STDOUT:
Results will be saved in /home/philip/projects/ltspice_examples_code_repo/Circuit-Completion-Using-GNNs/component_classification_with_link_prediction_head/evaluation/FEGIN/results/model_FEGIN_dataset_ltspice_examples
Command line input: python main.py --data ltspice_examples --representation component_pin --model FEGIN --layers 4 --hiddens 64 --batch_size 256 --lr 0.0001 --emb_size 128 --epochs 100 --save_appendix component_pin_L4_H64_BS256_LR0.0001_E128 --no_val
 is saved.
-----
ltspice_examples - FEGIN
Using 4 layers, 64 hidden units, h = 2
Loading component_pin representation dataset
ENTERED
Training FEGIN on component_pin representation
Train: 3560, Test: 848
##################ITERATION #0 ****************************************
 epoch: 0, train_loss: 1.3963, test_loss: 1.3955, test_f1: 0.0303
 epoch: 1, train_loss: 1.3886, test_loss: 1.3925, test_f1: 0.0303
 epoch: 2, train_loss: 1.3841, test_loss: 1.3888, test_f1: 0.0303
 epoch: 3, train_loss: 1.3788, test_loss: 1.3824, test_f1: 0.1337
 epoch: 4, train_loss: 1.3730, test_loss: 1.3735, test_f1: 0.2989
 epoch: 5, train_loss: 1.3660, test_loss: 1.3632, test_f1: 0.3381
 epoch: 6, train_loss: 1.3577, test_loss: 1.3522, test_f1: 0.3361
 epoch: 7, train_loss: 1.3463, test_loss: 1.3398, test_f1: 0.3361
 epoch: 8, train_loss: 1.3331, test_loss: 1.3241, test_f1: 0.3342
 epoch: 9, train_loss: 1.3164, test_loss: 1.3052, test_f1: 0.3332
 epoch: 10, train_loss: 1.2980, test_loss: 1.2826, test_f1: 0.3280
 epoch: 11, train_loss: 1.2756, test_loss: 1.2583, test_f1: 0.3332
 epoch: 12, train_loss: 1.2536, test_loss: 1.2335, test_f1: 0.3361
 epoch: 13, train_loss: 1.2293, test_loss: 1.2111, test_f1: 0.3361
 epoch: 14, train_loss: 1.2103, test_loss: 1.1875, test_f1: 0.3371
 epoch: 15, train_loss: 1.1921, test_loss: 1.1657, test_f1: 0.3374
 epoch: 16, train_loss: 1.1732, test_loss: 1.1471, test_f1: 0.3429
 epoch: 17, train_loss: 1.1555, test_loss: 1.1251, test_f1: 0.3429
 epoch: 18, train_loss: 1.1373, test_loss: 1.1086, test_f1: 0.3429
 epoch: 19, train_loss: 1.1175, test_loss: 1.0902, test_f1: 0.3438
 epoch: 20, train_loss: 1.1024, test_loss: 1.0733, test_f1: 0.3435
 epoch: 21, train_loss: 1.0873, test_loss: 1.0660, test_f1: 0.3589
 epoch: 22, train_loss: 1.0710, test_loss: 1.0500, test_f1: 0.3655
 epoch: 23, train_loss: 1.0627, test_loss: 1.0478, test_f1: 0.3643
 epoch: 24, train_loss: 1.0550, test_loss: 1.0370, test_f1: 0.3838
 epoch: 25, train_loss: 1.0383, test_loss: 1.0352, test_f1: 0.3862
 epoch: 26, train_loss: 1.0301, test_loss: 1.0315, test_f1: 0.3754
 epoch: 27, train_loss: 1.0275, test_loss: 1.0277, test_f1: 0.4001
 epoch: 28, train_loss: 1.0182, test_loss: 1.0312, test_f1: 0.4125
 epoch: 29, train_loss: 1.0120, test_loss: 1.0219, test_f1: 0.4168
 epoch: 30, train_loss: 1.0049, test_loss: 1.0223, test_f1: 0.4403
 epoch: 31, train_loss: 0.9995, test_loss: 1.0227, test_f1: 0.4304
 epoch: 32, train_loss: 0.9914, test_loss: 1.0209, test_f1: 0.4460
 epoch: 33, train_loss: 0.9962, test_loss: 1.0189, test_f1: 0.4430
 epoch: 34, train_loss: 0.9875, test_loss: 1.0437, test_f1: 0.4281
 epoch: 35, train_loss: 0.9866, test_loss: 1.0265, test_f1: 0.4465
 epoch: 36, train_loss: 0.9803, test_loss: 1.0307, test_f1: 0.4433
 epoch: 37, train_loss: 0.9770, test_loss: 1.0431, test_f1: 0.4309
 epoch: 38, train_loss: 0.9686, test_loss: 1.0229, test_f1: 0.4489
 epoch: 39, train_loss: 0.9699, test_loss: 1.0449, test_f1: 0.4339
 epoch: 40, train_loss: 0.9618, test_loss: 1.0192, test_f1: 0.4488
 epoch: 41, train_loss: 0.9624, test_loss: 1.0339, test_f1: 0.4489
 epoch: 42, train_loss: 0.9540, test_loss: 1.0375, test_f1: 0.4537
 epoch: 43, train_loss: 0.9536, test_loss: 1.0380, test_f1: 0.4490
 epoch: 44, train_loss: 0.9512, test_loss: 1.0362, test_f1: 0.4503
 epoch: 45, train_loss: 0.9462, test_loss: 1.0326, test_f1: 0.4613
 epoch: 46, train_loss: 0.9378, test_loss: 1.0499, test_f1: 0.4505
 epoch: 47, train_loss: 0.9352, test_loss: 1.0371, test_f1: 0.4612
 epoch: 48, train_loss: 0.9366, test_loss: 1.0363, test_f1: 0.4517
 epoch: 49, train_loss: 0.9239, test_loss: 1.0415, test_f1: 0.4806
 epoch: 50, train_loss: 0.9234, test_loss: 1.0184, test_f1: 0.4811
 epoch: 51, train_loss: 0.9168, test_loss: 1.0300, test_f1: 0.4796
 epoch: 52, train_loss: 0.9143, test_loss: 1.0304, test_f1: 0.4789
 epoch: 53, train_loss: 0.9177, test_loss: 1.0281, test_f1: 0.4720
 epoch: 54, train_loss: 0.9075, test_loss: 1.0323, test_f1: 0.4792
 epoch: 55, train_loss: 0.9099, test_loss: 1.0226, test_f1: 0.4831
 epoch: 56, train_loss: 0.9100, test_loss: 1.0190, test_f1: 0.4811
 epoch: 57, train_loss: 0.9127, test_loss: 1.0239, test_f1: 0.4809
 epoch: 58, train_loss: 0.9049, test_loss: 1.0324, test_f1: 0.4836
 epoch: 59, train_loss: 0.9053, test_loss: 1.0213, test_f1: 0.4833
 epoch: 60, train_loss: 0.8955, test_loss: 1.0261, test_f1: 0.4803
 epoch: 61, train_loss: 0.8947, test_loss: 1.0201, test_f1: 0.4775
 epoch: 62, train_loss: 0.8933, test_loss: 1.0191, test_f1: 0.4768
 epoch: 63, train_loss: 0.8897, test_loss: 1.0161, test_f1: 0.4774
 epoch: 64, train_loss: 0.8857, test_loss: 1.0166, test_f1: 0.4784
 epoch: 65, train_loss: 0.8865, test_loss: 1.0223, test_f1: 0.4895
 epoch: 66, train_loss: 0.8849, test_loss: 1.0243, test_f1: 0.4950
 epoch: 67, train_loss: 0.8742, test_loss: 1.0193, test_f1: 0.4951
 epoch: 68, train_loss: 0.8839, test_loss: 1.0092, test_f1: 0.4965
 epoch: 69, train_loss: 0.8705, test_loss: 1.0196, test_f1: 0.4957
 epoch: 70, train_loss: 0.8737, test_loss: 1.0210, test_f1: 0.4944
 epoch: 71, train_loss: 0.8717, test_loss: 1.0278, test_f1: 0.4972
 epoch: 72, train_loss: 0.8678, test_loss: 1.0174, test_f1: 0.4925
 epoch: 73, train_loss: 0.8710, test_loss: 1.0109, test_f1: 0.4959
 epoch: 74, train_loss: 0.8751, test_loss: 1.0119, test_f1: 0.4966
 epoch: 75, train_loss: 0.8630, test_loss: 1.0123, test_f1: 0.5015
 epoch: 76, train_loss: 0.8657, test_loss: 1.0058, test_f1: 0.5024
 epoch: 77, train_loss: 0.8514, test_loss: 1.0053, test_f1: 0.5079
 epoch: 78, train_loss: 0.8535, test_loss: 1.0129, test_f1: 0.5086
 epoch: 79, train_loss: 0.8462, test_loss: 0.9984, test_f1: 0.5098
 epoch: 80, train_loss: 0.8508, test_loss: 1.0099, test_f1: 0.5171
 epoch: 81, train_loss: 0.8469, test_loss: 1.0066, test_f1: 0.5084
 epoch: 82, train_loss: 0.8383, test_loss: 1.0214, test_f1: 0.5103
 epoch: 83, train_loss: 0.8431, test_loss: 1.0069, test_f1: 0.5140
 epoch: 84, train_loss: 0.8360, test_loss: 1.0051, test_f1: 0.5128
 epoch: 85, train_loss: 0.8348, test_loss: 1.0101, test_f1: 0.5085
 epoch: 86, train_loss: 0.8363, test_loss: 0.9947, test_f1: 0.5142
 epoch: 87, train_loss: 0.8339, test_loss: 1.0254, test_f1: 0.5136
 epoch: 88, train_loss: 0.8206, test_loss: 1.0033, test_f1: 0.5223
 epoch: 89, train_loss: 0.8192, test_loss: 1.0115, test_f1: 0.5097
 epoch: 90, train_loss: 0.8215, test_loss: 1.0064, test_f1: 0.5154
 epoch: 91, train_loss: 0.8165, test_loss: 0.9927, test_f1: 0.5204
 epoch: 92, train_loss: 0.8198, test_loss: 1.0095, test_f1: 0.5131
 epoch: 93, train_loss: 0.8259, test_loss: 0.9985, test_f1: 0.5172
 epoch: 94, train_loss: 0.8146, test_loss: 1.0098, test_f1: 0.5072
 epoch: 95, train_loss: 0.8072, test_loss: 1.0136, test_f1: 0.5131
 epoch: 96, train_loss: 0.8176, test_loss: 1.0015, test_f1: 0.5148
 epoch: 97, train_loss: 0.8081, test_loss: 1.0117, test_f1: 0.5179
 epoch: 98, train_loss: 0.8006, test_loss: 0.9873, test_f1: 0.5262
 epoch: 99, train_loss: 0.7957, test_loss: 0.9875, test_f1: 0.5164
##################ITERATION #1 ****************************************
 epoch: 0, train_loss: 1.3544, test_loss: 1.3633, test_f1: 0.2260
 epoch: 1, train_loss: 1.3361, test_loss: 1.3509, test_f1: 0.2260
 epoch: 2, train_loss: 1.3226, test_loss: 1.3327, test_f1: 0.2260
 epoch: 3, train_loss: 1.3091, test_loss: 1.3108, test_f1: 0.2260
 epoch: 4, train_loss: 1.2931, test_loss: 1.2887, test_f1: 0.2260
 epoch: 5, train_loss: 1.2758, test_loss: 1.2668, test_f1: 0.2260
 epoch: 6, train_loss: 1.2588, test_loss: 1.2443, test_f1: 0.2260
 epoch: 7, train_loss: 1.2390, test_loss: 1.2229, test_f1: 0.3323
 epoch: 8, train_loss: 1.2204, test_loss: 1.2010, test_f1: 0.3373
 epoch: 9, train_loss: 1.2038, test_loss: 1.1804, test_f1: 0.3374
 epoch: 10, train_loss: 1.1832, test_loss: 1.1608, test_f1: 0.3391
 epoch: 11, train_loss: 1.1635, test_loss: 1.1382, test_f1: 0.3419
 epoch: 12, train_loss: 1.1457, test_loss: 1.1200, test_f1: 0.3419
 epoch: 13, train_loss: 1.1214, test_loss: 1.0994, test_f1: 0.3429
 epoch: 14, train_loss: 1.1049, test_loss: 1.0822, test_f1: 0.3425
 epoch: 15, train_loss: 1.0852, test_loss: 1.0646, test_f1: 0.3591
 epoch: 16, train_loss: 1.0668, test_loss: 1.0543, test_f1: 0.3670
 epoch: 17, train_loss: 1.0499, test_loss: 1.0402, test_f1: 0.3785
 epoch: 18, train_loss: 1.0395, test_loss: 1.0327, test_f1: 0.3951
 epoch: 19, train_loss: 1.0273, test_loss: 1.0225, test_f1: 0.4047
 epoch: 20, train_loss: 1.0112, test_loss: 1.0111, test_f1: 0.4197
 epoch: 21, train_loss: 1.0080, test_loss: 1.0085, test_f1: 0.4478
 epoch: 22, train_loss: 0.9978, test_loss: 1.0077, test_f1: 0.4400
 epoch: 23, train_loss: 0.9897, test_loss: 1.0000, test_f1: 0.4574
 epoch: 24, train_loss: 0.9807, test_loss: 0.9941, test_f1: 0.4647
 epoch: 25, train_loss: 0.9756, test_loss: 0.9863, test_f1: 0.4730
 epoch: 26, train_loss: 0.9613, test_loss: 0.9917, test_f1: 0.4749
 epoch: 27, train_loss: 0.9595, test_loss: 0.9810, test_f1: 0.4775
 epoch: 28, train_loss: 0.9529, test_loss: 0.9848, test_f1: 0.4776
 epoch: 29, train_loss: 0.9449, test_loss: 0.9710, test_f1: 0.4881
 epoch: 30, train_loss: 0.9391, test_loss: 0.9655, test_f1: 0.4853
 epoch: 31, train_loss: 0.9324, test_loss: 0.9622, test_f1: 0.4869
 epoch: 32, train_loss: 0.9206, test_loss: 0.9777, test_f1: 0.4848
 epoch: 33, train_loss: 0.9192, test_loss: 0.9534, test_f1: 0.4998
 epoch: 34, train_loss: 0.9136, test_loss: 0.9448, test_f1: 0.4983
 epoch: 35, train_loss: 0.9015, test_loss: 0.9557, test_f1: 0.4975
 epoch: 36, train_loss: 0.9028, test_loss: 0.9370, test_f1: 0.5044
 epoch: 37, train_loss: 0.8909, test_loss: 0.9281, test_f1: 0.5059
 epoch: 38, train_loss: 0.8844, test_loss: 0.9126, test_f1: 0.5135
 epoch: 39, train_loss: 0.8838, test_loss: 0.9241, test_f1: 0.5229
 epoch: 40, train_loss: 0.8676, test_loss: 0.9279, test_f1: 0.5171
 epoch: 41, train_loss: 0.8636, test_loss: 0.9218, test_f1: 0.5344
 epoch: 42, train_loss: 0.8633, test_loss: 0.9175, test_f1: 0.5319
 epoch: 43, train_loss: 0.8567, test_loss: 0.9142, test_f1: 0.5315
 epoch: 44, train_loss: 0.8529, test_loss: 0.8872, test_f1: 0.5436
 epoch: 45, train_loss: 0.8511, test_loss: 0.9275, test_f1: 0.5301
 epoch: 46, train_loss: 0.8491, test_loss: 0.8890, test_f1: 0.5429
 epoch: 47, train_loss: 0.8404, test_loss: 0.8882, test_f1: 0.5400
 epoch: 48, train_loss: 0.8244, test_loss: 0.9030, test_f1: 0.5214
 epoch: 49, train_loss: 0.8296, test_loss: 0.8968, test_f1: 0.5159
 epoch: 50, train_loss: 0.8206, test_loss: 0.8825, test_f1: 0.5272
 epoch: 51, train_loss: 0.8166, test_loss: 0.8964, test_f1: 0.5258
 epoch: 52, train_loss: 0.8102, test_loss: 0.8974, test_f1: 0.5227
 epoch: 53, train_loss: 0.8060, test_loss: 0.8829, test_f1: 0.5231
 epoch: 54, train_loss: 0.8107, test_loss: 0.8911, test_f1: 0.5205
 epoch: 55, train_loss: 0.8075, test_loss: 0.8964, test_f1: 0.5196
 epoch: 56, train_loss: 0.8054, test_loss: 0.8929, test_f1: 0.5189
 epoch: 57, train_loss: 0.7942, test_loss: 0.8914, test_f1: 0.5295
 epoch: 58, train_loss: 0.7930, test_loss: 0.8928, test_f1: 0.5321
 epoch: 59, train_loss: 0.7957, test_loss: 0.8990, test_f1: 0.5250
 epoch: 60, train_loss: 0.7887, test_loss: 0.9073, test_f1: 0.5232
 epoch: 61, train_loss: 0.7912, test_loss: 0.9023, test_f1: 0.5271
 epoch: 62, train_loss: 0.7969, test_loss: 0.8932, test_f1: 0.5254
 epoch: 63, train_loss: 0.7768, test_loss: 0.9024, test_f1: 0.5263
 epoch: 64, train_loss: 0.7891, test_loss: 0.8995, test_f1: 0.5311
 epoch: 65, train_loss: 0.7893, test_loss: 0.9161, test_f1: 0.5281
 epoch: 66, train_loss: 0.7794, test_loss: 0.8963, test_f1: 0.5251
 epoch: 67, train_loss: 0.7744, test_loss: 0.9166, test_f1: 0.5318
 epoch: 68, train_loss: 0.7629, test_loss: 0.9242, test_f1: 0.5299
 epoch: 69, train_loss: 0.7702, test_loss: 0.9137, test_f1: 0.5291
 epoch: 70, train_loss: 0.7787, test_loss: 0.9242, test_f1: 0.5261
 epoch: 71, train_loss: 0.7714, test_loss: 0.9238, test_f1: 0.5299
 epoch: 72, train_loss: 0.7576, test_loss: 0.9295, test_f1: 0.5252
 epoch: 73, train_loss: 0.7674, test_loss: 0.9297, test_f1: 0.5286
 epoch: 74, train_loss: 0.7645, test_loss: 0.9180, test_f1: 0.5321
 epoch: 75, train_loss: 0.7669, test_loss: 0.9440, test_f1: 0.5314
 epoch: 76, train_loss: 0.7516, test_loss: 0.9360, test_f1: 0.5331
 epoch: 77, train_loss: 0.7484, test_loss: 0.9363, test_f1: 0.5364
 epoch: 78, train_loss: 0.7502, test_loss: 0.9244, test_f1: 0.5363
 epoch: 79, train_loss: 0.7484, test_loss: 0.9323, test_f1: 0.5330
 epoch: 80, train_loss: 0.7510, test_loss: 0.9335, test_f1: 0.5318
 epoch: 81, train_loss: 0.7531, test_loss: 0.9216, test_f1: 0.5407
 epoch: 82, train_loss: 0.7462, test_loss: 0.9375, test_f1: 0.5324
 epoch: 83, train_loss: 0.7410, test_loss: 0.9327, test_f1: 0.5403
 epoch: 84, train_loss: 0.7426, test_loss: 0.9350, test_f1: 0.5378
 epoch: 85, train_loss: 0.7381, test_loss: 0.9306, test_f1: 0.5417
 epoch: 86, train_loss: 0.7378, test_loss: 0.9466, test_f1: 0.5336
 epoch: 87, train_loss: 0.7297, test_loss: 0.9530, test_f1: 0.5362
 epoch: 88, train_loss: 0.7401, test_loss: 0.9404, test_f1: 0.5418
 epoch: 89, train_loss: 0.7288, test_loss: 0.9473, test_f1: 0.5396
 epoch: 90, train_loss: 0.7353, test_loss: 0.9279, test_f1: 0.5412
 epoch: 91, train_loss: 0.7358, test_loss: 0.9475, test_f1: 0.5388
 epoch: 92, train_loss: 0.7303, test_loss: 0.9580, test_f1: 0.5356
 epoch: 93, train_loss: 0.7299, test_loss: 0.9644, test_f1: 0.5354
 epoch: 94, train_loss: 0.7234, test_loss: 0.9557, test_f1: 0.5405
 epoch: 95, train_loss: 0.7247, test_loss: 0.9649, test_f1: 0.5320
 epoch: 96, train_loss: 0.7183, test_loss: 0.9567, test_f1: 0.5437
 epoch: 97, train_loss: 0.7233, test_loss: 0.9459, test_f1: 0.5449
 epoch: 98, train_loss: 0.7176, test_loss: 0.9672, test_f1: 0.5352
 epoch: 99, train_loss: 0.7159, test_loss: 0.9609, test_f1: 0.5384
##################ITERATION #2 ****************************************
 epoch: 0, train_loss: 1.3336, test_loss: 1.3479, test_f1: 0.2260
 epoch: 1, train_loss: 1.3107, test_loss: 1.3341, test_f1: 0.2260
 epoch: 2, train_loss: 1.2967, test_loss: 1.3152, test_f1: 0.2260
 epoch: 3, train_loss: 1.2836, test_loss: 1.2912, test_f1: 0.2260
 epoch: 4, train_loss: 1.2682, test_loss: 1.2624, test_f1: 0.2260
 epoch: 5, train_loss: 1.2488, test_loss: 1.2320, test_f1: 0.2709
 epoch: 6, train_loss: 1.2285, test_loss: 1.2029, test_f1: 0.3422
 epoch: 7, train_loss: 1.2099, test_loss: 1.1766, test_f1: 0.3767
 epoch: 8, train_loss: 1.1896, test_loss: 1.1504, test_f1: 0.4052
 epoch: 9, train_loss: 1.1662, test_loss: 1.1249, test_f1: 0.4024
 epoch: 10, train_loss: 1.1451, test_loss: 1.1019, test_f1: 0.4112
 epoch: 11, train_loss: 1.1318, test_loss: 1.0836, test_f1: 0.4299
 epoch: 12, train_loss: 1.1055, test_loss: 1.0643, test_f1: 0.4328
 epoch: 13, train_loss: 1.0853, test_loss: 1.0468, test_f1: 0.4539
 epoch: 14, train_loss: 1.0692, test_loss: 1.0310, test_f1: 0.4521
 epoch: 15, train_loss: 1.0496, test_loss: 1.0201, test_f1: 0.4576
 epoch: 16, train_loss: 1.0360, test_loss: 1.0019, test_f1: 0.4682
 epoch: 17, train_loss: 1.0233, test_loss: 0.9939, test_f1: 0.4648
 epoch: 18, train_loss: 1.0150, test_loss: 0.9835, test_f1: 0.4738
 epoch: 19, train_loss: 1.0015, test_loss: 0.9759, test_f1: 0.4724
 epoch: 20, train_loss: 0.9934, test_loss: 0.9643, test_f1: 0.4744
 epoch: 21, train_loss: 0.9740, test_loss: 0.9563, test_f1: 0.4725
 epoch: 22, train_loss: 0.9675, test_loss: 0.9578, test_f1: 0.4751
 epoch: 23, train_loss: 0.9612, test_loss: 0.9508, test_f1: 0.4722
 epoch: 24, train_loss: 0.9582, test_loss: 0.9483, test_f1: 0.4852
 epoch: 25, train_loss: 0.9548, test_loss: 0.9457, test_f1: 0.4726
 epoch: 26, train_loss: 0.9419, test_loss: 0.9372, test_f1: 0.4818
 epoch: 27, train_loss: 0.9339, test_loss: 0.9350, test_f1: 0.4870
 epoch: 28, train_loss: 0.9343, test_loss: 0.9356, test_f1: 0.5026
 epoch: 29, train_loss: 0.9267, test_loss: 0.9237, test_f1: 0.5038
 epoch: 30, train_loss: 0.9132, test_loss: 0.9254, test_f1: 0.4933
 epoch: 31, train_loss: 0.9162, test_loss: 0.9263, test_f1: 0.5021
 epoch: 32, train_loss: 0.9042, test_loss: 0.9237, test_f1: 0.4982
 epoch: 33, train_loss: 0.9161, test_loss: 0.9165, test_f1: 0.4893
 epoch: 34, train_loss: 0.8977, test_loss: 0.9207, test_f1: 0.4884
 epoch: 35, train_loss: 0.9014, test_loss: 0.9179, test_f1: 0.4897
 epoch: 36, train_loss: 0.8932, test_loss: 0.9120, test_f1: 0.4881
 epoch: 37, train_loss: 0.8883, test_loss: 0.9136, test_f1: 0.5018
 epoch: 38, train_loss: 0.8836, test_loss: 0.9140, test_f1: 0.4995
 epoch: 39, train_loss: 0.8716, test_loss: 0.9117, test_f1: 0.4944
 epoch: 40, train_loss: 0.8701, test_loss: 0.9278, test_f1: 0.5024
 epoch: 41, train_loss: 0.8697, test_loss: 0.9190, test_f1: 0.4926
 epoch: 42, train_loss: 0.8663, test_loss: 0.9128, test_f1: 0.4890
 epoch: 43, train_loss: 0.8616, test_loss: 0.9145, test_f1: 0.4977
 epoch: 44, train_loss: 0.8561, test_loss: 0.9204, test_f1: 0.5009
 epoch: 45, train_loss: 0.8490, test_loss: 0.9215, test_f1: 0.4960
 epoch: 46, train_loss: 0.8412, test_loss: 0.9172, test_f1: 0.5037
 epoch: 47, train_loss: 0.8487, test_loss: 0.9390, test_f1: 0.4988
 epoch: 48, train_loss: 0.8414, test_loss: 0.9314, test_f1: 0.4924
 epoch: 49, train_loss: 0.8313, test_loss: 0.9231, test_f1: 0.5007
 epoch: 50, train_loss: 0.8251, test_loss: 0.9273, test_f1: 0.5046
 epoch: 51, train_loss: 0.8206, test_loss: 0.9311, test_f1: 0.5049
 epoch: 52, train_loss: 0.8131, test_loss: 0.9353, test_f1: 0.5114
 epoch: 53, train_loss: 0.8151, test_loss: 0.9258, test_f1: 0.5011
 epoch: 54, train_loss: 0.8133, test_loss: 0.9293, test_f1: 0.5114
 epoch: 55, train_loss: 0.8117, test_loss: 0.9449, test_f1: 0.5007
 epoch: 56, train_loss: 0.8068, test_loss: 0.9325, test_f1: 0.5004
 epoch: 57, train_loss: 0.8052, test_loss: 0.9302, test_f1: 0.5207
 epoch: 58, train_loss: 0.8013, test_loss: 0.9384, test_f1: 0.5080
 epoch: 59, train_loss: 0.7985, test_loss: 0.9352, test_f1: 0.5192
 epoch: 60, train_loss: 0.8065, test_loss: 0.9403, test_f1: 0.5034
 epoch: 61, train_loss: 0.8025, test_loss: 0.9412, test_f1: 0.5278
 epoch: 62, train_loss: 0.7947, test_loss: 0.9419, test_f1: 0.5266
 epoch: 63, train_loss: 0.7932, test_loss: 0.9403, test_f1: 0.5242
 epoch: 64, train_loss: 0.7928, test_loss: 0.9433, test_f1: 0.5137
 epoch: 65, train_loss: 0.7845, test_loss: 0.9373, test_f1: 0.5184
 epoch: 66, train_loss: 0.7911, test_loss: 0.9352, test_f1: 0.5280
 epoch: 67, train_loss: 0.7858, test_loss: 0.9358, test_f1: 0.5256
 epoch: 68, train_loss: 0.7749, test_loss: 0.9394, test_f1: 0.5088
 epoch: 69, train_loss: 0.7773, test_loss: 0.9437, test_f1: 0.5147
 epoch: 70, train_loss: 0.7864, test_loss: 0.9463, test_f1: 0.5154
 epoch: 71, train_loss: 0.7773, test_loss: 0.9497, test_f1: 0.5208
 epoch: 72, train_loss: 0.7778, test_loss: 0.9405, test_f1: 0.5237
 epoch: 73, train_loss: 0.7775, test_loss: 0.9235, test_f1: 0.5301
 epoch: 74, train_loss: 0.7703, test_loss: 0.9451, test_f1: 0.5206
 epoch: 75, train_loss: 0.7701, test_loss: 0.9481, test_f1: 0.5255
 epoch: 76, train_loss: 0.7672, test_loss: 0.9393, test_f1: 0.5217
 epoch: 77, train_loss: 0.7657, test_loss: 0.9465, test_f1: 0.5227
 epoch: 78, train_loss: 0.7565, test_loss: 0.9335, test_f1: 0.5246
 epoch: 79, train_loss: 0.7639, test_loss: 0.9460, test_f1: 0.5195
 epoch: 80, train_loss: 0.7750, test_loss: 0.9392, test_f1: 0.5214
 epoch: 81, train_loss: 0.7634, test_loss: 0.9511, test_f1: 0.5182
 epoch: 82, train_loss: 0.7602, test_loss: 0.9421, test_f1: 0.5214
 epoch: 83, train_loss: 0.7565, test_loss: 0.9566, test_f1: 0.5193
 epoch: 84, train_loss: 0.7508, test_loss: 0.9584, test_f1: 0.5219
 epoch: 85, train_loss: 0.7496, test_loss: 0.9547, test_f1: 0.5182
 epoch: 86, train_loss: 0.7496, test_loss: 0.9635, test_f1: 0.5198
 epoch: 87, train_loss: 0.7503, test_loss: 0.9665, test_f1: 0.5133
 epoch: 88, train_loss: 0.7489, test_loss: 0.9475, test_f1: 0.5170
 epoch: 89, train_loss: 0.7433, test_loss: 0.9567, test_f1: 0.5265
 epoch: 90, train_loss: 0.7472, test_loss: 0.9725, test_f1: 0.5094
 epoch: 91, train_loss: 0.7382, test_loss: 0.9698, test_f1: 0.5188
 epoch: 92, train_loss: 0.7346, test_loss: 0.9469, test_f1: 0.5379
 epoch: 93, train_loss: 0.7338, test_loss: 0.9661, test_f1: 0.5220
 epoch: 94, train_loss: 0.7455, test_loss: 0.9515, test_f1: 0.5202
 epoch: 95, train_loss: 0.7343, test_loss: 0.9598, test_f1: 0.5229
 epoch: 96, train_loss: 0.7388, test_loss: 0.9381, test_f1: 0.5286
 epoch: 97, train_loss: 0.7382, test_loss: 0.9877, test_f1: 0.5159
 epoch: 98, train_loss: 0.7341, test_loss: 0.9967, test_f1: 0.5095
 epoch: 99, train_loss: 0.7346, test_loss: 0.9606, test_f1: 0.5250
##################ITERATION #3 ****************************************
 epoch: 0, train_loss: 1.3081, test_loss: 1.3161, test_f1: 0.2260
 epoch: 1, train_loss: 1.2798, test_loss: 1.3096, test_f1: 0.2260
 epoch: 2, train_loss: 1.2619, test_loss: 1.2950, test_f1: 0.2260
 epoch: 3, train_loss: 1.2425, test_loss: 1.2536, test_f1: 0.2308
 epoch: 4, train_loss: 1.2256, test_loss: 1.2076, test_f1: 0.2879
 epoch: 5, train_loss: 1.2049, test_loss: 1.1702, test_f1: 0.4325
 epoch: 6, train_loss: 1.1808, test_loss: 1.1437, test_f1: 0.4316
 epoch: 7, train_loss: 1.1589, test_loss: 1.1192, test_f1: 0.4366
 epoch: 8, train_loss: 1.1336, test_loss: 1.0993, test_f1: 0.4334
 epoch: 9, train_loss: 1.1184, test_loss: 1.0855, test_f1: 0.4373
 epoch: 10, train_loss: 1.0938, test_loss: 1.0747, test_f1: 0.4150
 epoch: 11, train_loss: 1.0760, test_loss: 1.0563, test_f1: 0.4326
 epoch: 12, train_loss: 1.0622, test_loss: 1.0457, test_f1: 0.4334
 epoch: 13, train_loss: 1.0436, test_loss: 1.0345, test_f1: 0.4695
 epoch: 14, train_loss: 1.0339, test_loss: 1.0349, test_f1: 0.4401
 epoch: 15, train_loss: 1.0160, test_loss: 1.0234, test_f1: 0.4595
 epoch: 16, train_loss: 1.0097, test_loss: 1.0174, test_f1: 0.4646
 epoch: 17, train_loss: 1.0020, test_loss: 1.0205, test_f1: 0.4495
 epoch: 18, train_loss: 0.9902, test_loss: 1.0036, test_f1: 0.4802
 epoch: 19, train_loss: 0.9803, test_loss: 1.0040, test_f1: 0.4818
 epoch: 20, train_loss: 0.9769, test_loss: 1.0029, test_f1: 0.4818
 epoch: 21, train_loss: 0.9707, test_loss: 1.0103, test_f1: 0.4851
 epoch: 22, train_loss: 0.9604, test_loss: 0.9928, test_f1: 0.4981
 epoch: 23, train_loss: 0.9495, test_loss: 0.9873, test_f1: 0.5078
 epoch: 24, train_loss: 0.9464, test_loss: 1.0016, test_f1: 0.4973
 epoch: 25, train_loss: 0.9345, test_loss: 0.9958, test_f1: 0.4926
 epoch: 26, train_loss: 0.9311, test_loss: 0.9869, test_f1: 0.4910
 epoch: 27, train_loss: 0.9221, test_loss: 0.9805, test_f1: 0.5042
 epoch: 28, train_loss: 0.9128, test_loss: 0.9855, test_f1: 0.5068
 epoch: 29, train_loss: 0.9136, test_loss: 0.9734, test_f1: 0.4986
 epoch: 30, train_loss: 0.9058, test_loss: 0.9832, test_f1: 0.4879
 epoch: 31, train_loss: 0.8977, test_loss: 0.9806, test_f1: 0.4918
 epoch: 32, train_loss: 0.8902, test_loss: 0.9631, test_f1: 0.5220
 epoch: 33, train_loss: 0.8883, test_loss: 0.9615, test_f1: 0.5249
 epoch: 34, train_loss: 0.8898, test_loss: 0.9722, test_f1: 0.4970
 epoch: 35, train_loss: 0.8778, test_loss: 0.9529, test_f1: 0.5313
 epoch: 36, train_loss: 0.8672, test_loss: 0.9578, test_f1: 0.5196
 epoch: 37, train_loss: 0.8525, test_loss: 0.9573, test_f1: 0.5211
 epoch: 38, train_loss: 0.8508, test_loss: 0.9549, test_f1: 0.5244
 epoch: 39, train_loss: 0.8514, test_loss: 0.9664, test_f1: 0.5074
 epoch: 40, train_loss: 0.8459, test_loss: 0.9506, test_f1: 0.5239
 epoch: 41, train_loss: 0.8360, test_loss: 0.9559, test_f1: 0.5222
 epoch: 42, train_loss: 0.8332, test_loss: 0.9749, test_f1: 0.5067
 epoch: 43, train_loss: 0.8170, test_loss: 0.9533, test_f1: 0.5220
 epoch: 44, train_loss: 0.8332, test_loss: 0.9451, test_f1: 0.5126
 epoch: 45, train_loss: 0.8163, test_loss: 0.9565, test_f1: 0.5202
 epoch: 46, train_loss: 0.8189, test_loss: 0.9653, test_f1: 0.5173
 epoch: 47, train_loss: 0.8033, test_loss: 0.9460, test_f1: 0.5374
 epoch: 48, train_loss: 0.7975, test_loss: 0.9631, test_f1: 0.5341
 epoch: 49, train_loss: 0.8039, test_loss: 0.9911, test_f1: 0.5130
 epoch: 50, train_loss: 0.7942, test_loss: 0.9577, test_f1: 0.5269
 epoch: 51, train_loss: 0.7804, test_loss: 0.9660, test_f1: 0.5315
 epoch: 52, train_loss: 0.7781, test_loss: 0.9769, test_f1: 0.5243
 epoch: 53, train_loss: 0.7873, test_loss: 0.9790, test_f1: 0.5224
 epoch: 54, train_loss: 0.7789, test_loss: 0.9826, test_f1: 0.5219
 epoch: 55, train_loss: 0.7679, test_loss: 0.9698, test_f1: 0.5257
 epoch: 56, train_loss: 0.7720, test_loss: 0.9710, test_f1: 0.5282
 epoch: 57, train_loss: 0.7676, test_loss: 0.9722, test_f1: 0.5263
 epoch: 58, train_loss: 0.7669, test_loss: 0.9802, test_f1: 0.5267
 epoch: 59, train_loss: 0.7620, test_loss: 0.9792, test_f1: 0.5222
 epoch: 60, train_loss: 0.7629, test_loss: 0.9964, test_f1: 0.5178
 epoch: 61, train_loss: 0.7635, test_loss: 0.9712, test_f1: 0.5095
 epoch: 62, train_loss: 0.7553, test_loss: 0.9767, test_f1: 0.5199
 epoch: 63, train_loss: 0.7551, test_loss: 0.9899, test_f1: 0.5211
 epoch: 64, train_loss: 0.7565, test_loss: 0.9897, test_f1: 0.5225
 epoch: 65, train_loss: 0.7529, test_loss: 0.9781, test_f1: 0.5290
 epoch: 66, train_loss: 0.7439, test_loss: 0.9897, test_f1: 0.5192
 epoch: 67, train_loss: 0.7524, test_loss: 0.9817, test_f1: 0.5254
 epoch: 68, train_loss: 0.7540, test_loss: 0.9913, test_f1: 0.5251
 epoch: 69, train_loss: 0.7391, test_loss: 0.9902, test_f1: 0.5238
 epoch: 70, train_loss: 0.7464, test_loss: 0.9867, test_f1: 0.5250
 epoch: 71, train_loss: 0.7425, test_loss: 0.9736, test_f1: 0.5274
 epoch: 72, train_loss: 0.7398, test_loss: 0.9923, test_f1: 0.5207
 epoch: 73, train_loss: 0.7367, test_loss: 0.9887, test_f1: 0.5242
 epoch: 74, train_loss: 0.7383, test_loss: 0.9969, test_f1: 0.5188
 epoch: 75, train_loss: 0.7332, test_loss: 1.0139, test_f1: 0.5153
 epoch: 76, train_loss: 0.7295, test_loss: 0.9853, test_f1: 0.5247
 epoch: 77, train_loss: 0.7383, test_loss: 1.0174, test_f1: 0.5211
 epoch: 78, train_loss: 0.7341, test_loss: 1.0065, test_f1: 0.5134
 epoch: 79, train_loss: 0.7329, test_loss: 1.0034, test_f1: 0.5226
 epoch: 80, train_loss: 0.7288, test_loss: 1.0129, test_f1: 0.5245
 epoch: 81, train_loss: 0.7253, test_loss: 0.9913, test_f1: 0.5259
 epoch: 82, train_loss: 0.7170, test_loss: 1.0378, test_f1: 0.5176
 epoch: 83, train_loss: 0.7193, test_loss: 1.0241, test_f1: 0.5194
 epoch: 84, train_loss: 0.7133, test_loss: 1.0121, test_f1: 0.5204
 epoch: 85, train_loss: 0.7265, test_loss: 1.0338, test_f1: 0.5193
 epoch: 86, train_loss: 0.7229, test_loss: 1.0033, test_f1: 0.5247
 epoch: 87, train_loss: 0.7078, test_loss: 1.0208, test_f1: 0.5239
 epoch: 88, train_loss: 0.7184, test_loss: 1.0039, test_f1: 0.5318
 epoch: 89, train_loss: 0.7086, test_loss: 1.0245, test_f1: 0.5235
 epoch: 90, train_loss: 0.7060, test_loss: 1.0153, test_f1: 0.5326
 epoch: 91, train_loss: 0.7132, test_loss: 1.0177, test_f1: 0.5308
 epoch: 92, train_loss: 0.7136, test_loss: 1.0134, test_f1: 0.5284
 epoch: 93, train_loss: 0.7040, test_loss: 1.0301, test_f1: 0.5276
 epoch: 94, train_loss: 0.7112, test_loss: 1.0460, test_f1: 0.5309
 epoch: 95, train_loss: 0.7076, test_loss: 1.0162, test_f1: 0.5225
 epoch: 96, train_loss: 0.7016, test_loss: 1.0572, test_f1: 0.5297
 epoch: 97, train_loss: 0.6956, test_loss: 1.0370, test_f1: 0.5273
 epoch: 98, train_loss: 0.6948, test_loss: 1.0352, test_f1: 0.5252
 epoch: 99, train_loss: 0.7007, test_loss: 1.0327, test_f1: 0.5296
##################ITERATION #4 ****************************************
 epoch: 0, train_loss: 1.2916, test_loss: 1.3120, test_f1: 0.2260
 epoch: 1, train_loss: 1.2502, test_loss: 1.3033, test_f1: 0.2260
 epoch: 2, train_loss: 1.2245, test_loss: 1.2848, test_f1: 0.2260
 epoch: 3, train_loss: 1.2024, test_loss: 1.2568, test_f1: 0.2642
 epoch: 4, train_loss: 1.1783, test_loss: 1.1992, test_f1: 0.3143
 epoch: 5, train_loss: 1.1575, test_loss: 1.1341, test_f1: 0.4314
 epoch: 6, train_loss: 1.1384, test_loss: 1.1023, test_f1: 0.4437
 epoch: 7, train_loss: 1.1195, test_loss: 1.0806, test_f1: 0.4498
 epoch: 8, train_loss: 1.1010, test_loss: 1.0676, test_f1: 0.4446
 epoch: 9, train_loss: 1.0849, test_loss: 1.0501, test_f1: 0.4512
 epoch: 10, train_loss: 1.0760, test_loss: 1.0403, test_f1: 0.4527
 epoch: 11, train_loss: 1.0596, test_loss: 1.0335, test_f1: 0.4586
 epoch: 12, train_loss: 1.0393, test_loss: 1.0286, test_f1: 0.4548
 epoch: 13, train_loss: 1.0324, test_loss: 1.0220, test_f1: 0.4624
 epoch: 14, train_loss: 1.0257, test_loss: 1.0133, test_f1: 0.4851
 epoch: 15, train_loss: 1.0203, test_loss: 1.0045, test_f1: 0.5007
 epoch: 16, train_loss: 1.0068, test_loss: 0.9978, test_f1: 0.4929
 epoch: 17, train_loss: 0.9990, test_loss: 0.9964, test_f1: 0.4782
 epoch: 18, train_loss: 0.9892, test_loss: 0.9839, test_f1: 0.4880
 epoch: 19, train_loss: 0.9793, test_loss: 0.9804, test_f1: 0.4839
 epoch: 20, train_loss: 0.9713, test_loss: 0.9728, test_f1: 0.4892
 epoch: 21, train_loss: 0.9644, test_loss: 0.9736, test_f1: 0.4930
 epoch: 22, train_loss: 0.9577, test_loss: 0.9605, test_f1: 0.4972
 epoch: 23, train_loss: 0.9452, test_loss: 0.9644, test_f1: 0.5040
 epoch: 24, train_loss: 0.9390, test_loss: 0.9515, test_f1: 0.5074
 epoch: 25, train_loss: 0.9254, test_loss: 0.9529, test_f1: 0.4862
 epoch: 26, train_loss: 0.9229, test_loss: 0.9548, test_f1: 0.5117
 epoch: 27, train_loss: 0.9198, test_loss: 0.9485, test_f1: 0.5046
 epoch: 28, train_loss: 0.9077, test_loss: 0.9441, test_f1: 0.4957
 epoch: 29, train_loss: 0.8933, test_loss: 0.9349, test_f1: 0.5079
 epoch: 30, train_loss: 0.8958, test_loss: 0.9352, test_f1: 0.5067
 epoch: 31, train_loss: 0.8860, test_loss: 0.9349, test_f1: 0.5025
 epoch: 32, train_loss: 0.8839, test_loss: 0.9381, test_f1: 0.4945
 epoch: 33, train_loss: 0.8788, test_loss: 0.9401, test_f1: 0.4965
 epoch: 34, train_loss: 0.8684, test_loss: 0.9252, test_f1: 0.4867
 epoch: 35, train_loss: 0.8647, test_loss: 0.9685, test_f1: 0.4896
 epoch: 36, train_loss: 0.8522, test_loss: 0.9321, test_f1: 0.5197
 epoch: 37, train_loss: 0.8494, test_loss: 0.9356, test_f1: 0.5004
 epoch: 38, train_loss: 0.8405, test_loss: 0.9149, test_f1: 0.5125
 epoch: 39, train_loss: 0.8309, test_loss: 0.9162, test_f1: 0.5280
 epoch: 40, train_loss: 0.8280, test_loss: 0.9072, test_f1: 0.5198
 epoch: 41, train_loss: 0.8256, test_loss: 0.9395, test_f1: 0.5191
 epoch: 42, train_loss: 0.8104, test_loss: 0.8990, test_f1: 0.5461
 epoch: 43, train_loss: 0.8110, test_loss: 0.9060, test_f1: 0.5418
 epoch: 44, train_loss: 0.8046, test_loss: 0.9147, test_f1: 0.5328
 epoch: 45, train_loss: 0.8061, test_loss: 0.9000, test_f1: 0.5443
 epoch: 46, train_loss: 0.8015, test_loss: 0.9211, test_f1: 0.5408
 epoch: 47, train_loss: 0.7919, test_loss: 0.9051, test_f1: 0.5528
 epoch: 48, train_loss: 0.7901, test_loss: 0.9042, test_f1: 0.5489
 epoch: 49, train_loss: 0.7760, test_loss: 0.9446, test_f1: 0.5318
 epoch: 50, train_loss: 0.7736, test_loss: 0.9056, test_f1: 0.5525
 epoch: 51, train_loss: 0.7579, test_loss: 0.8919, test_f1: 0.5561
 epoch: 52, train_loss: 0.7671, test_loss: 0.8910, test_f1: 0.5503
 epoch: 53, train_loss: 0.7606, test_loss: 0.9036, test_f1: 0.5504
 epoch: 54, train_loss: 0.7513, test_loss: 0.9040, test_f1: 0.5557
 epoch: 55, train_loss: 0.7550, test_loss: 0.8914, test_f1: 0.5558
 epoch: 56, train_loss: 0.7601, test_loss: 0.9045, test_f1: 0.5558
 epoch: 57, train_loss: 0.7566, test_loss: 0.8992, test_f1: 0.5533
 epoch: 58, train_loss: 0.7543, test_loss: 0.9085, test_f1: 0.5580
 epoch: 59, train_loss: 0.7505, test_loss: 0.8991, test_f1: 0.5540
 epoch: 60, train_loss: 0.7373, test_loss: 0.9032, test_f1: 0.5553
 epoch: 61, train_loss: 0.7356, test_loss: 0.9017, test_f1: 0.5512
 epoch: 62, train_loss: 0.7352, test_loss: 0.8835, test_f1: 0.5568
 epoch: 63, train_loss: 0.7413, test_loss: 0.9007, test_f1: 0.5587
 epoch: 64, train_loss: 0.7239, test_loss: 0.8879, test_f1: 0.5601
 epoch: 65, train_loss: 0.7333, test_loss: 0.8915, test_f1: 0.5560
 epoch: 66, train_loss: 0.7323, test_loss: 0.8985, test_f1: 0.5574
 epoch: 67, train_loss: 0.7262, test_loss: 0.9002, test_f1: 0.5574
 epoch: 68, train_loss: 0.7269, test_loss: 0.9106, test_f1: 0.5580
 epoch: 69, train_loss: 0.7247, test_loss: 0.8892, test_f1: 0.5641
 epoch: 70, train_loss: 0.7189, test_loss: 0.8975, test_f1: 0.5577
 epoch: 71, train_loss: 0.7242, test_loss: 0.8920, test_f1: 0.5693
 epoch: 72, train_loss: 0.7215, test_loss: 0.8992, test_f1: 0.5644
 epoch: 73, train_loss: 0.7112, test_loss: 0.8924, test_f1: 0.5632
 epoch: 74, train_loss: 0.7130, test_loss: 0.9028, test_f1: 0.5549
 epoch: 75, train_loss: 0.7104, test_loss: 0.8872, test_f1: 0.5663
 epoch: 76, train_loss: 0.7079, test_loss: 0.8905, test_f1: 0.5678
 epoch: 77, train_loss: 0.7104, test_loss: 0.8863, test_f1: 0.5668
 epoch: 78, train_loss: 0.7034, test_loss: 0.8971, test_f1: 0.5652
 epoch: 79, train_loss: 0.7027, test_loss: 0.9049, test_f1: 0.5586
 epoch: 80, train_loss: 0.7042, test_loss: 0.8976, test_f1: 0.5595
 epoch: 81, train_loss: 0.6874, test_loss: 0.9035, test_f1: 0.5676
 epoch: 82, train_loss: 0.7051, test_loss: 0.8985, test_f1: 0.5668
 epoch: 83, train_loss: 0.6975, test_loss: 0.8935, test_f1: 0.5682
 epoch: 84, train_loss: 0.6918, test_loss: 0.8791, test_f1: 0.5752
 epoch: 85, train_loss: 0.6884, test_loss: 0.8969, test_f1: 0.5729
 epoch: 86, train_loss: 0.6860, test_loss: 0.9078, test_f1: 0.5682
 epoch: 87, train_loss: 0.6830, test_loss: 0.9033, test_f1: 0.5715
 epoch: 88, train_loss: 0.6796, test_loss: 0.9075, test_f1: 0.5639
 epoch: 89, train_loss: 0.6850, test_loss: 0.8906, test_f1: 0.5719
 epoch: 90, train_loss: 0.6799, test_loss: 0.9025, test_f1: 0.5599
 epoch: 91, train_loss: 0.6847, test_loss: 0.8957, test_f1: 0.5695
 epoch: 92, train_loss: 0.6746, test_loss: 0.9029, test_f1: 0.5671
 epoch: 93, train_loss: 0.6821, test_loss: 0.8898, test_f1: 0.5701
 epoch: 94, train_loss: 0.6650, test_loss: 0.9228, test_f1: 0.5652
 epoch: 95, train_loss: 0.6788, test_loss: 0.9072, test_f1: 0.5734
 epoch: 96, train_loss: 0.6822, test_loss: 0.9088, test_f1: 0.5689
 epoch: 97, train_loss: 0.6748, test_loss: 0.9044, test_f1: 0.5716
 epoch: 98, train_loss: 0.6697, test_loss: 0.8932, test_f1: 0.5748
 epoch: 99, train_loss: 0.6742, test_loss: 0.9163, test_f1: 0.5648
##################ITERATION #5 ****************************************
 epoch: 0, train_loss: 1.2581, test_loss: 1.3098, test_f1: 0.2260
 epoch: 1, train_loss: 1.2028, test_loss: 1.2916, test_f1: 0.2260
 epoch: 2, train_loss: 1.1734, test_loss: 1.2536, test_f1: 0.2361
 epoch: 3, train_loss: 1.1523, test_loss: 1.1961, test_f1: 0.2771
 epoch: 4, train_loss: 1.1242, test_loss: 1.1314, test_f1: 0.4402
 epoch: 5, train_loss: 1.1051, test_loss: 1.0956, test_f1: 0.4267
 epoch: 6, train_loss: 1.0797, test_loss: 1.0591, test_f1: 0.4496
 epoch: 7, train_loss: 1.0609, test_loss: 1.0288, test_f1: 0.4651
 epoch: 8, train_loss: 1.0396, test_loss: 1.0098, test_f1: 0.4752
 epoch: 9, train_loss: 1.0208, test_loss: 0.9922, test_f1: 0.4759
 epoch: 10, train_loss: 1.0054, test_loss: 0.9762, test_f1: 0.4723
 epoch: 11, train_loss: 0.9975, test_loss: 0.9661, test_f1: 0.4838
 epoch: 12, train_loss: 0.9797, test_loss: 0.9633, test_f1: 0.4649
 epoch: 13, train_loss: 0.9649, test_loss: 0.9524, test_f1: 0.4800
 epoch: 14, train_loss: 0.9613, test_loss: 0.9377, test_f1: 0.4923
 epoch: 15, train_loss: 0.9468, test_loss: 0.9365, test_f1: 0.4889
 epoch: 16, train_loss: 0.9433, test_loss: 0.9220, test_f1: 0.4920
 epoch: 17, train_loss: 0.9309, test_loss: 0.9221, test_f1: 0.4899
 epoch: 18, train_loss: 0.9119, test_loss: 0.9157, test_f1: 0.5005
 epoch: 19, train_loss: 0.9195, test_loss: 0.9048, test_f1: 0.5012
 epoch: 20, train_loss: 0.9177, test_loss: 0.8989, test_f1: 0.4970
 epoch: 21, train_loss: 0.9033, test_loss: 0.9120, test_f1: 0.4937
 epoch: 22, train_loss: 0.8924, test_loss: 0.8950, test_f1: 0.5020
 epoch: 23, train_loss: 0.8840, test_loss: 0.8824, test_f1: 0.5090
 epoch: 24, train_loss: 0.8844, test_loss: 0.8780, test_f1: 0.5100
 epoch: 25, train_loss: 0.8754, test_loss: 0.8717, test_f1: 0.5128
 epoch: 26, train_loss: 0.8754, test_loss: 0.8840, test_f1: 0.5132
 epoch: 27, train_loss: 0.8689, test_loss: 0.8686, test_f1: 0.5119
 epoch: 28, train_loss: 0.8680, test_loss: 0.8746, test_f1: 0.5121
 epoch: 29, train_loss: 0.8532, test_loss: 0.8645, test_f1: 0.5249
 epoch: 30, train_loss: 0.8522, test_loss: 0.8717, test_f1: 0.5192
 epoch: 31, train_loss: 0.8491, test_loss: 0.8679, test_f1: 0.5103
 epoch: 32, train_loss: 0.8410, test_loss: 0.8707, test_f1: 0.5267
 epoch: 33, train_loss: 0.8431, test_loss: 0.8772, test_f1: 0.5102
 epoch: 34, train_loss: 0.8372, test_loss: 0.8506, test_f1: 0.5269
 epoch: 35, train_loss: 0.8305, test_loss: 0.8366, test_f1: 0.5381
 epoch: 36, train_loss: 0.8277, test_loss: 0.8631, test_f1: 0.5225
 epoch: 37, train_loss: 0.8161, test_loss: 0.8568, test_f1: 0.5241
 epoch: 38, train_loss: 0.8136, test_loss: 0.8443, test_f1: 0.5306
 epoch: 39, train_loss: 0.8112, test_loss: 0.8451, test_f1: 0.5370
 epoch: 40, train_loss: 0.8134, test_loss: 0.8621, test_f1: 0.5360
 epoch: 41, train_loss: 0.8079, test_loss: 0.8472, test_f1: 0.5390
 epoch: 42, train_loss: 0.8002, test_loss: 0.8537, test_f1: 0.5317
 epoch: 43, train_loss: 0.7894, test_loss: 0.8583, test_f1: 0.5308
 epoch: 44, train_loss: 0.7754, test_loss: 0.8450, test_f1: 0.5296
 epoch: 45, train_loss: 0.7716, test_loss: 0.8500, test_f1: 0.5355
 epoch: 46, train_loss: 0.7824, test_loss: 0.8506, test_f1: 0.5301
 epoch: 47, train_loss: 0.7791, test_loss: 0.8768, test_f1: 0.5273
 epoch: 48, train_loss: 0.7714, test_loss: 0.8479, test_f1: 0.5441
 epoch: 49, train_loss: 0.7682, test_loss: 0.8380, test_f1: 0.5386
 epoch: 50, train_loss: 0.7622, test_loss: 0.8466, test_f1: 0.5374
 epoch: 51, train_loss: 0.7618, test_loss: 0.8579, test_f1: 0.5387
 epoch: 52, train_loss: 0.7536, test_loss: 0.8516, test_f1: 0.5462
 epoch: 53, train_loss: 0.7553, test_loss: 0.8525, test_f1: 0.5531
 epoch: 54, train_loss: 0.7472, test_loss: 0.8490, test_f1: 0.5365
 epoch: 55, train_loss: 0.7468, test_loss: 0.8446, test_f1: 0.5580
 epoch: 56, train_loss: 0.7429, test_loss: 0.8426, test_f1: 0.5451
 epoch: 57, train_loss: 0.7362, test_loss: 0.8558, test_f1: 0.5377
 epoch: 58, train_loss: 0.7388, test_loss: 0.8513, test_f1: 0.5510
 epoch: 59, train_loss: 0.7423, test_loss: 0.8424, test_f1: 0.5567
 epoch: 60, train_loss: 0.7367, test_loss: 0.8478, test_f1: 0.5481
 epoch: 61, train_loss: 0.7294, test_loss: 0.8547, test_f1: 0.5516
 epoch: 62, train_loss: 0.7326, test_loss: 0.8676, test_f1: 0.5509
 epoch: 63, train_loss: 0.7324, test_loss: 0.8619, test_f1: 0.5458
 epoch: 64, train_loss: 0.7375, test_loss: 0.8781, test_f1: 0.5445
 epoch: 65, train_loss: 0.7349, test_loss: 0.8682, test_f1: 0.5501
 epoch: 66, train_loss: 0.7268, test_loss: 0.8591, test_f1: 0.5443
 epoch: 67, train_loss: 0.7222, test_loss: 0.8727, test_f1: 0.5492
 epoch: 68, train_loss: 0.7264, test_loss: 0.8881, test_f1: 0.5479
 epoch: 69, train_loss: 0.7152, test_loss: 0.8625, test_f1: 0.5471
 epoch: 70, train_loss: 0.7141, test_loss: 0.8549, test_f1: 0.5466
 epoch: 71, train_loss: 0.7122, test_loss: 0.8774, test_f1: 0.5456
 epoch: 72, train_loss: 0.7161, test_loss: 0.8645, test_f1: 0.5490
 epoch: 73, train_loss: 0.7203, test_loss: 0.8917, test_f1: 0.5482
 epoch: 74, train_loss: 0.7086, test_loss: 0.8736, test_f1: 0.5479
 epoch: 75, train_loss: 0.7127, test_loss: 0.8922, test_f1: 0.5493
 epoch: 76, train_loss: 0.7058, test_loss: 0.9031, test_f1: 0.5474
 epoch: 77, train_loss: 0.7032, test_loss: 0.9041, test_f1: 0.5481
 epoch: 78, train_loss: 0.6967, test_loss: 0.8863, test_f1: 0.5421
 epoch: 79, train_loss: 0.7177, test_loss: 0.8912, test_f1: 0.5374
 epoch: 80, train_loss: 0.6976, test_loss: 0.8841, test_f1: 0.5458
 epoch: 81, train_loss: 0.7090, test_loss: 0.9102, test_f1: 0.5504
 epoch: 82, train_loss: 0.7033, test_loss: 0.8926, test_f1: 0.5486
 epoch: 83, train_loss: 0.6978, test_loss: 0.9003, test_f1: 0.5496
 epoch: 84, train_loss: 0.6885, test_loss: 0.9196, test_f1: 0.5540
 epoch: 85, train_loss: 0.6872, test_loss: 0.9305, test_f1: 0.5486
 epoch: 86, train_loss: 0.6937, test_loss: 0.9213, test_f1: 0.5459
 epoch: 87, train_loss: 0.6875, test_loss: 0.8942, test_f1: 0.5547
 epoch: 88, train_loss: 0.6837, test_loss: 0.8939, test_f1: 0.5506
 epoch: 89, train_loss: 0.6930, test_loss: 0.8921, test_f1: 0.5495
 epoch: 90, train_loss: 0.6919, test_loss: 0.8914, test_f1: 0.5442
 epoch: 91, train_loss: 0.6871, test_loss: 0.8948, test_f1: 0.5483
 epoch: 92, train_loss: 0.6790, test_loss: 0.9019, test_f1: 0.5476
 epoch: 93, train_loss: 0.6751, test_loss: 0.9174, test_f1: 0.5546
 epoch: 94, train_loss: 0.6769, test_loss: 0.9012, test_f1: 0.5573
 epoch: 95, train_loss: 0.6793, test_loss: 0.9050, test_f1: 0.5546
 epoch: 96, train_loss: 0.6788, test_loss: 0.9048, test_f1: 0.5556
 epoch: 97, train_loss: 0.6773, test_loss: 0.8984, test_f1: 0.5509
 epoch: 98, train_loss: 0.6806, test_loss: 0.9020, test_f1: 0.5506
 epoch: 99, train_loss: 0.6687, test_loss: 0.9109, test_f1: 0.5485
##################ITERATION #6 ****************************************
 epoch: 0, train_loss: 1.2949, test_loss: 1.2964, test_f1: 0.2260
 epoch: 1, train_loss: 1.2205, test_loss: 1.2888, test_f1: 0.2508
 epoch: 2, train_loss: 1.1886, test_loss: 1.2608, test_f1: 0.3204
 epoch: 3, train_loss: 1.1680, test_loss: 1.1800, test_f1: 0.3605
 epoch: 4, train_loss: 1.1486, test_loss: 1.1235, test_f1: 0.4447
 epoch: 5, train_loss: 1.1285, test_loss: 1.0899, test_f1: 0.4601
 epoch: 6, train_loss: 1.1061, test_loss: 1.0642, test_f1: 0.4520
 epoch: 7, train_loss: 1.0896, test_loss: 1.0444, test_f1: 0.4533
 epoch: 8, train_loss: 1.0715, test_loss: 1.0303, test_f1: 0.4683
 epoch: 9, train_loss: 1.0590, test_loss: 1.0212, test_f1: 0.4743
 epoch: 10, train_loss: 1.0415, test_loss: 1.0112, test_f1: 0.4812
 epoch: 11, train_loss: 1.0356, test_loss: 1.0042, test_f1: 0.4778
 epoch: 12, train_loss: 1.0206, test_loss: 0.9973, test_f1: 0.4894
 epoch: 13, train_loss: 1.0049, test_loss: 0.9880, test_f1: 0.4725
 epoch: 14, train_loss: 0.9976, test_loss: 0.9866, test_f1: 0.4846
 epoch: 15, train_loss: 0.9823, test_loss: 0.9765, test_f1: 0.4799
 epoch: 16, train_loss: 0.9760, test_loss: 0.9731, test_f1: 0.4795
 epoch: 17, train_loss: 0.9673, test_loss: 0.9718, test_f1: 0.4804
 epoch: 18, train_loss: 0.9641, test_loss: 0.9655, test_f1: 0.4828
 epoch: 19, train_loss: 0.9582, test_loss: 0.9622, test_f1: 0.4839
 epoch: 20, train_loss: 0.9394, test_loss: 0.9583, test_f1: 0.4798
 epoch: 21, train_loss: 0.9423, test_loss: 0.9729, test_f1: 0.4730
 epoch: 22, train_loss: 0.9344, test_loss: 0.9609, test_f1: 0.4866
 epoch: 23, train_loss: 0.9208, test_loss: 0.9551, test_f1: 0.4777
 epoch: 24, train_loss: 0.9294, test_loss: 0.9527, test_f1: 0.4781
 epoch: 25, train_loss: 0.9209, test_loss: 0.9451, test_f1: 0.4936
 epoch: 26, train_loss: 0.9061, test_loss: 0.9539, test_f1: 0.4888
 epoch: 27, train_loss: 0.8957, test_loss: 0.9494, test_f1: 0.4860
 epoch: 28, train_loss: 0.8962, test_loss: 0.9658, test_f1: 0.4785
 epoch: 29, train_loss: 0.8950, test_loss: 0.9713, test_f1: 0.4869
 epoch: 30, train_loss: 0.8836, test_loss: 0.9755, test_f1: 0.4743
 epoch: 31, train_loss: 0.8807, test_loss: 0.9648, test_f1: 0.4827
 epoch: 32, train_loss: 0.8813, test_loss: 0.9640, test_f1: 0.4781
 epoch: 33, train_loss: 0.8638, test_loss: 0.9659, test_f1: 0.4871
 epoch: 34, train_loss: 0.8585, test_loss: 0.9613, test_f1: 0.4896
 epoch: 35, train_loss: 0.8582, test_loss: 0.9679, test_f1: 0.4802
 epoch: 36, train_loss: 0.8478, test_loss: 0.9859, test_f1: 0.4834
 epoch: 37, train_loss: 0.8448, test_loss: 0.9702, test_f1: 0.4878
 epoch: 38, train_loss: 0.8414, test_loss: 0.9540, test_f1: 0.4817
 epoch: 39, train_loss: 0.8415, test_loss: 0.9847, test_f1: 0.4844
 epoch: 40, train_loss: 0.8304, test_loss: 0.9925, test_f1: 0.4806
 epoch: 41, train_loss: 0.8416, test_loss: 0.9703, test_f1: 0.4902
 epoch: 42, train_loss: 0.8298, test_loss: 0.9711, test_f1: 0.4858
 epoch: 43, train_loss: 0.8243, test_loss: 0.9795, test_f1: 0.4956
 epoch: 44, train_loss: 0.8115, test_loss: 0.9696, test_f1: 0.4895
 epoch: 45, train_loss: 0.8145, test_loss: 0.9902, test_f1: 0.4943
 epoch: 46, train_loss: 0.8062, test_loss: 0.9700, test_f1: 0.4918
 epoch: 47, train_loss: 0.7974, test_loss: 0.9748, test_f1: 0.4916
 epoch: 48, train_loss: 0.8031, test_loss: 0.9839, test_f1: 0.4803
 epoch: 49, train_loss: 0.7864, test_loss: 0.9790, test_f1: 0.4889
 epoch: 50, train_loss: 0.7988, test_loss: 1.0132, test_f1: 0.4744
 epoch: 51, train_loss: 0.7948, test_loss: 0.9820, test_f1: 0.4880
 epoch: 52, train_loss: 0.7748, test_loss: 0.9879, test_f1: 0.4934
 epoch: 53, train_loss: 0.7811, test_loss: 0.9828, test_f1: 0.4967
 epoch: 54, train_loss: 0.7715, test_loss: 0.9945, test_f1: 0.4911
 epoch: 55, train_loss: 0.7756, test_loss: 0.9973, test_f1: 0.4770
 epoch: 56, train_loss: 0.7728, test_loss: 0.9946, test_f1: 0.4871
 epoch: 57, train_loss: 0.7784, test_loss: 0.9983, test_f1: 0.4826
 epoch: 58, train_loss: 0.7652, test_loss: 0.9938, test_f1: 0.4876
 epoch: 59, train_loss: 0.7612, test_loss: 0.9941, test_f1: 0.4862
 epoch: 60, train_loss: 0.7591, test_loss: 0.9954, test_f1: 0.4903
 epoch: 61, train_loss: 0.7582, test_loss: 1.0080, test_f1: 0.4797
 epoch: 62, train_loss: 0.7600, test_loss: 1.0088, test_f1: 0.4943
 epoch: 63, train_loss: 0.7540, test_loss: 1.0057, test_f1: 0.4934
 epoch: 64, train_loss: 0.7551, test_loss: 1.0131, test_f1: 0.4838
 epoch: 65, train_loss: 0.7598, test_loss: 1.0011, test_f1: 0.4948
 epoch: 66, train_loss: 0.7490, test_loss: 0.9789, test_f1: 0.5019
 epoch: 67, train_loss: 0.7488, test_loss: 0.9973, test_f1: 0.4921
 epoch: 68, train_loss: 0.7471, test_loss: 1.0016, test_f1: 0.4929
 epoch: 69, train_loss: 0.7560, test_loss: 0.9960, test_f1: 0.4935
 epoch: 70, train_loss: 0.7474, test_loss: 1.0040, test_f1: 0.4928
 epoch: 71, train_loss: 0.7348, test_loss: 1.0237, test_f1: 0.4908
 epoch: 72, train_loss: 0.7368, test_loss: 1.0188, test_f1: 0.4892
 epoch: 73, train_loss: 0.7283, test_loss: 1.0328, test_f1: 0.4918
 epoch: 74, train_loss: 0.7329, test_loss: 1.0074, test_f1: 0.5000
 epoch: 75, train_loss: 0.7286, test_loss: 1.0246, test_f1: 0.5036
 epoch: 76, train_loss: 0.7341, test_loss: 1.0214, test_f1: 0.5012
 epoch: 77, train_loss: 0.7234, test_loss: 1.0341, test_f1: 0.4975
 epoch: 78, train_loss: 0.7304, test_loss: 1.0254, test_f1: 0.4970
 epoch: 79, train_loss: 0.7275, test_loss: 1.0190, test_f1: 0.4971
 epoch: 80, train_loss: 0.7311, test_loss: 1.0203, test_f1: 0.5015
 epoch: 81, train_loss: 0.7315, test_loss: 1.0078, test_f1: 0.5123
 epoch: 82, train_loss: 0.7259, test_loss: 1.0215, test_f1: 0.5015
 epoch: 83, train_loss: 0.7173, test_loss: 1.0091, test_f1: 0.5085
 epoch: 84, train_loss: 0.7215, test_loss: 1.0151, test_f1: 0.5035
 epoch: 85, train_loss: 0.7156, test_loss: 1.0241, test_f1: 0.4983
 epoch: 86, train_loss: 0.7167, test_loss: 1.0187, test_f1: 0.5033
 epoch: 87, train_loss: 0.7184, test_loss: 1.0256, test_f1: 0.5146
 epoch: 88, train_loss: 0.7186, test_loss: 1.0240, test_f1: 0.5042
 epoch: 89, train_loss: 0.7065, test_loss: 1.0337, test_f1: 0.5137
 epoch: 90, train_loss: 0.7135, test_loss: 1.0140, test_f1: 0.5117
 epoch: 91, train_loss: 0.7047, test_loss: 1.0363, test_f1: 0.5114
 epoch: 92, train_loss: 0.7075, test_loss: 1.0274, test_f1: 0.5181
 epoch: 93, train_loss: 0.7044, test_loss: 1.0731, test_f1: 0.5230
 epoch: 94, train_loss: 0.7016, test_loss: 1.0511, test_f1: 0.5088
 epoch: 95, train_loss: 0.6967, test_loss: 1.0445, test_f1: 0.5128
 epoch: 96, train_loss: 0.7068, test_loss: 1.0342, test_f1: 0.5227
 epoch: 97, train_loss: 0.6995, test_loss: 1.0297, test_f1: 0.5045
 epoch: 98, train_loss: 0.6981, test_loss: 1.0302, test_f1: 0.5010
 epoch: 99, train_loss: 0.7012, test_loss: 1.0544, test_f1: 0.5123
##################ITERATION #7 ****************************************
 epoch: 0, train_loss: 1.3045, test_loss: 1.3052, test_f1: 0.2260
 epoch: 1, train_loss: 1.2262, test_loss: 1.3025, test_f1: 0.2260
 epoch: 2, train_loss: 1.1984, test_loss: 1.2772, test_f1: 0.2260
 epoch: 3, train_loss: 1.1647, test_loss: 1.2153, test_f1: 0.2507
 epoch: 4, train_loss: 1.1491, test_loss: 1.1312, test_f1: 0.3931
 epoch: 5, train_loss: 1.1223, test_loss: 1.0811, test_f1: 0.4731
 epoch: 6, train_loss: 1.1035, test_loss: 1.0583, test_f1: 0.4568
 epoch: 7, train_loss: 1.0888, test_loss: 1.0432, test_f1: 0.4698
 epoch: 8, train_loss: 1.0655, test_loss: 1.0323, test_f1: 0.4574
 epoch: 9, train_loss: 1.0583, test_loss: 1.0213, test_f1: 0.4599
 epoch: 10, train_loss: 1.0416, test_loss: 1.0169, test_f1: 0.4581
 epoch: 11, train_loss: 1.0216, test_loss: 1.0083, test_f1: 0.4605
 epoch: 12, train_loss: 1.0210, test_loss: 0.9979, test_f1: 0.4671
 epoch: 13, train_loss: 1.0086, test_loss: 0.9912, test_f1: 0.4672
 epoch: 14, train_loss: 1.0034, test_loss: 0.9875, test_f1: 0.4694
 epoch: 15, train_loss: 0.9817, test_loss: 0.9862, test_f1: 0.4702
 epoch: 16, train_loss: 0.9775, test_loss: 0.9786, test_f1: 0.4789
 epoch: 17, train_loss: 0.9727, test_loss: 0.9774, test_f1: 0.4707
 epoch: 18, train_loss: 0.9643, test_loss: 0.9723, test_f1: 0.4733
 epoch: 19, train_loss: 0.9549, test_loss: 0.9611, test_f1: 0.4800
 epoch: 20, train_loss: 0.9493, test_loss: 0.9620, test_f1: 0.4797
 epoch: 21, train_loss: 0.9390, test_loss: 0.9569, test_f1: 0.4818
 epoch: 22, train_loss: 0.9373, test_loss: 0.9566, test_f1: 0.4947
 epoch: 23, train_loss: 0.9228, test_loss: 0.9604, test_f1: 0.4838
 epoch: 24, train_loss: 0.9268, test_loss: 0.9630, test_f1: 0.4799
 epoch: 25, train_loss: 0.9100, test_loss: 0.9538, test_f1: 0.4701
 epoch: 26, train_loss: 0.8996, test_loss: 0.9658, test_f1: 0.4793
 epoch: 27, train_loss: 0.9029, test_loss: 0.9478, test_f1: 0.4795
 epoch: 28, train_loss: 0.8952, test_loss: 0.9414, test_f1: 0.4903
 epoch: 29, train_loss: 0.8890, test_loss: 0.9414, test_f1: 0.4824
 epoch: 30, train_loss: 0.8786, test_loss: 0.9484, test_f1: 0.4900
 epoch: 31, train_loss: 0.8712, test_loss: 0.9508, test_f1: 0.4993
 epoch: 32, train_loss: 0.8657, test_loss: 0.9427, test_f1: 0.4895
 epoch: 33, train_loss: 0.8650, test_loss: 0.9513, test_f1: 0.5015
 epoch: 34, train_loss: 0.8640, test_loss: 0.9454, test_f1: 0.4963
 epoch: 35, train_loss: 0.8502, test_loss: 0.9462, test_f1: 0.5039
 epoch: 36, train_loss: 0.8541, test_loss: 0.9451, test_f1: 0.4971
 epoch: 37, train_loss: 0.8483, test_loss: 0.9351, test_f1: 0.5144
 epoch: 38, train_loss: 0.8431, test_loss: 0.9442, test_f1: 0.5127
 epoch: 39, train_loss: 0.8297, test_loss: 0.9451, test_f1: 0.5084
 epoch: 40, train_loss: 0.8253, test_loss: 0.9609, test_f1: 0.5038
 epoch: 41, train_loss: 0.8293, test_loss: 0.9464, test_f1: 0.5082
 epoch: 42, train_loss: 0.8201, test_loss: 0.9480, test_f1: 0.5196
 epoch: 43, train_loss: 0.8162, test_loss: 0.9391, test_f1: 0.5168
 epoch: 44, train_loss: 0.8170, test_loss: 0.9598, test_f1: 0.5159
 epoch: 45, train_loss: 0.8181, test_loss: 0.9349, test_f1: 0.5147
 epoch: 46, train_loss: 0.7944, test_loss: 0.9577, test_f1: 0.5244
 epoch: 47, train_loss: 0.7911, test_loss: 0.9577, test_f1: 0.5083
 epoch: 48, train_loss: 0.7953, test_loss: 0.9820, test_f1: 0.5099
 epoch: 49, train_loss: 0.7795, test_loss: 0.9566, test_f1: 0.5235
 epoch: 50, train_loss: 0.7816, test_loss: 0.9630, test_f1: 0.5158
 epoch: 51, train_loss: 0.7773, test_loss: 0.9675, test_f1: 0.5245
 epoch: 52, train_loss: 0.7712, test_loss: 0.9644, test_f1: 0.5309
 epoch: 53, train_loss: 0.7693, test_loss: 0.9756, test_f1: 0.5200
 epoch: 54, train_loss: 0.7684, test_loss: 0.9861, test_f1: 0.5197
 epoch: 55, train_loss: 0.7670, test_loss: 0.9602, test_f1: 0.5387
 epoch: 56, train_loss: 0.7645, test_loss: 0.9670, test_f1: 0.5322
 epoch: 57, train_loss: 0.7650, test_loss: 0.9650, test_f1: 0.5244
 epoch: 58, train_loss: 0.7588, test_loss: 0.9802, test_f1: 0.5325
 epoch: 59, train_loss: 0.7469, test_loss: 0.9703, test_f1: 0.5478
 epoch: 60, train_loss: 0.7639, test_loss: 0.9747, test_f1: 0.5288
 epoch: 61, train_loss: 0.7534, test_loss: 0.9800, test_f1: 0.5340
 epoch: 62, train_loss: 0.7534, test_loss: 0.9754, test_f1: 0.5341
 epoch: 63, train_loss: 0.7413, test_loss: 0.9737, test_f1: 0.5324
 epoch: 64, train_loss: 0.7359, test_loss: 0.9831, test_f1: 0.5338
 epoch: 65, train_loss: 0.7442, test_loss: 0.9740, test_f1: 0.5535
 epoch: 66, train_loss: 0.7436, test_loss: 0.9786, test_f1: 0.5474
 epoch: 67, train_loss: 0.7324, test_loss: 0.9709, test_f1: 0.5453
 epoch: 68, train_loss: 0.7352, test_loss: 0.9781, test_f1: 0.5330
 epoch: 69, train_loss: 0.7293, test_loss: 0.9793, test_f1: 0.5378
 epoch: 70, train_loss: 0.7271, test_loss: 0.9924, test_f1: 0.5418
 epoch: 71, train_loss: 0.7327, test_loss: 0.9788, test_f1: 0.5428
 epoch: 72, train_loss: 0.7270, test_loss: 0.9752, test_f1: 0.5541
 epoch: 73, train_loss: 0.7278, test_loss: 0.9777, test_f1: 0.5387
 epoch: 74, train_loss: 0.7370, test_loss: 0.9853, test_f1: 0.5453
 epoch: 75, train_loss: 0.7209, test_loss: 0.9944, test_f1: 0.5293
 epoch: 76, train_loss: 0.7205, test_loss: 0.9906, test_f1: 0.5501
 epoch: 77, train_loss: 0.7132, test_loss: 0.9918, test_f1: 0.5536
 epoch: 78, train_loss: 0.7235, test_loss: 0.9863, test_f1: 0.5494
 epoch: 79, train_loss: 0.7166, test_loss: 0.9898, test_f1: 0.5474
 epoch: 80, train_loss: 0.7116, test_loss: 0.9960, test_f1: 0.5466
 epoch: 81, train_loss: 0.7069, test_loss: 1.0090, test_f1: 0.5364
 epoch: 82, train_loss: 0.7087, test_loss: 0.9858, test_f1: 0.5407
 epoch: 83, train_loss: 0.7149, test_loss: 0.9941, test_f1: 0.5543
 epoch: 84, train_loss: 0.7094, test_loss: 0.9833, test_f1: 0.5606
 epoch: 85, train_loss: 0.7026, test_loss: 0.9895, test_f1: 0.5535
 epoch: 86, train_loss: 0.7078, test_loss: 0.9964, test_f1: 0.5503
 epoch: 87, train_loss: 0.7042, test_loss: 0.9880, test_f1: 0.5548
 epoch: 88, train_loss: 0.6973, test_loss: 0.9995, test_f1: 0.5538
 epoch: 89, train_loss: 0.7024, test_loss: 0.9899, test_f1: 0.5546
 epoch: 90, train_loss: 0.7061, test_loss: 0.9936, test_f1: 0.5540
 epoch: 91, train_loss: 0.6966, test_loss: 0.9931, test_f1: 0.5534
 epoch: 92, train_loss: 0.6914, test_loss: 0.9953, test_f1: 0.5427
 epoch: 93, train_loss: 0.6937, test_loss: 0.9913, test_f1: 0.5501
 epoch: 94, train_loss: 0.6959, test_loss: 0.9940, test_f1: 0.5602
 epoch: 95, train_loss: 0.6924, test_loss: 1.0002, test_f1: 0.5544
 epoch: 96, train_loss: 0.6859, test_loss: 1.0244, test_f1: 0.5531
 epoch: 97, train_loss: 0.6778, test_loss: 1.0142, test_f1: 0.5512
 epoch: 98, train_loss: 0.6821, test_loss: 1.0138, test_f1: 0.5500
 epoch: 99, train_loss: 0.6758, test_loss: 1.0070, test_f1: 0.5646
##################ITERATION #8 ****************************************
 epoch: 0, train_loss: 1.2959, test_loss: 1.3109, test_f1: 0.2260
 epoch: 1, train_loss: 1.2135, test_loss: 1.3002, test_f1: 0.2260
 epoch: 2, train_loss: 1.1800, test_loss: 1.2727, test_f1: 0.2894
 epoch: 3, train_loss: 1.1546, test_loss: 1.1825, test_f1: 0.3612
 epoch: 4, train_loss: 1.1379, test_loss: 1.1177, test_f1: 0.4196
 epoch: 5, train_loss: 1.1074, test_loss: 1.0767, test_f1: 0.4399
 epoch: 6, train_loss: 1.0911, test_loss: 1.0598, test_f1: 0.4568
 epoch: 7, train_loss: 1.0814, test_loss: 1.0472, test_f1: 0.4618
 epoch: 8, train_loss: 1.0619, test_loss: 1.0340, test_f1: 0.4646
 epoch: 9, train_loss: 1.0587, test_loss: 1.0239, test_f1: 0.4632
 epoch: 10, train_loss: 1.0442, test_loss: 1.0239, test_f1: 0.4651
 epoch: 11, train_loss: 1.0301, test_loss: 1.0145, test_f1: 0.4823
 epoch: 12, train_loss: 1.0224, test_loss: 1.0004, test_f1: 0.4881
 epoch: 13, train_loss: 1.0197, test_loss: 0.9948, test_f1: 0.4828
 epoch: 14, train_loss: 1.0034, test_loss: 0.9851, test_f1: 0.4736
 epoch: 15, train_loss: 0.9884, test_loss: 0.9784, test_f1: 0.4891
 epoch: 16, train_loss: 0.9840, test_loss: 0.9771, test_f1: 0.4865
 epoch: 17, train_loss: 0.9825, test_loss: 0.9736, test_f1: 0.4844
 epoch: 18, train_loss: 0.9710, test_loss: 0.9729, test_f1: 0.4967
 epoch: 19, train_loss: 0.9618, test_loss: 0.9716, test_f1: 0.5005
 epoch: 20, train_loss: 0.9567, test_loss: 0.9655, test_f1: 0.4954
 epoch: 21, train_loss: 0.9471, test_loss: 0.9735, test_f1: 0.5024
 epoch: 22, train_loss: 0.9456, test_loss: 0.9644, test_f1: 0.5047
 epoch: 23, train_loss: 0.9369, test_loss: 0.9617, test_f1: 0.5095
 epoch: 24, train_loss: 0.9333, test_loss: 0.9519, test_f1: 0.5073
 epoch: 25, train_loss: 0.9313, test_loss: 0.9691, test_f1: 0.4967
 epoch: 26, train_loss: 0.9173, test_loss: 0.9766, test_f1: 0.4969
 epoch: 27, train_loss: 0.9200, test_loss: 0.9666, test_f1: 0.5137
 epoch: 28, train_loss: 0.9089, test_loss: 0.9533, test_f1: 0.5213
 epoch: 29, train_loss: 0.9064, test_loss: 0.9553, test_f1: 0.5132
 epoch: 30, train_loss: 0.8918, test_loss: 0.9954, test_f1: 0.5101
 epoch: 31, train_loss: 0.8852, test_loss: 0.9672, test_f1: 0.5279
 epoch: 32, train_loss: 0.8819, test_loss: 0.9535, test_f1: 0.5183
 epoch: 33, train_loss: 0.8712, test_loss: 0.9618, test_f1: 0.5121
 epoch: 34, train_loss: 0.8779, test_loss: 0.9970, test_f1: 0.5182
 epoch: 35, train_loss: 0.8729, test_loss: 0.9792, test_f1: 0.5236
 epoch: 36, train_loss: 0.8664, test_loss: 0.9390, test_f1: 0.5396
 epoch: 37, train_loss: 0.8587, test_loss: 0.9744, test_f1: 0.5288
 epoch: 38, train_loss: 0.8511, test_loss: 1.0313, test_f1: 0.5173
 epoch: 39, train_loss: 0.8437, test_loss: 0.9458, test_f1: 0.5460
 epoch: 40, train_loss: 0.8425, test_loss: 0.9764, test_f1: 0.5301
 epoch: 41, train_loss: 0.8354, test_loss: 0.9874, test_f1: 0.5293
 epoch: 42, train_loss: 0.8412, test_loss: 0.9950, test_f1: 0.5298
 epoch: 43, train_loss: 0.8248, test_loss: 1.0510, test_f1: 0.5350
 epoch: 44, train_loss: 0.8232, test_loss: 0.9529, test_f1: 0.5550
 epoch: 45, train_loss: 0.8224, test_loss: 0.9360, test_f1: 0.5403
 epoch: 46, train_loss: 0.8101, test_loss: 0.9413, test_f1: 0.5419
 epoch: 47, train_loss: 0.8139, test_loss: 0.9334, test_f1: 0.5316
 epoch: 48, train_loss: 0.8070, test_loss: 0.9151, test_f1: 0.5607
 epoch: 49, train_loss: 0.7904, test_loss: 0.9479, test_f1: 0.5403
 epoch: 50, train_loss: 0.7925, test_loss: 1.0246, test_f1: 0.5395
 epoch: 51, train_loss: 0.7903, test_loss: 0.9998, test_f1: 0.5348
 epoch: 52, train_loss: 0.7829, test_loss: 0.9436, test_f1: 0.5525
 epoch: 53, train_loss: 0.7807, test_loss: 0.9429, test_f1: 0.5451
 epoch: 54, train_loss: 0.7743, test_loss: 0.9730, test_f1: 0.5439
 epoch: 55, train_loss: 0.7901, test_loss: 0.9363, test_f1: 0.5591
 epoch: 56, train_loss: 0.7858, test_loss: 0.9635, test_f1: 0.5323
 epoch: 57, train_loss: 0.7745, test_loss: 0.9460, test_f1: 0.5446
 epoch: 58, train_loss: 0.7724, test_loss: 1.0245, test_f1: 0.5547
 epoch: 59, train_loss: 0.7761, test_loss: 0.9814, test_f1: 0.5491
 epoch: 60, train_loss: 0.7670, test_loss: 0.9645, test_f1: 0.5498
 epoch: 61, train_loss: 0.7684, test_loss: 0.9924, test_f1: 0.5512
 epoch: 62, train_loss: 0.7600, test_loss: 0.9380, test_f1: 0.5621
 epoch: 63, train_loss: 0.7657, test_loss: 0.9462, test_f1: 0.5551
 epoch: 64, train_loss: 0.7483, test_loss: 0.9968, test_f1: 0.5554
 epoch: 65, train_loss: 0.7579, test_loss: 0.9520, test_f1: 0.5560
 epoch: 66, train_loss: 0.7578, test_loss: 0.9189, test_f1: 0.5615
 epoch: 67, train_loss: 0.7540, test_loss: 0.9372, test_f1: 0.5601
 epoch: 68, train_loss: 0.7524, test_loss: 0.9839, test_f1: 0.5559
 epoch: 69, train_loss: 0.7464, test_loss: 0.9855, test_f1: 0.5540
 epoch: 70, train_loss: 0.7540, test_loss: 0.9826, test_f1: 0.5592
 epoch: 71, train_loss: 0.7478, test_loss: 1.0064, test_f1: 0.5596
 epoch: 72, train_loss: 0.7376, test_loss: 1.0472, test_f1: 0.5594
 epoch: 73, train_loss: 0.7319, test_loss: 1.0133, test_f1: 0.5566
 epoch: 74, train_loss: 0.7450, test_loss: 1.0120, test_f1: 0.5566
 epoch: 75, train_loss: 0.7384, test_loss: 1.0367, test_f1: 0.5578
 epoch: 76, train_loss: 0.7331, test_loss: 1.0212, test_f1: 0.5541
 epoch: 77, train_loss: 0.7305, test_loss: 1.0174, test_f1: 0.5540
 epoch: 78, train_loss: 0.7264, test_loss: 1.0129, test_f1: 0.5497
 epoch: 79, train_loss: 0.7339, test_loss: 1.0377, test_f1: 0.5564
 epoch: 80, train_loss: 0.7334, test_loss: 1.0111, test_f1: 0.5595
 epoch: 81, train_loss: 0.7289, test_loss: 0.9999, test_f1: 0.5587
 epoch: 82, train_loss: 0.7189, test_loss: 1.0266, test_f1: 0.5570
 epoch: 83, train_loss: 0.7172, test_loss: 1.0043, test_f1: 0.5547
 epoch: 84, train_loss: 0.7210, test_loss: 1.0320, test_f1: 0.5575
 epoch: 85, train_loss: 0.7159, test_loss: 1.0425, test_f1: 0.5540
 epoch: 86, train_loss: 0.7200, test_loss: 1.0536, test_f1: 0.5611
 epoch: 87, train_loss: 0.7239, test_loss: 0.9955, test_f1: 0.5638
 epoch: 88, train_loss: 0.7057, test_loss: 1.0566, test_f1: 0.5531
 epoch: 89, train_loss: 0.7111, test_loss: 1.0681, test_f1: 0.5619
 epoch: 90, train_loss: 0.7046, test_loss: 0.9781, test_f1: 0.5642
 epoch: 91, train_loss: 0.7089, test_loss: 1.0158, test_f1: 0.5641
 epoch: 92, train_loss: 0.7041, test_loss: 1.0397, test_f1: 0.5619
 epoch: 93, train_loss: 0.7074, test_loss: 1.0062, test_f1: 0.5582
 epoch: 94, train_loss: 0.7170, test_loss: 1.0918, test_f1: 0.5577
 epoch: 95, train_loss: 0.7021, test_loss: 1.0608, test_f1: 0.5564
 epoch: 96, train_loss: 0.6948, test_loss: 1.0321, test_f1: 0.5645
 epoch: 97, train_loss: 0.6930, test_loss: 1.0392, test_f1: 0.5601
 epoch: 98, train_loss: 0.6988, test_loss: 1.1107, test_f1: 0.5639
 epoch: 99, train_loss: 0.6943, test_loss: 1.1142, test_f1: 0.5650
##################ITERATION #9 ****************************************
 epoch: 0, train_loss: 1.3184, test_loss: 1.3349, test_f1: 0.2260
 epoch: 1, train_loss: 1.2072, test_loss: 1.3244, test_f1: 0.2540
 epoch: 2, train_loss: 1.1699, test_loss: 1.3086, test_f1: 0.3046
 epoch: 3, train_loss: 1.1423, test_loss: 1.2033, test_f1: 0.3245
 epoch: 4, train_loss: 1.1242, test_loss: 1.1027, test_f1: 0.4273
 epoch: 5, train_loss: 1.1006, test_loss: 1.0553, test_f1: 0.4642
 epoch: 6, train_loss: 1.0762, test_loss: 1.0323, test_f1: 0.4727
 epoch: 7, train_loss: 1.0655, test_loss: 1.0158, test_f1: 0.4761
 epoch: 8, train_loss: 1.0549, test_loss: 1.0056, test_f1: 0.4699
 epoch: 9, train_loss: 1.0427, test_loss: 0.9971, test_f1: 0.4676
 epoch: 10, train_loss: 1.0291, test_loss: 0.9844, test_f1: 0.4661
 epoch: 11, train_loss: 1.0181, test_loss: 0.9792, test_f1: 0.4680
 epoch: 12, train_loss: 1.0072, test_loss: 0.9736, test_f1: 0.4593
 epoch: 13, train_loss: 0.9901, test_loss: 0.9683, test_f1: 0.4622
 epoch: 14, train_loss: 0.9787, test_loss: 0.9573, test_f1: 0.4656
 epoch: 15, train_loss: 0.9712, test_loss: 0.9527, test_f1: 0.4635
 epoch: 16, train_loss: 0.9657, test_loss: 0.9433, test_f1: 0.4701
 epoch: 17, train_loss: 0.9596, test_loss: 0.9487, test_f1: 0.4759
 epoch: 18, train_loss: 0.9514, test_loss: 0.9375, test_f1: 0.4749
 epoch: 19, train_loss: 0.9396, test_loss: 0.9311, test_f1: 0.4858
 epoch: 20, train_loss: 0.9310, test_loss: 0.9351, test_f1: 0.4894
 epoch: 21, train_loss: 0.9268, test_loss: 0.9212, test_f1: 0.4858
 epoch: 22, train_loss: 0.9077, test_loss: 0.9160, test_f1: 0.4838
 epoch: 23, train_loss: 0.9025, test_loss: 0.9201, test_f1: 0.4849
 epoch: 24, train_loss: 0.9065, test_loss: 0.9073, test_f1: 0.4793
 epoch: 25, train_loss: 0.9025, test_loss: 0.8941, test_f1: 0.4958
 epoch: 26, train_loss: 0.8914, test_loss: 0.9081, test_f1: 0.4897
 epoch: 27, train_loss: 0.8820, test_loss: 0.9060, test_f1: 0.4828
 epoch: 28, train_loss: 0.8715, test_loss: 0.9055, test_f1: 0.4927
 epoch: 29, train_loss: 0.8663, test_loss: 0.8923, test_f1: 0.4940
 epoch: 30, train_loss: 0.8598, test_loss: 0.8980, test_f1: 0.4855
 epoch: 31, train_loss: 0.8586, test_loss: 0.9237, test_f1: 0.4904
 epoch: 32, train_loss: 0.8435, test_loss: 0.8919, test_f1: 0.5044
 epoch: 33, train_loss: 0.8409, test_loss: 0.9016, test_f1: 0.5059
 epoch: 34, train_loss: 0.8387, test_loss: 0.8943, test_f1: 0.5080
 epoch: 35, train_loss: 0.8341, test_loss: 0.9323, test_f1: 0.4919
 epoch: 36, train_loss: 0.8196, test_loss: 0.9047, test_f1: 0.5014
 epoch: 37, train_loss: 0.8278, test_loss: 0.8958, test_f1: 0.5138
 epoch: 38, train_loss: 0.8179, test_loss: 0.8980, test_f1: 0.5009
 epoch: 39, train_loss: 0.8155, test_loss: 0.8848, test_f1: 0.5170
 epoch: 40, train_loss: 0.8090, test_loss: 0.8919, test_f1: 0.5165
 epoch: 41, train_loss: 0.8044, test_loss: 0.8793, test_f1: 0.5246
 epoch: 42, train_loss: 0.8083, test_loss: 0.9010, test_f1: 0.5105
 epoch: 43, train_loss: 0.7939, test_loss: 0.8921, test_f1: 0.5322
 epoch: 44, train_loss: 0.7891, test_loss: 0.9281, test_f1: 0.5141
 epoch: 45, train_loss: 0.7825, test_loss: 0.9152, test_f1: 0.5273
 epoch: 46, train_loss: 0.7810, test_loss: 0.9031, test_f1: 0.5208
 epoch: 47, train_loss: 0.7750, test_loss: 0.9065, test_f1: 0.5367
 epoch: 48, train_loss: 0.7708, test_loss: 0.8692, test_f1: 0.5539
 epoch: 49, train_loss: 0.7782, test_loss: 0.9147, test_f1: 0.5382
 epoch: 50, train_loss: 0.7664, test_loss: 0.9029, test_f1: 0.5376
 epoch: 51, train_loss: 0.7604, test_loss: 0.9215, test_f1: 0.5384
 epoch: 52, train_loss: 0.7498, test_loss: 0.9005, test_f1: 0.5446
 epoch: 53, train_loss: 0.7430, test_loss: 0.9245, test_f1: 0.5329
 epoch: 54, train_loss: 0.7390, test_loss: 0.8958, test_f1: 0.5612
 epoch: 55, train_loss: 0.7441, test_loss: 0.9301, test_f1: 0.5323
 epoch: 56, train_loss: 0.7334, test_loss: 0.9138, test_f1: 0.5510
 epoch: 57, train_loss: 0.7341, test_loss: 0.9346, test_f1: 0.5442
 epoch: 58, train_loss: 0.7427, test_loss: 0.9190, test_f1: 0.5609
 epoch: 59, train_loss: 0.7292, test_loss: 0.9319, test_f1: 0.5521
 epoch: 60, train_loss: 0.7293, test_loss: 0.9190, test_f1: 0.5621
 epoch: 61, train_loss: 0.7273, test_loss: 0.9458, test_f1: 0.5338
 epoch: 62, train_loss: 0.7247, test_loss: 0.9561, test_f1: 0.5265
 epoch: 63, train_loss: 0.7226, test_loss: 0.9290, test_f1: 0.5454
 epoch: 64, train_loss: 0.7289, test_loss: 0.9184, test_f1: 0.5630
 epoch: 65, train_loss: 0.7324, test_loss: 0.9154, test_f1: 0.5636
 epoch: 66, train_loss: 0.7247, test_loss: 0.9076, test_f1: 0.5674
 epoch: 67, train_loss: 0.7210, test_loss: 0.9396, test_f1: 0.5504
 epoch: 68, train_loss: 0.7099, test_loss: 0.9235, test_f1: 0.5601
 epoch: 69, train_loss: 0.7155, test_loss: 0.9511, test_f1: 0.5434
 epoch: 70, train_loss: 0.7169, test_loss: 0.9206, test_f1: 0.5688
 epoch: 71, train_loss: 0.7176, test_loss: 0.9427, test_f1: 0.5470
 epoch: 72, train_loss: 0.7034, test_loss: 0.9287, test_f1: 0.5611
 epoch: 73, train_loss: 0.7092, test_loss: 0.9188, test_f1: 0.5671
 epoch: 74, train_loss: 0.7105, test_loss: 0.9216, test_f1: 0.5674
 epoch: 75, train_loss: 0.7147, test_loss: 0.9305, test_f1: 0.5540
 epoch: 76, train_loss: 0.7079, test_loss: 0.9100, test_f1: 0.5694
 epoch: 77, train_loss: 0.6925, test_loss: 0.9514, test_f1: 0.5562
 epoch: 78, train_loss: 0.6970, test_loss: 0.9222, test_f1: 0.5571
 epoch: 79, train_loss: 0.7018, test_loss: 0.9162, test_f1: 0.5617
 epoch: 80, train_loss: 0.6957, test_loss: 0.9251, test_f1: 0.5692
 epoch: 81, train_loss: 0.6890, test_loss: 0.9161, test_f1: 0.5662
 epoch: 82, train_loss: 0.6782, test_loss: 0.9427, test_f1: 0.5567
 epoch: 83, train_loss: 0.6849, test_loss: 0.9280, test_f1: 0.5676
 epoch: 84, train_loss: 0.6870, test_loss: 0.9319, test_f1: 0.5705
 epoch: 85, train_loss: 0.6908, test_loss: 0.9388, test_f1: 0.5599
 epoch: 86, train_loss: 0.6827, test_loss: 0.9424, test_f1: 0.5653
 epoch: 87, train_loss: 0.6789, test_loss: 0.9282, test_f1: 0.5696
 epoch: 88, train_loss: 0.6793, test_loss: 0.9395, test_f1: 0.5658
 epoch: 89, train_loss: 0.6770, test_loss: 0.9719, test_f1: 0.5542
 epoch: 90, train_loss: 0.6796, test_loss: 0.9391, test_f1: 0.5630
 epoch: 91, train_loss: 0.6814, test_loss: 0.9392, test_f1: 0.5627
 epoch: 92, train_loss: 0.6687, test_loss: 0.9475, test_f1: 0.5621
 epoch: 93, train_loss: 0.6657, test_loss: 0.9736, test_f1: 0.5604
 epoch: 94, train_loss: 0.6664, test_loss: 0.9579, test_f1: 0.5699
 epoch: 95, train_loss: 0.6748, test_loss: 0.9706, test_f1: 0.5518
 epoch: 96, train_loss: 0.6640, test_loss: 0.9521, test_f1: 0.5617
 epoch: 97, train_loss: 0.6685, test_loss: 0.9369, test_f1: 0.5726
 epoch: 98, train_loss: 0.6699, test_loss: 0.9607, test_f1: 0.5621
 epoch: 99, train_loss: 0.6624, test_loss: 0.9749, test_f1: 0.5582

Training completed in 442.74 seconds
Best F1: 0.5752 at epoch 84
Mean F1 across iterations: 0.5505  0.0181
========================FINAL RESULTS================================
FEGIN weighted F1: 0.5752  0.0181
python main.py --data ltspice_examples --representation component_pin --model FEGIN --layers 4 --hiddens 64 --batch_size 256 --lr 0.0001 --emb_size 128 --epochs 100 --save_appendix component_pin_L4_H64_BS256_LR0.0001_E128 --no_val
-----



STDERR:
  File "main.py", line 370, in <module>
    main()
  File "main.py", line 254, in main
    dataset = dataset_class(
  File "/home/philip/projects/ltspice_examples_code_repo/Circuit-Completion-Using-GNNs/component_classification_with_link_prediction_head/evaluation/FEGIN/kernel/circuit_datasets.py", line 15, in __init__
    self.data, self.slices = torch.load(self.processed_paths[0])
  File "/home/philip/.local/lib/python3.8/site-packages/torch/serialization.py", line 1040, in load
    warnings.warn(
  File "/usr/lib/python3.8/warnings.py", line 109, in _showwarnmsg
    sw(msg.message, msg.category, msg.filename, msg.lineno,
  File "main.py", line 47, in warn_with_traceback
    traceback.print_stack(file=log)
/home/philip/projects/ltspice_examples_code_repo/Circuit-Completion-Using-GNNs/component_classification_with_link_prediction_head/evaluation/FEGIN/kernel/circuit_datasets.py:15: FutureWarning: You are using `torch.load` with `weights_only=False` (the current default value), which uses the default pickle module implicitly. It is possible to construct malicious pickle data which will execute arbitrary code during unpickling (See https://github.com/pytorch/pytorch/blob/main/SECURITY.md#untrusted-models for more details). In a future release, the default value for `weights_only` will be flipped to `True`. This limits the functions that could be executed during unpickling. Arbitrary objects will no longer be allowed to be loaded via this mode unless they are explicitly allowlisted by the user via `torch.serialization.add_safe_globals`. We recommend you start setting `weights_only=True` for any use case where you don't have full control of the loaded file. Please open an issue on GitHub for any issues related to this experimental feature.
  self.data, self.slices = torch.load(self.processed_paths[0])
