STDOUT:
Results will be saved in /home/philip/projects/ltspice_examples_code_repo/Circuit-Completion-Using-GNNs/component_classification_with_link_prediction_head/evaluation/FEGIN/results/model_FEGIN_dataset_ltspice_examples
Command line input: python main.py --data ltspice_examples --representation component_net --model FEGIN --layers 5 --hiddens 32 --batch_size 128 --lr 0.0001 --emb_size 250 --epochs 100 --save_appendix component_net_L5_H32_BS128_LR0.0001_E250 --no_val
 is saved.
-----
ltspice_examples - FEGIN
Using 5 layers, 32 hidden units, h = 2
Loading component_net representation dataset
ENTERED
Training FEGIN on component_net representation
Train: 3558, Test: 846
##################ITERATION #0 ****************************************
 epoch: 0, train_loss: 1.4192, test_loss: 1.4163, test_f1: 0.1004
 epoch: 1, train_loss: 1.4100, test_loss: 1.4048, test_f1: 0.1004
 epoch: 2, train_loss: 1.4039, test_loss: 1.3984, test_f1: 0.1139
 epoch: 3, train_loss: 1.3973, test_loss: 1.3911, test_f1: 0.1182
 epoch: 4, train_loss: 1.3912, test_loss: 1.3836, test_f1: 0.1124
 epoch: 5, train_loss: 1.3835, test_loss: 1.3764, test_f1: 0.1587
 epoch: 6, train_loss: 1.3757, test_loss: 1.3681, test_f1: 0.2190
 epoch: 7, train_loss: 1.3663, test_loss: 1.3592, test_f1: 0.2798
 epoch: 8, train_loss: 1.3563, test_loss: 1.3485, test_f1: 0.3344
 epoch: 9, train_loss: 1.3458, test_loss: 1.3377, test_f1: 0.3303
 epoch: 10, train_loss: 1.3330, test_loss: 1.3253, test_f1: 0.3301
 epoch: 11, train_loss: 1.3223, test_loss: 1.3122, test_f1: 0.3357
 epoch: 12, train_loss: 1.3076, test_loss: 1.2982, test_f1: 0.3302
 epoch: 13, train_loss: 1.2972, test_loss: 1.2842, test_f1: 0.3292
 epoch: 14, train_loss: 1.2828, test_loss: 1.2714, test_f1: 0.3264
 epoch: 15, train_loss: 1.2716, test_loss: 1.2592, test_f1: 0.3248
 epoch: 16, train_loss: 1.2552, test_loss: 1.2457, test_f1: 0.3323
 epoch: 17, train_loss: 1.2440, test_loss: 1.2367, test_f1: 0.3351
 epoch: 18, train_loss: 1.2334, test_loss: 1.2237, test_f1: 0.3413
 epoch: 19, train_loss: 1.2217, test_loss: 1.2166, test_f1: 0.3427
 epoch: 20, train_loss: 1.2118, test_loss: 1.2039, test_f1: 0.3465
 epoch: 21, train_loss: 1.1974, test_loss: 1.1903, test_f1: 0.3494
 epoch: 22, train_loss: 1.1934, test_loss: 1.1834, test_f1: 0.3512
 epoch: 23, train_loss: 1.1803, test_loss: 1.1781, test_f1: 0.3494
 epoch: 24, train_loss: 1.1735, test_loss: 1.1690, test_f1: 0.3544
 epoch: 25, train_loss: 1.1658, test_loss: 1.1597, test_f1: 0.3743
 epoch: 26, train_loss: 1.1618, test_loss: 1.1456, test_f1: 0.3870
 epoch: 27, train_loss: 1.1529, test_loss: 1.1443, test_f1: 0.3898
 epoch: 28, train_loss: 1.1437, test_loss: 1.1364, test_f1: 0.4088
 epoch: 29, train_loss: 1.1397, test_loss: 1.1291, test_f1: 0.4103
 epoch: 30, train_loss: 1.1269, test_loss: 1.1199, test_f1: 0.4191
 epoch: 31, train_loss: 1.1275, test_loss: 1.1161, test_f1: 0.4224
 epoch: 32, train_loss: 1.1214, test_loss: 1.1063, test_f1: 0.4247
 epoch: 33, train_loss: 1.1108, test_loss: 1.1011, test_f1: 0.4395
 epoch: 34, train_loss: 1.1126, test_loss: 1.0911, test_f1: 0.4422
 epoch: 35, train_loss: 1.1019, test_loss: 1.0887, test_f1: 0.4564
 epoch: 36, train_loss: 1.0953, test_loss: 1.0834, test_f1: 0.4651
 epoch: 37, train_loss: 1.0970, test_loss: 1.0734, test_f1: 0.4754
 epoch: 38, train_loss: 1.0871, test_loss: 1.0710, test_f1: 0.4830
 epoch: 39, train_loss: 1.0774, test_loss: 1.0671, test_f1: 0.4957
 epoch: 40, train_loss: 1.0705, test_loss: 1.0553, test_f1: 0.5014
 epoch: 41, train_loss: 1.0681, test_loss: 1.0486, test_f1: 0.5227
 epoch: 42, train_loss: 1.0571, test_loss: 1.0390, test_f1: 0.5237
 epoch: 43, train_loss: 1.0523, test_loss: 1.0364, test_f1: 0.5222
 epoch: 44, train_loss: 1.0481, test_loss: 1.0310, test_f1: 0.5405
 epoch: 45, train_loss: 1.0316, test_loss: 1.0209, test_f1: 0.5235
 epoch: 46, train_loss: 1.0272, test_loss: 1.0201, test_f1: 0.5425
 epoch: 47, train_loss: 1.0228, test_loss: 1.0087, test_f1: 0.5205
 epoch: 48, train_loss: 1.0244, test_loss: 1.0045, test_f1: 0.5144
 epoch: 49, train_loss: 1.0072, test_loss: 1.0032, test_f1: 0.4988
 epoch: 50, train_loss: 1.0072, test_loss: 0.9928, test_f1: 0.5070
 epoch: 51, train_loss: 1.0025, test_loss: 0.9896, test_f1: 0.5043
 epoch: 52, train_loss: 0.9996, test_loss: 0.9839, test_f1: 0.5103
 epoch: 53, train_loss: 0.9927, test_loss: 0.9814, test_f1: 0.5041
 epoch: 54, train_loss: 0.9815, test_loss: 0.9835, test_f1: 0.4928
 epoch: 55, train_loss: 0.9838, test_loss: 0.9795, test_f1: 0.4945
 epoch: 56, train_loss: 0.9881, test_loss: 0.9741, test_f1: 0.5165
 epoch: 57, train_loss: 0.9796, test_loss: 0.9750, test_f1: 0.5061
 epoch: 58, train_loss: 0.9866, test_loss: 0.9714, test_f1: 0.4999
 epoch: 59, train_loss: 0.9757, test_loss: 0.9679, test_f1: 0.5088
 epoch: 60, train_loss: 0.9679, test_loss: 0.9673, test_f1: 0.5094
 epoch: 61, train_loss: 0.9708, test_loss: 0.9644, test_f1: 0.5056
 epoch: 62, train_loss: 0.9675, test_loss: 0.9620, test_f1: 0.5112
 epoch: 63, train_loss: 0.9714, test_loss: 0.9610, test_f1: 0.5116
 epoch: 64, train_loss: 0.9709, test_loss: 0.9583, test_f1: 0.5064
 epoch: 65, train_loss: 0.9638, test_loss: 0.9528, test_f1: 0.5077
 epoch: 66, train_loss: 0.9551, test_loss: 0.9471, test_f1: 0.5153
 epoch: 67, train_loss: 0.9589, test_loss: 0.9537, test_f1: 0.5058
 epoch: 68, train_loss: 0.9482, test_loss: 0.9506, test_f1: 0.5109
 epoch: 69, train_loss: 0.9562, test_loss: 0.9514, test_f1: 0.5099
 epoch: 70, train_loss: 0.9554, test_loss: 0.9472, test_f1: 0.5139
 epoch: 71, train_loss: 0.9567, test_loss: 0.9462, test_f1: 0.5043
 epoch: 72, train_loss: 0.9441, test_loss: 0.9445, test_f1: 0.5169
 epoch: 73, train_loss: 0.9412, test_loss: 0.9432, test_f1: 0.5071
 epoch: 74, train_loss: 0.9445, test_loss: 0.9380, test_f1: 0.5082
 epoch: 75, train_loss: 0.9442, test_loss: 0.9392, test_f1: 0.5133
 epoch: 76, train_loss: 0.9321, test_loss: 0.9368, test_f1: 0.5063
 epoch: 77, train_loss: 0.9305, test_loss: 0.9361, test_f1: 0.5124
 epoch: 78, train_loss: 0.9331, test_loss: 0.9348, test_f1: 0.5092
 epoch: 79, train_loss: 0.9295, test_loss: 0.9354, test_f1: 0.5154
 epoch: 80, train_loss: 0.9245, test_loss: 0.9342, test_f1: 0.5193
 epoch: 81, train_loss: 0.9223, test_loss: 0.9347, test_f1: 0.5157
 epoch: 82, train_loss: 0.9319, test_loss: 0.9304, test_f1: 0.5187
 epoch: 83, train_loss: 0.9303, test_loss: 0.9356, test_f1: 0.5105
 epoch: 84, train_loss: 0.9262, test_loss: 0.9303, test_f1: 0.5145
 epoch: 85, train_loss: 0.9200, test_loss: 0.9275, test_f1: 0.5234
 epoch: 86, train_loss: 0.9170, test_loss: 0.9273, test_f1: 0.5152
 epoch: 87, train_loss: 0.9193, test_loss: 0.9323, test_f1: 0.5193
 epoch: 88, train_loss: 0.9219, test_loss: 0.9303, test_f1: 0.5110
 epoch: 89, train_loss: 0.9216, test_loss: 0.9256, test_f1: 0.5128
 epoch: 90, train_loss: 0.9156, test_loss: 0.9250, test_f1: 0.5239
 epoch: 91, train_loss: 0.9176, test_loss: 0.9301, test_f1: 0.5209
 epoch: 92, train_loss: 0.9070, test_loss: 0.9224, test_f1: 0.5223
 epoch: 93, train_loss: 0.9109, test_loss: 0.9229, test_f1: 0.5162
 epoch: 94, train_loss: 0.9013, test_loss: 0.9216, test_f1: 0.5133
 epoch: 95, train_loss: 0.9091, test_loss: 0.9137, test_f1: 0.5220
 epoch: 96, train_loss: 0.9090, test_loss: 0.9202, test_f1: 0.5198
 epoch: 97, train_loss: 0.9047, test_loss: 0.9170, test_f1: 0.5175
 epoch: 98, train_loss: 0.8978, test_loss: 0.9127, test_f1: 0.5151
 epoch: 99, train_loss: 0.8984, test_loss: 0.9158, test_f1: 0.5108
##################ITERATION #1 ****************************************
 epoch: 0, train_loss: 1.3837, test_loss: 1.3912, test_f1: 0.1005
 epoch: 1, train_loss: 1.3585, test_loss: 1.3642, test_f1: 0.1001
 epoch: 2, train_loss: 1.3424, test_loss: 1.3385, test_f1: 0.2809
 epoch: 3, train_loss: 1.3243, test_loss: 1.3176, test_f1: 0.3352
 epoch: 4, train_loss: 1.3085, test_loss: 1.3008, test_f1: 0.3442
 epoch: 5, train_loss: 1.2923, test_loss: 1.2848, test_f1: 0.3237
 epoch: 6, train_loss: 1.2819, test_loss: 1.2707, test_f1: 0.3198
 epoch: 7, train_loss: 1.2679, test_loss: 1.2543, test_f1: 0.3322
 epoch: 8, train_loss: 1.2565, test_loss: 1.2384, test_f1: 0.3208
 epoch: 9, train_loss: 1.2435, test_loss: 1.2243, test_f1: 0.3408
 epoch: 10, train_loss: 1.2337, test_loss: 1.2105, test_f1: 0.3397
 epoch: 11, train_loss: 1.2227, test_loss: 1.1980, test_f1: 0.3653
 epoch: 12, train_loss: 1.2151, test_loss: 1.1849, test_f1: 0.3750
 epoch: 13, train_loss: 1.2007, test_loss: 1.1720, test_f1: 0.3851
 epoch: 14, train_loss: 1.1961, test_loss: 1.1639, test_f1: 0.4181
 epoch: 15, train_loss: 1.1833, test_loss: 1.1507, test_f1: 0.4251
 epoch: 16, train_loss: 1.1764, test_loss: 1.1391, test_f1: 0.4455
 epoch: 17, train_loss: 1.1708, test_loss: 1.1288, test_f1: 0.4539
 epoch: 18, train_loss: 1.1608, test_loss: 1.1176, test_f1: 0.4500
 epoch: 19, train_loss: 1.1469, test_loss: 1.1093, test_f1: 0.4675
 epoch: 20, train_loss: 1.1426, test_loss: 1.0948, test_f1: 0.4571
 epoch: 21, train_loss: 1.1311, test_loss: 1.0845, test_f1: 0.4643
 epoch: 22, train_loss: 1.1264, test_loss: 1.0786, test_f1: 0.4742
 epoch: 23, train_loss: 1.1191, test_loss: 1.0660, test_f1: 0.4713
 epoch: 24, train_loss: 1.1076, test_loss: 1.0577, test_f1: 0.4699
 epoch: 25, train_loss: 1.0988, test_loss: 1.0504, test_f1: 0.4713
 epoch: 26, train_loss: 1.0885, test_loss: 1.0335, test_f1: 0.4725
 epoch: 27, train_loss: 1.0866, test_loss: 1.0320, test_f1: 0.4777
 epoch: 28, train_loss: 1.0807, test_loss: 1.0265, test_f1: 0.4867
 epoch: 29, train_loss: 1.0680, test_loss: 1.0177, test_f1: 0.4865
 epoch: 30, train_loss: 1.0637, test_loss: 1.0056, test_f1: 0.4806
 epoch: 31, train_loss: 1.0594, test_loss: 1.0047, test_f1: 0.4786
 epoch: 32, train_loss: 1.0517, test_loss: 0.9999, test_f1: 0.4777
 epoch: 33, train_loss: 1.0542, test_loss: 0.9969, test_f1: 0.4750
 epoch: 34, train_loss: 1.0393, test_loss: 0.9874, test_f1: 0.4937
 epoch: 35, train_loss: 1.0373, test_loss: 0.9905, test_f1: 0.4911
 epoch: 36, train_loss: 1.0269, test_loss: 0.9797, test_f1: 0.4935
 epoch: 37, train_loss: 1.0315, test_loss: 0.9760, test_f1: 0.4992
 epoch: 38, train_loss: 1.0222, test_loss: 0.9725, test_f1: 0.4988
 epoch: 39, train_loss: 1.0209, test_loss: 0.9733, test_f1: 0.4933
 epoch: 40, train_loss: 1.0156, test_loss: 0.9524, test_f1: 0.5057
 epoch: 41, train_loss: 1.0008, test_loss: 0.9554, test_f1: 0.5101
 epoch: 42, train_loss: 1.0041, test_loss: 0.9568, test_f1: 0.5091
 epoch: 43, train_loss: 1.0062, test_loss: 0.9602, test_f1: 0.5141
 epoch: 44, train_loss: 0.9946, test_loss: 0.9644, test_f1: 0.5047
 epoch: 45, train_loss: 0.9958, test_loss: 0.9637, test_f1: 0.5048
 epoch: 46, train_loss: 0.9869, test_loss: 0.9486, test_f1: 0.5123
 epoch: 47, train_loss: 0.9834, test_loss: 0.9441, test_f1: 0.5208
 epoch: 48, train_loss: 0.9845, test_loss: 0.9381, test_f1: 0.5162
 epoch: 49, train_loss: 0.9797, test_loss: 0.9502, test_f1: 0.5014
 epoch: 50, train_loss: 0.9775, test_loss: 0.9561, test_f1: 0.5115
 epoch: 51, train_loss: 0.9674, test_loss: 0.9486, test_f1: 0.5114
 epoch: 52, train_loss: 0.9780, test_loss: 0.9421, test_f1: 0.5200
 epoch: 53, train_loss: 0.9694, test_loss: 0.9349, test_f1: 0.5205
 epoch: 54, train_loss: 0.9664, test_loss: 0.9403, test_f1: 0.5090
 epoch: 55, train_loss: 0.9649, test_loss: 0.9397, test_f1: 0.5083
 epoch: 56, train_loss: 0.9624, test_loss: 0.9370, test_f1: 0.5144
 epoch: 57, train_loss: 0.9562, test_loss: 0.9407, test_f1: 0.5175
 epoch: 58, train_loss: 0.9557, test_loss: 0.9406, test_f1: 0.5203
 epoch: 59, train_loss: 0.9549, test_loss: 0.9374, test_f1: 0.5184
 epoch: 60, train_loss: 0.9461, test_loss: 0.9282, test_f1: 0.5148
 epoch: 61, train_loss: 0.9527, test_loss: 0.9295, test_f1: 0.5154
 epoch: 62, train_loss: 0.9521, test_loss: 0.9356, test_f1: 0.5129
 epoch: 63, train_loss: 0.9436, test_loss: 0.9318, test_f1: 0.5131
 epoch: 64, train_loss: 0.9548, test_loss: 0.9387, test_f1: 0.5070
 epoch: 65, train_loss: 0.9396, test_loss: 0.9332, test_f1: 0.5108
 epoch: 66, train_loss: 0.9463, test_loss: 0.9385, test_f1: 0.5155
 epoch: 67, train_loss: 0.9474, test_loss: 0.9381, test_f1: 0.5174
 epoch: 68, train_loss: 0.9469, test_loss: 0.9290, test_f1: 0.5251
 epoch: 69, train_loss: 0.9398, test_loss: 0.9358, test_f1: 0.5297
 epoch: 70, train_loss: 0.9387, test_loss: 0.9276, test_f1: 0.5314
 epoch: 71, train_loss: 0.9445, test_loss: 0.9242, test_f1: 0.5194
 epoch: 72, train_loss: 0.9427, test_loss: 0.9266, test_f1: 0.5297
 epoch: 73, train_loss: 0.9420, test_loss: 0.9307, test_f1: 0.5211
 epoch: 74, train_loss: 0.9465, test_loss: 0.9298, test_f1: 0.5194
 epoch: 75, train_loss: 0.9411, test_loss: 0.9336, test_f1: 0.5262
 epoch: 76, train_loss: 0.9338, test_loss: 0.9270, test_f1: 0.5276
 epoch: 77, train_loss: 0.9411, test_loss: 0.9324, test_f1: 0.5144
 epoch: 78, train_loss: 0.9352, test_loss: 0.9254, test_f1: 0.5191
 epoch: 79, train_loss: 0.9284, test_loss: 0.9326, test_f1: 0.5223
 epoch: 80, train_loss: 0.9247, test_loss: 0.9303, test_f1: 0.5232
 epoch: 81, train_loss: 0.9272, test_loss: 0.9210, test_f1: 0.5277
 epoch: 82, train_loss: 0.9339, test_loss: 0.9261, test_f1: 0.5126
 epoch: 83, train_loss: 0.9219, test_loss: 0.9186, test_f1: 0.5291
 epoch: 84, train_loss: 0.9187, test_loss: 0.9223, test_f1: 0.5312
 epoch: 85, train_loss: 0.9296, test_loss: 0.9177, test_f1: 0.5257
 epoch: 86, train_loss: 0.9227, test_loss: 0.9228, test_f1: 0.5223
 epoch: 87, train_loss: 0.9218, test_loss: 0.9202, test_f1: 0.5274
 epoch: 88, train_loss: 0.9189, test_loss: 0.9115, test_f1: 0.5234
 epoch: 89, train_loss: 0.9255, test_loss: 0.9168, test_f1: 0.5186
 epoch: 90, train_loss: 0.9218, test_loss: 0.9112, test_f1: 0.5150
 epoch: 91, train_loss: 0.9096, test_loss: 0.9236, test_f1: 0.5233
 epoch: 92, train_loss: 0.9290, test_loss: 0.9226, test_f1: 0.5256
 epoch: 93, train_loss: 0.9170, test_loss: 0.9193, test_f1: 0.5182
 epoch: 94, train_loss: 0.9211, test_loss: 0.9157, test_f1: 0.5203
 epoch: 95, train_loss: 0.9075, test_loss: 0.9358, test_f1: 0.5255
 epoch: 96, train_loss: 0.9129, test_loss: 0.9306, test_f1: 0.5177
 epoch: 97, train_loss: 0.9106, test_loss: 0.9179, test_f1: 0.5257
 epoch: 98, train_loss: 0.9235, test_loss: 0.9334, test_f1: 0.5137
 epoch: 99, train_loss: 0.9078, test_loss: 0.9278, test_f1: 0.5244
##################ITERATION #2 ****************************************
 epoch: 0, train_loss: 1.3369, test_loss: 1.3529, test_f1: 0.2270
 epoch: 1, train_loss: 1.3040, test_loss: 1.3282, test_f1: 0.2270
 epoch: 2, train_loss: 1.2860, test_loss: 1.3000, test_f1: 0.2270
 epoch: 3, train_loss: 1.2761, test_loss: 1.2709, test_f1: 0.2506
 epoch: 4, train_loss: 1.2623, test_loss: 1.2514, test_f1: 0.2702
 epoch: 5, train_loss: 1.2465, test_loss: 1.2375, test_f1: 0.2847
 epoch: 6, train_loss: 1.2414, test_loss: 1.2276, test_f1: 0.3028
 epoch: 7, train_loss: 1.2273, test_loss: 1.2175, test_f1: 0.3169
 epoch: 8, train_loss: 1.2162, test_loss: 1.2038, test_f1: 0.3284
 epoch: 9, train_loss: 1.2098, test_loss: 1.1872, test_f1: 0.3554
 epoch: 10, train_loss: 1.1998, test_loss: 1.1772, test_f1: 0.3738
 epoch: 11, train_loss: 1.1857, test_loss: 1.1672, test_f1: 0.3700
 epoch: 12, train_loss: 1.1770, test_loss: 1.1508, test_f1: 0.3791
 epoch: 13, train_loss: 1.1692, test_loss: 1.1409, test_f1: 0.3879
 epoch: 14, train_loss: 1.1557, test_loss: 1.1273, test_f1: 0.3959
 epoch: 15, train_loss: 1.1466, test_loss: 1.1168, test_f1: 0.4049
 epoch: 16, train_loss: 1.1352, test_loss: 1.1061, test_f1: 0.4236
 epoch: 17, train_loss: 1.1294, test_loss: 1.0965, test_f1: 0.4364
 epoch: 18, train_loss: 1.1149, test_loss: 1.0867, test_f1: 0.4534
 epoch: 19, train_loss: 1.1102, test_loss: 1.0773, test_f1: 0.4629
 epoch: 20, train_loss: 1.1003, test_loss: 1.0680, test_f1: 0.4595
 epoch: 21, train_loss: 1.0848, test_loss: 1.0565, test_f1: 0.4702
 epoch: 22, train_loss: 1.0878, test_loss: 1.0495, test_f1: 0.4688
 epoch: 23, train_loss: 1.0761, test_loss: 1.0356, test_f1: 0.4772
 epoch: 24, train_loss: 1.0676, test_loss: 1.0293, test_f1: 0.4777
 epoch: 25, train_loss: 1.0539, test_loss: 1.0184, test_f1: 0.4735
 epoch: 26, train_loss: 1.0539, test_loss: 1.0121, test_f1: 0.4735
 epoch: 27, train_loss: 1.0437, test_loss: 1.0073, test_f1: 0.4804
 epoch: 28, train_loss: 1.0415, test_loss: 1.0037, test_f1: 0.4847
 epoch: 29, train_loss: 1.0399, test_loss: 1.0021, test_f1: 0.4759
 epoch: 30, train_loss: 1.0317, test_loss: 0.9886, test_f1: 0.4806
 epoch: 31, train_loss: 1.0285, test_loss: 0.9811, test_f1: 0.4858
 epoch: 32, train_loss: 1.0220, test_loss: 0.9745, test_f1: 0.4870
 epoch: 33, train_loss: 1.0056, test_loss: 0.9674, test_f1: 0.4949
 epoch: 34, train_loss: 1.0056, test_loss: 0.9664, test_f1: 0.4966
 epoch: 35, train_loss: 1.0028, test_loss: 0.9664, test_f1: 0.4939
 epoch: 36, train_loss: 0.9945, test_loss: 0.9611, test_f1: 0.5082
 epoch: 37, train_loss: 1.0009, test_loss: 0.9629, test_f1: 0.4953
 epoch: 38, train_loss: 0.9912, test_loss: 0.9521, test_f1: 0.4959
 epoch: 39, train_loss: 0.9823, test_loss: 0.9524, test_f1: 0.4971
 epoch: 40, train_loss: 0.9825, test_loss: 0.9431, test_f1: 0.4966
 epoch: 41, train_loss: 0.9717, test_loss: 0.9467, test_f1: 0.4995
 epoch: 42, train_loss: 0.9675, test_loss: 0.9457, test_f1: 0.4991
 epoch: 43, train_loss: 0.9687, test_loss: 0.9411, test_f1: 0.5099
 epoch: 44, train_loss: 0.9696, test_loss: 0.9353, test_f1: 0.5250
 epoch: 45, train_loss: 0.9709, test_loss: 0.9380, test_f1: 0.5083
 epoch: 46, train_loss: 0.9599, test_loss: 0.9446, test_f1: 0.5076
 epoch: 47, train_loss: 0.9589, test_loss: 0.9324, test_f1: 0.5102
 epoch: 48, train_loss: 0.9541, test_loss: 0.9328, test_f1: 0.5142
 epoch: 49, train_loss: 0.9550, test_loss: 0.9366, test_f1: 0.5103
 epoch: 50, train_loss: 0.9398, test_loss: 0.9310, test_f1: 0.5284
 epoch: 51, train_loss: 0.9374, test_loss: 0.9273, test_f1: 0.5353
 epoch: 52, train_loss: 0.9460, test_loss: 0.9329, test_f1: 0.5048
 epoch: 53, train_loss: 0.9403, test_loss: 0.9297, test_f1: 0.5119
 epoch: 54, train_loss: 0.9457, test_loss: 0.9270, test_f1: 0.5108
 epoch: 55, train_loss: 0.9324, test_loss: 0.9261, test_f1: 0.5134
 epoch: 56, train_loss: 0.9399, test_loss: 0.9280, test_f1: 0.5260
 epoch: 57, train_loss: 0.9365, test_loss: 0.9333, test_f1: 0.5196
 epoch: 58, train_loss: 0.9330, test_loss: 0.9282, test_f1: 0.5096
 epoch: 59, train_loss: 0.9331, test_loss: 0.9252, test_f1: 0.5331
 epoch: 60, train_loss: 0.9388, test_loss: 0.9199, test_f1: 0.5266
 epoch: 61, train_loss: 0.9321, test_loss: 0.9169, test_f1: 0.5352
 epoch: 62, train_loss: 0.9227, test_loss: 0.9186, test_f1: 0.5178
 epoch: 63, train_loss: 0.9294, test_loss: 0.9146, test_f1: 0.5163
 epoch: 64, train_loss: 0.9313, test_loss: 0.9154, test_f1: 0.5169
 epoch: 65, train_loss: 0.9252, test_loss: 0.9220, test_f1: 0.5338
 epoch: 66, train_loss: 0.9214, test_loss: 0.9197, test_f1: 0.5289
 epoch: 67, train_loss: 0.9190, test_loss: 0.9184, test_f1: 0.5182
 epoch: 68, train_loss: 0.9216, test_loss: 0.9246, test_f1: 0.5313
 epoch: 69, train_loss: 0.9124, test_loss: 0.9159, test_f1: 0.5175
 epoch: 70, train_loss: 0.9204, test_loss: 0.9209, test_f1: 0.5371
 epoch: 71, train_loss: 0.9202, test_loss: 0.9219, test_f1: 0.5381
 epoch: 72, train_loss: 0.9184, test_loss: 0.9131, test_f1: 0.5368
 epoch: 73, train_loss: 0.9198, test_loss: 0.9204, test_f1: 0.5363
 epoch: 74, train_loss: 0.9150, test_loss: 0.9170, test_f1: 0.5287
 epoch: 75, train_loss: 0.9105, test_loss: 0.9187, test_f1: 0.5365
 epoch: 76, train_loss: 0.9127, test_loss: 0.9177, test_f1: 0.5399
 epoch: 77, train_loss: 0.9125, test_loss: 0.9121, test_f1: 0.5359
 epoch: 78, train_loss: 0.9047, test_loss: 0.9133, test_f1: 0.5353
 epoch: 79, train_loss: 0.9197, test_loss: 0.9136, test_f1: 0.5316
 epoch: 80, train_loss: 0.9068, test_loss: 0.9114, test_f1: 0.5372
 epoch: 81, train_loss: 0.9074, test_loss: 0.9079, test_f1: 0.5349
 epoch: 82, train_loss: 0.9095, test_loss: 0.9092, test_f1: 0.5359
 epoch: 83, train_loss: 0.9089, test_loss: 0.9156, test_f1: 0.5310
 epoch: 84, train_loss: 0.9014, test_loss: 0.9202, test_f1: 0.5322
 epoch: 85, train_loss: 0.9115, test_loss: 0.9101, test_f1: 0.5597
 epoch: 86, train_loss: 0.9136, test_loss: 0.9129, test_f1: 0.5368
 epoch: 87, train_loss: 0.9000, test_loss: 0.9144, test_f1: 0.5431
 epoch: 88, train_loss: 0.8980, test_loss: 0.9180, test_f1: 0.5419
 epoch: 89, train_loss: 0.8998, test_loss: 0.9195, test_f1: 0.5305
 epoch: 90, train_loss: 0.8982, test_loss: 0.9150, test_f1: 0.5316
 epoch: 91, train_loss: 0.8938, test_loss: 0.9207, test_f1: 0.5378
 epoch: 92, train_loss: 0.8938, test_loss: 0.9094, test_f1: 0.5457
 epoch: 93, train_loss: 0.8903, test_loss: 0.9076, test_f1: 0.5375
 epoch: 94, train_loss: 0.8977, test_loss: 0.9086, test_f1: 0.5310
 epoch: 95, train_loss: 0.9141, test_loss: 0.9101, test_f1: 0.5521
 epoch: 96, train_loss: 0.8943, test_loss: 0.9053, test_f1: 0.5494
 epoch: 97, train_loss: 0.8938, test_loss: 0.9111, test_f1: 0.5507
 epoch: 98, train_loss: 0.8942, test_loss: 0.9095, test_f1: 0.5324
 epoch: 99, train_loss: 0.8976, test_loss: 0.9062, test_f1: 0.5485
##################ITERATION #3 ****************************************
 epoch: 0, train_loss: 1.3143, test_loss: 1.3461, test_f1: 0.2270
 epoch: 1, train_loss: 1.2824, test_loss: 1.3117, test_f1: 0.2236
 epoch: 2, train_loss: 1.2649, test_loss: 1.2665, test_f1: 0.2270
 epoch: 3, train_loss: 1.2500, test_loss: 1.2395, test_f1: 0.2344
 epoch: 4, train_loss: 1.2368, test_loss: 1.2235, test_f1: 0.2484
 epoch: 5, train_loss: 1.2273, test_loss: 1.2094, test_f1: 0.2631
 epoch: 6, train_loss: 1.2179, test_loss: 1.1971, test_f1: 0.3047
 epoch: 7, train_loss: 1.2047, test_loss: 1.1815, test_f1: 0.3186
 epoch: 8, train_loss: 1.1988, test_loss: 1.1683, test_f1: 0.3480
 epoch: 9, train_loss: 1.1806, test_loss: 1.1559, test_f1: 0.3786
 epoch: 10, train_loss: 1.1771, test_loss: 1.1436, test_f1: 0.3934
 epoch: 11, train_loss: 1.1645, test_loss: 1.1325, test_f1: 0.3970
 epoch: 12, train_loss: 1.1580, test_loss: 1.1211, test_f1: 0.4178
 epoch: 13, train_loss: 1.1489, test_loss: 1.1099, test_f1: 0.4206
 epoch: 14, train_loss: 1.1436, test_loss: 1.1000, test_f1: 0.4291
 epoch: 15, train_loss: 1.1303, test_loss: 1.0905, test_f1: 0.4222
 epoch: 16, train_loss: 1.1218, test_loss: 1.0793, test_f1: 0.4433
 epoch: 17, train_loss: 1.1179, test_loss: 1.0710, test_f1: 0.4305
 epoch: 18, train_loss: 1.0998, test_loss: 1.0599, test_f1: 0.4419
 epoch: 19, train_loss: 1.0982, test_loss: 1.0592, test_f1: 0.4343
 epoch: 20, train_loss: 1.0924, test_loss: 1.0470, test_f1: 0.4444
 epoch: 21, train_loss: 1.0829, test_loss: 1.0394, test_f1: 0.4451
 epoch: 22, train_loss: 1.0755, test_loss: 1.0344, test_f1: 0.4443
 epoch: 23, train_loss: 1.0638, test_loss: 1.0257, test_f1: 0.4413
 epoch: 24, train_loss: 1.0553, test_loss: 1.0227, test_f1: 0.4516
 epoch: 25, train_loss: 1.0483, test_loss: 1.0205, test_f1: 0.4497
 epoch: 26, train_loss: 1.0521, test_loss: 1.0080, test_f1: 0.4695
 epoch: 27, train_loss: 1.0368, test_loss: 1.0029, test_f1: 0.4691
 epoch: 28, train_loss: 1.0290, test_loss: 1.0001, test_f1: 0.4691
 epoch: 29, train_loss: 1.0298, test_loss: 0.9976, test_f1: 0.4679
 epoch: 30, train_loss: 1.0155, test_loss: 0.9902, test_f1: 0.4651
 epoch: 31, train_loss: 1.0107, test_loss: 0.9892, test_f1: 0.4675
 epoch: 32, train_loss: 1.0031, test_loss: 0.9820, test_f1: 0.4764
 epoch: 33, train_loss: 1.0010, test_loss: 0.9828, test_f1: 0.4760
 epoch: 34, train_loss: 1.0063, test_loss: 0.9825, test_f1: 0.4801
 epoch: 35, train_loss: 0.9979, test_loss: 0.9777, test_f1: 0.4772
 epoch: 36, train_loss: 0.9874, test_loss: 0.9770, test_f1: 0.4790
 epoch: 37, train_loss: 0.9836, test_loss: 0.9795, test_f1: 0.4793
 epoch: 38, train_loss: 0.9849, test_loss: 0.9774, test_f1: 0.4756
 epoch: 39, train_loss: 0.9762, test_loss: 0.9741, test_f1: 0.4783
 epoch: 40, train_loss: 0.9674, test_loss: 0.9714, test_f1: 0.4808
 epoch: 41, train_loss: 0.9644, test_loss: 0.9642, test_f1: 0.4869
 epoch: 42, train_loss: 0.9559, test_loss: 0.9692, test_f1: 0.4815
 epoch: 43, train_loss: 0.9586, test_loss: 0.9728, test_f1: 0.4861
 epoch: 44, train_loss: 0.9596, test_loss: 0.9668, test_f1: 0.4872
 epoch: 45, train_loss: 0.9499, test_loss: 0.9679, test_f1: 0.4847
 epoch: 46, train_loss: 0.9496, test_loss: 0.9642, test_f1: 0.4898
 epoch: 47, train_loss: 0.9419, test_loss: 0.9557, test_f1: 0.4906
 epoch: 48, train_loss: 0.9388, test_loss: 0.9543, test_f1: 0.4918
 epoch: 49, train_loss: 0.9457, test_loss: 0.9567, test_f1: 0.4902
 epoch: 50, train_loss: 0.9416, test_loss: 0.9599, test_f1: 0.4892
 epoch: 51, train_loss: 0.9394, test_loss: 0.9544, test_f1: 0.4958
 epoch: 52, train_loss: 0.9298, test_loss: 0.9565, test_f1: 0.4989
 epoch: 53, train_loss: 0.9352, test_loss: 0.9604, test_f1: 0.4865
 epoch: 54, train_loss: 0.9255, test_loss: 0.9535, test_f1: 0.4944
 epoch: 55, train_loss: 0.9343, test_loss: 0.9581, test_f1: 0.4861
 epoch: 56, train_loss: 0.9195, test_loss: 0.9548, test_f1: 0.4870
 epoch: 57, train_loss: 0.9253, test_loss: 0.9556, test_f1: 0.4972
 epoch: 58, train_loss: 0.9235, test_loss: 0.9531, test_f1: 0.4948
 epoch: 59, train_loss: 0.9173, test_loss: 0.9573, test_f1: 0.4880
 epoch: 60, train_loss: 0.9215, test_loss: 0.9538, test_f1: 0.4912
 epoch: 61, train_loss: 0.9187, test_loss: 0.9558, test_f1: 0.4871
 epoch: 62, train_loss: 0.9150, test_loss: 0.9602, test_f1: 0.4808
 epoch: 63, train_loss: 0.9234, test_loss: 0.9555, test_f1: 0.4941
 epoch: 64, train_loss: 0.9119, test_loss: 0.9535, test_f1: 0.4930
 epoch: 65, train_loss: 0.9188, test_loss: 0.9558, test_f1: 0.4921
 epoch: 66, train_loss: 0.9166, test_loss: 0.9543, test_f1: 0.4905
 epoch: 67, train_loss: 0.9137, test_loss: 0.9577, test_f1: 0.4902
 epoch: 68, train_loss: 0.9100, test_loss: 0.9559, test_f1: 0.4842
 epoch: 69, train_loss: 0.9035, test_loss: 0.9555, test_f1: 0.4909
 epoch: 70, train_loss: 0.9098, test_loss: 0.9533, test_f1: 0.4916
 epoch: 71, train_loss: 0.9066, test_loss: 0.9568, test_f1: 0.4823
 epoch: 72, train_loss: 0.9091, test_loss: 0.9529, test_f1: 0.4914
 epoch: 73, train_loss: 0.9100, test_loss: 0.9542, test_f1: 0.4911
 epoch: 74, train_loss: 0.9044, test_loss: 0.9552, test_f1: 0.4840
 epoch: 75, train_loss: 0.9020, test_loss: 0.9418, test_f1: 0.5004
 epoch: 76, train_loss: 0.9002, test_loss: 0.9590, test_f1: 0.4831
 epoch: 77, train_loss: 0.9024, test_loss: 0.9558, test_f1: 0.4864
 epoch: 78, train_loss: 0.8960, test_loss: 0.9508, test_f1: 0.4920
 epoch: 79, train_loss: 0.8951, test_loss: 0.9605, test_f1: 0.4854
 epoch: 80, train_loss: 0.8964, test_loss: 0.9581, test_f1: 0.4906
 epoch: 81, train_loss: 0.8961, test_loss: 0.9535, test_f1: 0.4915
 epoch: 82, train_loss: 0.8997, test_loss: 0.9558, test_f1: 0.4924
 epoch: 83, train_loss: 0.8944, test_loss: 0.9537, test_f1: 0.4894
 epoch: 84, train_loss: 0.8970, test_loss: 0.9561, test_f1: 0.4862
 epoch: 85, train_loss: 0.8979, test_loss: 0.9428, test_f1: 0.4987
 epoch: 86, train_loss: 0.8841, test_loss: 0.9503, test_f1: 0.4953
 epoch: 87, train_loss: 0.8781, test_loss: 0.9543, test_f1: 0.4891
 epoch: 88, train_loss: 0.8828, test_loss: 0.9459, test_f1: 0.4920
 epoch: 89, train_loss: 0.8878, test_loss: 0.9523, test_f1: 0.4892
 epoch: 90, train_loss: 0.8865, test_loss: 0.9457, test_f1: 0.4928
 epoch: 91, train_loss: 0.8745, test_loss: 0.9536, test_f1: 0.4886
 epoch: 92, train_loss: 0.8819, test_loss: 0.9554, test_f1: 0.4907
 epoch: 93, train_loss: 0.8862, test_loss: 0.9562, test_f1: 0.4978
 epoch: 94, train_loss: 0.8819, test_loss: 0.9546, test_f1: 0.4992
 epoch: 95, train_loss: 0.8828, test_loss: 0.9577, test_f1: 0.5025
 epoch: 96, train_loss: 0.8817, test_loss: 0.9535, test_f1: 0.4961
 epoch: 97, train_loss: 0.8837, test_loss: 0.9494, test_f1: 0.5026
 epoch: 98, train_loss: 0.8888, test_loss: 0.9585, test_f1: 0.5005
 epoch: 99, train_loss: 0.8719, test_loss: 0.9562, test_f1: 0.4971
##################ITERATION #4 ****************************************
 epoch: 0, train_loss: 1.2928, test_loss: 1.3468, test_f1: 0.2270
 epoch: 1, train_loss: 1.2497, test_loss: 1.2690, test_f1: 0.3520
 epoch: 2, train_loss: 1.2417, test_loss: 1.2082, test_f1: 0.3650
 epoch: 3, train_loss: 1.2227, test_loss: 1.1786, test_f1: 0.3754
 epoch: 4, train_loss: 1.2073, test_loss: 1.1589, test_f1: 0.3825
 epoch: 5, train_loss: 1.1987, test_loss: 1.1451, test_f1: 0.3873
 epoch: 6, train_loss: 1.1782, test_loss: 1.1277, test_f1: 0.3940
 epoch: 7, train_loss: 1.1669, test_loss: 1.1123, test_f1: 0.3988
 epoch: 8, train_loss: 1.1529, test_loss: 1.0989, test_f1: 0.4090
 epoch: 9, train_loss: 1.1524, test_loss: 1.0876, test_f1: 0.4252
 epoch: 10, train_loss: 1.1341, test_loss: 1.0749, test_f1: 0.4330
 epoch: 11, train_loss: 1.1285, test_loss: 1.0628, test_f1: 0.4319
 epoch: 12, train_loss: 1.1103, test_loss: 1.0478, test_f1: 0.4492
 epoch: 13, train_loss: 1.1072, test_loss: 1.0379, test_f1: 0.4512
 epoch: 14, train_loss: 1.0934, test_loss: 1.0240, test_f1: 0.4632
 epoch: 15, train_loss: 1.0844, test_loss: 1.0165, test_f1: 0.4580
 epoch: 16, train_loss: 1.0756, test_loss: 1.0043, test_f1: 0.4621
 epoch: 17, train_loss: 1.0713, test_loss: 0.9961, test_f1: 0.4659
 epoch: 18, train_loss: 1.0608, test_loss: 0.9918, test_f1: 0.4716
 epoch: 19, train_loss: 1.0526, test_loss: 0.9835, test_f1: 0.4872
 epoch: 20, train_loss: 1.0466, test_loss: 0.9703, test_f1: 0.4829
 epoch: 21, train_loss: 1.0403, test_loss: 0.9611, test_f1: 0.4837
 epoch: 22, train_loss: 1.0263, test_loss: 0.9550, test_f1: 0.4993
 epoch: 23, train_loss: 1.0228, test_loss: 0.9527, test_f1: 0.4970
 epoch: 24, train_loss: 1.0092, test_loss: 0.9438, test_f1: 0.5022
 epoch: 25, train_loss: 1.0125, test_loss: 0.9398, test_f1: 0.5001
 epoch: 26, train_loss: 0.9992, test_loss: 0.9382, test_f1: 0.5089
 epoch: 27, train_loss: 0.9952, test_loss: 0.9392, test_f1: 0.5129
 epoch: 28, train_loss: 0.9981, test_loss: 0.9290, test_f1: 0.5153
 epoch: 29, train_loss: 0.9849, test_loss: 0.9249, test_f1: 0.5215
 epoch: 30, train_loss: 0.9752, test_loss: 0.9233, test_f1: 0.5110
 epoch: 31, train_loss: 0.9809, test_loss: 0.9194, test_f1: 0.5241
 epoch: 32, train_loss: 0.9707, test_loss: 0.9199, test_f1: 0.5149
 epoch: 33, train_loss: 0.9622, test_loss: 0.9104, test_f1: 0.5238
 epoch: 34, train_loss: 0.9715, test_loss: 0.9122, test_f1: 0.5223
 epoch: 35, train_loss: 0.9563, test_loss: 0.9075, test_f1: 0.5249
 epoch: 36, train_loss: 0.9590, test_loss: 0.9090, test_f1: 0.5194
 epoch: 37, train_loss: 0.9442, test_loss: 0.9086, test_f1: 0.5227
 epoch: 38, train_loss: 0.9520, test_loss: 0.9094, test_f1: 0.5294
 epoch: 39, train_loss: 0.9378, test_loss: 0.9043, test_f1: 0.5259
 epoch: 40, train_loss: 0.9409, test_loss: 0.9071, test_f1: 0.5233
 epoch: 41, train_loss: 0.9273, test_loss: 0.9084, test_f1: 0.5249
 epoch: 42, train_loss: 0.9371, test_loss: 0.9060, test_f1: 0.5203
 epoch: 43, train_loss: 0.9304, test_loss: 0.9057, test_f1: 0.5228
 epoch: 44, train_loss: 0.9159, test_loss: 0.9112, test_f1: 0.5206
 epoch: 45, train_loss: 0.9246, test_loss: 0.9077, test_f1: 0.5218
 epoch: 46, train_loss: 0.9206, test_loss: 0.9031, test_f1: 0.5296
 epoch: 47, train_loss: 0.9248, test_loss: 0.9136, test_f1: 0.5213
 epoch: 48, train_loss: 0.9116, test_loss: 0.9074, test_f1: 0.5256
 epoch: 49, train_loss: 0.9162, test_loss: 0.8969, test_f1: 0.5267
 epoch: 50, train_loss: 0.9135, test_loss: 0.9053, test_f1: 0.5279
 epoch: 51, train_loss: 0.9151, test_loss: 0.9088, test_f1: 0.5263
 epoch: 52, train_loss: 0.9002, test_loss: 0.9024, test_f1: 0.5261
 epoch: 53, train_loss: 0.8917, test_loss: 0.9032, test_f1: 0.5305
 epoch: 54, train_loss: 0.9020, test_loss: 0.9074, test_f1: 0.5260
 epoch: 55, train_loss: 0.8963, test_loss: 0.9109, test_f1: 0.5282
 epoch: 56, train_loss: 0.8856, test_loss: 0.9084, test_f1: 0.5263
 epoch: 57, train_loss: 0.8994, test_loss: 0.9097, test_f1: 0.5296
 epoch: 58, train_loss: 0.9021, test_loss: 0.9120, test_f1: 0.5276
 epoch: 59, train_loss: 0.8963, test_loss: 0.9081, test_f1: 0.5233
 epoch: 60, train_loss: 0.8901, test_loss: 0.9120, test_f1: 0.5237
 epoch: 61, train_loss: 0.8915, test_loss: 0.9072, test_f1: 0.5322
 epoch: 62, train_loss: 0.8947, test_loss: 0.9061, test_f1: 0.5279
 epoch: 63, train_loss: 0.8868, test_loss: 0.9084, test_f1: 0.5266
 epoch: 64, train_loss: 0.8853, test_loss: 0.9079, test_f1: 0.5279
 epoch: 65, train_loss: 0.8821, test_loss: 0.9136, test_f1: 0.5301
 epoch: 66, train_loss: 0.8913, test_loss: 0.9081, test_f1: 0.5265
 epoch: 67, train_loss: 0.8790, test_loss: 0.9042, test_f1: 0.5263
 epoch: 68, train_loss: 0.8843, test_loss: 0.9075, test_f1: 0.5263
 epoch: 69, train_loss: 0.8813, test_loss: 0.9193, test_f1: 0.5241
 epoch: 70, train_loss: 0.8719, test_loss: 0.9191, test_f1: 0.5247
 epoch: 71, train_loss: 0.8736, test_loss: 0.9212, test_f1: 0.5235
 epoch: 72, train_loss: 0.8762, test_loss: 0.9191, test_f1: 0.5224
 epoch: 73, train_loss: 0.8751, test_loss: 0.9167, test_f1: 0.5249
 epoch: 74, train_loss: 0.8781, test_loss: 0.9163, test_f1: 0.5253
 epoch: 75, train_loss: 0.8744, test_loss: 0.9146, test_f1: 0.5275
 epoch: 76, train_loss: 0.8789, test_loss: 0.9143, test_f1: 0.5261
 epoch: 77, train_loss: 0.8760, test_loss: 0.9149, test_f1: 0.5240
 epoch: 78, train_loss: 0.8691, test_loss: 0.9145, test_f1: 0.5225
 epoch: 79, train_loss: 0.8789, test_loss: 0.9212, test_f1: 0.5230
 epoch: 80, train_loss: 0.8821, test_loss: 0.9207, test_f1: 0.5223
 epoch: 81, train_loss: 0.8702, test_loss: 0.9191, test_f1: 0.5275
 epoch: 82, train_loss: 0.8644, test_loss: 0.9279, test_f1: 0.5179
 epoch: 83, train_loss: 0.8687, test_loss: 0.9223, test_f1: 0.5178
 epoch: 84, train_loss: 0.8742, test_loss: 0.9208, test_f1: 0.5186
 epoch: 85, train_loss: 0.8682, test_loss: 0.9212, test_f1: 0.5180
 epoch: 86, train_loss: 0.8568, test_loss: 0.9140, test_f1: 0.5247
 epoch: 87, train_loss: 0.8580, test_loss: 0.9211, test_f1: 0.5158
 epoch: 88, train_loss: 0.8716, test_loss: 0.9156, test_f1: 0.5279
 epoch: 89, train_loss: 0.8676, test_loss: 0.9172, test_f1: 0.5131
 epoch: 90, train_loss: 0.8625, test_loss: 0.9157, test_f1: 0.5153
 epoch: 91, train_loss: 0.8698, test_loss: 0.9242, test_f1: 0.5180
 epoch: 92, train_loss: 0.8613, test_loss: 0.9165, test_f1: 0.5238
 epoch: 93, train_loss: 0.8469, test_loss: 0.9295, test_f1: 0.5118
 epoch: 94, train_loss: 0.8585, test_loss: 0.9197, test_f1: 0.5223
 epoch: 95, train_loss: 0.8607, test_loss: 0.9172, test_f1: 0.5264
 epoch: 96, train_loss: 0.8530, test_loss: 0.9191, test_f1: 0.5233
 epoch: 97, train_loss: 0.8531, test_loss: 0.9230, test_f1: 0.5242
 epoch: 98, train_loss: 0.8600, test_loss: 0.9344, test_f1: 0.5132
 epoch: 99, train_loss: 0.8559, test_loss: 0.9219, test_f1: 0.5241
##################ITERATION #5 ****************************************
 epoch: 0, train_loss: 1.3026, test_loss: 1.3666, test_f1: 0.2270
 epoch: 1, train_loss: 1.2634, test_loss: 1.2783, test_f1: 0.2664
 epoch: 2, train_loss: 1.2433, test_loss: 1.2379, test_f1: 0.2823
 epoch: 3, train_loss: 1.2316, test_loss: 1.2015, test_f1: 0.3223
 epoch: 4, train_loss: 1.2213, test_loss: 1.1833, test_f1: 0.3611
 epoch: 5, train_loss: 1.2033, test_loss: 1.1581, test_f1: 0.3844
 epoch: 6, train_loss: 1.1926, test_loss: 1.1481, test_f1: 0.4204
 epoch: 7, train_loss: 1.1759, test_loss: 1.1336, test_f1: 0.4256
 epoch: 8, train_loss: 1.1658, test_loss: 1.1231, test_f1: 0.4290
 epoch: 9, train_loss: 1.1672, test_loss: 1.1103, test_f1: 0.4433
 epoch: 10, train_loss: 1.1494, test_loss: 1.0978, test_f1: 0.4510
 epoch: 11, train_loss: 1.1417, test_loss: 1.0852, test_f1: 0.4573
 epoch: 12, train_loss: 1.1351, test_loss: 1.0767, test_f1: 0.4563
 epoch: 13, train_loss: 1.1268, test_loss: 1.0695, test_f1: 0.4525
 epoch: 14, train_loss: 1.1078, test_loss: 1.0667, test_f1: 0.4516
 epoch: 15, train_loss: 1.1060, test_loss: 1.0445, test_f1: 0.4550
 epoch: 16, train_loss: 1.0957, test_loss: 1.0415, test_f1: 0.4594
 epoch: 17, train_loss: 1.0900, test_loss: 1.0355, test_f1: 0.4536
 epoch: 18, train_loss: 1.0835, test_loss: 1.0283, test_f1: 0.4605
 epoch: 19, train_loss: 1.0708, test_loss: 1.0211, test_f1: 0.4645
 epoch: 20, train_loss: 1.0625, test_loss: 1.0183, test_f1: 0.4601
 epoch: 21, train_loss: 1.0547, test_loss: 1.0162, test_f1: 0.4534
 epoch: 22, train_loss: 1.0501, test_loss: 1.0017, test_f1: 0.4667
 epoch: 23, train_loss: 1.0440, test_loss: 1.0031, test_f1: 0.4625
 epoch: 24, train_loss: 1.0365, test_loss: 0.9965, test_f1: 0.4588
 epoch: 25, train_loss: 1.0378, test_loss: 0.9911, test_f1: 0.4645
 epoch: 26, train_loss: 1.0313, test_loss: 0.9866, test_f1: 0.4609
 epoch: 27, train_loss: 1.0274, test_loss: 0.9855, test_f1: 0.4612
 epoch: 28, train_loss: 1.0174, test_loss: 0.9823, test_f1: 0.4677
 epoch: 29, train_loss: 1.0135, test_loss: 0.9777, test_f1: 0.4729
 epoch: 30, train_loss: 1.0069, test_loss: 0.9709, test_f1: 0.4774
 epoch: 31, train_loss: 0.9935, test_loss: 0.9767, test_f1: 0.4708
 epoch: 32, train_loss: 1.0036, test_loss: 0.9798, test_f1: 0.4697
 epoch: 33, train_loss: 1.0024, test_loss: 0.9596, test_f1: 0.4706
 epoch: 34, train_loss: 0.9983, test_loss: 0.9573, test_f1: 0.4748
 epoch: 35, train_loss: 0.9864, test_loss: 0.9765, test_f1: 0.4726
 epoch: 36, train_loss: 0.9925, test_loss: 0.9663, test_f1: 0.4811
 epoch: 37, train_loss: 0.9820, test_loss: 0.9618, test_f1: 0.4807
 epoch: 38, train_loss: 0.9741, test_loss: 0.9584, test_f1: 0.4901
 epoch: 39, train_loss: 0.9761, test_loss: 0.9611, test_f1: 0.4802
 epoch: 40, train_loss: 0.9717, test_loss: 0.9538, test_f1: 0.4873
 epoch: 41, train_loss: 0.9587, test_loss: 0.9604, test_f1: 0.4902
 epoch: 42, train_loss: 0.9712, test_loss: 0.9556, test_f1: 0.4957
 epoch: 43, train_loss: 0.9675, test_loss: 0.9528, test_f1: 0.4905
 epoch: 44, train_loss: 0.9599, test_loss: 0.9528, test_f1: 0.4906
 epoch: 45, train_loss: 0.9444, test_loss: 0.9454, test_f1: 0.4855
 epoch: 46, train_loss: 0.9489, test_loss: 0.9540, test_f1: 0.4880
 epoch: 47, train_loss: 0.9480, test_loss: 0.9501, test_f1: 0.4966
 epoch: 48, train_loss: 0.9493, test_loss: 0.9575, test_f1: 0.4891
 epoch: 49, train_loss: 0.9444, test_loss: 0.9492, test_f1: 0.4893
 epoch: 50, train_loss: 0.9429, test_loss: 0.9535, test_f1: 0.4888
 epoch: 51, train_loss: 0.9388, test_loss: 0.9473, test_f1: 0.4948
 epoch: 52, train_loss: 0.9363, test_loss: 0.9471, test_f1: 0.4917
 epoch: 53, train_loss: 0.9285, test_loss: 0.9482, test_f1: 0.4935
 epoch: 54, train_loss: 0.9313, test_loss: 0.9571, test_f1: 0.4871
 epoch: 55, train_loss: 0.9309, test_loss: 0.9560, test_f1: 0.4967
 epoch: 56, train_loss: 0.9344, test_loss: 0.9575, test_f1: 0.4928
 epoch: 57, train_loss: 0.9311, test_loss: 0.9594, test_f1: 0.4902
 epoch: 58, train_loss: 0.9316, test_loss: 0.9610, test_f1: 0.4903
 epoch: 59, train_loss: 0.9355, test_loss: 0.9533, test_f1: 0.5023
 epoch: 60, train_loss: 0.9207, test_loss: 0.9688, test_f1: 0.4979
 epoch: 61, train_loss: 0.9243, test_loss: 0.9550, test_f1: 0.4941
 epoch: 62, train_loss: 0.9261, test_loss: 0.9532, test_f1: 0.4898
 epoch: 63, train_loss: 0.9260, test_loss: 0.9616, test_f1: 0.4922
 epoch: 64, train_loss: 0.9268, test_loss: 0.9554, test_f1: 0.4936
 epoch: 65, train_loss: 0.9196, test_loss: 0.9643, test_f1: 0.4956
 epoch: 66, train_loss: 0.9146, test_loss: 0.9587, test_f1: 0.5001
 epoch: 67, train_loss: 0.9125, test_loss: 0.9530, test_f1: 0.4995
 epoch: 68, train_loss: 0.9118, test_loss: 0.9425, test_f1: 0.5016
 epoch: 69, train_loss: 0.9084, test_loss: 0.9469, test_f1: 0.4972
 epoch: 70, train_loss: 0.9102, test_loss: 0.9470, test_f1: 0.5006
 epoch: 71, train_loss: 0.9173, test_loss: 0.9437, test_f1: 0.5020
 epoch: 72, train_loss: 0.9155, test_loss: 0.9449, test_f1: 0.5036
 epoch: 73, train_loss: 0.9079, test_loss: 0.9522, test_f1: 0.4963
 epoch: 74, train_loss: 0.9103, test_loss: 0.9508, test_f1: 0.5102
 epoch: 75, train_loss: 0.9170, test_loss: 0.9562, test_f1: 0.5040
 epoch: 76, train_loss: 0.9074, test_loss: 0.9464, test_f1: 0.5030
 epoch: 77, train_loss: 0.9086, test_loss: 0.9575, test_f1: 0.5030
 epoch: 78, train_loss: 0.9114, test_loss: 0.9481, test_f1: 0.5086
 epoch: 79, train_loss: 0.9098, test_loss: 0.9603, test_f1: 0.5007
 epoch: 80, train_loss: 0.9068, test_loss: 0.9461, test_f1: 0.5005
 epoch: 81, train_loss: 0.8995, test_loss: 0.9500, test_f1: 0.5031
 epoch: 82, train_loss: 0.9014, test_loss: 0.9471, test_f1: 0.5120
 epoch: 83, train_loss: 0.9090, test_loss: 0.9556, test_f1: 0.5043
 epoch: 84, train_loss: 0.8983, test_loss: 0.9667, test_f1: 0.5000
 epoch: 85, train_loss: 0.9020, test_loss: 0.9569, test_f1: 0.5112
 epoch: 86, train_loss: 0.9003, test_loss: 0.9582, test_f1: 0.5082
 epoch: 87, train_loss: 0.8930, test_loss: 0.9474, test_f1: 0.5102
 epoch: 88, train_loss: 0.8946, test_loss: 0.9514, test_f1: 0.5132
 epoch: 89, train_loss: 0.9017, test_loss: 0.9489, test_f1: 0.5113
 epoch: 90, train_loss: 0.8868, test_loss: 0.9476, test_f1: 0.5122
 epoch: 91, train_loss: 0.8956, test_loss: 0.9458, test_f1: 0.5174
 epoch: 92, train_loss: 0.8931, test_loss: 0.9405, test_f1: 0.5039
 epoch: 93, train_loss: 0.8987, test_loss: 0.9485, test_f1: 0.5196
 epoch: 94, train_loss: 0.8912, test_loss: 0.9565, test_f1: 0.5110
 epoch: 95, train_loss: 0.8920, test_loss: 0.9528, test_f1: 0.5131
 epoch: 96, train_loss: 0.8904, test_loss: 0.9553, test_f1: 0.5177
 epoch: 97, train_loss: 0.8778, test_loss: 0.9528, test_f1: 0.5087
 epoch: 98, train_loss: 0.8910, test_loss: 0.9552, test_f1: 0.5112
 epoch: 99, train_loss: 0.8866, test_loss: 0.9566, test_f1: 0.5102
##################ITERATION #6 ****************************************
 epoch: 0, train_loss: 1.3335, test_loss: 1.3085, test_f1: 0.2270
 epoch: 1, train_loss: 1.2712, test_loss: 1.2520, test_f1: 0.2685
 epoch: 2, train_loss: 1.2577, test_loss: 1.2231, test_f1: 0.2957
 epoch: 3, train_loss: 1.2316, test_loss: 1.2043, test_f1: 0.2922
 epoch: 4, train_loss: 1.2110, test_loss: 1.1866, test_f1: 0.3081
 epoch: 5, train_loss: 1.2029, test_loss: 1.1741, test_f1: 0.3331
 epoch: 6, train_loss: 1.1928, test_loss: 1.1588, test_f1: 0.3599
 epoch: 7, train_loss: 1.1760, test_loss: 1.1443, test_f1: 0.3872
 epoch: 8, train_loss: 1.1660, test_loss: 1.1295, test_f1: 0.3979
 epoch: 9, train_loss: 1.1619, test_loss: 1.1143, test_f1: 0.3955
 epoch: 10, train_loss: 1.1420, test_loss: 1.1046, test_f1: 0.4039
 epoch: 11, train_loss: 1.1329, test_loss: 1.0917, test_f1: 0.4211
 epoch: 12, train_loss: 1.1245, test_loss: 1.0788, test_f1: 0.4265
 epoch: 13, train_loss: 1.1039, test_loss: 1.0717, test_f1: 0.4252
 epoch: 14, train_loss: 1.1047, test_loss: 1.0539, test_f1: 0.4403
 epoch: 15, train_loss: 1.0983, test_loss: 1.0444, test_f1: 0.4474
 epoch: 16, train_loss: 1.0879, test_loss: 1.0359, test_f1: 0.4463
 epoch: 17, train_loss: 1.0767, test_loss: 1.0279, test_f1: 0.4462
 epoch: 18, train_loss: 1.0671, test_loss: 1.0186, test_f1: 0.4510
 epoch: 19, train_loss: 1.0593, test_loss: 1.0101, test_f1: 0.4494
 epoch: 20, train_loss: 1.0474, test_loss: 1.0042, test_f1: 0.4542
 epoch: 21, train_loss: 1.0477, test_loss: 0.9998, test_f1: 0.4559
 epoch: 22, train_loss: 1.0390, test_loss: 1.0002, test_f1: 0.4530
 epoch: 23, train_loss: 1.0416, test_loss: 0.9917, test_f1: 0.4557
 epoch: 24, train_loss: 1.0321, test_loss: 0.9894, test_f1: 0.4578
 epoch: 25, train_loss: 1.0268, test_loss: 0.9901, test_f1: 0.4536
 epoch: 26, train_loss: 1.0174, test_loss: 0.9820, test_f1: 0.4639
 epoch: 27, train_loss: 1.0131, test_loss: 0.9857, test_f1: 0.4532
 epoch: 28, train_loss: 1.0179, test_loss: 0.9871, test_f1: 0.4569
 epoch: 29, train_loss: 1.0065, test_loss: 0.9795, test_f1: 0.4660
 epoch: 30, train_loss: 1.0095, test_loss: 0.9707, test_f1: 0.4659
 epoch: 31, train_loss: 1.0003, test_loss: 0.9717, test_f1: 0.4693
 epoch: 32, train_loss: 1.0014, test_loss: 0.9757, test_f1: 0.4644
 epoch: 33, train_loss: 0.9940, test_loss: 0.9724, test_f1: 0.4678
 epoch: 34, train_loss: 0.9931, test_loss: 0.9728, test_f1: 0.4708
 epoch: 35, train_loss: 0.9899, test_loss: 0.9710, test_f1: 0.4663
 epoch: 36, train_loss: 0.9758, test_loss: 0.9691, test_f1: 0.4918
 epoch: 37, train_loss: 0.9753, test_loss: 0.9631, test_f1: 0.4770
 epoch: 38, train_loss: 0.9797, test_loss: 0.9659, test_f1: 0.4795
 epoch: 39, train_loss: 0.9732, test_loss: 0.9661, test_f1: 0.4980
 epoch: 40, train_loss: 0.9702, test_loss: 0.9628, test_f1: 0.4829
 epoch: 41, train_loss: 0.9656, test_loss: 0.9695, test_f1: 0.4816
 epoch: 42, train_loss: 0.9689, test_loss: 0.9556, test_f1: 0.4835
 epoch: 43, train_loss: 0.9559, test_loss: 0.9587, test_f1: 0.4799
 epoch: 44, train_loss: 0.9618, test_loss: 0.9523, test_f1: 0.4927
 epoch: 45, train_loss: 0.9567, test_loss: 0.9593, test_f1: 0.4947
 epoch: 46, train_loss: 0.9508, test_loss: 0.9556, test_f1: 0.4933
 epoch: 47, train_loss: 0.9555, test_loss: 0.9543, test_f1: 0.4973
 epoch: 48, train_loss: 0.9550, test_loss: 0.9649, test_f1: 0.4950
 epoch: 49, train_loss: 0.9450, test_loss: 0.9617, test_f1: 0.5072
 epoch: 50, train_loss: 0.9447, test_loss: 0.9514, test_f1: 0.4914
 epoch: 51, train_loss: 0.9403, test_loss: 0.9531, test_f1: 0.4985
 epoch: 52, train_loss: 0.9423, test_loss: 0.9571, test_f1: 0.4965
 epoch: 53, train_loss: 0.9419, test_loss: 0.9523, test_f1: 0.4930
 epoch: 54, train_loss: 0.9349, test_loss: 0.9558, test_f1: 0.5079
 epoch: 55, train_loss: 0.9375, test_loss: 0.9511, test_f1: 0.5012
 epoch: 56, train_loss: 0.9288, test_loss: 0.9509, test_f1: 0.5097
 epoch: 57, train_loss: 0.9436, test_loss: 0.9573, test_f1: 0.5072
 epoch: 58, train_loss: 0.9346, test_loss: 0.9529, test_f1: 0.5127
 epoch: 59, train_loss: 0.9407, test_loss: 0.9562, test_f1: 0.5031
 epoch: 60, train_loss: 0.9326, test_loss: 0.9512, test_f1: 0.5095
 epoch: 61, train_loss: 0.9390, test_loss: 0.9605, test_f1: 0.5110
 epoch: 62, train_loss: 0.9365, test_loss: 0.9429, test_f1: 0.5067
 epoch: 63, train_loss: 0.9385, test_loss: 0.9494, test_f1: 0.5062
 epoch: 64, train_loss: 0.9428, test_loss: 0.9544, test_f1: 0.5016
 epoch: 65, train_loss: 0.9310, test_loss: 0.9506, test_f1: 0.5034
 epoch: 66, train_loss: 0.9346, test_loss: 0.9530, test_f1: 0.5183
 epoch: 67, train_loss: 0.9311, test_loss: 0.9516, test_f1: 0.5105
 epoch: 68, train_loss: 0.9249, test_loss: 0.9462, test_f1: 0.5135
 epoch: 69, train_loss: 0.9270, test_loss: 0.9556, test_f1: 0.5105
 epoch: 70, train_loss: 0.9277, test_loss: 0.9497, test_f1: 0.5167
 epoch: 71, train_loss: 0.9258, test_loss: 0.9553, test_f1: 0.5147
 epoch: 72, train_loss: 0.9215, test_loss: 0.9504, test_f1: 0.5129
 epoch: 73, train_loss: 0.9236, test_loss: 0.9501, test_f1: 0.5097
 epoch: 74, train_loss: 0.9311, test_loss: 0.9420, test_f1: 0.5084
 epoch: 75, train_loss: 0.9121, test_loss: 0.9496, test_f1: 0.5125
 epoch: 76, train_loss: 0.9198, test_loss: 0.9577, test_f1: 0.5140
 epoch: 77, train_loss: 0.9217, test_loss: 0.9563, test_f1: 0.5149
 epoch: 78, train_loss: 0.9233, test_loss: 0.9550, test_f1: 0.5167
 epoch: 79, train_loss: 0.9224, test_loss: 0.9545, test_f1: 0.5196
 epoch: 80, train_loss: 0.9187, test_loss: 0.9576, test_f1: 0.5102
 epoch: 81, train_loss: 0.9187, test_loss: 0.9516, test_f1: 0.5170
 epoch: 82, train_loss: 0.9146, test_loss: 0.9420, test_f1: 0.5183
 epoch: 83, train_loss: 0.9202, test_loss: 0.9531, test_f1: 0.5145
 epoch: 84, train_loss: 0.9149, test_loss: 0.9486, test_f1: 0.5173
 epoch: 85, train_loss: 0.9194, test_loss: 0.9548, test_f1: 0.5161
 epoch: 86, train_loss: 0.9081, test_loss: 0.9542, test_f1: 0.5154
 epoch: 87, train_loss: 0.9187, test_loss: 0.9479, test_f1: 0.5127
 epoch: 88, train_loss: 0.9041, test_loss: 0.9522, test_f1: 0.5136
 epoch: 89, train_loss: 0.9150, test_loss: 0.9590, test_f1: 0.5167
 epoch: 90, train_loss: 0.9023, test_loss: 0.9570, test_f1: 0.5223
 epoch: 91, train_loss: 0.9135, test_loss: 0.9541, test_f1: 0.5259
 epoch: 92, train_loss: 0.9065, test_loss: 0.9561, test_f1: 0.5225
 epoch: 93, train_loss: 0.9149, test_loss: 0.9590, test_f1: 0.5145
 epoch: 94, train_loss: 0.8989, test_loss: 0.9489, test_f1: 0.5213
 epoch: 95, train_loss: 0.9008, test_loss: 0.9517, test_f1: 0.5207
 epoch: 96, train_loss: 0.9145, test_loss: 0.9594, test_f1: 0.5265
 epoch: 97, train_loss: 0.9101, test_loss: 0.9610, test_f1: 0.5299
 epoch: 98, train_loss: 0.9054, test_loss: 0.9515, test_f1: 0.5231
 epoch: 99, train_loss: 0.9059, test_loss: 0.9552, test_f1: 0.5223
##################ITERATION #7 ****************************************
 epoch: 0, train_loss: 1.3285, test_loss: 1.3036, test_f1: 0.2270
 epoch: 1, train_loss: 1.2811, test_loss: 1.2464, test_f1: 0.2611
 epoch: 2, train_loss: 1.2543, test_loss: 1.2243, test_f1: 0.2934
 epoch: 3, train_loss: 1.2268, test_loss: 1.2044, test_f1: 0.3038
 epoch: 4, train_loss: 1.2254, test_loss: 1.1869, test_f1: 0.3231
 epoch: 5, train_loss: 1.2028, test_loss: 1.1741, test_f1: 0.3401
 epoch: 6, train_loss: 1.1999, test_loss: 1.1578, test_f1: 0.3499
 epoch: 7, train_loss: 1.1869, test_loss: 1.1444, test_f1: 0.3779
 epoch: 8, train_loss: 1.1707, test_loss: 1.1311, test_f1: 0.3895
 epoch: 9, train_loss: 1.1628, test_loss: 1.1224, test_f1: 0.3982
 epoch: 10, train_loss: 1.1548, test_loss: 1.1109, test_f1: 0.4122
 epoch: 11, train_loss: 1.1380, test_loss: 1.0996, test_f1: 0.4292
 epoch: 12, train_loss: 1.1363, test_loss: 1.0894, test_f1: 0.4285
 epoch: 13, train_loss: 1.1262, test_loss: 1.0793, test_f1: 0.4301
 epoch: 14, train_loss: 1.1111, test_loss: 1.0723, test_f1: 0.4353
 epoch: 15, train_loss: 1.1035, test_loss: 1.0561, test_f1: 0.4460
 epoch: 16, train_loss: 1.0902, test_loss: 1.0475, test_f1: 0.4482
 epoch: 17, train_loss: 1.0909, test_loss: 1.0410, test_f1: 0.4493
 epoch: 18, train_loss: 1.0828, test_loss: 1.0389, test_f1: 0.4462
 epoch: 19, train_loss: 1.0714, test_loss: 1.0301, test_f1: 0.4383
 epoch: 20, train_loss: 1.0569, test_loss: 1.0223, test_f1: 0.4369
 epoch: 21, train_loss: 1.0539, test_loss: 1.0140, test_f1: 0.4222
 epoch: 22, train_loss: 1.0412, test_loss: 1.0085, test_f1: 0.4424
 epoch: 23, train_loss: 1.0467, test_loss: 1.0000, test_f1: 0.4291
 epoch: 24, train_loss: 1.0299, test_loss: 0.9910, test_f1: 0.4367
 epoch: 25, train_loss: 1.0279, test_loss: 0.9867, test_f1: 0.4414
 epoch: 26, train_loss: 1.0209, test_loss: 0.9857, test_f1: 0.4628
 epoch: 27, train_loss: 1.0189, test_loss: 0.9771, test_f1: 0.4405
 epoch: 28, train_loss: 1.0211, test_loss: 0.9757, test_f1: 0.4433
 epoch: 29, train_loss: 1.0064, test_loss: 0.9717, test_f1: 0.4426
 epoch: 30, train_loss: 1.0016, test_loss: 0.9670, test_f1: 0.4500
 epoch: 31, train_loss: 0.9953, test_loss: 0.9601, test_f1: 0.4771
 epoch: 32, train_loss: 0.9976, test_loss: 0.9535, test_f1: 0.4732
 epoch: 33, train_loss: 0.9851, test_loss: 0.9540, test_f1: 0.4725
 epoch: 34, train_loss: 0.9865, test_loss: 0.9584, test_f1: 0.4522
 epoch: 35, train_loss: 0.9841, test_loss: 0.9581, test_f1: 0.4511
 epoch: 36, train_loss: 0.9702, test_loss: 0.9464, test_f1: 0.4709
 epoch: 37, train_loss: 0.9727, test_loss: 0.9449, test_f1: 0.4675
 epoch: 38, train_loss: 0.9658, test_loss: 0.9416, test_f1: 0.4626
 epoch: 39, train_loss: 0.9596, test_loss: 0.9348, test_f1: 0.4883
 epoch: 40, train_loss: 0.9571, test_loss: 0.9342, test_f1: 0.4883
 epoch: 41, train_loss: 0.9555, test_loss: 0.9307, test_f1: 0.4855
 epoch: 42, train_loss: 0.9538, test_loss: 0.9384, test_f1: 0.4687
 epoch: 43, train_loss: 0.9520, test_loss: 0.9313, test_f1: 0.4778
 epoch: 44, train_loss: 0.9442, test_loss: 0.9273, test_f1: 0.4677
 epoch: 45, train_loss: 0.9415, test_loss: 0.9235, test_f1: 0.4974
 epoch: 46, train_loss: 0.9435, test_loss: 0.9289, test_f1: 0.4807
 epoch: 47, train_loss: 0.9317, test_loss: 0.9252, test_f1: 0.4829
 epoch: 48, train_loss: 0.9363, test_loss: 0.9190, test_f1: 0.4704
 epoch: 49, train_loss: 0.9321, test_loss: 0.9208, test_f1: 0.4826
 epoch: 50, train_loss: 0.9169, test_loss: 0.9242, test_f1: 0.4826
 epoch: 51, train_loss: 0.9288, test_loss: 0.9164, test_f1: 0.4925
 epoch: 52, train_loss: 0.9129, test_loss: 0.9137, test_f1: 0.4872
 epoch: 53, train_loss: 0.9167, test_loss: 0.9130, test_f1: 0.5010
 epoch: 54, train_loss: 0.9135, test_loss: 0.9104, test_f1: 0.4837
 epoch: 55, train_loss: 0.9085, test_loss: 0.9149, test_f1: 0.4807
 epoch: 56, train_loss: 0.9096, test_loss: 0.9162, test_f1: 0.4876
 epoch: 57, train_loss: 0.9161, test_loss: 0.9099, test_f1: 0.4908
 epoch: 58, train_loss: 0.9106, test_loss: 0.9171, test_f1: 0.4807
 epoch: 59, train_loss: 0.9092, test_loss: 0.9105, test_f1: 0.4902
 epoch: 60, train_loss: 0.9096, test_loss: 0.9074, test_f1: 0.4921
 epoch: 61, train_loss: 0.9072, test_loss: 0.9086, test_f1: 0.5169
 epoch: 62, train_loss: 0.9052, test_loss: 0.9074, test_f1: 0.4894
 epoch: 63, train_loss: 0.9046, test_loss: 0.9099, test_f1: 0.5162
 epoch: 64, train_loss: 0.9007, test_loss: 0.9037, test_f1: 0.4970
 epoch: 65, train_loss: 0.8995, test_loss: 0.9092, test_f1: 0.5063
 epoch: 66, train_loss: 0.9004, test_loss: 0.9049, test_f1: 0.4987
 epoch: 67, train_loss: 0.8971, test_loss: 0.9046, test_f1: 0.5099
 epoch: 68, train_loss: 0.9011, test_loss: 0.9077, test_f1: 0.4919
 epoch: 69, train_loss: 0.8939, test_loss: 0.9044, test_f1: 0.4986
 epoch: 70, train_loss: 0.8917, test_loss: 0.9060, test_f1: 0.4952
 epoch: 71, train_loss: 0.8991, test_loss: 0.9069, test_f1: 0.5210
 epoch: 72, train_loss: 0.8831, test_loss: 0.9058, test_f1: 0.5146
 epoch: 73, train_loss: 0.8902, test_loss: 0.9073, test_f1: 0.4926
 epoch: 74, train_loss: 0.8960, test_loss: 0.9025, test_f1: 0.5042
 epoch: 75, train_loss: 0.8952, test_loss: 0.9103, test_f1: 0.5068
 epoch: 76, train_loss: 0.8965, test_loss: 0.9037, test_f1: 0.5064
 epoch: 77, train_loss: 0.8930, test_loss: 0.9000, test_f1: 0.4982
 epoch: 78, train_loss: 0.8878, test_loss: 0.9060, test_f1: 0.5146
 epoch: 79, train_loss: 0.8940, test_loss: 0.9070, test_f1: 0.5057
 epoch: 80, train_loss: 0.8886, test_loss: 0.8972, test_f1: 0.5098
 epoch: 81, train_loss: 0.8817, test_loss: 0.8980, test_f1: 0.5251
 epoch: 82, train_loss: 0.8764, test_loss: 0.8997, test_f1: 0.5284
 epoch: 83, train_loss: 0.8788, test_loss: 0.8923, test_f1: 0.5184
 epoch: 84, train_loss: 0.8904, test_loss: 0.8942, test_f1: 0.5208
 epoch: 85, train_loss: 0.8783, test_loss: 0.8983, test_f1: 0.5220
 epoch: 86, train_loss: 0.8761, test_loss: 0.8980, test_f1: 0.5110
 epoch: 87, train_loss: 0.8755, test_loss: 0.9022, test_f1: 0.5104
 epoch: 88, train_loss: 0.8770, test_loss: 0.9043, test_f1: 0.4983
 epoch: 89, train_loss: 0.8786, test_loss: 0.8966, test_f1: 0.5069
 epoch: 90, train_loss: 0.8675, test_loss: 0.9028, test_f1: 0.5110
 epoch: 91, train_loss: 0.8714, test_loss: 0.8981, test_f1: 0.4995
 epoch: 92, train_loss: 0.8733, test_loss: 0.8985, test_f1: 0.5297
 epoch: 93, train_loss: 0.8656, test_loss: 0.8969, test_f1: 0.5106
 epoch: 94, train_loss: 0.8728, test_loss: 0.9019, test_f1: 0.5146
 epoch: 95, train_loss: 0.8781, test_loss: 0.8929, test_f1: 0.5271
 epoch: 96, train_loss: 0.8706, test_loss: 0.8936, test_f1: 0.5226
 epoch: 97, train_loss: 0.8621, test_loss: 0.8965, test_f1: 0.5129
 epoch: 98, train_loss: 0.8694, test_loss: 0.8938, test_f1: 0.5226
 epoch: 99, train_loss: 0.8719, test_loss: 0.8932, test_f1: 0.5159
##################ITERATION #8 ****************************************
 epoch: 0, train_loss: 1.3005, test_loss: 1.3664, test_f1: 0.2528
 epoch: 1, train_loss: 1.2512, test_loss: 1.2406, test_f1: 0.2711
 epoch: 2, train_loss: 1.2271, test_loss: 1.2062, test_f1: 0.3212
 epoch: 3, train_loss: 1.2067, test_loss: 1.1817, test_f1: 0.3752
 epoch: 4, train_loss: 1.1966, test_loss: 1.1692, test_f1: 0.3815
 epoch: 5, train_loss: 1.1903, test_loss: 1.1603, test_f1: 0.3815
 epoch: 6, train_loss: 1.1662, test_loss: 1.1399, test_f1: 0.3863
 epoch: 7, train_loss: 1.1598, test_loss: 1.1319, test_f1: 0.3816
 epoch: 8, train_loss: 1.1487, test_loss: 1.1168, test_f1: 0.3894
 epoch: 9, train_loss: 1.1381, test_loss: 1.0995, test_f1: 0.4049
 epoch: 10, train_loss: 1.1279, test_loss: 1.1005, test_f1: 0.4022
 epoch: 11, train_loss: 1.1165, test_loss: 1.0852, test_f1: 0.4191
 epoch: 12, train_loss: 1.1154, test_loss: 1.0805, test_f1: 0.4209
 epoch: 13, train_loss: 1.1064, test_loss: 1.0877, test_f1: 0.4203
 epoch: 14, train_loss: 1.1020, test_loss: 1.0846, test_f1: 0.4068
 epoch: 15, train_loss: 1.0919, test_loss: 1.0724, test_f1: 0.4279
 epoch: 16, train_loss: 1.0898, test_loss: 1.0447, test_f1: 0.4427
 epoch: 17, train_loss: 1.0850, test_loss: 1.0741, test_f1: 0.4162
 epoch: 18, train_loss: 1.0639, test_loss: 1.0508, test_f1: 0.4398
 epoch: 19, train_loss: 1.0624, test_loss: 1.0520, test_f1: 0.4409
 epoch: 20, train_loss: 1.0644, test_loss: 1.0446, test_f1: 0.4516
 epoch: 21, train_loss: 1.0484, test_loss: 1.0406, test_f1: 0.4506
 epoch: 22, train_loss: 1.0397, test_loss: 1.0402, test_f1: 0.4505
 epoch: 23, train_loss: 1.0397, test_loss: 1.0237, test_f1: 0.4616
 epoch: 24, train_loss: 1.0386, test_loss: 1.0551, test_f1: 0.4540
 epoch: 25, train_loss: 1.0364, test_loss: 1.0245, test_f1: 0.4691
 epoch: 26, train_loss: 1.0289, test_loss: 1.0231, test_f1: 0.4724
 epoch: 27, train_loss: 1.0223, test_loss: 1.0301, test_f1: 0.4795
 epoch: 28, train_loss: 1.0242, test_loss: 1.0386, test_f1: 0.4744
 epoch: 29, train_loss: 1.0146, test_loss: 1.0244, test_f1: 0.4822
 epoch: 30, train_loss: 1.0040, test_loss: 1.0145, test_f1: 0.4779
 epoch: 31, train_loss: 1.0057, test_loss: 1.0164, test_f1: 0.4797
 epoch: 32, train_loss: 0.9986, test_loss: 1.0201, test_f1: 0.4870
 epoch: 33, train_loss: 1.0064, test_loss: 1.0117, test_f1: 0.4796
 epoch: 34, train_loss: 0.9908, test_loss: 1.0040, test_f1: 0.4807
 epoch: 35, train_loss: 0.9903, test_loss: 1.0013, test_f1: 0.4822
 epoch: 36, train_loss: 0.9838, test_loss: 1.0104, test_f1: 0.4994
 epoch: 37, train_loss: 0.9798, test_loss: 1.0020, test_f1: 0.5034
 epoch: 38, train_loss: 0.9920, test_loss: 1.0102, test_f1: 0.4930
 epoch: 39, train_loss: 0.9806, test_loss: 0.9875, test_f1: 0.4951
 epoch: 40, train_loss: 0.9735, test_loss: 0.9867, test_f1: 0.5017
 epoch: 41, train_loss: 0.9654, test_loss: 0.9954, test_f1: 0.4943
 epoch: 42, train_loss: 0.9740, test_loss: 1.0004, test_f1: 0.4957
 epoch: 43, train_loss: 0.9714, test_loss: 0.9942, test_f1: 0.4974
 epoch: 44, train_loss: 0.9611, test_loss: 1.0032, test_f1: 0.4876
 epoch: 45, train_loss: 0.9588, test_loss: 0.9825, test_f1: 0.5087
 epoch: 46, train_loss: 0.9653, test_loss: 0.9896, test_f1: 0.5025
 epoch: 47, train_loss: 0.9570, test_loss: 0.9871, test_f1: 0.5049
 epoch: 48, train_loss: 0.9550, test_loss: 0.9746, test_f1: 0.5139
 epoch: 49, train_loss: 0.9439, test_loss: 0.9807, test_f1: 0.5057
 epoch: 50, train_loss: 0.9531, test_loss: 0.9789, test_f1: 0.5122
 epoch: 51, train_loss: 0.9505, test_loss: 0.9758, test_f1: 0.5064
 epoch: 52, train_loss: 0.9363, test_loss: 0.9782, test_f1: 0.5135
 epoch: 53, train_loss: 0.9351, test_loss: 0.9690, test_f1: 0.5126
 epoch: 54, train_loss: 0.9407, test_loss: 0.9865, test_f1: 0.5064
 epoch: 55, train_loss: 0.9400, test_loss: 0.9763, test_f1: 0.5115
 epoch: 56, train_loss: 0.9292, test_loss: 0.9745, test_f1: 0.5069
 epoch: 57, train_loss: 0.9389, test_loss: 0.9670, test_f1: 0.5101
 epoch: 58, train_loss: 0.9229, test_loss: 0.9748, test_f1: 0.5079
 epoch: 59, train_loss: 0.9357, test_loss: 0.9666, test_f1: 0.5036
 epoch: 60, train_loss: 0.9271, test_loss: 0.9620, test_f1: 0.4999
 epoch: 61, train_loss: 0.9321, test_loss: 0.9682, test_f1: 0.5110
 epoch: 62, train_loss: 0.9333, test_loss: 0.9762, test_f1: 0.5114
 epoch: 63, train_loss: 0.9139, test_loss: 0.9749, test_f1: 0.5084
 epoch: 64, train_loss: 0.9336, test_loss: 0.9736, test_f1: 0.5136
 epoch: 65, train_loss: 0.9217, test_loss: 0.9737, test_f1: 0.5063
 epoch: 66, train_loss: 0.9192, test_loss: 0.9907, test_f1: 0.5029
 epoch: 67, train_loss: 0.9282, test_loss: 0.9749, test_f1: 0.5094
 epoch: 68, train_loss: 0.9227, test_loss: 0.9799, test_f1: 0.5062
 epoch: 69, train_loss: 0.9147, test_loss: 0.9693, test_f1: 0.5136
 epoch: 70, train_loss: 0.9192, test_loss: 0.9735, test_f1: 0.5085
 epoch: 71, train_loss: 0.9181, test_loss: 0.9793, test_f1: 0.5095
 epoch: 72, train_loss: 0.9201, test_loss: 0.9745, test_f1: 0.5121
 epoch: 73, train_loss: 0.9126, test_loss: 0.9752, test_f1: 0.5125
 epoch: 74, train_loss: 0.9141, test_loss: 0.9643, test_f1: 0.5175
 epoch: 75, train_loss: 0.9044, test_loss: 0.9705, test_f1: 0.5181
 epoch: 76, train_loss: 0.9157, test_loss: 0.9773, test_f1: 0.5137
 epoch: 77, train_loss: 0.9073, test_loss: 0.9760, test_f1: 0.5091
 epoch: 78, train_loss: 0.9110, test_loss: 0.9678, test_f1: 0.5106
 epoch: 79, train_loss: 0.9025, test_loss: 0.9725, test_f1: 0.5090
 epoch: 80, train_loss: 0.9036, test_loss: 0.9673, test_f1: 0.5136
 epoch: 81, train_loss: 0.8997, test_loss: 0.9698, test_f1: 0.4998
 epoch: 82, train_loss: 0.9096, test_loss: 0.9710, test_f1: 0.5074
 epoch: 83, train_loss: 0.9016, test_loss: 0.9631, test_f1: 0.5224
 epoch: 84, train_loss: 0.9030, test_loss: 0.9767, test_f1: 0.5151
 epoch: 85, train_loss: 0.9032, test_loss: 0.9734, test_f1: 0.5124
 epoch: 86, train_loss: 0.8986, test_loss: 0.9699, test_f1: 0.5170
 epoch: 87, train_loss: 0.8996, test_loss: 0.9739, test_f1: 0.5165
 epoch: 88, train_loss: 0.8967, test_loss: 0.9674, test_f1: 0.5239
 epoch: 89, train_loss: 0.9066, test_loss: 0.9715, test_f1: 0.5170
 epoch: 90, train_loss: 0.8959, test_loss: 0.9675, test_f1: 0.5198
 epoch: 91, train_loss: 0.8931, test_loss: 0.9843, test_f1: 0.5103
 epoch: 92, train_loss: 0.8934, test_loss: 0.9751, test_f1: 0.5164
 epoch: 93, train_loss: 0.8932, test_loss: 0.9689, test_f1: 0.5131
 epoch: 94, train_loss: 0.8910, test_loss: 0.9650, test_f1: 0.5172
 epoch: 95, train_loss: 0.8889, test_loss: 0.9688, test_f1: 0.5157
 epoch: 96, train_loss: 0.8976, test_loss: 0.9809, test_f1: 0.5121
 epoch: 97, train_loss: 0.8991, test_loss: 0.9777, test_f1: 0.5219
 epoch: 98, train_loss: 0.8906, test_loss: 0.9739, test_f1: 0.5134
 epoch: 99, train_loss: 0.8925, test_loss: 0.9763, test_f1: 0.5109
##################ITERATION #9 ****************************************
 epoch: 0, train_loss: 1.3645, test_loss: 1.3453, test_f1: 0.2270
 epoch: 1, train_loss: 1.2853, test_loss: 1.3236, test_f1: 0.3231
 epoch: 2, train_loss: 1.2570, test_loss: 1.2481, test_f1: 0.3505
 epoch: 3, train_loss: 1.2429, test_loss: 1.2267, test_f1: 0.3576
 epoch: 4, train_loss: 1.2295, test_loss: 1.2007, test_f1: 0.3571
 epoch: 5, train_loss: 1.2138, test_loss: 1.1821, test_f1: 0.3699
 epoch: 6, train_loss: 1.2034, test_loss: 1.1677, test_f1: 0.4047
 epoch: 7, train_loss: 1.1940, test_loss: 1.1451, test_f1: 0.4155
 epoch: 8, train_loss: 1.1816, test_loss: 1.1391, test_f1: 0.4209
 epoch: 9, train_loss: 1.1699, test_loss: 1.1361, test_f1: 0.4185
 epoch: 10, train_loss: 1.1570, test_loss: 1.1160, test_f1: 0.4311
 epoch: 11, train_loss: 1.1522, test_loss: 1.1031, test_f1: 0.4362
 epoch: 12, train_loss: 1.1518, test_loss: 1.0867, test_f1: 0.4377
 epoch: 13, train_loss: 1.1454, test_loss: 1.0759, test_f1: 0.4439
 epoch: 14, train_loss: 1.1391, test_loss: 1.0727, test_f1: 0.4493
 epoch: 15, train_loss: 1.1189, test_loss: 1.0603, test_f1: 0.4609
 epoch: 16, train_loss: 1.1141, test_loss: 1.0457, test_f1: 0.4858
 epoch: 17, train_loss: 1.1118, test_loss: 1.0439, test_f1: 0.4790
 epoch: 18, train_loss: 1.1014, test_loss: 1.0291, test_f1: 0.4858
 epoch: 19, train_loss: 1.0997, test_loss: 1.0365, test_f1: 0.4536
 epoch: 20, train_loss: 1.0915, test_loss: 1.0179, test_f1: 0.4916
 epoch: 21, train_loss: 1.0867, test_loss: 1.0048, test_f1: 0.4946
 epoch: 22, train_loss: 1.0789, test_loss: 1.0046, test_f1: 0.4855
 epoch: 23, train_loss: 1.0709, test_loss: 0.9967, test_f1: 0.4913
 epoch: 24, train_loss: 1.0695, test_loss: 0.9901, test_f1: 0.4995
 epoch: 25, train_loss: 1.0629, test_loss: 0.9826, test_f1: 0.5019
 epoch: 26, train_loss: 1.0653, test_loss: 0.9776, test_f1: 0.5081
 epoch: 27, train_loss: 1.0552, test_loss: 0.9802, test_f1: 0.4903
 epoch: 28, train_loss: 1.0409, test_loss: 0.9685, test_f1: 0.4942
 epoch: 29, train_loss: 1.0403, test_loss: 0.9675, test_f1: 0.4941
 epoch: 30, train_loss: 1.0423, test_loss: 0.9623, test_f1: 0.4962
 epoch: 31, train_loss: 1.0278, test_loss: 0.9665, test_f1: 0.4976
 epoch: 32, train_loss: 1.0319, test_loss: 0.9629, test_f1: 0.4887
 epoch: 33, train_loss: 1.0259, test_loss: 0.9588, test_f1: 0.5011
 epoch: 34, train_loss: 1.0216, test_loss: 0.9539, test_f1: 0.4951
 epoch: 35, train_loss: 1.0280, test_loss: 0.9506, test_f1: 0.4891
 epoch: 36, train_loss: 1.0102, test_loss: 0.9493, test_f1: 0.4993
 epoch: 37, train_loss: 1.0091, test_loss: 0.9454, test_f1: 0.4963
 epoch: 38, train_loss: 1.0076, test_loss: 0.9385, test_f1: 0.4938
 epoch: 39, train_loss: 0.9980, test_loss: 0.9458, test_f1: 0.4969
 epoch: 40, train_loss: 1.0040, test_loss: 0.9401, test_f1: 0.4989
 epoch: 41, train_loss: 1.0064, test_loss: 0.9354, test_f1: 0.5036
 epoch: 42, train_loss: 1.0000, test_loss: 0.9464, test_f1: 0.5042
 epoch: 43, train_loss: 0.9901, test_loss: 0.9307, test_f1: 0.5005
 epoch: 44, train_loss: 0.9999, test_loss: 0.9435, test_f1: 0.4992
 epoch: 45, train_loss: 0.9882, test_loss: 0.9344, test_f1: 0.5033
 epoch: 46, train_loss: 0.9814, test_loss: 0.9378, test_f1: 0.5022
 epoch: 47, train_loss: 0.9856, test_loss: 0.9260, test_f1: 0.5028
 epoch: 48, train_loss: 0.9743, test_loss: 0.9286, test_f1: 0.5031
 epoch: 49, train_loss: 0.9685, test_loss: 0.9420, test_f1: 0.4923
 epoch: 50, train_loss: 0.9861, test_loss: 0.9342, test_f1: 0.5001
 epoch: 51, train_loss: 0.9659, test_loss: 0.9173, test_f1: 0.5008
 epoch: 52, train_loss: 0.9728, test_loss: 0.9227, test_f1: 0.4942
 epoch: 53, train_loss: 0.9716, test_loss: 0.9204, test_f1: 0.4989
 epoch: 54, train_loss: 0.9684, test_loss: 0.9107, test_f1: 0.5024
 epoch: 55, train_loss: 0.9637, test_loss: 0.9145, test_f1: 0.4958
 epoch: 56, train_loss: 0.9676, test_loss: 0.9235, test_f1: 0.4991
 epoch: 57, train_loss: 0.9511, test_loss: 0.9340, test_f1: 0.4962
 epoch: 58, train_loss: 0.9543, test_loss: 0.9275, test_f1: 0.4976
 epoch: 59, train_loss: 0.9579, test_loss: 0.9234, test_f1: 0.5054
 epoch: 60, train_loss: 0.9566, test_loss: 0.9218, test_f1: 0.4971
 epoch: 61, train_loss: 0.9541, test_loss: 0.9208, test_f1: 0.5069
 epoch: 62, train_loss: 0.9513, test_loss: 0.9187, test_f1: 0.5079
 epoch: 63, train_loss: 0.9559, test_loss: 0.9244, test_f1: 0.4882
 epoch: 64, train_loss: 0.9477, test_loss: 0.8985, test_f1: 0.5043
 epoch: 65, train_loss: 0.9467, test_loss: 0.9243, test_f1: 0.4896
 epoch: 66, train_loss: 0.9481, test_loss: 0.9287, test_f1: 0.5000
 epoch: 67, train_loss: 0.9537, test_loss: 0.9128, test_f1: 0.5018
 epoch: 68, train_loss: 0.9453, test_loss: 0.9080, test_f1: 0.5068
 epoch: 69, train_loss: 0.9438, test_loss: 0.9127, test_f1: 0.4960
 epoch: 70, train_loss: 0.9542, test_loss: 0.9247, test_f1: 0.5008
 epoch: 71, train_loss: 0.9467, test_loss: 0.9157, test_f1: 0.5015
 epoch: 72, train_loss: 0.9556, test_loss: 0.9135, test_f1: 0.5020
 epoch: 73, train_loss: 0.9346, test_loss: 0.9151, test_f1: 0.5085
 epoch: 74, train_loss: 0.9400, test_loss: 0.9131, test_f1: 0.5070
 epoch: 75, train_loss: 0.9429, test_loss: 0.9075, test_f1: 0.5140
 epoch: 76, train_loss: 0.9326, test_loss: 0.9260, test_f1: 0.4946
 epoch: 77, train_loss: 0.9379, test_loss: 0.9281, test_f1: 0.5040
 epoch: 78, train_loss: 0.9405, test_loss: 0.9212, test_f1: 0.4955
 epoch: 79, train_loss: 0.9433, test_loss: 0.9322, test_f1: 0.5025
 epoch: 80, train_loss: 0.9284, test_loss: 0.9316, test_f1: 0.4931
 epoch: 81, train_loss: 0.9367, test_loss: 0.9228, test_f1: 0.4908
 epoch: 82, train_loss: 0.9299, test_loss: 0.9040, test_f1: 0.5021
 epoch: 83, train_loss: 0.9418, test_loss: 0.9167, test_f1: 0.4993
 epoch: 84, train_loss: 0.9284, test_loss: 0.9097, test_f1: 0.5058
 epoch: 85, train_loss: 0.9310, test_loss: 0.9233, test_f1: 0.5030
 epoch: 86, train_loss: 0.9446, test_loss: 0.9045, test_f1: 0.5008
 epoch: 87, train_loss: 0.9322, test_loss: 0.9238, test_f1: 0.5014
 epoch: 88, train_loss: 0.9211, test_loss: 0.9088, test_f1: 0.5182
 epoch: 89, train_loss: 0.9239, test_loss: 0.9140, test_f1: 0.5105
 epoch: 90, train_loss: 0.9267, test_loss: 0.9362, test_f1: 0.4970
 epoch: 91, train_loss: 0.9289, test_loss: 0.9255, test_f1: 0.4962
 epoch: 92, train_loss: 0.9243, test_loss: 0.9183, test_f1: 0.5088
 epoch: 93, train_loss: 0.9327, test_loss: 0.9385, test_f1: 0.5010
 epoch: 94, train_loss: 0.9176, test_loss: 0.9334, test_f1: 0.4958
 epoch: 95, train_loss: 0.9288, test_loss: 0.9284, test_f1: 0.5068
 epoch: 96, train_loss: 0.9254, test_loss: 0.9343, test_f1: 0.4940
 epoch: 97, train_loss: 0.9209, test_loss: 0.9187, test_f1: 0.5138
 epoch: 98, train_loss: 0.9178, test_loss: 0.9213, test_f1: 0.5123
 epoch: 99, train_loss: 0.9227, test_loss: 0.9410, test_f1: 0.4975

Training completed in 521.57 seconds
Best F1: 0.5597 at epoch 85
Mean F1 across iterations: 0.5290  0.0144
========================FINAL RESULTS================================
FEGIN weighted F1: 0.5597  0.0144
python main.py --data ltspice_examples --representation component_net --model FEGIN --layers 5 --hiddens 32 --batch_size 128 --lr 0.0001 --emb_size 250 --epochs 100 --save_appendix component_net_L5_H32_BS128_LR0.0001_E250 --no_val
-----



STDERR:
  File "main.py", line 370, in <module>
    main()
  File "main.py", line 254, in main
    dataset = dataset_class(
  File "/home/philip/projects/ltspice_examples_code_repo/Circuit-Completion-Using-GNNs/component_classification_with_link_prediction_head/evaluation/FEGIN/kernel/circuit_datasets.py", line 15, in __init__
    self.data, self.slices = torch.load(self.processed_paths[0])
  File "/home/philip/.local/lib/python3.8/site-packages/torch/serialization.py", line 1040, in load
    warnings.warn(
  File "/usr/lib/python3.8/warnings.py", line 109, in _showwarnmsg
    sw(msg.message, msg.category, msg.filename, msg.lineno,
  File "main.py", line 47, in warn_with_traceback
    traceback.print_stack(file=log)
/home/philip/projects/ltspice_examples_code_repo/Circuit-Completion-Using-GNNs/component_classification_with_link_prediction_head/evaluation/FEGIN/kernel/circuit_datasets.py:15: FutureWarning: You are using `torch.load` with `weights_only=False` (the current default value), which uses the default pickle module implicitly. It is possible to construct malicious pickle data which will execute arbitrary code during unpickling (See https://github.com/pytorch/pytorch/blob/main/SECURITY.md#untrusted-models for more details). In a future release, the default value for `weights_only` will be flipped to `True`. This limits the functions that could be executed during unpickling. Arbitrary objects will no longer be allowed to be loaded via this mode unless they are explicitly allowlisted by the user via `torch.serialization.add_safe_globals`. We recommend you start setting `weights_only=True` for any use case where you don't have full control of the loaded file. Please open an issue on GitHub for any issues related to this experimental feature.
  self.data, self.slices = torch.load(self.processed_paths[0])
