STDOUT:
Results will be saved in /home/philip/projects/ltspice_examples_code_repo/Circuit-Completion-Using-GNNs/component_classification_with_link_prediction_head/evaluation/FEGIN/results/model_FEGIN_dataset_ltspice_examples
Command line input: python main.py --data ltspice_examples --representation component_net --model FEGIN --layers 4 --hiddens 32 --batch_size 128 --lr 0.01 --emb_size 250 --epochs 100 --save_appendix component_net_L4_H32_BS128_LR0.01_E250 --no_val
 is saved.
-----
ltspice_examples - FEGIN
Using 4 layers, 32 hidden units, h = 2
Loading component_net representation dataset
ENTERED
Training FEGIN on component_net representation
Train: 3558, Test: 846
##################ITERATION #0 ****************************************
 epoch: 0, train_loss: 1.2413, test_loss: 1.1998, test_f1: 0.3357
 epoch: 1, train_loss: 1.0621, test_loss: 1.0053, test_f1: 0.4362
 epoch: 2, train_loss: 1.0080, test_loss: 1.0036, test_f1: 0.4556
 epoch: 3, train_loss: 0.9922, test_loss: 0.9706, test_f1: 0.4834
 epoch: 4, train_loss: 0.9700, test_loss: 1.0109, test_f1: 0.4786
 epoch: 5, train_loss: 0.9417, test_loss: 0.9422, test_f1: 0.5034
 epoch: 6, train_loss: 0.9356, test_loss: 1.0102, test_f1: 0.5170
 epoch: 7, train_loss: 0.9276, test_loss: 1.1079, test_f1: 0.4484
 epoch: 8, train_loss: 0.9170, test_loss: 0.8925, test_f1: 0.5344
 epoch: 9, train_loss: 0.9055, test_loss: 1.0847, test_f1: 0.4771
 epoch: 10, train_loss: 0.9097, test_loss: 1.0485, test_f1: 0.5026
 epoch: 11, train_loss: 0.8921, test_loss: 0.9988, test_f1: 0.5492
 epoch: 12, train_loss: 0.8976, test_loss: 1.0520, test_f1: 0.5254
 epoch: 13, train_loss: 0.8864, test_loss: 0.8955, test_f1: 0.5309
 epoch: 14, train_loss: 0.8683, test_loss: 0.9837, test_f1: 0.4986
 epoch: 15, train_loss: 0.8845, test_loss: 0.9380, test_f1: 0.5518
 epoch: 16, train_loss: 0.8684, test_loss: 1.0331, test_f1: 0.5290
 epoch: 17, train_loss: 0.8600, test_loss: 1.0424, test_f1: 0.5508
 epoch: 18, train_loss: 0.8442, test_loss: 0.9532, test_f1: 0.5510
 epoch: 19, train_loss: 0.8425, test_loss: 0.9814, test_f1: 0.5252
 epoch: 20, train_loss: 0.8378, test_loss: 0.9286, test_f1: 0.5386
 epoch: 21, train_loss: 0.8249, test_loss: 1.0677, test_f1: 0.5155
 epoch: 22, train_loss: 0.8353, test_loss: 1.0267, test_f1: 0.5423
 epoch: 23, train_loss: 0.8214, test_loss: 1.0179, test_f1: 0.5298
 epoch: 24, train_loss: 0.8275, test_loss: 0.9833, test_f1: 0.5873
 epoch: 25, train_loss: 0.7998, test_loss: 0.9692, test_f1: 0.5270
 epoch: 26, train_loss: 0.8023, test_loss: 0.9964, test_f1: 0.5732
 epoch: 27, train_loss: 0.7969, test_loss: 1.2384, test_f1: 0.4721
 epoch: 28, train_loss: 0.8030, test_loss: 0.9582, test_f1: 0.5909
 epoch: 29, train_loss: 0.7958, test_loss: 0.8956, test_f1: 0.5802
 epoch: 30, train_loss: 0.7911, test_loss: 0.9611, test_f1: 0.5337
 epoch: 31, train_loss: 0.7880, test_loss: 1.0123, test_f1: 0.5349
 epoch: 32, train_loss: 0.7721, test_loss: 1.0070, test_f1: 0.5158
 epoch: 33, train_loss: 0.7648, test_loss: 0.9502, test_f1: 0.5770
 epoch: 34, train_loss: 0.7638, test_loss: 1.0753, test_f1: 0.5572
 epoch: 35, train_loss: 0.7596, test_loss: 0.9239, test_f1: 0.6404
 epoch: 36, train_loss: 0.7508, test_loss: 0.8888, test_f1: 0.6153
 epoch: 37, train_loss: 0.7277, test_loss: 1.0219, test_f1: 0.5746
 epoch: 38, train_loss: 0.7505, test_loss: 1.0727, test_f1: 0.5984
 epoch: 39, train_loss: 0.7397, test_loss: 0.9790, test_f1: 0.6041
 epoch: 40, train_loss: 0.7520, test_loss: 0.9896, test_f1: 0.6042
 epoch: 41, train_loss: 0.7313, test_loss: 1.0670, test_f1: 0.5861
 epoch: 42, train_loss: 0.7286, test_loss: 0.9482, test_f1: 0.6233
 epoch: 43, train_loss: 0.7271, test_loss: 0.9262, test_f1: 0.6616
 epoch: 44, train_loss: 0.7113, test_loss: 1.0040, test_f1: 0.5994
 epoch: 45, train_loss: 0.7093, test_loss: 1.0109, test_f1: 0.6294
 epoch: 46, train_loss: 0.7053, test_loss: 0.9810, test_f1: 0.6212
 epoch: 47, train_loss: 0.7304, test_loss: 0.8794, test_f1: 0.6682
 epoch: 48, train_loss: 0.7125, test_loss: 0.9185, test_f1: 0.6028
 epoch: 49, train_loss: 0.6963, test_loss: 0.9824, test_f1: 0.6353
 epoch: 50, train_loss: 0.6884, test_loss: 0.9517, test_f1: 0.6436
 epoch: 51, train_loss: 0.6696, test_loss: 1.0347, test_f1: 0.5735
 epoch: 52, train_loss: 0.6554, test_loss: 0.9508, test_f1: 0.6418
 epoch: 53, train_loss: 0.6606, test_loss: 0.9239, test_f1: 0.6043
 epoch: 54, train_loss: 0.6331, test_loss: 0.9334, test_f1: 0.6650
 epoch: 55, train_loss: 0.6646, test_loss: 0.9722, test_f1: 0.6402
 epoch: 56, train_loss: 0.6371, test_loss: 0.9619, test_f1: 0.6380
 epoch: 57, train_loss: 0.6370, test_loss: 0.9805, test_f1: 0.6450
 epoch: 58, train_loss: 0.6218, test_loss: 0.9252, test_f1: 0.6522
 epoch: 59, train_loss: 0.6156, test_loss: 0.9499, test_f1: 0.6357
 epoch: 60, train_loss: 0.6286, test_loss: 0.9688, test_f1: 0.6685
 epoch: 61, train_loss: 0.6183, test_loss: 0.9746, test_f1: 0.6395
 epoch: 62, train_loss: 0.6214, test_loss: 0.9482, test_f1: 0.6684
 epoch: 63, train_loss: 0.6175, test_loss: 0.9285, test_f1: 0.6540
 epoch: 64, train_loss: 0.6087, test_loss: 1.0124, test_f1: 0.6184
 epoch: 65, train_loss: 0.6135, test_loss: 0.9558, test_f1: 0.6391
 epoch: 66, train_loss: 0.6166, test_loss: 1.0053, test_f1: 0.6555
 epoch: 67, train_loss: 0.6159, test_loss: 1.0234, test_f1: 0.6480
 epoch: 68, train_loss: 0.6185, test_loss: 0.9432, test_f1: 0.6387
 epoch: 69, train_loss: 0.6044, test_loss: 0.9489, test_f1: 0.6257
 epoch: 70, train_loss: 0.6360, test_loss: 1.0191, test_f1: 0.6198
 epoch: 71, train_loss: 0.6077, test_loss: 0.9640, test_f1: 0.6367
 epoch: 72, train_loss: 0.5808, test_loss: 0.9860, test_f1: 0.5910
 epoch: 73, train_loss: 0.5907, test_loss: 0.9749, test_f1: 0.6306
 epoch: 74, train_loss: 0.5784, test_loss: 1.0290, test_f1: 0.6459
 epoch: 75, train_loss: 0.6060, test_loss: 0.9575, test_f1: 0.6515
 epoch: 76, train_loss: 0.5903, test_loss: 0.9526, test_f1: 0.6342
 epoch: 77, train_loss: 0.5738, test_loss: 0.9475, test_f1: 0.6615
 epoch: 78, train_loss: 0.5868, test_loss: 0.9227, test_f1: 0.6644
 epoch: 79, train_loss: 0.5843, test_loss: 0.9712, test_f1: 0.6495
 epoch: 80, train_loss: 0.5777, test_loss: 1.0521, test_f1: 0.6421
 epoch: 81, train_loss: 0.5750, test_loss: 0.9343, test_f1: 0.6597
 epoch: 82, train_loss: 0.5573, test_loss: 0.9974, test_f1: 0.6368
 epoch: 83, train_loss: 0.5754, test_loss: 1.0621, test_f1: 0.6570
 epoch: 84, train_loss: 0.5654, test_loss: 1.0324, test_f1: 0.6330
 epoch: 85, train_loss: 0.5885, test_loss: 1.0183, test_f1: 0.6475
 epoch: 86, train_loss: 0.5795, test_loss: 0.9676, test_f1: 0.6346
 epoch: 87, train_loss: 0.5834, test_loss: 1.0544, test_f1: 0.6196
 epoch: 88, train_loss: 0.5707, test_loss: 0.9616, test_f1: 0.6654
 epoch: 89, train_loss: 0.5615, test_loss: 0.9800, test_f1: 0.6608
 epoch: 90, train_loss: 0.5706, test_loss: 0.9701, test_f1: 0.6702
 epoch: 91, train_loss: 0.5807, test_loss: 0.9884, test_f1: 0.6363
 epoch: 92, train_loss: 0.5694, test_loss: 1.0313, test_f1: 0.6404
 epoch: 93, train_loss: 0.5707, test_loss: 0.9833, test_f1: 0.6183
 epoch: 94, train_loss: 0.5657, test_loss: 1.0070, test_f1: 0.6681
 epoch: 95, train_loss: 0.5631, test_loss: 1.0025, test_f1: 0.6520
 epoch: 96, train_loss: 0.5497, test_loss: 1.0891, test_f1: 0.6483
 epoch: 97, train_loss: 0.5659, test_loss: 1.0063, test_f1: 0.6144
 epoch: 98, train_loss: 0.5546, test_loss: 1.0439, test_f1: 0.6294
 epoch: 99, train_loss: 0.5736, test_loss: 0.9837, test_f1: 0.6460
##################ITERATION #1 ****************************************
 epoch: 0, train_loss: 1.1890, test_loss: 1.1943, test_f1: 0.2689
 epoch: 1, train_loss: 1.0351, test_loss: 1.0193, test_f1: 0.4683
 epoch: 2, train_loss: 0.9747, test_loss: 1.0016, test_f1: 0.4800
 epoch: 3, train_loss: 0.9524, test_loss: 1.1810, test_f1: 0.3807
 epoch: 4, train_loss: 0.9331, test_loss: 0.9774, test_f1: 0.4962
 epoch: 5, train_loss: 0.9259, test_loss: 0.9756, test_f1: 0.5320
 epoch: 6, train_loss: 0.9147, test_loss: 0.9309, test_f1: 0.4936
 epoch: 7, train_loss: 0.9073, test_loss: 0.9343, test_f1: 0.5260
 epoch: 8, train_loss: 0.8951, test_loss: 0.9201, test_f1: 0.4978
 epoch: 9, train_loss: 0.8872, test_loss: 0.9869, test_f1: 0.5288
 epoch: 10, train_loss: 0.8878, test_loss: 0.9099, test_f1: 0.4993
 epoch: 11, train_loss: 0.8803, test_loss: 0.9710, test_f1: 0.4938
 epoch: 12, train_loss: 0.8710, test_loss: 0.9676, test_f1: 0.5331
 epoch: 13, train_loss: 0.8516, test_loss: 0.9406, test_f1: 0.5584
 epoch: 14, train_loss: 0.8367, test_loss: 0.9368, test_f1: 0.5832
 epoch: 15, train_loss: 0.8401, test_loss: 0.9722, test_f1: 0.5100
 epoch: 16, train_loss: 0.8327, test_loss: 0.9619, test_f1: 0.5305
 epoch: 17, train_loss: 0.8353, test_loss: 0.9124, test_f1: 0.5846
 epoch: 18, train_loss: 0.8162, test_loss: 0.9189, test_f1: 0.5295
 epoch: 19, train_loss: 0.8205, test_loss: 0.9586, test_f1: 0.5455
 epoch: 20, train_loss: 0.8250, test_loss: 0.9861, test_f1: 0.5623
 epoch: 21, train_loss: 0.8093, test_loss: 0.9634, test_f1: 0.5524
 epoch: 22, train_loss: 0.8129, test_loss: 0.9413, test_f1: 0.5442
 epoch: 23, train_loss: 0.8041, test_loss: 0.9344, test_f1: 0.5736
 epoch: 24, train_loss: 0.7738, test_loss: 0.9764, test_f1: 0.5167
 epoch: 25, train_loss: 0.7714, test_loss: 0.9725, test_f1: 0.5671
 epoch: 26, train_loss: 0.7794, test_loss: 0.9590, test_f1: 0.5758
 epoch: 27, train_loss: 0.7809, test_loss: 1.0146, test_f1: 0.5579
 epoch: 28, train_loss: 0.7781, test_loss: 1.0616, test_f1: 0.5895
 epoch: 29, train_loss: 0.7822, test_loss: 0.9919, test_f1: 0.5909
 epoch: 30, train_loss: 0.7649, test_loss: 0.8835, test_f1: 0.6211
 epoch: 31, train_loss: 0.7408, test_loss: 0.9533, test_f1: 0.6070
 epoch: 32, train_loss: 0.7605, test_loss: 0.9276, test_f1: 0.6037
 epoch: 33, train_loss: 0.7422, test_loss: 0.9375, test_f1: 0.5712
 epoch: 34, train_loss: 0.7297, test_loss: 0.9769, test_f1: 0.5743
 epoch: 35, train_loss: 0.7345, test_loss: 0.9845, test_f1: 0.5766
 epoch: 36, train_loss: 0.7311, test_loss: 0.9562, test_f1: 0.5947
 epoch: 37, train_loss: 0.7182, test_loss: 0.9035, test_f1: 0.6063
 epoch: 38, train_loss: 0.7423, test_loss: 0.9486, test_f1: 0.5753
 epoch: 39, train_loss: 0.7228, test_loss: 1.0147, test_f1: 0.5751
 epoch: 40, train_loss: 0.7127, test_loss: 0.9242, test_f1: 0.5971
 epoch: 41, train_loss: 0.7018, test_loss: 1.0067, test_f1: 0.5800
 epoch: 42, train_loss: 0.7032, test_loss: 0.8900, test_f1: 0.6082
 epoch: 43, train_loss: 0.6953, test_loss: 1.0345, test_f1: 0.5897
 epoch: 44, train_loss: 0.6716, test_loss: 1.0931, test_f1: 0.6195
 epoch: 45, train_loss: 0.6910, test_loss: 0.9361, test_f1: 0.5763
 epoch: 46, train_loss: 0.6923, test_loss: 0.9658, test_f1: 0.5979
 epoch: 47, train_loss: 0.7041, test_loss: 0.9624, test_f1: 0.6195
 epoch: 48, train_loss: 0.6800, test_loss: 0.9635, test_f1: 0.6177
 epoch: 49, train_loss: 0.6635, test_loss: 1.0212, test_f1: 0.5777
 epoch: 50, train_loss: 0.6449, test_loss: 1.0479, test_f1: 0.6008
 epoch: 51, train_loss: 0.6415, test_loss: 0.9824, test_f1: 0.6225
 epoch: 52, train_loss: 0.6228, test_loss: 0.9417, test_f1: 0.6411
 epoch: 53, train_loss: 0.5997, test_loss: 1.0303, test_f1: 0.6169
 epoch: 54, train_loss: 0.6114, test_loss: 0.9943, test_f1: 0.6246
 epoch: 55, train_loss: 0.6001, test_loss: 1.0653, test_f1: 0.6123
 epoch: 56, train_loss: 0.5854, test_loss: 1.0314, test_f1: 0.6539
 epoch: 57, train_loss: 0.5913, test_loss: 1.0275, test_f1: 0.6176
 epoch: 58, train_loss: 0.5838, test_loss: 0.9969, test_f1: 0.6406
 epoch: 59, train_loss: 0.5743, test_loss: 1.0307, test_f1: 0.6236
 epoch: 60, train_loss: 0.5747, test_loss: 0.9816, test_f1: 0.6506
 epoch: 61, train_loss: 0.5930, test_loss: 1.1202, test_f1: 0.6340
 epoch: 62, train_loss: 0.5681, test_loss: 1.0073, test_f1: 0.6352
 epoch: 63, train_loss: 0.5901, test_loss: 1.0746, test_f1: 0.6229
 epoch: 64, train_loss: 0.5702, test_loss: 1.0127, test_f1: 0.6073
 epoch: 65, train_loss: 0.5599, test_loss: 1.0743, test_f1: 0.6420
 epoch: 66, train_loss: 0.5399, test_loss: 1.0132, test_f1: 0.6547
 epoch: 67, train_loss: 0.5613, test_loss: 0.9699, test_f1: 0.6303
 epoch: 68, train_loss: 0.5454, test_loss: 1.1291, test_f1: 0.6452
 epoch: 69, train_loss: 0.5535, test_loss: 0.9963, test_f1: 0.6299
 epoch: 70, train_loss: 0.5545, test_loss: 1.0941, test_f1: 0.6389
 epoch: 71, train_loss: 0.5353, test_loss: 1.0650, test_f1: 0.6579
 epoch: 72, train_loss: 0.5433, test_loss: 1.0420, test_f1: 0.6416
 epoch: 73, train_loss: 0.5301, test_loss: 1.0450, test_f1: 0.6387
 epoch: 74, train_loss: 0.5345, test_loss: 1.0313, test_f1: 0.6463
 epoch: 75, train_loss: 0.5402, test_loss: 1.0889, test_f1: 0.6253
 epoch: 76, train_loss: 0.5243, test_loss: 1.0343, test_f1: 0.6396
 epoch: 77, train_loss: 0.5110, test_loss: 1.1024, test_f1: 0.6322
 epoch: 78, train_loss: 0.5277, test_loss: 1.1185, test_f1: 0.6316
 epoch: 79, train_loss: 0.5343, test_loss: 1.1361, test_f1: 0.6446
 epoch: 80, train_loss: 0.5304, test_loss: 1.1115, test_f1: 0.6062
 epoch: 81, train_loss: 0.5297, test_loss: 1.0920, test_f1: 0.6437
 epoch: 82, train_loss: 0.5269, test_loss: 1.0715, test_f1: 0.6520
 epoch: 83, train_loss: 0.5125, test_loss: 1.1486, test_f1: 0.6486
 epoch: 84, train_loss: 0.5140, test_loss: 1.1818, test_f1: 0.6403
 epoch: 85, train_loss: 0.5247, test_loss: 0.9808, test_f1: 0.6391
 epoch: 86, train_loss: 0.5011, test_loss: 1.1951, test_f1: 0.6291
 epoch: 87, train_loss: 0.5056, test_loss: 1.1509, test_f1: 0.6240
 epoch: 88, train_loss: 0.5084, test_loss: 1.0987, test_f1: 0.6369
 epoch: 89, train_loss: 0.5065, test_loss: 1.0642, test_f1: 0.6495
 epoch: 90, train_loss: 0.5078, test_loss: 1.0137, test_f1: 0.6327
 epoch: 91, train_loss: 0.5050, test_loss: 1.1155, test_f1: 0.5894
 epoch: 92, train_loss: 0.4983, test_loss: 1.0222, test_f1: 0.6467
 epoch: 93, train_loss: 0.4902, test_loss: 1.0978, test_f1: 0.6323
 epoch: 94, train_loss: 0.4851, test_loss: 1.1121, test_f1: 0.6390
 epoch: 95, train_loss: 0.4735, test_loss: 1.1123, test_f1: 0.6311
 epoch: 96, train_loss: 0.4936, test_loss: 1.1019, test_f1: 0.6425
 epoch: 97, train_loss: 0.4927, test_loss: 1.1490, test_f1: 0.6379
 epoch: 98, train_loss: 0.5110, test_loss: 1.0951, test_f1: 0.6548
 epoch: 99, train_loss: 0.4873, test_loss: 0.9803, test_f1: 0.6475
##################ITERATION #2 ****************************************
 epoch: 0, train_loss: 1.1716, test_loss: 1.2442, test_f1: 0.3320
 epoch: 1, train_loss: 1.0216, test_loss: 0.9880, test_f1: 0.4865
 epoch: 2, train_loss: 0.9807, test_loss: 0.9745, test_f1: 0.4732
 epoch: 3, train_loss: 0.9665, test_loss: 1.0651, test_f1: 0.4729
 epoch: 4, train_loss: 0.9428, test_loss: 0.9880, test_f1: 0.5183
 epoch: 5, train_loss: 0.9322, test_loss: 0.9914, test_f1: 0.5086
 epoch: 6, train_loss: 0.9214, test_loss: 1.0186, test_f1: 0.5201
 epoch: 7, train_loss: 0.9094, test_loss: 0.9559, test_f1: 0.4921
 epoch: 8, train_loss: 0.9138, test_loss: 0.9750, test_f1: 0.4934
 epoch: 9, train_loss: 0.9040, test_loss: 1.0019, test_f1: 0.4585
 epoch: 10, train_loss: 0.9003, test_loss: 0.9151, test_f1: 0.5342
 epoch: 11, train_loss: 0.8720, test_loss: 0.9792, test_f1: 0.5228
 epoch: 12, train_loss: 0.8685, test_loss: 0.9501, test_f1: 0.5401
 epoch: 13, train_loss: 0.8531, test_loss: 0.8911, test_f1: 0.5208
 epoch: 14, train_loss: 0.8681, test_loss: 0.9294, test_f1: 0.5173
 epoch: 15, train_loss: 0.8553, test_loss: 0.9358, test_f1: 0.5057
 epoch: 16, train_loss: 0.8451, test_loss: 0.9644, test_f1: 0.5309
 epoch: 17, train_loss: 0.8345, test_loss: 0.9533, test_f1: 0.5107
 epoch: 18, train_loss: 0.8458, test_loss: 0.9341, test_f1: 0.5285
 epoch: 19, train_loss: 0.8384, test_loss: 0.8195, test_f1: 0.5832
 epoch: 20, train_loss: 0.8223, test_loss: 0.9342, test_f1: 0.5966
 epoch: 21, train_loss: 0.7956, test_loss: 0.8677, test_f1: 0.5864
 epoch: 22, train_loss: 0.8181, test_loss: 0.9149, test_f1: 0.5603
 epoch: 23, train_loss: 0.8074, test_loss: 0.9585, test_f1: 0.5474
 epoch: 24, train_loss: 0.7873, test_loss: 1.0587, test_f1: 0.5397
 epoch: 25, train_loss: 0.7792, test_loss: 0.9073, test_f1: 0.5999
 epoch: 26, train_loss: 0.7820, test_loss: 1.3679, test_f1: 0.5152
 epoch: 27, train_loss: 0.7927, test_loss: 0.9247, test_f1: 0.5870
 epoch: 28, train_loss: 0.7727, test_loss: 0.8545, test_f1: 0.5875
 epoch: 29, train_loss: 0.7624, test_loss: 0.8940, test_f1: 0.6150
 epoch: 30, train_loss: 0.7496, test_loss: 0.9890, test_f1: 0.5634
 epoch: 31, train_loss: 0.7598, test_loss: 0.9358, test_f1: 0.5718
 epoch: 32, train_loss: 0.7619, test_loss: 0.9510, test_f1: 0.6131
 epoch: 33, train_loss: 0.7552, test_loss: 0.9058, test_f1: 0.6376
 epoch: 34, train_loss: 0.7533, test_loss: 0.8866, test_f1: 0.6186
 epoch: 35, train_loss: 0.7605, test_loss: 0.8293, test_f1: 0.6387
 epoch: 36, train_loss: 0.7257, test_loss: 0.9551, test_f1: 0.6256
 epoch: 37, train_loss: 0.7304, test_loss: 0.9291, test_f1: 0.6258
 epoch: 38, train_loss: 0.7305, test_loss: 0.8720, test_f1: 0.6256
 epoch: 39, train_loss: 0.7500, test_loss: 1.0080, test_f1: 0.5883
 epoch: 40, train_loss: 0.7306, test_loss: 0.8571, test_f1: 0.6215
 epoch: 41, train_loss: 0.7091, test_loss: 0.8929, test_f1: 0.6032
 epoch: 42, train_loss: 0.7066, test_loss: 0.8476, test_f1: 0.6330
 epoch: 43, train_loss: 0.6960, test_loss: 0.9014, test_f1: 0.6478
 epoch: 44, train_loss: 0.7013, test_loss: 0.9209, test_f1: 0.6308
 epoch: 45, train_loss: 0.6994, test_loss: 0.9248, test_f1: 0.6341
 epoch: 46, train_loss: 0.7096, test_loss: 0.8992, test_f1: 0.6144
 epoch: 47, train_loss: 0.7231, test_loss: 0.8824, test_f1: 0.6247
 epoch: 48, train_loss: 0.7028, test_loss: 0.9030, test_f1: 0.6573
 epoch: 49, train_loss: 0.7064, test_loss: 0.9967, test_f1: 0.6081
 epoch: 50, train_loss: 0.6931, test_loss: 0.8813, test_f1: 0.5754
 epoch: 51, train_loss: 0.6739, test_loss: 0.9696, test_f1: 0.6354
 epoch: 52, train_loss: 0.6594, test_loss: 0.9298, test_f1: 0.6731
 epoch: 53, train_loss: 0.6295, test_loss: 0.9731, test_f1: 0.6503
 epoch: 54, train_loss: 0.6262, test_loss: 1.0191, test_f1: 0.6081
 epoch: 55, train_loss: 0.6305, test_loss: 0.8945, test_f1: 0.6491
 epoch: 56, train_loss: 0.6313, test_loss: 1.0605, test_f1: 0.6404
 epoch: 57, train_loss: 0.6262, test_loss: 1.0343, test_f1: 0.6087
 epoch: 58, train_loss: 0.6115, test_loss: 1.0401, test_f1: 0.6566
 epoch: 59, train_loss: 0.6142, test_loss: 1.0028, test_f1: 0.6547
 epoch: 60, train_loss: 0.6187, test_loss: 0.9984, test_f1: 0.6581
 epoch: 61, train_loss: 0.6146, test_loss: 1.0127, test_f1: 0.6804
 epoch: 62, train_loss: 0.6004, test_loss: 0.9882, test_f1: 0.6660
 epoch: 63, train_loss: 0.6149, test_loss: 0.9609, test_f1: 0.6656
 epoch: 64, train_loss: 0.6098, test_loss: 1.0566, test_f1: 0.6216
 epoch: 65, train_loss: 0.5932, test_loss: 1.0046, test_f1: 0.6597
 epoch: 66, train_loss: 0.6004, test_loss: 0.9949, test_f1: 0.6596
 epoch: 67, train_loss: 0.6098, test_loss: 0.9799, test_f1: 0.6599
 epoch: 68, train_loss: 0.6041, test_loss: 1.0067, test_f1: 0.6421
 epoch: 69, train_loss: 0.5911, test_loss: 1.0313, test_f1: 0.6680
 epoch: 70, train_loss: 0.5753, test_loss: 0.9891, test_f1: 0.6485
 epoch: 71, train_loss: 0.5827, test_loss: 1.1184, test_f1: 0.6421
 epoch: 72, train_loss: 0.5834, test_loss: 1.0845, test_f1: 0.6516
 epoch: 73, train_loss: 0.5830, test_loss: 1.0662, test_f1: 0.6412
 epoch: 74, train_loss: 0.5721, test_loss: 1.0090, test_f1: 0.6546
 epoch: 75, train_loss: 0.5862, test_loss: 1.0984, test_f1: 0.6456
 epoch: 76, train_loss: 0.5839, test_loss: 1.0536, test_f1: 0.6409
 epoch: 77, train_loss: 0.5821, test_loss: 1.1181, test_f1: 0.6227
 epoch: 78, train_loss: 0.5854, test_loss: 1.0142, test_f1: 0.6761
 epoch: 79, train_loss: 0.5805, test_loss: 1.0756, test_f1: 0.6401
 epoch: 80, train_loss: 0.5646, test_loss: 1.0387, test_f1: 0.6545
 epoch: 81, train_loss: 0.5628, test_loss: 1.2486, test_f1: 0.6230
 epoch: 82, train_loss: 0.5586, test_loss: 1.0445, test_f1: 0.6472
 epoch: 83, train_loss: 0.5634, test_loss: 1.0786, test_f1: 0.6506
 epoch: 84, train_loss: 0.5627, test_loss: 1.0829, test_f1: 0.6441
 epoch: 85, train_loss: 0.5539, test_loss: 1.0654, test_f1: 0.6282
 epoch: 86, train_loss: 0.5458, test_loss: 1.0893, test_f1: 0.6269
 epoch: 87, train_loss: 0.5620, test_loss: 1.2037, test_f1: 0.6504
 epoch: 88, train_loss: 0.5460, test_loss: 1.1839, test_f1: 0.6665
 epoch: 89, train_loss: 0.5427, test_loss: 1.0749, test_f1: 0.6235
 epoch: 90, train_loss: 0.5514, test_loss: 1.0863, test_f1: 0.6369
 epoch: 91, train_loss: 0.5684, test_loss: 1.0680, test_f1: 0.6579
 epoch: 92, train_loss: 0.5419, test_loss: 1.1352, test_f1: 0.6394
 epoch: 93, train_loss: 0.5473, test_loss: 1.0916, test_f1: 0.6726
 epoch: 94, train_loss: 0.5435, test_loss: 1.0759, test_f1: 0.6658
 epoch: 95, train_loss: 0.5515, test_loss: 1.1029, test_f1: 0.6454
 epoch: 96, train_loss: 0.5589, test_loss: 1.1059, test_f1: 0.6400
 epoch: 97, train_loss: 0.5279, test_loss: 1.2173, test_f1: 0.6637
 epoch: 98, train_loss: 0.5538, test_loss: 1.1964, test_f1: 0.6756
 epoch: 99, train_loss: 0.5220, test_loss: 1.2014, test_f1: 0.6153
##################ITERATION #3 ****************************************
 epoch: 0, train_loss: 1.2800, test_loss: 1.1953, test_f1: 0.3780
 epoch: 1, train_loss: 1.1007, test_loss: 1.0143, test_f1: 0.4670
 epoch: 2, train_loss: 1.0111, test_loss: 1.0111, test_f1: 0.4945
 epoch: 3, train_loss: 1.0090, test_loss: 1.1220, test_f1: 0.4169
 epoch: 4, train_loss: 1.0014, test_loss: 1.1531, test_f1: 0.4135
 epoch: 5, train_loss: 0.9816, test_loss: 1.0818, test_f1: 0.4238
 epoch: 6, train_loss: 0.9483, test_loss: 0.9725, test_f1: 0.4843
 epoch: 7, train_loss: 0.9512, test_loss: 1.0336, test_f1: 0.4461
 epoch: 8, train_loss: 0.9344, test_loss: 1.0103, test_f1: 0.4897
 epoch: 9, train_loss: 0.9261, test_loss: 1.0426, test_f1: 0.5219
 epoch: 10, train_loss: 0.9206, test_loss: 1.0601, test_f1: 0.4662
 epoch: 11, train_loss: 0.9165, test_loss: 1.0185, test_f1: 0.4881
 epoch: 12, train_loss: 0.9133, test_loss: 1.0269, test_f1: 0.4935
 epoch: 13, train_loss: 0.9133, test_loss: 1.0778, test_f1: 0.4919
 epoch: 14, train_loss: 0.8949, test_loss: 0.9107, test_f1: 0.5139
 epoch: 15, train_loss: 0.8943, test_loss: 1.0877, test_f1: 0.4825
 epoch: 16, train_loss: 0.8995, test_loss: 1.0707, test_f1: 0.4721
 epoch: 17, train_loss: 0.8736, test_loss: 1.0335, test_f1: 0.5082
 epoch: 18, train_loss: 0.8792, test_loss: 0.9491, test_f1: 0.5148
 epoch: 19, train_loss: 0.8898, test_loss: 0.9724, test_f1: 0.5031
 epoch: 20, train_loss: 0.8681, test_loss: 0.9852, test_f1: 0.5146
 epoch: 21, train_loss: 0.8608, test_loss: 0.9882, test_f1: 0.5602
 epoch: 22, train_loss: 0.8599, test_loss: 1.0637, test_f1: 0.4994
 epoch: 23, train_loss: 0.8523, test_loss: 0.9686, test_f1: 0.5682
 epoch: 24, train_loss: 0.8408, test_loss: 0.9613, test_f1: 0.5685
 epoch: 25, train_loss: 0.8509, test_loss: 0.9780, test_f1: 0.5786
 epoch: 26, train_loss: 0.8338, test_loss: 1.0545, test_f1: 0.5788
 epoch: 27, train_loss: 0.8216, test_loss: 1.0433, test_f1: 0.5562
 epoch: 28, train_loss: 0.8269, test_loss: 1.0062, test_f1: 0.5265
 epoch: 29, train_loss: 0.8201, test_loss: 0.9265, test_f1: 0.5511
 epoch: 30, train_loss: 0.8338, test_loss: 1.0385, test_f1: 0.5518
 epoch: 31, train_loss: 0.8140, test_loss: 1.0036, test_f1: 0.5287
 epoch: 32, train_loss: 0.8021, test_loss: 0.9269, test_f1: 0.5608
 epoch: 33, train_loss: 0.8372, test_loss: 1.0259, test_f1: 0.5572
 epoch: 34, train_loss: 0.8101, test_loss: 0.9927, test_f1: 0.5633
 epoch: 35, train_loss: 0.8119, test_loss: 1.0891, test_f1: 0.5132
 epoch: 36, train_loss: 0.7992, test_loss: 0.9760, test_f1: 0.5600
 epoch: 37, train_loss: 0.8079, test_loss: 1.0985, test_f1: 0.5325
 epoch: 38, train_loss: 0.8134, test_loss: 0.9656, test_f1: 0.5761
 epoch: 39, train_loss: 0.7909, test_loss: 1.0641, test_f1: 0.5552
 epoch: 40, train_loss: 0.7849, test_loss: 0.9438, test_f1: 0.5898
 epoch: 41, train_loss: 0.7660, test_loss: 1.0795, test_f1: 0.5600
 epoch: 42, train_loss: 0.7948, test_loss: 0.9547, test_f1: 0.5853
 epoch: 43, train_loss: 0.7991, test_loss: 0.9248, test_f1: 0.5730
 epoch: 44, train_loss: 0.7787, test_loss: 0.9490, test_f1: 0.6195
 epoch: 45, train_loss: 0.7903, test_loss: 0.8817, test_f1: 0.5936
 epoch: 46, train_loss: 0.7753, test_loss: 1.0125, test_f1: 0.5239
 epoch: 47, train_loss: 0.7696, test_loss: 1.0159, test_f1: 0.5953
 epoch: 48, train_loss: 0.7558, test_loss: 0.9150, test_f1: 0.6254
 epoch: 49, train_loss: 0.7490, test_loss: 0.9554, test_f1: 0.6480
 epoch: 50, train_loss: 0.7447, test_loss: 0.9739, test_f1: 0.6087
 epoch: 51, train_loss: 0.7373, test_loss: 0.9589, test_f1: 0.6295
 epoch: 52, train_loss: 0.7036, test_loss: 0.9029, test_f1: 0.6199
 epoch: 53, train_loss: 0.6893, test_loss: 1.0612, test_f1: 0.5951
 epoch: 54, train_loss: 0.6901, test_loss: 1.0124, test_f1: 0.6193
 epoch: 55, train_loss: 0.6908, test_loss: 1.0339, test_f1: 0.5902
 epoch: 56, train_loss: 0.6823, test_loss: 0.9743, test_f1: 0.6287
 epoch: 57, train_loss: 0.6983, test_loss: 1.0590, test_f1: 0.6027
 epoch: 58, train_loss: 0.6985, test_loss: 0.9625, test_f1: 0.6279
 epoch: 59, train_loss: 0.6911, test_loss: 0.9340, test_f1: 0.6320
 epoch: 60, train_loss: 0.6838, test_loss: 0.9675, test_f1: 0.6370
 epoch: 61, train_loss: 0.6708, test_loss: 1.0531, test_f1: 0.5768
 epoch: 62, train_loss: 0.6695, test_loss: 1.0162, test_f1: 0.6195
 epoch: 63, train_loss: 0.6749, test_loss: 1.0177, test_f1: 0.6027
 epoch: 64, train_loss: 0.6480, test_loss: 1.0673, test_f1: 0.6236
 epoch: 65, train_loss: 0.6671, test_loss: 1.1778, test_f1: 0.5891
 epoch: 66, train_loss: 0.6785, test_loss: 0.9983, test_f1: 0.6312
 epoch: 67, train_loss: 0.6605, test_loss: 1.0022, test_f1: 0.6163
 epoch: 68, train_loss: 0.6814, test_loss: 1.0310, test_f1: 0.6332
 epoch: 69, train_loss: 0.6723, test_loss: 1.0471, test_f1: 0.6015
 epoch: 70, train_loss: 0.6723, test_loss: 1.2105, test_f1: 0.6126
 epoch: 71, train_loss: 0.6674, test_loss: 1.0087, test_f1: 0.6050
 epoch: 72, train_loss: 0.6473, test_loss: 0.9507, test_f1: 0.6305
 epoch: 73, train_loss: 0.6523, test_loss: 0.9367, test_f1: 0.6111
 epoch: 74, train_loss: 0.6572, test_loss: 0.9985, test_f1: 0.6382
 epoch: 75, train_loss: 0.6432, test_loss: 1.0601, test_f1: 0.6357
 epoch: 76, train_loss: 0.6434, test_loss: 1.0291, test_f1: 0.6483
 epoch: 77, train_loss: 0.6535, test_loss: 1.1114, test_f1: 0.5887
 epoch: 78, train_loss: 0.6607, test_loss: 1.0652, test_f1: 0.6175
 epoch: 79, train_loss: 0.6354, test_loss: 1.0209, test_f1: 0.6258
 epoch: 80, train_loss: 0.6310, test_loss: 1.0077, test_f1: 0.6265
 epoch: 81, train_loss: 0.6275, test_loss: 1.0287, test_f1: 0.6014
 epoch: 82, train_loss: 0.6417, test_loss: 1.0405, test_f1: 0.6343
 epoch: 83, train_loss: 0.6071, test_loss: 1.0377, test_f1: 0.6228
 epoch: 84, train_loss: 0.6282, test_loss: 0.9636, test_f1: 0.6123
 epoch: 85, train_loss: 0.6399, test_loss: 1.0800, test_f1: 0.5976
 epoch: 86, train_loss: 0.6120, test_loss: 0.9515, test_f1: 0.5947
 epoch: 87, train_loss: 0.6273, test_loss: 0.9836, test_f1: 0.6564
 epoch: 88, train_loss: 0.6114, test_loss: 1.0648, test_f1: 0.6206
 epoch: 89, train_loss: 0.6194, test_loss: 1.1043, test_f1: 0.6195
 epoch: 90, train_loss: 0.6071, test_loss: 1.0908, test_f1: 0.6194
 epoch: 91, train_loss: 0.6040, test_loss: 1.0622, test_f1: 0.6242
 epoch: 92, train_loss: 0.6064, test_loss: 1.1473, test_f1: 0.6064
 epoch: 93, train_loss: 0.6135, test_loss: 1.0579, test_f1: 0.6329
 epoch: 94, train_loss: 0.6169, test_loss: 1.0607, test_f1: 0.6105
 epoch: 95, train_loss: 0.6191, test_loss: 1.0877, test_f1: 0.6050
 epoch: 96, train_loss: 0.6055, test_loss: 1.1389, test_f1: 0.6032
 epoch: 97, train_loss: 0.6207, test_loss: 1.0406, test_f1: 0.6430
 epoch: 98, train_loss: 0.5872, test_loss: 1.0300, test_f1: 0.6186
 epoch: 99, train_loss: 0.5841, test_loss: 1.0763, test_f1: 0.6115
##################ITERATION #4 ****************************************
 epoch: 0, train_loss: 1.2068, test_loss: 1.1256, test_f1: 0.3990
 epoch: 1, train_loss: 1.0159, test_loss: 1.0363, test_f1: 0.4658
 epoch: 2, train_loss: 1.0009, test_loss: 1.0148, test_f1: 0.4695
 epoch: 3, train_loss: 0.9791, test_loss: 1.0327, test_f1: 0.5067
 epoch: 4, train_loss: 0.9541, test_loss: 1.1205, test_f1: 0.4502
 epoch: 5, train_loss: 0.9508, test_loss: 1.0589, test_f1: 0.4578
 epoch: 6, train_loss: 0.9467, test_loss: 0.9730, test_f1: 0.5163
 epoch: 7, train_loss: 0.9249, test_loss: 0.9907, test_f1: 0.4896
 epoch: 8, train_loss: 0.9098, test_loss: 1.1938, test_f1: 0.4405
 epoch: 9, train_loss: 0.8974, test_loss: 0.9223, test_f1: 0.5019
 epoch: 10, train_loss: 0.9011, test_loss: 0.9566, test_f1: 0.5400
 epoch: 11, train_loss: 0.8959, test_loss: 0.9528, test_f1: 0.5187
 epoch: 12, train_loss: 0.8687, test_loss: 0.9344, test_f1: 0.5277
 epoch: 13, train_loss: 0.8641, test_loss: 0.9341, test_f1: 0.5617
 epoch: 14, train_loss: 0.8594, test_loss: 1.0068, test_f1: 0.5262
 epoch: 15, train_loss: 0.8658, test_loss: 0.9032, test_f1: 0.5565
 epoch: 16, train_loss: 0.8376, test_loss: 0.9205, test_f1: 0.5611
 epoch: 17, train_loss: 0.8522, test_loss: 0.9451, test_f1: 0.5941
 epoch: 18, train_loss: 0.8332, test_loss: 0.9761, test_f1: 0.5403
 epoch: 19, train_loss: 0.8171, test_loss: 0.9539, test_f1: 0.5564
 epoch: 20, train_loss: 0.8289, test_loss: 1.0120, test_f1: 0.5503
 epoch: 21, train_loss: 0.8159, test_loss: 0.9666, test_f1: 0.5620
 epoch: 22, train_loss: 0.8190, test_loss: 0.9771, test_f1: 0.5603
 epoch: 23, train_loss: 0.8163, test_loss: 0.9494, test_f1: 0.5438
 epoch: 24, train_loss: 0.8175, test_loss: 1.1085, test_f1: 0.5099
 epoch: 25, train_loss: 0.8102, test_loss: 0.9275, test_f1: 0.5817
 epoch: 26, train_loss: 0.8085, test_loss: 0.9571, test_f1: 0.5644
 epoch: 27, train_loss: 0.8231, test_loss: 0.9199, test_f1: 0.5480
 epoch: 28, train_loss: 0.8141, test_loss: 0.9375, test_f1: 0.5933
 epoch: 29, train_loss: 0.7914, test_loss: 0.9124, test_f1: 0.5520
 epoch: 30, train_loss: 0.7771, test_loss: 0.9603, test_f1: 0.6066
 epoch: 31, train_loss: 0.7744, test_loss: 0.9272, test_f1: 0.5610
 epoch: 32, train_loss: 0.7693, test_loss: 0.9533, test_f1: 0.5878
 epoch: 33, train_loss: 0.7725, test_loss: 1.0304, test_f1: 0.5515
 epoch: 34, train_loss: 0.7657, test_loss: 0.9794, test_f1: 0.5381
 epoch: 35, train_loss: 0.7692, test_loss: 0.9165, test_f1: 0.5846
 epoch: 36, train_loss: 0.7742, test_loss: 0.8565, test_f1: 0.6376
 epoch: 37, train_loss: 0.7624, test_loss: 0.9851, test_f1: 0.5468
 epoch: 38, train_loss: 0.7612, test_loss: 0.9414, test_f1: 0.5578
 epoch: 39, train_loss: 0.7552, test_loss: 1.0002, test_f1: 0.5885
 epoch: 40, train_loss: 0.7622, test_loss: 0.9232, test_f1: 0.5847
 epoch: 41, train_loss: 0.7531, test_loss: 0.8730, test_f1: 0.5682
 epoch: 42, train_loss: 0.7432, test_loss: 0.9151, test_f1: 0.5968
 epoch: 43, train_loss: 0.7387, test_loss: 0.9344, test_f1: 0.5646
 epoch: 44, train_loss: 0.7296, test_loss: 0.9284, test_f1: 0.5798
 epoch: 45, train_loss: 0.7253, test_loss: 1.0849, test_f1: 0.5439
 epoch: 46, train_loss: 0.7294, test_loss: 0.9908, test_f1: 0.5520
 epoch: 47, train_loss: 0.7319, test_loss: 0.9445, test_f1: 0.5962
 epoch: 48, train_loss: 0.7172, test_loss: 0.9202, test_f1: 0.5917
 epoch: 49, train_loss: 0.7231, test_loss: 0.8426, test_f1: 0.6239
 epoch: 50, train_loss: 0.6948, test_loss: 0.9101, test_f1: 0.5909
 epoch: 51, train_loss: 0.6890, test_loss: 0.8927, test_f1: 0.5983
 epoch: 52, train_loss: 0.6738, test_loss: 0.8819, test_f1: 0.6075
 epoch: 53, train_loss: 0.6686, test_loss: 0.8898, test_f1: 0.6354
 epoch: 54, train_loss: 0.6551, test_loss: 0.8857, test_f1: 0.6466
 epoch: 55, train_loss: 0.6584, test_loss: 0.9240, test_f1: 0.6304
 epoch: 56, train_loss: 0.6632, test_loss: 0.9321, test_f1: 0.6185
 epoch: 57, train_loss: 0.6562, test_loss: 0.9045, test_f1: 0.6742
 epoch: 58, train_loss: 0.6412, test_loss: 0.8788, test_f1: 0.6442
 epoch: 59, train_loss: 0.6462, test_loss: 0.9894, test_f1: 0.5964
 epoch: 60, train_loss: 0.6561, test_loss: 0.8703, test_f1: 0.6297
 epoch: 61, train_loss: 0.6343, test_loss: 0.9136, test_f1: 0.5994
 epoch: 62, train_loss: 0.6553, test_loss: 0.8951, test_f1: 0.6340
 epoch: 63, train_loss: 0.6270, test_loss: 0.8849, test_f1: 0.6412
 epoch: 64, train_loss: 0.6363, test_loss: 0.9451, test_f1: 0.6484
 epoch: 65, train_loss: 0.6172, test_loss: 0.9635, test_f1: 0.6419
 epoch: 66, train_loss: 0.6345, test_loss: 0.9205, test_f1: 0.6536
 epoch: 67, train_loss: 0.6151, test_loss: 0.9658, test_f1: 0.6434
 epoch: 68, train_loss: 0.6299, test_loss: 0.9538, test_f1: 0.6232
 epoch: 69, train_loss: 0.6089, test_loss: 0.9523, test_f1: 0.6500
 epoch: 70, train_loss: 0.6271, test_loss: 0.9912, test_f1: 0.6583
 epoch: 71, train_loss: 0.6208, test_loss: 0.9229, test_f1: 0.6638
 epoch: 72, train_loss: 0.6095, test_loss: 1.0592, test_f1: 0.6260
 epoch: 73, train_loss: 0.6163, test_loss: 0.9578, test_f1: 0.6208
 epoch: 74, train_loss: 0.6036, test_loss: 1.0011, test_f1: 0.6288
 epoch: 75, train_loss: 0.6059, test_loss: 1.0063, test_f1: 0.6203
 epoch: 76, train_loss: 0.5888, test_loss: 1.0227, test_f1: 0.6300
 epoch: 77, train_loss: 0.5919, test_loss: 1.0188, test_f1: 0.6683
 epoch: 78, train_loss: 0.6122, test_loss: 1.0993, test_f1: 0.6083
 epoch: 79, train_loss: 0.6104, test_loss: 0.9914, test_f1: 0.6363
 epoch: 80, train_loss: 0.5981, test_loss: 1.0148, test_f1: 0.6436
 epoch: 81, train_loss: 0.5932, test_loss: 1.0407, test_f1: 0.6174
 epoch: 82, train_loss: 0.5918, test_loss: 1.0417, test_f1: 0.6326
 epoch: 83, train_loss: 0.5834, test_loss: 0.9752, test_f1: 0.6496
 epoch: 84, train_loss: 0.5949, test_loss: 0.9817, test_f1: 0.6598
 epoch: 85, train_loss: 0.5940, test_loss: 1.1225, test_f1: 0.6356
 epoch: 86, train_loss: 0.5889, test_loss: 1.0208, test_f1: 0.6445
 epoch: 87, train_loss: 0.5683, test_loss: 1.0756, test_f1: 0.6487
 epoch: 88, train_loss: 0.5900, test_loss: 1.0538, test_f1: 0.6459
 epoch: 89, train_loss: 0.5803, test_loss: 1.0804, test_f1: 0.6346
 epoch: 90, train_loss: 0.5738, test_loss: 1.0162, test_f1: 0.6484
 epoch: 91, train_loss: 0.5708, test_loss: 0.9824, test_f1: 0.6571
 epoch: 92, train_loss: 0.5756, test_loss: 1.0479, test_f1: 0.6469
 epoch: 93, train_loss: 0.5569, test_loss: 1.0640, test_f1: 0.6490
 epoch: 94, train_loss: 0.5669, test_loss: 1.0284, test_f1: 0.6132
 epoch: 95, train_loss: 0.5729, test_loss: 1.1855, test_f1: 0.6361
 epoch: 96, train_loss: 0.5622, test_loss: 1.0057, test_f1: 0.6569
 epoch: 97, train_loss: 0.5592, test_loss: 1.1202, test_f1: 0.6662
 epoch: 98, train_loss: 0.5538, test_loss: 1.0649, test_f1: 0.6797
 epoch: 99, train_loss: 0.5709, test_loss: 1.0531, test_f1: 0.6419
##################ITERATION #5 ****************************************
 epoch: 0, train_loss: 1.2571, test_loss: 1.3301, test_f1: 0.3295
 epoch: 1, train_loss: 1.0432, test_loss: 1.0287, test_f1: 0.4868
 epoch: 2, train_loss: 1.0091, test_loss: 1.0844, test_f1: 0.4739
 epoch: 3, train_loss: 0.9839, test_loss: 1.0237, test_f1: 0.4612
 epoch: 4, train_loss: 0.9792, test_loss: 1.0610, test_f1: 0.4638
 epoch: 5, train_loss: 0.9476, test_loss: 1.0082, test_f1: 0.4468
 epoch: 6, train_loss: 0.9627, test_loss: 1.0436, test_f1: 0.4696
 epoch: 7, train_loss: 0.9426, test_loss: 1.0150, test_f1: 0.4541
 epoch: 8, train_loss: 0.9342, test_loss: 0.9906, test_f1: 0.5106
 epoch: 9, train_loss: 0.9144, test_loss: 1.0247, test_f1: 0.4827
 epoch: 10, train_loss: 0.9093, test_loss: 1.0131, test_f1: 0.5066
 epoch: 11, train_loss: 0.9016, test_loss: 1.0744, test_f1: 0.4940
 epoch: 12, train_loss: 0.9020, test_loss: 1.0317, test_f1: 0.5155
 epoch: 13, train_loss: 0.8948, test_loss: 0.9811, test_f1: 0.5066
 epoch: 14, train_loss: 0.8789, test_loss: 1.0043, test_f1: 0.4737
 epoch: 15, train_loss: 0.8945, test_loss: 0.9680, test_f1: 0.5366
 epoch: 16, train_loss: 0.8893, test_loss: 0.9484, test_f1: 0.5392
 epoch: 17, train_loss: 0.8702, test_loss: 1.2889, test_f1: 0.4879
 epoch: 18, train_loss: 0.8693, test_loss: 1.0115, test_f1: 0.5538
 epoch: 19, train_loss: 0.8491, test_loss: 1.0010, test_f1: 0.5326
 epoch: 20, train_loss: 0.8488, test_loss: 0.9532, test_f1: 0.5175
 epoch: 21, train_loss: 0.8475, test_loss: 0.9925, test_f1: 0.5288
 epoch: 22, train_loss: 0.8433, test_loss: 0.9963, test_f1: 0.5493
 epoch: 23, train_loss: 0.8392, test_loss: 1.0097, test_f1: 0.5336
 epoch: 24, train_loss: 0.8206, test_loss: 0.9703, test_f1: 0.5381
 epoch: 25, train_loss: 0.8351, test_loss: 1.0470, test_f1: 0.5386
 epoch: 26, train_loss: 0.8399, test_loss: 0.9454, test_f1: 0.5654
 epoch: 27, train_loss: 0.8306, test_loss: 0.9381, test_f1: 0.5770
 epoch: 28, train_loss: 0.8159, test_loss: 1.1232, test_f1: 0.4846
 epoch: 29, train_loss: 0.8178, test_loss: 1.1048, test_f1: 0.4808
 epoch: 30, train_loss: 0.8012, test_loss: 0.9097, test_f1: 0.5820
 epoch: 31, train_loss: 0.8057, test_loss: 0.9402, test_f1: 0.5674
 epoch: 32, train_loss: 0.7965, test_loss: 1.0346, test_f1: 0.5918
 epoch: 33, train_loss: 0.8070, test_loss: 1.0277, test_f1: 0.5543
 epoch: 34, train_loss: 0.7921, test_loss: 1.0174, test_f1: 0.5464
 epoch: 35, train_loss: 0.7803, test_loss: 0.9053, test_f1: 0.6111
 epoch: 36, train_loss: 0.7670, test_loss: 0.9332, test_f1: 0.6093
 epoch: 37, train_loss: 0.7734, test_loss: 1.0688, test_f1: 0.5194
 epoch: 38, train_loss: 0.7757, test_loss: 0.9285, test_f1: 0.6176
 epoch: 39, train_loss: 0.7802, test_loss: 0.9236, test_f1: 0.6237
 epoch: 40, train_loss: 0.7761, test_loss: 0.9238, test_f1: 0.5904
 epoch: 41, train_loss: 0.7551, test_loss: 1.0289, test_f1: 0.5882
 epoch: 42, train_loss: 0.7509, test_loss: 0.9383, test_f1: 0.6232
 epoch: 43, train_loss: 0.7370, test_loss: 1.0470, test_f1: 0.5721
 epoch: 44, train_loss: 0.7861, test_loss: 0.9650, test_f1: 0.5871
 epoch: 45, train_loss: 0.7717, test_loss: 0.9753, test_f1: 0.5788
 epoch: 46, train_loss: 0.7549, test_loss: 0.9584, test_f1: 0.5632
 epoch: 47, train_loss: 0.7493, test_loss: 0.9795, test_f1: 0.5345
 epoch: 48, train_loss: 0.7636, test_loss: 1.0234, test_f1: 0.5646
 epoch: 49, train_loss: 0.7617, test_loss: 1.0043, test_f1: 0.5884
 epoch: 50, train_loss: 0.7531, test_loss: 0.9696, test_f1: 0.6123
 epoch: 51, train_loss: 0.7162, test_loss: 0.8959, test_f1: 0.6417
 epoch: 52, train_loss: 0.6978, test_loss: 0.9233, test_f1: 0.6195
 epoch: 53, train_loss: 0.6791, test_loss: 0.9692, test_f1: 0.6094
 epoch: 54, train_loss: 0.6828, test_loss: 0.9153, test_f1: 0.6485
 epoch: 55, train_loss: 0.6897, test_loss: 0.9427, test_f1: 0.6490
 epoch: 56, train_loss: 0.6719, test_loss: 0.9238, test_f1: 0.6432
 epoch: 57, train_loss: 0.6748, test_loss: 0.8938, test_f1: 0.6482
 epoch: 58, train_loss: 0.6641, test_loss: 0.9592, test_f1: 0.6222
 epoch: 59, train_loss: 0.6554, test_loss: 0.8805, test_f1: 0.6551
 epoch: 60, train_loss: 0.6628, test_loss: 0.9477, test_f1: 0.6440
 epoch: 61, train_loss: 0.6617, test_loss: 0.9492, test_f1: 0.6245
 epoch: 62, train_loss: 0.6378, test_loss: 1.0201, test_f1: 0.6126
 epoch: 63, train_loss: 0.6486, test_loss: 0.9898, test_f1: 0.6087
 epoch: 64, train_loss: 0.6492, test_loss: 0.9686, test_f1: 0.6235
 epoch: 65, train_loss: 0.6441, test_loss: 0.9553, test_f1: 0.6224
 epoch: 66, train_loss: 0.6502, test_loss: 1.0596, test_f1: 0.5880
 epoch: 67, train_loss: 0.6468, test_loss: 0.8959, test_f1: 0.6371
 epoch: 68, train_loss: 0.6229, test_loss: 0.9796, test_f1: 0.6290
 epoch: 69, train_loss: 0.6416, test_loss: 0.9620, test_f1: 0.6391
 epoch: 70, train_loss: 0.6394, test_loss: 0.9366, test_f1: 0.6452
 epoch: 71, train_loss: 0.6166, test_loss: 0.9928, test_f1: 0.6228
 epoch: 72, train_loss: 0.6309, test_loss: 0.9209, test_f1: 0.6246
 epoch: 73, train_loss: 0.6195, test_loss: 1.0211, test_f1: 0.6187
 epoch: 74, train_loss: 0.6185, test_loss: 0.9479, test_f1: 0.6325
 epoch: 75, train_loss: 0.6336, test_loss: 0.9542, test_f1: 0.6391
 epoch: 76, train_loss: 0.6368, test_loss: 1.0033, test_f1: 0.6409
 epoch: 77, train_loss: 0.6392, test_loss: 1.4187, test_f1: 0.5456
 epoch: 78, train_loss: 0.6235, test_loss: 0.9868, test_f1: 0.6391
 epoch: 79, train_loss: 0.5968, test_loss: 0.9810, test_f1: 0.6484
 epoch: 80, train_loss: 0.6128, test_loss: 0.9510, test_f1: 0.6462
 epoch: 81, train_loss: 0.6131, test_loss: 0.9869, test_f1: 0.6562
 epoch: 82, train_loss: 0.6182, test_loss: 1.0358, test_f1: 0.6369
 epoch: 83, train_loss: 0.6267, test_loss: 1.0010, test_f1: 0.6086
 epoch: 84, train_loss: 0.5971, test_loss: 0.9486, test_f1: 0.6589
 epoch: 85, train_loss: 0.6112, test_loss: 0.9659, test_f1: 0.6440
 epoch: 86, train_loss: 0.6002, test_loss: 1.0286, test_f1: 0.6107
 epoch: 87, train_loss: 0.5958, test_loss: 1.0562, test_f1: 0.6348
 epoch: 88, train_loss: 0.6016, test_loss: 0.9883, test_f1: 0.6289
 epoch: 89, train_loss: 0.6039, test_loss: 0.9691, test_f1: 0.6504
 epoch: 90, train_loss: 0.6006, test_loss: 1.0063, test_f1: 0.6389
 epoch: 91, train_loss: 0.5903, test_loss: 1.0384, test_f1: 0.6426
 epoch: 92, train_loss: 0.5776, test_loss: 1.0355, test_f1: 0.6310
 epoch: 93, train_loss: 0.5964, test_loss: 0.9630, test_f1: 0.6450
 epoch: 94, train_loss: 0.6125, test_loss: 0.9810, test_f1: 0.6388
 epoch: 95, train_loss: 0.5777, test_loss: 0.9744, test_f1: 0.6268
 epoch: 96, train_loss: 0.6090, test_loss: 1.0277, test_f1: 0.6550
 epoch: 97, train_loss: 0.5949, test_loss: 1.0773, test_f1: 0.6239
 epoch: 98, train_loss: 0.5785, test_loss: 0.9951, test_f1: 0.6293
 epoch: 99, train_loss: 0.5773, test_loss: 1.0553, test_f1: 0.6100
##################ITERATION #6 ****************************************
 epoch: 0, train_loss: 1.2366, test_loss: 1.1165, test_f1: 0.3993
 epoch: 1, train_loss: 1.0271, test_loss: 1.0713, test_f1: 0.4346
 epoch: 2, train_loss: 1.0086, test_loss: 1.0037, test_f1: 0.4825
 epoch: 3, train_loss: 0.9838, test_loss: 1.0003, test_f1: 0.4699
 epoch: 4, train_loss: 0.9453, test_loss: 0.9900, test_f1: 0.4680
 epoch: 5, train_loss: 0.9384, test_loss: 0.9883, test_f1: 0.5013
 epoch: 6, train_loss: 0.9338, test_loss: 0.9494, test_f1: 0.5123
 epoch: 7, train_loss: 0.9156, test_loss: 0.9531, test_f1: 0.5119
 epoch: 8, train_loss: 0.9077, test_loss: 1.0217, test_f1: 0.4915
 epoch: 9, train_loss: 0.8994, test_loss: 0.9430, test_f1: 0.5557
 epoch: 10, train_loss: 0.8954, test_loss: 0.9689, test_f1: 0.5293
 epoch: 11, train_loss: 0.8737, test_loss: 0.9345, test_f1: 0.4899
 epoch: 12, train_loss: 0.8806, test_loss: 1.6664, test_f1: 0.2307
 epoch: 13, train_loss: 0.8839, test_loss: 0.9457, test_f1: 0.4865
 epoch: 14, train_loss: 0.8748, test_loss: 0.9768, test_f1: 0.5192
 epoch: 15, train_loss: 0.8631, test_loss: 0.9007, test_f1: 0.5296
 epoch: 16, train_loss: 0.8421, test_loss: 0.9193, test_f1: 0.5167
 epoch: 17, train_loss: 0.8527, test_loss: 0.8742, test_f1: 0.5395
 epoch: 18, train_loss: 0.8463, test_loss: 0.8326, test_f1: 0.5853
 epoch: 19, train_loss: 0.8171, test_loss: 0.8261, test_f1: 0.5661
 epoch: 20, train_loss: 0.8112, test_loss: 1.0385, test_f1: 0.5347
 epoch: 21, train_loss: 0.8284, test_loss: 0.9266, test_f1: 0.5808
 epoch: 22, train_loss: 0.8201, test_loss: 0.9138, test_f1: 0.5696
 epoch: 23, train_loss: 0.8074, test_loss: 0.9944, test_f1: 0.5549
 epoch: 24, train_loss: 0.7982, test_loss: 0.9251, test_f1: 0.6047
 epoch: 25, train_loss: 0.8028, test_loss: 0.9932, test_f1: 0.5654
 epoch: 26, train_loss: 0.7911, test_loss: 0.8931, test_f1: 0.5669
 epoch: 27, train_loss: 0.8019, test_loss: 0.9058, test_f1: 0.5319
 epoch: 28, train_loss: 0.7978, test_loss: 0.8951, test_f1: 0.5955
 epoch: 29, train_loss: 0.7905, test_loss: 0.9155, test_f1: 0.5650
 epoch: 30, train_loss: 0.7868, test_loss: 0.9685, test_f1: 0.5497
 epoch: 31, train_loss: 0.7807, test_loss: 0.8949, test_f1: 0.6024
 epoch: 32, train_loss: 0.7555, test_loss: 0.9233, test_f1: 0.5893
 epoch: 33, train_loss: 0.7759, test_loss: 0.9291, test_f1: 0.5893
 epoch: 34, train_loss: 0.7609, test_loss: 1.0007, test_f1: 0.6018
 epoch: 35, train_loss: 0.7573, test_loss: 0.9205, test_f1: 0.5830
 epoch: 36, train_loss: 0.7404, test_loss: 0.8276, test_f1: 0.5998
 epoch: 37, train_loss: 0.7331, test_loss: 0.9664, test_f1: 0.6178
 epoch: 38, train_loss: 0.7384, test_loss: 0.9994, test_f1: 0.5877
 epoch: 39, train_loss: 0.7562, test_loss: 0.8951, test_f1: 0.5947
 epoch: 40, train_loss: 0.7541, test_loss: 0.8701, test_f1: 0.6091
 epoch: 41, train_loss: 0.7363, test_loss: 0.9304, test_f1: 0.6062
 epoch: 42, train_loss: 0.7409, test_loss: 0.8981, test_f1: 0.6068
 epoch: 43, train_loss: 0.7409, test_loss: 1.0347, test_f1: 0.5984
 epoch: 44, train_loss: 0.7269, test_loss: 1.0140, test_f1: 0.5708
 epoch: 45, train_loss: 0.7394, test_loss: 0.8958, test_f1: 0.6313
 epoch: 46, train_loss: 0.7109, test_loss: 0.9117, test_f1: 0.6072
 epoch: 47, train_loss: 0.7005, test_loss: 0.8434, test_f1: 0.6255
 epoch: 48, train_loss: 0.7040, test_loss: 1.0146, test_f1: 0.6199
 epoch: 49, train_loss: 0.7393, test_loss: 0.8235, test_f1: 0.5985
 epoch: 50, train_loss: 0.7151, test_loss: 0.9190, test_f1: 0.6105
 epoch: 51, train_loss: 0.6923, test_loss: 0.9584, test_f1: 0.6260
 epoch: 52, train_loss: 0.6646, test_loss: 0.9344, test_f1: 0.6192
 epoch: 53, train_loss: 0.6680, test_loss: 0.9674, test_f1: 0.6631
 epoch: 54, train_loss: 0.6609, test_loss: 0.8750, test_f1: 0.6534
 epoch: 55, train_loss: 0.6499, test_loss: 0.9232, test_f1: 0.6233
 epoch: 56, train_loss: 0.6561, test_loss: 0.9980, test_f1: 0.6362
 epoch: 57, train_loss: 0.6448, test_loss: 0.8941, test_f1: 0.6550
 epoch: 58, train_loss: 0.6549, test_loss: 0.9319, test_f1: 0.6227
 epoch: 59, train_loss: 0.6480, test_loss: 0.9004, test_f1: 0.6346
 epoch: 60, train_loss: 0.6436, test_loss: 0.8728, test_f1: 0.6578
 epoch: 61, train_loss: 0.6272, test_loss: 0.9031, test_f1: 0.6355
 epoch: 62, train_loss: 0.6356, test_loss: 0.9141, test_f1: 0.6234
 epoch: 63, train_loss: 0.6329, test_loss: 0.8596, test_f1: 0.6456
 epoch: 64, train_loss: 0.6392, test_loss: 0.9882, test_f1: 0.6229
 epoch: 65, train_loss: 0.6116, test_loss: 0.9882, test_f1: 0.6572
 epoch: 66, train_loss: 0.6290, test_loss: 0.9446, test_f1: 0.6431
 epoch: 67, train_loss: 0.6406, test_loss: 0.9703, test_f1: 0.6489
 epoch: 68, train_loss: 0.6186, test_loss: 0.9277, test_f1: 0.6307
 epoch: 69, train_loss: 0.6251, test_loss: 0.9646, test_f1: 0.6591
 epoch: 70, train_loss: 0.6062, test_loss: 0.9660, test_f1: 0.6660
 epoch: 71, train_loss: 0.6001, test_loss: 0.9454, test_f1: 0.6274
 epoch: 72, train_loss: 0.6141, test_loss: 0.9805, test_f1: 0.6405
 epoch: 73, train_loss: 0.5942, test_loss: 1.0316, test_f1: 0.6444
 epoch: 74, train_loss: 0.6087, test_loss: 0.9114, test_f1: 0.6340
 epoch: 75, train_loss: 0.5899, test_loss: 0.9723, test_f1: 0.6655
 epoch: 76, train_loss: 0.6026, test_loss: 0.9772, test_f1: 0.6321
 epoch: 77, train_loss: 0.6121, test_loss: 0.9143, test_f1: 0.6607
 epoch: 78, train_loss: 0.5990, test_loss: 0.9037, test_f1: 0.6419
 epoch: 79, train_loss: 0.6028, test_loss: 0.9602, test_f1: 0.6280
 epoch: 80, train_loss: 0.5921, test_loss: 0.9335, test_f1: 0.6211
 epoch: 81, train_loss: 0.5996, test_loss: 0.9489, test_f1: 0.6698
 epoch: 82, train_loss: 0.5870, test_loss: 0.9446, test_f1: 0.6377
 epoch: 83, train_loss: 0.5909, test_loss: 0.9858, test_f1: 0.6679
 epoch: 84, train_loss: 0.6051, test_loss: 0.9858, test_f1: 0.6494
 epoch: 85, train_loss: 0.5956, test_loss: 1.0079, test_f1: 0.6403
 epoch: 86, train_loss: 0.5826, test_loss: 0.9767, test_f1: 0.6359
 epoch: 87, train_loss: 0.5841, test_loss: 0.9991, test_f1: 0.6615
 epoch: 88, train_loss: 0.5891, test_loss: 0.9190, test_f1: 0.6561
 epoch: 89, train_loss: 0.5887, test_loss: 1.0500, test_f1: 0.6297
 epoch: 90, train_loss: 0.5820, test_loss: 1.0317, test_f1: 0.6369
 epoch: 91, train_loss: 0.5838, test_loss: 0.9125, test_f1: 0.6965
 epoch: 92, train_loss: 0.5812, test_loss: 0.9524, test_f1: 0.6558
 epoch: 93, train_loss: 0.5673, test_loss: 1.0032, test_f1: 0.6310
 epoch: 94, train_loss: 0.6059, test_loss: 1.0348, test_f1: 0.6419
 epoch: 95, train_loss: 0.5631, test_loss: 1.0291, test_f1: 0.6481
 epoch: 96, train_loss: 0.5494, test_loss: 0.9407, test_f1: 0.6550
 epoch: 97, train_loss: 0.5641, test_loss: 0.9771, test_f1: 0.6748
 epoch: 98, train_loss: 0.5728, test_loss: 1.0178, test_f1: 0.6460
 epoch: 99, train_loss: 0.5655, test_loss: 1.0149, test_f1: 0.6314
##################ITERATION #7 ****************************************
 epoch: 0, train_loss: 1.2311, test_loss: 1.1339, test_f1: 0.4040
 epoch: 1, train_loss: 1.0497, test_loss: 1.0506, test_f1: 0.4982
 epoch: 2, train_loss: 1.0091, test_loss: 0.9990, test_f1: 0.4533
 epoch: 3, train_loss: 0.9807, test_loss: 1.1472, test_f1: 0.4463
 epoch: 4, train_loss: 0.9730, test_loss: 1.3767, test_f1: 0.4166
 epoch: 5, train_loss: 0.9826, test_loss: 1.0622, test_f1: 0.4139
 epoch: 6, train_loss: 0.9421, test_loss: 0.9612, test_f1: 0.4465
 epoch: 7, train_loss: 0.9261, test_loss: 0.9451, test_f1: 0.4824
 epoch: 8, train_loss: 0.9137, test_loss: 0.9860, test_f1: 0.5234
 epoch: 9, train_loss: 0.9163, test_loss: 0.9757, test_f1: 0.5121
 epoch: 10, train_loss: 0.9007, test_loss: 0.9386, test_f1: 0.5063
 epoch: 11, train_loss: 0.9224, test_loss: 0.9471, test_f1: 0.5229
 epoch: 12, train_loss: 0.9047, test_loss: 1.1366, test_f1: 0.4434
 epoch: 13, train_loss: 0.9050, test_loss: 0.9651, test_f1: 0.5336
 epoch: 14, train_loss: 0.8729, test_loss: 1.1201, test_f1: 0.4936
 epoch: 15, train_loss: 0.8801, test_loss: 0.9505, test_f1: 0.5172
 epoch: 16, train_loss: 0.8656, test_loss: 0.9303, test_f1: 0.5394
 epoch: 17, train_loss: 0.8503, test_loss: 0.9640, test_f1: 0.5278
 epoch: 18, train_loss: 0.8714, test_loss: 0.9971, test_f1: 0.5091
 epoch: 19, train_loss: 0.8441, test_loss: 0.9081, test_f1: 0.5859
 epoch: 20, train_loss: 0.8378, test_loss: 0.9713, test_f1: 0.5518
 epoch: 21, train_loss: 0.8264, test_loss: 0.9882, test_f1: 0.5488
 epoch: 22, train_loss: 0.8388, test_loss: 0.9171, test_f1: 0.5577
 epoch: 23, train_loss: 0.8355, test_loss: 1.0477, test_f1: 0.5158
 epoch: 24, train_loss: 0.8303, test_loss: 0.9657, test_f1: 0.5925
 epoch: 25, train_loss: 0.8188, test_loss: 0.9221, test_f1: 0.5467
 epoch: 26, train_loss: 0.8012, test_loss: 0.9649, test_f1: 0.5604
 epoch: 27, train_loss: 0.7915, test_loss: 0.9913, test_f1: 0.5325
 epoch: 28, train_loss: 0.8228, test_loss: 0.9430, test_f1: 0.5630
 epoch: 29, train_loss: 0.7970, test_loss: 0.9755, test_f1: 0.5751
 epoch: 30, train_loss: 0.8111, test_loss: 0.9336, test_f1: 0.5684
 epoch: 31, train_loss: 0.7836, test_loss: 0.8799, test_f1: 0.5606
 epoch: 32, train_loss: 0.7959, test_loss: 0.8849, test_f1: 0.5997
 epoch: 33, train_loss: 0.7617, test_loss: 0.9155, test_f1: 0.5601
 epoch: 34, train_loss: 0.7699, test_loss: 0.9782, test_f1: 0.6005
 epoch: 35, train_loss: 0.7554, test_loss: 0.8487, test_f1: 0.6053
 epoch: 36, train_loss: 0.7432, test_loss: 1.0054, test_f1: 0.5434
 epoch: 37, train_loss: 0.7482, test_loss: 1.0436, test_f1: 0.5305
 epoch: 38, train_loss: 0.7508, test_loss: 0.9661, test_f1: 0.6255
 epoch: 39, train_loss: 0.7418, test_loss: 1.0172, test_f1: 0.5737
 epoch: 40, train_loss: 0.7413, test_loss: 1.0080, test_f1: 0.6131
 epoch: 41, train_loss: 0.7415, test_loss: 0.9509, test_f1: 0.5701
 epoch: 42, train_loss: 0.7304, test_loss: 0.9698, test_f1: 0.6195
 epoch: 43, train_loss: 0.7377, test_loss: 0.9497, test_f1: 0.6115
 epoch: 44, train_loss: 0.7248, test_loss: 0.9701, test_f1: 0.6311
 epoch: 45, train_loss: 0.7174, test_loss: 1.0418, test_f1: 0.5923
 epoch: 46, train_loss: 0.7217, test_loss: 0.9626, test_f1: 0.6169
 epoch: 47, train_loss: 0.7200, test_loss: 0.9293, test_f1: 0.6003
 epoch: 48, train_loss: 0.7165, test_loss: 0.9181, test_f1: 0.5876
 epoch: 49, train_loss: 0.7121, test_loss: 0.9438, test_f1: 0.5769
 epoch: 50, train_loss: 0.6988, test_loss: 1.0769, test_f1: 0.5999
 epoch: 51, train_loss: 0.6676, test_loss: 1.0128, test_f1: 0.6016
 epoch: 52, train_loss: 0.6698, test_loss: 0.9643, test_f1: 0.6189
 epoch: 53, train_loss: 0.6553, test_loss: 0.9288, test_f1: 0.6626
 epoch: 54, train_loss: 0.6596, test_loss: 0.9914, test_f1: 0.6014
 epoch: 55, train_loss: 0.6457, test_loss: 0.9865, test_f1: 0.6427
 epoch: 56, train_loss: 0.6447, test_loss: 1.0142, test_f1: 0.6413
 epoch: 57, train_loss: 0.6444, test_loss: 1.0137, test_f1: 0.5967
 epoch: 58, train_loss: 0.6463, test_loss: 1.0063, test_f1: 0.6264
 epoch: 59, train_loss: 0.6539, test_loss: 1.0067, test_f1: 0.6384
 epoch: 60, train_loss: 0.6386, test_loss: 0.9455, test_f1: 0.6237
 epoch: 61, train_loss: 0.6381, test_loss: 1.0196, test_f1: 0.6165
 epoch: 62, train_loss: 0.6525, test_loss: 0.9918, test_f1: 0.6445
 epoch: 63, train_loss: 0.6335, test_loss: 1.1168, test_f1: 0.5993
 epoch: 64, train_loss: 0.6422, test_loss: 0.9538, test_f1: 0.6546
 epoch: 65, train_loss: 0.6407, test_loss: 1.0133, test_f1: 0.6307
 epoch: 66, train_loss: 0.6368, test_loss: 1.0016, test_f1: 0.6120
 epoch: 67, train_loss: 0.6269, test_loss: 0.9217, test_f1: 0.6411
 epoch: 68, train_loss: 0.6267, test_loss: 1.0165, test_f1: 0.6363
 epoch: 69, train_loss: 0.6274, test_loss: 0.9152, test_f1: 0.6354
 epoch: 70, train_loss: 0.6190, test_loss: 1.0103, test_f1: 0.6569
 epoch: 71, train_loss: 0.6075, test_loss: 0.9983, test_f1: 0.6382
 epoch: 72, train_loss: 0.6084, test_loss: 1.0567, test_f1: 0.6417
 epoch: 73, train_loss: 0.5991, test_loss: 1.0162, test_f1: 0.6437
 epoch: 74, train_loss: 0.6047, test_loss: 1.1047, test_f1: 0.6298
 epoch: 75, train_loss: 0.6242, test_loss: 0.9781, test_f1: 0.6390
 epoch: 76, train_loss: 0.6011, test_loss: 1.0399, test_f1: 0.6569
 epoch: 77, train_loss: 0.6095, test_loss: 1.0550, test_f1: 0.6185
 epoch: 78, train_loss: 0.5655, test_loss: 1.0544, test_f1: 0.6349
 epoch: 79, train_loss: 0.6056, test_loss: 0.9930, test_f1: 0.6257
 epoch: 80, train_loss: 0.6166, test_loss: 1.0056, test_f1: 0.6355
 epoch: 81, train_loss: 0.6001, test_loss: 0.9958, test_f1: 0.6356
 epoch: 82, train_loss: 0.5981, test_loss: 0.9661, test_f1: 0.6761
 epoch: 83, train_loss: 0.5995, test_loss: 1.0138, test_f1: 0.6192
 epoch: 84, train_loss: 0.5937, test_loss: 0.9772, test_f1: 0.6425
 epoch: 85, train_loss: 0.5798, test_loss: 1.0393, test_f1: 0.6437
 epoch: 86, train_loss: 0.5800, test_loss: 1.0584, test_f1: 0.6465
 epoch: 87, train_loss: 0.5983, test_loss: 1.0383, test_f1: 0.6485
 epoch: 88, train_loss: 0.5908, test_loss: 1.0084, test_f1: 0.6330
 epoch: 89, train_loss: 0.5821, test_loss: 1.0504, test_f1: 0.6453
 epoch: 90, train_loss: 0.5721, test_loss: 1.0301, test_f1: 0.6591
 epoch: 91, train_loss: 0.5822, test_loss: 1.1147, test_f1: 0.6414
 epoch: 92, train_loss: 0.5794, test_loss: 1.1290, test_f1: 0.6282
 epoch: 93, train_loss: 0.5869, test_loss: 1.0485, test_f1: 0.6375
 epoch: 94, train_loss: 0.5846, test_loss: 1.1737, test_f1: 0.6106
 epoch: 95, train_loss: 0.5790, test_loss: 1.0696, test_f1: 0.6351
 epoch: 96, train_loss: 0.5613, test_loss: 1.1005, test_f1: 0.6399
 epoch: 97, train_loss: 0.5549, test_loss: 1.0546, test_f1: 0.6301
 epoch: 98, train_loss: 0.5558, test_loss: 1.0009, test_f1: 0.6745
 epoch: 99, train_loss: 0.5680, test_loss: 1.0068, test_f1: 0.6504
##################ITERATION #8 ****************************************
 epoch: 0, train_loss: 1.2903, test_loss: 1.3880, test_f1: 0.2297
 epoch: 1, train_loss: 1.0862, test_loss: 0.9991, test_f1: 0.4809
 epoch: 2, train_loss: 1.0168, test_loss: 0.9541, test_f1: 0.4760
 epoch: 3, train_loss: 0.9772, test_loss: 0.9776, test_f1: 0.5078
 epoch: 4, train_loss: 0.9446, test_loss: 0.9790, test_f1: 0.4689
 epoch: 5, train_loss: 0.9623, test_loss: 0.9189, test_f1: 0.5027
 epoch: 6, train_loss: 0.9183, test_loss: 0.9834, test_f1: 0.4911
 epoch: 7, train_loss: 0.9328, test_loss: 0.9218, test_f1: 0.5179
 epoch: 8, train_loss: 0.9305, test_loss: 0.9674, test_f1: 0.4759
 epoch: 9, train_loss: 0.9099, test_loss: 0.9097, test_f1: 0.4884
 epoch: 10, train_loss: 0.9105, test_loss: 1.0629, test_f1: 0.4408
 epoch: 11, train_loss: 0.8970, test_loss: 0.9141, test_f1: 0.5206
 epoch: 12, train_loss: 0.8829, test_loss: 0.9432, test_f1: 0.5083
 epoch: 13, train_loss: 0.8895, test_loss: 0.9018, test_f1: 0.5195
 epoch: 14, train_loss: 0.8726, test_loss: 0.8869, test_f1: 0.5321
 epoch: 15, train_loss: 0.8698, test_loss: 0.9424, test_f1: 0.5296
 epoch: 16, train_loss: 0.8683, test_loss: 0.9720, test_f1: 0.4954
 epoch: 17, train_loss: 0.8663, test_loss: 1.0846, test_f1: 0.4723
 epoch: 18, train_loss: 0.8662, test_loss: 0.9826, test_f1: 0.5369
 epoch: 19, train_loss: 0.8731, test_loss: 0.9137, test_f1: 0.5320
 epoch: 20, train_loss: 0.8586, test_loss: 0.9958, test_f1: 0.5253
 epoch: 21, train_loss: 0.8427, test_loss: 0.8834, test_f1: 0.5351
 epoch: 22, train_loss: 0.8464, test_loss: 0.9027, test_f1: 0.5594
 epoch: 23, train_loss: 0.8335, test_loss: 0.9126, test_f1: 0.5291
 epoch: 24, train_loss: 0.8334, test_loss: 0.8921, test_f1: 0.6007
 epoch: 25, train_loss: 0.8014, test_loss: 0.8837, test_f1: 0.5752
 epoch: 26, train_loss: 0.7883, test_loss: 0.9973, test_f1: 0.5668
 epoch: 27, train_loss: 0.8047, test_loss: 0.8536, test_f1: 0.5716
 epoch: 28, train_loss: 0.8017, test_loss: 0.9286, test_f1: 0.5411
 epoch: 29, train_loss: 0.7839, test_loss: 0.9380, test_f1: 0.5822
 epoch: 30, train_loss: 0.7937, test_loss: 0.9183, test_f1: 0.5833
 epoch: 31, train_loss: 0.7927, test_loss: 0.8926, test_f1: 0.5990
 epoch: 32, train_loss: 0.7796, test_loss: 0.8865, test_f1: 0.6062
 epoch: 33, train_loss: 0.7858, test_loss: 0.9222, test_f1: 0.6056
 epoch: 34, train_loss: 0.7521, test_loss: 0.8879, test_f1: 0.6018
 epoch: 35, train_loss: 0.7498, test_loss: 0.9327, test_f1: 0.5432
 epoch: 36, train_loss: 0.7643, test_loss: 0.9628, test_f1: 0.5735
 epoch: 37, train_loss: 0.7396, test_loss: 0.9304, test_f1: 0.5719
 epoch: 38, train_loss: 0.7587, test_loss: 0.9284, test_f1: 0.5995
 epoch: 39, train_loss: 0.7577, test_loss: 0.9693, test_f1: 0.5844
 epoch: 40, train_loss: 0.7460, test_loss: 0.9210, test_f1: 0.6216
 epoch: 41, train_loss: 0.7436, test_loss: 0.9339, test_f1: 0.6037
 epoch: 42, train_loss: 0.7454, test_loss: 0.9745, test_f1: 0.5805
 epoch: 43, train_loss: 0.7261, test_loss: 0.9007, test_f1: 0.6368
 epoch: 44, train_loss: 0.7184, test_loss: 0.9336, test_f1: 0.5957
 epoch: 45, train_loss: 0.7362, test_loss: 1.0325, test_f1: 0.5316
 epoch: 46, train_loss: 0.7153, test_loss: 0.9734, test_f1: 0.5727
 epoch: 47, train_loss: 0.7226, test_loss: 0.8971, test_f1: 0.5898
 epoch: 48, train_loss: 0.7329, test_loss: 0.9432, test_f1: 0.6065
 epoch: 49, train_loss: 0.7039, test_loss: 1.0023, test_f1: 0.5889
 epoch: 50, train_loss: 0.7055, test_loss: 0.8780, test_f1: 0.5971
 epoch: 51, train_loss: 0.6946, test_loss: 0.8733, test_f1: 0.6035
 epoch: 52, train_loss: 0.6515, test_loss: 0.8466, test_f1: 0.6300
 epoch: 53, train_loss: 0.6370, test_loss: 0.8597, test_f1: 0.6622
 epoch: 54, train_loss: 0.6405, test_loss: 0.8733, test_f1: 0.6359
 epoch: 55, train_loss: 0.6212, test_loss: 0.9041, test_f1: 0.6408
 epoch: 56, train_loss: 0.6440, test_loss: 0.9160, test_f1: 0.6116
 epoch: 57, train_loss: 0.6418, test_loss: 0.8571, test_f1: 0.6418
 epoch: 58, train_loss: 0.6408, test_loss: 0.8732, test_f1: 0.6538
 epoch: 59, train_loss: 0.6342, test_loss: 0.9344, test_f1: 0.6238
 epoch: 60, train_loss: 0.6291, test_loss: 0.8901, test_f1: 0.6446
 epoch: 61, train_loss: 0.6310, test_loss: 0.9440, test_f1: 0.6164
 epoch: 62, train_loss: 0.6141, test_loss: 0.9211, test_f1: 0.6679
 epoch: 63, train_loss: 0.6180, test_loss: 1.0205, test_f1: 0.6299
 epoch: 64, train_loss: 0.6251, test_loss: 0.9979, test_f1: 0.6102
 epoch: 65, train_loss: 0.6114, test_loss: 1.0032, test_f1: 0.6462
 epoch: 66, train_loss: 0.6128, test_loss: 0.9907, test_f1: 0.6010
 epoch: 67, train_loss: 0.6055, test_loss: 1.0051, test_f1: 0.6239
 epoch: 68, train_loss: 0.6067, test_loss: 0.9479, test_f1: 0.5967
 epoch: 69, train_loss: 0.6155, test_loss: 1.0262, test_f1: 0.6204
 epoch: 70, train_loss: 0.5931, test_loss: 0.9363, test_f1: 0.6323
 epoch: 71, train_loss: 0.5948, test_loss: 1.0328, test_f1: 0.5963
 epoch: 72, train_loss: 0.6105, test_loss: 0.9959, test_f1: 0.6538
 epoch: 73, train_loss: 0.6154, test_loss: 0.8854, test_f1: 0.6473
 epoch: 74, train_loss: 0.6052, test_loss: 1.0088, test_f1: 0.6055
 epoch: 75, train_loss: 0.6028, test_loss: 0.9564, test_f1: 0.6400
 epoch: 76, train_loss: 0.5861, test_loss: 1.0355, test_f1: 0.6625
 epoch: 77, train_loss: 0.5929, test_loss: 1.0361, test_f1: 0.6182
 epoch: 78, train_loss: 0.5800, test_loss: 0.9649, test_f1: 0.6269
 epoch: 79, train_loss: 0.5964, test_loss: 1.0146, test_f1: 0.6441
 epoch: 80, train_loss: 0.5651, test_loss: 0.9156, test_f1: 0.7013
 epoch: 81, train_loss: 0.5793, test_loss: 1.0109, test_f1: 0.6179
 epoch: 82, train_loss: 0.5775, test_loss: 0.9259, test_f1: 0.6766
 epoch: 83, train_loss: 0.5656, test_loss: 0.9369, test_f1: 0.6129
 epoch: 84, train_loss: 0.5801, test_loss: 0.9744, test_f1: 0.6231
 epoch: 85, train_loss: 0.5731, test_loss: 0.9124, test_f1: 0.6616
 epoch: 86, train_loss: 0.5505, test_loss: 1.1266, test_f1: 0.6335
 epoch: 87, train_loss: 0.5759, test_loss: 0.8669, test_f1: 0.6284
 epoch: 88, train_loss: 0.5738, test_loss: 0.9014, test_f1: 0.6363
 epoch: 89, train_loss: 0.5476, test_loss: 0.9607, test_f1: 0.6565
 epoch: 90, train_loss: 0.5331, test_loss: 1.0221, test_f1: 0.6725
 epoch: 91, train_loss: 0.5451, test_loss: 1.0616, test_f1: 0.6478
 epoch: 92, train_loss: 0.5565, test_loss: 0.9761, test_f1: 0.6904
 epoch: 93, train_loss: 0.5681, test_loss: 0.9963, test_f1: 0.6625
 epoch: 94, train_loss: 0.5463, test_loss: 0.9311, test_f1: 0.6562
 epoch: 95, train_loss: 0.5403, test_loss: 1.0772, test_f1: 0.6263
 epoch: 96, train_loss: 0.5417, test_loss: 1.0104, test_f1: 0.6783
 epoch: 97, train_loss: 0.5536, test_loss: 0.9147, test_f1: 0.6973
 epoch: 98, train_loss: 0.5552, test_loss: 0.9963, test_f1: 0.6703
 epoch: 99, train_loss: 0.5347, test_loss: 1.0284, test_f1: 0.6354
##################ITERATION #9 ****************************************
 epoch: 0, train_loss: 1.2465, test_loss: 1.2550, test_f1: 0.3029
 epoch: 1, train_loss: 1.0340, test_loss: 1.0103, test_f1: 0.4585
 epoch: 2, train_loss: 0.9901, test_loss: 0.9968, test_f1: 0.4629
 epoch: 3, train_loss: 0.9851, test_loss: 1.0125, test_f1: 0.4980
 epoch: 4, train_loss: 0.9577, test_loss: 0.9521, test_f1: 0.5095
 epoch: 5, train_loss: 0.9362, test_loss: 1.0043, test_f1: 0.5282
 epoch: 6, train_loss: 0.9326, test_loss: 0.9320, test_f1: 0.4747
 epoch: 7, train_loss: 0.9196, test_loss: 0.9342, test_f1: 0.4941
 epoch: 8, train_loss: 0.9272, test_loss: 1.0011, test_f1: 0.4769
 epoch: 9, train_loss: 0.9083, test_loss: 0.9880, test_f1: 0.5084
 epoch: 10, train_loss: 0.9015, test_loss: 0.9497, test_f1: 0.4922
 epoch: 11, train_loss: 0.8888, test_loss: 0.9539, test_f1: 0.5493
 epoch: 12, train_loss: 0.8832, test_loss: 1.0011, test_f1: 0.5260
 epoch: 13, train_loss: 0.8804, test_loss: 0.9159, test_f1: 0.5498
 epoch: 14, train_loss: 0.8699, test_loss: 1.0497, test_f1: 0.5282
 epoch: 15, train_loss: 0.8552, test_loss: 0.9711, test_f1: 0.5446
 epoch: 16, train_loss: 0.8569, test_loss: 1.0007, test_f1: 0.5510
 epoch: 17, train_loss: 0.8541, test_loss: 0.9094, test_f1: 0.5340
 epoch: 18, train_loss: 0.8540, test_loss: 0.9866, test_f1: 0.5018
 epoch: 19, train_loss: 0.8390, test_loss: 0.9247, test_f1: 0.5668
 epoch: 20, train_loss: 0.8408, test_loss: 0.9152, test_f1: 0.5387
 epoch: 21, train_loss: 0.8416, test_loss: 1.0136, test_f1: 0.5202
 epoch: 22, train_loss: 0.8236, test_loss: 0.9490, test_f1: 0.5336
 epoch: 23, train_loss: 0.8164, test_loss: 0.9486, test_f1: 0.5688
 epoch: 24, train_loss: 0.8219, test_loss: 0.9209, test_f1: 0.5562
 epoch: 25, train_loss: 0.8150, test_loss: 0.9634, test_f1: 0.5287
 epoch: 26, train_loss: 0.8463, test_loss: 1.0601, test_f1: 0.5144
 epoch: 27, train_loss: 0.8115, test_loss: 1.1151, test_f1: 0.5240
 epoch: 28, train_loss: 0.8091, test_loss: 0.9150, test_f1: 0.5644
 epoch: 29, train_loss: 0.8020, test_loss: 0.9582, test_f1: 0.5724
 epoch: 30, train_loss: 0.7915, test_loss: 0.9461, test_f1: 0.5687
 epoch: 31, train_loss: 0.8125, test_loss: 0.9386, test_f1: 0.5714
 epoch: 32, train_loss: 0.7859, test_loss: 0.9270, test_f1: 0.5874
 epoch: 33, train_loss: 0.7835, test_loss: 0.9643, test_f1: 0.5958
 epoch: 34, train_loss: 0.7786, test_loss: 0.9193, test_f1: 0.5635
 epoch: 35, train_loss: 0.7895, test_loss: 0.8952, test_f1: 0.6041
 epoch: 36, train_loss: 0.7881, test_loss: 0.8818, test_f1: 0.5778
 epoch: 37, train_loss: 0.7665, test_loss: 0.9240, test_f1: 0.5785
 epoch: 38, train_loss: 0.7625, test_loss: 0.9938, test_f1: 0.5731
 epoch: 39, train_loss: 0.7410, test_loss: 0.8792, test_f1: 0.6135
 epoch: 40, train_loss: 0.7478, test_loss: 0.9441, test_f1: 0.6064
 epoch: 41, train_loss: 0.7512, test_loss: 0.9957, test_f1: 0.5970
 epoch: 42, train_loss: 0.7633, test_loss: 0.9592, test_f1: 0.5455
 epoch: 43, train_loss: 0.7587, test_loss: 0.9516, test_f1: 0.6290
 epoch: 44, train_loss: 0.7317, test_loss: 0.9791, test_f1: 0.5627
 epoch: 45, train_loss: 0.7204, test_loss: 0.8793, test_f1: 0.6347
 epoch: 46, train_loss: 0.7455, test_loss: 0.9173, test_f1: 0.5824
 epoch: 47, train_loss: 0.7509, test_loss: 0.9680, test_f1: 0.5784
 epoch: 48, train_loss: 0.7282, test_loss: 0.8636, test_f1: 0.6260
 epoch: 49, train_loss: 0.7496, test_loss: 0.8979, test_f1: 0.5963
 epoch: 50, train_loss: 0.7284, test_loss: 0.8957, test_f1: 0.5784
 epoch: 51, train_loss: 0.6960, test_loss: 0.8865, test_f1: 0.6195
 epoch: 52, train_loss: 0.6764, test_loss: 0.8806, test_f1: 0.6342
 epoch: 53, train_loss: 0.6657, test_loss: 0.8995, test_f1: 0.6429
 epoch: 54, train_loss: 0.6606, test_loss: 0.9306, test_f1: 0.5980
 epoch: 55, train_loss: 0.6542, test_loss: 0.8578, test_f1: 0.6377
 epoch: 56, train_loss: 0.6505, test_loss: 0.9189, test_f1: 0.6502
 epoch: 57, train_loss: 0.6555, test_loss: 0.8831, test_f1: 0.6484
 epoch: 58, train_loss: 0.6432, test_loss: 0.8513, test_f1: 0.6318
 epoch: 59, train_loss: 0.6369, test_loss: 0.8902, test_f1: 0.6202
 epoch: 60, train_loss: 0.6238, test_loss: 0.9132, test_f1: 0.6380
 epoch: 61, train_loss: 0.6343, test_loss: 0.9313, test_f1: 0.5907
 epoch: 62, train_loss: 0.6259, test_loss: 0.9123, test_f1: 0.6550
 epoch: 63, train_loss: 0.6331, test_loss: 0.8963, test_f1: 0.6686
 epoch: 64, train_loss: 0.6196, test_loss: 0.9902, test_f1: 0.5991
 epoch: 65, train_loss: 0.6225, test_loss: 1.0557, test_f1: 0.6183
 epoch: 66, train_loss: 0.6376, test_loss: 0.9468, test_f1: 0.6402
 epoch: 67, train_loss: 0.6313, test_loss: 0.8943, test_f1: 0.6492
 epoch: 68, train_loss: 0.6113, test_loss: 0.9069, test_f1: 0.6605
 epoch: 69, train_loss: 0.6178, test_loss: 0.9334, test_f1: 0.6261
 epoch: 70, train_loss: 0.6062, test_loss: 0.9738, test_f1: 0.6369
 epoch: 71, train_loss: 0.6088, test_loss: 0.9855, test_f1: 0.6615
 epoch: 72, train_loss: 0.6272, test_loss: 0.9714, test_f1: 0.6239
 epoch: 73, train_loss: 0.6089, test_loss: 0.9190, test_f1: 0.6439
 epoch: 74, train_loss: 0.6146, test_loss: 0.9596, test_f1: 0.6385
 epoch: 75, train_loss: 0.6124, test_loss: 0.9618, test_f1: 0.6397
 epoch: 76, train_loss: 0.6060, test_loss: 0.9720, test_f1: 0.6475
 epoch: 77, train_loss: 0.6111, test_loss: 0.9366, test_f1: 0.6521
 epoch: 78, train_loss: 0.5907, test_loss: 1.0222, test_f1: 0.6599
 epoch: 79, train_loss: 0.5670, test_loss: 1.0917, test_f1: 0.6503
 epoch: 80, train_loss: 0.5615, test_loss: 0.9579, test_f1: 0.6554
 epoch: 81, train_loss: 0.5803, test_loss: 0.9570, test_f1: 0.6543
 epoch: 82, train_loss: 0.5670, test_loss: 1.0310, test_f1: 0.6404
 epoch: 83, train_loss: 0.5701, test_loss: 0.9550, test_f1: 0.6598
 epoch: 84, train_loss: 0.6025, test_loss: 1.0004, test_f1: 0.6391
 epoch: 85, train_loss: 0.5853, test_loss: 0.9494, test_f1: 0.6499
 epoch: 86, train_loss: 0.5824, test_loss: 0.9988, test_f1: 0.6365
 epoch: 87, train_loss: 0.5728, test_loss: 0.9646, test_f1: 0.6485
 epoch: 88, train_loss: 0.5539, test_loss: 1.0076, test_f1: 0.6519
 epoch: 89, train_loss: 0.5635, test_loss: 0.9788, test_f1: 0.6334
 epoch: 90, train_loss: 0.5675, test_loss: 1.0973, test_f1: 0.6204
 epoch: 91, train_loss: 0.5664, test_loss: 0.9679, test_f1: 0.6241
 epoch: 92, train_loss: 0.5772, test_loss: 1.0189, test_f1: 0.6499
 epoch: 93, train_loss: 0.5507, test_loss: 1.0494, test_f1: 0.6658
 epoch: 94, train_loss: 0.5689, test_loss: 1.0085, test_f1: 0.6383
 epoch: 95, train_loss: 0.5698, test_loss: 1.0755, test_f1: 0.6512
 epoch: 96, train_loss: 0.5730, test_loss: 0.9931, test_f1: 0.6542
 epoch: 97, train_loss: 0.5496, test_loss: 1.0302, test_f1: 0.6208
 epoch: 98, train_loss: 0.5283, test_loss: 1.0280, test_f1: 0.6583
 epoch: 99, train_loss: 0.5510, test_loss: 1.0582, test_f1: 0.6307

Training completed in 486.20 seconds
Best F1: 0.7013 at epoch 80
Mean F1 across iterations: 0.6746  0.0147
========================FINAL RESULTS================================
FEGIN weighted F1: 0.7013  0.0147
python main.py --data ltspice_examples --representation component_net --model FEGIN --layers 4 --hiddens 32 --batch_size 128 --lr 0.01 --emb_size 250 --epochs 100 --save_appendix component_net_L4_H32_BS128_LR0.01_E250 --no_val
-----



STDERR:
  File "main.py", line 370, in <module>
    main()
  File "main.py", line 254, in main
    dataset = dataset_class(
  File "/home/philip/projects/ltspice_examples_code_repo/Circuit-Completion-Using-GNNs/component_classification_with_link_prediction_head/evaluation/FEGIN/kernel/circuit_datasets.py", line 15, in __init__
    self.data, self.slices = torch.load(self.processed_paths[0])
  File "/home/philip/.local/lib/python3.8/site-packages/torch/serialization.py", line 1040, in load
    warnings.warn(
  File "/usr/lib/python3.8/warnings.py", line 109, in _showwarnmsg
    sw(msg.message, msg.category, msg.filename, msg.lineno,
  File "main.py", line 47, in warn_with_traceback
    traceback.print_stack(file=log)
/home/philip/projects/ltspice_examples_code_repo/Circuit-Completion-Using-GNNs/component_classification_with_link_prediction_head/evaluation/FEGIN/kernel/circuit_datasets.py:15: FutureWarning: You are using `torch.load` with `weights_only=False` (the current default value), which uses the default pickle module implicitly. It is possible to construct malicious pickle data which will execute arbitrary code during unpickling (See https://github.com/pytorch/pytorch/blob/main/SECURITY.md#untrusted-models for more details). In a future release, the default value for `weights_only` will be flipped to `True`. This limits the functions that could be executed during unpickling. Arbitrary objects will no longer be allowed to be loaded via this mode unless they are explicitly allowlisted by the user via `torch.serialization.add_safe_globals`. We recommend you start setting `weights_only=True` for any use case where you don't have full control of the loaded file. Please open an issue on GitHub for any issues related to this experimental feature.
  self.data, self.slices = torch.load(self.processed_paths[0])
