STDOUT:
Results will be saved in /home/philip/projects/ltspice_examples_code_repo/Circuit-Completion-Using-GNNs/component_classification_with_link_prediction_head/evaluation/FEGIN/results/model_FEGIN_dataset_ltspice_demos
Command line input: python main.py --data ltspice_demos --representation component_pin --model FEGIN --layers 4 --hiddens 32 --batch_size 256 --lr 0.001 --emb_size 128 --epochs 100 --save_appendix component_pin_L4_H32_BS256_LR0.001_E128 --no_val
 is saved.
-----
ltspice_demos - FEGIN
Using 4 layers, 32 hidden units, h = 2
Loading component_pin representation dataset
ENTERED
Training FEGIN on component_pin representation
Train: 1565, Test: 383
##################ITERATION #0 ****************************************
 epoch: 0, train_loss: 1.3097, test_loss: 1.3263, test_f1: 0.2628
 epoch: 1, train_loss: 1.2975, test_loss: 1.3224, test_f1: 0.2628
 epoch: 2, train_loss: 1.2885, test_loss: 1.3184, test_f1: 0.2628
 epoch: 3, train_loss: 1.2768, test_loss: 1.3138, test_f1: 0.2630
 epoch: 4, train_loss: 1.2638, test_loss: 1.3086, test_f1: 0.2615
 epoch: 5, train_loss: 1.2454, test_loss: 1.3027, test_f1: 0.2600
 epoch: 6, train_loss: 1.2253, test_loss: 1.2949, test_f1: 0.2884
 epoch: 7, train_loss: 1.2031, test_loss: 1.2851, test_f1: 0.3276
 epoch: 8, train_loss: 1.1801, test_loss: 1.2861, test_f1: 0.3346
 epoch: 9, train_loss: 1.1554, test_loss: 1.2604, test_f1: 0.3279
 epoch: 10, train_loss: 1.1293, test_loss: 1.2149, test_f1: 0.3544
 epoch: 11, train_loss: 1.1042, test_loss: 1.2068, test_f1: 0.3986
 epoch: 12, train_loss: 1.0810, test_loss: 1.2081, test_f1: 0.4052
 epoch: 13, train_loss: 1.0617, test_loss: 1.1506, test_f1: 0.4421
 epoch: 14, train_loss: 1.0312, test_loss: 1.2093, test_f1: 0.4088
 epoch: 15, train_loss: 1.0000, test_loss: 1.1619, test_f1: 0.4251
 epoch: 16, train_loss: 0.9937, test_loss: 1.0969, test_f1: 0.4439
 epoch: 17, train_loss: 0.9847, test_loss: 1.0851, test_f1: 0.4514
 epoch: 18, train_loss: 0.9717, test_loss: 1.0864, test_f1: 0.4620
 epoch: 19, train_loss: 0.9674, test_loss: 1.0766, test_f1: 0.4588
 epoch: 20, train_loss: 0.9636, test_loss: 1.0653, test_f1: 0.4542
 epoch: 21, train_loss: 0.9467, test_loss: 1.1064, test_f1: 0.4471
 epoch: 22, train_loss: 0.9414, test_loss: 1.0675, test_f1: 0.4315
 epoch: 23, train_loss: 0.9353, test_loss: 1.0782, test_f1: 0.4499
 epoch: 24, train_loss: 0.9264, test_loss: 1.0449, test_f1: 0.4529
 epoch: 25, train_loss: 0.9314, test_loss: 1.0730, test_f1: 0.4507
 epoch: 26, train_loss: 0.9147, test_loss: 1.0176, test_f1: 0.4804
 epoch: 27, train_loss: 0.9096, test_loss: 1.0518, test_f1: 0.4571
 epoch: 28, train_loss: 0.9035, test_loss: 1.0189, test_f1: 0.4637
 epoch: 29, train_loss: 0.8947, test_loss: 1.0724, test_f1: 0.4636
 epoch: 30, train_loss: 0.8915, test_loss: 1.0848, test_f1: 0.4637
 epoch: 31, train_loss: 0.8795, test_loss: 1.1933, test_f1: 0.4295
 epoch: 32, train_loss: 0.8873, test_loss: 2.4633, test_f1: 0.2636
 epoch: 33, train_loss: 0.8740, test_loss: 1.0133, test_f1: 0.4905
 epoch: 34, train_loss: 0.8767, test_loss: 1.3855, test_f1: 0.4009
 epoch: 35, train_loss: 0.8643, test_loss: 1.1090, test_f1: 0.4764
 epoch: 36, train_loss: 0.8529, test_loss: 1.2313, test_f1: 0.4730
 epoch: 37, train_loss: 0.8453, test_loss: 1.2154, test_f1: 0.4792
 epoch: 38, train_loss: 0.8293, test_loss: 1.0424, test_f1: 0.5013
 epoch: 39, train_loss: 0.8420, test_loss: 0.9888, test_f1: 0.5152
 epoch: 40, train_loss: 0.8283, test_loss: 0.9748, test_f1: 0.5721
 epoch: 41, train_loss: 0.8172, test_loss: 0.9845, test_f1: 0.5410
 epoch: 42, train_loss: 0.8034, test_loss: 1.0756, test_f1: 0.5397
 epoch: 43, train_loss: 0.7889, test_loss: 1.2018, test_f1: 0.4845
 epoch: 44, train_loss: 0.7979, test_loss: 1.9228, test_f1: 0.2818
 epoch: 45, train_loss: 0.8048, test_loss: 0.9354, test_f1: 0.5411
 epoch: 46, train_loss: 0.7768, test_loss: 0.9300, test_f1: 0.5741
 epoch: 47, train_loss: 0.7686, test_loss: 1.0050, test_f1: 0.4830
 epoch: 48, train_loss: 0.7745, test_loss: 1.0043, test_f1: 0.5611
 epoch: 49, train_loss: 0.7515, test_loss: 1.0333, test_f1: 0.5502
 epoch: 50, train_loss: 0.7406, test_loss: 1.0661, test_f1: 0.5533
 epoch: 51, train_loss: 0.7309, test_loss: 1.0840, test_f1: 0.5386
 epoch: 52, train_loss: 0.7196, test_loss: 1.0886, test_f1: 0.5519
 epoch: 53, train_loss: 0.7239, test_loss: 1.0988, test_f1: 0.5570
 epoch: 54, train_loss: 0.7268, test_loss: 1.1579, test_f1: 0.5432
 epoch: 55, train_loss: 0.7155, test_loss: 1.0629, test_f1: 0.5183
 epoch: 56, train_loss: 0.7053, test_loss: 1.0262, test_f1: 0.5655
 epoch: 57, train_loss: 0.7147, test_loss: 1.1150, test_f1: 0.4856
 epoch: 58, train_loss: 0.6963, test_loss: 1.0952, test_f1: 0.5724
 epoch: 59, train_loss: 0.6962, test_loss: 1.0561, test_f1: 0.5661
 epoch: 60, train_loss: 0.6797, test_loss: 1.0578, test_f1: 0.5708
 epoch: 61, train_loss: 0.6795, test_loss: 1.0586, test_f1: 0.5516
 epoch: 62, train_loss: 0.6679, test_loss: 1.1003, test_f1: 0.5733
 epoch: 63, train_loss: 0.6678, test_loss: 1.1270, test_f1: 0.5517
 epoch: 64, train_loss: 0.6702, test_loss: 1.1110, test_f1: 0.5586
 epoch: 65, train_loss: 0.6801, test_loss: 1.1307, test_f1: 0.5391
 epoch: 66, train_loss: 0.6500, test_loss: 1.1275, test_f1: 0.5611
 epoch: 67, train_loss: 0.6545, test_loss: 1.1289, test_f1: 0.5545
 epoch: 68, train_loss: 0.6515, test_loss: 1.1359, test_f1: 0.5714
 epoch: 69, train_loss: 0.6653, test_loss: 1.1000, test_f1: 0.5367
 epoch: 70, train_loss: 0.6673, test_loss: 1.0923, test_f1: 0.5412
 epoch: 71, train_loss: 0.6432, test_loss: 1.1526, test_f1: 0.5399
 epoch: 72, train_loss: 0.6609, test_loss: 1.1425, test_f1: 0.5382
 epoch: 73, train_loss: 0.6686, test_loss: 1.2023, test_f1: 0.5473
 epoch: 74, train_loss: 0.6600, test_loss: 1.1848, test_f1: 0.5361
 epoch: 75, train_loss: 0.6540, test_loss: 1.1618, test_f1: 0.5299
 epoch: 76, train_loss: 0.6525, test_loss: 1.2488, test_f1: 0.5253
 epoch: 77, train_loss: 0.6506, test_loss: 1.1734, test_f1: 0.5265
 epoch: 78, train_loss: 0.6429, test_loss: 1.2922, test_f1: 0.5387
 epoch: 79, train_loss: 0.6635, test_loss: 1.1822, test_f1: 0.5501
 epoch: 80, train_loss: 0.6727, test_loss: 1.2103, test_f1: 0.5487
 epoch: 81, train_loss: 0.6382, test_loss: 1.3290, test_f1: 0.5373
 epoch: 82, train_loss: 0.6475, test_loss: 1.3055, test_f1: 0.5425
 epoch: 83, train_loss: 0.6350, test_loss: 1.2689, test_f1: 0.5515
 epoch: 84, train_loss: 0.6424, test_loss: 1.1886, test_f1: 0.5711
 epoch: 85, train_loss: 0.6383, test_loss: 1.1944, test_f1: 0.5280
 epoch: 86, train_loss: 0.6406, test_loss: 1.1764, test_f1: 0.5223
 epoch: 87, train_loss: 0.6340, test_loss: 1.1456, test_f1: 0.5677
 epoch: 88, train_loss: 0.6481, test_loss: 1.1638, test_f1: 0.5743
 epoch: 89, train_loss: 0.6290, test_loss: 1.1829, test_f1: 0.5613
 epoch: 90, train_loss: 0.6341, test_loss: 1.2419, test_f1: 0.5786
 epoch: 91, train_loss: 0.6145, test_loss: 1.2718, test_f1: 0.5622
 epoch: 92, train_loss: 0.6159, test_loss: 1.1799, test_f1: 0.5994
 epoch: 93, train_loss: 0.6106, test_loss: 1.1442, test_f1: 0.5683
 epoch: 94, train_loss: 0.6120, test_loss: 1.1852, test_f1: 0.5491
 epoch: 95, train_loss: 0.6160, test_loss: 1.2198, test_f1: 0.5769
 epoch: 96, train_loss: 0.6068, test_loss: 1.2551, test_f1: 0.5584
 epoch: 97, train_loss: 0.6337, test_loss: 1.3008, test_f1: 0.5410
 epoch: 98, train_loss: 0.6037, test_loss: 1.2667, test_f1: 0.5483
 epoch: 99, train_loss: 0.6032, test_loss: 1.2557, test_f1: 0.5521
##################ITERATION #1 ****************************************
 epoch: 0, train_loss: 1.2547, test_loss: 1.2972, test_f1: 0.2281
 epoch: 1, train_loss: 1.2076, test_loss: 1.2975, test_f1: 0.2281
 epoch: 2, train_loss: 1.1794, test_loss: 1.3026, test_f1: 0.2281
 epoch: 3, train_loss: 1.1489, test_loss: 1.3153, test_f1: 0.2281
 epoch: 4, train_loss: 1.1180, test_loss: 1.3284, test_f1: 0.2281
 epoch: 5, train_loss: 1.0930, test_loss: 1.3346, test_f1: 0.2614
 epoch: 6, train_loss: 1.0681, test_loss: 1.3310, test_f1: 0.2614
 epoch: 7, train_loss: 1.0410, test_loss: 1.2733, test_f1: 0.3217
 epoch: 8, train_loss: 1.0173, test_loss: 1.1875, test_f1: 0.4239
 epoch: 9, train_loss: 0.9972, test_loss: 1.1552, test_f1: 0.4222
 epoch: 10, train_loss: 0.9711, test_loss: 1.0947, test_f1: 0.4464
 epoch: 11, train_loss: 0.9534, test_loss: 1.0845, test_f1: 0.4805
 epoch: 12, train_loss: 0.9337, test_loss: 1.0521, test_f1: 0.4872
 epoch: 13, train_loss: 0.9156, test_loss: 1.0349, test_f1: 0.5167
 epoch: 14, train_loss: 0.9022, test_loss: 1.0295, test_f1: 0.5316
 epoch: 15, train_loss: 0.8860, test_loss: 1.0106, test_f1: 0.5294
 epoch: 16, train_loss: 0.8722, test_loss: 1.0145, test_f1: 0.5238
 epoch: 17, train_loss: 0.8582, test_loss: 1.0189, test_f1: 0.5336
 epoch: 18, train_loss: 0.8559, test_loss: 1.0263, test_f1: 0.5561
 epoch: 19, train_loss: 0.8435, test_loss: 1.0221, test_f1: 0.5351
 epoch: 20, train_loss: 0.8408, test_loss: 0.9814, test_f1: 0.5358
 epoch: 21, train_loss: 0.8305, test_loss: 0.9878, test_f1: 0.5854
 epoch: 22, train_loss: 0.8040, test_loss: 1.1642, test_f1: 0.5763
 epoch: 23, train_loss: 0.8071, test_loss: 1.0273, test_f1: 0.5354
 epoch: 24, train_loss: 0.7923, test_loss: 1.1734, test_f1: 0.5592
 epoch: 25, train_loss: 0.7982, test_loss: 0.9628, test_f1: 0.5755
 epoch: 26, train_loss: 0.7842, test_loss: 0.9959, test_f1: 0.5967
 epoch: 27, train_loss: 0.7524, test_loss: 1.0515, test_f1: 0.5805
 epoch: 28, train_loss: 0.7565, test_loss: 1.0094, test_f1: 0.5953
 epoch: 29, train_loss: 0.7533, test_loss: 1.0582, test_f1: 0.5384
 epoch: 30, train_loss: 0.7488, test_loss: 1.0572, test_f1: 0.5806
 epoch: 31, train_loss: 0.7450, test_loss: 0.9774, test_f1: 0.6177
 epoch: 32, train_loss: 0.7233, test_loss: 1.0098, test_f1: 0.6015
 epoch: 33, train_loss: 0.7156, test_loss: 1.0173, test_f1: 0.6035
 epoch: 34, train_loss: 0.7404, test_loss: 1.0801, test_f1: 0.5829
 epoch: 35, train_loss: 0.7214, test_loss: 1.0689, test_f1: 0.5785
 epoch: 36, train_loss: 0.7346, test_loss: 1.2865, test_f1: 0.4752
 epoch: 37, train_loss: 0.7244, test_loss: 1.1948, test_f1: 0.5073
 epoch: 38, train_loss: 0.7053, test_loss: 1.1139, test_f1: 0.5280
 epoch: 39, train_loss: 0.6925, test_loss: 1.0558, test_f1: 0.5918
 epoch: 40, train_loss: 0.6891, test_loss: 1.0204, test_f1: 0.5852
 epoch: 41, train_loss: 0.6848, test_loss: 1.0403, test_f1: 0.5781
 epoch: 42, train_loss: 0.6796, test_loss: 1.0305, test_f1: 0.5979
 epoch: 43, train_loss: 0.6732, test_loss: 1.1282, test_f1: 0.5554
 epoch: 44, train_loss: 0.6686, test_loss: 1.1993, test_f1: 0.5693
 epoch: 45, train_loss: 0.6624, test_loss: 1.3299, test_f1: 0.5597
 epoch: 46, train_loss: 0.6703, test_loss: 1.1185, test_f1: 0.6003
 epoch: 47, train_loss: 0.6780, test_loss: 1.2077, test_f1: 0.5095
 epoch: 48, train_loss: 0.6866, test_loss: 1.1113, test_f1: 0.5529
 epoch: 49, train_loss: 0.6812, test_loss: 1.4747, test_f1: 0.5065
 epoch: 50, train_loss: 0.6695, test_loss: 1.3610, test_f1: 0.5010
 epoch: 51, train_loss: 0.6657, test_loss: 1.2364, test_f1: 0.5120
 epoch: 52, train_loss: 0.6567, test_loss: 1.0963, test_f1: 0.5467
 epoch: 53, train_loss: 0.6415, test_loss: 1.0972, test_f1: 0.5732
 epoch: 54, train_loss: 0.6485, test_loss: 1.0919, test_f1: 0.5786
 epoch: 55, train_loss: 0.6659, test_loss: 1.0939, test_f1: 0.5811
 epoch: 56, train_loss: 0.6410, test_loss: 1.2068, test_f1: 0.5558
 epoch: 57, train_loss: 0.6429, test_loss: 1.1395, test_f1: 0.5558
 epoch: 58, train_loss: 0.6333, test_loss: 1.1309, test_f1: 0.5874
 epoch: 59, train_loss: 0.6336, test_loss: 1.1476, test_f1: 0.5595
 epoch: 60, train_loss: 0.6355, test_loss: 1.1638, test_f1: 0.5638
 epoch: 61, train_loss: 0.6304, test_loss: 1.1092, test_f1: 0.5880
 epoch: 62, train_loss: 0.6314, test_loss: 1.1770, test_f1: 0.5788
 epoch: 63, train_loss: 0.6358, test_loss: 1.1519, test_f1: 0.5597
 epoch: 64, train_loss: 0.6233, test_loss: 1.1763, test_f1: 0.5582
 epoch: 65, train_loss: 0.6205, test_loss: 1.2018, test_f1: 0.5717
 epoch: 66, train_loss: 0.6145, test_loss: 1.1311, test_f1: 0.5837
 epoch: 67, train_loss: 0.6085, test_loss: 1.1936, test_f1: 0.5701
 epoch: 68, train_loss: 0.6094, test_loss: 1.1928, test_f1: 0.5766
 epoch: 69, train_loss: 0.6197, test_loss: 1.1733, test_f1: 0.5638
 epoch: 70, train_loss: 0.6140, test_loss: 1.1450, test_f1: 0.5720
 epoch: 71, train_loss: 0.6247, test_loss: 1.1920, test_f1: 0.5672
 epoch: 72, train_loss: 0.6101, test_loss: 1.2630, test_f1: 0.5510
 epoch: 73, train_loss: 0.6102, test_loss: 1.3820, test_f1: 0.5167
 epoch: 74, train_loss: 0.6127, test_loss: 1.2140, test_f1: 0.5609
 epoch: 75, train_loss: 0.6120, test_loss: 1.1653, test_f1: 0.5747
 epoch: 76, train_loss: 0.6016, test_loss: 1.1556, test_f1: 0.5763
 epoch: 77, train_loss: 0.5993, test_loss: 1.1838, test_f1: 0.5763
 epoch: 78, train_loss: 0.6055, test_loss: 1.2015, test_f1: 0.5542
 epoch: 79, train_loss: 0.6166, test_loss: 1.1755, test_f1: 0.5651
 epoch: 80, train_loss: 0.6143, test_loss: 1.2139, test_f1: 0.5758
 epoch: 81, train_loss: 0.6122, test_loss: 1.1933, test_f1: 0.5733
 epoch: 82, train_loss: 0.6126, test_loss: 1.2865, test_f1: 0.5469
 epoch: 83, train_loss: 0.6010, test_loss: 1.1926, test_f1: 0.5581
 epoch: 84, train_loss: 0.6022, test_loss: 1.1830, test_f1: 0.5673
 epoch: 85, train_loss: 0.6059, test_loss: 1.1404, test_f1: 0.5655
 epoch: 86, train_loss: 0.6029, test_loss: 1.2260, test_f1: 0.5521
 epoch: 87, train_loss: 0.6000, test_loss: 1.1251, test_f1: 0.5925
 epoch: 88, train_loss: 0.5963, test_loss: 1.1374, test_f1: 0.5533
 epoch: 89, train_loss: 0.5986, test_loss: 1.0992, test_f1: 0.5757
 epoch: 90, train_loss: 0.5890, test_loss: 1.1659, test_f1: 0.5583
 epoch: 91, train_loss: 0.6136, test_loss: 1.2045, test_f1: 0.5723
 epoch: 92, train_loss: 0.5883, test_loss: 1.2225, test_f1: 0.5052
 epoch: 93, train_loss: 0.6119, test_loss: 1.3030, test_f1: 0.5470
 epoch: 94, train_loss: 0.6015, test_loss: 1.2649, test_f1: 0.5701
 epoch: 95, train_loss: 0.6036, test_loss: 1.2267, test_f1: 0.5619
 epoch: 96, train_loss: 0.5945, test_loss: 1.1866, test_f1: 0.5679
 epoch: 97, train_loss: 0.5956, test_loss: 1.2222, test_f1: 0.5851
 epoch: 98, train_loss: 0.5989, test_loss: 1.2104, test_f1: 0.5937
 epoch: 99, train_loss: 0.5921, test_loss: 1.2339, test_f1: 0.5966
##################ITERATION #2 ****************************************
 epoch: 0, train_loss: 1.2455, test_loss: 1.3124, test_f1: 0.2281
 epoch: 1, train_loss: 1.1851, test_loss: 1.3042, test_f1: 0.2281
 epoch: 2, train_loss: 1.1515, test_loss: 1.2866, test_f1: 0.2281
 epoch: 3, train_loss: 1.1228, test_loss: 1.2686, test_f1: 0.2281
 epoch: 4, train_loss: 1.0898, test_loss: 1.2520, test_f1: 0.2446
 epoch: 5, train_loss: 1.0653, test_loss: 1.2249, test_f1: 0.3183
 epoch: 6, train_loss: 1.0289, test_loss: 1.2001, test_f1: 0.3457
 epoch: 7, train_loss: 1.0096, test_loss: 1.1668, test_f1: 0.3774
 epoch: 8, train_loss: 0.9990, test_loss: 1.1023, test_f1: 0.4072
 epoch: 9, train_loss: 0.9762, test_loss: 1.0743, test_f1: 0.4309
 epoch: 10, train_loss: 0.9712, test_loss: 1.0810, test_f1: 0.4304
 epoch: 11, train_loss: 0.9438, test_loss: 1.0601, test_f1: 0.4526
 epoch: 12, train_loss: 0.9306, test_loss: 1.0210, test_f1: 0.5155
 epoch: 13, train_loss: 0.9095, test_loss: 1.0246, test_f1: 0.4796
 epoch: 14, train_loss: 0.8948, test_loss: 1.0444, test_f1: 0.5105
 epoch: 15, train_loss: 0.8863, test_loss: 1.0725, test_f1: 0.4768
 epoch: 16, train_loss: 0.8831, test_loss: 1.0432, test_f1: 0.5042
 epoch: 17, train_loss: 0.8602, test_loss: 1.0181, test_f1: 0.5199
 epoch: 18, train_loss: 0.8345, test_loss: 0.9993, test_f1: 0.5279
 epoch: 19, train_loss: 0.8261, test_loss: 1.0170, test_f1: 0.5211
 epoch: 20, train_loss: 0.8214, test_loss: 0.9819, test_f1: 0.5315
 epoch: 21, train_loss: 0.8135, test_loss: 1.0268, test_f1: 0.5300
 epoch: 22, train_loss: 0.8019, test_loss: 1.0013, test_f1: 0.5787
 epoch: 23, train_loss: 0.8156, test_loss: 0.9984, test_f1: 0.5244
 epoch: 24, train_loss: 0.7914, test_loss: 1.0255, test_f1: 0.4948
 epoch: 25, train_loss: 0.8114, test_loss: 1.0638, test_f1: 0.4576
 epoch: 26, train_loss: 0.8097, test_loss: 0.9970, test_f1: 0.5337
 epoch: 27, train_loss: 0.7873, test_loss: 1.0282, test_f1: 0.4627
 epoch: 28, train_loss: 0.7702, test_loss: 1.0157, test_f1: 0.4914
 epoch: 29, train_loss: 0.7579, test_loss: 0.9563, test_f1: 0.5216
 epoch: 30, train_loss: 0.7579, test_loss: 0.9869, test_f1: 0.5456
 epoch: 31, train_loss: 0.7534, test_loss: 0.9726, test_f1: 0.5019
 epoch: 32, train_loss: 0.7816, test_loss: 0.9498, test_f1: 0.5625
 epoch: 33, train_loss: 0.7694, test_loss: 0.9477, test_f1: 0.5485
 epoch: 34, train_loss: 0.7491, test_loss: 1.0056, test_f1: 0.5105
 epoch: 35, train_loss: 0.7389, test_loss: 0.9957, test_f1: 0.5332
 epoch: 36, train_loss: 0.7233, test_loss: 0.9847, test_f1: 0.5112
 epoch: 37, train_loss: 0.7234, test_loss: 0.9604, test_f1: 0.5491
 epoch: 38, train_loss: 0.7026, test_loss: 0.9625, test_f1: 0.5390
 epoch: 39, train_loss: 0.7101, test_loss: 0.9895, test_f1: 0.5099
 epoch: 40, train_loss: 0.7415, test_loss: 1.1360, test_f1: 0.4756
 epoch: 41, train_loss: 0.7525, test_loss: 1.0186, test_f1: 0.5553
 epoch: 42, train_loss: 0.7334, test_loss: 1.0564, test_f1: 0.5397
 epoch: 43, train_loss: 0.7408, test_loss: 0.9747, test_f1: 0.5858
 epoch: 44, train_loss: 0.7308, test_loss: 1.0019, test_f1: 0.5914
 epoch: 45, train_loss: 0.7162, test_loss: 1.0907, test_f1: 0.4957
 epoch: 46, train_loss: 0.7159, test_loss: 1.1280, test_f1: 0.4907
 epoch: 47, train_loss: 0.7261, test_loss: 0.9883, test_f1: 0.5476
 epoch: 48, train_loss: 0.7139, test_loss: 0.9812, test_f1: 0.5559
 epoch: 49, train_loss: 0.7130, test_loss: 0.9464, test_f1: 0.5659
 epoch: 50, train_loss: 0.7031, test_loss: 0.9817, test_f1: 0.5365
 epoch: 51, train_loss: 0.6937, test_loss: 0.9728, test_f1: 0.5641
 epoch: 52, train_loss: 0.6850, test_loss: 0.9831, test_f1: 0.5644
 epoch: 53, train_loss: 0.6784, test_loss: 0.9902, test_f1: 0.5508
 epoch: 54, train_loss: 0.6821, test_loss: 0.9615, test_f1: 0.5700
 epoch: 55, train_loss: 0.6777, test_loss: 0.9693, test_f1: 0.5960
 epoch: 56, train_loss: 0.6788, test_loss: 0.9587, test_f1: 0.5889
 epoch: 57, train_loss: 0.6692, test_loss: 0.9579, test_f1: 0.5750
 epoch: 58, train_loss: 0.6663, test_loss: 0.9852, test_f1: 0.5723
 epoch: 59, train_loss: 0.6628, test_loss: 0.9267, test_f1: 0.5734
 epoch: 60, train_loss: 0.6776, test_loss: 0.9540, test_f1: 0.5779
 epoch: 61, train_loss: 0.6733, test_loss: 0.9886, test_f1: 0.5627
 epoch: 62, train_loss: 0.6596, test_loss: 1.0245, test_f1: 0.5549
 epoch: 63, train_loss: 0.6787, test_loss: 0.9814, test_f1: 0.5598
 epoch: 64, train_loss: 0.6563, test_loss: 0.9926, test_f1: 0.5505
 epoch: 65, train_loss: 0.6668, test_loss: 0.9803, test_f1: 0.5630
 epoch: 66, train_loss: 0.6574, test_loss: 1.0232, test_f1: 0.5838
 epoch: 67, train_loss: 0.6604, test_loss: 1.0194, test_f1: 0.5982
 epoch: 68, train_loss: 0.6494, test_loss: 0.9895, test_f1: 0.5942
 epoch: 69, train_loss: 0.6430, test_loss: 0.9714, test_f1: 0.5813
 epoch: 70, train_loss: 0.6547, test_loss: 0.9764, test_f1: 0.5927
 epoch: 71, train_loss: 0.6505, test_loss: 0.9516, test_f1: 0.6134
 epoch: 72, train_loss: 0.6626, test_loss: 0.9392, test_f1: 0.6043
 epoch: 73, train_loss: 0.6640, test_loss: 0.9697, test_f1: 0.6048
 epoch: 74, train_loss: 0.6580, test_loss: 0.9771, test_f1: 0.5886
 epoch: 75, train_loss: 0.6685, test_loss: 1.0403, test_f1: 0.5535
 epoch: 76, train_loss: 0.6425, test_loss: 1.0123, test_f1: 0.5716
 epoch: 77, train_loss: 0.6458, test_loss: 0.9898, test_f1: 0.5702
 epoch: 78, train_loss: 0.6425, test_loss: 1.0113, test_f1: 0.5711
 epoch: 79, train_loss: 0.6470, test_loss: 1.0389, test_f1: 0.5720
 epoch: 80, train_loss: 0.6338, test_loss: 1.0477, test_f1: 0.5766
 epoch: 81, train_loss: 0.6324, test_loss: 1.0182, test_f1: 0.5812
 epoch: 82, train_loss: 0.6278, test_loss: 1.0502, test_f1: 0.5755
 epoch: 83, train_loss: 0.6667, test_loss: 0.9639, test_f1: 0.6054
 epoch: 84, train_loss: 0.6435, test_loss: 0.9405, test_f1: 0.6068
 epoch: 85, train_loss: 0.6376, test_loss: 1.0067, test_f1: 0.5971
 epoch: 86, train_loss: 0.6424, test_loss: 0.9975, test_f1: 0.5899
 epoch: 87, train_loss: 0.6406, test_loss: 0.9799, test_f1: 0.6016
 epoch: 88, train_loss: 0.6391, test_loss: 0.9676, test_f1: 0.5993
 epoch: 89, train_loss: 0.6338, test_loss: 0.9728, test_f1: 0.5851
 epoch: 90, train_loss: 0.6366, test_loss: 0.9762, test_f1: 0.5977
 epoch: 91, train_loss: 0.6642, test_loss: 1.0742, test_f1: 0.5798
 epoch: 92, train_loss: 0.6781, test_loss: 1.0405, test_f1: 0.5811
 epoch: 93, train_loss: 0.6462, test_loss: 1.0670, test_f1: 0.5769
 epoch: 94, train_loss: 0.6452, test_loss: 1.0730, test_f1: 0.5657
 epoch: 95, train_loss: 0.6347, test_loss: 1.0157, test_f1: 0.5834
 epoch: 96, train_loss: 0.6270, test_loss: 1.0005, test_f1: 0.5850
 epoch: 97, train_loss: 0.6273, test_loss: 1.0470, test_f1: 0.5762
 epoch: 98, train_loss: 0.6203, test_loss: 1.0683, test_f1: 0.5788
 epoch: 99, train_loss: 0.6058, test_loss: 1.0319, test_f1: 0.5929
##################ITERATION #3 ****************************************
 epoch: 0, train_loss: 1.2074, test_loss: 1.3235, test_f1: 0.2281
 epoch: 1, train_loss: 1.1303, test_loss: 1.3243, test_f1: 0.2281
 epoch: 2, train_loss: 1.1009, test_loss: 1.3353, test_f1: 0.2281
 epoch: 3, train_loss: 1.0656, test_loss: 1.3314, test_f1: 0.2281
 epoch: 4, train_loss: 1.0435, test_loss: 1.3126, test_f1: 0.2281
 epoch: 5, train_loss: 1.0083, test_loss: 1.2832, test_f1: 0.2281
 epoch: 6, train_loss: 0.9938, test_loss: 1.2349, test_f1: 0.2855
 epoch: 7, train_loss: 0.9576, test_loss: 1.1509, test_f1: 0.3748
 epoch: 8, train_loss: 0.9450, test_loss: 1.0767, test_f1: 0.4386
 epoch: 9, train_loss: 0.9096, test_loss: 1.0517, test_f1: 0.4763
 epoch: 10, train_loss: 0.9072, test_loss: 1.0245, test_f1: 0.5458
 epoch: 11, train_loss: 0.8837, test_loss: 1.0219, test_f1: 0.5478
 epoch: 12, train_loss: 0.8693, test_loss: 1.0334, test_f1: 0.5491
 epoch: 13, train_loss: 0.8578, test_loss: 1.0101, test_f1: 0.5734
 epoch: 14, train_loss: 0.8452, test_loss: 1.0291, test_f1: 0.5593
 epoch: 15, train_loss: 0.8451, test_loss: 1.0062, test_f1: 0.5478
 epoch: 16, train_loss: 0.8247, test_loss: 0.9579, test_f1: 0.5652
 epoch: 17, train_loss: 0.8013, test_loss: 0.9594, test_f1: 0.5482
 epoch: 18, train_loss: 0.8152, test_loss: 0.9579, test_f1: 0.5704
 epoch: 19, train_loss: 0.8022, test_loss: 0.9614, test_f1: 0.5784
 epoch: 20, train_loss: 0.7895, test_loss: 0.9675, test_f1: 0.5663
 epoch: 21, train_loss: 0.7767, test_loss: 0.9444, test_f1: 0.6172
 epoch: 22, train_loss: 0.7654, test_loss: 0.9492, test_f1: 0.5890
 epoch: 23, train_loss: 0.7610, test_loss: 0.9569, test_f1: 0.6065
 epoch: 24, train_loss: 0.7389, test_loss: 0.9499, test_f1: 0.6111
 epoch: 25, train_loss: 0.7515, test_loss: 0.9280, test_f1: 0.6087
 epoch: 26, train_loss: 0.7475, test_loss: 0.9331, test_f1: 0.5763
 epoch: 27, train_loss: 0.7406, test_loss: 0.9218, test_f1: 0.5992
 epoch: 28, train_loss: 0.7419, test_loss: 1.0033, test_f1: 0.6118
 epoch: 29, train_loss: 0.7422, test_loss: 0.9257, test_f1: 0.5916
 epoch: 30, train_loss: 0.7443, test_loss: 0.9740, test_f1: 0.5705
 epoch: 31, train_loss: 0.7266, test_loss: 0.9597, test_f1: 0.6046
 epoch: 32, train_loss: 0.7196, test_loss: 0.9506, test_f1: 0.6175
 epoch: 33, train_loss: 0.7132, test_loss: 1.0252, test_f1: 0.5928
 epoch: 34, train_loss: 0.7371, test_loss: 0.9830, test_f1: 0.5921
 epoch: 35, train_loss: 0.7361, test_loss: 0.9808, test_f1: 0.5641
 epoch: 36, train_loss: 0.7126, test_loss: 0.9379, test_f1: 0.5999
 epoch: 37, train_loss: 0.7152, test_loss: 0.9396, test_f1: 0.6346
 epoch: 38, train_loss: 0.7074, test_loss: 0.9540, test_f1: 0.6067
 epoch: 39, train_loss: 0.7159, test_loss: 0.9885, test_f1: 0.5930
 epoch: 40, train_loss: 0.7006, test_loss: 0.9201, test_f1: 0.6433
 epoch: 41, train_loss: 0.6907, test_loss: 0.9179, test_f1: 0.5847
 epoch: 42, train_loss: 0.6803, test_loss: 0.9064, test_f1: 0.6100
 epoch: 43, train_loss: 0.6922, test_loss: 0.9136, test_f1: 0.6138
 epoch: 44, train_loss: 0.7392, test_loss: 0.8920, test_f1: 0.5923
 epoch: 45, train_loss: 0.7133, test_loss: 0.9020, test_f1: 0.6367
 epoch: 46, train_loss: 0.7020, test_loss: 0.9566, test_f1: 0.6134
 epoch: 47, train_loss: 0.6962, test_loss: 0.8993, test_f1: 0.6038
 epoch: 48, train_loss: 0.6750, test_loss: 0.8605, test_f1: 0.5923
 epoch: 49, train_loss: 0.6714, test_loss: 0.8652, test_f1: 0.6134
 epoch: 50, train_loss: 0.6629, test_loss: 0.9262, test_f1: 0.5964
 epoch: 51, train_loss: 0.6540, test_loss: 0.9439, test_f1: 0.6164
 epoch: 52, train_loss: 0.6619, test_loss: 0.8963, test_f1: 0.6313
 epoch: 53, train_loss: 0.6628, test_loss: 0.9289, test_f1: 0.6179
 epoch: 54, train_loss: 0.6552, test_loss: 0.9422, test_f1: 0.6011
 epoch: 55, train_loss: 0.6521, test_loss: 0.9483, test_f1: 0.6230
 epoch: 56, train_loss: 0.6465, test_loss: 0.9414, test_f1: 0.5911
 epoch: 57, train_loss: 0.6513, test_loss: 0.9533, test_f1: 0.6325
 epoch: 58, train_loss: 0.6463, test_loss: 0.9514, test_f1: 0.6095
 epoch: 59, train_loss: 0.6368, test_loss: 0.9453, test_f1: 0.5976
 epoch: 60, train_loss: 0.6373, test_loss: 0.9643, test_f1: 0.6061
 epoch: 61, train_loss: 0.6380, test_loss: 0.9477, test_f1: 0.6227
 epoch: 62, train_loss: 0.6248, test_loss: 0.9748, test_f1: 0.6191
 epoch: 63, train_loss: 0.6333, test_loss: 0.9530, test_f1: 0.6250
 epoch: 64, train_loss: 0.6332, test_loss: 0.9623, test_f1: 0.6192
 epoch: 65, train_loss: 0.6300, test_loss: 0.9715, test_f1: 0.6137
 epoch: 66, train_loss: 0.6213, test_loss: 0.9745, test_f1: 0.6126
 epoch: 67, train_loss: 0.6191, test_loss: 0.9638, test_f1: 0.6166
 epoch: 68, train_loss: 0.6168, test_loss: 0.9570, test_f1: 0.6053
 epoch: 69, train_loss: 0.6168, test_loss: 0.9728, test_f1: 0.6076
 epoch: 70, train_loss: 0.6274, test_loss: 0.9585, test_f1: 0.6089
 epoch: 71, train_loss: 0.6155, test_loss: 0.9656, test_f1: 0.6088
 epoch: 72, train_loss: 0.6225, test_loss: 0.9861, test_f1: 0.5802
 epoch: 73, train_loss: 0.6147, test_loss: 0.9720, test_f1: 0.6036
 epoch: 74, train_loss: 0.6071, test_loss: 0.9999, test_f1: 0.5913
 epoch: 75, train_loss: 0.6009, test_loss: 1.0190, test_f1: 0.6026
 epoch: 76, train_loss: 0.6103, test_loss: 1.0209, test_f1: 0.6054
 epoch: 77, train_loss: 0.6224, test_loss: 0.9898, test_f1: 0.6144
 epoch: 78, train_loss: 0.6155, test_loss: 1.0197, test_f1: 0.6077
 epoch: 79, train_loss: 0.6033, test_loss: 1.0394, test_f1: 0.5873
 epoch: 80, train_loss: 0.6004, test_loss: 0.9894, test_f1: 0.6171
 epoch: 81, train_loss: 0.6091, test_loss: 1.0158, test_f1: 0.6072
 epoch: 82, train_loss: 0.6060, test_loss: 1.0374, test_f1: 0.5971
 epoch: 83, train_loss: 0.6080, test_loss: 1.0408, test_f1: 0.5927
 epoch: 84, train_loss: 0.6060, test_loss: 1.0526, test_f1: 0.6035
 epoch: 85, train_loss: 0.6157, test_loss: 0.9781, test_f1: 0.6081
 epoch: 86, train_loss: 0.6029, test_loss: 1.0203, test_f1: 0.5973
 epoch: 87, train_loss: 0.5930, test_loss: 1.0101, test_f1: 0.6101
 epoch: 88, train_loss: 0.5978, test_loss: 0.9855, test_f1: 0.6080
 epoch: 89, train_loss: 0.5919, test_loss: 1.0225, test_f1: 0.6034
 epoch: 90, train_loss: 0.5970, test_loss: 1.0093, test_f1: 0.5970
 epoch: 91, train_loss: 0.5959, test_loss: 1.0589, test_f1: 0.5972
 epoch: 92, train_loss: 0.5912, test_loss: 1.0555, test_f1: 0.5870
 epoch: 93, train_loss: 0.5926, test_loss: 1.0100, test_f1: 0.5965
 epoch: 94, train_loss: 0.5932, test_loss: 0.9734, test_f1: 0.6163
 epoch: 95, train_loss: 0.5817, test_loss: 1.0317, test_f1: 0.6077
 epoch: 96, train_loss: 0.5833, test_loss: 1.0465, test_f1: 0.5938
 epoch: 97, train_loss: 0.5802, test_loss: 1.0548, test_f1: 0.6100
 epoch: 98, train_loss: 0.5984, test_loss: 1.0923, test_f1: 0.5865
 epoch: 99, train_loss: 0.5995, test_loss: 1.1604, test_f1: 0.5846
##################ITERATION #4 ****************************************
 epoch: 0, train_loss: 1.2355, test_loss: 1.3052, test_f1: 0.2281
 epoch: 1, train_loss: 1.1204, test_loss: 1.2973, test_f1: 0.2281
 epoch: 2, train_loss: 1.0786, test_loss: 1.3025, test_f1: 0.2281
 epoch: 3, train_loss: 1.0547, test_loss: 1.3267, test_f1: 0.2281
 epoch: 4, train_loss: 1.0239, test_loss: 1.3574, test_f1: 0.2231
 epoch: 5, train_loss: 0.9902, test_loss: 1.4401, test_f1: 0.1305
 epoch: 6, train_loss: 0.9578, test_loss: 1.5548, test_f1: 0.1237
 epoch: 7, train_loss: 0.9473, test_loss: 1.4866, test_f1: 0.1687
 epoch: 8, train_loss: 0.9245, test_loss: 1.2499, test_f1: 0.3458
 epoch: 9, train_loss: 0.9020, test_loss: 1.1917, test_f1: 0.4690
 epoch: 10, train_loss: 0.8789, test_loss: 1.1632, test_f1: 0.5172
 epoch: 11, train_loss: 0.8575, test_loss: 1.0434, test_f1: 0.5562
 epoch: 12, train_loss: 0.8586, test_loss: 1.0422, test_f1: 0.5385
 epoch: 13, train_loss: 0.8439, test_loss: 1.0320, test_f1: 0.5666
 epoch: 14, train_loss: 0.8239, test_loss: 1.0301, test_f1: 0.5525
 epoch: 15, train_loss: 0.8162, test_loss: 0.9994, test_f1: 0.5839
 epoch: 16, train_loss: 0.8098, test_loss: 1.0649, test_f1: 0.5881
 epoch: 17, train_loss: 0.7974, test_loss: 1.0268, test_f1: 0.5621
 epoch: 18, train_loss: 0.7850, test_loss: 1.0142, test_f1: 0.5881
 epoch: 19, train_loss: 0.7799, test_loss: 1.0691, test_f1: 0.5618
 epoch: 20, train_loss: 0.7685, test_loss: 1.0649, test_f1: 0.5671
 epoch: 21, train_loss: 0.7600, test_loss: 1.0244, test_f1: 0.5695
 epoch: 22, train_loss: 0.7523, test_loss: 1.0376, test_f1: 0.5856
 epoch: 23, train_loss: 0.7349, test_loss: 1.0750, test_f1: 0.6013
 epoch: 24, train_loss: 0.7370, test_loss: 1.0957, test_f1: 0.5856
 epoch: 25, train_loss: 0.7332, test_loss: 1.1134, test_f1: 0.5688
 epoch: 26, train_loss: 0.7365, test_loss: 1.0585, test_f1: 0.6113
 epoch: 27, train_loss: 0.7344, test_loss: 1.0761, test_f1: 0.5946
 epoch: 28, train_loss: 0.7108, test_loss: 1.0499, test_f1: 0.6021
 epoch: 29, train_loss: 0.7162, test_loss: 1.1320, test_f1: 0.5449
 epoch: 30, train_loss: 0.7084, test_loss: 1.0803, test_f1: 0.6051
 epoch: 31, train_loss: 0.6892, test_loss: 1.0999, test_f1: 0.5833
 epoch: 32, train_loss: 0.7065, test_loss: 1.1336, test_f1: 0.6055
 epoch: 33, train_loss: 0.6957, test_loss: 1.1244, test_f1: 0.6140
 epoch: 34, train_loss: 0.6865, test_loss: 1.1813, test_f1: 0.5982
 epoch: 35, train_loss: 0.6808, test_loss: 1.1501, test_f1: 0.6042
 epoch: 36, train_loss: 0.6773, test_loss: 1.1393, test_f1: 0.6179
 epoch: 37, train_loss: 0.6745, test_loss: 1.1531, test_f1: 0.5820
 epoch: 38, train_loss: 0.6872, test_loss: 1.1087, test_f1: 0.5934
 epoch: 39, train_loss: 0.6718, test_loss: 1.2272, test_f1: 0.5410
 epoch: 40, train_loss: 0.6684, test_loss: 1.1793, test_f1: 0.5853
 epoch: 41, train_loss: 0.6682, test_loss: 1.2001, test_f1: 0.5870
 epoch: 42, train_loss: 0.6617, test_loss: 1.0956, test_f1: 0.6312
 epoch: 43, train_loss: 0.6496, test_loss: 1.1454, test_f1: 0.6036
 epoch: 44, train_loss: 0.6526, test_loss: 1.2306, test_f1: 0.6126
 epoch: 45, train_loss: 0.6532, test_loss: 1.2216, test_f1: 0.6094
 epoch: 46, train_loss: 0.6498, test_loss: 1.2219, test_f1: 0.6324
 epoch: 47, train_loss: 0.6540, test_loss: 1.2355, test_f1: 0.6069
 epoch: 48, train_loss: 0.6529, test_loss: 1.3106, test_f1: 0.6125
 epoch: 49, train_loss: 0.6609, test_loss: 1.1945, test_f1: 0.6085
 epoch: 50, train_loss: 0.6520, test_loss: 1.1653, test_f1: 0.6113
 epoch: 51, train_loss: 0.6354, test_loss: 1.2277, test_f1: 0.5864
 epoch: 52, train_loss: 0.6255, test_loss: 1.2888, test_f1: 0.5964
 epoch: 53, train_loss: 0.6166, test_loss: 1.2819, test_f1: 0.6104
 epoch: 54, train_loss: 0.6160, test_loss: 1.2653, test_f1: 0.6103
 epoch: 55, train_loss: 0.6186, test_loss: 1.2421, test_f1: 0.6132
 epoch: 56, train_loss: 0.6141, test_loss: 1.2408, test_f1: 0.6104
 epoch: 57, train_loss: 0.6050, test_loss: 1.2600, test_f1: 0.6139
 epoch: 58, train_loss: 0.6089, test_loss: 1.2374, test_f1: 0.6270
 epoch: 59, train_loss: 0.5985, test_loss: 1.2638, test_f1: 0.6263
 epoch: 60, train_loss: 0.5945, test_loss: 1.2911, test_f1: 0.6052
 epoch: 61, train_loss: 0.6157, test_loss: 1.2297, test_f1: 0.5937
 epoch: 62, train_loss: 0.6242, test_loss: 1.2387, test_f1: 0.6127
 epoch: 63, train_loss: 0.6037, test_loss: 1.3197, test_f1: 0.6005
 epoch: 64, train_loss: 0.6060, test_loss: 1.3364, test_f1: 0.5921
 epoch: 65, train_loss: 0.6127, test_loss: 1.2870, test_f1: 0.5831
 epoch: 66, train_loss: 0.6033, test_loss: 1.4125, test_f1: 0.5824
 epoch: 67, train_loss: 0.5986, test_loss: 1.3068, test_f1: 0.5924
 epoch: 68, train_loss: 0.6107, test_loss: 1.3036, test_f1: 0.6217
 epoch: 69, train_loss: 0.5921, test_loss: 1.3663, test_f1: 0.6135
 epoch: 70, train_loss: 0.5994, test_loss: 1.4228, test_f1: 0.5924
 epoch: 71, train_loss: 0.5941, test_loss: 1.3520, test_f1: 0.5831
 epoch: 72, train_loss: 0.5960, test_loss: 1.2580, test_f1: 0.6220
 epoch: 73, train_loss: 0.5932, test_loss: 1.3270, test_f1: 0.6051
 epoch: 74, train_loss: 0.5772, test_loss: 1.3823, test_f1: 0.6066
 epoch: 75, train_loss: 0.5904, test_loss: 1.2829, test_f1: 0.6173
 epoch: 76, train_loss: 0.5992, test_loss: 1.2324, test_f1: 0.6168
 epoch: 77, train_loss: 0.5958, test_loss: 1.2956, test_f1: 0.6049
 epoch: 78, train_loss: 0.5839, test_loss: 1.3592, test_f1: 0.5965
 epoch: 79, train_loss: 0.5895, test_loss: 1.3825, test_f1: 0.6143
 epoch: 80, train_loss: 0.5823, test_loss: 1.3973, test_f1: 0.6011
 epoch: 81, train_loss: 0.5930, test_loss: 1.3391, test_f1: 0.6032
 epoch: 82, train_loss: 0.5669, test_loss: 1.3306, test_f1: 0.6008
 epoch: 83, train_loss: 0.5916, test_loss: 1.3133, test_f1: 0.6082
 epoch: 84, train_loss: 0.5630, test_loss: 1.4405, test_f1: 0.5604
 epoch: 85, train_loss: 0.5797, test_loss: 1.4326, test_f1: 0.5553
 epoch: 86, train_loss: 0.5710, test_loss: 1.3879, test_f1: 0.6101
 epoch: 87, train_loss: 0.5574, test_loss: 1.3876, test_f1: 0.5857
 epoch: 88, train_loss: 0.5691, test_loss: 1.3889, test_f1: 0.5745
 epoch: 89, train_loss: 0.5887, test_loss: 1.4675, test_f1: 0.5755
 epoch: 90, train_loss: 0.5705, test_loss: 1.4137, test_f1: 0.5669
 epoch: 91, train_loss: 0.5687, test_loss: 1.4008, test_f1: 0.5846
 epoch: 92, train_loss: 0.5673, test_loss: 1.3567, test_f1: 0.5767
 epoch: 93, train_loss: 0.5583, test_loss: 1.3209, test_f1: 0.5708
 epoch: 94, train_loss: 0.5679, test_loss: 1.3713, test_f1: 0.5998
 epoch: 95, train_loss: 0.5554, test_loss: 1.3929, test_f1: 0.5872
 epoch: 96, train_loss: 0.5634, test_loss: 1.3573, test_f1: 0.5976
 epoch: 97, train_loss: 0.5718, test_loss: 1.4212, test_f1: 0.5901
 epoch: 98, train_loss: 0.5528, test_loss: 1.5632, test_f1: 0.5909
 epoch: 99, train_loss: 0.5702, test_loss: 1.5093, test_f1: 0.5776
##################ITERATION #5 ****************************************
 epoch: 0, train_loss: 1.2894, test_loss: 1.3436, test_f1: 0.2281
 epoch: 1, train_loss: 1.1572, test_loss: 1.3269, test_f1: 0.2281
 epoch: 2, train_loss: 1.1009, test_loss: 1.3045, test_f1: 0.2281
 epoch: 3, train_loss: 1.0641, test_loss: 1.2719, test_f1: 0.2281
 epoch: 4, train_loss: 1.0376, test_loss: 1.2195, test_f1: 0.2298
 epoch: 5, train_loss: 1.0095, test_loss: 1.1669, test_f1: 0.3347
 epoch: 6, train_loss: 0.9931, test_loss: 1.1188, test_f1: 0.4277
 epoch: 7, train_loss: 0.9742, test_loss: 1.0485, test_f1: 0.5312
 epoch: 8, train_loss: 0.9370, test_loss: 1.0193, test_f1: 0.5546
 epoch: 9, train_loss: 0.9203, test_loss: 1.0256, test_f1: 0.5738
 epoch: 10, train_loss: 0.9228, test_loss: 0.9976, test_f1: 0.5449
 epoch: 11, train_loss: 0.9018, test_loss: 0.9903, test_f1: 0.5288
 epoch: 12, train_loss: 0.8802, test_loss: 0.9990, test_f1: 0.5552
 epoch: 13, train_loss: 0.8803, test_loss: 0.9868, test_f1: 0.5633
 epoch: 14, train_loss: 0.8638, test_loss: 1.0296, test_f1: 0.5035
 epoch: 15, train_loss: 0.8452, test_loss: 1.0353, test_f1: 0.4717
 epoch: 16, train_loss: 0.8316, test_loss: 1.0304, test_f1: 0.5155
 epoch: 17, train_loss: 0.8312, test_loss: 1.0917, test_f1: 0.4868
 epoch: 18, train_loss: 0.8154, test_loss: 1.0761, test_f1: 0.4701
 epoch: 19, train_loss: 0.8008, test_loss: 1.0582, test_f1: 0.4829
 epoch: 20, train_loss: 0.8142, test_loss: 1.1173, test_f1: 0.4733
 epoch: 21, train_loss: 0.7984, test_loss: 1.1154, test_f1: 0.4650
 epoch: 22, train_loss: 0.8049, test_loss: 1.0439, test_f1: 0.5055
 epoch: 23, train_loss: 0.7899, test_loss: 0.9883, test_f1: 0.4995
 epoch: 24, train_loss: 0.7658, test_loss: 1.0056, test_f1: 0.4599
 epoch: 25, train_loss: 0.7772, test_loss: 1.1250, test_f1: 0.4794
 epoch: 26, train_loss: 0.7486, test_loss: 1.0356, test_f1: 0.4932
 epoch: 27, train_loss: 0.7566, test_loss: 1.0719, test_f1: 0.5334
 epoch: 28, train_loss: 0.7453, test_loss: 1.0382, test_f1: 0.5311
 epoch: 29, train_loss: 0.7358, test_loss: 1.0557, test_f1: 0.5390
 epoch: 30, train_loss: 0.7387, test_loss: 0.9895, test_f1: 0.5050
 epoch: 31, train_loss: 0.7446, test_loss: 0.9578, test_f1: 0.5324
 epoch: 32, train_loss: 0.7425, test_loss: 1.0994, test_f1: 0.5294
 epoch: 33, train_loss: 0.7287, test_loss: 1.1393, test_f1: 0.5225
 epoch: 34, train_loss: 0.7464, test_loss: 0.9477, test_f1: 0.5747
 epoch: 35, train_loss: 0.7382, test_loss: 0.9481, test_f1: 0.5943
 epoch: 36, train_loss: 0.7238, test_loss: 1.0041, test_f1: 0.5642
 epoch: 37, train_loss: 0.7208, test_loss: 0.9762, test_f1: 0.5812
 epoch: 38, train_loss: 0.7248, test_loss: 1.0765, test_f1: 0.5524
 epoch: 39, train_loss: 0.7031, test_loss: 1.0193, test_f1: 0.6013
 epoch: 40, train_loss: 0.6997, test_loss: 1.0529, test_f1: 0.5581
 epoch: 41, train_loss: 0.6897, test_loss: 1.0562, test_f1: 0.5961
 epoch: 42, train_loss: 0.6655, test_loss: 1.0420, test_f1: 0.5913
 epoch: 43, train_loss: 0.6781, test_loss: 1.1087, test_f1: 0.5796
 epoch: 44, train_loss: 0.6927, test_loss: 1.0137, test_f1: 0.5863
 epoch: 45, train_loss: 0.6814, test_loss: 1.0591, test_f1: 0.5972
 epoch: 46, train_loss: 0.6679, test_loss: 1.0646, test_f1: 0.5679
 epoch: 47, train_loss: 0.6755, test_loss: 1.0264, test_f1: 0.5719
 epoch: 48, train_loss: 0.6499, test_loss: 1.0865, test_f1: 0.5517
 epoch: 49, train_loss: 0.6552, test_loss: 1.0517, test_f1: 0.5833
 epoch: 50, train_loss: 0.6509, test_loss: 1.1703, test_f1: 0.6103
 epoch: 51, train_loss: 0.6695, test_loss: 1.1319, test_f1: 0.6089
 epoch: 52, train_loss: 0.6439, test_loss: 1.1663, test_f1: 0.5675
 epoch: 53, train_loss: 0.6388, test_loss: 1.2157, test_f1: 0.5537
 epoch: 54, train_loss: 0.6335, test_loss: 1.1727, test_f1: 0.5719
 epoch: 55, train_loss: 0.6331, test_loss: 1.0768, test_f1: 0.5685
 epoch: 56, train_loss: 0.6293, test_loss: 1.1475, test_f1: 0.5623
 epoch: 57, train_loss: 0.6304, test_loss: 1.1878, test_f1: 0.5764
 epoch: 58, train_loss: 0.6514, test_loss: 1.1127, test_f1: 0.5586
 epoch: 59, train_loss: 0.6499, test_loss: 1.2883, test_f1: 0.5618
 epoch: 60, train_loss: 0.6703, test_loss: 1.2143, test_f1: 0.5841
 epoch: 61, train_loss: 0.6545, test_loss: 1.1464, test_f1: 0.5796
 epoch: 62, train_loss: 0.6486, test_loss: 1.1213, test_f1: 0.5942
 epoch: 63, train_loss: 0.6390, test_loss: 1.1125, test_f1: 0.5928
 epoch: 64, train_loss: 0.6268, test_loss: 1.1249, test_f1: 0.5609
 epoch: 65, train_loss: 0.6344, test_loss: 1.1815, test_f1: 0.5538
 epoch: 66, train_loss: 0.6250, test_loss: 1.1619, test_f1: 0.5551
 epoch: 67, train_loss: 0.6259, test_loss: 1.1643, test_f1: 0.5451
 epoch: 68, train_loss: 0.6214, test_loss: 1.1903, test_f1: 0.5499
 epoch: 69, train_loss: 0.6309, test_loss: 1.2295, test_f1: 0.5486
 epoch: 70, train_loss: 0.6227, test_loss: 1.2623, test_f1: 0.5573
 epoch: 71, train_loss: 0.6204, test_loss: 1.2889, test_f1: 0.5616
 epoch: 72, train_loss: 0.6189, test_loss: 1.2559, test_f1: 0.5558
 epoch: 73, train_loss: 0.6033, test_loss: 1.2308, test_f1: 0.5694
 epoch: 74, train_loss: 0.6120, test_loss: 1.2799, test_f1: 0.5477
 epoch: 75, train_loss: 0.6010, test_loss: 1.2980, test_f1: 0.5467
 epoch: 76, train_loss: 0.6086, test_loss: 1.2095, test_f1: 0.5587
 epoch: 77, train_loss: 0.6233, test_loss: 1.2494, test_f1: 0.5698
 epoch: 78, train_loss: 0.6212, test_loss: 1.1649, test_f1: 0.5732
 epoch: 79, train_loss: 0.6138, test_loss: 1.2286, test_f1: 0.5445
 epoch: 80, train_loss: 0.5965, test_loss: 1.2407, test_f1: 0.5658
 epoch: 81, train_loss: 0.6036, test_loss: 1.2480, test_f1: 0.5763
 epoch: 82, train_loss: 0.6018, test_loss: 1.3225, test_f1: 0.5673
 epoch: 83, train_loss: 0.5926, test_loss: 1.2921, test_f1: 0.5765
 epoch: 84, train_loss: 0.6067, test_loss: 1.2039, test_f1: 0.6034
 epoch: 85, train_loss: 0.5979, test_loss: 1.2107, test_f1: 0.5939
 epoch: 86, train_loss: 0.6074, test_loss: 1.2174, test_f1: 0.6031
 epoch: 87, train_loss: 0.5975, test_loss: 1.2747, test_f1: 0.5756
 epoch: 88, train_loss: 0.5916, test_loss: 1.3083, test_f1: 0.5734
 epoch: 89, train_loss: 0.5980, test_loss: 1.3999, test_f1: 0.5894
 epoch: 90, train_loss: 0.5854, test_loss: 1.3935, test_f1: 0.6006
 epoch: 91, train_loss: 0.5932, test_loss: 1.2352, test_f1: 0.5899
 epoch: 92, train_loss: 0.5862, test_loss: 1.3181, test_f1: 0.5687
 epoch: 93, train_loss: 0.5919, test_loss: 1.5161, test_f1: 0.5731
 epoch: 94, train_loss: 0.5935, test_loss: 1.2970, test_f1: 0.5939
 epoch: 95, train_loss: 0.5894, test_loss: 1.2344, test_f1: 0.6153
 epoch: 96, train_loss: 0.5885, test_loss: 1.2934, test_f1: 0.6299
 epoch: 97, train_loss: 0.5740, test_loss: 1.3637, test_f1: 0.5746
 epoch: 98, train_loss: 0.5968, test_loss: 1.3303, test_f1: 0.5650
 epoch: 99, train_loss: 0.5841, test_loss: 1.3282, test_f1: 0.5897
##################ITERATION #6 ****************************************
 epoch: 0, train_loss: 1.2613, test_loss: 1.4629, test_f1: 0.3037
 epoch: 1, train_loss: 1.0951, test_loss: 1.4356, test_f1: 0.3051
 epoch: 2, train_loss: 1.0575, test_loss: 1.3681, test_f1: 0.2680
 epoch: 3, train_loss: 1.0286, test_loss: 1.3272, test_f1: 0.2625
 epoch: 4, train_loss: 1.0064, test_loss: 1.2816, test_f1: 0.3387
 epoch: 5, train_loss: 0.9807, test_loss: 1.2849, test_f1: 0.3196
 epoch: 6, train_loss: 0.9682, test_loss: 1.2565, test_f1: 0.3212
 epoch: 7, train_loss: 0.9532, test_loss: 1.1740, test_f1: 0.3366
 epoch: 8, train_loss: 0.9339, test_loss: 1.1002, test_f1: 0.4063
 epoch: 9, train_loss: 0.9169, test_loss: 1.0462, test_f1: 0.4461
 epoch: 10, train_loss: 0.9180, test_loss: 0.9970, test_f1: 0.5120
 epoch: 11, train_loss: 0.9096, test_loss: 0.9967, test_f1: 0.5207
 epoch: 12, train_loss: 0.8742, test_loss: 0.9689, test_f1: 0.5708
 epoch: 13, train_loss: 0.8763, test_loss: 0.9670, test_f1: 0.5741
 epoch: 14, train_loss: 0.8770, test_loss: 0.9728, test_f1: 0.5779
 epoch: 15, train_loss: 0.8532, test_loss: 0.9678, test_f1: 0.5957
 epoch: 16, train_loss: 0.8473, test_loss: 0.9609, test_f1: 0.5908
 epoch: 17, train_loss: 0.8457, test_loss: 0.9623, test_f1: 0.5919
 epoch: 18, train_loss: 0.8398, test_loss: 0.9725, test_f1: 0.5888
 epoch: 19, train_loss: 0.8593, test_loss: 0.9680, test_f1: 0.5832
 epoch: 20, train_loss: 0.8307, test_loss: 0.9392, test_f1: 0.5789
 epoch: 21, train_loss: 0.8236, test_loss: 0.9571, test_f1: 0.5802
 epoch: 22, train_loss: 0.8008, test_loss: 0.9568, test_f1: 0.5910
 epoch: 23, train_loss: 0.7803, test_loss: 0.9421, test_f1: 0.6018
 epoch: 24, train_loss: 0.7852, test_loss: 0.9485, test_f1: 0.5830
 epoch: 25, train_loss: 0.7855, test_loss: 0.9660, test_f1: 0.5835
 epoch: 26, train_loss: 0.7734, test_loss: 0.9479, test_f1: 0.5889
 epoch: 27, train_loss: 0.7705, test_loss: 0.9272, test_f1: 0.5874
 epoch: 28, train_loss: 0.7652, test_loss: 0.9528, test_f1: 0.6075
 epoch: 29, train_loss: 0.7640, test_loss: 0.9200, test_f1: 0.6147
 epoch: 30, train_loss: 0.7733, test_loss: 0.9477, test_f1: 0.5959
 epoch: 31, train_loss: 0.7583, test_loss: 0.9186, test_f1: 0.6123
 epoch: 32, train_loss: 0.7609, test_loss: 0.9685, test_f1: 0.5910
 epoch: 33, train_loss: 0.7531, test_loss: 0.9741, test_f1: 0.6036
 epoch: 34, train_loss: 0.7545, test_loss: 1.0436, test_f1: 0.5803
 epoch: 35, train_loss: 0.7487, test_loss: 1.0089, test_f1: 0.6131
 epoch: 36, train_loss: 0.7357, test_loss: 1.0319, test_f1: 0.5644
 epoch: 37, train_loss: 0.7337, test_loss: 1.0051, test_f1: 0.5904
 epoch: 38, train_loss: 0.7253, test_loss: 1.0061, test_f1: 0.5861
 epoch: 39, train_loss: 0.7373, test_loss: 1.0492, test_f1: 0.5442
 epoch: 40, train_loss: 0.7469, test_loss: 0.9957, test_f1: 0.5846
 epoch: 41, train_loss: 0.7308, test_loss: 1.0314, test_f1: 0.6116
 epoch: 42, train_loss: 0.7446, test_loss: 0.9193, test_f1: 0.6354
 epoch: 43, train_loss: 0.7147, test_loss: 0.9331, test_f1: 0.6213
 epoch: 44, train_loss: 0.6966, test_loss: 0.9365, test_f1: 0.6062
 epoch: 45, train_loss: 0.7140, test_loss: 0.9508, test_f1: 0.5808
 epoch: 46, train_loss: 0.6948, test_loss: 0.9180, test_f1: 0.6173
 epoch: 47, train_loss: 0.7027, test_loss: 0.9342, test_f1: 0.5948
 epoch: 48, train_loss: 0.6916, test_loss: 0.9444, test_f1: 0.6051
 epoch: 49, train_loss: 0.6824, test_loss: 1.0037, test_f1: 0.5839
 epoch: 50, train_loss: 0.7088, test_loss: 0.9898, test_f1: 0.5950
 epoch: 51, train_loss: 0.6934, test_loss: 0.9988, test_f1: 0.5893
 epoch: 52, train_loss: 0.6807, test_loss: 1.0285, test_f1: 0.5688
 epoch: 53, train_loss: 0.6783, test_loss: 1.0685, test_f1: 0.5551
 epoch: 54, train_loss: 0.6689, test_loss: 0.9740, test_f1: 0.5754
 epoch: 55, train_loss: 0.6643, test_loss: 0.9700, test_f1: 0.5779
 epoch: 56, train_loss: 0.6659, test_loss: 0.9836, test_f1: 0.5884
 epoch: 57, train_loss: 0.6575, test_loss: 0.9916, test_f1: 0.5865
 epoch: 58, train_loss: 0.6662, test_loss: 0.9723, test_f1: 0.5821
 epoch: 59, train_loss: 0.6594, test_loss: 0.9572, test_f1: 0.5962
 epoch: 60, train_loss: 0.6724, test_loss: 0.9757, test_f1: 0.5960
 epoch: 61, train_loss: 0.6513, test_loss: 0.9722, test_f1: 0.6013
 epoch: 62, train_loss: 0.6570, test_loss: 0.9715, test_f1: 0.5770
 epoch: 63, train_loss: 0.6611, test_loss: 0.9570, test_f1: 0.6066
 epoch: 64, train_loss: 0.6495, test_loss: 0.9472, test_f1: 0.6154
 epoch: 65, train_loss: 0.6514, test_loss: 0.9233, test_f1: 0.6256
 epoch: 66, train_loss: 0.6526, test_loss: 0.9424, test_f1: 0.5880
 epoch: 67, train_loss: 0.6398, test_loss: 0.9368, test_f1: 0.6195
 epoch: 68, train_loss: 0.6552, test_loss: 0.9368, test_f1: 0.6250
 epoch: 69, train_loss: 0.6453, test_loss: 0.9522, test_f1: 0.6123
 epoch: 70, train_loss: 0.6469, test_loss: 0.9481, test_f1: 0.6269
 epoch: 71, train_loss: 0.6638, test_loss: 0.9418, test_f1: 0.6284
 epoch: 72, train_loss: 0.6359, test_loss: 0.9474, test_f1: 0.6276
 epoch: 73, train_loss: 0.6478, test_loss: 0.9720, test_f1: 0.6087
 epoch: 74, train_loss: 0.6316, test_loss: 0.9729, test_f1: 0.6072
 epoch: 75, train_loss: 0.6258, test_loss: 0.9617, test_f1: 0.6078
 epoch: 76, train_loss: 0.6251, test_loss: 0.9541, test_f1: 0.6203
 epoch: 77, train_loss: 0.6291, test_loss: 0.9664, test_f1: 0.6159
 epoch: 78, train_loss: 0.6351, test_loss: 0.9407, test_f1: 0.6090
 epoch: 79, train_loss: 0.6318, test_loss: 0.9472, test_f1: 0.6054
 epoch: 80, train_loss: 0.6256, test_loss: 0.9869, test_f1: 0.6130
 epoch: 81, train_loss: 0.6331, test_loss: 0.9899, test_f1: 0.5934
 epoch: 82, train_loss: 0.6278, test_loss: 1.0026, test_f1: 0.5894
 epoch: 83, train_loss: 0.6304, test_loss: 1.0206, test_f1: 0.5956
 epoch: 84, train_loss: 0.6362, test_loss: 1.0295, test_f1: 0.5614
 epoch: 85, train_loss: 0.6515, test_loss: 1.0560, test_f1: 0.5877
 epoch: 86, train_loss: 0.6391, test_loss: 1.1142, test_f1: 0.5515
 epoch: 87, train_loss: 0.6411, test_loss: 1.0125, test_f1: 0.5975
 epoch: 88, train_loss: 0.6234, test_loss: 0.9902, test_f1: 0.6083
 epoch: 89, train_loss: 0.6241, test_loss: 0.9686, test_f1: 0.6128
 epoch: 90, train_loss: 0.6297, test_loss: 1.0028, test_f1: 0.5742
 epoch: 91, train_loss: 0.6271, test_loss: 1.0123, test_f1: 0.5899
 epoch: 92, train_loss: 0.6281, test_loss: 0.9630, test_f1: 0.6193
 epoch: 93, train_loss: 0.6060, test_loss: 0.9937, test_f1: 0.6209
 epoch: 94, train_loss: 0.6021, test_loss: 1.0037, test_f1: 0.6012
 epoch: 95, train_loss: 0.6143, test_loss: 1.0244, test_f1: 0.5894
 epoch: 96, train_loss: 0.6177, test_loss: 1.0516, test_f1: 0.5622
 epoch: 97, train_loss: 0.6191, test_loss: 1.0826, test_f1: 0.5654
 epoch: 98, train_loss: 0.6123, test_loss: 1.0222, test_f1: 0.5887
 epoch: 99, train_loss: 0.6104, test_loss: 1.1104, test_f1: 0.5657
##################ITERATION #7 ****************************************
 epoch: 0, train_loss: 1.2988, test_loss: 1.3678, test_f1: 0.2281
 epoch: 1, train_loss: 1.1663, test_loss: 1.3424, test_f1: 0.2281
 epoch: 2, train_loss: 1.1153, test_loss: 1.3291, test_f1: 0.2281
 epoch: 3, train_loss: 1.1088, test_loss: 1.3112, test_f1: 0.2465
 epoch: 4, train_loss: 1.0637, test_loss: 1.3057, test_f1: 0.3107
 epoch: 5, train_loss: 1.0325, test_loss: 1.2740, test_f1: 0.2946
 epoch: 6, train_loss: 1.0267, test_loss: 1.2148, test_f1: 0.3271
 epoch: 7, train_loss: 0.9964, test_loss: 1.1411, test_f1: 0.4078
 epoch: 8, train_loss: 0.9899, test_loss: 1.1149, test_f1: 0.4626
 epoch: 9, train_loss: 0.9723, test_loss: 1.1013, test_f1: 0.5077
 epoch: 10, train_loss: 0.9656, test_loss: 1.0914, test_f1: 0.5104
 epoch: 11, train_loss: 0.9359, test_loss: 1.0468, test_f1: 0.5259
 epoch: 12, train_loss: 0.9211, test_loss: 1.0467, test_f1: 0.5424
 epoch: 13, train_loss: 0.9014, test_loss: 1.0410, test_f1: 0.5237
 epoch: 14, train_loss: 0.8865, test_loss: 1.0302, test_f1: 0.4707
 epoch: 15, train_loss: 0.8812, test_loss: 1.0216, test_f1: 0.4837
 epoch: 16, train_loss: 0.8621, test_loss: 1.0015, test_f1: 0.5104
 epoch: 17, train_loss: 0.8514, test_loss: 1.0206, test_f1: 0.5356
 epoch: 18, train_loss: 0.8540, test_loss: 1.0521, test_f1: 0.5349
 epoch: 19, train_loss: 0.8513, test_loss: 1.0042, test_f1: 0.5586
 epoch: 20, train_loss: 0.8421, test_loss: 1.0054, test_f1: 0.5214
 epoch: 21, train_loss: 0.8307, test_loss: 0.9960, test_f1: 0.5848
 epoch: 22, train_loss: 0.8124, test_loss: 1.0703, test_f1: 0.5537
 epoch: 23, train_loss: 0.7897, test_loss: 1.0279, test_f1: 0.5522
 epoch: 24, train_loss: 0.7953, test_loss: 1.0352, test_f1: 0.5141
 epoch: 25, train_loss: 0.7878, test_loss: 1.0487, test_f1: 0.5484
 epoch: 26, train_loss: 0.8067, test_loss: 1.0447, test_f1: 0.5663
 epoch: 27, train_loss: 0.7775, test_loss: 1.0185, test_f1: 0.5591
 epoch: 28, train_loss: 0.7808, test_loss: 1.0176, test_f1: 0.5662
 epoch: 29, train_loss: 0.7566, test_loss: 1.0294, test_f1: 0.5782
 epoch: 30, train_loss: 0.7434, test_loss: 1.0416, test_f1: 0.5739
 epoch: 31, train_loss: 0.7412, test_loss: 1.0669, test_f1: 0.5460
 epoch: 32, train_loss: 0.7423, test_loss: 1.0756, test_f1: 0.5445
 epoch: 33, train_loss: 0.7294, test_loss: 1.0418, test_f1: 0.5567
 epoch: 34, train_loss: 0.7444, test_loss: 1.0958, test_f1: 0.5668
 epoch: 35, train_loss: 0.7353, test_loss: 1.0817, test_f1: 0.6112
 epoch: 36, train_loss: 0.7214, test_loss: 1.1014, test_f1: 0.6055
 epoch: 37, train_loss: 0.7158, test_loss: 1.1491, test_f1: 0.5613
 epoch: 38, train_loss: 0.7020, test_loss: 1.1963, test_f1: 0.5834
 epoch: 39, train_loss: 0.7181, test_loss: 1.2765, test_f1: 0.5408
 epoch: 40, train_loss: 0.7392, test_loss: 1.0629, test_f1: 0.5686
 epoch: 41, train_loss: 0.7463, test_loss: 1.1965, test_f1: 0.5198
 epoch: 42, train_loss: 0.7344, test_loss: 1.1266, test_f1: 0.5463
 epoch: 43, train_loss: 0.7056, test_loss: 1.0764, test_f1: 0.5711
 epoch: 44, train_loss: 0.7128, test_loss: 1.1263, test_f1: 0.5840
 epoch: 45, train_loss: 0.7099, test_loss: 1.1322, test_f1: 0.5760
 epoch: 46, train_loss: 0.7007, test_loss: 1.1251, test_f1: 0.5845
 epoch: 47, train_loss: 0.7001, test_loss: 1.1442, test_f1: 0.5773
 epoch: 48, train_loss: 0.6898, test_loss: 1.0704, test_f1: 0.6046
 epoch: 49, train_loss: 0.6974, test_loss: 1.1284, test_f1: 0.5666
 epoch: 50, train_loss: 0.6894, test_loss: 1.1389, test_f1: 0.5822
 epoch: 51, train_loss: 0.6775, test_loss: 1.1258, test_f1: 0.6054
 epoch: 52, train_loss: 0.6575, test_loss: 1.1246, test_f1: 0.5892
 epoch: 53, train_loss: 0.6508, test_loss: 1.0927, test_f1: 0.5901
 epoch: 54, train_loss: 0.6529, test_loss: 1.0831, test_f1: 0.6052
 epoch: 55, train_loss: 0.6488, test_loss: 1.1117, test_f1: 0.5860
 epoch: 56, train_loss: 0.6479, test_loss: 1.1529, test_f1: 0.5811
 epoch: 57, train_loss: 0.6396, test_loss: 1.1594, test_f1: 0.5795
 epoch: 58, train_loss: 0.6435, test_loss: 1.1226, test_f1: 0.5888
 epoch: 59, train_loss: 0.6288, test_loss: 1.0826, test_f1: 0.6109
 epoch: 60, train_loss: 0.6324, test_loss: 1.0882, test_f1: 0.6248
 epoch: 61, train_loss: 0.6383, test_loss: 1.1323, test_f1: 0.6165
 epoch: 62, train_loss: 0.6401, test_loss: 1.1614, test_f1: 0.6005
 epoch: 63, train_loss: 0.6289, test_loss: 1.2152, test_f1: 0.5619
 epoch: 64, train_loss: 0.6279, test_loss: 1.1586, test_f1: 0.6181
 epoch: 65, train_loss: 0.6136, test_loss: 1.1450, test_f1: 0.6198
 epoch: 66, train_loss: 0.6342, test_loss: 1.1794, test_f1: 0.5856
 epoch: 67, train_loss: 0.6253, test_loss: 1.2089, test_f1: 0.6321
 epoch: 68, train_loss: 0.6261, test_loss: 1.1944, test_f1: 0.6265
 epoch: 69, train_loss: 0.6133, test_loss: 1.1719, test_f1: 0.6274
 epoch: 70, train_loss: 0.6095, test_loss: 1.1396, test_f1: 0.6248
 epoch: 71, train_loss: 0.6169, test_loss: 1.1903, test_f1: 0.6307
 epoch: 72, train_loss: 0.6232, test_loss: 1.2001, test_f1: 0.6387
 epoch: 73, train_loss: 0.6143, test_loss: 1.2462, test_f1: 0.5930
 epoch: 74, train_loss: 0.6117, test_loss: 1.1696, test_f1: 0.5990
 epoch: 75, train_loss: 0.6021, test_loss: 1.1801, test_f1: 0.5882
 epoch: 76, train_loss: 0.6125, test_loss: 1.2213, test_f1: 0.5922
 epoch: 77, train_loss: 0.6160, test_loss: 1.2188, test_f1: 0.5852
 epoch: 78, train_loss: 0.6077, test_loss: 1.2651, test_f1: 0.5873
 epoch: 79, train_loss: 0.6119, test_loss: 1.1445, test_f1: 0.6029
 epoch: 80, train_loss: 0.6137, test_loss: 1.2017, test_f1: 0.5804
 epoch: 81, train_loss: 0.6000, test_loss: 1.2262, test_f1: 0.5911
 epoch: 82, train_loss: 0.6108, test_loss: 1.1136, test_f1: 0.6150
 epoch: 83, train_loss: 0.6147, test_loss: 1.0777, test_f1: 0.6256
 epoch: 84, train_loss: 0.6001, test_loss: 1.1850, test_f1: 0.6178
 epoch: 85, train_loss: 0.6068, test_loss: 1.2242, test_f1: 0.5965
 epoch: 86, train_loss: 0.5861, test_loss: 1.1729, test_f1: 0.6003
 epoch: 87, train_loss: 0.5837, test_loss: 1.2334, test_f1: 0.6238
 epoch: 88, train_loss: 0.6106, test_loss: 1.3347, test_f1: 0.5709
 epoch: 89, train_loss: 0.6033, test_loss: 1.2082, test_f1: 0.6109
 epoch: 90, train_loss: 0.5866, test_loss: 1.1502, test_f1: 0.5933
 epoch: 91, train_loss: 0.5863, test_loss: 1.1633, test_f1: 0.5861
 epoch: 92, train_loss: 0.5917, test_loss: 1.2082, test_f1: 0.5860
 epoch: 93, train_loss: 0.5909, test_loss: 1.2748, test_f1: 0.5888
 epoch: 94, train_loss: 0.5780, test_loss: 1.2030, test_f1: 0.5987
 epoch: 95, train_loss: 0.5731, test_loss: 1.1193, test_f1: 0.6033
 epoch: 96, train_loss: 0.5773, test_loss: 1.1976, test_f1: 0.5760
 epoch: 97, train_loss: 0.5711, test_loss: 1.1313, test_f1: 0.5781
 epoch: 98, train_loss: 0.5778, test_loss: 1.1291, test_f1: 0.5826
 epoch: 99, train_loss: 0.5725, test_loss: 1.1278, test_f1: 0.6265
##################ITERATION #8 ****************************************
 epoch: 0, train_loss: 1.3884, test_loss: 1.3676, test_f1: 0.2903
 epoch: 1, train_loss: 1.1752, test_loss: 1.3610, test_f1: 0.3622
 epoch: 2, train_loss: 1.1259, test_loss: 1.3516, test_f1: 0.3474
 epoch: 3, train_loss: 1.0921, test_loss: 1.3467, test_f1: 0.3219
 epoch: 4, train_loss: 1.0768, test_loss: 1.3354, test_f1: 0.2978
 epoch: 5, train_loss: 1.0359, test_loss: 1.2972, test_f1: 0.2620
 epoch: 6, train_loss: 1.0166, test_loss: 1.2368, test_f1: 0.3260
 epoch: 7, train_loss: 0.9940, test_loss: 1.1801, test_f1: 0.4714
 epoch: 8, train_loss: 0.9510, test_loss: 1.1214, test_f1: 0.5449
 epoch: 9, train_loss: 0.9496, test_loss: 1.0802, test_f1: 0.5645
 epoch: 10, train_loss: 0.9346, test_loss: 1.0471, test_f1: 0.5619
 epoch: 11, train_loss: 0.9138, test_loss: 1.0246, test_f1: 0.5209
 epoch: 12, train_loss: 0.8917, test_loss: 1.0252, test_f1: 0.5309
 epoch: 13, train_loss: 0.8812, test_loss: 1.0173, test_f1: 0.5389
 epoch: 14, train_loss: 0.8638, test_loss: 0.9997, test_f1: 0.5439
 epoch: 15, train_loss: 0.8589, test_loss: 1.0042, test_f1: 0.5348
 epoch: 16, train_loss: 0.8640, test_loss: 1.0031, test_f1: 0.5558
 epoch: 17, train_loss: 0.8479, test_loss: 1.0018, test_f1: 0.5633
 epoch: 18, train_loss: 0.8243, test_loss: 1.0058, test_f1: 0.5646
 epoch: 19, train_loss: 0.8283, test_loss: 1.0156, test_f1: 0.5632
 epoch: 20, train_loss: 0.8015, test_loss: 1.0264, test_f1: 0.5462
 epoch: 21, train_loss: 0.8160, test_loss: 1.0177, test_f1: 0.5436
 epoch: 22, train_loss: 0.7914, test_loss: 1.0130, test_f1: 0.5277
 epoch: 23, train_loss: 0.7938, test_loss: 1.0198, test_f1: 0.5494
 epoch: 24, train_loss: 0.7879, test_loss: 1.0139, test_f1: 0.5405
 epoch: 25, train_loss: 0.7680, test_loss: 1.0180, test_f1: 0.5599
 epoch: 26, train_loss: 0.7689, test_loss: 1.0384, test_f1: 0.5617
 epoch: 27, train_loss: 0.7581, test_loss: 1.0353, test_f1: 0.5436
 epoch: 28, train_loss: 0.7464, test_loss: 1.0436, test_f1: 0.5514
 epoch: 29, train_loss: 0.7274, test_loss: 1.0356, test_f1: 0.5577
 epoch: 30, train_loss: 0.7334, test_loss: 1.0384, test_f1: 0.5558
 epoch: 31, train_loss: 0.7270, test_loss: 1.0310, test_f1: 0.5625
 epoch: 32, train_loss: 0.7285, test_loss: 1.0412, test_f1: 0.5858
 epoch: 33, train_loss: 0.7142, test_loss: 1.0158, test_f1: 0.5769
 epoch: 34, train_loss: 0.7101, test_loss: 1.0185, test_f1: 0.5868
 epoch: 35, train_loss: 0.6963, test_loss: 1.0638, test_f1: 0.5540
 epoch: 36, train_loss: 0.6985, test_loss: 1.0573, test_f1: 0.5598
 epoch: 37, train_loss: 0.6832, test_loss: 1.0325, test_f1: 0.5726
 epoch: 38, train_loss: 0.6644, test_loss: 1.0341, test_f1: 0.5915
 epoch: 39, train_loss: 0.6655, test_loss: 1.0929, test_f1: 0.6033
 epoch: 40, train_loss: 0.6901, test_loss: 1.1307, test_f1: 0.5354
 epoch: 41, train_loss: 0.6846, test_loss: 1.0185, test_f1: 0.5710
 epoch: 42, train_loss: 0.6723, test_loss: 1.0539, test_f1: 0.5597
 epoch: 43, train_loss: 0.6652, test_loss: 1.0801, test_f1: 0.6065
 epoch: 44, train_loss: 0.6541, test_loss: 1.0817, test_f1: 0.6036
 epoch: 45, train_loss: 0.6417, test_loss: 1.0314, test_f1: 0.6056
 epoch: 46, train_loss: 0.6647, test_loss: 1.0724, test_f1: 0.5664
 epoch: 47, train_loss: 0.6431, test_loss: 1.1037, test_f1: 0.5615
 epoch: 48, train_loss: 0.6419, test_loss: 1.0764, test_f1: 0.5929
 epoch: 49, train_loss: 0.6435, test_loss: 1.0821, test_f1: 0.5841
 epoch: 50, train_loss: 0.6556, test_loss: 1.0821, test_f1: 0.5753
 epoch: 51, train_loss: 0.6390, test_loss: 1.0597, test_f1: 0.5745
 epoch: 52, train_loss: 0.6156, test_loss: 1.0092, test_f1: 0.5936
 epoch: 53, train_loss: 0.6092, test_loss: 1.0377, test_f1: 0.5951
 epoch: 54, train_loss: 0.6051, test_loss: 1.0915, test_f1: 0.5680
 epoch: 55, train_loss: 0.6019, test_loss: 1.1377, test_f1: 0.5631
 epoch: 56, train_loss: 0.6079, test_loss: 1.1022, test_f1: 0.5692
 epoch: 57, train_loss: 0.6129, test_loss: 1.0705, test_f1: 0.5787
 epoch: 58, train_loss: 0.6106, test_loss: 1.0785, test_f1: 0.5792
 epoch: 59, train_loss: 0.6173, test_loss: 1.1056, test_f1: 0.5778
 epoch: 60, train_loss: 0.6151, test_loss: 1.0797, test_f1: 0.5688
 epoch: 61, train_loss: 0.6015, test_loss: 1.0575, test_f1: 0.5785
 epoch: 62, train_loss: 0.5861, test_loss: 1.0835, test_f1: 0.5754
 epoch: 63, train_loss: 0.5884, test_loss: 1.0925, test_f1: 0.5725
 epoch: 64, train_loss: 0.5878, test_loss: 1.1261, test_f1: 0.5620
 epoch: 65, train_loss: 0.5783, test_loss: 1.0929, test_f1: 0.5793
 epoch: 66, train_loss: 0.5711, test_loss: 1.1143, test_f1: 0.5822
 epoch: 67, train_loss: 0.5686, test_loss: 1.1464, test_f1: 0.5727
 epoch: 68, train_loss: 0.5665, test_loss: 1.1015, test_f1: 0.5806
 epoch: 69, train_loss: 0.5685, test_loss: 1.1229, test_f1: 0.5808
 epoch: 70, train_loss: 0.5713, test_loss: 1.1722, test_f1: 0.5853
 epoch: 71, train_loss: 0.5829, test_loss: 1.1934, test_f1: 0.5953
 epoch: 72, train_loss: 0.5719, test_loss: 1.1484, test_f1: 0.5933
 epoch: 73, train_loss: 0.5820, test_loss: 1.0989, test_f1: 0.6029
 epoch: 74, train_loss: 0.5558, test_loss: 1.1318, test_f1: 0.5536
 epoch: 75, train_loss: 0.5768, test_loss: 1.1925, test_f1: 0.5491
 epoch: 76, train_loss: 0.5761, test_loss: 1.1514, test_f1: 0.5915
 epoch: 77, train_loss: 0.5712, test_loss: 1.1570, test_f1: 0.5857
 epoch: 78, train_loss: 0.5599, test_loss: 1.1862, test_f1: 0.5658
 epoch: 79, train_loss: 0.5715, test_loss: 1.1141, test_f1: 0.5846
 epoch: 80, train_loss: 0.5535, test_loss: 1.1070, test_f1: 0.5977
 epoch: 81, train_loss: 0.5665, test_loss: 1.1335, test_f1: 0.5893
 epoch: 82, train_loss: 0.5648, test_loss: 1.1590, test_f1: 0.5706
 epoch: 83, train_loss: 0.5670, test_loss: 1.1752, test_f1: 0.5788
 epoch: 84, train_loss: 0.5700, test_loss: 1.1861, test_f1: 0.5654
 epoch: 85, train_loss: 0.5730, test_loss: 1.1574, test_f1: 0.5742
 epoch: 86, train_loss: 0.5605, test_loss: 1.1575, test_f1: 0.5869
 epoch: 87, train_loss: 0.5547, test_loss: 1.1632, test_f1: 0.5951
 epoch: 88, train_loss: 0.5445, test_loss: 1.1989, test_f1: 0.5839
 epoch: 89, train_loss: 0.5461, test_loss: 1.1914, test_f1: 0.5805
 epoch: 90, train_loss: 0.5367, test_loss: 1.3142, test_f1: 0.5748
 epoch: 91, train_loss: 0.5539, test_loss: 1.3040, test_f1: 0.5549
 epoch: 92, train_loss: 0.5352, test_loss: 1.2643, test_f1: 0.5678
 epoch: 93, train_loss: 0.5452, test_loss: 1.2607, test_f1: 0.5565
 epoch: 94, train_loss: 0.5471, test_loss: 1.2583, test_f1: 0.5593
 epoch: 95, train_loss: 0.5403, test_loss: 1.2364, test_f1: 0.5711
 epoch: 96, train_loss: 0.5355, test_loss: 1.1816, test_f1: 0.5620
 epoch: 97, train_loss: 0.5365, test_loss: 1.1488, test_f1: 0.5853
 epoch: 98, train_loss: 0.5417, test_loss: 1.1777, test_f1: 0.5822
 epoch: 99, train_loss: 0.5524, test_loss: 1.2264, test_f1: 0.5988
##################ITERATION #9 ****************************************
 epoch: 0, train_loss: 1.3948, test_loss: 1.5434, test_f1: 0.2765
 epoch: 1, train_loss: 1.1902, test_loss: 1.5222, test_f1: 0.2712
 epoch: 2, train_loss: 1.1159, test_loss: 1.4075, test_f1: 0.2285
 epoch: 3, train_loss: 1.0901, test_loss: 1.3479, test_f1: 0.2289
 epoch: 4, train_loss: 1.0704, test_loss: 1.3877, test_f1: 0.2261
 epoch: 5, train_loss: 1.0172, test_loss: 1.5760, test_f1: 0.1926
 epoch: 6, train_loss: 0.9970, test_loss: 1.7859, test_f1: 0.1362
 epoch: 7, train_loss: 0.9642, test_loss: 1.7003, test_f1: 0.1852
 epoch: 8, train_loss: 0.9564, test_loss: 1.4786, test_f1: 0.2814
 epoch: 9, train_loss: 0.9245, test_loss: 1.1675, test_f1: 0.4629
 epoch: 10, train_loss: 0.9215, test_loss: 1.0780, test_f1: 0.5070
 epoch: 11, train_loss: 0.9010, test_loss: 1.0498, test_f1: 0.5401
 epoch: 12, train_loss: 0.8865, test_loss: 1.0033, test_f1: 0.5981
 epoch: 13, train_loss: 0.8844, test_loss: 1.0181, test_f1: 0.5686
 epoch: 14, train_loss: 0.8666, test_loss: 1.0771, test_f1: 0.5474
 epoch: 15, train_loss: 0.8602, test_loss: 1.0642, test_f1: 0.5573
 epoch: 16, train_loss: 0.8541, test_loss: 1.0448, test_f1: 0.5461
 epoch: 17, train_loss: 0.8300, test_loss: 1.0506, test_f1: 0.5852
 epoch: 18, train_loss: 0.8358, test_loss: 1.0927, test_f1: 0.5685
 epoch: 19, train_loss: 0.8225, test_loss: 1.0536, test_f1: 0.5522
 epoch: 20, train_loss: 0.7981, test_loss: 1.0406, test_f1: 0.5665
 epoch: 21, train_loss: 0.8076, test_loss: 1.0393, test_f1: 0.5642
 epoch: 22, train_loss: 0.7964, test_loss: 1.0251, test_f1: 0.5734
 epoch: 23, train_loss: 0.7987, test_loss: 1.0115, test_f1: 0.5964
 epoch: 24, train_loss: 0.7771, test_loss: 1.0803, test_f1: 0.5937
 epoch: 25, train_loss: 0.7665, test_loss: 1.0045, test_f1: 0.6203
 epoch: 26, train_loss: 0.7826, test_loss: 1.2867, test_f1: 0.5756
 epoch: 27, train_loss: 0.7550, test_loss: 1.0761, test_f1: 0.5695
 epoch: 28, train_loss: 0.7480, test_loss: 1.0669, test_f1: 0.5626
 epoch: 29, train_loss: 0.7546, test_loss: 1.0495, test_f1: 0.6024
 epoch: 30, train_loss: 0.7389, test_loss: 1.0157, test_f1: 0.5789
 epoch: 31, train_loss: 0.7322, test_loss: 1.0440, test_f1: 0.5386
 epoch: 32, train_loss: 0.7197, test_loss: 1.0764, test_f1: 0.5449
 epoch: 33, train_loss: 0.7305, test_loss: 1.3017, test_f1: 0.5734
 epoch: 34, train_loss: 0.7219, test_loss: 1.0107, test_f1: 0.5998
 epoch: 35, train_loss: 0.7348, test_loss: 1.0766, test_f1: 0.5735
 epoch: 36, train_loss: 0.7066, test_loss: 1.1148, test_f1: 0.5701
 epoch: 37, train_loss: 0.6976, test_loss: 1.0844, test_f1: 0.5719
 epoch: 38, train_loss: 0.6854, test_loss: 1.1018, test_f1: 0.5513
 epoch: 39, train_loss: 0.6880, test_loss: 1.1808, test_f1: 0.5420
 epoch: 40, train_loss: 0.6723, test_loss: 1.1249, test_f1: 0.5370
 epoch: 41, train_loss: 0.6616, test_loss: 1.1944, test_f1: 0.5164
 epoch: 42, train_loss: 0.6686, test_loss: 1.0502, test_f1: 0.5647
 epoch: 43, train_loss: 0.6811, test_loss: 1.0598, test_f1: 0.5729
 epoch: 44, train_loss: 0.6600, test_loss: 1.1460, test_f1: 0.5547
 epoch: 45, train_loss: 0.6695, test_loss: 1.1981, test_f1: 0.5646
 epoch: 46, train_loss: 0.6757, test_loss: 1.1087, test_f1: 0.5665
 epoch: 47, train_loss: 0.6471, test_loss: 1.1632, test_f1: 0.5546
 epoch: 48, train_loss: 0.6500, test_loss: 1.1340, test_f1: 0.5338
 epoch: 49, train_loss: 0.6477, test_loss: 1.2993, test_f1: 0.5500
 epoch: 50, train_loss: 0.6352, test_loss: 1.2380, test_f1: 0.5574
 epoch: 51, train_loss: 0.6431, test_loss: 1.1958, test_f1: 0.5303
 epoch: 52, train_loss: 0.6382, test_loss: 1.2496, test_f1: 0.5411
 epoch: 53, train_loss: 0.6362, test_loss: 1.1732, test_f1: 0.5613
 epoch: 54, train_loss: 0.6102, test_loss: 1.1737, test_f1: 0.5312
 epoch: 55, train_loss: 0.6151, test_loss: 1.2185, test_f1: 0.5451
 epoch: 56, train_loss: 0.6116, test_loss: 1.1723, test_f1: 0.5709
 epoch: 57, train_loss: 0.6083, test_loss: 1.1959, test_f1: 0.5568
 epoch: 58, train_loss: 0.6150, test_loss: 1.1643, test_f1: 0.5708
 epoch: 59, train_loss: 0.6141, test_loss: 1.1287, test_f1: 0.5938
 epoch: 60, train_loss: 0.5989, test_loss: 1.1725, test_f1: 0.5761
 epoch: 61, train_loss: 0.6195, test_loss: 1.1802, test_f1: 0.5804
 epoch: 62, train_loss: 0.5969, test_loss: 1.1063, test_f1: 0.5863
 epoch: 63, train_loss: 0.5928, test_loss: 1.2040, test_f1: 0.5657
 epoch: 64, train_loss: 0.5823, test_loss: 1.3034, test_f1: 0.5363
 epoch: 65, train_loss: 0.5940, test_loss: 1.2325, test_f1: 0.5388
 epoch: 66, train_loss: 0.5902, test_loss: 1.1352, test_f1: 0.5525
 epoch: 67, train_loss: 0.5883, test_loss: 1.1249, test_f1: 0.5832
 epoch: 68, train_loss: 0.6018, test_loss: 1.1063, test_f1: 0.6010
 epoch: 69, train_loss: 0.5934, test_loss: 1.1412, test_f1: 0.5688
 epoch: 70, train_loss: 0.5894, test_loss: 1.1206, test_f1: 0.5786
 epoch: 71, train_loss: 0.5973, test_loss: 1.1882, test_f1: 0.5613
 epoch: 72, train_loss: 0.5880, test_loss: 1.2402, test_f1: 0.5855
 epoch: 73, train_loss: 0.5879, test_loss: 1.2776, test_f1: 0.5575
 epoch: 74, train_loss: 0.5839, test_loss: 1.2716, test_f1: 0.5348
 epoch: 75, train_loss: 0.5680, test_loss: 1.2138, test_f1: 0.5616
 epoch: 76, train_loss: 0.5836, test_loss: 1.1479, test_f1: 0.5573
 epoch: 77, train_loss: 0.5787, test_loss: 1.1183, test_f1: 0.5923
 epoch: 78, train_loss: 0.5842, test_loss: 1.2476, test_f1: 0.5543
 epoch: 79, train_loss: 0.5627, test_loss: 1.2379, test_f1: 0.5646
 epoch: 80, train_loss: 0.5679, test_loss: 1.3323, test_f1: 0.5536
 epoch: 81, train_loss: 0.5685, test_loss: 1.3899, test_f1: 0.5550
 epoch: 82, train_loss: 0.5662, test_loss: 1.2179, test_f1: 0.5952
 epoch: 83, train_loss: 0.5598, test_loss: 1.3036, test_f1: 0.5527
 epoch: 84, train_loss: 0.5612, test_loss: 1.1322, test_f1: 0.5874
 epoch: 85, train_loss: 0.5834, test_loss: 1.1035, test_f1: 0.5881
 epoch: 86, train_loss: 0.5806, test_loss: 1.1564, test_f1: 0.5714
 epoch: 87, train_loss: 0.5619, test_loss: 1.2267, test_f1: 0.5814
 epoch: 88, train_loss: 0.5919, test_loss: 1.1056, test_f1: 0.5631
 epoch: 89, train_loss: 0.5777, test_loss: 1.0799, test_f1: 0.6113
 epoch: 90, train_loss: 0.5613, test_loss: 1.3339, test_f1: 0.5698
 epoch: 91, train_loss: 0.5604, test_loss: 1.2395, test_f1: 0.5709
 epoch: 92, train_loss: 0.5580, test_loss: 1.1871, test_f1: 0.6084
 epoch: 93, train_loss: 0.5553, test_loss: 1.3042, test_f1: 0.5617
 epoch: 94, train_loss: 0.5506, test_loss: 1.3499, test_f1: 0.5401
 epoch: 95, train_loss: 0.5518, test_loss: 1.3099, test_f1: 0.5750
 epoch: 96, train_loss: 0.5507, test_loss: 1.3827, test_f1: 0.5565
 epoch: 97, train_loss: 0.5351, test_loss: 1.1748, test_f1: 0.5638
 epoch: 98, train_loss: 0.5171, test_loss: 1.1574, test_f1: 0.5746
 epoch: 99, train_loss: 0.5340, test_loss: 1.3557, test_f1: 0.5736

Training completed in 310.36 seconds
Best F1: 0.6433 at epoch 40
Mean F1 across iterations: 0.6237  0.0138
========================FINAL RESULTS================================
FEGIN weighted F1: 0.6433  0.0138
python main.py --data ltspice_demos --representation component_pin --model FEGIN --layers 4 --hiddens 32 --batch_size 256 --lr 0.001 --emb_size 128 --epochs 100 --save_appendix component_pin_L4_H32_BS256_LR0.001_E128 --no_val
-----



STDERR:
  File "main.py", line 370, in <module>
    main()
  File "main.py", line 254, in main
    dataset = dataset_class(
  File "/home/philip/projects/ltspice_examples_code_repo/Circuit-Completion-Using-GNNs/component_classification_with_link_prediction_head/evaluation/FEGIN/kernel/circuit_datasets.py", line 15, in __init__
    self.data, self.slices = torch.load(self.processed_paths[0])
  File "/home/philip/.local/lib/python3.8/site-packages/torch/serialization.py", line 1040, in load
    warnings.warn(
  File "/usr/lib/python3.8/warnings.py", line 109, in _showwarnmsg
    sw(msg.message, msg.category, msg.filename, msg.lineno,
  File "main.py", line 47, in warn_with_traceback
    traceback.print_stack(file=log)
/home/philip/projects/ltspice_examples_code_repo/Circuit-Completion-Using-GNNs/component_classification_with_link_prediction_head/evaluation/FEGIN/kernel/circuit_datasets.py:15: FutureWarning: You are using `torch.load` with `weights_only=False` (the current default value), which uses the default pickle module implicitly. It is possible to construct malicious pickle data which will execute arbitrary code during unpickling (See https://github.com/pytorch/pytorch/blob/main/SECURITY.md#untrusted-models for more details). In a future release, the default value for `weights_only` will be flipped to `True`. This limits the functions that could be executed during unpickling. Arbitrary objects will no longer be allowed to be loaded via this mode unless they are explicitly allowlisted by the user via `torch.serialization.add_safe_globals`. We recommend you start setting `weights_only=True` for any use case where you don't have full control of the loaded file. Please open an issue on GitHub for any issues related to this experimental feature.
  self.data, self.slices = torch.load(self.processed_paths[0])
