STDOUT:
Results will be saved in /home/philip/projects/ltspice_examples_code_repo/Circuit-Completion-Using-GNNs/component_classification_with_link_prediction_head/evaluation/FEGIN/results/model_FEGIN_dataset_ltspice_examples
Command line input: python main.py --data ltspice_examples --representation component_pin --model FEGIN --layers 2 --hiddens 128 --batch_size 32 --lr 0.0001 --emb_size 250 --epochs 100 --save_appendix component_pin_L2_H128_BS32_LR0.0001_E250 --no_val
 is saved.
-----
ltspice_examples - FEGIN
Using 2 layers, 128 hidden units, h = 2
Loading component_pin representation dataset
ENTERED
Training FEGIN on component_pin representation
Train: 3560, Test: 848
##################ITERATION #0 ****************************************
 epoch: 0, train_loss: 1.3326, test_loss: 1.2085, test_f1: 0.3361
 epoch: 1, train_loss: 1.1551, test_loss: 1.0854, test_f1: 0.3445
 epoch: 2, train_loss: 1.0699, test_loss: 1.0573, test_f1: 0.3432
 epoch: 3, train_loss: 1.0375, test_loss: 1.0376, test_f1: 0.3703
 epoch: 4, train_loss: 1.0166, test_loss: 1.0106, test_f1: 0.4315
 epoch: 5, train_loss: 0.9915, test_loss: 1.0076, test_f1: 0.4350
 epoch: 6, train_loss: 0.9757, test_loss: 1.0072, test_f1: 0.4853
 epoch: 7, train_loss: 0.9609, test_loss: 0.9981, test_f1: 0.4892
 epoch: 8, train_loss: 0.9548, test_loss: 0.9897, test_f1: 0.4772
 epoch: 9, train_loss: 0.9304, test_loss: 0.9986, test_f1: 0.4888
 epoch: 10, train_loss: 0.9201, test_loss: 0.9831, test_f1: 0.4957
 epoch: 11, train_loss: 0.9003, test_loss: 0.9910, test_f1: 0.5068
 epoch: 12, train_loss: 0.8895, test_loss: 0.9549, test_f1: 0.5189
 epoch: 13, train_loss: 0.8765, test_loss: 0.9661, test_f1: 0.5142
 epoch: 14, train_loss: 0.8593, test_loss: 0.9258, test_f1: 0.5240
 epoch: 15, train_loss: 0.8435, test_loss: 0.9194, test_f1: 0.5366
 epoch: 16, train_loss: 0.8370, test_loss: 0.9160, test_f1: 0.5400
 epoch: 17, train_loss: 0.8256, test_loss: 0.8995, test_f1: 0.5368
 epoch: 18, train_loss: 0.8170, test_loss: 0.9119, test_f1: 0.5298
 epoch: 19, train_loss: 0.7970, test_loss: 0.9043, test_f1: 0.5427
 epoch: 20, train_loss: 0.7858, test_loss: 0.9038, test_f1: 0.5401
 epoch: 21, train_loss: 0.7831, test_loss: 0.9290, test_f1: 0.5434
 epoch: 22, train_loss: 0.7802, test_loss: 0.9061, test_f1: 0.5406
 epoch: 23, train_loss: 0.7626, test_loss: 0.8913, test_f1: 0.5414
 epoch: 24, train_loss: 0.7493, test_loss: 0.9267, test_f1: 0.5420
 epoch: 25, train_loss: 0.7479, test_loss: 0.9038, test_f1: 0.5405
 epoch: 26, train_loss: 0.7397, test_loss: 0.9058, test_f1: 0.5560
 epoch: 27, train_loss: 0.7274, test_loss: 0.9058, test_f1: 0.5394
 epoch: 28, train_loss: 0.7264, test_loss: 0.9040, test_f1: 0.5560
 epoch: 29, train_loss: 0.7136, test_loss: 0.9098, test_f1: 0.5666
 epoch: 30, train_loss: 0.7117, test_loss: 0.9012, test_f1: 0.5850
 epoch: 31, train_loss: 0.6996, test_loss: 0.9335, test_f1: 0.5746
 epoch: 32, train_loss: 0.7035, test_loss: 0.9534, test_f1: 0.5659
 epoch: 33, train_loss: 0.6881, test_loss: 0.8959, test_f1: 0.5953
 epoch: 34, train_loss: 0.6844, test_loss: 0.9351, test_f1: 0.5684
 epoch: 35, train_loss: 0.6756, test_loss: 0.8876, test_f1: 0.6000
 epoch: 36, train_loss: 0.6769, test_loss: 0.9598, test_f1: 0.5794
 epoch: 37, train_loss: 0.6762, test_loss: 0.9340, test_f1: 0.5921
 epoch: 38, train_loss: 0.6533, test_loss: 0.9370, test_f1: 0.5926
 epoch: 39, train_loss: 0.6587, test_loss: 0.9593, test_f1: 0.5650
 epoch: 40, train_loss: 0.6418, test_loss: 0.9214, test_f1: 0.5780
 epoch: 41, train_loss: 0.6388, test_loss: 0.9659, test_f1: 0.5781
 epoch: 42, train_loss: 0.6352, test_loss: 0.9312, test_f1: 0.5760
 epoch: 43, train_loss: 0.6479, test_loss: 0.9592, test_f1: 0.5918
 epoch: 44, train_loss: 0.6269, test_loss: 0.9579, test_f1: 0.5905
 epoch: 45, train_loss: 0.6209, test_loss: 0.9614, test_f1: 0.6064
 epoch: 46, train_loss: 0.6325, test_loss: 0.9682, test_f1: 0.5713
 epoch: 47, train_loss: 0.6216, test_loss: 1.0328, test_f1: 0.5909
 epoch: 48, train_loss: 0.6095, test_loss: 0.9960, test_f1: 0.5960
 epoch: 49, train_loss: 0.6049, test_loss: 0.9841, test_f1: 0.5947
 epoch: 50, train_loss: 0.6040, test_loss: 0.9832, test_f1: 0.5927
 epoch: 51, train_loss: 0.5976, test_loss: 0.9976, test_f1: 0.6078
 epoch: 52, train_loss: 0.5926, test_loss: 1.0138, test_f1: 0.5962
 epoch: 53, train_loss: 0.5861, test_loss: 0.9920, test_f1: 0.5940
 epoch: 54, train_loss: 0.5800, test_loss: 1.0304, test_f1: 0.6019
 epoch: 55, train_loss: 0.5881, test_loss: 0.9804, test_f1: 0.6003
 epoch: 56, train_loss: 0.5733, test_loss: 1.0437, test_f1: 0.5933
 epoch: 57, train_loss: 0.5622, test_loss: 1.0311, test_f1: 0.5951
 epoch: 58, train_loss: 0.5784, test_loss: 0.9879, test_f1: 0.6097
 epoch: 59, train_loss: 0.5813, test_loss: 1.0185, test_f1: 0.6119
 epoch: 60, train_loss: 0.5711, test_loss: 1.0261, test_f1: 0.6041
 epoch: 61, train_loss: 0.5638, test_loss: 1.0364, test_f1: 0.6062
 epoch: 62, train_loss: 0.5666, test_loss: 0.9986, test_f1: 0.6017
 epoch: 63, train_loss: 0.5627, test_loss: 0.9838, test_f1: 0.6107
 epoch: 64, train_loss: 0.5650, test_loss: 0.9884, test_f1: 0.6252
 epoch: 65, train_loss: 0.5522, test_loss: 1.0638, test_f1: 0.5960
 epoch: 66, train_loss: 0.5472, test_loss: 1.0354, test_f1: 0.6113
 epoch: 67, train_loss: 0.5514, test_loss: 1.0092, test_f1: 0.6038
 epoch: 68, train_loss: 0.5472, test_loss: 1.1142, test_f1: 0.6089
 epoch: 69, train_loss: 0.5368, test_loss: 1.0656, test_f1: 0.6125
 epoch: 70, train_loss: 0.5445, test_loss: 1.0639, test_f1: 0.6034
 epoch: 71, train_loss: 0.5256, test_loss: 1.1074, test_f1: 0.6175
 epoch: 72, train_loss: 0.5366, test_loss: 1.0556, test_f1: 0.6105
 epoch: 73, train_loss: 0.5388, test_loss: 1.1041, test_f1: 0.6170
 epoch: 74, train_loss: 0.5259, test_loss: 1.0927, test_f1: 0.6166
 epoch: 75, train_loss: 0.5369, test_loss: 1.0602, test_f1: 0.6152
 epoch: 76, train_loss: 0.5289, test_loss: 1.1528, test_f1: 0.6040
 epoch: 77, train_loss: 0.5243, test_loss: 1.0869, test_f1: 0.6164
 epoch: 78, train_loss: 0.5299, test_loss: 1.0617, test_f1: 0.6230
 epoch: 79, train_loss: 0.5134, test_loss: 1.0964, test_f1: 0.6214
 epoch: 80, train_loss: 0.5182, test_loss: 1.0517, test_f1: 0.6242
 epoch: 81, train_loss: 0.5089, test_loss: 1.2236, test_f1: 0.6255
 epoch: 82, train_loss: 0.5114, test_loss: 1.1153, test_f1: 0.6240
 epoch: 83, train_loss: 0.5168, test_loss: 1.1193, test_f1: 0.6161
 epoch: 84, train_loss: 0.5133, test_loss: 1.1637, test_f1: 0.6371
 epoch: 85, train_loss: 0.5137, test_loss: 1.1955, test_f1: 0.6337
 epoch: 86, train_loss: 0.5117, test_loss: 1.0864, test_f1: 0.6222
 epoch: 87, train_loss: 0.5129, test_loss: 1.1412, test_f1: 0.6271
 epoch: 88, train_loss: 0.5037, test_loss: 1.1271, test_f1: 0.6174
 epoch: 89, train_loss: 0.5016, test_loss: 1.1240, test_f1: 0.6183
 epoch: 90, train_loss: 0.5077, test_loss: 1.1768, test_f1: 0.6318
 epoch: 91, train_loss: 0.4962, test_loss: 1.2287, test_f1: 0.6328
 epoch: 92, train_loss: 0.5058, test_loss: 1.1788, test_f1: 0.6042
 epoch: 93, train_loss: 0.5079, test_loss: 1.1596, test_f1: 0.6241
 epoch: 94, train_loss: 0.4934, test_loss: 1.1704, test_f1: 0.6296
 epoch: 95, train_loss: 0.4995, test_loss: 1.1509, test_f1: 0.6265
 epoch: 96, train_loss: 0.4985, test_loss: 1.1913, test_f1: 0.6216
 epoch: 97, train_loss: 0.4986, test_loss: 1.1395, test_f1: 0.6389
 epoch: 98, train_loss: 0.4784, test_loss: 1.1716, test_f1: 0.6407
 epoch: 99, train_loss: 0.4918, test_loss: 1.2171, test_f1: 0.6327
##################ITERATION #1 ****************************************
 epoch: 0, train_loss: 1.2213, test_loss: 1.0739, test_f1: 0.3973
 epoch: 1, train_loss: 1.0555, test_loss: 0.9999, test_f1: 0.4747
 epoch: 2, train_loss: 1.0046, test_loss: 0.9761, test_f1: 0.5261
 epoch: 3, train_loss: 0.9690, test_loss: 0.9461, test_f1: 0.5055
 epoch: 4, train_loss: 0.9446, test_loss: 0.9190, test_f1: 0.5111
 epoch: 5, train_loss: 0.9121, test_loss: 0.9009, test_f1: 0.5381
 epoch: 6, train_loss: 0.8935, test_loss: 0.9000, test_f1: 0.5337
 epoch: 7, train_loss: 0.8724, test_loss: 0.8420, test_f1: 0.5400
 epoch: 8, train_loss: 0.8544, test_loss: 0.8628, test_f1: 0.5547
 epoch: 9, train_loss: 0.8409, test_loss: 0.8627, test_f1: 0.5351
 epoch: 10, train_loss: 0.8341, test_loss: 0.8642, test_f1: 0.5647
 epoch: 11, train_loss: 0.8125, test_loss: 0.8410, test_f1: 0.5524
 epoch: 12, train_loss: 0.7901, test_loss: 0.8503, test_f1: 0.5497
 epoch: 13, train_loss: 0.7854, test_loss: 0.8095, test_f1: 0.5667
 epoch: 14, train_loss: 0.7765, test_loss: 0.7776, test_f1: 0.5753
 epoch: 15, train_loss: 0.7572, test_loss: 0.8574, test_f1: 0.5631
 epoch: 16, train_loss: 0.7618, test_loss: 0.8195, test_f1: 0.5719
 epoch: 17, train_loss: 0.7565, test_loss: 0.8256, test_f1: 0.5601
 epoch: 18, train_loss: 0.7463, test_loss: 0.8630, test_f1: 0.5757
 epoch: 19, train_loss: 0.7265, test_loss: 0.8034, test_f1: 0.5765
 epoch: 20, train_loss: 0.7214, test_loss: 0.8409, test_f1: 0.6025
 epoch: 21, train_loss: 0.7218, test_loss: 0.8525, test_f1: 0.5853
 epoch: 22, train_loss: 0.7149, test_loss: 0.8041, test_f1: 0.5844
 epoch: 23, train_loss: 0.7093, test_loss: 0.8212, test_f1: 0.5971
 epoch: 24, train_loss: 0.6940, test_loss: 0.8292, test_f1: 0.6021
 epoch: 25, train_loss: 0.6902, test_loss: 0.8004, test_f1: 0.6074
 epoch: 26, train_loss: 0.6814, test_loss: 0.8570, test_f1: 0.5722
 epoch: 27, train_loss: 0.6793, test_loss: 0.8101, test_f1: 0.6096
 epoch: 28, train_loss: 0.6780, test_loss: 0.8287, test_f1: 0.5859
 epoch: 29, train_loss: 0.6791, test_loss: 0.8870, test_f1: 0.5780
 epoch: 30, train_loss: 0.6734, test_loss: 0.8089, test_f1: 0.6058
 epoch: 31, train_loss: 0.6591, test_loss: 0.8363, test_f1: 0.5977
 epoch: 32, train_loss: 0.6438, test_loss: 0.9230, test_f1: 0.5993
 epoch: 33, train_loss: 0.6527, test_loss: 0.9164, test_f1: 0.5851
 epoch: 34, train_loss: 0.6534, test_loss: 0.8714, test_f1: 0.6079
 epoch: 35, train_loss: 0.6455, test_loss: 0.8408, test_f1: 0.6071
 epoch: 36, train_loss: 0.6257, test_loss: 0.8699, test_f1: 0.6036
 epoch: 37, train_loss: 0.6286, test_loss: 0.7760, test_f1: 0.6177
 epoch: 38, train_loss: 0.6260, test_loss: 0.8240, test_f1: 0.6258
 epoch: 39, train_loss: 0.6224, test_loss: 0.8155, test_f1: 0.6263
 epoch: 40, train_loss: 0.6277, test_loss: 0.8868, test_f1: 0.5835
 epoch: 41, train_loss: 0.6023, test_loss: 0.7909, test_f1: 0.6301
 epoch: 42, train_loss: 0.6087, test_loss: 0.8127, test_f1: 0.6234
 epoch: 43, train_loss: 0.5995, test_loss: 0.8407, test_f1: 0.6449
 epoch: 44, train_loss: 0.5988, test_loss: 0.8932, test_f1: 0.6350
 epoch: 45, train_loss: 0.5982, test_loss: 0.8514, test_f1: 0.6182
 epoch: 46, train_loss: 0.6060, test_loss: 0.8728, test_f1: 0.6172
 epoch: 47, train_loss: 0.5831, test_loss: 0.8544, test_f1: 0.6458
 epoch: 48, train_loss: 0.5869, test_loss: 0.8925, test_f1: 0.6210
 epoch: 49, train_loss: 0.5842, test_loss: 0.8599, test_f1: 0.6193
 epoch: 50, train_loss: 0.5713, test_loss: 0.8479, test_f1: 0.6245
 epoch: 51, train_loss: 0.5680, test_loss: 0.8668, test_f1: 0.6247
 epoch: 52, train_loss: 0.5502, test_loss: 0.8503, test_f1: 0.6328
 epoch: 53, train_loss: 0.5582, test_loss: 0.9094, test_f1: 0.6397
 epoch: 54, train_loss: 0.5536, test_loss: 0.8918, test_f1: 0.6452
 epoch: 55, train_loss: 0.5403, test_loss: 0.8699, test_f1: 0.6406
 epoch: 56, train_loss: 0.5409, test_loss: 0.8451, test_f1: 0.6428
 epoch: 57, train_loss: 0.5426, test_loss: 0.8352, test_f1: 0.6467
 epoch: 58, train_loss: 0.5480, test_loss: 0.8308, test_f1: 0.6448
 epoch: 59, train_loss: 0.5282, test_loss: 0.8963, test_f1: 0.6434
 epoch: 60, train_loss: 0.5373, test_loss: 0.9260, test_f1: 0.6235
 epoch: 61, train_loss: 0.5383, test_loss: 0.8418, test_f1: 0.6375
 epoch: 62, train_loss: 0.5450, test_loss: 0.9187, test_f1: 0.6257
 epoch: 63, train_loss: 0.5257, test_loss: 0.9060, test_f1: 0.6365
 epoch: 64, train_loss: 0.5229, test_loss: 0.9114, test_f1: 0.6385
 epoch: 65, train_loss: 0.5200, test_loss: 0.9535, test_f1: 0.6516
 epoch: 66, train_loss: 0.5115, test_loss: 0.9259, test_f1: 0.6422
 epoch: 67, train_loss: 0.5246, test_loss: 0.9274, test_f1: 0.6326
 epoch: 68, train_loss: 0.5296, test_loss: 0.8704, test_f1: 0.6463
 epoch: 69, train_loss: 0.5233, test_loss: 0.8760, test_f1: 0.6272
 epoch: 70, train_loss: 0.5201, test_loss: 0.8915, test_f1: 0.6292
 epoch: 71, train_loss: 0.5152, test_loss: 0.9381, test_f1: 0.6299
 epoch: 72, train_loss: 0.5143, test_loss: 0.9513, test_f1: 0.6358
 epoch: 73, train_loss: 0.5204, test_loss: 0.9014, test_f1: 0.6366
 epoch: 74, train_loss: 0.5105, test_loss: 0.8906, test_f1: 0.6389
 epoch: 75, train_loss: 0.5165, test_loss: 0.8545, test_f1: 0.6410
 epoch: 76, train_loss: 0.4910, test_loss: 0.9378, test_f1: 0.6480
 epoch: 77, train_loss: 0.5018, test_loss: 0.8946, test_f1: 0.6388
 epoch: 78, train_loss: 0.4931, test_loss: 0.9087, test_f1: 0.6424
 epoch: 79, train_loss: 0.5061, test_loss: 0.8454, test_f1: 0.6317
 epoch: 80, train_loss: 0.5017, test_loss: 0.8996, test_f1: 0.6492
 epoch: 81, train_loss: 0.4851, test_loss: 0.9187, test_f1: 0.6402
 epoch: 82, train_loss: 0.4952, test_loss: 0.9452, test_f1: 0.6454
 epoch: 83, train_loss: 0.4812, test_loss: 0.9364, test_f1: 0.6444
 epoch: 84, train_loss: 0.4946, test_loss: 0.9348, test_f1: 0.6398
 epoch: 85, train_loss: 0.4716, test_loss: 0.9783, test_f1: 0.6515
 epoch: 86, train_loss: 0.4920, test_loss: 0.9438, test_f1: 0.6341
 epoch: 87, train_loss: 0.4831, test_loss: 0.9235, test_f1: 0.6381
 epoch: 88, train_loss: 0.4745, test_loss: 1.0038, test_f1: 0.6433
 epoch: 89, train_loss: 0.4738, test_loss: 0.9702, test_f1: 0.6429
 epoch: 90, train_loss: 0.4754, test_loss: 0.9247, test_f1: 0.6401
 epoch: 91, train_loss: 0.4609, test_loss: 0.9637, test_f1: 0.6443
 epoch: 92, train_loss: 0.4658, test_loss: 0.9198, test_f1: 0.6405
 epoch: 93, train_loss: 0.4715, test_loss: 0.9739, test_f1: 0.6423
 epoch: 94, train_loss: 0.4742, test_loss: 0.9606, test_f1: 0.6419
 epoch: 95, train_loss: 0.4674, test_loss: 0.9526, test_f1: 0.6598
 epoch: 96, train_loss: 0.4736, test_loss: 0.9440, test_f1: 0.6494
 epoch: 97, train_loss: 0.4651, test_loss: 0.9553, test_f1: 0.6434
 epoch: 98, train_loss: 0.4710, test_loss: 0.9764, test_f1: 0.6384
 epoch: 99, train_loss: 0.4674, test_loss: 0.9953, test_f1: 0.6509
##################ITERATION #2 ****************************************
 epoch: 0, train_loss: 1.1671, test_loss: 1.0235, test_f1: 0.4229
 epoch: 1, train_loss: 1.0291, test_loss: 0.9792, test_f1: 0.4873
 epoch: 2, train_loss: 0.9927, test_loss: 0.9803, test_f1: 0.4788
 epoch: 3, train_loss: 0.9599, test_loss: 0.9652, test_f1: 0.5391
 epoch: 4, train_loss: 0.9357, test_loss: 0.9284, test_f1: 0.5252
 epoch: 5, train_loss: 0.9162, test_loss: 0.9196, test_f1: 0.5279
 epoch: 6, train_loss: 0.9036, test_loss: 0.9266, test_f1: 0.5645
 epoch: 7, train_loss: 0.8805, test_loss: 0.9195, test_f1: 0.5357
 epoch: 8, train_loss: 0.8728, test_loss: 0.9072, test_f1: 0.5729
 epoch: 9, train_loss: 0.8550, test_loss: 0.8878, test_f1: 0.5719
 epoch: 10, train_loss: 0.8386, test_loss: 0.8599, test_f1: 0.5439
 epoch: 11, train_loss: 0.8290, test_loss: 0.8652, test_f1: 0.5793
 epoch: 12, train_loss: 0.8154, test_loss: 0.8560, test_f1: 0.5726
 epoch: 13, train_loss: 0.8045, test_loss: 0.8700, test_f1: 0.5650
 epoch: 14, train_loss: 0.7988, test_loss: 0.8393, test_f1: 0.5919
 epoch: 15, train_loss: 0.7768, test_loss: 0.8620, test_f1: 0.5649
 epoch: 16, train_loss: 0.7800, test_loss: 0.8173, test_f1: 0.5777
 epoch: 17, train_loss: 0.7745, test_loss: 0.8467, test_f1: 0.5471
 epoch: 18, train_loss: 0.7641, test_loss: 0.8409, test_f1: 0.5787
 epoch: 19, train_loss: 0.7478, test_loss: 0.8313, test_f1: 0.5916
 epoch: 20, train_loss: 0.7346, test_loss: 0.8382, test_f1: 0.5792
 epoch: 21, train_loss: 0.7378, test_loss: 0.8494, test_f1: 0.5815
 epoch: 22, train_loss: 0.7243, test_loss: 0.8378, test_f1: 0.5774
 epoch: 23, train_loss: 0.7145, test_loss: 0.8337, test_f1: 0.5945
 epoch: 24, train_loss: 0.7176, test_loss: 0.8289, test_f1: 0.6004
 epoch: 25, train_loss: 0.7082, test_loss: 0.8391, test_f1: 0.5845
 epoch: 26, train_loss: 0.7078, test_loss: 0.8511, test_f1: 0.5990
 epoch: 27, train_loss: 0.6868, test_loss: 0.8154, test_f1: 0.5953
 epoch: 28, train_loss: 0.6903, test_loss: 0.8219, test_f1: 0.5984
 epoch: 29, train_loss: 0.6727, test_loss: 0.8337, test_f1: 0.6114
 epoch: 30, train_loss: 0.6696, test_loss: 0.7921, test_f1: 0.6178
 epoch: 31, train_loss: 0.6654, test_loss: 0.8163, test_f1: 0.5953
 epoch: 32, train_loss: 0.6558, test_loss: 0.7820, test_f1: 0.6152
 epoch: 33, train_loss: 0.6557, test_loss: 0.8737, test_f1: 0.5951
 epoch: 34, train_loss: 0.6368, test_loss: 0.8187, test_f1: 0.6067
 epoch: 35, train_loss: 0.6359, test_loss: 0.8070, test_f1: 0.6044
 epoch: 36, train_loss: 0.6367, test_loss: 0.8377, test_f1: 0.6105
 epoch: 37, train_loss: 0.6307, test_loss: 0.8143, test_f1: 0.6535
 epoch: 38, train_loss: 0.6294, test_loss: 0.8190, test_f1: 0.6332
 epoch: 39, train_loss: 0.6268, test_loss: 0.8023, test_f1: 0.6468
 epoch: 40, train_loss: 0.6275, test_loss: 0.7743, test_f1: 0.6263
 epoch: 41, train_loss: 0.6148, test_loss: 0.8821, test_f1: 0.6120
 epoch: 42, train_loss: 0.6073, test_loss: 0.8444, test_f1: 0.6327
 epoch: 43, train_loss: 0.6053, test_loss: 0.8818, test_f1: 0.6175
 epoch: 44, train_loss: 0.6000, test_loss: 0.8441, test_f1: 0.6287
 epoch: 45, train_loss: 0.6060, test_loss: 0.8684, test_f1: 0.6626
 epoch: 46, train_loss: 0.6035, test_loss: 0.8542, test_f1: 0.6182
 epoch: 47, train_loss: 0.5756, test_loss: 0.8526, test_f1: 0.6393
 epoch: 48, train_loss: 0.5744, test_loss: 0.8594, test_f1: 0.6067
 epoch: 49, train_loss: 0.5752, test_loss: 0.8713, test_f1: 0.6010
 epoch: 50, train_loss: 0.5841, test_loss: 0.9339, test_f1: 0.6222
 epoch: 51, train_loss: 0.5549, test_loss: 0.9508, test_f1: 0.6189
 epoch: 52, train_loss: 0.5513, test_loss: 0.9218, test_f1: 0.6511
 epoch: 53, train_loss: 0.5406, test_loss: 0.9669, test_f1: 0.6313
 epoch: 54, train_loss: 0.5431, test_loss: 0.9114, test_f1: 0.6361
 epoch: 55, train_loss: 0.5485, test_loss: 0.9251, test_f1: 0.6033
 epoch: 56, train_loss: 0.5404, test_loss: 0.9017, test_f1: 0.6138
 epoch: 57, train_loss: 0.5363, test_loss: 0.9378, test_f1: 0.6270
 epoch: 58, train_loss: 0.5246, test_loss: 0.9983, test_f1: 0.6441
 epoch: 59, train_loss: 0.5351, test_loss: 0.9270, test_f1: 0.6010
 epoch: 60, train_loss: 0.5274, test_loss: 0.9951, test_f1: 0.6148
 epoch: 61, train_loss: 0.5412, test_loss: 0.9361, test_f1: 0.6398
 epoch: 62, train_loss: 0.5234, test_loss: 1.0373, test_f1: 0.6058
 epoch: 63, train_loss: 0.5277, test_loss: 0.9698, test_f1: 0.6424
 epoch: 64, train_loss: 0.5258, test_loss: 0.9889, test_f1: 0.6420
 epoch: 65, train_loss: 0.5158, test_loss: 1.0356, test_f1: 0.6407
 epoch: 66, train_loss: 0.5296, test_loss: 1.0126, test_f1: 0.6221
 epoch: 67, train_loss: 0.5140, test_loss: 1.0274, test_f1: 0.6470
 epoch: 68, train_loss: 0.5173, test_loss: 0.9699, test_f1: 0.6475
 epoch: 69, train_loss: 0.5085, test_loss: 0.9700, test_f1: 0.6275
 epoch: 70, train_loss: 0.5208, test_loss: 0.9610, test_f1: 0.6360
 epoch: 71, train_loss: 0.5137, test_loss: 1.0013, test_f1: 0.6471
 epoch: 72, train_loss: 0.5136, test_loss: 0.9814, test_f1: 0.5904
 epoch: 73, train_loss: 0.5049, test_loss: 0.9439, test_f1: 0.6218
 epoch: 74, train_loss: 0.5052, test_loss: 0.9320, test_f1: 0.6649
 epoch: 75, train_loss: 0.4973, test_loss: 1.0224, test_f1: 0.6436
 epoch: 76, train_loss: 0.4919, test_loss: 0.9431, test_f1: 0.6327
 epoch: 77, train_loss: 0.4944, test_loss: 0.9592, test_f1: 0.6210
 epoch: 78, train_loss: 0.4964, test_loss: 1.0008, test_f1: 0.6270
 epoch: 79, train_loss: 0.4914, test_loss: 0.9814, test_f1: 0.6412
 epoch: 80, train_loss: 0.4945, test_loss: 1.0530, test_f1: 0.6107
 epoch: 81, train_loss: 0.4942, test_loss: 1.0288, test_f1: 0.6401
 epoch: 82, train_loss: 0.4794, test_loss: 1.0440, test_f1: 0.6199
 epoch: 83, train_loss: 0.4798, test_loss: 1.0023, test_f1: 0.6525
 epoch: 84, train_loss: 0.4816, test_loss: 1.1111, test_f1: 0.6364
 epoch: 85, train_loss: 0.4670, test_loss: 1.0329, test_f1: 0.6385
 epoch: 86, train_loss: 0.4784, test_loss: 1.0672, test_f1: 0.5964
 epoch: 87, train_loss: 0.4775, test_loss: 1.0553, test_f1: 0.6254
 epoch: 88, train_loss: 0.4771, test_loss: 1.0993, test_f1: 0.6022
 epoch: 89, train_loss: 0.4634, test_loss: 1.0969, test_f1: 0.6310
 epoch: 90, train_loss: 0.4693, test_loss: 1.0017, test_f1: 0.6484
 epoch: 91, train_loss: 0.4607, test_loss: 1.1489, test_f1: 0.6341
 epoch: 92, train_loss: 0.4546, test_loss: 1.1304, test_f1: 0.6150
 epoch: 93, train_loss: 0.4571, test_loss: 1.1606, test_f1: 0.6079
 epoch: 94, train_loss: 0.4519, test_loss: 1.0859, test_f1: 0.6296
 epoch: 95, train_loss: 0.4679, test_loss: 1.1196, test_f1: 0.6363
 epoch: 96, train_loss: 0.4654, test_loss: 1.1054, test_f1: 0.6442
 epoch: 97, train_loss: 0.4664, test_loss: 1.1189, test_f1: 0.6420
 epoch: 98, train_loss: 0.4534, test_loss: 1.2217, test_f1: 0.6414
 epoch: 99, train_loss: 0.4564, test_loss: 1.2078, test_f1: 0.6247
##################ITERATION #3 ****************************************
 epoch: 0, train_loss: 1.1446, test_loss: 0.9814, test_f1: 0.4885
 epoch: 1, train_loss: 1.0275, test_loss: 0.9554, test_f1: 0.4953
 epoch: 2, train_loss: 0.9934, test_loss: 0.9458, test_f1: 0.5054
 epoch: 3, train_loss: 0.9655, test_loss: 0.9287, test_f1: 0.5460
 epoch: 4, train_loss: 0.9353, test_loss: 0.9159, test_f1: 0.5421
 epoch: 5, train_loss: 0.9289, test_loss: 0.9129, test_f1: 0.5316
 epoch: 6, train_loss: 0.9047, test_loss: 0.9041, test_f1: 0.5474
 epoch: 7, train_loss: 0.8929, test_loss: 0.9092, test_f1: 0.5706
 epoch: 8, train_loss: 0.8864, test_loss: 0.8724, test_f1: 0.5605
 epoch: 9, train_loss: 0.8749, test_loss: 0.8701, test_f1: 0.5672
 epoch: 10, train_loss: 0.8594, test_loss: 0.8741, test_f1: 0.5826
 epoch: 11, train_loss: 0.8426, test_loss: 0.8661, test_f1: 0.5913
 epoch: 12, train_loss: 0.8351, test_loss: 0.8580, test_f1: 0.5843
 epoch: 13, train_loss: 0.8120, test_loss: 0.9215, test_f1: 0.5644
 epoch: 14, train_loss: 0.8097, test_loss: 0.8535, test_f1: 0.5997
 epoch: 15, train_loss: 0.7963, test_loss: 0.8356, test_f1: 0.5965
 epoch: 16, train_loss: 0.7921, test_loss: 0.8311, test_f1: 0.6058
 epoch: 17, train_loss: 0.7773, test_loss: 0.8153, test_f1: 0.5974
 epoch: 18, train_loss: 0.7720, test_loss: 0.8107, test_f1: 0.6024
 epoch: 19, train_loss: 0.7568, test_loss: 0.8536, test_f1: 0.5833
 epoch: 20, train_loss: 0.7512, test_loss: 0.8243, test_f1: 0.6041
 epoch: 21, train_loss: 0.7409, test_loss: 0.8206, test_f1: 0.6209
 epoch: 22, train_loss: 0.7310, test_loss: 0.8014, test_f1: 0.6217
 epoch: 23, train_loss: 0.7390, test_loss: 0.8572, test_f1: 0.6214
 epoch: 24, train_loss: 0.7150, test_loss: 0.8379, test_f1: 0.6300
 epoch: 25, train_loss: 0.7169, test_loss: 0.8950, test_f1: 0.5934
 epoch: 26, train_loss: 0.6997, test_loss: 0.8141, test_f1: 0.6304
 epoch: 27, train_loss: 0.6928, test_loss: 0.7855, test_f1: 0.6395
 epoch: 28, train_loss: 0.6954, test_loss: 0.8268, test_f1: 0.6348
 epoch: 29, train_loss: 0.6907, test_loss: 0.7998, test_f1: 0.6294
 epoch: 30, train_loss: 0.6834, test_loss: 0.7894, test_f1: 0.6483
 epoch: 31, train_loss: 0.6824, test_loss: 0.8676, test_f1: 0.6277
 epoch: 32, train_loss: 0.6648, test_loss: 0.8379, test_f1: 0.6179
 epoch: 33, train_loss: 0.6581, test_loss: 0.7709, test_f1: 0.6329
 epoch: 34, train_loss: 0.6669, test_loss: 0.7867, test_f1: 0.6551
 epoch: 35, train_loss: 0.6719, test_loss: 0.7958, test_f1: 0.6439
 epoch: 36, train_loss: 0.6473, test_loss: 0.8011, test_f1: 0.6537
 epoch: 37, train_loss: 0.6530, test_loss: 0.8250, test_f1: 0.6482
 epoch: 38, train_loss: 0.6256, test_loss: 0.8503, test_f1: 0.6269
 epoch: 39, train_loss: 0.6381, test_loss: 0.7574, test_f1: 0.6292
 epoch: 40, train_loss: 0.6415, test_loss: 0.7590, test_f1: 0.6502
 epoch: 41, train_loss: 0.6373, test_loss: 0.7921, test_f1: 0.6326
 epoch: 42, train_loss: 0.6234, test_loss: 0.7439, test_f1: 0.6486
 epoch: 43, train_loss: 0.6199, test_loss: 0.8438, test_f1: 0.6395
 epoch: 44, train_loss: 0.6075, test_loss: 0.7843, test_f1: 0.6378
 epoch: 45, train_loss: 0.6175, test_loss: 0.8507, test_f1: 0.6377
 epoch: 46, train_loss: 0.5959, test_loss: 0.8703, test_f1: 0.6352
 epoch: 47, train_loss: 0.6075, test_loss: 0.8090, test_f1: 0.6485
 epoch: 48, train_loss: 0.6111, test_loss: 0.7872, test_f1: 0.6370
 epoch: 49, train_loss: 0.5965, test_loss: 0.9132, test_f1: 0.6396
 epoch: 50, train_loss: 0.6111, test_loss: 0.8424, test_f1: 0.6361
 epoch: 51, train_loss: 0.5788, test_loss: 0.8027, test_f1: 0.6450
 epoch: 52, train_loss: 0.5747, test_loss: 0.8162, test_f1: 0.6501
 epoch: 53, train_loss: 0.5636, test_loss: 0.7397, test_f1: 0.6618
 epoch: 54, train_loss: 0.5629, test_loss: 0.7777, test_f1: 0.6599
 epoch: 55, train_loss: 0.5658, test_loss: 0.8451, test_f1: 0.6493
 epoch: 56, train_loss: 0.5523, test_loss: 0.8123, test_f1: 0.6532
 epoch: 57, train_loss: 0.5525, test_loss: 0.8070, test_f1: 0.6532
 epoch: 58, train_loss: 0.5672, test_loss: 0.8359, test_f1: 0.6621
 epoch: 59, train_loss: 0.5566, test_loss: 0.8233, test_f1: 0.6670
 epoch: 60, train_loss: 0.5491, test_loss: 0.8211, test_f1: 0.6483
 epoch: 61, train_loss: 0.5580, test_loss: 0.8046, test_f1: 0.6442
 epoch: 62, train_loss: 0.5434, test_loss: 0.8062, test_f1: 0.6564
 epoch: 63, train_loss: 0.5442, test_loss: 0.8194, test_f1: 0.6424
 epoch: 64, train_loss: 0.5362, test_loss: 0.8322, test_f1: 0.6473
 epoch: 65, train_loss: 0.5441, test_loss: 0.8938, test_f1: 0.6287
 epoch: 66, train_loss: 0.5401, test_loss: 0.8917, test_f1: 0.6529
 epoch: 67, train_loss: 0.5396, test_loss: 0.7865, test_f1: 0.6533
 epoch: 68, train_loss: 0.5349, test_loss: 0.8056, test_f1: 0.6392
 epoch: 69, train_loss: 0.5272, test_loss: 0.8042, test_f1: 0.6668
 epoch: 70, train_loss: 0.5292, test_loss: 0.8182, test_f1: 0.6478
 epoch: 71, train_loss: 0.5295, test_loss: 0.8220, test_f1: 0.6532
 epoch: 72, train_loss: 0.5179, test_loss: 0.8645, test_f1: 0.6501
 epoch: 73, train_loss: 0.5160, test_loss: 0.8622, test_f1: 0.6483
 epoch: 74, train_loss: 0.5245, test_loss: 0.8428, test_f1: 0.6379
 epoch: 75, train_loss: 0.5132, test_loss: 0.8078, test_f1: 0.6361
 epoch: 76, train_loss: 0.5246, test_loss: 0.9007, test_f1: 0.6543
 epoch: 77, train_loss: 0.5146, test_loss: 0.8350, test_f1: 0.6506
 epoch: 78, train_loss: 0.5090, test_loss: 0.7946, test_f1: 0.6480
 epoch: 79, train_loss: 0.5102, test_loss: 0.8767, test_f1: 0.6441
 epoch: 80, train_loss: 0.4958, test_loss: 0.8670, test_f1: 0.6359
 epoch: 81, train_loss: 0.5003, test_loss: 0.9225, test_f1: 0.6332
 epoch: 82, train_loss: 0.4998, test_loss: 0.9210, test_f1: 0.6355
 epoch: 83, train_loss: 0.4927, test_loss: 0.8649, test_f1: 0.6529
 epoch: 84, train_loss: 0.5006, test_loss: 0.8980, test_f1: 0.6451
 epoch: 85, train_loss: 0.4981, test_loss: 0.8887, test_f1: 0.6507
 epoch: 86, train_loss: 0.4863, test_loss: 0.8532, test_f1: 0.6588
 epoch: 87, train_loss: 0.4917, test_loss: 0.8821, test_f1: 0.6750
 epoch: 88, train_loss: 0.4971, test_loss: 0.9187, test_f1: 0.6478
 epoch: 89, train_loss: 0.5028, test_loss: 0.8786, test_f1: 0.6580
 epoch: 90, train_loss: 0.4928, test_loss: 0.8860, test_f1: 0.6519
 epoch: 91, train_loss: 0.4826, test_loss: 0.8946, test_f1: 0.6482
 epoch: 92, train_loss: 0.4766, test_loss: 0.9128, test_f1: 0.6452
 epoch: 93, train_loss: 0.4794, test_loss: 0.9370, test_f1: 0.6490
 epoch: 94, train_loss: 0.4878, test_loss: 0.8873, test_f1: 0.6563
 epoch: 95, train_loss: 0.4694, test_loss: 0.9124, test_f1: 0.6522
 epoch: 96, train_loss: 0.4697, test_loss: 0.9251, test_f1: 0.6488
 epoch: 97, train_loss: 0.4725, test_loss: 0.8918, test_f1: 0.6731
 epoch: 98, train_loss: 0.4707, test_loss: 0.8935, test_f1: 0.6537
 epoch: 99, train_loss: 0.4660, test_loss: 0.9080, test_f1: 0.6552
##################ITERATION #4 ****************************************
 epoch: 0, train_loss: 1.1739, test_loss: 0.9996, test_f1: 0.5021
 epoch: 1, train_loss: 1.0418, test_loss: 0.9768, test_f1: 0.5173
 epoch: 2, train_loss: 0.9957, test_loss: 0.9628, test_f1: 0.5419
 epoch: 3, train_loss: 0.9717, test_loss: 0.9426, test_f1: 0.5556
 epoch: 4, train_loss: 0.9370, test_loss: 0.9150, test_f1: 0.5559
 epoch: 5, train_loss: 0.9281, test_loss: 0.9224, test_f1: 0.5473
 epoch: 6, train_loss: 0.8959, test_loss: 0.9113, test_f1: 0.5577
 epoch: 7, train_loss: 0.8792, test_loss: 0.8955, test_f1: 0.5424
 epoch: 8, train_loss: 0.8679, test_loss: 0.8788, test_f1: 0.5668
 epoch: 9, train_loss: 0.8552, test_loss: 0.8848, test_f1: 0.5781
 epoch: 10, train_loss: 0.8343, test_loss: 0.8721, test_f1: 0.5843
 epoch: 11, train_loss: 0.8347, test_loss: 0.8854, test_f1: 0.5861
 epoch: 12, train_loss: 0.8028, test_loss: 0.8960, test_f1: 0.6000
 epoch: 13, train_loss: 0.8018, test_loss: 0.9145, test_f1: 0.5669
 epoch: 14, train_loss: 0.7967, test_loss: 0.8379, test_f1: 0.6373
 epoch: 15, train_loss: 0.7859, test_loss: 0.8432, test_f1: 0.6046
 epoch: 16, train_loss: 0.7719, test_loss: 0.8421, test_f1: 0.6076
 epoch: 17, train_loss: 0.7595, test_loss: 0.8349, test_f1: 0.5891
 epoch: 18, train_loss: 0.7526, test_loss: 0.8451, test_f1: 0.6169
 epoch: 19, train_loss: 0.7473, test_loss: 0.8234, test_f1: 0.6076
 epoch: 20, train_loss: 0.7430, test_loss: 0.8083, test_f1: 0.6211
 epoch: 21, train_loss: 0.7325, test_loss: 0.8031, test_f1: 0.6034
 epoch: 22, train_loss: 0.7265, test_loss: 0.7809, test_f1: 0.6257
 epoch: 23, train_loss: 0.7100, test_loss: 0.7869, test_f1: 0.6464
 epoch: 24, train_loss: 0.7080, test_loss: 0.8178, test_f1: 0.6420
 epoch: 25, train_loss: 0.6958, test_loss: 0.8126, test_f1: 0.6492
 epoch: 26, train_loss: 0.6906, test_loss: 0.8193, test_f1: 0.6278
 epoch: 27, train_loss: 0.6893, test_loss: 0.8288, test_f1: 0.6240
 epoch: 28, train_loss: 0.6804, test_loss: 0.7978, test_f1: 0.6389
 epoch: 29, train_loss: 0.6640, test_loss: 0.7896, test_f1: 0.6310
 epoch: 30, train_loss: 0.6722, test_loss: 0.8077, test_f1: 0.6368
 epoch: 31, train_loss: 0.6557, test_loss: 0.8264, test_f1: 0.6264
 epoch: 32, train_loss: 0.6674, test_loss: 0.7775, test_f1: 0.6612
 epoch: 33, train_loss: 0.6497, test_loss: 0.7929, test_f1: 0.6416
 epoch: 34, train_loss: 0.6453, test_loss: 0.7535, test_f1: 0.6654
 epoch: 35, train_loss: 0.6455, test_loss: 0.8102, test_f1: 0.6475
 epoch: 36, train_loss: 0.6328, test_loss: 0.7722, test_f1: 0.6354
 epoch: 37, train_loss: 0.6321, test_loss: 0.7943, test_f1: 0.6624
 epoch: 38, train_loss: 0.6402, test_loss: 0.7265, test_f1: 0.6412
 epoch: 39, train_loss: 0.6177, test_loss: 0.7458, test_f1: 0.6540
 epoch: 40, train_loss: 0.6007, test_loss: 0.7823, test_f1: 0.6492
 epoch: 41, train_loss: 0.6087, test_loss: 0.7116, test_f1: 0.6595
 epoch: 42, train_loss: 0.6071, test_loss: 0.7023, test_f1: 0.6726
 epoch: 43, train_loss: 0.6083, test_loss: 0.8006, test_f1: 0.6514
 epoch: 44, train_loss: 0.5974, test_loss: 0.7683, test_f1: 0.6601
 epoch: 45, train_loss: 0.5923, test_loss: 0.8122, test_f1: 0.6352
 epoch: 46, train_loss: 0.5897, test_loss: 0.7500, test_f1: 0.6648
 epoch: 47, train_loss: 0.5799, test_loss: 0.7502, test_f1: 0.6580
 epoch: 48, train_loss: 0.5818, test_loss: 0.7780, test_f1: 0.6592
 epoch: 49, train_loss: 0.5777, test_loss: 0.7173, test_f1: 0.6591
 epoch: 50, train_loss: 0.5686, test_loss: 0.8194, test_f1: 0.6439
 epoch: 51, train_loss: 0.5620, test_loss: 0.7791, test_f1: 0.6646
 epoch: 52, train_loss: 0.5499, test_loss: 0.7725, test_f1: 0.6815
 epoch: 53, train_loss: 0.5390, test_loss: 0.7703, test_f1: 0.6622
 epoch: 54, train_loss: 0.5444, test_loss: 0.7481, test_f1: 0.6718
 epoch: 55, train_loss: 0.5470, test_loss: 0.7659, test_f1: 0.6736
 epoch: 56, train_loss: 0.5342, test_loss: 0.8003, test_f1: 0.6418
 epoch: 57, train_loss: 0.5285, test_loss: 0.7749, test_f1: 0.6520
 epoch: 58, train_loss: 0.5319, test_loss: 0.8502, test_f1: 0.6594
 epoch: 59, train_loss: 0.5310, test_loss: 0.7689, test_f1: 0.6674
 epoch: 60, train_loss: 0.5234, test_loss: 0.8007, test_f1: 0.6840
 epoch: 61, train_loss: 0.5333, test_loss: 0.7886, test_f1: 0.6634
 epoch: 62, train_loss: 0.5274, test_loss: 0.8021, test_f1: 0.6553
 epoch: 63, train_loss: 0.5314, test_loss: 0.7985, test_f1: 0.6540
 epoch: 64, train_loss: 0.5218, test_loss: 0.8109, test_f1: 0.6630
 epoch: 65, train_loss: 0.5273, test_loss: 0.8025, test_f1: 0.6918
 epoch: 66, train_loss: 0.5122, test_loss: 0.7555, test_f1: 0.6639
 epoch: 67, train_loss: 0.5122, test_loss: 0.8103, test_f1: 0.6652
 epoch: 68, train_loss: 0.5074, test_loss: 0.8118, test_f1: 0.6653
 epoch: 69, train_loss: 0.4896, test_loss: 0.8184, test_f1: 0.6723
 epoch: 70, train_loss: 0.5100, test_loss: 0.7588, test_f1: 0.6717
 epoch: 71, train_loss: 0.5085, test_loss: 0.8170, test_f1: 0.6690
 epoch: 72, train_loss: 0.4981, test_loss: 0.7957, test_f1: 0.6715
 epoch: 73, train_loss: 0.5093, test_loss: 0.8020, test_f1: 0.6849
 epoch: 74, train_loss: 0.5102, test_loss: 0.8490, test_f1: 0.6618
 epoch: 75, train_loss: 0.4941, test_loss: 0.8133, test_f1: 0.6732
 epoch: 76, train_loss: 0.4862, test_loss: 0.7907, test_f1: 0.6610
 epoch: 77, train_loss: 0.4829, test_loss: 0.8557, test_f1: 0.6585
 epoch: 78, train_loss: 0.4871, test_loss: 0.8479, test_f1: 0.6702
 epoch: 79, train_loss: 0.4724, test_loss: 0.8875, test_f1: 0.6638
 epoch: 80, train_loss: 0.4876, test_loss: 0.8152, test_f1: 0.6738
 epoch: 81, train_loss: 0.4858, test_loss: 0.8427, test_f1: 0.6576
 epoch: 82, train_loss: 0.4871, test_loss: 0.8454, test_f1: 0.6780
 epoch: 83, train_loss: 0.4674, test_loss: 0.8186, test_f1: 0.6692
 epoch: 84, train_loss: 0.4695, test_loss: 0.8132, test_f1: 0.6488
 epoch: 85, train_loss: 0.4786, test_loss: 0.8302, test_f1: 0.6931
 epoch: 86, train_loss: 0.4775, test_loss: 0.8070, test_f1: 0.6701
 epoch: 87, train_loss: 0.4767, test_loss: 0.8251, test_f1: 0.6784
 epoch: 88, train_loss: 0.4748, test_loss: 0.8400, test_f1: 0.6903
 epoch: 89, train_loss: 0.4524, test_loss: 0.7980, test_f1: 0.6674
 epoch: 90, train_loss: 0.4616, test_loss: 0.8232, test_f1: 0.6860
 epoch: 91, train_loss: 0.4689, test_loss: 0.8785, test_f1: 0.6638
 epoch: 92, train_loss: 0.4724, test_loss: 0.8085, test_f1: 0.6691
 epoch: 93, train_loss: 0.4497, test_loss: 0.8081, test_f1: 0.6835
 epoch: 94, train_loss: 0.4688, test_loss: 0.8196, test_f1: 0.6672
 epoch: 95, train_loss: 0.4674, test_loss: 0.8064, test_f1: 0.6786
 epoch: 96, train_loss: 0.4463, test_loss: 0.7860, test_f1: 0.6801
 epoch: 97, train_loss: 0.4617, test_loss: 0.8073, test_f1: 0.6777
 epoch: 98, train_loss: 0.4582, test_loss: 0.8192, test_f1: 0.6565
 epoch: 99, train_loss: 0.4470, test_loss: 0.8583, test_f1: 0.6761
##################ITERATION #5 ****************************************
 epoch: 0, train_loss: 1.1640, test_loss: 0.9631, test_f1: 0.4914
 epoch: 1, train_loss: 1.0265, test_loss: 0.9475, test_f1: 0.4876
 epoch: 2, train_loss: 0.9891, test_loss: 0.9225, test_f1: 0.5472
 epoch: 3, train_loss: 0.9705, test_loss: 0.9357, test_f1: 0.4967
 epoch: 4, train_loss: 0.9362, test_loss: 0.9075, test_f1: 0.5520
 epoch: 5, train_loss: 0.9291, test_loss: 0.9046, test_f1: 0.5613
 epoch: 6, train_loss: 0.8991, test_loss: 0.8880, test_f1: 0.5575
 epoch: 7, train_loss: 0.8822, test_loss: 0.8723, test_f1: 0.5726
 epoch: 8, train_loss: 0.8724, test_loss: 0.8871, test_f1: 0.5443
 epoch: 9, train_loss: 0.8496, test_loss: 0.8813, test_f1: 0.5739
 epoch: 10, train_loss: 0.8329, test_loss: 0.8665, test_f1: 0.5649
 epoch: 11, train_loss: 0.8339, test_loss: 0.8446, test_f1: 0.6082
 epoch: 12, train_loss: 0.8042, test_loss: 0.8530, test_f1: 0.5925
 epoch: 13, train_loss: 0.8000, test_loss: 0.8394, test_f1: 0.6080
 epoch: 14, train_loss: 0.7861, test_loss: 0.8417, test_f1: 0.6033
 epoch: 15, train_loss: 0.7809, test_loss: 0.8235, test_f1: 0.6415
 epoch: 16, train_loss: 0.7696, test_loss: 0.8190, test_f1: 0.6322
 epoch: 17, train_loss: 0.7599, test_loss: 0.8208, test_f1: 0.6320
 epoch: 18, train_loss: 0.7574, test_loss: 0.8249, test_f1: 0.6191
 epoch: 19, train_loss: 0.7514, test_loss: 0.8315, test_f1: 0.6180
 epoch: 20, train_loss: 0.7225, test_loss: 0.8242, test_f1: 0.6477
 epoch: 21, train_loss: 0.7299, test_loss: 0.8285, test_f1: 0.6128
 epoch: 22, train_loss: 0.7193, test_loss: 0.8124, test_f1: 0.6367
 epoch: 23, train_loss: 0.7025, test_loss: 0.8031, test_f1: 0.6377
 epoch: 24, train_loss: 0.6975, test_loss: 0.8099, test_f1: 0.6443
 epoch: 25, train_loss: 0.7021, test_loss: 0.8522, test_f1: 0.6342
 epoch: 26, train_loss: 0.6977, test_loss: 0.7988, test_f1: 0.6518
 epoch: 27, train_loss: 0.6904, test_loss: 0.7856, test_f1: 0.6586
 epoch: 28, train_loss: 0.6696, test_loss: 0.7917, test_f1: 0.6544
 epoch: 29, train_loss: 0.6708, test_loss: 0.7989, test_f1: 0.6580
 epoch: 30, train_loss: 0.6630, test_loss: 0.8230, test_f1: 0.6479
 epoch: 31, train_loss: 0.6588, test_loss: 0.8062, test_f1: 0.6319
 epoch: 32, train_loss: 0.6402, test_loss: 0.8479, test_f1: 0.6435
 epoch: 33, train_loss: 0.6475, test_loss: 0.8360, test_f1: 0.6217
 epoch: 34, train_loss: 0.6404, test_loss: 0.8178, test_f1: 0.6485
 epoch: 35, train_loss: 0.6429, test_loss: 0.8677, test_f1: 0.6371
 epoch: 36, train_loss: 0.6304, test_loss: 0.8106, test_f1: 0.6531
 epoch: 37, train_loss: 0.6475, test_loss: 0.7970, test_f1: 0.6504
 epoch: 38, train_loss: 0.6230, test_loss: 0.8219, test_f1: 0.6432
 epoch: 39, train_loss: 0.6208, test_loss: 0.8477, test_f1: 0.6258
 epoch: 40, train_loss: 0.6109, test_loss: 0.8220, test_f1: 0.6505
 epoch: 41, train_loss: 0.6007, test_loss: 0.8319, test_f1: 0.6451
 epoch: 42, train_loss: 0.6006, test_loss: 0.7745, test_f1: 0.6515
 epoch: 43, train_loss: 0.5953, test_loss: 0.8524, test_f1: 0.6502
 epoch: 44, train_loss: 0.5998, test_loss: 0.8387, test_f1: 0.6516
 epoch: 45, train_loss: 0.5888, test_loss: 0.8171, test_f1: 0.6461
 epoch: 46, train_loss: 0.5756, test_loss: 0.8394, test_f1: 0.6563
 epoch: 47, train_loss: 0.5735, test_loss: 0.8040, test_f1: 0.6865
 epoch: 48, train_loss: 0.5734, test_loss: 0.8196, test_f1: 0.6511
 epoch: 49, train_loss: 0.5719, test_loss: 0.8449, test_f1: 0.6454
 epoch: 50, train_loss: 0.5506, test_loss: 0.7897, test_f1: 0.6441
 epoch: 51, train_loss: 0.5518, test_loss: 0.8549, test_f1: 0.6404
 epoch: 52, train_loss: 0.5495, test_loss: 0.8213, test_f1: 0.6529
 epoch: 53, train_loss: 0.5332, test_loss: 0.8267, test_f1: 0.6592
 epoch: 54, train_loss: 0.5454, test_loss: 0.8241, test_f1: 0.6659
 epoch: 55, train_loss: 0.5336, test_loss: 0.8439, test_f1: 0.6553
 epoch: 56, train_loss: 0.5360, test_loss: 0.8463, test_f1: 0.6577
 epoch: 57, train_loss: 0.5174, test_loss: 0.8702, test_f1: 0.6354
 epoch: 58, train_loss: 0.5176, test_loss: 0.8310, test_f1: 0.6376
 epoch: 59, train_loss: 0.5271, test_loss: 0.8158, test_f1: 0.6506
 epoch: 60, train_loss: 0.5203, test_loss: 0.7894, test_f1: 0.6633
 epoch: 61, train_loss: 0.5223, test_loss: 0.8628, test_f1: 0.6556
 epoch: 62, train_loss: 0.5137, test_loss: 0.8225, test_f1: 0.6487
 epoch: 63, train_loss: 0.5144, test_loss: 0.7880, test_f1: 0.6696
 epoch: 64, train_loss: 0.5201, test_loss: 0.8496, test_f1: 0.6514
 epoch: 65, train_loss: 0.5181, test_loss: 0.7899, test_f1: 0.6625
 epoch: 66, train_loss: 0.5104, test_loss: 0.8056, test_f1: 0.6496
 epoch: 67, train_loss: 0.5228, test_loss: 0.8402, test_f1: 0.6689
 epoch: 68, train_loss: 0.4998, test_loss: 0.8344, test_f1: 0.6650
 epoch: 69, train_loss: 0.4896, test_loss: 0.8418, test_f1: 0.6586
 epoch: 70, train_loss: 0.4969, test_loss: 0.8988, test_f1: 0.6638
 epoch: 71, train_loss: 0.4959, test_loss: 0.8527, test_f1: 0.6541
 epoch: 72, train_loss: 0.4985, test_loss: 0.8988, test_f1: 0.6632
 epoch: 73, train_loss: 0.5010, test_loss: 0.8754, test_f1: 0.6629
 epoch: 74, train_loss: 0.4902, test_loss: 0.8634, test_f1: 0.6604
 epoch: 75, train_loss: 0.4891, test_loss: 0.8906, test_f1: 0.6551
 epoch: 76, train_loss: 0.4921, test_loss: 0.8549, test_f1: 0.6690
 epoch: 77, train_loss: 0.4897, test_loss: 0.8559, test_f1: 0.6425
 epoch: 78, train_loss: 0.4911, test_loss: 0.8465, test_f1: 0.6471
 epoch: 79, train_loss: 0.4712, test_loss: 0.8543, test_f1: 0.6553
 epoch: 80, train_loss: 0.4878, test_loss: 0.8702, test_f1: 0.6502
 epoch: 81, train_loss: 0.4765, test_loss: 0.8550, test_f1: 0.6684
 epoch: 82, train_loss: 0.4774, test_loss: 0.8548, test_f1: 0.6566
 epoch: 83, train_loss: 0.4636, test_loss: 0.8476, test_f1: 0.6518
 epoch: 84, train_loss: 0.4672, test_loss: 0.8708, test_f1: 0.6565
 epoch: 85, train_loss: 0.4598, test_loss: 0.8740, test_f1: 0.6712
 epoch: 86, train_loss: 0.4631, test_loss: 0.9835, test_f1: 0.6581
 epoch: 87, train_loss: 0.4697, test_loss: 0.9937, test_f1: 0.6534
 epoch: 88, train_loss: 0.4560, test_loss: 0.9393, test_f1: 0.6566
 epoch: 89, train_loss: 0.4625, test_loss: 0.9471, test_f1: 0.6635
 epoch: 90, train_loss: 0.4456, test_loss: 0.9541, test_f1: 0.6482
 epoch: 91, train_loss: 0.4710, test_loss: 1.0858, test_f1: 0.6713
 epoch: 92, train_loss: 0.4692, test_loss: 0.9491, test_f1: 0.6744
 epoch: 93, train_loss: 0.4613, test_loss: 0.9292, test_f1: 0.6622
 epoch: 94, train_loss: 0.4529, test_loss: 1.0108, test_f1: 0.6588
 epoch: 95, train_loss: 0.4522, test_loss: 0.9925, test_f1: 0.6566
 epoch: 96, train_loss: 0.4533, test_loss: 1.0077, test_f1: 0.6799
 epoch: 97, train_loss: 0.4531, test_loss: 0.9461, test_f1: 0.6770
 epoch: 98, train_loss: 0.4319, test_loss: 1.0050, test_f1: 0.6572
 epoch: 99, train_loss: 0.4313, test_loss: 0.9233, test_f1: 0.6494
##################ITERATION #6 ****************************************
 epoch: 0, train_loss: 1.2072, test_loss: 1.0105, test_f1: 0.5155
 epoch: 1, train_loss: 1.0685, test_loss: 0.9849, test_f1: 0.5324
 epoch: 2, train_loss: 1.0191, test_loss: 0.9575, test_f1: 0.5354
 epoch: 3, train_loss: 0.9785, test_loss: 0.9678, test_f1: 0.5078
 epoch: 4, train_loss: 0.9519, test_loss: 0.9540, test_f1: 0.5502
 epoch: 5, train_loss: 0.9411, test_loss: 0.9354, test_f1: 0.5612
 epoch: 6, train_loss: 0.9171, test_loss: 0.9237, test_f1: 0.5767
 epoch: 7, train_loss: 0.8961, test_loss: 0.9361, test_f1: 0.5638
 epoch: 8, train_loss: 0.8781, test_loss: 0.9137, test_f1: 0.5482
 epoch: 9, train_loss: 0.8675, test_loss: 0.8926, test_f1: 0.5807
 epoch: 10, train_loss: 0.8549, test_loss: 0.8901, test_f1: 0.6128
 epoch: 11, train_loss: 0.8404, test_loss: 0.8743, test_f1: 0.5839
 epoch: 12, train_loss: 0.8187, test_loss: 0.8575, test_f1: 0.6040
 epoch: 13, train_loss: 0.8112, test_loss: 0.8868, test_f1: 0.5866
 epoch: 14, train_loss: 0.8156, test_loss: 0.8843, test_f1: 0.6087
 epoch: 15, train_loss: 0.7992, test_loss: 0.8791, test_f1: 0.6127
 epoch: 16, train_loss: 0.7786, test_loss: 0.8792, test_f1: 0.5993
 epoch: 17, train_loss: 0.7796, test_loss: 0.8776, test_f1: 0.6040
 epoch: 18, train_loss: 0.7610, test_loss: 0.8462, test_f1: 0.6176
 epoch: 19, train_loss: 0.7524, test_loss: 0.8280, test_f1: 0.6220
 epoch: 20, train_loss: 0.7513, test_loss: 0.8245, test_f1: 0.6391
 epoch: 21, train_loss: 0.7352, test_loss: 0.8817, test_f1: 0.6133
 epoch: 22, train_loss: 0.7322, test_loss: 0.8650, test_f1: 0.5867
 epoch: 23, train_loss: 0.7275, test_loss: 0.8452, test_f1: 0.6070
 epoch: 24, train_loss: 0.7266, test_loss: 0.8384, test_f1: 0.6357
 epoch: 25, train_loss: 0.7148, test_loss: 0.8357, test_f1: 0.6282
 epoch: 26, train_loss: 0.7141, test_loss: 0.8423, test_f1: 0.6075
 epoch: 27, train_loss: 0.6853, test_loss: 0.8534, test_f1: 0.6045
 epoch: 28, train_loss: 0.6990, test_loss: 0.8723, test_f1: 0.6098
 epoch: 29, train_loss: 0.6741, test_loss: 0.7957, test_f1: 0.6405
 epoch: 30, train_loss: 0.6926, test_loss: 0.8202, test_f1: 0.6481
 epoch: 31, train_loss: 0.6772, test_loss: 0.8423, test_f1: 0.6337
 epoch: 32, train_loss: 0.6618, test_loss: 0.8047, test_f1: 0.6432
 epoch: 33, train_loss: 0.6656, test_loss: 0.8009, test_f1: 0.6286
 epoch: 34, train_loss: 0.6526, test_loss: 0.8200, test_f1: 0.6303
 epoch: 35, train_loss: 0.6494, test_loss: 0.8368, test_f1: 0.6593
 epoch: 36, train_loss: 0.6507, test_loss: 0.8590, test_f1: 0.6411
 epoch: 37, train_loss: 0.6416, test_loss: 0.8042, test_f1: 0.6091
 epoch: 38, train_loss: 0.6371, test_loss: 0.8559, test_f1: 0.6297
 epoch: 39, train_loss: 0.6200, test_loss: 0.8451, test_f1: 0.6409
 epoch: 40, train_loss: 0.6230, test_loss: 0.8261, test_f1: 0.6488
 epoch: 41, train_loss: 0.6180, test_loss: 0.7899, test_f1: 0.6465
 epoch: 42, train_loss: 0.6122, test_loss: 0.8507, test_f1: 0.6470
 epoch: 43, train_loss: 0.6023, test_loss: 0.9083, test_f1: 0.6125
 epoch: 44, train_loss: 0.6155, test_loss: 0.8521, test_f1: 0.6231
 epoch: 45, train_loss: 0.6029, test_loss: 0.8754, test_f1: 0.6466
 epoch: 46, train_loss: 0.5928, test_loss: 0.8514, test_f1: 0.6392
 epoch: 47, train_loss: 0.5907, test_loss: 0.8730, test_f1: 0.6717
 epoch: 48, train_loss: 0.5854, test_loss: 0.8433, test_f1: 0.6727
 epoch: 49, train_loss: 0.5859, test_loss: 0.8615, test_f1: 0.6600
 epoch: 50, train_loss: 0.5782, test_loss: 0.8471, test_f1: 0.6638
 epoch: 51, train_loss: 0.5663, test_loss: 0.8512, test_f1: 0.6477
 epoch: 52, train_loss: 0.5550, test_loss: 0.8808, test_f1: 0.6496
 epoch: 53, train_loss: 0.5643, test_loss: 0.8505, test_f1: 0.6421
 epoch: 54, train_loss: 0.5533, test_loss: 0.8751, test_f1: 0.6448
 epoch: 55, train_loss: 0.5429, test_loss: 0.8628, test_f1: 0.6550
 epoch: 56, train_loss: 0.5438, test_loss: 0.8230, test_f1: 0.6626
 epoch: 57, train_loss: 0.5638, test_loss: 0.8232, test_f1: 0.6708
 epoch: 58, train_loss: 0.5417, test_loss: 0.8422, test_f1: 0.6675
 epoch: 59, train_loss: 0.5372, test_loss: 0.8263, test_f1: 0.6757
 epoch: 60, train_loss: 0.5302, test_loss: 0.8861, test_f1: 0.6605
 epoch: 61, train_loss: 0.5311, test_loss: 0.8802, test_f1: 0.6551
 epoch: 62, train_loss: 0.5232, test_loss: 0.8610, test_f1: 0.6769
 epoch: 63, train_loss: 0.5339, test_loss: 0.8844, test_f1: 0.6454
 epoch: 64, train_loss: 0.5190, test_loss: 0.8865, test_f1: 0.6661
 epoch: 65, train_loss: 0.5212, test_loss: 0.8586, test_f1: 0.6663
 epoch: 66, train_loss: 0.5139, test_loss: 0.8448, test_f1: 0.6746
 epoch: 67, train_loss: 0.5240, test_loss: 0.9156, test_f1: 0.6684
 epoch: 68, train_loss: 0.5267, test_loss: 0.9197, test_f1: 0.6548
 epoch: 69, train_loss: 0.5134, test_loss: 0.8888, test_f1: 0.6773
 epoch: 70, train_loss: 0.5025, test_loss: 0.8546, test_f1: 0.6891
 epoch: 71, train_loss: 0.5219, test_loss: 0.9080, test_f1: 0.6568
 epoch: 72, train_loss: 0.5026, test_loss: 0.8967, test_f1: 0.6452
 epoch: 73, train_loss: 0.5040, test_loss: 0.9040, test_f1: 0.6627
 epoch: 74, train_loss: 0.5025, test_loss: 0.9211, test_f1: 0.6553
 epoch: 75, train_loss: 0.5027, test_loss: 0.9193, test_f1: 0.6554
 epoch: 76, train_loss: 0.5008, test_loss: 0.8880, test_f1: 0.6608
 epoch: 77, train_loss: 0.4833, test_loss: 0.9163, test_f1: 0.6622
 epoch: 78, train_loss: 0.5002, test_loss: 0.9264, test_f1: 0.6549
 epoch: 79, train_loss: 0.5112, test_loss: 0.8962, test_f1: 0.6592
 epoch: 80, train_loss: 0.4825, test_loss: 0.9345, test_f1: 0.6693
 epoch: 81, train_loss: 0.4767, test_loss: 0.9352, test_f1: 0.6464
 epoch: 82, train_loss: 0.4686, test_loss: 0.8793, test_f1: 0.6673
 epoch: 83, train_loss: 0.4779, test_loss: 0.9107, test_f1: 0.6477
 epoch: 84, train_loss: 0.4798, test_loss: 0.8887, test_f1: 0.6292
 epoch: 85, train_loss: 0.4806, test_loss: 0.8978, test_f1: 0.6641
 epoch: 86, train_loss: 0.4707, test_loss: 0.9259, test_f1: 0.6541
 epoch: 87, train_loss: 0.4746, test_loss: 0.9230, test_f1: 0.6519
 epoch: 88, train_loss: 0.4768, test_loss: 0.9848, test_f1: 0.6402
 epoch: 89, train_loss: 0.4671, test_loss: 0.9011, test_f1: 0.6539
 epoch: 90, train_loss: 0.4672, test_loss: 0.9379, test_f1: 0.6406
 epoch: 91, train_loss: 0.4718, test_loss: 0.9709, test_f1: 0.6389
 epoch: 92, train_loss: 0.4622, test_loss: 0.9897, test_f1: 0.6580
 epoch: 93, train_loss: 0.4737, test_loss: 0.9678, test_f1: 0.6474
 epoch: 94, train_loss: 0.4683, test_loss: 0.9821, test_f1: 0.6477
 epoch: 95, train_loss: 0.4560, test_loss: 0.9837, test_f1: 0.6475
 epoch: 96, train_loss: 0.4508, test_loss: 0.9642, test_f1: 0.6575
 epoch: 97, train_loss: 0.4504, test_loss: 0.9756, test_f1: 0.6364
 epoch: 98, train_loss: 0.4479, test_loss: 0.9111, test_f1: 0.6433
 epoch: 99, train_loss: 0.4692, test_loss: 0.9926, test_f1: 0.6490
##################ITERATION #7 ****************************************
 epoch: 0, train_loss: 1.1565, test_loss: 0.9682, test_f1: 0.4849
 epoch: 1, train_loss: 1.0361, test_loss: 0.9392, test_f1: 0.5122
 epoch: 2, train_loss: 0.9865, test_loss: 0.9447, test_f1: 0.4992
 epoch: 3, train_loss: 0.9591, test_loss: 0.9183, test_f1: 0.5518
 epoch: 4, train_loss: 0.9316, test_loss: 0.9090, test_f1: 0.5434
 epoch: 5, train_loss: 0.9127, test_loss: 0.9365, test_f1: 0.5656
 epoch: 6, train_loss: 0.9035, test_loss: 0.9031, test_f1: 0.5720
 epoch: 7, train_loss: 0.8789, test_loss: 0.9133, test_f1: 0.5557
 epoch: 8, train_loss: 0.8686, test_loss: 0.9159, test_f1: 0.5393
 epoch: 9, train_loss: 0.8652, test_loss: 0.8936, test_f1: 0.5623
 epoch: 10, train_loss: 0.8444, test_loss: 0.9353, test_f1: 0.5649
 epoch: 11, train_loss: 0.8223, test_loss: 0.9153, test_f1: 0.5591
 epoch: 12, train_loss: 0.8261, test_loss: 0.8948, test_f1: 0.5857
 epoch: 13, train_loss: 0.8093, test_loss: 0.8773, test_f1: 0.5884
 epoch: 14, train_loss: 0.8034, test_loss: 0.9072, test_f1: 0.5788
 epoch: 15, train_loss: 0.7936, test_loss: 0.8830, test_f1: 0.5803
 epoch: 16, train_loss: 0.7767, test_loss: 0.9020, test_f1: 0.5979
 epoch: 17, train_loss: 0.7623, test_loss: 0.9034, test_f1: 0.6103
 epoch: 18, train_loss: 0.7608, test_loss: 0.8670, test_f1: 0.6172
 epoch: 19, train_loss: 0.7506, test_loss: 0.9082, test_f1: 0.5923
 epoch: 20, train_loss: 0.7493, test_loss: 0.8858, test_f1: 0.6073
 epoch: 21, train_loss: 0.7403, test_loss: 0.8634, test_f1: 0.6319
 epoch: 22, train_loss: 0.7178, test_loss: 0.9024, test_f1: 0.5987
 epoch: 23, train_loss: 0.7258, test_loss: 0.8615, test_f1: 0.6428
 epoch: 24, train_loss: 0.7080, test_loss: 0.9100, test_f1: 0.6219
 epoch: 25, train_loss: 0.7052, test_loss: 0.8492, test_f1: 0.6418
 epoch: 26, train_loss: 0.7025, test_loss: 0.9027, test_f1: 0.5918
 epoch: 27, train_loss: 0.6964, test_loss: 0.8564, test_f1: 0.6228
 epoch: 28, train_loss: 0.6771, test_loss: 0.8688, test_f1: 0.6309
 epoch: 29, train_loss: 0.6702, test_loss: 0.8800, test_f1: 0.6284
 epoch: 30, train_loss: 0.6764, test_loss: 0.8852, test_f1: 0.6091
 epoch: 31, train_loss: 0.6738, test_loss: 0.8942, test_f1: 0.6351
 epoch: 32, train_loss: 0.6721, test_loss: 0.9080, test_f1: 0.6607
 epoch: 33, train_loss: 0.6478, test_loss: 0.8894, test_f1: 0.6551
 epoch: 34, train_loss: 0.6625, test_loss: 0.8357, test_f1: 0.6638
 epoch: 35, train_loss: 0.6328, test_loss: 0.8776, test_f1: 0.6689
 epoch: 36, train_loss: 0.6206, test_loss: 0.8641, test_f1: 0.6527
 epoch: 37, train_loss: 0.6315, test_loss: 0.8648, test_f1: 0.6406
 epoch: 38, train_loss: 0.6380, test_loss: 0.8986, test_f1: 0.6168
 epoch: 39, train_loss: 0.6153, test_loss: 0.8528, test_f1: 0.6568
 epoch: 40, train_loss: 0.6179, test_loss: 0.8840, test_f1: 0.6559
 epoch: 41, train_loss: 0.6241, test_loss: 0.8886, test_f1: 0.6683
 epoch: 42, train_loss: 0.6244, test_loss: 0.8927, test_f1: 0.6665
 epoch: 43, train_loss: 0.6074, test_loss: 0.8692, test_f1: 0.6442
 epoch: 44, train_loss: 0.6019, test_loss: 0.8626, test_f1: 0.6659
 epoch: 45, train_loss: 0.5920, test_loss: 0.8579, test_f1: 0.6502
 epoch: 46, train_loss: 0.5892, test_loss: 0.8663, test_f1: 0.6782
 epoch: 47, train_loss: 0.6037, test_loss: 0.9330, test_f1: 0.6844
 epoch: 48, train_loss: 0.5807, test_loss: 0.8776, test_f1: 0.6384
 epoch: 49, train_loss: 0.5909, test_loss: 0.9185, test_f1: 0.6358
 epoch: 50, train_loss: 0.5640, test_loss: 0.8875, test_f1: 0.6728
 epoch: 51, train_loss: 0.5593, test_loss: 0.9196, test_f1: 0.6581
 epoch: 52, train_loss: 0.5567, test_loss: 0.8796, test_f1: 0.6762
 epoch: 53, train_loss: 0.5501, test_loss: 0.8553, test_f1: 0.6666
 epoch: 54, train_loss: 0.5478, test_loss: 0.8782, test_f1: 0.6850
 epoch: 55, train_loss: 0.5335, test_loss: 0.8887, test_f1: 0.6597
 epoch: 56, train_loss: 0.5405, test_loss: 0.9044, test_f1: 0.6655
 epoch: 57, train_loss: 0.5460, test_loss: 0.8792, test_f1: 0.6870
 epoch: 58, train_loss: 0.5474, test_loss: 0.9088, test_f1: 0.6450
 epoch: 59, train_loss: 0.5390, test_loss: 0.8621, test_f1: 0.6509
 epoch: 60, train_loss: 0.5356, test_loss: 0.8909, test_f1: 0.6600
 epoch: 61, train_loss: 0.5318, test_loss: 0.8915, test_f1: 0.6577
 epoch: 62, train_loss: 0.5172, test_loss: 0.9073, test_f1: 0.6668
 epoch: 63, train_loss: 0.5242, test_loss: 0.9144, test_f1: 0.6656
 epoch: 64, train_loss: 0.5147, test_loss: 0.8854, test_f1: 0.6517
 epoch: 65, train_loss: 0.5131, test_loss: 0.8874, test_f1: 0.6823
 epoch: 66, train_loss: 0.5154, test_loss: 0.9045, test_f1: 0.6579
 epoch: 67, train_loss: 0.5186, test_loss: 0.8932, test_f1: 0.6605
 epoch: 68, train_loss: 0.5148, test_loss: 0.9238, test_f1: 0.6480
 epoch: 69, train_loss: 0.4974, test_loss: 0.9058, test_f1: 0.6528
 epoch: 70, train_loss: 0.5141, test_loss: 0.9084, test_f1: 0.6468
 epoch: 71, train_loss: 0.4955, test_loss: 0.9161, test_f1: 0.6867
 epoch: 72, train_loss: 0.5026, test_loss: 0.9633, test_f1: 0.6372
 epoch: 73, train_loss: 0.4942, test_loss: 0.9213, test_f1: 0.6718
 epoch: 74, train_loss: 0.5008, test_loss: 0.8979, test_f1: 0.6586
 epoch: 75, train_loss: 0.4999, test_loss: 0.9345, test_f1: 0.6671
 epoch: 76, train_loss: 0.5010, test_loss: 0.9425, test_f1: 0.6354
 epoch: 77, train_loss: 0.4977, test_loss: 0.9425, test_f1: 0.6534
 epoch: 78, train_loss: 0.4902, test_loss: 0.9417, test_f1: 0.6450
 epoch: 79, train_loss: 0.4942, test_loss: 0.9080, test_f1: 0.6648
 epoch: 80, train_loss: 0.4966, test_loss: 0.9290, test_f1: 0.6618
 epoch: 81, train_loss: 0.4945, test_loss: 0.9266, test_f1: 0.6530
 epoch: 82, train_loss: 0.4737, test_loss: 0.9376, test_f1: 0.6693
 epoch: 83, train_loss: 0.4818, test_loss: 0.9672, test_f1: 0.6544
 epoch: 84, train_loss: 0.4825, test_loss: 0.8825, test_f1: 0.6658
 epoch: 85, train_loss: 0.4786, test_loss: 0.9227, test_f1: 0.6593
 epoch: 86, train_loss: 0.4748, test_loss: 0.9531, test_f1: 0.6729
 epoch: 87, train_loss: 0.4645, test_loss: 0.9164, test_f1: 0.6690
 epoch: 88, train_loss: 0.4679, test_loss: 0.9422, test_f1: 0.6515
 epoch: 89, train_loss: 0.4666, test_loss: 0.9493, test_f1: 0.6611
 epoch: 90, train_loss: 0.4885, test_loss: 0.8908, test_f1: 0.6511
 epoch: 91, train_loss: 0.4668, test_loss: 0.9309, test_f1: 0.6591
 epoch: 92, train_loss: 0.4574, test_loss: 0.9520, test_f1: 0.6651
 epoch: 93, train_loss: 0.4620, test_loss: 0.9055, test_f1: 0.6562
 epoch: 94, train_loss: 0.4635, test_loss: 0.9636, test_f1: 0.6383
 epoch: 95, train_loss: 0.4599, test_loss: 0.9521, test_f1: 0.6571
 epoch: 96, train_loss: 0.4537, test_loss: 0.9526, test_f1: 0.6720
 epoch: 97, train_loss: 0.4602, test_loss: 1.0429, test_f1: 0.6522
 epoch: 98, train_loss: 0.4494, test_loss: 0.9788, test_f1: 0.6523
 epoch: 99, train_loss: 0.4470, test_loss: 0.9874, test_f1: 0.6497
##################ITERATION #8 ****************************************
 epoch: 0, train_loss: 1.2111, test_loss: 1.0166, test_f1: 0.4499
 epoch: 1, train_loss: 1.0694, test_loss: 0.9821, test_f1: 0.4630
 epoch: 2, train_loss: 1.0174, test_loss: 0.9647, test_f1: 0.4937
 epoch: 3, train_loss: 0.9947, test_loss: 0.9179, test_f1: 0.5227
 epoch: 4, train_loss: 0.9546, test_loss: 0.9146, test_f1: 0.5223
 epoch: 5, train_loss: 0.9463, test_loss: 0.8963, test_f1: 0.5359
 epoch: 6, train_loss: 0.9239, test_loss: 0.8934, test_f1: 0.5438
 epoch: 7, train_loss: 0.9000, test_loss: 0.8642, test_f1: 0.5617
 epoch: 8, train_loss: 0.8955, test_loss: 0.8831, test_f1: 0.5605
 epoch: 9, train_loss: 0.8760, test_loss: 0.8718, test_f1: 0.5679
 epoch: 10, train_loss: 0.8558, test_loss: 0.9017, test_f1: 0.5355
 epoch: 11, train_loss: 0.8476, test_loss: 0.8931, test_f1: 0.5610
 epoch: 12, train_loss: 0.8456, test_loss: 0.8888, test_f1: 0.5503
 epoch: 13, train_loss: 0.8226, test_loss: 0.8465, test_f1: 0.5870
 epoch: 14, train_loss: 0.8098, test_loss: 0.8556, test_f1: 0.6064
 epoch: 15, train_loss: 0.7998, test_loss: 0.8928, test_f1: 0.5749
 epoch: 16, train_loss: 0.7968, test_loss: 0.8846, test_f1: 0.5823
 epoch: 17, train_loss: 0.7903, test_loss: 0.8585, test_f1: 0.5903
 epoch: 18, train_loss: 0.7679, test_loss: 0.8357, test_f1: 0.6032
 epoch: 19, train_loss: 0.7752, test_loss: 0.8760, test_f1: 0.5906
 epoch: 20, train_loss: 0.7700, test_loss: 0.8486, test_f1: 0.6265
 epoch: 21, train_loss: 0.7568, test_loss: 0.8994, test_f1: 0.5828
 epoch: 22, train_loss: 0.7536, test_loss: 0.8055, test_f1: 0.6108
 epoch: 23, train_loss: 0.7427, test_loss: 0.8274, test_f1: 0.6078
 epoch: 24, train_loss: 0.7439, test_loss: 0.8450, test_f1: 0.6069
 epoch: 25, train_loss: 0.7322, test_loss: 0.8603, test_f1: 0.6083
 epoch: 26, train_loss: 0.7250, test_loss: 0.8376, test_f1: 0.6109
 epoch: 27, train_loss: 0.7117, test_loss: 0.8323, test_f1: 0.6229
 epoch: 28, train_loss: 0.7092, test_loss: 0.8540, test_f1: 0.6182
 epoch: 29, train_loss: 0.7027, test_loss: 0.8667, test_f1: 0.6262
 epoch: 30, train_loss: 0.6993, test_loss: 0.8421, test_f1: 0.6278
 epoch: 31, train_loss: 0.6877, test_loss: 0.8491, test_f1: 0.6305
 epoch: 32, train_loss: 0.6897, test_loss: 0.8677, test_f1: 0.6146
 epoch: 33, train_loss: 0.6714, test_loss: 0.8127, test_f1: 0.6396
 epoch: 34, train_loss: 0.6809, test_loss: 0.8122, test_f1: 0.6230
 epoch: 35, train_loss: 0.6589, test_loss: 0.8487, test_f1: 0.6196
 epoch: 36, train_loss: 0.6653, test_loss: 0.8113, test_f1: 0.6341
 epoch: 37, train_loss: 0.6676, test_loss: 0.8690, test_f1: 0.6236
 epoch: 38, train_loss: 0.6598, test_loss: 0.8628, test_f1: 0.6077
 epoch: 39, train_loss: 0.6574, test_loss: 0.8402, test_f1: 0.6325
 epoch: 40, train_loss: 0.6361, test_loss: 0.7899, test_f1: 0.6344
 epoch: 41, train_loss: 0.6352, test_loss: 0.8792, test_f1: 0.6056
 epoch: 42, train_loss: 0.6374, test_loss: 0.8027, test_f1: 0.6446
 epoch: 43, train_loss: 0.6259, test_loss: 0.8794, test_f1: 0.6096
 epoch: 44, train_loss: 0.6288, test_loss: 0.8418, test_f1: 0.6227
 epoch: 45, train_loss: 0.6098, test_loss: 0.8201, test_f1: 0.6362
 epoch: 46, train_loss: 0.5994, test_loss: 0.8018, test_f1: 0.6219
 epoch: 47, train_loss: 0.6140, test_loss: 0.9256, test_f1: 0.6046
 epoch: 48, train_loss: 0.6159, test_loss: 0.8581, test_f1: 0.6252
 epoch: 49, train_loss: 0.6047, test_loss: 0.8222, test_f1: 0.6298
 epoch: 50, train_loss: 0.6015, test_loss: 0.9653, test_f1: 0.6072
 epoch: 51, train_loss: 0.5767, test_loss: 0.7714, test_f1: 0.6375
 epoch: 52, train_loss: 0.5781, test_loss: 0.8171, test_f1: 0.6428
 epoch: 53, train_loss: 0.5699, test_loss: 0.8602, test_f1: 0.6287
 epoch: 54, train_loss: 0.5749, test_loss: 0.7957, test_f1: 0.6309
 epoch: 55, train_loss: 0.5652, test_loss: 0.7646, test_f1: 0.6474
 epoch: 56, train_loss: 0.5668, test_loss: 0.7772, test_f1: 0.6362
 epoch: 57, train_loss: 0.5586, test_loss: 0.8991, test_f1: 0.6420
 epoch: 58, train_loss: 0.5588, test_loss: 0.8767, test_f1: 0.6218
 epoch: 59, train_loss: 0.5708, test_loss: 0.8608, test_f1: 0.6246
 epoch: 60, train_loss: 0.5537, test_loss: 0.9013, test_f1: 0.6123
 epoch: 61, train_loss: 0.5581, test_loss: 0.8434, test_f1: 0.6393
 epoch: 62, train_loss: 0.5431, test_loss: 0.8293, test_f1: 0.6426
 epoch: 63, train_loss: 0.5353, test_loss: 0.8604, test_f1: 0.6371
 epoch: 64, train_loss: 0.5454, test_loss: 0.8497, test_f1: 0.6264
 epoch: 65, train_loss: 0.5473, test_loss: 0.8234, test_f1: 0.6454
 epoch: 66, train_loss: 0.5430, test_loss: 0.8848, test_f1: 0.6302
 epoch: 67, train_loss: 0.5180, test_loss: 0.9148, test_f1: 0.6287
 epoch: 68, train_loss: 0.5363, test_loss: 0.8378, test_f1: 0.6353
 epoch: 69, train_loss: 0.5346, test_loss: 0.8240, test_f1: 0.6681
 epoch: 70, train_loss: 0.5265, test_loss: 0.8150, test_f1: 0.6482
 epoch: 71, train_loss: 0.5240, test_loss: 0.8553, test_f1: 0.6449
 epoch: 72, train_loss: 0.5182, test_loss: 0.8994, test_f1: 0.6419
 epoch: 73, train_loss: 0.5117, test_loss: 0.8476, test_f1: 0.6626
 epoch: 74, train_loss: 0.5182, test_loss: 0.8772, test_f1: 0.6306
 epoch: 75, train_loss: 0.5252, test_loss: 0.9297, test_f1: 0.6312
 epoch: 76, train_loss: 0.5237, test_loss: 0.9120, test_f1: 0.6314
 epoch: 77, train_loss: 0.5134, test_loss: 0.8907, test_f1: 0.6365
 epoch: 78, train_loss: 0.5067, test_loss: 0.9657, test_f1: 0.6492
 epoch: 79, train_loss: 0.5129, test_loss: 0.9160, test_f1: 0.6394
 epoch: 80, train_loss: 0.4932, test_loss: 0.8599, test_f1: 0.6515
 epoch: 81, train_loss: 0.5114, test_loss: 0.8789, test_f1: 0.6475
 epoch: 82, train_loss: 0.5051, test_loss: 0.9509, test_f1: 0.6563
 epoch: 83, train_loss: 0.4982, test_loss: 0.9242, test_f1: 0.6522
 epoch: 84, train_loss: 0.5104, test_loss: 0.9039, test_f1: 0.6795
 epoch: 85, train_loss: 0.4889, test_loss: 0.9058, test_f1: 0.6626
 epoch: 86, train_loss: 0.4930, test_loss: 0.8491, test_f1: 0.6565
 epoch: 87, train_loss: 0.4946, test_loss: 0.9024, test_f1: 0.6396
 epoch: 88, train_loss: 0.4912, test_loss: 0.8878, test_f1: 0.6621
 epoch: 89, train_loss: 0.4959, test_loss: 0.8404, test_f1: 0.6862
 epoch: 90, train_loss: 0.4966, test_loss: 0.9305, test_f1: 0.6450
 epoch: 91, train_loss: 0.4932, test_loss: 0.9089, test_f1: 0.6511
 epoch: 92, train_loss: 0.4810, test_loss: 0.9316, test_f1: 0.6502
 epoch: 93, train_loss: 0.4870, test_loss: 0.9406, test_f1: 0.6692
 epoch: 94, train_loss: 0.4776, test_loss: 0.8911, test_f1: 0.6400
 epoch: 95, train_loss: 0.4781, test_loss: 0.9276, test_f1: 0.6542
 epoch: 96, train_loss: 0.4610, test_loss: 0.9658, test_f1: 0.6390
 epoch: 97, train_loss: 0.4870, test_loss: 1.0119, test_f1: 0.6469
 epoch: 98, train_loss: 0.4674, test_loss: 0.9102, test_f1: 0.6657
 epoch: 99, train_loss: 0.4708, test_loss: 0.9793, test_f1: 0.6295
##################ITERATION #9 ****************************************
 epoch: 0, train_loss: 1.2613, test_loss: 1.0224, test_f1: 0.5005
 epoch: 1, train_loss: 1.0824, test_loss: 0.9805, test_f1: 0.5178
 epoch: 2, train_loss: 1.0066, test_loss: 0.9336, test_f1: 0.5234
 epoch: 3, train_loss: 0.9773, test_loss: 0.9282, test_f1: 0.5515
 epoch: 4, train_loss: 0.9623, test_loss: 0.9238, test_f1: 0.5618
 epoch: 5, train_loss: 0.9455, test_loss: 0.9036, test_f1: 0.5469
 epoch: 6, train_loss: 0.9253, test_loss: 0.9009, test_f1: 0.5683
 epoch: 7, train_loss: 0.9035, test_loss: 0.9144, test_f1: 0.5640
 epoch: 8, train_loss: 0.8741, test_loss: 0.8906, test_f1: 0.5614
 epoch: 9, train_loss: 0.8749, test_loss: 0.8652, test_f1: 0.5936
 epoch: 10, train_loss: 0.8642, test_loss: 0.8449, test_f1: 0.5690
 epoch: 11, train_loss: 0.8537, test_loss: 0.8771, test_f1: 0.5751
 epoch: 12, train_loss: 0.8294, test_loss: 0.8317, test_f1: 0.5747
 epoch: 13, train_loss: 0.8235, test_loss: 0.8505, test_f1: 0.6226
 epoch: 14, train_loss: 0.8209, test_loss: 0.8660, test_f1: 0.6174
 epoch: 15, train_loss: 0.7959, test_loss: 0.8405, test_f1: 0.6052
 epoch: 16, train_loss: 0.7964, test_loss: 0.8426, test_f1: 0.6086
 epoch: 17, train_loss: 0.7986, test_loss: 0.8166, test_f1: 0.6067
 epoch: 18, train_loss: 0.7901, test_loss: 0.7806, test_f1: 0.6371
 epoch: 19, train_loss: 0.7635, test_loss: 0.8091, test_f1: 0.6254
 epoch: 20, train_loss: 0.7694, test_loss: 0.8007, test_f1: 0.6248
 epoch: 21, train_loss: 0.7605, test_loss: 0.8196, test_f1: 0.6382
 epoch: 22, train_loss: 0.7440, test_loss: 0.8353, test_f1: 0.5988
 epoch: 23, train_loss: 0.7415, test_loss: 0.7911, test_f1: 0.6530
 epoch: 24, train_loss: 0.7339, test_loss: 0.8157, test_f1: 0.6417
 epoch: 25, train_loss: 0.7335, test_loss: 0.8037, test_f1: 0.6309
 epoch: 26, train_loss: 0.7326, test_loss: 0.8012, test_f1: 0.6436
 epoch: 27, train_loss: 0.7303, test_loss: 0.8043, test_f1: 0.6320
 epoch: 28, train_loss: 0.7147, test_loss: 0.7985, test_f1: 0.6285
 epoch: 29, train_loss: 0.7139, test_loss: 0.8127, test_f1: 0.6454
 epoch: 30, train_loss: 0.7050, test_loss: 0.7763, test_f1: 0.6677
 epoch: 31, train_loss: 0.6917, test_loss: 0.8062, test_f1: 0.6407
 epoch: 32, train_loss: 0.6838, test_loss: 0.7981, test_f1: 0.6519
 epoch: 33, train_loss: 0.6956, test_loss: 0.8260, test_f1: 0.6472
 epoch: 34, train_loss: 0.6819, test_loss: 0.8068, test_f1: 0.6593
 epoch: 35, train_loss: 0.6648, test_loss: 0.8101, test_f1: 0.6525
 epoch: 36, train_loss: 0.6721, test_loss: 0.8042, test_f1: 0.6548
 epoch: 37, train_loss: 0.6664, test_loss: 0.8609, test_f1: 0.6376
 epoch: 38, train_loss: 0.6620, test_loss: 0.8416, test_f1: 0.6406
 epoch: 39, train_loss: 0.6530, test_loss: 0.8287, test_f1: 0.6548
 epoch: 40, train_loss: 0.6427, test_loss: 0.8319, test_f1: 0.6738
 epoch: 41, train_loss: 0.6398, test_loss: 0.8061, test_f1: 0.6572
 epoch: 42, train_loss: 0.6438, test_loss: 0.7919, test_f1: 0.6723
 epoch: 43, train_loss: 0.6389, test_loss: 0.8083, test_f1: 0.6675
 epoch: 44, train_loss: 0.6307, test_loss: 0.8019, test_f1: 0.6601
 epoch: 45, train_loss: 0.6185, test_loss: 0.8211, test_f1: 0.6584
 epoch: 46, train_loss: 0.6148, test_loss: 0.7978, test_f1: 0.6485
 epoch: 47, train_loss: 0.6167, test_loss: 0.8196, test_f1: 0.6584
 epoch: 48, train_loss: 0.6092, test_loss: 0.8558, test_f1: 0.6587
 epoch: 49, train_loss: 0.6130, test_loss: 0.8223, test_f1: 0.6672
 epoch: 50, train_loss: 0.5933, test_loss: 0.8508, test_f1: 0.6626
 epoch: 51, train_loss: 0.5755, test_loss: 0.8059, test_f1: 0.6820
 epoch: 52, train_loss: 0.5806, test_loss: 0.7833, test_f1: 0.6809
 epoch: 53, train_loss: 0.5624, test_loss: 0.8202, test_f1: 0.6639
 epoch: 54, train_loss: 0.5670, test_loss: 0.8275, test_f1: 0.6584
 epoch: 55, train_loss: 0.5736, test_loss: 0.8364, test_f1: 0.6713
 epoch: 56, train_loss: 0.5601, test_loss: 0.8412, test_f1: 0.6762
 epoch: 57, train_loss: 0.5571, test_loss: 0.8183, test_f1: 0.6642
 epoch: 58, train_loss: 0.5663, test_loss: 0.7983, test_f1: 0.6611
 epoch: 59, train_loss: 0.5661, test_loss: 0.8029, test_f1: 0.6757
 epoch: 60, train_loss: 0.5682, test_loss: 0.8290, test_f1: 0.6463
 epoch: 61, train_loss: 0.5525, test_loss: 0.8209, test_f1: 0.6672
 epoch: 62, train_loss: 0.5443, test_loss: 0.8243, test_f1: 0.6576
 epoch: 63, train_loss: 0.5368, test_loss: 0.8249, test_f1: 0.6783
 epoch: 64, train_loss: 0.5491, test_loss: 0.8096, test_f1: 0.6738
 epoch: 65, train_loss: 0.5514, test_loss: 0.8509, test_f1: 0.6515
 epoch: 66, train_loss: 0.5404, test_loss: 0.8075, test_f1: 0.6738
 epoch: 67, train_loss: 0.5362, test_loss: 0.8505, test_f1: 0.6598
 epoch: 68, train_loss: 0.5480, test_loss: 0.8481, test_f1: 0.6625
 epoch: 69, train_loss: 0.5340, test_loss: 0.7892, test_f1: 0.6607
 epoch: 70, train_loss: 0.5258, test_loss: 0.7981, test_f1: 0.6574
 epoch: 71, train_loss: 0.5372, test_loss: 0.8306, test_f1: 0.6547
 epoch: 72, train_loss: 0.5170, test_loss: 0.8220, test_f1: 0.6583
 epoch: 73, train_loss: 0.5311, test_loss: 0.8235, test_f1: 0.6522
 epoch: 74, train_loss: 0.5292, test_loss: 0.8053, test_f1: 0.6789
 epoch: 75, train_loss: 0.5250, test_loss: 0.8178, test_f1: 0.6752
 epoch: 76, train_loss: 0.5327, test_loss: 0.8190, test_f1: 0.6737
 epoch: 77, train_loss: 0.5185, test_loss: 0.8624, test_f1: 0.6512
 epoch: 78, train_loss: 0.5149, test_loss: 0.8170, test_f1: 0.6768
 epoch: 79, train_loss: 0.5200, test_loss: 0.8543, test_f1: 0.6627
 epoch: 80, train_loss: 0.5168, test_loss: 0.8016, test_f1: 0.6684
 epoch: 81, train_loss: 0.5096, test_loss: 0.7788, test_f1: 0.6629
 epoch: 82, train_loss: 0.4964, test_loss: 0.8026, test_f1: 0.6738
 epoch: 83, train_loss: 0.4940, test_loss: 0.8331, test_f1: 0.6589
 epoch: 84, train_loss: 0.5012, test_loss: 0.8554, test_f1: 0.6515
 epoch: 85, train_loss: 0.4956, test_loss: 0.8493, test_f1: 0.6679
 epoch: 86, train_loss: 0.5114, test_loss: 0.8103, test_f1: 0.6762
 epoch: 87, train_loss: 0.5097, test_loss: 0.8616, test_f1: 0.6554
 epoch: 88, train_loss: 0.4927, test_loss: 0.9221, test_f1: 0.6267
 epoch: 89, train_loss: 0.4972, test_loss: 0.8712, test_f1: 0.6448
 epoch: 90, train_loss: 0.4857, test_loss: 0.8489, test_f1: 0.6608
 epoch: 91, train_loss: 0.4881, test_loss: 0.8430, test_f1: 0.6751
 epoch: 92, train_loss: 0.4898, test_loss: 0.8209, test_f1: 0.6692
 epoch: 93, train_loss: 0.4933, test_loss: 0.8389, test_f1: 0.6523
 epoch: 94, train_loss: 0.4934, test_loss: 0.8774, test_f1: 0.6503
 epoch: 95, train_loss: 0.4852, test_loss: 0.8503, test_f1: 0.6745
 epoch: 96, train_loss: 0.4702, test_loss: 0.8544, test_f1: 0.6595
 epoch: 97, train_loss: 0.4724, test_loss: 0.8286, test_f1: 0.6757
 epoch: 98, train_loss: 0.4819, test_loss: 0.8045, test_f1: 0.6698
 epoch: 99, train_loss: 0.4733, test_loss: 0.8639, test_f1: 0.6680

Training completed in 822.95 seconds
Best F1: 0.6931 at epoch 85
Mean F1 across iterations: 0.6764  0.0157
========================FINAL RESULTS================================
FEGIN weighted F1: 0.6931  0.0157
python main.py --data ltspice_examples --representation component_pin --model FEGIN --layers 2 --hiddens 128 --batch_size 32 --lr 0.0001 --emb_size 250 --epochs 100 --save_appendix component_pin_L2_H128_BS32_LR0.0001_E250 --no_val
-----



STDERR:
  File "main.py", line 370, in <module>
    main()
  File "main.py", line 254, in main
    dataset = dataset_class(
  File "/home/philip/projects/ltspice_examples_code_repo/Circuit-Completion-Using-GNNs/component_classification_with_link_prediction_head/evaluation/FEGIN/kernel/circuit_datasets.py", line 15, in __init__
    self.data, self.slices = torch.load(self.processed_paths[0])
  File "/home/philip/.local/lib/python3.8/site-packages/torch/serialization.py", line 1040, in load
    warnings.warn(
  File "/usr/lib/python3.8/warnings.py", line 109, in _showwarnmsg
    sw(msg.message, msg.category, msg.filename, msg.lineno,
  File "main.py", line 47, in warn_with_traceback
    traceback.print_stack(file=log)
/home/philip/projects/ltspice_examples_code_repo/Circuit-Completion-Using-GNNs/component_classification_with_link_prediction_head/evaluation/FEGIN/kernel/circuit_datasets.py:15: FutureWarning: You are using `torch.load` with `weights_only=False` (the current default value), which uses the default pickle module implicitly. It is possible to construct malicious pickle data which will execute arbitrary code during unpickling (See https://github.com/pytorch/pytorch/blob/main/SECURITY.md#untrusted-models for more details). In a future release, the default value for `weights_only` will be flipped to `True`. This limits the functions that could be executed during unpickling. Arbitrary objects will no longer be allowed to be loaded via this mode unless they are explicitly allowlisted by the user via `torch.serialization.add_safe_globals`. We recommend you start setting `weights_only=True` for any use case where you don't have full control of the loaded file. Please open an issue on GitHub for any issues related to this experimental feature.
  self.data, self.slices = torch.load(self.processed_paths[0])
