STDOUT:
Results will be saved in /home/philip/projects/ltspice_examples_code_repo/Circuit-Completion-Using-GNNs/component_classification_with_link_prediction_head/evaluation/FEGIN/results/model_FEGIN_dataset_ltspice_examples
Command line input: python main.py --data ltspice_examples --representation component_pin_net --model FEGIN --layers 5 --hiddens 32 --batch_size 128 --lr 0.0001 --emb_size 512 --epochs 100 --save_appendix component_pin_net_L5_H32_BS128_LR0.0001_E512 --no_val
 is saved.
-----
ltspice_examples - FEGIN
Using 5 layers, 32 hidden units, h = 2
Loading component_pin_net representation dataset
ENTERED
Training FEGIN on component_pin_net representation
Train: 3558, Test: 846
##################ITERATION #0 ****************************************
 epoch: 0, train_loss: 1.3972, test_loss: 1.3959, test_f1: 0.1004
 epoch: 1, train_loss: 1.3879, test_loss: 1.3915, test_f1: 0.1004
 epoch: 2, train_loss: 1.3809, test_loss: 1.3796, test_f1: 0.1004
 epoch: 3, train_loss: 1.3713, test_loss: 1.3673, test_f1: 0.1296
 epoch: 4, train_loss: 1.3599, test_loss: 1.3544, test_f1: 0.1799
 epoch: 5, train_loss: 1.3460, test_loss: 1.3390, test_f1: 0.2630
 epoch: 6, train_loss: 1.3293, test_loss: 1.3212, test_f1: 0.3043
 epoch: 7, train_loss: 1.3107, test_loss: 1.3024, test_f1: 0.2690
 epoch: 8, train_loss: 1.2914, test_loss: 1.2803, test_f1: 0.2409
 epoch: 9, train_loss: 1.2736, test_loss: 1.2630, test_f1: 0.2357
 epoch: 10, train_loss: 1.2584, test_loss: 1.2461, test_f1: 0.2308
 epoch: 11, train_loss: 1.2499, test_loss: 1.2337, test_f1: 0.2299
 epoch: 12, train_loss: 1.2356, test_loss: 1.2220, test_f1: 0.2295
 epoch: 13, train_loss: 1.2278, test_loss: 1.2129, test_f1: 0.2270
 epoch: 14, train_loss: 1.2154, test_loss: 1.2037, test_f1: 0.2270
 epoch: 15, train_loss: 1.2101, test_loss: 1.1942, test_f1: 0.2270
 epoch: 16, train_loss: 1.2068, test_loss: 1.1878, test_f1: 0.2368
 epoch: 17, train_loss: 1.1955, test_loss: 1.1816, test_f1: 0.2966
 epoch: 18, train_loss: 1.1907, test_loss: 1.1734, test_f1: 0.3168
 epoch: 19, train_loss: 1.1863, test_loss: 1.1693, test_f1: 0.3401
 epoch: 20, train_loss: 1.1810, test_loss: 1.1605, test_f1: 0.3354
 epoch: 21, train_loss: 1.1676, test_loss: 1.1530, test_f1: 0.3393
 epoch: 22, train_loss: 1.1680, test_loss: 1.1469, test_f1: 0.3403
 epoch: 23, train_loss: 1.1603, test_loss: 1.1401, test_f1: 0.3405
 epoch: 24, train_loss: 1.1500, test_loss: 1.1308, test_f1: 0.3511
 epoch: 25, train_loss: 1.1424, test_loss: 1.1248, test_f1: 0.3689
 epoch: 26, train_loss: 1.1368, test_loss: 1.1151, test_f1: 0.3778
 epoch: 27, train_loss: 1.1284, test_loss: 1.1104, test_f1: 0.3735
 epoch: 28, train_loss: 1.1170, test_loss: 1.0982, test_f1: 0.3996
 epoch: 29, train_loss: 1.1057, test_loss: 1.0942, test_f1: 0.4091
 epoch: 30, train_loss: 1.1005, test_loss: 1.0842, test_f1: 0.4116
 epoch: 31, train_loss: 1.0959, test_loss: 1.0785, test_f1: 0.4128
 epoch: 32, train_loss: 1.0874, test_loss: 1.0714, test_f1: 0.4057
 epoch: 33, train_loss: 1.0762, test_loss: 1.0653, test_f1: 0.3956
 epoch: 34, train_loss: 1.0791, test_loss: 1.0607, test_f1: 0.3989
 epoch: 35, train_loss: 1.0628, test_loss: 1.0552, test_f1: 0.3987
 epoch: 36, train_loss: 1.0558, test_loss: 1.0499, test_f1: 0.3979
 epoch: 37, train_loss: 1.0479, test_loss: 1.0510, test_f1: 0.4205
 epoch: 38, train_loss: 1.0465, test_loss: 1.0462, test_f1: 0.4278
 epoch: 39, train_loss: 1.0406, test_loss: 1.0426, test_f1: 0.4462
 epoch: 40, train_loss: 1.0334, test_loss: 1.0366, test_f1: 0.4466
 epoch: 41, train_loss: 1.0314, test_loss: 1.0333, test_f1: 0.4565
 epoch: 42, train_loss: 1.0221, test_loss: 1.0286, test_f1: 0.4543
 epoch: 43, train_loss: 1.0146, test_loss: 1.0230, test_f1: 0.4646
 epoch: 44, train_loss: 1.0124, test_loss: 1.0217, test_f1: 0.4532
 epoch: 45, train_loss: 1.0124, test_loss: 1.0212, test_f1: 0.4689
 epoch: 46, train_loss: 1.0058, test_loss: 1.0129, test_f1: 0.4922
 epoch: 47, train_loss: 0.9951, test_loss: 1.0132, test_f1: 0.4770
 epoch: 48, train_loss: 0.9876, test_loss: 1.0126, test_f1: 0.4954
 epoch: 49, train_loss: 0.9887, test_loss: 1.0322, test_f1: 0.4891
 epoch: 50, train_loss: 0.9833, test_loss: 1.0070, test_f1: 0.5028
 epoch: 51, train_loss: 0.9813, test_loss: 1.0053, test_f1: 0.5140
 epoch: 52, train_loss: 0.9786, test_loss: 1.0176, test_f1: 0.5071
 epoch: 53, train_loss: 0.9710, test_loss: 0.9995, test_f1: 0.5206
 epoch: 54, train_loss: 0.9724, test_loss: 0.9993, test_f1: 0.5142
 epoch: 55, train_loss: 0.9724, test_loss: 1.0038, test_f1: 0.5226
 epoch: 56, train_loss: 0.9669, test_loss: 0.9990, test_f1: 0.5328
 epoch: 57, train_loss: 0.9656, test_loss: 0.9966, test_f1: 0.5326
 epoch: 58, train_loss: 0.9639, test_loss: 0.9951, test_f1: 0.5258
 epoch: 59, train_loss: 0.9592, test_loss: 1.0002, test_f1: 0.5353
 epoch: 60, train_loss: 0.9559, test_loss: 0.9952, test_f1: 0.5309
 epoch: 61, train_loss: 0.9688, test_loss: 0.9983, test_f1: 0.5296
 epoch: 62, train_loss: 0.9542, test_loss: 0.9939, test_f1: 0.5330
 epoch: 63, train_loss: 0.9676, test_loss: 0.9939, test_f1: 0.5386
 epoch: 64, train_loss: 0.9535, test_loss: 0.9890, test_f1: 0.5393
 epoch: 65, train_loss: 0.9535, test_loss: 0.9893, test_f1: 0.5354
 epoch: 66, train_loss: 0.9535, test_loss: 0.9891, test_f1: 0.5383
 epoch: 67, train_loss: 0.9472, test_loss: 0.9889, test_f1: 0.5417
 epoch: 68, train_loss: 0.9448, test_loss: 0.9921, test_f1: 0.5459
 epoch: 69, train_loss: 0.9482, test_loss: 0.9866, test_f1: 0.5473
 epoch: 70, train_loss: 0.9480, test_loss: 0.9879, test_f1: 0.5444
 epoch: 71, train_loss: 0.9409, test_loss: 0.9847, test_f1: 0.5402
 epoch: 72, train_loss: 0.9472, test_loss: 0.9812, test_f1: 0.5300
 epoch: 73, train_loss: 0.9401, test_loss: 0.9845, test_f1: 0.5399
 epoch: 74, train_loss: 0.9392, test_loss: 0.9833, test_f1: 0.5348
 epoch: 75, train_loss: 0.9438, test_loss: 0.9841, test_f1: 0.5383
 epoch: 76, train_loss: 0.9444, test_loss: 0.9762, test_f1: 0.5346
 epoch: 77, train_loss: 0.9350, test_loss: 0.9806, test_f1: 0.5336
 epoch: 78, train_loss: 0.9374, test_loss: 0.9766, test_f1: 0.5316
 epoch: 79, train_loss: 0.9299, test_loss: 0.9817, test_f1: 0.5352
 epoch: 80, train_loss: 0.9301, test_loss: 0.9749, test_f1: 0.5389
 epoch: 81, train_loss: 0.9259, test_loss: 0.9726, test_f1: 0.5427
 epoch: 82, train_loss: 0.9258, test_loss: 0.9731, test_f1: 0.5333
 epoch: 83, train_loss: 0.9275, test_loss: 0.9751, test_f1: 0.5354
 epoch: 84, train_loss: 0.9312, test_loss: 0.9691, test_f1: 0.5341
 epoch: 85, train_loss: 0.9321, test_loss: 0.9728, test_f1: 0.5400
 epoch: 86, train_loss: 0.9298, test_loss: 0.9672, test_f1: 0.5379
 epoch: 87, train_loss: 0.9225, test_loss: 0.9718, test_f1: 0.5398
 epoch: 88, train_loss: 0.9185, test_loss: 0.9681, test_f1: 0.5445
 epoch: 89, train_loss: 0.9267, test_loss: 0.9643, test_f1: 0.5418
 epoch: 90, train_loss: 0.9177, test_loss: 0.9660, test_f1: 0.5418
 epoch: 91, train_loss: 0.9267, test_loss: 0.9683, test_f1: 0.5350
 epoch: 92, train_loss: 0.9152, test_loss: 0.9617, test_f1: 0.5389
 epoch: 93, train_loss: 0.9135, test_loss: 0.9603, test_f1: 0.5443
 epoch: 94, train_loss: 0.9102, test_loss: 0.9648, test_f1: 0.5393
 epoch: 95, train_loss: 0.9176, test_loss: 0.9674, test_f1: 0.5336
 epoch: 96, train_loss: 0.9198, test_loss: 0.9620, test_f1: 0.5370
 epoch: 97, train_loss: 0.9226, test_loss: 0.9630, test_f1: 0.5292
 epoch: 98, train_loss: 0.9161, test_loss: 0.9675, test_f1: 0.5448
 epoch: 99, train_loss: 0.9064, test_loss: 0.9593, test_f1: 0.5408
##################ITERATION #1 ****************************************
 epoch: 0, train_loss: 1.3663, test_loss: 1.3741, test_f1: 0.1004
 epoch: 1, train_loss: 1.3411, test_loss: 1.3630, test_f1: 0.1053
 epoch: 2, train_loss: 1.3238, test_loss: 1.3204, test_f1: 0.3276
 epoch: 3, train_loss: 1.3055, test_loss: 1.2953, test_f1: 0.4076
 epoch: 4, train_loss: 1.2858, test_loss: 1.2724, test_f1: 0.3915
 epoch: 5, train_loss: 1.2668, test_loss: 1.2512, test_f1: 0.3465
 epoch: 6, train_loss: 1.2447, test_loss: 1.2306, test_f1: 0.3451
 epoch: 7, train_loss: 1.2248, test_loss: 1.2076, test_f1: 0.3451
 epoch: 8, train_loss: 1.2064, test_loss: 1.1869, test_f1: 0.3460
 epoch: 9, train_loss: 1.1910, test_loss: 1.1705, test_f1: 0.3460
 epoch: 10, train_loss: 1.1735, test_loss: 1.1536, test_f1: 0.3460
 epoch: 11, train_loss: 1.1607, test_loss: 1.1410, test_f1: 0.3431
 epoch: 12, train_loss: 1.1464, test_loss: 1.1255, test_f1: 0.3441
 epoch: 13, train_loss: 1.1357, test_loss: 1.1135, test_f1: 0.3441
 epoch: 14, train_loss: 1.1259, test_loss: 1.1056, test_f1: 0.3371
 epoch: 15, train_loss: 1.1136, test_loss: 1.0948, test_f1: 0.3421
 epoch: 16, train_loss: 1.1038, test_loss: 1.0859, test_f1: 0.3421
 epoch: 17, train_loss: 1.0894, test_loss: 1.0785, test_f1: 0.3411
 epoch: 18, train_loss: 1.0815, test_loss: 1.0729, test_f1: 0.3348
 epoch: 19, train_loss: 1.0767, test_loss: 1.0671, test_f1: 0.3392
 epoch: 20, train_loss: 1.0752, test_loss: 1.0622, test_f1: 0.3388
 epoch: 21, train_loss: 1.0642, test_loss: 1.0580, test_f1: 0.3411
 epoch: 22, train_loss: 1.0595, test_loss: 1.0584, test_f1: 0.3328
 epoch: 23, train_loss: 1.0478, test_loss: 1.0514, test_f1: 0.3532
 epoch: 24, train_loss: 1.0409, test_loss: 1.0488, test_f1: 0.3541
 epoch: 25, train_loss: 1.0394, test_loss: 1.0510, test_f1: 0.3669
 epoch: 26, train_loss: 1.0368, test_loss: 1.0491, test_f1: 0.3943
 epoch: 27, train_loss: 1.0326, test_loss: 1.0408, test_f1: 0.4078
 epoch: 28, train_loss: 1.0294, test_loss: 1.0424, test_f1: 0.4190
 epoch: 29, train_loss: 1.0203, test_loss: 1.0412, test_f1: 0.4253
 epoch: 30, train_loss: 1.0215, test_loss: 1.0355, test_f1: 0.4352
 epoch: 31, train_loss: 1.0156, test_loss: 1.0361, test_f1: 0.4187
 epoch: 32, train_loss: 1.0107, test_loss: 1.0455, test_f1: 0.4307
 epoch: 33, train_loss: 1.0070, test_loss: 1.0299, test_f1: 0.4390
 epoch: 34, train_loss: 1.0054, test_loss: 1.0281, test_f1: 0.4402
 epoch: 35, train_loss: 0.9945, test_loss: 1.0180, test_f1: 0.4637
 epoch: 36, train_loss: 0.9965, test_loss: 1.0255, test_f1: 0.4529
 epoch: 37, train_loss: 0.9902, test_loss: 1.0165, test_f1: 0.4664
 epoch: 38, train_loss: 0.9918, test_loss: 1.0228, test_f1: 0.4532
 epoch: 39, train_loss: 0.9813, test_loss: 1.0255, test_f1: 0.4505
 epoch: 40, train_loss: 0.9774, test_loss: 1.0087, test_f1: 0.4653
 epoch: 41, train_loss: 0.9722, test_loss: 1.0037, test_f1: 0.4764
 epoch: 42, train_loss: 0.9725, test_loss: 1.0126, test_f1: 0.4790
 epoch: 43, train_loss: 0.9676, test_loss: 0.9986, test_f1: 0.4785
 epoch: 44, train_loss: 0.9656, test_loss: 0.9891, test_f1: 0.4908
 epoch: 45, train_loss: 0.9621, test_loss: 0.9944, test_f1: 0.4923
 epoch: 46, train_loss: 0.9548, test_loss: 0.9845, test_f1: 0.4867
 epoch: 47, train_loss: 0.9527, test_loss: 0.9836, test_f1: 0.5042
 epoch: 48, train_loss: 0.9494, test_loss: 0.9751, test_f1: 0.4882
 epoch: 49, train_loss: 0.9432, test_loss: 0.9940, test_f1: 0.5028
 epoch: 50, train_loss: 0.9324, test_loss: 0.9578, test_f1: 0.4972
 epoch: 51, train_loss: 0.9461, test_loss: 0.9734, test_f1: 0.5062
 epoch: 52, train_loss: 0.9353, test_loss: 0.9740, test_f1: 0.5062
 epoch: 53, train_loss: 0.9335, test_loss: 0.9719, test_f1: 0.5037
 epoch: 54, train_loss: 0.9328, test_loss: 0.9656, test_f1: 0.5016
 epoch: 55, train_loss: 0.9240, test_loss: 0.9574, test_f1: 0.5044
 epoch: 56, train_loss: 0.9290, test_loss: 0.9546, test_f1: 0.5113
 epoch: 57, train_loss: 0.9274, test_loss: 0.9565, test_f1: 0.5146
 epoch: 58, train_loss: 0.9267, test_loss: 0.9532, test_f1: 0.5107
 epoch: 59, train_loss: 0.9235, test_loss: 0.9459, test_f1: 0.5144
 epoch: 60, train_loss: 0.9212, test_loss: 0.9512, test_f1: 0.5115
 epoch: 61, train_loss: 0.9178, test_loss: 0.9501, test_f1: 0.5105
 epoch: 62, train_loss: 0.9146, test_loss: 0.9524, test_f1: 0.5090
 epoch: 63, train_loss: 0.9235, test_loss: 0.9464, test_f1: 0.5118
 epoch: 64, train_loss: 0.9191, test_loss: 0.9463, test_f1: 0.5095
 epoch: 65, train_loss: 0.9156, test_loss: 0.9463, test_f1: 0.5224
 epoch: 66, train_loss: 0.9156, test_loss: 0.9459, test_f1: 0.5174
 epoch: 67, train_loss: 0.9102, test_loss: 0.9422, test_f1: 0.5073
 epoch: 68, train_loss: 0.9076, test_loss: 0.9413, test_f1: 0.5137
 epoch: 69, train_loss: 0.9161, test_loss: 0.9358, test_f1: 0.5164
 epoch: 70, train_loss: 0.9087, test_loss: 0.9387, test_f1: 0.5078
 epoch: 71, train_loss: 0.9067, test_loss: 0.9456, test_f1: 0.5126
 epoch: 72, train_loss: 0.9074, test_loss: 0.9406, test_f1: 0.5170
 epoch: 73, train_loss: 0.9033, test_loss: 0.9270, test_f1: 0.5193
 epoch: 74, train_loss: 0.9030, test_loss: 0.9348, test_f1: 0.5210
 epoch: 75, train_loss: 0.8984, test_loss: 0.9307, test_f1: 0.5160
 epoch: 76, train_loss: 0.8999, test_loss: 0.9295, test_f1: 0.5292
 epoch: 77, train_loss: 0.9012, test_loss: 0.9436, test_f1: 0.5076
 epoch: 78, train_loss: 0.9001, test_loss: 0.9363, test_f1: 0.5140
 epoch: 79, train_loss: 0.8933, test_loss: 0.9355, test_f1: 0.5237
 epoch: 80, train_loss: 0.9053, test_loss: 0.9399, test_f1: 0.5243
 epoch: 81, train_loss: 0.8898, test_loss: 0.9360, test_f1: 0.5159
 epoch: 82, train_loss: 0.8931, test_loss: 0.9256, test_f1: 0.5225
 epoch: 83, train_loss: 0.8942, test_loss: 0.9297, test_f1: 0.5301
 epoch: 84, train_loss: 0.8921, test_loss: 0.9299, test_f1: 0.5236
 epoch: 85, train_loss: 0.8889, test_loss: 0.9274, test_f1: 0.5191
 epoch: 86, train_loss: 0.8867, test_loss: 0.9301, test_f1: 0.5290
 epoch: 87, train_loss: 0.8909, test_loss: 0.9340, test_f1: 0.5304
 epoch: 88, train_loss: 0.8908, test_loss: 0.9221, test_f1: 0.5207
 epoch: 89, train_loss: 0.8865, test_loss: 0.9227, test_f1: 0.5285
 epoch: 90, train_loss: 0.8850, test_loss: 0.9327, test_f1: 0.5203
 epoch: 91, train_loss: 0.8792, test_loss: 0.9245, test_f1: 0.5266
 epoch: 92, train_loss: 0.8910, test_loss: 0.9199, test_f1: 0.5305
 epoch: 93, train_loss: 0.8882, test_loss: 0.9320, test_f1: 0.5274
 epoch: 94, train_loss: 0.8807, test_loss: 0.9170, test_f1: 0.5391
 epoch: 95, train_loss: 0.8828, test_loss: 0.9256, test_f1: 0.5270
 epoch: 96, train_loss: 0.8752, test_loss: 0.9284, test_f1: 0.5211
 epoch: 97, train_loss: 0.8812, test_loss: 0.9210, test_f1: 0.5291
 epoch: 98, train_loss: 0.8878, test_loss: 0.9144, test_f1: 0.5282
 epoch: 99, train_loss: 0.8804, test_loss: 0.9293, test_f1: 0.5233
##################ITERATION #2 ****************************************
 epoch: 0, train_loss: 1.3172, test_loss: 1.3388, test_f1: 0.1125
 epoch: 1, train_loss: 1.2847, test_loss: 1.3088, test_f1: 0.2539
 epoch: 2, train_loss: 1.2640, test_loss: 1.2653, test_f1: 0.3049
 epoch: 3, train_loss: 1.2429, test_loss: 1.2340, test_f1: 0.3575
 epoch: 4, train_loss: 1.2225, test_loss: 1.2075, test_f1: 0.3513
 epoch: 5, train_loss: 1.2004, test_loss: 1.1857, test_f1: 0.3389
 epoch: 6, train_loss: 1.1787, test_loss: 1.1674, test_f1: 0.3288
 epoch: 7, train_loss: 1.1631, test_loss: 1.1495, test_f1: 0.3282
 epoch: 8, train_loss: 1.1459, test_loss: 1.1351, test_f1: 0.3236
 epoch: 9, train_loss: 1.1331, test_loss: 1.1239, test_f1: 0.3231
 epoch: 10, train_loss: 1.1166, test_loss: 1.1121, test_f1: 0.3316
 epoch: 11, train_loss: 1.1089, test_loss: 1.1035, test_f1: 0.3348
 epoch: 12, train_loss: 1.0917, test_loss: 1.0982, test_f1: 0.3299
 epoch: 13, train_loss: 1.0835, test_loss: 1.0880, test_f1: 0.3545
 epoch: 14, train_loss: 1.0743, test_loss: 1.0817, test_f1: 0.3777
 epoch: 15, train_loss: 1.0623, test_loss: 1.0740, test_f1: 0.3996
 epoch: 16, train_loss: 1.0500, test_loss: 1.0760, test_f1: 0.3957
 epoch: 17, train_loss: 1.0473, test_loss: 1.0608, test_f1: 0.4368
 epoch: 18, train_loss: 1.0368, test_loss: 1.0585, test_f1: 0.4299
 epoch: 19, train_loss: 1.0255, test_loss: 1.0504, test_f1: 0.4390
 epoch: 20, train_loss: 1.0206, test_loss: 1.0599, test_f1: 0.4485
 epoch: 21, train_loss: 1.0182, test_loss: 1.0596, test_f1: 0.4207
 epoch: 22, train_loss: 1.0150, test_loss: 1.0535, test_f1: 0.4347
 epoch: 23, train_loss: 1.0092, test_loss: 1.0422, test_f1: 0.4489
 epoch: 24, train_loss: 1.0009, test_loss: 1.0359, test_f1: 0.4512
 epoch: 25, train_loss: 0.9930, test_loss: 1.0453, test_f1: 0.4521
 epoch: 26, train_loss: 0.9852, test_loss: 1.0284, test_f1: 0.4488
 epoch: 27, train_loss: 0.9850, test_loss: 1.0201, test_f1: 0.4590
 epoch: 28, train_loss: 0.9779, test_loss: 1.0214, test_f1: 0.4590
 epoch: 29, train_loss: 0.9686, test_loss: 1.0170, test_f1: 0.4641
 epoch: 30, train_loss: 0.9671, test_loss: 1.0380, test_f1: 0.4507
 epoch: 31, train_loss: 0.9629, test_loss: 1.0166, test_f1: 0.4794
 epoch: 32, train_loss: 0.9634, test_loss: 1.0270, test_f1: 0.4874
 epoch: 33, train_loss: 0.9569, test_loss: 1.0109, test_f1: 0.4696
 epoch: 34, train_loss: 0.9589, test_loss: 1.0291, test_f1: 0.4541
 epoch: 35, train_loss: 0.9486, test_loss: 0.9986, test_f1: 0.4952
 epoch: 36, train_loss: 0.9517, test_loss: 0.9975, test_f1: 0.4902
 epoch: 37, train_loss: 0.9418, test_loss: 0.9920, test_f1: 0.4908
 epoch: 38, train_loss: 0.9440, test_loss: 1.0023, test_f1: 0.4832
 epoch: 39, train_loss: 0.9357, test_loss: 1.0123, test_f1: 0.4734
 epoch: 40, train_loss: 0.9305, test_loss: 0.9859, test_f1: 0.5018
 epoch: 41, train_loss: 0.9300, test_loss: 0.9878, test_f1: 0.4997
 epoch: 42, train_loss: 0.9283, test_loss: 1.0010, test_f1: 0.4983
 epoch: 43, train_loss: 0.9280, test_loss: 0.9691, test_f1: 0.5005
 epoch: 44, train_loss: 0.9322, test_loss: 0.9962, test_f1: 0.4837
 epoch: 45, train_loss: 0.9236, test_loss: 1.0100, test_f1: 0.4852
 epoch: 46, train_loss: 0.9251, test_loss: 0.9753, test_f1: 0.5152
 epoch: 47, train_loss: 0.9158, test_loss: 0.9590, test_f1: 0.5016
 epoch: 48, train_loss: 0.9185, test_loss: 1.0288, test_f1: 0.4886
 epoch: 49, train_loss: 0.9269, test_loss: 0.9629, test_f1: 0.4981
 epoch: 50, train_loss: 0.9136, test_loss: 0.9567, test_f1: 0.5215
 epoch: 51, train_loss: 0.9112, test_loss: 0.9507, test_f1: 0.5172
 epoch: 52, train_loss: 0.9071, test_loss: 0.9464, test_f1: 0.5172
 epoch: 53, train_loss: 0.9029, test_loss: 0.9476, test_f1: 0.5168
 epoch: 54, train_loss: 0.9020, test_loss: 0.9508, test_f1: 0.5166
 epoch: 55, train_loss: 0.9063, test_loss: 0.9506, test_f1: 0.5138
 epoch: 56, train_loss: 0.9009, test_loss: 0.9381, test_f1: 0.5078
 epoch: 57, train_loss: 0.8998, test_loss: 0.9397, test_f1: 0.5231
 epoch: 58, train_loss: 0.8940, test_loss: 0.9598, test_f1: 0.5115
 epoch: 59, train_loss: 0.8986, test_loss: 0.9405, test_f1: 0.5207
 epoch: 60, train_loss: 0.8991, test_loss: 0.9520, test_f1: 0.5139
 epoch: 61, train_loss: 0.8974, test_loss: 0.9306, test_f1: 0.5072
 epoch: 62, train_loss: 0.8974, test_loss: 0.9352, test_f1: 0.5281
 epoch: 63, train_loss: 0.8950, test_loss: 0.9392, test_f1: 0.5229
 epoch: 64, train_loss: 0.8923, test_loss: 0.9403, test_f1: 0.5189
 epoch: 65, train_loss: 0.8930, test_loss: 0.9288, test_f1: 0.5106
 epoch: 66, train_loss: 0.8933, test_loss: 0.9382, test_f1: 0.5195
 epoch: 67, train_loss: 0.8905, test_loss: 0.9298, test_f1: 0.5289
 epoch: 68, train_loss: 0.8815, test_loss: 0.9294, test_f1: 0.5229
 epoch: 69, train_loss: 0.8873, test_loss: 0.9292, test_f1: 0.5189
 epoch: 70, train_loss: 0.8843, test_loss: 0.9395, test_f1: 0.5258
 epoch: 71, train_loss: 0.8862, test_loss: 0.9279, test_f1: 0.5186
 epoch: 72, train_loss: 0.8790, test_loss: 0.9296, test_f1: 0.5118
 epoch: 73, train_loss: 0.8913, test_loss: 0.9243, test_f1: 0.5123
 epoch: 74, train_loss: 0.8814, test_loss: 0.9227, test_f1: 0.5324
 epoch: 75, train_loss: 0.8746, test_loss: 0.9232, test_f1: 0.5270
 epoch: 76, train_loss: 0.8744, test_loss: 0.9239, test_f1: 0.5214
 epoch: 77, train_loss: 0.8819, test_loss: 0.9604, test_f1: 0.5172
 epoch: 78, train_loss: 0.8818, test_loss: 0.9288, test_f1: 0.5297
 epoch: 79, train_loss: 0.8716, test_loss: 0.9185, test_f1: 0.5224
 epoch: 80, train_loss: 0.8870, test_loss: 0.9203, test_f1: 0.5263
 epoch: 81, train_loss: 0.8752, test_loss: 0.9328, test_f1: 0.5299
 epoch: 82, train_loss: 0.8773, test_loss: 0.9162, test_f1: 0.5202
 epoch: 83, train_loss: 0.8686, test_loss: 0.9212, test_f1: 0.5261
 epoch: 84, train_loss: 0.8751, test_loss: 0.9340, test_f1: 0.5174
 epoch: 85, train_loss: 0.8755, test_loss: 0.9354, test_f1: 0.5294
 epoch: 86, train_loss: 0.8689, test_loss: 0.9224, test_f1: 0.5250
 epoch: 87, train_loss: 0.8649, test_loss: 0.9199, test_f1: 0.5201
 epoch: 88, train_loss: 0.8761, test_loss: 0.9216, test_f1: 0.5290
 epoch: 89, train_loss: 0.8822, test_loss: 0.9082, test_f1: 0.5351
 epoch: 90, train_loss: 0.8745, test_loss: 0.9059, test_f1: 0.5254
 epoch: 91, train_loss: 0.8680, test_loss: 0.9075, test_f1: 0.5318
 epoch: 92, train_loss: 0.8626, test_loss: 0.9165, test_f1: 0.5263
 epoch: 93, train_loss: 0.8620, test_loss: 0.9093, test_f1: 0.5217
 epoch: 94, train_loss: 0.8664, test_loss: 0.9238, test_f1: 0.5233
 epoch: 95, train_loss: 0.8691, test_loss: 0.9157, test_f1: 0.5211
 epoch: 96, train_loss: 0.8665, test_loss: 0.9329, test_f1: 0.5149
 epoch: 97, train_loss: 0.8698, test_loss: 0.9247, test_f1: 0.5103
 epoch: 98, train_loss: 0.8594, test_loss: 0.9134, test_f1: 0.5172
 epoch: 99, train_loss: 0.8567, test_loss: 0.9120, test_f1: 0.5223
##################ITERATION #3 ****************************************
 epoch: 0, train_loss: 1.3147, test_loss: 1.3177, test_f1: 0.2270
 epoch: 1, train_loss: 1.2689, test_loss: 1.2686, test_f1: 0.2270
 epoch: 2, train_loss: 1.2420, test_loss: 1.2279, test_f1: 0.3019
 epoch: 3, train_loss: 1.2201, test_loss: 1.1946, test_f1: 0.3508
 epoch: 4, train_loss: 1.1996, test_loss: 1.1670, test_f1: 0.3425
 epoch: 5, train_loss: 1.1790, test_loss: 1.1459, test_f1: 0.3541
 epoch: 6, train_loss: 1.1613, test_loss: 1.1248, test_f1: 0.3745
 epoch: 7, train_loss: 1.1410, test_loss: 1.1072, test_f1: 0.3801
 epoch: 8, train_loss: 1.1284, test_loss: 1.0892, test_f1: 0.3964
 epoch: 9, train_loss: 1.1065, test_loss: 1.0748, test_f1: 0.4116
 epoch: 10, train_loss: 1.0908, test_loss: 1.0658, test_f1: 0.4126
 epoch: 11, train_loss: 1.0791, test_loss: 1.0558, test_f1: 0.4298
 epoch: 12, train_loss: 1.0676, test_loss: 1.0512, test_f1: 0.4300
 epoch: 13, train_loss: 1.0577, test_loss: 1.0429, test_f1: 0.4354
 epoch: 14, train_loss: 1.0458, test_loss: 1.0384, test_f1: 0.4333
 epoch: 15, train_loss: 1.0403, test_loss: 1.0320, test_f1: 0.4387
 epoch: 16, train_loss: 1.0297, test_loss: 1.0271, test_f1: 0.4548
 epoch: 17, train_loss: 1.0265, test_loss: 1.0245, test_f1: 0.4552
 epoch: 18, train_loss: 1.0156, test_loss: 1.0244, test_f1: 0.4466
 epoch: 19, train_loss: 1.0074, test_loss: 1.0144, test_f1: 0.4561
 epoch: 20, train_loss: 1.0094, test_loss: 1.0174, test_f1: 0.4613
 epoch: 21, train_loss: 0.9967, test_loss: 1.0070, test_f1: 0.4651
 epoch: 22, train_loss: 0.9854, test_loss: 0.9968, test_f1: 0.4676
 epoch: 23, train_loss: 0.9856, test_loss: 0.9963, test_f1: 0.4640
 epoch: 24, train_loss: 0.9813, test_loss: 0.9965, test_f1: 0.4700
 epoch: 25, train_loss: 0.9676, test_loss: 0.9897, test_f1: 0.4771
 epoch: 26, train_loss: 0.9656, test_loss: 0.9920, test_f1: 0.4905
 epoch: 27, train_loss: 0.9613, test_loss: 0.9805, test_f1: 0.4864
 epoch: 28, train_loss: 0.9584, test_loss: 0.9838, test_f1: 0.4856
 epoch: 29, train_loss: 0.9508, test_loss: 0.9969, test_f1: 0.4834
 epoch: 30, train_loss: 0.9449, test_loss: 0.9727, test_f1: 0.4932
 epoch: 31, train_loss: 0.9446, test_loss: 0.9781, test_f1: 0.4981
 epoch: 32, train_loss: 0.9353, test_loss: 0.9625, test_f1: 0.4988
 epoch: 33, train_loss: 0.9319, test_loss: 0.9622, test_f1: 0.4989
 epoch: 34, train_loss: 0.9295, test_loss: 0.9586, test_f1: 0.4879
 epoch: 35, train_loss: 0.9277, test_loss: 0.9563, test_f1: 0.5056
 epoch: 36, train_loss: 0.9127, test_loss: 0.9596, test_f1: 0.4969
 epoch: 37, train_loss: 0.9245, test_loss: 0.9615, test_f1: 0.4966
 epoch: 38, train_loss: 0.9173, test_loss: 0.9601, test_f1: 0.4967
 epoch: 39, train_loss: 0.9106, test_loss: 0.9617, test_f1: 0.4996
 epoch: 40, train_loss: 0.9085, test_loss: 0.9439, test_f1: 0.5073
 epoch: 41, train_loss: 0.9064, test_loss: 0.9510, test_f1: 0.5163
 epoch: 42, train_loss: 0.8973, test_loss: 0.9507, test_f1: 0.5268
 epoch: 43, train_loss: 0.9035, test_loss: 0.9389, test_f1: 0.5156
 epoch: 44, train_loss: 0.8960, test_loss: 0.9421, test_f1: 0.5255
 epoch: 45, train_loss: 0.8938, test_loss: 0.9410, test_f1: 0.5111
 epoch: 46, train_loss: 0.9022, test_loss: 0.9249, test_f1: 0.5123
 epoch: 47, train_loss: 0.8819, test_loss: 0.9268, test_f1: 0.5261
 epoch: 48, train_loss: 0.8851, test_loss: 0.9290, test_f1: 0.5214
 epoch: 49, train_loss: 0.8956, test_loss: 0.9362, test_f1: 0.5300
 epoch: 50, train_loss: 0.8827, test_loss: 0.9491, test_f1: 0.5163
 epoch: 51, train_loss: 0.8781, test_loss: 0.9354, test_f1: 0.5267
 epoch: 52, train_loss: 0.8706, test_loss: 0.9333, test_f1: 0.5253
 epoch: 53, train_loss: 0.8793, test_loss: 0.9280, test_f1: 0.5340
 epoch: 54, train_loss: 0.8656, test_loss: 0.9259, test_f1: 0.5310
 epoch: 55, train_loss: 0.8748, test_loss: 0.9229, test_f1: 0.5282
 epoch: 56, train_loss: 0.8695, test_loss: 0.9219, test_f1: 0.5339
 epoch: 57, train_loss: 0.8695, test_loss: 0.9218, test_f1: 0.5299
 epoch: 58, train_loss: 0.8648, test_loss: 0.9189, test_f1: 0.5345
 epoch: 59, train_loss: 0.8616, test_loss: 0.9218, test_f1: 0.5312
 epoch: 60, train_loss: 0.8654, test_loss: 0.9198, test_f1: 0.5277
 epoch: 61, train_loss: 0.8604, test_loss: 0.9155, test_f1: 0.5366
 epoch: 62, train_loss: 0.8590, test_loss: 0.9234, test_f1: 0.5277
 epoch: 63, train_loss: 0.8641, test_loss: 0.9181, test_f1: 0.5281
 epoch: 64, train_loss: 0.8645, test_loss: 0.9210, test_f1: 0.5319
 epoch: 65, train_loss: 0.8602, test_loss: 0.9161, test_f1: 0.5259
 epoch: 66, train_loss: 0.8594, test_loss: 0.9103, test_f1: 0.5251
 epoch: 67, train_loss: 0.8534, test_loss: 0.9108, test_f1: 0.5296
 epoch: 68, train_loss: 0.8616, test_loss: 0.9115, test_f1: 0.5315
 epoch: 69, train_loss: 0.8574, test_loss: 0.9169, test_f1: 0.5261
 epoch: 70, train_loss: 0.8560, test_loss: 0.9139, test_f1: 0.5348
 epoch: 71, train_loss: 0.8488, test_loss: 0.9149, test_f1: 0.5342
 epoch: 72, train_loss: 0.8501, test_loss: 0.9091, test_f1: 0.5392
 epoch: 73, train_loss: 0.8548, test_loss: 0.9008, test_f1: 0.5382
 epoch: 74, train_loss: 0.8502, test_loss: 0.9169, test_f1: 0.5277
 epoch: 75, train_loss: 0.8449, test_loss: 0.9084, test_f1: 0.5358
 epoch: 76, train_loss: 0.8517, test_loss: 0.9116, test_f1: 0.5308
 epoch: 77, train_loss: 0.8529, test_loss: 0.9128, test_f1: 0.5266
 epoch: 78, train_loss: 0.8392, test_loss: 0.9156, test_f1: 0.5287
 epoch: 79, train_loss: 0.8452, test_loss: 0.9173, test_f1: 0.5238
 epoch: 80, train_loss: 0.8504, test_loss: 0.9006, test_f1: 0.5299
 epoch: 81, train_loss: 0.8500, test_loss: 0.9131, test_f1: 0.5344
 epoch: 82, train_loss: 0.8435, test_loss: 0.9026, test_f1: 0.5337
 epoch: 83, train_loss: 0.8417, test_loss: 0.9093, test_f1: 0.5391
 epoch: 84, train_loss: 0.8327, test_loss: 0.9132, test_f1: 0.5323
 epoch: 85, train_loss: 0.8393, test_loss: 0.9129, test_f1: 0.5351
 epoch: 86, train_loss: 0.8302, test_loss: 0.9092, test_f1: 0.5327
 epoch: 87, train_loss: 0.8346, test_loss: 0.9069, test_f1: 0.5416
 epoch: 88, train_loss: 0.8346, test_loss: 0.9097, test_f1: 0.5332
 epoch: 89, train_loss: 0.8345, test_loss: 0.9107, test_f1: 0.5379
 epoch: 90, train_loss: 0.8340, test_loss: 0.9043, test_f1: 0.5455
 epoch: 91, train_loss: 0.8297, test_loss: 0.9130, test_f1: 0.5296
 epoch: 92, train_loss: 0.8336, test_loss: 0.8990, test_f1: 0.5312
 epoch: 93, train_loss: 0.8309, test_loss: 0.9051, test_f1: 0.5321
 epoch: 94, train_loss: 0.8327, test_loss: 0.8986, test_f1: 0.5363
 epoch: 95, train_loss: 0.8261, test_loss: 0.9033, test_f1: 0.5396
 epoch: 96, train_loss: 0.8269, test_loss: 0.9111, test_f1: 0.5351
 epoch: 97, train_loss: 0.8216, test_loss: 0.8956, test_f1: 0.5427
 epoch: 98, train_loss: 0.8303, test_loss: 0.9140, test_f1: 0.5412
 epoch: 99, train_loss: 0.8226, test_loss: 0.8993, test_f1: 0.5366
##################ITERATION #4 ****************************************
 epoch: 0, train_loss: 1.2855, test_loss: 1.3119, test_f1: 0.2270
 epoch: 1, train_loss: 1.2482, test_loss: 1.2753, test_f1: 0.2499
 epoch: 2, train_loss: 1.2318, test_loss: 1.2125, test_f1: 0.2747
 epoch: 3, train_loss: 1.2067, test_loss: 1.1772, test_f1: 0.3654
 epoch: 4, train_loss: 1.1858, test_loss: 1.1481, test_f1: 0.4244
 epoch: 5, train_loss: 1.1599, test_loss: 1.1199, test_f1: 0.4294
 epoch: 6, train_loss: 1.1359, test_loss: 1.0984, test_f1: 0.4589
 epoch: 7, train_loss: 1.1152, test_loss: 1.0797, test_f1: 0.4504
 epoch: 8, train_loss: 1.0964, test_loss: 1.0636, test_f1: 0.4476
 epoch: 9, train_loss: 1.0824, test_loss: 1.0544, test_f1: 0.4617
 epoch: 10, train_loss: 1.0696, test_loss: 1.0403, test_f1: 0.4565
 epoch: 11, train_loss: 1.0655, test_loss: 1.0336, test_f1: 0.4623
 epoch: 12, train_loss: 1.0485, test_loss: 1.0282, test_f1: 0.4793
 epoch: 13, train_loss: 1.0365, test_loss: 1.0174, test_f1: 0.4815
 epoch: 14, train_loss: 1.0340, test_loss: 1.0117, test_f1: 0.4810
 epoch: 15, train_loss: 1.0275, test_loss: 1.0131, test_f1: 0.4843
 epoch: 16, train_loss: 1.0172, test_loss: 0.9970, test_f1: 0.4926
 epoch: 17, train_loss: 1.0194, test_loss: 0.9909, test_f1: 0.5023
 epoch: 18, train_loss: 1.0028, test_loss: 0.9861, test_f1: 0.4803
 epoch: 19, train_loss: 1.0033, test_loss: 0.9844, test_f1: 0.4950
 epoch: 20, train_loss: 0.9918, test_loss: 0.9852, test_f1: 0.4916
 epoch: 21, train_loss: 0.9924, test_loss: 0.9765, test_f1: 0.4986
 epoch: 22, train_loss: 0.9914, test_loss: 0.9809, test_f1: 0.5030
 epoch: 23, train_loss: 0.9808, test_loss: 0.9703, test_f1: 0.5034
 epoch: 24, train_loss: 0.9780, test_loss: 0.9565, test_f1: 0.4983
 epoch: 25, train_loss: 0.9740, test_loss: 0.9620, test_f1: 0.5032
 epoch: 26, train_loss: 0.9720, test_loss: 0.9522, test_f1: 0.5054
 epoch: 27, train_loss: 0.9655, test_loss: 0.9504, test_f1: 0.5149
 epoch: 28, train_loss: 0.9664, test_loss: 0.9494, test_f1: 0.5085
 epoch: 29, train_loss: 0.9553, test_loss: 0.9621, test_f1: 0.4949
 epoch: 30, train_loss: 0.9595, test_loss: 0.9482, test_f1: 0.5165
 epoch: 31, train_loss: 0.9542, test_loss: 0.9466, test_f1: 0.5024
 epoch: 32, train_loss: 0.9495, test_loss: 0.9391, test_f1: 0.5193
 epoch: 33, train_loss: 0.9503, test_loss: 0.9356, test_f1: 0.5052
 epoch: 34, train_loss: 0.9409, test_loss: 0.9394, test_f1: 0.5184
 epoch: 35, train_loss: 0.9395, test_loss: 0.9407, test_f1: 0.5107
 epoch: 36, train_loss: 0.9439, test_loss: 0.9370, test_f1: 0.5053
 epoch: 37, train_loss: 0.9430, test_loss: 0.9220, test_f1: 0.5150
 epoch: 38, train_loss: 0.9319, test_loss: 0.9203, test_f1: 0.5130
 epoch: 39, train_loss: 0.9350, test_loss: 0.9245, test_f1: 0.5152
 epoch: 40, train_loss: 0.9248, test_loss: 0.9149, test_f1: 0.5202
 epoch: 41, train_loss: 0.9307, test_loss: 0.9203, test_f1: 0.5116
 epoch: 42, train_loss: 0.9243, test_loss: 0.9035, test_f1: 0.5221
 epoch: 43, train_loss: 0.9193, test_loss: 0.9149, test_f1: 0.5171
 epoch: 44, train_loss: 0.9214, test_loss: 0.9038, test_f1: 0.5186
 epoch: 45, train_loss: 0.9144, test_loss: 0.8942, test_f1: 0.5276
 epoch: 46, train_loss: 0.9161, test_loss: 0.8991, test_f1: 0.5211
 epoch: 47, train_loss: 0.9144, test_loss: 0.8870, test_f1: 0.5266
 epoch: 48, train_loss: 0.9086, test_loss: 0.8908, test_f1: 0.5302
 epoch: 49, train_loss: 0.8996, test_loss: 0.9025, test_f1: 0.5229
 epoch: 50, train_loss: 0.8995, test_loss: 0.8918, test_f1: 0.5316
 epoch: 51, train_loss: 0.8983, test_loss: 0.8874, test_f1: 0.5193
 epoch: 52, train_loss: 0.8975, test_loss: 0.8861, test_f1: 0.5332
 epoch: 53, train_loss: 0.9017, test_loss: 0.8822, test_f1: 0.5215
 epoch: 54, train_loss: 0.8897, test_loss: 0.8883, test_f1: 0.5223
 epoch: 55, train_loss: 0.8896, test_loss: 0.8773, test_f1: 0.5336
 epoch: 56, train_loss: 0.8924, test_loss: 0.8850, test_f1: 0.5229
 epoch: 57, train_loss: 0.8843, test_loss: 0.8737, test_f1: 0.5335
 epoch: 58, train_loss: 0.8821, test_loss: 0.8753, test_f1: 0.5326
 epoch: 59, train_loss: 0.8946, test_loss: 0.8785, test_f1: 0.5256
 epoch: 60, train_loss: 0.8926, test_loss: 0.8862, test_f1: 0.5253
 epoch: 61, train_loss: 0.8841, test_loss: 0.8740, test_f1: 0.5295
 epoch: 62, train_loss: 0.8878, test_loss: 0.8782, test_f1: 0.5243
 epoch: 63, train_loss: 0.8892, test_loss: 0.8712, test_f1: 0.5371
 epoch: 64, train_loss: 0.8825, test_loss: 0.8728, test_f1: 0.5324
 epoch: 65, train_loss: 0.8875, test_loss: 0.8679, test_f1: 0.5366
 epoch: 66, train_loss: 0.8796, test_loss: 0.8699, test_f1: 0.5347
 epoch: 67, train_loss: 0.8813, test_loss: 0.8721, test_f1: 0.5254
 epoch: 68, train_loss: 0.8754, test_loss: 0.8725, test_f1: 0.5386
 epoch: 69, train_loss: 0.8746, test_loss: 0.8670, test_f1: 0.5362
 epoch: 70, train_loss: 0.8705, test_loss: 0.8643, test_f1: 0.5337
 epoch: 71, train_loss: 0.8741, test_loss: 0.8642, test_f1: 0.5378
 epoch: 72, train_loss: 0.8709, test_loss: 0.8648, test_f1: 0.5272
 epoch: 73, train_loss: 0.8719, test_loss: 0.8623, test_f1: 0.5397
 epoch: 74, train_loss: 0.8701, test_loss: 0.8662, test_f1: 0.5344
 epoch: 75, train_loss: 0.8731, test_loss: 0.8666, test_f1: 0.5332
 epoch: 76, train_loss: 0.8628, test_loss: 0.8727, test_f1: 0.5258
 epoch: 77, train_loss: 0.8681, test_loss: 0.8637, test_f1: 0.5383
 epoch: 78, train_loss: 0.8671, test_loss: 0.8634, test_f1: 0.5368
 epoch: 79, train_loss: 0.8693, test_loss: 0.8565, test_f1: 0.5449
 epoch: 80, train_loss: 0.8646, test_loss: 0.8520, test_f1: 0.5459
 epoch: 81, train_loss: 0.8642, test_loss: 0.8493, test_f1: 0.5471
 epoch: 82, train_loss: 0.8698, test_loss: 0.8542, test_f1: 0.5440
 epoch: 83, train_loss: 0.8661, test_loss: 0.8567, test_f1: 0.5467
 epoch: 84, train_loss: 0.8626, test_loss: 0.8631, test_f1: 0.5361
 epoch: 85, train_loss: 0.8603, test_loss: 0.8567, test_f1: 0.5432
 epoch: 86, train_loss: 0.8611, test_loss: 0.8490, test_f1: 0.5430
 epoch: 87, train_loss: 0.8694, test_loss: 0.8593, test_f1: 0.5383
 epoch: 88, train_loss: 0.8600, test_loss: 0.8503, test_f1: 0.5520
 epoch: 89, train_loss: 0.8502, test_loss: 0.8433, test_f1: 0.5527
 epoch: 90, train_loss: 0.8579, test_loss: 0.8456, test_f1: 0.5445
 epoch: 91, train_loss: 0.8553, test_loss: 0.8468, test_f1: 0.5497
 epoch: 92, train_loss: 0.8569, test_loss: 0.8484, test_f1: 0.5459
 epoch: 93, train_loss: 0.8535, test_loss: 0.8650, test_f1: 0.5325
 epoch: 94, train_loss: 0.8568, test_loss: 0.8520, test_f1: 0.5507
 epoch: 95, train_loss: 0.8504, test_loss: 0.8474, test_f1: 0.5461
 epoch: 96, train_loss: 0.8504, test_loss: 0.8464, test_f1: 0.5488
 epoch: 97, train_loss: 0.8526, test_loss: 0.8550, test_f1: 0.5292
 epoch: 98, train_loss: 0.8554, test_loss: 0.8463, test_f1: 0.5410
 epoch: 99, train_loss: 0.8463, test_loss: 0.8529, test_f1: 0.5452
##################ITERATION #5 ****************************************
 epoch: 0, train_loss: 1.2806, test_loss: 1.3217, test_f1: 0.2270
 epoch: 1, train_loss: 1.2317, test_loss: 1.2840, test_f1: 0.2270
 epoch: 2, train_loss: 1.2059, test_loss: 1.1805, test_f1: 0.3303
 epoch: 3, train_loss: 1.1809, test_loss: 1.1407, test_f1: 0.4001
 epoch: 4, train_loss: 1.1495, test_loss: 1.1072, test_f1: 0.4055
 epoch: 5, train_loss: 1.1278, test_loss: 1.0877, test_f1: 0.4271
 epoch: 6, train_loss: 1.1068, test_loss: 1.0708, test_f1: 0.4423
 epoch: 7, train_loss: 1.0915, test_loss: 1.0612, test_f1: 0.4496
 epoch: 8, train_loss: 1.0759, test_loss: 1.0518, test_f1: 0.4573
 epoch: 9, train_loss: 1.0578, test_loss: 1.0466, test_f1: 0.4562
 epoch: 10, train_loss: 1.0526, test_loss: 1.0391, test_f1: 0.4648
 epoch: 11, train_loss: 1.0340, test_loss: 1.0313, test_f1: 0.4771
 epoch: 12, train_loss: 1.0291, test_loss: 1.0239, test_f1: 0.4805
 epoch: 13, train_loss: 1.0214, test_loss: 1.0201, test_f1: 0.4616
 epoch: 14, train_loss: 1.0105, test_loss: 1.0107, test_f1: 0.4725
 epoch: 15, train_loss: 1.0019, test_loss: 1.0042, test_f1: 0.4879
 epoch: 16, train_loss: 0.9927, test_loss: 0.9987, test_f1: 0.4860
 epoch: 17, train_loss: 0.9920, test_loss: 1.0060, test_f1: 0.4761
 epoch: 18, train_loss: 0.9918, test_loss: 0.9994, test_f1: 0.4920
 epoch: 19, train_loss: 0.9775, test_loss: 0.9877, test_f1: 0.4969
 epoch: 20, train_loss: 0.9749, test_loss: 0.9831, test_f1: 0.4875
 epoch: 21, train_loss: 0.9709, test_loss: 0.9854, test_f1: 0.4909
 epoch: 22, train_loss: 0.9609, test_loss: 0.9793, test_f1: 0.5046
 epoch: 23, train_loss: 0.9606, test_loss: 0.9709, test_f1: 0.5018
 epoch: 24, train_loss: 0.9515, test_loss: 0.9743, test_f1: 0.4906
 epoch: 25, train_loss: 0.9499, test_loss: 0.9667, test_f1: 0.4834
 epoch: 26, train_loss: 0.9419, test_loss: 0.9705, test_f1: 0.5142
 epoch: 27, train_loss: 0.9413, test_loss: 0.9615, test_f1: 0.5193
 epoch: 28, train_loss: 0.9420, test_loss: 0.9677, test_f1: 0.4912
 epoch: 29, train_loss: 0.9302, test_loss: 0.9718, test_f1: 0.4955
 epoch: 30, train_loss: 0.9306, test_loss: 0.9618, test_f1: 0.4935
 epoch: 31, train_loss: 0.9355, test_loss: 0.9540, test_f1: 0.4902
 epoch: 32, train_loss: 0.9275, test_loss: 0.9715, test_f1: 0.4955
 epoch: 33, train_loss: 0.9177, test_loss: 0.9520, test_f1: 0.4959
 epoch: 34, train_loss: 0.9157, test_loss: 0.9467, test_f1: 0.5072
 epoch: 35, train_loss: 0.9128, test_loss: 0.9579, test_f1: 0.5116
 epoch: 36, train_loss: 0.9205, test_loss: 0.9518, test_f1: 0.5021
 epoch: 37, train_loss: 0.9138, test_loss: 0.9520, test_f1: 0.4932
 epoch: 38, train_loss: 0.9038, test_loss: 0.9494, test_f1: 0.5043
 epoch: 39, train_loss: 0.9043, test_loss: 0.9327, test_f1: 0.5199
 epoch: 40, train_loss: 0.9071, test_loss: 0.9449, test_f1: 0.5163
 epoch: 41, train_loss: 0.8962, test_loss: 0.9283, test_f1: 0.5061
 epoch: 42, train_loss: 0.8932, test_loss: 0.9416, test_f1: 0.5028
 epoch: 43, train_loss: 0.9010, test_loss: 0.9497, test_f1: 0.5077
 epoch: 44, train_loss: 0.8945, test_loss: 0.9176, test_f1: 0.5158
 epoch: 45, train_loss: 0.8926, test_loss: 0.9275, test_f1: 0.5216
 epoch: 46, train_loss: 0.8816, test_loss: 0.9245, test_f1: 0.5051
 epoch: 47, train_loss: 0.8813, test_loss: 0.9651, test_f1: 0.5087
 epoch: 48, train_loss: 0.8791, test_loss: 0.9187, test_f1: 0.5242
 epoch: 49, train_loss: 0.8819, test_loss: 0.9143, test_f1: 0.5003
 epoch: 50, train_loss: 0.8781, test_loss: 0.9293, test_f1: 0.5214
 epoch: 51, train_loss: 0.8734, test_loss: 0.9018, test_f1: 0.5315
 epoch: 52, train_loss: 0.8765, test_loss: 0.9073, test_f1: 0.5187
 epoch: 53, train_loss: 0.8743, test_loss: 0.9041, test_f1: 0.5280
 epoch: 54, train_loss: 0.8748, test_loss: 0.9181, test_f1: 0.5148
 epoch: 55, train_loss: 0.8687, test_loss: 0.9046, test_f1: 0.5226
 epoch: 56, train_loss: 0.8697, test_loss: 0.9159, test_f1: 0.5248
 epoch: 57, train_loss: 0.8644, test_loss: 0.9003, test_f1: 0.5263
 epoch: 58, train_loss: 0.8605, test_loss: 0.9012, test_f1: 0.5373
 epoch: 59, train_loss: 0.8653, test_loss: 0.8998, test_f1: 0.5224
 epoch: 60, train_loss: 0.8617, test_loss: 0.8959, test_f1: 0.5121
 epoch: 61, train_loss: 0.8602, test_loss: 0.9073, test_f1: 0.5051
 epoch: 62, train_loss: 0.8529, test_loss: 0.8978, test_f1: 0.5064
 epoch: 63, train_loss: 0.8630, test_loss: 0.9004, test_f1: 0.5176
 epoch: 64, train_loss: 0.8633, test_loss: 0.8994, test_f1: 0.5263
 epoch: 65, train_loss: 0.8654, test_loss: 0.9064, test_f1: 0.5199
 epoch: 66, train_loss: 0.8526, test_loss: 0.8989, test_f1: 0.5215
 epoch: 67, train_loss: 0.8488, test_loss: 0.9019, test_f1: 0.5229
 epoch: 68, train_loss: 0.8549, test_loss: 0.8942, test_f1: 0.5196
 epoch: 69, train_loss: 0.8475, test_loss: 0.8838, test_f1: 0.5365
 epoch: 70, train_loss: 0.8596, test_loss: 0.8974, test_f1: 0.5336
 epoch: 71, train_loss: 0.8490, test_loss: 0.8968, test_f1: 0.5320
 epoch: 72, train_loss: 0.8527, test_loss: 0.8791, test_f1: 0.5365
 epoch: 73, train_loss: 0.8481, test_loss: 0.8906, test_f1: 0.5325
 epoch: 74, train_loss: 0.8512, test_loss: 0.8865, test_f1: 0.5279
 epoch: 75, train_loss: 0.8474, test_loss: 0.8965, test_f1: 0.5282
 epoch: 76, train_loss: 0.8461, test_loss: 0.8886, test_f1: 0.5326
 epoch: 77, train_loss: 0.8490, test_loss: 0.8841, test_f1: 0.5286
 epoch: 78, train_loss: 0.8450, test_loss: 0.9048, test_f1: 0.5159
 epoch: 79, train_loss: 0.8507, test_loss: 0.8841, test_f1: 0.5349
 epoch: 80, train_loss: 0.8519, test_loss: 0.8838, test_f1: 0.5321
 epoch: 81, train_loss: 0.8506, test_loss: 0.8846, test_f1: 0.5281
 epoch: 82, train_loss: 0.8420, test_loss: 0.8863, test_f1: 0.5279
 epoch: 83, train_loss: 0.8393, test_loss: 0.8803, test_f1: 0.5352
 epoch: 84, train_loss: 0.8340, test_loss: 0.8865, test_f1: 0.5149
 epoch: 85, train_loss: 0.8363, test_loss: 0.8898, test_f1: 0.5323
 epoch: 86, train_loss: 0.8367, test_loss: 0.8812, test_f1: 0.5507
 epoch: 87, train_loss: 0.8415, test_loss: 0.9007, test_f1: 0.5227
 epoch: 88, train_loss: 0.8394, test_loss: 0.8918, test_f1: 0.5203
 epoch: 89, train_loss: 0.8401, test_loss: 0.8947, test_f1: 0.5195
 epoch: 90, train_loss: 0.8357, test_loss: 0.8852, test_f1: 0.5376
 epoch: 91, train_loss: 0.8321, test_loss: 0.8928, test_f1: 0.5233
 epoch: 92, train_loss: 0.8329, test_loss: 0.8838, test_f1: 0.5309
 epoch: 93, train_loss: 0.8287, test_loss: 0.8722, test_f1: 0.5380
 epoch: 94, train_loss: 0.8278, test_loss: 0.8808, test_f1: 0.5337
 epoch: 95, train_loss: 0.8315, test_loss: 0.8943, test_f1: 0.5174
 epoch: 96, train_loss: 0.8385, test_loss: 0.8951, test_f1: 0.5148
 epoch: 97, train_loss: 0.8266, test_loss: 0.8811, test_f1: 0.5302
 epoch: 98, train_loss: 0.8171, test_loss: 0.8914, test_f1: 0.5065
 epoch: 99, train_loss: 0.8275, test_loss: 0.9009, test_f1: 0.5165
##################ITERATION #6 ****************************************
 epoch: 0, train_loss: 1.3134, test_loss: 1.3436, test_f1: 0.2270
 epoch: 1, train_loss: 1.2602, test_loss: 1.2641, test_f1: 0.2270
 epoch: 2, train_loss: 1.2408, test_loss: 1.1949, test_f1: 0.2344
 epoch: 3, train_loss: 1.2094, test_loss: 1.1571, test_f1: 0.2983
 epoch: 4, train_loss: 1.1840, test_loss: 1.1262, test_f1: 0.3453
 epoch: 5, train_loss: 1.1486, test_loss: 1.0961, test_f1: 0.3745
 epoch: 6, train_loss: 1.1260, test_loss: 1.0769, test_f1: 0.3969
 epoch: 7, train_loss: 1.1068, test_loss: 1.0568, test_f1: 0.4067
 epoch: 8, train_loss: 1.0930, test_loss: 1.0451, test_f1: 0.4218
 epoch: 9, train_loss: 1.0707, test_loss: 1.0396, test_f1: 0.4275
 epoch: 10, train_loss: 1.0646, test_loss: 1.0295, test_f1: 0.4339
 epoch: 11, train_loss: 1.0522, test_loss: 1.0262, test_f1: 0.4232
 epoch: 12, train_loss: 1.0445, test_loss: 1.0183, test_f1: 0.4338
 epoch: 13, train_loss: 1.0296, test_loss: 1.0187, test_f1: 0.4358
 epoch: 14, train_loss: 1.0295, test_loss: 1.0128, test_f1: 0.4345
 epoch: 15, train_loss: 1.0245, test_loss: 1.0187, test_f1: 0.4497
 epoch: 16, train_loss: 1.0195, test_loss: 1.0051, test_f1: 0.4774
 epoch: 17, train_loss: 1.0113, test_loss: 1.0036, test_f1: 0.4735
 epoch: 18, train_loss: 1.0024, test_loss: 0.9967, test_f1: 0.4622
 epoch: 19, train_loss: 1.0025, test_loss: 0.9877, test_f1: 0.4892
 epoch: 20, train_loss: 0.9981, test_loss: 0.9897, test_f1: 0.5094
 epoch: 21, train_loss: 0.9949, test_loss: 1.0042, test_f1: 0.4755
 epoch: 22, train_loss: 0.9836, test_loss: 0.9787, test_f1: 0.4951
 epoch: 23, train_loss: 0.9812, test_loss: 0.9829, test_f1: 0.4996
 epoch: 24, train_loss: 0.9752, test_loss: 0.9791, test_f1: 0.4894
 epoch: 25, train_loss: 0.9747, test_loss: 0.9705, test_f1: 0.4991
 epoch: 26, train_loss: 0.9653, test_loss: 0.9684, test_f1: 0.4943
 epoch: 27, train_loss: 0.9616, test_loss: 0.9483, test_f1: 0.4995
 epoch: 28, train_loss: 0.9587, test_loss: 0.9598, test_f1: 0.5010
 epoch: 29, train_loss: 0.9509, test_loss: 0.9556, test_f1: 0.4965
 epoch: 30, train_loss: 0.9477, test_loss: 0.9538, test_f1: 0.4975
 epoch: 31, train_loss: 0.9437, test_loss: 0.9541, test_f1: 0.4980
 epoch: 32, train_loss: 0.9456, test_loss: 0.9493, test_f1: 0.4954
 epoch: 33, train_loss: 0.9300, test_loss: 0.9401, test_f1: 0.4961
 epoch: 34, train_loss: 0.9375, test_loss: 0.9315, test_f1: 0.5086
 epoch: 35, train_loss: 0.9262, test_loss: 0.9284, test_f1: 0.4994
 epoch: 36, train_loss: 0.9317, test_loss: 0.9351, test_f1: 0.5009
 epoch: 37, train_loss: 0.9202, test_loss: 0.9383, test_f1: 0.5030
 epoch: 38, train_loss: 0.9157, test_loss: 0.9277, test_f1: 0.5013
 epoch: 39, train_loss: 0.9175, test_loss: 0.9199, test_f1: 0.5012
 epoch: 40, train_loss: 0.9116, test_loss: 0.9310, test_f1: 0.5039
 epoch: 41, train_loss: 0.9126, test_loss: 0.9228, test_f1: 0.5046
 epoch: 42, train_loss: 0.9174, test_loss: 0.9750, test_f1: 0.4957
 epoch: 43, train_loss: 0.9098, test_loss: 0.9269, test_f1: 0.5008
 epoch: 44, train_loss: 0.9044, test_loss: 0.9286, test_f1: 0.5084
 epoch: 45, train_loss: 0.8981, test_loss: 0.9181, test_f1: 0.5022
 epoch: 46, train_loss: 0.9026, test_loss: 0.9108, test_f1: 0.5228
 epoch: 47, train_loss: 0.8938, test_loss: 0.9124, test_f1: 0.5186
 epoch: 48, train_loss: 0.8995, test_loss: 0.9266, test_f1: 0.5075
 epoch: 49, train_loss: 0.8905, test_loss: 0.9122, test_f1: 0.5075
 epoch: 50, train_loss: 0.8880, test_loss: 0.9143, test_f1: 0.5228
 epoch: 51, train_loss: 0.8801, test_loss: 0.9146, test_f1: 0.5266
 epoch: 52, train_loss: 0.8825, test_loss: 0.9203, test_f1: 0.5163
 epoch: 53, train_loss: 0.8839, test_loss: 0.9213, test_f1: 0.5270
 epoch: 54, train_loss: 0.8803, test_loss: 0.9140, test_f1: 0.5240
 epoch: 55, train_loss: 0.8820, test_loss: 0.9187, test_f1: 0.5237
 epoch: 56, train_loss: 0.8666, test_loss: 0.9144, test_f1: 0.5209
 epoch: 57, train_loss: 0.8777, test_loss: 0.9181, test_f1: 0.5241
 epoch: 58, train_loss: 0.8725, test_loss: 0.9210, test_f1: 0.5264
 epoch: 59, train_loss: 0.8638, test_loss: 0.9152, test_f1: 0.5216
 epoch: 60, train_loss: 0.8686, test_loss: 0.9117, test_f1: 0.5239
 epoch: 61, train_loss: 0.8716, test_loss: 0.9225, test_f1: 0.5289
 epoch: 62, train_loss: 0.8663, test_loss: 0.9159, test_f1: 0.5271
 epoch: 63, train_loss: 0.8659, test_loss: 0.9058, test_f1: 0.5314
 epoch: 64, train_loss: 0.8694, test_loss: 0.9039, test_f1: 0.5260
 epoch: 65, train_loss: 0.8704, test_loss: 0.9168, test_f1: 0.5260
 epoch: 66, train_loss: 0.8645, test_loss: 0.9124, test_f1: 0.5266
 epoch: 67, train_loss: 0.8717, test_loss: 0.9104, test_f1: 0.5240
 epoch: 68, train_loss: 0.8570, test_loss: 0.9161, test_f1: 0.5279
 epoch: 69, train_loss: 0.8574, test_loss: 0.9071, test_f1: 0.5307
 epoch: 70, train_loss: 0.8623, test_loss: 0.9100, test_f1: 0.5312
 epoch: 71, train_loss: 0.8660, test_loss: 0.9074, test_f1: 0.5277
 epoch: 72, train_loss: 0.8601, test_loss: 0.9052, test_f1: 0.5327
 epoch: 73, train_loss: 0.8561, test_loss: 0.9026, test_f1: 0.5321
 epoch: 74, train_loss: 0.8621, test_loss: 0.9108, test_f1: 0.5413
 epoch: 75, train_loss: 0.8459, test_loss: 0.9072, test_f1: 0.5238
 epoch: 76, train_loss: 0.8553, test_loss: 0.9041, test_f1: 0.5239
 epoch: 77, train_loss: 0.8490, test_loss: 0.8996, test_f1: 0.5328
 epoch: 78, train_loss: 0.8528, test_loss: 0.9084, test_f1: 0.5340
 epoch: 79, train_loss: 0.8508, test_loss: 0.9178, test_f1: 0.5283
 epoch: 80, train_loss: 0.8443, test_loss: 0.9116, test_f1: 0.5302
 epoch: 81, train_loss: 0.8419, test_loss: 0.9096, test_f1: 0.5286
 epoch: 82, train_loss: 0.8509, test_loss: 0.9069, test_f1: 0.5275
 epoch: 83, train_loss: 0.8409, test_loss: 0.9039, test_f1: 0.5226
 epoch: 84, train_loss: 0.8505, test_loss: 0.9017, test_f1: 0.5228
 epoch: 85, train_loss: 0.8448, test_loss: 0.9064, test_f1: 0.5384
 epoch: 86, train_loss: 0.8484, test_loss: 0.9004, test_f1: 0.5299
 epoch: 87, train_loss: 0.8492, test_loss: 0.8977, test_f1: 0.5248
 epoch: 88, train_loss: 0.8471, test_loss: 0.8987, test_f1: 0.5209
 epoch: 89, train_loss: 0.8436, test_loss: 0.9034, test_f1: 0.5223
 epoch: 90, train_loss: 0.8468, test_loss: 0.9015, test_f1: 0.5326
 epoch: 91, train_loss: 0.8417, test_loss: 0.9035, test_f1: 0.5213
 epoch: 92, train_loss: 0.8369, test_loss: 0.9010, test_f1: 0.5295
 epoch: 93, train_loss: 0.8354, test_loss: 0.9152, test_f1: 0.5289
 epoch: 94, train_loss: 0.8366, test_loss: 0.8974, test_f1: 0.5325
 epoch: 95, train_loss: 0.8450, test_loss: 0.8937, test_f1: 0.5329
 epoch: 96, train_loss: 0.8350, test_loss: 0.9016, test_f1: 0.5350
 epoch: 97, train_loss: 0.8402, test_loss: 0.9011, test_f1: 0.5269
 epoch: 98, train_loss: 0.8326, test_loss: 0.9049, test_f1: 0.5272
 epoch: 99, train_loss: 0.8372, test_loss: 0.8937, test_f1: 0.5240
##################ITERATION #7 ****************************************
 epoch: 0, train_loss: 1.2950, test_loss: 1.3163, test_f1: 0.2270
 epoch: 1, train_loss: 1.2235, test_loss: 1.3006, test_f1: 0.2527
 epoch: 2, train_loss: 1.1819, test_loss: 1.1898, test_f1: 0.3461
 epoch: 3, train_loss: 1.1544, test_loss: 1.1063, test_f1: 0.4205
 epoch: 4, train_loss: 1.1278, test_loss: 1.0847, test_f1: 0.4266
 epoch: 5, train_loss: 1.0999, test_loss: 1.0720, test_f1: 0.4411
 epoch: 6, train_loss: 1.0876, test_loss: 1.0587, test_f1: 0.4439
 epoch: 7, train_loss: 1.0749, test_loss: 1.0512, test_f1: 0.4463
 epoch: 8, train_loss: 1.0577, test_loss: 1.0455, test_f1: 0.4467
 epoch: 9, train_loss: 1.0413, test_loss: 1.0350, test_f1: 0.4592
 epoch: 10, train_loss: 1.0343, test_loss: 1.0362, test_f1: 0.4682
 epoch: 11, train_loss: 1.0358, test_loss: 1.0341, test_f1: 0.4722
 epoch: 12, train_loss: 1.0186, test_loss: 1.0256, test_f1: 0.4686
 epoch: 13, train_loss: 1.0125, test_loss: 1.0265, test_f1: 0.4827
 epoch: 14, train_loss: 1.0125, test_loss: 1.0219, test_f1: 0.4903
 epoch: 15, train_loss: 1.0077, test_loss: 1.0167, test_f1: 0.4827
 epoch: 16, train_loss: 0.9993, test_loss: 1.0181, test_f1: 0.4848
 epoch: 17, train_loss: 0.9979, test_loss: 1.0160, test_f1: 0.4781
 epoch: 18, train_loss: 0.9869, test_loss: 1.0103, test_f1: 0.4772
 epoch: 19, train_loss: 0.9852, test_loss: 1.0182, test_f1: 0.4853
 epoch: 20, train_loss: 0.9744, test_loss: 1.0083, test_f1: 0.4888
 epoch: 21, train_loss: 0.9788, test_loss: 1.0049, test_f1: 0.4913
 epoch: 22, train_loss: 0.9716, test_loss: 0.9986, test_f1: 0.4924
 epoch: 23, train_loss: 0.9698, test_loss: 0.9921, test_f1: 0.4983
 epoch: 24, train_loss: 0.9644, test_loss: 1.0093, test_f1: 0.4934
 epoch: 25, train_loss: 0.9641, test_loss: 0.9919, test_f1: 0.4904
 epoch: 26, train_loss: 0.9566, test_loss: 0.9975, test_f1: 0.4874
 epoch: 27, train_loss: 0.9603, test_loss: 0.9981, test_f1: 0.4951
 epoch: 28, train_loss: 0.9565, test_loss: 1.0045, test_f1: 0.4869
 epoch: 29, train_loss: 0.9513, test_loss: 0.9879, test_f1: 0.4968
 epoch: 30, train_loss: 0.9487, test_loss: 0.9912, test_f1: 0.4925
 epoch: 31, train_loss: 0.9432, test_loss: 0.9840, test_f1: 0.4948
 epoch: 32, train_loss: 0.9332, test_loss: 0.9925, test_f1: 0.5000
 epoch: 33, train_loss: 0.9331, test_loss: 0.9939, test_f1: 0.4931
 epoch: 34, train_loss: 0.9449, test_loss: 0.9734, test_f1: 0.5039
 epoch: 35, train_loss: 0.9327, test_loss: 0.9846, test_f1: 0.5036
 epoch: 36, train_loss: 0.9249, test_loss: 1.0005, test_f1: 0.4914
 epoch: 37, train_loss: 0.9304, test_loss: 0.9963, test_f1: 0.4956
 epoch: 38, train_loss: 0.9286, test_loss: 1.0003, test_f1: 0.4872
 epoch: 39, train_loss: 0.9262, test_loss: 0.9967, test_f1: 0.4992
 epoch: 40, train_loss: 0.9210, test_loss: 0.9923, test_f1: 0.4986
 epoch: 41, train_loss: 0.9092, test_loss: 0.9949, test_f1: 0.5047
 epoch: 42, train_loss: 0.9128, test_loss: 0.9841, test_f1: 0.5014
 epoch: 43, train_loss: 0.9132, test_loss: 0.9948, test_f1: 0.5024
 epoch: 44, train_loss: 0.9126, test_loss: 0.9926, test_f1: 0.5059
 epoch: 45, train_loss: 0.9117, test_loss: 0.9852, test_f1: 0.5123
 epoch: 46, train_loss: 0.9125, test_loss: 0.9820, test_f1: 0.5122
 epoch: 47, train_loss: 0.9082, test_loss: 0.9747, test_f1: 0.5047
 epoch: 48, train_loss: 0.9027, test_loss: 0.9914, test_f1: 0.5019
 epoch: 49, train_loss: 0.9017, test_loss: 0.9735, test_f1: 0.5130
 epoch: 50, train_loss: 0.9045, test_loss: 1.0064, test_f1: 0.5134
 epoch: 51, train_loss: 0.8936, test_loss: 0.9912, test_f1: 0.5018
 epoch: 52, train_loss: 0.8945, test_loss: 0.9814, test_f1: 0.5290
 epoch: 53, train_loss: 0.8934, test_loss: 0.9857, test_f1: 0.5082
 epoch: 54, train_loss: 0.8942, test_loss: 0.9886, test_f1: 0.5160
 epoch: 55, train_loss: 0.8939, test_loss: 0.9803, test_f1: 0.5119
 epoch: 56, train_loss: 0.8984, test_loss: 0.9843, test_f1: 0.5115
 epoch: 57, train_loss: 0.8837, test_loss: 0.9919, test_f1: 0.5064
 epoch: 58, train_loss: 0.8826, test_loss: 0.9886, test_f1: 0.5097
 epoch: 59, train_loss: 0.8812, test_loss: 0.9868, test_f1: 0.5161
 epoch: 60, train_loss: 0.8869, test_loss: 1.0015, test_f1: 0.5113
 epoch: 61, train_loss: 0.8770, test_loss: 0.9887, test_f1: 0.5121
 epoch: 62, train_loss: 0.8852, test_loss: 0.9879, test_f1: 0.5121
 epoch: 63, train_loss: 0.8892, test_loss: 0.9897, test_f1: 0.5087
 epoch: 64, train_loss: 0.8777, test_loss: 0.9887, test_f1: 0.5085
 epoch: 65, train_loss: 0.8786, test_loss: 0.9836, test_f1: 0.5161
 epoch: 66, train_loss: 0.8820, test_loss: 0.9819, test_f1: 0.5303
 epoch: 67, train_loss: 0.8761, test_loss: 0.9874, test_f1: 0.5121
 epoch: 68, train_loss: 0.8699, test_loss: 0.9806, test_f1: 0.5227
 epoch: 69, train_loss: 0.8735, test_loss: 0.9914, test_f1: 0.5138
 epoch: 70, train_loss: 0.8749, test_loss: 0.9783, test_f1: 0.5213
 epoch: 71, train_loss: 0.8814, test_loss: 0.9846, test_f1: 0.5247
 epoch: 72, train_loss: 0.8729, test_loss: 0.9703, test_f1: 0.5195
 epoch: 73, train_loss: 0.8749, test_loss: 0.9794, test_f1: 0.5131
 epoch: 74, train_loss: 0.8786, test_loss: 0.9770, test_f1: 0.5153
 epoch: 75, train_loss: 0.8841, test_loss: 0.9901, test_f1: 0.5232
 epoch: 76, train_loss: 0.8701, test_loss: 0.9941, test_f1: 0.5190
 epoch: 77, train_loss: 0.8684, test_loss: 0.9852, test_f1: 0.5093
 epoch: 78, train_loss: 0.8789, test_loss: 0.9909, test_f1: 0.5107
 epoch: 79, train_loss: 0.8717, test_loss: 0.9842, test_f1: 0.5196
 epoch: 80, train_loss: 0.8604, test_loss: 0.9780, test_f1: 0.5449
 epoch: 81, train_loss: 0.8554, test_loss: 0.9836, test_f1: 0.5268
 epoch: 82, train_loss: 0.8701, test_loss: 0.9825, test_f1: 0.5336
 epoch: 83, train_loss: 0.8652, test_loss: 0.9933, test_f1: 0.5400
 epoch: 84, train_loss: 0.8645, test_loss: 0.9730, test_f1: 0.5252
 epoch: 85, train_loss: 0.8616, test_loss: 0.9776, test_f1: 0.5402
 epoch: 86, train_loss: 0.8663, test_loss: 0.9851, test_f1: 0.5187
 epoch: 87, train_loss: 0.8658, test_loss: 0.9765, test_f1: 0.5216
 epoch: 88, train_loss: 0.8754, test_loss: 0.9774, test_f1: 0.5317
 epoch: 89, train_loss: 0.8584, test_loss: 0.9905, test_f1: 0.5156
 epoch: 90, train_loss: 0.8645, test_loss: 0.9871, test_f1: 0.5243
 epoch: 91, train_loss: 0.8585, test_loss: 0.9849, test_f1: 0.5286
 epoch: 92, train_loss: 0.8761, test_loss: 0.9860, test_f1: 0.5252
 epoch: 93, train_loss: 0.8641, test_loss: 0.9894, test_f1: 0.5221
 epoch: 94, train_loss: 0.8615, test_loss: 0.9908, test_f1: 0.5139
 epoch: 95, train_loss: 0.8548, test_loss: 0.9969, test_f1: 0.5240
 epoch: 96, train_loss: 0.8627, test_loss: 0.9896, test_f1: 0.5255
 epoch: 97, train_loss: 0.8569, test_loss: 0.9855, test_f1: 0.5214
 epoch: 98, train_loss: 0.8542, test_loss: 0.9793, test_f1: 0.5232
 epoch: 99, train_loss: 0.8563, test_loss: 0.9929, test_f1: 0.5224
##################ITERATION #8 ****************************************
 epoch: 0, train_loss: 1.2824, test_loss: 1.3312, test_f1: 0.2270
 epoch: 1, train_loss: 1.2035, test_loss: 1.2897, test_f1: 0.2270
 epoch: 2, train_loss: 1.1889, test_loss: 1.1688, test_f1: 0.2523
 epoch: 3, train_loss: 1.1607, test_loss: 1.1029, test_f1: 0.3627
 epoch: 4, train_loss: 1.1444, test_loss: 1.0864, test_f1: 0.3989
 epoch: 5, train_loss: 1.1297, test_loss: 1.0779, test_f1: 0.4009
 epoch: 6, train_loss: 1.1044, test_loss: 1.0735, test_f1: 0.4130
 epoch: 7, train_loss: 1.0949, test_loss: 1.0633, test_f1: 0.4380
 epoch: 8, train_loss: 1.0836, test_loss: 1.0569, test_f1: 0.4439
 epoch: 9, train_loss: 1.0706, test_loss: 1.0478, test_f1: 0.4465
 epoch: 10, train_loss: 1.0545, test_loss: 1.0462, test_f1: 0.4549
 epoch: 11, train_loss: 1.0476, test_loss: 1.0325, test_f1: 0.4536
 epoch: 12, train_loss: 1.0392, test_loss: 1.0352, test_f1: 0.4607
 epoch: 13, train_loss: 1.0359, test_loss: 1.0339, test_f1: 0.4527
 epoch: 14, train_loss: 1.0240, test_loss: 1.0210, test_f1: 0.4741
 epoch: 15, train_loss: 1.0153, test_loss: 1.0152, test_f1: 0.4787
 epoch: 16, train_loss: 1.0101, test_loss: 1.0246, test_f1: 0.4682
 epoch: 17, train_loss: 1.0013, test_loss: 1.0105, test_f1: 0.4515
 epoch: 18, train_loss: 1.0008, test_loss: 1.0054, test_f1: 0.4588
 epoch: 19, train_loss: 0.9949, test_loss: 0.9995, test_f1: 0.4682
 epoch: 20, train_loss: 0.9827, test_loss: 1.0002, test_f1: 0.4724
 epoch: 21, train_loss: 0.9746, test_loss: 0.9918, test_f1: 0.4861
 epoch: 22, train_loss: 0.9853, test_loss: 0.9879, test_f1: 0.4756
 epoch: 23, train_loss: 0.9737, test_loss: 0.9862, test_f1: 0.4650
 epoch: 24, train_loss: 0.9789, test_loss: 0.9763, test_f1: 0.4961
 epoch: 25, train_loss: 0.9717, test_loss: 0.9801, test_f1: 0.4831
 epoch: 26, train_loss: 0.9662, test_loss: 0.9736, test_f1: 0.5027
 epoch: 27, train_loss: 0.9586, test_loss: 0.9629, test_f1: 0.4959
 epoch: 28, train_loss: 0.9570, test_loss: 0.9648, test_f1: 0.5003
 epoch: 29, train_loss: 0.9567, test_loss: 0.9596, test_f1: 0.4907
 epoch: 30, train_loss: 0.9554, test_loss: 0.9603, test_f1: 0.5066
 epoch: 31, train_loss: 0.9417, test_loss: 0.9544, test_f1: 0.4789
 epoch: 32, train_loss: 0.9403, test_loss: 0.9558, test_f1: 0.5010
 epoch: 33, train_loss: 0.9428, test_loss: 0.9438, test_f1: 0.5125
 epoch: 34, train_loss: 0.9415, test_loss: 0.9468, test_f1: 0.5117
 epoch: 35, train_loss: 0.9379, test_loss: 0.9468, test_f1: 0.5192
 epoch: 36, train_loss: 0.9387, test_loss: 0.9440, test_f1: 0.4858
 epoch: 37, train_loss: 0.9405, test_loss: 0.9399, test_f1: 0.5144
 epoch: 38, train_loss: 0.9237, test_loss: 0.9495, test_f1: 0.5110
 epoch: 39, train_loss: 0.9208, test_loss: 0.9332, test_f1: 0.5121
 epoch: 40, train_loss: 0.9184, test_loss: 0.9397, test_f1: 0.5103
 epoch: 41, train_loss: 0.9255, test_loss: 0.9267, test_f1: 0.4965
 epoch: 42, train_loss: 0.9221, test_loss: 0.9480, test_f1: 0.5010
 epoch: 43, train_loss: 0.9140, test_loss: 0.9248, test_f1: 0.5229
 epoch: 44, train_loss: 0.9184, test_loss: 0.9065, test_f1: 0.5329
 epoch: 45, train_loss: 0.9091, test_loss: 0.9025, test_f1: 0.5368
 epoch: 46, train_loss: 0.9104, test_loss: 0.9086, test_f1: 0.5257
 epoch: 47, train_loss: 0.9080, test_loss: 0.9179, test_f1: 0.5269
 epoch: 48, train_loss: 0.9007, test_loss: 0.9320, test_f1: 0.5190
 epoch: 49, train_loss: 0.9067, test_loss: 0.9279, test_f1: 0.5315
 epoch: 50, train_loss: 0.9019, test_loss: 0.9071, test_f1: 0.5220
 epoch: 51, train_loss: 0.9011, test_loss: 0.9100, test_f1: 0.5214
 epoch: 52, train_loss: 0.8901, test_loss: 0.9094, test_f1: 0.5349
 epoch: 53, train_loss: 0.8879, test_loss: 0.9145, test_f1: 0.5161
 epoch: 54, train_loss: 0.8913, test_loss: 0.9164, test_f1: 0.5130
 epoch: 55, train_loss: 0.8896, test_loss: 0.9113, test_f1: 0.5219
 epoch: 56, train_loss: 0.8812, test_loss: 0.9078, test_f1: 0.5249
 epoch: 57, train_loss: 0.8897, test_loss: 0.9063, test_f1: 0.5301
 epoch: 58, train_loss: 0.8808, test_loss: 0.9069, test_f1: 0.5260
 epoch: 59, train_loss: 0.8799, test_loss: 0.9107, test_f1: 0.5287
 epoch: 60, train_loss: 0.8768, test_loss: 0.9069, test_f1: 0.5399
 epoch: 61, train_loss: 0.8826, test_loss: 0.9114, test_f1: 0.5336
 epoch: 62, train_loss: 0.8742, test_loss: 0.9084, test_f1: 0.5257
 epoch: 63, train_loss: 0.8709, test_loss: 0.8980, test_f1: 0.5305
 epoch: 64, train_loss: 0.8821, test_loss: 0.9097, test_f1: 0.5264
 epoch: 65, train_loss: 0.8773, test_loss: 0.9010, test_f1: 0.5267
 epoch: 66, train_loss: 0.8793, test_loss: 0.8947, test_f1: 0.5063
 epoch: 67, train_loss: 0.8775, test_loss: 0.8955, test_f1: 0.5062
 epoch: 68, train_loss: 0.8790, test_loss: 0.8953, test_f1: 0.5323
 epoch: 69, train_loss: 0.8691, test_loss: 0.9026, test_f1: 0.5274
 epoch: 70, train_loss: 0.8713, test_loss: 0.9039, test_f1: 0.5106
 epoch: 71, train_loss: 0.8653, test_loss: 0.9050, test_f1: 0.5204
 epoch: 72, train_loss: 0.8605, test_loss: 0.8982, test_f1: 0.5094
 epoch: 73, train_loss: 0.8639, test_loss: 0.9094, test_f1: 0.5054
 epoch: 74, train_loss: 0.8657, test_loss: 0.8957, test_f1: 0.5170
 epoch: 75, train_loss: 0.8606, test_loss: 0.8999, test_f1: 0.5309
 epoch: 76, train_loss: 0.8650, test_loss: 0.9005, test_f1: 0.5197
 epoch: 77, train_loss: 0.8596, test_loss: 0.9020, test_f1: 0.5295
 epoch: 78, train_loss: 0.8584, test_loss: 0.9022, test_f1: 0.5279
 epoch: 79, train_loss: 0.8551, test_loss: 0.9032, test_f1: 0.5217
 epoch: 80, train_loss: 0.8541, test_loss: 0.8871, test_f1: 0.5167
 epoch: 81, train_loss: 0.8572, test_loss: 0.8913, test_f1: 0.5292
 epoch: 82, train_loss: 0.8585, test_loss: 0.8859, test_f1: 0.5222
 epoch: 83, train_loss: 0.8619, test_loss: 0.8788, test_f1: 0.5230
 epoch: 84, train_loss: 0.8516, test_loss: 0.8892, test_f1: 0.5354
 epoch: 85, train_loss: 0.8600, test_loss: 0.8904, test_f1: 0.5285
 epoch: 86, train_loss: 0.8581, test_loss: 0.8766, test_f1: 0.5204
 epoch: 87, train_loss: 0.8592, test_loss: 0.8882, test_f1: 0.5225
 epoch: 88, train_loss: 0.8481, test_loss: 0.8944, test_f1: 0.5135
 epoch: 89, train_loss: 0.8494, test_loss: 0.9013, test_f1: 0.5363
 epoch: 90, train_loss: 0.8517, test_loss: 0.8948, test_f1: 0.5081
 epoch: 91, train_loss: 0.8524, test_loss: 0.8932, test_f1: 0.5288
 epoch: 92, train_loss: 0.8478, test_loss: 0.8972, test_f1: 0.5361
 epoch: 93, train_loss: 0.8429, test_loss: 0.8930, test_f1: 0.5325
 epoch: 94, train_loss: 0.8355, test_loss: 0.8934, test_f1: 0.5214
 epoch: 95, train_loss: 0.8397, test_loss: 0.8793, test_f1: 0.5253
 epoch: 96, train_loss: 0.8451, test_loss: 0.8910, test_f1: 0.5204
 epoch: 97, train_loss: 0.8475, test_loss: 0.8899, test_f1: 0.5225
 epoch: 98, train_loss: 0.8327, test_loss: 0.8940, test_f1: 0.5311
 epoch: 99, train_loss: 0.8375, test_loss: 0.8822, test_f1: 0.5234
##################ITERATION #9 ****************************************
 epoch: 0, train_loss: 1.3017, test_loss: 1.3296, test_f1: 0.2270
 epoch: 1, train_loss: 1.2041, test_loss: 1.2421, test_f1: 0.2345
 epoch: 2, train_loss: 1.1660, test_loss: 1.1363, test_f1: 0.3810
 epoch: 3, train_loss: 1.1529, test_loss: 1.0968, test_f1: 0.3998
 epoch: 4, train_loss: 1.1219, test_loss: 1.0815, test_f1: 0.4120
 epoch: 5, train_loss: 1.0996, test_loss: 1.0678, test_f1: 0.4270
 epoch: 6, train_loss: 1.0855, test_loss: 1.0564, test_f1: 0.4436
 epoch: 7, train_loss: 1.0687, test_loss: 1.0542, test_f1: 0.4267
 epoch: 8, train_loss: 1.0569, test_loss: 1.0505, test_f1: 0.4487
 epoch: 9, train_loss: 1.0486, test_loss: 1.0445, test_f1: 0.4439
 epoch: 10, train_loss: 1.0320, test_loss: 1.0398, test_f1: 0.4598
 epoch: 11, train_loss: 1.0286, test_loss: 1.0365, test_f1: 0.4707
 epoch: 12, train_loss: 1.0265, test_loss: 1.0320, test_f1: 0.4649
 epoch: 13, train_loss: 1.0172, test_loss: 1.0332, test_f1: 0.4697
 epoch: 14, train_loss: 1.0068, test_loss: 1.0254, test_f1: 0.4650
 epoch: 15, train_loss: 1.0030, test_loss: 1.0237, test_f1: 0.4629
 epoch: 16, train_loss: 0.9982, test_loss: 1.0238, test_f1: 0.4799
 epoch: 17, train_loss: 0.9945, test_loss: 1.0185, test_f1: 0.4662
 epoch: 18, train_loss: 0.9872, test_loss: 1.0113, test_f1: 0.4769
 epoch: 19, train_loss: 0.9849, test_loss: 1.0101, test_f1: 0.4804
 epoch: 20, train_loss: 0.9741, test_loss: 1.0010, test_f1: 0.4918
 epoch: 21, train_loss: 0.9774, test_loss: 1.0025, test_f1: 0.4977
 epoch: 22, train_loss: 0.9691, test_loss: 0.9931, test_f1: 0.4928
 epoch: 23, train_loss: 0.9643, test_loss: 0.9906, test_f1: 0.4944
 epoch: 24, train_loss: 0.9622, test_loss: 0.9873, test_f1: 0.4951
 epoch: 25, train_loss: 0.9542, test_loss: 0.9789, test_f1: 0.5054
 epoch: 26, train_loss: 0.9526, test_loss: 0.9854, test_f1: 0.5065
 epoch: 27, train_loss: 0.9424, test_loss: 0.9763, test_f1: 0.5068
 epoch: 28, train_loss: 0.9419, test_loss: 0.9661, test_f1: 0.5059
 epoch: 29, train_loss: 0.9440, test_loss: 0.9657, test_f1: 0.5053
 epoch: 30, train_loss: 0.9367, test_loss: 0.9573, test_f1: 0.5184
 epoch: 31, train_loss: 0.9293, test_loss: 0.9659, test_f1: 0.5253
 epoch: 32, train_loss: 0.9294, test_loss: 0.9555, test_f1: 0.5190
 epoch: 33, train_loss: 0.9289, test_loss: 0.9632, test_f1: 0.5011
 epoch: 34, train_loss: 0.9237, test_loss: 0.9591, test_f1: 0.5082
 epoch: 35, train_loss: 0.9111, test_loss: 0.9434, test_f1: 0.5204
 epoch: 36, train_loss: 0.9175, test_loss: 0.9538, test_f1: 0.5246
 epoch: 37, train_loss: 0.9130, test_loss: 0.9494, test_f1: 0.5263
 epoch: 38, train_loss: 0.9087, test_loss: 0.9456, test_f1: 0.5181
 epoch: 39, train_loss: 0.9060, test_loss: 0.9589, test_f1: 0.5117
 epoch: 40, train_loss: 0.9002, test_loss: 0.9393, test_f1: 0.5204
 epoch: 41, train_loss: 0.8965, test_loss: 0.9377, test_f1: 0.5285
 epoch: 42, train_loss: 0.8986, test_loss: 0.9438, test_f1: 0.5146
 epoch: 43, train_loss: 0.9049, test_loss: 0.9258, test_f1: 0.5100
 epoch: 44, train_loss: 0.8912, test_loss: 0.9326, test_f1: 0.5352
 epoch: 45, train_loss: 0.8838, test_loss: 0.9245, test_f1: 0.5199
 epoch: 46, train_loss: 0.8815, test_loss: 0.9281, test_f1: 0.5207
 epoch: 47, train_loss: 0.8782, test_loss: 0.9227, test_f1: 0.5153
 epoch: 48, train_loss: 0.8811, test_loss: 0.9351, test_f1: 0.5051
 epoch: 49, train_loss: 0.8818, test_loss: 0.9402, test_f1: 0.5306
 epoch: 50, train_loss: 0.8693, test_loss: 0.9282, test_f1: 0.5060
 epoch: 51, train_loss: 0.8768, test_loss: 0.9307, test_f1: 0.5184
 epoch: 52, train_loss: 0.8828, test_loss: 0.9312, test_f1: 0.5237
 epoch: 53, train_loss: 0.8726, test_loss: 0.9259, test_f1: 0.5189
 epoch: 54, train_loss: 0.8659, test_loss: 0.9068, test_f1: 0.5161
 epoch: 55, train_loss: 0.8716, test_loss: 0.9238, test_f1: 0.5111
 epoch: 56, train_loss: 0.8733, test_loss: 0.9283, test_f1: 0.5118
 epoch: 57, train_loss: 0.8664, test_loss: 0.9179, test_f1: 0.5109
 epoch: 58, train_loss: 0.8780, test_loss: 0.9197, test_f1: 0.5209
 epoch: 59, train_loss: 0.8584, test_loss: 0.9359, test_f1: 0.5168
 epoch: 60, train_loss: 0.8679, test_loss: 0.9188, test_f1: 0.5147
 epoch: 61, train_loss: 0.8601, test_loss: 0.9331, test_f1: 0.5208
 epoch: 62, train_loss: 0.8621, test_loss: 0.9353, test_f1: 0.5162
 epoch: 63, train_loss: 0.8638, test_loss: 0.9377, test_f1: 0.5163
 epoch: 64, train_loss: 0.8570, test_loss: 0.9286, test_f1: 0.5195
 epoch: 65, train_loss: 0.8485, test_loss: 0.9154, test_f1: 0.5250
 epoch: 66, train_loss: 0.8449, test_loss: 0.9294, test_f1: 0.5215
 epoch: 67, train_loss: 0.8497, test_loss: 0.9160, test_f1: 0.5241
 epoch: 68, train_loss: 0.8612, test_loss: 0.9242, test_f1: 0.5155
 epoch: 69, train_loss: 0.8564, test_loss: 0.9220, test_f1: 0.5174
 epoch: 70, train_loss: 0.8599, test_loss: 0.9065, test_f1: 0.5219
 epoch: 71, train_loss: 0.8448, test_loss: 0.9247, test_f1: 0.5164
 epoch: 72, train_loss: 0.8532, test_loss: 0.9067, test_f1: 0.5246
 epoch: 73, train_loss: 0.8389, test_loss: 0.9049, test_f1: 0.5255
 epoch: 74, train_loss: 0.8287, test_loss: 0.9266, test_f1: 0.5192
 epoch: 75, train_loss: 0.8452, test_loss: 0.9130, test_f1: 0.5107
 epoch: 76, train_loss: 0.8496, test_loss: 0.9129, test_f1: 0.5165
 epoch: 77, train_loss: 0.8478, test_loss: 0.9040, test_f1: 0.5282
 epoch: 78, train_loss: 0.8512, test_loss: 0.8974, test_f1: 0.5218
 epoch: 79, train_loss: 0.8400, test_loss: 0.9023, test_f1: 0.5192
 epoch: 80, train_loss: 0.8392, test_loss: 0.8997, test_f1: 0.5273
 epoch: 81, train_loss: 0.8369, test_loss: 0.8975, test_f1: 0.5280
 epoch: 82, train_loss: 0.8336, test_loss: 0.9259, test_f1: 0.5270
 epoch: 83, train_loss: 0.8275, test_loss: 0.9088, test_f1: 0.5287
 epoch: 84, train_loss: 0.8377, test_loss: 0.9088, test_f1: 0.5240
 epoch: 85, train_loss: 0.8378, test_loss: 0.9017, test_f1: 0.5287
 epoch: 86, train_loss: 0.8281, test_loss: 0.8961, test_f1: 0.5304
 epoch: 87, train_loss: 0.8356, test_loss: 0.8968, test_f1: 0.5283
 epoch: 88, train_loss: 0.8207, test_loss: 0.9085, test_f1: 0.5258
 epoch: 89, train_loss: 0.8239, test_loss: 0.9130, test_f1: 0.5128
 epoch: 90, train_loss: 0.8182, test_loss: 0.9127, test_f1: 0.5189
 epoch: 91, train_loss: 0.8273, test_loss: 0.9046, test_f1: 0.5318
 epoch: 92, train_loss: 0.8292, test_loss: 0.9193, test_f1: 0.5301
 epoch: 93, train_loss: 0.8220, test_loss: 0.8952, test_f1: 0.5286
 epoch: 94, train_loss: 0.8216, test_loss: 0.9083, test_f1: 0.5250
 epoch: 95, train_loss: 0.8256, test_loss: 0.8971, test_f1: 0.5292
 epoch: 96, train_loss: 0.8179, test_loss: 0.8918, test_f1: 0.5316
 epoch: 97, train_loss: 0.8157, test_loss: 0.8991, test_f1: 0.5337
 epoch: 98, train_loss: 0.8120, test_loss: 0.8959, test_f1: 0.5324
 epoch: 99, train_loss: 0.8112, test_loss: 0.9046, test_f1: 0.5289

Training completed in 550.32 seconds
Best F1: 0.5527 at epoch 89
Mean F1 across iterations: 0.5432  0.0058
========================FINAL RESULTS================================
FEGIN weighted F1: 0.5527  0.0058
python main.py --data ltspice_examples --representation component_pin_net --model FEGIN --layers 5 --hiddens 32 --batch_size 128 --lr 0.0001 --emb_size 512 --epochs 100 --save_appendix component_pin_net_L5_H32_BS128_LR0.0001_E512 --no_val
-----



STDERR:
  File "main.py", line 370, in <module>
    main()
  File "main.py", line 254, in main
    dataset = dataset_class(
  File "/home/philip/projects/ltspice_examples_code_repo/Circuit-Completion-Using-GNNs/component_classification_with_link_prediction_head/evaluation/FEGIN/kernel/circuit_datasets.py", line 15, in __init__
    self.data, self.slices = torch.load(self.processed_paths[0])
  File "/home/philip/.local/lib/python3.8/site-packages/torch/serialization.py", line 1040, in load
    warnings.warn(
  File "/usr/lib/python3.8/warnings.py", line 109, in _showwarnmsg
    sw(msg.message, msg.category, msg.filename, msg.lineno,
  File "main.py", line 47, in warn_with_traceback
    traceback.print_stack(file=log)
/home/philip/projects/ltspice_examples_code_repo/Circuit-Completion-Using-GNNs/component_classification_with_link_prediction_head/evaluation/FEGIN/kernel/circuit_datasets.py:15: FutureWarning: You are using `torch.load` with `weights_only=False` (the current default value), which uses the default pickle module implicitly. It is possible to construct malicious pickle data which will execute arbitrary code during unpickling (See https://github.com/pytorch/pytorch/blob/main/SECURITY.md#untrusted-models for more details). In a future release, the default value for `weights_only` will be flipped to `True`. This limits the functions that could be executed during unpickling. Arbitrary objects will no longer be allowed to be loaded via this mode unless they are explicitly allowlisted by the user via `torch.serialization.add_safe_globals`. We recommend you start setting `weights_only=True` for any use case where you don't have full control of the loaded file. Please open an issue on GitHub for any issues related to this experimental feature.
  self.data, self.slices = torch.load(self.processed_paths[0])
