STDOUT:
Results will be saved in /home/philip/projects/llm_inference_code_repo/Circuit-Completion-Using-GNNs/component_classification_with_link_prediction_head/evaluation/FEGIN/results/model_FEGIN_dataset_ltspice_examples
Command line input: python main.py --data ltspice_examples --representation component_component --model FEGIN --layers 4 --hiddens 16 --batch_size 128 --lr 0.001 --emb_size 250 --epochs 100 --save_appendix component_component_L4_H16_BS128_LR0.001_E250 --no_val
 is saved.
-----
ltspice_examples - FEGIN
Using 4 layers, 16 hidden units, h = 2
Loading component_component representation dataset
ENTERED
Training FEGIN on component_component representation
Train: 3556, Test: 845
##################ITERATION #0 ****************************************
 epoch: 0, train_loss: 1.3495, test_loss: 1.3447, test_f1: 0.2274
 epoch: 1, train_loss: 1.3213, test_loss: 1.3250, test_f1: 0.2274
 epoch: 2, train_loss: 1.3014, test_loss: 1.2964, test_f1: 0.2274
 epoch: 3, train_loss: 1.2792, test_loss: 1.2670, test_f1: 0.2274
 epoch: 4, train_loss: 1.2563, test_loss: 1.2412, test_f1: 0.2555
 epoch: 5, train_loss: 1.2349, test_loss: 1.2152, test_f1: 0.2555
 epoch: 6, train_loss: 1.2208, test_loss: 1.1934, test_f1: 0.2538
 epoch: 7, train_loss: 1.2158, test_loss: 1.1853, test_f1: 0.2799
 epoch: 8, train_loss: 1.2063, test_loss: 1.1800, test_f1: 0.2687
 epoch: 9, train_loss: 1.2010, test_loss: 1.1651, test_f1: 0.3015
 epoch: 10, train_loss: 1.1925, test_loss: 1.1618, test_f1: 0.3195
 epoch: 11, train_loss: 1.1815, test_loss: 1.1666, test_f1: 0.3401
 epoch: 12, train_loss: 1.1802, test_loss: 1.1423, test_f1: 0.3910
 epoch: 13, train_loss: 1.1743, test_loss: 1.1429, test_f1: 0.4204
 epoch: 14, train_loss: 1.1628, test_loss: 1.1449, test_f1: 0.4215
 epoch: 15, train_loss: 1.1589, test_loss: 1.1264, test_f1: 0.4166
 epoch: 16, train_loss: 1.1553, test_loss: 1.1384, test_f1: 0.4097
 epoch: 17, train_loss: 1.1469, test_loss: 1.1250, test_f1: 0.4303
 epoch: 18, train_loss: 1.1431, test_loss: 1.1313, test_f1: 0.4148
 epoch: 19, train_loss: 1.1364, test_loss: 1.1128, test_f1: 0.4295
 epoch: 20, train_loss: 1.1302, test_loss: 1.1049, test_f1: 0.4440
 epoch: 21, train_loss: 1.1175, test_loss: 1.1059, test_f1: 0.4436
 epoch: 22, train_loss: 1.1162, test_loss: 1.0985, test_f1: 0.4429
 epoch: 23, train_loss: 1.1030, test_loss: 1.0856, test_f1: 0.4519
 epoch: 24, train_loss: 1.1010, test_loss: 1.0742, test_f1: 0.4603
 epoch: 25, train_loss: 1.0857, test_loss: 1.0824, test_f1: 0.4600
 epoch: 26, train_loss: 1.0754, test_loss: 1.0695, test_f1: 0.4569
 epoch: 27, train_loss: 1.0610, test_loss: 1.0659, test_f1: 0.4611
 epoch: 28, train_loss: 1.0644, test_loss: 1.0522, test_f1: 0.4790
 epoch: 29, train_loss: 1.0623, test_loss: 1.0678, test_f1: 0.4693
 epoch: 30, train_loss: 1.0496, test_loss: 1.0436, test_f1: 0.4732
 epoch: 31, train_loss: 1.0489, test_loss: 1.0623, test_f1: 0.4693
 epoch: 32, train_loss: 1.0348, test_loss: 1.0318, test_f1: 0.4991
 epoch: 33, train_loss: 1.0399, test_loss: 1.0504, test_f1: 0.4761
 epoch: 34, train_loss: 1.0345, test_loss: 1.0556, test_f1: 0.4720
 epoch: 35, train_loss: 1.0179, test_loss: 1.0329, test_f1: 0.4687
 epoch: 36, train_loss: 1.0154, test_loss: 1.0368, test_f1: 0.4749
 epoch: 37, train_loss: 1.0178, test_loss: 1.0402, test_f1: 0.4707
 epoch: 38, train_loss: 1.0151, test_loss: 1.0476, test_f1: 0.4583
 epoch: 39, train_loss: 1.0101, test_loss: 1.0316, test_f1: 0.4731
 epoch: 40, train_loss: 0.9963, test_loss: 1.0277, test_f1: 0.4783
 epoch: 41, train_loss: 0.9924, test_loss: 1.0342, test_f1: 0.4835
 epoch: 42, train_loss: 0.9880, test_loss: 1.0264, test_f1: 0.4875
 epoch: 43, train_loss: 0.9854, test_loss: 1.0177, test_f1: 0.4773
 epoch: 44, train_loss: 0.9931, test_loss: 1.0318, test_f1: 0.4681
 epoch: 45, train_loss: 0.9849, test_loss: 1.0149, test_f1: 0.4899
 epoch: 46, train_loss: 0.9747, test_loss: 1.0290, test_f1: 0.4716
 epoch: 47, train_loss: 0.9633, test_loss: 1.0176, test_f1: 0.4820
 epoch: 48, train_loss: 0.9636, test_loss: 1.0041, test_f1: 0.4949
 epoch: 49, train_loss: 0.9520, test_loss: 1.0704, test_f1: 0.4654
 epoch: 50, train_loss: 0.9678, test_loss: 1.0054, test_f1: 0.4860
 epoch: 51, train_loss: 0.9439, test_loss: 1.0042, test_f1: 0.4913
 epoch: 52, train_loss: 0.9456, test_loss: 1.0182, test_f1: 0.4848
 epoch: 53, train_loss: 0.9379, test_loss: 1.0158, test_f1: 0.4942
 epoch: 54, train_loss: 0.9439, test_loss: 1.0233, test_f1: 0.4839
 epoch: 55, train_loss: 0.9390, test_loss: 1.0560, test_f1: 0.4753
 epoch: 56, train_loss: 0.9555, test_loss: 1.0090, test_f1: 0.4792
 epoch: 57, train_loss: 0.9326, test_loss: 1.0148, test_f1: 0.4957
 epoch: 58, train_loss: 0.9322, test_loss: 1.0099, test_f1: 0.4771
 epoch: 59, train_loss: 0.9272, test_loss: 1.0329, test_f1: 0.4811
 epoch: 60, train_loss: 0.9363, test_loss: 1.0203, test_f1: 0.4926
 epoch: 61, train_loss: 0.9360, test_loss: 1.0210, test_f1: 0.4962
 epoch: 62, train_loss: 0.9375, test_loss: 1.0383, test_f1: 0.4875
 epoch: 63, train_loss: 0.9323, test_loss: 1.0140, test_f1: 0.4892
 epoch: 64, train_loss: 0.9270, test_loss: 1.0215, test_f1: 0.4879
 epoch: 65, train_loss: 0.9315, test_loss: 1.0392, test_f1: 0.4929
 epoch: 66, train_loss: 0.9201, test_loss: 1.0290, test_f1: 0.4965
 epoch: 67, train_loss: 0.9207, test_loss: 1.0336, test_f1: 0.5065
 epoch: 68, train_loss: 0.9256, test_loss: 1.0266, test_f1: 0.4911
 epoch: 69, train_loss: 0.9285, test_loss: 1.0367, test_f1: 0.4867
 epoch: 70, train_loss: 0.9062, test_loss: 1.0235, test_f1: 0.4934
 epoch: 71, train_loss: 0.9313, test_loss: 1.0488, test_f1: 0.4951
 epoch: 72, train_loss: 0.9108, test_loss: 1.0283, test_f1: 0.5055
 epoch: 73, train_loss: 0.9102, test_loss: 1.0220, test_f1: 0.4999
 epoch: 74, train_loss: 0.9112, test_loss: 1.0242, test_f1: 0.4968
 epoch: 75, train_loss: 0.9125, test_loss: 1.0337, test_f1: 0.4854
 epoch: 76, train_loss: 0.9120, test_loss: 1.0244, test_f1: 0.4924
 epoch: 77, train_loss: 0.9130, test_loss: 1.0181, test_f1: 0.4995
 epoch: 78, train_loss: 0.9069, test_loss: 1.0267, test_f1: 0.4981
 epoch: 79, train_loss: 0.9022, test_loss: 1.0031, test_f1: 0.4996
 epoch: 80, train_loss: 0.9088, test_loss: 1.0238, test_f1: 0.5090
 epoch: 81, train_loss: 0.9001, test_loss: 1.0214, test_f1: 0.4964
 epoch: 82, train_loss: 0.8953, test_loss: 1.0100, test_f1: 0.4931
 epoch: 83, train_loss: 0.9062, test_loss: 1.0088, test_f1: 0.4999
 epoch: 84, train_loss: 0.8897, test_loss: 1.0340, test_f1: 0.4796
 epoch: 85, train_loss: 0.8915, test_loss: 1.0387, test_f1: 0.4935
 epoch: 86, train_loss: 0.8980, test_loss: 1.0303, test_f1: 0.5050
 epoch: 87, train_loss: 0.8924, test_loss: 1.0392, test_f1: 0.5236
 epoch: 88, train_loss: 0.9034, test_loss: 1.0287, test_f1: 0.5004
 epoch: 89, train_loss: 0.9015, test_loss: 1.0145, test_f1: 0.5233
 epoch: 90, train_loss: 0.8888, test_loss: 1.0223, test_f1: 0.5318
 epoch: 91, train_loss: 0.8849, test_loss: 1.0208, test_f1: 0.4980
 epoch: 92, train_loss: 0.8999, test_loss: 1.0313, test_f1: 0.4897
 epoch: 93, train_loss: 0.8940, test_loss: 1.0107, test_f1: 0.5248
 epoch: 94, train_loss: 0.8991, test_loss: 1.0131, test_f1: 0.4989
 epoch: 95, train_loss: 0.8914, test_loss: 1.0099, test_f1: 0.4958
 epoch: 96, train_loss: 0.8709, test_loss: 1.0215, test_f1: 0.5011
 epoch: 97, train_loss: 0.8865, test_loss: 1.0174, test_f1: 0.5039
 epoch: 98, train_loss: 0.8653, test_loss: 1.0207, test_f1: 0.4952
 epoch: 99, train_loss: 0.8803, test_loss: 1.0194, test_f1: 0.5182
##################ITERATION #1 ****************************************
 epoch: 0, train_loss: 1.3047, test_loss: 1.2836, test_f1: 0.2274
 epoch: 1, train_loss: 1.2630, test_loss: 1.2509, test_f1: 0.2545
 epoch: 2, train_loss: 1.2414, test_loss: 1.2235, test_f1: 0.3016
 epoch: 3, train_loss: 1.2281, test_loss: 1.2017, test_f1: 0.3344
 epoch: 4, train_loss: 1.2093, test_loss: 1.1817, test_f1: 0.4003
 epoch: 5, train_loss: 1.2004, test_loss: 1.1570, test_f1: 0.4192
 epoch: 6, train_loss: 1.1758, test_loss: 1.1407, test_f1: 0.4181
 epoch: 7, train_loss: 1.1598, test_loss: 1.1212, test_f1: 0.4238
 epoch: 8, train_loss: 1.1513, test_loss: 1.1052, test_f1: 0.4197
 epoch: 9, train_loss: 1.1432, test_loss: 1.1081, test_f1: 0.4151
 epoch: 10, train_loss: 1.1324, test_loss: 1.0777, test_f1: 0.4433
 epoch: 11, train_loss: 1.1099, test_loss: 1.0714, test_f1: 0.4561
 epoch: 12, train_loss: 1.1086, test_loss: 1.0579, test_f1: 0.4527
 epoch: 13, train_loss: 1.0948, test_loss: 1.0621, test_f1: 0.4575
 epoch: 14, train_loss: 1.0869, test_loss: 1.0643, test_f1: 0.4436
 epoch: 15, train_loss: 1.0809, test_loss: 1.0593, test_f1: 0.4431
 epoch: 16, train_loss: 1.0774, test_loss: 1.0715, test_f1: 0.4275
 epoch: 17, train_loss: 1.0623, test_loss: 1.0311, test_f1: 0.4546
 epoch: 18, train_loss: 1.0607, test_loss: 1.0199, test_f1: 0.4473
 epoch: 19, train_loss: 1.0510, test_loss: 1.0364, test_f1: 0.4573
 epoch: 20, train_loss: 1.0480, test_loss: 1.0111, test_f1: 0.4685
 epoch: 21, train_loss: 1.0363, test_loss: 1.0179, test_f1: 0.4606
 epoch: 22, train_loss: 1.0394, test_loss: 1.0094, test_f1: 0.4672
 epoch: 23, train_loss: 1.0306, test_loss: 0.9712, test_f1: 0.4868
 epoch: 24, train_loss: 1.0211, test_loss: 1.0030, test_f1: 0.4695
 epoch: 25, train_loss: 1.0209, test_loss: 1.0150, test_f1: 0.4721
 epoch: 26, train_loss: 1.0179, test_loss: 1.0138, test_f1: 0.4847
 epoch: 27, train_loss: 0.9971, test_loss: 0.9839, test_f1: 0.4755
 epoch: 28, train_loss: 1.0035, test_loss: 0.9746, test_f1: 0.4794
 epoch: 29, train_loss: 1.0032, test_loss: 0.9898, test_f1: 0.4764
 epoch: 30, train_loss: 0.9909, test_loss: 1.0394, test_f1: 0.4655
 epoch: 31, train_loss: 0.9954, test_loss: 1.0126, test_f1: 0.4679
 epoch: 32, train_loss: 0.9838, test_loss: 1.0214, test_f1: 0.4720
 epoch: 33, train_loss: 0.9719, test_loss: 0.9923, test_f1: 0.4827
 epoch: 34, train_loss: 0.9659, test_loss: 0.9978, test_f1: 0.4813
 epoch: 35, train_loss: 0.9593, test_loss: 1.0391, test_f1: 0.4671
 epoch: 36, train_loss: 0.9714, test_loss: 0.9937, test_f1: 0.4822
 epoch: 37, train_loss: 0.9561, test_loss: 1.0535, test_f1: 0.4708
 epoch: 38, train_loss: 0.9642, test_loss: 1.0100, test_f1: 0.4903
 epoch: 39, train_loss: 0.9546, test_loss: 0.9640, test_f1: 0.4919
 epoch: 40, train_loss: 0.9495, test_loss: 1.0589, test_f1: 0.4546
 epoch: 41, train_loss: 0.9559, test_loss: 1.0070, test_f1: 0.4816
 epoch: 42, train_loss: 0.9345, test_loss: 0.9789, test_f1: 0.4770
 epoch: 43, train_loss: 0.9413, test_loss: 1.0148, test_f1: 0.4745
 epoch: 44, train_loss: 0.9337, test_loss: 0.9642, test_f1: 0.4749
 epoch: 45, train_loss: 0.9436, test_loss: 1.0055, test_f1: 0.4693
 epoch: 46, train_loss: 0.9328, test_loss: 0.9945, test_f1: 0.4837
 epoch: 47, train_loss: 0.9118, test_loss: 1.0243, test_f1: 0.4779
 epoch: 48, train_loss: 0.9295, test_loss: 1.0263, test_f1: 0.4807
 epoch: 49, train_loss: 0.9257, test_loss: 0.9647, test_f1: 0.4848
 epoch: 50, train_loss: 0.9182, test_loss: 1.0519, test_f1: 0.4679
 epoch: 51, train_loss: 0.9127, test_loss: 1.0077, test_f1: 0.4786
 epoch: 52, train_loss: 0.9118, test_loss: 1.0477, test_f1: 0.4692
 epoch: 53, train_loss: 0.9186, test_loss: 1.0265, test_f1: 0.4862
 epoch: 54, train_loss: 0.8958, test_loss: 1.0188, test_f1: 0.4782
 epoch: 55, train_loss: 0.9059, test_loss: 1.0255, test_f1: 0.4646
 epoch: 56, train_loss: 0.8989, test_loss: 1.0184, test_f1: 0.4817
 epoch: 57, train_loss: 0.9066, test_loss: 1.0237, test_f1: 0.4825
 epoch: 58, train_loss: 0.9007, test_loss: 1.0151, test_f1: 0.4734
 epoch: 59, train_loss: 0.9042, test_loss: 1.0185, test_f1: 0.4768
 epoch: 60, train_loss: 0.9022, test_loss: 1.0356, test_f1: 0.4728
 epoch: 61, train_loss: 0.8930, test_loss: 1.0363, test_f1: 0.4859
 epoch: 62, train_loss: 0.8918, test_loss: 1.0236, test_f1: 0.4712
 epoch: 63, train_loss: 0.8902, test_loss: 1.0372, test_f1: 0.4848
 epoch: 64, train_loss: 0.8907, test_loss: 1.0373, test_f1: 0.4706
 epoch: 65, train_loss: 0.8880, test_loss: 1.0593, test_f1: 0.4892
 epoch: 66, train_loss: 0.8980, test_loss: 1.0171, test_f1: 0.4804
 epoch: 67, train_loss: 0.8875, test_loss: 1.0388, test_f1: 0.4673
 epoch: 68, train_loss: 0.8976, test_loss: 1.1092, test_f1: 0.4440
 epoch: 69, train_loss: 0.8843, test_loss: 1.0008, test_f1: 0.4882
 epoch: 70, train_loss: 0.8879, test_loss: 1.0327, test_f1: 0.4875
 epoch: 71, train_loss: 0.8800, test_loss: 1.0656, test_f1: 0.4623
 epoch: 72, train_loss: 0.8758, test_loss: 1.0393, test_f1: 0.4665
 epoch: 73, train_loss: 0.8833, test_loss: 1.0509, test_f1: 0.4676
 epoch: 74, train_loss: 0.8850, test_loss: 1.0006, test_f1: 0.4772
 epoch: 75, train_loss: 0.8750, test_loss: 1.0370, test_f1: 0.4800
 epoch: 76, train_loss: 0.8745, test_loss: 1.0433, test_f1: 0.4691
 epoch: 77, train_loss: 0.8652, test_loss: 1.0227, test_f1: 0.4821
 epoch: 78, train_loss: 0.8839, test_loss: 1.0586, test_f1: 0.4667
 epoch: 79, train_loss: 0.8740, test_loss: 1.0550, test_f1: 0.4603
 epoch: 80, train_loss: 0.8746, test_loss: 1.0460, test_f1: 0.4569
 epoch: 81, train_loss: 0.8698, test_loss: 0.9933, test_f1: 0.4743
 epoch: 82, train_loss: 0.8613, test_loss: 1.0650, test_f1: 0.4554
 epoch: 83, train_loss: 0.8763, test_loss: 1.0299, test_f1: 0.4688
 epoch: 84, train_loss: 0.8689, test_loss: 1.0314, test_f1: 0.4802
 epoch: 85, train_loss: 0.8729, test_loss: 1.0605, test_f1: 0.4524
 epoch: 86, train_loss: 0.8688, test_loss: 1.0331, test_f1: 0.4685
 epoch: 87, train_loss: 0.8726, test_loss: 1.1017, test_f1: 0.4410
 epoch: 88, train_loss: 0.8624, test_loss: 1.0475, test_f1: 0.4779
 epoch: 89, train_loss: 0.8673, test_loss: 1.0436, test_f1: 0.4726
 epoch: 90, train_loss: 0.8671, test_loss: 1.0405, test_f1: 0.4803
 epoch: 91, train_loss: 0.8635, test_loss: 1.0334, test_f1: 0.4732
 epoch: 92, train_loss: 0.8703, test_loss: 1.0214, test_f1: 0.4654
 epoch: 93, train_loss: 0.8586, test_loss: 1.0756, test_f1: 0.4662
 epoch: 94, train_loss: 0.8566, test_loss: 1.0689, test_f1: 0.4613
 epoch: 95, train_loss: 0.8670, test_loss: 1.0333, test_f1: 0.4705
 epoch: 96, train_loss: 0.8584, test_loss: 1.0332, test_f1: 0.4730
 epoch: 97, train_loss: 0.8492, test_loss: 1.0204, test_f1: 0.4786
 epoch: 98, train_loss: 0.8493, test_loss: 1.0659, test_f1: 0.4436
 epoch: 99, train_loss: 0.8410, test_loss: 1.0286, test_f1: 0.4663
##################ITERATION #2 ****************************************
 epoch: 0, train_loss: 1.3027, test_loss: 1.2791, test_f1: 0.2274
 epoch: 1, train_loss: 1.2583, test_loss: 1.2384, test_f1: 0.2790
 epoch: 2, train_loss: 1.2510, test_loss: 1.2203, test_f1: 0.3046
 epoch: 3, train_loss: 1.2370, test_loss: 1.2082, test_f1: 0.3355
 epoch: 4, train_loss: 1.2292, test_loss: 1.2012, test_f1: 0.3492
 epoch: 5, train_loss: 1.2139, test_loss: 1.1823, test_f1: 0.3619
 epoch: 6, train_loss: 1.2072, test_loss: 1.1685, test_f1: 0.3704
 epoch: 7, train_loss: 1.1967, test_loss: 1.1564, test_f1: 0.3832
 epoch: 8, train_loss: 1.1861, test_loss: 1.1386, test_f1: 0.3907
 epoch: 9, train_loss: 1.1758, test_loss: 1.1316, test_f1: 0.3821
 epoch: 10, train_loss: 1.1698, test_loss: 1.1264, test_f1: 0.4101
 epoch: 11, train_loss: 1.1580, test_loss: 1.1064, test_f1: 0.4310
 epoch: 12, train_loss: 1.1408, test_loss: 1.0909, test_f1: 0.4198
 epoch: 13, train_loss: 1.1326, test_loss: 1.0855, test_f1: 0.4156
 epoch: 14, train_loss: 1.1257, test_loss: 1.0695, test_f1: 0.4393
 epoch: 15, train_loss: 1.1072, test_loss: 1.0590, test_f1: 0.4341
 epoch: 16, train_loss: 1.0990, test_loss: 1.0583, test_f1: 0.4312
 epoch: 17, train_loss: 1.0921, test_loss: 1.0413, test_f1: 0.4476
 epoch: 18, train_loss: 1.0918, test_loss: 1.0370, test_f1: 0.4547
 epoch: 19, train_loss: 1.0794, test_loss: 1.0380, test_f1: 0.4286
 epoch: 20, train_loss: 1.0647, test_loss: 1.0502, test_f1: 0.4446
 epoch: 21, train_loss: 1.0583, test_loss: 1.0878, test_f1: 0.4458
 epoch: 22, train_loss: 1.0517, test_loss: 1.0719, test_f1: 0.4361
 epoch: 23, train_loss: 1.0404, test_loss: 1.0221, test_f1: 0.4591
 epoch: 24, train_loss: 1.0475, test_loss: 0.9927, test_f1: 0.4643
 epoch: 25, train_loss: 1.0247, test_loss: 1.0059, test_f1: 0.4398
 epoch: 26, train_loss: 1.0176, test_loss: 1.0334, test_f1: 0.4496
 epoch: 27, train_loss: 1.0257, test_loss: 0.9924, test_f1: 0.4514
 epoch: 28, train_loss: 1.0155, test_loss: 1.0453, test_f1: 0.4585
 epoch: 29, train_loss: 1.0101, test_loss: 0.9809, test_f1: 0.4564
 epoch: 30, train_loss: 1.0101, test_loss: 0.9754, test_f1: 0.4833
 epoch: 31, train_loss: 0.9977, test_loss: 0.9782, test_f1: 0.4569
 epoch: 32, train_loss: 0.9995, test_loss: 0.9825, test_f1: 0.4530
 epoch: 33, train_loss: 1.0033, test_loss: 0.9795, test_f1: 0.4624
 epoch: 34, train_loss: 0.9903, test_loss: 0.9833, test_f1: 0.4574
 epoch: 35, train_loss: 0.9909, test_loss: 0.9856, test_f1: 0.4586
 epoch: 36, train_loss: 0.9875, test_loss: 0.9549, test_f1: 0.4804
 epoch: 37, train_loss: 0.9689, test_loss: 1.0029, test_f1: 0.4555
 epoch: 38, train_loss: 0.9710, test_loss: 0.9847, test_f1: 0.4519
 epoch: 39, train_loss: 0.9661, test_loss: 0.9735, test_f1: 0.4686
 epoch: 40, train_loss: 0.9514, test_loss: 0.9930, test_f1: 0.4524
 epoch: 41, train_loss: 0.9637, test_loss: 0.9524, test_f1: 0.4825
 epoch: 42, train_loss: 0.9571, test_loss: 1.0284, test_f1: 0.4567
 epoch: 43, train_loss: 0.9547, test_loss: 0.9661, test_f1: 0.4690
 epoch: 44, train_loss: 0.9537, test_loss: 0.9657, test_f1: 0.4771
 epoch: 45, train_loss: 0.9403, test_loss: 0.9830, test_f1: 0.4799
 epoch: 46, train_loss: 0.9270, test_loss: 0.9687, test_f1: 0.4647
 epoch: 47, train_loss: 0.9370, test_loss: 0.9763, test_f1: 0.4672
 epoch: 48, train_loss: 0.9368, test_loss: 0.9599, test_f1: 0.4646
 epoch: 49, train_loss: 0.9235, test_loss: 0.9803, test_f1: 0.4635
 epoch: 50, train_loss: 0.9177, test_loss: 0.9967, test_f1: 0.4583
 epoch: 51, train_loss: 0.9146, test_loss: 0.9615, test_f1: 0.4644
 epoch: 52, train_loss: 0.9138, test_loss: 0.9744, test_f1: 0.4626
 epoch: 53, train_loss: 0.9171, test_loss: 0.9515, test_f1: 0.4757
 epoch: 54, train_loss: 0.9130, test_loss: 0.9699, test_f1: 0.4696
 epoch: 55, train_loss: 0.9079, test_loss: 0.9863, test_f1: 0.4587
 epoch: 56, train_loss: 0.9113, test_loss: 0.9860, test_f1: 0.4654
 epoch: 57, train_loss: 0.9132, test_loss: 0.9912, test_f1: 0.4527
 epoch: 58, train_loss: 0.9083, test_loss: 1.0003, test_f1: 0.4551
 epoch: 59, train_loss: 0.9101, test_loss: 1.0041, test_f1: 0.4660
 epoch: 60, train_loss: 0.8948, test_loss: 1.0129, test_f1: 0.4590
 epoch: 61, train_loss: 0.9011, test_loss: 0.9842, test_f1: 0.4661
 epoch: 62, train_loss: 0.8969, test_loss: 0.9958, test_f1: 0.4610
 epoch: 63, train_loss: 0.9035, test_loss: 1.0126, test_f1: 0.4566
 epoch: 64, train_loss: 0.8984, test_loss: 1.0102, test_f1: 0.4677
 epoch: 65, train_loss: 0.8833, test_loss: 1.0207, test_f1: 0.4652
 epoch: 66, train_loss: 0.8878, test_loss: 0.9765, test_f1: 0.4679
 epoch: 67, train_loss: 0.9006, test_loss: 0.9896, test_f1: 0.4701
 epoch: 68, train_loss: 0.8832, test_loss: 1.0023, test_f1: 0.4619
 epoch: 69, train_loss: 0.8936, test_loss: 0.9801, test_f1: 0.4585
 epoch: 70, train_loss: 0.8818, test_loss: 0.9889, test_f1: 0.4659
 epoch: 71, train_loss: 0.8854, test_loss: 1.0155, test_f1: 0.4618
 epoch: 72, train_loss: 0.8866, test_loss: 1.0073, test_f1: 0.4687
 epoch: 73, train_loss: 0.8775, test_loss: 1.0119, test_f1: 0.4557
 epoch: 74, train_loss: 0.8782, test_loss: 0.9628, test_f1: 0.4688
 epoch: 75, train_loss: 0.8799, test_loss: 1.0417, test_f1: 0.4579
 epoch: 76, train_loss: 0.8918, test_loss: 0.9917, test_f1: 0.4564
 epoch: 77, train_loss: 0.8798, test_loss: 1.0279, test_f1: 0.4577
 epoch: 78, train_loss: 0.8856, test_loss: 1.0305, test_f1: 0.4601
 epoch: 79, train_loss: 0.8708, test_loss: 1.0336, test_f1: 0.4660
 epoch: 80, train_loss: 0.8636, test_loss: 1.0297, test_f1: 0.4551
 epoch: 81, train_loss: 0.8804, test_loss: 1.0057, test_f1: 0.4568
 epoch: 82, train_loss: 0.8611, test_loss: 1.0183, test_f1: 0.4531
 epoch: 83, train_loss: 0.8650, test_loss: 1.0346, test_f1: 0.4507
 epoch: 84, train_loss: 0.8646, test_loss: 1.0203, test_f1: 0.4677
 epoch: 85, train_loss: 0.8708, test_loss: 1.0110, test_f1: 0.4663
 epoch: 86, train_loss: 0.8687, test_loss: 1.0248, test_f1: 0.4598
 epoch: 87, train_loss: 0.8634, test_loss: 1.0070, test_f1: 0.4657
 epoch: 88, train_loss: 0.8720, test_loss: 1.0386, test_f1: 0.4717
 epoch: 89, train_loss: 0.8598, test_loss: 1.0287, test_f1: 0.4662
 epoch: 90, train_loss: 0.8504, test_loss: 1.0432, test_f1: 0.4530
 epoch: 91, train_loss: 0.8499, test_loss: 1.0873, test_f1: 0.4757
 epoch: 92, train_loss: 0.8636, test_loss: 1.0540, test_f1: 0.4765
 epoch: 93, train_loss: 0.8567, test_loss: 1.0507, test_f1: 0.4596
 epoch: 94, train_loss: 0.8643, test_loss: 1.0230, test_f1: 0.4638
 epoch: 95, train_loss: 0.8590, test_loss: 1.0537, test_f1: 0.4742
 epoch: 96, train_loss: 0.8491, test_loss: 1.0439, test_f1: 0.4571
 epoch: 97, train_loss: 0.8475, test_loss: 1.0169, test_f1: 0.4623
 epoch: 98, train_loss: 0.8577, test_loss: 1.0571, test_f1: 0.4596
 epoch: 99, train_loss: 0.8623, test_loss: 1.0681, test_f1: 0.4762
##################ITERATION #3 ****************************************
 epoch: 0, train_loss: 1.3004, test_loss: 1.2860, test_f1: 0.2274
 epoch: 1, train_loss: 1.2504, test_loss: 1.2263, test_f1: 0.2390
 epoch: 2, train_loss: 1.2283, test_loss: 1.1885, test_f1: 0.3559
 epoch: 3, train_loss: 1.2119, test_loss: 1.1667, test_f1: 0.3484
 epoch: 4, train_loss: 1.2094, test_loss: 1.1518, test_f1: 0.3867
 epoch: 5, train_loss: 1.1883, test_loss: 1.1307, test_f1: 0.4116
 epoch: 6, train_loss: 1.1669, test_loss: 1.1034, test_f1: 0.4431
 epoch: 7, train_loss: 1.1557, test_loss: 1.0893, test_f1: 0.4313
 epoch: 8, train_loss: 1.1618, test_loss: 1.0852, test_f1: 0.4233
 epoch: 9, train_loss: 1.1498, test_loss: 1.0664, test_f1: 0.4317
 epoch: 10, train_loss: 1.1272, test_loss: 1.0668, test_f1: 0.4282
 epoch: 11, train_loss: 1.1255, test_loss: 1.0540, test_f1: 0.4368
 epoch: 12, train_loss: 1.1053, test_loss: 1.0473, test_f1: 0.4395
 epoch: 13, train_loss: 1.1037, test_loss: 1.0254, test_f1: 0.4647
 epoch: 14, train_loss: 1.1007, test_loss: 1.0351, test_f1: 0.4495
 epoch: 15, train_loss: 1.0849, test_loss: 1.0008, test_f1: 0.4583
 epoch: 16, train_loss: 1.0731, test_loss: 1.0040, test_f1: 0.4529
 epoch: 17, train_loss: 1.0790, test_loss: 0.9918, test_f1: 0.4740
 epoch: 18, train_loss: 1.0712, test_loss: 0.9906, test_f1: 0.4720
 epoch: 19, train_loss: 1.0633, test_loss: 0.9716, test_f1: 0.4603
 epoch: 20, train_loss: 1.0609, test_loss: 1.0166, test_f1: 0.4498
 epoch: 21, train_loss: 1.0545, test_loss: 0.9587, test_f1: 0.4753
 epoch: 22, train_loss: 1.0431, test_loss: 1.0137, test_f1: 0.4491
 epoch: 23, train_loss: 1.0367, test_loss: 0.9699, test_f1: 0.4750
 epoch: 24, train_loss: 1.0317, test_loss: 0.9709, test_f1: 0.4697
 epoch: 25, train_loss: 1.0223, test_loss: 0.9538, test_f1: 0.4858
 epoch: 26, train_loss: 1.0118, test_loss: 0.9556, test_f1: 0.4796
 epoch: 27, train_loss: 1.0075, test_loss: 0.9470, test_f1: 0.4658
 epoch: 28, train_loss: 1.0025, test_loss: 0.9940, test_f1: 0.4692
 epoch: 29, train_loss: 1.0018, test_loss: 0.9374, test_f1: 0.4806
 epoch: 30, train_loss: 0.9913, test_loss: 0.9409, test_f1: 0.4840
 epoch: 31, train_loss: 0.9932, test_loss: 0.9566, test_f1: 0.4770
 epoch: 32, train_loss: 0.9784, test_loss: 0.9337, test_f1: 0.4836
 epoch: 33, train_loss: 0.9781, test_loss: 0.9260, test_f1: 0.4803
 epoch: 34, train_loss: 0.9756, test_loss: 1.1197, test_f1: 0.4694
 epoch: 35, train_loss: 0.9699, test_loss: 0.9493, test_f1: 0.4900
 epoch: 36, train_loss: 0.9697, test_loss: 0.9874, test_f1: 0.4772
 epoch: 37, train_loss: 0.9663, test_loss: 0.9270, test_f1: 0.4808
 epoch: 38, train_loss: 0.9659, test_loss: 0.9133, test_f1: 0.5041
 epoch: 39, train_loss: 0.9692, test_loss: 0.9576, test_f1: 0.4763
 epoch: 40, train_loss: 0.9516, test_loss: 0.9267, test_f1: 0.4909
 epoch: 41, train_loss: 0.9503, test_loss: 0.9386, test_f1: 0.4982
 epoch: 42, train_loss: 0.9429, test_loss: 0.9717, test_f1: 0.4791
 epoch: 43, train_loss: 0.9487, test_loss: 0.9371, test_f1: 0.5035
 epoch: 44, train_loss: 0.9292, test_loss: 1.0137, test_f1: 0.4652
 epoch: 45, train_loss: 0.9410, test_loss: 0.9358, test_f1: 0.5070
 epoch: 46, train_loss: 0.9440, test_loss: 0.9637, test_f1: 0.4665
 epoch: 47, train_loss: 0.9323, test_loss: 0.9385, test_f1: 0.4889
 epoch: 48, train_loss: 0.9286, test_loss: 0.9380, test_f1: 0.4820
 epoch: 49, train_loss: 0.9284, test_loss: 0.9423, test_f1: 0.4943
 epoch: 50, train_loss: 0.9266, test_loss: 1.0022, test_f1: 0.4711
 epoch: 51, train_loss: 0.9152, test_loss: 0.9558, test_f1: 0.4830
 epoch: 52, train_loss: 0.9110, test_loss: 0.9496, test_f1: 0.4850
 epoch: 53, train_loss: 0.9144, test_loss: 0.9608, test_f1: 0.4925
 epoch: 54, train_loss: 0.9106, test_loss: 0.9442, test_f1: 0.4918
 epoch: 55, train_loss: 0.9017, test_loss: 0.9325, test_f1: 0.4927
 epoch: 56, train_loss: 0.9012, test_loss: 0.9437, test_f1: 0.4975
 epoch: 57, train_loss: 0.8984, test_loss: 0.9133, test_f1: 0.4966
 epoch: 58, train_loss: 0.9053, test_loss: 0.9466, test_f1: 0.4983
 epoch: 59, train_loss: 0.9059, test_loss: 0.9480, test_f1: 0.4950
 epoch: 60, train_loss: 0.8944, test_loss: 0.9373, test_f1: 0.5062
 epoch: 61, train_loss: 0.8976, test_loss: 0.9505, test_f1: 0.4879
 epoch: 62, train_loss: 0.8989, test_loss: 0.9537, test_f1: 0.4985
 epoch: 63, train_loss: 0.8888, test_loss: 0.9364, test_f1: 0.5128
 epoch: 64, train_loss: 0.8977, test_loss: 0.9437, test_f1: 0.5147
 epoch: 65, train_loss: 0.8852, test_loss: 0.9532, test_f1: 0.5017
 epoch: 66, train_loss: 0.8869, test_loss: 0.9546, test_f1: 0.5045
 epoch: 67, train_loss: 0.8871, test_loss: 0.9596, test_f1: 0.5123
 epoch: 68, train_loss: 0.8911, test_loss: 0.9477, test_f1: 0.4892
 epoch: 69, train_loss: 0.8975, test_loss: 0.9595, test_f1: 0.4924
 epoch: 70, train_loss: 0.8870, test_loss: 0.9515, test_f1: 0.5015
 epoch: 71, train_loss: 0.8926, test_loss: 0.9494, test_f1: 0.4993
 epoch: 72, train_loss: 0.8863, test_loss: 0.9566, test_f1: 0.5022
 epoch: 73, train_loss: 0.8809, test_loss: 0.9691, test_f1: 0.5004
 epoch: 74, train_loss: 0.8816, test_loss: 0.9711, test_f1: 0.4898
 epoch: 75, train_loss: 0.8782, test_loss: 0.9692, test_f1: 0.4880
 epoch: 76, train_loss: 0.8812, test_loss: 0.9622, test_f1: 0.4929
 epoch: 77, train_loss: 0.8862, test_loss: 0.9644, test_f1: 0.5019
 epoch: 78, train_loss: 0.8742, test_loss: 0.9692, test_f1: 0.5050
 epoch: 79, train_loss: 0.8706, test_loss: 0.9569, test_f1: 0.5007
 epoch: 80, train_loss: 0.8651, test_loss: 0.9634, test_f1: 0.4991
 epoch: 81, train_loss: 0.8790, test_loss: 0.9706, test_f1: 0.4965
 epoch: 82, train_loss: 0.8791, test_loss: 0.9893, test_f1: 0.4899
 epoch: 83, train_loss: 0.8858, test_loss: 0.9790, test_f1: 0.4911
 epoch: 84, train_loss: 0.8649, test_loss: 0.9702, test_f1: 0.4985
 epoch: 85, train_loss: 0.8693, test_loss: 0.9652, test_f1: 0.4975
 epoch: 86, train_loss: 0.8740, test_loss: 0.9586, test_f1: 0.4861
 epoch: 87, train_loss: 0.8690, test_loss: 0.9719, test_f1: 0.4919
 epoch: 88, train_loss: 0.8625, test_loss: 0.9746, test_f1: 0.5045
 epoch: 89, train_loss: 0.8508, test_loss: 0.9630, test_f1: 0.4992
 epoch: 90, train_loss: 0.8487, test_loss: 0.9707, test_f1: 0.4984
 epoch: 91, train_loss: 0.8695, test_loss: 0.9693, test_f1: 0.5101
 epoch: 92, train_loss: 0.8556, test_loss: 0.9506, test_f1: 0.5028
 epoch: 93, train_loss: 0.8540, test_loss: 0.9749, test_f1: 0.5184
 epoch: 94, train_loss: 0.8593, test_loss: 0.9686, test_f1: 0.5043
 epoch: 95, train_loss: 0.8562, test_loss: 0.9668, test_f1: 0.4881
 epoch: 96, train_loss: 0.8610, test_loss: 0.9627, test_f1: 0.5061
 epoch: 97, train_loss: 0.8580, test_loss: 0.9624, test_f1: 0.5168
 epoch: 98, train_loss: 0.8525, test_loss: 0.9954, test_f1: 0.5092
 epoch: 99, train_loss: 0.8527, test_loss: 1.0427, test_f1: 0.4794
##################ITERATION #4 ****************************************
 epoch: 0, train_loss: 1.3089, test_loss: 1.2967, test_f1: 0.2274
 epoch: 1, train_loss: 1.2580, test_loss: 1.2312, test_f1: 0.3025
 epoch: 2, train_loss: 1.2487, test_loss: 1.1996, test_f1: 0.3311
 epoch: 3, train_loss: 1.2327, test_loss: 1.1905, test_f1: 0.3559
 epoch: 4, train_loss: 1.2266, test_loss: 1.1862, test_f1: 0.3669
 epoch: 5, train_loss: 1.2173, test_loss: 1.1751, test_f1: 0.3612
 epoch: 6, train_loss: 1.2101, test_loss: 1.1580, test_f1: 0.3900
 epoch: 7, train_loss: 1.1960, test_loss: 1.1526, test_f1: 0.3738
 epoch: 8, train_loss: 1.1903, test_loss: 1.1328, test_f1: 0.4006
 epoch: 9, train_loss: 1.1725, test_loss: 1.1205, test_f1: 0.4130
 epoch: 10, train_loss: 1.1682, test_loss: 1.1166, test_f1: 0.4200
 epoch: 11, train_loss: 1.1635, test_loss: 1.1090, test_f1: 0.4121
 epoch: 12, train_loss: 1.1497, test_loss: 1.0945, test_f1: 0.4179
 epoch: 13, train_loss: 1.1476, test_loss: 1.0829, test_f1: 0.4175
 epoch: 14, train_loss: 1.1325, test_loss: 1.0679, test_f1: 0.4189
 epoch: 15, train_loss: 1.1370, test_loss: 1.0782, test_f1: 0.4335
 epoch: 16, train_loss: 1.1170, test_loss: 1.0508, test_f1: 0.4321
 epoch: 17, train_loss: 1.1112, test_loss: 1.0399, test_f1: 0.4330
 epoch: 18, train_loss: 1.0991, test_loss: 1.0384, test_f1: 0.4479
 epoch: 19, train_loss: 1.1058, test_loss: 1.0476, test_f1: 0.4154
 epoch: 20, train_loss: 1.0965, test_loss: 1.0117, test_f1: 0.4621
 epoch: 21, train_loss: 1.0929, test_loss: 1.0231, test_f1: 0.4372
 epoch: 22, train_loss: 1.0767, test_loss: 1.0231, test_f1: 0.4388
 epoch: 23, train_loss: 1.0748, test_loss: 1.0479, test_f1: 0.4466
 epoch: 24, train_loss: 1.0620, test_loss: 1.0010, test_f1: 0.4484
 epoch: 25, train_loss: 1.0657, test_loss: 1.0322, test_f1: 0.4366
 epoch: 26, train_loss: 1.0601, test_loss: 1.0086, test_f1: 0.4463
 epoch: 27, train_loss: 1.0550, test_loss: 1.0172, test_f1: 0.4529
 epoch: 28, train_loss: 1.0443, test_loss: 1.0032, test_f1: 0.4604
 epoch: 29, train_loss: 1.0360, test_loss: 0.9997, test_f1: 0.4602
 epoch: 30, train_loss: 1.0369, test_loss: 1.0227, test_f1: 0.4585
 epoch: 31, train_loss: 1.0361, test_loss: 1.0193, test_f1: 0.4523
 epoch: 32, train_loss: 1.0362, test_loss: 0.9945, test_f1: 0.4586
 epoch: 33, train_loss: 1.0194, test_loss: 1.0264, test_f1: 0.4556
 epoch: 34, train_loss: 1.0252, test_loss: 1.0049, test_f1: 0.4626
 epoch: 35, train_loss: 1.0140, test_loss: 1.0262, test_f1: 0.4587
 epoch: 36, train_loss: 1.0044, test_loss: 1.0217, test_f1: 0.4554
 epoch: 37, train_loss: 1.0054, test_loss: 1.0052, test_f1: 0.4586
 epoch: 38, train_loss: 1.0046, test_loss: 1.0362, test_f1: 0.4555
 epoch: 39, train_loss: 0.9968, test_loss: 1.0615, test_f1: 0.4490
 epoch: 40, train_loss: 1.0029, test_loss: 1.0004, test_f1: 0.4653
 epoch: 41, train_loss: 0.9944, test_loss: 1.0268, test_f1: 0.4674
 epoch: 42, train_loss: 0.9766, test_loss: 1.0666, test_f1: 0.4452
 epoch: 43, train_loss: 0.9859, test_loss: 1.0413, test_f1: 0.4507
 epoch: 44, train_loss: 0.9766, test_loss: 1.0538, test_f1: 0.4571
 epoch: 45, train_loss: 0.9691, test_loss: 1.0295, test_f1: 0.4606
 epoch: 46, train_loss: 0.9733, test_loss: 1.0395, test_f1: 0.4563
 epoch: 47, train_loss: 0.9698, test_loss: 1.0550, test_f1: 0.4604
 epoch: 48, train_loss: 0.9602, test_loss: 1.0256, test_f1: 0.4612
 epoch: 49, train_loss: 0.9627, test_loss: 1.0392, test_f1: 0.4439
 epoch: 50, train_loss: 0.9570, test_loss: 1.0003, test_f1: 0.4705
 epoch: 51, train_loss: 0.9416, test_loss: 1.0397, test_f1: 0.4702
 epoch: 52, train_loss: 0.9451, test_loss: 1.0430, test_f1: 0.4629
 epoch: 53, train_loss: 0.9413, test_loss: 1.0261, test_f1: 0.4702
 epoch: 54, train_loss: 0.9423, test_loss: 1.0538, test_f1: 0.4639
 epoch: 55, train_loss: 0.9375, test_loss: 1.0586, test_f1: 0.4571
 epoch: 56, train_loss: 0.9400, test_loss: 1.0452, test_f1: 0.4632
 epoch: 57, train_loss: 0.9439, test_loss: 1.0649, test_f1: 0.4640
 epoch: 58, train_loss: 0.9297, test_loss: 1.0275, test_f1: 0.4654
 epoch: 59, train_loss: 0.9283, test_loss: 1.0463, test_f1: 0.4538
 epoch: 60, train_loss: 0.9280, test_loss: 1.0354, test_f1: 0.4656
 epoch: 61, train_loss: 0.9465, test_loss: 1.0347, test_f1: 0.4701
 epoch: 62, train_loss: 0.9337, test_loss: 1.0393, test_f1: 0.4586
 epoch: 63, train_loss: 0.9233, test_loss: 1.0491, test_f1: 0.4489
 epoch: 64, train_loss: 0.9298, test_loss: 1.0624, test_f1: 0.4534
 epoch: 65, train_loss: 0.9229, test_loss: 1.0417, test_f1: 0.4533
 epoch: 66, train_loss: 0.9291, test_loss: 1.0537, test_f1: 0.4695
 epoch: 67, train_loss: 0.9272, test_loss: 1.0540, test_f1: 0.4581
 epoch: 68, train_loss: 0.9357, test_loss: 1.0693, test_f1: 0.4621
 epoch: 69, train_loss: 0.9228, test_loss: 1.0410, test_f1: 0.4578
 epoch: 70, train_loss: 0.9288, test_loss: 1.0413, test_f1: 0.4589
 epoch: 71, train_loss: 0.9273, test_loss: 1.0522, test_f1: 0.4615
 epoch: 72, train_loss: 0.9185, test_loss: 1.0539, test_f1: 0.4493
 epoch: 73, train_loss: 0.9234, test_loss: 1.0546, test_f1: 0.4630
 epoch: 74, train_loss: 0.9189, test_loss: 1.0316, test_f1: 0.4658
 epoch: 75, train_loss: 0.9226, test_loss: 1.0802, test_f1: 0.4600
 epoch: 76, train_loss: 0.9263, test_loss: 1.0347, test_f1: 0.4583
 epoch: 77, train_loss: 0.9181, test_loss: 1.0440, test_f1: 0.4599
 epoch: 78, train_loss: 0.9163, test_loss: 1.0376, test_f1: 0.4703
 epoch: 79, train_loss: 0.9090, test_loss: 1.0395, test_f1: 0.4601
 epoch: 80, train_loss: 0.9075, test_loss: 1.0465, test_f1: 0.4635
 epoch: 81, train_loss: 0.8997, test_loss: 1.0233, test_f1: 0.4628
 epoch: 82, train_loss: 0.8909, test_loss: 1.0710, test_f1: 0.4581
 epoch: 83, train_loss: 0.9000, test_loss: 1.0538, test_f1: 0.4577
 epoch: 84, train_loss: 0.9011, test_loss: 1.0462, test_f1: 0.4574
 epoch: 85, train_loss: 0.9197, test_loss: 1.0784, test_f1: 0.4543
 epoch: 86, train_loss: 0.9026, test_loss: 1.0419, test_f1: 0.4581
 epoch: 87, train_loss: 0.8939, test_loss: 1.0784, test_f1: 0.4510
 epoch: 88, train_loss: 0.9001, test_loss: 1.0639, test_f1: 0.4524
 epoch: 89, train_loss: 0.8986, test_loss: 1.0726, test_f1: 0.4511
 epoch: 90, train_loss: 0.8922, test_loss: 1.0442, test_f1: 0.4596
 epoch: 91, train_loss: 0.9002, test_loss: 1.0772, test_f1: 0.4632
 epoch: 92, train_loss: 0.9037, test_loss: 1.0509, test_f1: 0.4661
 epoch: 93, train_loss: 0.8820, test_loss: 1.0686, test_f1: 0.4494
 epoch: 94, train_loss: 0.9125, test_loss: 1.0689, test_f1: 0.4553
 epoch: 95, train_loss: 0.8923, test_loss: 1.0476, test_f1: 0.4643
 epoch: 96, train_loss: 0.8917, test_loss: 1.0796, test_f1: 0.4606
 epoch: 97, train_loss: 0.8962, test_loss: 1.0757, test_f1: 0.4555
 epoch: 98, train_loss: 0.8977, test_loss: 1.0362, test_f1: 0.4620
 epoch: 99, train_loss: 0.8818, test_loss: 1.0654, test_f1: 0.4526
##################ITERATION #5 ****************************************
 epoch: 0, train_loss: 1.4594, test_loss: 1.3202, test_f1: 0.2274
 epoch: 1, train_loss: 1.2908, test_loss: 1.2678, test_f1: 0.2496
 epoch: 2, train_loss: 1.2596, test_loss: 1.2346, test_f1: 0.3289
 epoch: 3, train_loss: 1.2422, test_loss: 1.2150, test_f1: 0.3268
 epoch: 4, train_loss: 1.2230, test_loss: 1.1891, test_f1: 0.3495
 epoch: 5, train_loss: 1.2088, test_loss: 1.1762, test_f1: 0.3672
 epoch: 6, train_loss: 1.1923, test_loss: 1.1630, test_f1: 0.3925
 epoch: 7, train_loss: 1.1724, test_loss: 1.1490, test_f1: 0.4254
 epoch: 8, train_loss: 1.1605, test_loss: 1.1259, test_f1: 0.4073
 epoch: 9, train_loss: 1.1622, test_loss: 1.1240, test_f1: 0.4187
 epoch: 10, train_loss: 1.1556, test_loss: 1.1049, test_f1: 0.4110
 epoch: 11, train_loss: 1.1469, test_loss: 1.0969, test_f1: 0.4250
 epoch: 12, train_loss: 1.1325, test_loss: 1.0861, test_f1: 0.4308
 epoch: 13, train_loss: 1.1217, test_loss: 1.0817, test_f1: 0.4254
 epoch: 14, train_loss: 1.1034, test_loss: 1.0674, test_f1: 0.4590
 epoch: 15, train_loss: 1.1110, test_loss: 1.0488, test_f1: 0.4550
 epoch: 16, train_loss: 1.1093, test_loss: 1.0500, test_f1: 0.4406
 epoch: 17, train_loss: 1.0974, test_loss: 1.0360, test_f1: 0.4701
 epoch: 18, train_loss: 1.0915, test_loss: 1.0499, test_f1: 0.4515
 epoch: 19, train_loss: 1.0706, test_loss: 1.0444, test_f1: 0.4606
 epoch: 20, train_loss: 1.0890, test_loss: 1.0154, test_f1: 0.4663
 epoch: 21, train_loss: 1.0826, test_loss: 1.0305, test_f1: 0.4481
 epoch: 22, train_loss: 1.0587, test_loss: 1.0230, test_f1: 0.4599
 epoch: 23, train_loss: 1.0576, test_loss: 1.0228, test_f1: 0.4677
 epoch: 24, train_loss: 1.0396, test_loss: 1.0092, test_f1: 0.4620
 epoch: 25, train_loss: 1.0535, test_loss: 1.0057, test_f1: 0.4595
 epoch: 26, train_loss: 1.0492, test_loss: 0.9932, test_f1: 0.4752
 epoch: 27, train_loss: 1.0403, test_loss: 1.0034, test_f1: 0.4678
 epoch: 28, train_loss: 1.0366, test_loss: 0.9971, test_f1: 0.4698
 epoch: 29, train_loss: 1.0216, test_loss: 0.9970, test_f1: 0.4706
 epoch: 30, train_loss: 1.0251, test_loss: 1.0193, test_f1: 0.4640
 epoch: 31, train_loss: 1.0130, test_loss: 0.9793, test_f1: 0.4689
 epoch: 32, train_loss: 1.0156, test_loss: 0.9876, test_f1: 0.4599
 epoch: 33, train_loss: 1.0111, test_loss: 0.9943, test_f1: 0.4549
 epoch: 34, train_loss: 1.0129, test_loss: 0.9915, test_f1: 0.4637
 epoch: 35, train_loss: 1.0011, test_loss: 0.9764, test_f1: 0.4589
 epoch: 36, train_loss: 0.9859, test_loss: 0.9886, test_f1: 0.4631
 epoch: 37, train_loss: 0.9914, test_loss: 0.9842, test_f1: 0.4619
 epoch: 38, train_loss: 0.9909, test_loss: 0.9770, test_f1: 0.4713
 epoch: 39, train_loss: 0.9814, test_loss: 0.9897, test_f1: 0.4651
 epoch: 40, train_loss: 0.9880, test_loss: 1.0081, test_f1: 0.4595
 epoch: 41, train_loss: 0.9709, test_loss: 0.9489, test_f1: 0.4838
 epoch: 42, train_loss: 0.9703, test_loss: 1.0105, test_f1: 0.4732
 epoch: 43, train_loss: 0.9779, test_loss: 0.9550, test_f1: 0.4798
 epoch: 44, train_loss: 0.9725, test_loss: 0.9832, test_f1: 0.4802
 epoch: 45, train_loss: 0.9695, test_loss: 0.9680, test_f1: 0.4712
 epoch: 46, train_loss: 0.9635, test_loss: 0.9441, test_f1: 0.4728
 epoch: 47, train_loss: 0.9646, test_loss: 0.9492, test_f1: 0.4870
 epoch: 48, train_loss: 0.9539, test_loss: 0.9567, test_f1: 0.4816
 epoch: 49, train_loss: 0.9577, test_loss: 1.0070, test_f1: 0.4746
 epoch: 50, train_loss: 0.9418, test_loss: 0.9631, test_f1: 0.4771
 epoch: 51, train_loss: 0.9307, test_loss: 0.9834, test_f1: 0.4789
 epoch: 52, train_loss: 0.9360, test_loss: 0.9542, test_f1: 0.4841
 epoch: 53, train_loss: 0.9387, test_loss: 0.9577, test_f1: 0.4776
 epoch: 54, train_loss: 0.9431, test_loss: 0.9591, test_f1: 0.4737
 epoch: 55, train_loss: 0.9326, test_loss: 0.9456, test_f1: 0.4777
 epoch: 56, train_loss: 0.9341, test_loss: 0.9397, test_f1: 0.4898
 epoch: 57, train_loss: 0.9178, test_loss: 0.9418, test_f1: 0.4821
 epoch: 58, train_loss: 0.9268, test_loss: 0.9509, test_f1: 0.4778
 epoch: 59, train_loss: 0.9266, test_loss: 0.9598, test_f1: 0.4805
 epoch: 60, train_loss: 0.9253, test_loss: 0.9799, test_f1: 0.4630
 epoch: 61, train_loss: 0.9144, test_loss: 0.9508, test_f1: 0.4866
 epoch: 62, train_loss: 0.9104, test_loss: 0.9416, test_f1: 0.4835
 epoch: 63, train_loss: 0.9255, test_loss: 0.9320, test_f1: 0.4843
 epoch: 64, train_loss: 0.9215, test_loss: 0.9662, test_f1: 0.4845
 epoch: 65, train_loss: 0.9140, test_loss: 0.9472, test_f1: 0.4833
 epoch: 66, train_loss: 0.9090, test_loss: 0.9375, test_f1: 0.4795
 epoch: 67, train_loss: 0.9155, test_loss: 0.9482, test_f1: 0.4878
 epoch: 68, train_loss: 0.9240, test_loss: 0.9410, test_f1: 0.4845
 epoch: 69, train_loss: 0.9106, test_loss: 0.9580, test_f1: 0.4834
 epoch: 70, train_loss: 0.8933, test_loss: 0.9582, test_f1: 0.4766
 epoch: 71, train_loss: 0.8933, test_loss: 0.9711, test_f1: 0.4849
 epoch: 72, train_loss: 0.9108, test_loss: 0.9358, test_f1: 0.4934
 epoch: 73, train_loss: 0.9091, test_loss: 0.9459, test_f1: 0.4767
 epoch: 74, train_loss: 0.9106, test_loss: 0.9678, test_f1: 0.4656
 epoch: 75, train_loss: 0.9069, test_loss: 0.9787, test_f1: 0.4670
 epoch: 76, train_loss: 0.8990, test_loss: 0.9481, test_f1: 0.4967
 epoch: 77, train_loss: 0.9123, test_loss: 0.9485, test_f1: 0.4826
 epoch: 78, train_loss: 0.8991, test_loss: 0.9424, test_f1: 0.4928
 epoch: 79, train_loss: 0.8865, test_loss: 0.9503, test_f1: 0.4945
 epoch: 80, train_loss: 0.8945, test_loss: 0.9618, test_f1: 0.4912
 epoch: 81, train_loss: 0.8983, test_loss: 0.9431, test_f1: 0.5016
 epoch: 82, train_loss: 0.8981, test_loss: 0.9768, test_f1: 0.4777
 epoch: 83, train_loss: 0.8967, test_loss: 0.9306, test_f1: 0.4972
 epoch: 84, train_loss: 0.8787, test_loss: 0.9788, test_f1: 0.4800
 epoch: 85, train_loss: 0.8880, test_loss: 0.9513, test_f1: 0.4866
 epoch: 86, train_loss: 0.8829, test_loss: 0.9407, test_f1: 0.4920
 epoch: 87, train_loss: 0.8890, test_loss: 0.9606, test_f1: 0.4983
 epoch: 88, train_loss: 0.8885, test_loss: 0.9641, test_f1: 0.4879
 epoch: 89, train_loss: 0.8790, test_loss: 0.9621, test_f1: 0.4905
 epoch: 90, train_loss: 0.8912, test_loss: 0.9444, test_f1: 0.4984
 epoch: 91, train_loss: 0.8792, test_loss: 0.9714, test_f1: 0.4962
 epoch: 92, train_loss: 0.8785, test_loss: 0.9534, test_f1: 0.4983
 epoch: 93, train_loss: 0.8774, test_loss: 0.9482, test_f1: 0.4959
 epoch: 94, train_loss: 0.8937, test_loss: 0.9438, test_f1: 0.4993
 epoch: 95, train_loss: 0.8893, test_loss: 0.9554, test_f1: 0.5103
 epoch: 96, train_loss: 0.8845, test_loss: 0.9590, test_f1: 0.4911
 epoch: 97, train_loss: 0.8758, test_loss: 0.9663, test_f1: 0.4927
 epoch: 98, train_loss: 0.8718, test_loss: 0.9406, test_f1: 0.5097
 epoch: 99, train_loss: 0.8765, test_loss: 0.9737, test_f1: 0.4993
##################ITERATION #6 ****************************************
 epoch: 0, train_loss: 1.3796, test_loss: 1.2843, test_f1: 0.2569
 epoch: 1, train_loss: 1.2781, test_loss: 1.2481, test_f1: 0.3205
 epoch: 2, train_loss: 1.2534, test_loss: 1.2212, test_f1: 0.3454
 epoch: 3, train_loss: 1.2367, test_loss: 1.2085, test_f1: 0.3510
 epoch: 4, train_loss: 1.2391, test_loss: 1.2113, test_f1: 0.3064
 epoch: 5, train_loss: 1.2217, test_loss: 1.2003, test_f1: 0.3451
 epoch: 6, train_loss: 1.2148, test_loss: 1.1872, test_f1: 0.3417
 epoch: 7, train_loss: 1.1973, test_loss: 1.1683, test_f1: 0.3865
 epoch: 8, train_loss: 1.1946, test_loss: 1.1890, test_f1: 0.3840
 epoch: 9, train_loss: 1.1832, test_loss: 1.1718, test_f1: 0.3907
 epoch: 10, train_loss: 1.1852, test_loss: 1.1592, test_f1: 0.3909
 epoch: 11, train_loss: 1.1710, test_loss: 1.1321, test_f1: 0.4178
 epoch: 12, train_loss: 1.1660, test_loss: 1.1421, test_f1: 0.4073
 epoch: 13, train_loss: 1.1518, test_loss: 1.1125, test_f1: 0.4119
 epoch: 14, train_loss: 1.1396, test_loss: 1.0983, test_f1: 0.4216
 epoch: 15, train_loss: 1.1200, test_loss: 1.0935, test_f1: 0.4236
 epoch: 16, train_loss: 1.1054, test_loss: 1.0706, test_f1: 0.4508
 epoch: 17, train_loss: 1.1025, test_loss: 1.0574, test_f1: 0.4634
 epoch: 18, train_loss: 1.0885, test_loss: 1.0514, test_f1: 0.4625
 epoch: 19, train_loss: 1.1038, test_loss: 1.0227, test_f1: 0.4981
 epoch: 20, train_loss: 1.0860, test_loss: 1.0416, test_f1: 0.4616
 epoch: 21, train_loss: 1.0606, test_loss: 1.0199, test_f1: 0.4565
 epoch: 22, train_loss: 1.0599, test_loss: 1.0058, test_f1: 0.4783
 epoch: 23, train_loss: 1.0366, test_loss: 1.0151, test_f1: 0.4542
 epoch: 24, train_loss: 1.0362, test_loss: 1.0198, test_f1: 0.4678
 epoch: 25, train_loss: 1.0352, test_loss: 0.9686, test_f1: 0.4747
 epoch: 26, train_loss: 1.0329, test_loss: 1.0093, test_f1: 0.4622
 epoch: 27, train_loss: 1.0245, test_loss: 0.9403, test_f1: 0.4989
 epoch: 28, train_loss: 1.0041, test_loss: 0.9587, test_f1: 0.4691
 epoch: 29, train_loss: 1.0095, test_loss: 0.9532, test_f1: 0.4962
 epoch: 30, train_loss: 1.0030, test_loss: 0.9504, test_f1: 0.4803
 epoch: 31, train_loss: 0.9976, test_loss: 0.9483, test_f1: 0.4982
 epoch: 32, train_loss: 1.0050, test_loss: 0.9759, test_f1: 0.4755
 epoch: 33, train_loss: 0.9966, test_loss: 0.9351, test_f1: 0.4877
 epoch: 34, train_loss: 0.9948, test_loss: 0.9545, test_f1: 0.4926
 epoch: 35, train_loss: 0.9871, test_loss: 0.9491, test_f1: 0.4943
 epoch: 36, train_loss: 0.9806, test_loss: 0.9717, test_f1: 0.4920
 epoch: 37, train_loss: 0.9760, test_loss: 0.9524, test_f1: 0.4924
 epoch: 38, train_loss: 0.9665, test_loss: 0.9262, test_f1: 0.5004
 epoch: 39, train_loss: 0.9598, test_loss: 0.9242, test_f1: 0.4939
 epoch: 40, train_loss: 0.9594, test_loss: 0.9553, test_f1: 0.4981
 epoch: 41, train_loss: 0.9486, test_loss: 0.9283, test_f1: 0.4882
 epoch: 42, train_loss: 0.9535, test_loss: 0.9250, test_f1: 0.4991
 epoch: 43, train_loss: 0.9650, test_loss: 0.9773, test_f1: 0.4994
 epoch: 44, train_loss: 0.9560, test_loss: 0.9371, test_f1: 0.4952
 epoch: 45, train_loss: 0.9553, test_loss: 0.9256, test_f1: 0.4885
 epoch: 46, train_loss: 0.9502, test_loss: 0.9295, test_f1: 0.4902
 epoch: 47, train_loss: 0.9321, test_loss: 0.9462, test_f1: 0.5024
 epoch: 48, train_loss: 0.9457, test_loss: 0.9134, test_f1: 0.5065
 epoch: 49, train_loss: 0.9291, test_loss: 0.9879, test_f1: 0.4791
 epoch: 50, train_loss: 0.9353, test_loss: 0.9431, test_f1: 0.4804
 epoch: 51, train_loss: 0.9403, test_loss: 0.9330, test_f1: 0.5028
 epoch: 52, train_loss: 0.9296, test_loss: 0.9350, test_f1: 0.5024
 epoch: 53, train_loss: 0.9313, test_loss: 0.9424, test_f1: 0.4956
 epoch: 54, train_loss: 0.9263, test_loss: 0.9482, test_f1: 0.4916
 epoch: 55, train_loss: 0.9124, test_loss: 0.9374, test_f1: 0.5078
 epoch: 56, train_loss: 0.9212, test_loss: 0.9359, test_f1: 0.5109
 epoch: 57, train_loss: 0.9091, test_loss: 0.9576, test_f1: 0.4857
 epoch: 58, train_loss: 0.9120, test_loss: 0.9320, test_f1: 0.5084
 epoch: 59, train_loss: 0.9125, test_loss: 0.9405, test_f1: 0.5038
 epoch: 60, train_loss: 0.9116, test_loss: 0.9471, test_f1: 0.4917
 epoch: 61, train_loss: 0.9118, test_loss: 0.9425, test_f1: 0.5088
 epoch: 62, train_loss: 0.9076, test_loss: 0.9576, test_f1: 0.4965
 epoch: 63, train_loss: 0.9253, test_loss: 1.0034, test_f1: 0.4800
 epoch: 64, train_loss: 0.9106, test_loss: 0.9200, test_f1: 0.4962
 epoch: 65, train_loss: 0.9047, test_loss: 0.9481, test_f1: 0.5031
 epoch: 66, train_loss: 0.9026, test_loss: 0.9478, test_f1: 0.5063
 epoch: 67, train_loss: 0.9051, test_loss: 0.9505, test_f1: 0.5037
 epoch: 68, train_loss: 0.8955, test_loss: 0.9518, test_f1: 0.4985
 epoch: 69, train_loss: 0.8946, test_loss: 0.9368, test_f1: 0.5124
 epoch: 70, train_loss: 0.9070, test_loss: 0.9559, test_f1: 0.5114
 epoch: 71, train_loss: 0.9112, test_loss: 0.9665, test_f1: 0.4814
 epoch: 72, train_loss: 0.9034, test_loss: 0.9510, test_f1: 0.5035
 epoch: 73, train_loss: 0.8926, test_loss: 0.9572, test_f1: 0.4936
 epoch: 74, train_loss: 0.8799, test_loss: 0.9570, test_f1: 0.5048
 epoch: 75, train_loss: 0.9036, test_loss: 0.9567, test_f1: 0.5109
 epoch: 76, train_loss: 0.9003, test_loss: 0.9387, test_f1: 0.4989
 epoch: 77, train_loss: 0.8921, test_loss: 0.9472, test_f1: 0.4983
 epoch: 78, train_loss: 0.8879, test_loss: 0.9609, test_f1: 0.4996
 epoch: 79, train_loss: 0.8971, test_loss: 0.9633, test_f1: 0.5114
 epoch: 80, train_loss: 0.8988, test_loss: 0.9606, test_f1: 0.5071
 epoch: 81, train_loss: 0.8767, test_loss: 0.9487, test_f1: 0.5119
 epoch: 82, train_loss: 0.8852, test_loss: 0.9560, test_f1: 0.5025
 epoch: 83, train_loss: 0.8839, test_loss: 0.9560, test_f1: 0.5089
 epoch: 84, train_loss: 0.8855, test_loss: 0.9491, test_f1: 0.5029
 epoch: 85, train_loss: 0.8821, test_loss: 0.9560, test_f1: 0.5027
 epoch: 86, train_loss: 0.8747, test_loss: 0.9529, test_f1: 0.4950
 epoch: 87, train_loss: 0.8857, test_loss: 0.9986, test_f1: 0.5038
 epoch: 88, train_loss: 0.8812, test_loss: 0.9486, test_f1: 0.5185
 epoch: 89, train_loss: 0.8891, test_loss: 0.9596, test_f1: 0.5013
 epoch: 90, train_loss: 0.8804, test_loss: 0.9671, test_f1: 0.5003
 epoch: 91, train_loss: 0.8798, test_loss: 0.9587, test_f1: 0.5035
 epoch: 92, train_loss: 0.8771, test_loss: 0.9582, test_f1: 0.5069
 epoch: 93, train_loss: 0.8790, test_loss: 0.9728, test_f1: 0.5059
 epoch: 94, train_loss: 0.8766, test_loss: 0.9939, test_f1: 0.4941
 epoch: 95, train_loss: 0.8900, test_loss: 0.9606, test_f1: 0.5065
 epoch: 96, train_loss: 0.8717, test_loss: 0.9549, test_f1: 0.4965
 epoch: 97, train_loss: 0.8738, test_loss: 0.9541, test_f1: 0.5099
 epoch: 98, train_loss: 0.8679, test_loss: 0.9597, test_f1: 0.4987
 epoch: 99, train_loss: 0.8665, test_loss: 0.9598, test_f1: 0.5029
##################ITERATION #7 ****************************************
 epoch: 0, train_loss: 1.3664, test_loss: 1.2696, test_f1: 0.2274
 epoch: 1, train_loss: 1.2826, test_loss: 1.2547, test_f1: 0.2295
 epoch: 2, train_loss: 1.2680, test_loss: 1.2433, test_f1: 0.2612
 epoch: 3, train_loss: 1.2547, test_loss: 1.2284, test_f1: 0.2616
 epoch: 4, train_loss: 1.2435, test_loss: 1.2144, test_f1: 0.2577
 epoch: 5, train_loss: 1.2394, test_loss: 1.1936, test_f1: 0.3337
 epoch: 6, train_loss: 1.2107, test_loss: 1.1678, test_f1: 0.3586
 epoch: 7, train_loss: 1.2033, test_loss: 1.1449, test_f1: 0.3584
 epoch: 8, train_loss: 1.1944, test_loss: 1.1331, test_f1: 0.3678
 epoch: 9, train_loss: 1.1833, test_loss: 1.1229, test_f1: 0.3753
 epoch: 10, train_loss: 1.1712, test_loss: 1.1130, test_f1: 0.3818
 epoch: 11, train_loss: 1.1653, test_loss: 1.1063, test_f1: 0.3946
 epoch: 12, train_loss: 1.1632, test_loss: 1.0997, test_f1: 0.4098
 epoch: 13, train_loss: 1.1526, test_loss: 1.0940, test_f1: 0.4084
 epoch: 14, train_loss: 1.1453, test_loss: 1.0808, test_f1: 0.4267
 epoch: 15, train_loss: 1.1445, test_loss: 1.0806, test_f1: 0.4211
 epoch: 16, train_loss: 1.1312, test_loss: 1.0697, test_f1: 0.4280
 epoch: 17, train_loss: 1.1378, test_loss: 1.0681, test_f1: 0.4332
 epoch: 18, train_loss: 1.1345, test_loss: 1.0663, test_f1: 0.4180
 epoch: 19, train_loss: 1.1159, test_loss: 1.0572, test_f1: 0.4230
 epoch: 20, train_loss: 1.1165, test_loss: 1.0612, test_f1: 0.4262
 epoch: 21, train_loss: 1.1187, test_loss: 1.0546, test_f1: 0.4158
 epoch: 22, train_loss: 1.1059, test_loss: 1.0552, test_f1: 0.4219
 epoch: 23, train_loss: 1.1080, test_loss: 1.0482, test_f1: 0.4287
 epoch: 24, train_loss: 1.1051, test_loss: 1.0572, test_f1: 0.4277
 epoch: 25, train_loss: 1.0964, test_loss: 1.0409, test_f1: 0.4170
 epoch: 26, train_loss: 1.1068, test_loss: 1.0403, test_f1: 0.4236
 epoch: 27, train_loss: 1.0979, test_loss: 1.0515, test_f1: 0.4191
 epoch: 28, train_loss: 1.0934, test_loss: 1.0295, test_f1: 0.4355
 epoch: 29, train_loss: 1.0885, test_loss: 1.0301, test_f1: 0.4370
 epoch: 30, train_loss: 1.0777, test_loss: 1.0340, test_f1: 0.4370
 epoch: 31, train_loss: 1.0771, test_loss: 1.0275, test_f1: 0.4257
 epoch: 32, train_loss: 1.0734, test_loss: 1.0189, test_f1: 0.4250
 epoch: 33, train_loss: 1.0728, test_loss: 1.0208, test_f1: 0.4234
 epoch: 34, train_loss: 1.0708, test_loss: 1.0277, test_f1: 0.4296
 epoch: 35, train_loss: 1.0613, test_loss: 1.0074, test_f1: 0.4352
 epoch: 36, train_loss: 1.0643, test_loss: 1.0364, test_f1: 0.4223
 epoch: 37, train_loss: 1.0647, test_loss: 1.0245, test_f1: 0.4304
 epoch: 38, train_loss: 1.0521, test_loss: 1.0126, test_f1: 0.4379
 epoch: 39, train_loss: 1.0440, test_loss: 1.0150, test_f1: 0.4332
 epoch: 40, train_loss: 1.0504, test_loss: 1.0028, test_f1: 0.4508
 epoch: 41, train_loss: 1.0543, test_loss: 1.0201, test_f1: 0.4426
 epoch: 42, train_loss: 1.0475, test_loss: 1.0117, test_f1: 0.4496
 epoch: 43, train_loss: 1.0395, test_loss: 1.0105, test_f1: 0.4507
 epoch: 44, train_loss: 1.0378, test_loss: 1.0271, test_f1: 0.4399
 epoch: 45, train_loss: 1.0348, test_loss: 1.0459, test_f1: 0.4579
 epoch: 46, train_loss: 1.0276, test_loss: 1.0398, test_f1: 0.4499
 epoch: 47, train_loss: 1.0355, test_loss: 1.0161, test_f1: 0.4574
 epoch: 48, train_loss: 1.0289, test_loss: 1.0087, test_f1: 0.4478
 epoch: 49, train_loss: 1.0275, test_loss: 1.0210, test_f1: 0.4545
 epoch: 50, train_loss: 1.0143, test_loss: 1.0466, test_f1: 0.4414
 epoch: 51, train_loss: 1.0085, test_loss: 1.0242, test_f1: 0.4517
 epoch: 52, train_loss: 1.0067, test_loss: 1.0187, test_f1: 0.4429
 epoch: 53, train_loss: 1.0045, test_loss: 1.0374, test_f1: 0.4494
 epoch: 54, train_loss: 1.0078, test_loss: 1.0336, test_f1: 0.4608
 epoch: 55, train_loss: 1.0116, test_loss: 1.0306, test_f1: 0.4567
 epoch: 56, train_loss: 1.0003, test_loss: 1.0214, test_f1: 0.4460
 epoch: 57, train_loss: 1.0003, test_loss: 1.0279, test_f1: 0.4729
 epoch: 58, train_loss: 0.9984, test_loss: 1.0239, test_f1: 0.4524
 epoch: 59, train_loss: 0.9914, test_loss: 1.0390, test_f1: 0.4764
 epoch: 60, train_loss: 0.9946, test_loss: 1.0311, test_f1: 0.4717
 epoch: 61, train_loss: 0.9946, test_loss: 1.0391, test_f1: 0.4681
 epoch: 62, train_loss: 0.9889, test_loss: 1.0181, test_f1: 0.4607
 epoch: 63, train_loss: 0.9913, test_loss: 1.0264, test_f1: 0.4634
 epoch: 64, train_loss: 0.9888, test_loss: 1.0290, test_f1: 0.4616
 epoch: 65, train_loss: 0.9921, test_loss: 1.0342, test_f1: 0.4642
 epoch: 66, train_loss: 0.9932, test_loss: 1.0177, test_f1: 0.4577
 epoch: 67, train_loss: 0.9776, test_loss: 1.0337, test_f1: 0.4492
 epoch: 68, train_loss: 0.9722, test_loss: 1.0327, test_f1: 0.4533
 epoch: 69, train_loss: 0.9846, test_loss: 1.0306, test_f1: 0.4577
 epoch: 70, train_loss: 0.9687, test_loss: 1.0138, test_f1: 0.4686
 epoch: 71, train_loss: 0.9736, test_loss: 1.0354, test_f1: 0.4596
 epoch: 72, train_loss: 0.9779, test_loss: 1.0343, test_f1: 0.4645
 epoch: 73, train_loss: 0.9645, test_loss: 1.0333, test_f1: 0.4616
 epoch: 74, train_loss: 0.9718, test_loss: 1.0250, test_f1: 0.4607
 epoch: 75, train_loss: 0.9640, test_loss: 1.0492, test_f1: 0.4535
 epoch: 76, train_loss: 0.9736, test_loss: 1.0267, test_f1: 0.4617
 epoch: 77, train_loss: 0.9708, test_loss: 1.0233, test_f1: 0.4570
 epoch: 78, train_loss: 0.9764, test_loss: 1.0414, test_f1: 0.4613
 epoch: 79, train_loss: 0.9576, test_loss: 1.0474, test_f1: 0.4571
 epoch: 80, train_loss: 0.9549, test_loss: 1.0107, test_f1: 0.4625
 epoch: 81, train_loss: 0.9483, test_loss: 1.0218, test_f1: 0.4564
 epoch: 82, train_loss: 0.9511, test_loss: 1.0099, test_f1: 0.4737
 epoch: 83, train_loss: 0.9638, test_loss: 1.0070, test_f1: 0.4670
 epoch: 84, train_loss: 0.9500, test_loss: 1.0356, test_f1: 0.4690
 epoch: 85, train_loss: 0.9357, test_loss: 1.0239, test_f1: 0.4621
 epoch: 86, train_loss: 0.9485, test_loss: 1.0535, test_f1: 0.4824
 epoch: 87, train_loss: 0.9525, test_loss: 1.0369, test_f1: 0.4629
 epoch: 88, train_loss: 0.9513, test_loss: 1.0212, test_f1: 0.4616
 epoch: 89, train_loss: 0.9465, test_loss: 0.9996, test_f1: 0.4689
 epoch: 90, train_loss: 0.9383, test_loss: 1.0332, test_f1: 0.4592
 epoch: 91, train_loss: 0.9382, test_loss: 1.0162, test_f1: 0.4611
 epoch: 92, train_loss: 0.9422, test_loss: 1.0219, test_f1: 0.4662
 epoch: 93, train_loss: 0.9323, test_loss: 1.0096, test_f1: 0.4725
 epoch: 94, train_loss: 0.9332, test_loss: 1.0679, test_f1: 0.4644
 epoch: 95, train_loss: 0.9292, test_loss: 1.0259, test_f1: 0.4590
 epoch: 96, train_loss: 0.9321, test_loss: 1.0395, test_f1: 0.4833
 epoch: 97, train_loss: 0.9281, test_loss: 1.0617, test_f1: 0.4786
 epoch: 98, train_loss: 0.9367, test_loss: 1.0273, test_f1: 0.4849
 epoch: 99, train_loss: 0.9362, test_loss: 1.0671, test_f1: 0.4579
##################ITERATION #8 ****************************************
 epoch: 0, train_loss: 1.4508, test_loss: 1.3079, test_f1: 0.2662
 epoch: 1, train_loss: 1.2802, test_loss: 1.2550, test_f1: 0.2803
 epoch: 2, train_loss: 1.2722, test_loss: 1.2161, test_f1: 0.3259
 epoch: 3, train_loss: 1.2383, test_loss: 1.1908, test_f1: 0.3464
 epoch: 4, train_loss: 1.2265, test_loss: 1.1794, test_f1: 0.3527
 epoch: 5, train_loss: 1.2066, test_loss: 1.1725, test_f1: 0.3686
 epoch: 6, train_loss: 1.2186, test_loss: 1.1683, test_f1: 0.3802
 epoch: 7, train_loss: 1.2014, test_loss: 1.1588, test_f1: 0.4048
 epoch: 8, train_loss: 1.1904, test_loss: 1.1475, test_f1: 0.3980
 epoch: 9, train_loss: 1.1833, test_loss: 1.1375, test_f1: 0.4199
 epoch: 10, train_loss: 1.1778, test_loss: 1.1308, test_f1: 0.4055
 epoch: 11, train_loss: 1.1654, test_loss: 1.1179, test_f1: 0.4255
 epoch: 12, train_loss: 1.1508, test_loss: 1.1124, test_f1: 0.4078
 epoch: 13, train_loss: 1.1521, test_loss: 1.1052, test_f1: 0.4253
 epoch: 14, train_loss: 1.1364, test_loss: 1.1036, test_f1: 0.4399
 epoch: 15, train_loss: 1.1310, test_loss: 1.0933, test_f1: 0.4226
 epoch: 16, train_loss: 1.1257, test_loss: 1.0999, test_f1: 0.4454
 epoch: 17, train_loss: 1.1196, test_loss: 1.0702, test_f1: 0.4399
 epoch: 18, train_loss: 1.1061, test_loss: 1.0850, test_f1: 0.4286
 epoch: 19, train_loss: 1.1102, test_loss: 1.0641, test_f1: 0.4361
 epoch: 20, train_loss: 1.0935, test_loss: 1.0546, test_f1: 0.4311
 epoch: 21, train_loss: 1.0929, test_loss: 1.0672, test_f1: 0.4312
 epoch: 22, train_loss: 1.0792, test_loss: 1.0446, test_f1: 0.4346
 epoch: 23, train_loss: 1.0792, test_loss: 1.0325, test_f1: 0.4391
 epoch: 24, train_loss: 1.0652, test_loss: 1.0257, test_f1: 0.4441
 epoch: 25, train_loss: 1.0701, test_loss: 1.0784, test_f1: 0.4314
 epoch: 26, train_loss: 1.0530, test_loss: 1.0250, test_f1: 0.4532
 epoch: 27, train_loss: 1.0480, test_loss: 1.0256, test_f1: 0.4405
 epoch: 28, train_loss: 1.0411, test_loss: 1.0352, test_f1: 0.4326
 epoch: 29, train_loss: 1.0285, test_loss: 1.0027, test_f1: 0.4501
 epoch: 30, train_loss: 1.0294, test_loss: 0.9989, test_f1: 0.4635
 epoch: 31, train_loss: 1.0262, test_loss: 1.0336, test_f1: 0.4337
 epoch: 32, train_loss: 1.0180, test_loss: 0.9860, test_f1: 0.4559
 epoch: 33, train_loss: 1.0111, test_loss: 0.9820, test_f1: 0.4559
 epoch: 34, train_loss: 1.0068, test_loss: 0.9912, test_f1: 0.4487
 epoch: 35, train_loss: 1.0010, test_loss: 0.9876, test_f1: 0.4502
 epoch: 36, train_loss: 1.0116, test_loss: 1.0208, test_f1: 0.4325
 epoch: 37, train_loss: 0.9877, test_loss: 0.9723, test_f1: 0.4675
 epoch: 38, train_loss: 0.9896, test_loss: 0.9695, test_f1: 0.4562
 epoch: 39, train_loss: 0.9802, test_loss: 0.9686, test_f1: 0.4568
 epoch: 40, train_loss: 0.9811, test_loss: 0.9723, test_f1: 0.4678
 epoch: 41, train_loss: 0.9771, test_loss: 0.9527, test_f1: 0.4774
 epoch: 42, train_loss: 0.9777, test_loss: 0.9725, test_f1: 0.4654
 epoch: 43, train_loss: 0.9754, test_loss: 0.9733, test_f1: 0.4644
 epoch: 44, train_loss: 0.9646, test_loss: 0.9418, test_f1: 0.4861
 epoch: 45, train_loss: 0.9747, test_loss: 1.0036, test_f1: 0.4550
 epoch: 46, train_loss: 0.9783, test_loss: 0.9831, test_f1: 0.4569
 epoch: 47, train_loss: 0.9541, test_loss: 0.9599, test_f1: 0.4758
 epoch: 48, train_loss: 0.9517, test_loss: 0.9697, test_f1: 0.4632
 epoch: 49, train_loss: 0.9494, test_loss: 1.0457, test_f1: 0.4563
 epoch: 50, train_loss: 0.9424, test_loss: 0.9620, test_f1: 0.4594
 epoch: 51, train_loss: 0.9410, test_loss: 0.9482, test_f1: 0.4726
 epoch: 52, train_loss: 0.9370, test_loss: 0.9562, test_f1: 0.4731
 epoch: 53, train_loss: 0.9174, test_loss: 0.9800, test_f1: 0.4609
 epoch: 54, train_loss: 0.9255, test_loss: 0.9843, test_f1: 0.4693
 epoch: 55, train_loss: 0.9247, test_loss: 0.9608, test_f1: 0.4751
 epoch: 56, train_loss: 0.9379, test_loss: 1.0210, test_f1: 0.4666
 epoch: 57, train_loss: 0.9142, test_loss: 0.9396, test_f1: 0.4828
 epoch: 58, train_loss: 0.9245, test_loss: 0.9789, test_f1: 0.4745
 epoch: 59, train_loss: 0.9197, test_loss: 0.9350, test_f1: 0.4734
 epoch: 60, train_loss: 0.9233, test_loss: 0.9846, test_f1: 0.4744
 epoch: 61, train_loss: 0.9177, test_loss: 0.9637, test_f1: 0.4762
 epoch: 62, train_loss: 0.9178, test_loss: 0.9792, test_f1: 0.4678
 epoch: 63, train_loss: 0.9170, test_loss: 0.9711, test_f1: 0.4765
 epoch: 64, train_loss: 0.9221, test_loss: 0.9677, test_f1: 0.4697
 epoch: 65, train_loss: 0.9008, test_loss: 1.0195, test_f1: 0.4728
 epoch: 66, train_loss: 0.9106, test_loss: 0.9603, test_f1: 0.4694
 epoch: 67, train_loss: 0.8998, test_loss: 0.9599, test_f1: 0.4807
 epoch: 68, train_loss: 0.8990, test_loss: 0.9727, test_f1: 0.4720
 epoch: 69, train_loss: 0.9049, test_loss: 1.0121, test_f1: 0.4682
 epoch: 70, train_loss: 0.9090, test_loss: 0.9842, test_f1: 0.4643
 epoch: 71, train_loss: 0.8903, test_loss: 0.9785, test_f1: 0.4673
 epoch: 72, train_loss: 0.9064, test_loss: 1.0005, test_f1: 0.4586
 epoch: 73, train_loss: 0.9076, test_loss: 0.9423, test_f1: 0.4832
 epoch: 74, train_loss: 0.9008, test_loss: 0.9942, test_f1: 0.4762
 epoch: 75, train_loss: 0.9031, test_loss: 1.0110, test_f1: 0.4675
 epoch: 76, train_loss: 0.8964, test_loss: 0.9769, test_f1: 0.4658
 epoch: 77, train_loss: 0.9100, test_loss: 0.9613, test_f1: 0.4663
 epoch: 78, train_loss: 0.8943, test_loss: 0.9999, test_f1: 0.4615
 epoch: 79, train_loss: 0.8912, test_loss: 0.9920, test_f1: 0.4745
 epoch: 80, train_loss: 0.9017, test_loss: 0.9646, test_f1: 0.4848
 epoch: 81, train_loss: 0.8940, test_loss: 1.0136, test_f1: 0.4731
 epoch: 82, train_loss: 0.8906, test_loss: 0.9701, test_f1: 0.4820
 epoch: 83, train_loss: 0.8823, test_loss: 1.0191, test_f1: 0.4588
 epoch: 84, train_loss: 0.8745, test_loss: 1.0122, test_f1: 0.4685
 epoch: 85, train_loss: 0.8753, test_loss: 1.0174, test_f1: 0.4592
 epoch: 86, train_loss: 0.8788, test_loss: 0.9823, test_f1: 0.4822
 epoch: 87, train_loss: 0.8818, test_loss: 1.0029, test_f1: 0.4626
 epoch: 88, train_loss: 0.8724, test_loss: 0.9894, test_f1: 0.4703
 epoch: 89, train_loss: 0.8784, test_loss: 0.9873, test_f1: 0.4719
 epoch: 90, train_loss: 0.8709, test_loss: 1.0115, test_f1: 0.4662
 epoch: 91, train_loss: 0.8759, test_loss: 0.9911, test_f1: 0.4688
 epoch: 92, train_loss: 0.8843, test_loss: 0.9958, test_f1: 0.4699
 epoch: 93, train_loss: 0.8695, test_loss: 0.9811, test_f1: 0.4751
 epoch: 94, train_loss: 0.8679, test_loss: 0.9998, test_f1: 0.4655
 epoch: 95, train_loss: 0.8650, test_loss: 0.9642, test_f1: 0.4759
 epoch: 96, train_loss: 0.8716, test_loss: 0.9576, test_f1: 0.4905
 epoch: 97, train_loss: 0.8683, test_loss: 0.9821, test_f1: 0.4879
 epoch: 98, train_loss: 0.8731, test_loss: 1.0212, test_f1: 0.4460
 epoch: 99, train_loss: 0.8792, test_loss: 0.9536, test_f1: 0.4700
##################ITERATION #9 ****************************************
 epoch: 0, train_loss: 1.4239, test_loss: 1.2997, test_f1: 0.2505
 epoch: 1, train_loss: 1.2851, test_loss: 1.2067, test_f1: 0.3309
 epoch: 2, train_loss: 1.2460, test_loss: 1.1890, test_f1: 0.3525
 epoch: 3, train_loss: 1.2329, test_loss: 1.1741, test_f1: 0.3917
 epoch: 4, train_loss: 1.2184, test_loss: 1.1767, test_f1: 0.3574
 epoch: 5, train_loss: 1.2035, test_loss: 1.1657, test_f1: 0.3773
 epoch: 6, train_loss: 1.1882, test_loss: 1.1517, test_f1: 0.4041
 epoch: 7, train_loss: 1.1914, test_loss: 1.1508, test_f1: 0.4176
 epoch: 8, train_loss: 1.1802, test_loss: 1.1408, test_f1: 0.4207
 epoch: 9, train_loss: 1.1729, test_loss: 1.1381, test_f1: 0.4240
 epoch: 10, train_loss: 1.1695, test_loss: 1.1202, test_f1: 0.4341
 epoch: 11, train_loss: 1.1617, test_loss: 1.1181, test_f1: 0.4309
 epoch: 12, train_loss: 1.1579, test_loss: 1.1055, test_f1: 0.4297
 epoch: 13, train_loss: 1.1470, test_loss: 1.1105, test_f1: 0.4309
 epoch: 14, train_loss: 1.1361, test_loss: 1.1042, test_f1: 0.4456
 epoch: 15, train_loss: 1.1321, test_loss: 1.0950, test_f1: 0.4301
 epoch: 16, train_loss: 1.1296, test_loss: 1.0949, test_f1: 0.4239
 epoch: 17, train_loss: 1.1207, test_loss: 1.0915, test_f1: 0.4196
 epoch: 18, train_loss: 1.1193, test_loss: 1.0896, test_f1: 0.4466
 epoch: 19, train_loss: 1.1090, test_loss: 1.0676, test_f1: 0.4642
 epoch: 20, train_loss: 1.0988, test_loss: 1.0778, test_f1: 0.4255
 epoch: 21, train_loss: 1.0907, test_loss: 1.0669, test_f1: 0.4249
 epoch: 22, train_loss: 1.0988, test_loss: 1.0664, test_f1: 0.4498
 epoch: 23, train_loss: 1.0851, test_loss: 1.0650, test_f1: 0.4065
 epoch: 24, train_loss: 1.0819, test_loss: 1.0642, test_f1: 0.4149
 epoch: 25, train_loss: 1.0781, test_loss: 1.0469, test_f1: 0.4196
 epoch: 26, train_loss: 1.0590, test_loss: 1.0305, test_f1: 0.4425
 epoch: 27, train_loss: 1.0563, test_loss: 1.0310, test_f1: 0.4496
 epoch: 28, train_loss: 1.0506, test_loss: 1.0277, test_f1: 0.4494
 epoch: 29, train_loss: 1.0504, test_loss: 1.0219, test_f1: 0.4591
 epoch: 30, train_loss: 1.0303, test_loss: 1.0302, test_f1: 0.4605
 epoch: 31, train_loss: 1.0324, test_loss: 1.0335, test_f1: 0.4578
 epoch: 32, train_loss: 1.0256, test_loss: 1.0356, test_f1: 0.4629
 epoch: 33, train_loss: 1.0253, test_loss: 1.0011, test_f1: 0.4770
 epoch: 34, train_loss: 1.0020, test_loss: 1.0313, test_f1: 0.4573
 epoch: 35, train_loss: 0.9958, test_loss: 1.0184, test_f1: 0.4941
 epoch: 36, train_loss: 1.0054, test_loss: 1.0216, test_f1: 0.4605
 epoch: 37, train_loss: 0.9968, test_loss: 1.0307, test_f1: 0.4816
 epoch: 38, train_loss: 0.9951, test_loss: 1.0172, test_f1: 0.4605
 epoch: 39, train_loss: 0.9933, test_loss: 1.0493, test_f1: 0.4564
 epoch: 40, train_loss: 0.9800, test_loss: 1.0266, test_f1: 0.4868
 epoch: 41, train_loss: 0.9756, test_loss: 1.0318, test_f1: 0.4702
 epoch: 42, train_loss: 0.9805, test_loss: 1.0585, test_f1: 0.4679
 epoch: 43, train_loss: 0.9892, test_loss: 1.0176, test_f1: 0.4879
 epoch: 44, train_loss: 0.9695, test_loss: 1.0491, test_f1: 0.4658
 epoch: 45, train_loss: 0.9733, test_loss: 1.0263, test_f1: 0.4684
 epoch: 46, train_loss: 0.9649, test_loss: 1.0782, test_f1: 0.4409
 epoch: 47, train_loss: 0.9666, test_loss: 1.0434, test_f1: 0.4535
 epoch: 48, train_loss: 0.9576, test_loss: 1.0581, test_f1: 0.4968
 epoch: 49, train_loss: 0.9486, test_loss: 1.0689, test_f1: 0.4480
 epoch: 50, train_loss: 0.9369, test_loss: 1.0522, test_f1: 0.4603
 epoch: 51, train_loss: 0.9452, test_loss: 1.0546, test_f1: 0.4476
 epoch: 52, train_loss: 0.9427, test_loss: 1.0428, test_f1: 0.4686
 epoch: 53, train_loss: 0.9352, test_loss: 1.0556, test_f1: 0.4655
 epoch: 54, train_loss: 0.9349, test_loss: 1.0551, test_f1: 0.4684
 epoch: 55, train_loss: 0.9348, test_loss: 1.0637, test_f1: 0.4883
 epoch: 56, train_loss: 0.9388, test_loss: 1.0437, test_f1: 0.5020
 epoch: 57, train_loss: 0.9335, test_loss: 1.0673, test_f1: 0.4703
 epoch: 58, train_loss: 0.9325, test_loss: 1.0527, test_f1: 0.4784
 epoch: 59, train_loss: 0.9270, test_loss: 1.0424, test_f1: 0.4811
 epoch: 60, train_loss: 0.9191, test_loss: 1.0844, test_f1: 0.4797
 epoch: 61, train_loss: 0.9290, test_loss: 1.0564, test_f1: 0.4819
 epoch: 62, train_loss: 0.9217, test_loss: 1.0635, test_f1: 0.4780
 epoch: 63, train_loss: 0.9282, test_loss: 1.0586, test_f1: 0.4955
 epoch: 64, train_loss: 0.9175, test_loss: 1.0562, test_f1: 0.4709
 epoch: 65, train_loss: 0.9181, test_loss: 1.0719, test_f1: 0.4877
 epoch: 66, train_loss: 0.9070, test_loss: 1.0818, test_f1: 0.4879
 epoch: 67, train_loss: 0.9161, test_loss: 1.0579, test_f1: 0.4872
 epoch: 68, train_loss: 0.9089, test_loss: 1.0670, test_f1: 0.5057
 epoch: 69, train_loss: 0.9093, test_loss: 1.0801, test_f1: 0.5041
 epoch: 70, train_loss: 0.9005, test_loss: 1.0763, test_f1: 0.4730
 epoch: 71, train_loss: 0.9166, test_loss: 1.0855, test_f1: 0.4888
 epoch: 72, train_loss: 0.9092, test_loss: 1.0861, test_f1: 0.4977
 epoch: 73, train_loss: 0.9020, test_loss: 1.0583, test_f1: 0.4915
 epoch: 74, train_loss: 0.9033, test_loss: 1.0884, test_f1: 0.4843
 epoch: 75, train_loss: 0.9055, test_loss: 1.0724, test_f1: 0.4889
 epoch: 76, train_loss: 0.9059, test_loss: 1.1005, test_f1: 0.4787
 epoch: 77, train_loss: 0.9050, test_loss: 1.0602, test_f1: 0.4948
 epoch: 78, train_loss: 0.8983, test_loss: 1.0759, test_f1: 0.4692
 epoch: 79, train_loss: 0.8960, test_loss: 1.0834, test_f1: 0.4783
 epoch: 80, train_loss: 0.8978, test_loss: 1.0757, test_f1: 0.5023
 epoch: 81, train_loss: 0.8991, test_loss: 1.0926, test_f1: 0.4831
 epoch: 82, train_loss: 0.9003, test_loss: 1.0904, test_f1: 0.4957
 epoch: 83, train_loss: 0.8972, test_loss: 1.0583, test_f1: 0.5000
 epoch: 84, train_loss: 0.8840, test_loss: 1.0834, test_f1: 0.4815
 epoch: 85, train_loss: 0.9047, test_loss: 1.0508, test_f1: 0.4868
 epoch: 86, train_loss: 0.8983, test_loss: 1.0702, test_f1: 0.5043
 epoch: 87, train_loss: 0.8890, test_loss: 1.0846, test_f1: 0.4929
 epoch: 88, train_loss: 0.8864, test_loss: 1.1053, test_f1: 0.4821
 epoch: 89, train_loss: 0.8810, test_loss: 1.0698, test_f1: 0.4896
 epoch: 90, train_loss: 0.8778, test_loss: 1.0594, test_f1: 0.4723
 epoch: 91, train_loss: 0.8809, test_loss: 1.0773, test_f1: 0.5183
 epoch: 92, train_loss: 0.8842, test_loss: 1.0762, test_f1: 0.4984
 epoch: 93, train_loss: 0.8793, test_loss: 1.0980, test_f1: 0.4929
 epoch: 94, train_loss: 0.8958, test_loss: 1.0537, test_f1: 0.4683
 epoch: 95, train_loss: 0.8742, test_loss: 1.0898, test_f1: 0.4945
 epoch: 96, train_loss: 0.8765, test_loss: 1.0845, test_f1: 0.5181
 epoch: 97, train_loss: 0.8762, test_loss: 1.0599, test_f1: 0.5122
 epoch: 98, train_loss: 0.8706, test_loss: 1.0761, test_f1: 0.5268
 epoch: 99, train_loss: 0.8729, test_loss: 1.1082, test_f1: 0.4923

Training completed in 575.25 seconds
Best F1: 0.5318 at epoch 90
Mean F1 across iterations: 0.5027  0.0199
========================FINAL RESULTS================================
FEGIN weighted F1: 0.5318  0.0199
python main.py --data ltspice_examples --representation component_component --model FEGIN --layers 4 --hiddens 16 --batch_size 128 --lr 0.001 --emb_size 250 --epochs 100 --save_appendix component_component_L4_H16_BS128_LR0.001_E250 --no_val
-----



STDERR:
  File "main.py", line 370, in <module>
    main()
  File "main.py", line 254, in main
    dataset = dataset_class(
  File "/home/philip/projects/llm_inference_code_repo/Circuit-Completion-Using-GNNs/component_classification_with_link_prediction_head/evaluation/FEGIN/kernel/circuit_datasets.py", line 15, in __init__
    self.data, self.slices = torch.load(self.processed_paths[0])
  File "/home/philip/.local/lib/python3.8/site-packages/torch/serialization.py", line 1040, in load
    warnings.warn(
  File "/usr/lib/python3.8/warnings.py", line 109, in _showwarnmsg
    sw(msg.message, msg.category, msg.filename, msg.lineno,
  File "main.py", line 47, in warn_with_traceback
    traceback.print_stack(file=log)
/home/philip/projects/llm_inference_code_repo/Circuit-Completion-Using-GNNs/component_classification_with_link_prediction_head/evaluation/FEGIN/kernel/circuit_datasets.py:15: FutureWarning: You are using `torch.load` with `weights_only=False` (the current default value), which uses the default pickle module implicitly. It is possible to construct malicious pickle data which will execute arbitrary code during unpickling (See https://github.com/pytorch/pytorch/blob/main/SECURITY.md#untrusted-models for more details). In a future release, the default value for `weights_only` will be flipped to `True`. This limits the functions that could be executed during unpickling. Arbitrary objects will no longer be allowed to be loaded via this mode unless they are explicitly allowlisted by the user via `torch.serialization.add_safe_globals`. We recommend you start setting `weights_only=True` for any use case where you don't have full control of the loaded file. Please open an issue on GitHub for any issues related to this experimental feature.
  self.data, self.slices = torch.load(self.processed_paths[0])
