STDOUT:
Results will be saved in /home/philip/projects/ltspice_examples_code_repo/Circuit-Completion-Using-GNNs/component_classification_with_link_prediction_head/evaluation/FEGIN/results/model_FEGIN_dataset_ltspice_examples
Command line input: python main.py --data ltspice_examples --representation component_component --model FEGIN --layers 6 --hiddens 64 --batch_size 256 --lr 0.0001 --emb_size 250 --epochs 100 --save_appendix component_component_L6_H64_BS256_LR0.0001_E250 --no_val
 is saved.
-----
ltspice_examples - FEGIN
Using 6 layers, 64 hidden units, h = 2
Loading component_component representation dataset
ENTERED
Training FEGIN on component_component representation
Train: 3556, Test: 845
##################ITERATION #0 ****************************************
 epoch: 0, train_loss: 1.3604, test_loss: 1.3647, test_f1: 0.2274
 epoch: 1, train_loss: 1.3529, test_loss: 1.3592, test_f1: 0.2555
 epoch: 2, train_loss: 1.3468, test_loss: 1.3497, test_f1: 0.2666
 epoch: 3, train_loss: 1.3412, test_loss: 1.3395, test_f1: 0.2654
 epoch: 4, train_loss: 1.3344, test_loss: 1.3298, test_f1: 0.2653
 epoch: 5, train_loss: 1.3270, test_loss: 1.3193, test_f1: 0.2833
 epoch: 6, train_loss: 1.3184, test_loss: 1.3093, test_f1: 0.3055
 epoch: 7, train_loss: 1.3094, test_loss: 1.2977, test_f1: 0.3061
 epoch: 8, train_loss: 1.2992, test_loss: 1.2864, test_f1: 0.3052
 epoch: 9, train_loss: 1.2880, test_loss: 1.2740, test_f1: 0.3084
 epoch: 10, train_loss: 1.2780, test_loss: 1.2625, test_f1: 0.3124
 epoch: 11, train_loss: 1.2687, test_loss: 1.2513, test_f1: 0.3125
 epoch: 12, train_loss: 1.2562, test_loss: 1.2398, test_f1: 0.3134
 epoch: 13, train_loss: 1.2482, test_loss: 1.2285, test_f1: 0.3158
 epoch: 14, train_loss: 1.2395, test_loss: 1.2189, test_f1: 0.3156
 epoch: 15, train_loss: 1.2308, test_loss: 1.2093, test_f1: 0.3175
 epoch: 16, train_loss: 1.2213, test_loss: 1.2020, test_f1: 0.3269
 epoch: 17, train_loss: 1.2162, test_loss: 1.1943, test_f1: 0.3363
 epoch: 18, train_loss: 1.2114, test_loss: 1.1875, test_f1: 0.3478
 epoch: 19, train_loss: 1.1988, test_loss: 1.1810, test_f1: 0.3479
 epoch: 20, train_loss: 1.1957, test_loss: 1.1740, test_f1: 0.3482
 epoch: 21, train_loss: 1.1859, test_loss: 1.1679, test_f1: 0.3506
 epoch: 22, train_loss: 1.1765, test_loss: 1.1603, test_f1: 0.3539
 epoch: 23, train_loss: 1.1764, test_loss: 1.1565, test_f1: 0.3560
 epoch: 24, train_loss: 1.1654, test_loss: 1.1510, test_f1: 0.3476
 epoch: 25, train_loss: 1.1566, test_loss: 1.1451, test_f1: 0.3449
 epoch: 26, train_loss: 1.1452, test_loss: 1.1353, test_f1: 0.3504
 epoch: 27, train_loss: 1.1404, test_loss: 1.1361, test_f1: 0.3512
 epoch: 28, train_loss: 1.1301, test_loss: 1.1326, test_f1: 0.3568
 epoch: 29, train_loss: 1.1209, test_loss: 1.1208, test_f1: 0.3624
 epoch: 30, train_loss: 1.1165, test_loss: 1.1146, test_f1: 0.3692
 epoch: 31, train_loss: 1.1061, test_loss: 1.1179, test_f1: 0.3663
 epoch: 32, train_loss: 1.0957, test_loss: 1.1087, test_f1: 0.3619
 epoch: 33, train_loss: 1.0939, test_loss: 1.1077, test_f1: 0.3619
 epoch: 34, train_loss: 1.0846, test_loss: 1.0996, test_f1: 0.3702
 epoch: 35, train_loss: 1.0829, test_loss: 1.0993, test_f1: 0.3691
 epoch: 36, train_loss: 1.0702, test_loss: 1.0899, test_f1: 0.3667
 epoch: 37, train_loss: 1.0601, test_loss: 1.0948, test_f1: 0.4048
 epoch: 38, train_loss: 1.0510, test_loss: 1.0991, test_f1: 0.4259
 epoch: 39, train_loss: 1.0567, test_loss: 1.0859, test_f1: 0.4275
 epoch: 40, train_loss: 1.0443, test_loss: 1.0852, test_f1: 0.4527
 epoch: 41, train_loss: 1.0391, test_loss: 1.0925, test_f1: 0.4530
 epoch: 42, train_loss: 1.0284, test_loss: 1.0855, test_f1: 0.4410
 epoch: 43, train_loss: 1.0278, test_loss: 1.0860, test_f1: 0.4399
 epoch: 44, train_loss: 1.0225, test_loss: 1.0802, test_f1: 0.4500
 epoch: 45, train_loss: 1.0089, test_loss: 1.0787, test_f1: 0.4477
 epoch: 46, train_loss: 1.0041, test_loss: 1.1049, test_f1: 0.4361
 epoch: 47, train_loss: 1.0080, test_loss: 1.0848, test_f1: 0.4407
 epoch: 48, train_loss: 1.0003, test_loss: 1.1070, test_f1: 0.4387
 epoch: 49, train_loss: 0.9944, test_loss: 1.1170, test_f1: 0.4459
 epoch: 50, train_loss: 0.9809, test_loss: 1.1003, test_f1: 0.4379
 epoch: 51, train_loss: 0.9776, test_loss: 1.1234, test_f1: 0.4398
 epoch: 52, train_loss: 0.9811, test_loss: 1.1164, test_f1: 0.4456
 epoch: 53, train_loss: 0.9721, test_loss: 1.1052, test_f1: 0.4363
 epoch: 54, train_loss: 0.9719, test_loss: 1.1061, test_f1: 0.4399
 epoch: 55, train_loss: 0.9739, test_loss: 1.1351, test_f1: 0.4430
 epoch: 56, train_loss: 0.9601, test_loss: 1.1303, test_f1: 0.4401
 epoch: 57, train_loss: 0.9756, test_loss: 1.1175, test_f1: 0.4424
 epoch: 58, train_loss: 0.9600, test_loss: 1.0976, test_f1: 0.4422
 epoch: 59, train_loss: 0.9556, test_loss: 1.1172, test_f1: 0.4406
 epoch: 60, train_loss: 0.9540, test_loss: 1.1204, test_f1: 0.4436
 epoch: 61, train_loss: 0.9585, test_loss: 1.1296, test_f1: 0.4415
 epoch: 62, train_loss: 0.9540, test_loss: 1.1592, test_f1: 0.4458
 epoch: 63, train_loss: 0.9432, test_loss: 1.1723, test_f1: 0.4443
 epoch: 64, train_loss: 0.9547, test_loss: 1.1759, test_f1: 0.4407
 epoch: 65, train_loss: 0.9434, test_loss: 1.1861, test_f1: 0.4425
 epoch: 66, train_loss: 0.9478, test_loss: 1.1588, test_f1: 0.4419
 epoch: 67, train_loss: 0.9427, test_loss: 1.1243, test_f1: 0.4423
 epoch: 68, train_loss: 0.9439, test_loss: 1.1241, test_f1: 0.4402
 epoch: 69, train_loss: 0.9311, test_loss: 1.0949, test_f1: 0.4473
 epoch: 70, train_loss: 0.9382, test_loss: 1.1123, test_f1: 0.4434
 epoch: 71, train_loss: 0.9370, test_loss: 1.1278, test_f1: 0.4416
 epoch: 72, train_loss: 0.9330, test_loss: 1.1309, test_f1: 0.4464
 epoch: 73, train_loss: 0.9248, test_loss: 1.1457, test_f1: 0.4376
 epoch: 74, train_loss: 0.9250, test_loss: 1.2094, test_f1: 0.4423
 epoch: 75, train_loss: 0.9222, test_loss: 1.1486, test_f1: 0.4416
 epoch: 76, train_loss: 0.9190, test_loss: 1.1381, test_f1: 0.4418
 epoch: 77, train_loss: 0.9317, test_loss: 1.1437, test_f1: 0.4477
 epoch: 78, train_loss: 0.9159, test_loss: 1.1542, test_f1: 0.4468
 epoch: 79, train_loss: 0.9209, test_loss: 1.2191, test_f1: 0.4512
 epoch: 80, train_loss: 0.9204, test_loss: 1.2155, test_f1: 0.4498
 epoch: 81, train_loss: 0.9087, test_loss: 1.2204, test_f1: 0.4385
 epoch: 82, train_loss: 0.9119, test_loss: 1.1965, test_f1: 0.4452
 epoch: 83, train_loss: 0.9213, test_loss: 1.1901, test_f1: 0.4513
 epoch: 84, train_loss: 0.9187, test_loss: 1.1541, test_f1: 0.4464
 epoch: 85, train_loss: 0.9115, test_loss: 1.1724, test_f1: 0.4462
 epoch: 86, train_loss: 0.9161, test_loss: 1.1654, test_f1: 0.4476
 epoch: 87, train_loss: 0.9206, test_loss: 1.1988, test_f1: 0.4493
 epoch: 88, train_loss: 0.9078, test_loss: 1.2021, test_f1: 0.4482
 epoch: 89, train_loss: 0.8915, test_loss: 1.2097, test_f1: 0.4457
 epoch: 90, train_loss: 0.8977, test_loss: 1.2145, test_f1: 0.4463
 epoch: 91, train_loss: 0.8959, test_loss: 1.1949, test_f1: 0.4456
 epoch: 92, train_loss: 0.8935, test_loss: 1.2140, test_f1: 0.4350
 epoch: 93, train_loss: 0.8966, test_loss: 1.2297, test_f1: 0.4386
 epoch: 94, train_loss: 0.9015, test_loss: 1.2317, test_f1: 0.4420
 epoch: 95, train_loss: 0.8865, test_loss: 1.2002, test_f1: 0.4485
 epoch: 96, train_loss: 0.8819, test_loss: 1.1730, test_f1: 0.4405
 epoch: 97, train_loss: 0.8751, test_loss: 1.1904, test_f1: 0.4336
 epoch: 98, train_loss: 0.8897, test_loss: 1.1828, test_f1: 0.4346
 epoch: 99, train_loss: 0.8711, test_loss: 1.2491, test_f1: 0.4396
##################ITERATION #1 ****************************************
 epoch: 0, train_loss: 1.3365, test_loss: 1.3454, test_f1: 0.2274
 epoch: 1, train_loss: 1.3213, test_loss: 1.3328, test_f1: 0.2274
 epoch: 2, train_loss: 1.3111, test_loss: 1.3219, test_f1: 0.2274
 epoch: 3, train_loss: 1.2995, test_loss: 1.3064, test_f1: 0.2274
 epoch: 4, train_loss: 1.2893, test_loss: 1.2900, test_f1: 0.2549
 epoch: 5, train_loss: 1.2781, test_loss: 1.2732, test_f1: 0.2571
 epoch: 6, train_loss: 1.2679, test_loss: 1.2584, test_f1: 0.2873
 epoch: 7, train_loss: 1.2556, test_loss: 1.2433, test_f1: 0.2910
 epoch: 8, train_loss: 1.2451, test_loss: 1.2287, test_f1: 0.3048
 epoch: 9, train_loss: 1.2366, test_loss: 1.2160, test_f1: 0.3250
 epoch: 10, train_loss: 1.2233, test_loss: 1.2044, test_f1: 0.3241
 epoch: 11, train_loss: 1.2121, test_loss: 1.1944, test_f1: 0.3216
 epoch: 12, train_loss: 1.2052, test_loss: 1.1826, test_f1: 0.3262
 epoch: 13, train_loss: 1.1962, test_loss: 1.1733, test_f1: 0.3519
 epoch: 14, train_loss: 1.1846, test_loss: 1.1642, test_f1: 0.3617
 epoch: 15, train_loss: 1.1776, test_loss: 1.1564, test_f1: 0.3670
 epoch: 16, train_loss: 1.1690, test_loss: 1.1479, test_f1: 0.3908
 epoch: 17, train_loss: 1.1635, test_loss: 1.1415, test_f1: 0.3843
 epoch: 18, train_loss: 1.1522, test_loss: 1.1326, test_f1: 0.3903
 epoch: 19, train_loss: 1.1508, test_loss: 1.1305, test_f1: 0.4003
 epoch: 20, train_loss: 1.1371, test_loss: 1.1215, test_f1: 0.4115
 epoch: 21, train_loss: 1.1307, test_loss: 1.1127, test_f1: 0.4299
 epoch: 22, train_loss: 1.1219, test_loss: 1.1089, test_f1: 0.4216
 epoch: 23, train_loss: 1.1108, test_loss: 1.1038, test_f1: 0.4331
 epoch: 24, train_loss: 1.1064, test_loss: 1.0942, test_f1: 0.4353
 epoch: 25, train_loss: 1.0946, test_loss: 1.0896, test_f1: 0.4344
 epoch: 26, train_loss: 1.0890, test_loss: 1.0931, test_f1: 0.4288
 epoch: 27, train_loss: 1.0785, test_loss: 1.0805, test_f1: 0.4417
 epoch: 28, train_loss: 1.0668, test_loss: 1.0770, test_f1: 0.4469
 epoch: 29, train_loss: 1.0664, test_loss: 1.0814, test_f1: 0.4351
 epoch: 30, train_loss: 1.0571, test_loss: 1.0716, test_f1: 0.4463
 epoch: 31, train_loss: 1.0465, test_loss: 1.0748, test_f1: 0.4501
 epoch: 32, train_loss: 1.0391, test_loss: 1.0709, test_f1: 0.4584
 epoch: 33, train_loss: 1.0259, test_loss: 1.0677, test_f1: 0.4660
 epoch: 34, train_loss: 1.0203, test_loss: 1.0784, test_f1: 0.4634
 epoch: 35, train_loss: 1.0042, test_loss: 1.0738, test_f1: 0.4649
 epoch: 36, train_loss: 1.0084, test_loss: 1.0655, test_f1: 0.4677
 epoch: 37, train_loss: 0.9976, test_loss: 1.0675, test_f1: 0.4683
 epoch: 38, train_loss: 0.9906, test_loss: 1.0669, test_f1: 0.4546
 epoch: 39, train_loss: 0.9857, test_loss: 1.0739, test_f1: 0.4633
 epoch: 40, train_loss: 0.9796, test_loss: 1.0731, test_f1: 0.4658
 epoch: 41, train_loss: 0.9777, test_loss: 1.0716, test_f1: 0.4605
 epoch: 42, train_loss: 0.9673, test_loss: 1.0681, test_f1: 0.4628
 epoch: 43, train_loss: 0.9587, test_loss: 1.0636, test_f1: 0.4631
 epoch: 44, train_loss: 0.9526, test_loss: 1.0767, test_f1: 0.4634
 epoch: 45, train_loss: 0.9515, test_loss: 1.0755, test_f1: 0.4451
 epoch: 46, train_loss: 0.9484, test_loss: 1.0780, test_f1: 0.4494
 epoch: 47, train_loss: 0.9405, test_loss: 1.0764, test_f1: 0.4665
 epoch: 48, train_loss: 0.9356, test_loss: 1.1056, test_f1: 0.4584
 epoch: 49, train_loss: 0.9340, test_loss: 1.1132, test_f1: 0.4524
 epoch: 50, train_loss: 0.9232, test_loss: 1.0849, test_f1: 0.4482
 epoch: 51, train_loss: 0.9080, test_loss: 1.1032, test_f1: 0.4610
 epoch: 52, train_loss: 0.9018, test_loss: 1.1059, test_f1: 0.4589
 epoch: 53, train_loss: 0.8994, test_loss: 1.1053, test_f1: 0.4573
 epoch: 54, train_loss: 0.9043, test_loss: 1.1165, test_f1: 0.4441
 epoch: 55, train_loss: 0.8915, test_loss: 1.1266, test_f1: 0.4465
 epoch: 56, train_loss: 0.8889, test_loss: 1.1334, test_f1: 0.4565
 epoch: 57, train_loss: 0.8955, test_loss: 1.1228, test_f1: 0.4467
 epoch: 58, train_loss: 0.8950, test_loss: 1.1243, test_f1: 0.4517
 epoch: 59, train_loss: 0.8867, test_loss: 1.1235, test_f1: 0.4599
 epoch: 60, train_loss: 0.8924, test_loss: 1.1223, test_f1: 0.4616
 epoch: 61, train_loss: 0.8756, test_loss: 1.1135, test_f1: 0.4651
 epoch: 62, train_loss: 0.8811, test_loss: 1.1234, test_f1: 0.4638
 epoch: 63, train_loss: 0.8750, test_loss: 1.1397, test_f1: 0.4559
 epoch: 64, train_loss: 0.8720, test_loss: 1.1446, test_f1: 0.4520
 epoch: 65, train_loss: 0.8775, test_loss: 1.1516, test_f1: 0.4515
 epoch: 66, train_loss: 0.8694, test_loss: 1.1497, test_f1: 0.4519
 epoch: 67, train_loss: 0.8790, test_loss: 1.1448, test_f1: 0.4579
 epoch: 68, train_loss: 0.8665, test_loss: 1.1568, test_f1: 0.4470
 epoch: 69, train_loss: 0.8601, test_loss: 1.1491, test_f1: 0.4525
 epoch: 70, train_loss: 0.8640, test_loss: 1.1375, test_f1: 0.4640
 epoch: 71, train_loss: 0.8560, test_loss: 1.1574, test_f1: 0.4613
 epoch: 72, train_loss: 0.8557, test_loss: 1.1775, test_f1: 0.4692
 epoch: 73, train_loss: 0.8480, test_loss: 1.1669, test_f1: 0.4718
 epoch: 74, train_loss: 0.8620, test_loss: 1.1714, test_f1: 0.4595
 epoch: 75, train_loss: 0.8439, test_loss: 1.1592, test_f1: 0.4659
 epoch: 76, train_loss: 0.8563, test_loss: 1.1767, test_f1: 0.4724
 epoch: 77, train_loss: 0.8490, test_loss: 1.1830, test_f1: 0.4586
 epoch: 78, train_loss: 0.8530, test_loss: 1.1802, test_f1: 0.4508
 epoch: 79, train_loss: 0.8491, test_loss: 1.1872, test_f1: 0.4580
 epoch: 80, train_loss: 0.8485, test_loss: 1.1725, test_f1: 0.4639
 epoch: 81, train_loss: 0.8241, test_loss: 1.1722, test_f1: 0.4584
 epoch: 82, train_loss: 0.8183, test_loss: 1.1927, test_f1: 0.4627
 epoch: 83, train_loss: 0.8377, test_loss: 1.1903, test_f1: 0.4766
 epoch: 84, train_loss: 0.8325, test_loss: 1.1821, test_f1: 0.4687
 epoch: 85, train_loss: 0.8400, test_loss: 1.1798, test_f1: 0.4672
 epoch: 86, train_loss: 0.8268, test_loss: 1.1909, test_f1: 0.4571
 epoch: 87, train_loss: 0.8328, test_loss: 1.1895, test_f1: 0.4635
 epoch: 88, train_loss: 0.8235, test_loss: 1.1949, test_f1: 0.4666
 epoch: 89, train_loss: 0.8218, test_loss: 1.2171, test_f1: 0.4650
 epoch: 90, train_loss: 0.8245, test_loss: 1.2085, test_f1: 0.4415
 epoch: 91, train_loss: 0.8221, test_loss: 1.2097, test_f1: 0.4601
 epoch: 92, train_loss: 0.8220, test_loss: 1.2017, test_f1: 0.4615
 epoch: 93, train_loss: 0.8192, test_loss: 1.2243, test_f1: 0.4562
 epoch: 94, train_loss: 0.8212, test_loss: 1.1816, test_f1: 0.4618
 epoch: 95, train_loss: 0.8184, test_loss: 1.2131, test_f1: 0.4651
 epoch: 96, train_loss: 0.8104, test_loss: 1.2215, test_f1: 0.4677
 epoch: 97, train_loss: 0.8060, test_loss: 1.1965, test_f1: 0.4546
 epoch: 98, train_loss: 0.8170, test_loss: 1.2102, test_f1: 0.4621
 epoch: 99, train_loss: 0.8023, test_loss: 1.2193, test_f1: 0.4536
##################ITERATION #2 ****************************************
 epoch: 0, train_loss: 1.3211, test_loss: 1.3385, test_f1: 0.2274
 epoch: 1, train_loss: 1.2955, test_loss: 1.3195, test_f1: 0.2274
 epoch: 2, train_loss: 1.2779, test_loss: 1.2906, test_f1: 0.2274
 epoch: 3, train_loss: 1.2662, test_loss: 1.2636, test_f1: 0.2497
 epoch: 4, train_loss: 1.2533, test_loss: 1.2439, test_f1: 0.2737
 epoch: 5, train_loss: 1.2441, test_loss: 1.2298, test_f1: 0.3233
 epoch: 6, train_loss: 1.2352, test_loss: 1.2188, test_f1: 0.3169
 epoch: 7, train_loss: 1.2223, test_loss: 1.2086, test_f1: 0.3131
 epoch: 8, train_loss: 1.2146, test_loss: 1.1976, test_f1: 0.3424
 epoch: 9, train_loss: 1.2024, test_loss: 1.1888, test_f1: 0.3752
 epoch: 10, train_loss: 1.1949, test_loss: 1.1795, test_f1: 0.4083
 epoch: 11, train_loss: 1.1847, test_loss: 1.1698, test_f1: 0.4335
 epoch: 12, train_loss: 1.1744, test_loss: 1.1603, test_f1: 0.4555
 epoch: 13, train_loss: 1.1625, test_loss: 1.1524, test_f1: 0.4642
 epoch: 14, train_loss: 1.1539, test_loss: 1.1454, test_f1: 0.4689
 epoch: 15, train_loss: 1.1401, test_loss: 1.1370, test_f1: 0.4712
 epoch: 16, train_loss: 1.1362, test_loss: 1.1312, test_f1: 0.4514
 epoch: 17, train_loss: 1.1257, test_loss: 1.1247, test_f1: 0.4535
 epoch: 18, train_loss: 1.1209, test_loss: 1.1177, test_f1: 0.4571
 epoch: 19, train_loss: 1.1081, test_loss: 1.1094, test_f1: 0.4572
 epoch: 20, train_loss: 1.0975, test_loss: 1.1024, test_f1: 0.4607
 epoch: 21, train_loss: 1.0985, test_loss: 1.0945, test_f1: 0.4648
 epoch: 22, train_loss: 1.0823, test_loss: 1.0923, test_f1: 0.4592
 epoch: 23, train_loss: 1.0663, test_loss: 1.0851, test_f1: 0.4611
 epoch: 24, train_loss: 1.0591, test_loss: 1.0786, test_f1: 0.4641
 epoch: 25, train_loss: 1.0494, test_loss: 1.0773, test_f1: 0.4578
 epoch: 26, train_loss: 1.0455, test_loss: 1.0716, test_f1: 0.4655
 epoch: 27, train_loss: 1.0430, test_loss: 1.0732, test_f1: 0.4586
 epoch: 28, train_loss: 1.0262, test_loss: 1.0713, test_f1: 0.4495
 epoch: 29, train_loss: 1.0217, test_loss: 1.0658, test_f1: 0.4685
 epoch: 30, train_loss: 1.0116, test_loss: 1.0617, test_f1: 0.4653
 epoch: 31, train_loss: 1.0037, test_loss: 1.0622, test_f1: 0.4635
 epoch: 32, train_loss: 1.0055, test_loss: 1.0540, test_f1: 0.4678
 epoch: 33, train_loss: 0.9892, test_loss: 1.0570, test_f1: 0.4567
 epoch: 34, train_loss: 0.9861, test_loss: 1.0540, test_f1: 0.4671
 epoch: 35, train_loss: 0.9769, test_loss: 1.0635, test_f1: 0.4495
 epoch: 36, train_loss: 0.9789, test_loss: 1.0628, test_f1: 0.4561
 epoch: 37, train_loss: 0.9640, test_loss: 1.0628, test_f1: 0.4500
 epoch: 38, train_loss: 0.9701, test_loss: 1.0673, test_f1: 0.4488
 epoch: 39, train_loss: 0.9575, test_loss: 1.0592, test_f1: 0.4512
 epoch: 40, train_loss: 0.9401, test_loss: 1.0611, test_f1: 0.4544
 epoch: 41, train_loss: 0.9378, test_loss: 1.0606, test_f1: 0.4436
 epoch: 42, train_loss: 0.9341, test_loss: 1.0530, test_f1: 0.4580
 epoch: 43, train_loss: 0.9234, test_loss: 1.0632, test_f1: 0.4587
 epoch: 44, train_loss: 0.9277, test_loss: 1.0651, test_f1: 0.4497
 epoch: 45, train_loss: 0.9219, test_loss: 1.0665, test_f1: 0.4572
 epoch: 46, train_loss: 0.9061, test_loss: 1.0771, test_f1: 0.4454
 epoch: 47, train_loss: 0.9085, test_loss: 1.0730, test_f1: 0.4554
 epoch: 48, train_loss: 0.9021, test_loss: 1.0868, test_f1: 0.4517
 epoch: 49, train_loss: 0.8927, test_loss: 1.0895, test_f1: 0.4583
 epoch: 50, train_loss: 0.8991, test_loss: 1.0948, test_f1: 0.4507
 epoch: 51, train_loss: 0.8801, test_loss: 1.0926, test_f1: 0.4517
 epoch: 52, train_loss: 0.8728, test_loss: 1.0884, test_f1: 0.4553
 epoch: 53, train_loss: 0.8710, test_loss: 1.0924, test_f1: 0.4591
 epoch: 54, train_loss: 0.8782, test_loss: 1.1003, test_f1: 0.4606
 epoch: 55, train_loss: 0.8649, test_loss: 1.0876, test_f1: 0.4496
 epoch: 56, train_loss: 0.8733, test_loss: 1.0832, test_f1: 0.4549
 epoch: 57, train_loss: 0.8527, test_loss: 1.0865, test_f1: 0.4552
 epoch: 58, train_loss: 0.8664, test_loss: 1.0915, test_f1: 0.4638
 epoch: 59, train_loss: 0.8545, test_loss: 1.0860, test_f1: 0.4636
 epoch: 60, train_loss: 0.8591, test_loss: 1.1054, test_f1: 0.4548
 epoch: 61, train_loss: 0.8540, test_loss: 1.1146, test_f1: 0.4502
 epoch: 62, train_loss: 0.8647, test_loss: 1.1071, test_f1: 0.4533
 epoch: 63, train_loss: 0.8439, test_loss: 1.1013, test_f1: 0.4638
 epoch: 64, train_loss: 0.8509, test_loss: 1.1013, test_f1: 0.4604
 epoch: 65, train_loss: 0.8413, test_loss: 1.1021, test_f1: 0.4584
 epoch: 66, train_loss: 0.8468, test_loss: 1.1017, test_f1: 0.4560
 epoch: 67, train_loss: 0.8391, test_loss: 1.1028, test_f1: 0.4696
 epoch: 68, train_loss: 0.8416, test_loss: 1.1105, test_f1: 0.4605
 epoch: 69, train_loss: 0.8375, test_loss: 1.1109, test_f1: 0.4552
 epoch: 70, train_loss: 0.8293, test_loss: 1.1050, test_f1: 0.4628
 epoch: 71, train_loss: 0.8284, test_loss: 1.1046, test_f1: 0.4754
 epoch: 72, train_loss: 0.8362, test_loss: 1.1191, test_f1: 0.4745
 epoch: 73, train_loss: 0.8226, test_loss: 1.1218, test_f1: 0.4653
 epoch: 74, train_loss: 0.8127, test_loss: 1.1189, test_f1: 0.4611
 epoch: 75, train_loss: 0.8253, test_loss: 1.1085, test_f1: 0.4648
 epoch: 76, train_loss: 0.8271, test_loss: 1.1269, test_f1: 0.4579
 epoch: 77, train_loss: 0.8111, test_loss: 1.1298, test_f1: 0.4564
 epoch: 78, train_loss: 0.8114, test_loss: 1.1327, test_f1: 0.4669
 epoch: 79, train_loss: 0.8083, test_loss: 1.1313, test_f1: 0.4608
 epoch: 80, train_loss: 0.8031, test_loss: 1.1133, test_f1: 0.4703
 epoch: 81, train_loss: 0.8076, test_loss: 1.1298, test_f1: 0.4632
 epoch: 82, train_loss: 0.8228, test_loss: 1.1374, test_f1: 0.4591
 epoch: 83, train_loss: 0.7995, test_loss: 1.1369, test_f1: 0.4539
 epoch: 84, train_loss: 0.8042, test_loss: 1.1262, test_f1: 0.4527
 epoch: 85, train_loss: 0.8034, test_loss: 1.1248, test_f1: 0.4675
 epoch: 86, train_loss: 0.7957, test_loss: 1.1404, test_f1: 0.4579
 epoch: 87, train_loss: 0.8038, test_loss: 1.1354, test_f1: 0.4569
 epoch: 88, train_loss: 0.7908, test_loss: 1.1267, test_f1: 0.4589
 epoch: 89, train_loss: 0.7852, test_loss: 1.1347, test_f1: 0.4559
 epoch: 90, train_loss: 0.7884, test_loss: 1.1325, test_f1: 0.4705
 epoch: 91, train_loss: 0.7831, test_loss: 1.1429, test_f1: 0.4655
 epoch: 92, train_loss: 0.7851, test_loss: 1.1416, test_f1: 0.4692
 epoch: 93, train_loss: 0.7770, test_loss: 1.1340, test_f1: 0.4679
 epoch: 94, train_loss: 0.7811, test_loss: 1.1331, test_f1: 0.4672
 epoch: 95, train_loss: 0.7819, test_loss: 1.1508, test_f1: 0.4642
 epoch: 96, train_loss: 0.7782, test_loss: 1.1450, test_f1: 0.4636
 epoch: 97, train_loss: 0.7774, test_loss: 1.1402, test_f1: 0.4679
 epoch: 98, train_loss: 0.7761, test_loss: 1.1570, test_f1: 0.4681
 epoch: 99, train_loss: 0.7662, test_loss: 1.1456, test_f1: 0.4681
##################ITERATION #3 ****************************************
 epoch: 0, train_loss: 1.3072, test_loss: 1.3244, test_f1: 0.2274
 epoch: 1, train_loss: 1.2824, test_loss: 1.3044, test_f1: 0.2274
 epoch: 2, train_loss: 1.2736, test_loss: 1.2738, test_f1: 0.2555
 epoch: 3, train_loss: 1.2571, test_loss: 1.2507, test_f1: 0.2666
 epoch: 4, train_loss: 1.2516, test_loss: 1.2336, test_f1: 0.2908
 epoch: 5, train_loss: 1.2410, test_loss: 1.2240, test_f1: 0.3178
 epoch: 6, train_loss: 1.2322, test_loss: 1.2163, test_f1: 0.3239
 epoch: 7, train_loss: 1.2197, test_loss: 1.2061, test_f1: 0.3367
 epoch: 8, train_loss: 1.2158, test_loss: 1.1975, test_f1: 0.3442
 epoch: 9, train_loss: 1.2056, test_loss: 1.1905, test_f1: 0.3503
 epoch: 10, train_loss: 1.1970, test_loss: 1.1846, test_f1: 0.3577
 epoch: 11, train_loss: 1.1854, test_loss: 1.1785, test_f1: 0.3587
 epoch: 12, train_loss: 1.1848, test_loss: 1.1701, test_f1: 0.3746
 epoch: 13, train_loss: 1.1789, test_loss: 1.1663, test_f1: 0.3994
 epoch: 14, train_loss: 1.1710, test_loss: 1.1630, test_f1: 0.4201
 epoch: 15, train_loss: 1.1663, test_loss: 1.1571, test_f1: 0.4308
 epoch: 16, train_loss: 1.1576, test_loss: 1.1499, test_f1: 0.4314
 epoch: 17, train_loss: 1.1589, test_loss: 1.1473, test_f1: 0.4328
 epoch: 18, train_loss: 1.1455, test_loss: 1.1428, test_f1: 0.4350
 epoch: 19, train_loss: 1.1442, test_loss: 1.1403, test_f1: 0.4261
 epoch: 20, train_loss: 1.1336, test_loss: 1.1315, test_f1: 0.4208
 epoch: 21, train_loss: 1.1312, test_loss: 1.1275, test_f1: 0.4263
 epoch: 22, train_loss: 1.1218, test_loss: 1.1241, test_f1: 0.4315
 epoch: 23, train_loss: 1.1251, test_loss: 1.1199, test_f1: 0.4251
 epoch: 24, train_loss: 1.1108, test_loss: 1.1160, test_f1: 0.4398
 epoch: 25, train_loss: 1.1056, test_loss: 1.1124, test_f1: 0.4447
 epoch: 26, train_loss: 1.1000, test_loss: 1.1099, test_f1: 0.4463
 epoch: 27, train_loss: 1.0967, test_loss: 1.1012, test_f1: 0.4462
 epoch: 28, train_loss: 1.0884, test_loss: 1.0935, test_f1: 0.4520
 epoch: 29, train_loss: 1.0899, test_loss: 1.0884, test_f1: 0.4771
 epoch: 30, train_loss: 1.0685, test_loss: 1.0853, test_f1: 0.4748
 epoch: 31, train_loss: 1.0657, test_loss: 1.0926, test_f1: 0.4764
 epoch: 32, train_loss: 1.0708, test_loss: 1.0938, test_f1: 0.4773
 epoch: 33, train_loss: 1.0548, test_loss: 1.0951, test_f1: 0.4527
 epoch: 34, train_loss: 1.0446, test_loss: 1.0812, test_f1: 0.4577
 epoch: 35, train_loss: 1.0514, test_loss: 1.0845, test_f1: 0.4558
 epoch: 36, train_loss: 1.0425, test_loss: 1.0828, test_f1: 0.4552
 epoch: 37, train_loss: 1.0355, test_loss: 1.0822, test_f1: 0.4601
 epoch: 38, train_loss: 1.0189, test_loss: 1.0775, test_f1: 0.4673
 epoch: 39, train_loss: 1.0306, test_loss: 1.0748, test_f1: 0.4511
 epoch: 40, train_loss: 1.0265, test_loss: 1.0720, test_f1: 0.4580
 epoch: 41, train_loss: 1.0168, test_loss: 1.0621, test_f1: 0.4602
 epoch: 42, train_loss: 1.0067, test_loss: 1.0671, test_f1: 0.4633
 epoch: 43, train_loss: 1.0008, test_loss: 1.0721, test_f1: 0.4694
 epoch: 44, train_loss: 1.0046, test_loss: 1.0661, test_f1: 0.4646
 epoch: 45, train_loss: 0.9948, test_loss: 1.0560, test_f1: 0.4722
 epoch: 46, train_loss: 0.9865, test_loss: 1.0633, test_f1: 0.4689
 epoch: 47, train_loss: 0.9827, test_loss: 1.0542, test_f1: 0.4728
 epoch: 48, train_loss: 0.9807, test_loss: 1.0637, test_f1: 0.4653
 epoch: 49, train_loss: 0.9711, test_loss: 1.0565, test_f1: 0.4694
 epoch: 50, train_loss: 0.9763, test_loss: 1.0696, test_f1: 0.4419
 epoch: 51, train_loss: 0.9576, test_loss: 1.0558, test_f1: 0.4630
 epoch: 52, train_loss: 0.9647, test_loss: 1.0573, test_f1: 0.4608
 epoch: 53, train_loss: 0.9589, test_loss: 1.0718, test_f1: 0.4501
 epoch: 54, train_loss: 0.9618, test_loss: 1.0702, test_f1: 0.4523
 epoch: 55, train_loss: 0.9553, test_loss: 1.0463, test_f1: 0.4593
 epoch: 56, train_loss: 0.9454, test_loss: 1.0475, test_f1: 0.4616
 epoch: 57, train_loss: 0.9469, test_loss: 1.0522, test_f1: 0.4641
 epoch: 58, train_loss: 0.9439, test_loss: 1.0581, test_f1: 0.4458
 epoch: 59, train_loss: 0.9396, test_loss: 1.0539, test_f1: 0.4571
 epoch: 60, train_loss: 0.9465, test_loss: 1.0592, test_f1: 0.4552
 epoch: 61, train_loss: 0.9341, test_loss: 1.0520, test_f1: 0.4627
 epoch: 62, train_loss: 0.9318, test_loss: 1.0524, test_f1: 0.4707
 epoch: 63, train_loss: 0.9387, test_loss: 1.0623, test_f1: 0.4676
 epoch: 64, train_loss: 0.9325, test_loss: 1.0482, test_f1: 0.4777
 epoch: 65, train_loss: 0.9274, test_loss: 1.0566, test_f1: 0.4765
 epoch: 66, train_loss: 0.9247, test_loss: 1.0507, test_f1: 0.4742
 epoch: 67, train_loss: 0.9146, test_loss: 1.0530, test_f1: 0.4582
 epoch: 68, train_loss: 0.9117, test_loss: 1.0538, test_f1: 0.4631
 epoch: 69, train_loss: 0.9203, test_loss: 1.0478, test_f1: 0.4808
 epoch: 70, train_loss: 0.9219, test_loss: 1.0578, test_f1: 0.4795
 epoch: 71, train_loss: 0.9136, test_loss: 1.0483, test_f1: 0.4746
 epoch: 72, train_loss: 0.9186, test_loss: 1.0566, test_f1: 0.4761
 epoch: 73, train_loss: 0.9042, test_loss: 1.0455, test_f1: 0.4765
 epoch: 74, train_loss: 0.9086, test_loss: 1.0573, test_f1: 0.4665
 epoch: 75, train_loss: 0.9119, test_loss: 1.0646, test_f1: 0.4641
 epoch: 76, train_loss: 0.9068, test_loss: 1.0615, test_f1: 0.4734
 epoch: 77, train_loss: 0.8986, test_loss: 1.0677, test_f1: 0.4849
 epoch: 78, train_loss: 0.9084, test_loss: 1.0652, test_f1: 0.4721
 epoch: 79, train_loss: 0.9056, test_loss: 1.0572, test_f1: 0.4742
 epoch: 80, train_loss: 0.8938, test_loss: 1.0458, test_f1: 0.4727
 epoch: 81, train_loss: 0.8981, test_loss: 1.0513, test_f1: 0.4676
 epoch: 82, train_loss: 0.8776, test_loss: 1.0611, test_f1: 0.4677
 epoch: 83, train_loss: 0.8850, test_loss: 1.0727, test_f1: 0.4682
 epoch: 84, train_loss: 0.8843, test_loss: 1.0659, test_f1: 0.4689
 epoch: 85, train_loss: 0.8972, test_loss: 1.0509, test_f1: 0.4765
 epoch: 86, train_loss: 0.8803, test_loss: 1.0658, test_f1: 0.4731
 epoch: 87, train_loss: 0.8856, test_loss: 1.0757, test_f1: 0.4652
 epoch: 88, train_loss: 0.8909, test_loss: 1.0714, test_f1: 0.4656
 epoch: 89, train_loss: 0.8781, test_loss: 1.0674, test_f1: 0.4679
 epoch: 90, train_loss: 0.8816, test_loss: 1.0655, test_f1: 0.4706
 epoch: 91, train_loss: 0.8877, test_loss: 1.0770, test_f1: 0.4781
 epoch: 92, train_loss: 0.8787, test_loss: 1.0777, test_f1: 0.4635
 epoch: 93, train_loss: 0.8659, test_loss: 1.0619, test_f1: 0.4630
 epoch: 94, train_loss: 0.8611, test_loss: 1.0668, test_f1: 0.4678
 epoch: 95, train_loss: 0.8731, test_loss: 1.0737, test_f1: 0.4699
 epoch: 96, train_loss: 0.8631, test_loss: 1.0722, test_f1: 0.4631
 epoch: 97, train_loss: 0.8662, test_loss: 1.0637, test_f1: 0.4664
 epoch: 98, train_loss: 0.8667, test_loss: 1.0746, test_f1: 0.4699
 epoch: 99, train_loss: 0.8581, test_loss: 1.0835, test_f1: 0.4726
##################ITERATION #4 ****************************************
 epoch: 0, train_loss: 1.3099, test_loss: 1.3113, test_f1: 0.2274
 epoch: 1, train_loss: 1.2773, test_loss: 1.2908, test_f1: 0.2274
 epoch: 2, train_loss: 1.2638, test_loss: 1.2630, test_f1: 0.2557
 epoch: 3, train_loss: 1.2552, test_loss: 1.2369, test_f1: 0.3003
 epoch: 4, train_loss: 1.2439, test_loss: 1.2210, test_f1: 0.3189
 epoch: 5, train_loss: 1.2343, test_loss: 1.2105, test_f1: 0.3474
 epoch: 6, train_loss: 1.2237, test_loss: 1.2026, test_f1: 0.3728
 epoch: 7, train_loss: 1.2155, test_loss: 1.1956, test_f1: 0.3932
 epoch: 8, train_loss: 1.2121, test_loss: 1.1876, test_f1: 0.4000
 epoch: 9, train_loss: 1.2029, test_loss: 1.1801, test_f1: 0.4080
 epoch: 10, train_loss: 1.1977, test_loss: 1.1736, test_f1: 0.4074
 epoch: 11, train_loss: 1.1913, test_loss: 1.1691, test_f1: 0.4169
 epoch: 12, train_loss: 1.1821, test_loss: 1.1639, test_f1: 0.4251
 epoch: 13, train_loss: 1.1804, test_loss: 1.1572, test_f1: 0.4317
 epoch: 14, train_loss: 1.1707, test_loss: 1.1514, test_f1: 0.4311
 epoch: 15, train_loss: 1.1621, test_loss: 1.1476, test_f1: 0.4215
 epoch: 16, train_loss: 1.1613, test_loss: 1.1418, test_f1: 0.4290
 epoch: 17, train_loss: 1.1526, test_loss: 1.1354, test_f1: 0.4205
 epoch: 18, train_loss: 1.1442, test_loss: 1.1309, test_f1: 0.4165
 epoch: 19, train_loss: 1.1426, test_loss: 1.1270, test_f1: 0.4152
 epoch: 20, train_loss: 1.1360, test_loss: 1.1216, test_f1: 0.4211
 epoch: 21, train_loss: 1.1303, test_loss: 1.1165, test_f1: 0.4195
 epoch: 22, train_loss: 1.1259, test_loss: 1.1134, test_f1: 0.4173
 epoch: 23, train_loss: 1.1143, test_loss: 1.1087, test_f1: 0.4312
 epoch: 24, train_loss: 1.1113, test_loss: 1.1089, test_f1: 0.4317
 epoch: 25, train_loss: 1.1044, test_loss: 1.1038, test_f1: 0.4249
 epoch: 26, train_loss: 1.0901, test_loss: 1.0988, test_f1: 0.4379
 epoch: 27, train_loss: 1.0882, test_loss: 1.0935, test_f1: 0.4186
 epoch: 28, train_loss: 1.0903, test_loss: 1.0938, test_f1: 0.4217
 epoch: 29, train_loss: 1.0758, test_loss: 1.0844, test_f1: 0.4292
 epoch: 30, train_loss: 1.0691, test_loss: 1.0789, test_f1: 0.4300
 epoch: 31, train_loss: 1.0667, test_loss: 1.0743, test_f1: 0.4325
 epoch: 32, train_loss: 1.0587, test_loss: 1.0852, test_f1: 0.4250
 epoch: 33, train_loss: 1.0501, test_loss: 1.0651, test_f1: 0.4347
 epoch: 34, train_loss: 1.0470, test_loss: 1.0760, test_f1: 0.4341
 epoch: 35, train_loss: 1.0235, test_loss: 1.0755, test_f1: 0.4377
 epoch: 36, train_loss: 1.0344, test_loss: 1.0646, test_f1: 0.4444
 epoch: 37, train_loss: 1.0215, test_loss: 1.0584, test_f1: 0.4476
 epoch: 38, train_loss: 1.0208, test_loss: 1.0586, test_f1: 0.4406
 epoch: 39, train_loss: 1.0172, test_loss: 1.0652, test_f1: 0.4499
 epoch: 40, train_loss: 1.0060, test_loss: 1.0622, test_f1: 0.4617
 epoch: 41, train_loss: 0.9948, test_loss: 1.0729, test_f1: 0.4679
 epoch: 42, train_loss: 0.9947, test_loss: 1.0706, test_f1: 0.4509
 epoch: 43, train_loss: 0.9916, test_loss: 1.0517, test_f1: 0.4578
 epoch: 44, train_loss: 0.9756, test_loss: 1.0453, test_f1: 0.4681
 epoch: 45, train_loss: 0.9826, test_loss: 1.0546, test_f1: 0.4623
 epoch: 46, train_loss: 0.9739, test_loss: 1.0567, test_f1: 0.4458
 epoch: 47, train_loss: 0.9590, test_loss: 1.0607, test_f1: 0.4657
 epoch: 48, train_loss: 0.9681, test_loss: 1.0609, test_f1: 0.4685
 epoch: 49, train_loss: 0.9489, test_loss: 1.0698, test_f1: 0.4570
 epoch: 50, train_loss: 0.9423, test_loss: 1.0667, test_f1: 0.4644
 epoch: 51, train_loss: 0.9370, test_loss: 1.0788, test_f1: 0.4587
 epoch: 52, train_loss: 0.9470, test_loss: 1.0750, test_f1: 0.4625
 epoch: 53, train_loss: 0.9366, test_loss: 1.0679, test_f1: 0.4683
 epoch: 54, train_loss: 0.9242, test_loss: 1.0708, test_f1: 0.4531
 epoch: 55, train_loss: 0.9457, test_loss: 1.0672, test_f1: 0.4548
 epoch: 56, train_loss: 0.9250, test_loss: 1.0767, test_f1: 0.4577
 epoch: 57, train_loss: 0.9308, test_loss: 1.0797, test_f1: 0.4582
 epoch: 58, train_loss: 0.9213, test_loss: 1.0685, test_f1: 0.4624
 epoch: 59, train_loss: 0.9195, test_loss: 1.0854, test_f1: 0.4508
 epoch: 60, train_loss: 0.9152, test_loss: 1.0763, test_f1: 0.4647
 epoch: 61, train_loss: 0.9267, test_loss: 1.0783, test_f1: 0.4568
 epoch: 62, train_loss: 0.9113, test_loss: 1.0836, test_f1: 0.4606
 epoch: 63, train_loss: 0.9185, test_loss: 1.0950, test_f1: 0.4519
 epoch: 64, train_loss: 0.9003, test_loss: 1.0936, test_f1: 0.4595
 epoch: 65, train_loss: 0.8993, test_loss: 1.0981, test_f1: 0.4535
 epoch: 66, train_loss: 0.8996, test_loss: 1.0849, test_f1: 0.4565
 epoch: 67, train_loss: 0.9007, test_loss: 1.0967, test_f1: 0.4541
 epoch: 68, train_loss: 0.8948, test_loss: 1.0820, test_f1: 0.4549
 epoch: 69, train_loss: 0.9027, test_loss: 1.0869, test_f1: 0.4562
 epoch: 70, train_loss: 0.8940, test_loss: 1.0926, test_f1: 0.4535
 epoch: 71, train_loss: 0.8963, test_loss: 1.0845, test_f1: 0.4567
 epoch: 72, train_loss: 0.8923, test_loss: 1.0864, test_f1: 0.4543
 epoch: 73, train_loss: 0.8912, test_loss: 1.0986, test_f1: 0.4533
 epoch: 74, train_loss: 0.8876, test_loss: 1.0756, test_f1: 0.4599
 epoch: 75, train_loss: 0.8801, test_loss: 1.0915, test_f1: 0.4526
 epoch: 76, train_loss: 0.8851, test_loss: 1.0840, test_f1: 0.4592
 epoch: 77, train_loss: 0.8797, test_loss: 1.1004, test_f1: 0.4611
 epoch: 78, train_loss: 0.8745, test_loss: 1.1027, test_f1: 0.4634
 epoch: 79, train_loss: 0.8939, test_loss: 1.1105, test_f1: 0.4554
 epoch: 80, train_loss: 0.8752, test_loss: 1.0965, test_f1: 0.4628
 epoch: 81, train_loss: 0.8858, test_loss: 1.1010, test_f1: 0.4556
 epoch: 82, train_loss: 0.8711, test_loss: 1.0905, test_f1: 0.4564
 epoch: 83, train_loss: 0.8712, test_loss: 1.1320, test_f1: 0.4583
 epoch: 84, train_loss: 0.8752, test_loss: 1.1084, test_f1: 0.4605
 epoch: 85, train_loss: 0.8724, test_loss: 1.1169, test_f1: 0.4638
 epoch: 86, train_loss: 0.8629, test_loss: 1.1144, test_f1: 0.4581
 epoch: 87, train_loss: 0.8682, test_loss: 1.1133, test_f1: 0.4723
 epoch: 88, train_loss: 0.8601, test_loss: 1.1056, test_f1: 0.4676
 epoch: 89, train_loss: 0.8638, test_loss: 1.1107, test_f1: 0.4641
 epoch: 90, train_loss: 0.8571, test_loss: 1.1223, test_f1: 0.4610
 epoch: 91, train_loss: 0.8587, test_loss: 1.1077, test_f1: 0.4683
 epoch: 92, train_loss: 0.8590, test_loss: 1.1032, test_f1: 0.4659
 epoch: 93, train_loss: 0.8593, test_loss: 1.1201, test_f1: 0.4618
 epoch: 94, train_loss: 0.8387, test_loss: 1.1215, test_f1: 0.4570
 epoch: 95, train_loss: 0.8513, test_loss: 1.1224, test_f1: 0.4550
 epoch: 96, train_loss: 0.8607, test_loss: 1.1135, test_f1: 0.4627
 epoch: 97, train_loss: 0.8523, test_loss: 1.1157, test_f1: 0.4665
 epoch: 98, train_loss: 0.8489, test_loss: 1.1046, test_f1: 0.4642
 epoch: 99, train_loss: 0.8613, test_loss: 1.1007, test_f1: 0.4553
##################ITERATION #5 ****************************************
 epoch: 0, train_loss: 1.3175, test_loss: 1.3125, test_f1: 0.2274
 epoch: 1, train_loss: 1.2749, test_loss: 1.2932, test_f1: 0.2274
 epoch: 2, train_loss: 1.2577, test_loss: 1.2712, test_f1: 0.2708
 epoch: 3, train_loss: 1.2402, test_loss: 1.2415, test_f1: 0.2934
 epoch: 4, train_loss: 1.2303, test_loss: 1.2293, test_f1: 0.3159
 epoch: 5, train_loss: 1.2171, test_loss: 1.2312, test_f1: 0.3677
 epoch: 6, train_loss: 1.2085, test_loss: 1.2318, test_f1: 0.4129
 epoch: 7, train_loss: 1.2024, test_loss: 1.2371, test_f1: 0.4237
 epoch: 8, train_loss: 1.1882, test_loss: 1.2270, test_f1: 0.4313
 epoch: 9, train_loss: 1.1813, test_loss: 1.2175, test_f1: 0.4264
 epoch: 10, train_loss: 1.1779, test_loss: 1.2293, test_f1: 0.4293
 epoch: 11, train_loss: 1.1604, test_loss: 1.2646, test_f1: 0.4285
 epoch: 12, train_loss: 1.1578, test_loss: 1.2182, test_f1: 0.4332
 epoch: 13, train_loss: 1.1486, test_loss: 1.1909, test_f1: 0.4452
 epoch: 14, train_loss: 1.1405, test_loss: 1.1726, test_f1: 0.4385
 epoch: 15, train_loss: 1.1282, test_loss: 1.1763, test_f1: 0.4419
 epoch: 16, train_loss: 1.1278, test_loss: 1.1701, test_f1: 0.4419
 epoch: 17, train_loss: 1.1297, test_loss: 1.1288, test_f1: 0.4428
 epoch: 18, train_loss: 1.1104, test_loss: 1.1248, test_f1: 0.4462
 epoch: 19, train_loss: 1.1136, test_loss: 1.1145, test_f1: 0.4521
 epoch: 20, train_loss: 1.1070, test_loss: 1.1103, test_f1: 0.4454
 epoch: 21, train_loss: 1.1007, test_loss: 1.1230, test_f1: 0.4538
 epoch: 22, train_loss: 1.0949, test_loss: 1.1240, test_f1: 0.4535
 epoch: 23, train_loss: 1.0885, test_loss: 1.1371, test_f1: 0.4489
 epoch: 24, train_loss: 1.0764, test_loss: 1.1265, test_f1: 0.4496
 epoch: 25, train_loss: 1.0758, test_loss: 1.1079, test_f1: 0.4553
 epoch: 26, train_loss: 1.0650, test_loss: 1.1035, test_f1: 0.4599
 epoch: 27, train_loss: 1.0638, test_loss: 1.0960, test_f1: 0.4553
 epoch: 28, train_loss: 1.0573, test_loss: 1.0929, test_f1: 0.4547
 epoch: 29, train_loss: 1.0602, test_loss: 1.0972, test_f1: 0.4580
 epoch: 30, train_loss: 1.0413, test_loss: 1.0855, test_f1: 0.4578
 epoch: 31, train_loss: 1.0503, test_loss: 1.0861, test_f1: 0.4525
 epoch: 32, train_loss: 1.0390, test_loss: 1.0800, test_f1: 0.4563
 epoch: 33, train_loss: 1.0254, test_loss: 1.0773, test_f1: 0.4534
 epoch: 34, train_loss: 1.0234, test_loss: 1.0870, test_f1: 0.4542
 epoch: 35, train_loss: 1.0362, test_loss: 1.0692, test_f1: 0.4583
 epoch: 36, train_loss: 1.0243, test_loss: 1.0683, test_f1: 0.4493
 epoch: 37, train_loss: 1.0112, test_loss: 1.0923, test_f1: 0.4446
 epoch: 38, train_loss: 1.0105, test_loss: 1.0688, test_f1: 0.4523
 epoch: 39, train_loss: 0.9969, test_loss: 1.0578, test_f1: 0.4486
 epoch: 40, train_loss: 1.0020, test_loss: 1.0613, test_f1: 0.4506
 epoch: 41, train_loss: 0.9970, test_loss: 1.0752, test_f1: 0.4416
 epoch: 42, train_loss: 0.9942, test_loss: 1.0620, test_f1: 0.4519
 epoch: 43, train_loss: 0.9875, test_loss: 1.0814, test_f1: 0.4473
 epoch: 44, train_loss: 0.9810, test_loss: 1.0878, test_f1: 0.4442
 epoch: 45, train_loss: 0.9835, test_loss: 1.0811, test_f1: 0.4519
 epoch: 46, train_loss: 0.9674, test_loss: 1.0783, test_f1: 0.4418
 epoch: 47, train_loss: 0.9806, test_loss: 1.0667, test_f1: 0.4440
 epoch: 48, train_loss: 0.9636, test_loss: 1.0642, test_f1: 0.4526
 epoch: 49, train_loss: 0.9567, test_loss: 1.0661, test_f1: 0.4486
 epoch: 50, train_loss: 0.9507, test_loss: 1.0670, test_f1: 0.4443
 epoch: 51, train_loss: 0.9524, test_loss: 1.0822, test_f1: 0.4473
 epoch: 52, train_loss: 0.9410, test_loss: 1.0796, test_f1: 0.4453
 epoch: 53, train_loss: 0.9360, test_loss: 1.0810, test_f1: 0.4487
 epoch: 54, train_loss: 0.9281, test_loss: 1.0637, test_f1: 0.4607
 epoch: 55, train_loss: 0.9415, test_loss: 1.0757, test_f1: 0.4504
 epoch: 56, train_loss: 0.9294, test_loss: 1.0655, test_f1: 0.4515
 epoch: 57, train_loss: 0.9430, test_loss: 1.0619, test_f1: 0.4511
 epoch: 58, train_loss: 0.9368, test_loss: 1.0660, test_f1: 0.4444
 epoch: 59, train_loss: 0.9270, test_loss: 1.0769, test_f1: 0.4464
 epoch: 60, train_loss: 0.9343, test_loss: 1.0747, test_f1: 0.4522
 epoch: 61, train_loss: 0.9296, test_loss: 1.0787, test_f1: 0.4560
 epoch: 62, train_loss: 0.9124, test_loss: 1.0771, test_f1: 0.4593
 epoch: 63, train_loss: 0.9243, test_loss: 1.0714, test_f1: 0.4620
 epoch: 64, train_loss: 0.9313, test_loss: 1.0659, test_f1: 0.4494
 epoch: 65, train_loss: 0.9137, test_loss: 1.0846, test_f1: 0.4498
 epoch: 66, train_loss: 0.9278, test_loss: 1.0702, test_f1: 0.4492
 epoch: 67, train_loss: 0.9133, test_loss: 1.0765, test_f1: 0.4463
 epoch: 68, train_loss: 0.9142, test_loss: 1.0573, test_f1: 0.4540
 epoch: 69, train_loss: 0.9037, test_loss: 1.0699, test_f1: 0.4535
 epoch: 70, train_loss: 0.9092, test_loss: 1.0671, test_f1: 0.4664
 epoch: 71, train_loss: 0.8964, test_loss: 1.0793, test_f1: 0.4677
 epoch: 72, train_loss: 0.9057, test_loss: 1.0834, test_f1: 0.4615
 epoch: 73, train_loss: 0.9052, test_loss: 1.0880, test_f1: 0.4591
 epoch: 74, train_loss: 0.9040, test_loss: 1.0820, test_f1: 0.4545
 epoch: 75, train_loss: 0.8929, test_loss: 1.0810, test_f1: 0.4533
 epoch: 76, train_loss: 0.8994, test_loss: 1.0734, test_f1: 0.4586
 epoch: 77, train_loss: 0.8875, test_loss: 1.0808, test_f1: 0.4599
 epoch: 78, train_loss: 0.8919, test_loss: 1.0925, test_f1: 0.4469
 epoch: 79, train_loss: 0.8950, test_loss: 1.0797, test_f1: 0.4549
 epoch: 80, train_loss: 0.8936, test_loss: 1.0896, test_f1: 0.4622
 epoch: 81, train_loss: 0.8877, test_loss: 1.0721, test_f1: 0.4652
 epoch: 82, train_loss: 0.8723, test_loss: 1.0844, test_f1: 0.4654
 epoch: 83, train_loss: 0.8768, test_loss: 1.0877, test_f1: 0.4641
 epoch: 84, train_loss: 0.8796, test_loss: 1.0736, test_f1: 0.4564
 epoch: 85, train_loss: 0.8783, test_loss: 1.0991, test_f1: 0.4649
 epoch: 86, train_loss: 0.8788, test_loss: 1.0749, test_f1: 0.4584
 epoch: 87, train_loss: 0.8631, test_loss: 1.0826, test_f1: 0.4580
 epoch: 88, train_loss: 0.8708, test_loss: 1.0795, test_f1: 0.4649
 epoch: 89, train_loss: 0.8752, test_loss: 1.0802, test_f1: 0.4622
 epoch: 90, train_loss: 0.8791, test_loss: 1.0793, test_f1: 0.4621
 epoch: 91, train_loss: 0.8675, test_loss: 1.0674, test_f1: 0.4617
 epoch: 92, train_loss: 0.8658, test_loss: 1.0724, test_f1: 0.4653
 epoch: 93, train_loss: 0.8630, test_loss: 1.0741, test_f1: 0.4629
 epoch: 94, train_loss: 0.8770, test_loss: 1.0818, test_f1: 0.4577
 epoch: 95, train_loss: 0.8686, test_loss: 1.0773, test_f1: 0.4577
 epoch: 96, train_loss: 0.8581, test_loss: 1.0824, test_f1: 0.4589
 epoch: 97, train_loss: 0.8588, test_loss: 1.0828, test_f1: 0.4623
 epoch: 98, train_loss: 0.8506, test_loss: 1.0774, test_f1: 0.4685
 epoch: 99, train_loss: 0.8457, test_loss: 1.0900, test_f1: 0.4660
##################ITERATION #6 ****************************************
 epoch: 0, train_loss: 1.3084, test_loss: 1.3064, test_f1: 0.2274
 epoch: 1, train_loss: 1.2657, test_loss: 1.2873, test_f1: 0.2292
 epoch: 2, train_loss: 1.2499, test_loss: 1.2689, test_f1: 0.2557
 epoch: 3, train_loss: 1.2437, test_loss: 1.2485, test_f1: 0.3162
 epoch: 4, train_loss: 1.2362, test_loss: 1.2241, test_f1: 0.3755
 epoch: 5, train_loss: 1.2164, test_loss: 1.2075, test_f1: 0.4157
 epoch: 6, train_loss: 1.2164, test_loss: 1.1968, test_f1: 0.4061
 epoch: 7, train_loss: 1.2077, test_loss: 1.1878, test_f1: 0.4058
 epoch: 8, train_loss: 1.2016, test_loss: 1.1793, test_f1: 0.4139
 epoch: 9, train_loss: 1.1972, test_loss: 1.1735, test_f1: 0.4139
 epoch: 10, train_loss: 1.1833, test_loss: 1.1703, test_f1: 0.4042
 epoch: 11, train_loss: 1.1816, test_loss: 1.1658, test_f1: 0.4050
 epoch: 12, train_loss: 1.1680, test_loss: 1.1606, test_f1: 0.4158
 epoch: 13, train_loss: 1.1615, test_loss: 1.1548, test_f1: 0.4187
 epoch: 14, train_loss: 1.1552, test_loss: 1.1463, test_f1: 0.4205
 epoch: 15, train_loss: 1.1537, test_loss: 1.1417, test_f1: 0.4279
 epoch: 16, train_loss: 1.1475, test_loss: 1.1327, test_f1: 0.4292
 epoch: 17, train_loss: 1.1386, test_loss: 1.1268, test_f1: 0.4214
 epoch: 18, train_loss: 1.1322, test_loss: 1.1225, test_f1: 0.4299
 epoch: 19, train_loss: 1.1218, test_loss: 1.1174, test_f1: 0.4271
 epoch: 20, train_loss: 1.1157, test_loss: 1.1111, test_f1: 0.4414
 epoch: 21, train_loss: 1.1053, test_loss: 1.1036, test_f1: 0.4393
 epoch: 22, train_loss: 1.1027, test_loss: 1.1086, test_f1: 0.4490
 epoch: 23, train_loss: 1.0985, test_loss: 1.1062, test_f1: 0.4394
 epoch: 24, train_loss: 1.0944, test_loss: 1.1082, test_f1: 0.4428
 epoch: 25, train_loss: 1.0872, test_loss: 1.0999, test_f1: 0.4469
 epoch: 26, train_loss: 1.0887, test_loss: 1.0972, test_f1: 0.4483
 epoch: 27, train_loss: 1.0787, test_loss: 1.0895, test_f1: 0.4392
 epoch: 28, train_loss: 1.0680, test_loss: 1.0942, test_f1: 0.4505
 epoch: 29, train_loss: 1.0709, test_loss: 1.0919, test_f1: 0.4619
 epoch: 30, train_loss: 1.0705, test_loss: 1.0835, test_f1: 0.4503
 epoch: 31, train_loss: 1.0606, test_loss: 1.0754, test_f1: 0.4492
 epoch: 32, train_loss: 1.0588, test_loss: 1.0705, test_f1: 0.4503
 epoch: 33, train_loss: 1.0532, test_loss: 1.0629, test_f1: 0.4593
 epoch: 34, train_loss: 1.0400, test_loss: 1.0567, test_f1: 0.4425
 epoch: 35, train_loss: 1.0285, test_loss: 1.0617, test_f1: 0.4447
 epoch: 36, train_loss: 1.0313, test_loss: 1.0567, test_f1: 0.4486
 epoch: 37, train_loss: 1.0274, test_loss: 1.0588, test_f1: 0.4420
 epoch: 38, train_loss: 1.0201, test_loss: 1.0598, test_f1: 0.4505
 epoch: 39, train_loss: 1.0178, test_loss: 1.0552, test_f1: 0.4587
 epoch: 40, train_loss: 1.0152, test_loss: 1.0588, test_f1: 0.4478
 epoch: 41, train_loss: 1.0098, test_loss: 1.0674, test_f1: 0.4554
 epoch: 42, train_loss: 1.0026, test_loss: 1.0481, test_f1: 0.4545
 epoch: 43, train_loss: 1.0003, test_loss: 1.0561, test_f1: 0.4643
 epoch: 44, train_loss: 0.9897, test_loss: 1.0566, test_f1: 0.4501
 epoch: 45, train_loss: 0.9805, test_loss: 1.0560, test_f1: 0.4619
 epoch: 46, train_loss: 0.9762, test_loss: 1.0478, test_f1: 0.4615
 epoch: 47, train_loss: 0.9636, test_loss: 1.0480, test_f1: 0.4695
 epoch: 48, train_loss: 0.9769, test_loss: 1.0520, test_f1: 0.4796
 epoch: 49, train_loss: 0.9604, test_loss: 1.0680, test_f1: 0.4648
 epoch: 50, train_loss: 0.9771, test_loss: 1.0639, test_f1: 0.4655
 epoch: 51, train_loss: 0.9558, test_loss: 1.0799, test_f1: 0.4585
 epoch: 52, train_loss: 0.9537, test_loss: 1.0694, test_f1: 0.4723
 epoch: 53, train_loss: 0.9536, test_loss: 1.0620, test_f1: 0.4738
 epoch: 54, train_loss: 0.9506, test_loss: 1.0616, test_f1: 0.4754
 epoch: 55, train_loss: 0.9437, test_loss: 1.0678, test_f1: 0.4648
 epoch: 56, train_loss: 0.9309, test_loss: 1.0613, test_f1: 0.4625
 epoch: 57, train_loss: 0.9557, test_loss: 1.0641, test_f1: 0.4613
 epoch: 58, train_loss: 0.9405, test_loss: 1.0619, test_f1: 0.4603
 epoch: 59, train_loss: 0.9404, test_loss: 1.0696, test_f1: 0.4765
 epoch: 60, train_loss: 0.9308, test_loss: 1.0725, test_f1: 0.4738
 epoch: 61, train_loss: 0.9294, test_loss: 1.0673, test_f1: 0.4608
 epoch: 62, train_loss: 0.9277, test_loss: 1.0670, test_f1: 0.4542
 epoch: 63, train_loss: 0.9337, test_loss: 1.0767, test_f1: 0.4639
 epoch: 64, train_loss: 0.9294, test_loss: 1.0881, test_f1: 0.4506
 epoch: 65, train_loss: 0.9241, test_loss: 1.0867, test_f1: 0.4491
 epoch: 66, train_loss: 0.9295, test_loss: 1.0783, test_f1: 0.4573
 epoch: 67, train_loss: 0.9126, test_loss: 1.0761, test_f1: 0.4549
 epoch: 68, train_loss: 0.9069, test_loss: 1.0878, test_f1: 0.4611
 epoch: 69, train_loss: 0.9117, test_loss: 1.0850, test_f1: 0.4703
 epoch: 70, train_loss: 0.9115, test_loss: 1.0812, test_f1: 0.4598
 epoch: 71, train_loss: 0.9110, test_loss: 1.0899, test_f1: 0.4618
 epoch: 72, train_loss: 0.9062, test_loss: 1.0911, test_f1: 0.4619
 epoch: 73, train_loss: 0.8984, test_loss: 1.0893, test_f1: 0.4645
 epoch: 74, train_loss: 0.9088, test_loss: 1.0867, test_f1: 0.4464
 epoch: 75, train_loss: 0.8984, test_loss: 1.0986, test_f1: 0.4471
 epoch: 76, train_loss: 0.8985, test_loss: 1.0863, test_f1: 0.4689
 epoch: 77, train_loss: 0.8945, test_loss: 1.0984, test_f1: 0.4647
 epoch: 78, train_loss: 0.8908, test_loss: 1.1029, test_f1: 0.4546
 epoch: 79, train_loss: 0.9019, test_loss: 1.1016, test_f1: 0.4554
 epoch: 80, train_loss: 0.8841, test_loss: 1.0943, test_f1: 0.4638
 epoch: 81, train_loss: 0.8847, test_loss: 1.0998, test_f1: 0.4573
 epoch: 82, train_loss: 0.8933, test_loss: 1.0854, test_f1: 0.4550
 epoch: 83, train_loss: 0.8909, test_loss: 1.0939, test_f1: 0.4534
 epoch: 84, train_loss: 0.8781, test_loss: 1.0917, test_f1: 0.4587
 epoch: 85, train_loss: 0.8723, test_loss: 1.0970, test_f1: 0.4563
 epoch: 86, train_loss: 0.8846, test_loss: 1.1233, test_f1: 0.4534
 epoch: 87, train_loss: 0.8791, test_loss: 1.0986, test_f1: 0.4590
 epoch: 88, train_loss: 0.8784, test_loss: 1.0999, test_f1: 0.4695
 epoch: 89, train_loss: 0.8675, test_loss: 1.0931, test_f1: 0.4617
 epoch: 90, train_loss: 0.8777, test_loss: 1.0960, test_f1: 0.4605
 epoch: 91, train_loss: 0.8743, test_loss: 1.0988, test_f1: 0.4637
 epoch: 92, train_loss: 0.8757, test_loss: 1.1304, test_f1: 0.4563
 epoch: 93, train_loss: 0.8752, test_loss: 1.1180, test_f1: 0.4621
 epoch: 94, train_loss: 0.8718, test_loss: 1.1318, test_f1: 0.4578
 epoch: 95, train_loss: 0.8660, test_loss: 1.1190, test_f1: 0.4510
 epoch: 96, train_loss: 0.8621, test_loss: 1.1220, test_f1: 0.4541
 epoch: 97, train_loss: 0.8623, test_loss: 1.1379, test_f1: 0.4524
 epoch: 98, train_loss: 0.8607, test_loss: 1.1256, test_f1: 0.4674
 epoch: 99, train_loss: 0.8645, test_loss: 1.1402, test_f1: 0.4554
##################ITERATION #7 ****************************************
 epoch: 0, train_loss: 1.3017, test_loss: 1.3015, test_f1: 0.2274
 epoch: 1, train_loss: 1.2625, test_loss: 1.2855, test_f1: 0.2274
 epoch: 2, train_loss: 1.2454, test_loss: 1.2679, test_f1: 0.2604
 epoch: 3, train_loss: 1.2289, test_loss: 1.2375, test_f1: 0.3293
 epoch: 4, train_loss: 1.2219, test_loss: 1.2145, test_f1: 0.3691
 epoch: 5, train_loss: 1.2103, test_loss: 1.1977, test_f1: 0.3924
 epoch: 6, train_loss: 1.2047, test_loss: 1.1863, test_f1: 0.4138
 epoch: 7, train_loss: 1.1940, test_loss: 1.1786, test_f1: 0.4232
 epoch: 8, train_loss: 1.1857, test_loss: 1.1732, test_f1: 0.4264
 epoch: 9, train_loss: 1.1851, test_loss: 1.1666, test_f1: 0.4159
 epoch: 10, train_loss: 1.1822, test_loss: 1.1583, test_f1: 0.4396
 epoch: 11, train_loss: 1.1716, test_loss: 1.1534, test_f1: 0.4371
 epoch: 12, train_loss: 1.1608, test_loss: 1.1465, test_f1: 0.4279
 epoch: 13, train_loss: 1.1550, test_loss: 1.1380, test_f1: 0.4419
 epoch: 14, train_loss: 1.1470, test_loss: 1.1350, test_f1: 0.4301
 epoch: 15, train_loss: 1.1446, test_loss: 1.1272, test_f1: 0.4545
 epoch: 16, train_loss: 1.1379, test_loss: 1.1207, test_f1: 0.4353
 epoch: 17, train_loss: 1.1312, test_loss: 1.1149, test_f1: 0.4553
 epoch: 18, train_loss: 1.1287, test_loss: 1.1119, test_f1: 0.4452
 epoch: 19, train_loss: 1.1225, test_loss: 1.1054, test_f1: 0.4445
 epoch: 20, train_loss: 1.1133, test_loss: 1.0994, test_f1: 0.4565
 epoch: 21, train_loss: 1.1068, test_loss: 1.0972, test_f1: 0.4498
 epoch: 22, train_loss: 1.1011, test_loss: 1.0925, test_f1: 0.4490
 epoch: 23, train_loss: 1.0972, test_loss: 1.0888, test_f1: 0.4433
 epoch: 24, train_loss: 1.0924, test_loss: 1.0910, test_f1: 0.4371
 epoch: 25, train_loss: 1.0783, test_loss: 1.0823, test_f1: 0.4457
 epoch: 26, train_loss: 1.0704, test_loss: 1.0775, test_f1: 0.4642
 epoch: 27, train_loss: 1.0726, test_loss: 1.0796, test_f1: 0.4597
 epoch: 28, train_loss: 1.0582, test_loss: 1.0715, test_f1: 0.4580
 epoch: 29, train_loss: 1.0471, test_loss: 1.0731, test_f1: 0.4438
 epoch: 30, train_loss: 1.0530, test_loss: 1.0688, test_f1: 0.4387
 epoch: 31, train_loss: 1.0500, test_loss: 1.0672, test_f1: 0.4449
 epoch: 32, train_loss: 1.0339, test_loss: 1.0592, test_f1: 0.4483
 epoch: 33, train_loss: 1.0294, test_loss: 1.0633, test_f1: 0.4427
 epoch: 34, train_loss: 1.0296, test_loss: 1.0527, test_f1: 0.4550
 epoch: 35, train_loss: 1.0285, test_loss: 1.0545, test_f1: 0.4630
 epoch: 36, train_loss: 1.0219, test_loss: 1.0473, test_f1: 0.4587
 epoch: 37, train_loss: 1.0179, test_loss: 1.0575, test_f1: 0.4438
 epoch: 38, train_loss: 1.0002, test_loss: 1.0517, test_f1: 0.4380
 epoch: 39, train_loss: 0.9974, test_loss: 1.0751, test_f1: 0.4480
 epoch: 40, train_loss: 0.9991, test_loss: 1.0618, test_f1: 0.4433
 epoch: 41, train_loss: 0.9946, test_loss: 1.0562, test_f1: 0.4392
 epoch: 42, train_loss: 0.9889, test_loss: 1.0572, test_f1: 0.4511
 epoch: 43, train_loss: 0.9868, test_loss: 1.0547, test_f1: 0.4600
 epoch: 44, train_loss: 0.9874, test_loss: 1.0576, test_f1: 0.4546
 epoch: 45, train_loss: 0.9736, test_loss: 1.0595, test_f1: 0.4593
 epoch: 46, train_loss: 0.9696, test_loss: 1.0640, test_f1: 0.4581
 epoch: 47, train_loss: 0.9763, test_loss: 1.0717, test_f1: 0.4630
 epoch: 48, train_loss: 0.9704, test_loss: 1.0695, test_f1: 0.4575
 epoch: 49, train_loss: 0.9648, test_loss: 1.0655, test_f1: 0.4605
 epoch: 50, train_loss: 0.9507, test_loss: 1.0622, test_f1: 0.4648
 epoch: 51, train_loss: 0.9448, test_loss: 1.0671, test_f1: 0.4481
 epoch: 52, train_loss: 0.9447, test_loss: 1.0633, test_f1: 0.4503
 epoch: 53, train_loss: 0.9494, test_loss: 1.0697, test_f1: 0.4639
 epoch: 54, train_loss: 0.9356, test_loss: 1.0721, test_f1: 0.4647
 epoch: 55, train_loss: 0.9456, test_loss: 1.0692, test_f1: 0.4737
 epoch: 56, train_loss: 0.9435, test_loss: 1.0777, test_f1: 0.4639
 epoch: 57, train_loss: 0.9373, test_loss: 1.0609, test_f1: 0.4703
 epoch: 58, train_loss: 0.9308, test_loss: 1.0712, test_f1: 0.4680
 epoch: 59, train_loss: 0.9290, test_loss: 1.0718, test_f1: 0.4606
 epoch: 60, train_loss: 0.9257, test_loss: 1.0797, test_f1: 0.4678
 epoch: 61, train_loss: 0.9178, test_loss: 1.0714, test_f1: 0.4572
 epoch: 62, train_loss: 0.9300, test_loss: 1.0653, test_f1: 0.4667
 epoch: 63, train_loss: 0.9211, test_loss: 1.0815, test_f1: 0.4719
 epoch: 64, train_loss: 0.9250, test_loss: 1.0740, test_f1: 0.4781
 epoch: 65, train_loss: 0.9100, test_loss: 1.0742, test_f1: 0.4705
 epoch: 66, train_loss: 0.9036, test_loss: 1.0747, test_f1: 0.4792
 epoch: 67, train_loss: 0.9060, test_loss: 1.0746, test_f1: 0.4789
 epoch: 68, train_loss: 0.9077, test_loss: 1.0725, test_f1: 0.4702
 epoch: 69, train_loss: 0.9048, test_loss: 1.0812, test_f1: 0.4686
 epoch: 70, train_loss: 0.9102, test_loss: 1.0884, test_f1: 0.4678
 epoch: 71, train_loss: 0.8935, test_loss: 1.0876, test_f1: 0.4701
 epoch: 72, train_loss: 0.8903, test_loss: 1.0758, test_f1: 0.4744
 epoch: 73, train_loss: 0.8940, test_loss: 1.0775, test_f1: 0.4692
 epoch: 74, train_loss: 0.8869, test_loss: 1.0892, test_f1: 0.4772
 epoch: 75, train_loss: 0.8871, test_loss: 1.0789, test_f1: 0.4779
 epoch: 76, train_loss: 0.8862, test_loss: 1.0837, test_f1: 0.4659
 epoch: 77, train_loss: 0.8864, test_loss: 1.0814, test_f1: 0.4747
 epoch: 78, train_loss: 0.8837, test_loss: 1.0904, test_f1: 0.4684
 epoch: 79, train_loss: 0.8856, test_loss: 1.0937, test_f1: 0.4602
 epoch: 80, train_loss: 0.8909, test_loss: 1.0936, test_f1: 0.4615
 epoch: 81, train_loss: 0.8724, test_loss: 1.0966, test_f1: 0.4707
 epoch: 82, train_loss: 0.8793, test_loss: 1.1062, test_f1: 0.4712
 epoch: 83, train_loss: 0.8695, test_loss: 1.1031, test_f1: 0.4695
 epoch: 84, train_loss: 0.8791, test_loss: 1.0977, test_f1: 0.4727
 epoch: 85, train_loss: 0.8713, test_loss: 1.1032, test_f1: 0.4593
 epoch: 86, train_loss: 0.8705, test_loss: 1.0950, test_f1: 0.4692
 epoch: 87, train_loss: 0.8775, test_loss: 1.0952, test_f1: 0.4805
 epoch: 88, train_loss: 0.8672, test_loss: 1.1049, test_f1: 0.4742
 epoch: 89, train_loss: 0.8674, test_loss: 1.1069, test_f1: 0.4667
 epoch: 90, train_loss: 0.8612, test_loss: 1.1139, test_f1: 0.4645
 epoch: 91, train_loss: 0.8660, test_loss: 1.1026, test_f1: 0.4701
 epoch: 92, train_loss: 0.8626, test_loss: 1.1098, test_f1: 0.4743
 epoch: 93, train_loss: 0.8621, test_loss: 1.1157, test_f1: 0.4776
 epoch: 94, train_loss: 0.8553, test_loss: 1.1125, test_f1: 0.4680
 epoch: 95, train_loss: 0.8707, test_loss: 1.0981, test_f1: 0.4711
 epoch: 96, train_loss: 0.8576, test_loss: 1.0948, test_f1: 0.4799
 epoch: 97, train_loss: 0.8592, test_loss: 1.0991, test_f1: 0.4737
 epoch: 98, train_loss: 0.8656, test_loss: 1.1133, test_f1: 0.4799
 epoch: 99, train_loss: 0.8500, test_loss: 1.1184, test_f1: 0.4659
##################ITERATION #8 ****************************************
 epoch: 0, train_loss: 1.3738, test_loss: 1.3494, test_f1: 0.2244
 epoch: 1, train_loss: 1.3010, test_loss: 1.2992, test_f1: 0.2274
 epoch: 2, train_loss: 1.2821, test_loss: 1.2690, test_f1: 0.2508
 epoch: 3, train_loss: 1.2680, test_loss: 1.2403, test_f1: 0.3520
 epoch: 4, train_loss: 1.2396, test_loss: 1.2149, test_f1: 0.3689
 epoch: 5, train_loss: 1.2328, test_loss: 1.1950, test_f1: 0.3844
 epoch: 6, train_loss: 1.2195, test_loss: 1.1808, test_f1: 0.3965
 epoch: 7, train_loss: 1.2065, test_loss: 1.1687, test_f1: 0.4034
 epoch: 8, train_loss: 1.2050, test_loss: 1.1610, test_f1: 0.4099
 epoch: 9, train_loss: 1.1913, test_loss: 1.1541, test_f1: 0.4118
 epoch: 10, train_loss: 1.1862, test_loss: 1.1479, test_f1: 0.4094
 epoch: 11, train_loss: 1.1840, test_loss: 1.1417, test_f1: 0.4102
 epoch: 12, train_loss: 1.1719, test_loss: 1.1341, test_f1: 0.4152
 epoch: 13, train_loss: 1.1691, test_loss: 1.1276, test_f1: 0.4152
 epoch: 14, train_loss: 1.1570, test_loss: 1.1242, test_f1: 0.4148
 epoch: 15, train_loss: 1.1494, test_loss: 1.1189, test_f1: 0.4177
 epoch: 16, train_loss: 1.1429, test_loss: 1.1157, test_f1: 0.4251
 epoch: 17, train_loss: 1.1447, test_loss: 1.1101, test_f1: 0.4304
 epoch: 18, train_loss: 1.1316, test_loss: 1.1039, test_f1: 0.4286
 epoch: 19, train_loss: 1.1258, test_loss: 1.1001, test_f1: 0.4362
 epoch: 20, train_loss: 1.1089, test_loss: 1.0977, test_f1: 0.4372
 epoch: 21, train_loss: 1.1139, test_loss: 1.0900, test_f1: 0.4422
 epoch: 22, train_loss: 1.1139, test_loss: 1.0857, test_f1: 0.4380
 epoch: 23, train_loss: 1.1123, test_loss: 1.0809, test_f1: 0.4424
 epoch: 24, train_loss: 1.0989, test_loss: 1.0768, test_f1: 0.4457
 epoch: 25, train_loss: 1.0954, test_loss: 1.0758, test_f1: 0.4411
 epoch: 26, train_loss: 1.0879, test_loss: 1.0727, test_f1: 0.4440
 epoch: 27, train_loss: 1.0873, test_loss: 1.0703, test_f1: 0.4455
 epoch: 28, train_loss: 1.0792, test_loss: 1.0600, test_f1: 0.4438
 epoch: 29, train_loss: 1.0706, test_loss: 1.0482, test_f1: 0.4596
 epoch: 30, train_loss: 1.0664, test_loss: 1.0481, test_f1: 0.4675
 epoch: 31, train_loss: 1.0572, test_loss: 1.0382, test_f1: 0.4682
 epoch: 32, train_loss: 1.0576, test_loss: 1.0350, test_f1: 0.4664
 epoch: 33, train_loss: 1.0487, test_loss: 1.0280, test_f1: 0.4742
 epoch: 34, train_loss: 1.0431, test_loss: 1.0167, test_f1: 0.4738
 epoch: 35, train_loss: 1.0435, test_loss: 1.0184, test_f1: 0.4811
 epoch: 36, train_loss: 1.0269, test_loss: 1.0158, test_f1: 0.4679
 epoch: 37, train_loss: 1.0304, test_loss: 1.0152, test_f1: 0.4809
 epoch: 38, train_loss: 1.0178, test_loss: 1.0186, test_f1: 0.4835
 epoch: 39, train_loss: 1.0140, test_loss: 1.0123, test_f1: 0.4727
 epoch: 40, train_loss: 1.0124, test_loss: 1.0051, test_f1: 0.4796
 epoch: 41, train_loss: 0.9991, test_loss: 1.0032, test_f1: 0.4771
 epoch: 42, train_loss: 0.9985, test_loss: 1.0044, test_f1: 0.4882
 epoch: 43, train_loss: 0.9983, test_loss: 1.0083, test_f1: 0.4823
 epoch: 44, train_loss: 0.9971, test_loss: 1.0039, test_f1: 0.4739
 epoch: 45, train_loss: 0.9838, test_loss: 0.9984, test_f1: 0.4754
 epoch: 46, train_loss: 0.9697, test_loss: 0.9951, test_f1: 0.4729
 epoch: 47, train_loss: 0.9819, test_loss: 1.0078, test_f1: 0.4727
 epoch: 48, train_loss: 0.9645, test_loss: 0.9933, test_f1: 0.4848
 epoch: 49, train_loss: 0.9674, test_loss: 0.9867, test_f1: 0.4917
 epoch: 50, train_loss: 0.9570, test_loss: 1.0062, test_f1: 0.4695
 epoch: 51, train_loss: 0.9488, test_loss: 1.0057, test_f1: 0.4707
 epoch: 52, train_loss: 0.9529, test_loss: 0.9958, test_f1: 0.4749
 epoch: 53, train_loss: 0.9457, test_loss: 0.9970, test_f1: 0.4761
 epoch: 54, train_loss: 0.9445, test_loss: 0.9998, test_f1: 0.4701
 epoch: 55, train_loss: 0.9356, test_loss: 0.9936, test_f1: 0.4765
 epoch: 56, train_loss: 0.9393, test_loss: 0.9905, test_f1: 0.4876
 epoch: 57, train_loss: 0.9277, test_loss: 0.9890, test_f1: 0.4934
 epoch: 58, train_loss: 0.9376, test_loss: 1.0009, test_f1: 0.4801
 epoch: 59, train_loss: 0.9398, test_loss: 1.0092, test_f1: 0.4764
 epoch: 60, train_loss: 0.9171, test_loss: 1.0056, test_f1: 0.4820
 epoch: 61, train_loss: 0.9220, test_loss: 0.9971, test_f1: 0.4935
 epoch: 62, train_loss: 0.9215, test_loss: 0.9990, test_f1: 0.4978
 epoch: 63, train_loss: 0.9184, test_loss: 1.0098, test_f1: 0.4769
 epoch: 64, train_loss: 0.9134, test_loss: 1.0049, test_f1: 0.4866
 epoch: 65, train_loss: 0.9115, test_loss: 1.0018, test_f1: 0.4778
 epoch: 66, train_loss: 0.9202, test_loss: 0.9962, test_f1: 0.4863
 epoch: 67, train_loss: 0.9177, test_loss: 1.0105, test_f1: 0.4788
 epoch: 68, train_loss: 0.9126, test_loss: 1.0131, test_f1: 0.4817
 epoch: 69, train_loss: 0.9092, test_loss: 1.0012, test_f1: 0.4774
 epoch: 70, train_loss: 0.8942, test_loss: 1.0048, test_f1: 0.4776
 epoch: 71, train_loss: 0.9025, test_loss: 1.0045, test_f1: 0.4715
 epoch: 72, train_loss: 0.9022, test_loss: 1.0179, test_f1: 0.4712
 epoch: 73, train_loss: 0.8872, test_loss: 1.0100, test_f1: 0.4769
 epoch: 74, train_loss: 0.8977, test_loss: 0.9983, test_f1: 0.4805
 epoch: 75, train_loss: 0.8810, test_loss: 1.0072, test_f1: 0.4710
 epoch: 76, train_loss: 0.9036, test_loss: 1.0031, test_f1: 0.4765
 epoch: 77, train_loss: 0.8825, test_loss: 1.0206, test_f1: 0.4863
 epoch: 78, train_loss: 0.8901, test_loss: 1.0171, test_f1: 0.4685
 epoch: 79, train_loss: 0.8852, test_loss: 1.0202, test_f1: 0.4727
 epoch: 80, train_loss: 0.8750, test_loss: 1.0193, test_f1: 0.4716
 epoch: 81, train_loss: 0.8723, test_loss: 1.0196, test_f1: 0.4652
 epoch: 82, train_loss: 0.8689, test_loss: 1.0140, test_f1: 0.4600
 epoch: 83, train_loss: 0.8804, test_loss: 1.0116, test_f1: 0.4610
 epoch: 84, train_loss: 0.8783, test_loss: 1.0103, test_f1: 0.4715
 epoch: 85, train_loss: 0.8847, test_loss: 1.0137, test_f1: 0.4658
 epoch: 86, train_loss: 0.8598, test_loss: 1.0273, test_f1: 0.4709
 epoch: 87, train_loss: 0.8636, test_loss: 1.0148, test_f1: 0.4758
 epoch: 88, train_loss: 0.8621, test_loss: 1.0306, test_f1: 0.4746
 epoch: 89, train_loss: 0.8573, test_loss: 1.0245, test_f1: 0.4599
 epoch: 90, train_loss: 0.8661, test_loss: 1.0475, test_f1: 0.4620
 epoch: 91, train_loss: 0.8559, test_loss: 1.0210, test_f1: 0.4883
 epoch: 92, train_loss: 0.8653, test_loss: 1.0219, test_f1: 0.4821
 epoch: 93, train_loss: 0.8577, test_loss: 1.0116, test_f1: 0.4935
 epoch: 94, train_loss: 0.8527, test_loss: 1.0273, test_f1: 0.4778
 epoch: 95, train_loss: 0.8518, test_loss: 1.0196, test_f1: 0.4703
 epoch: 96, train_loss: 0.8426, test_loss: 1.0176, test_f1: 0.4860
 epoch: 97, train_loss: 0.8551, test_loss: 1.0215, test_f1: 0.4865
 epoch: 98, train_loss: 0.8498, test_loss: 1.0243, test_f1: 0.4852
 epoch: 99, train_loss: 0.8369, test_loss: 1.0164, test_f1: 0.4875
##################ITERATION #9 ****************************************
 epoch: 0, train_loss: 1.3361, test_loss: 1.3151, test_f1: 0.2274
 epoch: 1, train_loss: 1.2837, test_loss: 1.2967, test_f1: 0.2274
 epoch: 2, train_loss: 1.2639, test_loss: 1.2676, test_f1: 0.2556
 epoch: 3, train_loss: 1.2423, test_loss: 1.2416, test_f1: 0.2739
 epoch: 4, train_loss: 1.2254, test_loss: 1.2177, test_f1: 0.3250
 epoch: 5, train_loss: 1.2220, test_loss: 1.1996, test_f1: 0.3679
 epoch: 6, train_loss: 1.2054, test_loss: 1.1851, test_f1: 0.3883
 epoch: 7, train_loss: 1.1948, test_loss: 1.1865, test_f1: 0.3980
 epoch: 8, train_loss: 1.1869, test_loss: 1.1747, test_f1: 0.4129
 epoch: 9, train_loss: 1.1774, test_loss: 1.1622, test_f1: 0.4123
 epoch: 10, train_loss: 1.1698, test_loss: 1.1635, test_f1: 0.4075
 epoch: 11, train_loss: 1.1662, test_loss: 1.1523, test_f1: 0.4220
 epoch: 12, train_loss: 1.1577, test_loss: 1.1453, test_f1: 0.4275
 epoch: 13, train_loss: 1.1508, test_loss: 1.1382, test_f1: 0.4350
 epoch: 14, train_loss: 1.1400, test_loss: 1.1301, test_f1: 0.4413
 epoch: 15, train_loss: 1.1324, test_loss: 1.1207, test_f1: 0.4319
 epoch: 16, train_loss: 1.1327, test_loss: 1.1177, test_f1: 0.4325
 epoch: 17, train_loss: 1.1184, test_loss: 1.1212, test_f1: 0.4324
 epoch: 18, train_loss: 1.1192, test_loss: 1.1340, test_f1: 0.4265
 epoch: 19, train_loss: 1.1048, test_loss: 1.1299, test_f1: 0.4317
 epoch: 20, train_loss: 1.0965, test_loss: 1.1181, test_f1: 0.4409
 epoch: 21, train_loss: 1.0883, test_loss: 1.1149, test_f1: 0.4438
 epoch: 22, train_loss: 1.0883, test_loss: 1.1044, test_f1: 0.4370
 epoch: 23, train_loss: 1.0826, test_loss: 1.0748, test_f1: 0.4555
 epoch: 24, train_loss: 1.0691, test_loss: 1.0837, test_f1: 0.4513
 epoch: 25, train_loss: 1.0656, test_loss: 1.1115, test_f1: 0.4527
 epoch: 26, train_loss: 1.0566, test_loss: 1.1565, test_f1: 0.4481
 epoch: 27, train_loss: 1.0563, test_loss: 1.0963, test_f1: 0.4338
 epoch: 28, train_loss: 1.0476, test_loss: 1.1890, test_f1: 0.4432
 epoch: 29, train_loss: 1.0325, test_loss: 1.1855, test_f1: 0.4476
 epoch: 30, train_loss: 1.0386, test_loss: 1.1624, test_f1: 0.4448
 epoch: 31, train_loss: 1.0281, test_loss: 1.1664, test_f1: 0.4337
 epoch: 32, train_loss: 1.0370, test_loss: 1.1584, test_f1: 0.4570
 epoch: 33, train_loss: 1.0194, test_loss: 1.1196, test_f1: 0.4566
 epoch: 34, train_loss: 1.0234, test_loss: 1.0645, test_f1: 0.4549
 epoch: 35, train_loss: 1.0053, test_loss: 1.0369, test_f1: 0.4663
 epoch: 36, train_loss: 1.0070, test_loss: 1.0719, test_f1: 0.4697
 epoch: 37, train_loss: 0.9937, test_loss: 1.0488, test_f1: 0.4627
 epoch: 38, train_loss: 0.9867, test_loss: 1.0463, test_f1: 0.4696
 epoch: 39, train_loss: 0.9837, test_loss: 1.0338, test_f1: 0.4743
 epoch: 40, train_loss: 0.9768, test_loss: 1.0385, test_f1: 0.4752
 epoch: 41, train_loss: 0.9801, test_loss: 1.0364, test_f1: 0.4800
 epoch: 42, train_loss: 0.9664, test_loss: 1.0171, test_f1: 0.4806
 epoch: 43, train_loss: 0.9715, test_loss: 1.0232, test_f1: 0.4733
 epoch: 44, train_loss: 0.9574, test_loss: 1.0225, test_f1: 0.4628
 epoch: 45, train_loss: 0.9635, test_loss: 1.1796, test_f1: 0.4644
 epoch: 46, train_loss: 0.9571, test_loss: 1.1423, test_f1: 0.4808
 epoch: 47, train_loss: 0.9493, test_loss: 1.1180, test_f1: 0.4682
 epoch: 48, train_loss: 0.9471, test_loss: 1.1033, test_f1: 0.4769
 epoch: 49, train_loss: 0.9519, test_loss: 1.0914, test_f1: 0.4633
 epoch: 50, train_loss: 0.9491, test_loss: 1.0638, test_f1: 0.4659
 epoch: 51, train_loss: 0.9289, test_loss: 1.0489, test_f1: 0.4668
 epoch: 52, train_loss: 0.9304, test_loss: 1.0352, test_f1: 0.4636
 epoch: 53, train_loss: 0.9162, test_loss: 1.0644, test_f1: 0.4650
 epoch: 54, train_loss: 0.9240, test_loss: 1.0484, test_f1: 0.4590
 epoch: 55, train_loss: 0.9234, test_loss: 1.0676, test_f1: 0.4597
 epoch: 56, train_loss: 0.9106, test_loss: 1.0346, test_f1: 0.4758
 epoch: 57, train_loss: 0.9187, test_loss: 1.0294, test_f1: 0.4788
 epoch: 58, train_loss: 0.9018, test_loss: 1.0838, test_f1: 0.4601
 epoch: 59, train_loss: 0.9100, test_loss: 1.0773, test_f1: 0.4586
 epoch: 60, train_loss: 0.8971, test_loss: 1.0783, test_f1: 0.4599
 epoch: 61, train_loss: 0.9058, test_loss: 1.0743, test_f1: 0.4653
 epoch: 62, train_loss: 0.9034, test_loss: 1.0681, test_f1: 0.4605
 epoch: 63, train_loss: 0.8990, test_loss: 1.0751, test_f1: 0.4627
 epoch: 64, train_loss: 0.8893, test_loss: 1.0886, test_f1: 0.4710
 epoch: 65, train_loss: 0.8942, test_loss: 1.0450, test_f1: 0.4656
 epoch: 66, train_loss: 0.8866, test_loss: 1.0538, test_f1: 0.4873
 epoch: 67, train_loss: 0.8995, test_loss: 1.0573, test_f1: 0.4618
 epoch: 68, train_loss: 0.8811, test_loss: 1.1147, test_f1: 0.4618
 epoch: 69, train_loss: 0.8980, test_loss: 1.1229, test_f1: 0.4692
 epoch: 70, train_loss: 0.8891, test_loss: 1.2128, test_f1: 0.4668
 epoch: 71, train_loss: 0.8839, test_loss: 1.0891, test_f1: 0.4752
 epoch: 72, train_loss: 0.8879, test_loss: 1.0569, test_f1: 0.4696
 epoch: 73, train_loss: 0.8653, test_loss: 1.0684, test_f1: 0.4693
 epoch: 74, train_loss: 0.8671, test_loss: 1.1858, test_f1: 0.4716
 epoch: 75, train_loss: 0.8660, test_loss: 1.0904, test_f1: 0.4683
 epoch: 76, train_loss: 0.8656, test_loss: 1.1360, test_f1: 0.4598
 epoch: 77, train_loss: 0.8610, test_loss: 1.0732, test_f1: 0.4653
 epoch: 78, train_loss: 0.8756, test_loss: 1.0689, test_f1: 0.4699
 epoch: 79, train_loss: 0.8661, test_loss: 1.0734, test_f1: 0.4694
 epoch: 80, train_loss: 0.8684, test_loss: 1.0908, test_f1: 0.4702
 epoch: 81, train_loss: 0.8787, test_loss: 1.1561, test_f1: 0.4627
 epoch: 82, train_loss: 0.8591, test_loss: 1.1374, test_f1: 0.4772
 epoch: 83, train_loss: 0.8426, test_loss: 1.1382, test_f1: 0.4812
 epoch: 84, train_loss: 0.8499, test_loss: 1.1782, test_f1: 0.4594
 epoch: 85, train_loss: 0.8452, test_loss: 1.1188, test_f1: 0.4703
 epoch: 86, train_loss: 0.8514, test_loss: 1.1035, test_f1: 0.4677
 epoch: 87, train_loss: 0.8481, test_loss: 1.1097, test_f1: 0.4656
 epoch: 88, train_loss: 0.8501, test_loss: 1.0806, test_f1: 0.4650
 epoch: 89, train_loss: 0.8479, test_loss: 1.0712, test_f1: 0.4757
 epoch: 90, train_loss: 0.8453, test_loss: 1.1068, test_f1: 0.4575
 epoch: 91, train_loss: 0.8307, test_loss: 1.0835, test_f1: 0.4616
 epoch: 92, train_loss: 0.8440, test_loss: 1.0538, test_f1: 0.4667
 epoch: 93, train_loss: 0.8322, test_loss: 1.1160, test_f1: 0.4623
 epoch: 94, train_loss: 0.8391, test_loss: 1.1172, test_f1: 0.4624
 epoch: 95, train_loss: 0.8481, test_loss: 1.0615, test_f1: 0.4643
 epoch: 96, train_loss: 0.8218, test_loss: 1.0766, test_f1: 0.4675
 epoch: 97, train_loss: 0.8346, test_loss: 1.0762, test_f1: 0.4792
 epoch: 98, train_loss: 0.8252, test_loss: 1.1327, test_f1: 0.4669
 epoch: 99, train_loss: 0.8304, test_loss: 1.1263, test_f1: 0.4661

Training completed in 424.24 seconds
Best F1: 0.4978 at epoch 62
Mean F1 across iterations: 0.4776  0.0114
========================FINAL RESULTS================================
FEGIN weighted F1: 0.4978  0.0114
python main.py --data ltspice_examples --representation component_component --model FEGIN --layers 6 --hiddens 64 --batch_size 256 --lr 0.0001 --emb_size 250 --epochs 100 --save_appendix component_component_L6_H64_BS256_LR0.0001_E250 --no_val
-----



STDERR:
  File "main.py", line 370, in <module>
    main()
  File "main.py", line 254, in main
    dataset = dataset_class(
  File "/home/philip/projects/ltspice_examples_code_repo/Circuit-Completion-Using-GNNs/component_classification_with_link_prediction_head/evaluation/FEGIN/kernel/circuit_datasets.py", line 15, in __init__
    self.data, self.slices = torch.load(self.processed_paths[0])
  File "/home/philip/.local/lib/python3.8/site-packages/torch/serialization.py", line 1040, in load
    warnings.warn(
  File "/usr/lib/python3.8/warnings.py", line 109, in _showwarnmsg
    sw(msg.message, msg.category, msg.filename, msg.lineno,
  File "main.py", line 47, in warn_with_traceback
    traceback.print_stack(file=log)
/home/philip/projects/ltspice_examples_code_repo/Circuit-Completion-Using-GNNs/component_classification_with_link_prediction_head/evaluation/FEGIN/kernel/circuit_datasets.py:15: FutureWarning: You are using `torch.load` with `weights_only=False` (the current default value), which uses the default pickle module implicitly. It is possible to construct malicious pickle data which will execute arbitrary code during unpickling (See https://github.com/pytorch/pytorch/blob/main/SECURITY.md#untrusted-models for more details). In a future release, the default value for `weights_only` will be flipped to `True`. This limits the functions that could be executed during unpickling. Arbitrary objects will no longer be allowed to be loaded via this mode unless they are explicitly allowlisted by the user via `torch.serialization.add_safe_globals`. We recommend you start setting `weights_only=True` for any use case where you don't have full control of the loaded file. Please open an issue on GitHub for any issues related to this experimental feature.
  self.data, self.slices = torch.load(self.processed_paths[0])
