STDOUT:
Results will be saved in /home/philip/projects/ltspice_examples_code_repo/Circuit-Completion-Using-GNNs/component_classification_with_link_prediction_head/evaluation/FEGIN/results/model_FEGIN_dataset_ltspice_examples
Command line input: python main.py --data ltspice_examples --representation component_pin --model FEGIN --layers 3 --hiddens 64 --batch_size 256 --lr 0.01 --emb_size 250 --epochs 100 --save_appendix component_pin_L3_H64_BS256_LR0.01_E250 --no_val
 is saved.
-----
ltspice_examples - FEGIN
Using 3 layers, 64 hidden units, h = 2
Loading component_pin representation dataset
ENTERED
Training FEGIN on component_pin representation
Train: 3560, Test: 848
##################ITERATION #0 ****************************************
 epoch: 0, train_loss: 1.2550, test_loss: 1.4064, test_f1: 0.2260
 epoch: 1, train_loss: 1.0514, test_loss: 1.1091, test_f1: 0.3413
 epoch: 2, train_loss: 0.9800, test_loss: 0.9987, test_f1: 0.5298
 epoch: 3, train_loss: 0.9432, test_loss: 1.1412, test_f1: 0.4576
 epoch: 4, train_loss: 0.9069, test_loss: 1.1164, test_f1: 0.4413
 epoch: 5, train_loss: 0.8809, test_loss: 0.9690, test_f1: 0.5455
 epoch: 6, train_loss: 0.8942, test_loss: 1.1047, test_f1: 0.4316
 epoch: 7, train_loss: 0.8661, test_loss: 0.8610, test_f1: 0.5642
 epoch: 8, train_loss: 0.8311, test_loss: 0.8601, test_f1: 0.5939
 epoch: 9, train_loss: 0.8160, test_loss: 0.9498, test_f1: 0.4790
 epoch: 10, train_loss: 0.8023, test_loss: 0.9969, test_f1: 0.5007
 epoch: 11, train_loss: 0.7810, test_loss: 1.0923, test_f1: 0.4867
 epoch: 12, train_loss: 0.7760, test_loss: 0.9075, test_f1: 0.5468
 epoch: 13, train_loss: 0.7651, test_loss: 0.8601, test_f1: 0.6124
 epoch: 14, train_loss: 0.7448, test_loss: 0.9451, test_f1: 0.5475
 epoch: 15, train_loss: 0.7370, test_loss: 0.8634, test_f1: 0.5599
 epoch: 16, train_loss: 0.7346, test_loss: 0.9920, test_f1: 0.5100
 epoch: 17, train_loss: 0.7063, test_loss: 0.9582, test_f1: 0.5486
 epoch: 18, train_loss: 0.7066, test_loss: 0.8699, test_f1: 0.6196
 epoch: 19, train_loss: 0.6809, test_loss: 0.9226, test_f1: 0.6074
 epoch: 20, train_loss: 0.6624, test_loss: 0.9899, test_f1: 0.6039
 epoch: 21, train_loss: 0.6854, test_loss: 0.8705, test_f1: 0.6084
 epoch: 22, train_loss: 0.6815, test_loss: 0.8818, test_f1: 0.5916
 epoch: 23, train_loss: 0.6603, test_loss: 0.8780, test_f1: 0.6167
 epoch: 24, train_loss: 0.6590, test_loss: 0.9966, test_f1: 0.5715
 epoch: 25, train_loss: 0.6180, test_loss: 0.9513, test_f1: 0.5952
 epoch: 26, train_loss: 0.6328, test_loss: 0.8620, test_f1: 0.6306
 epoch: 27, train_loss: 0.6469, test_loss: 0.9432, test_f1: 0.6045
 epoch: 28, train_loss: 0.6112, test_loss: 1.0511, test_f1: 0.5808
 epoch: 29, train_loss: 0.6337, test_loss: 0.9294, test_f1: 0.5866
 epoch: 30, train_loss: 0.6237, test_loss: 1.0004, test_f1: 0.5220
 epoch: 31, train_loss: 0.6283, test_loss: 1.0923, test_f1: 0.5310
 epoch: 32, train_loss: 0.6142, test_loss: 0.9154, test_f1: 0.6022
 epoch: 33, train_loss: 0.5984, test_loss: 0.9184, test_f1: 0.6060
 epoch: 34, train_loss: 0.6043, test_loss: 1.0850, test_f1: 0.5794
 epoch: 35, train_loss: 0.6012, test_loss: 1.0015, test_f1: 0.5890
 epoch: 36, train_loss: 0.5716, test_loss: 0.7849, test_f1: 0.6550
 epoch: 37, train_loss: 0.5690, test_loss: 0.9005, test_f1: 0.6141
 epoch: 38, train_loss: 0.5646, test_loss: 1.0995, test_f1: 0.5794
 epoch: 39, train_loss: 0.5699, test_loss: 0.8613, test_f1: 0.5913
 epoch: 40, train_loss: 0.5407, test_loss: 0.8223, test_f1: 0.6326
 epoch: 41, train_loss: 0.5546, test_loss: 0.9301, test_f1: 0.6588
 epoch: 42, train_loss: 0.5129, test_loss: 1.2365, test_f1: 0.5810
 epoch: 43, train_loss: 0.5180, test_loss: 0.9328, test_f1: 0.6022
 epoch: 44, train_loss: 0.5189, test_loss: 1.2033, test_f1: 0.6028
 epoch: 45, train_loss: 0.5024, test_loss: 1.0599, test_f1: 0.5790
 epoch: 46, train_loss: 0.5105, test_loss: 1.0934, test_f1: 0.6194
 epoch: 47, train_loss: 0.5068, test_loss: 1.2944, test_f1: 0.5896
 epoch: 48, train_loss: 0.4974, test_loss: 1.0319, test_f1: 0.6551
 epoch: 49, train_loss: 0.4764, test_loss: 0.9837, test_f1: 0.6024
 epoch: 50, train_loss: 0.5006, test_loss: 1.3976, test_f1: 0.5798
 epoch: 51, train_loss: 0.4694, test_loss: 0.9388, test_f1: 0.6582
 epoch: 52, train_loss: 0.4343, test_loss: 0.9115, test_f1: 0.6389
 epoch: 53, train_loss: 0.4151, test_loss: 1.0697, test_f1: 0.6242
 epoch: 54, train_loss: 0.3962, test_loss: 1.0402, test_f1: 0.6577
 epoch: 55, train_loss: 0.4138, test_loss: 1.1368, test_f1: 0.6199
 epoch: 56, train_loss: 0.4056, test_loss: 1.0095, test_f1: 0.6482
 epoch: 57, train_loss: 0.3817, test_loss: 1.0082, test_f1: 0.6518
 epoch: 58, train_loss: 0.3910, test_loss: 1.0421, test_f1: 0.6493
 epoch: 59, train_loss: 0.3794, test_loss: 1.3807, test_f1: 0.6000
 epoch: 60, train_loss: 0.3643, test_loss: 0.9682, test_f1: 0.6547
 epoch: 61, train_loss: 0.3604, test_loss: 1.1416, test_f1: 0.6322
 epoch: 62, train_loss: 0.3569, test_loss: 1.1227, test_f1: 0.6495
 epoch: 63, train_loss: 0.3552, test_loss: 1.0733, test_f1: 0.6933
 epoch: 64, train_loss: 0.3699, test_loss: 1.1825, test_f1: 0.6541
 epoch: 65, train_loss: 0.3539, test_loss: 1.1593, test_f1: 0.6302
 epoch: 66, train_loss: 0.3455, test_loss: 1.2318, test_f1: 0.6259
 epoch: 67, train_loss: 0.3582, test_loss: 1.2338, test_f1: 0.6684
 epoch: 68, train_loss: 0.3586, test_loss: 1.3035, test_f1: 0.6318
 epoch: 69, train_loss: 0.3591, test_loss: 1.2260, test_f1: 0.6062
 epoch: 70, train_loss: 0.3414, test_loss: 1.3757, test_f1: 0.6438
 epoch: 71, train_loss: 0.3286, test_loss: 1.2483, test_f1: 0.6357
 epoch: 72, train_loss: 0.3355, test_loss: 1.1975, test_f1: 0.6750
 epoch: 73, train_loss: 0.3144, test_loss: 1.3897, test_f1: 0.6623
 epoch: 74, train_loss: 0.2994, test_loss: 1.3447, test_f1: 0.6632
 epoch: 75, train_loss: 0.3072, test_loss: 1.5073, test_f1: 0.6548
 epoch: 76, train_loss: 0.3263, test_loss: 1.3115, test_f1: 0.6424
 epoch: 77, train_loss: 0.3084, test_loss: 1.4081, test_f1: 0.6477
 epoch: 78, train_loss: 0.2974, test_loss: 1.2896, test_f1: 0.6582
 epoch: 79, train_loss: 0.2958, test_loss: 1.4109, test_f1: 0.6498
 epoch: 80, train_loss: 0.2988, test_loss: 1.4163, test_f1: 0.6494
 epoch: 81, train_loss: 0.2821, test_loss: 1.4601, test_f1: 0.6488
 epoch: 82, train_loss: 0.2885, test_loss: 1.4614, test_f1: 0.6362
 epoch: 83, train_loss: 0.2826, test_loss: 1.2665, test_f1: 0.6635
 epoch: 84, train_loss: 0.2932, test_loss: 1.4388, test_f1: 0.6478
 epoch: 85, train_loss: 0.2881, test_loss: 1.4479, test_f1: 0.6644
 epoch: 86, train_loss: 0.2995, test_loss: 1.3301, test_f1: 0.6715
 epoch: 87, train_loss: 0.3056, test_loss: 1.4693, test_f1: 0.6414
 epoch: 88, train_loss: 0.3026, test_loss: 1.4141, test_f1: 0.6446
 epoch: 89, train_loss: 0.2765, test_loss: 1.4096, test_f1: 0.6698
 epoch: 90, train_loss: 0.2820, test_loss: 1.5740, test_f1: 0.6614
 epoch: 91, train_loss: 0.2786, test_loss: 1.3089, test_f1: 0.6673
 epoch: 92, train_loss: 0.2652, test_loss: 1.5940, test_f1: 0.6580
 epoch: 93, train_loss: 0.2735, test_loss: 1.4111, test_f1: 0.6509
 epoch: 94, train_loss: 0.2851, test_loss: 1.3184, test_f1: 0.6391
 epoch: 95, train_loss: 0.2850, test_loss: 1.4862, test_f1: 0.6544
 epoch: 96, train_loss: 0.3042, test_loss: 1.5292, test_f1: 0.6433
 epoch: 97, train_loss: 0.2742, test_loss: 1.4298, test_f1: 0.6606
 epoch: 98, train_loss: 0.2593, test_loss: 1.5007, test_f1: 0.6789
 epoch: 99, train_loss: 0.2506, test_loss: 1.4578, test_f1: 0.6749
##################ITERATION #1 ****************************************
 epoch: 0, train_loss: 1.2224, test_loss: 1.3544, test_f1: 0.2335
 epoch: 1, train_loss: 1.0240, test_loss: 1.0739, test_f1: 0.3563
 epoch: 2, train_loss: 0.9755, test_loss: 1.0397, test_f1: 0.4638
 epoch: 3, train_loss: 0.9362, test_loss: 1.2051, test_f1: 0.4452
 epoch: 4, train_loss: 0.9009, test_loss: 1.0226, test_f1: 0.5164
 epoch: 5, train_loss: 0.8853, test_loss: 0.9950, test_f1: 0.4918
 epoch: 6, train_loss: 0.8743, test_loss: 1.2596, test_f1: 0.4098
 epoch: 7, train_loss: 0.8530, test_loss: 1.0258, test_f1: 0.5041
 epoch: 8, train_loss: 0.8451, test_loss: 0.9177, test_f1: 0.5265
 epoch: 9, train_loss: 0.8105, test_loss: 0.8309, test_f1: 0.5433
 epoch: 10, train_loss: 0.8008, test_loss: 0.9400, test_f1: 0.5233
 epoch: 11, train_loss: 0.7795, test_loss: 0.8218, test_f1: 0.5488
 epoch: 12, train_loss: 0.7675, test_loss: 0.9443, test_f1: 0.5137
 epoch: 13, train_loss: 0.7408, test_loss: 0.8744, test_f1: 0.5776
 epoch: 14, train_loss: 0.7419, test_loss: 2.0728, test_f1: 0.3297
 epoch: 15, train_loss: 0.7220, test_loss: 0.9278, test_f1: 0.5607
 epoch: 16, train_loss: 0.7290, test_loss: 0.8781, test_f1: 0.6156
 epoch: 17, train_loss: 0.7129, test_loss: 0.9239, test_f1: 0.5691
 epoch: 18, train_loss: 0.6994, test_loss: 0.9275, test_f1: 0.5765
 epoch: 19, train_loss: 0.7001, test_loss: 0.8699, test_f1: 0.5806
 epoch: 20, train_loss: 0.6598, test_loss: 0.9047, test_f1: 0.5812
 epoch: 21, train_loss: 0.6718, test_loss: 0.8257, test_f1: 0.5551
 epoch: 22, train_loss: 0.6789, test_loss: 1.0250, test_f1: 0.5091
 epoch: 23, train_loss: 0.6650, test_loss: 1.1108, test_f1: 0.5158
 epoch: 24, train_loss: 0.6530, test_loss: 0.8774, test_f1: 0.6265
 epoch: 25, train_loss: 0.6412, test_loss: 0.9628, test_f1: 0.5681
 epoch: 26, train_loss: 0.6397, test_loss: 0.9265, test_f1: 0.5967
 epoch: 27, train_loss: 0.6300, test_loss: 1.0373, test_f1: 0.5657
 epoch: 28, train_loss: 0.5954, test_loss: 0.9471, test_f1: 0.5873
 epoch: 29, train_loss: 0.6181, test_loss: 0.9069, test_f1: 0.5930
 epoch: 30, train_loss: 0.5904, test_loss: 1.1947, test_f1: 0.4671
 epoch: 31, train_loss: 0.6080, test_loss: 0.8920, test_f1: 0.6567
 epoch: 32, train_loss: 0.5692, test_loss: 0.8338, test_f1: 0.6105
 epoch: 33, train_loss: 0.5951, test_loss: 1.1917, test_f1: 0.5150
 epoch: 34, train_loss: 0.5835, test_loss: 0.8878, test_f1: 0.6403
 epoch: 35, train_loss: 0.5681, test_loss: 0.8712, test_f1: 0.5990
 epoch: 36, train_loss: 0.5519, test_loss: 0.9293, test_f1: 0.6203
 epoch: 37, train_loss: 0.5818, test_loss: 0.8399, test_f1: 0.5917
 epoch: 38, train_loss: 0.5637, test_loss: 0.9836, test_f1: 0.6163
 epoch: 39, train_loss: 0.5374, test_loss: 0.9899, test_f1: 0.5937
 epoch: 40, train_loss: 0.5282, test_loss: 0.9909, test_f1: 0.6008
 epoch: 41, train_loss: 0.5638, test_loss: 0.9974, test_f1: 0.6192
 epoch: 42, train_loss: 0.5221, test_loss: 0.9375, test_f1: 0.6283
 epoch: 43, train_loss: 0.5167, test_loss: 1.1020, test_f1: 0.5995
 epoch: 44, train_loss: 0.5149, test_loss: 0.9065, test_f1: 0.6190
 epoch: 45, train_loss: 0.4891, test_loss: 1.0636, test_f1: 0.6237
 epoch: 46, train_loss: 0.5048, test_loss: 0.9398, test_f1: 0.6419
 epoch: 47, train_loss: 0.4906, test_loss: 0.8897, test_f1: 0.6548
 epoch: 48, train_loss: 0.4889, test_loss: 1.6595, test_f1: 0.4905
 epoch: 49, train_loss: 0.5119, test_loss: 1.0116, test_f1: 0.5870
 epoch: 50, train_loss: 0.5187, test_loss: 1.0548, test_f1: 0.5704
 epoch: 51, train_loss: 0.4773, test_loss: 0.9744, test_f1: 0.6216
 epoch: 52, train_loss: 0.4508, test_loss: 0.9281, test_f1: 0.6313
 epoch: 53, train_loss: 0.4236, test_loss: 1.1065, test_f1: 0.6274
 epoch: 54, train_loss: 0.4124, test_loss: 0.9861, test_f1: 0.6253
 epoch: 55, train_loss: 0.3952, test_loss: 0.9657, test_f1: 0.6735
 epoch: 56, train_loss: 0.3989, test_loss: 0.9844, test_f1: 0.6455
 epoch: 57, train_loss: 0.4001, test_loss: 1.0580, test_f1: 0.6291
 epoch: 58, train_loss: 0.3933, test_loss: 1.0054, test_f1: 0.6575
 epoch: 59, train_loss: 0.3837, test_loss: 1.1024, test_f1: 0.6504
 epoch: 60, train_loss: 0.3893, test_loss: 1.0650, test_f1: 0.6232
 epoch: 61, train_loss: 0.3627, test_loss: 1.1359, test_f1: 0.6103
 epoch: 62, train_loss: 0.3718, test_loss: 1.0277, test_f1: 0.6303
 epoch: 63, train_loss: 0.3611, test_loss: 1.0596, test_f1: 0.6481
 epoch: 64, train_loss: 0.3573, test_loss: 1.1872, test_f1: 0.6188
 epoch: 65, train_loss: 0.3611, test_loss: 1.0831, test_f1: 0.6369
 epoch: 66, train_loss: 0.3471, test_loss: 1.3047, test_f1: 0.6093
 epoch: 67, train_loss: 0.3744, test_loss: 1.2060, test_f1: 0.5535
 epoch: 68, train_loss: 0.3680, test_loss: 1.2954, test_f1: 0.5929
 epoch: 69, train_loss: 0.3569, test_loss: 1.0872, test_f1: 0.6432
 epoch: 70, train_loss: 0.3520, test_loss: 1.1614, test_f1: 0.6349
 epoch: 71, train_loss: 0.3399, test_loss: 1.1640, test_f1: 0.6407
 epoch: 72, train_loss: 0.3343, test_loss: 1.1185, test_f1: 0.6520
 epoch: 73, train_loss: 0.3500, test_loss: 1.1234, test_f1: 0.6327
 epoch: 74, train_loss: 0.3467, test_loss: 1.0793, test_f1: 0.6524
 epoch: 75, train_loss: 0.3145, test_loss: 1.1734, test_f1: 0.6543
 epoch: 76, train_loss: 0.3454, test_loss: 1.3121, test_f1: 0.6377
 epoch: 77, train_loss: 0.3434, test_loss: 1.1910, test_f1: 0.6551
 epoch: 78, train_loss: 0.3467, test_loss: 1.1465, test_f1: 0.6620
 epoch: 79, train_loss: 0.3373, test_loss: 1.1776, test_f1: 0.6710
 epoch: 80, train_loss: 0.3383, test_loss: 1.1704, test_f1: 0.6369
 epoch: 81, train_loss: 0.3193, test_loss: 1.3200, test_f1: 0.6500
 epoch: 82, train_loss: 0.3073, test_loss: 1.0703, test_f1: 0.6643
 epoch: 83, train_loss: 0.3187, test_loss: 1.2592, test_f1: 0.6257
 epoch: 84, train_loss: 0.2723, test_loss: 1.1097, test_f1: 0.6817
 epoch: 85, train_loss: 0.3051, test_loss: 1.1323, test_f1: 0.6523
 epoch: 86, train_loss: 0.3068, test_loss: 1.0895, test_f1: 0.6493
 epoch: 87, train_loss: 0.3120, test_loss: 1.1456, test_f1: 0.6446
 epoch: 88, train_loss: 0.3093, test_loss: 1.2637, test_f1: 0.6525
 epoch: 89, train_loss: 0.3172, test_loss: 1.1354, test_f1: 0.6682
 epoch: 90, train_loss: 0.3249, test_loss: 1.0704, test_f1: 0.6757
 epoch: 91, train_loss: 0.3438, test_loss: 0.9519, test_f1: 0.6766
 epoch: 92, train_loss: 0.3028, test_loss: 1.2653, test_f1: 0.6488
 epoch: 93, train_loss: 0.2775, test_loss: 1.1190, test_f1: 0.6497
 epoch: 94, train_loss: 0.2904, test_loss: 1.1672, test_f1: 0.6485
 epoch: 95, train_loss: 0.2823, test_loss: 1.1528, test_f1: 0.6596
 epoch: 96, train_loss: 0.2854, test_loss: 1.3050, test_f1: 0.6416
 epoch: 97, train_loss: 0.2857, test_loss: 1.1066, test_f1: 0.6648
 epoch: 98, train_loss: 0.3091, test_loss: 1.1996, test_f1: 0.6327
 epoch: 99, train_loss: 0.2825, test_loss: 1.2942, test_f1: 0.6561
##################ITERATION #2 ****************************************
 epoch: 0, train_loss: 1.4485, test_loss: 1.3034, test_f1: 0.3324
 epoch: 1, train_loss: 1.0201, test_loss: 1.0616, test_f1: 0.4297
 epoch: 2, train_loss: 0.9645, test_loss: 1.0294, test_f1: 0.4687
 epoch: 3, train_loss: 0.9245, test_loss: 1.0125, test_f1: 0.4630
 epoch: 4, train_loss: 0.9095, test_loss: 0.9779, test_f1: 0.4877
 epoch: 5, train_loss: 0.8782, test_loss: 1.0742, test_f1: 0.4285
 epoch: 6, train_loss: 0.8746, test_loss: 0.9856, test_f1: 0.5004
 epoch: 7, train_loss: 0.8426, test_loss: 0.9160, test_f1: 0.5114
 epoch: 8, train_loss: 0.8319, test_loss: 1.0672, test_f1: 0.4598
 epoch: 9, train_loss: 0.8277, test_loss: 0.9994, test_f1: 0.5149
 epoch: 10, train_loss: 0.8267, test_loss: 0.9141, test_f1: 0.5778
 epoch: 11, train_loss: 0.8045, test_loss: 0.8823, test_f1: 0.5234
 epoch: 12, train_loss: 0.7579, test_loss: 0.8936, test_f1: 0.5681
 epoch: 13, train_loss: 0.7595, test_loss: 1.1249, test_f1: 0.5243
 epoch: 14, train_loss: 0.7482, test_loss: 0.9998, test_f1: 0.5274
 epoch: 15, train_loss: 0.7414, test_loss: 0.8944, test_f1: 0.5528
 epoch: 16, train_loss: 0.7220, test_loss: 0.8967, test_f1: 0.5949
 epoch: 17, train_loss: 0.7119, test_loss: 0.9628, test_f1: 0.5678
 epoch: 18, train_loss: 0.7036, test_loss: 0.8988, test_f1: 0.6184
 epoch: 19, train_loss: 0.6997, test_loss: 0.8953, test_f1: 0.5694
 epoch: 20, train_loss: 0.6924, test_loss: 0.7848, test_f1: 0.6307
 epoch: 21, train_loss: 0.6811, test_loss: 0.8425, test_f1: 0.6082
 epoch: 22, train_loss: 0.6744, test_loss: 0.8757, test_f1: 0.6004
 epoch: 23, train_loss: 0.6538, test_loss: 0.8965, test_f1: 0.6379
 epoch: 24, train_loss: 0.6230, test_loss: 0.8608, test_f1: 0.5732
 epoch: 25, train_loss: 0.6316, test_loss: 0.8401, test_f1: 0.6507
 epoch: 26, train_loss: 0.6117, test_loss: 0.8214, test_f1: 0.6085
 epoch: 27, train_loss: 0.6313, test_loss: 0.8482, test_f1: 0.6091
 epoch: 28, train_loss: 0.6203, test_loss: 0.9124, test_f1: 0.6448
 epoch: 29, train_loss: 0.6303, test_loss: 0.8819, test_f1: 0.5609
 epoch: 30, train_loss: 0.6246, test_loss: 0.8124, test_f1: 0.5940
 epoch: 31, train_loss: 0.6078, test_loss: 0.9142, test_f1: 0.5927
 epoch: 32, train_loss: 0.6061, test_loss: 0.8905, test_f1: 0.6281
 epoch: 33, train_loss: 0.5726, test_loss: 0.9648, test_f1: 0.5778
 epoch: 34, train_loss: 0.5738, test_loss: 0.8790, test_f1: 0.5807
 epoch: 35, train_loss: 0.5939, test_loss: 0.7958, test_f1: 0.6064
 epoch: 36, train_loss: 0.6043, test_loss: 0.9381, test_f1: 0.6219
 epoch: 37, train_loss: 0.5665, test_loss: 0.9129, test_f1: 0.6257
 epoch: 38, train_loss: 0.5535, test_loss: 0.9879, test_f1: 0.5997
 epoch: 39, train_loss: 0.5533, test_loss: 0.8855, test_f1: 0.6051
 epoch: 40, train_loss: 0.5393, test_loss: 0.8847, test_f1: 0.6027
 epoch: 41, train_loss: 0.5135, test_loss: 0.8780, test_f1: 0.5570
 epoch: 42, train_loss: 0.5479, test_loss: 0.8780, test_f1: 0.6401
 epoch: 43, train_loss: 0.5149, test_loss: 0.9621, test_f1: 0.5978
 epoch: 44, train_loss: 0.5179, test_loss: 0.8863, test_f1: 0.6031
 epoch: 45, train_loss: 0.5184, test_loss: 1.0118, test_f1: 0.6102
 epoch: 46, train_loss: 0.5302, test_loss: 0.8425, test_f1: 0.6530
 epoch: 47, train_loss: 0.5271, test_loss: 0.8908, test_f1: 0.6328
 epoch: 48, train_loss: 0.5037, test_loss: 1.1556, test_f1: 0.5489
 epoch: 49, train_loss: 0.4984, test_loss: 0.9073, test_f1: 0.6199
 epoch: 50, train_loss: 0.4827, test_loss: 0.8543, test_f1: 0.6529
 epoch: 51, train_loss: 0.4377, test_loss: 0.8783, test_f1: 0.6703
 epoch: 52, train_loss: 0.4167, test_loss: 0.9966, test_f1: 0.6181
 epoch: 53, train_loss: 0.4103, test_loss: 0.8262, test_f1: 0.6539
 epoch: 54, train_loss: 0.4044, test_loss: 1.0265, test_f1: 0.6555
 epoch: 55, train_loss: 0.3934, test_loss: 0.9094, test_f1: 0.6779
 epoch: 56, train_loss: 0.4059, test_loss: 0.9093, test_f1: 0.6830
 epoch: 57, train_loss: 0.3908, test_loss: 0.9608, test_f1: 0.6496
 epoch: 58, train_loss: 0.4084, test_loss: 0.8697, test_f1: 0.6707
 epoch: 59, train_loss: 0.3729, test_loss: 1.0423, test_f1: 0.6301
 epoch: 60, train_loss: 0.3772, test_loss: 0.9379, test_f1: 0.6421
 epoch: 61, train_loss: 0.3978, test_loss: 0.9954, test_f1: 0.6343
 epoch: 62, train_loss: 0.3867, test_loss: 0.8901, test_f1: 0.6744
 epoch: 63, train_loss: 0.3670, test_loss: 0.9921, test_f1: 0.6422
 epoch: 64, train_loss: 0.3589, test_loss: 1.0947, test_f1: 0.6440
 epoch: 65, train_loss: 0.3444, test_loss: 1.0172, test_f1: 0.6426
 epoch: 66, train_loss: 0.3594, test_loss: 1.1806, test_f1: 0.6524
 epoch: 67, train_loss: 0.3664, test_loss: 1.1420, test_f1: 0.6678
 epoch: 68, train_loss: 0.3552, test_loss: 1.1444, test_f1: 0.6713
 epoch: 69, train_loss: 0.3489, test_loss: 1.0567, test_f1: 0.6671
 epoch: 70, train_loss: 0.3652, test_loss: 1.0793, test_f1: 0.6459
 epoch: 71, train_loss: 0.3601, test_loss: 1.0557, test_f1: 0.6394
 epoch: 72, train_loss: 0.3627, test_loss: 1.1101, test_f1: 0.6550
 epoch: 73, train_loss: 0.3431, test_loss: 1.2145, test_f1: 0.6332
 epoch: 74, train_loss: 0.3306, test_loss: 1.2935, test_f1: 0.6702
 epoch: 75, train_loss: 0.3420, test_loss: 1.2524, test_f1: 0.6595
 epoch: 76, train_loss: 0.3416, test_loss: 1.2017, test_f1: 0.6365
 epoch: 77, train_loss: 0.3437, test_loss: 1.1230, test_f1: 0.6475
 epoch: 78, train_loss: 0.3313, test_loss: 1.2240, test_f1: 0.6657
 epoch: 79, train_loss: 0.3460, test_loss: 1.1359, test_f1: 0.6358
 epoch: 80, train_loss: 0.3157, test_loss: 1.1971, test_f1: 0.6687
 epoch: 81, train_loss: 0.3202, test_loss: 1.1311, test_f1: 0.6772
 epoch: 82, train_loss: 0.3243, test_loss: 1.2584, test_f1: 0.6501
 epoch: 83, train_loss: 0.3501, test_loss: 1.2446, test_f1: 0.6376
 epoch: 84, train_loss: 0.3212, test_loss: 1.2322, test_f1: 0.6560
 epoch: 85, train_loss: 0.3075, test_loss: 1.2453, test_f1: 0.6524
 epoch: 86, train_loss: 0.3068, test_loss: 1.3119, test_f1: 0.6363
 epoch: 87, train_loss: 0.3105, test_loss: 1.0352, test_f1: 0.6981
 epoch: 88, train_loss: 0.3352, test_loss: 1.6323, test_f1: 0.5625
 epoch: 89, train_loss: 0.3201, test_loss: 1.3356, test_f1: 0.6340
 epoch: 90, train_loss: 0.3303, test_loss: 1.2417, test_f1: 0.6425
 epoch: 91, train_loss: 0.3068, test_loss: 1.2381, test_f1: 0.6584
 epoch: 92, train_loss: 0.3078, test_loss: 1.2645, test_f1: 0.6720
 epoch: 93, train_loss: 0.2954, test_loss: 1.1905, test_f1: 0.6676
 epoch: 94, train_loss: 0.2782, test_loss: 1.1824, test_f1: 0.6837
 epoch: 95, train_loss: 0.2803, test_loss: 1.3047, test_f1: 0.6470
 epoch: 96, train_loss: 0.3023, test_loss: 1.2426, test_f1: 0.6685
 epoch: 97, train_loss: 0.2948, test_loss: 1.4229, test_f1: 0.6542
 epoch: 98, train_loss: 0.2718, test_loss: 1.3898, test_f1: 0.6339
 epoch: 99, train_loss: 0.2891, test_loss: 1.1281, test_f1: 0.6830
##################ITERATION #3 ****************************************
 epoch: 0, train_loss: 1.4756, test_loss: 1.2237, test_f1: 0.2789
 epoch: 1, train_loss: 1.0123, test_loss: 1.1418, test_f1: 0.3555
 epoch: 2, train_loss: 0.9742, test_loss: 1.0805, test_f1: 0.3960
 epoch: 3, train_loss: 0.9448, test_loss: 1.0322, test_f1: 0.4182
 epoch: 4, train_loss: 0.9160, test_loss: 1.0025, test_f1: 0.4486
 epoch: 5, train_loss: 0.8870, test_loss: 1.0697, test_f1: 0.4772
 epoch: 6, train_loss: 0.8869, test_loss: 0.9849, test_f1: 0.5302
 epoch: 7, train_loss: 0.8662, test_loss: 1.0874, test_f1: 0.4308
 epoch: 8, train_loss: 0.8448, test_loss: 1.1738, test_f1: 0.4327
 epoch: 9, train_loss: 0.8253, test_loss: 0.9146, test_f1: 0.5563
 epoch: 10, train_loss: 0.8138, test_loss: 0.9621, test_f1: 0.4887
 epoch: 11, train_loss: 0.8023, test_loss: 0.8403, test_f1: 0.5522
 epoch: 12, train_loss: 0.7769, test_loss: 1.0434, test_f1: 0.5471
 epoch: 13, train_loss: 0.7647, test_loss: 0.8804, test_f1: 0.5832
 epoch: 14, train_loss: 0.7417, test_loss: 0.8386, test_f1: 0.6096
 epoch: 15, train_loss: 0.7324, test_loss: 1.0093, test_f1: 0.5120
 epoch: 16, train_loss: 0.7312, test_loss: 0.9274, test_f1: 0.5812
 epoch: 17, train_loss: 0.7274, test_loss: 0.8887, test_f1: 0.5509
 epoch: 18, train_loss: 0.7120, test_loss: 0.9260, test_f1: 0.5602
 epoch: 19, train_loss: 0.6846, test_loss: 1.1934, test_f1: 0.5252
 epoch: 20, train_loss: 0.7053, test_loss: 0.9173, test_f1: 0.6113
 epoch: 21, train_loss: 0.7053, test_loss: 0.8987, test_f1: 0.6041
 epoch: 22, train_loss: 0.6960, test_loss: 0.8970, test_f1: 0.5894
 epoch: 23, train_loss: 0.6889, test_loss: 1.0327, test_f1: 0.5777
 epoch: 24, train_loss: 0.6700, test_loss: 0.9496, test_f1: 0.5982
 epoch: 25, train_loss: 0.6487, test_loss: 0.9114, test_f1: 0.5911
 epoch: 26, train_loss: 0.6628, test_loss: 0.9575, test_f1: 0.6135
 epoch: 27, train_loss: 0.6556, test_loss: 0.9560, test_f1: 0.6014
 epoch: 28, train_loss: 0.6271, test_loss: 0.8409, test_f1: 0.6546
 epoch: 29, train_loss: 0.6096, test_loss: 0.9530, test_f1: 0.6095
 epoch: 30, train_loss: 0.6270, test_loss: 0.9414, test_f1: 0.6057
 epoch: 31, train_loss: 0.6197, test_loss: 0.8038, test_f1: 0.6322
 epoch: 32, train_loss: 0.6261, test_loss: 1.0448, test_f1: 0.6040
 epoch: 33, train_loss: 0.6165, test_loss: 1.0201, test_f1: 0.5412
 epoch: 34, train_loss: 0.6041, test_loss: 0.8797, test_f1: 0.6305
 epoch: 35, train_loss: 0.5882, test_loss: 1.0306, test_f1: 0.5546
 epoch: 36, train_loss: 0.5911, test_loss: 0.9748, test_f1: 0.5709
 epoch: 37, train_loss: 0.5737, test_loss: 1.0203, test_f1: 0.5901
 epoch: 38, train_loss: 0.5669, test_loss: 1.1970, test_f1: 0.5641
 epoch: 39, train_loss: 0.5551, test_loss: 1.0105, test_f1: 0.6307
 epoch: 40, train_loss: 0.6057, test_loss: 0.9396, test_f1: 0.6107
 epoch: 41, train_loss: 0.5764, test_loss: 1.0853, test_f1: 0.5846
 epoch: 42, train_loss: 0.5723, test_loss: 0.8452, test_f1: 0.6613
 epoch: 43, train_loss: 0.5480, test_loss: 1.2006, test_f1: 0.5355
 epoch: 44, train_loss: 0.5410, test_loss: 0.9205, test_f1: 0.6573
 epoch: 45, train_loss: 0.5351, test_loss: 1.0448, test_f1: 0.6215
 epoch: 46, train_loss: 0.5357, test_loss: 0.9144, test_f1: 0.6235
 epoch: 47, train_loss: 0.5473, test_loss: 0.9080, test_f1: 0.6316
 epoch: 48, train_loss: 0.5524, test_loss: 1.2547, test_f1: 0.5119
 epoch: 49, train_loss: 0.5383, test_loss: 0.9903, test_f1: 0.6092
 epoch: 50, train_loss: 0.5392, test_loss: 1.2376, test_f1: 0.6019
 epoch: 51, train_loss: 0.4885, test_loss: 0.8851, test_f1: 0.6485
 epoch: 52, train_loss: 0.4592, test_loss: 1.0057, test_f1: 0.6318
 epoch: 53, train_loss: 0.4604, test_loss: 0.8797, test_f1: 0.6639
 epoch: 54, train_loss: 0.4257, test_loss: 1.0102, test_f1: 0.6195
 epoch: 55, train_loss: 0.4346, test_loss: 1.0481, test_f1: 0.6436
 epoch: 56, train_loss: 0.4300, test_loss: 1.0103, test_f1: 0.6424
 epoch: 57, train_loss: 0.4190, test_loss: 1.2874, test_f1: 0.6285
 epoch: 58, train_loss: 0.4477, test_loss: 1.0468, test_f1: 0.6265
 epoch: 59, train_loss: 0.4241, test_loss: 0.9730, test_f1: 0.6588
 epoch: 60, train_loss: 0.4104, test_loss: 1.1663, test_f1: 0.6038
 epoch: 61, train_loss: 0.3848, test_loss: 1.0199, test_f1: 0.6468
 epoch: 62, train_loss: 0.3819, test_loss: 1.1009, test_f1: 0.6353
 epoch: 63, train_loss: 0.4057, test_loss: 1.1599, test_f1: 0.6231
 epoch: 64, train_loss: 0.3862, test_loss: 1.1984, test_f1: 0.6307
 epoch: 65, train_loss: 0.3944, test_loss: 1.0620, test_f1: 0.6483
 epoch: 66, train_loss: 0.3791, test_loss: 1.1007, test_f1: 0.6542
 epoch: 67, train_loss: 0.3854, test_loss: 1.1570, test_f1: 0.6373
 epoch: 68, train_loss: 0.3903, test_loss: 1.0248, test_f1: 0.6500
 epoch: 69, train_loss: 0.4123, test_loss: 1.2712, test_f1: 0.6128
 epoch: 70, train_loss: 0.3918, test_loss: 1.0182, test_f1: 0.6437
 epoch: 71, train_loss: 0.3935, test_loss: 1.0063, test_f1: 0.6608
 epoch: 72, train_loss: 0.3878, test_loss: 1.3489, test_f1: 0.6118
 epoch: 73, train_loss: 0.3861, test_loss: 1.0688, test_f1: 0.6420
 epoch: 74, train_loss: 0.3779, test_loss: 1.1290, test_f1: 0.6263
 epoch: 75, train_loss: 0.3693, test_loss: 1.1135, test_f1: 0.6350
 epoch: 76, train_loss: 0.3670, test_loss: 1.2162, test_f1: 0.6164
 epoch: 77, train_loss: 0.3862, test_loss: 1.1461, test_f1: 0.6350
 epoch: 78, train_loss: 0.3946, test_loss: 1.0341, test_f1: 0.6553
 epoch: 79, train_loss: 0.3639, test_loss: 1.1241, test_f1: 0.6420
 epoch: 80, train_loss: 0.3585, test_loss: 1.2671, test_f1: 0.6356
 epoch: 81, train_loss: 0.3420, test_loss: 1.0601, test_f1: 0.6644
 epoch: 82, train_loss: 0.3569, test_loss: 1.1929, test_f1: 0.6403
 epoch: 83, train_loss: 0.3723, test_loss: 1.1860, test_f1: 0.6393
 epoch: 84, train_loss: 0.3648, test_loss: 0.9490, test_f1: 0.6698
 epoch: 85, train_loss: 0.3426, test_loss: 1.2457, test_f1: 0.6299
 epoch: 86, train_loss: 0.3441, test_loss: 1.0502, test_f1: 0.6645
 epoch: 87, train_loss: 0.3522, test_loss: 1.1808, test_f1: 0.6554
 epoch: 88, train_loss: 0.3269, test_loss: 1.1970, test_f1: 0.6497
 epoch: 89, train_loss: 0.3289, test_loss: 1.1808, test_f1: 0.6454
 epoch: 90, train_loss: 0.3299, test_loss: 1.1908, test_f1: 0.6301
 epoch: 91, train_loss: 0.3187, test_loss: 1.4329, test_f1: 0.6356
 epoch: 92, train_loss: 0.3379, test_loss: 1.2700, test_f1: 0.6203
 epoch: 93, train_loss: 0.3241, test_loss: 1.1721, test_f1: 0.6313
 epoch: 94, train_loss: 0.3566, test_loss: 0.9499, test_f1: 0.6787
 epoch: 95, train_loss: 0.3317, test_loss: 1.2342, test_f1: 0.6147
 epoch: 96, train_loss: 0.3258, test_loss: 1.0765, test_f1: 0.6506
 epoch: 97, train_loss: 0.3164, test_loss: 1.0051, test_f1: 0.6380
 epoch: 98, train_loss: 0.3153, test_loss: 1.1592, test_f1: 0.6315
 epoch: 99, train_loss: 0.3081, test_loss: 1.2126, test_f1: 0.6335
##################ITERATION #4 ****************************************
 epoch: 0, train_loss: 1.4202, test_loss: 1.1828, test_f1: 0.3101
 epoch: 1, train_loss: 1.0310, test_loss: 1.2243, test_f1: 0.2953
 epoch: 2, train_loss: 0.9776, test_loss: 1.1357, test_f1: 0.4395
 epoch: 3, train_loss: 0.9622, test_loss: 1.0457, test_f1: 0.4915
 epoch: 4, train_loss: 0.9295, test_loss: 0.9525, test_f1: 0.4664
 epoch: 5, train_loss: 0.8928, test_loss: 0.9298, test_f1: 0.4964
 epoch: 6, train_loss: 0.8652, test_loss: 0.9126, test_f1: 0.5097
 epoch: 7, train_loss: 0.8604, test_loss: 0.9009, test_f1: 0.5691
 epoch: 8, train_loss: 0.8264, test_loss: 0.9148, test_f1: 0.5067
 epoch: 9, train_loss: 0.8104, test_loss: 0.9488, test_f1: 0.5022
 epoch: 10, train_loss: 0.7828, test_loss: 1.0311, test_f1: 0.5238
 epoch: 11, train_loss: 0.7849, test_loss: 1.0503, test_f1: 0.5345
 epoch: 12, train_loss: 0.7761, test_loss: 0.8694, test_f1: 0.5723
 epoch: 13, train_loss: 0.7499, test_loss: 0.9490, test_f1: 0.5448
 epoch: 14, train_loss: 0.7363, test_loss: 0.9289, test_f1: 0.5806
 epoch: 15, train_loss: 0.7344, test_loss: 1.0794, test_f1: 0.5219
 epoch: 16, train_loss: 0.7322, test_loss: 0.9735, test_f1: 0.5285
 epoch: 17, train_loss: 0.7218, test_loss: 0.9478, test_f1: 0.5991
 epoch: 18, train_loss: 0.7123, test_loss: 0.9049, test_f1: 0.5712
 epoch: 19, train_loss: 0.6985, test_loss: 1.1619, test_f1: 0.4843
 epoch: 20, train_loss: 0.7055, test_loss: 0.9741, test_f1: 0.6219
 epoch: 21, train_loss: 0.7046, test_loss: 1.0000, test_f1: 0.5807
 epoch: 22, train_loss: 0.6868, test_loss: 1.0284, test_f1: 0.5283
 epoch: 23, train_loss: 0.6742, test_loss: 0.9382, test_f1: 0.5991
 epoch: 24, train_loss: 0.6532, test_loss: 0.9250, test_f1: 0.5905
 epoch: 25, train_loss: 0.6615, test_loss: 1.1163, test_f1: 0.5372
 epoch: 26, train_loss: 0.6786, test_loss: 1.0139, test_f1: 0.5664
 epoch: 27, train_loss: 0.6382, test_loss: 1.3464, test_f1: 0.5560
 epoch: 28, train_loss: 0.6334, test_loss: 1.1210, test_f1: 0.5803
 epoch: 29, train_loss: 0.6392, test_loss: 0.9217, test_f1: 0.6200
 epoch: 30, train_loss: 0.6400, test_loss: 0.9844, test_f1: 0.6254
 epoch: 31, train_loss: 0.6602, test_loss: 2.2276, test_f1: 0.5037
 epoch: 32, train_loss: 0.6606, test_loss: 1.0475, test_f1: 0.6552
 epoch: 33, train_loss: 0.6181, test_loss: 0.8809, test_f1: 0.6537
 epoch: 34, train_loss: 0.6285, test_loss: 1.0777, test_f1: 0.6060
 epoch: 35, train_loss: 0.6468, test_loss: 1.0536, test_f1: 0.5789
 epoch: 36, train_loss: 0.6026, test_loss: 1.1853, test_f1: 0.5246
 epoch: 37, train_loss: 0.6120, test_loss: 0.9133, test_f1: 0.6375
 epoch: 38, train_loss: 0.5860, test_loss: 0.8668, test_f1: 0.6657
 epoch: 39, train_loss: 0.5800, test_loss: 0.9883, test_f1: 0.6398
 epoch: 40, train_loss: 0.5653, test_loss: 0.9147, test_f1: 0.6246
 epoch: 41, train_loss: 0.5969, test_loss: 1.3915, test_f1: 0.5812
 epoch: 42, train_loss: 0.5714, test_loss: 0.9910, test_f1: 0.5907
 epoch: 43, train_loss: 0.5742, test_loss: 1.2304, test_f1: 0.5761
 epoch: 44, train_loss: 0.5648, test_loss: 1.1207, test_f1: 0.6430
 epoch: 45, train_loss: 0.5737, test_loss: 0.9329, test_f1: 0.6400
 epoch: 46, train_loss: 0.5809, test_loss: 1.3962, test_f1: 0.5693
 epoch: 47, train_loss: 0.5776, test_loss: 1.1478, test_f1: 0.5615
 epoch: 48, train_loss: 0.5713, test_loss: 1.1848, test_f1: 0.6152
 epoch: 49, train_loss: 0.5500, test_loss: 1.1890, test_f1: 0.6363
 epoch: 50, train_loss: 0.5492, test_loss: 1.2080, test_f1: 0.5748
 epoch: 51, train_loss: 0.5262, test_loss: 0.8352, test_f1: 0.6915
 epoch: 52, train_loss: 0.4936, test_loss: 1.0602, test_f1: 0.6480
 epoch: 53, train_loss: 0.4922, test_loss: 0.9521, test_f1: 0.6530
 epoch: 54, train_loss: 0.4628, test_loss: 1.0223, test_f1: 0.6551
 epoch: 55, train_loss: 0.4546, test_loss: 1.2137, test_f1: 0.6351
 epoch: 56, train_loss: 0.4604, test_loss: 0.9339, test_f1: 0.6774
 epoch: 57, train_loss: 0.4476, test_loss: 1.1160, test_f1: 0.6324
 epoch: 58, train_loss: 0.4406, test_loss: 1.1470, test_f1: 0.6727
 epoch: 59, train_loss: 0.4741, test_loss: 1.0962, test_f1: 0.6385
 epoch: 60, train_loss: 0.4379, test_loss: 1.0994, test_f1: 0.6309
 epoch: 61, train_loss: 0.4268, test_loss: 1.3753, test_f1: 0.6063
 epoch: 62, train_loss: 0.4399, test_loss: 1.0854, test_f1: 0.6639
 epoch: 63, train_loss: 0.4433, test_loss: 1.0575, test_f1: 0.6540
 epoch: 64, train_loss: 0.4201, test_loss: 1.0202, test_f1: 0.6930
 epoch: 65, train_loss: 0.4140, test_loss: 1.0942, test_f1: 0.6724
 epoch: 66, train_loss: 0.4133, test_loss: 1.0970, test_f1: 0.6658
 epoch: 67, train_loss: 0.4095, test_loss: 1.0716, test_f1: 0.6803
 epoch: 68, train_loss: 0.4023, test_loss: 1.2023, test_f1: 0.6647
 epoch: 69, train_loss: 0.4078, test_loss: 1.2704, test_f1: 0.6451
 epoch: 70, train_loss: 0.3976, test_loss: 1.1248, test_f1: 0.6346
 epoch: 71, train_loss: 0.4237, test_loss: 1.2277, test_f1: 0.6588
 epoch: 72, train_loss: 0.3917, test_loss: 1.2825, test_f1: 0.6445
 epoch: 73, train_loss: 0.3759, test_loss: 1.3164, test_f1: 0.6432
 epoch: 74, train_loss: 0.3888, test_loss: 1.3353, test_f1: 0.6210
 epoch: 75, train_loss: 0.3996, test_loss: 1.3158, test_f1: 0.6056
 epoch: 76, train_loss: 0.4149, test_loss: 1.1516, test_f1: 0.6638
 epoch: 77, train_loss: 0.4003, test_loss: 1.2008, test_f1: 0.6562
 epoch: 78, train_loss: 0.4073, test_loss: 1.3532, test_f1: 0.6461
 epoch: 79, train_loss: 0.3876, test_loss: 1.1422, test_f1: 0.6791
 epoch: 80, train_loss: 0.3769, test_loss: 1.5405, test_f1: 0.6271
 epoch: 81, train_loss: 0.3870, test_loss: 1.2232, test_f1: 0.6149
 epoch: 82, train_loss: 0.3750, test_loss: 1.1875, test_f1: 0.6589
 epoch: 83, train_loss: 0.3685, test_loss: 1.2991, test_f1: 0.6475
 epoch: 84, train_loss: 0.3773, test_loss: 1.2464, test_f1: 0.6552
 epoch: 85, train_loss: 0.3659, test_loss: 1.2724, test_f1: 0.6496
 epoch: 86, train_loss: 0.3585, test_loss: 1.3645, test_f1: 0.6528
 epoch: 87, train_loss: 0.3767, test_loss: 1.2195, test_f1: 0.6665
 epoch: 88, train_loss: 0.3529, test_loss: 1.1827, test_f1: 0.6902
 epoch: 89, train_loss: 0.3443, test_loss: 1.1975, test_f1: 0.6437
 epoch: 90, train_loss: 0.3450, test_loss: 1.2595, test_f1: 0.6683
 epoch: 91, train_loss: 0.3426, test_loss: 1.3051, test_f1: 0.6321
 epoch: 92, train_loss: 0.3336, test_loss: 1.2550, test_f1: 0.6982
 epoch: 93, train_loss: 0.3527, test_loss: 1.2669, test_f1: 0.6621
 epoch: 94, train_loss: 0.3443, test_loss: 1.3861, test_f1: 0.6392
 epoch: 95, train_loss: 0.3367, test_loss: 1.3079, test_f1: 0.6754
 epoch: 96, train_loss: 0.3296, test_loss: 1.3516, test_f1: 0.6803
 epoch: 97, train_loss: 0.3212, test_loss: 1.3669, test_f1: 0.6259
 epoch: 98, train_loss: 0.3260, test_loss: 1.4938, test_f1: 0.5749
 epoch: 99, train_loss: 0.3672, test_loss: 1.1629, test_f1: 0.6601
##################ITERATION #5 ****************************************
 epoch: 0, train_loss: 1.6963, test_loss: 1.3559, test_f1: 0.2898
 epoch: 1, train_loss: 1.0667, test_loss: 1.3060, test_f1: 0.3368
 epoch: 2, train_loss: 1.0044, test_loss: 1.0753, test_f1: 0.4249
 epoch: 3, train_loss: 0.9668, test_loss: 0.9967, test_f1: 0.4822
 epoch: 4, train_loss: 0.9302, test_loss: 1.0442, test_f1: 0.4798
 epoch: 5, train_loss: 0.9153, test_loss: 0.9997, test_f1: 0.5187
 epoch: 6, train_loss: 0.8896, test_loss: 1.0611, test_f1: 0.4907
 epoch: 7, train_loss: 0.8517, test_loss: 1.0683, test_f1: 0.5061
 epoch: 8, train_loss: 0.8240, test_loss: 0.8971, test_f1: 0.5065
 epoch: 9, train_loss: 0.8167, test_loss: 0.9947, test_f1: 0.5307
 epoch: 10, train_loss: 0.8002, test_loss: 0.9397, test_f1: 0.5146
 epoch: 11, train_loss: 0.7891, test_loss: 0.9994, test_f1: 0.5408
 epoch: 12, train_loss: 0.7710, test_loss: 1.0904, test_f1: 0.4989
 epoch: 13, train_loss: 0.7558, test_loss: 0.8855, test_f1: 0.5716
 epoch: 14, train_loss: 0.7368, test_loss: 0.8948, test_f1: 0.5462
 epoch: 15, train_loss: 0.7570, test_loss: 1.1384, test_f1: 0.4883
 epoch: 16, train_loss: 0.7585, test_loss: 0.7875, test_f1: 0.5638
 epoch: 17, train_loss: 0.7411, test_loss: 1.3660, test_f1: 0.4690
 epoch: 18, train_loss: 0.7357, test_loss: 1.1868, test_f1: 0.4951
 epoch: 19, train_loss: 0.7039, test_loss: 0.8525, test_f1: 0.6204
 epoch: 20, train_loss: 0.6914, test_loss: 1.1441, test_f1: 0.5100
 epoch: 21, train_loss: 0.6979, test_loss: 0.8322, test_f1: 0.6240
 epoch: 22, train_loss: 0.6704, test_loss: 1.0074, test_f1: 0.5596
 epoch: 23, train_loss: 0.6743, test_loss: 0.7990, test_f1: 0.6206
 epoch: 24, train_loss: 0.6564, test_loss: 0.8562, test_f1: 0.6115
 epoch: 25, train_loss: 0.6474, test_loss: 0.9247, test_f1: 0.5888
 epoch: 26, train_loss: 0.6494, test_loss: 0.9514, test_f1: 0.6010
 epoch: 27, train_loss: 0.6208, test_loss: 0.7931, test_f1: 0.6456
 epoch: 28, train_loss: 0.6284, test_loss: 0.7727, test_f1: 0.6572
 epoch: 29, train_loss: 0.6054, test_loss: 0.8087, test_f1: 0.6183
 epoch: 30, train_loss: 0.6261, test_loss: 0.8610, test_f1: 0.6178
 epoch: 31, train_loss: 0.6075, test_loss: 0.8232, test_f1: 0.5986
 epoch: 32, train_loss: 0.5880, test_loss: 0.7381, test_f1: 0.6728
 epoch: 33, train_loss: 0.5673, test_loss: 0.7747, test_f1: 0.6701
 epoch: 34, train_loss: 0.5917, test_loss: 0.8500, test_f1: 0.6205
 epoch: 35, train_loss: 0.5860, test_loss: 0.8555, test_f1: 0.6121
 epoch: 36, train_loss: 0.5888, test_loss: 0.8041, test_f1: 0.6554
 epoch: 37, train_loss: 0.5599, test_loss: 1.0730, test_f1: 0.5542
 epoch: 38, train_loss: 0.5612, test_loss: 0.7393, test_f1: 0.6652
 epoch: 39, train_loss: 0.5306, test_loss: 0.8991, test_f1: 0.6494
 epoch: 40, train_loss: 0.5475, test_loss: 0.8529, test_f1: 0.6069
 epoch: 41, train_loss: 0.5359, test_loss: 0.8942, test_f1: 0.6183
 epoch: 42, train_loss: 0.5530, test_loss: 0.8722, test_f1: 0.6446
 epoch: 43, train_loss: 0.5316, test_loss: 0.9205, test_f1: 0.5863
 epoch: 44, train_loss: 0.5237, test_loss: 0.8433, test_f1: 0.6578
 epoch: 45, train_loss: 0.5247, test_loss: 0.8216, test_f1: 0.6659
 epoch: 46, train_loss: 0.5243, test_loss: 0.8962, test_f1: 0.6239
 epoch: 47, train_loss: 0.5175, test_loss: 0.8653, test_f1: 0.6243
 epoch: 48, train_loss: 0.5053, test_loss: 0.8880, test_f1: 0.6723
 epoch: 49, train_loss: 0.5024, test_loss: 1.2736, test_f1: 0.5137
 epoch: 50, train_loss: 0.5283, test_loss: 1.0734, test_f1: 0.5773
 epoch: 51, train_loss: 0.4647, test_loss: 0.8132, test_f1: 0.6615
 epoch: 52, train_loss: 0.4404, test_loss: 0.8716, test_f1: 0.6482
 epoch: 53, train_loss: 0.4168, test_loss: 0.9244, test_f1: 0.6449
 epoch: 54, train_loss: 0.4112, test_loss: 0.8501, test_f1: 0.6535
 epoch: 55, train_loss: 0.4000, test_loss: 0.8468, test_f1: 0.6750
 epoch: 56, train_loss: 0.4014, test_loss: 0.8514, test_f1: 0.6611
 epoch: 57, train_loss: 0.3936, test_loss: 0.9113, test_f1: 0.6505
 epoch: 58, train_loss: 0.3900, test_loss: 0.9295, test_f1: 0.6476
 epoch: 59, train_loss: 0.3962, test_loss: 0.9333, test_f1: 0.6511
 epoch: 60, train_loss: 0.3948, test_loss: 1.0014, test_f1: 0.6215
 epoch: 61, train_loss: 0.3966, test_loss: 0.8260, test_f1: 0.6791
 epoch: 62, train_loss: 0.3777, test_loss: 0.9069, test_f1: 0.6612
 epoch: 63, train_loss: 0.3861, test_loss: 0.9134, test_f1: 0.6220
 epoch: 64, train_loss: 0.3816, test_loss: 0.9245, test_f1: 0.6128
 epoch: 65, train_loss: 0.3600, test_loss: 0.9485, test_f1: 0.6590
 epoch: 66, train_loss: 0.3688, test_loss: 1.0218, test_f1: 0.6389
 epoch: 67, train_loss: 0.3486, test_loss: 0.9060, test_f1: 0.6626
 epoch: 68, train_loss: 0.3470, test_loss: 0.9346, test_f1: 0.6554
 epoch: 69, train_loss: 0.3534, test_loss: 1.0859, test_f1: 0.6114
 epoch: 70, train_loss: 0.3771, test_loss: 1.1916, test_f1: 0.5946
 epoch: 71, train_loss: 0.3696, test_loss: 1.1054, test_f1: 0.6209
 epoch: 72, train_loss: 0.3663, test_loss: 0.9276, test_f1: 0.6641
 epoch: 73, train_loss: 0.3667, test_loss: 1.0803, test_f1: 0.6368
 epoch: 74, train_loss: 0.3410, test_loss: 0.9830, test_f1: 0.6354
 epoch: 75, train_loss: 0.3503, test_loss: 1.0647, test_f1: 0.6268
 epoch: 76, train_loss: 0.3405, test_loss: 1.0368, test_f1: 0.6314
 epoch: 77, train_loss: 0.3295, test_loss: 1.0363, test_f1: 0.6006
 epoch: 78, train_loss: 0.3442, test_loss: 1.0578, test_f1: 0.6301
 epoch: 79, train_loss: 0.3403, test_loss: 0.9433, test_f1: 0.6561
 epoch: 80, train_loss: 0.3462, test_loss: 0.9779, test_f1: 0.6429
 epoch: 81, train_loss: 0.3321, test_loss: 1.0347, test_f1: 0.6364
 epoch: 82, train_loss: 0.3335, test_loss: 1.0871, test_f1: 0.6360
 epoch: 83, train_loss: 0.3200, test_loss: 1.0179, test_f1: 0.6659
 epoch: 84, train_loss: 0.3174, test_loss: 1.1676, test_f1: 0.6240
 epoch: 85, train_loss: 0.3141, test_loss: 1.0735, test_f1: 0.6276
 epoch: 86, train_loss: 0.3442, test_loss: 0.9370, test_f1: 0.6383
 epoch: 87, train_loss: 0.3417, test_loss: 1.1193, test_f1: 0.6194
 epoch: 88, train_loss: 0.3472, test_loss: 1.0039, test_f1: 0.6416
 epoch: 89, train_loss: 0.3144, test_loss: 0.9897, test_f1: 0.6754
 epoch: 90, train_loss: 0.3060, test_loss: 1.0185, test_f1: 0.6607
 epoch: 91, train_loss: 0.3133, test_loss: 1.1624, test_f1: 0.6347
 epoch: 92, train_loss: 0.3060, test_loss: 1.0247, test_f1: 0.6431
 epoch: 93, train_loss: 0.2802, test_loss: 0.9947, test_f1: 0.6507
 epoch: 94, train_loss: 0.2808, test_loss: 1.2649, test_f1: 0.6159
 epoch: 95, train_loss: 0.2794, test_loss: 1.0287, test_f1: 0.6780
 epoch: 96, train_loss: 0.2883, test_loss: 1.2886, test_f1: 0.6102
 epoch: 97, train_loss: 0.3082, test_loss: 1.1747, test_f1: 0.6272
 epoch: 98, train_loss: 0.2885, test_loss: 1.0664, test_f1: 0.6256
 epoch: 99, train_loss: 0.2916, test_loss: 0.9965, test_f1: 0.6641
##################ITERATION #6 ****************************************
 epoch: 0, train_loss: 1.6273, test_loss: 1.2525, test_f1: 0.2836
 epoch: 1, train_loss: 1.0494, test_loss: 1.1644, test_f1: 0.3342
 epoch: 2, train_loss: 0.9752, test_loss: 1.2451, test_f1: 0.3774
 epoch: 3, train_loss: 0.9245, test_loss: 1.1176, test_f1: 0.4009
 epoch: 4, train_loss: 0.8968, test_loss: 1.0560, test_f1: 0.4198
 epoch: 5, train_loss: 0.8637, test_loss: 0.9619, test_f1: 0.5103
 epoch: 6, train_loss: 0.8473, test_loss: 1.0153, test_f1: 0.5448
 epoch: 7, train_loss: 0.8234, test_loss: 0.9941, test_f1: 0.4968
 epoch: 8, train_loss: 0.8143, test_loss: 1.2957, test_f1: 0.4874
 epoch: 9, train_loss: 0.7908, test_loss: 1.0615, test_f1: 0.4708
 epoch: 10, train_loss: 0.7806, test_loss: 0.9950, test_f1: 0.5189
 epoch: 11, train_loss: 0.7619, test_loss: 3.4559, test_f1: 0.1986
 epoch: 12, train_loss: 0.7784, test_loss: 1.0762, test_f1: 0.4578
 epoch: 13, train_loss: 0.7610, test_loss: 1.0535, test_f1: 0.5218
 epoch: 14, train_loss: 0.7620, test_loss: 0.9694, test_f1: 0.5400
 epoch: 15, train_loss: 0.7575, test_loss: 1.0662, test_f1: 0.5105
 epoch: 16, train_loss: 0.7303, test_loss: 1.1380, test_f1: 0.5449
 epoch: 17, train_loss: 0.7119, test_loss: 0.8327, test_f1: 0.6198
 epoch: 18, train_loss: 0.6919, test_loss: 0.9975, test_f1: 0.5616
 epoch: 19, train_loss: 0.6968, test_loss: 1.1442, test_f1: 0.5325
 epoch: 20, train_loss: 0.7033, test_loss: 1.2353, test_f1: 0.5289
 epoch: 21, train_loss: 0.6849, test_loss: 0.9829, test_f1: 0.5687
 epoch: 22, train_loss: 0.6529, test_loss: 1.0552, test_f1: 0.6201
 epoch: 23, train_loss: 0.6496, test_loss: 1.1100, test_f1: 0.6227
 epoch: 24, train_loss: 0.6517, test_loss: 0.7816, test_f1: 0.6223
 epoch: 25, train_loss: 0.6403, test_loss: 0.9623, test_f1: 0.5781
 epoch: 26, train_loss: 0.6452, test_loss: 1.1747, test_f1: 0.4605
 epoch: 27, train_loss: 0.6452, test_loss: 0.9213, test_f1: 0.6420
 epoch: 28, train_loss: 0.6432, test_loss: 1.0761, test_f1: 0.6016
 epoch: 29, train_loss: 0.6247, test_loss: 1.0508, test_f1: 0.6339
 epoch: 30, train_loss: 0.5952, test_loss: 1.0225, test_f1: 0.5925
 epoch: 31, train_loss: 0.5980, test_loss: 1.0011, test_f1: 0.6391
 epoch: 32, train_loss: 0.5767, test_loss: 1.1223, test_f1: 0.6271
 epoch: 33, train_loss: 0.5958, test_loss: 1.1273, test_f1: 0.5880
 epoch: 34, train_loss: 0.6053, test_loss: 1.2878, test_f1: 0.5776
 epoch: 35, train_loss: 0.5928, test_loss: 1.1508, test_f1: 0.6264
 epoch: 36, train_loss: 0.5718, test_loss: 1.1807, test_f1: 0.5877
 epoch: 37, train_loss: 0.5675, test_loss: 0.9783, test_f1: 0.5879
 epoch: 38, train_loss: 0.5626, test_loss: 1.2325, test_f1: 0.5916
 epoch: 39, train_loss: 0.5554, test_loss: 1.4138, test_f1: 0.5891
 epoch: 40, train_loss: 0.5768, test_loss: 1.0226, test_f1: 0.6195
 epoch: 41, train_loss: 0.5538, test_loss: 1.2676, test_f1: 0.6076
 epoch: 42, train_loss: 0.5671, test_loss: 1.0924, test_f1: 0.6265
 epoch: 43, train_loss: 0.5716, test_loss: 1.2319, test_f1: 0.6363
 epoch: 44, train_loss: 0.5504, test_loss: 1.0788, test_f1: 0.6314
 epoch: 45, train_loss: 0.5490, test_loss: 1.4234, test_f1: 0.5903
 epoch: 46, train_loss: 0.5203, test_loss: 1.1214, test_f1: 0.6435
 epoch: 47, train_loss: 0.5030, test_loss: 1.2071, test_f1: 0.5841
 epoch: 48, train_loss: 0.4963, test_loss: 1.1059, test_f1: 0.6249
 epoch: 49, train_loss: 0.5183, test_loss: 1.2070, test_f1: 0.5730
 epoch: 50, train_loss: 0.5038, test_loss: 1.1483, test_f1: 0.6186
 epoch: 51, train_loss: 0.4679, test_loss: 1.0521, test_f1: 0.6275
 epoch: 52, train_loss: 0.4412, test_loss: 0.9708, test_f1: 0.6435
 epoch: 53, train_loss: 0.4362, test_loss: 1.1164, test_f1: 0.6487
 epoch: 54, train_loss: 0.4292, test_loss: 1.0484, test_f1: 0.6479
 epoch: 55, train_loss: 0.4023, test_loss: 1.0904, test_f1: 0.6399
 epoch: 56, train_loss: 0.4024, test_loss: 1.0587, test_f1: 0.6819
 epoch: 57, train_loss: 0.3900, test_loss: 1.0901, test_f1: 0.6444
 epoch: 58, train_loss: 0.3895, test_loss: 1.1024, test_f1: 0.6443
 epoch: 59, train_loss: 0.3915, test_loss: 1.1401, test_f1: 0.6747
 epoch: 60, train_loss: 0.3789, test_loss: 1.3362, test_f1: 0.6412
 epoch: 61, train_loss: 0.3860, test_loss: 1.1508, test_f1: 0.6495
 epoch: 62, train_loss: 0.3902, test_loss: 1.0732, test_f1: 0.6452
 epoch: 63, train_loss: 0.3734, test_loss: 1.2005, test_f1: 0.6719
 epoch: 64, train_loss: 0.3891, test_loss: 1.0727, test_f1: 0.6236
 epoch: 65, train_loss: 0.3662, test_loss: 1.1095, test_f1: 0.6342
 epoch: 66, train_loss: 0.3777, test_loss: 1.2343, test_f1: 0.6436
 epoch: 67, train_loss: 0.3670, test_loss: 1.3069, test_f1: 0.6215
 epoch: 68, train_loss: 0.4083, test_loss: 1.1558, test_f1: 0.6736
 epoch: 69, train_loss: 0.3922, test_loss: 2.0031, test_f1: 0.4524
 epoch: 70, train_loss: 0.3726, test_loss: 1.1136, test_f1: 0.6508
 epoch: 71, train_loss: 0.3497, test_loss: 1.2181, test_f1: 0.6374
 epoch: 72, train_loss: 0.3524, test_loss: 1.1348, test_f1: 0.6663
 epoch: 73, train_loss: 0.3426, test_loss: 1.2885, test_f1: 0.6554
 epoch: 74, train_loss: 0.3634, test_loss: 1.1187, test_f1: 0.6491
 epoch: 75, train_loss: 0.3562, test_loss: 1.2367, test_f1: 0.6490
 epoch: 76, train_loss: 0.3543, test_loss: 1.1078, test_f1: 0.6712
 epoch: 77, train_loss: 0.3424, test_loss: 1.4134, test_f1: 0.6364
 epoch: 78, train_loss: 0.3355, test_loss: 1.2517, test_f1: 0.6384
 epoch: 79, train_loss: 0.3284, test_loss: 1.4089, test_f1: 0.6442
 epoch: 80, train_loss: 0.3109, test_loss: 1.3916, test_f1: 0.6475
 epoch: 81, train_loss: 0.3231, test_loss: 1.2705, test_f1: 0.6480
 epoch: 82, train_loss: 0.3126, test_loss: 1.3735, test_f1: 0.6473
 epoch: 83, train_loss: 0.3181, test_loss: 1.3608, test_f1: 0.6406
 epoch: 84, train_loss: 0.3288, test_loss: 1.2926, test_f1: 0.6345
 epoch: 85, train_loss: 0.3185, test_loss: 1.2319, test_f1: 0.6613
 epoch: 86, train_loss: 0.3038, test_loss: 1.4026, test_f1: 0.6333
 epoch: 87, train_loss: 0.2980, test_loss: 1.4254, test_f1: 0.6373
 epoch: 88, train_loss: 0.2985, test_loss: 1.3829, test_f1: 0.6293
 epoch: 89, train_loss: 0.3032, test_loss: 1.3168, test_f1: 0.6521
 epoch: 90, train_loss: 0.3118, test_loss: 1.5042, test_f1: 0.6467
 epoch: 91, train_loss: 0.3234, test_loss: 1.3533, test_f1: 0.6394
 epoch: 92, train_loss: 0.3034, test_loss: 1.3121, test_f1: 0.6421
 epoch: 93, train_loss: 0.2999, test_loss: 1.4361, test_f1: 0.6334
 epoch: 94, train_loss: 0.2956, test_loss: 1.3932, test_f1: 0.6511
 epoch: 95, train_loss: 0.2883, test_loss: 1.3653, test_f1: 0.6643
 epoch: 96, train_loss: 0.2986, test_loss: 1.3167, test_f1: 0.6726
 epoch: 97, train_loss: 0.2958, test_loss: 1.4144, test_f1: 0.6478
 epoch: 98, train_loss: 0.3025, test_loss: 1.3792, test_f1: 0.6666
 epoch: 99, train_loss: 0.2891, test_loss: 1.3881, test_f1: 0.6730
##################ITERATION #7 ****************************************
 epoch: 0, train_loss: 1.6232, test_loss: 1.4922, test_f1: 0.2539
 epoch: 1, train_loss: 1.0474, test_loss: 1.2086, test_f1: 0.3777
 epoch: 2, train_loss: 0.9759, test_loss: 1.1100, test_f1: 0.4723
 epoch: 3, train_loss: 0.9386, test_loss: 0.9821, test_f1: 0.5461
 epoch: 4, train_loss: 0.8907, test_loss: 0.9083, test_f1: 0.5494
 epoch: 5, train_loss: 0.8695, test_loss: 0.9827, test_f1: 0.5145
 epoch: 6, train_loss: 0.8617, test_loss: 0.8570, test_f1: 0.5687
 epoch: 7, train_loss: 0.8103, test_loss: 1.3734, test_f1: 0.4633
 epoch: 8, train_loss: 0.8059, test_loss: 0.8456, test_f1: 0.5840
 epoch: 9, train_loss: 0.7692, test_loss: 1.0435, test_f1: 0.4964
 epoch: 10, train_loss: 0.7614, test_loss: 0.8109, test_f1: 0.6225
 epoch: 11, train_loss: 0.7590, test_loss: 1.0251, test_f1: 0.5551
 epoch: 12, train_loss: 0.7700, test_loss: 0.8810, test_f1: 0.5581
 epoch: 13, train_loss: 0.7813, test_loss: 0.7852, test_f1: 0.6044
 epoch: 14, train_loss: 0.7609, test_loss: 1.0868, test_f1: 0.5029
 epoch: 15, train_loss: 0.7429, test_loss: 0.9170, test_f1: 0.5766
 epoch: 16, train_loss: 0.7148, test_loss: 0.8728, test_f1: 0.6087
 epoch: 17, train_loss: 0.7238, test_loss: 0.8618, test_f1: 0.5965
 epoch: 18, train_loss: 0.7078, test_loss: 0.9373, test_f1: 0.5480
 epoch: 19, train_loss: 0.7006, test_loss: 1.1185, test_f1: 0.5686
 epoch: 20, train_loss: 0.6857, test_loss: 1.2401, test_f1: 0.5288
 epoch: 21, train_loss: 0.6629, test_loss: 1.8208, test_f1: 0.4395
 epoch: 22, train_loss: 0.6594, test_loss: 0.9352, test_f1: 0.5990
 epoch: 23, train_loss: 0.6672, test_loss: 0.9893, test_f1: 0.5612
 epoch: 24, train_loss: 0.6382, test_loss: 0.8960, test_f1: 0.6139
 epoch: 25, train_loss: 0.6410, test_loss: 0.8884, test_f1: 0.6187
 epoch: 26, train_loss: 0.6534, test_loss: 1.0108, test_f1: 0.5372
 epoch: 27, train_loss: 0.6311, test_loss: 0.9301, test_f1: 0.6274
 epoch: 28, train_loss: 0.6015, test_loss: 0.8306, test_f1: 0.6325
 epoch: 29, train_loss: 0.6142, test_loss: 0.9168, test_f1: 0.6097
 epoch: 30, train_loss: 0.6086, test_loss: 1.0063, test_f1: 0.6351
 epoch: 31, train_loss: 0.5969, test_loss: 0.9348, test_f1: 0.6457
 epoch: 32, train_loss: 0.5819, test_loss: 0.9836, test_f1: 0.6414
 epoch: 33, train_loss: 0.5901, test_loss: 0.9025, test_f1: 0.6375
 epoch: 34, train_loss: 0.5840, test_loss: 0.9445, test_f1: 0.6092
 epoch: 35, train_loss: 0.5744, test_loss: 1.6586, test_f1: 0.5100
 epoch: 36, train_loss: 0.5857, test_loss: 1.0416, test_f1: 0.6309
 epoch: 37, train_loss: 0.5734, test_loss: 0.8991, test_f1: 0.6058
 epoch: 38, train_loss: 0.5847, test_loss: 0.9730, test_f1: 0.5740
 epoch: 39, train_loss: 0.5853, test_loss: 1.1164, test_f1: 0.5887
 epoch: 40, train_loss: 0.5488, test_loss: 1.0926, test_f1: 0.5428
 epoch: 41, train_loss: 0.5571, test_loss: 1.2594, test_f1: 0.5619
 epoch: 42, train_loss: 0.5474, test_loss: 1.0520, test_f1: 0.6058
 epoch: 43, train_loss: 0.5615, test_loss: 1.0634, test_f1: 0.5920
 epoch: 44, train_loss: 0.5167, test_loss: 0.9581, test_f1: 0.6306
 epoch: 45, train_loss: 0.5137, test_loss: 1.1314, test_f1: 0.6100
 epoch: 46, train_loss: 0.5245, test_loss: 1.0626, test_f1: 0.6180
 epoch: 47, train_loss: 0.5056, test_loss: 1.1687, test_f1: 0.6271
 epoch: 48, train_loss: 0.5000, test_loss: 1.1628, test_f1: 0.6082
 epoch: 49, train_loss: 0.4897, test_loss: 1.0269, test_f1: 0.6014
 epoch: 50, train_loss: 0.4868, test_loss: 1.0330, test_f1: 0.6542
 epoch: 51, train_loss: 0.4886, test_loss: 1.0701, test_f1: 0.6071
 epoch: 52, train_loss: 0.4345, test_loss: 1.1161, test_f1: 0.6551
 epoch: 53, train_loss: 0.4098, test_loss: 1.0607, test_f1: 0.6450
 epoch: 54, train_loss: 0.4012, test_loss: 1.2268, test_f1: 0.6168
 epoch: 55, train_loss: 0.3997, test_loss: 1.0652, test_f1: 0.6397
 epoch: 56, train_loss: 0.3865, test_loss: 1.1086, test_f1: 0.6268
 epoch: 57, train_loss: 0.4060, test_loss: 1.1767, test_f1: 0.5819
 epoch: 58, train_loss: 0.4136, test_loss: 1.1149, test_f1: 0.6288
 epoch: 59, train_loss: 0.3921, test_loss: 1.0141, test_f1: 0.6408
 epoch: 60, train_loss: 0.3779, test_loss: 1.0447, test_f1: 0.6574
 epoch: 61, train_loss: 0.3573, test_loss: 1.3014, test_f1: 0.6086
 epoch: 62, train_loss: 0.3693, test_loss: 1.1902, test_f1: 0.5958
 epoch: 63, train_loss: 0.3494, test_loss: 1.2593, test_f1: 0.6364
 epoch: 64, train_loss: 0.3573, test_loss: 1.1620, test_f1: 0.6426
 epoch: 65, train_loss: 0.3567, test_loss: 1.1357, test_f1: 0.6577
 epoch: 66, train_loss: 0.3865, test_loss: 1.0465, test_f1: 0.6617
 epoch: 67, train_loss: 0.3936, test_loss: 1.0963, test_f1: 0.6168
 epoch: 68, train_loss: 0.3704, test_loss: 1.2238, test_f1: 0.6428
 epoch: 69, train_loss: 0.3607, test_loss: 1.1265, test_f1: 0.6566
 epoch: 70, train_loss: 0.3692, test_loss: 1.1034, test_f1: 0.6346
 epoch: 71, train_loss: 0.3646, test_loss: 1.1484, test_f1: 0.6440
 epoch: 72, train_loss: 0.3460, test_loss: 1.4718, test_f1: 0.5701
 epoch: 73, train_loss: 0.3533, test_loss: 1.1143, test_f1: 0.6191
 epoch: 74, train_loss: 0.3302, test_loss: 1.3927, test_f1: 0.6075
 epoch: 75, train_loss: 0.3367, test_loss: 1.0727, test_f1: 0.6700
 epoch: 76, train_loss: 0.3323, test_loss: 1.1899, test_f1: 0.6429
 epoch: 77, train_loss: 0.3337, test_loss: 1.2322, test_f1: 0.6368
 epoch: 78, train_loss: 0.3045, test_loss: 1.2039, test_f1: 0.6423
 epoch: 79, train_loss: 0.3064, test_loss: 1.1751, test_f1: 0.6361
 epoch: 80, train_loss: 0.3151, test_loss: 1.5086, test_f1: 0.6175
 epoch: 81, train_loss: 0.3207, test_loss: 1.4977, test_f1: 0.6095
 epoch: 82, train_loss: 0.3172, test_loss: 1.2972, test_f1: 0.6485
 epoch: 83, train_loss: 0.2993, test_loss: 1.2928, test_f1: 0.6336
 epoch: 84, train_loss: 0.3197, test_loss: 1.1819, test_f1: 0.6396
 epoch: 85, train_loss: 0.3095, test_loss: 1.2372, test_f1: 0.6622
 epoch: 86, train_loss: 0.2966, test_loss: 1.1878, test_f1: 0.6328
 epoch: 87, train_loss: 0.2789, test_loss: 1.4980, test_f1: 0.6171
 epoch: 88, train_loss: 0.2988, test_loss: 1.2069, test_f1: 0.6674
 epoch: 89, train_loss: 0.2989, test_loss: 1.3508, test_f1: 0.6329
 epoch: 90, train_loss: 0.3157, test_loss: 1.3926, test_f1: 0.6047
 epoch: 91, train_loss: 0.3068, test_loss: 1.3597, test_f1: 0.6225
 epoch: 92, train_loss: 0.3010, test_loss: 1.3778, test_f1: 0.6459
 epoch: 93, train_loss: 0.2889, test_loss: 1.3090, test_f1: 0.6581
 epoch: 94, train_loss: 0.3020, test_loss: 1.3159, test_f1: 0.6464
 epoch: 95, train_loss: 0.2971, test_loss: 1.4151, test_f1: 0.6353
 epoch: 96, train_loss: 0.2976, test_loss: 1.3940, test_f1: 0.6500
 epoch: 97, train_loss: 0.3213, test_loss: 1.3272, test_f1: 0.6126
 epoch: 98, train_loss: 0.2854, test_loss: 1.4058, test_f1: 0.6341
 epoch: 99, train_loss: 0.3026, test_loss: 1.3671, test_f1: 0.6471
##################ITERATION #8 ****************************************
 epoch: 0, train_loss: 1.9329, test_loss: 1.3425, test_f1: 0.2691
 epoch: 1, train_loss: 1.0846, test_loss: 1.1930, test_f1: 0.3136
 epoch: 2, train_loss: 1.0265, test_loss: 1.0778, test_f1: 0.3957
 epoch: 3, train_loss: 0.9810, test_loss: 1.2103, test_f1: 0.4433
 epoch: 4, train_loss: 0.9668, test_loss: 2.0991, test_f1: 0.3412
 epoch: 5, train_loss: 0.9569, test_loss: 0.9761, test_f1: 0.5458
 epoch: 6, train_loss: 0.9236, test_loss: 1.8807, test_f1: 0.3158
 epoch: 7, train_loss: 0.8992, test_loss: 1.1491, test_f1: 0.4916
 epoch: 8, train_loss: 0.8898, test_loss: 1.0547, test_f1: 0.5228
 epoch: 9, train_loss: 0.8537, test_loss: 1.0014, test_f1: 0.5289
 epoch: 10, train_loss: 0.8565, test_loss: 0.9431, test_f1: 0.5701
 epoch: 11, train_loss: 0.8534, test_loss: 0.9958, test_f1: 0.4709
 epoch: 12, train_loss: 0.8301, test_loss: 1.1534, test_f1: 0.4549
 epoch: 13, train_loss: 0.8100, test_loss: 0.9909, test_f1: 0.5599
 epoch: 14, train_loss: 0.8238, test_loss: 1.0053, test_f1: 0.5347
 epoch: 15, train_loss: 0.8002, test_loss: 1.1716, test_f1: 0.5104
 epoch: 16, train_loss: 0.7689, test_loss: 0.8861, test_f1: 0.5839
 epoch: 17, train_loss: 0.7503, test_loss: 1.0669, test_f1: 0.5542
 epoch: 18, train_loss: 0.7385, test_loss: 1.3106, test_f1: 0.5241
 epoch: 19, train_loss: 0.7484, test_loss: 1.1653, test_f1: 0.4800
 epoch: 20, train_loss: 0.7162, test_loss: 1.0596, test_f1: 0.5223
 epoch: 21, train_loss: 0.7145, test_loss: 1.0848, test_f1: 0.5147
 epoch: 22, train_loss: 0.6885, test_loss: 1.0047, test_f1: 0.5780
 epoch: 23, train_loss: 0.7132, test_loss: 0.9885, test_f1: 0.6114
 epoch: 24, train_loss: 0.7117, test_loss: 1.1333, test_f1: 0.5270
 epoch: 25, train_loss: 0.7365, test_loss: 1.2002, test_f1: 0.4990
 epoch: 26, train_loss: 0.6876, test_loss: 0.9575, test_f1: 0.6118
 epoch: 27, train_loss: 0.6761, test_loss: 1.0086, test_f1: 0.5237
 epoch: 28, train_loss: 0.6868, test_loss: 0.9230, test_f1: 0.5722
 epoch: 29, train_loss: 0.7377, test_loss: 1.1500, test_f1: 0.4990
 epoch: 30, train_loss: 0.7286, test_loss: 1.6002, test_f1: 0.4584
 epoch: 31, train_loss: 0.6729, test_loss: 0.9790, test_f1: 0.5824
 epoch: 32, train_loss: 0.6474, test_loss: 0.9619, test_f1: 0.6006
 epoch: 33, train_loss: 0.6503, test_loss: 1.1250, test_f1: 0.5369
 epoch: 34, train_loss: 0.6505, test_loss: 1.0266, test_f1: 0.5836
 epoch: 35, train_loss: 0.6357, test_loss: 1.0520, test_f1: 0.5922
 epoch: 36, train_loss: 0.6438, test_loss: 1.1233, test_f1: 0.6108
 epoch: 37, train_loss: 0.6488, test_loss: 0.9628, test_f1: 0.5903
 epoch: 38, train_loss: 0.6117, test_loss: 1.0409, test_f1: 0.5884
 epoch: 39, train_loss: 0.6387, test_loss: 1.2896, test_f1: 0.5412
 epoch: 40, train_loss: 0.6313, test_loss: 1.1152, test_f1: 0.5917
 epoch: 41, train_loss: 0.6011, test_loss: 0.9668, test_f1: 0.6095
 epoch: 42, train_loss: 0.6024, test_loss: 0.9401, test_f1: 0.6561
 epoch: 43, train_loss: 0.5833, test_loss: 1.1481, test_f1: 0.5675
 epoch: 44, train_loss: 0.5896, test_loss: 0.9847, test_f1: 0.6273
 epoch: 45, train_loss: 0.5844, test_loss: 1.6372, test_f1: 0.5473
 epoch: 46, train_loss: 0.5795, test_loss: 1.0179, test_f1: 0.6381
 epoch: 47, train_loss: 0.5773, test_loss: 1.1103, test_f1: 0.6153
 epoch: 48, train_loss: 0.5628, test_loss: 1.0510, test_f1: 0.6083
 epoch: 49, train_loss: 0.5674, test_loss: 0.9860, test_f1: 0.6370
 epoch: 50, train_loss: 0.5554, test_loss: 1.0792, test_f1: 0.6649
 epoch: 51, train_loss: 0.5284, test_loss: 1.0853, test_f1: 0.6310
 epoch: 52, train_loss: 0.5056, test_loss: 0.9926, test_f1: 0.6515
 epoch: 53, train_loss: 0.4865, test_loss: 1.0713, test_f1: 0.6327
 epoch: 54, train_loss: 0.4737, test_loss: 1.1678, test_f1: 0.6141
 epoch: 55, train_loss: 0.4756, test_loss: 1.0649, test_f1: 0.6534
 epoch: 56, train_loss: 0.4714, test_loss: 1.1436, test_f1: 0.6376
 epoch: 57, train_loss: 0.4602, test_loss: 1.1168, test_f1: 0.6482
 epoch: 58, train_loss: 0.4758, test_loss: 1.3009, test_f1: 0.6115
 epoch: 59, train_loss: 0.4684, test_loss: 1.0085, test_f1: 0.6831
 epoch: 60, train_loss: 0.4656, test_loss: 1.0905, test_f1: 0.6331
 epoch: 61, train_loss: 0.4724, test_loss: 1.0536, test_f1: 0.6475
 epoch: 62, train_loss: 0.4481, test_loss: 1.1334, test_f1: 0.6616
 epoch: 63, train_loss: 0.4487, test_loss: 1.0964, test_f1: 0.6444
 epoch: 64, train_loss: 0.4490, test_loss: 1.1064, test_f1: 0.6722
 epoch: 65, train_loss: 0.4628, test_loss: 1.1619, test_f1: 0.6524
 epoch: 66, train_loss: 0.4625, test_loss: 1.1085, test_f1: 0.6623
 epoch: 67, train_loss: 0.4331, test_loss: 1.1090, test_f1: 0.6516
 epoch: 68, train_loss: 0.4438, test_loss: 1.0991, test_f1: 0.6498
 epoch: 69, train_loss: 0.4427, test_loss: 1.2439, test_f1: 0.6434
 epoch: 70, train_loss: 0.4115, test_loss: 1.1686, test_f1: 0.6404
 epoch: 71, train_loss: 0.4237, test_loss: 1.2388, test_f1: 0.6625
 epoch: 72, train_loss: 0.4301, test_loss: 1.6870, test_f1: 0.6006
 epoch: 73, train_loss: 0.4292, test_loss: 1.0929, test_f1: 0.6903
 epoch: 74, train_loss: 0.4185, test_loss: 1.1158, test_f1: 0.6468
 epoch: 75, train_loss: 0.4211, test_loss: 1.1857, test_f1: 0.6526
 epoch: 76, train_loss: 0.4332, test_loss: 1.1710, test_f1: 0.6530
 epoch: 77, train_loss: 0.4168, test_loss: 1.2010, test_f1: 0.6476
 epoch: 78, train_loss: 0.4018, test_loss: 1.0928, test_f1: 0.6756
 epoch: 79, train_loss: 0.3894, test_loss: 1.2780, test_f1: 0.6622
 epoch: 80, train_loss: 0.3826, test_loss: 1.1987, test_f1: 0.6873
 epoch: 81, train_loss: 0.3732, test_loss: 1.3438, test_f1: 0.6381
 epoch: 82, train_loss: 0.3845, test_loss: 1.1274, test_f1: 0.6874
 epoch: 83, train_loss: 0.3849, test_loss: 1.1926, test_f1: 0.6416
 epoch: 84, train_loss: 0.3986, test_loss: 1.2349, test_f1: 0.6651
 epoch: 85, train_loss: 0.4129, test_loss: 1.2579, test_f1: 0.6394
 epoch: 86, train_loss: 0.3777, test_loss: 1.2452, test_f1: 0.6407
 epoch: 87, train_loss: 0.3528, test_loss: 1.3383, test_f1: 0.6317
 epoch: 88, train_loss: 0.3883, test_loss: 1.2229, test_f1: 0.6736
 epoch: 89, train_loss: 0.3698, test_loss: 1.4268, test_f1: 0.6553
 epoch: 90, train_loss: 0.3659, test_loss: 1.3883, test_f1: 0.6272
 epoch: 91, train_loss: 0.3624, test_loss: 1.1714, test_f1: 0.6569
 epoch: 92, train_loss: 0.3578, test_loss: 1.1985, test_f1: 0.6743
 epoch: 93, train_loss: 0.3537, test_loss: 1.2223, test_f1: 0.6587
 epoch: 94, train_loss: 0.3393, test_loss: 1.2001, test_f1: 0.6898
 epoch: 95, train_loss: 0.3506, test_loss: 1.4677, test_f1: 0.6139
 epoch: 96, train_loss: 0.3541, test_loss: 1.3978, test_f1: 0.6562
 epoch: 97, train_loss: 0.3643, test_loss: 1.3668, test_f1: 0.6308
 epoch: 98, train_loss: 0.3556, test_loss: 1.6154, test_f1: 0.6147
 epoch: 99, train_loss: 0.3523, test_loss: 1.2092, test_f1: 0.6597
##################ITERATION #9 ****************************************
 epoch: 0, train_loss: 1.7050, test_loss: 1.2922, test_f1: 0.3089
 epoch: 1, train_loss: 1.0644, test_loss: 1.1551, test_f1: 0.3772
 epoch: 2, train_loss: 0.9958, test_loss: 1.0339, test_f1: 0.4567
 epoch: 3, train_loss: 0.9575, test_loss: 1.0332, test_f1: 0.4607
 epoch: 4, train_loss: 0.9257, test_loss: 1.0043, test_f1: 0.4848
 epoch: 5, train_loss: 0.8921, test_loss: 0.9932, test_f1: 0.5238
 epoch: 6, train_loss: 0.8740, test_loss: 1.4140, test_f1: 0.3953
 epoch: 7, train_loss: 0.8601, test_loss: 1.0479, test_f1: 0.4886
 epoch: 8, train_loss: 0.8502, test_loss: 1.0638, test_f1: 0.5168
 epoch: 9, train_loss: 0.8233, test_loss: 1.0779, test_f1: 0.4919
 epoch: 10, train_loss: 0.8196, test_loss: 1.0584, test_f1: 0.4843
 epoch: 11, train_loss: 0.7881, test_loss: 1.0294, test_f1: 0.5251
 epoch: 12, train_loss: 0.7791, test_loss: 1.1194, test_f1: 0.4918
 epoch: 13, train_loss: 0.7893, test_loss: 0.9825, test_f1: 0.5318
 epoch: 14, train_loss: 0.7742, test_loss: 0.9355, test_f1: 0.5765
 epoch: 15, train_loss: 0.7568, test_loss: 1.0530, test_f1: 0.5108
 epoch: 16, train_loss: 0.7402, test_loss: 0.9604, test_f1: 0.5759
 epoch: 17, train_loss: 0.7260, test_loss: 0.9163, test_f1: 0.5334
 epoch: 18, train_loss: 0.7087, test_loss: 0.8185, test_f1: 0.6023
 epoch: 19, train_loss: 0.7275, test_loss: 1.0017, test_f1: 0.5463
 epoch: 20, train_loss: 0.7030, test_loss: 0.9811, test_f1: 0.5859
 epoch: 21, train_loss: 0.6906, test_loss: 0.9621, test_f1: 0.5972
 epoch: 22, train_loss: 0.7062, test_loss: 0.8057, test_f1: 0.5770
 epoch: 23, train_loss: 0.6925, test_loss: 0.8756, test_f1: 0.6074
 epoch: 24, train_loss: 0.6732, test_loss: 0.7753, test_f1: 0.6161
 epoch: 25, train_loss: 0.6675, test_loss: 0.8839, test_f1: 0.6092
 epoch: 26, train_loss: 0.6754, test_loss: 0.8771, test_f1: 0.6099
 epoch: 27, train_loss: 0.6214, test_loss: 0.8839, test_f1: 0.6150
 epoch: 28, train_loss: 0.6269, test_loss: 1.1256, test_f1: 0.5371
 epoch: 29, train_loss: 0.6354, test_loss: 0.9995, test_f1: 0.5996
 epoch: 30, train_loss: 0.6368, test_loss: 0.9116, test_f1: 0.6633
 epoch: 31, train_loss: 0.6212, test_loss: 1.0333, test_f1: 0.5501
 epoch: 32, train_loss: 0.6011, test_loss: 1.1882, test_f1: 0.5388
 epoch: 33, train_loss: 0.6189, test_loss: 1.0237, test_f1: 0.5554
 epoch: 34, train_loss: 0.6159, test_loss: 1.0108, test_f1: 0.5856
 epoch: 35, train_loss: 0.5845, test_loss: 0.9478, test_f1: 0.5847
 epoch: 36, train_loss: 0.5834, test_loss: 0.9330, test_f1: 0.6365
 epoch: 37, train_loss: 0.5790, test_loss: 0.8940, test_f1: 0.6365
 epoch: 38, train_loss: 0.5661, test_loss: 1.3594, test_f1: 0.5151
 epoch: 39, train_loss: 0.5994, test_loss: 1.1135, test_f1: 0.5557
 epoch: 40, train_loss: 0.5750, test_loss: 0.9014, test_f1: 0.6557
 epoch: 41, train_loss: 0.5677, test_loss: 0.9263, test_f1: 0.6281
 epoch: 42, train_loss: 0.5705, test_loss: 0.8502, test_f1: 0.6457
 epoch: 43, train_loss: 0.5658, test_loss: 1.0909, test_f1: 0.5837
 epoch: 44, train_loss: 0.5455, test_loss: 0.8883, test_f1: 0.6308
 epoch: 45, train_loss: 0.5305, test_loss: 0.9311, test_f1: 0.6454
 epoch: 46, train_loss: 0.5178, test_loss: 1.0211, test_f1: 0.6284
 epoch: 47, train_loss: 0.5245, test_loss: 0.9508, test_f1: 0.6323
 epoch: 48, train_loss: 0.5485, test_loss: 0.9979, test_f1: 0.6353
 epoch: 49, train_loss: 0.5388, test_loss: 0.9042, test_f1: 0.6202
 epoch: 50, train_loss: 0.5277, test_loss: 1.0338, test_f1: 0.6003
 epoch: 51, train_loss: 0.4783, test_loss: 0.9449, test_f1: 0.6468
 epoch: 52, train_loss: 0.4555, test_loss: 0.9730, test_f1: 0.6619
 epoch: 53, train_loss: 0.4474, test_loss: 0.9765, test_f1: 0.6382
 epoch: 54, train_loss: 0.4323, test_loss: 1.0405, test_f1: 0.6436
 epoch: 55, train_loss: 0.4104, test_loss: 1.0590, test_f1: 0.6505
 epoch: 56, train_loss: 0.4062, test_loss: 0.9397, test_f1: 0.6542
 epoch: 57, train_loss: 0.4215, test_loss: 0.9545, test_f1: 0.6562
 epoch: 58, train_loss: 0.4269, test_loss: 0.9978, test_f1: 0.6395
 epoch: 59, train_loss: 0.4078, test_loss: 0.9646, test_f1: 0.6599
 epoch: 60, train_loss: 0.3999, test_loss: 1.0657, test_f1: 0.6299
 epoch: 61, train_loss: 0.4007, test_loss: 1.0689, test_f1: 0.6523
 epoch: 62, train_loss: 0.3975, test_loss: 1.0150, test_f1: 0.6588
 epoch: 63, train_loss: 0.3933, test_loss: 0.9831, test_f1: 0.6605
 epoch: 64, train_loss: 0.4044, test_loss: 1.0608, test_f1: 0.6536
 epoch: 65, train_loss: 0.3931, test_loss: 1.1669, test_f1: 0.6232
 epoch: 66, train_loss: 0.3999, test_loss: 0.9666, test_f1: 0.6752
 epoch: 67, train_loss: 0.3895, test_loss: 1.2706, test_f1: 0.6078
 epoch: 68, train_loss: 0.3827, test_loss: 1.0437, test_f1: 0.6552
 epoch: 69, train_loss: 0.3891, test_loss: 1.0501, test_f1: 0.6696
 epoch: 70, train_loss: 0.3727, test_loss: 1.0304, test_f1: 0.6521
 epoch: 71, train_loss: 0.3561, test_loss: 1.0533, test_f1: 0.6665
 epoch: 72, train_loss: 0.3787, test_loss: 1.0142, test_f1: 0.6615
 epoch: 73, train_loss: 0.3852, test_loss: 0.9826, test_f1: 0.6761
 epoch: 74, train_loss: 0.3835, test_loss: 1.0907, test_f1: 0.6709
 epoch: 75, train_loss: 0.3452, test_loss: 1.1151, test_f1: 0.6825
 epoch: 76, train_loss: 0.3494, test_loss: 1.2026, test_f1: 0.6145
 epoch: 77, train_loss: 0.3454, test_loss: 1.0901, test_f1: 0.6685
 epoch: 78, train_loss: 0.3530, test_loss: 1.1036, test_f1: 0.6736
 epoch: 79, train_loss: 0.3532, test_loss: 1.2425, test_f1: 0.6531
 epoch: 80, train_loss: 0.3285, test_loss: 1.1137, test_f1: 0.6895
 epoch: 81, train_loss: 0.3210, test_loss: 1.2312, test_f1: 0.6646
 epoch: 82, train_loss: 0.3310, test_loss: 1.1361, test_f1: 0.6937
 epoch: 83, train_loss: 0.3211, test_loss: 1.2240, test_f1: 0.6656
 epoch: 84, train_loss: 0.3141, test_loss: 1.1570, test_f1: 0.6831
 epoch: 85, train_loss: 0.3291, test_loss: 1.0788, test_f1: 0.6764
 epoch: 86, train_loss: 0.3339, test_loss: 1.2596, test_f1: 0.6355
 epoch: 87, train_loss: 0.3518, test_loss: 1.0950, test_f1: 0.6849
 epoch: 88, train_loss: 0.3130, test_loss: 1.3271, test_f1: 0.6469
 epoch: 89, train_loss: 0.3101, test_loss: 1.1900, test_f1: 0.6392
 epoch: 90, train_loss: 0.3215, test_loss: 1.2941, test_f1: 0.6592
 epoch: 91, train_loss: 0.3152, test_loss: 1.2213, test_f1: 0.6726
 epoch: 92, train_loss: 0.3095, test_loss: 1.2365, test_f1: 0.6751
 epoch: 93, train_loss: 0.2943, test_loss: 1.2661, test_f1: 0.6726
 epoch: 94, train_loss: 0.3111, test_loss: 1.2034, test_f1: 0.6707
 epoch: 95, train_loss: 0.3046, test_loss: 1.3852, test_f1: 0.6470
 epoch: 96, train_loss: 0.3462, test_loss: 1.0872, test_f1: 0.6384
 epoch: 97, train_loss: 0.3550, test_loss: 1.1318, test_f1: 0.6534
 epoch: 98, train_loss: 0.3201, test_loss: 1.1654, test_f1: 0.6591
 epoch: 99, train_loss: 0.2939, test_loss: 1.2290, test_f1: 0.6799

Training completed in 420.11 seconds
Best F1: 0.6982 at epoch 92
Mean F1 across iterations: 0.6865  0.0090
========================FINAL RESULTS================================
FEGIN weighted F1: 0.6982  0.0090
python main.py --data ltspice_examples --representation component_pin --model FEGIN --layers 3 --hiddens 64 --batch_size 256 --lr 0.01 --emb_size 250 --epochs 100 --save_appendix component_pin_L3_H64_BS256_LR0.01_E250 --no_val
-----



STDERR:
  File "main.py", line 370, in <module>
    main()
  File "main.py", line 254, in main
    dataset = dataset_class(
  File "/home/philip/projects/ltspice_examples_code_repo/Circuit-Completion-Using-GNNs/component_classification_with_link_prediction_head/evaluation/FEGIN/kernel/circuit_datasets.py", line 15, in __init__
    self.data, self.slices = torch.load(self.processed_paths[0])
  File "/home/philip/.local/lib/python3.8/site-packages/torch/serialization.py", line 1040, in load
    warnings.warn(
  File "/usr/lib/python3.8/warnings.py", line 109, in _showwarnmsg
    sw(msg.message, msg.category, msg.filename, msg.lineno,
  File "main.py", line 47, in warn_with_traceback
    traceback.print_stack(file=log)
/home/philip/projects/ltspice_examples_code_repo/Circuit-Completion-Using-GNNs/component_classification_with_link_prediction_head/evaluation/FEGIN/kernel/circuit_datasets.py:15: FutureWarning: You are using `torch.load` with `weights_only=False` (the current default value), which uses the default pickle module implicitly. It is possible to construct malicious pickle data which will execute arbitrary code during unpickling (See https://github.com/pytorch/pytorch/blob/main/SECURITY.md#untrusted-models for more details). In a future release, the default value for `weights_only` will be flipped to `True`. This limits the functions that could be executed during unpickling. Arbitrary objects will no longer be allowed to be loaded via this mode unless they are explicitly allowlisted by the user via `torch.serialization.add_safe_globals`. We recommend you start setting `weights_only=True` for any use case where you don't have full control of the loaded file. Please open an issue on GitHub for any issues related to this experimental feature.
  self.data, self.slices = torch.load(self.processed_paths[0])
