STDOUT:
Results will be saved in /home/philip/projects/ltspice_examples_code_repo/Circuit-Completion-Using-GNNs/component_classification_with_link_prediction_head/evaluation/FEGIN/results/model_FEGIN_dataset_ltspice_demos
Command line input: python main.py --data ltspice_demos --representation component_pin --model FEGIN --layers 3 --hiddens 64 --batch_size 128 --lr 0.01 --emb_size 250 --epochs 100 --save_appendix component_pin_L3_H64_BS128_LR0.01_E250 --no_val
 is saved.
-----
ltspice_demos - FEGIN
Using 3 layers, 64 hidden units, h = 2
Loading component_pin representation dataset
ENTERED
Training FEGIN on component_pin representation
Train: 1565, Test: 383
##################ITERATION #0 ****************************************
 epoch: 0, train_loss: 1.2440, test_loss: 1.3229, test_f1: 0.2910
 epoch: 1, train_loss: 1.1442, test_loss: 1.3536, test_f1: 0.3319
 epoch: 2, train_loss: 1.0628, test_loss: 1.3488, test_f1: 0.3409
 epoch: 3, train_loss: 0.9677, test_loss: 1.4041, test_f1: 0.2245
 epoch: 4, train_loss: 0.8978, test_loss: 1.1236, test_f1: 0.4634
 epoch: 5, train_loss: 0.8634, test_loss: 1.0968, test_f1: 0.4595
 epoch: 6, train_loss: 0.8425, test_loss: 1.0537, test_f1: 0.5814
 epoch: 7, train_loss: 0.8145, test_loss: 0.9241, test_f1: 0.5801
 epoch: 8, train_loss: 0.7979, test_loss: 1.8312, test_f1: 0.3237
 epoch: 9, train_loss: 0.7783, test_loss: 1.1556, test_f1: 0.5244
 epoch: 10, train_loss: 0.7391, test_loss: 1.2815, test_f1: 0.5313
 epoch: 11, train_loss: 0.7272, test_loss: 0.9765, test_f1: 0.6457
 epoch: 12, train_loss: 0.7354, test_loss: 1.3731, test_f1: 0.5554
 epoch: 13, train_loss: 0.7417, test_loss: 0.9202, test_f1: 0.5216
 epoch: 14, train_loss: 0.7267, test_loss: 2.4986, test_f1: 0.3781
 epoch: 15, train_loss: 0.7247, test_loss: 1.2675, test_f1: 0.4494
 epoch: 16, train_loss: 0.6928, test_loss: 1.0741, test_f1: 0.5741
 epoch: 17, train_loss: 0.6649, test_loss: 1.0238, test_f1: 0.5523
 epoch: 18, train_loss: 0.6564, test_loss: 1.0916, test_f1: 0.5832
 epoch: 19, train_loss: 0.6880, test_loss: 2.5277, test_f1: 0.3570
 epoch: 20, train_loss: 0.6415, test_loss: 0.9880, test_f1: 0.6256
 epoch: 21, train_loss: 0.6894, test_loss: 0.9778, test_f1: 0.5865
 epoch: 22, train_loss: 0.6595, test_loss: 0.9514, test_f1: 0.6064
 epoch: 23, train_loss: 0.6304, test_loss: 1.2888, test_f1: 0.5203
 epoch: 24, train_loss: 0.6071, test_loss: 1.3357, test_f1: 0.5643
 epoch: 25, train_loss: 0.6141, test_loss: 0.9264, test_f1: 0.6263
 epoch: 26, train_loss: 0.5902, test_loss: 1.2441, test_f1: 0.5731
 epoch: 27, train_loss: 0.5789, test_loss: 1.2295, test_f1: 0.5273
 epoch: 28, train_loss: 0.5934, test_loss: 0.8751, test_f1: 0.6507
 epoch: 29, train_loss: 0.5699, test_loss: 1.1906, test_f1: 0.5338
 epoch: 30, train_loss: 0.5580, test_loss: 1.2162, test_f1: 0.6237
 epoch: 31, train_loss: 0.5757, test_loss: 1.1345, test_f1: 0.6152
 epoch: 32, train_loss: 0.5973, test_loss: 1.3009, test_f1: 0.5970
 epoch: 33, train_loss: 0.5758, test_loss: 1.6097, test_f1: 0.5318
 epoch: 34, train_loss: 0.5847, test_loss: 1.2430, test_f1: 0.5597
 epoch: 35, train_loss: 0.6031, test_loss: 1.3711, test_f1: 0.6154
 epoch: 36, train_loss: 0.5892, test_loss: 1.3846, test_f1: 0.5038
 epoch: 37, train_loss: 0.5610, test_loss: 1.4707, test_f1: 0.5719
 epoch: 38, train_loss: 0.5497, test_loss: 1.2161, test_f1: 0.6035
 epoch: 39, train_loss: 0.5400, test_loss: 1.2354, test_f1: 0.6102
 epoch: 40, train_loss: 0.5056, test_loss: 1.1009, test_f1: 0.6359
 epoch: 41, train_loss: 0.5011, test_loss: 1.2220, test_f1: 0.5837
 epoch: 42, train_loss: 0.5288, test_loss: 1.4092, test_f1: 0.5613
 epoch: 43, train_loss: 0.5380, test_loss: 1.2755, test_f1: 0.6005
 epoch: 44, train_loss: 0.4973, test_loss: 1.2451, test_f1: 0.5519
 epoch: 45, train_loss: 0.4873, test_loss: 1.3354, test_f1: 0.5822
 epoch: 46, train_loss: 0.4682, test_loss: 1.1908, test_f1: 0.6507
 epoch: 47, train_loss: 0.4491, test_loss: 1.2347, test_f1: 0.6076
 epoch: 48, train_loss: 0.4856, test_loss: 1.3078, test_f1: 0.5058
 epoch: 49, train_loss: 0.4678, test_loss: 1.3845, test_f1: 0.6027
 epoch: 50, train_loss: 0.4587, test_loss: 1.2001, test_f1: 0.6400
 epoch: 51, train_loss: 0.4328, test_loss: 1.4395, test_f1: 0.6316
 epoch: 52, train_loss: 0.3848, test_loss: 1.5684, test_f1: 0.6169
 epoch: 53, train_loss: 0.3820, test_loss: 1.4657, test_f1: 0.6057
 epoch: 54, train_loss: 0.3988, test_loss: 1.5020, test_f1: 0.5946
 epoch: 55, train_loss: 0.3555, test_loss: 1.5370, test_f1: 0.6150
 epoch: 56, train_loss: 0.3277, test_loss: 1.5378, test_f1: 0.6296
 epoch: 57, train_loss: 0.3313, test_loss: 1.6370, test_f1: 0.6377
 epoch: 58, train_loss: 0.3224, test_loss: 1.7339, test_f1: 0.6236
 epoch: 59, train_loss: 0.3345, test_loss: 2.1032, test_f1: 0.5228
 epoch: 60, train_loss: 0.3146, test_loss: 1.7601, test_f1: 0.5917
 epoch: 61, train_loss: 0.3313, test_loss: 1.9224, test_f1: 0.6028
 epoch: 62, train_loss: 0.2848, test_loss: 2.4736, test_f1: 0.6124
 epoch: 63, train_loss: 0.3344, test_loss: 1.3668, test_f1: 0.6366
 epoch: 64, train_loss: 0.3270, test_loss: 1.9002, test_f1: 0.6127
 epoch: 65, train_loss: 0.3175, test_loss: 2.1738, test_f1: 0.6184
 epoch: 66, train_loss: 0.3268, test_loss: 1.8748, test_f1: 0.6199
 epoch: 67, train_loss: 0.2944, test_loss: 1.7856, test_f1: 0.6052
 epoch: 68, train_loss: 0.2792, test_loss: 2.0644, test_f1: 0.6250
 epoch: 69, train_loss: 0.2715, test_loss: 2.1936, test_f1: 0.6432
 epoch: 70, train_loss: 0.2845, test_loss: 2.2230, test_f1: 0.6005
 epoch: 71, train_loss: 0.2889, test_loss: 2.0653, test_f1: 0.6083
 epoch: 72, train_loss: 0.3275, test_loss: 1.7772, test_f1: 0.6322
 epoch: 73, train_loss: 0.2703, test_loss: 1.6498, test_f1: 0.6179
 epoch: 74, train_loss: 0.2430, test_loss: 1.9867, test_f1: 0.6139
 epoch: 75, train_loss: 0.2089, test_loss: 2.5340, test_f1: 0.6214
 epoch: 76, train_loss: 0.2119, test_loss: 2.1845, test_f1: 0.6429
 epoch: 77, train_loss: 0.2559, test_loss: 2.0052, test_f1: 0.6247
 epoch: 78, train_loss: 0.2274, test_loss: 2.0019, test_f1: 0.6049
 epoch: 79, train_loss: 0.2994, test_loss: 2.1456, test_f1: 0.5993
 epoch: 80, train_loss: 0.2865, test_loss: 2.0426, test_f1: 0.6485
 epoch: 81, train_loss: 0.2550, test_loss: 2.1846, test_f1: 0.6155
 epoch: 82, train_loss: 0.2315, test_loss: 2.0500, test_f1: 0.6422
 epoch: 83, train_loss: 0.2022, test_loss: 2.6811, test_f1: 0.6163
 epoch: 84, train_loss: 0.2419, test_loss: 2.1387, test_f1: 0.6240
 epoch: 85, train_loss: 0.2539, test_loss: 1.9530, test_f1: 0.6567
 epoch: 86, train_loss: 0.2244, test_loss: 2.2527, test_f1: 0.6174
 epoch: 87, train_loss: 0.2366, test_loss: 2.8240, test_f1: 0.5901
 epoch: 88, train_loss: 0.2411, test_loss: 2.5230, test_f1: 0.5947
 epoch: 89, train_loss: 0.2609, test_loss: 2.3024, test_f1: 0.6473
 epoch: 90, train_loss: 0.2625, test_loss: 2.8208, test_f1: 0.5843
 epoch: 91, train_loss: 0.3566, test_loss: 2.1939, test_f1: 0.5886
 epoch: 92, train_loss: 0.3322, test_loss: 1.7964, test_f1: 0.6292
 epoch: 93, train_loss: 0.2743, test_loss: 1.8467, test_f1: 0.6278
 epoch: 94, train_loss: 0.2177, test_loss: 2.0511, test_f1: 0.6216
 epoch: 95, train_loss: 0.2088, test_loss: 2.3994, test_f1: 0.5988
 epoch: 96, train_loss: 0.1974, test_loss: 2.5059, test_f1: 0.6140
 epoch: 97, train_loss: 0.1728, test_loss: 2.5949, test_f1: 0.6327
 epoch: 98, train_loss: 0.2420, test_loss: 2.5325, test_f1: 0.6541
 epoch: 99, train_loss: 0.2141, test_loss: 2.4339, test_f1: 0.6182
##################ITERATION #1 ****************************************
 epoch: 0, train_loss: 1.1776, test_loss: 1.4899, test_f1: 0.2425
 epoch: 1, train_loss: 0.9758, test_loss: 1.6435, test_f1: 0.2703
 epoch: 2, train_loss: 0.9297, test_loss: 1.0765, test_f1: 0.5432
 epoch: 3, train_loss: 0.8815, test_loss: 1.0866, test_f1: 0.4212
 epoch: 4, train_loss: 0.8440, test_loss: 1.7950, test_f1: 0.3962
 epoch: 5, train_loss: 0.8251, test_loss: 1.2988, test_f1: 0.4101
 epoch: 6, train_loss: 0.8549, test_loss: 1.0025, test_f1: 0.5649
 epoch: 7, train_loss: 0.7959, test_loss: 0.9698, test_f1: 0.5469
 epoch: 8, train_loss: 0.8029, test_loss: 1.0386, test_f1: 0.5382
 epoch: 9, train_loss: 0.7856, test_loss: 1.0566, test_f1: 0.5830
 epoch: 10, train_loss: 0.7600, test_loss: 1.3046, test_f1: 0.5102
 epoch: 11, train_loss: 0.7692, test_loss: 1.2994, test_f1: 0.3904
 epoch: 12, train_loss: 0.7508, test_loss: 1.0177, test_f1: 0.5063
 epoch: 13, train_loss: 0.7509, test_loss: 1.3880, test_f1: 0.5155
 epoch: 14, train_loss: 0.7066, test_loss: 1.0634, test_f1: 0.5224
 epoch: 15, train_loss: 0.7224, test_loss: 0.9422, test_f1: 0.5950
 epoch: 16, train_loss: 0.7139, test_loss: 0.9443, test_f1: 0.6137
 epoch: 17, train_loss: 0.6801, test_loss: 1.0224, test_f1: 0.6319
 epoch: 18, train_loss: 0.6659, test_loss: 0.9647, test_f1: 0.5243
 epoch: 19, train_loss: 0.6910, test_loss: 1.1877, test_f1: 0.5423
 epoch: 20, train_loss: 0.6662, test_loss: 1.0547, test_f1: 0.5995
 epoch: 21, train_loss: 0.6288, test_loss: 1.1584, test_f1: 0.5918
 epoch: 22, train_loss: 0.6369, test_loss: 1.1919, test_f1: 0.5329
 epoch: 23, train_loss: 0.6301, test_loss: 1.0424, test_f1: 0.6258
 epoch: 24, train_loss: 0.6235, test_loss: 2.0223, test_f1: 0.4133
 epoch: 25, train_loss: 0.6092, test_loss: 1.5572, test_f1: 0.5503
 epoch: 26, train_loss: 0.6179, test_loss: 1.0218, test_f1: 0.6087
 epoch: 27, train_loss: 0.6179, test_loss: 1.1545, test_f1: 0.5058
 epoch: 28, train_loss: 0.6217, test_loss: 1.6645, test_f1: 0.5071
 epoch: 29, train_loss: 0.6460, test_loss: 1.1932, test_f1: 0.5775
 epoch: 30, train_loss: 0.5930, test_loss: 0.9991, test_f1: 0.5838
 epoch: 31, train_loss: 0.5733, test_loss: 1.1335, test_f1: 0.6321
 epoch: 32, train_loss: 0.5704, test_loss: 1.1559, test_f1: 0.5919
 epoch: 33, train_loss: 0.5296, test_loss: 1.4523, test_f1: 0.5460
 epoch: 34, train_loss: 0.6008, test_loss: 1.1496, test_f1: 0.6230
 epoch: 35, train_loss: 0.5700, test_loss: 1.0070, test_f1: 0.5943
 epoch: 36, train_loss: 0.5536, test_loss: 1.1641, test_f1: 0.5925
 epoch: 37, train_loss: 0.5813, test_loss: 1.3122, test_f1: 0.4970
 epoch: 38, train_loss: 0.6103, test_loss: 1.2378, test_f1: 0.5396
 epoch: 39, train_loss: 0.5687, test_loss: 1.1128, test_f1: 0.5972
 epoch: 40, train_loss: 0.5967, test_loss: 1.1660, test_f1: 0.5666
 epoch: 41, train_loss: 0.5704, test_loss: 0.9481, test_f1: 0.6264
 epoch: 42, train_loss: 0.5253, test_loss: 1.1856, test_f1: 0.6169
 epoch: 43, train_loss: 0.5511, test_loss: 0.9956, test_f1: 0.5812
 epoch: 44, train_loss: 0.5201, test_loss: 1.3241, test_f1: 0.5596
 epoch: 45, train_loss: 0.5386, test_loss: 1.3943, test_f1: 0.6022
 epoch: 46, train_loss: 0.5562, test_loss: 1.0276, test_f1: 0.6591
 epoch: 47, train_loss: 0.5431, test_loss: 1.0998, test_f1: 0.6175
 epoch: 48, train_loss: 0.4849, test_loss: 1.0509, test_f1: 0.6123
 epoch: 49, train_loss: 0.5140, test_loss: 1.1585, test_f1: 0.6209
 epoch: 50, train_loss: 0.4876, test_loss: 1.1196, test_f1: 0.5209
 epoch: 51, train_loss: 0.4466, test_loss: 1.1888, test_f1: 0.6033
 epoch: 52, train_loss: 0.4489, test_loss: 1.2081, test_f1: 0.6386
 epoch: 53, train_loss: 0.4470, test_loss: 1.2243, test_f1: 0.6084
 epoch: 54, train_loss: 0.4182, test_loss: 1.2125, test_f1: 0.6115
 epoch: 55, train_loss: 0.4000, test_loss: 1.2132, test_f1: 0.6437
 epoch: 56, train_loss: 0.4302, test_loss: 1.1756, test_f1: 0.6426
 epoch: 57, train_loss: 0.3715, test_loss: 1.3574, test_f1: 0.5962
 epoch: 58, train_loss: 0.3971, test_loss: 1.2874, test_f1: 0.6048
 epoch: 59, train_loss: 0.4295, test_loss: 1.1925, test_f1: 0.6353
 epoch: 60, train_loss: 0.3959, test_loss: 1.3721, test_f1: 0.5994
 epoch: 61, train_loss: 0.3958, test_loss: 1.3153, test_f1: 0.6619
 epoch: 62, train_loss: 0.3860, test_loss: 1.2798, test_f1: 0.6100
 epoch: 63, train_loss: 0.3912, test_loss: 1.2463, test_f1: 0.6132
 epoch: 64, train_loss: 0.3715, test_loss: 1.1791, test_f1: 0.6126
 epoch: 65, train_loss: 0.3661, test_loss: 1.2661, test_f1: 0.6138
 epoch: 66, train_loss: 0.3612, test_loss: 1.4148, test_f1: 0.6147
 epoch: 67, train_loss: 0.3417, test_loss: 1.3790, test_f1: 0.6136
 epoch: 68, train_loss: 0.3336, test_loss: 1.3668, test_f1: 0.6048
 epoch: 69, train_loss: 0.3473, test_loss: 1.4262, test_f1: 0.6097
 epoch: 70, train_loss: 0.3494, test_loss: 1.3378, test_f1: 0.6322
 epoch: 71, train_loss: 0.3711, test_loss: 1.3196, test_f1: 0.6561
 epoch: 72, train_loss: 0.3256, test_loss: 1.5137, test_f1: 0.6254
 epoch: 73, train_loss: 0.3218, test_loss: 1.3371, test_f1: 0.6282
 epoch: 74, train_loss: 0.3217, test_loss: 1.4602, test_f1: 0.6231
 epoch: 75, train_loss: 0.3529, test_loss: 1.4138, test_f1: 0.6383
 epoch: 76, train_loss: 0.3258, test_loss: 1.5338, test_f1: 0.6090
 epoch: 77, train_loss: 0.3373, test_loss: 1.4413, test_f1: 0.6274
 epoch: 78, train_loss: 0.3564, test_loss: 1.4354, test_f1: 0.6323
 epoch: 79, train_loss: 0.2970, test_loss: 1.4569, test_f1: 0.6357
 epoch: 80, train_loss: 0.3074, test_loss: 1.7148, test_f1: 0.6161
 epoch: 81, train_loss: 0.3138, test_loss: 1.5874, test_f1: 0.6077
 epoch: 82, train_loss: 0.2985, test_loss: 1.7222, test_f1: 0.5686
 epoch: 83, train_loss: 0.3205, test_loss: 1.6115, test_f1: 0.5934
 epoch: 84, train_loss: 0.3275, test_loss: 1.4662, test_f1: 0.6216
 epoch: 85, train_loss: 0.3071, test_loss: 1.3585, test_f1: 0.6132
 epoch: 86, train_loss: 0.3132, test_loss: 1.5150, test_f1: 0.6384
 epoch: 87, train_loss: 0.3105, test_loss: 1.3860, test_f1: 0.6475
 epoch: 88, train_loss: 0.3224, test_loss: 1.5481, test_f1: 0.6202
 epoch: 89, train_loss: 0.3077, test_loss: 1.6327, test_f1: 0.6131
 epoch: 90, train_loss: 0.2898, test_loss: 1.6157, test_f1: 0.5989
 epoch: 91, train_loss: 0.2808, test_loss: 1.7566, test_f1: 0.5836
 epoch: 92, train_loss: 0.2947, test_loss: 1.5397, test_f1: 0.6467
 epoch: 93, train_loss: 0.3908, test_loss: 2.2512, test_f1: 0.5989
 epoch: 94, train_loss: 0.3783, test_loss: 1.7456, test_f1: 0.5679
 epoch: 95, train_loss: 0.4275, test_loss: 3.0606, test_f1: 0.3418
 epoch: 96, train_loss: 0.4100, test_loss: 1.5825, test_f1: 0.4930
 epoch: 97, train_loss: 0.3403, test_loss: 1.2363, test_f1: 0.6163
 epoch: 98, train_loss: 0.3688, test_loss: 1.2933, test_f1: 0.5974
 epoch: 99, train_loss: 0.2925, test_loss: 1.3622, test_f1: 0.6534
##################ITERATION #2 ****************************************
 epoch: 0, train_loss: 1.2988, test_loss: 1.5924, test_f1: 0.3290
 epoch: 1, train_loss: 0.9800, test_loss: 1.3051, test_f1: 0.3203
 epoch: 2, train_loss: 0.9525, test_loss: 1.1773, test_f1: 0.4809
 epoch: 3, train_loss: 0.9046, test_loss: 1.1649, test_f1: 0.4383
 epoch: 4, train_loss: 0.8475, test_loss: 1.0422, test_f1: 0.5487
 epoch: 5, train_loss: 0.8099, test_loss: 1.1474, test_f1: 0.4403
 epoch: 6, train_loss: 0.8199, test_loss: 0.9454, test_f1: 0.6128
 epoch: 7, train_loss: 0.8175, test_loss: 1.1074, test_f1: 0.5008
 epoch: 8, train_loss: 0.7770, test_loss: 1.1274, test_f1: 0.6291
 epoch: 9, train_loss: 0.7869, test_loss: 1.0677, test_f1: 0.6072
 epoch: 10, train_loss: 0.7786, test_loss: 1.0961, test_f1: 0.5660
 epoch: 11, train_loss: 0.7552, test_loss: 1.1428, test_f1: 0.4964
 epoch: 12, train_loss: 0.7423, test_loss: 1.8480, test_f1: 0.4223
 epoch: 13, train_loss: 0.7426, test_loss: 1.6581, test_f1: 0.5382
 epoch: 14, train_loss: 0.7095, test_loss: 7.6726, test_f1: 0.5697
 epoch: 15, train_loss: 0.6978, test_loss: 1.3560, test_f1: 0.5165
 epoch: 16, train_loss: 0.7308, test_loss: 2.7456, test_f1: 0.3797
 epoch: 17, train_loss: 0.6836, test_loss: 1.5017, test_f1: 0.5315
 epoch: 18, train_loss: 0.6708, test_loss: 1.2938, test_f1: 0.5825
 epoch: 19, train_loss: 0.6789, test_loss: 1.0599, test_f1: 0.5657
 epoch: 20, train_loss: 0.6640, test_loss: 0.9448, test_f1: 0.5251
 epoch: 21, train_loss: 0.6537, test_loss: 1.8009, test_f1: 0.5003
 epoch: 22, train_loss: 0.7164, test_loss: 1.0119, test_f1: 0.6129
 epoch: 23, train_loss: 0.7208, test_loss: 1.4178, test_f1: 0.5128
 epoch: 24, train_loss: 0.6695, test_loss: 0.9971, test_f1: 0.5952
 epoch: 25, train_loss: 0.6558, test_loss: 1.6161, test_f1: 0.5453
 epoch: 26, train_loss: 0.6444, test_loss: 1.0045, test_f1: 0.6267
 epoch: 27, train_loss: 0.6530, test_loss: 1.1526, test_f1: 0.5075
 epoch: 28, train_loss: 0.6253, test_loss: 1.7308, test_f1: 0.4632
 epoch: 29, train_loss: 0.6477, test_loss: 1.1568, test_f1: 0.5067
 epoch: 30, train_loss: 0.6405, test_loss: 1.1376, test_f1: 0.5474
 epoch: 31, train_loss: 0.5984, test_loss: 1.3927, test_f1: 0.5496
 epoch: 32, train_loss: 0.5806, test_loss: 1.1208, test_f1: 0.6071
 epoch: 33, train_loss: 0.5846, test_loss: 1.2047, test_f1: 0.5617
 epoch: 34, train_loss: 0.5813, test_loss: 1.0638, test_f1: 0.5865
 epoch: 35, train_loss: 0.5792, test_loss: 1.4783, test_f1: 0.6204
 epoch: 36, train_loss: 0.5680, test_loss: 1.3083, test_f1: 0.6197
 epoch: 37, train_loss: 0.5808, test_loss: 1.3604, test_f1: 0.5416
 epoch: 38, train_loss: 0.5877, test_loss: 1.7641, test_f1: 0.5708
 epoch: 39, train_loss: 0.5701, test_loss: 1.0544, test_f1: 0.6749
 epoch: 40, train_loss: 0.6132, test_loss: 1.5310, test_f1: 0.6188
 epoch: 41, train_loss: 0.5669, test_loss: 1.5908, test_f1: 0.5806
 epoch: 42, train_loss: 0.5230, test_loss: 1.3600, test_f1: 0.6568
 epoch: 43, train_loss: 0.5228, test_loss: 1.2042, test_f1: 0.6401
 epoch: 44, train_loss: 0.5345, test_loss: 1.1227, test_f1: 0.5687
 epoch: 45, train_loss: 0.5365, test_loss: 0.9778, test_f1: 0.6315
 epoch: 46, train_loss: 0.5168, test_loss: 1.4807, test_f1: 0.6419
 epoch: 47, train_loss: 0.5198, test_loss: 1.2092, test_f1: 0.6028
 epoch: 48, train_loss: 0.5776, test_loss: 1.2506, test_f1: 0.5758
 epoch: 49, train_loss: 0.5361, test_loss: 1.1608, test_f1: 0.5983
 epoch: 50, train_loss: 0.5252, test_loss: 1.4464, test_f1: 0.6498
 epoch: 51, train_loss: 0.4854, test_loss: 1.4224, test_f1: 0.6287
 epoch: 52, train_loss: 0.4628, test_loss: 1.1950, test_f1: 0.6455
 epoch: 53, train_loss: 0.4515, test_loss: 1.5111, test_f1: 0.5822
 epoch: 54, train_loss: 0.4433, test_loss: 1.7259, test_f1: 0.5956
 epoch: 55, train_loss: 0.4235, test_loss: 1.4071, test_f1: 0.5958
 epoch: 56, train_loss: 0.4184, test_loss: 1.5506, test_f1: 0.6277
 epoch: 57, train_loss: 0.3943, test_loss: 1.6048, test_f1: 0.6080
 epoch: 58, train_loss: 0.3771, test_loss: 1.6178, test_f1: 0.6163
 epoch: 59, train_loss: 0.3729, test_loss: 1.5302, test_f1: 0.6123
 epoch: 60, train_loss: 0.3694, test_loss: 1.4723, test_f1: 0.6101
 epoch: 61, train_loss: 0.3373, test_loss: 1.8459, test_f1: 0.6062
 epoch: 62, train_loss: 0.3493, test_loss: 1.8916, test_f1: 0.5881
 epoch: 63, train_loss: 0.3452, test_loss: 1.8333, test_f1: 0.6273
 epoch: 64, train_loss: 0.3663, test_loss: 1.6874, test_f1: 0.5945
 epoch: 65, train_loss: 0.3653, test_loss: 1.7510, test_f1: 0.6424
 epoch: 66, train_loss: 0.3613, test_loss: 1.5585, test_f1: 0.6497
 epoch: 67, train_loss: 0.3681, test_loss: 1.6808, test_f1: 0.6107
 epoch: 68, train_loss: 0.3472, test_loss: 1.5912, test_f1: 0.6119
 epoch: 69, train_loss: 0.3368, test_loss: 2.1404, test_f1: 0.6147
 epoch: 70, train_loss: 0.3403, test_loss: 1.7343, test_f1: 0.5993
 epoch: 71, train_loss: 0.3275, test_loss: 1.7566, test_f1: 0.6272
 epoch: 72, train_loss: 0.3196, test_loss: 2.4874, test_f1: 0.6012
 epoch: 73, train_loss: 0.3409, test_loss: 2.0452, test_f1: 0.5971
 epoch: 74, train_loss: 0.3511, test_loss: 2.0750, test_f1: 0.5831
 epoch: 75, train_loss: 0.3508, test_loss: 1.6420, test_f1: 0.6197
 epoch: 76, train_loss: 0.3459, test_loss: 1.9227, test_f1: 0.6046
 epoch: 77, train_loss: 0.3254, test_loss: 1.7792, test_f1: 0.6131
 epoch: 78, train_loss: 0.3702, test_loss: 2.1141, test_f1: 0.6187
 epoch: 79, train_loss: 0.3749, test_loss: 2.1632, test_f1: 0.6025
 epoch: 80, train_loss: 0.3311, test_loss: 2.0266, test_f1: 0.6311
 epoch: 81, train_loss: 0.3412, test_loss: 2.2527, test_f1: 0.5992
 epoch: 82, train_loss: 0.3001, test_loss: 2.2494, test_f1: 0.6004
 epoch: 83, train_loss: 0.3676, test_loss: 1.6844, test_f1: 0.6109
 epoch: 84, train_loss: 0.3910, test_loss: 1.7975, test_f1: 0.6441
 epoch: 85, train_loss: 0.3370, test_loss: 1.5381, test_f1: 0.6410
 epoch: 86, train_loss: 0.3152, test_loss: 2.1805, test_f1: 0.6106
 epoch: 87, train_loss: 0.3457, test_loss: 2.2150, test_f1: 0.6630
 epoch: 88, train_loss: 0.3418, test_loss: 1.7149, test_f1: 0.6224
 epoch: 89, train_loss: 0.3026, test_loss: 2.0858, test_f1: 0.6291
 epoch: 90, train_loss: 0.2678, test_loss: 1.5614, test_f1: 0.6375
 epoch: 91, train_loss: 0.3035, test_loss: 1.8902, test_f1: 0.6151
 epoch: 92, train_loss: 0.2736, test_loss: 1.8752, test_f1: 0.6045
 epoch: 93, train_loss: 0.2826, test_loss: 2.1123, test_f1: 0.6200
 epoch: 94, train_loss: 0.2518, test_loss: 2.1300, test_f1: 0.6392
 epoch: 95, train_loss: 0.2730, test_loss: 2.4216, test_f1: 0.6008
 epoch: 96, train_loss: 0.2894, test_loss: 1.8764, test_f1: 0.5964
 epoch: 97, train_loss: 0.2916, test_loss: 2.2636, test_f1: 0.6476
 epoch: 98, train_loss: 0.2585, test_loss: 2.5849, test_f1: 0.5972
 epoch: 99, train_loss: 0.2627, test_loss: 2.2318, test_f1: 0.6325
##################ITERATION #3 ****************************************
 epoch: 0, train_loss: 1.3550, test_loss: 1.4939, test_f1: 0.3308
 epoch: 1, train_loss: 1.0266, test_loss: 1.1323, test_f1: 0.4305
 epoch: 2, train_loss: 0.9639, test_loss: 1.3040, test_f1: 0.4468
 epoch: 3, train_loss: 0.9143, test_loss: 1.0776, test_f1: 0.4943
 epoch: 4, train_loss: 0.8856, test_loss: 1.1751, test_f1: 0.5372
 epoch: 5, train_loss: 0.8507, test_loss: 1.0031, test_f1: 0.5014
 epoch: 6, train_loss: 0.8458, test_loss: 2.7595, test_f1: 0.3985
 epoch: 7, train_loss: 0.8148, test_loss: 1.2650, test_f1: 0.4623
 epoch: 8, train_loss: 0.7907, test_loss: 1.0049, test_f1: 0.5892
 epoch: 9, train_loss: 0.7624, test_loss: 1.3320, test_f1: 0.5073
 epoch: 10, train_loss: 0.7623, test_loss: 1.5293, test_f1: 0.4728
 epoch: 11, train_loss: 0.7557, test_loss: 2.7035, test_f1: 0.4262
 epoch: 12, train_loss: 0.7758, test_loss: 0.9962, test_f1: 0.5841
 epoch: 13, train_loss: 0.7653, test_loss: 1.0024, test_f1: 0.5475
 epoch: 14, train_loss: 0.7508, test_loss: 1.1717, test_f1: 0.5835
 epoch: 15, train_loss: 0.7261, test_loss: 1.0197, test_f1: 0.5316
 epoch: 16, train_loss: 0.7161, test_loss: 1.2495, test_f1: 0.4124
 epoch: 17, train_loss: 0.7184, test_loss: 1.0704, test_f1: 0.6011
 epoch: 18, train_loss: 0.6964, test_loss: 1.1156, test_f1: 0.5616
 epoch: 19, train_loss: 0.7170, test_loss: 1.1543, test_f1: 0.6042
 epoch: 20, train_loss: 0.6739, test_loss: 1.0683, test_f1: 0.5971
 epoch: 21, train_loss: 0.6989, test_loss: 1.2460, test_f1: 0.5896
 epoch: 22, train_loss: 0.6837, test_loss: 1.2830, test_f1: 0.5182
 epoch: 23, train_loss: 0.6702, test_loss: 1.1210, test_f1: 0.5305
 epoch: 24, train_loss: 0.6495, test_loss: 1.0883, test_f1: 0.5865
 epoch: 25, train_loss: 0.6470, test_loss: 1.0872, test_f1: 0.5333
 epoch: 26, train_loss: 0.6493, test_loss: 1.1793, test_f1: 0.5758
 epoch: 27, train_loss: 0.6461, test_loss: 1.4083, test_f1: 0.4433
 epoch: 28, train_loss: 0.6551, test_loss: 1.2458, test_f1: 0.4897
 epoch: 29, train_loss: 0.6577, test_loss: 1.0708, test_f1: 0.5929
 epoch: 30, train_loss: 0.6388, test_loss: 1.3284, test_f1: 0.5339
 epoch: 31, train_loss: 0.6540, test_loss: 1.0187, test_f1: 0.5648
 epoch: 32, train_loss: 0.6228, test_loss: 1.0566, test_f1: 0.5352
 epoch: 33, train_loss: 0.6043, test_loss: 1.3017, test_f1: 0.5317
 epoch: 34, train_loss: 0.5857, test_loss: 1.1401, test_f1: 0.6112
 epoch: 35, train_loss: 0.6192, test_loss: 1.1713, test_f1: 0.5785
 epoch: 36, train_loss: 0.5933, test_loss: 1.0980, test_f1: 0.5717
 epoch: 37, train_loss: 0.6169, test_loss: 1.1960, test_f1: 0.6055
 epoch: 38, train_loss: 0.5918, test_loss: 1.3041, test_f1: 0.5695
 epoch: 39, train_loss: 0.6255, test_loss: 1.0384, test_f1: 0.6398
 epoch: 40, train_loss: 0.6224, test_loss: 1.0048, test_f1: 0.5991
 epoch: 41, train_loss: 0.5960, test_loss: 1.0196, test_f1: 0.6212
 epoch: 42, train_loss: 0.5721, test_loss: 1.1325, test_f1: 0.5838
 epoch: 43, train_loss: 0.5760, test_loss: 1.1843, test_f1: 0.5511
 epoch: 44, train_loss: 0.5492, test_loss: 1.1161, test_f1: 0.6014
 epoch: 45, train_loss: 0.5918, test_loss: 1.1963, test_f1: 0.5729
 epoch: 46, train_loss: 0.6144, test_loss: 1.2710, test_f1: 0.6095
 epoch: 47, train_loss: 0.6080, test_loss: 1.2655, test_f1: 0.5925
 epoch: 48, train_loss: 0.5664, test_loss: 1.7611, test_f1: 0.4216
 epoch: 49, train_loss: 0.5477, test_loss: 1.1898, test_f1: 0.5750
 epoch: 50, train_loss: 0.5433, test_loss: 1.2305, test_f1: 0.5788
 epoch: 51, train_loss: 0.5116, test_loss: 1.1647, test_f1: 0.6369
 epoch: 52, train_loss: 0.4992, test_loss: 1.2784, test_f1: 0.6193
 epoch: 53, train_loss: 0.4711, test_loss: 1.3191, test_f1: 0.5922
 epoch: 54, train_loss: 0.4503, test_loss: 1.3823, test_f1: 0.6100
 epoch: 55, train_loss: 0.4521, test_loss: 1.4854, test_f1: 0.6045
 epoch: 56, train_loss: 0.4359, test_loss: 1.5646, test_f1: 0.6328
 epoch: 57, train_loss: 0.4375, test_loss: 1.4805, test_f1: 0.6011
 epoch: 58, train_loss: 0.4399, test_loss: 1.5601, test_f1: 0.6132
 epoch: 59, train_loss: 0.4424, test_loss: 1.6418, test_f1: 0.5853
 epoch: 60, train_loss: 0.5079, test_loss: 1.2549, test_f1: 0.6316
 epoch: 61, train_loss: 0.4426, test_loss: 1.4051, test_f1: 0.6001
 epoch: 62, train_loss: 0.4579, test_loss: 1.5808, test_f1: 0.6227
 epoch: 63, train_loss: 0.4319, test_loss: 1.4644, test_f1: 0.6242
 epoch: 64, train_loss: 0.4239, test_loss: 1.5514, test_f1: 0.5892
 epoch: 65, train_loss: 0.4360, test_loss: 1.5353, test_f1: 0.6585
 epoch: 66, train_loss: 0.4083, test_loss: 1.4726, test_f1: 0.6684
 epoch: 67, train_loss: 0.4048, test_loss: 1.4917, test_f1: 0.5580
 epoch: 68, train_loss: 0.4549, test_loss: 1.4658, test_f1: 0.6278
 epoch: 69, train_loss: 0.4226, test_loss: 1.6167, test_f1: 0.6451
 epoch: 70, train_loss: 0.4162, test_loss: 1.4455, test_f1: 0.6406
 epoch: 71, train_loss: 0.3857, test_loss: 1.5625, test_f1: 0.5931
 epoch: 72, train_loss: 0.3826, test_loss: 1.4315, test_f1: 0.6495
 epoch: 73, train_loss: 0.3769, test_loss: 1.7246, test_f1: 0.6015
 epoch: 74, train_loss: 0.3776, test_loss: 1.6426, test_f1: 0.6031
 epoch: 75, train_loss: 0.4079, test_loss: 1.3745, test_f1: 0.6516
 epoch: 76, train_loss: 0.3908, test_loss: 1.6773, test_f1: 0.5790
 epoch: 77, train_loss: 0.4100, test_loss: 1.6058, test_f1: 0.6305
 epoch: 78, train_loss: 0.3533, test_loss: 1.6499, test_f1: 0.6239
 epoch: 79, train_loss: 0.3133, test_loss: 1.8909, test_f1: 0.5960
 epoch: 80, train_loss: 0.3226, test_loss: 1.6578, test_f1: 0.6299
 epoch: 81, train_loss: 0.3460, test_loss: 1.9715, test_f1: 0.5876
 epoch: 82, train_loss: 0.3799, test_loss: 1.5095, test_f1: 0.6508
 epoch: 83, train_loss: 0.3643, test_loss: 1.8107, test_f1: 0.6276
 epoch: 84, train_loss: 0.3272, test_loss: 2.0886, test_f1: 0.5813
 epoch: 85, train_loss: 0.3496, test_loss: 1.8112, test_f1: 0.5916
 epoch: 86, train_loss: 0.3916, test_loss: 1.7186, test_f1: 0.6177
 epoch: 87, train_loss: 0.3799, test_loss: 1.5207, test_f1: 0.6235
 epoch: 88, train_loss: 0.3666, test_loss: 1.8015, test_f1: 0.6058
 epoch: 89, train_loss: 0.3139, test_loss: 1.6587, test_f1: 0.6646
 epoch: 90, train_loss: 0.3193, test_loss: 1.8660, test_f1: 0.6041
 epoch: 91, train_loss: 0.3261, test_loss: 1.7757, test_f1: 0.6295
 epoch: 92, train_loss: 0.3291, test_loss: 1.7284, test_f1: 0.5981
 epoch: 93, train_loss: 0.3393, test_loss: 1.7578, test_f1: 0.6397
 epoch: 94, train_loss: 0.3173, test_loss: 1.7504, test_f1: 0.6278
 epoch: 95, train_loss: 0.3224, test_loss: 1.6511, test_f1: 0.6574
 epoch: 96, train_loss: 0.3326, test_loss: 1.9853, test_f1: 0.5854
 epoch: 97, train_loss: 0.3690, test_loss: 1.9330, test_f1: 0.6216
 epoch: 98, train_loss: 0.3185, test_loss: 1.8213, test_f1: 0.6786
 epoch: 99, train_loss: 0.3250, test_loss: 1.9031, test_f1: 0.6666
##################ITERATION #4 ****************************************
 epoch: 0, train_loss: 1.4041, test_loss: 1.6724, test_f1: 0.1368
 epoch: 1, train_loss: 1.0298, test_loss: 1.2287, test_f1: 0.4626
 epoch: 2, train_loss: 0.9467, test_loss: 1.1082, test_f1: 0.4887
 epoch: 3, train_loss: 0.8985, test_loss: 1.0054, test_f1: 0.5352
 epoch: 4, train_loss: 0.8255, test_loss: 1.0267, test_f1: 0.5150
 epoch: 5, train_loss: 0.8444, test_loss: 1.1933, test_f1: 0.4503
 epoch: 6, train_loss: 0.8131, test_loss: 0.9927, test_f1: 0.5478
 epoch: 7, train_loss: 0.7884, test_loss: 1.1246, test_f1: 0.5117
 epoch: 8, train_loss: 0.7782, test_loss: 0.9866, test_f1: 0.5341
 epoch: 9, train_loss: 0.7631, test_loss: 1.1043, test_f1: 0.5535
 epoch: 10, train_loss: 0.8052, test_loss: 0.9742, test_f1: 0.5412
 epoch: 11, train_loss: 0.7754, test_loss: 1.0532, test_f1: 0.5113
 epoch: 12, train_loss: 0.7628, test_loss: 0.9673, test_f1: 0.5171
 epoch: 13, train_loss: 0.7529, test_loss: 1.0304, test_f1: 0.5328
 epoch: 14, train_loss: 0.7373, test_loss: 0.9909, test_f1: 0.6340
 epoch: 15, train_loss: 0.7146, test_loss: 1.0787, test_f1: 0.5344
 epoch: 16, train_loss: 0.7374, test_loss: 0.9555, test_f1: 0.5482
 epoch: 17, train_loss: 0.7459, test_loss: 1.0556, test_f1: 0.5357
 epoch: 18, train_loss: 0.7187, test_loss: 1.2987, test_f1: 0.4575
 epoch: 19, train_loss: 0.7128, test_loss: 1.0855, test_f1: 0.5067
 epoch: 20, train_loss: 0.7255, test_loss: 1.1152, test_f1: 0.4287
 epoch: 21, train_loss: 0.7102, test_loss: 1.0806, test_f1: 0.5153
 epoch: 22, train_loss: 0.7414, test_loss: 0.9708, test_f1: 0.5431
 epoch: 23, train_loss: 0.6883, test_loss: 1.2048, test_f1: 0.5452
 epoch: 24, train_loss: 0.6601, test_loss: 1.3090, test_f1: 0.5716
 epoch: 25, train_loss: 0.6673, test_loss: 0.9619, test_f1: 0.6739
 epoch: 26, train_loss: 0.6736, test_loss: 1.2800, test_f1: 0.4413
 epoch: 27, train_loss: 0.7358, test_loss: 1.4200, test_f1: 0.5056
 epoch: 28, train_loss: 0.7273, test_loss: 1.0183, test_f1: 0.6047
 epoch: 29, train_loss: 0.7006, test_loss: 0.9790, test_f1: 0.6204
 epoch: 30, train_loss: 0.6736, test_loss: 1.1281, test_f1: 0.5507
 epoch: 31, train_loss: 0.6417, test_loss: 1.0261, test_f1: 0.6240
 epoch: 32, train_loss: 0.6588, test_loss: 1.0911, test_f1: 0.5487
 epoch: 33, train_loss: 0.6630, test_loss: 1.2649, test_f1: 0.6305
 epoch: 34, train_loss: 0.6351, test_loss: 1.4713, test_f1: 0.4664
 epoch: 35, train_loss: 0.6354, test_loss: 1.0831, test_f1: 0.6354
 epoch: 36, train_loss: 0.6269, test_loss: 1.1875, test_f1: 0.5990
 epoch: 37, train_loss: 0.6171, test_loss: 0.9487, test_f1: 0.6307
 epoch: 38, train_loss: 0.6044, test_loss: 1.0304, test_f1: 0.6222
 epoch: 39, train_loss: 0.5786, test_loss: 0.9251, test_f1: 0.6935
 epoch: 40, train_loss: 0.5382, test_loss: 1.0370, test_f1: 0.6672
 epoch: 41, train_loss: 0.5783, test_loss: 1.2125, test_f1: 0.6118
 epoch: 42, train_loss: 0.5809, test_loss: 1.3777, test_f1: 0.4714
 epoch: 43, train_loss: 0.6064, test_loss: 1.9198, test_f1: 0.5233
 epoch: 44, train_loss: 0.5993, test_loss: 1.1007, test_f1: 0.6279
 epoch: 45, train_loss: 0.5850, test_loss: 1.7986, test_f1: 0.5151
 epoch: 46, train_loss: 0.5614, test_loss: 0.9880, test_f1: 0.6196
 epoch: 47, train_loss: 0.5428, test_loss: 1.1286, test_f1: 0.6236
 epoch: 48, train_loss: 0.5423, test_loss: 0.9732, test_f1: 0.6630
 epoch: 49, train_loss: 0.6216, test_loss: 1.1036, test_f1: 0.5266
 epoch: 50, train_loss: 0.5984, test_loss: 1.0517, test_f1: 0.5346
 epoch: 51, train_loss: 0.5284, test_loss: 1.1558, test_f1: 0.6420
 epoch: 52, train_loss: 0.5167, test_loss: 1.4271, test_f1: 0.6040
 epoch: 53, train_loss: 0.5013, test_loss: 1.2630, test_f1: 0.6154
 epoch: 54, train_loss: 0.4823, test_loss: 1.3719, test_f1: 0.5960
 epoch: 55, train_loss: 0.4982, test_loss: 1.2885, test_f1: 0.6264
 epoch: 56, train_loss: 0.4855, test_loss: 1.2307, test_f1: 0.6582
 epoch: 57, train_loss: 0.4552, test_loss: 1.1915, test_f1: 0.6813
 epoch: 58, train_loss: 0.4484, test_loss: 1.3393, test_f1: 0.6376
 epoch: 59, train_loss: 0.4391, test_loss: 1.5602, test_f1: 0.5799
 epoch: 60, train_loss: 0.4494, test_loss: 1.1851, test_f1: 0.6170
 epoch: 61, train_loss: 0.4413, test_loss: 1.3416, test_f1: 0.6281
 epoch: 62, train_loss: 0.4063, test_loss: 1.3115, test_f1: 0.6371
 epoch: 63, train_loss: 0.4159, test_loss: 1.6202, test_f1: 0.6080
 epoch: 64, train_loss: 0.4021, test_loss: 1.4091, test_f1: 0.6403
 epoch: 65, train_loss: 0.3944, test_loss: 1.9358, test_f1: 0.5957
 epoch: 66, train_loss: 0.3929, test_loss: 1.4991, test_f1: 0.6209
 epoch: 67, train_loss: 0.4265, test_loss: 1.4013, test_f1: 0.6279
 epoch: 68, train_loss: 0.4150, test_loss: 1.7025, test_f1: 0.5620
 epoch: 69, train_loss: 0.4131, test_loss: 1.5188, test_f1: 0.5985
 epoch: 70, train_loss: 0.4212, test_loss: 1.5944, test_f1: 0.5866
 epoch: 71, train_loss: 0.3968, test_loss: 1.3232, test_f1: 0.6493
 epoch: 72, train_loss: 0.4073, test_loss: 1.7004, test_f1: 0.6070
 epoch: 73, train_loss: 0.3681, test_loss: 1.4580, test_f1: 0.6408
 epoch: 74, train_loss: 0.3954, test_loss: 1.4342, test_f1: 0.6666
 epoch: 75, train_loss: 0.3649, test_loss: 1.8548, test_f1: 0.5824
 epoch: 76, train_loss: 0.3780, test_loss: 1.5002, test_f1: 0.6416
 epoch: 77, train_loss: 0.3699, test_loss: 1.3364, test_f1: 0.6390
 epoch: 78, train_loss: 0.3587, test_loss: 1.8077, test_f1: 0.6060
 epoch: 79, train_loss: 0.3627, test_loss: 1.6151, test_f1: 0.6254
 epoch: 80, train_loss: 0.3764, test_loss: 1.6398, test_f1: 0.5989
 epoch: 81, train_loss: 0.3702, test_loss: 1.6901, test_f1: 0.5883
 epoch: 82, train_loss: 0.3735, test_loss: 1.8215, test_f1: 0.6141
 epoch: 83, train_loss: 0.3315, test_loss: 1.4826, test_f1: 0.6471
 epoch: 84, train_loss: 0.3453, test_loss: 2.1756, test_f1: 0.5320
 epoch: 85, train_loss: 0.3650, test_loss: 1.6412, test_f1: 0.6381
 epoch: 86, train_loss: 0.3352, test_loss: 1.5647, test_f1: 0.6313
 epoch: 87, train_loss: 0.3404, test_loss: 1.4687, test_f1: 0.6439
 epoch: 88, train_loss: 0.3097, test_loss: 1.6808, test_f1: 0.6238
 epoch: 89, train_loss: 0.2852, test_loss: 1.8812, test_f1: 0.5850
 epoch: 90, train_loss: 0.3230, test_loss: 1.6105, test_f1: 0.6128
 epoch: 91, train_loss: 0.3369, test_loss: 1.5703, test_f1: 0.6147
 epoch: 92, train_loss: 0.3389, test_loss: 1.7647, test_f1: 0.6015
 epoch: 93, train_loss: 0.3321, test_loss: 1.4159, test_f1: 0.6391
 epoch: 94, train_loss: 0.2900, test_loss: 1.6415, test_f1: 0.6305
 epoch: 95, train_loss: 0.3022, test_loss: 1.6440, test_f1: 0.6491
 epoch: 96, train_loss: 0.3498, test_loss: 1.4624, test_f1: 0.6254
 epoch: 97, train_loss: 0.2833, test_loss: 2.0977, test_f1: 0.5829
 epoch: 98, train_loss: 0.3152, test_loss: 1.6502, test_f1: 0.6175
 epoch: 99, train_loss: 0.2959, test_loss: 1.6621, test_f1: 0.6138
##################ITERATION #5 ****************************************
 epoch: 0, train_loss: 1.3080, test_loss: 1.6254, test_f1: 0.3347
 epoch: 1, train_loss: 0.9695, test_loss: 1.3397, test_f1: 0.4411
 epoch: 2, train_loss: 0.8854, test_loss: 1.1493, test_f1: 0.4183
 epoch: 3, train_loss: 0.8549, test_loss: 1.2648, test_f1: 0.5038
 epoch: 4, train_loss: 0.8503, test_loss: 1.0294, test_f1: 0.5668
 epoch: 5, train_loss: 0.7744, test_loss: 1.0271, test_f1: 0.5450
 epoch: 6, train_loss: 0.7575, test_loss: 1.0431, test_f1: 0.5708
 epoch: 7, train_loss: 0.7685, test_loss: 1.2373, test_f1: 0.5102
 epoch: 8, train_loss: 0.7695, test_loss: 1.0650, test_f1: 0.5891
 epoch: 9, train_loss: 0.7543, test_loss: 1.1189, test_f1: 0.4816
 epoch: 10, train_loss: 0.7560, test_loss: 1.4226, test_f1: 0.5213
 epoch: 11, train_loss: 0.6890, test_loss: 1.0809, test_f1: 0.6031
 epoch: 12, train_loss: 0.6848, test_loss: 1.0550, test_f1: 0.5225
 epoch: 13, train_loss: 0.6486, test_loss: 1.4226, test_f1: 0.4756
 epoch: 14, train_loss: 0.6854, test_loss: 1.2507, test_f1: 0.5502
 epoch: 15, train_loss: 0.6388, test_loss: 1.1780, test_f1: 0.5621
 epoch: 16, train_loss: 0.6590, test_loss: 1.0614, test_f1: 0.5384
 epoch: 17, train_loss: 0.6389, test_loss: 1.0620, test_f1: 0.5683
 epoch: 18, train_loss: 0.6247, test_loss: 1.2411, test_f1: 0.5303
 epoch: 19, train_loss: 0.6388, test_loss: 1.2142, test_f1: 0.6267
 epoch: 20, train_loss: 0.6283, test_loss: 2.1685, test_f1: 0.3758
 epoch: 21, train_loss: 0.6060, test_loss: 0.9866, test_f1: 0.5961
 epoch: 22, train_loss: 0.5919, test_loss: 1.1176, test_f1: 0.6367
 epoch: 23, train_loss: 0.5924, test_loss: 1.0374, test_f1: 0.6191
 epoch: 24, train_loss: 0.5827, test_loss: 1.0537, test_f1: 0.5998
 epoch: 25, train_loss: 0.5771, test_loss: 1.2100, test_f1: 0.5650
 epoch: 26, train_loss: 0.5736, test_loss: 1.2352, test_f1: 0.5538
 epoch: 27, train_loss: 0.5705, test_loss: 1.1022, test_f1: 0.5501
 epoch: 28, train_loss: 0.5991, test_loss: 1.0526, test_f1: 0.6422
 epoch: 29, train_loss: 0.5475, test_loss: 1.2445, test_f1: 0.5584
 epoch: 30, train_loss: 0.5711, test_loss: 1.2936, test_f1: 0.5861
 epoch: 31, train_loss: 0.5254, test_loss: 1.2683, test_f1: 0.5746
 epoch: 32, train_loss: 0.4812, test_loss: 1.5128, test_f1: 0.5268
 epoch: 33, train_loss: 0.5096, test_loss: 1.9649, test_f1: 0.5119
 epoch: 34, train_loss: 0.5653, test_loss: 1.2098, test_f1: 0.5621
 epoch: 35, train_loss: 0.5584, test_loss: 1.0462, test_f1: 0.6663
 epoch: 36, train_loss: 0.5475, test_loss: 1.1481, test_f1: 0.5719
 epoch: 37, train_loss: 0.5217, test_loss: 1.0803, test_f1: 0.6035
 epoch: 38, train_loss: 0.5229, test_loss: 1.0640, test_f1: 0.5912
 epoch: 39, train_loss: 0.4888, test_loss: 1.2063, test_f1: 0.5945
 epoch: 40, train_loss: 0.4702, test_loss: 1.4813, test_f1: 0.5478
 epoch: 41, train_loss: 0.4688, test_loss: 1.5928, test_f1: 0.5217
 epoch: 42, train_loss: 0.4573, test_loss: 1.1968, test_f1: 0.6464
 epoch: 43, train_loss: 0.4859, test_loss: 1.4807, test_f1: 0.5737
 epoch: 44, train_loss: 0.4807, test_loss: 1.7696, test_f1: 0.5673
 epoch: 45, train_loss: 0.5282, test_loss: 1.5998, test_f1: 0.5251
 epoch: 46, train_loss: 0.4941, test_loss: 1.2045, test_f1: 0.5607
 epoch: 47, train_loss: 0.4574, test_loss: 1.4819, test_f1: 0.5366
 epoch: 48, train_loss: 0.4958, test_loss: 1.0468, test_f1: 0.6146
 epoch: 49, train_loss: 0.4601, test_loss: 1.0378, test_f1: 0.5989
 epoch: 50, train_loss: 0.4595, test_loss: 1.0804, test_f1: 0.6429
 epoch: 51, train_loss: 0.3922, test_loss: 1.3185, test_f1: 0.6057
 epoch: 52, train_loss: 0.3818, test_loss: 1.2779, test_f1: 0.5823
 epoch: 53, train_loss: 0.3390, test_loss: 1.2063, test_f1: 0.6196
 epoch: 54, train_loss: 0.3472, test_loss: 1.1547, test_f1: 0.6175
 epoch: 55, train_loss: 0.3354, test_loss: 1.3645, test_f1: 0.6051
 epoch: 56, train_loss: 0.3074, test_loss: 1.5670, test_f1: 0.5883
 epoch: 57, train_loss: 0.3339, test_loss: 1.3790, test_f1: 0.6555
 epoch: 58, train_loss: 0.3283, test_loss: 1.4535, test_f1: 0.6217
 epoch: 59, train_loss: 0.3433, test_loss: 1.3213, test_f1: 0.6042
 epoch: 60, train_loss: 0.3668, test_loss: 1.5606, test_f1: 0.6118
 epoch: 61, train_loss: 0.3239, test_loss: 1.5649, test_f1: 0.6036
 epoch: 62, train_loss: 0.3092, test_loss: 1.4026, test_f1: 0.6084
 epoch: 63, train_loss: 0.2972, test_loss: 1.5807, test_f1: 0.5686
 epoch: 64, train_loss: 0.2851, test_loss: 1.6606, test_f1: 0.6132
 epoch: 65, train_loss: 0.2452, test_loss: 1.5516, test_f1: 0.5847
 epoch: 66, train_loss: 0.2725, test_loss: 1.4599, test_f1: 0.6405
 epoch: 67, train_loss: 0.2728, test_loss: 1.8796, test_f1: 0.5553
 epoch: 68, train_loss: 0.2933, test_loss: 1.3893, test_f1: 0.6355
 epoch: 69, train_loss: 0.2926, test_loss: 1.5193, test_f1: 0.6115
 epoch: 70, train_loss: 0.2616, test_loss: 1.6497, test_f1: 0.6140
 epoch: 71, train_loss: 0.2928, test_loss: 1.6034, test_f1: 0.6233
 epoch: 72, train_loss: 0.3148, test_loss: 1.6455, test_f1: 0.5953
 epoch: 73, train_loss: 0.3357, test_loss: 1.3890, test_f1: 0.6008
 epoch: 74, train_loss: 0.2878, test_loss: 1.8231, test_f1: 0.5824
 epoch: 75, train_loss: 0.2546, test_loss: 1.3767, test_f1: 0.6442
 epoch: 76, train_loss: 0.2495, test_loss: 1.8305, test_f1: 0.6249
 epoch: 77, train_loss: 0.2702, test_loss: 1.5721, test_f1: 0.6238
 epoch: 78, train_loss: 0.2520, test_loss: 1.7952, test_f1: 0.5974
 epoch: 79, train_loss: 0.2487, test_loss: 1.7208, test_f1: 0.6030
 epoch: 80, train_loss: 0.2340, test_loss: 1.8475, test_f1: 0.6221
 epoch: 81, train_loss: 0.2802, test_loss: 1.8626, test_f1: 0.5580
 epoch: 82, train_loss: 0.2848, test_loss: 1.4726, test_f1: 0.6297
 epoch: 83, train_loss: 0.2424, test_loss: 1.3030, test_f1: 0.6530
 epoch: 84, train_loss: 0.2207, test_loss: 1.6240, test_f1: 0.6208
 epoch: 85, train_loss: 0.2324, test_loss: 1.8750, test_f1: 0.5821
 epoch: 86, train_loss: 0.2371, test_loss: 1.8163, test_f1: 0.5722
 epoch: 87, train_loss: 0.1908, test_loss: 1.6758, test_f1: 0.6096
 epoch: 88, train_loss: 0.2203, test_loss: 1.5979, test_f1: 0.6233
 epoch: 89, train_loss: 0.1943, test_loss: 1.7607, test_f1: 0.6101
 epoch: 90, train_loss: 0.2209, test_loss: 1.8943, test_f1: 0.5983
 epoch: 91, train_loss: 0.2130, test_loss: 1.8304, test_f1: 0.6126
 epoch: 92, train_loss: 0.2272, test_loss: 1.7887, test_f1: 0.6151
 epoch: 93, train_loss: 0.2037, test_loss: 1.6972, test_f1: 0.6251
 epoch: 94, train_loss: 0.2216, test_loss: 2.2060, test_f1: 0.6031
 epoch: 95, train_loss: 0.1990, test_loss: 1.8760, test_f1: 0.6372
 epoch: 96, train_loss: 0.3009, test_loss: 1.8331, test_f1: 0.6171
 epoch: 97, train_loss: 0.2681, test_loss: 1.9237, test_f1: 0.5952
 epoch: 98, train_loss: 0.2257, test_loss: 2.0144, test_f1: 0.6126
 epoch: 99, train_loss: 0.1769, test_loss: 1.8243, test_f1: 0.6267
##################ITERATION #6 ****************************************
 epoch: 0, train_loss: 1.3574, test_loss: 1.5610, test_f1: 0.2633
 epoch: 1, train_loss: 1.0840, test_loss: 1.1978, test_f1: 0.4150
 epoch: 2, train_loss: 0.9387, test_loss: 1.0636, test_f1: 0.5110
 epoch: 3, train_loss: 0.8633, test_loss: 1.0139, test_f1: 0.5143
 epoch: 4, train_loss: 0.8410, test_loss: 1.0207, test_f1: 0.5836
 epoch: 5, train_loss: 0.8083, test_loss: 1.1602, test_f1: 0.5378
 epoch: 6, train_loss: 0.7772, test_loss: 0.9887, test_f1: 0.5811
 epoch: 7, train_loss: 0.7660, test_loss: 1.1751, test_f1: 0.5135
 epoch: 8, train_loss: 0.7666, test_loss: 1.0670, test_f1: 0.5520
 epoch: 9, train_loss: 0.8159, test_loss: 1.0461, test_f1: 0.5485
 epoch: 10, train_loss: 0.7616, test_loss: 1.0096, test_f1: 0.5932
 epoch: 11, train_loss: 0.7468, test_loss: 1.0874, test_f1: 0.5591
 epoch: 12, train_loss: 0.7448, test_loss: 1.4769, test_f1: 0.5290
 epoch: 13, train_loss: 0.7588, test_loss: 1.1658, test_f1: 0.5110
 epoch: 14, train_loss: 0.7388, test_loss: 1.4288, test_f1: 0.4873
 epoch: 15, train_loss: 0.7382, test_loss: 1.0319, test_f1: 0.5911
 epoch: 16, train_loss: 0.7164, test_loss: 1.2578, test_f1: 0.5143
 epoch: 17, train_loss: 0.7081, test_loss: 0.9911, test_f1: 0.6220
 epoch: 18, train_loss: 0.7387, test_loss: 1.0717, test_f1: 0.5897
 epoch: 19, train_loss: 0.7263, test_loss: 1.2086, test_f1: 0.5564
 epoch: 20, train_loss: 0.7422, test_loss: 1.0901, test_f1: 0.4972
 epoch: 21, train_loss: 0.7395, test_loss: 1.0691, test_f1: 0.5137
 epoch: 22, train_loss: 0.6827, test_loss: 1.0152, test_f1: 0.5928
 epoch: 23, train_loss: 0.6677, test_loss: 1.2649, test_f1: 0.5532
 epoch: 24, train_loss: 0.6633, test_loss: 1.3224, test_f1: 0.5479
 epoch: 25, train_loss: 0.6737, test_loss: 1.1148, test_f1: 0.5047
 epoch: 26, train_loss: 0.6817, test_loss: 1.3947, test_f1: 0.4923
 epoch: 27, train_loss: 0.6454, test_loss: 1.2753, test_f1: 0.5903
 epoch: 28, train_loss: 0.6745, test_loss: 1.3224, test_f1: 0.5291
 epoch: 29, train_loss: 0.6271, test_loss: 1.0582, test_f1: 0.6172
 epoch: 30, train_loss: 0.6418, test_loss: 1.2296, test_f1: 0.6172
 epoch: 31, train_loss: 0.6125, test_loss: 1.3244, test_f1: 0.5674
 epoch: 32, train_loss: 0.6356, test_loss: 1.0695, test_f1: 0.6172
 epoch: 33, train_loss: 0.6151, test_loss: 1.3342, test_f1: 0.5530
 epoch: 34, train_loss: 0.6224, test_loss: 1.3000, test_f1: 0.5651
 epoch: 35, train_loss: 0.6271, test_loss: 1.3834, test_f1: 0.5853
 epoch: 36, train_loss: 0.5985, test_loss: 1.1505, test_f1: 0.6013
 epoch: 37, train_loss: 0.6243, test_loss: 1.0999, test_f1: 0.6630
 epoch: 38, train_loss: 0.5946, test_loss: 1.0329, test_f1: 0.6245
 epoch: 39, train_loss: 0.5361, test_loss: 1.3602, test_f1: 0.6440
 epoch: 40, train_loss: 0.5506, test_loss: 1.6061, test_f1: 0.5868
 epoch: 41, train_loss: 0.5643, test_loss: 1.2946, test_f1: 0.5648
 epoch: 42, train_loss: 0.5425, test_loss: 1.6298, test_f1: 0.5275
 epoch: 43, train_loss: 0.5393, test_loss: 1.2462, test_f1: 0.6431
 epoch: 44, train_loss: 0.5144, test_loss: 1.1330, test_f1: 0.6089
 epoch: 45, train_loss: 0.5198, test_loss: 1.1008, test_f1: 0.6636
 epoch: 46, train_loss: 0.5329, test_loss: 1.8012, test_f1: 0.5376
 epoch: 47, train_loss: 0.5404, test_loss: 1.0565, test_f1: 0.6901
 epoch: 48, train_loss: 0.5370, test_loss: 1.3053, test_f1: 0.5932
 epoch: 49, train_loss: 0.5378, test_loss: 1.1836, test_f1: 0.6717
 epoch: 50, train_loss: 0.5163, test_loss: 1.4905, test_f1: 0.5717
 epoch: 51, train_loss: 0.4575, test_loss: 1.2303, test_f1: 0.6738
 epoch: 52, train_loss: 0.4364, test_loss: 1.3525, test_f1: 0.6593
 epoch: 53, train_loss: 0.4507, test_loss: 1.3206, test_f1: 0.6459
 epoch: 54, train_loss: 0.4519, test_loss: 1.2900, test_f1: 0.6565
 epoch: 55, train_loss: 0.4383, test_loss: 1.5289, test_f1: 0.5769
 epoch: 56, train_loss: 0.4532, test_loss: 1.3261, test_f1: 0.6715
 epoch: 57, train_loss: 0.4230, test_loss: 1.4648, test_f1: 0.6020
 epoch: 58, train_loss: 0.4132, test_loss: 1.5085, test_f1: 0.6549
 epoch: 59, train_loss: 0.3977, test_loss: 1.7501, test_f1: 0.6035
 epoch: 60, train_loss: 0.4204, test_loss: 1.7766, test_f1: 0.5714
 epoch: 61, train_loss: 0.4062, test_loss: 1.7951, test_f1: 0.5936
 epoch: 62, train_loss: 0.4226, test_loss: 1.5651, test_f1: 0.5942
 epoch: 63, train_loss: 0.4098, test_loss: 1.8532, test_f1: 0.6433
 epoch: 64, train_loss: 0.3793, test_loss: 1.4310, test_f1: 0.6456
 epoch: 65, train_loss: 0.3900, test_loss: 1.5886, test_f1: 0.6044
 epoch: 66, train_loss: 0.4579, test_loss: 1.8808, test_f1: 0.6197
 epoch: 67, train_loss: 0.4169, test_loss: 1.4415, test_f1: 0.6240
 epoch: 68, train_loss: 0.3924, test_loss: 1.5798, test_f1: 0.6043
 epoch: 69, train_loss: 0.3600, test_loss: 1.6110, test_f1: 0.6213
 epoch: 70, train_loss: 0.3848, test_loss: 1.5212, test_f1: 0.6042
 epoch: 71, train_loss: 0.3564, test_loss: 1.6620, test_f1: 0.6268
 epoch: 72, train_loss: 0.3289, test_loss: 2.0287, test_f1: 0.5954
 epoch: 73, train_loss: 0.3619, test_loss: 2.6401, test_f1: 0.5715
 epoch: 74, train_loss: 0.3503, test_loss: 1.6567, test_f1: 0.6127
 epoch: 75, train_loss: 0.3730, test_loss: 1.7911, test_f1: 0.6333
 epoch: 76, train_loss: 0.3379, test_loss: 2.1525, test_f1: 0.6246
 epoch: 77, train_loss: 0.3608, test_loss: 1.7175, test_f1: 0.6181
 epoch: 78, train_loss: 0.3465, test_loss: 1.8796, test_f1: 0.6116
 epoch: 79, train_loss: 0.3576, test_loss: 1.9498, test_f1: 0.5690
 epoch: 80, train_loss: 0.3307, test_loss: 1.8803, test_f1: 0.6285
 epoch: 81, train_loss: 0.3355, test_loss: 2.1443, test_f1: 0.6010
 epoch: 82, train_loss: 0.3322, test_loss: 1.7081, test_f1: 0.6225
 epoch: 83, train_loss: 0.3154, test_loss: 2.5470, test_f1: 0.6273
 epoch: 84, train_loss: 0.3526, test_loss: 1.7192, test_f1: 0.6083
 epoch: 85, train_loss: 0.3641, test_loss: 1.8866, test_f1: 0.5715
 epoch: 86, train_loss: 0.3335, test_loss: 1.9417, test_f1: 0.5996
 epoch: 87, train_loss: 0.3464, test_loss: 1.5534, test_f1: 0.6324
 epoch: 88, train_loss: 0.3914, test_loss: 1.7479, test_f1: 0.5934
 epoch: 89, train_loss: 0.3374, test_loss: 1.5047, test_f1: 0.6171
 epoch: 90, train_loss: 0.3281, test_loss: 1.5533, test_f1: 0.6174
 epoch: 91, train_loss: 0.3307, test_loss: 1.4892, test_f1: 0.6600
 epoch: 92, train_loss: 0.3236, test_loss: 1.8930, test_f1: 0.6060
 epoch: 93, train_loss: 0.2882, test_loss: 1.9729, test_f1: 0.6251
 epoch: 94, train_loss: 0.3716, test_loss: 1.9240, test_f1: 0.5965
 epoch: 95, train_loss: 0.3832, test_loss: 2.1491, test_f1: 0.5806
 epoch: 96, train_loss: 0.3520, test_loss: 1.6091, test_f1: 0.6790
 epoch: 97, train_loss: 0.3048, test_loss: 1.8544, test_f1: 0.6314
 epoch: 98, train_loss: 0.2855, test_loss: 1.8278, test_f1: 0.6351
 epoch: 99, train_loss: 0.2781, test_loss: 2.2625, test_f1: 0.5900
##################ITERATION #7 ****************************************
 epoch: 0, train_loss: 1.4434, test_loss: 1.4888, test_f1: 0.3071
 epoch: 1, train_loss: 1.0012, test_loss: 1.2276, test_f1: 0.4287
 epoch: 2, train_loss: 0.8740, test_loss: 1.0643, test_f1: 0.5143
 epoch: 3, train_loss: 0.8364, test_loss: 1.1396, test_f1: 0.5349
 epoch: 4, train_loss: 0.8239, test_loss: 1.0029, test_f1: 0.5346
 epoch: 5, train_loss: 0.7962, test_loss: 1.0122, test_f1: 0.5023
 epoch: 6, train_loss: 0.7822, test_loss: 0.9766, test_f1: 0.5648
 epoch: 7, train_loss: 0.7512, test_loss: 0.9061, test_f1: 0.5834
 epoch: 8, train_loss: 0.7350, test_loss: 1.5907, test_f1: 0.4374
 epoch: 9, train_loss: 0.7927, test_loss: 1.0499, test_f1: 0.5607
 epoch: 10, train_loss: 0.7596, test_loss: 1.0068, test_f1: 0.5901
 epoch: 11, train_loss: 0.7889, test_loss: 1.1328, test_f1: 0.4748
 epoch: 12, train_loss: 0.7412, test_loss: 0.9717, test_f1: 0.6340
 epoch: 13, train_loss: 0.7119, test_loss: 1.0518, test_f1: 0.6213
 epoch: 14, train_loss: 0.6985, test_loss: 1.0226, test_f1: 0.5961
 epoch: 15, train_loss: 0.7304, test_loss: 1.1346, test_f1: 0.5869
 epoch: 16, train_loss: 0.7061, test_loss: 1.0907, test_f1: 0.6044
 epoch: 17, train_loss: 0.6872, test_loss: 0.9423, test_f1: 0.6707
 epoch: 18, train_loss: 0.6586, test_loss: 1.0056, test_f1: 0.6007
 epoch: 19, train_loss: 0.6731, test_loss: 1.1730, test_f1: 0.5931
 epoch: 20, train_loss: 0.6602, test_loss: 1.0914, test_f1: 0.5539
 epoch: 21, train_loss: 0.6689, test_loss: 1.1339, test_f1: 0.5982
 epoch: 22, train_loss: 0.6413, test_loss: 1.2081, test_f1: 0.6130
 epoch: 23, train_loss: 0.6477, test_loss: 1.1448, test_f1: 0.5289
 epoch: 24, train_loss: 0.6239, test_loss: 1.1667, test_f1: 0.6071
 epoch: 25, train_loss: 0.6562, test_loss: 1.0622, test_f1: 0.6346
 epoch: 26, train_loss: 0.6324, test_loss: 1.1951, test_f1: 0.6002
 epoch: 27, train_loss: 0.6267, test_loss: 1.5102, test_f1: 0.5344
 epoch: 28, train_loss: 0.6389, test_loss: 1.0571, test_f1: 0.6421
 epoch: 29, train_loss: 0.6032, test_loss: 1.1618, test_f1: 0.6064
 epoch: 30, train_loss: 0.5738, test_loss: 1.0192, test_f1: 0.6353
 epoch: 31, train_loss: 0.5466, test_loss: 1.1687, test_f1: 0.5353
 epoch: 32, train_loss: 0.5489, test_loss: 1.2258, test_f1: 0.5882
 epoch: 33, train_loss: 0.5499, test_loss: 1.1141, test_f1: 0.6901
 epoch: 34, train_loss: 0.5671, test_loss: 1.3156, test_f1: 0.5612
 epoch: 35, train_loss: 0.5561, test_loss: 1.1748, test_f1: 0.5559
 epoch: 36, train_loss: 0.5984, test_loss: 1.1367, test_f1: 0.5323
 epoch: 37, train_loss: 0.5874, test_loss: 1.0558, test_f1: 0.6290
 epoch: 38, train_loss: 0.5385, test_loss: 1.2264, test_f1: 0.6523
 epoch: 39, train_loss: 0.5121, test_loss: 1.1594, test_f1: 0.6488
 epoch: 40, train_loss: 0.5784, test_loss: 1.6535, test_f1: 0.4487
 epoch: 41, train_loss: 0.5611, test_loss: 1.1555, test_f1: 0.5893
 epoch: 42, train_loss: 0.5466, test_loss: 0.9717, test_f1: 0.6674
 epoch: 43, train_loss: 0.5242, test_loss: 1.3183, test_f1: 0.5619
 epoch: 44, train_loss: 0.5144, test_loss: 1.5015, test_f1: 0.5568
 epoch: 45, train_loss: 0.5295, test_loss: 1.0732, test_f1: 0.6512
 epoch: 46, train_loss: 0.5142, test_loss: 1.2331, test_f1: 0.5875
 epoch: 47, train_loss: 0.5087, test_loss: 1.5622, test_f1: 0.5522
 epoch: 48, train_loss: 0.5334, test_loss: 1.1497, test_f1: 0.5644
 epoch: 49, train_loss: 0.5027, test_loss: 1.2898, test_f1: 0.6142
 epoch: 50, train_loss: 0.4781, test_loss: 1.5086, test_f1: 0.5197
 epoch: 51, train_loss: 0.4919, test_loss: 1.2107, test_f1: 0.6465
 epoch: 52, train_loss: 0.4224, test_loss: 1.3125, test_f1: 0.6037
 epoch: 53, train_loss: 0.4140, test_loss: 1.3524, test_f1: 0.6538
 epoch: 54, train_loss: 0.4112, test_loss: 1.2566, test_f1: 0.6033
 epoch: 55, train_loss: 0.4078, test_loss: 1.3656, test_f1: 0.5981
 epoch: 56, train_loss: 0.3720, test_loss: 1.4091, test_f1: 0.5932
 epoch: 57, train_loss: 0.3830, test_loss: 1.4001, test_f1: 0.5989
 epoch: 58, train_loss: 0.3486, test_loss: 1.3020, test_f1: 0.6490
 epoch: 59, train_loss: 0.3390, test_loss: 1.5289, test_f1: 0.6030
 epoch: 60, train_loss: 0.3348, test_loss: 1.3454, test_f1: 0.6036
 epoch: 61, train_loss: 0.3276, test_loss: 1.4369, test_f1: 0.5874
 epoch: 62, train_loss: 0.3485, test_loss: 1.4889, test_f1: 0.6134
 epoch: 63, train_loss: 0.3384, test_loss: 1.5297, test_f1: 0.6093
 epoch: 64, train_loss: 0.3699, test_loss: 1.4719, test_f1: 0.6141
 epoch: 65, train_loss: 0.3667, test_loss: 1.5520, test_f1: 0.5876
 epoch: 66, train_loss: 0.3731, test_loss: 1.3228, test_f1: 0.6429
 epoch: 67, train_loss: 0.3424, test_loss: 1.4756, test_f1: 0.6300
 epoch: 68, train_loss: 0.2915, test_loss: 1.4306, test_f1: 0.6208
 epoch: 69, train_loss: 0.3160, test_loss: 1.5815, test_f1: 0.5823
 epoch: 70, train_loss: 0.3547, test_loss: 1.4518, test_f1: 0.6078
 epoch: 71, train_loss: 0.2943, test_loss: 1.3906, test_f1: 0.6377
 epoch: 72, train_loss: 0.2888, test_loss: 1.5962, test_f1: 0.6081
 epoch: 73, train_loss: 0.2891, test_loss: 1.7460, test_f1: 0.6415
 epoch: 74, train_loss: 0.3299, test_loss: 1.4149, test_f1: 0.6300
 epoch: 75, train_loss: 0.3030, test_loss: 1.4457, test_f1: 0.6564
 epoch: 76, train_loss: 0.2977, test_loss: 1.6051, test_f1: 0.6604
 epoch: 77, train_loss: 0.2914, test_loss: 1.5027, test_f1: 0.6227
 epoch: 78, train_loss: 0.2816, test_loss: 1.6145, test_f1: 0.6421
 epoch: 79, train_loss: 0.2884, test_loss: 1.7795, test_f1: 0.6402
 epoch: 80, train_loss: 0.2932, test_loss: 1.8767, test_f1: 0.6368
 epoch: 81, train_loss: 0.2973, test_loss: 1.4938, test_f1: 0.6401
 epoch: 82, train_loss: 0.2798, test_loss: 1.4764, test_f1: 0.6369
 epoch: 83, train_loss: 0.2952, test_loss: 1.7264, test_f1: 0.5972
 epoch: 84, train_loss: 0.2634, test_loss: 1.8882, test_f1: 0.5913
 epoch: 85, train_loss: 0.3169, test_loss: 1.5771, test_f1: 0.5876
 epoch: 86, train_loss: 0.3259, test_loss: 1.3053, test_f1: 0.6464
 epoch: 87, train_loss: 0.3113, test_loss: 1.5025, test_f1: 0.6400
 epoch: 88, train_loss: 0.2544, test_loss: 1.3568, test_f1: 0.6547
 epoch: 89, train_loss: 0.2541, test_loss: 1.6730, test_f1: 0.6122
 epoch: 90, train_loss: 0.2420, test_loss: 1.5717, test_f1: 0.6327
 epoch: 91, train_loss: 0.2694, test_loss: 1.7061, test_f1: 0.6479
 epoch: 92, train_loss: 0.2553, test_loss: 1.6828, test_f1: 0.6594
 epoch: 93, train_loss: 0.2685, test_loss: 1.9563, test_f1: 0.5976
 epoch: 94, train_loss: 0.2613, test_loss: 1.5026, test_f1: 0.6289
 epoch: 95, train_loss: 0.2195, test_loss: 1.9450, test_f1: 0.5834
 epoch: 96, train_loss: 0.2246, test_loss: 1.9458, test_f1: 0.6482
 epoch: 97, train_loss: 0.2302, test_loss: 1.8739, test_f1: 0.5739
 epoch: 98, train_loss: 0.2230, test_loss: 1.7989, test_f1: 0.6643
 epoch: 99, train_loss: 0.2583, test_loss: 1.5398, test_f1: 0.6363
##################ITERATION #8 ****************************************
 epoch: 0, train_loss: 1.5372, test_loss: 1.6663, test_f1: 0.2654
 epoch: 1, train_loss: 1.0714, test_loss: 1.3719, test_f1: 0.3566
 epoch: 2, train_loss: 0.9535, test_loss: 1.2085, test_f1: 0.4479
 epoch: 3, train_loss: 0.9365, test_loss: 1.5128, test_f1: 0.4394
 epoch: 4, train_loss: 0.9006, test_loss: 1.3382, test_f1: 0.4432
 epoch: 5, train_loss: 0.8655, test_loss: 1.1563, test_f1: 0.5521
 epoch: 6, train_loss: 0.8337, test_loss: 1.0845, test_f1: 0.5491
 epoch: 7, train_loss: 0.8215, test_loss: 0.9957, test_f1: 0.6043
 epoch: 8, train_loss: 0.7966, test_loss: 1.0202, test_f1: 0.5455
 epoch: 9, train_loss: 0.7631, test_loss: 1.1228, test_f1: 0.5606
 epoch: 10, train_loss: 0.7760, test_loss: 1.0874, test_f1: 0.5125
 epoch: 11, train_loss: 0.7850, test_loss: 1.0145, test_f1: 0.5848
 epoch: 12, train_loss: 0.7817, test_loss: 1.1313, test_f1: 0.4933
 epoch: 13, train_loss: 0.7551, test_loss: 1.0839, test_f1: 0.5810
 epoch: 14, train_loss: 0.7775, test_loss: 1.0514, test_f1: 0.5314
 epoch: 15, train_loss: 0.7586, test_loss: 0.9921, test_f1: 0.5635
 epoch: 16, train_loss: 0.7406, test_loss: 1.0173, test_f1: 0.5608
 epoch: 17, train_loss: 0.7233, test_loss: 1.0738, test_f1: 0.5728
 epoch: 18, train_loss: 0.6955, test_loss: 1.4187, test_f1: 0.4792
 epoch: 19, train_loss: 0.7160, test_loss: 1.0849, test_f1: 0.5721
 epoch: 20, train_loss: 0.6796, test_loss: 1.0392, test_f1: 0.5918
 epoch: 21, train_loss: 0.7008, test_loss: 1.0748, test_f1: 0.5461
 epoch: 22, train_loss: 0.7370, test_loss: 1.4772, test_f1: 0.5178
 epoch: 23, train_loss: 0.6750, test_loss: 0.9720, test_f1: 0.5760
 epoch: 24, train_loss: 0.6756, test_loss: 1.0314, test_f1: 0.6022
 epoch: 25, train_loss: 0.6309, test_loss: 1.0804, test_f1: 0.5406
 epoch: 26, train_loss: 0.6716, test_loss: 1.0006, test_f1: 0.5735
 epoch: 27, train_loss: 0.6611, test_loss: 0.9602, test_f1: 0.6343
 epoch: 28, train_loss: 0.6764, test_loss: 1.7225, test_f1: 0.4224
 epoch: 29, train_loss: 0.6647, test_loss: 1.0512, test_f1: 0.5898
 epoch: 30, train_loss: 0.6372, test_loss: 1.1142, test_f1: 0.6012
 epoch: 31, train_loss: 0.6137, test_loss: 1.3051, test_f1: 0.5805
 epoch: 32, train_loss: 0.5921, test_loss: 1.0563, test_f1: 0.5980
 epoch: 33, train_loss: 0.6246, test_loss: 1.4569, test_f1: 0.4861
 epoch: 34, train_loss: 0.6476, test_loss: 0.9582, test_f1: 0.6243
 epoch: 35, train_loss: 0.6254, test_loss: 1.2068, test_f1: 0.6270
 epoch: 36, train_loss: 0.5890, test_loss: 1.1607, test_f1: 0.5835
 epoch: 37, train_loss: 0.5955, test_loss: 1.3804, test_f1: 0.5161
 epoch: 38, train_loss: 0.6168, test_loss: 1.1361, test_f1: 0.6023
 epoch: 39, train_loss: 0.5872, test_loss: 1.3576, test_f1: 0.5520
 epoch: 40, train_loss: 0.5874, test_loss: 1.1327, test_f1: 0.5593
 epoch: 41, train_loss: 0.5796, test_loss: 0.9761, test_f1: 0.6217
 epoch: 42, train_loss: 0.5966, test_loss: 1.0945, test_f1: 0.6198
 epoch: 43, train_loss: 0.5458, test_loss: 0.9859, test_f1: 0.6449
 epoch: 44, train_loss: 0.5498, test_loss: 0.9807, test_f1: 0.6389
 epoch: 45, train_loss: 0.5289, test_loss: 1.0174, test_f1: 0.6111
 epoch: 46, train_loss: 0.5359, test_loss: 0.9615, test_f1: 0.6566
 epoch: 47, train_loss: 0.5378, test_loss: 1.0374, test_f1: 0.6537
 epoch: 48, train_loss: 0.5580, test_loss: 1.0819, test_f1: 0.6464
 epoch: 49, train_loss: 0.5345, test_loss: 1.0860, test_f1: 0.6400
 epoch: 50, train_loss: 0.5075, test_loss: 1.9864, test_f1: 0.3668
 epoch: 51, train_loss: 0.5089, test_loss: 1.2598, test_f1: 0.6169
 epoch: 52, train_loss: 0.4640, test_loss: 1.1335, test_f1: 0.6246
 epoch: 53, train_loss: 0.4448, test_loss: 1.1866, test_f1: 0.6380
 epoch: 54, train_loss: 0.4111, test_loss: 1.1889, test_f1: 0.6585
 epoch: 55, train_loss: 0.4163, test_loss: 1.1829, test_f1: 0.6474
 epoch: 56, train_loss: 0.4232, test_loss: 1.0481, test_f1: 0.6591
 epoch: 57, train_loss: 0.4165, test_loss: 1.1514, test_f1: 0.6531
 epoch: 58, train_loss: 0.4183, test_loss: 1.1202, test_f1: 0.6598
 epoch: 59, train_loss: 0.3990, test_loss: 1.2416, test_f1: 0.6240
 epoch: 60, train_loss: 0.4178, test_loss: 1.2189, test_f1: 0.6128
 epoch: 61, train_loss: 0.4079, test_loss: 1.4215, test_f1: 0.6204
 epoch: 62, train_loss: 0.3946, test_loss: 1.4017, test_f1: 0.5261
 epoch: 63, train_loss: 0.3878, test_loss: 1.2842, test_f1: 0.5913
 epoch: 64, train_loss: 0.3722, test_loss: 1.2497, test_f1: 0.6110
 epoch: 65, train_loss: 0.3988, test_loss: 1.2186, test_f1: 0.6489
 epoch: 66, train_loss: 0.4320, test_loss: 1.3926, test_f1: 0.5575
 epoch: 67, train_loss: 0.4448, test_loss: 1.3486, test_f1: 0.6216
 epoch: 68, train_loss: 0.4025, test_loss: 1.1778, test_f1: 0.6321
 epoch: 69, train_loss: 0.3791, test_loss: 1.2287, test_f1: 0.6153
 epoch: 70, train_loss: 0.3579, test_loss: 1.5564, test_f1: 0.5914
 epoch: 71, train_loss: 0.3548, test_loss: 1.5895, test_f1: 0.5925
 epoch: 72, train_loss: 0.3748, test_loss: 1.5429, test_f1: 0.5822
 epoch: 73, train_loss: 0.3461, test_loss: 1.8488, test_f1: 0.5559
 epoch: 74, train_loss: 0.4050, test_loss: 1.5357, test_f1: 0.6234
 epoch: 75, train_loss: 0.3894, test_loss: 1.2878, test_f1: 0.6249
 epoch: 76, train_loss: 0.3323, test_loss: 1.4989, test_f1: 0.6214
 epoch: 77, train_loss: 0.3988, test_loss: 1.7381, test_f1: 0.5771
 epoch: 78, train_loss: 0.3429, test_loss: 1.7463, test_f1: 0.5863
 epoch: 79, train_loss: 0.3536, test_loss: 1.6326, test_f1: 0.5923
 epoch: 80, train_loss: 0.3267, test_loss: 1.5412, test_f1: 0.5885
 epoch: 81, train_loss: 0.3476, test_loss: 1.4016, test_f1: 0.6180
 epoch: 82, train_loss: 0.3854, test_loss: 1.3451, test_f1: 0.6109
 epoch: 83, train_loss: 0.3686, test_loss: 1.5669, test_f1: 0.5605
 epoch: 84, train_loss: 0.3385, test_loss: 1.3936, test_f1: 0.5851
 epoch: 85, train_loss: 0.3303, test_loss: 1.6937, test_f1: 0.5658
 epoch: 86, train_loss: 0.3096, test_loss: 1.4315, test_f1: 0.6130
 epoch: 87, train_loss: 0.3157, test_loss: 1.4093, test_f1: 0.6335
 epoch: 88, train_loss: 0.3423, test_loss: 1.3101, test_f1: 0.6293
 epoch: 89, train_loss: 0.3196, test_loss: 1.6367, test_f1: 0.6351
 epoch: 90, train_loss: 0.3285, test_loss: 1.4274, test_f1: 0.6265
 epoch: 91, train_loss: 0.3190, test_loss: 1.6127, test_f1: 0.6243
 epoch: 92, train_loss: 0.3198, test_loss: 1.4481, test_f1: 0.6232
 epoch: 93, train_loss: 0.2990, test_loss: 1.7339, test_f1: 0.5785
 epoch: 94, train_loss: 0.3059, test_loss: 1.5221, test_f1: 0.5951
 epoch: 95, train_loss: 0.3066, test_loss: 1.6896, test_f1: 0.6103
 epoch: 96, train_loss: 0.3004, test_loss: 1.6737, test_f1: 0.5968
 epoch: 97, train_loss: 0.2981, test_loss: 1.6629, test_f1: 0.6003
 epoch: 98, train_loss: 0.2748, test_loss: 1.6430, test_f1: 0.6202
 epoch: 99, train_loss: 0.2741, test_loss: 1.8780, test_f1: 0.5757
##################ITERATION #9 ****************************************
 epoch: 0, train_loss: 1.4756, test_loss: 1.4557, test_f1: 0.2327
 epoch: 1, train_loss: 0.9829, test_loss: 1.2613, test_f1: 0.3497
 epoch: 2, train_loss: 0.9167, test_loss: 1.1115, test_f1: 0.4693
 epoch: 3, train_loss: 0.8760, test_loss: 1.1373, test_f1: 0.4604
 epoch: 4, train_loss: 0.8586, test_loss: 0.9882, test_f1: 0.5347
 epoch: 5, train_loss: 0.8274, test_loss: 1.1089, test_f1: 0.5227
 epoch: 6, train_loss: 0.8074, test_loss: 1.1094, test_f1: 0.5227
 epoch: 7, train_loss: 0.7787, test_loss: 0.9777, test_f1: 0.5919
 epoch: 8, train_loss: 0.7649, test_loss: 1.0374, test_f1: 0.5643
 epoch: 9, train_loss: 0.7572, test_loss: 1.0909, test_f1: 0.5323
 epoch: 10, train_loss: 0.7917, test_loss: 1.4973, test_f1: 0.4804
 epoch: 11, train_loss: 0.7288, test_loss: 1.3886, test_f1: 0.5306
 epoch: 12, train_loss: 0.7532, test_loss: 1.3687, test_f1: 0.5411
 epoch: 13, train_loss: 0.7176, test_loss: 1.0536, test_f1: 0.5282
 epoch: 14, train_loss: 0.7292, test_loss: 2.5074, test_f1: 0.4007
 epoch: 15, train_loss: 0.7114, test_loss: 1.0857, test_f1: 0.6038
 epoch: 16, train_loss: 0.6786, test_loss: 1.1227, test_f1: 0.6240
 epoch: 17, train_loss: 0.7026, test_loss: 1.0577, test_f1: 0.5618
 epoch: 18, train_loss: 0.6628, test_loss: 1.1088, test_f1: 0.6220
 epoch: 19, train_loss: 0.6611, test_loss: 1.3988, test_f1: 0.5634
 epoch: 20, train_loss: 0.6819, test_loss: 1.0426, test_f1: 0.5905
 epoch: 21, train_loss: 0.6201, test_loss: 1.2000, test_f1: 0.5360
 epoch: 22, train_loss: 0.6036, test_loss: 1.1770, test_f1: 0.6614
 epoch: 23, train_loss: 0.6055, test_loss: 1.3607, test_f1: 0.5915
 epoch: 24, train_loss: 0.5852, test_loss: 1.2390, test_f1: 0.5692
 epoch: 25, train_loss: 0.6054, test_loss: 1.4108, test_f1: 0.4800
 epoch: 26, train_loss: 0.6342, test_loss: 1.4470, test_f1: 0.4984
 epoch: 27, train_loss: 0.6029, test_loss: 1.1128, test_f1: 0.6195
 epoch: 28, train_loss: 0.5798, test_loss: 1.3659, test_f1: 0.6242
 epoch: 29, train_loss: 0.5764, test_loss: 1.6451, test_f1: 0.5700
 epoch: 30, train_loss: 0.5668, test_loss: 1.9040, test_f1: 0.4851
 epoch: 31, train_loss: 0.5533, test_loss: 1.8040, test_f1: 0.5312
 epoch: 32, train_loss: 0.5270, test_loss: 1.3270, test_f1: 0.5837
 epoch: 33, train_loss: 0.5535, test_loss: 1.3071, test_f1: 0.5938
 epoch: 34, train_loss: 0.5287, test_loss: 1.3891, test_f1: 0.5781
 epoch: 35, train_loss: 0.5182, test_loss: 1.2601, test_f1: 0.5686
 epoch: 36, train_loss: 0.5357, test_loss: 1.5998, test_f1: 0.4651
 epoch: 37, train_loss: 0.5432, test_loss: 1.7748, test_f1: 0.5895
 epoch: 38, train_loss: 0.5371, test_loss: 1.2827, test_f1: 0.5932
 epoch: 39, train_loss: 0.5382, test_loss: 1.5325, test_f1: 0.5866
 epoch: 40, train_loss: 0.5057, test_loss: 1.7112, test_f1: 0.5642
 epoch: 41, train_loss: 0.5118, test_loss: 1.5445, test_f1: 0.5817
 epoch: 42, train_loss: 0.5172, test_loss: 1.7996, test_f1: 0.5349
 epoch: 43, train_loss: 0.5194, test_loss: 1.3469, test_f1: 0.6269
 epoch: 44, train_loss: 0.4764, test_loss: 1.5800, test_f1: 0.5246
 epoch: 45, train_loss: 0.4892, test_loss: 1.3093, test_f1: 0.6250
 epoch: 46, train_loss: 0.4993, test_loss: 1.4720, test_f1: 0.5783
 epoch: 47, train_loss: 0.5066, test_loss: 1.2852, test_f1: 0.5664
 epoch: 48, train_loss: 0.4701, test_loss: 1.7161, test_f1: 0.5445
 epoch: 49, train_loss: 0.4691, test_loss: 1.1189, test_f1: 0.5969
 epoch: 50, train_loss: 0.4567, test_loss: 1.3807, test_f1: 0.5954
 epoch: 51, train_loss: 0.4218, test_loss: 1.4837, test_f1: 0.6358
 epoch: 52, train_loss: 0.3743, test_loss: 1.4497, test_f1: 0.6089
 epoch: 53, train_loss: 0.3859, test_loss: 1.4000, test_f1: 0.6173
 epoch: 54, train_loss: 0.3962, test_loss: 1.4577, test_f1: 0.6075
 epoch: 55, train_loss: 0.3442, test_loss: 1.5178, test_f1: 0.6160
 epoch: 56, train_loss: 0.3694, test_loss: 1.5012, test_f1: 0.5998
 epoch: 57, train_loss: 0.3742, test_loss: 1.4863, test_f1: 0.5999
 epoch: 58, train_loss: 0.3744, test_loss: 1.6556, test_f1: 0.6055
 epoch: 59, train_loss: 0.3325, test_loss: 1.7995, test_f1: 0.5931
 epoch: 60, train_loss: 0.3056, test_loss: 1.7112, test_f1: 0.6043
 epoch: 61, train_loss: 0.3588, test_loss: 1.6143, test_f1: 0.6181
 epoch: 62, train_loss: 0.3166, test_loss: 1.6592, test_f1: 0.6234
 epoch: 63, train_loss: 0.3344, test_loss: 1.7706, test_f1: 0.6142
 epoch: 64, train_loss: 0.3380, test_loss: 1.6558, test_f1: 0.6274
 epoch: 65, train_loss: 0.3010, test_loss: 1.9475, test_f1: 0.6053
 epoch: 66, train_loss: 0.2848, test_loss: 1.8191, test_f1: 0.5975
 epoch: 67, train_loss: 0.2777, test_loss: 1.9467, test_f1: 0.6069
 epoch: 68, train_loss: 0.2741, test_loss: 2.0306, test_f1: 0.5727
 epoch: 69, train_loss: 0.2842, test_loss: 2.3429, test_f1: 0.5958
 epoch: 70, train_loss: 0.3222, test_loss: 1.8984, test_f1: 0.6320
 epoch: 71, train_loss: 0.3085, test_loss: 2.0648, test_f1: 0.6244
 epoch: 72, train_loss: 0.3014, test_loss: 2.4594, test_f1: 0.6010
 epoch: 73, train_loss: 0.3090, test_loss: 2.0136, test_f1: 0.5973
 epoch: 74, train_loss: 0.3331, test_loss: 1.6024, test_f1: 0.6328
 epoch: 75, train_loss: 0.3238, test_loss: 1.8668, test_f1: 0.5865
 epoch: 76, train_loss: 0.3057, test_loss: 2.1965, test_f1: 0.5471
 epoch: 77, train_loss: 0.3302, test_loss: 1.9784, test_f1: 0.6166
 epoch: 78, train_loss: 0.3035, test_loss: 1.9978, test_f1: 0.6093
 epoch: 79, train_loss: 0.2766, test_loss: 2.1291, test_f1: 0.5992
 epoch: 80, train_loss: 0.2956, test_loss: 2.0480, test_f1: 0.5620
 epoch: 81, train_loss: 0.2978, test_loss: 2.0435, test_f1: 0.6477
 epoch: 82, train_loss: 0.2982, test_loss: 1.8773, test_f1: 0.5756
 epoch: 83, train_loss: 0.2708, test_loss: 1.9035, test_f1: 0.6122
 epoch: 84, train_loss: 0.2732, test_loss: 2.5309, test_f1: 0.6071
 epoch: 85, train_loss: 0.2879, test_loss: 2.7042, test_f1: 0.6092
 epoch: 86, train_loss: 0.2729, test_loss: 2.1313, test_f1: 0.5837
 epoch: 87, train_loss: 0.2706, test_loss: 2.0640, test_f1: 0.6337
 epoch: 88, train_loss: 0.2639, test_loss: 1.9307, test_f1: 0.6173
 epoch: 89, train_loss: 0.2602, test_loss: 2.1027, test_f1: 0.5695
 epoch: 90, train_loss: 0.2378, test_loss: 2.0123, test_f1: 0.5761
 epoch: 91, train_loss: 0.2461, test_loss: 2.2374, test_f1: 0.6016
 epoch: 92, train_loss: 0.2502, test_loss: 2.8752, test_f1: 0.5374
 epoch: 93, train_loss: 0.2812, test_loss: 2.0655, test_f1: 0.5746
 epoch: 94, train_loss: 0.2775, test_loss: 1.9839, test_f1: 0.5989
 epoch: 95, train_loss: 0.2582, test_loss: 2.0739, test_f1: 0.6204
 epoch: 96, train_loss: 0.2584, test_loss: 2.2373, test_f1: 0.5693
 epoch: 97, train_loss: 0.2473, test_loss: 2.0407, test_f1: 0.6097
 epoch: 98, train_loss: 0.2300, test_loss: 2.1474, test_f1: 0.6186
 epoch: 99, train_loss: 0.2267, test_loss: 2.1705, test_f1: 0.6033

Training completed in 339.29 seconds
Best F1: 0.6935 at epoch 39
Mean F1 across iterations: 0.6733  0.0133
========================FINAL RESULTS================================
FEGIN weighted F1: 0.6935  0.0133
python main.py --data ltspice_demos --representation component_pin --model FEGIN --layers 3 --hiddens 64 --batch_size 128 --lr 0.01 --emb_size 250 --epochs 100 --save_appendix component_pin_L3_H64_BS128_LR0.01_E250 --no_val
-----



STDERR:
  File "main.py", line 370, in <module>
    main()
  File "main.py", line 254, in main
    dataset = dataset_class(
  File "/home/philip/projects/ltspice_examples_code_repo/Circuit-Completion-Using-GNNs/component_classification_with_link_prediction_head/evaluation/FEGIN/kernel/circuit_datasets.py", line 15, in __init__
    self.data, self.slices = torch.load(self.processed_paths[0])
  File "/home/philip/.local/lib/python3.8/site-packages/torch/serialization.py", line 1040, in load
    warnings.warn(
  File "/usr/lib/python3.8/warnings.py", line 109, in _showwarnmsg
    sw(msg.message, msg.category, msg.filename, msg.lineno,
  File "main.py", line 47, in warn_with_traceback
    traceback.print_stack(file=log)
/home/philip/projects/ltspice_examples_code_repo/Circuit-Completion-Using-GNNs/component_classification_with_link_prediction_head/evaluation/FEGIN/kernel/circuit_datasets.py:15: FutureWarning: You are using `torch.load` with `weights_only=False` (the current default value), which uses the default pickle module implicitly. It is possible to construct malicious pickle data which will execute arbitrary code during unpickling (See https://github.com/pytorch/pytorch/blob/main/SECURITY.md#untrusted-models for more details). In a future release, the default value for `weights_only` will be flipped to `True`. This limits the functions that could be executed during unpickling. Arbitrary objects will no longer be allowed to be loaded via this mode unless they are explicitly allowlisted by the user via `torch.serialization.add_safe_globals`. We recommend you start setting `weights_only=True` for any use case where you don't have full control of the loaded file. Please open an issue on GitHub for any issues related to this experimental feature.
  self.data, self.slices = torch.load(self.processed_paths[0])
