STDOUT:
Results will be saved in /home/philip/projects/ltspice_examples_code_repo/Circuit-Completion-Using-GNNs/component_classification_with_link_prediction_head/evaluation/FEGIN/results/model_FEGIN_dataset_ltspice_examples
Command line input: python main.py --data ltspice_examples --representation component_component --model FEGIN --layers 2 --hiddens 64 --batch_size 64 --lr 0.0001 --emb_size 128 --epochs 100 --save_appendix component_component_L2_H64_BS64_LR0.0001_E128 --no_val
 is saved.
-----
ltspice_examples - FEGIN
Using 2 layers, 64 hidden units, h = 2
Loading component_component representation dataset
ENTERED
Training FEGIN on component_component representation
Train: 3556, Test: 845
##################ITERATION #0 ****************************************
 epoch: 0, train_loss: 1.3872, test_loss: 1.3789, test_f1: 0.2515
 epoch: 1, train_loss: 1.3651, test_loss: 1.3565, test_f1: 0.2552
 epoch: 2, train_loss: 1.3445, test_loss: 1.3288, test_f1: 0.2530
 epoch: 3, train_loss: 1.3180, test_loss: 1.2956, test_f1: 0.2670
 epoch: 4, train_loss: 1.2894, test_loss: 1.2668, test_f1: 0.2610
 epoch: 5, train_loss: 1.2659, test_loss: 1.2404, test_f1: 0.3161
 epoch: 6, train_loss: 1.2453, test_loss: 1.2200, test_f1: 0.3392
 epoch: 7, train_loss: 1.2292, test_loss: 1.2009, test_f1: 0.3502
 epoch: 8, train_loss: 1.2131, test_loss: 1.1839, test_f1: 0.3479
 epoch: 9, train_loss: 1.2015, test_loss: 1.1670, test_f1: 0.3474
 epoch: 10, train_loss: 1.1876, test_loss: 1.1553, test_f1: 0.3596
 epoch: 11, train_loss: 1.1768, test_loss: 1.1438, test_f1: 0.3565
 epoch: 12, train_loss: 1.1686, test_loss: 1.1328, test_f1: 0.3683
 epoch: 13, train_loss: 1.1562, test_loss: 1.1217, test_f1: 0.3846
 epoch: 14, train_loss: 1.1483, test_loss: 1.1105, test_f1: 0.3989
 epoch: 15, train_loss: 1.1338, test_loss: 1.1015, test_f1: 0.4196
 epoch: 16, train_loss: 1.1288, test_loss: 1.0937, test_f1: 0.4321
 epoch: 17, train_loss: 1.1264, test_loss: 1.0857, test_f1: 0.4370
 epoch: 18, train_loss: 1.1139, test_loss: 1.0778, test_f1: 0.4489
 epoch: 19, train_loss: 1.1038, test_loss: 1.0702, test_f1: 0.4561
 epoch: 20, train_loss: 1.1040, test_loss: 1.0613, test_f1: 0.4570
 epoch: 21, train_loss: 1.0924, test_loss: 1.0581, test_f1: 0.4693
 epoch: 22, train_loss: 1.0809, test_loss: 1.0499, test_f1: 0.4717
 epoch: 23, train_loss: 1.0777, test_loss: 1.0419, test_f1: 0.4765
 epoch: 24, train_loss: 1.0686, test_loss: 1.0338, test_f1: 0.4754
 epoch: 25, train_loss: 1.0679, test_loss: 1.0270, test_f1: 0.4738
 epoch: 26, train_loss: 1.0606, test_loss: 1.0234, test_f1: 0.4700
 epoch: 27, train_loss: 1.0551, test_loss: 1.0172, test_f1: 0.4919
 epoch: 28, train_loss: 1.0494, test_loss: 1.0094, test_f1: 0.4730
 epoch: 29, train_loss: 1.0403, test_loss: 0.9997, test_f1: 0.4799
 epoch: 30, train_loss: 1.0344, test_loss: 0.9965, test_f1: 0.4730
 epoch: 31, train_loss: 1.0343, test_loss: 0.9922, test_f1: 0.4832
 epoch: 32, train_loss: 1.0232, test_loss: 0.9918, test_f1: 0.4950
 epoch: 33, train_loss: 1.0220, test_loss: 0.9793, test_f1: 0.4952
 epoch: 34, train_loss: 1.0120, test_loss: 0.9760, test_f1: 0.4969
 epoch: 35, train_loss: 1.0097, test_loss: 0.9747, test_f1: 0.4881
 epoch: 36, train_loss: 1.0009, test_loss: 0.9666, test_f1: 0.5079
 epoch: 37, train_loss: 0.9935, test_loss: 0.9616, test_f1: 0.5097
 epoch: 38, train_loss: 0.9892, test_loss: 0.9580, test_f1: 0.4867
 epoch: 39, train_loss: 0.9853, test_loss: 0.9617, test_f1: 0.4888
 epoch: 40, train_loss: 0.9848, test_loss: 0.9513, test_f1: 0.4940
 epoch: 41, train_loss: 0.9737, test_loss: 0.9523, test_f1: 0.4943
 epoch: 42, train_loss: 0.9750, test_loss: 0.9532, test_f1: 0.4952
 epoch: 43, train_loss: 0.9683, test_loss: 0.9449, test_f1: 0.4950
 epoch: 44, train_loss: 0.9525, test_loss: 0.9481, test_f1: 0.4957
 epoch: 45, train_loss: 0.9678, test_loss: 0.9444, test_f1: 0.5013
 epoch: 46, train_loss: 0.9468, test_loss: 0.9405, test_f1: 0.4950
 epoch: 47, train_loss: 0.9434, test_loss: 0.9291, test_f1: 0.5047
 epoch: 48, train_loss: 0.9449, test_loss: 0.9383, test_f1: 0.5023
 epoch: 49, train_loss: 0.9418, test_loss: 0.9417, test_f1: 0.4889
 epoch: 50, train_loss: 0.9402, test_loss: 0.9402, test_f1: 0.4864
 epoch: 51, train_loss: 0.9314, test_loss: 0.9363, test_f1: 0.4901
 epoch: 52, train_loss: 0.9297, test_loss: 0.9315, test_f1: 0.5035
 epoch: 53, train_loss: 0.9200, test_loss: 0.9263, test_f1: 0.5013
 epoch: 54, train_loss: 0.9216, test_loss: 0.9361, test_f1: 0.4973
 epoch: 55, train_loss: 0.9212, test_loss: 0.9314, test_f1: 0.4971
 epoch: 56, train_loss: 0.9228, test_loss: 0.9280, test_f1: 0.4972
 epoch: 57, train_loss: 0.9242, test_loss: 0.9364, test_f1: 0.4973
 epoch: 58, train_loss: 0.9134, test_loss: 0.9354, test_f1: 0.5010
 epoch: 59, train_loss: 0.9115, test_loss: 0.9352, test_f1: 0.5003
 epoch: 60, train_loss: 0.9153, test_loss: 0.9320, test_f1: 0.5050
 epoch: 61, train_loss: 0.9101, test_loss: 0.9296, test_f1: 0.5104
 epoch: 62, train_loss: 0.9174, test_loss: 0.9340, test_f1: 0.5032
 epoch: 63, train_loss: 0.9080, test_loss: 0.9375, test_f1: 0.4998
 epoch: 64, train_loss: 0.9025, test_loss: 0.9316, test_f1: 0.5006
 epoch: 65, train_loss: 0.9088, test_loss: 0.9307, test_f1: 0.4952
 epoch: 66, train_loss: 0.8989, test_loss: 0.9297, test_f1: 0.5215
 epoch: 67, train_loss: 0.8989, test_loss: 0.9294, test_f1: 0.5218
 epoch: 68, train_loss: 0.8960, test_loss: 0.9311, test_f1: 0.5223
 epoch: 69, train_loss: 0.8955, test_loss: 0.9363, test_f1: 0.5024
 epoch: 70, train_loss: 0.9010, test_loss: 0.9266, test_f1: 0.5078
 epoch: 71, train_loss: 0.8980, test_loss: 0.9317, test_f1: 0.5272
 epoch: 72, train_loss: 0.8966, test_loss: 0.9241, test_f1: 0.5216
 epoch: 73, train_loss: 0.8972, test_loss: 0.9281, test_f1: 0.5125
 epoch: 74, train_loss: 0.8857, test_loss: 0.9353, test_f1: 0.5253
 epoch: 75, train_loss: 0.8829, test_loss: 0.9305, test_f1: 0.5044
 epoch: 76, train_loss: 0.8899, test_loss: 0.9325, test_f1: 0.5241
 epoch: 77, train_loss: 0.8895, test_loss: 0.9330, test_f1: 0.5185
 epoch: 78, train_loss: 0.8904, test_loss: 0.9325, test_f1: 0.5262
 epoch: 79, train_loss: 0.8846, test_loss: 0.9337, test_f1: 0.5261
 epoch: 80, train_loss: 0.8821, test_loss: 0.9389, test_f1: 0.5031
 epoch: 81, train_loss: 0.8847, test_loss: 0.9347, test_f1: 0.5008
 epoch: 82, train_loss: 0.8816, test_loss: 0.9309, test_f1: 0.5255
 epoch: 83, train_loss: 0.8757, test_loss: 0.9386, test_f1: 0.5118
 epoch: 84, train_loss: 0.8819, test_loss: 0.9318, test_f1: 0.5194
 epoch: 85, train_loss: 0.8780, test_loss: 0.9294, test_f1: 0.5199
 epoch: 86, train_loss: 0.8750, test_loss: 0.9390, test_f1: 0.5228
 epoch: 87, train_loss: 0.8725, test_loss: 0.9349, test_f1: 0.5189
 epoch: 88, train_loss: 0.8754, test_loss: 0.9310, test_f1: 0.5183
 epoch: 89, train_loss: 0.8824, test_loss: 0.9366, test_f1: 0.5227
 epoch: 90, train_loss: 0.8730, test_loss: 0.9380, test_f1: 0.5143
 epoch: 91, train_loss: 0.8717, test_loss: 0.9374, test_f1: 0.5207
 epoch: 92, train_loss: 0.8719, test_loss: 0.9317, test_f1: 0.5243
 epoch: 93, train_loss: 0.8768, test_loss: 0.9433, test_f1: 0.5237
 epoch: 94, train_loss: 0.8699, test_loss: 0.9388, test_f1: 0.5171
 epoch: 95, train_loss: 0.8757, test_loss: 0.9358, test_f1: 0.5181
 epoch: 96, train_loss: 0.8642, test_loss: 0.9304, test_f1: 0.5158
 epoch: 97, train_loss: 0.8682, test_loss: 0.9385, test_f1: 0.5237
 epoch: 98, train_loss: 0.8658, test_loss: 0.9389, test_f1: 0.5237
 epoch: 99, train_loss: 0.8611, test_loss: 0.9339, test_f1: 0.5182
##################ITERATION #1 ****************************************
 epoch: 0, train_loss: 1.3479, test_loss: 1.3095, test_f1: 0.2274
 epoch: 1, train_loss: 1.2903, test_loss: 1.2710, test_f1: 0.2274
 epoch: 2, train_loss: 1.2642, test_loss: 1.2445, test_f1: 0.2274
 epoch: 3, train_loss: 1.2462, test_loss: 1.2272, test_f1: 0.2487
 epoch: 4, train_loss: 1.2297, test_loss: 1.2125, test_f1: 0.2654
 epoch: 5, train_loss: 1.2162, test_loss: 1.1947, test_f1: 0.3013
 epoch: 6, train_loss: 1.2065, test_loss: 1.1732, test_f1: 0.4128
 epoch: 7, train_loss: 1.1899, test_loss: 1.1593, test_f1: 0.4309
 epoch: 8, train_loss: 1.1743, test_loss: 1.1439, test_f1: 0.4218
 epoch: 9, train_loss: 1.1591, test_loss: 1.1234, test_f1: 0.4140
 epoch: 10, train_loss: 1.1428, test_loss: 1.1087, test_f1: 0.4107
 epoch: 11, train_loss: 1.1300, test_loss: 1.0957, test_f1: 0.4146
 epoch: 12, train_loss: 1.1171, test_loss: 1.0820, test_f1: 0.4190
 epoch: 13, train_loss: 1.1005, test_loss: 1.0655, test_f1: 0.4513
 epoch: 14, train_loss: 1.0949, test_loss: 1.0559, test_f1: 0.4324
 epoch: 15, train_loss: 1.0761, test_loss: 1.0392, test_f1: 0.4333
 epoch: 16, train_loss: 1.0669, test_loss: 1.0325, test_f1: 0.4563
 epoch: 17, train_loss: 1.0594, test_loss: 1.0203, test_f1: 0.4661
 epoch: 18, train_loss: 1.0502, test_loss: 1.0108, test_f1: 0.4692
 epoch: 19, train_loss: 1.0425, test_loss: 1.0067, test_f1: 0.4670
 epoch: 20, train_loss: 1.0347, test_loss: 0.9975, test_f1: 0.4728
 epoch: 21, train_loss: 1.0284, test_loss: 0.9958, test_f1: 0.4596
 epoch: 22, train_loss: 1.0285, test_loss: 0.9928, test_f1: 0.4941
 epoch: 23, train_loss: 1.0093, test_loss: 0.9787, test_f1: 0.4700
 epoch: 24, train_loss: 1.0040, test_loss: 0.9732, test_f1: 0.4888
 epoch: 25, train_loss: 1.0084, test_loss: 0.9738, test_f1: 0.4738
 epoch: 26, train_loss: 0.9925, test_loss: 0.9925, test_f1: 0.4877
 epoch: 27, train_loss: 0.9960, test_loss: 0.9728, test_f1: 0.4960
 epoch: 28, train_loss: 0.9778, test_loss: 0.9744, test_f1: 0.4842
 epoch: 29, train_loss: 0.9763, test_loss: 0.9741, test_f1: 0.4861
 epoch: 30, train_loss: 0.9753, test_loss: 0.9605, test_f1: 0.5029
 epoch: 31, train_loss: 0.9672, test_loss: 0.9746, test_f1: 0.4911
 epoch: 32, train_loss: 0.9605, test_loss: 0.9710, test_f1: 0.5087
 epoch: 33, train_loss: 0.9557, test_loss: 0.9594, test_f1: 0.4991
 epoch: 34, train_loss: 0.9579, test_loss: 0.9694, test_f1: 0.4974
 epoch: 35, train_loss: 0.9479, test_loss: 0.9897, test_f1: 0.4899
 epoch: 36, train_loss: 0.9549, test_loss: 0.9736, test_f1: 0.4943
 epoch: 37, train_loss: 0.9464, test_loss: 0.9649, test_f1: 0.5001
 epoch: 38, train_loss: 0.9330, test_loss: 0.9647, test_f1: 0.4931
 epoch: 39, train_loss: 0.9423, test_loss: 0.9665, test_f1: 0.4889
 epoch: 40, train_loss: 0.9331, test_loss: 0.9482, test_f1: 0.5076
 epoch: 41, train_loss: 0.9252, test_loss: 0.9915, test_f1: 0.4885
 epoch: 42, train_loss: 0.9235, test_loss: 0.9579, test_f1: 0.4901
 epoch: 43, train_loss: 0.9268, test_loss: 0.9459, test_f1: 0.4962
 epoch: 44, train_loss: 0.9164, test_loss: 1.0011, test_f1: 0.4843
 epoch: 45, train_loss: 0.9138, test_loss: 0.9701, test_f1: 0.4845
 epoch: 46, train_loss: 0.9183, test_loss: 0.9852, test_f1: 0.4810
 epoch: 47, train_loss: 0.9096, test_loss: 0.9694, test_f1: 0.4835
 epoch: 48, train_loss: 0.9043, test_loss: 0.9604, test_f1: 0.4850
 epoch: 49, train_loss: 0.9072, test_loss: 0.9704, test_f1: 0.4902
 epoch: 50, train_loss: 0.9057, test_loss: 0.9830, test_f1: 0.4898
 epoch: 51, train_loss: 0.8985, test_loss: 0.9675, test_f1: 0.4861
 epoch: 52, train_loss: 0.8956, test_loss: 0.9779, test_f1: 0.4868
 epoch: 53, train_loss: 0.8893, test_loss: 0.9755, test_f1: 0.4899
 epoch: 54, train_loss: 0.8887, test_loss: 0.9695, test_f1: 0.4910
 epoch: 55, train_loss: 0.8877, test_loss: 0.9751, test_f1: 0.4858
 epoch: 56, train_loss: 0.8828, test_loss: 0.9847, test_f1: 0.4845
 epoch: 57, train_loss: 0.8865, test_loss: 0.9687, test_f1: 0.4879
 epoch: 58, train_loss: 0.8855, test_loss: 0.9669, test_f1: 0.4866
 epoch: 59, train_loss: 0.8818, test_loss: 0.9777, test_f1: 0.4909
 epoch: 60, train_loss: 0.8834, test_loss: 0.9802, test_f1: 0.4879
 epoch: 61, train_loss: 0.8832, test_loss: 0.9753, test_f1: 0.4874
 epoch: 62, train_loss: 0.8820, test_loss: 0.9747, test_f1: 0.4970
 epoch: 63, train_loss: 0.8839, test_loss: 0.9774, test_f1: 0.4927
 epoch: 64, train_loss: 0.8759, test_loss: 0.9739, test_f1: 0.4980
 epoch: 65, train_loss: 0.8805, test_loss: 0.9706, test_f1: 0.4919
 epoch: 66, train_loss: 0.8748, test_loss: 0.9785, test_f1: 0.4888
 epoch: 67, train_loss: 0.8690, test_loss: 0.9654, test_f1: 0.5042
 epoch: 68, train_loss: 0.8794, test_loss: 0.9725, test_f1: 0.4944
 epoch: 69, train_loss: 0.8730, test_loss: 0.9623, test_f1: 0.4916
 epoch: 70, train_loss: 0.8677, test_loss: 0.9759, test_f1: 0.4971
 epoch: 71, train_loss: 0.8771, test_loss: 0.9901, test_f1: 0.4869
 epoch: 72, train_loss: 0.8752, test_loss: 0.9651, test_f1: 0.5008
 epoch: 73, train_loss: 0.8705, test_loss: 0.9650, test_f1: 0.5033
 epoch: 74, train_loss: 0.8681, test_loss: 0.9563, test_f1: 0.5087
 epoch: 75, train_loss: 0.8653, test_loss: 0.9689, test_f1: 0.4995
 epoch: 76, train_loss: 0.8705, test_loss: 0.9729, test_f1: 0.5072
 epoch: 77, train_loss: 0.8638, test_loss: 0.9767, test_f1: 0.5022
 epoch: 78, train_loss: 0.8655, test_loss: 0.9739, test_f1: 0.4982
 epoch: 79, train_loss: 0.8598, test_loss: 0.9893, test_f1: 0.4952
 epoch: 80, train_loss: 0.8656, test_loss: 0.9915, test_f1: 0.4860
 epoch: 81, train_loss: 0.8676, test_loss: 0.9745, test_f1: 0.5045
 epoch: 82, train_loss: 0.8593, test_loss: 0.9867, test_f1: 0.4984
 epoch: 83, train_loss: 0.8552, test_loss: 0.9721, test_f1: 0.5066
 epoch: 84, train_loss: 0.8596, test_loss: 0.9759, test_f1: 0.4980
 epoch: 85, train_loss: 0.8556, test_loss: 0.9851, test_f1: 0.5018
 epoch: 86, train_loss: 0.8538, test_loss: 0.9706, test_f1: 0.5092
 epoch: 87, train_loss: 0.8443, test_loss: 0.9705, test_f1: 0.4966
 epoch: 88, train_loss: 0.8509, test_loss: 0.9919, test_f1: 0.4992
 epoch: 89, train_loss: 0.8588, test_loss: 0.9786, test_f1: 0.4882
 epoch: 90, train_loss: 0.8462, test_loss: 0.9972, test_f1: 0.4992
 epoch: 91, train_loss: 0.8444, test_loss: 0.9689, test_f1: 0.5093
 epoch: 92, train_loss: 0.8439, test_loss: 0.9792, test_f1: 0.5025
 epoch: 93, train_loss: 0.8454, test_loss: 0.9805, test_f1: 0.5096
 epoch: 94, train_loss: 0.8520, test_loss: 0.9838, test_f1: 0.5049
 epoch: 95, train_loss: 0.8381, test_loss: 0.9986, test_f1: 0.5018
 epoch: 96, train_loss: 0.8440, test_loss: 0.9830, test_f1: 0.4986
 epoch: 97, train_loss: 0.8390, test_loss: 0.9747, test_f1: 0.5000
 epoch: 98, train_loss: 0.8405, test_loss: 0.9920, test_f1: 0.5045
 epoch: 99, train_loss: 0.8408, test_loss: 0.9810, test_f1: 0.5143
##################ITERATION #2 ****************************************
 epoch: 0, train_loss: 1.3685, test_loss: 1.3122, test_f1: 0.3268
 epoch: 1, train_loss: 1.2867, test_loss: 1.2481, test_f1: 0.3602
 epoch: 2, train_loss: 1.2621, test_loss: 1.2187, test_f1: 0.3751
 epoch: 3, train_loss: 1.2381, test_loss: 1.1963, test_f1: 0.4050
 epoch: 4, train_loss: 1.2226, test_loss: 1.1812, test_f1: 0.4243
 epoch: 5, train_loss: 1.2063, test_loss: 1.1638, test_f1: 0.4289
 epoch: 6, train_loss: 1.2002, test_loss: 1.1511, test_f1: 0.4264
 epoch: 7, train_loss: 1.1874, test_loss: 1.1363, test_f1: 0.4353
 epoch: 8, train_loss: 1.1756, test_loss: 1.1256, test_f1: 0.4316
 epoch: 9, train_loss: 1.1603, test_loss: 1.1167, test_f1: 0.4482
 epoch: 10, train_loss: 1.1446, test_loss: 1.1025, test_f1: 0.4450
 epoch: 11, train_loss: 1.1408, test_loss: 1.0912, test_f1: 0.4464
 epoch: 12, train_loss: 1.1328, test_loss: 1.0813, test_f1: 0.4552
 epoch: 13, train_loss: 1.1220, test_loss: 1.0681, test_f1: 0.4535
 epoch: 14, train_loss: 1.1143, test_loss: 1.0677, test_f1: 0.4465
 epoch: 15, train_loss: 1.1049, test_loss: 1.0521, test_f1: 0.4601
 epoch: 16, train_loss: 1.0985, test_loss: 1.0446, test_f1: 0.4548
 epoch: 17, train_loss: 1.0832, test_loss: 1.0395, test_f1: 0.4416
 epoch: 18, train_loss: 1.0765, test_loss: 1.0315, test_f1: 0.4645
 epoch: 19, train_loss: 1.0747, test_loss: 1.0211, test_f1: 0.4779
 epoch: 20, train_loss: 1.0611, test_loss: 1.0200, test_f1: 0.4735
 epoch: 21, train_loss: 1.0541, test_loss: 1.0119, test_f1: 0.4904
 epoch: 22, train_loss: 1.0504, test_loss: 1.0038, test_f1: 0.4768
 epoch: 23, train_loss: 1.0493, test_loss: 0.9982, test_f1: 0.4974
 epoch: 24, train_loss: 1.0444, test_loss: 0.9924, test_f1: 0.5015
 epoch: 25, train_loss: 1.0305, test_loss: 0.9888, test_f1: 0.4933
 epoch: 26, train_loss: 1.0257, test_loss: 0.9863, test_f1: 0.4967
 epoch: 27, train_loss: 1.0199, test_loss: 0.9775, test_f1: 0.4704
 epoch: 28, train_loss: 1.0161, test_loss: 0.9779, test_f1: 0.4912
 epoch: 29, train_loss: 1.0091, test_loss: 0.9748, test_f1: 0.4948
 epoch: 30, train_loss: 1.0053, test_loss: 0.9646, test_f1: 0.4995
 epoch: 31, train_loss: 1.0024, test_loss: 0.9665, test_f1: 0.4890
 epoch: 32, train_loss: 0.9959, test_loss: 0.9635, test_f1: 0.4889
 epoch: 33, train_loss: 0.9949, test_loss: 0.9579, test_f1: 0.4953
 epoch: 34, train_loss: 0.9794, test_loss: 0.9681, test_f1: 0.4930
 epoch: 35, train_loss: 0.9816, test_loss: 0.9585, test_f1: 0.4857
 epoch: 36, train_loss: 0.9806, test_loss: 0.9464, test_f1: 0.4797
 epoch: 37, train_loss: 0.9746, test_loss: 0.9559, test_f1: 0.4838
 epoch: 38, train_loss: 0.9689, test_loss: 0.9444, test_f1: 0.4800
 epoch: 39, train_loss: 0.9684, test_loss: 0.9698, test_f1: 0.4525
 epoch: 40, train_loss: 0.9593, test_loss: 0.9563, test_f1: 0.4840
 epoch: 41, train_loss: 0.9597, test_loss: 0.9465, test_f1: 0.5061
 epoch: 42, train_loss: 0.9539, test_loss: 0.9497, test_f1: 0.5008
 epoch: 43, train_loss: 0.9535, test_loss: 0.9660, test_f1: 0.4623
 epoch: 44, train_loss: 0.9400, test_loss: 0.9405, test_f1: 0.5100
 epoch: 45, train_loss: 0.9401, test_loss: 0.9556, test_f1: 0.4661
 epoch: 46, train_loss: 0.9392, test_loss: 0.9586, test_f1: 0.4757
 epoch: 47, train_loss: 0.9421, test_loss: 0.9487, test_f1: 0.4876
 epoch: 48, train_loss: 0.9317, test_loss: 0.9450, test_f1: 0.4851
 epoch: 49, train_loss: 0.9293, test_loss: 0.9444, test_f1: 0.5082
 epoch: 50, train_loss: 0.9277, test_loss: 0.9583, test_f1: 0.4979
 epoch: 51, train_loss: 0.9230, test_loss: 0.9492, test_f1: 0.4925
 epoch: 52, train_loss: 0.9183, test_loss: 0.9443, test_f1: 0.5062
 epoch: 53, train_loss: 0.9154, test_loss: 0.9638, test_f1: 0.4639
 epoch: 54, train_loss: 0.9156, test_loss: 0.9508, test_f1: 0.4780
 epoch: 55, train_loss: 0.9137, test_loss: 0.9494, test_f1: 0.4947
 epoch: 56, train_loss: 0.9091, test_loss: 0.9352, test_f1: 0.5189
 epoch: 57, train_loss: 0.9113, test_loss: 0.9374, test_f1: 0.5170
 epoch: 58, train_loss: 0.9106, test_loss: 0.9424, test_f1: 0.4950
 epoch: 59, train_loss: 0.9116, test_loss: 0.9486, test_f1: 0.5044
 epoch: 60, train_loss: 0.9075, test_loss: 0.9596, test_f1: 0.4762
 epoch: 61, train_loss: 0.9077, test_loss: 0.9458, test_f1: 0.5001
 epoch: 62, train_loss: 0.9082, test_loss: 0.9509, test_f1: 0.5144
 epoch: 63, train_loss: 0.8938, test_loss: 0.9501, test_f1: 0.4982
 epoch: 64, train_loss: 0.9063, test_loss: 0.9542, test_f1: 0.4993
 epoch: 65, train_loss: 0.8979, test_loss: 0.9549, test_f1: 0.4956
 epoch: 66, train_loss: 0.8974, test_loss: 0.9530, test_f1: 0.4904
 epoch: 67, train_loss: 0.8931, test_loss: 0.9692, test_f1: 0.4879
 epoch: 68, train_loss: 0.8928, test_loss: 0.9486, test_f1: 0.5121
 epoch: 69, train_loss: 0.8865, test_loss: 0.9664, test_f1: 0.4862
 epoch: 70, train_loss: 0.8953, test_loss: 0.9797, test_f1: 0.4901
 epoch: 71, train_loss: 0.8864, test_loss: 0.9430, test_f1: 0.5219
 epoch: 72, train_loss: 0.8919, test_loss: 0.9559, test_f1: 0.5039
 epoch: 73, train_loss: 0.8884, test_loss: 0.9637, test_f1: 0.4983
 epoch: 74, train_loss: 0.8835, test_loss: 0.9800, test_f1: 0.4941
 epoch: 75, train_loss: 0.8809, test_loss: 0.9456, test_f1: 0.5021
 epoch: 76, train_loss: 0.8783, test_loss: 0.9775, test_f1: 0.4876
 epoch: 77, train_loss: 0.8818, test_loss: 0.9592, test_f1: 0.5098
 epoch: 78, train_loss: 0.8755, test_loss: 0.9458, test_f1: 0.5259
 epoch: 79, train_loss: 0.8890, test_loss: 0.9685, test_f1: 0.4827
 epoch: 80, train_loss: 0.8779, test_loss: 0.9462, test_f1: 0.5261
 epoch: 81, train_loss: 0.8775, test_loss: 0.9373, test_f1: 0.5229
 epoch: 82, train_loss: 0.8743, test_loss: 0.9456, test_f1: 0.5118
 epoch: 83, train_loss: 0.8607, test_loss: 0.9502, test_f1: 0.5165
 epoch: 84, train_loss: 0.8841, test_loss: 0.9428, test_f1: 0.5095
 epoch: 85, train_loss: 0.8858, test_loss: 0.9614, test_f1: 0.4927
 epoch: 86, train_loss: 0.8680, test_loss: 0.9646, test_f1: 0.4921
 epoch: 87, train_loss: 0.8684, test_loss: 0.9540, test_f1: 0.5088
 epoch: 88, train_loss: 0.8721, test_loss: 0.9580, test_f1: 0.5198
 epoch: 89, train_loss: 0.8617, test_loss: 0.9383, test_f1: 0.5250
 epoch: 90, train_loss: 0.8649, test_loss: 0.9439, test_f1: 0.5275
 epoch: 91, train_loss: 0.8673, test_loss: 0.9515, test_f1: 0.5182
 epoch: 92, train_loss: 0.8634, test_loss: 0.9778, test_f1: 0.4990
 epoch: 93, train_loss: 0.8669, test_loss: 0.9460, test_f1: 0.5299
 epoch: 94, train_loss: 0.8667, test_loss: 0.9467, test_f1: 0.5248
 epoch: 95, train_loss: 0.8550, test_loss: 0.9663, test_f1: 0.4998
 epoch: 96, train_loss: 0.8528, test_loss: 0.9438, test_f1: 0.5269
 epoch: 97, train_loss: 0.8479, test_loss: 0.9577, test_f1: 0.5087
 epoch: 98, train_loss: 0.8625, test_loss: 0.9426, test_f1: 0.5263
 epoch: 99, train_loss: 0.8485, test_loss: 0.9713, test_f1: 0.4902
##################ITERATION #3 ****************************************
 epoch: 0, train_loss: 1.3063, test_loss: 1.2509, test_f1: 0.2656
 epoch: 1, train_loss: 1.2473, test_loss: 1.2049, test_f1: 0.3405
 epoch: 2, train_loss: 1.2254, test_loss: 1.1815, test_f1: 0.3856
 epoch: 3, train_loss: 1.2019, test_loss: 1.1642, test_f1: 0.4056
 epoch: 4, train_loss: 1.1929, test_loss: 1.1472, test_f1: 0.4207
 epoch: 5, train_loss: 1.1793, test_loss: 1.1315, test_f1: 0.4377
 epoch: 6, train_loss: 1.1643, test_loss: 1.1178, test_f1: 0.4359
 epoch: 7, train_loss: 1.1533, test_loss: 1.1050, test_f1: 0.4386
 epoch: 8, train_loss: 1.1447, test_loss: 1.0912, test_f1: 0.4309
 epoch: 9, train_loss: 1.1242, test_loss: 1.0833, test_f1: 0.4243
 epoch: 10, train_loss: 1.1250, test_loss: 1.0769, test_f1: 0.4501
 epoch: 11, train_loss: 1.1121, test_loss: 1.0702, test_f1: 0.4456
 epoch: 12, train_loss: 1.0978, test_loss: 1.0536, test_f1: 0.4608
 epoch: 13, train_loss: 1.0955, test_loss: 1.0508, test_f1: 0.4544
 epoch: 14, train_loss: 1.0837, test_loss: 1.0392, test_f1: 0.4578
 epoch: 15, train_loss: 1.0768, test_loss: 1.0325, test_f1: 0.4610
 epoch: 16, train_loss: 1.0631, test_loss: 1.0291, test_f1: 0.4655
 epoch: 17, train_loss: 1.0622, test_loss: 1.0144, test_f1: 0.4670
 epoch: 18, train_loss: 1.0573, test_loss: 1.0061, test_f1: 0.4712
 epoch: 19, train_loss: 1.0464, test_loss: 1.0052, test_f1: 0.4692
 epoch: 20, train_loss: 1.0410, test_loss: 1.0052, test_f1: 0.4734
 epoch: 21, train_loss: 1.0321, test_loss: 0.9929, test_f1: 0.4750
 epoch: 22, train_loss: 1.0289, test_loss: 0.9871, test_f1: 0.4773
 epoch: 23, train_loss: 1.0215, test_loss: 0.9854, test_f1: 0.4693
 epoch: 24, train_loss: 1.0141, test_loss: 0.9894, test_f1: 0.4590
 epoch: 25, train_loss: 1.0074, test_loss: 0.9884, test_f1: 0.4568
 epoch: 26, train_loss: 1.0021, test_loss: 0.9909, test_f1: 0.4720
 epoch: 27, train_loss: 0.9966, test_loss: 0.9853, test_f1: 0.4769
 epoch: 28, train_loss: 0.9960, test_loss: 0.9921, test_f1: 0.4754
 epoch: 29, train_loss: 0.9929, test_loss: 0.9827, test_f1: 0.4788
 epoch: 30, train_loss: 0.9872, test_loss: 0.9919, test_f1: 0.4754
 epoch: 31, train_loss: 0.9849, test_loss: 0.9794, test_f1: 0.4758
 epoch: 32, train_loss: 0.9737, test_loss: 0.9785, test_f1: 0.4801
 epoch: 33, train_loss: 0.9785, test_loss: 0.9851, test_f1: 0.4748
 epoch: 34, train_loss: 0.9639, test_loss: 0.9787, test_f1: 0.4858
 epoch: 35, train_loss: 0.9712, test_loss: 0.9877, test_f1: 0.4630
 epoch: 36, train_loss: 0.9601, test_loss: 0.9813, test_f1: 0.4788
 epoch: 37, train_loss: 0.9617, test_loss: 0.9842, test_f1: 0.4808
 epoch: 38, train_loss: 0.9536, test_loss: 0.9799, test_f1: 0.4848
 epoch: 39, train_loss: 0.9469, test_loss: 0.9854, test_f1: 0.4785
 epoch: 40, train_loss: 0.9557, test_loss: 0.9862, test_f1: 0.4795
 epoch: 41, train_loss: 0.9424, test_loss: 0.9871, test_f1: 0.4813
 epoch: 42, train_loss: 0.9441, test_loss: 0.9826, test_f1: 0.4753
 epoch: 43, train_loss: 0.9425, test_loss: 0.9772, test_f1: 0.4891
 epoch: 44, train_loss: 0.9305, test_loss: 0.9940, test_f1: 0.4695
 epoch: 45, train_loss: 0.9331, test_loss: 0.9785, test_f1: 0.4761
 epoch: 46, train_loss: 0.9253, test_loss: 0.9847, test_f1: 0.4754
 epoch: 47, train_loss: 0.9193, test_loss: 0.9713, test_f1: 0.4787
 epoch: 48, train_loss: 0.9147, test_loss: 0.9586, test_f1: 0.4980
 epoch: 49, train_loss: 0.9148, test_loss: 0.9826, test_f1: 0.4907
 epoch: 50, train_loss: 0.9089, test_loss: 0.9765, test_f1: 0.4960
 epoch: 51, train_loss: 0.9120, test_loss: 0.9796, test_f1: 0.4875
 epoch: 52, train_loss: 0.9067, test_loss: 0.9780, test_f1: 0.4959
 epoch: 53, train_loss: 0.9037, test_loss: 0.9744, test_f1: 0.4792
 epoch: 54, train_loss: 0.9116, test_loss: 0.9750, test_f1: 0.4908
 epoch: 55, train_loss: 0.9053, test_loss: 0.9830, test_f1: 0.4816
 epoch: 56, train_loss: 0.8959, test_loss: 0.9777, test_f1: 0.4860
 epoch: 57, train_loss: 0.9001, test_loss: 0.9792, test_f1: 0.4904
 epoch: 58, train_loss: 0.9037, test_loss: 0.9845, test_f1: 0.4836
 epoch: 59, train_loss: 0.9012, test_loss: 0.9778, test_f1: 0.4818
 epoch: 60, train_loss: 0.8907, test_loss: 0.9861, test_f1: 0.4889
 epoch: 61, train_loss: 0.8919, test_loss: 0.9839, test_f1: 0.4845
 epoch: 62, train_loss: 0.8892, test_loss: 0.9773, test_f1: 0.4850
 epoch: 63, train_loss: 0.8859, test_loss: 0.9838, test_f1: 0.4843
 epoch: 64, train_loss: 0.8926, test_loss: 0.9942, test_f1: 0.4876
 epoch: 65, train_loss: 0.8895, test_loss: 0.9897, test_f1: 0.4906
 epoch: 66, train_loss: 0.8871, test_loss: 1.0085, test_f1: 0.4827
 epoch: 67, train_loss: 0.8862, test_loss: 0.9875, test_f1: 0.4903
 epoch: 68, train_loss: 0.8894, test_loss: 0.9900, test_f1: 0.4895
 epoch: 69, train_loss: 0.8893, test_loss: 0.9957, test_f1: 0.4847
 epoch: 70, train_loss: 0.8730, test_loss: 0.9827, test_f1: 0.4839
 epoch: 71, train_loss: 0.8812, test_loss: 0.9891, test_f1: 0.4841
 epoch: 72, train_loss: 0.8721, test_loss: 0.9847, test_f1: 0.4872
 epoch: 73, train_loss: 0.8732, test_loss: 0.9914, test_f1: 0.4842
 epoch: 74, train_loss: 0.8777, test_loss: 0.9997, test_f1: 0.4867
 epoch: 75, train_loss: 0.8838, test_loss: 0.9947, test_f1: 0.4832
 epoch: 76, train_loss: 0.8729, test_loss: 0.9954, test_f1: 0.4887
 epoch: 77, train_loss: 0.8723, test_loss: 1.0021, test_f1: 0.4788
 epoch: 78, train_loss: 0.8732, test_loss: 1.0074, test_f1: 0.4872
 epoch: 79, train_loss: 0.8725, test_loss: 1.0104, test_f1: 0.4861
 epoch: 80, train_loss: 0.8789, test_loss: 1.0111, test_f1: 0.4841
 epoch: 81, train_loss: 0.8672, test_loss: 1.0159, test_f1: 0.4860
 epoch: 82, train_loss: 0.8735, test_loss: 1.0163, test_f1: 0.4810
 epoch: 83, train_loss: 0.8632, test_loss: 0.9956, test_f1: 0.4881
 epoch: 84, train_loss: 0.8570, test_loss: 1.0012, test_f1: 0.4796
 epoch: 85, train_loss: 0.8622, test_loss: 1.0010, test_f1: 0.4783
 epoch: 86, train_loss: 0.8601, test_loss: 1.0004, test_f1: 0.4830
 epoch: 87, train_loss: 0.8576, test_loss: 1.0214, test_f1: 0.4848
 epoch: 88, train_loss: 0.8543, test_loss: 1.0223, test_f1: 0.4812
 epoch: 89, train_loss: 0.8543, test_loss: 1.0148, test_f1: 0.4817
 epoch: 90, train_loss: 0.8584, test_loss: 1.0197, test_f1: 0.4823
 epoch: 91, train_loss: 0.8430, test_loss: 1.0249, test_f1: 0.4838
 epoch: 92, train_loss: 0.8561, test_loss: 1.0190, test_f1: 0.4779
 epoch: 93, train_loss: 0.8498, test_loss: 1.0188, test_f1: 0.4858
 epoch: 94, train_loss: 0.8363, test_loss: 1.0194, test_f1: 0.4835
 epoch: 95, train_loss: 0.8472, test_loss: 1.0211, test_f1: 0.4851
 epoch: 96, train_loss: 0.8372, test_loss: 1.0315, test_f1: 0.4877
 epoch: 97, train_loss: 0.8538, test_loss: 1.0081, test_f1: 0.4806
 epoch: 98, train_loss: 0.8461, test_loss: 1.0355, test_f1: 0.4830
 epoch: 99, train_loss: 0.8481, test_loss: 1.0307, test_f1: 0.4923
##################ITERATION #4 ****************************************
 epoch: 0, train_loss: 1.3426, test_loss: 1.2567, test_f1: 0.2447
 epoch: 1, train_loss: 1.2560, test_loss: 1.2071, test_f1: 0.3338
 epoch: 2, train_loss: 1.2457, test_loss: 1.1867, test_f1: 0.3639
 epoch: 3, train_loss: 1.2241, test_loss: 1.1678, test_f1: 0.3881
 epoch: 4, train_loss: 1.2037, test_loss: 1.1545, test_f1: 0.3857
 epoch: 5, train_loss: 1.1924, test_loss: 1.1447, test_f1: 0.4054
 epoch: 6, train_loss: 1.1783, test_loss: 1.1281, test_f1: 0.4102
 epoch: 7, train_loss: 1.1661, test_loss: 1.1185, test_f1: 0.4143
 epoch: 8, train_loss: 1.1575, test_loss: 1.1097, test_f1: 0.4502
 epoch: 9, train_loss: 1.1564, test_loss: 1.0975, test_f1: 0.4301
 epoch: 10, train_loss: 1.1461, test_loss: 1.0876, test_f1: 0.4375
 epoch: 11, train_loss: 1.1349, test_loss: 1.0790, test_f1: 0.4415
 epoch: 12, train_loss: 1.1222, test_loss: 1.0707, test_f1: 0.4500
 epoch: 13, train_loss: 1.1162, test_loss: 1.0631, test_f1: 0.4504
 epoch: 14, train_loss: 1.1082, test_loss: 1.0574, test_f1: 0.4617
 epoch: 15, train_loss: 1.0958, test_loss: 1.0595, test_f1: 0.4416
 epoch: 16, train_loss: 1.0867, test_loss: 1.0422, test_f1: 0.4557
 epoch: 17, train_loss: 1.0860, test_loss: 1.0393, test_f1: 0.4731
 epoch: 18, train_loss: 1.0680, test_loss: 1.0253, test_f1: 0.4664
 epoch: 19, train_loss: 1.0673, test_loss: 1.0213, test_f1: 0.4599
 epoch: 20, train_loss: 1.0613, test_loss: 1.0206, test_f1: 0.4597
 epoch: 21, train_loss: 1.0500, test_loss: 1.0209, test_f1: 0.4497
 epoch: 22, train_loss: 1.0568, test_loss: 1.0051, test_f1: 0.4647
 epoch: 23, train_loss: 1.0407, test_loss: 1.0001, test_f1: 0.4663
 epoch: 24, train_loss: 1.0354, test_loss: 0.9916, test_f1: 0.4708
 epoch: 25, train_loss: 1.0386, test_loss: 0.9897, test_f1: 0.4757
 epoch: 26, train_loss: 1.0309, test_loss: 0.9813, test_f1: 0.4742
 epoch: 27, train_loss: 1.0175, test_loss: 0.9738, test_f1: 0.4798
 epoch: 28, train_loss: 1.0219, test_loss: 0.9712, test_f1: 0.4808
 epoch: 29, train_loss: 1.0122, test_loss: 0.9718, test_f1: 0.4716
 epoch: 30, train_loss: 1.0081, test_loss: 0.9766, test_f1: 0.4834
 epoch: 31, train_loss: 0.9910, test_loss: 0.9624, test_f1: 0.4784
 epoch: 32, train_loss: 0.9871, test_loss: 0.9627, test_f1: 0.4846
 epoch: 33, train_loss: 0.9862, test_loss: 0.9556, test_f1: 0.4737
 epoch: 34, train_loss: 0.9817, test_loss: 0.9599, test_f1: 0.4840
 epoch: 35, train_loss: 0.9744, test_loss: 0.9465, test_f1: 0.4806
 epoch: 36, train_loss: 0.9719, test_loss: 0.9539, test_f1: 0.4727
 epoch: 37, train_loss: 0.9772, test_loss: 0.9528, test_f1: 0.4594
 epoch: 38, train_loss: 0.9685, test_loss: 0.9492, test_f1: 0.4794
 epoch: 39, train_loss: 0.9586, test_loss: 0.9367, test_f1: 0.4672
 epoch: 40, train_loss: 0.9598, test_loss: 0.9470, test_f1: 0.4684
 epoch: 41, train_loss: 0.9550, test_loss: 0.9402, test_f1: 0.4701
 epoch: 42, train_loss: 0.9475, test_loss: 0.9387, test_f1: 0.4858
 epoch: 43, train_loss: 0.9549, test_loss: 0.9442, test_f1: 0.4823
 epoch: 44, train_loss: 0.9477, test_loss: 0.9337, test_f1: 0.4686
 epoch: 45, train_loss: 0.9412, test_loss: 0.9330, test_f1: 0.4896
 epoch: 46, train_loss: 0.9410, test_loss: 0.9354, test_f1: 0.4608
 epoch: 47, train_loss: 0.9341, test_loss: 0.9344, test_f1: 0.4661
 epoch: 48, train_loss: 0.9268, test_loss: 0.9241, test_f1: 0.4763
 epoch: 49, train_loss: 0.9150, test_loss: 0.9209, test_f1: 0.5004
 epoch: 50, train_loss: 0.9300, test_loss: 0.9369, test_f1: 0.4663
 epoch: 51, train_loss: 0.9140, test_loss: 0.9310, test_f1: 0.4928
 epoch: 52, train_loss: 0.9220, test_loss: 0.9310, test_f1: 0.4886
 epoch: 53, train_loss: 0.9142, test_loss: 0.9213, test_f1: 0.5033
 epoch: 54, train_loss: 0.9202, test_loss: 0.9264, test_f1: 0.4939
 epoch: 55, train_loss: 0.9040, test_loss: 0.9248, test_f1: 0.4996
 epoch: 56, train_loss: 0.9067, test_loss: 0.9301, test_f1: 0.5020
 epoch: 57, train_loss: 0.9066, test_loss: 0.9280, test_f1: 0.5060
 epoch: 58, train_loss: 0.9126, test_loss: 0.9224, test_f1: 0.4911
 epoch: 59, train_loss: 0.8988, test_loss: 0.9279, test_f1: 0.4765
 epoch: 60, train_loss: 0.9019, test_loss: 0.9274, test_f1: 0.5085
 epoch: 61, train_loss: 0.8957, test_loss: 0.9289, test_f1: 0.4930
 epoch: 62, train_loss: 0.9053, test_loss: 0.9368, test_f1: 0.4854
 epoch: 63, train_loss: 0.9035, test_loss: 0.9426, test_f1: 0.4871
 epoch: 64, train_loss: 0.8983, test_loss: 0.9384, test_f1: 0.4756
 epoch: 65, train_loss: 0.9017, test_loss: 0.9319, test_f1: 0.5061
 epoch: 66, train_loss: 0.8944, test_loss: 0.9410, test_f1: 0.4869
 epoch: 67, train_loss: 0.8943, test_loss: 0.9366, test_f1: 0.4884
 epoch: 68, train_loss: 0.8869, test_loss: 0.9341, test_f1: 0.4826
 epoch: 69, train_loss: 0.8980, test_loss: 0.9395, test_f1: 0.4818
 epoch: 70, train_loss: 0.8852, test_loss: 0.9314, test_f1: 0.4889
 epoch: 71, train_loss: 0.8904, test_loss: 0.9353, test_f1: 0.4944
 epoch: 72, train_loss: 0.8830, test_loss: 0.9369, test_f1: 0.5026
 epoch: 73, train_loss: 0.8813, test_loss: 0.9358, test_f1: 0.4936
 epoch: 74, train_loss: 0.8849, test_loss: 0.9447, test_f1: 0.4864
 epoch: 75, train_loss: 0.8799, test_loss: 0.9346, test_f1: 0.4966
 epoch: 76, train_loss: 0.8735, test_loss: 0.9254, test_f1: 0.5092
 epoch: 77, train_loss: 0.8818, test_loss: 0.9272, test_f1: 0.5002
 epoch: 78, train_loss: 0.8829, test_loss: 0.9372, test_f1: 0.4982
 epoch: 79, train_loss: 0.8791, test_loss: 0.9433, test_f1: 0.4864
 epoch: 80, train_loss: 0.8770, test_loss: 0.9509, test_f1: 0.4813
 epoch: 81, train_loss: 0.8727, test_loss: 0.9336, test_f1: 0.5009
 epoch: 82, train_loss: 0.8773, test_loss: 0.9338, test_f1: 0.4876
 epoch: 83, train_loss: 0.8645, test_loss: 0.9510, test_f1: 0.4882
 epoch: 84, train_loss: 0.8550, test_loss: 0.9360, test_f1: 0.4859
 epoch: 85, train_loss: 0.8598, test_loss: 0.9566, test_f1: 0.4951
 epoch: 86, train_loss: 0.8632, test_loss: 0.9404, test_f1: 0.4883
 epoch: 87, train_loss: 0.8598, test_loss: 0.9309, test_f1: 0.5046
 epoch: 88, train_loss: 0.8553, test_loss: 0.9441, test_f1: 0.4865
 epoch: 89, train_loss: 0.8686, test_loss: 0.9384, test_f1: 0.4837
 epoch: 90, train_loss: 0.8657, test_loss: 0.9521, test_f1: 0.4942
 epoch: 91, train_loss: 0.8545, test_loss: 0.9572, test_f1: 0.4911
 epoch: 92, train_loss: 0.8634, test_loss: 0.9508, test_f1: 0.4920
 epoch: 93, train_loss: 0.8588, test_loss: 0.9402, test_f1: 0.4856
 epoch: 94, train_loss: 0.8514, test_loss: 0.9376, test_f1: 0.4811
 epoch: 95, train_loss: 0.8493, test_loss: 0.9572, test_f1: 0.4908
 epoch: 96, train_loss: 0.8469, test_loss: 0.9490, test_f1: 0.4973
 epoch: 97, train_loss: 0.8540, test_loss: 0.9403, test_f1: 0.4873
 epoch: 98, train_loss: 0.8541, test_loss: 0.9506, test_f1: 0.4941
 epoch: 99, train_loss: 0.8448, test_loss: 0.9678, test_f1: 0.4932
##################ITERATION #5 ****************************************
 epoch: 0, train_loss: 1.3612, test_loss: 1.2631, test_f1: 0.3150
 epoch: 1, train_loss: 1.2670, test_loss: 1.2159, test_f1: 0.3667
 epoch: 2, train_loss: 1.2382, test_loss: 1.1886, test_f1: 0.3795
 epoch: 3, train_loss: 1.2200, test_loss: 1.1677, test_f1: 0.3929
 epoch: 4, train_loss: 1.2062, test_loss: 1.1435, test_f1: 0.4009
 epoch: 5, train_loss: 1.1916, test_loss: 1.1260, test_f1: 0.4158
 epoch: 6, train_loss: 1.1635, test_loss: 1.1088, test_f1: 0.4423
 epoch: 7, train_loss: 1.1510, test_loss: 1.0905, test_f1: 0.4609
 epoch: 8, train_loss: 1.1387, test_loss: 1.0779, test_f1: 0.4620
 epoch: 9, train_loss: 1.1316, test_loss: 1.0670, test_f1: 0.4712
 epoch: 10, train_loss: 1.1145, test_loss: 1.0538, test_f1: 0.4685
 epoch: 11, train_loss: 1.1059, test_loss: 1.0487, test_f1: 0.4685
 epoch: 12, train_loss: 1.0980, test_loss: 1.0372, test_f1: 0.4567
 epoch: 13, train_loss: 1.0775, test_loss: 1.0280, test_f1: 0.4645
 epoch: 14, train_loss: 1.0806, test_loss: 1.0235, test_f1: 0.4591
 epoch: 15, train_loss: 1.0711, test_loss: 1.0167, test_f1: 0.4611
 epoch: 16, train_loss: 1.0605, test_loss: 1.0130, test_f1: 0.4624
 epoch: 17, train_loss: 1.0514, test_loss: 1.0114, test_f1: 0.4604
 epoch: 18, train_loss: 1.0444, test_loss: 0.9997, test_f1: 0.4633
 epoch: 19, train_loss: 1.0410, test_loss: 1.0005, test_f1: 0.4648
 epoch: 20, train_loss: 1.0206, test_loss: 0.9984, test_f1: 0.4694
 epoch: 21, train_loss: 1.0204, test_loss: 0.9912, test_f1: 0.4670
 epoch: 22, train_loss: 1.0173, test_loss: 0.9809, test_f1: 0.4604
 epoch: 23, train_loss: 1.0128, test_loss: 0.9905, test_f1: 0.4644
 epoch: 24, train_loss: 1.0088, test_loss: 1.0029, test_f1: 0.4681
 epoch: 25, train_loss: 0.9952, test_loss: 0.9720, test_f1: 0.4594
 epoch: 26, train_loss: 0.9894, test_loss: 0.9771, test_f1: 0.4621
 epoch: 27, train_loss: 0.9829, test_loss: 0.9810, test_f1: 0.4609
 epoch: 28, train_loss: 0.9830, test_loss: 0.9624, test_f1: 0.4704
 epoch: 29, train_loss: 0.9808, test_loss: 0.9760, test_f1: 0.4605
 epoch: 30, train_loss: 0.9792, test_loss: 0.9808, test_f1: 0.4686
 epoch: 31, train_loss: 0.9699, test_loss: 0.9654, test_f1: 0.4742
 epoch: 32, train_loss: 0.9694, test_loss: 0.9615, test_f1: 0.4851
 epoch: 33, train_loss: 0.9655, test_loss: 0.9608, test_f1: 0.4695
 epoch: 34, train_loss: 0.9500, test_loss: 0.9512, test_f1: 0.4728
 epoch: 35, train_loss: 0.9495, test_loss: 0.9555, test_f1: 0.4778
 epoch: 36, train_loss: 0.9606, test_loss: 0.9404, test_f1: 0.4984
 epoch: 37, train_loss: 0.9433, test_loss: 0.9485, test_f1: 0.4808
 epoch: 38, train_loss: 0.9460, test_loss: 0.9493, test_f1: 0.4804
 epoch: 39, train_loss: 0.9323, test_loss: 0.9410, test_f1: 0.4791
 epoch: 40, train_loss: 0.9346, test_loss: 0.9548, test_f1: 0.4751
 epoch: 41, train_loss: 0.9274, test_loss: 0.9576, test_f1: 0.4740
 epoch: 42, train_loss: 0.9267, test_loss: 0.9393, test_f1: 0.5000
 epoch: 43, train_loss: 0.9146, test_loss: 0.9555, test_f1: 0.4770
 epoch: 44, train_loss: 0.9145, test_loss: 0.9306, test_f1: 0.5046
 epoch: 45, train_loss: 0.9118, test_loss: 0.9512, test_f1: 0.4864
 epoch: 46, train_loss: 0.9223, test_loss: 0.9517, test_f1: 0.4876
 epoch: 47, train_loss: 0.9110, test_loss: 0.9356, test_f1: 0.4958
 epoch: 48, train_loss: 0.9067, test_loss: 0.9437, test_f1: 0.4914
 epoch: 49, train_loss: 0.9063, test_loss: 0.9362, test_f1: 0.4946
 epoch: 50, train_loss: 0.9039, test_loss: 0.9421, test_f1: 0.4847
 epoch: 51, train_loss: 0.8958, test_loss: 0.9533, test_f1: 0.4874
 epoch: 52, train_loss: 0.8884, test_loss: 0.9422, test_f1: 0.4865
 epoch: 53, train_loss: 0.8803, test_loss: 0.9571, test_f1: 0.4898
 epoch: 54, train_loss: 0.8857, test_loss: 0.9520, test_f1: 0.4899
 epoch: 55, train_loss: 0.8840, test_loss: 0.9483, test_f1: 0.4922
 epoch: 56, train_loss: 0.8797, test_loss: 0.9715, test_f1: 0.4924
 epoch: 57, train_loss: 0.8874, test_loss: 0.9518, test_f1: 0.4975
 epoch: 58, train_loss: 0.8781, test_loss: 0.9472, test_f1: 0.4989
 epoch: 59, train_loss: 0.8829, test_loss: 0.9615, test_f1: 0.4931
 epoch: 60, train_loss: 0.8735, test_loss: 0.9583, test_f1: 0.4784
 epoch: 61, train_loss: 0.8852, test_loss: 0.9630, test_f1: 0.4940
 epoch: 62, train_loss: 0.8687, test_loss: 0.9404, test_f1: 0.4996
 epoch: 63, train_loss: 0.8750, test_loss: 0.9684, test_f1: 0.4957
 epoch: 64, train_loss: 0.8684, test_loss: 0.9347, test_f1: 0.5060
 epoch: 65, train_loss: 0.8722, test_loss: 0.9549, test_f1: 0.5051
 epoch: 66, train_loss: 0.8707, test_loss: 0.9496, test_f1: 0.5067
 epoch: 67, train_loss: 0.8722, test_loss: 0.9514, test_f1: 0.4984
 epoch: 68, train_loss: 0.8654, test_loss: 0.9583, test_f1: 0.5022
 epoch: 69, train_loss: 0.8607, test_loss: 0.9603, test_f1: 0.5071
 epoch: 70, train_loss: 0.8686, test_loss: 0.9667, test_f1: 0.5011
 epoch: 71, train_loss: 0.8694, test_loss: 0.9522, test_f1: 0.5039
 epoch: 72, train_loss: 0.8673, test_loss: 0.9560, test_f1: 0.5015
 epoch: 73, train_loss: 0.8615, test_loss: 0.9643, test_f1: 0.4961
 epoch: 74, train_loss: 0.8610, test_loss: 0.9563, test_f1: 0.5028
 epoch: 75, train_loss: 0.8565, test_loss: 0.9489, test_f1: 0.5006
 epoch: 76, train_loss: 0.8491, test_loss: 0.9624, test_f1: 0.5011
 epoch: 77, train_loss: 0.8521, test_loss: 0.9741, test_f1: 0.5022
 epoch: 78, train_loss: 0.8503, test_loss: 0.9616, test_f1: 0.5129
 epoch: 79, train_loss: 0.8559, test_loss: 0.9708, test_f1: 0.5040
 epoch: 80, train_loss: 0.8446, test_loss: 0.9602, test_f1: 0.4966
 epoch: 81, train_loss: 0.8526, test_loss: 0.9529, test_f1: 0.5191
 epoch: 82, train_loss: 0.8484, test_loss: 0.9503, test_f1: 0.4949
 epoch: 83, train_loss: 0.8465, test_loss: 0.9608, test_f1: 0.4956
 epoch: 84, train_loss: 0.8431, test_loss: 0.9453, test_f1: 0.5073
 epoch: 85, train_loss: 0.8484, test_loss: 0.9664, test_f1: 0.4996
 epoch: 86, train_loss: 0.8444, test_loss: 0.9492, test_f1: 0.5059
 epoch: 87, train_loss: 0.8525, test_loss: 0.9683, test_f1: 0.4986
 epoch: 88, train_loss: 0.8380, test_loss: 0.9648, test_f1: 0.4950
 epoch: 89, train_loss: 0.8396, test_loss: 0.9642, test_f1: 0.5071
 epoch: 90, train_loss: 0.8424, test_loss: 0.9799, test_f1: 0.5102
 epoch: 91, train_loss: 0.8402, test_loss: 0.9700, test_f1: 0.4991
 epoch: 92, train_loss: 0.8394, test_loss: 0.9635, test_f1: 0.5020
 epoch: 93, train_loss: 0.8346, test_loss: 0.9528, test_f1: 0.5026
 epoch: 94, train_loss: 0.8314, test_loss: 0.9824, test_f1: 0.5045
 epoch: 95, train_loss: 0.8460, test_loss: 0.9466, test_f1: 0.5008
 epoch: 96, train_loss: 0.8366, test_loss: 0.9563, test_f1: 0.5162
 epoch: 97, train_loss: 0.8338, test_loss: 0.9586, test_f1: 0.5074
 epoch: 98, train_loss: 0.8385, test_loss: 0.9627, test_f1: 0.5061
 epoch: 99, train_loss: 0.8238, test_loss: 0.9966, test_f1: 0.4931
##################ITERATION #6 ****************************************
 epoch: 0, train_loss: 1.3378, test_loss: 1.2462, test_f1: 0.3180
 epoch: 1, train_loss: 1.2573, test_loss: 1.2105, test_f1: 0.4228
 epoch: 2, train_loss: 1.2328, test_loss: 1.1937, test_f1: 0.4119
 epoch: 3, train_loss: 1.2138, test_loss: 1.1746, test_f1: 0.4226
 epoch: 4, train_loss: 1.1952, test_loss: 1.1587, test_f1: 0.4333
 epoch: 5, train_loss: 1.1890, test_loss: 1.1437, test_f1: 0.4335
 epoch: 6, train_loss: 1.1699, test_loss: 1.1378, test_f1: 0.4637
 epoch: 7, train_loss: 1.1598, test_loss: 1.1212, test_f1: 0.4563
 epoch: 8, train_loss: 1.1491, test_loss: 1.1080, test_f1: 0.4612
 epoch: 9, train_loss: 1.1397, test_loss: 1.1119, test_f1: 0.4517
 epoch: 10, train_loss: 1.1293, test_loss: 1.0891, test_f1: 0.4701
 epoch: 11, train_loss: 1.1176, test_loss: 1.0865, test_f1: 0.4599
 epoch: 12, train_loss: 1.1159, test_loss: 1.0804, test_f1: 0.4553
 epoch: 13, train_loss: 1.1066, test_loss: 1.0743, test_f1: 0.4524
 epoch: 14, train_loss: 1.1040, test_loss: 1.0662, test_f1: 0.4598
 epoch: 15, train_loss: 1.0947, test_loss: 1.0524, test_f1: 0.4689
 epoch: 16, train_loss: 1.0890, test_loss: 1.0493, test_f1: 0.4561
 epoch: 17, train_loss: 1.0678, test_loss: 1.0389, test_f1: 0.4698
 epoch: 18, train_loss: 1.0679, test_loss: 1.0314, test_f1: 0.4813
 epoch: 19, train_loss: 1.0549, test_loss: 1.0333, test_f1: 0.4823
 epoch: 20, train_loss: 1.0504, test_loss: 1.0251, test_f1: 0.4616
 epoch: 21, train_loss: 1.0529, test_loss: 1.0196, test_f1: 0.4772
 epoch: 22, train_loss: 1.0402, test_loss: 1.0123, test_f1: 0.4731
 epoch: 23, train_loss: 1.0351, test_loss: 1.0132, test_f1: 0.4821
 epoch: 24, train_loss: 1.0393, test_loss: 1.0013, test_f1: 0.4798
 epoch: 25, train_loss: 1.0265, test_loss: 1.0138, test_f1: 0.4769
 epoch: 26, train_loss: 1.0198, test_loss: 0.9958, test_f1: 0.4806
 epoch: 27, train_loss: 1.0234, test_loss: 0.9979, test_f1: 0.4771
 epoch: 28, train_loss: 1.0226, test_loss: 0.9924, test_f1: 0.4829
 epoch: 29, train_loss: 1.0069, test_loss: 0.9940, test_f1: 0.4799
 epoch: 30, train_loss: 1.0120, test_loss: 0.9873, test_f1: 0.4856
 epoch: 31, train_loss: 0.9974, test_loss: 0.9916, test_f1: 0.4821
 epoch: 32, train_loss: 0.9949, test_loss: 0.9956, test_f1: 0.4801
 epoch: 33, train_loss: 0.9928, test_loss: 0.9865, test_f1: 0.4868
 epoch: 34, train_loss: 0.9932, test_loss: 0.9762, test_f1: 0.4805
 epoch: 35, train_loss: 0.9855, test_loss: 0.9885, test_f1: 0.4907
 epoch: 36, train_loss: 0.9851, test_loss: 0.9740, test_f1: 0.4872
 epoch: 37, train_loss: 0.9784, test_loss: 0.9622, test_f1: 0.4891
 epoch: 38, train_loss: 0.9757, test_loss: 0.9792, test_f1: 0.4860
 epoch: 39, train_loss: 0.9689, test_loss: 0.9558, test_f1: 0.4955
 epoch: 40, train_loss: 0.9628, test_loss: 0.9854, test_f1: 0.4963
 epoch: 41, train_loss: 0.9620, test_loss: 0.9674, test_f1: 0.4868
 epoch: 42, train_loss: 0.9626, test_loss: 0.9600, test_f1: 0.4858
 epoch: 43, train_loss: 0.9515, test_loss: 0.9608, test_f1: 0.4911
 epoch: 44, train_loss: 0.9515, test_loss: 0.9593, test_f1: 0.4936
 epoch: 45, train_loss: 0.9371, test_loss: 0.9680, test_f1: 0.4822
 epoch: 46, train_loss: 0.9399, test_loss: 0.9640, test_f1: 0.4778
 epoch: 47, train_loss: 0.9390, test_loss: 0.9539, test_f1: 0.4919
 epoch: 48, train_loss: 0.9294, test_loss: 0.9476, test_f1: 0.4962
 epoch: 49, train_loss: 0.9330, test_loss: 0.9796, test_f1: 0.4734
 epoch: 50, train_loss: 0.9402, test_loss: 0.9602, test_f1: 0.4875
 epoch: 51, train_loss: 0.9227, test_loss: 0.9581, test_f1: 0.4872
 epoch: 52, train_loss: 0.9095, test_loss: 0.9656, test_f1: 0.4996
 epoch: 53, train_loss: 0.9192, test_loss: 0.9533, test_f1: 0.4900
 epoch: 54, train_loss: 0.9141, test_loss: 0.9740, test_f1: 0.4908
 epoch: 55, train_loss: 0.9214, test_loss: 0.9595, test_f1: 0.4929
 epoch: 56, train_loss: 0.9261, test_loss: 0.9722, test_f1: 0.4773
 epoch: 57, train_loss: 0.9113, test_loss: 0.9703, test_f1: 0.4820
 epoch: 58, train_loss: 0.9120, test_loss: 0.9540, test_f1: 0.4987
 epoch: 59, train_loss: 0.8974, test_loss: 0.9613, test_f1: 0.4876
 epoch: 60, train_loss: 0.9134, test_loss: 0.9613, test_f1: 0.4872
 epoch: 61, train_loss: 0.9141, test_loss: 0.9571, test_f1: 0.4923
 epoch: 62, train_loss: 0.9066, test_loss: 0.9596, test_f1: 0.4941
 epoch: 63, train_loss: 0.8982, test_loss: 0.9648, test_f1: 0.4988
 epoch: 64, train_loss: 0.8992, test_loss: 0.9522, test_f1: 0.4902
 epoch: 65, train_loss: 0.9055, test_loss: 0.9638, test_f1: 0.4973
 epoch: 66, train_loss: 0.9064, test_loss: 0.9494, test_f1: 0.4971
 epoch: 67, train_loss: 0.9127, test_loss: 0.9714, test_f1: 0.4805
 epoch: 68, train_loss: 0.9076, test_loss: 0.9549, test_f1: 0.4903
 epoch: 69, train_loss: 0.9022, test_loss: 0.9645, test_f1: 0.4911
 epoch: 70, train_loss: 0.8885, test_loss: 0.9636, test_f1: 0.4927
 epoch: 71, train_loss: 0.9010, test_loss: 0.9518, test_f1: 0.4870
 epoch: 72, train_loss: 0.8900, test_loss: 0.9595, test_f1: 0.4915
 epoch: 73, train_loss: 0.8945, test_loss: 0.9662, test_f1: 0.4880
 epoch: 74, train_loss: 0.8884, test_loss: 0.9704, test_f1: 0.4992
 epoch: 75, train_loss: 0.8935, test_loss: 0.9605, test_f1: 0.4952
 epoch: 76, train_loss: 0.8770, test_loss: 0.9570, test_f1: 0.4922
 epoch: 77, train_loss: 0.8810, test_loss: 0.9601, test_f1: 0.5041
 epoch: 78, train_loss: 0.8918, test_loss: 0.9561, test_f1: 0.5006
 epoch: 79, train_loss: 0.8831, test_loss: 0.9689, test_f1: 0.4976
 epoch: 80, train_loss: 0.8710, test_loss: 0.9621, test_f1: 0.4945
 epoch: 81, train_loss: 0.8844, test_loss: 0.9730, test_f1: 0.4970
 epoch: 82, train_loss: 0.8784, test_loss: 0.9639, test_f1: 0.5025
 epoch: 83, train_loss: 0.8796, test_loss: 0.9710, test_f1: 0.4971
 epoch: 84, train_loss: 0.8796, test_loss: 0.9728, test_f1: 0.4990
 epoch: 85, train_loss: 0.8746, test_loss: 0.9590, test_f1: 0.4914
 epoch: 86, train_loss: 0.8790, test_loss: 0.9727, test_f1: 0.4946
 epoch: 87, train_loss: 0.8748, test_loss: 0.9656, test_f1: 0.5017
 epoch: 88, train_loss: 0.8785, test_loss: 0.9635, test_f1: 0.5023
 epoch: 89, train_loss: 0.8769, test_loss: 0.9741, test_f1: 0.5037
 epoch: 90, train_loss: 0.8789, test_loss: 1.0012, test_f1: 0.4506
 epoch: 91, train_loss: 0.8782, test_loss: 0.9799, test_f1: 0.4928
 epoch: 92, train_loss: 0.8665, test_loss: 0.9773, test_f1: 0.4956
 epoch: 93, train_loss: 0.8685, test_loss: 0.9593, test_f1: 0.4997
 epoch: 94, train_loss: 0.8795, test_loss: 0.9653, test_f1: 0.5019
 epoch: 95, train_loss: 0.8529, test_loss: 0.9826, test_f1: 0.4972
 epoch: 96, train_loss: 0.8742, test_loss: 0.9688, test_f1: 0.5150
 epoch: 97, train_loss: 0.8717, test_loss: 0.9686, test_f1: 0.4929
 epoch: 98, train_loss: 0.8655, test_loss: 0.9903, test_f1: 0.4782
 epoch: 99, train_loss: 0.8613, test_loss: 0.9669, test_f1: 0.5187
##################ITERATION #7 ****************************************
 epoch: 0, train_loss: 1.3314, test_loss: 1.2426, test_f1: 0.2979
 epoch: 1, train_loss: 1.2600, test_loss: 1.1660, test_f1: 0.4265
 epoch: 2, train_loss: 1.2232, test_loss: 1.1479, test_f1: 0.4418
 epoch: 3, train_loss: 1.1999, test_loss: 1.1312, test_f1: 0.4422
 epoch: 4, train_loss: 1.1953, test_loss: 1.1145, test_f1: 0.4552
 epoch: 5, train_loss: 1.1793, test_loss: 1.0973, test_f1: 0.4620
 epoch: 6, train_loss: 1.1651, test_loss: 1.0916, test_f1: 0.4515
 epoch: 7, train_loss: 1.1414, test_loss: 1.0756, test_f1: 0.4725
 epoch: 8, train_loss: 1.1279, test_loss: 1.0667, test_f1: 0.4801
 epoch: 9, train_loss: 1.1239, test_loss: 1.0581, test_f1: 0.4697
 epoch: 10, train_loss: 1.1116, test_loss: 1.0502, test_f1: 0.4678
 epoch: 11, train_loss: 1.0905, test_loss: 1.0427, test_f1: 0.4849
 epoch: 12, train_loss: 1.0907, test_loss: 1.0309, test_f1: 0.4828
 epoch: 13, train_loss: 1.0921, test_loss: 1.0264, test_f1: 0.4851
 epoch: 14, train_loss: 1.0768, test_loss: 1.0154, test_f1: 0.4785
 epoch: 15, train_loss: 1.0739, test_loss: 1.0107, test_f1: 0.4815
 epoch: 16, train_loss: 1.0551, test_loss: 1.0110, test_f1: 0.4798
 epoch: 17, train_loss: 1.0586, test_loss: 1.0012, test_f1: 0.4696
 epoch: 18, train_loss: 1.0431, test_loss: 0.9964, test_f1: 0.4683
 epoch: 19, train_loss: 1.0523, test_loss: 0.9944, test_f1: 0.4760
 epoch: 20, train_loss: 1.0501, test_loss: 0.9841, test_f1: 0.4901
 epoch: 21, train_loss: 1.0271, test_loss: 0.9822, test_f1: 0.4819
 epoch: 22, train_loss: 1.0299, test_loss: 0.9778, test_f1: 0.4913
 epoch: 23, train_loss: 1.0293, test_loss: 0.9722, test_f1: 0.4862
 epoch: 24, train_loss: 1.0160, test_loss: 0.9727, test_f1: 0.4732
 epoch: 25, train_loss: 1.0126, test_loss: 0.9645, test_f1: 0.4994
 epoch: 26, train_loss: 1.0036, test_loss: 0.9596, test_f1: 0.4799
 epoch: 27, train_loss: 1.0032, test_loss: 0.9595, test_f1: 0.4824
 epoch: 28, train_loss: 1.0025, test_loss: 0.9616, test_f1: 0.4861
 epoch: 29, train_loss: 0.9915, test_loss: 0.9573, test_f1: 0.4723
 epoch: 30, train_loss: 0.9915, test_loss: 0.9506, test_f1: 0.4842
 epoch: 31, train_loss: 0.9842, test_loss: 0.9528, test_f1: 0.4870
 epoch: 32, train_loss: 0.9907, test_loss: 0.9536, test_f1: 0.4774
 epoch: 33, train_loss: 0.9849, test_loss: 0.9507, test_f1: 0.4836
 epoch: 34, train_loss: 0.9814, test_loss: 0.9533, test_f1: 0.4653
 epoch: 35, train_loss: 0.9910, test_loss: 0.9431, test_f1: 0.4810
 epoch: 36, train_loss: 0.9731, test_loss: 0.9401, test_f1: 0.4771
 epoch: 37, train_loss: 0.9761, test_loss: 0.9457, test_f1: 0.4868
 epoch: 38, train_loss: 0.9677, test_loss: 0.9338, test_f1: 0.4958
 epoch: 39, train_loss: 0.9603, test_loss: 0.9357, test_f1: 0.4867
 epoch: 40, train_loss: 0.9596, test_loss: 0.9376, test_f1: 0.4943
 epoch: 41, train_loss: 0.9609, test_loss: 0.9424, test_f1: 0.4848
 epoch: 42, train_loss: 0.9542, test_loss: 0.9342, test_f1: 0.4873
 epoch: 43, train_loss: 0.9428, test_loss: 0.9434, test_f1: 0.4831
 epoch: 44, train_loss: 0.9445, test_loss: 0.9337, test_f1: 0.4972
 epoch: 45, train_loss: 0.9418, test_loss: 0.9323, test_f1: 0.5097
 epoch: 46, train_loss: 0.9401, test_loss: 0.9384, test_f1: 0.5113
 epoch: 47, train_loss: 0.9340, test_loss: 0.9442, test_f1: 0.5050
 epoch: 48, train_loss: 0.9265, test_loss: 0.9325, test_f1: 0.4897
 epoch: 49, train_loss: 0.9279, test_loss: 0.9288, test_f1: 0.5024
 epoch: 50, train_loss: 0.9263, test_loss: 0.9334, test_f1: 0.4915
 epoch: 51, train_loss: 0.9257, test_loss: 0.9288, test_f1: 0.4958
 epoch: 52, train_loss: 0.9271, test_loss: 0.9276, test_f1: 0.4870
 epoch: 53, train_loss: 0.9133, test_loss: 0.9240, test_f1: 0.5023
 epoch: 54, train_loss: 0.9244, test_loss: 0.9267, test_f1: 0.5002
 epoch: 55, train_loss: 0.9105, test_loss: 0.9222, test_f1: 0.4829
 epoch: 56, train_loss: 0.9134, test_loss: 0.9198, test_f1: 0.4825
 epoch: 57, train_loss: 0.9056, test_loss: 0.9326, test_f1: 0.4899
 epoch: 58, train_loss: 0.9071, test_loss: 0.9242, test_f1: 0.5092
 epoch: 59, train_loss: 0.9084, test_loss: 0.9340, test_f1: 0.4997
 epoch: 60, train_loss: 0.9138, test_loss: 0.9307, test_f1: 0.5009
 epoch: 61, train_loss: 0.9066, test_loss: 0.9284, test_f1: 0.5020
 epoch: 62, train_loss: 0.8959, test_loss: 0.9277, test_f1: 0.5131
 epoch: 63, train_loss: 0.9033, test_loss: 0.9269, test_f1: 0.5101
 epoch: 64, train_loss: 0.9099, test_loss: 0.9208, test_f1: 0.5025
 epoch: 65, train_loss: 0.8947, test_loss: 0.9201, test_f1: 0.4812
 epoch: 66, train_loss: 0.8970, test_loss: 0.9261, test_f1: 0.5134
 epoch: 67, train_loss: 0.8926, test_loss: 0.9293, test_f1: 0.4993
 epoch: 68, train_loss: 0.9022, test_loss: 0.9311, test_f1: 0.4997
 epoch: 69, train_loss: 0.8932, test_loss: 0.9186, test_f1: 0.4979
 epoch: 70, train_loss: 0.8893, test_loss: 0.9166, test_f1: 0.5006
 epoch: 71, train_loss: 0.8991, test_loss: 0.9218, test_f1: 0.4765
 epoch: 72, train_loss: 0.8978, test_loss: 0.9234, test_f1: 0.5269
 epoch: 73, train_loss: 0.9044, test_loss: 0.9309, test_f1: 0.5131
 epoch: 74, train_loss: 0.8864, test_loss: 0.9280, test_f1: 0.5045
 epoch: 75, train_loss: 0.8846, test_loss: 0.9197, test_f1: 0.5024
 epoch: 76, train_loss: 0.8900, test_loss: 0.9256, test_f1: 0.5266
 epoch: 77, train_loss: 0.8962, test_loss: 0.9266, test_f1: 0.5205
 epoch: 78, train_loss: 0.8825, test_loss: 0.9228, test_f1: 0.5159
 epoch: 79, train_loss: 0.8831, test_loss: 0.9168, test_f1: 0.5241
 epoch: 80, train_loss: 0.8785, test_loss: 0.9203, test_f1: 0.5086
 epoch: 81, train_loss: 0.8878, test_loss: 0.9206, test_f1: 0.4985
 epoch: 82, train_loss: 0.8793, test_loss: 0.9250, test_f1: 0.5277
 epoch: 83, train_loss: 0.8741, test_loss: 0.9256, test_f1: 0.5022
 epoch: 84, train_loss: 0.8736, test_loss: 0.9193, test_f1: 0.5143
 epoch: 85, train_loss: 0.8802, test_loss: 0.9235, test_f1: 0.5076
 epoch: 86, train_loss: 0.8744, test_loss: 0.9207, test_f1: 0.5172
 epoch: 87, train_loss: 0.8790, test_loss: 0.9216, test_f1: 0.5119
 epoch: 88, train_loss: 0.8627, test_loss: 0.9151, test_f1: 0.5163
 epoch: 89, train_loss: 0.8718, test_loss: 0.9184, test_f1: 0.5228
 epoch: 90, train_loss: 0.8655, test_loss: 0.9193, test_f1: 0.5224
 epoch: 91, train_loss: 0.8679, test_loss: 0.9246, test_f1: 0.5255
 epoch: 92, train_loss: 0.8676, test_loss: 0.9208, test_f1: 0.5169
 epoch: 93, train_loss: 0.8684, test_loss: 0.9193, test_f1: 0.5144
 epoch: 94, train_loss: 0.8700, test_loss: 0.9203, test_f1: 0.5080
 epoch: 95, train_loss: 0.8607, test_loss: 0.9255, test_f1: 0.5171
 epoch: 96, train_loss: 0.8626, test_loss: 0.9246, test_f1: 0.5086
 epoch: 97, train_loss: 0.8584, test_loss: 0.9248, test_f1: 0.5234
 epoch: 98, train_loss: 0.8608, test_loss: 0.9181, test_f1: 0.5134
 epoch: 99, train_loss: 0.8668, test_loss: 0.9161, test_f1: 0.5240
##################ITERATION #8 ****************************************
 epoch: 0, train_loss: 1.3550, test_loss: 1.2187, test_f1: 0.2532
 epoch: 1, train_loss: 1.2631, test_loss: 1.1579, test_f1: 0.3888
 epoch: 2, train_loss: 1.2470, test_loss: 1.1425, test_f1: 0.3915
 epoch: 3, train_loss: 1.2203, test_loss: 1.1304, test_f1: 0.4251
 epoch: 4, train_loss: 1.2007, test_loss: 1.1128, test_f1: 0.4388
 epoch: 5, train_loss: 1.1965, test_loss: 1.1119, test_f1: 0.4277
 epoch: 6, train_loss: 1.1727, test_loss: 1.1069, test_f1: 0.4401
 epoch: 7, train_loss: 1.1676, test_loss: 1.1035, test_f1: 0.4527
 epoch: 8, train_loss: 1.1621, test_loss: 1.0877, test_f1: 0.4824
 epoch: 9, train_loss: 1.1405, test_loss: 1.0917, test_f1: 0.4664
 epoch: 10, train_loss: 1.1355, test_loss: 1.0852, test_f1: 0.4666
 epoch: 11, train_loss: 1.1296, test_loss: 1.0763, test_f1: 0.4851
 epoch: 12, train_loss: 1.1153, test_loss: 1.0821, test_f1: 0.4533
 epoch: 13, train_loss: 1.1135, test_loss: 1.0706, test_f1: 0.4649
 epoch: 14, train_loss: 1.1049, test_loss: 1.0687, test_f1: 0.4581
 epoch: 15, train_loss: 1.1016, test_loss: 1.0678, test_f1: 0.4547
 epoch: 16, train_loss: 1.0994, test_loss: 1.0496, test_f1: 0.4745
 epoch: 17, train_loss: 1.0844, test_loss: 1.0467, test_f1: 0.4712
 epoch: 18, train_loss: 1.0880, test_loss: 1.0477, test_f1: 0.4528
 epoch: 19, train_loss: 1.0869, test_loss: 1.0478, test_f1: 0.4642
 epoch: 20, train_loss: 1.0765, test_loss: 1.0386, test_f1: 0.4570
 epoch: 21, train_loss: 1.0712, test_loss: 1.0264, test_f1: 0.4620
 epoch: 22, train_loss: 1.0715, test_loss: 1.0275, test_f1: 0.4552
 epoch: 23, train_loss: 1.0684, test_loss: 1.0232, test_f1: 0.4657
 epoch: 24, train_loss: 1.0591, test_loss: 1.0225, test_f1: 0.4562
 epoch: 25, train_loss: 1.0447, test_loss: 1.0209, test_f1: 0.4542
 epoch: 26, train_loss: 1.0477, test_loss: 1.0271, test_f1: 0.4434
 epoch: 27, train_loss: 1.0527, test_loss: 1.0156, test_f1: 0.4568
 epoch: 28, train_loss: 1.0368, test_loss: 1.0298, test_f1: 0.4500
 epoch: 29, train_loss: 1.0297, test_loss: 1.0142, test_f1: 0.4556
 epoch: 30, train_loss: 1.0325, test_loss: 1.0080, test_f1: 0.4592
 epoch: 31, train_loss: 1.0211, test_loss: 1.0113, test_f1: 0.4474
 epoch: 32, train_loss: 1.0219, test_loss: 1.0084, test_f1: 0.4456
 epoch: 33, train_loss: 1.0145, test_loss: 0.9971, test_f1: 0.4610
 epoch: 34, train_loss: 1.0099, test_loss: 0.9939, test_f1: 0.4717
 epoch: 35, train_loss: 1.0141, test_loss: 1.0072, test_f1: 0.4537
 epoch: 36, train_loss: 1.0055, test_loss: 1.0020, test_f1: 0.4679
 epoch: 37, train_loss: 1.0096, test_loss: 0.9946, test_f1: 0.4696
 epoch: 38, train_loss: 1.0060, test_loss: 1.0015, test_f1: 0.4597
 epoch: 39, train_loss: 0.9946, test_loss: 0.9980, test_f1: 0.4609
 epoch: 40, train_loss: 0.9898, test_loss: 0.9891, test_f1: 0.4581
 epoch: 41, train_loss: 0.9918, test_loss: 0.9891, test_f1: 0.4675
 epoch: 42, train_loss: 0.9850, test_loss: 0.9804, test_f1: 0.4701
 epoch: 43, train_loss: 0.9818, test_loss: 0.9844, test_f1: 0.4737
 epoch: 44, train_loss: 0.9770, test_loss: 0.9823, test_f1: 0.4737
 epoch: 45, train_loss: 0.9734, test_loss: 0.9770, test_f1: 0.4741
 epoch: 46, train_loss: 0.9705, test_loss: 0.9835, test_f1: 0.4777
 epoch: 47, train_loss: 0.9659, test_loss: 0.9848, test_f1: 0.4768
 epoch: 48, train_loss: 0.9605, test_loss: 0.9810, test_f1: 0.4885
 epoch: 49, train_loss: 0.9666, test_loss: 0.9960, test_f1: 0.4734
 epoch: 50, train_loss: 0.9401, test_loss: 0.9832, test_f1: 0.4766
 epoch: 51, train_loss: 0.9508, test_loss: 0.9853, test_f1: 0.4806
 epoch: 52, train_loss: 0.9489, test_loss: 0.9806, test_f1: 0.4844
 epoch: 53, train_loss: 0.9597, test_loss: 0.9791, test_f1: 0.4872
 epoch: 54, train_loss: 0.9533, test_loss: 0.9734, test_f1: 0.4908
 epoch: 55, train_loss: 0.9372, test_loss: 0.9820, test_f1: 0.4718
 epoch: 56, train_loss: 0.9425, test_loss: 0.9860, test_f1: 0.4760
 epoch: 57, train_loss: 0.9313, test_loss: 0.9866, test_f1: 0.4945
 epoch: 58, train_loss: 0.9302, test_loss: 0.9866, test_f1: 0.4825
 epoch: 59, train_loss: 0.9358, test_loss: 0.9859, test_f1: 0.4961
 epoch: 60, train_loss: 0.9300, test_loss: 0.9912, test_f1: 0.4767
 epoch: 61, train_loss: 0.9236, test_loss: 0.9928, test_f1: 0.4818
 epoch: 62, train_loss: 0.9367, test_loss: 0.9826, test_f1: 0.5002
 epoch: 63, train_loss: 0.9253, test_loss: 0.9866, test_f1: 0.4926
 epoch: 64, train_loss: 0.9394, test_loss: 0.9937, test_f1: 0.4879
 epoch: 65, train_loss: 0.9323, test_loss: 0.9910, test_f1: 0.4927
 epoch: 66, train_loss: 0.9135, test_loss: 0.9872, test_f1: 0.4860
 epoch: 67, train_loss: 0.9161, test_loss: 0.9962, test_f1: 0.4845
 epoch: 68, train_loss: 0.9403, test_loss: 0.9914, test_f1: 0.4899
 epoch: 69, train_loss: 0.9201, test_loss: 0.9902, test_f1: 0.4948
 epoch: 70, train_loss: 0.9147, test_loss: 0.9933, test_f1: 0.4983
 epoch: 71, train_loss: 0.9154, test_loss: 0.9991, test_f1: 0.4887
 epoch: 72, train_loss: 0.9183, test_loss: 0.9881, test_f1: 0.4939
 epoch: 73, train_loss: 0.9195, test_loss: 0.9808, test_f1: 0.5012
 epoch: 74, train_loss: 0.9147, test_loss: 0.9895, test_f1: 0.5040
 epoch: 75, train_loss: 0.9096, test_loss: 0.9868, test_f1: 0.4973
 epoch: 76, train_loss: 0.9244, test_loss: 0.9938, test_f1: 0.4952
 epoch: 77, train_loss: 0.9166, test_loss: 0.9852, test_f1: 0.4964
 epoch: 78, train_loss: 0.9023, test_loss: 0.9888, test_f1: 0.4980
 epoch: 79, train_loss: 0.9120, test_loss: 0.9969, test_f1: 0.4991
 epoch: 80, train_loss: 0.9124, test_loss: 0.9902, test_f1: 0.5016
 epoch: 81, train_loss: 0.9114, test_loss: 0.9908, test_f1: 0.4960
 epoch: 82, train_loss: 0.9084, test_loss: 0.9923, test_f1: 0.4997
 epoch: 83, train_loss: 0.9064, test_loss: 0.9974, test_f1: 0.4998
 epoch: 84, train_loss: 0.8934, test_loss: 0.9871, test_f1: 0.5051
 epoch: 85, train_loss: 0.9062, test_loss: 0.9945, test_f1: 0.4989
 epoch: 86, train_loss: 0.9076, test_loss: 0.9932, test_f1: 0.5031
 epoch: 87, train_loss: 0.8966, test_loss: 1.0009, test_f1: 0.4988
 epoch: 88, train_loss: 0.8983, test_loss: 0.9948, test_f1: 0.5024
 epoch: 89, train_loss: 0.8941, test_loss: 0.9869, test_f1: 0.5073
 epoch: 90, train_loss: 0.8982, test_loss: 0.9893, test_f1: 0.5089
 epoch: 91, train_loss: 0.8926, test_loss: 0.9869, test_f1: 0.5101
 epoch: 92, train_loss: 0.9037, test_loss: 0.9871, test_f1: 0.5183
 epoch: 93, train_loss: 0.8841, test_loss: 1.0023, test_f1: 0.5054
 epoch: 94, train_loss: 0.8856, test_loss: 1.0030, test_f1: 0.4997
 epoch: 95, train_loss: 0.8831, test_loss: 1.0064, test_f1: 0.4996
 epoch: 96, train_loss: 0.8918, test_loss: 0.9928, test_f1: 0.5086
 epoch: 97, train_loss: 0.8906, test_loss: 1.0020, test_f1: 0.5083
 epoch: 98, train_loss: 0.8926, test_loss: 1.0008, test_f1: 0.5054
 epoch: 99, train_loss: 0.8701, test_loss: 1.0089, test_f1: 0.5009
##################ITERATION #9 ****************************************
 epoch: 0, train_loss: 1.3717, test_loss: 1.2311, test_f1: 0.3575
 epoch: 1, train_loss: 1.2855, test_loss: 1.1932, test_f1: 0.3853
 epoch: 2, train_loss: 1.2480, test_loss: 1.1673, test_f1: 0.4108
 epoch: 3, train_loss: 1.2310, test_loss: 1.1559, test_f1: 0.4378
 epoch: 4, train_loss: 1.2122, test_loss: 1.1396, test_f1: 0.4191
 epoch: 5, train_loss: 1.1987, test_loss: 1.1358, test_f1: 0.4303
 epoch: 6, train_loss: 1.1756, test_loss: 1.1154, test_f1: 0.4331
 epoch: 7, train_loss: 1.1661, test_loss: 1.1220, test_f1: 0.4228
 epoch: 8, train_loss: 1.1496, test_loss: 1.0882, test_f1: 0.4277
 epoch: 9, train_loss: 1.1440, test_loss: 1.0876, test_f1: 0.4541
 epoch: 10, train_loss: 1.1345, test_loss: 1.0845, test_f1: 0.4436
 epoch: 11, train_loss: 1.1279, test_loss: 1.0664, test_f1: 0.4446
 epoch: 12, train_loss: 1.1167, test_loss: 1.0617, test_f1: 0.4416
 epoch: 13, train_loss: 1.1120, test_loss: 1.0541, test_f1: 0.4344
 epoch: 14, train_loss: 1.1002, test_loss: 1.0590, test_f1: 0.4471
 epoch: 15, train_loss: 1.1045, test_loss: 1.0624, test_f1: 0.4238
 epoch: 16, train_loss: 1.0957, test_loss: 1.0513, test_f1: 0.4210
 epoch: 17, train_loss: 1.0844, test_loss: 1.0366, test_f1: 0.4423
 epoch: 18, train_loss: 1.0840, test_loss: 1.0389, test_f1: 0.4546
 epoch: 19, train_loss: 1.0838, test_loss: 1.0615, test_f1: 0.4232
 epoch: 20, train_loss: 1.0675, test_loss: 1.0325, test_f1: 0.4180
 epoch: 21, train_loss: 1.0581, test_loss: 1.0234, test_f1: 0.4536
 epoch: 22, train_loss: 1.0590, test_loss: 1.0218, test_f1: 0.4473
 epoch: 23, train_loss: 1.0495, test_loss: 1.0084, test_f1: 0.4524
 epoch: 24, train_loss: 1.0457, test_loss: 1.0130, test_f1: 0.4704
 epoch: 25, train_loss: 1.0383, test_loss: 1.0018, test_f1: 0.4660
 epoch: 26, train_loss: 1.0396, test_loss: 1.0039, test_f1: 0.4561
 epoch: 27, train_loss: 1.0256, test_loss: 1.0019, test_f1: 0.4670
 epoch: 28, train_loss: 1.0141, test_loss: 1.0095, test_f1: 0.4666
 epoch: 29, train_loss: 1.0197, test_loss: 0.9944, test_f1: 0.4803
 epoch: 30, train_loss: 1.0131, test_loss: 0.9903, test_f1: 0.4666
 epoch: 31, train_loss: 1.0106, test_loss: 0.9989, test_f1: 0.4757
 epoch: 32, train_loss: 1.0066, test_loss: 0.9835, test_f1: 0.4511
 epoch: 33, train_loss: 1.0016, test_loss: 0.9823, test_f1: 0.4729
 epoch: 34, train_loss: 0.9981, test_loss: 0.9888, test_f1: 0.4679
 epoch: 35, train_loss: 0.9923, test_loss: 0.9873, test_f1: 0.4782
 epoch: 36, train_loss: 0.9822, test_loss: 1.0267, test_f1: 0.4492
 epoch: 37, train_loss: 0.9779, test_loss: 0.9890, test_f1: 0.4687
 epoch: 38, train_loss: 0.9834, test_loss: 0.9855, test_f1: 0.4858
 epoch: 39, train_loss: 0.9726, test_loss: 0.9702, test_f1: 0.4860
 epoch: 40, train_loss: 0.9764, test_loss: 0.9732, test_f1: 0.4904
 epoch: 41, train_loss: 0.9730, test_loss: 0.9706, test_f1: 0.4906
 epoch: 42, train_loss: 0.9572, test_loss: 0.9924, test_f1: 0.4943
 epoch: 43, train_loss: 0.9730, test_loss: 0.9850, test_f1: 0.4910
 epoch: 44, train_loss: 0.9637, test_loss: 0.9730, test_f1: 0.4864
 epoch: 45, train_loss: 0.9625, test_loss: 1.0217, test_f1: 0.4396
 epoch: 46, train_loss: 0.9496, test_loss: 0.9742, test_f1: 0.4900
 epoch: 47, train_loss: 0.9481, test_loss: 0.9680, test_f1: 0.4966
 epoch: 48, train_loss: 0.9501, test_loss: 0.9773, test_f1: 0.4784
 epoch: 49, train_loss: 0.9404, test_loss: 0.9673, test_f1: 0.4784
 epoch: 50, train_loss: 0.9421, test_loss: 0.9683, test_f1: 0.4913
 epoch: 51, train_loss: 0.9345, test_loss: 0.9631, test_f1: 0.4893
 epoch: 52, train_loss: 0.9205, test_loss: 0.9670, test_f1: 0.4947
 epoch: 53, train_loss: 0.9336, test_loss: 0.9824, test_f1: 0.4805
 epoch: 54, train_loss: 0.9250, test_loss: 0.9694, test_f1: 0.4889
 epoch: 55, train_loss: 0.9183, test_loss: 0.9651, test_f1: 0.4929
 epoch: 56, train_loss: 0.9236, test_loss: 0.9721, test_f1: 0.4861
 epoch: 57, train_loss: 0.9149, test_loss: 0.9596, test_f1: 0.4918
 epoch: 58, train_loss: 0.9173, test_loss: 0.9643, test_f1: 0.4887
 epoch: 59, train_loss: 0.9221, test_loss: 0.9771, test_f1: 0.4671
 epoch: 60, train_loss: 0.9129, test_loss: 0.9678, test_f1: 0.4895
 epoch: 61, train_loss: 0.9003, test_loss: 0.9614, test_f1: 0.4946
 epoch: 62, train_loss: 0.9218, test_loss: 0.9690, test_f1: 0.4814
 epoch: 63, train_loss: 0.9085, test_loss: 0.9575, test_f1: 0.4968
 epoch: 64, train_loss: 0.9068, test_loss: 0.9614, test_f1: 0.4965
 epoch: 65, train_loss: 0.9100, test_loss: 0.9728, test_f1: 0.4900
 epoch: 66, train_loss: 0.9029, test_loss: 0.9651, test_f1: 0.4912
 epoch: 67, train_loss: 0.8989, test_loss: 0.9681, test_f1: 0.4703
 epoch: 68, train_loss: 0.9084, test_loss: 0.9683, test_f1: 0.4928
 epoch: 69, train_loss: 0.9019, test_loss: 0.9550, test_f1: 0.4870
 epoch: 70, train_loss: 0.9059, test_loss: 0.9819, test_f1: 0.4716
 epoch: 71, train_loss: 0.8978, test_loss: 0.9703, test_f1: 0.4806
 epoch: 72, train_loss: 0.9059, test_loss: 0.9723, test_f1: 0.4832
 epoch: 73, train_loss: 0.8994, test_loss: 0.9680, test_f1: 0.4863
 epoch: 74, train_loss: 0.8989, test_loss: 0.9503, test_f1: 0.4964
 epoch: 75, train_loss: 0.8956, test_loss: 0.9710, test_f1: 0.4894
 epoch: 76, train_loss: 0.8949, test_loss: 0.9540, test_f1: 0.4957
 epoch: 77, train_loss: 0.8918, test_loss: 0.9725, test_f1: 0.4871
 epoch: 78, train_loss: 0.8929, test_loss: 0.9586, test_f1: 0.4883
 epoch: 79, train_loss: 0.8858, test_loss: 0.9625, test_f1: 0.4879
 epoch: 80, train_loss: 0.8887, test_loss: 0.9651, test_f1: 0.4844
 epoch: 81, train_loss: 0.8827, test_loss: 0.9697, test_f1: 0.4863
 epoch: 82, train_loss: 0.8869, test_loss: 0.9821, test_f1: 0.4881
 epoch: 83, train_loss: 0.8859, test_loss: 0.9716, test_f1: 0.4851
 epoch: 84, train_loss: 0.8782, test_loss: 0.9633, test_f1: 0.4834
 epoch: 85, train_loss: 0.8761, test_loss: 0.9606, test_f1: 0.4832
 epoch: 86, train_loss: 0.8900, test_loss: 0.9843, test_f1: 0.4788
 epoch: 87, train_loss: 0.8772, test_loss: 0.9546, test_f1: 0.4736
 epoch: 88, train_loss: 0.8848, test_loss: 0.9601, test_f1: 0.4827
 epoch: 89, train_loss: 0.8898, test_loss: 0.9615, test_f1: 0.4912
 epoch: 90, train_loss: 0.8784, test_loss: 0.9658, test_f1: 0.4827
 epoch: 91, train_loss: 0.8791, test_loss: 0.9637, test_f1: 0.4957
 epoch: 92, train_loss: 0.8673, test_loss: 0.9764, test_f1: 0.4825
 epoch: 93, train_loss: 0.8690, test_loss: 0.9694, test_f1: 0.4838
 epoch: 94, train_loss: 0.8678, test_loss: 0.9781, test_f1: 0.4816
 epoch: 95, train_loss: 0.8579, test_loss: 0.9732, test_f1: 0.4799
 epoch: 96, train_loss: 0.8670, test_loss: 0.9571, test_f1: 0.4787
 epoch: 97, train_loss: 0.8663, test_loss: 0.9847, test_f1: 0.4801
 epoch: 98, train_loss: 0.8728, test_loss: 0.9711, test_f1: 0.4760
 epoch: 99, train_loss: 0.8684, test_loss: 0.9597, test_f1: 0.4818

Training completed in 549.45 seconds
Best F1: 0.5299 at epoch 93
Mean F1 across iterations: 0.5159  0.0110
========================FINAL RESULTS================================
FEGIN weighted F1: 0.5299  0.0110
python main.py --data ltspice_examples --representation component_component --model FEGIN --layers 2 --hiddens 64 --batch_size 64 --lr 0.0001 --emb_size 128 --epochs 100 --save_appendix component_component_L2_H64_BS64_LR0.0001_E128 --no_val
-----



STDERR:
  File "main.py", line 370, in <module>
    main()
  File "main.py", line 254, in main
    dataset = dataset_class(
  File "/home/philip/projects/ltspice_examples_code_repo/Circuit-Completion-Using-GNNs/component_classification_with_link_prediction_head/evaluation/FEGIN/kernel/circuit_datasets.py", line 15, in __init__
    self.data, self.slices = torch.load(self.processed_paths[0])
  File "/home/philip/.local/lib/python3.8/site-packages/torch/serialization.py", line 1040, in load
    warnings.warn(
  File "/usr/lib/python3.8/warnings.py", line 109, in _showwarnmsg
    sw(msg.message, msg.category, msg.filename, msg.lineno,
  File "main.py", line 47, in warn_with_traceback
    traceback.print_stack(file=log)
/home/philip/projects/ltspice_examples_code_repo/Circuit-Completion-Using-GNNs/component_classification_with_link_prediction_head/evaluation/FEGIN/kernel/circuit_datasets.py:15: FutureWarning: You are using `torch.load` with `weights_only=False` (the current default value), which uses the default pickle module implicitly. It is possible to construct malicious pickle data which will execute arbitrary code during unpickling (See https://github.com/pytorch/pytorch/blob/main/SECURITY.md#untrusted-models for more details). In a future release, the default value for `weights_only` will be flipped to `True`. This limits the functions that could be executed during unpickling. Arbitrary objects will no longer be allowed to be loaded via this mode unless they are explicitly allowlisted by the user via `torch.serialization.add_safe_globals`. We recommend you start setting `weights_only=True` for any use case where you don't have full control of the loaded file. Please open an issue on GitHub for any issues related to this experimental feature.
  self.data, self.slices = torch.load(self.processed_paths[0])
