STDOUT:
Results will be saved in /home/philip/projects/ltspice_examples_code_repo/Circuit-Completion-Using-GNNs/component_classification_with_link_prediction_head/evaluation/FEGIN/results/model_FEGIN_dataset_ltspice_examples
Command line input: python main.py --data ltspice_examples --representation component_net --model FEGIN --layers 3 --hiddens 16 --batch_size 256 --lr 0.01 --emb_size 250 --epochs 100 --save_appendix component_net_L3_H16_BS256_LR0.01_E250 --no_val
 is saved.
-----
ltspice_examples - FEGIN
Using 3 layers, 16 hidden units, h = 2
Loading component_net representation dataset
ENTERED
Training FEGIN on component_net representation
Train: 3558, Test: 846
##################ITERATION #0 ****************************************
 epoch: 0, train_loss: 1.3074, test_loss: 1.2986, test_f1: 0.2270
 epoch: 1, train_loss: 1.2223, test_loss: 1.2317, test_f1: 0.2270
 epoch: 2, train_loss: 1.1810, test_loss: 1.1980, test_f1: 0.2270
 epoch: 3, train_loss: 1.1440, test_loss: 1.1529, test_f1: 0.2270
 epoch: 4, train_loss: 1.1145, test_loss: 1.1243, test_f1: 0.3822
 epoch: 5, train_loss: 1.0754, test_loss: 1.0304, test_f1: 0.4706
 epoch: 6, train_loss: 1.0327, test_loss: 1.0022, test_f1: 0.5096
 epoch: 7, train_loss: 0.9954, test_loss: 0.9927, test_f1: 0.4714
 epoch: 8, train_loss: 0.9766, test_loss: 1.0048, test_f1: 0.4251
 epoch: 9, train_loss: 0.9622, test_loss: 0.9456, test_f1: 0.5012
 epoch: 10, train_loss: 0.9562, test_loss: 0.9782, test_f1: 0.4532
 epoch: 11, train_loss: 0.9578, test_loss: 0.9999, test_f1: 0.4977
 epoch: 12, train_loss: 0.9327, test_loss: 0.9595, test_f1: 0.5251
 epoch: 13, train_loss: 0.9141, test_loss: 0.9334, test_f1: 0.5216
 epoch: 14, train_loss: 0.9103, test_loss: 1.0566, test_f1: 0.4677
 epoch: 15, train_loss: 0.9138, test_loss: 1.0065, test_f1: 0.4491
 epoch: 16, train_loss: 0.9063, test_loss: 0.9918, test_f1: 0.4796
 epoch: 17, train_loss: 0.8911, test_loss: 0.8870, test_f1: 0.5208
 epoch: 18, train_loss: 0.8960, test_loss: 0.9202, test_f1: 0.5525
 epoch: 19, train_loss: 0.8927, test_loss: 1.0200, test_f1: 0.5118
 epoch: 20, train_loss: 0.8836, test_loss: 0.9721, test_f1: 0.4940
 epoch: 21, train_loss: 0.8785, test_loss: 0.9405, test_f1: 0.4998
 epoch: 22, train_loss: 0.8883, test_loss: 0.9218, test_f1: 0.5099
 epoch: 23, train_loss: 0.8781, test_loss: 0.8638, test_f1: 0.5426
 epoch: 24, train_loss: 0.8668, test_loss: 0.9739, test_f1: 0.5231
 epoch: 25, train_loss: 0.8583, test_loss: 0.9752, test_f1: 0.5006
 epoch: 26, train_loss: 0.8599, test_loss: 0.9488, test_f1: 0.5178
 epoch: 27, train_loss: 0.8605, test_loss: 0.9049, test_f1: 0.5291
 epoch: 28, train_loss: 0.8448, test_loss: 0.9886, test_f1: 0.5012
 epoch: 29, train_loss: 0.8584, test_loss: 0.9566, test_f1: 0.5333
 epoch: 30, train_loss: 0.8636, test_loss: 0.9746, test_f1: 0.5239
 epoch: 31, train_loss: 0.8414, test_loss: 0.9005, test_f1: 0.5526
 epoch: 32, train_loss: 0.8402, test_loss: 0.9774, test_f1: 0.5004
 epoch: 33, train_loss: 0.8479, test_loss: 1.0309, test_f1: 0.4953
 epoch: 34, train_loss: 0.8385, test_loss: 0.9791, test_f1: 0.5473
 epoch: 35, train_loss: 0.8303, test_loss: 1.0247, test_f1: 0.5209
 epoch: 36, train_loss: 0.8200, test_loss: 0.9693, test_f1: 0.5433
 epoch: 37, train_loss: 0.8298, test_loss: 1.0498, test_f1: 0.5381
 epoch: 38, train_loss: 0.8329, test_loss: 0.9936, test_f1: 0.4860
 epoch: 39, train_loss: 0.8249, test_loss: 0.9255, test_f1: 0.5385
 epoch: 40, train_loss: 0.8264, test_loss: 0.9173, test_f1: 0.5229
 epoch: 41, train_loss: 0.8239, test_loss: 1.0755, test_f1: 0.5091
 epoch: 42, train_loss: 0.8392, test_loss: 0.9524, test_f1: 0.5037
 epoch: 43, train_loss: 0.8266, test_loss: 0.9334, test_f1: 0.5756
 epoch: 44, train_loss: 0.8178, test_loss: 0.9292, test_f1: 0.5400
 epoch: 45, train_loss: 0.8208, test_loss: 0.9405, test_f1: 0.5549
 epoch: 46, train_loss: 0.8142, test_loss: 1.0049, test_f1: 0.5002
 epoch: 47, train_loss: 0.7949, test_loss: 1.0259, test_f1: 0.5152
 epoch: 48, train_loss: 0.7913, test_loss: 1.0144, test_f1: 0.5411
 epoch: 49, train_loss: 0.7949, test_loss: 0.9766, test_f1: 0.5380
 epoch: 50, train_loss: 0.8018, test_loss: 0.9803, test_f1: 0.5666
 epoch: 51, train_loss: 0.7797, test_loss: 1.0145, test_f1: 0.5410
 epoch: 52, train_loss: 0.7745, test_loss: 1.0071, test_f1: 0.5398
 epoch: 53, train_loss: 0.7835, test_loss: 0.9999, test_f1: 0.5312
 epoch: 54, train_loss: 0.7717, test_loss: 0.9689, test_f1: 0.5922
 epoch: 55, train_loss: 0.7614, test_loss: 0.9517, test_f1: 0.5885
 epoch: 56, train_loss: 0.7593, test_loss: 1.0010, test_f1: 0.5421
 epoch: 57, train_loss: 0.7561, test_loss: 0.9661, test_f1: 0.5956
 epoch: 58, train_loss: 0.7650, test_loss: 1.0198, test_f1: 0.5456
 epoch: 59, train_loss: 0.7742, test_loss: 0.9744, test_f1: 0.5376
 epoch: 60, train_loss: 0.7588, test_loss: 0.9815, test_f1: 0.5832
 epoch: 61, train_loss: 0.7625, test_loss: 0.9300, test_f1: 0.5621
 epoch: 62, train_loss: 0.7624, test_loss: 0.9587, test_f1: 0.5815
 epoch: 63, train_loss: 0.7528, test_loss: 0.9928, test_f1: 0.5571
 epoch: 64, train_loss: 0.7521, test_loss: 0.9885, test_f1: 0.5504
 epoch: 65, train_loss: 0.7486, test_loss: 0.9593, test_f1: 0.5973
 epoch: 66, train_loss: 0.7658, test_loss: 1.0035, test_f1: 0.5575
 epoch: 67, train_loss: 0.7557, test_loss: 1.0155, test_f1: 0.5574
 epoch: 68, train_loss: 0.7535, test_loss: 1.0574, test_f1: 0.5422
 epoch: 69, train_loss: 0.7575, test_loss: 0.9797, test_f1: 0.5679
 epoch: 70, train_loss: 0.7486, test_loss: 0.9807, test_f1: 0.5559
 epoch: 71, train_loss: 0.7637, test_loss: 0.9956, test_f1: 0.5588
 epoch: 72, train_loss: 0.7518, test_loss: 0.9679, test_f1: 0.5782
 epoch: 73, train_loss: 0.7435, test_loss: 1.0392, test_f1: 0.5356
 epoch: 74, train_loss: 0.7422, test_loss: 1.0260, test_f1: 0.5551
 epoch: 75, train_loss: 0.7439, test_loss: 1.0149, test_f1: 0.5319
 epoch: 76, train_loss: 0.7463, test_loss: 1.0181, test_f1: 0.5728
 epoch: 77, train_loss: 0.7527, test_loss: 1.0222, test_f1: 0.5631
 epoch: 78, train_loss: 0.7487, test_loss: 0.9921, test_f1: 0.5666
 epoch: 79, train_loss: 0.7449, test_loss: 1.0224, test_f1: 0.5433
 epoch: 80, train_loss: 0.7238, test_loss: 1.0352, test_f1: 0.5811
 epoch: 81, train_loss: 0.7325, test_loss: 1.0643, test_f1: 0.5550
 epoch: 82, train_loss: 0.7384, test_loss: 1.0444, test_f1: 0.5404
 epoch: 83, train_loss: 0.7370, test_loss: 1.0424, test_f1: 0.5471
 epoch: 84, train_loss: 0.7414, test_loss: 0.9927, test_f1: 0.5428
 epoch: 85, train_loss: 0.7428, test_loss: 0.9887, test_f1: 0.5683
 epoch: 86, train_loss: 0.7307, test_loss: 1.0316, test_f1: 0.5455
 epoch: 87, train_loss: 0.7245, test_loss: 0.9979, test_f1: 0.5458
 epoch: 88, train_loss: 0.7245, test_loss: 1.0389, test_f1: 0.5686
 epoch: 89, train_loss: 0.7355, test_loss: 0.9929, test_f1: 0.5926
 epoch: 90, train_loss: 0.7336, test_loss: 1.0191, test_f1: 0.5685
 epoch: 91, train_loss: 0.7274, test_loss: 1.0063, test_f1: 0.5699
 epoch: 92, train_loss: 0.7165, test_loss: 0.9793, test_f1: 0.5843
 epoch: 93, train_loss: 0.7216, test_loss: 0.9940, test_f1: 0.5766
 epoch: 94, train_loss: 0.7149, test_loss: 1.0324, test_f1: 0.5803
 epoch: 95, train_loss: 0.7105, test_loss: 1.1238, test_f1: 0.5223
 epoch: 96, train_loss: 0.7164, test_loss: 1.0134, test_f1: 0.5967
 epoch: 97, train_loss: 0.7170, test_loss: 1.0568, test_f1: 0.5767
 epoch: 98, train_loss: 0.7388, test_loss: 1.0496, test_f1: 0.5732
 epoch: 99, train_loss: 0.7374, test_loss: 1.0401, test_f1: 0.5726
##################ITERATION #1 ****************************************
 epoch: 0, train_loss: 1.3140, test_loss: 1.2966, test_f1: 0.2270
 epoch: 1, train_loss: 1.1936, test_loss: 1.2210, test_f1: 0.2631
 epoch: 2, train_loss: 1.1268, test_loss: 1.0947, test_f1: 0.3662
 epoch: 3, train_loss: 1.0861, test_loss: 1.2986, test_f1: 0.2994
 epoch: 4, train_loss: 1.0363, test_loss: 1.0147, test_f1: 0.4598
 epoch: 5, train_loss: 1.0269, test_loss: 1.0140, test_f1: 0.4844
 epoch: 6, train_loss: 0.9964, test_loss: 1.1041, test_f1: 0.4251
 epoch: 7, train_loss: 0.9839, test_loss: 1.1433, test_f1: 0.4036
 epoch: 8, train_loss: 0.9770, test_loss: 0.9593, test_f1: 0.5208
 epoch: 9, train_loss: 0.9629, test_loss: 0.9420, test_f1: 0.5071
 epoch: 10, train_loss: 0.9505, test_loss: 1.0146, test_f1: 0.4842
 epoch: 11, train_loss: 0.9461, test_loss: 1.0113, test_f1: 0.4786
 epoch: 12, train_loss: 0.9313, test_loss: 0.9968, test_f1: 0.5310
 epoch: 13, train_loss: 0.9377, test_loss: 0.9819, test_f1: 0.5033
 epoch: 14, train_loss: 0.9293, test_loss: 1.0202, test_f1: 0.5205
 epoch: 15, train_loss: 0.9122, test_loss: 1.0278, test_f1: 0.4719
 epoch: 16, train_loss: 0.9177, test_loss: 0.9833, test_f1: 0.4964
 epoch: 17, train_loss: 0.9067, test_loss: 1.1682, test_f1: 0.4656
 epoch: 18, train_loss: 0.8984, test_loss: 0.9151, test_f1: 0.4996
 epoch: 19, train_loss: 0.8959, test_loss: 1.0407, test_f1: 0.5044
 epoch: 20, train_loss: 0.8995, test_loss: 0.9227, test_f1: 0.5052
 epoch: 21, train_loss: 0.8972, test_loss: 0.9537, test_f1: 0.4846
 epoch: 22, train_loss: 0.8962, test_loss: 0.9525, test_f1: 0.5017
 epoch: 23, train_loss: 0.8924, test_loss: 1.0227, test_f1: 0.4811
 epoch: 24, train_loss: 0.8815, test_loss: 0.8791, test_f1: 0.5361
 epoch: 25, train_loss: 0.8794, test_loss: 0.9717, test_f1: 0.4927
 epoch: 26, train_loss: 0.8753, test_loss: 0.9976, test_f1: 0.4921
 epoch: 27, train_loss: 0.8578, test_loss: 0.9438, test_f1: 0.5102
 epoch: 28, train_loss: 0.8598, test_loss: 0.9706, test_f1: 0.5044
 epoch: 29, train_loss: 0.8585, test_loss: 1.0005, test_f1: 0.4975
 epoch: 30, train_loss: 0.8559, test_loss: 0.9297, test_f1: 0.5277
 epoch: 31, train_loss: 0.8456, test_loss: 0.9157, test_f1: 0.5428
 epoch: 32, train_loss: 0.8566, test_loss: 0.9140, test_f1: 0.5024
 epoch: 33, train_loss: 0.8662, test_loss: 1.0319, test_f1: 0.5002
 epoch: 34, train_loss: 0.8529, test_loss: 1.0754, test_f1: 0.5030
 epoch: 35, train_loss: 0.8603, test_loss: 1.0871, test_f1: 0.4821
 epoch: 36, train_loss: 0.8460, test_loss: 1.0610, test_f1: 0.4857
 epoch: 37, train_loss: 0.8374, test_loss: 0.8710, test_f1: 0.5339
 epoch: 38, train_loss: 0.8482, test_loss: 0.8946, test_f1: 0.5109
 epoch: 39, train_loss: 0.8577, test_loss: 0.8606, test_f1: 0.5509
 epoch: 40, train_loss: 0.8514, test_loss: 0.8717, test_f1: 0.5143
 epoch: 41, train_loss: 0.8431, test_loss: 0.9704, test_f1: 0.5496
 epoch: 42, train_loss: 0.8485, test_loss: 0.9056, test_f1: 0.5244
 epoch: 43, train_loss: 0.8196, test_loss: 0.8844, test_f1: 0.5365
 epoch: 44, train_loss: 0.8250, test_loss: 1.0689, test_f1: 0.4917
 epoch: 45, train_loss: 0.8288, test_loss: 0.9470, test_f1: 0.5405
 epoch: 46, train_loss: 0.8312, test_loss: 0.9252, test_f1: 0.5023
 epoch: 47, train_loss: 0.8320, test_loss: 1.0396, test_f1: 0.4893
 epoch: 48, train_loss: 0.8300, test_loss: 0.9019, test_f1: 0.5113
 epoch: 49, train_loss: 0.8308, test_loss: 0.8986, test_f1: 0.5470
 epoch: 50, train_loss: 0.8217, test_loss: 0.9234, test_f1: 0.5726
 epoch: 51, train_loss: 0.8078, test_loss: 0.9989, test_f1: 0.5029
 epoch: 52, train_loss: 0.7986, test_loss: 0.9063, test_f1: 0.5483
 epoch: 53, train_loss: 0.7932, test_loss: 0.8634, test_f1: 0.5631
 epoch: 54, train_loss: 0.7888, test_loss: 0.9720, test_f1: 0.4895
 epoch: 55, train_loss: 0.7917, test_loss: 0.8719, test_f1: 0.5829
 epoch: 56, train_loss: 0.7782, test_loss: 0.9674, test_f1: 0.5203
 epoch: 57, train_loss: 0.7856, test_loss: 0.9425, test_f1: 0.5894
 epoch: 58, train_loss: 0.7910, test_loss: 0.9507, test_f1: 0.5319
 epoch: 59, train_loss: 0.7754, test_loss: 1.0047, test_f1: 0.5384
 epoch: 60, train_loss: 0.7786, test_loss: 0.9800, test_f1: 0.5509
 epoch: 61, train_loss: 0.7751, test_loss: 0.9867, test_f1: 0.5502
 epoch: 62, train_loss: 0.7732, test_loss: 1.0023, test_f1: 0.5508
 epoch: 63, train_loss: 0.7654, test_loss: 1.0147, test_f1: 0.5384
 epoch: 64, train_loss: 0.7694, test_loss: 1.0047, test_f1: 0.5157
 epoch: 65, train_loss: 0.7878, test_loss: 0.9833, test_f1: 0.5067
 epoch: 66, train_loss: 0.7824, test_loss: 0.9694, test_f1: 0.5636
 epoch: 67, train_loss: 0.7675, test_loss: 0.9779, test_f1: 0.5236
 epoch: 68, train_loss: 0.7836, test_loss: 1.0055, test_f1: 0.5117
 epoch: 69, train_loss: 0.7646, test_loss: 0.8977, test_f1: 0.5388
 epoch: 70, train_loss: 0.7742, test_loss: 1.0230, test_f1: 0.5276
 epoch: 71, train_loss: 0.7629, test_loss: 0.9917, test_f1: 0.5531
 epoch: 72, train_loss: 0.7624, test_loss: 0.9850, test_f1: 0.5402
 epoch: 73, train_loss: 0.7518, test_loss: 0.9418, test_f1: 0.5536
 epoch: 74, train_loss: 0.7517, test_loss: 0.9697, test_f1: 0.5329
 epoch: 75, train_loss: 0.7549, test_loss: 0.9535, test_f1: 0.5619
 epoch: 76, train_loss: 0.7585, test_loss: 0.9662, test_f1: 0.5402
 epoch: 77, train_loss: 0.7570, test_loss: 0.9344, test_f1: 0.5533
 epoch: 78, train_loss: 0.7495, test_loss: 0.9986, test_f1: 0.5325
 epoch: 79, train_loss: 0.7393, test_loss: 0.9239, test_f1: 0.5638
 epoch: 80, train_loss: 0.7436, test_loss: 0.9487, test_f1: 0.5409
 epoch: 81, train_loss: 0.7538, test_loss: 1.0165, test_f1: 0.5384
 epoch: 82, train_loss: 0.7521, test_loss: 1.0263, test_f1: 0.5402
 epoch: 83, train_loss: 0.7581, test_loss: 0.9614, test_f1: 0.5271
 epoch: 84, train_loss: 0.7532, test_loss: 0.9198, test_f1: 0.5349
 epoch: 85, train_loss: 0.7359, test_loss: 0.9928, test_f1: 0.5436
 epoch: 86, train_loss: 0.7364, test_loss: 0.8941, test_f1: 0.5783
 epoch: 87, train_loss: 0.7454, test_loss: 1.0130, test_f1: 0.5356
 epoch: 88, train_loss: 0.7425, test_loss: 0.9472, test_f1: 0.5359
 epoch: 89, train_loss: 0.7348, test_loss: 1.0237, test_f1: 0.5564
 epoch: 90, train_loss: 0.7344, test_loss: 0.9068, test_f1: 0.5657
 epoch: 91, train_loss: 0.7457, test_loss: 0.9456, test_f1: 0.5619
 epoch: 92, train_loss: 0.7446, test_loss: 0.9115, test_f1: 0.5500
 epoch: 93, train_loss: 0.7460, test_loss: 0.9435, test_f1: 0.5615
 epoch: 94, train_loss: 0.7609, test_loss: 1.0736, test_f1: 0.5088
 epoch: 95, train_loss: 0.7331, test_loss: 0.9286, test_f1: 0.5904
 epoch: 96, train_loss: 0.7308, test_loss: 0.9263, test_f1: 0.5673
 epoch: 97, train_loss: 0.7270, test_loss: 0.9497, test_f1: 0.5425
 epoch: 98, train_loss: 0.7383, test_loss: 0.9740, test_f1: 0.5331
 epoch: 99, train_loss: 0.7123, test_loss: 0.9859, test_f1: 0.5693
##################ITERATION #2 ****************************************
 epoch: 0, train_loss: 1.2497, test_loss: 1.2788, test_f1: 0.2270
 epoch: 1, train_loss: 1.1207, test_loss: 1.1137, test_f1: 0.3513
 epoch: 2, train_loss: 1.0628, test_loss: 1.0789, test_f1: 0.3317
 epoch: 3, train_loss: 1.0473, test_loss: 1.1253, test_f1: 0.3262
 epoch: 4, train_loss: 1.0376, test_loss: 1.0776, test_f1: 0.4180
 epoch: 5, train_loss: 1.0275, test_loss: 1.0478, test_f1: 0.4390
 epoch: 6, train_loss: 1.0146, test_loss: 1.0554, test_f1: 0.3943
 epoch: 7, train_loss: 1.0129, test_loss: 1.0306, test_f1: 0.4101
 epoch: 8, train_loss: 1.0046, test_loss: 1.0498, test_f1: 0.4248
 epoch: 9, train_loss: 0.9995, test_loss: 1.0264, test_f1: 0.4369
 epoch: 10, train_loss: 0.9895, test_loss: 1.0300, test_f1: 0.4428
 epoch: 11, train_loss: 0.9754, test_loss: 1.0409, test_f1: 0.4713
 epoch: 12, train_loss: 0.9729, test_loss: 1.0155, test_f1: 0.4730
 epoch: 13, train_loss: 0.9652, test_loss: 1.0712, test_f1: 0.4454
 epoch: 14, train_loss: 0.9653, test_loss: 0.9931, test_f1: 0.4813
 epoch: 15, train_loss: 0.9568, test_loss: 0.9510, test_f1: 0.4946
 epoch: 16, train_loss: 0.9554, test_loss: 0.9875, test_f1: 0.4817
 epoch: 17, train_loss: 0.9316, test_loss: 1.0377, test_f1: 0.4063
 epoch: 18, train_loss: 0.9462, test_loss: 1.0060, test_f1: 0.4738
 epoch: 19, train_loss: 0.9322, test_loss: 0.9876, test_f1: 0.4980
 epoch: 20, train_loss: 0.9202, test_loss: 1.0193, test_f1: 0.4809
 epoch: 21, train_loss: 0.9153, test_loss: 1.0162, test_f1: 0.4942
 epoch: 22, train_loss: 0.9177, test_loss: 0.9636, test_f1: 0.5110
 epoch: 23, train_loss: 0.9437, test_loss: 1.0194, test_f1: 0.4487
 epoch: 24, train_loss: 0.9239, test_loss: 0.9331, test_f1: 0.5084
 epoch: 25, train_loss: 0.9084, test_loss: 1.0954, test_f1: 0.4767
 epoch: 26, train_loss: 0.9012, test_loss: 1.0236, test_f1: 0.5018
 epoch: 27, train_loss: 0.9170, test_loss: 1.0286, test_f1: 0.5103
 epoch: 28, train_loss: 0.9117, test_loss: 1.0284, test_f1: 0.4617
 epoch: 29, train_loss: 0.9006, test_loss: 0.9524, test_f1: 0.5122
 epoch: 30, train_loss: 0.8901, test_loss: 1.0478, test_f1: 0.4793
 epoch: 31, train_loss: 0.8967, test_loss: 0.9326, test_f1: 0.5020
 epoch: 32, train_loss: 0.9108, test_loss: 0.9614, test_f1: 0.4972
 epoch: 33, train_loss: 0.8907, test_loss: 0.9851, test_f1: 0.4926
 epoch: 34, train_loss: 0.8868, test_loss: 0.9576, test_f1: 0.5071
 epoch: 35, train_loss: 0.8941, test_loss: 1.0796, test_f1: 0.4636
 epoch: 36, train_loss: 0.8879, test_loss: 0.9885, test_f1: 0.4981
 epoch: 37, train_loss: 0.8931, test_loss: 0.9502, test_f1: 0.5175
 epoch: 38, train_loss: 0.8780, test_loss: 0.9678, test_f1: 0.5094
 epoch: 39, train_loss: 0.8711, test_loss: 0.9279, test_f1: 0.5346
 epoch: 40, train_loss: 0.8630, test_loss: 0.9261, test_f1: 0.5680
 epoch: 41, train_loss: 0.8696, test_loss: 0.9638, test_f1: 0.5119
 epoch: 42, train_loss: 0.8694, test_loss: 0.9759, test_f1: 0.5380
 epoch: 43, train_loss: 0.8582, test_loss: 0.9432, test_f1: 0.5161
 epoch: 44, train_loss: 0.8570, test_loss: 0.9222, test_f1: 0.5537
 epoch: 45, train_loss: 0.8438, test_loss: 0.9682, test_f1: 0.5043
 epoch: 46, train_loss: 0.8327, test_loss: 0.9265, test_f1: 0.5524
 epoch: 47, train_loss: 0.8353, test_loss: 0.9140, test_f1: 0.5547
 epoch: 48, train_loss: 0.8526, test_loss: 0.9526, test_f1: 0.5526
 epoch: 49, train_loss: 0.8504, test_loss: 0.8842, test_f1: 0.5481
 epoch: 50, train_loss: 0.8468, test_loss: 0.9093, test_f1: 0.5353
 epoch: 51, train_loss: 0.8214, test_loss: 0.8864, test_f1: 0.5629
 epoch: 52, train_loss: 0.8285, test_loss: 0.8956, test_f1: 0.5634
 epoch: 53, train_loss: 0.8187, test_loss: 0.9063, test_f1: 0.5669
 epoch: 54, train_loss: 0.8220, test_loss: 0.9026, test_f1: 0.5618
 epoch: 55, train_loss: 0.8131, test_loss: 0.9059, test_f1: 0.5693
 epoch: 56, train_loss: 0.8075, test_loss: 0.9056, test_f1: 0.5717
 epoch: 57, train_loss: 0.7929, test_loss: 0.8974, test_f1: 0.5730
 epoch: 58, train_loss: 0.8060, test_loss: 0.8976, test_f1: 0.5846
 epoch: 59, train_loss: 0.7989, test_loss: 0.9371, test_f1: 0.5328
 epoch: 60, train_loss: 0.8102, test_loss: 0.8958, test_f1: 0.5802
 epoch: 61, train_loss: 0.7994, test_loss: 0.8934, test_f1: 0.5773
 epoch: 62, train_loss: 0.8017, test_loss: 0.9111, test_f1: 0.5691
 epoch: 63, train_loss: 0.7949, test_loss: 0.9338, test_f1: 0.5546
 epoch: 64, train_loss: 0.7991, test_loss: 0.9596, test_f1: 0.5526
 epoch: 65, train_loss: 0.7925, test_loss: 0.8883, test_f1: 0.5704
 epoch: 66, train_loss: 0.7880, test_loss: 0.9102, test_f1: 0.5789
 epoch: 67, train_loss: 0.7884, test_loss: 0.9029, test_f1: 0.5671
 epoch: 68, train_loss: 0.7940, test_loss: 0.9506, test_f1: 0.5267
 epoch: 69, train_loss: 0.7960, test_loss: 0.8997, test_f1: 0.5807
 epoch: 70, train_loss: 0.7823, test_loss: 0.8849, test_f1: 0.5678
 epoch: 71, train_loss: 0.7854, test_loss: 0.9035, test_f1: 0.5680
 epoch: 72, train_loss: 0.7829, test_loss: 0.9065, test_f1: 0.5893
 epoch: 73, train_loss: 0.7937, test_loss: 0.9065, test_f1: 0.5887
 epoch: 74, train_loss: 0.7852, test_loss: 0.9052, test_f1: 0.5601
 epoch: 75, train_loss: 0.7717, test_loss: 0.8976, test_f1: 0.5825
 epoch: 76, train_loss: 0.7828, test_loss: 0.9699, test_f1: 0.5672
 epoch: 77, train_loss: 0.7856, test_loss: 0.9272, test_f1: 0.5591
 epoch: 78, train_loss: 0.7761, test_loss: 0.9227, test_f1: 0.5804
 epoch: 79, train_loss: 0.7848, test_loss: 0.8992, test_f1: 0.5822
 epoch: 80, train_loss: 0.7769, test_loss: 0.8970, test_f1: 0.6087
 epoch: 81, train_loss: 0.7781, test_loss: 0.9114, test_f1: 0.5763
 epoch: 82, train_loss: 0.7700, test_loss: 0.9006, test_f1: 0.5664
 epoch: 83, train_loss: 0.7706, test_loss: 0.8919, test_f1: 0.5841
 epoch: 84, train_loss: 0.7719, test_loss: 0.8933, test_f1: 0.5646
 epoch: 85, train_loss: 0.7619, test_loss: 0.8890, test_f1: 0.5872
 epoch: 86, train_loss: 0.7681, test_loss: 0.9422, test_f1: 0.5729
 epoch: 87, train_loss: 0.7608, test_loss: 0.9576, test_f1: 0.5607
 epoch: 88, train_loss: 0.7722, test_loss: 0.9104, test_f1: 0.5796
 epoch: 89, train_loss: 0.7682, test_loss: 0.9088, test_f1: 0.5834
 epoch: 90, train_loss: 0.7546, test_loss: 0.9137, test_f1: 0.5517
 epoch: 91, train_loss: 0.7665, test_loss: 0.9167, test_f1: 0.5919
 epoch: 92, train_loss: 0.7610, test_loss: 0.9046, test_f1: 0.6008
 epoch: 93, train_loss: 0.7655, test_loss: 0.8950, test_f1: 0.5855
 epoch: 94, train_loss: 0.7586, test_loss: 0.8983, test_f1: 0.5942
 epoch: 95, train_loss: 0.7610, test_loss: 0.8964, test_f1: 0.5881
 epoch: 96, train_loss: 0.7644, test_loss: 0.9809, test_f1: 0.5452
 epoch: 97, train_loss: 0.7644, test_loss: 0.9149, test_f1: 0.6019
 epoch: 98, train_loss: 0.7499, test_loss: 0.8969, test_f1: 0.5698
 epoch: 99, train_loss: 0.7500, test_loss: 0.9382, test_f1: 0.5566
##################ITERATION #3 ****************************************
 epoch: 0, train_loss: 1.3638, test_loss: 1.3599, test_f1: 0.2270
 epoch: 1, train_loss: 1.1668, test_loss: 1.2538, test_f1: 0.2270
 epoch: 2, train_loss: 1.1107, test_loss: 1.0601, test_f1: 0.3441
 epoch: 3, train_loss: 1.0659, test_loss: 1.0345, test_f1: 0.3417
 epoch: 4, train_loss: 1.0416, test_loss: 1.0547, test_f1: 0.3592
 epoch: 5, train_loss: 1.0247, test_loss: 1.0014, test_f1: 0.3756
 epoch: 6, train_loss: 1.0119, test_loss: 1.0227, test_f1: 0.4148
 epoch: 7, train_loss: 1.0094, test_loss: 0.9604, test_f1: 0.4181
 epoch: 8, train_loss: 0.9816, test_loss: 0.9411, test_f1: 0.4713
 epoch: 9, train_loss: 0.9616, test_loss: 1.0314, test_f1: 0.4444
 epoch: 10, train_loss: 0.9548, test_loss: 1.0359, test_f1: 0.4409
 epoch: 11, train_loss: 0.9396, test_loss: 0.9067, test_f1: 0.4755
 epoch: 12, train_loss: 0.9472, test_loss: 0.9956, test_f1: 0.4772
 epoch: 13, train_loss: 0.9314, test_loss: 0.9648, test_f1: 0.4871
 epoch: 14, train_loss: 0.9100, test_loss: 0.9898, test_f1: 0.4874
 epoch: 15, train_loss: 0.9212, test_loss: 0.9835, test_f1: 0.4824
 epoch: 16, train_loss: 0.9028, test_loss: 0.9520, test_f1: 0.5206
 epoch: 17, train_loss: 0.8922, test_loss: 0.9895, test_f1: 0.4686
 epoch: 18, train_loss: 0.8840, test_loss: 1.0099, test_f1: 0.4992
 epoch: 19, train_loss: 0.8947, test_loss: 1.0448, test_f1: 0.4571
 epoch: 20, train_loss: 0.8951, test_loss: 0.9242, test_f1: 0.5043
 epoch: 21, train_loss: 0.8821, test_loss: 0.9764, test_f1: 0.5102
 epoch: 22, train_loss: 0.8867, test_loss: 0.9619, test_f1: 0.5097
 epoch: 23, train_loss: 0.8656, test_loss: 0.8869, test_f1: 0.5296
 epoch: 24, train_loss: 0.8707, test_loss: 0.9199, test_f1: 0.5154
 epoch: 25, train_loss: 0.8643, test_loss: 0.9861, test_f1: 0.4933
 epoch: 26, train_loss: 0.8950, test_loss: 0.9703, test_f1: 0.5189
 epoch: 27, train_loss: 0.8925, test_loss: 0.9770, test_f1: 0.5247
 epoch: 28, train_loss: 0.8755, test_loss: 0.9994, test_f1: 0.4765
 epoch: 29, train_loss: 0.8633, test_loss: 0.9331, test_f1: 0.5374
 epoch: 30, train_loss: 0.8676, test_loss: 0.9388, test_f1: 0.5189
 epoch: 31, train_loss: 0.8495, test_loss: 0.9601, test_f1: 0.4942
 epoch: 32, train_loss: 0.8633, test_loss: 1.0536, test_f1: 0.5047
 epoch: 33, train_loss: 0.8760, test_loss: 1.0162, test_f1: 0.4717
 epoch: 34, train_loss: 0.8665, test_loss: 0.9493, test_f1: 0.5022
 epoch: 35, train_loss: 0.8628, test_loss: 0.9357, test_f1: 0.5523
 epoch: 36, train_loss: 0.8436, test_loss: 0.9123, test_f1: 0.5160
 epoch: 37, train_loss: 0.8477, test_loss: 0.9417, test_f1: 0.5217
 epoch: 38, train_loss: 0.8668, test_loss: 0.9813, test_f1: 0.4948
 epoch: 39, train_loss: 0.8558, test_loss: 0.9525, test_f1: 0.5481
 epoch: 40, train_loss: 0.8357, test_loss: 0.9066, test_f1: 0.5517
 epoch: 41, train_loss: 0.8477, test_loss: 0.9544, test_f1: 0.5027
 epoch: 42, train_loss: 0.8285, test_loss: 0.9175, test_f1: 0.5510
 epoch: 43, train_loss: 0.8373, test_loss: 0.9136, test_f1: 0.5774
 epoch: 44, train_loss: 0.8327, test_loss: 0.9267, test_f1: 0.5438
 epoch: 45, train_loss: 0.8223, test_loss: 0.9238, test_f1: 0.5589
 epoch: 46, train_loss: 0.8177, test_loss: 0.9549, test_f1: 0.5411
 epoch: 47, train_loss: 0.8195, test_loss: 0.9256, test_f1: 0.5267
 epoch: 48, train_loss: 0.8135, test_loss: 0.9268, test_f1: 0.5591
 epoch: 49, train_loss: 0.8120, test_loss: 0.9331, test_f1: 0.5503
 epoch: 50, train_loss: 0.8098, test_loss: 0.9231, test_f1: 0.5498
 epoch: 51, train_loss: 0.8084, test_loss: 0.9248, test_f1: 0.5505
 epoch: 52, train_loss: 0.7996, test_loss: 0.9301, test_f1: 0.5397
 epoch: 53, train_loss: 0.7771, test_loss: 0.9167, test_f1: 0.5575
 epoch: 54, train_loss: 0.7821, test_loss: 0.9124, test_f1: 0.5578
 epoch: 55, train_loss: 0.7859, test_loss: 0.9045, test_f1: 0.5555
 epoch: 56, train_loss: 0.7765, test_loss: 0.9197, test_f1: 0.5713
 epoch: 57, train_loss: 0.7790, test_loss: 0.9030, test_f1: 0.5827
 epoch: 58, train_loss: 0.7827, test_loss: 0.9360, test_f1: 0.5454
 epoch: 59, train_loss: 0.7747, test_loss: 0.8969, test_f1: 0.5916
 epoch: 60, train_loss: 0.7589, test_loss: 0.9228, test_f1: 0.5463
 epoch: 61, train_loss: 0.7549, test_loss: 0.8850, test_f1: 0.5861
 epoch: 62, train_loss: 0.7606, test_loss: 0.9408, test_f1: 0.5221
 epoch: 63, train_loss: 0.7641, test_loss: 0.9332, test_f1: 0.5609
 epoch: 64, train_loss: 0.7652, test_loss: 0.9011, test_f1: 0.5693
 epoch: 65, train_loss: 0.7598, test_loss: 0.8936, test_f1: 0.5820
 epoch: 66, train_loss: 0.7738, test_loss: 0.9329, test_f1: 0.5440
 epoch: 67, train_loss: 0.7534, test_loss: 0.9275, test_f1: 0.5606
 epoch: 68, train_loss: 0.7522, test_loss: 0.8977, test_f1: 0.5591
 epoch: 69, train_loss: 0.7496, test_loss: 0.8956, test_f1: 0.5900
 epoch: 70, train_loss: 0.7761, test_loss: 0.9338, test_f1: 0.5769
 epoch: 71, train_loss: 0.7642, test_loss: 0.8914, test_f1: 0.5803
 epoch: 72, train_loss: 0.7429, test_loss: 0.9028, test_f1: 0.5685
 epoch: 73, train_loss: 0.7588, test_loss: 0.8754, test_f1: 0.5987
 epoch: 74, train_loss: 0.7750, test_loss: 0.8899, test_f1: 0.5634
 epoch: 75, train_loss: 0.7462, test_loss: 0.9071, test_f1: 0.5612
 epoch: 76, train_loss: 0.7483, test_loss: 0.9103, test_f1: 0.5870
 epoch: 77, train_loss: 0.7478, test_loss: 0.8951, test_f1: 0.5828
 epoch: 78, train_loss: 0.7426, test_loss: 0.8985, test_f1: 0.5475
 epoch: 79, train_loss: 0.7461, test_loss: 0.9145, test_f1: 0.5457
 epoch: 80, train_loss: 0.7383, test_loss: 0.9019, test_f1: 0.5931
 epoch: 81, train_loss: 0.7231, test_loss: 0.8832, test_f1: 0.5968
 epoch: 82, train_loss: 0.7442, test_loss: 0.8753, test_f1: 0.6060
 epoch: 83, train_loss: 0.7371, test_loss: 0.8896, test_f1: 0.6033
 epoch: 84, train_loss: 0.7399, test_loss: 0.9194, test_f1: 0.5648
 epoch: 85, train_loss: 0.7122, test_loss: 0.8920, test_f1: 0.5797
 epoch: 86, train_loss: 0.7273, test_loss: 0.9362, test_f1: 0.5892
 epoch: 87, train_loss: 0.7185, test_loss: 0.9166, test_f1: 0.5794
 epoch: 88, train_loss: 0.7204, test_loss: 0.8607, test_f1: 0.6138
 epoch: 89, train_loss: 0.7163, test_loss: 0.9464, test_f1: 0.5643
 epoch: 90, train_loss: 0.7179, test_loss: 0.9448, test_f1: 0.5679
 epoch: 91, train_loss: 0.7109, test_loss: 0.8882, test_f1: 0.6035
 epoch: 92, train_loss: 0.7279, test_loss: 0.9336, test_f1: 0.5537
 epoch: 93, train_loss: 0.7258, test_loss: 0.9342, test_f1: 0.5819
 epoch: 94, train_loss: 0.7328, test_loss: 0.8806, test_f1: 0.6136
 epoch: 95, train_loss: 0.7205, test_loss: 0.8834, test_f1: 0.6244
 epoch: 96, train_loss: 0.7005, test_loss: 0.8912, test_f1: 0.6096
 epoch: 97, train_loss: 0.7068, test_loss: 0.8751, test_f1: 0.6014
 epoch: 98, train_loss: 0.7094, test_loss: 0.8964, test_f1: 0.6047
 epoch: 99, train_loss: 0.7045, test_loss: 0.8997, test_f1: 0.6048
##################ITERATION #4 ****************************************
 epoch: 0, train_loss: 1.4096, test_loss: 1.3011, test_f1: 0.2270
 epoch: 1, train_loss: 1.2305, test_loss: 1.2369, test_f1: 0.2270
 epoch: 2, train_loss: 1.1761, test_loss: 1.1754, test_f1: 0.2531
 epoch: 3, train_loss: 1.1372, test_loss: 1.1006, test_f1: 0.3371
 epoch: 4, train_loss: 1.1003, test_loss: 1.0850, test_f1: 0.3360
 epoch: 5, train_loss: 1.0555, test_loss: 1.0532, test_f1: 0.3662
 epoch: 6, train_loss: 1.0386, test_loss: 1.0966, test_f1: 0.4075
 epoch: 7, train_loss: 1.0230, test_loss: 0.9878, test_f1: 0.4706
 epoch: 8, train_loss: 0.9903, test_loss: 0.9990, test_f1: 0.4253
 epoch: 9, train_loss: 0.9774, test_loss: 0.9800, test_f1: 0.4391
 epoch: 10, train_loss: 0.9596, test_loss: 0.9376, test_f1: 0.4762
 epoch: 11, train_loss: 0.9459, test_loss: 0.9517, test_f1: 0.4752
 epoch: 12, train_loss: 0.9512, test_loss: 0.9713, test_f1: 0.4697
 epoch: 13, train_loss: 0.9339, test_loss: 0.9184, test_f1: 0.4811
 epoch: 14, train_loss: 0.9258, test_loss: 0.9083, test_f1: 0.5261
 epoch: 15, train_loss: 0.9357, test_loss: 1.0092, test_f1: 0.4938
 epoch: 16, train_loss: 0.9285, test_loss: 1.0046, test_f1: 0.4804
 epoch: 17, train_loss: 0.9225, test_loss: 0.9612, test_f1: 0.5007
 epoch: 18, train_loss: 0.9091, test_loss: 0.8844, test_f1: 0.5241
 epoch: 19, train_loss: 0.9211, test_loss: 0.9419, test_f1: 0.5219
 epoch: 20, train_loss: 0.9024, test_loss: 0.8888, test_f1: 0.5017
 epoch: 21, train_loss: 0.8918, test_loss: 0.9290, test_f1: 0.5125
 epoch: 22, train_loss: 0.8942, test_loss: 0.9425, test_f1: 0.5385
 epoch: 23, train_loss: 0.8802, test_loss: 1.0133, test_f1: 0.4681
 epoch: 24, train_loss: 0.8879, test_loss: 0.9326, test_f1: 0.5396
 epoch: 25, train_loss: 0.8830, test_loss: 0.9670, test_f1: 0.4843
 epoch: 26, train_loss: 0.8857, test_loss: 0.9092, test_f1: 0.5164
 epoch: 27, train_loss: 0.8724, test_loss: 0.8641, test_f1: 0.5222
 epoch: 28, train_loss: 0.8815, test_loss: 0.8522, test_f1: 0.5734
 epoch: 29, train_loss: 0.8857, test_loss: 0.9665, test_f1: 0.5279
 epoch: 30, train_loss: 0.8676, test_loss: 0.9198, test_f1: 0.5293
 epoch: 31, train_loss: 0.8709, test_loss: 0.9014, test_f1: 0.4825
 epoch: 32, train_loss: 0.8577, test_loss: 0.8806, test_f1: 0.5272
 epoch: 33, train_loss: 0.8613, test_loss: 1.0039, test_f1: 0.5529
 epoch: 34, train_loss: 0.8478, test_loss: 1.0031, test_f1: 0.5121
 epoch: 35, train_loss: 0.8534, test_loss: 0.9951, test_f1: 0.4854
 epoch: 36, train_loss: 0.8821, test_loss: 0.8806, test_f1: 0.5508
 epoch: 37, train_loss: 0.8858, test_loss: 1.0238, test_f1: 0.5219
 epoch: 38, train_loss: 0.8687, test_loss: 0.8845, test_f1: 0.5342
 epoch: 39, train_loss: 0.8610, test_loss: 0.8787, test_f1: 0.5181
 epoch: 40, train_loss: 0.8366, test_loss: 0.9276, test_f1: 0.5174
 epoch: 41, train_loss: 0.8491, test_loss: 0.8789, test_f1: 0.5643
 epoch: 42, train_loss: 0.8396, test_loss: 0.9264, test_f1: 0.5268
 epoch: 43, train_loss: 0.8467, test_loss: 0.8397, test_f1: 0.5536
 epoch: 44, train_loss: 0.8417, test_loss: 0.8691, test_f1: 0.5642
 epoch: 45, train_loss: 0.8375, test_loss: 0.9889, test_f1: 0.5045
 epoch: 46, train_loss: 0.8222, test_loss: 0.8426, test_f1: 0.5461
 epoch: 47, train_loss: 0.8204, test_loss: 0.8681, test_f1: 0.5654
 epoch: 48, train_loss: 0.8236, test_loss: 0.9875, test_f1: 0.5936
 epoch: 49, train_loss: 0.8190, test_loss: 0.9347, test_f1: 0.5723
 epoch: 50, train_loss: 0.8240, test_loss: 0.8973, test_f1: 0.5979
 epoch: 51, train_loss: 0.8130, test_loss: 0.8279, test_f1: 0.5727
 epoch: 52, train_loss: 0.7961, test_loss: 0.9406, test_f1: 0.5554
 epoch: 53, train_loss: 0.7903, test_loss: 0.8176, test_f1: 0.6108
 epoch: 54, train_loss: 0.7930, test_loss: 0.8719, test_f1: 0.5845
 epoch: 55, train_loss: 0.7833, test_loss: 0.8612, test_f1: 0.5945
 epoch: 56, train_loss: 0.7885, test_loss: 0.8157, test_f1: 0.5846
 epoch: 57, train_loss: 0.7789, test_loss: 0.8797, test_f1: 0.5776
 epoch: 58, train_loss: 0.7774, test_loss: 0.8767, test_f1: 0.5836
 epoch: 59, train_loss: 0.7784, test_loss: 0.8960, test_f1: 0.5665
 epoch: 60, train_loss: 0.7818, test_loss: 0.8585, test_f1: 0.6112
 epoch: 61, train_loss: 0.7688, test_loss: 0.8976, test_f1: 0.5866
 epoch: 62, train_loss: 0.7606, test_loss: 0.8588, test_f1: 0.5942
 epoch: 63, train_loss: 0.7608, test_loss: 0.8870, test_f1: 0.5726
 epoch: 64, train_loss: 0.7604, test_loss: 0.8495, test_f1: 0.6122
 epoch: 65, train_loss: 0.7721, test_loss: 0.8686, test_f1: 0.6054
 epoch: 66, train_loss: 0.7642, test_loss: 0.8564, test_f1: 0.5600
 epoch: 67, train_loss: 0.7456, test_loss: 0.8210, test_f1: 0.6168
 epoch: 68, train_loss: 0.7541, test_loss: 0.8661, test_f1: 0.6267
 epoch: 69, train_loss: 0.7543, test_loss: 0.8614, test_f1: 0.5923
 epoch: 70, train_loss: 0.7747, test_loss: 0.9017, test_f1: 0.5659
 epoch: 71, train_loss: 0.7747, test_loss: 0.8554, test_f1: 0.5717
 epoch: 72, train_loss: 0.7775, test_loss: 0.9301, test_f1: 0.5747
 epoch: 73, train_loss: 0.7596, test_loss: 0.8919, test_f1: 0.5968
 epoch: 74, train_loss: 0.7462, test_loss: 0.8538, test_f1: 0.5908
 epoch: 75, train_loss: 0.7577, test_loss: 0.7817, test_f1: 0.6004
 epoch: 76, train_loss: 0.7467, test_loss: 0.8638, test_f1: 0.5934
 epoch: 77, train_loss: 0.7380, test_loss: 0.9022, test_f1: 0.6329
 epoch: 78, train_loss: 0.7527, test_loss: 0.8070, test_f1: 0.6098
 epoch: 79, train_loss: 0.7631, test_loss: 0.8783, test_f1: 0.5908
 epoch: 80, train_loss: 0.7366, test_loss: 0.8818, test_f1: 0.6069
 epoch: 81, train_loss: 0.7377, test_loss: 0.8404, test_f1: 0.6379
 epoch: 82, train_loss: 0.7497, test_loss: 0.8679, test_f1: 0.5576
 epoch: 83, train_loss: 0.7418, test_loss: 0.8484, test_f1: 0.6214
 epoch: 84, train_loss: 0.7406, test_loss: 0.8821, test_f1: 0.5471
 epoch: 85, train_loss: 0.7571, test_loss: 0.8537, test_f1: 0.6289
 epoch: 86, train_loss: 0.7566, test_loss: 0.8845, test_f1: 0.6155
 epoch: 87, train_loss: 0.7469, test_loss: 0.7727, test_f1: 0.6300
 epoch: 88, train_loss: 0.7297, test_loss: 0.8225, test_f1: 0.6372
 epoch: 89, train_loss: 0.7372, test_loss: 0.8595, test_f1: 0.5937
 epoch: 90, train_loss: 0.7338, test_loss: 0.8780, test_f1: 0.6181
 epoch: 91, train_loss: 0.7293, test_loss: 0.8949, test_f1: 0.5768
 epoch: 92, train_loss: 0.7315, test_loss: 0.9462, test_f1: 0.5989
 epoch: 93, train_loss: 0.7294, test_loss: 0.9124, test_f1: 0.5821
 epoch: 94, train_loss: 0.7339, test_loss: 0.8670, test_f1: 0.6048
 epoch: 95, train_loss: 0.7478, test_loss: 0.9027, test_f1: 0.5834
 epoch: 96, train_loss: 0.7277, test_loss: 0.9339, test_f1: 0.6019
 epoch: 97, train_loss: 0.7297, test_loss: 0.9027, test_f1: 0.6153
 epoch: 98, train_loss: 0.7140, test_loss: 0.8968, test_f1: 0.5821
 epoch: 99, train_loss: 0.7229, test_loss: 0.8830, test_f1: 0.6287
##################ITERATION #5 ****************************************
 epoch: 0, train_loss: 1.3057, test_loss: 1.2812, test_f1: 0.2270
 epoch: 1, train_loss: 1.1294, test_loss: 1.1908, test_f1: 0.4099
 epoch: 2, train_loss: 1.0841, test_loss: 1.1072, test_f1: 0.4328
 epoch: 3, train_loss: 1.0383, test_loss: 1.0502, test_f1: 0.4229
 epoch: 4, train_loss: 1.0106, test_loss: 1.0104, test_f1: 0.4507
 epoch: 5, train_loss: 0.9991, test_loss: 1.0045, test_f1: 0.4525
 epoch: 6, train_loss: 0.9734, test_loss: 1.0271, test_f1: 0.4397
 epoch: 7, train_loss: 0.9731, test_loss: 1.0647, test_f1: 0.4440
 epoch: 8, train_loss: 0.9596, test_loss: 1.0464, test_f1: 0.4651
 epoch: 9, train_loss: 0.9632, test_loss: 1.0313, test_f1: 0.4205
 epoch: 10, train_loss: 0.9507, test_loss: 0.9374, test_f1: 0.4814
 epoch: 11, train_loss: 0.9377, test_loss: 1.0031, test_f1: 0.5284
 epoch: 12, train_loss: 0.9411, test_loss: 0.9672, test_f1: 0.4676
 epoch: 13, train_loss: 0.9300, test_loss: 1.0080, test_f1: 0.4828
 epoch: 14, train_loss: 0.9182, test_loss: 1.0450, test_f1: 0.5187
 epoch: 15, train_loss: 0.9175, test_loss: 1.1087, test_f1: 0.4503
 epoch: 16, train_loss: 0.8955, test_loss: 1.0101, test_f1: 0.5022
 epoch: 17, train_loss: 0.8965, test_loss: 0.9977, test_f1: 0.5139
 epoch: 18, train_loss: 0.9218, test_loss: 1.0672, test_f1: 0.4817
 epoch: 19, train_loss: 0.8916, test_loss: 1.1568, test_f1: 0.4290
 epoch: 20, train_loss: 0.8886, test_loss: 1.0815, test_f1: 0.4648
 epoch: 21, train_loss: 0.8728, test_loss: 1.0257, test_f1: 0.5356
 epoch: 22, train_loss: 0.8703, test_loss: 0.9737, test_f1: 0.4846
 epoch: 23, train_loss: 0.8781, test_loss: 0.9322, test_f1: 0.5455
 epoch: 24, train_loss: 0.8532, test_loss: 0.9978, test_f1: 0.5114
 epoch: 25, train_loss: 0.8731, test_loss: 1.0192, test_f1: 0.5558
 epoch: 26, train_loss: 0.8769, test_loss: 1.0860, test_f1: 0.4769
 epoch: 27, train_loss: 0.8681, test_loss: 1.1024, test_f1: 0.4522
 epoch: 28, train_loss: 0.8788, test_loss: 1.0243, test_f1: 0.4907
 epoch: 29, train_loss: 0.8588, test_loss: 0.9661, test_f1: 0.5787
 epoch: 30, train_loss: 0.8437, test_loss: 0.9825, test_f1: 0.5637
 epoch: 31, train_loss: 0.8583, test_loss: 1.0167, test_f1: 0.5464
 epoch: 32, train_loss: 0.8671, test_loss: 1.0293, test_f1: 0.5027
 epoch: 33, train_loss: 0.8376, test_loss: 1.0157, test_f1: 0.5045
 epoch: 34, train_loss: 0.8311, test_loss: 1.1790, test_f1: 0.4893
 epoch: 35, train_loss: 0.8488, test_loss: 1.0131, test_f1: 0.5230
 epoch: 36, train_loss: 0.8377, test_loss: 0.9391, test_f1: 0.5740
 epoch: 37, train_loss: 0.8249, test_loss: 1.0110, test_f1: 0.5699
 epoch: 38, train_loss: 0.8271, test_loss: 1.0278, test_f1: 0.5448
 epoch: 39, train_loss: 0.8271, test_loss: 0.9656, test_f1: 0.5939
 epoch: 40, train_loss: 0.8283, test_loss: 0.9911, test_f1: 0.5179
 epoch: 41, train_loss: 0.8358, test_loss: 0.9839, test_f1: 0.5738
 epoch: 42, train_loss: 0.8279, test_loss: 1.0625, test_f1: 0.4950
 epoch: 43, train_loss: 0.8176, test_loss: 0.9790, test_f1: 0.5536
 epoch: 44, train_loss: 0.8195, test_loss: 0.9930, test_f1: 0.5865
 epoch: 45, train_loss: 0.8255, test_loss: 1.1784, test_f1: 0.4410
 epoch: 46, train_loss: 0.8028, test_loss: 0.9759, test_f1: 0.5945
 epoch: 47, train_loss: 0.8026, test_loss: 0.9941, test_f1: 0.5278
 epoch: 48, train_loss: 0.7875, test_loss: 1.0082, test_f1: 0.5708
 epoch: 49, train_loss: 0.8232, test_loss: 0.9688, test_f1: 0.5381
 epoch: 50, train_loss: 0.8110, test_loss: 1.0163, test_f1: 0.4981
 epoch: 51, train_loss: 0.8030, test_loss: 0.9877, test_f1: 0.5722
 epoch: 52, train_loss: 0.7817, test_loss: 1.0105, test_f1: 0.5346
 epoch: 53, train_loss: 0.7743, test_loss: 0.9736, test_f1: 0.5988
 epoch: 54, train_loss: 0.7671, test_loss: 1.0226, test_f1: 0.5637
 epoch: 55, train_loss: 0.7688, test_loss: 0.9947, test_f1: 0.5566
 epoch: 56, train_loss: 0.7644, test_loss: 0.9914, test_f1: 0.5912
 epoch: 57, train_loss: 0.7537, test_loss: 0.9956, test_f1: 0.5865
 epoch: 58, train_loss: 0.7734, test_loss: 0.9818, test_f1: 0.5636
 epoch: 59, train_loss: 0.7667, test_loss: 0.9883, test_f1: 0.5680
 epoch: 60, train_loss: 0.7667, test_loss: 0.9672, test_f1: 0.5869
 epoch: 61, train_loss: 0.7575, test_loss: 0.9835, test_f1: 0.5844
 epoch: 62, train_loss: 0.7561, test_loss: 0.9742, test_f1: 0.6070
 epoch: 63, train_loss: 0.7587, test_loss: 1.0301, test_f1: 0.5563
 epoch: 64, train_loss: 0.7592, test_loss: 0.9752, test_f1: 0.5940
 epoch: 65, train_loss: 0.7479, test_loss: 1.0291, test_f1: 0.5633
 epoch: 66, train_loss: 0.7650, test_loss: 1.0573, test_f1: 0.5407
 epoch: 67, train_loss: 0.7546, test_loss: 0.9598, test_f1: 0.6109
 epoch: 68, train_loss: 0.7430, test_loss: 0.9738, test_f1: 0.5782
 epoch: 69, train_loss: 0.7564, test_loss: 1.0067, test_f1: 0.5834
 epoch: 70, train_loss: 0.7538, test_loss: 1.0044, test_f1: 0.5942
 epoch: 71, train_loss: 0.7458, test_loss: 0.9698, test_f1: 0.5718
 epoch: 72, train_loss: 0.7334, test_loss: 1.0334, test_f1: 0.5844
 epoch: 73, train_loss: 0.7328, test_loss: 0.9873, test_f1: 0.5809
 epoch: 74, train_loss: 0.7310, test_loss: 0.9343, test_f1: 0.6013
 epoch: 75, train_loss: 0.7466, test_loss: 0.9557, test_f1: 0.6072
 epoch: 76, train_loss: 0.7341, test_loss: 0.9644, test_f1: 0.5870
 epoch: 77, train_loss: 0.7186, test_loss: 0.9775, test_f1: 0.5836
 epoch: 78, train_loss: 0.7340, test_loss: 1.0256, test_f1: 0.5809
 epoch: 79, train_loss: 0.7351, test_loss: 0.9928, test_f1: 0.5984
 epoch: 80, train_loss: 0.7302, test_loss: 0.9939, test_f1: 0.5729
 epoch: 81, train_loss: 0.7207, test_loss: 1.0652, test_f1: 0.5700
 epoch: 82, train_loss: 0.7242, test_loss: 0.9812, test_f1: 0.5799
 epoch: 83, train_loss: 0.7366, test_loss: 0.9529, test_f1: 0.6120
 epoch: 84, train_loss: 0.7324, test_loss: 1.0619, test_f1: 0.5637
 epoch: 85, train_loss: 0.7216, test_loss: 0.9654, test_f1: 0.5916
 epoch: 86, train_loss: 0.7248, test_loss: 0.9896, test_f1: 0.6040
 epoch: 87, train_loss: 0.7189, test_loss: 1.2563, test_f1: 0.5202
 epoch: 88, train_loss: 0.7136, test_loss: 0.9881, test_f1: 0.6011
 epoch: 89, train_loss: 0.7316, test_loss: 0.9816, test_f1: 0.5718
 epoch: 90, train_loss: 0.7087, test_loss: 0.9932, test_f1: 0.5882
 epoch: 91, train_loss: 0.7240, test_loss: 1.0174, test_f1: 0.6003
 epoch: 92, train_loss: 0.7219, test_loss: 0.9895, test_f1: 0.5708
 epoch: 93, train_loss: 0.7262, test_loss: 1.0028, test_f1: 0.5797
 epoch: 94, train_loss: 0.7183, test_loss: 1.0688, test_f1: 0.5873
 epoch: 95, train_loss: 0.7110, test_loss: 1.0279, test_f1: 0.5934
 epoch: 96, train_loss: 0.7254, test_loss: 0.9991, test_f1: 0.5843
 epoch: 97, train_loss: 0.7233, test_loss: 0.9923, test_f1: 0.5896
 epoch: 98, train_loss: 0.7188, test_loss: 0.9658, test_f1: 0.5992
 epoch: 99, train_loss: 0.7272, test_loss: 0.9819, test_f1: 0.6049
##################ITERATION #6 ****************************************
 epoch: 0, train_loss: 1.5203, test_loss: 1.3794, test_f1: 0.2270
 epoch: 1, train_loss: 1.2212, test_loss: 1.2439, test_f1: 0.2631
 epoch: 2, train_loss: 1.1482, test_loss: 1.1424, test_f1: 0.3518
 epoch: 3, train_loss: 1.0894, test_loss: 1.0552, test_f1: 0.4100
 epoch: 4, train_loss: 1.0498, test_loss: 1.0292, test_f1: 0.4484
 epoch: 5, train_loss: 1.0226, test_loss: 0.9943, test_f1: 0.4834
 epoch: 6, train_loss: 1.0081, test_loss: 1.0672, test_f1: 0.4736
 epoch: 7, train_loss: 0.9971, test_loss: 1.0355, test_f1: 0.4743
 epoch: 8, train_loss: 0.9929, test_loss: 1.0541, test_f1: 0.4476
 epoch: 9, train_loss: 0.9681, test_loss: 1.0128, test_f1: 0.4711
 epoch: 10, train_loss: 0.9612, test_loss: 0.9851, test_f1: 0.5136
 epoch: 11, train_loss: 0.9584, test_loss: 0.9710, test_f1: 0.5272
 epoch: 12, train_loss: 0.9360, test_loss: 1.0519, test_f1: 0.4695
 epoch: 13, train_loss: 0.9508, test_loss: 0.9667, test_f1: 0.4987
 epoch: 14, train_loss: 0.9475, test_loss: 1.0526, test_f1: 0.4616
 epoch: 15, train_loss: 0.9411, test_loss: 0.9442, test_f1: 0.5216
 epoch: 16, train_loss: 0.9285, test_loss: 1.0113, test_f1: 0.4824
 epoch: 17, train_loss: 0.9350, test_loss: 0.9432, test_f1: 0.5151
 epoch: 18, train_loss: 0.9264, test_loss: 1.0589, test_f1: 0.4752
 epoch: 19, train_loss: 0.9206, test_loss: 0.9801, test_f1: 0.5055
 epoch: 20, train_loss: 0.9171, test_loss: 0.9180, test_f1: 0.5282
 epoch: 21, train_loss: 0.9213, test_loss: 0.9656, test_f1: 0.4929
 epoch: 22, train_loss: 0.9142, test_loss: 0.9494, test_f1: 0.5181
 epoch: 23, train_loss: 0.9177, test_loss: 0.9606, test_f1: 0.5392
 epoch: 24, train_loss: 0.9135, test_loss: 1.0191, test_f1: 0.4817
 epoch: 25, train_loss: 0.9133, test_loss: 0.9307, test_f1: 0.5578
 epoch: 26, train_loss: 0.9122, test_loss: 0.9103, test_f1: 0.5314
 epoch: 27, train_loss: 0.9016, test_loss: 0.9352, test_f1: 0.5347
 epoch: 28, train_loss: 0.8990, test_loss: 0.9639, test_f1: 0.5208
 epoch: 29, train_loss: 0.8917, test_loss: 0.9084, test_f1: 0.5091
 epoch: 30, train_loss: 0.8812, test_loss: 1.0001, test_f1: 0.4957
 epoch: 31, train_loss: 0.8867, test_loss: 0.9545, test_f1: 0.5328
 epoch: 32, train_loss: 0.8795, test_loss: 0.9518, test_f1: 0.5343
 epoch: 33, train_loss: 0.8800, test_loss: 0.9800, test_f1: 0.5090
 epoch: 34, train_loss: 0.8870, test_loss: 0.9624, test_f1: 0.5266
 epoch: 35, train_loss: 0.8744, test_loss: 0.9238, test_f1: 0.5295
 epoch: 36, train_loss: 0.8797, test_loss: 1.1282, test_f1: 0.4675
 epoch: 37, train_loss: 0.8777, test_loss: 0.9019, test_f1: 0.5479
 epoch: 38, train_loss: 0.8668, test_loss: 0.9740, test_f1: 0.4944
 epoch: 39, train_loss: 0.8585, test_loss: 0.9156, test_f1: 0.5358
 epoch: 40, train_loss: 0.8492, test_loss: 0.9046, test_f1: 0.5361
 epoch: 41, train_loss: 0.8576, test_loss: 0.9793, test_f1: 0.4943
 epoch: 42, train_loss: 0.8509, test_loss: 1.0314, test_f1: 0.5162
 epoch: 43, train_loss: 0.8421, test_loss: 0.9544, test_f1: 0.5290
 epoch: 44, train_loss: 0.8560, test_loss: 0.9939, test_f1: 0.5088
 epoch: 45, train_loss: 0.8543, test_loss: 0.9554, test_f1: 0.5275
 epoch: 46, train_loss: 0.8540, test_loss: 1.0258, test_f1: 0.4885
 epoch: 47, train_loss: 0.8437, test_loss: 0.8739, test_f1: 0.5669
 epoch: 48, train_loss: 0.8341, test_loss: 0.9422, test_f1: 0.5184
 epoch: 49, train_loss: 0.8422, test_loss: 0.9055, test_f1: 0.5397
 epoch: 50, train_loss: 0.8449, test_loss: 1.1360, test_f1: 0.4576
 epoch: 51, train_loss: 0.8406, test_loss: 0.8844, test_f1: 0.5413
 epoch: 52, train_loss: 0.8344, test_loss: 0.9754, test_f1: 0.5191
 epoch: 53, train_loss: 0.8296, test_loss: 0.9325, test_f1: 0.5547
 epoch: 54, train_loss: 0.8291, test_loss: 0.9968, test_f1: 0.5362
 epoch: 55, train_loss: 0.8197, test_loss: 0.9486, test_f1: 0.5204
 epoch: 56, train_loss: 0.8089, test_loss: 0.9069, test_f1: 0.5556
 epoch: 57, train_loss: 0.8129, test_loss: 0.9144, test_f1: 0.5444
 epoch: 58, train_loss: 0.8057, test_loss: 0.9928, test_f1: 0.5107
 epoch: 59, train_loss: 0.8110, test_loss: 0.9340, test_f1: 0.5415
 epoch: 60, train_loss: 0.8150, test_loss: 0.9167, test_f1: 0.5184
 epoch: 61, train_loss: 0.8071, test_loss: 0.9311, test_f1: 0.5295
 epoch: 62, train_loss: 0.8025, test_loss: 0.9411, test_f1: 0.5338
 epoch: 63, train_loss: 0.8049, test_loss: 0.9421, test_f1: 0.5373
 epoch: 64, train_loss: 0.7889, test_loss: 0.9203, test_f1: 0.5412
 epoch: 65, train_loss: 0.7929, test_loss: 0.9084, test_f1: 0.5342
 epoch: 66, train_loss: 0.7914, test_loss: 0.8954, test_f1: 0.5474
 epoch: 67, train_loss: 0.7940, test_loss: 0.8999, test_f1: 0.5527
 epoch: 68, train_loss: 0.7999, test_loss: 0.9469, test_f1: 0.5372
 epoch: 69, train_loss: 0.7893, test_loss: 0.9423, test_f1: 0.5375
 epoch: 70, train_loss: 0.7889, test_loss: 0.9626, test_f1: 0.5435
 epoch: 71, train_loss: 0.7798, test_loss: 0.9492, test_f1: 0.5324
 epoch: 72, train_loss: 0.7957, test_loss: 0.9416, test_f1: 0.5752
 epoch: 73, train_loss: 0.7958, test_loss: 0.9265, test_f1: 0.5449
 epoch: 74, train_loss: 0.8066, test_loss: 0.9409, test_f1: 0.5517
 epoch: 75, train_loss: 0.7984, test_loss: 0.9251, test_f1: 0.5449
 epoch: 76, train_loss: 0.7787, test_loss: 0.9206, test_f1: 0.5490
 epoch: 77, train_loss: 0.7789, test_loss: 0.9209, test_f1: 0.5631
 epoch: 78, train_loss: 0.7813, test_loss: 0.9464, test_f1: 0.5656
 epoch: 79, train_loss: 0.7851, test_loss: 0.9167, test_f1: 0.5616
 epoch: 80, train_loss: 0.7916, test_loss: 0.9470, test_f1: 0.5600
 epoch: 81, train_loss: 0.7912, test_loss: 0.9508, test_f1: 0.5467
 epoch: 82, train_loss: 0.7873, test_loss: 0.9492, test_f1: 0.5272
 epoch: 83, train_loss: 0.7799, test_loss: 0.9269, test_f1: 0.5376
 epoch: 84, train_loss: 0.7868, test_loss: 0.9081, test_f1: 0.5532
 epoch: 85, train_loss: 0.7907, test_loss: 0.9087, test_f1: 0.5465
 epoch: 86, train_loss: 0.7869, test_loss: 0.9002, test_f1: 0.5643
 epoch: 87, train_loss: 0.7684, test_loss: 0.8931, test_f1: 0.5505
 epoch: 88, train_loss: 0.7676, test_loss: 0.8971, test_f1: 0.5567
 epoch: 89, train_loss: 0.7741, test_loss: 0.9169, test_f1: 0.5509
 epoch: 90, train_loss: 0.7760, test_loss: 0.9307, test_f1: 0.5767
 epoch: 91, train_loss: 0.7775, test_loss: 0.9206, test_f1: 0.5633
 epoch: 92, train_loss: 0.7772, test_loss: 0.9169, test_f1: 0.5678
 epoch: 93, train_loss: 0.7716, test_loss: 0.9265, test_f1: 0.5516
 epoch: 94, train_loss: 0.7740, test_loss: 0.9388, test_f1: 0.5503
 epoch: 95, train_loss: 0.7733, test_loss: 1.0217, test_f1: 0.5132
 epoch: 96, train_loss: 0.7587, test_loss: 0.9092, test_f1: 0.5703
 epoch: 97, train_loss: 0.7686, test_loss: 0.9699, test_f1: 0.5368
 epoch: 98, train_loss: 0.7768, test_loss: 0.9889, test_f1: 0.5406
 epoch: 99, train_loss: 0.7747, test_loss: 0.9398, test_f1: 0.5578
##################ITERATION #7 ****************************************
 epoch: 0, train_loss: 1.3039, test_loss: 1.4716, test_f1: 0.2270
 epoch: 1, train_loss: 1.1002, test_loss: 1.1574, test_f1: 0.3059
 epoch: 2, train_loss: 1.0417, test_loss: 1.0470, test_f1: 0.3966
 epoch: 3, train_loss: 1.0146, test_loss: 0.9784, test_f1: 0.4919
 epoch: 4, train_loss: 0.9847, test_loss: 1.0326, test_f1: 0.4562
 epoch: 5, train_loss: 0.9671, test_loss: 0.9511, test_f1: 0.4938
 epoch: 6, train_loss: 0.9609, test_loss: 1.0043, test_f1: 0.4840
 epoch: 7, train_loss: 0.9357, test_loss: 1.0124, test_f1: 0.4594
 epoch: 8, train_loss: 0.9357, test_loss: 0.9844, test_f1: 0.4777
 epoch: 9, train_loss: 0.9401, test_loss: 0.9761, test_f1: 0.4695
 epoch: 10, train_loss: 0.9146, test_loss: 0.8960, test_f1: 0.4950
 epoch: 11, train_loss: 0.9103, test_loss: 1.0064, test_f1: 0.5059
 epoch: 12, train_loss: 0.9145, test_loss: 0.9871, test_f1: 0.4985
 epoch: 13, train_loss: 0.8997, test_loss: 0.9613, test_f1: 0.4794
 epoch: 14, train_loss: 0.8930, test_loss: 0.9820, test_f1: 0.4837
 epoch: 15, train_loss: 0.8914, test_loss: 0.9965, test_f1: 0.5293
 epoch: 16, train_loss: 0.9092, test_loss: 0.9577, test_f1: 0.5059
 epoch: 17, train_loss: 0.8811, test_loss: 0.9992, test_f1: 0.5292
 epoch: 18, train_loss: 0.8880, test_loss: 0.9884, test_f1: 0.4953
 epoch: 19, train_loss: 0.8777, test_loss: 1.0012, test_f1: 0.5179
 epoch: 20, train_loss: 0.8725, test_loss: 0.9537, test_f1: 0.5448
 epoch: 21, train_loss: 0.8724, test_loss: 0.9461, test_f1: 0.5083
 epoch: 22, train_loss: 0.8639, test_loss: 0.9673, test_f1: 0.4923
 epoch: 23, train_loss: 0.8858, test_loss: 1.0559, test_f1: 0.4643
 epoch: 24, train_loss: 0.8668, test_loss: 0.8640, test_f1: 0.5620
 epoch: 25, train_loss: 0.8472, test_loss: 0.9704, test_f1: 0.5326
 epoch: 26, train_loss: 0.8418, test_loss: 0.9293, test_f1: 0.5271
 epoch: 27, train_loss: 0.8519, test_loss: 0.9272, test_f1: 0.4837
 epoch: 28, train_loss: 0.8541, test_loss: 0.9174, test_f1: 0.5564
 epoch: 29, train_loss: 0.8425, test_loss: 0.9676, test_f1: 0.4930
 epoch: 30, train_loss: 0.8406, test_loss: 0.8827, test_f1: 0.5609
 epoch: 31, train_loss: 0.8135, test_loss: 0.9015, test_f1: 0.5536
 epoch: 32, train_loss: 0.8228, test_loss: 0.9956, test_f1: 0.4871
 epoch: 33, train_loss: 0.8159, test_loss: 0.8181, test_f1: 0.5875
 epoch: 34, train_loss: 0.8125, test_loss: 0.8828, test_f1: 0.5782
 epoch: 35, train_loss: 0.8112, test_loss: 0.8822, test_f1: 0.5799
 epoch: 36, train_loss: 0.8124, test_loss: 0.9277, test_f1: 0.5287
 epoch: 37, train_loss: 0.8080, test_loss: 0.9184, test_f1: 0.5624
 epoch: 38, train_loss: 0.8234, test_loss: 0.8857, test_f1: 0.5979
 epoch: 39, train_loss: 0.8192, test_loss: 0.9561, test_f1: 0.5513
 epoch: 40, train_loss: 0.7948, test_loss: 0.9063, test_f1: 0.5641
 epoch: 41, train_loss: 0.8014, test_loss: 0.9415, test_f1: 0.5529
 epoch: 42, train_loss: 0.8067, test_loss: 0.9100, test_f1: 0.5660
 epoch: 43, train_loss: 0.8232, test_loss: 0.9237, test_f1: 0.5476
 epoch: 44, train_loss: 0.8108, test_loss: 0.9805, test_f1: 0.5462
 epoch: 45, train_loss: 0.7919, test_loss: 1.0980, test_f1: 0.5337
 epoch: 46, train_loss: 0.7981, test_loss: 1.0048, test_f1: 0.4958
 epoch: 47, train_loss: 0.7957, test_loss: 0.8472, test_f1: 0.5931
 epoch: 48, train_loss: 0.7814, test_loss: 0.8143, test_f1: 0.6230
 epoch: 49, train_loss: 0.7960, test_loss: 1.0841, test_f1: 0.4820
 epoch: 50, train_loss: 0.7883, test_loss: 0.9860, test_f1: 0.5253
 epoch: 51, train_loss: 0.7816, test_loss: 0.8653, test_f1: 0.6053
 epoch: 52, train_loss: 0.7548, test_loss: 0.8790, test_f1: 0.5947
 epoch: 53, train_loss: 0.7485, test_loss: 0.8347, test_f1: 0.6267
 epoch: 54, train_loss: 0.7437, test_loss: 0.8674, test_f1: 0.6001
 epoch: 55, train_loss: 0.7415, test_loss: 0.8818, test_f1: 0.6072
 epoch: 56, train_loss: 0.7353, test_loss: 0.8936, test_f1: 0.5761
 epoch: 57, train_loss: 0.7480, test_loss: 0.8518, test_f1: 0.6125
 epoch: 58, train_loss: 0.7458, test_loss: 0.8886, test_f1: 0.6037
 epoch: 59, train_loss: 0.7391, test_loss: 0.8842, test_f1: 0.5986
 epoch: 60, train_loss: 0.7443, test_loss: 0.9090, test_f1: 0.6166
 epoch: 61, train_loss: 0.7319, test_loss: 0.8802, test_f1: 0.6055
 epoch: 62, train_loss: 0.7240, test_loss: 0.8949, test_f1: 0.6074
 epoch: 63, train_loss: 0.7326, test_loss: 0.9745, test_f1: 0.5729
 epoch: 64, train_loss: 0.7303, test_loss: 0.9059, test_f1: 0.5905
 epoch: 65, train_loss: 0.7242, test_loss: 0.9144, test_f1: 0.6012
 epoch: 66, train_loss: 0.7284, test_loss: 0.9205, test_f1: 0.5861
 epoch: 67, train_loss: 0.7387, test_loss: 0.8611, test_f1: 0.5907
 epoch: 68, train_loss: 0.7186, test_loss: 0.8520, test_f1: 0.6333
 epoch: 69, train_loss: 0.7180, test_loss: 0.8544, test_f1: 0.6240
 epoch: 70, train_loss: 0.7017, test_loss: 0.9025, test_f1: 0.5996
 epoch: 71, train_loss: 0.7139, test_loss: 0.9303, test_f1: 0.5933
 epoch: 72, train_loss: 0.7176, test_loss: 0.8558, test_f1: 0.6413
 epoch: 73, train_loss: 0.7140, test_loss: 0.8746, test_f1: 0.5952
 epoch: 74, train_loss: 0.7189, test_loss: 0.9188, test_f1: 0.5806
 epoch: 75, train_loss: 0.7016, test_loss: 0.8695, test_f1: 0.5932
 epoch: 76, train_loss: 0.7025, test_loss: 0.8588, test_f1: 0.6291
 epoch: 77, train_loss: 0.7103, test_loss: 0.8735, test_f1: 0.6142
 epoch: 78, train_loss: 0.7092, test_loss: 0.8615, test_f1: 0.6200
 epoch: 79, train_loss: 0.7066, test_loss: 0.9423, test_f1: 0.5751
 epoch: 80, train_loss: 0.7152, test_loss: 0.9204, test_f1: 0.5618
 epoch: 81, train_loss: 0.7048, test_loss: 0.9334, test_f1: 0.6070
 epoch: 82, train_loss: 0.6968, test_loss: 0.9297, test_f1: 0.6017
 epoch: 83, train_loss: 0.7057, test_loss: 0.9142, test_f1: 0.6519
 epoch: 84, train_loss: 0.6988, test_loss: 0.9154, test_f1: 0.6015
 epoch: 85, train_loss: 0.7035, test_loss: 0.9065, test_f1: 0.6115
 epoch: 86, train_loss: 0.6955, test_loss: 0.8952, test_f1: 0.6090
 epoch: 87, train_loss: 0.7131, test_loss: 0.9163, test_f1: 0.6248
 epoch: 88, train_loss: 0.6890, test_loss: 0.8787, test_f1: 0.6302
 epoch: 89, train_loss: 0.6871, test_loss: 0.8745, test_f1: 0.6430
 epoch: 90, train_loss: 0.6793, test_loss: 0.8981, test_f1: 0.6068
 epoch: 91, train_loss: 0.6754, test_loss: 0.8809, test_f1: 0.6225
 epoch: 92, train_loss: 0.6754, test_loss: 0.8936, test_f1: 0.6382
 epoch: 93, train_loss: 0.6740, test_loss: 0.8956, test_f1: 0.6398
 epoch: 94, train_loss: 0.6791, test_loss: 0.8899, test_f1: 0.6142
 epoch: 95, train_loss: 0.6802, test_loss: 0.9273, test_f1: 0.5957
 epoch: 96, train_loss: 0.6727, test_loss: 0.8919, test_f1: 0.5862
 epoch: 97, train_loss: 0.6810, test_loss: 0.9093, test_f1: 0.6102
 epoch: 98, train_loss: 0.6832, test_loss: 0.9056, test_f1: 0.6148
 epoch: 99, train_loss: 0.6964, test_loss: 0.8853, test_f1: 0.6300
##################ITERATION #8 ****************************************
 epoch: 0, train_loss: 1.3418, test_loss: 1.3874, test_f1: 0.2270
 epoch: 1, train_loss: 1.1257, test_loss: 1.1431, test_f1: 0.3380
 epoch: 2, train_loss: 1.0726, test_loss: 1.0612, test_f1: 0.3490
 epoch: 3, train_loss: 1.0381, test_loss: 1.0659, test_f1: 0.4050
 epoch: 4, train_loss: 1.0141, test_loss: 1.0476, test_f1: 0.3966
 epoch: 5, train_loss: 0.9965, test_loss: 1.0381, test_f1: 0.4594
 epoch: 6, train_loss: 0.9894, test_loss: 1.0388, test_f1: 0.4614
 epoch: 7, train_loss: 0.9796, test_loss: 1.1071, test_f1: 0.4328
 epoch: 8, train_loss: 0.9780, test_loss: 1.0264, test_f1: 0.5029
 epoch: 9, train_loss: 0.9568, test_loss: 1.0036, test_f1: 0.5115
 epoch: 10, train_loss: 0.9463, test_loss: 1.0398, test_f1: 0.4378
 epoch: 11, train_loss: 0.9425, test_loss: 1.0225, test_f1: 0.5059
 epoch: 12, train_loss: 0.9327, test_loss: 0.9930, test_f1: 0.5115
 epoch: 13, train_loss: 0.9237, test_loss: 0.9829, test_f1: 0.4981
 epoch: 14, train_loss: 0.9391, test_loss: 1.0251, test_f1: 0.4686
 epoch: 15, train_loss: 0.9320, test_loss: 0.9890, test_f1: 0.5072
 epoch: 16, train_loss: 0.9152, test_loss: 0.9657, test_f1: 0.4908
 epoch: 17, train_loss: 0.9263, test_loss: 1.0728, test_f1: 0.4898
 epoch: 18, train_loss: 0.9264, test_loss: 0.9849, test_f1: 0.5137
 epoch: 19, train_loss: 0.9057, test_loss: 0.9890, test_f1: 0.5277
 epoch: 20, train_loss: 0.8879, test_loss: 0.9751, test_f1: 0.5136
 epoch: 21, train_loss: 0.9036, test_loss: 0.9506, test_f1: 0.5111
 epoch: 22, train_loss: 0.8908, test_loss: 0.9464, test_f1: 0.5266
 epoch: 23, train_loss: 0.9038, test_loss: 1.0322, test_f1: 0.4656
 epoch: 24, train_loss: 0.9101, test_loss: 1.0000, test_f1: 0.5108
 epoch: 25, train_loss: 0.9028, test_loss: 0.9914, test_f1: 0.4844
 epoch: 26, train_loss: 0.8806, test_loss: 0.9892, test_f1: 0.5159
 epoch: 27, train_loss: 0.8774, test_loss: 0.9978, test_f1: 0.5051
 epoch: 28, train_loss: 0.8894, test_loss: 0.9716, test_f1: 0.5235
 epoch: 29, train_loss: 0.8792, test_loss: 0.9813, test_f1: 0.5112
 epoch: 30, train_loss: 0.8704, test_loss: 0.9721, test_f1: 0.5172
 epoch: 31, train_loss: 0.8677, test_loss: 0.9496, test_f1: 0.5199
 epoch: 32, train_loss: 0.8846, test_loss: 1.0384, test_f1: 0.4795
 epoch: 33, train_loss: 0.8867, test_loss: 0.9484, test_f1: 0.5176
 epoch: 34, train_loss: 0.8664, test_loss: 0.9646, test_f1: 0.5316
 epoch: 35, train_loss: 0.8668, test_loss: 0.9518, test_f1: 0.5234
 epoch: 36, train_loss: 0.8647, test_loss: 0.9569, test_f1: 0.5370
 epoch: 37, train_loss: 0.8509, test_loss: 0.9676, test_f1: 0.4773
 epoch: 38, train_loss: 0.8572, test_loss: 0.9698, test_f1: 0.5246
 epoch: 39, train_loss: 0.8559, test_loss: 0.9327, test_f1: 0.5576
 epoch: 40, train_loss: 0.8520, test_loss: 0.9885, test_f1: 0.4925
 epoch: 41, train_loss: 0.8491, test_loss: 0.9339, test_f1: 0.5068
 epoch: 42, train_loss: 0.8475, test_loss: 0.9191, test_f1: 0.5235
 epoch: 43, train_loss: 0.8572, test_loss: 0.9343, test_f1: 0.5252
 epoch: 44, train_loss: 0.8584, test_loss: 0.9596, test_f1: 0.5088
 epoch: 45, train_loss: 0.8616, test_loss: 0.9009, test_f1: 0.5217
 epoch: 46, train_loss: 0.8594, test_loss: 1.0671, test_f1: 0.5104
 epoch: 47, train_loss: 0.8511, test_loss: 0.9935, test_f1: 0.5194
 epoch: 48, train_loss: 0.8629, test_loss: 0.9579, test_f1: 0.4892
 epoch: 49, train_loss: 0.8521, test_loss: 0.9759, test_f1: 0.4965
 epoch: 50, train_loss: 0.8450, test_loss: 0.9430, test_f1: 0.5169
 epoch: 51, train_loss: 0.8241, test_loss: 0.9099, test_f1: 0.5350
 epoch: 52, train_loss: 0.8084, test_loss: 0.9061, test_f1: 0.5464
 epoch: 53, train_loss: 0.8202, test_loss: 0.9007, test_f1: 0.5546
 epoch: 54, train_loss: 0.8120, test_loss: 0.9164, test_f1: 0.5517
 epoch: 55, train_loss: 0.7947, test_loss: 0.9116, test_f1: 0.5663
 epoch: 56, train_loss: 0.8020, test_loss: 0.9076, test_f1: 0.5386
 epoch: 57, train_loss: 0.7890, test_loss: 0.9097, test_f1: 0.5383
 epoch: 58, train_loss: 0.7953, test_loss: 0.9141, test_f1: 0.5331
 epoch: 59, train_loss: 0.7911, test_loss: 0.9157, test_f1: 0.5173
 epoch: 60, train_loss: 0.8051, test_loss: 0.8902, test_f1: 0.5557
 epoch: 61, train_loss: 0.8019, test_loss: 0.9185, test_f1: 0.5577
 epoch: 62, train_loss: 0.7899, test_loss: 0.8908, test_f1: 0.5607
 epoch: 63, train_loss: 0.7748, test_loss: 0.9082, test_f1: 0.5450
 epoch: 64, train_loss: 0.7835, test_loss: 0.9017, test_f1: 0.5439
 epoch: 65, train_loss: 0.7862, test_loss: 0.8423, test_f1: 0.5668
 epoch: 66, train_loss: 0.7945, test_loss: 0.9285, test_f1: 0.5489
 epoch: 67, train_loss: 0.7880, test_loss: 0.8870, test_f1: 0.5548
 epoch: 68, train_loss: 0.7919, test_loss: 0.8555, test_f1: 0.5617
 epoch: 69, train_loss: 0.7755, test_loss: 0.8823, test_f1: 0.5500
 epoch: 70, train_loss: 0.7795, test_loss: 0.9224, test_f1: 0.5200
 epoch: 71, train_loss: 0.7719, test_loss: 0.9137, test_f1: 0.5381
 epoch: 72, train_loss: 0.7663, test_loss: 0.8670, test_f1: 0.5656
 epoch: 73, train_loss: 0.7778, test_loss: 0.9058, test_f1: 0.5411
 epoch: 74, train_loss: 0.7817, test_loss: 0.8639, test_f1: 0.5501
 epoch: 75, train_loss: 0.7825, test_loss: 0.8817, test_f1: 0.5835
 epoch: 76, train_loss: 0.7796, test_loss: 0.9343, test_f1: 0.5219
 epoch: 77, train_loss: 0.7660, test_loss: 0.8766, test_f1: 0.5600
 epoch: 78, train_loss: 0.7574, test_loss: 0.9721, test_f1: 0.5032
 epoch: 79, train_loss: 0.7483, test_loss: 0.8830, test_f1: 0.5773
 epoch: 80, train_loss: 0.7612, test_loss: 0.8693, test_f1: 0.5664
 epoch: 81, train_loss: 0.7648, test_loss: 0.9127, test_f1: 0.5340
 epoch: 82, train_loss: 0.7572, test_loss: 0.8874, test_f1: 0.5669
 epoch: 83, train_loss: 0.7654, test_loss: 0.8933, test_f1: 0.5772
 epoch: 84, train_loss: 0.7703, test_loss: 0.9751, test_f1: 0.5266
 epoch: 85, train_loss: 0.7709, test_loss: 0.9035, test_f1: 0.5669
 epoch: 86, train_loss: 0.7649, test_loss: 0.9110, test_f1: 0.5468
 epoch: 87, train_loss: 0.7591, test_loss: 0.8433, test_f1: 0.5411
 epoch: 88, train_loss: 0.7543, test_loss: 0.8957, test_f1: 0.5545
 epoch: 89, train_loss: 0.7519, test_loss: 0.9012, test_f1: 0.5693
 epoch: 90, train_loss: 0.7608, test_loss: 0.8860, test_f1: 0.5681
 epoch: 91, train_loss: 0.7479, test_loss: 0.8763, test_f1: 0.5623
 epoch: 92, train_loss: 0.7523, test_loss: 0.8588, test_f1: 0.5462
 epoch: 93, train_loss: 0.7455, test_loss: 0.8871, test_f1: 0.5755
 epoch: 94, train_loss: 0.7424, test_loss: 0.8978, test_f1: 0.5611
 epoch: 95, train_loss: 0.7421, test_loss: 0.9218, test_f1: 0.5517
 epoch: 96, train_loss: 0.7597, test_loss: 0.8879, test_f1: 0.5577
 epoch: 97, train_loss: 0.7406, test_loss: 0.8834, test_f1: 0.5812
 epoch: 98, train_loss: 0.7536, test_loss: 0.8816, test_f1: 0.5778
 epoch: 99, train_loss: 0.7692, test_loss: 0.8809, test_f1: 0.5824
##################ITERATION #9 ****************************************
 epoch: 0, train_loss: 1.3319, test_loss: 1.2581, test_f1: 0.2270
 epoch: 1, train_loss: 1.1540, test_loss: 1.1205, test_f1: 0.3438
 epoch: 2, train_loss: 1.1002, test_loss: 1.0559, test_f1: 0.3453
 epoch: 3, train_loss: 1.0789, test_loss: 1.0505, test_f1: 0.3731
 epoch: 4, train_loss: 1.0500, test_loss: 1.0784, test_f1: 0.4126
 epoch: 5, train_loss: 1.0251, test_loss: 1.0623, test_f1: 0.4433
 epoch: 6, train_loss: 1.0172, test_loss: 1.0474, test_f1: 0.4490
 epoch: 7, train_loss: 0.9974, test_loss: 1.0349, test_f1: 0.4722
 epoch: 8, train_loss: 0.9830, test_loss: 1.0703, test_f1: 0.4733
 epoch: 9, train_loss: 0.9797, test_loss: 1.0745, test_f1: 0.4319
 epoch: 10, train_loss: 0.9682, test_loss: 1.0510, test_f1: 0.4937
 epoch: 11, train_loss: 0.9595, test_loss: 1.0396, test_f1: 0.4786
 epoch: 12, train_loss: 0.9542, test_loss: 1.0135, test_f1: 0.5084
 epoch: 13, train_loss: 0.9368, test_loss: 0.9987, test_f1: 0.4696
 epoch: 14, train_loss: 0.9342, test_loss: 1.0162, test_f1: 0.5152
 epoch: 15, train_loss: 0.9402, test_loss: 1.0248, test_f1: 0.5219
 epoch: 16, train_loss: 0.9357, test_loss: 0.9859, test_f1: 0.5279
 epoch: 17, train_loss: 0.9314, test_loss: 1.0075, test_f1: 0.5082
 epoch: 18, train_loss: 0.9324, test_loss: 0.9832, test_f1: 0.5028
 epoch: 19, train_loss: 0.9134, test_loss: 1.0025, test_f1: 0.4885
 epoch: 20, train_loss: 0.9007, test_loss: 0.9727, test_f1: 0.5175
 epoch: 21, train_loss: 0.8978, test_loss: 0.9450, test_f1: 0.5517
 epoch: 22, train_loss: 0.8921, test_loss: 0.9867, test_f1: 0.5353
 epoch: 23, train_loss: 0.8958, test_loss: 1.0094, test_f1: 0.5090
 epoch: 24, train_loss: 0.8965, test_loss: 1.0370, test_f1: 0.4868
 epoch: 25, train_loss: 0.8993, test_loss: 1.0206, test_f1: 0.4935
 epoch: 26, train_loss: 0.9066, test_loss: 0.9860, test_f1: 0.5134
 epoch: 27, train_loss: 0.8939, test_loss: 1.0305, test_f1: 0.4972
 epoch: 28, train_loss: 0.8852, test_loss: 0.9759, test_f1: 0.5209
 epoch: 29, train_loss: 0.8969, test_loss: 0.9741, test_f1: 0.5200
 epoch: 30, train_loss: 0.8927, test_loss: 0.8894, test_f1: 0.5651
 epoch: 31, train_loss: 0.8872, test_loss: 0.9599, test_f1: 0.5411
 epoch: 32, train_loss: 0.8747, test_loss: 0.9464, test_f1: 0.5135
 epoch: 33, train_loss: 0.8677, test_loss: 0.9323, test_f1: 0.5403
 epoch: 34, train_loss: 0.8706, test_loss: 1.0186, test_f1: 0.5034
 epoch: 35, train_loss: 0.8695, test_loss: 0.9557, test_f1: 0.5333
 epoch: 36, train_loss: 0.8635, test_loss: 0.9454, test_f1: 0.5389
 epoch: 37, train_loss: 0.8580, test_loss: 0.9313, test_f1: 0.5670
 epoch: 38, train_loss: 0.8640, test_loss: 0.9338, test_f1: 0.5611
 epoch: 39, train_loss: 0.8557, test_loss: 1.0047, test_f1: 0.4886
 epoch: 40, train_loss: 0.8576, test_loss: 0.8997, test_f1: 0.5393
 epoch: 41, train_loss: 0.8512, test_loss: 0.9042, test_f1: 0.5647
 epoch: 42, train_loss: 0.8503, test_loss: 0.9604, test_f1: 0.5251
 epoch: 43, train_loss: 0.8397, test_loss: 0.9668, test_f1: 0.4876
 epoch: 44, train_loss: 0.8315, test_loss: 0.8566, test_f1: 0.5634
 epoch: 45, train_loss: 0.8663, test_loss: 0.9396, test_f1: 0.5669
 epoch: 46, train_loss: 0.8513, test_loss: 0.9519, test_f1: 0.5414
 epoch: 47, train_loss: 0.8535, test_loss: 0.9472, test_f1: 0.5248
 epoch: 48, train_loss: 0.8328, test_loss: 1.0215, test_f1: 0.4769
 epoch: 49, train_loss: 0.8341, test_loss: 0.9638, test_f1: 0.5281
 epoch: 50, train_loss: 0.8213, test_loss: 0.9280, test_f1: 0.5350
 epoch: 51, train_loss: 0.8125, test_loss: 0.8787, test_f1: 0.5454
 epoch: 52, train_loss: 0.8019, test_loss: 0.9033, test_f1: 0.5523
 epoch: 53, train_loss: 0.7968, test_loss: 0.9279, test_f1: 0.5458
 epoch: 54, train_loss: 0.7969, test_loss: 0.9376, test_f1: 0.5407
 epoch: 55, train_loss: 0.8010, test_loss: 0.9139, test_f1: 0.5625
 epoch: 56, train_loss: 0.7903, test_loss: 0.9357, test_f1: 0.5478
 epoch: 57, train_loss: 0.7924, test_loss: 0.9114, test_f1: 0.5425
 epoch: 58, train_loss: 0.7738, test_loss: 0.9257, test_f1: 0.5230
 epoch: 59, train_loss: 0.7803, test_loss: 0.9381, test_f1: 0.5223
 epoch: 60, train_loss: 0.7974, test_loss: 0.9389, test_f1: 0.5224
 epoch: 61, train_loss: 0.7933, test_loss: 0.9231, test_f1: 0.5586
 epoch: 62, train_loss: 0.7738, test_loss: 0.9019, test_f1: 0.5620
 epoch: 63, train_loss: 0.7893, test_loss: 0.9508, test_f1: 0.5325
 epoch: 64, train_loss: 0.7971, test_loss: 0.9310, test_f1: 0.5222
 epoch: 65, train_loss: 0.7788, test_loss: 0.9290, test_f1: 0.5455
 epoch: 66, train_loss: 0.7770, test_loss: 0.9741, test_f1: 0.5519
 epoch: 67, train_loss: 0.7711, test_loss: 0.9162, test_f1: 0.6042
 epoch: 68, train_loss: 0.7697, test_loss: 0.9284, test_f1: 0.5760
 epoch: 69, train_loss: 0.7857, test_loss: 0.9183, test_f1: 0.5388
 epoch: 70, train_loss: 0.7715, test_loss: 0.9273, test_f1: 0.5241
 epoch: 71, train_loss: 0.7677, test_loss: 0.9028, test_f1: 0.5390
 epoch: 72, train_loss: 0.7633, test_loss: 0.9190, test_f1: 0.5464
 epoch: 73, train_loss: 0.7672, test_loss: 0.9330, test_f1: 0.5553
 epoch: 74, train_loss: 0.7631, test_loss: 0.8884, test_f1: 0.5899
 epoch: 75, train_loss: 0.7670, test_loss: 1.0211, test_f1: 0.5298
 epoch: 76, train_loss: 0.7631, test_loss: 0.9279, test_f1: 0.5755
 epoch: 77, train_loss: 0.7734, test_loss: 0.9239, test_f1: 0.5376
 epoch: 78, train_loss: 0.7597, test_loss: 0.9653, test_f1: 0.5342
 epoch: 79, train_loss: 0.7583, test_loss: 0.9578, test_f1: 0.5561
 epoch: 80, train_loss: 0.7582, test_loss: 0.9281, test_f1: 0.5287
 epoch: 81, train_loss: 0.7461, test_loss: 0.9478, test_f1: 0.5280
 epoch: 82, train_loss: 0.7586, test_loss: 0.9242, test_f1: 0.5785
 epoch: 83, train_loss: 0.7554, test_loss: 0.9386, test_f1: 0.5334
 epoch: 84, train_loss: 0.7582, test_loss: 0.9775, test_f1: 0.5410
 epoch: 85, train_loss: 0.7484, test_loss: 0.9505, test_f1: 0.5215
 epoch: 86, train_loss: 0.7328, test_loss: 0.9071, test_f1: 0.6108
 epoch: 87, train_loss: 0.7462, test_loss: 0.9770, test_f1: 0.5196
 epoch: 88, train_loss: 0.7366, test_loss: 0.9331, test_f1: 0.5413
 epoch: 89, train_loss: 0.7399, test_loss: 0.9148, test_f1: 0.5737
 epoch: 90, train_loss: 0.7444, test_loss: 0.9901, test_f1: 0.5225
 epoch: 91, train_loss: 0.7478, test_loss: 0.9095, test_f1: 0.5776
 epoch: 92, train_loss: 0.7506, test_loss: 1.0891, test_f1: 0.4929
 epoch: 93, train_loss: 0.7404, test_loss: 0.8711, test_f1: 0.5828
 epoch: 94, train_loss: 0.7356, test_loss: 0.9700, test_f1: 0.5095
 epoch: 95, train_loss: 0.7441, test_loss: 0.8584, test_f1: 0.5850
 epoch: 96, train_loss: 0.7438, test_loss: 0.9922, test_f1: 0.5376
 epoch: 97, train_loss: 0.7389, test_loss: 0.9028, test_f1: 0.5957
 epoch: 98, train_loss: 0.7433, test_loss: 0.9336, test_f1: 0.5486
 epoch: 99, train_loss: 0.7304, test_loss: 0.8919, test_f1: 0.5670

Training completed in 387.75 seconds
Best F1: 0.6519 at epoch 83
Mean F1 across iterations: 0.6094  0.0226
========================FINAL RESULTS================================
FEGIN weighted F1: 0.6519  0.0226
python main.py --data ltspice_examples --representation component_net --model FEGIN --layers 3 --hiddens 16 --batch_size 256 --lr 0.01 --emb_size 250 --epochs 100 --save_appendix component_net_L3_H16_BS256_LR0.01_E250 --no_val
-----



STDERR:
  File "main.py", line 370, in <module>
    main()
  File "main.py", line 254, in main
    dataset = dataset_class(
  File "/home/philip/projects/ltspice_examples_code_repo/Circuit-Completion-Using-GNNs/component_classification_with_link_prediction_head/evaluation/FEGIN/kernel/circuit_datasets.py", line 15, in __init__
    self.data, self.slices = torch.load(self.processed_paths[0])
  File "/home/philip/.local/lib/python3.8/site-packages/torch/serialization.py", line 1040, in load
    warnings.warn(
  File "/usr/lib/python3.8/warnings.py", line 109, in _showwarnmsg
    sw(msg.message, msg.category, msg.filename, msg.lineno,
  File "main.py", line 47, in warn_with_traceback
    traceback.print_stack(file=log)
/home/philip/projects/ltspice_examples_code_repo/Circuit-Completion-Using-GNNs/component_classification_with_link_prediction_head/evaluation/FEGIN/kernel/circuit_datasets.py:15: FutureWarning: You are using `torch.load` with `weights_only=False` (the current default value), which uses the default pickle module implicitly. It is possible to construct malicious pickle data which will execute arbitrary code during unpickling (See https://github.com/pytorch/pytorch/blob/main/SECURITY.md#untrusted-models for more details). In a future release, the default value for `weights_only` will be flipped to `True`. This limits the functions that could be executed during unpickling. Arbitrary objects will no longer be allowed to be loaded via this mode unless they are explicitly allowlisted by the user via `torch.serialization.add_safe_globals`. We recommend you start setting `weights_only=True` for any use case where you don't have full control of the loaded file. Please open an issue on GitHub for any issues related to this experimental feature.
  self.data, self.slices = torch.load(self.processed_paths[0])
