STDOUT:
Results will be saved in /home/philip/projects/ltspice_examples_code_repo/Circuit-Completion-Using-GNNs/component_classification_with_link_prediction_head/evaluation/FEGIN/results/model_FEGIN_dataset_ltspice_demos
Command line input: python main.py --data ltspice_demos --representation component_pin --model FEGIN --layers 3 --hiddens 64 --batch_size 256 --lr 0.01 --emb_size 250 --epochs 100 --save_appendix component_pin_L3_H64_BS256_LR0.01_E250 --no_val
 is saved.
-----
ltspice_demos - FEGIN
Using 3 layers, 64 hidden units, h = 2
Loading component_pin representation dataset
ENTERED
Training FEGIN on component_pin representation
Train: 1565, Test: 383
##################ITERATION #0 ****************************************
 epoch: 0, train_loss: 1.2931, test_loss: 1.3512, test_f1: 0.1365
 epoch: 1, train_loss: 1.1633, test_loss: 1.4249, test_f1: 0.3315
 epoch: 2, train_loss: 1.1026, test_loss: 1.7649, test_f1: 0.1836
 epoch: 3, train_loss: 1.0309, test_loss: 2.0085, test_f1: 0.1902
 epoch: 4, train_loss: 0.9716, test_loss: 1.5572, test_f1: 0.2336
 epoch: 5, train_loss: 0.9240, test_loss: 1.0436, test_f1: 0.4259
 epoch: 6, train_loss: 0.9098, test_loss: 1.0325, test_f1: 0.4674
 epoch: 7, train_loss: 0.8938, test_loss: 0.9852, test_f1: 0.5686
 epoch: 8, train_loss: 0.8804, test_loss: 1.0821, test_f1: 0.4205
 epoch: 9, train_loss: 0.8553, test_loss: 0.9957, test_f1: 0.5270
 epoch: 10, train_loss: 0.8170, test_loss: 0.9536, test_f1: 0.4807
 epoch: 11, train_loss: 0.8090, test_loss: 0.9810, test_f1: 0.5857
 epoch: 12, train_loss: 0.8677, test_loss: 1.1414, test_f1: 0.5067
 epoch: 13, train_loss: 0.8354, test_loss: 1.1913, test_f1: 0.5065
 epoch: 14, train_loss: 0.8077, test_loss: 1.0388, test_f1: 0.5346
 epoch: 15, train_loss: 0.7937, test_loss: 1.0820, test_f1: 0.5733
 epoch: 16, train_loss: 0.8060, test_loss: 0.9176, test_f1: 0.5460
 epoch: 17, train_loss: 0.7668, test_loss: 1.0445, test_f1: 0.5755
 epoch: 18, train_loss: 0.7541, test_loss: 1.0108, test_f1: 0.5685
 epoch: 19, train_loss: 0.7699, test_loss: 1.1432, test_f1: 0.5718
 epoch: 20, train_loss: 0.7486, test_loss: 1.0238, test_f1: 0.5299
 epoch: 21, train_loss: 0.7629, test_loss: 0.9874, test_f1: 0.5879
 epoch: 22, train_loss: 0.7319, test_loss: 1.0922, test_f1: 0.5144
 epoch: 23, train_loss: 0.7287, test_loss: 1.0132, test_f1: 0.6085
 epoch: 24, train_loss: 0.7552, test_loss: 1.2553, test_f1: 0.5817
 epoch: 25, train_loss: 0.7522, test_loss: 1.0006, test_f1: 0.6032
 epoch: 26, train_loss: 0.7202, test_loss: 1.0134, test_f1: 0.5772
 epoch: 27, train_loss: 0.7082, test_loss: 0.9558, test_f1: 0.6186
 epoch: 28, train_loss: 0.7018, test_loss: 1.0120, test_f1: 0.6377
 epoch: 29, train_loss: 0.6758, test_loss: 1.0904, test_f1: 0.6246
 epoch: 30, train_loss: 0.6641, test_loss: 1.3667, test_f1: 0.5340
 epoch: 31, train_loss: 0.6888, test_loss: 0.9449, test_f1: 0.6091
 epoch: 32, train_loss: 0.7143, test_loss: 1.0810, test_f1: 0.5414
 epoch: 33, train_loss: 0.7560, test_loss: 1.2145, test_f1: 0.5515
 epoch: 34, train_loss: 0.7403, test_loss: 0.9735, test_f1: 0.6255
 epoch: 35, train_loss: 0.7191, test_loss: 1.3544, test_f1: 0.4727
 epoch: 36, train_loss: 0.7137, test_loss: 1.3223, test_f1: 0.5214
 epoch: 37, train_loss: 0.7059, test_loss: 1.2582, test_f1: 0.5225
 epoch: 38, train_loss: 0.7097, test_loss: 0.9414, test_f1: 0.5943
 epoch: 39, train_loss: 0.7117, test_loss: 0.9905, test_f1: 0.5842
 epoch: 40, train_loss: 0.7184, test_loss: 1.1260, test_f1: 0.5578
 epoch: 41, train_loss: 0.6990, test_loss: 0.9901, test_f1: 0.5891
 epoch: 42, train_loss: 0.6871, test_loss: 1.0021, test_f1: 0.5783
 epoch: 43, train_loss: 0.6555, test_loss: 0.9508, test_f1: 0.6082
 epoch: 44, train_loss: 0.6317, test_loss: 1.0622, test_f1: 0.6035
 epoch: 45, train_loss: 0.6353, test_loss: 1.3417, test_f1: 0.5516
 epoch: 46, train_loss: 0.6348, test_loss: 1.2467, test_f1: 0.5908
 epoch: 47, train_loss: 0.6205, test_loss: 1.2327, test_f1: 0.5651
 epoch: 48, train_loss: 0.6349, test_loss: 1.4058, test_f1: 0.4784
 epoch: 49, train_loss: 0.6566, test_loss: 1.1824, test_f1: 0.6263
 epoch: 50, train_loss: 0.6485, test_loss: 1.1916, test_f1: 0.6051
 epoch: 51, train_loss: 0.5992, test_loss: 1.1457, test_f1: 0.6091
 epoch: 52, train_loss: 0.5956, test_loss: 1.1022, test_f1: 0.6194
 epoch: 53, train_loss: 0.5870, test_loss: 1.2056, test_f1: 0.5952
 epoch: 54, train_loss: 0.6129, test_loss: 1.3539, test_f1: 0.5011
 epoch: 55, train_loss: 0.6200, test_loss: 1.2318, test_f1: 0.6170
 epoch: 56, train_loss: 0.5974, test_loss: 1.1759, test_f1: 0.5878
 epoch: 57, train_loss: 0.5720, test_loss: 1.1909, test_f1: 0.5445
 epoch: 58, train_loss: 0.5618, test_loss: 1.2224, test_f1: 0.6064
 epoch: 59, train_loss: 0.5560, test_loss: 1.1765, test_f1: 0.5834
 epoch: 60, train_loss: 0.5502, test_loss: 1.0861, test_f1: 0.5988
 epoch: 61, train_loss: 0.5248, test_loss: 1.1677, test_f1: 0.6078
 epoch: 62, train_loss: 0.5353, test_loss: 1.2506, test_f1: 0.6003
 epoch: 63, train_loss: 0.5435, test_loss: 1.3632, test_f1: 0.5305
 epoch: 64, train_loss: 0.5626, test_loss: 1.2657, test_f1: 0.5975
 epoch: 65, train_loss: 0.5269, test_loss: 1.5037, test_f1: 0.5929
 epoch: 66, train_loss: 0.5141, test_loss: 1.2836, test_f1: 0.6312
 epoch: 67, train_loss: 0.5066, test_loss: 1.2119, test_f1: 0.6318
 epoch: 68, train_loss: 0.4839, test_loss: 1.5467, test_f1: 0.5535
 epoch: 69, train_loss: 0.5011, test_loss: 1.8329, test_f1: 0.6157
 epoch: 70, train_loss: 0.4977, test_loss: 1.7019, test_f1: 0.5815
 epoch: 71, train_loss: 0.4806, test_loss: 1.5716, test_f1: 0.5475
 epoch: 72, train_loss: 0.4873, test_loss: 1.4720, test_f1: 0.6457
 epoch: 73, train_loss: 0.4516, test_loss: 1.6275, test_f1: 0.5898
 epoch: 74, train_loss: 0.4564, test_loss: 1.7283, test_f1: 0.5820
 epoch: 75, train_loss: 0.4614, test_loss: 1.5234, test_f1: 0.6081
 epoch: 76, train_loss: 0.4484, test_loss: 1.5450, test_f1: 0.6070
 epoch: 77, train_loss: 0.4535, test_loss: 1.5354, test_f1: 0.6359
 epoch: 78, train_loss: 0.4482, test_loss: 1.6899, test_f1: 0.6118
 epoch: 79, train_loss: 0.4610, test_loss: 1.4892, test_f1: 0.5964
 epoch: 80, train_loss: 0.4509, test_loss: 1.4868, test_f1: 0.6091
 epoch: 81, train_loss: 0.4543, test_loss: 1.6950, test_f1: 0.6126
 epoch: 82, train_loss: 0.4244, test_loss: 1.5286, test_f1: 0.5743
 epoch: 83, train_loss: 0.4157, test_loss: 1.8385, test_f1: 0.5466
 epoch: 84, train_loss: 0.4399, test_loss: 1.6132, test_f1: 0.6385
 epoch: 85, train_loss: 0.4303, test_loss: 1.6141, test_f1: 0.6279
 epoch: 86, train_loss: 0.4576, test_loss: 1.3401, test_f1: 0.6223
 epoch: 87, train_loss: 0.4433, test_loss: 1.6162, test_f1: 0.5793
 epoch: 88, train_loss: 0.4332, test_loss: 1.9253, test_f1: 0.6173
 epoch: 89, train_loss: 0.4202, test_loss: 1.7965, test_f1: 0.5881
 epoch: 90, train_loss: 0.3992, test_loss: 1.5622, test_f1: 0.6833
 epoch: 91, train_loss: 0.3972, test_loss: 1.7546, test_f1: 0.5911
 epoch: 92, train_loss: 0.4000, test_loss: 2.0004, test_f1: 0.5672
 epoch: 93, train_loss: 0.3909, test_loss: 2.0477, test_f1: 0.5081
 epoch: 94, train_loss: 0.4130, test_loss: 1.9329, test_f1: 0.5217
 epoch: 95, train_loss: 0.4053, test_loss: 1.6314, test_f1: 0.6099
 epoch: 96, train_loss: 0.4317, test_loss: 1.5518, test_f1: 0.6004
 epoch: 97, train_loss: 0.4202, test_loss: 1.6341, test_f1: 0.6265
 epoch: 98, train_loss: 0.4510, test_loss: 1.5901, test_f1: 0.5644
 epoch: 99, train_loss: 0.4113, test_loss: 1.5597, test_f1: 0.5716
##################ITERATION #1 ****************************************
 epoch: 0, train_loss: 1.2002, test_loss: 1.5329, test_f1: 0.2301
 epoch: 1, train_loss: 1.0462, test_loss: 1.4425, test_f1: 0.2671
 epoch: 2, train_loss: 0.9625, test_loss: 1.7133, test_f1: 0.1750
 epoch: 3, train_loss: 0.8876, test_loss: 1.8023, test_f1: 0.1841
 epoch: 4, train_loss: 0.8441, test_loss: 1.2140, test_f1: 0.4474
 epoch: 5, train_loss: 0.8204, test_loss: 1.1728, test_f1: 0.5539
 epoch: 6, train_loss: 0.8137, test_loss: 1.5005, test_f1: 0.4497
 epoch: 7, train_loss: 0.7718, test_loss: 1.1909, test_f1: 0.5827
 epoch: 8, train_loss: 0.8183, test_loss: 1.7048, test_f1: 0.5382
 epoch: 9, train_loss: 0.8003, test_loss: 1.1691, test_f1: 0.5949
 epoch: 10, train_loss: 0.7820, test_loss: 1.0651, test_f1: 0.5488
 epoch: 11, train_loss: 0.7478, test_loss: 1.1905, test_f1: 0.5673
 epoch: 12, train_loss: 0.7621, test_loss: 1.1555, test_f1: 0.5786
 epoch: 13, train_loss: 0.7493, test_loss: 1.0230, test_f1: 0.5617
 epoch: 14, train_loss: 0.7232, test_loss: 1.0248, test_f1: 0.4934
 epoch: 15, train_loss: 0.7418, test_loss: 1.0680, test_f1: 0.6190
 epoch: 16, train_loss: 0.7099, test_loss: 1.0036, test_f1: 0.5296
 epoch: 17, train_loss: 0.7716, test_loss: 0.9779, test_f1: 0.5716
 epoch: 18, train_loss: 0.7504, test_loss: 1.0874, test_f1: 0.4173
 epoch: 19, train_loss: 0.7066, test_loss: 1.0981, test_f1: 0.5262
 epoch: 20, train_loss: 0.6938, test_loss: 1.1202, test_f1: 0.5777
 epoch: 21, train_loss: 0.7009, test_loss: 1.3759, test_f1: 0.4952
 epoch: 22, train_loss: 0.6612, test_loss: 1.1088, test_f1: 0.5869
 epoch: 23, train_loss: 0.6566, test_loss: 1.7209, test_f1: 0.4956
 epoch: 24, train_loss: 0.6424, test_loss: 1.1214, test_f1: 0.6151
 epoch: 25, train_loss: 0.6277, test_loss: 1.0487, test_f1: 0.6158
 epoch: 26, train_loss: 0.6674, test_loss: 1.0621, test_f1: 0.5843
 epoch: 27, train_loss: 0.6765, test_loss: 1.1896, test_f1: 0.6219
 epoch: 28, train_loss: 0.6613, test_loss: 1.2977, test_f1: 0.5599
 epoch: 29, train_loss: 0.6441, test_loss: 1.3974, test_f1: 0.5296
 epoch: 30, train_loss: 0.6510, test_loss: 1.1857, test_f1: 0.5466
 epoch: 31, train_loss: 0.6619, test_loss: 1.3550, test_f1: 0.4359
 epoch: 32, train_loss: 0.6739, test_loss: 1.0972, test_f1: 0.5902
 epoch: 33, train_loss: 0.6603, test_loss: 1.5359, test_f1: 0.4246
 epoch: 34, train_loss: 0.6729, test_loss: 1.5898, test_f1: 0.3750
 epoch: 35, train_loss: 0.6431, test_loss: 1.0405, test_f1: 0.6038
 epoch: 36, train_loss: 0.6320, test_loss: 1.2536, test_f1: 0.4877
 epoch: 37, train_loss: 0.6031, test_loss: 1.4440, test_f1: 0.5276
 epoch: 38, train_loss: 0.5924, test_loss: 1.2912, test_f1: 0.6392
 epoch: 39, train_loss: 0.5876, test_loss: 1.8076, test_f1: 0.5368
 epoch: 40, train_loss: 0.5865, test_loss: 1.3930, test_f1: 0.6136
 epoch: 41, train_loss: 0.5864, test_loss: 1.1265, test_f1: 0.5935
 epoch: 42, train_loss: 0.5725, test_loss: 1.1810, test_f1: 0.5796
 epoch: 43, train_loss: 0.5752, test_loss: 1.0583, test_f1: 0.5964
 epoch: 44, train_loss: 0.5937, test_loss: 1.0751, test_f1: 0.6058
 epoch: 45, train_loss: 0.5620, test_loss: 1.2108, test_f1: 0.5910
 epoch: 46, train_loss: 0.5817, test_loss: 1.1501, test_f1: 0.5725
 epoch: 47, train_loss: 0.5652, test_loss: 1.4182, test_f1: 0.5354
 epoch: 48, train_loss: 0.5586, test_loss: 1.2870, test_f1: 0.5434
 epoch: 49, train_loss: 0.5452, test_loss: 1.5301, test_f1: 0.6142
 epoch: 50, train_loss: 0.5390, test_loss: 1.3133, test_f1: 0.5970
 epoch: 51, train_loss: 0.5562, test_loss: 1.2665, test_f1: 0.6335
 epoch: 52, train_loss: 0.5286, test_loss: 1.2286, test_f1: 0.6464
 epoch: 53, train_loss: 0.4906, test_loss: 1.3858, test_f1: 0.5687
 epoch: 54, train_loss: 0.4723, test_loss: 1.5625, test_f1: 0.6042
 epoch: 55, train_loss: 0.4521, test_loss: 1.5290, test_f1: 0.6080
 epoch: 56, train_loss: 0.4635, test_loss: 1.4084, test_f1: 0.5844
 epoch: 57, train_loss: 0.4655, test_loss: 1.6006, test_f1: 0.6114
 epoch: 58, train_loss: 0.4614, test_loss: 1.4410, test_f1: 0.6209
 epoch: 59, train_loss: 0.4408, test_loss: 1.4360, test_f1: 0.6171
 epoch: 60, train_loss: 0.4472, test_loss: 1.6172, test_f1: 0.6439
 epoch: 61, train_loss: 0.4192, test_loss: 1.8639, test_f1: 0.6040
 epoch: 62, train_loss: 0.4301, test_loss: 2.1250, test_f1: 0.5803
 epoch: 63, train_loss: 0.4198, test_loss: 1.8873, test_f1: 0.6118
 epoch: 64, train_loss: 0.4011, test_loss: 1.9541, test_f1: 0.5957
 epoch: 65, train_loss: 0.4068, test_loss: 1.8795, test_f1: 0.6003
 epoch: 66, train_loss: 0.4223, test_loss: 1.7314, test_f1: 0.5153
 epoch: 67, train_loss: 0.4020, test_loss: 1.7844, test_f1: 0.6231
 epoch: 68, train_loss: 0.3859, test_loss: 1.6439, test_f1: 0.6211
 epoch: 69, train_loss: 0.3754, test_loss: 1.9027, test_f1: 0.5969
 epoch: 70, train_loss: 0.3614, test_loss: 1.9384, test_f1: 0.5901
 epoch: 71, train_loss: 0.3975, test_loss: 1.7026, test_f1: 0.6543
 epoch: 72, train_loss: 0.4142, test_loss: 1.5869, test_f1: 0.6282
 epoch: 73, train_loss: 0.4369, test_loss: 1.7842, test_f1: 0.6230
 epoch: 74, train_loss: 0.4208, test_loss: 1.8062, test_f1: 0.6222
 epoch: 75, train_loss: 0.4237, test_loss: 1.6583, test_f1: 0.6413
 epoch: 76, train_loss: 0.3854, test_loss: 1.7131, test_f1: 0.6076
 epoch: 77, train_loss: 0.4060, test_loss: 1.6827, test_f1: 0.6135
 epoch: 78, train_loss: 0.3927, test_loss: 1.8538, test_f1: 0.6160
 epoch: 79, train_loss: 0.4016, test_loss: 2.3172, test_f1: 0.5463
 epoch: 80, train_loss: 0.4089, test_loss: 1.8121, test_f1: 0.6425
 epoch: 81, train_loss: 0.4324, test_loss: 2.0131, test_f1: 0.5831
 epoch: 82, train_loss: 0.4248, test_loss: 1.8971, test_f1: 0.5890
 epoch: 83, train_loss: 0.3917, test_loss: 2.0220, test_f1: 0.5321
 epoch: 84, train_loss: 0.3733, test_loss: 2.1369, test_f1: 0.5824
 epoch: 85, train_loss: 0.3500, test_loss: 2.1014, test_f1: 0.6155
 epoch: 86, train_loss: 0.3137, test_loss: 2.1411, test_f1: 0.5776
 epoch: 87, train_loss: 0.3444, test_loss: 2.2594, test_f1: 0.5851
 epoch: 88, train_loss: 0.4432, test_loss: 1.8526, test_f1: 0.5848
 epoch: 89, train_loss: 0.4181, test_loss: 2.0507, test_f1: 0.5965
 epoch: 90, train_loss: 0.3883, test_loss: 2.1003, test_f1: 0.5940
 epoch: 91, train_loss: 0.3468, test_loss: 2.0234, test_f1: 0.5951
 epoch: 92, train_loss: 0.3664, test_loss: 2.1638, test_f1: 0.6108
 epoch: 93, train_loss: 0.3637, test_loss: 1.9774, test_f1: 0.6082
 epoch: 94, train_loss: 0.3865, test_loss: 1.9045, test_f1: 0.6475
 epoch: 95, train_loss: 0.3795, test_loss: 1.6166, test_f1: 0.6083
 epoch: 96, train_loss: 0.3707, test_loss: 1.7571, test_f1: 0.6202
 epoch: 97, train_loss: 0.3984, test_loss: 1.9921, test_f1: 0.6020
 epoch: 98, train_loss: 0.3707, test_loss: 1.9569, test_f1: 0.5884
 epoch: 99, train_loss: 0.3300, test_loss: 1.9227, test_f1: 0.6505
##################ITERATION #2 ****************************************
 epoch: 0, train_loss: 1.2885, test_loss: 1.3544, test_f1: 0.2281
 epoch: 1, train_loss: 1.0383, test_loss: 1.3693, test_f1: 0.3363
 epoch: 2, train_loss: 1.0009, test_loss: 1.4171, test_f1: 0.3272
 epoch: 3, train_loss: 0.9462, test_loss: 1.4106, test_f1: 0.4226
 epoch: 4, train_loss: 0.9329, test_loss: 1.2793, test_f1: 0.4136
 epoch: 5, train_loss: 0.8864, test_loss: 1.1427, test_f1: 0.5081
 epoch: 6, train_loss: 0.8622, test_loss: 1.0620, test_f1: 0.5056
 epoch: 7, train_loss: 0.8325, test_loss: 1.0120, test_f1: 0.5633
 epoch: 8, train_loss: 0.7853, test_loss: 1.2215, test_f1: 0.5443
 epoch: 9, train_loss: 0.7880, test_loss: 1.1764, test_f1: 0.5030
 epoch: 10, train_loss: 0.7622, test_loss: 1.5366, test_f1: 0.3941
 epoch: 11, train_loss: 0.7769, test_loss: 1.4733, test_f1: 0.2975
 epoch: 12, train_loss: 0.7647, test_loss: 1.2094, test_f1: 0.4099
 epoch: 13, train_loss: 0.7300, test_loss: 1.0723, test_f1: 0.4894
 epoch: 14, train_loss: 0.7044, test_loss: 1.0567, test_f1: 0.5144
 epoch: 15, train_loss: 0.7214, test_loss: 3.1234, test_f1: 0.3830
 epoch: 16, train_loss: 0.6978, test_loss: 1.8962, test_f1: 0.4460
 epoch: 17, train_loss: 0.7204, test_loss: 1.3679, test_f1: 0.4821
 epoch: 18, train_loss: 0.7066, test_loss: 1.0439, test_f1: 0.5807
 epoch: 19, train_loss: 0.7105, test_loss: 1.1212, test_f1: 0.6169
 epoch: 20, train_loss: 0.7029, test_loss: 1.1812, test_f1: 0.5945
 epoch: 21, train_loss: 0.7037, test_loss: 1.1922, test_f1: 0.4839
 epoch: 22, train_loss: 0.6964, test_loss: 1.5814, test_f1: 0.4778
 epoch: 23, train_loss: 0.7080, test_loss: 1.6432, test_f1: 0.4220
 epoch: 24, train_loss: 0.7027, test_loss: 2.2394, test_f1: 0.3757
 epoch: 25, train_loss: 0.6926, test_loss: 1.4755, test_f1: 0.5142
 epoch: 26, train_loss: 0.6706, test_loss: 1.0984, test_f1: 0.6127
 epoch: 27, train_loss: 0.6644, test_loss: 1.1000, test_f1: 0.6337
 epoch: 28, train_loss: 0.6374, test_loss: 2.1233, test_f1: 0.3405
 epoch: 29, train_loss: 0.6469, test_loss: 1.2292, test_f1: 0.6303
 epoch: 30, train_loss: 0.6545, test_loss: 1.1242, test_f1: 0.6202
 epoch: 31, train_loss: 0.6677, test_loss: 1.9034, test_f1: 0.4850
 epoch: 32, train_loss: 0.6874, test_loss: 1.8953, test_f1: 0.4809
 epoch: 33, train_loss: 0.6759, test_loss: 1.1020, test_f1: 0.4958
 epoch: 34, train_loss: 0.6910, test_loss: 1.1048, test_f1: 0.5735
 epoch: 35, train_loss: 0.6492, test_loss: 1.1046, test_f1: 0.5957
 epoch: 36, train_loss: 0.6223, test_loss: 1.0664, test_f1: 0.6103
 epoch: 37, train_loss: 0.6484, test_loss: 1.1645, test_f1: 0.6089
 epoch: 38, train_loss: 0.6054, test_loss: 1.1416, test_f1: 0.5601
 epoch: 39, train_loss: 0.5923, test_loss: 1.0451, test_f1: 0.6450
 epoch: 40, train_loss: 0.6524, test_loss: 0.9665, test_f1: 0.6029
 epoch: 41, train_loss: 0.5962, test_loss: 1.3661, test_f1: 0.5187
 epoch: 42, train_loss: 0.5805, test_loss: 1.0353, test_f1: 0.6221
 epoch: 43, train_loss: 0.5601, test_loss: 1.2021, test_f1: 0.6298
 epoch: 44, train_loss: 0.5682, test_loss: 1.1426, test_f1: 0.6035
 epoch: 45, train_loss: 0.5179, test_loss: 1.1678, test_f1: 0.6456
 epoch: 46, train_loss: 0.5265, test_loss: 1.2203, test_f1: 0.5673
 epoch: 47, train_loss: 0.5251, test_loss: 1.7054, test_f1: 0.4925
 epoch: 48, train_loss: 0.5144, test_loss: 1.2318, test_f1: 0.6001
 epoch: 49, train_loss: 0.5178, test_loss: 1.1847, test_f1: 0.5846
 epoch: 50, train_loss: 0.6008, test_loss: 1.1835, test_f1: 0.5445
 epoch: 51, train_loss: 0.5737, test_loss: 1.1719, test_f1: 0.5920
 epoch: 52, train_loss: 0.5494, test_loss: 1.2023, test_f1: 0.5987
 epoch: 53, train_loss: 0.5167, test_loss: 1.2271, test_f1: 0.6180
 epoch: 54, train_loss: 0.4861, test_loss: 1.0696, test_f1: 0.6602
 epoch: 55, train_loss: 0.4846, test_loss: 1.1628, test_f1: 0.6237
 epoch: 56, train_loss: 0.4553, test_loss: 1.0766, test_f1: 0.6514
 epoch: 57, train_loss: 0.4569, test_loss: 1.1690, test_f1: 0.6346
 epoch: 58, train_loss: 0.4395, test_loss: 1.2417, test_f1: 0.6131
 epoch: 59, train_loss: 0.4500, test_loss: 1.3439, test_f1: 0.5810
 epoch: 60, train_loss: 0.4833, test_loss: 1.3360, test_f1: 0.6278
 epoch: 61, train_loss: 0.4548, test_loss: 1.3846, test_f1: 0.6147
 epoch: 62, train_loss: 0.4122, test_loss: 1.3550, test_f1: 0.5948
 epoch: 63, train_loss: 0.4158, test_loss: 1.4460, test_f1: 0.5774
 epoch: 64, train_loss: 0.4196, test_loss: 1.2928, test_f1: 0.6430
 epoch: 65, train_loss: 0.4428, test_loss: 1.3028, test_f1: 0.6396
 epoch: 66, train_loss: 0.4507, test_loss: 1.3733, test_f1: 0.5807
 epoch: 67, train_loss: 0.4097, test_loss: 1.6135, test_f1: 0.5529
 epoch: 68, train_loss: 0.4081, test_loss: 1.3774, test_f1: 0.6407
 epoch: 69, train_loss: 0.4020, test_loss: 1.5762, test_f1: 0.6010
 epoch: 70, train_loss: 0.3646, test_loss: 1.6320, test_f1: 0.5771
 epoch: 71, train_loss: 0.4106, test_loss: 1.6861, test_f1: 0.5994
 epoch: 72, train_loss: 0.3688, test_loss: 1.5366, test_f1: 0.6336
 epoch: 73, train_loss: 0.3627, test_loss: 1.6106, test_f1: 0.6179
 epoch: 74, train_loss: 0.3884, test_loss: 2.2778, test_f1: 0.5571
 epoch: 75, train_loss: 0.4742, test_loss: 1.5007, test_f1: 0.6252
 epoch: 76, train_loss: 0.4428, test_loss: 1.2422, test_f1: 0.6016
 epoch: 77, train_loss: 0.3975, test_loss: 1.4448, test_f1: 0.6052
 epoch: 78, train_loss: 0.4006, test_loss: 1.7651, test_f1: 0.5605
 epoch: 79, train_loss: 0.3856, test_loss: 1.5537, test_f1: 0.6034
 epoch: 80, train_loss: 0.3493, test_loss: 1.4181, test_f1: 0.6164
 epoch: 81, train_loss: 0.3613, test_loss: 1.5143, test_f1: 0.6142
 epoch: 82, train_loss: 0.3690, test_loss: 1.5588, test_f1: 0.6498
 epoch: 83, train_loss: 0.3570, test_loss: 1.3305, test_f1: 0.6649
 epoch: 84, train_loss: 0.3281, test_loss: 1.5213, test_f1: 0.6182
 epoch: 85, train_loss: 0.3547, test_loss: 1.8836, test_f1: 0.5824
 epoch: 86, train_loss: 0.3347, test_loss: 1.7048, test_f1: 0.6503
 epoch: 87, train_loss: 0.3659, test_loss: 1.6250, test_f1: 0.6526
 epoch: 88, train_loss: 0.3478, test_loss: 1.7627, test_f1: 0.5911
 epoch: 89, train_loss: 0.3419, test_loss: 1.7652, test_f1: 0.5921
 epoch: 90, train_loss: 0.3622, test_loss: 1.8312, test_f1: 0.5712
 epoch: 91, train_loss: 0.3798, test_loss: 1.6286, test_f1: 0.6493
 epoch: 92, train_loss: 0.3936, test_loss: 3.0941, test_f1: 0.4715
 epoch: 93, train_loss: 0.3473, test_loss: 1.5424, test_f1: 0.6296
 epoch: 94, train_loss: 0.3144, test_loss: 1.4108, test_f1: 0.6281
 epoch: 95, train_loss: 0.3297, test_loss: 1.9123, test_f1: 0.5829
 epoch: 96, train_loss: 0.3503, test_loss: 1.5884, test_f1: 0.6707
 epoch: 97, train_loss: 0.3460, test_loss: 1.8518, test_f1: 0.6334
 epoch: 98, train_loss: 0.3165, test_loss: 1.8865, test_f1: 0.6293
 epoch: 99, train_loss: 0.3231, test_loss: 2.1305, test_f1: 0.5317
##################ITERATION #3 ****************************************
 epoch: 0, train_loss: 1.3450, test_loss: 2.0826, test_f1: 0.3369
 epoch: 1, train_loss: 1.0633, test_loss: 1.5654, test_f1: 0.3036
 epoch: 2, train_loss: 0.9824, test_loss: 1.4292, test_f1: 0.3280
 epoch: 3, train_loss: 0.9235, test_loss: 1.2657, test_f1: 0.4127
 epoch: 4, train_loss: 0.8853, test_loss: 1.0908, test_f1: 0.5043
 epoch: 5, train_loss: 0.8738, test_loss: 1.4145, test_f1: 0.3990
 epoch: 6, train_loss: 0.8518, test_loss: 1.1535, test_f1: 0.4541
 epoch: 7, train_loss: 0.8449, test_loss: 1.1180, test_f1: 0.4342
 epoch: 8, train_loss: 0.7972, test_loss: 1.0956, test_f1: 0.4685
 epoch: 9, train_loss: 0.7846, test_loss: 1.1725, test_f1: 0.5308
 epoch: 10, train_loss: 0.7664, test_loss: 1.0843, test_f1: 0.5966
 epoch: 11, train_loss: 0.7674, test_loss: 1.0317, test_f1: 0.5729
 epoch: 12, train_loss: 0.7804, test_loss: 1.5984, test_f1: 0.4987
 epoch: 13, train_loss: 0.7370, test_loss: 1.4837, test_f1: 0.5256
 epoch: 14, train_loss: 0.7402, test_loss: 1.5496, test_f1: 0.5116
 epoch: 15, train_loss: 0.7387, test_loss: 1.1217, test_f1: 0.5733
 epoch: 16, train_loss: 0.7344, test_loss: 1.2743, test_f1: 0.5067
 epoch: 17, train_loss: 0.7174, test_loss: 1.3615, test_f1: 0.5647
 epoch: 18, train_loss: 0.7157, test_loss: 1.0439, test_f1: 0.6028
 epoch: 19, train_loss: 0.7154, test_loss: 1.8459, test_f1: 0.3928
 epoch: 20, train_loss: 0.7024, test_loss: 1.1866, test_f1: 0.5667
 epoch: 21, train_loss: 0.6656, test_loss: 1.4137, test_f1: 0.5280
 epoch: 22, train_loss: 0.7029, test_loss: 1.1114, test_f1: 0.5996
 epoch: 23, train_loss: 0.7107, test_loss: 1.1253, test_f1: 0.5714
 epoch: 24, train_loss: 0.7027, test_loss: 1.4292, test_f1: 0.4494
 epoch: 25, train_loss: 0.7051, test_loss: 1.0898, test_f1: 0.5852
 epoch: 26, train_loss: 0.6971, test_loss: 1.2226, test_f1: 0.5350
 epoch: 27, train_loss: 0.6793, test_loss: 1.4788, test_f1: 0.4421
 epoch: 28, train_loss: 0.7019, test_loss: 1.3351, test_f1: 0.4991
 epoch: 29, train_loss: 0.6707, test_loss: 1.4876, test_f1: 0.4563
 epoch: 30, train_loss: 0.6747, test_loss: 1.5188, test_f1: 0.5003
 epoch: 31, train_loss: 0.6918, test_loss: 1.4602, test_f1: 0.5528
 epoch: 32, train_loss: 0.6491, test_loss: 1.6854, test_f1: 0.4613
 epoch: 33, train_loss: 0.6751, test_loss: 1.1066, test_f1: 0.5851
 epoch: 34, train_loss: 0.6729, test_loss: 1.1553, test_f1: 0.5600
 epoch: 35, train_loss: 0.6751, test_loss: 1.0929, test_f1: 0.5655
 epoch: 36, train_loss: 0.6426, test_loss: 0.9841, test_f1: 0.6450
 epoch: 37, train_loss: 0.6319, test_loss: 1.1664, test_f1: 0.5772
 epoch: 38, train_loss: 0.6017, test_loss: 1.0771, test_f1: 0.5836
 epoch: 39, train_loss: 0.6194, test_loss: 1.0047, test_f1: 0.6020
 epoch: 40, train_loss: 0.6426, test_loss: 1.1799, test_f1: 0.5819
 epoch: 41, train_loss: 0.6358, test_loss: 1.0860, test_f1: 0.6042
 epoch: 42, train_loss: 0.6263, test_loss: 1.1344, test_f1: 0.6156
 epoch: 43, train_loss: 0.6357, test_loss: 1.1017, test_f1: 0.6685
 epoch: 44, train_loss: 0.6184, test_loss: 1.4075, test_f1: 0.6284
 epoch: 45, train_loss: 0.5724, test_loss: 1.0825, test_f1: 0.5754
 epoch: 46, train_loss: 0.5772, test_loss: 1.0762, test_f1: 0.6559
 epoch: 47, train_loss: 0.5751, test_loss: 1.0715, test_f1: 0.6194
 epoch: 48, train_loss: 0.5755, test_loss: 1.2253, test_f1: 0.4932
 epoch: 49, train_loss: 0.5557, test_loss: 1.2131, test_f1: 0.6122
 epoch: 50, train_loss: 0.5711, test_loss: 1.1786, test_f1: 0.5730
 epoch: 51, train_loss: 0.5563, test_loss: 0.9910, test_f1: 0.6602
 epoch: 52, train_loss: 0.5315, test_loss: 0.9744, test_f1: 0.6776
 epoch: 53, train_loss: 0.4995, test_loss: 1.1047, test_f1: 0.6365
 epoch: 54, train_loss: 0.4901, test_loss: 1.1701, test_f1: 0.6156
 epoch: 55, train_loss: 0.4903, test_loss: 1.2052, test_f1: 0.6396
 epoch: 56, train_loss: 0.4697, test_loss: 1.2422, test_f1: 0.6315
 epoch: 57, train_loss: 0.4789, test_loss: 1.2740, test_f1: 0.5934
 epoch: 58, train_loss: 0.4807, test_loss: 1.2773, test_f1: 0.5765
 epoch: 59, train_loss: 0.4952, test_loss: 1.7196, test_f1: 0.5775
 epoch: 60, train_loss: 0.4867, test_loss: 1.4791, test_f1: 0.5966
 epoch: 61, train_loss: 0.4661, test_loss: 1.5922, test_f1: 0.5982
 epoch: 62, train_loss: 0.4734, test_loss: 1.2823, test_f1: 0.6378
 epoch: 63, train_loss: 0.4609, test_loss: 1.3409, test_f1: 0.6553
 epoch: 64, train_loss: 0.4535, test_loss: 1.3371, test_f1: 0.6313
 epoch: 65, train_loss: 0.4631, test_loss: 1.2204, test_f1: 0.6345
 epoch: 66, train_loss: 0.4967, test_loss: 1.1937, test_f1: 0.5680
 epoch: 67, train_loss: 0.4613, test_loss: 1.2892, test_f1: 0.6536
 epoch: 68, train_loss: 0.4426, test_loss: 1.3339, test_f1: 0.6111
 epoch: 69, train_loss: 0.4371, test_loss: 1.2372, test_f1: 0.6293
 epoch: 70, train_loss: 0.4429, test_loss: 1.3057, test_f1: 0.6384
 epoch: 71, train_loss: 0.4640, test_loss: 1.7077, test_f1: 0.5713
 epoch: 72, train_loss: 0.4438, test_loss: 1.3686, test_f1: 0.6077
 epoch: 73, train_loss: 0.4699, test_loss: 1.2531, test_f1: 0.6042
 epoch: 74, train_loss: 0.4176, test_loss: 1.1761, test_f1: 0.6244
 epoch: 75, train_loss: 0.4169, test_loss: 1.2616, test_f1: 0.6470
 epoch: 76, train_loss: 0.4035, test_loss: 1.3215, test_f1: 0.6551
 epoch: 77, train_loss: 0.4102, test_loss: 1.4495, test_f1: 0.6205
 epoch: 78, train_loss: 0.4082, test_loss: 1.4528, test_f1: 0.6193
 epoch: 79, train_loss: 0.3875, test_loss: 1.4645, test_f1: 0.6355
 epoch: 80, train_loss: 0.3819, test_loss: 1.5662, test_f1: 0.6247
 epoch: 81, train_loss: 0.3704, test_loss: 1.4013, test_f1: 0.6252
 epoch: 82, train_loss: 0.3756, test_loss: 1.3695, test_f1: 0.6402
 epoch: 83, train_loss: 0.3582, test_loss: 1.3215, test_f1: 0.6445
 epoch: 84, train_loss: 0.3591, test_loss: 1.2386, test_f1: 0.6390
 epoch: 85, train_loss: 0.3838, test_loss: 1.3890, test_f1: 0.5843
 epoch: 86, train_loss: 0.3543, test_loss: 1.7581, test_f1: 0.5807
 epoch: 87, train_loss: 0.3717, test_loss: 1.7035, test_f1: 0.5971
 epoch: 88, train_loss: 0.4315, test_loss: 1.4778, test_f1: 0.5847
 epoch: 89, train_loss: 0.3932, test_loss: 1.3434, test_f1: 0.6132
 epoch: 90, train_loss: 0.3746, test_loss: 1.2499, test_f1: 0.6658
 epoch: 91, train_loss: 0.3644, test_loss: 1.3351, test_f1: 0.6786
 epoch: 92, train_loss: 0.3770, test_loss: 1.4320, test_f1: 0.6594
 epoch: 93, train_loss: 0.3516, test_loss: 1.3873, test_f1: 0.6205
 epoch: 94, train_loss: 0.3811, test_loss: 1.4156, test_f1: 0.6403
 epoch: 95, train_loss: 0.3610, test_loss: 1.4595, test_f1: 0.6414
 epoch: 96, train_loss: 0.3555, test_loss: 1.5012, test_f1: 0.6319
 epoch: 97, train_loss: 0.3874, test_loss: 1.5630, test_f1: 0.5991
 epoch: 98, train_loss: 0.4023, test_loss: 1.2677, test_f1: 0.6800
 epoch: 99, train_loss: 0.3444, test_loss: 1.4243, test_f1: 0.6435
##################ITERATION #4 ****************************************
 epoch: 0, train_loss: 1.4306, test_loss: 1.6238, test_f1: 0.1365
 epoch: 1, train_loss: 1.0917, test_loss: 1.3642, test_f1: 0.3124
 epoch: 2, train_loss: 0.9835, test_loss: 1.2404, test_f1: 0.3905
 epoch: 3, train_loss: 0.9194, test_loss: 1.0973, test_f1: 0.4752
 epoch: 4, train_loss: 0.8955, test_loss: 1.0824, test_f1: 0.4917
 epoch: 5, train_loss: 0.8645, test_loss: 1.1942, test_f1: 0.4376
 epoch: 6, train_loss: 0.8035, test_loss: 1.1234, test_f1: 0.5242
 epoch: 7, train_loss: 0.7787, test_loss: 1.0106, test_f1: 0.5600
 epoch: 8, train_loss: 0.8018, test_loss: 0.9581, test_f1: 0.5593
 epoch: 9, train_loss: 0.7737, test_loss: 0.9968, test_f1: 0.5502
 epoch: 10, train_loss: 0.7727, test_loss: 1.2615, test_f1: 0.4274
 epoch: 11, train_loss: 0.7732, test_loss: 1.2579, test_f1: 0.4141
 epoch: 12, train_loss: 0.7554, test_loss: 0.9780, test_f1: 0.5964
 epoch: 13, train_loss: 0.7339, test_loss: 1.1466, test_f1: 0.5922
 epoch: 14, train_loss: 0.7181, test_loss: 0.9863, test_f1: 0.5842
 epoch: 15, train_loss: 0.6826, test_loss: 1.5010, test_f1: 0.4311
 epoch: 16, train_loss: 0.7042, test_loss: 1.0441, test_f1: 0.5682
 epoch: 17, train_loss: 0.7027, test_loss: 1.3743, test_f1: 0.5003
 epoch: 18, train_loss: 0.6932, test_loss: 0.9299, test_f1: 0.6102
 epoch: 19, train_loss: 0.6575, test_loss: 1.0670, test_f1: 0.5565
 epoch: 20, train_loss: 0.6601, test_loss: 1.0534, test_f1: 0.5642
 epoch: 21, train_loss: 0.6694, test_loss: 0.9777, test_f1: 0.6216
 epoch: 22, train_loss: 0.6636, test_loss: 1.0478, test_f1: 0.5774
 epoch: 23, train_loss: 0.6523, test_loss: 1.1288, test_f1: 0.5629
 epoch: 24, train_loss: 0.6179, test_loss: 1.1761, test_f1: 0.5807
 epoch: 25, train_loss: 0.6673, test_loss: 1.0013, test_f1: 0.6042
 epoch: 26, train_loss: 0.6729, test_loss: 1.1154, test_f1: 0.5966
 epoch: 27, train_loss: 0.6696, test_loss: 1.0368, test_f1: 0.5711
 epoch: 28, train_loss: 0.6759, test_loss: 1.0129, test_f1: 0.5938
 epoch: 29, train_loss: 0.6428, test_loss: 1.0552, test_f1: 0.5826
 epoch: 30, train_loss: 0.6109, test_loss: 1.0727, test_f1: 0.5919
 epoch: 31, train_loss: 0.6125, test_loss: 1.0677, test_f1: 0.5954
 epoch: 32, train_loss: 0.6004, test_loss: 0.9819, test_f1: 0.5917
 epoch: 33, train_loss: 0.6284, test_loss: 0.9805, test_f1: 0.5673
 epoch: 34, train_loss: 0.5939, test_loss: 1.0636, test_f1: 0.6148
 epoch: 35, train_loss: 0.5874, test_loss: 1.0249, test_f1: 0.6478
 epoch: 36, train_loss: 0.5634, test_loss: 1.1681, test_f1: 0.6134
 epoch: 37, train_loss: 0.5566, test_loss: 0.9586, test_f1: 0.6449
 epoch: 38, train_loss: 0.5705, test_loss: 1.4199, test_f1: 0.5444
 epoch: 39, train_loss: 0.5683, test_loss: 1.0008, test_f1: 0.6430
 epoch: 40, train_loss: 0.5680, test_loss: 1.0818, test_f1: 0.6066
 epoch: 41, train_loss: 0.5792, test_loss: 1.1240, test_f1: 0.6248
 epoch: 42, train_loss: 0.5608, test_loss: 1.0169, test_f1: 0.6551
 epoch: 43, train_loss: 0.5510, test_loss: 1.2177, test_f1: 0.6112
 epoch: 44, train_loss: 0.5841, test_loss: 1.2305, test_f1: 0.5169
 epoch: 45, train_loss: 0.5713, test_loss: 1.1080, test_f1: 0.6339
 epoch: 46, train_loss: 0.5618, test_loss: 1.0985, test_f1: 0.6517
 epoch: 47, train_loss: 0.5480, test_loss: 1.5350, test_f1: 0.5066
 epoch: 48, train_loss: 0.5885, test_loss: 1.2601, test_f1: 0.5517
 epoch: 49, train_loss: 0.5658, test_loss: 1.0728, test_f1: 0.6184
 epoch: 50, train_loss: 0.5173, test_loss: 1.2318, test_f1: 0.5993
 epoch: 51, train_loss: 0.5028, test_loss: 1.4708, test_f1: 0.5839
 epoch: 52, train_loss: 0.4888, test_loss: 1.1966, test_f1: 0.6695
 epoch: 53, train_loss: 0.4847, test_loss: 1.1650, test_f1: 0.6417
 epoch: 54, train_loss: 0.4680, test_loss: 1.1098, test_f1: 0.6622
 epoch: 55, train_loss: 0.4806, test_loss: 1.2035, test_f1: 0.6433
 epoch: 56, train_loss: 0.5344, test_loss: 1.1661, test_f1: 0.6055
 epoch: 57, train_loss: 0.4713, test_loss: 1.3136, test_f1: 0.5755
 epoch: 58, train_loss: 0.4789, test_loss: 1.1380, test_f1: 0.6446
 epoch: 59, train_loss: 0.4448, test_loss: 1.2360, test_f1: 0.6343
 epoch: 60, train_loss: 0.4485, test_loss: 1.4028, test_f1: 0.6226
 epoch: 61, train_loss: 0.4398, test_loss: 1.2350, test_f1: 0.6160
 epoch: 62, train_loss: 0.4033, test_loss: 1.3853, test_f1: 0.6171
 epoch: 63, train_loss: 0.4079, test_loss: 1.3373, test_f1: 0.6234
 epoch: 64, train_loss: 0.3852, test_loss: 1.3778, test_f1: 0.6430
 epoch: 65, train_loss: 0.3978, test_loss: 1.4368, test_f1: 0.6095
 epoch: 66, train_loss: 0.3887, test_loss: 1.3630, test_f1: 0.6232
 epoch: 67, train_loss: 0.3744, test_loss: 1.2489, test_f1: 0.6015
 epoch: 68, train_loss: 0.3900, test_loss: 1.4596, test_f1: 0.6263
 epoch: 69, train_loss: 0.4054, test_loss: 1.3501, test_f1: 0.5975
 epoch: 70, train_loss: 0.4265, test_loss: 1.3587, test_f1: 0.5830
 epoch: 71, train_loss: 0.4232, test_loss: 1.4014, test_f1: 0.6126
 epoch: 72, train_loss: 0.4490, test_loss: 1.1369, test_f1: 0.6610
 epoch: 73, train_loss: 0.4559, test_loss: 1.1172, test_f1: 0.6673
 epoch: 74, train_loss: 0.4069, test_loss: 1.3098, test_f1: 0.6159
 epoch: 75, train_loss: 0.4081, test_loss: 1.4719, test_f1: 0.5955
 epoch: 76, train_loss: 0.3890, test_loss: 1.2147, test_f1: 0.6618
 epoch: 77, train_loss: 0.3905, test_loss: 1.2619, test_f1: 0.6126
 epoch: 78, train_loss: 0.4527, test_loss: 1.4339, test_f1: 0.5665
 epoch: 79, train_loss: 0.4376, test_loss: 1.3110, test_f1: 0.6359
 epoch: 80, train_loss: 0.4443, test_loss: 1.3691, test_f1: 0.6250
 epoch: 81, train_loss: 0.4072, test_loss: 1.4588, test_f1: 0.6191
 epoch: 82, train_loss: 0.4148, test_loss: 1.4014, test_f1: 0.6207
 epoch: 83, train_loss: 0.3844, test_loss: 1.4944, test_f1: 0.6207
 epoch: 84, train_loss: 0.3688, test_loss: 1.2373, test_f1: 0.6269
 epoch: 85, train_loss: 0.3656, test_loss: 1.2016, test_f1: 0.6689
 epoch: 86, train_loss: 0.3447, test_loss: 1.4127, test_f1: 0.6375
 epoch: 87, train_loss: 0.3341, test_loss: 1.5149, test_f1: 0.5851
 epoch: 88, train_loss: 0.3187, test_loss: 1.4405, test_f1: 0.6244
 epoch: 89, train_loss: 0.3178, test_loss: 1.6451, test_f1: 0.6016
 epoch: 90, train_loss: 0.3304, test_loss: 1.6022, test_f1: 0.6023
 epoch: 91, train_loss: 0.3380, test_loss: 1.5964, test_f1: 0.6013
 epoch: 92, train_loss: 0.3414, test_loss: 1.5824, test_f1: 0.5824
 epoch: 93, train_loss: 0.3375, test_loss: 1.4737, test_f1: 0.6184
 epoch: 94, train_loss: 0.3423, test_loss: 1.6398, test_f1: 0.6363
 epoch: 95, train_loss: 0.3445, test_loss: 1.5077, test_f1: 0.6202
 epoch: 96, train_loss: 0.3318, test_loss: 1.4585, test_f1: 0.6650
 epoch: 97, train_loss: 0.3444, test_loss: 1.5728, test_f1: 0.5878
 epoch: 98, train_loss: 0.3271, test_loss: 1.7528, test_f1: 0.6029
 epoch: 99, train_loss: 0.3307, test_loss: 1.5783, test_f1: 0.6446
##################ITERATION #5 ****************************************
 epoch: 0, train_loss: 1.5373, test_loss: 1.9118, test_f1: 0.3495
 epoch: 1, train_loss: 1.0499, test_loss: 1.5754, test_f1: 0.2710
 epoch: 2, train_loss: 0.9410, test_loss: 1.4264, test_f1: 0.3293
 epoch: 3, train_loss: 0.8883, test_loss: 1.1790, test_f1: 0.4690
 epoch: 4, train_loss: 0.8393, test_loss: 1.2223, test_f1: 0.5071
 epoch: 5, train_loss: 0.8494, test_loss: 1.3148, test_f1: 0.4572
 epoch: 6, train_loss: 0.8680, test_loss: 1.1877, test_f1: 0.4539
 epoch: 7, train_loss: 0.8087, test_loss: 1.0343, test_f1: 0.5595
 epoch: 8, train_loss: 0.7939, test_loss: 1.1893, test_f1: 0.5449
 epoch: 9, train_loss: 0.7816, test_loss: 1.6062, test_f1: 0.4863
 epoch: 10, train_loss: 0.7679, test_loss: 1.0438, test_f1: 0.5745
 epoch: 11, train_loss: 0.7225, test_loss: 1.1266, test_f1: 0.5553
 epoch: 12, train_loss: 0.7564, test_loss: 1.0676, test_f1: 0.5667
 epoch: 13, train_loss: 0.7445, test_loss: 1.5540, test_f1: 0.4207
 epoch: 14, train_loss: 0.7278, test_loss: 0.9720, test_f1: 0.5899
 epoch: 15, train_loss: 0.7223, test_loss: 1.7999, test_f1: 0.5195
 epoch: 16, train_loss: 0.7612, test_loss: 1.8553, test_f1: 0.4034
 epoch: 17, train_loss: 0.7236, test_loss: 1.1444, test_f1: 0.5459
 epoch: 18, train_loss: 0.7063, test_loss: 1.1042, test_f1: 0.5332
 epoch: 19, train_loss: 0.7436, test_loss: 1.4561, test_f1: 0.4777
 epoch: 20, train_loss: 0.7071, test_loss: 1.1868, test_f1: 0.5647
 epoch: 21, train_loss: 0.6721, test_loss: 1.0557, test_f1: 0.5669
 epoch: 22, train_loss: 0.6636, test_loss: 1.0466, test_f1: 0.6398
 epoch: 23, train_loss: 0.6358, test_loss: 1.1446, test_f1: 0.5605
 epoch: 24, train_loss: 0.6804, test_loss: 1.1922, test_f1: 0.5900
 epoch: 25, train_loss: 0.6458, test_loss: 1.2514, test_f1: 0.4828
 epoch: 26, train_loss: 0.6425, test_loss: 1.6823, test_f1: 0.4381
 epoch: 27, train_loss: 0.6572, test_loss: 1.7122, test_f1: 0.5306
 epoch: 28, train_loss: 0.6519, test_loss: 1.4982, test_f1: 0.5042
 epoch: 29, train_loss: 0.6282, test_loss: 1.3650, test_f1: 0.5310
 epoch: 30, train_loss: 0.6476, test_loss: 1.3876, test_f1: 0.4926
 epoch: 31, train_loss: 0.6329, test_loss: 1.0443, test_f1: 0.6193
 epoch: 32, train_loss: 0.6275, test_loss: 1.3602, test_f1: 0.5248
 epoch: 33, train_loss: 0.6202, test_loss: 1.5032, test_f1: 0.4892
 epoch: 34, train_loss: 0.6213, test_loss: 1.1973, test_f1: 0.5555
 epoch: 35, train_loss: 0.6256, test_loss: 1.3305, test_f1: 0.6063
 epoch: 36, train_loss: 0.6079, test_loss: 1.3303, test_f1: 0.5481
 epoch: 37, train_loss: 0.6287, test_loss: 1.3188, test_f1: 0.6268
 epoch: 38, train_loss: 0.6015, test_loss: 1.2905, test_f1: 0.5949
 epoch: 39, train_loss: 0.6110, test_loss: 1.1588, test_f1: 0.5577
 epoch: 40, train_loss: 0.6128, test_loss: 1.5082, test_f1: 0.5104
 epoch: 41, train_loss: 0.5875, test_loss: 1.2126, test_f1: 0.5798
 epoch: 42, train_loss: 0.5769, test_loss: 1.3778, test_f1: 0.5378
 epoch: 43, train_loss: 0.5714, test_loss: 4.2028, test_f1: 0.2064
 epoch: 44, train_loss: 0.6791, test_loss: 1.5566, test_f1: 0.3906
 epoch: 45, train_loss: 0.6591, test_loss: 1.4959, test_f1: 0.5117
 epoch: 46, train_loss: 0.6514, test_loss: 2.5691, test_f1: 0.3540
 epoch: 47, train_loss: 0.6065, test_loss: 2.4971, test_f1: 0.3283
 epoch: 48, train_loss: 0.5939, test_loss: 1.2933, test_f1: 0.5895
 epoch: 49, train_loss: 0.5828, test_loss: 1.1250, test_f1: 0.5627
 epoch: 50, train_loss: 0.5597, test_loss: 1.2948, test_f1: 0.5210
 epoch: 51, train_loss: 0.5786, test_loss: 1.0622, test_f1: 0.6007
 epoch: 52, train_loss: 0.5307, test_loss: 1.2415, test_f1: 0.5384
 epoch: 53, train_loss: 0.5068, test_loss: 1.1643, test_f1: 0.5731
 epoch: 54, train_loss: 0.4987, test_loss: 1.1081, test_f1: 0.6086
 epoch: 55, train_loss: 0.4713, test_loss: 1.1492, test_f1: 0.6084
 epoch: 56, train_loss: 0.4788, test_loss: 1.2860, test_f1: 0.5795
 epoch: 57, train_loss: 0.5016, test_loss: 1.4894, test_f1: 0.5790
 epoch: 58, train_loss: 0.4660, test_loss: 1.2057, test_f1: 0.6397
 epoch: 59, train_loss: 0.4809, test_loss: 1.1871, test_f1: 0.6115
 epoch: 60, train_loss: 0.4792, test_loss: 1.1413, test_f1: 0.6252
 epoch: 61, train_loss: 0.4607, test_loss: 1.2262, test_f1: 0.5940
 epoch: 62, train_loss: 0.4251, test_loss: 1.4809, test_f1: 0.6199
 epoch: 63, train_loss: 0.4186, test_loss: 1.5685, test_f1: 0.6010
 epoch: 64, train_loss: 0.4541, test_loss: 1.5747, test_f1: 0.5678
 epoch: 65, train_loss: 0.4549, test_loss: 1.4531, test_f1: 0.5858
 epoch: 66, train_loss: 0.4346, test_loss: 1.4264, test_f1: 0.5373
 epoch: 67, train_loss: 0.4408, test_loss: 1.3757, test_f1: 0.5641
 epoch: 68, train_loss: 0.4268, test_loss: 1.3690, test_f1: 0.5831
 epoch: 69, train_loss: 0.4484, test_loss: 1.2538, test_f1: 0.6032
 epoch: 70, train_loss: 0.4271, test_loss: 1.5350, test_f1: 0.6525
 epoch: 71, train_loss: 0.4037, test_loss: 1.5032, test_f1: 0.5552
 epoch: 72, train_loss: 0.4155, test_loss: 1.4463, test_f1: 0.6102
 epoch: 73, train_loss: 0.4178, test_loss: 1.9005, test_f1: 0.5380
 epoch: 74, train_loss: 0.4080, test_loss: 1.3251, test_f1: 0.5865
 epoch: 75, train_loss: 0.3843, test_loss: 1.5789, test_f1: 0.5733
 epoch: 76, train_loss: 0.3514, test_loss: 1.5486, test_f1: 0.5820
 epoch: 77, train_loss: 0.3988, test_loss: 1.4165, test_f1: 0.5958
 epoch: 78, train_loss: 0.4004, test_loss: 1.7469, test_f1: 0.5672
 epoch: 79, train_loss: 0.3756, test_loss: 1.6213, test_f1: 0.5579
 epoch: 80, train_loss: 0.3653, test_loss: 1.5605, test_f1: 0.5719
 epoch: 81, train_loss: 0.3752, test_loss: 1.5200, test_f1: 0.5810
 epoch: 82, train_loss: 0.3764, test_loss: 1.8129, test_f1: 0.5932
 epoch: 83, train_loss: 0.3628, test_loss: 1.5991, test_f1: 0.5858
 epoch: 84, train_loss: 0.4172, test_loss: 1.6496, test_f1: 0.5817
 epoch: 85, train_loss: 0.3972, test_loss: 1.7349, test_f1: 0.5586
 epoch: 86, train_loss: 0.4157, test_loss: 1.5734, test_f1: 0.5768
 epoch: 87, train_loss: 0.3863, test_loss: 1.3682, test_f1: 0.6202
 epoch: 88, train_loss: 0.3701, test_loss: 1.2278, test_f1: 0.6106
 epoch: 89, train_loss: 0.3591, test_loss: 1.4575, test_f1: 0.6374
 epoch: 90, train_loss: 0.3714, test_loss: 1.4215, test_f1: 0.6030
 epoch: 91, train_loss: 0.3474, test_loss: 1.5785, test_f1: 0.5764
 epoch: 92, train_loss: 0.3163, test_loss: 1.5626, test_f1: 0.6085
 epoch: 93, train_loss: 0.3280, test_loss: 1.6575, test_f1: 0.5986
 epoch: 94, train_loss: 0.3076, test_loss: 1.6458, test_f1: 0.6224
 epoch: 95, train_loss: 0.2942, test_loss: 1.6716, test_f1: 0.5952
 epoch: 96, train_loss: 0.3207, test_loss: 1.6227, test_f1: 0.5623
 epoch: 97, train_loss: 0.3050, test_loss: 1.5857, test_f1: 0.6095
 epoch: 98, train_loss: 0.3162, test_loss: 1.5653, test_f1: 0.6079
 epoch: 99, train_loss: 0.2955, test_loss: 1.6598, test_f1: 0.5853
##################ITERATION #6 ****************************************
 epoch: 0, train_loss: 1.4855, test_loss: 1.6400, test_f1: 0.3225
 epoch: 1, train_loss: 1.1255, test_loss: 1.5449, test_f1: 0.3623
 epoch: 2, train_loss: 1.0121, test_loss: 1.3087, test_f1: 0.3815
 epoch: 3, train_loss: 0.9716, test_loss: 1.1561, test_f1: 0.4436
 epoch: 4, train_loss: 0.9007, test_loss: 1.0354, test_f1: 0.5388
 epoch: 5, train_loss: 0.8845, test_loss: 1.0501, test_f1: 0.5314
 epoch: 6, train_loss: 0.8584, test_loss: 1.1113, test_f1: 0.5000
 epoch: 7, train_loss: 0.8297, test_loss: 0.9864, test_f1: 0.5787
 epoch: 8, train_loss: 0.8218, test_loss: 1.0338, test_f1: 0.5985
 epoch: 9, train_loss: 0.7832, test_loss: 1.1920, test_f1: 0.5242
 epoch: 10, train_loss: 0.7707, test_loss: 1.0285, test_f1: 0.5362
 epoch: 11, train_loss: 0.7660, test_loss: 1.0130, test_f1: 0.6033
 epoch: 12, train_loss: 0.7379, test_loss: 1.0457, test_f1: 0.5882
 epoch: 13, train_loss: 0.7346, test_loss: 0.9396, test_f1: 0.6197
 epoch: 14, train_loss: 0.7501, test_loss: 1.0982, test_f1: 0.5155
 epoch: 15, train_loss: 0.7395, test_loss: 1.1059, test_f1: 0.5405
 epoch: 16, train_loss: 0.7560, test_loss: 1.1750, test_f1: 0.5628
 epoch: 17, train_loss: 0.7444, test_loss: 1.1697, test_f1: 0.4980
 epoch: 18, train_loss: 0.7246, test_loss: 1.0298, test_f1: 0.6007
 epoch: 19, train_loss: 0.6989, test_loss: 1.2013, test_f1: 0.4963
 epoch: 20, train_loss: 0.7088, test_loss: 1.3189, test_f1: 0.6115
 epoch: 21, train_loss: 0.6875, test_loss: 1.1296, test_f1: 0.6418
 epoch: 22, train_loss: 0.6940, test_loss: 1.2109, test_f1: 0.5292
 epoch: 23, train_loss: 0.6614, test_loss: 1.0129, test_f1: 0.6253
 epoch: 24, train_loss: 0.6473, test_loss: 1.3992, test_f1: 0.5566
 epoch: 25, train_loss: 0.6861, test_loss: 1.4718, test_f1: 0.5173
 epoch: 26, train_loss: 0.6682, test_loss: 1.2536, test_f1: 0.5116
 epoch: 27, train_loss: 0.6772, test_loss: 1.5047, test_f1: 0.4513
 epoch: 28, train_loss: 0.6668, test_loss: 1.3736, test_f1: 0.5318
 epoch: 29, train_loss: 0.6273, test_loss: 1.6514, test_f1: 0.5064
 epoch: 30, train_loss: 0.6962, test_loss: 1.0570, test_f1: 0.5763
 epoch: 31, train_loss: 0.6648, test_loss: 1.0279, test_f1: 0.5475
 epoch: 32, train_loss: 0.7258, test_loss: 1.1032, test_f1: 0.5917
 epoch: 33, train_loss: 0.7107, test_loss: 0.9232, test_f1: 0.6067
 epoch: 34, train_loss: 0.7171, test_loss: 0.9325, test_f1: 0.6260
 epoch: 35, train_loss: 0.6830, test_loss: 2.3985, test_f1: 0.4685
 epoch: 36, train_loss: 0.6861, test_loss: 1.1996, test_f1: 0.5990
 epoch: 37, train_loss: 0.6563, test_loss: 1.3098, test_f1: 0.5469
 epoch: 38, train_loss: 0.6279, test_loss: 0.9999, test_f1: 0.6231
 epoch: 39, train_loss: 0.6235, test_loss: 1.1670, test_f1: 0.6274
 epoch: 40, train_loss: 0.6077, test_loss: 1.6558, test_f1: 0.5611
 epoch: 41, train_loss: 0.6002, test_loss: 1.1176, test_f1: 0.6275
 epoch: 42, train_loss: 0.6572, test_loss: 1.3754, test_f1: 0.5114
 epoch: 43, train_loss: 0.6074, test_loss: 0.9976, test_f1: 0.6221
 epoch: 44, train_loss: 0.6111, test_loss: 1.1065, test_f1: 0.6195
 epoch: 45, train_loss: 0.5515, test_loss: 1.4303, test_f1: 0.5551
 epoch: 46, train_loss: 0.5854, test_loss: 1.2393, test_f1: 0.6200
 epoch: 47, train_loss: 0.5846, test_loss: 1.5045, test_f1: 0.5221
 epoch: 48, train_loss: 0.5765, test_loss: 1.3696, test_f1: 0.5569
 epoch: 49, train_loss: 0.5757, test_loss: 1.0967, test_f1: 0.6423
 epoch: 50, train_loss: 0.5296, test_loss: 1.1194, test_f1: 0.6055
 epoch: 51, train_loss: 0.5135, test_loss: 1.2371, test_f1: 0.5860
 epoch: 52, train_loss: 0.5017, test_loss: 1.2033, test_f1: 0.6373
 epoch: 53, train_loss: 0.4632, test_loss: 1.2813, test_f1: 0.5831
 epoch: 54, train_loss: 0.4747, test_loss: 1.1097, test_f1: 0.6395
 epoch: 55, train_loss: 0.4627, test_loss: 1.1065, test_f1: 0.5966
 epoch: 56, train_loss: 0.4562, test_loss: 1.2139, test_f1: 0.6030
 epoch: 57, train_loss: 0.4763, test_loss: 1.2652, test_f1: 0.6040
 epoch: 58, train_loss: 0.4705, test_loss: 1.1497, test_f1: 0.5759
 epoch: 59, train_loss: 0.4404, test_loss: 1.1792, test_f1: 0.6362
 epoch: 60, train_loss: 0.4274, test_loss: 1.3314, test_f1: 0.5853
 epoch: 61, train_loss: 0.4443, test_loss: 1.3991, test_f1: 0.6111
 epoch: 62, train_loss: 0.4214, test_loss: 1.3072, test_f1: 0.6193
 epoch: 63, train_loss: 0.4151, test_loss: 1.3452, test_f1: 0.5924
 epoch: 64, train_loss: 0.4082, test_loss: 1.2935, test_f1: 0.5886
 epoch: 65, train_loss: 0.4655, test_loss: 1.3338, test_f1: 0.5622
 epoch: 66, train_loss: 0.4161, test_loss: 1.2268, test_f1: 0.6324
 epoch: 67, train_loss: 0.4115, test_loss: 1.2739, test_f1: 0.6059
 epoch: 68, train_loss: 0.4349, test_loss: 1.3485, test_f1: 0.5800
 epoch: 69, train_loss: 0.4188, test_loss: 1.5215, test_f1: 0.5845
 epoch: 70, train_loss: 0.4520, test_loss: 1.2853, test_f1: 0.5940
 epoch: 71, train_loss: 0.4652, test_loss: 1.4656, test_f1: 0.5994
 epoch: 72, train_loss: 0.4357, test_loss: 1.6438, test_f1: 0.6161
 epoch: 73, train_loss: 0.4314, test_loss: 1.5419, test_f1: 0.6075
 epoch: 74, train_loss: 0.3982, test_loss: 1.4062, test_f1: 0.6284
 epoch: 75, train_loss: 0.3714, test_loss: 1.4026, test_f1: 0.6292
 epoch: 76, train_loss: 0.3609, test_loss: 1.4779, test_f1: 0.6031
 epoch: 77, train_loss: 0.3770, test_loss: 1.5023, test_f1: 0.6341
 epoch: 78, train_loss: 0.3468, test_loss: 1.6896, test_f1: 0.6062
 epoch: 79, train_loss: 0.3718, test_loss: 1.7265, test_f1: 0.5951
 epoch: 80, train_loss: 0.3487, test_loss: 1.8359, test_f1: 0.6251
 epoch: 81, train_loss: 0.3593, test_loss: 1.6253, test_f1: 0.5715
 epoch: 82, train_loss: 0.3887, test_loss: 1.7200, test_f1: 0.5757
 epoch: 83, train_loss: 0.3822, test_loss: 1.5243, test_f1: 0.6341
 epoch: 84, train_loss: 0.4047, test_loss: 1.5151, test_f1: 0.6263
 epoch: 85, train_loss: 0.3678, test_loss: 1.3066, test_f1: 0.5841
 epoch: 86, train_loss: 0.3536, test_loss: 1.5427, test_f1: 0.5989
 epoch: 87, train_loss: 0.3559, test_loss: 1.8524, test_f1: 0.5851
 epoch: 88, train_loss: 0.4120, test_loss: 1.8714, test_f1: 0.6155
 epoch: 89, train_loss: 0.3576, test_loss: 1.7458, test_f1: 0.6203
 epoch: 90, train_loss: 0.3582, test_loss: 1.6537, test_f1: 0.6290
 epoch: 91, train_loss: 0.3492, test_loss: 1.5286, test_f1: 0.6002
 epoch: 92, train_loss: 0.3649, test_loss: 1.7452, test_f1: 0.5691
 epoch: 93, train_loss: 0.3650, test_loss: 1.7068, test_f1: 0.6164
 epoch: 94, train_loss: 0.3418, test_loss: 1.6225, test_f1: 0.6361
 epoch: 95, train_loss: 0.3174, test_loss: 2.1085, test_f1: 0.5966
 epoch: 96, train_loss: 0.3096, test_loss: 1.8751, test_f1: 0.6099
 epoch: 97, train_loss: 0.3130, test_loss: 1.9673, test_f1: 0.5875
 epoch: 98, train_loss: 0.2737, test_loss: 2.0521, test_f1: 0.5648
 epoch: 99, train_loss: 0.2940, test_loss: 2.1768, test_f1: 0.5860
##################ITERATION #7 ****************************************
 epoch: 0, train_loss: 1.5743, test_loss: 1.6937, test_f1: 0.3150
 epoch: 1, train_loss: 1.1000, test_loss: 1.4457, test_f1: 0.3909
 epoch: 2, train_loss: 1.0162, test_loss: 1.4102, test_f1: 0.3862
 epoch: 3, train_loss: 0.9410, test_loss: 1.7236, test_f1: 0.2108
 epoch: 4, train_loss: 0.9151, test_loss: 1.1431, test_f1: 0.4874
 epoch: 5, train_loss: 0.8693, test_loss: 1.0098, test_f1: 0.5640
 epoch: 6, train_loss: 0.8285, test_loss: 1.0808, test_f1: 0.5120
 epoch: 7, train_loss: 0.8090, test_loss: 1.0855, test_f1: 0.5386
 epoch: 8, train_loss: 0.7996, test_loss: 1.0202, test_f1: 0.5500
 epoch: 9, train_loss: 0.8202, test_loss: 1.1476, test_f1: 0.5378
 epoch: 10, train_loss: 0.8057, test_loss: 1.2198, test_f1: 0.4613
 epoch: 11, train_loss: 0.7954, test_loss: 1.3818, test_f1: 0.4470
 epoch: 12, train_loss: 0.7750, test_loss: 1.0406, test_f1: 0.4855
 epoch: 13, train_loss: 0.7451, test_loss: 1.0166, test_f1: 0.4669
 epoch: 14, train_loss: 0.7544, test_loss: 1.8028, test_f1: 0.4106
 epoch: 15, train_loss: 0.7159, test_loss: 1.2790, test_f1: 0.5442
 epoch: 16, train_loss: 0.7271, test_loss: 1.0262, test_f1: 0.5949
 epoch: 17, train_loss: 0.7317, test_loss: 1.1554, test_f1: 0.5640
 epoch: 18, train_loss: 0.7185, test_loss: 1.1336, test_f1: 0.5996
 epoch: 19, train_loss: 0.7006, test_loss: 1.2910, test_f1: 0.5510
 epoch: 20, train_loss: 0.7332, test_loss: 0.9885, test_f1: 0.5821
 epoch: 21, train_loss: 0.7430, test_loss: 1.1246, test_f1: 0.5359
 epoch: 22, train_loss: 0.7054, test_loss: 1.3145, test_f1: 0.5690
 epoch: 23, train_loss: 0.7092, test_loss: 1.5498, test_f1: 0.5626
 epoch: 24, train_loss: 0.6945, test_loss: 1.1734, test_f1: 0.6153
 epoch: 25, train_loss: 0.6981, test_loss: 1.0707, test_f1: 0.6264
 epoch: 26, train_loss: 0.7293, test_loss: 1.0106, test_f1: 0.6127
 epoch: 27, train_loss: 0.6955, test_loss: 1.0549, test_f1: 0.5382
 epoch: 28, train_loss: 0.6992, test_loss: 1.4275, test_f1: 0.5162
 epoch: 29, train_loss: 0.7038, test_loss: 1.0581, test_f1: 0.5750
 epoch: 30, train_loss: 0.7005, test_loss: 1.1333, test_f1: 0.6325
 epoch: 31, train_loss: 0.6664, test_loss: 1.1406, test_f1: 0.6000
 epoch: 32, train_loss: 0.6597, test_loss: 1.2665, test_f1: 0.5486
 epoch: 33, train_loss: 0.6652, test_loss: 1.3976, test_f1: 0.5275
 epoch: 34, train_loss: 0.6630, test_loss: 1.2455, test_f1: 0.5720
 epoch: 35, train_loss: 0.6495, test_loss: 1.3878, test_f1: 0.6005
 epoch: 36, train_loss: 0.6497, test_loss: 1.0739, test_f1: 0.6691
 epoch: 37, train_loss: 0.6448, test_loss: 1.1094, test_f1: 0.5880
 epoch: 38, train_loss: 0.6305, test_loss: 1.1535, test_f1: 0.5417
 epoch: 39, train_loss: 0.6366, test_loss: 1.1719, test_f1: 0.5750
 epoch: 40, train_loss: 0.6196, test_loss: 1.2145, test_f1: 0.6097
 epoch: 41, train_loss: 0.5973, test_loss: 1.2181, test_f1: 0.6026
 epoch: 42, train_loss: 0.6263, test_loss: 1.1776, test_f1: 0.5730
 epoch: 43, train_loss: 0.6179, test_loss: 1.0420, test_f1: 0.6183
 epoch: 44, train_loss: 0.6443, test_loss: 1.4386, test_f1: 0.5027
 epoch: 45, train_loss: 0.6543, test_loss: 1.1779, test_f1: 0.6113
 epoch: 46, train_loss: 0.6637, test_loss: 1.2358, test_f1: 0.5689
 epoch: 47, train_loss: 0.6172, test_loss: 1.3163, test_f1: 0.5512
 epoch: 48, train_loss: 0.5914, test_loss: 1.1914, test_f1: 0.6232
 epoch: 49, train_loss: 0.6044, test_loss: 1.7888, test_f1: 0.3985
 epoch: 50, train_loss: 0.6489, test_loss: 1.2270, test_f1: 0.4354
 epoch: 51, train_loss: 0.6716, test_loss: 1.0216, test_f1: 0.5956
 epoch: 52, train_loss: 0.6089, test_loss: 1.0473, test_f1: 0.6062
 epoch: 53, train_loss: 0.6000, test_loss: 1.1529, test_f1: 0.5526
 epoch: 54, train_loss: 0.5814, test_loss: 0.9906, test_f1: 0.6046
 epoch: 55, train_loss: 0.5646, test_loss: 0.9919, test_f1: 0.6333
 epoch: 56, train_loss: 0.5413, test_loss: 0.9699, test_f1: 0.6323
 epoch: 57, train_loss: 0.5458, test_loss: 1.0983, test_f1: 0.6158
 epoch: 58, train_loss: 0.5270, test_loss: 1.0935, test_f1: 0.6091
 epoch: 59, train_loss: 0.5252, test_loss: 1.1966, test_f1: 0.5917
 epoch: 60, train_loss: 0.5046, test_loss: 1.0856, test_f1: 0.5949
 epoch: 61, train_loss: 0.5087, test_loss: 1.2165, test_f1: 0.5939
 epoch: 62, train_loss: 0.5001, test_loss: 1.2700, test_f1: 0.6298
 epoch: 63, train_loss: 0.4891, test_loss: 1.4289, test_f1: 0.5590
 epoch: 64, train_loss: 0.5101, test_loss: 1.1851, test_f1: 0.6468
 epoch: 65, train_loss: 0.6086, test_loss: 1.5699, test_f1: 0.5466
 epoch: 66, train_loss: 0.5725, test_loss: 1.2327, test_f1: 0.5509
 epoch: 67, train_loss: 0.5643, test_loss: 1.1256, test_f1: 0.5826
 epoch: 68, train_loss: 0.5179, test_loss: 1.2473, test_f1: 0.5550
 epoch: 69, train_loss: 0.4886, test_loss: 1.2420, test_f1: 0.5790
 epoch: 70, train_loss: 0.4729, test_loss: 1.2520, test_f1: 0.5941
 epoch: 71, train_loss: 0.4518, test_loss: 1.3497, test_f1: 0.5642
 epoch: 72, train_loss: 0.4577, test_loss: 1.3343, test_f1: 0.6197
 epoch: 73, train_loss: 0.4447, test_loss: 1.2538, test_f1: 0.5963
 epoch: 74, train_loss: 0.4292, test_loss: 1.3970, test_f1: 0.6233
 epoch: 75, train_loss: 0.4305, test_loss: 1.2574, test_f1: 0.6326
 epoch: 76, train_loss: 0.4452, test_loss: 1.3057, test_f1: 0.5866
 epoch: 77, train_loss: 0.4684, test_loss: 1.1331, test_f1: 0.6190
 epoch: 78, train_loss: 0.4839, test_loss: 1.3879, test_f1: 0.5889
 epoch: 79, train_loss: 0.4685, test_loss: 1.2961, test_f1: 0.6028
 epoch: 80, train_loss: 0.4625, test_loss: 1.5078, test_f1: 0.5992
 epoch: 81, train_loss: 0.4873, test_loss: 1.4056, test_f1: 0.5892
 epoch: 82, train_loss: 0.4707, test_loss: 1.4269, test_f1: 0.6085
 epoch: 83, train_loss: 0.4184, test_loss: 1.7347, test_f1: 0.6353
 epoch: 84, train_loss: 0.4360, test_loss: 1.5485, test_f1: 0.6225
 epoch: 85, train_loss: 0.4125, test_loss: 1.7637, test_f1: 0.5939
 epoch: 86, train_loss: 0.4389, test_loss: 1.4351, test_f1: 0.5933
 epoch: 87, train_loss: 0.4746, test_loss: 1.4122, test_f1: 0.5975
 epoch: 88, train_loss: 0.4438, test_loss: 1.6795, test_f1: 0.5754
 epoch: 89, train_loss: 0.4030, test_loss: 1.7721, test_f1: 0.5824
 epoch: 90, train_loss: 0.4354, test_loss: 1.5978, test_f1: 0.6479
 epoch: 91, train_loss: 0.4040, test_loss: 1.6452, test_f1: 0.6037
 epoch: 92, train_loss: 0.4048, test_loss: 1.6098, test_f1: 0.6373
 epoch: 93, train_loss: 0.4295, test_loss: 1.9291, test_f1: 0.5986
 epoch: 94, train_loss: 0.4189, test_loss: 1.4890, test_f1: 0.5954
 epoch: 95, train_loss: 0.4097, test_loss: 1.5020, test_f1: 0.5516
 epoch: 96, train_loss: 0.4043, test_loss: 1.5318, test_f1: 0.6130
 epoch: 97, train_loss: 0.3807, test_loss: 1.7594, test_f1: 0.5869
 epoch: 98, train_loss: 0.3806, test_loss: 1.7611, test_f1: 0.6189
 epoch: 99, train_loss: 0.3654, test_loss: 2.4336, test_f1: 0.6312
##################ITERATION #8 ****************************************
 epoch: 0, train_loss: 2.0231, test_loss: 1.9501, test_f1: 0.1365
 epoch: 1, train_loss: 1.1446, test_loss: 1.5082, test_f1: 0.3375
 epoch: 2, train_loss: 1.0681, test_loss: 1.4241, test_f1: 0.3423
 epoch: 3, train_loss: 1.0167, test_loss: 1.3735, test_f1: 0.3423
 epoch: 4, train_loss: 0.9945, test_loss: 1.3866, test_f1: 0.3375
 epoch: 5, train_loss: 0.9256, test_loss: 1.2831, test_f1: 0.4779
 epoch: 6, train_loss: 0.8982, test_loss: 1.4231, test_f1: 0.2434
 epoch: 7, train_loss: 0.8723, test_loss: 1.2514, test_f1: 0.3725
 epoch: 8, train_loss: 0.8271, test_loss: 1.2012, test_f1: 0.4481
 epoch: 9, train_loss: 0.7951, test_loss: 1.0807, test_f1: 0.5621
 epoch: 10, train_loss: 0.7732, test_loss: 1.0499, test_f1: 0.5714
 epoch: 11, train_loss: 0.7662, test_loss: 1.1414, test_f1: 0.6118
 epoch: 12, train_loss: 0.7815, test_loss: 1.4478, test_f1: 0.4792
 epoch: 13, train_loss: 0.7775, test_loss: 0.9966, test_f1: 0.5750
 epoch: 14, train_loss: 0.7416, test_loss: 0.9919, test_f1: 0.6525
 epoch: 15, train_loss: 0.7613, test_loss: 1.1041, test_f1: 0.5407
 epoch: 16, train_loss: 0.7455, test_loss: 1.1331, test_f1: 0.6648
 epoch: 17, train_loss: 0.7066, test_loss: 1.2222, test_f1: 0.5278
 epoch: 18, train_loss: 0.7240, test_loss: 1.1709, test_f1: 0.5062
 epoch: 19, train_loss: 0.7078, test_loss: 1.0117, test_f1: 0.5704
 epoch: 20, train_loss: 0.7290, test_loss: 1.2402, test_f1: 0.4339
 epoch: 21, train_loss: 0.7150, test_loss: 1.0391, test_f1: 0.5932
 epoch: 22, train_loss: 0.7539, test_loss: 0.9912, test_f1: 0.5597
 epoch: 23, train_loss: 0.7105, test_loss: 1.0705, test_f1: 0.4860
 epoch: 24, train_loss: 0.7159, test_loss: 1.2632, test_f1: 0.4903
 epoch: 25, train_loss: 0.6824, test_loss: 1.0796, test_f1: 0.5672
 epoch: 26, train_loss: 0.6789, test_loss: 1.0530, test_f1: 0.6133
 epoch: 27, train_loss: 0.6610, test_loss: 1.1924, test_f1: 0.5448
 epoch: 28, train_loss: 0.7005, test_loss: 1.1391, test_f1: 0.5532
 epoch: 29, train_loss: 0.6601, test_loss: 1.5819, test_f1: 0.4709
 epoch: 30, train_loss: 0.6438, test_loss: 1.5681, test_f1: 0.5645
 epoch: 31, train_loss: 0.6337, test_loss: 1.2260, test_f1: 0.6300
 epoch: 32, train_loss: 0.6300, test_loss: 1.0932, test_f1: 0.5710
 epoch: 33, train_loss: 0.6225, test_loss: 1.9209, test_f1: 0.4569
 epoch: 34, train_loss: 0.6216, test_loss: 1.2797, test_f1: 0.5139
 epoch: 35, train_loss: 0.6810, test_loss: 1.0616, test_f1: 0.6059
 epoch: 36, train_loss: 0.6646, test_loss: 0.9765, test_f1: 0.6342
 epoch: 37, train_loss: 0.6401, test_loss: 1.1178, test_f1: 0.5610
 epoch: 38, train_loss: 0.6548, test_loss: 1.1938, test_f1: 0.6281
 epoch: 39, train_loss: 0.6406, test_loss: 1.2916, test_f1: 0.5849
 epoch: 40, train_loss: 0.6309, test_loss: 1.1590, test_f1: 0.5285
 epoch: 41, train_loss: 0.6319, test_loss: 1.0309, test_f1: 0.5826
 epoch: 42, train_loss: 0.5984, test_loss: 1.2952, test_f1: 0.5870
 epoch: 43, train_loss: 0.5918, test_loss: 1.1534, test_f1: 0.5816
 epoch: 44, train_loss: 0.6084, test_loss: 1.3946, test_f1: 0.4755
 epoch: 45, train_loss: 0.6026, test_loss: 1.4075, test_f1: 0.5652
 epoch: 46, train_loss: 0.6109, test_loss: 1.1573, test_f1: 0.5763
 epoch: 47, train_loss: 0.5968, test_loss: 1.0332, test_f1: 0.6652
 epoch: 48, train_loss: 0.5696, test_loss: 1.1291, test_f1: 0.7058
 epoch: 49, train_loss: 0.5355, test_loss: 1.7489, test_f1: 0.5933
 epoch: 50, train_loss: 0.5481, test_loss: 1.9340, test_f1: 0.4690
 epoch: 51, train_loss: 0.5571, test_loss: 1.5149, test_f1: 0.6057
 epoch: 52, train_loss: 0.5490, test_loss: 1.4909, test_f1: 0.5782
 epoch: 53, train_loss: 0.5382, test_loss: 1.4055, test_f1: 0.6101
 epoch: 54, train_loss: 0.5311, test_loss: 1.2839, test_f1: 0.6131
 epoch: 55, train_loss: 0.5281, test_loss: 1.5286, test_f1: 0.6206
 epoch: 56, train_loss: 0.5299, test_loss: 1.2812, test_f1: 0.6019
 epoch: 57, train_loss: 0.5163, test_loss: 1.4157, test_f1: 0.5428
 epoch: 58, train_loss: 0.5221, test_loss: 0.9933, test_f1: 0.6334
 epoch: 59, train_loss: 0.5219, test_loss: 0.9924, test_f1: 0.6305
 epoch: 60, train_loss: 0.4999, test_loss: 1.0105, test_f1: 0.6270
 epoch: 61, train_loss: 0.5163, test_loss: 1.2719, test_f1: 0.6591
 epoch: 62, train_loss: 0.5603, test_loss: 1.1249, test_f1: 0.6281
 epoch: 63, train_loss: 0.5655, test_loss: 1.4443, test_f1: 0.5004
 epoch: 64, train_loss: 0.5218, test_loss: 1.3103, test_f1: 0.5389
 epoch: 65, train_loss: 0.5140, test_loss: 1.1397, test_f1: 0.5990
 epoch: 66, train_loss: 0.5284, test_loss: 1.1223, test_f1: 0.6242
 epoch: 67, train_loss: 0.5435, test_loss: 1.1532, test_f1: 0.6375
 epoch: 68, train_loss: 0.4906, test_loss: 1.1991, test_f1: 0.6153
 epoch: 69, train_loss: 0.4736, test_loss: 1.3425, test_f1: 0.5192
 epoch: 70, train_loss: 0.4730, test_loss: 1.1855, test_f1: 0.6386
 epoch: 71, train_loss: 0.4552, test_loss: 1.1515, test_f1: 0.6538
 epoch: 72, train_loss: 0.4544, test_loss: 1.0222, test_f1: 0.6822
 epoch: 73, train_loss: 0.4510, test_loss: 1.1048, test_f1: 0.6503
 epoch: 74, train_loss: 0.4278, test_loss: 1.2121, test_f1: 0.6431
 epoch: 75, train_loss: 0.4417, test_loss: 1.2822, test_f1: 0.6260
 epoch: 76, train_loss: 0.4441, test_loss: 1.3398, test_f1: 0.6359
 epoch: 77, train_loss: 0.4261, test_loss: 1.1558, test_f1: 0.5886
 epoch: 78, train_loss: 0.4379, test_loss: 1.1890, test_f1: 0.6315
 epoch: 79, train_loss: 0.4443, test_loss: 1.1728, test_f1: 0.6745
 epoch: 80, train_loss: 0.4263, test_loss: 1.4985, test_f1: 0.6037
 epoch: 81, train_loss: 0.4583, test_loss: 1.1151, test_f1: 0.6703
 epoch: 82, train_loss: 0.5487, test_loss: 1.2599, test_f1: 0.5315
 epoch: 83, train_loss: 0.5770, test_loss: 1.1093, test_f1: 0.5248
 epoch: 84, train_loss: 0.5422, test_loss: 1.0973, test_f1: 0.5837
 epoch: 85, train_loss: 0.5433, test_loss: 1.0655, test_f1: 0.6374
 epoch: 86, train_loss: 0.4904, test_loss: 1.2737, test_f1: 0.6261
 epoch: 87, train_loss: 0.4799, test_loss: 1.2349, test_f1: 0.5790
 epoch: 88, train_loss: 0.4478, test_loss: 1.2586, test_f1: 0.5878
 epoch: 89, train_loss: 0.4404, test_loss: 1.2377, test_f1: 0.6176
 epoch: 90, train_loss: 0.3941, test_loss: 1.2763, test_f1: 0.6473
 epoch: 91, train_loss: 0.3913, test_loss: 1.5171, test_f1: 0.6084
 epoch: 92, train_loss: 0.3936, test_loss: 1.3540, test_f1: 0.6304
 epoch: 93, train_loss: 0.4044, test_loss: 1.2664, test_f1: 0.6634
 epoch: 94, train_loss: 0.4025, test_loss: 1.2242, test_f1: 0.6470
 epoch: 95, train_loss: 0.3865, test_loss: 1.2894, test_f1: 0.6396
 epoch: 96, train_loss: 0.3830, test_loss: 1.2252, test_f1: 0.6366
 epoch: 97, train_loss: 0.4478, test_loss: 1.3364, test_f1: 0.5766
 epoch: 98, train_loss: 0.4433, test_loss: 1.1772, test_f1: 0.6543
 epoch: 99, train_loss: 0.4267, test_loss: 1.2828, test_f1: 0.6665
##################ITERATION #9 ****************************************
 epoch: 0, train_loss: 1.4564, test_loss: 1.4296, test_f1: 0.3156
 epoch: 1, train_loss: 1.0988, test_loss: 1.3366, test_f1: 0.3017
 epoch: 2, train_loss: 0.9830, test_loss: 1.3486, test_f1: 0.3623
 epoch: 3, train_loss: 0.9465, test_loss: 1.1970, test_f1: 0.4565
 epoch: 4, train_loss: 0.9181, test_loss: 1.2308, test_f1: 0.4090
 epoch: 5, train_loss: 0.8696, test_loss: 1.1331, test_f1: 0.4948
 epoch: 6, train_loss: 0.8439, test_loss: 1.0566, test_f1: 0.5032
 epoch: 7, train_loss: 0.8091, test_loss: 1.1131, test_f1: 0.5193
 epoch: 8, train_loss: 0.8151, test_loss: 1.1956, test_f1: 0.4711
 epoch: 9, train_loss: 0.7925, test_loss: 1.2357, test_f1: 0.4870
 epoch: 10, train_loss: 0.7833, test_loss: 1.7359, test_f1: 0.4315
 epoch: 11, train_loss: 0.7951, test_loss: 1.5006, test_f1: 0.4181
 epoch: 12, train_loss: 0.7997, test_loss: 2.2445, test_f1: 0.2587
 epoch: 13, train_loss: 0.8035, test_loss: 1.5927, test_f1: 0.3371
 epoch: 14, train_loss: 0.7697, test_loss: 0.9806, test_f1: 0.5968
 epoch: 15, train_loss: 0.7483, test_loss: 1.0051, test_f1: 0.5756
 epoch: 16, train_loss: 0.7644, test_loss: 1.1146, test_f1: 0.5220
 epoch: 17, train_loss: 0.7556, test_loss: 1.1788, test_f1: 0.5188
 epoch: 18, train_loss: 0.7206, test_loss: 1.3773, test_f1: 0.5042
 epoch: 19, train_loss: 0.7055, test_loss: 1.2492, test_f1: 0.5482
 epoch: 20, train_loss: 0.6803, test_loss: 1.0219, test_f1: 0.6247
 epoch: 21, train_loss: 0.6609, test_loss: 1.0991, test_f1: 0.5280
 epoch: 22, train_loss: 0.6729, test_loss: 1.0717, test_f1: 0.5614
 epoch: 23, train_loss: 0.6872, test_loss: 1.1144, test_f1: 0.5413
 epoch: 24, train_loss: 0.7117, test_loss: 1.0636, test_f1: 0.5662
 epoch: 25, train_loss: 0.6841, test_loss: 1.2025, test_f1: 0.5036
 epoch: 26, train_loss: 0.6904, test_loss: 1.0164, test_f1: 0.5835
 epoch: 27, train_loss: 0.6809, test_loss: 1.0240, test_f1: 0.5524
 epoch: 28, train_loss: 0.6478, test_loss: 1.1523, test_f1: 0.5376
 epoch: 29, train_loss: 0.6750, test_loss: 1.0698, test_f1: 0.6206
 epoch: 30, train_loss: 0.6565, test_loss: 1.3155, test_f1: 0.5314
 epoch: 31, train_loss: 0.6890, test_loss: 1.3127, test_f1: 0.4409
 epoch: 32, train_loss: 0.6932, test_loss: 1.3691, test_f1: 0.4247
 epoch: 33, train_loss: 0.6938, test_loss: 1.0245, test_f1: 0.5467
 epoch: 34, train_loss: 0.6681, test_loss: 0.9568, test_f1: 0.5680
 epoch: 35, train_loss: 0.6897, test_loss: 0.9720, test_f1: 0.6034
 epoch: 36, train_loss: 0.6386, test_loss: 1.5381, test_f1: 0.5465
 epoch: 37, train_loss: 0.6215, test_loss: 1.5215, test_f1: 0.4709
 epoch: 38, train_loss: 0.6002, test_loss: 1.2923, test_f1: 0.5798
 epoch: 39, train_loss: 0.5968, test_loss: 1.0757, test_f1: 0.5528
 epoch: 40, train_loss: 0.5801, test_loss: 1.2271, test_f1: 0.5078
 epoch: 41, train_loss: 0.5872, test_loss: 1.3958, test_f1: 0.5065
 epoch: 42, train_loss: 0.5868, test_loss: 1.2302, test_f1: 0.5820
 epoch: 43, train_loss: 0.6176, test_loss: 1.2372, test_f1: 0.5390
 epoch: 44, train_loss: 0.5757, test_loss: 1.3123, test_f1: 0.5838
 epoch: 45, train_loss: 0.5817, test_loss: 1.1487, test_f1: 0.5999
 epoch: 46, train_loss: 0.5739, test_loss: 1.3051, test_f1: 0.5280
 epoch: 47, train_loss: 0.5568, test_loss: 1.1738, test_f1: 0.5842
 epoch: 48, train_loss: 0.5614, test_loss: 1.0471, test_f1: 0.6256
 epoch: 49, train_loss: 0.5459, test_loss: 1.2507, test_f1: 0.5584
 epoch: 50, train_loss: 0.5501, test_loss: 1.8673, test_f1: 0.4664
 epoch: 51, train_loss: 0.5285, test_loss: 1.1462, test_f1: 0.5566
 epoch: 52, train_loss: 0.5550, test_loss: 1.1260, test_f1: 0.5497
 epoch: 53, train_loss: 0.5394, test_loss: 1.3469, test_f1: 0.5537
 epoch: 54, train_loss: 0.5088, test_loss: 1.2012, test_f1: 0.6180
 epoch: 55, train_loss: 0.4953, test_loss: 1.2325, test_f1: 0.6174
 epoch: 56, train_loss: 0.4941, test_loss: 1.2106, test_f1: 0.6244
 epoch: 57, train_loss: 0.4982, test_loss: 1.1622, test_f1: 0.5971
 epoch: 58, train_loss: 0.4933, test_loss: 1.5153, test_f1: 0.5847
 epoch: 59, train_loss: 0.4720, test_loss: 1.3666, test_f1: 0.5283
 epoch: 60, train_loss: 0.4731, test_loss: 1.4288, test_f1: 0.5359
 epoch: 61, train_loss: 0.4568, test_loss: 1.3086, test_f1: 0.5692
 epoch: 62, train_loss: 0.4577, test_loss: 1.3279, test_f1: 0.5779
 epoch: 63, train_loss: 0.4425, test_loss: 1.4683, test_f1: 0.5482
 epoch: 64, train_loss: 0.4332, test_loss: 1.7212, test_f1: 0.5322
 epoch: 65, train_loss: 0.4457, test_loss: 1.4421, test_f1: 0.5573
 epoch: 66, train_loss: 0.4758, test_loss: 1.1705, test_f1: 0.5712
 epoch: 67, train_loss: 0.4640, test_loss: 1.2857, test_f1: 0.5074
 epoch: 68, train_loss: 0.4337, test_loss: 1.3824, test_f1: 0.5481
 epoch: 69, train_loss: 0.4315, test_loss: 1.3298, test_f1: 0.5456
 epoch: 70, train_loss: 0.4510, test_loss: 1.4514, test_f1: 0.5805
 epoch: 71, train_loss: 0.4175, test_loss: 1.5228, test_f1: 0.5140
 epoch: 72, train_loss: 0.4392, test_loss: 1.4694, test_f1: 0.5538
 epoch: 73, train_loss: 0.4297, test_loss: 1.4874, test_f1: 0.6090
 epoch: 74, train_loss: 0.4226, test_loss: 1.4428, test_f1: 0.5672
 epoch: 75, train_loss: 0.4072, test_loss: 1.4541, test_f1: 0.5722
 epoch: 76, train_loss: 0.4244, test_loss: 1.6775, test_f1: 0.5375
 epoch: 77, train_loss: 0.4252, test_loss: 1.7226, test_f1: 0.5032
 epoch: 78, train_loss: 0.4228, test_loss: 1.8055, test_f1: 0.5122
 epoch: 79, train_loss: 0.4313, test_loss: 1.4973, test_f1: 0.5568
 epoch: 80, train_loss: 0.4537, test_loss: 1.2863, test_f1: 0.5719
 epoch: 81, train_loss: 0.4301, test_loss: 1.4389, test_f1: 0.5975
 epoch: 82, train_loss: 0.4507, test_loss: 1.2890, test_f1: 0.5578
 epoch: 83, train_loss: 0.4242, test_loss: 1.4604, test_f1: 0.5411
 epoch: 84, train_loss: 0.4219, test_loss: 1.3369, test_f1: 0.6097
 epoch: 85, train_loss: 0.3805, test_loss: 1.2732, test_f1: 0.5964
 epoch: 86, train_loss: 0.4486, test_loss: 1.4136, test_f1: 0.5693
 epoch: 87, train_loss: 0.4333, test_loss: 1.3298, test_f1: 0.5639
 epoch: 88, train_loss: 0.4084, test_loss: 1.3839, test_f1: 0.5774
 epoch: 89, train_loss: 0.4124, test_loss: 1.8147, test_f1: 0.5060
 epoch: 90, train_loss: 0.4353, test_loss: 1.3573, test_f1: 0.5536
 epoch: 91, train_loss: 0.4076, test_loss: 1.5231, test_f1: 0.5037
 epoch: 92, train_loss: 0.4624, test_loss: 1.8299, test_f1: 0.5265
 epoch: 93, train_loss: 0.4153, test_loss: 1.5483, test_f1: 0.6088
 epoch: 94, train_loss: 0.4062, test_loss: 1.4389, test_f1: 0.5784
 epoch: 95, train_loss: 0.3819, test_loss: 1.4588, test_f1: 0.5384
 epoch: 96, train_loss: 0.3834, test_loss: 1.8127, test_f1: 0.5658
 epoch: 97, train_loss: 0.4090, test_loss: 1.8456, test_f1: 0.5503
 epoch: 98, train_loss: 0.4241, test_loss: 1.5946, test_f1: 0.5771
 epoch: 99, train_loss: 0.4022, test_loss: 1.7843, test_f1: 0.5472

Training completed in 384.78 seconds
Best F1: 0.7058 at epoch 48
Mean F1 across iterations: 0.6653  0.0215
========================FINAL RESULTS================================
FEGIN weighted F1: 0.7058  0.0215
python main.py --data ltspice_demos --representation component_pin --model FEGIN --layers 3 --hiddens 64 --batch_size 256 --lr 0.01 --emb_size 250 --epochs 100 --save_appendix component_pin_L3_H64_BS256_LR0.01_E250 --no_val
-----



STDERR:
  File "main.py", line 370, in <module>
    main()
  File "main.py", line 254, in main
    dataset = dataset_class(
  File "/home/philip/projects/ltspice_examples_code_repo/Circuit-Completion-Using-GNNs/component_classification_with_link_prediction_head/evaluation/FEGIN/kernel/circuit_datasets.py", line 15, in __init__
    self.data, self.slices = torch.load(self.processed_paths[0])
  File "/home/philip/.local/lib/python3.8/site-packages/torch/serialization.py", line 1040, in load
    warnings.warn(
  File "/usr/lib/python3.8/warnings.py", line 109, in _showwarnmsg
    sw(msg.message, msg.category, msg.filename, msg.lineno,
  File "main.py", line 47, in warn_with_traceback
    traceback.print_stack(file=log)
/home/philip/projects/ltspice_examples_code_repo/Circuit-Completion-Using-GNNs/component_classification_with_link_prediction_head/evaluation/FEGIN/kernel/circuit_datasets.py:15: FutureWarning: You are using `torch.load` with `weights_only=False` (the current default value), which uses the default pickle module implicitly. It is possible to construct malicious pickle data which will execute arbitrary code during unpickling (See https://github.com/pytorch/pytorch/blob/main/SECURITY.md#untrusted-models for more details). In a future release, the default value for `weights_only` will be flipped to `True`. This limits the functions that could be executed during unpickling. Arbitrary objects will no longer be allowed to be loaded via this mode unless they are explicitly allowlisted by the user via `torch.serialization.add_safe_globals`. We recommend you start setting `weights_only=True` for any use case where you don't have full control of the loaded file. Please open an issue on GitHub for any issues related to this experimental feature.
  self.data, self.slices = torch.load(self.processed_paths[0])
