STDOUT:
Results will be saved in /home/philip/projects/ltspice_examples_code_repo/Circuit-Completion-Using-GNNs/component_classification_with_link_prediction_head/evaluation/FEGIN/results/model_FEGIN_dataset_ltspice_examples
Command line input: python main.py --data ltspice_examples --representation component_component --model FEGIN --layers 4 --hiddens 128 --batch_size 128 --lr 0.0001 --emb_size 128 --epochs 100 --save_appendix component_component_L4_H128_BS128_LR0.0001_E128 --no_val
 is saved.
-----
ltspice_examples - FEGIN
Using 4 layers, 128 hidden units, h = 2
Loading component_component representation dataset
ENTERED
Training FEGIN on component_component representation
Train: 3556, Test: 845
##################ITERATION #0 ****************************************
 epoch: 0, train_loss: 1.3581, test_loss: 1.3532, test_f1: 0.2274
 epoch: 1, train_loss: 1.3281, test_loss: 1.3258, test_f1: 0.2274
 epoch: 2, train_loss: 1.3014, test_loss: 1.2933, test_f1: 0.2555
 epoch: 3, train_loss: 1.2747, test_loss: 1.2562, test_f1: 0.2925
 epoch: 4, train_loss: 1.2468, test_loss: 1.2258, test_f1: 0.3042
 epoch: 5, train_loss: 1.2229, test_loss: 1.1965, test_f1: 0.3433
 epoch: 6, train_loss: 1.1992, test_loss: 1.1753, test_f1: 0.3567
 epoch: 7, train_loss: 1.1775, test_loss: 1.1534, test_f1: 0.3775
 epoch: 8, train_loss: 1.1590, test_loss: 1.1293, test_f1: 0.3604
 epoch: 9, train_loss: 1.1419, test_loss: 1.1138, test_f1: 0.4068
 epoch: 10, train_loss: 1.1266, test_loss: 1.0982, test_f1: 0.4171
 epoch: 11, train_loss: 1.1050, test_loss: 1.0882, test_f1: 0.4231
 epoch: 12, train_loss: 1.0867, test_loss: 1.0741, test_f1: 0.4360
 epoch: 13, train_loss: 1.0731, test_loss: 1.0573, test_f1: 0.4431
 epoch: 14, train_loss: 1.0584, test_loss: 1.0473, test_f1: 0.4517
 epoch: 15, train_loss: 1.0378, test_loss: 1.0514, test_f1: 0.4470
 epoch: 16, train_loss: 1.0182, test_loss: 1.0371, test_f1: 0.4525
 epoch: 17, train_loss: 1.0140, test_loss: 1.0329, test_f1: 0.4700
 epoch: 18, train_loss: 0.9981, test_loss: 1.0244, test_f1: 0.4560
 epoch: 19, train_loss: 0.9790, test_loss: 1.0273, test_f1: 0.4697
 epoch: 20, train_loss: 0.9668, test_loss: 1.0246, test_f1: 0.4662
 epoch: 21, train_loss: 0.9486, test_loss: 1.0069, test_f1: 0.4902
 epoch: 22, train_loss: 0.9265, test_loss: 1.0148, test_f1: 0.4752
 epoch: 23, train_loss: 0.9193, test_loss: 1.0642, test_f1: 0.5010
 epoch: 24, train_loss: 0.9085, test_loss: 1.0350, test_f1: 0.5030
 epoch: 25, train_loss: 0.8942, test_loss: 1.0247, test_f1: 0.4896
 epoch: 26, train_loss: 0.8858, test_loss: 1.0233, test_f1: 0.5002
 epoch: 27, train_loss: 0.8669, test_loss: 1.0335, test_f1: 0.4898
 epoch: 28, train_loss: 0.8652, test_loss: 1.0534, test_f1: 0.5000
 epoch: 29, train_loss: 0.8470, test_loss: 1.0986, test_f1: 0.5059
 epoch: 30, train_loss: 0.8293, test_loss: 1.0718, test_f1: 0.5034
 epoch: 31, train_loss: 0.8241, test_loss: 1.0730, test_f1: 0.4951
 epoch: 32, train_loss: 0.8113, test_loss: 1.0600, test_f1: 0.5057
 epoch: 33, train_loss: 0.8034, test_loss: 1.0820, test_f1: 0.5182
 epoch: 34, train_loss: 0.7939, test_loss: 1.0692, test_f1: 0.5185
 epoch: 35, train_loss: 0.7830, test_loss: 1.0791, test_f1: 0.5240
 epoch: 36, train_loss: 0.7766, test_loss: 1.0973, test_f1: 0.5296
 epoch: 37, train_loss: 0.7685, test_loss: 1.1112, test_f1: 0.5176
 epoch: 38, train_loss: 0.7509, test_loss: 1.1612, test_f1: 0.5190
 epoch: 39, train_loss: 0.7399, test_loss: 1.1789, test_f1: 0.4954
 epoch: 40, train_loss: 0.7365, test_loss: 1.1592, test_f1: 0.5218
 epoch: 41, train_loss: 0.7365, test_loss: 1.1557, test_f1: 0.5206
 epoch: 42, train_loss: 0.7356, test_loss: 1.1042, test_f1: 0.5437
 epoch: 43, train_loss: 0.7200, test_loss: 1.1380, test_f1: 0.5193
 epoch: 44, train_loss: 0.7040, test_loss: 1.2167, test_f1: 0.5296
 epoch: 45, train_loss: 0.6948, test_loss: 1.2396, test_f1: 0.5237
 epoch: 46, train_loss: 0.7065, test_loss: 1.1970, test_f1: 0.4906
 epoch: 47, train_loss: 0.6822, test_loss: 1.1998, test_f1: 0.5264
 epoch: 48, train_loss: 0.6700, test_loss: 1.1910, test_f1: 0.5153
 epoch: 49, train_loss: 0.6833, test_loss: 1.2188, test_f1: 0.5128
 epoch: 50, train_loss: 0.6567, test_loss: 1.2633, test_f1: 0.5113
 epoch: 51, train_loss: 0.6494, test_loss: 1.2134, test_f1: 0.5399
 epoch: 52, train_loss: 0.6287, test_loss: 1.2652, test_f1: 0.5089
 epoch: 53, train_loss: 0.6379, test_loss: 1.2169, test_f1: 0.5431
 epoch: 54, train_loss: 0.6353, test_loss: 1.1848, test_f1: 0.5407
 epoch: 55, train_loss: 0.6222, test_loss: 1.2788, test_f1: 0.5217
 epoch: 56, train_loss: 0.6286, test_loss: 1.2773, test_f1: 0.5233
 epoch: 57, train_loss: 0.6255, test_loss: 1.2767, test_f1: 0.5351
 epoch: 58, train_loss: 0.6202, test_loss: 1.3147, test_f1: 0.5168
 epoch: 59, train_loss: 0.5998, test_loss: 1.3248, test_f1: 0.5229
 epoch: 60, train_loss: 0.6228, test_loss: 1.2804, test_f1: 0.5437
 epoch: 61, train_loss: 0.6129, test_loss: 1.3650, test_f1: 0.5292
 epoch: 62, train_loss: 0.6075, test_loss: 1.3172, test_f1: 0.5324
 epoch: 63, train_loss: 0.6106, test_loss: 1.3562, test_f1: 0.5335
 epoch: 64, train_loss: 0.6034, test_loss: 1.4027, test_f1: 0.5230
 epoch: 65, train_loss: 0.6047, test_loss: 1.4077, test_f1: 0.5196
 epoch: 66, train_loss: 0.5998, test_loss: 1.3665, test_f1: 0.5374
 epoch: 67, train_loss: 0.5929, test_loss: 1.4348, test_f1: 0.5281
 epoch: 68, train_loss: 0.5940, test_loss: 1.3264, test_f1: 0.5288
 epoch: 69, train_loss: 0.5785, test_loss: 1.3718, test_f1: 0.5489
 epoch: 70, train_loss: 0.5809, test_loss: 1.3708, test_f1: 0.5398
 epoch: 71, train_loss: 0.5744, test_loss: 1.4036, test_f1: 0.5502
 epoch: 72, train_loss: 0.5844, test_loss: 1.3311, test_f1: 0.5311
 epoch: 73, train_loss: 0.5714, test_loss: 1.4051, test_f1: 0.5237
 epoch: 74, train_loss: 0.5715, test_loss: 1.4873, test_f1: 0.5357
 epoch: 75, train_loss: 0.5590, test_loss: 1.4535, test_f1: 0.5341
 epoch: 76, train_loss: 0.5558, test_loss: 1.5228, test_f1: 0.5427
 epoch: 77, train_loss: 0.5729, test_loss: 1.4538, test_f1: 0.5553
 epoch: 78, train_loss: 0.5802, test_loss: 1.4809, test_f1: 0.5484
 epoch: 79, train_loss: 0.5450, test_loss: 1.4112, test_f1: 0.5432
 epoch: 80, train_loss: 0.5503, test_loss: 1.4373, test_f1: 0.5479
 epoch: 81, train_loss: 0.5479, test_loss: 1.4392, test_f1: 0.5454
 epoch: 82, train_loss: 0.5544, test_loss: 1.5070, test_f1: 0.5388
 epoch: 83, train_loss: 0.5372, test_loss: 1.4598, test_f1: 0.5371
 epoch: 84, train_loss: 0.5474, test_loss: 1.5576, test_f1: 0.5428
 epoch: 85, train_loss: 0.5419, test_loss: 1.5328, test_f1: 0.5353
 epoch: 86, train_loss: 0.5327, test_loss: 1.5064, test_f1: 0.5290
 epoch: 87, train_loss: 0.5406, test_loss: 1.5419, test_f1: 0.5336
 epoch: 88, train_loss: 0.5414, test_loss: 1.4835, test_f1: 0.5372
 epoch: 89, train_loss: 0.5268, test_loss: 1.4332, test_f1: 0.5471
 epoch: 90, train_loss: 0.5199, test_loss: 1.4713, test_f1: 0.5389
 epoch: 91, train_loss: 0.5242, test_loss: 1.4908, test_f1: 0.5430
 epoch: 92, train_loss: 0.5154, test_loss: 1.5096, test_f1: 0.5425
 epoch: 93, train_loss: 0.5078, test_loss: 1.5203, test_f1: 0.5360
 epoch: 94, train_loss: 0.5288, test_loss: 1.5605, test_f1: 0.5346
 epoch: 95, train_loss: 0.5322, test_loss: 1.5762, test_f1: 0.5347
 epoch: 96, train_loss: 0.5102, test_loss: 1.5882, test_f1: 0.5414
 epoch: 97, train_loss: 0.5235, test_loss: 1.5556, test_f1: 0.5448
 epoch: 98, train_loss: 0.5117, test_loss: 1.5806, test_f1: 0.5412
 epoch: 99, train_loss: 0.5023, test_loss: 1.5524, test_f1: 0.5414
##################ITERATION #1 ****************************************
 epoch: 0, train_loss: 1.3096, test_loss: 1.3009, test_f1: 0.2274
 epoch: 1, train_loss: 1.2472, test_loss: 1.2438, test_f1: 0.2555
 epoch: 2, train_loss: 1.2160, test_loss: 1.2026, test_f1: 0.3384
 epoch: 3, train_loss: 1.1916, test_loss: 1.1814, test_f1: 0.4028
 epoch: 4, train_loss: 1.1687, test_loss: 1.2008, test_f1: 0.4091
 epoch: 5, train_loss: 1.1531, test_loss: 1.1768, test_f1: 0.4123
 epoch: 6, train_loss: 1.1277, test_loss: 1.1577, test_f1: 0.4317
 epoch: 7, train_loss: 1.1174, test_loss: 1.1455, test_f1: 0.4343
 epoch: 8, train_loss: 1.0998, test_loss: 1.1042, test_f1: 0.4387
 epoch: 9, train_loss: 1.0777, test_loss: 1.1465, test_f1: 0.4305
 epoch: 10, train_loss: 1.0580, test_loss: 1.0969, test_f1: 0.4505
 epoch: 11, train_loss: 1.0377, test_loss: 1.0758, test_f1: 0.4510
 epoch: 12, train_loss: 1.0150, test_loss: 1.0531, test_f1: 0.4526
 epoch: 13, train_loss: 1.0032, test_loss: 1.0364, test_f1: 0.4594
 epoch: 14, train_loss: 0.9823, test_loss: 1.0280, test_f1: 0.4568
 epoch: 15, train_loss: 0.9617, test_loss: 1.0233, test_f1: 0.4645
 epoch: 16, train_loss: 0.9508, test_loss: 1.0166, test_f1: 0.4675
 epoch: 17, train_loss: 0.9342, test_loss: 1.0535, test_f1: 0.4612
 epoch: 18, train_loss: 0.9185, test_loss: 1.0304, test_f1: 0.4575
 epoch: 19, train_loss: 0.8984, test_loss: 1.0185, test_f1: 0.4699
 epoch: 20, train_loss: 0.8936, test_loss: 1.0338, test_f1: 0.4576
 epoch: 21, train_loss: 0.8678, test_loss: 1.0467, test_f1: 0.4702
 epoch: 22, train_loss: 0.8598, test_loss: 1.0207, test_f1: 0.4785
 epoch: 23, train_loss: 0.8592, test_loss: 1.0062, test_f1: 0.4804
 epoch: 24, train_loss: 0.8463, test_loss: 1.0428, test_f1: 0.4803
 epoch: 25, train_loss: 0.8337, test_loss: 1.0466, test_f1: 0.4880
 epoch: 26, train_loss: 0.8110, test_loss: 1.0355, test_f1: 0.5037
 epoch: 27, train_loss: 0.7988, test_loss: 1.0061, test_f1: 0.4929
 epoch: 28, train_loss: 0.7902, test_loss: 1.0506, test_f1: 0.4770
 epoch: 29, train_loss: 0.7851, test_loss: 1.0390, test_f1: 0.4765
 epoch: 30, train_loss: 0.7915, test_loss: 1.0790, test_f1: 0.4849
 epoch: 31, train_loss: 0.7685, test_loss: 1.0264, test_f1: 0.5096
 epoch: 32, train_loss: 0.7598, test_loss: 1.0421, test_f1: 0.4989
 epoch: 33, train_loss: 0.7437, test_loss: 1.0877, test_f1: 0.4936
 epoch: 34, train_loss: 0.7416, test_loss: 1.0701, test_f1: 0.4924
 epoch: 35, train_loss: 0.7291, test_loss: 1.0690, test_f1: 0.4826
 epoch: 36, train_loss: 0.7178, test_loss: 1.1255, test_f1: 0.4886
 epoch: 37, train_loss: 0.7097, test_loss: 1.1258, test_f1: 0.4850
 epoch: 38, train_loss: 0.7051, test_loss: 1.1213, test_f1: 0.4867
 epoch: 39, train_loss: 0.6840, test_loss: 1.1227, test_f1: 0.4928
 epoch: 40, train_loss: 0.6827, test_loss: 1.1644, test_f1: 0.4851
 epoch: 41, train_loss: 0.6745, test_loss: 1.1726, test_f1: 0.4888
 epoch: 42, train_loss: 0.6774, test_loss: 1.1740, test_f1: 0.5109
 epoch: 43, train_loss: 0.6678, test_loss: 1.1817, test_f1: 0.4972
 epoch: 44, train_loss: 0.6560, test_loss: 1.1936, test_f1: 0.4913
 epoch: 45, train_loss: 0.6570, test_loss: 1.1618, test_f1: 0.5091
 epoch: 46, train_loss: 0.6515, test_loss: 1.2189, test_f1: 0.4860
 epoch: 47, train_loss: 0.6451, test_loss: 1.2913, test_f1: 0.5043
 epoch: 48, train_loss: 0.6373, test_loss: 1.2702, test_f1: 0.5025
 epoch: 49, train_loss: 0.6412, test_loss: 1.2222, test_f1: 0.5047
 epoch: 50, train_loss: 0.6229, test_loss: 1.2221, test_f1: 0.5002
 epoch: 51, train_loss: 0.5931, test_loss: 1.2854, test_f1: 0.4916
 epoch: 52, train_loss: 0.5904, test_loss: 1.2507, test_f1: 0.5028
 epoch: 53, train_loss: 0.5948, test_loss: 1.2720, test_f1: 0.5203
 epoch: 54, train_loss: 0.5772, test_loss: 1.2528, test_f1: 0.5271
 epoch: 55, train_loss: 0.5748, test_loss: 1.2971, test_f1: 0.5051
 epoch: 56, train_loss: 0.5918, test_loss: 1.3280, test_f1: 0.4977
 epoch: 57, train_loss: 0.5673, test_loss: 1.3667, test_f1: 0.4972
 epoch: 58, train_loss: 0.5766, test_loss: 1.3173, test_f1: 0.4963
 epoch: 59, train_loss: 0.5755, test_loss: 1.3597, test_f1: 0.5052
 epoch: 60, train_loss: 0.5704, test_loss: 1.3560, test_f1: 0.5001
 epoch: 61, train_loss: 0.5577, test_loss: 1.3368, test_f1: 0.5065
 epoch: 62, train_loss: 0.5773, test_loss: 1.3665, test_f1: 0.4887
 epoch: 63, train_loss: 0.5609, test_loss: 1.3564, test_f1: 0.4972
 epoch: 64, train_loss: 0.5472, test_loss: 1.3374, test_f1: 0.5239
 epoch: 65, train_loss: 0.5492, test_loss: 1.4198, test_f1: 0.4935
 epoch: 66, train_loss: 0.5450, test_loss: 1.4147, test_f1: 0.5026
 epoch: 67, train_loss: 0.5407, test_loss: 1.3986, test_f1: 0.5040
 epoch: 68, train_loss: 0.5493, test_loss: 1.4157, test_f1: 0.5045
 epoch: 69, train_loss: 0.5416, test_loss: 1.4508, test_f1: 0.5057
 epoch: 70, train_loss: 0.5210, test_loss: 1.4094, test_f1: 0.5149
 epoch: 71, train_loss: 0.5389, test_loss: 1.4055, test_f1: 0.5203
 epoch: 72, train_loss: 0.5246, test_loss: 1.4203, test_f1: 0.5149
 epoch: 73, train_loss: 0.5344, test_loss: 1.4163, test_f1: 0.5087
 epoch: 74, train_loss: 0.5246, test_loss: 1.4348, test_f1: 0.5057
 epoch: 75, train_loss: 0.5204, test_loss: 1.4529, test_f1: 0.5074
 epoch: 76, train_loss: 0.5156, test_loss: 1.4223, test_f1: 0.5049
 epoch: 77, train_loss: 0.5249, test_loss: 1.4463, test_f1: 0.5057
 epoch: 78, train_loss: 0.5043, test_loss: 1.4274, test_f1: 0.5218
 epoch: 79, train_loss: 0.5104, test_loss: 1.4945, test_f1: 0.5069
 epoch: 80, train_loss: 0.5099, test_loss: 1.5176, test_f1: 0.5075
 epoch: 81, train_loss: 0.4993, test_loss: 1.4665, test_f1: 0.5096
 epoch: 82, train_loss: 0.4996, test_loss: 1.5745, test_f1: 0.5182
 epoch: 83, train_loss: 0.4984, test_loss: 1.5243, test_f1: 0.5148
 epoch: 84, train_loss: 0.5014, test_loss: 1.4904, test_f1: 0.5188
 epoch: 85, train_loss: 0.4900, test_loss: 1.5484, test_f1: 0.5122
 epoch: 86, train_loss: 0.4937, test_loss: 1.5432, test_f1: 0.5130
 epoch: 87, train_loss: 0.4860, test_loss: 1.5322, test_f1: 0.5070
 epoch: 88, train_loss: 0.5040, test_loss: 1.5670, test_f1: 0.5118
 epoch: 89, train_loss: 0.4894, test_loss: 1.5554, test_f1: 0.5102
 epoch: 90, train_loss: 0.4875, test_loss: 1.4548, test_f1: 0.5344
 epoch: 91, train_loss: 0.4853, test_loss: 1.5128, test_f1: 0.5257
 epoch: 92, train_loss: 0.4835, test_loss: 1.4983, test_f1: 0.5154
 epoch: 93, train_loss: 0.4685, test_loss: 1.5315, test_f1: 0.5120
 epoch: 94, train_loss: 0.4680, test_loss: 1.5241, test_f1: 0.5126
 epoch: 95, train_loss: 0.4658, test_loss: 1.5398, test_f1: 0.5144
 epoch: 96, train_loss: 0.4838, test_loss: 1.5840, test_f1: 0.4993
 epoch: 97, train_loss: 0.4729, test_loss: 1.5100, test_f1: 0.4954
 epoch: 98, train_loss: 0.4839, test_loss: 1.5973, test_f1: 0.5122
 epoch: 99, train_loss: 0.4610, test_loss: 1.5548, test_f1: 0.5104
##################ITERATION #2 ****************************************
 epoch: 0, train_loss: 1.3074, test_loss: 1.2794, test_f1: 0.2555
 epoch: 1, train_loss: 1.2150, test_loss: 1.2081, test_f1: 0.2960
 epoch: 2, train_loss: 1.1846, test_loss: 1.1529, test_f1: 0.4390
 epoch: 3, train_loss: 1.1640, test_loss: 1.1257, test_f1: 0.4423
 epoch: 4, train_loss: 1.1357, test_loss: 1.1082, test_f1: 0.4429
 epoch: 5, train_loss: 1.1237, test_loss: 1.0968, test_f1: 0.4395
 epoch: 6, train_loss: 1.1022, test_loss: 1.0811, test_f1: 0.4552
 epoch: 7, train_loss: 1.0842, test_loss: 1.0661, test_f1: 0.4630
 epoch: 8, train_loss: 1.0733, test_loss: 1.0597, test_f1: 0.4286
 epoch: 9, train_loss: 1.0623, test_loss: 1.0458, test_f1: 0.4541
 epoch: 10, train_loss: 1.0433, test_loss: 1.0337, test_f1: 0.4530
 epoch: 11, train_loss: 1.0328, test_loss: 1.0131, test_f1: 0.4630
 epoch: 12, train_loss: 1.0157, test_loss: 1.0177, test_f1: 0.4760
 epoch: 13, train_loss: 1.0046, test_loss: 1.0108, test_f1: 0.4733
 epoch: 14, train_loss: 0.9854, test_loss: 1.0112, test_f1: 0.4739
 epoch: 15, train_loss: 0.9734, test_loss: 0.9860, test_f1: 0.4807
 epoch: 16, train_loss: 0.9625, test_loss: 0.9895, test_f1: 0.4880
 epoch: 17, train_loss: 0.9624, test_loss: 0.9848, test_f1: 0.5040
 epoch: 18, train_loss: 0.9417, test_loss: 0.9883, test_f1: 0.5036
 epoch: 19, train_loss: 0.9283, test_loss: 0.9786, test_f1: 0.5036
 epoch: 20, train_loss: 0.9234, test_loss: 0.9809, test_f1: 0.5306
 epoch: 21, train_loss: 0.9044, test_loss: 0.9549, test_f1: 0.5342
 epoch: 22, train_loss: 0.8913, test_loss: 1.0084, test_f1: 0.5011
 epoch: 23, train_loss: 0.8791, test_loss: 0.9726, test_f1: 0.5162
 epoch: 24, train_loss: 0.8794, test_loss: 1.0013, test_f1: 0.4930
 epoch: 25, train_loss: 0.8680, test_loss: 0.9659, test_f1: 0.5407
 epoch: 26, train_loss: 0.8526, test_loss: 1.0234, test_f1: 0.5201
 epoch: 27, train_loss: 0.8433, test_loss: 0.9768, test_f1: 0.5055
 epoch: 28, train_loss: 0.8278, test_loss: 0.9775, test_f1: 0.5266
 epoch: 29, train_loss: 0.8299, test_loss: 0.9760, test_f1: 0.5360
 epoch: 30, train_loss: 0.8164, test_loss: 0.9782, test_f1: 0.5219
 epoch: 31, train_loss: 0.8009, test_loss: 1.0119, test_f1: 0.5265
 epoch: 32, train_loss: 0.8026, test_loss: 1.0240, test_f1: 0.5268
 epoch: 33, train_loss: 0.7928, test_loss: 1.0071, test_f1: 0.5137
 epoch: 34, train_loss: 0.7695, test_loss: 1.0682, test_f1: 0.5122
 epoch: 35, train_loss: 0.7556, test_loss: 1.0151, test_f1: 0.5229
 epoch: 36, train_loss: 0.7568, test_loss: 1.0202, test_f1: 0.5374
 epoch: 37, train_loss: 0.7422, test_loss: 1.0613, test_f1: 0.5366
 epoch: 38, train_loss: 0.7352, test_loss: 1.0762, test_f1: 0.5508
 epoch: 39, train_loss: 0.7312, test_loss: 1.0403, test_f1: 0.5311
 epoch: 40, train_loss: 0.7193, test_loss: 1.0116, test_f1: 0.5264
 epoch: 41, train_loss: 0.7187, test_loss: 1.0617, test_f1: 0.5505
 epoch: 42, train_loss: 0.7143, test_loss: 1.1031, test_f1: 0.5182
 epoch: 43, train_loss: 0.6939, test_loss: 1.1069, test_f1: 0.5502
 epoch: 44, train_loss: 0.6977, test_loss: 1.0810, test_f1: 0.5444
 epoch: 45, train_loss: 0.6914, test_loss: 1.0842, test_f1: 0.5285
 epoch: 46, train_loss: 0.6787, test_loss: 1.0989, test_f1: 0.5372
 epoch: 47, train_loss: 0.6681, test_loss: 1.1407, test_f1: 0.5249
 epoch: 48, train_loss: 0.6680, test_loss: 1.1162, test_f1: 0.5409
 epoch: 49, train_loss: 0.6597, test_loss: 1.1124, test_f1: 0.5283
 epoch: 50, train_loss: 0.6574, test_loss: 1.1929, test_f1: 0.5142
 epoch: 51, train_loss: 0.6358, test_loss: 1.1311, test_f1: 0.5307
 epoch: 52, train_loss: 0.6265, test_loss: 1.1862, test_f1: 0.5114
 epoch: 53, train_loss: 0.6199, test_loss: 1.1684, test_f1: 0.5176
 epoch: 54, train_loss: 0.6051, test_loss: 1.1849, test_f1: 0.5224
 epoch: 55, train_loss: 0.6148, test_loss: 1.1881, test_f1: 0.5364
 epoch: 56, train_loss: 0.5924, test_loss: 1.1790, test_f1: 0.5289
 epoch: 57, train_loss: 0.5869, test_loss: 1.1872, test_f1: 0.5443
 epoch: 58, train_loss: 0.5899, test_loss: 1.1825, test_f1: 0.5374
 epoch: 59, train_loss: 0.5888, test_loss: 1.2080, test_f1: 0.5155
 epoch: 60, train_loss: 0.5838, test_loss: 1.2062, test_f1: 0.5307
 epoch: 61, train_loss: 0.5852, test_loss: 1.2182, test_f1: 0.5393
 epoch: 62, train_loss: 0.5736, test_loss: 1.2314, test_f1: 0.5352
 epoch: 63, train_loss: 0.5775, test_loss: 1.2077, test_f1: 0.5369
 epoch: 64, train_loss: 0.5629, test_loss: 1.2721, test_f1: 0.5226
 epoch: 65, train_loss: 0.5681, test_loss: 1.2612, test_f1: 0.5317
 epoch: 66, train_loss: 0.5519, test_loss: 1.2724, test_f1: 0.5061
 epoch: 67, train_loss: 0.5633, test_loss: 1.2472, test_f1: 0.5277
 epoch: 68, train_loss: 0.5692, test_loss: 1.2832, test_f1: 0.5049
 epoch: 69, train_loss: 0.5521, test_loss: 1.2701, test_f1: 0.5333
 epoch: 70, train_loss: 0.5611, test_loss: 1.2869, test_f1: 0.5124
 epoch: 71, train_loss: 0.5507, test_loss: 1.2955, test_f1: 0.5162
 epoch: 72, train_loss: 0.5744, test_loss: 1.2815, test_f1: 0.5222
 epoch: 73, train_loss: 0.5443, test_loss: 1.3600, test_f1: 0.5045
 epoch: 74, train_loss: 0.5260, test_loss: 1.2676, test_f1: 0.5310
 epoch: 75, train_loss: 0.5482, test_loss: 1.2753, test_f1: 0.5347
 epoch: 76, train_loss: 0.5234, test_loss: 1.2982, test_f1: 0.5429
 epoch: 77, train_loss: 0.5533, test_loss: 1.3199, test_f1: 0.5274
 epoch: 78, train_loss: 0.5258, test_loss: 1.3437, test_f1: 0.5061
 epoch: 79, train_loss: 0.5223, test_loss: 1.3161, test_f1: 0.5275
 epoch: 80, train_loss: 0.5277, test_loss: 1.3340, test_f1: 0.5279
 epoch: 81, train_loss: 0.5305, test_loss: 1.2939, test_f1: 0.5357
 epoch: 82, train_loss: 0.5194, test_loss: 1.3537, test_f1: 0.5248
 epoch: 83, train_loss: 0.5232, test_loss: 1.3307, test_f1: 0.5286
 epoch: 84, train_loss: 0.5291, test_loss: 1.3362, test_f1: 0.5426
 epoch: 85, train_loss: 0.5036, test_loss: 1.3389, test_f1: 0.5339
 epoch: 86, train_loss: 0.5147, test_loss: 1.3898, test_f1: 0.5445
 epoch: 87, train_loss: 0.5129, test_loss: 1.3706, test_f1: 0.5416
 epoch: 88, train_loss: 0.5093, test_loss: 1.3676, test_f1: 0.5396
 epoch: 89, train_loss: 0.5081, test_loss: 1.3686, test_f1: 0.5268
 epoch: 90, train_loss: 0.5068, test_loss: 1.3995, test_f1: 0.5476
 epoch: 91, train_loss: 0.4798, test_loss: 1.4327, test_f1: 0.5195
 epoch: 92, train_loss: 0.4875, test_loss: 1.4015, test_f1: 0.5433
 epoch: 93, train_loss: 0.4907, test_loss: 1.3732, test_f1: 0.5294
 epoch: 94, train_loss: 0.4815, test_loss: 1.4452, test_f1: 0.5302
 epoch: 95, train_loss: 0.4947, test_loss: 1.3924, test_f1: 0.5273
 epoch: 96, train_loss: 0.4687, test_loss: 1.4574, test_f1: 0.5192
 epoch: 97, train_loss: 0.4820, test_loss: 1.4155, test_f1: 0.5398
 epoch: 98, train_loss: 0.4697, test_loss: 1.4564, test_f1: 0.5274
 epoch: 99, train_loss: 0.4740, test_loss: 1.5024, test_f1: 0.5197
##################ITERATION #3 ****************************************
 epoch: 0, train_loss: 1.2788, test_loss: 1.2669, test_f1: 0.3118
 epoch: 1, train_loss: 1.2014, test_loss: 1.1888, test_f1: 0.4421
 epoch: 2, train_loss: 1.1679, test_loss: 1.1419, test_f1: 0.4135
 epoch: 3, train_loss: 1.1538, test_loss: 1.1162, test_f1: 0.4389
 epoch: 4, train_loss: 1.1324, test_loss: 1.0986, test_f1: 0.4527
 epoch: 5, train_loss: 1.1110, test_loss: 1.0876, test_f1: 0.4541
 epoch: 6, train_loss: 1.0989, test_loss: 1.0783, test_f1: 0.4428
 epoch: 7, train_loss: 1.0835, test_loss: 1.0821, test_f1: 0.4387
 epoch: 8, train_loss: 1.0709, test_loss: 1.0627, test_f1: 0.4378
 epoch: 9, train_loss: 1.0482, test_loss: 1.0571, test_f1: 0.4595
 epoch: 10, train_loss: 1.0422, test_loss: 1.0479, test_f1: 0.4605
 epoch: 11, train_loss: 1.0314, test_loss: 1.0343, test_f1: 0.4764
 epoch: 12, train_loss: 1.0110, test_loss: 1.0390, test_f1: 0.4466
 epoch: 13, train_loss: 1.0052, test_loss: 1.0277, test_f1: 0.4649
 epoch: 14, train_loss: 0.9960, test_loss: 1.0207, test_f1: 0.4683
 epoch: 15, train_loss: 0.9885, test_loss: 1.0370, test_f1: 0.4508
 epoch: 16, train_loss: 0.9746, test_loss: 1.0215, test_f1: 0.4476
 epoch: 17, train_loss: 0.9579, test_loss: 1.0036, test_f1: 0.4806
 epoch: 18, train_loss: 0.9419, test_loss: 1.0244, test_f1: 0.4705
 epoch: 19, train_loss: 0.9383, test_loss: 1.0184, test_f1: 0.4778
 epoch: 20, train_loss: 0.9237, test_loss: 1.0135, test_f1: 0.4621
 epoch: 21, train_loss: 0.9115, test_loss: 1.0198, test_f1: 0.4800
 epoch: 22, train_loss: 0.9036, test_loss: 0.9948, test_f1: 0.5000
 epoch: 23, train_loss: 0.8927, test_loss: 0.9998, test_f1: 0.4989
 epoch: 24, train_loss: 0.8752, test_loss: 0.9981, test_f1: 0.4909
 epoch: 25, train_loss: 0.8524, test_loss: 1.0022, test_f1: 0.5062
 epoch: 26, train_loss: 0.8564, test_loss: 1.0245, test_f1: 0.5126
 epoch: 27, train_loss: 0.8440, test_loss: 0.9993, test_f1: 0.5189
 epoch: 28, train_loss: 0.8410, test_loss: 1.0211, test_f1: 0.5078
 epoch: 29, train_loss: 0.8239, test_loss: 1.0191, test_f1: 0.5113
 epoch: 30, train_loss: 0.8057, test_loss: 0.9947, test_f1: 0.5175
 epoch: 31, train_loss: 0.8084, test_loss: 1.0090, test_f1: 0.5116
 epoch: 32, train_loss: 0.7884, test_loss: 1.0384, test_f1: 0.5029
 epoch: 33, train_loss: 0.7810, test_loss: 1.0414, test_f1: 0.4971
 epoch: 34, train_loss: 0.7831, test_loss: 1.0544, test_f1: 0.5074
 epoch: 35, train_loss: 0.7748, test_loss: 1.0426, test_f1: 0.5154
 epoch: 36, train_loss: 0.7702, test_loss: 1.0391, test_f1: 0.5275
 epoch: 37, train_loss: 0.7561, test_loss: 1.0410, test_f1: 0.5027
 epoch: 38, train_loss: 0.7514, test_loss: 1.0659, test_f1: 0.5052
 epoch: 39, train_loss: 0.7306, test_loss: 1.1001, test_f1: 0.4989
 epoch: 40, train_loss: 0.7274, test_loss: 1.0421, test_f1: 0.5183
 epoch: 41, train_loss: 0.7204, test_loss: 1.0797, test_f1: 0.5222
 epoch: 42, train_loss: 0.7034, test_loss: 1.0823, test_f1: 0.5250
 epoch: 43, train_loss: 0.6887, test_loss: 1.1184, test_f1: 0.5241
 epoch: 44, train_loss: 0.6883, test_loss: 1.1515, test_f1: 0.5202
 epoch: 45, train_loss: 0.6889, test_loss: 1.1137, test_f1: 0.5245
 epoch: 46, train_loss: 0.6785, test_loss: 1.1443, test_f1: 0.5217
 epoch: 47, train_loss: 0.6573, test_loss: 1.1451, test_f1: 0.5221
 epoch: 48, train_loss: 0.6558, test_loss: 1.1102, test_f1: 0.5463
 epoch: 49, train_loss: 0.6510, test_loss: 1.1628, test_f1: 0.5298
 epoch: 50, train_loss: 0.6548, test_loss: 1.1079, test_f1: 0.5354
 epoch: 51, train_loss: 0.6354, test_loss: 1.1739, test_f1: 0.5218
 epoch: 52, train_loss: 0.6266, test_loss: 1.1471, test_f1: 0.5487
 epoch: 53, train_loss: 0.6167, test_loss: 1.1497, test_f1: 0.5245
 epoch: 54, train_loss: 0.6179, test_loss: 1.1150, test_f1: 0.5447
 epoch: 55, train_loss: 0.6011, test_loss: 1.1746, test_f1: 0.5477
 epoch: 56, train_loss: 0.5966, test_loss: 1.1513, test_f1: 0.5514
 epoch: 57, train_loss: 0.6037, test_loss: 1.1966, test_f1: 0.5461
 epoch: 58, train_loss: 0.6076, test_loss: 1.2133, test_f1: 0.5495
 epoch: 59, train_loss: 0.6003, test_loss: 1.1902, test_f1: 0.5414
 epoch: 60, train_loss: 0.5954, test_loss: 1.2191, test_f1: 0.5443
 epoch: 61, train_loss: 0.5733, test_loss: 1.1973, test_f1: 0.5492
 epoch: 62, train_loss: 0.5785, test_loss: 1.2136, test_f1: 0.5439
 epoch: 63, train_loss: 0.5795, test_loss: 1.1903, test_f1: 0.5599
 epoch: 64, train_loss: 0.5927, test_loss: 1.2225, test_f1: 0.5352
 epoch: 65, train_loss: 0.5823, test_loss: 1.2342, test_f1: 0.5415
 epoch: 66, train_loss: 0.5844, test_loss: 1.2068, test_f1: 0.5565
 epoch: 67, train_loss: 0.5692, test_loss: 1.2225, test_f1: 0.5531
 epoch: 68, train_loss: 0.5661, test_loss: 1.2510, test_f1: 0.5420
 epoch: 69, train_loss: 0.5512, test_loss: 1.2406, test_f1: 0.5462
 epoch: 70, train_loss: 0.5589, test_loss: 1.2211, test_f1: 0.5403
 epoch: 71, train_loss: 0.5574, test_loss: 1.2038, test_f1: 0.5663
 epoch: 72, train_loss: 0.5626, test_loss: 1.2746, test_f1: 0.5479
 epoch: 73, train_loss: 0.5585, test_loss: 1.2353, test_f1: 0.5516
 epoch: 74, train_loss: 0.5462, test_loss: 1.2774, test_f1: 0.5392
 epoch: 75, train_loss: 0.5406, test_loss: 1.2640, test_f1: 0.5594
 epoch: 76, train_loss: 0.5507, test_loss: 1.2996, test_f1: 0.5435
 epoch: 77, train_loss: 0.5348, test_loss: 1.2447, test_f1: 0.5667
 epoch: 78, train_loss: 0.5518, test_loss: 1.2685, test_f1: 0.5582
 epoch: 79, train_loss: 0.5366, test_loss: 1.2532, test_f1: 0.5589
 epoch: 80, train_loss: 0.5384, test_loss: 1.3145, test_f1: 0.5273
 epoch: 81, train_loss: 0.5334, test_loss: 1.3269, test_f1: 0.5350
 epoch: 82, train_loss: 0.5273, test_loss: 1.2976, test_f1: 0.5457
 epoch: 83, train_loss: 0.5167, test_loss: 1.3108, test_f1: 0.5338
 epoch: 84, train_loss: 0.5092, test_loss: 1.3182, test_f1: 0.5415
 epoch: 85, train_loss: 0.5122, test_loss: 1.3042, test_f1: 0.5518
 epoch: 86, train_loss: 0.5097, test_loss: 1.3579, test_f1: 0.5392
 epoch: 87, train_loss: 0.5179, test_loss: 1.3530, test_f1: 0.5388
 epoch: 88, train_loss: 0.5169, test_loss: 1.3361, test_f1: 0.5404
 epoch: 89, train_loss: 0.5148, test_loss: 1.3732, test_f1: 0.5420
 epoch: 90, train_loss: 0.5067, test_loss: 1.3925, test_f1: 0.5362
 epoch: 91, train_loss: 0.4959, test_loss: 1.3757, test_f1: 0.5360
 epoch: 92, train_loss: 0.5101, test_loss: 1.3532, test_f1: 0.5447
 epoch: 93, train_loss: 0.5019, test_loss: 1.3661, test_f1: 0.5389
 epoch: 94, train_loss: 0.5060, test_loss: 1.3627, test_f1: 0.5456
 epoch: 95, train_loss: 0.4956, test_loss: 1.3921, test_f1: 0.5397
 epoch: 96, train_loss: 0.4942, test_loss: 1.3588, test_f1: 0.5510
 epoch: 97, train_loss: 0.4865, test_loss: 1.4168, test_f1: 0.5440
 epoch: 98, train_loss: 0.4806, test_loss: 1.4624, test_f1: 0.5392
 epoch: 99, train_loss: 0.4741, test_loss: 1.4141, test_f1: 0.5462
##################ITERATION #4 ****************************************
 epoch: 0, train_loss: 1.2896, test_loss: 1.2367, test_f1: 0.2559
 epoch: 1, train_loss: 1.2117, test_loss: 1.1821, test_f1: 0.3322
 epoch: 2, train_loss: 1.1848, test_loss: 1.1487, test_f1: 0.4584
 epoch: 3, train_loss: 1.1581, test_loss: 1.1256, test_f1: 0.4593
 epoch: 4, train_loss: 1.1403, test_loss: 1.1036, test_f1: 0.4587
 epoch: 5, train_loss: 1.1278, test_loss: 1.0813, test_f1: 0.4607
 epoch: 6, train_loss: 1.1059, test_loss: 1.0662, test_f1: 0.4930
 epoch: 7, train_loss: 1.0880, test_loss: 1.0488, test_f1: 0.4682
 epoch: 8, train_loss: 1.0821, test_loss: 1.0365, test_f1: 0.4913
 epoch: 9, train_loss: 1.0595, test_loss: 1.0307, test_f1: 0.4787
 epoch: 10, train_loss: 1.0483, test_loss: 1.0085, test_f1: 0.4949
 epoch: 11, train_loss: 1.0383, test_loss: 1.0053, test_f1: 0.4892
 epoch: 12, train_loss: 1.0242, test_loss: 0.9905, test_f1: 0.4860
 epoch: 13, train_loss: 1.0090, test_loss: 0.9836, test_f1: 0.4882
 epoch: 14, train_loss: 0.9983, test_loss: 0.9866, test_f1: 0.4839
 epoch: 15, train_loss: 0.9979, test_loss: 0.9649, test_f1: 0.5076
 epoch: 16, train_loss: 0.9824, test_loss: 0.9712, test_f1: 0.5075
 epoch: 17, train_loss: 0.9603, test_loss: 0.9531, test_f1: 0.5106
 epoch: 18, train_loss: 0.9573, test_loss: 0.9565, test_f1: 0.5335
 epoch: 19, train_loss: 0.9467, test_loss: 0.9656, test_f1: 0.5023
 epoch: 20, train_loss: 0.9330, test_loss: 0.9536, test_f1: 0.5441
 epoch: 21, train_loss: 0.9271, test_loss: 0.9490, test_f1: 0.5360
 epoch: 22, train_loss: 0.9135, test_loss: 0.9463, test_f1: 0.5134
 epoch: 23, train_loss: 0.9081, test_loss: 0.9504, test_f1: 0.5113
 epoch: 24, train_loss: 0.9014, test_loss: 0.9358, test_f1: 0.5407
 epoch: 25, train_loss: 0.8913, test_loss: 0.9411, test_f1: 0.5293
 epoch: 26, train_loss: 0.8756, test_loss: 0.9474, test_f1: 0.5122
 epoch: 27, train_loss: 0.8607, test_loss: 0.9624, test_f1: 0.5230
 epoch: 28, train_loss: 0.8519, test_loss: 0.9446, test_f1: 0.5249
 epoch: 29, train_loss: 0.8412, test_loss: 0.9618, test_f1: 0.5101
 epoch: 30, train_loss: 0.8300, test_loss: 0.9580, test_f1: 0.5240
 epoch: 31, train_loss: 0.8325, test_loss: 0.9652, test_f1: 0.5318
 epoch: 32, train_loss: 0.8219, test_loss: 0.9469, test_f1: 0.5506
 epoch: 33, train_loss: 0.8186, test_loss: 0.9722, test_f1: 0.5110
 epoch: 34, train_loss: 0.8008, test_loss: 0.9678, test_f1: 0.5201
 epoch: 35, train_loss: 0.8018, test_loss: 0.9773, test_f1: 0.5395
 epoch: 36, train_loss: 0.7926, test_loss: 0.9854, test_f1: 0.5466
 epoch: 37, train_loss: 0.7682, test_loss: 0.9836, test_f1: 0.5159
 epoch: 38, train_loss: 0.7642, test_loss: 1.0158, test_f1: 0.5475
 epoch: 39, train_loss: 0.7543, test_loss: 1.0132, test_f1: 0.5392
 epoch: 40, train_loss: 0.7418, test_loss: 1.0090, test_f1: 0.5466
 epoch: 41, train_loss: 0.7480, test_loss: 1.0179, test_f1: 0.5408
 epoch: 42, train_loss: 0.7228, test_loss: 1.0112, test_f1: 0.5382
 epoch: 43, train_loss: 0.7235, test_loss: 1.0398, test_f1: 0.5289
 epoch: 44, train_loss: 0.7448, test_loss: 1.0767, test_f1: 0.5146
 epoch: 45, train_loss: 0.7253, test_loss: 1.0476, test_f1: 0.5646
 epoch: 46, train_loss: 0.7166, test_loss: 1.0563, test_f1: 0.5252
 epoch: 47, train_loss: 0.7139, test_loss: 1.0598, test_f1: 0.5362
 epoch: 48, train_loss: 0.7013, test_loss: 1.1070, test_f1: 0.5448
 epoch: 49, train_loss: 0.6868, test_loss: 1.0734, test_f1: 0.5439
 epoch: 50, train_loss: 0.6868, test_loss: 1.0869, test_f1: 0.5389
 epoch: 51, train_loss: 0.6749, test_loss: 1.0808, test_f1: 0.5492
 epoch: 52, train_loss: 0.6588, test_loss: 1.0887, test_f1: 0.5444
 epoch: 53, train_loss: 0.6512, test_loss: 1.0926, test_f1: 0.5344
 epoch: 54, train_loss: 0.6456, test_loss: 1.0965, test_f1: 0.5538
 epoch: 55, train_loss: 0.6487, test_loss: 1.0933, test_f1: 0.5457
 epoch: 56, train_loss: 0.6440, test_loss: 1.1534, test_f1: 0.5469
 epoch: 57, train_loss: 0.6447, test_loss: 1.1090, test_f1: 0.5565
 epoch: 58, train_loss: 0.6502, test_loss: 1.1321, test_f1: 0.5474
 epoch: 59, train_loss: 0.6459, test_loss: 1.1321, test_f1: 0.5343
 epoch: 60, train_loss: 0.6276, test_loss: 1.1049, test_f1: 0.5459
 epoch: 61, train_loss: 0.6406, test_loss: 1.1091, test_f1: 0.5738
 epoch: 62, train_loss: 0.6240, test_loss: 1.1335, test_f1: 0.5424
 epoch: 63, train_loss: 0.6204, test_loss: 1.1305, test_f1: 0.5445
 epoch: 64, train_loss: 0.6233, test_loss: 1.1285, test_f1: 0.5481
 epoch: 65, train_loss: 0.6170, test_loss: 1.1467, test_f1: 0.5449
 epoch: 66, train_loss: 0.6296, test_loss: 1.1489, test_f1: 0.5536
 epoch: 67, train_loss: 0.6016, test_loss: 1.1654, test_f1: 0.5503
 epoch: 68, train_loss: 0.6080, test_loss: 1.1865, test_f1: 0.5430
 epoch: 69, train_loss: 0.6075, test_loss: 1.2222, test_f1: 0.5247
 epoch: 70, train_loss: 0.6057, test_loss: 1.1974, test_f1: 0.5335
 epoch: 71, train_loss: 0.6027, test_loss: 1.1932, test_f1: 0.5404
 epoch: 72, train_loss: 0.5917, test_loss: 1.1902, test_f1: 0.5506
 epoch: 73, train_loss: 0.5994, test_loss: 1.2150, test_f1: 0.5285
 epoch: 74, train_loss: 0.5960, test_loss: 1.2303, test_f1: 0.5361
 epoch: 75, train_loss: 0.6004, test_loss: 1.1722, test_f1: 0.5646
 epoch: 76, train_loss: 0.5670, test_loss: 1.2215, test_f1: 0.5460
 epoch: 77, train_loss: 0.5874, test_loss: 1.2448, test_f1: 0.5408
 epoch: 78, train_loss: 0.5807, test_loss: 1.1843, test_f1: 0.5377
 epoch: 79, train_loss: 0.5851, test_loss: 1.2705, test_f1: 0.5423
 epoch: 80, train_loss: 0.5688, test_loss: 1.2254, test_f1: 0.5526
 epoch: 81, train_loss: 0.5858, test_loss: 1.2481, test_f1: 0.5545
 epoch: 82, train_loss: 0.5597, test_loss: 1.2740, test_f1: 0.5415
 epoch: 83, train_loss: 0.5801, test_loss: 1.2653, test_f1: 0.5542
 epoch: 84, train_loss: 0.5727, test_loss: 1.2354, test_f1: 0.5408
 epoch: 85, train_loss: 0.5566, test_loss: 1.2722, test_f1: 0.5425
 epoch: 86, train_loss: 0.5452, test_loss: 1.2778, test_f1: 0.5320
 epoch: 87, train_loss: 0.5658, test_loss: 1.3054, test_f1: 0.5327
 epoch: 88, train_loss: 0.5521, test_loss: 1.3169, test_f1: 0.5382
 epoch: 89, train_loss: 0.5564, test_loss: 1.2918, test_f1: 0.5518
 epoch: 90, train_loss: 0.5598, test_loss: 1.3263, test_f1: 0.5242
 epoch: 91, train_loss: 0.5348, test_loss: 1.2729, test_f1: 0.5378
 epoch: 92, train_loss: 0.5480, test_loss: 1.3043, test_f1: 0.5465
 epoch: 93, train_loss: 0.5457, test_loss: 1.3158, test_f1: 0.5503
 epoch: 94, train_loss: 0.5296, test_loss: 1.3314, test_f1: 0.5360
 epoch: 95, train_loss: 0.5302, test_loss: 1.3890, test_f1: 0.5253
 epoch: 96, train_loss: 0.5355, test_loss: 1.3072, test_f1: 0.5382
 epoch: 97, train_loss: 0.5332, test_loss: 1.3655, test_f1: 0.5453
 epoch: 98, train_loss: 0.5313, test_loss: 1.3120, test_f1: 0.5340
 epoch: 99, train_loss: 0.5328, test_loss: 1.3302, test_f1: 0.5444
##################ITERATION #5 ****************************************
 epoch: 0, train_loss: 1.3373, test_loss: 1.2657, test_f1: 0.2743
 epoch: 1, train_loss: 1.2195, test_loss: 1.1840, test_f1: 0.4249
 epoch: 2, train_loss: 1.1816, test_loss: 1.1450, test_f1: 0.4566
 epoch: 3, train_loss: 1.1602, test_loss: 1.1173, test_f1: 0.4567
 epoch: 4, train_loss: 1.1306, test_loss: 1.0985, test_f1: 0.4635
 epoch: 5, train_loss: 1.1154, test_loss: 1.0950, test_f1: 0.4779
 epoch: 6, train_loss: 1.0946, test_loss: 1.0772, test_f1: 0.4666
 epoch: 7, train_loss: 1.0854, test_loss: 1.0646, test_f1: 0.4716
 epoch: 8, train_loss: 1.0698, test_loss: 1.0466, test_f1: 0.4995
 epoch: 9, train_loss: 1.0630, test_loss: 1.0402, test_f1: 0.4786
 epoch: 10, train_loss: 1.0452, test_loss: 1.0295, test_f1: 0.4974
 epoch: 11, train_loss: 1.0308, test_loss: 1.0256, test_f1: 0.4821
 epoch: 12, train_loss: 1.0164, test_loss: 1.0261, test_f1: 0.4485
 epoch: 13, train_loss: 0.9963, test_loss: 1.0038, test_f1: 0.4991
 epoch: 14, train_loss: 0.9933, test_loss: 1.0024, test_f1: 0.4994
 epoch: 15, train_loss: 0.9708, test_loss: 0.9973, test_f1: 0.4883
 epoch: 16, train_loss: 0.9723, test_loss: 0.9922, test_f1: 0.5048
 epoch: 17, train_loss: 0.9499, test_loss: 0.9944, test_f1: 0.4936
 epoch: 18, train_loss: 0.9442, test_loss: 1.0082, test_f1: 0.4709
 epoch: 19, train_loss: 0.9256, test_loss: 0.9928, test_f1: 0.4808
 epoch: 20, train_loss: 0.9247, test_loss: 0.9704, test_f1: 0.5054
 epoch: 21, train_loss: 0.9122, test_loss: 0.9756, test_f1: 0.5064
 epoch: 22, train_loss: 0.9017, test_loss: 0.9869, test_f1: 0.4911
 epoch: 23, train_loss: 0.8942, test_loss: 0.9782, test_f1: 0.5045
 epoch: 24, train_loss: 0.8685, test_loss: 0.9868, test_f1: 0.5049
 epoch: 25, train_loss: 0.8717, test_loss: 0.9877, test_f1: 0.4994
 epoch: 26, train_loss: 0.8626, test_loss: 0.9739, test_f1: 0.5174
 epoch: 27, train_loss: 0.8397, test_loss: 1.0022, test_f1: 0.4983
 epoch: 28, train_loss: 0.8441, test_loss: 1.0076, test_f1: 0.5184
 epoch: 29, train_loss: 0.8283, test_loss: 1.0322, test_f1: 0.5102
 epoch: 30, train_loss: 0.8208, test_loss: 0.9898, test_f1: 0.5359
 epoch: 31, train_loss: 0.8065, test_loss: 1.0155, test_f1: 0.5167
 epoch: 32, train_loss: 0.7939, test_loss: 1.0585, test_f1: 0.5139
 epoch: 33, train_loss: 0.7898, test_loss: 1.0263, test_f1: 0.5235
 epoch: 34, train_loss: 0.7774, test_loss: 1.0145, test_f1: 0.5303
 epoch: 35, train_loss: 0.7550, test_loss: 1.0798, test_f1: 0.5232
 epoch: 36, train_loss: 0.7577, test_loss: 1.0504, test_f1: 0.5379
 epoch: 37, train_loss: 0.7520, test_loss: 1.0398, test_f1: 0.5125
 epoch: 38, train_loss: 0.7328, test_loss: 1.0477, test_f1: 0.5404
 epoch: 39, train_loss: 0.7260, test_loss: 1.1083, test_f1: 0.5277
 epoch: 40, train_loss: 0.7389, test_loss: 1.0809, test_f1: 0.5312
 epoch: 41, train_loss: 0.7255, test_loss: 1.1208, test_f1: 0.5260
 epoch: 42, train_loss: 0.7039, test_loss: 1.1138, test_f1: 0.5183
 epoch: 43, train_loss: 0.7007, test_loss: 1.1345, test_f1: 0.5124
 epoch: 44, train_loss: 0.7079, test_loss: 1.0764, test_f1: 0.5274
 epoch: 45, train_loss: 0.6803, test_loss: 1.0875, test_f1: 0.5431
 epoch: 46, train_loss: 0.6820, test_loss: 1.1132, test_f1: 0.5347
 epoch: 47, train_loss: 0.6743, test_loss: 1.1651, test_f1: 0.5295
 epoch: 48, train_loss: 0.6659, test_loss: 1.1485, test_f1: 0.5291
 epoch: 49, train_loss: 0.6523, test_loss: 1.1295, test_f1: 0.5275
 epoch: 50, train_loss: 0.6424, test_loss: 1.2015, test_f1: 0.5096
 epoch: 51, train_loss: 0.6302, test_loss: 1.1722, test_f1: 0.5195
 epoch: 52, train_loss: 0.6317, test_loss: 1.1696, test_f1: 0.5245
 epoch: 53, train_loss: 0.6267, test_loss: 1.1718, test_f1: 0.5258
 epoch: 54, train_loss: 0.6178, test_loss: 1.2291, test_f1: 0.5346
 epoch: 55, train_loss: 0.6077, test_loss: 1.1843, test_f1: 0.5290
 epoch: 56, train_loss: 0.6195, test_loss: 1.1620, test_f1: 0.5240
 epoch: 57, train_loss: 0.6060, test_loss: 1.1816, test_f1: 0.5323
 epoch: 58, train_loss: 0.5987, test_loss: 1.2162, test_f1: 0.5228
 epoch: 59, train_loss: 0.6039, test_loss: 1.2159, test_f1: 0.5240
 epoch: 60, train_loss: 0.6018, test_loss: 1.1920, test_f1: 0.5349
 epoch: 61, train_loss: 0.5991, test_loss: 1.1493, test_f1: 0.5324
 epoch: 62, train_loss: 0.5811, test_loss: 1.1926, test_f1: 0.5318
 epoch: 63, train_loss: 0.5971, test_loss: 1.2115, test_f1: 0.5402
 epoch: 64, train_loss: 0.5794, test_loss: 1.2247, test_f1: 0.5354
 epoch: 65, train_loss: 0.5776, test_loss: 1.2305, test_f1: 0.5291
 epoch: 66, train_loss: 0.5980, test_loss: 1.2272, test_f1: 0.5333
 epoch: 67, train_loss: 0.5867, test_loss: 1.2475, test_f1: 0.5507
 epoch: 68, train_loss: 0.5655, test_loss: 1.2061, test_f1: 0.5414
 epoch: 69, train_loss: 0.5679, test_loss: 1.2020, test_f1: 0.5351
 epoch: 70, train_loss: 0.5564, test_loss: 1.2055, test_f1: 0.5452
 epoch: 71, train_loss: 0.5612, test_loss: 1.3026, test_f1: 0.5254
 epoch: 72, train_loss: 0.5499, test_loss: 1.2414, test_f1: 0.5463
 epoch: 73, train_loss: 0.5515, test_loss: 1.2311, test_f1: 0.5423
 epoch: 74, train_loss: 0.5620, test_loss: 1.2954, test_f1: 0.5325
 epoch: 75, train_loss: 0.5497, test_loss: 1.2745, test_f1: 0.5448
 epoch: 76, train_loss: 0.5462, test_loss: 1.2831, test_f1: 0.5383
 epoch: 77, train_loss: 0.5488, test_loss: 1.3080, test_f1: 0.5308
 epoch: 78, train_loss: 0.5322, test_loss: 1.2642, test_f1: 0.5236
 epoch: 79, train_loss: 0.5413, test_loss: 1.2552, test_f1: 0.5284
 epoch: 80, train_loss: 0.5230, test_loss: 1.3257, test_f1: 0.5193
 epoch: 81, train_loss: 0.5359, test_loss: 1.2784, test_f1: 0.5373
 epoch: 82, train_loss: 0.5287, test_loss: 1.3086, test_f1: 0.5444
 epoch: 83, train_loss: 0.5327, test_loss: 1.3257, test_f1: 0.5401
 epoch: 84, train_loss: 0.5256, test_loss: 1.3688, test_f1: 0.5291
 epoch: 85, train_loss: 0.5204, test_loss: 1.3492, test_f1: 0.5359
 epoch: 86, train_loss: 0.5174, test_loss: 1.3731, test_f1: 0.5353
 epoch: 87, train_loss: 0.5032, test_loss: 1.3464, test_f1: 0.5458
 epoch: 88, train_loss: 0.5098, test_loss: 1.3155, test_f1: 0.5478
 epoch: 89, train_loss: 0.5233, test_loss: 1.3304, test_f1: 0.5422
 epoch: 90, train_loss: 0.5073, test_loss: 1.3541, test_f1: 0.5505
 epoch: 91, train_loss: 0.5006, test_loss: 1.3571, test_f1: 0.5465
 epoch: 92, train_loss: 0.5048, test_loss: 1.3967, test_f1: 0.5397
 epoch: 93, train_loss: 0.5202, test_loss: 1.3981, test_f1: 0.5254
 epoch: 94, train_loss: 0.4890, test_loss: 1.3553, test_f1: 0.5433
 epoch: 95, train_loss: 0.4863, test_loss: 1.3889, test_f1: 0.5341
 epoch: 96, train_loss: 0.4986, test_loss: 1.4267, test_f1: 0.5241
 epoch: 97, train_loss: 0.4884, test_loss: 1.3893, test_f1: 0.5398
 epoch: 98, train_loss: 0.4633, test_loss: 1.4490, test_f1: 0.5364
 epoch: 99, train_loss: 0.4894, test_loss: 1.4219, test_f1: 0.5389
##################ITERATION #6 ****************************************
 epoch: 0, train_loss: 1.3318, test_loss: 1.2682, test_f1: 0.2555
 epoch: 1, train_loss: 1.2150, test_loss: 1.1932, test_f1: 0.3783
 epoch: 2, train_loss: 1.1911, test_loss: 1.1625, test_f1: 0.4371
 epoch: 3, train_loss: 1.1612, test_loss: 1.1473, test_f1: 0.4538
 epoch: 4, train_loss: 1.1437, test_loss: 1.1212, test_f1: 0.4474
 epoch: 5, train_loss: 1.1249, test_loss: 1.1193, test_f1: 0.4349
 epoch: 6, train_loss: 1.1113, test_loss: 1.0934, test_f1: 0.4536
 epoch: 7, train_loss: 1.0925, test_loss: 1.0955, test_f1: 0.4604
 epoch: 8, train_loss: 1.0790, test_loss: 1.0814, test_f1: 0.4747
 epoch: 9, train_loss: 1.0547, test_loss: 1.0712, test_f1: 0.4568
 epoch: 10, train_loss: 1.0452, test_loss: 1.0709, test_f1: 0.4662
 epoch: 11, train_loss: 1.0346, test_loss: 1.0496, test_f1: 0.4774
 epoch: 12, train_loss: 1.0257, test_loss: 1.0576, test_f1: 0.4597
 epoch: 13, train_loss: 1.0211, test_loss: 1.0537, test_f1: 0.4750
 epoch: 14, train_loss: 1.0064, test_loss: 1.0451, test_f1: 0.4562
 epoch: 15, train_loss: 0.9884, test_loss: 1.0364, test_f1: 0.4895
 epoch: 16, train_loss: 0.9859, test_loss: 1.0489, test_f1: 0.4754
 epoch: 17, train_loss: 0.9621, test_loss: 1.0438, test_f1: 0.4875
 epoch: 18, train_loss: 0.9571, test_loss: 1.0222, test_f1: 0.4972
 epoch: 19, train_loss: 0.9446, test_loss: 1.0346, test_f1: 0.4934
 epoch: 20, train_loss: 0.9471, test_loss: 1.0371, test_f1: 0.4670
 epoch: 21, train_loss: 0.9350, test_loss: 1.0422, test_f1: 0.4912
 epoch: 22, train_loss: 0.9265, test_loss: 1.0259, test_f1: 0.4802
 epoch: 23, train_loss: 0.9211, test_loss: 1.0374, test_f1: 0.4910
 epoch: 24, train_loss: 0.9036, test_loss: 1.0267, test_f1: 0.5034
 epoch: 25, train_loss: 0.8993, test_loss: 1.0312, test_f1: 0.4871
 epoch: 26, train_loss: 0.8972, test_loss: 1.0171, test_f1: 0.4965
 epoch: 27, train_loss: 0.8812, test_loss: 1.0340, test_f1: 0.4971
 epoch: 28, train_loss: 0.8757, test_loss: 1.0377, test_f1: 0.4991
 epoch: 29, train_loss: 0.8626, test_loss: 1.0243, test_f1: 0.5063
 epoch: 30, train_loss: 0.8611, test_loss: 1.0362, test_f1: 0.5019
 epoch: 31, train_loss: 0.8442, test_loss: 1.0347, test_f1: 0.5219
 epoch: 32, train_loss: 0.8353, test_loss: 1.0448, test_f1: 0.5110
 epoch: 33, train_loss: 0.8129, test_loss: 1.0565, test_f1: 0.5106
 epoch: 34, train_loss: 0.8205, test_loss: 1.0924, test_f1: 0.5012
 epoch: 35, train_loss: 0.8090, test_loss: 1.0284, test_f1: 0.5358
 epoch: 36, train_loss: 0.8110, test_loss: 1.0556, test_f1: 0.5227
 epoch: 37, train_loss: 0.8085, test_loss: 1.0784, test_f1: 0.5025
 epoch: 38, train_loss: 0.7824, test_loss: 1.0560, test_f1: 0.5226
 epoch: 39, train_loss: 0.7929, test_loss: 1.1090, test_f1: 0.5204
 epoch: 40, train_loss: 0.7889, test_loss: 1.0519, test_f1: 0.5232
 epoch: 41, train_loss: 0.7797, test_loss: 1.0710, test_f1: 0.5252
 epoch: 42, train_loss: 0.7551, test_loss: 1.0662, test_f1: 0.5180
 epoch: 43, train_loss: 0.7491, test_loss: 1.0846, test_f1: 0.5102
 epoch: 44, train_loss: 0.7361, test_loss: 1.0719, test_f1: 0.5085
 epoch: 45, train_loss: 0.7359, test_loss: 1.1342, test_f1: 0.5274
 epoch: 46, train_loss: 0.7420, test_loss: 1.1361, test_f1: 0.5329
 epoch: 47, train_loss: 0.7265, test_loss: 1.1055, test_f1: 0.5198
 epoch: 48, train_loss: 0.7249, test_loss: 1.1494, test_f1: 0.5064
 epoch: 49, train_loss: 0.6999, test_loss: 1.1034, test_f1: 0.5203
 epoch: 50, train_loss: 0.7213, test_loss: 1.1214, test_f1: 0.5143
 epoch: 51, train_loss: 0.6923, test_loss: 1.1580, test_f1: 0.5271
 epoch: 52, train_loss: 0.6855, test_loss: 1.1358, test_f1: 0.5222
 epoch: 53, train_loss: 0.6823, test_loss: 1.1448, test_f1: 0.5337
 epoch: 54, train_loss: 0.6862, test_loss: 1.1566, test_f1: 0.5136
 epoch: 55, train_loss: 0.6736, test_loss: 1.1718, test_f1: 0.5270
 epoch: 56, train_loss: 0.6694, test_loss: 1.1737, test_f1: 0.5213
 epoch: 57, train_loss: 0.6598, test_loss: 1.1280, test_f1: 0.5250
 epoch: 58, train_loss: 0.6527, test_loss: 1.1861, test_f1: 0.5235
 epoch: 59, train_loss: 0.6593, test_loss: 1.1875, test_f1: 0.5349
 epoch: 60, train_loss: 0.6428, test_loss: 1.1964, test_f1: 0.5221
 epoch: 61, train_loss: 0.6552, test_loss: 1.2011, test_f1: 0.5276
 epoch: 62, train_loss: 0.6430, test_loss: 1.2068, test_f1: 0.5298
 epoch: 63, train_loss: 0.6571, test_loss: 1.2301, test_f1: 0.5244
 epoch: 64, train_loss: 0.6373, test_loss: 1.2317, test_f1: 0.5182
 epoch: 65, train_loss: 0.6453, test_loss: 1.2481, test_f1: 0.5232
 epoch: 66, train_loss: 0.6409, test_loss: 1.2224, test_f1: 0.5367
 epoch: 67, train_loss: 0.6163, test_loss: 1.2062, test_f1: 0.5392
 epoch: 68, train_loss: 0.6142, test_loss: 1.2586, test_f1: 0.5249
 epoch: 69, train_loss: 0.6353, test_loss: 1.2156, test_f1: 0.5250
 epoch: 70, train_loss: 0.6171, test_loss: 1.2622, test_f1: 0.5282
 epoch: 71, train_loss: 0.6216, test_loss: 1.2623, test_f1: 0.5287
 epoch: 72, train_loss: 0.6256, test_loss: 1.2627, test_f1: 0.5194
 epoch: 73, train_loss: 0.6204, test_loss: 1.2855, test_f1: 0.5291
 epoch: 74, train_loss: 0.5913, test_loss: 1.2983, test_f1: 0.5140
 epoch: 75, train_loss: 0.6136, test_loss: 1.2713, test_f1: 0.5203
 epoch: 76, train_loss: 0.6153, test_loss: 1.2200, test_f1: 0.5354
 epoch: 77, train_loss: 0.5879, test_loss: 1.3043, test_f1: 0.5299
 epoch: 78, train_loss: 0.6128, test_loss: 1.2980, test_f1: 0.5239
 epoch: 79, train_loss: 0.5938, test_loss: 1.3236, test_f1: 0.5065
 epoch: 80, train_loss: 0.5934, test_loss: 1.2957, test_f1: 0.5041
 epoch: 81, train_loss: 0.5821, test_loss: 1.2880, test_f1: 0.5389
 epoch: 82, train_loss: 0.6023, test_loss: 1.2928, test_f1: 0.5149
 epoch: 83, train_loss: 0.5862, test_loss: 1.3262, test_f1: 0.5150
 epoch: 84, train_loss: 0.5849, test_loss: 1.2868, test_f1: 0.5361
 epoch: 85, train_loss: 0.5769, test_loss: 1.3448, test_f1: 0.5124
 epoch: 86, train_loss: 0.5663, test_loss: 1.4180, test_f1: 0.5056
 epoch: 87, train_loss: 0.5820, test_loss: 1.3442, test_f1: 0.5275
 epoch: 88, train_loss: 0.5806, test_loss: 1.3382, test_f1: 0.5289
 epoch: 89, train_loss: 0.5643, test_loss: 1.3550, test_f1: 0.5210
 epoch: 90, train_loss: 0.5627, test_loss: 1.3655, test_f1: 0.5237
 epoch: 91, train_loss: 0.5801, test_loss: 1.4114, test_f1: 0.5111
 epoch: 92, train_loss: 0.5632, test_loss: 1.3455, test_f1: 0.5227
 epoch: 93, train_loss: 0.5607, test_loss: 1.4327, test_f1: 0.5307
 epoch: 94, train_loss: 0.5688, test_loss: 1.3595, test_f1: 0.5318
 epoch: 95, train_loss: 0.5758, test_loss: 1.4148, test_f1: 0.5312
 epoch: 96, train_loss: 0.5393, test_loss: 1.3962, test_f1: 0.5421
 epoch: 97, train_loss: 0.5509, test_loss: 1.4111, test_f1: 0.5308
 epoch: 98, train_loss: 0.5574, test_loss: 1.3557, test_f1: 0.5415
 epoch: 99, train_loss: 0.5504, test_loss: 1.4517, test_f1: 0.5159
##################ITERATION #7 ****************************************
 epoch: 0, train_loss: 1.3382, test_loss: 1.2653, test_f1: 0.3151
 epoch: 1, train_loss: 1.2415, test_loss: 1.1991, test_f1: 0.4225
 epoch: 2, train_loss: 1.2224, test_loss: 1.1653, test_f1: 0.4625
 epoch: 3, train_loss: 1.1837, test_loss: 1.1275, test_f1: 0.4571
 epoch: 4, train_loss: 1.1702, test_loss: 1.1214, test_f1: 0.4594
 epoch: 5, train_loss: 1.1475, test_loss: 1.1207, test_f1: 0.4618
 epoch: 6, train_loss: 1.1231, test_loss: 1.1130, test_f1: 0.4470
 epoch: 7, train_loss: 1.1295, test_loss: 1.1098, test_f1: 0.4623
 epoch: 8, train_loss: 1.1088, test_loss: 1.0773, test_f1: 0.4679
 epoch: 9, train_loss: 1.0950, test_loss: 1.0834, test_f1: 0.4650
 epoch: 10, train_loss: 1.0857, test_loss: 1.0715, test_f1: 0.4762
 epoch: 11, train_loss: 1.0685, test_loss: 1.0689, test_f1: 0.4860
 epoch: 12, train_loss: 1.0642, test_loss: 1.0569, test_f1: 0.4823
 epoch: 13, train_loss: 1.0577, test_loss: 1.0719, test_f1: 0.4843
 epoch: 14, train_loss: 1.0426, test_loss: 1.0415, test_f1: 0.4749
 epoch: 15, train_loss: 1.0274, test_loss: 1.0406, test_f1: 0.4782
 epoch: 16, train_loss: 1.0236, test_loss: 1.0187, test_f1: 0.4807
 epoch: 17, train_loss: 1.0190, test_loss: 1.0278, test_f1: 0.4574
 epoch: 18, train_loss: 0.9949, test_loss: 1.0219, test_f1: 0.4677
 epoch: 19, train_loss: 0.9989, test_loss: 1.0176, test_f1: 0.4512
 epoch: 20, train_loss: 0.9873, test_loss: 0.9906, test_f1: 0.4683
 epoch: 21, train_loss: 0.9713, test_loss: 1.0208, test_f1: 0.4874
 epoch: 22, train_loss: 0.9718, test_loss: 1.0071, test_f1: 0.4878
 epoch: 23, train_loss: 0.9607, test_loss: 0.9980, test_f1: 0.4899
 epoch: 24, train_loss: 0.9485, test_loss: 1.0060, test_f1: 0.4706
 epoch: 25, train_loss: 0.9449, test_loss: 0.9978, test_f1: 0.4708
 epoch: 26, train_loss: 0.9429, test_loss: 1.0144, test_f1: 0.4717
 epoch: 27, train_loss: 0.9282, test_loss: 1.0000, test_f1: 0.4666
 epoch: 28, train_loss: 0.9109, test_loss: 1.0024, test_f1: 0.4711
 epoch: 29, train_loss: 0.9074, test_loss: 1.0035, test_f1: 0.4837
 epoch: 30, train_loss: 0.8969, test_loss: 1.0002, test_f1: 0.4756
 epoch: 31, train_loss: 0.8848, test_loss: 1.0284, test_f1: 0.4654
 epoch: 32, train_loss: 0.8868, test_loss: 1.0455, test_f1: 0.4652
 epoch: 33, train_loss: 0.8745, test_loss: 1.0103, test_f1: 0.4813
 epoch: 34, train_loss: 0.8655, test_loss: 1.0165, test_f1: 0.4713
 epoch: 35, train_loss: 0.8559, test_loss: 1.0307, test_f1: 0.4738
 epoch: 36, train_loss: 0.8547, test_loss: 1.0135, test_f1: 0.4887
 epoch: 37, train_loss: 0.8504, test_loss: 1.0394, test_f1: 0.4850
 epoch: 38, train_loss: 0.8332, test_loss: 1.0269, test_f1: 0.5059
 epoch: 39, train_loss: 0.8363, test_loss: 1.0100, test_f1: 0.4932
 epoch: 40, train_loss: 0.8198, test_loss: 1.0370, test_f1: 0.4993
 epoch: 41, train_loss: 0.8133, test_loss: 1.0517, test_f1: 0.5084
 epoch: 42, train_loss: 0.8111, test_loss: 1.1067, test_f1: 0.4691
 epoch: 43, train_loss: 0.8054, test_loss: 1.0390, test_f1: 0.5207
 epoch: 44, train_loss: 0.8068, test_loss: 1.0920, test_f1: 0.5101
 epoch: 45, train_loss: 0.7844, test_loss: 1.0847, test_f1: 0.5191
 epoch: 46, train_loss: 0.7927, test_loss: 1.1100, test_f1: 0.5110
 epoch: 47, train_loss: 0.7739, test_loss: 1.0869, test_f1: 0.5106
 epoch: 48, train_loss: 0.7747, test_loss: 1.1755, test_f1: 0.5056
 epoch: 49, train_loss: 0.7696, test_loss: 1.1240, test_f1: 0.5171
 epoch: 50, train_loss: 0.7630, test_loss: 1.1234, test_f1: 0.5182
 epoch: 51, train_loss: 0.7563, test_loss: 1.1857, test_f1: 0.4961
 epoch: 52, train_loss: 0.7454, test_loss: 1.1912, test_f1: 0.5041
 epoch: 53, train_loss: 0.7381, test_loss: 1.1706, test_f1: 0.5127
 epoch: 54, train_loss: 0.7337, test_loss: 1.1622, test_f1: 0.5183
 epoch: 55, train_loss: 0.7085, test_loss: 1.1777, test_f1: 0.5299
 epoch: 56, train_loss: 0.7184, test_loss: 1.1691, test_f1: 0.5140
 epoch: 57, train_loss: 0.7081, test_loss: 1.1844, test_f1: 0.5283
 epoch: 58, train_loss: 0.7095, test_loss: 1.1991, test_f1: 0.5342
 epoch: 59, train_loss: 0.7108, test_loss: 1.1959, test_f1: 0.5141
 epoch: 60, train_loss: 0.7083, test_loss: 1.2292, test_f1: 0.5267
 epoch: 61, train_loss: 0.7094, test_loss: 1.2235, test_f1: 0.5240
 epoch: 62, train_loss: 0.6971, test_loss: 1.2504, test_f1: 0.5141
 epoch: 63, train_loss: 0.6958, test_loss: 1.2795, test_f1: 0.5088
 epoch: 64, train_loss: 0.7033, test_loss: 1.2512, test_f1: 0.5187
 epoch: 65, train_loss: 0.6884, test_loss: 1.2894, test_f1: 0.5156
 epoch: 66, train_loss: 0.6853, test_loss: 1.2721, test_f1: 0.5067
 epoch: 67, train_loss: 0.6813, test_loss: 1.3429, test_f1: 0.5177
 epoch: 68, train_loss: 0.6752, test_loss: 1.2976, test_f1: 0.5072
 epoch: 69, train_loss: 0.6812, test_loss: 1.2868, test_f1: 0.5135
 epoch: 70, train_loss: 0.6644, test_loss: 1.2926, test_f1: 0.5091
 epoch: 71, train_loss: 0.6660, test_loss: 1.2853, test_f1: 0.5237
 epoch: 72, train_loss: 0.6648, test_loss: 1.3295, test_f1: 0.5214
 epoch: 73, train_loss: 0.6666, test_loss: 1.3187, test_f1: 0.5158
 epoch: 74, train_loss: 0.6616, test_loss: 1.3222, test_f1: 0.5229
 epoch: 75, train_loss: 0.6596, test_loss: 1.3696, test_f1: 0.5113
 epoch: 76, train_loss: 0.6415, test_loss: 1.3481, test_f1: 0.5126
 epoch: 77, train_loss: 0.6439, test_loss: 1.3424, test_f1: 0.5351
 epoch: 78, train_loss: 0.6548, test_loss: 1.3138, test_f1: 0.5147
 epoch: 79, train_loss: 0.6593, test_loss: 1.3791, test_f1: 0.5050
 epoch: 80, train_loss: 0.6388, test_loss: 1.3609, test_f1: 0.5134
 epoch: 81, train_loss: 0.6475, test_loss: 1.4273, test_f1: 0.5106
 epoch: 82, train_loss: 0.6441, test_loss: 1.3705, test_f1: 0.5256
 epoch: 83, train_loss: 0.6466, test_loss: 1.4118, test_f1: 0.5186
 epoch: 84, train_loss: 0.6293, test_loss: 1.4151, test_f1: 0.5090
 epoch: 85, train_loss: 0.6324, test_loss: 1.3919, test_f1: 0.5253
 epoch: 86, train_loss: 0.6335, test_loss: 1.3950, test_f1: 0.5226
 epoch: 87, train_loss: 0.6275, test_loss: 1.4407, test_f1: 0.5140
 epoch: 88, train_loss: 0.6250, test_loss: 1.5069, test_f1: 0.5137
 epoch: 89, train_loss: 0.6222, test_loss: 1.3944, test_f1: 0.5245
 epoch: 90, train_loss: 0.6119, test_loss: 1.4446, test_f1: 0.5165
 epoch: 91, train_loss: 0.6151, test_loss: 1.4630, test_f1: 0.5100
 epoch: 92, train_loss: 0.6125, test_loss: 1.4441, test_f1: 0.5301
 epoch: 93, train_loss: 0.6154, test_loss: 1.5235, test_f1: 0.5194
 epoch: 94, train_loss: 0.5979, test_loss: 1.4778, test_f1: 0.5313
 epoch: 95, train_loss: 0.6114, test_loss: 1.4488, test_f1: 0.5473
 epoch: 96, train_loss: 0.6095, test_loss: 1.4707, test_f1: 0.5154
 epoch: 97, train_loss: 0.5910, test_loss: 1.4790, test_f1: 0.5295
 epoch: 98, train_loss: 0.5965, test_loss: 1.4918, test_f1: 0.5236
 epoch: 99, train_loss: 0.5940, test_loss: 1.4821, test_f1: 0.5399
##################ITERATION #8 ****************************************
 epoch: 0, train_loss: 1.3437, test_loss: 1.2369, test_f1: 0.3312
 epoch: 1, train_loss: 1.2208, test_loss: 1.1583, test_f1: 0.4750
 epoch: 2, train_loss: 1.1864, test_loss: 1.1232, test_f1: 0.4363
 epoch: 3, train_loss: 1.1493, test_loss: 1.0979, test_f1: 0.4456
 epoch: 4, train_loss: 1.1286, test_loss: 1.0904, test_f1: 0.4571
 epoch: 5, train_loss: 1.1238, test_loss: 1.0854, test_f1: 0.4428
 epoch: 6, train_loss: 1.1202, test_loss: 1.0868, test_f1: 0.4451
 epoch: 7, train_loss: 1.0900, test_loss: 1.0953, test_f1: 0.4304
 epoch: 8, train_loss: 1.0752, test_loss: 1.1004, test_f1: 0.4435
 epoch: 9, train_loss: 1.0590, test_loss: 1.0825, test_f1: 0.4272
 epoch: 10, train_loss: 1.0501, test_loss: 1.0755, test_f1: 0.4570
 epoch: 11, train_loss: 1.0386, test_loss: 1.0854, test_f1: 0.4362
 epoch: 12, train_loss: 1.0214, test_loss: 1.0689, test_f1: 0.4488
 epoch: 13, train_loss: 1.0176, test_loss: 1.0592, test_f1: 0.4358
 epoch: 14, train_loss: 1.0119, test_loss: 1.0521, test_f1: 0.4411
 epoch: 15, train_loss: 0.9938, test_loss: 1.0625, test_f1: 0.4191
 epoch: 16, train_loss: 0.9762, test_loss: 1.0646, test_f1: 0.4261
 epoch: 17, train_loss: 0.9813, test_loss: 1.0632, test_f1: 0.4348
 epoch: 18, train_loss: 0.9680, test_loss: 1.0518, test_f1: 0.4527
 epoch: 19, train_loss: 0.9608, test_loss: 1.0762, test_f1: 0.4300
 epoch: 20, train_loss: 0.9570, test_loss: 1.0363, test_f1: 0.4649
 epoch: 21, train_loss: 0.9318, test_loss: 1.0559, test_f1: 0.4573
 epoch: 22, train_loss: 0.9406, test_loss: 1.0441, test_f1: 0.4515
 epoch: 23, train_loss: 0.9216, test_loss: 1.0478, test_f1: 0.4634
 epoch: 24, train_loss: 0.9186, test_loss: 1.0408, test_f1: 0.4727
 epoch: 25, train_loss: 0.9031, test_loss: 1.0571, test_f1: 0.4685
 epoch: 26, train_loss: 0.9057, test_loss: 1.0409, test_f1: 0.4567
 epoch: 27, train_loss: 0.8921, test_loss: 1.0361, test_f1: 0.4552
 epoch: 28, train_loss: 0.8848, test_loss: 1.0994, test_f1: 0.4410
 epoch: 29, train_loss: 0.8708, test_loss: 1.0425, test_f1: 0.4762
 epoch: 30, train_loss: 0.8551, test_loss: 1.0460, test_f1: 0.4722
 epoch: 31, train_loss: 0.8566, test_loss: 1.0393, test_f1: 0.4938
 epoch: 32, train_loss: 0.8566, test_loss: 1.0347, test_f1: 0.4752
 epoch: 33, train_loss: 0.8420, test_loss: 1.0366, test_f1: 0.5085
 epoch: 34, train_loss: 0.8278, test_loss: 1.0511, test_f1: 0.5063
 epoch: 35, train_loss: 0.8212, test_loss: 1.0474, test_f1: 0.4747
 epoch: 36, train_loss: 0.8127, test_loss: 1.0402, test_f1: 0.5145
 epoch: 37, train_loss: 0.8038, test_loss: 1.0498, test_f1: 0.5153
 epoch: 38, train_loss: 0.8004, test_loss: 1.0571, test_f1: 0.5004
 epoch: 39, train_loss: 0.7910, test_loss: 1.0484, test_f1: 0.5030
 epoch: 40, train_loss: 0.7917, test_loss: 1.0545, test_f1: 0.5042
 epoch: 41, train_loss: 0.7745, test_loss: 1.0780, test_f1: 0.5025
 epoch: 42, train_loss: 0.7758, test_loss: 1.0673, test_f1: 0.4869
 epoch: 43, train_loss: 0.7717, test_loss: 1.0819, test_f1: 0.4770
 epoch: 44, train_loss: 0.7745, test_loss: 1.1009, test_f1: 0.5060
 epoch: 45, train_loss: 0.7569, test_loss: 1.0814, test_f1: 0.5156
 epoch: 46, train_loss: 0.7317, test_loss: 1.0913, test_f1: 0.5210
 epoch: 47, train_loss: 0.7468, test_loss: 1.1174, test_f1: 0.5051
 epoch: 48, train_loss: 0.7492, test_loss: 1.1027, test_f1: 0.5096
 epoch: 49, train_loss: 0.7372, test_loss: 1.1334, test_f1: 0.4847
 epoch: 50, train_loss: 0.7110, test_loss: 1.1585, test_f1: 0.4929
 epoch: 51, train_loss: 0.7138, test_loss: 1.1295, test_f1: 0.5018
 epoch: 52, train_loss: 0.6847, test_loss: 1.1407, test_f1: 0.5118
 epoch: 53, train_loss: 0.7073, test_loss: 1.1498, test_f1: 0.5001
 epoch: 54, train_loss: 0.6850, test_loss: 1.1594, test_f1: 0.5067
 epoch: 55, train_loss: 0.6770, test_loss: 1.1788, test_f1: 0.4817
 epoch: 56, train_loss: 0.6819, test_loss: 1.2059, test_f1: 0.4956
 epoch: 57, train_loss: 0.6849, test_loss: 1.1537, test_f1: 0.4965
 epoch: 58, train_loss: 0.6756, test_loss: 1.1586, test_f1: 0.4980
 epoch: 59, train_loss: 0.6748, test_loss: 1.2094, test_f1: 0.4925
 epoch: 60, train_loss: 0.6571, test_loss: 1.1708, test_f1: 0.5072
 epoch: 61, train_loss: 0.6730, test_loss: 1.1726, test_f1: 0.5027
 epoch: 62, train_loss: 0.6627, test_loss: 1.1751, test_f1: 0.4903
 epoch: 63, train_loss: 0.6558, test_loss: 1.1878, test_f1: 0.5048
 epoch: 64, train_loss: 0.6658, test_loss: 1.1933, test_f1: 0.5053
 epoch: 65, train_loss: 0.6662, test_loss: 1.1743, test_f1: 0.5079
 epoch: 66, train_loss: 0.6657, test_loss: 1.1717, test_f1: 0.5008
 epoch: 67, train_loss: 0.6544, test_loss: 1.1901, test_f1: 0.4858
 epoch: 68, train_loss: 0.6413, test_loss: 1.1746, test_f1: 0.5158
 epoch: 69, train_loss: 0.6372, test_loss: 1.2045, test_f1: 0.5002
 epoch: 70, train_loss: 0.6408, test_loss: 1.2470, test_f1: 0.4814
 epoch: 71, train_loss: 0.6287, test_loss: 1.2006, test_f1: 0.4958
 epoch: 72, train_loss: 0.6464, test_loss: 1.2154, test_f1: 0.4853
 epoch: 73, train_loss: 0.6278, test_loss: 1.1938, test_f1: 0.5155
 epoch: 74, train_loss: 0.6185, test_loss: 1.1843, test_f1: 0.5207
 epoch: 75, train_loss: 0.6332, test_loss: 1.2244, test_f1: 0.5295
 epoch: 76, train_loss: 0.6138, test_loss: 1.2396, test_f1: 0.5198
 epoch: 77, train_loss: 0.5938, test_loss: 1.2548, test_f1: 0.5184
 epoch: 78, train_loss: 0.6260, test_loss: 1.2484, test_f1: 0.5000
 epoch: 79, train_loss: 0.6025, test_loss: 1.2358, test_f1: 0.4848
 epoch: 80, train_loss: 0.6169, test_loss: 1.2433, test_f1: 0.5202
 epoch: 81, train_loss: 0.6069, test_loss: 1.2427, test_f1: 0.5127
 epoch: 82, train_loss: 0.6112, test_loss: 1.2666, test_f1: 0.4948
 epoch: 83, train_loss: 0.6003, test_loss: 1.2497, test_f1: 0.5063
 epoch: 84, train_loss: 0.6032, test_loss: 1.2826, test_f1: 0.4907
 epoch: 85, train_loss: 0.5962, test_loss: 1.3058, test_f1: 0.4914
 epoch: 86, train_loss: 0.6110, test_loss: 1.2827, test_f1: 0.5116
 epoch: 87, train_loss: 0.5912, test_loss: 1.2385, test_f1: 0.5131
 epoch: 88, train_loss: 0.5855, test_loss: 1.2729, test_f1: 0.5053
 epoch: 89, train_loss: 0.5798, test_loss: 1.2611, test_f1: 0.4912
 epoch: 90, train_loss: 0.5893, test_loss: 1.3129, test_f1: 0.4880
 epoch: 91, train_loss: 0.5862, test_loss: 1.2779, test_f1: 0.4950
 epoch: 92, train_loss: 0.5780, test_loss: 1.3202, test_f1: 0.4909
 epoch: 93, train_loss: 0.5796, test_loss: 1.3530, test_f1: 0.4994
 epoch: 94, train_loss: 0.5871, test_loss: 1.3613, test_f1: 0.4941
 epoch: 95, train_loss: 0.5662, test_loss: 1.3464, test_f1: 0.4905
 epoch: 96, train_loss: 0.5853, test_loss: 1.3461, test_f1: 0.4965
 epoch: 97, train_loss: 0.5622, test_loss: 1.3331, test_f1: 0.4928
 epoch: 98, train_loss: 0.5632, test_loss: 1.3181, test_f1: 0.5100
 epoch: 99, train_loss: 0.5754, test_loss: 1.3020, test_f1: 0.5041
##################ITERATION #9 ****************************************
 epoch: 0, train_loss: 1.3521, test_loss: 1.2913, test_f1: 0.3219
 epoch: 1, train_loss: 1.2399, test_loss: 1.2081, test_f1: 0.4015
 epoch: 2, train_loss: 1.2147, test_loss: 1.1374, test_f1: 0.4455
 epoch: 3, train_loss: 1.1727, test_loss: 1.1197, test_f1: 0.4649
 epoch: 4, train_loss: 1.1580, test_loss: 1.0845, test_f1: 0.4736
 epoch: 5, train_loss: 1.1379, test_loss: 1.0947, test_f1: 0.4594
 epoch: 6, train_loss: 1.1064, test_loss: 1.0728, test_f1: 0.4800
 epoch: 7, train_loss: 1.0966, test_loss: 1.0544, test_f1: 0.4914
 epoch: 8, train_loss: 1.0851, test_loss: 1.0535, test_f1: 0.4937
 epoch: 9, train_loss: 1.0743, test_loss: 1.0469, test_f1: 0.4795
 epoch: 10, train_loss: 1.0561, test_loss: 1.0334, test_f1: 0.4827
 epoch: 11, train_loss: 1.0491, test_loss: 1.0306, test_f1: 0.4826
 epoch: 12, train_loss: 1.0380, test_loss: 1.0281, test_f1: 0.4951
 epoch: 13, train_loss: 1.0294, test_loss: 1.0110, test_f1: 0.4906
 epoch: 14, train_loss: 1.0328, test_loss: 1.0268, test_f1: 0.5102
 epoch: 15, train_loss: 1.0120, test_loss: 1.0344, test_f1: 0.4880
 epoch: 16, train_loss: 0.9909, test_loss: 1.0124, test_f1: 0.5053
 epoch: 17, train_loss: 0.9768, test_loss: 0.9977, test_f1: 0.5178
 epoch: 18, train_loss: 0.9615, test_loss: 1.0044, test_f1: 0.5074
 epoch: 19, train_loss: 0.9609, test_loss: 0.9934, test_f1: 0.5268
 epoch: 20, train_loss: 0.9588, test_loss: 0.9930, test_f1: 0.4982
 epoch: 21, train_loss: 0.9494, test_loss: 0.9940, test_f1: 0.5273
 epoch: 22, train_loss: 0.9419, test_loss: 0.9933, test_f1: 0.5084
 epoch: 23, train_loss: 0.9392, test_loss: 0.9947, test_f1: 0.5025
 epoch: 24, train_loss: 0.9163, test_loss: 0.9839, test_f1: 0.5113
 epoch: 25, train_loss: 0.9113, test_loss: 0.9843, test_f1: 0.5291
 epoch: 26, train_loss: 0.9052, test_loss: 0.9817, test_f1: 0.5216
 epoch: 27, train_loss: 0.8925, test_loss: 1.0125, test_f1: 0.4874
 epoch: 28, train_loss: 0.8865, test_loss: 0.9860, test_f1: 0.5188
 epoch: 29, train_loss: 0.8582, test_loss: 0.9739, test_f1: 0.5197
 epoch: 30, train_loss: 0.8758, test_loss: 0.9762, test_f1: 0.5116
 epoch: 31, train_loss: 0.8712, test_loss: 0.9726, test_f1: 0.4933
 epoch: 32, train_loss: 0.8587, test_loss: 0.9734, test_f1: 0.5255
 epoch: 33, train_loss: 0.8469, test_loss: 0.9808, test_f1: 0.5184
 epoch: 34, train_loss: 0.8388, test_loss: 0.9914, test_f1: 0.5060
 epoch: 35, train_loss: 0.8267, test_loss: 0.9941, test_f1: 0.5096
 epoch: 36, train_loss: 0.8177, test_loss: 0.9961, test_f1: 0.5016
 epoch: 37, train_loss: 0.8133, test_loss: 1.0370, test_f1: 0.5019
 epoch: 38, train_loss: 0.8092, test_loss: 1.0146, test_f1: 0.5166
 epoch: 39, train_loss: 0.8040, test_loss: 1.0195, test_f1: 0.5006
 epoch: 40, train_loss: 0.7802, test_loss: 1.0173, test_f1: 0.4996
 epoch: 41, train_loss: 0.7770, test_loss: 1.0636, test_f1: 0.5040
 epoch: 42, train_loss: 0.7665, test_loss: 1.0233, test_f1: 0.5067
 epoch: 43, train_loss: 0.7636, test_loss: 1.0153, test_f1: 0.5238
 epoch: 44, train_loss: 0.7585, test_loss: 1.0355, test_f1: 0.5153
 epoch: 45, train_loss: 0.7543, test_loss: 1.0319, test_f1: 0.5288
 epoch: 46, train_loss: 0.7597, test_loss: 1.0516, test_f1: 0.5327
 epoch: 47, train_loss: 0.7445, test_loss: 1.0644, test_f1: 0.5266
 epoch: 48, train_loss: 0.7332, test_loss: 1.0418, test_f1: 0.5055
 epoch: 49, train_loss: 0.7329, test_loss: 1.0430, test_f1: 0.5325
 epoch: 50, train_loss: 0.7053, test_loss: 1.0529, test_f1: 0.5269
 epoch: 51, train_loss: 0.7071, test_loss: 1.0669, test_f1: 0.5229
 epoch: 52, train_loss: 0.6997, test_loss: 1.0886, test_f1: 0.5138
 epoch: 53, train_loss: 0.6946, test_loss: 1.0783, test_f1: 0.5176
 epoch: 54, train_loss: 0.6831, test_loss: 1.0720, test_f1: 0.5172
 epoch: 55, train_loss: 0.6697, test_loss: 1.0988, test_f1: 0.5160
 epoch: 56, train_loss: 0.6746, test_loss: 1.0840, test_f1: 0.5428
 epoch: 57, train_loss: 0.6797, test_loss: 1.0894, test_f1: 0.5213
 epoch: 58, train_loss: 0.6815, test_loss: 1.1016, test_f1: 0.5259
 epoch: 59, train_loss: 0.6668, test_loss: 1.1022, test_f1: 0.5302
 epoch: 60, train_loss: 0.6762, test_loss: 1.1029, test_f1: 0.5326
 epoch: 61, train_loss: 0.6741, test_loss: 1.1173, test_f1: 0.5287
 epoch: 62, train_loss: 0.6596, test_loss: 1.1073, test_f1: 0.5352
 epoch: 63, train_loss: 0.6598, test_loss: 1.1254, test_f1: 0.5234
 epoch: 64, train_loss: 0.6553, test_loss: 1.1119, test_f1: 0.5246
 epoch: 65, train_loss: 0.6338, test_loss: 1.1327, test_f1: 0.5211
 epoch: 66, train_loss: 0.6346, test_loss: 1.1529, test_f1: 0.5355
 epoch: 67, train_loss: 0.6450, test_loss: 1.1528, test_f1: 0.5261
 epoch: 68, train_loss: 0.6444, test_loss: 1.1531, test_f1: 0.5372
 epoch: 69, train_loss: 0.6279, test_loss: 1.1499, test_f1: 0.5329
 epoch: 70, train_loss: 0.6384, test_loss: 1.1467, test_f1: 0.5442
 epoch: 71, train_loss: 0.6433, test_loss: 1.1338, test_f1: 0.5434
 epoch: 72, train_loss: 0.6410, test_loss: 1.1752, test_f1: 0.5286
 epoch: 73, train_loss: 0.6488, test_loss: 1.1535, test_f1: 0.5197
 epoch: 74, train_loss: 0.6136, test_loss: 1.1784, test_f1: 0.5262
 epoch: 75, train_loss: 0.6174, test_loss: 1.1907, test_f1: 0.5157
 epoch: 76, train_loss: 0.6005, test_loss: 1.1958, test_f1: 0.5070
 epoch: 77, train_loss: 0.6165, test_loss: 1.1948, test_f1: 0.5315
 epoch: 78, train_loss: 0.6032, test_loss: 1.2150, test_f1: 0.5282
 epoch: 79, train_loss: 0.6059, test_loss: 1.1734, test_f1: 0.5402
 epoch: 80, train_loss: 0.6098, test_loss: 1.2049, test_f1: 0.5288
 epoch: 81, train_loss: 0.5935, test_loss: 1.2145, test_f1: 0.5231
 epoch: 82, train_loss: 0.5960, test_loss: 1.2141, test_f1: 0.5409
 epoch: 83, train_loss: 0.5870, test_loss: 1.2373, test_f1: 0.5300
 epoch: 84, train_loss: 0.5771, test_loss: 1.2210, test_f1: 0.5201
 epoch: 85, train_loss: 0.5856, test_loss: 1.2451, test_f1: 0.5359
 epoch: 86, train_loss: 0.5822, test_loss: 1.2557, test_f1: 0.5336
 epoch: 87, train_loss: 0.6023, test_loss: 1.2273, test_f1: 0.5483
 epoch: 88, train_loss: 0.5788, test_loss: 1.2327, test_f1: 0.5462
 epoch: 89, train_loss: 0.5823, test_loss: 1.2592, test_f1: 0.5312
 epoch: 90, train_loss: 0.5816, test_loss: 1.2560, test_f1: 0.5174
 epoch: 91, train_loss: 0.5719, test_loss: 1.2502, test_f1: 0.5309
 epoch: 92, train_loss: 0.5799, test_loss: 1.2431, test_f1: 0.5352
 epoch: 93, train_loss: 0.5648, test_loss: 1.2840, test_f1: 0.5377
 epoch: 94, train_loss: 0.5472, test_loss: 1.2798, test_f1: 0.5271
 epoch: 95, train_loss: 0.5590, test_loss: 1.2527, test_f1: 0.5225
 epoch: 96, train_loss: 0.5382, test_loss: 1.2989, test_f1: 0.5295
 epoch: 97, train_loss: 0.5614, test_loss: 1.3087, test_f1: 0.5194
 epoch: 98, train_loss: 0.5482, test_loss: 1.3106, test_f1: 0.5257
 epoch: 99, train_loss: 0.5480, test_loss: 1.2936, test_f1: 0.5162

Training completed in 485.47 seconds
Best F1: 0.5738 at epoch 61
Mean F1 across iterations: 0.5499  0.0127
========================FINAL RESULTS================================
FEGIN weighted F1: 0.5738  0.0127
python main.py --data ltspice_examples --representation component_component --model FEGIN --layers 4 --hiddens 128 --batch_size 128 --lr 0.0001 --emb_size 128 --epochs 100 --save_appendix component_component_L4_H128_BS128_LR0.0001_E128 --no_val
-----



STDERR:
  File "main.py", line 370, in <module>
    main()
  File "main.py", line 254, in main
    dataset = dataset_class(
  File "/home/philip/projects/ltspice_examples_code_repo/Circuit-Completion-Using-GNNs/component_classification_with_link_prediction_head/evaluation/FEGIN/kernel/circuit_datasets.py", line 15, in __init__
    self.data, self.slices = torch.load(self.processed_paths[0])
  File "/home/philip/.local/lib/python3.8/site-packages/torch/serialization.py", line 1040, in load
    warnings.warn(
  File "/usr/lib/python3.8/warnings.py", line 109, in _showwarnmsg
    sw(msg.message, msg.category, msg.filename, msg.lineno,
  File "main.py", line 47, in warn_with_traceback
    traceback.print_stack(file=log)
/home/philip/projects/ltspice_examples_code_repo/Circuit-Completion-Using-GNNs/component_classification_with_link_prediction_head/evaluation/FEGIN/kernel/circuit_datasets.py:15: FutureWarning: You are using `torch.load` with `weights_only=False` (the current default value), which uses the default pickle module implicitly. It is possible to construct malicious pickle data which will execute arbitrary code during unpickling (See https://github.com/pytorch/pytorch/blob/main/SECURITY.md#untrusted-models for more details). In a future release, the default value for `weights_only` will be flipped to `True`. This limits the functions that could be executed during unpickling. Arbitrary objects will no longer be allowed to be loaded via this mode unless they are explicitly allowlisted by the user via `torch.serialization.add_safe_globals`. We recommend you start setting `weights_only=True` for any use case where you don't have full control of the loaded file. Please open an issue on GitHub for any issues related to this experimental feature.
  self.data, self.slices = torch.load(self.processed_paths[0])
