STDOUT:
Results will be saved in /home/philip/projects/ltspice_examples_code_repo/Circuit-Completion-Using-GNNs/component_classification_with_link_prediction_head/evaluation/FEGIN/results/model_FEGIN_dataset_ltspice_demos
Command line input: python main.py --data ltspice_demos --representation component_net --model FEGIN --layers 3 --hiddens 32 --batch_size 64 --lr 0.001 --emb_size 128 --epochs 100 --save_appendix component_net_L3_H32_BS64_LR0.001_E128 --no_val
 is saved.
-----
ltspice_demos - FEGIN
Using 3 layers, 32 hidden units, h = 2
Loading component_net representation dataset
ENTERED
Training FEGIN on component_net representation
Train: 1565, Test: 383
##################ITERATION #0 ****************************************
 epoch: 0, train_loss: 1.3523, test_loss: 1.3470, test_f1: 0.1368
 epoch: 1, train_loss: 1.2347, test_loss: 1.2735, test_f1: 0.3535
 epoch: 2, train_loss: 1.1515, test_loss: 1.1954, test_f1: 0.3256
 epoch: 3, train_loss: 1.1179, test_loss: 1.1738, test_f1: 0.3967
 epoch: 4, train_loss: 1.0870, test_loss: 1.1506, test_f1: 0.4373
 epoch: 5, train_loss: 1.0570, test_loss: 1.1403, test_f1: 0.4200
 epoch: 6, train_loss: 1.0409, test_loss: 1.1178, test_f1: 0.4354
 epoch: 7, train_loss: 1.0094, test_loss: 1.1109, test_f1: 0.4473
 epoch: 8, train_loss: 0.9861, test_loss: 1.1570, test_f1: 0.4649
 epoch: 9, train_loss: 0.9785, test_loss: 1.1038, test_f1: 0.4487
 epoch: 10, train_loss: 0.9643, test_loss: 1.1131, test_f1: 0.4598
 epoch: 11, train_loss: 0.9440, test_loss: 1.1285, test_f1: 0.4458
 epoch: 12, train_loss: 0.9425, test_loss: 1.1285, test_f1: 0.4710
 epoch: 13, train_loss: 0.9226, test_loss: 1.1077, test_f1: 0.4875
 epoch: 14, train_loss: 0.9288, test_loss: 1.1443, test_f1: 0.5068
 epoch: 15, train_loss: 0.9211, test_loss: 1.1574, test_f1: 0.4919
 epoch: 16, train_loss: 0.9167, test_loss: 1.0642, test_f1: 0.5323
 epoch: 17, train_loss: 0.8942, test_loss: 1.0532, test_f1: 0.5553
 epoch: 18, train_loss: 0.8819, test_loss: 1.1238, test_f1: 0.5054
 epoch: 19, train_loss: 0.8816, test_loss: 1.0915, test_f1: 0.5618
 epoch: 20, train_loss: 0.8771, test_loss: 1.1511, test_f1: 0.5446
 epoch: 21, train_loss: 0.8625, test_loss: 1.0891, test_f1: 0.5622
 epoch: 22, train_loss: 0.8714, test_loss: 1.1037, test_f1: 0.5336
 epoch: 23, train_loss: 0.8500, test_loss: 1.0318, test_f1: 0.5684
 epoch: 24, train_loss: 0.8448, test_loss: 1.0774, test_f1: 0.5724
 epoch: 25, train_loss: 0.8417, test_loss: 1.0715, test_f1: 0.5664
 epoch: 26, train_loss: 0.8306, test_loss: 1.0900, test_f1: 0.5713
 epoch: 27, train_loss: 0.8375, test_loss: 1.0454, test_f1: 0.5316
 epoch: 28, train_loss: 0.8429, test_loss: 1.0971, test_f1: 0.5751
 epoch: 29, train_loss: 0.8281, test_loss: 1.1230, test_f1: 0.5376
 epoch: 30, train_loss: 0.8280, test_loss: 1.1316, test_f1: 0.5100
 epoch: 31, train_loss: 0.8170, test_loss: 1.0769, test_f1: 0.5553
 epoch: 32, train_loss: 0.8080, test_loss: 1.0620, test_f1: 0.5570
 epoch: 33, train_loss: 0.8152, test_loss: 1.0489, test_f1: 0.5898
 epoch: 34, train_loss: 0.7973, test_loss: 1.1257, test_f1: 0.5628
 epoch: 35, train_loss: 0.7916, test_loss: 1.0816, test_f1: 0.5815
 epoch: 36, train_loss: 0.7784, test_loss: 1.0966, test_f1: 0.5631
 epoch: 37, train_loss: 0.8124, test_loss: 1.1614, test_f1: 0.5621
 epoch: 38, train_loss: 0.7702, test_loss: 1.1077, test_f1: 0.5675
 epoch: 39, train_loss: 0.7751, test_loss: 1.0951, test_f1: 0.5575
 epoch: 40, train_loss: 0.7667, test_loss: 1.1261, test_f1: 0.5726
 epoch: 41, train_loss: 0.7566, test_loss: 1.1582, test_f1: 0.5772
 epoch: 42, train_loss: 0.7678, test_loss: 1.1508, test_f1: 0.5384
 epoch: 43, train_loss: 0.7559, test_loss: 1.1604, test_f1: 0.5630
 epoch: 44, train_loss: 0.7403, test_loss: 1.1645, test_f1: 0.5320
 epoch: 45, train_loss: 0.7581, test_loss: 1.1140, test_f1: 0.5633
 epoch: 46, train_loss: 0.7284, test_loss: 1.0960, test_f1: 0.5752
 epoch: 47, train_loss: 0.7508, test_loss: 1.2402, test_f1: 0.5527
 epoch: 48, train_loss: 0.7576, test_loss: 1.1104, test_f1: 0.5893
 epoch: 49, train_loss: 0.7387, test_loss: 1.1157, test_f1: 0.6042
 epoch: 50, train_loss: 0.7417, test_loss: 1.0719, test_f1: 0.6045
 epoch: 51, train_loss: 0.7010, test_loss: 1.1751, test_f1: 0.5754
 epoch: 52, train_loss: 0.6957, test_loss: 1.1550, test_f1: 0.5998
 epoch: 53, train_loss: 0.6888, test_loss: 1.2749, test_f1: 0.5690
 epoch: 54, train_loss: 0.6836, test_loss: 1.1760, test_f1: 0.6039
 epoch: 55, train_loss: 0.6683, test_loss: 1.1941, test_f1: 0.5721
 epoch: 56, train_loss: 0.6751, test_loss: 1.1003, test_f1: 0.6296
 epoch: 57, train_loss: 0.6743, test_loss: 1.2342, test_f1: 0.5820
 epoch: 58, train_loss: 0.6589, test_loss: 1.1270, test_f1: 0.6071
 epoch: 59, train_loss: 0.6697, test_loss: 1.2509, test_f1: 0.5913
 epoch: 60, train_loss: 0.6689, test_loss: 1.1551, test_f1: 0.6024
 epoch: 61, train_loss: 0.6711, test_loss: 1.2253, test_f1: 0.5815
 epoch: 62, train_loss: 0.6638, test_loss: 1.2201, test_f1: 0.5907
 epoch: 63, train_loss: 0.6646, test_loss: 1.1541, test_f1: 0.6141
 epoch: 64, train_loss: 0.6494, test_loss: 1.1653, test_f1: 0.6384
 epoch: 65, train_loss: 0.6623, test_loss: 1.1470, test_f1: 0.6173
 epoch: 66, train_loss: 0.6609, test_loss: 1.1761, test_f1: 0.6387
 epoch: 67, train_loss: 0.6669, test_loss: 1.2123, test_f1: 0.6068
 epoch: 68, train_loss: 0.6390, test_loss: 1.2386, test_f1: 0.6268
 epoch: 69, train_loss: 0.6361, test_loss: 1.2100, test_f1: 0.6032
 epoch: 70, train_loss: 0.6324, test_loss: 1.2625, test_f1: 0.6050
 epoch: 71, train_loss: 0.6339, test_loss: 1.2679, test_f1: 0.6188
 epoch: 72, train_loss: 0.6398, test_loss: 1.2192, test_f1: 0.6115
 epoch: 73, train_loss: 0.6191, test_loss: 1.2012, test_f1: 0.6127
 epoch: 74, train_loss: 0.6368, test_loss: 1.1589, test_f1: 0.6150
 epoch: 75, train_loss: 0.6254, test_loss: 1.1679, test_f1: 0.6041
 epoch: 76, train_loss: 0.6057, test_loss: 1.2291, test_f1: 0.6277
 epoch: 77, train_loss: 0.6000, test_loss: 1.2284, test_f1: 0.6385
 epoch: 78, train_loss: 0.6024, test_loss: 1.3209, test_f1: 0.6051
 epoch: 79, train_loss: 0.6006, test_loss: 1.3212, test_f1: 0.5962
 epoch: 80, train_loss: 0.5849, test_loss: 1.1751, test_f1: 0.6629
 epoch: 81, train_loss: 0.6023, test_loss: 1.2453, test_f1: 0.6014
 epoch: 82, train_loss: 0.5916, test_loss: 1.2273, test_f1: 0.6433
 epoch: 83, train_loss: 0.5933, test_loss: 1.3103, test_f1: 0.6234
 epoch: 84, train_loss: 0.5757, test_loss: 1.2800, test_f1: 0.6288
 epoch: 85, train_loss: 0.5710, test_loss: 1.3078, test_f1: 0.6534
 epoch: 86, train_loss: 0.5878, test_loss: 1.3697, test_f1: 0.5863
 epoch: 87, train_loss: 0.5863, test_loss: 1.2303, test_f1: 0.6493
 epoch: 88, train_loss: 0.5973, test_loss: 1.3295, test_f1: 0.6314
 epoch: 89, train_loss: 0.5731, test_loss: 1.3436, test_f1: 0.6345
 epoch: 90, train_loss: 0.5652, test_loss: 1.2102, test_f1: 0.6326
 epoch: 91, train_loss: 0.5762, test_loss: 1.2986, test_f1: 0.6263
 epoch: 92, train_loss: 0.5912, test_loss: 1.3612, test_f1: 0.6130
 epoch: 93, train_loss: 0.5607, test_loss: 1.2992, test_f1: 0.6267
 epoch: 94, train_loss: 0.5723, test_loss: 1.3351, test_f1: 0.6284
 epoch: 95, train_loss: 0.5428, test_loss: 1.2499, test_f1: 0.6152
 epoch: 96, train_loss: 0.5509, test_loss: 1.3999, test_f1: 0.6368
 epoch: 97, train_loss: 0.5420, test_loss: 1.2666, test_f1: 0.6213
 epoch: 98, train_loss: 0.5389, test_loss: 1.2316, test_f1: 0.6456
 epoch: 99, train_loss: 0.5130, test_loss: 1.2684, test_f1: 0.6198
##################ITERATION #1 ****************************************
 epoch: 0, train_loss: 1.2407, test_loss: 1.2906, test_f1: 0.2281
 epoch: 1, train_loss: 1.1310, test_loss: 1.2115, test_f1: 0.3494
 epoch: 2, train_loss: 1.0858, test_loss: 1.1700, test_f1: 0.4200
 epoch: 3, train_loss: 1.0425, test_loss: 1.1346, test_f1: 0.4361
 epoch: 4, train_loss: 1.0217, test_loss: 1.1271, test_f1: 0.4481
 epoch: 5, train_loss: 1.0070, test_loss: 1.1231, test_f1: 0.4585
 epoch: 6, train_loss: 0.9788, test_loss: 1.0909, test_f1: 0.4736
 epoch: 7, train_loss: 0.9707, test_loss: 1.0878, test_f1: 0.4866
 epoch: 8, train_loss: 0.9458, test_loss: 1.0869, test_f1: 0.4932
 epoch: 9, train_loss: 0.9394, test_loss: 1.0998, test_f1: 0.4917
 epoch: 10, train_loss: 0.9195, test_loss: 1.1315, test_f1: 0.5182
 epoch: 11, train_loss: 0.9059, test_loss: 1.0647, test_f1: 0.5063
 epoch: 12, train_loss: 0.8847, test_loss: 1.0849, test_f1: 0.5523
 epoch: 13, train_loss: 0.8598, test_loss: 1.1266, test_f1: 0.5531
 epoch: 14, train_loss: 0.8697, test_loss: 1.1347, test_f1: 0.5533
 epoch: 15, train_loss: 0.8639, test_loss: 1.1782, test_f1: 0.5291
 epoch: 16, train_loss: 0.8456, test_loss: 1.1165, test_f1: 0.5366
 epoch: 17, train_loss: 0.8544, test_loss: 1.1421, test_f1: 0.5687
 epoch: 18, train_loss: 0.8481, test_loss: 1.0845, test_f1: 0.5739
 epoch: 19, train_loss: 0.8276, test_loss: 1.1509, test_f1: 0.5864
 epoch: 20, train_loss: 0.8194, test_loss: 1.1482, test_f1: 0.5680
 epoch: 21, train_loss: 0.8053, test_loss: 1.1217, test_f1: 0.5878
 epoch: 22, train_loss: 0.8089, test_loss: 1.1640, test_f1: 0.5817
 epoch: 23, train_loss: 0.7805, test_loss: 1.2355, test_f1: 0.5522
 epoch: 24, train_loss: 0.7878, test_loss: 1.1655, test_f1: 0.5966
 epoch: 25, train_loss: 0.7729, test_loss: 1.1588, test_f1: 0.5972
 epoch: 26, train_loss: 0.7741, test_loss: 1.1873, test_f1: 0.5967
 epoch: 27, train_loss: 0.7803, test_loss: 1.2157, test_f1: 0.6044
 epoch: 28, train_loss: 0.7760, test_loss: 1.1421, test_f1: 0.6000
 epoch: 29, train_loss: 0.7434, test_loss: 1.2870, test_f1: 0.5905
 epoch: 30, train_loss: 0.7311, test_loss: 1.2664, test_f1: 0.5705
 epoch: 31, train_loss: 0.7235, test_loss: 1.2155, test_f1: 0.5534
 epoch: 32, train_loss: 0.7372, test_loss: 1.1357, test_f1: 0.5815
 epoch: 33, train_loss: 0.7059, test_loss: 1.2190, test_f1: 0.5806
 epoch: 34, train_loss: 0.7139, test_loss: 1.1830, test_f1: 0.5939
 epoch: 35, train_loss: 0.7238, test_loss: 1.2505, test_f1: 0.5659
 epoch: 36, train_loss: 0.7153, test_loss: 1.2377, test_f1: 0.5906
 epoch: 37, train_loss: 0.7113, test_loss: 1.2040, test_f1: 0.5858
 epoch: 38, train_loss: 0.6967, test_loss: 1.1754, test_f1: 0.5692
 epoch: 39, train_loss: 0.6781, test_loss: 1.2051, test_f1: 0.5599
 epoch: 40, train_loss: 0.6805, test_loss: 1.1554, test_f1: 0.5526
 epoch: 41, train_loss: 0.7034, test_loss: 1.1503, test_f1: 0.5796
 epoch: 42, train_loss: 0.6815, test_loss: 1.1256, test_f1: 0.6004
 epoch: 43, train_loss: 0.6556, test_loss: 1.2503, test_f1: 0.5818
 epoch: 44, train_loss: 0.6469, test_loss: 1.2724, test_f1: 0.5820
 epoch: 45, train_loss: 0.6682, test_loss: 1.3483, test_f1: 0.5963
 epoch: 46, train_loss: 0.6821, test_loss: 1.2472, test_f1: 0.5950
 epoch: 47, train_loss: 0.6499, test_loss: 1.2818, test_f1: 0.5600
 epoch: 48, train_loss: 0.6454, test_loss: 1.3798, test_f1: 0.5882
 epoch: 49, train_loss: 0.6286, test_loss: 1.3005, test_f1: 0.5704
 epoch: 50, train_loss: 0.6381, test_loss: 1.4120, test_f1: 0.5885
 epoch: 51, train_loss: 0.6235, test_loss: 1.3237, test_f1: 0.5594
 epoch: 52, train_loss: 0.5980, test_loss: 1.3745, test_f1: 0.5811
 epoch: 53, train_loss: 0.6098, test_loss: 1.2676, test_f1: 0.5836
 epoch: 54, train_loss: 0.5857, test_loss: 1.3371, test_f1: 0.5788
 epoch: 55, train_loss: 0.5787, test_loss: 1.3397, test_f1: 0.5698
 epoch: 56, train_loss: 0.5827, test_loss: 1.3053, test_f1: 0.5804
 epoch: 57, train_loss: 0.6050, test_loss: 1.4030, test_f1: 0.5737
 epoch: 58, train_loss: 0.5898, test_loss: 1.3282, test_f1: 0.5892
 epoch: 59, train_loss: 0.5801, test_loss: 1.3309, test_f1: 0.6079
 epoch: 60, train_loss: 0.5759, test_loss: 1.4295, test_f1: 0.5785
 epoch: 61, train_loss: 0.5838, test_loss: 1.3962, test_f1: 0.6031
 epoch: 62, train_loss: 0.5657, test_loss: 1.4738, test_f1: 0.6086
 epoch: 63, train_loss: 0.5778, test_loss: 1.4162, test_f1: 0.5686
 epoch: 64, train_loss: 0.5840, test_loss: 1.4196, test_f1: 0.5932
 epoch: 65, train_loss: 0.5687, test_loss: 1.3969, test_f1: 0.5767
 epoch: 66, train_loss: 0.5601, test_loss: 1.5022, test_f1: 0.5751
 epoch: 67, train_loss: 0.5680, test_loss: 1.4370, test_f1: 0.5880
 epoch: 68, train_loss: 0.5632, test_loss: 1.3886, test_f1: 0.6013
 epoch: 69, train_loss: 0.5838, test_loss: 1.5134, test_f1: 0.5985
 epoch: 70, train_loss: 0.5669, test_loss: 1.5080, test_f1: 0.5205
 epoch: 71, train_loss: 0.5464, test_loss: 1.4643, test_f1: 0.6155
 epoch: 72, train_loss: 0.5588, test_loss: 1.4727, test_f1: 0.5989
 epoch: 73, train_loss: 0.5577, test_loss: 1.4377, test_f1: 0.6042
 epoch: 74, train_loss: 0.5262, test_loss: 1.5019, test_f1: 0.6165
 epoch: 75, train_loss: 0.5449, test_loss: 1.4303, test_f1: 0.6068
 epoch: 76, train_loss: 0.5456, test_loss: 1.3899, test_f1: 0.6060
 epoch: 77, train_loss: 0.5445, test_loss: 1.4525, test_f1: 0.6069
 epoch: 78, train_loss: 0.5196, test_loss: 1.4405, test_f1: 0.6252
 epoch: 79, train_loss: 0.5322, test_loss: 1.4603, test_f1: 0.5729
 epoch: 80, train_loss: 0.5161, test_loss: 1.5003, test_f1: 0.5889
 epoch: 81, train_loss: 0.5189, test_loss: 1.5353, test_f1: 0.6095
 epoch: 82, train_loss: 0.5219, test_loss: 1.5469, test_f1: 0.6004
 epoch: 83, train_loss: 0.5193, test_loss: 1.4626, test_f1: 0.5979
 epoch: 84, train_loss: 0.5314, test_loss: 1.5768, test_f1: 0.5933
 epoch: 85, train_loss: 0.5133, test_loss: 1.5061, test_f1: 0.5855
 epoch: 86, train_loss: 0.5477, test_loss: 1.4579, test_f1: 0.6152
 epoch: 87, train_loss: 0.5476, test_loss: 1.5448, test_f1: 0.6266
 epoch: 88, train_loss: 0.5275, test_loss: 1.5487, test_f1: 0.6063
 epoch: 89, train_loss: 0.5181, test_loss: 1.4807, test_f1: 0.6234
 epoch: 90, train_loss: 0.4994, test_loss: 1.6346, test_f1: 0.5960
 epoch: 91, train_loss: 0.5036, test_loss: 1.5670, test_f1: 0.5831
 epoch: 92, train_loss: 0.4832, test_loss: 1.5302, test_f1: 0.6021
 epoch: 93, train_loss: 0.4954, test_loss: 1.5500, test_f1: 0.5882
 epoch: 94, train_loss: 0.4823, test_loss: 1.6504, test_f1: 0.5884
 epoch: 95, train_loss: 0.4836, test_loss: 1.5604, test_f1: 0.6142
 epoch: 96, train_loss: 0.4689, test_loss: 1.5282, test_f1: 0.6221
 epoch: 97, train_loss: 0.4777, test_loss: 1.6338, test_f1: 0.5959
 epoch: 98, train_loss: 0.4603, test_loss: 1.8017, test_f1: 0.5843
 epoch: 99, train_loss: 0.4787, test_loss: 1.7160, test_f1: 0.5701
##################ITERATION #2 ****************************************
 epoch: 0, train_loss: 1.2052, test_loss: 1.3031, test_f1: 0.2585
 epoch: 1, train_loss: 1.1082, test_loss: 1.2762, test_f1: 0.3161
 epoch: 2, train_loss: 1.0672, test_loss: 1.1951, test_f1: 0.4008
 epoch: 3, train_loss: 1.0372, test_loss: 1.1317, test_f1: 0.4918
 epoch: 4, train_loss: 1.0160, test_loss: 1.1266, test_f1: 0.5191
 epoch: 5, train_loss: 0.9960, test_loss: 1.1173, test_f1: 0.5111
 epoch: 6, train_loss: 0.9690, test_loss: 1.1039, test_f1: 0.5217
 epoch: 7, train_loss: 0.9536, test_loss: 1.1111, test_f1: 0.5395
 epoch: 8, train_loss: 0.9569, test_loss: 1.1131, test_f1: 0.5419
 epoch: 9, train_loss: 0.9351, test_loss: 1.0832, test_f1: 0.5293
 epoch: 10, train_loss: 0.9234, test_loss: 1.1055, test_f1: 0.5366
 epoch: 11, train_loss: 0.8968, test_loss: 1.1105, test_f1: 0.5281
 epoch: 12, train_loss: 0.9004, test_loss: 1.1229, test_f1: 0.5313
 epoch: 13, train_loss: 0.8798, test_loss: 1.1264, test_f1: 0.5334
 epoch: 14, train_loss: 0.8853, test_loss: 1.0749, test_f1: 0.5750
 epoch: 15, train_loss: 0.8913, test_loss: 1.0895, test_f1: 0.5834
 epoch: 16, train_loss: 0.8761, test_loss: 1.0625, test_f1: 0.5468
 epoch: 17, train_loss: 0.8715, test_loss: 1.0742, test_f1: 0.5752
 epoch: 18, train_loss: 0.8571, test_loss: 1.0713, test_f1: 0.5700
 epoch: 19, train_loss: 0.8542, test_loss: 1.0594, test_f1: 0.5739
 epoch: 20, train_loss: 0.8519, test_loss: 1.1096, test_f1: 0.5502
 epoch: 21, train_loss: 0.8295, test_loss: 1.0954, test_f1: 0.5785
 epoch: 22, train_loss: 0.8187, test_loss: 1.0851, test_f1: 0.5654
 epoch: 23, train_loss: 0.8213, test_loss: 1.1055, test_f1: 0.5632
 epoch: 24, train_loss: 0.8213, test_loss: 1.1074, test_f1: 0.5918
 epoch: 25, train_loss: 0.8074, test_loss: 1.0798, test_f1: 0.6154
 epoch: 26, train_loss: 0.8346, test_loss: 1.0125, test_f1: 0.5901
 epoch: 27, train_loss: 0.8142, test_loss: 1.0389, test_f1: 0.6176
 epoch: 28, train_loss: 0.7978, test_loss: 1.0589, test_f1: 0.5924
 epoch: 29, train_loss: 0.7973, test_loss: 1.0539, test_f1: 0.5987
 epoch: 30, train_loss: 0.7870, test_loss: 1.1359, test_f1: 0.5905
 epoch: 31, train_loss: 0.7729, test_loss: 1.0032, test_f1: 0.6163
 epoch: 32, train_loss: 0.7722, test_loss: 1.0980, test_f1: 0.6022
 epoch: 33, train_loss: 0.7749, test_loss: 1.0879, test_f1: 0.6173
 epoch: 34, train_loss: 0.7668, test_loss: 1.0348, test_f1: 0.5914
 epoch: 35, train_loss: 0.7637, test_loss: 1.1892, test_f1: 0.5918
 epoch: 36, train_loss: 0.7618, test_loss: 1.0995, test_f1: 0.6137
 epoch: 37, train_loss: 0.7447, test_loss: 1.0847, test_f1: 0.6124
 epoch: 38, train_loss: 0.7623, test_loss: 1.1049, test_f1: 0.6459
 epoch: 39, train_loss: 0.7475, test_loss: 1.1015, test_f1: 0.6000
 epoch: 40, train_loss: 0.7324, test_loss: 1.0791, test_f1: 0.6260
 epoch: 41, train_loss: 0.7520, test_loss: 1.1493, test_f1: 0.5770
 epoch: 42, train_loss: 0.7398, test_loss: 1.1183, test_f1: 0.6256
 epoch: 43, train_loss: 0.7263, test_loss: 1.1255, test_f1: 0.5911
 epoch: 44, train_loss: 0.7127, test_loss: 1.1576, test_f1: 0.6011
 epoch: 45, train_loss: 0.7126, test_loss: 1.1429, test_f1: 0.6137
 epoch: 46, train_loss: 0.7279, test_loss: 1.1119, test_f1: 0.5976
 epoch: 47, train_loss: 0.7222, test_loss: 1.1338, test_f1: 0.5908
 epoch: 48, train_loss: 0.7040, test_loss: 1.1704, test_f1: 0.6036
 epoch: 49, train_loss: 0.7137, test_loss: 1.1805, test_f1: 0.5891
 epoch: 50, train_loss: 0.7067, test_loss: 1.1281, test_f1: 0.6397
 epoch: 51, train_loss: 0.6838, test_loss: 1.1304, test_f1: 0.5881
 epoch: 52, train_loss: 0.6776, test_loss: 1.1537, test_f1: 0.6198
 epoch: 53, train_loss: 0.6521, test_loss: 1.1200, test_f1: 0.6362
 epoch: 54, train_loss: 0.6556, test_loss: 1.2076, test_f1: 0.5895
 epoch: 55, train_loss: 0.6710, test_loss: 1.1051, test_f1: 0.6300
 epoch: 56, train_loss: 0.6728, test_loss: 1.2594, test_f1: 0.5874
 epoch: 57, train_loss: 0.6603, test_loss: 1.1431, test_f1: 0.6144
 epoch: 58, train_loss: 0.6574, test_loss: 1.2035, test_f1: 0.5775
 epoch: 59, train_loss: 0.6436, test_loss: 1.2363, test_f1: 0.6265
 epoch: 60, train_loss: 0.6317, test_loss: 1.1989, test_f1: 0.6197
 epoch: 61, train_loss: 0.6421, test_loss: 1.1990, test_f1: 0.6282
 epoch: 62, train_loss: 0.6291, test_loss: 1.2192, test_f1: 0.5690
 epoch: 63, train_loss: 0.6415, test_loss: 1.2353, test_f1: 0.6261
 epoch: 64, train_loss: 0.6239, test_loss: 1.1531, test_f1: 0.6335
 epoch: 65, train_loss: 0.6457, test_loss: 1.1861, test_f1: 0.6278
 epoch: 66, train_loss: 0.6319, test_loss: 1.1960, test_f1: 0.6100
 epoch: 67, train_loss: 0.6073, test_loss: 1.2337, test_f1: 0.5806
 epoch: 68, train_loss: 0.6203, test_loss: 1.2537, test_f1: 0.6182
 epoch: 69, train_loss: 0.6068, test_loss: 1.2445, test_f1: 0.6305
 epoch: 70, train_loss: 0.6264, test_loss: 1.2638, test_f1: 0.5975
 epoch: 71, train_loss: 0.6238, test_loss: 1.2423, test_f1: 0.6505
 epoch: 72, train_loss: 0.6262, test_loss: 1.2091, test_f1: 0.6412
 epoch: 73, train_loss: 0.6164, test_loss: 1.2153, test_f1: 0.6051
 epoch: 74, train_loss: 0.6103, test_loss: 1.2315, test_f1: 0.6035
 epoch: 75, train_loss: 0.6079, test_loss: 1.1842, test_f1: 0.5904
 epoch: 76, train_loss: 0.6072, test_loss: 1.2226, test_f1: 0.6208
 epoch: 77, train_loss: 0.6142, test_loss: 1.2118, test_f1: 0.5932
 epoch: 78, train_loss: 0.5934, test_loss: 1.2628, test_f1: 0.5652
 epoch: 79, train_loss: 0.6081, test_loss: 1.1940, test_f1: 0.6088
 epoch: 80, train_loss: 0.5959, test_loss: 1.2565, test_f1: 0.5642
 epoch: 81, train_loss: 0.5645, test_loss: 1.2826, test_f1: 0.5602
 epoch: 82, train_loss: 0.5785, test_loss: 1.1803, test_f1: 0.6062
 epoch: 83, train_loss: 0.5775, test_loss: 1.3007, test_f1: 0.6045
 epoch: 84, train_loss: 0.5785, test_loss: 1.2990, test_f1: 0.6200
 epoch: 85, train_loss: 0.5766, test_loss: 1.3631, test_f1: 0.5981
 epoch: 86, train_loss: 0.5750, test_loss: 1.2773, test_f1: 0.6126
 epoch: 87, train_loss: 0.5706, test_loss: 1.2389, test_f1: 0.6062
 epoch: 88, train_loss: 0.5729, test_loss: 1.3212, test_f1: 0.6343
 epoch: 89, train_loss: 0.5699, test_loss: 1.2944, test_f1: 0.5932
 epoch: 90, train_loss: 0.5465, test_loss: 1.2435, test_f1: 0.6321
 epoch: 91, train_loss: 0.5718, test_loss: 1.2926, test_f1: 0.6413
 epoch: 92, train_loss: 0.5302, test_loss: 1.3979, test_f1: 0.6065
 epoch: 93, train_loss: 0.5539, test_loss: 1.3302, test_f1: 0.5975
 epoch: 94, train_loss: 0.5551, test_loss: 1.2773, test_f1: 0.6027
 epoch: 95, train_loss: 0.5381, test_loss: 1.2589, test_f1: 0.6113
 epoch: 96, train_loss: 0.5173, test_loss: 1.5481, test_f1: 0.6026
 epoch: 97, train_loss: 0.5270, test_loss: 1.3687, test_f1: 0.6064
 epoch: 98, train_loss: 0.5451, test_loss: 1.4136, test_f1: 0.5531
 epoch: 99, train_loss: 0.5539, test_loss: 1.4487, test_f1: 0.5920
##################ITERATION #3 ****************************************
 epoch: 0, train_loss: 1.3092, test_loss: 1.2832, test_f1: 0.3176
 epoch: 1, train_loss: 1.1028, test_loss: 1.1993, test_f1: 0.4890
 epoch: 2, train_loss: 1.0579, test_loss: 1.1253, test_f1: 0.4881
 epoch: 3, train_loss: 1.0337, test_loss: 1.1250, test_f1: 0.4946
 epoch: 4, train_loss: 1.0136, test_loss: 1.1114, test_f1: 0.5100
 epoch: 5, train_loss: 0.9894, test_loss: 1.1029, test_f1: 0.5196
 epoch: 6, train_loss: 0.9418, test_loss: 1.0813, test_f1: 0.5169
 epoch: 7, train_loss: 0.9469, test_loss: 1.0856, test_f1: 0.5261
 epoch: 8, train_loss: 0.9401, test_loss: 1.1407, test_f1: 0.5307
 epoch: 9, train_loss: 0.9258, test_loss: 1.0924, test_f1: 0.5148
 epoch: 10, train_loss: 0.9201, test_loss: 1.0988, test_f1: 0.5572
 epoch: 11, train_loss: 0.8966, test_loss: 1.0788, test_f1: 0.5564
 epoch: 12, train_loss: 0.8960, test_loss: 1.0598, test_f1: 0.5761
 epoch: 13, train_loss: 0.8881, test_loss: 1.1212, test_f1: 0.5650
 epoch: 14, train_loss: 0.8723, test_loss: 1.0665, test_f1: 0.5543
 epoch: 15, train_loss: 0.8614, test_loss: 1.0879, test_f1: 0.5683
 epoch: 16, train_loss: 0.8615, test_loss: 1.0288, test_f1: 0.5767
 epoch: 17, train_loss: 0.8649, test_loss: 1.1116, test_f1: 0.5713
 epoch: 18, train_loss: 0.8385, test_loss: 1.1380, test_f1: 0.5532
 epoch: 19, train_loss: 0.8521, test_loss: 1.1108, test_f1: 0.5581
 epoch: 20, train_loss: 0.8405, test_loss: 1.1325, test_f1: 0.5499
 epoch: 21, train_loss: 0.8371, test_loss: 1.0475, test_f1: 0.5859
 epoch: 22, train_loss: 0.8144, test_loss: 1.0186, test_f1: 0.6038
 epoch: 23, train_loss: 0.8024, test_loss: 1.0785, test_f1: 0.5606
 epoch: 24, train_loss: 0.7980, test_loss: 1.0750, test_f1: 0.5868
 epoch: 25, train_loss: 0.7959, test_loss: 1.0846, test_f1: 0.6134
 epoch: 26, train_loss: 0.7786, test_loss: 1.0313, test_f1: 0.5581
 epoch: 27, train_loss: 0.7490, test_loss: 1.1345, test_f1: 0.5923
 epoch: 28, train_loss: 0.7857, test_loss: 1.0504, test_f1: 0.5887
 epoch: 29, train_loss: 0.7624, test_loss: 1.0983, test_f1: 0.5617
 epoch: 30, train_loss: 0.7534, test_loss: 1.0267, test_f1: 0.6055
 epoch: 31, train_loss: 0.7552, test_loss: 1.1224, test_f1: 0.6110
 epoch: 32, train_loss: 0.7393, test_loss: 1.0293, test_f1: 0.6104
 epoch: 33, train_loss: 0.7342, test_loss: 1.0682, test_f1: 0.5928
 epoch: 34, train_loss: 0.7266, test_loss: 1.0576, test_f1: 0.5795
 epoch: 35, train_loss: 0.6989, test_loss: 1.1206, test_f1: 0.6217
 epoch: 36, train_loss: 0.6916, test_loss: 1.0294, test_f1: 0.6503
 epoch: 37, train_loss: 0.6978, test_loss: 1.1650, test_f1: 0.5575
 epoch: 38, train_loss: 0.6973, test_loss: 1.1314, test_f1: 0.6053
 epoch: 39, train_loss: 0.7105, test_loss: 1.2364, test_f1: 0.5422
 epoch: 40, train_loss: 0.6836, test_loss: 1.2869, test_f1: 0.5661
 epoch: 41, train_loss: 0.6734, test_loss: 1.1108, test_f1: 0.6034
 epoch: 42, train_loss: 0.6636, test_loss: 1.2426, test_f1: 0.5594
 epoch: 43, train_loss: 0.6612, test_loss: 1.2056, test_f1: 0.5838
 epoch: 44, train_loss: 0.6630, test_loss: 1.2429, test_f1: 0.5856
 epoch: 45, train_loss: 0.6635, test_loss: 1.2770, test_f1: 0.5860
 epoch: 46, train_loss: 0.6422, test_loss: 1.1242, test_f1: 0.5647
 epoch: 47, train_loss: 0.6402, test_loss: 1.2076, test_f1: 0.5944
 epoch: 48, train_loss: 0.6271, test_loss: 1.3236, test_f1: 0.5670
 epoch: 49, train_loss: 0.5961, test_loss: 1.4078, test_f1: 0.5859
 epoch: 50, train_loss: 0.5879, test_loss: 1.2094, test_f1: 0.5541
 epoch: 51, train_loss: 0.5931, test_loss: 1.1961, test_f1: 0.6319
 epoch: 52, train_loss: 0.5747, test_loss: 1.2002, test_f1: 0.6383
 epoch: 53, train_loss: 0.5683, test_loss: 1.2517, test_f1: 0.6317
 epoch: 54, train_loss: 0.5575, test_loss: 1.2329, test_f1: 0.6417
 epoch: 55, train_loss: 0.5824, test_loss: 1.3253, test_f1: 0.5963
 epoch: 56, train_loss: 0.5474, test_loss: 1.3369, test_f1: 0.6331
 epoch: 57, train_loss: 0.5326, test_loss: 1.2875, test_f1: 0.6174
 epoch: 58, train_loss: 0.5443, test_loss: 1.2776, test_f1: 0.6180
 epoch: 59, train_loss: 0.5206, test_loss: 1.2460, test_f1: 0.6405
 epoch: 60, train_loss: 0.5516, test_loss: 1.3343, test_f1: 0.5836
 epoch: 61, train_loss: 0.5423, test_loss: 1.3396, test_f1: 0.6501
 epoch: 62, train_loss: 0.5402, test_loss: 1.3869, test_f1: 0.6034
 epoch: 63, train_loss: 0.5307, test_loss: 1.3928, test_f1: 0.6246
 epoch: 64, train_loss: 0.5318, test_loss: 1.3501, test_f1: 0.5903
 epoch: 65, train_loss: 0.5072, test_loss: 1.3162, test_f1: 0.6394
 epoch: 66, train_loss: 0.5159, test_loss: 1.3340, test_f1: 0.5719
 epoch: 67, train_loss: 0.5204, test_loss: 1.4664, test_f1: 0.6137
 epoch: 68, train_loss: 0.5266, test_loss: 1.4031, test_f1: 0.6436
 epoch: 69, train_loss: 0.5190, test_loss: 1.4826, test_f1: 0.6243
 epoch: 70, train_loss: 0.5281, test_loss: 1.4456, test_f1: 0.6336
 epoch: 71, train_loss: 0.5073, test_loss: 1.3909, test_f1: 0.5894
 epoch: 72, train_loss: 0.5120, test_loss: 1.4274, test_f1: 0.6167
 epoch: 73, train_loss: 0.5058, test_loss: 1.4082, test_f1: 0.6265
 epoch: 74, train_loss: 0.5099, test_loss: 1.4137, test_f1: 0.6232
 epoch: 75, train_loss: 0.5037, test_loss: 1.4857, test_f1: 0.6119
 epoch: 76, train_loss: 0.4964, test_loss: 1.4595, test_f1: 0.6349
 epoch: 77, train_loss: 0.4745, test_loss: 1.5889, test_f1: 0.6350
 epoch: 78, train_loss: 0.4809, test_loss: 1.4744, test_f1: 0.6545
 epoch: 79, train_loss: 0.5024, test_loss: 1.5650, test_f1: 0.6324
 epoch: 80, train_loss: 0.4716, test_loss: 1.5522, test_f1: 0.6244
 epoch: 81, train_loss: 0.4708, test_loss: 1.5117, test_f1: 0.6317
 epoch: 82, train_loss: 0.5056, test_loss: 1.4960, test_f1: 0.6125
 epoch: 83, train_loss: 0.4691, test_loss: 1.5657, test_f1: 0.6256
 epoch: 84, train_loss: 0.4563, test_loss: 1.4756, test_f1: 0.6397
 epoch: 85, train_loss: 0.4700, test_loss: 1.4494, test_f1: 0.6287
 epoch: 86, train_loss: 0.4540, test_loss: 1.6630, test_f1: 0.6363
 epoch: 87, train_loss: 0.4680, test_loss: 1.5553, test_f1: 0.6433
 epoch: 88, train_loss: 0.4652, test_loss: 1.5392, test_f1: 0.6182
 epoch: 89, train_loss: 0.4619, test_loss: 1.5493, test_f1: 0.6132
 epoch: 90, train_loss: 0.4403, test_loss: 1.6223, test_f1: 0.6252
 epoch: 91, train_loss: 0.4512, test_loss: 1.5759, test_f1: 0.6276
 epoch: 92, train_loss: 0.4434, test_loss: 1.6387, test_f1: 0.6387
 epoch: 93, train_loss: 0.4239, test_loss: 1.6427, test_f1: 0.6165
 epoch: 94, train_loss: 0.4261, test_loss: 1.7352, test_f1: 0.6346
 epoch: 95, train_loss: 0.4325, test_loss: 1.5403, test_f1: 0.6254
 epoch: 96, train_loss: 0.4395, test_loss: 1.6204, test_f1: 0.6277
 epoch: 97, train_loss: 0.4439, test_loss: 1.7283, test_f1: 0.6207
 epoch: 98, train_loss: 0.4403, test_loss: 1.6179, test_f1: 0.6037
 epoch: 99, train_loss: 0.4413, test_loss: 1.7064, test_f1: 0.6426
##################ITERATION #4 ****************************************
 epoch: 0, train_loss: 1.2173, test_loss: 1.2660, test_f1: 0.3123
 epoch: 1, train_loss: 1.1223, test_loss: 1.1933, test_f1: 0.3816
 epoch: 2, train_loss: 1.0667, test_loss: 1.1166, test_f1: 0.4574
 epoch: 3, train_loss: 1.0334, test_loss: 1.0917, test_f1: 0.4698
 epoch: 4, train_loss: 1.0057, test_loss: 1.0734, test_f1: 0.5156
 epoch: 5, train_loss: 0.9921, test_loss: 1.0485, test_f1: 0.5135
 epoch: 6, train_loss: 0.9666, test_loss: 1.0433, test_f1: 0.5057
 epoch: 7, train_loss: 0.9690, test_loss: 1.0657, test_f1: 0.4989
 epoch: 8, train_loss: 0.9456, test_loss: 1.0547, test_f1: 0.4817
 epoch: 9, train_loss: 0.9326, test_loss: 1.0616, test_f1: 0.5263
 epoch: 10, train_loss: 0.9099, test_loss: 1.0655, test_f1: 0.4990
 epoch: 11, train_loss: 0.9250, test_loss: 1.0739, test_f1: 0.5093
 epoch: 12, train_loss: 0.9033, test_loss: 1.0359, test_f1: 0.5401
 epoch: 13, train_loss: 0.9044, test_loss: 1.0370, test_f1: 0.5455
 epoch: 14, train_loss: 0.8791, test_loss: 1.0210, test_f1: 0.5813
 epoch: 15, train_loss: 0.8730, test_loss: 1.0101, test_f1: 0.5541
 epoch: 16, train_loss: 0.8803, test_loss: 1.0499, test_f1: 0.5808
 epoch: 17, train_loss: 0.8524, test_loss: 1.0378, test_f1: 0.5509
 epoch: 18, train_loss: 0.8682, test_loss: 1.0158, test_f1: 0.5570
 epoch: 19, train_loss: 0.8610, test_loss: 1.0519, test_f1: 0.5412
 epoch: 20, train_loss: 0.8432, test_loss: 1.0349, test_f1: 0.5779
 epoch: 21, train_loss: 0.8388, test_loss: 1.0166, test_f1: 0.5636
 epoch: 22, train_loss: 0.8301, test_loss: 1.0176, test_f1: 0.5693
 epoch: 23, train_loss: 0.8083, test_loss: 0.9676, test_f1: 0.6268
 epoch: 24, train_loss: 0.8099, test_loss: 1.0470, test_f1: 0.5918
 epoch: 25, train_loss: 0.8298, test_loss: 1.1055, test_f1: 0.5302
 epoch: 26, train_loss: 0.8102, test_loss: 1.0309, test_f1: 0.5824
 epoch: 27, train_loss: 0.7887, test_loss: 1.0431, test_f1: 0.5647
 epoch: 28, train_loss: 0.7684, test_loss: 1.0129, test_f1: 0.6277
 epoch: 29, train_loss: 0.7716, test_loss: 1.0101, test_f1: 0.5963
 epoch: 30, train_loss: 0.7721, test_loss: 1.0647, test_f1: 0.5794
 epoch: 31, train_loss: 0.7531, test_loss: 1.0562, test_f1: 0.6168
 epoch: 32, train_loss: 0.7461, test_loss: 1.1361, test_f1: 0.5304
 epoch: 33, train_loss: 0.7394, test_loss: 1.0673, test_f1: 0.5766
 epoch: 34, train_loss: 0.7494, test_loss: 1.0400, test_f1: 0.5637
 epoch: 35, train_loss: 0.7458, test_loss: 1.2917, test_f1: 0.5064
 epoch: 36, train_loss: 0.7277, test_loss: 1.0733, test_f1: 0.5995
 epoch: 37, train_loss: 0.7207, test_loss: 1.0365, test_f1: 0.5865
 epoch: 38, train_loss: 0.7048, test_loss: 1.0532, test_f1: 0.5878
 epoch: 39, train_loss: 0.6901, test_loss: 1.1203, test_f1: 0.5766
 epoch: 40, train_loss: 0.6868, test_loss: 1.2021, test_f1: 0.5455
 epoch: 41, train_loss: 0.6934, test_loss: 1.2975, test_f1: 0.5159
 epoch: 42, train_loss: 0.6905, test_loss: 1.0801, test_f1: 0.6244
 epoch: 43, train_loss: 0.6920, test_loss: 1.1229, test_f1: 0.6158
 epoch: 44, train_loss: 0.6757, test_loss: 1.1010, test_f1: 0.6082
 epoch: 45, train_loss: 0.6407, test_loss: 1.0660, test_f1: 0.6154
 epoch: 46, train_loss: 0.6623, test_loss: 1.0474, test_f1: 0.6556
 epoch: 47, train_loss: 0.6576, test_loss: 1.2401, test_f1: 0.5718
 epoch: 48, train_loss: 0.6646, test_loss: 1.2330, test_f1: 0.5636
 epoch: 49, train_loss: 0.6261, test_loss: 1.1034, test_f1: 0.6597
 epoch: 50, train_loss: 0.6225, test_loss: 1.2402, test_f1: 0.5965
 epoch: 51, train_loss: 0.6023, test_loss: 1.0845, test_f1: 0.6348
 epoch: 52, train_loss: 0.6026, test_loss: 1.1105, test_f1: 0.6233
 epoch: 53, train_loss: 0.5993, test_loss: 1.2067, test_f1: 0.5893
 epoch: 54, train_loss: 0.5745, test_loss: 1.2006, test_f1: 0.6334
 epoch: 55, train_loss: 0.5778, test_loss: 1.1962, test_f1: 0.6165
 epoch: 56, train_loss: 0.5707, test_loss: 1.1009, test_f1: 0.6529
 epoch: 57, train_loss: 0.5559, test_loss: 1.2001, test_f1: 0.6006
 epoch: 58, train_loss: 0.5575, test_loss: 1.2155, test_f1: 0.6317
 epoch: 59, train_loss: 0.5697, test_loss: 1.2081, test_f1: 0.6250
 epoch: 60, train_loss: 0.5495, test_loss: 1.1655, test_f1: 0.6359
 epoch: 61, train_loss: 0.5529, test_loss: 1.1284, test_f1: 0.6418
 epoch: 62, train_loss: 0.5402, test_loss: 1.2257, test_f1: 0.6067
 epoch: 63, train_loss: 0.5542, test_loss: 1.2039, test_f1: 0.6238
 epoch: 64, train_loss: 0.5566, test_loss: 1.2615, test_f1: 0.6377
 epoch: 65, train_loss: 0.5285, test_loss: 1.2439, test_f1: 0.6345
 epoch: 66, train_loss: 0.5496, test_loss: 1.2880, test_f1: 0.6129
 epoch: 67, train_loss: 0.5256, test_loss: 1.3133, test_f1: 0.5688
 epoch: 68, train_loss: 0.5202, test_loss: 1.2742, test_f1: 0.6007
 epoch: 69, train_loss: 0.5271, test_loss: 1.3014, test_f1: 0.6033
 epoch: 70, train_loss: 0.5142, test_loss: 1.2325, test_f1: 0.6225
 epoch: 71, train_loss: 0.5226, test_loss: 1.3515, test_f1: 0.5892
 epoch: 72, train_loss: 0.4959, test_loss: 1.2971, test_f1: 0.6008
 epoch: 73, train_loss: 0.5397, test_loss: 1.3792, test_f1: 0.6252
 epoch: 74, train_loss: 0.5196, test_loss: 1.3282, test_f1: 0.6054
 epoch: 75, train_loss: 0.5176, test_loss: 1.5180, test_f1: 0.5651
 epoch: 76, train_loss: 0.4990, test_loss: 1.3246, test_f1: 0.6238
 epoch: 77, train_loss: 0.4844, test_loss: 1.3819, test_f1: 0.6167
 epoch: 78, train_loss: 0.4951, test_loss: 1.4451, test_f1: 0.5907
 epoch: 79, train_loss: 0.5103, test_loss: 1.3758, test_f1: 0.6166
 epoch: 80, train_loss: 0.4908, test_loss: 1.2780, test_f1: 0.6233
 epoch: 81, train_loss: 0.4923, test_loss: 1.3152, test_f1: 0.6232
 epoch: 82, train_loss: 0.4985, test_loss: 1.4567, test_f1: 0.5933
 epoch: 83, train_loss: 0.4998, test_loss: 1.3084, test_f1: 0.6264
 epoch: 84, train_loss: 0.4682, test_loss: 1.3305, test_f1: 0.6174
 epoch: 85, train_loss: 0.4607, test_loss: 1.4105, test_f1: 0.6246
 epoch: 86, train_loss: 0.4826, test_loss: 1.3540, test_f1: 0.6452
 epoch: 87, train_loss: 0.4994, test_loss: 1.4373, test_f1: 0.6060
 epoch: 88, train_loss: 0.4621, test_loss: 1.3684, test_f1: 0.6343
 epoch: 89, train_loss: 0.4587, test_loss: 1.3470, test_f1: 0.6230
 epoch: 90, train_loss: 0.4743, test_loss: 1.4930, test_f1: 0.5936
 epoch: 91, train_loss: 0.4796, test_loss: 1.3971, test_f1: 0.6331
 epoch: 92, train_loss: 0.4436, test_loss: 1.5270, test_f1: 0.6195
 epoch: 93, train_loss: 0.4656, test_loss: 1.5384, test_f1: 0.5945
 epoch: 94, train_loss: 0.4554, test_loss: 1.5443, test_f1: 0.5900
 epoch: 95, train_loss: 0.4440, test_loss: 1.4900, test_f1: 0.5887
 epoch: 96, train_loss: 0.4426, test_loss: 1.4210, test_f1: 0.6055
 epoch: 97, train_loss: 0.4526, test_loss: 1.6195, test_f1: 0.5923
 epoch: 98, train_loss: 0.4389, test_loss: 1.5226, test_f1: 0.6036
 epoch: 99, train_loss: 0.4442, test_loss: 1.5667, test_f1: 0.5942
##################ITERATION #5 ****************************************
 epoch: 0, train_loss: 1.2930, test_loss: 1.2567, test_f1: 0.2865
 epoch: 1, train_loss: 1.1396, test_loss: 1.2235, test_f1: 0.3470
 epoch: 2, train_loss: 1.0911, test_loss: 1.1611, test_f1: 0.4234
 epoch: 3, train_loss: 1.0601, test_loss: 1.1648, test_f1: 0.4200
 epoch: 4, train_loss: 1.0273, test_loss: 1.1583, test_f1: 0.3976
 epoch: 5, train_loss: 1.0082, test_loss: 1.1181, test_f1: 0.4558
 epoch: 6, train_loss: 1.0032, test_loss: 1.1310, test_f1: 0.4688
 epoch: 7, train_loss: 0.9821, test_loss: 1.0966, test_f1: 0.5050
 epoch: 8, train_loss: 0.9654, test_loss: 1.1249, test_f1: 0.4981
 epoch: 9, train_loss: 0.9629, test_loss: 1.1031, test_f1: 0.4908
 epoch: 10, train_loss: 0.9472, test_loss: 1.0752, test_f1: 0.4898
 epoch: 11, train_loss: 0.9371, test_loss: 1.0749, test_f1: 0.5260
 epoch: 12, train_loss: 0.9164, test_loss: 1.0481, test_f1: 0.5403
 epoch: 13, train_loss: 0.9043, test_loss: 1.0653, test_f1: 0.5424
 epoch: 14, train_loss: 0.9071, test_loss: 1.0890, test_f1: 0.5766
 epoch: 15, train_loss: 0.8951, test_loss: 1.0608, test_f1: 0.5604
 epoch: 16, train_loss: 0.9066, test_loss: 1.0420, test_f1: 0.5662
 epoch: 17, train_loss: 0.8905, test_loss: 1.0398, test_f1: 0.5365
 epoch: 18, train_loss: 0.8507, test_loss: 1.0425, test_f1: 0.5453
 epoch: 19, train_loss: 0.8607, test_loss: 1.0787, test_f1: 0.5198
 epoch: 20, train_loss: 0.8500, test_loss: 1.0309, test_f1: 0.5714
 epoch: 21, train_loss: 0.8467, test_loss: 1.0616, test_f1: 0.5592
 epoch: 22, train_loss: 0.8304, test_loss: 1.1121, test_f1: 0.5314
 epoch: 23, train_loss: 0.8143, test_loss: 1.1759, test_f1: 0.5688
 epoch: 24, train_loss: 0.8210, test_loss: 1.0444, test_f1: 0.5349
 epoch: 25, train_loss: 0.8258, test_loss: 1.0505, test_f1: 0.5909
 epoch: 26, train_loss: 0.8193, test_loss: 1.0240, test_f1: 0.5851
 epoch: 27, train_loss: 0.8235, test_loss: 1.0233, test_f1: 0.5866
 epoch: 28, train_loss: 0.7803, test_loss: 1.0586, test_f1: 0.5647
 epoch: 29, train_loss: 0.8072, test_loss: 1.0953, test_f1: 0.5852
 epoch: 30, train_loss: 0.7823, test_loss: 1.0294, test_f1: 0.5694
 epoch: 31, train_loss: 0.7774, test_loss: 1.0679, test_f1: 0.5800
 epoch: 32, train_loss: 0.7674, test_loss: 1.0839, test_f1: 0.5827
 epoch: 33, train_loss: 0.7557, test_loss: 1.1236, test_f1: 0.5498
 epoch: 34, train_loss: 0.7532, test_loss: 1.0130, test_f1: 0.6406
 epoch: 35, train_loss: 0.7566, test_loss: 1.1584, test_f1: 0.5718
 epoch: 36, train_loss: 0.7572, test_loss: 1.0850, test_f1: 0.5989
 epoch: 37, train_loss: 0.7362, test_loss: 1.0519, test_f1: 0.5956
 epoch: 38, train_loss: 0.7311, test_loss: 1.0581, test_f1: 0.6114
 epoch: 39, train_loss: 0.7057, test_loss: 1.1140, test_f1: 0.5798
 epoch: 40, train_loss: 0.7261, test_loss: 1.1561, test_f1: 0.5742
 epoch: 41, train_loss: 0.7255, test_loss: 1.1313, test_f1: 0.5780
 epoch: 42, train_loss: 0.6828, test_loss: 1.0634, test_f1: 0.5772
 epoch: 43, train_loss: 0.6787, test_loss: 1.0600, test_f1: 0.5969
 epoch: 44, train_loss: 0.6844, test_loss: 1.0389, test_f1: 0.5632
 epoch: 45, train_loss: 0.6854, test_loss: 1.0576, test_f1: 0.5892
 epoch: 46, train_loss: 0.6837, test_loss: 1.1560, test_f1: 0.5516
 epoch: 47, train_loss: 0.6769, test_loss: 1.1209, test_f1: 0.6086
 epoch: 48, train_loss: 0.6888, test_loss: 1.2637, test_f1: 0.6155
 epoch: 49, train_loss: 0.6695, test_loss: 1.1089, test_f1: 0.6007
 epoch: 50, train_loss: 0.6629, test_loss: 1.1574, test_f1: 0.5710
 epoch: 51, train_loss: 0.6305, test_loss: 1.1520, test_f1: 0.5825
 epoch: 52, train_loss: 0.6360, test_loss: 1.2226, test_f1: 0.5919
 epoch: 53, train_loss: 0.6236, test_loss: 1.1899, test_f1: 0.6014
 epoch: 54, train_loss: 0.6208, test_loss: 1.2508, test_f1: 0.5986
 epoch: 55, train_loss: 0.6089, test_loss: 1.2208, test_f1: 0.6098
 epoch: 56, train_loss: 0.5993, test_loss: 1.1984, test_f1: 0.6021
 epoch: 57, train_loss: 0.5928, test_loss: 1.2846, test_f1: 0.6001
 epoch: 58, train_loss: 0.5895, test_loss: 1.2102, test_f1: 0.5738
 epoch: 59, train_loss: 0.5815, test_loss: 1.2289, test_f1: 0.5750
 epoch: 60, train_loss: 0.5737, test_loss: 1.2307, test_f1: 0.5941
 epoch: 61, train_loss: 0.5964, test_loss: 1.2967, test_f1: 0.5935
 epoch: 62, train_loss: 0.5917, test_loss: 1.2089, test_f1: 0.5962
 epoch: 63, train_loss: 0.5721, test_loss: 1.3351, test_f1: 0.5741
 epoch: 64, train_loss: 0.5581, test_loss: 1.2852, test_f1: 0.5925
 epoch: 65, train_loss: 0.5663, test_loss: 1.3615, test_f1: 0.5927
 epoch: 66, train_loss: 0.5816, test_loss: 1.2505, test_f1: 0.5925
 epoch: 67, train_loss: 0.5851, test_loss: 1.3125, test_f1: 0.5558
 epoch: 68, train_loss: 0.5511, test_loss: 1.1768, test_f1: 0.6119
 epoch: 69, train_loss: 0.5644, test_loss: 1.3219, test_f1: 0.5923
 epoch: 70, train_loss: 0.5571, test_loss: 1.0938, test_f1: 0.6086
 epoch: 71, train_loss: 0.5573, test_loss: 1.3229, test_f1: 0.5521
 epoch: 72, train_loss: 0.5527, test_loss: 1.3469, test_f1: 0.5727
 epoch: 73, train_loss: 0.5363, test_loss: 1.3563, test_f1: 0.5922
 epoch: 74, train_loss: 0.5458, test_loss: 1.2952, test_f1: 0.6080
 epoch: 75, train_loss: 0.5338, test_loss: 1.2060, test_f1: 0.6008
 epoch: 76, train_loss: 0.5222, test_loss: 1.2820, test_f1: 0.6078
 epoch: 77, train_loss: 0.5424, test_loss: 1.3344, test_f1: 0.5932
 epoch: 78, train_loss: 0.5430, test_loss: 1.3088, test_f1: 0.6134
 epoch: 79, train_loss: 0.5376, test_loss: 1.2875, test_f1: 0.5789
 epoch: 80, train_loss: 0.4989, test_loss: 1.4286, test_f1: 0.5858
 epoch: 81, train_loss: 0.4993, test_loss: 1.4545, test_f1: 0.6100
 epoch: 82, train_loss: 0.5169, test_loss: 1.4402, test_f1: 0.5723
 epoch: 83, train_loss: 0.5014, test_loss: 1.3273, test_f1: 0.5930
 epoch: 84, train_loss: 0.4982, test_loss: 1.3429, test_f1: 0.5586
 epoch: 85, train_loss: 0.5365, test_loss: 1.4779, test_f1: 0.5619
 epoch: 86, train_loss: 0.5231, test_loss: 1.5426, test_f1: 0.5993
 epoch: 87, train_loss: 0.4992, test_loss: 1.2163, test_f1: 0.6286
 epoch: 88, train_loss: 0.5142, test_loss: 1.2655, test_f1: 0.6305
 epoch: 89, train_loss: 0.4843, test_loss: 1.5322, test_f1: 0.6192
 epoch: 90, train_loss: 0.5032, test_loss: 1.4562, test_f1: 0.6271
 epoch: 91, train_loss: 0.4723, test_loss: 1.4374, test_f1: 0.5771
 epoch: 92, train_loss: 0.4885, test_loss: 1.6672, test_f1: 0.5641
 epoch: 93, train_loss: 0.5036, test_loss: 1.4161, test_f1: 0.5971
 epoch: 94, train_loss: 0.4777, test_loss: 1.3917, test_f1: 0.6291
 epoch: 95, train_loss: 0.4593, test_loss: 1.4051, test_f1: 0.6194
 epoch: 96, train_loss: 0.4864, test_loss: 1.3167, test_f1: 0.5950
 epoch: 97, train_loss: 0.4718, test_loss: 1.7571, test_f1: 0.5776
 epoch: 98, train_loss: 0.4540, test_loss: 1.5357, test_f1: 0.6188
 epoch: 99, train_loss: 0.4475, test_loss: 1.6439, test_f1: 0.5802
##################ITERATION #6 ****************************************
 epoch: 0, train_loss: 1.4407, test_loss: 1.3042, test_f1: 0.2431
 epoch: 1, train_loss: 1.1887, test_loss: 1.2201, test_f1: 0.2938
 epoch: 2, train_loss: 1.1004, test_loss: 1.1666, test_f1: 0.4527
 epoch: 3, train_loss: 1.0703, test_loss: 1.1110, test_f1: 0.4921
 epoch: 4, train_loss: 1.0581, test_loss: 1.1070, test_f1: 0.5151
 epoch: 5, train_loss: 1.0260, test_loss: 1.0952, test_f1: 0.5289
 epoch: 6, train_loss: 1.0130, test_loss: 1.0742, test_f1: 0.5297
 epoch: 7, train_loss: 0.9994, test_loss: 1.0554, test_f1: 0.5505
 epoch: 8, train_loss: 0.9826, test_loss: 1.0582, test_f1: 0.5175
 epoch: 9, train_loss: 0.9626, test_loss: 1.0108, test_f1: 0.5492
 epoch: 10, train_loss: 0.9481, test_loss: 1.0271, test_f1: 0.5105
 epoch: 11, train_loss: 0.9492, test_loss: 0.9885, test_f1: 0.5285
 epoch: 12, train_loss: 0.9471, test_loss: 1.0243, test_f1: 0.5591
 epoch: 13, train_loss: 0.9238, test_loss: 1.0084, test_f1: 0.5463
 epoch: 14, train_loss: 0.9153, test_loss: 1.0273, test_f1: 0.5335
 epoch: 15, train_loss: 0.8850, test_loss: 0.9875, test_f1: 0.5758
 epoch: 16, train_loss: 0.8906, test_loss: 0.9864, test_f1: 0.5493
 epoch: 17, train_loss: 0.8873, test_loss: 0.9413, test_f1: 0.5826
 epoch: 18, train_loss: 0.8907, test_loss: 0.9450, test_f1: 0.5709
 epoch: 19, train_loss: 0.8645, test_loss: 0.9416, test_f1: 0.6038
 epoch: 20, train_loss: 0.8674, test_loss: 0.9639, test_f1: 0.5690
 epoch: 21, train_loss: 0.8449, test_loss: 0.9538, test_f1: 0.5619
 epoch: 22, train_loss: 0.8354, test_loss: 0.9467, test_f1: 0.6071
 epoch: 23, train_loss: 0.8402, test_loss: 0.9510, test_f1: 0.5819
 epoch: 24, train_loss: 0.8545, test_loss: 0.9089, test_f1: 0.5846
 epoch: 25, train_loss: 0.8405, test_loss: 0.9277, test_f1: 0.6068
 epoch: 26, train_loss: 0.8307, test_loss: 0.9709, test_f1: 0.5887
 epoch: 27, train_loss: 0.8166, test_loss: 0.9346, test_f1: 0.6155
 epoch: 28, train_loss: 0.8036, test_loss: 0.9523, test_f1: 0.5910
 epoch: 29, train_loss: 0.8049, test_loss: 1.0191, test_f1: 0.5834
 epoch: 30, train_loss: 0.8113, test_loss: 0.9626, test_f1: 0.6037
 epoch: 31, train_loss: 0.7807, test_loss: 0.9716, test_f1: 0.6120
 epoch: 32, train_loss: 0.7803, test_loss: 1.0193, test_f1: 0.5590
 epoch: 33, train_loss: 0.7884, test_loss: 0.9871, test_f1: 0.6009
 epoch: 34, train_loss: 0.7809, test_loss: 1.0609, test_f1: 0.5692
 epoch: 35, train_loss: 0.7695, test_loss: 1.0107, test_f1: 0.5947
 epoch: 36, train_loss: 0.7742, test_loss: 0.9820, test_f1: 0.6278
 epoch: 37, train_loss: 0.7432, test_loss: 0.9518, test_f1: 0.6187
 epoch: 38, train_loss: 0.7376, test_loss: 0.9950, test_f1: 0.6124
 epoch: 39, train_loss: 0.7302, test_loss: 1.0476, test_f1: 0.5829
 epoch: 40, train_loss: 0.7283, test_loss: 1.0996, test_f1: 0.6114
 epoch: 41, train_loss: 0.7167, test_loss: 1.0851, test_f1: 0.6161
 epoch: 42, train_loss: 0.6932, test_loss: 1.0463, test_f1: 0.5914
 epoch: 43, train_loss: 0.7164, test_loss: 1.0111, test_f1: 0.6358
 epoch: 44, train_loss: 0.6878, test_loss: 1.0855, test_f1: 0.6247
 epoch: 45, train_loss: 0.6926, test_loss: 1.0498, test_f1: 0.5953
 epoch: 46, train_loss: 0.6868, test_loss: 1.1311, test_f1: 0.5950
 epoch: 47, train_loss: 0.6750, test_loss: 0.9883, test_f1: 0.6120
 epoch: 48, train_loss: 0.6983, test_loss: 0.9932, test_f1: 0.6248
 epoch: 49, train_loss: 0.6748, test_loss: 1.1243, test_f1: 0.6180
 epoch: 50, train_loss: 0.6571, test_loss: 1.0087, test_f1: 0.5973
 epoch: 51, train_loss: 0.6482, test_loss: 0.9861, test_f1: 0.6089
 epoch: 52, train_loss: 0.6328, test_loss: 1.0353, test_f1: 0.6294
 epoch: 53, train_loss: 0.6331, test_loss: 1.0543, test_f1: 0.5988
 epoch: 54, train_loss: 0.6156, test_loss: 0.9723, test_f1: 0.6190
 epoch: 55, train_loss: 0.6301, test_loss: 1.0203, test_f1: 0.6316
 epoch: 56, train_loss: 0.6205, test_loss: 1.0229, test_f1: 0.6153
 epoch: 57, train_loss: 0.6267, test_loss: 1.0348, test_f1: 0.6425
 epoch: 58, train_loss: 0.6252, test_loss: 0.9395, test_f1: 0.6334
 epoch: 59, train_loss: 0.6204, test_loss: 0.9955, test_f1: 0.6447
 epoch: 60, train_loss: 0.5934, test_loss: 1.0572, test_f1: 0.6234
 epoch: 61, train_loss: 0.5941, test_loss: 1.0062, test_f1: 0.6347
 epoch: 62, train_loss: 0.5911, test_loss: 1.0166, test_f1: 0.6099
 epoch: 63, train_loss: 0.5927, test_loss: 1.0200, test_f1: 0.5896
 epoch: 64, train_loss: 0.5685, test_loss: 1.0675, test_f1: 0.6249
 epoch: 65, train_loss: 0.5860, test_loss: 1.0125, test_f1: 0.6141
 epoch: 66, train_loss: 0.5905, test_loss: 1.1156, test_f1: 0.6086
 epoch: 67, train_loss: 0.5826, test_loss: 1.0987, test_f1: 0.6076
 epoch: 68, train_loss: 0.5657, test_loss: 1.1715, test_f1: 0.5837
 epoch: 69, train_loss: 0.5670, test_loss: 1.1475, test_f1: 0.6005
 epoch: 70, train_loss: 0.5649, test_loss: 1.1030, test_f1: 0.5958
 epoch: 71, train_loss: 0.5617, test_loss: 1.1597, test_f1: 0.6072
 epoch: 72, train_loss: 0.5411, test_loss: 1.1437, test_f1: 0.6057
 epoch: 73, train_loss: 0.5507, test_loss: 1.2139, test_f1: 0.5966
 epoch: 74, train_loss: 0.5472, test_loss: 1.1944, test_f1: 0.5902
 epoch: 75, train_loss: 0.5576, test_loss: 1.1021, test_f1: 0.5988
 epoch: 76, train_loss: 0.5346, test_loss: 1.1204, test_f1: 0.5908
 epoch: 77, train_loss: 0.5440, test_loss: 1.1709, test_f1: 0.6186
 epoch: 78, train_loss: 0.5428, test_loss: 1.2499, test_f1: 0.6039
 epoch: 79, train_loss: 0.5519, test_loss: 1.2212, test_f1: 0.5776
 epoch: 80, train_loss: 0.5175, test_loss: 1.2581, test_f1: 0.5717
 epoch: 81, train_loss: 0.5268, test_loss: 1.1981, test_f1: 0.6171
 epoch: 82, train_loss: 0.5095, test_loss: 1.1696, test_f1: 0.5859
 epoch: 83, train_loss: 0.5251, test_loss: 1.2048, test_f1: 0.6107
 epoch: 84, train_loss: 0.5451, test_loss: 1.2765, test_f1: 0.6182
 epoch: 85, train_loss: 0.5260, test_loss: 1.2483, test_f1: 0.6081
 epoch: 86, train_loss: 0.5231, test_loss: 1.2210, test_f1: 0.5983
 epoch: 87, train_loss: 0.5261, test_loss: 1.3400, test_f1: 0.5908
 epoch: 88, train_loss: 0.5088, test_loss: 1.1802, test_f1: 0.6025
 epoch: 89, train_loss: 0.5005, test_loss: 1.2899, test_f1: 0.6187
 epoch: 90, train_loss: 0.4900, test_loss: 1.2364, test_f1: 0.5992
 epoch: 91, train_loss: 0.5104, test_loss: 1.1851, test_f1: 0.5960
 epoch: 92, train_loss: 0.5223, test_loss: 1.3310, test_f1: 0.5930
 epoch: 93, train_loss: 0.5055, test_loss: 1.3156, test_f1: 0.5877
 epoch: 94, train_loss: 0.4951, test_loss: 1.2884, test_f1: 0.6225
 epoch: 95, train_loss: 0.4915, test_loss: 1.3366, test_f1: 0.5969
 epoch: 96, train_loss: 0.4982, test_loss: 1.2987, test_f1: 0.6007
 epoch: 97, train_loss: 0.5151, test_loss: 1.3640, test_f1: 0.5999
 epoch: 98, train_loss: 0.4888, test_loss: 1.3379, test_f1: 0.5929
 epoch: 99, train_loss: 0.4813, test_loss: 1.3142, test_f1: 0.6040
##################ITERATION #7 ****************************************
 epoch: 0, train_loss: 1.5132, test_loss: 1.2645, test_f1: 0.2308
 epoch: 1, train_loss: 1.2213, test_loss: 1.2049, test_f1: 0.4535
 epoch: 2, train_loss: 1.0992, test_loss: 1.1489, test_f1: 0.4771
 epoch: 3, train_loss: 1.0631, test_loss: 1.1115, test_f1: 0.5137
 epoch: 4, train_loss: 1.0225, test_loss: 1.1160, test_f1: 0.5292
 epoch: 5, train_loss: 1.0239, test_loss: 1.0898, test_f1: 0.5080
 epoch: 6, train_loss: 0.9970, test_loss: 1.0727, test_f1: 0.5404
 epoch: 7, train_loss: 0.9754, test_loss: 1.0909, test_f1: 0.5327
 epoch: 8, train_loss: 0.9353, test_loss: 1.1008, test_f1: 0.5434
 epoch: 9, train_loss: 0.9362, test_loss: 1.1037, test_f1: 0.5408
 epoch: 10, train_loss: 0.9243, test_loss: 1.0922, test_f1: 0.5211
 epoch: 11, train_loss: 0.9030, test_loss: 1.0807, test_f1: 0.5580
 epoch: 12, train_loss: 0.9023, test_loss: 1.1015, test_f1: 0.5509
 epoch: 13, train_loss: 0.8704, test_loss: 1.0791, test_f1: 0.5725
 epoch: 14, train_loss: 0.8583, test_loss: 1.1110, test_f1: 0.5498
 epoch: 15, train_loss: 0.8746, test_loss: 1.0816, test_f1: 0.5734
 epoch: 16, train_loss: 0.8563, test_loss: 1.0687, test_f1: 0.5547
 epoch: 17, train_loss: 0.8209, test_loss: 1.0359, test_f1: 0.5671
 epoch: 18, train_loss: 0.8259, test_loss: 1.0790, test_f1: 0.5358
 epoch: 19, train_loss: 0.8074, test_loss: 1.0919, test_f1: 0.5441
 epoch: 20, train_loss: 0.8098, test_loss: 1.0660, test_f1: 0.5502
 epoch: 21, train_loss: 0.7807, test_loss: 1.0787, test_f1: 0.5883
 epoch: 22, train_loss: 0.8041, test_loss: 1.0750, test_f1: 0.5991
 epoch: 23, train_loss: 0.7785, test_loss: 1.1155, test_f1: 0.5811
 epoch: 24, train_loss: 0.7738, test_loss: 1.0817, test_f1: 0.5840
 epoch: 25, train_loss: 0.7555, test_loss: 1.0920, test_f1: 0.5877
 epoch: 26, train_loss: 0.7570, test_loss: 1.0533, test_f1: 0.6036
 epoch: 27, train_loss: 0.7297, test_loss: 1.0815, test_f1: 0.5706
 epoch: 28, train_loss: 0.7458, test_loss: 1.0963, test_f1: 0.5989
 epoch: 29, train_loss: 0.7431, test_loss: 1.0685, test_f1: 0.5866
 epoch: 30, train_loss: 0.7121, test_loss: 1.0924, test_f1: 0.5885
 epoch: 31, train_loss: 0.7267, test_loss: 1.0911, test_f1: 0.5716
 epoch: 32, train_loss: 0.6934, test_loss: 1.0870, test_f1: 0.5863
 epoch: 33, train_loss: 0.7033, test_loss: 1.1372, test_f1: 0.5982
 epoch: 34, train_loss: 0.6720, test_loss: 1.0809, test_f1: 0.5827
 epoch: 35, train_loss: 0.7111, test_loss: 1.1390, test_f1: 0.5902
 epoch: 36, train_loss: 0.6830, test_loss: 1.1211, test_f1: 0.5660
 epoch: 37, train_loss: 0.6667, test_loss: 1.1263, test_f1: 0.6011
 epoch: 38, train_loss: 0.6816, test_loss: 1.1494, test_f1: 0.5699
 epoch: 39, train_loss: 0.6614, test_loss: 1.1042, test_f1: 0.5911
 epoch: 40, train_loss: 0.6537, test_loss: 1.1853, test_f1: 0.5585
 epoch: 41, train_loss: 0.6678, test_loss: 1.0885, test_f1: 0.6065
 epoch: 42, train_loss: 0.6593, test_loss: 1.1885, test_f1: 0.5593
 epoch: 43, train_loss: 0.6792, test_loss: 1.1723, test_f1: 0.5478
 epoch: 44, train_loss: 0.6534, test_loss: 1.1363, test_f1: 0.5798
 epoch: 45, train_loss: 0.6351, test_loss: 1.1169, test_f1: 0.5729
 epoch: 46, train_loss: 0.6160, test_loss: 1.1972, test_f1: 0.5517
 epoch: 47, train_loss: 0.6460, test_loss: 1.0871, test_f1: 0.5850
 epoch: 48, train_loss: 0.6450, test_loss: 1.1837, test_f1: 0.5449
 epoch: 49, train_loss: 0.5938, test_loss: 1.1794, test_f1: 0.5495
 epoch: 50, train_loss: 0.6150, test_loss: 1.2588, test_f1: 0.5438
 epoch: 51, train_loss: 0.6111, test_loss: 1.1248, test_f1: 0.5973
 epoch: 52, train_loss: 0.5805, test_loss: 1.1621, test_f1: 0.5890
 epoch: 53, train_loss: 0.5656, test_loss: 1.1708, test_f1: 0.6001
 epoch: 54, train_loss: 0.5710, test_loss: 1.2221, test_f1: 0.5988
 epoch: 55, train_loss: 0.5787, test_loss: 1.1848, test_f1: 0.5791
 epoch: 56, train_loss: 0.5719, test_loss: 1.2025, test_f1: 0.5959
 epoch: 57, train_loss: 0.5702, test_loss: 1.2159, test_f1: 0.5969
 epoch: 58, train_loss: 0.5753, test_loss: 1.1673, test_f1: 0.5570
 epoch: 59, train_loss: 0.5514, test_loss: 1.1751, test_f1: 0.5756
 epoch: 60, train_loss: 0.5554, test_loss: 1.2409, test_f1: 0.5842
 epoch: 61, train_loss: 0.5438, test_loss: 1.1819, test_f1: 0.5816
 epoch: 62, train_loss: 0.5366, test_loss: 1.2328, test_f1: 0.5985
 epoch: 63, train_loss: 0.5348, test_loss: 1.2086, test_f1: 0.6009
 epoch: 64, train_loss: 0.5449, test_loss: 1.2765, test_f1: 0.5767
 epoch: 65, train_loss: 0.5418, test_loss: 1.2520, test_f1: 0.6058
 epoch: 66, train_loss: 0.5523, test_loss: 1.1803, test_f1: 0.6047
 epoch: 67, train_loss: 0.5540, test_loss: 1.2700, test_f1: 0.5728
 epoch: 68, train_loss: 0.5349, test_loss: 1.2079, test_f1: 0.5868
 epoch: 69, train_loss: 0.5351, test_loss: 1.2201, test_f1: 0.5671
 epoch: 70, train_loss: 0.5278, test_loss: 1.2163, test_f1: 0.6146
 epoch: 71, train_loss: 0.5337, test_loss: 1.2915, test_f1: 0.5909
 epoch: 72, train_loss: 0.5124, test_loss: 1.1886, test_f1: 0.5915
 epoch: 73, train_loss: 0.5099, test_loss: 1.2361, test_f1: 0.6078
 epoch: 74, train_loss: 0.5278, test_loss: 1.2954, test_f1: 0.5757
 epoch: 75, train_loss: 0.5074, test_loss: 1.3121, test_f1: 0.5784
 epoch: 76, train_loss: 0.5080, test_loss: 1.2837, test_f1: 0.5759
 epoch: 77, train_loss: 0.4873, test_loss: 1.3184, test_f1: 0.5685
 epoch: 78, train_loss: 0.5102, test_loss: 1.4072, test_f1: 0.5924
 epoch: 79, train_loss: 0.4958, test_loss: 1.3471, test_f1: 0.5803
 epoch: 80, train_loss: 0.5091, test_loss: 1.2841, test_f1: 0.5953
 epoch: 81, train_loss: 0.4759, test_loss: 1.3077, test_f1: 0.5823
 epoch: 82, train_loss: 0.5208, test_loss: 1.3333, test_f1: 0.5820
 epoch: 83, train_loss: 0.4921, test_loss: 1.3459, test_f1: 0.5759
 epoch: 84, train_loss: 0.4822, test_loss: 1.3000, test_f1: 0.6229
 epoch: 85, train_loss: 0.4842, test_loss: 1.3868, test_f1: 0.5630
 epoch: 86, train_loss: 0.4764, test_loss: 1.3457, test_f1: 0.5718
 epoch: 87, train_loss: 0.4631, test_loss: 1.3762, test_f1: 0.5884
 epoch: 88, train_loss: 0.4983, test_loss: 1.3106, test_f1: 0.6049
 epoch: 89, train_loss: 0.4782, test_loss: 1.4232, test_f1: 0.5835
 epoch: 90, train_loss: 0.4859, test_loss: 1.3771, test_f1: 0.6011
 epoch: 91, train_loss: 0.4614, test_loss: 1.3954, test_f1: 0.6026
 epoch: 92, train_loss: 0.4819, test_loss: 1.4507, test_f1: 0.5637
 epoch: 93, train_loss: 0.4769, test_loss: 1.5291, test_f1: 0.5947
 epoch: 94, train_loss: 0.4791, test_loss: 1.4658, test_f1: 0.5944
 epoch: 95, train_loss: 0.4865, test_loss: 1.4880, test_f1: 0.6021
 epoch: 96, train_loss: 0.4751, test_loss: 1.5210, test_f1: 0.5927
 epoch: 97, train_loss: 0.4621, test_loss: 1.4520, test_f1: 0.5871
 epoch: 98, train_loss: 0.4384, test_loss: 1.4978, test_f1: 0.5962
 epoch: 99, train_loss: 0.4451, test_loss: 1.3859, test_f1: 0.5950
##################ITERATION #8 ****************************************
 epoch: 0, train_loss: 1.5101, test_loss: 1.3885, test_f1: 0.1365
 epoch: 1, train_loss: 1.1946, test_loss: 1.1939, test_f1: 0.3301
 epoch: 2, train_loss: 1.1076, test_loss: 1.1431, test_f1: 0.4919
 epoch: 3, train_loss: 1.0707, test_loss: 1.1099, test_f1: 0.5108
 epoch: 4, train_loss: 1.0184, test_loss: 1.0889, test_f1: 0.5140
 epoch: 5, train_loss: 1.0110, test_loss: 1.0829, test_f1: 0.5378
 epoch: 6, train_loss: 0.9896, test_loss: 1.0741, test_f1: 0.5476
 epoch: 7, train_loss: 0.9653, test_loss: 1.0587, test_f1: 0.5143
 epoch: 8, train_loss: 0.9539, test_loss: 1.0186, test_f1: 0.5325
 epoch: 9, train_loss: 0.9445, test_loss: 1.0550, test_f1: 0.5775
 epoch: 10, train_loss: 0.9161, test_loss: 1.0456, test_f1: 0.5559
 epoch: 11, train_loss: 0.9102, test_loss: 1.0279, test_f1: 0.5687
 epoch: 12, train_loss: 0.9017, test_loss: 1.0113, test_f1: 0.5801
 epoch: 13, train_loss: 0.8938, test_loss: 0.9948, test_f1: 0.5487
 epoch: 14, train_loss: 0.8726, test_loss: 1.0225, test_f1: 0.5860
 epoch: 15, train_loss: 0.8508, test_loss: 1.0291, test_f1: 0.6076
 epoch: 16, train_loss: 0.8576, test_loss: 1.0232, test_f1: 0.5723
 epoch: 17, train_loss: 0.8371, test_loss: 1.0424, test_f1: 0.6017
 epoch: 18, train_loss: 0.8418, test_loss: 1.0780, test_f1: 0.5751
 epoch: 19, train_loss: 0.8412, test_loss: 1.0531, test_f1: 0.5591
 epoch: 20, train_loss: 0.8254, test_loss: 1.0408, test_f1: 0.6029
 epoch: 21, train_loss: 0.8159, test_loss: 1.0331, test_f1: 0.5732
 epoch: 22, train_loss: 0.8063, test_loss: 1.0498, test_f1: 0.5996
 epoch: 23, train_loss: 0.7881, test_loss: 1.0036, test_f1: 0.6079
 epoch: 24, train_loss: 0.7735, test_loss: 1.1039, test_f1: 0.5914
 epoch: 25, train_loss: 0.7838, test_loss: 1.1140, test_f1: 0.5985
 epoch: 26, train_loss: 0.7593, test_loss: 1.1012, test_f1: 0.5855
 epoch: 27, train_loss: 0.7674, test_loss: 1.1316, test_f1: 0.5387
 epoch: 28, train_loss: 0.7562, test_loss: 0.9943, test_f1: 0.5640
 epoch: 29, train_loss: 0.7563, test_loss: 1.1134, test_f1: 0.5930
 epoch: 30, train_loss: 0.7489, test_loss: 1.1312, test_f1: 0.6000
 epoch: 31, train_loss: 0.7278, test_loss: 1.0255, test_f1: 0.6249
 epoch: 32, train_loss: 0.7102, test_loss: 1.1059, test_f1: 0.6477
 epoch: 33, train_loss: 0.7298, test_loss: 1.2075, test_f1: 0.5725
 epoch: 34, train_loss: 0.7090, test_loss: 1.1217, test_f1: 0.5691
 epoch: 35, train_loss: 0.6895, test_loss: 1.1626, test_f1: 0.5965
 epoch: 36, train_loss: 0.7062, test_loss: 1.1291, test_f1: 0.5984
 epoch: 37, train_loss: 0.6910, test_loss: 1.1378, test_f1: 0.6070
 epoch: 38, train_loss: 0.6661, test_loss: 1.1561, test_f1: 0.5528
 epoch: 39, train_loss: 0.6970, test_loss: 1.1894, test_f1: 0.5928
 epoch: 40, train_loss: 0.6906, test_loss: 1.1616, test_f1: 0.6103
 epoch: 41, train_loss: 0.6573, test_loss: 1.1352, test_f1: 0.5829
 epoch: 42, train_loss: 0.6692, test_loss: 1.1444, test_f1: 0.6290
 epoch: 43, train_loss: 0.6288, test_loss: 1.1338, test_f1: 0.6001
 epoch: 44, train_loss: 0.6340, test_loss: 1.1733, test_f1: 0.6246
 epoch: 45, train_loss: 0.6451, test_loss: 1.2053, test_f1: 0.6163
 epoch: 46, train_loss: 0.6402, test_loss: 1.3593, test_f1: 0.5418
 epoch: 47, train_loss: 0.6495, test_loss: 1.2285, test_f1: 0.5975
 epoch: 48, train_loss: 0.6263, test_loss: 1.2064, test_f1: 0.5625
 epoch: 49, train_loss: 0.6193, test_loss: 1.2394, test_f1: 0.5544
 epoch: 50, train_loss: 0.6320, test_loss: 1.2889, test_f1: 0.5609
 epoch: 51, train_loss: 0.5969, test_loss: 1.2530, test_f1: 0.5794
 epoch: 52, train_loss: 0.5820, test_loss: 1.2479, test_f1: 0.6203
 epoch: 53, train_loss: 0.5668, test_loss: 1.2446, test_f1: 0.6161
 epoch: 54, train_loss: 0.5536, test_loss: 1.2273, test_f1: 0.6126
 epoch: 55, train_loss: 0.5684, test_loss: 1.4089, test_f1: 0.5734
 epoch: 56, train_loss: 0.5606, test_loss: 1.2320, test_f1: 0.6069
 epoch: 57, train_loss: 0.5398, test_loss: 1.2684, test_f1: 0.5864
 epoch: 58, train_loss: 0.5624, test_loss: 1.3587, test_f1: 0.6111
 epoch: 59, train_loss: 0.5155, test_loss: 1.3690, test_f1: 0.6225
 epoch: 60, train_loss: 0.5291, test_loss: 1.3649, test_f1: 0.5991
 epoch: 61, train_loss: 0.5426, test_loss: 1.3273, test_f1: 0.6290
 epoch: 62, train_loss: 0.5367, test_loss: 1.3891, test_f1: 0.6015
 epoch: 63, train_loss: 0.5225, test_loss: 1.3417, test_f1: 0.6122
 epoch: 64, train_loss: 0.5216, test_loss: 1.2992, test_f1: 0.6133
 epoch: 65, train_loss: 0.5355, test_loss: 1.4076, test_f1: 0.5940
 epoch: 66, train_loss: 0.5128, test_loss: 1.3656, test_f1: 0.6266
 epoch: 67, train_loss: 0.5281, test_loss: 1.3833, test_f1: 0.6074
 epoch: 68, train_loss: 0.4995, test_loss: 1.4846, test_f1: 0.5963
 epoch: 69, train_loss: 0.4929, test_loss: 1.4407, test_f1: 0.5841
 epoch: 70, train_loss: 0.5019, test_loss: 1.3817, test_f1: 0.6165
 epoch: 71, train_loss: 0.4862, test_loss: 1.4560, test_f1: 0.5804
 epoch: 72, train_loss: 0.4869, test_loss: 1.4248, test_f1: 0.5897
 epoch: 73, train_loss: 0.4982, test_loss: 1.5288, test_f1: 0.5890
 epoch: 74, train_loss: 0.4796, test_loss: 1.4364, test_f1: 0.6372
 epoch: 75, train_loss: 0.4784, test_loss: 1.4981, test_f1: 0.5960
 epoch: 76, train_loss: 0.5024, test_loss: 1.4778, test_f1: 0.6205
 epoch: 77, train_loss: 0.4573, test_loss: 1.5001, test_f1: 0.5887
 epoch: 78, train_loss: 0.4636, test_loss: 1.5855, test_f1: 0.6038
 epoch: 79, train_loss: 0.4852, test_loss: 1.4807, test_f1: 0.6427
 epoch: 80, train_loss: 0.4690, test_loss: 1.6406, test_f1: 0.5819
 epoch: 81, train_loss: 0.4662, test_loss: 1.5199, test_f1: 0.6192
 epoch: 82, train_loss: 0.4620, test_loss: 1.6047, test_f1: 0.6119
 epoch: 83, train_loss: 0.4597, test_loss: 1.5161, test_f1: 0.6083
 epoch: 84, train_loss: 0.4730, test_loss: 1.5829, test_f1: 0.6136
 epoch: 85, train_loss: 0.4475, test_loss: 1.6218, test_f1: 0.6109
 epoch: 86, train_loss: 0.4218, test_loss: 1.5958, test_f1: 0.6143
 epoch: 87, train_loss: 0.4664, test_loss: 1.6705, test_f1: 0.6106
 epoch: 88, train_loss: 0.4432, test_loss: 1.6237, test_f1: 0.6163
 epoch: 89, train_loss: 0.4365, test_loss: 1.6829, test_f1: 0.5914
 epoch: 90, train_loss: 0.4332, test_loss: 1.6601, test_f1: 0.5905
 epoch: 91, train_loss: 0.4539, test_loss: 1.7023, test_f1: 0.5834
 epoch: 92, train_loss: 0.4345, test_loss: 1.6956, test_f1: 0.6199
 epoch: 93, train_loss: 0.4747, test_loss: 1.6564, test_f1: 0.5980
 epoch: 94, train_loss: 0.4226, test_loss: 1.7016, test_f1: 0.5651
 epoch: 95, train_loss: 0.4017, test_loss: 1.6560, test_f1: 0.6177
 epoch: 96, train_loss: 0.4338, test_loss: 1.6557, test_f1: 0.6306
 epoch: 97, train_loss: 0.4452, test_loss: 1.7926, test_f1: 0.5674
 epoch: 98, train_loss: 0.4208, test_loss: 1.8092, test_f1: 0.6011
 epoch: 99, train_loss: 0.4204, test_loss: 1.7431, test_f1: 0.5979
##################ITERATION #9 ****************************************
 epoch: 0, train_loss: 1.5119, test_loss: 1.4095, test_f1: 0.1917
 epoch: 1, train_loss: 1.1555, test_loss: 1.2937, test_f1: 0.2054
 epoch: 2, train_loss: 1.0998, test_loss: 1.0986, test_f1: 0.5364
 epoch: 3, train_loss: 1.0795, test_loss: 1.0640, test_f1: 0.5451
 epoch: 4, train_loss: 1.0523, test_loss: 1.0428, test_f1: 0.5840
 epoch: 5, train_loss: 1.0181, test_loss: 1.1027, test_f1: 0.5580
 epoch: 6, train_loss: 1.0238, test_loss: 1.0406, test_f1: 0.5608
 epoch: 7, train_loss: 0.9781, test_loss: 1.0348, test_f1: 0.5206
 epoch: 8, train_loss: 0.9529, test_loss: 1.0501, test_f1: 0.5551
 epoch: 9, train_loss: 0.9419, test_loss: 1.0495, test_f1: 0.5469
 epoch: 10, train_loss: 0.9345, test_loss: 1.0159, test_f1: 0.5391
 epoch: 11, train_loss: 0.9363, test_loss: 1.0138, test_f1: 0.5790
 epoch: 12, train_loss: 0.9128, test_loss: 1.0350, test_f1: 0.5675
 epoch: 13, train_loss: 0.9020, test_loss: 1.0219, test_f1: 0.5766
 epoch: 14, train_loss: 0.8899, test_loss: 1.0247, test_f1: 0.5560
 epoch: 15, train_loss: 0.8898, test_loss: 1.0212, test_f1: 0.5566
 epoch: 16, train_loss: 0.8884, test_loss: 0.9987, test_f1: 0.5650
 epoch: 17, train_loss: 0.8773, test_loss: 1.0057, test_f1: 0.5621
 epoch: 18, train_loss: 0.8492, test_loss: 1.0258, test_f1: 0.5867
 epoch: 19, train_loss: 0.8682, test_loss: 0.9960, test_f1: 0.5658
 epoch: 20, train_loss: 0.8446, test_loss: 0.9776, test_f1: 0.5993
 epoch: 21, train_loss: 0.8406, test_loss: 1.0204, test_f1: 0.5871
 epoch: 22, train_loss: 0.8227, test_loss: 0.9947, test_f1: 0.5917
 epoch: 23, train_loss: 0.8426, test_loss: 0.9695, test_f1: 0.5724
 epoch: 24, train_loss: 0.8473, test_loss: 0.9855, test_f1: 0.5907
 epoch: 25, train_loss: 0.8224, test_loss: 0.9920, test_f1: 0.6047
 epoch: 26, train_loss: 0.8164, test_loss: 0.9779, test_f1: 0.5918
 epoch: 27, train_loss: 0.8086, test_loss: 0.9885, test_f1: 0.5989
 epoch: 28, train_loss: 0.8078, test_loss: 0.9987, test_f1: 0.6013
 epoch: 29, train_loss: 0.7998, test_loss: 1.0537, test_f1: 0.5846
 epoch: 30, train_loss: 0.7894, test_loss: 0.9498, test_f1: 0.5895
 epoch: 31, train_loss: 0.7842, test_loss: 0.9958, test_f1: 0.5967
 epoch: 32, train_loss: 0.7626, test_loss: 0.9634, test_f1: 0.6206
 epoch: 33, train_loss: 0.7771, test_loss: 1.0210, test_f1: 0.5785
 epoch: 34, train_loss: 0.7701, test_loss: 0.9766, test_f1: 0.6216
 epoch: 35, train_loss: 0.7562, test_loss: 1.0134, test_f1: 0.6383
 epoch: 36, train_loss: 0.7564, test_loss: 0.9804, test_f1: 0.6141
 epoch: 37, train_loss: 0.7281, test_loss: 1.0204, test_f1: 0.6243
 epoch: 38, train_loss: 0.7501, test_loss: 0.9716, test_f1: 0.6412
 epoch: 39, train_loss: 0.7562, test_loss: 1.0023, test_f1: 0.6198
 epoch: 40, train_loss: 0.7300, test_loss: 0.9915, test_f1: 0.6240
 epoch: 41, train_loss: 0.7326, test_loss: 1.0705, test_f1: 0.5707
 epoch: 42, train_loss: 0.7298, test_loss: 0.9910, test_f1: 0.6127
 epoch: 43, train_loss: 0.7392, test_loss: 1.0007, test_f1: 0.5863
 epoch: 44, train_loss: 0.6935, test_loss: 1.0316, test_f1: 0.6240
 epoch: 45, train_loss: 0.6899, test_loss: 1.0108, test_f1: 0.6204
 epoch: 46, train_loss: 0.6755, test_loss: 1.0165, test_f1: 0.5996
 epoch: 47, train_loss: 0.7015, test_loss: 1.0387, test_f1: 0.6157
 epoch: 48, train_loss: 0.6927, test_loss: 1.0473, test_f1: 0.6122
 epoch: 49, train_loss: 0.6870, test_loss: 1.0002, test_f1: 0.6416
 epoch: 50, train_loss: 0.6683, test_loss: 1.0465, test_f1: 0.6263
 epoch: 51, train_loss: 0.6622, test_loss: 1.0296, test_f1: 0.6099
 epoch: 52, train_loss: 0.6506, test_loss: 1.0242, test_f1: 0.6088
 epoch: 53, train_loss: 0.6551, test_loss: 1.0226, test_f1: 0.6417
 epoch: 54, train_loss: 0.6489, test_loss: 1.0696, test_f1: 0.6090
 epoch: 55, train_loss: 0.6329, test_loss: 1.0297, test_f1: 0.5861
 epoch: 56, train_loss: 0.6324, test_loss: 1.0449, test_f1: 0.6430
 epoch: 57, train_loss: 0.6297, test_loss: 1.0470, test_f1: 0.6254
 epoch: 58, train_loss: 0.6232, test_loss: 1.0481, test_f1: 0.6146
 epoch: 59, train_loss: 0.6097, test_loss: 1.0432, test_f1: 0.6150
 epoch: 60, train_loss: 0.6031, test_loss: 1.0327, test_f1: 0.6149
 epoch: 61, train_loss: 0.6120, test_loss: 1.0133, test_f1: 0.6132
 epoch: 62, train_loss: 0.5995, test_loss: 1.1076, test_f1: 0.6289
 epoch: 63, train_loss: 0.6143, test_loss: 1.0836, test_f1: 0.6308
 epoch: 64, train_loss: 0.5992, test_loss: 1.0554, test_f1: 0.6304
 epoch: 65, train_loss: 0.5821, test_loss: 1.0924, test_f1: 0.6515
 epoch: 66, train_loss: 0.5668, test_loss: 1.0248, test_f1: 0.6348
 epoch: 67, train_loss: 0.5836, test_loss: 1.1071, test_f1: 0.6141
 epoch: 68, train_loss: 0.5944, test_loss: 1.0876, test_f1: 0.6221
 epoch: 69, train_loss: 0.5862, test_loss: 1.1070, test_f1: 0.6189
 epoch: 70, train_loss: 0.5790, test_loss: 1.0819, test_f1: 0.6129
 epoch: 71, train_loss: 0.5744, test_loss: 1.2247, test_f1: 0.6133
 epoch: 72, train_loss: 0.5704, test_loss: 1.1062, test_f1: 0.6340
 epoch: 73, train_loss: 0.5701, test_loss: 1.0625, test_f1: 0.6409
 epoch: 74, train_loss: 0.5632, test_loss: 1.1156, test_f1: 0.6156
 epoch: 75, train_loss: 0.5677, test_loss: 1.0908, test_f1: 0.6098
 epoch: 76, train_loss: 0.5607, test_loss: 1.1235, test_f1: 0.6427
 epoch: 77, train_loss: 0.5523, test_loss: 1.1475, test_f1: 0.6072
 epoch: 78, train_loss: 0.5452, test_loss: 1.1468, test_f1: 0.6210
 epoch: 79, train_loss: 0.5475, test_loss: 1.1850, test_f1: 0.6044
 epoch: 80, train_loss: 0.5479, test_loss: 1.1952, test_f1: 0.6080
 epoch: 81, train_loss: 0.5426, test_loss: 1.1430, test_f1: 0.6304
 epoch: 82, train_loss: 0.5558, test_loss: 1.1256, test_f1: 0.6043
 epoch: 83, train_loss: 0.5500, test_loss: 1.1316, test_f1: 0.6282
 epoch: 84, train_loss: 0.5318, test_loss: 1.1339, test_f1: 0.6157
 epoch: 85, train_loss: 0.5360, test_loss: 1.2607, test_f1: 0.6079
 epoch: 86, train_loss: 0.5335, test_loss: 1.0805, test_f1: 0.6573
 epoch: 87, train_loss: 0.5125, test_loss: 1.1747, test_f1: 0.6198
 epoch: 88, train_loss: 0.5025, test_loss: 1.1463, test_f1: 0.6538
 epoch: 89, train_loss: 0.5312, test_loss: 1.1651, test_f1: 0.6491
 epoch: 90, train_loss: 0.5175, test_loss: 1.1743, test_f1: 0.6222
 epoch: 91, train_loss: 0.4871, test_loss: 1.2321, test_f1: 0.6197
 epoch: 92, train_loss: 0.5175, test_loss: 1.1802, test_f1: 0.6514
 epoch: 93, train_loss: 0.5175, test_loss: 1.1563, test_f1: 0.6553
 epoch: 94, train_loss: 0.5127, test_loss: 1.2081, test_f1: 0.6173
 epoch: 95, train_loss: 0.4900, test_loss: 1.1623, test_f1: 0.6267
 epoch: 96, train_loss: 0.4761, test_loss: 1.2061, test_f1: 0.6241
 epoch: 97, train_loss: 0.4884, test_loss: 1.2828, test_f1: 0.6143
 epoch: 98, train_loss: 0.4817, test_loss: 1.0892, test_f1: 0.6658
 epoch: 99, train_loss: 0.4973, test_loss: 1.2257, test_f1: 0.6225

Training completed in 574.94 seconds
Best F1: 0.6658 at epoch 98
Mean F1 across iterations: 0.6476  0.0137
========================FINAL RESULTS================================
FEGIN weighted F1: 0.6658  0.0137
python main.py --data ltspice_demos --representation component_net --model FEGIN --layers 3 --hiddens 32 --batch_size 64 --lr 0.001 --emb_size 128 --epochs 100 --save_appendix component_net_L3_H32_BS64_LR0.001_E128 --no_val
-----



STDERR:
  File "main.py", line 370, in <module>
    main()
  File "main.py", line 254, in main
    dataset = dataset_class(
  File "/home/philip/projects/ltspice_examples_code_repo/Circuit-Completion-Using-GNNs/component_classification_with_link_prediction_head/evaluation/FEGIN/kernel/circuit_datasets.py", line 15, in __init__
    self.data, self.slices = torch.load(self.processed_paths[0])
  File "/home/philip/.local/lib/python3.8/site-packages/torch/serialization.py", line 1040, in load
    warnings.warn(
  File "/usr/lib/python3.8/warnings.py", line 109, in _showwarnmsg
    sw(msg.message, msg.category, msg.filename, msg.lineno,
  File "main.py", line 47, in warn_with_traceback
    traceback.print_stack(file=log)
/home/philip/projects/ltspice_examples_code_repo/Circuit-Completion-Using-GNNs/component_classification_with_link_prediction_head/evaluation/FEGIN/kernel/circuit_datasets.py:15: FutureWarning: You are using `torch.load` with `weights_only=False` (the current default value), which uses the default pickle module implicitly. It is possible to construct malicious pickle data which will execute arbitrary code during unpickling (See https://github.com/pytorch/pytorch/blob/main/SECURITY.md#untrusted-models for more details). In a future release, the default value for `weights_only` will be flipped to `True`. This limits the functions that could be executed during unpickling. Arbitrary objects will no longer be allowed to be loaded via this mode unless they are explicitly allowlisted by the user via `torch.serialization.add_safe_globals`. We recommend you start setting `weights_only=True` for any use case where you don't have full control of the loaded file. Please open an issue on GitHub for any issues related to this experimental feature.
  self.data, self.slices = torch.load(self.processed_paths[0])
