STDOUT:
Results will be saved in /home/philip/projects/llm_inference_code_repo/Circuit-Completion-Using-GNNs/component_classification_with_link_prediction_head/evaluation/FEGIN/results/model_FEGIN_dataset_ltspice_examples
Command line input: python main.py --data ltspice_examples --representation component_component --model FEGIN --layers 6 --hiddens 64 --batch_size 64 --lr 0.001 --emb_size 512 --epochs 100 --save_appendix component_component_L6_H64_BS64_LR0.001_E512 --no_val
 is saved.
-----
ltspice_examples - FEGIN
Using 6 layers, 64 hidden units, h = 2
Loading component_component representation dataset
ENTERED
Training FEGIN on component_component representation
Train: 3556, Test: 845
##################ITERATION #0 ****************************************
 epoch: 0, train_loss: 1.2841, test_loss: 1.2260, test_f1: 0.2416
 epoch: 1, train_loss: 1.2058, test_loss: 1.1387, test_f1: 0.3650
 epoch: 2, train_loss: 1.1443, test_loss: 1.1092, test_f1: 0.4443
 epoch: 3, train_loss: 1.0999, test_loss: 1.0974, test_f1: 0.4413
 epoch: 4, train_loss: 1.0536, test_loss: 1.0257, test_f1: 0.4806
 epoch: 5, train_loss: 1.0151, test_loss: 0.9748, test_f1: 0.4991
 epoch: 6, train_loss: 0.9871, test_loss: 1.0184, test_f1: 0.4509
 epoch: 7, train_loss: 0.9692, test_loss: 0.9738, test_f1: 0.4905
 epoch: 8, train_loss: 0.9418, test_loss: 0.9558, test_f1: 0.4715
 epoch: 9, train_loss: 0.9253, test_loss: 0.9405, test_f1: 0.5067
 epoch: 10, train_loss: 0.9127, test_loss: 0.9845, test_f1: 0.4977
 epoch: 11, train_loss: 0.8953, test_loss: 0.9847, test_f1: 0.5235
 epoch: 12, train_loss: 0.8882, test_loss: 1.0565, test_f1: 0.5110
 epoch: 13, train_loss: 0.8650, test_loss: 0.9975, test_f1: 0.5249
 epoch: 14, train_loss: 0.8561, test_loss: 0.9718, test_f1: 0.5389
 epoch: 15, train_loss: 0.8491, test_loss: 0.9613, test_f1: 0.5298
 epoch: 16, train_loss: 0.8314, test_loss: 1.0669, test_f1: 0.5371
 epoch: 17, train_loss: 0.8198, test_loss: 0.9773, test_f1: 0.5314
 epoch: 18, train_loss: 0.8152, test_loss: 1.0071, test_f1: 0.4973
 epoch: 19, train_loss: 0.8082, test_loss: 1.0996, test_f1: 0.5193
 epoch: 20, train_loss: 0.7913, test_loss: 1.0691, test_f1: 0.5312
 epoch: 21, train_loss: 0.7869, test_loss: 1.0637, test_f1: 0.5411
 epoch: 22, train_loss: 0.7921, test_loss: 1.0629, test_f1: 0.5594
 epoch: 23, train_loss: 0.7711, test_loss: 1.1115, test_f1: 0.5189
 epoch: 24, train_loss: 0.7576, test_loss: 1.1554, test_f1: 0.5447
 epoch: 25, train_loss: 0.7610, test_loss: 1.0424, test_f1: 0.5413
 epoch: 26, train_loss: 0.7504, test_loss: 1.1281, test_f1: 0.5457
 epoch: 27, train_loss: 0.7364, test_loss: 1.1205, test_f1: 0.5379
 epoch: 28, train_loss: 0.7306, test_loss: 1.1618, test_f1: 0.5406
 epoch: 29, train_loss: 0.7202, test_loss: 1.1786, test_f1: 0.5515
 epoch: 30, train_loss: 0.6995, test_loss: 1.2279, test_f1: 0.5522
 epoch: 31, train_loss: 0.7046, test_loss: 1.1609, test_f1: 0.5667
 epoch: 32, train_loss: 0.7091, test_loss: 1.1316, test_f1: 0.5459
 epoch: 33, train_loss: 0.6943, test_loss: 1.0934, test_f1: 0.5567
 epoch: 34, train_loss: 0.7003, test_loss: 1.2119, test_f1: 0.5137
 epoch: 35, train_loss: 0.6947, test_loss: 1.1020, test_f1: 0.5464
 epoch: 36, train_loss: 0.6684, test_loss: 1.2904, test_f1: 0.5647
 epoch: 37, train_loss: 0.6635, test_loss: 1.1846, test_f1: 0.5581
 epoch: 38, train_loss: 0.6620, test_loss: 1.1980, test_f1: 0.5448
 epoch: 39, train_loss: 0.6678, test_loss: 1.2013, test_f1: 0.5625
 epoch: 40, train_loss: 0.6358, test_loss: 1.2651, test_f1: 0.5401
 epoch: 41, train_loss: 0.6252, test_loss: 1.3431, test_f1: 0.5346
 epoch: 42, train_loss: 0.6432, test_loss: 1.2997, test_f1: 0.5551
 epoch: 43, train_loss: 0.6273, test_loss: 1.3241, test_f1: 0.5437
 epoch: 44, train_loss: 0.6270, test_loss: 1.3093, test_f1: 0.5670
 epoch: 45, train_loss: 0.6063, test_loss: 1.3035, test_f1: 0.5536
 epoch: 46, train_loss: 0.5940, test_loss: 1.3479, test_f1: 0.5494
 epoch: 47, train_loss: 0.5866, test_loss: 1.4257, test_f1: 0.5321
 epoch: 48, train_loss: 0.5886, test_loss: 1.5009, test_f1: 0.5354
 epoch: 49, train_loss: 0.5769, test_loss: 1.4422, test_f1: 0.5298
 epoch: 50, train_loss: 0.5897, test_loss: 1.4696, test_f1: 0.5212
 epoch: 51, train_loss: 0.5312, test_loss: 1.4186, test_f1: 0.5670
 epoch: 52, train_loss: 0.5265, test_loss: 1.4758, test_f1: 0.5487
 epoch: 53, train_loss: 0.4946, test_loss: 1.5387, test_f1: 0.5556
 epoch: 54, train_loss: 0.5024, test_loss: 1.5135, test_f1: 0.5417
 epoch: 55, train_loss: 0.4948, test_loss: 1.5382, test_f1: 0.5687
 epoch: 56, train_loss: 0.4726, test_loss: 1.6000, test_f1: 0.5393
 epoch: 57, train_loss: 0.4860, test_loss: 1.5287, test_f1: 0.5540
 epoch: 58, train_loss: 0.4815, test_loss: 1.5392, test_f1: 0.5394
 epoch: 59, train_loss: 0.4758, test_loss: 1.5001, test_f1: 0.5559
 epoch: 60, train_loss: 0.4728, test_loss: 1.5406, test_f1: 0.5532
 epoch: 61, train_loss: 0.4664, test_loss: 1.4973, test_f1: 0.5705
 epoch: 62, train_loss: 0.4563, test_loss: 1.6165, test_f1: 0.5420
 epoch: 63, train_loss: 0.4723, test_loss: 1.5584, test_f1: 0.5573
 epoch: 64, train_loss: 0.4538, test_loss: 1.6428, test_f1: 0.5635
 epoch: 65, train_loss: 0.4480, test_loss: 1.6289, test_f1: 0.5522
 epoch: 66, train_loss: 0.4532, test_loss: 1.7116, test_f1: 0.5575
 epoch: 67, train_loss: 0.4453, test_loss: 1.7032, test_f1: 0.5506
 epoch: 68, train_loss: 0.4252, test_loss: 1.7800, test_f1: 0.5499
 epoch: 69, train_loss: 0.4537, test_loss: 1.7061, test_f1: 0.5573
 epoch: 70, train_loss: 0.4514, test_loss: 1.7525, test_f1: 0.5616
 epoch: 71, train_loss: 0.3949, test_loss: 1.7328, test_f1: 0.5707
 epoch: 72, train_loss: 0.4298, test_loss: 1.7884, test_f1: 0.5568
 epoch: 73, train_loss: 0.4392, test_loss: 1.7882, test_f1: 0.5542
 epoch: 74, train_loss: 0.4266, test_loss: 1.7683, test_f1: 0.5478
 epoch: 75, train_loss: 0.4163, test_loss: 1.8595, test_f1: 0.5482
 epoch: 76, train_loss: 0.4167, test_loss: 1.7243, test_f1: 0.5737
 epoch: 77, train_loss: 0.4260, test_loss: 1.7471, test_f1: 0.5828
 epoch: 78, train_loss: 0.3869, test_loss: 1.7332, test_f1: 0.5504
 epoch: 79, train_loss: 0.4042, test_loss: 1.7844, test_f1: 0.5551
 epoch: 80, train_loss: 0.4228, test_loss: 1.7158, test_f1: 0.5674
 epoch: 81, train_loss: 0.4202, test_loss: 1.8336, test_f1: 0.5549
 epoch: 82, train_loss: 0.4105, test_loss: 1.7899, test_f1: 0.5677
 epoch: 83, train_loss: 0.3890, test_loss: 1.7553, test_f1: 0.5837
 epoch: 84, train_loss: 0.3983, test_loss: 1.8255, test_f1: 0.5666
 epoch: 85, train_loss: 0.3922, test_loss: 1.8932, test_f1: 0.5640
 epoch: 86, train_loss: 0.3800, test_loss: 1.8526, test_f1: 0.5395
 epoch: 87, train_loss: 0.3867, test_loss: 1.8340, test_f1: 0.5570
 epoch: 88, train_loss: 0.3655, test_loss: 2.0139, test_f1: 0.5560
 epoch: 89, train_loss: 0.3858, test_loss: 1.8379, test_f1: 0.5780
 epoch: 90, train_loss: 0.3897, test_loss: 1.9133, test_f1: 0.5589
 epoch: 91, train_loss: 0.3697, test_loss: 2.0485, test_f1: 0.5553
 epoch: 92, train_loss: 0.3608, test_loss: 1.8966, test_f1: 0.5662
 epoch: 93, train_loss: 0.3575, test_loss: 1.9473, test_f1: 0.5877
 epoch: 94, train_loss: 0.3565, test_loss: 1.9857, test_f1: 0.5664
 epoch: 95, train_loss: 0.3541, test_loss: 2.0148, test_f1: 0.5813
 epoch: 96, train_loss: 0.3698, test_loss: 1.9553, test_f1: 0.5735
 epoch: 97, train_loss: 0.3567, test_loss: 1.9239, test_f1: 0.5805
 epoch: 98, train_loss: 0.3653, test_loss: 1.8915, test_f1: 0.5770
 epoch: 99, train_loss: 0.3582, test_loss: 1.8390, test_f1: 0.5723
##################ITERATION #1 ****************************************
 epoch: 0, train_loss: 1.2399, test_loss: 1.1633, test_f1: 0.4113
 epoch: 1, train_loss: 1.1496, test_loss: 1.0875, test_f1: 0.4441
 epoch: 2, train_loss: 1.1102, test_loss: 1.0632, test_f1: 0.4591
 epoch: 3, train_loss: 1.0880, test_loss: 1.0452, test_f1: 0.4535
 epoch: 4, train_loss: 1.0560, test_loss: 0.9962, test_f1: 0.4889
 epoch: 5, train_loss: 1.0274, test_loss: 0.9771, test_f1: 0.4705
 epoch: 6, train_loss: 1.0080, test_loss: 0.9694, test_f1: 0.4781
 epoch: 7, train_loss: 0.9781, test_loss: 1.0508, test_f1: 0.4305
 epoch: 8, train_loss: 0.9659, test_loss: 0.9710, test_f1: 0.5189
 epoch: 9, train_loss: 0.9585, test_loss: 0.9682, test_f1: 0.5146
 epoch: 10, train_loss: 0.9322, test_loss: 1.0425, test_f1: 0.4618
 epoch: 11, train_loss: 0.9164, test_loss: 0.9315, test_f1: 0.5212
 epoch: 12, train_loss: 0.9050, test_loss: 0.9929, test_f1: 0.5367
 epoch: 13, train_loss: 0.8979, test_loss: 1.0154, test_f1: 0.5267
 epoch: 14, train_loss: 0.8901, test_loss: 0.9452, test_f1: 0.5190
 epoch: 15, train_loss: 0.8659, test_loss: 1.1508, test_f1: 0.5268
 epoch: 16, train_loss: 0.8664, test_loss: 0.9465, test_f1: 0.5544
 epoch: 17, train_loss: 0.8479, test_loss: 1.0286, test_f1: 0.5277
 epoch: 18, train_loss: 0.8299, test_loss: 0.9703, test_f1: 0.5506
 epoch: 19, train_loss: 0.8451, test_loss: 0.9553, test_f1: 0.5411
 epoch: 20, train_loss: 0.8411, test_loss: 0.9949, test_f1: 0.5585
 epoch: 21, train_loss: 0.8127, test_loss: 1.0729, test_f1: 0.5198
 epoch: 22, train_loss: 0.8089, test_loss: 1.0001, test_f1: 0.5494
 epoch: 23, train_loss: 0.7871, test_loss: 1.0027, test_f1: 0.5537
 epoch: 24, train_loss: 0.7747, test_loss: 1.0035, test_f1: 0.5354
 epoch: 25, train_loss: 0.7891, test_loss: 1.0040, test_f1: 0.5190
 epoch: 26, train_loss: 0.7763, test_loss: 1.0470, test_f1: 0.5613
 epoch: 27, train_loss: 0.7586, test_loss: 1.0847, test_f1: 0.5528
 epoch: 28, train_loss: 0.7671, test_loss: 1.0127, test_f1: 0.5417
 epoch: 29, train_loss: 0.7426, test_loss: 1.0502, test_f1: 0.5345
 epoch: 30, train_loss: 0.7348, test_loss: 1.1120, test_f1: 0.5497
 epoch: 31, train_loss: 0.7392, test_loss: 1.0560, test_f1: 0.5360
 epoch: 32, train_loss: 0.7333, test_loss: 1.0899, test_f1: 0.5431
 epoch: 33, train_loss: 0.7130, test_loss: 1.1780, test_f1: 0.5313
 epoch: 34, train_loss: 0.7134, test_loss: 1.0662, test_f1: 0.5672
 epoch: 35, train_loss: 0.7150, test_loss: 1.1168, test_f1: 0.5521
 epoch: 36, train_loss: 0.7092, test_loss: 1.1093, test_f1: 0.5614
 epoch: 37, train_loss: 0.7095, test_loss: 1.0449, test_f1: 0.5278
 epoch: 38, train_loss: 0.7112, test_loss: 1.1833, test_f1: 0.5673
 epoch: 39, train_loss: 0.7039, test_loss: 1.0961, test_f1: 0.5780
 epoch: 40, train_loss: 0.6771, test_loss: 1.1992, test_f1: 0.5394
 epoch: 41, train_loss: 0.6671, test_loss: 1.2200, test_f1: 0.5039
 epoch: 42, train_loss: 0.6855, test_loss: 1.1445, test_f1: 0.5518
 epoch: 43, train_loss: 0.6713, test_loss: 1.1938, test_f1: 0.5274
 epoch: 44, train_loss: 0.6403, test_loss: 1.2307, test_f1: 0.5384
 epoch: 45, train_loss: 0.6500, test_loss: 1.0867, test_f1: 0.5358
 epoch: 46, train_loss: 0.6404, test_loss: 1.2076, test_f1: 0.5341
 epoch: 47, train_loss: 0.6471, test_loss: 1.2128, test_f1: 0.5327
 epoch: 48, train_loss: 0.6319, test_loss: 1.0687, test_f1: 0.5529
 epoch: 49, train_loss: 0.6362, test_loss: 1.2055, test_f1: 0.5569
 epoch: 50, train_loss: 0.6314, test_loss: 1.2268, test_f1: 0.5752
 epoch: 51, train_loss: 0.5789, test_loss: 1.2902, test_f1: 0.5660
 epoch: 52, train_loss: 0.5758, test_loss: 1.2668, test_f1: 0.5624
 epoch: 53, train_loss: 0.5622, test_loss: 1.2406, test_f1: 0.5620
 epoch: 54, train_loss: 0.5539, test_loss: 1.3049, test_f1: 0.5585
 epoch: 55, train_loss: 0.5346, test_loss: 1.3294, test_f1: 0.5533
 epoch: 56, train_loss: 0.5451, test_loss: 1.3745, test_f1: 0.5466
 epoch: 57, train_loss: 0.5264, test_loss: 1.3435, test_f1: 0.5540
 epoch: 58, train_loss: 0.5287, test_loss: 1.2616, test_f1: 0.5672
 epoch: 59, train_loss: 0.5011, test_loss: 1.3448, test_f1: 0.5757
 epoch: 60, train_loss: 0.5014, test_loss: 1.3809, test_f1: 0.5481
 epoch: 61, train_loss: 0.5051, test_loss: 1.3905, test_f1: 0.5448
 epoch: 62, train_loss: 0.5014, test_loss: 1.4288, test_f1: 0.5706
 epoch: 63, train_loss: 0.5340, test_loss: 1.4086, test_f1: 0.5176
 epoch: 64, train_loss: 0.5191, test_loss: 1.4480, test_f1: 0.5529
 epoch: 65, train_loss: 0.4899, test_loss: 1.4086, test_f1: 0.5443
 epoch: 66, train_loss: 0.4834, test_loss: 1.4447, test_f1: 0.5463
 epoch: 67, train_loss: 0.4952, test_loss: 1.3880, test_f1: 0.5647
 epoch: 68, train_loss: 0.4705, test_loss: 1.4452, test_f1: 0.5560
 epoch: 69, train_loss: 0.4909, test_loss: 1.4713, test_f1: 0.5681
 epoch: 70, train_loss: 0.4531, test_loss: 1.5029, test_f1: 0.5668
 epoch: 71, train_loss: 0.4680, test_loss: 1.4597, test_f1: 0.5666
 epoch: 72, train_loss: 0.4652, test_loss: 1.4901, test_f1: 0.5751
 epoch: 73, train_loss: 0.4534, test_loss: 1.6097, test_f1: 0.5544
 epoch: 74, train_loss: 0.4544, test_loss: 1.4848, test_f1: 0.5663
 epoch: 75, train_loss: 0.4550, test_loss: 1.5735, test_f1: 0.5750
 epoch: 76, train_loss: 0.4549, test_loss: 1.6793, test_f1: 0.5440
 epoch: 77, train_loss: 0.4509, test_loss: 1.5190, test_f1: 0.5498
 epoch: 78, train_loss: 0.4376, test_loss: 1.5370, test_f1: 0.5719
 epoch: 79, train_loss: 0.4374, test_loss: 1.5607, test_f1: 0.5587
 epoch: 80, train_loss: 0.4501, test_loss: 1.5889, test_f1: 0.5653
 epoch: 81, train_loss: 0.4352, test_loss: 1.6007, test_f1: 0.5802
 epoch: 82, train_loss: 0.4429, test_loss: 1.7098, test_f1: 0.5562
 epoch: 83, train_loss: 0.4428, test_loss: 1.5675, test_f1: 0.5681
 epoch: 84, train_loss: 0.4261, test_loss: 1.6056, test_f1: 0.5658
 epoch: 85, train_loss: 0.4064, test_loss: 1.6415, test_f1: 0.5640
 epoch: 86, train_loss: 0.4033, test_loss: 1.5885, test_f1: 0.5784
 epoch: 87, train_loss: 0.4244, test_loss: 1.5925, test_f1: 0.5672
 epoch: 88, train_loss: 0.3980, test_loss: 1.7555, test_f1: 0.5753
 epoch: 89, train_loss: 0.4308, test_loss: 1.7446, test_f1: 0.5682
 epoch: 90, train_loss: 0.4134, test_loss: 1.6763, test_f1: 0.5511
 epoch: 91, train_loss: 0.3997, test_loss: 1.6368, test_f1: 0.5630
 epoch: 92, train_loss: 0.4006, test_loss: 1.6345, test_f1: 0.5666
 epoch: 93, train_loss: 0.4122, test_loss: 1.6386, test_f1: 0.5687
 epoch: 94, train_loss: 0.4056, test_loss: 1.7268, test_f1: 0.5847
 epoch: 95, train_loss: 0.4044, test_loss: 1.7438, test_f1: 0.5651
 epoch: 96, train_loss: 0.3975, test_loss: 1.7064, test_f1: 0.5509
 epoch: 97, train_loss: 0.3836, test_loss: 1.6361, test_f1: 0.5860
 epoch: 98, train_loss: 0.3677, test_loss: 1.6835, test_f1: 0.5754
 epoch: 99, train_loss: 0.3540, test_loss: 1.7261, test_f1: 0.5702
##################ITERATION #2 ****************************************
 epoch: 0, train_loss: 1.2555, test_loss: 1.1510, test_f1: 0.3490
 epoch: 1, train_loss: 1.1520, test_loss: 1.0688, test_f1: 0.4457
 epoch: 2, train_loss: 1.1145, test_loss: 1.0598, test_f1: 0.4257
 epoch: 3, train_loss: 1.0703, test_loss: 1.0328, test_f1: 0.4335
 epoch: 4, train_loss: 1.0431, test_loss: 1.0081, test_f1: 0.4492
 epoch: 5, train_loss: 1.0140, test_loss: 0.9987, test_f1: 0.4843
 epoch: 6, train_loss: 0.9958, test_loss: 0.9860, test_f1: 0.4578
 epoch: 7, train_loss: 0.9721, test_loss: 0.9595, test_f1: 0.4838
 epoch: 8, train_loss: 0.9561, test_loss: 0.9616, test_f1: 0.5132
 epoch: 9, train_loss: 0.9499, test_loss: 0.9637, test_f1: 0.4910
 epoch: 10, train_loss: 0.9280, test_loss: 0.9064, test_f1: 0.5264
 epoch: 11, train_loss: 0.9196, test_loss: 0.9256, test_f1: 0.4917
 epoch: 12, train_loss: 0.9002, test_loss: 0.9070, test_f1: 0.5325
 epoch: 13, train_loss: 0.8851, test_loss: 0.9714, test_f1: 0.5282
 epoch: 14, train_loss: 0.8817, test_loss: 0.9736, test_f1: 0.5211
 epoch: 15, train_loss: 0.8659, test_loss: 0.9274, test_f1: 0.5504
 epoch: 16, train_loss: 0.8620, test_loss: 0.9488, test_f1: 0.5506
 epoch: 17, train_loss: 0.8544, test_loss: 1.0076, test_f1: 0.5324
 epoch: 18, train_loss: 0.8420, test_loss: 0.9675, test_f1: 0.5301
 epoch: 19, train_loss: 0.8619, test_loss: 0.9351, test_f1: 0.5604
 epoch: 20, train_loss: 0.8292, test_loss: 1.2583, test_f1: 0.4850
 epoch: 21, train_loss: 0.8204, test_loss: 1.0269, test_f1: 0.5333
 epoch: 22, train_loss: 0.8131, test_loss: 1.0190, test_f1: 0.5488
 epoch: 23, train_loss: 0.7964, test_loss: 1.0186, test_f1: 0.5367
 epoch: 24, train_loss: 0.7912, test_loss: 0.9870, test_f1: 0.5374
 epoch: 25, train_loss: 0.7819, test_loss: 1.0305, test_f1: 0.5445
 epoch: 26, train_loss: 0.7895, test_loss: 1.0493, test_f1: 0.5210
 epoch: 27, train_loss: 0.7736, test_loss: 1.0726, test_f1: 0.5045
 epoch: 28, train_loss: 0.7677, test_loss: 1.1055, test_f1: 0.5221
 epoch: 29, train_loss: 0.7617, test_loss: 1.0563, test_f1: 0.5550
 epoch: 30, train_loss: 0.7330, test_loss: 1.1362, test_f1: 0.5342
 epoch: 31, train_loss: 0.7578, test_loss: 1.0547, test_f1: 0.5358
 epoch: 32, train_loss: 0.7438, test_loss: 1.0588, test_f1: 0.5392
 epoch: 33, train_loss: 0.7256, test_loss: 1.0675, test_f1: 0.5209
 epoch: 34, train_loss: 0.7042, test_loss: 1.0943, test_f1: 0.5372
 epoch: 35, train_loss: 0.7348, test_loss: 1.0682, test_f1: 0.5661
 epoch: 36, train_loss: 0.7049, test_loss: 1.1136, test_f1: 0.5363
 epoch: 37, train_loss: 0.7001, test_loss: 1.0558, test_f1: 0.5563
 epoch: 38, train_loss: 0.6945, test_loss: 1.2102, test_f1: 0.5311
 epoch: 39, train_loss: 0.6839, test_loss: 1.4068, test_f1: 0.5187
 epoch: 40, train_loss: 0.7019, test_loss: 1.1161, test_f1: 0.5600
 epoch: 41, train_loss: 0.6774, test_loss: 1.1056, test_f1: 0.5412
 epoch: 42, train_loss: 0.6712, test_loss: 1.0661, test_f1: 0.5345
 epoch: 43, train_loss: 0.6806, test_loss: 1.2235, test_f1: 0.5291
 epoch: 44, train_loss: 0.6461, test_loss: 1.1575, test_f1: 0.5519
 epoch: 45, train_loss: 0.6759, test_loss: 1.1864, test_f1: 0.5664
 epoch: 46, train_loss: 0.6687, test_loss: 1.1505, test_f1: 0.5418
 epoch: 47, train_loss: 0.6592, test_loss: 1.1183, test_f1: 0.5679
 epoch: 48, train_loss: 0.6567, test_loss: 1.1957, test_f1: 0.5433
 epoch: 49, train_loss: 0.6432, test_loss: 1.2194, test_f1: 0.5318
 epoch: 50, train_loss: 0.6481, test_loss: 1.1218, test_f1: 0.5447
 epoch: 51, train_loss: 0.5926, test_loss: 1.2626, test_f1: 0.5780
 epoch: 52, train_loss: 0.5865, test_loss: 1.2238, test_f1: 0.5805
 epoch: 53, train_loss: 0.5541, test_loss: 1.2838, test_f1: 0.5636
 epoch: 54, train_loss: 0.5484, test_loss: 1.2827, test_f1: 0.5633
 epoch: 55, train_loss: 0.5591, test_loss: 1.2756, test_f1: 0.5757
 epoch: 56, train_loss: 0.5432, test_loss: 1.2505, test_f1: 0.5767
 epoch: 57, train_loss: 0.5326, test_loss: 1.3076, test_f1: 0.5811
 epoch: 58, train_loss: 0.5473, test_loss: 1.3420, test_f1: 0.5760
 epoch: 59, train_loss: 0.5406, test_loss: 1.3570, test_f1: 0.5899
 epoch: 60, train_loss: 0.5236, test_loss: 1.4005, test_f1: 0.5864
 epoch: 61, train_loss: 0.5416, test_loss: 1.3257, test_f1: 0.5919
 epoch: 62, train_loss: 0.5223, test_loss: 1.3571, test_f1: 0.5682
 epoch: 63, train_loss: 0.5210, test_loss: 1.4241, test_f1: 0.5810
 epoch: 64, train_loss: 0.4994, test_loss: 1.4483, test_f1: 0.5776
 epoch: 65, train_loss: 0.5130, test_loss: 1.3765, test_f1: 0.5927
 epoch: 66, train_loss: 0.5048, test_loss: 1.4211, test_f1: 0.5712
 epoch: 67, train_loss: 0.4973, test_loss: 1.4296, test_f1: 0.5684
 epoch: 68, train_loss: 0.4858, test_loss: 1.4547, test_f1: 0.5811
 epoch: 69, train_loss: 0.4940, test_loss: 1.3999, test_f1: 0.5826
 epoch: 70, train_loss: 0.4888, test_loss: 1.5013, test_f1: 0.5574
 epoch: 71, train_loss: 0.4979, test_loss: 1.4731, test_f1: 0.5740
 epoch: 72, train_loss: 0.4795, test_loss: 1.4574, test_f1: 0.5790
 epoch: 73, train_loss: 0.4681, test_loss: 1.5539, test_f1: 0.5529
 epoch: 74, train_loss: 0.4656, test_loss: 1.4986, test_f1: 0.5789
 epoch: 75, train_loss: 0.4601, test_loss: 1.5558, test_f1: 0.5760
 epoch: 76, train_loss: 0.4749, test_loss: 1.5263, test_f1: 0.5596
 epoch: 77, train_loss: 0.4571, test_loss: 1.5298, test_f1: 0.5868
 epoch: 78, train_loss: 0.4576, test_loss: 1.5269, test_f1: 0.5795
 epoch: 79, train_loss: 0.4519, test_loss: 1.5330, test_f1: 0.5891
 epoch: 80, train_loss: 0.4391, test_loss: 1.5687, test_f1: 0.5690
 epoch: 81, train_loss: 0.4250, test_loss: 1.6577, test_f1: 0.5750
 epoch: 82, train_loss: 0.4679, test_loss: 1.5941, test_f1: 0.5659
 epoch: 83, train_loss: 0.4563, test_loss: 1.5932, test_f1: 0.5663
 epoch: 84, train_loss: 0.4495, test_loss: 1.6089, test_f1: 0.5874
 epoch: 85, train_loss: 0.4250, test_loss: 1.6413, test_f1: 0.5971
 epoch: 86, train_loss: 0.4247, test_loss: 1.6078, test_f1: 0.5644
 epoch: 87, train_loss: 0.4284, test_loss: 1.6418, test_f1: 0.5698
 epoch: 88, train_loss: 0.4414, test_loss: 1.5547, test_f1: 0.5545
 epoch: 89, train_loss: 0.4248, test_loss: 1.7111, test_f1: 0.5706
 epoch: 90, train_loss: 0.4211, test_loss: 1.7012, test_f1: 0.5824
 epoch: 91, train_loss: 0.4189, test_loss: 1.7200, test_f1: 0.5971
 epoch: 92, train_loss: 0.4077, test_loss: 1.6420, test_f1: 0.5808
 epoch: 93, train_loss: 0.4056, test_loss: 1.6927, test_f1: 0.5765
 epoch: 94, train_loss: 0.4104, test_loss: 1.6360, test_f1: 0.5915
 epoch: 95, train_loss: 0.4088, test_loss: 1.6063, test_f1: 0.5862
 epoch: 96, train_loss: 0.4091, test_loss: 1.7263, test_f1: 0.5708
 epoch: 97, train_loss: 0.3928, test_loss: 1.6976, test_f1: 0.5679
 epoch: 98, train_loss: 0.3981, test_loss: 1.7370, test_f1: 0.5756
 epoch: 99, train_loss: 0.3972, test_loss: 1.7966, test_f1: 0.5613
##################ITERATION #3 ****************************************
 epoch: 0, train_loss: 1.2790, test_loss: 1.1559, test_f1: 0.4213
 epoch: 1, train_loss: 1.1408, test_loss: 1.0658, test_f1: 0.4456
 epoch: 2, train_loss: 1.0955, test_loss: 1.0364, test_f1: 0.4301
 epoch: 3, train_loss: 1.0465, test_loss: 0.9733, test_f1: 0.4585
 epoch: 4, train_loss: 1.0208, test_loss: 0.9692, test_f1: 0.4758
 epoch: 5, train_loss: 1.0123, test_loss: 0.9572, test_f1: 0.4844
 epoch: 6, train_loss: 0.9989, test_loss: 0.9739, test_f1: 0.4785
 epoch: 7, train_loss: 0.9606, test_loss: 0.9349, test_f1: 0.5309
 epoch: 8, train_loss: 0.9631, test_loss: 0.9537, test_f1: 0.4799
 epoch: 9, train_loss: 0.9414, test_loss: 0.9218, test_f1: 0.5071
 epoch: 10, train_loss: 0.9309, test_loss: 0.9194, test_f1: 0.4847
 epoch: 11, train_loss: 0.9229, test_loss: 0.9857, test_f1: 0.4974
 epoch: 12, train_loss: 0.9051, test_loss: 0.9119, test_f1: 0.5174
 epoch: 13, train_loss: 0.8806, test_loss: 0.9722, test_f1: 0.5194
 epoch: 14, train_loss: 0.8808, test_loss: 1.0000, test_f1: 0.5296
 epoch: 15, train_loss: 0.8665, test_loss: 0.9767, test_f1: 0.5269
 epoch: 16, train_loss: 0.8660, test_loss: 0.9376, test_f1: 0.5475
 epoch: 17, train_loss: 0.8571, test_loss: 0.9967, test_f1: 0.5206
 epoch: 18, train_loss: 0.8459, test_loss: 0.9701, test_f1: 0.5359
 epoch: 19, train_loss: 0.8521, test_loss: 0.9523, test_f1: 0.5442
 epoch: 20, train_loss: 0.8269, test_loss: 0.9247, test_f1: 0.5131
 epoch: 21, train_loss: 0.8252, test_loss: 0.9631, test_f1: 0.5585
 epoch: 22, train_loss: 0.8160, test_loss: 0.9955, test_f1: 0.5259
 epoch: 23, train_loss: 0.8144, test_loss: 0.9831, test_f1: 0.5335
 epoch: 24, train_loss: 0.8111, test_loss: 1.0649, test_f1: 0.5607
 epoch: 25, train_loss: 0.7963, test_loss: 0.9795, test_f1: 0.5426
 epoch: 26, train_loss: 0.7988, test_loss: 1.0257, test_f1: 0.5479
 epoch: 27, train_loss: 0.7858, test_loss: 1.0279, test_f1: 0.5380
 epoch: 28, train_loss: 0.7651, test_loss: 1.0143, test_f1: 0.5600
 epoch: 29, train_loss: 0.7584, test_loss: 1.0092, test_f1: 0.5486
 epoch: 30, train_loss: 0.7603, test_loss: 1.0144, test_f1: 0.5755
 epoch: 31, train_loss: 0.7691, test_loss: 1.0187, test_f1: 0.5534
 epoch: 32, train_loss: 0.7553, test_loss: 1.0113, test_f1: 0.5510
 epoch: 33, train_loss: 0.7490, test_loss: 1.0129, test_f1: 0.5570
 epoch: 34, train_loss: 0.7373, test_loss: 1.0693, test_f1: 0.5492
 epoch: 35, train_loss: 0.7372, test_loss: 1.2071, test_f1: 0.4918
 epoch: 36, train_loss: 0.7193, test_loss: 1.0701, test_f1: 0.5320
 epoch: 37, train_loss: 0.7118, test_loss: 1.0824, test_f1: 0.5553
 epoch: 38, train_loss: 0.7292, test_loss: 1.0835, test_f1: 0.5444
 epoch: 39, train_loss: 0.7021, test_loss: 1.0651, test_f1: 0.5528
 epoch: 40, train_loss: 0.6951, test_loss: 1.1002, test_f1: 0.5694
 epoch: 41, train_loss: 0.6841, test_loss: 1.0715, test_f1: 0.5701
 epoch: 42, train_loss: 0.6740, test_loss: 1.1716, test_f1: 0.5457
 epoch: 43, train_loss: 0.6630, test_loss: 1.1403, test_f1: 0.5581
 epoch: 44, train_loss: 0.6926, test_loss: 1.2395, test_f1: 0.5437
 epoch: 45, train_loss: 0.6718, test_loss: 1.1159, test_f1: 0.5550
 epoch: 46, train_loss: 0.6796, test_loss: 1.1766, test_f1: 0.5678
 epoch: 47, train_loss: 0.6622, test_loss: 1.1131, test_f1: 0.5497
 epoch: 48, train_loss: 0.6696, test_loss: 1.0730, test_f1: 0.5449
 epoch: 49, train_loss: 0.6332, test_loss: 1.1539, test_f1: 0.5612
 epoch: 50, train_loss: 0.6423, test_loss: 1.1540, test_f1: 0.5592
 epoch: 51, train_loss: 0.6083, test_loss: 1.1594, test_f1: 0.5621
 epoch: 52, train_loss: 0.5834, test_loss: 1.1326, test_f1: 0.5977
 epoch: 53, train_loss: 0.5941, test_loss: 1.1430, test_f1: 0.5927
 epoch: 54, train_loss: 0.5672, test_loss: 1.1382, test_f1: 0.5946
 epoch: 55, train_loss: 0.5781, test_loss: 1.1619, test_f1: 0.5738
 epoch: 56, train_loss: 0.5559, test_loss: 1.1933, test_f1: 0.5816
 epoch: 57, train_loss: 0.5503, test_loss: 1.2125, test_f1: 0.5978
 epoch: 58, train_loss: 0.5431, test_loss: 1.1312, test_f1: 0.5854
 epoch: 59, train_loss: 0.5479, test_loss: 1.3383, test_f1: 0.5511
 epoch: 60, train_loss: 0.5449, test_loss: 1.1935, test_f1: 0.5811
 epoch: 61, train_loss: 0.5436, test_loss: 1.2122, test_f1: 0.5827
 epoch: 62, train_loss: 0.5564, test_loss: 1.2309, test_f1: 0.5713
 epoch: 63, train_loss: 0.5291, test_loss: 1.2304, test_f1: 0.5700
 epoch: 64, train_loss: 0.5193, test_loss: 1.3788, test_f1: 0.5384
 epoch: 65, train_loss: 0.5251, test_loss: 1.2575, test_f1: 0.5603
 epoch: 66, train_loss: 0.5184, test_loss: 1.2426, test_f1: 0.5696
 epoch: 67, train_loss: 0.5130, test_loss: 1.3305, test_f1: 0.5621
 epoch: 68, train_loss: 0.5126, test_loss: 1.2524, test_f1: 0.5731
 epoch: 69, train_loss: 0.5084, test_loss: 1.2878, test_f1: 0.5661
 epoch: 70, train_loss: 0.5061, test_loss: 1.2959, test_f1: 0.5801
 epoch: 71, train_loss: 0.5113, test_loss: 1.2476, test_f1: 0.5773
 epoch: 72, train_loss: 0.5094, test_loss: 1.3298, test_f1: 0.5895
 epoch: 73, train_loss: 0.4964, test_loss: 1.3363, test_f1: 0.5666
 epoch: 74, train_loss: 0.4917, test_loss: 1.2848, test_f1: 0.5851
 epoch: 75, train_loss: 0.4700, test_loss: 1.4460, test_f1: 0.5556
 epoch: 76, train_loss: 0.4882, test_loss: 1.3319, test_f1: 0.5914
 epoch: 77, train_loss: 0.4854, test_loss: 1.3192, test_f1: 0.5772
 epoch: 78, train_loss: 0.4655, test_loss: 1.3812, test_f1: 0.5696
 epoch: 79, train_loss: 0.4921, test_loss: 1.4054, test_f1: 0.5643
 epoch: 80, train_loss: 0.4710, test_loss: 1.3034, test_f1: 0.5823
 epoch: 81, train_loss: 0.4525, test_loss: 1.3951, test_f1: 0.5723
 epoch: 82, train_loss: 0.4930, test_loss: 1.2949, test_f1: 0.5817
 epoch: 83, train_loss: 0.4530, test_loss: 1.3589, test_f1: 0.6021
 epoch: 84, train_loss: 0.4615, test_loss: 1.3861, test_f1: 0.5733
 epoch: 85, train_loss: 0.4616, test_loss: 1.3301, test_f1: 0.5732
 epoch: 86, train_loss: 0.4403, test_loss: 1.3113, test_f1: 0.5948
 epoch: 87, train_loss: 0.4635, test_loss: 1.3139, test_f1: 0.5976
 epoch: 88, train_loss: 0.4481, test_loss: 1.4047, test_f1: 0.5699
 epoch: 89, train_loss: 0.4478, test_loss: 1.4431, test_f1: 0.5536
 epoch: 90, train_loss: 0.4291, test_loss: 1.4369, test_f1: 0.5586
 epoch: 91, train_loss: 0.4348, test_loss: 1.5410, test_f1: 0.5317
 epoch: 92, train_loss: 0.4438, test_loss: 1.4228, test_f1: 0.5843
 epoch: 93, train_loss: 0.4368, test_loss: 1.4362, test_f1: 0.5818
 epoch: 94, train_loss: 0.4389, test_loss: 1.5298, test_f1: 0.5641
 epoch: 95, train_loss: 0.4355, test_loss: 1.4903, test_f1: 0.5785
 epoch: 96, train_loss: 0.4459, test_loss: 1.4292, test_f1: 0.5760
 epoch: 97, train_loss: 0.4146, test_loss: 1.4051, test_f1: 0.5999
 epoch: 98, train_loss: 0.4379, test_loss: 1.4301, test_f1: 0.5772
 epoch: 99, train_loss: 0.4254, test_loss: 1.4856, test_f1: 0.5748
##################ITERATION #4 ****************************************
 epoch: 0, train_loss: 1.3359, test_loss: 1.1801, test_f1: 0.3813
 epoch: 1, train_loss: 1.1945, test_loss: 1.1208, test_f1: 0.4253
 epoch: 2, train_loss: 1.1469, test_loss: 1.0811, test_f1: 0.4476
 epoch: 3, train_loss: 1.1066, test_loss: 1.0500, test_f1: 0.4410
 epoch: 4, train_loss: 1.0852, test_loss: 1.0218, test_f1: 0.4748
 epoch: 5, train_loss: 1.0559, test_loss: 1.0375, test_f1: 0.4520
 epoch: 6, train_loss: 1.0431, test_loss: 0.9980, test_f1: 0.4466
 epoch: 7, train_loss: 1.0122, test_loss: 1.0247, test_f1: 0.4779
 epoch: 8, train_loss: 0.9987, test_loss: 0.9725, test_f1: 0.4604
 epoch: 9, train_loss: 0.9824, test_loss: 0.9890, test_f1: 0.4620
 epoch: 10, train_loss: 0.9586, test_loss: 0.9507, test_f1: 0.4865
 epoch: 11, train_loss: 0.9379, test_loss: 1.0049, test_f1: 0.4532
 epoch: 12, train_loss: 0.9416, test_loss: 0.9625, test_f1: 0.4838
 epoch: 13, train_loss: 0.9257, test_loss: 0.9807, test_f1: 0.5079
 epoch: 14, train_loss: 0.9147, test_loss: 0.9896, test_f1: 0.4838
 epoch: 15, train_loss: 0.9206, test_loss: 0.9865, test_f1: 0.4859
 epoch: 16, train_loss: 0.9009, test_loss: 0.9421, test_f1: 0.4935
 epoch: 17, train_loss: 0.8890, test_loss: 0.9882, test_f1: 0.4943
 epoch: 18, train_loss: 0.8755, test_loss: 1.0628, test_f1: 0.4696
 epoch: 19, train_loss: 0.8649, test_loss: 0.9886, test_f1: 0.5204
 epoch: 20, train_loss: 0.8591, test_loss: 1.0791, test_f1: 0.5035
 epoch: 21, train_loss: 0.8426, test_loss: 1.0050, test_f1: 0.5146
 epoch: 22, train_loss: 0.8268, test_loss: 1.0491, test_f1: 0.5434
 epoch: 23, train_loss: 0.8424, test_loss: 1.0491, test_f1: 0.5384
 epoch: 24, train_loss: 0.8203, test_loss: 1.0479, test_f1: 0.5161
 epoch: 25, train_loss: 0.7972, test_loss: 1.0452, test_f1: 0.5078
 epoch: 26, train_loss: 0.7887, test_loss: 1.1275, test_f1: 0.5035
 epoch: 27, train_loss: 0.7990, test_loss: 1.1535, test_f1: 0.5167
 epoch: 28, train_loss: 0.7992, test_loss: 1.0755, test_f1: 0.5244
 epoch: 29, train_loss: 0.7832, test_loss: 1.1972, test_f1: 0.4686
 epoch: 30, train_loss: 0.7784, test_loss: 1.1103, test_f1: 0.5310
 epoch: 31, train_loss: 0.7553, test_loss: 1.2116, test_f1: 0.5286
 epoch: 32, train_loss: 0.7578, test_loss: 1.1712, test_f1: 0.5357
 epoch: 33, train_loss: 0.7475, test_loss: 1.1587, test_f1: 0.5361
 epoch: 34, train_loss: 0.7514, test_loss: 1.1243, test_f1: 0.5394
 epoch: 35, train_loss: 0.7568, test_loss: 1.1058, test_f1: 0.5187
 epoch: 36, train_loss: 0.7481, test_loss: 1.0784, test_f1: 0.5574
 epoch: 37, train_loss: 0.7496, test_loss: 1.1781, test_f1: 0.5228
 epoch: 38, train_loss: 0.7160, test_loss: 1.1529, test_f1: 0.5297
 epoch: 39, train_loss: 0.7007, test_loss: 1.1549, test_f1: 0.5427
 epoch: 40, train_loss: 0.7074, test_loss: 1.2781, test_f1: 0.5185
 epoch: 41, train_loss: 0.7157, test_loss: 1.1389, test_f1: 0.5284
 epoch: 42, train_loss: 0.6904, test_loss: 1.2498, test_f1: 0.5287
 epoch: 43, train_loss: 0.6985, test_loss: 1.3103, test_f1: 0.5010
 epoch: 44, train_loss: 0.6913, test_loss: 1.2114, test_f1: 0.5416
 epoch: 45, train_loss: 0.6793, test_loss: 1.2184, test_f1: 0.5453
 epoch: 46, train_loss: 0.6896, test_loss: 1.2272, test_f1: 0.5515
 epoch: 47, train_loss: 0.6753, test_loss: 1.1859, test_f1: 0.5390
 epoch: 48, train_loss: 0.6601, test_loss: 1.2638, test_f1: 0.5429
 epoch: 49, train_loss: 0.6462, test_loss: 1.2727, test_f1: 0.5433
 epoch: 50, train_loss: 0.6472, test_loss: 1.2832, test_f1: 0.5298
 epoch: 51, train_loss: 0.6299, test_loss: 1.2973, test_f1: 0.5549
 epoch: 52, train_loss: 0.5968, test_loss: 1.2191, test_f1: 0.5619
 epoch: 53, train_loss: 0.5760, test_loss: 1.2063, test_f1: 0.5895
 epoch: 54, train_loss: 0.5642, test_loss: 1.3590, test_f1: 0.5436
 epoch: 55, train_loss: 0.5621, test_loss: 1.3285, test_f1: 0.5491
 epoch: 56, train_loss: 0.5617, test_loss: 1.3594, test_f1: 0.5259
 epoch: 57, train_loss: 0.5692, test_loss: 1.2751, test_f1: 0.5620
 epoch: 58, train_loss: 0.5722, test_loss: 1.3219, test_f1: 0.5788
 epoch: 59, train_loss: 0.5552, test_loss: 1.3046, test_f1: 0.5740
 epoch: 60, train_loss: 0.5462, test_loss: 1.3774, test_f1: 0.5579
 epoch: 61, train_loss: 0.5331, test_loss: 1.3718, test_f1: 0.5587
 epoch: 62, train_loss: 0.5494, test_loss: 1.3820, test_f1: 0.5685
 epoch: 63, train_loss: 0.5415, test_loss: 1.3713, test_f1: 0.5551
 epoch: 64, train_loss: 0.5290, test_loss: 1.4136, test_f1: 0.5473
 epoch: 65, train_loss: 0.5346, test_loss: 1.4871, test_f1: 0.5263
 epoch: 66, train_loss: 0.5282, test_loss: 1.3895, test_f1: 0.5421
 epoch: 67, train_loss: 0.5176, test_loss: 1.4137, test_f1: 0.5547
 epoch: 68, train_loss: 0.5192, test_loss: 1.3600, test_f1: 0.5503
 epoch: 69, train_loss: 0.5181, test_loss: 1.4692, test_f1: 0.5487
 epoch: 70, train_loss: 0.5065, test_loss: 1.4852, test_f1: 0.5471
 epoch: 71, train_loss: 0.4955, test_loss: 1.4789, test_f1: 0.5602
 epoch: 72, train_loss: 0.5177, test_loss: 1.4641, test_f1: 0.5474
 epoch: 73, train_loss: 0.4958, test_loss: 1.4504, test_f1: 0.5494
 epoch: 74, train_loss: 0.4829, test_loss: 1.4530, test_f1: 0.5377
 epoch: 75, train_loss: 0.4842, test_loss: 1.4600, test_f1: 0.5620
 epoch: 76, train_loss: 0.4803, test_loss: 1.5201, test_f1: 0.5278
 epoch: 77, train_loss: 0.4755, test_loss: 1.5281, test_f1: 0.5390
 epoch: 78, train_loss: 0.4902, test_loss: 1.5377, test_f1: 0.5523
 epoch: 79, train_loss: 0.4664, test_loss: 1.5098, test_f1: 0.5526
 epoch: 80, train_loss: 0.4749, test_loss: 1.4772, test_f1: 0.5525
 epoch: 81, train_loss: 0.4873, test_loss: 1.4356, test_f1: 0.5632
 epoch: 82, train_loss: 0.4627, test_loss: 1.4563, test_f1: 0.5831
 epoch: 83, train_loss: 0.4682, test_loss: 1.4086, test_f1: 0.5593
 epoch: 84, train_loss: 0.4659, test_loss: 1.5254, test_f1: 0.5543
 epoch: 85, train_loss: 0.4589, test_loss: 1.5252, test_f1: 0.5531
 epoch: 86, train_loss: 0.4742, test_loss: 1.4605, test_f1: 0.5518
 epoch: 87, train_loss: 0.4354, test_loss: 1.5894, test_f1: 0.5669
 epoch: 88, train_loss: 0.4520, test_loss: 1.5370, test_f1: 0.5558
 epoch: 89, train_loss: 0.4396, test_loss: 1.5029, test_f1: 0.5681
 epoch: 90, train_loss: 0.4482, test_loss: 1.5912, test_f1: 0.5548
 epoch: 91, train_loss: 0.4356, test_loss: 1.6046, test_f1: 0.5547
 epoch: 92, train_loss: 0.4355, test_loss: 1.5867, test_f1: 0.5798
 epoch: 93, train_loss: 0.4385, test_loss: 1.5239, test_f1: 0.5755
 epoch: 94, train_loss: 0.4342, test_loss: 1.6031, test_f1: 0.5562
 epoch: 95, train_loss: 0.4320, test_loss: 1.5799, test_f1: 0.5557
 epoch: 96, train_loss: 0.4136, test_loss: 1.6111, test_f1: 0.5448
 epoch: 97, train_loss: 0.4231, test_loss: 1.5852, test_f1: 0.5796
 epoch: 98, train_loss: 0.4071, test_loss: 1.5994, test_f1: 0.5548
 epoch: 99, train_loss: 0.3998, test_loss: 1.6405, test_f1: 0.5627
##################ITERATION #5 ****************************************
 epoch: 0, train_loss: 1.3426, test_loss: 1.1558, test_f1: 0.4215
 epoch: 1, train_loss: 1.1746, test_loss: 1.0733, test_f1: 0.4646
 epoch: 2, train_loss: 1.1093, test_loss: 1.0374, test_f1: 0.4762
 epoch: 3, train_loss: 1.0827, test_loss: 0.9725, test_f1: 0.4745
 epoch: 4, train_loss: 1.0562, test_loss: 1.0188, test_f1: 0.4405
 epoch: 5, train_loss: 1.0469, test_loss: 0.9817, test_f1: 0.4774
 epoch: 6, train_loss: 1.0215, test_loss: 0.9772, test_f1: 0.5124
 epoch: 7, train_loss: 0.9998, test_loss: 0.9735, test_f1: 0.4726
 epoch: 8, train_loss: 0.9829, test_loss: 0.9147, test_f1: 0.5114
 epoch: 9, train_loss: 0.9603, test_loss: 1.0750, test_f1: 0.4609
 epoch: 10, train_loss: 0.9680, test_loss: 0.9883, test_f1: 0.4736
 epoch: 11, train_loss: 0.9481, test_loss: 0.9579, test_f1: 0.4761
 epoch: 12, train_loss: 0.9429, test_loss: 0.9845, test_f1: 0.4565
 epoch: 13, train_loss: 0.9110, test_loss: 0.9915, test_f1: 0.4709
 epoch: 14, train_loss: 0.9248, test_loss: 0.9473, test_f1: 0.5184
 epoch: 15, train_loss: 0.8965, test_loss: 0.9789, test_f1: 0.4978
 epoch: 16, train_loss: 0.8812, test_loss: 1.0361, test_f1: 0.5060
 epoch: 17, train_loss: 0.8866, test_loss: 0.9927, test_f1: 0.4852
 epoch: 18, train_loss: 0.8699, test_loss: 0.9242, test_f1: 0.4976
 epoch: 19, train_loss: 0.8583, test_loss: 1.0986, test_f1: 0.4772
 epoch: 20, train_loss: 0.8518, test_loss: 1.0212, test_f1: 0.5019
 epoch: 21, train_loss: 0.8762, test_loss: 0.9538, test_f1: 0.5047
 epoch: 22, train_loss: 0.8340, test_loss: 1.0017, test_f1: 0.4999
 epoch: 23, train_loss: 0.8290, test_loss: 1.0767, test_f1: 0.5191
 epoch: 24, train_loss: 0.8555, test_loss: 0.9639, test_f1: 0.5417
 epoch: 25, train_loss: 0.8486, test_loss: 1.0914, test_f1: 0.4749
 epoch: 26, train_loss: 0.8293, test_loss: 0.9584, test_f1: 0.5193
 epoch: 27, train_loss: 0.8255, test_loss: 1.0605, test_f1: 0.5063
 epoch: 28, train_loss: 0.7984, test_loss: 1.0205, test_f1: 0.5313
 epoch: 29, train_loss: 0.7875, test_loss: 1.0489, test_f1: 0.5227
 epoch: 30, train_loss: 0.7820, test_loss: 1.0811, test_f1: 0.5066
 epoch: 31, train_loss: 0.7813, test_loss: 1.1143, test_f1: 0.5106
 epoch: 32, train_loss: 0.7849, test_loss: 1.0006, test_f1: 0.5154
 epoch: 33, train_loss: 0.7624, test_loss: 1.0243, test_f1: 0.5174
 epoch: 34, train_loss: 0.7510, test_loss: 1.0896, test_f1: 0.5102
 epoch: 35, train_loss: 0.7625, test_loss: 1.0836, test_f1: 0.5109
 epoch: 36, train_loss: 0.7484, test_loss: 1.0893, test_f1: 0.5211
 epoch: 37, train_loss: 0.7247, test_loss: 1.0921, test_f1: 0.5331
 epoch: 38, train_loss: 0.7328, test_loss: 1.1213, test_f1: 0.4881
 epoch: 39, train_loss: 0.7353, test_loss: 1.0307, test_f1: 0.5523
 epoch: 40, train_loss: 0.7334, test_loss: 1.0807, test_f1: 0.5178
 epoch: 41, train_loss: 0.7365, test_loss: 1.1133, test_f1: 0.4920
 epoch: 42, train_loss: 0.7191, test_loss: 1.2015, test_f1: 0.5285
 epoch: 43, train_loss: 0.7208, test_loss: 1.0947, test_f1: 0.5384
 epoch: 44, train_loss: 0.7078, test_loss: 1.2990, test_f1: 0.5311
 epoch: 45, train_loss: 0.7022, test_loss: 1.1352, test_f1: 0.5315
 epoch: 46, train_loss: 0.6835, test_loss: 1.2010, test_f1: 0.5233
 epoch: 47, train_loss: 0.6989, test_loss: 1.1743, test_f1: 0.5337
 epoch: 48, train_loss: 0.7083, test_loss: 1.1287, test_f1: 0.5184
 epoch: 49, train_loss: 0.6826, test_loss: 1.1335, test_f1: 0.5461
 epoch: 50, train_loss: 0.7005, test_loss: 1.1610, test_f1: 0.5470
 epoch: 51, train_loss: 0.6924, test_loss: 1.1587, test_f1: 0.5271
 epoch: 52, train_loss: 0.6324, test_loss: 1.1820, test_f1: 0.5385
 epoch: 53, train_loss: 0.6559, test_loss: 1.2122, test_f1: 0.5037
 epoch: 54, train_loss: 0.6319, test_loss: 1.2383, test_f1: 0.5282
 epoch: 55, train_loss: 0.6125, test_loss: 1.1958, test_f1: 0.5499
 epoch: 56, train_loss: 0.6245, test_loss: 1.2071, test_f1: 0.5571
 epoch: 57, train_loss: 0.6005, test_loss: 1.2101, test_f1: 0.5664
 epoch: 58, train_loss: 0.5903, test_loss: 1.2395, test_f1: 0.5462
 epoch: 59, train_loss: 0.5788, test_loss: 1.2330, test_f1: 0.5578
 epoch: 60, train_loss: 0.5832, test_loss: 1.1983, test_f1: 0.5629
 epoch: 61, train_loss: 0.5760, test_loss: 1.1963, test_f1: 0.5636
 epoch: 62, train_loss: 0.5632, test_loss: 1.2285, test_f1: 0.5789
 epoch: 63, train_loss: 0.5688, test_loss: 1.2231, test_f1: 0.5606
 epoch: 64, train_loss: 0.5747, test_loss: 1.2553, test_f1: 0.5447
 epoch: 65, train_loss: 0.5580, test_loss: 1.2284, test_f1: 0.5671
 epoch: 66, train_loss: 0.5670, test_loss: 1.2593, test_f1: 0.5874
 epoch: 67, train_loss: 0.5608, test_loss: 1.2238, test_f1: 0.5717
 epoch: 68, train_loss: 0.5613, test_loss: 1.3029, test_f1: 0.5649
 epoch: 69, train_loss: 0.5373, test_loss: 1.3456, test_f1: 0.5632
 epoch: 70, train_loss: 0.5324, test_loss: 1.3220, test_f1: 0.5652
 epoch: 71, train_loss: 0.5419, test_loss: 1.2265, test_f1: 0.5740
 epoch: 72, train_loss: 0.5387, test_loss: 1.3145, test_f1: 0.5747
 epoch: 73, train_loss: 0.5258, test_loss: 1.2898, test_f1: 0.5694
 epoch: 74, train_loss: 0.5340, test_loss: 1.2465, test_f1: 0.5657
 epoch: 75, train_loss: 0.5344, test_loss: 1.2995, test_f1: 0.5766
 epoch: 76, train_loss: 0.5179, test_loss: 1.3491, test_f1: 0.5714
 epoch: 77, train_loss: 0.5180, test_loss: 1.2813, test_f1: 0.5654
 epoch: 78, train_loss: 0.5287, test_loss: 1.3960, test_f1: 0.5580
 epoch: 79, train_loss: 0.5088, test_loss: 1.3406, test_f1: 0.5835
 epoch: 80, train_loss: 0.5085, test_loss: 1.3714, test_f1: 0.5752
 epoch: 81, train_loss: 0.4799, test_loss: 1.3658, test_f1: 0.5622
 epoch: 82, train_loss: 0.4875, test_loss: 1.3362, test_f1: 0.5974
 epoch: 83, train_loss: 0.4941, test_loss: 1.4072, test_f1: 0.5558
 epoch: 84, train_loss: 0.4949, test_loss: 1.3695, test_f1: 0.5893
 epoch: 85, train_loss: 0.4886, test_loss: 1.3590, test_f1: 0.5652
 epoch: 86, train_loss: 0.4773, test_loss: 1.4800, test_f1: 0.5660
 epoch: 87, train_loss: 0.4886, test_loss: 1.3622, test_f1: 0.5599
 epoch: 88, train_loss: 0.4921, test_loss: 1.3457, test_f1: 0.5633
 epoch: 89, train_loss: 0.4897, test_loss: 1.3860, test_f1: 0.5629
 epoch: 90, train_loss: 0.4654, test_loss: 1.4003, test_f1: 0.5828
 epoch: 91, train_loss: 0.4602, test_loss: 1.4564, test_f1: 0.5598
 epoch: 92, train_loss: 0.4742, test_loss: 1.5155, test_f1: 0.5748
 epoch: 93, train_loss: 0.4726, test_loss: 1.3378, test_f1: 0.5761
 epoch: 94, train_loss: 0.4575, test_loss: 1.3627, test_f1: 0.5755
 epoch: 95, train_loss: 0.4690, test_loss: 1.3373, test_f1: 0.5932
 epoch: 96, train_loss: 0.4589, test_loss: 1.3300, test_f1: 0.5693
 epoch: 97, train_loss: 0.4550, test_loss: 1.3603, test_f1: 0.5775
 epoch: 98, train_loss: 0.4527, test_loss: 1.3410, test_f1: 0.5848
 epoch: 99, train_loss: 0.4441, test_loss: 1.4744, test_f1: 0.5485
##################ITERATION #6 ****************************************
 epoch: 0, train_loss: 1.3503, test_loss: 1.1775, test_f1: 0.3799
 epoch: 1, train_loss: 1.1846, test_loss: 1.1075, test_f1: 0.4198
 epoch: 2, train_loss: 1.1341, test_loss: 1.0488, test_f1: 0.4550
 epoch: 3, train_loss: 1.0919, test_loss: 1.0787, test_f1: 0.4300
 epoch: 4, train_loss: 1.0720, test_loss: 1.0154, test_f1: 0.4582
 epoch: 5, train_loss: 1.0474, test_loss: 1.0499, test_f1: 0.4310
 epoch: 6, train_loss: 1.0202, test_loss: 0.9869, test_f1: 0.4774
 epoch: 7, train_loss: 1.0135, test_loss: 0.9838, test_f1: 0.4386
 epoch: 8, train_loss: 0.9908, test_loss: 1.0198, test_f1: 0.4570
 epoch: 9, train_loss: 0.9765, test_loss: 0.9532, test_f1: 0.4612
 epoch: 10, train_loss: 0.9631, test_loss: 0.9553, test_f1: 0.4946
 epoch: 11, train_loss: 0.9851, test_loss: 0.9502, test_f1: 0.4806
 epoch: 12, train_loss: 0.9740, test_loss: 0.9829, test_f1: 0.4479
 epoch: 13, train_loss: 0.9502, test_loss: 0.9755, test_f1: 0.4600
 epoch: 14, train_loss: 0.9329, test_loss: 1.0145, test_f1: 0.4790
 epoch: 15, train_loss: 0.9346, test_loss: 1.0172, test_f1: 0.4736
 epoch: 16, train_loss: 0.9244, test_loss: 0.9794, test_f1: 0.4713
 epoch: 17, train_loss: 0.8931, test_loss: 0.9606, test_f1: 0.4989
 epoch: 18, train_loss: 0.8957, test_loss: 0.9780, test_f1: 0.4928
 epoch: 19, train_loss: 0.8900, test_loss: 0.9732, test_f1: 0.5060
 epoch: 20, train_loss: 0.8692, test_loss: 0.9972, test_f1: 0.4656
 epoch: 21, train_loss: 0.8661, test_loss: 1.0344, test_f1: 0.4948
 epoch: 22, train_loss: 0.8678, test_loss: 0.9695, test_f1: 0.5243
 epoch: 23, train_loss: 0.8698, test_loss: 1.0930, test_f1: 0.5068
 epoch: 24, train_loss: 0.8401, test_loss: 1.0494, test_f1: 0.5270
 epoch: 25, train_loss: 0.8342, test_loss: 0.9733, test_f1: 0.5061
 epoch: 26, train_loss: 0.8336, test_loss: 1.1216, test_f1: 0.5207
 epoch: 27, train_loss: 0.8303, test_loss: 1.0703, test_f1: 0.4973
 epoch: 28, train_loss: 0.8209, test_loss: 1.0254, test_f1: 0.5106
 epoch: 29, train_loss: 0.8174, test_loss: 1.0592, test_f1: 0.5073
 epoch: 30, train_loss: 0.8123, test_loss: 1.1525, test_f1: 0.5272
 epoch: 31, train_loss: 0.8059, test_loss: 1.0800, test_f1: 0.4894
 epoch: 32, train_loss: 0.7982, test_loss: 1.0836, test_f1: 0.4970
 epoch: 33, train_loss: 0.7862, test_loss: 1.0356, test_f1: 0.5150
 epoch: 34, train_loss: 0.7744, test_loss: 1.1930, test_f1: 0.5254
 epoch: 35, train_loss: 0.7632, test_loss: 1.1101, test_f1: 0.5157
 epoch: 36, train_loss: 0.7738, test_loss: 1.1028, test_f1: 0.5187
 epoch: 37, train_loss: 0.7662, test_loss: 1.1676, test_f1: 0.5000
 epoch: 38, train_loss: 0.7530, test_loss: 1.1292, test_f1: 0.5169
 epoch: 39, train_loss: 0.7501, test_loss: 1.1556, test_f1: 0.5211
 epoch: 40, train_loss: 0.7471, test_loss: 1.1641, test_f1: 0.4882
 epoch: 41, train_loss: 0.7636, test_loss: 1.1112, test_f1: 0.5118
 epoch: 42, train_loss: 0.7332, test_loss: 1.1800, test_f1: 0.5144
 epoch: 43, train_loss: 0.7266, test_loss: 1.2141, test_f1: 0.4936
 epoch: 44, train_loss: 0.7267, test_loss: 1.1637, test_f1: 0.5156
 epoch: 45, train_loss: 0.7184, test_loss: 1.1618, test_f1: 0.5045
 epoch: 46, train_loss: 0.7136, test_loss: 1.3857, test_f1: 0.5262
 epoch: 47, train_loss: 0.7182, test_loss: 1.2964, test_f1: 0.5135
 epoch: 48, train_loss: 0.7169, test_loss: 1.3892, test_f1: 0.4794
 epoch: 49, train_loss: 0.6995, test_loss: 1.2198, test_f1: 0.5199
 epoch: 50, train_loss: 0.6969, test_loss: 1.2765, test_f1: 0.5364
 epoch: 51, train_loss: 0.6539, test_loss: 1.2174, test_f1: 0.5248
 epoch: 52, train_loss: 0.6134, test_loss: 1.2908, test_f1: 0.5125
 epoch: 53, train_loss: 0.6179, test_loss: 1.3266, test_f1: 0.5098
 epoch: 54, train_loss: 0.6233, test_loss: 1.3216, test_f1: 0.5197
 epoch: 55, train_loss: 0.6231, test_loss: 1.2847, test_f1: 0.5222
 epoch: 56, train_loss: 0.6038, test_loss: 1.2764, test_f1: 0.5264
 epoch: 57, train_loss: 0.6128, test_loss: 1.2860, test_f1: 0.5212
 epoch: 58, train_loss: 0.5958, test_loss: 1.2634, test_f1: 0.5285
 epoch: 59, train_loss: 0.5993, test_loss: 1.2620, test_f1: 0.5295
 epoch: 60, train_loss: 0.6000, test_loss: 1.3465, test_f1: 0.5182
 epoch: 61, train_loss: 0.5998, test_loss: 1.3429, test_f1: 0.5217
 epoch: 62, train_loss: 0.5919, test_loss: 1.2939, test_f1: 0.5277
 epoch: 63, train_loss: 0.5729, test_loss: 1.3550, test_f1: 0.5371
 epoch: 64, train_loss: 0.5741, test_loss: 1.3624, test_f1: 0.5529
 epoch: 65, train_loss: 0.5872, test_loss: 1.3871, test_f1: 0.5484
 epoch: 66, train_loss: 0.5708, test_loss: 1.3270, test_f1: 0.5446
 epoch: 67, train_loss: 0.5628, test_loss: 1.4816, test_f1: 0.5341
 epoch: 68, train_loss: 0.5689, test_loss: 1.3705, test_f1: 0.5389
 epoch: 69, train_loss: 0.5849, test_loss: 1.4325, test_f1: 0.5333
 epoch: 70, train_loss: 0.5603, test_loss: 1.3972, test_f1: 0.5256
 epoch: 71, train_loss: 0.5495, test_loss: 1.4186, test_f1: 0.5308
 epoch: 72, train_loss: 0.5505, test_loss: 1.4875, test_f1: 0.5397
 epoch: 73, train_loss: 0.5375, test_loss: 1.4219, test_f1: 0.5461
 epoch: 74, train_loss: 0.5510, test_loss: 1.4805, test_f1: 0.5164
 epoch: 75, train_loss: 0.5374, test_loss: 1.4824, test_f1: 0.5283
 epoch: 76, train_loss: 0.5322, test_loss: 1.4137, test_f1: 0.5389
 epoch: 77, train_loss: 0.5473, test_loss: 1.3924, test_f1: 0.5577
 epoch: 78, train_loss: 0.5527, test_loss: 1.5465, test_f1: 0.5307
 epoch: 79, train_loss: 0.5474, test_loss: 1.4926, test_f1: 0.5318
 epoch: 80, train_loss: 0.5284, test_loss: 1.5686, test_f1: 0.5429
 epoch: 81, train_loss: 0.5156, test_loss: 1.4312, test_f1: 0.5208
 epoch: 82, train_loss: 0.5358, test_loss: 1.4796, test_f1: 0.5226
 epoch: 83, train_loss: 0.5124, test_loss: 1.5391, test_f1: 0.5330
 epoch: 84, train_loss: 0.5079, test_loss: 1.5509, test_f1: 0.5407
 epoch: 85, train_loss: 0.5459, test_loss: 1.4628, test_f1: 0.5265
 epoch: 86, train_loss: 0.5037, test_loss: 1.5736, test_f1: 0.5460
 epoch: 87, train_loss: 0.5095, test_loss: 1.5342, test_f1: 0.5510
 epoch: 88, train_loss: 0.4974, test_loss: 1.5262, test_f1: 0.5475
 epoch: 89, train_loss: 0.5079, test_loss: 1.4855, test_f1: 0.5516
 epoch: 90, train_loss: 0.4988, test_loss: 1.4771, test_f1: 0.5506
 epoch: 91, train_loss: 0.5129, test_loss: 1.6140, test_f1: 0.5485
 epoch: 92, train_loss: 0.4959, test_loss: 1.6717, test_f1: 0.5398
 epoch: 93, train_loss: 0.4911, test_loss: 1.6565, test_f1: 0.5263
 epoch: 94, train_loss: 0.4832, test_loss: 1.5604, test_f1: 0.5472
 epoch: 95, train_loss: 0.4785, test_loss: 1.6668, test_f1: 0.5150
 epoch: 96, train_loss: 0.4941, test_loss: 1.6007, test_f1: 0.5308
 epoch: 97, train_loss: 0.4722, test_loss: 1.5704, test_f1: 0.5364
 epoch: 98, train_loss: 0.4803, test_loss: 1.6845, test_f1: 0.5216
 epoch: 99, train_loss: 0.4701, test_loss: 1.5827, test_f1: 0.5508
##################ITERATION #7 ****************************************
 epoch: 0, train_loss: 1.3988, test_loss: 1.1679, test_f1: 0.4707
 epoch: 1, train_loss: 1.2007, test_loss: 1.1008, test_f1: 0.4419
 epoch: 2, train_loss: 1.1524, test_loss: 1.0959, test_f1: 0.4251
 epoch: 3, train_loss: 1.1147, test_loss: 1.0737, test_f1: 0.4408
 epoch: 4, train_loss: 1.0939, test_loss: 1.0393, test_f1: 0.4275
 epoch: 5, train_loss: 1.0728, test_loss: 0.9971, test_f1: 0.4849
 epoch: 6, train_loss: 1.0560, test_loss: 1.0021, test_f1: 0.4726
 epoch: 7, train_loss: 1.0241, test_loss: 0.9726, test_f1: 0.4885
 epoch: 8, train_loss: 1.0112, test_loss: 0.9615, test_f1: 0.4863
 epoch: 9, train_loss: 0.9805, test_loss: 0.9102, test_f1: 0.5302
 epoch: 10, train_loss: 0.9631, test_loss: 0.9580, test_f1: 0.5130
 epoch: 11, train_loss: 0.9602, test_loss: 0.9290, test_f1: 0.5121
 epoch: 12, train_loss: 0.9623, test_loss: 0.9252, test_f1: 0.5089
 epoch: 13, train_loss: 0.9355, test_loss: 0.9259, test_f1: 0.5180
 epoch: 14, train_loss: 0.9341, test_loss: 0.9491, test_f1: 0.5080
 epoch: 15, train_loss: 0.8999, test_loss: 0.9666, test_f1: 0.4745
 epoch: 16, train_loss: 0.9010, test_loss: 0.9806, test_f1: 0.4880
 epoch: 17, train_loss: 0.8761, test_loss: 0.9399, test_f1: 0.5177
 epoch: 18, train_loss: 0.8689, test_loss: 1.0122, test_f1: 0.4853
 epoch: 19, train_loss: 0.8669, test_loss: 0.9950, test_f1: 0.5062
 epoch: 20, train_loss: 0.8582, test_loss: 1.0313, test_f1: 0.5015
 epoch: 21, train_loss: 0.8646, test_loss: 1.1184, test_f1: 0.4936
 epoch: 22, train_loss: 0.8483, test_loss: 0.9822, test_f1: 0.5431
 epoch: 23, train_loss: 0.8435, test_loss: 1.0510, test_f1: 0.5088
 epoch: 24, train_loss: 0.8367, test_loss: 0.9901, test_f1: 0.4920
 epoch: 25, train_loss: 0.8217, test_loss: 0.9854, test_f1: 0.5270
 epoch: 26, train_loss: 0.8258, test_loss: 1.0272, test_f1: 0.4931
 epoch: 27, train_loss: 0.8013, test_loss: 1.0532, test_f1: 0.5126
 epoch: 28, train_loss: 0.7974, test_loss: 1.1022, test_f1: 0.5058
 epoch: 29, train_loss: 0.7847, test_loss: 1.0176, test_f1: 0.5052
 epoch: 30, train_loss: 0.7866, test_loss: 1.0697, test_f1: 0.5139
 epoch: 31, train_loss: 0.7788, test_loss: 1.1320, test_f1: 0.5170
 epoch: 32, train_loss: 0.7734, test_loss: 1.1000, test_f1: 0.5240
 epoch: 33, train_loss: 0.7716, test_loss: 1.1689, test_f1: 0.5095
 epoch: 34, train_loss: 0.7517, test_loss: 1.1455, test_f1: 0.5198
 epoch: 35, train_loss: 0.7572, test_loss: 1.1039, test_f1: 0.5276
 epoch: 36, train_loss: 0.7379, test_loss: 1.1359, test_f1: 0.5502
 epoch: 37, train_loss: 0.7445, test_loss: 1.1385, test_f1: 0.5435
 epoch: 38, train_loss: 0.7400, test_loss: 1.1032, test_f1: 0.5484
 epoch: 39, train_loss: 0.7110, test_loss: 1.1494, test_f1: 0.5363
 epoch: 40, train_loss: 0.7225, test_loss: 1.1920, test_f1: 0.5197
 epoch: 41, train_loss: 0.7028, test_loss: 1.2415, test_f1: 0.5020
 epoch: 42, train_loss: 0.7030, test_loss: 1.2461, test_f1: 0.5359
 epoch: 43, train_loss: 0.7090, test_loss: 1.2490, test_f1: 0.5263
 epoch: 44, train_loss: 0.7110, test_loss: 1.1637, test_f1: 0.5328
 epoch: 45, train_loss: 0.6850, test_loss: 1.1996, test_f1: 0.5192
 epoch: 46, train_loss: 0.6829, test_loss: 1.2525, test_f1: 0.5186
 epoch: 47, train_loss: 0.6801, test_loss: 1.2449, test_f1: 0.5200
 epoch: 48, train_loss: 0.6710, test_loss: 1.2487, test_f1: 0.5064
 epoch: 49, train_loss: 0.6835, test_loss: 1.2918, test_f1: 0.5101
 epoch: 50, train_loss: 0.6536, test_loss: 1.3028, test_f1: 0.4957
 epoch: 51, train_loss: 0.6262, test_loss: 1.2349, test_f1: 0.5445
 epoch: 52, train_loss: 0.6007, test_loss: 1.2394, test_f1: 0.5314
 epoch: 53, train_loss: 0.6012, test_loss: 1.2863, test_f1: 0.5317
 epoch: 54, train_loss: 0.5910, test_loss: 1.2794, test_f1: 0.5364
 epoch: 55, train_loss: 0.5933, test_loss: 1.3013, test_f1: 0.5355
 epoch: 56, train_loss: 0.5826, test_loss: 1.3146, test_f1: 0.5410
 epoch: 57, train_loss: 0.5768, test_loss: 1.3921, test_f1: 0.5178
 epoch: 58, train_loss: 0.5697, test_loss: 1.3165, test_f1: 0.5300
 epoch: 59, train_loss: 0.5885, test_loss: 1.2807, test_f1: 0.5469
 epoch: 60, train_loss: 0.5638, test_loss: 1.2826, test_f1: 0.5518
 epoch: 61, train_loss: 0.5716, test_loss: 1.3092, test_f1: 0.5423
 epoch: 62, train_loss: 0.5700, test_loss: 1.4084, test_f1: 0.5324
 epoch: 63, train_loss: 0.5551, test_loss: 1.4118, test_f1: 0.5192
 epoch: 64, train_loss: 0.5351, test_loss: 1.3636, test_f1: 0.5220
 epoch: 65, train_loss: 0.5337, test_loss: 1.5078, test_f1: 0.5293
 epoch: 66, train_loss: 0.5329, test_loss: 1.3954, test_f1: 0.5393
 epoch: 67, train_loss: 0.5506, test_loss: 1.4126, test_f1: 0.5338
 epoch: 68, train_loss: 0.5278, test_loss: 1.4507, test_f1: 0.5340
 epoch: 69, train_loss: 0.5081, test_loss: 1.6441, test_f1: 0.5242
 epoch: 70, train_loss: 0.5190, test_loss: 1.4129, test_f1: 0.5355
 epoch: 71, train_loss: 0.5213, test_loss: 1.4872, test_f1: 0.5246
 epoch: 72, train_loss: 0.5199, test_loss: 1.4508, test_f1: 0.5285
 epoch: 73, train_loss: 0.5083, test_loss: 1.6200, test_f1: 0.5450
 epoch: 74, train_loss: 0.5101, test_loss: 1.4258, test_f1: 0.5309
 epoch: 75, train_loss: 0.5242, test_loss: 1.4316, test_f1: 0.5359
 epoch: 76, train_loss: 0.4975, test_loss: 1.4963, test_f1: 0.5524
 epoch: 77, train_loss: 0.4945, test_loss: 1.4909, test_f1: 0.5695
 epoch: 78, train_loss: 0.5030, test_loss: 1.5711, test_f1: 0.5660
 epoch: 79, train_loss: 0.5056, test_loss: 1.5133, test_f1: 0.5474
 epoch: 80, train_loss: 0.4900, test_loss: 1.6445, test_f1: 0.5364
 epoch: 81, train_loss: 0.4743, test_loss: 1.4882, test_f1: 0.5396
 epoch: 82, train_loss: 0.4780, test_loss: 1.8097, test_f1: 0.5303
 epoch: 83, train_loss: 0.4747, test_loss: 1.6311, test_f1: 0.5442
 epoch: 84, train_loss: 0.4905, test_loss: 1.7542, test_f1: 0.5439
 epoch: 85, train_loss: 0.4726, test_loss: 1.6908, test_f1: 0.5580
 epoch: 86, train_loss: 0.4647, test_loss: 1.5155, test_f1: 0.5548
 epoch: 87, train_loss: 0.4675, test_loss: 1.5499, test_f1: 0.5363
 epoch: 88, train_loss: 0.4599, test_loss: 1.8550, test_f1: 0.5505
 epoch: 89, train_loss: 0.4594, test_loss: 1.5445, test_f1: 0.5538
 epoch: 90, train_loss: 0.4533, test_loss: 1.5903, test_f1: 0.5473
 epoch: 91, train_loss: 0.4511, test_loss: 1.5483, test_f1: 0.5462
 epoch: 92, train_loss: 0.4549, test_loss: 1.7944, test_f1: 0.5489
 epoch: 93, train_loss: 0.4347, test_loss: 1.8235, test_f1: 0.5477
 epoch: 94, train_loss: 0.4509, test_loss: 1.5750, test_f1: 0.5432
 epoch: 95, train_loss: 0.4438, test_loss: 1.5974, test_f1: 0.5514
 epoch: 96, train_loss: 0.4370, test_loss: 1.6303, test_f1: 0.5544
 epoch: 97, train_loss: 0.4380, test_loss: 1.7318, test_f1: 0.5482
 epoch: 98, train_loss: 0.4509, test_loss: 1.6809, test_f1: 0.5499
 epoch: 99, train_loss: 0.4208, test_loss: 1.7061, test_f1: 0.5315
##################ITERATION #8 ****************************************
 epoch: 0, train_loss: 1.3849, test_loss: 1.2031, test_f1: 0.3875
 epoch: 1, train_loss: 1.1972, test_loss: 1.0973, test_f1: 0.4548
 epoch: 2, train_loss: 1.1542, test_loss: 1.0883, test_f1: 0.4370
 epoch: 3, train_loss: 1.1231, test_loss: 1.0299, test_f1: 0.4810
 epoch: 4, train_loss: 1.1014, test_loss: 1.0247, test_f1: 0.4796
 epoch: 5, train_loss: 1.0641, test_loss: 0.9956, test_f1: 0.5186
 epoch: 6, train_loss: 1.0393, test_loss: 0.9792, test_f1: 0.5222
 epoch: 7, train_loss: 1.0458, test_loss: 0.9874, test_f1: 0.5105
 epoch: 8, train_loss: 1.0291, test_loss: 0.9501, test_f1: 0.5016
 epoch: 9, train_loss: 0.9916, test_loss: 1.0541, test_f1: 0.5054
 epoch: 10, train_loss: 0.9768, test_loss: 0.9652, test_f1: 0.5190
 epoch: 11, train_loss: 0.9803, test_loss: 0.9989, test_f1: 0.4822
 epoch: 12, train_loss: 0.9549, test_loss: 1.0393, test_f1: 0.5011
 epoch: 13, train_loss: 0.9544, test_loss: 1.0920, test_f1: 0.4641
 epoch: 14, train_loss: 0.9323, test_loss: 0.9843, test_f1: 0.4803
 epoch: 15, train_loss: 0.9461, test_loss: 0.9501, test_f1: 0.4938
 epoch: 16, train_loss: 0.8961, test_loss: 0.9597, test_f1: 0.5156
 epoch: 17, train_loss: 0.9217, test_loss: 1.0689, test_f1: 0.4976
 epoch: 18, train_loss: 0.9213, test_loss: 0.9246, test_f1: 0.4984
 epoch: 19, train_loss: 0.9086, test_loss: 0.9581, test_f1: 0.4922
 epoch: 20, train_loss: 0.8959, test_loss: 0.9542, test_f1: 0.5252
 epoch: 21, train_loss: 0.8891, test_loss: 1.1137, test_f1: 0.5158
 epoch: 22, train_loss: 0.8575, test_loss: 1.0015, test_f1: 0.5044
 epoch: 23, train_loss: 0.8688, test_loss: 1.0039, test_f1: 0.4776
 epoch: 24, train_loss: 0.8508, test_loss: 1.0357, test_f1: 0.4897
 epoch: 25, train_loss: 0.8581, test_loss: 0.9951, test_f1: 0.5058
 epoch: 26, train_loss: 0.8423, test_loss: 0.9546, test_f1: 0.5153
 epoch: 27, train_loss: 0.8327, test_loss: 0.9781, test_f1: 0.4842
 epoch: 28, train_loss: 0.8356, test_loss: 0.9921, test_f1: 0.4767
 epoch: 29, train_loss: 0.8432, test_loss: 1.0633, test_f1: 0.5034
 epoch: 30, train_loss: 0.8166, test_loss: 0.9422, test_f1: 0.5268
 epoch: 31, train_loss: 0.8112, test_loss: 1.1544, test_f1: 0.4921
 epoch: 32, train_loss: 0.7962, test_loss: 1.1496, test_f1: 0.5092
 epoch: 33, train_loss: 0.7961, test_loss: 1.0797, test_f1: 0.5375
 epoch: 34, train_loss: 0.7956, test_loss: 1.0090, test_f1: 0.5075
 epoch: 35, train_loss: 0.7845, test_loss: 1.1650, test_f1: 0.5124
 epoch: 36, train_loss: 0.7788, test_loss: 1.0294, test_f1: 0.5040
 epoch: 37, train_loss: 0.7823, test_loss: 1.2252, test_f1: 0.5240
 epoch: 38, train_loss: 0.7556, test_loss: 1.0251, test_f1: 0.5329
 epoch: 39, train_loss: 0.7283, test_loss: 1.1301, test_f1: 0.5366
 epoch: 40, train_loss: 0.7445, test_loss: 1.1570, test_f1: 0.5347
 epoch: 41, train_loss: 0.7513, test_loss: 1.1778, test_f1: 0.5670
 epoch: 42, train_loss: 0.7432, test_loss: 1.2189, test_f1: 0.5144
 epoch: 43, train_loss: 0.7302, test_loss: 1.1281, test_f1: 0.5252
 epoch: 44, train_loss: 0.7214, test_loss: 1.2316, test_f1: 0.5233
 epoch: 45, train_loss: 0.7478, test_loss: 1.3070, test_f1: 0.5271
 epoch: 46, train_loss: 0.7230, test_loss: 1.0811, test_f1: 0.5408
 epoch: 47, train_loss: 0.7016, test_loss: 1.2558, test_f1: 0.5239
 epoch: 48, train_loss: 0.6963, test_loss: 1.1060, test_f1: 0.5772
 epoch: 49, train_loss: 0.6991, test_loss: 1.1987, test_f1: 0.5574
 epoch: 50, train_loss: 0.6979, test_loss: 1.1438, test_f1: 0.5603
 epoch: 51, train_loss: 0.6574, test_loss: 1.1998, test_f1: 0.5338
 epoch: 52, train_loss: 0.6468, test_loss: 1.2285, test_f1: 0.5607
 epoch: 53, train_loss: 0.6325, test_loss: 1.2753, test_f1: 0.5521
 epoch: 54, train_loss: 0.6260, test_loss: 1.2252, test_f1: 0.5411
 epoch: 55, train_loss: 0.6247, test_loss: 1.2911, test_f1: 0.5457
 epoch: 56, train_loss: 0.6195, test_loss: 1.2985, test_f1: 0.5418
 epoch: 57, train_loss: 0.6290, test_loss: 1.2218, test_f1: 0.5329
 epoch: 58, train_loss: 0.6201, test_loss: 1.2668, test_f1: 0.5313
 epoch: 59, train_loss: 0.5998, test_loss: 1.2947, test_f1: 0.5410
 epoch: 60, train_loss: 0.6034, test_loss: 1.2274, test_f1: 0.5384
 epoch: 61, train_loss: 0.5940, test_loss: 1.2361, test_f1: 0.5437
 epoch: 62, train_loss: 0.5963, test_loss: 1.3001, test_f1: 0.5465
 epoch: 63, train_loss: 0.5916, test_loss: 1.2606, test_f1: 0.5415
 epoch: 64, train_loss: 0.5739, test_loss: 1.2898, test_f1: 0.5373
 epoch: 65, train_loss: 0.5717, test_loss: 1.2946, test_f1: 0.5424
 epoch: 66, train_loss: 0.5822, test_loss: 1.2977, test_f1: 0.5289
 epoch: 67, train_loss: 0.5887, test_loss: 1.2611, test_f1: 0.5375
 epoch: 68, train_loss: 0.5675, test_loss: 1.2554, test_f1: 0.5413
 epoch: 69, train_loss: 0.5704, test_loss: 1.2538, test_f1: 0.5506
 epoch: 70, train_loss: 0.5554, test_loss: 1.3748, test_f1: 0.5374
 epoch: 71, train_loss: 0.5601, test_loss: 1.2961, test_f1: 0.5459
 epoch: 72, train_loss: 0.5494, test_loss: 1.3396, test_f1: 0.5360
 epoch: 73, train_loss: 0.5410, test_loss: 1.3387, test_f1: 0.5523
 epoch: 74, train_loss: 0.5429, test_loss: 1.3302, test_f1: 0.5543
 epoch: 75, train_loss: 0.5385, test_loss: 1.3269, test_f1: 0.5463
 epoch: 76, train_loss: 0.5486, test_loss: 1.3183, test_f1: 0.5371
 epoch: 77, train_loss: 0.5225, test_loss: 1.4568, test_f1: 0.5282
 epoch: 78, train_loss: 0.5150, test_loss: 1.4104, test_f1: 0.5151
 epoch: 79, train_loss: 0.5436, test_loss: 1.3912, test_f1: 0.5379
 epoch: 80, train_loss: 0.5207, test_loss: 1.4082, test_f1: 0.5405
 epoch: 81, train_loss: 0.5077, test_loss: 1.4321, test_f1: 0.5500
 epoch: 82, train_loss: 0.5146, test_loss: 1.3903, test_f1: 0.5632
 epoch: 83, train_loss: 0.5218, test_loss: 1.4703, test_f1: 0.5327
 epoch: 84, train_loss: 0.5151, test_loss: 1.4487, test_f1: 0.5557
 epoch: 85, train_loss: 0.4908, test_loss: 1.4566, test_f1: 0.5435
 epoch: 86, train_loss: 0.5118, test_loss: 1.4247, test_f1: 0.5478
 epoch: 87, train_loss: 0.4959, test_loss: 1.4863, test_f1: 0.5144
 epoch: 88, train_loss: 0.5181, test_loss: 1.3740, test_f1: 0.5453
 epoch: 89, train_loss: 0.5051, test_loss: 1.4565, test_f1: 0.5297
 epoch: 90, train_loss: 0.4962, test_loss: 1.4516, test_f1: 0.5437
 epoch: 91, train_loss: 0.4578, test_loss: 1.4892, test_f1: 0.5261
 epoch: 92, train_loss: 0.5007, test_loss: 1.4797, test_f1: 0.5634
 epoch: 93, train_loss: 0.4782, test_loss: 1.5540, test_f1: 0.5329
 epoch: 94, train_loss: 0.4831, test_loss: 1.4456, test_f1: 0.5306
 epoch: 95, train_loss: 0.4880, test_loss: 1.6196, test_f1: 0.5140
 epoch: 96, train_loss: 0.4754, test_loss: 1.6593, test_f1: 0.5300
 epoch: 97, train_loss: 0.4876, test_loss: 1.5294, test_f1: 0.5267
 epoch: 98, train_loss: 0.4571, test_loss: 1.5182, test_f1: 0.5401
 epoch: 99, train_loss: 0.4910, test_loss: 1.5594, test_f1: 0.5470
##################ITERATION #9 ****************************************
 epoch: 0, train_loss: 1.4133, test_loss: 1.2252, test_f1: 0.3130
 epoch: 1, train_loss: 1.2267, test_loss: 1.1623, test_f1: 0.3915
 epoch: 2, train_loss: 1.1962, test_loss: 1.1339, test_f1: 0.4259
 epoch: 3, train_loss: 1.1533, test_loss: 1.0946, test_f1: 0.4093
 epoch: 4, train_loss: 1.1268, test_loss: 1.0700, test_f1: 0.4199
 epoch: 5, train_loss: 1.1073, test_loss: 1.0711, test_f1: 0.4305
 epoch: 6, train_loss: 1.0854, test_loss: 1.0515, test_f1: 0.4522
 epoch: 7, train_loss: 1.0636, test_loss: 1.0381, test_f1: 0.4795
 epoch: 8, train_loss: 1.0413, test_loss: 1.0427, test_f1: 0.4769
 epoch: 9, train_loss: 1.0172, test_loss: 1.0210, test_f1: 0.4679
 epoch: 10, train_loss: 1.0044, test_loss: 0.9825, test_f1: 0.4898
 epoch: 11, train_loss: 0.9933, test_loss: 0.9978, test_f1: 0.4816
 epoch: 12, train_loss: 0.9738, test_loss: 1.0147, test_f1: 0.5163
 epoch: 13, train_loss: 0.9495, test_loss: 0.9840, test_f1: 0.4769
 epoch: 14, train_loss: 0.9411, test_loss: 1.0030, test_f1: 0.5066
 epoch: 15, train_loss: 0.9443, test_loss: 0.9595, test_f1: 0.4975
 epoch: 16, train_loss: 0.9210, test_loss: 0.9851, test_f1: 0.4989
 epoch: 17, train_loss: 0.9168, test_loss: 0.9957, test_f1: 0.4673
 epoch: 18, train_loss: 0.9090, test_loss: 0.9739, test_f1: 0.5282
 epoch: 19, train_loss: 0.8846, test_loss: 0.9935, test_f1: 0.5021
 epoch: 20, train_loss: 0.8909, test_loss: 1.0599, test_f1: 0.5028
 epoch: 21, train_loss: 0.8811, test_loss: 1.0095, test_f1: 0.5125
 epoch: 22, train_loss: 0.8665, test_loss: 1.0245, test_f1: 0.5127
 epoch: 23, train_loss: 0.8358, test_loss: 1.0196, test_f1: 0.5198
 epoch: 24, train_loss: 0.8404, test_loss: 1.0356, test_f1: 0.5194
 epoch: 25, train_loss: 0.8291, test_loss: 1.1354, test_f1: 0.5119
 epoch: 26, train_loss: 0.8248, test_loss: 1.1269, test_f1: 0.4937
 epoch: 27, train_loss: 0.8196, test_loss: 1.1557, test_f1: 0.4989
 epoch: 28, train_loss: 0.8225, test_loss: 1.0797, test_f1: 0.5089
 epoch: 29, train_loss: 0.8043, test_loss: 1.1504, test_f1: 0.4973
 epoch: 30, train_loss: 0.8103, test_loss: 1.1534, test_f1: 0.4881
 epoch: 31, train_loss: 0.7880, test_loss: 1.2133, test_f1: 0.5015
 epoch: 32, train_loss: 0.7955, test_loss: 1.2462, test_f1: 0.4999
 epoch: 33, train_loss: 0.7706, test_loss: 1.1955, test_f1: 0.5426
 epoch: 34, train_loss: 0.7706, test_loss: 1.2025, test_f1: 0.5159
 epoch: 35, train_loss: 0.7527, test_loss: 1.1591, test_f1: 0.5379
 epoch: 36, train_loss: 0.7784, test_loss: 1.1625, test_f1: 0.4995
 epoch: 37, train_loss: 0.7553, test_loss: 1.2307, test_f1: 0.4972
 epoch: 38, train_loss: 0.7671, test_loss: 1.2648, test_f1: 0.5126
 epoch: 39, train_loss: 0.7480, test_loss: 1.2420, test_f1: 0.5269
 epoch: 40, train_loss: 0.7481, test_loss: 1.2536, test_f1: 0.5218
 epoch: 41, train_loss: 0.7238, test_loss: 1.2849, test_f1: 0.5225
 epoch: 42, train_loss: 0.7243, test_loss: 1.2895, test_f1: 0.5198
 epoch: 43, train_loss: 0.7188, test_loss: 1.2956, test_f1: 0.5361
 epoch: 44, train_loss: 0.7066, test_loss: 1.2801, test_f1: 0.5476
 epoch: 45, train_loss: 0.7296, test_loss: 1.3196, test_f1: 0.5084
 epoch: 46, train_loss: 0.6934, test_loss: 1.2941, test_f1: 0.5404
 epoch: 47, train_loss: 0.7025, test_loss: 1.2549, test_f1: 0.5547
 epoch: 48, train_loss: 0.6703, test_loss: 1.3277, test_f1: 0.5178
 epoch: 49, train_loss: 0.6712, test_loss: 1.2950, test_f1: 0.5309
 epoch: 50, train_loss: 0.6960, test_loss: 1.2949, test_f1: 0.5366
 epoch: 51, train_loss: 0.6452, test_loss: 1.3717, test_f1: 0.5339
 epoch: 52, train_loss: 0.6159, test_loss: 1.3479, test_f1: 0.5554
 epoch: 53, train_loss: 0.6100, test_loss: 1.3782, test_f1: 0.5447
 epoch: 54, train_loss: 0.6111, test_loss: 1.3894, test_f1: 0.5529
 epoch: 55, train_loss: 0.5989, test_loss: 1.4242, test_f1: 0.5223
 epoch: 56, train_loss: 0.6138, test_loss: 1.4239, test_f1: 0.5391
 epoch: 57, train_loss: 0.5995, test_loss: 1.4313, test_f1: 0.5229
 epoch: 58, train_loss: 0.5908, test_loss: 1.3824, test_f1: 0.5451
 epoch: 59, train_loss: 0.5948, test_loss: 1.4112, test_f1: 0.5567
 epoch: 60, train_loss: 0.5881, test_loss: 1.4198, test_f1: 0.5402
 epoch: 61, train_loss: 0.5829, test_loss: 1.4243, test_f1: 0.5389
 epoch: 62, train_loss: 0.5740, test_loss: 1.4324, test_f1: 0.5435
 epoch: 63, train_loss: 0.5880, test_loss: 1.4014, test_f1: 0.5520
 epoch: 64, train_loss: 0.5915, test_loss: 1.4260, test_f1: 0.5571
 epoch: 65, train_loss: 0.5751, test_loss: 1.4659, test_f1: 0.5531
 epoch: 66, train_loss: 0.5698, test_loss: 1.4887, test_f1: 0.5680
 epoch: 67, train_loss: 0.5484, test_loss: 1.4911, test_f1: 0.5585
 epoch: 68, train_loss: 0.5468, test_loss: 1.4962, test_f1: 0.5602
 epoch: 69, train_loss: 0.5505, test_loss: 1.5362, test_f1: 0.5622
 epoch: 70, train_loss: 0.5450, test_loss: 1.5619, test_f1: 0.5563
 epoch: 71, train_loss: 0.5363, test_loss: 1.5496, test_f1: 0.5642
 epoch: 72, train_loss: 0.5444, test_loss: 1.5132, test_f1: 0.5764
 epoch: 73, train_loss: 0.5303, test_loss: 1.5685, test_f1: 0.5604
 epoch: 74, train_loss: 0.5396, test_loss: 1.4979, test_f1: 0.5506
 epoch: 75, train_loss: 0.5335, test_loss: 1.5507, test_f1: 0.5252
 epoch: 76, train_loss: 0.5182, test_loss: 1.5231, test_f1: 0.5563
 epoch: 77, train_loss: 0.5386, test_loss: 1.5865, test_f1: 0.5625
 epoch: 78, train_loss: 0.5182, test_loss: 1.5726, test_f1: 0.5375
 epoch: 79, train_loss: 0.5225, test_loss: 1.5673, test_f1: 0.5391
 epoch: 80, train_loss: 0.5108, test_loss: 1.5929, test_f1: 0.5356
 epoch: 81, train_loss: 0.5058, test_loss: 1.6039, test_f1: 0.5553
 epoch: 82, train_loss: 0.5144, test_loss: 1.6636, test_f1: 0.5387
 epoch: 83, train_loss: 0.5062, test_loss: 1.5696, test_f1: 0.5466
 epoch: 84, train_loss: 0.5205, test_loss: 1.5964, test_f1: 0.5390
 epoch: 85, train_loss: 0.5150, test_loss: 1.5485, test_f1: 0.5578
 epoch: 86, train_loss: 0.4886, test_loss: 1.5896, test_f1: 0.5481
 epoch: 87, train_loss: 0.5143, test_loss: 1.6117, test_f1: 0.5343
 epoch: 88, train_loss: 0.4987, test_loss: 1.6039, test_f1: 0.5538
 epoch: 89, train_loss: 0.5060, test_loss: 1.6497, test_f1: 0.5685
 epoch: 90, train_loss: 0.4873, test_loss: 1.6027, test_f1: 0.5689
 epoch: 91, train_loss: 0.4869, test_loss: 1.6421, test_f1: 0.5568
 epoch: 92, train_loss: 0.4824, test_loss: 1.7622, test_f1: 0.5246
 epoch: 93, train_loss: 0.4983, test_loss: 1.6737, test_f1: 0.5365
 epoch: 94, train_loss: 0.4722, test_loss: 1.7259, test_f1: 0.5573
 epoch: 95, train_loss: 0.4835, test_loss: 1.6741, test_f1: 0.5465
 epoch: 96, train_loss: 0.4742, test_loss: 1.7509, test_f1: 0.5543
 epoch: 97, train_loss: 0.4909, test_loss: 1.6867, test_f1: 0.5646
 epoch: 98, train_loss: 0.4648, test_loss: 1.6575, test_f1: 0.5674
 epoch: 99, train_loss: 0.4679, test_loss: 1.7232, test_f1: 0.5660

Training completed in 997.72 seconds
Best F1: 0.6021 at epoch 83
Mean F1 across iterations: 0.5841  0.0132
========================FINAL RESULTS================================
FEGIN weighted F1: 0.6021  0.0132
python main.py --data ltspice_examples --representation component_component --model FEGIN --layers 6 --hiddens 64 --batch_size 64 --lr 0.001 --emb_size 512 --epochs 100 --save_appendix component_component_L6_H64_BS64_LR0.001_E512 --no_val
-----



STDERR:
  File "main.py", line 370, in <module>
    main()
  File "main.py", line 254, in main
    dataset = dataset_class(
  File "/home/philip/projects/llm_inference_code_repo/Circuit-Completion-Using-GNNs/component_classification_with_link_prediction_head/evaluation/FEGIN/kernel/circuit_datasets.py", line 15, in __init__
    self.data, self.slices = torch.load(self.processed_paths[0])
  File "/home/philip/.local/lib/python3.8/site-packages/torch/serialization.py", line 1040, in load
    warnings.warn(
  File "/usr/lib/python3.8/warnings.py", line 109, in _showwarnmsg
    sw(msg.message, msg.category, msg.filename, msg.lineno,
  File "main.py", line 47, in warn_with_traceback
    traceback.print_stack(file=log)
/home/philip/projects/llm_inference_code_repo/Circuit-Completion-Using-GNNs/component_classification_with_link_prediction_head/evaluation/FEGIN/kernel/circuit_datasets.py:15: FutureWarning: You are using `torch.load` with `weights_only=False` (the current default value), which uses the default pickle module implicitly. It is possible to construct malicious pickle data which will execute arbitrary code during unpickling (See https://github.com/pytorch/pytorch/blob/main/SECURITY.md#untrusted-models for more details). In a future release, the default value for `weights_only` will be flipped to `True`. This limits the functions that could be executed during unpickling. Arbitrary objects will no longer be allowed to be loaded via this mode unless they are explicitly allowlisted by the user via `torch.serialization.add_safe_globals`. We recommend you start setting `weights_only=True` for any use case where you don't have full control of the loaded file. Please open an issue on GitHub for any issues related to this experimental feature.
  self.data, self.slices = torch.load(self.processed_paths[0])
