STDOUT:
Results will be saved in /home/philip/projects/llm_inference_code_repo/Circuit-Completion-Using-GNNs/component_classification_with_link_prediction_head/evaluation/FEGIN/results/model_FEGIN_dataset_ltspice_examples
Command line input: python main.py --data ltspice_examples --representation component_component --model FEGIN --layers 3 --hiddens 16 --batch_size 256 --lr 0.001 --emb_size 128 --epochs 100 --save_appendix component_component_L3_H16_BS256_LR0.001_E128 --no_val
 is saved.
-----
ltspice_examples - FEGIN
Using 3 layers, 16 hidden units, h = 2
Loading component_component representation dataset
ENTERED
Training FEGIN on component_component representation
Train: 3556, Test: 845
##################ITERATION #0 ****************************************
 epoch: 0, train_loss: 1.3551, test_loss: 1.3487, test_f1: 0.2274
 epoch: 1, train_loss: 1.3283, test_loss: 1.3312, test_f1: 0.2274
 epoch: 2, train_loss: 1.3118, test_loss: 1.3118, test_f1: 0.2274
 epoch: 3, train_loss: 1.3017, test_loss: 1.2978, test_f1: 0.2274
 epoch: 4, train_loss: 1.2899, test_loss: 1.2890, test_f1: 0.2274
 epoch: 5, train_loss: 1.2786, test_loss: 1.2830, test_f1: 0.2274
 epoch: 6, train_loss: 1.2722, test_loss: 1.2799, test_f1: 0.2276
 epoch: 7, train_loss: 1.2651, test_loss: 1.2733, test_f1: 0.2392
 epoch: 8, train_loss: 1.2616, test_loss: 1.2684, test_f1: 0.2393
 epoch: 9, train_loss: 1.2493, test_loss: 1.2627, test_f1: 0.2670
 epoch: 10, train_loss: 1.2442, test_loss: 1.2533, test_f1: 0.2670
 epoch: 11, train_loss: 1.2347, test_loss: 1.2445, test_f1: 0.2752
 epoch: 12, train_loss: 1.2279, test_loss: 1.2365, test_f1: 0.2987
 epoch: 13, train_loss: 1.2149, test_loss: 1.2280, test_f1: 0.3249
 epoch: 14, train_loss: 1.2021, test_loss: 1.2194, test_f1: 0.3732
 epoch: 15, train_loss: 1.1931, test_loss: 1.2074, test_f1: 0.3700
 epoch: 16, train_loss: 1.1796, test_loss: 1.1989, test_f1: 0.3689
 epoch: 17, train_loss: 1.1727, test_loss: 1.1882, test_f1: 0.3737
 epoch: 18, train_loss: 1.1606, test_loss: 1.1805, test_f1: 0.4095
 epoch: 19, train_loss: 1.1571, test_loss: 1.1765, test_f1: 0.4350
 epoch: 20, train_loss: 1.1352, test_loss: 1.1747, test_f1: 0.4401
 epoch: 21, train_loss: 1.1368, test_loss: 1.1569, test_f1: 0.4370
 epoch: 22, train_loss: 1.1286, test_loss: 1.1665, test_f1: 0.4424
 epoch: 23, train_loss: 1.1163, test_loss: 1.1590, test_f1: 0.4538
 epoch: 24, train_loss: 1.1250, test_loss: 1.1525, test_f1: 0.4522
 epoch: 25, train_loss: 1.1146, test_loss: 1.1361, test_f1: 0.4613
 epoch: 26, train_loss: 1.1030, test_loss: 1.1363, test_f1: 0.4548
 epoch: 27, train_loss: 1.0959, test_loss: 1.1294, test_f1: 0.4798
 epoch: 28, train_loss: 1.0930, test_loss: 1.1275, test_f1: 0.4699
 epoch: 29, train_loss: 1.0997, test_loss: 1.1152, test_f1: 0.4725
 epoch: 30, train_loss: 1.0756, test_loss: 1.1166, test_f1: 0.4807
 epoch: 31, train_loss: 1.0829, test_loss: 1.1166, test_f1: 0.4738
 epoch: 32, train_loss: 1.0777, test_loss: 1.1095, test_f1: 0.4620
 epoch: 33, train_loss: 1.0654, test_loss: 1.0955, test_f1: 0.4968
 epoch: 34, train_loss: 1.0621, test_loss: 1.1096, test_f1: 0.4711
 epoch: 35, train_loss: 1.0588, test_loss: 1.1215, test_f1: 0.4687
 epoch: 36, train_loss: 1.0471, test_loss: 1.0935, test_f1: 0.4850
 epoch: 37, train_loss: 1.0455, test_loss: 1.0771, test_f1: 0.4854
 epoch: 38, train_loss: 1.0406, test_loss: 1.0938, test_f1: 0.4708
 epoch: 39, train_loss: 1.0275, test_loss: 1.0911, test_f1: 0.4654
 epoch: 40, train_loss: 1.0252, test_loss: 1.0838, test_f1: 0.4866
 epoch: 41, train_loss: 1.0215, test_loss: 1.0801, test_f1: 0.4663
 epoch: 42, train_loss: 1.0265, test_loss: 1.0781, test_f1: 0.4813
 epoch: 43, train_loss: 1.0110, test_loss: 1.0614, test_f1: 0.5045
 epoch: 44, train_loss: 1.0171, test_loss: 1.1637, test_f1: 0.4686
 epoch: 45, train_loss: 1.0154, test_loss: 1.0889, test_f1: 0.4825
 epoch: 46, train_loss: 1.0037, test_loss: 1.1267, test_f1: 0.4851
 epoch: 47, train_loss: 1.0008, test_loss: 1.1470, test_f1: 0.4789
 epoch: 48, train_loss: 0.9933, test_loss: 1.1766, test_f1: 0.4853
 epoch: 49, train_loss: 0.9992, test_loss: 1.2384, test_f1: 0.4645
 epoch: 50, train_loss: 0.9894, test_loss: 1.0985, test_f1: 0.4795
 epoch: 51, train_loss: 0.9810, test_loss: 1.0366, test_f1: 0.5003
 epoch: 52, train_loss: 0.9741, test_loss: 1.1294, test_f1: 0.4890
 epoch: 53, train_loss: 0.9619, test_loss: 1.1968, test_f1: 0.4841
 epoch: 54, train_loss: 0.9612, test_loss: 1.1771, test_f1: 0.4913
 epoch: 55, train_loss: 0.9629, test_loss: 1.2573, test_f1: 0.4819
 epoch: 56, train_loss: 0.9640, test_loss: 1.2376, test_f1: 0.4890
 epoch: 57, train_loss: 0.9654, test_loss: 1.3143, test_f1: 0.4781
 epoch: 58, train_loss: 0.9493, test_loss: 1.1691, test_f1: 0.4851
 epoch: 59, train_loss: 0.9551, test_loss: 1.2881, test_f1: 0.4874
 epoch: 60, train_loss: 0.9533, test_loss: 1.2760, test_f1: 0.4865
 epoch: 61, train_loss: 0.9573, test_loss: 1.2656, test_f1: 0.4944
 epoch: 62, train_loss: 0.9474, test_loss: 1.2842, test_f1: 0.4788
 epoch: 63, train_loss: 0.9518, test_loss: 1.4125, test_f1: 0.4912
 epoch: 64, train_loss: 0.9375, test_loss: 1.3244, test_f1: 0.4974
 epoch: 65, train_loss: 0.9388, test_loss: 1.4144, test_f1: 0.4928
 epoch: 66, train_loss: 0.9464, test_loss: 1.3713, test_f1: 0.4906
 epoch: 67, train_loss: 0.9371, test_loss: 1.3505, test_f1: 0.4878
 epoch: 68, train_loss: 0.9289, test_loss: 1.3827, test_f1: 0.4993
 epoch: 69, train_loss: 0.9435, test_loss: 1.3545, test_f1: 0.4907
 epoch: 70, train_loss: 0.9508, test_loss: 1.3564, test_f1: 0.4981
 epoch: 71, train_loss: 0.9366, test_loss: 1.2574, test_f1: 0.5025
 epoch: 72, train_loss: 0.9313, test_loss: 1.3882, test_f1: 0.4939
 epoch: 73, train_loss: 0.9373, test_loss: 1.2453, test_f1: 0.4955
 epoch: 74, train_loss: 0.9234, test_loss: 1.4366, test_f1: 0.4890
 epoch: 75, train_loss: 0.9338, test_loss: 1.3889, test_f1: 0.4984
 epoch: 76, train_loss: 0.9374, test_loss: 1.3445, test_f1: 0.4990
 epoch: 77, train_loss: 0.9284, test_loss: 1.4885, test_f1: 0.4952
 epoch: 78, train_loss: 0.9303, test_loss: 1.4252, test_f1: 0.5012
 epoch: 79, train_loss: 0.9221, test_loss: 1.3942, test_f1: 0.5030
 epoch: 80, train_loss: 0.9155, test_loss: 1.5085, test_f1: 0.4998
 epoch: 81, train_loss: 0.9223, test_loss: 1.5018, test_f1: 0.4989
 epoch: 82, train_loss: 0.9187, test_loss: 1.4387, test_f1: 0.4964
 epoch: 83, train_loss: 0.9147, test_loss: 1.4548, test_f1: 0.4903
 epoch: 84, train_loss: 0.9110, test_loss: 1.5428, test_f1: 0.5008
 epoch: 85, train_loss: 0.9288, test_loss: 1.5940, test_f1: 0.4963
 epoch: 86, train_loss: 0.9255, test_loss: 1.4065, test_f1: 0.4968
 epoch: 87, train_loss: 0.9075, test_loss: 1.4372, test_f1: 0.4915
 epoch: 88, train_loss: 0.9022, test_loss: 1.5505, test_f1: 0.4924
 epoch: 89, train_loss: 0.9120, test_loss: 1.4985, test_f1: 0.4900
 epoch: 90, train_loss: 0.9055, test_loss: 1.4545, test_f1: 0.5035
 epoch: 91, train_loss: 0.9058, test_loss: 1.6087, test_f1: 0.5059
 epoch: 92, train_loss: 0.9007, test_loss: 1.6001, test_f1: 0.4932
 epoch: 93, train_loss: 0.9022, test_loss: 1.5848, test_f1: 0.4893
 epoch: 94, train_loss: 0.9123, test_loss: 1.7361, test_f1: 0.4961
 epoch: 95, train_loss: 0.8897, test_loss: 1.4378, test_f1: 0.5019
 epoch: 96, train_loss: 0.8898, test_loss: 1.6183, test_f1: 0.5001
 epoch: 97, train_loss: 0.8930, test_loss: 1.5706, test_f1: 0.5044
 epoch: 98, train_loss: 0.8996, test_loss: 1.3393, test_f1: 0.5000
 epoch: 99, train_loss: 0.9015, test_loss: 1.5901, test_f1: 0.4969
##################ITERATION #1 ****************************************
 epoch: 0, train_loss: 1.3686, test_loss: 1.3432, test_f1: 0.2274
 epoch: 1, train_loss: 1.3014, test_loss: 1.3094, test_f1: 0.2274
 epoch: 2, train_loss: 1.2804, test_loss: 1.2723, test_f1: 0.2266
 epoch: 3, train_loss: 1.2618, test_loss: 1.2433, test_f1: 0.2528
 epoch: 4, train_loss: 1.2475, test_loss: 1.2187, test_f1: 0.3116
 epoch: 5, train_loss: 1.2253, test_loss: 1.1961, test_f1: 0.3376
 epoch: 6, train_loss: 1.2117, test_loss: 1.1756, test_f1: 0.3487
 epoch: 7, train_loss: 1.2039, test_loss: 1.1618, test_f1: 0.3691
 epoch: 8, train_loss: 1.1868, test_loss: 1.1447, test_f1: 0.4002
 epoch: 9, train_loss: 1.1801, test_loss: 1.1301, test_f1: 0.3967
 epoch: 10, train_loss: 1.1582, test_loss: 1.1158, test_f1: 0.4086
 epoch: 11, train_loss: 1.1555, test_loss: 1.1025, test_f1: 0.4200
 epoch: 12, train_loss: 1.1395, test_loss: 1.0901, test_f1: 0.4287
 epoch: 13, train_loss: 1.1288, test_loss: 1.0823, test_f1: 0.4313
 epoch: 14, train_loss: 1.1154, test_loss: 1.0704, test_f1: 0.4364
 epoch: 15, train_loss: 1.1047, test_loss: 1.0622, test_f1: 0.4283
 epoch: 16, train_loss: 1.0975, test_loss: 1.0497, test_f1: 0.4291
 epoch: 17, train_loss: 1.0932, test_loss: 1.0346, test_f1: 0.4316
 epoch: 18, train_loss: 1.0736, test_loss: 1.0295, test_f1: 0.4407
 epoch: 19, train_loss: 1.0721, test_loss: 1.0199, test_f1: 0.4456
 epoch: 20, train_loss: 1.0603, test_loss: 1.0309, test_f1: 0.4404
 epoch: 21, train_loss: 1.0519, test_loss: 1.0075, test_f1: 0.4491
 epoch: 22, train_loss: 1.0459, test_loss: 1.0106, test_f1: 0.4577
 epoch: 23, train_loss: 1.0319, test_loss: 1.0010, test_f1: 0.4579
 epoch: 24, train_loss: 1.0257, test_loss: 1.0038, test_f1: 0.4626
 epoch: 25, train_loss: 1.0274, test_loss: 0.9972, test_f1: 0.4696
 epoch: 26, train_loss: 1.0275, test_loss: 0.9994, test_f1: 0.4647
 epoch: 27, train_loss: 1.0116, test_loss: 0.9992, test_f1: 0.4891
 epoch: 28, train_loss: 1.0150, test_loss: 0.9932, test_f1: 0.4898
 epoch: 29, train_loss: 1.0074, test_loss: 0.9889, test_f1: 0.4764
 epoch: 30, train_loss: 1.0050, test_loss: 0.9749, test_f1: 0.4811
 epoch: 31, train_loss: 0.9916, test_loss: 1.0036, test_f1: 0.4594
 epoch: 32, train_loss: 0.9946, test_loss: 0.9908, test_f1: 0.4740
 epoch: 33, train_loss: 0.9881, test_loss: 0.9861, test_f1: 0.4612
 epoch: 34, train_loss: 0.9878, test_loss: 0.9854, test_f1: 0.4925
 epoch: 35, train_loss: 0.9764, test_loss: 0.9477, test_f1: 0.4844
 epoch: 36, train_loss: 0.9727, test_loss: 1.0044, test_f1: 0.4782
 epoch: 37, train_loss: 0.9770, test_loss: 0.9758, test_f1: 0.4865
 epoch: 38, train_loss: 0.9664, test_loss: 0.9629, test_f1: 0.4974
 epoch: 39, train_loss: 0.9663, test_loss: 0.9912, test_f1: 0.4692
 epoch: 40, train_loss: 0.9583, test_loss: 0.9692, test_f1: 0.4662
 epoch: 41, train_loss: 0.9495, test_loss: 0.9482, test_f1: 0.4626
 epoch: 42, train_loss: 0.9543, test_loss: 0.9836, test_f1: 0.4640
 epoch: 43, train_loss: 0.9535, test_loss: 0.9652, test_f1: 0.4655
 epoch: 44, train_loss: 0.9485, test_loss: 0.9610, test_f1: 0.4758
 epoch: 45, train_loss: 0.9544, test_loss: 0.9586, test_f1: 0.4555
 epoch: 46, train_loss: 0.9361, test_loss: 0.9614, test_f1: 0.4862
 epoch: 47, train_loss: 0.9352, test_loss: 0.9671, test_f1: 0.4918
 epoch: 48, train_loss: 0.9315, test_loss: 0.9602, test_f1: 0.5186
 epoch: 49, train_loss: 0.9270, test_loss: 0.9786, test_f1: 0.4849
 epoch: 50, train_loss: 0.9232, test_loss: 0.9829, test_f1: 0.4683
 epoch: 51, train_loss: 0.9295, test_loss: 0.9663, test_f1: 0.4890
 epoch: 52, train_loss: 0.9200, test_loss: 0.9615, test_f1: 0.5031
 epoch: 53, train_loss: 0.9143, test_loss: 0.9485, test_f1: 0.4925
 epoch: 54, train_loss: 0.9201, test_loss: 0.9611, test_f1: 0.5078
 epoch: 55, train_loss: 0.9224, test_loss: 0.9544, test_f1: 0.4952
 epoch: 56, train_loss: 0.9133, test_loss: 0.9516, test_f1: 0.5071
 epoch: 57, train_loss: 0.9133, test_loss: 0.9776, test_f1: 0.5039
 epoch: 58, train_loss: 0.9122, test_loss: 0.9540, test_f1: 0.5021
 epoch: 59, train_loss: 0.9176, test_loss: 0.9687, test_f1: 0.5077
 epoch: 60, train_loss: 0.9050, test_loss: 0.9667, test_f1: 0.5075
 epoch: 61, train_loss: 0.9059, test_loss: 0.9626, test_f1: 0.5033
 epoch: 62, train_loss: 0.9010, test_loss: 0.9634, test_f1: 0.5042
 epoch: 63, train_loss: 0.9072, test_loss: 0.9678, test_f1: 0.5066
 epoch: 64, train_loss: 0.8986, test_loss: 0.9604, test_f1: 0.5259
 epoch: 65, train_loss: 0.8938, test_loss: 0.9676, test_f1: 0.5208
 epoch: 66, train_loss: 0.8924, test_loss: 0.9788, test_f1: 0.5163
 epoch: 67, train_loss: 0.8959, test_loss: 0.9829, test_f1: 0.5192
 epoch: 68, train_loss: 0.9008, test_loss: 0.9668, test_f1: 0.5121
 epoch: 69, train_loss: 0.8882, test_loss: 0.9602, test_f1: 0.5318
 epoch: 70, train_loss: 0.8948, test_loss: 0.9691, test_f1: 0.5066
 epoch: 71, train_loss: 0.9009, test_loss: 0.9832, test_f1: 0.5102
 epoch: 72, train_loss: 0.8881, test_loss: 0.9670, test_f1: 0.5096
 epoch: 73, train_loss: 0.8968, test_loss: 0.9656, test_f1: 0.5050
 epoch: 74, train_loss: 0.8870, test_loss: 0.9710, test_f1: 0.5075
 epoch: 75, train_loss: 0.8925, test_loss: 0.9812, test_f1: 0.5119
 epoch: 76, train_loss: 0.8918, test_loss: 0.9660, test_f1: 0.5350
 epoch: 77, train_loss: 0.8780, test_loss: 0.9900, test_f1: 0.5034
 epoch: 78, train_loss: 0.8872, test_loss: 0.9800, test_f1: 0.5177
 epoch: 79, train_loss: 0.8824, test_loss: 0.9736, test_f1: 0.5164
 epoch: 80, train_loss: 0.8781, test_loss: 0.9885, test_f1: 0.5167
 epoch: 81, train_loss: 0.8873, test_loss: 0.9878, test_f1: 0.5112
 epoch: 82, train_loss: 0.8830, test_loss: 0.9950, test_f1: 0.5066
 epoch: 83, train_loss: 0.8815, test_loss: 1.0031, test_f1: 0.4970
 epoch: 84, train_loss: 0.8793, test_loss: 1.0065, test_f1: 0.4996
 epoch: 85, train_loss: 0.8767, test_loss: 1.0012, test_f1: 0.5150
 epoch: 86, train_loss: 0.8639, test_loss: 1.0102, test_f1: 0.4994
 epoch: 87, train_loss: 0.8728, test_loss: 0.9866, test_f1: 0.5174
 epoch: 88, train_loss: 0.8864, test_loss: 1.0091, test_f1: 0.4908
 epoch: 89, train_loss: 0.8783, test_loss: 1.0059, test_f1: 0.4996
 epoch: 90, train_loss: 0.8684, test_loss: 1.0071, test_f1: 0.4917
 epoch: 91, train_loss: 0.8669, test_loss: 0.9905, test_f1: 0.5130
 epoch: 92, train_loss: 0.8650, test_loss: 1.0336, test_f1: 0.4907
 epoch: 93, train_loss: 0.8619, test_loss: 1.0164, test_f1: 0.4980
 epoch: 94, train_loss: 0.8709, test_loss: 0.9934, test_f1: 0.5088
 epoch: 95, train_loss: 0.8778, test_loss: 1.0060, test_f1: 0.5057
 epoch: 96, train_loss: 0.8740, test_loss: 1.0032, test_f1: 0.5000
 epoch: 97, train_loss: 0.8691, test_loss: 1.0190, test_f1: 0.4874
 epoch: 98, train_loss: 0.8605, test_loss: 0.9897, test_f1: 0.5063
 epoch: 99, train_loss: 0.8704, test_loss: 1.0073, test_f1: 0.4908
##################ITERATION #2 ****************************************
 epoch: 0, train_loss: 1.3076, test_loss: 1.2972, test_f1: 0.2274
 epoch: 1, train_loss: 1.2700, test_loss: 1.2712, test_f1: 0.2274
 epoch: 2, train_loss: 1.2575, test_loss: 1.2474, test_f1: 0.2274
 epoch: 3, train_loss: 1.2399, test_loss: 1.2297, test_f1: 0.2300
 epoch: 4, train_loss: 1.2351, test_loss: 1.2210, test_f1: 0.2843
 epoch: 5, train_loss: 1.2343, test_loss: 1.2046, test_f1: 0.3286
 epoch: 6, train_loss: 1.2101, test_loss: 1.1848, test_f1: 0.3286
 epoch: 7, train_loss: 1.2070, test_loss: 1.1758, test_f1: 0.3448
 epoch: 8, train_loss: 1.1963, test_loss: 1.1699, test_f1: 0.3455
 epoch: 9, train_loss: 1.1855, test_loss: 1.1744, test_f1: 0.3687
 epoch: 10, train_loss: 1.1816, test_loss: 1.3253, test_f1: 0.3701
 epoch: 11, train_loss: 1.1707, test_loss: 1.1612, test_f1: 0.3600
 epoch: 12, train_loss: 1.1606, test_loss: 1.1297, test_f1: 0.3912
 epoch: 13, train_loss: 1.1388, test_loss: 1.1750, test_f1: 0.3963
 epoch: 14, train_loss: 1.1373, test_loss: 1.1446, test_f1: 0.3743
 epoch: 15, train_loss: 1.1221, test_loss: 1.2014, test_f1: 0.3776
 epoch: 16, train_loss: 1.1171, test_loss: 1.1755, test_f1: 0.3859
 epoch: 17, train_loss: 1.1149, test_loss: 1.1496, test_f1: 0.4021
 epoch: 18, train_loss: 1.1101, test_loss: 1.1884, test_f1: 0.4079
 epoch: 19, train_loss: 1.0961, test_loss: 1.1557, test_f1: 0.4169
 epoch: 20, train_loss: 1.0899, test_loss: 1.1376, test_f1: 0.4023
 epoch: 21, train_loss: 1.0893, test_loss: 1.0916, test_f1: 0.4172
 epoch: 22, train_loss: 1.0740, test_loss: 1.1591, test_f1: 0.4131
 epoch: 23, train_loss: 1.0681, test_loss: 1.0732, test_f1: 0.4198
 epoch: 24, train_loss: 1.0681, test_loss: 1.0887, test_f1: 0.4011
 epoch: 25, train_loss: 1.0627, test_loss: 1.1039, test_f1: 0.4215
 epoch: 26, train_loss: 1.0587, test_loss: 1.1371, test_f1: 0.4222
 epoch: 27, train_loss: 1.0524, test_loss: 1.0720, test_f1: 0.4066
 epoch: 28, train_loss: 1.0513, test_loss: 1.0784, test_f1: 0.4238
 epoch: 29, train_loss: 1.0428, test_loss: 1.0977, test_f1: 0.4243
 epoch: 30, train_loss: 1.0289, test_loss: 1.1057, test_f1: 0.4157
 epoch: 31, train_loss: 1.0339, test_loss: 1.2794, test_f1: 0.4191
 epoch: 32, train_loss: 1.0260, test_loss: 1.1053, test_f1: 0.4357
 epoch: 33, train_loss: 1.0172, test_loss: 1.0829, test_f1: 0.4275
 epoch: 34, train_loss: 1.0123, test_loss: 1.1260, test_f1: 0.4256
 epoch: 35, train_loss: 1.0084, test_loss: 1.0841, test_f1: 0.4230
 epoch: 36, train_loss: 1.0008, test_loss: 1.1272, test_f1: 0.4199
 epoch: 37, train_loss: 0.9969, test_loss: 1.2058, test_f1: 0.4421
 epoch: 38, train_loss: 1.0019, test_loss: 1.1157, test_f1: 0.4088
 epoch: 39, train_loss: 1.0056, test_loss: 1.1810, test_f1: 0.4247
 epoch: 40, train_loss: 0.9961, test_loss: 1.1038, test_f1: 0.4258
 epoch: 41, train_loss: 0.9810, test_loss: 1.1168, test_f1: 0.4236
 epoch: 42, train_loss: 0.9755, test_loss: 1.1258, test_f1: 0.4222
 epoch: 43, train_loss: 0.9762, test_loss: 1.1719, test_f1: 0.4164
 epoch: 44, train_loss: 0.9757, test_loss: 1.0790, test_f1: 0.4327
 epoch: 45, train_loss: 0.9776, test_loss: 1.1847, test_f1: 0.4205
 epoch: 46, train_loss: 0.9715, test_loss: 1.0745, test_f1: 0.4321
 epoch: 47, train_loss: 0.9687, test_loss: 1.0796, test_f1: 0.4458
 epoch: 48, train_loss: 0.9632, test_loss: 1.1210, test_f1: 0.4325
 epoch: 49, train_loss: 0.9640, test_loss: 1.1689, test_f1: 0.4101
 epoch: 50, train_loss: 0.9617, test_loss: 1.3113, test_f1: 0.4251
 epoch: 51, train_loss: 0.9531, test_loss: 1.1592, test_f1: 0.4179
 epoch: 52, train_loss: 0.9437, test_loss: 1.2503, test_f1: 0.4428
 epoch: 53, train_loss: 0.9388, test_loss: 1.1367, test_f1: 0.4341
 epoch: 54, train_loss: 0.9429, test_loss: 1.1549, test_f1: 0.4168
 epoch: 55, train_loss: 0.9436, test_loss: 1.1619, test_f1: 0.4207
 epoch: 56, train_loss: 0.9435, test_loss: 1.1433, test_f1: 0.4182
 epoch: 57, train_loss: 0.9291, test_loss: 1.1396, test_f1: 0.4247
 epoch: 58, train_loss: 0.9429, test_loss: 1.1720, test_f1: 0.4227
 epoch: 59, train_loss: 0.9370, test_loss: 1.1425, test_f1: 0.4250
 epoch: 60, train_loss: 0.9386, test_loss: 1.1571, test_f1: 0.4298
 epoch: 61, train_loss: 0.9273, test_loss: 1.1991, test_f1: 0.4305
 epoch: 62, train_loss: 0.9353, test_loss: 1.1610, test_f1: 0.4269
 epoch: 63, train_loss: 0.9316, test_loss: 1.2012, test_f1: 0.4245
 epoch: 64, train_loss: 0.9386, test_loss: 1.1579, test_f1: 0.4282
 epoch: 65, train_loss: 0.9277, test_loss: 1.2838, test_f1: 0.4437
 epoch: 66, train_loss: 0.9268, test_loss: 1.1407, test_f1: 0.4333
 epoch: 67, train_loss: 0.9273, test_loss: 1.2903, test_f1: 0.4229
 epoch: 68, train_loss: 0.9276, test_loss: 1.1459, test_f1: 0.4241
 epoch: 69, train_loss: 0.9210, test_loss: 1.2080, test_f1: 0.4298
 epoch: 70, train_loss: 0.9147, test_loss: 1.2235, test_f1: 0.4320
 epoch: 71, train_loss: 0.9240, test_loss: 1.2624, test_f1: 0.4250
 epoch: 72, train_loss: 0.9167, test_loss: 1.3485, test_f1: 0.4297
 epoch: 73, train_loss: 0.9157, test_loss: 1.2569, test_f1: 0.4256
 epoch: 74, train_loss: 0.9030, test_loss: 1.3559, test_f1: 0.4408
 epoch: 75, train_loss: 0.9273, test_loss: 1.1603, test_f1: 0.4352
 epoch: 76, train_loss: 0.9135, test_loss: 1.1762, test_f1: 0.4340
 epoch: 77, train_loss: 0.9144, test_loss: 1.1166, test_f1: 0.4310
 epoch: 78, train_loss: 0.9030, test_loss: 1.1791, test_f1: 0.4340
 epoch: 79, train_loss: 0.9048, test_loss: 1.1783, test_f1: 0.4284
 epoch: 80, train_loss: 0.9005, test_loss: 1.2104, test_f1: 0.4328
 epoch: 81, train_loss: 0.9042, test_loss: 1.1895, test_f1: 0.4284
 epoch: 82, train_loss: 0.8988, test_loss: 1.1746, test_f1: 0.4249
 epoch: 83, train_loss: 0.9067, test_loss: 1.1696, test_f1: 0.4414
 epoch: 84, train_loss: 0.9022, test_loss: 1.1456, test_f1: 0.4298
 epoch: 85, train_loss: 0.8953, test_loss: 1.1594, test_f1: 0.4297
 epoch: 86, train_loss: 0.8934, test_loss: 1.2254, test_f1: 0.4329
 epoch: 87, train_loss: 0.9019, test_loss: 1.2008, test_f1: 0.4331
 epoch: 88, train_loss: 0.9115, test_loss: 1.4428, test_f1: 0.4473
 epoch: 89, train_loss: 0.8945, test_loss: 1.2542, test_f1: 0.4337
 epoch: 90, train_loss: 0.8982, test_loss: 1.1757, test_f1: 0.4418
 epoch: 91, train_loss: 0.9056, test_loss: 1.1947, test_f1: 0.4448
 epoch: 92, train_loss: 0.8887, test_loss: 1.2861, test_f1: 0.4458
 epoch: 93, train_loss: 0.8929, test_loss: 1.1572, test_f1: 0.4257
 epoch: 94, train_loss: 0.8955, test_loss: 1.1805, test_f1: 0.4317
 epoch: 95, train_loss: 0.8978, test_loss: 1.1585, test_f1: 0.4269
 epoch: 96, train_loss: 0.8983, test_loss: 1.1435, test_f1: 0.4319
 epoch: 97, train_loss: 0.8858, test_loss: 1.1924, test_f1: 0.4366
 epoch: 98, train_loss: 0.8889, test_loss: 1.1609, test_f1: 0.4470
 epoch: 99, train_loss: 0.8937, test_loss: 1.1445, test_f1: 0.4288
##################ITERATION #3 ****************************************
 epoch: 0, train_loss: 1.4177, test_loss: 1.3115, test_f1: 0.2274
 epoch: 1, train_loss: 1.2831, test_loss: 1.2641, test_f1: 0.2274
 epoch: 2, train_loss: 1.2559, test_loss: 1.2385, test_f1: 0.2377
 epoch: 3, train_loss: 1.2440, test_loss: 1.2139, test_f1: 0.2868
 epoch: 4, train_loss: 1.2403, test_loss: 1.2035, test_f1: 0.3095
 epoch: 5, train_loss: 1.2267, test_loss: 1.1956, test_f1: 0.3144
 epoch: 6, train_loss: 1.2235, test_loss: 1.1875, test_f1: 0.3300
 epoch: 7, train_loss: 1.2163, test_loss: 1.1809, test_f1: 0.3325
 epoch: 8, train_loss: 1.2096, test_loss: 1.1768, test_f1: 0.3326
 epoch: 9, train_loss: 1.2027, test_loss: 1.1742, test_f1: 0.3310
 epoch: 10, train_loss: 1.1986, test_loss: 1.1648, test_f1: 0.3403
 epoch: 11, train_loss: 1.1960, test_loss: 1.1601, test_f1: 0.3708
 epoch: 12, train_loss: 1.1857, test_loss: 1.1571, test_f1: 0.3700
 epoch: 13, train_loss: 1.1818, test_loss: 1.1424, test_f1: 0.3934
 epoch: 14, train_loss: 1.1723, test_loss: 1.1291, test_f1: 0.3894
 epoch: 15, train_loss: 1.1712, test_loss: 1.1250, test_f1: 0.3943
 epoch: 16, train_loss: 1.1591, test_loss: 1.1135, test_f1: 0.3889
 epoch: 17, train_loss: 1.1567, test_loss: 1.0983, test_f1: 0.4283
 epoch: 18, train_loss: 1.1392, test_loss: 1.0949, test_f1: 0.4195
 epoch: 19, train_loss: 1.1268, test_loss: 1.0883, test_f1: 0.4421
 epoch: 20, train_loss: 1.1279, test_loss: 1.0748, test_f1: 0.4469
 epoch: 21, train_loss: 1.1201, test_loss: 1.0659, test_f1: 0.4614
 epoch: 22, train_loss: 1.1079, test_loss: 1.0558, test_f1: 0.4659
 epoch: 23, train_loss: 1.1151, test_loss: 1.0496, test_f1: 0.4574
 epoch: 24, train_loss: 1.0993, test_loss: 1.0451, test_f1: 0.4637
 epoch: 25, train_loss: 1.0863, test_loss: 1.0352, test_f1: 0.4654
 epoch: 26, train_loss: 1.0769, test_loss: 1.0242, test_f1: 0.4603
 epoch: 27, train_loss: 1.0815, test_loss: 1.0294, test_f1: 0.4725
 epoch: 28, train_loss: 1.0679, test_loss: 1.0130, test_f1: 0.4676
 epoch: 29, train_loss: 1.0782, test_loss: 1.0136, test_f1: 0.4684
 epoch: 30, train_loss: 1.0749, test_loss: 1.0145, test_f1: 0.4636
 epoch: 31, train_loss: 1.0604, test_loss: 1.0079, test_f1: 0.4599
 epoch: 32, train_loss: 1.0521, test_loss: 0.9977, test_f1: 0.4705
 epoch: 33, train_loss: 1.0456, test_loss: 0.9973, test_f1: 0.4717
 epoch: 34, train_loss: 1.0570, test_loss: 1.0028, test_f1: 0.4644
 epoch: 35, train_loss: 1.0361, test_loss: 0.9927, test_f1: 0.4865
 epoch: 36, train_loss: 1.0302, test_loss: 0.9900, test_f1: 0.4509
 epoch: 37, train_loss: 1.0361, test_loss: 1.0029, test_f1: 0.4526
 epoch: 38, train_loss: 1.0249, test_loss: 0.9716, test_f1: 0.4795
 epoch: 39, train_loss: 1.0150, test_loss: 0.9715, test_f1: 0.4705
 epoch: 40, train_loss: 1.0136, test_loss: 0.9923, test_f1: 0.4711
 epoch: 41, train_loss: 1.0169, test_loss: 0.9694, test_f1: 0.4758
 epoch: 42, train_loss: 1.0173, test_loss: 0.9910, test_f1: 0.4578
 epoch: 43, train_loss: 1.0083, test_loss: 0.9720, test_f1: 0.4658
 epoch: 44, train_loss: 1.0088, test_loss: 0.9664, test_f1: 0.4605
 epoch: 45, train_loss: 1.0014, test_loss: 0.9662, test_f1: 0.4736
 epoch: 46, train_loss: 0.9975, test_loss: 0.9751, test_f1: 0.4528
 epoch: 47, train_loss: 0.9934, test_loss: 0.9720, test_f1: 0.4785
 epoch: 48, train_loss: 0.9929, test_loss: 0.9665, test_f1: 0.4718
 epoch: 49, train_loss: 0.9939, test_loss: 0.9612, test_f1: 0.4650
 epoch: 50, train_loss: 0.9892, test_loss: 0.9438, test_f1: 0.4829
 epoch: 51, train_loss: 0.9917, test_loss: 0.9572, test_f1: 0.4665
 epoch: 52, train_loss: 0.9820, test_loss: 0.9615, test_f1: 0.4589
 epoch: 53, train_loss: 0.9776, test_loss: 0.9522, test_f1: 0.4843
 epoch: 54, train_loss: 0.9761, test_loss: 0.9459, test_f1: 0.4785
 epoch: 55, train_loss: 0.9726, test_loss: 0.9467, test_f1: 0.4743
 epoch: 56, train_loss: 0.9717, test_loss: 0.9448, test_f1: 0.4908
 epoch: 57, train_loss: 0.9666, test_loss: 0.9431, test_f1: 0.4830
 epoch: 58, train_loss: 0.9765, test_loss: 0.9460, test_f1: 0.4804
 epoch: 59, train_loss: 0.9653, test_loss: 0.9449, test_f1: 0.4832
 epoch: 60, train_loss: 0.9683, test_loss: 0.9450, test_f1: 0.4705
 epoch: 61, train_loss: 0.9618, test_loss: 0.9439, test_f1: 0.4737
 epoch: 62, train_loss: 0.9608, test_loss: 0.9353, test_f1: 0.4813
 epoch: 63, train_loss: 0.9543, test_loss: 0.9497, test_f1: 0.4649
 epoch: 64, train_loss: 0.9568, test_loss: 0.9528, test_f1: 0.4676
 epoch: 65, train_loss: 0.9617, test_loss: 0.9544, test_f1: 0.4661
 epoch: 66, train_loss: 0.9565, test_loss: 0.9491, test_f1: 0.4677
 epoch: 67, train_loss: 0.9444, test_loss: 0.9478, test_f1: 0.4690
 epoch: 68, train_loss: 0.9534, test_loss: 0.9388, test_f1: 0.4724
 epoch: 69, train_loss: 0.9613, test_loss: 0.9430, test_f1: 0.4680
 epoch: 70, train_loss: 0.9482, test_loss: 0.9407, test_f1: 0.4732
 epoch: 71, train_loss: 0.9520, test_loss: 0.9455, test_f1: 0.4743
 epoch: 72, train_loss: 0.9509, test_loss: 0.9400, test_f1: 0.4650
 epoch: 73, train_loss: 0.9447, test_loss: 0.9445, test_f1: 0.4703
 epoch: 74, train_loss: 0.9506, test_loss: 0.9357, test_f1: 0.4722
 epoch: 75, train_loss: 0.9520, test_loss: 0.9371, test_f1: 0.4802
 epoch: 76, train_loss: 0.9547, test_loss: 0.9379, test_f1: 0.4744
 epoch: 77, train_loss: 0.9499, test_loss: 0.9446, test_f1: 0.4772
 epoch: 78, train_loss: 0.9377, test_loss: 0.9394, test_f1: 0.4752
 epoch: 79, train_loss: 0.9500, test_loss: 0.9511, test_f1: 0.4659
 epoch: 80, train_loss: 0.9458, test_loss: 0.9402, test_f1: 0.4671
 epoch: 81, train_loss: 0.9344, test_loss: 0.9396, test_f1: 0.4676
 epoch: 82, train_loss: 0.9431, test_loss: 0.9554, test_f1: 0.4620
 epoch: 83, train_loss: 0.9424, test_loss: 0.9437, test_f1: 0.4623
 epoch: 84, train_loss: 0.9423, test_loss: 0.9406, test_f1: 0.4682
 epoch: 85, train_loss: 0.9406, test_loss: 0.9418, test_f1: 0.4754
 epoch: 86, train_loss: 0.9336, test_loss: 0.9313, test_f1: 0.4847
 epoch: 87, train_loss: 0.9372, test_loss: 0.9436, test_f1: 0.4774
 epoch: 88, train_loss: 0.9368, test_loss: 0.9388, test_f1: 0.4844
 epoch: 89, train_loss: 0.9443, test_loss: 0.9467, test_f1: 0.4743
 epoch: 90, train_loss: 0.9432, test_loss: 0.9384, test_f1: 0.4856
 epoch: 91, train_loss: 0.9209, test_loss: 0.9527, test_f1: 0.4757
 epoch: 92, train_loss: 0.9383, test_loss: 0.9473, test_f1: 0.4715
 epoch: 93, train_loss: 0.9302, test_loss: 0.9421, test_f1: 0.4837
 epoch: 94, train_loss: 0.9249, test_loss: 0.9513, test_f1: 0.4785
 epoch: 95, train_loss: 0.9336, test_loss: 0.9368, test_f1: 0.4710
 epoch: 96, train_loss: 0.9240, test_loss: 0.9306, test_f1: 0.4962
 epoch: 97, train_loss: 0.9216, test_loss: 0.9436, test_f1: 0.4767
 epoch: 98, train_loss: 0.9089, test_loss: 0.9398, test_f1: 0.4958
 epoch: 99, train_loss: 0.9170, test_loss: 0.9388, test_f1: 0.4842
##################ITERATION #4 ****************************************
 epoch: 0, train_loss: 1.3604, test_loss: 1.2969, test_f1: 0.2589
 epoch: 1, train_loss: 1.2867, test_loss: 1.2755, test_f1: 0.2589
 epoch: 2, train_loss: 1.2653, test_loss: 1.2528, test_f1: 0.2585
 epoch: 3, train_loss: 1.2566, test_loss: 1.2322, test_f1: 0.3127
 epoch: 4, train_loss: 1.2470, test_loss: 1.2173, test_f1: 0.3057
 epoch: 5, train_loss: 1.2377, test_loss: 1.2064, test_f1: 0.3274
 epoch: 6, train_loss: 1.2329, test_loss: 1.1982, test_f1: 0.3424
 epoch: 7, train_loss: 1.2254, test_loss: 1.1870, test_f1: 0.3685
 epoch: 8, train_loss: 1.2152, test_loss: 1.1757, test_f1: 0.3598
 epoch: 9, train_loss: 1.2100, test_loss: 1.1673, test_f1: 0.3854
 epoch: 10, train_loss: 1.2004, test_loss: 1.1579, test_f1: 0.3732
 epoch: 11, train_loss: 1.1948, test_loss: 1.1525, test_f1: 0.4003
 epoch: 12, train_loss: 1.1857, test_loss: 1.1765, test_f1: 0.3838
 epoch: 13, train_loss: 1.1770, test_loss: 1.1385, test_f1: 0.4058
 epoch: 14, train_loss: 1.1765, test_loss: 1.1265, test_f1: 0.4083
 epoch: 15, train_loss: 1.1629, test_loss: 1.1232, test_f1: 0.4005
 epoch: 16, train_loss: 1.1621, test_loss: 1.1056, test_f1: 0.4264
 epoch: 17, train_loss: 1.1523, test_loss: 1.0989, test_f1: 0.4325
 epoch: 18, train_loss: 1.1419, test_loss: 1.0896, test_f1: 0.4399
 epoch: 19, train_loss: 1.1415, test_loss: 1.0821, test_f1: 0.4387
 epoch: 20, train_loss: 1.1424, test_loss: 1.0824, test_f1: 0.4399
 epoch: 21, train_loss: 1.1275, test_loss: 1.0679, test_f1: 0.4444
 epoch: 22, train_loss: 1.1175, test_loss: 1.0598, test_f1: 0.4486
 epoch: 23, train_loss: 1.1203, test_loss: 1.0530, test_f1: 0.4738
 epoch: 24, train_loss: 1.1002, test_loss: 1.0467, test_f1: 0.4483
 epoch: 25, train_loss: 1.0927, test_loss: 1.0430, test_f1: 0.4474
 epoch: 26, train_loss: 1.0907, test_loss: 1.0296, test_f1: 0.4723
 epoch: 27, train_loss: 1.0743, test_loss: 1.0239, test_f1: 0.4476
 epoch: 28, train_loss: 1.0744, test_loss: 1.0081, test_f1: 0.4840
 epoch: 29, train_loss: 1.0691, test_loss: 1.0050, test_f1: 0.4839
 epoch: 30, train_loss: 1.0590, test_loss: 1.0097, test_f1: 0.4561
 epoch: 31, train_loss: 1.0551, test_loss: 0.9969, test_f1: 0.4648
 epoch: 32, train_loss: 1.0557, test_loss: 0.9929, test_f1: 0.4984
 epoch: 33, train_loss: 1.0453, test_loss: 0.9902, test_f1: 0.4809
 epoch: 34, train_loss: 1.0344, test_loss: 0.9738, test_f1: 0.5041
 epoch: 35, train_loss: 1.0314, test_loss: 0.9836, test_f1: 0.4916
 epoch: 36, train_loss: 1.0196, test_loss: 0.9695, test_f1: 0.4951
 epoch: 37, train_loss: 1.0298, test_loss: 0.9652, test_f1: 0.4990
 epoch: 38, train_loss: 1.0103, test_loss: 0.9692, test_f1: 0.4991
 epoch: 39, train_loss: 1.0026, test_loss: 0.9590, test_f1: 0.5140
 epoch: 40, train_loss: 1.0036, test_loss: 0.9675, test_f1: 0.4989
 epoch: 41, train_loss: 1.0083, test_loss: 0.9527, test_f1: 0.4834
 epoch: 42, train_loss: 0.9901, test_loss: 0.9560, test_f1: 0.4584
 epoch: 43, train_loss: 0.9922, test_loss: 0.9468, test_f1: 0.4809
 epoch: 44, train_loss: 0.9904, test_loss: 0.9596, test_f1: 0.4775
 epoch: 45, train_loss: 0.9922, test_loss: 0.9698, test_f1: 0.4516
 epoch: 46, train_loss: 0.9760, test_loss: 0.9613, test_f1: 0.4983
 epoch: 47, train_loss: 0.9781, test_loss: 0.9528, test_f1: 0.4874
 epoch: 48, train_loss: 0.9784, test_loss: 0.9635, test_f1: 0.4599
 epoch: 49, train_loss: 0.9727, test_loss: 0.9381, test_f1: 0.4801
 epoch: 50, train_loss: 0.9737, test_loss: 0.9513, test_f1: 0.4599
 epoch: 51, train_loss: 0.9714, test_loss: 0.9594, test_f1: 0.4881
 epoch: 52, train_loss: 0.9646, test_loss: 0.9564, test_f1: 0.4743
 epoch: 53, train_loss: 0.9585, test_loss: 0.9392, test_f1: 0.4735
 epoch: 54, train_loss: 0.9532, test_loss: 0.9444, test_f1: 0.4707
 epoch: 55, train_loss: 0.9590, test_loss: 0.9526, test_f1: 0.4540
 epoch: 56, train_loss: 0.9524, test_loss: 0.9626, test_f1: 0.4447
 epoch: 57, train_loss: 0.9591, test_loss: 0.9451, test_f1: 0.4674
 epoch: 58, train_loss: 0.9506, test_loss: 0.9547, test_f1: 0.4528
 epoch: 59, train_loss: 0.9520, test_loss: 0.9489, test_f1: 0.4668
 epoch: 60, train_loss: 0.9518, test_loss: 0.9462, test_f1: 0.4596
 epoch: 61, train_loss: 0.9568, test_loss: 0.9511, test_f1: 0.4528
 epoch: 62, train_loss: 0.9481, test_loss: 0.9542, test_f1: 0.4537
 epoch: 63, train_loss: 0.9639, test_loss: 0.9461, test_f1: 0.4536
 epoch: 64, train_loss: 0.9485, test_loss: 0.9503, test_f1: 0.4582
 epoch: 65, train_loss: 0.9431, test_loss: 0.9444, test_f1: 0.4634
 epoch: 66, train_loss: 0.9403, test_loss: 0.9616, test_f1: 0.4580
 epoch: 67, train_loss: 0.9377, test_loss: 0.9541, test_f1: 0.4544
 epoch: 68, train_loss: 0.9411, test_loss: 0.9645, test_f1: 0.4460
 epoch: 69, train_loss: 0.9456, test_loss: 0.9602, test_f1: 0.4644
 epoch: 70, train_loss: 0.9452, test_loss: 0.9854, test_f1: 0.4506
 epoch: 71, train_loss: 0.9368, test_loss: 0.9573, test_f1: 0.4540
 epoch: 72, train_loss: 0.9344, test_loss: 0.9457, test_f1: 0.4785
 epoch: 73, train_loss: 0.9388, test_loss: 0.9489, test_f1: 0.4808
 epoch: 74, train_loss: 0.9293, test_loss: 0.9437, test_f1: 0.4711
 epoch: 75, train_loss: 0.9260, test_loss: 0.9349, test_f1: 0.4663
 epoch: 76, train_loss: 0.9302, test_loss: 0.9568, test_f1: 0.4615
 epoch: 77, train_loss: 0.9275, test_loss: 0.9585, test_f1: 0.4521
 epoch: 78, train_loss: 0.9261, test_loss: 0.9567, test_f1: 0.4488
 epoch: 79, train_loss: 0.9194, test_loss: 0.9643, test_f1: 0.4542
 epoch: 80, train_loss: 0.9350, test_loss: 0.9622, test_f1: 0.4518
 epoch: 81, train_loss: 0.9272, test_loss: 0.9529, test_f1: 0.4651
 epoch: 82, train_loss: 0.9286, test_loss: 0.9599, test_f1: 0.4653
 epoch: 83, train_loss: 0.9325, test_loss: 0.9575, test_f1: 0.4783
 epoch: 84, train_loss: 0.9229, test_loss: 0.9551, test_f1: 0.4866
 epoch: 85, train_loss: 0.9222, test_loss: 0.9648, test_f1: 0.4572
 epoch: 86, train_loss: 0.9241, test_loss: 0.9500, test_f1: 0.4735
 epoch: 87, train_loss: 0.9152, test_loss: 0.9684, test_f1: 0.4581
 epoch: 88, train_loss: 0.9306, test_loss: 0.9714, test_f1: 0.4858
 epoch: 89, train_loss: 0.9384, test_loss: 0.9455, test_f1: 0.4502
 epoch: 90, train_loss: 0.9244, test_loss: 0.9653, test_f1: 0.4866
 epoch: 91, train_loss: 0.9226, test_loss: 0.9646, test_f1: 0.4433
 epoch: 92, train_loss: 0.9215, test_loss: 0.9528, test_f1: 0.4558
 epoch: 93, train_loss: 0.9296, test_loss: 0.9557, test_f1: 0.4725
 epoch: 94, train_loss: 0.9210, test_loss: 0.9640, test_f1: 0.4576
 epoch: 95, train_loss: 0.9023, test_loss: 0.9677, test_f1: 0.4710
 epoch: 96, train_loss: 0.9254, test_loss: 0.9528, test_f1: 0.4575
 epoch: 97, train_loss: 0.9097, test_loss: 0.9674, test_f1: 0.4901
 epoch: 98, train_loss: 0.9118, test_loss: 0.9685, test_f1: 0.4621
 epoch: 99, train_loss: 0.9082, test_loss: 0.9750, test_f1: 0.4490
##################ITERATION #5 ****************************************
 epoch: 0, train_loss: 1.3273, test_loss: 1.3072, test_f1: 0.2274
 epoch: 1, train_loss: 1.2771, test_loss: 1.2826, test_f1: 0.2274
 epoch: 2, train_loss: 1.2586, test_loss: 1.2520, test_f1: 0.2578
 epoch: 3, train_loss: 1.2444, test_loss: 1.2223, test_f1: 0.2812
 epoch: 4, train_loss: 1.2363, test_loss: 1.2020, test_f1: 0.3621
 epoch: 5, train_loss: 1.2235, test_loss: 1.1817, test_f1: 0.3717
 epoch: 6, train_loss: 1.2173, test_loss: 1.1704, test_f1: 0.4093
 epoch: 7, train_loss: 1.2065, test_loss: 1.1603, test_f1: 0.4089
 epoch: 8, train_loss: 1.1998, test_loss: 1.1512, test_f1: 0.4142
 epoch: 9, train_loss: 1.1895, test_loss: 1.1504, test_f1: 0.4211
 epoch: 10, train_loss: 1.1771, test_loss: 1.1346, test_f1: 0.4183
 epoch: 11, train_loss: 1.1768, test_loss: 1.1266, test_f1: 0.4351
 epoch: 12, train_loss: 1.1770, test_loss: 1.1354, test_f1: 0.4172
 epoch: 13, train_loss: 1.1666, test_loss: 1.1165, test_f1: 0.4263
 epoch: 14, train_loss: 1.1489, test_loss: 1.0900, test_f1: 0.4405
 epoch: 15, train_loss: 1.1535, test_loss: 1.0962, test_f1: 0.4387
 epoch: 16, train_loss: 1.1383, test_loss: 1.0816, test_f1: 0.4564
 epoch: 17, train_loss: 1.1397, test_loss: 1.0699, test_f1: 0.4587
 epoch: 18, train_loss: 1.1322, test_loss: 1.0579, test_f1: 0.4740
 epoch: 19, train_loss: 1.1188, test_loss: 1.0512, test_f1: 0.4565
 epoch: 20, train_loss: 1.1169, test_loss: 1.0561, test_f1: 0.4497
 epoch: 21, train_loss: 1.1152, test_loss: 1.0458, test_f1: 0.4743
 epoch: 22, train_loss: 1.1031, test_loss: 1.0475, test_f1: 0.4768
 epoch: 23, train_loss: 1.1075, test_loss: 1.0385, test_f1: 0.4748
 epoch: 24, train_loss: 1.1098, test_loss: 1.0477, test_f1: 0.4685
 epoch: 25, train_loss: 1.0962, test_loss: 1.0232, test_f1: 0.4754
 epoch: 26, train_loss: 1.0921, test_loss: 1.0260, test_f1: 0.4643
 epoch: 27, train_loss: 1.0835, test_loss: 1.0288, test_f1: 0.4700
 epoch: 28, train_loss: 1.0827, test_loss: 1.0124, test_f1: 0.4782
 epoch: 29, train_loss: 1.0817, test_loss: 1.0177, test_f1: 0.4889
 epoch: 30, train_loss: 1.0744, test_loss: 1.0079, test_f1: 0.4954
 epoch: 31, train_loss: 1.0771, test_loss: 1.0104, test_f1: 0.4733
 epoch: 32, train_loss: 1.0728, test_loss: 1.0116, test_f1: 0.4811
 epoch: 33, train_loss: 1.0610, test_loss: 1.0017, test_f1: 0.4789
 epoch: 34, train_loss: 1.0712, test_loss: 1.0051, test_f1: 0.4722
 epoch: 35, train_loss: 1.0651, test_loss: 1.0078, test_f1: 0.4732
 epoch: 36, train_loss: 1.0750, test_loss: 0.9936, test_f1: 0.4790
 epoch: 37, train_loss: 1.0529, test_loss: 1.0107, test_f1: 0.4667
 epoch: 38, train_loss: 1.0597, test_loss: 0.9893, test_f1: 0.4721
 epoch: 39, train_loss: 1.0522, test_loss: 0.9889, test_f1: 0.4745
 epoch: 40, train_loss: 1.0516, test_loss: 1.0230, test_f1: 0.4422
 epoch: 41, train_loss: 1.0457, test_loss: 0.9929, test_f1: 0.4828
 epoch: 42, train_loss: 1.0395, test_loss: 1.0073, test_f1: 0.4522
 epoch: 43, train_loss: 1.0396, test_loss: 0.9951, test_f1: 0.4872
 epoch: 44, train_loss: 1.0399, test_loss: 0.9857, test_f1: 0.4858
 epoch: 45, train_loss: 1.0347, test_loss: 1.0010, test_f1: 0.4749
 epoch: 46, train_loss: 1.0410, test_loss: 0.9974, test_f1: 0.4699
 epoch: 47, train_loss: 1.0239, test_loss: 1.0069, test_f1: 0.4632
 epoch: 48, train_loss: 1.0315, test_loss: 0.9936, test_f1: 0.4802
 epoch: 49, train_loss: 1.0245, test_loss: 1.0002, test_f1: 0.4777
 epoch: 50, train_loss: 1.0286, test_loss: 1.0048, test_f1: 0.4511
 epoch: 51, train_loss: 1.0160, test_loss: 0.9770, test_f1: 0.4800
 epoch: 52, train_loss: 1.0152, test_loss: 0.9952, test_f1: 0.4733
 epoch: 53, train_loss: 1.0162, test_loss: 0.9744, test_f1: 0.4864
 epoch: 54, train_loss: 1.0010, test_loss: 0.9790, test_f1: 0.4846
 epoch: 55, train_loss: 1.0094, test_loss: 0.9905, test_f1: 0.4778
 epoch: 56, train_loss: 0.9984, test_loss: 1.0037, test_f1: 0.4705
 epoch: 57, train_loss: 1.0070, test_loss: 1.0046, test_f1: 0.4717
 epoch: 58, train_loss: 1.0042, test_loss: 1.0172, test_f1: 0.4605
 epoch: 59, train_loss: 0.9993, test_loss: 0.9880, test_f1: 0.4878
 epoch: 60, train_loss: 0.9975, test_loss: 0.9814, test_f1: 0.4900
 epoch: 61, train_loss: 1.0076, test_loss: 1.0030, test_f1: 0.4624
 epoch: 62, train_loss: 0.9921, test_loss: 1.0111, test_f1: 0.4562
 epoch: 63, train_loss: 1.0003, test_loss: 0.9723, test_f1: 0.5085
 epoch: 64, train_loss: 0.9924, test_loss: 0.9872, test_f1: 0.4890
 epoch: 65, train_loss: 0.9919, test_loss: 1.0362, test_f1: 0.4691
 epoch: 66, train_loss: 0.9923, test_loss: 0.9993, test_f1: 0.4670
 epoch: 67, train_loss: 0.9916, test_loss: 0.9778, test_f1: 0.4945
 epoch: 68, train_loss: 0.9773, test_loss: 1.0302, test_f1: 0.4712
 epoch: 69, train_loss: 0.9908, test_loss: 0.9739, test_f1: 0.4841
 epoch: 70, train_loss: 0.9897, test_loss: 1.0337, test_f1: 0.4769
 epoch: 71, train_loss: 0.9812, test_loss: 0.9793, test_f1: 0.4851
 epoch: 72, train_loss: 0.9777, test_loss: 0.9825, test_f1: 0.5065
 epoch: 73, train_loss: 0.9821, test_loss: 0.9785, test_f1: 0.4831
 epoch: 74, train_loss: 0.9820, test_loss: 0.9875, test_f1: 0.4778
 epoch: 75, train_loss: 0.9814, test_loss: 1.0020, test_f1: 0.4673
 epoch: 76, train_loss: 0.9722, test_loss: 0.9785, test_f1: 0.4910
 epoch: 77, train_loss: 0.9714, test_loss: 0.9837, test_f1: 0.4878
 epoch: 78, train_loss: 0.9752, test_loss: 0.9809, test_f1: 0.4880
 epoch: 79, train_loss: 0.9698, test_loss: 0.9730, test_f1: 0.5063
 epoch: 80, train_loss: 0.9698, test_loss: 0.9743, test_f1: 0.5055
 epoch: 81, train_loss: 0.9734, test_loss: 1.0112, test_f1: 0.4632
 epoch: 82, train_loss: 0.9665, test_loss: 0.9803, test_f1: 0.5018
 epoch: 83, train_loss: 0.9793, test_loss: 0.9873, test_f1: 0.4965
 epoch: 84, train_loss: 0.9666, test_loss: 0.9801, test_f1: 0.5031
 epoch: 85, train_loss: 0.9634, test_loss: 0.9766, test_f1: 0.5033
 epoch: 86, train_loss: 0.9650, test_loss: 0.9818, test_f1: 0.4901
 epoch: 87, train_loss: 0.9602, test_loss: 1.0188, test_f1: 0.4727
 epoch: 88, train_loss: 0.9665, test_loss: 0.9820, test_f1: 0.5005
 epoch: 89, train_loss: 0.9555, test_loss: 0.9814, test_f1: 0.4819
 epoch: 90, train_loss: 0.9564, test_loss: 0.9704, test_f1: 0.5118
 epoch: 91, train_loss: 0.9448, test_loss: 0.9676, test_f1: 0.5049
 epoch: 92, train_loss: 0.9545, test_loss: 1.0044, test_f1: 0.4626
 epoch: 93, train_loss: 0.9480, test_loss: 0.9711, test_f1: 0.5020
 epoch: 94, train_loss: 0.9521, test_loss: 0.9786, test_f1: 0.5022
 epoch: 95, train_loss: 0.9452, test_loss: 0.9846, test_f1: 0.4841
 epoch: 96, train_loss: 0.9497, test_loss: 0.9701, test_f1: 0.5152
 epoch: 97, train_loss: 0.9530, test_loss: 0.9733, test_f1: 0.5025
 epoch: 98, train_loss: 0.9519, test_loss: 0.9617, test_f1: 0.5097
 epoch: 99, train_loss: 0.9509, test_loss: 0.9681, test_f1: 0.5074
##################ITERATION #6 ****************************************
 epoch: 0, train_loss: 1.3967, test_loss: 1.2964, test_f1: 0.2274
 epoch: 1, train_loss: 1.2922, test_loss: 1.2737, test_f1: 0.2555
 epoch: 2, train_loss: 1.2680, test_loss: 1.2432, test_f1: 0.2579
 epoch: 3, train_loss: 1.2550, test_loss: 1.2229, test_f1: 0.2646
 epoch: 4, train_loss: 1.2431, test_loss: 1.2115, test_f1: 0.2836
 epoch: 5, train_loss: 1.2297, test_loss: 1.2013, test_f1: 0.3091
 epoch: 6, train_loss: 1.2215, test_loss: 1.1947, test_f1: 0.3472
 epoch: 7, train_loss: 1.2093, test_loss: 1.1865, test_f1: 0.3640
 epoch: 8, train_loss: 1.2039, test_loss: 1.1748, test_f1: 0.3715
 epoch: 9, train_loss: 1.2084, test_loss: 1.1691, test_f1: 0.3742
 epoch: 10, train_loss: 1.1919, test_loss: 1.1615, test_f1: 0.3796
 epoch: 11, train_loss: 1.1841, test_loss: 1.1522, test_f1: 0.3758
 epoch: 12, train_loss: 1.1860, test_loss: 1.1446, test_f1: 0.4024
 epoch: 13, train_loss: 1.1703, test_loss: 1.1358, test_f1: 0.4221
 epoch: 14, train_loss: 1.1686, test_loss: 1.1313, test_f1: 0.4190
 epoch: 15, train_loss: 1.1661, test_loss: 1.1215, test_f1: 0.4146
 epoch: 16, train_loss: 1.1535, test_loss: 1.1108, test_f1: 0.4306
 epoch: 17, train_loss: 1.1437, test_loss: 1.1022, test_f1: 0.4326
 epoch: 18, train_loss: 1.1458, test_loss: 1.0964, test_f1: 0.4548
 epoch: 19, train_loss: 1.1352, test_loss: 1.0884, test_f1: 0.4394
 epoch: 20, train_loss: 1.1244, test_loss: 1.0798, test_f1: 0.4546
 epoch: 21, train_loss: 1.1161, test_loss: 1.0721, test_f1: 0.4459
 epoch: 22, train_loss: 1.1216, test_loss: 1.0754, test_f1: 0.4396
 epoch: 23, train_loss: 1.1105, test_loss: 1.0629, test_f1: 0.4389
 epoch: 24, train_loss: 1.0995, test_loss: 1.0578, test_f1: 0.4439
 epoch: 25, train_loss: 1.0962, test_loss: 1.0429, test_f1: 0.4515
 epoch: 26, train_loss: 1.0928, test_loss: 1.0433, test_f1: 0.4568
 epoch: 27, train_loss: 1.0769, test_loss: 1.0475, test_f1: 0.4483
 epoch: 28, train_loss: 1.0792, test_loss: 1.0561, test_f1: 0.4491
 epoch: 29, train_loss: 1.0725, test_loss: 1.0527, test_f1: 0.4588
 epoch: 30, train_loss: 1.0612, test_loss: 1.0375, test_f1: 0.4625
 epoch: 31, train_loss: 1.0655, test_loss: 1.0403, test_f1: 0.4672
 epoch: 32, train_loss: 1.0532, test_loss: 1.0483, test_f1: 0.4675
 epoch: 33, train_loss: 1.0508, test_loss: 1.0505, test_f1: 0.4623
 epoch: 34, train_loss: 1.0441, test_loss: 1.0332, test_f1: 0.4763
 epoch: 35, train_loss: 1.0418, test_loss: 1.0341, test_f1: 0.4728
 epoch: 36, train_loss: 1.0443, test_loss: 1.0342, test_f1: 0.4772
 epoch: 37, train_loss: 1.0336, test_loss: 1.0505, test_f1: 0.4753
 epoch: 38, train_loss: 1.0316, test_loss: 1.0315, test_f1: 0.4767
 epoch: 39, train_loss: 1.0197, test_loss: 1.0490, test_f1: 0.4723
 epoch: 40, train_loss: 1.0273, test_loss: 1.0426, test_f1: 0.4750
 epoch: 41, train_loss: 1.0174, test_loss: 1.0368, test_f1: 0.4845
 epoch: 42, train_loss: 1.0129, test_loss: 1.0391, test_f1: 0.4811
 epoch: 43, train_loss: 1.0128, test_loss: 1.0358, test_f1: 0.4813
 epoch: 44, train_loss: 1.0078, test_loss: 1.0318, test_f1: 0.4809
 epoch: 45, train_loss: 1.0062, test_loss: 1.0509, test_f1: 0.4783
 epoch: 46, train_loss: 1.0044, test_loss: 1.0219, test_f1: 0.4883
 epoch: 47, train_loss: 1.0077, test_loss: 1.0312, test_f1: 0.4727
 epoch: 48, train_loss: 0.9913, test_loss: 1.0331, test_f1: 0.4785
 epoch: 49, train_loss: 0.9836, test_loss: 1.0397, test_f1: 0.4870
 epoch: 50, train_loss: 0.9869, test_loss: 1.0394, test_f1: 0.4804
 epoch: 51, train_loss: 0.9789, test_loss: 1.0384, test_f1: 0.4862
 epoch: 52, train_loss: 0.9874, test_loss: 1.0392, test_f1: 0.4821
 epoch: 53, train_loss: 0.9731, test_loss: 1.0406, test_f1: 0.4777
 epoch: 54, train_loss: 0.9706, test_loss: 1.0442, test_f1: 0.4771
 epoch: 55, train_loss: 0.9779, test_loss: 1.0361, test_f1: 0.4846
 epoch: 56, train_loss: 0.9754, test_loss: 1.0338, test_f1: 0.4866
 epoch: 57, train_loss: 0.9731, test_loss: 1.0344, test_f1: 0.4868
 epoch: 58, train_loss: 0.9658, test_loss: 1.0322, test_f1: 0.4859
 epoch: 59, train_loss: 0.9685, test_loss: 1.0430, test_f1: 0.4840
 epoch: 60, train_loss: 0.9624, test_loss: 1.0364, test_f1: 0.4843
 epoch: 61, train_loss: 0.9602, test_loss: 1.0460, test_f1: 0.4808
 epoch: 62, train_loss: 0.9541, test_loss: 1.0476, test_f1: 0.4833
 epoch: 63, train_loss: 0.9626, test_loss: 1.0336, test_f1: 0.4754
 epoch: 64, train_loss: 0.9623, test_loss: 1.0359, test_f1: 0.4844
 epoch: 65, train_loss: 0.9527, test_loss: 1.0372, test_f1: 0.4826
 epoch: 66, train_loss: 0.9637, test_loss: 1.0352, test_f1: 0.4828
 epoch: 67, train_loss: 0.9619, test_loss: 1.0373, test_f1: 0.4860
 epoch: 68, train_loss: 0.9611, test_loss: 1.0388, test_f1: 0.4856
 epoch: 69, train_loss: 0.9633, test_loss: 1.0377, test_f1: 0.4850
 epoch: 70, train_loss: 0.9587, test_loss: 1.0397, test_f1: 0.4851
 epoch: 71, train_loss: 0.9555, test_loss: 1.0488, test_f1: 0.4867
 epoch: 72, train_loss: 0.9544, test_loss: 1.0425, test_f1: 0.4883
 epoch: 73, train_loss: 0.9506, test_loss: 1.0333, test_f1: 0.4829
 epoch: 74, train_loss: 0.9465, test_loss: 1.0343, test_f1: 0.4815
 epoch: 75, train_loss: 0.9496, test_loss: 1.0333, test_f1: 0.4913
 epoch: 76, train_loss: 0.9452, test_loss: 1.0335, test_f1: 0.4936
 epoch: 77, train_loss: 0.9405, test_loss: 1.0327, test_f1: 0.4934
 epoch: 78, train_loss: 0.9395, test_loss: 1.0445, test_f1: 0.4847
 epoch: 79, train_loss: 0.9434, test_loss: 1.0390, test_f1: 0.4965
 epoch: 80, train_loss: 0.9359, test_loss: 1.0380, test_f1: 0.5008
 epoch: 81, train_loss: 0.9425, test_loss: 1.0496, test_f1: 0.4905
 epoch: 82, train_loss: 0.9279, test_loss: 1.0432, test_f1: 0.4922
 epoch: 83, train_loss: 0.9347, test_loss: 1.0288, test_f1: 0.5042
 epoch: 84, train_loss: 0.9394, test_loss: 1.0336, test_f1: 0.4995
 epoch: 85, train_loss: 0.9411, test_loss: 1.0292, test_f1: 0.4980
 epoch: 86, train_loss: 0.9325, test_loss: 1.0327, test_f1: 0.4958
 epoch: 87, train_loss: 0.9257, test_loss: 1.0379, test_f1: 0.5001
 epoch: 88, train_loss: 0.9299, test_loss: 1.0409, test_f1: 0.4838
 epoch: 89, train_loss: 0.9289, test_loss: 1.0406, test_f1: 0.4860
 epoch: 90, train_loss: 0.9249, test_loss: 1.0374, test_f1: 0.4945
 epoch: 91, train_loss: 0.9203, test_loss: 1.0444, test_f1: 0.4920
 epoch: 92, train_loss: 0.9312, test_loss: 1.0471, test_f1: 0.4947
 epoch: 93, train_loss: 0.9235, test_loss: 1.0531, test_f1: 0.4880
 epoch: 94, train_loss: 0.9225, test_loss: 1.0393, test_f1: 0.4985
 epoch: 95, train_loss: 0.9260, test_loss: 1.0461, test_f1: 0.4957
 epoch: 96, train_loss: 0.9262, test_loss: 1.0442, test_f1: 0.4966
 epoch: 97, train_loss: 0.9106, test_loss: 1.0413, test_f1: 0.4906
 epoch: 98, train_loss: 0.9112, test_loss: 1.0530, test_f1: 0.4897
 epoch: 99, train_loss: 0.9238, test_loss: 1.0323, test_f1: 0.4984
##################ITERATION #7 ****************************************
 epoch: 0, train_loss: 1.5051, test_loss: 1.3616, test_f1: 0.2274
 epoch: 1, train_loss: 1.3416, test_loss: 1.3070, test_f1: 0.2274
 epoch: 2, train_loss: 1.3204, test_loss: 1.2788, test_f1: 0.2274
 epoch: 3, train_loss: 1.2967, test_loss: 1.2615, test_f1: 0.2543
 epoch: 4, train_loss: 1.2827, test_loss: 1.2437, test_f1: 0.2701
 epoch: 5, train_loss: 1.2663, test_loss: 1.2300, test_f1: 0.2742
 epoch: 6, train_loss: 1.2526, test_loss: 1.2174, test_f1: 0.2960
 epoch: 7, train_loss: 1.2426, test_loss: 1.2032, test_f1: 0.3105
 epoch: 8, train_loss: 1.2334, test_loss: 1.1942, test_f1: 0.3112
 epoch: 9, train_loss: 1.2238, test_loss: 1.2020, test_f1: 0.2974
 epoch: 10, train_loss: 1.2188, test_loss: 1.1792, test_f1: 0.3109
 epoch: 11, train_loss: 1.2071, test_loss: 1.1704, test_f1: 0.3235
 epoch: 12, train_loss: 1.2067, test_loss: 1.1671, test_f1: 0.3350
 epoch: 13, train_loss: 1.1881, test_loss: 1.1620, test_f1: 0.3633
 epoch: 14, train_loss: 1.1829, test_loss: 1.1742, test_f1: 0.3655
 epoch: 15, train_loss: 1.1836, test_loss: 1.1634, test_f1: 0.3629
 epoch: 16, train_loss: 1.1655, test_loss: 1.2094, test_f1: 0.3773
 epoch: 17, train_loss: 1.1718, test_loss: 1.2121, test_f1: 0.3772
 epoch: 18, train_loss: 1.1658, test_loss: 1.2195, test_f1: 0.3771
 epoch: 19, train_loss: 1.1619, test_loss: 1.2356, test_f1: 0.3828
 epoch: 20, train_loss: 1.1544, test_loss: 1.2217, test_f1: 0.3928
 epoch: 21, train_loss: 1.1490, test_loss: 1.2949, test_f1: 0.3869
 epoch: 22, train_loss: 1.1361, test_loss: 1.1423, test_f1: 0.4113
 epoch: 23, train_loss: 1.1232, test_loss: 1.1440, test_f1: 0.4164
 epoch: 24, train_loss: 1.1241, test_loss: 1.1666, test_f1: 0.4295
 epoch: 25, train_loss: 1.1202, test_loss: 1.1483, test_f1: 0.4198
 epoch: 26, train_loss: 1.1229, test_loss: 1.2325, test_f1: 0.4184
 epoch: 27, train_loss: 1.1115, test_loss: 1.1594, test_f1: 0.4356
 epoch: 28, train_loss: 1.1025, test_loss: 1.2996, test_f1: 0.4212
 epoch: 29, train_loss: 1.0995, test_loss: 1.2159, test_f1: 0.4393
 epoch: 30, train_loss: 1.0980, test_loss: 1.1920, test_f1: 0.4428
 epoch: 31, train_loss: 1.0893, test_loss: 1.2111, test_f1: 0.4476
 epoch: 32, train_loss: 1.0983, test_loss: 1.1065, test_f1: 0.4225
 epoch: 33, train_loss: 1.0873, test_loss: 1.1315, test_f1: 0.4453
 epoch: 34, train_loss: 1.0871, test_loss: 1.2010, test_f1: 0.4411
 epoch: 35, train_loss: 1.0729, test_loss: 1.1638, test_f1: 0.4536
 epoch: 36, train_loss: 1.0727, test_loss: 1.1181, test_f1: 0.4433
 epoch: 37, train_loss: 1.0683, test_loss: 1.0093, test_f1: 0.4653
 epoch: 38, train_loss: 1.0647, test_loss: 1.1549, test_f1: 0.4445
 epoch: 39, train_loss: 1.0621, test_loss: 1.0167, test_f1: 0.4669
 epoch: 40, train_loss: 1.0560, test_loss: 1.1239, test_f1: 0.4605
 epoch: 41, train_loss: 1.0533, test_loss: 1.0800, test_f1: 0.4584
 epoch: 42, train_loss: 1.0475, test_loss: 1.1090, test_f1: 0.4522
 epoch: 43, train_loss: 1.0558, test_loss: 1.0025, test_f1: 0.4794
 epoch: 44, train_loss: 1.0265, test_loss: 1.0658, test_f1: 0.4606
 epoch: 45, train_loss: 1.0339, test_loss: 1.2593, test_f1: 0.4486
 epoch: 46, train_loss: 1.0284, test_loss: 1.0762, test_f1: 0.4648
 epoch: 47, train_loss: 1.0239, test_loss: 1.0990, test_f1: 0.4690
 epoch: 48, train_loss: 1.0241, test_loss: 1.3921, test_f1: 0.4578
 epoch: 49, train_loss: 1.0202, test_loss: 1.2840, test_f1: 0.4693
 epoch: 50, train_loss: 1.0004, test_loss: 1.2547, test_f1: 0.4657
 epoch: 51, train_loss: 1.0051, test_loss: 1.1699, test_f1: 0.4516
 epoch: 52, train_loss: 1.0145, test_loss: 1.3740, test_f1: 0.4636
 epoch: 53, train_loss: 1.0086, test_loss: 1.4214, test_f1: 0.4509
 epoch: 54, train_loss: 0.9989, test_loss: 1.1904, test_f1: 0.4710
 epoch: 55, train_loss: 0.9938, test_loss: 1.2684, test_f1: 0.4636
 epoch: 56, train_loss: 0.9943, test_loss: 1.3611, test_f1: 0.4587
 epoch: 57, train_loss: 1.0026, test_loss: 1.2772, test_f1: 0.4650
 epoch: 58, train_loss: 0.9921, test_loss: 1.4060, test_f1: 0.4654
 epoch: 59, train_loss: 0.9977, test_loss: 1.4348, test_f1: 0.4681
 epoch: 60, train_loss: 0.9905, test_loss: 1.5396, test_f1: 0.4692
 epoch: 61, train_loss: 0.9898, test_loss: 1.5374, test_f1: 0.4587
 epoch: 62, train_loss: 0.9877, test_loss: 1.3684, test_f1: 0.4739
 epoch: 63, train_loss: 0.9843, test_loss: 1.5297, test_f1: 0.4463
 epoch: 64, train_loss: 0.9792, test_loss: 1.4660, test_f1: 0.4648
 epoch: 65, train_loss: 0.9792, test_loss: 1.5421, test_f1: 0.4684
 epoch: 66, train_loss: 0.9789, test_loss: 1.4998, test_f1: 0.4808
 epoch: 67, train_loss: 0.9715, test_loss: 1.3750, test_f1: 0.4651
 epoch: 68, train_loss: 0.9903, test_loss: 1.4797, test_f1: 0.4722
 epoch: 69, train_loss: 0.9774, test_loss: 1.4702, test_f1: 0.4755
 epoch: 70, train_loss: 0.9677, test_loss: 1.5600, test_f1: 0.4683
 epoch: 71, train_loss: 0.9754, test_loss: 1.5445, test_f1: 0.4755
 epoch: 72, train_loss: 0.9723, test_loss: 1.2912, test_f1: 0.4684
 epoch: 73, train_loss: 0.9803, test_loss: 1.4603, test_f1: 0.4718
 epoch: 74, train_loss: 0.9677, test_loss: 1.3767, test_f1: 0.4698
 epoch: 75, train_loss: 0.9643, test_loss: 1.5173, test_f1: 0.4716
 epoch: 76, train_loss: 0.9549, test_loss: 1.5013, test_f1: 0.4712
 epoch: 77, train_loss: 0.9696, test_loss: 1.5115, test_f1: 0.4757
 epoch: 78, train_loss: 0.9605, test_loss: 1.5357, test_f1: 0.4714
 epoch: 79, train_loss: 0.9520, test_loss: 1.4800, test_f1: 0.4791
 epoch: 80, train_loss: 0.9628, test_loss: 1.5501, test_f1: 0.4725
 epoch: 81, train_loss: 0.9505, test_loss: 1.6011, test_f1: 0.4663
 epoch: 82, train_loss: 0.9534, test_loss: 1.4688, test_f1: 0.4732
 epoch: 83, train_loss: 0.9605, test_loss: 1.6860, test_f1: 0.4715
 epoch: 84, train_loss: 0.9500, test_loss: 1.5466, test_f1: 0.4799
 epoch: 85, train_loss: 0.9467, test_loss: 1.6366, test_f1: 0.4770
 epoch: 86, train_loss: 0.9448, test_loss: 1.4927, test_f1: 0.4774
 epoch: 87, train_loss: 0.9447, test_loss: 1.4854, test_f1: 0.4734
 epoch: 88, train_loss: 0.9541, test_loss: 1.5387, test_f1: 0.4703
 epoch: 89, train_loss: 0.9383, test_loss: 1.5097, test_f1: 0.4691
 epoch: 90, train_loss: 0.9446, test_loss: 1.5822, test_f1: 0.4666
 epoch: 91, train_loss: 0.9495, test_loss: 1.6256, test_f1: 0.4649
 epoch: 92, train_loss: 0.9346, test_loss: 1.7026, test_f1: 0.4723
 epoch: 93, train_loss: 0.9464, test_loss: 1.7652, test_f1: 0.4559
 epoch: 94, train_loss: 0.9335, test_loss: 1.6672, test_f1: 0.4710
 epoch: 95, train_loss: 0.9428, test_loss: 1.7327, test_f1: 0.4629
 epoch: 96, train_loss: 0.9387, test_loss: 1.6368, test_f1: 0.4720
 epoch: 97, train_loss: 0.9379, test_loss: 1.5613, test_f1: 0.4657
 epoch: 98, train_loss: 0.9390, test_loss: 1.6123, test_f1: 0.4781
 epoch: 99, train_loss: 0.9402, test_loss: 1.6745, test_f1: 0.4713
##################ITERATION #8 ****************************************
 epoch: 0, train_loss: 1.4180, test_loss: 1.2905, test_f1: 0.2274
 epoch: 1, train_loss: 1.2921, test_loss: 1.2731, test_f1: 0.2274
 epoch: 2, train_loss: 1.2761, test_loss: 1.2610, test_f1: 0.2274
 epoch: 3, train_loss: 1.2515, test_loss: 1.2371, test_f1: 0.2512
 epoch: 4, train_loss: 1.2433, test_loss: 1.2193, test_f1: 0.2710
 epoch: 5, train_loss: 1.2496, test_loss: 1.2145, test_f1: 0.2656
 epoch: 6, train_loss: 1.2297, test_loss: 1.2077, test_f1: 0.3195
 epoch: 7, train_loss: 1.2240, test_loss: 1.1899, test_f1: 0.3281
 epoch: 8, train_loss: 1.2179, test_loss: 1.1784, test_f1: 0.3275
 epoch: 9, train_loss: 1.2105, test_loss: 1.1689, test_f1: 0.3316
 epoch: 10, train_loss: 1.2062, test_loss: 1.1708, test_f1: 0.3350
 epoch: 11, train_loss: 1.1934, test_loss: 1.1672, test_f1: 0.3399
 epoch: 12, train_loss: 1.1863, test_loss: 1.1581, test_f1: 0.3401
 epoch: 13, train_loss: 1.1791, test_loss: 1.1506, test_f1: 0.3516
 epoch: 14, train_loss: 1.1730, test_loss: 1.1502, test_f1: 0.3605
 epoch: 15, train_loss: 1.1687, test_loss: 1.1382, test_f1: 0.3700
 epoch: 16, train_loss: 1.1543, test_loss: 1.1413, test_f1: 0.3915
 epoch: 17, train_loss: 1.1549, test_loss: 1.1369, test_f1: 0.3999
 epoch: 18, train_loss: 1.1396, test_loss: 1.1142, test_f1: 0.4122
 epoch: 19, train_loss: 1.1360, test_loss: 1.1260, test_f1: 0.4206
 epoch: 20, train_loss: 1.1242, test_loss: 1.1275, test_f1: 0.4238
 epoch: 21, train_loss: 1.1311, test_loss: 1.1209, test_f1: 0.4374
 epoch: 22, train_loss: 1.1192, test_loss: 1.0968, test_f1: 0.4353
 epoch: 23, train_loss: 1.1055, test_loss: 1.0739, test_f1: 0.4426
 epoch: 24, train_loss: 1.1053, test_loss: 1.0873, test_f1: 0.4338
 epoch: 25, train_loss: 1.1001, test_loss: 1.0782, test_f1: 0.4375
 epoch: 26, train_loss: 1.0857, test_loss: 1.0587, test_f1: 0.4549
 epoch: 27, train_loss: 1.0968, test_loss: 1.0504, test_f1: 0.4552
 epoch: 28, train_loss: 1.0752, test_loss: 1.0257, test_f1: 0.4445
 epoch: 29, train_loss: 1.0793, test_loss: 1.0184, test_f1: 0.4706
 epoch: 30, train_loss: 1.0680, test_loss: 1.0203, test_f1: 0.4555
 epoch: 31, train_loss: 1.0528, test_loss: 1.0206, test_f1: 0.4466
 epoch: 32, train_loss: 1.0541, test_loss: 1.0116, test_f1: 0.4570
 epoch: 33, train_loss: 1.0599, test_loss: 0.9833, test_f1: 0.4767
 epoch: 34, train_loss: 1.0478, test_loss: 1.0054, test_f1: 0.4680
 epoch: 35, train_loss: 1.0552, test_loss: 0.9859, test_f1: 0.4939
 epoch: 36, train_loss: 1.0582, test_loss: 0.9849, test_f1: 0.4807
 epoch: 37, train_loss: 1.0441, test_loss: 0.9852, test_f1: 0.4672
 epoch: 38, train_loss: 1.0446, test_loss: 0.9607, test_f1: 0.4805
 epoch: 39, train_loss: 1.0398, test_loss: 0.9928, test_f1: 0.4711
 epoch: 40, train_loss: 1.0374, test_loss: 0.9780, test_f1: 0.4649
 epoch: 41, train_loss: 1.0195, test_loss: 0.9659, test_f1: 0.4744
 epoch: 42, train_loss: 1.0260, test_loss: 0.9591, test_f1: 0.4615
 epoch: 43, train_loss: 1.0229, test_loss: 0.9479, test_f1: 0.4606
 epoch: 44, train_loss: 1.0117, test_loss: 0.9490, test_f1: 0.4697
 epoch: 45, train_loss: 1.0178, test_loss: 0.9670, test_f1: 0.4640
 epoch: 46, train_loss: 1.0079, test_loss: 0.9608, test_f1: 0.4907
 epoch: 47, train_loss: 1.0101, test_loss: 0.9466, test_f1: 0.4887
 epoch: 48, train_loss: 1.0122, test_loss: 0.9361, test_f1: 0.4933
 epoch: 49, train_loss: 0.9994, test_loss: 0.9599, test_f1: 0.4851
 epoch: 50, train_loss: 0.9982, test_loss: 0.9359, test_f1: 0.4883
 epoch: 51, train_loss: 1.0003, test_loss: 0.9350, test_f1: 0.4837
 epoch: 52, train_loss: 0.9989, test_loss: 0.9449, test_f1: 0.4763
 epoch: 53, train_loss: 0.9967, test_loss: 0.9380, test_f1: 0.4854
 epoch: 54, train_loss: 0.9938, test_loss: 0.9313, test_f1: 0.4985
 epoch: 55, train_loss: 0.9874, test_loss: 0.9357, test_f1: 0.4901
 epoch: 56, train_loss: 0.9893, test_loss: 0.9358, test_f1: 0.4897
 epoch: 57, train_loss: 0.9830, test_loss: 0.9256, test_f1: 0.5075
 epoch: 58, train_loss: 0.9894, test_loss: 0.9226, test_f1: 0.4952
 epoch: 59, train_loss: 0.9827, test_loss: 0.9299, test_f1: 0.4847
 epoch: 60, train_loss: 0.9813, test_loss: 0.9344, test_f1: 0.4850
 epoch: 61, train_loss: 0.9757, test_loss: 0.9365, test_f1: 0.4781
 epoch: 62, train_loss: 0.9787, test_loss: 0.9409, test_f1: 0.4880
 epoch: 63, train_loss: 0.9761, test_loss: 0.9383, test_f1: 0.4849
 epoch: 64, train_loss: 0.9701, test_loss: 0.9333, test_f1: 0.4878
 epoch: 65, train_loss: 0.9668, test_loss: 0.9333, test_f1: 0.4772
 epoch: 66, train_loss: 0.9688, test_loss: 0.9310, test_f1: 0.4923
 epoch: 67, train_loss: 0.9761, test_loss: 0.9289, test_f1: 0.4882
 epoch: 68, train_loss: 0.9742, test_loss: 0.9269, test_f1: 0.4935
 epoch: 69, train_loss: 0.9688, test_loss: 0.9327, test_f1: 0.4790
 epoch: 70, train_loss: 0.9707, test_loss: 0.9329, test_f1: 0.5133
 epoch: 71, train_loss: 0.9685, test_loss: 0.9223, test_f1: 0.5015
 epoch: 72, train_loss: 0.9750, test_loss: 0.9254, test_f1: 0.5026
 epoch: 73, train_loss: 0.9701, test_loss: 0.9328, test_f1: 0.4898
 epoch: 74, train_loss: 0.9624, test_loss: 0.9390, test_f1: 0.4784
 epoch: 75, train_loss: 0.9675, test_loss: 0.9252, test_f1: 0.4934
 epoch: 76, train_loss: 0.9652, test_loss: 0.9326, test_f1: 0.4893
 epoch: 77, train_loss: 0.9697, test_loss: 0.9326, test_f1: 0.5028
 epoch: 78, train_loss: 0.9652, test_loss: 0.9319, test_f1: 0.5004
 epoch: 79, train_loss: 0.9568, test_loss: 0.9381, test_f1: 0.4899
 epoch: 80, train_loss: 0.9566, test_loss: 0.9220, test_f1: 0.5050
 epoch: 81, train_loss: 0.9617, test_loss: 0.9308, test_f1: 0.4937
 epoch: 82, train_loss: 0.9593, test_loss: 0.9183, test_f1: 0.5022
 epoch: 83, train_loss: 0.9640, test_loss: 0.9434, test_f1: 0.4861
 epoch: 84, train_loss: 0.9473, test_loss: 0.9551, test_f1: 0.4818
 epoch: 85, train_loss: 0.9541, test_loss: 0.9233, test_f1: 0.5005
 epoch: 86, train_loss: 0.9540, test_loss: 0.9285, test_f1: 0.4981
 epoch: 87, train_loss: 0.9542, test_loss: 0.9338, test_f1: 0.5011
 epoch: 88, train_loss: 0.9561, test_loss: 0.9328, test_f1: 0.5057
 epoch: 89, train_loss: 0.9494, test_loss: 0.9220, test_f1: 0.4942
 epoch: 90, train_loss: 0.9398, test_loss: 0.9376, test_f1: 0.4943
 epoch: 91, train_loss: 0.9549, test_loss: 0.9280, test_f1: 0.4951
 epoch: 92, train_loss: 0.9406, test_loss: 0.9307, test_f1: 0.4973
 epoch: 93, train_loss: 0.9493, test_loss: 0.9431, test_f1: 0.4885
 epoch: 94, train_loss: 0.9347, test_loss: 0.9257, test_f1: 0.4870
 epoch: 95, train_loss: 0.9441, test_loss: 0.9555, test_f1: 0.4769
 epoch: 96, train_loss: 0.9438, test_loss: 0.9224, test_f1: 0.4962
 epoch: 97, train_loss: 0.9555, test_loss: 0.9367, test_f1: 0.5115
 epoch: 98, train_loss: 0.9394, test_loss: 0.9572, test_f1: 0.4965
 epoch: 99, train_loss: 0.9364, test_loss: 0.9300, test_f1: 0.4895
##################ITERATION #9 ****************************************
 epoch: 0, train_loss: 1.4398, test_loss: 1.3413, test_f1: 0.2274
 epoch: 1, train_loss: 1.3098, test_loss: 1.2877, test_f1: 0.2274
 epoch: 2, train_loss: 1.2885, test_loss: 1.2517, test_f1: 0.2555
 epoch: 3, train_loss: 1.2609, test_loss: 1.2224, test_f1: 0.2572
 epoch: 4, train_loss: 1.2482, test_loss: 1.2023, test_f1: 0.2932
 epoch: 5, train_loss: 1.2340, test_loss: 1.1941, test_f1: 0.3150
 epoch: 6, train_loss: 1.2278, test_loss: 1.1772, test_f1: 0.3300
 epoch: 7, train_loss: 1.1943, test_loss: 1.1621, test_f1: 0.3632
 epoch: 8, train_loss: 1.1957, test_loss: 1.1489, test_f1: 0.3951
 epoch: 9, train_loss: 1.1885, test_loss: 1.1369, test_f1: 0.4108
 epoch: 10, train_loss: 1.1807, test_loss: 1.1284, test_f1: 0.4117
 epoch: 11, train_loss: 1.1733, test_loss: 1.1166, test_f1: 0.4097
 epoch: 12, train_loss: 1.1636, test_loss: 1.1059, test_f1: 0.4401
 epoch: 13, train_loss: 1.1523, test_loss: 1.0978, test_f1: 0.4446
 epoch: 14, train_loss: 1.1500, test_loss: 1.0894, test_f1: 0.4281
 epoch: 15, train_loss: 1.1396, test_loss: 1.0852, test_f1: 0.4353
 epoch: 16, train_loss: 1.1304, test_loss: 1.0757, test_f1: 0.4269
 epoch: 17, train_loss: 1.1161, test_loss: 1.0678, test_f1: 0.4495
 epoch: 18, train_loss: 1.1171, test_loss: 1.0727, test_f1: 0.4456
 epoch: 19, train_loss: 1.1123, test_loss: 1.0632, test_f1: 0.4556
 epoch: 20, train_loss: 1.0889, test_loss: 1.0541, test_f1: 0.4607
 epoch: 21, train_loss: 1.0878, test_loss: 1.0494, test_f1: 0.4456
 epoch: 22, train_loss: 1.0774, test_loss: 1.0486, test_f1: 0.4540
 epoch: 23, train_loss: 1.0843, test_loss: 1.0392, test_f1: 0.4488
 epoch: 24, train_loss: 1.0687, test_loss: 1.0348, test_f1: 0.4477
 epoch: 25, train_loss: 1.0687, test_loss: 1.0298, test_f1: 0.4469
 epoch: 26, train_loss: 1.0549, test_loss: 1.0245, test_f1: 0.4349
 epoch: 27, train_loss: 1.0486, test_loss: 1.0252, test_f1: 0.4478
 epoch: 28, train_loss: 1.0578, test_loss: 1.0145, test_f1: 0.4422
 epoch: 29, train_loss: 1.0353, test_loss: 1.0162, test_f1: 0.4592
 epoch: 30, train_loss: 1.0337, test_loss: 1.0132, test_f1: 0.4497
 epoch: 31, train_loss: 1.0421, test_loss: 1.0015, test_f1: 0.4724
 epoch: 32, train_loss: 1.0198, test_loss: 1.0040, test_f1: 0.4699
 epoch: 33, train_loss: 1.0110, test_loss: 1.0045, test_f1: 0.4736
 epoch: 34, train_loss: 1.0139, test_loss: 0.9981, test_f1: 0.4876
 epoch: 35, train_loss: 1.0080, test_loss: 1.0064, test_f1: 0.4776
 epoch: 36, train_loss: 1.0090, test_loss: 1.0212, test_f1: 0.4719
 epoch: 37, train_loss: 1.0005, test_loss: 1.0183, test_f1: 0.4771
 epoch: 38, train_loss: 0.9830, test_loss: 1.0100, test_f1: 0.4729
 epoch: 39, train_loss: 0.9984, test_loss: 0.9994, test_f1: 0.4579
 epoch: 40, train_loss: 0.9938, test_loss: 1.0337, test_f1: 0.4635
 epoch: 41, train_loss: 0.9847, test_loss: 1.0276, test_f1: 0.4628
 epoch: 42, train_loss: 0.9916, test_loss: 1.0135, test_f1: 0.4664
 epoch: 43, train_loss: 0.9831, test_loss: 1.0085, test_f1: 0.4603
 epoch: 44, train_loss: 0.9817, test_loss: 1.0012, test_f1: 0.4712
 epoch: 45, train_loss: 0.9611, test_loss: 1.0319, test_f1: 0.4719
 epoch: 46, train_loss: 0.9764, test_loss: 1.0068, test_f1: 0.4685
 epoch: 47, train_loss: 0.9820, test_loss: 1.0309, test_f1: 0.4645
 epoch: 48, train_loss: 0.9703, test_loss: 0.9957, test_f1: 0.4893
 epoch: 49, train_loss: 0.9603, test_loss: 1.0169, test_f1: 0.4757
 epoch: 50, train_loss: 0.9545, test_loss: 1.0150, test_f1: 0.4651
 epoch: 51, train_loss: 0.9531, test_loss: 1.0153, test_f1: 0.4709
 epoch: 52, train_loss: 0.9492, test_loss: 1.0081, test_f1: 0.4757
 epoch: 53, train_loss: 0.9477, test_loss: 1.0143, test_f1: 0.4780
 epoch: 54, train_loss: 0.9453, test_loss: 1.0159, test_f1: 0.4757
 epoch: 55, train_loss: 0.9390, test_loss: 1.0096, test_f1: 0.4738
 epoch: 56, train_loss: 0.9442, test_loss: 1.0122, test_f1: 0.4664
 epoch: 57, train_loss: 0.9479, test_loss: 1.0101, test_f1: 0.4717
 epoch: 58, train_loss: 0.9443, test_loss: 1.0011, test_f1: 0.4821
 epoch: 59, train_loss: 0.9325, test_loss: 1.0250, test_f1: 0.4929
 epoch: 60, train_loss: 0.9410, test_loss: 1.0126, test_f1: 0.5052
 epoch: 61, train_loss: 0.9330, test_loss: 1.0054, test_f1: 0.4791
 epoch: 62, train_loss: 0.9351, test_loss: 1.0172, test_f1: 0.4741
 epoch: 63, train_loss: 0.9269, test_loss: 1.0136, test_f1: 0.4769
 epoch: 64, train_loss: 0.9375, test_loss: 1.0207, test_f1: 0.4707
 epoch: 65, train_loss: 0.9302, test_loss: 1.0257, test_f1: 0.4761
 epoch: 66, train_loss: 0.9345, test_loss: 1.0175, test_f1: 0.4706
 epoch: 67, train_loss: 0.9339, test_loss: 1.0168, test_f1: 0.4813
 epoch: 68, train_loss: 0.9260, test_loss: 1.0223, test_f1: 0.4744
 epoch: 69, train_loss: 0.9340, test_loss: 1.0186, test_f1: 0.4707
 epoch: 70, train_loss: 0.9264, test_loss: 1.0164, test_f1: 0.4770
 epoch: 71, train_loss: 0.9214, test_loss: 1.0173, test_f1: 0.4695
 epoch: 72, train_loss: 0.9193, test_loss: 1.0298, test_f1: 0.4806
 epoch: 73, train_loss: 0.9159, test_loss: 1.0241, test_f1: 0.4692
 epoch: 74, train_loss: 0.9174, test_loss: 1.0158, test_f1: 0.4679
 epoch: 75, train_loss: 0.9253, test_loss: 1.0311, test_f1: 0.4751
 epoch: 76, train_loss: 0.9071, test_loss: 1.0212, test_f1: 0.4687
 epoch: 77, train_loss: 0.9135, test_loss: 1.0127, test_f1: 0.4694
 epoch: 78, train_loss: 0.9271, test_loss: 1.0236, test_f1: 0.4611
 epoch: 79, train_loss: 0.9203, test_loss: 1.0198, test_f1: 0.4684
 epoch: 80, train_loss: 0.9177, test_loss: 1.0333, test_f1: 0.4729
 epoch: 81, train_loss: 0.9120, test_loss: 1.0217, test_f1: 0.4625
 epoch: 82, train_loss: 0.9053, test_loss: 1.0245, test_f1: 0.4731
 epoch: 83, train_loss: 0.9054, test_loss: 1.0341, test_f1: 0.4734
 epoch: 84, train_loss: 0.9025, test_loss: 1.0225, test_f1: 0.4795
 epoch: 85, train_loss: 0.9052, test_loss: 1.0293, test_f1: 0.4800
 epoch: 86, train_loss: 0.9075, test_loss: 1.0269, test_f1: 0.4682
 epoch: 87, train_loss: 0.9053, test_loss: 1.0383, test_f1: 0.4614
 epoch: 88, train_loss: 0.9139, test_loss: 1.0349, test_f1: 0.4772
 epoch: 89, train_loss: 0.9025, test_loss: 1.0333, test_f1: 0.4762
 epoch: 90, train_loss: 0.9145, test_loss: 1.0218, test_f1: 0.4741
 epoch: 91, train_loss: 0.8960, test_loss: 1.0269, test_f1: 0.4764
 epoch: 92, train_loss: 0.9011, test_loss: 1.0176, test_f1: 0.4819
 epoch: 93, train_loss: 0.8996, test_loss: 1.0290, test_f1: 0.4717
 epoch: 94, train_loss: 0.9041, test_loss: 1.0328, test_f1: 0.4663
 epoch: 95, train_loss: 0.8943, test_loss: 1.0373, test_f1: 0.4627
 epoch: 96, train_loss: 0.8977, test_loss: 1.0306, test_f1: 0.4733
 epoch: 97, train_loss: 0.9086, test_loss: 1.0211, test_f1: 0.4793
 epoch: 98, train_loss: 0.9003, test_loss: 1.0344, test_f1: 0.4766
 epoch: 99, train_loss: 0.8943, test_loss: 1.0188, test_f1: 0.4765

Training completed in 469.14 seconds
Best F1: 0.5350 at epoch 76
Mean F1 across iterations: 0.5017  0.0224
========================FINAL RESULTS================================
FEGIN weighted F1: 0.5350  0.0224
python main.py --data ltspice_examples --representation component_component --model FEGIN --layers 3 --hiddens 16 --batch_size 256 --lr 0.001 --emb_size 128 --epochs 100 --save_appendix component_component_L3_H16_BS256_LR0.001_E128 --no_val
-----



STDERR:
  File "main.py", line 370, in <module>
    main()
  File "main.py", line 254, in main
    dataset = dataset_class(
  File "/home/philip/projects/llm_inference_code_repo/Circuit-Completion-Using-GNNs/component_classification_with_link_prediction_head/evaluation/FEGIN/kernel/circuit_datasets.py", line 15, in __init__
    self.data, self.slices = torch.load(self.processed_paths[0])
  File "/home/philip/.local/lib/python3.8/site-packages/torch/serialization.py", line 1040, in load
    warnings.warn(
  File "/usr/lib/python3.8/warnings.py", line 109, in _showwarnmsg
    sw(msg.message, msg.category, msg.filename, msg.lineno,
  File "main.py", line 47, in warn_with_traceback
    traceback.print_stack(file=log)
/home/philip/projects/llm_inference_code_repo/Circuit-Completion-Using-GNNs/component_classification_with_link_prediction_head/evaluation/FEGIN/kernel/circuit_datasets.py:15: FutureWarning: You are using `torch.load` with `weights_only=False` (the current default value), which uses the default pickle module implicitly. It is possible to construct malicious pickle data which will execute arbitrary code during unpickling (See https://github.com/pytorch/pytorch/blob/main/SECURITY.md#untrusted-models for more details). In a future release, the default value for `weights_only` will be flipped to `True`. This limits the functions that could be executed during unpickling. Arbitrary objects will no longer be allowed to be loaded via this mode unless they are explicitly allowlisted by the user via `torch.serialization.add_safe_globals`. We recommend you start setting `weights_only=True` for any use case where you don't have full control of the loaded file. Please open an issue on GitHub for any issues related to this experimental feature.
  self.data, self.slices = torch.load(self.processed_paths[0])
