STDOUT:
Results will be saved in /home/philip/projects/llm_inference_code_repo/Circuit-Completion-Using-GNNs/component_classification_with_link_prediction_head/evaluation/FEGIN/results/model_FEGIN_dataset_ltspice_examples
Command line input: python main.py --data ltspice_examples --representation component_net --model FEGIN --layers 5 --hiddens 64 --batch_size 128 --lr 0.0001 --emb_size 512 --epochs 100 --save_appendix component_net_L5_H64_BS128_LR0.0001_E512 --no_val
 is saved.
-----
ltspice_examples - FEGIN
Using 5 layers, 64 hidden units, h = 2
Loading component_net representation dataset
ENTERED
Training FEGIN on component_net representation
Train: 3558, Test: 846
##################ITERATION #0 ****************************************
 epoch: 0, train_loss: 1.4016, test_loss: 1.3963, test_f1: 0.0793
 epoch: 1, train_loss: 1.3863, test_loss: 1.3840, test_f1: 0.0791
 epoch: 2, train_loss: 1.3728, test_loss: 1.3623, test_f1: 0.1545
 epoch: 3, train_loss: 1.3563, test_loss: 1.3379, test_f1: 0.3026
 epoch: 4, train_loss: 1.3342, test_loss: 1.3093, test_f1: 0.3207
 epoch: 5, train_loss: 1.3057, test_loss: 1.2813, test_f1: 0.3165
 epoch: 6, train_loss: 1.2798, test_loss: 1.2541, test_f1: 0.3074
 epoch: 7, train_loss: 1.2543, test_loss: 1.2371, test_f1: 0.3152
 epoch: 8, train_loss: 1.2350, test_loss: 1.2228, test_f1: 0.3149
 epoch: 9, train_loss: 1.2214, test_loss: 1.2060, test_f1: 0.3307
 epoch: 10, train_loss: 1.2064, test_loss: 1.1921, test_f1: 0.3294
 epoch: 11, train_loss: 1.1942, test_loss: 1.1806, test_f1: 0.3542
 epoch: 12, train_loss: 1.1781, test_loss: 1.1674, test_f1: 0.3631
 epoch: 13, train_loss: 1.1663, test_loss: 1.1507, test_f1: 0.3482
 epoch: 14, train_loss: 1.1547, test_loss: 1.1399, test_f1: 0.3632
 epoch: 15, train_loss: 1.1372, test_loss: 1.1253, test_f1: 0.3710
 epoch: 16, train_loss: 1.1215, test_loss: 1.1131, test_f1: 0.3785
 epoch: 17, train_loss: 1.1156, test_loss: 1.1032, test_f1: 0.3978
 epoch: 18, train_loss: 1.1017, test_loss: 1.0866, test_f1: 0.4171
 epoch: 19, train_loss: 1.0861, test_loss: 1.0737, test_f1: 0.4313
 epoch: 20, train_loss: 1.0874, test_loss: 1.0679, test_f1: 0.4499
 epoch: 21, train_loss: 1.0658, test_loss: 1.0539, test_f1: 0.4827
 epoch: 22, train_loss: 1.0631, test_loss: 1.0418, test_f1: 0.5033
 epoch: 23, train_loss: 1.0470, test_loss: 1.0381, test_f1: 0.5079
 epoch: 24, train_loss: 1.0345, test_loss: 1.0243, test_f1: 0.5194
 epoch: 25, train_loss: 1.0208, test_loss: 1.0117, test_f1: 0.5177
 epoch: 26, train_loss: 1.0128, test_loss: 0.9972, test_f1: 0.5323
 epoch: 27, train_loss: 0.9940, test_loss: 0.9937, test_f1: 0.5269
 epoch: 28, train_loss: 0.9803, test_loss: 0.9868, test_f1: 0.5173
 epoch: 29, train_loss: 0.9716, test_loss: 0.9772, test_f1: 0.5167
 epoch: 30, train_loss: 0.9640, test_loss: 0.9796, test_f1: 0.5035
 epoch: 31, train_loss: 0.9509, test_loss: 0.9652, test_f1: 0.5214
 epoch: 32, train_loss: 0.9339, test_loss: 0.9531, test_f1: 0.5247
 epoch: 33, train_loss: 0.9249, test_loss: 0.9492, test_f1: 0.5247
 epoch: 34, train_loss: 0.9126, test_loss: 0.9555, test_f1: 0.5107
 epoch: 35, train_loss: 0.9001, test_loss: 0.9237, test_f1: 0.5271
 epoch: 36, train_loss: 0.8976, test_loss: 0.9338, test_f1: 0.5257
 epoch: 37, train_loss: 0.8849, test_loss: 0.9296, test_f1: 0.5218
 epoch: 38, train_loss: 0.8903, test_loss: 0.9256, test_f1: 0.5225
 epoch: 39, train_loss: 0.8718, test_loss: 0.9372, test_f1: 0.5148
 epoch: 40, train_loss: 0.8671, test_loss: 0.9287, test_f1: 0.5106
 epoch: 41, train_loss: 0.8683, test_loss: 0.9103, test_f1: 0.5286
 epoch: 42, train_loss: 0.8659, test_loss: 0.9477, test_f1: 0.5222
 epoch: 43, train_loss: 0.8418, test_loss: 0.9323, test_f1: 0.5133
 epoch: 44, train_loss: 0.8460, test_loss: 0.9338, test_f1: 0.5174
 epoch: 45, train_loss: 0.8392, test_loss: 0.9242, test_f1: 0.5237
 epoch: 46, train_loss: 0.8381, test_loss: 0.9379, test_f1: 0.5271
 epoch: 47, train_loss: 0.8358, test_loss: 0.9251, test_f1: 0.5305
 epoch: 48, train_loss: 0.8252, test_loss: 0.9243, test_f1: 0.5234
 epoch: 49, train_loss: 0.8284, test_loss: 0.9394, test_f1: 0.5286
 epoch: 50, train_loss: 0.8259, test_loss: 0.9426, test_f1: 0.5148
 epoch: 51, train_loss: 0.8118, test_loss: 0.9526, test_f1: 0.5321
 epoch: 52, train_loss: 0.7958, test_loss: 0.9402, test_f1: 0.5233
 epoch: 53, train_loss: 0.7958, test_loss: 0.9384, test_f1: 0.5257
 epoch: 54, train_loss: 0.7977, test_loss: 0.9440, test_f1: 0.5198
 epoch: 55, train_loss: 0.7984, test_loss: 0.9286, test_f1: 0.5242
 epoch: 56, train_loss: 0.8072, test_loss: 0.9425, test_f1: 0.5242
 epoch: 57, train_loss: 0.7999, test_loss: 0.9383, test_f1: 0.5295
 epoch: 58, train_loss: 0.7948, test_loss: 0.9395, test_f1: 0.5217
 epoch: 59, train_loss: 0.8002, test_loss: 0.9547, test_f1: 0.5197
 epoch: 60, train_loss: 0.7957, test_loss: 0.9647, test_f1: 0.5135
 epoch: 61, train_loss: 0.7804, test_loss: 0.9592, test_f1: 0.5173
 epoch: 62, train_loss: 0.7921, test_loss: 0.9510, test_f1: 0.5249
 epoch: 63, train_loss: 0.7750, test_loss: 0.9564, test_f1: 0.5239
 epoch: 64, train_loss: 0.7873, test_loss: 0.9653, test_f1: 0.5135
 epoch: 65, train_loss: 0.7852, test_loss: 0.9712, test_f1: 0.5221
 epoch: 66, train_loss: 0.7639, test_loss: 0.9515, test_f1: 0.5327
 epoch: 67, train_loss: 0.7766, test_loss: 0.9698, test_f1: 0.5161
 epoch: 68, train_loss: 0.7821, test_loss: 0.9583, test_f1: 0.5164
 epoch: 69, train_loss: 0.7726, test_loss: 0.9575, test_f1: 0.5234
 epoch: 70, train_loss: 0.7708, test_loss: 0.9686, test_f1: 0.5186
 epoch: 71, train_loss: 0.7715, test_loss: 0.9645, test_f1: 0.5261
 epoch: 72, train_loss: 0.7633, test_loss: 0.9746, test_f1: 0.5111
 epoch: 73, train_loss: 0.7639, test_loss: 0.9572, test_f1: 0.5179
 epoch: 74, train_loss: 0.7617, test_loss: 0.9702, test_f1: 0.5282
 epoch: 75, train_loss: 0.7684, test_loss: 0.9507, test_f1: 0.5271
 epoch: 76, train_loss: 0.7587, test_loss: 0.9902, test_f1: 0.5130
 epoch: 77, train_loss: 0.7675, test_loss: 0.9742, test_f1: 0.5245
 epoch: 78, train_loss: 0.7575, test_loss: 0.9591, test_f1: 0.5230
 epoch: 79, train_loss: 0.7722, test_loss: 0.9746, test_f1: 0.5187
 epoch: 80, train_loss: 0.7651, test_loss: 0.9741, test_f1: 0.5055
 epoch: 81, train_loss: 0.7488, test_loss: 0.9712, test_f1: 0.5316
 epoch: 82, train_loss: 0.7495, test_loss: 0.9575, test_f1: 0.5365
 epoch: 83, train_loss: 0.7456, test_loss: 0.9877, test_f1: 0.5224
 epoch: 84, train_loss: 0.7488, test_loss: 0.9790, test_f1: 0.5346
 epoch: 85, train_loss: 0.7551, test_loss: 0.9659, test_f1: 0.5258
 epoch: 86, train_loss: 0.7502, test_loss: 0.9695, test_f1: 0.5310
 epoch: 87, train_loss: 0.7447, test_loss: 0.9620, test_f1: 0.5312
 epoch: 88, train_loss: 0.7507, test_loss: 0.9681, test_f1: 0.5290
 epoch: 89, train_loss: 0.7542, test_loss: 0.9828, test_f1: 0.5240
 epoch: 90, train_loss: 0.7374, test_loss: 0.9732, test_f1: 0.5361
 epoch: 91, train_loss: 0.7491, test_loss: 0.9740, test_f1: 0.5251
 epoch: 92, train_loss: 0.7363, test_loss: 0.9872, test_f1: 0.5316
 epoch: 93, train_loss: 0.7451, test_loss: 0.9852, test_f1: 0.5199
 epoch: 94, train_loss: 0.7380, test_loss: 0.9924, test_f1: 0.5201
 epoch: 95, train_loss: 0.7318, test_loss: 0.9998, test_f1: 0.5192
 epoch: 96, train_loss: 0.7354, test_loss: 0.9912, test_f1: 0.5265
 epoch: 97, train_loss: 0.7357, test_loss: 0.9927, test_f1: 0.5239
 epoch: 98, train_loss: 0.7344, test_loss: 0.9904, test_f1: 0.5296
 epoch: 99, train_loss: 0.7286, test_loss: 1.0105, test_f1: 0.5260
##################ITERATION #1 ****************************************
 epoch: 0, train_loss: 1.3520, test_loss: 1.3797, test_f1: 0.2842
 epoch: 1, train_loss: 1.3014, test_loss: 1.3119, test_f1: 0.2749
 epoch: 2, train_loss: 1.2744, test_loss: 1.2670, test_f1: 0.3275
 epoch: 3, train_loss: 1.2512, test_loss: 1.2306, test_f1: 0.3341
 epoch: 4, train_loss: 1.2316, test_loss: 1.2044, test_f1: 0.3453
 epoch: 5, train_loss: 1.2098, test_loss: 1.1815, test_f1: 0.3618
 epoch: 6, train_loss: 1.1846, test_loss: 1.1641, test_f1: 0.3856
 epoch: 7, train_loss: 1.1650, test_loss: 1.1387, test_f1: 0.4030
 epoch: 8, train_loss: 1.1473, test_loss: 1.1156, test_f1: 0.4109
 epoch: 9, train_loss: 1.1319, test_loss: 1.0944, test_f1: 0.4448
 epoch: 10, train_loss: 1.1129, test_loss: 1.0822, test_f1: 0.4516
 epoch: 11, train_loss: 1.0913, test_loss: 1.0531, test_f1: 0.4742
 epoch: 12, train_loss: 1.0698, test_loss: 1.0431, test_f1: 0.4686
 epoch: 13, train_loss: 1.0557, test_loss: 1.0191, test_f1: 0.4660
 epoch: 14, train_loss: 1.0405, test_loss: 1.0062, test_f1: 0.4817
 epoch: 15, train_loss: 1.0205, test_loss: 0.9947, test_f1: 0.4807
 epoch: 16, train_loss: 1.0049, test_loss: 0.9845, test_f1: 0.4982
 epoch: 17, train_loss: 0.9941, test_loss: 0.9804, test_f1: 0.5008
 epoch: 18, train_loss: 0.9805, test_loss: 0.9551, test_f1: 0.5081
 epoch: 19, train_loss: 0.9659, test_loss: 0.9552, test_f1: 0.5032
 epoch: 20, train_loss: 0.9536, test_loss: 0.9602, test_f1: 0.5136
 epoch: 21, train_loss: 0.9477, test_loss: 0.9585, test_f1: 0.5033
 epoch: 22, train_loss: 0.9446, test_loss: 0.9350, test_f1: 0.5242
 epoch: 23, train_loss: 0.9418, test_loss: 0.9437, test_f1: 0.5221
 epoch: 24, train_loss: 0.9243, test_loss: 0.9436, test_f1: 0.5098
 epoch: 25, train_loss: 0.9228, test_loss: 0.9518, test_f1: 0.4964
 epoch: 26, train_loss: 0.9133, test_loss: 0.9390, test_f1: 0.5225
 epoch: 27, train_loss: 0.9011, test_loss: 0.9333, test_f1: 0.5229
 epoch: 28, train_loss: 0.9115, test_loss: 0.9354, test_f1: 0.5403
 epoch: 29, train_loss: 0.8918, test_loss: 0.9365, test_f1: 0.5282
 epoch: 30, train_loss: 0.8881, test_loss: 0.9190, test_f1: 0.5327
 epoch: 31, train_loss: 0.8811, test_loss: 0.9181, test_f1: 0.5341
 epoch: 32, train_loss: 0.8731, test_loss: 0.9233, test_f1: 0.5294
 epoch: 33, train_loss: 0.8760, test_loss: 0.9331, test_f1: 0.5327
 epoch: 34, train_loss: 0.8634, test_loss: 0.9242, test_f1: 0.5453
 epoch: 35, train_loss: 0.8697, test_loss: 0.9072, test_f1: 0.5336
 epoch: 36, train_loss: 0.8618, test_loss: 0.9264, test_f1: 0.5347
 epoch: 37, train_loss: 0.8483, test_loss: 0.9225, test_f1: 0.5429
 epoch: 38, train_loss: 0.8407, test_loss: 0.9208, test_f1: 0.5328
 epoch: 39, train_loss: 0.8454, test_loss: 0.9218, test_f1: 0.5361
 epoch: 40, train_loss: 0.8522, test_loss: 0.9243, test_f1: 0.5329
 epoch: 41, train_loss: 0.8426, test_loss: 0.9154, test_f1: 0.5375
 epoch: 42, train_loss: 0.8409, test_loss: 0.9136, test_f1: 0.5321
 epoch: 43, train_loss: 0.8286, test_loss: 0.9110, test_f1: 0.5433
 epoch: 44, train_loss: 0.8259, test_loss: 0.9262, test_f1: 0.5296
 epoch: 45, train_loss: 0.8228, test_loss: 0.9063, test_f1: 0.5478
 epoch: 46, train_loss: 0.8130, test_loss: 0.9252, test_f1: 0.5391
 epoch: 47, train_loss: 0.8148, test_loss: 0.9149, test_f1: 0.5419
 epoch: 48, train_loss: 0.8081, test_loss: 0.9084, test_f1: 0.5366
 epoch: 49, train_loss: 0.8130, test_loss: 0.9059, test_f1: 0.5537
 epoch: 50, train_loss: 0.8121, test_loss: 0.9135, test_f1: 0.5298
 epoch: 51, train_loss: 0.8150, test_loss: 0.9077, test_f1: 0.5347
 epoch: 52, train_loss: 0.8016, test_loss: 0.9079, test_f1: 0.5377
 epoch: 53, train_loss: 0.7980, test_loss: 0.9037, test_f1: 0.5356
 epoch: 54, train_loss: 0.8010, test_loss: 0.9025, test_f1: 0.5395
 epoch: 55, train_loss: 0.7836, test_loss: 0.9025, test_f1: 0.5379
 epoch: 56, train_loss: 0.7836, test_loss: 0.9016, test_f1: 0.5347
 epoch: 57, train_loss: 0.7928, test_loss: 0.9006, test_f1: 0.5340
 epoch: 58, train_loss: 0.7933, test_loss: 0.8931, test_f1: 0.5375
 epoch: 59, train_loss: 0.7862, test_loss: 0.8991, test_f1: 0.5365
 epoch: 60, train_loss: 0.7819, test_loss: 0.9062, test_f1: 0.5418
 epoch: 61, train_loss: 0.7792, test_loss: 0.8961, test_f1: 0.5338
 epoch: 62, train_loss: 0.7901, test_loss: 0.9033, test_f1: 0.5331
 epoch: 63, train_loss: 0.7852, test_loss: 0.9074, test_f1: 0.5477
 epoch: 64, train_loss: 0.7786, test_loss: 0.8999, test_f1: 0.5363
 epoch: 65, train_loss: 0.7756, test_loss: 0.9023, test_f1: 0.5337
 epoch: 66, train_loss: 0.7776, test_loss: 0.8954, test_f1: 0.5374
 epoch: 67, train_loss: 0.7766, test_loss: 0.9032, test_f1: 0.5348
 epoch: 68, train_loss: 0.7765, test_loss: 0.9077, test_f1: 0.5326
 epoch: 69, train_loss: 0.7709, test_loss: 0.9102, test_f1: 0.5410
 epoch: 70, train_loss: 0.7806, test_loss: 0.9056, test_f1: 0.5401
 epoch: 71, train_loss: 0.7660, test_loss: 0.9011, test_f1: 0.5437
 epoch: 72, train_loss: 0.7657, test_loss: 0.8944, test_f1: 0.5456
 epoch: 73, train_loss: 0.7746, test_loss: 0.9063, test_f1: 0.5445
 epoch: 74, train_loss: 0.7610, test_loss: 0.9030, test_f1: 0.5357
 epoch: 75, train_loss: 0.7669, test_loss: 0.9056, test_f1: 0.5332
 epoch: 76, train_loss: 0.7605, test_loss: 0.9002, test_f1: 0.5374
 epoch: 77, train_loss: 0.7727, test_loss: 0.9101, test_f1: 0.5407
 epoch: 78, train_loss: 0.7752, test_loss: 0.9125, test_f1: 0.5493
 epoch: 79, train_loss: 0.7592, test_loss: 0.8980, test_f1: 0.5367
 epoch: 80, train_loss: 0.7635, test_loss: 0.9104, test_f1: 0.5455
 epoch: 81, train_loss: 0.7593, test_loss: 0.9062, test_f1: 0.5541
 epoch: 82, train_loss: 0.7643, test_loss: 0.9068, test_f1: 0.5408
 epoch: 83, train_loss: 0.7553, test_loss: 0.9036, test_f1: 0.5439
 epoch: 84, train_loss: 0.7573, test_loss: 0.8993, test_f1: 0.5409
 epoch: 85, train_loss: 0.7616, test_loss: 0.9058, test_f1: 0.5403
 epoch: 86, train_loss: 0.7488, test_loss: 0.9167, test_f1: 0.5426
 epoch: 87, train_loss: 0.7550, test_loss: 0.9153, test_f1: 0.5438
 epoch: 88, train_loss: 0.7515, test_loss: 0.9075, test_f1: 0.5451
 epoch: 89, train_loss: 0.7511, test_loss: 0.9027, test_f1: 0.5375
 epoch: 90, train_loss: 0.7546, test_loss: 0.9145, test_f1: 0.5591
 epoch: 91, train_loss: 0.7490, test_loss: 0.9016, test_f1: 0.5594
 epoch: 92, train_loss: 0.7384, test_loss: 0.8966, test_f1: 0.5393
 epoch: 93, train_loss: 0.7402, test_loss: 0.9074, test_f1: 0.5515
 epoch: 94, train_loss: 0.7326, test_loss: 0.9055, test_f1: 0.5443
 epoch: 95, train_loss: 0.7374, test_loss: 0.9054, test_f1: 0.5492
 epoch: 96, train_loss: 0.7365, test_loss: 0.9035, test_f1: 0.5571
 epoch: 97, train_loss: 0.7462, test_loss: 0.9104, test_f1: 0.5458
 epoch: 98, train_loss: 0.7446, test_loss: 0.9116, test_f1: 0.5413
 epoch: 99, train_loss: 0.7382, test_loss: 0.9079, test_f1: 0.5517
##################ITERATION #2 ****************************************
 epoch: 0, train_loss: 1.3102, test_loss: 1.3484, test_f1: 0.2807
 epoch: 1, train_loss: 1.2549, test_loss: 1.2687, test_f1: 0.2934
 epoch: 2, train_loss: 1.2325, test_loss: 1.1999, test_f1: 0.3119
 epoch: 3, train_loss: 1.2118, test_loss: 1.1672, test_f1: 0.3472
 epoch: 4, train_loss: 1.1881, test_loss: 1.1431, test_f1: 0.3635
 epoch: 5, train_loss: 1.1665, test_loss: 1.1184, test_f1: 0.3749
 epoch: 6, train_loss: 1.1472, test_loss: 1.0997, test_f1: 0.4015
 epoch: 7, train_loss: 1.1356, test_loss: 1.0767, test_f1: 0.4257
 epoch: 8, train_loss: 1.1117, test_loss: 1.0602, test_f1: 0.4259
 epoch: 9, train_loss: 1.0924, test_loss: 1.0380, test_f1: 0.4395
 epoch: 10, train_loss: 1.0786, test_loss: 1.0271, test_f1: 0.4345
 epoch: 11, train_loss: 1.0556, test_loss: 1.0223, test_f1: 0.4417
 epoch: 12, train_loss: 1.0467, test_loss: 0.9921, test_f1: 0.4545
 epoch: 13, train_loss: 1.0352, test_loss: 0.9923, test_f1: 0.4665
 epoch: 14, train_loss: 1.0196, test_loss: 0.9843, test_f1: 0.4682
 epoch: 15, train_loss: 1.0043, test_loss: 0.9829, test_f1: 0.4654
 epoch: 16, train_loss: 1.0010, test_loss: 0.9722, test_f1: 0.4721
 epoch: 17, train_loss: 0.9795, test_loss: 0.9755, test_f1: 0.4798
 epoch: 18, train_loss: 0.9755, test_loss: 0.9711, test_f1: 0.4794
 epoch: 19, train_loss: 0.9642, test_loss: 0.9657, test_f1: 0.4743
 epoch: 20, train_loss: 0.9514, test_loss: 0.9607, test_f1: 0.4895
 epoch: 21, train_loss: 0.9510, test_loss: 0.9612, test_f1: 0.4950
 epoch: 22, train_loss: 0.9325, test_loss: 0.9616, test_f1: 0.5120
 epoch: 23, train_loss: 0.9414, test_loss: 0.9608, test_f1: 0.5152
 epoch: 24, train_loss: 0.9250, test_loss: 0.9532, test_f1: 0.5207
 epoch: 25, train_loss: 0.9258, test_loss: 0.9609, test_f1: 0.5176
 epoch: 26, train_loss: 0.9149, test_loss: 0.9611, test_f1: 0.5070
 epoch: 27, train_loss: 0.9099, test_loss: 0.9546, test_f1: 0.5165
 epoch: 28, train_loss: 0.9031, test_loss: 0.9672, test_f1: 0.5270
 epoch: 29, train_loss: 0.8936, test_loss: 0.9628, test_f1: 0.5359
 epoch: 30, train_loss: 0.8938, test_loss: 0.9848, test_f1: 0.5239
 epoch: 31, train_loss: 0.8847, test_loss: 0.9519, test_f1: 0.5357
 epoch: 32, train_loss: 0.8825, test_loss: 0.9707, test_f1: 0.5261
 epoch: 33, train_loss: 0.8835, test_loss: 0.9724, test_f1: 0.5320
 epoch: 34, train_loss: 0.8693, test_loss: 0.9555, test_f1: 0.5218
 epoch: 35, train_loss: 0.8659, test_loss: 0.9671, test_f1: 0.5323
 epoch: 36, train_loss: 0.8556, test_loss: 0.9430, test_f1: 0.5394
 epoch: 37, train_loss: 0.8508, test_loss: 0.9682, test_f1: 0.5491
 epoch: 38, train_loss: 0.8510, test_loss: 0.9537, test_f1: 0.5363
 epoch: 39, train_loss: 0.8477, test_loss: 0.9592, test_f1: 0.5352
 epoch: 40, train_loss: 0.8358, test_loss: 0.9627, test_f1: 0.5530
 epoch: 41, train_loss: 0.8439, test_loss: 0.9747, test_f1: 0.5596
 epoch: 42, train_loss: 0.8397, test_loss: 0.9678, test_f1: 0.5528
 epoch: 43, train_loss: 0.8369, test_loss: 0.9489, test_f1: 0.5612
 epoch: 44, train_loss: 0.8333, test_loss: 0.9508, test_f1: 0.5463
 epoch: 45, train_loss: 0.8294, test_loss: 0.9444, test_f1: 0.5649
 epoch: 46, train_loss: 0.8189, test_loss: 0.9724, test_f1: 0.5624
 epoch: 47, train_loss: 0.8227, test_loss: 0.9689, test_f1: 0.5675
 epoch: 48, train_loss: 0.8082, test_loss: 0.9726, test_f1: 0.5730
 epoch: 49, train_loss: 0.8094, test_loss: 0.9522, test_f1: 0.5794
 epoch: 50, train_loss: 0.8029, test_loss: 0.9292, test_f1: 0.5677
 epoch: 51, train_loss: 0.7897, test_loss: 0.9652, test_f1: 0.5745
 epoch: 52, train_loss: 0.7923, test_loss: 0.9628, test_f1: 0.5729
 epoch: 53, train_loss: 0.7844, test_loss: 0.9698, test_f1: 0.5697
 epoch: 54, train_loss: 0.7931, test_loss: 0.9558, test_f1: 0.5694
 epoch: 55, train_loss: 0.7925, test_loss: 0.9666, test_f1: 0.5744
 epoch: 56, train_loss: 0.7852, test_loss: 0.9552, test_f1: 0.5726
 epoch: 57, train_loss: 0.7819, test_loss: 0.9641, test_f1: 0.5693
 epoch: 58, train_loss: 0.7677, test_loss: 0.9646, test_f1: 0.5801
 epoch: 59, train_loss: 0.7751, test_loss: 0.9530, test_f1: 0.5756
 epoch: 60, train_loss: 0.7718, test_loss: 0.9637, test_f1: 0.5834
 epoch: 61, train_loss: 0.7704, test_loss: 0.9623, test_f1: 0.5782
 epoch: 62, train_loss: 0.7758, test_loss: 0.9565, test_f1: 0.5815
 epoch: 63, train_loss: 0.7773, test_loss: 0.9560, test_f1: 0.5902
 epoch: 64, train_loss: 0.7658, test_loss: 0.9626, test_f1: 0.5823
 epoch: 65, train_loss: 0.7709, test_loss: 0.9574, test_f1: 0.5825
 epoch: 66, train_loss: 0.7635, test_loss: 0.9633, test_f1: 0.5855
 epoch: 67, train_loss: 0.7669, test_loss: 0.9618, test_f1: 0.5886
 epoch: 68, train_loss: 0.7622, test_loss: 0.9687, test_f1: 0.5798
 epoch: 69, train_loss: 0.7617, test_loss: 0.9536, test_f1: 0.5838
 epoch: 70, train_loss: 0.7558, test_loss: 0.9557, test_f1: 0.5812
 epoch: 71, train_loss: 0.7578, test_loss: 0.9736, test_f1: 0.5925
 epoch: 72, train_loss: 0.7542, test_loss: 0.9679, test_f1: 0.5955
 epoch: 73, train_loss: 0.7564, test_loss: 0.9669, test_f1: 0.5889
 epoch: 74, train_loss: 0.7594, test_loss: 0.9601, test_f1: 0.5950
 epoch: 75, train_loss: 0.7528, test_loss: 0.9701, test_f1: 0.5884
 epoch: 76, train_loss: 0.7512, test_loss: 0.9647, test_f1: 0.5840
 epoch: 77, train_loss: 0.7549, test_loss: 0.9764, test_f1: 0.5817
 epoch: 78, train_loss: 0.7488, test_loss: 0.9672, test_f1: 0.5940
 epoch: 79, train_loss: 0.7446, test_loss: 0.9620, test_f1: 0.5866
 epoch: 80, train_loss: 0.7394, test_loss: 0.9626, test_f1: 0.5813
 epoch: 81, train_loss: 0.7425, test_loss: 0.9583, test_f1: 0.5957
 epoch: 82, train_loss: 0.7393, test_loss: 0.9695, test_f1: 0.5855
 epoch: 83, train_loss: 0.7391, test_loss: 0.9694, test_f1: 0.5918
 epoch: 84, train_loss: 0.7305, test_loss: 0.9604, test_f1: 0.6021
 epoch: 85, train_loss: 0.7350, test_loss: 0.9696, test_f1: 0.5860
 epoch: 86, train_loss: 0.7341, test_loss: 0.9568, test_f1: 0.6024
 epoch: 87, train_loss: 0.7261, test_loss: 0.9677, test_f1: 0.5884
 epoch: 88, train_loss: 0.7328, test_loss: 0.9571, test_f1: 0.5932
 epoch: 89, train_loss: 0.7406, test_loss: 0.9687, test_f1: 0.6080
 epoch: 90, train_loss: 0.7289, test_loss: 0.9743, test_f1: 0.6001
 epoch: 91, train_loss: 0.7323, test_loss: 0.9893, test_f1: 0.5875
 epoch: 92, train_loss: 0.7236, test_loss: 0.9589, test_f1: 0.5896
 epoch: 93, train_loss: 0.7257, test_loss: 0.9686, test_f1: 0.5793
 epoch: 94, train_loss: 0.7193, test_loss: 0.9739, test_f1: 0.5886
 epoch: 95, train_loss: 0.7295, test_loss: 0.9725, test_f1: 0.5988
 epoch: 96, train_loss: 0.7208, test_loss: 0.9845, test_f1: 0.5874
 epoch: 97, train_loss: 0.7316, test_loss: 0.9659, test_f1: 0.5956
 epoch: 98, train_loss: 0.7175, test_loss: 0.9867, test_f1: 0.5905
 epoch: 99, train_loss: 0.7220, test_loss: 0.9916, test_f1: 0.5893
##################ITERATION #3 ****************************************
 epoch: 0, train_loss: 1.3118, test_loss: 1.4177, test_f1: 0.0422
 epoch: 1, train_loss: 1.2471, test_loss: 1.3020, test_f1: 0.2254
 epoch: 2, train_loss: 1.2073, test_loss: 1.1977, test_f1: 0.3694
 epoch: 3, train_loss: 1.1873, test_loss: 1.1475, test_f1: 0.3880
 epoch: 4, train_loss: 1.1545, test_loss: 1.1103, test_f1: 0.4196
 epoch: 5, train_loss: 1.1347, test_loss: 1.0804, test_f1: 0.4298
 epoch: 6, train_loss: 1.1066, test_loss: 1.0566, test_f1: 0.4447
 epoch: 7, train_loss: 1.0833, test_loss: 1.0357, test_f1: 0.4590
 epoch: 8, train_loss: 1.0584, test_loss: 1.0236, test_f1: 0.4616
 epoch: 9, train_loss: 1.0477, test_loss: 1.0081, test_f1: 0.4592
 epoch: 10, train_loss: 1.0303, test_loss: 0.9938, test_f1: 0.4854
 epoch: 11, train_loss: 1.0207, test_loss: 0.9806, test_f1: 0.4920
 epoch: 12, train_loss: 1.0072, test_loss: 0.9744, test_f1: 0.4922
 epoch: 13, train_loss: 0.9941, test_loss: 0.9726, test_f1: 0.4952
 epoch: 14, train_loss: 0.9726, test_loss: 0.9625, test_f1: 0.5029
 epoch: 15, train_loss: 0.9710, test_loss: 0.9553, test_f1: 0.5080
 epoch: 16, train_loss: 0.9611, test_loss: 0.9548, test_f1: 0.5121
 epoch: 17, train_loss: 0.9450, test_loss: 0.9321, test_f1: 0.5193
 epoch: 18, train_loss: 0.9447, test_loss: 0.9405, test_f1: 0.5157
 epoch: 19, train_loss: 0.9346, test_loss: 0.9500, test_f1: 0.5066
 epoch: 20, train_loss: 0.9285, test_loss: 0.9218, test_f1: 0.5154
 epoch: 21, train_loss: 0.9203, test_loss: 0.9327, test_f1: 0.5130
 epoch: 22, train_loss: 0.9154, test_loss: 0.9467, test_f1: 0.5118
 epoch: 23, train_loss: 0.9110, test_loss: 0.9152, test_f1: 0.5312
 epoch: 24, train_loss: 0.8966, test_loss: 0.9067, test_f1: 0.5264
 epoch: 25, train_loss: 0.8931, test_loss: 0.9249, test_f1: 0.5312
 epoch: 26, train_loss: 0.8910, test_loss: 0.9232, test_f1: 0.5310
 epoch: 27, train_loss: 0.8832, test_loss: 0.9448, test_f1: 0.5205
 epoch: 28, train_loss: 0.8720, test_loss: 0.9388, test_f1: 0.5177
 epoch: 29, train_loss: 0.8741, test_loss: 0.9191, test_f1: 0.5454
 epoch: 30, train_loss: 0.8630, test_loss: 0.9213, test_f1: 0.5393
 epoch: 31, train_loss: 0.8548, test_loss: 0.9231, test_f1: 0.5429
 epoch: 32, train_loss: 0.8508, test_loss: 0.9298, test_f1: 0.5586
 epoch: 33, train_loss: 0.8578, test_loss: 0.9256, test_f1: 0.5514
 epoch: 34, train_loss: 0.8539, test_loss: 0.9357, test_f1: 0.5500
 epoch: 35, train_loss: 0.8462, test_loss: 0.9347, test_f1: 0.5528
 epoch: 36, train_loss: 0.8330, test_loss: 0.9510, test_f1: 0.5447
 epoch: 37, train_loss: 0.8288, test_loss: 0.9274, test_f1: 0.5697
 epoch: 38, train_loss: 0.8317, test_loss: 0.9295, test_f1: 0.5584
 epoch: 39, train_loss: 0.8249, test_loss: 0.9277, test_f1: 0.5706
 epoch: 40, train_loss: 0.8394, test_loss: 0.9290, test_f1: 0.5571
 epoch: 41, train_loss: 0.8202, test_loss: 0.9558, test_f1: 0.5519
 epoch: 42, train_loss: 0.8158, test_loss: 0.9461, test_f1: 0.5474
 epoch: 43, train_loss: 0.8212, test_loss: 0.9368, test_f1: 0.5495
 epoch: 44, train_loss: 0.8141, test_loss: 0.9290, test_f1: 0.5553
 epoch: 45, train_loss: 0.8091, test_loss: 0.9210, test_f1: 0.5688
 epoch: 46, train_loss: 0.8054, test_loss: 0.9205, test_f1: 0.5650
 epoch: 47, train_loss: 0.7949, test_loss: 0.9435, test_f1: 0.5393
 epoch: 48, train_loss: 0.8064, test_loss: 0.9343, test_f1: 0.5558
 epoch: 49, train_loss: 0.7902, test_loss: 0.9518, test_f1: 0.5384
 epoch: 50, train_loss: 0.8046, test_loss: 0.9327, test_f1: 0.5430
 epoch: 51, train_loss: 0.7785, test_loss: 0.9277, test_f1: 0.5487
 epoch: 52, train_loss: 0.7820, test_loss: 0.9391, test_f1: 0.5487
 epoch: 53, train_loss: 0.7715, test_loss: 0.9369, test_f1: 0.5302
 epoch: 54, train_loss: 0.7797, test_loss: 0.9260, test_f1: 0.5607
 epoch: 55, train_loss: 0.7777, test_loss: 0.9404, test_f1: 0.5471
 epoch: 56, train_loss: 0.7714, test_loss: 0.9492, test_f1: 0.5456
 epoch: 57, train_loss: 0.7581, test_loss: 0.9509, test_f1: 0.5371
 epoch: 58, train_loss: 0.7814, test_loss: 0.9418, test_f1: 0.5523
 epoch: 59, train_loss: 0.7682, test_loss: 0.9382, test_f1: 0.5539
 epoch: 60, train_loss: 0.7615, test_loss: 0.9518, test_f1: 0.5630
 epoch: 61, train_loss: 0.7719, test_loss: 0.9402, test_f1: 0.5552
 epoch: 62, train_loss: 0.7615, test_loss: 0.9513, test_f1: 0.5623
 epoch: 63, train_loss: 0.7602, test_loss: 0.9485, test_f1: 0.5433
 epoch: 64, train_loss: 0.7592, test_loss: 0.9477, test_f1: 0.5447
 epoch: 65, train_loss: 0.7573, test_loss: 0.9553, test_f1: 0.5482
 epoch: 66, train_loss: 0.7547, test_loss: 0.9538, test_f1: 0.5454
 epoch: 67, train_loss: 0.7523, test_loss: 0.9626, test_f1: 0.5544
 epoch: 68, train_loss: 0.7561, test_loss: 0.9430, test_f1: 0.5470
 epoch: 69, train_loss: 0.7521, test_loss: 0.9584, test_f1: 0.5491
 epoch: 70, train_loss: 0.7479, test_loss: 0.9461, test_f1: 0.5515
 epoch: 71, train_loss: 0.7436, test_loss: 0.9595, test_f1: 0.5391
 epoch: 72, train_loss: 0.7424, test_loss: 0.9642, test_f1: 0.5392
 epoch: 73, train_loss: 0.7511, test_loss: 0.9468, test_f1: 0.5584
 epoch: 74, train_loss: 0.7446, test_loss: 0.9400, test_f1: 0.5413
 epoch: 75, train_loss: 0.7484, test_loss: 0.9584, test_f1: 0.5584
 epoch: 76, train_loss: 0.7546, test_loss: 0.9557, test_f1: 0.5593
 epoch: 77, train_loss: 0.7413, test_loss: 0.9509, test_f1: 0.5548
 epoch: 78, train_loss: 0.7354, test_loss: 0.9424, test_f1: 0.5506
 epoch: 79, train_loss: 0.7407, test_loss: 0.9477, test_f1: 0.5641
 epoch: 80, train_loss: 0.7346, test_loss: 0.9425, test_f1: 0.5630
 epoch: 81, train_loss: 0.7407, test_loss: 0.9602, test_f1: 0.5508
 epoch: 82, train_loss: 0.7316, test_loss: 0.9553, test_f1: 0.5554
 epoch: 83, train_loss: 0.7381, test_loss: 0.9749, test_f1: 0.5452
 epoch: 84, train_loss: 0.7314, test_loss: 0.9694, test_f1: 0.5847
 epoch: 85, train_loss: 0.7345, test_loss: 0.9627, test_f1: 0.5527
 epoch: 86, train_loss: 0.7341, test_loss: 0.9626, test_f1: 0.5694
 epoch: 87, train_loss: 0.7312, test_loss: 0.9593, test_f1: 0.5575
 epoch: 88, train_loss: 0.7254, test_loss: 0.9646, test_f1: 0.5700
 epoch: 89, train_loss: 0.7312, test_loss: 0.9816, test_f1: 0.5552
 epoch: 90, train_loss: 0.7278, test_loss: 0.9585, test_f1: 0.5757
 epoch: 91, train_loss: 0.7313, test_loss: 0.9677, test_f1: 0.5709
 epoch: 92, train_loss: 0.7198, test_loss: 0.9605, test_f1: 0.5720
 epoch: 93, train_loss: 0.7182, test_loss: 0.9668, test_f1: 0.5679
 epoch: 94, train_loss: 0.7209, test_loss: 0.9594, test_f1: 0.5646
 epoch: 95, train_loss: 0.7135, test_loss: 0.9707, test_f1: 0.5772
 epoch: 96, train_loss: 0.7196, test_loss: 0.9759, test_f1: 0.5542
 epoch: 97, train_loss: 0.7099, test_loss: 0.9678, test_f1: 0.5676
 epoch: 98, train_loss: 0.7226, test_loss: 0.9702, test_f1: 0.5572
 epoch: 99, train_loss: 0.7091, test_loss: 0.9837, test_f1: 0.5500
##################ITERATION #4 ****************************************
 epoch: 0, train_loss: 1.2793, test_loss: 1.3334, test_f1: 0.3580
 epoch: 1, train_loss: 1.2118, test_loss: 1.2318, test_f1: 0.3984
 epoch: 2, train_loss: 1.1680, test_loss: 1.1484, test_f1: 0.4034
 epoch: 3, train_loss: 1.1460, test_loss: 1.0953, test_f1: 0.4337
 epoch: 4, train_loss: 1.1176, test_loss: 1.0677, test_f1: 0.4408
 epoch: 5, train_loss: 1.0978, test_loss: 1.0364, test_f1: 0.4510
 epoch: 6, train_loss: 1.0746, test_loss: 1.0260, test_f1: 0.4488
 epoch: 7, train_loss: 1.0558, test_loss: 1.0043, test_f1: 0.4490
 epoch: 8, train_loss: 1.0392, test_loss: 0.9950, test_f1: 0.4535
 epoch: 9, train_loss: 1.0106, test_loss: 0.9935, test_f1: 0.4594
 epoch: 10, train_loss: 1.0001, test_loss: 0.9745, test_f1: 0.4727
 epoch: 11, train_loss: 0.9884, test_loss: 0.9653, test_f1: 0.4815
 epoch: 12, train_loss: 0.9815, test_loss: 0.9709, test_f1: 0.5017
 epoch: 13, train_loss: 0.9590, test_loss: 0.9553, test_f1: 0.4782
 epoch: 14, train_loss: 0.9592, test_loss: 0.9441, test_f1: 0.5024
 epoch: 15, train_loss: 0.9538, test_loss: 0.9633, test_f1: 0.4976
 epoch: 16, train_loss: 0.9225, test_loss: 0.9611, test_f1: 0.5052
 epoch: 17, train_loss: 0.9361, test_loss: 0.9582, test_f1: 0.5037
 epoch: 18, train_loss: 0.9265, test_loss: 0.9587, test_f1: 0.5033
 epoch: 19, train_loss: 0.9131, test_loss: 0.9433, test_f1: 0.4963
 epoch: 20, train_loss: 0.9119, test_loss: 0.9436, test_f1: 0.5007
 epoch: 21, train_loss: 0.8994, test_loss: 0.9578, test_f1: 0.4925
 epoch: 22, train_loss: 0.8990, test_loss: 0.9693, test_f1: 0.5063
 epoch: 23, train_loss: 0.8905, test_loss: 0.9680, test_f1: 0.5089
 epoch: 24, train_loss: 0.8843, test_loss: 0.9580, test_f1: 0.5133
 epoch: 25, train_loss: 0.8760, test_loss: 0.9510, test_f1: 0.5075
 epoch: 26, train_loss: 0.8711, test_loss: 0.9693, test_f1: 0.5188
 epoch: 27, train_loss: 0.8712, test_loss: 0.9619, test_f1: 0.5222
 epoch: 28, train_loss: 0.8700, test_loss: 0.9703, test_f1: 0.5219
 epoch: 29, train_loss: 0.8581, test_loss: 0.9704, test_f1: 0.5276
 epoch: 30, train_loss: 0.8615, test_loss: 0.9543, test_f1: 0.5095
 epoch: 31, train_loss: 0.8472, test_loss: 0.9609, test_f1: 0.5206
 epoch: 32, train_loss: 0.8526, test_loss: 0.9644, test_f1: 0.5372
 epoch: 33, train_loss: 0.8484, test_loss: 0.9526, test_f1: 0.5336
 epoch: 34, train_loss: 0.8403, test_loss: 0.9555, test_f1: 0.5320
 epoch: 35, train_loss: 0.8238, test_loss: 0.9716, test_f1: 0.5257
 epoch: 36, train_loss: 0.8299, test_loss: 0.9603, test_f1: 0.5244
 epoch: 37, train_loss: 0.8213, test_loss: 0.9569, test_f1: 0.5319
 epoch: 38, train_loss: 0.8219, test_loss: 0.9630, test_f1: 0.5280
 epoch: 39, train_loss: 0.8160, test_loss: 0.9596, test_f1: 0.5394
 epoch: 40, train_loss: 0.8234, test_loss: 0.9813, test_f1: 0.5230
 epoch: 41, train_loss: 0.8138, test_loss: 0.9537, test_f1: 0.5312
 epoch: 42, train_loss: 0.8082, test_loss: 0.9540, test_f1: 0.5332
 epoch: 43, train_loss: 0.8036, test_loss: 0.9821, test_f1: 0.5322
 epoch: 44, train_loss: 0.8091, test_loss: 1.0054, test_f1: 0.5342
 epoch: 45, train_loss: 0.7982, test_loss: 0.9612, test_f1: 0.5233
 epoch: 46, train_loss: 0.8030, test_loss: 1.0027, test_f1: 0.5237
 epoch: 47, train_loss: 0.7969, test_loss: 0.9912, test_f1: 0.5325
 epoch: 48, train_loss: 0.7992, test_loss: 0.9770, test_f1: 0.5486
 epoch: 49, train_loss: 0.7870, test_loss: 0.9714, test_f1: 0.5424
 epoch: 50, train_loss: 0.7847, test_loss: 0.9589, test_f1: 0.5371
 epoch: 51, train_loss: 0.7686, test_loss: 0.9734, test_f1: 0.5368
 epoch: 52, train_loss: 0.7874, test_loss: 0.9665, test_f1: 0.5442
 epoch: 53, train_loss: 0.7770, test_loss: 0.9744, test_f1: 0.5363
 epoch: 54, train_loss: 0.7740, test_loss: 0.9902, test_f1: 0.5336
 epoch: 55, train_loss: 0.7645, test_loss: 0.9761, test_f1: 0.5419
 epoch: 56, train_loss: 0.7640, test_loss: 0.9883, test_f1: 0.5387
 epoch: 57, train_loss: 0.7733, test_loss: 0.9889, test_f1: 0.5390
 epoch: 58, train_loss: 0.7656, test_loss: 0.9740, test_f1: 0.5379
 epoch: 59, train_loss: 0.7630, test_loss: 0.9752, test_f1: 0.5417
 epoch: 60, train_loss: 0.7620, test_loss: 0.9797, test_f1: 0.5408
 epoch: 61, train_loss: 0.7600, test_loss: 0.9751, test_f1: 0.5534
 epoch: 62, train_loss: 0.7604, test_loss: 0.9825, test_f1: 0.5469
 epoch: 63, train_loss: 0.7532, test_loss: 0.9725, test_f1: 0.5436
 epoch: 64, train_loss: 0.7587, test_loss: 0.9792, test_f1: 0.5357
 epoch: 65, train_loss: 0.7513, test_loss: 0.9742, test_f1: 0.5449
 epoch: 66, train_loss: 0.7580, test_loss: 0.9701, test_f1: 0.5347
 epoch: 67, train_loss: 0.7567, test_loss: 0.9836, test_f1: 0.5444
 epoch: 68, train_loss: 0.7477, test_loss: 0.9932, test_f1: 0.5414
 epoch: 69, train_loss: 0.7403, test_loss: 0.9766, test_f1: 0.5399
 epoch: 70, train_loss: 0.7424, test_loss: 0.9930, test_f1: 0.5374
 epoch: 71, train_loss: 0.7361, test_loss: 0.9863, test_f1: 0.5397
 epoch: 72, train_loss: 0.7454, test_loss: 0.9956, test_f1: 0.5416
 epoch: 73, train_loss: 0.7330, test_loss: 0.9965, test_f1: 0.5484
 epoch: 74, train_loss: 0.7415, test_loss: 0.9845, test_f1: 0.5502
 epoch: 75, train_loss: 0.7402, test_loss: 1.0002, test_f1: 0.5414
 epoch: 76, train_loss: 0.7488, test_loss: 0.9755, test_f1: 0.5342
 epoch: 77, train_loss: 0.7310, test_loss: 0.9766, test_f1: 0.5473
 epoch: 78, train_loss: 0.7302, test_loss: 0.9684, test_f1: 0.5501
 epoch: 79, train_loss: 0.7395, test_loss: 0.9860, test_f1: 0.5469
 epoch: 80, train_loss: 0.7254, test_loss: 0.9981, test_f1: 0.5543
 epoch: 81, train_loss: 0.7176, test_loss: 0.9841, test_f1: 0.5603
 epoch: 82, train_loss: 0.7213, test_loss: 0.9917, test_f1: 0.5577
 epoch: 83, train_loss: 0.7160, test_loss: 1.0209, test_f1: 0.5483
 epoch: 84, train_loss: 0.7192, test_loss: 0.9990, test_f1: 0.5511
 epoch: 85, train_loss: 0.7211, test_loss: 0.9810, test_f1: 0.5590
 epoch: 86, train_loss: 0.7142, test_loss: 0.9918, test_f1: 0.5630
 epoch: 87, train_loss: 0.7162, test_loss: 0.9910, test_f1: 0.5533
 epoch: 88, train_loss: 0.7062, test_loss: 1.0022, test_f1: 0.5607
 epoch: 89, train_loss: 0.7179, test_loss: 1.0093, test_f1: 0.5555
 epoch: 90, train_loss: 0.7123, test_loss: 1.0169, test_f1: 0.5541
 epoch: 91, train_loss: 0.7209, test_loss: 1.0021, test_f1: 0.5364
 epoch: 92, train_loss: 0.7146, test_loss: 1.0151, test_f1: 0.5321
 epoch: 93, train_loss: 0.7169, test_loss: 1.0143, test_f1: 0.5650
 epoch: 94, train_loss: 0.7083, test_loss: 1.0157, test_f1: 0.5644
 epoch: 95, train_loss: 0.7118, test_loss: 1.0151, test_f1: 0.5584
 epoch: 96, train_loss: 0.7037, test_loss: 1.0319, test_f1: 0.5725
 epoch: 97, train_loss: 0.7109, test_loss: 1.0215, test_f1: 0.5372
 epoch: 98, train_loss: 0.6985, test_loss: 1.0151, test_f1: 0.5549
 epoch: 99, train_loss: 0.7024, test_loss: 1.0091, test_f1: 0.5434
##################ITERATION #5 ****************************************
 epoch: 0, train_loss: 1.2871, test_loss: 1.3993, test_f1: 0.1295
 epoch: 1, train_loss: 1.1969, test_loss: 1.2651, test_f1: 0.3134
 epoch: 2, train_loss: 1.1665, test_loss: 1.1331, test_f1: 0.4108
 epoch: 3, train_loss: 1.1365, test_loss: 1.0916, test_f1: 0.4245
 epoch: 4, train_loss: 1.1140, test_loss: 1.0673, test_f1: 0.4283
 epoch: 5, train_loss: 1.0863, test_loss: 1.0426, test_f1: 0.4418
 epoch: 6, train_loss: 1.0661, test_loss: 1.0299, test_f1: 0.4686
 epoch: 7, train_loss: 1.0668, test_loss: 1.0098, test_f1: 0.4722
 epoch: 8, train_loss: 1.0418, test_loss: 0.9888, test_f1: 0.4837
 epoch: 9, train_loss: 1.0265, test_loss: 0.9879, test_f1: 0.4819
 epoch: 10, train_loss: 1.0087, test_loss: 0.9860, test_f1: 0.4841
 epoch: 11, train_loss: 0.9987, test_loss: 0.9719, test_f1: 0.4932
 epoch: 12, train_loss: 0.9792, test_loss: 0.9632, test_f1: 0.4715
 epoch: 13, train_loss: 0.9700, test_loss: 0.9695, test_f1: 0.4751
 epoch: 14, train_loss: 0.9712, test_loss: 0.9611, test_f1: 0.5048
 epoch: 15, train_loss: 0.9548, test_loss: 0.9572, test_f1: 0.4859
 epoch: 16, train_loss: 0.9437, test_loss: 0.9476, test_f1: 0.4978
 epoch: 17, train_loss: 0.9403, test_loss: 0.9472, test_f1: 0.5092
 epoch: 18, train_loss: 0.9354, test_loss: 0.9415, test_f1: 0.4941
 epoch: 19, train_loss: 0.9208, test_loss: 0.9389, test_f1: 0.5245
 epoch: 20, train_loss: 0.9201, test_loss: 0.9383, test_f1: 0.5238
 epoch: 21, train_loss: 0.9141, test_loss: 0.9515, test_f1: 0.5143
 epoch: 22, train_loss: 0.8991, test_loss: 0.9471, test_f1: 0.5151
 epoch: 23, train_loss: 0.8966, test_loss: 0.9422, test_f1: 0.5451
 epoch: 24, train_loss: 0.8930, test_loss: 0.9558, test_f1: 0.5271
 epoch: 25, train_loss: 0.8896, test_loss: 0.9389, test_f1: 0.5204
 epoch: 26, train_loss: 0.8836, test_loss: 0.9692, test_f1: 0.4979
 epoch: 27, train_loss: 0.8828, test_loss: 0.9534, test_f1: 0.5268
 epoch: 28, train_loss: 0.8729, test_loss: 0.9627, test_f1: 0.5184
 epoch: 29, train_loss: 0.8679, test_loss: 0.9570, test_f1: 0.5324
 epoch: 30, train_loss: 0.8641, test_loss: 0.9403, test_f1: 0.5202
 epoch: 31, train_loss: 0.8467, test_loss: 0.9429, test_f1: 0.5317
 epoch: 32, train_loss: 0.8553, test_loss: 0.9346, test_f1: 0.5688
 epoch: 33, train_loss: 0.8387, test_loss: 0.9355, test_f1: 0.5552
 epoch: 34, train_loss: 0.8449, test_loss: 0.9301, test_f1: 0.5571
 epoch: 35, train_loss: 0.8411, test_loss: 0.9463, test_f1: 0.5531
 epoch: 36, train_loss: 0.8378, test_loss: 0.9260, test_f1: 0.5522
 epoch: 37, train_loss: 0.8410, test_loss: 0.9507, test_f1: 0.5450
 epoch: 38, train_loss: 0.8300, test_loss: 0.9317, test_f1: 0.5584
 epoch: 39, train_loss: 0.8209, test_loss: 0.9297, test_f1: 0.5567
 epoch: 40, train_loss: 0.8255, test_loss: 0.9555, test_f1: 0.5652
 epoch: 41, train_loss: 0.8251, test_loss: 0.9343, test_f1: 0.5439
 epoch: 42, train_loss: 0.8226, test_loss: 0.9425, test_f1: 0.5446
 epoch: 43, train_loss: 0.8134, test_loss: 0.9321, test_f1: 0.5733
 epoch: 44, train_loss: 0.8134, test_loss: 0.9518, test_f1: 0.5451
 epoch: 45, train_loss: 0.8131, test_loss: 0.9263, test_f1: 0.5770
 epoch: 46, train_loss: 0.8064, test_loss: 0.9467, test_f1: 0.5800
 epoch: 47, train_loss: 0.8024, test_loss: 0.9521, test_f1: 0.5506
 epoch: 48, train_loss: 0.7964, test_loss: 0.9388, test_f1: 0.5665
 epoch: 49, train_loss: 0.7994, test_loss: 0.9228, test_f1: 0.5680
 epoch: 50, train_loss: 0.7947, test_loss: 0.9511, test_f1: 0.5655
 epoch: 51, train_loss: 0.7902, test_loss: 0.9396, test_f1: 0.5672
 epoch: 52, train_loss: 0.7871, test_loss: 0.9597, test_f1: 0.5623
 epoch: 53, train_loss: 0.7862, test_loss: 0.9323, test_f1: 0.5731
 epoch: 54, train_loss: 0.7813, test_loss: 0.9368, test_f1: 0.5823
 epoch: 55, train_loss: 0.7753, test_loss: 0.9424, test_f1: 0.5625
 epoch: 56, train_loss: 0.7779, test_loss: 0.9327, test_f1: 0.5604
 epoch: 57, train_loss: 0.7793, test_loss: 0.9440, test_f1: 0.5624
 epoch: 58, train_loss: 0.7841, test_loss: 0.9383, test_f1: 0.5685
 epoch: 59, train_loss: 0.7671, test_loss: 0.9529, test_f1: 0.5782
 epoch: 60, train_loss: 0.7717, test_loss: 0.9436, test_f1: 0.5504
 epoch: 61, train_loss: 0.7657, test_loss: 0.9619, test_f1: 0.5760
 epoch: 62, train_loss: 0.7741, test_loss: 0.9684, test_f1: 0.5611
 epoch: 63, train_loss: 0.7652, test_loss: 0.9613, test_f1: 0.5795
 epoch: 64, train_loss: 0.7692, test_loss: 0.9398, test_f1: 0.5828
 epoch: 65, train_loss: 0.7566, test_loss: 0.9547, test_f1: 0.5676
 epoch: 66, train_loss: 0.7668, test_loss: 0.9421, test_f1: 0.5786
 epoch: 67, train_loss: 0.7581, test_loss: 0.9256, test_f1: 0.5786
 epoch: 68, train_loss: 0.7567, test_loss: 0.9406, test_f1: 0.5717
 epoch: 69, train_loss: 0.7481, test_loss: 0.9639, test_f1: 0.5689
 epoch: 70, train_loss: 0.7545, test_loss: 0.9652, test_f1: 0.5636
 epoch: 71, train_loss: 0.7488, test_loss: 0.9732, test_f1: 0.5812
 epoch: 72, train_loss: 0.7461, test_loss: 0.9665, test_f1: 0.5723
 epoch: 73, train_loss: 0.7535, test_loss: 0.9931, test_f1: 0.5712
 epoch: 74, train_loss: 0.7527, test_loss: 0.9588, test_f1: 0.5940
 epoch: 75, train_loss: 0.7489, test_loss: 0.9475, test_f1: 0.5889
 epoch: 76, train_loss: 0.7473, test_loss: 0.9463, test_f1: 0.6029
 epoch: 77, train_loss: 0.7467, test_loss: 0.9535, test_f1: 0.6001
 epoch: 78, train_loss: 0.7469, test_loss: 0.9657, test_f1: 0.5722
 epoch: 79, train_loss: 0.7438, test_loss: 0.9339, test_f1: 0.5970
 epoch: 80, train_loss: 0.7443, test_loss: 0.9603, test_f1: 0.5714
 epoch: 81, train_loss: 0.7381, test_loss: 0.9448, test_f1: 0.5918
 epoch: 82, train_loss: 0.7288, test_loss: 0.9577, test_f1: 0.5754
 epoch: 83, train_loss: 0.7238, test_loss: 0.9671, test_f1: 0.5736
 epoch: 84, train_loss: 0.7340, test_loss: 0.9580, test_f1: 0.5745
 epoch: 85, train_loss: 0.7337, test_loss: 0.9686, test_f1: 0.5723
 epoch: 86, train_loss: 0.7366, test_loss: 0.9538, test_f1: 0.5942
 epoch: 87, train_loss: 0.7385, test_loss: 0.9502, test_f1: 0.5823
 epoch: 88, train_loss: 0.7272, test_loss: 0.9682, test_f1: 0.5974
 epoch: 89, train_loss: 0.7246, test_loss: 0.9836, test_f1: 0.5728
 epoch: 90, train_loss: 0.7165, test_loss: 0.9796, test_f1: 0.5840
 epoch: 91, train_loss: 0.7264, test_loss: 0.9823, test_f1: 0.5870
 epoch: 92, train_loss: 0.7267, test_loss: 0.9785, test_f1: 0.5884
 epoch: 93, train_loss: 0.7312, test_loss: 0.9385, test_f1: 0.6022
 epoch: 94, train_loss: 0.7226, test_loss: 0.9810, test_f1: 0.5878
 epoch: 95, train_loss: 0.7373, test_loss: 0.9750, test_f1: 0.5885
 epoch: 96, train_loss: 0.7239, test_loss: 0.9912, test_f1: 0.5840
 epoch: 97, train_loss: 0.7225, test_loss: 1.0010, test_f1: 0.5808
 epoch: 98, train_loss: 0.7316, test_loss: 0.9690, test_f1: 0.5804
 epoch: 99, train_loss: 0.7121, test_loss: 0.9843, test_f1: 0.5808
##################ITERATION #6 ****************************************
 epoch: 0, train_loss: 1.2769, test_loss: 1.4644, test_f1: 0.1072
 epoch: 1, train_loss: 1.1900, test_loss: 1.2192, test_f1: 0.3302
 epoch: 2, train_loss: 1.1543, test_loss: 1.1089, test_f1: 0.4361
 epoch: 3, train_loss: 1.1264, test_loss: 1.0573, test_f1: 0.4781
 epoch: 4, train_loss: 1.0939, test_loss: 1.0324, test_f1: 0.4713
 epoch: 5, train_loss: 1.0786, test_loss: 1.0065, test_f1: 0.4980
 epoch: 6, train_loss: 1.0533, test_loss: 0.9964, test_f1: 0.4958
 epoch: 7, train_loss: 1.0445, test_loss: 0.9780, test_f1: 0.5009
 epoch: 8, train_loss: 1.0351, test_loss: 0.9657, test_f1: 0.5027
 epoch: 9, train_loss: 1.0060, test_loss: 0.9513, test_f1: 0.5065
 epoch: 10, train_loss: 0.9980, test_loss: 0.9446, test_f1: 0.5117
 epoch: 11, train_loss: 0.9845, test_loss: 0.9439, test_f1: 0.5017
 epoch: 12, train_loss: 0.9826, test_loss: 0.9355, test_f1: 0.5209
 epoch: 13, train_loss: 0.9723, test_loss: 0.9223, test_f1: 0.5194
 epoch: 14, train_loss: 0.9571, test_loss: 0.9279, test_f1: 0.5135
 epoch: 15, train_loss: 0.9527, test_loss: 0.9099, test_f1: 0.5309
 epoch: 16, train_loss: 0.9552, test_loss: 0.9110, test_f1: 0.5335
 epoch: 17, train_loss: 0.9360, test_loss: 0.9031, test_f1: 0.5267
 epoch: 18, train_loss: 0.9332, test_loss: 0.9060, test_f1: 0.5361
 epoch: 19, train_loss: 0.9279, test_loss: 0.9116, test_f1: 0.5443
 epoch: 20, train_loss: 0.9192, test_loss: 0.8995, test_f1: 0.5203
 epoch: 21, train_loss: 0.9174, test_loss: 0.9015, test_f1: 0.5219
 epoch: 22, train_loss: 0.9023, test_loss: 0.8964, test_f1: 0.5258
 epoch: 23, train_loss: 0.8934, test_loss: 0.8849, test_f1: 0.5331
 epoch: 24, train_loss: 0.8917, test_loss: 0.8965, test_f1: 0.5208
 epoch: 25, train_loss: 0.8970, test_loss: 0.8864, test_f1: 0.5366
 epoch: 26, train_loss: 0.8900, test_loss: 0.8940, test_f1: 0.5519
 epoch: 27, train_loss: 0.8814, test_loss: 0.8874, test_f1: 0.5327
 epoch: 28, train_loss: 0.8869, test_loss: 0.8839, test_f1: 0.5415
 epoch: 29, train_loss: 0.8697, test_loss: 0.8755, test_f1: 0.5395
 epoch: 30, train_loss: 0.8666, test_loss: 0.8718, test_f1: 0.5413
 epoch: 31, train_loss: 0.8742, test_loss: 0.8981, test_f1: 0.5335
 epoch: 32, train_loss: 0.8580, test_loss: 0.8971, test_f1: 0.5578
 epoch: 33, train_loss: 0.8527, test_loss: 0.8750, test_f1: 0.5367
 epoch: 34, train_loss: 0.8601, test_loss: 0.8779, test_f1: 0.5664
 epoch: 35, train_loss: 0.8534, test_loss: 0.8824, test_f1: 0.5660
 epoch: 36, train_loss: 0.8429, test_loss: 0.8826, test_f1: 0.5631
 epoch: 37, train_loss: 0.8457, test_loss: 0.8795, test_f1: 0.5886
 epoch: 38, train_loss: 0.8419, test_loss: 0.8691, test_f1: 0.5558
 epoch: 39, train_loss: 0.8290, test_loss: 0.8840, test_f1: 0.5610
 epoch: 40, train_loss: 0.8301, test_loss: 0.8660, test_f1: 0.5730
 epoch: 41, train_loss: 0.8362, test_loss: 0.8833, test_f1: 0.5674
 epoch: 42, train_loss: 0.8256, test_loss: 0.8874, test_f1: 0.5747
 epoch: 43, train_loss: 0.8185, test_loss: 0.8644, test_f1: 0.5741
 epoch: 44, train_loss: 0.8161, test_loss: 0.8601, test_f1: 0.5709
 epoch: 45, train_loss: 0.8177, test_loss: 0.8840, test_f1: 0.5582
 epoch: 46, train_loss: 0.8102, test_loss: 0.8670, test_f1: 0.5697
 epoch: 47, train_loss: 0.8216, test_loss: 0.8838, test_f1: 0.5627
 epoch: 48, train_loss: 0.8205, test_loss: 0.8696, test_f1: 0.5660
 epoch: 49, train_loss: 0.8040, test_loss: 0.8799, test_f1: 0.5686
 epoch: 50, train_loss: 0.7975, test_loss: 0.8633, test_f1: 0.5665
 epoch: 51, train_loss: 0.7899, test_loss: 0.8593, test_f1: 0.5677
 epoch: 52, train_loss: 0.7945, test_loss: 0.8557, test_f1: 0.5675
 epoch: 53, train_loss: 0.7991, test_loss: 0.8706, test_f1: 0.5610
 epoch: 54, train_loss: 0.7885, test_loss: 0.8682, test_f1: 0.5633
 epoch: 55, train_loss: 0.7841, test_loss: 0.8712, test_f1: 0.5668
 epoch: 56, train_loss: 0.7897, test_loss: 0.8741, test_f1: 0.5675
 epoch: 57, train_loss: 0.7811, test_loss: 0.8554, test_f1: 0.5687
 epoch: 58, train_loss: 0.7873, test_loss: 0.8523, test_f1: 0.5778
 epoch: 59, train_loss: 0.7845, test_loss: 0.8686, test_f1: 0.5716
 epoch: 60, train_loss: 0.7804, test_loss: 0.8681, test_f1: 0.5742
 epoch: 61, train_loss: 0.7805, test_loss: 0.8626, test_f1: 0.5659
 epoch: 62, train_loss: 0.7817, test_loss: 0.8642, test_f1: 0.5762
 epoch: 63, train_loss: 0.7801, test_loss: 0.8793, test_f1: 0.5803
 epoch: 64, train_loss: 0.7727, test_loss: 0.8689, test_f1: 0.5813
 epoch: 65, train_loss: 0.7768, test_loss: 0.8686, test_f1: 0.5860
 epoch: 66, train_loss: 0.7793, test_loss: 0.8671, test_f1: 0.5771
 epoch: 67, train_loss: 0.7720, test_loss: 0.8580, test_f1: 0.5872
 epoch: 68, train_loss: 0.7693, test_loss: 0.8755, test_f1: 0.5814
 epoch: 69, train_loss: 0.7606, test_loss: 0.8733, test_f1: 0.5825
 epoch: 70, train_loss: 0.7629, test_loss: 0.8656, test_f1: 0.5981
 epoch: 71, train_loss: 0.7643, test_loss: 0.8674, test_f1: 0.5940
 epoch: 72, train_loss: 0.7654, test_loss: 0.8877, test_f1: 0.6022
 epoch: 73, train_loss: 0.7619, test_loss: 0.8884, test_f1: 0.5981
 epoch: 74, train_loss: 0.7637, test_loss: 0.8724, test_f1: 0.5918
 epoch: 75, train_loss: 0.7587, test_loss: 0.8815, test_f1: 0.6029
 epoch: 76, train_loss: 0.7528, test_loss: 0.8806, test_f1: 0.5939
 epoch: 77, train_loss: 0.7626, test_loss: 0.8842, test_f1: 0.6046
 epoch: 78, train_loss: 0.7627, test_loss: 0.8685, test_f1: 0.6025
 epoch: 79, train_loss: 0.7574, test_loss: 0.8848, test_f1: 0.5906
 epoch: 80, train_loss: 0.7555, test_loss: 0.8757, test_f1: 0.6009
 epoch: 81, train_loss: 0.7497, test_loss: 0.8861, test_f1: 0.5909
 epoch: 82, train_loss: 0.7518, test_loss: 0.8861, test_f1: 0.5880
 epoch: 83, train_loss: 0.7509, test_loss: 0.8843, test_f1: 0.5897
 epoch: 84, train_loss: 0.7470, test_loss: 0.8734, test_f1: 0.5887
 epoch: 85, train_loss: 0.7433, test_loss: 0.8877, test_f1: 0.5839
 epoch: 86, train_loss: 0.7429, test_loss: 0.8961, test_f1: 0.5871
 epoch: 87, train_loss: 0.7482, test_loss: 0.9080, test_f1: 0.5825
 epoch: 88, train_loss: 0.7413, test_loss: 0.8891, test_f1: 0.5921
 epoch: 89, train_loss: 0.7331, test_loss: 0.8831, test_f1: 0.6020
 epoch: 90, train_loss: 0.7374, test_loss: 0.9026, test_f1: 0.5993
 epoch: 91, train_loss: 0.7354, test_loss: 0.8794, test_f1: 0.5952
 epoch: 92, train_loss: 0.7387, test_loss: 0.8822, test_f1: 0.5808
 epoch: 93, train_loss: 0.7433, test_loss: 0.8823, test_f1: 0.6022
 epoch: 94, train_loss: 0.7354, test_loss: 0.8865, test_f1: 0.5894
 epoch: 95, train_loss: 0.7361, test_loss: 0.8885, test_f1: 0.5994
 epoch: 96, train_loss: 0.7293, test_loss: 0.8904, test_f1: 0.6075
 epoch: 97, train_loss: 0.7337, test_loss: 0.8817, test_f1: 0.6033
 epoch: 98, train_loss: 0.7396, test_loss: 0.8890, test_f1: 0.5868
 epoch: 99, train_loss: 0.7277, test_loss: 0.8892, test_f1: 0.5774
##################ITERATION #7 ****************************************
 epoch: 0, train_loss: 1.2647, test_loss: 1.2509, test_f1: 0.2419
 epoch: 1, train_loss: 1.1703, test_loss: 1.1605, test_f1: 0.4022
 epoch: 2, train_loss: 1.1375, test_loss: 1.1054, test_f1: 0.4017
 epoch: 3, train_loss: 1.1137, test_loss: 1.0707, test_f1: 0.4437
 epoch: 4, train_loss: 1.0797, test_loss: 1.0466, test_f1: 0.4501
 epoch: 5, train_loss: 1.0552, test_loss: 1.0217, test_f1: 0.4715
 epoch: 6, train_loss: 1.0397, test_loss: 1.0102, test_f1: 0.4808
 epoch: 7, train_loss: 1.0272, test_loss: 0.9929, test_f1: 0.5169
 epoch: 8, train_loss: 1.0215, test_loss: 0.9898, test_f1: 0.5043
 epoch: 9, train_loss: 0.9994, test_loss: 0.9739, test_f1: 0.5163
 epoch: 10, train_loss: 1.0000, test_loss: 0.9736, test_f1: 0.5360
 epoch: 11, train_loss: 0.9833, test_loss: 0.9634, test_f1: 0.5319
 epoch: 12, train_loss: 0.9738, test_loss: 0.9631, test_f1: 0.5620
 epoch: 13, train_loss: 0.9642, test_loss: 0.9657, test_f1: 0.5234
 epoch: 14, train_loss: 0.9551, test_loss: 0.9547, test_f1: 0.5480
 epoch: 15, train_loss: 0.9488, test_loss: 0.9513, test_f1: 0.5352
 epoch: 16, train_loss: 0.9445, test_loss: 0.9441, test_f1: 0.5302
 epoch: 17, train_loss: 0.9396, test_loss: 0.9464, test_f1: 0.5424
 epoch: 18, train_loss: 0.9425, test_loss: 0.9382, test_f1: 0.5539
 epoch: 19, train_loss: 0.9281, test_loss: 0.9450, test_f1: 0.5581
 epoch: 20, train_loss: 0.9279, test_loss: 0.9410, test_f1: 0.5590
 epoch: 21, train_loss: 0.9136, test_loss: 0.9482, test_f1: 0.5403
 epoch: 22, train_loss: 0.9067, test_loss: 0.9446, test_f1: 0.5618
 epoch: 23, train_loss: 0.8928, test_loss: 0.9410, test_f1: 0.5446
 epoch: 24, train_loss: 0.8999, test_loss: 0.9394, test_f1: 0.5537
 epoch: 25, train_loss: 0.8923, test_loss: 0.9319, test_f1: 0.5659
 epoch: 26, train_loss: 0.9011, test_loss: 0.9475, test_f1: 0.5616
 epoch: 27, train_loss: 0.8763, test_loss: 0.9355, test_f1: 0.5573
 epoch: 28, train_loss: 0.8825, test_loss: 0.9332, test_f1: 0.5614
 epoch: 29, train_loss: 0.8731, test_loss: 0.9331, test_f1: 0.5665
 epoch: 30, train_loss: 0.8730, test_loss: 0.9277, test_f1: 0.5655
 epoch: 31, train_loss: 0.8653, test_loss: 0.9385, test_f1: 0.5691
 epoch: 32, train_loss: 0.8554, test_loss: 0.9300, test_f1: 0.5836
 epoch: 33, train_loss: 0.8626, test_loss: 0.9219, test_f1: 0.5846
 epoch: 34, train_loss: 0.8449, test_loss: 0.9281, test_f1: 0.5880
 epoch: 35, train_loss: 0.8366, test_loss: 0.9220, test_f1: 0.5841
 epoch: 36, train_loss: 0.8370, test_loss: 0.9259, test_f1: 0.5781
 epoch: 37, train_loss: 0.8314, test_loss: 0.9262, test_f1: 0.5845
 epoch: 38, train_loss: 0.8380, test_loss: 0.9216, test_f1: 0.5803
 epoch: 39, train_loss: 0.8258, test_loss: 0.9259, test_f1: 0.5825
 epoch: 40, train_loss: 0.8166, test_loss: 0.9094, test_f1: 0.5933
 epoch: 41, train_loss: 0.8181, test_loss: 0.9208, test_f1: 0.5863
 epoch: 42, train_loss: 0.8226, test_loss: 0.9231, test_f1: 0.5732
 epoch: 43, train_loss: 0.8139, test_loss: 0.9230, test_f1: 0.5998
 epoch: 44, train_loss: 0.8127, test_loss: 0.9281, test_f1: 0.5702
 epoch: 45, train_loss: 0.8102, test_loss: 0.9203, test_f1: 0.5811
 epoch: 46, train_loss: 0.8059, test_loss: 0.9167, test_f1: 0.5964
 epoch: 47, train_loss: 0.8075, test_loss: 0.9246, test_f1: 0.5863
 epoch: 48, train_loss: 0.8024, test_loss: 0.9298, test_f1: 0.5843
 epoch: 49, train_loss: 0.7999, test_loss: 0.9272, test_f1: 0.5924
 epoch: 50, train_loss: 0.7905, test_loss: 0.9244, test_f1: 0.6151
 epoch: 51, train_loss: 0.7925, test_loss: 0.9183, test_f1: 0.5975
 epoch: 52, train_loss: 0.7758, test_loss: 0.9157, test_f1: 0.6162
 epoch: 53, train_loss: 0.7798, test_loss: 0.9128, test_f1: 0.6223
 epoch: 54, train_loss: 0.7688, test_loss: 0.9143, test_f1: 0.6163
 epoch: 55, train_loss: 0.7802, test_loss: 0.9086, test_f1: 0.5998
 epoch: 56, train_loss: 0.7722, test_loss: 0.9083, test_f1: 0.6222
 epoch: 57, train_loss: 0.7703, test_loss: 0.9099, test_f1: 0.6026
 epoch: 58, train_loss: 0.7729, test_loss: 0.9094, test_f1: 0.6188
 epoch: 59, train_loss: 0.7697, test_loss: 0.9079, test_f1: 0.6229
 epoch: 60, train_loss: 0.7683, test_loss: 0.9115, test_f1: 0.6132
 epoch: 61, train_loss: 0.7642, test_loss: 0.9108, test_f1: 0.6138
 epoch: 62, train_loss: 0.7571, test_loss: 0.9108, test_f1: 0.6119
 epoch: 63, train_loss: 0.7706, test_loss: 0.9165, test_f1: 0.5920
 epoch: 64, train_loss: 0.7692, test_loss: 0.9089, test_f1: 0.6235
 epoch: 65, train_loss: 0.7574, test_loss: 0.8943, test_f1: 0.6243
 epoch: 66, train_loss: 0.7613, test_loss: 0.9056, test_f1: 0.6082
 epoch: 67, train_loss: 0.7596, test_loss: 0.9128, test_f1: 0.6111
 epoch: 68, train_loss: 0.7607, test_loss: 0.9012, test_f1: 0.5995
 epoch: 69, train_loss: 0.7498, test_loss: 0.9134, test_f1: 0.6183
 epoch: 70, train_loss: 0.7557, test_loss: 0.9150, test_f1: 0.6098
 epoch: 71, train_loss: 0.7514, test_loss: 0.9129, test_f1: 0.6092
 epoch: 72, train_loss: 0.7498, test_loss: 0.9078, test_f1: 0.6122
 epoch: 73, train_loss: 0.7620, test_loss: 0.9103, test_f1: 0.6161
 epoch: 74, train_loss: 0.7569, test_loss: 0.9119, test_f1: 0.6013
 epoch: 75, train_loss: 0.7437, test_loss: 0.9145, test_f1: 0.6119
 epoch: 76, train_loss: 0.7432, test_loss: 0.9100, test_f1: 0.6076
 epoch: 77, train_loss: 0.7486, test_loss: 0.9136, test_f1: 0.6158
 epoch: 78, train_loss: 0.7491, test_loss: 0.9066, test_f1: 0.6223
 epoch: 79, train_loss: 0.7376, test_loss: 0.9123, test_f1: 0.6087
 epoch: 80, train_loss: 0.7302, test_loss: 0.9141, test_f1: 0.6102
 epoch: 81, train_loss: 0.7400, test_loss: 0.9066, test_f1: 0.6054
 epoch: 82, train_loss: 0.7356, test_loss: 0.9077, test_f1: 0.6046
 epoch: 83, train_loss: 0.7292, test_loss: 0.9118, test_f1: 0.6090
 epoch: 84, train_loss: 0.7416, test_loss: 0.9042, test_f1: 0.6139
 epoch: 85, train_loss: 0.7376, test_loss: 0.9086, test_f1: 0.6187
 epoch: 86, train_loss: 0.7310, test_loss: 0.9045, test_f1: 0.6108
 epoch: 87, train_loss: 0.7357, test_loss: 0.8967, test_f1: 0.6108
 epoch: 88, train_loss: 0.7297, test_loss: 0.9120, test_f1: 0.6032
 epoch: 89, train_loss: 0.7261, test_loss: 0.9127, test_f1: 0.6031
 epoch: 90, train_loss: 0.7256, test_loss: 0.9125, test_f1: 0.6088
 epoch: 91, train_loss: 0.7204, test_loss: 0.9142, test_f1: 0.6085
 epoch: 92, train_loss: 0.7261, test_loss: 0.9226, test_f1: 0.6130
 epoch: 93, train_loss: 0.7180, test_loss: 0.9112, test_f1: 0.6121
 epoch: 94, train_loss: 0.7311, test_loss: 0.9158, test_f1: 0.6119
 epoch: 95, train_loss: 0.7275, test_loss: 0.9145, test_f1: 0.6171
 epoch: 96, train_loss: 0.7125, test_loss: 0.9104, test_f1: 0.6175
 epoch: 97, train_loss: 0.7184, test_loss: 0.9060, test_f1: 0.6049
 epoch: 98, train_loss: 0.7144, test_loss: 0.9126, test_f1: 0.6285
 epoch: 99, train_loss: 0.7104, test_loss: 0.9047, test_f1: 0.6076
##################ITERATION #8 ****************************************
 epoch: 0, train_loss: 1.3274, test_loss: 1.3266, test_f1: 0.2271
 epoch: 1, train_loss: 1.1923, test_loss: 1.2305, test_f1: 0.3305
 epoch: 2, train_loss: 1.1651, test_loss: 1.1001, test_f1: 0.3978
 epoch: 3, train_loss: 1.1288, test_loss: 1.0462, test_f1: 0.4473
 epoch: 4, train_loss: 1.0957, test_loss: 1.0341, test_f1: 0.4430
 epoch: 5, train_loss: 1.0794, test_loss: 0.9995, test_f1: 0.5011
 epoch: 6, train_loss: 1.0649, test_loss: 1.0028, test_f1: 0.4696
 epoch: 7, train_loss: 1.0373, test_loss: 0.9972, test_f1: 0.4804
 epoch: 8, train_loss: 1.0384, test_loss: 0.9721, test_f1: 0.4960
 epoch: 9, train_loss: 1.0154, test_loss: 0.9785, test_f1: 0.5030
 epoch: 10, train_loss: 1.0007, test_loss: 0.9609, test_f1: 0.5083
 epoch: 11, train_loss: 0.9985, test_loss: 0.9609, test_f1: 0.5172
 epoch: 12, train_loss: 0.9778, test_loss: 0.9555, test_f1: 0.5220
 epoch: 13, train_loss: 0.9710, test_loss: 0.9492, test_f1: 0.5235
 epoch: 14, train_loss: 0.9617, test_loss: 0.9363, test_f1: 0.5306
 epoch: 15, train_loss: 0.9572, test_loss: 0.9411, test_f1: 0.5339
 epoch: 16, train_loss: 0.9391, test_loss: 0.9191, test_f1: 0.5431
 epoch: 17, train_loss: 0.9233, test_loss: 0.9282, test_f1: 0.5224
 epoch: 18, train_loss: 0.9221, test_loss: 0.9327, test_f1: 0.5298
 epoch: 19, train_loss: 0.9183, test_loss: 0.9339, test_f1: 0.5173
 epoch: 20, train_loss: 0.9238, test_loss: 0.9263, test_f1: 0.5175
 epoch: 21, train_loss: 0.9053, test_loss: 0.9199, test_f1: 0.5313
 epoch: 22, train_loss: 0.9123, test_loss: 0.9293, test_f1: 0.5261
 epoch: 23, train_loss: 0.9114, test_loss: 0.9246, test_f1: 0.5249
 epoch: 24, train_loss: 0.9000, test_loss: 0.9267, test_f1: 0.5266
 epoch: 25, train_loss: 0.8865, test_loss: 0.9090, test_f1: 0.5319
 epoch: 26, train_loss: 0.8839, test_loss: 0.9002, test_f1: 0.5335
 epoch: 27, train_loss: 0.8892, test_loss: 0.9228, test_f1: 0.5376
 epoch: 28, train_loss: 0.8735, test_loss: 0.8993, test_f1: 0.5231
 epoch: 29, train_loss: 0.8578, test_loss: 0.9076, test_f1: 0.5287
 epoch: 30, train_loss: 0.8663, test_loss: 0.9097, test_f1: 0.5383
 epoch: 31, train_loss: 0.8609, test_loss: 0.9152, test_f1: 0.5415
 epoch: 32, train_loss: 0.8519, test_loss: 0.9211, test_f1: 0.5484
 epoch: 33, train_loss: 0.8560, test_loss: 0.8980, test_f1: 0.5610
 epoch: 34, train_loss: 0.8590, test_loss: 0.9122, test_f1: 0.5327
 epoch: 35, train_loss: 0.8458, test_loss: 0.9100, test_f1: 0.5431
 epoch: 36, train_loss: 0.8406, test_loss: 0.9124, test_f1: 0.5623
 epoch: 37, train_loss: 0.8475, test_loss: 0.9047, test_f1: 0.5521
 epoch: 38, train_loss: 0.8336, test_loss: 0.9185, test_f1: 0.5611
 epoch: 39, train_loss: 0.8270, test_loss: 0.8981, test_f1: 0.5621
 epoch: 40, train_loss: 0.8168, test_loss: 0.9003, test_f1: 0.5787
 epoch: 41, train_loss: 0.8353, test_loss: 0.9154, test_f1: 0.5718
 epoch: 42, train_loss: 0.8250, test_loss: 0.9205, test_f1: 0.5615
 epoch: 43, train_loss: 0.8231, test_loss: 0.8979, test_f1: 0.5776
 epoch: 44, train_loss: 0.8140, test_loss: 0.9085, test_f1: 0.5810
 epoch: 45, train_loss: 0.8033, test_loss: 0.9004, test_f1: 0.5740
 epoch: 46, train_loss: 0.8059, test_loss: 0.9125, test_f1: 0.5651
 epoch: 47, train_loss: 0.7994, test_loss: 0.9033, test_f1: 0.5898
 epoch: 48, train_loss: 0.7978, test_loss: 0.8824, test_f1: 0.5783
 epoch: 49, train_loss: 0.7986, test_loss: 0.9151, test_f1: 0.5688
 epoch: 50, train_loss: 0.7921, test_loss: 0.8953, test_f1: 0.5824
 epoch: 51, train_loss: 0.7809, test_loss: 0.8920, test_f1: 0.5804
 epoch: 52, train_loss: 0.7820, test_loss: 0.8801, test_f1: 0.5900
 epoch: 53, train_loss: 0.7871, test_loss: 0.8962, test_f1: 0.5754
 epoch: 54, train_loss: 0.7825, test_loss: 0.9129, test_f1: 0.5686
 epoch: 55, train_loss: 0.7725, test_loss: 0.8992, test_f1: 0.5753
 epoch: 56, train_loss: 0.7695, test_loss: 0.9028, test_f1: 0.5922
 epoch: 57, train_loss: 0.7755, test_loss: 0.8999, test_f1: 0.5775
 epoch: 58, train_loss: 0.7740, test_loss: 0.8969, test_f1: 0.5752
 epoch: 59, train_loss: 0.7582, test_loss: 0.8966, test_f1: 0.5802
 epoch: 60, train_loss: 0.7749, test_loss: 0.9170, test_f1: 0.5601
 epoch: 61, train_loss: 0.7799, test_loss: 0.9067, test_f1: 0.5840
 epoch: 62, train_loss: 0.7771, test_loss: 0.8979, test_f1: 0.5627
 epoch: 63, train_loss: 0.7637, test_loss: 0.8913, test_f1: 0.5781
 epoch: 64, train_loss: 0.7640, test_loss: 0.9091, test_f1: 0.5753
 epoch: 65, train_loss: 0.7621, test_loss: 0.8954, test_f1: 0.5834
 epoch: 66, train_loss: 0.7533, test_loss: 0.9096, test_f1: 0.5793
 epoch: 67, train_loss: 0.7642, test_loss: 0.9115, test_f1: 0.5764
 epoch: 68, train_loss: 0.7584, test_loss: 0.8932, test_f1: 0.5794
 epoch: 69, train_loss: 0.7587, test_loss: 0.9095, test_f1: 0.5843
 epoch: 70, train_loss: 0.7568, test_loss: 0.8936, test_f1: 0.5863
 epoch: 71, train_loss: 0.7520, test_loss: 0.9098, test_f1: 0.5723
 epoch: 72, train_loss: 0.7523, test_loss: 0.9071, test_f1: 0.5806
 epoch: 73, train_loss: 0.7538, test_loss: 0.8980, test_f1: 0.5728
 epoch: 74, train_loss: 0.7572, test_loss: 0.9115, test_f1: 0.5819
 epoch: 75, train_loss: 0.7475, test_loss: 0.9194, test_f1: 0.5843
 epoch: 76, train_loss: 0.7355, test_loss: 0.9238, test_f1: 0.5803
 epoch: 77, train_loss: 0.7443, test_loss: 0.9108, test_f1: 0.5825
 epoch: 78, train_loss: 0.7323, test_loss: 0.9201, test_f1: 0.5731
 epoch: 79, train_loss: 0.7374, test_loss: 0.9128, test_f1: 0.5783
 epoch: 80, train_loss: 0.7295, test_loss: 0.9118, test_f1: 0.5875
 epoch: 81, train_loss: 0.7334, test_loss: 0.9225, test_f1: 0.5877
 epoch: 82, train_loss: 0.7388, test_loss: 0.9169, test_f1: 0.5855
 epoch: 83, train_loss: 0.7437, test_loss: 0.9410, test_f1: 0.5758
 epoch: 84, train_loss: 0.7388, test_loss: 0.9397, test_f1: 0.5784
 epoch: 85, train_loss: 0.7289, test_loss: 0.9139, test_f1: 0.6018
 epoch: 86, train_loss: 0.7288, test_loss: 0.9269, test_f1: 0.5909
 epoch: 87, train_loss: 0.7307, test_loss: 0.9127, test_f1: 0.5891
 epoch: 88, train_loss: 0.7459, test_loss: 0.9264, test_f1: 0.5841
 epoch: 89, train_loss: 0.7355, test_loss: 0.9414, test_f1: 0.6088
 epoch: 90, train_loss: 0.7245, test_loss: 0.9367, test_f1: 0.5854
 epoch: 91, train_loss: 0.7328, test_loss: 0.9343, test_f1: 0.6110
 epoch: 92, train_loss: 0.7251, test_loss: 0.9458, test_f1: 0.5882
 epoch: 93, train_loss: 0.7266, test_loss: 0.9374, test_f1: 0.5989
 epoch: 94, train_loss: 0.7243, test_loss: 0.9385, test_f1: 0.5905
 epoch: 95, train_loss: 0.7160, test_loss: 0.9234, test_f1: 0.5985
 epoch: 96, train_loss: 0.7202, test_loss: 0.9310, test_f1: 0.6100
 epoch: 97, train_loss: 0.7196, test_loss: 0.9332, test_f1: 0.5888
 epoch: 98, train_loss: 0.7241, test_loss: 0.9626, test_f1: 0.5918
 epoch: 99, train_loss: 0.7164, test_loss: 0.9299, test_f1: 0.6146
##################ITERATION #9 ****************************************
 epoch: 0, train_loss: 1.2941, test_loss: 1.3635, test_f1: 0.3105
 epoch: 1, train_loss: 1.1447, test_loss: 1.1705, test_f1: 0.4202
 epoch: 2, train_loss: 1.1212, test_loss: 1.0753, test_f1: 0.4661
 epoch: 3, train_loss: 1.0983, test_loss: 1.0232, test_f1: 0.4760
 epoch: 4, train_loss: 1.0696, test_loss: 1.0044, test_f1: 0.4967
 epoch: 5, train_loss: 1.0536, test_loss: 0.9957, test_f1: 0.4856
 epoch: 6, train_loss: 1.0327, test_loss: 0.9864, test_f1: 0.5041
 epoch: 7, train_loss: 1.0221, test_loss: 0.9833, test_f1: 0.4994
 epoch: 8, train_loss: 0.9991, test_loss: 0.9822, test_f1: 0.5006
 epoch: 9, train_loss: 0.9986, test_loss: 0.9750, test_f1: 0.5046
 epoch: 10, train_loss: 0.9880, test_loss: 0.9670, test_f1: 0.5092
 epoch: 11, train_loss: 0.9780, test_loss: 0.9670, test_f1: 0.5293
 epoch: 12, train_loss: 0.9618, test_loss: 0.9732, test_f1: 0.5150
 epoch: 13, train_loss: 0.9546, test_loss: 0.9598, test_f1: 0.5276
 epoch: 14, train_loss: 0.9568, test_loss: 0.9659, test_f1: 0.5245
 epoch: 15, train_loss: 0.9443, test_loss: 0.9601, test_f1: 0.5266
 epoch: 16, train_loss: 0.9359, test_loss: 0.9552, test_f1: 0.5429
 epoch: 17, train_loss: 0.9293, test_loss: 0.9729, test_f1: 0.5374
 epoch: 18, train_loss: 0.9269, test_loss: 0.9595, test_f1: 0.5386
 epoch: 19, train_loss: 0.9178, test_loss: 0.9593, test_f1: 0.5388
 epoch: 20, train_loss: 0.9190, test_loss: 0.9663, test_f1: 0.5350
 epoch: 21, train_loss: 0.9170, test_loss: 0.9661, test_f1: 0.5495
 epoch: 22, train_loss: 0.8992, test_loss: 0.9444, test_f1: 0.5527
 epoch: 23, train_loss: 0.9013, test_loss: 0.9600, test_f1: 0.5462
 epoch: 24, train_loss: 0.8861, test_loss: 0.9637, test_f1: 0.5633
 epoch: 25, train_loss: 0.8811, test_loss: 0.9497, test_f1: 0.5589
 epoch: 26, train_loss: 0.8811, test_loss: 0.9565, test_f1: 0.5600
 epoch: 27, train_loss: 0.8835, test_loss: 0.9619, test_f1: 0.5652
 epoch: 28, train_loss: 0.8739, test_loss: 0.9666, test_f1: 0.5409
 epoch: 29, train_loss: 0.8708, test_loss: 0.9551, test_f1: 0.5517
 epoch: 30, train_loss: 0.8702, test_loss: 0.9425, test_f1: 0.5562
 epoch: 31, train_loss: 0.8573, test_loss: 0.9556, test_f1: 0.5602
 epoch: 32, train_loss: 0.8529, test_loss: 0.9434, test_f1: 0.5538
 epoch: 33, train_loss: 0.8474, test_loss: 0.9479, test_f1: 0.5513
 epoch: 34, train_loss: 0.8474, test_loss: 0.9625, test_f1: 0.5572
 epoch: 35, train_loss: 0.8525, test_loss: 0.9709, test_f1: 0.5526
 epoch: 36, train_loss: 0.8434, test_loss: 0.9604, test_f1: 0.5606
 epoch: 37, train_loss: 0.8366, test_loss: 0.9521, test_f1: 0.5701
 epoch: 38, train_loss: 0.8468, test_loss: 0.9661, test_f1: 0.5622
 epoch: 39, train_loss: 0.8379, test_loss: 0.9528, test_f1: 0.5644
 epoch: 40, train_loss: 0.8294, test_loss: 0.9753, test_f1: 0.5638
 epoch: 41, train_loss: 0.8318, test_loss: 0.9597, test_f1: 0.5601
 epoch: 42, train_loss: 0.8236, test_loss: 0.9490, test_f1: 0.5707
 epoch: 43, train_loss: 0.8191, test_loss: 0.9724, test_f1: 0.5513
 epoch: 44, train_loss: 0.8129, test_loss: 0.9419, test_f1: 0.5665
 epoch: 45, train_loss: 0.8142, test_loss: 0.9752, test_f1: 0.5572
 epoch: 46, train_loss: 0.8110, test_loss: 0.9531, test_f1: 0.5584
 epoch: 47, train_loss: 0.8122, test_loss: 0.9588, test_f1: 0.5649
 epoch: 48, train_loss: 0.8071, test_loss: 0.9637, test_f1: 0.5653
 epoch: 49, train_loss: 0.7921, test_loss: 0.9639, test_f1: 0.5682
 epoch: 50, train_loss: 0.8009, test_loss: 0.9632, test_f1: 0.5688
 epoch: 51, train_loss: 0.7995, test_loss: 0.9616, test_f1: 0.5720
 epoch: 52, train_loss: 0.7854, test_loss: 0.9462, test_f1: 0.5728
 epoch: 53, train_loss: 0.7915, test_loss: 0.9638, test_f1: 0.5694
 epoch: 54, train_loss: 0.7906, test_loss: 0.9630, test_f1: 0.5739
 epoch: 55, train_loss: 0.7933, test_loss: 0.9494, test_f1: 0.5689
 epoch: 56, train_loss: 0.7810, test_loss: 0.9661, test_f1: 0.5760
 epoch: 57, train_loss: 0.7765, test_loss: 0.9627, test_f1: 0.5708
 epoch: 58, train_loss: 0.7753, test_loss: 0.9534, test_f1: 0.5707
 epoch: 59, train_loss: 0.7760, test_loss: 0.9551, test_f1: 0.5723
 epoch: 60, train_loss: 0.7746, test_loss: 0.9639, test_f1: 0.5752
 epoch: 61, train_loss: 0.7755, test_loss: 0.9586, test_f1: 0.5816
 epoch: 62, train_loss: 0.7836, test_loss: 0.9528, test_f1: 0.5882
 epoch: 63, train_loss: 0.7652, test_loss: 0.9720, test_f1: 0.5709
 epoch: 64, train_loss: 0.7723, test_loss: 0.9686, test_f1: 0.5658
 epoch: 65, train_loss: 0.7699, test_loss: 0.9636, test_f1: 0.5723
 epoch: 66, train_loss: 0.7641, test_loss: 0.9610, test_f1: 0.5732
 epoch: 67, train_loss: 0.7655, test_loss: 0.9584, test_f1: 0.5742
 epoch: 68, train_loss: 0.7674, test_loss: 0.9737, test_f1: 0.5660
 epoch: 69, train_loss: 0.7569, test_loss: 0.9597, test_f1: 0.5790
 epoch: 70, train_loss: 0.7646, test_loss: 0.9631, test_f1: 0.5679
 epoch: 71, train_loss: 0.7729, test_loss: 0.9665, test_f1: 0.5678
 epoch: 72, train_loss: 0.7733, test_loss: 0.9610, test_f1: 0.5888
 epoch: 73, train_loss: 0.7689, test_loss: 0.9575, test_f1: 0.5756
 epoch: 74, train_loss: 0.7589, test_loss: 0.9587, test_f1: 0.5912
 epoch: 75, train_loss: 0.7576, test_loss: 0.9510, test_f1: 0.5906
 epoch: 76, train_loss: 0.7706, test_loss: 0.9807, test_f1: 0.5701
 epoch: 77, train_loss: 0.7502, test_loss: 0.9616, test_f1: 0.5784
 epoch: 78, train_loss: 0.7482, test_loss: 0.9691, test_f1: 0.5897
 epoch: 79, train_loss: 0.7516, test_loss: 0.9693, test_f1: 0.5957
 epoch: 80, train_loss: 0.7552, test_loss: 0.9630, test_f1: 0.5974
 epoch: 81, train_loss: 0.7491, test_loss: 0.9702, test_f1: 0.5793
 epoch: 82, train_loss: 0.7605, test_loss: 0.9714, test_f1: 0.5891
 epoch: 83, train_loss: 0.7409, test_loss: 0.9590, test_f1: 0.5727
 epoch: 84, train_loss: 0.7518, test_loss: 0.9769, test_f1: 0.5889
 epoch: 85, train_loss: 0.7472, test_loss: 0.9809, test_f1: 0.5717
 epoch: 86, train_loss: 0.7415, test_loss: 0.9710, test_f1: 0.5781
 epoch: 87, train_loss: 0.7433, test_loss: 0.9694, test_f1: 0.5852
 epoch: 88, train_loss: 0.7382, test_loss: 0.9808, test_f1: 0.5898
 epoch: 89, train_loss: 0.7387, test_loss: 0.9803, test_f1: 0.5901
 epoch: 90, train_loss: 0.7408, test_loss: 0.9868, test_f1: 0.5833
 epoch: 91, train_loss: 0.7355, test_loss: 0.9698, test_f1: 0.5908
 epoch: 92, train_loss: 0.7418, test_loss: 0.9688, test_f1: 0.6039
 epoch: 93, train_loss: 0.7493, test_loss: 0.9820, test_f1: 0.5948
 epoch: 94, train_loss: 0.7353, test_loss: 0.9682, test_f1: 0.5986
 epoch: 95, train_loss: 0.7351, test_loss: 0.9692, test_f1: 0.5951
 epoch: 96, train_loss: 0.7421, test_loss: 0.9782, test_f1: 0.5944
 epoch: 97, train_loss: 0.7387, test_loss: 0.9552, test_f1: 0.6026
 epoch: 98, train_loss: 0.7270, test_loss: 0.9595, test_f1: 0.6008
 epoch: 99, train_loss: 0.7252, test_loss: 0.9597, test_f1: 0.5990

Training completed in 791.15 seconds
Best F1: 0.6285 at epoch 98
Mean F1 across iterations: 0.5919  0.0268
========================FINAL RESULTS================================
FEGIN weighted F1: 0.6285  0.0268
python main.py --data ltspice_examples --representation component_net --model FEGIN --layers 5 --hiddens 64 --batch_size 128 --lr 0.0001 --emb_size 512 --epochs 100 --save_appendix component_net_L5_H64_BS128_LR0.0001_E512 --no_val
-----



STDERR:
  File "main.py", line 370, in <module>
    main()
  File "main.py", line 254, in main
    dataset = dataset_class(
  File "/home/philip/projects/llm_inference_code_repo/Circuit-Completion-Using-GNNs/component_classification_with_link_prediction_head/evaluation/FEGIN/kernel/circuit_datasets.py", line 15, in __init__
    self.data, self.slices = torch.load(self.processed_paths[0])
  File "/home/philip/.local/lib/python3.8/site-packages/torch/serialization.py", line 1040, in load
    warnings.warn(
  File "/usr/lib/python3.8/warnings.py", line 109, in _showwarnmsg
    sw(msg.message, msg.category, msg.filename, msg.lineno,
  File "main.py", line 47, in warn_with_traceback
    traceback.print_stack(file=log)
/home/philip/projects/llm_inference_code_repo/Circuit-Completion-Using-GNNs/component_classification_with_link_prediction_head/evaluation/FEGIN/kernel/circuit_datasets.py:15: FutureWarning: You are using `torch.load` with `weights_only=False` (the current default value), which uses the default pickle module implicitly. It is possible to construct malicious pickle data which will execute arbitrary code during unpickling (See https://github.com/pytorch/pytorch/blob/main/SECURITY.md#untrusted-models for more details). In a future release, the default value for `weights_only` will be flipped to `True`. This limits the functions that could be executed during unpickling. Arbitrary objects will no longer be allowed to be loaded via this mode unless they are explicitly allowlisted by the user via `torch.serialization.add_safe_globals`. We recommend you start setting `weights_only=True` for any use case where you don't have full control of the loaded file. Please open an issue on GitHub for any issues related to this experimental feature.
  self.data, self.slices = torch.load(self.processed_paths[0])
