STDOUT:
Results will be saved in /home/philip/projects/ltspice_examples_code_repo/Circuit-Completion-Using-GNNs/component_classification_with_link_prediction_head/evaluation/FEGIN/results/model_FEGIN_dataset_ltspice_examples
Command line input: python main.py --data ltspice_examples --representation component_component --model FEGIN --layers 5 --hiddens 128 --batch_size 256 --lr 0.001 --emb_size 250 --epochs 100 --save_appendix component_component_L5_H128_BS256_LR0.001_E250 --no_val
 is saved.
-----
ltspice_examples - FEGIN
Using 5 layers, 128 hidden units, h = 2
Loading component_component representation dataset
ENTERED
Training FEGIN on component_component representation
Train: 3556, Test: 845
##################ITERATION #0 ****************************************
 epoch: 0, train_loss: 1.3149, test_loss: 1.2847, test_f1: 0.2589
 epoch: 1, train_loss: 1.2005, test_loss: 1.2187, test_f1: 0.3145
 epoch: 2, train_loss: 1.1469, test_loss: 1.1526, test_f1: 0.3793
 epoch: 3, train_loss: 1.0933, test_loss: 1.1111, test_f1: 0.4644
 epoch: 4, train_loss: 1.0396, test_loss: 1.0225, test_f1: 0.4731
 epoch: 5, train_loss: 1.0043, test_loss: 1.0171, test_f1: 0.4738
 epoch: 6, train_loss: 0.9554, test_loss: 1.0478, test_f1: 0.4598
 epoch: 7, train_loss: 0.9211, test_loss: 1.0420, test_f1: 0.4907
 epoch: 8, train_loss: 0.8986, test_loss: 0.9877, test_f1: 0.5200
 epoch: 9, train_loss: 0.8683, test_loss: 1.0484, test_f1: 0.4861
 epoch: 10, train_loss: 0.8404, test_loss: 1.0458, test_f1: 0.4893
 epoch: 11, train_loss: 0.8309, test_loss: 1.1791, test_f1: 0.4905
 epoch: 12, train_loss: 0.7965, test_loss: 1.2451, test_f1: 0.4693
 epoch: 13, train_loss: 0.8103, test_loss: 1.0396, test_f1: 0.5246
 epoch: 14, train_loss: 0.7835, test_loss: 1.1027, test_f1: 0.5219
 epoch: 15, train_loss: 0.7602, test_loss: 1.1234, test_f1: 0.5136
 epoch: 16, train_loss: 0.7344, test_loss: 1.2218, test_f1: 0.5236
 epoch: 17, train_loss: 0.7226, test_loss: 1.2740, test_f1: 0.5446
 epoch: 18, train_loss: 0.6963, test_loss: 1.3671, test_f1: 0.5065
 epoch: 19, train_loss: 0.6848, test_loss: 1.2234, test_f1: 0.5371
 epoch: 20, train_loss: 0.6909, test_loss: 1.3399, test_f1: 0.5063
 epoch: 21, train_loss: 0.6553, test_loss: 1.2330, test_f1: 0.5544
 epoch: 22, train_loss: 0.6551, test_loss: 1.5481, test_f1: 0.5199
 epoch: 23, train_loss: 0.6346, test_loss: 1.3463, test_f1: 0.5450
 epoch: 24, train_loss: 0.5988, test_loss: 1.7010, test_f1: 0.5386
 epoch: 25, train_loss: 0.5909, test_loss: 1.5033, test_f1: 0.5060
 epoch: 26, train_loss: 0.5818, test_loss: 1.4532, test_f1: 0.5303
 epoch: 27, train_loss: 0.5951, test_loss: 1.5954, test_f1: 0.4883
 epoch: 28, train_loss: 0.5656, test_loss: 1.7548, test_f1: 0.4954
 epoch: 29, train_loss: 0.5372, test_loss: 1.5815, test_f1: 0.5437
 epoch: 30, train_loss: 0.5487, test_loss: 1.7551, test_f1: 0.4693
 epoch: 31, train_loss: 0.5564, test_loss: 1.6075, test_f1: 0.5246
 epoch: 32, train_loss: 0.5472, test_loss: 1.5090, test_f1: 0.5152
 epoch: 33, train_loss: 0.5145, test_loss: 1.4729, test_f1: 0.5657
 epoch: 34, train_loss: 0.5085, test_loss: 1.6379, test_f1: 0.5359
 epoch: 35, train_loss: 0.4814, test_loss: 1.5210, test_f1: 0.5321
 epoch: 36, train_loss: 0.5021, test_loss: 1.6389, test_f1: 0.5157
 epoch: 37, train_loss: 0.4789, test_loss: 1.8487, test_f1: 0.5251
 epoch: 38, train_loss: 0.4737, test_loss: 1.7248, test_f1: 0.5441
 epoch: 39, train_loss: 0.4667, test_loss: 1.9424, test_f1: 0.5194
 epoch: 40, train_loss: 0.4517, test_loss: 1.8840, test_f1: 0.5120
 epoch: 41, train_loss: 0.4234, test_loss: 1.9383, test_f1: 0.5146
 epoch: 42, train_loss: 0.4285, test_loss: 1.8613, test_f1: 0.5317
 epoch: 43, train_loss: 0.4325, test_loss: 1.8233, test_f1: 0.5300
 epoch: 44, train_loss: 0.4253, test_loss: 1.9123, test_f1: 0.5202
 epoch: 45, train_loss: 0.4232, test_loss: 1.8123, test_f1: 0.5181
 epoch: 46, train_loss: 0.4082, test_loss: 2.0175, test_f1: 0.5369
 epoch: 47, train_loss: 0.4239, test_loss: 2.3472, test_f1: 0.5021
 epoch: 48, train_loss: 0.4180, test_loss: 1.9180, test_f1: 0.5127
 epoch: 49, train_loss: 0.3846, test_loss: 2.0133, test_f1: 0.5564
 epoch: 50, train_loss: 0.3781, test_loss: 2.0669, test_f1: 0.5104
 epoch: 51, train_loss: 0.3367, test_loss: 2.2071, test_f1: 0.5125
 epoch: 52, train_loss: 0.3071, test_loss: 2.3325, test_f1: 0.5194
 epoch: 53, train_loss: 0.2876, test_loss: 2.2911, test_f1: 0.5378
 epoch: 54, train_loss: 0.2783, test_loss: 2.4393, test_f1: 0.5222
 epoch: 55, train_loss: 0.2595, test_loss: 2.3517, test_f1: 0.5471
 epoch: 56, train_loss: 0.2518, test_loss: 2.6441, test_f1: 0.5240
 epoch: 57, train_loss: 0.2446, test_loss: 2.4598, test_f1: 0.5282
 epoch: 58, train_loss: 0.2455, test_loss: 2.6104, test_f1: 0.5133
 epoch: 59, train_loss: 0.2614, test_loss: 2.7902, test_f1: 0.5297
 epoch: 60, train_loss: 0.2577, test_loss: 2.3535, test_f1: 0.5428
 epoch: 61, train_loss: 0.2541, test_loss: 2.7273, test_f1: 0.5311
 epoch: 62, train_loss: 0.2484, test_loss: 2.6012, test_f1: 0.5265
 epoch: 63, train_loss: 0.2429, test_loss: 2.8350, test_f1: 0.5208
 epoch: 64, train_loss: 0.2318, test_loss: 2.6715, test_f1: 0.5285
 epoch: 65, train_loss: 0.2320, test_loss: 2.7470, test_f1: 0.5298
 epoch: 66, train_loss: 0.2505, test_loss: 2.7213, test_f1: 0.5471
 epoch: 67, train_loss: 0.2394, test_loss: 2.6596, test_f1: 0.5430
 epoch: 68, train_loss: 0.2296, test_loss: 2.7455, test_f1: 0.5357
 epoch: 69, train_loss: 0.2401, test_loss: 2.8863, test_f1: 0.5449
 epoch: 70, train_loss: 0.2231, test_loss: 2.8092, test_f1: 0.5342
 epoch: 71, train_loss: 0.2373, test_loss: 2.9658, test_f1: 0.5382
 epoch: 72, train_loss: 0.2270, test_loss: 3.0878, test_f1: 0.5391
 epoch: 73, train_loss: 0.2267, test_loss: 2.8404, test_f1: 0.5110
 epoch: 74, train_loss: 0.2149, test_loss: 2.8768, test_f1: 0.5171
 epoch: 75, train_loss: 0.2099, test_loss: 2.9459, test_f1: 0.5247
 epoch: 76, train_loss: 0.2229, test_loss: 3.1002, test_f1: 0.5241
 epoch: 77, train_loss: 0.2101, test_loss: 2.8915, test_f1: 0.5369
 epoch: 78, train_loss: 0.2115, test_loss: 3.1822, test_f1: 0.5083
 epoch: 79, train_loss: 0.2153, test_loss: 2.6674, test_f1: 0.5496
 epoch: 80, train_loss: 0.1991, test_loss: 2.8867, test_f1: 0.5229
 epoch: 81, train_loss: 0.2013, test_loss: 3.0938, test_f1: 0.5172
 epoch: 82, train_loss: 0.2054, test_loss: 3.2989, test_f1: 0.5291
 epoch: 83, train_loss: 0.1925, test_loss: 3.0164, test_f1: 0.5172
 epoch: 84, train_loss: 0.1795, test_loss: 2.9886, test_f1: 0.5249
 epoch: 85, train_loss: 0.1808, test_loss: 3.3071, test_f1: 0.5104
 epoch: 86, train_loss: 0.1900, test_loss: 3.0516, test_f1: 0.5489
 epoch: 87, train_loss: 0.1844, test_loss: 3.3327, test_f1: 0.5208
 epoch: 88, train_loss: 0.1925, test_loss: 3.3182, test_f1: 0.5213
 epoch: 89, train_loss: 0.2111, test_loss: 3.1451, test_f1: 0.5306
 epoch: 90, train_loss: 0.1978, test_loss: 3.1638, test_f1: 0.5198
 epoch: 91, train_loss: 0.1888, test_loss: 3.3412, test_f1: 0.5291
 epoch: 92, train_loss: 0.1861, test_loss: 3.5417, test_f1: 0.5237
 epoch: 93, train_loss: 0.1682, test_loss: 3.2779, test_f1: 0.5215
 epoch: 94, train_loss: 0.1631, test_loss: 3.3575, test_f1: 0.5240
 epoch: 95, train_loss: 0.1729, test_loss: 3.2848, test_f1: 0.5319
 epoch: 96, train_loss: 0.1626, test_loss: 3.3903, test_f1: 0.5180
 epoch: 97, train_loss: 0.1504, test_loss: 3.5233, test_f1: 0.5166
 epoch: 98, train_loss: 0.1598, test_loss: 3.6009, test_f1: 0.5097
 epoch: 99, train_loss: 0.1362, test_loss: 3.8613, test_f1: 0.5138
##################ITERATION #1 ****************************************
 epoch: 0, train_loss: 1.2397, test_loss: 1.2630, test_f1: 0.2589
 epoch: 1, train_loss: 1.1209, test_loss: 1.1581, test_f1: 0.4296
 epoch: 2, train_loss: 1.0648, test_loss: 1.0641, test_f1: 0.4913
 epoch: 3, train_loss: 1.0061, test_loss: 0.9910, test_f1: 0.5379
 epoch: 4, train_loss: 0.9741, test_loss: 0.9979, test_f1: 0.5122
 epoch: 5, train_loss: 0.9464, test_loss: 0.9630, test_f1: 0.4810
 epoch: 6, train_loss: 0.8931, test_loss: 1.0031, test_f1: 0.5142
 epoch: 7, train_loss: 0.8727, test_loss: 0.9905, test_f1: 0.5405
 epoch: 8, train_loss: 0.8410, test_loss: 0.9790, test_f1: 0.5170
 epoch: 9, train_loss: 0.8243, test_loss: 1.1460, test_f1: 0.4953
 epoch: 10, train_loss: 0.8198, test_loss: 1.1773, test_f1: 0.5022
 epoch: 11, train_loss: 0.7750, test_loss: 1.1446, test_f1: 0.5128
 epoch: 12, train_loss: 0.7677, test_loss: 1.1391, test_f1: 0.5045
 epoch: 13, train_loss: 0.7576, test_loss: 1.2127, test_f1: 0.5077
 epoch: 14, train_loss: 0.7525, test_loss: 1.0906, test_f1: 0.5102
 epoch: 15, train_loss: 0.7180, test_loss: 1.3147, test_f1: 0.5302
 epoch: 16, train_loss: 0.7023, test_loss: 1.1519, test_f1: 0.5497
 epoch: 17, train_loss: 0.6916, test_loss: 1.2573, test_f1: 0.5385
 epoch: 18, train_loss: 0.6738, test_loss: 1.0943, test_f1: 0.5290
 epoch: 19, train_loss: 0.6468, test_loss: 1.5362, test_f1: 0.4865
 epoch: 20, train_loss: 0.6350, test_loss: 1.3084, test_f1: 0.5166
 epoch: 21, train_loss: 0.6089, test_loss: 1.4150, test_f1: 0.5014
 epoch: 22, train_loss: 0.5996, test_loss: 1.3731, test_f1: 0.5156
 epoch: 23, train_loss: 0.6166, test_loss: 2.1312, test_f1: 0.4354
 epoch: 24, train_loss: 0.6086, test_loss: 1.3833, test_f1: 0.5148
 epoch: 25, train_loss: 0.5946, test_loss: 1.3014, test_f1: 0.5446
 epoch: 26, train_loss: 0.5717, test_loss: 1.4380, test_f1: 0.5578
 epoch: 27, train_loss: 0.5507, test_loss: 1.5609, test_f1: 0.5200
 epoch: 28, train_loss: 0.5491, test_loss: 1.4491, test_f1: 0.5549
 epoch: 29, train_loss: 0.5228, test_loss: 1.5990, test_f1: 0.5032
 epoch: 30, train_loss: 0.5305, test_loss: 1.6523, test_f1: 0.4995
 epoch: 31, train_loss: 0.5160, test_loss: 1.6448, test_f1: 0.5080
 epoch: 32, train_loss: 0.5137, test_loss: 1.8699, test_f1: 0.5086
 epoch: 33, train_loss: 0.5057, test_loss: 1.6903, test_f1: 0.5125
 epoch: 34, train_loss: 0.4990, test_loss: 1.7250, test_f1: 0.5187
 epoch: 35, train_loss: 0.5032, test_loss: 1.7648, test_f1: 0.5120
 epoch: 36, train_loss: 0.5059, test_loss: 1.8841, test_f1: 0.5315
 epoch: 37, train_loss: 0.4739, test_loss: 1.5539, test_f1: 0.5525
 epoch: 38, train_loss: 0.4681, test_loss: 1.7829, test_f1: 0.5263
 epoch: 39, train_loss: 0.4412, test_loss: 1.8117, test_f1: 0.5231
 epoch: 40, train_loss: 0.4613, test_loss: 1.9872, test_f1: 0.5224
 epoch: 41, train_loss: 0.4479, test_loss: 1.8633, test_f1: 0.5401
 epoch: 42, train_loss: 0.4428, test_loss: 1.6991, test_f1: 0.5377
 epoch: 43, train_loss: 0.4171, test_loss: 1.8204, test_f1: 0.5623
 epoch: 44, train_loss: 0.3918, test_loss: 1.9704, test_f1: 0.5032
 epoch: 45, train_loss: 0.3931, test_loss: 2.0972, test_f1: 0.4885
 epoch: 46, train_loss: 0.4110, test_loss: 2.0668, test_f1: 0.5438
 epoch: 47, train_loss: 0.4189, test_loss: 2.0836, test_f1: 0.4888
 epoch: 48, train_loss: 0.4163, test_loss: 2.3201, test_f1: 0.5138
 epoch: 49, train_loss: 0.3885, test_loss: 1.8266, test_f1: 0.5297
 epoch: 50, train_loss: 0.3815, test_loss: 2.2859, test_f1: 0.5466
 epoch: 51, train_loss: 0.3469, test_loss: 2.0061, test_f1: 0.5472
 epoch: 52, train_loss: 0.3072, test_loss: 2.1466, test_f1: 0.5746
 epoch: 53, train_loss: 0.2863, test_loss: 2.0965, test_f1: 0.5452
 epoch: 54, train_loss: 0.2779, test_loss: 2.1579, test_f1: 0.5447
 epoch: 55, train_loss: 0.2911, test_loss: 2.2646, test_f1: 0.5474
 epoch: 56, train_loss: 0.2714, test_loss: 2.4645, test_f1: 0.5481
 epoch: 57, train_loss: 0.2668, test_loss: 2.4945, test_f1: 0.5460
 epoch: 58, train_loss: 0.2542, test_loss: 2.6513, test_f1: 0.5342
 epoch: 59, train_loss: 0.2579, test_loss: 2.5158, test_f1: 0.5256
 epoch: 60, train_loss: 0.2691, test_loss: 2.7283, test_f1: 0.5216
 epoch: 61, train_loss: 0.2411, test_loss: 2.7373, test_f1: 0.5301
 epoch: 62, train_loss: 0.2364, test_loss: 2.6431, test_f1: 0.5565
 epoch: 63, train_loss: 0.2486, test_loss: 2.8101, test_f1: 0.5410
 epoch: 64, train_loss: 0.2464, test_loss: 2.7401, test_f1: 0.5471
 epoch: 65, train_loss: 0.2238, test_loss: 2.8750, test_f1: 0.5242
 epoch: 66, train_loss: 0.2313, test_loss: 2.7966, test_f1: 0.5563
 epoch: 67, train_loss: 0.2250, test_loss: 2.7514, test_f1: 0.5373
 epoch: 68, train_loss: 0.2295, test_loss: 2.7619, test_f1: 0.5368
 epoch: 69, train_loss: 0.2233, test_loss: 2.7307, test_f1: 0.5355
 epoch: 70, train_loss: 0.2354, test_loss: 2.5859, test_f1: 0.5568
 epoch: 71, train_loss: 0.2521, test_loss: 2.9893, test_f1: 0.5412
 epoch: 72, train_loss: 0.2359, test_loss: 3.0425, test_f1: 0.5280
 epoch: 73, train_loss: 0.2267, test_loss: 2.8271, test_f1: 0.5448
 epoch: 74, train_loss: 0.2241, test_loss: 2.8497, test_f1: 0.5484
 epoch: 75, train_loss: 0.2374, test_loss: 2.7437, test_f1: 0.5316
 epoch: 76, train_loss: 0.2233, test_loss: 2.6240, test_f1: 0.5378
 epoch: 77, train_loss: 0.2133, test_loss: 2.7705, test_f1: 0.5466
 epoch: 78, train_loss: 0.1979, test_loss: 2.9926, test_f1: 0.5221
 epoch: 79, train_loss: 0.1879, test_loss: 3.1014, test_f1: 0.5514
 epoch: 80, train_loss: 0.1932, test_loss: 3.1045, test_f1: 0.5429
 epoch: 81, train_loss: 0.1998, test_loss: 2.9689, test_f1: 0.5356
 epoch: 82, train_loss: 0.1865, test_loss: 3.0970, test_f1: 0.5307
 epoch: 83, train_loss: 0.1963, test_loss: 3.1028, test_f1: 0.5391
 epoch: 84, train_loss: 0.1995, test_loss: 3.2250, test_f1: 0.5366
 epoch: 85, train_loss: 0.1816, test_loss: 3.0632, test_f1: 0.5460
 epoch: 86, train_loss: 0.1767, test_loss: 3.1031, test_f1: 0.5490
 epoch: 87, train_loss: 0.2062, test_loss: 3.3713, test_f1: 0.5191
 epoch: 88, train_loss: 0.2064, test_loss: 3.4687, test_f1: 0.5490
 epoch: 89, train_loss: 0.1811, test_loss: 3.0175, test_f1: 0.5581
 epoch: 90, train_loss: 0.1792, test_loss: 3.1451, test_f1: 0.5348
 epoch: 91, train_loss: 0.1675, test_loss: 3.3304, test_f1: 0.5474
 epoch: 92, train_loss: 0.1665, test_loss: 3.5735, test_f1: 0.5475
 epoch: 93, train_loss: 0.1872, test_loss: 3.4369, test_f1: 0.5539
 epoch: 94, train_loss: 0.1770, test_loss: 3.1186, test_f1: 0.5460
 epoch: 95, train_loss: 0.1697, test_loss: 3.4047, test_f1: 0.5341
 epoch: 96, train_loss: 0.1592, test_loss: 3.4473, test_f1: 0.5648
 epoch: 97, train_loss: 0.1648, test_loss: 3.4028, test_f1: 0.5258
 epoch: 98, train_loss: 0.1560, test_loss: 3.4976, test_f1: 0.5348
 epoch: 99, train_loss: 0.1538, test_loss: 3.2780, test_f1: 0.5378
##################ITERATION #2 ****************************************
 epoch: 0, train_loss: 1.2676, test_loss: 1.2887, test_f1: 0.3093
 epoch: 1, train_loss: 1.1345, test_loss: 1.1845, test_f1: 0.4151
 epoch: 2, train_loss: 1.0846, test_loss: 1.1538, test_f1: 0.4373
 epoch: 3, train_loss: 1.0333, test_loss: 1.0807, test_f1: 0.4138
 epoch: 4, train_loss: 0.9844, test_loss: 1.0014, test_f1: 0.5097
 epoch: 5, train_loss: 0.9598, test_loss: 1.1255, test_f1: 0.4665
 epoch: 6, train_loss: 0.9416, test_loss: 1.1529, test_f1: 0.4822
 epoch: 7, train_loss: 0.9167, test_loss: 1.0475, test_f1: 0.5056
 epoch: 8, train_loss: 0.9080, test_loss: 0.9796, test_f1: 0.4955
 epoch: 9, train_loss: 0.8925, test_loss: 0.9977, test_f1: 0.5304
 epoch: 10, train_loss: 0.8679, test_loss: 1.0497, test_f1: 0.4658
 epoch: 11, train_loss: 0.8331, test_loss: 1.1115, test_f1: 0.4686
 epoch: 12, train_loss: 0.8055, test_loss: 1.1946, test_f1: 0.5032
 epoch: 13, train_loss: 0.8225, test_loss: 1.0555, test_f1: 0.5107
 epoch: 14, train_loss: 0.7962, test_loss: 1.0601, test_f1: 0.5177
 epoch: 15, train_loss: 0.7657, test_loss: 1.1213, test_f1: 0.4877
 epoch: 16, train_loss: 0.7767, test_loss: 1.0282, test_f1: 0.5209
 epoch: 17, train_loss: 0.7681, test_loss: 1.1479, test_f1: 0.5457
 epoch: 18, train_loss: 0.7341, test_loss: 1.1239, test_f1: 0.5406
 epoch: 19, train_loss: 0.7256, test_loss: 1.3700, test_f1: 0.4947
 epoch: 20, train_loss: 0.7064, test_loss: 1.1924, test_f1: 0.5124
 epoch: 21, train_loss: 0.7122, test_loss: 1.3847, test_f1: 0.4972
 epoch: 22, train_loss: 0.6943, test_loss: 1.2126, test_f1: 0.5261
 epoch: 23, train_loss: 0.6657, test_loss: 1.3694, test_f1: 0.4791
 epoch: 24, train_loss: 0.6634, test_loss: 1.3573, test_f1: 0.5031
 epoch: 25, train_loss: 0.6631, test_loss: 1.3263, test_f1: 0.5131
 epoch: 26, train_loss: 0.6468, test_loss: 1.2456, test_f1: 0.5657
 epoch: 27, train_loss: 0.6332, test_loss: 1.5385, test_f1: 0.5040
 epoch: 28, train_loss: 0.6413, test_loss: 1.3540, test_f1: 0.5083
 epoch: 29, train_loss: 0.6167, test_loss: 1.2840, test_f1: 0.5058
 epoch: 30, train_loss: 0.6046, test_loss: 1.3547, test_f1: 0.5235
 epoch: 31, train_loss: 0.5832, test_loss: 1.3423, test_f1: 0.5640
 epoch: 32, train_loss: 0.5831, test_loss: 1.4124, test_f1: 0.5263
 epoch: 33, train_loss: 0.5589, test_loss: 1.4789, test_f1: 0.5465
 epoch: 34, train_loss: 0.5718, test_loss: 1.6840, test_f1: 0.5218
 epoch: 35, train_loss: 0.5492, test_loss: 1.5436, test_f1: 0.5302
 epoch: 36, train_loss: 0.5372, test_loss: 1.5223, test_f1: 0.5190
 epoch: 37, train_loss: 0.5685, test_loss: 1.5003, test_f1: 0.5385
 epoch: 38, train_loss: 0.5516, test_loss: 1.8290, test_f1: 0.4800
 epoch: 39, train_loss: 0.5308, test_loss: 1.6469, test_f1: 0.5202
 epoch: 40, train_loss: 0.5271, test_loss: 1.5442, test_f1: 0.5145
 epoch: 41, train_loss: 0.5010, test_loss: 1.5784, test_f1: 0.5340
 epoch: 42, train_loss: 0.4995, test_loss: 1.6180, test_f1: 0.5105
 epoch: 43, train_loss: 0.5007, test_loss: 1.6715, test_f1: 0.5415
 epoch: 44, train_loss: 0.5104, test_loss: 1.6249, test_f1: 0.5050
 epoch: 45, train_loss: 0.5082, test_loss: 1.7716, test_f1: 0.5281
 epoch: 46, train_loss: 0.4954, test_loss: 1.5488, test_f1: 0.4758
 epoch: 47, train_loss: 0.4519, test_loss: 2.0143, test_f1: 0.5237
 epoch: 48, train_loss: 0.4601, test_loss: 1.8012, test_f1: 0.5197
 epoch: 49, train_loss: 0.4761, test_loss: 1.6575, test_f1: 0.5195
 epoch: 50, train_loss: 0.4482, test_loss: 1.6735, test_f1: 0.5535
 epoch: 51, train_loss: 0.4057, test_loss: 1.7524, test_f1: 0.5316
 epoch: 52, train_loss: 0.3747, test_loss: 1.8343, test_f1: 0.5407
 epoch: 53, train_loss: 0.3632, test_loss: 1.8185, test_f1: 0.5322
 epoch: 54, train_loss: 0.3402, test_loss: 1.8501, test_f1: 0.5336
 epoch: 55, train_loss: 0.3289, test_loss: 2.0471, test_f1: 0.5204
 epoch: 56, train_loss: 0.3356, test_loss: 2.0606, test_f1: 0.5142
 epoch: 57, train_loss: 0.3386, test_loss: 2.0347, test_f1: 0.5311
 epoch: 58, train_loss: 0.3116, test_loss: 1.9899, test_f1: 0.5162
 epoch: 59, train_loss: 0.3202, test_loss: 1.9711, test_f1: 0.5240
 epoch: 60, train_loss: 0.3354, test_loss: 2.0593, test_f1: 0.5424
 epoch: 61, train_loss: 0.3276, test_loss: 2.0454, test_f1: 0.5229
 epoch: 62, train_loss: 0.3095, test_loss: 2.2353, test_f1: 0.5159
 epoch: 63, train_loss: 0.3002, test_loss: 2.2468, test_f1: 0.5156
 epoch: 64, train_loss: 0.2980, test_loss: 2.0792, test_f1: 0.5367
 epoch: 65, train_loss: 0.2955, test_loss: 2.2061, test_f1: 0.5136
 epoch: 66, train_loss: 0.2903, test_loss: 2.3470, test_f1: 0.5021
 epoch: 67, train_loss: 0.2958, test_loss: 2.1921, test_f1: 0.5570
 epoch: 68, train_loss: 0.2921, test_loss: 2.4061, test_f1: 0.5326
 epoch: 69, train_loss: 0.3015, test_loss: 2.2610, test_f1: 0.5457
 epoch: 70, train_loss: 0.2790, test_loss: 2.4968, test_f1: 0.4953
 epoch: 71, train_loss: 0.2671, test_loss: 2.1830, test_f1: 0.5379
 epoch: 72, train_loss: 0.2616, test_loss: 2.4006, test_f1: 0.5158
 epoch: 73, train_loss: 0.2568, test_loss: 2.4609, test_f1: 0.5300
 epoch: 74, train_loss: 0.2610, test_loss: 2.3404, test_f1: 0.5037
 epoch: 75, train_loss: 0.2775, test_loss: 2.3956, test_f1: 0.5350
 epoch: 76, train_loss: 0.2429, test_loss: 2.4166, test_f1: 0.5420
 epoch: 77, train_loss: 0.2572, test_loss: 2.4096, test_f1: 0.5092
 epoch: 78, train_loss: 0.2726, test_loss: 2.3931, test_f1: 0.5152
 epoch: 79, train_loss: 0.2641, test_loss: 2.3086, test_f1: 0.5253
 epoch: 80, train_loss: 0.2621, test_loss: 2.3316, test_f1: 0.5268
 epoch: 81, train_loss: 0.2547, test_loss: 2.5532, test_f1: 0.5158
 epoch: 82, train_loss: 0.2575, test_loss: 2.4018, test_f1: 0.5444
 epoch: 83, train_loss: 0.2434, test_loss: 2.6071, test_f1: 0.5130
 epoch: 84, train_loss: 0.2286, test_loss: 2.5888, test_f1: 0.5272
 epoch: 85, train_loss: 0.2392, test_loss: 2.4881, test_f1: 0.5395
 epoch: 86, train_loss: 0.2353, test_loss: 2.6538, test_f1: 0.5123
 epoch: 87, train_loss: 0.2419, test_loss: 2.5625, test_f1: 0.5395
 epoch: 88, train_loss: 0.2443, test_loss: 2.5113, test_f1: 0.5154
 epoch: 89, train_loss: 0.2223, test_loss: 2.6900, test_f1: 0.5152
 epoch: 90, train_loss: 0.2186, test_loss: 2.5251, test_f1: 0.5459
 epoch: 91, train_loss: 0.2160, test_loss: 2.5760, test_f1: 0.5313
 epoch: 92, train_loss: 0.1985, test_loss: 2.7303, test_f1: 0.5138
 epoch: 93, train_loss: 0.2191, test_loss: 2.7795, test_f1: 0.5245
 epoch: 94, train_loss: 0.2173, test_loss: 2.6053, test_f1: 0.5229
 epoch: 95, train_loss: 0.2022, test_loss: 2.7498, test_f1: 0.5054
 epoch: 96, train_loss: 0.2202, test_loss: 2.6529, test_f1: 0.5572
 epoch: 97, train_loss: 0.2198, test_loss: 2.6176, test_f1: 0.5210
 epoch: 98, train_loss: 0.2047, test_loss: 2.7732, test_f1: 0.5294
 epoch: 99, train_loss: 0.2285, test_loss: 2.7279, test_f1: 0.5369
##################ITERATION #3 ****************************************
 epoch: 0, train_loss: 1.3039, test_loss: 1.2435, test_f1: 0.2825
 epoch: 1, train_loss: 1.1264, test_loss: 1.1677, test_f1: 0.3974
 epoch: 2, train_loss: 1.0900, test_loss: 1.0883, test_f1: 0.4349
 epoch: 3, train_loss: 1.0350, test_loss: 1.0421, test_f1: 0.4782
 epoch: 4, train_loss: 0.9965, test_loss: 0.9819, test_f1: 0.5067
 epoch: 5, train_loss: 0.9630, test_loss: 0.9920, test_f1: 0.4935
 epoch: 6, train_loss: 0.9287, test_loss: 0.9630, test_f1: 0.4997
 epoch: 7, train_loss: 0.8963, test_loss: 1.0535, test_f1: 0.4945
 epoch: 8, train_loss: 0.8911, test_loss: 1.1953, test_f1: 0.4695
 epoch: 9, train_loss: 0.8713, test_loss: 1.0733, test_f1: 0.4997
 epoch: 10, train_loss: 0.8426, test_loss: 1.0874, test_f1: 0.4836
 epoch: 11, train_loss: 0.7986, test_loss: 1.0835, test_f1: 0.5044
 epoch: 12, train_loss: 0.7827, test_loss: 1.1193, test_f1: 0.5200
 epoch: 13, train_loss: 0.7753, test_loss: 1.1821, test_f1: 0.4865
 epoch: 14, train_loss: 0.7624, test_loss: 1.0694, test_f1: 0.5185
 epoch: 15, train_loss: 0.7461, test_loss: 1.2705, test_f1: 0.4790
 epoch: 16, train_loss: 0.7138, test_loss: 1.0969, test_f1: 0.5416
 epoch: 17, train_loss: 0.6906, test_loss: 1.2111, test_f1: 0.5272
 epoch: 18, train_loss: 0.6969, test_loss: 1.1781, test_f1: 0.5261
 epoch: 19, train_loss: 0.6960, test_loss: 1.3127, test_f1: 0.5026
 epoch: 20, train_loss: 0.6951, test_loss: 1.3029, test_f1: 0.5401
 epoch: 21, train_loss: 0.7023, test_loss: 1.1790, test_f1: 0.5180
 epoch: 22, train_loss: 0.6610, test_loss: 1.3838, test_f1: 0.5279
 epoch: 23, train_loss: 0.6514, test_loss: 1.3255, test_f1: 0.5038
 epoch: 24, train_loss: 0.6104, test_loss: 1.3604, test_f1: 0.5200
 epoch: 25, train_loss: 0.6106, test_loss: 1.4237, test_f1: 0.5083
 epoch: 26, train_loss: 0.6267, test_loss: 1.3554, test_f1: 0.5015
 epoch: 27, train_loss: 0.6171, test_loss: 1.5827, test_f1: 0.5281
 epoch: 28, train_loss: 0.5951, test_loss: 1.3353, test_f1: 0.5343
 epoch: 29, train_loss: 0.5801, test_loss: 1.5742, test_f1: 0.5340
 epoch: 30, train_loss: 0.5780, test_loss: 1.5395, test_f1: 0.5096
 epoch: 31, train_loss: 0.5709, test_loss: 1.4404, test_f1: 0.5511
 epoch: 32, train_loss: 0.5378, test_loss: 1.4368, test_f1: 0.5448
 epoch: 33, train_loss: 0.5337, test_loss: 1.6436, test_f1: 0.5197
 epoch: 34, train_loss: 0.5219, test_loss: 1.6218, test_f1: 0.5104
 epoch: 35, train_loss: 0.5297, test_loss: 1.5468, test_f1: 0.5478
 epoch: 36, train_loss: 0.5310, test_loss: 1.9685, test_f1: 0.5047
 epoch: 37, train_loss: 0.5310, test_loss: 1.5337, test_f1: 0.5298
 epoch: 38, train_loss: 0.5012, test_loss: 1.9912, test_f1: 0.4777
 epoch: 39, train_loss: 0.4986, test_loss: 1.5728, test_f1: 0.5547
 epoch: 40, train_loss: 0.4861, test_loss: 1.4918, test_f1: 0.5343
 epoch: 41, train_loss: 0.4749, test_loss: 1.8695, test_f1: 0.5064
 epoch: 42, train_loss: 0.4727, test_loss: 1.9871, test_f1: 0.5193
 epoch: 43, train_loss: 0.4716, test_loss: 1.7539, test_f1: 0.5302
 epoch: 44, train_loss: 0.4668, test_loss: 1.6754, test_f1: 0.5355
 epoch: 45, train_loss: 0.4351, test_loss: 1.8209, test_f1: 0.5154
 epoch: 46, train_loss: 0.4383, test_loss: 1.7776, test_f1: 0.5215
 epoch: 47, train_loss: 0.4674, test_loss: 1.7930, test_f1: 0.5030
 epoch: 48, train_loss: 0.4362, test_loss: 1.6727, test_f1: 0.5481
 epoch: 49, train_loss: 0.4190, test_loss: 2.0150, test_f1: 0.5235
 epoch: 50, train_loss: 0.4157, test_loss: 1.7923, test_f1: 0.5447
 epoch: 51, train_loss: 0.3893, test_loss: 1.8958, test_f1: 0.5217
 epoch: 52, train_loss: 0.3458, test_loss: 1.8651, test_f1: 0.5345
 epoch: 53, train_loss: 0.3365, test_loss: 2.2715, test_f1: 0.5343
 epoch: 54, train_loss: 0.3290, test_loss: 2.0170, test_f1: 0.5294
 epoch: 55, train_loss: 0.3176, test_loss: 2.0600, test_f1: 0.5264
 epoch: 56, train_loss: 0.2988, test_loss: 2.0314, test_f1: 0.5218
 epoch: 57, train_loss: 0.3022, test_loss: 2.0951, test_f1: 0.5024
 epoch: 58, train_loss: 0.2953, test_loss: 2.2479, test_f1: 0.5330
 epoch: 59, train_loss: 0.2838, test_loss: 2.4728, test_f1: 0.5266
 epoch: 60, train_loss: 0.3041, test_loss: 2.2408, test_f1: 0.5328
 epoch: 61, train_loss: 0.2893, test_loss: 2.2417, test_f1: 0.5090
 epoch: 62, train_loss: 0.2930, test_loss: 2.2529, test_f1: 0.5176
 epoch: 63, train_loss: 0.2890, test_loss: 2.5331, test_f1: 0.5341
 epoch: 64, train_loss: 0.2934, test_loss: 2.1735, test_f1: 0.5337
 epoch: 65, train_loss: 0.2982, test_loss: 2.4262, test_f1: 0.5227
 epoch: 66, train_loss: 0.2830, test_loss: 2.1471, test_f1: 0.5182
 epoch: 67, train_loss: 0.2783, test_loss: 2.3435, test_f1: 0.5208
 epoch: 68, train_loss: 0.2691, test_loss: 2.3655, test_f1: 0.5327
 epoch: 69, train_loss: 0.2649, test_loss: 2.5702, test_f1: 0.5240
 epoch: 70, train_loss: 0.2564, test_loss: 2.6651, test_f1: 0.5040
 epoch: 71, train_loss: 0.2556, test_loss: 2.3983, test_f1: 0.5321
 epoch: 72, train_loss: 0.2532, test_loss: 2.6944, test_f1: 0.5002
 epoch: 73, train_loss: 0.2474, test_loss: 2.6933, test_f1: 0.5316
 epoch: 74, train_loss: 0.2315, test_loss: 2.8706, test_f1: 0.5318
 epoch: 75, train_loss: 0.2428, test_loss: 2.8595, test_f1: 0.5206
 epoch: 76, train_loss: 0.2504, test_loss: 2.7923, test_f1: 0.5135
 epoch: 77, train_loss: 0.2268, test_loss: 2.7435, test_f1: 0.5216
 epoch: 78, train_loss: 0.2275, test_loss: 2.6950, test_f1: 0.5315
 epoch: 79, train_loss: 0.2499, test_loss: 2.7896, test_f1: 0.5186
 epoch: 80, train_loss: 0.2443, test_loss: 2.8937, test_f1: 0.5250
 epoch: 81, train_loss: 0.2401, test_loss: 2.8266, test_f1: 0.5134
 epoch: 82, train_loss: 0.2098, test_loss: 2.6981, test_f1: 0.5214
 epoch: 83, train_loss: 0.2490, test_loss: 3.0983, test_f1: 0.4866
 epoch: 84, train_loss: 0.2468, test_loss: 2.7509, test_f1: 0.5460
 epoch: 85, train_loss: 0.2351, test_loss: 3.0268, test_f1: 0.5327
 epoch: 86, train_loss: 0.2156, test_loss: 2.8568, test_f1: 0.5199
 epoch: 87, train_loss: 0.2288, test_loss: 2.8711, test_f1: 0.5413
 epoch: 88, train_loss: 0.2133, test_loss: 2.7510, test_f1: 0.5253
 epoch: 89, train_loss: 0.2128, test_loss: 2.9471, test_f1: 0.5316
 epoch: 90, train_loss: 0.2218, test_loss: 2.7601, test_f1: 0.5422
 epoch: 91, train_loss: 0.2169, test_loss: 2.6919, test_f1: 0.5172
 epoch: 92, train_loss: 0.2090, test_loss: 2.8958, test_f1: 0.5429
 epoch: 93, train_loss: 0.1873, test_loss: 2.9195, test_f1: 0.5587
 epoch: 94, train_loss: 0.1838, test_loss: 2.8929, test_f1: 0.5309
 epoch: 95, train_loss: 0.1961, test_loss: 2.9055, test_f1: 0.5237
 epoch: 96, train_loss: 0.1813, test_loss: 3.0009, test_f1: 0.5372
 epoch: 97, train_loss: 0.1980, test_loss: 3.2320, test_f1: 0.5463
 epoch: 98, train_loss: 0.2217, test_loss: 2.9895, test_f1: 0.5442
 epoch: 99, train_loss: 0.1941, test_loss: 2.9335, test_f1: 0.5439
##################ITERATION #4 ****************************************
 epoch: 0, train_loss: 1.3522, test_loss: 1.2428, test_f1: 0.4614
 epoch: 1, train_loss: 1.2020, test_loss: 1.1884, test_f1: 0.4790
 epoch: 2, train_loss: 1.1126, test_loss: 1.0831, test_f1: 0.4778
 epoch: 3, train_loss: 1.0692, test_loss: 1.0473, test_f1: 0.4768
 epoch: 4, train_loss: 1.0450, test_loss: 1.0282, test_f1: 0.5138
 epoch: 5, train_loss: 1.0038, test_loss: 0.9939, test_f1: 0.5200
 epoch: 6, train_loss: 0.9858, test_loss: 1.0010, test_f1: 0.5014
 epoch: 7, train_loss: 0.9670, test_loss: 0.9896, test_f1: 0.5070
 epoch: 8, train_loss: 0.9293, test_loss: 0.9765, test_f1: 0.5518
 epoch: 9, train_loss: 0.9001, test_loss: 1.0177, test_f1: 0.5141
 epoch: 10, train_loss: 0.8890, test_loss: 1.0326, test_f1: 0.5426
 epoch: 11, train_loss: 0.8634, test_loss: 1.0308, test_f1: 0.5206
 epoch: 12, train_loss: 0.8558, test_loss: 1.0339, test_f1: 0.5068
 epoch: 13, train_loss: 0.8206, test_loss: 1.0660, test_f1: 0.5284
 epoch: 14, train_loss: 0.8269, test_loss: 1.0411, test_f1: 0.5223
 epoch: 15, train_loss: 0.7988, test_loss: 1.0465, test_f1: 0.5422
 epoch: 16, train_loss: 0.7740, test_loss: 1.1106, test_f1: 0.5223
 epoch: 17, train_loss: 0.7676, test_loss: 1.1043, test_f1: 0.5255
 epoch: 18, train_loss: 0.7457, test_loss: 1.0666, test_f1: 0.4935
 epoch: 19, train_loss: 0.7245, test_loss: 1.2325, test_f1: 0.5044
 epoch: 20, train_loss: 0.7149, test_loss: 1.2714, test_f1: 0.5113
 epoch: 21, train_loss: 0.7149, test_loss: 1.2535, test_f1: 0.5169
 epoch: 22, train_loss: 0.6808, test_loss: 1.2583, test_f1: 0.5149
 epoch: 23, train_loss: 0.7011, test_loss: 1.0788, test_f1: 0.5482
 epoch: 24, train_loss: 0.6846, test_loss: 1.2947, test_f1: 0.5377
 epoch: 25, train_loss: 0.6666, test_loss: 1.1503, test_f1: 0.5648
 epoch: 26, train_loss: 0.6686, test_loss: 1.2972, test_f1: 0.5220
 epoch: 27, train_loss: 0.6321, test_loss: 1.1929, test_f1: 0.5653
 epoch: 28, train_loss: 0.6127, test_loss: 1.2014, test_f1: 0.5340
 epoch: 29, train_loss: 0.6040, test_loss: 1.3738, test_f1: 0.5390
 epoch: 30, train_loss: 0.6073, test_loss: 1.4259, test_f1: 0.5145
 epoch: 31, train_loss: 0.5788, test_loss: 1.2165, test_f1: 0.5276
 epoch: 32, train_loss: 0.5826, test_loss: 1.5651, test_f1: 0.5260
 epoch: 33, train_loss: 0.5573, test_loss: 1.3391, test_f1: 0.5503
 epoch: 34, train_loss: 0.5798, test_loss: 1.6255, test_f1: 0.5411
 epoch: 35, train_loss: 0.5711, test_loss: 1.2931, test_f1: 0.5841
 epoch: 36, train_loss: 0.5407, test_loss: 1.5091, test_f1: 0.5546
 epoch: 37, train_loss: 0.5309, test_loss: 1.7276, test_f1: 0.5300
 epoch: 38, train_loss: 0.5182, test_loss: 1.5451, test_f1: 0.5329
 epoch: 39, train_loss: 0.5040, test_loss: 1.5693, test_f1: 0.5538
 epoch: 40, train_loss: 0.5016, test_loss: 1.5091, test_f1: 0.5489
 epoch: 41, train_loss: 0.4945, test_loss: 1.7754, test_f1: 0.5099
 epoch: 42, train_loss: 0.4871, test_loss: 1.6803, test_f1: 0.5277
 epoch: 43, train_loss: 0.4875, test_loss: 1.6536, test_f1: 0.5136
 epoch: 44, train_loss: 0.4982, test_loss: 1.9959, test_f1: 0.5270
 epoch: 45, train_loss: 0.4654, test_loss: 1.7463, test_f1: 0.5376
 epoch: 46, train_loss: 0.5025, test_loss: 1.6488, test_f1: 0.5640
 epoch: 47, train_loss: 0.4706, test_loss: 1.6501, test_f1: 0.5517
 epoch: 48, train_loss: 0.4735, test_loss: 1.5481, test_f1: 0.5576
 epoch: 49, train_loss: 0.4550, test_loss: 1.5644, test_f1: 0.5675
 epoch: 50, train_loss: 0.4291, test_loss: 1.7317, test_f1: 0.5528
 epoch: 51, train_loss: 0.3867, test_loss: 1.7134, test_f1: 0.5365
 epoch: 52, train_loss: 0.3551, test_loss: 1.7386, test_f1: 0.5531
 epoch: 53, train_loss: 0.3386, test_loss: 1.8739, test_f1: 0.5381
 epoch: 54, train_loss: 0.3475, test_loss: 2.1109, test_f1: 0.5295
 epoch: 55, train_loss: 0.3378, test_loss: 1.7630, test_f1: 0.5661
 epoch: 56, train_loss: 0.3298, test_loss: 1.8792, test_f1: 0.5348
 epoch: 57, train_loss: 0.3257, test_loss: 2.1707, test_f1: 0.5235
 epoch: 58, train_loss: 0.2998, test_loss: 2.0862, test_f1: 0.5307
 epoch: 59, train_loss: 0.3296, test_loss: 1.8968, test_f1: 0.5511
 epoch: 60, train_loss: 0.3216, test_loss: 2.1734, test_f1: 0.5268
 epoch: 61, train_loss: 0.3123, test_loss: 2.0398, test_f1: 0.5445
 epoch: 62, train_loss: 0.3092, test_loss: 1.8795, test_f1: 0.5413
 epoch: 63, train_loss: 0.3037, test_loss: 2.0947, test_f1: 0.5481
 epoch: 64, train_loss: 0.2961, test_loss: 2.0996, test_f1: 0.5204
 epoch: 65, train_loss: 0.2924, test_loss: 2.2313, test_f1: 0.5267
 epoch: 66, train_loss: 0.2970, test_loss: 2.0616, test_f1: 0.5568
 epoch: 67, train_loss: 0.2957, test_loss: 2.2034, test_f1: 0.5150
 epoch: 68, train_loss: 0.2986, test_loss: 2.0127, test_f1: 0.5502
 epoch: 69, train_loss: 0.2924, test_loss: 2.1567, test_f1: 0.5313
 epoch: 70, train_loss: 0.2733, test_loss: 2.0621, test_f1: 0.5575
 epoch: 71, train_loss: 0.2886, test_loss: 2.0384, test_f1: 0.5600
 epoch: 72, train_loss: 0.2587, test_loss: 2.2499, test_f1: 0.5248
 epoch: 73, train_loss: 0.2676, test_loss: 2.2995, test_f1: 0.5352
 epoch: 74, train_loss: 0.2757, test_loss: 2.2620, test_f1: 0.5673
 epoch: 75, train_loss: 0.2567, test_loss: 2.1985, test_f1: 0.5270
 epoch: 76, train_loss: 0.2717, test_loss: 2.0907, test_f1: 0.5639
 epoch: 77, train_loss: 0.2871, test_loss: 2.2608, test_f1: 0.5113
 epoch: 78, train_loss: 0.2640, test_loss: 2.2008, test_f1: 0.5615
 epoch: 79, train_loss: 0.2669, test_loss: 2.2274, test_f1: 0.5357
 epoch: 80, train_loss: 0.2443, test_loss: 2.2435, test_f1: 0.5455
 epoch: 81, train_loss: 0.2415, test_loss: 2.3194, test_f1: 0.5333
 epoch: 82, train_loss: 0.2429, test_loss: 2.3467, test_f1: 0.5470
 epoch: 83, train_loss: 0.2398, test_loss: 2.2816, test_f1: 0.5337
 epoch: 84, train_loss: 0.2415, test_loss: 2.4994, test_f1: 0.5130
 epoch: 85, train_loss: 0.2362, test_loss: 2.4751, test_f1: 0.5427
 epoch: 86, train_loss: 0.2302, test_loss: 2.2986, test_f1: 0.5228
 epoch: 87, train_loss: 0.2467, test_loss: 2.3749, test_f1: 0.5470
 epoch: 88, train_loss: 0.2272, test_loss: 2.4670, test_f1: 0.5261
 epoch: 89, train_loss: 0.2246, test_loss: 2.4028, test_f1: 0.5542
 epoch: 90, train_loss: 0.2127, test_loss: 2.6234, test_f1: 0.5127
 epoch: 91, train_loss: 0.2112, test_loss: 2.5749, test_f1: 0.5119
 epoch: 92, train_loss: 0.2282, test_loss: 2.4501, test_f1: 0.5236
 epoch: 93, train_loss: 0.2171, test_loss: 2.6036, test_f1: 0.5344
 epoch: 94, train_loss: 0.2203, test_loss: 2.4652, test_f1: 0.5298
 epoch: 95, train_loss: 0.2319, test_loss: 2.3015, test_f1: 0.5612
 epoch: 96, train_loss: 0.2191, test_loss: 2.4828, test_f1: 0.5366
 epoch: 97, train_loss: 0.2106, test_loss: 2.5228, test_f1: 0.5296
 epoch: 98, train_loss: 0.2190, test_loss: 2.5676, test_f1: 0.5427
 epoch: 99, train_loss: 0.2374, test_loss: 2.7537, test_f1: 0.5407
##################ITERATION #5 ****************************************
 epoch: 0, train_loss: 1.4186, test_loss: 1.3964, test_f1: 0.3755
 epoch: 1, train_loss: 1.2379, test_loss: 1.1991, test_f1: 0.4675
 epoch: 2, train_loss: 1.1668, test_loss: 1.1259, test_f1: 0.4208
 epoch: 3, train_loss: 1.0994, test_loss: 1.0870, test_f1: 0.4596
 epoch: 4, train_loss: 1.0604, test_loss: 1.0329, test_f1: 0.4760
 epoch: 5, train_loss: 1.0122, test_loss: 1.0086, test_f1: 0.5062
 epoch: 6, train_loss: 1.0031, test_loss: 1.0303, test_f1: 0.4742
 epoch: 7, train_loss: 0.9723, test_loss: 0.9867, test_f1: 0.4960
 epoch: 8, train_loss: 0.9372, test_loss: 1.0328, test_f1: 0.4852
 epoch: 9, train_loss: 0.9218, test_loss: 1.2890, test_f1: 0.4550
 epoch: 10, train_loss: 0.8942, test_loss: 0.9698, test_f1: 0.5292
 epoch: 11, train_loss: 0.8842, test_loss: 0.9383, test_f1: 0.5700
 epoch: 12, train_loss: 0.8499, test_loss: 1.0580, test_f1: 0.5011
 epoch: 13, train_loss: 0.8380, test_loss: 1.0794, test_f1: 0.5030
 epoch: 14, train_loss: 0.8234, test_loss: 0.9807, test_f1: 0.5403
 epoch: 15, train_loss: 0.8036, test_loss: 0.9981, test_f1: 0.5284
 epoch: 16, train_loss: 0.7800, test_loss: 1.0193, test_f1: 0.5303
 epoch: 17, train_loss: 0.7776, test_loss: 1.2919, test_f1: 0.4752
 epoch: 18, train_loss: 0.7671, test_loss: 1.0326, test_f1: 0.5534
 epoch: 19, train_loss: 0.7611, test_loss: 1.0326, test_f1: 0.5204
 epoch: 20, train_loss: 0.7471, test_loss: 1.0511, test_f1: 0.5290
 epoch: 21, train_loss: 0.7036, test_loss: 1.1422, test_f1: 0.5309
 epoch: 22, train_loss: 0.6918, test_loss: 1.1533, test_f1: 0.5262
 epoch: 23, train_loss: 0.6558, test_loss: 1.0927, test_f1: 0.5346
 epoch: 24, train_loss: 0.6741, test_loss: 1.3592, test_f1: 0.5249
 epoch: 25, train_loss: 0.6814, test_loss: 1.1042, test_f1: 0.5363
 epoch: 26, train_loss: 0.6529, test_loss: 1.2911, test_f1: 0.5182
 epoch: 27, train_loss: 0.6635, test_loss: 1.2445, test_f1: 0.5150
 epoch: 28, train_loss: 0.6453, test_loss: 1.5146, test_f1: 0.5031
 epoch: 29, train_loss: 0.6421, test_loss: 1.4943, test_f1: 0.5001
 epoch: 30, train_loss: 0.6070, test_loss: 1.3149, test_f1: 0.4940
 epoch: 31, train_loss: 0.5882, test_loss: 1.3034, test_f1: 0.5358
 epoch: 32, train_loss: 0.5892, test_loss: 1.4667, test_f1: 0.5077
 epoch: 33, train_loss: 0.5726, test_loss: 1.3134, test_f1: 0.5445
 epoch: 34, train_loss: 0.5310, test_loss: 1.3101, test_f1: 0.5293
 epoch: 35, train_loss: 0.5378, test_loss: 1.3803, test_f1: 0.4948
 epoch: 36, train_loss: 0.5463, test_loss: 1.6020, test_f1: 0.5194
 epoch: 37, train_loss: 0.5538, test_loss: 1.4766, test_f1: 0.5428
 epoch: 38, train_loss: 0.5511, test_loss: 1.5147, test_f1: 0.5299
 epoch: 39, train_loss: 0.5194, test_loss: 1.5054, test_f1: 0.5371
 epoch: 40, train_loss: 0.5050, test_loss: 1.5748, test_f1: 0.5188
 epoch: 41, train_loss: 0.5117, test_loss: 1.4818, test_f1: 0.5249
 epoch: 42, train_loss: 0.5012, test_loss: 1.5388, test_f1: 0.5277
 epoch: 43, train_loss: 0.4928, test_loss: 1.5458, test_f1: 0.5371
 epoch: 44, train_loss: 0.4769, test_loss: 1.5737, test_f1: 0.5018
 epoch: 45, train_loss: 0.4569, test_loss: 1.5229, test_f1: 0.5378
 epoch: 46, train_loss: 0.4660, test_loss: 1.4494, test_f1: 0.5399
 epoch: 47, train_loss: 0.4516, test_loss: 1.8369, test_f1: 0.5148
 epoch: 48, train_loss: 0.4767, test_loss: 1.5650, test_f1: 0.5228
 epoch: 49, train_loss: 0.4666, test_loss: 1.7357, test_f1: 0.5128
 epoch: 50, train_loss: 0.4445, test_loss: 1.6735, test_f1: 0.5410
 epoch: 51, train_loss: 0.4005, test_loss: 1.7108, test_f1: 0.5289
 epoch: 52, train_loss: 0.3553, test_loss: 1.7372, test_f1: 0.5243
 epoch: 53, train_loss: 0.3556, test_loss: 1.8240, test_f1: 0.5386
 epoch: 54, train_loss: 0.3359, test_loss: 1.8020, test_f1: 0.5259
 epoch: 55, train_loss: 0.3361, test_loss: 1.9999, test_f1: 0.5284
 epoch: 56, train_loss: 0.3169, test_loss: 2.0535, test_f1: 0.5258
 epoch: 57, train_loss: 0.3262, test_loss: 2.1411, test_f1: 0.5166
 epoch: 58, train_loss: 0.3349, test_loss: 1.9574, test_f1: 0.5342
 epoch: 59, train_loss: 0.3168, test_loss: 2.0539, test_f1: 0.5168
 epoch: 60, train_loss: 0.3134, test_loss: 2.2446, test_f1: 0.5299
 epoch: 61, train_loss: 0.3198, test_loss: 2.0455, test_f1: 0.5196
 epoch: 62, train_loss: 0.3265, test_loss: 2.0456, test_f1: 0.5385
 epoch: 63, train_loss: 0.3280, test_loss: 1.9609, test_f1: 0.5414
 epoch: 64, train_loss: 0.3087, test_loss: 2.2497, test_f1: 0.5351
 epoch: 65, train_loss: 0.2871, test_loss: 2.1617, test_f1: 0.5387
 epoch: 66, train_loss: 0.2838, test_loss: 2.2907, test_f1: 0.5272
 epoch: 67, train_loss: 0.2698, test_loss: 2.1840, test_f1: 0.5341
 epoch: 68, train_loss: 0.2742, test_loss: 2.4625, test_f1: 0.5337
 epoch: 69, train_loss: 0.2830, test_loss: 2.1835, test_f1: 0.5341
 epoch: 70, train_loss: 0.2841, test_loss: 2.2708, test_f1: 0.5342
 epoch: 71, train_loss: 0.2749, test_loss: 2.2778, test_f1: 0.5381
 epoch: 72, train_loss: 0.2747, test_loss: 2.3355, test_f1: 0.5404
 epoch: 73, train_loss: 0.2742, test_loss: 2.3036, test_f1: 0.5196
 epoch: 74, train_loss: 0.2757, test_loss: 2.4634, test_f1: 0.5369
 epoch: 75, train_loss: 0.2862, test_loss: 2.0693, test_f1: 0.5544
 epoch: 76, train_loss: 0.2715, test_loss: 2.2305, test_f1: 0.5362
 epoch: 77, train_loss: 0.2572, test_loss: 2.3716, test_f1: 0.5365
 epoch: 78, train_loss: 0.2610, test_loss: 2.3620, test_f1: 0.5500
 epoch: 79, train_loss: 0.2601, test_loss: 2.4170, test_f1: 0.5285
 epoch: 80, train_loss: 0.2613, test_loss: 2.3432, test_f1: 0.5570
 epoch: 81, train_loss: 0.2516, test_loss: 2.4233, test_f1: 0.5325
 epoch: 82, train_loss: 0.2515, test_loss: 2.6284, test_f1: 0.5195
 epoch: 83, train_loss: 0.2734, test_loss: 2.4921, test_f1: 0.5376
 epoch: 84, train_loss: 0.2764, test_loss: 2.4546, test_f1: 0.5271
 epoch: 85, train_loss: 0.2760, test_loss: 2.4353, test_f1: 0.5308
 epoch: 86, train_loss: 0.2622, test_loss: 2.3397, test_f1: 0.5297
 epoch: 87, train_loss: 0.2385, test_loss: 2.3104, test_f1: 0.5420
 epoch: 88, train_loss: 0.2308, test_loss: 2.3663, test_f1: 0.5213
 epoch: 89, train_loss: 0.2264, test_loss: 2.7313, test_f1: 0.5291
 epoch: 90, train_loss: 0.2179, test_loss: 2.6323, test_f1: 0.5306
 epoch: 91, train_loss: 0.2228, test_loss: 2.6843, test_f1: 0.5370
 epoch: 92, train_loss: 0.2181, test_loss: 2.4766, test_f1: 0.5491
 epoch: 93, train_loss: 0.2214, test_loss: 2.7180, test_f1: 0.5176
 epoch: 94, train_loss: 0.2317, test_loss: 2.7368, test_f1: 0.5156
 epoch: 95, train_loss: 0.2015, test_loss: 2.6325, test_f1: 0.5418
 epoch: 96, train_loss: 0.2122, test_loss: 2.6711, test_f1: 0.5385
 epoch: 97, train_loss: 0.1931, test_loss: 2.6462, test_f1: 0.5240
 epoch: 98, train_loss: 0.2030, test_loss: 2.8767, test_f1: 0.5419
 epoch: 99, train_loss: 0.2005, test_loss: 2.8056, test_f1: 0.5284
##################ITERATION #6 ****************************************
 epoch: 0, train_loss: 1.5019, test_loss: 1.2728, test_f1: 0.4022
 epoch: 1, train_loss: 1.2297, test_loss: 1.1834, test_f1: 0.4258
 epoch: 2, train_loss: 1.1359, test_loss: 1.0936, test_f1: 0.4770
 epoch: 3, train_loss: 1.0687, test_loss: 1.0565, test_f1: 0.4703
 epoch: 4, train_loss: 1.0207, test_loss: 0.9876, test_f1: 0.4933
 epoch: 5, train_loss: 0.9741, test_loss: 1.0007, test_f1: 0.5062
 epoch: 6, train_loss: 0.9417, test_loss: 0.9619, test_f1: 0.5442
 epoch: 7, train_loss: 0.9157, test_loss: 0.9732, test_f1: 0.5374
 epoch: 8, train_loss: 0.9068, test_loss: 1.0221, test_f1: 0.5087
 epoch: 9, train_loss: 0.8820, test_loss: 0.9580, test_f1: 0.5482
 epoch: 10, train_loss: 0.8514, test_loss: 1.0069, test_f1: 0.5109
 epoch: 11, train_loss: 0.8366, test_loss: 0.9423, test_f1: 0.5425
 epoch: 12, train_loss: 0.8216, test_loss: 1.0263, test_f1: 0.5324
 epoch: 13, train_loss: 0.7991, test_loss: 1.0262, test_f1: 0.5087
 epoch: 14, train_loss: 0.7884, test_loss: 0.9929, test_f1: 0.5391
 epoch: 15, train_loss: 0.7719, test_loss: 1.0193, test_f1: 0.5446
 epoch: 16, train_loss: 0.7512, test_loss: 1.1200, test_f1: 0.5334
 epoch: 17, train_loss: 0.7348, test_loss: 1.0370, test_f1: 0.5562
 epoch: 18, train_loss: 0.7182, test_loss: 1.2017, test_f1: 0.5664
 epoch: 19, train_loss: 0.7071, test_loss: 1.0759, test_f1: 0.5478
 epoch: 20, train_loss: 0.6791, test_loss: 1.0819, test_f1: 0.5594
 epoch: 21, train_loss: 0.6955, test_loss: 1.2344, test_f1: 0.5460
 epoch: 22, train_loss: 0.6649, test_loss: 1.0556, test_f1: 0.5865
 epoch: 23, train_loss: 0.6673, test_loss: 1.1092, test_f1: 0.5531
 epoch: 24, train_loss: 0.6591, test_loss: 1.1074, test_f1: 0.5679
 epoch: 25, train_loss: 0.6418, test_loss: 1.2534, test_f1: 0.5280
 epoch: 26, train_loss: 0.6211, test_loss: 1.2792, test_f1: 0.5581
 epoch: 27, train_loss: 0.6314, test_loss: 1.3761, test_f1: 0.5268
 epoch: 28, train_loss: 0.6088, test_loss: 1.2229, test_f1: 0.5729
 epoch: 29, train_loss: 0.5851, test_loss: 1.2034, test_f1: 0.5657
 epoch: 30, train_loss: 0.5670, test_loss: 1.4295, test_f1: 0.5563
 epoch: 31, train_loss: 0.5637, test_loss: 1.3603, test_f1: 0.5359
 epoch: 32, train_loss: 0.5749, test_loss: 1.3929, test_f1: 0.5405
 epoch: 33, train_loss: 0.5494, test_loss: 1.4191, test_f1: 0.5634
 epoch: 34, train_loss: 0.5378, test_loss: 1.6149, test_f1: 0.5155
 epoch: 35, train_loss: 0.5500, test_loss: 1.5830, test_f1: 0.5592
 epoch: 36, train_loss: 0.5286, test_loss: 1.2312, test_f1: 0.5831
 epoch: 37, train_loss: 0.5372, test_loss: 1.4426, test_f1: 0.5585
 epoch: 38, train_loss: 0.5196, test_loss: 1.4462, test_f1: 0.5446
 epoch: 39, train_loss: 0.4955, test_loss: 1.7101, test_f1: 0.5367
 epoch: 40, train_loss: 0.4899, test_loss: 1.6119, test_f1: 0.5599
 epoch: 41, train_loss: 0.4902, test_loss: 1.6277, test_f1: 0.5483
 epoch: 42, train_loss: 0.4814, test_loss: 1.4877, test_f1: 0.5615
 epoch: 43, train_loss: 0.4644, test_loss: 1.6039, test_f1: 0.5514
 epoch: 44, train_loss: 0.4580, test_loss: 1.6020, test_f1: 0.5193
 epoch: 45, train_loss: 0.4706, test_loss: 1.7111, test_f1: 0.5436
 epoch: 46, train_loss: 0.4816, test_loss: 1.6588, test_f1: 0.5660
 epoch: 47, train_loss: 0.4730, test_loss: 1.4527, test_f1: 0.5484
 epoch: 48, train_loss: 0.4688, test_loss: 1.6408, test_f1: 0.5277
 epoch: 49, train_loss: 0.4435, test_loss: 1.5280, test_f1: 0.5584
 epoch: 50, train_loss: 0.4172, test_loss: 1.5562, test_f1: 0.5621
 epoch: 51, train_loss: 0.3649, test_loss: 1.6178, test_f1: 0.5575
 epoch: 52, train_loss: 0.3444, test_loss: 1.7468, test_f1: 0.5585
 epoch: 53, train_loss: 0.3417, test_loss: 1.7975, test_f1: 0.5458
 epoch: 54, train_loss: 0.3401, test_loss: 1.7319, test_f1: 0.5532
 epoch: 55, train_loss: 0.3296, test_loss: 1.6586, test_f1: 0.5763
 epoch: 56, train_loss: 0.3087, test_loss: 1.8498, test_f1: 0.5523
 epoch: 57, train_loss: 0.3057, test_loss: 1.8147, test_f1: 0.5694
 epoch: 58, train_loss: 0.3074, test_loss: 1.9480, test_f1: 0.5651
 epoch: 59, train_loss: 0.3128, test_loss: 1.9764, test_f1: 0.5412
 epoch: 60, train_loss: 0.3021, test_loss: 1.9775, test_f1: 0.5590
 epoch: 61, train_loss: 0.2901, test_loss: 2.0188, test_f1: 0.5484
 epoch: 62, train_loss: 0.2840, test_loss: 1.9971, test_f1: 0.5490
 epoch: 63, train_loss: 0.2767, test_loss: 1.9988, test_f1: 0.5546
 epoch: 64, train_loss: 0.2846, test_loss: 2.1039, test_f1: 0.5866
 epoch: 65, train_loss: 0.2767, test_loss: 2.1698, test_f1: 0.5224
 epoch: 66, train_loss: 0.2882, test_loss: 2.1727, test_f1: 0.5572
 epoch: 67, train_loss: 0.2760, test_loss: 2.1877, test_f1: 0.5438
 epoch: 68, train_loss: 0.2720, test_loss: 2.0928, test_f1: 0.5528
 epoch: 69, train_loss: 0.2890, test_loss: 2.0143, test_f1: 0.5284
 epoch: 70, train_loss: 0.2745, test_loss: 2.0450, test_f1: 0.5577
 epoch: 71, train_loss: 0.2533, test_loss: 2.1152, test_f1: 0.5505
 epoch: 72, train_loss: 0.2514, test_loss: 2.0206, test_f1: 0.5606
 epoch: 73, train_loss: 0.2390, test_loss: 2.1601, test_f1: 0.5509
 epoch: 74, train_loss: 0.2608, test_loss: 2.1204, test_f1: 0.5651
 epoch: 75, train_loss: 0.2630, test_loss: 2.1939, test_f1: 0.5366
 epoch: 76, train_loss: 0.2522, test_loss: 2.0676, test_f1: 0.5748
 epoch: 77, train_loss: 0.2315, test_loss: 2.2130, test_f1: 0.5447
 epoch: 78, train_loss: 0.2284, test_loss: 2.3179, test_f1: 0.5382
 epoch: 79, train_loss: 0.2249, test_loss: 2.2655, test_f1: 0.5520
 epoch: 80, train_loss: 0.2207, test_loss: 2.2351, test_f1: 0.5764
 epoch: 81, train_loss: 0.2274, test_loss: 2.1374, test_f1: 0.5516
 epoch: 82, train_loss: 0.2172, test_loss: 2.4671, test_f1: 0.5559
 epoch: 83, train_loss: 0.2232, test_loss: 2.3735, test_f1: 0.5609
 epoch: 84, train_loss: 0.2147, test_loss: 2.3677, test_f1: 0.5792
 epoch: 85, train_loss: 0.2325, test_loss: 2.3495, test_f1: 0.5387
 epoch: 86, train_loss: 0.2312, test_loss: 2.5373, test_f1: 0.5235
 epoch: 87, train_loss: 0.2333, test_loss: 2.4776, test_f1: 0.5712
 epoch: 88, train_loss: 0.2302, test_loss: 2.4633, test_f1: 0.5333
 epoch: 89, train_loss: 0.2115, test_loss: 2.4328, test_f1: 0.5253
 epoch: 90, train_loss: 0.2048, test_loss: 2.5042, test_f1: 0.5697
 epoch: 91, train_loss: 0.1958, test_loss: 2.3924, test_f1: 0.5545
 epoch: 92, train_loss: 0.1987, test_loss: 2.4706, test_f1: 0.5607
 epoch: 93, train_loss: 0.2031, test_loss: 2.5654, test_f1: 0.5472
 epoch: 94, train_loss: 0.1935, test_loss: 2.5043, test_f1: 0.5438
 epoch: 95, train_loss: 0.1907, test_loss: 2.5333, test_f1: 0.5396
 epoch: 96, train_loss: 0.1979, test_loss: 2.6065, test_f1: 0.5520
 epoch: 97, train_loss: 0.1910, test_loss: 2.5174, test_f1: 0.5339
 epoch: 98, train_loss: 0.2265, test_loss: 2.4510, test_f1: 0.5442
 epoch: 99, train_loss: 0.2172, test_loss: 2.1866, test_f1: 0.5651
##################ITERATION #7 ****************************************
 epoch: 0, train_loss: 1.4602, test_loss: 1.3083, test_f1: 0.3298
 epoch: 1, train_loss: 1.1902, test_loss: 1.2664, test_f1: 0.3379
 epoch: 2, train_loss: 1.0921, test_loss: 1.1974, test_f1: 0.4286
 epoch: 3, train_loss: 1.0434, test_loss: 1.0634, test_f1: 0.4822
 epoch: 4, train_loss: 0.9852, test_loss: 1.0101, test_f1: 0.4933
 epoch: 5, train_loss: 0.9525, test_loss: 1.0066, test_f1: 0.4788
 epoch: 6, train_loss: 0.9238, test_loss: 0.9761, test_f1: 0.5097
 epoch: 7, train_loss: 0.9036, test_loss: 1.0415, test_f1: 0.4596
 epoch: 8, train_loss: 0.8740, test_loss: 0.9867, test_f1: 0.4913
 epoch: 9, train_loss: 0.8674, test_loss: 1.0626, test_f1: 0.5154
 epoch: 10, train_loss: 0.8405, test_loss: 1.0010, test_f1: 0.5273
 epoch: 11, train_loss: 0.8274, test_loss: 1.0324, test_f1: 0.5099
 epoch: 12, train_loss: 0.7975, test_loss: 1.0796, test_f1: 0.5080
 epoch: 13, train_loss: 0.7796, test_loss: 1.1327, test_f1: 0.4907
 epoch: 14, train_loss: 0.7481, test_loss: 0.9824, test_f1: 0.5343
 epoch: 15, train_loss: 0.7440, test_loss: 1.0538, test_f1: 0.5019
 epoch: 16, train_loss: 0.7447, test_loss: 1.1050, test_f1: 0.5527
 epoch: 17, train_loss: 0.7106, test_loss: 1.1087, test_f1: 0.5197
 epoch: 18, train_loss: 0.6943, test_loss: 1.0858, test_f1: 0.5534
 epoch: 19, train_loss: 0.6877, test_loss: 1.1504, test_f1: 0.5168
 epoch: 20, train_loss: 0.6955, test_loss: 1.2841, test_f1: 0.4825
 epoch: 21, train_loss: 0.6844, test_loss: 1.1655, test_f1: 0.5273
 epoch: 22, train_loss: 0.6771, test_loss: 1.2053, test_f1: 0.5436
 epoch: 23, train_loss: 0.6397, test_loss: 1.1936, test_f1: 0.5332
 epoch: 24, train_loss: 0.6502, test_loss: 1.3169, test_f1: 0.5481
 epoch: 25, train_loss: 0.6473, test_loss: 1.1614, test_f1: 0.5324
 epoch: 26, train_loss: 0.6094, test_loss: 1.2561, test_f1: 0.5486
 epoch: 27, train_loss: 0.5958, test_loss: 1.3185, test_f1: 0.5350
 epoch: 28, train_loss: 0.5793, test_loss: 1.3617, test_f1: 0.5296
 epoch: 29, train_loss: 0.5775, test_loss: 1.3991, test_f1: 0.5466
 epoch: 30, train_loss: 0.5468, test_loss: 1.1822, test_f1: 0.5844
 epoch: 31, train_loss: 0.5436, test_loss: 1.5526, test_f1: 0.4954
 epoch: 32, train_loss: 0.5305, test_loss: 1.4946, test_f1: 0.5362
 epoch: 33, train_loss: 0.5314, test_loss: 1.4086, test_f1: 0.5611
 epoch: 34, train_loss: 0.5094, test_loss: 1.4190, test_f1: 0.5231
 epoch: 35, train_loss: 0.5198, test_loss: 1.4640, test_f1: 0.5259
 epoch: 36, train_loss: 0.5220, test_loss: 1.4285, test_f1: 0.5527
 epoch: 37, train_loss: 0.5187, test_loss: 1.2419, test_f1: 0.5765
 epoch: 38, train_loss: 0.4984, test_loss: 1.4915, test_f1: 0.5406
 epoch: 39, train_loss: 0.4830, test_loss: 1.5202, test_f1: 0.5400
 epoch: 40, train_loss: 0.4517, test_loss: 1.6948, test_f1: 0.5201
 epoch: 41, train_loss: 0.4740, test_loss: 1.5029, test_f1: 0.5466
 epoch: 42, train_loss: 0.4663, test_loss: 1.3472, test_f1: 0.5675
 epoch: 43, train_loss: 0.4533, test_loss: 1.6580, test_f1: 0.5438
 epoch: 44, train_loss: 0.4581, test_loss: 1.5629, test_f1: 0.5617
 epoch: 45, train_loss: 0.4478, test_loss: 1.6281, test_f1: 0.5481
 epoch: 46, train_loss: 0.4320, test_loss: 1.9217, test_f1: 0.5337
 epoch: 47, train_loss: 0.4239, test_loss: 1.4883, test_f1: 0.5703
 epoch: 48, train_loss: 0.4336, test_loss: 1.7758, test_f1: 0.5316
 epoch: 49, train_loss: 0.4157, test_loss: 1.9903, test_f1: 0.5355
 epoch: 50, train_loss: 0.3931, test_loss: 1.8059, test_f1: 0.5546
 epoch: 51, train_loss: 0.3639, test_loss: 2.0080, test_f1: 0.5353
 epoch: 52, train_loss: 0.3321, test_loss: 1.8597, test_f1: 0.5402
 epoch: 53, train_loss: 0.3157, test_loss: 1.9639, test_f1: 0.5436
 epoch: 54, train_loss: 0.2999, test_loss: 1.9954, test_f1: 0.5305
 epoch: 55, train_loss: 0.2887, test_loss: 1.9954, test_f1: 0.5428
 epoch: 56, train_loss: 0.2920, test_loss: 2.1285, test_f1: 0.5309
 epoch: 57, train_loss: 0.2905, test_loss: 2.0978, test_f1: 0.5568
 epoch: 58, train_loss: 0.2805, test_loss: 1.9975, test_f1: 0.5426
 epoch: 59, train_loss: 0.2706, test_loss: 2.1512, test_f1: 0.5457
 epoch: 60, train_loss: 0.2691, test_loss: 2.2870, test_f1: 0.5225
 epoch: 61, train_loss: 0.2664, test_loss: 2.1437, test_f1: 0.5453
 epoch: 62, train_loss: 0.2598, test_loss: 2.3118, test_f1: 0.5351
 epoch: 63, train_loss: 0.2914, test_loss: 2.2336, test_f1: 0.5500
 epoch: 64, train_loss: 0.2877, test_loss: 2.2164, test_f1: 0.5497
 epoch: 65, train_loss: 0.2781, test_loss: 2.2858, test_f1: 0.5249
 epoch: 66, train_loss: 0.2588, test_loss: 2.2203, test_f1: 0.5435
 epoch: 67, train_loss: 0.2782, test_loss: 2.3164, test_f1: 0.5425
 epoch: 68, train_loss: 0.2627, test_loss: 2.3050, test_f1: 0.5431
 epoch: 69, train_loss: 0.2683, test_loss: 2.2745, test_f1: 0.5524
 epoch: 70, train_loss: 0.2640, test_loss: 2.1982, test_f1: 0.5469
 epoch: 71, train_loss: 0.2546, test_loss: 2.2057, test_f1: 0.5459
 epoch: 72, train_loss: 0.2473, test_loss: 2.5061, test_f1: 0.5238
 epoch: 73, train_loss: 0.2506, test_loss: 2.3736, test_f1: 0.5471
 epoch: 74, train_loss: 0.2512, test_loss: 2.2546, test_f1: 0.5590
 epoch: 75, train_loss: 0.2466, test_loss: 2.3531, test_f1: 0.5358
 epoch: 76, train_loss: 0.2395, test_loss: 2.4717, test_f1: 0.5435
 epoch: 77, train_loss: 0.2312, test_loss: 2.4357, test_f1: 0.5522
 epoch: 78, train_loss: 0.2302, test_loss: 2.5552, test_f1: 0.5564
 epoch: 79, train_loss: 0.2329, test_loss: 2.4820, test_f1: 0.5557
 epoch: 80, train_loss: 0.2175, test_loss: 2.5425, test_f1: 0.5395
 epoch: 81, train_loss: 0.2114, test_loss: 2.4865, test_f1: 0.5531
 epoch: 82, train_loss: 0.2063, test_loss: 2.5645, test_f1: 0.5474
 epoch: 83, train_loss: 0.2021, test_loss: 2.5957, test_f1: 0.5550
 epoch: 84, train_loss: 0.2076, test_loss: 2.6895, test_f1: 0.5304
 epoch: 85, train_loss: 0.2162, test_loss: 2.6622, test_f1: 0.5484
 epoch: 86, train_loss: 0.2291, test_loss: 2.5120, test_f1: 0.5725
 epoch: 87, train_loss: 0.2464, test_loss: 2.5081, test_f1: 0.5378
 epoch: 88, train_loss: 0.2243, test_loss: 2.5198, test_f1: 0.5385
 epoch: 89, train_loss: 0.2185, test_loss: 2.5440, test_f1: 0.5399
 epoch: 90, train_loss: 0.2180, test_loss: 2.6228, test_f1: 0.5443
 epoch: 91, train_loss: 0.1944, test_loss: 2.5834, test_f1: 0.5646
 epoch: 92, train_loss: 0.1856, test_loss: 2.6738, test_f1: 0.5427
 epoch: 93, train_loss: 0.1937, test_loss: 2.5130, test_f1: 0.5627
 epoch: 94, train_loss: 0.2019, test_loss: 2.5191, test_f1: 0.5603
 epoch: 95, train_loss: 0.2111, test_loss: 2.7855, test_f1: 0.5326
 epoch: 96, train_loss: 0.2223, test_loss: 2.7424, test_f1: 0.5538
 epoch: 97, train_loss: 0.2253, test_loss: 2.6195, test_f1: 0.5403
 epoch: 98, train_loss: 0.2026, test_loss: 2.6132, test_f1: 0.5218
 epoch: 99, train_loss: 0.1955, test_loss: 3.0550, test_f1: 0.5477
##################ITERATION #8 ****************************************
 epoch: 0, train_loss: 1.5954, test_loss: 1.4469, test_f1: 0.2674
 epoch: 1, train_loss: 1.2646, test_loss: 1.2870, test_f1: 0.2871
 epoch: 2, train_loss: 1.1740, test_loss: 1.1352, test_f1: 0.4367
 epoch: 3, train_loss: 1.1012, test_loss: 1.0665, test_f1: 0.4584
 epoch: 4, train_loss: 1.0545, test_loss: 1.0088, test_f1: 0.4811
 epoch: 5, train_loss: 1.0316, test_loss: 0.9729, test_f1: 0.5124
 epoch: 6, train_loss: 0.9931, test_loss: 0.9816, test_f1: 0.4851
 epoch: 7, train_loss: 0.9680, test_loss: 0.9826, test_f1: 0.4909
 epoch: 8, train_loss: 0.9417, test_loss: 1.0098, test_f1: 0.5011
 epoch: 9, train_loss: 0.9263, test_loss: 0.9742, test_f1: 0.5143
 epoch: 10, train_loss: 0.9218, test_loss: 0.9583, test_f1: 0.5383
 epoch: 11, train_loss: 0.9272, test_loss: 1.1401, test_f1: 0.4982
 epoch: 12, train_loss: 0.8879, test_loss: 0.9666, test_f1: 0.5203
 epoch: 13, train_loss: 0.8676, test_loss: 1.0752, test_f1: 0.4954
 epoch: 14, train_loss: 0.8342, test_loss: 1.0041, test_f1: 0.5137
 epoch: 15, train_loss: 0.8329, test_loss: 0.9710, test_f1: 0.5212
 epoch: 16, train_loss: 0.8165, test_loss: 1.0527, test_f1: 0.5001
 epoch: 17, train_loss: 0.8075, test_loss: 1.0869, test_f1: 0.4742
 epoch: 18, train_loss: 0.7997, test_loss: 1.0951, test_f1: 0.5080
 epoch: 19, train_loss: 0.7674, test_loss: 1.0290, test_f1: 0.5201
 epoch: 20, train_loss: 0.7536, test_loss: 1.0475, test_f1: 0.5307
 epoch: 21, train_loss: 0.7396, test_loss: 1.0421, test_f1: 0.5384
 epoch: 22, train_loss: 0.7252, test_loss: 1.1274, test_f1: 0.5301
 epoch: 23, train_loss: 0.7114, test_loss: 1.1340, test_f1: 0.5027
 epoch: 24, train_loss: 0.7107, test_loss: 1.0394, test_f1: 0.5209
 epoch: 25, train_loss: 0.6959, test_loss: 1.1059, test_f1: 0.5431
 epoch: 26, train_loss: 0.6832, test_loss: 1.0944, test_f1: 0.5268
 epoch: 27, train_loss: 0.6878, test_loss: 1.1727, test_f1: 0.5252
 epoch: 28, train_loss: 0.6762, test_loss: 1.1080, test_f1: 0.5328
 epoch: 29, train_loss: 0.6378, test_loss: 1.2129, test_f1: 0.5503
 epoch: 30, train_loss: 0.6338, test_loss: 1.3266, test_f1: 0.5459
 epoch: 31, train_loss: 0.6225, test_loss: 1.2144, test_f1: 0.5415
 epoch: 32, train_loss: 0.6267, test_loss: 1.2628, test_f1: 0.5263
 epoch: 33, train_loss: 0.6033, test_loss: 1.2296, test_f1: 0.5353
 epoch: 34, train_loss: 0.5998, test_loss: 1.3668, test_f1: 0.5161
 epoch: 35, train_loss: 0.5845, test_loss: 1.3312, test_f1: 0.5227
 epoch: 36, train_loss: 0.5694, test_loss: 1.3419, test_f1: 0.5276
 epoch: 37, train_loss: 0.5789, test_loss: 1.5405, test_f1: 0.5282
 epoch: 38, train_loss: 0.5948, test_loss: 1.1877, test_f1: 0.5740
 epoch: 39, train_loss: 0.5621, test_loss: 1.2352, test_f1: 0.5524
 epoch: 40, train_loss: 0.5631, test_loss: 1.4472, test_f1: 0.5192
 epoch: 41, train_loss: 0.5543, test_loss: 1.3277, test_f1: 0.5440
 epoch: 42, train_loss: 0.5559, test_loss: 1.2122, test_f1: 0.5256
 epoch: 43, train_loss: 0.5421, test_loss: 1.4841, test_f1: 0.5224
 epoch: 44, train_loss: 0.5280, test_loss: 1.2273, test_f1: 0.5440
 epoch: 45, train_loss: 0.5232, test_loss: 1.3625, test_f1: 0.5414
 epoch: 46, train_loss: 0.5184, test_loss: 1.5434, test_f1: 0.5351
 epoch: 47, train_loss: 0.5038, test_loss: 1.4391, test_f1: 0.5304
 epoch: 48, train_loss: 0.4911, test_loss: 1.6285, test_f1: 0.5131
 epoch: 49, train_loss: 0.4828, test_loss: 1.3472, test_f1: 0.5357
 epoch: 50, train_loss: 0.4924, test_loss: 1.5111, test_f1: 0.5103
 epoch: 51, train_loss: 0.4564, test_loss: 1.4527, test_f1: 0.5362
 epoch: 52, train_loss: 0.4018, test_loss: 1.5364, test_f1: 0.5527
 epoch: 53, train_loss: 0.3891, test_loss: 1.6099, test_f1: 0.5534
 epoch: 54, train_loss: 0.3701, test_loss: 1.7745, test_f1: 0.5233
 epoch: 55, train_loss: 0.3494, test_loss: 1.7138, test_f1: 0.5583
 epoch: 56, train_loss: 0.3497, test_loss: 1.8319, test_f1: 0.5379
 epoch: 57, train_loss: 0.3516, test_loss: 1.7796, test_f1: 0.5576
 epoch: 58, train_loss: 0.3729, test_loss: 1.8848, test_f1: 0.5234
 epoch: 59, train_loss: 0.3405, test_loss: 1.7564, test_f1: 0.5663
 epoch: 60, train_loss: 0.3370, test_loss: 1.8790, test_f1: 0.5184
 epoch: 61, train_loss: 0.3631, test_loss: 1.8089, test_f1: 0.5508
 epoch: 62, train_loss: 0.3329, test_loss: 1.7537, test_f1: 0.5701
 epoch: 63, train_loss: 0.3379, test_loss: 1.7750, test_f1: 0.5286
 epoch: 64, train_loss: 0.3255, test_loss: 1.9942, test_f1: 0.5441
 epoch: 65, train_loss: 0.3087, test_loss: 2.0519, test_f1: 0.5341
 epoch: 66, train_loss: 0.3150, test_loss: 1.9089, test_f1: 0.5586
 epoch: 67, train_loss: 0.3107, test_loss: 1.8226, test_f1: 0.5713
 epoch: 68, train_loss: 0.3175, test_loss: 1.9688, test_f1: 0.5502
 epoch: 69, train_loss: 0.3021, test_loss: 1.9178, test_f1: 0.5560
 epoch: 70, train_loss: 0.3015, test_loss: 2.0669, test_f1: 0.5513
 epoch: 71, train_loss: 0.2873, test_loss: 1.9472, test_f1: 0.5186
 epoch: 72, train_loss: 0.2911, test_loss: 2.0459, test_f1: 0.5418
 epoch: 73, train_loss: 0.2796, test_loss: 2.0406, test_f1: 0.5475
 epoch: 74, train_loss: 0.2830, test_loss: 2.0184, test_f1: 0.5671
 epoch: 75, train_loss: 0.2719, test_loss: 2.3139, test_f1: 0.5333
 epoch: 76, train_loss: 0.2446, test_loss: 2.1356, test_f1: 0.5434
 epoch: 77, train_loss: 0.2404, test_loss: 2.2416, test_f1: 0.5408
 epoch: 78, train_loss: 0.2543, test_loss: 2.2367, test_f1: 0.5612
 epoch: 79, train_loss: 0.2711, test_loss: 2.2543, test_f1: 0.5485
 epoch: 80, train_loss: 0.2885, test_loss: 2.1222, test_f1: 0.5269
 epoch: 81, train_loss: 0.2729, test_loss: 2.1123, test_f1: 0.5513
 epoch: 82, train_loss: 0.2645, test_loss: 2.0753, test_f1: 0.5590
 epoch: 83, train_loss: 0.2548, test_loss: 2.1860, test_f1: 0.5245
 epoch: 84, train_loss: 0.2439, test_loss: 2.1208, test_f1: 0.5452
 epoch: 85, train_loss: 0.2547, test_loss: 2.1301, test_f1: 0.5438
 epoch: 86, train_loss: 0.2625, test_loss: 2.2413, test_f1: 0.5597
 epoch: 87, train_loss: 0.2604, test_loss: 2.2095, test_f1: 0.5326
 epoch: 88, train_loss: 0.2365, test_loss: 2.3485, test_f1: 0.5468
 epoch: 89, train_loss: 0.2327, test_loss: 2.2917, test_f1: 0.5363
 epoch: 90, train_loss: 0.2157, test_loss: 2.2639, test_f1: 0.5579
 epoch: 91, train_loss: 0.2220, test_loss: 2.2336, test_f1: 0.5349
 epoch: 92, train_loss: 0.2409, test_loss: 2.3788, test_f1: 0.5577
 epoch: 93, train_loss: 0.2543, test_loss: 2.3012, test_f1: 0.5564
 epoch: 94, train_loss: 0.2440, test_loss: 2.3882, test_f1: 0.5569
 epoch: 95, train_loss: 0.2372, test_loss: 2.4144, test_f1: 0.5452
 epoch: 96, train_loss: 0.2331, test_loss: 2.3724, test_f1: 0.5347
 epoch: 97, train_loss: 0.2121, test_loss: 2.3278, test_f1: 0.5418
 epoch: 98, train_loss: 0.2066, test_loss: 2.4876, test_f1: 0.5272
 epoch: 99, train_loss: 0.2179, test_loss: 2.4099, test_f1: 0.5497
##################ITERATION #9 ****************************************
 epoch: 0, train_loss: 1.5667, test_loss: 1.2490, test_f1: 0.2850
 epoch: 1, train_loss: 1.2412, test_loss: 1.1616, test_f1: 0.4043
 epoch: 2, train_loss: 1.1391, test_loss: 1.1211, test_f1: 0.4422
 epoch: 3, train_loss: 1.0825, test_loss: 1.0516, test_f1: 0.4721
 epoch: 4, train_loss: 1.0511, test_loss: 1.0366, test_f1: 0.4736
 epoch: 5, train_loss: 1.0210, test_loss: 1.0085, test_f1: 0.5005
 epoch: 6, train_loss: 0.9963, test_loss: 1.0072, test_f1: 0.4632
 epoch: 7, train_loss: 0.9608, test_loss: 1.0221, test_f1: 0.4778
 epoch: 8, train_loss: 0.9407, test_loss: 1.0231, test_f1: 0.4718
 epoch: 9, train_loss: 0.9130, test_loss: 0.9882, test_f1: 0.4974
 epoch: 10, train_loss: 0.8869, test_loss: 1.0096, test_f1: 0.4964
 epoch: 11, train_loss: 0.8877, test_loss: 1.0418, test_f1: 0.4966
 epoch: 12, train_loss: 0.8560, test_loss: 1.0165, test_f1: 0.5213
 epoch: 13, train_loss: 0.8441, test_loss: 1.0955, test_f1: 0.4847
 epoch: 14, train_loss: 0.8267, test_loss: 1.0676, test_f1: 0.5222
 epoch: 15, train_loss: 0.8011, test_loss: 1.0388, test_f1: 0.5302
 epoch: 16, train_loss: 0.7965, test_loss: 1.0880, test_f1: 0.5187
 epoch: 17, train_loss: 0.8015, test_loss: 1.0760, test_f1: 0.5091
 epoch: 18, train_loss: 0.7875, test_loss: 1.0646, test_f1: 0.5250
 epoch: 19, train_loss: 0.7787, test_loss: 1.1108, test_f1: 0.4866
 epoch: 20, train_loss: 0.7325, test_loss: 1.1318, test_f1: 0.5185
 epoch: 21, train_loss: 0.7292, test_loss: 1.0959, test_f1: 0.5328
 epoch: 22, train_loss: 0.7227, test_loss: 1.2487, test_f1: 0.5006
 epoch: 23, train_loss: 0.7087, test_loss: 1.1426, test_f1: 0.5264
 epoch: 24, train_loss: 0.7063, test_loss: 1.2601, test_f1: 0.4917
 epoch: 25, train_loss: 0.6804, test_loss: 1.2571, test_f1: 0.4960
 epoch: 26, train_loss: 0.6670, test_loss: 1.1998, test_f1: 0.5395
 epoch: 27, train_loss: 0.6672, test_loss: 1.2931, test_f1: 0.5284
 epoch: 28, train_loss: 0.6653, test_loss: 1.2716, test_f1: 0.5033
 epoch: 29, train_loss: 0.6489, test_loss: 1.4033, test_f1: 0.4887
 epoch: 30, train_loss: 0.6250, test_loss: 1.2080, test_f1: 0.5278
 epoch: 31, train_loss: 0.6321, test_loss: 1.3551, test_f1: 0.5146
 epoch: 32, train_loss: 0.6433, test_loss: 1.2783, test_f1: 0.5228
 epoch: 33, train_loss: 0.6122, test_loss: 1.4126, test_f1: 0.5165
 epoch: 34, train_loss: 0.5925, test_loss: 1.3663, test_f1: 0.5497
 epoch: 35, train_loss: 0.6121, test_loss: 1.3682, test_f1: 0.5316
 epoch: 36, train_loss: 0.6093, test_loss: 1.3417, test_f1: 0.5233
 epoch: 37, train_loss: 0.5730, test_loss: 1.4141, test_f1: 0.5367
 epoch: 38, train_loss: 0.5560, test_loss: 1.4626, test_f1: 0.5286
 epoch: 39, train_loss: 0.5557, test_loss: 1.3867, test_f1: 0.5428
 epoch: 40, train_loss: 0.5622, test_loss: 1.5822, test_f1: 0.5220
 epoch: 41, train_loss: 0.5539, test_loss: 1.4564, test_f1: 0.5173
 epoch: 42, train_loss: 0.5317, test_loss: 1.4352, test_f1: 0.5177
 epoch: 43, train_loss: 0.5237, test_loss: 1.6843, test_f1: 0.5053
 epoch: 44, train_loss: 0.5247, test_loss: 1.5781, test_f1: 0.4923
 epoch: 45, train_loss: 0.5455, test_loss: 1.6036, test_f1: 0.4906
 epoch: 46, train_loss: 0.5035, test_loss: 1.6069, test_f1: 0.5165
 epoch: 47, train_loss: 0.4942, test_loss: 1.6111, test_f1: 0.5170
 epoch: 48, train_loss: 0.5051, test_loss: 1.7559, test_f1: 0.4852
 epoch: 49, train_loss: 0.5000, test_loss: 1.5468, test_f1: 0.4941
 epoch: 50, train_loss: 0.4808, test_loss: 1.5444, test_f1: 0.5527
 epoch: 51, train_loss: 0.4392, test_loss: 1.6962, test_f1: 0.5193
 epoch: 52, train_loss: 0.4154, test_loss: 1.6669, test_f1: 0.5196
 epoch: 53, train_loss: 0.3954, test_loss: 1.8180, test_f1: 0.5155
 epoch: 54, train_loss: 0.3818, test_loss: 1.8616, test_f1: 0.5223
 epoch: 55, train_loss: 0.3680, test_loss: 1.9555, test_f1: 0.5146
 epoch: 56, train_loss: 0.3611, test_loss: 1.8926, test_f1: 0.5331
 epoch: 57, train_loss: 0.3630, test_loss: 1.9311, test_f1: 0.5061
 epoch: 58, train_loss: 0.3619, test_loss: 1.8930, test_f1: 0.5331
 epoch: 59, train_loss: 0.3565, test_loss: 1.9978, test_f1: 0.5176
 epoch: 60, train_loss: 0.3372, test_loss: 1.9668, test_f1: 0.5476
 epoch: 61, train_loss: 0.3486, test_loss: 2.0496, test_f1: 0.5282
 epoch: 62, train_loss: 0.3476, test_loss: 1.8375, test_f1: 0.5343
 epoch: 63, train_loss: 0.3556, test_loss: 2.0713, test_f1: 0.5231
 epoch: 64, train_loss: 0.3502, test_loss: 1.9736, test_f1: 0.5095
 epoch: 65, train_loss: 0.3197, test_loss: 1.9361, test_f1: 0.5298
 epoch: 66, train_loss: 0.3152, test_loss: 2.2210, test_f1: 0.5095
 epoch: 67, train_loss: 0.3091, test_loss: 2.1707, test_f1: 0.5091
 epoch: 68, train_loss: 0.3129, test_loss: 2.3835, test_f1: 0.5066
 epoch: 69, train_loss: 0.3166, test_loss: 2.3428, test_f1: 0.5118
 epoch: 70, train_loss: 0.3176, test_loss: 2.3046, test_f1: 0.5180
 epoch: 71, train_loss: 0.3178, test_loss: 2.2228, test_f1: 0.5133
 epoch: 72, train_loss: 0.3340, test_loss: 2.1018, test_f1: 0.5375
 epoch: 73, train_loss: 0.3107, test_loss: 2.0754, test_f1: 0.5342
 epoch: 74, train_loss: 0.2932, test_loss: 2.3228, test_f1: 0.4991
 epoch: 75, train_loss: 0.2864, test_loss: 2.3138, test_f1: 0.5207
 epoch: 76, train_loss: 0.2876, test_loss: 2.2654, test_f1: 0.5238
 epoch: 77, train_loss: 0.2826, test_loss: 2.2314, test_f1: 0.5142
 epoch: 78, train_loss: 0.2897, test_loss: 2.3819, test_f1: 0.5144
 epoch: 79, train_loss: 0.2857, test_loss: 2.5022, test_f1: 0.5108
 epoch: 80, train_loss: 0.2721, test_loss: 2.3039, test_f1: 0.5271
 epoch: 81, train_loss: 0.2652, test_loss: 2.5476, test_f1: 0.5182
 epoch: 82, train_loss: 0.2474, test_loss: 2.4563, test_f1: 0.5197
 epoch: 83, train_loss: 0.2642, test_loss: 2.6588, test_f1: 0.5182
 epoch: 84, train_loss: 0.2626, test_loss: 2.4653, test_f1: 0.5144
 epoch: 85, train_loss: 0.2509, test_loss: 2.4247, test_f1: 0.5301
 epoch: 86, train_loss: 0.2553, test_loss: 2.4494, test_f1: 0.5193
 epoch: 87, train_loss: 0.2835, test_loss: 2.4918, test_f1: 0.5216
 epoch: 88, train_loss: 0.2658, test_loss: 2.4684, test_f1: 0.5296
 epoch: 89, train_loss: 0.2615, test_loss: 2.4288, test_f1: 0.5357
 epoch: 90, train_loss: 0.2546, test_loss: 2.4681, test_f1: 0.5125
 epoch: 91, train_loss: 0.2561, test_loss: 2.4486, test_f1: 0.5126
 epoch: 92, train_loss: 0.2422, test_loss: 2.4758, test_f1: 0.5198
 epoch: 93, train_loss: 0.2309, test_loss: 2.5170, test_f1: 0.5048
 epoch: 94, train_loss: 0.2370, test_loss: 2.6362, test_f1: 0.5059
 epoch: 95, train_loss: 0.2370, test_loss: 2.5257, test_f1: 0.5172
 epoch: 96, train_loss: 0.2443, test_loss: 2.6203, test_f1: 0.5154
 epoch: 97, train_loss: 0.2315, test_loss: 2.6963, test_f1: 0.5312
 epoch: 98, train_loss: 0.2500, test_loss: 2.4464, test_f1: 0.5202
 epoch: 99, train_loss: 0.2499, test_loss: 2.4510, test_f1: 0.5280

Training completed in 409.02 seconds
Best F1: 0.5866 at epoch 64
Mean F1 across iterations: 0.5717  0.0107
========================FINAL RESULTS================================
FEGIN weighted F1: 0.5866  0.0107
python main.py --data ltspice_examples --representation component_component --model FEGIN --layers 5 --hiddens 128 --batch_size 256 --lr 0.001 --emb_size 250 --epochs 100 --save_appendix component_component_L5_H128_BS256_LR0.001_E250 --no_val
-----



STDERR:
  File "main.py", line 370, in <module>
    main()
  File "main.py", line 254, in main
    dataset = dataset_class(
  File "/home/philip/projects/ltspice_examples_code_repo/Circuit-Completion-Using-GNNs/component_classification_with_link_prediction_head/evaluation/FEGIN/kernel/circuit_datasets.py", line 15, in __init__
    self.data, self.slices = torch.load(self.processed_paths[0])
  File "/home/philip/.local/lib/python3.8/site-packages/torch/serialization.py", line 1040, in load
    warnings.warn(
  File "/usr/lib/python3.8/warnings.py", line 109, in _showwarnmsg
    sw(msg.message, msg.category, msg.filename, msg.lineno,
  File "main.py", line 47, in warn_with_traceback
    traceback.print_stack(file=log)
/home/philip/projects/ltspice_examples_code_repo/Circuit-Completion-Using-GNNs/component_classification_with_link_prediction_head/evaluation/FEGIN/kernel/circuit_datasets.py:15: FutureWarning: You are using `torch.load` with `weights_only=False` (the current default value), which uses the default pickle module implicitly. It is possible to construct malicious pickle data which will execute arbitrary code during unpickling (See https://github.com/pytorch/pytorch/blob/main/SECURITY.md#untrusted-models for more details). In a future release, the default value for `weights_only` will be flipped to `True`. This limits the functions that could be executed during unpickling. Arbitrary objects will no longer be allowed to be loaded via this mode unless they are explicitly allowlisted by the user via `torch.serialization.add_safe_globals`. We recommend you start setting `weights_only=True` for any use case where you don't have full control of the loaded file. Please open an issue on GitHub for any issues related to this experimental feature.
  self.data, self.slices = torch.load(self.processed_paths[0])
