STDOUT:
Results will be saved in /home/philip/projects/ltspice_examples_code_repo/Circuit-Completion-Using-GNNs/component_classification_with_link_prediction_head/evaluation/FEGIN/results/model_FEGIN_dataset_ltspice_examples
Command line input: python main.py --data ltspice_examples --representation component_component --model FEGIN --layers 2 --hiddens 128 --batch_size 32 --lr 0.0001 --emb_size 250 --epochs 100 --save_appendix component_component_L2_H128_BS32_LR0.0001_E250 --no_val
 is saved.
-----
ltspice_examples - FEGIN
Using 2 layers, 128 hidden units, h = 2
Loading component_component representation dataset
ENTERED
Training FEGIN on component_component representation
Train: 3556, Test: 845
##################ITERATION #0 ****************************************
 epoch: 0, train_loss: 1.3325, test_loss: 1.2692, test_f1: 0.2274
 epoch: 1, train_loss: 1.2561, test_loss: 1.2240, test_f1: 0.2274
 epoch: 2, train_loss: 1.2238, test_loss: 1.1877, test_f1: 0.3260
 epoch: 3, train_loss: 1.1901, test_loss: 1.1613, test_f1: 0.3650
 epoch: 4, train_loss: 1.1606, test_loss: 1.1287, test_f1: 0.4588
 epoch: 5, train_loss: 1.1303, test_loss: 1.1008, test_f1: 0.4584
 epoch: 6, train_loss: 1.1047, test_loss: 1.0638, test_f1: 0.4521
 epoch: 7, train_loss: 1.0873, test_loss: 1.0459, test_f1: 0.4848
 epoch: 8, train_loss: 1.0589, test_loss: 1.0274, test_f1: 0.4843
 epoch: 9, train_loss: 1.0465, test_loss: 1.0013, test_f1: 0.4790
 epoch: 10, train_loss: 1.0249, test_loss: 0.9887, test_f1: 0.4543
 epoch: 11, train_loss: 1.0018, test_loss: 1.0025, test_f1: 0.4758
 epoch: 12, train_loss: 0.9902, test_loss: 0.9788, test_f1: 0.4929
 epoch: 13, train_loss: 0.9841, test_loss: 0.9643, test_f1: 0.5024
 epoch: 14, train_loss: 0.9592, test_loss: 0.9723, test_f1: 0.5107
 epoch: 15, train_loss: 0.9579, test_loss: 0.9813, test_f1: 0.5043
 epoch: 16, train_loss: 0.9493, test_loss: 0.9616, test_f1: 0.5165
 epoch: 17, train_loss: 0.9341, test_loss: 0.9519, test_f1: 0.5149
 epoch: 18, train_loss: 0.9314, test_loss: 0.9641, test_f1: 0.4983
 epoch: 19, train_loss: 0.9217, test_loss: 0.9404, test_f1: 0.5014
 epoch: 20, train_loss: 0.9170, test_loss: 0.9681, test_f1: 0.4925
 epoch: 21, train_loss: 0.8985, test_loss: 0.9622, test_f1: 0.5132
 epoch: 22, train_loss: 0.8968, test_loss: 0.9765, test_f1: 0.5116
 epoch: 23, train_loss: 0.8959, test_loss: 0.9657, test_f1: 0.5221
 epoch: 24, train_loss: 0.8856, test_loss: 0.9799, test_f1: 0.5292
 epoch: 25, train_loss: 0.8671, test_loss: 0.9961, test_f1: 0.5200
 epoch: 26, train_loss: 0.8720, test_loss: 0.9950, test_f1: 0.5284
 epoch: 27, train_loss: 0.8707, test_loss: 0.9887, test_f1: 0.5039
 epoch: 28, train_loss: 0.8625, test_loss: 0.9768, test_f1: 0.5173
 epoch: 29, train_loss: 0.8399, test_loss: 1.0063, test_f1: 0.5065
 epoch: 30, train_loss: 0.8465, test_loss: 0.9841, test_f1: 0.5242
 epoch: 31, train_loss: 0.8305, test_loss: 1.0472, test_f1: 0.5163
 epoch: 32, train_loss: 0.8252, test_loss: 1.0080, test_f1: 0.5289
 epoch: 33, train_loss: 0.8227, test_loss: 0.9932, test_f1: 0.5310
 epoch: 34, train_loss: 0.8176, test_loss: 1.0233, test_f1: 0.5348
 epoch: 35, train_loss: 0.8102, test_loss: 1.0441, test_f1: 0.4923
 epoch: 36, train_loss: 0.8175, test_loss: 1.0544, test_f1: 0.5068
 epoch: 37, train_loss: 0.8037, test_loss: 1.0275, test_f1: 0.5160
 epoch: 38, train_loss: 0.7995, test_loss: 1.0426, test_f1: 0.5182
 epoch: 39, train_loss: 0.7881, test_loss: 1.0439, test_f1: 0.5072
 epoch: 40, train_loss: 0.7835, test_loss: 1.1295, test_f1: 0.4818
 epoch: 41, train_loss: 0.7881, test_loss: 1.0780, test_f1: 0.5065
 epoch: 42, train_loss: 0.7790, test_loss: 1.0897, test_f1: 0.5081
 epoch: 43, train_loss: 0.7759, test_loss: 1.0671, test_f1: 0.5091
 epoch: 44, train_loss: 0.7705, test_loss: 1.0744, test_f1: 0.5132
 epoch: 45, train_loss: 0.7648, test_loss: 1.0834, test_f1: 0.5087
 epoch: 46, train_loss: 0.7571, test_loss: 1.1287, test_f1: 0.4964
 epoch: 47, train_loss: 0.7488, test_loss: 1.1137, test_f1: 0.5141
 epoch: 48, train_loss: 0.7507, test_loss: 1.0722, test_f1: 0.5235
 epoch: 49, train_loss: 0.7484, test_loss: 1.0748, test_f1: 0.5300
 epoch: 50, train_loss: 0.7314, test_loss: 1.1243, test_f1: 0.4908
 epoch: 51, train_loss: 0.7329, test_loss: 1.1766, test_f1: 0.4998
 epoch: 52, train_loss: 0.7269, test_loss: 1.1247, test_f1: 0.5087
 epoch: 53, train_loss: 0.7116, test_loss: 1.1524, test_f1: 0.5168
 epoch: 54, train_loss: 0.7009, test_loss: 1.0866, test_f1: 0.5216
 epoch: 55, train_loss: 0.7166, test_loss: 1.1473, test_f1: 0.5208
 epoch: 56, train_loss: 0.7044, test_loss: 1.1733, test_f1: 0.5187
 epoch: 57, train_loss: 0.7181, test_loss: 1.1879, test_f1: 0.5133
 epoch: 58, train_loss: 0.7093, test_loss: 1.1625, test_f1: 0.5202
 epoch: 59, train_loss: 0.7033, test_loss: 1.1788, test_f1: 0.4951
 epoch: 60, train_loss: 0.6995, test_loss: 1.1274, test_f1: 0.5229
 epoch: 61, train_loss: 0.6947, test_loss: 1.1686, test_f1: 0.5109
 epoch: 62, train_loss: 0.6962, test_loss: 1.1978, test_f1: 0.5089
 epoch: 63, train_loss: 0.7024, test_loss: 1.1654, test_f1: 0.5270
 epoch: 64, train_loss: 0.6876, test_loss: 1.1903, test_f1: 0.5225
 epoch: 65, train_loss: 0.6727, test_loss: 1.1680, test_f1: 0.5192
 epoch: 66, train_loss: 0.6903, test_loss: 1.2316, test_f1: 0.5127
 epoch: 67, train_loss: 0.6803, test_loss: 1.2205, test_f1: 0.5339
 epoch: 68, train_loss: 0.6796, test_loss: 1.2255, test_f1: 0.5217
 epoch: 69, train_loss: 0.6842, test_loss: 1.2488, test_f1: 0.5181
 epoch: 70, train_loss: 0.6625, test_loss: 1.2631, test_f1: 0.5081
 epoch: 71, train_loss: 0.6601, test_loss: 1.1963, test_f1: 0.5186
 epoch: 72, train_loss: 0.6735, test_loss: 1.1942, test_f1: 0.5278
 epoch: 73, train_loss: 0.6768, test_loss: 1.2517, test_f1: 0.5377
 epoch: 74, train_loss: 0.6706, test_loss: 1.2301, test_f1: 0.5160
 epoch: 75, train_loss: 0.6599, test_loss: 1.2063, test_f1: 0.5260
 epoch: 76, train_loss: 0.6620, test_loss: 1.3079, test_f1: 0.5092
 epoch: 77, train_loss: 0.6695, test_loss: 1.2638, test_f1: 0.5180
 epoch: 78, train_loss: 0.6575, test_loss: 1.2228, test_f1: 0.5275
 epoch: 79, train_loss: 0.6640, test_loss: 1.2382, test_f1: 0.5339
 epoch: 80, train_loss: 0.6616, test_loss: 1.2447, test_f1: 0.5228
 epoch: 81, train_loss: 0.6444, test_loss: 1.2271, test_f1: 0.5477
 epoch: 82, train_loss: 0.6588, test_loss: 1.2579, test_f1: 0.5386
 epoch: 83, train_loss: 0.6535, test_loss: 1.2700, test_f1: 0.5248
 epoch: 84, train_loss: 0.6544, test_loss: 1.3161, test_f1: 0.5148
 epoch: 85, train_loss: 0.6463, test_loss: 1.2616, test_f1: 0.5075
 epoch: 86, train_loss: 0.6334, test_loss: 1.2733, test_f1: 0.5041
 epoch: 87, train_loss: 0.6357, test_loss: 1.2861, test_f1: 0.5184
 epoch: 88, train_loss: 0.6476, test_loss: 1.2635, test_f1: 0.5267
 epoch: 89, train_loss: 0.6398, test_loss: 1.2952, test_f1: 0.5172
 epoch: 90, train_loss: 0.6339, test_loss: 1.2815, test_f1: 0.5196
 epoch: 91, train_loss: 0.6414, test_loss: 1.2721, test_f1: 0.5228
 epoch: 92, train_loss: 0.6481, test_loss: 1.3740, test_f1: 0.5192
 epoch: 93, train_loss: 0.6390, test_loss: 1.2931, test_f1: 0.5183
 epoch: 94, train_loss: 0.6299, test_loss: 1.3270, test_f1: 0.5304
 epoch: 95, train_loss: 0.6350, test_loss: 1.3240, test_f1: 0.5136
 epoch: 96, train_loss: 0.6442, test_loss: 1.2997, test_f1: 0.5357
 epoch: 97, train_loss: 0.6138, test_loss: 1.3939, test_f1: 0.5336
 epoch: 98, train_loss: 0.6261, test_loss: 1.3455, test_f1: 0.5296
 epoch: 99, train_loss: 0.6183, test_loss: 1.3598, test_f1: 0.5312
##################ITERATION #1 ****************************************
 epoch: 0, train_loss: 1.2659, test_loss: 1.1887, test_f1: 0.4407
 epoch: 1, train_loss: 1.1932, test_loss: 1.1396, test_f1: 0.4512
 epoch: 2, train_loss: 1.1506, test_loss: 1.1039, test_f1: 0.4625
 epoch: 3, train_loss: 1.1305, test_loss: 1.0802, test_f1: 0.4665
 epoch: 4, train_loss: 1.0970, test_loss: 1.0486, test_f1: 0.4674
 epoch: 5, train_loss: 1.0795, test_loss: 1.0336, test_f1: 0.4740
 epoch: 6, train_loss: 1.0570, test_loss: 1.0054, test_f1: 0.4882
 epoch: 7, train_loss: 1.0483, test_loss: 1.0062, test_f1: 0.4803
 epoch: 8, train_loss: 1.0300, test_loss: 1.0004, test_f1: 0.4864
 epoch: 9, train_loss: 1.0152, test_loss: 0.9755, test_f1: 0.4888
 epoch: 10, train_loss: 0.9916, test_loss: 0.9743, test_f1: 0.4850
 epoch: 11, train_loss: 0.9821, test_loss: 0.9559, test_f1: 0.5021
 epoch: 12, train_loss: 0.9656, test_loss: 0.9595, test_f1: 0.4984
 epoch: 13, train_loss: 0.9526, test_loss: 0.9552, test_f1: 0.5099
 epoch: 14, train_loss: 0.9501, test_loss: 0.9766, test_f1: 0.4904
 epoch: 15, train_loss: 0.9450, test_loss: 0.9393, test_f1: 0.5177
 epoch: 16, train_loss: 0.9349, test_loss: 0.9499, test_f1: 0.4960
 epoch: 17, train_loss: 0.9255, test_loss: 0.9477, test_f1: 0.4998
 epoch: 18, train_loss: 0.9137, test_loss: 0.9395, test_f1: 0.5073
 epoch: 19, train_loss: 0.8981, test_loss: 0.9714, test_f1: 0.5197
 epoch: 20, train_loss: 0.9058, test_loss: 0.9488, test_f1: 0.4901
 epoch: 21, train_loss: 0.8847, test_loss: 0.9789, test_f1: 0.5111
 epoch: 22, train_loss: 0.8850, test_loss: 0.9611, test_f1: 0.5069
 epoch: 23, train_loss: 0.8839, test_loss: 0.9754, test_f1: 0.4818
 epoch: 24, train_loss: 0.8660, test_loss: 0.9809, test_f1: 0.4963
 epoch: 25, train_loss: 0.8698, test_loss: 0.9786, test_f1: 0.4977
 epoch: 26, train_loss: 0.8592, test_loss: 0.9512, test_f1: 0.5147
 epoch: 27, train_loss: 0.8485, test_loss: 0.9916, test_f1: 0.4983
 epoch: 28, train_loss: 0.8430, test_loss: 0.9694, test_f1: 0.4991
 epoch: 29, train_loss: 0.8377, test_loss: 0.9969, test_f1: 0.4783
 epoch: 30, train_loss: 0.8439, test_loss: 0.9848, test_f1: 0.5172
 epoch: 31, train_loss: 0.8529, test_loss: 0.9886, test_f1: 0.4997
 epoch: 32, train_loss: 0.8347, test_loss: 0.9803, test_f1: 0.5208
 epoch: 33, train_loss: 0.8270, test_loss: 1.0120, test_f1: 0.5135
 epoch: 34, train_loss: 0.8121, test_loss: 1.0181, test_f1: 0.5069
 epoch: 35, train_loss: 0.8077, test_loss: 1.0134, test_f1: 0.4954
 epoch: 36, train_loss: 0.8141, test_loss: 1.0097, test_f1: 0.5059
 epoch: 37, train_loss: 0.7994, test_loss: 0.9996, test_f1: 0.5196
 epoch: 38, train_loss: 0.7926, test_loss: 0.9807, test_f1: 0.5215
 epoch: 39, train_loss: 0.7909, test_loss: 1.0207, test_f1: 0.5147
 epoch: 40, train_loss: 0.7881, test_loss: 0.9768, test_f1: 0.5358
 epoch: 41, train_loss: 0.7770, test_loss: 0.9958, test_f1: 0.5144
 epoch: 42, train_loss: 0.7734, test_loss: 0.9908, test_f1: 0.5426
 epoch: 43, train_loss: 0.7643, test_loss: 0.9894, test_f1: 0.5350
 epoch: 44, train_loss: 0.7637, test_loss: 0.9967, test_f1: 0.5408
 epoch: 45, train_loss: 0.7573, test_loss: 1.0832, test_f1: 0.5302
 epoch: 46, train_loss: 0.7516, test_loss: 1.0283, test_f1: 0.5388
 epoch: 47, train_loss: 0.7644, test_loss: 1.0149, test_f1: 0.5448
 epoch: 48, train_loss: 0.7419, test_loss: 1.0383, test_f1: 0.5322
 epoch: 49, train_loss: 0.7557, test_loss: 1.0441, test_f1: 0.5241
 epoch: 50, train_loss: 0.7516, test_loss: 1.0372, test_f1: 0.5332
 epoch: 51, train_loss: 0.7327, test_loss: 1.0235, test_f1: 0.5417
 epoch: 52, train_loss: 0.7169, test_loss: 1.0536, test_f1: 0.5182
 epoch: 53, train_loss: 0.7065, test_loss: 1.0419, test_f1: 0.5427
 epoch: 54, train_loss: 0.7090, test_loss: 1.0105, test_f1: 0.5445
 epoch: 55, train_loss: 0.7050, test_loss: 1.1038, test_f1: 0.5427
 epoch: 56, train_loss: 0.6940, test_loss: 1.0453, test_f1: 0.5397
 epoch: 57, train_loss: 0.7076, test_loss: 1.1338, test_f1: 0.5448
 epoch: 58, train_loss: 0.6978, test_loss: 1.0196, test_f1: 0.5348
 epoch: 59, train_loss: 0.6918, test_loss: 1.1236, test_f1: 0.5332
 epoch: 60, train_loss: 0.7000, test_loss: 1.0738, test_f1: 0.5387
 epoch: 61, train_loss: 0.6845, test_loss: 1.0697, test_f1: 0.5375
 epoch: 62, train_loss: 0.6927, test_loss: 1.0868, test_f1: 0.5506
 epoch: 63, train_loss: 0.6934, test_loss: 1.1273, test_f1: 0.5438
 epoch: 64, train_loss: 0.6886, test_loss: 1.1101, test_f1: 0.5181
 epoch: 65, train_loss: 0.6814, test_loss: 1.0721, test_f1: 0.5364
 epoch: 66, train_loss: 0.6811, test_loss: 1.0658, test_f1: 0.5320
 epoch: 67, train_loss: 0.6704, test_loss: 1.1076, test_f1: 0.5419
 epoch: 68, train_loss: 0.6728, test_loss: 1.1494, test_f1: 0.5418
 epoch: 69, train_loss: 0.6758, test_loss: 1.0539, test_f1: 0.5473
 epoch: 70, train_loss: 0.6798, test_loss: 1.0640, test_f1: 0.5457
 epoch: 71, train_loss: 0.6705, test_loss: 1.1619, test_f1: 0.5342
 epoch: 72, train_loss: 0.6621, test_loss: 1.1009, test_f1: 0.5180
 epoch: 73, train_loss: 0.6713, test_loss: 1.1157, test_f1: 0.5343
 epoch: 74, train_loss: 0.6493, test_loss: 1.1579, test_f1: 0.5422
 epoch: 75, train_loss: 0.6633, test_loss: 1.1082, test_f1: 0.5463
 epoch: 76, train_loss: 0.6749, test_loss: 1.1382, test_f1: 0.5457
 epoch: 77, train_loss: 0.6626, test_loss: 1.1652, test_f1: 0.5272
 epoch: 78, train_loss: 0.6501, test_loss: 1.1697, test_f1: 0.5103
 epoch: 79, train_loss: 0.6505, test_loss: 1.1509, test_f1: 0.5506
 epoch: 80, train_loss: 0.6528, test_loss: 1.0929, test_f1: 0.5336
 epoch: 81, train_loss: 0.6399, test_loss: 1.1160, test_f1: 0.5321
 epoch: 82, train_loss: 0.6507, test_loss: 1.1683, test_f1: 0.5326
 epoch: 83, train_loss: 0.6274, test_loss: 1.1838, test_f1: 0.5441
 epoch: 84, train_loss: 0.6283, test_loss: 1.1499, test_f1: 0.5549
 epoch: 85, train_loss: 0.6344, test_loss: 1.2340, test_f1: 0.5412
 epoch: 86, train_loss: 0.6459, test_loss: 1.1499, test_f1: 0.5414
 epoch: 87, train_loss: 0.6450, test_loss: 1.2874, test_f1: 0.5447
 epoch: 88, train_loss: 0.6299, test_loss: 1.1594, test_f1: 0.5419
 epoch: 89, train_loss: 0.6408, test_loss: 1.2028, test_f1: 0.5369
 epoch: 90, train_loss: 0.6346, test_loss: 1.1434, test_f1: 0.5422
 epoch: 91, train_loss: 0.6432, test_loss: 1.1485, test_f1: 0.5375
 epoch: 92, train_loss: 0.6213, test_loss: 1.1798, test_f1: 0.5512
 epoch: 93, train_loss: 0.6242, test_loss: 1.2635, test_f1: 0.5288
 epoch: 94, train_loss: 0.6240, test_loss: 1.1864, test_f1: 0.5489
 epoch: 95, train_loss: 0.6198, test_loss: 1.2800, test_f1: 0.5333
 epoch: 96, train_loss: 0.6130, test_loss: 1.1736, test_f1: 0.5326
 epoch: 97, train_loss: 0.6081, test_loss: 1.2584, test_f1: 0.5400
 epoch: 98, train_loss: 0.6209, test_loss: 1.2326, test_f1: 0.5323
 epoch: 99, train_loss: 0.6080, test_loss: 1.2951, test_f1: 0.5443
##################ITERATION #2 ****************************************
 epoch: 0, train_loss: 1.2528, test_loss: 1.1513, test_f1: 0.4361
 epoch: 1, train_loss: 1.1743, test_loss: 1.1187, test_f1: 0.4646
 epoch: 2, train_loss: 1.1413, test_loss: 1.0911, test_f1: 0.4685
 epoch: 3, train_loss: 1.1215, test_loss: 1.0804, test_f1: 0.4654
 epoch: 4, train_loss: 1.1007, test_loss: 1.0501, test_f1: 0.4846
 epoch: 5, train_loss: 1.0811, test_loss: 1.0263, test_f1: 0.4681
 epoch: 6, train_loss: 1.0666, test_loss: 1.0109, test_f1: 0.4415
 epoch: 7, train_loss: 1.0448, test_loss: 0.9957, test_f1: 0.4845
 epoch: 8, train_loss: 1.0248, test_loss: 0.9934, test_f1: 0.5013
 epoch: 9, train_loss: 1.0225, test_loss: 0.9867, test_f1: 0.4736
 epoch: 10, train_loss: 1.0087, test_loss: 0.9800, test_f1: 0.4751
 epoch: 11, train_loss: 1.0004, test_loss: 0.9660, test_f1: 0.4889
 epoch: 12, train_loss: 0.9816, test_loss: 0.9707, test_f1: 0.4841
 epoch: 13, train_loss: 0.9644, test_loss: 0.9644, test_f1: 0.4753
 epoch: 14, train_loss: 0.9641, test_loss: 1.0035, test_f1: 0.4636
 epoch: 15, train_loss: 0.9533, test_loss: 0.9428, test_f1: 0.5118
 epoch: 16, train_loss: 0.9421, test_loss: 0.9418, test_f1: 0.4941
 epoch: 17, train_loss: 0.9405, test_loss: 0.9465, test_f1: 0.4915
 epoch: 18, train_loss: 0.9244, test_loss: 0.9332, test_f1: 0.5238
 epoch: 19, train_loss: 0.9153, test_loss: 0.9727, test_f1: 0.4933
 epoch: 20, train_loss: 0.9189, test_loss: 0.9543, test_f1: 0.4992
 epoch: 21, train_loss: 0.9118, test_loss: 0.9711, test_f1: 0.5005
 epoch: 22, train_loss: 0.8916, test_loss: 0.9423, test_f1: 0.5047
 epoch: 23, train_loss: 0.8881, test_loss: 0.9574, test_f1: 0.5071
 epoch: 24, train_loss: 0.8864, test_loss: 0.9361, test_f1: 0.4978
 epoch: 25, train_loss: 0.8731, test_loss: 0.9554, test_f1: 0.5026
 epoch: 26, train_loss: 0.8698, test_loss: 0.9758, test_f1: 0.4994
 epoch: 27, train_loss: 0.8619, test_loss: 0.9786, test_f1: 0.5005
 epoch: 28, train_loss: 0.8594, test_loss: 0.9784, test_f1: 0.5037
 epoch: 29, train_loss: 0.8840, test_loss: 0.9504, test_f1: 0.5016
 epoch: 30, train_loss: 0.8603, test_loss: 0.9744, test_f1: 0.5196
 epoch: 31, train_loss: 0.8595, test_loss: 0.9600, test_f1: 0.4958
 epoch: 32, train_loss: 0.8503, test_loss: 0.9783, test_f1: 0.5118
 epoch: 33, train_loss: 0.8368, test_loss: 0.9755, test_f1: 0.5000
 epoch: 34, train_loss: 0.8294, test_loss: 0.9662, test_f1: 0.5054
 epoch: 35, train_loss: 0.8325, test_loss: 0.9797, test_f1: 0.5087
 epoch: 36, train_loss: 0.8161, test_loss: 1.0130, test_f1: 0.5121
 epoch: 37, train_loss: 0.8127, test_loss: 1.0129, test_f1: 0.5095
 epoch: 38, train_loss: 0.8158, test_loss: 1.0078, test_f1: 0.5097
 epoch: 39, train_loss: 0.8033, test_loss: 0.9895, test_f1: 0.5274
 epoch: 40, train_loss: 0.7984, test_loss: 1.0251, test_f1: 0.5170
 epoch: 41, train_loss: 0.8102, test_loss: 1.0238, test_f1: 0.5157
 epoch: 42, train_loss: 0.8137, test_loss: 1.0354, test_f1: 0.5079
 epoch: 43, train_loss: 0.7948, test_loss: 1.0068, test_f1: 0.5204
 epoch: 44, train_loss: 0.7803, test_loss: 1.0349, test_f1: 0.5105
 epoch: 45, train_loss: 0.7833, test_loss: 1.0221, test_f1: 0.5241
 epoch: 46, train_loss: 0.7739, test_loss: 0.9910, test_f1: 0.5259
 epoch: 47, train_loss: 0.7691, test_loss: 1.0340, test_f1: 0.4962
 epoch: 48, train_loss: 0.7800, test_loss: 1.0225, test_f1: 0.5355
 epoch: 49, train_loss: 0.7781, test_loss: 0.9992, test_f1: 0.5241
 epoch: 50, train_loss: 0.7659, test_loss: 1.0209, test_f1: 0.5321
 epoch: 51, train_loss: 0.7474, test_loss: 1.0525, test_f1: 0.5268
 epoch: 52, train_loss: 0.7464, test_loss: 1.0141, test_f1: 0.5274
 epoch: 53, train_loss: 0.7379, test_loss: 1.0554, test_f1: 0.5223
 epoch: 54, train_loss: 0.7313, test_loss: 1.0789, test_f1: 0.5153
 epoch: 55, train_loss: 0.7333, test_loss: 1.0503, test_f1: 0.5194
 epoch: 56, train_loss: 0.7298, test_loss: 1.0469, test_f1: 0.5127
 epoch: 57, train_loss: 0.7260, test_loss: 1.0408, test_f1: 0.5220
 epoch: 58, train_loss: 0.7268, test_loss: 1.0893, test_f1: 0.5107
 epoch: 59, train_loss: 0.7234, test_loss: 1.0705, test_f1: 0.4990
 epoch: 60, train_loss: 0.7229, test_loss: 1.0539, test_f1: 0.5239
 epoch: 61, train_loss: 0.7100, test_loss: 1.0685, test_f1: 0.5179
 epoch: 62, train_loss: 0.7080, test_loss: 1.0805, test_f1: 0.5233
 epoch: 63, train_loss: 0.7235, test_loss: 1.0438, test_f1: 0.5261
 epoch: 64, train_loss: 0.7044, test_loss: 1.0980, test_f1: 0.5245
 epoch: 65, train_loss: 0.7181, test_loss: 1.0865, test_f1: 0.5303
 epoch: 66, train_loss: 0.7168, test_loss: 1.0994, test_f1: 0.5205
 epoch: 67, train_loss: 0.7049, test_loss: 1.0967, test_f1: 0.5365
 epoch: 68, train_loss: 0.7074, test_loss: 1.0795, test_f1: 0.5316
 epoch: 69, train_loss: 0.7112, test_loss: 1.1267, test_f1: 0.5198
 epoch: 70, train_loss: 0.6908, test_loss: 1.1072, test_f1: 0.5172
 epoch: 71, train_loss: 0.7064, test_loss: 1.1142, test_f1: 0.5250
 epoch: 72, train_loss: 0.7003, test_loss: 1.1027, test_f1: 0.5419
 epoch: 73, train_loss: 0.6928, test_loss: 1.0834, test_f1: 0.5278
 epoch: 74, train_loss: 0.7078, test_loss: 1.1029, test_f1: 0.5257
 epoch: 75, train_loss: 0.6867, test_loss: 1.1253, test_f1: 0.5156
 epoch: 76, train_loss: 0.6897, test_loss: 1.1165, test_f1: 0.5336
 epoch: 77, train_loss: 0.6935, test_loss: 1.1334, test_f1: 0.5233
 epoch: 78, train_loss: 0.6866, test_loss: 1.1299, test_f1: 0.5317
 epoch: 79, train_loss: 0.6818, test_loss: 1.1088, test_f1: 0.5277
 epoch: 80, train_loss: 0.6704, test_loss: 1.1182, test_f1: 0.5384
 epoch: 81, train_loss: 0.6791, test_loss: 1.0818, test_f1: 0.5349
 epoch: 82, train_loss: 0.6769, test_loss: 1.1081, test_f1: 0.5292
 epoch: 83, train_loss: 0.6876, test_loss: 1.1190, test_f1: 0.5117
 epoch: 84, train_loss: 0.6796, test_loss: 1.1395, test_f1: 0.5328
 epoch: 85, train_loss: 0.6735, test_loss: 1.1742, test_f1: 0.5139
 epoch: 86, train_loss: 0.6706, test_loss: 1.1658, test_f1: 0.5101
 epoch: 87, train_loss: 0.6693, test_loss: 1.1374, test_f1: 0.5263
 epoch: 88, train_loss: 0.6715, test_loss: 1.1546, test_f1: 0.4986
 epoch: 89, train_loss: 0.6601, test_loss: 1.1566, test_f1: 0.5160
 epoch: 90, train_loss: 0.6610, test_loss: 1.1409, test_f1: 0.5455
 epoch: 91, train_loss: 0.6494, test_loss: 1.1587, test_f1: 0.5321
 epoch: 92, train_loss: 0.6676, test_loss: 1.1791, test_f1: 0.5201
 epoch: 93, train_loss: 0.6561, test_loss: 1.1975, test_f1: 0.5050
 epoch: 94, train_loss: 0.6583, test_loss: 1.1301, test_f1: 0.5263
 epoch: 95, train_loss: 0.6501, test_loss: 1.2290, test_f1: 0.5296
 epoch: 96, train_loss: 0.6320, test_loss: 1.1565, test_f1: 0.5158
 epoch: 97, train_loss: 0.6454, test_loss: 1.1833, test_f1: 0.5373
 epoch: 98, train_loss: 0.6563, test_loss: 1.2482, test_f1: 0.5160
 epoch: 99, train_loss: 0.6540, test_loss: 1.1943, test_f1: 0.5416
##################ITERATION #3 ****************************************
 epoch: 0, train_loss: 1.2633, test_loss: 1.1639, test_f1: 0.4308
 epoch: 1, train_loss: 1.1907, test_loss: 1.1161, test_f1: 0.4519
 epoch: 2, train_loss: 1.1494, test_loss: 1.0834, test_f1: 0.4728
 epoch: 3, train_loss: 1.1368, test_loss: 1.0728, test_f1: 0.4523
 epoch: 4, train_loss: 1.1125, test_loss: 1.0466, test_f1: 0.4596
 epoch: 5, train_loss: 1.0919, test_loss: 1.0238, test_f1: 0.4473
 epoch: 6, train_loss: 1.0784, test_loss: 1.0271, test_f1: 0.4671
 epoch: 7, train_loss: 1.0608, test_loss: 1.0107, test_f1: 0.4350
 epoch: 8, train_loss: 1.0458, test_loss: 0.9750, test_f1: 0.4661
 epoch: 9, train_loss: 1.0271, test_loss: 0.9642, test_f1: 0.4861
 epoch: 10, train_loss: 1.0255, test_loss: 0.9498, test_f1: 0.5047
 epoch: 11, train_loss: 1.0154, test_loss: 0.9495, test_f1: 0.4870
 epoch: 12, train_loss: 0.9874, test_loss: 0.9499, test_f1: 0.4884
 epoch: 13, train_loss: 0.9926, test_loss: 0.9436, test_f1: 0.5329
 epoch: 14, train_loss: 0.9774, test_loss: 0.9269, test_f1: 0.5012
 epoch: 15, train_loss: 0.9669, test_loss: 0.9299, test_f1: 0.4913
 epoch: 16, train_loss: 0.9648, test_loss: 0.9386, test_f1: 0.4940
 epoch: 17, train_loss: 0.9601, test_loss: 0.9357, test_f1: 0.4857
 epoch: 18, train_loss: 0.9575, test_loss: 0.9321, test_f1: 0.5159
 epoch: 19, train_loss: 0.9411, test_loss: 0.9053, test_f1: 0.5195
 epoch: 20, train_loss: 0.9185, test_loss: 0.9281, test_f1: 0.4955
 epoch: 21, train_loss: 0.9142, test_loss: 0.9231, test_f1: 0.5109
 epoch: 22, train_loss: 0.9034, test_loss: 0.9260, test_f1: 0.5179
 epoch: 23, train_loss: 0.9036, test_loss: 0.9401, test_f1: 0.5003
 epoch: 24, train_loss: 0.9068, test_loss: 0.9395, test_f1: 0.4928
 epoch: 25, train_loss: 0.8931, test_loss: 0.9471, test_f1: 0.4987
 epoch: 26, train_loss: 0.8951, test_loss: 0.9360, test_f1: 0.4915
 epoch: 27, train_loss: 0.8795, test_loss: 0.9560, test_f1: 0.5059
 epoch: 28, train_loss: 0.8837, test_loss: 0.9707, test_f1: 0.5085
 epoch: 29, train_loss: 0.8721, test_loss: 1.0012, test_f1: 0.5065
 epoch: 30, train_loss: 0.8736, test_loss: 0.9351, test_f1: 0.5238
 epoch: 31, train_loss: 0.8576, test_loss: 0.9642, test_f1: 0.5125
 epoch: 32, train_loss: 0.8633, test_loss: 0.9527, test_f1: 0.5084
 epoch: 33, train_loss: 0.8608, test_loss: 0.9347, test_f1: 0.5201
 epoch: 34, train_loss: 0.8612, test_loss: 0.9768, test_f1: 0.5061
 epoch: 35, train_loss: 0.8545, test_loss: 0.9077, test_f1: 0.5308
 epoch: 36, train_loss: 0.8479, test_loss: 0.9395, test_f1: 0.5382
 epoch: 37, train_loss: 0.8538, test_loss: 0.9305, test_f1: 0.5198
 epoch: 38, train_loss: 0.8476, test_loss: 0.9299, test_f1: 0.5256
 epoch: 39, train_loss: 0.8381, test_loss: 0.9394, test_f1: 0.5150
 epoch: 40, train_loss: 0.8309, test_loss: 0.9412, test_f1: 0.5212
 epoch: 41, train_loss: 0.8170, test_loss: 0.9236, test_f1: 0.5129
 epoch: 42, train_loss: 0.8207, test_loss: 0.9430, test_f1: 0.5175
 epoch: 43, train_loss: 0.8125, test_loss: 0.9484, test_f1: 0.5294
 epoch: 44, train_loss: 0.8118, test_loss: 0.9770, test_f1: 0.5210
 epoch: 45, train_loss: 0.8068, test_loss: 0.9358, test_f1: 0.5308
 epoch: 46, train_loss: 0.8145, test_loss: 0.9264, test_f1: 0.5312
 epoch: 47, train_loss: 0.8088, test_loss: 0.9661, test_f1: 0.5257
 epoch: 48, train_loss: 0.7952, test_loss: 0.9679, test_f1: 0.5238
 epoch: 49, train_loss: 0.7911, test_loss: 0.9271, test_f1: 0.5191
 epoch: 50, train_loss: 0.7775, test_loss: 1.0114, test_f1: 0.4993
 epoch: 51, train_loss: 0.7762, test_loss: 0.9869, test_f1: 0.5139
 epoch: 52, train_loss: 0.7686, test_loss: 0.9587, test_f1: 0.5336
 epoch: 53, train_loss: 0.7701, test_loss: 0.9745, test_f1: 0.5312
 epoch: 54, train_loss: 0.7572, test_loss: 0.9529, test_f1: 0.5277
 epoch: 55, train_loss: 0.7616, test_loss: 0.9661, test_f1: 0.5322
 epoch: 56, train_loss: 0.7545, test_loss: 0.9737, test_f1: 0.5302
 epoch: 57, train_loss: 0.7658, test_loss: 0.9608, test_f1: 0.5266
 epoch: 58, train_loss: 0.7624, test_loss: 0.9595, test_f1: 0.5305
 epoch: 59, train_loss: 0.7549, test_loss: 1.0211, test_f1: 0.5292
 epoch: 60, train_loss: 0.7472, test_loss: 0.9820, test_f1: 0.5326
 epoch: 61, train_loss: 0.7437, test_loss: 1.0109, test_f1: 0.5219
 epoch: 62, train_loss: 0.7459, test_loss: 0.9870, test_f1: 0.5327
 epoch: 63, train_loss: 0.7488, test_loss: 0.9592, test_f1: 0.5285
 epoch: 64, train_loss: 0.7459, test_loss: 0.9432, test_f1: 0.5338
 epoch: 65, train_loss: 0.7415, test_loss: 0.9775, test_f1: 0.5314
 epoch: 66, train_loss: 0.7578, test_loss: 0.9638, test_f1: 0.5237
 epoch: 67, train_loss: 0.7479, test_loss: 0.9914, test_f1: 0.5206
 epoch: 68, train_loss: 0.7295, test_loss: 0.9742, test_f1: 0.5230
 epoch: 69, train_loss: 0.7325, test_loss: 1.0074, test_f1: 0.5043
 epoch: 70, train_loss: 0.7353, test_loss: 0.9541, test_f1: 0.5409
 epoch: 71, train_loss: 0.7246, test_loss: 0.9952, test_f1: 0.5264
 epoch: 72, train_loss: 0.7271, test_loss: 0.9763, test_f1: 0.5393
 epoch: 73, train_loss: 0.7138, test_loss: 0.9684, test_f1: 0.5557
 epoch: 74, train_loss: 0.7110, test_loss: 0.9961, test_f1: 0.5262
 epoch: 75, train_loss: 0.7245, test_loss: 1.0341, test_f1: 0.5220
 epoch: 76, train_loss: 0.7062, test_loss: 1.0179, test_f1: 0.5275
 epoch: 77, train_loss: 0.7120, test_loss: 1.0507, test_f1: 0.5206
 epoch: 78, train_loss: 0.7200, test_loss: 1.0232, test_f1: 0.5225
 epoch: 79, train_loss: 0.7116, test_loss: 0.9979, test_f1: 0.5334
 epoch: 80, train_loss: 0.7141, test_loss: 1.0079, test_f1: 0.5337
 epoch: 81, train_loss: 0.7138, test_loss: 1.0386, test_f1: 0.5452
 epoch: 82, train_loss: 0.7028, test_loss: 0.9987, test_f1: 0.5286
 epoch: 83, train_loss: 0.7046, test_loss: 1.0057, test_f1: 0.5363
 epoch: 84, train_loss: 0.6962, test_loss: 1.0072, test_f1: 0.5382
 epoch: 85, train_loss: 0.6930, test_loss: 1.0334, test_f1: 0.5222
 epoch: 86, train_loss: 0.6965, test_loss: 1.0228, test_f1: 0.5365
 epoch: 87, train_loss: 0.7049, test_loss: 1.0530, test_f1: 0.5347
 epoch: 88, train_loss: 0.6930, test_loss: 0.9961, test_f1: 0.5406
 epoch: 89, train_loss: 0.6870, test_loss: 1.0138, test_f1: 0.5306
 epoch: 90, train_loss: 0.6857, test_loss: 1.0248, test_f1: 0.5343
 epoch: 91, train_loss: 0.6934, test_loss: 0.9967, test_f1: 0.5302
 epoch: 92, train_loss: 0.6893, test_loss: 1.0175, test_f1: 0.5434
 epoch: 93, train_loss: 0.6846, test_loss: 1.0006, test_f1: 0.5538
 epoch: 94, train_loss: 0.6801, test_loss: 1.0196, test_f1: 0.5404
 epoch: 95, train_loss: 0.6855, test_loss: 1.0534, test_f1: 0.5236
 epoch: 96, train_loss: 0.6828, test_loss: 1.0590, test_f1: 0.5289
 epoch: 97, train_loss: 0.6629, test_loss: 1.0484, test_f1: 0.5357
 epoch: 98, train_loss: 0.6925, test_loss: 1.0240, test_f1: 0.5507
 epoch: 99, train_loss: 0.6704, test_loss: 1.0020, test_f1: 0.5449
##################ITERATION #4 ****************************************
 epoch: 0, train_loss: 1.2530, test_loss: 1.1033, test_f1: 0.4738
 epoch: 1, train_loss: 1.1539, test_loss: 1.0767, test_f1: 0.4646
 epoch: 2, train_loss: 1.1283, test_loss: 1.0615, test_f1: 0.4555
 epoch: 3, train_loss: 1.1008, test_loss: 1.0501, test_f1: 0.4480
 epoch: 4, train_loss: 1.0841, test_loss: 1.0246, test_f1: 0.4623
 epoch: 5, train_loss: 1.0628, test_loss: 1.0085, test_f1: 0.4733
 epoch: 6, train_loss: 1.0470, test_loss: 1.0145, test_f1: 0.4645
 epoch: 7, train_loss: 1.0348, test_loss: 0.9884, test_f1: 0.4783
 epoch: 8, train_loss: 1.0213, test_loss: 1.0020, test_f1: 0.4700
 epoch: 9, train_loss: 1.0167, test_loss: 1.0021, test_f1: 0.4751
 epoch: 10, train_loss: 0.9941, test_loss: 0.9885, test_f1: 0.5033
 epoch: 11, train_loss: 0.9892, test_loss: 1.0062, test_f1: 0.4882
 epoch: 12, train_loss: 0.9798, test_loss: 0.9767, test_f1: 0.4881
 epoch: 13, train_loss: 0.9712, test_loss: 0.9729, test_f1: 0.5000
 epoch: 14, train_loss: 0.9682, test_loss: 0.9798, test_f1: 0.5098
 epoch: 15, train_loss: 0.9509, test_loss: 0.9774, test_f1: 0.5039
 epoch: 16, train_loss: 0.9540, test_loss: 0.9704, test_f1: 0.5212
 epoch: 17, train_loss: 0.9396, test_loss: 0.9614, test_f1: 0.5106
 epoch: 18, train_loss: 0.9412, test_loss: 0.9550, test_f1: 0.4958
 epoch: 19, train_loss: 0.9272, test_loss: 0.9521, test_f1: 0.4933
 epoch: 20, train_loss: 0.9267, test_loss: 0.9487, test_f1: 0.5172
 epoch: 21, train_loss: 0.9096, test_loss: 0.9740, test_f1: 0.5196
 epoch: 22, train_loss: 0.9199, test_loss: 0.9579, test_f1: 0.5123
 epoch: 23, train_loss: 0.9038, test_loss: 0.9484, test_f1: 0.5032
 epoch: 24, train_loss: 0.8906, test_loss: 0.9587, test_f1: 0.5287
 epoch: 25, train_loss: 0.8910, test_loss: 0.9634, test_f1: 0.5075
 epoch: 26, train_loss: 0.8883, test_loss: 1.0164, test_f1: 0.4951
 epoch: 27, train_loss: 0.8862, test_loss: 1.0081, test_f1: 0.4854
 epoch: 28, train_loss: 0.8885, test_loss: 1.0235, test_f1: 0.4830
 epoch: 29, train_loss: 0.8685, test_loss: 1.0404, test_f1: 0.4862
 epoch: 30, train_loss: 0.8804, test_loss: 0.9912, test_f1: 0.5137
 epoch: 31, train_loss: 0.8718, test_loss: 0.9797, test_f1: 0.5164
 epoch: 32, train_loss: 0.8492, test_loss: 1.0504, test_f1: 0.4826
 epoch: 33, train_loss: 0.8517, test_loss: 1.0313, test_f1: 0.4966
 epoch: 34, train_loss: 0.8356, test_loss: 0.9875, test_f1: 0.5154
 epoch: 35, train_loss: 0.8441, test_loss: 0.9622, test_f1: 0.5242
 epoch: 36, train_loss: 0.8428, test_loss: 1.1131, test_f1: 0.5021
 epoch: 37, train_loss: 0.8268, test_loss: 1.0192, test_f1: 0.5132
 epoch: 38, train_loss: 0.8281, test_loss: 0.9736, test_f1: 0.5112
 epoch: 39, train_loss: 0.8308, test_loss: 1.0214, test_f1: 0.5258
 epoch: 40, train_loss: 0.8193, test_loss: 1.0223, test_f1: 0.5180
 epoch: 41, train_loss: 0.8063, test_loss: 1.0425, test_f1: 0.5199
 epoch: 42, train_loss: 0.8188, test_loss: 1.0273, test_f1: 0.5108
 epoch: 43, train_loss: 0.8178, test_loss: 1.0372, test_f1: 0.5175
 epoch: 44, train_loss: 0.8002, test_loss: 1.1118, test_f1: 0.4996
 epoch: 45, train_loss: 0.8011, test_loss: 1.0395, test_f1: 0.5172
 epoch: 46, train_loss: 0.7860, test_loss: 1.0659, test_f1: 0.5091
 epoch: 47, train_loss: 0.7869, test_loss: 1.0214, test_f1: 0.5170
 epoch: 48, train_loss: 0.7763, test_loss: 1.0535, test_f1: 0.5200
 epoch: 49, train_loss: 0.7748, test_loss: 1.0350, test_f1: 0.5239
 epoch: 50, train_loss: 0.7696, test_loss: 1.0905, test_f1: 0.5408
 epoch: 51, train_loss: 0.7587, test_loss: 1.0198, test_f1: 0.5362
 epoch: 52, train_loss: 0.7600, test_loss: 1.0499, test_f1: 0.5377
 epoch: 53, train_loss: 0.7571, test_loss: 1.0689, test_f1: 0.5165
 epoch: 54, train_loss: 0.7482, test_loss: 1.0687, test_f1: 0.5427
 epoch: 55, train_loss: 0.7524, test_loss: 1.0610, test_f1: 0.5323
 epoch: 56, train_loss: 0.7421, test_loss: 1.0879, test_f1: 0.5275
 epoch: 57, train_loss: 0.7453, test_loss: 1.0424, test_f1: 0.5431
 epoch: 58, train_loss: 0.7435, test_loss: 1.0499, test_f1: 0.5391
 epoch: 59, train_loss: 0.7447, test_loss: 1.0605, test_f1: 0.5364
 epoch: 60, train_loss: 0.7384, test_loss: 1.1191, test_f1: 0.5222
 epoch: 61, train_loss: 0.7429, test_loss: 1.0625, test_f1: 0.5204
 epoch: 62, train_loss: 0.7403, test_loss: 1.0880, test_f1: 0.5150
 epoch: 63, train_loss: 0.7236, test_loss: 1.0605, test_f1: 0.5323
 epoch: 64, train_loss: 0.7401, test_loss: 1.0779, test_f1: 0.5430
 epoch: 65, train_loss: 0.7313, test_loss: 1.1105, test_f1: 0.5304
 epoch: 66, train_loss: 0.7314, test_loss: 1.0506, test_f1: 0.5324
 epoch: 67, train_loss: 0.7337, test_loss: 1.0788, test_f1: 0.5356
 epoch: 68, train_loss: 0.7181, test_loss: 1.0753, test_f1: 0.5364
 epoch: 69, train_loss: 0.7164, test_loss: 1.0775, test_f1: 0.5345
 epoch: 70, train_loss: 0.7085, test_loss: 1.1548, test_f1: 0.5287
 epoch: 71, train_loss: 0.7120, test_loss: 1.0894, test_f1: 0.5433
 epoch: 72, train_loss: 0.7082, test_loss: 1.1203, test_f1: 0.5281
 epoch: 73, train_loss: 0.7026, test_loss: 1.1161, test_f1: 0.5444
 epoch: 74, train_loss: 0.7088, test_loss: 1.0707, test_f1: 0.5549
 epoch: 75, train_loss: 0.6939, test_loss: 1.0913, test_f1: 0.5518
 epoch: 76, train_loss: 0.7154, test_loss: 1.1183, test_f1: 0.5317
 epoch: 77, train_loss: 0.7013, test_loss: 1.1338, test_f1: 0.5442
 epoch: 78, train_loss: 0.6991, test_loss: 1.0971, test_f1: 0.5371
 epoch: 79, train_loss: 0.7051, test_loss: 1.1170, test_f1: 0.5380
 epoch: 80, train_loss: 0.6919, test_loss: 1.1167, test_f1: 0.5476
 epoch: 81, train_loss: 0.6764, test_loss: 1.1186, test_f1: 0.5458
 epoch: 82, train_loss: 0.6905, test_loss: 1.1194, test_f1: 0.5354
 epoch: 83, train_loss: 0.6964, test_loss: 1.1132, test_f1: 0.5487
 epoch: 84, train_loss: 0.6919, test_loss: 1.1354, test_f1: 0.5454
 epoch: 85, train_loss: 0.6909, test_loss: 1.1305, test_f1: 0.5436
 epoch: 86, train_loss: 0.6696, test_loss: 1.1350, test_f1: 0.5496
 epoch: 87, train_loss: 0.6793, test_loss: 1.1023, test_f1: 0.5670
 epoch: 88, train_loss: 0.6711, test_loss: 1.1480, test_f1: 0.5518
 epoch: 89, train_loss: 0.6647, test_loss: 1.1431, test_f1: 0.5419
 epoch: 90, train_loss: 0.6834, test_loss: 1.1516, test_f1: 0.5285
 epoch: 91, train_loss: 0.6587, test_loss: 1.1256, test_f1: 0.5562
 epoch: 92, train_loss: 0.6738, test_loss: 1.1873, test_f1: 0.5529
 epoch: 93, train_loss: 0.6710, test_loss: 1.1500, test_f1: 0.5583
 epoch: 94, train_loss: 0.6669, test_loss: 1.1585, test_f1: 0.5391
 epoch: 95, train_loss: 0.6630, test_loss: 1.1824, test_f1: 0.5413
 epoch: 96, train_loss: 0.6489, test_loss: 1.1979, test_f1: 0.5452
 epoch: 97, train_loss: 0.6638, test_loss: 1.2012, test_f1: 0.5387
 epoch: 98, train_loss: 0.6586, test_loss: 1.1401, test_f1: 0.5474
 epoch: 99, train_loss: 0.6566, test_loss: 1.1993, test_f1: 0.5467
##################ITERATION #5 ****************************************
 epoch: 0, train_loss: 1.3081, test_loss: 1.1776, test_f1: 0.4030
 epoch: 1, train_loss: 1.1914, test_loss: 1.1341, test_f1: 0.4136
 epoch: 2, train_loss: 1.1660, test_loss: 1.1128, test_f1: 0.4366
 epoch: 3, train_loss: 1.1407, test_loss: 1.0999, test_f1: 0.4633
 epoch: 4, train_loss: 1.1245, test_loss: 1.0766, test_f1: 0.4448
 epoch: 5, train_loss: 1.0983, test_loss: 1.0624, test_f1: 0.4508
 epoch: 6, train_loss: 1.0914, test_loss: 1.0465, test_f1: 0.4354
 epoch: 7, train_loss: 1.0849, test_loss: 1.0345, test_f1: 0.4679
 epoch: 8, train_loss: 1.0729, test_loss: 1.0346, test_f1: 0.4571
 epoch: 9, train_loss: 1.0512, test_loss: 1.0180, test_f1: 0.4663
 epoch: 10, train_loss: 1.0352, test_loss: 1.0158, test_f1: 0.4668
 epoch: 11, train_loss: 1.0270, test_loss: 0.9910, test_f1: 0.4688
 epoch: 12, train_loss: 1.0126, test_loss: 1.0193, test_f1: 0.4604
 epoch: 13, train_loss: 1.0035, test_loss: 1.0057, test_f1: 0.4776
 epoch: 14, train_loss: 0.9926, test_loss: 0.9968, test_f1: 0.4535
 epoch: 15, train_loss: 0.9991, test_loss: 0.9917, test_f1: 0.4763
 epoch: 16, train_loss: 0.9844, test_loss: 0.9920, test_f1: 0.4761
 epoch: 17, train_loss: 0.9717, test_loss: 0.9742, test_f1: 0.4921
 epoch: 18, train_loss: 0.9593, test_loss: 0.9918, test_f1: 0.4976
 epoch: 19, train_loss: 0.9529, test_loss: 0.9894, test_f1: 0.4778
 epoch: 20, train_loss: 0.9396, test_loss: 0.9868, test_f1: 0.4975
 epoch: 21, train_loss: 0.9455, test_loss: 0.9587, test_f1: 0.5096
 epoch: 22, train_loss: 0.9384, test_loss: 0.9655, test_f1: 0.5192
 epoch: 23, train_loss: 0.9302, test_loss: 0.9740, test_f1: 0.5164
 epoch: 24, train_loss: 0.9260, test_loss: 0.9663, test_f1: 0.4950
 epoch: 25, train_loss: 0.9201, test_loss: 0.9744, test_f1: 0.5184
 epoch: 26, train_loss: 0.9192, test_loss: 0.9768, test_f1: 0.4979
 epoch: 27, train_loss: 0.8940, test_loss: 0.9669, test_f1: 0.4929
 epoch: 28, train_loss: 0.9073, test_loss: 0.9866, test_f1: 0.5195
 epoch: 29, train_loss: 0.8937, test_loss: 1.0027, test_f1: 0.5058
 epoch: 30, train_loss: 0.8924, test_loss: 0.9761, test_f1: 0.5218
 epoch: 31, train_loss: 0.8727, test_loss: 0.9668, test_f1: 0.5298
 epoch: 32, train_loss: 0.8680, test_loss: 0.9565, test_f1: 0.4984
 epoch: 33, train_loss: 0.8686, test_loss: 0.9949, test_f1: 0.5169
 epoch: 34, train_loss: 0.8667, test_loss: 1.0332, test_f1: 0.5155
 epoch: 35, train_loss: 0.8649, test_loss: 1.0049, test_f1: 0.5120
 epoch: 36, train_loss: 0.8576, test_loss: 0.9927, test_f1: 0.5185
 epoch: 37, train_loss: 0.8542, test_loss: 1.0079, test_f1: 0.4963
 epoch: 38, train_loss: 0.8367, test_loss: 1.0152, test_f1: 0.5171
 epoch: 39, train_loss: 0.8340, test_loss: 0.9968, test_f1: 0.5201
 epoch: 40, train_loss: 0.8376, test_loss: 0.9985, test_f1: 0.5221
 epoch: 41, train_loss: 0.8308, test_loss: 1.0252, test_f1: 0.5234
 epoch: 42, train_loss: 0.8175, test_loss: 1.0119, test_f1: 0.5090
 epoch: 43, train_loss: 0.8199, test_loss: 1.0301, test_f1: 0.5292
 epoch: 44, train_loss: 0.8171, test_loss: 1.0111, test_f1: 0.5126
 epoch: 45, train_loss: 0.8159, test_loss: 1.0543, test_f1: 0.5195
 epoch: 46, train_loss: 0.8072, test_loss: 1.0863, test_f1: 0.4732
 epoch: 47, train_loss: 0.8077, test_loss: 1.0225, test_f1: 0.5338
 epoch: 48, train_loss: 0.7847, test_loss: 1.0677, test_f1: 0.5166
 epoch: 49, train_loss: 0.7906, test_loss: 0.9992, test_f1: 0.5257
 epoch: 50, train_loss: 0.8051, test_loss: 1.0480, test_f1: 0.5198
 epoch: 51, train_loss: 0.7839, test_loss: 1.0432, test_f1: 0.5128
 epoch: 52, train_loss: 0.7679, test_loss: 1.0521, test_f1: 0.5266
 epoch: 53, train_loss: 0.7799, test_loss: 1.0021, test_f1: 0.5367
 epoch: 54, train_loss: 0.7624, test_loss: 1.0321, test_f1: 0.5355
 epoch: 55, train_loss: 0.7630, test_loss: 1.0617, test_f1: 0.5237
 epoch: 56, train_loss: 0.7589, test_loss: 1.0404, test_f1: 0.5268
 epoch: 57, train_loss: 0.7548, test_loss: 1.0370, test_f1: 0.5218
 epoch: 58, train_loss: 0.7540, test_loss: 1.0390, test_f1: 0.5320
 epoch: 59, train_loss: 0.7540, test_loss: 1.0826, test_f1: 0.5253
 epoch: 60, train_loss: 0.7551, test_loss: 1.0770, test_f1: 0.5356
 epoch: 61, train_loss: 0.7489, test_loss: 1.0663, test_f1: 0.5067
 epoch: 62, train_loss: 0.7441, test_loss: 1.0452, test_f1: 0.5316
 epoch: 63, train_loss: 0.7436, test_loss: 1.0447, test_f1: 0.5204
 epoch: 64, train_loss: 0.7554, test_loss: 1.0466, test_f1: 0.5381
 epoch: 65, train_loss: 0.7398, test_loss: 1.0618, test_f1: 0.5290
 epoch: 66, train_loss: 0.7400, test_loss: 1.0857, test_f1: 0.5401
 epoch: 67, train_loss: 0.7286, test_loss: 1.0860, test_f1: 0.5362
 epoch: 68, train_loss: 0.7339, test_loss: 1.1140, test_f1: 0.5325
 epoch: 69, train_loss: 0.7217, test_loss: 1.0824, test_f1: 0.5292
 epoch: 70, train_loss: 0.7255, test_loss: 1.0727, test_f1: 0.5386
 epoch: 71, train_loss: 0.7374, test_loss: 1.0609, test_f1: 0.5281
 epoch: 72, train_loss: 0.7222, test_loss: 1.0958, test_f1: 0.5119
 epoch: 73, train_loss: 0.7212, test_loss: 1.0694, test_f1: 0.5314
 epoch: 74, train_loss: 0.7194, test_loss: 1.1521, test_f1: 0.5238
 epoch: 75, train_loss: 0.7159, test_loss: 1.1259, test_f1: 0.5221
 epoch: 76, train_loss: 0.7161, test_loss: 1.1851, test_f1: 0.5191
 epoch: 77, train_loss: 0.7116, test_loss: 1.1614, test_f1: 0.5152
 epoch: 78, train_loss: 0.7178, test_loss: 1.1671, test_f1: 0.5190
 epoch: 79, train_loss: 0.7027, test_loss: 1.0899, test_f1: 0.5230
 epoch: 80, train_loss: 0.7122, test_loss: 1.1273, test_f1: 0.5365
 epoch: 81, train_loss: 0.7242, test_loss: 1.1525, test_f1: 0.5376
 epoch: 82, train_loss: 0.7017, test_loss: 1.1406, test_f1: 0.5323
 epoch: 83, train_loss: 0.6943, test_loss: 1.1484, test_f1: 0.5185
 epoch: 84, train_loss: 0.6891, test_loss: 1.1520, test_f1: 0.5191
 epoch: 85, train_loss: 0.6870, test_loss: 1.1797, test_f1: 0.5320
 epoch: 86, train_loss: 0.6923, test_loss: 1.2130, test_f1: 0.5213
 epoch: 87, train_loss: 0.7096, test_loss: 1.1815, test_f1: 0.5312
 epoch: 88, train_loss: 0.7088, test_loss: 1.2036, test_f1: 0.5307
 epoch: 89, train_loss: 0.6831, test_loss: 1.1623, test_f1: 0.5371
 epoch: 90, train_loss: 0.6786, test_loss: 1.1343, test_f1: 0.5325
 epoch: 91, train_loss: 0.6934, test_loss: 1.2172, test_f1: 0.5520
 epoch: 92, train_loss: 0.6843, test_loss: 1.1621, test_f1: 0.5579
 epoch: 93, train_loss: 0.6848, test_loss: 1.1972, test_f1: 0.5412
 epoch: 94, train_loss: 0.6894, test_loss: 1.2182, test_f1: 0.5362
 epoch: 95, train_loss: 0.6759, test_loss: 1.2168, test_f1: 0.5434
 epoch: 96, train_loss: 0.6772, test_loss: 1.1540, test_f1: 0.5426
 epoch: 97, train_loss: 0.6720, test_loss: 1.1326, test_f1: 0.5380
 epoch: 98, train_loss: 0.6587, test_loss: 1.1903, test_f1: 0.5458
 epoch: 99, train_loss: 0.6759, test_loss: 1.1445, test_f1: 0.5422
##################ITERATION #6 ****************************************
 epoch: 0, train_loss: 1.3281, test_loss: 1.1387, test_f1: 0.4451
 epoch: 1, train_loss: 1.1849, test_loss: 1.1202, test_f1: 0.4411
 epoch: 2, train_loss: 1.1658, test_loss: 1.1036, test_f1: 0.4522
 epoch: 3, train_loss: 1.1268, test_loss: 1.0705, test_f1: 0.4524
 epoch: 4, train_loss: 1.1130, test_loss: 1.0601, test_f1: 0.4590
 epoch: 5, train_loss: 1.0889, test_loss: 1.0439, test_f1: 0.4749
 epoch: 6, train_loss: 1.0733, test_loss: 1.0469, test_f1: 0.4447
 epoch: 7, train_loss: 1.0579, test_loss: 1.0135, test_f1: 0.4835
 epoch: 8, train_loss: 1.0443, test_loss: 1.0297, test_f1: 0.4742
 epoch: 9, train_loss: 1.0367, test_loss: 0.9911, test_f1: 0.4704
 epoch: 10, train_loss: 1.0309, test_loss: 1.0265, test_f1: 0.4551
 epoch: 11, train_loss: 1.0237, test_loss: 0.9783, test_f1: 0.4811
 epoch: 12, train_loss: 0.9975, test_loss: 1.0008, test_f1: 0.4808
 epoch: 13, train_loss: 0.9970, test_loss: 0.9670, test_f1: 0.4930
 epoch: 14, train_loss: 0.9860, test_loss: 0.9959, test_f1: 0.4777
 epoch: 15, train_loss: 0.9915, test_loss: 0.9688, test_f1: 0.4933
 epoch: 16, train_loss: 0.9681, test_loss: 0.9704, test_f1: 0.5059
 epoch: 17, train_loss: 0.9618, test_loss: 0.9910, test_f1: 0.4972
 epoch: 18, train_loss: 0.9564, test_loss: 0.9825, test_f1: 0.4895
 epoch: 19, train_loss: 0.9517, test_loss: 0.9706, test_f1: 0.5063
 epoch: 20, train_loss: 0.9423, test_loss: 0.9636, test_f1: 0.4890
 epoch: 21, train_loss: 0.9353, test_loss: 0.9869, test_f1: 0.4921
 epoch: 22, train_loss: 0.9285, test_loss: 0.9605, test_f1: 0.5248
 epoch: 23, train_loss: 0.9321, test_loss: 0.9544, test_f1: 0.5318
 epoch: 24, train_loss: 0.9105, test_loss: 0.9636, test_f1: 0.4879
 epoch: 25, train_loss: 0.9008, test_loss: 0.9803, test_f1: 0.4971
 epoch: 26, train_loss: 0.9020, test_loss: 0.9826, test_f1: 0.5016
 epoch: 27, train_loss: 0.8962, test_loss: 0.9626, test_f1: 0.5130
 epoch: 28, train_loss: 0.8823, test_loss: 0.9409, test_f1: 0.5212
 epoch: 29, train_loss: 0.8849, test_loss: 0.9816, test_f1: 0.5067
 epoch: 30, train_loss: 0.8774, test_loss: 0.9869, test_f1: 0.5033
 epoch: 31, train_loss: 0.8789, test_loss: 1.0014, test_f1: 0.5202
 epoch: 32, train_loss: 0.8566, test_loss: 0.9683, test_f1: 0.5338
 epoch: 33, train_loss: 0.8634, test_loss: 0.9876, test_f1: 0.5237
 epoch: 34, train_loss: 0.8592, test_loss: 0.9793, test_f1: 0.5189
 epoch: 35, train_loss: 0.8498, test_loss: 1.0384, test_f1: 0.5057
 epoch: 36, train_loss: 0.8481, test_loss: 0.9934, test_f1: 0.5243
 epoch: 37, train_loss: 0.8452, test_loss: 0.9687, test_f1: 0.5394
 epoch: 38, train_loss: 0.8283, test_loss: 1.0448, test_f1: 0.4942
 epoch: 39, train_loss: 0.8483, test_loss: 1.0459, test_f1: 0.5006
 epoch: 40, train_loss: 0.8331, test_loss: 0.9663, test_f1: 0.5443
 epoch: 41, train_loss: 0.8295, test_loss: 1.0273, test_f1: 0.5186
 epoch: 42, train_loss: 0.8181, test_loss: 1.0107, test_f1: 0.5421
 epoch: 43, train_loss: 0.8214, test_loss: 1.0470, test_f1: 0.5380
 epoch: 44, train_loss: 0.8100, test_loss: 1.0002, test_f1: 0.5285
 epoch: 45, train_loss: 0.7996, test_loss: 1.0508, test_f1: 0.5054
 epoch: 46, train_loss: 0.8011, test_loss: 1.0408, test_f1: 0.5431
 epoch: 47, train_loss: 0.8019, test_loss: 1.0374, test_f1: 0.5334
 epoch: 48, train_loss: 0.7903, test_loss: 0.9834, test_f1: 0.5371
 epoch: 49, train_loss: 0.7864, test_loss: 0.9950, test_f1: 0.5454
 epoch: 50, train_loss: 0.7817, test_loss: 1.0035, test_f1: 0.5494
 epoch: 51, train_loss: 0.7713, test_loss: 1.0095, test_f1: 0.5342
 epoch: 52, train_loss: 0.7715, test_loss: 1.0380, test_f1: 0.5358
 epoch: 53, train_loss: 0.7772, test_loss: 1.0215, test_f1: 0.5438
 epoch: 54, train_loss: 0.7620, test_loss: 1.0465, test_f1: 0.5322
 epoch: 55, train_loss: 0.7545, test_loss: 1.0331, test_f1: 0.5419
 epoch: 56, train_loss: 0.7594, test_loss: 1.0555, test_f1: 0.5269
 epoch: 57, train_loss: 0.7452, test_loss: 1.0475, test_f1: 0.5358
 epoch: 58, train_loss: 0.7498, test_loss: 1.0980, test_f1: 0.5040
 epoch: 59, train_loss: 0.7412, test_loss: 1.0707, test_f1: 0.5391
 epoch: 60, train_loss: 0.7510, test_loss: 1.0901, test_f1: 0.5184
 epoch: 61, train_loss: 0.7523, test_loss: 1.0558, test_f1: 0.5355
 epoch: 62, train_loss: 0.7404, test_loss: 1.0604, test_f1: 0.5485
 epoch: 63, train_loss: 0.7379, test_loss: 1.0647, test_f1: 0.5386
 epoch: 64, train_loss: 0.7323, test_loss: 1.0586, test_f1: 0.5374
 epoch: 65, train_loss: 0.7339, test_loss: 1.1125, test_f1: 0.5166
 epoch: 66, train_loss: 0.7357, test_loss: 1.0765, test_f1: 0.5482
 epoch: 67, train_loss: 0.7427, test_loss: 1.0651, test_f1: 0.5549
 epoch: 68, train_loss: 0.7368, test_loss: 1.0868, test_f1: 0.5324
 epoch: 69, train_loss: 0.7241, test_loss: 1.0842, test_f1: 0.5323
 epoch: 70, train_loss: 0.7340, test_loss: 1.0977, test_f1: 0.5278
 epoch: 71, train_loss: 0.7116, test_loss: 1.1146, test_f1: 0.5290
 epoch: 72, train_loss: 0.7178, test_loss: 1.0743, test_f1: 0.5458
 epoch: 73, train_loss: 0.7290, test_loss: 1.1190, test_f1: 0.5539
 epoch: 74, train_loss: 0.7125, test_loss: 1.1411, test_f1: 0.5285
 epoch: 75, train_loss: 0.7232, test_loss: 1.0539, test_f1: 0.5592
 epoch: 76, train_loss: 0.7042, test_loss: 1.0999, test_f1: 0.5387
 epoch: 77, train_loss: 0.7047, test_loss: 1.0573, test_f1: 0.5404
 epoch: 78, train_loss: 0.7103, test_loss: 1.1373, test_f1: 0.5374
 epoch: 79, train_loss: 0.6958, test_loss: 1.1140, test_f1: 0.5388
 epoch: 80, train_loss: 0.7085, test_loss: 1.0750, test_f1: 0.5296
 epoch: 81, train_loss: 0.6971, test_loss: 1.1364, test_f1: 0.5111
 epoch: 82, train_loss: 0.6990, test_loss: 1.1040, test_f1: 0.5392
 epoch: 83, train_loss: 0.6917, test_loss: 1.1604, test_f1: 0.5198
 epoch: 84, train_loss: 0.7060, test_loss: 1.1286, test_f1: 0.5364
 epoch: 85, train_loss: 0.7026, test_loss: 1.1413, test_f1: 0.5418
 epoch: 86, train_loss: 0.7085, test_loss: 1.1770, test_f1: 0.5162
 epoch: 87, train_loss: 0.6886, test_loss: 1.1369, test_f1: 0.5316
 epoch: 88, train_loss: 0.7040, test_loss: 1.1114, test_f1: 0.5294
 epoch: 89, train_loss: 0.6834, test_loss: 1.1078, test_f1: 0.5476
 epoch: 90, train_loss: 0.6962, test_loss: 1.1522, test_f1: 0.5237
 epoch: 91, train_loss: 0.6961, test_loss: 1.1859, test_f1: 0.5257
 epoch: 92, train_loss: 0.6795, test_loss: 1.1309, test_f1: 0.5592
 epoch: 93, train_loss: 0.6843, test_loss: 1.0966, test_f1: 0.5498
 epoch: 94, train_loss: 0.6847, test_loss: 1.1926, test_f1: 0.5363
 epoch: 95, train_loss: 0.6932, test_loss: 1.1492, test_f1: 0.5301
 epoch: 96, train_loss: 0.6760, test_loss: 1.1470, test_f1: 0.5472
 epoch: 97, train_loss: 0.6814, test_loss: 1.1388, test_f1: 0.5408
 epoch: 98, train_loss: 0.6935, test_loss: 1.1576, test_f1: 0.5178
 epoch: 99, train_loss: 0.6802, test_loss: 1.1867, test_f1: 0.5230
##################ITERATION #7 ****************************************
 epoch: 0, train_loss: 1.3114, test_loss: 1.1462, test_f1: 0.4766
 epoch: 1, train_loss: 1.1888, test_loss: 1.0942, test_f1: 0.4628
 epoch: 2, train_loss: 1.1492, test_loss: 1.0688, test_f1: 0.4763
 epoch: 3, train_loss: 1.1306, test_loss: 1.0585, test_f1: 0.4921
 epoch: 4, train_loss: 1.1065, test_loss: 1.0666, test_f1: 0.4679
 epoch: 5, train_loss: 1.0987, test_loss: 1.0158, test_f1: 0.4685
 epoch: 6, train_loss: 1.0817, test_loss: 1.0074, test_f1: 0.5052
 epoch: 7, train_loss: 1.0598, test_loss: 1.0037, test_f1: 0.4856
 epoch: 8, train_loss: 1.0564, test_loss: 0.9806, test_f1: 0.5197
 epoch: 9, train_loss: 1.0495, test_loss: 0.9895, test_f1: 0.5060
 epoch: 10, train_loss: 1.0395, test_loss: 0.9828, test_f1: 0.4913
 epoch: 11, train_loss: 1.0330, test_loss: 0.9907, test_f1: 0.4780
 epoch: 12, train_loss: 1.0157, test_loss: 0.9642, test_f1: 0.5061
 epoch: 13, train_loss: 0.9994, test_loss: 0.9693, test_f1: 0.4684
 epoch: 14, train_loss: 0.9923, test_loss: 0.9715, test_f1: 0.4872
 epoch: 15, train_loss: 0.9773, test_loss: 0.9670, test_f1: 0.4743
 epoch: 16, train_loss: 0.9673, test_loss: 0.9449, test_f1: 0.4957
 epoch: 17, train_loss: 0.9810, test_loss: 0.9578, test_f1: 0.5110
 epoch: 18, train_loss: 0.9751, test_loss: 0.9651, test_f1: 0.4987
 epoch: 19, train_loss: 0.9586, test_loss: 0.9774, test_f1: 0.5137
 epoch: 20, train_loss: 0.9578, test_loss: 0.9693, test_f1: 0.5104
 epoch: 21, train_loss: 0.9493, test_loss: 0.9586, test_f1: 0.5048
 epoch: 22, train_loss: 0.9410, test_loss: 0.9593, test_f1: 0.4980
 epoch: 23, train_loss: 0.9310, test_loss: 0.9565, test_f1: 0.4886
 epoch: 24, train_loss: 0.9238, test_loss: 0.9492, test_f1: 0.5061
 epoch: 25, train_loss: 0.9095, test_loss: 0.9511, test_f1: 0.5149
 epoch: 26, train_loss: 0.9023, test_loss: 0.9584, test_f1: 0.5312
 epoch: 27, train_loss: 0.9139, test_loss: 0.9358, test_f1: 0.5078
 epoch: 28, train_loss: 0.9011, test_loss: 0.9283, test_f1: 0.5217
 epoch: 29, train_loss: 0.8998, test_loss: 0.9512, test_f1: 0.5199
 epoch: 30, train_loss: 0.8972, test_loss: 0.9556, test_f1: 0.5108
 epoch: 31, train_loss: 0.8854, test_loss: 0.9415, test_f1: 0.5123
 epoch: 32, train_loss: 0.8886, test_loss: 0.9376, test_f1: 0.5102
 epoch: 33, train_loss: 0.8815, test_loss: 0.9349, test_f1: 0.5248
 epoch: 34, train_loss: 0.8763, test_loss: 0.9557, test_f1: 0.5186
 epoch: 35, train_loss: 0.8591, test_loss: 0.9371, test_f1: 0.5190
 epoch: 36, train_loss: 0.8524, test_loss: 0.9333, test_f1: 0.5362
 epoch: 37, train_loss: 0.8673, test_loss: 0.9379, test_f1: 0.5157
 epoch: 38, train_loss: 0.8519, test_loss: 0.9615, test_f1: 0.5106
 epoch: 39, train_loss: 0.8564, test_loss: 0.9971, test_f1: 0.5041
 epoch: 40, train_loss: 0.8444, test_loss: 0.9508, test_f1: 0.5228
 epoch: 41, train_loss: 0.8435, test_loss: 0.9413, test_f1: 0.5289
 epoch: 42, train_loss: 0.8304, test_loss: 1.0513, test_f1: 0.5180
 epoch: 43, train_loss: 0.8201, test_loss: 0.9348, test_f1: 0.5396
 epoch: 44, train_loss: 0.8244, test_loss: 0.9435, test_f1: 0.5340
 epoch: 45, train_loss: 0.8177, test_loss: 0.9680, test_f1: 0.5521
 epoch: 46, train_loss: 0.8187, test_loss: 0.9512, test_f1: 0.5412
 epoch: 47, train_loss: 0.8206, test_loss: 1.0026, test_f1: 0.5151
 epoch: 48, train_loss: 0.8032, test_loss: 0.9549, test_f1: 0.5308
 epoch: 49, train_loss: 0.8167, test_loss: 0.9755, test_f1: 0.5305
 epoch: 50, train_loss: 0.8073, test_loss: 0.9739, test_f1: 0.5367
 epoch: 51, train_loss: 0.7872, test_loss: 0.9837, test_f1: 0.5512
 epoch: 52, train_loss: 0.7857, test_loss: 0.9820, test_f1: 0.5207
 epoch: 53, train_loss: 0.7932, test_loss: 0.9761, test_f1: 0.5298
 epoch: 54, train_loss: 0.7717, test_loss: 0.9546, test_f1: 0.5507
 epoch: 55, train_loss: 0.7769, test_loss: 0.9581, test_f1: 0.5547
 epoch: 56, train_loss: 0.7793, test_loss: 0.9713, test_f1: 0.5336
 epoch: 57, train_loss: 0.7629, test_loss: 0.9754, test_f1: 0.5400
 epoch: 58, train_loss: 0.7660, test_loss: 0.9881, test_f1: 0.5422
 epoch: 59, train_loss: 0.7556, test_loss: 0.9790, test_f1: 0.5336
 epoch: 60, train_loss: 0.7573, test_loss: 0.9530, test_f1: 0.5491
 epoch: 61, train_loss: 0.7644, test_loss: 0.9707, test_f1: 0.5342
 epoch: 62, train_loss: 0.7617, test_loss: 0.9861, test_f1: 0.5218
 epoch: 63, train_loss: 0.7512, test_loss: 0.9802, test_f1: 0.5328
 epoch: 64, train_loss: 0.7611, test_loss: 0.9702, test_f1: 0.5488
 epoch: 65, train_loss: 0.7494, test_loss: 0.9985, test_f1: 0.5422
 epoch: 66, train_loss: 0.7533, test_loss: 1.0070, test_f1: 0.5447
 epoch: 67, train_loss: 0.7452, test_loss: 0.9970, test_f1: 0.5295
 epoch: 68, train_loss: 0.7406, test_loss: 1.0285, test_f1: 0.5421
 epoch: 69, train_loss: 0.7538, test_loss: 0.9920, test_f1: 0.5557
 epoch: 70, train_loss: 0.7425, test_loss: 1.0037, test_f1: 0.5246
 epoch: 71, train_loss: 0.7457, test_loss: 0.9913, test_f1: 0.5366
 epoch: 72, train_loss: 0.7306, test_loss: 0.9982, test_f1: 0.5273
 epoch: 73, train_loss: 0.7277, test_loss: 1.0114, test_f1: 0.5540
 epoch: 74, train_loss: 0.7399, test_loss: 1.0078, test_f1: 0.5468
 epoch: 75, train_loss: 0.7226, test_loss: 1.0081, test_f1: 0.5389
 epoch: 76, train_loss: 0.7408, test_loss: 0.9820, test_f1: 0.5423
 epoch: 77, train_loss: 0.7172, test_loss: 1.0014, test_f1: 0.5345
 epoch: 78, train_loss: 0.7247, test_loss: 1.0098, test_f1: 0.5326
 epoch: 79, train_loss: 0.7235, test_loss: 1.0157, test_f1: 0.5442
 epoch: 80, train_loss: 0.7241, test_loss: 1.0251, test_f1: 0.5503
 epoch: 81, train_loss: 0.7194, test_loss: 0.9830, test_f1: 0.5605
 epoch: 82, train_loss: 0.7188, test_loss: 1.0496, test_f1: 0.5404
 epoch: 83, train_loss: 0.7206, test_loss: 1.0363, test_f1: 0.5461
 epoch: 84, train_loss: 0.7123, test_loss: 0.9903, test_f1: 0.5577
 epoch: 85, train_loss: 0.7105, test_loss: 1.0440, test_f1: 0.5471
 epoch: 86, train_loss: 0.7070, test_loss: 1.0186, test_f1: 0.5539
 epoch: 87, train_loss: 0.7026, test_loss: 1.0526, test_f1: 0.5337
 epoch: 88, train_loss: 0.7163, test_loss: 1.0524, test_f1: 0.5450
 epoch: 89, train_loss: 0.7159, test_loss: 1.0099, test_f1: 0.5489
 epoch: 90, train_loss: 0.7083, test_loss: 1.0564, test_f1: 0.5408
 epoch: 91, train_loss: 0.7013, test_loss: 1.0165, test_f1: 0.5505
 epoch: 92, train_loss: 0.6856, test_loss: 1.0515, test_f1: 0.5429
 epoch: 93, train_loss: 0.7099, test_loss: 1.0409, test_f1: 0.5360
 epoch: 94, train_loss: 0.6869, test_loss: 1.0198, test_f1: 0.5475
 epoch: 95, train_loss: 0.6840, test_loss: 1.0204, test_f1: 0.5488
 epoch: 96, train_loss: 0.6770, test_loss: 1.0120, test_f1: 0.5633
 epoch: 97, train_loss: 0.6855, test_loss: 1.0360, test_f1: 0.5545
 epoch: 98, train_loss: 0.6921, test_loss: 1.0356, test_f1: 0.5339
 epoch: 99, train_loss: 0.6858, test_loss: 1.0358, test_f1: 0.5319
##################ITERATION #8 ****************************************
 epoch: 0, train_loss: 1.3778, test_loss: 1.1821, test_f1: 0.4542
 epoch: 1, train_loss: 1.2077, test_loss: 1.1166, test_f1: 0.4474
 epoch: 2, train_loss: 1.1779, test_loss: 1.0853, test_f1: 0.4350
 epoch: 3, train_loss: 1.1608, test_loss: 1.0825, test_f1: 0.4301
 epoch: 4, train_loss: 1.1143, test_loss: 1.0604, test_f1: 0.4618
 epoch: 5, train_loss: 1.1052, test_loss: 1.0366, test_f1: 0.4624
 epoch: 6, train_loss: 1.1018, test_loss: 1.0181, test_f1: 0.4742
 epoch: 7, train_loss: 1.0741, test_loss: 1.0031, test_f1: 0.4838
 epoch: 8, train_loss: 1.0693, test_loss: 1.2465, test_f1: 0.4313
 epoch: 9, train_loss: 1.0308, test_loss: 1.1165, test_f1: 0.4597
 epoch: 10, train_loss: 1.0322, test_loss: 1.0182, test_f1: 0.4627
 epoch: 11, train_loss: 1.0192, test_loss: 1.0532, test_f1: 0.4509
 epoch: 12, train_loss: 1.0040, test_loss: 1.0204, test_f1: 0.4642
 epoch: 13, train_loss: 1.0114, test_loss: 1.1168, test_f1: 0.4406
 epoch: 14, train_loss: 0.9847, test_loss: 1.2325, test_f1: 0.4450
 epoch: 15, train_loss: 0.9883, test_loss: 1.1380, test_f1: 0.4392
 epoch: 16, train_loss: 0.9688, test_loss: 1.0426, test_f1: 0.4502
 epoch: 17, train_loss: 0.9673, test_loss: 1.0714, test_f1: 0.4605
 epoch: 18, train_loss: 0.9436, test_loss: 0.9827, test_f1: 0.4641
 epoch: 19, train_loss: 0.9400, test_loss: 1.0103, test_f1: 0.4741
 epoch: 20, train_loss: 0.9330, test_loss: 1.1903, test_f1: 0.4690
 epoch: 21, train_loss: 0.9406, test_loss: 0.9851, test_f1: 0.4972
 epoch: 22, train_loss: 0.9203, test_loss: 0.9829, test_f1: 0.4796
 epoch: 23, train_loss: 0.9316, test_loss: 0.9704, test_f1: 0.4787
 epoch: 24, train_loss: 0.9129, test_loss: 1.0035, test_f1: 0.4847
 epoch: 25, train_loss: 0.9039, test_loss: 1.0220, test_f1: 0.4834
 epoch: 26, train_loss: 0.9004, test_loss: 1.4298, test_f1: 0.4751
 epoch: 27, train_loss: 0.8862, test_loss: 1.1150, test_f1: 0.4657
 epoch: 28, train_loss: 0.8983, test_loss: 1.0703, test_f1: 0.4860
 epoch: 29, train_loss: 0.8866, test_loss: 1.0848, test_f1: 0.4795
 epoch: 30, train_loss: 0.8688, test_loss: 1.0619, test_f1: 0.4914
 epoch: 31, train_loss: 0.8579, test_loss: 1.0270, test_f1: 0.4938
 epoch: 32, train_loss: 0.8713, test_loss: 1.1567, test_f1: 0.4806
 epoch: 33, train_loss: 0.8659, test_loss: 1.2511, test_f1: 0.4773
 epoch: 34, train_loss: 0.8545, test_loss: 1.0536, test_f1: 0.4729
 epoch: 35, train_loss: 0.8558, test_loss: 1.1826, test_f1: 0.4697
 epoch: 36, train_loss: 0.8409, test_loss: 1.2065, test_f1: 0.4790
 epoch: 37, train_loss: 0.8411, test_loss: 1.0270, test_f1: 0.4864
 epoch: 38, train_loss: 0.8576, test_loss: 1.1987, test_f1: 0.4719
 epoch: 39, train_loss: 0.8302, test_loss: 1.3331, test_f1: 0.4696
 epoch: 40, train_loss: 0.8260, test_loss: 1.2910, test_f1: 0.4845
 epoch: 41, train_loss: 0.8171, test_loss: 1.2113, test_f1: 0.4796
 epoch: 42, train_loss: 0.8113, test_loss: 1.0191, test_f1: 0.5073
 epoch: 43, train_loss: 0.8196, test_loss: 1.4177, test_f1: 0.4694
 epoch: 44, train_loss: 0.8073, test_loss: 1.3504, test_f1: 0.4830
 epoch: 45, train_loss: 0.8110, test_loss: 1.3286, test_f1: 0.4850
 epoch: 46, train_loss: 0.8009, test_loss: 1.4145, test_f1: 0.4835
 epoch: 47, train_loss: 0.7985, test_loss: 1.2480, test_f1: 0.4766
 epoch: 48, train_loss: 0.7765, test_loss: 1.0423, test_f1: 0.4860
 epoch: 49, train_loss: 0.7894, test_loss: 1.0439, test_f1: 0.5076
 epoch: 50, train_loss: 0.7866, test_loss: 1.0410, test_f1: 0.5049
 epoch: 51, train_loss: 0.7704, test_loss: 1.0498, test_f1: 0.5104
 epoch: 52, train_loss: 0.7596, test_loss: 1.0759, test_f1: 0.4957
 epoch: 53, train_loss: 0.7548, test_loss: 1.0609, test_f1: 0.4904
 epoch: 54, train_loss: 0.7437, test_loss: 1.0433, test_f1: 0.5105
 epoch: 55, train_loss: 0.7617, test_loss: 1.0451, test_f1: 0.5039
 epoch: 56, train_loss: 0.7381, test_loss: 1.0363, test_f1: 0.4984
 epoch: 57, train_loss: 0.7519, test_loss: 1.0469, test_f1: 0.5086
 epoch: 58, train_loss: 0.7490, test_loss: 1.0969, test_f1: 0.5111
 epoch: 59, train_loss: 0.7412, test_loss: 1.0473, test_f1: 0.5186
 epoch: 60, train_loss: 0.7432, test_loss: 1.0585, test_f1: 0.4956
 epoch: 61, train_loss: 0.7254, test_loss: 1.0494, test_f1: 0.5028
 epoch: 62, train_loss: 0.7316, test_loss: 1.0941, test_f1: 0.4921
 epoch: 63, train_loss: 0.7262, test_loss: 1.0865, test_f1: 0.5171
 epoch: 64, train_loss: 0.7364, test_loss: 1.0757, test_f1: 0.5067
 epoch: 65, train_loss: 0.7224, test_loss: 1.1118, test_f1: 0.5220
 epoch: 66, train_loss: 0.7119, test_loss: 1.0975, test_f1: 0.5098
 epoch: 67, train_loss: 0.7250, test_loss: 1.1015, test_f1: 0.4934
 epoch: 68, train_loss: 0.7224, test_loss: 1.1138, test_f1: 0.5012
 epoch: 69, train_loss: 0.7030, test_loss: 1.1050, test_f1: 0.4958
 epoch: 70, train_loss: 0.7086, test_loss: 1.0782, test_f1: 0.5007
 epoch: 71, train_loss: 0.7053, test_loss: 1.1245, test_f1: 0.4855
 epoch: 72, train_loss: 0.7164, test_loss: 1.0984, test_f1: 0.5025
 epoch: 73, train_loss: 0.7104, test_loss: 1.1746, test_f1: 0.4987
 epoch: 74, train_loss: 0.7210, test_loss: 1.1195, test_f1: 0.5199
 epoch: 75, train_loss: 0.7030, test_loss: 1.1520, test_f1: 0.5204
 epoch: 76, train_loss: 0.6921, test_loss: 1.0992, test_f1: 0.5234
 epoch: 77, train_loss: 0.6904, test_loss: 1.1481, test_f1: 0.5045
 epoch: 78, train_loss: 0.6908, test_loss: 1.0979, test_f1: 0.4978
 epoch: 79, train_loss: 0.6933, test_loss: 1.1669, test_f1: 0.5007
 epoch: 80, train_loss: 0.6825, test_loss: 1.1616, test_f1: 0.4794
 epoch: 81, train_loss: 0.7024, test_loss: 1.1319, test_f1: 0.5185
 epoch: 82, train_loss: 0.6948, test_loss: 1.1006, test_f1: 0.5202
 epoch: 83, train_loss: 0.6886, test_loss: 1.1178, test_f1: 0.5295
 epoch: 84, train_loss: 0.6854, test_loss: 1.1454, test_f1: 0.5147
 epoch: 85, train_loss: 0.6956, test_loss: 1.0925, test_f1: 0.5157
 epoch: 86, train_loss: 0.6849, test_loss: 1.1001, test_f1: 0.5185
 epoch: 87, train_loss: 0.6852, test_loss: 1.2550, test_f1: 0.4852
 epoch: 88, train_loss: 0.6752, test_loss: 1.1246, test_f1: 0.4940
 epoch: 89, train_loss: 0.6685, test_loss: 1.1881, test_f1: 0.4904
 epoch: 90, train_loss: 0.6901, test_loss: 1.1353, test_f1: 0.5081
 epoch: 91, train_loss: 0.6697, test_loss: 1.1458, test_f1: 0.5046
 epoch: 92, train_loss: 0.6703, test_loss: 1.1264, test_f1: 0.5332
 epoch: 93, train_loss: 0.6683, test_loss: 1.1255, test_f1: 0.5287
 epoch: 94, train_loss: 0.6628, test_loss: 1.2377, test_f1: 0.4995
 epoch: 95, train_loss: 0.6700, test_loss: 1.1450, test_f1: 0.5117
 epoch: 96, train_loss: 0.6656, test_loss: 1.1505, test_f1: 0.4968
 epoch: 97, train_loss: 0.6655, test_loss: 1.1857, test_f1: 0.5106
 epoch: 98, train_loss: 0.6554, test_loss: 1.1640, test_f1: 0.5106
 epoch: 99, train_loss: 0.6681, test_loss: 1.2051, test_f1: 0.5309
##################ITERATION #9 ****************************************
 epoch: 0, train_loss: 1.3378, test_loss: 1.1310, test_f1: 0.4352
 epoch: 1, train_loss: 1.2144, test_loss: 1.1032, test_f1: 0.4496
 epoch: 2, train_loss: 1.1789, test_loss: 1.0792, test_f1: 0.4534
 epoch: 3, train_loss: 1.1440, test_loss: 1.0555, test_f1: 0.4429
 epoch: 4, train_loss: 1.1245, test_loss: 1.0604, test_f1: 0.4629
 epoch: 5, train_loss: 1.0962, test_loss: 1.0312, test_f1: 0.4816
 epoch: 6, train_loss: 1.0931, test_loss: 1.0186, test_f1: 0.4759
 epoch: 7, train_loss: 1.0641, test_loss: 1.0042, test_f1: 0.4948
 epoch: 8, train_loss: 1.0499, test_loss: 0.9878, test_f1: 0.4519
 epoch: 9, train_loss: 1.0290, test_loss: 0.9784, test_f1: 0.4650
 epoch: 10, train_loss: 1.0267, test_loss: 0.9702, test_f1: 0.4848
 epoch: 11, train_loss: 1.0111, test_loss: 0.9825, test_f1: 0.4835
 epoch: 12, train_loss: 0.9972, test_loss: 0.9247, test_f1: 0.5054
 epoch: 13, train_loss: 0.9917, test_loss: 0.9425, test_f1: 0.4917
 epoch: 14, train_loss: 0.9756, test_loss: 0.9424, test_f1: 0.4905
 epoch: 15, train_loss: 0.9744, test_loss: 0.9208, test_f1: 0.5127
 epoch: 16, train_loss: 0.9626, test_loss: 0.9446, test_f1: 0.5176
 epoch: 17, train_loss: 0.9644, test_loss: 0.9471, test_f1: 0.5118
 epoch: 18, train_loss: 0.9499, test_loss: 0.9479, test_f1: 0.4963
 epoch: 19, train_loss: 0.9431, test_loss: 0.9321, test_f1: 0.5200
 epoch: 20, train_loss: 0.9403, test_loss: 0.9479, test_f1: 0.5006
 epoch: 21, train_loss: 0.9145, test_loss: 0.9392, test_f1: 0.5081
 epoch: 22, train_loss: 0.9147, test_loss: 0.9338, test_f1: 0.5124
 epoch: 23, train_loss: 0.9218, test_loss: 0.9162, test_f1: 0.5332
 epoch: 24, train_loss: 0.9136, test_loss: 0.9487, test_f1: 0.5004
 epoch: 25, train_loss: 0.9074, test_loss: 0.9437, test_f1: 0.5320
 epoch: 26, train_loss: 0.8922, test_loss: 0.9481, test_f1: 0.5090
 epoch: 27, train_loss: 0.8873, test_loss: 0.9394, test_f1: 0.5009
 epoch: 28, train_loss: 0.8758, test_loss: 0.9615, test_f1: 0.5249
 epoch: 29, train_loss: 0.8752, test_loss: 0.9430, test_f1: 0.5318
 epoch: 30, train_loss: 0.8703, test_loss: 0.9693, test_f1: 0.4942
 epoch: 31, train_loss: 0.8802, test_loss: 0.9555, test_f1: 0.5161
 epoch: 32, train_loss: 0.8699, test_loss: 0.9505, test_f1: 0.5190
 epoch: 33, train_loss: 0.8529, test_loss: 0.9711, test_f1: 0.5308
 epoch: 34, train_loss: 0.8558, test_loss: 0.9873, test_f1: 0.4994
 epoch: 35, train_loss: 0.8456, test_loss: 0.9428, test_f1: 0.5398
 epoch: 36, train_loss: 0.8471, test_loss: 0.9690, test_f1: 0.5190
 epoch: 37, train_loss: 0.8375, test_loss: 0.9755, test_f1: 0.5140
 epoch: 38, train_loss: 0.8331, test_loss: 0.9904, test_f1: 0.5217
 epoch: 39, train_loss: 0.8235, test_loss: 0.9960, test_f1: 0.5154
 epoch: 40, train_loss: 0.8254, test_loss: 1.0111, test_f1: 0.5088
 epoch: 41, train_loss: 0.8190, test_loss: 0.9882, test_f1: 0.5363
 epoch: 42, train_loss: 0.8277, test_loss: 0.9867, test_f1: 0.5147
 epoch: 43, train_loss: 0.8158, test_loss: 0.9571, test_f1: 0.5224
 epoch: 44, train_loss: 0.8133, test_loss: 1.0054, test_f1: 0.5067
 epoch: 45, train_loss: 0.7945, test_loss: 0.9939, test_f1: 0.5228
 epoch: 46, train_loss: 0.8005, test_loss: 1.0207, test_f1: 0.5197
 epoch: 47, train_loss: 0.8045, test_loss: 0.9751, test_f1: 0.5406
 epoch: 48, train_loss: 0.7848, test_loss: 1.0044, test_f1: 0.5375
 epoch: 49, train_loss: 0.7990, test_loss: 0.9768, test_f1: 0.5223
 epoch: 50, train_loss: 0.7961, test_loss: 1.0122, test_f1: 0.5299
 epoch: 51, train_loss: 0.7750, test_loss: 1.0081, test_f1: 0.5417
 epoch: 52, train_loss: 0.7576, test_loss: 1.0059, test_f1: 0.5339
 epoch: 53, train_loss: 0.7669, test_loss: 1.0131, test_f1: 0.5438
 epoch: 54, train_loss: 0.7458, test_loss: 1.0032, test_f1: 0.5288
 epoch: 55, train_loss: 0.7533, test_loss: 1.0258, test_f1: 0.5233
 epoch: 56, train_loss: 0.7351, test_loss: 1.0201, test_f1: 0.5272
 epoch: 57, train_loss: 0.7535, test_loss: 1.0435, test_f1: 0.5343
 epoch: 58, train_loss: 0.7478, test_loss: 1.0291, test_f1: 0.5183
 epoch: 59, train_loss: 0.7520, test_loss: 1.0285, test_f1: 0.5401
 epoch: 60, train_loss: 0.7370, test_loss: 1.0703, test_f1: 0.5122
 epoch: 61, train_loss: 0.7386, test_loss: 1.0051, test_f1: 0.5298
 epoch: 62, train_loss: 0.7284, test_loss: 1.0534, test_f1: 0.5092
 epoch: 63, train_loss: 0.7332, test_loss: 1.0658, test_f1: 0.5172
 epoch: 64, train_loss: 0.7260, test_loss: 1.0472, test_f1: 0.5478
 epoch: 65, train_loss: 0.7434, test_loss: 1.0493, test_f1: 0.5430
 epoch: 66, train_loss: 0.7304, test_loss: 1.0527, test_f1: 0.5281
 epoch: 67, train_loss: 0.7246, test_loss: 1.0417, test_f1: 0.5207
 epoch: 68, train_loss: 0.7166, test_loss: 1.0282, test_f1: 0.5330
 epoch: 69, train_loss: 0.7234, test_loss: 1.0538, test_f1: 0.5294
 epoch: 70, train_loss: 0.7294, test_loss: 1.0315, test_f1: 0.5402
 epoch: 71, train_loss: 0.7166, test_loss: 1.0376, test_f1: 0.5418
 epoch: 72, train_loss: 0.7112, test_loss: 1.0641, test_f1: 0.5143
 epoch: 73, train_loss: 0.7150, test_loss: 1.0260, test_f1: 0.5509
 epoch: 74, train_loss: 0.7083, test_loss: 0.9726, test_f1: 0.5204
 epoch: 75, train_loss: 0.7122, test_loss: 1.0567, test_f1: 0.5311
 epoch: 76, train_loss: 0.7123, test_loss: 1.0412, test_f1: 0.5493
 epoch: 77, train_loss: 0.7028, test_loss: 1.0460, test_f1: 0.5337
 epoch: 78, train_loss: 0.7069, test_loss: 1.0758, test_f1: 0.5312
 epoch: 79, train_loss: 0.7045, test_loss: 1.0833, test_f1: 0.5374
 epoch: 80, train_loss: 0.7003, test_loss: 1.0375, test_f1: 0.5475
 epoch: 81, train_loss: 0.6850, test_loss: 1.0996, test_f1: 0.5293
 epoch: 82, train_loss: 0.6968, test_loss: 1.0513, test_f1: 0.5284
 epoch: 83, train_loss: 0.6850, test_loss: 1.0858, test_f1: 0.5276
 epoch: 84, train_loss: 0.6878, test_loss: 1.1150, test_f1: 0.5327
 epoch: 85, train_loss: 0.7003, test_loss: 1.0652, test_f1: 0.5413
 epoch: 86, train_loss: 0.6655, test_loss: 1.0425, test_f1: 0.5360
 epoch: 87, train_loss: 0.6853, test_loss: 1.0839, test_f1: 0.5348
 epoch: 88, train_loss: 0.6902, test_loss: 1.0964, test_f1: 0.5252
 epoch: 89, train_loss: 0.6783, test_loss: 1.0691, test_f1: 0.5417
 epoch: 90, train_loss: 0.6890, test_loss: 1.0631, test_f1: 0.5375
 epoch: 91, train_loss: 0.6918, test_loss: 1.0766, test_f1: 0.5460
 epoch: 92, train_loss: 0.6777, test_loss: 1.0852, test_f1: 0.5389
 epoch: 93, train_loss: 0.6655, test_loss: 1.0773, test_f1: 0.5303
 epoch: 94, train_loss: 0.6755, test_loss: 1.0718, test_f1: 0.5507
 epoch: 95, train_loss: 0.6698, test_loss: 1.1277, test_f1: 0.5250
 epoch: 96, train_loss: 0.6724, test_loss: 1.1091, test_f1: 0.5356
 epoch: 97, train_loss: 0.6654, test_loss: 1.1294, test_f1: 0.5187
 epoch: 98, train_loss: 0.6600, test_loss: 1.1089, test_f1: 0.5451
 epoch: 99, train_loss: 0.6617, test_loss: 1.1037, test_f1: 0.5455

Training completed in 794.76 seconds
Best F1: 0.5670 at epoch 87
Mean F1 across iterations: 0.5535  0.0093
========================FINAL RESULTS================================
FEGIN weighted F1: 0.5670  0.0093
python main.py --data ltspice_examples --representation component_component --model FEGIN --layers 2 --hiddens 128 --batch_size 32 --lr 0.0001 --emb_size 250 --epochs 100 --save_appendix component_component_L2_H128_BS32_LR0.0001_E250 --no_val
-----



STDERR:
  File "main.py", line 370, in <module>
    main()
  File "main.py", line 254, in main
    dataset = dataset_class(
  File "/home/philip/projects/ltspice_examples_code_repo/Circuit-Completion-Using-GNNs/component_classification_with_link_prediction_head/evaluation/FEGIN/kernel/circuit_datasets.py", line 15, in __init__
    self.data, self.slices = torch.load(self.processed_paths[0])
  File "/home/philip/.local/lib/python3.8/site-packages/torch/serialization.py", line 1040, in load
    warnings.warn(
  File "/usr/lib/python3.8/warnings.py", line 109, in _showwarnmsg
    sw(msg.message, msg.category, msg.filename, msg.lineno,
  File "main.py", line 47, in warn_with_traceback
    traceback.print_stack(file=log)
/home/philip/projects/ltspice_examples_code_repo/Circuit-Completion-Using-GNNs/component_classification_with_link_prediction_head/evaluation/FEGIN/kernel/circuit_datasets.py:15: FutureWarning: You are using `torch.load` with `weights_only=False` (the current default value), which uses the default pickle module implicitly. It is possible to construct malicious pickle data which will execute arbitrary code during unpickling (See https://github.com/pytorch/pytorch/blob/main/SECURITY.md#untrusted-models for more details). In a future release, the default value for `weights_only` will be flipped to `True`. This limits the functions that could be executed during unpickling. Arbitrary objects will no longer be allowed to be loaded via this mode unless they are explicitly allowlisted by the user via `torch.serialization.add_safe_globals`. We recommend you start setting `weights_only=True` for any use case where you don't have full control of the loaded file. Please open an issue on GitHub for any issues related to this experimental feature.
  self.data, self.slices = torch.load(self.processed_paths[0])
