STDOUT:
Results will be saved in /home/philip/projects/ltspice_examples_code_repo/Circuit-Completion-Using-GNNs/component_classification_with_link_prediction_head/evaluation/FEGIN/results/model_FEGIN_dataset_ltspice_examples
Command line input: python main.py --data ltspice_examples --representation component_component --model FEGIN --layers 5 --hiddens 16 --batch_size 64 --lr 0.0001 --emb_size 128 --epochs 100 --save_appendix component_component_L5_H16_BS64_LR0.0001_E128 --no_val
 is saved.
-----
ltspice_examples - FEGIN
Using 5 layers, 16 hidden units, h = 2
Loading component_component representation dataset
ENTERED
Training FEGIN on component_component representation
Train: 3556, Test: 845
##################ITERATION #0 ****************************************
 epoch: 0, train_loss: 1.4169, test_loss: 1.4148, test_f1: 0.0295
 epoch: 1, train_loss: 1.4097, test_loss: 1.4094, test_f1: 0.0295
 epoch: 2, train_loss: 1.4043, test_loss: 1.4048, test_f1: 0.0295
 epoch: 3, train_loss: 1.3991, test_loss: 1.3990, test_f1: 0.0295
 epoch: 4, train_loss: 1.3931, test_loss: 1.3931, test_f1: 0.0455
 epoch: 5, train_loss: 1.3861, test_loss: 1.3862, test_f1: 0.2284
 epoch: 6, train_loss: 1.3782, test_loss: 1.3794, test_f1: 0.2289
 epoch: 7, train_loss: 1.3699, test_loss: 1.3714, test_f1: 0.2251
 epoch: 8, train_loss: 1.3623, test_loss: 1.3645, test_f1: 0.2261
 epoch: 9, train_loss: 1.3506, test_loss: 1.3528, test_f1: 0.2277
 epoch: 10, train_loss: 1.3420, test_loss: 1.3457, test_f1: 0.2266
 epoch: 11, train_loss: 1.3340, test_loss: 1.3377, test_f1: 0.2274
 epoch: 12, train_loss: 1.3293, test_loss: 1.3303, test_f1: 0.2274
 epoch: 13, train_loss: 1.3207, test_loss: 1.3250, test_f1: 0.2274
 epoch: 14, train_loss: 1.3172, test_loss: 1.3195, test_f1: 0.2274
 epoch: 15, train_loss: 1.3103, test_loss: 1.3138, test_f1: 0.2274
 epoch: 16, train_loss: 1.3058, test_loss: 1.3086, test_f1: 0.2274
 epoch: 17, train_loss: 1.3021, test_loss: 1.3039, test_f1: 0.2274
 epoch: 18, train_loss: 1.3000, test_loss: 1.2996, test_f1: 0.2274
 epoch: 19, train_loss: 1.2954, test_loss: 1.2966, test_f1: 0.2274
 epoch: 20, train_loss: 1.2943, test_loss: 1.2923, test_f1: 0.2274
 epoch: 21, train_loss: 1.2910, test_loss: 1.2886, test_f1: 0.2274
 epoch: 22, train_loss: 1.2872, test_loss: 1.2838, test_f1: 0.2274
 epoch: 23, train_loss: 1.2853, test_loss: 1.2835, test_f1: 0.2274
 epoch: 24, train_loss: 1.2809, test_loss: 1.2808, test_f1: 0.2274
 epoch: 25, train_loss: 1.2810, test_loss: 1.2788, test_f1: 0.2274
 epoch: 26, train_loss: 1.2769, test_loss: 1.2752, test_f1: 0.2274
 epoch: 27, train_loss: 1.2747, test_loss: 1.2727, test_f1: 0.2274
 epoch: 28, train_loss: 1.2748, test_loss: 1.2701, test_f1: 0.2274
 epoch: 29, train_loss: 1.2707, test_loss: 1.2692, test_f1: 0.2274
 epoch: 30, train_loss: 1.2687, test_loss: 1.2653, test_f1: 0.2274
 epoch: 31, train_loss: 1.2668, test_loss: 1.2643, test_f1: 0.2274
 epoch: 32, train_loss: 1.2679, test_loss: 1.2591, test_f1: 0.2274
 epoch: 33, train_loss: 1.2626, test_loss: 1.2560, test_f1: 0.2274
 epoch: 34, train_loss: 1.2604, test_loss: 1.2577, test_f1: 0.2274
 epoch: 35, train_loss: 1.2587, test_loss: 1.2525, test_f1: 0.2274
 epoch: 36, train_loss: 1.2579, test_loss: 1.2487, test_f1: 0.2274
 epoch: 37, train_loss: 1.2550, test_loss: 1.2458, test_f1: 0.2274
 epoch: 38, train_loss: 1.2574, test_loss: 1.2445, test_f1: 0.2274
 epoch: 39, train_loss: 1.2460, test_loss: 1.2411, test_f1: 0.2274
 epoch: 40, train_loss: 1.2461, test_loss: 1.2394, test_f1: 0.2274
 epoch: 41, train_loss: 1.2471, test_loss: 1.2378, test_f1: 0.2274
 epoch: 42, train_loss: 1.2428, test_loss: 1.2325, test_f1: 0.2274
 epoch: 43, train_loss: 1.2421, test_loss: 1.2313, test_f1: 0.2274
 epoch: 44, train_loss: 1.2423, test_loss: 1.2298, test_f1: 0.2274
 epoch: 45, train_loss: 1.2393, test_loss: 1.2263, test_f1: 0.2300
 epoch: 46, train_loss: 1.2370, test_loss: 1.2241, test_f1: 0.2325
 epoch: 47, train_loss: 1.2377, test_loss: 1.2208, test_f1: 0.2424
 epoch: 48, train_loss: 1.2406, test_loss: 1.2177, test_f1: 0.2424
 epoch: 49, train_loss: 1.2323, test_loss: 1.2157, test_f1: 0.2448
 epoch: 50, train_loss: 1.2277, test_loss: 1.2142, test_f1: 0.2613
 epoch: 51, train_loss: 1.2277, test_loss: 1.2159, test_f1: 0.2681
 epoch: 52, train_loss: 1.2265, test_loss: 1.2134, test_f1: 0.2681
 epoch: 53, train_loss: 1.2299, test_loss: 1.2107, test_f1: 0.2636
 epoch: 54, train_loss: 1.2267, test_loss: 1.2090, test_f1: 0.2681
 epoch: 55, train_loss: 1.2247, test_loss: 1.2085, test_f1: 0.2740
 epoch: 56, train_loss: 1.2223, test_loss: 1.2087, test_f1: 0.2804
 epoch: 57, train_loss: 1.2289, test_loss: 1.2087, test_f1: 0.2761
 epoch: 58, train_loss: 1.2206, test_loss: 1.2024, test_f1: 0.2762
 epoch: 59, train_loss: 1.2183, test_loss: 1.2035, test_f1: 0.2944
 epoch: 60, train_loss: 1.2166, test_loss: 1.2022, test_f1: 0.2981
 epoch: 61, train_loss: 1.2183, test_loss: 1.1997, test_f1: 0.2929
 epoch: 62, train_loss: 1.2169, test_loss: 1.1984, test_f1: 0.3254
 epoch: 63, train_loss: 1.2139, test_loss: 1.1993, test_f1: 0.3293
 epoch: 64, train_loss: 1.2142, test_loss: 1.1993, test_f1: 0.3410
 epoch: 65, train_loss: 1.2187, test_loss: 1.1966, test_f1: 0.3452
 epoch: 66, train_loss: 1.2137, test_loss: 1.1979, test_f1: 0.3639
 epoch: 67, train_loss: 1.2117, test_loss: 1.1977, test_f1: 0.3707
 epoch: 68, train_loss: 1.2116, test_loss: 1.1943, test_f1: 0.3799
 epoch: 69, train_loss: 1.2085, test_loss: 1.1922, test_f1: 0.3860
 epoch: 70, train_loss: 1.2103, test_loss: 1.1930, test_f1: 0.3920
 epoch: 71, train_loss: 1.2143, test_loss: 1.1898, test_f1: 0.3882
 epoch: 72, train_loss: 1.2142, test_loss: 1.1893, test_f1: 0.3935
 epoch: 73, train_loss: 1.2076, test_loss: 1.1886, test_f1: 0.4028
 epoch: 74, train_loss: 1.2131, test_loss: 1.1855, test_f1: 0.3951
 epoch: 75, train_loss: 1.2085, test_loss: 1.1853, test_f1: 0.4094
 epoch: 76, train_loss: 1.2043, test_loss: 1.1829, test_f1: 0.3972
 epoch: 77, train_loss: 1.2105, test_loss: 1.1836, test_f1: 0.4082
 epoch: 78, train_loss: 1.2079, test_loss: 1.1809, test_f1: 0.4125
 epoch: 79, train_loss: 1.2019, test_loss: 1.1820, test_f1: 0.4165
 epoch: 80, train_loss: 1.2042, test_loss: 1.1789, test_f1: 0.4196
 epoch: 81, train_loss: 1.2090, test_loss: 1.1776, test_f1: 0.4204
 epoch: 82, train_loss: 1.2047, test_loss: 1.1802, test_f1: 0.4261
 epoch: 83, train_loss: 1.2026, test_loss: 1.1760, test_f1: 0.4263
 epoch: 84, train_loss: 1.2019, test_loss: 1.1753, test_f1: 0.4139
 epoch: 85, train_loss: 1.2014, test_loss: 1.1732, test_f1: 0.4179
 epoch: 86, train_loss: 1.2021, test_loss: 1.1715, test_f1: 0.4180
 epoch: 87, train_loss: 1.1927, test_loss: 1.1704, test_f1: 0.4233
 epoch: 88, train_loss: 1.1978, test_loss: 1.1730, test_f1: 0.4316
 epoch: 89, train_loss: 1.1953, test_loss: 1.1682, test_f1: 0.4321
 epoch: 90, train_loss: 1.1915, test_loss: 1.1672, test_f1: 0.4319
 epoch: 91, train_loss: 1.1944, test_loss: 1.1667, test_f1: 0.4177
 epoch: 92, train_loss: 1.1892, test_loss: 1.1672, test_f1: 0.4296
 epoch: 93, train_loss: 1.1900, test_loss: 1.1643, test_f1: 0.4268
 epoch: 94, train_loss: 1.1944, test_loss: 1.1647, test_f1: 0.4396
 epoch: 95, train_loss: 1.1895, test_loss: 1.1643, test_f1: 0.4342
 epoch: 96, train_loss: 1.1892, test_loss: 1.1606, test_f1: 0.4289
 epoch: 97, train_loss: 1.1871, test_loss: 1.1597, test_f1: 0.4410
 epoch: 98, train_loss: 1.1850, test_loss: 1.1593, test_f1: 0.4344
 epoch: 99, train_loss: 1.1841, test_loss: 1.1592, test_f1: 0.4292
##################ITERATION #1 ****************************************
 epoch: 0, train_loss: 1.3493, test_loss: 1.3411, test_f1: 0.2274
 epoch: 1, train_loss: 1.3382, test_loss: 1.3314, test_f1: 0.2274
 epoch: 2, train_loss: 1.3322, test_loss: 1.3257, test_f1: 0.2274
 epoch: 3, train_loss: 1.3256, test_loss: 1.3183, test_f1: 0.2274
 epoch: 4, train_loss: 1.3184, test_loss: 1.3118, test_f1: 0.2274
 epoch: 5, train_loss: 1.3117, test_loss: 1.3057, test_f1: 0.2274
 epoch: 6, train_loss: 1.3045, test_loss: 1.3019, test_f1: 0.2274
 epoch: 7, train_loss: 1.2993, test_loss: 1.2934, test_f1: 0.2274
 epoch: 8, train_loss: 1.2952, test_loss: 1.2900, test_f1: 0.2274
 epoch: 9, train_loss: 1.2920, test_loss: 1.2836, test_f1: 0.2274
 epoch: 10, train_loss: 1.2881, test_loss: 1.2789, test_f1: 0.2274
 epoch: 11, train_loss: 1.2826, test_loss: 1.2755, test_f1: 0.2274
 epoch: 12, train_loss: 1.2808, test_loss: 1.2734, test_f1: 0.2274
 epoch: 13, train_loss: 1.2746, test_loss: 1.2681, test_f1: 0.2274
 epoch: 14, train_loss: 1.2749, test_loss: 1.2660, test_f1: 0.2274
 epoch: 15, train_loss: 1.2739, test_loss: 1.2647, test_f1: 0.2274
 epoch: 16, train_loss: 1.2715, test_loss: 1.2644, test_f1: 0.2274
 epoch: 17, train_loss: 1.2710, test_loss: 1.2647, test_f1: 0.2274
 epoch: 18, train_loss: 1.2707, test_loss: 1.2602, test_f1: 0.2274
 epoch: 19, train_loss: 1.2662, test_loss: 1.2561, test_f1: 0.2274
 epoch: 20, train_loss: 1.2651, test_loss: 1.2560, test_f1: 0.2274
 epoch: 21, train_loss: 1.2636, test_loss: 1.2545, test_f1: 0.2274
 epoch: 22, train_loss: 1.2605, test_loss: 1.2492, test_f1: 0.2274
 epoch: 23, train_loss: 1.2633, test_loss: 1.2492, test_f1: 0.2274
 epoch: 24, train_loss: 1.2601, test_loss: 1.2492, test_f1: 0.2274
 epoch: 25, train_loss: 1.2620, test_loss: 1.2463, test_f1: 0.2274
 epoch: 26, train_loss: 1.2530, test_loss: 1.2430, test_f1: 0.2274
 epoch: 27, train_loss: 1.2555, test_loss: 1.2396, test_f1: 0.2274
 epoch: 28, train_loss: 1.2557, test_loss: 1.2386, test_f1: 0.2274
 epoch: 29, train_loss: 1.2517, test_loss: 1.2388, test_f1: 0.2274
 epoch: 30, train_loss: 1.2513, test_loss: 1.2367, test_f1: 0.2276
 epoch: 31, train_loss: 1.2481, test_loss: 1.2355, test_f1: 0.2561
 epoch: 32, train_loss: 1.2452, test_loss: 1.2330, test_f1: 0.2561
 epoch: 33, train_loss: 1.2467, test_loss: 1.2295, test_f1: 0.2555
 epoch: 34, train_loss: 1.2478, test_loss: 1.2255, test_f1: 0.2555
 epoch: 35, train_loss: 1.2436, test_loss: 1.2277, test_f1: 0.2555
 epoch: 36, train_loss: 1.2424, test_loss: 1.2275, test_f1: 0.2555
 epoch: 37, train_loss: 1.2392, test_loss: 1.2264, test_f1: 0.2557
 epoch: 38, train_loss: 1.2355, test_loss: 1.2229, test_f1: 0.2602
 epoch: 39, train_loss: 1.2402, test_loss: 1.2203, test_f1: 0.2635
 epoch: 40, train_loss: 1.2342, test_loss: 1.2197, test_f1: 0.2609
 epoch: 41, train_loss: 1.2398, test_loss: 1.2222, test_f1: 0.2675
 epoch: 42, train_loss: 1.2315, test_loss: 1.2172, test_f1: 0.2644
 epoch: 43, train_loss: 1.2376, test_loss: 1.2174, test_f1: 0.2738
 epoch: 44, train_loss: 1.2326, test_loss: 1.2124, test_f1: 0.2861
 epoch: 45, train_loss: 1.2330, test_loss: 1.2157, test_f1: 0.3054
 epoch: 46, train_loss: 1.2306, test_loss: 1.2115, test_f1: 0.3213
 epoch: 47, train_loss: 1.2313, test_loss: 1.2127, test_f1: 0.3253
 epoch: 48, train_loss: 1.2312, test_loss: 1.2059, test_f1: 0.3387
 epoch: 49, train_loss: 1.2296, test_loss: 1.2051, test_f1: 0.3400
 epoch: 50, train_loss: 1.2237, test_loss: 1.2089, test_f1: 0.3472
 epoch: 51, train_loss: 1.2236, test_loss: 1.2055, test_f1: 0.3475
 epoch: 52, train_loss: 1.2246, test_loss: 1.2053, test_f1: 0.3479
 epoch: 53, train_loss: 1.2250, test_loss: 1.2036, test_f1: 0.3495
 epoch: 54, train_loss: 1.2234, test_loss: 1.2067, test_f1: 0.3521
 epoch: 55, train_loss: 1.2184, test_loss: 1.2032, test_f1: 0.3457
 epoch: 56, train_loss: 1.2245, test_loss: 1.2025, test_f1: 0.3478
 epoch: 57, train_loss: 1.2225, test_loss: 1.2002, test_f1: 0.3486
 epoch: 58, train_loss: 1.2208, test_loss: 1.2027, test_f1: 0.3489
 epoch: 59, train_loss: 1.2185, test_loss: 1.2041, test_f1: 0.3486
 epoch: 60, train_loss: 1.2201, test_loss: 1.2014, test_f1: 0.3472
 epoch: 61, train_loss: 1.2203, test_loss: 1.2015, test_f1: 0.3506
 epoch: 62, train_loss: 1.2197, test_loss: 1.2004, test_f1: 0.3474
 epoch: 63, train_loss: 1.2225, test_loss: 1.2000, test_f1: 0.3503
 epoch: 64, train_loss: 1.2180, test_loss: 1.1964, test_f1: 0.3498
 epoch: 65, train_loss: 1.2198, test_loss: 1.1991, test_f1: 0.3483
 epoch: 66, train_loss: 1.2155, test_loss: 1.1980, test_f1: 0.3508
 epoch: 67, train_loss: 1.2190, test_loss: 1.1982, test_f1: 0.3501
 epoch: 68, train_loss: 1.2204, test_loss: 1.1956, test_f1: 0.3503
 epoch: 69, train_loss: 1.2144, test_loss: 1.1931, test_f1: 0.3532
 epoch: 70, train_loss: 1.2184, test_loss: 1.1944, test_f1: 0.3482
 epoch: 71, train_loss: 1.2093, test_loss: 1.1949, test_f1: 0.3458
 epoch: 72, train_loss: 1.2141, test_loss: 1.1963, test_f1: 0.3505
 epoch: 73, train_loss: 1.2161, test_loss: 1.1942, test_f1: 0.3524
 epoch: 74, train_loss: 1.2108, test_loss: 1.1907, test_f1: 0.3506
 epoch: 75, train_loss: 1.2106, test_loss: 1.1924, test_f1: 0.3532
 epoch: 76, train_loss: 1.2080, test_loss: 1.1904, test_f1: 0.3491
 epoch: 77, train_loss: 1.2100, test_loss: 1.1913, test_f1: 0.3455
 epoch: 78, train_loss: 1.2107, test_loss: 1.1918, test_f1: 0.3530
 epoch: 79, train_loss: 1.2078, test_loss: 1.1889, test_f1: 0.3473
 epoch: 80, train_loss: 1.2070, test_loss: 1.1891, test_f1: 0.3530
 epoch: 81, train_loss: 1.2086, test_loss: 1.1903, test_f1: 0.3517
 epoch: 82, train_loss: 1.2065, test_loss: 1.1881, test_f1: 0.3514
 epoch: 83, train_loss: 1.2045, test_loss: 1.1865, test_f1: 0.3500
 epoch: 84, train_loss: 1.2076, test_loss: 1.1858, test_f1: 0.3457
 epoch: 85, train_loss: 1.2059, test_loss: 1.1860, test_f1: 0.3492
 epoch: 86, train_loss: 1.2079, test_loss: 1.1871, test_f1: 0.3515
 epoch: 87, train_loss: 1.1973, test_loss: 1.1862, test_f1: 0.3490
 epoch: 88, train_loss: 1.2038, test_loss: 1.1828, test_f1: 0.3456
 epoch: 89, train_loss: 1.2009, test_loss: 1.1842, test_f1: 0.3411
 epoch: 90, train_loss: 1.2013, test_loss: 1.1840, test_f1: 0.3466
 epoch: 91, train_loss: 1.1981, test_loss: 1.1832, test_f1: 0.3443
 epoch: 92, train_loss: 1.2073, test_loss: 1.1824, test_f1: 0.3418
 epoch: 93, train_loss: 1.2009, test_loss: 1.1839, test_f1: 0.3451
 epoch: 94, train_loss: 1.2023, test_loss: 1.1813, test_f1: 0.3443
 epoch: 95, train_loss: 1.2018, test_loss: 1.1825, test_f1: 0.3515
 epoch: 96, train_loss: 1.2038, test_loss: 1.1793, test_f1: 0.3481
 epoch: 97, train_loss: 1.1994, test_loss: 1.1805, test_f1: 0.3457
 epoch: 98, train_loss: 1.1883, test_loss: 1.1811, test_f1: 0.3506
 epoch: 99, train_loss: 1.2001, test_loss: 1.1794, test_f1: 0.3480
##################ITERATION #2 ****************************************
 epoch: 0, train_loss: 1.3200, test_loss: 1.3260, test_f1: 0.2274
 epoch: 1, train_loss: 1.3119, test_loss: 1.3211, test_f1: 0.2274
 epoch: 2, train_loss: 1.3088, test_loss: 1.3168, test_f1: 0.2274
 epoch: 3, train_loss: 1.3020, test_loss: 1.3105, test_f1: 0.2274
 epoch: 4, train_loss: 1.2963, test_loss: 1.3040, test_f1: 0.2274
 epoch: 5, train_loss: 1.2919, test_loss: 1.3043, test_f1: 0.2274
 epoch: 6, train_loss: 1.2903, test_loss: 1.2990, test_f1: 0.2274
 epoch: 7, train_loss: 1.2849, test_loss: 1.2938, test_f1: 0.2274
 epoch: 8, train_loss: 1.2822, test_loss: 1.2907, test_f1: 0.2274
 epoch: 9, train_loss: 1.2776, test_loss: 1.2863, test_f1: 0.2274
 epoch: 10, train_loss: 1.2743, test_loss: 1.2813, test_f1: 0.2274
 epoch: 11, train_loss: 1.2715, test_loss: 1.2751, test_f1: 0.2274
 epoch: 12, train_loss: 1.2703, test_loss: 1.2753, test_f1: 0.2274
 epoch: 13, train_loss: 1.2672, test_loss: 1.2748, test_f1: 0.2274
 epoch: 14, train_loss: 1.2627, test_loss: 1.2688, test_f1: 0.2274
 epoch: 15, train_loss: 1.2609, test_loss: 1.2687, test_f1: 0.2274
 epoch: 16, train_loss: 1.2580, test_loss: 1.2640, test_f1: 0.2274
 epoch: 17, train_loss: 1.2564, test_loss: 1.2596, test_f1: 0.2274
 epoch: 18, train_loss: 1.2496, test_loss: 1.2584, test_f1: 0.2274
 epoch: 19, train_loss: 1.2516, test_loss: 1.2533, test_f1: 0.2274
 epoch: 20, train_loss: 1.2482, test_loss: 1.2491, test_f1: 0.2274
 epoch: 21, train_loss: 1.2460, test_loss: 1.2519, test_f1: 0.2274
 epoch: 22, train_loss: 1.2464, test_loss: 1.2461, test_f1: 0.2274
 epoch: 23, train_loss: 1.2452, test_loss: 1.2428, test_f1: 0.2276
 epoch: 24, train_loss: 1.2432, test_loss: 1.2426, test_f1: 0.2274
 epoch: 25, train_loss: 1.2417, test_loss: 1.2404, test_f1: 0.2401
 epoch: 26, train_loss: 1.2417, test_loss: 1.2408, test_f1: 0.2397
 epoch: 27, train_loss: 1.2418, test_loss: 1.2394, test_f1: 0.2392
 epoch: 28, train_loss: 1.2356, test_loss: 1.2339, test_f1: 0.2395
 epoch: 29, train_loss: 1.2343, test_loss: 1.2329, test_f1: 0.2397
 epoch: 30, train_loss: 1.2246, test_loss: 1.2280, test_f1: 0.2395
 epoch: 31, train_loss: 1.2277, test_loss: 1.2250, test_f1: 0.2397
 epoch: 32, train_loss: 1.2259, test_loss: 1.2224, test_f1: 0.2392
 epoch: 33, train_loss: 1.2253, test_loss: 1.2217, test_f1: 0.2392
 epoch: 34, train_loss: 1.2254, test_loss: 1.2207, test_f1: 0.2392
 epoch: 35, train_loss: 1.2251, test_loss: 1.2197, test_f1: 0.2409
 epoch: 36, train_loss: 1.2232, test_loss: 1.2261, test_f1: 0.2434
 epoch: 37, train_loss: 1.2144, test_loss: 1.2341, test_f1: 0.2573
 epoch: 38, train_loss: 1.2165, test_loss: 1.2171, test_f1: 0.2738
 epoch: 39, train_loss: 1.2167, test_loss: 1.2158, test_f1: 0.2859
 epoch: 40, train_loss: 1.2125, test_loss: 1.2123, test_f1: 0.2946
 epoch: 41, train_loss: 1.2093, test_loss: 1.2250, test_f1: 0.2997
 epoch: 42, train_loss: 1.2107, test_loss: 1.2114, test_f1: 0.3014
 epoch: 43, train_loss: 1.2116, test_loss: 1.2073, test_f1: 0.2972
 epoch: 44, train_loss: 1.2060, test_loss: 1.1995, test_f1: 0.3130
 epoch: 45, train_loss: 1.2029, test_loss: 1.2095, test_f1: 0.3123
 epoch: 46, train_loss: 1.2043, test_loss: 1.2087, test_f1: 0.3334
 epoch: 47, train_loss: 1.2007, test_loss: 1.2008, test_f1: 0.3229
 epoch: 48, train_loss: 1.2020, test_loss: 1.1949, test_f1: 0.3206
 epoch: 49, train_loss: 1.1978, test_loss: 1.2030, test_f1: 0.3379
 epoch: 50, train_loss: 1.1973, test_loss: 1.1954, test_f1: 0.3299
 epoch: 51, train_loss: 1.1999, test_loss: 1.2013, test_f1: 0.3327
 epoch: 52, train_loss: 1.1964, test_loss: 1.1942, test_f1: 0.3420
 epoch: 53, train_loss: 1.1900, test_loss: 1.2137, test_f1: 0.3441
 epoch: 54, train_loss: 1.1949, test_loss: 1.2164, test_f1: 0.3486
 epoch: 55, train_loss: 1.1903, test_loss: 1.2090, test_f1: 0.3435
 epoch: 56, train_loss: 1.1874, test_loss: 1.1951, test_f1: 0.3357
 epoch: 57, train_loss: 1.1975, test_loss: 1.2029, test_f1: 0.3479
 epoch: 58, train_loss: 1.1937, test_loss: 1.1935, test_f1: 0.3580
 epoch: 59, train_loss: 1.1885, test_loss: 1.2006, test_f1: 0.3470
 epoch: 60, train_loss: 1.1868, test_loss: 1.2015, test_f1: 0.3574
 epoch: 61, train_loss: 1.1871, test_loss: 1.2418, test_f1: 0.3441
 epoch: 62, train_loss: 1.1914, test_loss: 1.1929, test_f1: 0.3514
 epoch: 63, train_loss: 1.1822, test_loss: 1.1987, test_f1: 0.3451
 epoch: 64, train_loss: 1.1817, test_loss: 1.2043, test_f1: 0.3544
 epoch: 65, train_loss: 1.1834, test_loss: 1.2077, test_f1: 0.3502
 epoch: 66, train_loss: 1.1875, test_loss: 1.2256, test_f1: 0.3387
 epoch: 67, train_loss: 1.1818, test_loss: 1.1929, test_f1: 0.3512
 epoch: 68, train_loss: 1.1848, test_loss: 1.2074, test_f1: 0.3661
 epoch: 69, train_loss: 1.1804, test_loss: 1.1788, test_f1: 0.3743
 epoch: 70, train_loss: 1.1802, test_loss: 1.1950, test_f1: 0.3581
 epoch: 71, train_loss: 1.1785, test_loss: 1.1941, test_f1: 0.3524
 epoch: 72, train_loss: 1.1795, test_loss: 1.1993, test_f1: 0.3687
 epoch: 73, train_loss: 1.1772, test_loss: 1.1941, test_f1: 0.3739
 epoch: 74, train_loss: 1.1738, test_loss: 1.1961, test_f1: 0.3748
 epoch: 75, train_loss: 1.1817, test_loss: 1.1884, test_f1: 0.3648
 epoch: 76, train_loss: 1.1786, test_loss: 1.1983, test_f1: 0.3799
 epoch: 77, train_loss: 1.1717, test_loss: 1.1997, test_f1: 0.3652
 epoch: 78, train_loss: 1.1794, test_loss: 1.1983, test_f1: 0.3763
 epoch: 79, train_loss: 1.1722, test_loss: 1.1924, test_f1: 0.3758
 epoch: 80, train_loss: 1.1763, test_loss: 1.1917, test_f1: 0.3622
 epoch: 81, train_loss: 1.1706, test_loss: 1.2022, test_f1: 0.3737
 epoch: 82, train_loss: 1.1724, test_loss: 1.1871, test_f1: 0.3695
 epoch: 83, train_loss: 1.1683, test_loss: 1.1965, test_f1: 0.3638
 epoch: 84, train_loss: 1.1806, test_loss: 1.1920, test_f1: 0.3690
 epoch: 85, train_loss: 1.1711, test_loss: 1.1888, test_f1: 0.3831
 epoch: 86, train_loss: 1.1732, test_loss: 1.1935, test_f1: 0.3658
 epoch: 87, train_loss: 1.1719, test_loss: 1.1919, test_f1: 0.3834
 epoch: 88, train_loss: 1.1731, test_loss: 1.1885, test_f1: 0.3757
 epoch: 89, train_loss: 1.1664, test_loss: 1.1904, test_f1: 0.3724
 epoch: 90, train_loss: 1.1719, test_loss: 1.1900, test_f1: 0.3754
 epoch: 91, train_loss: 1.1696, test_loss: 1.1886, test_f1: 0.3711
 epoch: 92, train_loss: 1.1715, test_loss: 1.1858, test_f1: 0.3749
 epoch: 93, train_loss: 1.1732, test_loss: 1.1677, test_f1: 0.3806
 epoch: 94, train_loss: 1.1697, test_loss: 1.1694, test_f1: 0.3800
 epoch: 95, train_loss: 1.1695, test_loss: 1.1898, test_f1: 0.3772
 epoch: 96, train_loss: 1.1634, test_loss: 1.1701, test_f1: 0.3827
 epoch: 97, train_loss: 1.1774, test_loss: 1.1758, test_f1: 0.3847
 epoch: 98, train_loss: 1.1620, test_loss: 1.1818, test_f1: 0.3793
 epoch: 99, train_loss: 1.1673, test_loss: 1.1865, test_f1: 0.3675
##################ITERATION #3 ****************************************
 epoch: 0, train_loss: 1.3132, test_loss: 1.3128, test_f1: 0.2555
 epoch: 1, train_loss: 1.3033, test_loss: 1.3034, test_f1: 0.2438
 epoch: 2, train_loss: 1.2980, test_loss: 1.2977, test_f1: 0.2555
 epoch: 3, train_loss: 1.2941, test_loss: 1.2916, test_f1: 0.2557
 epoch: 4, train_loss: 1.2908, test_loss: 1.2871, test_f1: 0.2557
 epoch: 5, train_loss: 1.2870, test_loss: 1.2819, test_f1: 0.2557
 epoch: 6, train_loss: 1.2828, test_loss: 1.2773, test_f1: 0.2557
 epoch: 7, train_loss: 1.2752, test_loss: 1.2727, test_f1: 0.2557
 epoch: 8, train_loss: 1.2727, test_loss: 1.2655, test_f1: 0.2557
 epoch: 9, train_loss: 1.2693, test_loss: 1.2629, test_f1: 0.2608
 epoch: 10, train_loss: 1.2649, test_loss: 1.2531, test_f1: 0.2631
 epoch: 11, train_loss: 1.2618, test_loss: 1.2489, test_f1: 0.2631
 epoch: 12, train_loss: 1.2580, test_loss: 1.2470, test_f1: 0.2608
 epoch: 13, train_loss: 1.2598, test_loss: 1.2412, test_f1: 0.2551
 epoch: 14, train_loss: 1.2530, test_loss: 1.2373, test_f1: 0.2614
 epoch: 15, train_loss: 1.2515, test_loss: 1.2316, test_f1: 0.2551
 epoch: 16, train_loss: 1.2482, test_loss: 1.2302, test_f1: 0.2552
 epoch: 17, train_loss: 1.2456, test_loss: 1.2232, test_f1: 0.2537
 epoch: 18, train_loss: 1.2423, test_loss: 1.2218, test_f1: 0.2648
 epoch: 19, train_loss: 1.2406, test_loss: 1.2147, test_f1: 0.2705
 epoch: 20, train_loss: 1.2313, test_loss: 1.2132, test_f1: 0.2665
 epoch: 21, train_loss: 1.2345, test_loss: 1.2109, test_f1: 0.2765
 epoch: 22, train_loss: 1.2283, test_loss: 1.2066, test_f1: 0.2757
 epoch: 23, train_loss: 1.2233, test_loss: 1.2010, test_f1: 0.3078
 epoch: 24, train_loss: 1.2238, test_loss: 1.1975, test_f1: 0.3271
 epoch: 25, train_loss: 1.2239, test_loss: 1.1957, test_f1: 0.3341
 epoch: 26, train_loss: 1.2155, test_loss: 1.1885, test_f1: 0.3300
 epoch: 27, train_loss: 1.2163, test_loss: 1.1873, test_f1: 0.3582
 epoch: 28, train_loss: 1.2163, test_loss: 1.1866, test_f1: 0.3664
 epoch: 29, train_loss: 1.2137, test_loss: 1.1798, test_f1: 0.3717
 epoch: 30, train_loss: 1.2073, test_loss: 1.1770, test_f1: 0.4014
 epoch: 31, train_loss: 1.2053, test_loss: 1.1742, test_f1: 0.3972
 epoch: 32, train_loss: 1.2019, test_loss: 1.1708, test_f1: 0.3952
 epoch: 33, train_loss: 1.2031, test_loss: 1.1697, test_f1: 0.4185
 epoch: 34, train_loss: 1.2003, test_loss: 1.1638, test_f1: 0.4106
 epoch: 35, train_loss: 1.2026, test_loss: 1.1608, test_f1: 0.4088
 epoch: 36, train_loss: 1.1904, test_loss: 1.1580, test_f1: 0.4102
 epoch: 37, train_loss: 1.1922, test_loss: 1.1567, test_f1: 0.4359
 epoch: 38, train_loss: 1.1884, test_loss: 1.1517, test_f1: 0.4285
 epoch: 39, train_loss: 1.1872, test_loss: 1.1503, test_f1: 0.4362
 epoch: 40, train_loss: 1.1876, test_loss: 1.1481, test_f1: 0.4242
 epoch: 41, train_loss: 1.1901, test_loss: 1.1453, test_f1: 0.4376
 epoch: 42, train_loss: 1.1834, test_loss: 1.1426, test_f1: 0.4314
 epoch: 43, train_loss: 1.1789, test_loss: 1.1388, test_f1: 0.4348
 epoch: 44, train_loss: 1.1824, test_loss: 1.1408, test_f1: 0.4289
 epoch: 45, train_loss: 1.1748, test_loss: 1.1347, test_f1: 0.4461
 epoch: 46, train_loss: 1.1782, test_loss: 1.1354, test_f1: 0.4395
 epoch: 47, train_loss: 1.1708, test_loss: 1.1334, test_f1: 0.4313
 epoch: 48, train_loss: 1.1687, test_loss: 1.1274, test_f1: 0.4461
 epoch: 49, train_loss: 1.1655, test_loss: 1.1275, test_f1: 0.4472
 epoch: 50, train_loss: 1.1630, test_loss: 1.1244, test_f1: 0.4417
 epoch: 51, train_loss: 1.1685, test_loss: 1.1225, test_f1: 0.4528
 epoch: 52, train_loss: 1.1592, test_loss: 1.1194, test_f1: 0.4480
 epoch: 53, train_loss: 1.1611, test_loss: 1.1167, test_f1: 0.4560
 epoch: 54, train_loss: 1.1535, test_loss: 1.1176, test_f1: 0.4449
 epoch: 55, train_loss: 1.1559, test_loss: 1.1169, test_f1: 0.4550
 epoch: 56, train_loss: 1.1606, test_loss: 1.1125, test_f1: 0.4510
 epoch: 57, train_loss: 1.1572, test_loss: 1.1159, test_f1: 0.4489
 epoch: 58, train_loss: 1.1585, test_loss: 1.1160, test_f1: 0.4406
 epoch: 59, train_loss: 1.1550, test_loss: 1.1123, test_f1: 0.4418
 epoch: 60, train_loss: 1.1477, test_loss: 1.1134, test_f1: 0.4406
 epoch: 61, train_loss: 1.1539, test_loss: 1.1129, test_f1: 0.4401
 epoch: 62, train_loss: 1.1593, test_loss: 1.1097, test_f1: 0.4375
 epoch: 63, train_loss: 1.1545, test_loss: 1.1093, test_f1: 0.4434
 epoch: 64, train_loss: 1.1540, test_loss: 1.1052, test_f1: 0.4406
 epoch: 65, train_loss: 1.1459, test_loss: 1.1044, test_f1: 0.4510
 epoch: 66, train_loss: 1.1475, test_loss: 1.1056, test_f1: 0.4360
 epoch: 67, train_loss: 1.1542, test_loss: 1.1020, test_f1: 0.4518
 epoch: 68, train_loss: 1.1469, test_loss: 1.1054, test_f1: 0.4534
 epoch: 69, train_loss: 1.1446, test_loss: 1.1009, test_f1: 0.4462
 epoch: 70, train_loss: 1.1477, test_loss: 1.1024, test_f1: 0.4364
 epoch: 71, train_loss: 1.1473, test_loss: 1.1002, test_f1: 0.4389
 epoch: 72, train_loss: 1.1445, test_loss: 1.1041, test_f1: 0.4358
 epoch: 73, train_loss: 1.1482, test_loss: 1.0968, test_f1: 0.4529
 epoch: 74, train_loss: 1.1460, test_loss: 1.0992, test_f1: 0.4382
 epoch: 75, train_loss: 1.1438, test_loss: 1.0974, test_f1: 0.4349
 epoch: 76, train_loss: 1.1388, test_loss: 1.0960, test_f1: 0.4382
 epoch: 77, train_loss: 1.1382, test_loss: 1.0952, test_f1: 0.4445
 epoch: 78, train_loss: 1.1378, test_loss: 1.0933, test_f1: 0.4533
 epoch: 79, train_loss: 1.1363, test_loss: 1.0935, test_f1: 0.4410
 epoch: 80, train_loss: 1.1342, test_loss: 1.0908, test_f1: 0.4505
 epoch: 81, train_loss: 1.1395, test_loss: 1.0895, test_f1: 0.4429
 epoch: 82, train_loss: 1.1336, test_loss: 1.0919, test_f1: 0.4368
 epoch: 83, train_loss: 1.1261, test_loss: 1.0919, test_f1: 0.4378
 epoch: 84, train_loss: 1.1290, test_loss: 1.0903, test_f1: 0.4353
 epoch: 85, train_loss: 1.1375, test_loss: 1.0874, test_f1: 0.4425
 epoch: 86, train_loss: 1.1370, test_loss: 1.0868, test_f1: 0.4364
 epoch: 87, train_loss: 1.1309, test_loss: 1.0903, test_f1: 0.4373
 epoch: 88, train_loss: 1.1347, test_loss: 1.0845, test_f1: 0.4337
 epoch: 89, train_loss: 1.1364, test_loss: 1.0879, test_f1: 0.4395
 epoch: 90, train_loss: 1.1297, test_loss: 1.0836, test_f1: 0.4356
 epoch: 91, train_loss: 1.1297, test_loss: 1.0834, test_f1: 0.4288
 epoch: 92, train_loss: 1.1276, test_loss: 1.0816, test_f1: 0.4439
 epoch: 93, train_loss: 1.1297, test_loss: 1.0816, test_f1: 0.4381
 epoch: 94, train_loss: 1.1270, test_loss: 1.0830, test_f1: 0.4340
 epoch: 95, train_loss: 1.1284, test_loss: 1.0831, test_f1: 0.4351
 epoch: 96, train_loss: 1.1244, test_loss: 1.0805, test_f1: 0.4436
 epoch: 97, train_loss: 1.1255, test_loss: 1.0760, test_f1: 0.4488
 epoch: 98, train_loss: 1.1248, test_loss: 1.0773, test_f1: 0.4430
 epoch: 99, train_loss: 1.1302, test_loss: 1.0787, test_f1: 0.4375
##################ITERATION #4 ****************************************
 epoch: 0, train_loss: 1.3142, test_loss: 1.3137, test_f1: 0.2274
 epoch: 1, train_loss: 1.3044, test_loss: 1.3119, test_f1: 0.2274
 epoch: 2, train_loss: 1.3007, test_loss: 1.3096, test_f1: 0.2274
 epoch: 3, train_loss: 1.2973, test_loss: 1.3015, test_f1: 0.2274
 epoch: 4, train_loss: 1.2964, test_loss: 1.3023, test_f1: 0.2274
 epoch: 5, train_loss: 1.2910, test_loss: 1.2982, test_f1: 0.2274
 epoch: 6, train_loss: 1.2882, test_loss: 1.2946, test_f1: 0.2274
 epoch: 7, train_loss: 1.2848, test_loss: 1.2908, test_f1: 0.2274
 epoch: 8, train_loss: 1.2784, test_loss: 1.2856, test_f1: 0.2274
 epoch: 9, train_loss: 1.2768, test_loss: 1.2816, test_f1: 0.2274
 epoch: 10, train_loss: 1.2740, test_loss: 1.2798, test_f1: 0.2274
 epoch: 11, train_loss: 1.2711, test_loss: 1.2777, test_f1: 0.2274
 epoch: 12, train_loss: 1.2662, test_loss: 1.2717, test_f1: 0.2274
 epoch: 13, train_loss: 1.2647, test_loss: 1.2677, test_f1: 0.2274
 epoch: 14, train_loss: 1.2609, test_loss: 1.2622, test_f1: 0.2274
 epoch: 15, train_loss: 1.2551, test_loss: 1.2581, test_f1: 0.2274
 epoch: 16, train_loss: 1.2580, test_loss: 1.2566, test_f1: 0.2350
 epoch: 17, train_loss: 1.2507, test_loss: 1.2495, test_f1: 0.2577
 epoch: 18, train_loss: 1.2449, test_loss: 1.2449, test_f1: 0.2505
 epoch: 19, train_loss: 1.2438, test_loss: 1.2410, test_f1: 0.2600
 epoch: 20, train_loss: 1.2405, test_loss: 1.2362, test_f1: 0.2957
 epoch: 21, train_loss: 1.2370, test_loss: 1.2230, test_f1: 0.3076
 epoch: 22, train_loss: 1.2347, test_loss: 1.2251, test_f1: 0.3034
 epoch: 23, train_loss: 1.2334, test_loss: 1.2194, test_f1: 0.3132
 epoch: 24, train_loss: 1.2255, test_loss: 1.2215, test_f1: 0.3111
 epoch: 25, train_loss: 1.2290, test_loss: 1.2162, test_f1: 0.3225
 epoch: 26, train_loss: 1.2267, test_loss: 1.2123, test_f1: 0.3233
 epoch: 27, train_loss: 1.2170, test_loss: 1.2063, test_f1: 0.3344
 epoch: 28, train_loss: 1.2191, test_loss: 1.2060, test_f1: 0.3414
 epoch: 29, train_loss: 1.2185, test_loss: 1.1985, test_f1: 0.3473
 epoch: 30, train_loss: 1.2153, test_loss: 1.2010, test_f1: 0.3307
 epoch: 31, train_loss: 1.2161, test_loss: 1.1985, test_f1: 0.3216
 epoch: 32, train_loss: 1.2081, test_loss: 1.1973, test_f1: 0.3309
 epoch: 33, train_loss: 1.2086, test_loss: 1.1941, test_f1: 0.3293
 epoch: 34, train_loss: 1.2110, test_loss: 1.1939, test_f1: 0.3438
 epoch: 35, train_loss: 1.2074, test_loss: 1.1930, test_f1: 0.3380
 epoch: 36, train_loss: 1.2080, test_loss: 1.1875, test_f1: 0.3496
 epoch: 37, train_loss: 1.2051, test_loss: 1.1893, test_f1: 0.3462
 epoch: 38, train_loss: 1.2073, test_loss: 1.1846, test_f1: 0.3633
 epoch: 39, train_loss: 1.1950, test_loss: 1.1854, test_f1: 0.3473
 epoch: 40, train_loss: 1.1957, test_loss: 1.1830, test_f1: 0.3485
 epoch: 41, train_loss: 1.1992, test_loss: 1.1824, test_f1: 0.3449
 epoch: 42, train_loss: 1.1956, test_loss: 1.1800, test_f1: 0.3504
 epoch: 43, train_loss: 1.1936, test_loss: 1.1777, test_f1: 0.3525
 epoch: 44, train_loss: 1.1915, test_loss: 1.1746, test_f1: 0.3539
 epoch: 45, train_loss: 1.1923, test_loss: 1.1746, test_f1: 0.3498
 epoch: 46, train_loss: 1.1929, test_loss: 1.1754, test_f1: 0.3514
 epoch: 47, train_loss: 1.1921, test_loss: 1.1733, test_f1: 0.3630
 epoch: 48, train_loss: 1.1866, test_loss: 1.1694, test_f1: 0.3675
 epoch: 49, train_loss: 1.1863, test_loss: 1.1669, test_f1: 0.3769
 epoch: 50, train_loss: 1.1871, test_loss: 1.1636, test_f1: 0.3731
 epoch: 51, train_loss: 1.1789, test_loss: 1.1654, test_f1: 0.3704
 epoch: 52, train_loss: 1.1850, test_loss: 1.1642, test_f1: 0.3804
 epoch: 53, train_loss: 1.1864, test_loss: 1.1631, test_f1: 0.3771
 epoch: 54, train_loss: 1.1870, test_loss: 1.1618, test_f1: 0.3843
 epoch: 55, train_loss: 1.1780, test_loss: 1.1602, test_f1: 0.3886
 epoch: 56, train_loss: 1.1876, test_loss: 1.1608, test_f1: 0.3835
 epoch: 57, train_loss: 1.1831, test_loss: 1.1606, test_f1: 0.3891
 epoch: 58, train_loss: 1.1811, test_loss: 1.1568, test_f1: 0.3921
 epoch: 59, train_loss: 1.1857, test_loss: 1.1593, test_f1: 0.3951
 epoch: 60, train_loss: 1.1793, test_loss: 1.1569, test_f1: 0.3907
 epoch: 61, train_loss: 1.1796, test_loss: 1.1567, test_f1: 0.3939
 epoch: 62, train_loss: 1.1800, test_loss: 1.1555, test_f1: 0.4121
 epoch: 63, train_loss: 1.1814, test_loss: 1.1549, test_f1: 0.4016
 epoch: 64, train_loss: 1.1711, test_loss: 1.1530, test_f1: 0.4043
 epoch: 65, train_loss: 1.1748, test_loss: 1.1522, test_f1: 0.4050
 epoch: 66, train_loss: 1.1773, test_loss: 1.1549, test_f1: 0.4053
 epoch: 67, train_loss: 1.1678, test_loss: 1.1518, test_f1: 0.4024
 epoch: 68, train_loss: 1.1747, test_loss: 1.1522, test_f1: 0.4064
 epoch: 69, train_loss: 1.1741, test_loss: 1.1487, test_f1: 0.4048
 epoch: 70, train_loss: 1.1655, test_loss: 1.1481, test_f1: 0.4035
 epoch: 71, train_loss: 1.1694, test_loss: 1.1500, test_f1: 0.4131
 epoch: 72, train_loss: 1.1691, test_loss: 1.1464, test_f1: 0.4112
 epoch: 73, train_loss: 1.1689, test_loss: 1.1480, test_f1: 0.4066
 epoch: 74, train_loss: 1.1644, test_loss: 1.1446, test_f1: 0.4062
 epoch: 75, train_loss: 1.1648, test_loss: 1.1446, test_f1: 0.4053
 epoch: 76, train_loss: 1.1698, test_loss: 1.1415, test_f1: 0.4001
 epoch: 77, train_loss: 1.1727, test_loss: 1.1437, test_f1: 0.4141
 epoch: 78, train_loss: 1.1661, test_loss: 1.1396, test_f1: 0.4222
 epoch: 79, train_loss: 1.1704, test_loss: 1.1404, test_f1: 0.4256
 epoch: 80, train_loss: 1.1687, test_loss: 1.1398, test_f1: 0.4313
 epoch: 81, train_loss: 1.1719, test_loss: 1.1401, test_f1: 0.4373
 epoch: 82, train_loss: 1.1548, test_loss: 1.1374, test_f1: 0.4310
 epoch: 83, train_loss: 1.1645, test_loss: 1.1346, test_f1: 0.4196
 epoch: 84, train_loss: 1.1604, test_loss: 1.1334, test_f1: 0.4346
 epoch: 85, train_loss: 1.1607, test_loss: 1.1323, test_f1: 0.4284
 epoch: 86, train_loss: 1.1588, test_loss: 1.1316, test_f1: 0.4329
 epoch: 87, train_loss: 1.1640, test_loss: 1.1329, test_f1: 0.4304
 epoch: 88, train_loss: 1.1681, test_loss: 1.1316, test_f1: 0.4312
 epoch: 89, train_loss: 1.1576, test_loss: 1.1325, test_f1: 0.4378
 epoch: 90, train_loss: 1.1603, test_loss: 1.1297, test_f1: 0.4368
 epoch: 91, train_loss: 1.1580, test_loss: 1.1328, test_f1: 0.4338
 epoch: 92, train_loss: 1.1586, test_loss: 1.1307, test_f1: 0.4284
 epoch: 93, train_loss: 1.1543, test_loss: 1.1284, test_f1: 0.4360
 epoch: 94, train_loss: 1.1554, test_loss: 1.1272, test_f1: 0.4273
 epoch: 95, train_loss: 1.1475, test_loss: 1.1247, test_f1: 0.4371
 epoch: 96, train_loss: 1.1542, test_loss: 1.1259, test_f1: 0.4315
 epoch: 97, train_loss: 1.1612, test_loss: 1.1248, test_f1: 0.4429
 epoch: 98, train_loss: 1.1510, test_loss: 1.1224, test_f1: 0.4319
 epoch: 99, train_loss: 1.1476, test_loss: 1.1206, test_f1: 0.4331
##################ITERATION #5 ****************************************
 epoch: 0, train_loss: 1.3087, test_loss: 1.2903, test_f1: 0.2274
 epoch: 1, train_loss: 1.2927, test_loss: 1.2729, test_f1: 0.2414
 epoch: 2, train_loss: 1.2850, test_loss: 1.2644, test_f1: 0.2322
 epoch: 3, train_loss: 1.2828, test_loss: 1.2625, test_f1: 0.2414
 epoch: 4, train_loss: 1.2777, test_loss: 1.2537, test_f1: 0.2600
 epoch: 5, train_loss: 1.2751, test_loss: 1.2522, test_f1: 0.2578
 epoch: 6, train_loss: 1.2676, test_loss: 1.2467, test_f1: 0.2600
 epoch: 7, train_loss: 1.2660, test_loss: 1.2419, test_f1: 0.2594
 epoch: 8, train_loss: 1.2631, test_loss: 1.2418, test_f1: 0.2677
 epoch: 9, train_loss: 1.2631, test_loss: 1.2323, test_f1: 0.2693
 epoch: 10, train_loss: 1.2638, test_loss: 1.2343, test_f1: 0.2770
 epoch: 11, train_loss: 1.2550, test_loss: 1.2306, test_f1: 0.2790
 epoch: 12, train_loss: 1.2525, test_loss: 1.2291, test_f1: 0.2870
 epoch: 13, train_loss: 1.2590, test_loss: 1.2253, test_f1: 0.2939
 epoch: 14, train_loss: 1.2570, test_loss: 1.2263, test_f1: 0.2908
 epoch: 15, train_loss: 1.2495, test_loss: 1.2230, test_f1: 0.2940
 epoch: 16, train_loss: 1.2437, test_loss: 1.2184, test_f1: 0.2997
 epoch: 17, train_loss: 1.2523, test_loss: 1.2175, test_f1: 0.2961
 epoch: 18, train_loss: 1.2494, test_loss: 1.2160, test_f1: 0.2954
 epoch: 19, train_loss: 1.2429, test_loss: 1.2122, test_f1: 0.2990
 epoch: 20, train_loss: 1.2387, test_loss: 1.2100, test_f1: 0.2962
 epoch: 21, train_loss: 1.2404, test_loss: 1.2123, test_f1: 0.3128
 epoch: 22, train_loss: 1.2364, test_loss: 1.2101, test_f1: 0.3077
 epoch: 23, train_loss: 1.2334, test_loss: 1.2062, test_f1: 0.3111
 epoch: 24, train_loss: 1.2362, test_loss: 1.2046, test_f1: 0.3148
 epoch: 25, train_loss: 1.2330, test_loss: 1.2029, test_f1: 0.2977
 epoch: 26, train_loss: 1.2260, test_loss: 1.2029, test_f1: 0.3096
 epoch: 27, train_loss: 1.2261, test_loss: 1.1999, test_f1: 0.3113
 epoch: 28, train_loss: 1.2201, test_loss: 1.1962, test_f1: 0.3186
 epoch: 29, train_loss: 1.2190, test_loss: 1.1968, test_f1: 0.3209
 epoch: 30, train_loss: 1.2223, test_loss: 1.1933, test_f1: 0.3295
 epoch: 31, train_loss: 1.2266, test_loss: 1.1918, test_f1: 0.3236
 epoch: 32, train_loss: 1.2211, test_loss: 1.1912, test_f1: 0.3337
 epoch: 33, train_loss: 1.2228, test_loss: 1.1850, test_f1: 0.3321
 epoch: 34, train_loss: 1.2234, test_loss: 1.1909, test_f1: 0.3267
 epoch: 35, train_loss: 1.2211, test_loss: 1.1866, test_f1: 0.3354
 epoch: 36, train_loss: 1.2227, test_loss: 1.1868, test_f1: 0.3347
 epoch: 37, train_loss: 1.2183, test_loss: 1.1823, test_f1: 0.3344
 epoch: 38, train_loss: 1.2072, test_loss: 1.1782, test_f1: 0.3458
 epoch: 39, train_loss: 1.2077, test_loss: 1.1812, test_f1: 0.3600
 epoch: 40, train_loss: 1.2086, test_loss: 1.1797, test_f1: 0.3607
 epoch: 41, train_loss: 1.2100, test_loss: 1.1772, test_f1: 0.3594
 epoch: 42, train_loss: 1.2030, test_loss: 1.1755, test_f1: 0.3663
 epoch: 43, train_loss: 1.2057, test_loss: 1.1766, test_f1: 0.3669
 epoch: 44, train_loss: 1.2054, test_loss: 1.1692, test_f1: 0.3680
 epoch: 45, train_loss: 1.2127, test_loss: 1.1675, test_f1: 0.3724
 epoch: 46, train_loss: 1.1971, test_loss: 1.1655, test_f1: 0.3675
 epoch: 47, train_loss: 1.1992, test_loss: 1.1610, test_f1: 0.3780
 epoch: 48, train_loss: 1.2073, test_loss: 1.1628, test_f1: 0.3725
 epoch: 49, train_loss: 1.1940, test_loss: 1.1635, test_f1: 0.3902
 epoch: 50, train_loss: 1.1978, test_loss: 1.1614, test_f1: 0.3853
 epoch: 51, train_loss: 1.1926, test_loss: 1.1605, test_f1: 0.3871
 epoch: 52, train_loss: 1.1921, test_loss: 1.1616, test_f1: 0.3909
 epoch: 53, train_loss: 1.1917, test_loss: 1.1604, test_f1: 0.3978
 epoch: 54, train_loss: 1.1943, test_loss: 1.1568, test_f1: 0.3867
 epoch: 55, train_loss: 1.1924, test_loss: 1.1573, test_f1: 0.3922
 epoch: 56, train_loss: 1.1931, test_loss: 1.1561, test_f1: 0.4022
 epoch: 57, train_loss: 1.1873, test_loss: 1.1576, test_f1: 0.3926
 epoch: 58, train_loss: 1.1907, test_loss: 1.1558, test_f1: 0.3973
 epoch: 59, train_loss: 1.1918, test_loss: 1.1541, test_f1: 0.4008
 epoch: 60, train_loss: 1.1928, test_loss: 1.1552, test_f1: 0.3935
 epoch: 61, train_loss: 1.1882, test_loss: 1.1498, test_f1: 0.4040
 epoch: 62, train_loss: 1.1874, test_loss: 1.1471, test_f1: 0.3988
 epoch: 63, train_loss: 1.1892, test_loss: 1.1496, test_f1: 0.4042
 epoch: 64, train_loss: 1.1833, test_loss: 1.1502, test_f1: 0.4036
 epoch: 65, train_loss: 1.1790, test_loss: 1.1504, test_f1: 0.4027
 epoch: 66, train_loss: 1.1783, test_loss: 1.1480, test_f1: 0.3983
 epoch: 67, train_loss: 1.1876, test_loss: 1.1448, test_f1: 0.4082
 epoch: 68, train_loss: 1.1882, test_loss: 1.1463, test_f1: 0.4100
 epoch: 69, train_loss: 1.1825, test_loss: 1.1503, test_f1: 0.4039
 epoch: 70, train_loss: 1.1862, test_loss: 1.1493, test_f1: 0.4034
 epoch: 71, train_loss: 1.1788, test_loss: 1.1479, test_f1: 0.4099
 epoch: 72, train_loss: 1.1812, test_loss: 1.1430, test_f1: 0.4139
 epoch: 73, train_loss: 1.1827, test_loss: 1.1463, test_f1: 0.3999
 epoch: 74, train_loss: 1.1788, test_loss: 1.1471, test_f1: 0.4043
 epoch: 75, train_loss: 1.1742, test_loss: 1.1435, test_f1: 0.4037
 epoch: 76, train_loss: 1.1810, test_loss: 1.1472, test_f1: 0.4126
 epoch: 77, train_loss: 1.1804, test_loss: 1.1446, test_f1: 0.4000
 epoch: 78, train_loss: 1.1809, test_loss: 1.1404, test_f1: 0.4103
 epoch: 79, train_loss: 1.1825, test_loss: 1.1418, test_f1: 0.4108
 epoch: 80, train_loss: 1.1748, test_loss: 1.1441, test_f1: 0.4115
 epoch: 81, train_loss: 1.1755, test_loss: 1.1402, test_f1: 0.4126
 epoch: 82, train_loss: 1.1755, test_loss: 1.1404, test_f1: 0.4092
 epoch: 83, train_loss: 1.1653, test_loss: 1.1426, test_f1: 0.4071
 epoch: 84, train_loss: 1.1712, test_loss: 1.1403, test_f1: 0.4083
 epoch: 85, train_loss: 1.1696, test_loss: 1.1372, test_f1: 0.4132
 epoch: 86, train_loss: 1.1643, test_loss: 1.1403, test_f1: 0.4106
 epoch: 87, train_loss: 1.1676, test_loss: 1.1380, test_f1: 0.4200
 epoch: 88, train_loss: 1.1677, test_loss: 1.1384, test_f1: 0.4247
 epoch: 89, train_loss: 1.1687, test_loss: 1.1376, test_f1: 0.4193
 epoch: 90, train_loss: 1.1643, test_loss: 1.1340, test_f1: 0.4234
 epoch: 91, train_loss: 1.1663, test_loss: 1.1338, test_f1: 0.4271
 epoch: 92, train_loss: 1.1672, test_loss: 1.1341, test_f1: 0.4199
 epoch: 93, train_loss: 1.1607, test_loss: 1.1325, test_f1: 0.4210
 epoch: 94, train_loss: 1.1691, test_loss: 1.1292, test_f1: 0.4229
 epoch: 95, train_loss: 1.1687, test_loss: 1.1328, test_f1: 0.4146
 epoch: 96, train_loss: 1.1589, test_loss: 1.1332, test_f1: 0.4124
 epoch: 97, train_loss: 1.1666, test_loss: 1.1328, test_f1: 0.4217
 epoch: 98, train_loss: 1.1632, test_loss: 1.1298, test_f1: 0.4169
 epoch: 99, train_loss: 1.1610, test_loss: 1.1283, test_f1: 0.4180
##################ITERATION #6 ****************************************
 epoch: 0, train_loss: 1.3318, test_loss: 1.3415, test_f1: 0.2558
 epoch: 1, train_loss: 1.3106, test_loss: 1.3186, test_f1: 0.2613
 epoch: 2, train_loss: 1.3049, test_loss: 1.3040, test_f1: 0.2747
 epoch: 3, train_loss: 1.2953, test_loss: 1.2902, test_f1: 0.2727
 epoch: 4, train_loss: 1.2807, test_loss: 1.2738, test_f1: 0.2803
 epoch: 5, train_loss: 1.2778, test_loss: 1.2685, test_f1: 0.2907
 epoch: 6, train_loss: 1.2713, test_loss: 1.2605, test_f1: 0.2883
 epoch: 7, train_loss: 1.2742, test_loss: 1.2511, test_f1: 0.3075
 epoch: 8, train_loss: 1.2645, test_loss: 1.2472, test_f1: 0.3120
 epoch: 9, train_loss: 1.2610, test_loss: 1.2446, test_f1: 0.3094
 epoch: 10, train_loss: 1.2626, test_loss: 1.2355, test_f1: 0.3094
 epoch: 11, train_loss: 1.2600, test_loss: 1.2315, test_f1: 0.3125
 epoch: 12, train_loss: 1.2511, test_loss: 1.2281, test_f1: 0.3143
 epoch: 13, train_loss: 1.2545, test_loss: 1.2269, test_f1: 0.3151
 epoch: 14, train_loss: 1.2456, test_loss: 1.2236, test_f1: 0.3147
 epoch: 15, train_loss: 1.2470, test_loss: 1.2168, test_f1: 0.3163
 epoch: 16, train_loss: 1.2435, test_loss: 1.2178, test_f1: 0.3189
 epoch: 17, train_loss: 1.2421, test_loss: 1.2141, test_f1: 0.3271
 epoch: 18, train_loss: 1.2403, test_loss: 1.2113, test_f1: 0.3333
 epoch: 19, train_loss: 1.2278, test_loss: 1.2087, test_f1: 0.3267
 epoch: 20, train_loss: 1.2329, test_loss: 1.2029, test_f1: 0.3199
 epoch: 21, train_loss: 1.2265, test_loss: 1.2017, test_f1: 0.3380
 epoch: 22, train_loss: 1.2339, test_loss: 1.2020, test_f1: 0.3431
 epoch: 23, train_loss: 1.2280, test_loss: 1.2028, test_f1: 0.3344
 epoch: 24, train_loss: 1.2271, test_loss: 1.1993, test_f1: 0.3453
 epoch: 25, train_loss: 1.2247, test_loss: 1.1978, test_f1: 0.3478
 epoch: 26, train_loss: 1.2204, test_loss: 1.1923, test_f1: 0.3507
 epoch: 27, train_loss: 1.2183, test_loss: 1.1918, test_f1: 0.3536
 epoch: 28, train_loss: 1.2094, test_loss: 1.1910, test_f1: 0.3438
 epoch: 29, train_loss: 1.2156, test_loss: 1.1859, test_f1: 0.3451
 epoch: 30, train_loss: 1.2107, test_loss: 1.1800, test_f1: 0.3629
 epoch: 31, train_loss: 1.2131, test_loss: 1.1818, test_f1: 0.3548
 epoch: 32, train_loss: 1.2172, test_loss: 1.1785, test_f1: 0.3732
 epoch: 33, train_loss: 1.2038, test_loss: 1.1748, test_f1: 0.3815
 epoch: 34, train_loss: 1.2026, test_loss: 1.1758, test_f1: 0.3785
 epoch: 35, train_loss: 1.2029, test_loss: 1.1702, test_f1: 0.3781
 epoch: 36, train_loss: 1.2029, test_loss: 1.1721, test_f1: 0.3870
 epoch: 37, train_loss: 1.2025, test_loss: 1.1683, test_f1: 0.3944
 epoch: 38, train_loss: 1.2003, test_loss: 1.1698, test_f1: 0.3695
 epoch: 39, train_loss: 1.2023, test_loss: 1.1690, test_f1: 0.3676
 epoch: 40, train_loss: 1.1943, test_loss: 1.1671, test_f1: 0.3708
 epoch: 41, train_loss: 1.1947, test_loss: 1.1628, test_f1: 0.3707
 epoch: 42, train_loss: 1.1990, test_loss: 1.1662, test_f1: 0.3677
 epoch: 43, train_loss: 1.1897, test_loss: 1.1611, test_f1: 0.3828
 epoch: 44, train_loss: 1.1866, test_loss: 1.1596, test_f1: 0.3874
 epoch: 45, train_loss: 1.1904, test_loss: 1.1587, test_f1: 0.3838
 epoch: 46, train_loss: 1.1876, test_loss: 1.1583, test_f1: 0.3717
 epoch: 47, train_loss: 1.1878, test_loss: 1.1594, test_f1: 0.3729
 epoch: 48, train_loss: 1.1867, test_loss: 1.1583, test_f1: 0.3802
 epoch: 49, train_loss: 1.1858, test_loss: 1.1516, test_f1: 0.3733
 epoch: 50, train_loss: 1.1831, test_loss: 1.1534, test_f1: 0.3870
 epoch: 51, train_loss: 1.1795, test_loss: 1.1507, test_f1: 0.3887
 epoch: 52, train_loss: 1.1870, test_loss: 1.1520, test_f1: 0.3895
 epoch: 53, train_loss: 1.1776, test_loss: 1.1516, test_f1: 0.3797
 epoch: 54, train_loss: 1.1792, test_loss: 1.1502, test_f1: 0.3885
 epoch: 55, train_loss: 1.1741, test_loss: 1.1446, test_f1: 0.3892
 epoch: 56, train_loss: 1.1727, test_loss: 1.1446, test_f1: 0.3795
 epoch: 57, train_loss: 1.1790, test_loss: 1.1476, test_f1: 0.3927
 epoch: 58, train_loss: 1.1781, test_loss: 1.1459, test_f1: 0.3941
 epoch: 59, train_loss: 1.1739, test_loss: 1.1467, test_f1: 0.3904
 epoch: 60, train_loss: 1.1758, test_loss: 1.1440, test_f1: 0.3991
 epoch: 61, train_loss: 1.1689, test_loss: 1.1396, test_f1: 0.3934
 epoch: 62, train_loss: 1.1742, test_loss: 1.1394, test_f1: 0.3829
 epoch: 63, train_loss: 1.1773, test_loss: 1.1434, test_f1: 0.3846
 epoch: 64, train_loss: 1.1698, test_loss: 1.1389, test_f1: 0.4049
 epoch: 65, train_loss: 1.1669, test_loss: 1.1430, test_f1: 0.3871
 epoch: 66, train_loss: 1.1645, test_loss: 1.1384, test_f1: 0.3987
 epoch: 67, train_loss: 1.1652, test_loss: 1.1365, test_f1: 0.4029
 epoch: 68, train_loss: 1.1677, test_loss: 1.1408, test_f1: 0.3904
 epoch: 69, train_loss: 1.1682, test_loss: 1.1364, test_f1: 0.3964
 epoch: 70, train_loss: 1.1586, test_loss: 1.1407, test_f1: 0.3802
 epoch: 71, train_loss: 1.1684, test_loss: 1.1371, test_f1: 0.3862
 epoch: 72, train_loss: 1.1676, test_loss: 1.1341, test_f1: 0.4032
 epoch: 73, train_loss: 1.1604, test_loss: 1.1313, test_f1: 0.4093
 epoch: 74, train_loss: 1.1604, test_loss: 1.1341, test_f1: 0.4073
 epoch: 75, train_loss: 1.1609, test_loss: 1.1359, test_f1: 0.4003
 epoch: 76, train_loss: 1.1689, test_loss: 1.1352, test_f1: 0.3927
 epoch: 77, train_loss: 1.1599, test_loss: 1.1336, test_f1: 0.4014
 epoch: 78, train_loss: 1.1675, test_loss: 1.1347, test_f1: 0.4071
 epoch: 79, train_loss: 1.1596, test_loss: 1.1381, test_f1: 0.3890
 epoch: 80, train_loss: 1.1644, test_loss: 1.1347, test_f1: 0.3886
 epoch: 81, train_loss: 1.1590, test_loss: 1.1321, test_f1: 0.3980
 epoch: 82, train_loss: 1.1507, test_loss: 1.1335, test_f1: 0.4020
 epoch: 83, train_loss: 1.1616, test_loss: 1.1276, test_f1: 0.3935
 epoch: 84, train_loss: 1.1553, test_loss: 1.1303, test_f1: 0.3938
 epoch: 85, train_loss: 1.1539, test_loss: 1.1339, test_f1: 0.3929
 epoch: 86, train_loss: 1.1556, test_loss: 1.1293, test_f1: 0.3969
 epoch: 87, train_loss: 1.1604, test_loss: 1.1311, test_f1: 0.3975
 epoch: 88, train_loss: 1.1552, test_loss: 1.1301, test_f1: 0.4044
 epoch: 89, train_loss: 1.1490, test_loss: 1.1256, test_f1: 0.4082
 epoch: 90, train_loss: 1.1456, test_loss: 1.1283, test_f1: 0.4078
 epoch: 91, train_loss: 1.1529, test_loss: 1.1264, test_f1: 0.4029
 epoch: 92, train_loss: 1.1532, test_loss: 1.1268, test_f1: 0.4116
 epoch: 93, train_loss: 1.1499, test_loss: 1.1237, test_f1: 0.4006
 epoch: 94, train_loss: 1.1560, test_loss: 1.1242, test_f1: 0.3978
 epoch: 95, train_loss: 1.1495, test_loss: 1.1269, test_f1: 0.4038
 epoch: 96, train_loss: 1.1486, test_loss: 1.1224, test_f1: 0.4032
 epoch: 97, train_loss: 1.1488, test_loss: 1.1246, test_f1: 0.4139
 epoch: 98, train_loss: 1.1469, test_loss: 1.1225, test_f1: 0.4069
 epoch: 99, train_loss: 1.1487, test_loss: 1.1227, test_f1: 0.4143
##################ITERATION #7 ****************************************
 epoch: 0, train_loss: 1.3427, test_loss: 1.3303, test_f1: 0.2274
 epoch: 1, train_loss: 1.3189, test_loss: 1.3263, test_f1: 0.2274
 epoch: 2, train_loss: 1.3118, test_loss: 1.3147, test_f1: 0.2274
 epoch: 3, train_loss: 1.3022, test_loss: 1.3061, test_f1: 0.2274
 epoch: 4, train_loss: 1.2947, test_loss: 1.2955, test_f1: 0.2274
 epoch: 5, train_loss: 1.2877, test_loss: 1.2915, test_f1: 0.2274
 epoch: 6, train_loss: 1.2831, test_loss: 1.2835, test_f1: 0.2274
 epoch: 7, train_loss: 1.2706, test_loss: 1.2706, test_f1: 0.2274
 epoch: 8, train_loss: 1.2706, test_loss: 1.2712, test_f1: 0.2274
 epoch: 9, train_loss: 1.2640, test_loss: 1.2681, test_f1: 0.2274
 epoch: 10, train_loss: 1.2637, test_loss: 1.2556, test_f1: 0.2274
 epoch: 11, train_loss: 1.2563, test_loss: 1.2542, test_f1: 0.2274
 epoch: 12, train_loss: 1.2548, test_loss: 1.2482, test_f1: 0.2274
 epoch: 13, train_loss: 1.2562, test_loss: 1.2402, test_f1: 0.2392
 epoch: 14, train_loss: 1.2504, test_loss: 1.2390, test_f1: 0.2390
 epoch: 15, train_loss: 1.2488, test_loss: 1.2357, test_f1: 0.2390
 epoch: 16, train_loss: 1.2476, test_loss: 1.2298, test_f1: 0.2390
 epoch: 17, train_loss: 1.2459, test_loss: 1.2292, test_f1: 0.2582
 epoch: 18, train_loss: 1.2497, test_loss: 1.2248, test_f1: 0.2586
 epoch: 19, train_loss: 1.2442, test_loss: 1.2260, test_f1: 0.2419
 epoch: 20, train_loss: 1.2353, test_loss: 1.2188, test_f1: 0.2608
 epoch: 21, train_loss: 1.2454, test_loss: 1.2196, test_f1: 0.2609
 epoch: 22, train_loss: 1.2346, test_loss: 1.2141, test_f1: 0.2609
 epoch: 23, train_loss: 1.2351, test_loss: 1.2120, test_f1: 0.2609
 epoch: 24, train_loss: 1.2351, test_loss: 1.2140, test_f1: 0.2702
 epoch: 25, train_loss: 1.2304, test_loss: 1.2058, test_f1: 0.2702
 epoch: 26, train_loss: 1.2338, test_loss: 1.2058, test_f1: 0.2726
 epoch: 27, train_loss: 1.2295, test_loss: 1.2041, test_f1: 0.2726
 epoch: 28, train_loss: 1.2278, test_loss: 1.1998, test_f1: 0.2884
 epoch: 29, train_loss: 1.2248, test_loss: 1.2015, test_f1: 0.3026
 epoch: 30, train_loss: 1.2212, test_loss: 1.1979, test_f1: 0.3164
 epoch: 31, train_loss: 1.2196, test_loss: 1.1924, test_f1: 0.3145
 epoch: 32, train_loss: 1.2199, test_loss: 1.1934, test_f1: 0.3182
 epoch: 33, train_loss: 1.2203, test_loss: 1.1905, test_f1: 0.3216
 epoch: 34, train_loss: 1.2189, test_loss: 1.1921, test_f1: 0.3296
 epoch: 35, train_loss: 1.2158, test_loss: 1.1852, test_f1: 0.3216
 epoch: 36, train_loss: 1.2185, test_loss: 1.1864, test_f1: 0.3471
 epoch: 37, train_loss: 1.2080, test_loss: 1.1830, test_f1: 0.3547
 epoch: 38, train_loss: 1.2139, test_loss: 1.1808, test_f1: 0.3389
 epoch: 39, train_loss: 1.2037, test_loss: 1.1817, test_f1: 0.3618
 epoch: 40, train_loss: 1.2122, test_loss: 1.1775, test_f1: 0.3493
 epoch: 41, train_loss: 1.2058, test_loss: 1.1765, test_f1: 0.3569
 epoch: 42, train_loss: 1.2049, test_loss: 1.1725, test_f1: 0.3663
 epoch: 43, train_loss: 1.2088, test_loss: 1.1736, test_f1: 0.3728
 epoch: 44, train_loss: 1.2005, test_loss: 1.1719, test_f1: 0.3737
 epoch: 45, train_loss: 1.2034, test_loss: 1.1714, test_f1: 0.3838
 epoch: 46, train_loss: 1.1988, test_loss: 1.1676, test_f1: 0.3773
 epoch: 47, train_loss: 1.2005, test_loss: 1.1672, test_f1: 0.3811
 epoch: 48, train_loss: 1.1963, test_loss: 1.1635, test_f1: 0.3812
 epoch: 49, train_loss: 1.1929, test_loss: 1.1631, test_f1: 0.3923
 epoch: 50, train_loss: 1.1954, test_loss: 1.1569, test_f1: 0.3822
 epoch: 51, train_loss: 1.1957, test_loss: 1.1613, test_f1: 0.3937
 epoch: 52, train_loss: 1.1899, test_loss: 1.1585, test_f1: 0.3906
 epoch: 53, train_loss: 1.1888, test_loss: 1.1562, test_f1: 0.3919
 epoch: 54, train_loss: 1.1900, test_loss: 1.1577, test_f1: 0.3945
 epoch: 55, train_loss: 1.1845, test_loss: 1.1564, test_f1: 0.3939
 epoch: 56, train_loss: 1.1832, test_loss: 1.1550, test_f1: 0.3969
 epoch: 57, train_loss: 1.1885, test_loss: 1.1556, test_f1: 0.3989
 epoch: 58, train_loss: 1.1868, test_loss: 1.1539, test_f1: 0.3988
 epoch: 59, train_loss: 1.1928, test_loss: 1.1533, test_f1: 0.3988
 epoch: 60, train_loss: 1.1873, test_loss: 1.1551, test_f1: 0.4033
 epoch: 61, train_loss: 1.1791, test_loss: 1.1537, test_f1: 0.4060
 epoch: 62, train_loss: 1.1859, test_loss: 1.1523, test_f1: 0.4029
 epoch: 63, train_loss: 1.1844, test_loss: 1.1520, test_f1: 0.4080
 epoch: 64, train_loss: 1.1782, test_loss: 1.1510, test_f1: 0.3992
 epoch: 65, train_loss: 1.1847, test_loss: 1.1499, test_f1: 0.4007
 epoch: 66, train_loss: 1.1788, test_loss: 1.1485, test_f1: 0.3972
 epoch: 67, train_loss: 1.1800, test_loss: 1.1487, test_f1: 0.4047
 epoch: 68, train_loss: 1.1782, test_loss: 1.1493, test_f1: 0.3957
 epoch: 69, train_loss: 1.1792, test_loss: 1.1497, test_f1: 0.3947
 epoch: 70, train_loss: 1.1811, test_loss: 1.1462, test_f1: 0.4022
 epoch: 71, train_loss: 1.1732, test_loss: 1.1450, test_f1: 0.4046
 epoch: 72, train_loss: 1.1753, test_loss: 1.1421, test_f1: 0.4047
 epoch: 73, train_loss: 1.1748, test_loss: 1.1450, test_f1: 0.4060
 epoch: 74, train_loss: 1.1824, test_loss: 1.1422, test_f1: 0.4092
 epoch: 75, train_loss: 1.1722, test_loss: 1.1419, test_f1: 0.4022
 epoch: 76, train_loss: 1.1726, test_loss: 1.1425, test_f1: 0.4048
 epoch: 77, train_loss: 1.1704, test_loss: 1.1414, test_f1: 0.4121
 epoch: 78, train_loss: 1.1704, test_loss: 1.1399, test_f1: 0.4193
 epoch: 79, train_loss: 1.1763, test_loss: 1.1374, test_f1: 0.4149
 epoch: 80, train_loss: 1.1708, test_loss: 1.1427, test_f1: 0.4139
 epoch: 81, train_loss: 1.1667, test_loss: 1.1387, test_f1: 0.4206
 epoch: 82, train_loss: 1.1666, test_loss: 1.1383, test_f1: 0.4088
 epoch: 83, train_loss: 1.1715, test_loss: 1.1403, test_f1: 0.4200
 epoch: 84, train_loss: 1.1692, test_loss: 1.1374, test_f1: 0.4061
 epoch: 85, train_loss: 1.1729, test_loss: 1.1343, test_f1: 0.4057
 epoch: 86, train_loss: 1.1584, test_loss: 1.1344, test_f1: 0.4098
 epoch: 87, train_loss: 1.1712, test_loss: 1.1361, test_f1: 0.4096
 epoch: 88, train_loss: 1.1687, test_loss: 1.1341, test_f1: 0.4200
 epoch: 89, train_loss: 1.1724, test_loss: 1.1387, test_f1: 0.4083
 epoch: 90, train_loss: 1.1678, test_loss: 1.1340, test_f1: 0.4061
 epoch: 91, train_loss: 1.1641, test_loss: 1.1322, test_f1: 0.4159
 epoch: 92, train_loss: 1.1660, test_loss: 1.1335, test_f1: 0.4138
 epoch: 93, train_loss: 1.1579, test_loss: 1.1322, test_f1: 0.4199
 epoch: 94, train_loss: 1.1678, test_loss: 1.1337, test_f1: 0.4135
 epoch: 95, train_loss: 1.1624, test_loss: 1.1322, test_f1: 0.4209
 epoch: 96, train_loss: 1.1526, test_loss: 1.1292, test_f1: 0.4205
 epoch: 97, train_loss: 1.1516, test_loss: 1.1303, test_f1: 0.4140
 epoch: 98, train_loss: 1.1620, test_loss: 1.1294, test_f1: 0.4214
 epoch: 99, train_loss: 1.1543, test_loss: 1.1310, test_f1: 0.4151
##################ITERATION #8 ****************************************
 epoch: 0, train_loss: 1.3564, test_loss: 1.3558, test_f1: 0.2249
 epoch: 1, train_loss: 1.3303, test_loss: 1.3171, test_f1: 0.2285
 epoch: 2, train_loss: 1.3219, test_loss: 1.2969, test_f1: 0.2322
 epoch: 3, train_loss: 1.2986, test_loss: 1.2923, test_f1: 0.2264
 epoch: 4, train_loss: 1.2933, test_loss: 1.2775, test_f1: 0.2421
 epoch: 5, train_loss: 1.2878, test_loss: 1.2732, test_f1: 0.2340
 epoch: 6, train_loss: 1.2763, test_loss: 1.2585, test_f1: 0.2736
 epoch: 7, train_loss: 1.2765, test_loss: 1.2544, test_f1: 0.2773
 epoch: 8, train_loss: 1.2657, test_loss: 1.2580, test_f1: 0.2405
 epoch: 9, train_loss: 1.2643, test_loss: 1.2489, test_f1: 0.2788
 epoch: 10, train_loss: 1.2567, test_loss: 1.2480, test_f1: 0.2810
 epoch: 11, train_loss: 1.2502, test_loss: 1.2429, test_f1: 0.2795
 epoch: 12, train_loss: 1.2566, test_loss: 1.2358, test_f1: 0.2862
 epoch: 13, train_loss: 1.2492, test_loss: 1.2295, test_f1: 0.2812
 epoch: 14, train_loss: 1.2470, test_loss: 1.2275, test_f1: 0.2794
 epoch: 15, train_loss: 1.2397, test_loss: 1.2227, test_f1: 0.2909
 epoch: 16, train_loss: 1.2383, test_loss: 1.2219, test_f1: 0.2936
 epoch: 17, train_loss: 1.2393, test_loss: 1.2196, test_f1: 0.2953
 epoch: 18, train_loss: 1.2373, test_loss: 1.2185, test_f1: 0.2928
 epoch: 19, train_loss: 1.2406, test_loss: 1.2182, test_f1: 0.2916
 epoch: 20, train_loss: 1.2275, test_loss: 1.2153, test_f1: 0.2917
 epoch: 21, train_loss: 1.2370, test_loss: 1.2103, test_f1: 0.3015
 epoch: 22, train_loss: 1.2332, test_loss: 1.2121, test_f1: 0.2974
 epoch: 23, train_loss: 1.2312, test_loss: 1.2051, test_f1: 0.3123
 epoch: 24, train_loss: 1.2240, test_loss: 1.2058, test_f1: 0.3277
 epoch: 25, train_loss: 1.2207, test_loss: 1.2038, test_f1: 0.3178
 epoch: 26, train_loss: 1.2223, test_loss: 1.2010, test_f1: 0.3333
 epoch: 27, train_loss: 1.2246, test_loss: 1.2001, test_f1: 0.3373
 epoch: 28, train_loss: 1.2208, test_loss: 1.1923, test_f1: 0.3538
 epoch: 29, train_loss: 1.2227, test_loss: 1.1948, test_f1: 0.3460
 epoch: 30, train_loss: 1.2146, test_loss: 1.1943, test_f1: 0.3373
 epoch: 31, train_loss: 1.2167, test_loss: 1.1896, test_f1: 0.3427
 epoch: 32, train_loss: 1.2121, test_loss: 1.1979, test_f1: 0.3440
 epoch: 33, train_loss: 1.2176, test_loss: 1.2221, test_f1: 0.3431
 epoch: 34, train_loss: 1.2112, test_loss: 1.1872, test_f1: 0.3409
 epoch: 35, train_loss: 1.2122, test_loss: 1.1852, test_f1: 0.3524
 epoch: 36, train_loss: 1.2071, test_loss: 1.1794, test_f1: 0.3563
 epoch: 37, train_loss: 1.2076, test_loss: 1.1772, test_f1: 0.3581
 epoch: 38, train_loss: 1.1997, test_loss: 1.1784, test_f1: 0.3508
 epoch: 39, train_loss: 1.1995, test_loss: 1.1769, test_f1: 0.3566
 epoch: 40, train_loss: 1.2055, test_loss: 1.1751, test_f1: 0.3647
 epoch: 41, train_loss: 1.2042, test_loss: 1.1720, test_f1: 0.3644
 epoch: 42, train_loss: 1.1987, test_loss: 1.1692, test_f1: 0.3631
 epoch: 43, train_loss: 1.2019, test_loss: 1.1717, test_f1: 0.3645
 epoch: 44, train_loss: 1.2013, test_loss: 1.1667, test_f1: 0.3637
 epoch: 45, train_loss: 1.2019, test_loss: 1.1656, test_f1: 0.3668
 epoch: 46, train_loss: 1.1964, test_loss: 1.1641, test_f1: 0.3649
 epoch: 47, train_loss: 1.1966, test_loss: 1.1632, test_f1: 0.3697
 epoch: 48, train_loss: 1.1947, test_loss: 1.1664, test_f1: 0.3657
 epoch: 49, train_loss: 1.1927, test_loss: 1.1685, test_f1: 0.3700
 epoch: 50, train_loss: 1.1899, test_loss: 1.1612, test_f1: 0.3682
 epoch: 51, train_loss: 1.1869, test_loss: 1.1594, test_f1: 0.3599
 epoch: 52, train_loss: 1.1894, test_loss: 1.1647, test_f1: 0.3572
 epoch: 53, train_loss: 1.1887, test_loss: 1.1616, test_f1: 0.3649
 epoch: 54, train_loss: 1.1838, test_loss: 1.1585, test_f1: 0.3629
 epoch: 55, train_loss: 1.1869, test_loss: 1.1575, test_f1: 0.3621
 epoch: 56, train_loss: 1.1880, test_loss: 1.1548, test_f1: 0.3590
 epoch: 57, train_loss: 1.1851, test_loss: 1.1550, test_f1: 0.3634
 epoch: 58, train_loss: 1.1815, test_loss: 1.1536, test_f1: 0.3608
 epoch: 59, train_loss: 1.1851, test_loss: 1.1565, test_f1: 0.3680
 epoch: 60, train_loss: 1.1840, test_loss: 1.1522, test_f1: 0.3591
 epoch: 61, train_loss: 1.1857, test_loss: 1.1503, test_f1: 0.3715
 epoch: 62, train_loss: 1.1877, test_loss: 1.1550, test_f1: 0.3609
 epoch: 63, train_loss: 1.1820, test_loss: 1.1504, test_f1: 0.3643
 epoch: 64, train_loss: 1.1761, test_loss: 1.1500, test_f1: 0.3687
 epoch: 65, train_loss: 1.1750, test_loss: 1.1536, test_f1: 0.3765
 epoch: 66, train_loss: 1.1689, test_loss: 1.1492, test_f1: 0.3734
 epoch: 67, train_loss: 1.1830, test_loss: 1.1533, test_f1: 0.3710
 epoch: 68, train_loss: 1.1726, test_loss: 1.1424, test_f1: 0.3840
 epoch: 69, train_loss: 1.1743, test_loss: 1.1461, test_f1: 0.3757
 epoch: 70, train_loss: 1.1719, test_loss: 1.1472, test_f1: 0.3768
 epoch: 71, train_loss: 1.1773, test_loss: 1.1435, test_f1: 0.3753
 epoch: 72, train_loss: 1.1791, test_loss: 1.1424, test_f1: 0.3736
 epoch: 73, train_loss: 1.1767, test_loss: 1.1441, test_f1: 0.3760
 epoch: 74, train_loss: 1.1765, test_loss: 1.1435, test_f1: 0.3760
 epoch: 75, train_loss: 1.1767, test_loss: 1.1395, test_f1: 0.3732
 epoch: 76, train_loss: 1.1742, test_loss: 1.1435, test_f1: 0.3746
 epoch: 77, train_loss: 1.1726, test_loss: 1.1399, test_f1: 0.3738
 epoch: 78, train_loss: 1.1711, test_loss: 1.1421, test_f1: 0.3704
 epoch: 79, train_loss: 1.1638, test_loss: 1.1423, test_f1: 0.3788
 epoch: 80, train_loss: 1.1642, test_loss: 1.1483, test_f1: 0.3779
 epoch: 81, train_loss: 1.1665, test_loss: 1.1407, test_f1: 0.3758
 epoch: 82, train_loss: 1.1656, test_loss: 1.1387, test_f1: 0.3807
 epoch: 83, train_loss: 1.1707, test_loss: 1.1431, test_f1: 0.3810
 epoch: 84, train_loss: 1.1724, test_loss: 1.1391, test_f1: 0.3787
 epoch: 85, train_loss: 1.1685, test_loss: 1.1348, test_f1: 0.3827
 epoch: 86, train_loss: 1.1667, test_loss: 1.1468, test_f1: 0.3758
 epoch: 87, train_loss: 1.1643, test_loss: 1.1385, test_f1: 0.3818
 epoch: 88, train_loss: 1.1648, test_loss: 1.1344, test_f1: 0.3884
 epoch: 89, train_loss: 1.1612, test_loss: 1.1379, test_f1: 0.3773
 epoch: 90, train_loss: 1.1648, test_loss: 1.1378, test_f1: 0.3783
 epoch: 91, train_loss: 1.1523, test_loss: 1.1331, test_f1: 0.3868
 epoch: 92, train_loss: 1.1601, test_loss: 1.1317, test_f1: 0.3833
 epoch: 93, train_loss: 1.1658, test_loss: 1.1314, test_f1: 0.3896
 epoch: 94, train_loss: 1.1592, test_loss: 1.1368, test_f1: 0.3875
 epoch: 95, train_loss: 1.1619, test_loss: 1.1316, test_f1: 0.3838
 epoch: 96, train_loss: 1.1593, test_loss: 1.1363, test_f1: 0.3902
 epoch: 97, train_loss: 1.1578, test_loss: 1.1384, test_f1: 0.3852
 epoch: 98, train_loss: 1.1666, test_loss: 1.1384, test_f1: 0.3831
 epoch: 99, train_loss: 1.1670, test_loss: 1.1284, test_f1: 0.3805
##################ITERATION #9 ****************************************
 epoch: 0, train_loss: 1.3317, test_loss: 1.3127, test_f1: 0.2274
 epoch: 1, train_loss: 1.3163, test_loss: 1.3031, test_f1: 0.2274
 epoch: 2, train_loss: 1.3079, test_loss: 1.2959, test_f1: 0.2274
 epoch: 3, train_loss: 1.3031, test_loss: 1.2931, test_f1: 0.2274
 epoch: 4, train_loss: 1.2974, test_loss: 1.2912, test_f1: 0.2274
 epoch: 5, train_loss: 1.2927, test_loss: 1.2836, test_f1: 0.2325
 epoch: 6, train_loss: 1.2871, test_loss: 1.2814, test_f1: 0.2274
 epoch: 7, train_loss: 1.2833, test_loss: 1.2792, test_f1: 0.2274
 epoch: 8, train_loss: 1.2775, test_loss: 1.2764, test_f1: 0.2274
 epoch: 9, train_loss: 1.2707, test_loss: 1.2721, test_f1: 0.2300
 epoch: 10, train_loss: 1.2724, test_loss: 1.2680, test_f1: 0.2322
 epoch: 11, train_loss: 1.2672, test_loss: 1.2589, test_f1: 0.2300
 epoch: 12, train_loss: 1.2658, test_loss: 1.2559, test_f1: 0.2300
 epoch: 13, train_loss: 1.2615, test_loss: 1.2513, test_f1: 0.2389
 epoch: 14, train_loss: 1.2551, test_loss: 1.2534, test_f1: 0.2415
 epoch: 15, train_loss: 1.2588, test_loss: 1.2458, test_f1: 0.2350
 epoch: 16, train_loss: 1.2608, test_loss: 1.2503, test_f1: 0.2435
 epoch: 17, train_loss: 1.2489, test_loss: 1.2439, test_f1: 0.2485
 epoch: 18, train_loss: 1.2497, test_loss: 1.2400, test_f1: 0.2465
 epoch: 19, train_loss: 1.2487, test_loss: 1.2351, test_f1: 0.2599
 epoch: 20, train_loss: 1.2471, test_loss: 1.2328, test_f1: 0.2506
 epoch: 21, train_loss: 1.2418, test_loss: 1.2362, test_f1: 0.2704
 epoch: 22, train_loss: 1.2386, test_loss: 1.2278, test_f1: 0.2737
 epoch: 23, train_loss: 1.2394, test_loss: 1.2221, test_f1: 0.2863
 epoch: 24, train_loss: 1.2422, test_loss: 1.2249, test_f1: 0.2720
 epoch: 25, train_loss: 1.2344, test_loss: 1.2234, test_f1: 0.2865
 epoch: 26, train_loss: 1.2396, test_loss: 1.2166, test_f1: 0.2933
 epoch: 27, train_loss: 1.2345, test_loss: 1.2190, test_f1: 0.2986
 epoch: 28, train_loss: 1.2302, test_loss: 1.2094, test_f1: 0.3024
 epoch: 29, train_loss: 1.2329, test_loss: 1.2059, test_f1: 0.3306
 epoch: 30, train_loss: 1.2231, test_loss: 1.2019, test_f1: 0.3304
 epoch: 31, train_loss: 1.2259, test_loss: 1.2017, test_f1: 0.3310
 epoch: 32, train_loss: 1.2270, test_loss: 1.2025, test_f1: 0.3326
 epoch: 33, train_loss: 1.2272, test_loss: 1.1951, test_f1: 0.3335
 epoch: 34, train_loss: 1.2210, test_loss: 1.1960, test_f1: 0.3377
 epoch: 35, train_loss: 1.2301, test_loss: 1.1976, test_f1: 0.3417
 epoch: 36, train_loss: 1.2138, test_loss: 1.1924, test_f1: 0.3502
 epoch: 37, train_loss: 1.2211, test_loss: 1.1920, test_f1: 0.3535
 epoch: 38, train_loss: 1.2174, test_loss: 1.1955, test_f1: 0.3545
 epoch: 39, train_loss: 1.2166, test_loss: 1.1906, test_f1: 0.3648
 epoch: 40, train_loss: 1.2232, test_loss: 1.1872, test_f1: 0.3690
 epoch: 41, train_loss: 1.2145, test_loss: 1.1874, test_f1: 0.3580
 epoch: 42, train_loss: 1.2144, test_loss: 1.1836, test_f1: 0.3661
 epoch: 43, train_loss: 1.2059, test_loss: 1.1816, test_f1: 0.3740
 epoch: 44, train_loss: 1.2170, test_loss: 1.1791, test_f1: 0.3716
 epoch: 45, train_loss: 1.2040, test_loss: 1.1828, test_f1: 0.3595
 epoch: 46, train_loss: 1.2074, test_loss: 1.1798, test_f1: 0.3646
 epoch: 47, train_loss: 1.2118, test_loss: 1.1769, test_f1: 0.3731
 epoch: 48, train_loss: 1.2075, test_loss: 1.1790, test_f1: 0.3678
 epoch: 49, train_loss: 1.1980, test_loss: 1.1788, test_f1: 0.3636
 epoch: 50, train_loss: 1.2091, test_loss: 1.1784, test_f1: 0.3738
 epoch: 51, train_loss: 1.2037, test_loss: 1.1769, test_f1: 0.3717
 epoch: 52, train_loss: 1.2070, test_loss: 1.1763, test_f1: 0.3788
 epoch: 53, train_loss: 1.2066, test_loss: 1.1785, test_f1: 0.3681
 epoch: 54, train_loss: 1.1984, test_loss: 1.1742, test_f1: 0.3738
 epoch: 55, train_loss: 1.2005, test_loss: 1.1729, test_f1: 0.3837
 epoch: 56, train_loss: 1.2052, test_loss: 1.1728, test_f1: 0.3789
 epoch: 57, train_loss: 1.1933, test_loss: 1.1734, test_f1: 0.3757
 epoch: 58, train_loss: 1.1960, test_loss: 1.1705, test_f1: 0.3802
 epoch: 59, train_loss: 1.2032, test_loss: 1.1712, test_f1: 0.3775
 epoch: 60, train_loss: 1.2021, test_loss: 1.1694, test_f1: 0.3855
 epoch: 61, train_loss: 1.2022, test_loss: 1.1697, test_f1: 0.3753
 epoch: 62, train_loss: 1.1941, test_loss: 1.1722, test_f1: 0.3837
 epoch: 63, train_loss: 1.1966, test_loss: 1.1696, test_f1: 0.3795
 epoch: 64, train_loss: 1.1995, test_loss: 1.1674, test_f1: 0.3858
 epoch: 65, train_loss: 1.2010, test_loss: 1.1677, test_f1: 0.3800
 epoch: 66, train_loss: 1.1943, test_loss: 1.1670, test_f1: 0.3828
 epoch: 67, train_loss: 1.1920, test_loss: 1.1674, test_f1: 0.3869
 epoch: 68, train_loss: 1.1973, test_loss: 1.1662, test_f1: 0.3869
 epoch: 69, train_loss: 1.1965, test_loss: 1.1643, test_f1: 0.3867
 epoch: 70, train_loss: 1.2008, test_loss: 1.1659, test_f1: 0.3869
 epoch: 71, train_loss: 1.2003, test_loss: 1.1663, test_f1: 0.3815
 epoch: 72, train_loss: 1.1925, test_loss: 1.1637, test_f1: 0.3844
 epoch: 73, train_loss: 1.1964, test_loss: 1.1651, test_f1: 0.3863
 epoch: 74, train_loss: 1.1932, test_loss: 1.1634, test_f1: 0.3804
 epoch: 75, train_loss: 1.1944, test_loss: 1.1634, test_f1: 0.3786
 epoch: 76, train_loss: 1.1990, test_loss: 1.1634, test_f1: 0.3880
 epoch: 77, train_loss: 1.1916, test_loss: 1.1631, test_f1: 0.3854
 epoch: 78, train_loss: 1.1892, test_loss: 1.1637, test_f1: 0.3817
 epoch: 79, train_loss: 1.1939, test_loss: 1.1622, test_f1: 0.3928
 epoch: 80, train_loss: 1.1990, test_loss: 1.1618, test_f1: 0.3886
 epoch: 81, train_loss: 1.1917, test_loss: 1.1583, test_f1: 0.3874
 epoch: 82, train_loss: 1.1962, test_loss: 1.1580, test_f1: 0.3922
 epoch: 83, train_loss: 1.1925, test_loss: 1.1590, test_f1: 0.3912
 epoch: 84, train_loss: 1.1909, test_loss: 1.1594, test_f1: 0.3863
 epoch: 85, train_loss: 1.1918, test_loss: 1.1592, test_f1: 0.3925
 epoch: 86, train_loss: 1.1841, test_loss: 1.1593, test_f1: 0.3862
 epoch: 87, train_loss: 1.1861, test_loss: 1.1568, test_f1: 0.3819
 epoch: 88, train_loss: 1.1898, test_loss: 1.1566, test_f1: 0.3938
 epoch: 89, train_loss: 1.1846, test_loss: 1.1567, test_f1: 0.3904
 epoch: 90, train_loss: 1.1882, test_loss: 1.1579, test_f1: 0.3837
 epoch: 91, train_loss: 1.1888, test_loss: 1.1594, test_f1: 0.3833
 epoch: 92, train_loss: 1.1823, test_loss: 1.1546, test_f1: 0.3933
 epoch: 93, train_loss: 1.1873, test_loss: 1.1538, test_f1: 0.3868
 epoch: 94, train_loss: 1.1956, test_loss: 1.1547, test_f1: 0.3842
 epoch: 95, train_loss: 1.1882, test_loss: 1.1547, test_f1: 0.3875
 epoch: 96, train_loss: 1.1811, test_loss: 1.1512, test_f1: 0.3904
 epoch: 97, train_loss: 1.1761, test_loss: 1.1528, test_f1: 0.3877
 epoch: 98, train_loss: 1.1839, test_loss: 1.1521, test_f1: 0.3880
 epoch: 99, train_loss: 1.1812, test_loss: 1.1538, test_f1: 0.3853

Training completed in 728.34 seconds
Best F1: 0.4560 at epoch 53
Mean F1 across iterations: 0.4125  0.0301
========================FINAL RESULTS================================
FEGIN weighted F1: 0.4560  0.0301
python main.py --data ltspice_examples --representation component_component --model FEGIN --layers 5 --hiddens 16 --batch_size 64 --lr 0.0001 --emb_size 128 --epochs 100 --save_appendix component_component_L5_H16_BS64_LR0.0001_E128 --no_val
-----



STDERR:
  File "main.py", line 370, in <module>
    main()
  File "main.py", line 254, in main
    dataset = dataset_class(
  File "/home/philip/projects/ltspice_examples_code_repo/Circuit-Completion-Using-GNNs/component_classification_with_link_prediction_head/evaluation/FEGIN/kernel/circuit_datasets.py", line 15, in __init__
    self.data, self.slices = torch.load(self.processed_paths[0])
  File "/home/philip/.local/lib/python3.8/site-packages/torch/serialization.py", line 1040, in load
    warnings.warn(
  File "/usr/lib/python3.8/warnings.py", line 109, in _showwarnmsg
    sw(msg.message, msg.category, msg.filename, msg.lineno,
  File "main.py", line 47, in warn_with_traceback
    traceback.print_stack(file=log)
/home/philip/projects/ltspice_examples_code_repo/Circuit-Completion-Using-GNNs/component_classification_with_link_prediction_head/evaluation/FEGIN/kernel/circuit_datasets.py:15: FutureWarning: You are using `torch.load` with `weights_only=False` (the current default value), which uses the default pickle module implicitly. It is possible to construct malicious pickle data which will execute arbitrary code during unpickling (See https://github.com/pytorch/pytorch/blob/main/SECURITY.md#untrusted-models for more details). In a future release, the default value for `weights_only` will be flipped to `True`. This limits the functions that could be executed during unpickling. Arbitrary objects will no longer be allowed to be loaded via this mode unless they are explicitly allowlisted by the user via `torch.serialization.add_safe_globals`. We recommend you start setting `weights_only=True` for any use case where you don't have full control of the loaded file. Please open an issue on GitHub for any issues related to this experimental feature.
  self.data, self.slices = torch.load(self.processed_paths[0])
