STDOUT:
Results will be saved in /home/philip/projects/llm_inference_code_repo/Circuit-Completion-Using-GNNs/component_classification_with_link_prediction_head/evaluation/FEGIN/results/model_FEGIN_dataset_ltspice_examples
Command line input: python main.py --data ltspice_examples --representation component_pin --model FEGIN --layers 5 --hiddens 32 --batch_size 32 --lr 0.0001 --emb_size 250 --epochs 100 --save_appendix component_pin_L5_H32_BS32_LR0.0001_E250 --no_val
 is saved.
-----
ltspice_examples - FEGIN
Using 5 layers, 32 hidden units, h = 2
Loading component_pin representation dataset
ENTERED
Training FEGIN on component_pin representation
Train: 3560, Test: 848
##################ITERATION #0 ****************************************
 epoch: 0, train_loss: 1.3863, test_loss: 1.3720, test_f1: 0.1013
 epoch: 1, train_loss: 1.3538, test_loss: 1.3455, test_f1: 0.2253
 epoch: 2, train_loss: 1.3209, test_loss: 1.3097, test_f1: 0.2308
 epoch: 3, train_loss: 1.2814, test_loss: 1.2653, test_f1: 0.2260
 epoch: 4, train_loss: 1.2496, test_loss: 1.2340, test_f1: 0.2260
 epoch: 5, train_loss: 1.2348, test_loss: 1.2148, test_f1: 0.2260
 epoch: 6, train_loss: 1.2183, test_loss: 1.1958, test_f1: 0.2260
 epoch: 7, train_loss: 1.2069, test_loss: 1.1813, test_f1: 0.2260
 epoch: 8, train_loss: 1.1909, test_loss: 1.1627, test_f1: 0.3160
 epoch: 9, train_loss: 1.1762, test_loss: 1.1423, test_f1: 0.3321
 epoch: 10, train_loss: 1.1599, test_loss: 1.1256, test_f1: 0.3474
 epoch: 11, train_loss: 1.1393, test_loss: 1.1012, test_f1: 0.3484
 epoch: 12, train_loss: 1.1235, test_loss: 1.0830, test_f1: 0.3501
 epoch: 13, train_loss: 1.1038, test_loss: 1.0814, test_f1: 0.3527
 epoch: 14, train_loss: 1.0858, test_loss: 1.0718, test_f1: 0.3511
 epoch: 15, train_loss: 1.0742, test_loss: 1.0408, test_f1: 0.3520
 epoch: 16, train_loss: 1.0617, test_loss: 1.0356, test_f1: 0.3576
 epoch: 17, train_loss: 1.0474, test_loss: 1.0319, test_f1: 0.3729
 epoch: 18, train_loss: 1.0393, test_loss: 1.0256, test_f1: 0.4003
 epoch: 19, train_loss: 1.0304, test_loss: 1.0266, test_f1: 0.4123
 epoch: 20, train_loss: 1.0337, test_loss: 1.0284, test_f1: 0.4243
 epoch: 21, train_loss: 1.0257, test_loss: 1.0208, test_f1: 0.4314
 epoch: 22, train_loss: 1.0247, test_loss: 1.0230, test_f1: 0.4395
 epoch: 23, train_loss: 1.0158, test_loss: 1.0202, test_f1: 0.4430
 epoch: 24, train_loss: 1.0100, test_loss: 1.0173, test_f1: 0.4590
 epoch: 25, train_loss: 1.0057, test_loss: 1.0247, test_f1: 0.4367
 epoch: 26, train_loss: 1.0059, test_loss: 1.0131, test_f1: 0.4583
 epoch: 27, train_loss: 0.9973, test_loss: 1.0152, test_f1: 0.4686
 epoch: 28, train_loss: 0.9900, test_loss: 1.0081, test_f1: 0.4458
 epoch: 29, train_loss: 0.9924, test_loss: 1.0220, test_f1: 0.4608
 epoch: 30, train_loss: 0.9948, test_loss: 1.0173, test_f1: 0.4630
 epoch: 31, train_loss: 0.9841, test_loss: 1.0065, test_f1: 0.4737
 epoch: 32, train_loss: 0.9791, test_loss: 1.0215, test_f1: 0.4643
 epoch: 33, train_loss: 0.9829, test_loss: 1.0131, test_f1: 0.4771
 epoch: 34, train_loss: 0.9784, test_loss: 1.0079, test_f1: 0.4702
 epoch: 35, train_loss: 0.9672, test_loss: 1.0084, test_f1: 0.4838
 epoch: 36, train_loss: 0.9655, test_loss: 0.9671, test_f1: 0.4755
 epoch: 37, train_loss: 0.9643, test_loss: 0.9754, test_f1: 0.4807
 epoch: 38, train_loss: 0.9600, test_loss: 0.9879, test_f1: 0.4935
 epoch: 39, train_loss: 0.9590, test_loss: 0.9701, test_f1: 0.4814
 epoch: 40, train_loss: 0.9599, test_loss: 0.9969, test_f1: 0.4779
 epoch: 41, train_loss: 0.9510, test_loss: 0.9724, test_f1: 0.4913
 epoch: 42, train_loss: 0.9505, test_loss: 0.9788, test_f1: 0.5016
 epoch: 43, train_loss: 0.9410, test_loss: 0.9698, test_f1: 0.4897
 epoch: 44, train_loss: 0.9404, test_loss: 0.9706, test_f1: 0.4884
 epoch: 45, train_loss: 0.9480, test_loss: 0.9509, test_f1: 0.5000
 epoch: 46, train_loss: 0.9323, test_loss: 0.9597, test_f1: 0.4911
 epoch: 47, train_loss: 0.9320, test_loss: 0.9492, test_f1: 0.4785
 epoch: 48, train_loss: 0.9269, test_loss: 0.9400, test_f1: 0.4990
 epoch: 49, train_loss: 0.9283, test_loss: 0.9477, test_f1: 0.5005
 epoch: 50, train_loss: 0.9166, test_loss: 0.9651, test_f1: 0.5097
 epoch: 51, train_loss: 0.9207, test_loss: 0.9626, test_f1: 0.5018
 epoch: 52, train_loss: 0.9199, test_loss: 0.9547, test_f1: 0.5044
 epoch: 53, train_loss: 0.9115, test_loss: 0.9701, test_f1: 0.4959
 epoch: 54, train_loss: 0.9187, test_loss: 0.9560, test_f1: 0.4993
 epoch: 55, train_loss: 0.9125, test_loss: 0.9601, test_f1: 0.4963
 epoch: 56, train_loss: 0.9106, test_loss: 0.9525, test_f1: 0.5078
 epoch: 57, train_loss: 0.9135, test_loss: 0.9444, test_f1: 0.4943
 epoch: 58, train_loss: 0.9071, test_loss: 0.9273, test_f1: 0.5028
 epoch: 59, train_loss: 0.9050, test_loss: 0.9378, test_f1: 0.5128
 epoch: 60, train_loss: 0.9053, test_loss: 0.9478, test_f1: 0.5047
 epoch: 61, train_loss: 0.9002, test_loss: 0.9489, test_f1: 0.5194
 epoch: 62, train_loss: 0.9004, test_loss: 0.9406, test_f1: 0.5062
 epoch: 63, train_loss: 0.9015, test_loss: 0.9537, test_f1: 0.5031
 epoch: 64, train_loss: 0.9001, test_loss: 0.9590, test_f1: 0.5040
 epoch: 65, train_loss: 0.8973, test_loss: 0.9476, test_f1: 0.5158
 epoch: 66, train_loss: 0.9050, test_loss: 0.9239, test_f1: 0.5124
 epoch: 67, train_loss: 0.9066, test_loss: 0.9257, test_f1: 0.5122
 epoch: 68, train_loss: 0.8876, test_loss: 0.9431, test_f1: 0.5034
 epoch: 69, train_loss: 0.9002, test_loss: 0.9183, test_f1: 0.5157
 epoch: 70, train_loss: 0.9024, test_loss: 0.9199, test_f1: 0.5056
 epoch: 71, train_loss: 0.8944, test_loss: 0.9397, test_f1: 0.5050
 epoch: 72, train_loss: 0.8930, test_loss: 0.9393, test_f1: 0.5064
 epoch: 73, train_loss: 0.8909, test_loss: 0.9300, test_f1: 0.5127
 epoch: 74, train_loss: 0.8852, test_loss: 0.9430, test_f1: 0.5083
 epoch: 75, train_loss: 0.8818, test_loss: 0.9283, test_f1: 0.5161
 epoch: 76, train_loss: 0.8854, test_loss: 0.9305, test_f1: 0.5039
 epoch: 77, train_loss: 0.8928, test_loss: 0.9312, test_f1: 0.5142
 epoch: 78, train_loss: 0.8832, test_loss: 0.9349, test_f1: 0.5132
 epoch: 79, train_loss: 0.8779, test_loss: 0.9307, test_f1: 0.5149
 epoch: 80, train_loss: 0.8795, test_loss: 0.9278, test_f1: 0.5104
 epoch: 81, train_loss: 0.8725, test_loss: 0.9193, test_f1: 0.5137
 epoch: 82, train_loss: 0.8693, test_loss: 0.9422, test_f1: 0.5149
 epoch: 83, train_loss: 0.8834, test_loss: 0.9288, test_f1: 0.5105
 epoch: 84, train_loss: 0.8666, test_loss: 0.9492, test_f1: 0.5142
 epoch: 85, train_loss: 0.8727, test_loss: 0.9297, test_f1: 0.5179
 epoch: 86, train_loss: 0.8634, test_loss: 0.9465, test_f1: 0.5024
 epoch: 87, train_loss: 0.8783, test_loss: 0.9312, test_f1: 0.5149
 epoch: 88, train_loss: 0.8700, test_loss: 0.9379, test_f1: 0.5074
 epoch: 89, train_loss: 0.8665, test_loss: 0.9549, test_f1: 0.5027
 epoch: 90, train_loss: 0.8758, test_loss: 0.9366, test_f1: 0.5191
 epoch: 91, train_loss: 0.8695, test_loss: 0.9205, test_f1: 0.5243
 epoch: 92, train_loss: 0.8586, test_loss: 0.9350, test_f1: 0.5231
 epoch: 93, train_loss: 0.8681, test_loss: 0.9057, test_f1: 0.5172
 epoch: 94, train_loss: 0.8645, test_loss: 0.9120, test_f1: 0.5146
 epoch: 95, train_loss: 0.8612, test_loss: 0.9117, test_f1: 0.5373
 epoch: 96, train_loss: 0.8611, test_loss: 0.9251, test_f1: 0.5173
 epoch: 97, train_loss: 0.8550, test_loss: 0.9164, test_f1: 0.5262
 epoch: 98, train_loss: 0.8606, test_loss: 0.9154, test_f1: 0.5322
 epoch: 99, train_loss: 0.8537, test_loss: 0.9206, test_f1: 0.5188
##################ITERATION #1 ****************************************
 epoch: 0, train_loss: 1.3292, test_loss: 1.3127, test_f1: 0.2260
 epoch: 1, train_loss: 1.2964, test_loss: 1.2898, test_f1: 0.2260
 epoch: 2, train_loss: 1.2745, test_loss: 1.2675, test_f1: 0.2260
 epoch: 3, train_loss: 1.2540, test_loss: 1.2464, test_f1: 0.2260
 epoch: 4, train_loss: 1.2346, test_loss: 1.2154, test_f1: 0.2260
 epoch: 5, train_loss: 1.2145, test_loss: 1.1952, test_f1: 0.2909
 epoch: 6, train_loss: 1.1931, test_loss: 1.1671, test_f1: 0.3335
 epoch: 7, train_loss: 1.1680, test_loss: 1.1415, test_f1: 0.3361
 epoch: 8, train_loss: 1.1476, test_loss: 1.1141, test_f1: 0.3403
 epoch: 9, train_loss: 1.1231, test_loss: 1.0851, test_f1: 0.3397
 epoch: 10, train_loss: 1.0934, test_loss: 1.0698, test_f1: 0.3422
 epoch: 11, train_loss: 1.0842, test_loss: 1.0664, test_f1: 0.3268
 epoch: 12, train_loss: 1.0676, test_loss: 1.0574, test_f1: 0.3413
 epoch: 13, train_loss: 1.0604, test_loss: 1.0534, test_f1: 0.3575
 epoch: 14, train_loss: 1.0411, test_loss: 1.0461, test_f1: 0.3607
 epoch: 15, train_loss: 1.0395, test_loss: 1.0548, test_f1: 0.3476
 epoch: 16, train_loss: 1.0314, test_loss: 1.0417, test_f1: 0.4036
 epoch: 17, train_loss: 1.0242, test_loss: 1.0599, test_f1: 0.3785
 epoch: 18, train_loss: 1.0123, test_loss: 1.0454, test_f1: 0.4616
 epoch: 19, train_loss: 1.0052, test_loss: 1.0412, test_f1: 0.4514
 epoch: 20, train_loss: 1.0032, test_loss: 1.0409, test_f1: 0.4608
 epoch: 21, train_loss: 0.9965, test_loss: 1.0405, test_f1: 0.4326
 epoch: 22, train_loss: 0.9862, test_loss: 1.0358, test_f1: 0.4599
 epoch: 23, train_loss: 0.9896, test_loss: 1.0304, test_f1: 0.4717
 epoch: 24, train_loss: 0.9843, test_loss: 1.0340, test_f1: 0.4740
 epoch: 25, train_loss: 0.9759, test_loss: 1.0257, test_f1: 0.4748
 epoch: 26, train_loss: 0.9707, test_loss: 1.0182, test_f1: 0.4794
 epoch: 27, train_loss: 0.9696, test_loss: 1.0128, test_f1: 0.4740
 epoch: 28, train_loss: 0.9666, test_loss: 1.0334, test_f1: 0.4679
 epoch: 29, train_loss: 0.9507, test_loss: 1.0239, test_f1: 0.4797
 epoch: 30, train_loss: 0.9715, test_loss: 1.0293, test_f1: 0.4769
 epoch: 31, train_loss: 0.9599, test_loss: 1.0469, test_f1: 0.4556
 epoch: 32, train_loss: 0.9553, test_loss: 1.0152, test_f1: 0.4978
 epoch: 33, train_loss: 0.9475, test_loss: 1.0306, test_f1: 0.4938
 epoch: 34, train_loss: 0.9470, test_loss: 1.0070, test_f1: 0.5085
 epoch: 35, train_loss: 0.9438, test_loss: 1.0166, test_f1: 0.4958
 epoch: 36, train_loss: 0.9400, test_loss: 1.0032, test_f1: 0.5081
 epoch: 37, train_loss: 0.9307, test_loss: 1.0177, test_f1: 0.4788
 epoch: 38, train_loss: 0.9345, test_loss: 0.9979, test_f1: 0.4894
 epoch: 39, train_loss: 0.9249, test_loss: 1.0050, test_f1: 0.4818
 epoch: 40, train_loss: 0.9382, test_loss: 1.0044, test_f1: 0.4862
 epoch: 41, train_loss: 0.9278, test_loss: 1.0012, test_f1: 0.5133
 epoch: 42, train_loss: 0.9265, test_loss: 1.0028, test_f1: 0.4852
 epoch: 43, train_loss: 0.9231, test_loss: 1.0035, test_f1: 0.4898
 epoch: 44, train_loss: 0.9181, test_loss: 1.0020, test_f1: 0.5118
 epoch: 45, train_loss: 0.9188, test_loss: 1.0140, test_f1: 0.5003
 epoch: 46, train_loss: 0.9156, test_loss: 0.9927, test_f1: 0.4975
 epoch: 47, train_loss: 0.9172, test_loss: 1.0027, test_f1: 0.4906
 epoch: 48, train_loss: 0.9112, test_loss: 0.9913, test_f1: 0.4992
 epoch: 49, train_loss: 0.9071, test_loss: 0.9865, test_f1: 0.5073
 epoch: 50, train_loss: 0.9052, test_loss: 0.9583, test_f1: 0.5159
 epoch: 51, train_loss: 0.8981, test_loss: 0.9623, test_f1: 0.5173
 epoch: 52, train_loss: 0.9012, test_loss: 0.9705, test_f1: 0.5128
 epoch: 53, train_loss: 0.8956, test_loss: 0.9756, test_f1: 0.5209
 epoch: 54, train_loss: 0.8993, test_loss: 0.9869, test_f1: 0.5149
 epoch: 55, train_loss: 0.8901, test_loss: 0.9675, test_f1: 0.5227
 epoch: 56, train_loss: 0.8903, test_loss: 1.0187, test_f1: 0.4996
 epoch: 57, train_loss: 0.8876, test_loss: 0.9841, test_f1: 0.5091
 epoch: 58, train_loss: 0.8860, test_loss: 1.0024, test_f1: 0.5069
 epoch: 59, train_loss: 0.8986, test_loss: 1.0007, test_f1: 0.5045
 epoch: 60, train_loss: 0.8884, test_loss: 1.0202, test_f1: 0.4944
 epoch: 61, train_loss: 0.8854, test_loss: 0.9679, test_f1: 0.5165
 epoch: 62, train_loss: 0.8879, test_loss: 0.9756, test_f1: 0.5228
 epoch: 63, train_loss: 0.8873, test_loss: 0.9674, test_f1: 0.5216
 epoch: 64, train_loss: 0.8830, test_loss: 0.9714, test_f1: 0.5043
 epoch: 65, train_loss: 0.8882, test_loss: 1.0000, test_f1: 0.5063
 epoch: 66, train_loss: 0.8851, test_loss: 0.9735, test_f1: 0.5116
 epoch: 67, train_loss: 0.8891, test_loss: 0.9725, test_f1: 0.5130
 epoch: 68, train_loss: 0.8862, test_loss: 0.9833, test_f1: 0.5125
 epoch: 69, train_loss: 0.8821, test_loss: 0.9824, test_f1: 0.5138
 epoch: 70, train_loss: 0.8735, test_loss: 0.9727, test_f1: 0.5049
 epoch: 71, train_loss: 0.8752, test_loss: 0.9852, test_f1: 0.5051
 epoch: 72, train_loss: 0.8761, test_loss: 1.0058, test_f1: 0.5008
 epoch: 73, train_loss: 0.8741, test_loss: 0.9652, test_f1: 0.5135
 epoch: 74, train_loss: 0.8782, test_loss: 0.9903, test_f1: 0.5067
 epoch: 75, train_loss: 0.8741, test_loss: 0.9754, test_f1: 0.5121
 epoch: 76, train_loss: 0.8764, test_loss: 0.9842, test_f1: 0.5032
 epoch: 77, train_loss: 0.8755, test_loss: 0.9843, test_f1: 0.5060
 epoch: 78, train_loss: 0.8666, test_loss: 0.9992, test_f1: 0.5022
 epoch: 79, train_loss: 0.8735, test_loss: 1.0166, test_f1: 0.4976
 epoch: 80, train_loss: 0.8715, test_loss: 0.9853, test_f1: 0.5097
 epoch: 81, train_loss: 0.8669, test_loss: 0.9970, test_f1: 0.5019
 epoch: 82, train_loss: 0.8690, test_loss: 0.9711, test_f1: 0.5139
 epoch: 83, train_loss: 0.8681, test_loss: 0.9982, test_f1: 0.5083
 epoch: 84, train_loss: 0.8568, test_loss: 0.9844, test_f1: 0.5113
 epoch: 85, train_loss: 0.8622, test_loss: 0.9976, test_f1: 0.5022
 epoch: 86, train_loss: 0.8662, test_loss: 0.9925, test_f1: 0.5013
 epoch: 87, train_loss: 0.8692, test_loss: 0.9743, test_f1: 0.5181
 epoch: 88, train_loss: 0.8584, test_loss: 1.0011, test_f1: 0.5034
 epoch: 89, train_loss: 0.8579, test_loss: 0.9867, test_f1: 0.5045
 epoch: 90, train_loss: 0.8630, test_loss: 0.9804, test_f1: 0.5204
 epoch: 91, train_loss: 0.8552, test_loss: 0.9805, test_f1: 0.5061
 epoch: 92, train_loss: 0.8600, test_loss: 0.9791, test_f1: 0.4999
 epoch: 93, train_loss: 0.8521, test_loss: 0.9775, test_f1: 0.5228
 epoch: 94, train_loss: 0.8459, test_loss: 0.9972, test_f1: 0.5034
 epoch: 95, train_loss: 0.8484, test_loss: 0.9914, test_f1: 0.5068
 epoch: 96, train_loss: 0.8581, test_loss: 0.9763, test_f1: 0.5243
 epoch: 97, train_loss: 0.8399, test_loss: 0.9841, test_f1: 0.5140
 epoch: 98, train_loss: 0.8491, test_loss: 0.9829, test_f1: 0.5092
 epoch: 99, train_loss: 0.8407, test_loss: 0.9829, test_f1: 0.5138
##################ITERATION #2 ****************************************
 epoch: 0, train_loss: 1.3130, test_loss: 1.2984, test_f1: 0.2260
 epoch: 1, train_loss: 1.2768, test_loss: 1.2678, test_f1: 0.2260
 epoch: 2, train_loss: 1.2530, test_loss: 1.2380, test_f1: 0.2260
 epoch: 3, train_loss: 1.2190, test_loss: 1.1874, test_f1: 0.2361
 epoch: 4, train_loss: 1.1919, test_loss: 1.1533, test_f1: 0.3439
 epoch: 5, train_loss: 1.1624, test_loss: 1.1230, test_f1: 0.3789
 epoch: 6, train_loss: 1.1432, test_loss: 1.0888, test_f1: 0.3803
 epoch: 7, train_loss: 1.1161, test_loss: 1.0805, test_f1: 0.3952
 epoch: 8, train_loss: 1.0843, test_loss: 1.0639, test_f1: 0.4160
 epoch: 9, train_loss: 1.0762, test_loss: 1.0588, test_f1: 0.4271
 epoch: 10, train_loss: 1.0641, test_loss: 1.0588, test_f1: 0.4463
 epoch: 11, train_loss: 1.0591, test_loss: 1.0555, test_f1: 0.4407
 epoch: 12, train_loss: 1.0515, test_loss: 1.0693, test_f1: 0.4512
 epoch: 13, train_loss: 1.0415, test_loss: 1.0589, test_f1: 0.4298
 epoch: 14, train_loss: 1.0352, test_loss: 1.0597, test_f1: 0.4476
 epoch: 15, train_loss: 1.0314, test_loss: 1.0613, test_f1: 0.4470
 epoch: 16, train_loss: 1.0238, test_loss: 1.0561, test_f1: 0.4479
 epoch: 17, train_loss: 1.0246, test_loss: 1.0613, test_f1: 0.4515
 epoch: 18, train_loss: 1.0093, test_loss: 1.0440, test_f1: 0.4604
 epoch: 19, train_loss: 1.0102, test_loss: 1.0572, test_f1: 0.4551
 epoch: 20, train_loss: 1.0088, test_loss: 1.0445, test_f1: 0.4741
 epoch: 21, train_loss: 1.0036, test_loss: 1.0458, test_f1: 0.4720
 epoch: 22, train_loss: 1.0038, test_loss: 1.0526, test_f1: 0.4739
 epoch: 23, train_loss: 0.9956, test_loss: 1.0430, test_f1: 0.4695
 epoch: 24, train_loss: 0.9910, test_loss: 1.0424, test_f1: 0.4678
 epoch: 25, train_loss: 0.9854, test_loss: 1.0456, test_f1: 0.4962
 epoch: 26, train_loss: 0.9791, test_loss: 1.0439, test_f1: 0.4802
 epoch: 27, train_loss: 0.9750, test_loss: 1.0152, test_f1: 0.4967
 epoch: 28, train_loss: 0.9680, test_loss: 1.0161, test_f1: 0.4981
 epoch: 29, train_loss: 0.9657, test_loss: 1.0441, test_f1: 0.4980
 epoch: 30, train_loss: 0.9680, test_loss: 1.0403, test_f1: 0.4910
 epoch: 31, train_loss: 0.9699, test_loss: 1.0052, test_f1: 0.4860
 epoch: 32, train_loss: 0.9590, test_loss: 1.0166, test_f1: 0.4990
 epoch: 33, train_loss: 0.9521, test_loss: 1.0086, test_f1: 0.5105
 epoch: 34, train_loss: 0.9527, test_loss: 1.0144, test_f1: 0.5048
 epoch: 35, train_loss: 0.9540, test_loss: 1.0148, test_f1: 0.5069
 epoch: 36, train_loss: 0.9466, test_loss: 1.0210, test_f1: 0.5042
 epoch: 37, train_loss: 0.9603, test_loss: 1.0124, test_f1: 0.5140
 epoch: 38, train_loss: 0.9422, test_loss: 1.0140, test_f1: 0.5060
 epoch: 39, train_loss: 0.9360, test_loss: 1.0163, test_f1: 0.5102
 epoch: 40, train_loss: 0.9443, test_loss: 1.0030, test_f1: 0.5126
 epoch: 41, train_loss: 0.9396, test_loss: 1.0346, test_f1: 0.5128
 epoch: 42, train_loss: 0.9376, test_loss: 0.9979, test_f1: 0.5085
 epoch: 43, train_loss: 0.9281, test_loss: 1.0023, test_f1: 0.5173
 epoch: 44, train_loss: 0.9222, test_loss: 0.9987, test_f1: 0.4916
 epoch: 45, train_loss: 0.9283, test_loss: 1.0112, test_f1: 0.5080
 epoch: 46, train_loss: 0.9229, test_loss: 1.0001, test_f1: 0.5098
 epoch: 47, train_loss: 0.9111, test_loss: 1.0136, test_f1: 0.5160
 epoch: 48, train_loss: 0.9183, test_loss: 0.9967, test_f1: 0.5232
 epoch: 49, train_loss: 0.9207, test_loss: 1.0016, test_f1: 0.5053
 epoch: 50, train_loss: 0.9178, test_loss: 0.9845, test_f1: 0.5248
 epoch: 51, train_loss: 0.9076, test_loss: 1.0160, test_f1: 0.5059
 epoch: 52, train_loss: 0.9096, test_loss: 1.0051, test_f1: 0.5112
 epoch: 53, train_loss: 0.9052, test_loss: 0.9936, test_f1: 0.5283
 epoch: 54, train_loss: 0.9030, test_loss: 1.0044, test_f1: 0.5005
 epoch: 55, train_loss: 0.8966, test_loss: 1.0197, test_f1: 0.5024
 epoch: 56, train_loss: 0.8953, test_loss: 1.0096, test_f1: 0.5191
 epoch: 57, train_loss: 0.9125, test_loss: 1.0210, test_f1: 0.5169
 epoch: 58, train_loss: 0.9008, test_loss: 0.9911, test_f1: 0.5223
 epoch: 59, train_loss: 0.8974, test_loss: 0.9807, test_f1: 0.5259
 epoch: 60, train_loss: 0.8970, test_loss: 0.9816, test_f1: 0.5266
 epoch: 61, train_loss: 0.8868, test_loss: 0.9962, test_f1: 0.5094
 epoch: 62, train_loss: 0.8891, test_loss: 0.9834, test_f1: 0.5132
 epoch: 63, train_loss: 0.8991, test_loss: 0.9926, test_f1: 0.5199
 epoch: 64, train_loss: 0.8903, test_loss: 1.0066, test_f1: 0.5119
 epoch: 65, train_loss: 0.8942, test_loss: 1.0029, test_f1: 0.5156
 epoch: 66, train_loss: 0.8859, test_loss: 0.9949, test_f1: 0.5119
 epoch: 67, train_loss: 0.8938, test_loss: 1.0022, test_f1: 0.5126
 epoch: 68, train_loss: 0.8880, test_loss: 0.9935, test_f1: 0.5178
 epoch: 69, train_loss: 0.8893, test_loss: 1.0153, test_f1: 0.5156
 epoch: 70, train_loss: 0.8869, test_loss: 0.9922, test_f1: 0.5180
 epoch: 71, train_loss: 0.8781, test_loss: 0.9942, test_f1: 0.5072
 epoch: 72, train_loss: 0.8869, test_loss: 0.9781, test_f1: 0.5201
 epoch: 73, train_loss: 0.8861, test_loss: 0.9956, test_f1: 0.5256
 epoch: 74, train_loss: 0.8837, test_loss: 0.9819, test_f1: 0.5119
 epoch: 75, train_loss: 0.8903, test_loss: 0.9660, test_f1: 0.5276
 epoch: 76, train_loss: 0.8794, test_loss: 1.0022, test_f1: 0.5059
 epoch: 77, train_loss: 0.8867, test_loss: 0.9878, test_f1: 0.5099
 epoch: 78, train_loss: 0.8747, test_loss: 0.9745, test_f1: 0.5274
 epoch: 79, train_loss: 0.8859, test_loss: 1.0093, test_f1: 0.5167
 epoch: 80, train_loss: 0.8730, test_loss: 1.0005, test_f1: 0.5022
 epoch: 81, train_loss: 0.8744, test_loss: 0.9889, test_f1: 0.5143
 epoch: 82, train_loss: 0.8690, test_loss: 0.9867, test_f1: 0.5212
 epoch: 83, train_loss: 0.8813, test_loss: 0.9675, test_f1: 0.5248
 epoch: 84, train_loss: 0.8759, test_loss: 0.9558, test_f1: 0.5252
 epoch: 85, train_loss: 0.8667, test_loss: 0.9834, test_f1: 0.5141
 epoch: 86, train_loss: 0.8671, test_loss: 0.9688, test_f1: 0.5196
 epoch: 87, train_loss: 0.8668, test_loss: 0.9951, test_f1: 0.5097
 epoch: 88, train_loss: 0.8696, test_loss: 0.9741, test_f1: 0.5237
 epoch: 89, train_loss: 0.8686, test_loss: 0.9896, test_f1: 0.5168
 epoch: 90, train_loss: 0.8686, test_loss: 1.0008, test_f1: 0.5116
 epoch: 91, train_loss: 0.8693, test_loss: 1.0003, test_f1: 0.5115
 epoch: 92, train_loss: 0.8727, test_loss: 0.9817, test_f1: 0.5339
 epoch: 93, train_loss: 0.8677, test_loss: 0.9949, test_f1: 0.5184
 epoch: 94, train_loss: 0.8570, test_loss: 0.9759, test_f1: 0.5286
 epoch: 95, train_loss: 0.8675, test_loss: 0.9922, test_f1: 0.5343
 epoch: 96, train_loss: 0.8614, test_loss: 0.9853, test_f1: 0.5304
 epoch: 97, train_loss: 0.8669, test_loss: 0.9855, test_f1: 0.5374
 epoch: 98, train_loss: 0.8613, test_loss: 0.9718, test_f1: 0.5352
 epoch: 99, train_loss: 0.8552, test_loss: 0.9732, test_f1: 0.5253
##################ITERATION #3 ****************************************
 epoch: 0, train_loss: 1.2838, test_loss: 1.2135, test_f1: 0.2976
 epoch: 1, train_loss: 1.1987, test_loss: 1.1575, test_f1: 0.3685
 epoch: 2, train_loss: 1.1579, test_loss: 1.1096, test_f1: 0.3659
 epoch: 3, train_loss: 1.1273, test_loss: 1.0883, test_f1: 0.3949
 epoch: 4, train_loss: 1.1053, test_loss: 1.0757, test_f1: 0.3994
 epoch: 5, train_loss: 1.0871, test_loss: 1.0656, test_f1: 0.4074
 epoch: 6, train_loss: 1.0659, test_loss: 1.0748, test_f1: 0.3767
 epoch: 7, train_loss: 1.0579, test_loss: 1.0535, test_f1: 0.4171
 epoch: 8, train_loss: 1.0470, test_loss: 1.0571, test_f1: 0.4118
 epoch: 9, train_loss: 1.0364, test_loss: 1.0398, test_f1: 0.4290
 epoch: 10, train_loss: 1.0256, test_loss: 1.0481, test_f1: 0.4297
 epoch: 11, train_loss: 1.0187, test_loss: 1.0286, test_f1: 0.4577
 epoch: 12, train_loss: 1.0191, test_loss: 1.0168, test_f1: 0.4625
 epoch: 13, train_loss: 1.0030, test_loss: 1.0267, test_f1: 0.4540
 epoch: 14, train_loss: 1.0007, test_loss: 0.9976, test_f1: 0.4852
 epoch: 15, train_loss: 0.9900, test_loss: 1.0280, test_f1: 0.4680
 epoch: 16, train_loss: 0.9847, test_loss: 1.0165, test_f1: 0.4829
 epoch: 17, train_loss: 0.9722, test_loss: 1.0512, test_f1: 0.4691
 epoch: 18, train_loss: 0.9716, test_loss: 1.0074, test_f1: 0.4894
 epoch: 19, train_loss: 0.9685, test_loss: 1.0072, test_f1: 0.4835
 epoch: 20, train_loss: 0.9544, test_loss: 0.9912, test_f1: 0.5099
 epoch: 21, train_loss: 0.9505, test_loss: 0.9965, test_f1: 0.4955
 epoch: 22, train_loss: 0.9354, test_loss: 0.9939, test_f1: 0.5001
 epoch: 23, train_loss: 0.9478, test_loss: 0.9981, test_f1: 0.5057
 epoch: 24, train_loss: 0.9203, test_loss: 1.0148, test_f1: 0.4892
 epoch: 25, train_loss: 0.9319, test_loss: 0.9950, test_f1: 0.5054
 epoch: 26, train_loss: 0.9270, test_loss: 1.0086, test_f1: 0.4950
 epoch: 27, train_loss: 0.9264, test_loss: 0.9962, test_f1: 0.5002
 epoch: 28, train_loss: 0.9081, test_loss: 0.9877, test_f1: 0.4995
 epoch: 29, train_loss: 0.9124, test_loss: 0.9859, test_f1: 0.5186
 epoch: 30, train_loss: 0.9097, test_loss: 1.0129, test_f1: 0.5071
 epoch: 31, train_loss: 0.9034, test_loss: 1.0138, test_f1: 0.5147
 epoch: 32, train_loss: 0.9012, test_loss: 1.0036, test_f1: 0.5179
 epoch: 33, train_loss: 0.8924, test_loss: 0.9714, test_f1: 0.5151
 epoch: 34, train_loss: 0.8974, test_loss: 1.0035, test_f1: 0.5045
 epoch: 35, train_loss: 0.8877, test_loss: 1.0127, test_f1: 0.4884
 epoch: 36, train_loss: 0.8898, test_loss: 0.9813, test_f1: 0.5134
 epoch: 37, train_loss: 0.8858, test_loss: 0.9880, test_f1: 0.5032
 epoch: 38, train_loss: 0.8843, test_loss: 0.9629, test_f1: 0.5147
 epoch: 39, train_loss: 0.8734, test_loss: 0.9968, test_f1: 0.5034
 epoch: 40, train_loss: 0.8760, test_loss: 0.9890, test_f1: 0.5284
 epoch: 41, train_loss: 0.8605, test_loss: 0.9895, test_f1: 0.5267
 epoch: 42, train_loss: 0.8615, test_loss: 0.9785, test_f1: 0.5167
 epoch: 43, train_loss: 0.8709, test_loss: 0.9864, test_f1: 0.5182
 epoch: 44, train_loss: 0.8573, test_loss: 0.9927, test_f1: 0.5321
 epoch: 45, train_loss: 0.8569, test_loss: 0.9711, test_f1: 0.5419
 epoch: 46, train_loss: 0.8447, test_loss: 0.9729, test_f1: 0.5243
 epoch: 47, train_loss: 0.8554, test_loss: 0.9982, test_f1: 0.5250
 epoch: 48, train_loss: 0.8335, test_loss: 0.9794, test_f1: 0.5290
 epoch: 49, train_loss: 0.8478, test_loss: 0.9802, test_f1: 0.5303
 epoch: 50, train_loss: 0.8388, test_loss: 0.9797, test_f1: 0.5392
 epoch: 51, train_loss: 0.8305, test_loss: 0.9753, test_f1: 0.5384
 epoch: 52, train_loss: 0.8358, test_loss: 0.9774, test_f1: 0.5560
 epoch: 53, train_loss: 0.8298, test_loss: 0.9690, test_f1: 0.5561
 epoch: 54, train_loss: 0.8256, test_loss: 0.9621, test_f1: 0.5530
 epoch: 55, train_loss: 0.8345, test_loss: 0.9748, test_f1: 0.5457
 epoch: 56, train_loss: 0.8322, test_loss: 0.9724, test_f1: 0.5604
 epoch: 57, train_loss: 0.8266, test_loss: 0.9618, test_f1: 0.5529
 epoch: 58, train_loss: 0.8308, test_loss: 0.9569, test_f1: 0.5558
 epoch: 59, train_loss: 0.8222, test_loss: 0.9666, test_f1: 0.5531
 epoch: 60, train_loss: 0.8251, test_loss: 0.9608, test_f1: 0.5577
 epoch: 61, train_loss: 0.8291, test_loss: 0.9643, test_f1: 0.5602
 epoch: 62, train_loss: 0.8193, test_loss: 0.9531, test_f1: 0.5579
 epoch: 63, train_loss: 0.8209, test_loss: 0.9609, test_f1: 0.5414
 epoch: 64, train_loss: 0.8145, test_loss: 0.9543, test_f1: 0.5483
 epoch: 65, train_loss: 0.8175, test_loss: 0.9645, test_f1: 0.5437
 epoch: 66, train_loss: 0.8130, test_loss: 0.9538, test_f1: 0.5416
 epoch: 67, train_loss: 0.8148, test_loss: 0.9666, test_f1: 0.5581
 epoch: 68, train_loss: 0.8116, test_loss: 0.9882, test_f1: 0.5472
 epoch: 69, train_loss: 0.8095, test_loss: 0.9632, test_f1: 0.5545
 epoch: 70, train_loss: 0.8130, test_loss: 0.9741, test_f1: 0.5577
 epoch: 71, train_loss: 0.8029, test_loss: 0.9816, test_f1: 0.5447
 epoch: 72, train_loss: 0.8134, test_loss: 0.9670, test_f1: 0.5498
 epoch: 73, train_loss: 0.8147, test_loss: 0.9602, test_f1: 0.5469
 epoch: 74, train_loss: 0.8031, test_loss: 0.9540, test_f1: 0.5513
 epoch: 75, train_loss: 0.8078, test_loss: 0.9917, test_f1: 0.5496
 epoch: 76, train_loss: 0.8015, test_loss: 0.9687, test_f1: 0.5541
 epoch: 77, train_loss: 0.8046, test_loss: 0.9776, test_f1: 0.5478
 epoch: 78, train_loss: 0.8112, test_loss: 0.9555, test_f1: 0.5691
 epoch: 79, train_loss: 0.7887, test_loss: 0.9890, test_f1: 0.5507
 epoch: 80, train_loss: 0.8045, test_loss: 0.9634, test_f1: 0.5514
 epoch: 81, train_loss: 0.7996, test_loss: 0.9851, test_f1: 0.5610
 epoch: 82, train_loss: 0.8036, test_loss: 0.9794, test_f1: 0.5624
 epoch: 83, train_loss: 0.7860, test_loss: 0.9845, test_f1: 0.5678
 epoch: 84, train_loss: 0.7976, test_loss: 0.9629, test_f1: 0.5733
 epoch: 85, train_loss: 0.7953, test_loss: 0.9632, test_f1: 0.5703
 epoch: 86, train_loss: 0.7880, test_loss: 0.9633, test_f1: 0.5567
 epoch: 87, train_loss: 0.7777, test_loss: 0.9461, test_f1: 0.5679
 epoch: 88, train_loss: 0.7857, test_loss: 0.9595, test_f1: 0.5666
 epoch: 89, train_loss: 0.7857, test_loss: 0.9632, test_f1: 0.5660
 epoch: 90, train_loss: 0.7864, test_loss: 0.9568, test_f1: 0.5656
 epoch: 91, train_loss: 0.7817, test_loss: 0.9497, test_f1: 0.5585
 epoch: 92, train_loss: 0.7870, test_loss: 0.9523, test_f1: 0.5702
 epoch: 93, train_loss: 0.7937, test_loss: 0.9380, test_f1: 0.5726
 epoch: 94, train_loss: 0.7880, test_loss: 0.9623, test_f1: 0.5585
 epoch: 95, train_loss: 0.7850, test_loss: 0.9612, test_f1: 0.5605
 epoch: 96, train_loss: 0.7852, test_loss: 0.9599, test_f1: 0.5617
 epoch: 97, train_loss: 0.7894, test_loss: 0.9575, test_f1: 0.5452
 epoch: 98, train_loss: 0.7879, test_loss: 0.9661, test_f1: 0.5635
 epoch: 99, train_loss: 0.7852, test_loss: 0.9552, test_f1: 0.5634
##################ITERATION #4 ****************************************
 epoch: 0, train_loss: 1.2888, test_loss: 1.2362, test_f1: 0.2260
 epoch: 1, train_loss: 1.2258, test_loss: 1.1931, test_f1: 0.2562
 epoch: 2, train_loss: 1.1986, test_loss: 1.1573, test_f1: 0.3132
 epoch: 3, train_loss: 1.1625, test_loss: 1.1155, test_f1: 0.3316
 epoch: 4, train_loss: 1.1327, test_loss: 1.0869, test_f1: 0.3817
 epoch: 5, train_loss: 1.1091, test_loss: 1.0636, test_f1: 0.3951
 epoch: 6, train_loss: 1.0836, test_loss: 1.0565, test_f1: 0.4205
 epoch: 7, train_loss: 1.0713, test_loss: 1.0482, test_f1: 0.4250
 epoch: 8, train_loss: 1.0592, test_loss: 1.0453, test_f1: 0.4159
 epoch: 9, train_loss: 1.0520, test_loss: 1.0455, test_f1: 0.4122
 epoch: 10, train_loss: 1.0397, test_loss: 1.0454, test_f1: 0.4204
 epoch: 11, train_loss: 1.0287, test_loss: 1.0334, test_f1: 0.4775
 epoch: 12, train_loss: 1.0315, test_loss: 1.0283, test_f1: 0.4664
 epoch: 13, train_loss: 1.0185, test_loss: 1.0226, test_f1: 0.4664
 epoch: 14, train_loss: 1.0135, test_loss: 1.0122, test_f1: 0.4674
 epoch: 15, train_loss: 1.0075, test_loss: 1.0117, test_f1: 0.4554
 epoch: 16, train_loss: 1.0033, test_loss: 1.0134, test_f1: 0.4627
 epoch: 17, train_loss: 0.9957, test_loss: 1.0001, test_f1: 0.5015
 epoch: 18, train_loss: 0.9934, test_loss: 1.0056, test_f1: 0.4826
 epoch: 19, train_loss: 0.9921, test_loss: 1.0017, test_f1: 0.4915
 epoch: 20, train_loss: 0.9780, test_loss: 0.9828, test_f1: 0.5197
 epoch: 21, train_loss: 0.9748, test_loss: 1.0063, test_f1: 0.4899
 epoch: 22, train_loss: 0.9684, test_loss: 0.9799, test_f1: 0.5219
 epoch: 23, train_loss: 0.9701, test_loss: 0.9837, test_f1: 0.5130
 epoch: 24, train_loss: 0.9643, test_loss: 0.9942, test_f1: 0.4935
 epoch: 25, train_loss: 0.9538, test_loss: 0.9933, test_f1: 0.5014
 epoch: 26, train_loss: 0.9503, test_loss: 0.9923, test_f1: 0.5071
 epoch: 27, train_loss: 0.9439, test_loss: 0.9948, test_f1: 0.5125
 epoch: 28, train_loss: 0.9463, test_loss: 0.9697, test_f1: 0.5347
 epoch: 29, train_loss: 0.9431, test_loss: 0.9897, test_f1: 0.5088
 epoch: 30, train_loss: 0.9408, test_loss: 0.9693, test_f1: 0.5010
 epoch: 31, train_loss: 0.9225, test_loss: 0.9925, test_f1: 0.5024
 epoch: 32, train_loss: 0.9285, test_loss: 0.9848, test_f1: 0.5196
 epoch: 33, train_loss: 0.9322, test_loss: 0.9725, test_f1: 0.5251
 epoch: 34, train_loss: 0.9217, test_loss: 0.9766, test_f1: 0.5241
 epoch: 35, train_loss: 0.9220, test_loss: 0.9781, test_f1: 0.4947
 epoch: 36, train_loss: 0.9143, test_loss: 0.9900, test_f1: 0.5065
 epoch: 37, train_loss: 0.9194, test_loss: 0.9753, test_f1: 0.4922
 epoch: 38, train_loss: 0.9199, test_loss: 0.9624, test_f1: 0.5086
 epoch: 39, train_loss: 0.9128, test_loss: 0.9417, test_f1: 0.5310
 epoch: 40, train_loss: 0.8957, test_loss: 0.9439, test_f1: 0.5356
 epoch: 41, train_loss: 0.8943, test_loss: 0.9500, test_f1: 0.5314
 epoch: 42, train_loss: 0.9007, test_loss: 0.9495, test_f1: 0.5344
 epoch: 43, train_loss: 0.8980, test_loss: 0.9401, test_f1: 0.5365
 epoch: 44, train_loss: 0.8984, test_loss: 0.9369, test_f1: 0.5186
 epoch: 45, train_loss: 0.8787, test_loss: 0.9347, test_f1: 0.5172
 epoch: 46, train_loss: 0.8891, test_loss: 0.9568, test_f1: 0.5158
 epoch: 47, train_loss: 0.8761, test_loss: 0.9250, test_f1: 0.5396
 epoch: 48, train_loss: 0.8875, test_loss: 0.9433, test_f1: 0.5054
 epoch: 49, train_loss: 0.8836, test_loss: 0.9320, test_f1: 0.5396
 epoch: 50, train_loss: 0.8785, test_loss: 0.9228, test_f1: 0.5355
 epoch: 51, train_loss: 0.8768, test_loss: 0.9528, test_f1: 0.5319
 epoch: 52, train_loss: 0.8698, test_loss: 0.9322, test_f1: 0.5308
 epoch: 53, train_loss: 0.8628, test_loss: 0.9281, test_f1: 0.5393
 epoch: 54, train_loss: 0.8660, test_loss: 0.9198, test_f1: 0.5370
 epoch: 55, train_loss: 0.8539, test_loss: 0.9231, test_f1: 0.5460
 epoch: 56, train_loss: 0.8623, test_loss: 0.8994, test_f1: 0.5381
 epoch: 57, train_loss: 0.8571, test_loss: 0.9109, test_f1: 0.5471
 epoch: 58, train_loss: 0.8584, test_loss: 0.9163, test_f1: 0.5377
 epoch: 59, train_loss: 0.8616, test_loss: 0.9025, test_f1: 0.5373
 epoch: 60, train_loss: 0.8650, test_loss: 0.9332, test_f1: 0.5361
 epoch: 61, train_loss: 0.8564, test_loss: 0.9049, test_f1: 0.5504
 epoch: 62, train_loss: 0.8635, test_loss: 0.9198, test_f1: 0.5379
 epoch: 63, train_loss: 0.8557, test_loss: 0.9205, test_f1: 0.5306
 epoch: 64, train_loss: 0.8488, test_loss: 0.9249, test_f1: 0.5424
 epoch: 65, train_loss: 0.8508, test_loss: 0.9435, test_f1: 0.5406
 epoch: 66, train_loss: 0.8467, test_loss: 0.9097, test_f1: 0.5447
 epoch: 67, train_loss: 0.8467, test_loss: 0.9144, test_f1: 0.5442
 epoch: 68, train_loss: 0.8486, test_loss: 0.9052, test_f1: 0.5378
 epoch: 69, train_loss: 0.8435, test_loss: 0.9049, test_f1: 0.5320
 epoch: 70, train_loss: 0.8474, test_loss: 0.9209, test_f1: 0.5200
 epoch: 71, train_loss: 0.8384, test_loss: 0.9009, test_f1: 0.5430
 epoch: 72, train_loss: 0.8407, test_loss: 0.9117, test_f1: 0.5378
 epoch: 73, train_loss: 0.8596, test_loss: 0.9151, test_f1: 0.5421
 epoch: 74, train_loss: 0.8328, test_loss: 0.9184, test_f1: 0.5418
 epoch: 75, train_loss: 0.8466, test_loss: 0.8991, test_f1: 0.5328
 epoch: 76, train_loss: 0.8325, test_loss: 0.9092, test_f1: 0.5273
 epoch: 77, train_loss: 0.8392, test_loss: 0.9126, test_f1: 0.5455
 epoch: 78, train_loss: 0.8421, test_loss: 0.9155, test_f1: 0.5238
 epoch: 79, train_loss: 0.8369, test_loss: 0.8854, test_f1: 0.5486
 epoch: 80, train_loss: 0.8245, test_loss: 0.9334, test_f1: 0.5398
 epoch: 81, train_loss: 0.8380, test_loss: 0.8952, test_f1: 0.5453
 epoch: 82, train_loss: 0.8348, test_loss: 0.9091, test_f1: 0.5383
 epoch: 83, train_loss: 0.8333, test_loss: 0.8788, test_f1: 0.5467
 epoch: 84, train_loss: 0.8327, test_loss: 0.8989, test_f1: 0.5484
 epoch: 85, train_loss: 0.8307, test_loss: 0.8898, test_f1: 0.5430
 epoch: 86, train_loss: 0.8251, test_loss: 0.8866, test_f1: 0.5454
 epoch: 87, train_loss: 0.8269, test_loss: 0.9332, test_f1: 0.5321
 epoch: 88, train_loss: 0.8337, test_loss: 0.8883, test_f1: 0.5299
 epoch: 89, train_loss: 0.8307, test_loss: 0.9477, test_f1: 0.5457
 epoch: 90, train_loss: 0.8263, test_loss: 0.8948, test_f1: 0.5406
 epoch: 91, train_loss: 0.8305, test_loss: 0.8836, test_f1: 0.5471
 epoch: 92, train_loss: 0.8283, test_loss: 0.9014, test_f1: 0.5370
 epoch: 93, train_loss: 0.8135, test_loss: 0.8997, test_f1: 0.5491
 epoch: 94, train_loss: 0.8264, test_loss: 0.9058, test_f1: 0.5431
 epoch: 95, train_loss: 0.8225, test_loss: 0.8759, test_f1: 0.5496
 epoch: 96, train_loss: 0.8204, test_loss: 0.8878, test_f1: 0.5477
 epoch: 97, train_loss: 0.8207, test_loss: 0.8791, test_f1: 0.5433
 epoch: 98, train_loss: 0.8237, test_loss: 0.8705, test_f1: 0.5347
 epoch: 99, train_loss: 0.8023, test_loss: 0.9115, test_f1: 0.5391
##################ITERATION #5 ****************************************
 epoch: 0, train_loss: 1.2743, test_loss: 1.2094, test_f1: 0.2408
 epoch: 1, train_loss: 1.2070, test_loss: 1.1643, test_f1: 0.3232
 epoch: 2, train_loss: 1.1787, test_loss: 1.1290, test_f1: 0.3563
 epoch: 3, train_loss: 1.1424, test_loss: 1.1019, test_f1: 0.3900
 epoch: 4, train_loss: 1.1279, test_loss: 1.0884, test_f1: 0.4016
 epoch: 5, train_loss: 1.1100, test_loss: 1.0731, test_f1: 0.4184
 epoch: 6, train_loss: 1.0933, test_loss: 1.0645, test_f1: 0.3910
 epoch: 7, train_loss: 1.0726, test_loss: 1.0571, test_f1: 0.3872
 epoch: 8, train_loss: 1.0656, test_loss: 1.0394, test_f1: 0.4192
 epoch: 9, train_loss: 1.0572, test_loss: 1.0430, test_f1: 0.4039
 epoch: 10, train_loss: 1.0435, test_loss: 1.0346, test_f1: 0.4190
 epoch: 11, train_loss: 1.0378, test_loss: 1.0290, test_f1: 0.4158
 epoch: 12, train_loss: 1.0315, test_loss: 1.0334, test_f1: 0.4527
 epoch: 13, train_loss: 1.0247, test_loss: 1.0197, test_f1: 0.4294
 epoch: 14, train_loss: 1.0199, test_loss: 1.0178, test_f1: 0.4463
 epoch: 15, train_loss: 1.0115, test_loss: 1.0170, test_f1: 0.4735
 epoch: 16, train_loss: 1.0064, test_loss: 1.0138, test_f1: 0.4682
 epoch: 17, train_loss: 0.9973, test_loss: 1.0003, test_f1: 0.4720
 epoch: 18, train_loss: 0.9869, test_loss: 1.0081, test_f1: 0.4507
 epoch: 19, train_loss: 0.9834, test_loss: 0.9937, test_f1: 0.4610
 epoch: 20, train_loss: 0.9837, test_loss: 0.9932, test_f1: 0.4824
 epoch: 21, train_loss: 0.9775, test_loss: 0.9898, test_f1: 0.4896
 epoch: 22, train_loss: 0.9742, test_loss: 0.9905, test_f1: 0.4611
 epoch: 23, train_loss: 0.9685, test_loss: 0.9836, test_f1: 0.4899
 epoch: 24, train_loss: 0.9649, test_loss: 0.9837, test_f1: 0.4876
 epoch: 25, train_loss: 0.9619, test_loss: 0.9793, test_f1: 0.4960
 epoch: 26, train_loss: 0.9461, test_loss: 0.9793, test_f1: 0.4880
 epoch: 27, train_loss: 0.9555, test_loss: 0.9837, test_f1: 0.5108
 epoch: 28, train_loss: 0.9448, test_loss: 0.9805, test_f1: 0.4957
 epoch: 29, train_loss: 0.9466, test_loss: 0.9852, test_f1: 0.5103
 epoch: 30, train_loss: 0.9361, test_loss: 0.9962, test_f1: 0.4996
 epoch: 31, train_loss: 0.9423, test_loss: 0.9844, test_f1: 0.4852
 epoch: 32, train_loss: 0.9387, test_loss: 0.9855, test_f1: 0.5147
 epoch: 33, train_loss: 0.9297, test_loss: 0.9881, test_f1: 0.5063
 epoch: 34, train_loss: 0.9293, test_loss: 0.9661, test_f1: 0.5057
 epoch: 35, train_loss: 0.9208, test_loss: 0.9774, test_f1: 0.4895
 epoch: 36, train_loss: 0.9141, test_loss: 0.9671, test_f1: 0.5043
 epoch: 37, train_loss: 0.9193, test_loss: 0.9750, test_f1: 0.5149
 epoch: 38, train_loss: 0.9252, test_loss: 0.9710, test_f1: 0.5213
 epoch: 39, train_loss: 0.9275, test_loss: 0.9706, test_f1: 0.5252
 epoch: 40, train_loss: 0.9112, test_loss: 0.9783, test_f1: 0.5074
 epoch: 41, train_loss: 0.9188, test_loss: 0.9692, test_f1: 0.5111
 epoch: 42, train_loss: 0.9069, test_loss: 0.9649, test_f1: 0.5279
 epoch: 43, train_loss: 0.9056, test_loss: 0.9630, test_f1: 0.5288
 epoch: 44, train_loss: 0.8994, test_loss: 0.9620, test_f1: 0.5204
 epoch: 45, train_loss: 0.9112, test_loss: 0.9725, test_f1: 0.5280
 epoch: 46, train_loss: 0.8960, test_loss: 0.9642, test_f1: 0.5366
 epoch: 47, train_loss: 0.9054, test_loss: 0.9643, test_f1: 0.5252
 epoch: 48, train_loss: 0.8962, test_loss: 0.9603, test_f1: 0.5324
 epoch: 49, train_loss: 0.8998, test_loss: 0.9645, test_f1: 0.5275
 epoch: 50, train_loss: 0.8993, test_loss: 0.9724, test_f1: 0.5342
 epoch: 51, train_loss: 0.8825, test_loss: 0.9435, test_f1: 0.5362
 epoch: 52, train_loss: 0.8972, test_loss: 0.9555, test_f1: 0.5386
 epoch: 53, train_loss: 0.8881, test_loss: 0.9551, test_f1: 0.5300
 epoch: 54, train_loss: 0.8798, test_loss: 0.9660, test_f1: 0.5239
 epoch: 55, train_loss: 0.8943, test_loss: 0.9639, test_f1: 0.5392
 epoch: 56, train_loss: 0.8905, test_loss: 0.9677, test_f1: 0.5312
 epoch: 57, train_loss: 0.8853, test_loss: 0.9723, test_f1: 0.5341
 epoch: 58, train_loss: 0.8827, test_loss: 0.9503, test_f1: 0.5354
 epoch: 59, train_loss: 0.8824, test_loss: 0.9631, test_f1: 0.5387
 epoch: 60, train_loss: 0.8806, test_loss: 0.9533, test_f1: 0.5392
 epoch: 61, train_loss: 0.8736, test_loss: 0.9537, test_f1: 0.5315
 epoch: 62, train_loss: 0.8707, test_loss: 0.9487, test_f1: 0.5373
 epoch: 63, train_loss: 0.8793, test_loss: 0.9533, test_f1: 0.5398
 epoch: 64, train_loss: 0.8807, test_loss: 0.9575, test_f1: 0.5279
 epoch: 65, train_loss: 0.8817, test_loss: 0.9505, test_f1: 0.5348
 epoch: 66, train_loss: 0.8761, test_loss: 0.9517, test_f1: 0.5320
 epoch: 67, train_loss: 0.8739, test_loss: 0.9552, test_f1: 0.5331
 epoch: 68, train_loss: 0.8696, test_loss: 0.9604, test_f1: 0.5339
 epoch: 69, train_loss: 0.8600, test_loss: 0.9574, test_f1: 0.5358
 epoch: 70, train_loss: 0.8764, test_loss: 0.9691, test_f1: 0.5310
 epoch: 71, train_loss: 0.8694, test_loss: 0.9769, test_f1: 0.5265
 epoch: 72, train_loss: 0.8664, test_loss: 0.9638, test_f1: 0.5329
 epoch: 73, train_loss: 0.8600, test_loss: 0.9612, test_f1: 0.5332
 epoch: 74, train_loss: 0.8610, test_loss: 0.9716, test_f1: 0.5324
 epoch: 75, train_loss: 0.8652, test_loss: 0.9502, test_f1: 0.5343
 epoch: 76, train_loss: 0.8551, test_loss: 0.9525, test_f1: 0.5432
 epoch: 77, train_loss: 0.8684, test_loss: 0.9388, test_f1: 0.5352
 epoch: 78, train_loss: 0.8648, test_loss: 0.9490, test_f1: 0.5451
 epoch: 79, train_loss: 0.8532, test_loss: 0.9684, test_f1: 0.5376
 epoch: 80, train_loss: 0.8695, test_loss: 0.9664, test_f1: 0.5346
 epoch: 81, train_loss: 0.8579, test_loss: 0.9705, test_f1: 0.5385
 epoch: 82, train_loss: 0.8562, test_loss: 0.9684, test_f1: 0.5384
 epoch: 83, train_loss: 0.8600, test_loss: 0.9545, test_f1: 0.5325
 epoch: 84, train_loss: 0.8516, test_loss: 0.9606, test_f1: 0.5344
 epoch: 85, train_loss: 0.8524, test_loss: 0.9624, test_f1: 0.5265
 epoch: 86, train_loss: 0.8554, test_loss: 0.9386, test_f1: 0.5362
 epoch: 87, train_loss: 0.8562, test_loss: 0.9378, test_f1: 0.5430
 epoch: 88, train_loss: 0.8474, test_loss: 0.9502, test_f1: 0.5443
 epoch: 89, train_loss: 0.8500, test_loss: 0.9605, test_f1: 0.5390
 epoch: 90, train_loss: 0.8521, test_loss: 0.9518, test_f1: 0.5296
 epoch: 91, train_loss: 0.8479, test_loss: 0.9380, test_f1: 0.5437
 epoch: 92, train_loss: 0.8517, test_loss: 0.9506, test_f1: 0.5335
 epoch: 93, train_loss: 0.8503, test_loss: 0.9421, test_f1: 0.5450
 epoch: 94, train_loss: 0.8475, test_loss: 0.9512, test_f1: 0.5361
 epoch: 95, train_loss: 0.8446, test_loss: 0.9460, test_f1: 0.5381
 epoch: 96, train_loss: 0.8448, test_loss: 0.9444, test_f1: 0.5418
 epoch: 97, train_loss: 0.8487, test_loss: 0.9451, test_f1: 0.5503
 epoch: 98, train_loss: 0.8424, test_loss: 0.9475, test_f1: 0.5384
 epoch: 99, train_loss: 0.8446, test_loss: 0.9415, test_f1: 0.5414
##################ITERATION #6 ****************************************
 epoch: 0, train_loss: 1.2853, test_loss: 1.1814, test_f1: 0.2945
 epoch: 1, train_loss: 1.1888, test_loss: 1.1249, test_f1: 0.4036
 epoch: 2, train_loss: 1.1562, test_loss: 1.0985, test_f1: 0.4212
 epoch: 3, train_loss: 1.1192, test_loss: 1.0715, test_f1: 0.4308
 epoch: 4, train_loss: 1.1000, test_loss: 1.0538, test_f1: 0.4363
 epoch: 5, train_loss: 1.0829, test_loss: 1.0503, test_f1: 0.4448
 epoch: 6, train_loss: 1.0777, test_loss: 1.0478, test_f1: 0.4479
 epoch: 7, train_loss: 1.0628, test_loss: 1.0338, test_f1: 0.4471
 epoch: 8, train_loss: 1.0524, test_loss: 1.0374, test_f1: 0.4542
 epoch: 9, train_loss: 1.0348, test_loss: 1.0328, test_f1: 0.4556
 epoch: 10, train_loss: 1.0376, test_loss: 1.0351, test_f1: 0.4515
 epoch: 11, train_loss: 1.0277, test_loss: 1.0398, test_f1: 0.4667
 epoch: 12, train_loss: 1.0166, test_loss: 1.0332, test_f1: 0.4437
 epoch: 13, train_loss: 1.0132, test_loss: 1.0372, test_f1: 0.4503
 epoch: 14, train_loss: 1.0110, test_loss: 1.0350, test_f1: 0.4478
 epoch: 15, train_loss: 0.9913, test_loss: 1.0199, test_f1: 0.4560
 epoch: 16, train_loss: 0.9980, test_loss: 1.0160, test_f1: 0.4522
 epoch: 17, train_loss: 0.9864, test_loss: 1.0087, test_f1: 0.4598
 epoch: 18, train_loss: 0.9897, test_loss: 1.0166, test_f1: 0.4469
 epoch: 19, train_loss: 0.9932, test_loss: 1.0201, test_f1: 0.4424
 epoch: 20, train_loss: 0.9700, test_loss: 1.0034, test_f1: 0.4723
 epoch: 21, train_loss: 0.9661, test_loss: 1.0204, test_f1: 0.4599
 epoch: 22, train_loss: 0.9701, test_loss: 1.0118, test_f1: 0.4628
 epoch: 23, train_loss: 0.9624, test_loss: 1.0276, test_f1: 0.4668
 epoch: 24, train_loss: 0.9598, test_loss: 1.0088, test_f1: 0.4797
 epoch: 25, train_loss: 0.9544, test_loss: 1.0030, test_f1: 0.4551
 epoch: 26, train_loss: 0.9486, test_loss: 0.9978, test_f1: 0.4618
 epoch: 27, train_loss: 0.9469, test_loss: 1.0023, test_f1: 0.4824
 epoch: 28, train_loss: 0.9333, test_loss: 1.0121, test_f1: 0.4476
 epoch: 29, train_loss: 0.9369, test_loss: 1.0165, test_f1: 0.4865
 epoch: 30, train_loss: 0.9326, test_loss: 1.0197, test_f1: 0.4840
 epoch: 31, train_loss: 0.9253, test_loss: 1.0219, test_f1: 0.4659
 epoch: 32, train_loss: 0.9277, test_loss: 0.9973, test_f1: 0.4549
 epoch: 33, train_loss: 0.9167, test_loss: 1.0108, test_f1: 0.4882
 epoch: 34, train_loss: 0.9167, test_loss: 1.0332, test_f1: 0.4535
 epoch: 35, train_loss: 0.9161, test_loss: 1.0004, test_f1: 0.4759
 epoch: 36, train_loss: 0.9067, test_loss: 1.0021, test_f1: 0.4878
 epoch: 37, train_loss: 0.8957, test_loss: 1.0016, test_f1: 0.4975
 epoch: 38, train_loss: 0.8994, test_loss: 1.0332, test_f1: 0.4691
 epoch: 39, train_loss: 0.9145, test_loss: 1.0007, test_f1: 0.5024
 epoch: 40, train_loss: 0.9029, test_loss: 1.0293, test_f1: 0.4870
 epoch: 41, train_loss: 0.8931, test_loss: 1.0169, test_f1: 0.4865
 epoch: 42, train_loss: 0.8969, test_loss: 1.0272, test_f1: 0.4849
 epoch: 43, train_loss: 0.8904, test_loss: 1.0382, test_f1: 0.4745
 epoch: 44, train_loss: 0.8895, test_loss: 1.0056, test_f1: 0.4837
 epoch: 45, train_loss: 0.8839, test_loss: 0.9861, test_f1: 0.5168
 epoch: 46, train_loss: 0.8778, test_loss: 1.0176, test_f1: 0.4863
 epoch: 47, train_loss: 0.8873, test_loss: 1.0119, test_f1: 0.4920
 epoch: 48, train_loss: 0.8750, test_loss: 1.0215, test_f1: 0.5048
 epoch: 49, train_loss: 0.8765, test_loss: 1.0136, test_f1: 0.4940
 epoch: 50, train_loss: 0.8793, test_loss: 1.0050, test_f1: 0.4854
 epoch: 51, train_loss: 0.8686, test_loss: 1.0098, test_f1: 0.4989
 epoch: 52, train_loss: 0.8612, test_loss: 0.9879, test_f1: 0.5119
 epoch: 53, train_loss: 0.8726, test_loss: 1.0249, test_f1: 0.4896
 epoch: 54, train_loss: 0.8692, test_loss: 1.0326, test_f1: 0.4876
 epoch: 55, train_loss: 0.8646, test_loss: 1.0350, test_f1: 0.4921
 epoch: 56, train_loss: 0.8636, test_loss: 0.9935, test_f1: 0.5095
 epoch: 57, train_loss: 0.8642, test_loss: 1.0118, test_f1: 0.5056
 epoch: 58, train_loss: 0.8589, test_loss: 1.0257, test_f1: 0.5185
 epoch: 59, train_loss: 0.8626, test_loss: 1.0207, test_f1: 0.4967
 epoch: 60, train_loss: 0.8529, test_loss: 1.0115, test_f1: 0.5238
 epoch: 61, train_loss: 0.8591, test_loss: 1.0109, test_f1: 0.5116
 epoch: 62, train_loss: 0.8598, test_loss: 1.0144, test_f1: 0.5116
 epoch: 63, train_loss: 0.8520, test_loss: 1.0101, test_f1: 0.4968
 epoch: 64, train_loss: 0.8458, test_loss: 1.0180, test_f1: 0.5132
 epoch: 65, train_loss: 0.8530, test_loss: 1.0399, test_f1: 0.5165
 epoch: 66, train_loss: 0.8530, test_loss: 1.0109, test_f1: 0.5131
 epoch: 67, train_loss: 0.8546, test_loss: 1.0490, test_f1: 0.5137
 epoch: 68, train_loss: 0.8427, test_loss: 0.9989, test_f1: 0.5202
 epoch: 69, train_loss: 0.8393, test_loss: 1.0256, test_f1: 0.5122
 epoch: 70, train_loss: 0.8559, test_loss: 1.0396, test_f1: 0.5238
 epoch: 71, train_loss: 0.8593, test_loss: 1.0096, test_f1: 0.5142
 epoch: 72, train_loss: 0.8525, test_loss: 1.0588, test_f1: 0.5111
 epoch: 73, train_loss: 0.8477, test_loss: 1.0113, test_f1: 0.5033
 epoch: 74, train_loss: 0.8394, test_loss: 1.0162, test_f1: 0.5298
 epoch: 75, train_loss: 0.8478, test_loss: 0.9927, test_f1: 0.5415
 epoch: 76, train_loss: 0.8441, test_loss: 1.0112, test_f1: 0.5294
 epoch: 77, train_loss: 0.8359, test_loss: 1.0238, test_f1: 0.5221
 epoch: 78, train_loss: 0.8479, test_loss: 1.0304, test_f1: 0.5248
 epoch: 79, train_loss: 0.8483, test_loss: 1.0267, test_f1: 0.5470
 epoch: 80, train_loss: 0.8332, test_loss: 0.9949, test_f1: 0.5383
 epoch: 81, train_loss: 0.8433, test_loss: 1.0423, test_f1: 0.5230
 epoch: 82, train_loss: 0.8380, test_loss: 1.0132, test_f1: 0.5383
 epoch: 83, train_loss: 0.8300, test_loss: 0.9991, test_f1: 0.5318
 epoch: 84, train_loss: 0.8322, test_loss: 1.0022, test_f1: 0.5329
 epoch: 85, train_loss: 0.8374, test_loss: 1.0150, test_f1: 0.5355
 epoch: 86, train_loss: 0.8347, test_loss: 1.0443, test_f1: 0.4937
 epoch: 87, train_loss: 0.8325, test_loss: 1.0271, test_f1: 0.5187
 epoch: 88, train_loss: 0.8344, test_loss: 1.0545, test_f1: 0.5279
 epoch: 89, train_loss: 0.8231, test_loss: 1.0238, test_f1: 0.5262
 epoch: 90, train_loss: 0.8256, test_loss: 1.0057, test_f1: 0.5362
 epoch: 91, train_loss: 0.8348, test_loss: 1.0011, test_f1: 0.5375
 epoch: 92, train_loss: 0.8313, test_loss: 0.9908, test_f1: 0.5162
 epoch: 93, train_loss: 0.8413, test_loss: 1.0207, test_f1: 0.5180
 epoch: 94, train_loss: 0.8235, test_loss: 1.0312, test_f1: 0.5361
 epoch: 95, train_loss: 0.8339, test_loss: 1.0236, test_f1: 0.5243
 epoch: 96, train_loss: 0.8306, test_loss: 1.0190, test_f1: 0.5365
 epoch: 97, train_loss: 0.8249, test_loss: 0.9952, test_f1: 0.5177
 epoch: 98, train_loss: 0.8134, test_loss: 1.0250, test_f1: 0.5194
 epoch: 99, train_loss: 0.8294, test_loss: 0.9859, test_f1: 0.5210
##################ITERATION #7 ****************************************
 epoch: 0, train_loss: 1.2813, test_loss: 1.2082, test_f1: 0.2667
 epoch: 1, train_loss: 1.2247, test_loss: 1.1787, test_f1: 0.3223
 epoch: 2, train_loss: 1.1930, test_loss: 1.1420, test_f1: 0.3714
 epoch: 3, train_loss: 1.1532, test_loss: 1.0920, test_f1: 0.3872
 epoch: 4, train_loss: 1.1271, test_loss: 1.0699, test_f1: 0.3767
 epoch: 5, train_loss: 1.1082, test_loss: 1.0393, test_f1: 0.4234
 epoch: 6, train_loss: 1.0866, test_loss: 1.0107, test_f1: 0.4457
 epoch: 7, train_loss: 1.0705, test_loss: 1.0148, test_f1: 0.4082
 epoch: 8, train_loss: 1.0535, test_loss: 1.0027, test_f1: 0.4197
 epoch: 9, train_loss: 1.0320, test_loss: 0.9917, test_f1: 0.4591
 epoch: 10, train_loss: 1.0243, test_loss: 1.0006, test_f1: 0.4309
 epoch: 11, train_loss: 1.0194, test_loss: 0.9764, test_f1: 0.4568
 epoch: 12, train_loss: 1.0006, test_loss: 0.9786, test_f1: 0.4789
 epoch: 13, train_loss: 0.9962, test_loss: 0.9740, test_f1: 0.4855
 epoch: 14, train_loss: 0.9824, test_loss: 0.9887, test_f1: 0.4735
 epoch: 15, train_loss: 0.9724, test_loss: 0.9660, test_f1: 0.4852
 epoch: 16, train_loss: 0.9671, test_loss: 0.9725, test_f1: 0.4771
 epoch: 17, train_loss: 0.9592, test_loss: 0.9644, test_f1: 0.4897
 epoch: 18, train_loss: 0.9646, test_loss: 0.9575, test_f1: 0.4898
 epoch: 19, train_loss: 0.9606, test_loss: 0.9547, test_f1: 0.4917
 epoch: 20, train_loss: 0.9421, test_loss: 0.9509, test_f1: 0.4863
 epoch: 21, train_loss: 0.9380, test_loss: 0.9423, test_f1: 0.5041
 epoch: 22, train_loss: 0.9378, test_loss: 0.9316, test_f1: 0.5009
 epoch: 23, train_loss: 0.9211, test_loss: 0.9346, test_f1: 0.5052
 epoch: 24, train_loss: 0.9270, test_loss: 0.9455, test_f1: 0.4785
 epoch: 25, train_loss: 0.9208, test_loss: 0.9439, test_f1: 0.5074
 epoch: 26, train_loss: 0.9180, test_loss: 0.9736, test_f1: 0.4842
 epoch: 27, train_loss: 0.9183, test_loss: 0.9446, test_f1: 0.4976
 epoch: 28, train_loss: 0.9018, test_loss: 0.9223, test_f1: 0.5255
 epoch: 29, train_loss: 0.9008, test_loss: 0.9251, test_f1: 0.5169
 epoch: 30, train_loss: 0.9037, test_loss: 0.9198, test_f1: 0.5268
 epoch: 31, train_loss: 0.8991, test_loss: 0.9215, test_f1: 0.5241
 epoch: 32, train_loss: 0.8969, test_loss: 0.9278, test_f1: 0.5236
 epoch: 33, train_loss: 0.8997, test_loss: 0.9270, test_f1: 0.5192
 epoch: 34, train_loss: 0.8914, test_loss: 0.9240, test_f1: 0.5143
 epoch: 35, train_loss: 0.8838, test_loss: 0.9231, test_f1: 0.5109
 epoch: 36, train_loss: 0.8843, test_loss: 0.8950, test_f1: 0.5378
 epoch: 37, train_loss: 0.8803, test_loss: 0.9397, test_f1: 0.5260
 epoch: 38, train_loss: 0.8708, test_loss: 0.9454, test_f1: 0.5119
 epoch: 39, train_loss: 0.8684, test_loss: 0.9327, test_f1: 0.5011
 epoch: 40, train_loss: 0.8726, test_loss: 0.9175, test_f1: 0.5142
 epoch: 41, train_loss: 0.8768, test_loss: 0.9186, test_f1: 0.5118
 epoch: 42, train_loss: 0.8721, test_loss: 0.9032, test_f1: 0.5082
 epoch: 43, train_loss: 0.8687, test_loss: 0.9287, test_f1: 0.5344
 epoch: 44, train_loss: 0.8597, test_loss: 0.9127, test_f1: 0.5483
 epoch: 45, train_loss: 0.8530, test_loss: 0.9123, test_f1: 0.5347
 epoch: 46, train_loss: 0.8566, test_loss: 0.9351, test_f1: 0.5376
 epoch: 47, train_loss: 0.8483, test_loss: 0.9107, test_f1: 0.5343
 epoch: 48, train_loss: 0.8609, test_loss: 0.9232, test_f1: 0.5307
 epoch: 49, train_loss: 0.8468, test_loss: 0.9322, test_f1: 0.5471
 epoch: 50, train_loss: 0.8430, test_loss: 0.9252, test_f1: 0.5444
 epoch: 51, train_loss: 0.8386, test_loss: 0.9117, test_f1: 0.5348
 epoch: 52, train_loss: 0.8406, test_loss: 0.9002, test_f1: 0.5303
 epoch: 53, train_loss: 0.8423, test_loss: 0.9309, test_f1: 0.5400
 epoch: 54, train_loss: 0.8353, test_loss: 0.9307, test_f1: 0.5293
 epoch: 55, train_loss: 0.8305, test_loss: 0.9143, test_f1: 0.5355
 epoch: 56, train_loss: 0.8439, test_loss: 0.9189, test_f1: 0.5391
 epoch: 57, train_loss: 0.8347, test_loss: 0.9370, test_f1: 0.5172
 epoch: 58, train_loss: 0.8357, test_loss: 0.9067, test_f1: 0.5518
 epoch: 59, train_loss: 0.8410, test_loss: 0.9088, test_f1: 0.5403
 epoch: 60, train_loss: 0.8410, test_loss: 0.9072, test_f1: 0.5301
 epoch: 61, train_loss: 0.8262, test_loss: 0.8825, test_f1: 0.5310
 epoch: 62, train_loss: 0.8266, test_loss: 0.9221, test_f1: 0.5265
 epoch: 63, train_loss: 0.8293, test_loss: 0.9064, test_f1: 0.5428
 epoch: 64, train_loss: 0.8299, test_loss: 0.9000, test_f1: 0.5426
 epoch: 65, train_loss: 0.8290, test_loss: 0.9077, test_f1: 0.5464
 epoch: 66, train_loss: 0.8333, test_loss: 0.9019, test_f1: 0.5521
 epoch: 67, train_loss: 0.8216, test_loss: 0.9183, test_f1: 0.5396
 epoch: 68, train_loss: 0.8231, test_loss: 0.8999, test_f1: 0.5516
 epoch: 69, train_loss: 0.8197, test_loss: 0.9016, test_f1: 0.5402
 epoch: 70, train_loss: 0.8136, test_loss: 0.9059, test_f1: 0.5410
 epoch: 71, train_loss: 0.8153, test_loss: 0.9227, test_f1: 0.5452
 epoch: 72, train_loss: 0.8152, test_loss: 0.9040, test_f1: 0.5498
 epoch: 73, train_loss: 0.8172, test_loss: 0.9076, test_f1: 0.5458
 epoch: 74, train_loss: 0.8113, test_loss: 0.9031, test_f1: 0.5443
 epoch: 75, train_loss: 0.8130, test_loss: 0.9269, test_f1: 0.5398
 epoch: 76, train_loss: 0.8220, test_loss: 0.9271, test_f1: 0.5473
 epoch: 77, train_loss: 0.8264, test_loss: 0.9137, test_f1: 0.5524
 epoch: 78, train_loss: 0.8198, test_loss: 0.9103, test_f1: 0.5432
 epoch: 79, train_loss: 0.8113, test_loss: 0.9093, test_f1: 0.5422
 epoch: 80, train_loss: 0.8142, test_loss: 0.9135, test_f1: 0.5440
 epoch: 81, train_loss: 0.8122, test_loss: 0.9526, test_f1: 0.5360
 epoch: 82, train_loss: 0.8099, test_loss: 0.9434, test_f1: 0.5296
 epoch: 83, train_loss: 0.8119, test_loss: 0.8960, test_f1: 0.5444
 epoch: 84, train_loss: 0.8099, test_loss: 0.9156, test_f1: 0.5463
 epoch: 85, train_loss: 0.8091, test_loss: 0.8993, test_f1: 0.5470
 epoch: 86, train_loss: 0.8083, test_loss: 0.9002, test_f1: 0.5469
 epoch: 87, train_loss: 0.8136, test_loss: 0.8863, test_f1: 0.5363
 epoch: 88, train_loss: 0.8089, test_loss: 0.8959, test_f1: 0.5529
 epoch: 89, train_loss: 0.8116, test_loss: 0.9331, test_f1: 0.5366
 epoch: 90, train_loss: 0.8094, test_loss: 0.9202, test_f1: 0.5403
 epoch: 91, train_loss: 0.7933, test_loss: 0.9177, test_f1: 0.5470
 epoch: 92, train_loss: 0.8131, test_loss: 0.8983, test_f1: 0.5409
 epoch: 93, train_loss: 0.7967, test_loss: 0.8925, test_f1: 0.5416
 epoch: 94, train_loss: 0.8037, test_loss: 0.8987, test_f1: 0.5569
 epoch: 95, train_loss: 0.8043, test_loss: 0.8734, test_f1: 0.5697
 epoch: 96, train_loss: 0.8121, test_loss: 0.8968, test_f1: 0.5572
 epoch: 97, train_loss: 0.8030, test_loss: 0.8885, test_f1: 0.5528
 epoch: 98, train_loss: 0.8007, test_loss: 0.9048, test_f1: 0.5550
 epoch: 99, train_loss: 0.7961, test_loss: 0.9075, test_f1: 0.5456
##################ITERATION #8 ****************************************
 epoch: 0, train_loss: 1.3238, test_loss: 1.1857, test_f1: 0.2621
 epoch: 1, train_loss: 1.1914, test_loss: 1.1273, test_f1: 0.3572
 epoch: 2, train_loss: 1.1755, test_loss: 1.0994, test_f1: 0.3645
 epoch: 3, train_loss: 1.1495, test_loss: 1.0775, test_f1: 0.3833
 epoch: 4, train_loss: 1.1246, test_loss: 1.0616, test_f1: 0.3896
 epoch: 5, train_loss: 1.1067, test_loss: 1.0480, test_f1: 0.4177
 epoch: 6, train_loss: 1.0967, test_loss: 1.0392, test_f1: 0.4484
 epoch: 7, train_loss: 1.0867, test_loss: 1.0347, test_f1: 0.4606
 epoch: 8, train_loss: 1.0708, test_loss: 1.0254, test_f1: 0.4472
 epoch: 9, train_loss: 1.0621, test_loss: 1.0226, test_f1: 0.4643
 epoch: 10, train_loss: 1.0476, test_loss: 1.0252, test_f1: 0.4544
 epoch: 11, train_loss: 1.0458, test_loss: 1.0179, test_f1: 0.4693
 epoch: 12, train_loss: 1.0327, test_loss: 1.0186, test_f1: 0.4483
 epoch: 13, train_loss: 1.0262, test_loss: 1.0286, test_f1: 0.4725
 epoch: 14, train_loss: 1.0320, test_loss: 1.0145, test_f1: 0.4616
 epoch: 15, train_loss: 1.0144, test_loss: 1.0161, test_f1: 0.4732
 epoch: 16, train_loss: 1.0189, test_loss: 1.0092, test_f1: 0.4818
 epoch: 17, train_loss: 1.0013, test_loss: 1.0200, test_f1: 0.4783
 epoch: 18, train_loss: 0.9896, test_loss: 1.0173, test_f1: 0.4831
 epoch: 19, train_loss: 0.9988, test_loss: 1.0150, test_f1: 0.4867
 epoch: 20, train_loss: 0.9906, test_loss: 1.0107, test_f1: 0.4939
 epoch: 21, train_loss: 0.9944, test_loss: 1.0074, test_f1: 0.4934
 epoch: 22, train_loss: 0.9850, test_loss: 1.0008, test_f1: 0.4829
 epoch: 23, train_loss: 0.9758, test_loss: 1.0108, test_f1: 0.4742
 epoch: 24, train_loss: 0.9698, test_loss: 0.9999, test_f1: 0.4875
 epoch: 25, train_loss: 0.9677, test_loss: 1.0023, test_f1: 0.4809
 epoch: 26, train_loss: 0.9721, test_loss: 1.0168, test_f1: 0.4980
 epoch: 27, train_loss: 0.9634, test_loss: 0.9978, test_f1: 0.5181
 epoch: 28, train_loss: 0.9630, test_loss: 1.0016, test_f1: 0.4909
 epoch: 29, train_loss: 0.9606, test_loss: 1.0005, test_f1: 0.5094
 epoch: 30, train_loss: 0.9552, test_loss: 1.0036, test_f1: 0.5069
 epoch: 31, train_loss: 0.9484, test_loss: 0.9844, test_f1: 0.5222
 epoch: 32, train_loss: 0.9427, test_loss: 0.9917, test_f1: 0.5063
 epoch: 33, train_loss: 0.9411, test_loss: 0.9885, test_f1: 0.5212
 epoch: 34, train_loss: 0.9369, test_loss: 0.9808, test_f1: 0.5345
 epoch: 35, train_loss: 0.9306, test_loss: 1.0093, test_f1: 0.5051
 epoch: 36, train_loss: 0.9338, test_loss: 0.9907, test_f1: 0.5100
 epoch: 37, train_loss: 0.9284, test_loss: 1.0050, test_f1: 0.4994
 epoch: 38, train_loss: 0.9072, test_loss: 1.0111, test_f1: 0.4975
 epoch: 39, train_loss: 0.9190, test_loss: 0.9901, test_f1: 0.5148
 epoch: 40, train_loss: 0.9098, test_loss: 1.0339, test_f1: 0.4942
 epoch: 41, train_loss: 0.9203, test_loss: 1.0107, test_f1: 0.5100
 epoch: 42, train_loss: 0.9208, test_loss: 1.0454, test_f1: 0.4898
 epoch: 43, train_loss: 0.9024, test_loss: 1.0111, test_f1: 0.5041
 epoch: 44, train_loss: 0.9072, test_loss: 1.0184, test_f1: 0.5079
 epoch: 45, train_loss: 0.9014, test_loss: 1.0027, test_f1: 0.4899
 epoch: 46, train_loss: 0.8919, test_loss: 1.0016, test_f1: 0.5059
 epoch: 47, train_loss: 0.9050, test_loss: 0.9876, test_f1: 0.5087
 epoch: 48, train_loss: 0.8865, test_loss: 1.0101, test_f1: 0.5023
 epoch: 49, train_loss: 0.8904, test_loss: 0.9726, test_f1: 0.5173
 epoch: 50, train_loss: 0.8913, test_loss: 0.9981, test_f1: 0.5132
 epoch: 51, train_loss: 0.8746, test_loss: 0.9986, test_f1: 0.5224
 epoch: 52, train_loss: 0.8781, test_loss: 0.9973, test_f1: 0.5073
 epoch: 53, train_loss: 0.8761, test_loss: 0.9748, test_f1: 0.5220
 epoch: 54, train_loss: 0.8742, test_loss: 1.0006, test_f1: 0.5031
 epoch: 55, train_loss: 0.8751, test_loss: 1.0117, test_f1: 0.5076
 epoch: 56, train_loss: 0.8694, test_loss: 1.0305, test_f1: 0.4986
 epoch: 57, train_loss: 0.8700, test_loss: 1.0066, test_f1: 0.5169
 epoch: 58, train_loss: 0.8656, test_loss: 0.9969, test_f1: 0.5143
 epoch: 59, train_loss: 0.8773, test_loss: 1.0060, test_f1: 0.5184
 epoch: 60, train_loss: 0.8636, test_loss: 0.9898, test_f1: 0.5165
 epoch: 61, train_loss: 0.8684, test_loss: 1.0185, test_f1: 0.4988
 epoch: 62, train_loss: 0.8720, test_loss: 0.9889, test_f1: 0.5074
 epoch: 63, train_loss: 0.8703, test_loss: 0.9920, test_f1: 0.5166
 epoch: 64, train_loss: 0.8623, test_loss: 0.9951, test_f1: 0.5063
 epoch: 65, train_loss: 0.8624, test_loss: 0.9998, test_f1: 0.5121
 epoch: 66, train_loss: 0.8550, test_loss: 1.0059, test_f1: 0.5144
 epoch: 67, train_loss: 0.8713, test_loss: 0.9847, test_f1: 0.5188
 epoch: 68, train_loss: 0.8655, test_loss: 0.9878, test_f1: 0.5153
 epoch: 69, train_loss: 0.8570, test_loss: 0.9935, test_f1: 0.5094
 epoch: 70, train_loss: 0.8435, test_loss: 1.0109, test_f1: 0.5195
 epoch: 71, train_loss: 0.8546, test_loss: 0.9975, test_f1: 0.5189
 epoch: 72, train_loss: 0.8681, test_loss: 1.0323, test_f1: 0.4960
 epoch: 73, train_loss: 0.8604, test_loss: 0.9819, test_f1: 0.5207
 epoch: 74, train_loss: 0.8486, test_loss: 1.0077, test_f1: 0.5069
 epoch: 75, train_loss: 0.8451, test_loss: 1.0267, test_f1: 0.5135
 epoch: 76, train_loss: 0.8423, test_loss: 1.0253, test_f1: 0.5009
 epoch: 77, train_loss: 0.8516, test_loss: 1.0016, test_f1: 0.5043
 epoch: 78, train_loss: 0.8541, test_loss: 0.9940, test_f1: 0.5231
 epoch: 79, train_loss: 0.8517, test_loss: 0.9961, test_f1: 0.5143
 epoch: 80, train_loss: 0.8393, test_loss: 1.0097, test_f1: 0.5093
 epoch: 81, train_loss: 0.8525, test_loss: 1.0021, test_f1: 0.5153
 epoch: 82, train_loss: 0.8440, test_loss: 1.0134, test_f1: 0.5089
 epoch: 83, train_loss: 0.8427, test_loss: 0.9931, test_f1: 0.5174
 epoch: 84, train_loss: 0.8426, test_loss: 1.0184, test_f1: 0.5156
 epoch: 85, train_loss: 0.8403, test_loss: 0.9861, test_f1: 0.5367
 epoch: 86, train_loss: 0.8400, test_loss: 1.0160, test_f1: 0.5284
 epoch: 87, train_loss: 0.8391, test_loss: 1.0252, test_f1: 0.5235
 epoch: 88, train_loss: 0.8465, test_loss: 1.0296, test_f1: 0.5241
 epoch: 89, train_loss: 0.8450, test_loss: 1.0136, test_f1: 0.5147
 epoch: 90, train_loss: 0.8401, test_loss: 1.0023, test_f1: 0.5288
 epoch: 91, train_loss: 0.8353, test_loss: 1.0065, test_f1: 0.5139
 epoch: 92, train_loss: 0.8423, test_loss: 1.0245, test_f1: 0.5135
 epoch: 93, train_loss: 0.8396, test_loss: 1.0144, test_f1: 0.5202
 epoch: 94, train_loss: 0.8357, test_loss: 0.9915, test_f1: 0.5253
 epoch: 95, train_loss: 0.8281, test_loss: 1.0035, test_f1: 0.5284
 epoch: 96, train_loss: 0.8394, test_loss: 1.0064, test_f1: 0.5174
 epoch: 97, train_loss: 0.8317, test_loss: 0.9728, test_f1: 0.5245
 epoch: 98, train_loss: 0.8391, test_loss: 0.9996, test_f1: 0.5199
 epoch: 99, train_loss: 0.8257, test_loss: 1.0394, test_f1: 0.5091
##################ITERATION #9 ****************************************
 epoch: 0, train_loss: 1.2740, test_loss: 1.1477, test_f1: 0.3888
 epoch: 1, train_loss: 1.1762, test_loss: 1.1061, test_f1: 0.4096
 epoch: 2, train_loss: 1.1488, test_loss: 1.0768, test_f1: 0.4093
 epoch: 3, train_loss: 1.1153, test_loss: 1.0499, test_f1: 0.4222
 epoch: 4, train_loss: 1.0970, test_loss: 1.0351, test_f1: 0.4392
 epoch: 5, train_loss: 1.0826, test_loss: 1.0310, test_f1: 0.4532
 epoch: 6, train_loss: 1.0709, test_loss: 1.0227, test_f1: 0.4319
 epoch: 7, train_loss: 1.0584, test_loss: 1.0140, test_f1: 0.4509
 epoch: 8, train_loss: 1.0532, test_loss: 1.0173, test_f1: 0.4583
 epoch: 9, train_loss: 1.0392, test_loss: 1.0101, test_f1: 0.4509
 epoch: 10, train_loss: 1.0401, test_loss: 1.0020, test_f1: 0.4919
 epoch: 11, train_loss: 1.0239, test_loss: 0.9854, test_f1: 0.4751
 epoch: 12, train_loss: 1.0198, test_loss: 0.9966, test_f1: 0.4784
 epoch: 13, train_loss: 1.0134, test_loss: 0.9956, test_f1: 0.4870
 epoch: 14, train_loss: 1.0076, test_loss: 0.9787, test_f1: 0.4734
 epoch: 15, train_loss: 1.0056, test_loss: 0.9724, test_f1: 0.4964
 epoch: 16, train_loss: 0.9860, test_loss: 0.9622, test_f1: 0.5017
 epoch: 17, train_loss: 0.9934, test_loss: 0.9775, test_f1: 0.4951
 epoch: 18, train_loss: 0.9873, test_loss: 0.9668, test_f1: 0.4928
 epoch: 19, train_loss: 0.9860, test_loss: 0.9624, test_f1: 0.4921
 epoch: 20, train_loss: 0.9792, test_loss: 0.9610, test_f1: 0.4947
 epoch: 21, train_loss: 0.9725, test_loss: 0.9801, test_f1: 0.5014
 epoch: 22, train_loss: 0.9767, test_loss: 0.9848, test_f1: 0.5048
 epoch: 23, train_loss: 0.9657, test_loss: 0.9619, test_f1: 0.4836
 epoch: 24, train_loss: 0.9615, test_loss: 0.9671, test_f1: 0.4932
 epoch: 25, train_loss: 0.9571, test_loss: 0.9733, test_f1: 0.4884
 epoch: 26, train_loss: 0.9563, test_loss: 0.9648, test_f1: 0.4873
 epoch: 27, train_loss: 0.9561, test_loss: 0.9816, test_f1: 0.4874
 epoch: 28, train_loss: 0.9445, test_loss: 0.9841, test_f1: 0.4928
 epoch: 29, train_loss: 0.9462, test_loss: 0.9802, test_f1: 0.4958
 epoch: 30, train_loss: 0.9389, test_loss: 0.9784, test_f1: 0.4963
 epoch: 31, train_loss: 0.9411, test_loss: 0.9709, test_f1: 0.5045
 epoch: 32, train_loss: 0.9390, test_loss: 0.9842, test_f1: 0.4886
 epoch: 33, train_loss: 0.9377, test_loss: 0.9908, test_f1: 0.4738
 epoch: 34, train_loss: 0.9360, test_loss: 0.9834, test_f1: 0.4838
 epoch: 35, train_loss: 0.9293, test_loss: 0.9909, test_f1: 0.4864
 epoch: 36, train_loss: 0.9239, test_loss: 0.9611, test_f1: 0.4981
 epoch: 37, train_loss: 0.9299, test_loss: 0.9590, test_f1: 0.5064
 epoch: 38, train_loss: 0.9144, test_loss: 0.9790, test_f1: 0.4957
 epoch: 39, train_loss: 0.9260, test_loss: 0.9897, test_f1: 0.5030
 epoch: 40, train_loss: 0.9138, test_loss: 0.9886, test_f1: 0.4909
 epoch: 41, train_loss: 0.9104, test_loss: 0.9874, test_f1: 0.4846
 epoch: 42, train_loss: 0.9140, test_loss: 0.9923, test_f1: 0.4883
 epoch: 43, train_loss: 0.9070, test_loss: 0.9964, test_f1: 0.4953
 epoch: 44, train_loss: 0.8997, test_loss: 1.0004, test_f1: 0.4994
 epoch: 45, train_loss: 0.9033, test_loss: 0.9941, test_f1: 0.4959
 epoch: 46, train_loss: 0.8966, test_loss: 0.9780, test_f1: 0.4799
 epoch: 47, train_loss: 0.8853, test_loss: 0.9451, test_f1: 0.5030
 epoch: 48, train_loss: 0.8914, test_loss: 0.9826, test_f1: 0.4969
 epoch: 49, train_loss: 0.9013, test_loss: 0.9921, test_f1: 0.5005
 epoch: 50, train_loss: 0.8844, test_loss: 1.0012, test_f1: 0.4933
 epoch: 51, train_loss: 0.8919, test_loss: 0.9889, test_f1: 0.4991
 epoch: 52, train_loss: 0.8837, test_loss: 0.9820, test_f1: 0.4973
 epoch: 53, train_loss: 0.8771, test_loss: 0.9704, test_f1: 0.5035
 epoch: 54, train_loss: 0.8834, test_loss: 0.9717, test_f1: 0.4940
 epoch: 55, train_loss: 0.8784, test_loss: 0.9959, test_f1: 0.5034
 epoch: 56, train_loss: 0.8718, test_loss: 0.9840, test_f1: 0.4970
 epoch: 57, train_loss: 0.8717, test_loss: 0.9796, test_f1: 0.5046
 epoch: 58, train_loss: 0.8748, test_loss: 0.9702, test_f1: 0.5070
 epoch: 59, train_loss: 0.8807, test_loss: 0.9957, test_f1: 0.5009
 epoch: 60, train_loss: 0.8905, test_loss: 0.9877, test_f1: 0.4957
 epoch: 61, train_loss: 0.8621, test_loss: 0.9724, test_f1: 0.5038
 epoch: 62, train_loss: 0.8724, test_loss: 0.9679, test_f1: 0.4992
 epoch: 63, train_loss: 0.8598, test_loss: 0.9936, test_f1: 0.5093
 epoch: 64, train_loss: 0.8710, test_loss: 0.9928, test_f1: 0.5057
 epoch: 65, train_loss: 0.8651, test_loss: 0.9853, test_f1: 0.4969
 epoch: 66, train_loss: 0.8642, test_loss: 1.0070, test_f1: 0.5031
 epoch: 67, train_loss: 0.8681, test_loss: 0.9967, test_f1: 0.5147
 epoch: 68, train_loss: 0.8595, test_loss: 1.0127, test_f1: 0.5101
 epoch: 69, train_loss: 0.8630, test_loss: 0.9660, test_f1: 0.5109
 epoch: 70, train_loss: 0.8621, test_loss: 0.9975, test_f1: 0.5050
 epoch: 71, train_loss: 0.8536, test_loss: 0.9763, test_f1: 0.5248
 epoch: 72, train_loss: 0.8574, test_loss: 0.9950, test_f1: 0.5108
 epoch: 73, train_loss: 0.8570, test_loss: 1.0024, test_f1: 0.5064
 epoch: 74, train_loss: 0.8427, test_loss: 0.9723, test_f1: 0.5067
 epoch: 75, train_loss: 0.8581, test_loss: 0.9910, test_f1: 0.5137
 epoch: 76, train_loss: 0.8586, test_loss: 1.0120, test_f1: 0.4915
 epoch: 77, train_loss: 0.8491, test_loss: 0.9980, test_f1: 0.5199
 epoch: 78, train_loss: 0.8553, test_loss: 0.9886, test_f1: 0.5071
 epoch: 79, train_loss: 0.8412, test_loss: 0.9815, test_f1: 0.5082
 epoch: 80, train_loss: 0.8430, test_loss: 1.0082, test_f1: 0.5145
 epoch: 81, train_loss: 0.8524, test_loss: 0.9811, test_f1: 0.5103
 epoch: 82, train_loss: 0.8434, test_loss: 0.9888, test_f1: 0.5242
 epoch: 83, train_loss: 0.8406, test_loss: 0.9887, test_f1: 0.5075
 epoch: 84, train_loss: 0.8356, test_loss: 1.0106, test_f1: 0.5180
 epoch: 85, train_loss: 0.8487, test_loss: 0.9885, test_f1: 0.5053
 epoch: 86, train_loss: 0.8379, test_loss: 0.9872, test_f1: 0.5099
 epoch: 87, train_loss: 0.8414, test_loss: 0.9603, test_f1: 0.5301
 epoch: 88, train_loss: 0.8342, test_loss: 0.9963, test_f1: 0.5082
 epoch: 89, train_loss: 0.8338, test_loss: 1.0127, test_f1: 0.5155
 epoch: 90, train_loss: 0.8376, test_loss: 0.9850, test_f1: 0.5089
 epoch: 91, train_loss: 0.8446, test_loss: 1.0145, test_f1: 0.5053
 epoch: 92, train_loss: 0.8265, test_loss: 0.9831, test_f1: 0.5129
 epoch: 93, train_loss: 0.8242, test_loss: 0.9843, test_f1: 0.4968
 epoch: 94, train_loss: 0.8371, test_loss: 1.0019, test_f1: 0.5354
 epoch: 95, train_loss: 0.8240, test_loss: 1.0021, test_f1: 0.5051
 epoch: 96, train_loss: 0.8250, test_loss: 0.9857, test_f1: 0.5270
 epoch: 97, train_loss: 0.8257, test_loss: 0.9938, test_f1: 0.5138
 epoch: 98, train_loss: 0.8378, test_loss: 0.9803, test_f1: 0.5143
 epoch: 99, train_loss: 0.8257, test_loss: 0.9738, test_f1: 0.5097

Training completed in 1456.06 seconds
Best F1: 0.5733 at epoch 84
Mean F1 across iterations: 0.5462  0.0147
========================FINAL RESULTS================================
FEGIN weighted F1: 0.5733  0.0147
python main.py --data ltspice_examples --representation component_pin --model FEGIN --layers 5 --hiddens 32 --batch_size 32 --lr 0.0001 --emb_size 250 --epochs 100 --save_appendix component_pin_L5_H32_BS32_LR0.0001_E250 --no_val
-----



STDERR:
  File "main.py", line 370, in <module>
    main()
  File "main.py", line 254, in main
    dataset = dataset_class(
  File "/home/philip/projects/llm_inference_code_repo/Circuit-Completion-Using-GNNs/component_classification_with_link_prediction_head/evaluation/FEGIN/kernel/circuit_datasets.py", line 15, in __init__
    self.data, self.slices = torch.load(self.processed_paths[0])
  File "/home/philip/.local/lib/python3.8/site-packages/torch/serialization.py", line 1040, in load
    warnings.warn(
  File "/usr/lib/python3.8/warnings.py", line 109, in _showwarnmsg
    sw(msg.message, msg.category, msg.filename, msg.lineno,
  File "main.py", line 47, in warn_with_traceback
    traceback.print_stack(file=log)
/home/philip/projects/llm_inference_code_repo/Circuit-Completion-Using-GNNs/component_classification_with_link_prediction_head/evaluation/FEGIN/kernel/circuit_datasets.py:15: FutureWarning: You are using `torch.load` with `weights_only=False` (the current default value), which uses the default pickle module implicitly. It is possible to construct malicious pickle data which will execute arbitrary code during unpickling (See https://github.com/pytorch/pytorch/blob/main/SECURITY.md#untrusted-models for more details). In a future release, the default value for `weights_only` will be flipped to `True`. This limits the functions that could be executed during unpickling. Arbitrary objects will no longer be allowed to be loaded via this mode unless they are explicitly allowlisted by the user via `torch.serialization.add_safe_globals`. We recommend you start setting `weights_only=True` for any use case where you don't have full control of the loaded file. Please open an issue on GitHub for any issues related to this experimental feature.
  self.data, self.slices = torch.load(self.processed_paths[0])
