STDOUT:
Results will be saved in /home/philip/projects/ltspice_examples_code_repo/Circuit-Completion-Using-GNNs/component_classification_with_link_prediction_head/evaluation/FEGIN/results/model_FEGIN_dataset_ltspice_demos
Command line input: python main.py --data ltspice_demos --representation component_pin_net --model FEGIN --layers 5 --hiddens 32 --batch_size 32 --lr 0.001 --emb_size 128 --epochs 100 --save_appendix component_pin_net_L5_H32_BS32_LR0.001_E128 --no_val
 is saved.
-----
ltspice_demos - FEGIN
Using 5 layers, 32 hidden units, h = 2
Loading component_pin_net representation dataset
ENTERED
Training FEGIN on component_pin_net representation
Train: 1565, Test: 383
##################ITERATION #0 ****************************************
 epoch: 0, train_loss: 1.2828, test_loss: 1.2923, test_f1: 0.3232
 epoch: 1, train_loss: 1.1504, test_loss: 1.2056, test_f1: 0.4143
 epoch: 2, train_loss: 1.1160, test_loss: 1.1521, test_f1: 0.4399
 epoch: 3, train_loss: 1.0764, test_loss: 1.1240, test_f1: 0.4163
 epoch: 4, train_loss: 1.0312, test_loss: 1.0905, test_f1: 0.4646
 epoch: 5, train_loss: 0.9943, test_loss: 1.0779, test_f1: 0.4731
 epoch: 6, train_loss: 0.9822, test_loss: 1.0603, test_f1: 0.4502
 epoch: 7, train_loss: 0.9703, test_loss: 1.0501, test_f1: 0.5228
 epoch: 8, train_loss: 0.9588, test_loss: 1.0501, test_f1: 0.5230
 epoch: 9, train_loss: 0.9509, test_loss: 1.0746, test_f1: 0.5397
 epoch: 10, train_loss: 0.9411, test_loss: 1.0413, test_f1: 0.5646
 epoch: 11, train_loss: 0.9290, test_loss: 1.0691, test_f1: 0.5171
 epoch: 12, train_loss: 0.9169, test_loss: 1.0379, test_f1: 0.4803
 epoch: 13, train_loss: 0.9087, test_loss: 1.0127, test_f1: 0.5328
 epoch: 14, train_loss: 0.8840, test_loss: 0.9855, test_f1: 0.5839
 epoch: 15, train_loss: 0.8810, test_loss: 1.0987, test_f1: 0.5433
 epoch: 16, train_loss: 0.8646, test_loss: 1.0399, test_f1: 0.5607
 epoch: 17, train_loss: 0.8604, test_loss: 0.9956, test_f1: 0.5729
 epoch: 18, train_loss: 0.8422, test_loss: 0.9893, test_f1: 0.5955
 epoch: 19, train_loss: 0.8001, test_loss: 0.9919, test_f1: 0.5926
 epoch: 20, train_loss: 0.8030, test_loss: 1.0055, test_f1: 0.5867
 epoch: 21, train_loss: 0.7768, test_loss: 0.9676, test_f1: 0.5815
 epoch: 22, train_loss: 0.7732, test_loss: 0.9555, test_f1: 0.6479
 epoch: 23, train_loss: 0.7396, test_loss: 0.9378, test_f1: 0.6533
 epoch: 24, train_loss: 0.7447, test_loss: 1.0073, test_f1: 0.5780
 epoch: 25, train_loss: 0.7391, test_loss: 1.0337, test_f1: 0.5643
 epoch: 26, train_loss: 0.7361, test_loss: 0.9843, test_f1: 0.5947
 epoch: 27, train_loss: 0.7213, test_loss: 1.0917, test_f1: 0.5995
 epoch: 28, train_loss: 0.7232, test_loss: 0.9739, test_f1: 0.6548
 epoch: 29, train_loss: 0.6855, test_loss: 0.9918, test_f1: 0.5884
 epoch: 30, train_loss: 0.6843, test_loss: 0.9706, test_f1: 0.6407
 epoch: 31, train_loss: 0.6642, test_loss: 0.9486, test_f1: 0.6481
 epoch: 32, train_loss: 0.6495, test_loss: 1.0216, test_f1: 0.6067
 epoch: 33, train_loss: 0.6480, test_loss: 0.9481, test_f1: 0.6338
 epoch: 34, train_loss: 0.6627, test_loss: 0.9854, test_f1: 0.5855
 epoch: 35, train_loss: 0.6387, test_loss: 1.2016, test_f1: 0.5698
 epoch: 36, train_loss: 0.6255, test_loss: 0.9893, test_f1: 0.6401
 epoch: 37, train_loss: 0.6136, test_loss: 0.9575, test_f1: 0.6506
 epoch: 38, train_loss: 0.5978, test_loss: 0.9719, test_f1: 0.6206
 epoch: 39, train_loss: 0.6378, test_loss: 1.0701, test_f1: 0.6239
 epoch: 40, train_loss: 0.5921, test_loss: 0.9528, test_f1: 0.6445
 epoch: 41, train_loss: 0.5865, test_loss: 1.0154, test_f1: 0.5803
 epoch: 42, train_loss: 0.5981, test_loss: 1.0345, test_f1: 0.5760
 epoch: 43, train_loss: 0.5800, test_loss: 1.0877, test_f1: 0.6143
 epoch: 44, train_loss: 0.5660, test_loss: 1.1181, test_f1: 0.6242
 epoch: 45, train_loss: 0.5515, test_loss: 1.2872, test_f1: 0.5578
 epoch: 46, train_loss: 0.5834, test_loss: 0.9889, test_f1: 0.6301
 epoch: 47, train_loss: 0.5782, test_loss: 1.0352, test_f1: 0.6074
 epoch: 48, train_loss: 0.5452, test_loss: 1.0771, test_f1: 0.6288
 epoch: 49, train_loss: 0.5407, test_loss: 1.0991, test_f1: 0.6229
 epoch: 50, train_loss: 0.5416, test_loss: 1.1277, test_f1: 0.6084
 epoch: 51, train_loss: 0.5051, test_loss: 1.1401, test_f1: 0.6468
 epoch: 52, train_loss: 0.4797, test_loss: 1.1354, test_f1: 0.6296
 epoch: 53, train_loss: 0.4905, test_loss: 1.0991, test_f1: 0.6576
 epoch: 54, train_loss: 0.4716, test_loss: 1.1098, test_f1: 0.6423
 epoch: 55, train_loss: 0.4690, test_loss: 1.2105, test_f1: 0.6145
 epoch: 56, train_loss: 0.4502, test_loss: 1.1924, test_f1: 0.6331
 epoch: 57, train_loss: 0.4375, test_loss: 1.1976, test_f1: 0.6606
 epoch: 58, train_loss: 0.4412, test_loss: 1.1906, test_f1: 0.6319
 epoch: 59, train_loss: 0.4369, test_loss: 1.3294, test_f1: 0.6135
 epoch: 60, train_loss: 0.4544, test_loss: 1.3519, test_f1: 0.6234
 epoch: 61, train_loss: 0.4305, test_loss: 1.2459, test_f1: 0.6351
 epoch: 62, train_loss: 0.4269, test_loss: 1.2547, test_f1: 0.6559
 epoch: 63, train_loss: 0.4153, test_loss: 1.2350, test_f1: 0.6378
 epoch: 64, train_loss: 0.4463, test_loss: 1.2478, test_f1: 0.6477
 epoch: 65, train_loss: 0.4056, test_loss: 1.5113, test_f1: 0.5881
 epoch: 66, train_loss: 0.4334, test_loss: 1.2270, test_f1: 0.6296
 epoch: 67, train_loss: 0.3834, test_loss: 1.2901, test_f1: 0.6338
 epoch: 68, train_loss: 0.3634, test_loss: 1.4022, test_f1: 0.6293
 epoch: 69, train_loss: 0.4013, test_loss: 1.3487, test_f1: 0.5996
 epoch: 70, train_loss: 0.3798, test_loss: 1.4068, test_f1: 0.5881
 epoch: 71, train_loss: 0.3892, test_loss: 1.4749, test_f1: 0.6175
 epoch: 72, train_loss: 0.3661, test_loss: 1.3584, test_f1: 0.6387
 epoch: 73, train_loss: 0.3656, test_loss: 1.4470, test_f1: 0.6137
 epoch: 74, train_loss: 0.3745, test_loss: 1.4894, test_f1: 0.6374
 epoch: 75, train_loss: 0.3805, test_loss: 1.4832, test_f1: 0.5870
 epoch: 76, train_loss: 0.3737, test_loss: 1.4277, test_f1: 0.6206
 epoch: 77, train_loss: 0.3616, test_loss: 1.5048, test_f1: 0.6535
 epoch: 78, train_loss: 0.3663, test_loss: 1.4512, test_f1: 0.6222
 epoch: 79, train_loss: 0.3750, test_loss: 1.4926, test_f1: 0.6243
 epoch: 80, train_loss: 0.3340, test_loss: 1.6202, test_f1: 0.6340
 epoch: 81, train_loss: 0.3520, test_loss: 1.6674, test_f1: 0.5980
 epoch: 82, train_loss: 0.3211, test_loss: 1.5778, test_f1: 0.6156
 epoch: 83, train_loss: 0.3604, test_loss: 1.6531, test_f1: 0.5863
 epoch: 84, train_loss: 0.3430, test_loss: 1.7533, test_f1: 0.5702
 epoch: 85, train_loss: 0.3225, test_loss: 1.6988, test_f1: 0.6099
 epoch: 86, train_loss: 0.3316, test_loss: 1.6765, test_f1: 0.6194
 epoch: 87, train_loss: 0.3352, test_loss: 1.7203, test_f1: 0.6262
 epoch: 88, train_loss: 0.3447, test_loss: 1.6303, test_f1: 0.5944
 epoch: 89, train_loss: 0.3347, test_loss: 1.6186, test_f1: 0.6188
 epoch: 90, train_loss: 0.3256, test_loss: 1.6116, test_f1: 0.6196
 epoch: 91, train_loss: 0.3046, test_loss: 1.6818, test_f1: 0.6222
 epoch: 92, train_loss: 0.3210, test_loss: 1.8422, test_f1: 0.6158
 epoch: 93, train_loss: 0.3141, test_loss: 1.9402, test_f1: 0.6197
 epoch: 94, train_loss: 0.3007, test_loss: 2.0259, test_f1: 0.6158
 epoch: 95, train_loss: 0.3051, test_loss: 1.9167, test_f1: 0.5716
 epoch: 96, train_loss: 0.2932, test_loss: 1.9127, test_f1: 0.5851
 epoch: 97, train_loss: 0.2815, test_loss: 1.8091, test_f1: 0.6055
 epoch: 98, train_loss: 0.3076, test_loss: 1.9249, test_f1: 0.6217
 epoch: 99, train_loss: 0.2941, test_loss: 1.8757, test_f1: 0.6009
##################ITERATION #1 ****************************************
 epoch: 0, train_loss: 1.1975, test_loss: 1.2101, test_f1: 0.3800
 epoch: 1, train_loss: 1.0611, test_loss: 1.0836, test_f1: 0.5118
 epoch: 2, train_loss: 1.0027, test_loss: 1.0729, test_f1: 0.5445
 epoch: 3, train_loss: 0.9807, test_loss: 1.0261, test_f1: 0.5453
 epoch: 4, train_loss: 0.9515, test_loss: 1.0225, test_f1: 0.5575
 epoch: 5, train_loss: 0.9313, test_loss: 1.0332, test_f1: 0.5500
 epoch: 6, train_loss: 0.9261, test_loss: 1.0312, test_f1: 0.5565
 epoch: 7, train_loss: 0.9079, test_loss: 0.9964, test_f1: 0.5873
 epoch: 8, train_loss: 0.9007, test_loss: 1.0007, test_f1: 0.5605
 epoch: 9, train_loss: 0.8780, test_loss: 0.9614, test_f1: 0.5686
 epoch: 10, train_loss: 0.8653, test_loss: 1.1027, test_f1: 0.5220
 epoch: 11, train_loss: 0.8631, test_loss: 0.9890, test_f1: 0.5712
 epoch: 12, train_loss: 0.8577, test_loss: 0.9763, test_f1: 0.5865
 epoch: 13, train_loss: 0.8227, test_loss: 1.0431, test_f1: 0.5069
 epoch: 14, train_loss: 0.8161, test_loss: 1.0447, test_f1: 0.5427
 epoch: 15, train_loss: 0.8057, test_loss: 1.0127, test_f1: 0.5891
 epoch: 16, train_loss: 0.7978, test_loss: 1.1696, test_f1: 0.5133
 epoch: 17, train_loss: 0.7901, test_loss: 1.1559, test_f1: 0.5319
 epoch: 18, train_loss: 0.7562, test_loss: 1.3560, test_f1: 0.4776
 epoch: 19, train_loss: 0.7509, test_loss: 1.0790, test_f1: 0.5709
 epoch: 20, train_loss: 0.7360, test_loss: 1.0232, test_f1: 0.5884
 epoch: 21, train_loss: 0.7418, test_loss: 1.0610, test_f1: 0.5991
 epoch: 22, train_loss: 0.7141, test_loss: 1.0676, test_f1: 0.6200
 epoch: 23, train_loss: 0.7067, test_loss: 1.1583, test_f1: 0.5381
 epoch: 24, train_loss: 0.7102, test_loss: 1.1111, test_f1: 0.6507
 epoch: 25, train_loss: 0.6940, test_loss: 1.0752, test_f1: 0.5975
 epoch: 26, train_loss: 0.6638, test_loss: 1.1409, test_f1: 0.5677
 epoch: 27, train_loss: 0.6642, test_loss: 1.1515, test_f1: 0.5942
 epoch: 28, train_loss: 0.6458, test_loss: 1.2678, test_f1: 0.5638
 epoch: 29, train_loss: 0.6615, test_loss: 1.2319, test_f1: 0.5158
 epoch: 30, train_loss: 0.6281, test_loss: 1.1175, test_f1: 0.5805
 epoch: 31, train_loss: 0.6263, test_loss: 1.1466, test_f1: 0.5728
 epoch: 32, train_loss: 0.6469, test_loss: 1.2996, test_f1: 0.5564
 epoch: 33, train_loss: 0.6252, test_loss: 1.4638, test_f1: 0.4729
 epoch: 34, train_loss: 0.6466, test_loss: 1.2178, test_f1: 0.5809
 epoch: 35, train_loss: 0.5964, test_loss: 1.1763, test_f1: 0.6077
 epoch: 36, train_loss: 0.5992, test_loss: 1.2012, test_f1: 0.6112
 epoch: 37, train_loss: 0.5806, test_loss: 1.3415, test_f1: 0.5387
 epoch: 38, train_loss: 0.5929, test_loss: 1.3509, test_f1: 0.6021
 epoch: 39, train_loss: 0.5776, test_loss: 1.2121, test_f1: 0.6295
 epoch: 40, train_loss: 0.5735, test_loss: 1.3236, test_f1: 0.6118
 epoch: 41, train_loss: 0.5696, test_loss: 1.4182, test_f1: 0.5822
 epoch: 42, train_loss: 0.5687, test_loss: 1.5007, test_f1: 0.6019
 epoch: 43, train_loss: 0.5523, test_loss: 1.3413, test_f1: 0.6237
 epoch: 44, train_loss: 0.5662, test_loss: 1.3286, test_f1: 0.5840
 epoch: 45, train_loss: 0.5253, test_loss: 1.2995, test_f1: 0.6049
 epoch: 46, train_loss: 0.5202, test_loss: 1.4982, test_f1: 0.5909
 epoch: 47, train_loss: 0.5227, test_loss: 1.4499, test_f1: 0.6216
 epoch: 48, train_loss: 0.5335, test_loss: 1.3732, test_f1: 0.6060
 epoch: 49, train_loss: 0.5378, test_loss: 1.5284, test_f1: 0.5792
 epoch: 50, train_loss: 0.5168, test_loss: 1.6996, test_f1: 0.5213
 epoch: 51, train_loss: 0.4505, test_loss: 1.5262, test_f1: 0.5945
 epoch: 52, train_loss: 0.4475, test_loss: 1.5450, test_f1: 0.6072
 epoch: 53, train_loss: 0.4459, test_loss: 1.4984, test_f1: 0.6080
 epoch: 54, train_loss: 0.4414, test_loss: 1.5039, test_f1: 0.6115
 epoch: 55, train_loss: 0.4367, test_loss: 1.5289, test_f1: 0.6163
 epoch: 56, train_loss: 0.4470, test_loss: 1.5624, test_f1: 0.6204
 epoch: 57, train_loss: 0.4420, test_loss: 1.5694, test_f1: 0.6009
 epoch: 58, train_loss: 0.4336, test_loss: 1.6305, test_f1: 0.5971
 epoch: 59, train_loss: 0.4381, test_loss: 1.6324, test_f1: 0.6058
 epoch: 60, train_loss: 0.4216, test_loss: 1.6825, test_f1: 0.6023
 epoch: 61, train_loss: 0.4181, test_loss: 1.6797, test_f1: 0.5958
 epoch: 62, train_loss: 0.3876, test_loss: 1.6941, test_f1: 0.6059
 epoch: 63, train_loss: 0.4021, test_loss: 1.6741, test_f1: 0.6012
 epoch: 64, train_loss: 0.4247, test_loss: 1.7041, test_f1: 0.6055
 epoch: 65, train_loss: 0.3881, test_loss: 1.7456, test_f1: 0.5920
 epoch: 66, train_loss: 0.3909, test_loss: 1.8337, test_f1: 0.5924
 epoch: 67, train_loss: 0.3930, test_loss: 1.8213, test_f1: 0.5806
 epoch: 68, train_loss: 0.4071, test_loss: 1.8282, test_f1: 0.6069
 epoch: 69, train_loss: 0.3718, test_loss: 1.8579, test_f1: 0.5985
 epoch: 70, train_loss: 0.3971, test_loss: 1.8231, test_f1: 0.6010
 epoch: 71, train_loss: 0.3849, test_loss: 1.8070, test_f1: 0.6105
 epoch: 72, train_loss: 0.3903, test_loss: 1.7748, test_f1: 0.6077
 epoch: 73, train_loss: 0.3654, test_loss: 1.7901, test_f1: 0.5907
 epoch: 74, train_loss: 0.3704, test_loss: 1.8788, test_f1: 0.6076
 epoch: 75, train_loss: 0.3580, test_loss: 1.9650, test_f1: 0.5971
 epoch: 76, train_loss: 0.3598, test_loss: 2.0174, test_f1: 0.5969
 epoch: 77, train_loss: 0.3675, test_loss: 1.9186, test_f1: 0.6164
 epoch: 78, train_loss: 0.3368, test_loss: 2.0396, test_f1: 0.5919
 epoch: 79, train_loss: 0.3297, test_loss: 1.9842, test_f1: 0.6111
 epoch: 80, train_loss: 0.3441, test_loss: 2.0590, test_f1: 0.6054
 epoch: 81, train_loss: 0.3371, test_loss: 2.0352, test_f1: 0.6045
 epoch: 82, train_loss: 0.3335, test_loss: 2.1154, test_f1: 0.5942
 epoch: 83, train_loss: 0.3710, test_loss: 1.9164, test_f1: 0.6248
 epoch: 84, train_loss: 0.3278, test_loss: 2.1978, test_f1: 0.5904
 epoch: 85, train_loss: 0.3276, test_loss: 2.1508, test_f1: 0.5770
 epoch: 86, train_loss: 0.3264, test_loss: 2.1181, test_f1: 0.5956
 epoch: 87, train_loss: 0.3132, test_loss: 2.1841, test_f1: 0.5759
 epoch: 88, train_loss: 0.3382, test_loss: 2.1113, test_f1: 0.6013
 epoch: 89, train_loss: 0.3116, test_loss: 2.1592, test_f1: 0.6090
 epoch: 90, train_loss: 0.2994, test_loss: 2.3608, test_f1: 0.6107
 epoch: 91, train_loss: 0.3153, test_loss: 2.2945, test_f1: 0.5912
 epoch: 92, train_loss: 0.3160, test_loss: 2.2505, test_f1: 0.5680
 epoch: 93, train_loss: 0.2986, test_loss: 2.1628, test_f1: 0.5994
 epoch: 94, train_loss: 0.2912, test_loss: 2.0372, test_f1: 0.6237
 epoch: 95, train_loss: 0.2853, test_loss: 2.3936, test_f1: 0.6063
 epoch: 96, train_loss: 0.2963, test_loss: 2.2225, test_f1: 0.5934
 epoch: 97, train_loss: 0.2992, test_loss: 2.3008, test_f1: 0.5937
 epoch: 98, train_loss: 0.3283, test_loss: 2.2852, test_f1: 0.5617
 epoch: 99, train_loss: 0.2927, test_loss: 2.3747, test_f1: 0.6005
##################ITERATION #2 ****************************************
 epoch: 0, train_loss: 1.1859, test_loss: 1.2529, test_f1: 0.3623
 epoch: 1, train_loss: 1.0555, test_loss: 1.0976, test_f1: 0.4722
 epoch: 2, train_loss: 1.0143, test_loss: 1.0434, test_f1: 0.5227
 epoch: 3, train_loss: 0.9811, test_loss: 1.0413, test_f1: 0.5291
 epoch: 4, train_loss: 0.9536, test_loss: 1.0290, test_f1: 0.5298
 epoch: 5, train_loss: 0.9225, test_loss: 0.9967, test_f1: 0.5333
 epoch: 6, train_loss: 0.9052, test_loss: 0.9926, test_f1: 0.5760
 epoch: 7, train_loss: 0.9164, test_loss: 1.0349, test_f1: 0.5816
 epoch: 8, train_loss: 0.8868, test_loss: 0.9827, test_f1: 0.5935
 epoch: 9, train_loss: 0.8634, test_loss: 0.9832, test_f1: 0.5784
 epoch: 10, train_loss: 0.8357, test_loss: 0.9811, test_f1: 0.5846
 epoch: 11, train_loss: 0.8199, test_loss: 0.9880, test_f1: 0.5692
 epoch: 12, train_loss: 0.8139, test_loss: 1.0774, test_f1: 0.5541
 epoch: 13, train_loss: 0.8084, test_loss: 0.9923, test_f1: 0.6016
 epoch: 14, train_loss: 0.7715, test_loss: 1.0992, test_f1: 0.5437
 epoch: 15, train_loss: 0.7792, test_loss: 1.0314, test_f1: 0.5861
 epoch: 16, train_loss: 0.7662, test_loss: 1.0389, test_f1: 0.5899
 epoch: 17, train_loss: 0.7555, test_loss: 1.0151, test_f1: 0.6226
 epoch: 18, train_loss: 0.7256, test_loss: 1.2292, test_f1: 0.5223
 epoch: 19, train_loss: 0.7238, test_loss: 1.0587, test_f1: 0.6061
 epoch: 20, train_loss: 0.7413, test_loss: 1.1468, test_f1: 0.5954
 epoch: 21, train_loss: 0.7194, test_loss: 1.0763, test_f1: 0.6274
 epoch: 22, train_loss: 0.7147, test_loss: 1.0236, test_f1: 0.6096
 epoch: 23, train_loss: 0.6713, test_loss: 1.0580, test_f1: 0.5959
 epoch: 24, train_loss: 0.6780, test_loss: 0.9997, test_f1: 0.6395
 epoch: 25, train_loss: 0.6853, test_loss: 1.1571, test_f1: 0.5807
 epoch: 26, train_loss: 0.6652, test_loss: 1.2018, test_f1: 0.5417
 epoch: 27, train_loss: 0.6738, test_loss: 1.0631, test_f1: 0.6074
 epoch: 28, train_loss: 0.6423, test_loss: 1.0963, test_f1: 0.5962
 epoch: 29, train_loss: 0.6631, test_loss: 1.0288, test_f1: 0.6157
 epoch: 30, train_loss: 0.6739, test_loss: 1.1099, test_f1: 0.5987
 epoch: 31, train_loss: 0.6473, test_loss: 1.1621, test_f1: 0.5683
 epoch: 32, train_loss: 0.6308, test_loss: 1.1370, test_f1: 0.6072
 epoch: 33, train_loss: 0.6045, test_loss: 1.0803, test_f1: 0.6309
 epoch: 34, train_loss: 0.6075, test_loss: 1.1935, test_f1: 0.5885
 epoch: 35, train_loss: 0.6059, test_loss: 1.0568, test_f1: 0.6019
 epoch: 36, train_loss: 0.6498, test_loss: 1.0944, test_f1: 0.6029
 epoch: 37, train_loss: 0.6011, test_loss: 1.1624, test_f1: 0.6347
 epoch: 38, train_loss: 0.5915, test_loss: 1.2178, test_f1: 0.5916
 epoch: 39, train_loss: 0.6130, test_loss: 1.2100, test_f1: 0.6306
 epoch: 40, train_loss: 0.5829, test_loss: 1.0947, test_f1: 0.6201
 epoch: 41, train_loss: 0.5830, test_loss: 1.2615, test_f1: 0.6114
 epoch: 42, train_loss: 0.5712, test_loss: 1.1063, test_f1: 0.6444
 epoch: 43, train_loss: 0.5558, test_loss: 1.1532, test_f1: 0.6614
 epoch: 44, train_loss: 0.5710, test_loss: 1.1371, test_f1: 0.6285
 epoch: 45, train_loss: 0.5753, test_loss: 1.1367, test_f1: 0.6256
 epoch: 46, train_loss: 0.5230, test_loss: 1.1497, test_f1: 0.6294
 epoch: 47, train_loss: 0.5212, test_loss: 1.2508, test_f1: 0.6150
 epoch: 48, train_loss: 0.5230, test_loss: 1.1910, test_f1: 0.6336
 epoch: 49, train_loss: 0.5751, test_loss: 1.3412, test_f1: 0.5916
 epoch: 50, train_loss: 0.5136, test_loss: 1.1756, test_f1: 0.5989
 epoch: 51, train_loss: 0.4752, test_loss: 1.1551, test_f1: 0.6380
 epoch: 52, train_loss: 0.4659, test_loss: 1.2151, test_f1: 0.6451
 epoch: 53, train_loss: 0.4414, test_loss: 1.2514, test_f1: 0.6372
 epoch: 54, train_loss: 0.4653, test_loss: 1.2810, test_f1: 0.6517
 epoch: 55, train_loss: 0.4455, test_loss: 1.2795, test_f1: 0.6394
 epoch: 56, train_loss: 0.4500, test_loss: 1.2569, test_f1: 0.6314
 epoch: 57, train_loss: 0.4282, test_loss: 1.2411, test_f1: 0.6220
 epoch: 58, train_loss: 0.4080, test_loss: 1.2473, test_f1: 0.6406
 epoch: 59, train_loss: 0.4291, test_loss: 1.3823, test_f1: 0.6437
 epoch: 60, train_loss: 0.4092, test_loss: 1.2926, test_f1: 0.6281
 epoch: 61, train_loss: 0.4154, test_loss: 1.4896, test_f1: 0.5967
 epoch: 62, train_loss: 0.4171, test_loss: 1.3330, test_f1: 0.6279
 epoch: 63, train_loss: 0.4060, test_loss: 1.4417, test_f1: 0.6262
 epoch: 64, train_loss: 0.3984, test_loss: 1.3689, test_f1: 0.6223
 epoch: 65, train_loss: 0.4174, test_loss: 1.3906, test_f1: 0.6273
 epoch: 66, train_loss: 0.4150, test_loss: 1.3978, test_f1: 0.6281
 epoch: 67, train_loss: 0.4039, test_loss: 1.4576, test_f1: 0.6379
 epoch: 68, train_loss: 0.4120, test_loss: 1.3789, test_f1: 0.6302
 epoch: 69, train_loss: 0.3993, test_loss: 1.4816, test_f1: 0.6103
 epoch: 70, train_loss: 0.3929, test_loss: 1.4089, test_f1: 0.6399
 epoch: 71, train_loss: 0.3808, test_loss: 1.5290, test_f1: 0.6081
 epoch: 72, train_loss: 0.3797, test_loss: 1.5014, test_f1: 0.6374
 epoch: 73, train_loss: 0.3729, test_loss: 1.4632, test_f1: 0.6440
 epoch: 74, train_loss: 0.3693, test_loss: 1.6873, test_f1: 0.6189
 epoch: 75, train_loss: 0.3777, test_loss: 1.4362, test_f1: 0.6345
 epoch: 76, train_loss: 0.3483, test_loss: 1.5594, test_f1: 0.6344
 epoch: 77, train_loss: 0.3511, test_loss: 1.5354, test_f1: 0.6342
 epoch: 78, train_loss: 0.3768, test_loss: 1.6185, test_f1: 0.6015
 epoch: 79, train_loss: 0.3577, test_loss: 1.4995, test_f1: 0.6392
 epoch: 80, train_loss: 0.3574, test_loss: 1.4655, test_f1: 0.6323
 epoch: 81, train_loss: 0.3401, test_loss: 1.6594, test_f1: 0.6184
 epoch: 82, train_loss: 0.3646, test_loss: 1.6624, test_f1: 0.6193
 epoch: 83, train_loss: 0.3614, test_loss: 1.5249, test_f1: 0.6147
 epoch: 84, train_loss: 0.3670, test_loss: 1.6549, test_f1: 0.6247
 epoch: 85, train_loss: 0.3300, test_loss: 1.7318, test_f1: 0.6107
 epoch: 86, train_loss: 0.3482, test_loss: 1.6566, test_f1: 0.6234
 epoch: 87, train_loss: 0.3163, test_loss: 1.8045, test_f1: 0.5931
 epoch: 88, train_loss: 0.3312, test_loss: 1.6482, test_f1: 0.6289
 epoch: 89, train_loss: 0.3255, test_loss: 1.7636, test_f1: 0.6106
 epoch: 90, train_loss: 0.3177, test_loss: 1.9032, test_f1: 0.6115
 epoch: 91, train_loss: 0.3582, test_loss: 1.8048, test_f1: 0.6196
 epoch: 92, train_loss: 0.3194, test_loss: 1.8660, test_f1: 0.5977
 epoch: 93, train_loss: 0.3147, test_loss: 1.9201, test_f1: 0.6020
 epoch: 94, train_loss: 0.3209, test_loss: 1.8409, test_f1: 0.5793
 epoch: 95, train_loss: 0.3259, test_loss: 1.8098, test_f1: 0.6044
 epoch: 96, train_loss: 0.2902, test_loss: 1.7196, test_f1: 0.5958
 epoch: 97, train_loss: 0.2961, test_loss: 1.9304, test_f1: 0.5892
 epoch: 98, train_loss: 0.3353, test_loss: 1.9034, test_f1: 0.5728
 epoch: 99, train_loss: 0.3236, test_loss: 1.7082, test_f1: 0.5985
##################ITERATION #3 ****************************************
 epoch: 0, train_loss: 1.1815, test_loss: 1.2484, test_f1: 0.2467
 epoch: 1, train_loss: 1.0388, test_loss: 1.0637, test_f1: 0.4964
 epoch: 2, train_loss: 0.9864, test_loss: 1.0423, test_f1: 0.5127
 epoch: 3, train_loss: 0.9656, test_loss: 1.0343, test_f1: 0.5110
 epoch: 4, train_loss: 0.9548, test_loss: 1.0360, test_f1: 0.5023
 epoch: 5, train_loss: 0.9248, test_loss: 1.0204, test_f1: 0.5261
 epoch: 6, train_loss: 0.9116, test_loss: 1.0343, test_f1: 0.5211
 epoch: 7, train_loss: 0.8889, test_loss: 0.9880, test_f1: 0.5515
 epoch: 8, train_loss: 0.8891, test_loss: 0.9881, test_f1: 0.5763
 epoch: 9, train_loss: 0.8798, test_loss: 1.0145, test_f1: 0.5114
 epoch: 10, train_loss: 0.8672, test_loss: 1.0123, test_f1: 0.5513
 epoch: 11, train_loss: 0.8590, test_loss: 1.0453, test_f1: 0.5639
 epoch: 12, train_loss: 0.8189, test_loss: 1.0735, test_f1: 0.5662
 epoch: 13, train_loss: 0.8420, test_loss: 1.0421, test_f1: 0.5711
 epoch: 14, train_loss: 0.8236, test_loss: 1.0404, test_f1: 0.5493
 epoch: 15, train_loss: 0.8043, test_loss: 1.0990, test_f1: 0.5420
 epoch: 16, train_loss: 0.7859, test_loss: 1.1109, test_f1: 0.5457
 epoch: 17, train_loss: 0.7832, test_loss: 1.0652, test_f1: 0.5094
 epoch: 18, train_loss: 0.7697, test_loss: 1.1493, test_f1: 0.4961
 epoch: 19, train_loss: 0.7524, test_loss: 1.3387, test_f1: 0.5255
 epoch: 20, train_loss: 0.7405, test_loss: 1.2267, test_f1: 0.4836
 epoch: 21, train_loss: 0.7135, test_loss: 1.0964, test_f1: 0.5468
 epoch: 22, train_loss: 0.7218, test_loss: 1.3409, test_f1: 0.5058
 epoch: 23, train_loss: 0.7134, test_loss: 1.1660, test_f1: 0.5436
 epoch: 24, train_loss: 0.7180, test_loss: 1.3165, test_f1: 0.5623
 epoch: 25, train_loss: 0.7038, test_loss: 1.1264, test_f1: 0.5271
 epoch: 26, train_loss: 0.7004, test_loss: 1.2234, test_f1: 0.5669
 epoch: 27, train_loss: 0.6873, test_loss: 1.4386, test_f1: 0.5484
 epoch: 28, train_loss: 0.6560, test_loss: 1.2505, test_f1: 0.5471
 epoch: 29, train_loss: 0.6739, test_loss: 1.3324, test_f1: 0.4591
 epoch: 30, train_loss: 0.6539, test_loss: 1.1748, test_f1: 0.5422
 epoch: 31, train_loss: 0.6664, test_loss: 1.3507, test_f1: 0.5314
 epoch: 32, train_loss: 0.6401, test_loss: 1.3363, test_f1: 0.5345
 epoch: 33, train_loss: 0.6261, test_loss: 1.4994, test_f1: 0.4959
 epoch: 34, train_loss: 0.6722, test_loss: 1.3195, test_f1: 0.5889
 epoch: 35, train_loss: 0.6413, test_loss: 1.1990, test_f1: 0.5607
 epoch: 36, train_loss: 0.6184, test_loss: 1.3480, test_f1: 0.5674
 epoch: 37, train_loss: 0.5888, test_loss: 1.5143, test_f1: 0.4968
 epoch: 38, train_loss: 0.5990, test_loss: 1.5072, test_f1: 0.5672
 epoch: 39, train_loss: 0.6043, test_loss: 1.4979, test_f1: 0.5702
 epoch: 40, train_loss: 0.5788, test_loss: 1.2671, test_f1: 0.5520
 epoch: 41, train_loss: 0.5865, test_loss: 1.2202, test_f1: 0.6029
 epoch: 42, train_loss: 0.5703, test_loss: 1.3870, test_f1: 0.6100
 epoch: 43, train_loss: 0.5731, test_loss: 1.3850, test_f1: 0.5858
 epoch: 44, train_loss: 0.5730, test_loss: 1.6120, test_f1: 0.5315
 epoch: 45, train_loss: 0.5570, test_loss: 1.6634, test_f1: 0.5771
 epoch: 46, train_loss: 0.5648, test_loss: 1.6005, test_f1: 0.5541
 epoch: 47, train_loss: 0.5711, test_loss: 1.4899, test_f1: 0.5418
 epoch: 48, train_loss: 0.5419, test_loss: 1.7271, test_f1: 0.5638
 epoch: 49, train_loss: 0.5266, test_loss: 1.5262, test_f1: 0.5866
 epoch: 50, train_loss: 0.5334, test_loss: 1.6767, test_f1: 0.5830
 epoch: 51, train_loss: 0.4933, test_loss: 1.5420, test_f1: 0.6081
 epoch: 52, train_loss: 0.5010, test_loss: 1.6293, test_f1: 0.5763
 epoch: 53, train_loss: 0.4698, test_loss: 1.5077, test_f1: 0.6127
 epoch: 54, train_loss: 0.4549, test_loss: 1.5713, test_f1: 0.5828
 epoch: 55, train_loss: 0.4582, test_loss: 1.5091, test_f1: 0.5777
 epoch: 56, train_loss: 0.4213, test_loss: 1.5771, test_f1: 0.5770
 epoch: 57, train_loss: 0.4322, test_loss: 1.7500, test_f1: 0.5636
 epoch: 58, train_loss: 0.4761, test_loss: 1.6412, test_f1: 0.5829
 epoch: 59, train_loss: 0.4466, test_loss: 1.6421, test_f1: 0.5867
 epoch: 60, train_loss: 0.4377, test_loss: 1.5719, test_f1: 0.6152
 epoch: 61, train_loss: 0.4272, test_loss: 1.6766, test_f1: 0.5971
 epoch: 62, train_loss: 0.4235, test_loss: 1.6807, test_f1: 0.5996
 epoch: 63, train_loss: 0.4302, test_loss: 1.7872, test_f1: 0.5858
 epoch: 64, train_loss: 0.4165, test_loss: 1.7465, test_f1: 0.6103
 epoch: 65, train_loss: 0.3914, test_loss: 1.8693, test_f1: 0.5774
 epoch: 66, train_loss: 0.3977, test_loss: 1.8104, test_f1: 0.6058
 epoch: 67, train_loss: 0.4014, test_loss: 1.7639, test_f1: 0.5834
 epoch: 68, train_loss: 0.4077, test_loss: 1.9289, test_f1: 0.5985
 epoch: 69, train_loss: 0.4072, test_loss: 1.7227, test_f1: 0.5986
 epoch: 70, train_loss: 0.3997, test_loss: 1.7141, test_f1: 0.5897
 epoch: 71, train_loss: 0.3721, test_loss: 1.9543, test_f1: 0.5820
 epoch: 72, train_loss: 0.3750, test_loss: 1.8334, test_f1: 0.5738
 epoch: 73, train_loss: 0.4019, test_loss: 1.8354, test_f1: 0.5634
 epoch: 74, train_loss: 0.3722, test_loss: 1.7518, test_f1: 0.5595
 epoch: 75, train_loss: 0.3701, test_loss: 1.8163, test_f1: 0.5899
 epoch: 76, train_loss: 0.3856, test_loss: 1.6886, test_f1: 0.5954
 epoch: 77, train_loss: 0.3581, test_loss: 1.7784, test_f1: 0.5916
 epoch: 78, train_loss: 0.3730, test_loss: 1.6512, test_f1: 0.5993
 epoch: 79, train_loss: 0.3543, test_loss: 1.7214, test_f1: 0.5843
 epoch: 80, train_loss: 0.3508, test_loss: 1.8796, test_f1: 0.5787
 epoch: 81, train_loss: 0.3815, test_loss: 1.9530, test_f1: 0.5846
 epoch: 82, train_loss: 0.3530, test_loss: 1.8168, test_f1: 0.5884
 epoch: 83, train_loss: 0.3614, test_loss: 1.7422, test_f1: 0.5920
 epoch: 84, train_loss: 0.3611, test_loss: 1.8256, test_f1: 0.5967
 epoch: 85, train_loss: 0.3677, test_loss: 1.8402, test_f1: 0.6212
 epoch: 86, train_loss: 0.3732, test_loss: 1.9786, test_f1: 0.5834
 epoch: 87, train_loss: 0.3413, test_loss: 1.9441, test_f1: 0.5986
 epoch: 88, train_loss: 0.3409, test_loss: 1.9259, test_f1: 0.6034
 epoch: 89, train_loss: 0.3570, test_loss: 2.0129, test_f1: 0.5886
 epoch: 90, train_loss: 0.3339, test_loss: 2.1095, test_f1: 0.5489
 epoch: 91, train_loss: 0.3159, test_loss: 2.0666, test_f1: 0.5839
 epoch: 92, train_loss: 0.3298, test_loss: 2.0460, test_f1: 0.6018
 epoch: 93, train_loss: 0.3371, test_loss: 2.0029, test_f1: 0.5684
 epoch: 94, train_loss: 0.3368, test_loss: 1.9734, test_f1: 0.5864
 epoch: 95, train_loss: 0.3212, test_loss: 2.0469, test_f1: 0.5900
 epoch: 96, train_loss: 0.3199, test_loss: 2.2335, test_f1: 0.5664
 epoch: 97, train_loss: 0.3090, test_loss: 2.2400, test_f1: 0.6049
 epoch: 98, train_loss: 0.3064, test_loss: 2.1509, test_f1: 0.5754
 epoch: 99, train_loss: 0.3209, test_loss: 2.1197, test_f1: 0.6002
##################ITERATION #4 ****************************************
 epoch: 0, train_loss: 1.2938, test_loss: 1.4639, test_f1: 0.3295
 epoch: 1, train_loss: 1.0723, test_loss: 1.0808, test_f1: 0.4645
 epoch: 2, train_loss: 1.0133, test_loss: 1.0939, test_f1: 0.5206
 epoch: 3, train_loss: 0.9704, test_loss: 1.0987, test_f1: 0.5283
 epoch: 4, train_loss: 0.9773, test_loss: 1.0311, test_f1: 0.5059
 epoch: 5, train_loss: 0.9354, test_loss: 1.0409, test_f1: 0.5014
 epoch: 6, train_loss: 0.9437, test_loss: 1.0624, test_f1: 0.5224
 epoch: 7, train_loss: 0.9239, test_loss: 1.0746, test_f1: 0.5562
 epoch: 8, train_loss: 0.8949, test_loss: 1.0287, test_f1: 0.5717
 epoch: 9, train_loss: 0.8665, test_loss: 0.9868, test_f1: 0.5696
 epoch: 10, train_loss: 0.8566, test_loss: 0.9940, test_f1: 0.5519
 epoch: 11, train_loss: 0.8525, test_loss: 1.0096, test_f1: 0.5525
 epoch: 12, train_loss: 0.8260, test_loss: 1.0405, test_f1: 0.5556
 epoch: 13, train_loss: 0.8068, test_loss: 0.9877, test_f1: 0.5751
 epoch: 14, train_loss: 0.7989, test_loss: 1.0045, test_f1: 0.5691
 epoch: 15, train_loss: 0.7907, test_loss: 0.9775, test_f1: 0.5742
 epoch: 16, train_loss: 0.7634, test_loss: 0.9783, test_f1: 0.5924
 epoch: 17, train_loss: 0.7808, test_loss: 0.9907, test_f1: 0.6130
 epoch: 18, train_loss: 0.7489, test_loss: 0.9984, test_f1: 0.5945
 epoch: 19, train_loss: 0.7270, test_loss: 1.0045, test_f1: 0.6312
 epoch: 20, train_loss: 0.7089, test_loss: 1.0231, test_f1: 0.6032
 epoch: 21, train_loss: 0.7299, test_loss: 1.0069, test_f1: 0.6139
 epoch: 22, train_loss: 0.6896, test_loss: 1.0411, test_f1: 0.5932
 epoch: 23, train_loss: 0.7019, test_loss: 1.1340, test_f1: 0.5820
 epoch: 24, train_loss: 0.7070, test_loss: 1.0302, test_f1: 0.6005
 epoch: 25, train_loss: 0.6739, test_loss: 1.0720, test_f1: 0.5996
 epoch: 26, train_loss: 0.6839, test_loss: 1.0371, test_f1: 0.6290
 epoch: 27, train_loss: 0.6633, test_loss: 1.0972, test_f1: 0.5767
 epoch: 28, train_loss: 0.6902, test_loss: 1.0681, test_f1: 0.5682
 epoch: 29, train_loss: 0.6497, test_loss: 1.1299, test_f1: 0.6053
 epoch: 30, train_loss: 0.6326, test_loss: 1.1050, test_f1: 0.6068
 epoch: 31, train_loss: 0.6277, test_loss: 1.0794, test_f1: 0.5895
 epoch: 32, train_loss: 0.6239, test_loss: 1.1642, test_f1: 0.5823
 epoch: 33, train_loss: 0.6252, test_loss: 1.0722, test_f1: 0.5938
 epoch: 34, train_loss: 0.6251, test_loss: 1.1079, test_f1: 0.5986
 epoch: 35, train_loss: 0.6065, test_loss: 1.0903, test_f1: 0.6187
 epoch: 36, train_loss: 0.5826, test_loss: 1.1134, test_f1: 0.6252
 epoch: 37, train_loss: 0.5999, test_loss: 1.1784, test_f1: 0.5829
 epoch: 38, train_loss: 0.5798, test_loss: 1.1676, test_f1: 0.6070
 epoch: 39, train_loss: 0.5735, test_loss: 1.1528, test_f1: 0.6357
 epoch: 40, train_loss: 0.5961, test_loss: 1.3379, test_f1: 0.5576
 epoch: 41, train_loss: 0.5687, test_loss: 1.2938, test_f1: 0.5945
 epoch: 42, train_loss: 0.5523, test_loss: 1.2767, test_f1: 0.6068
 epoch: 43, train_loss: 0.5473, test_loss: 1.2378, test_f1: 0.6064
 epoch: 44, train_loss: 0.5483, test_loss: 1.2326, test_f1: 0.6012
 epoch: 45, train_loss: 0.5443, test_loss: 1.2377, test_f1: 0.6177
 epoch: 46, train_loss: 0.5572, test_loss: 1.2400, test_f1: 0.6398
 epoch: 47, train_loss: 0.5299, test_loss: 1.3153, test_f1: 0.6022
 epoch: 48, train_loss: 0.5129, test_loss: 1.2759, test_f1: 0.6230
 epoch: 49, train_loss: 0.5277, test_loss: 1.3421, test_f1: 0.5856
 epoch: 50, train_loss: 0.5311, test_loss: 1.3639, test_f1: 0.5838
 epoch: 51, train_loss: 0.5023, test_loss: 1.3944, test_f1: 0.6201
 epoch: 52, train_loss: 0.4364, test_loss: 1.3487, test_f1: 0.6247
 epoch: 53, train_loss: 0.4421, test_loss: 1.3739, test_f1: 0.6186
 epoch: 54, train_loss: 0.4303, test_loss: 1.3426, test_f1: 0.6179
 epoch: 55, train_loss: 0.4256, test_loss: 1.4059, test_f1: 0.6428
 epoch: 56, train_loss: 0.4163, test_loss: 1.4246, test_f1: 0.6168
 epoch: 57, train_loss: 0.4311, test_loss: 1.4145, test_f1: 0.6589
 epoch: 58, train_loss: 0.4261, test_loss: 1.4748, test_f1: 0.6455
 epoch: 59, train_loss: 0.3978, test_loss: 1.4598, test_f1: 0.6344
 epoch: 60, train_loss: 0.4100, test_loss: 1.4632, test_f1: 0.6293
 epoch: 61, train_loss: 0.4049, test_loss: 1.5029, test_f1: 0.6517
 epoch: 62, train_loss: 0.4102, test_loss: 1.5981, test_f1: 0.6678
 epoch: 63, train_loss: 0.4060, test_loss: 1.5320, test_f1: 0.6403
 epoch: 64, train_loss: 0.4063, test_loss: 1.5684, test_f1: 0.5973
 epoch: 65, train_loss: 0.3518, test_loss: 1.5546, test_f1: 0.6208
 epoch: 66, train_loss: 0.4297, test_loss: 1.4992, test_f1: 0.6360
 epoch: 67, train_loss: 0.4073, test_loss: 1.5926, test_f1: 0.6264
 epoch: 68, train_loss: 0.3538, test_loss: 1.5553, test_f1: 0.6227
 epoch: 69, train_loss: 0.3605, test_loss: 1.5743, test_f1: 0.6422
 epoch: 70, train_loss: 0.3794, test_loss: 1.7189, test_f1: 0.6188
 epoch: 71, train_loss: 0.3611, test_loss: 1.6688, test_f1: 0.5949
 epoch: 72, train_loss: 0.3562, test_loss: 1.6800, test_f1: 0.6376
 epoch: 73, train_loss: 0.3271, test_loss: 1.6871, test_f1: 0.6286
 epoch: 74, train_loss: 0.3507, test_loss: 1.7217, test_f1: 0.6483
 epoch: 75, train_loss: 0.3428, test_loss: 1.7341, test_f1: 0.6511
 epoch: 76, train_loss: 0.3577, test_loss: 1.8145, test_f1: 0.5881
 epoch: 77, train_loss: 0.3310, test_loss: 1.8291, test_f1: 0.6329
 epoch: 78, train_loss: 0.3556, test_loss: 1.8203, test_f1: 0.6129
 epoch: 79, train_loss: 0.3139, test_loss: 1.8858, test_f1: 0.6499
 epoch: 80, train_loss: 0.3341, test_loss: 1.9534, test_f1: 0.6459
 epoch: 81, train_loss: 0.3402, test_loss: 1.9310, test_f1: 0.6164
 epoch: 82, train_loss: 0.3378, test_loss: 1.9009, test_f1: 0.6359
 epoch: 83, train_loss: 0.3226, test_loss: 2.0482, test_f1: 0.5910
 epoch: 84, train_loss: 0.3250, test_loss: 1.8760, test_f1: 0.6198
 epoch: 85, train_loss: 0.3163, test_loss: 2.0428, test_f1: 0.6163
 epoch: 86, train_loss: 0.3393, test_loss: 2.0500, test_f1: 0.5927
 epoch: 87, train_loss: 0.3085, test_loss: 2.0231, test_f1: 0.6308
 epoch: 88, train_loss: 0.2978, test_loss: 1.9134, test_f1: 0.6243
 epoch: 89, train_loss: 0.3241, test_loss: 2.1084, test_f1: 0.6041
 epoch: 90, train_loss: 0.2984, test_loss: 2.0813, test_f1: 0.5955
 epoch: 91, train_loss: 0.3095, test_loss: 2.0337, test_f1: 0.6291
 epoch: 92, train_loss: 0.3048, test_loss: 2.1258, test_f1: 0.6353
 epoch: 93, train_loss: 0.2913, test_loss: 2.0071, test_f1: 0.6464
 epoch: 94, train_loss: 0.3076, test_loss: 2.1269, test_f1: 0.6156
 epoch: 95, train_loss: 0.3061, test_loss: 2.1635, test_f1: 0.6283
 epoch: 96, train_loss: 0.3152, test_loss: 2.0518, test_f1: 0.6173
 epoch: 97, train_loss: 0.3068, test_loss: 2.0955, test_f1: 0.6346
 epoch: 98, train_loss: 0.3314, test_loss: 2.1041, test_f1: 0.6340
 epoch: 99, train_loss: 0.2879, test_loss: 2.1468, test_f1: 0.6176
##################ITERATION #5 ****************************************
 epoch: 0, train_loss: 1.2883, test_loss: 1.2780, test_f1: 0.2318
 epoch: 1, train_loss: 1.0616, test_loss: 1.0531, test_f1: 0.5348
 epoch: 2, train_loss: 0.9946, test_loss: 1.0373, test_f1: 0.5376
 epoch: 3, train_loss: 0.9620, test_loss: 1.0019, test_f1: 0.5443
 epoch: 4, train_loss: 0.9477, test_loss: 1.0244, test_f1: 0.5202
 epoch: 5, train_loss: 0.9129, test_loss: 1.0286, test_f1: 0.5261
 epoch: 6, train_loss: 0.8852, test_loss: 1.0132, test_f1: 0.5146
 epoch: 7, train_loss: 0.8743, test_loss: 1.0001, test_f1: 0.5691
 epoch: 8, train_loss: 0.8552, test_loss: 1.0008, test_f1: 0.5264
 epoch: 9, train_loss: 0.8362, test_loss: 0.9759, test_f1: 0.5703
 epoch: 10, train_loss: 0.8137, test_loss: 1.0115, test_f1: 0.5666
 epoch: 11, train_loss: 0.8086, test_loss: 1.0002, test_f1: 0.5461
 epoch: 12, train_loss: 0.7789, test_loss: 1.1750, test_f1: 0.5210
 epoch: 13, train_loss: 0.7899, test_loss: 1.0292, test_f1: 0.5246
 epoch: 14, train_loss: 0.7894, test_loss: 1.0052, test_f1: 0.5886
 epoch: 15, train_loss: 0.7697, test_loss: 1.0346, test_f1: 0.5749
 epoch: 16, train_loss: 0.7445, test_loss: 0.9899, test_f1: 0.6073
 epoch: 17, train_loss: 0.7443, test_loss: 1.0301, test_f1: 0.5730
 epoch: 18, train_loss: 0.7267, test_loss: 1.1142, test_f1: 0.5682
 epoch: 19, train_loss: 0.7431, test_loss: 1.0554, test_f1: 0.5558
 epoch: 20, train_loss: 0.7351, test_loss: 1.0300, test_f1: 0.5697
 epoch: 21, train_loss: 0.7185, test_loss: 0.9802, test_f1: 0.5916
 epoch: 22, train_loss: 0.6829, test_loss: 1.0189, test_f1: 0.5855
 epoch: 23, train_loss: 0.6973, test_loss: 1.0470, test_f1: 0.5574
 epoch: 24, train_loss: 0.6928, test_loss: 1.0713, test_f1: 0.6073
 epoch: 25, train_loss: 0.6614, test_loss: 1.0285, test_f1: 0.5903
 epoch: 26, train_loss: 0.6702, test_loss: 1.0693, test_f1: 0.5925
 epoch: 27, train_loss: 0.6593, test_loss: 1.0762, test_f1: 0.5967
 epoch: 28, train_loss: 0.6607, test_loss: 1.0235, test_f1: 0.6175
 epoch: 29, train_loss: 0.6674, test_loss: 1.0939, test_f1: 0.5834
 epoch: 30, train_loss: 0.6324, test_loss: 1.1572, test_f1: 0.5862
 epoch: 31, train_loss: 0.6605, test_loss: 1.0099, test_f1: 0.6067
 epoch: 32, train_loss: 0.6488, test_loss: 1.1107, test_f1: 0.5739
 epoch: 33, train_loss: 0.6060, test_loss: 1.1601, test_f1: 0.5824
 epoch: 34, train_loss: 0.6311, test_loss: 1.1001, test_f1: 0.5967
 epoch: 35, train_loss: 0.6063, test_loss: 1.0771, test_f1: 0.6257
 epoch: 36, train_loss: 0.5979, test_loss: 1.1573, test_f1: 0.6247
 epoch: 37, train_loss: 0.5664, test_loss: 1.1609, test_f1: 0.5881
 epoch: 38, train_loss: 0.6030, test_loss: 1.1895, test_f1: 0.5546
 epoch: 39, train_loss: 0.6182, test_loss: 1.1762, test_f1: 0.5668
 epoch: 40, train_loss: 0.5851, test_loss: 1.1790, test_f1: 0.5724
 epoch: 41, train_loss: 0.5815, test_loss: 1.1096, test_f1: 0.5671
 epoch: 42, train_loss: 0.5825, test_loss: 1.1380, test_f1: 0.5891
 epoch: 43, train_loss: 0.5401, test_loss: 1.3270, test_f1: 0.5649
 epoch: 44, train_loss: 0.5645, test_loss: 1.1714, test_f1: 0.5953
 epoch: 45, train_loss: 0.5696, test_loss: 1.1823, test_f1: 0.5825
 epoch: 46, train_loss: 0.5521, test_loss: 1.2109, test_f1: 0.6011
 epoch: 47, train_loss: 0.5666, test_loss: 1.2106, test_f1: 0.6012
 epoch: 48, train_loss: 0.5742, test_loss: 1.1626, test_f1: 0.5951
 epoch: 49, train_loss: 0.5550, test_loss: 1.2238, test_f1: 0.5886
 epoch: 50, train_loss: 0.5335, test_loss: 1.1656, test_f1: 0.6410
 epoch: 51, train_loss: 0.5001, test_loss: 1.2153, test_f1: 0.6297
 epoch: 52, train_loss: 0.4690, test_loss: 1.2622, test_f1: 0.6190
 epoch: 53, train_loss: 0.4600, test_loss: 1.2978, test_f1: 0.6138
 epoch: 54, train_loss: 0.4861, test_loss: 1.3456, test_f1: 0.6194
 epoch: 55, train_loss: 0.4535, test_loss: 1.3268, test_f1: 0.6349
 epoch: 56, train_loss: 0.4502, test_loss: 1.3305, test_f1: 0.6115
 epoch: 57, train_loss: 0.4567, test_loss: 1.3593, test_f1: 0.6184
 epoch: 58, train_loss: 0.4367, test_loss: 1.3182, test_f1: 0.6020
 epoch: 59, train_loss: 0.4543, test_loss: 1.3345, test_f1: 0.6064
 epoch: 60, train_loss: 0.4256, test_loss: 1.3898, test_f1: 0.6217
 epoch: 61, train_loss: 0.4420, test_loss: 1.4342, test_f1: 0.5930
 epoch: 62, train_loss: 0.4646, test_loss: 1.3592, test_f1: 0.6079
 epoch: 63, train_loss: 0.4156, test_loss: 1.4066, test_f1: 0.6233
 epoch: 64, train_loss: 0.4429, test_loss: 1.3872, test_f1: 0.6016
 epoch: 65, train_loss: 0.4300, test_loss: 1.4185, test_f1: 0.6045
 epoch: 66, train_loss: 0.4063, test_loss: 1.4544, test_f1: 0.5939
 epoch: 67, train_loss: 0.3931, test_loss: 1.4527, test_f1: 0.6201
 epoch: 68, train_loss: 0.3940, test_loss: 1.4177, test_f1: 0.6259
 epoch: 69, train_loss: 0.3973, test_loss: 1.4735, test_f1: 0.6089
 epoch: 70, train_loss: 0.3859, test_loss: 1.4542, test_f1: 0.6398
 epoch: 71, train_loss: 0.4082, test_loss: 1.4911, test_f1: 0.6127
 epoch: 72, train_loss: 0.4009, test_loss: 1.4401, test_f1: 0.6336
 epoch: 73, train_loss: 0.3844, test_loss: 1.5733, test_f1: 0.6300
 epoch: 74, train_loss: 0.3863, test_loss: 1.4565, test_f1: 0.6413
 epoch: 75, train_loss: 0.3666, test_loss: 1.5273, test_f1: 0.6029
 epoch: 76, train_loss: 0.3802, test_loss: 1.4806, test_f1: 0.6181
 epoch: 77, train_loss: 0.3962, test_loss: 1.5653, test_f1: 0.6108
 epoch: 78, train_loss: 0.3676, test_loss: 1.4800, test_f1: 0.6104
 epoch: 79, train_loss: 0.3754, test_loss: 1.5423, test_f1: 0.6264
 epoch: 80, train_loss: 0.3786, test_loss: 1.6420, test_f1: 0.5865
 epoch: 81, train_loss: 0.3818, test_loss: 1.6434, test_f1: 0.6173
 epoch: 82, train_loss: 0.3819, test_loss: 1.5735, test_f1: 0.6383
 epoch: 83, train_loss: 0.3482, test_loss: 1.6002, test_f1: 0.6171
 epoch: 84, train_loss: 0.3449, test_loss: 1.6526, test_f1: 0.6052
 epoch: 85, train_loss: 0.3429, test_loss: 1.7185, test_f1: 0.5987
 epoch: 86, train_loss: 0.3560, test_loss: 1.6656, test_f1: 0.6168
 epoch: 87, train_loss: 0.3440, test_loss: 1.6615, test_f1: 0.6204
 epoch: 88, train_loss: 0.3391, test_loss: 1.5780, test_f1: 0.5936
 epoch: 89, train_loss: 0.3297, test_loss: 1.5947, test_f1: 0.6156
 epoch: 90, train_loss: 0.3669, test_loss: 1.6900, test_f1: 0.6174
 epoch: 91, train_loss: 0.3116, test_loss: 1.6600, test_f1: 0.6178
 epoch: 92, train_loss: 0.3257, test_loss: 1.7004, test_f1: 0.6113
 epoch: 93, train_loss: 0.3391, test_loss: 1.6164, test_f1: 0.6161
 epoch: 94, train_loss: 0.3326, test_loss: 1.8136, test_f1: 0.6098
 epoch: 95, train_loss: 0.3317, test_loss: 1.7880, test_f1: 0.6067
 epoch: 96, train_loss: 0.3320, test_loss: 1.7724, test_f1: 0.6004
 epoch: 97, train_loss: 0.3395, test_loss: 1.8200, test_f1: 0.6151
 epoch: 98, train_loss: 0.2887, test_loss: 1.7511, test_f1: 0.6134
 epoch: 99, train_loss: 0.3363, test_loss: 1.6968, test_f1: 0.6345
##################ITERATION #6 ****************************************
 epoch: 0, train_loss: 1.2719, test_loss: 2.1924, test_f1: 0.0870
 epoch: 1, train_loss: 1.0589, test_loss: 1.0896, test_f1: 0.5021
 epoch: 2, train_loss: 1.0024, test_loss: 1.0860, test_f1: 0.4817
 epoch: 3, train_loss: 0.9723, test_loss: 1.0587, test_f1: 0.5360
 epoch: 4, train_loss: 0.9606, test_loss: 1.0320, test_f1: 0.5470
 epoch: 5, train_loss: 0.9238, test_loss: 0.9956, test_f1: 0.5354
 epoch: 6, train_loss: 0.9283, test_loss: 0.9870, test_f1: 0.5964
 epoch: 7, train_loss: 0.9011, test_loss: 1.0509, test_f1: 0.5597
 epoch: 8, train_loss: 0.8867, test_loss: 1.0002, test_f1: 0.5765
 epoch: 9, train_loss: 0.8817, test_loss: 0.9691, test_f1: 0.5661
 epoch: 10, train_loss: 0.8616, test_loss: 0.9947, test_f1: 0.5367
 epoch: 11, train_loss: 0.8397, test_loss: 1.0526, test_f1: 0.5712
 epoch: 12, train_loss: 0.8227, test_loss: 1.0404, test_f1: 0.5413
 epoch: 13, train_loss: 0.8323, test_loss: 1.0218, test_f1: 0.5699
 epoch: 14, train_loss: 0.8091, test_loss: 1.0107, test_f1: 0.5914
 epoch: 15, train_loss: 0.8044, test_loss: 1.0756, test_f1: 0.5622
 epoch: 16, train_loss: 0.7917, test_loss: 1.0251, test_f1: 0.5695
 epoch: 17, train_loss: 0.7766, test_loss: 1.0025, test_f1: 0.5564
 epoch: 18, train_loss: 0.7519, test_loss: 1.0023, test_f1: 0.5982
 epoch: 19, train_loss: 0.7501, test_loss: 1.0426, test_f1: 0.5862
 epoch: 20, train_loss: 0.7540, test_loss: 1.1004, test_f1: 0.5534
 epoch: 21, train_loss: 0.7422, test_loss: 1.0587, test_f1: 0.5518
 epoch: 22, train_loss: 0.7347, test_loss: 1.0516, test_f1: 0.5798
 epoch: 23, train_loss: 0.7127, test_loss: 1.0247, test_f1: 0.5814
 epoch: 24, train_loss: 0.6800, test_loss: 1.1086, test_f1: 0.5791
 epoch: 25, train_loss: 0.7144, test_loss: 1.0933, test_f1: 0.5666
 epoch: 26, train_loss: 0.7234, test_loss: 1.0927, test_f1: 0.5472
 epoch: 27, train_loss: 0.7190, test_loss: 1.0812, test_f1: 0.5950
 epoch: 28, train_loss: 0.6991, test_loss: 1.1297, test_f1: 0.5638
 epoch: 29, train_loss: 0.6919, test_loss: 1.0754, test_f1: 0.6041
 epoch: 30, train_loss: 0.6747, test_loss: 1.1174, test_f1: 0.5972
 epoch: 31, train_loss: 0.6807, test_loss: 1.1396, test_f1: 0.6000
 epoch: 32, train_loss: 0.6680, test_loss: 1.1077, test_f1: 0.5892
 epoch: 33, train_loss: 0.6579, test_loss: 1.1626, test_f1: 0.6071
 epoch: 34, train_loss: 0.6484, test_loss: 1.2029, test_f1: 0.5910
 epoch: 35, train_loss: 0.6274, test_loss: 1.2975, test_f1: 0.5571
 epoch: 36, train_loss: 0.6306, test_loss: 1.1041, test_f1: 0.5974
 epoch: 37, train_loss: 0.6404, test_loss: 1.1205, test_f1: 0.5705
 epoch: 38, train_loss: 0.6276, test_loss: 1.1846, test_f1: 0.5885
 epoch: 39, train_loss: 0.6192, test_loss: 1.1798, test_f1: 0.6336
 epoch: 40, train_loss: 0.6135, test_loss: 1.2712, test_f1: 0.5809
 epoch: 41, train_loss: 0.6149, test_loss: 1.2452, test_f1: 0.6107
 epoch: 42, train_loss: 0.6009, test_loss: 1.1495, test_f1: 0.6045
 epoch: 43, train_loss: 0.6021, test_loss: 1.1830, test_f1: 0.6042
 epoch: 44, train_loss: 0.6064, test_loss: 1.2633, test_f1: 0.5746
 epoch: 45, train_loss: 0.5808, test_loss: 1.3859, test_f1: 0.6000
 epoch: 46, train_loss: 0.6007, test_loss: 1.1952, test_f1: 0.5960
 epoch: 47, train_loss: 0.5875, test_loss: 1.3564, test_f1: 0.5649
 epoch: 48, train_loss: 0.5760, test_loss: 1.2566, test_f1: 0.5933
 epoch: 49, train_loss: 0.5874, test_loss: 1.2932, test_f1: 0.6151
 epoch: 50, train_loss: 0.5651, test_loss: 1.3379, test_f1: 0.5997
 epoch: 51, train_loss: 0.5416, test_loss: 1.3275, test_f1: 0.6463
 epoch: 52, train_loss: 0.5076, test_loss: 1.3882, test_f1: 0.6158
 epoch: 53, train_loss: 0.5171, test_loss: 1.4407, test_f1: 0.6194
 epoch: 54, train_loss: 0.4818, test_loss: 1.3986, test_f1: 0.6326
 epoch: 55, train_loss: 0.5015, test_loss: 1.4001, test_f1: 0.6354
 epoch: 56, train_loss: 0.4849, test_loss: 1.3907, test_f1: 0.6316
 epoch: 57, train_loss: 0.4661, test_loss: 1.4038, test_f1: 0.6375
 epoch: 58, train_loss: 0.5109, test_loss: 1.4833, test_f1: 0.6234
 epoch: 59, train_loss: 0.4581, test_loss: 1.4250, test_f1: 0.6202
 epoch: 60, train_loss: 0.4478, test_loss: 1.5824, test_f1: 0.6296
 epoch: 61, train_loss: 0.4663, test_loss: 1.5720, test_f1: 0.5597
 epoch: 62, train_loss: 0.4460, test_loss: 1.5629, test_f1: 0.6204
 epoch: 63, train_loss: 0.4428, test_loss: 1.5458, test_f1: 0.6135
 epoch: 64, train_loss: 0.4543, test_loss: 1.5376, test_f1: 0.6249
 epoch: 65, train_loss: 0.4436, test_loss: 1.5768, test_f1: 0.6266
 epoch: 66, train_loss: 0.4545, test_loss: 1.6266, test_f1: 0.6166
 epoch: 67, train_loss: 0.4540, test_loss: 1.6286, test_f1: 0.5805
 epoch: 68, train_loss: 0.4272, test_loss: 1.7404, test_f1: 0.6065
 epoch: 69, train_loss: 0.4356, test_loss: 1.5419, test_f1: 0.6381
 epoch: 70, train_loss: 0.4551, test_loss: 1.6588, test_f1: 0.6304
 epoch: 71, train_loss: 0.4258, test_loss: 1.6871, test_f1: 0.6160
 epoch: 72, train_loss: 0.4319, test_loss: 1.6979, test_f1: 0.6306
 epoch: 73, train_loss: 0.4180, test_loss: 1.6100, test_f1: 0.6149
 epoch: 74, train_loss: 0.4103, test_loss: 1.7475, test_f1: 0.5915
 epoch: 75, train_loss: 0.4146, test_loss: 1.6340, test_f1: 0.6201
 epoch: 76, train_loss: 0.4026, test_loss: 1.7082, test_f1: 0.6040
 epoch: 77, train_loss: 0.4317, test_loss: 1.7994, test_f1: 0.6141
 epoch: 78, train_loss: 0.4270, test_loss: 1.7634, test_f1: 0.6095
 epoch: 79, train_loss: 0.4276, test_loss: 1.8027, test_f1: 0.6068
 epoch: 80, train_loss: 0.4026, test_loss: 1.6589, test_f1: 0.6444
 epoch: 81, train_loss: 0.4159, test_loss: 1.7596, test_f1: 0.5940
 epoch: 82, train_loss: 0.3901, test_loss: 1.8706, test_f1: 0.6346
 epoch: 83, train_loss: 0.4073, test_loss: 1.7966, test_f1: 0.6221
 epoch: 84, train_loss: 0.3970, test_loss: 1.7041, test_f1: 0.6372
 epoch: 85, train_loss: 0.3857, test_loss: 1.8257, test_f1: 0.6088
 epoch: 86, train_loss: 0.3834, test_loss: 1.9170, test_f1: 0.6217
 epoch: 87, train_loss: 0.3998, test_loss: 1.8205, test_f1: 0.6119
 epoch: 88, train_loss: 0.3767, test_loss: 1.9004, test_f1: 0.6047
 epoch: 89, train_loss: 0.3533, test_loss: 1.9523, test_f1: 0.6064
 epoch: 90, train_loss: 0.3616, test_loss: 2.0877, test_f1: 0.5820
 epoch: 91, train_loss: 0.3572, test_loss: 2.0551, test_f1: 0.5788
 epoch: 92, train_loss: 0.3489, test_loss: 2.0597, test_f1: 0.5857
 epoch: 93, train_loss: 0.3697, test_loss: 2.0096, test_f1: 0.6054
 epoch: 94, train_loss: 0.3720, test_loss: 2.2747, test_f1: 0.5666
 epoch: 95, train_loss: 0.3639, test_loss: 2.1815, test_f1: 0.5852
 epoch: 96, train_loss: 0.3514, test_loss: 2.1161, test_f1: 0.5721
 epoch: 97, train_loss: 0.3550, test_loss: 2.0706, test_f1: 0.6059
 epoch: 98, train_loss: 0.3557, test_loss: 2.0319, test_f1: 0.6175
 epoch: 99, train_loss: 0.3570, test_loss: 2.0606, test_f1: 0.6285
##################ITERATION #7 ****************************************
 epoch: 0, train_loss: 1.3471, test_loss: 1.3570, test_f1: 0.2796
 epoch: 1, train_loss: 1.1321, test_loss: 1.0871, test_f1: 0.5093
 epoch: 2, train_loss: 1.0118, test_loss: 1.0582, test_f1: 0.5201
 epoch: 3, train_loss: 0.9897, test_loss: 1.0722, test_f1: 0.5009
 epoch: 4, train_loss: 0.9602, test_loss: 1.0448, test_f1: 0.5206
 epoch: 5, train_loss: 0.9300, test_loss: 1.0218, test_f1: 0.5459
 epoch: 6, train_loss: 0.9409, test_loss: 1.0351, test_f1: 0.5196
 epoch: 7, train_loss: 0.8986, test_loss: 1.0401, test_f1: 0.4995
 epoch: 8, train_loss: 0.8934, test_loss: 1.0327, test_f1: 0.5148
 epoch: 9, train_loss: 0.8776, test_loss: 1.0182, test_f1: 0.5326
 epoch: 10, train_loss: 0.8485, test_loss: 1.0416, test_f1: 0.5519
 epoch: 11, train_loss: 0.8205, test_loss: 1.0013, test_f1: 0.5394
 epoch: 12, train_loss: 0.8535, test_loss: 1.0044, test_f1: 0.5732
 epoch: 13, train_loss: 0.8087, test_loss: 1.0091, test_f1: 0.5533
 epoch: 14, train_loss: 0.8040, test_loss: 1.0335, test_f1: 0.5369
 epoch: 15, train_loss: 0.7843, test_loss: 1.0404, test_f1: 0.5723
 epoch: 16, train_loss: 0.7811, test_loss: 1.0372, test_f1: 0.5875
 epoch: 17, train_loss: 0.7742, test_loss: 1.0211, test_f1: 0.5718
 epoch: 18, train_loss: 0.7638, test_loss: 1.0220, test_f1: 0.5812
 epoch: 19, train_loss: 0.7523, test_loss: 1.0403, test_f1: 0.5951
 epoch: 20, train_loss: 0.7532, test_loss: 1.0421, test_f1: 0.5823
 epoch: 21, train_loss: 0.7022, test_loss: 1.0319, test_f1: 0.6268
 epoch: 22, train_loss: 0.7097, test_loss: 1.0784, test_f1: 0.5814
 epoch: 23, train_loss: 0.7076, test_loss: 1.0387, test_f1: 0.6287
 epoch: 24, train_loss: 0.6804, test_loss: 1.0475, test_f1: 0.6385
 epoch: 25, train_loss: 0.7156, test_loss: 1.0236, test_f1: 0.6234
 epoch: 26, train_loss: 0.6624, test_loss: 1.0781, test_f1: 0.6291
 epoch: 27, train_loss: 0.6528, test_loss: 1.0818, test_f1: 0.6075
 epoch: 28, train_loss: 0.6635, test_loss: 1.1092, test_f1: 0.5952
 epoch: 29, train_loss: 0.6475, test_loss: 1.1497, test_f1: 0.6095
 epoch: 30, train_loss: 0.6516, test_loss: 1.0816, test_f1: 0.6020
 epoch: 31, train_loss: 0.6422, test_loss: 1.1926, test_f1: 0.6114
 epoch: 32, train_loss: 0.6443, test_loss: 1.1899, test_f1: 0.6075
 epoch: 33, train_loss: 0.6665, test_loss: 1.1804, test_f1: 0.5929
 epoch: 34, train_loss: 0.6220, test_loss: 1.1629, test_f1: 0.6084
 epoch: 35, train_loss: 0.6171, test_loss: 1.1724, test_f1: 0.6347
 epoch: 36, train_loss: 0.5870, test_loss: 1.1313, test_f1: 0.6157
 epoch: 37, train_loss: 0.6148, test_loss: 1.1592, test_f1: 0.6322
 epoch: 38, train_loss: 0.5852, test_loss: 1.2956, test_f1: 0.5740
 epoch: 39, train_loss: 0.5933, test_loss: 1.1140, test_f1: 0.6120
 epoch: 40, train_loss: 0.5655, test_loss: 1.2552, test_f1: 0.6153
 epoch: 41, train_loss: 0.5571, test_loss: 1.2860, test_f1: 0.6102
 epoch: 42, train_loss: 0.5629, test_loss: 1.2404, test_f1: 0.6038
 epoch: 43, train_loss: 0.5810, test_loss: 1.2702, test_f1: 0.6256
 epoch: 44, train_loss: 0.5380, test_loss: 1.3595, test_f1: 0.5951
 epoch: 45, train_loss: 0.5562, test_loss: 1.1992, test_f1: 0.6121
 epoch: 46, train_loss: 0.5040, test_loss: 1.2858, test_f1: 0.5736
 epoch: 47, train_loss: 0.5176, test_loss: 1.3867, test_f1: 0.6268
 epoch: 48, train_loss: 0.5414, test_loss: 1.3728, test_f1: 0.6448
 epoch: 49, train_loss: 0.5301, test_loss: 1.3004, test_f1: 0.6181
 epoch: 50, train_loss: 0.5211, test_loss: 1.4133, test_f1: 0.6282
 epoch: 51, train_loss: 0.5057, test_loss: 1.3224, test_f1: 0.6123
 epoch: 52, train_loss: 0.4810, test_loss: 1.2839, test_f1: 0.6427
 epoch: 53, train_loss: 0.4620, test_loss: 1.3137, test_f1: 0.6409
 epoch: 54, train_loss: 0.4473, test_loss: 1.3132, test_f1: 0.6379
 epoch: 55, train_loss: 0.4456, test_loss: 1.3364, test_f1: 0.6222
 epoch: 56, train_loss: 0.4289, test_loss: 1.4351, test_f1: 0.6328
 epoch: 57, train_loss: 0.4283, test_loss: 1.3887, test_f1: 0.6274
 epoch: 58, train_loss: 0.4146, test_loss: 1.4789, test_f1: 0.6091
 epoch: 59, train_loss: 0.4266, test_loss: 1.4437, test_f1: 0.6385
 epoch: 60, train_loss: 0.4225, test_loss: 1.4075, test_f1: 0.6351
 epoch: 61, train_loss: 0.4154, test_loss: 1.4233, test_f1: 0.6242
 epoch: 62, train_loss: 0.4019, test_loss: 1.4993, test_f1: 0.6402
 epoch: 63, train_loss: 0.3803, test_loss: 1.4904, test_f1: 0.6157
 epoch: 64, train_loss: 0.3991, test_loss: 1.6166, test_f1: 0.6204
 epoch: 65, train_loss: 0.4064, test_loss: 1.4999, test_f1: 0.6008
 epoch: 66, train_loss: 0.3911, test_loss: 1.4846, test_f1: 0.6192
 epoch: 67, train_loss: 0.3826, test_loss: 1.5522, test_f1: 0.6147
 epoch: 68, train_loss: 0.3884, test_loss: 1.5874, test_f1: 0.5996
 epoch: 69, train_loss: 0.3785, test_loss: 1.5644, test_f1: 0.6191
 epoch: 70, train_loss: 0.4005, test_loss: 1.5359, test_f1: 0.6012
 epoch: 71, train_loss: 0.3948, test_loss: 1.5345, test_f1: 0.6268
 epoch: 72, train_loss: 0.3903, test_loss: 1.6042, test_f1: 0.6202
 epoch: 73, train_loss: 0.3670, test_loss: 1.5805, test_f1: 0.6215
 epoch: 74, train_loss: 0.3550, test_loss: 1.6602, test_f1: 0.6117
 epoch: 75, train_loss: 0.3659, test_loss: 1.6250, test_f1: 0.5994
 epoch: 76, train_loss: 0.3925, test_loss: 1.6189, test_f1: 0.6245
 epoch: 77, train_loss: 0.3444, test_loss: 1.6749, test_f1: 0.6278
 epoch: 78, train_loss: 0.3650, test_loss: 1.6234, test_f1: 0.6201
 epoch: 79, train_loss: 0.3521, test_loss: 1.5431, test_f1: 0.6326
 epoch: 80, train_loss: 0.3520, test_loss: 1.6164, test_f1: 0.6349
 epoch: 81, train_loss: 0.3479, test_loss: 1.6380, test_f1: 0.6322
 epoch: 82, train_loss: 0.3549, test_loss: 1.5639, test_f1: 0.6446
 epoch: 83, train_loss: 0.3310, test_loss: 1.6824, test_f1: 0.6051
 epoch: 84, train_loss: 0.3176, test_loss: 1.7089, test_f1: 0.6212
 epoch: 85, train_loss: 0.3482, test_loss: 1.7387, test_f1: 0.6240
 epoch: 86, train_loss: 0.3686, test_loss: 1.7223, test_f1: 0.6195
 epoch: 87, train_loss: 0.3497, test_loss: 1.6808, test_f1: 0.6337
 epoch: 88, train_loss: 0.3310, test_loss: 1.7589, test_f1: 0.6462
 epoch: 89, train_loss: 0.3151, test_loss: 1.7982, test_f1: 0.6258
 epoch: 90, train_loss: 0.3317, test_loss: 1.7962, test_f1: 0.6303
 epoch: 91, train_loss: 0.3286, test_loss: 1.7901, test_f1: 0.6213
 epoch: 92, train_loss: 0.3161, test_loss: 1.7372, test_f1: 0.6375
 epoch: 93, train_loss: 0.2911, test_loss: 1.7957, test_f1: 0.6216
 epoch: 94, train_loss: 0.3101, test_loss: 1.8362, test_f1: 0.6269
 epoch: 95, train_loss: 0.3152, test_loss: 1.7445, test_f1: 0.6175
 epoch: 96, train_loss: 0.3520, test_loss: 1.7781, test_f1: 0.6022
 epoch: 97, train_loss: 0.2976, test_loss: 1.9000, test_f1: 0.6130
 epoch: 98, train_loss: 0.3091, test_loss: 1.9449, test_f1: 0.5878
 epoch: 99, train_loss: 0.2922, test_loss: 1.9197, test_f1: 0.5963
##################ITERATION #8 ****************************************
 epoch: 0, train_loss: 1.3680, test_loss: 1.4736, test_f1: 0.3390
 epoch: 1, train_loss: 1.0529, test_loss: 1.0695, test_f1: 0.5136
 epoch: 2, train_loss: 0.9995, test_loss: 1.0965, test_f1: 0.5358
 epoch: 3, train_loss: 0.9579, test_loss: 1.0779, test_f1: 0.5163
 epoch: 4, train_loss: 0.9355, test_loss: 1.0683, test_f1: 0.5441
 epoch: 5, train_loss: 0.9423, test_loss: 1.0653, test_f1: 0.5047
 epoch: 6, train_loss: 0.9123, test_loss: 1.0188, test_f1: 0.5570
 epoch: 7, train_loss: 0.8807, test_loss: 1.0753, test_f1: 0.5556
 epoch: 8, train_loss: 0.8768, test_loss: 1.0712, test_f1: 0.5425
 epoch: 9, train_loss: 0.8547, test_loss: 1.0714, test_f1: 0.5738
 epoch: 10, train_loss: 0.8208, test_loss: 1.0737, test_f1: 0.5502
 epoch: 11, train_loss: 0.8108, test_loss: 1.1091, test_f1: 0.5840
 epoch: 12, train_loss: 0.8019, test_loss: 1.1720, test_f1: 0.5620
 epoch: 13, train_loss: 0.8003, test_loss: 1.0499, test_f1: 0.5981
 epoch: 14, train_loss: 0.8047, test_loss: 1.0845, test_f1: 0.5782
 epoch: 15, train_loss: 0.7923, test_loss: 1.0328, test_f1: 0.6078
 epoch: 16, train_loss: 0.7645, test_loss: 1.0591, test_f1: 0.6155
 epoch: 17, train_loss: 0.7524, test_loss: 1.0281, test_f1: 0.6204
 epoch: 18, train_loss: 0.7504, test_loss: 1.1065, test_f1: 0.5650
 epoch: 19, train_loss: 0.7470, test_loss: 1.0535, test_f1: 0.6003
 epoch: 20, train_loss: 0.7077, test_loss: 1.0209, test_f1: 0.6357
 epoch: 21, train_loss: 0.7069, test_loss: 1.0086, test_f1: 0.5847
 epoch: 22, train_loss: 0.7171, test_loss: 1.0574, test_f1: 0.6265
 epoch: 23, train_loss: 0.6766, test_loss: 1.1423, test_f1: 0.6090
 epoch: 24, train_loss: 0.6746, test_loss: 1.2255, test_f1: 0.5938
 epoch: 25, train_loss: 0.6565, test_loss: 1.2644, test_f1: 0.5577
 epoch: 26, train_loss: 0.6822, test_loss: 1.2178, test_f1: 0.6245
 epoch: 27, train_loss: 0.6624, test_loss: 1.3037, test_f1: 0.5751
 epoch: 28, train_loss: 0.6333, test_loss: 1.1934, test_f1: 0.5863
 epoch: 29, train_loss: 0.6401, test_loss: 1.1069, test_f1: 0.6003
 epoch: 30, train_loss: 0.6347, test_loss: 1.3663, test_f1: 0.5837
 epoch: 31, train_loss: 0.6434, test_loss: 1.1558, test_f1: 0.5690
 epoch: 32, train_loss: 0.6246, test_loss: 1.2212, test_f1: 0.6040
 epoch: 33, train_loss: 0.6377, test_loss: 1.1448, test_f1: 0.5747
 epoch: 34, train_loss: 0.6193, test_loss: 1.1430, test_f1: 0.6072
 epoch: 35, train_loss: 0.5994, test_loss: 1.1132, test_f1: 0.6341
 epoch: 36, train_loss: 0.6088, test_loss: 1.2398, test_f1: 0.6036
 epoch: 37, train_loss: 0.6267, test_loss: 1.2890, test_f1: 0.6100
 epoch: 38, train_loss: 0.5995, test_loss: 1.3216, test_f1: 0.5597
 epoch: 39, train_loss: 0.5726, test_loss: 1.2733, test_f1: 0.6054
 epoch: 40, train_loss: 0.5439, test_loss: 1.2252, test_f1: 0.5731
 epoch: 41, train_loss: 0.5644, test_loss: 1.2642, test_f1: 0.5881
 epoch: 42, train_loss: 0.5605, test_loss: 1.3341, test_f1: 0.5986
 epoch: 43, train_loss: 0.5757, test_loss: 1.2142, test_f1: 0.6474
 epoch: 44, train_loss: 0.5460, test_loss: 1.3222, test_f1: 0.5782
 epoch: 45, train_loss: 0.5637, test_loss: 1.2427, test_f1: 0.6287
 epoch: 46, train_loss: 0.5407, test_loss: 1.1517, test_f1: 0.6184
 epoch: 47, train_loss: 0.5481, test_loss: 1.2778, test_f1: 0.5992
 epoch: 48, train_loss: 0.5497, test_loss: 1.2200, test_f1: 0.6166
 epoch: 49, train_loss: 0.5283, test_loss: 1.3417, test_f1: 0.6179
 epoch: 50, train_loss: 0.5303, test_loss: 1.2943, test_f1: 0.6054
 epoch: 51, train_loss: 0.4730, test_loss: 1.3675, test_f1: 0.5808
 epoch: 52, train_loss: 0.4664, test_loss: 1.2825, test_f1: 0.6181
 epoch: 53, train_loss: 0.4678, test_loss: 1.3629, test_f1: 0.6451
 epoch: 54, train_loss: 0.4456, test_loss: 1.3382, test_f1: 0.6185
 epoch: 55, train_loss: 0.4587, test_loss: 1.3317, test_f1: 0.6164
 epoch: 56, train_loss: 0.4471, test_loss: 1.3165, test_f1: 0.6445
 epoch: 57, train_loss: 0.4369, test_loss: 1.3273, test_f1: 0.6174
 epoch: 58, train_loss: 0.4231, test_loss: 1.3706, test_f1: 0.6279
 epoch: 59, train_loss: 0.4192, test_loss: 1.4166, test_f1: 0.6374
 epoch: 60, train_loss: 0.4342, test_loss: 1.4444, test_f1: 0.6170
 epoch: 61, train_loss: 0.4390, test_loss: 1.3956, test_f1: 0.6256
 epoch: 62, train_loss: 0.4140, test_loss: 1.4657, test_f1: 0.6203
 epoch: 63, train_loss: 0.4312, test_loss: 1.4665, test_f1: 0.6465
 epoch: 64, train_loss: 0.4070, test_loss: 1.4750, test_f1: 0.6200
 epoch: 65, train_loss: 0.4074, test_loss: 1.5861, test_f1: 0.6065
 epoch: 66, train_loss: 0.4303, test_loss: 1.4371, test_f1: 0.6575
 epoch: 67, train_loss: 0.4139, test_loss: 1.4963, test_f1: 0.6234
 epoch: 68, train_loss: 0.4162, test_loss: 1.4866, test_f1: 0.6294
 epoch: 69, train_loss: 0.4170, test_loss: 1.4317, test_f1: 0.6344
 epoch: 70, train_loss: 0.4037, test_loss: 1.5591, test_f1: 0.6208
 epoch: 71, train_loss: 0.3963, test_loss: 1.4762, test_f1: 0.6479
 epoch: 72, train_loss: 0.3932, test_loss: 1.5675, test_f1: 0.6255
 epoch: 73, train_loss: 0.3651, test_loss: 1.5085, test_f1: 0.6192
 epoch: 74, train_loss: 0.3714, test_loss: 1.4982, test_f1: 0.6385
 epoch: 75, train_loss: 0.3627, test_loss: 1.5773, test_f1: 0.6262
 epoch: 76, train_loss: 0.3786, test_loss: 1.5994, test_f1: 0.6225
 epoch: 77, train_loss: 0.3712, test_loss: 1.7037, test_f1: 0.6223
 epoch: 78, train_loss: 0.3652, test_loss: 1.5804, test_f1: 0.6510
 epoch: 79, train_loss: 0.3835, test_loss: 1.6886, test_f1: 0.6071
 epoch: 80, train_loss: 0.3875, test_loss: 1.7558, test_f1: 0.6025
 epoch: 81, train_loss: 0.3605, test_loss: 1.5800, test_f1: 0.6256
 epoch: 82, train_loss: 0.3657, test_loss: 1.6916, test_f1: 0.6484
 epoch: 83, train_loss: 0.3693, test_loss: 1.7153, test_f1: 0.6361
 epoch: 84, train_loss: 0.3492, test_loss: 1.6653, test_f1: 0.6162
 epoch: 85, train_loss: 0.3679, test_loss: 1.6294, test_f1: 0.6160
 epoch: 86, train_loss: 0.3468, test_loss: 1.6872, test_f1: 0.6143
 epoch: 87, train_loss: 0.3394, test_loss: 1.5866, test_f1: 0.6140
 epoch: 88, train_loss: 0.3491, test_loss: 1.7427, test_f1: 0.6272
 epoch: 89, train_loss: 0.3444, test_loss: 1.6215, test_f1: 0.6279
 epoch: 90, train_loss: 0.3259, test_loss: 1.6930, test_f1: 0.6309
 epoch: 91, train_loss: 0.3592, test_loss: 1.7343, test_f1: 0.6149
 epoch: 92, train_loss: 0.3397, test_loss: 1.7107, test_f1: 0.6139
 epoch: 93, train_loss: 0.3312, test_loss: 1.7177, test_f1: 0.6075
 epoch: 94, train_loss: 0.3235, test_loss: 1.8133, test_f1: 0.6328
 epoch: 95, train_loss: 0.3390, test_loss: 1.7946, test_f1: 0.6044
 epoch: 96, train_loss: 0.3218, test_loss: 1.7884, test_f1: 0.6018
 epoch: 97, train_loss: 0.3105, test_loss: 1.7990, test_f1: 0.6178
 epoch: 98, train_loss: 0.2892, test_loss: 1.8987, test_f1: 0.5883
 epoch: 99, train_loss: 0.3243, test_loss: 1.9006, test_f1: 0.5950
##################ITERATION #9 ****************************************
 epoch: 0, train_loss: 1.4195, test_loss: 1.3090, test_f1: 0.3348
 epoch: 1, train_loss: 1.0678, test_loss: 1.0922, test_f1: 0.5083
 epoch: 2, train_loss: 0.9872, test_loss: 1.0405, test_f1: 0.5655
 epoch: 3, train_loss: 0.9679, test_loss: 1.0277, test_f1: 0.5738
 epoch: 4, train_loss: 0.9289, test_loss: 1.0502, test_f1: 0.5137
 epoch: 5, train_loss: 0.8985, test_loss: 1.0227, test_f1: 0.5270
 epoch: 6, train_loss: 0.8982, test_loss: 1.0108, test_f1: 0.5651
 epoch: 7, train_loss: 0.8771, test_loss: 1.0295, test_f1: 0.5462
 epoch: 8, train_loss: 0.8622, test_loss: 1.0128, test_f1: 0.5440
 epoch: 9, train_loss: 0.8350, test_loss: 1.0322, test_f1: 0.5956
 epoch: 10, train_loss: 0.8224, test_loss: 1.0021, test_f1: 0.5450
 epoch: 11, train_loss: 0.8059, test_loss: 0.9616, test_f1: 0.5912
 epoch: 12, train_loss: 0.8030, test_loss: 1.0156, test_f1: 0.5505
 epoch: 13, train_loss: 0.7803, test_loss: 1.0103, test_f1: 0.6360
 epoch: 14, train_loss: 0.7635, test_loss: 0.9867, test_f1: 0.6444
 epoch: 15, train_loss: 0.7372, test_loss: 1.0217, test_f1: 0.6071
 epoch: 16, train_loss: 0.7392, test_loss: 1.0726, test_f1: 0.5846
 epoch: 17, train_loss: 0.7091, test_loss: 1.0433, test_f1: 0.6574
 epoch: 18, train_loss: 0.7247, test_loss: 1.0667, test_f1: 0.6339
 epoch: 19, train_loss: 0.7097, test_loss: 1.0299, test_f1: 0.6288
 epoch: 20, train_loss: 0.6963, test_loss: 1.0713, test_f1: 0.6389
 epoch: 21, train_loss: 0.6567, test_loss: 1.0741, test_f1: 0.6221
 epoch: 22, train_loss: 0.6619, test_loss: 1.2261, test_f1: 0.5351
 epoch: 23, train_loss: 0.6444, test_loss: 1.0857, test_f1: 0.6395
 epoch: 24, train_loss: 0.6315, test_loss: 1.1373, test_f1: 0.5956
 epoch: 25, train_loss: 0.6708, test_loss: 1.0472, test_f1: 0.6402
 epoch: 26, train_loss: 0.6263, test_loss: 1.0718, test_f1: 0.6312
 epoch: 27, train_loss: 0.6214, test_loss: 1.1186, test_f1: 0.5650
 epoch: 28, train_loss: 0.6203, test_loss: 1.1827, test_f1: 0.6369
 epoch: 29, train_loss: 0.6352, test_loss: 1.1317, test_f1: 0.6153
 epoch: 30, train_loss: 0.6108, test_loss: 1.2162, test_f1: 0.6295
 epoch: 31, train_loss: 0.6083, test_loss: 1.2595, test_f1: 0.5886
 epoch: 32, train_loss: 0.5906, test_loss: 1.1645, test_f1: 0.6520
 epoch: 33, train_loss: 0.5853, test_loss: 1.2397, test_f1: 0.6388
 epoch: 34, train_loss: 0.5630, test_loss: 1.2071, test_f1: 0.5922
 epoch: 35, train_loss: 0.5708, test_loss: 1.1875, test_f1: 0.6505
 epoch: 36, train_loss: 0.5656, test_loss: 1.2359, test_f1: 0.6028
 epoch: 37, train_loss: 0.5568, test_loss: 1.4407, test_f1: 0.6228
 epoch: 38, train_loss: 0.5778, test_loss: 1.2557, test_f1: 0.6433
 epoch: 39, train_loss: 0.5708, test_loss: 1.4633, test_f1: 0.5603
 epoch: 40, train_loss: 0.5567, test_loss: 1.3257, test_f1: 0.6123
 epoch: 41, train_loss: 0.5494, test_loss: 1.2965, test_f1: 0.6170
 epoch: 42, train_loss: 0.5318, test_loss: 1.3298, test_f1: 0.6012
 epoch: 43, train_loss: 0.5244, test_loss: 1.3098, test_f1: 0.6494
 epoch: 44, train_loss: 0.5217, test_loss: 1.2804, test_f1: 0.6316
 epoch: 45, train_loss: 0.5220, test_loss: 1.3674, test_f1: 0.6246
 epoch: 46, train_loss: 0.5154, test_loss: 1.2900, test_f1: 0.6388
 epoch: 47, train_loss: 0.5101, test_loss: 1.4524, test_f1: 0.6246
 epoch: 48, train_loss: 0.4972, test_loss: 1.3470, test_f1: 0.6307
 epoch: 49, train_loss: 0.5036, test_loss: 1.3799, test_f1: 0.6260
 epoch: 50, train_loss: 0.5311, test_loss: 1.4313, test_f1: 0.6478
 epoch: 51, train_loss: 0.4534, test_loss: 1.3951, test_f1: 0.6298
 epoch: 52, train_loss: 0.4137, test_loss: 1.5115, test_f1: 0.6365
 epoch: 53, train_loss: 0.4320, test_loss: 1.4330, test_f1: 0.6344
 epoch: 54, train_loss: 0.4312, test_loss: 1.5862, test_f1: 0.6411
 epoch: 55, train_loss: 0.4215, test_loss: 1.5022, test_f1: 0.6219
 epoch: 56, train_loss: 0.4204, test_loss: 1.5455, test_f1: 0.6271
 epoch: 57, train_loss: 0.4145, test_loss: 1.5235, test_f1: 0.6187
 epoch: 58, train_loss: 0.4025, test_loss: 1.5766, test_f1: 0.6539
 epoch: 59, train_loss: 0.4068, test_loss: 1.6320, test_f1: 0.6483
 epoch: 60, train_loss: 0.3709, test_loss: 1.6450, test_f1: 0.6460
 epoch: 61, train_loss: 0.3833, test_loss: 1.6246, test_f1: 0.6490
 epoch: 62, train_loss: 0.3846, test_loss: 1.5656, test_f1: 0.6440
 epoch: 63, train_loss: 0.3887, test_loss: 1.7698, test_f1: 0.6299
 epoch: 64, train_loss: 0.3923, test_loss: 1.6971, test_f1: 0.6522
 epoch: 65, train_loss: 0.3710, test_loss: 1.6918, test_f1: 0.6485
 epoch: 66, train_loss: 0.3888, test_loss: 1.7928, test_f1: 0.6225
 epoch: 67, train_loss: 0.3717, test_loss: 1.7664, test_f1: 0.6331
 epoch: 68, train_loss: 0.3484, test_loss: 1.8285, test_f1: 0.6365
 epoch: 69, train_loss: 0.3451, test_loss: 1.7122, test_f1: 0.6471
 epoch: 70, train_loss: 0.3725, test_loss: 1.7431, test_f1: 0.6017
 epoch: 71, train_loss: 0.3552, test_loss: 1.7042, test_f1: 0.6451
 epoch: 72, train_loss: 0.3807, test_loss: 1.7153, test_f1: 0.6365
 epoch: 73, train_loss: 0.3432, test_loss: 1.7432, test_f1: 0.6536
 epoch: 74, train_loss: 0.3340, test_loss: 1.7254, test_f1: 0.6692
 epoch: 75, train_loss: 0.3304, test_loss: 1.8301, test_f1: 0.6225
 epoch: 76, train_loss: 0.3487, test_loss: 1.8078, test_f1: 0.6307
 epoch: 77, train_loss: 0.3402, test_loss: 1.8446, test_f1: 0.6346
 epoch: 78, train_loss: 0.3184, test_loss: 1.8991, test_f1: 0.6321
 epoch: 79, train_loss: 0.3514, test_loss: 1.9159, test_f1: 0.6094
 epoch: 80, train_loss: 0.3347, test_loss: 1.8492, test_f1: 0.6408
 epoch: 81, train_loss: 0.3174, test_loss: 2.0270, test_f1: 0.6334
 epoch: 82, train_loss: 0.3120, test_loss: 1.9562, test_f1: 0.6213
 epoch: 83, train_loss: 0.3238, test_loss: 1.9197, test_f1: 0.6362
 epoch: 84, train_loss: 0.3463, test_loss: 2.1023, test_f1: 0.6191
 epoch: 85, train_loss: 0.3286, test_loss: 1.9286, test_f1: 0.6258
 epoch: 86, train_loss: 0.3252, test_loss: 1.9305, test_f1: 0.6253
 epoch: 87, train_loss: 0.3298, test_loss: 1.8824, test_f1: 0.6243
 epoch: 88, train_loss: 0.3236, test_loss: 2.0169, test_f1: 0.6176
 epoch: 89, train_loss: 0.3287, test_loss: 1.8623, test_f1: 0.6369
 epoch: 90, train_loss: 0.3168, test_loss: 1.9604, test_f1: 0.6447
 epoch: 91, train_loss: 0.2932, test_loss: 1.9047, test_f1: 0.6458
 epoch: 92, train_loss: 0.2996, test_loss: 2.0811, test_f1: 0.6505
 epoch: 93, train_loss: 0.2869, test_loss: 1.9528, test_f1: 0.6424
 epoch: 94, train_loss: 0.3130, test_loss: 2.0309, test_f1: 0.6328
 epoch: 95, train_loss: 0.3035, test_loss: 2.1199, test_f1: 0.6233
 epoch: 96, train_loss: 0.3375, test_loss: 2.1830, test_f1: 0.6219
 epoch: 97, train_loss: 0.3099, test_loss: 2.0543, test_f1: 0.6082
 epoch: 98, train_loss: 0.2883, test_loss: 2.1078, test_f1: 0.6141
 epoch: 99, train_loss: 0.2789, test_loss: 2.2566, test_f1: 0.6565

Training completed in 750.11 seconds
Best F1: 0.6692 at epoch 74
Mean F1 across iterations: 0.6522  0.0137
========================FINAL RESULTS================================
FEGIN weighted F1: 0.6692  0.0137
python main.py --data ltspice_demos --representation component_pin_net --model FEGIN --layers 5 --hiddens 32 --batch_size 32 --lr 0.001 --emb_size 128 --epochs 100 --save_appendix component_pin_net_L5_H32_BS32_LR0.001_E128 --no_val
-----



STDERR:
  File "main.py", line 370, in <module>
    main()
  File "main.py", line 254, in main
    dataset = dataset_class(
  File "/home/philip/projects/ltspice_examples_code_repo/Circuit-Completion-Using-GNNs/component_classification_with_link_prediction_head/evaluation/FEGIN/kernel/circuit_datasets.py", line 15, in __init__
    self.data, self.slices = torch.load(self.processed_paths[0])
  File "/home/philip/.local/lib/python3.8/site-packages/torch/serialization.py", line 1040, in load
    warnings.warn(
  File "/usr/lib/python3.8/warnings.py", line 109, in _showwarnmsg
    sw(msg.message, msg.category, msg.filename, msg.lineno,
  File "main.py", line 47, in warn_with_traceback
    traceback.print_stack(file=log)
/home/philip/projects/ltspice_examples_code_repo/Circuit-Completion-Using-GNNs/component_classification_with_link_prediction_head/evaluation/FEGIN/kernel/circuit_datasets.py:15: FutureWarning: You are using `torch.load` with `weights_only=False` (the current default value), which uses the default pickle module implicitly. It is possible to construct malicious pickle data which will execute arbitrary code during unpickling (See https://github.com/pytorch/pytorch/blob/main/SECURITY.md#untrusted-models for more details). In a future release, the default value for `weights_only` will be flipped to `True`. This limits the functions that could be executed during unpickling. Arbitrary objects will no longer be allowed to be loaded via this mode unless they are explicitly allowlisted by the user via `torch.serialization.add_safe_globals`. We recommend you start setting `weights_only=True` for any use case where you don't have full control of the loaded file. Please open an issue on GitHub for any issues related to this experimental feature.
  self.data, self.slices = torch.load(self.processed_paths[0])
