STDOUT:
Results will be saved in /home/philip/projects/ltspice_examples_code_repo/Circuit-Completion-Using-GNNs/component_classification_with_link_prediction_head/evaluation/FEGIN/results/model_FEGIN_dataset_ltspice_demos
Command line input: python main.py --data ltspice_demos --representation component_pin --model FEGIN --layers 3 --hiddens 16 --batch_size 256 --lr 0.1 --emb_size 128 --epochs 100 --save_appendix component_pin_L3_H16_BS256_LR0.1_E128 --no_val
 is saved.
-----
ltspice_demos - FEGIN
Using 3 layers, 16 hidden units, h = 2
Loading component_pin representation dataset
ENTERED
Training FEGIN on component_pin representation
Train: 1565, Test: 383
##################ITERATION #0 ****************************************
 epoch: 0, train_loss: 1.3878, test_loss: 1.3047, test_f1: 0.2281
 epoch: 1, train_loss: 1.2647, test_loss: 1.3037, test_f1: 0.2281
 epoch: 2, train_loss: 1.2232, test_loss: 1.3548, test_f1: 0.1365
 epoch: 3, train_loss: 1.1766, test_loss: 1.1983, test_f1: 0.2636
 epoch: 4, train_loss: 1.0878, test_loss: 1.1671, test_f1: 0.3311
 epoch: 5, train_loss: 1.0633, test_loss: 1.1183, test_f1: 0.3395
 epoch: 6, train_loss: 1.0734, test_loss: 1.1490, test_f1: 0.3732
 epoch: 7, train_loss: 1.0523, test_loss: 1.1868, test_f1: 0.3506
 epoch: 8, train_loss: 1.0458, test_loss: 1.2545, test_f1: 0.3191
 epoch: 9, train_loss: 1.0353, test_loss: 1.1081, test_f1: 0.3398
 epoch: 10, train_loss: 1.0387, test_loss: 1.1141, test_f1: 0.3863
 epoch: 11, train_loss: 1.0495, test_loss: 1.1121, test_f1: 0.3895
 epoch: 12, train_loss: 1.0689, test_loss: 1.1251, test_f1: 0.3370
 epoch: 13, train_loss: 1.0403, test_loss: 1.1097, test_f1: 0.3395
 epoch: 14, train_loss: 1.0357, test_loss: 1.1070, test_f1: 0.3887
 epoch: 15, train_loss: 1.0323, test_loss: 1.1306, test_f1: 0.4429
 epoch: 16, train_loss: 1.0200, test_loss: 1.1152, test_f1: 0.3420
 epoch: 17, train_loss: 1.0338, test_loss: 1.1217, test_f1: 0.3839
 epoch: 18, train_loss: 1.0286, test_loss: 1.1434, test_f1: 0.3587
 epoch: 19, train_loss: 1.0188, test_loss: 1.1032, test_f1: 0.3849
 epoch: 20, train_loss: 1.0211, test_loss: 1.0959, test_f1: 0.3396
 epoch: 21, train_loss: 1.0298, test_loss: 1.1144, test_f1: 0.3395
 epoch: 22, train_loss: 1.0500, test_loss: 1.1799, test_f1: 0.4186
 epoch: 23, train_loss: 1.0413, test_loss: 1.1498, test_f1: 0.4046
 epoch: 24, train_loss: 1.0467, test_loss: 1.1288, test_f1: 0.3344
 epoch: 25, train_loss: 1.0414, test_loss: 1.1394, test_f1: 0.4279
 epoch: 26, train_loss: 1.0364, test_loss: 1.1383, test_f1: 0.3842
 epoch: 27, train_loss: 1.0330, test_loss: 1.1266, test_f1: 0.4097
 epoch: 28, train_loss: 1.0260, test_loss: 1.1031, test_f1: 0.4273
 epoch: 29, train_loss: 1.0272, test_loss: 1.2526, test_f1: 0.3488
 epoch: 30, train_loss: 1.0185, test_loss: 1.1200, test_f1: 0.3320
 epoch: 31, train_loss: 1.0158, test_loss: 1.1427, test_f1: 0.3759
 epoch: 32, train_loss: 1.0177, test_loss: 1.1252, test_f1: 0.3511
 epoch: 33, train_loss: 1.0321, test_loss: 1.2165, test_f1: 0.4081
 epoch: 34, train_loss: 1.0262, test_loss: 1.3019, test_f1: 0.4065
 epoch: 35, train_loss: 1.0429, test_loss: 1.1214, test_f1: 0.3395
 epoch: 36, train_loss: 1.0398, test_loss: 1.0926, test_f1: 0.3707
 epoch: 37, train_loss: 1.0314, test_loss: 1.2010, test_f1: 0.3125
 epoch: 38, train_loss: 1.0205, test_loss: 1.4259, test_f1: 0.3001
 epoch: 39, train_loss: 1.0309, test_loss: 1.1004, test_f1: 0.3518
 epoch: 40, train_loss: 1.0176, test_loss: 1.2591, test_f1: 0.3476
 epoch: 41, train_loss: 0.9884, test_loss: 1.2034, test_f1: 0.3133
 epoch: 42, train_loss: 0.9751, test_loss: 1.5220, test_f1: 0.3072
 epoch: 43, train_loss: 0.9664, test_loss: 0.9902, test_f1: 0.4408
 epoch: 44, train_loss: 0.9521, test_loss: 3.1460, test_f1: 0.3472
 epoch: 45, train_loss: 0.9803, test_loss: 1.0406, test_f1: 0.4275
 epoch: 46, train_loss: 0.9680, test_loss: 1.0086, test_f1: 0.4408
 epoch: 47, train_loss: 0.9410, test_loss: 1.0353, test_f1: 0.4321
 epoch: 48, train_loss: 0.9382, test_loss: 1.0329, test_f1: 0.5055
 epoch: 49, train_loss: 0.9311, test_loss: 1.0137, test_f1: 0.5130
 epoch: 50, train_loss: 0.9064, test_loss: 1.2936, test_f1: 0.3648
 epoch: 51, train_loss: 0.9171, test_loss: 1.1712, test_f1: 0.3762
 epoch: 52, train_loss: 0.9026, test_loss: 0.9975, test_f1: 0.4405
 epoch: 53, train_loss: 0.8873, test_loss: 0.9976, test_f1: 0.4884
 epoch: 54, train_loss: 0.8872, test_loss: 1.0173, test_f1: 0.4297
 epoch: 55, train_loss: 0.8814, test_loss: 1.0257, test_f1: 0.4256
 epoch: 56, train_loss: 0.8838, test_loss: 1.0729, test_f1: 0.4068
 epoch: 57, train_loss: 0.8902, test_loss: 1.1056, test_f1: 0.3969
 epoch: 58, train_loss: 0.8893, test_loss: 1.0182, test_f1: 0.4361
 epoch: 59, train_loss: 0.9006, test_loss: 1.0162, test_f1: 0.4440
 epoch: 60, train_loss: 0.8919, test_loss: 1.0230, test_f1: 0.4375
 epoch: 61, train_loss: 0.8985, test_loss: 1.0530, test_f1: 0.4260
 epoch: 62, train_loss: 0.8880, test_loss: 1.1495, test_f1: 0.4600
 epoch: 63, train_loss: 0.8975, test_loss: 1.0163, test_f1: 0.4451
 epoch: 64, train_loss: 0.8837, test_loss: 1.0221, test_f1: 0.4377
 epoch: 65, train_loss: 0.8698, test_loss: 1.0482, test_f1: 0.4260
 epoch: 66, train_loss: 0.8844, test_loss: 1.0299, test_f1: 0.4331
 epoch: 67, train_loss: 0.8778, test_loss: 1.0229, test_f1: 0.5127
 epoch: 68, train_loss: 0.8935, test_loss: 1.0119, test_f1: 0.4416
 epoch: 69, train_loss: 0.8866, test_loss: 1.0118, test_f1: 0.4666
 epoch: 70, train_loss: 0.9034, test_loss: 1.0378, test_f1: 0.4351
 epoch: 71, train_loss: 0.9038, test_loss: 1.0315, test_f1: 0.4347
 epoch: 72, train_loss: 0.8913, test_loss: 1.0481, test_f1: 0.4316
 epoch: 73, train_loss: 0.8904, test_loss: 1.0299, test_f1: 0.4419
 epoch: 74, train_loss: 0.8795, test_loss: 1.1028, test_f1: 0.4140
 epoch: 75, train_loss: 0.8852, test_loss: 1.0353, test_f1: 0.4561
 epoch: 76, train_loss: 0.8922, test_loss: 1.0278, test_f1: 0.4587
 epoch: 77, train_loss: 0.8773, test_loss: 1.0172, test_f1: 0.4675
 epoch: 78, train_loss: 0.8774, test_loss: 1.0142, test_f1: 0.4453
 epoch: 79, train_loss: 0.8713, test_loss: 1.0166, test_f1: 0.4361
 epoch: 80, train_loss: 0.8725, test_loss: 1.0751, test_f1: 0.4364
 epoch: 81, train_loss: 0.8721, test_loss: 1.0138, test_f1: 0.4501
 epoch: 82, train_loss: 0.8719, test_loss: 1.0118, test_f1: 0.4409
 epoch: 83, train_loss: 0.8690, test_loss: 1.0233, test_f1: 0.4342
 epoch: 84, train_loss: 0.8782, test_loss: 1.0137, test_f1: 0.4890
 epoch: 85, train_loss: 0.8792, test_loss: 1.0226, test_f1: 0.4213
 epoch: 86, train_loss: 0.8667, test_loss: 1.6817, test_f1: 0.3642
 epoch: 87, train_loss: 0.9660, test_loss: 1.0724, test_f1: 0.4270
 epoch: 88, train_loss: 1.0213, test_loss: 1.0202, test_f1: 0.4547
 epoch: 89, train_loss: 0.9343, test_loss: 1.0226, test_f1: 0.4551
 epoch: 90, train_loss: 0.9272, test_loss: 1.0158, test_f1: 0.4556
 epoch: 91, train_loss: 0.9039, test_loss: 0.9933, test_f1: 0.4700
 epoch: 92, train_loss: 0.9038, test_loss: 1.0132, test_f1: 0.4472
 epoch: 93, train_loss: 0.8914, test_loss: 1.0065, test_f1: 0.4472
 epoch: 94, train_loss: 0.9090, test_loss: 1.0175, test_f1: 0.4406
 epoch: 95, train_loss: 0.8917, test_loss: 1.0335, test_f1: 0.4358
 epoch: 96, train_loss: 0.8944, test_loss: 1.0168, test_f1: 0.4411
 epoch: 97, train_loss: 0.8806, test_loss: 1.0172, test_f1: 0.4450
 epoch: 98, train_loss: 0.8741, test_loss: 1.0406, test_f1: 0.4415
 epoch: 99, train_loss: 0.8759, test_loss: 1.0751, test_f1: 0.4507
##################ITERATION #1 ****************************************
 epoch: 0, train_loss: 1.5117, test_loss: 1.4790, test_f1: 0.2281
 epoch: 1, train_loss: 1.2979, test_loss: 1.3586, test_f1: 0.2281
 epoch: 2, train_loss: 1.2677, test_loss: 1.3166, test_f1: 0.2281
 epoch: 3, train_loss: 1.2540, test_loss: 1.3018, test_f1: 0.2281
 epoch: 4, train_loss: 1.2541, test_loss: 1.3001, test_f1: 0.2281
 epoch: 5, train_loss: 1.2541, test_loss: 1.3005, test_f1: 0.2281
 epoch: 6, train_loss: 1.2532, test_loss: 1.3041, test_f1: 0.2281
 epoch: 7, train_loss: 1.2526, test_loss: 1.3061, test_f1: 0.2281
 epoch: 8, train_loss: 1.2534, test_loss: 1.3060, test_f1: 0.2281
 epoch: 9, train_loss: 1.2537, test_loss: 1.3040, test_f1: 0.2281
 epoch: 10, train_loss: 1.2539, test_loss: 1.3044, test_f1: 0.2281
 epoch: 11, train_loss: 1.2519, test_loss: 1.3025, test_f1: 0.2281
 epoch: 12, train_loss: 1.2529, test_loss: 1.3012, test_f1: 0.2281
 epoch: 13, train_loss: 1.2527, test_loss: 1.3036, test_f1: 0.2281
 epoch: 14, train_loss: 1.2525, test_loss: 1.3054, test_f1: 0.2281
 epoch: 15, train_loss: 1.2525, test_loss: 1.3031, test_f1: 0.2281
 epoch: 16, train_loss: 1.2530, test_loss: 1.3013, test_f1: 0.2281
 epoch: 17, train_loss: 1.2532, test_loss: 1.3007, test_f1: 0.2281
 epoch: 18, train_loss: 1.2531, test_loss: 1.3037, test_f1: 0.2281
 epoch: 19, train_loss: 1.2526, test_loss: 1.3033, test_f1: 0.2281
 epoch: 20, train_loss: 1.2524, test_loss: 1.3012, test_f1: 0.2281
 epoch: 21, train_loss: 1.2525, test_loss: 1.3034, test_f1: 0.2281
 epoch: 22, train_loss: 1.2521, test_loss: 1.3095, test_f1: 0.2281
 epoch: 23, train_loss: 1.2538, test_loss: 1.3124, test_f1: 0.2281
 epoch: 24, train_loss: 1.2538, test_loss: 1.3104, test_f1: 0.2281
 epoch: 25, train_loss: 1.2532, test_loss: 1.3082, test_f1: 0.2281
 epoch: 26, train_loss: 1.2526, test_loss: 1.3022, test_f1: 0.2281
 epoch: 27, train_loss: 1.2519, test_loss: 1.3024, test_f1: 0.2281
 epoch: 28, train_loss: 1.2537, test_loss: 1.3035, test_f1: 0.2281
 epoch: 29, train_loss: 1.2541, test_loss: 1.3056, test_f1: 0.2281
 epoch: 30, train_loss: 1.2535, test_loss: 1.3121, test_f1: 0.2281
 epoch: 31, train_loss: 1.2531, test_loss: 1.3060, test_f1: 0.2281
 epoch: 32, train_loss: 1.2525, test_loss: 1.3004, test_f1: 0.2281
 epoch: 33, train_loss: 1.2541, test_loss: 1.2983, test_f1: 0.2281
 epoch: 34, train_loss: 1.2544, test_loss: 1.2994, test_f1: 0.2281
 epoch: 35, train_loss: 1.2532, test_loss: 1.3048, test_f1: 0.2281
 epoch: 36, train_loss: 1.2525, test_loss: 1.3067, test_f1: 0.2281
 epoch: 37, train_loss: 1.2531, test_loss: 1.3054, test_f1: 0.2281
 epoch: 38, train_loss: 1.2523, test_loss: 1.3056, test_f1: 0.2281
 epoch: 39, train_loss: 1.2528, test_loss: 1.3091, test_f1: 0.2281
 epoch: 40, train_loss: 1.2535, test_loss: 1.3081, test_f1: 0.2281
 epoch: 41, train_loss: 1.2541, test_loss: 1.3118, test_f1: 0.2281
 epoch: 42, train_loss: 1.2539, test_loss: 1.3086, test_f1: 0.2281
 epoch: 43, train_loss: 1.2527, test_loss: 1.3052, test_f1: 0.2281
 epoch: 44, train_loss: 1.2522, test_loss: 1.3039, test_f1: 0.2281
 epoch: 45, train_loss: 1.2525, test_loss: 1.3031, test_f1: 0.2281
 epoch: 46, train_loss: 1.2527, test_loss: 1.3039, test_f1: 0.2281
 epoch: 47, train_loss: 1.2522, test_loss: 1.3040, test_f1: 0.2281
 epoch: 48, train_loss: 1.2528, test_loss: 1.3046, test_f1: 0.2281
 epoch: 49, train_loss: 1.2524, test_loss: 1.3042, test_f1: 0.2281
 epoch: 50, train_loss: 1.2529, test_loss: 1.3072, test_f1: 0.2281
 epoch: 51, train_loss: 1.2523, test_loss: 1.3069, test_f1: 0.2281
 epoch: 52, train_loss: 1.2523, test_loss: 1.3066, test_f1: 0.2281
 epoch: 53, train_loss: 1.2525, test_loss: 1.3083, test_f1: 0.2281
 epoch: 54, train_loss: 1.2529, test_loss: 1.3082, test_f1: 0.2281
 epoch: 55, train_loss: 1.2524, test_loss: 1.3066, test_f1: 0.2281
 epoch: 56, train_loss: 1.2524, test_loss: 1.3056, test_f1: 0.2281
 epoch: 57, train_loss: 1.2520, test_loss: 1.3032, test_f1: 0.2281
 epoch: 58, train_loss: 1.2523, test_loss: 1.3007, test_f1: 0.2281
 epoch: 59, train_loss: 1.2529, test_loss: 1.3006, test_f1: 0.2281
 epoch: 60, train_loss: 1.2531, test_loss: 1.3019, test_f1: 0.2281
 epoch: 61, train_loss: 1.2525, test_loss: 1.3038, test_f1: 0.2281
 epoch: 62, train_loss: 1.2523, test_loss: 1.3070, test_f1: 0.2281
 epoch: 63, train_loss: 1.2525, test_loss: 1.3065, test_f1: 0.2281
 epoch: 64, train_loss: 1.2522, test_loss: 1.3073, test_f1: 0.2281
 epoch: 65, train_loss: 1.2525, test_loss: 1.3079, test_f1: 0.2281
 epoch: 66, train_loss: 1.2534, test_loss: 1.3072, test_f1: 0.2281
 epoch: 67, train_loss: 1.2523, test_loss: 1.3042, test_f1: 0.2281
 epoch: 68, train_loss: 1.2521, test_loss: 1.3037, test_f1: 0.2281
 epoch: 69, train_loss: 1.2523, test_loss: 1.3042, test_f1: 0.2281
 epoch: 70, train_loss: 1.2522, test_loss: 1.3059, test_f1: 0.2281
 epoch: 71, train_loss: 1.2524, test_loss: 1.3074, test_f1: 0.2281
 epoch: 72, train_loss: 1.2527, test_loss: 1.3082, test_f1: 0.2281
 epoch: 73, train_loss: 1.2523, test_loss: 1.3062, test_f1: 0.2281
 epoch: 74, train_loss: 1.2522, test_loss: 1.3047, test_f1: 0.2281
 epoch: 75, train_loss: 1.2524, test_loss: 1.3046, test_f1: 0.2281
 epoch: 76, train_loss: 1.2531, test_loss: 1.3022, test_f1: 0.2281
 epoch: 77, train_loss: 1.2521, test_loss: 1.3034, test_f1: 0.2281
 epoch: 78, train_loss: 1.2521, test_loss: 1.3047, test_f1: 0.2281
 epoch: 79, train_loss: 1.2522, test_loss: 1.3056, test_f1: 0.2281
 epoch: 80, train_loss: 1.2527, test_loss: 1.3049, test_f1: 0.2281
 epoch: 81, train_loss: 1.2522, test_loss: 1.3024, test_f1: 0.2281
 epoch: 82, train_loss: 1.2527, test_loss: 1.3015, test_f1: 0.2281
 epoch: 83, train_loss: 1.2525, test_loss: 1.3048, test_f1: 0.2281
 epoch: 84, train_loss: 1.2520, test_loss: 1.3060, test_f1: 0.2281
 epoch: 85, train_loss: 1.2525, test_loss: 1.3039, test_f1: 0.2281
 epoch: 86, train_loss: 1.2527, test_loss: 1.3032, test_f1: 0.2281
 epoch: 87, train_loss: 1.2523, test_loss: 1.3063, test_f1: 0.2281
 epoch: 88, train_loss: 1.2522, test_loss: 1.3069, test_f1: 0.2281
 epoch: 89, train_loss: 1.2522, test_loss: 1.3065, test_f1: 0.2281
 epoch: 90, train_loss: 1.2521, test_loss: 1.3052, test_f1: 0.2281
 epoch: 91, train_loss: 1.2522, test_loss: 1.3061, test_f1: 0.2281
 epoch: 92, train_loss: 1.2520, test_loss: 1.3072, test_f1: 0.2281
 epoch: 93, train_loss: 1.2525, test_loss: 1.3077, test_f1: 0.2281
 epoch: 94, train_loss: 1.2529, test_loss: 1.3089, test_f1: 0.2281
 epoch: 95, train_loss: 1.2527, test_loss: 1.3054, test_f1: 0.2281
 epoch: 96, train_loss: 1.2520, test_loss: 1.3036, test_f1: 0.2281
 epoch: 97, train_loss: 1.2524, test_loss: 1.3031, test_f1: 0.2281
 epoch: 98, train_loss: 1.2523, test_loss: 1.3040, test_f1: 0.2281
 epoch: 99, train_loss: 1.2523, test_loss: 1.3057, test_f1: 0.2281
##################ITERATION #2 ****************************************
 epoch: 0, train_loss: 1.2576, test_loss: 1.3027, test_f1: 0.2281
 epoch: 1, train_loss: 1.2537, test_loss: 1.3045, test_f1: 0.2281
 epoch: 2, train_loss: 1.2527, test_loss: 1.3101, test_f1: 0.2281
 epoch: 3, train_loss: 1.2533, test_loss: 1.3082, test_f1: 0.2281
 epoch: 4, train_loss: 1.2535, test_loss: 1.3017, test_f1: 0.2281
 epoch: 5, train_loss: 1.2533, test_loss: 1.3066, test_f1: 0.2281
 epoch: 6, train_loss: 1.2527, test_loss: 1.3065, test_f1: 0.2281
 epoch: 7, train_loss: 1.2531, test_loss: 1.3068, test_f1: 0.2281
 epoch: 8, train_loss: 1.2536, test_loss: 1.3102, test_f1: 0.2281
 epoch: 9, train_loss: 1.2526, test_loss: 1.3060, test_f1: 0.2281
 epoch: 10, train_loss: 1.2523, test_loss: 1.3056, test_f1: 0.2281
 epoch: 11, train_loss: 1.2521, test_loss: 1.3051, test_f1: 0.2281
 epoch: 12, train_loss: 1.2531, test_loss: 1.3043, test_f1: 0.2281
 epoch: 13, train_loss: 1.2530, test_loss: 1.3051, test_f1: 0.2281
 epoch: 14, train_loss: 1.2533, test_loss: 1.3019, test_f1: 0.2281
 epoch: 15, train_loss: 1.2526, test_loss: 1.3029, test_f1: 0.2281
 epoch: 16, train_loss: 1.2525, test_loss: 1.3034, test_f1: 0.2281
 epoch: 17, train_loss: 1.2523, test_loss: 1.3048, test_f1: 0.2281
 epoch: 18, train_loss: 1.2527, test_loss: 1.3072, test_f1: 0.2281
 epoch: 19, train_loss: 1.2533, test_loss: 1.3074, test_f1: 0.2281
 epoch: 20, train_loss: 1.2547, test_loss: 1.3041, test_f1: 0.2281
 epoch: 21, train_loss: 1.2531, test_loss: 1.3010, test_f1: 0.2281
 epoch: 22, train_loss: 1.2544, test_loss: 1.3037, test_f1: 0.2281
 epoch: 23, train_loss: 1.2531, test_loss: 1.3089, test_f1: 0.2281
 epoch: 24, train_loss: 1.2528, test_loss: 1.3093, test_f1: 0.2281
 epoch: 25, train_loss: 1.2534, test_loss: 1.3058, test_f1: 0.2281
 epoch: 26, train_loss: 1.2525, test_loss: 1.3053, test_f1: 0.2281
 epoch: 27, train_loss: 1.2521, test_loss: 1.3088, test_f1: 0.2281
 epoch: 28, train_loss: 1.2526, test_loss: 1.3069, test_f1: 0.2281
 epoch: 29, train_loss: 1.2528, test_loss: 1.3015, test_f1: 0.2281
 epoch: 30, train_loss: 1.2538, test_loss: 1.2983, test_f1: 0.2281
 epoch: 31, train_loss: 1.2535, test_loss: 1.3032, test_f1: 0.2281
 epoch: 32, train_loss: 1.2523, test_loss: 1.3028, test_f1: 0.2281
 epoch: 33, train_loss: 1.2526, test_loss: 1.3046, test_f1: 0.2281
 epoch: 34, train_loss: 1.2529, test_loss: 1.3069, test_f1: 0.2281
 epoch: 35, train_loss: 1.2535, test_loss: 1.3060, test_f1: 0.2281
 epoch: 36, train_loss: 1.2530, test_loss: 1.3018, test_f1: 0.2281
 epoch: 37, train_loss: 1.2526, test_loss: 1.3051, test_f1: 0.2281
 epoch: 38, train_loss: 1.2526, test_loss: 1.3104, test_f1: 0.2281
 epoch: 39, train_loss: 1.2528, test_loss: 1.3102, test_f1: 0.2281
 epoch: 40, train_loss: 1.2534, test_loss: 1.3081, test_f1: 0.2281
 epoch: 41, train_loss: 1.2542, test_loss: 1.3024, test_f1: 0.2281
 epoch: 42, train_loss: 1.2540, test_loss: 1.3012, test_f1: 0.2281
 epoch: 43, train_loss: 1.2523, test_loss: 1.3078, test_f1: 0.2281
 epoch: 44, train_loss: 1.2540, test_loss: 1.3075, test_f1: 0.2281
 epoch: 45, train_loss: 1.2531, test_loss: 1.3082, test_f1: 0.2281
 epoch: 46, train_loss: 1.2522, test_loss: 1.3055, test_f1: 0.2281
 epoch: 47, train_loss: 1.2529, test_loss: 1.3024, test_f1: 0.2281
 epoch: 48, train_loss: 1.2521, test_loss: 1.3006, test_f1: 0.2281
 epoch: 49, train_loss: 1.2537, test_loss: 1.3040, test_f1: 0.2281
 epoch: 50, train_loss: 1.2532, test_loss: 1.3068, test_f1: 0.2281
 epoch: 51, train_loss: 1.2529, test_loss: 1.3087, test_f1: 0.2281
 epoch: 52, train_loss: 1.2528, test_loss: 1.3058, test_f1: 0.2281
 epoch: 53, train_loss: 1.2522, test_loss: 1.3051, test_f1: 0.2281
 epoch: 54, train_loss: 1.2521, test_loss: 1.3054, test_f1: 0.2281
 epoch: 55, train_loss: 1.2524, test_loss: 1.3049, test_f1: 0.2281
 epoch: 56, train_loss: 1.2524, test_loss: 1.3018, test_f1: 0.2281
 epoch: 57, train_loss: 1.2524, test_loss: 1.3024, test_f1: 0.2281
 epoch: 58, train_loss: 1.2529, test_loss: 1.3037, test_f1: 0.2281
 epoch: 59, train_loss: 1.2527, test_loss: 1.3041, test_f1: 0.2281
 epoch: 60, train_loss: 1.2528, test_loss: 1.3039, test_f1: 0.2281
 epoch: 61, train_loss: 1.2531, test_loss: 1.3022, test_f1: 0.2281
 epoch: 62, train_loss: 1.2535, test_loss: 1.3056, test_f1: 0.2281
 epoch: 63, train_loss: 1.2533, test_loss: 1.3063, test_f1: 0.2281
 epoch: 64, train_loss: 1.2519, test_loss: 1.3057, test_f1: 0.2281
 epoch: 65, train_loss: 1.2524, test_loss: 1.3033, test_f1: 0.2281
 epoch: 66, train_loss: 1.2534, test_loss: 1.3023, test_f1: 0.2281
 epoch: 67, train_loss: 1.2524, test_loss: 1.3054, test_f1: 0.2281
 epoch: 68, train_loss: 1.2521, test_loss: 1.3058, test_f1: 0.2281
 epoch: 69, train_loss: 1.2527, test_loss: 1.3024, test_f1: 0.2281
 epoch: 70, train_loss: 1.2522, test_loss: 1.3018, test_f1: 0.2281
 epoch: 71, train_loss: 1.2526, test_loss: 1.3022, test_f1: 0.2281
 epoch: 72, train_loss: 1.2527, test_loss: 1.3009, test_f1: 0.2281
 epoch: 73, train_loss: 1.2529, test_loss: 1.3017, test_f1: 0.2281
 epoch: 74, train_loss: 1.2522, test_loss: 1.3031, test_f1: 0.2281
 epoch: 75, train_loss: 1.2520, test_loss: 1.3066, test_f1: 0.2281
 epoch: 76, train_loss: 1.2525, test_loss: 1.3084, test_f1: 0.2281
 epoch: 77, train_loss: 1.2526, test_loss: 1.3076, test_f1: 0.2281
 epoch: 78, train_loss: 1.2524, test_loss: 1.3070, test_f1: 0.2281
 epoch: 79, train_loss: 1.2521, test_loss: 1.3061, test_f1: 0.2281
 epoch: 80, train_loss: 1.2522, test_loss: 1.3076, test_f1: 0.2281
 epoch: 81, train_loss: 1.2523, test_loss: 1.3086, test_f1: 0.2281
 epoch: 82, train_loss: 1.2526, test_loss: 1.3077, test_f1: 0.2281
 epoch: 83, train_loss: 1.2529, test_loss: 1.3061, test_f1: 0.2281
 epoch: 84, train_loss: 1.2523, test_loss: 1.3042, test_f1: 0.2281
 epoch: 85, train_loss: 1.2519, test_loss: 1.3045, test_f1: 0.2281
 epoch: 86, train_loss: 1.2527, test_loss: 1.3052, test_f1: 0.2281
 epoch: 87, train_loss: 1.2525, test_loss: 1.3038, test_f1: 0.2281
 epoch: 88, train_loss: 1.2523, test_loss: 1.3024, test_f1: 0.2281
 epoch: 89, train_loss: 1.2526, test_loss: 1.3026, test_f1: 0.2281
 epoch: 90, train_loss: 1.2522, test_loss: 1.3073, test_f1: 0.2281
 epoch: 91, train_loss: 1.2528, test_loss: 1.3116, test_f1: 0.2281
 epoch: 92, train_loss: 1.2532, test_loss: 1.3106, test_f1: 0.2281
 epoch: 93, train_loss: 1.2528, test_loss: 1.3071, test_f1: 0.2281
 epoch: 94, train_loss: 1.2527, test_loss: 1.3044, test_f1: 0.2281
 epoch: 95, train_loss: 1.2522, test_loss: 1.3047, test_f1: 0.2281
 epoch: 96, train_loss: 1.2525, test_loss: 1.3022, test_f1: 0.2281
 epoch: 97, train_loss: 1.2533, test_loss: 1.3020, test_f1: 0.2281
 epoch: 98, train_loss: 1.2527, test_loss: 1.3002, test_f1: 0.2281
 epoch: 99, train_loss: 1.2533, test_loss: 1.3021, test_f1: 0.2281
##################ITERATION #3 ****************************************
 epoch: 0, train_loss: 1.2549, test_loss: 1.3054, test_f1: 0.2281
 epoch: 1, train_loss: 1.2528, test_loss: 1.3102, test_f1: 0.2281
 epoch: 2, train_loss: 1.2529, test_loss: 1.3063, test_f1: 0.2281
 epoch: 3, train_loss: 1.2534, test_loss: 1.3030, test_f1: 0.2281
 epoch: 4, train_loss: 1.2525, test_loss: 1.3059, test_f1: 0.2281
 epoch: 5, train_loss: 1.2544, test_loss: 1.3059, test_f1: 0.2281
 epoch: 6, train_loss: 1.2525, test_loss: 1.3019, test_f1: 0.2281
 epoch: 7, train_loss: 1.2526, test_loss: 1.3022, test_f1: 0.2281
 epoch: 8, train_loss: 1.2530, test_loss: 1.3045, test_f1: 0.2281
 epoch: 9, train_loss: 1.2549, test_loss: 1.3129, test_f1: 0.2281
 epoch: 10, train_loss: 1.2544, test_loss: 1.3121, test_f1: 0.2281
 epoch: 11, train_loss: 1.2537, test_loss: 1.3088, test_f1: 0.2281
 epoch: 12, train_loss: 1.2520, test_loss: 1.3049, test_f1: 0.2281
 epoch: 13, train_loss: 1.2537, test_loss: 1.3048, test_f1: 0.2281
 epoch: 14, train_loss: 1.2524, test_loss: 1.3089, test_f1: 0.2281
 epoch: 15, train_loss: 1.2549, test_loss: 1.3049, test_f1: 0.2281
 epoch: 16, train_loss: 1.2529, test_loss: 1.3027, test_f1: 0.2281
 epoch: 17, train_loss: 1.2544, test_loss: 1.3053, test_f1: 0.2281
 epoch: 18, train_loss: 1.2531, test_loss: 1.3114, test_f1: 0.2281
 epoch: 19, train_loss: 1.2557, test_loss: 1.3079, test_f1: 0.2281
 epoch: 20, train_loss: 1.2529, test_loss: 1.3021, test_f1: 0.2281
 epoch: 21, train_loss: 1.2525, test_loss: 1.3019, test_f1: 0.2281
 epoch: 22, train_loss: 1.2528, test_loss: 1.3018, test_f1: 0.2281
 epoch: 23, train_loss: 1.2525, test_loss: 1.3074, test_f1: 0.2281
 epoch: 24, train_loss: 1.2531, test_loss: 1.3065, test_f1: 0.2281
 epoch: 25, train_loss: 1.2527, test_loss: 1.3019, test_f1: 0.2281
 epoch: 26, train_loss: 1.2528, test_loss: 1.3005, test_f1: 0.2281
 epoch: 27, train_loss: 1.2526, test_loss: 1.3059, test_f1: 0.2281
 epoch: 28, train_loss: 1.2526, test_loss: 1.3083, test_f1: 0.2281
 epoch: 29, train_loss: 1.2528, test_loss: 1.3075, test_f1: 0.2281
 epoch: 30, train_loss: 1.2528, test_loss: 1.3028, test_f1: 0.2281
 epoch: 31, train_loss: 1.2525, test_loss: 1.3058, test_f1: 0.2281
 epoch: 32, train_loss: 1.2533, test_loss: 1.3084, test_f1: 0.2281
 epoch: 33, train_loss: 1.2529, test_loss: 1.3085, test_f1: 0.2281
 epoch: 34, train_loss: 1.2529, test_loss: 1.3091, test_f1: 0.2281
 epoch: 35, train_loss: 1.2522, test_loss: 1.3047, test_f1: 0.2281
 epoch: 36, train_loss: 1.2523, test_loss: 1.3024, test_f1: 0.2281
 epoch: 37, train_loss: 1.2530, test_loss: 1.3068, test_f1: 0.2281
 epoch: 38, train_loss: 1.2530, test_loss: 1.3087, test_f1: 0.2281
 epoch: 39, train_loss: 1.2533, test_loss: 1.3060, test_f1: 0.2281
 epoch: 40, train_loss: 1.2531, test_loss: 1.3057, test_f1: 0.2281
 epoch: 41, train_loss: 1.2526, test_loss: 1.3092, test_f1: 0.2281
 epoch: 42, train_loss: 1.2532, test_loss: 1.3099, test_f1: 0.2281
 epoch: 43, train_loss: 1.2541, test_loss: 1.3083, test_f1: 0.2281
 epoch: 44, train_loss: 1.2535, test_loss: 1.3047, test_f1: 0.2281
 epoch: 45, train_loss: 1.2532, test_loss: 1.3043, test_f1: 0.2281
 epoch: 46, train_loss: 1.2533, test_loss: 1.3085, test_f1: 0.2281
 epoch: 47, train_loss: 1.2526, test_loss: 1.3027, test_f1: 0.2281
 epoch: 48, train_loss: 1.2529, test_loss: 1.2997, test_f1: 0.2281
 epoch: 49, train_loss: 1.2537, test_loss: 1.3029, test_f1: 0.2281
 epoch: 50, train_loss: 1.2530, test_loss: 1.3035, test_f1: 0.2281
 epoch: 51, train_loss: 1.2526, test_loss: 1.3059, test_f1: 0.2281
 epoch: 52, train_loss: 1.2524, test_loss: 1.3048, test_f1: 0.2281
 epoch: 53, train_loss: 1.2521, test_loss: 1.3045, test_f1: 0.2281
 epoch: 54, train_loss: 1.2520, test_loss: 1.3076, test_f1: 0.2281
 epoch: 55, train_loss: 1.2525, test_loss: 1.3098, test_f1: 0.2281
 epoch: 56, train_loss: 1.2528, test_loss: 1.3105, test_f1: 0.2281
 epoch: 57, train_loss: 1.2525, test_loss: 1.3059, test_f1: 0.2281
 epoch: 58, train_loss: 1.2527, test_loss: 1.3029, test_f1: 0.2281
 epoch: 59, train_loss: 1.2526, test_loss: 1.3017, test_f1: 0.2281
 epoch: 60, train_loss: 1.2527, test_loss: 1.3013, test_f1: 0.2281
 epoch: 61, train_loss: 1.2524, test_loss: 1.3031, test_f1: 0.2281
 epoch: 62, train_loss: 1.2524, test_loss: 1.3031, test_f1: 0.2281
 epoch: 63, train_loss: 1.2522, test_loss: 1.3045, test_f1: 0.2281
 epoch: 64, train_loss: 1.2522, test_loss: 1.3062, test_f1: 0.2281
 epoch: 65, train_loss: 1.2523, test_loss: 1.3078, test_f1: 0.2281
 epoch: 66, train_loss: 1.2527, test_loss: 1.3082, test_f1: 0.2281
 epoch: 67, train_loss: 1.2526, test_loss: 1.3076, test_f1: 0.2281
 epoch: 68, train_loss: 1.2525, test_loss: 1.3053, test_f1: 0.2281
 epoch: 69, train_loss: 1.2522, test_loss: 1.3058, test_f1: 0.2281
 epoch: 70, train_loss: 1.2528, test_loss: 1.3041, test_f1: 0.2281
 epoch: 71, train_loss: 1.2523, test_loss: 1.3052, test_f1: 0.2281
 epoch: 72, train_loss: 1.2522, test_loss: 1.3056, test_f1: 0.2281
 epoch: 73, train_loss: 1.2523, test_loss: 1.3032, test_f1: 0.2281
 epoch: 74, train_loss: 1.2526, test_loss: 1.3036, test_f1: 0.2281
 epoch: 75, train_loss: 1.2520, test_loss: 1.3040, test_f1: 0.2281
 epoch: 76, train_loss: 1.2527, test_loss: 1.3054, test_f1: 0.2281
 epoch: 77, train_loss: 1.2523, test_loss: 1.3068, test_f1: 0.2281
 epoch: 78, train_loss: 1.2524, test_loss: 1.3075, test_f1: 0.2281
 epoch: 79, train_loss: 1.2529, test_loss: 1.3064, test_f1: 0.2281
 epoch: 80, train_loss: 1.2531, test_loss: 1.3051, test_f1: 0.2281
 epoch: 81, train_loss: 1.2528, test_loss: 1.3068, test_f1: 0.2281
 epoch: 82, train_loss: 1.2524, test_loss: 1.3065, test_f1: 0.2281
 epoch: 83, train_loss: 1.2524, test_loss: 1.3059, test_f1: 0.2281
 epoch: 84, train_loss: 1.2522, test_loss: 1.3060, test_f1: 0.2281
 epoch: 85, train_loss: 1.2523, test_loss: 1.3066, test_f1: 0.2281
 epoch: 86, train_loss: 1.2530, test_loss: 1.3050, test_f1: 0.2281
 epoch: 87, train_loss: 1.2527, test_loss: 1.3030, test_f1: 0.2281
 epoch: 88, train_loss: 1.2524, test_loss: 1.3023, test_f1: 0.2281
 epoch: 89, train_loss: 1.2529, test_loss: 1.3058, test_f1: 0.2281
 epoch: 90, train_loss: 1.2529, test_loss: 1.3076, test_f1: 0.2281
 epoch: 91, train_loss: 1.2529, test_loss: 1.3107, test_f1: 0.2281
 epoch: 92, train_loss: 1.2533, test_loss: 1.3132, test_f1: 0.2281
 epoch: 93, train_loss: 1.2533, test_loss: 1.3095, test_f1: 0.2281
 epoch: 94, train_loss: 1.2523, test_loss: 1.3065, test_f1: 0.2281
 epoch: 95, train_loss: 1.2523, test_loss: 1.3059, test_f1: 0.2281
 epoch: 96, train_loss: 1.2521, test_loss: 1.3054, test_f1: 0.2281
 epoch: 97, train_loss: 1.2522, test_loss: 1.3025, test_f1: 0.2281
 epoch: 98, train_loss: 1.2528, test_loss: 1.3035, test_f1: 0.2281
 epoch: 99, train_loss: 1.2523, test_loss: 1.3049, test_f1: 0.2281
##################ITERATION #4 ****************************************
 epoch: 0, train_loss: 1.2565, test_loss: 1.3104, test_f1: 0.2281
 epoch: 1, train_loss: 1.2544, test_loss: 1.3104, test_f1: 0.2281
 epoch: 2, train_loss: 1.2531, test_loss: 1.3074, test_f1: 0.2281
 epoch: 3, train_loss: 1.2535, test_loss: 1.3064, test_f1: 0.2281
 epoch: 4, train_loss: 1.2524, test_loss: 1.3007, test_f1: 0.2281
 epoch: 5, train_loss: 1.2544, test_loss: 1.2993, test_f1: 0.2281
 epoch: 6, train_loss: 1.2534, test_loss: 1.3014, test_f1: 0.2281
 epoch: 7, train_loss: 1.2523, test_loss: 1.3049, test_f1: 0.2281
 epoch: 8, train_loss: 1.2528, test_loss: 1.3054, test_f1: 0.2281
 epoch: 9, train_loss: 1.2526, test_loss: 1.3027, test_f1: 0.2281
 epoch: 10, train_loss: 1.2530, test_loss: 1.3013, test_f1: 0.2281
 epoch: 11, train_loss: 1.2538, test_loss: 1.3013, test_f1: 0.2281
 epoch: 12, train_loss: 1.2553, test_loss: 1.3053, test_f1: 0.2281
 epoch: 13, train_loss: 1.2549, test_loss: 1.3069, test_f1: 0.2281
 epoch: 14, train_loss: 1.2529, test_loss: 1.3084, test_f1: 0.2281
 epoch: 15, train_loss: 1.2520, test_loss: 1.3029, test_f1: 0.2281
 epoch: 16, train_loss: 1.2525, test_loss: 1.3029, test_f1: 0.2281
 epoch: 17, train_loss: 1.2523, test_loss: 1.3022, test_f1: 0.2281
 epoch: 18, train_loss: 1.2521, test_loss: 1.3052, test_f1: 0.2281
 epoch: 19, train_loss: 1.2524, test_loss: 1.3071, test_f1: 0.2281
 epoch: 20, train_loss: 1.2550, test_loss: 1.3027, test_f1: 0.2281
 epoch: 21, train_loss: 1.2534, test_loss: 1.3037, test_f1: 0.2281
 epoch: 22, train_loss: 1.2529, test_loss: 1.3034, test_f1: 0.2281
 epoch: 23, train_loss: 1.2534, test_loss: 1.3047, test_f1: 0.2281
 epoch: 24, train_loss: 1.2530, test_loss: 1.3085, test_f1: 0.2281
 epoch: 25, train_loss: 1.2533, test_loss: 1.3055, test_f1: 0.2281
 epoch: 26, train_loss: 1.2524, test_loss: 1.3044, test_f1: 0.2281
 epoch: 27, train_loss: 1.2526, test_loss: 1.3081, test_f1: 0.2281
 epoch: 28, train_loss: 1.2531, test_loss: 1.3132, test_f1: 0.2281
 epoch: 29, train_loss: 1.2539, test_loss: 1.3139, test_f1: 0.2281
 epoch: 30, train_loss: 1.2542, test_loss: 1.3092, test_f1: 0.2281
 epoch: 31, train_loss: 1.2530, test_loss: 1.3044, test_f1: 0.2281
 epoch: 32, train_loss: 1.2524, test_loss: 1.3045, test_f1: 0.2281
 epoch: 33, train_loss: 1.2529, test_loss: 1.3045, test_f1: 0.2281
 epoch: 34, train_loss: 1.2533, test_loss: 1.3006, test_f1: 0.2281
 epoch: 35, train_loss: 1.2533, test_loss: 1.3021, test_f1: 0.2281
 epoch: 36, train_loss: 1.2543, test_loss: 1.3056, test_f1: 0.2281
 epoch: 37, train_loss: 1.2546, test_loss: 1.3061, test_f1: 0.2281
 epoch: 38, train_loss: 1.2531, test_loss: 1.3041, test_f1: 0.2281
 epoch: 39, train_loss: 1.2530, test_loss: 1.3006, test_f1: 0.2281
 epoch: 40, train_loss: 1.2525, test_loss: 1.3050, test_f1: 0.2281
 epoch: 41, train_loss: 1.2523, test_loss: 1.3035, test_f1: 0.2281
 epoch: 42, train_loss: 1.2522, test_loss: 1.3054, test_f1: 0.2281
 epoch: 43, train_loss: 1.2527, test_loss: 1.3039, test_f1: 0.2281
 epoch: 44, train_loss: 1.2528, test_loss: 1.3044, test_f1: 0.2281
 epoch: 45, train_loss: 1.2522, test_loss: 1.3070, test_f1: 0.2281
 epoch: 46, train_loss: 1.2524, test_loss: 1.3115, test_f1: 0.2281
 epoch: 47, train_loss: 1.2535, test_loss: 1.3103, test_f1: 0.2281
 epoch: 48, train_loss: 1.2527, test_loss: 1.3077, test_f1: 0.2281
 epoch: 49, train_loss: 1.2528, test_loss: 1.3044, test_f1: 0.2281
 epoch: 50, train_loss: 1.2524, test_loss: 1.3064, test_f1: 0.2281
 epoch: 51, train_loss: 1.2526, test_loss: 1.3074, test_f1: 0.2281
 epoch: 52, train_loss: 1.2526, test_loss: 1.3086, test_f1: 0.2281
 epoch: 53, train_loss: 1.2522, test_loss: 1.3057, test_f1: 0.2281
 epoch: 54, train_loss: 1.2519, test_loss: 1.3039, test_f1: 0.2281
 epoch: 55, train_loss: 1.2521, test_loss: 1.3046, test_f1: 0.2281
 epoch: 56, train_loss: 1.2521, test_loss: 1.3075, test_f1: 0.2281
 epoch: 57, train_loss: 1.2526, test_loss: 1.3096, test_f1: 0.2281
 epoch: 58, train_loss: 1.2523, test_loss: 1.3062, test_f1: 0.2281
 epoch: 59, train_loss: 1.2521, test_loss: 1.3042, test_f1: 0.2281
 epoch: 60, train_loss: 1.2523, test_loss: 1.3019, test_f1: 0.2281
 epoch: 61, train_loss: 1.2528, test_loss: 1.3005, test_f1: 0.2281
 epoch: 62, train_loss: 1.2528, test_loss: 1.3028, test_f1: 0.2281
 epoch: 63, train_loss: 1.2524, test_loss: 1.3027, test_f1: 0.2281
 epoch: 64, train_loss: 1.2522, test_loss: 1.3017, test_f1: 0.2281
 epoch: 65, train_loss: 1.2522, test_loss: 1.3030, test_f1: 0.2281
 epoch: 66, train_loss: 1.2521, test_loss: 1.3036, test_f1: 0.2281
 epoch: 67, train_loss: 1.2521, test_loss: 1.3024, test_f1: 0.2281
 epoch: 68, train_loss: 1.2523, test_loss: 1.3025, test_f1: 0.2281
 epoch: 69, train_loss: 1.2524, test_loss: 1.3050, test_f1: 0.2281
 epoch: 70, train_loss: 1.2525, test_loss: 1.3038, test_f1: 0.2281
 epoch: 71, train_loss: 1.2524, test_loss: 1.3012, test_f1: 0.2281
 epoch: 72, train_loss: 1.2523, test_loss: 1.3029, test_f1: 0.2281
 epoch: 73, train_loss: 1.2524, test_loss: 1.3062, test_f1: 0.2281
 epoch: 74, train_loss: 1.2531, test_loss: 1.3078, test_f1: 0.2281
 epoch: 75, train_loss: 1.2528, test_loss: 1.3074, test_f1: 0.2281
 epoch: 76, train_loss: 1.2524, test_loss: 1.3053, test_f1: 0.2281
 epoch: 77, train_loss: 1.2522, test_loss: 1.3054, test_f1: 0.2281
 epoch: 78, train_loss: 1.2522, test_loss: 1.3043, test_f1: 0.2281
 epoch: 79, train_loss: 1.2526, test_loss: 1.3028, test_f1: 0.2281
 epoch: 80, train_loss: 1.2522, test_loss: 1.3012, test_f1: 0.2281
 epoch: 81, train_loss: 1.2525, test_loss: 1.3004, test_f1: 0.2281
 epoch: 82, train_loss: 1.2535, test_loss: 1.2991, test_f1: 0.2281
 epoch: 83, train_loss: 1.2538, test_loss: 1.3009, test_f1: 0.2281
 epoch: 84, train_loss: 1.2527, test_loss: 1.3032, test_f1: 0.2281
 epoch: 85, train_loss: 1.2517, test_loss: 1.3054, test_f1: 0.2281
 epoch: 86, train_loss: 1.2526, test_loss: 1.3062, test_f1: 0.2281
 epoch: 87, train_loss: 1.2534, test_loss: 1.3033, test_f1: 0.2281
 epoch: 88, train_loss: 1.2530, test_loss: 1.3029, test_f1: 0.2281
 epoch: 89, train_loss: 1.2527, test_loss: 1.3026, test_f1: 0.2281
 epoch: 90, train_loss: 1.2530, test_loss: 1.3017, test_f1: 0.2281
 epoch: 91, train_loss: 1.2521, test_loss: 1.3037, test_f1: 0.2281
 epoch: 92, train_loss: 1.2526, test_loss: 1.3063, test_f1: 0.2281
 epoch: 93, train_loss: 1.2525, test_loss: 1.3057, test_f1: 0.2281
 epoch: 94, train_loss: 1.2522, test_loss: 1.3056, test_f1: 0.2281
 epoch: 95, train_loss: 1.2523, test_loss: 1.3052, test_f1: 0.2281
 epoch: 96, train_loss: 1.2523, test_loss: 1.3046, test_f1: 0.2281
 epoch: 97, train_loss: 1.2524, test_loss: 1.3044, test_f1: 0.2281
 epoch: 98, train_loss: 1.2530, test_loss: 1.3023, test_f1: 0.2281
 epoch: 99, train_loss: 1.2525, test_loss: 1.3042, test_f1: 0.2281
##################ITERATION #5 ****************************************
 epoch: 0, train_loss: 1.2561, test_loss: 1.2995, test_f1: 0.2281
 epoch: 1, train_loss: 1.2562, test_loss: 1.3007, test_f1: 0.2281
 epoch: 2, train_loss: 1.2548, test_loss: 1.3058, test_f1: 0.2281
 epoch: 3, train_loss: 1.2519, test_loss: 1.3118, test_f1: 0.2281
 epoch: 4, train_loss: 1.2542, test_loss: 1.3088, test_f1: 0.2281
 epoch: 5, train_loss: 1.2530, test_loss: 1.3062, test_f1: 0.2281
 epoch: 6, train_loss: 1.2534, test_loss: 1.3025, test_f1: 0.2281
 epoch: 7, train_loss: 1.2544, test_loss: 1.3024, test_f1: 0.2281
 epoch: 8, train_loss: 1.2533, test_loss: 1.3077, test_f1: 0.2281
 epoch: 9, train_loss: 1.2538, test_loss: 1.3064, test_f1: 0.2281
 epoch: 10, train_loss: 1.2529, test_loss: 1.3009, test_f1: 0.2281
 epoch: 11, train_loss: 1.2545, test_loss: 1.3001, test_f1: 0.2281
 epoch: 12, train_loss: 1.2525, test_loss: 1.3056, test_f1: 0.2281
 epoch: 13, train_loss: 1.2531, test_loss: 1.3057, test_f1: 0.2281
 epoch: 14, train_loss: 1.2528, test_loss: 1.3084, test_f1: 0.2281
 epoch: 15, train_loss: 1.2521, test_loss: 1.3100, test_f1: 0.2281
 epoch: 16, train_loss: 1.2555, test_loss: 1.3146, test_f1: 0.2281
 epoch: 17, train_loss: 1.2541, test_loss: 1.3131, test_f1: 0.2281
 epoch: 18, train_loss: 1.2529, test_loss: 1.3051, test_f1: 0.2281
 epoch: 19, train_loss: 1.2538, test_loss: 1.2998, test_f1: 0.2281
 epoch: 20, train_loss: 1.2532, test_loss: 1.3006, test_f1: 0.2281
 epoch: 21, train_loss: 1.2546, test_loss: 1.3067, test_f1: 0.2281
 epoch: 22, train_loss: 1.2531, test_loss: 1.3130, test_f1: 0.2281
 epoch: 23, train_loss: 1.2541, test_loss: 1.3128, test_f1: 0.2281
 epoch: 24, train_loss: 1.2536, test_loss: 1.3089, test_f1: 0.2281
 epoch: 25, train_loss: 1.2530, test_loss: 1.3065, test_f1: 0.2281
 epoch: 26, train_loss: 1.2597, test_loss: 1.3019, test_f1: 0.2281
 epoch: 27, train_loss: 1.2526, test_loss: 1.3029, test_f1: 0.2281
 epoch: 28, train_loss: 1.2531, test_loss: 1.3082, test_f1: 0.2281
 epoch: 29, train_loss: 1.2536, test_loss: 1.3094, test_f1: 0.2281
 epoch: 30, train_loss: 1.2525, test_loss: 1.3079, test_f1: 0.2281
 epoch: 31, train_loss: 1.2527, test_loss: 1.3068, test_f1: 0.2281
 epoch: 32, train_loss: 1.2536, test_loss: 1.3082, test_f1: 0.2281
 epoch: 33, train_loss: 1.2531, test_loss: 1.3044, test_f1: 0.2281
 epoch: 34, train_loss: 1.2530, test_loss: 1.3048, test_f1: 0.2281
 epoch: 35, train_loss: 1.2538, test_loss: 1.3055, test_f1: 0.2281
 epoch: 36, train_loss: 1.2527, test_loss: 1.3110, test_f1: 0.2281
 epoch: 37, train_loss: 1.2528, test_loss: 1.3071, test_f1: 0.2281
 epoch: 38, train_loss: 1.2524, test_loss: 1.3048, test_f1: 0.2281
 epoch: 39, train_loss: 1.2524, test_loss: 1.3025, test_f1: 0.2281
 epoch: 40, train_loss: 1.2524, test_loss: 1.3072, test_f1: 0.2281
 epoch: 41, train_loss: 1.2530, test_loss: 1.3061, test_f1: 0.2281
 epoch: 42, train_loss: 1.2535, test_loss: 1.3018, test_f1: 0.2281
 epoch: 43, train_loss: 1.2531, test_loss: 1.3015, test_f1: 0.2281
 epoch: 44, train_loss: 1.2527, test_loss: 1.3050, test_f1: 0.2281
 epoch: 45, train_loss: 1.2524, test_loss: 1.3031, test_f1: 0.2281
 epoch: 46, train_loss: 1.2532, test_loss: 1.3045, test_f1: 0.2281
 epoch: 47, train_loss: 1.2539, test_loss: 1.3088, test_f1: 0.2281
 epoch: 48, train_loss: 1.2532, test_loss: 1.3054, test_f1: 0.2281
 epoch: 49, train_loss: 1.2546, test_loss: 1.3034, test_f1: 0.2281
 epoch: 50, train_loss: 1.2533, test_loss: 1.3017, test_f1: 0.2281
 epoch: 51, train_loss: 1.2530, test_loss: 1.3053, test_f1: 0.2281
 epoch: 52, train_loss: 1.2527, test_loss: 1.3073, test_f1: 0.2281
 epoch: 53, train_loss: 1.2523, test_loss: 1.3075, test_f1: 0.2281
 epoch: 54, train_loss: 1.2527, test_loss: 1.3046, test_f1: 0.2281
 epoch: 55, train_loss: 1.2522, test_loss: 1.3052, test_f1: 0.2281
 epoch: 56, train_loss: 1.2524, test_loss: 1.3069, test_f1: 0.2281
 epoch: 57, train_loss: 1.2524, test_loss: 1.3081, test_f1: 0.2281
 epoch: 58, train_loss: 1.2527, test_loss: 1.3081, test_f1: 0.2281
 epoch: 59, train_loss: 1.2529, test_loss: 1.3051, test_f1: 0.2281
 epoch: 60, train_loss: 1.2528, test_loss: 1.3040, test_f1: 0.2281
 epoch: 61, train_loss: 1.2526, test_loss: 1.3048, test_f1: 0.2281
 epoch: 62, train_loss: 1.2518, test_loss: 1.3083, test_f1: 0.2281
 epoch: 63, train_loss: 1.2527, test_loss: 1.3094, test_f1: 0.2281
 epoch: 64, train_loss: 1.2528, test_loss: 1.3065, test_f1: 0.2281
 epoch: 65, train_loss: 1.2523, test_loss: 1.3052, test_f1: 0.2281
 epoch: 66, train_loss: 1.2520, test_loss: 1.3040, test_f1: 0.2281
 epoch: 67, train_loss: 1.2527, test_loss: 1.3044, test_f1: 0.2281
 epoch: 68, train_loss: 1.2527, test_loss: 1.3036, test_f1: 0.2281
 epoch: 69, train_loss: 1.2526, test_loss: 1.3041, test_f1: 0.2281
 epoch: 70, train_loss: 1.2528, test_loss: 1.3065, test_f1: 0.2281
 epoch: 71, train_loss: 1.2532, test_loss: 1.3060, test_f1: 0.2281
 epoch: 72, train_loss: 1.2526, test_loss: 1.3041, test_f1: 0.2281
 epoch: 73, train_loss: 1.2526, test_loss: 1.3042, test_f1: 0.2281
 epoch: 74, train_loss: 1.2529, test_loss: 1.3040, test_f1: 0.2281
 epoch: 75, train_loss: 1.2524, test_loss: 1.3059, test_f1: 0.2281
 epoch: 76, train_loss: 1.2524, test_loss: 1.3081, test_f1: 0.2281
 epoch: 77, train_loss: 1.2526, test_loss: 1.3080, test_f1: 0.2281
 epoch: 78, train_loss: 1.2527, test_loss: 1.3069, test_f1: 0.2281
 epoch: 79, train_loss: 1.2525, test_loss: 1.3053, test_f1: 0.2281
 epoch: 80, train_loss: 1.2521, test_loss: 1.3032, test_f1: 0.2281
 epoch: 81, train_loss: 1.2522, test_loss: 1.3029, test_f1: 0.2281
 epoch: 82, train_loss: 1.2520, test_loss: 1.3046, test_f1: 0.2281
 epoch: 83, train_loss: 1.2521, test_loss: 1.3053, test_f1: 0.2281
 epoch: 84, train_loss: 1.2522, test_loss: 1.3039, test_f1: 0.2281
 epoch: 85, train_loss: 1.2522, test_loss: 1.3039, test_f1: 0.2281
 epoch: 86, train_loss: 1.2526, test_loss: 1.3072, test_f1: 0.2281
 epoch: 87, train_loss: 1.2523, test_loss: 1.3089, test_f1: 0.2281
 epoch: 88, train_loss: 1.2528, test_loss: 1.3075, test_f1: 0.2281
 epoch: 89, train_loss: 1.2537, test_loss: 1.3057, test_f1: 0.2281
 epoch: 90, train_loss: 1.2546, test_loss: 1.3051, test_f1: 0.2281
 epoch: 91, train_loss: 1.2530, test_loss: 1.3048, test_f1: 0.2281
 epoch: 92, train_loss: 1.2520, test_loss: 1.3057, test_f1: 0.2281
 epoch: 93, train_loss: 1.2526, test_loss: 1.3056, test_f1: 0.2281
 epoch: 94, train_loss: 1.2531, test_loss: 1.3059, test_f1: 0.2281
 epoch: 95, train_loss: 1.2531, test_loss: 1.3036, test_f1: 0.2281
 epoch: 96, train_loss: 1.2525, test_loss: 1.3029, test_f1: 0.2281
 epoch: 97, train_loss: 1.2524, test_loss: 1.3028, test_f1: 0.2281
 epoch: 98, train_loss: 1.2528, test_loss: 1.3043, test_f1: 0.2281
 epoch: 99, train_loss: 1.2524, test_loss: 1.3043, test_f1: 0.2281
##################ITERATION #6 ****************************************
 epoch: 0, train_loss: 1.2738, test_loss: 1.3365, test_f1: 0.2281
 epoch: 1, train_loss: 1.2634, test_loss: 1.3225, test_f1: 0.2281
 epoch: 2, train_loss: 1.2560, test_loss: 1.3045, test_f1: 0.2281
 epoch: 3, train_loss: 1.2536, test_loss: 1.3029, test_f1: 0.2281
 epoch: 4, train_loss: 1.2535, test_loss: 1.3073, test_f1: 0.2281
 epoch: 5, train_loss: 1.2538, test_loss: 1.3075, test_f1: 0.2281
 epoch: 6, train_loss: 1.2521, test_loss: 1.3021, test_f1: 0.2281
 epoch: 7, train_loss: 1.2533, test_loss: 1.3043, test_f1: 0.2281
 epoch: 8, train_loss: 1.2543, test_loss: 1.3054, test_f1: 0.2281
 epoch: 9, train_loss: 1.2524, test_loss: 1.3088, test_f1: 0.2281
 epoch: 10, train_loss: 1.2527, test_loss: 1.3077, test_f1: 0.2281
 epoch: 11, train_loss: 1.2536, test_loss: 1.3040, test_f1: 0.2281
 epoch: 12, train_loss: 1.2529, test_loss: 1.3045, test_f1: 0.2281
 epoch: 13, train_loss: 1.2525, test_loss: 1.3029, test_f1: 0.2281
 epoch: 14, train_loss: 1.2530, test_loss: 1.3017, test_f1: 0.2281
 epoch: 15, train_loss: 1.2531, test_loss: 1.3008, test_f1: 0.2281
 epoch: 16, train_loss: 1.2540, test_loss: 1.3027, test_f1: 0.2281
 epoch: 17, train_loss: 1.2529, test_loss: 1.3111, test_f1: 0.2281
 epoch: 18, train_loss: 1.2533, test_loss: 1.3075, test_f1: 0.2281
 epoch: 19, train_loss: 1.2528, test_loss: 1.3087, test_f1: 0.2281
 epoch: 20, train_loss: 1.2531, test_loss: 1.3090, test_f1: 0.2281
 epoch: 21, train_loss: 1.2529, test_loss: 1.3023, test_f1: 0.2281
 epoch: 22, train_loss: 1.2530, test_loss: 1.3029, test_f1: 0.2281
 epoch: 23, train_loss: 1.2539, test_loss: 1.3076, test_f1: 0.2281
 epoch: 24, train_loss: 1.2538, test_loss: 1.3115, test_f1: 0.2281
 epoch: 25, train_loss: 1.2533, test_loss: 1.3120, test_f1: 0.2281
 epoch: 26, train_loss: 1.2539, test_loss: 1.3075, test_f1: 0.2281
 epoch: 27, train_loss: 1.2530, test_loss: 1.3060, test_f1: 0.2281
 epoch: 28, train_loss: 1.2519, test_loss: 1.3040, test_f1: 0.2281
 epoch: 29, train_loss: 1.2529, test_loss: 1.3016, test_f1: 0.2281
 epoch: 30, train_loss: 1.2526, test_loss: 1.3042, test_f1: 0.2281
 epoch: 31, train_loss: 1.2534, test_loss: 1.3079, test_f1: 0.2281
 epoch: 32, train_loss: 1.2526, test_loss: 1.3045, test_f1: 0.2281
 epoch: 33, train_loss: 1.2527, test_loss: 1.3005, test_f1: 0.2281
 epoch: 34, train_loss: 1.2529, test_loss: 1.3005, test_f1: 0.2281
 epoch: 35, train_loss: 1.2526, test_loss: 1.3030, test_f1: 0.2281
 epoch: 36, train_loss: 1.2536, test_loss: 1.3069, test_f1: 0.2281
 epoch: 37, train_loss: 1.2523, test_loss: 1.3053, test_f1: 0.2281
 epoch: 38, train_loss: 1.2526, test_loss: 1.3044, test_f1: 0.2281
 epoch: 39, train_loss: 1.2523, test_loss: 1.3051, test_f1: 0.2281
 epoch: 40, train_loss: 1.2526, test_loss: 1.3044, test_f1: 0.2281
 epoch: 41, train_loss: 1.2535, test_loss: 1.3026, test_f1: 0.2281
 epoch: 42, train_loss: 1.2531, test_loss: 1.3046, test_f1: 0.2281
 epoch: 43, train_loss: 1.2520, test_loss: 1.3061, test_f1: 0.2281
 epoch: 44, train_loss: 1.2525, test_loss: 1.3074, test_f1: 0.2281
 epoch: 45, train_loss: 1.2525, test_loss: 1.3071, test_f1: 0.2281
 epoch: 46, train_loss: 1.2526, test_loss: 1.3046, test_f1: 0.2281
 epoch: 47, train_loss: 1.2528, test_loss: 1.3046, test_f1: 0.2281
 epoch: 48, train_loss: 1.2525, test_loss: 1.3015, test_f1: 0.2281
 epoch: 49, train_loss: 1.2522, test_loss: 1.3002, test_f1: 0.2281
 epoch: 50, train_loss: 1.2532, test_loss: 1.3032, test_f1: 0.2281
 epoch: 51, train_loss: 1.2531, test_loss: 1.3052, test_f1: 0.2281
 epoch: 52, train_loss: 1.2525, test_loss: 1.3054, test_f1: 0.2281
 epoch: 53, train_loss: 1.2524, test_loss: 1.3040, test_f1: 0.2281
 epoch: 54, train_loss: 1.2523, test_loss: 1.3045, test_f1: 0.2281
 epoch: 55, train_loss: 1.2524, test_loss: 1.3034, test_f1: 0.2281
 epoch: 56, train_loss: 1.2527, test_loss: 1.3015, test_f1: 0.2281
 epoch: 57, train_loss: 1.2524, test_loss: 1.3017, test_f1: 0.2281
 epoch: 58, train_loss: 1.2525, test_loss: 1.3031, test_f1: 0.2281
 epoch: 59, train_loss: 1.2522, test_loss: 1.3036, test_f1: 0.2281
 epoch: 60, train_loss: 1.2522, test_loss: 1.3043, test_f1: 0.2281
 epoch: 61, train_loss: 1.2526, test_loss: 1.3055, test_f1: 0.2281
 epoch: 62, train_loss: 1.2521, test_loss: 1.3056, test_f1: 0.2281
 epoch: 63, train_loss: 1.2519, test_loss: 1.3053, test_f1: 0.2281
 epoch: 64, train_loss: 1.2523, test_loss: 1.3040, test_f1: 0.2281
 epoch: 65, train_loss: 1.2518, test_loss: 1.3012, test_f1: 0.2281
 epoch: 66, train_loss: 1.2526, test_loss: 1.3008, test_f1: 0.2281
 epoch: 67, train_loss: 1.2523, test_loss: 1.3032, test_f1: 0.2281
 epoch: 68, train_loss: 1.2520, test_loss: 1.3037, test_f1: 0.2281
 epoch: 69, train_loss: 1.2522, test_loss: 1.3028, test_f1: 0.2281
 epoch: 70, train_loss: 1.2521, test_loss: 1.3027, test_f1: 0.2281
 epoch: 71, train_loss: 1.2525, test_loss: 1.3035, test_f1: 0.2281
 epoch: 72, train_loss: 1.2524, test_loss: 1.3049, test_f1: 0.2281
 epoch: 73, train_loss: 1.2525, test_loss: 1.3059, test_f1: 0.2281
 epoch: 74, train_loss: 1.2523, test_loss: 1.3049, test_f1: 0.2281
 epoch: 75, train_loss: 1.2523, test_loss: 1.3047, test_f1: 0.2281
 epoch: 76, train_loss: 1.2521, test_loss: 1.3044, test_f1: 0.2281
 epoch: 77, train_loss: 1.2525, test_loss: 1.3065, test_f1: 0.2281
 epoch: 78, train_loss: 1.2525, test_loss: 1.3075, test_f1: 0.2281
 epoch: 79, train_loss: 1.2522, test_loss: 1.3056, test_f1: 0.2281
 epoch: 80, train_loss: 1.2529, test_loss: 1.3034, test_f1: 0.2281
 epoch: 81, train_loss: 1.2525, test_loss: 1.3028, test_f1: 0.2281
 epoch: 82, train_loss: 1.2526, test_loss: 1.3029, test_f1: 0.2281
 epoch: 83, train_loss: 1.2524, test_loss: 1.3053, test_f1: 0.2281
 epoch: 84, train_loss: 1.2521, test_loss: 1.3047, test_f1: 0.2281
 epoch: 85, train_loss: 1.2522, test_loss: 1.3032, test_f1: 0.2281
 epoch: 86, train_loss: 1.2525, test_loss: 1.3027, test_f1: 0.2281
 epoch: 87, train_loss: 1.2526, test_loss: 1.3052, test_f1: 0.2281
 epoch: 88, train_loss: 1.2525, test_loss: 1.3055, test_f1: 0.2281
 epoch: 89, train_loss: 1.2517, test_loss: 1.3025, test_f1: 0.2281
 epoch: 90, train_loss: 1.2529, test_loss: 1.3003, test_f1: 0.2281
 epoch: 91, train_loss: 1.2527, test_loss: 1.3026, test_f1: 0.2281
 epoch: 92, train_loss: 1.2525, test_loss: 1.3030, test_f1: 0.2281
 epoch: 93, train_loss: 1.2524, test_loss: 1.3069, test_f1: 0.2281
 epoch: 94, train_loss: 1.2527, test_loss: 1.3081, test_f1: 0.2281
 epoch: 95, train_loss: 1.2523, test_loss: 1.3048, test_f1: 0.2281
 epoch: 96, train_loss: 1.2529, test_loss: 1.3026, test_f1: 0.2281
 epoch: 97, train_loss: 1.2523, test_loss: 1.3034, test_f1: 0.2281
 epoch: 98, train_loss: 1.2518, test_loss: 1.3052, test_f1: 0.2281
 epoch: 99, train_loss: 1.2526, test_loss: 1.3057, test_f1: 0.2281
##################ITERATION #7 ****************************************
 epoch: 0, train_loss: 1.2560, test_loss: 1.3059, test_f1: 0.2281
 epoch: 1, train_loss: 1.2530, test_loss: 1.3068, test_f1: 0.2281
 epoch: 2, train_loss: 1.2527, test_loss: 1.3033, test_f1: 0.2281
 epoch: 3, train_loss: 1.2524, test_loss: 1.3048, test_f1: 0.2281
 epoch: 4, train_loss: 1.2525, test_loss: 1.3033, test_f1: 0.2281
 epoch: 5, train_loss: 1.2529, test_loss: 1.3000, test_f1: 0.2281
 epoch: 6, train_loss: 1.2532, test_loss: 1.3029, test_f1: 0.2281
 epoch: 7, train_loss: 1.2527, test_loss: 1.3070, test_f1: 0.2281
 epoch: 8, train_loss: 1.2540, test_loss: 1.3054, test_f1: 0.2281
 epoch: 9, train_loss: 1.2532, test_loss: 1.3031, test_f1: 0.2281
 epoch: 10, train_loss: 1.2537, test_loss: 1.3046, test_f1: 0.2281
 epoch: 11, train_loss: 1.2535, test_loss: 1.3081, test_f1: 0.2281
 epoch: 12, train_loss: 1.2547, test_loss: 1.3087, test_f1: 0.2281
 epoch: 13, train_loss: 1.2537, test_loss: 1.3047, test_f1: 0.2281
 epoch: 14, train_loss: 1.2520, test_loss: 1.3026, test_f1: 0.2281
 epoch: 15, train_loss: 1.2536, test_loss: 1.3019, test_f1: 0.2281
 epoch: 16, train_loss: 1.2541, test_loss: 1.3020, test_f1: 0.2281
 epoch: 17, train_loss: 1.2535, test_loss: 1.3066, test_f1: 0.2281
 epoch: 18, train_loss: 1.2533, test_loss: 1.3039, test_f1: 0.2281
 epoch: 19, train_loss: 1.2538, test_loss: 1.3074, test_f1: 0.2281
 epoch: 20, train_loss: 1.2533, test_loss: 1.3061, test_f1: 0.2281
 epoch: 21, train_loss: 1.2532, test_loss: 1.3065, test_f1: 0.2281
 epoch: 22, train_loss: 1.2527, test_loss: 1.3013, test_f1: 0.2281
 epoch: 23, train_loss: 1.2524, test_loss: 1.3044, test_f1: 0.2281
 epoch: 24, train_loss: 1.2530, test_loss: 1.3077, test_f1: 0.2281
 epoch: 25, train_loss: 1.2531, test_loss: 1.3079, test_f1: 0.2281
 epoch: 26, train_loss: 1.2530, test_loss: 1.3035, test_f1: 0.2281
 epoch: 27, train_loss: 1.2535, test_loss: 1.3037, test_f1: 0.2281
 epoch: 28, train_loss: 1.2530, test_loss: 1.3049, test_f1: 0.2281
 epoch: 29, train_loss: 1.2530, test_loss: 1.3050, test_f1: 0.2281
 epoch: 30, train_loss: 1.2523, test_loss: 1.3037, test_f1: 0.2281
 epoch: 31, train_loss: 1.2531, test_loss: 1.3024, test_f1: 0.2281
 epoch: 32, train_loss: 1.2533, test_loss: 1.3029, test_f1: 0.2281
 epoch: 33, train_loss: 1.2529, test_loss: 1.3016, test_f1: 0.2281
 epoch: 34, train_loss: 1.2525, test_loss: 1.3012, test_f1: 0.2281
 epoch: 35, train_loss: 1.2528, test_loss: 1.3017, test_f1: 0.2281
 epoch: 36, train_loss: 1.2534, test_loss: 1.3058, test_f1: 0.2281
 epoch: 37, train_loss: 1.2530, test_loss: 1.3060, test_f1: 0.2281
 epoch: 38, train_loss: 1.2522, test_loss: 1.3053, test_f1: 0.2281
 epoch: 39, train_loss: 1.2523, test_loss: 1.3038, test_f1: 0.2281
 epoch: 40, train_loss: 1.2523, test_loss: 1.3053, test_f1: 0.2281
 epoch: 41, train_loss: 1.2528, test_loss: 1.3094, test_f1: 0.2281
 epoch: 42, train_loss: 1.2526, test_loss: 1.3066, test_f1: 0.2281
 epoch: 43, train_loss: 1.2530, test_loss: 1.3022, test_f1: 0.2281
 epoch: 44, train_loss: 1.2525, test_loss: 1.2997, test_f1: 0.2281
 epoch: 45, train_loss: 1.2543, test_loss: 1.3031, test_f1: 0.2281
 epoch: 46, train_loss: 1.2549, test_loss: 1.3082, test_f1: 0.2281
 epoch: 47, train_loss: 1.2536, test_loss: 1.3103, test_f1: 0.2281
 epoch: 48, train_loss: 1.2535, test_loss: 1.3088, test_f1: 0.2281
 epoch: 49, train_loss: 1.2528, test_loss: 1.3053, test_f1: 0.2281
 epoch: 50, train_loss: 1.2525, test_loss: 1.3046, test_f1: 0.2281
 epoch: 51, train_loss: 1.2525, test_loss: 1.3035, test_f1: 0.2281
 epoch: 52, train_loss: 1.2520, test_loss: 1.3049, test_f1: 0.2281
 epoch: 53, train_loss: 1.2521, test_loss: 1.3052, test_f1: 0.2281
 epoch: 54, train_loss: 1.2520, test_loss: 1.3038, test_f1: 0.2281
 epoch: 55, train_loss: 1.2524, test_loss: 1.3022, test_f1: 0.2281
 epoch: 56, train_loss: 1.2526, test_loss: 1.3010, test_f1: 0.2281
 epoch: 57, train_loss: 1.2525, test_loss: 1.3030, test_f1: 0.2281
 epoch: 58, train_loss: 1.2520, test_loss: 1.3059, test_f1: 0.2281
 epoch: 59, train_loss: 1.2522, test_loss: 1.3070, test_f1: 0.2281
 epoch: 60, train_loss: 1.2526, test_loss: 1.3027, test_f1: 0.2281
 epoch: 61, train_loss: 1.2521, test_loss: 1.3020, test_f1: 0.2281
 epoch: 62, train_loss: 1.2522, test_loss: 1.3029, test_f1: 0.2281
 epoch: 63, train_loss: 1.2522, test_loss: 1.3059, test_f1: 0.2281
 epoch: 64, train_loss: 1.2535, test_loss: 1.3079, test_f1: 0.2281
 epoch: 65, train_loss: 1.2532, test_loss: 1.3071, test_f1: 0.2281
 epoch: 66, train_loss: 1.2525, test_loss: 1.3059, test_f1: 0.2281
 epoch: 67, train_loss: 1.2521, test_loss: 1.3047, test_f1: 0.2281
 epoch: 68, train_loss: 1.2523, test_loss: 1.3043, test_f1: 0.2281
 epoch: 69, train_loss: 1.2523, test_loss: 1.3054, test_f1: 0.2281
 epoch: 70, train_loss: 1.2524, test_loss: 1.3059, test_f1: 0.2281
 epoch: 71, train_loss: 1.2522, test_loss: 1.3047, test_f1: 0.2281
 epoch: 72, train_loss: 1.2525, test_loss: 1.3026, test_f1: 0.2281
 epoch: 73, train_loss: 1.2531, test_loss: 1.3018, test_f1: 0.2281
 epoch: 74, train_loss: 1.2526, test_loss: 1.3033, test_f1: 0.2281
 epoch: 75, train_loss: 1.2523, test_loss: 1.3043, test_f1: 0.2281
 epoch: 76, train_loss: 1.2527, test_loss: 1.3037, test_f1: 0.2281
 epoch: 77, train_loss: 1.2520, test_loss: 1.3044, test_f1: 0.2281
 epoch: 78, train_loss: 1.2527, test_loss: 1.3068, test_f1: 0.2281
 epoch: 79, train_loss: 1.2528, test_loss: 1.3059, test_f1: 0.2281
 epoch: 80, train_loss: 1.2524, test_loss: 1.3055, test_f1: 0.2281
 epoch: 81, train_loss: 1.2527, test_loss: 1.3091, test_f1: 0.2281
 epoch: 82, train_loss: 1.2537, test_loss: 1.3082, test_f1: 0.2281
 epoch: 83, train_loss: 1.2544, test_loss: 1.3046, test_f1: 0.2281
 epoch: 84, train_loss: 1.2529, test_loss: 1.3008, test_f1: 0.2281
 epoch: 85, train_loss: 1.2532, test_loss: 1.3016, test_f1: 0.2281
 epoch: 86, train_loss: 1.2524, test_loss: 1.3053, test_f1: 0.2281
 epoch: 87, train_loss: 1.2521, test_loss: 1.3103, test_f1: 0.2281
 epoch: 88, train_loss: 1.2530, test_loss: 1.3114, test_f1: 0.2281
 epoch: 89, train_loss: 1.2527, test_loss: 1.3081, test_f1: 0.2281
 epoch: 90, train_loss: 1.2526, test_loss: 1.3052, test_f1: 0.2281
 epoch: 91, train_loss: 1.2527, test_loss: 1.3037, test_f1: 0.2281
 epoch: 92, train_loss: 1.2529, test_loss: 1.3047, test_f1: 0.2281
 epoch: 93, train_loss: 1.2526, test_loss: 1.3050, test_f1: 0.2281
 epoch: 94, train_loss: 1.2523, test_loss: 1.3067, test_f1: 0.2281
 epoch: 95, train_loss: 1.2528, test_loss: 1.3081, test_f1: 0.2281
 epoch: 96, train_loss: 1.2527, test_loss: 1.3071, test_f1: 0.2281
 epoch: 97, train_loss: 1.2524, test_loss: 1.3047, test_f1: 0.2281
 epoch: 98, train_loss: 1.2524, test_loss: 1.3034, test_f1: 0.2281
 epoch: 99, train_loss: 1.2527, test_loss: 1.3028, test_f1: 0.2281
##################ITERATION #8 ****************************************
 epoch: 0, train_loss: 1.2546, test_loss: 1.3164, test_f1: 0.1365
 epoch: 1, train_loss: 1.2584, test_loss: 1.3198, test_f1: 0.2281
 epoch: 2, train_loss: 1.2541, test_loss: 1.3048, test_f1: 0.2281
 epoch: 3, train_loss: 1.2529, test_loss: 1.2996, test_f1: 0.2281
 epoch: 4, train_loss: 1.2528, test_loss: 1.3019, test_f1: 0.2281
 epoch: 5, train_loss: 1.2524, test_loss: 1.3065, test_f1: 0.2281
 epoch: 6, train_loss: 1.2543, test_loss: 1.3090, test_f1: 0.2281
 epoch: 7, train_loss: 1.2527, test_loss: 1.3078, test_f1: 0.2281
 epoch: 8, train_loss: 1.2529, test_loss: 1.3092, test_f1: 0.2281
 epoch: 9, train_loss: 1.2526, test_loss: 1.3075, test_f1: 0.2281
 epoch: 10, train_loss: 1.2540, test_loss: 1.3034, test_f1: 0.2281
 epoch: 11, train_loss: 1.2530, test_loss: 1.3056, test_f1: 0.2281
 epoch: 12, train_loss: 1.2538, test_loss: 1.3066, test_f1: 0.2281
 epoch: 13, train_loss: 1.2527, test_loss: 1.3056, test_f1: 0.2281
 epoch: 14, train_loss: 1.2541, test_loss: 1.3037, test_f1: 0.2281
 epoch: 15, train_loss: 1.2528, test_loss: 1.3053, test_f1: 0.2281
 epoch: 16, train_loss: 1.2524, test_loss: 1.3093, test_f1: 0.2281
 epoch: 17, train_loss: 1.2531, test_loss: 1.3111, test_f1: 0.2281
 epoch: 18, train_loss: 1.2541, test_loss: 1.3062, test_f1: 0.2281
 epoch: 19, train_loss: 1.2518, test_loss: 1.3008, test_f1: 0.2281
 epoch: 20, train_loss: 1.2539, test_loss: 1.3029, test_f1: 0.2281
 epoch: 21, train_loss: 1.2525, test_loss: 1.3048, test_f1: 0.2281
 epoch: 22, train_loss: 1.2527, test_loss: 1.3074, test_f1: 0.2281
 epoch: 23, train_loss: 1.2530, test_loss: 1.3051, test_f1: 0.2281
 epoch: 24, train_loss: 1.2530, test_loss: 1.3048, test_f1: 0.2281
 epoch: 25, train_loss: 1.2525, test_loss: 1.3032, test_f1: 0.2281
 epoch: 26, train_loss: 1.2534, test_loss: 1.3027, test_f1: 0.2281
 epoch: 27, train_loss: 1.2546, test_loss: 1.3020, test_f1: 0.2281
 epoch: 28, train_loss: 1.2532, test_loss: 1.3029, test_f1: 0.2281
 epoch: 29, train_loss: 1.2536, test_loss: 1.3053, test_f1: 0.2281
 epoch: 30, train_loss: 1.2535, test_loss: 1.3144, test_f1: 0.2281
 epoch: 31, train_loss: 1.2541, test_loss: 1.3085, test_f1: 0.2281
 epoch: 32, train_loss: 1.2523, test_loss: 1.3017, test_f1: 0.2281
 epoch: 33, train_loss: 1.2521, test_loss: 1.3095, test_f1: 0.2281
 epoch: 34, train_loss: 1.2534, test_loss: 1.3110, test_f1: 0.2281
 epoch: 35, train_loss: 1.2524, test_loss: 1.3049, test_f1: 0.2281
 epoch: 36, train_loss: 1.2524, test_loss: 1.3020, test_f1: 0.2281
 epoch: 37, train_loss: 1.2523, test_loss: 1.3042, test_f1: 0.2281
 epoch: 38, train_loss: 1.2521, test_loss: 1.3057, test_f1: 0.2281
 epoch: 39, train_loss: 1.2518, test_loss: 1.3042, test_f1: 0.2281
 epoch: 40, train_loss: 1.2524, test_loss: 1.3022, test_f1: 0.2281
 epoch: 41, train_loss: 1.2527, test_loss: 1.3047, test_f1: 0.2281
 epoch: 42, train_loss: 1.2522, test_loss: 1.3052, test_f1: 0.2281
 epoch: 43, train_loss: 1.2521, test_loss: 1.3091, test_f1: 0.2281
 epoch: 44, train_loss: 1.2528, test_loss: 1.3081, test_f1: 0.2281
 epoch: 45, train_loss: 1.2526, test_loss: 1.3077, test_f1: 0.2281
 epoch: 46, train_loss: 1.2537, test_loss: 1.3071, test_f1: 0.2281
 epoch: 47, train_loss: 1.2520, test_loss: 1.3057, test_f1: 0.2281
 epoch: 48, train_loss: 1.2524, test_loss: 1.3043, test_f1: 0.2281
 epoch: 49, train_loss: 1.2532, test_loss: 1.3016, test_f1: 0.2281
 epoch: 50, train_loss: 1.2531, test_loss: 1.3038, test_f1: 0.2281
 epoch: 51, train_loss: 1.2542, test_loss: 1.3052, test_f1: 0.2281
 epoch: 52, train_loss: 1.2532, test_loss: 1.3045, test_f1: 0.2281
 epoch: 53, train_loss: 1.2529, test_loss: 1.3058, test_f1: 0.2281
 epoch: 54, train_loss: 1.2528, test_loss: 1.3062, test_f1: 0.2281
 epoch: 55, train_loss: 1.2530, test_loss: 1.3040, test_f1: 0.2281
 epoch: 56, train_loss: 1.2525, test_loss: 1.3044, test_f1: 0.2281
 epoch: 57, train_loss: 1.2527, test_loss: 1.3077, test_f1: 0.2281
 epoch: 58, train_loss: 1.2528, test_loss: 1.3083, test_f1: 0.2281
 epoch: 59, train_loss: 1.2526, test_loss: 1.3080, test_f1: 0.2281
 epoch: 60, train_loss: 1.2522, test_loss: 1.3068, test_f1: 0.2281
 epoch: 61, train_loss: 1.2522, test_loss: 1.3055, test_f1: 0.2281
 epoch: 62, train_loss: 1.2529, test_loss: 1.3031, test_f1: 0.2281
 epoch: 63, train_loss: 1.2533, test_loss: 1.3012, test_f1: 0.2281
 epoch: 64, train_loss: 1.2529, test_loss: 1.3004, test_f1: 0.2281
 epoch: 65, train_loss: 1.2535, test_loss: 1.3015, test_f1: 0.2281
 epoch: 66, train_loss: 1.2530, test_loss: 1.3032, test_f1: 0.2281
 epoch: 67, train_loss: 1.2529, test_loss: 1.3060, test_f1: 0.2281
 epoch: 68, train_loss: 1.2524, test_loss: 1.3055, test_f1: 0.2281
 epoch: 69, train_loss: 1.2521, test_loss: 1.3059, test_f1: 0.2281
 epoch: 70, train_loss: 1.2521, test_loss: 1.3045, test_f1: 0.2281
 epoch: 71, train_loss: 1.2523, test_loss: 1.3041, test_f1: 0.2281
 epoch: 72, train_loss: 1.2525, test_loss: 1.3039, test_f1: 0.2281
 epoch: 73, train_loss: 1.2525, test_loss: 1.3068, test_f1: 0.2281
 epoch: 74, train_loss: 1.2531, test_loss: 1.3077, test_f1: 0.2281
 epoch: 75, train_loss: 1.2522, test_loss: 1.3057, test_f1: 0.2281
 epoch: 76, train_loss: 1.2524, test_loss: 1.3043, test_f1: 0.2281
 epoch: 77, train_loss: 1.2525, test_loss: 1.3016, test_f1: 0.2281
 epoch: 78, train_loss: 1.2524, test_loss: 1.3023, test_f1: 0.2281
 epoch: 79, train_loss: 1.2530, test_loss: 1.3042, test_f1: 0.2281
 epoch: 80, train_loss: 1.2520, test_loss: 1.3025, test_f1: 0.2281
 epoch: 81, train_loss: 1.2531, test_loss: 1.3026, test_f1: 0.2281
 epoch: 82, train_loss: 1.2534, test_loss: 1.3026, test_f1: 0.2281
 epoch: 83, train_loss: 1.2524, test_loss: 1.3045, test_f1: 0.2281
 epoch: 84, train_loss: 1.2526, test_loss: 1.3052, test_f1: 0.2281
 epoch: 85, train_loss: 1.2520, test_loss: 1.3044, test_f1: 0.2281
 epoch: 86, train_loss: 1.2519, test_loss: 1.3038, test_f1: 0.2281
 epoch: 87, train_loss: 1.2526, test_loss: 1.3021, test_f1: 0.2281
 epoch: 88, train_loss: 1.2526, test_loss: 1.3019, test_f1: 0.2281
 epoch: 89, train_loss: 1.2522, test_loss: 1.3047, test_f1: 0.2281
 epoch: 90, train_loss: 1.2520, test_loss: 1.3051, test_f1: 0.2281
 epoch: 91, train_loss: 1.2521, test_loss: 1.3049, test_f1: 0.2281
 epoch: 92, train_loss: 1.2524, test_loss: 1.3054, test_f1: 0.2281
 epoch: 93, train_loss: 1.2523, test_loss: 1.3058, test_f1: 0.2281
 epoch: 94, train_loss: 1.2520, test_loss: 1.3041, test_f1: 0.2281
 epoch: 95, train_loss: 1.2520, test_loss: 1.3036, test_f1: 0.2281
 epoch: 96, train_loss: 1.2521, test_loss: 1.3029, test_f1: 0.2281
 epoch: 97, train_loss: 1.2526, test_loss: 1.3011, test_f1: 0.2281
 epoch: 98, train_loss: 1.2527, test_loss: 1.3014, test_f1: 0.2281
 epoch: 99, train_loss: 1.2524, test_loss: 1.3021, test_f1: 0.2281
##################ITERATION #9 ****************************************
 epoch: 0, train_loss: 1.2561, test_loss: 1.3082, test_f1: 0.2281
 epoch: 1, train_loss: 1.2561, test_loss: 1.3026, test_f1: 0.2281
 epoch: 2, train_loss: 1.2541, test_loss: 1.2995, test_f1: 0.2281
 epoch: 3, train_loss: 1.2549, test_loss: 1.3030, test_f1: 0.2281
 epoch: 4, train_loss: 1.2558, test_loss: 1.3049, test_f1: 0.2281
 epoch: 5, train_loss: 1.2535, test_loss: 1.3074, test_f1: 0.2281
 epoch: 6, train_loss: 1.2533, test_loss: 1.3072, test_f1: 0.2281
 epoch: 7, train_loss: 1.2522, test_loss: 1.3014, test_f1: 0.2281
 epoch: 8, train_loss: 1.2539, test_loss: 1.3018, test_f1: 0.2281
 epoch: 9, train_loss: 1.2542, test_loss: 1.3020, test_f1: 0.2281
 epoch: 10, train_loss: 1.2527, test_loss: 1.3056, test_f1: 0.2281
 epoch: 11, train_loss: 1.2526, test_loss: 1.3066, test_f1: 0.2281
 epoch: 12, train_loss: 1.2528, test_loss: 1.3056, test_f1: 0.2281
 epoch: 13, train_loss: 1.2563, test_loss: 1.3088, test_f1: 0.2281
 epoch: 14, train_loss: 1.2530, test_loss: 1.3061, test_f1: 0.2281
 epoch: 15, train_loss: 1.2543, test_loss: 1.3083, test_f1: 0.1365
 epoch: 16, train_loss: 1.2550, test_loss: 1.3001, test_f1: 0.2281
 epoch: 17, train_loss: 1.2561, test_loss: 1.3022, test_f1: 0.2281
 epoch: 18, train_loss: 1.2564, test_loss: 1.3007, test_f1: 0.2281
 epoch: 19, train_loss: 1.2527, test_loss: 1.3030, test_f1: 0.2281
 epoch: 20, train_loss: 1.2533, test_loss: 1.3057, test_f1: 0.2281
 epoch: 21, train_loss: 1.2523, test_loss: 1.3032, test_f1: 0.2281
 epoch: 22, train_loss: 1.2521, test_loss: 1.3055, test_f1: 0.2281
 epoch: 23, train_loss: 1.2524, test_loss: 1.3072, test_f1: 0.2281
 epoch: 24, train_loss: 1.2535, test_loss: 1.3094, test_f1: 0.2281
 epoch: 25, train_loss: 1.2526, test_loss: 1.3038, test_f1: 0.2281
 epoch: 26, train_loss: 1.2523, test_loss: 1.3018, test_f1: 0.2281
 epoch: 27, train_loss: 1.2540, test_loss: 1.3053, test_f1: 0.2281
 epoch: 28, train_loss: 1.2530, test_loss: 1.3031, test_f1: 0.2281
 epoch: 29, train_loss: 1.2526, test_loss: 1.3060, test_f1: 0.2281
 epoch: 30, train_loss: 1.2537, test_loss: 1.3042, test_f1: 0.2281
 epoch: 31, train_loss: 1.2532, test_loss: 1.3046, test_f1: 0.2281
 epoch: 32, train_loss: 1.2522, test_loss: 1.3042, test_f1: 0.2281
 epoch: 33, train_loss: 1.2533, test_loss: 1.3028, test_f1: 0.2281
 epoch: 34, train_loss: 1.2521, test_loss: 1.3014, test_f1: 0.2281
 epoch: 35, train_loss: 1.2527, test_loss: 1.3031, test_f1: 0.2281
 epoch: 36, train_loss: 1.2526, test_loss: 1.3061, test_f1: 0.2281
 epoch: 37, train_loss: 1.2536, test_loss: 1.3046, test_f1: 0.2281
 epoch: 38, train_loss: 1.2539, test_loss: 1.3016, test_f1: 0.2281
 epoch: 39, train_loss: 1.2548, test_loss: 1.3022, test_f1: 0.2281
 epoch: 40, train_loss: 1.2538, test_loss: 1.3102, test_f1: 0.2281
 epoch: 41, train_loss: 1.2530, test_loss: 1.3085, test_f1: 0.2281
 epoch: 42, train_loss: 1.2519, test_loss: 1.3045, test_f1: 0.2281
 epoch: 43, train_loss: 1.2526, test_loss: 1.3015, test_f1: 0.2281
 epoch: 44, train_loss: 1.2544, test_loss: 1.3004, test_f1: 0.2281
 epoch: 45, train_loss: 1.2529, test_loss: 1.3031, test_f1: 0.2281
 epoch: 46, train_loss: 1.2525, test_loss: 1.3025, test_f1: 0.2281
 epoch: 47, train_loss: 1.2527, test_loss: 1.3052, test_f1: 0.2281
 epoch: 48, train_loss: 1.2529, test_loss: 1.3075, test_f1: 0.2281
 epoch: 49, train_loss: 1.2525, test_loss: 1.3061, test_f1: 0.2281
 epoch: 50, train_loss: 1.2525, test_loss: 1.3042, test_f1: 0.2281
 epoch: 51, train_loss: 1.2522, test_loss: 1.3042, test_f1: 0.2281
 epoch: 52, train_loss: 1.2520, test_loss: 1.3031, test_f1: 0.2281
 epoch: 53, train_loss: 1.2522, test_loss: 1.3021, test_f1: 0.2281
 epoch: 54, train_loss: 1.2523, test_loss: 1.3023, test_f1: 0.2281
 epoch: 55, train_loss: 1.2519, test_loss: 1.3051, test_f1: 0.2281
 epoch: 56, train_loss: 1.2525, test_loss: 1.3078, test_f1: 0.2281
 epoch: 57, train_loss: 1.2530, test_loss: 1.3089, test_f1: 0.2281
 epoch: 58, train_loss: 1.2526, test_loss: 1.3086, test_f1: 0.2281
 epoch: 59, train_loss: 1.2527, test_loss: 1.3079, test_f1: 0.2281
 epoch: 60, train_loss: 1.2528, test_loss: 1.3071, test_f1: 0.2281
 epoch: 61, train_loss: 1.2522, test_loss: 1.3039, test_f1: 0.2281
 epoch: 62, train_loss: 1.2525, test_loss: 1.3027, test_f1: 0.2281
 epoch: 63, train_loss: 1.2526, test_loss: 1.3023, test_f1: 0.2281
 epoch: 64, train_loss: 1.2525, test_loss: 1.3030, test_f1: 0.2281
 epoch: 65, train_loss: 1.2521, test_loss: 1.3032, test_f1: 0.2281
 epoch: 66, train_loss: 1.2523, test_loss: 1.3049, test_f1: 0.2281
 epoch: 67, train_loss: 1.2523, test_loss: 1.3031, test_f1: 0.2281
 epoch: 68, train_loss: 1.2524, test_loss: 1.3018, test_f1: 0.2281
 epoch: 69, train_loss: 1.2525, test_loss: 1.3012, test_f1: 0.2281
 epoch: 70, train_loss: 1.2526, test_loss: 1.3022, test_f1: 0.2281
 epoch: 71, train_loss: 1.2524, test_loss: 1.3065, test_f1: 0.2281
 epoch: 72, train_loss: 1.2528, test_loss: 1.3107, test_f1: 0.2281
 epoch: 73, train_loss: 1.2532, test_loss: 1.3117, test_f1: 0.2281
 epoch: 74, train_loss: 1.2525, test_loss: 1.3079, test_f1: 0.2281
 epoch: 75, train_loss: 1.2522, test_loss: 1.3051, test_f1: 0.2281
 epoch: 76, train_loss: 1.2523, test_loss: 1.3021, test_f1: 0.2281
 epoch: 77, train_loss: 1.2527, test_loss: 1.3027, test_f1: 0.2281
 epoch: 78, train_loss: 1.2523, test_loss: 1.3044, test_f1: 0.2281
 epoch: 79, train_loss: 1.2524, test_loss: 1.3067, test_f1: 0.2281
 epoch: 80, train_loss: 1.2526, test_loss: 1.3052, test_f1: 0.2281
 epoch: 81, train_loss: 1.2526, test_loss: 1.3051, test_f1: 0.2281
 epoch: 82, train_loss: 1.2525, test_loss: 1.3065, test_f1: 0.2281
 epoch: 83, train_loss: 1.2525, test_loss: 1.3068, test_f1: 0.2281
 epoch: 84, train_loss: 1.2521, test_loss: 1.3050, test_f1: 0.2281
 epoch: 85, train_loss: 1.2520, test_loss: 1.3042, test_f1: 0.2281
 epoch: 86, train_loss: 1.2524, test_loss: 1.3028, test_f1: 0.2281
 epoch: 87, train_loss: 1.2522, test_loss: 1.3037, test_f1: 0.2281
 epoch: 88, train_loss: 1.2521, test_loss: 1.3048, test_f1: 0.2281
 epoch: 89, train_loss: 1.2522, test_loss: 1.3039, test_f1: 0.2281
 epoch: 90, train_loss: 1.2528, test_loss: 1.3022, test_f1: 0.2281
 epoch: 91, train_loss: 1.2527, test_loss: 1.3054, test_f1: 0.2281
 epoch: 92, train_loss: 1.2524, test_loss: 1.3086, test_f1: 0.2281
 epoch: 93, train_loss: 1.2530, test_loss: 1.3085, test_f1: 0.2281
 epoch: 94, train_loss: 1.2529, test_loss: 1.3069, test_f1: 0.2281
 epoch: 95, train_loss: 1.2525, test_loss: 1.3013, test_f1: 0.2281
 epoch: 96, train_loss: 1.2526, test_loss: 1.3000, test_f1: 0.2281
 epoch: 97, train_loss: 1.2531, test_loss: 1.2998, test_f1: 0.2281
 epoch: 98, train_loss: 1.2530, test_loss: 1.3009, test_f1: 0.2281
 epoch: 99, train_loss: 1.2521, test_loss: 1.3034, test_f1: 0.2281

Training completed in 381.81 seconds
Best F1: 0.5130 at epoch 49
Mean F1 across iterations: 0.2566  0.0855
========================FINAL RESULTS================================
FEGIN weighted F1: 0.5130  0.0855
python main.py --data ltspice_demos --representation component_pin --model FEGIN --layers 3 --hiddens 16 --batch_size 256 --lr 0.1 --emb_size 128 --epochs 100 --save_appendix component_pin_L3_H16_BS256_LR0.1_E128 --no_val
-----



STDERR:
  File "main.py", line 370, in <module>
    main()
  File "main.py", line 254, in main
    dataset = dataset_class(
  File "/home/philip/projects/ltspice_examples_code_repo/Circuit-Completion-Using-GNNs/component_classification_with_link_prediction_head/evaluation/FEGIN/kernel/circuit_datasets.py", line 15, in __init__
    self.data, self.slices = torch.load(self.processed_paths[0])
  File "/home/philip/.local/lib/python3.8/site-packages/torch/serialization.py", line 1040, in load
    warnings.warn(
  File "/usr/lib/python3.8/warnings.py", line 109, in _showwarnmsg
    sw(msg.message, msg.category, msg.filename, msg.lineno,
  File "main.py", line 47, in warn_with_traceback
    traceback.print_stack(file=log)
/home/philip/projects/ltspice_examples_code_repo/Circuit-Completion-Using-GNNs/component_classification_with_link_prediction_head/evaluation/FEGIN/kernel/circuit_datasets.py:15: FutureWarning: You are using `torch.load` with `weights_only=False` (the current default value), which uses the default pickle module implicitly. It is possible to construct malicious pickle data which will execute arbitrary code during unpickling (See https://github.com/pytorch/pytorch/blob/main/SECURITY.md#untrusted-models for more details). In a future release, the default value for `weights_only` will be flipped to `True`. This limits the functions that could be executed during unpickling. Arbitrary objects will no longer be allowed to be loaded via this mode unless they are explicitly allowlisted by the user via `torch.serialization.add_safe_globals`. We recommend you start setting `weights_only=True` for any use case where you don't have full control of the loaded file. Please open an issue on GitHub for any issues related to this experimental feature.
  self.data, self.slices = torch.load(self.processed_paths[0])
