STDOUT:
Results will be saved in /home/philip/projects/ltspice_examples_code_repo/Circuit-Completion-Using-GNNs/component_classification_with_link_prediction_head/evaluation/FEGIN/results/model_FEGIN_dataset_ltspice_demos
Command line input: python main.py --data ltspice_demos --representation component_component --model FEGIN --layers 3 --hiddens 32 --batch_size 256 --lr 0.01 --emb_size 250 --epochs 100 --save_appendix component_component_L3_H32_BS256_LR0.01_E250 --no_val
 is saved.
-----
ltspice_demos - FEGIN
Using 3 layers, 32 hidden units, h = 2
Loading component_component representation dataset
ENTERED
Training FEGIN on component_component representation
Train: 1565, Test: 383
##################ITERATION #0 ****************************************
 epoch: 0, train_loss: 1.3010, test_loss: 1.3176, test_f1: 0.1716
 epoch: 1, train_loss: 1.2098, test_loss: 1.2822, test_f1: 0.2734
 epoch: 2, train_loss: 1.1887, test_loss: 1.3384, test_f1: 0.2613
 epoch: 3, train_loss: 1.1754, test_loss: 1.2781, test_f1: 0.2441
 epoch: 4, train_loss: 1.1634, test_loss: 1.2807, test_f1: 0.3484
 epoch: 5, train_loss: 1.1691, test_loss: 1.2616, test_f1: 0.3124
 epoch: 6, train_loss: 1.1518, test_loss: 1.3358, test_f1: 0.2281
 epoch: 7, train_loss: 1.1583, test_loss: 1.2247, test_f1: 0.3237
 epoch: 8, train_loss: 1.1358, test_loss: 1.2317, test_f1: 0.4260
 epoch: 9, train_loss: 1.1083, test_loss: 1.2160, test_f1: 0.3329
 epoch: 10, train_loss: 1.0669, test_loss: 1.2450, test_f1: 0.3143
 epoch: 11, train_loss: 1.0588, test_loss: 1.3140, test_f1: 0.4768
 epoch: 12, train_loss: 1.0585, test_loss: 1.3351, test_f1: 0.5029
 epoch: 13, train_loss: 1.0178, test_loss: 1.3702, test_f1: 0.5192
 epoch: 14, train_loss: 1.0096, test_loss: 1.3418, test_f1: 0.4690
 epoch: 15, train_loss: 0.9872, test_loss: 1.1967, test_f1: 0.5305
 epoch: 16, train_loss: 0.9654, test_loss: 1.4291, test_f1: 0.4802
 epoch: 17, train_loss: 0.9502, test_loss: 1.4183, test_f1: 0.2965
 epoch: 18, train_loss: 0.9307, test_loss: 1.2820, test_f1: 0.4897
 epoch: 19, train_loss: 0.9193, test_loss: 1.4241, test_f1: 0.4273
 epoch: 20, train_loss: 0.9072, test_loss: 1.2750, test_f1: 0.5369
 epoch: 21, train_loss: 0.8871, test_loss: 1.2111, test_f1: 0.5009
 epoch: 22, train_loss: 0.9013, test_loss: 1.3797, test_f1: 0.4101
 epoch: 23, train_loss: 0.8868, test_loss: 1.3072, test_f1: 0.4404
 epoch: 24, train_loss: 0.8678, test_loss: 1.3553, test_f1: 0.4985
 epoch: 25, train_loss: 0.8490, test_loss: 1.4134, test_f1: 0.5238
 epoch: 26, train_loss: 0.8383, test_loss: 1.1337, test_f1: 0.5232
 epoch: 27, train_loss: 0.8137, test_loss: 1.1935, test_f1: 0.5808
 epoch: 28, train_loss: 0.8325, test_loss: 1.1895, test_f1: 0.5163
 epoch: 29, train_loss: 0.8474, test_loss: 1.2023, test_f1: 0.4400
 epoch: 30, train_loss: 0.8167, test_loss: 1.3027, test_f1: 0.5465
 epoch: 31, train_loss: 0.8063, test_loss: 1.1571, test_f1: 0.4766
 epoch: 32, train_loss: 0.8058, test_loss: 1.2290, test_f1: 0.5034
 epoch: 33, train_loss: 0.7941, test_loss: 1.3953, test_f1: 0.4860
 epoch: 34, train_loss: 0.8272, test_loss: 1.1975, test_f1: 0.5145
 epoch: 35, train_loss: 0.7917, test_loss: 1.4355, test_f1: 0.4320
 epoch: 36, train_loss: 0.7768, test_loss: 1.4158, test_f1: 0.5867
 epoch: 37, train_loss: 0.7640, test_loss: 1.4468, test_f1: 0.5714
 epoch: 38, train_loss: 0.7593, test_loss: 1.5090, test_f1: 0.5408
 epoch: 39, train_loss: 0.7595, test_loss: 1.4497, test_f1: 0.4652
 epoch: 40, train_loss: 0.7646, test_loss: 1.4715, test_f1: 0.4999
 epoch: 41, train_loss: 0.7558, test_loss: 1.3582, test_f1: 0.5026
 epoch: 42, train_loss: 0.7643, test_loss: 1.1690, test_f1: 0.5814
 epoch: 43, train_loss: 0.7701, test_loss: 1.1669, test_f1: 0.5644
 epoch: 44, train_loss: 0.7283, test_loss: 1.4728, test_f1: 0.5463
 epoch: 45, train_loss: 0.7292, test_loss: 1.4166, test_f1: 0.5161
 epoch: 46, train_loss: 0.7778, test_loss: 1.5375, test_f1: 0.4465
 epoch: 47, train_loss: 0.7526, test_loss: 1.4020, test_f1: 0.5540
 epoch: 48, train_loss: 0.7485, test_loss: 1.6462, test_f1: 0.5287
 epoch: 49, train_loss: 0.7107, test_loss: 1.6182, test_f1: 0.5814
 epoch: 50, train_loss: 0.7117, test_loss: 1.4922, test_f1: 0.5477
 epoch: 51, train_loss: 0.6946, test_loss: 1.5358, test_f1: 0.5683
 epoch: 52, train_loss: 0.6883, test_loss: 1.5785, test_f1: 0.4974
 epoch: 53, train_loss: 0.7007, test_loss: 1.4974, test_f1: 0.5761
 epoch: 54, train_loss: 0.7020, test_loss: 1.5622, test_f1: 0.5282
 epoch: 55, train_loss: 0.7087, test_loss: 1.6016, test_f1: 0.5594
 epoch: 56, train_loss: 0.6831, test_loss: 1.5790, test_f1: 0.5649
 epoch: 57, train_loss: 0.6618, test_loss: 1.5155, test_f1: 0.5668
 epoch: 58, train_loss: 0.6501, test_loss: 1.5658, test_f1: 0.6027
 epoch: 59, train_loss: 0.6537, test_loss: 1.7935, test_f1: 0.5911
 epoch: 60, train_loss: 0.6535, test_loss: 1.9566, test_f1: 0.5848
 epoch: 61, train_loss: 0.6476, test_loss: 1.8176, test_f1: 0.5367
 epoch: 62, train_loss: 0.6214, test_loss: 1.7761, test_f1: 0.5577
 epoch: 63, train_loss: 0.6233, test_loss: 1.6647, test_f1: 0.5755
 epoch: 64, train_loss: 0.6396, test_loss: 1.6824, test_f1: 0.5093
 epoch: 65, train_loss: 0.6391, test_loss: 1.4733, test_f1: 0.5563
 epoch: 66, train_loss: 0.6244, test_loss: 1.4748, test_f1: 0.5678
 epoch: 67, train_loss: 0.6151, test_loss: 1.8472, test_f1: 0.5727
 epoch: 68, train_loss: 0.5971, test_loss: 2.0826, test_f1: 0.5955
 epoch: 69, train_loss: 0.5927, test_loss: 2.0272, test_f1: 0.5815
 epoch: 70, train_loss: 0.5997, test_loss: 1.9873, test_f1: 0.5347
 epoch: 71, train_loss: 0.5713, test_loss: 2.0368, test_f1: 0.6109
 epoch: 72, train_loss: 0.5678, test_loss: 1.8083, test_f1: 0.6007
 epoch: 73, train_loss: 0.5794, test_loss: 1.9797, test_f1: 0.5651
 epoch: 74, train_loss: 0.5893, test_loss: 2.1052, test_f1: 0.5074
 epoch: 75, train_loss: 0.5757, test_loss: 1.9387, test_f1: 0.5547
 epoch: 76, train_loss: 0.5960, test_loss: 2.0288, test_f1: 0.5713
 epoch: 77, train_loss: 0.5562, test_loss: 2.2336, test_f1: 0.5680
 epoch: 78, train_loss: 0.5725, test_loss: 2.2146, test_f1: 0.5749
 epoch: 79, train_loss: 0.5431, test_loss: 2.2604, test_f1: 0.5462
 epoch: 80, train_loss: 0.5402, test_loss: 2.4324, test_f1: 0.5928
 epoch: 81, train_loss: 0.5278, test_loss: 2.1656, test_f1: 0.5787
 epoch: 82, train_loss: 0.5570, test_loss: 1.9003, test_f1: 0.4989
 epoch: 83, train_loss: 0.5847, test_loss: 1.8175, test_f1: 0.5079
 epoch: 84, train_loss: 0.5680, test_loss: 1.9220, test_f1: 0.5593
 epoch: 85, train_loss: 0.5673, test_loss: 1.9671, test_f1: 0.5730
 epoch: 86, train_loss: 0.5697, test_loss: 1.9241, test_f1: 0.5855
 epoch: 87, train_loss: 0.5737, test_loss: 2.0578, test_f1: 0.5951
 epoch: 88, train_loss: 0.5640, test_loss: 2.2408, test_f1: 0.5080
 epoch: 89, train_loss: 0.5411, test_loss: 2.1348, test_f1: 0.5062
 epoch: 90, train_loss: 0.5229, test_loss: 2.1920, test_f1: 0.5707
 epoch: 91, train_loss: 0.5234, test_loss: 2.0563, test_f1: 0.5550
 epoch: 92, train_loss: 0.5466, test_loss: 1.7329, test_f1: 0.5406
 epoch: 93, train_loss: 0.5280, test_loss: 1.7535, test_f1: 0.5391
 epoch: 94, train_loss: 0.5286, test_loss: 1.8438, test_f1: 0.5107
 epoch: 95, train_loss: 0.5505, test_loss: 1.6550, test_f1: 0.5464
 epoch: 96, train_loss: 0.5581, test_loss: 1.7961, test_f1: 0.5559
 epoch: 97, train_loss: 0.5377, test_loss: 1.9267, test_f1: 0.5801
 epoch: 98, train_loss: 0.5436, test_loss: 2.2109, test_f1: 0.5050
 epoch: 99, train_loss: 0.6890, test_loss: 3.8472, test_f1: 0.3047
##################ITERATION #1 ****************************************
 epoch: 0, train_loss: 1.2972, test_loss: 1.3696, test_f1: 0.2293
 epoch: 1, train_loss: 1.2110, test_loss: 1.2731, test_f1: 0.2730
 epoch: 2, train_loss: 1.1823, test_loss: 1.2935, test_f1: 0.2349
 epoch: 3, train_loss: 1.1538, test_loss: 1.2126, test_f1: 0.4050
 epoch: 4, train_loss: 1.1222, test_loss: 1.2331, test_f1: 0.3518
 epoch: 5, train_loss: 1.0783, test_loss: 1.2192, test_f1: 0.3970
 epoch: 6, train_loss: 1.0808, test_loss: 1.3328, test_f1: 0.3203
 epoch: 7, train_loss: 1.0788, test_loss: 1.2379, test_f1: 0.4221
 epoch: 8, train_loss: 1.0551, test_loss: 1.2869, test_f1: 0.3382
 epoch: 9, train_loss: 1.0341, test_loss: 1.2890, test_f1: 0.4047
 epoch: 10, train_loss: 1.0150, test_loss: 1.2583, test_f1: 0.4388
 epoch: 11, train_loss: 1.0026, test_loss: 1.1945, test_f1: 0.4898
 epoch: 12, train_loss: 0.9969, test_loss: 1.2253, test_f1: 0.5085
 epoch: 13, train_loss: 0.9850, test_loss: 1.4448, test_f1: 0.4527
 epoch: 14, train_loss: 0.9703, test_loss: 1.1105, test_f1: 0.5591
 epoch: 15, train_loss: 0.9230, test_loss: 1.3304, test_f1: 0.4781
 epoch: 16, train_loss: 0.9524, test_loss: 1.2503, test_f1: 0.5069
 epoch: 17, train_loss: 0.9318, test_loss: 1.1394, test_f1: 0.5054
 epoch: 18, train_loss: 0.9085, test_loss: 1.7149, test_f1: 0.4388
 epoch: 19, train_loss: 0.9175, test_loss: 1.2656, test_f1: 0.5369
 epoch: 20, train_loss: 0.8970, test_loss: 1.1798, test_f1: 0.5778
 epoch: 21, train_loss: 0.8891, test_loss: 1.2637, test_f1: 0.5710
 epoch: 22, train_loss: 0.8651, test_loss: 1.1492, test_f1: 0.5601
 epoch: 23, train_loss: 0.8520, test_loss: 1.5312, test_f1: 0.4560
 epoch: 24, train_loss: 0.8668, test_loss: 1.1581, test_f1: 0.5522
 epoch: 25, train_loss: 0.8792, test_loss: 1.5004, test_f1: 0.5239
 epoch: 26, train_loss: 0.8633, test_loss: 1.5231, test_f1: 0.4317
 epoch: 27, train_loss: 0.8717, test_loss: 1.2304, test_f1: 0.5531
 epoch: 28, train_loss: 0.8442, test_loss: 1.2825, test_f1: 0.5110
 epoch: 29, train_loss: 0.8222, test_loss: 1.2902, test_f1: 0.5387
 epoch: 30, train_loss: 0.8346, test_loss: 1.2831, test_f1: 0.6035
 epoch: 31, train_loss: 0.8554, test_loss: 1.3812, test_f1: 0.5529
 epoch: 32, train_loss: 0.8554, test_loss: 1.2768, test_f1: 0.5125
 epoch: 33, train_loss: 0.8267, test_loss: 1.4073, test_f1: 0.4869
 epoch: 34, train_loss: 0.8010, test_loss: 1.3230, test_f1: 0.5280
 epoch: 35, train_loss: 0.8207, test_loss: 1.4057, test_f1: 0.4711
 epoch: 36, train_loss: 0.8072, test_loss: 1.3129, test_f1: 0.5238
 epoch: 37, train_loss: 0.8146, test_loss: 1.3126, test_f1: 0.5566
 epoch: 38, train_loss: 0.7892, test_loss: 1.3486, test_f1: 0.5623
 epoch: 39, train_loss: 0.7618, test_loss: 1.5263, test_f1: 0.5484
 epoch: 40, train_loss: 0.7918, test_loss: 1.4740, test_f1: 0.5119
 epoch: 41, train_loss: 0.7735, test_loss: 1.3561, test_f1: 0.6010
 epoch: 42, train_loss: 0.7592, test_loss: 1.3201, test_f1: 0.6249
 epoch: 43, train_loss: 0.8348, test_loss: 2.0748, test_f1: 0.4088
 epoch: 44, train_loss: 0.8734, test_loss: 1.5707, test_f1: 0.4459
 epoch: 45, train_loss: 0.9044, test_loss: 1.1377, test_f1: 0.5444
 epoch: 46, train_loss: 0.8601, test_loss: 1.3775, test_f1: 0.4670
 epoch: 47, train_loss: 0.8412, test_loss: 1.3876, test_f1: 0.5067
 epoch: 48, train_loss: 0.8302, test_loss: 1.5104, test_f1: 0.5850
 epoch: 49, train_loss: 0.8197, test_loss: 2.0972, test_f1: 0.5496
 epoch: 50, train_loss: 0.8402, test_loss: 1.8563, test_f1: 0.5064
 epoch: 51, train_loss: 0.8272, test_loss: 1.4998, test_f1: 0.5106
 epoch: 52, train_loss: 0.8233, test_loss: 1.3658, test_f1: 0.5180
 epoch: 53, train_loss: 0.7845, test_loss: 1.3893, test_f1: 0.5458
 epoch: 54, train_loss: 0.7782, test_loss: 1.2916, test_f1: 0.5615
 epoch: 55, train_loss: 0.7778, test_loss: 1.3928, test_f1: 0.5266
 epoch: 56, train_loss: 0.7745, test_loss: 1.4417, test_f1: 0.5320
 epoch: 57, train_loss: 0.7753, test_loss: 1.6421, test_f1: 0.5096
 epoch: 58, train_loss: 0.7591, test_loss: 1.7411, test_f1: 0.5420
 epoch: 59, train_loss: 0.7572, test_loss: 1.8055, test_f1: 0.5469
 epoch: 60, train_loss: 0.7728, test_loss: 2.2107, test_f1: 0.4933
 epoch: 61, train_loss: 0.7584, test_loss: 1.4945, test_f1: 0.5541
 epoch: 62, train_loss: 0.7385, test_loss: 1.4629, test_f1: 0.5860
 epoch: 63, train_loss: 0.7326, test_loss: 1.5055, test_f1: 0.5469
 epoch: 64, train_loss: 0.7345, test_loss: 1.4668, test_f1: 0.5656
 epoch: 65, train_loss: 0.7237, test_loss: 1.4859, test_f1: 0.5581
 epoch: 66, train_loss: 0.7095, test_loss: 1.4579, test_f1: 0.5816
 epoch: 67, train_loss: 0.7097, test_loss: 1.4641, test_f1: 0.5939
 epoch: 68, train_loss: 0.7077, test_loss: 1.5612, test_f1: 0.5383
 epoch: 69, train_loss: 0.7099, test_loss: 1.4840, test_f1: 0.5469
 epoch: 70, train_loss: 0.7044, test_loss: 1.4853, test_f1: 0.5620
 epoch: 71, train_loss: 0.7161, test_loss: 1.5898, test_f1: 0.5228
 epoch: 72, train_loss: 0.7249, test_loss: 1.6082, test_f1: 0.5296
 epoch: 73, train_loss: 0.7209, test_loss: 1.5792, test_f1: 0.5547
 epoch: 74, train_loss: 0.7259, test_loss: 1.5389, test_f1: 0.5560
 epoch: 75, train_loss: 0.7065, test_loss: 1.5537, test_f1: 0.5440
 epoch: 76, train_loss: 0.7166, test_loss: 1.7691, test_f1: 0.5818
 epoch: 77, train_loss: 0.7112, test_loss: 1.6111, test_f1: 0.5922
 epoch: 78, train_loss: 0.7161, test_loss: 1.3919, test_f1: 0.6153
 epoch: 79, train_loss: 0.7108, test_loss: 1.3691, test_f1: 0.6181
 epoch: 80, train_loss: 0.6903, test_loss: 1.3836, test_f1: 0.5715
 epoch: 81, train_loss: 0.6786, test_loss: 1.4370, test_f1: 0.5736
 epoch: 82, train_loss: 0.6727, test_loss: 1.4348, test_f1: 0.5726
 epoch: 83, train_loss: 0.6646, test_loss: 1.4785, test_f1: 0.6105
 epoch: 84, train_loss: 0.6624, test_loss: 1.6316, test_f1: 0.5621
 epoch: 85, train_loss: 0.6461, test_loss: 1.7019, test_f1: 0.6094
 epoch: 86, train_loss: 0.6368, test_loss: 1.7462, test_f1: 0.5977
 epoch: 87, train_loss: 0.6418, test_loss: 1.6171, test_f1: 0.5757
 epoch: 88, train_loss: 0.6316, test_loss: 1.7255, test_f1: 0.5353
 epoch: 89, train_loss: 0.6536, test_loss: 1.6800, test_f1: 0.5773
 epoch: 90, train_loss: 0.6628, test_loss: 1.8060, test_f1: 0.5452
 epoch: 91, train_loss: 0.6934, test_loss: 1.7834, test_f1: 0.5770
 epoch: 92, train_loss: 0.6802, test_loss: 1.6670, test_f1: 0.5866
 epoch: 93, train_loss: 0.6810, test_loss: 1.5131, test_f1: 0.5608
 epoch: 94, train_loss: 0.6504, test_loss: 1.4985, test_f1: 0.5417
 epoch: 95, train_loss: 0.6189, test_loss: 1.4829, test_f1: 0.5373
 epoch: 96, train_loss: 0.6348, test_loss: 1.4960, test_f1: 0.5632
 epoch: 97, train_loss: 0.6208, test_loss: 1.4813, test_f1: 0.5603
 epoch: 98, train_loss: 0.6235, test_loss: 1.5073, test_f1: 0.5556
 epoch: 99, train_loss: 0.5937, test_loss: 1.5833, test_f1: 0.5677
##################ITERATION #2 ****************************************
 epoch: 0, train_loss: 1.3013, test_loss: 1.4693, test_f1: 0.2566
 epoch: 1, train_loss: 1.1900, test_loss: 1.3106, test_f1: 0.2775
 epoch: 2, train_loss: 1.1354, test_loss: 1.2760, test_f1: 0.3900
 epoch: 3, train_loss: 1.0983, test_loss: 1.3630, test_f1: 0.2628
 epoch: 4, train_loss: 1.0611, test_loss: 1.4787, test_f1: 0.2835
 epoch: 5, train_loss: 1.0340, test_loss: 1.4271, test_f1: 0.2961
 epoch: 6, train_loss: 1.0146, test_loss: 1.3978, test_f1: 0.3907
 epoch: 7, train_loss: 1.0091, test_loss: 1.2326, test_f1: 0.4788
 epoch: 8, train_loss: 0.9890, test_loss: 1.2362, test_f1: 0.4159
 epoch: 9, train_loss: 0.9601, test_loss: 1.3309, test_f1: 0.4420
 epoch: 10, train_loss: 0.9614, test_loss: 1.2587, test_f1: 0.3818
 epoch: 11, train_loss: 0.9381, test_loss: 1.2113, test_f1: 0.4791
 epoch: 12, train_loss: 0.9256, test_loss: 1.2038, test_f1: 0.3922
 epoch: 13, train_loss: 0.9757, test_loss: 1.1896, test_f1: 0.5463
 epoch: 14, train_loss: 0.9430, test_loss: 1.3402, test_f1: 0.4867
 epoch: 15, train_loss: 0.9156, test_loss: 1.3715, test_f1: 0.4620
 epoch: 16, train_loss: 0.9061, test_loss: 1.2487, test_f1: 0.4317
 epoch: 17, train_loss: 0.8877, test_loss: 1.0877, test_f1: 0.5501
 epoch: 18, train_loss: 0.8734, test_loss: 1.2481, test_f1: 0.4298
 epoch: 19, train_loss: 0.8892, test_loss: 1.3191, test_f1: 0.4394
 epoch: 20, train_loss: 0.8647, test_loss: 1.1511, test_f1: 0.5305
 epoch: 21, train_loss: 0.8461, test_loss: 1.1218, test_f1: 0.4144
 epoch: 22, train_loss: 0.8519, test_loss: 1.1806, test_f1: 0.4075
 epoch: 23, train_loss: 0.8763, test_loss: 1.3292, test_f1: 0.4606
 epoch: 24, train_loss: 0.8639, test_loss: 1.2180, test_f1: 0.4469
 epoch: 25, train_loss: 0.8412, test_loss: 1.7272, test_f1: 0.4182
 epoch: 26, train_loss: 0.8248, test_loss: 1.3416, test_f1: 0.4764
 epoch: 27, train_loss: 0.8560, test_loss: 1.2242, test_f1: 0.5462
 epoch: 28, train_loss: 0.8395, test_loss: 1.1746, test_f1: 0.5525
 epoch: 29, train_loss: 0.8205, test_loss: 2.0378, test_f1: 0.4235
 epoch: 30, train_loss: 0.8109, test_loss: 1.2228, test_f1: 0.5416
 epoch: 31, train_loss: 0.8250, test_loss: 1.3767, test_f1: 0.5607
 epoch: 32, train_loss: 0.8003, test_loss: 1.4581, test_f1: 0.5314
 epoch: 33, train_loss: 0.8003, test_loss: 1.1782, test_f1: 0.5347
 epoch: 34, train_loss: 0.8050, test_loss: 1.1464, test_f1: 0.5975
 epoch: 35, train_loss: 0.7854, test_loss: 1.3214, test_f1: 0.5484
 epoch: 36, train_loss: 0.7827, test_loss: 1.1805, test_f1: 0.5698
 epoch: 37, train_loss: 0.7928, test_loss: 1.2915, test_f1: 0.5008
 epoch: 38, train_loss: 0.7856, test_loss: 1.1662, test_f1: 0.5774
 epoch: 39, train_loss: 0.7710, test_loss: 1.4017, test_f1: 0.5398
 epoch: 40, train_loss: 0.7655, test_loss: 2.5538, test_f1: 0.3622
 epoch: 41, train_loss: 0.7785, test_loss: 1.2333, test_f1: 0.5601
 epoch: 42, train_loss: 0.7638, test_loss: 1.2629, test_f1: 0.5348
 epoch: 43, train_loss: 0.7517, test_loss: 1.1317, test_f1: 0.5446
 epoch: 44, train_loss: 0.7785, test_loss: 1.2082, test_f1: 0.5601
 epoch: 45, train_loss: 0.7469, test_loss: 1.2495, test_f1: 0.5724
 epoch: 46, train_loss: 0.7445, test_loss: 1.3420, test_f1: 0.5517
 epoch: 47, train_loss: 0.7362, test_loss: 1.2871, test_f1: 0.5254
 epoch: 48, train_loss: 0.7437, test_loss: 1.3526, test_f1: 0.5567
 epoch: 49, train_loss: 0.7260, test_loss: 1.2665, test_f1: 0.5921
 epoch: 50, train_loss: 0.7331, test_loss: 1.4264, test_f1: 0.5271
 epoch: 51, train_loss: 0.7574, test_loss: 1.1837, test_f1: 0.5644
 epoch: 52, train_loss: 0.7254, test_loss: 1.7641, test_f1: 0.4898
 epoch: 53, train_loss: 0.7160, test_loss: 1.4999, test_f1: 0.5109
 epoch: 54, train_loss: 0.7100, test_loss: 1.4751, test_f1: 0.5188
 epoch: 55, train_loss: 0.7161, test_loss: 1.3036, test_f1: 0.5590
 epoch: 56, train_loss: 0.7080, test_loss: 1.2361, test_f1: 0.5815
 epoch: 57, train_loss: 0.7053, test_loss: 1.1928, test_f1: 0.5774
 epoch: 58, train_loss: 0.7086, test_loss: 1.4020, test_f1: 0.5474
 epoch: 59, train_loss: 0.7145, test_loss: 1.9045, test_f1: 0.5023
 epoch: 60, train_loss: 0.7143, test_loss: 1.6262, test_f1: 0.5385
 epoch: 61, train_loss: 0.7074, test_loss: 1.3704, test_f1: 0.5589
 epoch: 62, train_loss: 0.6970, test_loss: 1.3305, test_f1: 0.5483
 epoch: 63, train_loss: 0.6892, test_loss: 1.4538, test_f1: 0.5469
 epoch: 64, train_loss: 0.6984, test_loss: 1.5284, test_f1: 0.5186
 epoch: 65, train_loss: 0.6812, test_loss: 1.2878, test_f1: 0.5811
 epoch: 66, train_loss: 0.6756, test_loss: 1.1324, test_f1: 0.6087
 epoch: 67, train_loss: 0.6683, test_loss: 1.1192, test_f1: 0.6181
 epoch: 68, train_loss: 0.6982, test_loss: 1.1661, test_f1: 0.6048
 epoch: 69, train_loss: 0.6578, test_loss: 1.7146, test_f1: 0.5383
 epoch: 70, train_loss: 0.6770, test_loss: 1.1021, test_f1: 0.6143
 epoch: 71, train_loss: 0.6716, test_loss: 1.2268, test_f1: 0.5990
 epoch: 72, train_loss: 0.6980, test_loss: 1.2501, test_f1: 0.6054
 epoch: 73, train_loss: 0.6816, test_loss: 1.2713, test_f1: 0.5686
 epoch: 74, train_loss: 0.6570, test_loss: 1.7461, test_f1: 0.4399
 epoch: 75, train_loss: 0.6295, test_loss: 1.6163, test_f1: 0.4601
 epoch: 76, train_loss: 0.6618, test_loss: 1.5817, test_f1: 0.5273
 epoch: 77, train_loss: 0.6692, test_loss: 1.6330, test_f1: 0.5027
 epoch: 78, train_loss: 0.6404, test_loss: 1.3782, test_f1: 0.5644
 epoch: 79, train_loss: 0.6225, test_loss: 1.4134, test_f1: 0.5603
 epoch: 80, train_loss: 0.6191, test_loss: 1.3345, test_f1: 0.5845
 epoch: 81, train_loss: 0.6487, test_loss: 1.2575, test_f1: 0.6203
 epoch: 82, train_loss: 0.6684, test_loss: 1.2544, test_f1: 0.6076
 epoch: 83, train_loss: 0.6517, test_loss: 1.2697, test_f1: 0.5775
 epoch: 84, train_loss: 0.6738, test_loss: 1.5271, test_f1: 0.5893
 epoch: 85, train_loss: 0.6806, test_loss: 1.6510, test_f1: 0.5999
 epoch: 86, train_loss: 0.6613, test_loss: 1.5389, test_f1: 0.5030
 epoch: 87, train_loss: 0.6712, test_loss: 1.4086, test_f1: 0.4917
 epoch: 88, train_loss: 0.6643, test_loss: 1.3892, test_f1: 0.5178
 epoch: 89, train_loss: 0.6762, test_loss: 1.5535, test_f1: 0.4808
 epoch: 90, train_loss: 0.6402, test_loss: 2.4196, test_f1: 0.3975
 epoch: 91, train_loss: 0.7246, test_loss: 1.7090, test_f1: 0.5986
 epoch: 92, train_loss: 0.6732, test_loss: 1.4405, test_f1: 0.5912
 epoch: 93, train_loss: 0.6443, test_loss: 1.3234, test_f1: 0.5762
 epoch: 94, train_loss: 0.6397, test_loss: 1.4274, test_f1: 0.5240
 epoch: 95, train_loss: 0.6427, test_loss: 1.4342, test_f1: 0.5646
 epoch: 96, train_loss: 0.6256, test_loss: 1.5011, test_f1: 0.5734
 epoch: 97, train_loss: 0.5949, test_loss: 1.6846, test_f1: 0.5380
 epoch: 98, train_loss: 0.5858, test_loss: 1.4459, test_f1: 0.5640
 epoch: 99, train_loss: 0.5793, test_loss: 1.4846, test_f1: 0.5358
##################ITERATION #3 ****************************************
 epoch: 0, train_loss: 1.2662, test_loss: 1.4243, test_f1: 0.3518
 epoch: 1, train_loss: 1.1519, test_loss: 1.3032, test_f1: 0.3192
 epoch: 2, train_loss: 1.1151, test_loss: 1.4873, test_f1: 0.2653
 epoch: 3, train_loss: 1.0951, test_loss: 1.2036, test_f1: 0.3245
 epoch: 4, train_loss: 1.0357, test_loss: 1.2045, test_f1: 0.3932
 epoch: 5, train_loss: 1.0098, test_loss: 1.2285, test_f1: 0.4579
 epoch: 6, train_loss: 0.9914, test_loss: 1.2640, test_f1: 0.4280
 epoch: 7, train_loss: 0.9743, test_loss: 1.3149, test_f1: 0.4470
 epoch: 8, train_loss: 0.9689, test_loss: 1.1945, test_f1: 0.4336
 epoch: 9, train_loss: 0.9381, test_loss: 1.2784, test_f1: 0.3535
 epoch: 10, train_loss: 0.9131, test_loss: 1.2691, test_f1: 0.4249
 epoch: 11, train_loss: 0.9077, test_loss: 1.1366, test_f1: 0.4707
 epoch: 12, train_loss: 0.8934, test_loss: 1.3632, test_f1: 0.3713
 epoch: 13, train_loss: 0.8721, test_loss: 1.1274, test_f1: 0.5004
 epoch: 14, train_loss: 0.8754, test_loss: 1.0441, test_f1: 0.5678
 epoch: 15, train_loss: 0.8429, test_loss: 1.3966, test_f1: 0.4514
 epoch: 16, train_loss: 0.8288, test_loss: 1.0965, test_f1: 0.5552
 epoch: 17, train_loss: 0.8297, test_loss: 1.0618, test_f1: 0.5085
 epoch: 18, train_loss: 0.8393, test_loss: 1.2386, test_f1: 0.5265
 epoch: 19, train_loss: 0.8374, test_loss: 1.1539, test_f1: 0.5730
 epoch: 20, train_loss: 0.8682, test_loss: 1.4653, test_f1: 0.5372
 epoch: 21, train_loss: 0.8664, test_loss: 1.3634, test_f1: 0.5259
 epoch: 22, train_loss: 0.8522, test_loss: 1.2199, test_f1: 0.5124
 epoch: 23, train_loss: 0.8307, test_loss: 1.4321, test_f1: 0.5241
 epoch: 24, train_loss: 0.8299, test_loss: 1.3038, test_f1: 0.4580
 epoch: 25, train_loss: 0.7948, test_loss: 1.0936, test_f1: 0.5787
 epoch: 26, train_loss: 0.7800, test_loss: 1.0341, test_f1: 0.5791
 epoch: 27, train_loss: 0.7738, test_loss: 1.1780, test_f1: 0.5405
 epoch: 28, train_loss: 0.7879, test_loss: 1.3685, test_f1: 0.5523
 epoch: 29, train_loss: 0.8034, test_loss: 1.3264, test_f1: 0.4479
 epoch: 30, train_loss: 0.8083, test_loss: 1.1931, test_f1: 0.5308
 epoch: 31, train_loss: 0.7894, test_loss: 1.0795, test_f1: 0.5597
 epoch: 32, train_loss: 0.7713, test_loss: 1.0413, test_f1: 0.5871
 epoch: 33, train_loss: 0.7659, test_loss: 1.1629, test_f1: 0.5277
 epoch: 34, train_loss: 0.7359, test_loss: 1.4668, test_f1: 0.4834
 epoch: 35, train_loss: 0.7440, test_loss: 1.2467, test_f1: 0.5705
 epoch: 36, train_loss: 0.7544, test_loss: 1.2960, test_f1: 0.5780
 epoch: 37, train_loss: 0.7511, test_loss: 1.1372, test_f1: 0.5443
 epoch: 38, train_loss: 0.7349, test_loss: 1.0819, test_f1: 0.5632
 epoch: 39, train_loss: 0.7315, test_loss: 1.0247, test_f1: 0.5988
 epoch: 40, train_loss: 0.7126, test_loss: 1.1041, test_f1: 0.5821
 epoch: 41, train_loss: 0.7235, test_loss: 1.3965, test_f1: 0.5106
 epoch: 42, train_loss: 0.7201, test_loss: 1.2451, test_f1: 0.5225
 epoch: 43, train_loss: 0.7227, test_loss: 1.2867, test_f1: 0.5236
 epoch: 44, train_loss: 0.7403, test_loss: 1.1679, test_f1: 0.5577
 epoch: 45, train_loss: 0.7208, test_loss: 1.1350, test_f1: 0.5322
 epoch: 46, train_loss: 0.7046, test_loss: 1.2741, test_f1: 0.5685
 epoch: 47, train_loss: 0.7028, test_loss: 1.2774, test_f1: 0.5574
 epoch: 48, train_loss: 0.6943, test_loss: 1.0986, test_f1: 0.6252
 epoch: 49, train_loss: 0.6927, test_loss: 1.1588, test_f1: 0.6342
 epoch: 50, train_loss: 0.6919, test_loss: 1.0933, test_f1: 0.5882
 epoch: 51, train_loss: 0.6787, test_loss: 1.1250, test_f1: 0.6063
 epoch: 52, train_loss: 0.6457, test_loss: 1.1291, test_f1: 0.5980
 epoch: 53, train_loss: 0.6550, test_loss: 1.1012, test_f1: 0.6294
 epoch: 54, train_loss: 0.6440, test_loss: 1.1166, test_f1: 0.5994
 epoch: 55, train_loss: 0.6399, test_loss: 1.1593, test_f1: 0.6373
 epoch: 56, train_loss: 0.6351, test_loss: 1.5473, test_f1: 0.5995
 epoch: 57, train_loss: 0.6276, test_loss: 1.2357, test_f1: 0.5807
 epoch: 58, train_loss: 0.6188, test_loss: 1.2051, test_f1: 0.5751
 epoch: 59, train_loss: 0.6063, test_loss: 1.3910, test_f1: 0.5826
 epoch: 60, train_loss: 0.6004, test_loss: 1.3491, test_f1: 0.5372
 epoch: 61, train_loss: 0.5945, test_loss: 1.2434, test_f1: 0.5411
 epoch: 62, train_loss: 0.6220, test_loss: 1.2956, test_f1: 0.5909
 epoch: 63, train_loss: 0.6226, test_loss: 1.2141, test_f1: 0.5934
 epoch: 64, train_loss: 0.6193, test_loss: 1.1903, test_f1: 0.6112
 epoch: 65, train_loss: 0.5948, test_loss: 1.2368, test_f1: 0.5811
 epoch: 66, train_loss: 0.5840, test_loss: 1.1997, test_f1: 0.5501
 epoch: 67, train_loss: 0.5638, test_loss: 1.1425, test_f1: 0.6176
 epoch: 68, train_loss: 0.5663, test_loss: 1.2052, test_f1: 0.5844
 epoch: 69, train_loss: 0.5925, test_loss: 1.2683, test_f1: 0.5484
 epoch: 70, train_loss: 0.5662, test_loss: 1.3718, test_f1: 0.5593
 epoch: 71, train_loss: 0.5687, test_loss: 1.2434, test_f1: 0.5939
 epoch: 72, train_loss: 0.5904, test_loss: 1.3633, test_f1: 0.5449
 epoch: 73, train_loss: 0.5807, test_loss: 1.4909, test_f1: 0.5303
 epoch: 74, train_loss: 0.5656, test_loss: 1.4796, test_f1: 0.5296
 epoch: 75, train_loss: 0.5505, test_loss: 1.4252, test_f1: 0.6663
 epoch: 76, train_loss: 0.5806, test_loss: 1.3134, test_f1: 0.6260
 epoch: 77, train_loss: 0.5995, test_loss: 1.4182, test_f1: 0.6240
 epoch: 78, train_loss: 0.5737, test_loss: 1.6016, test_f1: 0.5970
 epoch: 79, train_loss: 0.5915, test_loss: 1.3762, test_f1: 0.5682
 epoch: 80, train_loss: 0.5648, test_loss: 1.4817, test_f1: 0.6189
 epoch: 81, train_loss: 0.5830, test_loss: 1.4893, test_f1: 0.6421
 epoch: 82, train_loss: 0.5482, test_loss: 1.3509, test_f1: 0.6392
 epoch: 83, train_loss: 0.5651, test_loss: 1.2929, test_f1: 0.6527
 epoch: 84, train_loss: 0.5629, test_loss: 1.5432, test_f1: 0.5006
 epoch: 85, train_loss: 0.5527, test_loss: 1.4558, test_f1: 0.5823
 epoch: 86, train_loss: 0.5385, test_loss: 1.2935, test_f1: 0.6909
 epoch: 87, train_loss: 0.5206, test_loss: 1.3592, test_f1: 0.6552
 epoch: 88, train_loss: 0.5208, test_loss: 1.3601, test_f1: 0.6109
 epoch: 89, train_loss: 0.5779, test_loss: 1.2684, test_f1: 0.5717
 epoch: 90, train_loss: 0.5613, test_loss: 1.2140, test_f1: 0.5870
 epoch: 91, train_loss: 0.5652, test_loss: 1.2800, test_f1: 0.6003
 epoch: 92, train_loss: 0.5053, test_loss: 1.3348, test_f1: 0.6329
 epoch: 93, train_loss: 0.5211, test_loss: 1.2672, test_f1: 0.6308
 epoch: 94, train_loss: 0.5202, test_loss: 1.2297, test_f1: 0.6148
 epoch: 95, train_loss: 0.5179, test_loss: 1.3380, test_f1: 0.6266
 epoch: 96, train_loss: 0.4936, test_loss: 1.4220, test_f1: 0.6246
 epoch: 97, train_loss: 0.4853, test_loss: 1.5425, test_f1: 0.5582
 epoch: 98, train_loss: 0.4772, test_loss: 1.3836, test_f1: 0.5759
 epoch: 99, train_loss: 0.5114, test_loss: 1.2798, test_f1: 0.5866
##################ITERATION #4 ****************************************
 epoch: 0, train_loss: 1.3098, test_loss: 1.3857, test_f1: 0.2522
 epoch: 1, train_loss: 1.1837, test_loss: 1.3602, test_f1: 0.3324
 epoch: 2, train_loss: 1.1353, test_loss: 1.2472, test_f1: 0.4047
 epoch: 3, train_loss: 1.0896, test_loss: 1.1443, test_f1: 0.4907
 epoch: 4, train_loss: 1.0279, test_loss: 1.2277, test_f1: 0.3944
 epoch: 5, train_loss: 0.9854, test_loss: 1.1717, test_f1: 0.5168
 epoch: 6, train_loss: 0.9591, test_loss: 1.1409, test_f1: 0.4719
 epoch: 7, train_loss: 0.9483, test_loss: 1.1500, test_f1: 0.4561
 epoch: 8, train_loss: 0.9074, test_loss: 1.2570, test_f1: 0.4680
 epoch: 9, train_loss: 0.9101, test_loss: 1.0498, test_f1: 0.5286
 epoch: 10, train_loss: 0.8941, test_loss: 1.0287, test_f1: 0.5816
 epoch: 11, train_loss: 0.8708, test_loss: 1.1295, test_f1: 0.4772
 epoch: 12, train_loss: 0.8494, test_loss: 1.2604, test_f1: 0.4429
 epoch: 13, train_loss: 0.8473, test_loss: 1.0739, test_f1: 0.5419
 epoch: 14, train_loss: 0.8303, test_loss: 1.2033, test_f1: 0.4749
 epoch: 15, train_loss: 0.8142, test_loss: 1.0931, test_f1: 0.5820
 epoch: 16, train_loss: 0.8089, test_loss: 1.2707, test_f1: 0.4847
 epoch: 17, train_loss: 0.8455, test_loss: 1.0539, test_f1: 0.5994
 epoch: 18, train_loss: 0.8419, test_loss: 1.1062, test_f1: 0.4868
 epoch: 19, train_loss: 0.8263, test_loss: 1.0629, test_f1: 0.5459
 epoch: 20, train_loss: 0.8169, test_loss: 1.0931, test_f1: 0.5909
 epoch: 21, train_loss: 0.8264, test_loss: 1.1090, test_f1: 0.4858
 epoch: 22, train_loss: 0.7788, test_loss: 1.1205, test_f1: 0.5093
 epoch: 23, train_loss: 0.7685, test_loss: 1.1920, test_f1: 0.4640
 epoch: 24, train_loss: 0.8034, test_loss: 1.1762, test_f1: 0.5613
 epoch: 25, train_loss: 0.7785, test_loss: 1.0534, test_f1: 0.5709
 epoch: 26, train_loss: 0.7325, test_loss: 1.1458, test_f1: 0.5182
 epoch: 27, train_loss: 0.8153, test_loss: 1.1146, test_f1: 0.5400
 epoch: 28, train_loss: 0.7803, test_loss: 1.0244, test_f1: 0.6141
 epoch: 29, train_loss: 0.7547, test_loss: 1.0808, test_f1: 0.5743
 epoch: 30, train_loss: 0.7439, test_loss: 1.2924, test_f1: 0.4641
 epoch: 31, train_loss: 0.7520, test_loss: 1.3599, test_f1: 0.4870
 epoch: 32, train_loss: 0.7463, test_loss: 1.5712, test_f1: 0.4684
 epoch: 33, train_loss: 0.7262, test_loss: 1.2232, test_f1: 0.5385
 epoch: 34, train_loss: 0.7128, test_loss: 1.1036, test_f1: 0.5782
 epoch: 35, train_loss: 0.7409, test_loss: 1.2300, test_f1: 0.5234
 epoch: 36, train_loss: 0.7363, test_loss: 1.1412, test_f1: 0.5587
 epoch: 37, train_loss: 0.7269, test_loss: 1.1221, test_f1: 0.5772
 epoch: 38, train_loss: 0.7050, test_loss: 1.1233, test_f1: 0.6001
 epoch: 39, train_loss: 0.6859, test_loss: 1.1279, test_f1: 0.5468
 epoch: 40, train_loss: 0.6939, test_loss: 1.1963, test_f1: 0.5307
 epoch: 41, train_loss: 0.6986, test_loss: 1.2523, test_f1: 0.5392
 epoch: 42, train_loss: 0.7104, test_loss: 1.1828, test_f1: 0.5508
 epoch: 43, train_loss: 0.6780, test_loss: 1.1476, test_f1: 0.5292
 epoch: 44, train_loss: 0.6613, test_loss: 1.1881, test_f1: 0.5973
 epoch: 45, train_loss: 0.6618, test_loss: 1.1431, test_f1: 0.6047
 epoch: 46, train_loss: 0.6475, test_loss: 1.4175, test_f1: 0.5600
 epoch: 47, train_loss: 0.6847, test_loss: 1.3936, test_f1: 0.5546
 epoch: 48, train_loss: 0.6716, test_loss: 1.2892, test_f1: 0.5501
 epoch: 49, train_loss: 0.6397, test_loss: 1.2522, test_f1: 0.6053
 epoch: 50, train_loss: 0.6305, test_loss: 1.3979, test_f1: 0.5467
 epoch: 51, train_loss: 0.6404, test_loss: 1.2359, test_f1: 0.5528
 epoch: 52, train_loss: 0.6218, test_loss: 1.4383, test_f1: 0.5837
 epoch: 53, train_loss: 0.6270, test_loss: 1.7191, test_f1: 0.4885
 epoch: 54, train_loss: 0.6306, test_loss: 1.2538, test_f1: 0.5400
 epoch: 55, train_loss: 0.6110, test_loss: 1.2076, test_f1: 0.5883
 epoch: 56, train_loss: 0.6013, test_loss: 1.1974, test_f1: 0.6130
 epoch: 57, train_loss: 0.5721, test_loss: 1.2472, test_f1: 0.6067
 epoch: 58, train_loss: 0.5837, test_loss: 1.2881, test_f1: 0.5771
 epoch: 59, train_loss: 0.5989, test_loss: 1.2541, test_f1: 0.6125
 epoch: 60, train_loss: 0.6184, test_loss: 1.1615, test_f1: 0.6133
 epoch: 61, train_loss: 0.5978, test_loss: 1.2121, test_f1: 0.5664
 epoch: 62, train_loss: 0.5751, test_loss: 1.3637, test_f1: 0.5740
 epoch: 63, train_loss: 0.5662, test_loss: 1.4394, test_f1: 0.5663
 epoch: 64, train_loss: 0.5444, test_loss: 1.3618, test_f1: 0.5617
 epoch: 65, train_loss: 0.5527, test_loss: 1.2900, test_f1: 0.5700
 epoch: 66, train_loss: 0.5722, test_loss: 1.2908, test_f1: 0.5747
 epoch: 67, train_loss: 0.5391, test_loss: 1.3189, test_f1: 0.5950
 epoch: 68, train_loss: 0.5820, test_loss: 1.3542, test_f1: 0.6255
 epoch: 69, train_loss: 0.5666, test_loss: 1.2990, test_f1: 0.5963
 epoch: 70, train_loss: 0.5941, test_loss: 1.2858, test_f1: 0.6429
 epoch: 71, train_loss: 0.5786, test_loss: 1.3981, test_f1: 0.5819
 epoch: 72, train_loss: 0.5832, test_loss: 1.5523, test_f1: 0.5145
 epoch: 73, train_loss: 0.5528, test_loss: 1.3961, test_f1: 0.5674
 epoch: 74, train_loss: 0.5351, test_loss: 1.4963, test_f1: 0.5860
 epoch: 75, train_loss: 0.5293, test_loss: 1.4425, test_f1: 0.5833
 epoch: 76, train_loss: 0.5471, test_loss: 1.3301, test_f1: 0.5824
 epoch: 77, train_loss: 0.5320, test_loss: 1.5433, test_f1: 0.5619
 epoch: 78, train_loss: 0.5341, test_loss: 1.4221, test_f1: 0.5898
 epoch: 79, train_loss: 0.4988, test_loss: 1.5201, test_f1: 0.6043
 epoch: 80, train_loss: 0.4906, test_loss: 1.5883, test_f1: 0.5854
 epoch: 81, train_loss: 0.5075, test_loss: 1.6906, test_f1: 0.5376
 epoch: 82, train_loss: 0.5012, test_loss: 1.5887, test_f1: 0.5997
 epoch: 83, train_loss: 0.4952, test_loss: 1.5669, test_f1: 0.5685
 epoch: 84, train_loss: 0.4789, test_loss: 1.8861, test_f1: 0.5281
 epoch: 85, train_loss: 0.4803, test_loss: 1.6302, test_f1: 0.5692
 epoch: 86, train_loss: 0.4834, test_loss: 1.5705, test_f1: 0.6066
 epoch: 87, train_loss: 0.5009, test_loss: 1.5925, test_f1: 0.5819
 epoch: 88, train_loss: 0.5120, test_loss: 1.6773, test_f1: 0.5879
 epoch: 89, train_loss: 0.4826, test_loss: 1.6705, test_f1: 0.5649
 epoch: 90, train_loss: 0.4997, test_loss: 1.6541, test_f1: 0.5716
 epoch: 91, train_loss: 0.5079, test_loss: 1.7306, test_f1: 0.5444
 epoch: 92, train_loss: 0.4674, test_loss: 1.7629, test_f1: 0.5492
 epoch: 93, train_loss: 0.5008, test_loss: 1.5041, test_f1: 0.5562
 epoch: 94, train_loss: 0.4734, test_loss: 1.5840, test_f1: 0.5665
 epoch: 95, train_loss: 0.4736, test_loss: 1.7077, test_f1: 0.5564
 epoch: 96, train_loss: 0.4797, test_loss: 1.6444, test_f1: 0.5671
 epoch: 97, train_loss: 0.4911, test_loss: 1.7334, test_f1: 0.5712
 epoch: 98, train_loss: 0.4732, test_loss: 1.7841, test_f1: 0.5121
 epoch: 99, train_loss: 0.4887, test_loss: 1.6725, test_f1: 0.5599
##################ITERATION #5 ****************************************
 epoch: 0, train_loss: 1.3788, test_loss: 1.7257, test_f1: 0.2281
 epoch: 1, train_loss: 1.2525, test_loss: 1.4429, test_f1: 0.3098
 epoch: 2, train_loss: 1.1829, test_loss: 1.2920, test_f1: 0.2671
 epoch: 3, train_loss: 1.1327, test_loss: 1.2250, test_f1: 0.2621
 epoch: 4, train_loss: 1.0954, test_loss: 1.1805, test_f1: 0.3745
 epoch: 5, train_loss: 1.0504, test_loss: 1.1291, test_f1: 0.4713
 epoch: 6, train_loss: 1.0215, test_loss: 1.1514, test_f1: 0.4228
 epoch: 7, train_loss: 1.0027, test_loss: 1.1356, test_f1: 0.4576
 epoch: 8, train_loss: 0.9741, test_loss: 1.3746, test_f1: 0.4332
 epoch: 9, train_loss: 0.9700, test_loss: 1.2061, test_f1: 0.4441
 epoch: 10, train_loss: 0.9542, test_loss: 1.4765, test_f1: 0.3904
 epoch: 11, train_loss: 0.9398, test_loss: 1.4300, test_f1: 0.4619
 epoch: 12, train_loss: 0.9305, test_loss: 2.2979, test_f1: 0.4298
 epoch: 13, train_loss: 0.9346, test_loss: 1.1513, test_f1: 0.5068
 epoch: 14, train_loss: 0.8946, test_loss: 1.2802, test_f1: 0.4646
 epoch: 15, train_loss: 0.8787, test_loss: 1.0973, test_f1: 0.5221
 epoch: 16, train_loss: 0.8663, test_loss: 1.1832, test_f1: 0.4839
 epoch: 17, train_loss: 0.8547, test_loss: 1.0864, test_f1: 0.4903
 epoch: 18, train_loss: 0.8920, test_loss: 1.1181, test_f1: 0.5129
 epoch: 19, train_loss: 0.8646, test_loss: 1.0322, test_f1: 0.5663
 epoch: 20, train_loss: 0.8787, test_loss: 1.0632, test_f1: 0.5401
 epoch: 21, train_loss: 0.8248, test_loss: 1.1009, test_f1: 0.5236
 epoch: 22, train_loss: 0.8119, test_loss: 1.1574, test_f1: 0.4992
 epoch: 23, train_loss: 0.8311, test_loss: 1.3416, test_f1: 0.5051
 epoch: 24, train_loss: 0.8629, test_loss: 1.2578, test_f1: 0.5122
 epoch: 25, train_loss: 0.8733, test_loss: 1.2602, test_f1: 0.5023
 epoch: 26, train_loss: 0.8488, test_loss: 1.4364, test_f1: 0.4594
 epoch: 27, train_loss: 0.8612, test_loss: 1.1907, test_f1: 0.4619
 epoch: 28, train_loss: 0.8350, test_loss: 1.1316, test_f1: 0.5169
 epoch: 29, train_loss: 0.8342, test_loss: 1.2058, test_f1: 0.5165
 epoch: 30, train_loss: 0.8270, test_loss: 1.1197, test_f1: 0.5539
 epoch: 31, train_loss: 0.7874, test_loss: 1.0866, test_f1: 0.5669
 epoch: 32, train_loss: 0.7992, test_loss: 1.0535, test_f1: 0.5499
 epoch: 33, train_loss: 0.7863, test_loss: 1.1525, test_f1: 0.4870
 epoch: 34, train_loss: 0.7492, test_loss: 1.2329, test_f1: 0.5087
 epoch: 35, train_loss: 0.7554, test_loss: 1.2924, test_f1: 0.5722
 epoch: 36, train_loss: 0.7674, test_loss: 1.2374, test_f1: 0.5370
 epoch: 37, train_loss: 0.7833, test_loss: 1.2103, test_f1: 0.5468
 epoch: 38, train_loss: 0.7804, test_loss: 1.3209, test_f1: 0.4527
 epoch: 39, train_loss: 0.7558, test_loss: 1.1725, test_f1: 0.5599
 epoch: 40, train_loss: 0.7575, test_loss: 1.1574, test_f1: 0.5855
 epoch: 41, train_loss: 0.7651, test_loss: 1.5178, test_f1: 0.4636
 epoch: 42, train_loss: 0.7598, test_loss: 1.3727, test_f1: 0.5456
 epoch: 43, train_loss: 0.7333, test_loss: 1.4465, test_f1: 0.5463
 epoch: 44, train_loss: 0.7015, test_loss: 1.5906, test_f1: 0.5228
 epoch: 45, train_loss: 0.6908, test_loss: 1.5880, test_f1: 0.5001
 epoch: 46, train_loss: 0.7578, test_loss: 1.6094, test_f1: 0.4544
 epoch: 47, train_loss: 0.7537, test_loss: 1.2414, test_f1: 0.5006
 epoch: 48, train_loss: 0.7624, test_loss: 1.3907, test_f1: 0.4354
 epoch: 49, train_loss: 0.7664, test_loss: 1.3042, test_f1: 0.4524
 epoch: 50, train_loss: 0.7344, test_loss: 1.3437, test_f1: 0.4704
 epoch: 51, train_loss: 0.7039, test_loss: 1.3140, test_f1: 0.5575
 epoch: 52, train_loss: 0.7136, test_loss: 1.3442, test_f1: 0.5776
 epoch: 53, train_loss: 0.6968, test_loss: 1.3369, test_f1: 0.6358
 epoch: 54, train_loss: 0.6909, test_loss: 1.1912, test_f1: 0.5636
 epoch: 55, train_loss: 0.6621, test_loss: 1.2424, test_f1: 0.5312
 epoch: 56, train_loss: 0.6690, test_loss: 1.2916, test_f1: 0.5247
 epoch: 57, train_loss: 0.6419, test_loss: 1.2440, test_f1: 0.5713
 epoch: 58, train_loss: 0.6366, test_loss: 1.2472, test_f1: 0.6000
 epoch: 59, train_loss: 0.6093, test_loss: 1.3359, test_f1: 0.5565
 epoch: 60, train_loss: 0.6247, test_loss: 1.4171, test_f1: 0.5567
 epoch: 61, train_loss: 0.6250, test_loss: 1.5183, test_f1: 0.5967
 epoch: 62, train_loss: 0.6122, test_loss: 1.4395, test_f1: 0.6054
 epoch: 63, train_loss: 0.6096, test_loss: 1.4196, test_f1: 0.5891
 epoch: 64, train_loss: 0.5973, test_loss: 1.4471, test_f1: 0.5953
 epoch: 65, train_loss: 0.5971, test_loss: 1.4055, test_f1: 0.5895
 epoch: 66, train_loss: 0.5972, test_loss: 1.5239, test_f1: 0.5568
 epoch: 67, train_loss: 0.5782, test_loss: 1.5619, test_f1: 0.5717
 epoch: 68, train_loss: 0.5780, test_loss: 1.5699, test_f1: 0.5859
 epoch: 69, train_loss: 0.5733, test_loss: 1.5174, test_f1: 0.5826
 epoch: 70, train_loss: 0.6087, test_loss: 1.4081, test_f1: 0.5798
 epoch: 71, train_loss: 0.5966, test_loss: 1.3282, test_f1: 0.5801
 epoch: 72, train_loss: 0.5694, test_loss: 1.2791, test_f1: 0.5786
 epoch: 73, train_loss: 0.5981, test_loss: 1.3511, test_f1: 0.5955
 epoch: 74, train_loss: 0.6242, test_loss: 1.3742, test_f1: 0.5446
 epoch: 75, train_loss: 0.6383, test_loss: 1.3326, test_f1: 0.5432
 epoch: 76, train_loss: 0.6101, test_loss: 1.3046, test_f1: 0.5806
 epoch: 77, train_loss: 0.5923, test_loss: 1.2716, test_f1: 0.5675
 epoch: 78, train_loss: 0.5783, test_loss: 1.3259, test_f1: 0.5529
 epoch: 79, train_loss: 0.5665, test_loss: 1.4943, test_f1: 0.5516
 epoch: 80, train_loss: 0.5689, test_loss: 1.3745, test_f1: 0.5796
 epoch: 81, train_loss: 0.5478, test_loss: 1.3090, test_f1: 0.5966
 epoch: 82, train_loss: 0.5558, test_loss: 1.5035, test_f1: 0.5582
 epoch: 83, train_loss: 0.5635, test_loss: 1.4266, test_f1: 0.5844
 epoch: 84, train_loss: 0.5762, test_loss: 1.5278, test_f1: 0.5654
 epoch: 85, train_loss: 0.5426, test_loss: 1.5347, test_f1: 0.5707
 epoch: 86, train_loss: 0.5588, test_loss: 1.4770, test_f1: 0.6038
 epoch: 87, train_loss: 0.5487, test_loss: 1.5430, test_f1: 0.5748
 epoch: 88, train_loss: 0.5532, test_loss: 1.4481, test_f1: 0.6015
 epoch: 89, train_loss: 0.5365, test_loss: 1.3525, test_f1: 0.5815
 epoch: 90, train_loss: 0.5416, test_loss: 1.4277, test_f1: 0.5710
 epoch: 91, train_loss: 0.5602, test_loss: 1.4269, test_f1: 0.5681
 epoch: 92, train_loss: 0.5306, test_loss: 1.4109, test_f1: 0.5587
 epoch: 93, train_loss: 0.5493, test_loss: 1.5896, test_f1: 0.5564
 epoch: 94, train_loss: 0.5556, test_loss: 1.6303, test_f1: 0.5329
 epoch: 95, train_loss: 0.5250, test_loss: 1.6044, test_f1: 0.5821
 epoch: 96, train_loss: 0.5081, test_loss: 1.5177, test_f1: 0.5566
 epoch: 97, train_loss: 0.6056, test_loss: 1.8451, test_f1: 0.4066
 epoch: 98, train_loss: 0.6095, test_loss: 1.6683, test_f1: 0.5377
 epoch: 99, train_loss: 0.6274, test_loss: 1.6294, test_f1: 0.6230
##################ITERATION #6 ****************************************
 epoch: 0, train_loss: 1.4607, test_loss: 1.7063, test_f1: 0.1893
 epoch: 1, train_loss: 1.2036, test_loss: 1.4080, test_f1: 0.2729
 epoch: 2, train_loss: 1.1664, test_loss: 1.2887, test_f1: 0.2775
 epoch: 3, train_loss: 1.1176, test_loss: 1.2777, test_f1: 0.3093
 epoch: 4, train_loss: 1.0725, test_loss: 1.1881, test_f1: 0.4057
 epoch: 5, train_loss: 1.0385, test_loss: 1.1707, test_f1: 0.3905
 epoch: 6, train_loss: 1.0091, test_loss: 1.1200, test_f1: 0.4542
 epoch: 7, train_loss: 0.9932, test_loss: 1.2035, test_f1: 0.4577
 epoch: 8, train_loss: 0.9685, test_loss: 1.3123, test_f1: 0.4408
 epoch: 9, train_loss: 0.9578, test_loss: 1.1877, test_f1: 0.5168
 epoch: 10, train_loss: 0.9518, test_loss: 1.5571, test_f1: 0.3541
 epoch: 11, train_loss: 0.9454, test_loss: 1.3687, test_f1: 0.4052
 epoch: 12, train_loss: 0.9210, test_loss: 1.3483, test_f1: 0.4364
 epoch: 13, train_loss: 0.9231, test_loss: 1.2096, test_f1: 0.4543
 epoch: 14, train_loss: 0.8842, test_loss: 1.1885, test_f1: 0.4146
 epoch: 15, train_loss: 0.8729, test_loss: 1.1492, test_f1: 0.4407
 epoch: 16, train_loss: 0.8919, test_loss: 1.2359, test_f1: 0.5229
 epoch: 17, train_loss: 0.8747, test_loss: 1.1209, test_f1: 0.5340
 epoch: 18, train_loss: 0.8892, test_loss: 1.2204, test_f1: 0.5142
 epoch: 19, train_loss: 0.8525, test_loss: 1.1567, test_f1: 0.4505
 epoch: 20, train_loss: 0.8558, test_loss: 1.1427, test_f1: 0.5320
 epoch: 21, train_loss: 0.8533, test_loss: 1.1792, test_f1: 0.5164
 epoch: 22, train_loss: 0.8287, test_loss: 1.1765, test_f1: 0.4700
 epoch: 23, train_loss: 0.8330, test_loss: 1.0738, test_f1: 0.5022
 epoch: 24, train_loss: 0.8222, test_loss: 1.1393, test_f1: 0.5331
 epoch: 25, train_loss: 0.8252, test_loss: 1.2853, test_f1: 0.4947
 epoch: 26, train_loss: 0.8885, test_loss: 1.4148, test_f1: 0.4781
 epoch: 27, train_loss: 0.8441, test_loss: 1.1077, test_f1: 0.5360
 epoch: 28, train_loss: 0.8011, test_loss: 1.1887, test_f1: 0.5067
 epoch: 29, train_loss: 0.8106, test_loss: 0.9839, test_f1: 0.6267
 epoch: 30, train_loss: 0.8099, test_loss: 1.1552, test_f1: 0.5422
 epoch: 31, train_loss: 0.8013, test_loss: 1.1991, test_f1: 0.5162
 epoch: 32, train_loss: 0.7720, test_loss: 1.1482, test_f1: 0.5961
 epoch: 33, train_loss: 0.7485, test_loss: 1.1627, test_f1: 0.5725
 epoch: 34, train_loss: 0.7774, test_loss: 1.1188, test_f1: 0.5646
 epoch: 35, train_loss: 0.7853, test_loss: 1.0491, test_f1: 0.5865
 epoch: 36, train_loss: 0.7666, test_loss: 1.0323, test_f1: 0.5284
 epoch: 37, train_loss: 0.7777, test_loss: 1.0306, test_f1: 0.5734
 epoch: 38, train_loss: 0.7707, test_loss: 1.3249, test_f1: 0.4257
 epoch: 39, train_loss: 0.7625, test_loss: 1.3544, test_f1: 0.4463
 epoch: 40, train_loss: 0.7542, test_loss: 1.1102, test_f1: 0.5636
 epoch: 41, train_loss: 0.7548, test_loss: 1.0454, test_f1: 0.5638
 epoch: 42, train_loss: 0.7191, test_loss: 1.1264, test_f1: 0.5474
 epoch: 43, train_loss: 0.7570, test_loss: 1.3094, test_f1: 0.5071
 epoch: 44, train_loss: 0.7634, test_loss: 1.1348, test_f1: 0.5484
 epoch: 45, train_loss: 0.7607, test_loss: 1.0544, test_f1: 0.5697
 epoch: 46, train_loss: 0.7560, test_loss: 1.0252, test_f1: 0.5785
 epoch: 47, train_loss: 0.7719, test_loss: 1.0671, test_f1: 0.5662
 epoch: 48, train_loss: 0.7429, test_loss: 1.2966, test_f1: 0.4937
 epoch: 49, train_loss: 0.7532, test_loss: 1.1941, test_f1: 0.5272
 epoch: 50, train_loss: 0.7539, test_loss: 1.3622, test_f1: 0.4754
 epoch: 51, train_loss: 0.7436, test_loss: 1.1251, test_f1: 0.5535
 epoch: 52, train_loss: 0.7013, test_loss: 1.0617, test_f1: 0.5604
 epoch: 53, train_loss: 0.6893, test_loss: 1.2163, test_f1: 0.5549
 epoch: 54, train_loss: 0.6959, test_loss: 1.1535, test_f1: 0.5398
 epoch: 55, train_loss: 0.6712, test_loss: 1.0191, test_f1: 0.6013
 epoch: 56, train_loss: 0.6571, test_loss: 1.0522, test_f1: 0.5957
 epoch: 57, train_loss: 0.6567, test_loss: 1.1462, test_f1: 0.5712
 epoch: 58, train_loss: 0.6752, test_loss: 1.1461, test_f1: 0.5585
 epoch: 59, train_loss: 0.6594, test_loss: 1.0496, test_f1: 0.6142
 epoch: 60, train_loss: 0.6450, test_loss: 1.1775, test_f1: 0.5889
 epoch: 61, train_loss: 0.6523, test_loss: 1.1534, test_f1: 0.6181
 epoch: 62, train_loss: 0.6387, test_loss: 1.0670, test_f1: 0.6025
 epoch: 63, train_loss: 0.6524, test_loss: 1.1099, test_f1: 0.5648
 epoch: 64, train_loss: 0.6360, test_loss: 1.0931, test_f1: 0.5893
 epoch: 65, train_loss: 0.6414, test_loss: 1.1859, test_f1: 0.5667
 epoch: 66, train_loss: 0.6474, test_loss: 1.2394, test_f1: 0.5260
 epoch: 67, train_loss: 0.6745, test_loss: 1.1676, test_f1: 0.5764
 epoch: 68, train_loss: 0.7151, test_loss: 2.6542, test_f1: 0.4172
 epoch: 69, train_loss: 0.7373, test_loss: 1.3355, test_f1: 0.5229
 epoch: 70, train_loss: 0.7240, test_loss: 1.0544, test_f1: 0.5760
 epoch: 71, train_loss: 0.6683, test_loss: 1.0406, test_f1: 0.5895
 epoch: 72, train_loss: 0.6503, test_loss: 1.0667, test_f1: 0.6194
 epoch: 73, train_loss: 0.6461, test_loss: 1.0561, test_f1: 0.6022
 epoch: 74, train_loss: 0.6567, test_loss: 1.0991, test_f1: 0.5899
 epoch: 75, train_loss: 0.6397, test_loss: 1.1508, test_f1: 0.5837
 epoch: 76, train_loss: 0.6306, test_loss: 1.0997, test_f1: 0.6044
 epoch: 77, train_loss: 0.6225, test_loss: 1.1567, test_f1: 0.5852
 epoch: 78, train_loss: 0.6179, test_loss: 1.1847, test_f1: 0.6039
 epoch: 79, train_loss: 0.6038, test_loss: 1.0990, test_f1: 0.6124
 epoch: 80, train_loss: 0.5937, test_loss: 1.0940, test_f1: 0.5919
 epoch: 81, train_loss: 0.6169, test_loss: 1.1616, test_f1: 0.6020
 epoch: 82, train_loss: 0.5953, test_loss: 1.1457, test_f1: 0.6214
 epoch: 83, train_loss: 0.5798, test_loss: 1.2093, test_f1: 0.5869
 epoch: 84, train_loss: 0.5917, test_loss: 1.1991, test_f1: 0.5737
 epoch: 85, train_loss: 0.5988, test_loss: 1.2401, test_f1: 0.6104
 epoch: 86, train_loss: 0.5880, test_loss: 1.4538, test_f1: 0.5842
 epoch: 87, train_loss: 0.6119, test_loss: 1.5539, test_f1: 0.5842
 epoch: 88, train_loss: 0.5805, test_loss: 1.4600, test_f1: 0.5816
 epoch: 89, train_loss: 0.5838, test_loss: 1.4345, test_f1: 0.5881
 epoch: 90, train_loss: 0.5698, test_loss: 1.3713, test_f1: 0.6042
 epoch: 91, train_loss: 0.5638, test_loss: 1.3208, test_f1: 0.6151
 epoch: 92, train_loss: 0.5614, test_loss: 1.3287, test_f1: 0.6174
 epoch: 93, train_loss: 0.5486, test_loss: 1.4831, test_f1: 0.5830
 epoch: 94, train_loss: 0.5789, test_loss: 1.3760, test_f1: 0.5619
 epoch: 95, train_loss: 0.5595, test_loss: 1.2311, test_f1: 0.5712
 epoch: 96, train_loss: 0.5829, test_loss: 1.1619, test_f1: 0.5959
 epoch: 97, train_loss: 0.6080, test_loss: 1.3004, test_f1: 0.6158
 epoch: 98, train_loss: 0.5966, test_loss: 1.7120, test_f1: 0.4854
 epoch: 99, train_loss: 0.5963, test_loss: 1.4205, test_f1: 0.5548
##################ITERATION #7 ****************************************
 epoch: 0, train_loss: 1.3666, test_loss: 1.4506, test_f1: 0.1879
 epoch: 1, train_loss: 1.1812, test_loss: 1.3368, test_f1: 0.3006
 epoch: 2, train_loss: 1.1269, test_loss: 1.3571, test_f1: 0.2794
 epoch: 3, train_loss: 1.0976, test_loss: 1.3064, test_f1: 0.2715
 epoch: 4, train_loss: 1.0513, test_loss: 1.7208, test_f1: 0.2986
 epoch: 5, train_loss: 1.0300, test_loss: 1.5171, test_f1: 0.2848
 epoch: 6, train_loss: 1.0124, test_loss: 1.3336, test_f1: 0.3924
 epoch: 7, train_loss: 0.9771, test_loss: 1.5156, test_f1: 0.4174
 epoch: 8, train_loss: 0.9888, test_loss: 1.4390, test_f1: 0.3952
 epoch: 9, train_loss: 1.0456, test_loss: 1.2689, test_f1: 0.4565
 epoch: 10, train_loss: 1.0141, test_loss: 1.2394, test_f1: 0.4155
 epoch: 11, train_loss: 0.9693, test_loss: 1.1962, test_f1: 0.4363
 epoch: 12, train_loss: 0.9516, test_loss: 1.1709, test_f1: 0.4144
 epoch: 13, train_loss: 0.9311, test_loss: 1.1951, test_f1: 0.4853
 epoch: 14, train_loss: 0.9199, test_loss: 1.2160, test_f1: 0.4565
 epoch: 15, train_loss: 0.9388, test_loss: 1.1640, test_f1: 0.4469
 epoch: 16, train_loss: 0.9314, test_loss: 1.4086, test_f1: 0.4336
 epoch: 17, train_loss: 0.9163, test_loss: 1.1037, test_f1: 0.5052
 epoch: 18, train_loss: 0.9082, test_loss: 1.1521, test_f1: 0.5334
 epoch: 19, train_loss: 0.8845, test_loss: 1.0643, test_f1: 0.4892
 epoch: 20, train_loss: 0.8692, test_loss: 1.1671, test_f1: 0.5099
 epoch: 21, train_loss: 0.8751, test_loss: 1.9500, test_f1: 0.3974
 epoch: 22, train_loss: 0.8983, test_loss: 1.2539, test_f1: 0.4763
 epoch: 23, train_loss: 0.8903, test_loss: 1.1362, test_f1: 0.5205
 epoch: 24, train_loss: 0.8531, test_loss: 1.0650, test_f1: 0.5164
 epoch: 25, train_loss: 0.8556, test_loss: 1.0595, test_f1: 0.5458
 epoch: 26, train_loss: 0.8406, test_loss: 1.0567, test_f1: 0.5073
 epoch: 27, train_loss: 0.8552, test_loss: 1.1289, test_f1: 0.4722
 epoch: 28, train_loss: 0.8396, test_loss: 1.1432, test_f1: 0.5312
 epoch: 29, train_loss: 0.8320, test_loss: 1.3585, test_f1: 0.4802
 epoch: 30, train_loss: 0.8168, test_loss: 1.2888, test_f1: 0.5619
 epoch: 31, train_loss: 0.8271, test_loss: 2.1397, test_f1: 0.4328
 epoch: 32, train_loss: 0.8668, test_loss: 1.4868, test_f1: 0.5771
 epoch: 33, train_loss: 0.9131, test_loss: 1.3839, test_f1: 0.3214
 epoch: 34, train_loss: 0.9138, test_loss: 1.1428, test_f1: 0.4580
 epoch: 35, train_loss: 0.9166, test_loss: 1.0996, test_f1: 0.5430
 epoch: 36, train_loss: 0.8570, test_loss: 1.2413, test_f1: 0.4923
 epoch: 37, train_loss: 0.8427, test_loss: 1.0674, test_f1: 0.6036
 epoch: 38, train_loss: 0.8031, test_loss: 1.2479, test_f1: 0.5367
 epoch: 39, train_loss: 0.8209, test_loss: 1.2855, test_f1: 0.5403
 epoch: 40, train_loss: 0.8004, test_loss: 1.3436, test_f1: 0.5585
 epoch: 41, train_loss: 0.7913, test_loss: 1.2862, test_f1: 0.5813
 epoch: 42, train_loss: 0.7890, test_loss: 1.1092, test_f1: 0.5616
 epoch: 43, train_loss: 0.7759, test_loss: 1.1910, test_f1: 0.4834
 epoch: 44, train_loss: 0.7742, test_loss: 1.0966, test_f1: 0.5017
 epoch: 45, train_loss: 0.7882, test_loss: 1.4850, test_f1: 0.4643
 epoch: 46, train_loss: 0.7940, test_loss: 1.1441, test_f1: 0.5348
 epoch: 47, train_loss: 0.7744, test_loss: 1.3511, test_f1: 0.5120
 epoch: 48, train_loss: 0.7799, test_loss: 1.2266, test_f1: 0.5289
 epoch: 49, train_loss: 0.7811, test_loss: 1.8677, test_f1: 0.5310
 epoch: 50, train_loss: 0.7794, test_loss: 1.3875, test_f1: 0.5241
 epoch: 51, train_loss: 0.7675, test_loss: 1.4013, test_f1: 0.5711
 epoch: 52, train_loss: 0.7554, test_loss: 1.2599, test_f1: 0.5825
 epoch: 53, train_loss: 0.7366, test_loss: 1.6011, test_f1: 0.5648
 epoch: 54, train_loss: 0.7228, test_loss: 1.5139, test_f1: 0.4877
 epoch: 55, train_loss: 0.7265, test_loss: 1.7098, test_f1: 0.5079
 epoch: 56, train_loss: 0.7362, test_loss: 1.7212, test_f1: 0.4882
 epoch: 57, train_loss: 0.7219, test_loss: 1.0694, test_f1: 0.5826
 epoch: 58, train_loss: 0.7299, test_loss: 1.1687, test_f1: 0.5809
 epoch: 59, train_loss: 0.7230, test_loss: 1.1440, test_f1: 0.5651
 epoch: 60, train_loss: 0.6994, test_loss: 1.1958, test_f1: 0.5690
 epoch: 61, train_loss: 0.7102, test_loss: 1.1528, test_f1: 0.5373
 epoch: 62, train_loss: 0.6949, test_loss: 1.0867, test_f1: 0.5209
 epoch: 63, train_loss: 0.7226, test_loss: 1.1904, test_f1: 0.5026
 epoch: 64, train_loss: 0.7212, test_loss: 1.1269, test_f1: 0.5559
 epoch: 65, train_loss: 0.6979, test_loss: 1.1051, test_f1: 0.5871
 epoch: 66, train_loss: 0.7568, test_loss: 1.0718, test_f1: 0.5679
 epoch: 67, train_loss: 0.7129, test_loss: 1.1863, test_f1: 0.5919
 epoch: 68, train_loss: 0.6926, test_loss: 1.4799, test_f1: 0.5618
 epoch: 69, train_loss: 0.7042, test_loss: 1.3528, test_f1: 0.5256
 epoch: 70, train_loss: 0.6929, test_loss: 1.3648, test_f1: 0.5206
 epoch: 71, train_loss: 0.7020, test_loss: 1.2126, test_f1: 0.5448
 epoch: 72, train_loss: 0.7049, test_loss: 1.2681, test_f1: 0.5074
 epoch: 73, train_loss: 0.6805, test_loss: 1.1105, test_f1: 0.5978
 epoch: 74, train_loss: 0.6691, test_loss: 1.1507, test_f1: 0.5447
 epoch: 75, train_loss: 0.6877, test_loss: 1.2356, test_f1: 0.5064
 epoch: 76, train_loss: 0.6653, test_loss: 1.5795, test_f1: 0.5365
 epoch: 77, train_loss: 0.7242, test_loss: 1.1781, test_f1: 0.5670
 epoch: 78, train_loss: 0.6948, test_loss: 1.0898, test_f1: 0.6089
 epoch: 79, train_loss: 0.6581, test_loss: 1.2551, test_f1: 0.5587
 epoch: 80, train_loss: 0.6714, test_loss: 1.2238, test_f1: 0.5715
 epoch: 81, train_loss: 0.6535, test_loss: 1.2346, test_f1: 0.4947
 epoch: 82, train_loss: 0.6464, test_loss: 1.1870, test_f1: 0.5393
 epoch: 83, train_loss: 0.6363, test_loss: 1.1689, test_f1: 0.5790
 epoch: 84, train_loss: 0.6403, test_loss: 1.2356, test_f1: 0.6033
 epoch: 85, train_loss: 0.6550, test_loss: 1.0957, test_f1: 0.5901
 epoch: 86, train_loss: 0.7294, test_loss: 1.2574, test_f1: 0.5654
 epoch: 87, train_loss: 0.7142, test_loss: 1.3698, test_f1: 0.5641
 epoch: 88, train_loss: 0.7024, test_loss: 1.1191, test_f1: 0.5284
 epoch: 89, train_loss: 0.6685, test_loss: 1.0418, test_f1: 0.5621
 epoch: 90, train_loss: 0.6658, test_loss: 1.2074, test_f1: 0.5300
 epoch: 91, train_loss: 0.6518, test_loss: 1.4916, test_f1: 0.5415
 epoch: 92, train_loss: 0.6472, test_loss: 1.0141, test_f1: 0.5891
 epoch: 93, train_loss: 0.6623, test_loss: 1.0502, test_f1: 0.6109
 epoch: 94, train_loss: 0.6576, test_loss: 1.1643, test_f1: 0.5950
 epoch: 95, train_loss: 0.6428, test_loss: 1.8359, test_f1: 0.5927
 epoch: 96, train_loss: 0.6667, test_loss: 1.2699, test_f1: 0.5294
 epoch: 97, train_loss: 0.6394, test_loss: 1.1290, test_f1: 0.5244
 epoch: 98, train_loss: 0.6341, test_loss: 1.6664, test_f1: 0.4729
 epoch: 99, train_loss: 0.6115, test_loss: 1.3116, test_f1: 0.5309
##################ITERATION #8 ****************************************
 epoch: 0, train_loss: 1.3126, test_loss: 1.3956, test_f1: 0.2755
 epoch: 1, train_loss: 1.1868, test_loss: 1.3427, test_f1: 0.3006
 epoch: 2, train_loss: 1.1106, test_loss: 1.3293, test_f1: 0.3581
 epoch: 3, train_loss: 1.0792, test_loss: 1.2326, test_f1: 0.4612
 epoch: 4, train_loss: 1.0278, test_loss: 1.2594, test_f1: 0.4303
 epoch: 5, train_loss: 0.9937, test_loss: 1.3088, test_f1: 0.4086
 epoch: 6, train_loss: 0.9901, test_loss: 1.0920, test_f1: 0.4442
 epoch: 7, train_loss: 0.9536, test_loss: 1.1107, test_f1: 0.5020
 epoch: 8, train_loss: 0.9612, test_loss: 1.1698, test_f1: 0.4798
 epoch: 9, train_loss: 0.9314, test_loss: 1.3644, test_f1: 0.3921
 epoch: 10, train_loss: 0.9107, test_loss: 1.3546, test_f1: 0.4193
 epoch: 11, train_loss: 0.9031, test_loss: 1.1961, test_f1: 0.5249
 epoch: 12, train_loss: 0.9044, test_loss: 1.2140, test_f1: 0.4713
 epoch: 13, train_loss: 0.9041, test_loss: 1.1525, test_f1: 0.5193
 epoch: 14, train_loss: 0.8908, test_loss: 1.1781, test_f1: 0.5137
 epoch: 15, train_loss: 0.8691, test_loss: 1.0635, test_f1: 0.5036
 epoch: 16, train_loss: 0.8780, test_loss: 1.0930, test_f1: 0.5338
 epoch: 17, train_loss: 0.8463, test_loss: 1.1183, test_f1: 0.5594
 epoch: 18, train_loss: 0.8287, test_loss: 1.1200, test_f1: 0.5729
 epoch: 19, train_loss: 0.8386, test_loss: 1.7659, test_f1: 0.4664
 epoch: 20, train_loss: 0.8309, test_loss: 1.4022, test_f1: 0.5538
 epoch: 21, train_loss: 0.8182, test_loss: 1.1733, test_f1: 0.5889
 epoch: 22, train_loss: 0.7877, test_loss: 1.1191, test_f1: 0.5578
 epoch: 23, train_loss: 0.7681, test_loss: 1.2312, test_f1: 0.5891
 epoch: 24, train_loss: 0.7964, test_loss: 1.2558, test_f1: 0.6062
 epoch: 25, train_loss: 0.7781, test_loss: 1.3307, test_f1: 0.5586
 epoch: 26, train_loss: 0.7803, test_loss: 1.1993, test_f1: 0.5248
 epoch: 27, train_loss: 0.7687, test_loss: 1.1918, test_f1: 0.5506
 epoch: 28, train_loss: 0.7722, test_loss: 1.1933, test_f1: 0.5269
 epoch: 29, train_loss: 0.7346, test_loss: 1.0964, test_f1: 0.6102
 epoch: 30, train_loss: 0.7413, test_loss: 1.3946, test_f1: 0.4938
 epoch: 31, train_loss: 0.7393, test_loss: 1.3152, test_f1: 0.5503
 epoch: 32, train_loss: 0.7452, test_loss: 1.2021, test_f1: 0.5406
 epoch: 33, train_loss: 0.7323, test_loss: 1.1823, test_f1: 0.5679
 epoch: 34, train_loss: 0.7254, test_loss: 1.2422, test_f1: 0.5556
 epoch: 35, train_loss: 0.7166, test_loss: 1.2645, test_f1: 0.5854
 epoch: 36, train_loss: 0.7219, test_loss: 1.4237, test_f1: 0.5631
 epoch: 37, train_loss: 0.7360, test_loss: 1.6140, test_f1: 0.4660
 epoch: 38, train_loss: 0.7332, test_loss: 1.3254, test_f1: 0.5938
 epoch: 39, train_loss: 0.7203, test_loss: 1.1310, test_f1: 0.6001
 epoch: 40, train_loss: 0.7078, test_loss: 1.3589, test_f1: 0.4841
 epoch: 41, train_loss: 0.7132, test_loss: 1.2227, test_f1: 0.5132
 epoch: 42, train_loss: 0.7039, test_loss: 1.4552, test_f1: 0.5455
 epoch: 43, train_loss: 0.7751, test_loss: 1.3019, test_f1: 0.5920
 epoch: 44, train_loss: 0.7762, test_loss: 1.2854, test_f1: 0.5838
 epoch: 45, train_loss: 0.7636, test_loss: 1.4692, test_f1: 0.5471
 epoch: 46, train_loss: 0.7432, test_loss: 1.3608, test_f1: 0.5646
 epoch: 47, train_loss: 0.7296, test_loss: 1.2292, test_f1: 0.5608
 epoch: 48, train_loss: 0.7241, test_loss: 1.2780, test_f1: 0.5749
 epoch: 49, train_loss: 0.6823, test_loss: 1.3331, test_f1: 0.5980
 epoch: 50, train_loss: 0.7175, test_loss: 1.3967, test_f1: 0.5826
 epoch: 51, train_loss: 0.7123, test_loss: 1.3187, test_f1: 0.5917
 epoch: 52, train_loss: 0.6850, test_loss: 1.4831, test_f1: 0.5161
 epoch: 53, train_loss: 0.6720, test_loss: 1.3365, test_f1: 0.5552
 epoch: 54, train_loss: 0.6781, test_loss: 1.3859, test_f1: 0.5870
 epoch: 55, train_loss: 0.6628, test_loss: 1.5740, test_f1: 0.5643
 epoch: 56, train_loss: 0.6385, test_loss: 1.6637, test_f1: 0.5420
 epoch: 57, train_loss: 0.6472, test_loss: 1.6577, test_f1: 0.5796
 epoch: 58, train_loss: 0.6206, test_loss: 1.7709, test_f1: 0.5848
 epoch: 59, train_loss: 0.6259, test_loss: 1.7526, test_f1: 0.5516
 epoch: 60, train_loss: 0.6171, test_loss: 1.6948, test_f1: 0.5515
 epoch: 61, train_loss: 0.6297, test_loss: 1.7515, test_f1: 0.5292
 epoch: 62, train_loss: 0.6322, test_loss: 1.5298, test_f1: 0.5786
 epoch: 63, train_loss: 0.6154, test_loss: 1.5006, test_f1: 0.5220
 epoch: 64, train_loss: 0.6166, test_loss: 1.4350, test_f1: 0.5746
 epoch: 65, train_loss: 0.6258, test_loss: 1.5241, test_f1: 0.5854
 epoch: 66, train_loss: 0.6181, test_loss: 1.4847, test_f1: 0.5906
 epoch: 67, train_loss: 0.5871, test_loss: 1.5890, test_f1: 0.5325
 epoch: 68, train_loss: 0.6105, test_loss: 1.5171, test_f1: 0.5744
 epoch: 69, train_loss: 0.6169, test_loss: 1.5445, test_f1: 0.6136
 epoch: 70, train_loss: 0.5970, test_loss: 1.5278, test_f1: 0.5665
 epoch: 71, train_loss: 0.5895, test_loss: 1.3887, test_f1: 0.6179
 epoch: 72, train_loss: 0.5744, test_loss: 1.3589, test_f1: 0.6139
 epoch: 73, train_loss: 0.5757, test_loss: 1.5568, test_f1: 0.5194
 epoch: 74, train_loss: 0.5632, test_loss: 1.6270, test_f1: 0.5555
 epoch: 75, train_loss: 0.5724, test_loss: 1.5361, test_f1: 0.5972
 epoch: 76, train_loss: 0.5544, test_loss: 1.5241, test_f1: 0.5689
 epoch: 77, train_loss: 0.5744, test_loss: 1.5538, test_f1: 0.5502
 epoch: 78, train_loss: 0.5516, test_loss: 1.5309, test_f1: 0.5534
 epoch: 79, train_loss: 0.5602, test_loss: 1.7755, test_f1: 0.5477
 epoch: 80, train_loss: 0.5598, test_loss: 1.5346, test_f1: 0.5108
 epoch: 81, train_loss: 0.5549, test_loss: 1.5779, test_f1: 0.4981
 epoch: 82, train_loss: 0.5490, test_loss: 1.5968, test_f1: 0.5296
 epoch: 83, train_loss: 0.5877, test_loss: 1.4648, test_f1: 0.5684
 epoch: 84, train_loss: 0.5480, test_loss: 1.6895, test_f1: 0.5358
 epoch: 85, train_loss: 0.5024, test_loss: 1.6578, test_f1: 0.5249
 epoch: 86, train_loss: 0.5280, test_loss: 1.9385, test_f1: 0.4885
 epoch: 87, train_loss: 0.5775, test_loss: 2.0284, test_f1: 0.5288
 epoch: 88, train_loss: 0.5533, test_loss: 1.7780, test_f1: 0.5222
 epoch: 89, train_loss: 0.5643, test_loss: 1.7739, test_f1: 0.5750
 epoch: 90, train_loss: 0.5341, test_loss: 1.5385, test_f1: 0.5589
 epoch: 91, train_loss: 0.5411, test_loss: 1.4402, test_f1: 0.5740
 epoch: 92, train_loss: 0.5136, test_loss: 1.6251, test_f1: 0.5205
 epoch: 93, train_loss: 0.5338, test_loss: 1.8023, test_f1: 0.5109
 epoch: 94, train_loss: 0.5664, test_loss: 1.5322, test_f1: 0.5688
 epoch: 95, train_loss: 0.5332, test_loss: 1.3570, test_f1: 0.5513
 epoch: 96, train_loss: 0.5317, test_loss: 1.3362, test_f1: 0.5749
 epoch: 97, train_loss: 0.5286, test_loss: 1.3982, test_f1: 0.5494
 epoch: 98, train_loss: 0.7094, test_loss: 6.7585, test_f1: 0.4557
 epoch: 99, train_loss: 0.7637, test_loss: 9.4434, test_f1: 0.4848
##################ITERATION #9 ****************************************
 epoch: 0, train_loss: 1.3125, test_loss: 1.3915, test_f1: 0.3347
 epoch: 1, train_loss: 1.1985, test_loss: 1.3068, test_f1: 0.2700
 epoch: 2, train_loss: 1.1256, test_loss: 1.4101, test_f1: 0.3622
 epoch: 3, train_loss: 1.0994, test_loss: 1.2423, test_f1: 0.4178
 epoch: 4, train_loss: 1.0490, test_loss: 1.2505, test_f1: 0.3864
 epoch: 5, train_loss: 1.0636, test_loss: 1.2577, test_f1: 0.4061
 epoch: 6, train_loss: 1.0464, test_loss: 1.3097, test_f1: 0.4729
 epoch: 7, train_loss: 0.9897, test_loss: 1.3117, test_f1: 0.4675
 epoch: 8, train_loss: 0.9653, test_loss: 1.4704, test_f1: 0.4482
 epoch: 9, train_loss: 0.9605, test_loss: 1.4054, test_f1: 0.4103
 epoch: 10, train_loss: 0.9480, test_loss: 1.1336, test_f1: 0.5428
 epoch: 11, train_loss: 1.0010, test_loss: 1.1451, test_f1: 0.5454
 epoch: 12, train_loss: 0.9553, test_loss: 1.2163, test_f1: 0.4677
 epoch: 13, train_loss: 0.9252, test_loss: 1.1092, test_f1: 0.5307
 epoch: 14, train_loss: 0.9078, test_loss: 1.0615, test_f1: 0.5517
 epoch: 15, train_loss: 0.8820, test_loss: 1.1193, test_f1: 0.5118
 epoch: 16, train_loss: 0.8705, test_loss: 1.2572, test_f1: 0.4562
 epoch: 17, train_loss: 0.8606, test_loss: 1.1049, test_f1: 0.5467
 epoch: 18, train_loss: 0.8459, test_loss: 1.3074, test_f1: 0.5620
 epoch: 19, train_loss: 0.8453, test_loss: 1.2480, test_f1: 0.5477
 epoch: 20, train_loss: 0.8305, test_loss: 1.1967, test_f1: 0.5030
 epoch: 21, train_loss: 0.8149, test_loss: 1.2111, test_f1: 0.5123
 epoch: 22, train_loss: 0.8086, test_loss: 1.2347, test_f1: 0.5138
 epoch: 23, train_loss: 0.8263, test_loss: 1.1305, test_f1: 0.5761
 epoch: 24, train_loss: 0.8264, test_loss: 1.0794, test_f1: 0.5477
 epoch: 25, train_loss: 0.7958, test_loss: 1.2228, test_f1: 0.5189
 epoch: 26, train_loss: 0.7724, test_loss: 1.0664, test_f1: 0.5456
 epoch: 27, train_loss: 0.7546, test_loss: 1.2971, test_f1: 0.4921
 epoch: 28, train_loss: 0.7939, test_loss: 1.3046, test_f1: 0.5045
 epoch: 29, train_loss: 0.7617, test_loss: 1.2179, test_f1: 0.5426
 epoch: 30, train_loss: 0.7924, test_loss: 1.1446, test_f1: 0.5639
 epoch: 31, train_loss: 0.7693, test_loss: 1.0827, test_f1: 0.5988
 epoch: 32, train_loss: 0.7585, test_loss: 1.1147, test_f1: 0.5635
 epoch: 33, train_loss: 0.7302, test_loss: 1.2163, test_f1: 0.5107
 epoch: 34, train_loss: 0.7059, test_loss: 1.0737, test_f1: 0.6085
 epoch: 35, train_loss: 0.7355, test_loss: 0.9850, test_f1: 0.6013
 epoch: 36, train_loss: 0.7491, test_loss: 1.0962, test_f1: 0.5743
 epoch: 37, train_loss: 0.7636, test_loss: 1.2303, test_f1: 0.5243
 epoch: 38, train_loss: 0.7668, test_loss: 1.1418, test_f1: 0.5827
 epoch: 39, train_loss: 0.7734, test_loss: 1.2891, test_f1: 0.5294
 epoch: 40, train_loss: 0.7535, test_loss: 1.2011, test_f1: 0.5396
 epoch: 41, train_loss: 0.7255, test_loss: 1.0732, test_f1: 0.5437
 epoch: 42, train_loss: 0.7213, test_loss: 1.0114, test_f1: 0.5999
 epoch: 43, train_loss: 0.7729, test_loss: 1.0905, test_f1: 0.5649
 epoch: 44, train_loss: 0.7718, test_loss: 1.0427, test_f1: 0.6067
 epoch: 45, train_loss: 0.7210, test_loss: 1.0671, test_f1: 0.6352
 epoch: 46, train_loss: 0.7003, test_loss: 1.2004, test_f1: 0.5955
 epoch: 47, train_loss: 0.6833, test_loss: 1.2061, test_f1: 0.5871
 epoch: 48, train_loss: 0.7031, test_loss: 1.3316, test_f1: 0.5794
 epoch: 49, train_loss: 0.6765, test_loss: 1.3537, test_f1: 0.5922
 epoch: 50, train_loss: 0.6716, test_loss: 1.1995, test_f1: 0.5343
 epoch: 51, train_loss: 0.6661, test_loss: 1.1735, test_f1: 0.5268
 epoch: 52, train_loss: 0.6341, test_loss: 1.1788, test_f1: 0.5726
 epoch: 53, train_loss: 0.6530, test_loss: 1.1593, test_f1: 0.5858
 epoch: 54, train_loss: 0.6400, test_loss: 1.1024, test_f1: 0.6009
 epoch: 55, train_loss: 0.6229, test_loss: 1.1136, test_f1: 0.5834
 epoch: 56, train_loss: 0.6077, test_loss: 1.1354, test_f1: 0.6119
 epoch: 57, train_loss: 0.6014, test_loss: 1.2155, test_f1: 0.5746
 epoch: 58, train_loss: 0.5962, test_loss: 1.2687, test_f1: 0.5735
 epoch: 59, train_loss: 0.5918, test_loss: 1.2938, test_f1: 0.5920
 epoch: 60, train_loss: 0.5936, test_loss: 1.2830, test_f1: 0.5866
 epoch: 61, train_loss: 0.5779, test_loss: 1.2184, test_f1: 0.5933
 epoch: 62, train_loss: 0.6141, test_loss: 1.2680, test_f1: 0.5715
 epoch: 63, train_loss: 0.6087, test_loss: 1.3017, test_f1: 0.5572
 epoch: 64, train_loss: 0.5913, test_loss: 1.1875, test_f1: 0.6357
 epoch: 65, train_loss: 0.5884, test_loss: 1.3277, test_f1: 0.5784
 epoch: 66, train_loss: 0.5655, test_loss: 1.4311, test_f1: 0.5849
 epoch: 67, train_loss: 0.5574, test_loss: 1.4418, test_f1: 0.6193
 epoch: 68, train_loss: 0.5698, test_loss: 1.3617, test_f1: 0.5511
 epoch: 69, train_loss: 0.5587, test_loss: 1.4321, test_f1: 0.5710
 epoch: 70, train_loss: 0.5727, test_loss: 1.2297, test_f1: 0.6281
 epoch: 71, train_loss: 0.5654, test_loss: 1.1924, test_f1: 0.6003
 epoch: 72, train_loss: 0.5573, test_loss: 1.2313, test_f1: 0.6361
 epoch: 73, train_loss: 0.5459, test_loss: 1.2507, test_f1: 0.6121
 epoch: 74, train_loss: 0.5432, test_loss: 1.4278, test_f1: 0.5435
 epoch: 75, train_loss: 0.5633, test_loss: 1.1690, test_f1: 0.6208
 epoch: 76, train_loss: 0.5654, test_loss: 1.2753, test_f1: 0.6099
 epoch: 77, train_loss: 0.5741, test_loss: 1.3975, test_f1: 0.5415
 epoch: 78, train_loss: 0.6220, test_loss: 1.4208, test_f1: 0.4695
 epoch: 79, train_loss: 0.6255, test_loss: 1.3360, test_f1: 0.5903
 epoch: 80, train_loss: 0.6281, test_loss: 1.2656, test_f1: 0.5550
 epoch: 81, train_loss: 0.5850, test_loss: 1.4455, test_f1: 0.5230
 epoch: 82, train_loss: 0.5381, test_loss: 1.3825, test_f1: 0.5457
 epoch: 83, train_loss: 0.5384, test_loss: 1.2816, test_f1: 0.6074
 epoch: 84, train_loss: 0.5416, test_loss: 1.2661, test_f1: 0.5957
 epoch: 85, train_loss: 0.5431, test_loss: 1.3169, test_f1: 0.5969
 epoch: 86, train_loss: 0.5399, test_loss: 1.2769, test_f1: 0.5872
 epoch: 87, train_loss: 0.5329, test_loss: 1.2052, test_f1: 0.6062
 epoch: 88, train_loss: 0.5837, test_loss: 1.4728, test_f1: 0.5448
 epoch: 89, train_loss: 0.6065, test_loss: 1.5036, test_f1: 0.5319
 epoch: 90, train_loss: 0.5748, test_loss: 1.2261, test_f1: 0.6067
 epoch: 91, train_loss: 0.6018, test_loss: 1.1899, test_f1: 0.5956
 epoch: 92, train_loss: 0.5641, test_loss: 1.3175, test_f1: 0.5720
 epoch: 93, train_loss: 0.5281, test_loss: 1.2765, test_f1: 0.5674
 epoch: 94, train_loss: 0.5069, test_loss: 1.2009, test_f1: 0.5938
 epoch: 95, train_loss: 0.5086, test_loss: 1.2232, test_f1: 0.6392
 epoch: 96, train_loss: 0.5118, test_loss: 1.4397, test_f1: 0.5738
 epoch: 97, train_loss: 0.5108, test_loss: 1.1841, test_f1: 0.6161
 epoch: 98, train_loss: 0.5184, test_loss: 1.2576, test_f1: 0.5891
 epoch: 99, train_loss: 0.4956, test_loss: 1.2202, test_f1: 0.6296

Training completed in 286.79 seconds
Best F1: 0.6909 at epoch 86
Mean F1 across iterations: 0.6320  0.0223
========================FINAL RESULTS================================
FEGIN weighted F1: 0.6909  0.0223
python main.py --data ltspice_demos --representation component_component --model FEGIN --layers 3 --hiddens 32 --batch_size 256 --lr 0.01 --emb_size 250 --epochs 100 --save_appendix component_component_L3_H32_BS256_LR0.01_E250 --no_val
-----



STDERR:
  File "main.py", line 370, in <module>
    main()
  File "main.py", line 254, in main
    dataset = dataset_class(
  File "/home/philip/projects/ltspice_examples_code_repo/Circuit-Completion-Using-GNNs/component_classification_with_link_prediction_head/evaluation/FEGIN/kernel/circuit_datasets.py", line 15, in __init__
    self.data, self.slices = torch.load(self.processed_paths[0])
  File "/home/philip/.local/lib/python3.8/site-packages/torch/serialization.py", line 1040, in load
    warnings.warn(
  File "/usr/lib/python3.8/warnings.py", line 109, in _showwarnmsg
    sw(msg.message, msg.category, msg.filename, msg.lineno,
  File "main.py", line 47, in warn_with_traceback
    traceback.print_stack(file=log)
/home/philip/projects/ltspice_examples_code_repo/Circuit-Completion-Using-GNNs/component_classification_with_link_prediction_head/evaluation/FEGIN/kernel/circuit_datasets.py:15: FutureWarning: You are using `torch.load` with `weights_only=False` (the current default value), which uses the default pickle module implicitly. It is possible to construct malicious pickle data which will execute arbitrary code during unpickling (See https://github.com/pytorch/pytorch/blob/main/SECURITY.md#untrusted-models for more details). In a future release, the default value for `weights_only` will be flipped to `True`. This limits the functions that could be executed during unpickling. Arbitrary objects will no longer be allowed to be loaded via this mode unless they are explicitly allowlisted by the user via `torch.serialization.add_safe_globals`. We recommend you start setting `weights_only=True` for any use case where you don't have full control of the loaded file. Please open an issue on GitHub for any issues related to this experimental feature.
  self.data, self.slices = torch.load(self.processed_paths[0])
