STDOUT:
Results will be saved in /home/philip/projects/ltspice_examples_code_repo/Circuit-Completion-Using-GNNs/component_classification_with_link_prediction_head/evaluation/FEGIN/results/model_FEGIN_dataset_ltspice_demos
Command line input: python main.py --data ltspice_demos --representation component_pin --model FEGIN --layers 3 --hiddens 16 --batch_size 64 --lr 0.001 --emb_size 250 --epochs 100 --save_appendix component_pin_L3_H16_BS64_LR0.001_E250 --no_val
 is saved.
-----
ltspice_demos - FEGIN
Using 3 layers, 16 hidden units, h = 2
Loading component_pin representation dataset
ENTERED
Training FEGIN on component_pin representation
Train: 1565, Test: 383
##################ITERATION #0 ****************************************
 epoch: 0, train_loss: 1.3598, test_loss: 1.3479, test_f1: 0.2281
 epoch: 1, train_loss: 1.3307, test_loss: 1.3295, test_f1: 0.2281
 epoch: 2, train_loss: 1.3020, test_loss: 1.3014, test_f1: 0.2285
 epoch: 3, train_loss: 1.2623, test_loss: 1.2686, test_f1: 0.2252
 epoch: 4, train_loss: 1.2164, test_loss: 1.2438, test_f1: 0.2395
 epoch: 5, train_loss: 1.1683, test_loss: 1.2340, test_f1: 0.2420
 epoch: 6, train_loss: 1.1308, test_loss: 1.2114, test_f1: 0.2748
 epoch: 7, train_loss: 1.0746, test_loss: 1.3004, test_f1: 0.2604
 epoch: 8, train_loss: 1.0383, test_loss: 1.0853, test_f1: 0.3516
 epoch: 9, train_loss: 1.0036, test_loss: 1.2111, test_f1: 0.3444
 epoch: 10, train_loss: 0.9753, test_loss: 1.1374, test_f1: 0.3458
 epoch: 11, train_loss: 0.9634, test_loss: 1.1049, test_f1: 0.3412
 epoch: 12, train_loss: 0.9398, test_loss: 1.0898, test_f1: 0.4006
 epoch: 13, train_loss: 0.9328, test_loss: 1.0274, test_f1: 0.5115
 epoch: 14, train_loss: 0.9159, test_loss: 1.0380, test_f1: 0.4764
 epoch: 15, train_loss: 0.8916, test_loss: 1.0425, test_f1: 0.5239
 epoch: 16, train_loss: 0.8806, test_loss: 1.0025, test_f1: 0.5280
 epoch: 17, train_loss: 0.8763, test_loss: 1.0398, test_f1: 0.5051
 epoch: 18, train_loss: 0.8708, test_loss: 1.0406, test_f1: 0.4976
 epoch: 19, train_loss: 0.8602, test_loss: 0.9810, test_f1: 0.5232
 epoch: 20, train_loss: 0.8456, test_loss: 1.0136, test_f1: 0.5737
 epoch: 21, train_loss: 0.8352, test_loss: 1.0298, test_f1: 0.5494
 epoch: 22, train_loss: 0.8185, test_loss: 0.9750, test_f1: 0.5724
 epoch: 23, train_loss: 0.8316, test_loss: 1.0037, test_f1: 0.5646
 epoch: 24, train_loss: 0.8081, test_loss: 1.0290, test_f1: 0.6046
 epoch: 25, train_loss: 0.8094, test_loss: 1.0018, test_f1: 0.4626
 epoch: 26, train_loss: 0.8067, test_loss: 0.9911, test_f1: 0.5550
 epoch: 27, train_loss: 0.8026, test_loss: 0.9745, test_f1: 0.5938
 epoch: 28, train_loss: 0.8010, test_loss: 0.9439, test_f1: 0.5834
 epoch: 29, train_loss: 0.7876, test_loss: 1.0144, test_f1: 0.5706
 epoch: 30, train_loss: 0.7888, test_loss: 1.0000, test_f1: 0.5340
 epoch: 31, train_loss: 0.7814, test_loss: 0.9712, test_f1: 0.5627
 epoch: 32, train_loss: 0.7850, test_loss: 1.3011, test_f1: 0.4485
 epoch: 33, train_loss: 0.7809, test_loss: 1.0349, test_f1: 0.5233
 epoch: 34, train_loss: 0.7845, test_loss: 0.9780, test_f1: 0.5357
 epoch: 35, train_loss: 0.7780, test_loss: 1.0746, test_f1: 0.5068
 epoch: 36, train_loss: 0.7596, test_loss: 0.9968, test_f1: 0.5537
 epoch: 37, train_loss: 0.7545, test_loss: 0.9612, test_f1: 0.5376
 epoch: 38, train_loss: 0.7559, test_loss: 1.4638, test_f1: 0.3921
 epoch: 39, train_loss: 0.7783, test_loss: 1.0376, test_f1: 0.5657
 epoch: 40, train_loss: 0.7573, test_loss: 1.1244, test_f1: 0.4952
 epoch: 41, train_loss: 0.7540, test_loss: 1.0108, test_f1: 0.5906
 epoch: 42, train_loss: 0.7686, test_loss: 1.0113, test_f1: 0.5345
 epoch: 43, train_loss: 0.7467, test_loss: 1.0224, test_f1: 0.5827
 epoch: 44, train_loss: 0.7514, test_loss: 1.0374, test_f1: 0.4782
 epoch: 45, train_loss: 0.7376, test_loss: 1.1066, test_f1: 0.5362
 epoch: 46, train_loss: 0.7425, test_loss: 1.0854, test_f1: 0.5706
 epoch: 47, train_loss: 0.7372, test_loss: 1.1815, test_f1: 0.4924
 epoch: 48, train_loss: 0.7498, test_loss: 1.0377, test_f1: 0.5511
 epoch: 49, train_loss: 0.7457, test_loss: 1.0977, test_f1: 0.5718
 epoch: 50, train_loss: 0.7209, test_loss: 1.1246, test_f1: 0.5704
 epoch: 51, train_loss: 0.7238, test_loss: 1.1053, test_f1: 0.5496
 epoch: 52, train_loss: 0.7277, test_loss: 1.0856, test_f1: 0.5388
 epoch: 53, train_loss: 0.7260, test_loss: 1.1102, test_f1: 0.5329
 epoch: 54, train_loss: 0.7182, test_loss: 1.1241, test_f1: 0.5774
 epoch: 55, train_loss: 0.7124, test_loss: 1.1202, test_f1: 0.5500
 epoch: 56, train_loss: 0.7007, test_loss: 1.1348, test_f1: 0.5727
 epoch: 57, train_loss: 0.7084, test_loss: 1.1701, test_f1: 0.5526
 epoch: 58, train_loss: 0.7176, test_loss: 1.1374, test_f1: 0.5258
 epoch: 59, train_loss: 0.7016, test_loss: 1.1837, test_f1: 0.5384
 epoch: 60, train_loss: 0.7028, test_loss: 1.1611, test_f1: 0.5720
 epoch: 61, train_loss: 0.7106, test_loss: 1.1661, test_f1: 0.5127
 epoch: 62, train_loss: 0.7091, test_loss: 1.2048, test_f1: 0.5565
 epoch: 63, train_loss: 0.7114, test_loss: 1.1623, test_f1: 0.5381
 epoch: 64, train_loss: 0.6990, test_loss: 1.1974, test_f1: 0.5893
 epoch: 65, train_loss: 0.7002, test_loss: 1.1859, test_f1: 0.5334
 epoch: 66, train_loss: 0.6878, test_loss: 1.1570, test_f1: 0.5906
 epoch: 67, train_loss: 0.7084, test_loss: 1.1795, test_f1: 0.5561
 epoch: 68, train_loss: 0.7013, test_loss: 1.2455, test_f1: 0.4678
 epoch: 69, train_loss: 0.7004, test_loss: 1.1445, test_f1: 0.5701
 epoch: 70, train_loss: 0.6972, test_loss: 1.1712, test_f1: 0.5892
 epoch: 71, train_loss: 0.6815, test_loss: 1.1273, test_f1: 0.5390
 epoch: 72, train_loss: 0.6818, test_loss: 1.1907, test_f1: 0.5410
 epoch: 73, train_loss: 0.6881, test_loss: 1.2368, test_f1: 0.5648
 epoch: 74, train_loss: 0.6855, test_loss: 1.2231, test_f1: 0.5773
 epoch: 75, train_loss: 0.6744, test_loss: 1.2108, test_f1: 0.5798
 epoch: 76, train_loss: 0.6803, test_loss: 1.2589, test_f1: 0.5465
 epoch: 77, train_loss: 0.6778, test_loss: 1.1683, test_f1: 0.5774
 epoch: 78, train_loss: 0.6851, test_loss: 1.2485, test_f1: 0.5753
 epoch: 79, train_loss: 0.6814, test_loss: 1.2822, test_f1: 0.5453
 epoch: 80, train_loss: 0.6815, test_loss: 1.2681, test_f1: 0.5541
 epoch: 81, train_loss: 0.6806, test_loss: 1.3253, test_f1: 0.5781
 epoch: 82, train_loss: 0.6859, test_loss: 1.2802, test_f1: 0.5663
 epoch: 83, train_loss: 0.6711, test_loss: 1.3422, test_f1: 0.5617
 epoch: 84, train_loss: 0.6628, test_loss: 1.2790, test_f1: 0.5603
 epoch: 85, train_loss: 0.6710, test_loss: 1.2040, test_f1: 0.5407
 epoch: 86, train_loss: 0.6822, test_loss: 1.2707, test_f1: 0.5853
 epoch: 87, train_loss: 0.6767, test_loss: 1.2914, test_f1: 0.5778
 epoch: 88, train_loss: 0.6790, test_loss: 1.3050, test_f1: 0.5297
 epoch: 89, train_loss: 0.6592, test_loss: 1.3482, test_f1: 0.5676
 epoch: 90, train_loss: 0.6691, test_loss: 1.2601, test_f1: 0.5593
 epoch: 91, train_loss: 0.6817, test_loss: 1.2609, test_f1: 0.5521
 epoch: 92, train_loss: 0.6571, test_loss: 1.3117, test_f1: 0.5723
 epoch: 93, train_loss: 0.6644, test_loss: 1.2836, test_f1: 0.5620
 epoch: 94, train_loss: 0.6635, test_loss: 1.3021, test_f1: 0.5767
 epoch: 95, train_loss: 0.6608, test_loss: 1.3180, test_f1: 0.5363
 epoch: 96, train_loss: 0.6611, test_loss: 1.3956, test_f1: 0.5277
 epoch: 97, train_loss: 0.6589, test_loss: 1.2809, test_f1: 0.5557
 epoch: 98, train_loss: 0.6681, test_loss: 1.3729, test_f1: 0.5640
 epoch: 99, train_loss: 0.6845, test_loss: 1.4666, test_f1: 0.5537
##################ITERATION #1 ****************************************
 epoch: 0, train_loss: 1.3715, test_loss: 1.3104, test_f1: 0.2281
 epoch: 1, train_loss: 1.2568, test_loss: 1.2780, test_f1: 0.2281
 epoch: 2, train_loss: 1.2046, test_loss: 1.2489, test_f1: 0.3115
 epoch: 3, train_loss: 1.1718, test_loss: 1.2108, test_f1: 0.3344
 epoch: 4, train_loss: 1.1360, test_loss: 1.1748, test_f1: 0.3344
 epoch: 5, train_loss: 1.0907, test_loss: 1.1587, test_f1: 0.3692
 epoch: 6, train_loss: 1.0688, test_loss: 1.1206, test_f1: 0.3307
 epoch: 7, train_loss: 1.0415, test_loss: 1.1009, test_f1: 0.3597
 epoch: 8, train_loss: 1.0395, test_loss: 1.0883, test_f1: 0.3555
 epoch: 9, train_loss: 1.0139, test_loss: 1.0772, test_f1: 0.3837
 epoch: 10, train_loss: 1.0033, test_loss: 1.0990, test_f1: 0.3981
 epoch: 11, train_loss: 0.9926, test_loss: 1.0747, test_f1: 0.4112
 epoch: 12, train_loss: 0.9724, test_loss: 1.0555, test_f1: 0.3984
 epoch: 13, train_loss: 0.9590, test_loss: 1.0488, test_f1: 0.4199
 epoch: 14, train_loss: 0.9448, test_loss: 1.0575, test_f1: 0.4445
 epoch: 15, train_loss: 0.9456, test_loss: 1.0474, test_f1: 0.4648
 epoch: 16, train_loss: 0.9284, test_loss: 1.0581, test_f1: 0.4652
 epoch: 17, train_loss: 0.9251, test_loss: 1.0347, test_f1: 0.4509
 epoch: 18, train_loss: 0.9078, test_loss: 1.0271, test_f1: 0.4763
 epoch: 19, train_loss: 0.9131, test_loss: 1.0135, test_f1: 0.4861
 epoch: 20, train_loss: 0.8975, test_loss: 1.0209, test_f1: 0.4851
 epoch: 21, train_loss: 0.8755, test_loss: 1.0235, test_f1: 0.4668
 epoch: 22, train_loss: 0.8896, test_loss: 1.0157, test_f1: 0.4747
 epoch: 23, train_loss: 0.8657, test_loss: 1.0331, test_f1: 0.4357
 epoch: 24, train_loss: 0.8599, test_loss: 1.0154, test_f1: 0.4715
 epoch: 25, train_loss: 0.8592, test_loss: 1.0229, test_f1: 0.4805
 epoch: 26, train_loss: 0.8467, test_loss: 1.0501, test_f1: 0.4786
 epoch: 27, train_loss: 0.8420, test_loss: 1.0059, test_f1: 0.4841
 epoch: 28, train_loss: 0.8262, test_loss: 1.0162, test_f1: 0.4826
 epoch: 29, train_loss: 0.8227, test_loss: 1.0131, test_f1: 0.5070
 epoch: 30, train_loss: 0.8291, test_loss: 1.0377, test_f1: 0.4372
 epoch: 31, train_loss: 0.8125, test_loss: 0.9579, test_f1: 0.4956
 epoch: 32, train_loss: 0.8144, test_loss: 1.0111, test_f1: 0.4988
 epoch: 33, train_loss: 0.8008, test_loss: 1.0615, test_f1: 0.4813
 epoch: 34, train_loss: 0.7961, test_loss: 1.0345, test_f1: 0.4963
 epoch: 35, train_loss: 0.7893, test_loss: 1.0404, test_f1: 0.5045
 epoch: 36, train_loss: 0.7935, test_loss: 1.1026, test_f1: 0.4282
 epoch: 37, train_loss: 0.7833, test_loss: 1.0634, test_f1: 0.4899
 epoch: 38, train_loss: 0.7830, test_loss: 1.0753, test_f1: 0.4967
 epoch: 39, train_loss: 0.7657, test_loss: 1.1131, test_f1: 0.4716
 epoch: 40, train_loss: 0.7652, test_loss: 1.0782, test_f1: 0.4888
 epoch: 41, train_loss: 0.7635, test_loss: 1.2524, test_f1: 0.4246
 epoch: 42, train_loss: 0.7708, test_loss: 1.0058, test_f1: 0.5181
 epoch: 43, train_loss: 0.7322, test_loss: 1.0752, test_f1: 0.5237
 epoch: 44, train_loss: 0.7275, test_loss: 1.1519, test_f1: 0.4769
 epoch: 45, train_loss: 0.7455, test_loss: 1.1021, test_f1: 0.4983
 epoch: 46, train_loss: 0.7310, test_loss: 1.1060, test_f1: 0.5243
 epoch: 47, train_loss: 0.7240, test_loss: 1.2457, test_f1: 0.4737
 epoch: 48, train_loss: 0.7273, test_loss: 1.1503, test_f1: 0.5280
 epoch: 49, train_loss: 0.7255, test_loss: 1.0505, test_f1: 0.5230
 epoch: 50, train_loss: 0.7190, test_loss: 1.0894, test_f1: 0.5261
 epoch: 51, train_loss: 0.7149, test_loss: 1.0815, test_f1: 0.5317
 epoch: 52, train_loss: 0.7037, test_loss: 1.0669, test_f1: 0.5188
 epoch: 53, train_loss: 0.7105, test_loss: 1.0943, test_f1: 0.4920
 epoch: 54, train_loss: 0.7050, test_loss: 1.0828, test_f1: 0.5052
 epoch: 55, train_loss: 0.6977, test_loss: 1.0940, test_f1: 0.5306
 epoch: 56, train_loss: 0.6892, test_loss: 1.1254, test_f1: 0.4966
 epoch: 57, train_loss: 0.6919, test_loss: 1.1185, test_f1: 0.4885
 epoch: 58, train_loss: 0.7060, test_loss: 1.1092, test_f1: 0.4857
 epoch: 59, train_loss: 0.6937, test_loss: 1.1481, test_f1: 0.4730
 epoch: 60, train_loss: 0.6889, test_loss: 1.0832, test_f1: 0.5147
 epoch: 61, train_loss: 0.6831, test_loss: 1.0839, test_f1: 0.5166
 epoch: 62, train_loss: 0.6803, test_loss: 1.1588, test_f1: 0.4863
 epoch: 63, train_loss: 0.6864, test_loss: 1.1184, test_f1: 0.4869
 epoch: 64, train_loss: 0.6873, test_loss: 1.1297, test_f1: 0.4943
 epoch: 65, train_loss: 0.6858, test_loss: 1.0945, test_f1: 0.5016
 epoch: 66, train_loss: 0.6808, test_loss: 1.0868, test_f1: 0.5231
 epoch: 67, train_loss: 0.6827, test_loss: 1.1342, test_f1: 0.5065
 epoch: 68, train_loss: 0.6729, test_loss: 1.1134, test_f1: 0.5213
 epoch: 69, train_loss: 0.6692, test_loss: 1.1295, test_f1: 0.4791
 epoch: 70, train_loss: 0.6793, test_loss: 1.1147, test_f1: 0.4991
 epoch: 71, train_loss: 0.6769, test_loss: 1.1569, test_f1: 0.4883
 epoch: 72, train_loss: 0.6576, test_loss: 1.1296, test_f1: 0.5040
 epoch: 73, train_loss: 0.6627, test_loss: 1.0962, test_f1: 0.5058
 epoch: 74, train_loss: 0.6611, test_loss: 1.1056, test_f1: 0.5278
 epoch: 75, train_loss: 0.6588, test_loss: 1.1368, test_f1: 0.4955
 epoch: 76, train_loss: 0.6582, test_loss: 1.0680, test_f1: 0.5304
 epoch: 77, train_loss: 0.6516, test_loss: 1.1561, test_f1: 0.5030
 epoch: 78, train_loss: 0.6525, test_loss: 1.1095, test_f1: 0.5302
 epoch: 79, train_loss: 0.6568, test_loss: 1.1082, test_f1: 0.5261
 epoch: 80, train_loss: 0.6567, test_loss: 1.1366, test_f1: 0.5146
 epoch: 81, train_loss: 0.6542, test_loss: 1.1890, test_f1: 0.4572
 epoch: 82, train_loss: 0.6745, test_loss: 1.2315, test_f1: 0.4702
 epoch: 83, train_loss: 0.6639, test_loss: 1.1264, test_f1: 0.5212
 epoch: 84, train_loss: 0.6541, test_loss: 1.1292, test_f1: 0.4929
 epoch: 85, train_loss: 0.6669, test_loss: 1.1381, test_f1: 0.5418
 epoch: 86, train_loss: 0.6440, test_loss: 1.1782, test_f1: 0.4886
 epoch: 87, train_loss: 0.6525, test_loss: 1.2170, test_f1: 0.4947
 epoch: 88, train_loss: 0.6583, test_loss: 1.1429, test_f1: 0.5162
 epoch: 89, train_loss: 0.6396, test_loss: 1.1742, test_f1: 0.4896
 epoch: 90, train_loss: 0.6390, test_loss: 1.1640, test_f1: 0.5034
 epoch: 91, train_loss: 0.6493, test_loss: 1.2524, test_f1: 0.4787
 epoch: 92, train_loss: 0.6511, test_loss: 1.1675, test_f1: 0.4866
 epoch: 93, train_loss: 0.6460, test_loss: 1.1372, test_f1: 0.4991
 epoch: 94, train_loss: 0.6591, test_loss: 1.1641, test_f1: 0.5335
 epoch: 95, train_loss: 0.6525, test_loss: 1.1341, test_f1: 0.5208
 epoch: 96, train_loss: 0.6466, test_loss: 1.1323, test_f1: 0.5042
 epoch: 97, train_loss: 0.6422, test_loss: 1.2289, test_f1: 0.4723
 epoch: 98, train_loss: 0.6483, test_loss: 1.1337, test_f1: 0.5162
 epoch: 99, train_loss: 0.6428, test_loss: 1.1533, test_f1: 0.4871
##################ITERATION #2 ****************************************
 epoch: 0, train_loss: 1.3541, test_loss: 1.3143, test_f1: 0.2281
 epoch: 1, train_loss: 1.2194, test_loss: 1.2920, test_f1: 0.2281
 epoch: 2, train_loss: 1.1822, test_loss: 1.2376, test_f1: 0.2281
 epoch: 3, train_loss: 1.1474, test_loss: 1.1995, test_f1: 0.3003
 epoch: 4, train_loss: 1.1084, test_loss: 1.1900, test_f1: 0.3361
 epoch: 5, train_loss: 1.0923, test_loss: 1.1791, test_f1: 0.3671
 epoch: 6, train_loss: 1.0633, test_loss: 1.1410, test_f1: 0.4267
 epoch: 7, train_loss: 1.0280, test_loss: 1.1187, test_f1: 0.4106
 epoch: 8, train_loss: 0.9992, test_loss: 1.1010, test_f1: 0.4107
 epoch: 9, train_loss: 0.9928, test_loss: 1.0887, test_f1: 0.4789
 epoch: 10, train_loss: 0.9621, test_loss: 1.0976, test_f1: 0.5030
 epoch: 11, train_loss: 0.9411, test_loss: 1.0656, test_f1: 0.5006
 epoch: 12, train_loss: 0.9236, test_loss: 1.0251, test_f1: 0.5470
 epoch: 13, train_loss: 0.9109, test_loss: 1.2377, test_f1: 0.4690
 epoch: 14, train_loss: 0.9100, test_loss: 1.0168, test_f1: 0.5093
 epoch: 15, train_loss: 0.8876, test_loss: 1.1600, test_f1: 0.4084
 epoch: 16, train_loss: 0.8681, test_loss: 1.0824, test_f1: 0.4548
 epoch: 17, train_loss: 0.8635, test_loss: 1.0317, test_f1: 0.5622
 epoch: 18, train_loss: 0.8646, test_loss: 1.0438, test_f1: 0.5736
 epoch: 19, train_loss: 0.8463, test_loss: 0.9915, test_f1: 0.5217
 epoch: 20, train_loss: 0.8466, test_loss: 1.0485, test_f1: 0.5359
 epoch: 21, train_loss: 0.8275, test_loss: 0.9397, test_f1: 0.5641
 epoch: 22, train_loss: 0.8310, test_loss: 0.9604, test_f1: 0.5732
 epoch: 23, train_loss: 0.8234, test_loss: 1.2202, test_f1: 0.4532
 epoch: 24, train_loss: 0.8233, test_loss: 0.9339, test_f1: 0.5755
 epoch: 25, train_loss: 0.7930, test_loss: 1.0572, test_f1: 0.5584
 epoch: 26, train_loss: 0.7841, test_loss: 0.9710, test_f1: 0.5688
 epoch: 27, train_loss: 0.7900, test_loss: 1.1155, test_f1: 0.4720
 epoch: 28, train_loss: 0.7882, test_loss: 1.0141, test_f1: 0.5737
 epoch: 29, train_loss: 0.7881, test_loss: 1.1235, test_f1: 0.4875
 epoch: 30, train_loss: 0.7651, test_loss: 0.9642, test_f1: 0.5930
 epoch: 31, train_loss: 0.7734, test_loss: 0.9915, test_f1: 0.5954
 epoch: 32, train_loss: 0.7577, test_loss: 0.9911, test_f1: 0.5954
 epoch: 33, train_loss: 0.7430, test_loss: 0.9860, test_f1: 0.5828
 epoch: 34, train_loss: 0.7390, test_loss: 0.9609, test_f1: 0.5733
 epoch: 35, train_loss: 0.7402, test_loss: 0.9639, test_f1: 0.6022
 epoch: 36, train_loss: 0.7447, test_loss: 1.0106, test_f1: 0.5860
 epoch: 37, train_loss: 0.7293, test_loss: 1.0383, test_f1: 0.5771
 epoch: 38, train_loss: 0.7329, test_loss: 1.0490, test_f1: 0.5609
 epoch: 39, train_loss: 0.7175, test_loss: 1.0913, test_f1: 0.5452
 epoch: 40, train_loss: 0.7437, test_loss: 1.0297, test_f1: 0.5907
 epoch: 41, train_loss: 0.7424, test_loss: 1.1488, test_f1: 0.5644
 epoch: 42, train_loss: 0.7217, test_loss: 0.9685, test_f1: 0.5798
 epoch: 43, train_loss: 0.7182, test_loss: 1.0152, test_f1: 0.5577
 epoch: 44, train_loss: 0.7309, test_loss: 1.0276, test_f1: 0.5593
 epoch: 45, train_loss: 0.7190, test_loss: 1.1412, test_f1: 0.5160
 epoch: 46, train_loss: 0.7056, test_loss: 1.0192, test_f1: 0.5786
 epoch: 47, train_loss: 0.6987, test_loss: 1.0228, test_f1: 0.5965
 epoch: 48, train_loss: 0.6902, test_loss: 0.9978, test_f1: 0.5892
 epoch: 49, train_loss: 0.6881, test_loss: 1.0563, test_f1: 0.5898
 epoch: 50, train_loss: 0.6988, test_loss: 0.9880, test_f1: 0.5711
 epoch: 51, train_loss: 0.7024, test_loss: 1.0007, test_f1: 0.5920
 epoch: 52, train_loss: 0.6722, test_loss: 1.0547, test_f1: 0.6017
 epoch: 53, train_loss: 0.6682, test_loss: 0.9839, test_f1: 0.5954
 epoch: 54, train_loss: 0.6723, test_loss: 1.0043, test_f1: 0.6011
 epoch: 55, train_loss: 0.6862, test_loss: 1.0758, test_f1: 0.5849
 epoch: 56, train_loss: 0.6710, test_loss: 0.9845, test_f1: 0.6134
 epoch: 57, train_loss: 0.6736, test_loss: 0.9781, test_f1: 0.5953
 epoch: 58, train_loss: 0.6615, test_loss: 1.0154, test_f1: 0.5878
 epoch: 59, train_loss: 0.6742, test_loss: 1.0520, test_f1: 0.5869
 epoch: 60, train_loss: 0.6669, test_loss: 1.0568, test_f1: 0.5892
 epoch: 61, train_loss: 0.6549, test_loss: 1.0273, test_f1: 0.6213
 epoch: 62, train_loss: 0.6836, test_loss: 1.0108, test_f1: 0.5937
 epoch: 63, train_loss: 0.6539, test_loss: 1.0581, test_f1: 0.5933
 epoch: 64, train_loss: 0.6574, test_loss: 1.0039, test_f1: 0.6037
 epoch: 65, train_loss: 0.6602, test_loss: 1.0694, test_f1: 0.5868
 epoch: 66, train_loss: 0.6599, test_loss: 1.0661, test_f1: 0.5921
 epoch: 67, train_loss: 0.6598, test_loss: 1.0488, test_f1: 0.6000
 epoch: 68, train_loss: 0.6652, test_loss: 1.0211, test_f1: 0.6151
 epoch: 69, train_loss: 0.6622, test_loss: 1.0008, test_f1: 0.6216
 epoch: 70, train_loss: 0.6560, test_loss: 1.0649, test_f1: 0.6017
 epoch: 71, train_loss: 0.6494, test_loss: 1.0515, test_f1: 0.6054
 epoch: 72, train_loss: 0.6508, test_loss: 1.0299, test_f1: 0.6279
 epoch: 73, train_loss: 0.6613, test_loss: 1.0217, test_f1: 0.6113
 epoch: 74, train_loss: 0.6537, test_loss: 1.0535, test_f1: 0.5980
 epoch: 75, train_loss: 0.6552, test_loss: 1.0883, test_f1: 0.5868
 epoch: 76, train_loss: 0.6463, test_loss: 1.0479, test_f1: 0.6106
 epoch: 77, train_loss: 0.6589, test_loss: 1.0403, test_f1: 0.5983
 epoch: 78, train_loss: 0.6485, test_loss: 1.0430, test_f1: 0.6009
 epoch: 79, train_loss: 0.6378, test_loss: 1.0131, test_f1: 0.5992
 epoch: 80, train_loss: 0.6475, test_loss: 1.0565, test_f1: 0.5875
 epoch: 81, train_loss: 0.6539, test_loss: 1.0882, test_f1: 0.6324
 epoch: 82, train_loss: 0.6360, test_loss: 1.0462, test_f1: 0.6058
 epoch: 83, train_loss: 0.6412, test_loss: 1.0853, test_f1: 0.5997
 epoch: 84, train_loss: 0.6370, test_loss: 1.0637, test_f1: 0.6021
 epoch: 85, train_loss: 0.6280, test_loss: 1.0424, test_f1: 0.6051
 epoch: 86, train_loss: 0.6292, test_loss: 1.0982, test_f1: 0.5917
 epoch: 87, train_loss: 0.6148, test_loss: 1.0680, test_f1: 0.5891
 epoch: 88, train_loss: 0.6261, test_loss: 1.0405, test_f1: 0.6113
 epoch: 89, train_loss: 0.6451, test_loss: 1.0535, test_f1: 0.5887
 epoch: 90, train_loss: 0.6392, test_loss: 1.0583, test_f1: 0.6082
 epoch: 91, train_loss: 0.6138, test_loss: 1.0500, test_f1: 0.6085
 epoch: 92, train_loss: 0.6477, test_loss: 1.0748, test_f1: 0.5785
 epoch: 93, train_loss: 0.6328, test_loss: 1.1161, test_f1: 0.5792
 epoch: 94, train_loss: 0.6243, test_loss: 0.9823, test_f1: 0.6016
 epoch: 95, train_loss: 0.6358, test_loss: 1.1354, test_f1: 0.5858
 epoch: 96, train_loss: 0.6210, test_loss: 1.0194, test_f1: 0.6111
 epoch: 97, train_loss: 0.6256, test_loss: 1.0910, test_f1: 0.5859
 epoch: 98, train_loss: 0.6249, test_loss: 1.1191, test_f1: 0.5760
 epoch: 99, train_loss: 0.6206, test_loss: 1.1154, test_f1: 0.5962
##################ITERATION #3 ****************************************
 epoch: 0, train_loss: 1.2351, test_loss: 1.3423, test_f1: 0.3193
 epoch: 1, train_loss: 1.1468, test_loss: 1.2402, test_f1: 0.3274
 epoch: 2, train_loss: 1.1102, test_loss: 1.1490, test_f1: 0.3669
 epoch: 3, train_loss: 1.0725, test_loss: 1.1281, test_f1: 0.4070
 epoch: 4, train_loss: 1.0389, test_loss: 1.0920, test_f1: 0.4973
 epoch: 5, train_loss: 1.0285, test_loss: 1.0709, test_f1: 0.4893
 epoch: 6, train_loss: 0.9924, test_loss: 1.0595, test_f1: 0.4983
 epoch: 7, train_loss: 0.9665, test_loss: 1.0451, test_f1: 0.4915
 epoch: 8, train_loss: 0.9644, test_loss: 1.0562, test_f1: 0.4666
 epoch: 9, train_loss: 0.9556, test_loss: 1.0169, test_f1: 0.5147
 epoch: 10, train_loss: 0.9362, test_loss: 0.9980, test_f1: 0.5108
 epoch: 11, train_loss: 0.9121, test_loss: 1.0131, test_f1: 0.5216
 epoch: 12, train_loss: 0.8985, test_loss: 0.9888, test_f1: 0.5337
 epoch: 13, train_loss: 0.8973, test_loss: 0.9771, test_f1: 0.5371
 epoch: 14, train_loss: 0.8794, test_loss: 0.9846, test_f1: 0.5024
 epoch: 15, train_loss: 0.8720, test_loss: 0.9972, test_f1: 0.5238
 epoch: 16, train_loss: 0.8450, test_loss: 0.9689, test_f1: 0.5468
 epoch: 17, train_loss: 0.8495, test_loss: 1.0229, test_f1: 0.4984
 epoch: 18, train_loss: 0.8369, test_loss: 0.9653, test_f1: 0.5724
 epoch: 19, train_loss: 0.8324, test_loss: 0.9740, test_f1: 0.5424
 epoch: 20, train_loss: 0.8156, test_loss: 0.9476, test_f1: 0.5854
 epoch: 21, train_loss: 0.8213, test_loss: 0.9408, test_f1: 0.5702
 epoch: 22, train_loss: 0.8231, test_loss: 1.0125, test_f1: 0.5324
 epoch: 23, train_loss: 0.8229, test_loss: 1.0244, test_f1: 0.5252
 epoch: 24, train_loss: 0.7927, test_loss: 0.9502, test_f1: 0.5770
 epoch: 25, train_loss: 0.8141, test_loss: 0.9938, test_f1: 0.5624
 epoch: 26, train_loss: 0.8049, test_loss: 1.0338, test_f1: 0.5182
 epoch: 27, train_loss: 0.7705, test_loss: 0.9806, test_f1: 0.5513
 epoch: 28, train_loss: 0.7809, test_loss: 0.9482, test_f1: 0.5979
 epoch: 29, train_loss: 0.7843, test_loss: 1.0036, test_f1: 0.5615
 epoch: 30, train_loss: 0.7806, test_loss: 1.2342, test_f1: 0.4773
 epoch: 31, train_loss: 0.7623, test_loss: 0.9515, test_f1: 0.5874
 epoch: 32, train_loss: 0.7462, test_loss: 0.9987, test_f1: 0.5558
 epoch: 33, train_loss: 0.7562, test_loss: 1.1147, test_f1: 0.4938
 epoch: 34, train_loss: 0.7545, test_loss: 0.9815, test_f1: 0.5534
 epoch: 35, train_loss: 0.7533, test_loss: 0.9492, test_f1: 0.5795
 epoch: 36, train_loss: 0.7436, test_loss: 0.9319, test_f1: 0.5881
 epoch: 37, train_loss: 0.7327, test_loss: 1.0104, test_f1: 0.5762
 epoch: 38, train_loss: 0.7360, test_loss: 1.0062, test_f1: 0.5602
 epoch: 39, train_loss: 0.7325, test_loss: 0.9604, test_f1: 0.5957
 epoch: 40, train_loss: 0.7214, test_loss: 0.9269, test_f1: 0.5958
 epoch: 41, train_loss: 0.7442, test_loss: 1.0330, test_f1: 0.5481
 epoch: 42, train_loss: 0.7149, test_loss: 0.9546, test_f1: 0.5578
 epoch: 43, train_loss: 0.7003, test_loss: 0.9585, test_f1: 0.6001
 epoch: 44, train_loss: 0.7107, test_loss: 0.9795, test_f1: 0.5641
 epoch: 45, train_loss: 0.7066, test_loss: 0.9354, test_f1: 0.6145
 epoch: 46, train_loss: 0.7276, test_loss: 0.9634, test_f1: 0.5802
 epoch: 47, train_loss: 0.7053, test_loss: 0.9938, test_f1: 0.5645
 epoch: 48, train_loss: 0.6917, test_loss: 0.9230, test_f1: 0.6219
 epoch: 49, train_loss: 0.7039, test_loss: 1.0022, test_f1: 0.5803
 epoch: 50, train_loss: 0.6764, test_loss: 0.9334, test_f1: 0.5899
 epoch: 51, train_loss: 0.6633, test_loss: 0.9202, test_f1: 0.6136
 epoch: 52, train_loss: 0.6674, test_loss: 0.9874, test_f1: 0.5686
 epoch: 53, train_loss: 0.6648, test_loss: 0.9978, test_f1: 0.5676
 epoch: 54, train_loss: 0.6687, test_loss: 0.9364, test_f1: 0.5766
 epoch: 55, train_loss: 0.6547, test_loss: 0.9631, test_f1: 0.5747
 epoch: 56, train_loss: 0.6809, test_loss: 0.9805, test_f1: 0.5717
 epoch: 57, train_loss: 0.6637, test_loss: 1.0457, test_f1: 0.5445
 epoch: 58, train_loss: 0.6758, test_loss: 0.9729, test_f1: 0.6192
 epoch: 59, train_loss: 0.6670, test_loss: 1.0467, test_f1: 0.5508
 epoch: 60, train_loss: 0.6664, test_loss: 0.9639, test_f1: 0.5933
 epoch: 61, train_loss: 0.6667, test_loss: 1.0124, test_f1: 0.5620
 epoch: 62, train_loss: 0.6409, test_loss: 1.0187, test_f1: 0.5472
 epoch: 63, train_loss: 0.6750, test_loss: 0.9751, test_f1: 0.6032
 epoch: 64, train_loss: 0.6550, test_loss: 1.0098, test_f1: 0.5550
 epoch: 65, train_loss: 0.6464, test_loss: 0.9592, test_f1: 0.5796
 epoch: 66, train_loss: 0.6627, test_loss: 1.0332, test_f1: 0.5535
 epoch: 67, train_loss: 0.6558, test_loss: 0.9692, test_f1: 0.5646
 epoch: 68, train_loss: 0.6430, test_loss: 0.9868, test_f1: 0.5478
 epoch: 69, train_loss: 0.6458, test_loss: 0.9777, test_f1: 0.5613
 epoch: 70, train_loss: 0.6386, test_loss: 1.0138, test_f1: 0.5411
 epoch: 71, train_loss: 0.6515, test_loss: 0.9721, test_f1: 0.5659
 epoch: 72, train_loss: 0.6344, test_loss: 0.9971, test_f1: 0.5493
 epoch: 73, train_loss: 0.6406, test_loss: 1.0026, test_f1: 0.5603
 epoch: 74, train_loss: 0.6499, test_loss: 1.0608, test_f1: 0.5369
 epoch: 75, train_loss: 0.6420, test_loss: 0.9835, test_f1: 0.5699
 epoch: 76, train_loss: 0.6574, test_loss: 1.0604, test_f1: 0.5550
 epoch: 77, train_loss: 0.6509, test_loss: 0.9849, test_f1: 0.5792
 epoch: 78, train_loss: 0.6297, test_loss: 1.0377, test_f1: 0.5608
 epoch: 79, train_loss: 0.6508, test_loss: 1.0892, test_f1: 0.5609
 epoch: 80, train_loss: 0.6419, test_loss: 1.0057, test_f1: 0.5756
 epoch: 81, train_loss: 0.6601, test_loss: 1.0228, test_f1: 0.5569
 epoch: 82, train_loss: 0.6400, test_loss: 1.0069, test_f1: 0.5564
 epoch: 83, train_loss: 0.6416, test_loss: 1.0492, test_f1: 0.5417
 epoch: 84, train_loss: 0.6293, test_loss: 1.0201, test_f1: 0.5492
 epoch: 85, train_loss: 0.6420, test_loss: 1.0590, test_f1: 0.5534
 epoch: 86, train_loss: 0.6359, test_loss: 1.0182, test_f1: 0.5583
 epoch: 87, train_loss: 0.6258, test_loss: 1.0327, test_f1: 0.5669
 epoch: 88, train_loss: 0.6136, test_loss: 1.0122, test_f1: 0.5674
 epoch: 89, train_loss: 0.6322, test_loss: 1.0109, test_f1: 0.5645
 epoch: 90, train_loss: 0.6113, test_loss: 1.0735, test_f1: 0.5424
 epoch: 91, train_loss: 0.6192, test_loss: 1.0311, test_f1: 0.5768
 epoch: 92, train_loss: 0.6330, test_loss: 1.0231, test_f1: 0.5864
 epoch: 93, train_loss: 0.6169, test_loss: 1.0797, test_f1: 0.5590
 epoch: 94, train_loss: 0.6172, test_loss: 1.0270, test_f1: 0.5591
 epoch: 95, train_loss: 0.6130, test_loss: 1.0734, test_f1: 0.5608
 epoch: 96, train_loss: 0.6097, test_loss: 1.1102, test_f1: 0.5376
 epoch: 97, train_loss: 0.6276, test_loss: 1.0070, test_f1: 0.5659
 epoch: 98, train_loss: 0.6206, test_loss: 1.0444, test_f1: 0.5715
 epoch: 99, train_loss: 0.6106, test_loss: 1.0276, test_f1: 0.5677
##################ITERATION #4 ****************************************
 epoch: 0, train_loss: 1.5561, test_loss: 1.3342, test_f1: 0.2416
 epoch: 1, train_loss: 1.2185, test_loss: 1.3091, test_f1: 0.2801
 epoch: 2, train_loss: 1.1832, test_loss: 1.2253, test_f1: 0.3324
 epoch: 3, train_loss: 1.1476, test_loss: 1.1887, test_f1: 0.4316
 epoch: 4, train_loss: 1.1354, test_loss: 1.1677, test_f1: 0.4385
 epoch: 5, train_loss: 1.1059, test_loss: 1.1453, test_f1: 0.4397
 epoch: 6, train_loss: 1.0858, test_loss: 1.1194, test_f1: 0.4503
 epoch: 7, train_loss: 1.0505, test_loss: 1.0931, test_f1: 0.4881
 epoch: 8, train_loss: 1.0343, test_loss: 1.0698, test_f1: 0.4790
 epoch: 9, train_loss: 1.0215, test_loss: 1.0520, test_f1: 0.5166
 epoch: 10, train_loss: 1.0064, test_loss: 1.0370, test_f1: 0.5352
 epoch: 11, train_loss: 0.9853, test_loss: 1.0408, test_f1: 0.5150
 epoch: 12, train_loss: 0.9779, test_loss: 1.0314, test_f1: 0.5123
 epoch: 13, train_loss: 0.9808, test_loss: 1.0229, test_f1: 0.5305
 epoch: 14, train_loss: 0.9702, test_loss: 0.9871, test_f1: 0.5194
 epoch: 15, train_loss: 0.9424, test_loss: 0.9937, test_f1: 0.5488
 epoch: 16, train_loss: 0.9467, test_loss: 0.9935, test_f1: 0.5901
 epoch: 17, train_loss: 0.9326, test_loss: 0.9684, test_f1: 0.5751
 epoch: 18, train_loss: 0.9421, test_loss: 0.9796, test_f1: 0.5649
 epoch: 19, train_loss: 0.9186, test_loss: 0.9628, test_f1: 0.5948
 epoch: 20, train_loss: 0.9178, test_loss: 0.9579, test_f1: 0.5761
 epoch: 21, train_loss: 0.9099, test_loss: 0.9509, test_f1: 0.5873
 epoch: 22, train_loss: 0.8859, test_loss: 0.9543, test_f1: 0.5588
 epoch: 23, train_loss: 0.8855, test_loss: 0.9512, test_f1: 0.5875
 epoch: 24, train_loss: 0.8891, test_loss: 0.9353, test_f1: 0.5921
 epoch: 25, train_loss: 0.8680, test_loss: 0.9342, test_f1: 0.5885
 epoch: 26, train_loss: 0.8733, test_loss: 0.9440, test_f1: 0.6071
 epoch: 27, train_loss: 0.8705, test_loss: 0.9426, test_f1: 0.5805
 epoch: 28, train_loss: 0.8613, test_loss: 0.9355, test_f1: 0.6072
 epoch: 29, train_loss: 0.8530, test_loss: 0.9452, test_f1: 0.5797
 epoch: 30, train_loss: 0.8378, test_loss: 0.9254, test_f1: 0.5909
 epoch: 31, train_loss: 0.8492, test_loss: 0.9215, test_f1: 0.6091
 epoch: 32, train_loss: 0.8379, test_loss: 0.9319, test_f1: 0.6008
 epoch: 33, train_loss: 0.8305, test_loss: 0.9257, test_f1: 0.6171
 epoch: 34, train_loss: 0.8392, test_loss: 0.9016, test_f1: 0.6334
 epoch: 35, train_loss: 0.8213, test_loss: 0.8971, test_f1: 0.6129
 epoch: 36, train_loss: 0.8165, test_loss: 0.9265, test_f1: 0.6265
 epoch: 37, train_loss: 0.8179, test_loss: 0.9034, test_f1: 0.6020
 epoch: 38, train_loss: 0.8075, test_loss: 0.9161, test_f1: 0.6098
 epoch: 39, train_loss: 0.8159, test_loss: 0.9095, test_f1: 0.6380
 epoch: 40, train_loss: 0.8144, test_loss: 0.9313, test_f1: 0.6064
 epoch: 41, train_loss: 0.8053, test_loss: 0.8991, test_f1: 0.5926
 epoch: 42, train_loss: 0.8097, test_loss: 0.9215, test_f1: 0.6351
 epoch: 43, train_loss: 0.7831, test_loss: 0.9028, test_f1: 0.5741
 epoch: 44, train_loss: 0.7979, test_loss: 0.9074, test_f1: 0.6171
 epoch: 45, train_loss: 0.7814, test_loss: 0.8899, test_f1: 0.5918
 epoch: 46, train_loss: 0.7750, test_loss: 0.9371, test_f1: 0.6165
 epoch: 47, train_loss: 0.7844, test_loss: 0.9337, test_f1: 0.5860
 epoch: 48, train_loss: 0.7802, test_loss: 1.0113, test_f1: 0.5924
 epoch: 49, train_loss: 0.7600, test_loss: 0.8969, test_f1: 0.5796
 epoch: 50, train_loss: 0.7679, test_loss: 0.9034, test_f1: 0.5943
 epoch: 51, train_loss: 0.7620, test_loss: 0.9209, test_f1: 0.5924
 epoch: 52, train_loss: 0.7479, test_loss: 0.9322, test_f1: 0.5649
 epoch: 53, train_loss: 0.7422, test_loss: 0.9073, test_f1: 0.5658
 epoch: 54, train_loss: 0.7438, test_loss: 0.9215, test_f1: 0.5661
 epoch: 55, train_loss: 0.7260, test_loss: 0.9057, test_f1: 0.5941
 epoch: 56, train_loss: 0.7564, test_loss: 0.9200, test_f1: 0.5621
 epoch: 57, train_loss: 0.7410, test_loss: 0.9207, test_f1: 0.5845
 epoch: 58, train_loss: 0.7211, test_loss: 0.8946, test_f1: 0.5701
 epoch: 59, train_loss: 0.7421, test_loss: 0.8962, test_f1: 0.5924
 epoch: 60, train_loss: 0.7487, test_loss: 0.9325, test_f1: 0.5884
 epoch: 61, train_loss: 0.7251, test_loss: 0.9046, test_f1: 0.5709
 epoch: 62, train_loss: 0.7106, test_loss: 0.8803, test_f1: 0.5888
 epoch: 63, train_loss: 0.7381, test_loss: 0.9060, test_f1: 0.5796
 epoch: 64, train_loss: 0.7192, test_loss: 0.9128, test_f1: 0.5578
 epoch: 65, train_loss: 0.7404, test_loss: 0.9104, test_f1: 0.5714
 epoch: 66, train_loss: 0.7321, test_loss: 0.9520, test_f1: 0.5577
 epoch: 67, train_loss: 0.7295, test_loss: 0.9092, test_f1: 0.5828
 epoch: 68, train_loss: 0.7239, test_loss: 0.9100, test_f1: 0.5721
 epoch: 69, train_loss: 0.7247, test_loss: 0.9556, test_f1: 0.5511
 epoch: 70, train_loss: 0.7170, test_loss: 0.9271, test_f1: 0.5697
 epoch: 71, train_loss: 0.7117, test_loss: 0.9496, test_f1: 0.5619
 epoch: 72, train_loss: 0.7021, test_loss: 0.9176, test_f1: 0.5649
 epoch: 73, train_loss: 0.7165, test_loss: 0.9683, test_f1: 0.5701
 epoch: 74, train_loss: 0.7146, test_loss: 0.9264, test_f1: 0.5383
 epoch: 75, train_loss: 0.6994, test_loss: 0.9434, test_f1: 0.5336
 epoch: 76, train_loss: 0.6999, test_loss: 0.9189, test_f1: 0.5576
 epoch: 77, train_loss: 0.7168, test_loss: 0.9666, test_f1: 0.5581
 epoch: 78, train_loss: 0.7096, test_loss: 0.9506, test_f1: 0.5444
 epoch: 79, train_loss: 0.6994, test_loss: 0.9496, test_f1: 0.5481
 epoch: 80, train_loss: 0.6956, test_loss: 0.9325, test_f1: 0.5644
 epoch: 81, train_loss: 0.6966, test_loss: 0.9863, test_f1: 0.5514
 epoch: 82, train_loss: 0.6998, test_loss: 0.9613, test_f1: 0.5542
 epoch: 83, train_loss: 0.7054, test_loss: 0.9219, test_f1: 0.5358
 epoch: 84, train_loss: 0.6993, test_loss: 0.9479, test_f1: 0.5644
 epoch: 85, train_loss: 0.7003, test_loss: 0.9497, test_f1: 0.5501
 epoch: 86, train_loss: 0.6891, test_loss: 0.9201, test_f1: 0.5631
 epoch: 87, train_loss: 0.6834, test_loss: 0.9215, test_f1: 0.5527
 epoch: 88, train_loss: 0.6911, test_loss: 0.9895, test_f1: 0.5641
 epoch: 89, train_loss: 0.6956, test_loss: 0.9867, test_f1: 0.5539
 epoch: 90, train_loss: 0.6936, test_loss: 0.9813, test_f1: 0.5475
 epoch: 91, train_loss: 0.6944, test_loss: 0.9473, test_f1: 0.5387
 epoch: 92, train_loss: 0.6813, test_loss: 0.9653, test_f1: 0.5442
 epoch: 93, train_loss: 0.6587, test_loss: 0.9821, test_f1: 0.5520
 epoch: 94, train_loss: 0.6679, test_loss: 0.9279, test_f1: 0.5716
 epoch: 95, train_loss: 0.6867, test_loss: 0.9707, test_f1: 0.5502
 epoch: 96, train_loss: 0.6676, test_loss: 0.9427, test_f1: 0.5643
 epoch: 97, train_loss: 0.6628, test_loss: 1.0295, test_f1: 0.5430
 epoch: 98, train_loss: 0.6849, test_loss: 0.9531, test_f1: 0.5527
 epoch: 99, train_loss: 0.6858, test_loss: 0.9629, test_f1: 0.5590
##################ITERATION #5 ****************************************
 epoch: 0, train_loss: 1.3570, test_loss: 1.3809, test_f1: 0.2942
 epoch: 1, train_loss: 1.2450, test_loss: 1.3037, test_f1: 0.3369
 epoch: 2, train_loss: 1.1908, test_loss: 1.2452, test_f1: 0.3358
 epoch: 3, train_loss: 1.1451, test_loss: 1.2187, test_f1: 0.3538
 epoch: 4, train_loss: 1.1381, test_loss: 1.1919, test_f1: 0.4071
 epoch: 5, train_loss: 1.1110, test_loss: 1.1431, test_f1: 0.4247
 epoch: 6, train_loss: 1.0691, test_loss: 1.1287, test_f1: 0.4352
 epoch: 7, train_loss: 1.0703, test_loss: 1.1327, test_f1: 0.4538
 epoch: 8, train_loss: 1.0499, test_loss: 1.1044, test_f1: 0.4590
 epoch: 9, train_loss: 1.0300, test_loss: 1.0724, test_f1: 0.4887
 epoch: 10, train_loss: 1.0074, test_loss: 1.0845, test_f1: 0.4586
 epoch: 11, train_loss: 0.9852, test_loss: 1.0501, test_f1: 0.5127
 epoch: 12, train_loss: 0.9621, test_loss: 1.0576, test_f1: 0.5337
 epoch: 13, train_loss: 0.9590, test_loss: 1.0367, test_f1: 0.5094
 epoch: 14, train_loss: 0.9264, test_loss: 1.0496, test_f1: 0.5080
 epoch: 15, train_loss: 0.9199, test_loss: 1.0919, test_f1: 0.4946
 epoch: 16, train_loss: 0.9110, test_loss: 1.0546, test_f1: 0.5233
 epoch: 17, train_loss: 0.9098, test_loss: 1.0450, test_f1: 0.5408
 epoch: 18, train_loss: 0.8866, test_loss: 1.1564, test_f1: 0.5306
 epoch: 19, train_loss: 0.8837, test_loss: 0.9799, test_f1: 0.5903
 epoch: 20, train_loss: 0.8621, test_loss: 1.0168, test_f1: 0.5563
 epoch: 21, train_loss: 0.8492, test_loss: 1.0443, test_f1: 0.5416
 epoch: 22, train_loss: 0.8544, test_loss: 1.0428, test_f1: 0.5538
 epoch: 23, train_loss: 0.8342, test_loss: 1.0455, test_f1: 0.5389
 epoch: 24, train_loss: 0.8313, test_loss: 0.9771, test_f1: 0.6096
 epoch: 25, train_loss: 0.8207, test_loss: 0.9955, test_f1: 0.5806
 epoch: 26, train_loss: 0.8135, test_loss: 1.0909, test_f1: 0.5479
 epoch: 27, train_loss: 0.7940, test_loss: 1.1109, test_f1: 0.5419
 epoch: 28, train_loss: 0.8048, test_loss: 1.4677, test_f1: 0.5024
 epoch: 29, train_loss: 0.7948, test_loss: 1.1345, test_f1: 0.5280
 epoch: 30, train_loss: 0.7902, test_loss: 1.0684, test_f1: 0.5407
 epoch: 31, train_loss: 0.7977, test_loss: 1.0987, test_f1: 0.5379
 epoch: 32, train_loss: 0.7856, test_loss: 1.0458, test_f1: 0.5474
 epoch: 33, train_loss: 0.7786, test_loss: 1.1923, test_f1: 0.5429
 epoch: 34, train_loss: 0.7596, test_loss: 1.0175, test_f1: 0.5772
 epoch: 35, train_loss: 0.7833, test_loss: 1.1110, test_f1: 0.5367
 epoch: 36, train_loss: 0.7651, test_loss: 1.0317, test_f1: 0.5577
 epoch: 37, train_loss: 0.7733, test_loss: 1.0882, test_f1: 0.5346
 epoch: 38, train_loss: 0.7495, test_loss: 1.1249, test_f1: 0.5094
 epoch: 39, train_loss: 0.7467, test_loss: 1.0792, test_f1: 0.5395
 epoch: 40, train_loss: 0.7411, test_loss: 1.1510, test_f1: 0.5135
 epoch: 41, train_loss: 0.7253, test_loss: 1.0501, test_f1: 0.5494
 epoch: 42, train_loss: 0.7327, test_loss: 1.3936, test_f1: 0.5067
 epoch: 43, train_loss: 0.7450, test_loss: 1.1429, test_f1: 0.5302
 epoch: 44, train_loss: 0.7422, test_loss: 1.0909, test_f1: 0.5431
 epoch: 45, train_loss: 0.7318, test_loss: 1.0260, test_f1: 0.5710
 epoch: 46, train_loss: 0.7537, test_loss: 1.1630, test_f1: 0.5188
 epoch: 47, train_loss: 0.7371, test_loss: 1.0690, test_f1: 0.5392
 epoch: 48, train_loss: 0.7106, test_loss: 1.0970, test_f1: 0.5482
 epoch: 49, train_loss: 0.6939, test_loss: 1.1585, test_f1: 0.5414
 epoch: 50, train_loss: 0.7086, test_loss: 1.2325, test_f1: 0.5321
 epoch: 51, train_loss: 0.7044, test_loss: 1.1406, test_f1: 0.5386
 epoch: 52, train_loss: 0.6911, test_loss: 1.1312, test_f1: 0.5343
 epoch: 53, train_loss: 0.6911, test_loss: 1.0658, test_f1: 0.5452
 epoch: 54, train_loss: 0.6931, test_loss: 1.1371, test_f1: 0.5336
 epoch: 55, train_loss: 0.6676, test_loss: 1.1991, test_f1: 0.5297
 epoch: 56, train_loss: 0.6956, test_loss: 1.1578, test_f1: 0.5407
 epoch: 57, train_loss: 0.6747, test_loss: 1.1982, test_f1: 0.5383
 epoch: 58, train_loss: 0.6870, test_loss: 1.1238, test_f1: 0.5101
 epoch: 59, train_loss: 0.6827, test_loss: 1.1536, test_f1: 0.5457
 epoch: 60, train_loss: 0.6882, test_loss: 1.2120, test_f1: 0.5391
 epoch: 61, train_loss: 0.7015, test_loss: 1.2602, test_f1: 0.5073
 epoch: 62, train_loss: 0.6825, test_loss: 1.2218, test_f1: 0.5235
 epoch: 63, train_loss: 0.6787, test_loss: 1.2405, test_f1: 0.5193
 epoch: 64, train_loss: 0.6672, test_loss: 1.1869, test_f1: 0.5164
 epoch: 65, train_loss: 0.6654, test_loss: 1.1966, test_f1: 0.5227
 epoch: 66, train_loss: 0.6819, test_loss: 1.2610, test_f1: 0.5146
 epoch: 67, train_loss: 0.6684, test_loss: 1.3042, test_f1: 0.4895
 epoch: 68, train_loss: 0.6537, test_loss: 1.3745, test_f1: 0.4975
 epoch: 69, train_loss: 0.6735, test_loss: 1.3261, test_f1: 0.5125
 epoch: 70, train_loss: 0.6942, test_loss: 1.2706, test_f1: 0.5157
 epoch: 71, train_loss: 0.6733, test_loss: 1.3759, test_f1: 0.4977
 epoch: 72, train_loss: 0.6643, test_loss: 1.2111, test_f1: 0.5372
 epoch: 73, train_loss: 0.6700, test_loss: 1.3683, test_f1: 0.5226
 epoch: 74, train_loss: 0.6652, test_loss: 1.2221, test_f1: 0.5203
 epoch: 75, train_loss: 0.6461, test_loss: 1.3283, test_f1: 0.5177
 epoch: 76, train_loss: 0.6564, test_loss: 1.2807, test_f1: 0.5379
 epoch: 77, train_loss: 0.6555, test_loss: 1.2908, test_f1: 0.5240
 epoch: 78, train_loss: 0.6497, test_loss: 1.3006, test_f1: 0.5185
 epoch: 79, train_loss: 0.6538, test_loss: 1.3339, test_f1: 0.5065
 epoch: 80, train_loss: 0.6371, test_loss: 1.1840, test_f1: 0.5545
 epoch: 81, train_loss: 0.6558, test_loss: 1.3686, test_f1: 0.5042
 epoch: 82, train_loss: 0.6641, test_loss: 1.2848, test_f1: 0.5102
 epoch: 83, train_loss: 0.6462, test_loss: 1.2852, test_f1: 0.5345
 epoch: 84, train_loss: 0.6438, test_loss: 1.4203, test_f1: 0.5207
 epoch: 85, train_loss: 0.6552, test_loss: 1.3106, test_f1: 0.5291
 epoch: 86, train_loss: 0.6488, test_loss: 1.4286, test_f1: 0.4841
 epoch: 87, train_loss: 0.6556, test_loss: 1.3784, test_f1: 0.5266
 epoch: 88, train_loss: 0.6513, test_loss: 1.2997, test_f1: 0.5472
 epoch: 89, train_loss: 0.6524, test_loss: 1.4096, test_f1: 0.5173
 epoch: 90, train_loss: 0.6355, test_loss: 1.3528, test_f1: 0.5343
 epoch: 91, train_loss: 0.6439, test_loss: 1.2615, test_f1: 0.5391
 epoch: 92, train_loss: 0.6436, test_loss: 1.3818, test_f1: 0.5289
 epoch: 93, train_loss: 0.6658, test_loss: 1.2987, test_f1: 0.5416
 epoch: 94, train_loss: 0.6478, test_loss: 1.2826, test_f1: 0.5530
 epoch: 95, train_loss: 0.6505, test_loss: 1.3977, test_f1: 0.5252
 epoch: 96, train_loss: 0.6569, test_loss: 1.3711, test_f1: 0.5169
 epoch: 97, train_loss: 0.6428, test_loss: 1.4663, test_f1: 0.4907
 epoch: 98, train_loss: 0.6319, test_loss: 1.3437, test_f1: 0.5092
 epoch: 99, train_loss: 0.6311, test_loss: 1.3477, test_f1: 0.5383
##################ITERATION #6 ****************************************
 epoch: 0, train_loss: 1.6797, test_loss: 1.3465, test_f1: 0.2281
 epoch: 1, train_loss: 1.2746, test_loss: 1.3424, test_f1: 0.3302
 epoch: 2, train_loss: 1.2172, test_loss: 1.2468, test_f1: 0.3229
 epoch: 3, train_loss: 1.2044, test_loss: 1.2326, test_f1: 0.3645
 epoch: 4, train_loss: 1.1393, test_loss: 1.2047, test_f1: 0.3938
 epoch: 5, train_loss: 1.1159, test_loss: 1.1687, test_f1: 0.4391
 epoch: 6, train_loss: 1.0791, test_loss: 1.1557, test_f1: 0.4587
 epoch: 7, train_loss: 1.0402, test_loss: 1.1292, test_f1: 0.4692
 epoch: 8, train_loss: 1.0222, test_loss: 1.0919, test_f1: 0.4948
 epoch: 9, train_loss: 1.0098, test_loss: 1.0941, test_f1: 0.4954
 epoch: 10, train_loss: 0.9829, test_loss: 1.0886, test_f1: 0.5211
 epoch: 11, train_loss: 0.9652, test_loss: 1.1156, test_f1: 0.5032
 epoch: 12, train_loss: 0.9403, test_loss: 1.0800, test_f1: 0.5429
 epoch: 13, train_loss: 0.9325, test_loss: 1.0964, test_f1: 0.5540
 epoch: 14, train_loss: 0.9150, test_loss: 1.0937, test_f1: 0.5257
 epoch: 15, train_loss: 0.8952, test_loss: 1.0811, test_f1: 0.5470
 epoch: 16, train_loss: 0.8934, test_loss: 1.0914, test_f1: 0.5454
 epoch: 17, train_loss: 0.8964, test_loss: 1.0864, test_f1: 0.5765
 epoch: 18, train_loss: 0.8965, test_loss: 1.0803, test_f1: 0.5502
 epoch: 19, train_loss: 0.8895, test_loss: 2.1204, test_f1: 0.3467
 epoch: 20, train_loss: 0.8711, test_loss: 1.0669, test_f1: 0.5701
 epoch: 21, train_loss: 0.8562, test_loss: 1.0709, test_f1: 0.5699
 epoch: 22, train_loss: 0.8489, test_loss: 1.0319, test_f1: 0.5697
 epoch: 23, train_loss: 0.8356, test_loss: 1.0331, test_f1: 0.5770
 epoch: 24, train_loss: 0.8389, test_loss: 1.1879, test_f1: 0.5116
 epoch: 25, train_loss: 0.8342, test_loss: 1.0669, test_f1: 0.5632
 epoch: 26, train_loss: 0.8287, test_loss: 1.0698, test_f1: 0.5487
 epoch: 27, train_loss: 0.8326, test_loss: 1.0360, test_f1: 0.5836
 epoch: 28, train_loss: 0.8013, test_loss: 1.0459, test_f1: 0.5674
 epoch: 29, train_loss: 0.8059, test_loss: 1.0277, test_f1: 0.5343
 epoch: 30, train_loss: 0.8140, test_loss: 1.0312, test_f1: 0.5602
 epoch: 31, train_loss: 0.7883, test_loss: 1.0343, test_f1: 0.5570
 epoch: 32, train_loss: 0.7956, test_loss: 1.0131, test_f1: 0.5460
 epoch: 33, train_loss: 0.7858, test_loss: 1.0370, test_f1: 0.5540
 epoch: 34, train_loss: 0.7997, test_loss: 1.1147, test_f1: 0.5173
 epoch: 35, train_loss: 0.7864, test_loss: 0.9980, test_f1: 0.5592
 epoch: 36, train_loss: 0.7728, test_loss: 1.1534, test_f1: 0.5026
 epoch: 37, train_loss: 0.7724, test_loss: 1.0799, test_f1: 0.5400
 epoch: 38, train_loss: 0.7545, test_loss: 1.1080, test_f1: 0.5427
 epoch: 39, train_loss: 0.7499, test_loss: 1.0761, test_f1: 0.5347
 epoch: 40, train_loss: 0.7599, test_loss: 1.1247, test_f1: 0.5525
 epoch: 41, train_loss: 0.7693, test_loss: 1.2339, test_f1: 0.5232
 epoch: 42, train_loss: 0.7477, test_loss: 1.1682, test_f1: 0.5464
 epoch: 43, train_loss: 0.7634, test_loss: 1.3872, test_f1: 0.5236
 epoch: 44, train_loss: 0.7401, test_loss: 1.0883, test_f1: 0.5812
 epoch: 45, train_loss: 0.7478, test_loss: 1.1194, test_f1: 0.5900
 epoch: 46, train_loss: 0.7328, test_loss: 1.4309, test_f1: 0.4885
 epoch: 47, train_loss: 0.7309, test_loss: 1.2539, test_f1: 0.5421
 epoch: 48, train_loss: 0.7354, test_loss: 1.2694, test_f1: 0.5078
 epoch: 49, train_loss: 0.7104, test_loss: 1.1427, test_f1: 0.5778
 epoch: 50, train_loss: 0.7124, test_loss: 1.2807, test_f1: 0.5667
 epoch: 51, train_loss: 0.7149, test_loss: 1.1993, test_f1: 0.5731
 epoch: 52, train_loss: 0.7181, test_loss: 1.1982, test_f1: 0.5585
 epoch: 53, train_loss: 0.6958, test_loss: 1.2258, test_f1: 0.5712
 epoch: 54, train_loss: 0.6963, test_loss: 1.2886, test_f1: 0.5638
 epoch: 55, train_loss: 0.6814, test_loss: 1.2627, test_f1: 0.5597
 epoch: 56, train_loss: 0.7036, test_loss: 1.2828, test_f1: 0.5590
 epoch: 57, train_loss: 0.6906, test_loss: 1.3530, test_f1: 0.5532
 epoch: 58, train_loss: 0.6903, test_loss: 1.2262, test_f1: 0.5729
 epoch: 59, train_loss: 0.6929, test_loss: 1.2922, test_f1: 0.5738
 epoch: 60, train_loss: 0.6900, test_loss: 1.2242, test_f1: 0.5769
 epoch: 61, train_loss: 0.6925, test_loss: 1.2474, test_f1: 0.5680
 epoch: 62, train_loss: 0.6826, test_loss: 1.3508, test_f1: 0.5648
 epoch: 63, train_loss: 0.6753, test_loss: 1.3003, test_f1: 0.5718
 epoch: 64, train_loss: 0.6729, test_loss: 1.2674, test_f1: 0.5861
 epoch: 65, train_loss: 0.6813, test_loss: 1.3714, test_f1: 0.5483
 epoch: 66, train_loss: 0.6698, test_loss: 1.2984, test_f1: 0.5754
 epoch: 67, train_loss: 0.6828, test_loss: 1.3543, test_f1: 0.5528
 epoch: 68, train_loss: 0.6739, test_loss: 1.3436, test_f1: 0.5836
 epoch: 69, train_loss: 0.6700, test_loss: 1.2313, test_f1: 0.5817
 epoch: 70, train_loss: 0.6534, test_loss: 1.2768, test_f1: 0.5854
 epoch: 71, train_loss: 0.6764, test_loss: 1.3665, test_f1: 0.5705
 epoch: 72, train_loss: 0.6725, test_loss: 1.2928, test_f1: 0.5704
 epoch: 73, train_loss: 0.6721, test_loss: 1.2811, test_f1: 0.5773
 epoch: 74, train_loss: 0.6515, test_loss: 1.3170, test_f1: 0.5733
 epoch: 75, train_loss: 0.6483, test_loss: 1.3531, test_f1: 0.5685
 epoch: 76, train_loss: 0.6426, test_loss: 1.2885, test_f1: 0.5969
 epoch: 77, train_loss: 0.6635, test_loss: 1.3569, test_f1: 0.5842
 epoch: 78, train_loss: 0.6538, test_loss: 1.3036, test_f1: 0.5807
 epoch: 79, train_loss: 0.6532, test_loss: 1.4187, test_f1: 0.5608
 epoch: 80, train_loss: 0.6615, test_loss: 1.4192, test_f1: 0.5854
 epoch: 81, train_loss: 0.6436, test_loss: 1.3909, test_f1: 0.5686
 epoch: 82, train_loss: 0.6550, test_loss: 1.4055, test_f1: 0.5832
 epoch: 83, train_loss: 0.6529, test_loss: 1.3546, test_f1: 0.5802
 epoch: 84, train_loss: 0.6442, test_loss: 1.3819, test_f1: 0.5851
 epoch: 85, train_loss: 0.6400, test_loss: 1.4085, test_f1: 0.6081
 epoch: 86, train_loss: 0.6408, test_loss: 1.4132, test_f1: 0.5832
 epoch: 87, train_loss: 0.6544, test_loss: 1.4167, test_f1: 0.5763
 epoch: 88, train_loss: 0.6481, test_loss: 1.4023, test_f1: 0.5900
 epoch: 89, train_loss: 0.6538, test_loss: 1.3635, test_f1: 0.5885
 epoch: 90, train_loss: 0.6365, test_loss: 1.4457, test_f1: 0.5884
 epoch: 91, train_loss: 0.6353, test_loss: 1.3714, test_f1: 0.5998
 epoch: 92, train_loss: 0.6458, test_loss: 1.4354, test_f1: 0.5661
 epoch: 93, train_loss: 0.6394, test_loss: 1.4322, test_f1: 0.6048
 epoch: 94, train_loss: 0.6357, test_loss: 1.4066, test_f1: 0.5445
 epoch: 95, train_loss: 0.6299, test_loss: 1.4355, test_f1: 0.5826
 epoch: 96, train_loss: 0.6251, test_loss: 1.3687, test_f1: 0.5963
 epoch: 97, train_loss: 0.6233, test_loss: 1.4185, test_f1: 0.5623
 epoch: 98, train_loss: 0.6220, test_loss: 1.4160, test_f1: 0.5802
 epoch: 99, train_loss: 0.6368, test_loss: 1.3337, test_f1: 0.5946
##################ITERATION #7 ****************************************
 epoch: 0, train_loss: 1.3505, test_loss: 1.4097, test_f1: 0.2833
 epoch: 1, train_loss: 1.1367, test_loss: 1.3050, test_f1: 0.3265
 epoch: 2, train_loss: 1.1025, test_loss: 1.1702, test_f1: 0.4007
 epoch: 3, train_loss: 1.0804, test_loss: 1.1250, test_f1: 0.4233
 epoch: 4, train_loss: 1.0615, test_loss: 1.0828, test_f1: 0.4753
 epoch: 5, train_loss: 1.0286, test_loss: 1.0781, test_f1: 0.4849
 epoch: 6, train_loss: 1.0228, test_loss: 1.0999, test_f1: 0.4695
 epoch: 7, train_loss: 0.9993, test_loss: 1.0877, test_f1: 0.4882
 epoch: 8, train_loss: 0.9915, test_loss: 1.0867, test_f1: 0.4769
 epoch: 9, train_loss: 0.9747, test_loss: 1.0516, test_f1: 0.4959
 epoch: 10, train_loss: 0.9785, test_loss: 1.0646, test_f1: 0.5133
 epoch: 11, train_loss: 0.9643, test_loss: 1.0761, test_f1: 0.5119
 epoch: 12, train_loss: 0.9664, test_loss: 1.0567, test_f1: 0.5368
 epoch: 13, train_loss: 0.9172, test_loss: 1.0210, test_f1: 0.5599
 epoch: 14, train_loss: 0.9209, test_loss: 1.0062, test_f1: 0.5188
 epoch: 15, train_loss: 0.9103, test_loss: 1.0342, test_f1: 0.5300
 epoch: 16, train_loss: 0.8956, test_loss: 1.0288, test_f1: 0.5627
 epoch: 17, train_loss: 0.9043, test_loss: 1.0961, test_f1: 0.5204
 epoch: 18, train_loss: 0.8709, test_loss: 1.0238, test_f1: 0.5441
 epoch: 19, train_loss: 0.8759, test_loss: 1.0648, test_f1: 0.5397
 epoch: 20, train_loss: 0.8648, test_loss: 1.1268, test_f1: 0.5163
 epoch: 21, train_loss: 0.8665, test_loss: 0.9896, test_f1: 0.5647
 epoch: 22, train_loss: 0.8366, test_loss: 1.0237, test_f1: 0.5358
 epoch: 23, train_loss: 0.8562, test_loss: 1.0224, test_f1: 0.5500
 epoch: 24, train_loss: 0.8562, test_loss: 1.0690, test_f1: 0.5087
 epoch: 25, train_loss: 0.8326, test_loss: 0.9844, test_f1: 0.5766
 epoch: 26, train_loss: 0.8231, test_loss: 0.9835, test_f1: 0.5649
 epoch: 27, train_loss: 0.8292, test_loss: 1.0310, test_f1: 0.5237
 epoch: 28, train_loss: 0.8217, test_loss: 0.9808, test_f1: 0.5778
 epoch: 29, train_loss: 0.8023, test_loss: 0.9861, test_f1: 0.5706
 epoch: 30, train_loss: 0.8047, test_loss: 1.0185, test_f1: 0.5702
 epoch: 31, train_loss: 0.8112, test_loss: 1.0229, test_f1: 0.5264
 epoch: 32, train_loss: 0.8139, test_loss: 0.9848, test_f1: 0.5705
 epoch: 33, train_loss: 0.8049, test_loss: 0.9951, test_f1: 0.5702
 epoch: 34, train_loss: 0.7919, test_loss: 1.0472, test_f1: 0.5330
 epoch: 35, train_loss: 0.7953, test_loss: 1.0196, test_f1: 0.5551
 epoch: 36, train_loss: 0.7769, test_loss: 1.0363, test_f1: 0.5409
 epoch: 37, train_loss: 0.7740, test_loss: 1.0922, test_f1: 0.5512
 epoch: 38, train_loss: 0.7713, test_loss: 1.0120, test_f1: 0.5606
 epoch: 39, train_loss: 0.7803, test_loss: 1.0712, test_f1: 0.5389
 epoch: 40, train_loss: 0.7586, test_loss: 1.2168, test_f1: 0.5176
 epoch: 41, train_loss: 0.7701, test_loss: 1.0864, test_f1: 0.5459
 epoch: 42, train_loss: 0.7494, test_loss: 1.0359, test_f1: 0.5648
 epoch: 43, train_loss: 0.7635, test_loss: 1.1135, test_f1: 0.5214
 epoch: 44, train_loss: 0.7590, test_loss: 1.0425, test_f1: 0.5521
 epoch: 45, train_loss: 0.7739, test_loss: 1.0228, test_f1: 0.5496
 epoch: 46, train_loss: 0.7675, test_loss: 1.0826, test_f1: 0.5618
 epoch: 47, train_loss: 0.7472, test_loss: 1.1437, test_f1: 0.5725
 epoch: 48, train_loss: 0.7666, test_loss: 1.1086, test_f1: 0.5588
 epoch: 49, train_loss: 0.7319, test_loss: 1.0638, test_f1: 0.5633
 epoch: 50, train_loss: 0.7409, test_loss: 1.0380, test_f1: 0.5778
 epoch: 51, train_loss: 0.7400, test_loss: 1.0797, test_f1: 0.5564
 epoch: 52, train_loss: 0.7240, test_loss: 1.1155, test_f1: 0.5467
 epoch: 53, train_loss: 0.7471, test_loss: 1.0027, test_f1: 0.5769
 epoch: 54, train_loss: 0.7260, test_loss: 1.0766, test_f1: 0.5509
 epoch: 55, train_loss: 0.7173, test_loss: 1.0800, test_f1: 0.5467
 epoch: 56, train_loss: 0.7250, test_loss: 1.0883, test_f1: 0.5510
 epoch: 57, train_loss: 0.7118, test_loss: 1.0642, test_f1: 0.5647
 epoch: 58, train_loss: 0.7080, test_loss: 1.1167, test_f1: 0.5444
 epoch: 59, train_loss: 0.6933, test_loss: 1.1534, test_f1: 0.5389
 epoch: 60, train_loss: 0.6956, test_loss: 1.1175, test_f1: 0.5362
 epoch: 61, train_loss: 0.7187, test_loss: 1.1208, test_f1: 0.5409
 epoch: 62, train_loss: 0.7080, test_loss: 1.1269, test_f1: 0.5421
 epoch: 63, train_loss: 0.7169, test_loss: 1.1711, test_f1: 0.5415
 epoch: 64, train_loss: 0.7208, test_loss: 1.1161, test_f1: 0.5398
 epoch: 65, train_loss: 0.7028, test_loss: 1.1045, test_f1: 0.5423
 epoch: 66, train_loss: 0.7085, test_loss: 1.1566, test_f1: 0.5335
 epoch: 67, train_loss: 0.7010, test_loss: 1.0861, test_f1: 0.5581
 epoch: 68, train_loss: 0.6960, test_loss: 1.1540, test_f1: 0.5302
 epoch: 69, train_loss: 0.7065, test_loss: 1.1605, test_f1: 0.5368
 epoch: 70, train_loss: 0.6872, test_loss: 1.1536, test_f1: 0.5399
 epoch: 71, train_loss: 0.7012, test_loss: 1.1758, test_f1: 0.5386
 epoch: 72, train_loss: 0.6949, test_loss: 1.0922, test_f1: 0.5406
 epoch: 73, train_loss: 0.6909, test_loss: 1.2155, test_f1: 0.5199
 epoch: 74, train_loss: 0.6915, test_loss: 1.2154, test_f1: 0.5204
 epoch: 75, train_loss: 0.6941, test_loss: 1.1960, test_f1: 0.5086
 epoch: 76, train_loss: 0.6900, test_loss: 1.1849, test_f1: 0.5354
 epoch: 77, train_loss: 0.6941, test_loss: 1.1876, test_f1: 0.5257
 epoch: 78, train_loss: 0.7015, test_loss: 1.1979, test_f1: 0.5320
 epoch: 79, train_loss: 0.6771, test_loss: 1.2229, test_f1: 0.5602
 epoch: 80, train_loss: 0.7043, test_loss: 1.2413, test_f1: 0.5194
 epoch: 81, train_loss: 0.6761, test_loss: 1.2078, test_f1: 0.5481
 epoch: 82, train_loss: 0.6798, test_loss: 1.3006, test_f1: 0.5294
 epoch: 83, train_loss: 0.6863, test_loss: 1.2498, test_f1: 0.5338
 epoch: 84, train_loss: 0.6849, test_loss: 1.2376, test_f1: 0.5235
 epoch: 85, train_loss: 0.6800, test_loss: 1.1783, test_f1: 0.5261
 epoch: 86, train_loss: 0.6641, test_loss: 1.3304, test_f1: 0.5181
 epoch: 87, train_loss: 0.6622, test_loss: 1.2239, test_f1: 0.5254
 epoch: 88, train_loss: 0.6663, test_loss: 1.1635, test_f1: 0.5108
 epoch: 89, train_loss: 0.6559, test_loss: 1.3945, test_f1: 0.5278
 epoch: 90, train_loss: 0.6436, test_loss: 1.2057, test_f1: 0.5351
 epoch: 91, train_loss: 0.6876, test_loss: 1.2669, test_f1: 0.5233
 epoch: 92, train_loss: 0.6726, test_loss: 1.1725, test_f1: 0.5303
 epoch: 93, train_loss: 0.6682, test_loss: 1.3943, test_f1: 0.5134
 epoch: 94, train_loss: 0.6625, test_loss: 1.2432, test_f1: 0.5535
 epoch: 95, train_loss: 0.6565, test_loss: 1.3070, test_f1: 0.5486
 epoch: 96, train_loss: 0.6710, test_loss: 1.2316, test_f1: 0.5557
 epoch: 97, train_loss: 0.6874, test_loss: 1.3320, test_f1: 0.5325
 epoch: 98, train_loss: 0.6643, test_loss: 1.3051, test_f1: 0.5382
 epoch: 99, train_loss: 0.6589, test_loss: 1.3146, test_f1: 0.5320
##################ITERATION #8 ****************************************
 epoch: 0, train_loss: 1.3405, test_loss: 1.4067, test_f1: 0.2281
 epoch: 1, train_loss: 1.1467, test_loss: 1.2567, test_f1: 0.2631
 epoch: 2, train_loss: 1.0910, test_loss: 1.1164, test_f1: 0.5115
 epoch: 3, train_loss: 1.0484, test_loss: 1.0547, test_f1: 0.5509
 epoch: 4, train_loss: 1.0395, test_loss: 1.0572, test_f1: 0.5236
 epoch: 5, train_loss: 0.9945, test_loss: 1.0300, test_f1: 0.5341
 epoch: 6, train_loss: 0.9749, test_loss: 1.0286, test_f1: 0.5422
 epoch: 7, train_loss: 0.9613, test_loss: 1.0236, test_f1: 0.5577
 epoch: 8, train_loss: 0.9488, test_loss: 1.0173, test_f1: 0.5471
 epoch: 9, train_loss: 0.9520, test_loss: 0.9910, test_f1: 0.5554
 epoch: 10, train_loss: 0.9233, test_loss: 1.0198, test_f1: 0.5201
 epoch: 11, train_loss: 0.9135, test_loss: 0.9966, test_f1: 0.5536
 epoch: 12, train_loss: 0.8945, test_loss: 1.0159, test_f1: 0.5440
 epoch: 13, train_loss: 0.8923, test_loss: 0.9933, test_f1: 0.5477
 epoch: 14, train_loss: 0.8836, test_loss: 0.9860, test_f1: 0.5705
 epoch: 15, train_loss: 0.8837, test_loss: 0.9941, test_f1: 0.5453
 epoch: 16, train_loss: 0.8765, test_loss: 0.9964, test_f1: 0.5263
 epoch: 17, train_loss: 0.8542, test_loss: 1.0118, test_f1: 0.5433
 epoch: 18, train_loss: 0.8705, test_loss: 1.0088, test_f1: 0.5457
 epoch: 19, train_loss: 0.8540, test_loss: 0.9724, test_f1: 0.5549
 epoch: 20, train_loss: 0.8534, test_loss: 0.9789, test_f1: 0.5561
 epoch: 21, train_loss: 0.8426, test_loss: 0.9815, test_f1: 0.5727
 epoch: 22, train_loss: 0.8463, test_loss: 0.9699, test_f1: 0.5860
 epoch: 23, train_loss: 0.8283, test_loss: 1.0170, test_f1: 0.5450
 epoch: 24, train_loss: 0.8353, test_loss: 0.9992, test_f1: 0.5668
 epoch: 25, train_loss: 0.8178, test_loss: 0.9854, test_f1: 0.5366
 epoch: 26, train_loss: 0.8213, test_loss: 0.9810, test_f1: 0.5771
 epoch: 27, train_loss: 0.8231, test_loss: 0.9980, test_f1: 0.5762
 epoch: 28, train_loss: 0.8252, test_loss: 1.0357, test_f1: 0.5771
 epoch: 29, train_loss: 0.8205, test_loss: 1.0307, test_f1: 0.5640
 epoch: 30, train_loss: 0.8025, test_loss: 1.0517, test_f1: 0.5584
 epoch: 31, train_loss: 0.7984, test_loss: 1.0115, test_f1: 0.5784
 epoch: 32, train_loss: 0.8100, test_loss: 1.0187, test_f1: 0.5739
 epoch: 33, train_loss: 0.7971, test_loss: 1.0697, test_f1: 0.5470
 epoch: 34, train_loss: 0.7933, test_loss: 1.1422, test_f1: 0.5842
 epoch: 35, train_loss: 0.7825, test_loss: 1.0395, test_f1: 0.5684
 epoch: 36, train_loss: 0.7987, test_loss: 1.0486, test_f1: 0.5711
 epoch: 37, train_loss: 0.7849, test_loss: 1.0149, test_f1: 0.5985
 epoch: 38, train_loss: 0.7639, test_loss: 1.0503, test_f1: 0.6113
 epoch: 39, train_loss: 0.7762, test_loss: 1.0363, test_f1: 0.5677
 epoch: 40, train_loss: 0.7598, test_loss: 1.0335, test_f1: 0.5673
 epoch: 41, train_loss: 0.7596, test_loss: 1.0375, test_f1: 0.6001
 epoch: 42, train_loss: 0.7707, test_loss: 1.0073, test_f1: 0.5975
 epoch: 43, train_loss: 0.7633, test_loss: 1.1040, test_f1: 0.5900
 epoch: 44, train_loss: 0.7473, test_loss: 1.0212, test_f1: 0.5897
 epoch: 45, train_loss: 0.7623, test_loss: 1.0607, test_f1: 0.5967
 epoch: 46, train_loss: 0.7774, test_loss: 1.0842, test_f1: 0.6072
 epoch: 47, train_loss: 0.7556, test_loss: 1.0528, test_f1: 0.5287
 epoch: 48, train_loss: 0.7631, test_loss: 1.0107, test_f1: 0.5526
 epoch: 49, train_loss: 0.7490, test_loss: 1.0959, test_f1: 0.5724
 epoch: 50, train_loss: 0.7656, test_loss: 1.0739, test_f1: 0.5780
 epoch: 51, train_loss: 0.7392, test_loss: 1.0638, test_f1: 0.5548
 epoch: 52, train_loss: 0.7479, test_loss: 1.0668, test_f1: 0.5894
 epoch: 53, train_loss: 0.7317, test_loss: 1.0831, test_f1: 0.5918
 epoch: 54, train_loss: 0.7292, test_loss: 1.0534, test_f1: 0.5742
 epoch: 55, train_loss: 0.7112, test_loss: 1.0318, test_f1: 0.5700
 epoch: 56, train_loss: 0.7138, test_loss: 1.0794, test_f1: 0.5864
 epoch: 57, train_loss: 0.7183, test_loss: 1.0599, test_f1: 0.5851
 epoch: 58, train_loss: 0.7095, test_loss: 1.0382, test_f1: 0.5978
 epoch: 59, train_loss: 0.7138, test_loss: 1.0962, test_f1: 0.6026
 epoch: 60, train_loss: 0.7127, test_loss: 1.0548, test_f1: 0.5839
 epoch: 61, train_loss: 0.7235, test_loss: 1.0514, test_f1: 0.5688
 epoch: 62, train_loss: 0.7152, test_loss: 1.0588, test_f1: 0.5752
 epoch: 63, train_loss: 0.7000, test_loss: 1.1028, test_f1: 0.6016
 epoch: 64, train_loss: 0.7065, test_loss: 1.0342, test_f1: 0.5996
 epoch: 65, train_loss: 0.7248, test_loss: 1.0758, test_f1: 0.5840
 epoch: 66, train_loss: 0.6986, test_loss: 1.0538, test_f1: 0.5901
 epoch: 67, train_loss: 0.7041, test_loss: 1.1189, test_f1: 0.6001
 epoch: 68, train_loss: 0.7026, test_loss: 1.0264, test_f1: 0.5819
 epoch: 69, train_loss: 0.7089, test_loss: 1.0935, test_f1: 0.5925
 epoch: 70, train_loss: 0.6905, test_loss: 1.0570, test_f1: 0.5869
 epoch: 71, train_loss: 0.6910, test_loss: 1.0865, test_f1: 0.5900
 epoch: 72, train_loss: 0.7053, test_loss: 1.1098, test_f1: 0.5885
 epoch: 73, train_loss: 0.7030, test_loss: 1.0611, test_f1: 0.5736
 epoch: 74, train_loss: 0.6894, test_loss: 1.0490, test_f1: 0.5755
 epoch: 75, train_loss: 0.6935, test_loss: 1.1425, test_f1: 0.5908
 epoch: 76, train_loss: 0.6993, test_loss: 1.1168, test_f1: 0.5956
 epoch: 77, train_loss: 0.7054, test_loss: 1.0702, test_f1: 0.5878
 epoch: 78, train_loss: 0.6868, test_loss: 1.0475, test_f1: 0.5909
 epoch: 79, train_loss: 0.7102, test_loss: 1.0545, test_f1: 0.5928
 epoch: 80, train_loss: 0.7040, test_loss: 1.0976, test_f1: 0.5794
 epoch: 81, train_loss: 0.6860, test_loss: 1.1023, test_f1: 0.5951
 epoch: 82, train_loss: 0.6980, test_loss: 1.0772, test_f1: 0.5823
 epoch: 83, train_loss: 0.6819, test_loss: 1.1161, test_f1: 0.5728
 epoch: 84, train_loss: 0.6882, test_loss: 1.0611, test_f1: 0.5865
 epoch: 85, train_loss: 0.6867, test_loss: 1.0625, test_f1: 0.5941
 epoch: 86, train_loss: 0.6804, test_loss: 1.1296, test_f1: 0.5959
 epoch: 87, train_loss: 0.6823, test_loss: 1.1221, test_f1: 0.5929
 epoch: 88, train_loss: 0.6862, test_loss: 1.0808, test_f1: 0.5478
 epoch: 89, train_loss: 0.6876, test_loss: 1.1373, test_f1: 0.5638
 epoch: 90, train_loss: 0.6746, test_loss: 1.1344, test_f1: 0.5807
 epoch: 91, train_loss: 0.6712, test_loss: 1.1716, test_f1: 0.5893
 epoch: 92, train_loss: 0.6978, test_loss: 1.1600, test_f1: 0.5786
 epoch: 93, train_loss: 0.6970, test_loss: 1.2582, test_f1: 0.5749
 epoch: 94, train_loss: 0.6662, test_loss: 1.1116, test_f1: 0.5967
 epoch: 95, train_loss: 0.6724, test_loss: 1.1094, test_f1: 0.5997
 epoch: 96, train_loss: 0.6812, test_loss: 1.1412, test_f1: 0.5988
 epoch: 97, train_loss: 0.6870, test_loss: 1.1271, test_f1: 0.5620
 epoch: 98, train_loss: 0.6765, test_loss: 1.0874, test_f1: 0.5917
 epoch: 99, train_loss: 0.6844, test_loss: 1.0986, test_f1: 0.6086
##################ITERATION #9 ****************************************
 epoch: 0, train_loss: 1.3299, test_loss: 1.4727, test_f1: 0.2281
 epoch: 1, train_loss: 1.1028, test_loss: 1.3728, test_f1: 0.3254
 epoch: 2, train_loss: 1.0665, test_loss: 1.2369, test_f1: 0.3775
 epoch: 3, train_loss: 1.0527, test_loss: 1.0999, test_f1: 0.4313
 epoch: 4, train_loss: 1.0106, test_loss: 1.1099, test_f1: 0.4660
 epoch: 5, train_loss: 0.9866, test_loss: 1.0828, test_f1: 0.5118
 epoch: 6, train_loss: 0.9733, test_loss: 1.0646, test_f1: 0.4998
 epoch: 7, train_loss: 0.9378, test_loss: 1.0269, test_f1: 0.5292
 epoch: 8, train_loss: 0.9318, test_loss: 1.0481, test_f1: 0.5352
 epoch: 9, train_loss: 0.9318, test_loss: 1.0522, test_f1: 0.5134
 epoch: 10, train_loss: 0.9194, test_loss: 1.0108, test_f1: 0.5694
 epoch: 11, train_loss: 0.9043, test_loss: 0.9932, test_f1: 0.5671
 epoch: 12, train_loss: 0.8749, test_loss: 0.9940, test_f1: 0.5687
 epoch: 13, train_loss: 0.8896, test_loss: 1.0178, test_f1: 0.5310
 epoch: 14, train_loss: 0.8639, test_loss: 0.9741, test_f1: 0.5656
 epoch: 15, train_loss: 0.8544, test_loss: 0.9714, test_f1: 0.5851
 epoch: 16, train_loss: 0.8807, test_loss: 0.9791, test_f1: 0.5588
 epoch: 17, train_loss: 0.8465, test_loss: 0.9821, test_f1: 0.5606
 epoch: 18, train_loss: 0.8379, test_loss: 0.9759, test_f1: 0.5734
 epoch: 19, train_loss: 0.8435, test_loss: 0.9502, test_f1: 0.5981
 epoch: 20, train_loss: 0.8264, test_loss: 0.9719, test_f1: 0.6059
 epoch: 21, train_loss: 0.8223, test_loss: 0.9787, test_f1: 0.5743
 epoch: 22, train_loss: 0.8165, test_loss: 1.0007, test_f1: 0.6046
 epoch: 23, train_loss: 0.8094, test_loss: 0.9599, test_f1: 0.5768
 epoch: 24, train_loss: 0.8025, test_loss: 0.9682, test_f1: 0.5874
 epoch: 25, train_loss: 0.7883, test_loss: 0.9749, test_f1: 0.5826
 epoch: 26, train_loss: 0.8002, test_loss: 0.9869, test_f1: 0.5888
 epoch: 27, train_loss: 0.7898, test_loss: 0.9614, test_f1: 0.5799
 epoch: 28, train_loss: 0.7683, test_loss: 0.9466, test_f1: 0.5991
 epoch: 29, train_loss: 0.7580, test_loss: 0.9545, test_f1: 0.6044
 epoch: 30, train_loss: 0.7829, test_loss: 0.9349, test_f1: 0.5989
 epoch: 31, train_loss: 0.7833, test_loss: 0.9584, test_f1: 0.6099
 epoch: 32, train_loss: 0.7719, test_loss: 0.9575, test_f1: 0.6218
 epoch: 33, train_loss: 0.7707, test_loss: 0.9515, test_f1: 0.6074
 epoch: 34, train_loss: 0.7763, test_loss: 0.9207, test_f1: 0.6157
 epoch: 35, train_loss: 0.7508, test_loss: 0.9428, test_f1: 0.5992
 epoch: 36, train_loss: 0.7346, test_loss: 0.9601, test_f1: 0.6137
 epoch: 37, train_loss: 0.7382, test_loss: 0.9813, test_f1: 0.5938
 epoch: 38, train_loss: 0.7457, test_loss: 1.0302, test_f1: 0.6295
 epoch: 39, train_loss: 0.7292, test_loss: 1.0055, test_f1: 0.6097
 epoch: 40, train_loss: 0.7217, test_loss: 1.0151, test_f1: 0.6037
 epoch: 41, train_loss: 0.7440, test_loss: 1.0212, test_f1: 0.5963
 epoch: 42, train_loss: 0.7237, test_loss: 1.0215, test_f1: 0.6043
 epoch: 43, train_loss: 0.7278, test_loss: 1.0182, test_f1: 0.5949
 epoch: 44, train_loss: 0.7264, test_loss: 1.0585, test_f1: 0.5777
 epoch: 45, train_loss: 0.7195, test_loss: 1.0229, test_f1: 0.5611
 epoch: 46, train_loss: 0.7088, test_loss: 1.0123, test_f1: 0.5906
 epoch: 47, train_loss: 0.7356, test_loss: 1.1875, test_f1: 0.5678
 epoch: 48, train_loss: 0.7100, test_loss: 1.0724, test_f1: 0.5775
 epoch: 49, train_loss: 0.7163, test_loss: 1.0207, test_f1: 0.5739
 epoch: 50, train_loss: 0.7034, test_loss: 1.1145, test_f1: 0.5653
 epoch: 51, train_loss: 0.7000, test_loss: 0.9934, test_f1: 0.5793
 epoch: 52, train_loss: 0.6877, test_loss: 1.0429, test_f1: 0.5828
 epoch: 53, train_loss: 0.6851, test_loss: 1.0460, test_f1: 0.5732
 epoch: 54, train_loss: 0.6878, test_loss: 1.0976, test_f1: 0.5570
 epoch: 55, train_loss: 0.6815, test_loss: 1.0729, test_f1: 0.5681
 epoch: 56, train_loss: 0.6951, test_loss: 1.0558, test_f1: 0.6010
 epoch: 57, train_loss: 0.6902, test_loss: 1.0859, test_f1: 0.5559
 epoch: 58, train_loss: 0.6853, test_loss: 1.1072, test_f1: 0.5591
 epoch: 59, train_loss: 0.6719, test_loss: 1.0962, test_f1: 0.5567
 epoch: 60, train_loss: 0.6857, test_loss: 1.0957, test_f1: 0.5708
 epoch: 61, train_loss: 0.6720, test_loss: 1.1901, test_f1: 0.5414
 epoch: 62, train_loss: 0.6870, test_loss: 1.1202, test_f1: 0.5367
 epoch: 63, train_loss: 0.6766, test_loss: 1.0428, test_f1: 0.6056
 epoch: 64, train_loss: 0.6793, test_loss: 1.0680, test_f1: 0.5635
 epoch: 65, train_loss: 0.6789, test_loss: 1.1087, test_f1: 0.5540
 epoch: 66, train_loss: 0.6668, test_loss: 1.0820, test_f1: 0.5756
 epoch: 67, train_loss: 0.6658, test_loss: 1.1538, test_f1: 0.5719
 epoch: 68, train_loss: 0.6604, test_loss: 1.1271, test_f1: 0.5643
 epoch: 69, train_loss: 0.6802, test_loss: 1.1120, test_f1: 0.5717
 epoch: 70, train_loss: 0.6664, test_loss: 1.0634, test_f1: 0.5924
 epoch: 71, train_loss: 0.6558, test_loss: 1.0900, test_f1: 0.5574
 epoch: 72, train_loss: 0.6740, test_loss: 1.1728, test_f1: 0.5585
 epoch: 73, train_loss: 0.6628, test_loss: 1.1560, test_f1: 0.6005
 epoch: 74, train_loss: 0.6508, test_loss: 1.1095, test_f1: 0.5649
 epoch: 75, train_loss: 0.6528, test_loss: 1.1505, test_f1: 0.5567
 epoch: 76, train_loss: 0.6678, test_loss: 1.1667, test_f1: 0.5662
 epoch: 77, train_loss: 0.6613, test_loss: 1.2509, test_f1: 0.5585
 epoch: 78, train_loss: 0.6424, test_loss: 1.1646, test_f1: 0.5605
 epoch: 79, train_loss: 0.6435, test_loss: 1.1864, test_f1: 0.5625
 epoch: 80, train_loss: 0.6479, test_loss: 1.0987, test_f1: 0.5645
 epoch: 81, train_loss: 0.6560, test_loss: 1.1507, test_f1: 0.5811
 epoch: 82, train_loss: 0.6531, test_loss: 1.1432, test_f1: 0.5664
 epoch: 83, train_loss: 0.6547, test_loss: 1.1638, test_f1: 0.5827
 epoch: 84, train_loss: 0.6505, test_loss: 1.2373, test_f1: 0.5376
 epoch: 85, train_loss: 0.6513, test_loss: 1.2350, test_f1: 0.5653
 epoch: 86, train_loss: 0.6497, test_loss: 1.1278, test_f1: 0.5871
 epoch: 87, train_loss: 0.6571, test_loss: 1.2357, test_f1: 0.5539
 epoch: 88, train_loss: 0.6480, test_loss: 1.1185, test_f1: 0.5707
 epoch: 89, train_loss: 0.6477, test_loss: 1.2149, test_f1: 0.5700
 epoch: 90, train_loss: 0.6598, test_loss: 1.1342, test_f1: 0.5475
 epoch: 91, train_loss: 0.6388, test_loss: 1.1367, test_f1: 0.5624
 epoch: 92, train_loss: 0.6414, test_loss: 1.1640, test_f1: 0.5636
 epoch: 93, train_loss: 0.6429, test_loss: 1.1494, test_f1: 0.5827
 epoch: 94, train_loss: 0.6235, test_loss: 1.1251, test_f1: 0.5871
 epoch: 95, train_loss: 0.6466, test_loss: 1.1283, test_f1: 0.5922
 epoch: 96, train_loss: 0.6269, test_loss: 1.1314, test_f1: 0.5719
 epoch: 97, train_loss: 0.6414, test_loss: 1.2821, test_f1: 0.5674
 epoch: 98, train_loss: 0.6476, test_loss: 1.1194, test_f1: 0.5774
 epoch: 99, train_loss: 0.6307, test_loss: 1.2421, test_f1: 0.5750

Training completed in 410.15 seconds
Best F1: 0.6380 at epoch 39
Mean F1 across iterations: 0.6075  0.0273
========================FINAL RESULTS================================
FEGIN weighted F1: 0.6380  0.0273
python main.py --data ltspice_demos --representation component_pin --model FEGIN --layers 3 --hiddens 16 --batch_size 64 --lr 0.001 --emb_size 250 --epochs 100 --save_appendix component_pin_L3_H16_BS64_LR0.001_E250 --no_val
-----



STDERR:
  File "main.py", line 370, in <module>
    main()
  File "main.py", line 254, in main
    dataset = dataset_class(
  File "/home/philip/projects/ltspice_examples_code_repo/Circuit-Completion-Using-GNNs/component_classification_with_link_prediction_head/evaluation/FEGIN/kernel/circuit_datasets.py", line 15, in __init__
    self.data, self.slices = torch.load(self.processed_paths[0])
  File "/home/philip/.local/lib/python3.8/site-packages/torch/serialization.py", line 1040, in load
    warnings.warn(
  File "/usr/lib/python3.8/warnings.py", line 109, in _showwarnmsg
    sw(msg.message, msg.category, msg.filename, msg.lineno,
  File "main.py", line 47, in warn_with_traceback
    traceback.print_stack(file=log)
/home/philip/projects/ltspice_examples_code_repo/Circuit-Completion-Using-GNNs/component_classification_with_link_prediction_head/evaluation/FEGIN/kernel/circuit_datasets.py:15: FutureWarning: You are using `torch.load` with `weights_only=False` (the current default value), which uses the default pickle module implicitly. It is possible to construct malicious pickle data which will execute arbitrary code during unpickling (See https://github.com/pytorch/pytorch/blob/main/SECURITY.md#untrusted-models for more details). In a future release, the default value for `weights_only` will be flipped to `True`. This limits the functions that could be executed during unpickling. Arbitrary objects will no longer be allowed to be loaded via this mode unless they are explicitly allowlisted by the user via `torch.serialization.add_safe_globals`. We recommend you start setting `weights_only=True` for any use case where you don't have full control of the loaded file. Please open an issue on GitHub for any issues related to this experimental feature.
  self.data, self.slices = torch.load(self.processed_paths[0])
