STDOUT:
Results will be saved in /home/philip/projects/ltspice_examples_code_repo/Circuit-Completion-Using-GNNs/component_classification_with_link_prediction_head/evaluation/FEGIN/results/model_FEGIN_dataset_ltspice_examples
Command line input: python main.py --data ltspice_examples --representation component_pin_net --model FEGIN --layers 2 --hiddens 64 --batch_size 256 --lr 0.0001 --emb_size 512 --epochs 100 --save_appendix component_pin_net_L2_H64_BS256_LR0.0001_E512 --no_val
 is saved.
-----
ltspice_examples - FEGIN
Using 2 layers, 64 hidden units, h = 2
Loading component_pin_net representation dataset
ENTERED
Training FEGIN on component_pin_net representation
Train: 3558, Test: 846
##################ITERATION #0 ****************************************
 epoch: 0, train_loss: 1.3938, test_loss: 1.3924, test_f1: 0.1004
 epoch: 1, train_loss: 1.3854, test_loss: 1.3878, test_f1: 0.1004
 epoch: 2, train_loss: 1.3799, test_loss: 1.3824, test_f1: 0.1004
 epoch: 3, train_loss: 1.3731, test_loss: 1.3739, test_f1: 0.1162
 epoch: 4, train_loss: 1.3657, test_loss: 1.3633, test_f1: 0.1264
 epoch: 5, train_loss: 1.3557, test_loss: 1.3520, test_f1: 0.1471
 epoch: 6, train_loss: 1.3466, test_loss: 1.3395, test_f1: 0.2654
 epoch: 7, train_loss: 1.3338, test_loss: 1.3258, test_f1: 0.2777
 epoch: 8, train_loss: 1.3191, test_loss: 1.3113, test_f1: 0.2586
 epoch: 9, train_loss: 1.3049, test_loss: 1.2959, test_f1: 0.2555
 epoch: 10, train_loss: 1.2914, test_loss: 1.2800, test_f1: 0.2304
 epoch: 11, train_loss: 1.2741, test_loss: 1.2643, test_f1: 0.2302
 epoch: 12, train_loss: 1.2608, test_loss: 1.2503, test_f1: 0.2295
 epoch: 13, train_loss: 1.2504, test_loss: 1.2367, test_f1: 0.2270
 epoch: 14, train_loss: 1.2345, test_loss: 1.2237, test_f1: 0.2270
 epoch: 15, train_loss: 1.2271, test_loss: 1.2115, test_f1: 0.2270
 epoch: 16, train_loss: 1.2158, test_loss: 1.1998, test_f1: 0.2270
 epoch: 17, train_loss: 1.2086, test_loss: 1.1894, test_f1: 0.2679
 epoch: 18, train_loss: 1.1965, test_loss: 1.1791, test_f1: 0.2979
 epoch: 19, train_loss: 1.1889, test_loss: 1.1689, test_f1: 0.3155
 epoch: 20, train_loss: 1.1786, test_loss: 1.1591, test_f1: 0.3460
 epoch: 21, train_loss: 1.1732, test_loss: 1.1489, test_f1: 0.3708
 epoch: 22, train_loss: 1.1622, test_loss: 1.1386, test_f1: 0.3912
 epoch: 23, train_loss: 1.1538, test_loss: 1.1292, test_f1: 0.4076
 epoch: 24, train_loss: 1.1431, test_loss: 1.1190, test_f1: 0.4134
 epoch: 25, train_loss: 1.1345, test_loss: 1.1077, test_f1: 0.4231
 epoch: 26, train_loss: 1.1257, test_loss: 1.0974, test_f1: 0.4623
 epoch: 27, train_loss: 1.1123, test_loss: 1.0852, test_f1: 0.4577
 epoch: 28, train_loss: 1.1036, test_loss: 1.0737, test_f1: 0.4577
 epoch: 29, train_loss: 1.0921, test_loss: 1.0635, test_f1: 0.4750
 epoch: 30, train_loss: 1.0802, test_loss: 1.0532, test_f1: 0.4749
 epoch: 31, train_loss: 1.0726, test_loss: 1.0444, test_f1: 0.4749
 epoch: 32, train_loss: 1.0594, test_loss: 1.0341, test_f1: 0.4794
 epoch: 33, train_loss: 1.0568, test_loss: 1.0264, test_f1: 0.4815
 epoch: 34, train_loss: 1.0397, test_loss: 1.0199, test_f1: 0.4859
 epoch: 35, train_loss: 1.0378, test_loss: 1.0144, test_f1: 0.4838
 epoch: 36, train_loss: 1.0272, test_loss: 1.0070, test_f1: 0.4915
 epoch: 37, train_loss: 1.0181, test_loss: 1.0010, test_f1: 0.4935
 epoch: 38, train_loss: 1.0172, test_loss: 0.9983, test_f1: 0.4986
 epoch: 39, train_loss: 1.0051, test_loss: 0.9927, test_f1: 0.4965
 epoch: 40, train_loss: 1.0049, test_loss: 0.9921, test_f1: 0.5004
 epoch: 41, train_loss: 0.9967, test_loss: 0.9864, test_f1: 0.5036
 epoch: 42, train_loss: 0.9933, test_loss: 0.9829, test_f1: 0.5038
 epoch: 43, train_loss: 0.9903, test_loss: 0.9802, test_f1: 0.5034
 epoch: 44, train_loss: 0.9887, test_loss: 0.9789, test_f1: 0.5000
 epoch: 45, train_loss: 0.9858, test_loss: 0.9775, test_f1: 0.5067
 epoch: 46, train_loss: 0.9763, test_loss: 0.9714, test_f1: 0.5091
 epoch: 47, train_loss: 0.9774, test_loss: 0.9683, test_f1: 0.4980
 epoch: 48, train_loss: 0.9730, test_loss: 0.9653, test_f1: 0.5072
 epoch: 49, train_loss: 0.9755, test_loss: 0.9632, test_f1: 0.4985
 epoch: 50, train_loss: 0.9657, test_loss: 0.9686, test_f1: 0.5036
 epoch: 51, train_loss: 0.9618, test_loss: 0.9607, test_f1: 0.5081
 epoch: 52, train_loss: 0.9668, test_loss: 0.9590, test_f1: 0.5062
 epoch: 53, train_loss: 0.9638, test_loss: 0.9578, test_f1: 0.5083
 epoch: 54, train_loss: 0.9579, test_loss: 0.9567, test_f1: 0.5077
 epoch: 55, train_loss: 0.9578, test_loss: 0.9553, test_f1: 0.5109
 epoch: 56, train_loss: 0.9607, test_loss: 0.9550, test_f1: 0.5058
 epoch: 57, train_loss: 0.9562, test_loss: 0.9540, test_f1: 0.5046
 epoch: 58, train_loss: 0.9536, test_loss: 0.9519, test_f1: 0.5091
 epoch: 59, train_loss: 0.9547, test_loss: 0.9546, test_f1: 0.4976
 epoch: 60, train_loss: 0.9566, test_loss: 0.9520, test_f1: 0.5042
 epoch: 61, train_loss: 0.9526, test_loss: 0.9498, test_f1: 0.5144
 epoch: 62, train_loss: 0.9568, test_loss: 0.9517, test_f1: 0.4989
 epoch: 63, train_loss: 0.9506, test_loss: 0.9484, test_f1: 0.5066
 epoch: 64, train_loss: 0.9493, test_loss: 0.9472, test_f1: 0.5169
 epoch: 65, train_loss: 0.9484, test_loss: 0.9472, test_f1: 0.5110
 epoch: 66, train_loss: 0.9479, test_loss: 0.9493, test_f1: 0.5035
 epoch: 67, train_loss: 0.9488, test_loss: 0.9438, test_f1: 0.5164
 epoch: 68, train_loss: 0.9425, test_loss: 0.9441, test_f1: 0.5011
 epoch: 69, train_loss: 0.9455, test_loss: 0.9427, test_f1: 0.5045
 epoch: 70, train_loss: 0.9470, test_loss: 0.9427, test_f1: 0.5105
 epoch: 71, train_loss: 0.9377, test_loss: 0.9445, test_f1: 0.5035
 epoch: 72, train_loss: 0.9401, test_loss: 0.9423, test_f1: 0.5178
 epoch: 73, train_loss: 0.9391, test_loss: 0.9385, test_f1: 0.5121
 epoch: 74, train_loss: 0.9458, test_loss: 0.9369, test_f1: 0.5077
 epoch: 75, train_loss: 0.9331, test_loss: 0.9374, test_f1: 0.5054
 epoch: 76, train_loss: 0.9382, test_loss: 0.9353, test_f1: 0.5064
 epoch: 77, train_loss: 0.9343, test_loss: 0.9353, test_f1: 0.5070
 epoch: 78, train_loss: 0.9388, test_loss: 0.9334, test_f1: 0.5105
 epoch: 79, train_loss: 0.9325, test_loss: 0.9363, test_f1: 0.5041
 epoch: 80, train_loss: 0.9336, test_loss: 0.9360, test_f1: 0.5058
 epoch: 81, train_loss: 0.9272, test_loss: 0.9342, test_f1: 0.5105
 epoch: 82, train_loss: 0.9267, test_loss: 0.9338, test_f1: 0.5094
 epoch: 83, train_loss: 0.9276, test_loss: 0.9299, test_f1: 0.5072
 epoch: 84, train_loss: 0.9323, test_loss: 0.9322, test_f1: 0.5128
 epoch: 85, train_loss: 0.9306, test_loss: 0.9366, test_f1: 0.5211
 epoch: 86, train_loss: 0.9278, test_loss: 0.9321, test_f1: 0.5077
 epoch: 87, train_loss: 0.9291, test_loss: 0.9320, test_f1: 0.5125
 epoch: 88, train_loss: 0.9261, test_loss: 0.9340, test_f1: 0.5108
 epoch: 89, train_loss: 0.9222, test_loss: 0.9295, test_f1: 0.5154
 epoch: 90, train_loss: 0.9212, test_loss: 0.9313, test_f1: 0.5159
 epoch: 91, train_loss: 0.9261, test_loss: 0.9286, test_f1: 0.5143
 epoch: 92, train_loss: 0.9199, test_loss: 0.9307, test_f1: 0.5104
 epoch: 93, train_loss: 0.9144, test_loss: 0.9285, test_f1: 0.5161
 epoch: 94, train_loss: 0.9177, test_loss: 0.9276, test_f1: 0.5144
 epoch: 95, train_loss: 0.9187, test_loss: 0.9264, test_f1: 0.5098
 epoch: 96, train_loss: 0.9222, test_loss: 0.9239, test_f1: 0.5198
 epoch: 97, train_loss: 0.9133, test_loss: 0.9258, test_f1: 0.5294
 epoch: 98, train_loss: 0.9073, test_loss: 0.9205, test_f1: 0.5188
 epoch: 99, train_loss: 0.9139, test_loss: 0.9214, test_f1: 0.5214
##################ITERATION #1 ****************************************
 epoch: 0, train_loss: 1.3556, test_loss: 1.3668, test_f1: 0.1004
 epoch: 1, train_loss: 1.3351, test_loss: 1.3582, test_f1: 0.1004
 epoch: 2, train_loss: 1.3219, test_loss: 1.3466, test_f1: 0.2103
 epoch: 3, train_loss: 1.3072, test_loss: 1.3254, test_f1: 0.2481
 epoch: 4, train_loss: 1.2899, test_loss: 1.2908, test_f1: 0.2421
 epoch: 5, train_loss: 1.2743, test_loss: 1.2612, test_f1: 0.3158
 epoch: 6, train_loss: 1.2555, test_loss: 1.2366, test_f1: 0.3496
 epoch: 7, train_loss: 1.2350, test_loss: 1.2144, test_f1: 0.3403
 epoch: 8, train_loss: 1.2173, test_loss: 1.1934, test_f1: 0.3432
 epoch: 9, train_loss: 1.1996, test_loss: 1.1732, test_f1: 0.3460
 epoch: 10, train_loss: 1.1815, test_loss: 1.1537, test_f1: 0.3460
 epoch: 11, train_loss: 1.1636, test_loss: 1.1359, test_f1: 0.3460
 epoch: 12, train_loss: 1.1469, test_loss: 1.1192, test_f1: 0.3450
 epoch: 13, train_loss: 1.1309, test_loss: 1.1036, test_f1: 0.3448
 epoch: 14, train_loss: 1.1149, test_loss: 1.0902, test_f1: 0.3429
 epoch: 15, train_loss: 1.1053, test_loss: 1.0790, test_f1: 0.3428
 epoch: 16, train_loss: 1.0890, test_loss: 1.0694, test_f1: 0.3426
 epoch: 17, train_loss: 1.0828, test_loss: 1.0604, test_f1: 0.3502
 epoch: 18, train_loss: 1.0762, test_loss: 1.0521, test_f1: 0.3596
 epoch: 19, train_loss: 1.0659, test_loss: 1.0456, test_f1: 0.3628
 epoch: 20, train_loss: 1.0599, test_loss: 1.0399, test_f1: 0.3808
 epoch: 21, train_loss: 1.0532, test_loss: 1.0340, test_f1: 0.3861
 epoch: 22, train_loss: 1.0479, test_loss: 1.0287, test_f1: 0.3899
 epoch: 23, train_loss: 1.0389, test_loss: 1.0247, test_f1: 0.3986
 epoch: 24, train_loss: 1.0325, test_loss: 1.0192, test_f1: 0.4073
 epoch: 25, train_loss: 1.0294, test_loss: 1.0141, test_f1: 0.4119
 epoch: 26, train_loss: 1.0223, test_loss: 1.0099, test_f1: 0.4106
 epoch: 27, train_loss: 1.0232, test_loss: 1.0045, test_f1: 0.4139
 epoch: 28, train_loss: 1.0128, test_loss: 1.0007, test_f1: 0.4254
 epoch: 29, train_loss: 1.0072, test_loss: 0.9944, test_f1: 0.4337
 epoch: 30, train_loss: 1.0048, test_loss: 0.9912, test_f1: 0.4489
 epoch: 31, train_loss: 1.0050, test_loss: 0.9884, test_f1: 0.4462
 epoch: 32, train_loss: 1.0029, test_loss: 0.9880, test_f1: 0.4661
 epoch: 33, train_loss: 0.9930, test_loss: 0.9821, test_f1: 0.4742
 epoch: 34, train_loss: 0.9932, test_loss: 0.9802, test_f1: 0.4715
 epoch: 35, train_loss: 0.9821, test_loss: 0.9731, test_f1: 0.4760
 epoch: 36, train_loss: 0.9835, test_loss: 0.9674, test_f1: 0.4844
 epoch: 37, train_loss: 0.9817, test_loss: 0.9637, test_f1: 0.4777
 epoch: 38, train_loss: 0.9717, test_loss: 0.9601, test_f1: 0.4839
 epoch: 39, train_loss: 0.9741, test_loss: 0.9590, test_f1: 0.4869
 epoch: 40, train_loss: 0.9683, test_loss: 0.9545, test_f1: 0.4864
 epoch: 41, train_loss: 0.9646, test_loss: 0.9528, test_f1: 0.4947
 epoch: 42, train_loss: 0.9639, test_loss: 0.9511, test_f1: 0.4911
 epoch: 43, train_loss: 0.9587, test_loss: 0.9480, test_f1: 0.4888
 epoch: 44, train_loss: 0.9619, test_loss: 0.9442, test_f1: 0.4979
 epoch: 45, train_loss: 0.9555, test_loss: 0.9400, test_f1: 0.5052
 epoch: 46, train_loss: 0.9519, test_loss: 0.9367, test_f1: 0.4994
 epoch: 47, train_loss: 0.9493, test_loss: 0.9336, test_f1: 0.5038
 epoch: 48, train_loss: 0.9507, test_loss: 0.9364, test_f1: 0.5020
 epoch: 49, train_loss: 0.9462, test_loss: 0.9299, test_f1: 0.5064
 epoch: 50, train_loss: 0.9429, test_loss: 0.9295, test_f1: 0.5065
 epoch: 51, train_loss: 0.9334, test_loss: 0.9283, test_f1: 0.5066
 epoch: 52, train_loss: 0.9384, test_loss: 0.9244, test_f1: 0.5127
 epoch: 53, train_loss: 0.9339, test_loss: 0.9243, test_f1: 0.5057
 epoch: 54, train_loss: 0.9317, test_loss: 0.9247, test_f1: 0.5108
 epoch: 55, train_loss: 0.9345, test_loss: 0.9224, test_f1: 0.5080
 epoch: 56, train_loss: 0.9340, test_loss: 0.9202, test_f1: 0.5168
 epoch: 57, train_loss: 0.9276, test_loss: 0.9210, test_f1: 0.5124
 epoch: 58, train_loss: 0.9250, test_loss: 0.9207, test_f1: 0.5132
 epoch: 59, train_loss: 0.9228, test_loss: 0.9191, test_f1: 0.5092
 epoch: 60, train_loss: 0.9316, test_loss: 0.9170, test_f1: 0.5167
 epoch: 61, train_loss: 0.9282, test_loss: 0.9155, test_f1: 0.5212
 epoch: 62, train_loss: 0.9283, test_loss: 0.9131, test_f1: 0.5202
 epoch: 63, train_loss: 0.9248, test_loss: 0.9139, test_f1: 0.5145
 epoch: 64, train_loss: 0.9255, test_loss: 0.9114, test_f1: 0.5220
 epoch: 65, train_loss: 0.9218, test_loss: 0.9103, test_f1: 0.5210
 epoch: 66, train_loss: 0.9204, test_loss: 0.9102, test_f1: 0.5232
 epoch: 67, train_loss: 0.9198, test_loss: 0.9104, test_f1: 0.5183
 epoch: 68, train_loss: 0.9183, test_loss: 0.9090, test_f1: 0.5161
 epoch: 69, train_loss: 0.9144, test_loss: 0.9048, test_f1: 0.5264
 epoch: 70, train_loss: 0.9134, test_loss: 0.9050, test_f1: 0.5275
 epoch: 71, train_loss: 0.9166, test_loss: 0.9042, test_f1: 0.5248
 epoch: 72, train_loss: 0.9147, test_loss: 0.9045, test_f1: 0.5293
 epoch: 73, train_loss: 0.9076, test_loss: 0.9000, test_f1: 0.5234
 epoch: 74, train_loss: 0.9060, test_loss: 0.9037, test_f1: 0.5241
 epoch: 75, train_loss: 0.9104, test_loss: 0.9046, test_f1: 0.5240
 epoch: 76, train_loss: 0.9032, test_loss: 0.8997, test_f1: 0.5257
 epoch: 77, train_loss: 0.9079, test_loss: 0.8995, test_f1: 0.5300
 epoch: 78, train_loss: 0.8976, test_loss: 0.8982, test_f1: 0.5308
 epoch: 79, train_loss: 0.9060, test_loss: 0.8971, test_f1: 0.5313
 epoch: 80, train_loss: 0.9020, test_loss: 0.8959, test_f1: 0.5360
 epoch: 81, train_loss: 0.9004, test_loss: 0.8944, test_f1: 0.5311
 epoch: 82, train_loss: 0.8962, test_loss: 0.8925, test_f1: 0.5337
 epoch: 83, train_loss: 0.8946, test_loss: 0.8912, test_f1: 0.5371
 epoch: 84, train_loss: 0.8896, test_loss: 0.8917, test_f1: 0.5337
 epoch: 85, train_loss: 0.8935, test_loss: 0.8917, test_f1: 0.5299
 epoch: 86, train_loss: 0.8912, test_loss: 0.8913, test_f1: 0.5313
 epoch: 87, train_loss: 0.8982, test_loss: 0.8901, test_f1: 0.5318
 epoch: 88, train_loss: 0.8935, test_loss: 0.8893, test_f1: 0.5389
 epoch: 89, train_loss: 0.8844, test_loss: 0.8884, test_f1: 0.5377
 epoch: 90, train_loss: 0.8883, test_loss: 0.8871, test_f1: 0.5417
 epoch: 91, train_loss: 0.8846, test_loss: 0.8882, test_f1: 0.5371
 epoch: 92, train_loss: 0.8872, test_loss: 0.8885, test_f1: 0.5375
 epoch: 93, train_loss: 0.8827, test_loss: 0.8903, test_f1: 0.5339
 epoch: 94, train_loss: 0.8790, test_loss: 0.8848, test_f1: 0.5401
 epoch: 95, train_loss: 0.8782, test_loss: 0.8795, test_f1: 0.5359
 epoch: 96, train_loss: 0.8807, test_loss: 0.8810, test_f1: 0.5415
 epoch: 97, train_loss: 0.8763, test_loss: 0.8825, test_f1: 0.5398
 epoch: 98, train_loss: 0.8831, test_loss: 0.8824, test_f1: 0.5415
 epoch: 99, train_loss: 0.8754, test_loss: 0.8799, test_f1: 0.5424
##################ITERATION #2 ****************************************
 epoch: 0, train_loss: 1.3506, test_loss: 1.3594, test_f1: 0.2270
 epoch: 1, train_loss: 1.3228, test_loss: 1.3510, test_f1: 0.2270
 epoch: 2, train_loss: 1.3026, test_loss: 1.3340, test_f1: 0.2270
 epoch: 3, train_loss: 1.2858, test_loss: 1.3047, test_f1: 0.2527
 epoch: 4, train_loss: 1.2667, test_loss: 1.2669, test_f1: 0.3299
 epoch: 5, train_loss: 1.2450, test_loss: 1.2307, test_f1: 0.3467
 epoch: 6, train_loss: 1.2256, test_loss: 1.1992, test_f1: 0.3536
 epoch: 7, train_loss: 1.2056, test_loss: 1.1724, test_f1: 0.3441
 epoch: 8, train_loss: 1.1826, test_loss: 1.1469, test_f1: 0.3441
 epoch: 9, train_loss: 1.1654, test_loss: 1.1261, test_f1: 0.3451
 epoch: 10, train_loss: 1.1443, test_loss: 1.1080, test_f1: 0.3460
 epoch: 11, train_loss: 1.1306, test_loss: 1.0914, test_f1: 0.3460
 epoch: 12, train_loss: 1.1151, test_loss: 1.0777, test_f1: 0.3429
 epoch: 13, train_loss: 1.0987, test_loss: 1.0662, test_f1: 0.3448
 epoch: 14, train_loss: 1.0878, test_loss: 1.0580, test_f1: 0.3438
 epoch: 15, train_loss: 1.0781, test_loss: 1.0483, test_f1: 0.3538
 epoch: 16, train_loss: 1.0703, test_loss: 1.0426, test_f1: 0.3591
 epoch: 17, train_loss: 1.0595, test_loss: 1.0342, test_f1: 0.3729
 epoch: 18, train_loss: 1.0505, test_loss: 1.0313, test_f1: 0.3975
 epoch: 19, train_loss: 1.0440, test_loss: 1.0237, test_f1: 0.4039
 epoch: 20, train_loss: 1.0378, test_loss: 1.0186, test_f1: 0.4086
 epoch: 21, train_loss: 1.0332, test_loss: 1.0136, test_f1: 0.4132
 epoch: 22, train_loss: 1.0254, test_loss: 1.0103, test_f1: 0.4235
 epoch: 23, train_loss: 1.0209, test_loss: 1.0061, test_f1: 0.4247
 epoch: 24, train_loss: 1.0167, test_loss: 1.0020, test_f1: 0.4254
 epoch: 25, train_loss: 1.0104, test_loss: 0.9950, test_f1: 0.4301
 epoch: 26, train_loss: 1.0102, test_loss: 0.9906, test_f1: 0.4373
 epoch: 27, train_loss: 1.0037, test_loss: 0.9884, test_f1: 0.4406
 epoch: 28, train_loss: 0.9930, test_loss: 0.9833, test_f1: 0.4682
 epoch: 29, train_loss: 0.9907, test_loss: 0.9750, test_f1: 0.4643
 epoch: 30, train_loss: 0.9892, test_loss: 0.9715, test_f1: 0.4719
 epoch: 31, train_loss: 0.9864, test_loss: 0.9716, test_f1: 0.4806
 epoch: 32, train_loss: 0.9843, test_loss: 0.9639, test_f1: 0.4835
 epoch: 33, train_loss: 0.9723, test_loss: 0.9636, test_f1: 0.4854
 epoch: 34, train_loss: 0.9754, test_loss: 0.9562, test_f1: 0.4881
 epoch: 35, train_loss: 0.9727, test_loss: 0.9535, test_f1: 0.4869
 epoch: 36, train_loss: 0.9705, test_loss: 0.9528, test_f1: 0.4926
 epoch: 37, train_loss: 0.9671, test_loss: 0.9498, test_f1: 0.4928
 epoch: 38, train_loss: 0.9637, test_loss: 0.9553, test_f1: 0.4935
 epoch: 39, train_loss: 0.9579, test_loss: 0.9449, test_f1: 0.4936
 epoch: 40, train_loss: 0.9534, test_loss: 0.9398, test_f1: 0.5033
 epoch: 41, train_loss: 0.9495, test_loss: 0.9385, test_f1: 0.4967
 epoch: 42, train_loss: 0.9524, test_loss: 0.9373, test_f1: 0.4989
 epoch: 43, train_loss: 0.9418, test_loss: 0.9282, test_f1: 0.4999
 epoch: 44, train_loss: 0.9439, test_loss: 0.9288, test_f1: 0.4995
 epoch: 45, train_loss: 0.9378, test_loss: 0.9330, test_f1: 0.4980
 epoch: 46, train_loss: 0.9344, test_loss: 0.9238, test_f1: 0.4922
 epoch: 47, train_loss: 0.9318, test_loss: 0.9209, test_f1: 0.5104
 epoch: 48, train_loss: 0.9294, test_loss: 0.9259, test_f1: 0.5062
 epoch: 49, train_loss: 0.9281, test_loss: 0.9138, test_f1: 0.5138
 epoch: 50, train_loss: 0.9232, test_loss: 0.9130, test_f1: 0.5117
 epoch: 51, train_loss: 0.9180, test_loss: 0.9117, test_f1: 0.5106
 epoch: 52, train_loss: 0.9179, test_loss: 0.9131, test_f1: 0.5137
 epoch: 53, train_loss: 0.9161, test_loss: 0.9104, test_f1: 0.5180
 epoch: 54, train_loss: 0.9196, test_loss: 0.9105, test_f1: 0.5132
 epoch: 55, train_loss: 0.9130, test_loss: 0.9101, test_f1: 0.5151
 epoch: 56, train_loss: 0.9139, test_loss: 0.9071, test_f1: 0.5097
 epoch: 57, train_loss: 0.9100, test_loss: 0.9074, test_f1: 0.5116
 epoch: 58, train_loss: 0.9106, test_loss: 0.9017, test_f1: 0.5184
 epoch: 59, train_loss: 0.9085, test_loss: 0.9032, test_f1: 0.5217
 epoch: 60, train_loss: 0.9120, test_loss: 0.9005, test_f1: 0.5196
 epoch: 61, train_loss: 0.9096, test_loss: 0.9018, test_f1: 0.5209
 epoch: 62, train_loss: 0.8978, test_loss: 0.9020, test_f1: 0.5211
 epoch: 63, train_loss: 0.9045, test_loss: 0.9002, test_f1: 0.5218
 epoch: 64, train_loss: 0.9000, test_loss: 0.9017, test_f1: 0.5218
 epoch: 65, train_loss: 0.9025, test_loss: 0.8985, test_f1: 0.5269
 epoch: 66, train_loss: 0.8959, test_loss: 0.8985, test_f1: 0.5259
 epoch: 67, train_loss: 0.8966, test_loss: 0.8978, test_f1: 0.5237
 epoch: 68, train_loss: 0.8898, test_loss: 0.8940, test_f1: 0.5186
 epoch: 69, train_loss: 0.8993, test_loss: 0.8952, test_f1: 0.5293
 epoch: 70, train_loss: 0.8928, test_loss: 0.8901, test_f1: 0.5211
 epoch: 71, train_loss: 0.8902, test_loss: 0.8887, test_f1: 0.5316
 epoch: 72, train_loss: 0.8879, test_loss: 0.8866, test_f1: 0.5273
 epoch: 73, train_loss: 0.8867, test_loss: 0.8927, test_f1: 0.5319
 epoch: 74, train_loss: 0.8914, test_loss: 0.8857, test_f1: 0.5323
 epoch: 75, train_loss: 0.8885, test_loss: 0.8898, test_f1: 0.5267
 epoch: 76, train_loss: 0.8877, test_loss: 0.8866, test_f1: 0.5247
 epoch: 77, train_loss: 0.8839, test_loss: 0.8889, test_f1: 0.5274
 epoch: 78, train_loss: 0.8774, test_loss: 0.8891, test_f1: 0.5274
 epoch: 79, train_loss: 0.8789, test_loss: 0.8855, test_f1: 0.5248
 epoch: 80, train_loss: 0.8766, test_loss: 0.8847, test_f1: 0.5343
 epoch: 81, train_loss: 0.8754, test_loss: 0.8835, test_f1: 0.5301
 epoch: 82, train_loss: 0.8767, test_loss: 0.8884, test_f1: 0.5220
 epoch: 83, train_loss: 0.8789, test_loss: 0.8756, test_f1: 0.5343
 epoch: 84, train_loss: 0.8790, test_loss: 0.8807, test_f1: 0.5313
 epoch: 85, train_loss: 0.8730, test_loss: 0.8797, test_f1: 0.5343
 epoch: 86, train_loss: 0.8723, test_loss: 0.8764, test_f1: 0.5310
 epoch: 87, train_loss: 0.8641, test_loss: 0.8746, test_f1: 0.5343
 epoch: 88, train_loss: 0.8750, test_loss: 0.8748, test_f1: 0.5305
 epoch: 89, train_loss: 0.8678, test_loss: 0.8794, test_f1: 0.5278
 epoch: 90, train_loss: 0.8668, test_loss: 0.8705, test_f1: 0.5446
 epoch: 91, train_loss: 0.8647, test_loss: 0.8705, test_f1: 0.5379
 epoch: 92, train_loss: 0.8673, test_loss: 0.8765, test_f1: 0.5287
 epoch: 93, train_loss: 0.8633, test_loss: 0.8785, test_f1: 0.5276
 epoch: 94, train_loss: 0.8587, test_loss: 0.8776, test_f1: 0.5369
 epoch: 95, train_loss: 0.8629, test_loss: 0.8684, test_f1: 0.5319
 epoch: 96, train_loss: 0.8592, test_loss: 0.8740, test_f1: 0.5357
 epoch: 97, train_loss: 0.8594, test_loss: 0.8677, test_f1: 0.5424
 epoch: 98, train_loss: 0.8524, test_loss: 0.8731, test_f1: 0.5385
 epoch: 99, train_loss: 0.8603, test_loss: 0.8723, test_f1: 0.5460
##################ITERATION #3 ****************************************
 epoch: 0, train_loss: 1.3078, test_loss: 1.3172, test_f1: 0.2270
 epoch: 1, train_loss: 1.2741, test_loss: 1.2996, test_f1: 0.2270
 epoch: 2, train_loss: 1.2541, test_loss: 1.2726, test_f1: 0.2270
 epoch: 3, train_loss: 1.2377, test_loss: 1.2347, test_f1: 0.2270
 epoch: 4, train_loss: 1.2189, test_loss: 1.1998, test_f1: 0.3300
 epoch: 5, train_loss: 1.1972, test_loss: 1.1681, test_f1: 0.3548
 epoch: 6, train_loss: 1.1778, test_loss: 1.1410, test_f1: 0.3499
 epoch: 7, train_loss: 1.1578, test_loss: 1.1171, test_f1: 0.3473
 epoch: 8, train_loss: 1.1375, test_loss: 1.0960, test_f1: 0.3659
 epoch: 9, train_loss: 1.1148, test_loss: 1.0796, test_f1: 0.3992
 epoch: 10, train_loss: 1.0995, test_loss: 1.0647, test_f1: 0.4009
 epoch: 11, train_loss: 1.0853, test_loss: 1.0504, test_f1: 0.4154
 epoch: 12, train_loss: 1.0724, test_loss: 1.0382, test_f1: 0.4218
 epoch: 13, train_loss: 1.0579, test_loss: 1.0298, test_f1: 0.4277
 epoch: 14, train_loss: 1.0510, test_loss: 1.0209, test_f1: 0.4351
 epoch: 15, train_loss: 1.0455, test_loss: 1.0142, test_f1: 0.4335
 epoch: 16, train_loss: 1.0401, test_loss: 1.0070, test_f1: 0.4403
 epoch: 17, train_loss: 1.0280, test_loss: 1.0007, test_f1: 0.4431
 epoch: 18, train_loss: 1.0222, test_loss: 0.9956, test_f1: 0.4587
 epoch: 19, train_loss: 1.0145, test_loss: 0.9893, test_f1: 0.4666
 epoch: 20, train_loss: 1.0077, test_loss: 0.9838, test_f1: 0.4644
 epoch: 21, train_loss: 1.0048, test_loss: 0.9821, test_f1: 0.4693
 epoch: 22, train_loss: 0.9996, test_loss: 0.9772, test_f1: 0.4745
 epoch: 23, train_loss: 0.9933, test_loss: 0.9747, test_f1: 0.4797
 epoch: 24, train_loss: 0.9859, test_loss: 0.9710, test_f1: 0.4789
 epoch: 25, train_loss: 0.9853, test_loss: 0.9634, test_f1: 0.4889
 epoch: 26, train_loss: 0.9790, test_loss: 0.9589, test_f1: 0.4922
 epoch: 27, train_loss: 0.9746, test_loss: 0.9561, test_f1: 0.4934
 epoch: 28, train_loss: 0.9682, test_loss: 0.9523, test_f1: 0.4902
 epoch: 29, train_loss: 0.9669, test_loss: 0.9485, test_f1: 0.4935
 epoch: 30, train_loss: 0.9625, test_loss: 0.9448, test_f1: 0.4968
 epoch: 31, train_loss: 0.9611, test_loss: 0.9427, test_f1: 0.4935
 epoch: 32, train_loss: 0.9613, test_loss: 0.9405, test_f1: 0.4943
 epoch: 33, train_loss: 0.9479, test_loss: 0.9401, test_f1: 0.4950
 epoch: 34, train_loss: 0.9463, test_loss: 0.9334, test_f1: 0.5043
 epoch: 35, train_loss: 0.9421, test_loss: 0.9331, test_f1: 0.5146
 epoch: 36, train_loss: 0.9408, test_loss: 0.9294, test_f1: 0.5069
 epoch: 37, train_loss: 0.9395, test_loss: 0.9246, test_f1: 0.5182
 epoch: 38, train_loss: 0.9351, test_loss: 0.9235, test_f1: 0.5170
 epoch: 39, train_loss: 0.9332, test_loss: 0.9227, test_f1: 0.5139
 epoch: 40, train_loss: 0.9211, test_loss: 0.9148, test_f1: 0.5150
 epoch: 41, train_loss: 0.9237, test_loss: 0.9158, test_f1: 0.5237
 epoch: 42, train_loss: 0.9177, test_loss: 0.9092, test_f1: 0.5200
 epoch: 43, train_loss: 0.9155, test_loss: 0.9095, test_f1: 0.5207
 epoch: 44, train_loss: 0.9141, test_loss: 0.9066, test_f1: 0.5199
 epoch: 45, train_loss: 0.9194, test_loss: 0.9027, test_f1: 0.5260
 epoch: 46, train_loss: 0.9068, test_loss: 0.8967, test_f1: 0.5266
 epoch: 47, train_loss: 0.9069, test_loss: 0.9009, test_f1: 0.5113
 epoch: 48, train_loss: 0.9015, test_loss: 0.8948, test_f1: 0.5302
 epoch: 49, train_loss: 0.9025, test_loss: 0.8894, test_f1: 0.5209
 epoch: 50, train_loss: 0.9019, test_loss: 0.8819, test_f1: 0.5292
 epoch: 51, train_loss: 0.8891, test_loss: 0.8839, test_f1: 0.5204
 epoch: 52, train_loss: 0.8938, test_loss: 0.8837, test_f1: 0.5169
 epoch: 53, train_loss: 0.8871, test_loss: 0.8795, test_f1: 0.5346
 epoch: 54, train_loss: 0.8860, test_loss: 0.8768, test_f1: 0.5242
 epoch: 55, train_loss: 0.8878, test_loss: 0.8758, test_f1: 0.5337
 epoch: 56, train_loss: 0.8840, test_loss: 0.8765, test_f1: 0.5314
 epoch: 57, train_loss: 0.8862, test_loss: 0.8767, test_f1: 0.5279
 epoch: 58, train_loss: 0.8784, test_loss: 0.8759, test_f1: 0.5262
 epoch: 59, train_loss: 0.8825, test_loss: 0.8755, test_f1: 0.5323
 epoch: 60, train_loss: 0.8803, test_loss: 0.8739, test_f1: 0.5248
 epoch: 61, train_loss: 0.8784, test_loss: 0.8731, test_f1: 0.5288
 epoch: 62, train_loss: 0.8731, test_loss: 0.8725, test_f1: 0.5326
 epoch: 63, train_loss: 0.8745, test_loss: 0.8693, test_f1: 0.5371
 epoch: 64, train_loss: 0.8729, test_loss: 0.8679, test_f1: 0.5322
 epoch: 65, train_loss: 0.8676, test_loss: 0.8670, test_f1: 0.5287
 epoch: 66, train_loss: 0.8692, test_loss: 0.8662, test_f1: 0.5273
 epoch: 67, train_loss: 0.8666, test_loss: 0.8642, test_f1: 0.5255
 epoch: 68, train_loss: 0.8665, test_loss: 0.8620, test_f1: 0.5323
 epoch: 69, train_loss: 0.8692, test_loss: 0.8624, test_f1: 0.5277
 epoch: 70, train_loss: 0.8631, test_loss: 0.8620, test_f1: 0.5396
 epoch: 71, train_loss: 0.8628, test_loss: 0.8589, test_f1: 0.5287
 epoch: 72, train_loss: 0.8642, test_loss: 0.8583, test_f1: 0.5291
 epoch: 73, train_loss: 0.8604, test_loss: 0.8560, test_f1: 0.5435
 epoch: 74, train_loss: 0.8603, test_loss: 0.8575, test_f1: 0.5378
 epoch: 75, train_loss: 0.8558, test_loss: 0.8553, test_f1: 0.5353
 epoch: 76, train_loss: 0.8577, test_loss: 0.8556, test_f1: 0.5363
 epoch: 77, train_loss: 0.8594, test_loss: 0.8555, test_f1: 0.5360
 epoch: 78, train_loss: 0.8597, test_loss: 0.8546, test_f1: 0.5341
 epoch: 79, train_loss: 0.8534, test_loss: 0.8503, test_f1: 0.5452
 epoch: 80, train_loss: 0.8516, test_loss: 0.8534, test_f1: 0.5311
 epoch: 81, train_loss: 0.8508, test_loss: 0.8513, test_f1: 0.5414
 epoch: 82, train_loss: 0.8414, test_loss: 0.8513, test_f1: 0.5369
 epoch: 83, train_loss: 0.8439, test_loss: 0.8498, test_f1: 0.5323
 epoch: 84, train_loss: 0.8507, test_loss: 0.8482, test_f1: 0.5323
 epoch: 85, train_loss: 0.8448, test_loss: 0.8477, test_f1: 0.5345
 epoch: 86, train_loss: 0.8488, test_loss: 0.8490, test_f1: 0.5459
 epoch: 87, train_loss: 0.8490, test_loss: 0.8498, test_f1: 0.5465
 epoch: 88, train_loss: 0.8430, test_loss: 0.8496, test_f1: 0.5330
 epoch: 89, train_loss: 0.8473, test_loss: 0.8464, test_f1: 0.5373
 epoch: 90, train_loss: 0.8425, test_loss: 0.8459, test_f1: 0.5400
 epoch: 91, train_loss: 0.8447, test_loss: 0.8473, test_f1: 0.5324
 epoch: 92, train_loss: 0.8390, test_loss: 0.8442, test_f1: 0.5311
 epoch: 93, train_loss: 0.8339, test_loss: 0.8436, test_f1: 0.5352
 epoch: 94, train_loss: 0.8332, test_loss: 0.8416, test_f1: 0.5415
 epoch: 95, train_loss: 0.8310, test_loss: 0.8409, test_f1: 0.5438
 epoch: 96, train_loss: 0.8357, test_loss: 0.8368, test_f1: 0.5526
 epoch: 97, train_loss: 0.8354, test_loss: 0.8388, test_f1: 0.5350
 epoch: 98, train_loss: 0.8312, test_loss: 0.8377, test_f1: 0.5416
 epoch: 99, train_loss: 0.8285, test_loss: 0.8360, test_f1: 0.5494
##################ITERATION #4 ****************************************
 epoch: 0, train_loss: 1.3167, test_loss: 1.3352, test_f1: 0.2270
 epoch: 1, train_loss: 1.2814, test_loss: 1.3238, test_f1: 0.2270
 epoch: 2, train_loss: 1.2558, test_loss: 1.3015, test_f1: 0.2270
 epoch: 3, train_loss: 1.2363, test_loss: 1.2632, test_f1: 0.2320
 epoch: 4, train_loss: 1.2153, test_loss: 1.2201, test_f1: 0.3265
 epoch: 5, train_loss: 1.1986, test_loss: 1.1788, test_f1: 0.4296
 epoch: 6, train_loss: 1.1697, test_loss: 1.1443, test_f1: 0.4254
 epoch: 7, train_loss: 1.1522, test_loss: 1.1185, test_f1: 0.4306
 epoch: 8, train_loss: 1.1372, test_loss: 1.0971, test_f1: 0.4335
 epoch: 9, train_loss: 1.1174, test_loss: 1.0797, test_f1: 0.4300
 epoch: 10, train_loss: 1.1002, test_loss: 1.0646, test_f1: 0.4279
 epoch: 11, train_loss: 1.0893, test_loss: 1.0520, test_f1: 0.4334
 epoch: 12, train_loss: 1.0744, test_loss: 1.0422, test_f1: 0.4335
 epoch: 13, train_loss: 1.0678, test_loss: 1.0337, test_f1: 0.4387
 epoch: 14, train_loss: 1.0613, test_loss: 1.0271, test_f1: 0.4484
 epoch: 15, train_loss: 1.0451, test_loss: 1.0215, test_f1: 0.4369
 epoch: 16, train_loss: 1.0421, test_loss: 1.0150, test_f1: 0.4342
 epoch: 17, train_loss: 1.0290, test_loss: 1.0089, test_f1: 0.4391
 epoch: 18, train_loss: 1.0269, test_loss: 1.0042, test_f1: 0.4459
 epoch: 19, train_loss: 1.0203, test_loss: 0.9992, test_f1: 0.4520
 epoch: 20, train_loss: 1.0166, test_loss: 0.9950, test_f1: 0.4662
 epoch: 21, train_loss: 1.0118, test_loss: 0.9902, test_f1: 0.4629
 epoch: 22, train_loss: 1.0028, test_loss: 0.9855, test_f1: 0.4696
 epoch: 23, train_loss: 1.0010, test_loss: 0.9820, test_f1: 0.4753
 epoch: 24, train_loss: 0.9999, test_loss: 0.9777, test_f1: 0.4730
 epoch: 25, train_loss: 0.9886, test_loss: 0.9756, test_f1: 0.4708
 epoch: 26, train_loss: 0.9839, test_loss: 0.9693, test_f1: 0.4848
 epoch: 27, train_loss: 0.9840, test_loss: 0.9670, test_f1: 0.4738
 epoch: 28, train_loss: 0.9822, test_loss: 0.9655, test_f1: 0.4771
 epoch: 29, train_loss: 0.9768, test_loss: 0.9619, test_f1: 0.4828
 epoch: 30, train_loss: 0.9696, test_loss: 0.9595, test_f1: 0.4767
 epoch: 31, train_loss: 0.9641, test_loss: 0.9555, test_f1: 0.4877
 epoch: 32, train_loss: 0.9578, test_loss: 0.9504, test_f1: 0.4889
 epoch: 33, train_loss: 0.9611, test_loss: 0.9505, test_f1: 0.4801
 epoch: 34, train_loss: 0.9565, test_loss: 0.9477, test_f1: 0.4877
 epoch: 35, train_loss: 0.9539, test_loss: 0.9436, test_f1: 0.4834
 epoch: 36, train_loss: 0.9499, test_loss: 0.9405, test_f1: 0.5011
 epoch: 37, train_loss: 0.9485, test_loss: 0.9371, test_f1: 0.5017
 epoch: 38, train_loss: 0.9422, test_loss: 0.9351, test_f1: 0.5021
 epoch: 39, train_loss: 0.9428, test_loss: 0.9337, test_f1: 0.4920
 epoch: 40, train_loss: 0.9354, test_loss: 0.9251, test_f1: 0.5031
 epoch: 41, train_loss: 0.9317, test_loss: 0.9264, test_f1: 0.4969
 epoch: 42, train_loss: 0.9349, test_loss: 0.9223, test_f1: 0.5013
 epoch: 43, train_loss: 0.9225, test_loss: 0.9208, test_f1: 0.5001
 epoch: 44, train_loss: 0.9271, test_loss: 0.9195, test_f1: 0.5000
 epoch: 45, train_loss: 0.9225, test_loss: 0.9140, test_f1: 0.5026
 epoch: 46, train_loss: 0.9216, test_loss: 0.9136, test_f1: 0.5103
 epoch: 47, train_loss: 0.9165, test_loss: 0.9043, test_f1: 0.5035
 epoch: 48, train_loss: 0.9094, test_loss: 0.9025, test_f1: 0.5160
 epoch: 49, train_loss: 0.9125, test_loss: 0.8993, test_f1: 0.5076
 epoch: 50, train_loss: 0.9086, test_loss: 0.9105, test_f1: 0.5095
 epoch: 51, train_loss: 0.9078, test_loss: 0.8964, test_f1: 0.5125
 epoch: 52, train_loss: 0.8997, test_loss: 0.8923, test_f1: 0.5110
 epoch: 53, train_loss: 0.8965, test_loss: 0.8924, test_f1: 0.5121
 epoch: 54, train_loss: 0.9039, test_loss: 0.8932, test_f1: 0.5185
 epoch: 55, train_loss: 0.9004, test_loss: 0.8944, test_f1: 0.5143
 epoch: 56, train_loss: 0.8970, test_loss: 0.8930, test_f1: 0.5220
 epoch: 57, train_loss: 0.8934, test_loss: 0.8884, test_f1: 0.5159
 epoch: 58, train_loss: 0.8925, test_loss: 0.8869, test_f1: 0.5227
 epoch: 59, train_loss: 0.8857, test_loss: 0.8849, test_f1: 0.5168
 epoch: 60, train_loss: 0.8918, test_loss: 0.8853, test_f1: 0.5243
 epoch: 61, train_loss: 0.8866, test_loss: 0.8842, test_f1: 0.5273
 epoch: 62, train_loss: 0.8846, test_loss: 0.8795, test_f1: 0.5230
 epoch: 63, train_loss: 0.8866, test_loss: 0.8813, test_f1: 0.5270
 epoch: 64, train_loss: 0.8829, test_loss: 0.8819, test_f1: 0.5312
 epoch: 65, train_loss: 0.8871, test_loss: 0.8812, test_f1: 0.5297
 epoch: 66, train_loss: 0.8786, test_loss: 0.8781, test_f1: 0.5332
 epoch: 67, train_loss: 0.8806, test_loss: 0.8773, test_f1: 0.5329
 epoch: 68, train_loss: 0.8752, test_loss: 0.8728, test_f1: 0.5324
 epoch: 69, train_loss: 0.8767, test_loss: 0.8743, test_f1: 0.5358
 epoch: 70, train_loss: 0.8758, test_loss: 0.8712, test_f1: 0.5345
 epoch: 71, train_loss: 0.8757, test_loss: 0.8742, test_f1: 0.5348
 epoch: 72, train_loss: 0.8731, test_loss: 0.8718, test_f1: 0.5274
 epoch: 73, train_loss: 0.8692, test_loss: 0.8676, test_f1: 0.5348
 epoch: 74, train_loss: 0.8657, test_loss: 0.8680, test_f1: 0.5306
 epoch: 75, train_loss: 0.8746, test_loss: 0.8662, test_f1: 0.5312
 epoch: 76, train_loss: 0.8668, test_loss: 0.8672, test_f1: 0.5370
 epoch: 77, train_loss: 0.8644, test_loss: 0.8663, test_f1: 0.5380
 epoch: 78, train_loss: 0.8602, test_loss: 0.8641, test_f1: 0.5424
 epoch: 79, train_loss: 0.8546, test_loss: 0.8609, test_f1: 0.5396
 epoch: 80, train_loss: 0.8583, test_loss: 0.8643, test_f1: 0.5423
 epoch: 81, train_loss: 0.8552, test_loss: 0.8607, test_f1: 0.5464
 epoch: 82, train_loss: 0.8605, test_loss: 0.8594, test_f1: 0.5425
 epoch: 83, train_loss: 0.8629, test_loss: 0.8633, test_f1: 0.5429
 epoch: 84, train_loss: 0.8547, test_loss: 0.8606, test_f1: 0.5384
 epoch: 85, train_loss: 0.8533, test_loss: 0.8576, test_f1: 0.5414
 epoch: 86, train_loss: 0.8507, test_loss: 0.8599, test_f1: 0.5434
 epoch: 87, train_loss: 0.8516, test_loss: 0.8597, test_f1: 0.5498
 epoch: 88, train_loss: 0.8523, test_loss: 0.8554, test_f1: 0.5467
 epoch: 89, train_loss: 0.8589, test_loss: 0.8645, test_f1: 0.5421
 epoch: 90, train_loss: 0.8450, test_loss: 0.8544, test_f1: 0.5528
 epoch: 91, train_loss: 0.8462, test_loss: 0.8580, test_f1: 0.5501
 epoch: 92, train_loss: 0.8503, test_loss: 0.8551, test_f1: 0.5535
 epoch: 93, train_loss: 0.8464, test_loss: 0.8525, test_f1: 0.5539
 epoch: 94, train_loss: 0.8451, test_loss: 0.8523, test_f1: 0.5524
 epoch: 95, train_loss: 0.8459, test_loss: 0.8537, test_f1: 0.5554
 epoch: 96, train_loss: 0.8376, test_loss: 0.8503, test_f1: 0.5504
 epoch: 97, train_loss: 0.8433, test_loss: 0.8565, test_f1: 0.5525
 epoch: 98, train_loss: 0.8462, test_loss: 0.8546, test_f1: 0.5507
 epoch: 99, train_loss: 0.8439, test_loss: 0.8465, test_f1: 0.5564
##################ITERATION #5 ****************************************
 epoch: 0, train_loss: 1.3112, test_loss: 1.3171, test_f1: 0.2270
 epoch: 1, train_loss: 1.2510, test_loss: 1.2991, test_f1: 0.2270
 epoch: 2, train_loss: 1.2190, test_loss: 1.2633, test_f1: 0.2270
 epoch: 3, train_loss: 1.1946, test_loss: 1.2075, test_f1: 0.3080
 epoch: 4, train_loss: 1.1667, test_loss: 1.1458, test_f1: 0.3547
 epoch: 5, train_loss: 1.1372, test_loss: 1.1041, test_f1: 0.3834
 epoch: 6, train_loss: 1.1178, test_loss: 1.0804, test_f1: 0.4151
 epoch: 7, train_loss: 1.1046, test_loss: 1.0620, test_f1: 0.4265
 epoch: 8, train_loss: 1.0868, test_loss: 1.0492, test_f1: 0.4337
 epoch: 9, train_loss: 1.0758, test_loss: 1.0391, test_f1: 0.4488
 epoch: 10, train_loss: 1.0573, test_loss: 1.0294, test_f1: 0.4473
 epoch: 11, train_loss: 1.0544, test_loss: 1.0211, test_f1: 0.4454
 epoch: 12, train_loss: 1.0426, test_loss: 1.0158, test_f1: 0.4406
 epoch: 13, train_loss: 1.0285, test_loss: 1.0068, test_f1: 0.4534
 epoch: 14, train_loss: 1.0278, test_loss: 1.0002, test_f1: 0.4617
 epoch: 15, train_loss: 1.0173, test_loss: 0.9926, test_f1: 0.4652
 epoch: 16, train_loss: 1.0113, test_loss: 0.9871, test_f1: 0.4750
 epoch: 17, train_loss: 0.9986, test_loss: 0.9840, test_f1: 0.4775
 epoch: 18, train_loss: 1.0036, test_loss: 0.9792, test_f1: 0.4795
 epoch: 19, train_loss: 0.9948, test_loss: 0.9773, test_f1: 0.4847
 epoch: 20, train_loss: 0.9931, test_loss: 0.9729, test_f1: 0.4865
 epoch: 21, train_loss: 0.9844, test_loss: 0.9672, test_f1: 0.4832
 epoch: 22, train_loss: 0.9790, test_loss: 0.9661, test_f1: 0.4795
 epoch: 23, train_loss: 0.9711, test_loss: 0.9612, test_f1: 0.4876
 epoch: 24, train_loss: 0.9672, test_loss: 0.9589, test_f1: 0.4840
 epoch: 25, train_loss: 0.9657, test_loss: 0.9544, test_f1: 0.4786
 epoch: 26, train_loss: 0.9708, test_loss: 0.9490, test_f1: 0.4881
 epoch: 27, train_loss: 0.9614, test_loss: 0.9470, test_f1: 0.4783
 epoch: 28, train_loss: 0.9562, test_loss: 0.9455, test_f1: 0.4801
 epoch: 29, train_loss: 0.9483, test_loss: 0.9489, test_f1: 0.5056
 epoch: 30, train_loss: 0.9520, test_loss: 0.9421, test_f1: 0.5010
 epoch: 31, train_loss: 0.9495, test_loss: 0.9389, test_f1: 0.5017
 epoch: 32, train_loss: 0.9451, test_loss: 0.9328, test_f1: 0.5119
 epoch: 33, train_loss: 0.9406, test_loss: 0.9337, test_f1: 0.5001
 epoch: 34, train_loss: 0.9302, test_loss: 0.9304, test_f1: 0.5135
 epoch: 35, train_loss: 0.9261, test_loss: 0.9281, test_f1: 0.5138
 epoch: 36, train_loss: 0.9312, test_loss: 0.9236, test_f1: 0.5186
 epoch: 37, train_loss: 0.9272, test_loss: 0.9159, test_f1: 0.5221
 epoch: 38, train_loss: 0.9221, test_loss: 0.9173, test_f1: 0.5249
 epoch: 39, train_loss: 0.9212, test_loss: 0.9170, test_f1: 0.5219
 epoch: 40, train_loss: 0.9218, test_loss: 0.9140, test_f1: 0.5266
 epoch: 41, train_loss: 0.9093, test_loss: 0.9097, test_f1: 0.5250
 epoch: 42, train_loss: 0.9112, test_loss: 0.9038, test_f1: 0.5358
 epoch: 43, train_loss: 0.9092, test_loss: 0.9071, test_f1: 0.5309
 epoch: 44, train_loss: 0.9099, test_loss: 0.9041, test_f1: 0.5338
 epoch: 45, train_loss: 0.9032, test_loss: 0.9029, test_f1: 0.5344
 epoch: 46, train_loss: 0.8970, test_loss: 0.9031, test_f1: 0.5344
 epoch: 47, train_loss: 0.8951, test_loss: 0.8959, test_f1: 0.5363
 epoch: 48, train_loss: 0.8938, test_loss: 0.8950, test_f1: 0.5414
 epoch: 49, train_loss: 0.8988, test_loss: 0.8991, test_f1: 0.5301
 epoch: 50, train_loss: 0.8954, test_loss: 0.8937, test_f1: 0.5314
 epoch: 51, train_loss: 0.8885, test_loss: 0.8971, test_f1: 0.5291
 epoch: 52, train_loss: 0.8817, test_loss: 0.8911, test_f1: 0.5289
 epoch: 53, train_loss: 0.8801, test_loss: 0.8888, test_f1: 0.5350
 epoch: 54, train_loss: 0.8814, test_loss: 0.8891, test_f1: 0.5381
 epoch: 55, train_loss: 0.8847, test_loss: 0.8899, test_f1: 0.5333
 epoch: 56, train_loss: 0.8839, test_loss: 0.8873, test_f1: 0.5327
 epoch: 57, train_loss: 0.8834, test_loss: 0.8883, test_f1: 0.5303
 epoch: 58, train_loss: 0.8721, test_loss: 0.8886, test_f1: 0.5365
 epoch: 59, train_loss: 0.8829, test_loss: 0.8908, test_f1: 0.5346
 epoch: 60, train_loss: 0.8831, test_loss: 0.8876, test_f1: 0.5323
 epoch: 61, train_loss: 0.8751, test_loss: 0.8844, test_f1: 0.5352
 epoch: 62, train_loss: 0.8762, test_loss: 0.8823, test_f1: 0.5334
 epoch: 63, train_loss: 0.8631, test_loss: 0.8796, test_f1: 0.5321
 epoch: 64, train_loss: 0.8703, test_loss: 0.8804, test_f1: 0.5367
 epoch: 65, train_loss: 0.8738, test_loss: 0.8799, test_f1: 0.5388
 epoch: 66, train_loss: 0.8725, test_loss: 0.8801, test_f1: 0.5375
 epoch: 67, train_loss: 0.8730, test_loss: 0.8816, test_f1: 0.5408
 epoch: 68, train_loss: 0.8670, test_loss: 0.8776, test_f1: 0.5386
 epoch: 69, train_loss: 0.8683, test_loss: 0.8755, test_f1: 0.5411
 epoch: 70, train_loss: 0.8672, test_loss: 0.8724, test_f1: 0.5414
 epoch: 71, train_loss: 0.8628, test_loss: 0.8801, test_f1: 0.5369
 epoch: 72, train_loss: 0.8643, test_loss: 0.8752, test_f1: 0.5340
 epoch: 73, train_loss: 0.8598, test_loss: 0.8711, test_f1: 0.5366
 epoch: 74, train_loss: 0.8573, test_loss: 0.8723, test_f1: 0.5384
 epoch: 75, train_loss: 0.8528, test_loss: 0.8735, test_f1: 0.5384
 epoch: 76, train_loss: 0.8528, test_loss: 0.8754, test_f1: 0.5391
 epoch: 77, train_loss: 0.8578, test_loss: 0.8693, test_f1: 0.5418
 epoch: 78, train_loss: 0.8535, test_loss: 0.8712, test_f1: 0.5375
 epoch: 79, train_loss: 0.8547, test_loss: 0.8708, test_f1: 0.5413
 epoch: 80, train_loss: 0.8536, test_loss: 0.8680, test_f1: 0.5406
 epoch: 81, train_loss: 0.8578, test_loss: 0.8697, test_f1: 0.5427
 epoch: 82, train_loss: 0.8508, test_loss: 0.8714, test_f1: 0.5402
 epoch: 83, train_loss: 0.8529, test_loss: 0.8680, test_f1: 0.5417
 epoch: 84, train_loss: 0.8479, test_loss: 0.8679, test_f1: 0.5449
 epoch: 85, train_loss: 0.8477, test_loss: 0.8661, test_f1: 0.5444
 epoch: 86, train_loss: 0.8481, test_loss: 0.8682, test_f1: 0.5434
 epoch: 87, train_loss: 0.8490, test_loss: 0.8658, test_f1: 0.5416
 epoch: 88, train_loss: 0.8503, test_loss: 0.8624, test_f1: 0.5421
 epoch: 89, train_loss: 0.8400, test_loss: 0.8638, test_f1: 0.5480
 epoch: 90, train_loss: 0.8540, test_loss: 0.8646, test_f1: 0.5505
 epoch: 91, train_loss: 0.8432, test_loss: 0.8613, test_f1: 0.5476
 epoch: 92, train_loss: 0.8395, test_loss: 0.8638, test_f1: 0.5414
 epoch: 93, train_loss: 0.8341, test_loss: 0.8632, test_f1: 0.5419
 epoch: 94, train_loss: 0.8318, test_loss: 0.8563, test_f1: 0.5477
 epoch: 95, train_loss: 0.8422, test_loss: 0.8570, test_f1: 0.5416
 epoch: 96, train_loss: 0.8375, test_loss: 0.8595, test_f1: 0.5458
 epoch: 97, train_loss: 0.8317, test_loss: 0.8585, test_f1: 0.5473
 epoch: 98, train_loss: 0.8264, test_loss: 0.8587, test_f1: 0.5475
 epoch: 99, train_loss: 0.8349, test_loss: 0.8566, test_f1: 0.5514
##################ITERATION #6 ****************************************
 epoch: 0, train_loss: 1.3045, test_loss: 1.3148, test_f1: 0.2270
 epoch: 1, train_loss: 1.2322, test_loss: 1.2938, test_f1: 0.2270
 epoch: 2, train_loss: 1.2059, test_loss: 1.2301, test_f1: 0.2251
 epoch: 3, train_loss: 1.1761, test_loss: 1.1590, test_f1: 0.3351
 epoch: 4, train_loss: 1.1536, test_loss: 1.1139, test_f1: 0.4033
 epoch: 5, train_loss: 1.1275, test_loss: 1.0855, test_f1: 0.4238
 epoch: 6, train_loss: 1.1120, test_loss: 1.0627, test_f1: 0.4257
 epoch: 7, train_loss: 1.0904, test_loss: 1.0451, test_f1: 0.4271
 epoch: 8, train_loss: 1.0812, test_loss: 1.0329, test_f1: 0.4513
 epoch: 9, train_loss: 1.0666, test_loss: 1.0246, test_f1: 0.4540
 epoch: 10, train_loss: 1.0544, test_loss: 1.0174, test_f1: 0.4525
 epoch: 11, train_loss: 1.0487, test_loss: 1.0109, test_f1: 0.4615
 epoch: 12, train_loss: 1.0380, test_loss: 1.0046, test_f1: 0.4635
 epoch: 13, train_loss: 1.0328, test_loss: 0.9988, test_f1: 0.4566
 epoch: 14, train_loss: 1.0232, test_loss: 0.9970, test_f1: 0.4541
 epoch: 15, train_loss: 1.0170, test_loss: 0.9942, test_f1: 0.4700
 epoch: 16, train_loss: 1.0109, test_loss: 0.9885, test_f1: 0.4701
 epoch: 17, train_loss: 1.0108, test_loss: 0.9829, test_f1: 0.4725
 epoch: 18, train_loss: 1.0035, test_loss: 0.9815, test_f1: 0.4731
 epoch: 19, train_loss: 0.9962, test_loss: 0.9775, test_f1: 0.4796
 epoch: 20, train_loss: 0.9988, test_loss: 0.9741, test_f1: 0.4804
 epoch: 21, train_loss: 0.9984, test_loss: 0.9719, test_f1: 0.4818
 epoch: 22, train_loss: 0.9852, test_loss: 0.9677, test_f1: 0.4830
 epoch: 23, train_loss: 0.9829, test_loss: 0.9665, test_f1: 0.4818
 epoch: 24, train_loss: 0.9788, test_loss: 0.9684, test_f1: 0.4891
 epoch: 25, train_loss: 0.9738, test_loss: 0.9654, test_f1: 0.4864
 epoch: 26, train_loss: 0.9686, test_loss: 0.9589, test_f1: 0.4867
 epoch: 27, train_loss: 0.9703, test_loss: 0.9582, test_f1: 0.4894
 epoch: 28, train_loss: 0.9688, test_loss: 0.9568, test_f1: 0.4932
 epoch: 29, train_loss: 0.9668, test_loss: 0.9572, test_f1: 0.4923
 epoch: 30, train_loss: 0.9634, test_loss: 0.9546, test_f1: 0.4878
 epoch: 31, train_loss: 0.9613, test_loss: 0.9553, test_f1: 0.4867
 epoch: 32, train_loss: 0.9481, test_loss: 0.9510, test_f1: 0.4939
 epoch: 33, train_loss: 0.9478, test_loss: 0.9515, test_f1: 0.4857
 epoch: 34, train_loss: 0.9465, test_loss: 0.9430, test_f1: 0.5034
 epoch: 35, train_loss: 0.9400, test_loss: 0.9463, test_f1: 0.5034
 epoch: 36, train_loss: 0.9427, test_loss: 0.9403, test_f1: 0.5033
 epoch: 37, train_loss: 0.9364, test_loss: 0.9408, test_f1: 0.5066
 epoch: 38, train_loss: 0.9374, test_loss: 0.9354, test_f1: 0.5121
 epoch: 39, train_loss: 0.9372, test_loss: 0.9398, test_f1: 0.5146
 epoch: 40, train_loss: 0.9318, test_loss: 0.9309, test_f1: 0.5172
 epoch: 41, train_loss: 0.9243, test_loss: 0.9334, test_f1: 0.5248
 epoch: 42, train_loss: 0.9274, test_loss: 0.9296, test_f1: 0.5162
 epoch: 43, train_loss: 0.9197, test_loss: 0.9215, test_f1: 0.5247
 epoch: 44, train_loss: 0.9158, test_loss: 0.9175, test_f1: 0.5130
 epoch: 45, train_loss: 0.9177, test_loss: 0.9203, test_f1: 0.5108
 epoch: 46, train_loss: 0.9135, test_loss: 0.9157, test_f1: 0.5299
 epoch: 47, train_loss: 0.9099, test_loss: 0.9207, test_f1: 0.5372
 epoch: 48, train_loss: 0.9063, test_loss: 0.9102, test_f1: 0.5094
 epoch: 49, train_loss: 0.9128, test_loss: 0.9127, test_f1: 0.5219
 epoch: 50, train_loss: 0.9046, test_loss: 0.9227, test_f1: 0.5356
 epoch: 51, train_loss: 0.8994, test_loss: 0.9179, test_f1: 0.5396
 epoch: 52, train_loss: 0.8943, test_loss: 0.9083, test_f1: 0.5395
 epoch: 53, train_loss: 0.8972, test_loss: 0.9017, test_f1: 0.5413
 epoch: 54, train_loss: 0.8927, test_loss: 0.9014, test_f1: 0.5436
 epoch: 55, train_loss: 0.8906, test_loss: 0.9059, test_f1: 0.5382
 epoch: 56, train_loss: 0.8927, test_loss: 0.8990, test_f1: 0.5475
 epoch: 57, train_loss: 0.8965, test_loss: 0.8964, test_f1: 0.5399
 epoch: 58, train_loss: 0.8879, test_loss: 0.8989, test_f1: 0.5446
 epoch: 59, train_loss: 0.8933, test_loss: 0.9064, test_f1: 0.5387
 epoch: 60, train_loss: 0.8879, test_loss: 0.9023, test_f1: 0.5409
 epoch: 61, train_loss: 0.8874, test_loss: 0.9022, test_f1: 0.5413
 epoch: 62, train_loss: 0.8881, test_loss: 0.9009, test_f1: 0.5431
 epoch: 63, train_loss: 0.8765, test_loss: 0.8948, test_f1: 0.5421
 epoch: 64, train_loss: 0.8800, test_loss: 0.8959, test_f1: 0.5479
 epoch: 65, train_loss: 0.8769, test_loss: 0.8948, test_f1: 0.5516
 epoch: 66, train_loss: 0.8787, test_loss: 0.8947, test_f1: 0.5392
 epoch: 67, train_loss: 0.8753, test_loss: 0.8962, test_f1: 0.5507
 epoch: 68, train_loss: 0.8789, test_loss: 0.8918, test_f1: 0.5429
 epoch: 69, train_loss: 0.8805, test_loss: 0.9022, test_f1: 0.5348
 epoch: 70, train_loss: 0.8710, test_loss: 0.8889, test_f1: 0.5461
 epoch: 71, train_loss: 0.8728, test_loss: 0.8979, test_f1: 0.5542
 epoch: 72, train_loss: 0.8784, test_loss: 0.8899, test_f1: 0.5512
 epoch: 73, train_loss: 0.8735, test_loss: 0.8877, test_f1: 0.5476
 epoch: 74, train_loss: 0.8758, test_loss: 0.8929, test_f1: 0.5476
 epoch: 75, train_loss: 0.8719, test_loss: 0.8823, test_f1: 0.5390
 epoch: 76, train_loss: 0.8675, test_loss: 0.8909, test_f1: 0.5501
 epoch: 77, train_loss: 0.8672, test_loss: 0.8795, test_f1: 0.5567
 epoch: 78, train_loss: 0.8653, test_loss: 0.8891, test_f1: 0.5451
 epoch: 79, train_loss: 0.8591, test_loss: 0.8821, test_f1: 0.5519
 epoch: 80, train_loss: 0.8554, test_loss: 0.8809, test_f1: 0.5512
 epoch: 81, train_loss: 0.8606, test_loss: 0.8794, test_f1: 0.5571
 epoch: 82, train_loss: 0.8601, test_loss: 0.8803, test_f1: 0.5556
 epoch: 83, train_loss: 0.8538, test_loss: 0.8834, test_f1: 0.5563
 epoch: 84, train_loss: 0.8440, test_loss: 0.8827, test_f1: 0.5495
 epoch: 85, train_loss: 0.8553, test_loss: 0.8747, test_f1: 0.5487
 epoch: 86, train_loss: 0.8558, test_loss: 0.8821, test_f1: 0.5550
 epoch: 87, train_loss: 0.8545, test_loss: 0.8792, test_f1: 0.5503
 epoch: 88, train_loss: 0.8523, test_loss: 0.8758, test_f1: 0.5481
 epoch: 89, train_loss: 0.8499, test_loss: 0.8730, test_f1: 0.5628
 epoch: 90, train_loss: 0.8496, test_loss: 0.8735, test_f1: 0.5651
 epoch: 91, train_loss: 0.8458, test_loss: 0.8756, test_f1: 0.5476
 epoch: 92, train_loss: 0.8489, test_loss: 0.8721, test_f1: 0.5570
 epoch: 93, train_loss: 0.8432, test_loss: 0.8668, test_f1: 0.5710
 epoch: 94, train_loss: 0.8466, test_loss: 0.8769, test_f1: 0.5746
 epoch: 95, train_loss: 0.8425, test_loss: 0.8772, test_f1: 0.5722
 epoch: 96, train_loss: 0.8422, test_loss: 0.8728, test_f1: 0.5699
 epoch: 97, train_loss: 0.8395, test_loss: 0.8729, test_f1: 0.5543
 epoch: 98, train_loss: 0.8449, test_loss: 0.8775, test_f1: 0.5534
 epoch: 99, train_loss: 0.8406, test_loss: 0.8762, test_f1: 0.5699
##################ITERATION #7 ****************************************
 epoch: 0, train_loss: 1.2879, test_loss: 1.3063, test_f1: 0.2270
 epoch: 1, train_loss: 1.2225, test_loss: 1.2802, test_f1: 0.2270
 epoch: 2, train_loss: 1.1842, test_loss: 1.2380, test_f1: 0.2270
 epoch: 3, train_loss: 1.1589, test_loss: 1.1738, test_f1: 0.2386
 epoch: 4, train_loss: 1.1233, test_loss: 1.1133, test_f1: 0.4252
 epoch: 5, train_loss: 1.1040, test_loss: 1.0768, test_f1: 0.4380
 epoch: 6, train_loss: 1.0882, test_loss: 1.0549, test_f1: 0.4668
 epoch: 7, train_loss: 1.0805, test_loss: 1.0409, test_f1: 0.4710
 epoch: 8, train_loss: 1.0655, test_loss: 1.0345, test_f1: 0.4715
 epoch: 9, train_loss: 1.0488, test_loss: 1.0226, test_f1: 0.4690
 epoch: 10, train_loss: 1.0364, test_loss: 1.0173, test_f1: 0.4688
 epoch: 11, train_loss: 1.0295, test_loss: 1.0092, test_f1: 0.4762
 epoch: 12, train_loss: 1.0225, test_loss: 1.0019, test_f1: 0.4785
 epoch: 13, train_loss: 1.0144, test_loss: 0.9982, test_f1: 0.4777
 epoch: 14, train_loss: 1.0144, test_loss: 0.9926, test_f1: 0.4792
 epoch: 15, train_loss: 1.0022, test_loss: 0.9815, test_f1: 0.4824
 epoch: 16, train_loss: 0.9958, test_loss: 0.9776, test_f1: 0.4847
 epoch: 17, train_loss: 0.9903, test_loss: 0.9742, test_f1: 0.4917
 epoch: 18, train_loss: 0.9810, test_loss: 0.9672, test_f1: 0.5013
 epoch: 19, train_loss: 0.9772, test_loss: 0.9603, test_f1: 0.4876
 epoch: 20, train_loss: 0.9678, test_loss: 0.9563, test_f1: 0.5092
 epoch: 21, train_loss: 0.9668, test_loss: 0.9512, test_f1: 0.5156
 epoch: 22, train_loss: 0.9623, test_loss: 0.9486, test_f1: 0.5159
 epoch: 23, train_loss: 0.9514, test_loss: 0.9428, test_f1: 0.5241
 epoch: 24, train_loss: 0.9462, test_loss: 0.9362, test_f1: 0.5241
 epoch: 25, train_loss: 0.9441, test_loss: 0.9392, test_f1: 0.5254
 epoch: 26, train_loss: 0.9348, test_loss: 0.9319, test_f1: 0.5277
 epoch: 27, train_loss: 0.9322, test_loss: 0.9277, test_f1: 0.5381
 epoch: 28, train_loss: 0.9311, test_loss: 0.9303, test_f1: 0.5366
 epoch: 29, train_loss: 0.9266, test_loss: 0.9277, test_f1: 0.5226
 epoch: 30, train_loss: 0.9244, test_loss: 0.9245, test_f1: 0.5144
 epoch: 31, train_loss: 0.9180, test_loss: 0.9223, test_f1: 0.5307
 epoch: 32, train_loss: 0.9140, test_loss: 0.9242, test_f1: 0.5235
 epoch: 33, train_loss: 0.9065, test_loss: 0.9195, test_f1: 0.5271
 epoch: 34, train_loss: 0.9025, test_loss: 0.9182, test_f1: 0.5176
 epoch: 35, train_loss: 0.9041, test_loss: 0.9178, test_f1: 0.5355
 epoch: 36, train_loss: 0.9007, test_loss: 0.9160, test_f1: 0.5240
 epoch: 37, train_loss: 0.8952, test_loss: 0.9177, test_f1: 0.5320
 epoch: 38, train_loss: 0.8944, test_loss: 0.9112, test_f1: 0.5224
 epoch: 39, train_loss: 0.8945, test_loss: 0.9101, test_f1: 0.5368
 epoch: 40, train_loss: 0.8814, test_loss: 0.9064, test_f1: 0.5256
 epoch: 41, train_loss: 0.8838, test_loss: 0.9064, test_f1: 0.5358
 epoch: 42, train_loss: 0.8799, test_loss: 0.9040, test_f1: 0.5327
 epoch: 43, train_loss: 0.8722, test_loss: 0.9053, test_f1: 0.5435
 epoch: 44, train_loss: 0.8742, test_loss: 0.8987, test_f1: 0.5397
 epoch: 45, train_loss: 0.8639, test_loss: 0.9051, test_f1: 0.5296
 epoch: 46, train_loss: 0.8673, test_loss: 0.9006, test_f1: 0.5446
 epoch: 47, train_loss: 0.8696, test_loss: 0.8952, test_f1: 0.5455
 epoch: 48, train_loss: 0.8550, test_loss: 0.8962, test_f1: 0.5438
 epoch: 49, train_loss: 0.8598, test_loss: 0.8940, test_f1: 0.5498
 epoch: 50, train_loss: 0.8515, test_loss: 0.8975, test_f1: 0.5487
 epoch: 51, train_loss: 0.8569, test_loss: 0.8945, test_f1: 0.5391
 epoch: 52, train_loss: 0.8510, test_loss: 0.8900, test_f1: 0.5509
 epoch: 53, train_loss: 0.8542, test_loss: 0.8887, test_f1: 0.5592
 epoch: 54, train_loss: 0.8452, test_loss: 0.8892, test_f1: 0.5509
 epoch: 55, train_loss: 0.8424, test_loss: 0.8858, test_f1: 0.5507
 epoch: 56, train_loss: 0.8439, test_loss: 0.8871, test_f1: 0.5476
 epoch: 57, train_loss: 0.8392, test_loss: 0.8885, test_f1: 0.5545
 epoch: 58, train_loss: 0.8401, test_loss: 0.8820, test_f1: 0.5543
 epoch: 59, train_loss: 0.8378, test_loss: 0.8830, test_f1: 0.5506
 epoch: 60, train_loss: 0.8423, test_loss: 0.8857, test_f1: 0.5458
 epoch: 61, train_loss: 0.8391, test_loss: 0.8821, test_f1: 0.5543
 epoch: 62, train_loss: 0.8341, test_loss: 0.8804, test_f1: 0.5556
 epoch: 63, train_loss: 0.8414, test_loss: 0.8807, test_f1: 0.5585
 epoch: 64, train_loss: 0.8352, test_loss: 0.8803, test_f1: 0.5548
 epoch: 65, train_loss: 0.8318, test_loss: 0.8787, test_f1: 0.5541
 epoch: 66, train_loss: 0.8319, test_loss: 0.8772, test_f1: 0.5559
 epoch: 67, train_loss: 0.8352, test_loss: 0.8803, test_f1: 0.5589
 epoch: 68, train_loss: 0.8330, test_loss: 0.8775, test_f1: 0.5608
 epoch: 69, train_loss: 0.8270, test_loss: 0.8764, test_f1: 0.5547
 epoch: 70, train_loss: 0.8166, test_loss: 0.8765, test_f1: 0.5564
 epoch: 71, train_loss: 0.8199, test_loss: 0.8801, test_f1: 0.5596
 epoch: 72, train_loss: 0.8255, test_loss: 0.8757, test_f1: 0.5580
 epoch: 73, train_loss: 0.8191, test_loss: 0.8771, test_f1: 0.5569
 epoch: 74, train_loss: 0.8200, test_loss: 0.8823, test_f1: 0.5619
 epoch: 75, train_loss: 0.8205, test_loss: 0.8737, test_f1: 0.5643
 epoch: 76, train_loss: 0.8174, test_loss: 0.8693, test_f1: 0.5563
 epoch: 77, train_loss: 0.8150, test_loss: 0.8759, test_f1: 0.5595
 epoch: 78, train_loss: 0.8110, test_loss: 0.8741, test_f1: 0.5675
 epoch: 79, train_loss: 0.8091, test_loss: 0.8736, test_f1: 0.5619
 epoch: 80, train_loss: 0.8087, test_loss: 0.8714, test_f1: 0.5586
 epoch: 81, train_loss: 0.8087, test_loss: 0.8718, test_f1: 0.5578
 epoch: 82, train_loss: 0.8111, test_loss: 0.8702, test_f1: 0.5591
 epoch: 83, train_loss: 0.8064, test_loss: 0.8677, test_f1: 0.5602
 epoch: 84, train_loss: 0.8009, test_loss: 0.8699, test_f1: 0.5575
 epoch: 85, train_loss: 0.8027, test_loss: 0.8664, test_f1: 0.5594
 epoch: 86, train_loss: 0.8102, test_loss: 0.8688, test_f1: 0.5678
 epoch: 87, train_loss: 0.8044, test_loss: 0.8678, test_f1: 0.5626
 epoch: 88, train_loss: 0.7940, test_loss: 0.8657, test_f1: 0.5657
 epoch: 89, train_loss: 0.7959, test_loss: 0.8638, test_f1: 0.5596
 epoch: 90, train_loss: 0.8017, test_loss: 0.8626, test_f1: 0.5568
 epoch: 91, train_loss: 0.7944, test_loss: 0.8632, test_f1: 0.5596
 epoch: 92, train_loss: 0.8026, test_loss: 0.8656, test_f1: 0.5651
 epoch: 93, train_loss: 0.7946, test_loss: 0.8618, test_f1: 0.5653
 epoch: 94, train_loss: 0.7935, test_loss: 0.8625, test_f1: 0.5570
 epoch: 95, train_loss: 0.7939, test_loss: 0.8654, test_f1: 0.5572
 epoch: 96, train_loss: 0.7941, test_loss: 0.8629, test_f1: 0.5653
 epoch: 97, train_loss: 0.7936, test_loss: 0.8598, test_f1: 0.5607
 epoch: 98, train_loss: 0.7853, test_loss: 0.8619, test_f1: 0.5631
 epoch: 99, train_loss: 0.7811, test_loss: 0.8631, test_f1: 0.5594
##################ITERATION #8 ****************************************
 epoch: 0, train_loss: 1.3150, test_loss: 1.3452, test_f1: 0.2270
 epoch: 1, train_loss: 1.1947, test_loss: 1.3163, test_f1: 0.2270
 epoch: 2, train_loss: 1.1520, test_loss: 1.2427, test_f1: 0.2270
 epoch: 3, train_loss: 1.1206, test_loss: 1.1425, test_f1: 0.3116
 epoch: 4, train_loss: 1.0957, test_loss: 1.0697, test_f1: 0.3820
 epoch: 5, train_loss: 1.0817, test_loss: 1.0410, test_f1: 0.4275
 epoch: 6, train_loss: 1.0611, test_loss: 1.0295, test_f1: 0.4410
 epoch: 7, train_loss: 1.0480, test_loss: 1.0239, test_f1: 0.4505
 epoch: 8, train_loss: 1.0426, test_loss: 1.0173, test_f1: 0.4541
 epoch: 9, train_loss: 1.0375, test_loss: 1.0137, test_f1: 0.4554
 epoch: 10, train_loss: 1.0336, test_loss: 1.0076, test_f1: 0.4645
 epoch: 11, train_loss: 1.0233, test_loss: 1.0045, test_f1: 0.4677
 epoch: 12, train_loss: 1.0111, test_loss: 0.9994, test_f1: 0.4768
 epoch: 13, train_loss: 1.0105, test_loss: 0.9910, test_f1: 0.4961
 epoch: 14, train_loss: 1.0018, test_loss: 0.9860, test_f1: 0.5002
 epoch: 15, train_loss: 0.9977, test_loss: 0.9842, test_f1: 0.4935
 epoch: 16, train_loss: 0.9923, test_loss: 0.9806, test_f1: 0.5135
 epoch: 17, train_loss: 0.9884, test_loss: 0.9731, test_f1: 0.5214
 epoch: 18, train_loss: 0.9848, test_loss: 0.9693, test_f1: 0.5153
 epoch: 19, train_loss: 0.9754, test_loss: 0.9738, test_f1: 0.5152
 epoch: 20, train_loss: 0.9748, test_loss: 0.9637, test_f1: 0.5152
 epoch: 21, train_loss: 0.9761, test_loss: 0.9579, test_f1: 0.5099
 epoch: 22, train_loss: 0.9702, test_loss: 0.9555, test_f1: 0.5126
 epoch: 23, train_loss: 0.9665, test_loss: 0.9524, test_f1: 0.5225
 epoch: 24, train_loss: 0.9608, test_loss: 0.9508, test_f1: 0.5125
 epoch: 25, train_loss: 0.9507, test_loss: 0.9486, test_f1: 0.5168
 epoch: 26, train_loss: 0.9556, test_loss: 0.9527, test_f1: 0.5223
 epoch: 27, train_loss: 0.9432, test_loss: 0.9450, test_f1: 0.5171
 epoch: 28, train_loss: 0.9497, test_loss: 0.9404, test_f1: 0.5198
 epoch: 29, train_loss: 0.9447, test_loss: 0.9402, test_f1: 0.5222
 epoch: 30, train_loss: 0.9444, test_loss: 0.9369, test_f1: 0.5250
 epoch: 31, train_loss: 0.9342, test_loss: 0.9357, test_f1: 0.5344
 epoch: 32, train_loss: 0.9361, test_loss: 0.9357, test_f1: 0.5269
 epoch: 33, train_loss: 0.9319, test_loss: 0.9298, test_f1: 0.5253
 epoch: 34, train_loss: 0.9299, test_loss: 0.9321, test_f1: 0.5253
 epoch: 35, train_loss: 0.9272, test_loss: 0.9288, test_f1: 0.5253
 epoch: 36, train_loss: 0.9242, test_loss: 0.9289, test_f1: 0.5200
 epoch: 37, train_loss: 0.9155, test_loss: 0.9158, test_f1: 0.5230
 epoch: 38, train_loss: 0.9182, test_loss: 0.9173, test_f1: 0.5279
 epoch: 39, train_loss: 0.9169, test_loss: 0.9086, test_f1: 0.5401
 epoch: 40, train_loss: 0.9136, test_loss: 0.9221, test_f1: 0.5290
 epoch: 41, train_loss: 0.9057, test_loss: 0.9090, test_f1: 0.5281
 epoch: 42, train_loss: 0.9024, test_loss: 0.9117, test_f1: 0.5435
 epoch: 43, train_loss: 0.8991, test_loss: 0.9105, test_f1: 0.5372
 epoch: 44, train_loss: 0.9015, test_loss: 0.9081, test_f1: 0.5434
 epoch: 45, train_loss: 0.8960, test_loss: 0.8993, test_f1: 0.5396
 epoch: 46, train_loss: 0.8927, test_loss: 0.9008, test_f1: 0.5428
 epoch: 47, train_loss: 0.8959, test_loss: 0.8933, test_f1: 0.5429
 epoch: 48, train_loss: 0.8847, test_loss: 0.8983, test_f1: 0.5356
 epoch: 49, train_loss: 0.8814, test_loss: 0.8967, test_f1: 0.5499
 epoch: 50, train_loss: 0.8867, test_loss: 0.8961, test_f1: 0.5500
 epoch: 51, train_loss: 0.8732, test_loss: 0.8944, test_f1: 0.5495
 epoch: 52, train_loss: 0.8705, test_loss: 0.8957, test_f1: 0.5591
 epoch: 53, train_loss: 0.8732, test_loss: 0.8898, test_f1: 0.5618
 epoch: 54, train_loss: 0.8755, test_loss: 0.8874, test_f1: 0.5607
 epoch: 55, train_loss: 0.8715, test_loss: 0.8893, test_f1: 0.5498
 epoch: 56, train_loss: 0.8729, test_loss: 0.8902, test_f1: 0.5571
 epoch: 57, train_loss: 0.8741, test_loss: 0.8835, test_f1: 0.5512
 epoch: 58, train_loss: 0.8699, test_loss: 0.8887, test_f1: 0.5615
 epoch: 59, train_loss: 0.8710, test_loss: 0.8902, test_f1: 0.5606
 epoch: 60, train_loss: 0.8738, test_loss: 0.8873, test_f1: 0.5580
 epoch: 61, train_loss: 0.8663, test_loss: 0.8849, test_f1: 0.5588
 epoch: 62, train_loss: 0.8607, test_loss: 0.8835, test_f1: 0.5612
 epoch: 63, train_loss: 0.8641, test_loss: 0.8844, test_f1: 0.5601
 epoch: 64, train_loss: 0.8576, test_loss: 0.8829, test_f1: 0.5607
 epoch: 65, train_loss: 0.8674, test_loss: 0.8782, test_f1: 0.5634
 epoch: 66, train_loss: 0.8647, test_loss: 0.8858, test_f1: 0.5607
 epoch: 67, train_loss: 0.8616, test_loss: 0.8745, test_f1: 0.5650
 epoch: 68, train_loss: 0.8584, test_loss: 0.8817, test_f1: 0.5602
 epoch: 69, train_loss: 0.8567, test_loss: 0.8743, test_f1: 0.5667
 epoch: 70, train_loss: 0.8607, test_loss: 0.8754, test_f1: 0.5674
 epoch: 71, train_loss: 0.8597, test_loss: 0.8747, test_f1: 0.5699
 epoch: 72, train_loss: 0.8518, test_loss: 0.8778, test_f1: 0.5637
 epoch: 73, train_loss: 0.8488, test_loss: 0.8716, test_f1: 0.5685
 epoch: 74, train_loss: 0.8546, test_loss: 0.8777, test_f1: 0.5611
 epoch: 75, train_loss: 0.8543, test_loss: 0.8753, test_f1: 0.5618
 epoch: 76, train_loss: 0.8492, test_loss: 0.8723, test_f1: 0.5680
 epoch: 77, train_loss: 0.8476, test_loss: 0.8718, test_f1: 0.5676
 epoch: 78, train_loss: 0.8487, test_loss: 0.8733, test_f1: 0.5652
 epoch: 79, train_loss: 0.8478, test_loss: 0.8695, test_f1: 0.5688
 epoch: 80, train_loss: 0.8421, test_loss: 0.8739, test_f1: 0.5668
 epoch: 81, train_loss: 0.8426, test_loss: 0.8736, test_f1: 0.5628
 epoch: 82, train_loss: 0.8438, test_loss: 0.8689, test_f1: 0.5631
 epoch: 83, train_loss: 0.8403, test_loss: 0.8730, test_f1: 0.5710
 epoch: 84, train_loss: 0.8364, test_loss: 0.8738, test_f1: 0.5684
 epoch: 85, train_loss: 0.8375, test_loss: 0.8743, test_f1: 0.5625
 epoch: 86, train_loss: 0.8399, test_loss: 0.8682, test_f1: 0.5631
 epoch: 87, train_loss: 0.8313, test_loss: 0.8710, test_f1: 0.5681
 epoch: 88, train_loss: 0.8349, test_loss: 0.8720, test_f1: 0.5687
 epoch: 89, train_loss: 0.8307, test_loss: 0.8764, test_f1: 0.5615
 epoch: 90, train_loss: 0.8353, test_loss: 0.8680, test_f1: 0.5674
 epoch: 91, train_loss: 0.8351, test_loss: 0.8725, test_f1: 0.5718
 epoch: 92, train_loss: 0.8381, test_loss: 0.8690, test_f1: 0.5688
 epoch: 93, train_loss: 0.8364, test_loss: 0.8660, test_f1: 0.5719
 epoch: 94, train_loss: 0.8353, test_loss: 0.8681, test_f1: 0.5716
 epoch: 95, train_loss: 0.8299, test_loss: 0.8636, test_f1: 0.5714
 epoch: 96, train_loss: 0.8257, test_loss: 0.8682, test_f1: 0.5717
 epoch: 97, train_loss: 0.8250, test_loss: 0.8649, test_f1: 0.5710
 epoch: 98, train_loss: 0.8269, test_loss: 0.8626, test_f1: 0.5681
 epoch: 99, train_loss: 0.8249, test_loss: 0.8621, test_f1: 0.5759
##################ITERATION #9 ****************************************
 epoch: 0, train_loss: 1.3333, test_loss: 1.3177, test_f1: 0.2270
 epoch: 1, train_loss: 1.2243, test_loss: 1.2843, test_f1: 0.2270
 epoch: 2, train_loss: 1.1846, test_loss: 1.2402, test_f1: 0.2273
 epoch: 3, train_loss: 1.1491, test_loss: 1.1715, test_f1: 0.2855
 epoch: 4, train_loss: 1.1233, test_loss: 1.0977, test_f1: 0.3889
 epoch: 5, train_loss: 1.1066, test_loss: 1.0570, test_f1: 0.4352
 epoch: 6, train_loss: 1.0832, test_loss: 1.0355, test_f1: 0.4364
 epoch: 7, train_loss: 1.0749, test_loss: 1.0210, test_f1: 0.4324
 epoch: 8, train_loss: 1.0598, test_loss: 1.0106, test_f1: 0.4358
 epoch: 9, train_loss: 1.0559, test_loss: 1.0027, test_f1: 0.4411
 epoch: 10, train_loss: 1.0456, test_loss: 0.9952, test_f1: 0.4475
 epoch: 11, train_loss: 1.0333, test_loss: 0.9872, test_f1: 0.4582
 epoch: 12, train_loss: 1.0277, test_loss: 0.9817, test_f1: 0.4620
 epoch: 13, train_loss: 1.0185, test_loss: 0.9762, test_f1: 0.4619
 epoch: 14, train_loss: 1.0135, test_loss: 0.9732, test_f1: 0.4629
 epoch: 15, train_loss: 0.9976, test_loss: 0.9659, test_f1: 0.4781
 epoch: 16, train_loss: 1.0020, test_loss: 0.9612, test_f1: 0.4815
 epoch: 17, train_loss: 0.9933, test_loss: 0.9590, test_f1: 0.4770
 epoch: 18, train_loss: 0.9850, test_loss: 0.9542, test_f1: 0.4797
 epoch: 19, train_loss: 0.9793, test_loss: 0.9493, test_f1: 0.4793
 epoch: 20, train_loss: 0.9749, test_loss: 0.9480, test_f1: 0.4745
 epoch: 21, train_loss: 0.9671, test_loss: 0.9428, test_f1: 0.4796
 epoch: 22, train_loss: 0.9647, test_loss: 0.9410, test_f1: 0.4976
 epoch: 23, train_loss: 0.9669, test_loss: 0.9373, test_f1: 0.4851
 epoch: 24, train_loss: 0.9605, test_loss: 0.9338, test_f1: 0.5017
 epoch: 25, train_loss: 0.9532, test_loss: 0.9338, test_f1: 0.4972
 epoch: 26, train_loss: 0.9493, test_loss: 0.9280, test_f1: 0.4988
 epoch: 27, train_loss: 0.9497, test_loss: 0.9262, test_f1: 0.5019
 epoch: 28, train_loss: 0.9438, test_loss: 0.9236, test_f1: 0.4994
 epoch: 29, train_loss: 0.9428, test_loss: 0.9216, test_f1: 0.5131
 epoch: 30, train_loss: 0.9358, test_loss: 0.9174, test_f1: 0.5124
 epoch: 31, train_loss: 0.9337, test_loss: 0.9168, test_f1: 0.5145
 epoch: 32, train_loss: 0.9379, test_loss: 0.9159, test_f1: 0.5097
 epoch: 33, train_loss: 0.9274, test_loss: 0.9124, test_f1: 0.5143
 epoch: 34, train_loss: 0.9209, test_loss: 0.9085, test_f1: 0.5181
 epoch: 35, train_loss: 0.9282, test_loss: 0.9060, test_f1: 0.5193
 epoch: 36, train_loss: 0.9224, test_loss: 0.9072, test_f1: 0.5198
 epoch: 37, train_loss: 0.9194, test_loss: 0.9010, test_f1: 0.5190
 epoch: 38, train_loss: 0.9139, test_loss: 0.9042, test_f1: 0.5277
 epoch: 39, train_loss: 0.9064, test_loss: 0.9016, test_f1: 0.5345
 epoch: 40, train_loss: 0.9087, test_loss: 0.9022, test_f1: 0.5325
 epoch: 41, train_loss: 0.9063, test_loss: 0.8980, test_f1: 0.5258
 epoch: 42, train_loss: 0.9079, test_loss: 0.8938, test_f1: 0.5339
 epoch: 43, train_loss: 0.8959, test_loss: 0.8918, test_f1: 0.5401
 epoch: 44, train_loss: 0.8979, test_loss: 0.8898, test_f1: 0.5470
 epoch: 45, train_loss: 0.8931, test_loss: 0.8907, test_f1: 0.5367
 epoch: 46, train_loss: 0.8874, test_loss: 0.8876, test_f1: 0.5380
 epoch: 47, train_loss: 0.8876, test_loss: 0.8853, test_f1: 0.5410
 epoch: 48, train_loss: 0.8904, test_loss: 0.8834, test_f1: 0.5410
 epoch: 49, train_loss: 0.8784, test_loss: 0.8814, test_f1: 0.5459
 epoch: 50, train_loss: 0.8791, test_loss: 0.8783, test_f1: 0.5438
 epoch: 51, train_loss: 0.8702, test_loss: 0.8773, test_f1: 0.5502
 epoch: 52, train_loss: 0.8761, test_loss: 0.8789, test_f1: 0.5481
 epoch: 53, train_loss: 0.8734, test_loss: 0.8775, test_f1: 0.5491
 epoch: 54, train_loss: 0.8663, test_loss: 0.8758, test_f1: 0.5457
 epoch: 55, train_loss: 0.8686, test_loss: 0.8754, test_f1: 0.5562
 epoch: 56, train_loss: 0.8683, test_loss: 0.8744, test_f1: 0.5496
 epoch: 57, train_loss: 0.8745, test_loss: 0.8737, test_f1: 0.5497
 epoch: 58, train_loss: 0.8656, test_loss: 0.8740, test_f1: 0.5496
 epoch: 59, train_loss: 0.8670, test_loss: 0.8725, test_f1: 0.5504
 epoch: 60, train_loss: 0.8637, test_loss: 0.8711, test_f1: 0.5529
 epoch: 61, train_loss: 0.8611, test_loss: 0.8695, test_f1: 0.5507
 epoch: 62, train_loss: 0.8532, test_loss: 0.8696, test_f1: 0.5515
 epoch: 63, train_loss: 0.8529, test_loss: 0.8682, test_f1: 0.5610
 epoch: 64, train_loss: 0.8662, test_loss: 0.8694, test_f1: 0.5612
 epoch: 65, train_loss: 0.8502, test_loss: 0.8673, test_f1: 0.5626
 epoch: 66, train_loss: 0.8557, test_loss: 0.8655, test_f1: 0.5532
 epoch: 67, train_loss: 0.8523, test_loss: 0.8634, test_f1: 0.5607
 epoch: 68, train_loss: 0.8596, test_loss: 0.8660, test_f1: 0.5595
 epoch: 69, train_loss: 0.8545, test_loss: 0.8622, test_f1: 0.5588
 epoch: 70, train_loss: 0.8503, test_loss: 0.8663, test_f1: 0.5640
 epoch: 71, train_loss: 0.8518, test_loss: 0.8664, test_f1: 0.5658
 epoch: 72, train_loss: 0.8458, test_loss: 0.8647, test_f1: 0.5655
 epoch: 73, train_loss: 0.8404, test_loss: 0.8626, test_f1: 0.5646
 epoch: 74, train_loss: 0.8418, test_loss: 0.8614, test_f1: 0.5639
 epoch: 75, train_loss: 0.8562, test_loss: 0.8596, test_f1: 0.5640
 epoch: 76, train_loss: 0.8459, test_loss: 0.8604, test_f1: 0.5632
 epoch: 77, train_loss: 0.8449, test_loss: 0.8600, test_f1: 0.5677
 epoch: 78, train_loss: 0.8412, test_loss: 0.8621, test_f1: 0.5680
 epoch: 79, train_loss: 0.8395, test_loss: 0.8624, test_f1: 0.5654
 epoch: 80, train_loss: 0.8437, test_loss: 0.8596, test_f1: 0.5665
 epoch: 81, train_loss: 0.8394, test_loss: 0.8595, test_f1: 0.5680
 epoch: 82, train_loss: 0.8347, test_loss: 0.8601, test_f1: 0.5655
 epoch: 83, train_loss: 0.8306, test_loss: 0.8585, test_f1: 0.5662
 epoch: 84, train_loss: 0.8354, test_loss: 0.8609, test_f1: 0.5676
 epoch: 85, train_loss: 0.8337, test_loss: 0.8587, test_f1: 0.5613
 epoch: 86, train_loss: 0.8329, test_loss: 0.8586, test_f1: 0.5661
 epoch: 87, train_loss: 0.8261, test_loss: 0.8605, test_f1: 0.5645
 epoch: 88, train_loss: 0.8313, test_loss: 0.8581, test_f1: 0.5669
 epoch: 89, train_loss: 0.8305, test_loss: 0.8548, test_f1: 0.5662
 epoch: 90, train_loss: 0.8278, test_loss: 0.8556, test_f1: 0.5668
 epoch: 91, train_loss: 0.8297, test_loss: 0.8586, test_f1: 0.5692
 epoch: 92, train_loss: 0.8306, test_loss: 0.8546, test_f1: 0.5696
 epoch: 93, train_loss: 0.8265, test_loss: 0.8531, test_f1: 0.5672
 epoch: 94, train_loss: 0.8204, test_loss: 0.8515, test_f1: 0.5696
 epoch: 95, train_loss: 0.8204, test_loss: 0.8526, test_f1: 0.5685
 epoch: 96, train_loss: 0.8247, test_loss: 0.8503, test_f1: 0.5641
 epoch: 97, train_loss: 0.8280, test_loss: 0.8521, test_f1: 0.5655
 epoch: 98, train_loss: 0.8211, test_loss: 0.8568, test_f1: 0.5657
 epoch: 99, train_loss: 0.8159, test_loss: 0.8547, test_f1: 0.5700

Training completed in 407.14 seconds
Best F1: 0.5759 at epoch 99
Mean F1 across iterations: 0.5566  0.0145
========================FINAL RESULTS================================
FEGIN weighted F1: 0.5759  0.0145
python main.py --data ltspice_examples --representation component_pin_net --model FEGIN --layers 2 --hiddens 64 --batch_size 256 --lr 0.0001 --emb_size 512 --epochs 100 --save_appendix component_pin_net_L2_H64_BS256_LR0.0001_E512 --no_val
-----



STDERR:
  File "main.py", line 370, in <module>
    main()
  File "main.py", line 254, in main
    dataset = dataset_class(
  File "/home/philip/projects/ltspice_examples_code_repo/Circuit-Completion-Using-GNNs/component_classification_with_link_prediction_head/evaluation/FEGIN/kernel/circuit_datasets.py", line 15, in __init__
    self.data, self.slices = torch.load(self.processed_paths[0])
  File "/home/philip/.local/lib/python3.8/site-packages/torch/serialization.py", line 1040, in load
    warnings.warn(
  File "/usr/lib/python3.8/warnings.py", line 109, in _showwarnmsg
    sw(msg.message, msg.category, msg.filename, msg.lineno,
  File "main.py", line 47, in warn_with_traceback
    traceback.print_stack(file=log)
/home/philip/projects/ltspice_examples_code_repo/Circuit-Completion-Using-GNNs/component_classification_with_link_prediction_head/evaluation/FEGIN/kernel/circuit_datasets.py:15: FutureWarning: You are using `torch.load` with `weights_only=False` (the current default value), which uses the default pickle module implicitly. It is possible to construct malicious pickle data which will execute arbitrary code during unpickling (See https://github.com/pytorch/pytorch/blob/main/SECURITY.md#untrusted-models for more details). In a future release, the default value for `weights_only` will be flipped to `True`. This limits the functions that could be executed during unpickling. Arbitrary objects will no longer be allowed to be loaded via this mode unless they are explicitly allowlisted by the user via `torch.serialization.add_safe_globals`. We recommend you start setting `weights_only=True` for any use case where you don't have full control of the loaded file. Please open an issue on GitHub for any issues related to this experimental feature.
  self.data, self.slices = torch.load(self.processed_paths[0])
