STDOUT:
Results will be saved in /home/philip/projects/ltspice_examples_code_repo/Circuit-Completion-Using-GNNs/component_classification_with_link_prediction_head/evaluation/FEGIN/results/model_FEGIN_dataset_ltspice_examples
Command line input: python main.py --data ltspice_examples --representation component_component --model FEGIN --layers 2 --hiddens 64 --batch_size 128 --lr 0.001 --emb_size 250 --epochs 100 --save_appendix component_component_L2_H64_BS128_LR0.001_E250 --no_val
 is saved.
-----
ltspice_examples - FEGIN
Using 2 layers, 64 hidden units, h = 2
Loading component_component representation dataset
ENTERED
Training FEGIN on component_component representation
Train: 3556, Test: 845
##################ITERATION #0 ****************************************
 epoch: 0, train_loss: 1.3136, test_loss: 1.2545, test_f1: 0.2274
 epoch: 1, train_loss: 1.1968, test_loss: 1.1579, test_f1: 0.3352
 epoch: 2, train_loss: 1.1534, test_loss: 1.1042, test_f1: 0.3653
 epoch: 3, train_loss: 1.1150, test_loss: 1.0643, test_f1: 0.4594
 epoch: 4, train_loss: 1.0849, test_loss: 1.0189, test_f1: 0.4594
 epoch: 5, train_loss: 1.0597, test_loss: 1.0018, test_f1: 0.4941
 epoch: 6, train_loss: 1.0288, test_loss: 1.0060, test_f1: 0.4568
 epoch: 7, train_loss: 0.9997, test_loss: 0.9491, test_f1: 0.4976
 epoch: 8, train_loss: 0.9772, test_loss: 0.9617, test_f1: 0.5066
 epoch: 9, train_loss: 0.9641, test_loss: 0.9468, test_f1: 0.5152
 epoch: 10, train_loss: 0.9394, test_loss: 0.9367, test_f1: 0.5179
 epoch: 11, train_loss: 0.9220, test_loss: 0.9247, test_f1: 0.5276
 epoch: 12, train_loss: 0.9135, test_loss: 0.9493, test_f1: 0.4786
 epoch: 13, train_loss: 0.8847, test_loss: 0.9561, test_f1: 0.5033
 epoch: 14, train_loss: 0.8931, test_loss: 0.9028, test_f1: 0.5043
 epoch: 15, train_loss: 0.8746, test_loss: 0.9360, test_f1: 0.5144
 epoch: 16, train_loss: 0.8635, test_loss: 0.9472, test_f1: 0.5315
 epoch: 17, train_loss: 0.8581, test_loss: 0.9607, test_f1: 0.5225
 epoch: 18, train_loss: 0.8473, test_loss: 0.9918, test_f1: 0.5072
 epoch: 19, train_loss: 0.8380, test_loss: 0.9727, test_f1: 0.5078
 epoch: 20, train_loss: 0.8351, test_loss: 0.9494, test_f1: 0.5387
 epoch: 21, train_loss: 0.8111, test_loss: 0.9895, test_f1: 0.5037
 epoch: 22, train_loss: 0.8126, test_loss: 0.9523, test_f1: 0.5298
 epoch: 23, train_loss: 0.7968, test_loss: 0.9775, test_f1: 0.5127
 epoch: 24, train_loss: 0.7800, test_loss: 1.0007, test_f1: 0.5276
 epoch: 25, train_loss: 0.7864, test_loss: 0.9851, test_f1: 0.5217
 epoch: 26, train_loss: 0.7650, test_loss: 1.0362, test_f1: 0.5368
 epoch: 27, train_loss: 0.7637, test_loss: 1.0257, test_f1: 0.4847
 epoch: 28, train_loss: 0.7602, test_loss: 1.0374, test_f1: 0.4994
 epoch: 29, train_loss: 0.7525, test_loss: 0.9912, test_f1: 0.5276
 epoch: 30, train_loss: 0.7554, test_loss: 1.0565, test_f1: 0.5015
 epoch: 31, train_loss: 0.7407, test_loss: 1.0311, test_f1: 0.5147
 epoch: 32, train_loss: 0.7289, test_loss: 1.1005, test_f1: 0.5199
 epoch: 33, train_loss: 0.7205, test_loss: 1.0557, test_f1: 0.5226
 epoch: 34, train_loss: 0.7321, test_loss: 1.0454, test_f1: 0.5216
 epoch: 35, train_loss: 0.7164, test_loss: 1.0560, test_f1: 0.5276
 epoch: 36, train_loss: 0.7120, test_loss: 1.0311, test_f1: 0.5407
 epoch: 37, train_loss: 0.6996, test_loss: 1.0581, test_f1: 0.5530
 epoch: 38, train_loss: 0.6891, test_loss: 1.0601, test_f1: 0.5194
 epoch: 39, train_loss: 0.6924, test_loss: 1.1183, test_f1: 0.5300
 epoch: 40, train_loss: 0.6808, test_loss: 1.1745, test_f1: 0.4895
 epoch: 41, train_loss: 0.6726, test_loss: 1.1221, test_f1: 0.5220
 epoch: 42, train_loss: 0.6659, test_loss: 1.0668, test_f1: 0.5208
 epoch: 43, train_loss: 0.6524, test_loss: 1.1792, test_f1: 0.5342
 epoch: 44, train_loss: 0.6513, test_loss: 1.1684, test_f1: 0.5359
 epoch: 45, train_loss: 0.6490, test_loss: 1.1649, test_f1: 0.5332
 epoch: 46, train_loss: 0.6311, test_loss: 1.1663, test_f1: 0.5371
 epoch: 47, train_loss: 0.6360, test_loss: 1.1078, test_f1: 0.5583
 epoch: 48, train_loss: 0.6107, test_loss: 1.1299, test_f1: 0.5276
 epoch: 49, train_loss: 0.6171, test_loss: 1.2549, test_f1: 0.5134
 epoch: 50, train_loss: 0.6115, test_loss: 1.1844, test_f1: 0.5637
 epoch: 51, train_loss: 0.5860, test_loss: 1.1559, test_f1: 0.5399
 epoch: 52, train_loss: 0.5697, test_loss: 1.1884, test_f1: 0.5255
 epoch: 53, train_loss: 0.5631, test_loss: 1.1339, test_f1: 0.5528
 epoch: 54, train_loss: 0.5570, test_loss: 1.2005, test_f1: 0.5429
 epoch: 55, train_loss: 0.5682, test_loss: 1.1158, test_f1: 0.5620
 epoch: 56, train_loss: 0.5662, test_loss: 1.1772, test_f1: 0.5584
 epoch: 57, train_loss: 0.5616, test_loss: 1.1737, test_f1: 0.5623
 epoch: 58, train_loss: 0.5468, test_loss: 1.2229, test_f1: 0.5192
 epoch: 59, train_loss: 0.5321, test_loss: 1.2736, test_f1: 0.5298
 epoch: 60, train_loss: 0.5362, test_loss: 1.2585, test_f1: 0.5377
 epoch: 61, train_loss: 0.5298, test_loss: 1.3326, test_f1: 0.5276
 epoch: 62, train_loss: 0.5392, test_loss: 1.2472, test_f1: 0.5344
 epoch: 63, train_loss: 0.5299, test_loss: 1.3535, test_f1: 0.5256
 epoch: 64, train_loss: 0.5293, test_loss: 1.1766, test_f1: 0.5623
 epoch: 65, train_loss: 0.5410, test_loss: 1.2444, test_f1: 0.5463
 epoch: 66, train_loss: 0.5277, test_loss: 1.3751, test_f1: 0.5596
 epoch: 67, train_loss: 0.5106, test_loss: 1.2674, test_f1: 0.5366
 epoch: 68, train_loss: 0.5193, test_loss: 1.2881, test_f1: 0.5370
 epoch: 69, train_loss: 0.5081, test_loss: 1.2829, test_f1: 0.5520
 epoch: 70, train_loss: 0.5099, test_loss: 1.2717, test_f1: 0.5499
 epoch: 71, train_loss: 0.4878, test_loss: 1.2852, test_f1: 0.5451
 epoch: 72, train_loss: 0.4874, test_loss: 1.3102, test_f1: 0.5333
 epoch: 73, train_loss: 0.5120, test_loss: 1.3674, test_f1: 0.5240
 epoch: 74, train_loss: 0.5110, test_loss: 1.4626, test_f1: 0.5465
 epoch: 75, train_loss: 0.4937, test_loss: 1.2985, test_f1: 0.5624
 epoch: 76, train_loss: 0.4864, test_loss: 1.3698, test_f1: 0.5395
 epoch: 77, train_loss: 0.4923, test_loss: 1.4001, test_f1: 0.5147
 epoch: 78, train_loss: 0.4941, test_loss: 1.2966, test_f1: 0.5707
 epoch: 79, train_loss: 0.4764, test_loss: 1.4199, test_f1: 0.5518
 epoch: 80, train_loss: 0.4716, test_loss: 1.3171, test_f1: 0.5807
 epoch: 81, train_loss: 0.4752, test_loss: 1.3658, test_f1: 0.5421
 epoch: 82, train_loss: 0.4786, test_loss: 1.4398, test_f1: 0.5149
 epoch: 83, train_loss: 0.4752, test_loss: 1.3791, test_f1: 0.5424
 epoch: 84, train_loss: 0.4636, test_loss: 1.3774, test_f1: 0.5596
 epoch: 85, train_loss: 0.4666, test_loss: 1.4068, test_f1: 0.5359
 epoch: 86, train_loss: 0.4651, test_loss: 1.4060, test_f1: 0.5499
 epoch: 87, train_loss: 0.4668, test_loss: 1.4146, test_f1: 0.5396
 epoch: 88, train_loss: 0.4506, test_loss: 1.4908, test_f1: 0.5396
 epoch: 89, train_loss: 0.4444, test_loss: 1.5316, test_f1: 0.5416
 epoch: 90, train_loss: 0.4511, test_loss: 1.4267, test_f1: 0.5669
 epoch: 91, train_loss: 0.4596, test_loss: 1.4658, test_f1: 0.5305
 epoch: 92, train_loss: 0.4727, test_loss: 1.3782, test_f1: 0.5518
 epoch: 93, train_loss: 0.4606, test_loss: 1.4673, test_f1: 0.5214
 epoch: 94, train_loss: 0.4409, test_loss: 1.4647, test_f1: 0.5322
 epoch: 95, train_loss: 0.4572, test_loss: 1.4162, test_f1: 0.5665
 epoch: 96, train_loss: 0.4381, test_loss: 1.4849, test_f1: 0.5446
 epoch: 97, train_loss: 0.4347, test_loss: 1.5237, test_f1: 0.5164
 epoch: 98, train_loss: 0.4246, test_loss: 1.5152, test_f1: 0.5506
 epoch: 99, train_loss: 0.4304, test_loss: 1.5433, test_f1: 0.5494
##################ITERATION #1 ****************************************
 epoch: 0, train_loss: 1.2500, test_loss: 1.2614, test_f1: 0.3268
 epoch: 1, train_loss: 1.1316, test_loss: 1.1019, test_f1: 0.4104
 epoch: 2, train_loss: 1.0790, test_loss: 0.9969, test_f1: 0.4508
 epoch: 3, train_loss: 1.0253, test_loss: 0.9859, test_f1: 0.4570
 epoch: 4, train_loss: 0.9953, test_loss: 0.9416, test_f1: 0.4914
 epoch: 5, train_loss: 0.9818, test_loss: 0.9284, test_f1: 0.4855
 epoch: 6, train_loss: 0.9567, test_loss: 0.9965, test_f1: 0.4844
 epoch: 7, train_loss: 0.9409, test_loss: 0.9535, test_f1: 0.4734
 epoch: 8, train_loss: 0.9192, test_loss: 0.9171, test_f1: 0.4828
 epoch: 9, train_loss: 0.9054, test_loss: 1.0138, test_f1: 0.4672
 epoch: 10, train_loss: 0.8779, test_loss: 0.9388, test_f1: 0.5165
 epoch: 11, train_loss: 0.8724, test_loss: 0.9646, test_f1: 0.5149
 epoch: 12, train_loss: 0.8602, test_loss: 0.9510, test_f1: 0.5232
 epoch: 13, train_loss: 0.8441, test_loss: 0.9858, test_f1: 0.4768
 epoch: 14, train_loss: 0.8374, test_loss: 0.9982, test_f1: 0.5174
 epoch: 15, train_loss: 0.8282, test_loss: 0.9355, test_f1: 0.5332
 epoch: 16, train_loss: 0.8086, test_loss: 1.0179, test_f1: 0.5054
 epoch: 17, train_loss: 0.7897, test_loss: 1.0080, test_f1: 0.5058
 epoch: 18, train_loss: 0.7967, test_loss: 0.9999, test_f1: 0.5399
 epoch: 19, train_loss: 0.7784, test_loss: 1.0404, test_f1: 0.4942
 epoch: 20, train_loss: 0.7657, test_loss: 1.0337, test_f1: 0.5163
 epoch: 21, train_loss: 0.7640, test_loss: 1.0872, test_f1: 0.4954
 epoch: 22, train_loss: 0.7581, test_loss: 1.0485, test_f1: 0.5088
 epoch: 23, train_loss: 0.7362, test_loss: 1.1047, test_f1: 0.5190
 epoch: 24, train_loss: 0.7426, test_loss: 1.0625, test_f1: 0.5464
 epoch: 25, train_loss: 0.7220, test_loss: 1.1034, test_f1: 0.5021
 epoch: 26, train_loss: 0.7111, test_loss: 1.1126, test_f1: 0.5199
 epoch: 27, train_loss: 0.7113, test_loss: 1.1623, test_f1: 0.5144
 epoch: 28, train_loss: 0.7146, test_loss: 1.1362, test_f1: 0.5322
 epoch: 29, train_loss: 0.7098, test_loss: 1.1118, test_f1: 0.5313
 epoch: 30, train_loss: 0.6994, test_loss: 1.2137, test_f1: 0.4795
 epoch: 31, train_loss: 0.6840, test_loss: 1.2042, test_f1: 0.5101
 epoch: 32, train_loss: 0.6807, test_loss: 1.1874, test_f1: 0.5188
 epoch: 33, train_loss: 0.6668, test_loss: 1.1529, test_f1: 0.5584
 epoch: 34, train_loss: 0.6806, test_loss: 1.2140, test_f1: 0.5275
 epoch: 35, train_loss: 0.6579, test_loss: 1.1966, test_f1: 0.4999
 epoch: 36, train_loss: 0.6591, test_loss: 1.2120, test_f1: 0.5291
 epoch: 37, train_loss: 0.6398, test_loss: 1.1782, test_f1: 0.5310
 epoch: 38, train_loss: 0.6404, test_loss: 1.2217, test_f1: 0.5559
 epoch: 39, train_loss: 0.6185, test_loss: 1.2830, test_f1: 0.4835
 epoch: 40, train_loss: 0.6438, test_loss: 1.2341, test_f1: 0.5262
 epoch: 41, train_loss: 0.6149, test_loss: 1.1875, test_f1: 0.5524
 epoch: 42, train_loss: 0.6131, test_loss: 1.3039, test_f1: 0.5248
 epoch: 43, train_loss: 0.5981, test_loss: 1.2459, test_f1: 0.5183
 epoch: 44, train_loss: 0.6062, test_loss: 1.4130, test_f1: 0.5096
 epoch: 45, train_loss: 0.5829, test_loss: 1.3495, test_f1: 0.5259
 epoch: 46, train_loss: 0.5803, test_loss: 1.3462, test_f1: 0.5449
 epoch: 47, train_loss: 0.5890, test_loss: 1.3184, test_f1: 0.5191
 epoch: 48, train_loss: 0.5740, test_loss: 1.3188, test_f1: 0.5002
 epoch: 49, train_loss: 0.5835, test_loss: 1.3470, test_f1: 0.5166
 epoch: 50, train_loss: 0.5718, test_loss: 1.2922, test_f1: 0.5210
 epoch: 51, train_loss: 0.5298, test_loss: 1.3384, test_f1: 0.5402
 epoch: 52, train_loss: 0.5072, test_loss: 1.4132, test_f1: 0.4956
 epoch: 53, train_loss: 0.5031, test_loss: 1.4030, test_f1: 0.5079
 epoch: 54, train_loss: 0.4975, test_loss: 1.4362, test_f1: 0.4831
 epoch: 55, train_loss: 0.5084, test_loss: 1.4293, test_f1: 0.5226
 epoch: 56, train_loss: 0.4936, test_loss: 1.3782, test_f1: 0.5408
 epoch: 57, train_loss: 0.4871, test_loss: 1.5186, test_f1: 0.5348
 epoch: 58, train_loss: 0.4940, test_loss: 1.5617, test_f1: 0.5051
 epoch: 59, train_loss: 0.4957, test_loss: 1.4365, test_f1: 0.5195
 epoch: 60, train_loss: 0.4687, test_loss: 1.4992, test_f1: 0.5327
 epoch: 61, train_loss: 0.4741, test_loss: 1.5532, test_f1: 0.5137
 epoch: 62, train_loss: 0.4744, test_loss: 1.6020, test_f1: 0.5101
 epoch: 63, train_loss: 0.4734, test_loss: 1.5735, test_f1: 0.5155
 epoch: 64, train_loss: 0.4660, test_loss: 1.6537, test_f1: 0.5189
 epoch: 65, train_loss: 0.4606, test_loss: 1.5413, test_f1: 0.5475
 epoch: 66, train_loss: 0.4574, test_loss: 1.6260, test_f1: 0.4938
 epoch: 67, train_loss: 0.4649, test_loss: 1.5966, test_f1: 0.5379
 epoch: 68, train_loss: 0.4644, test_loss: 1.5415, test_f1: 0.5220
 epoch: 69, train_loss: 0.4454, test_loss: 1.6771, test_f1: 0.5051
 epoch: 70, train_loss: 0.4433, test_loss: 1.7190, test_f1: 0.5050
 epoch: 71, train_loss: 0.4565, test_loss: 1.8215, test_f1: 0.4994
 epoch: 72, train_loss: 0.4247, test_loss: 1.6303, test_f1: 0.5073
 epoch: 73, train_loss: 0.4435, test_loss: 1.6132, test_f1: 0.5295
 epoch: 74, train_loss: 0.4523, test_loss: 1.6685, test_f1: 0.5024
 epoch: 75, train_loss: 0.4343, test_loss: 1.6593, test_f1: 0.5239
 epoch: 76, train_loss: 0.4190, test_loss: 1.7900, test_f1: 0.5206
 epoch: 77, train_loss: 0.4222, test_loss: 1.8144, test_f1: 0.5186
 epoch: 78, train_loss: 0.4384, test_loss: 1.6419, test_f1: 0.5405
 epoch: 79, train_loss: 0.4451, test_loss: 1.7475, test_f1: 0.5443
 epoch: 80, train_loss: 0.4219, test_loss: 1.7335, test_f1: 0.5258
 epoch: 81, train_loss: 0.4219, test_loss: 1.7161, test_f1: 0.5283
 epoch: 82, train_loss: 0.4327, test_loss: 1.7863, test_f1: 0.5159
 epoch: 83, train_loss: 0.4201, test_loss: 1.5867, test_f1: 0.5533
 epoch: 84, train_loss: 0.4093, test_loss: 1.8326, test_f1: 0.5137
 epoch: 85, train_loss: 0.3968, test_loss: 1.8538, test_f1: 0.5193
 epoch: 86, train_loss: 0.3982, test_loss: 1.7148, test_f1: 0.5257
 epoch: 87, train_loss: 0.3832, test_loss: 1.8376, test_f1: 0.5206
 epoch: 88, train_loss: 0.3929, test_loss: 1.8932, test_f1: 0.5177
 epoch: 89, train_loss: 0.4134, test_loss: 1.8553, test_f1: 0.5331
 epoch: 90, train_loss: 0.4034, test_loss: 1.8957, test_f1: 0.5283
 epoch: 91, train_loss: 0.3972, test_loss: 1.8501, test_f1: 0.5315
 epoch: 92, train_loss: 0.3867, test_loss: 1.9100, test_f1: 0.5123
 epoch: 93, train_loss: 0.3803, test_loss: 1.7960, test_f1: 0.5349
 epoch: 94, train_loss: 0.3720, test_loss: 1.9360, test_f1: 0.5247
 epoch: 95, train_loss: 0.3788, test_loss: 1.8078, test_f1: 0.5670
 epoch: 96, train_loss: 0.3812, test_loss: 1.9404, test_f1: 0.5399
 epoch: 97, train_loss: 0.3753, test_loss: 1.9055, test_f1: 0.5139
 epoch: 98, train_loss: 0.3701, test_loss: 1.9244, test_f1: 0.5364
 epoch: 99, train_loss: 0.3598, test_loss: 1.8844, test_f1: 0.5653
##################ITERATION #2 ****************************************
 epoch: 0, train_loss: 1.3155, test_loss: 1.2387, test_f1: 0.2914
 epoch: 1, train_loss: 1.1652, test_loss: 1.1120, test_f1: 0.4076
 epoch: 2, train_loss: 1.1323, test_loss: 1.0689, test_f1: 0.4155
 epoch: 3, train_loss: 1.1082, test_loss: 1.0395, test_f1: 0.4806
 epoch: 4, train_loss: 1.0822, test_loss: 1.0118, test_f1: 0.4544
 epoch: 5, train_loss: 1.0503, test_loss: 1.0026, test_f1: 0.4555
 epoch: 6, train_loss: 1.0351, test_loss: 0.9842, test_f1: 0.4757
 epoch: 7, train_loss: 1.0011, test_loss: 0.9586, test_f1: 0.4895
 epoch: 8, train_loss: 0.9791, test_loss: 0.9708, test_f1: 0.4730
 epoch: 9, train_loss: 0.9652, test_loss: 0.9432, test_f1: 0.4873
 epoch: 10, train_loss: 0.9475, test_loss: 0.9618, test_f1: 0.4810
 epoch: 11, train_loss: 0.9368, test_loss: 0.9362, test_f1: 0.4950
 epoch: 12, train_loss: 0.9312, test_loss: 0.9765, test_f1: 0.4841
 epoch: 13, train_loss: 0.9218, test_loss: 0.9506, test_f1: 0.5121
 epoch: 14, train_loss: 0.9015, test_loss: 0.9892, test_f1: 0.5065
 epoch: 15, train_loss: 0.8800, test_loss: 0.9946, test_f1: 0.4972
 epoch: 16, train_loss: 0.8840, test_loss: 0.9743, test_f1: 0.5291
 epoch: 17, train_loss: 0.8753, test_loss: 0.9958, test_f1: 0.4911
 epoch: 18, train_loss: 0.8712, test_loss: 0.9623, test_f1: 0.5082
 epoch: 19, train_loss: 0.8478, test_loss: 0.9777, test_f1: 0.5113
 epoch: 20, train_loss: 0.8420, test_loss: 0.9618, test_f1: 0.5369
 epoch: 21, train_loss: 0.8349, test_loss: 0.9823, test_f1: 0.5007
 epoch: 22, train_loss: 0.8357, test_loss: 0.9575, test_f1: 0.5271
 epoch: 23, train_loss: 0.8117, test_loss: 0.9641, test_f1: 0.5216
 epoch: 24, train_loss: 0.8082, test_loss: 0.9641, test_f1: 0.5172
 epoch: 25, train_loss: 0.8006, test_loss: 0.9486, test_f1: 0.5366
 epoch: 26, train_loss: 0.7907, test_loss: 1.0015, test_f1: 0.5284
 epoch: 27, train_loss: 0.7931, test_loss: 1.0083, test_f1: 0.5252
 epoch: 28, train_loss: 0.7818, test_loss: 1.0583, test_f1: 0.5229
 epoch: 29, train_loss: 0.7705, test_loss: 1.0349, test_f1: 0.5006
 epoch: 30, train_loss: 0.7592, test_loss: 1.0525, test_f1: 0.5158
 epoch: 31, train_loss: 0.7498, test_loss: 1.0241, test_f1: 0.5444
 epoch: 32, train_loss: 0.7388, test_loss: 1.0909, test_f1: 0.5589
 epoch: 33, train_loss: 0.7399, test_loss: 1.1566, test_f1: 0.5385
 epoch: 34, train_loss: 0.7397, test_loss: 1.0929, test_f1: 0.5399
 epoch: 35, train_loss: 0.7213, test_loss: 1.0693, test_f1: 0.5796
 epoch: 36, train_loss: 0.7219, test_loss: 1.0026, test_f1: 0.5364
 epoch: 37, train_loss: 0.7060, test_loss: 1.1068, test_f1: 0.5319
 epoch: 38, train_loss: 0.6937, test_loss: 1.0608, test_f1: 0.5429
 epoch: 39, train_loss: 0.6886, test_loss: 1.1608, test_f1: 0.5531
 epoch: 40, train_loss: 0.6874, test_loss: 1.1481, test_f1: 0.5166
 epoch: 41, train_loss: 0.6981, test_loss: 1.0356, test_f1: 0.5450
 epoch: 42, train_loss: 0.6783, test_loss: 1.1118, test_f1: 0.5351
 epoch: 43, train_loss: 0.6678, test_loss: 1.1332, test_f1: 0.5372
 epoch: 44, train_loss: 0.6770, test_loss: 1.1535, test_f1: 0.5297
 epoch: 45, train_loss: 0.6536, test_loss: 1.1341, test_f1: 0.5588
 epoch: 46, train_loss: 0.6385, test_loss: 1.1627, test_f1: 0.5020
 epoch: 47, train_loss: 0.6458, test_loss: 1.1720, test_f1: 0.5595
 epoch: 48, train_loss: 0.6320, test_loss: 1.1651, test_f1: 0.5288
 epoch: 49, train_loss: 0.6341, test_loss: 1.2119, test_f1: 0.5032
 epoch: 50, train_loss: 0.6446, test_loss: 1.1481, test_f1: 0.5590
 epoch: 51, train_loss: 0.6075, test_loss: 1.1751, test_f1: 0.5552
 epoch: 52, train_loss: 0.5940, test_loss: 1.1365, test_f1: 0.5260
 epoch: 53, train_loss: 0.5615, test_loss: 1.1427, test_f1: 0.5752
 epoch: 54, train_loss: 0.5665, test_loss: 1.1665, test_f1: 0.5394
 epoch: 55, train_loss: 0.5520, test_loss: 1.1734, test_f1: 0.5646
 epoch: 56, train_loss: 0.5589, test_loss: 1.1180, test_f1: 0.5437
 epoch: 57, train_loss: 0.5607, test_loss: 1.1424, test_f1: 0.5659
 epoch: 58, train_loss: 0.5509, test_loss: 1.1334, test_f1: 0.5451
 epoch: 59, train_loss: 0.5583, test_loss: 1.1908, test_f1: 0.5545
 epoch: 60, train_loss: 0.5369, test_loss: 1.2332, test_f1: 0.5206
 epoch: 61, train_loss: 0.5408, test_loss: 1.2065, test_f1: 0.5539
 epoch: 62, train_loss: 0.5521, test_loss: 1.2141, test_f1: 0.5575
 epoch: 63, train_loss: 0.5300, test_loss: 1.2215, test_f1: 0.5503
 epoch: 64, train_loss: 0.5184, test_loss: 1.2101, test_f1: 0.5601
 epoch: 65, train_loss: 0.5174, test_loss: 1.2667, test_f1: 0.5500
 epoch: 66, train_loss: 0.5058, test_loss: 1.2846, test_f1: 0.5502
 epoch: 67, train_loss: 0.5127, test_loss: 1.2828, test_f1: 0.5487
 epoch: 68, train_loss: 0.5063, test_loss: 1.2891, test_f1: 0.5372
 epoch: 69, train_loss: 0.5101, test_loss: 1.2400, test_f1: 0.5556
 epoch: 70, train_loss: 0.5109, test_loss: 1.3109, test_f1: 0.5379
 epoch: 71, train_loss: 0.4950, test_loss: 1.2293, test_f1: 0.5523
 epoch: 72, train_loss: 0.4963, test_loss: 1.2302, test_f1: 0.5463
 epoch: 73, train_loss: 0.4893, test_loss: 1.3127, test_f1: 0.5459
 epoch: 74, train_loss: 0.4898, test_loss: 1.2878, test_f1: 0.5390
 epoch: 75, train_loss: 0.4983, test_loss: 1.2245, test_f1: 0.5418
 epoch: 76, train_loss: 0.4809, test_loss: 1.3311, test_f1: 0.5326
 epoch: 77, train_loss: 0.4945, test_loss: 1.2633, test_f1: 0.5405
 epoch: 78, train_loss: 0.4921, test_loss: 1.2534, test_f1: 0.5616
 epoch: 79, train_loss: 0.4767, test_loss: 1.3434, test_f1: 0.5431
 epoch: 80, train_loss: 0.4812, test_loss: 1.3060, test_f1: 0.5633
 epoch: 81, train_loss: 0.4630, test_loss: 1.2871, test_f1: 0.5589
 epoch: 82, train_loss: 0.4634, test_loss: 1.2945, test_f1: 0.5761
 epoch: 83, train_loss: 0.4736, test_loss: 1.3926, test_f1: 0.5398
 epoch: 84, train_loss: 0.4587, test_loss: 1.2884, test_f1: 0.5396
 epoch: 85, train_loss: 0.4720, test_loss: 1.2879, test_f1: 0.5422
 epoch: 86, train_loss: 0.4624, test_loss: 1.3745, test_f1: 0.5670
 epoch: 87, train_loss: 0.4571, test_loss: 1.2640, test_f1: 0.5620
 epoch: 88, train_loss: 0.4471, test_loss: 1.3225, test_f1: 0.5340
 epoch: 89, train_loss: 0.4446, test_loss: 1.2793, test_f1: 0.5496
 epoch: 90, train_loss: 0.4319, test_loss: 1.3594, test_f1: 0.5437
 epoch: 91, train_loss: 0.4478, test_loss: 1.3723, test_f1: 0.5417
 epoch: 92, train_loss: 0.4431, test_loss: 1.3773, test_f1: 0.5500
 epoch: 93, train_loss: 0.4308, test_loss: 1.4210, test_f1: 0.5489
 epoch: 94, train_loss: 0.4208, test_loss: 1.4103, test_f1: 0.5322
 epoch: 95, train_loss: 0.4341, test_loss: 1.3906, test_f1: 0.5494
 epoch: 96, train_loss: 0.4249, test_loss: 1.3964, test_f1: 0.5360
 epoch: 97, train_loss: 0.4223, test_loss: 1.4911, test_f1: 0.5355
 epoch: 98, train_loss: 0.4009, test_loss: 1.3640, test_f1: 0.5886
 epoch: 99, train_loss: 0.4226, test_loss: 1.4319, test_f1: 0.5493
##################ITERATION #3 ****************************************
 epoch: 0, train_loss: 1.3456, test_loss: 1.2289, test_f1: 0.3385
 epoch: 1, train_loss: 1.1752, test_loss: 1.1099, test_f1: 0.4466
 epoch: 2, train_loss: 1.1216, test_loss: 1.0645, test_f1: 0.4634
 epoch: 3, train_loss: 1.0775, test_loss: 1.0146, test_f1: 0.4619
 epoch: 4, train_loss: 1.0559, test_loss: 0.9714, test_f1: 0.4718
 epoch: 5, train_loss: 1.0269, test_loss: 0.9577, test_f1: 0.4914
 epoch: 6, train_loss: 1.0034, test_loss: 0.9502, test_f1: 0.4545
 epoch: 7, train_loss: 0.9900, test_loss: 0.9770, test_f1: 0.4777
 epoch: 8, train_loss: 0.9680, test_loss: 0.9463, test_f1: 0.4936
 epoch: 9, train_loss: 0.9663, test_loss: 0.9520, test_f1: 0.5031
 epoch: 10, train_loss: 0.9379, test_loss: 0.9358, test_f1: 0.5172
 epoch: 11, train_loss: 0.9239, test_loss: 0.9302, test_f1: 0.5066
 epoch: 12, train_loss: 0.9116, test_loss: 1.0415, test_f1: 0.4970
 epoch: 13, train_loss: 0.9024, test_loss: 0.9336, test_f1: 0.5168
 epoch: 14, train_loss: 0.8828, test_loss: 0.9105, test_f1: 0.5050
 epoch: 15, train_loss: 0.8670, test_loss: 0.9302, test_f1: 0.5150
 epoch: 16, train_loss: 0.8738, test_loss: 0.9351, test_f1: 0.4992
 epoch: 17, train_loss: 0.8795, test_loss: 0.9427, test_f1: 0.5301
 epoch: 18, train_loss: 0.8465, test_loss: 0.9276, test_f1: 0.5254
 epoch: 19, train_loss: 0.8422, test_loss: 0.9378, test_f1: 0.4834
 epoch: 20, train_loss: 0.8430, test_loss: 0.9891, test_f1: 0.5058
 epoch: 21, train_loss: 0.8128, test_loss: 0.9347, test_f1: 0.5295
 epoch: 22, train_loss: 0.8068, test_loss: 0.9286, test_f1: 0.5372
 epoch: 23, train_loss: 0.8155, test_loss: 1.0014, test_f1: 0.5195
 epoch: 24, train_loss: 0.8141, test_loss: 0.9389, test_f1: 0.5318
 epoch: 25, train_loss: 0.8137, test_loss: 0.9356, test_f1: 0.5148
 epoch: 26, train_loss: 0.8003, test_loss: 0.8933, test_f1: 0.5475
 epoch: 27, train_loss: 0.7979, test_loss: 0.9616, test_f1: 0.4994
 epoch: 28, train_loss: 0.7829, test_loss: 1.0008, test_f1: 0.5031
 epoch: 29, train_loss: 0.7855, test_loss: 1.0290, test_f1: 0.4863
 epoch: 30, train_loss: 0.7760, test_loss: 0.9593, test_f1: 0.5343
 epoch: 31, train_loss: 0.7585, test_loss: 0.8998, test_f1: 0.5446
 epoch: 32, train_loss: 0.7566, test_loss: 0.9743, test_f1: 0.5376
 epoch: 33, train_loss: 0.7544, test_loss: 0.9289, test_f1: 0.5357
 epoch: 34, train_loss: 0.7532, test_loss: 0.9848, test_f1: 0.5432
 epoch: 35, train_loss: 0.7424, test_loss: 1.0038, test_f1: 0.4816
 epoch: 36, train_loss: 0.7473, test_loss: 0.9211, test_f1: 0.5389
 epoch: 37, train_loss: 0.7407, test_loss: 1.0546, test_f1: 0.5122
 epoch: 38, train_loss: 0.7246, test_loss: 0.9896, test_f1: 0.5267
 epoch: 39, train_loss: 0.7056, test_loss: 1.1300, test_f1: 0.5212
 epoch: 40, train_loss: 0.7257, test_loss: 1.0245, test_f1: 0.5013
 epoch: 41, train_loss: 0.7036, test_loss: 0.9745, test_f1: 0.5270
 epoch: 42, train_loss: 0.6964, test_loss: 1.0809, test_f1: 0.5051
 epoch: 43, train_loss: 0.7003, test_loss: 1.0623, test_f1: 0.5459
 epoch: 44, train_loss: 0.7000, test_loss: 1.0328, test_f1: 0.5416
 epoch: 45, train_loss: 0.6924, test_loss: 1.0841, test_f1: 0.5423
 epoch: 46, train_loss: 0.6776, test_loss: 1.0501, test_f1: 0.5227
 epoch: 47, train_loss: 0.7002, test_loss: 1.0315, test_f1: 0.5399
 epoch: 48, train_loss: 0.6832, test_loss: 1.0367, test_f1: 0.5268
 epoch: 49, train_loss: 0.6851, test_loss: 1.0711, test_f1: 0.5188
 epoch: 50, train_loss: 0.6631, test_loss: 0.9895, test_f1: 0.5720
 epoch: 51, train_loss: 0.6682, test_loss: 1.0366, test_f1: 0.5557
 epoch: 52, train_loss: 0.6315, test_loss: 1.0370, test_f1: 0.5469
 epoch: 53, train_loss: 0.6277, test_loss: 1.1344, test_f1: 0.5152
 epoch: 54, train_loss: 0.6297, test_loss: 1.0527, test_f1: 0.5177
 epoch: 55, train_loss: 0.6107, test_loss: 1.1424, test_f1: 0.5006
 epoch: 56, train_loss: 0.6235, test_loss: 1.1132, test_f1: 0.5308
 epoch: 57, train_loss: 0.6221, test_loss: 1.1575, test_f1: 0.5489
 epoch: 58, train_loss: 0.6029, test_loss: 1.1456, test_f1: 0.5333
 epoch: 59, train_loss: 0.6118, test_loss: 1.1183, test_f1: 0.5412
 epoch: 60, train_loss: 0.5889, test_loss: 1.2745, test_f1: 0.5001
 epoch: 61, train_loss: 0.6040, test_loss: 1.0754, test_f1: 0.5481
 epoch: 62, train_loss: 0.5992, test_loss: 1.2786, test_f1: 0.5056
 epoch: 63, train_loss: 0.6001, test_loss: 1.2337, test_f1: 0.4990
 epoch: 64, train_loss: 0.5859, test_loss: 1.1399, test_f1: 0.5319
 epoch: 65, train_loss: 0.5943, test_loss: 1.1724, test_f1: 0.5503
 epoch: 66, train_loss: 0.5760, test_loss: 1.2860, test_f1: 0.4897
 epoch: 67, train_loss: 0.5664, test_loss: 1.2611, test_f1: 0.5251
 epoch: 68, train_loss: 0.5813, test_loss: 1.2457, test_f1: 0.5445
 epoch: 69, train_loss: 0.5735, test_loss: 1.2796, test_f1: 0.5489
 epoch: 70, train_loss: 0.5648, test_loss: 1.2001, test_f1: 0.5663
 epoch: 71, train_loss: 0.5690, test_loss: 1.2707, test_f1: 0.5189
 epoch: 72, train_loss: 0.5462, test_loss: 1.1771, test_f1: 0.5607
 epoch: 73, train_loss: 0.5654, test_loss: 1.1711, test_f1: 0.5468
 epoch: 74, train_loss: 0.5439, test_loss: 1.3191, test_f1: 0.5320
 epoch: 75, train_loss: 0.5327, test_loss: 1.4014, test_f1: 0.5247
 epoch: 76, train_loss: 0.5460, test_loss: 1.4355, test_f1: 0.5033
 epoch: 77, train_loss: 0.5452, test_loss: 1.3013, test_f1: 0.5449
 epoch: 78, train_loss: 0.5419, test_loss: 1.3243, test_f1: 0.5036
 epoch: 79, train_loss: 0.5462, test_loss: 1.3448, test_f1: 0.5453
 epoch: 80, train_loss: 0.5493, test_loss: 1.3535, test_f1: 0.5451
 epoch: 81, train_loss: 0.5259, test_loss: 1.3588, test_f1: 0.5082
 epoch: 82, train_loss: 0.5243, test_loss: 1.2573, test_f1: 0.5510
 epoch: 83, train_loss: 0.5260, test_loss: 1.5060, test_f1: 0.5160
 epoch: 84, train_loss: 0.5254, test_loss: 1.4038, test_f1: 0.5297
 epoch: 85, train_loss: 0.5324, test_loss: 1.4621, test_f1: 0.5220
 epoch: 86, train_loss: 0.5462, test_loss: 1.3557, test_f1: 0.5254
 epoch: 87, train_loss: 0.5166, test_loss: 1.4801, test_f1: 0.5196
 epoch: 88, train_loss: 0.5076, test_loss: 1.5219, test_f1: 0.5321
 epoch: 89, train_loss: 0.5084, test_loss: 1.2458, test_f1: 0.5571
 epoch: 90, train_loss: 0.5115, test_loss: 1.2943, test_f1: 0.5780
 epoch: 91, train_loss: 0.4980, test_loss: 1.4990, test_f1: 0.5342
 epoch: 92, train_loss: 0.5089, test_loss: 1.3077, test_f1: 0.5594
 epoch: 93, train_loss: 0.5125, test_loss: 1.3357, test_f1: 0.5322
 epoch: 94, train_loss: 0.4913, test_loss: 1.3378, test_f1: 0.5547
 epoch: 95, train_loss: 0.4796, test_loss: 1.4088, test_f1: 0.5764
 epoch: 96, train_loss: 0.5063, test_loss: 1.5174, test_f1: 0.5480
 epoch: 97, train_loss: 0.4775, test_loss: 1.3917, test_f1: 0.5522
 epoch: 98, train_loss: 0.4843, test_loss: 1.4055, test_f1: 0.5588
 epoch: 99, train_loss: 0.4741, test_loss: 1.6239, test_f1: 0.5163
##################ITERATION #4 ****************************************
 epoch: 0, train_loss: 1.4041, test_loss: 1.2054, test_f1: 0.3866
 epoch: 1, train_loss: 1.1815, test_loss: 1.0636, test_f1: 0.4681
 epoch: 2, train_loss: 1.1073, test_loss: 1.0340, test_f1: 0.4546
 epoch: 3, train_loss: 1.0696, test_loss: 1.0199, test_f1: 0.4811
 epoch: 4, train_loss: 1.0402, test_loss: 1.0502, test_f1: 0.4660
 epoch: 5, train_loss: 1.0223, test_loss: 0.9908, test_f1: 0.4618
 epoch: 6, train_loss: 0.9921, test_loss: 0.9698, test_f1: 0.4899
 epoch: 7, train_loss: 0.9870, test_loss: 0.9860, test_f1: 0.4836
 epoch: 8, train_loss: 0.9752, test_loss: 0.9692, test_f1: 0.5069
 epoch: 9, train_loss: 0.9393, test_loss: 1.0353, test_f1: 0.5045
 epoch: 10, train_loss: 0.9428, test_loss: 1.0132, test_f1: 0.5055
 epoch: 11, train_loss: 0.9278, test_loss: 1.0022, test_f1: 0.4838
 epoch: 12, train_loss: 0.9211, test_loss: 0.9872, test_f1: 0.5452
 epoch: 13, train_loss: 0.9197, test_loss: 0.9933, test_f1: 0.5189
 epoch: 14, train_loss: 0.9143, test_loss: 1.0151, test_f1: 0.5334
 epoch: 15, train_loss: 0.9000, test_loss: 1.0421, test_f1: 0.5414
 epoch: 16, train_loss: 0.8930, test_loss: 1.0053, test_f1: 0.5342
 epoch: 17, train_loss: 0.8710, test_loss: 1.0267, test_f1: 0.5384
 epoch: 18, train_loss: 0.8658, test_loss: 1.0511, test_f1: 0.5341
 epoch: 19, train_loss: 0.8589, test_loss: 1.0884, test_f1: 0.4721
 epoch: 20, train_loss: 0.8630, test_loss: 1.0700, test_f1: 0.5091
 epoch: 21, train_loss: 0.8356, test_loss: 1.0542, test_f1: 0.5240
 epoch: 22, train_loss: 0.8333, test_loss: 1.0794, test_f1: 0.5290
 epoch: 23, train_loss: 0.8176, test_loss: 1.0960, test_f1: 0.5245
 epoch: 24, train_loss: 0.8146, test_loss: 1.0789, test_f1: 0.5151
 epoch: 25, train_loss: 0.8179, test_loss: 1.0659, test_f1: 0.4876
 epoch: 26, train_loss: 0.8065, test_loss: 1.0512, test_f1: 0.5404
 epoch: 27, train_loss: 0.8070, test_loss: 1.0849, test_f1: 0.5168
 epoch: 28, train_loss: 0.7960, test_loss: 1.0968, test_f1: 0.5594
 epoch: 29, train_loss: 0.7923, test_loss: 1.0608, test_f1: 0.5313
 epoch: 30, train_loss: 0.7783, test_loss: 1.1667, test_f1: 0.5035
 epoch: 31, train_loss: 0.7773, test_loss: 1.0781, test_f1: 0.5390
 epoch: 32, train_loss: 0.7711, test_loss: 1.0858, test_f1: 0.5252
 epoch: 33, train_loss: 0.7674, test_loss: 1.1374, test_f1: 0.5351
 epoch: 34, train_loss: 0.7437, test_loss: 1.1027, test_f1: 0.5366
 epoch: 35, train_loss: 0.7464, test_loss: 1.1480, test_f1: 0.5162
 epoch: 36, train_loss: 0.7388, test_loss: 1.1052, test_f1: 0.5512
 epoch: 37, train_loss: 0.7403, test_loss: 1.1608, test_f1: 0.5428
 epoch: 38, train_loss: 0.7311, test_loss: 1.1378, test_f1: 0.5344
 epoch: 39, train_loss: 0.7190, test_loss: 1.0678, test_f1: 0.5513
 epoch: 40, train_loss: 0.7260, test_loss: 1.1526, test_f1: 0.5278
 epoch: 41, train_loss: 0.7146, test_loss: 1.1220, test_f1: 0.5458
 epoch: 42, train_loss: 0.7047, test_loss: 1.2143, test_f1: 0.5110
 epoch: 43, train_loss: 0.7038, test_loss: 1.2340, test_f1: 0.5127
 epoch: 44, train_loss: 0.6974, test_loss: 1.1306, test_f1: 0.5358
 epoch: 45, train_loss: 0.6871, test_loss: 1.1752, test_f1: 0.5419
 epoch: 46, train_loss: 0.6899, test_loss: 1.2030, test_f1: 0.5464
 epoch: 47, train_loss: 0.6809, test_loss: 1.1792, test_f1: 0.5387
 epoch: 48, train_loss: 0.6706, test_loss: 1.1831, test_f1: 0.5440
 epoch: 49, train_loss: 0.6601, test_loss: 1.2251, test_f1: 0.5691
 epoch: 50, train_loss: 0.6556, test_loss: 1.1864, test_f1: 0.5322
 epoch: 51, train_loss: 0.6419, test_loss: 1.2180, test_f1: 0.5473
 epoch: 52, train_loss: 0.6318, test_loss: 1.2655, test_f1: 0.5184
 epoch: 53, train_loss: 0.6120, test_loss: 1.2209, test_f1: 0.5370
 epoch: 54, train_loss: 0.6140, test_loss: 1.2646, test_f1: 0.5517
 epoch: 55, train_loss: 0.6020, test_loss: 1.2380, test_f1: 0.5603
 epoch: 56, train_loss: 0.6061, test_loss: 1.2751, test_f1: 0.5530
 epoch: 57, train_loss: 0.6055, test_loss: 1.2208, test_f1: 0.5787
 epoch: 58, train_loss: 0.5823, test_loss: 1.3375, test_f1: 0.5387
 epoch: 59, train_loss: 0.5926, test_loss: 1.2776, test_f1: 0.5685
 epoch: 60, train_loss: 0.5798, test_loss: 1.3004, test_f1: 0.5619
 epoch: 61, train_loss: 0.5925, test_loss: 1.3394, test_f1: 0.5605
 epoch: 62, train_loss: 0.5866, test_loss: 1.2186, test_f1: 0.5626
 epoch: 63, train_loss: 0.5984, test_loss: 1.3203, test_f1: 0.5575
 epoch: 64, train_loss: 0.5917, test_loss: 1.2538, test_f1: 0.5500
 epoch: 65, train_loss: 0.5865, test_loss: 1.2979, test_f1: 0.5528
 epoch: 66, train_loss: 0.5708, test_loss: 1.3588, test_f1: 0.5233
 epoch: 67, train_loss: 0.5768, test_loss: 1.3211, test_f1: 0.5698
 epoch: 68, train_loss: 0.5742, test_loss: 1.3494, test_f1: 0.5692
 epoch: 69, train_loss: 0.5494, test_loss: 1.3447, test_f1: 0.5616
 epoch: 70, train_loss: 0.5635, test_loss: 1.2955, test_f1: 0.5682
 epoch: 71, train_loss: 0.5669, test_loss: 1.2964, test_f1: 0.5574
 epoch: 72, train_loss: 0.5437, test_loss: 1.3320, test_f1: 0.5559
 epoch: 73, train_loss: 0.5495, test_loss: 1.3048, test_f1: 0.5867
 epoch: 74, train_loss: 0.5473, test_loss: 1.3389, test_f1: 0.5435
 epoch: 75, train_loss: 0.5420, test_loss: 1.3363, test_f1: 0.5703
 epoch: 76, train_loss: 0.5312, test_loss: 1.3256, test_f1: 0.5597
 epoch: 77, train_loss: 0.5436, test_loss: 1.4421, test_f1: 0.5714
 epoch: 78, train_loss: 0.5287, test_loss: 1.3877, test_f1: 0.5965
 epoch: 79, train_loss: 0.5289, test_loss: 1.4285, test_f1: 0.5614
 epoch: 80, train_loss: 0.5307, test_loss: 1.3882, test_f1: 0.5614
 epoch: 81, train_loss: 0.5273, test_loss: 1.3743, test_f1: 0.5713
 epoch: 82, train_loss: 0.5312, test_loss: 1.3199, test_f1: 0.5984
 epoch: 83, train_loss: 0.5323, test_loss: 1.4574, test_f1: 0.5414
 epoch: 84, train_loss: 0.5224, test_loss: 1.4727, test_f1: 0.5532
 epoch: 85, train_loss: 0.5152, test_loss: 1.4403, test_f1: 0.5715
 epoch: 86, train_loss: 0.5025, test_loss: 1.5761, test_f1: 0.5245
 epoch: 87, train_loss: 0.4998, test_loss: 1.5050, test_f1: 0.5363
 epoch: 88, train_loss: 0.5211, test_loss: 1.4617, test_f1: 0.5758
 epoch: 89, train_loss: 0.5153, test_loss: 1.3768, test_f1: 0.5661
 epoch: 90, train_loss: 0.5028, test_loss: 1.4681, test_f1: 0.5362
 epoch: 91, train_loss: 0.5076, test_loss: 1.4858, test_f1: 0.5565
 epoch: 92, train_loss: 0.4985, test_loss: 1.3867, test_f1: 0.5688
 epoch: 93, train_loss: 0.4810, test_loss: 1.4286, test_f1: 0.5644
 epoch: 94, train_loss: 0.4847, test_loss: 1.4612, test_f1: 0.5613
 epoch: 95, train_loss: 0.4842, test_loss: 1.4715, test_f1: 0.5770
 epoch: 96, train_loss: 0.4981, test_loss: 1.4665, test_f1: 0.5627
 epoch: 97, train_loss: 0.4912, test_loss: 1.4953, test_f1: 0.5837
 epoch: 98, train_loss: 0.4885, test_loss: 1.4330, test_f1: 0.5574
 epoch: 99, train_loss: 0.4908, test_loss: 1.5801, test_f1: 0.5306
##################ITERATION #5 ****************************************
 epoch: 0, train_loss: 1.4386, test_loss: 1.1769, test_f1: 0.4422
 epoch: 1, train_loss: 1.2095, test_loss: 1.1127, test_f1: 0.4567
 epoch: 2, train_loss: 1.1538, test_loss: 1.0440, test_f1: 0.5076
 epoch: 3, train_loss: 1.1039, test_loss: 1.0407, test_f1: 0.4668
 epoch: 4, train_loss: 1.0692, test_loss: 1.0483, test_f1: 0.4231
 epoch: 5, train_loss: 1.0553, test_loss: 1.0345, test_f1: 0.4331
 epoch: 6, train_loss: 1.0249, test_loss: 1.0239, test_f1: 0.4471
 epoch: 7, train_loss: 1.0136, test_loss: 0.9816, test_f1: 0.4905
 epoch: 8, train_loss: 0.9910, test_loss: 0.9783, test_f1: 0.4999
 epoch: 9, train_loss: 0.9896, test_loss: 1.1580, test_f1: 0.4380
 epoch: 10, train_loss: 0.9742, test_loss: 0.9760, test_f1: 0.4832
 epoch: 11, train_loss: 0.9596, test_loss: 0.9637, test_f1: 0.5386
 epoch: 12, train_loss: 0.9429, test_loss: 0.9283, test_f1: 0.5081
 epoch: 13, train_loss: 0.9447, test_loss: 0.9857, test_f1: 0.5265
 epoch: 14, train_loss: 0.9255, test_loss: 0.9537, test_f1: 0.5059
 epoch: 15, train_loss: 0.8968, test_loss: 0.9948, test_f1: 0.4991
 epoch: 16, train_loss: 0.9062, test_loss: 1.0003, test_f1: 0.4844
 epoch: 17, train_loss: 0.8877, test_loss: 1.0010, test_f1: 0.5017
 epoch: 18, train_loss: 0.8861, test_loss: 1.0018, test_f1: 0.5093
 epoch: 19, train_loss: 0.8806, test_loss: 1.0581, test_f1: 0.4478
 epoch: 20, train_loss: 0.8702, test_loss: 1.0006, test_f1: 0.4990
 epoch: 21, train_loss: 0.8574, test_loss: 1.0516, test_f1: 0.5340
 epoch: 22, train_loss: 0.8480, test_loss: 1.0220, test_f1: 0.5118
 epoch: 23, train_loss: 0.8502, test_loss: 1.0093, test_f1: 0.5331
 epoch: 24, train_loss: 0.8442, test_loss: 1.0356, test_f1: 0.4910
 epoch: 25, train_loss: 0.8291, test_loss: 0.9718, test_f1: 0.4973
 epoch: 26, train_loss: 0.8266, test_loss: 0.9937, test_f1: 0.5189
 epoch: 27, train_loss: 0.8191, test_loss: 1.0701, test_f1: 0.5119
 epoch: 28, train_loss: 0.8238, test_loss: 1.0449, test_f1: 0.4914
 epoch: 29, train_loss: 0.8025, test_loss: 1.0136, test_f1: 0.5400
 epoch: 30, train_loss: 0.8015, test_loss: 1.0631, test_f1: 0.5075
 epoch: 31, train_loss: 0.8035, test_loss: 1.1173, test_f1: 0.4823
 epoch: 32, train_loss: 0.7977, test_loss: 1.1025, test_f1: 0.5255
 epoch: 33, train_loss: 0.7703, test_loss: 1.0941, test_f1: 0.5014
 epoch: 34, train_loss: 0.7746, test_loss: 1.0944, test_f1: 0.5262
 epoch: 35, train_loss: 0.7672, test_loss: 1.1398, test_f1: 0.4758
 epoch: 36, train_loss: 0.7641, test_loss: 1.0478, test_f1: 0.5124
 epoch: 37, train_loss: 0.7493, test_loss: 1.1003, test_f1: 0.4865
 epoch: 38, train_loss: 0.7404, test_loss: 1.1362, test_f1: 0.5094
 epoch: 39, train_loss: 0.7378, test_loss: 1.1366, test_f1: 0.5095
 epoch: 40, train_loss: 0.7455, test_loss: 1.1133, test_f1: 0.5079
 epoch: 41, train_loss: 0.7399, test_loss: 1.2053, test_f1: 0.4893
 epoch: 42, train_loss: 0.7405, test_loss: 1.0825, test_f1: 0.5262
 epoch: 43, train_loss: 0.7424, test_loss: 1.0670, test_f1: 0.5271
 epoch: 44, train_loss: 0.7241, test_loss: 1.0627, test_f1: 0.5259
 epoch: 45, train_loss: 0.7196, test_loss: 1.0662, test_f1: 0.5381
 epoch: 46, train_loss: 0.7140, test_loss: 1.1245, test_f1: 0.5187
 epoch: 47, train_loss: 0.6969, test_loss: 1.2368, test_f1: 0.4903
 epoch: 48, train_loss: 0.6965, test_loss: 1.1359, test_f1: 0.5322
 epoch: 49, train_loss: 0.7077, test_loss: 1.1281, test_f1: 0.4913
 epoch: 50, train_loss: 0.6748, test_loss: 1.0635, test_f1: 0.5436
 epoch: 51, train_loss: 0.6554, test_loss: 1.1895, test_f1: 0.5000
 epoch: 52, train_loss: 0.6305, test_loss: 1.2599, test_f1: 0.4993
 epoch: 53, train_loss: 0.6513, test_loss: 1.1477, test_f1: 0.5300
 epoch: 54, train_loss: 0.6266, test_loss: 1.1621, test_f1: 0.5319
 epoch: 55, train_loss: 0.6337, test_loss: 1.1690, test_f1: 0.5303
 epoch: 56, train_loss: 0.6218, test_loss: 1.1913, test_f1: 0.5480
 epoch: 57, train_loss: 0.6146, test_loss: 1.2187, test_f1: 0.5101
 epoch: 58, train_loss: 0.6328, test_loss: 1.1876, test_f1: 0.5390
 epoch: 59, train_loss: 0.6198, test_loss: 1.1943, test_f1: 0.5293
 epoch: 60, train_loss: 0.6209, test_loss: 1.1890, test_f1: 0.5213
 epoch: 61, train_loss: 0.6174, test_loss: 1.2019, test_f1: 0.5401
 epoch: 62, train_loss: 0.6054, test_loss: 1.3136, test_f1: 0.5088
 epoch: 63, train_loss: 0.6151, test_loss: 1.2069, test_f1: 0.5386
 epoch: 64, train_loss: 0.5978, test_loss: 1.3038, test_f1: 0.5150
 epoch: 65, train_loss: 0.6059, test_loss: 1.1920, test_f1: 0.5141
 epoch: 66, train_loss: 0.5905, test_loss: 1.1685, test_f1: 0.5425
 epoch: 67, train_loss: 0.5964, test_loss: 1.2831, test_f1: 0.5364
 epoch: 68, train_loss: 0.6051, test_loss: 1.2692, test_f1: 0.5340
 epoch: 69, train_loss: 0.6021, test_loss: 1.2446, test_f1: 0.5215
 epoch: 70, train_loss: 0.6007, test_loss: 1.2110, test_f1: 0.5499
 epoch: 71, train_loss: 0.5997, test_loss: 1.2523, test_f1: 0.5151
 epoch: 72, train_loss: 0.5907, test_loss: 1.2874, test_f1: 0.5114
 epoch: 73, train_loss: 0.5708, test_loss: 1.2872, test_f1: 0.5150
 epoch: 74, train_loss: 0.5652, test_loss: 1.2805, test_f1: 0.5512
 epoch: 75, train_loss: 0.5757, test_loss: 1.2808, test_f1: 0.5363
 epoch: 76, train_loss: 0.5748, test_loss: 1.2298, test_f1: 0.5268
 epoch: 77, train_loss: 0.5733, test_loss: 1.3084, test_f1: 0.5362
 epoch: 78, train_loss: 0.5676, test_loss: 1.3368, test_f1: 0.5106
 epoch: 79, train_loss: 0.5666, test_loss: 1.3100, test_f1: 0.5595
 epoch: 80, train_loss: 0.5508, test_loss: 1.3647, test_f1: 0.4993
 epoch: 81, train_loss: 0.5495, test_loss: 1.2728, test_f1: 0.5513
 epoch: 82, train_loss: 0.5490, test_loss: 1.3458, test_f1: 0.5150
 epoch: 83, train_loss: 0.5484, test_loss: 1.3566, test_f1: 0.5116
 epoch: 84, train_loss: 0.5501, test_loss: 1.3680, test_f1: 0.5136
 epoch: 85, train_loss: 0.5573, test_loss: 1.3467, test_f1: 0.5533
 epoch: 86, train_loss: 0.5489, test_loss: 1.3242, test_f1: 0.5323
 epoch: 87, train_loss: 0.5526, test_loss: 1.3519, test_f1: 0.5377
 epoch: 88, train_loss: 0.5263, test_loss: 1.3626, test_f1: 0.5305
 epoch: 89, train_loss: 0.5373, test_loss: 1.3807, test_f1: 0.5232
 epoch: 90, train_loss: 0.5410, test_loss: 1.3569, test_f1: 0.5139
 epoch: 91, train_loss: 0.5361, test_loss: 1.2857, test_f1: 0.5586
 epoch: 92, train_loss: 0.5220, test_loss: 1.2889, test_f1: 0.5543
 epoch: 93, train_loss: 0.5286, test_loss: 1.3807, test_f1: 0.5390
 epoch: 94, train_loss: 0.5267, test_loss: 1.4346, test_f1: 0.5198
 epoch: 95, train_loss: 0.5347, test_loss: 1.2687, test_f1: 0.5610
 epoch: 96, train_loss: 0.5396, test_loss: 1.5054, test_f1: 0.5180
 epoch: 97, train_loss: 0.5318, test_loss: 1.3212, test_f1: 0.5419
 epoch: 98, train_loss: 0.5217, test_loss: 1.3721, test_f1: 0.5355
 epoch: 99, train_loss: 0.5192, test_loss: 1.3568, test_f1: 0.5412
##################ITERATION #6 ****************************************
 epoch: 0, train_loss: 1.5202, test_loss: 1.2204, test_f1: 0.3672
 epoch: 1, train_loss: 1.2010, test_loss: 1.0942, test_f1: 0.4783
 epoch: 2, train_loss: 1.1562, test_loss: 1.0730, test_f1: 0.4418
 epoch: 3, train_loss: 1.1373, test_loss: 1.0512, test_f1: 0.4547
 epoch: 4, train_loss: 1.0971, test_loss: 1.0237, test_f1: 0.4784
 epoch: 5, train_loss: 1.0745, test_loss: 1.0196, test_f1: 0.4608
 epoch: 6, train_loss: 1.0426, test_loss: 1.0260, test_f1: 0.4639
 epoch: 7, train_loss: 1.0317, test_loss: 1.0179, test_f1: 0.4672
 epoch: 8, train_loss: 1.0017, test_loss: 0.9976, test_f1: 0.4711
 epoch: 9, train_loss: 1.0056, test_loss: 1.0411, test_f1: 0.4713
 epoch: 10, train_loss: 0.9834, test_loss: 1.0173, test_f1: 0.5024
 epoch: 11, train_loss: 0.9895, test_loss: 1.0221, test_f1: 0.4814
 epoch: 12, train_loss: 0.9485, test_loss: 1.0553, test_f1: 0.4721
 epoch: 13, train_loss: 0.9459, test_loss: 1.0765, test_f1: 0.5067
 epoch: 14, train_loss: 0.9295, test_loss: 1.0236, test_f1: 0.4964
 epoch: 15, train_loss: 0.9182, test_loss: 1.0159, test_f1: 0.4920
 epoch: 16, train_loss: 0.8946, test_loss: 1.0390, test_f1: 0.4718
 epoch: 17, train_loss: 0.8871, test_loss: 1.0288, test_f1: 0.5053
 epoch: 18, train_loss: 0.8861, test_loss: 1.0944, test_f1: 0.4805
 epoch: 19, train_loss: 0.8774, test_loss: 1.0538, test_f1: 0.5112
 epoch: 20, train_loss: 0.8585, test_loss: 1.0044, test_f1: 0.5093
 epoch: 21, train_loss: 0.8586, test_loss: 1.0069, test_f1: 0.5159
 epoch: 22, train_loss: 0.8568, test_loss: 1.0565, test_f1: 0.4908
 epoch: 23, train_loss: 0.8390, test_loss: 1.1394, test_f1: 0.5050
 epoch: 24, train_loss: 0.8458, test_loss: 1.0866, test_f1: 0.4955
 epoch: 25, train_loss: 0.8437, test_loss: 1.0262, test_f1: 0.5200
 epoch: 26, train_loss: 0.8230, test_loss: 1.0145, test_f1: 0.5400
 epoch: 27, train_loss: 0.8177, test_loss: 1.0882, test_f1: 0.4970
 epoch: 28, train_loss: 0.8045, test_loss: 1.0450, test_f1: 0.5325
 epoch: 29, train_loss: 0.7813, test_loss: 1.0347, test_f1: 0.5323
 epoch: 30, train_loss: 0.7817, test_loss: 1.0810, test_f1: 0.4868
 epoch: 31, train_loss: 0.7793, test_loss: 1.0520, test_f1: 0.5149
 epoch: 32, train_loss: 0.7707, test_loss: 1.1028, test_f1: 0.5077
 epoch: 33, train_loss: 0.7599, test_loss: 1.1234, test_f1: 0.5300
 epoch: 34, train_loss: 0.7716, test_loss: 1.1705, test_f1: 0.4930
 epoch: 35, train_loss: 0.7558, test_loss: 1.1468, test_f1: 0.5452
 epoch: 36, train_loss: 0.7469, test_loss: 1.0650, test_f1: 0.5383
 epoch: 37, train_loss: 0.7438, test_loss: 1.0930, test_f1: 0.5237
 epoch: 38, train_loss: 0.7377, test_loss: 1.1749, test_f1: 0.5008
 epoch: 39, train_loss: 0.7328, test_loss: 1.1501, test_f1: 0.5167
 epoch: 40, train_loss: 0.7283, test_loss: 1.1253, test_f1: 0.5056
 epoch: 41, train_loss: 0.7227, test_loss: 1.0604, test_f1: 0.5254
 epoch: 42, train_loss: 0.7150, test_loss: 1.1152, test_f1: 0.5530
 epoch: 43, train_loss: 0.7081, test_loss: 1.2472, test_f1: 0.4737
 epoch: 44, train_loss: 0.7095, test_loss: 1.1336, test_f1: 0.5155
 epoch: 45, train_loss: 0.6971, test_loss: 1.1454, test_f1: 0.5305
 epoch: 46, train_loss: 0.6967, test_loss: 1.1610, test_f1: 0.5451
 epoch: 47, train_loss: 0.6976, test_loss: 1.1595, test_f1: 0.5327
 epoch: 48, train_loss: 0.6921, test_loss: 1.1733, test_f1: 0.5247
 epoch: 49, train_loss: 0.6698, test_loss: 1.2069, test_f1: 0.5213
 epoch: 50, train_loss: 0.6747, test_loss: 1.1779, test_f1: 0.5391
 epoch: 51, train_loss: 0.6513, test_loss: 1.1760, test_f1: 0.5093
 epoch: 52, train_loss: 0.6270, test_loss: 1.2261, test_f1: 0.4898
 epoch: 53, train_loss: 0.6378, test_loss: 1.1745, test_f1: 0.5289
 epoch: 54, train_loss: 0.6247, test_loss: 1.2496, test_f1: 0.5279
 epoch: 55, train_loss: 0.6073, test_loss: 1.2164, test_f1: 0.5140
 epoch: 56, train_loss: 0.6019, test_loss: 1.2068, test_f1: 0.5135
 epoch: 57, train_loss: 0.6017, test_loss: 1.2902, test_f1: 0.5002
 epoch: 58, train_loss: 0.5932, test_loss: 1.1854, test_f1: 0.5390
 epoch: 59, train_loss: 0.5991, test_loss: 1.2093, test_f1: 0.5275
 epoch: 60, train_loss: 0.5940, test_loss: 1.1755, test_f1: 0.5403
 epoch: 61, train_loss: 0.6040, test_loss: 1.1969, test_f1: 0.5470
 epoch: 62, train_loss: 0.5820, test_loss: 1.2634, test_f1: 0.5411
 epoch: 63, train_loss: 0.5924, test_loss: 1.2829, test_f1: 0.5070
 epoch: 64, train_loss: 0.5951, test_loss: 1.1736, test_f1: 0.5385
 epoch: 65, train_loss: 0.5794, test_loss: 1.2092, test_f1: 0.5293
 epoch: 66, train_loss: 0.5764, test_loss: 1.3105, test_f1: 0.5273
 epoch: 67, train_loss: 0.5807, test_loss: 1.2368, test_f1: 0.5306
 epoch: 68, train_loss: 0.5922, test_loss: 1.2465, test_f1: 0.5125
 epoch: 69, train_loss: 0.5713, test_loss: 1.3660, test_f1: 0.5208
 epoch: 70, train_loss: 0.5728, test_loss: 1.3332, test_f1: 0.5228
 epoch: 71, train_loss: 0.5578, test_loss: 1.2983, test_f1: 0.5291
 epoch: 72, train_loss: 0.5570, test_loss: 1.2250, test_f1: 0.5395
 epoch: 73, train_loss: 0.5511, test_loss: 1.2895, test_f1: 0.5106
 epoch: 74, train_loss: 0.5566, test_loss: 1.3152, test_f1: 0.5240
 epoch: 75, train_loss: 0.5589, test_loss: 1.2916, test_f1: 0.5453
 epoch: 76, train_loss: 0.5428, test_loss: 1.3657, test_f1: 0.5074
 epoch: 77, train_loss: 0.5389, test_loss: 1.2969, test_f1: 0.5253
 epoch: 78, train_loss: 0.5429, test_loss: 1.2777, test_f1: 0.5134
 epoch: 79, train_loss: 0.5311, test_loss: 1.2732, test_f1: 0.5470
 epoch: 80, train_loss: 0.5301, test_loss: 1.3388, test_f1: 0.5378
 epoch: 81, train_loss: 0.5519, test_loss: 1.3083, test_f1: 0.5229
 epoch: 82, train_loss: 0.5435, test_loss: 1.2963, test_f1: 0.5364
 epoch: 83, train_loss: 0.5233, test_loss: 1.3825, test_f1: 0.5169
 epoch: 84, train_loss: 0.5192, test_loss: 1.3247, test_f1: 0.5343
 epoch: 85, train_loss: 0.5246, test_loss: 1.3564, test_f1: 0.5619
 epoch: 86, train_loss: 0.5072, test_loss: 1.3501, test_f1: 0.5181
 epoch: 87, train_loss: 0.5149, test_loss: 1.3694, test_f1: 0.5175
 epoch: 88, train_loss: 0.5062, test_loss: 1.3528, test_f1: 0.5241
 epoch: 89, train_loss: 0.5097, test_loss: 1.2792, test_f1: 0.5332
 epoch: 90, train_loss: 0.5122, test_loss: 1.6466, test_f1: 0.5059
 epoch: 91, train_loss: 0.4981, test_loss: 1.5761, test_f1: 0.5214
 epoch: 92, train_loss: 0.4904, test_loss: 1.4300, test_f1: 0.5313
 epoch: 93, train_loss: 0.4970, test_loss: 1.3470, test_f1: 0.5169
 epoch: 94, train_loss: 0.5099, test_loss: 1.3425, test_f1: 0.5432
 epoch: 95, train_loss: 0.4782, test_loss: 1.3480, test_f1: 0.5421
 epoch: 96, train_loss: 0.4832, test_loss: 1.4350, test_f1: 0.5457
 epoch: 97, train_loss: 0.4728, test_loss: 1.3770, test_f1: 0.5383
 epoch: 98, train_loss: 0.4974, test_loss: 1.3935, test_f1: 0.5414
 epoch: 99, train_loss: 0.4987, test_loss: 1.4388, test_f1: 0.5150
##################ITERATION #7 ****************************************
 epoch: 0, train_loss: 1.5524, test_loss: 1.2659, test_f1: 0.2966
 epoch: 1, train_loss: 1.2519, test_loss: 1.1429, test_f1: 0.4639
 epoch: 2, train_loss: 1.1803, test_loss: 1.0844, test_f1: 0.4215
 epoch: 3, train_loss: 1.1354, test_loss: 1.0674, test_f1: 0.4818
 epoch: 4, train_loss: 1.1127, test_loss: 1.0502, test_f1: 0.4414
 epoch: 5, train_loss: 1.0796, test_loss: 1.0356, test_f1: 0.4314
 epoch: 6, train_loss: 1.0765, test_loss: 1.0206, test_f1: 0.4709
 epoch: 7, train_loss: 1.0433, test_loss: 1.0035, test_f1: 0.4726
 epoch: 8, train_loss: 1.0311, test_loss: 0.9996, test_f1: 0.4877
 epoch: 9, train_loss: 0.9937, test_loss: 0.9727, test_f1: 0.4961
 epoch: 10, train_loss: 0.9652, test_loss: 1.0230, test_f1: 0.4750
 epoch: 11, train_loss: 0.9588, test_loss: 0.9738, test_f1: 0.4630
 epoch: 12, train_loss: 0.9416, test_loss: 0.9906, test_f1: 0.4969
 epoch: 13, train_loss: 0.9395, test_loss: 0.9358, test_f1: 0.5104
 epoch: 14, train_loss: 0.9155, test_loss: 0.9092, test_f1: 0.5403
 epoch: 15, train_loss: 0.9226, test_loss: 0.9383, test_f1: 0.5215
 epoch: 16, train_loss: 0.9053, test_loss: 1.0066, test_f1: 0.5053
 epoch: 17, train_loss: 0.8827, test_loss: 0.9373, test_f1: 0.5532
 epoch: 18, train_loss: 0.8904, test_loss: 1.0022, test_f1: 0.5160
 epoch: 19, train_loss: 0.8699, test_loss: 0.9357, test_f1: 0.5437
 epoch: 20, train_loss: 0.8635, test_loss: 1.0783, test_f1: 0.4938
 epoch: 21, train_loss: 0.8617, test_loss: 0.9452, test_f1: 0.5142
 epoch: 22, train_loss: 0.8657, test_loss: 1.0203, test_f1: 0.5001
 epoch: 23, train_loss: 0.8489, test_loss: 0.9489, test_f1: 0.5325
 epoch: 24, train_loss: 0.8212, test_loss: 0.9818, test_f1: 0.5312
 epoch: 25, train_loss: 0.8254, test_loss: 1.0466, test_f1: 0.5000
 epoch: 26, train_loss: 0.8235, test_loss: 1.0452, test_f1: 0.5090
 epoch: 27, train_loss: 0.8210, test_loss: 0.9477, test_f1: 0.5258
 epoch: 28, train_loss: 0.8061, test_loss: 1.1523, test_f1: 0.5046
 epoch: 29, train_loss: 0.8211, test_loss: 1.0021, test_f1: 0.5276
 epoch: 30, train_loss: 0.7924, test_loss: 1.0467, test_f1: 0.5158
 epoch: 31, train_loss: 0.7771, test_loss: 1.0297, test_f1: 0.5354
 epoch: 32, train_loss: 0.7851, test_loss: 1.0068, test_f1: 0.4997
 epoch: 33, train_loss: 0.7766, test_loss: 1.1153, test_f1: 0.5292
 epoch: 34, train_loss: 0.7664, test_loss: 1.0610, test_f1: 0.5132
 epoch: 35, train_loss: 0.7813, test_loss: 1.0998, test_f1: 0.5158
 epoch: 36, train_loss: 0.7677, test_loss: 1.0293, test_f1: 0.5205
 epoch: 37, train_loss: 0.7577, test_loss: 1.0829, test_f1: 0.5215
 epoch: 38, train_loss: 0.7549, test_loss: 1.0575, test_f1: 0.5423
 epoch: 39, train_loss: 0.7564, test_loss: 1.1304, test_f1: 0.5192
 epoch: 40, train_loss: 0.7466, test_loss: 1.0551, test_f1: 0.5205
 epoch: 41, train_loss: 0.7386, test_loss: 1.1328, test_f1: 0.5633
 epoch: 42, train_loss: 0.7337, test_loss: 1.1016, test_f1: 0.5229
 epoch: 43, train_loss: 0.7214, test_loss: 1.2488, test_f1: 0.5140
 epoch: 44, train_loss: 0.7215, test_loss: 1.0827, test_f1: 0.5278
 epoch: 45, train_loss: 0.7188, test_loss: 1.1780, test_f1: 0.5151
 epoch: 46, train_loss: 0.7244, test_loss: 1.2719, test_f1: 0.5204
 epoch: 47, train_loss: 0.7081, test_loss: 1.1552, test_f1: 0.5247
 epoch: 48, train_loss: 0.6962, test_loss: 1.1889, test_f1: 0.5276
 epoch: 49, train_loss: 0.7014, test_loss: 1.1333, test_f1: 0.5259
 epoch: 50, train_loss: 0.7010, test_loss: 1.1011, test_f1: 0.5643
 epoch: 51, train_loss: 0.6809, test_loss: 1.1579, test_f1: 0.5489
 epoch: 52, train_loss: 0.6720, test_loss: 1.2127, test_f1: 0.5161
 epoch: 53, train_loss: 0.6480, test_loss: 1.0925, test_f1: 0.5514
 epoch: 54, train_loss: 0.6580, test_loss: 1.1645, test_f1: 0.5326
 epoch: 55, train_loss: 0.6429, test_loss: 1.2988, test_f1: 0.5296
 epoch: 56, train_loss: 0.6343, test_loss: 1.1150, test_f1: 0.5542
 epoch: 57, train_loss: 0.6420, test_loss: 1.1581, test_f1: 0.5437
 epoch: 58, train_loss: 0.6225, test_loss: 1.3125, test_f1: 0.5309
 epoch: 59, train_loss: 0.6345, test_loss: 1.2044, test_f1: 0.5473
 epoch: 60, train_loss: 0.6326, test_loss: 1.1833, test_f1: 0.5410
 epoch: 61, train_loss: 0.6205, test_loss: 1.2605, test_f1: 0.5216
 epoch: 62, train_loss: 0.6352, test_loss: 1.2572, test_f1: 0.5424
 epoch: 63, train_loss: 0.6221, test_loss: 1.1152, test_f1: 0.5473
 epoch: 64, train_loss: 0.6150, test_loss: 1.2864, test_f1: 0.5294
 epoch: 65, train_loss: 0.6099, test_loss: 1.2163, test_f1: 0.5345
 epoch: 66, train_loss: 0.6000, test_loss: 1.2757, test_f1: 0.5585
 epoch: 67, train_loss: 0.6082, test_loss: 1.3237, test_f1: 0.5232
 epoch: 68, train_loss: 0.6183, test_loss: 1.2707, test_f1: 0.5369
 epoch: 69, train_loss: 0.6163, test_loss: 1.2480, test_f1: 0.5381
 epoch: 70, train_loss: 0.5959, test_loss: 1.3050, test_f1: 0.5380
 epoch: 71, train_loss: 0.6095, test_loss: 1.2339, test_f1: 0.5554
 epoch: 72, train_loss: 0.5977, test_loss: 1.3183, test_f1: 0.5414
 epoch: 73, train_loss: 0.5981, test_loss: 1.2765, test_f1: 0.5293
 epoch: 74, train_loss: 0.5878, test_loss: 1.2142, test_f1: 0.5325
 epoch: 75, train_loss: 0.5979, test_loss: 1.3412, test_f1: 0.5257
 epoch: 76, train_loss: 0.5838, test_loss: 1.2957, test_f1: 0.5168
 epoch: 77, train_loss: 0.5911, test_loss: 1.2918, test_f1: 0.5297
 epoch: 78, train_loss: 0.5845, test_loss: 1.2700, test_f1: 0.5523
 epoch: 79, train_loss: 0.5746, test_loss: 1.3537, test_f1: 0.5512
 epoch: 80, train_loss: 0.5764, test_loss: 1.3301, test_f1: 0.5378
 epoch: 81, train_loss: 0.5604, test_loss: 1.3892, test_f1: 0.5222
 epoch: 82, train_loss: 0.5580, test_loss: 1.2798, test_f1: 0.5457
 epoch: 83, train_loss: 0.5468, test_loss: 1.4206, test_f1: 0.5489
 epoch: 84, train_loss: 0.5409, test_loss: 1.3354, test_f1: 0.5297
 epoch: 85, train_loss: 0.5707, test_loss: 1.3398, test_f1: 0.5397
 epoch: 86, train_loss: 0.5571, test_loss: 1.4742, test_f1: 0.5272
 epoch: 87, train_loss: 0.5544, test_loss: 1.4277, test_f1: 0.5519
 epoch: 88, train_loss: 0.5486, test_loss: 1.3285, test_f1: 0.5305
 epoch: 89, train_loss: 0.5481, test_loss: 1.4384, test_f1: 0.5400
 epoch: 90, train_loss: 0.5519, test_loss: 1.5281, test_f1: 0.5314
 epoch: 91, train_loss: 0.5557, test_loss: 1.3037, test_f1: 0.5542
 epoch: 92, train_loss: 0.5356, test_loss: 1.3413, test_f1: 0.5590
 epoch: 93, train_loss: 0.5587, test_loss: 1.2681, test_f1: 0.5547
 epoch: 94, train_loss: 0.5387, test_loss: 1.3343, test_f1: 0.5573
 epoch: 95, train_loss: 0.5154, test_loss: 1.4292, test_f1: 0.5221
 epoch: 96, train_loss: 0.5369, test_loss: 1.4897, test_f1: 0.5618
 epoch: 97, train_loss: 0.5444, test_loss: 1.4465, test_f1: 0.5395
 epoch: 98, train_loss: 0.5407, test_loss: 1.3838, test_f1: 0.5613
 epoch: 99, train_loss: 0.5214, test_loss: 1.4833, test_f1: 0.5313
##################ITERATION #8 ****************************************
 epoch: 0, train_loss: 1.5097, test_loss: 1.3837, test_f1: 0.2813
 epoch: 1, train_loss: 1.2031, test_loss: 1.1162, test_f1: 0.4069
 epoch: 2, train_loss: 1.1390, test_loss: 1.0306, test_f1: 0.4399
 epoch: 3, train_loss: 1.1045, test_loss: 1.0265, test_f1: 0.4639
 epoch: 4, train_loss: 1.0811, test_loss: 0.9987, test_f1: 0.4500
 epoch: 5, train_loss: 1.0469, test_loss: 0.9573, test_f1: 0.4745
 epoch: 6, train_loss: 1.0271, test_loss: 0.9402, test_f1: 0.5241
 epoch: 7, train_loss: 1.0192, test_loss: 0.9760, test_f1: 0.4528
 epoch: 8, train_loss: 1.0062, test_loss: 0.9452, test_f1: 0.5023
 epoch: 9, train_loss: 0.9894, test_loss: 0.9152, test_f1: 0.5169
 epoch: 10, train_loss: 0.9793, test_loss: 0.9882, test_f1: 0.4436
 epoch: 11, train_loss: 0.9677, test_loss: 0.9280, test_f1: 0.5221
 epoch: 12, train_loss: 0.9543, test_loss: 0.9429, test_f1: 0.4762
 epoch: 13, train_loss: 0.9319, test_loss: 0.9436, test_f1: 0.5184
 epoch: 14, train_loss: 0.9390, test_loss: 0.9211, test_f1: 0.5184
 epoch: 15, train_loss: 0.9230, test_loss: 0.9591, test_f1: 0.4963
 epoch: 16, train_loss: 0.9007, test_loss: 0.9664, test_f1: 0.5161
 epoch: 17, train_loss: 0.8946, test_loss: 0.9363, test_f1: 0.5262
 epoch: 18, train_loss: 0.8944, test_loss: 0.9637, test_f1: 0.4926
 epoch: 19, train_loss: 0.8862, test_loss: 0.9620, test_f1: 0.5195
 epoch: 20, train_loss: 0.8791, test_loss: 0.9128, test_f1: 0.5354
 epoch: 21, train_loss: 0.8710, test_loss: 1.0253, test_f1: 0.4459
 epoch: 22, train_loss: 0.8688, test_loss: 0.9791, test_f1: 0.5275
 epoch: 23, train_loss: 0.8660, test_loss: 0.9654, test_f1: 0.5319
 epoch: 24, train_loss: 0.8597, test_loss: 0.9926, test_f1: 0.5014
 epoch: 25, train_loss: 0.8403, test_loss: 0.9585, test_f1: 0.5224
 epoch: 26, train_loss: 0.8496, test_loss: 1.0039, test_f1: 0.5243
 epoch: 27, train_loss: 0.8253, test_loss: 0.9787, test_f1: 0.5338
 epoch: 28, train_loss: 0.8204, test_loss: 1.0803, test_f1: 0.5105
 epoch: 29, train_loss: 0.8066, test_loss: 1.1411, test_f1: 0.5013
 epoch: 30, train_loss: 0.8241, test_loss: 1.0808, test_f1: 0.4912
 epoch: 31, train_loss: 0.8062, test_loss: 1.0859, test_f1: 0.5175
 epoch: 32, train_loss: 0.8024, test_loss: 1.1355, test_f1: 0.5175
 epoch: 33, train_loss: 0.7909, test_loss: 1.0748, test_f1: 0.5316
 epoch: 34, train_loss: 0.7890, test_loss: 1.1307, test_f1: 0.4862
 epoch: 35, train_loss: 0.7811, test_loss: 1.0995, test_f1: 0.5007
 epoch: 36, train_loss: 0.7868, test_loss: 1.1199, test_f1: 0.5000
 epoch: 37, train_loss: 0.7717, test_loss: 1.1042, test_f1: 0.5235
 epoch: 38, train_loss: 0.7700, test_loss: 1.1956, test_f1: 0.4653
 epoch: 39, train_loss: 0.7444, test_loss: 1.1954, test_f1: 0.5051
 epoch: 40, train_loss: 0.7465, test_loss: 1.1665, test_f1: 0.5307
 epoch: 41, train_loss: 0.7357, test_loss: 1.1747, test_f1: 0.5390
 epoch: 42, train_loss: 0.7498, test_loss: 1.2856, test_f1: 0.5019
 epoch: 43, train_loss: 0.7337, test_loss: 1.1732, test_f1: 0.5100
 epoch: 44, train_loss: 0.7224, test_loss: 1.2659, test_f1: 0.5123
 epoch: 45, train_loss: 0.7232, test_loss: 1.1538, test_f1: 0.5038
 epoch: 46, train_loss: 0.7201, test_loss: 1.2345, test_f1: 0.5100
 epoch: 47, train_loss: 0.7122, test_loss: 1.1977, test_f1: 0.5247
 epoch: 48, train_loss: 0.7055, test_loss: 1.1973, test_f1: 0.5181
 epoch: 49, train_loss: 0.6903, test_loss: 1.2425, test_f1: 0.4991
 epoch: 50, train_loss: 0.6997, test_loss: 1.2569, test_f1: 0.5135
 epoch: 51, train_loss: 0.6741, test_loss: 1.2268, test_f1: 0.5116
 epoch: 52, train_loss: 0.6527, test_loss: 1.2356, test_f1: 0.4977
 epoch: 53, train_loss: 0.6405, test_loss: 1.3096, test_f1: 0.4983
 epoch: 54, train_loss: 0.6419, test_loss: 1.2760, test_f1: 0.4912
 epoch: 55, train_loss: 0.6314, test_loss: 1.2661, test_f1: 0.5201
 epoch: 56, train_loss: 0.6263, test_loss: 1.3380, test_f1: 0.5090
 epoch: 57, train_loss: 0.6210, test_loss: 1.3585, test_f1: 0.5002
 epoch: 58, train_loss: 0.6299, test_loss: 1.3841, test_f1: 0.5038
 epoch: 59, train_loss: 0.6253, test_loss: 1.3946, test_f1: 0.5116
 epoch: 60, train_loss: 0.6169, test_loss: 1.3249, test_f1: 0.5097
 epoch: 61, train_loss: 0.6220, test_loss: 1.4318, test_f1: 0.4919
 epoch: 62, train_loss: 0.6196, test_loss: 1.3085, test_f1: 0.5061
 epoch: 63, train_loss: 0.6006, test_loss: 1.3706, test_f1: 0.5288
 epoch: 64, train_loss: 0.6102, test_loss: 1.3646, test_f1: 0.4983
 epoch: 65, train_loss: 0.6029, test_loss: 1.4913, test_f1: 0.4824
 epoch: 66, train_loss: 0.6120, test_loss: 1.5014, test_f1: 0.4889
 epoch: 67, train_loss: 0.6089, test_loss: 1.4090, test_f1: 0.5059
 epoch: 68, train_loss: 0.5908, test_loss: 1.4266, test_f1: 0.5066
 epoch: 69, train_loss: 0.5888, test_loss: 1.4693, test_f1: 0.4888
 epoch: 70, train_loss: 0.5905, test_loss: 1.3759, test_f1: 0.5159
 epoch: 71, train_loss: 0.5772, test_loss: 1.4049, test_f1: 0.5157
 epoch: 72, train_loss: 0.5757, test_loss: 1.4507, test_f1: 0.5042
 epoch: 73, train_loss: 0.5775, test_loss: 1.5311, test_f1: 0.4977
 epoch: 74, train_loss: 0.5689, test_loss: 1.5683, test_f1: 0.5142
 epoch: 75, train_loss: 0.5702, test_loss: 1.6184, test_f1: 0.4860
 epoch: 76, train_loss: 0.5673, test_loss: 1.6804, test_f1: 0.4930
 epoch: 77, train_loss: 0.5726, test_loss: 1.6019, test_f1: 0.4906
 epoch: 78, train_loss: 0.5665, test_loss: 1.6734, test_f1: 0.5116
 epoch: 79, train_loss: 0.5755, test_loss: 1.7072, test_f1: 0.5197
 epoch: 80, train_loss: 0.5626, test_loss: 1.5998, test_f1: 0.5294
 epoch: 81, train_loss: 0.5624, test_loss: 1.6796, test_f1: 0.5116
 epoch: 82, train_loss: 0.5558, test_loss: 1.7426, test_f1: 0.5126
 epoch: 83, train_loss: 0.5652, test_loss: 1.8046, test_f1: 0.5068
 epoch: 84, train_loss: 0.5454, test_loss: 1.9014, test_f1: 0.5312
 epoch: 85, train_loss: 0.5673, test_loss: 1.7686, test_f1: 0.5160
 epoch: 86, train_loss: 0.5558, test_loss: 1.5563, test_f1: 0.5269
 epoch: 87, train_loss: 0.5399, test_loss: 1.7344, test_f1: 0.5114
 epoch: 88, train_loss: 0.5391, test_loss: 1.8946, test_f1: 0.5126
 epoch: 89, train_loss: 0.5303, test_loss: 1.7641, test_f1: 0.5182
 epoch: 90, train_loss: 0.5336, test_loss: 1.5552, test_f1: 0.5154
 epoch: 91, train_loss: 0.5333, test_loss: 1.6580, test_f1: 0.5057
 epoch: 92, train_loss: 0.5206, test_loss: 1.7690, test_f1: 0.5259
 epoch: 93, train_loss: 0.5454, test_loss: 1.7587, test_f1: 0.5293
 epoch: 94, train_loss: 0.5282, test_loss: 1.8606, test_f1: 0.5363
 epoch: 95, train_loss: 0.5379, test_loss: 1.7802, test_f1: 0.5176
 epoch: 96, train_loss: 0.5247, test_loss: 1.7893, test_f1: 0.5344
 epoch: 97, train_loss: 0.5252, test_loss: 1.7352, test_f1: 0.5090
 epoch: 98, train_loss: 0.5126, test_loss: 1.6895, test_f1: 0.5398
 epoch: 99, train_loss: 0.5103, test_loss: 1.6631, test_f1: 0.5212
##################ITERATION #9 ****************************************
 epoch: 0, train_loss: 1.7225, test_loss: 1.2018, test_f1: 0.3947
 epoch: 1, train_loss: 1.2179, test_loss: 1.1177, test_f1: 0.4374
 epoch: 2, train_loss: 1.1577, test_loss: 1.0707, test_f1: 0.4511
 epoch: 3, train_loss: 1.1185, test_loss: 1.0258, test_f1: 0.4493
 epoch: 4, train_loss: 1.0837, test_loss: 1.0233, test_f1: 0.4501
 epoch: 5, train_loss: 1.0523, test_loss: 0.9784, test_f1: 0.4765
 epoch: 6, train_loss: 1.0211, test_loss: 0.9625, test_f1: 0.4756
 epoch: 7, train_loss: 1.0110, test_loss: 0.9477, test_f1: 0.5126
 epoch: 8, train_loss: 0.9819, test_loss: 0.9385, test_f1: 0.5264
 epoch: 9, train_loss: 0.9648, test_loss: 0.9384, test_f1: 0.4946
 epoch: 10, train_loss: 0.9515, test_loss: 0.9721, test_f1: 0.5263
 epoch: 11, train_loss: 0.9406, test_loss: 0.9873, test_f1: 0.5063
 epoch: 12, train_loss: 0.9301, test_loss: 0.9650, test_f1: 0.5317
 epoch: 13, train_loss: 0.9206, test_loss: 0.9924, test_f1: 0.5307
 epoch: 14, train_loss: 0.8966, test_loss: 0.9789, test_f1: 0.5198
 epoch: 15, train_loss: 0.9032, test_loss: 0.9950, test_f1: 0.5281
 epoch: 16, train_loss: 0.8920, test_loss: 1.0142, test_f1: 0.5052
 epoch: 17, train_loss: 0.8709, test_loss: 1.0016, test_f1: 0.5045
 epoch: 18, train_loss: 0.8643, test_loss: 0.9983, test_f1: 0.5315
 epoch: 19, train_loss: 0.8513, test_loss: 1.0493, test_f1: 0.5110
 epoch: 20, train_loss: 0.8480, test_loss: 1.0085, test_f1: 0.5123
 epoch: 21, train_loss: 0.8451, test_loss: 1.0505, test_f1: 0.5124
 epoch: 22, train_loss: 0.8224, test_loss: 1.0213, test_f1: 0.5149
 epoch: 23, train_loss: 0.8298, test_loss: 1.0426, test_f1: 0.4954
 epoch: 24, train_loss: 0.8207, test_loss: 1.0141, test_f1: 0.5373
 epoch: 25, train_loss: 0.8125, test_loss: 1.0008, test_f1: 0.5494
 epoch: 26, train_loss: 0.8137, test_loss: 1.0492, test_f1: 0.5092
 epoch: 27, train_loss: 0.7954, test_loss: 1.0398, test_f1: 0.5418
 epoch: 28, train_loss: 0.7957, test_loss: 1.0441, test_f1: 0.5308
 epoch: 29, train_loss: 0.7931, test_loss: 1.0588, test_f1: 0.5375
 epoch: 30, train_loss: 0.7695, test_loss: 1.0393, test_f1: 0.5202
 epoch: 31, train_loss: 0.7680, test_loss: 1.0662, test_f1: 0.5087
 epoch: 32, train_loss: 0.7508, test_loss: 1.0144, test_f1: 0.5426
 epoch: 33, train_loss: 0.7641, test_loss: 1.2102, test_f1: 0.4880
 epoch: 34, train_loss: 0.7568, test_loss: 1.0279, test_f1: 0.5325
 epoch: 35, train_loss: 0.7507, test_loss: 1.0847, test_f1: 0.5360
 epoch: 36, train_loss: 0.7591, test_loss: 1.0772, test_f1: 0.5297
 epoch: 37, train_loss: 0.7442, test_loss: 1.1535, test_f1: 0.5143
 epoch: 38, train_loss: 0.7414, test_loss: 1.0936, test_f1: 0.5491
 epoch: 39, train_loss: 0.7223, test_loss: 1.0934, test_f1: 0.5493
 epoch: 40, train_loss: 0.7259, test_loss: 1.1051, test_f1: 0.5337
 epoch: 41, train_loss: 0.7150, test_loss: 1.1078, test_f1: 0.5414
 epoch: 42, train_loss: 0.7026, test_loss: 1.1600, test_f1: 0.5227
 epoch: 43, train_loss: 0.7065, test_loss: 1.1309, test_f1: 0.5279
 epoch: 44, train_loss: 0.7052, test_loss: 1.1646, test_f1: 0.5254
 epoch: 45, train_loss: 0.6902, test_loss: 1.1040, test_f1: 0.5360
 epoch: 46, train_loss: 0.6764, test_loss: 1.1935, test_f1: 0.5283
 epoch: 47, train_loss: 0.6679, test_loss: 1.1582, test_f1: 0.5317
 epoch: 48, train_loss: 0.6674, test_loss: 1.1808, test_f1: 0.5342
 epoch: 49, train_loss: 0.6766, test_loss: 1.1773, test_f1: 0.5069
 epoch: 50, train_loss: 0.6812, test_loss: 1.1704, test_f1: 0.5418
 epoch: 51, train_loss: 0.6501, test_loss: 1.1801, test_f1: 0.5465
 epoch: 52, train_loss: 0.6092, test_loss: 1.2055, test_f1: 0.5260
 epoch: 53, train_loss: 0.6122, test_loss: 1.2289, test_f1: 0.5467
 epoch: 54, train_loss: 0.6336, test_loss: 1.1597, test_f1: 0.5462
 epoch: 55, train_loss: 0.5949, test_loss: 1.1803, test_f1: 0.5479
 epoch: 56, train_loss: 0.6078, test_loss: 1.2038, test_f1: 0.5494
 epoch: 57, train_loss: 0.6026, test_loss: 1.1722, test_f1: 0.5609
 epoch: 58, train_loss: 0.5986, test_loss: 1.2147, test_f1: 0.5353
 epoch: 59, train_loss: 0.6044, test_loss: 1.2605, test_f1: 0.5422
 epoch: 60, train_loss: 0.6030, test_loss: 1.2355, test_f1: 0.5327
 epoch: 61, train_loss: 0.5808, test_loss: 1.2135, test_f1: 0.5570
 epoch: 62, train_loss: 0.6001, test_loss: 1.2709, test_f1: 0.5083
 epoch: 63, train_loss: 0.5831, test_loss: 1.2964, test_f1: 0.5358
 epoch: 64, train_loss: 0.5730, test_loss: 1.2126, test_f1: 0.5419
 epoch: 65, train_loss: 0.5688, test_loss: 1.2568, test_f1: 0.5353
 epoch: 66, train_loss: 0.5810, test_loss: 1.2101, test_f1: 0.5611
 epoch: 67, train_loss: 0.5818, test_loss: 1.2016, test_f1: 0.5437
 epoch: 68, train_loss: 0.5636, test_loss: 1.1974, test_f1: 0.5440
 epoch: 69, train_loss: 0.5609, test_loss: 1.3118, test_f1: 0.5391
 epoch: 70, train_loss: 0.5552, test_loss: 1.2841, test_f1: 0.5432
 epoch: 71, train_loss: 0.5481, test_loss: 1.2587, test_f1: 0.5531
 epoch: 72, train_loss: 0.5440, test_loss: 1.2225, test_f1: 0.5551
 epoch: 73, train_loss: 0.5509, test_loss: 1.2453, test_f1: 0.5582
 epoch: 74, train_loss: 0.5471, test_loss: 1.3240, test_f1: 0.5462
 epoch: 75, train_loss: 0.5449, test_loss: 1.3220, test_f1: 0.5472
 epoch: 76, train_loss: 0.5514, test_loss: 1.3369, test_f1: 0.5489
 epoch: 77, train_loss: 0.5540, test_loss: 1.3251, test_f1: 0.5308
 epoch: 78, train_loss: 0.5431, test_loss: 1.3113, test_f1: 0.5347
 epoch: 79, train_loss: 0.5450, test_loss: 1.2527, test_f1: 0.5493
 epoch: 80, train_loss: 0.5302, test_loss: 1.2737, test_f1: 0.5404
 epoch: 81, train_loss: 0.5295, test_loss: 1.3215, test_f1: 0.5421
 epoch: 82, train_loss: 0.5424, test_loss: 1.3051, test_f1: 0.5271
 epoch: 83, train_loss: 0.5294, test_loss: 1.2852, test_f1: 0.5603
 epoch: 84, train_loss: 0.5264, test_loss: 1.3529, test_f1: 0.5483
 epoch: 85, train_loss: 0.5166, test_loss: 1.3880, test_f1: 0.5201
 epoch: 86, train_loss: 0.5223, test_loss: 1.3559, test_f1: 0.5580
 epoch: 87, train_loss: 0.5071, test_loss: 1.3798, test_f1: 0.5269
 epoch: 88, train_loss: 0.5243, test_loss: 1.3382, test_f1: 0.5460
 epoch: 89, train_loss: 0.5105, test_loss: 1.3010, test_f1: 0.5371
 epoch: 90, train_loss: 0.5001, test_loss: 1.4000, test_f1: 0.5424
 epoch: 91, train_loss: 0.4976, test_loss: 1.3729, test_f1: 0.5557
 epoch: 92, train_loss: 0.4906, test_loss: 1.4129, test_f1: 0.5206
 epoch: 93, train_loss: 0.4962, test_loss: 1.3457, test_f1: 0.5511
 epoch: 94, train_loss: 0.4837, test_loss: 1.4552, test_f1: 0.5277
 epoch: 95, train_loss: 0.4871, test_loss: 1.3286, test_f1: 0.5406
 epoch: 96, train_loss: 0.4843, test_loss: 1.3366, test_f1: 0.5815
 epoch: 97, train_loss: 0.4884, test_loss: 1.4072, test_f1: 0.5590
 epoch: 98, train_loss: 0.4879, test_loss: 1.3888, test_f1: 0.5430
 epoch: 99, train_loss: 0.4815, test_loss: 1.3992, test_f1: 0.5421

Training completed in 422.67 seconds
Best F1: 0.5984 at epoch 82
Mean F1 across iterations: 0.5721  0.0159
========================FINAL RESULTS================================
FEGIN weighted F1: 0.5984  0.0159
python main.py --data ltspice_examples --representation component_component --model FEGIN --layers 2 --hiddens 64 --batch_size 128 --lr 0.001 --emb_size 250 --epochs 100 --save_appendix component_component_L2_H64_BS128_LR0.001_E250 --no_val
-----



STDERR:
  File "main.py", line 370, in <module>
    main()
  File "main.py", line 254, in main
    dataset = dataset_class(
  File "/home/philip/projects/ltspice_examples_code_repo/Circuit-Completion-Using-GNNs/component_classification_with_link_prediction_head/evaluation/FEGIN/kernel/circuit_datasets.py", line 15, in __init__
    self.data, self.slices = torch.load(self.processed_paths[0])
  File "/home/philip/.local/lib/python3.8/site-packages/torch/serialization.py", line 1040, in load
    warnings.warn(
  File "/usr/lib/python3.8/warnings.py", line 109, in _showwarnmsg
    sw(msg.message, msg.category, msg.filename, msg.lineno,
  File "main.py", line 47, in warn_with_traceback
    traceback.print_stack(file=log)
/home/philip/projects/ltspice_examples_code_repo/Circuit-Completion-Using-GNNs/component_classification_with_link_prediction_head/evaluation/FEGIN/kernel/circuit_datasets.py:15: FutureWarning: You are using `torch.load` with `weights_only=False` (the current default value), which uses the default pickle module implicitly. It is possible to construct malicious pickle data which will execute arbitrary code during unpickling (See https://github.com/pytorch/pytorch/blob/main/SECURITY.md#untrusted-models for more details). In a future release, the default value for `weights_only` will be flipped to `True`. This limits the functions that could be executed during unpickling. Arbitrary objects will no longer be allowed to be loaded via this mode unless they are explicitly allowlisted by the user via `torch.serialization.add_safe_globals`. We recommend you start setting `weights_only=True` for any use case where you don't have full control of the loaded file. Please open an issue on GitHub for any issues related to this experimental feature.
  self.data, self.slices = torch.load(self.processed_paths[0])
