STDOUT:
Results will be saved in /home/philip/projects/ltspice_examples_code_repo/Circuit-Completion-Using-GNNs/component_classification_with_link_prediction_head/evaluation/FEGIN/results/model_FEGIN_dataset_ltspice_demos
Command line input: python main.py --data ltspice_demos --representation component_net --model FEGIN --layers 4 --hiddens 16 --batch_size 64 --lr 0.01 --emb_size 250 --epochs 100 --save_appendix component_net_L4_H16_BS64_LR0.01_E250 --no_val
 is saved.
-----
ltspice_demos - FEGIN
Using 4 layers, 16 hidden units, h = 2
Loading component_net representation dataset
ENTERED
Training FEGIN on component_net representation
Train: 1565, Test: 383
##################ITERATION #0 ****************************************
 epoch: 0, train_loss: 1.2996, test_loss: 1.2935, test_f1: 0.1378
 epoch: 1, train_loss: 1.1725, test_loss: 1.2491, test_f1: 0.2281
 epoch: 2, train_loss: 1.1438, test_loss: 1.2349, test_f1: 0.2712
 epoch: 3, train_loss: 1.1058, test_loss: 1.2488, test_f1: 0.3969
 epoch: 4, train_loss: 1.0704, test_loss: 1.1661, test_f1: 0.4299
 epoch: 5, train_loss: 1.0326, test_loss: 1.1179, test_f1: 0.4156
 epoch: 6, train_loss: 0.9996, test_loss: 1.1137, test_f1: 0.4517
 epoch: 7, train_loss: 0.9973, test_loss: 1.0744, test_f1: 0.3576
 epoch: 8, train_loss: 0.9952, test_loss: 1.1617, test_f1: 0.4285
 epoch: 9, train_loss: 0.9708, test_loss: 1.0542, test_f1: 0.5232
 epoch: 10, train_loss: 0.9672, test_loss: 1.0257, test_f1: 0.4936
 epoch: 11, train_loss: 0.9606, test_loss: 1.0573, test_f1: 0.3981
 epoch: 12, train_loss: 0.9667, test_loss: 1.0870, test_f1: 0.4016
 epoch: 13, train_loss: 0.9350, test_loss: 1.0506, test_f1: 0.5061
 epoch: 14, train_loss: 0.9472, test_loss: 1.0727, test_f1: 0.4728
 epoch: 15, train_loss: 0.9447, test_loss: 1.0182, test_f1: 0.5255
 epoch: 16, train_loss: 0.9316, test_loss: 1.0435, test_f1: 0.4757
 epoch: 17, train_loss: 0.9349, test_loss: 1.0502, test_f1: 0.5174
 epoch: 18, train_loss: 0.9516, test_loss: 1.0074, test_f1: 0.5205
 epoch: 19, train_loss: 0.9228, test_loss: 1.0044, test_f1: 0.5280
 epoch: 20, train_loss: 0.9147, test_loss: 1.0575, test_f1: 0.5396
 epoch: 21, train_loss: 0.9240, test_loss: 1.0238, test_f1: 0.5196
 epoch: 22, train_loss: 0.9190, test_loss: 1.0081, test_f1: 0.5220
 epoch: 23, train_loss: 0.9126, test_loss: 1.1645, test_f1: 0.4050
 epoch: 24, train_loss: 0.9004, test_loss: 1.0151, test_f1: 0.5253
 epoch: 25, train_loss: 0.8918, test_loss: 1.0056, test_f1: 0.5704
 epoch: 26, train_loss: 0.8898, test_loss: 0.9906, test_f1: 0.5674
 epoch: 27, train_loss: 0.9159, test_loss: 1.0412, test_f1: 0.5143
 epoch: 28, train_loss: 0.9183, test_loss: 0.9927, test_f1: 0.5402
 epoch: 29, train_loss: 0.8953, test_loss: 0.9928, test_f1: 0.5426
 epoch: 30, train_loss: 0.9057, test_loss: 1.0723, test_f1: 0.5011
 epoch: 31, train_loss: 0.8830, test_loss: 1.0426, test_f1: 0.5627
 epoch: 32, train_loss: 0.8812, test_loss: 1.1089, test_f1: 0.5074
 epoch: 33, train_loss: 0.8794, test_loss: 1.0745, test_f1: 0.5095
 epoch: 34, train_loss: 0.9032, test_loss: 1.0022, test_f1: 0.5212
 epoch: 35, train_loss: 0.8632, test_loss: 1.0012, test_f1: 0.5765
 epoch: 36, train_loss: 0.8765, test_loss: 1.0297, test_f1: 0.5065
 epoch: 37, train_loss: 0.8789, test_loss: 1.1307, test_f1: 0.5448
 epoch: 38, train_loss: 0.8630, test_loss: 1.0370, test_f1: 0.4579
 epoch: 39, train_loss: 0.8586, test_loss: 0.9498, test_f1: 0.5415
 epoch: 40, train_loss: 0.8615, test_loss: 1.0209, test_f1: 0.5528
 epoch: 41, train_loss: 0.8619, test_loss: 0.9918, test_f1: 0.5700
 epoch: 42, train_loss: 0.8537, test_loss: 1.2299, test_f1: 0.5282
 epoch: 43, train_loss: 0.8570, test_loss: 1.0384, test_f1: 0.5301
 epoch: 44, train_loss: 0.8621, test_loss: 1.0083, test_f1: 0.5394
 epoch: 45, train_loss: 0.8420, test_loss: 1.0757, test_f1: 0.4941
 epoch: 46, train_loss: 0.8693, test_loss: 1.0016, test_f1: 0.5390
 epoch: 47, train_loss: 0.8355, test_loss: 1.8142, test_f1: 0.5485
 epoch: 48, train_loss: 0.8631, test_loss: 1.0218, test_f1: 0.5393
 epoch: 49, train_loss: 0.8558, test_loss: 1.1021, test_f1: 0.5521
 epoch: 50, train_loss: 0.8342, test_loss: 1.0634, test_f1: 0.5351
 epoch: 51, train_loss: 0.8081, test_loss: 1.0719, test_f1: 0.5483
 epoch: 52, train_loss: 0.7981, test_loss: 1.0165, test_f1: 0.5401
 epoch: 53, train_loss: 0.7836, test_loss: 1.0106, test_f1: 0.5607
 epoch: 54, train_loss: 0.7833, test_loss: 1.0304, test_f1: 0.5750
 epoch: 55, train_loss: 0.7870, test_loss: 1.1982, test_f1: 0.4708
 epoch: 56, train_loss: 0.8030, test_loss: 1.0344, test_f1: 0.5599
 epoch: 57, train_loss: 0.7949, test_loss: 1.0344, test_f1: 0.5768
 epoch: 58, train_loss: 0.7860, test_loss: 1.1103, test_f1: 0.5680
 epoch: 59, train_loss: 0.7867, test_loss: 0.9675, test_f1: 0.5901
 epoch: 60, train_loss: 0.7890, test_loss: 0.9825, test_f1: 0.5834
 epoch: 61, train_loss: 0.7653, test_loss: 1.1549, test_f1: 0.5503
 epoch: 62, train_loss: 0.7666, test_loss: 1.1862, test_f1: 0.5453
 epoch: 63, train_loss: 0.7647, test_loss: 1.2851, test_f1: 0.5163
 epoch: 64, train_loss: 0.7597, test_loss: 1.2149, test_f1: 0.5564
 epoch: 65, train_loss: 0.7654, test_loss: 1.1380, test_f1: 0.5667
 epoch: 66, train_loss: 0.7502, test_loss: 1.0868, test_f1: 0.5557
 epoch: 67, train_loss: 0.7422, test_loss: 1.2235, test_f1: 0.5682
 epoch: 68, train_loss: 0.7636, test_loss: 1.0629, test_f1: 0.5526
 epoch: 69, train_loss: 0.7395, test_loss: 1.1191, test_f1: 0.5411
 epoch: 70, train_loss: 0.7327, test_loss: 1.1631, test_f1: 0.5811
 epoch: 71, train_loss: 0.7503, test_loss: 1.2517, test_f1: 0.5630
 epoch: 72, train_loss: 0.7316, test_loss: 1.1828, test_f1: 0.6016
 epoch: 73, train_loss: 0.7341, test_loss: 1.1248, test_f1: 0.5774
 epoch: 74, train_loss: 0.7296, test_loss: 1.2447, test_f1: 0.5327
 epoch: 75, train_loss: 0.7226, test_loss: 1.3102, test_f1: 0.5560
 epoch: 76, train_loss: 0.7248, test_loss: 1.0746, test_f1: 0.5858
 epoch: 77, train_loss: 0.7226, test_loss: 1.4118, test_f1: 0.5464
 epoch: 78, train_loss: 0.7158, test_loss: 1.1456, test_f1: 0.5794
 epoch: 79, train_loss: 0.6992, test_loss: 1.1239, test_f1: 0.5862
 epoch: 80, train_loss: 0.7087, test_loss: 1.3684, test_f1: 0.5458
 epoch: 81, train_loss: 0.7151, test_loss: 1.1320, test_f1: 0.5731
 epoch: 82, train_loss: 0.7002, test_loss: 1.2176, test_f1: 0.5833
 epoch: 83, train_loss: 0.7021, test_loss: 1.1427, test_f1: 0.5765
 epoch: 84, train_loss: 0.6933, test_loss: 1.2134, test_f1: 0.5571
 epoch: 85, train_loss: 0.6919, test_loss: 1.2788, test_f1: 0.5968
 epoch: 86, train_loss: 0.7046, test_loss: 1.1950, test_f1: 0.6151
 epoch: 87, train_loss: 0.6570, test_loss: 1.2128, test_f1: 0.5709
 epoch: 88, train_loss: 0.6663, test_loss: 1.3054, test_f1: 0.5385
 epoch: 89, train_loss: 0.6965, test_loss: 1.1138, test_f1: 0.6185
 epoch: 90, train_loss: 0.6634, test_loss: 1.3435, test_f1: 0.5786
 epoch: 91, train_loss: 0.6817, test_loss: 1.4027, test_f1: 0.5277
 epoch: 92, train_loss: 0.6592, test_loss: 1.2615, test_f1: 0.5693
 epoch: 93, train_loss: 0.6619, test_loss: 1.5796, test_f1: 0.5217
 epoch: 94, train_loss: 0.6445, test_loss: 1.2787, test_f1: 0.5409
 epoch: 95, train_loss: 0.6700, test_loss: 1.2174, test_f1: 0.5860
 epoch: 96, train_loss: 0.6763, test_loss: 1.3721, test_f1: 0.5765
 epoch: 97, train_loss: 0.6794, test_loss: 1.2947, test_f1: 0.5573
 epoch: 98, train_loss: 0.6688, test_loss: 1.3002, test_f1: 0.5760
 epoch: 99, train_loss: 0.6677, test_loss: 1.6096, test_f1: 0.5125
##################ITERATION #1 ****************************************
 epoch: 0, train_loss: 1.1823, test_loss: 1.2784, test_f1: 0.3232
 epoch: 1, train_loss: 1.0665, test_loss: 1.2108, test_f1: 0.4473
 epoch: 2, train_loss: 1.0461, test_loss: 1.1260, test_f1: 0.3467
 epoch: 3, train_loss: 0.9943, test_loss: 1.1137, test_f1: 0.4722
 epoch: 4, train_loss: 0.9823, test_loss: 1.0707, test_f1: 0.4706
 epoch: 5, train_loss: 0.9753, test_loss: 1.0232, test_f1: 0.5341
 epoch: 6, train_loss: 0.9502, test_loss: 1.2000, test_f1: 0.4758
 epoch: 7, train_loss: 0.9298, test_loss: 1.1167, test_f1: 0.4970
 epoch: 8, train_loss: 0.9500, test_loss: 1.0679, test_f1: 0.4920
 epoch: 9, train_loss: 0.9437, test_loss: 1.0392, test_f1: 0.5339
 epoch: 10, train_loss: 0.9431, test_loss: 1.0260, test_f1: 0.5465
 epoch: 11, train_loss: 0.9238, test_loss: 1.0728, test_f1: 0.4830
 epoch: 12, train_loss: 0.9103, test_loss: 1.1583, test_f1: 0.4782
 epoch: 13, train_loss: 0.9077, test_loss: 1.1114, test_f1: 0.4541
 epoch: 14, train_loss: 0.8886, test_loss: 1.0558, test_f1: 0.5350
 epoch: 15, train_loss: 0.8754, test_loss: 0.9653, test_f1: 0.5393
 epoch: 16, train_loss: 0.8705, test_loss: 1.0578, test_f1: 0.4674
 epoch: 17, train_loss: 0.8778, test_loss: 0.9518, test_f1: 0.5321
 epoch: 18, train_loss: 0.8826, test_loss: 1.0651, test_f1: 0.4729
 epoch: 19, train_loss: 0.8593, test_loss: 1.0374, test_f1: 0.5226
 epoch: 20, train_loss: 0.8213, test_loss: 1.0687, test_f1: 0.5363
 epoch: 21, train_loss: 0.8264, test_loss: 1.1366, test_f1: 0.5127
 epoch: 22, train_loss: 0.8157, test_loss: 1.0376, test_f1: 0.5839
 epoch: 23, train_loss: 0.8137, test_loss: 1.0863, test_f1: 0.5484
 epoch: 24, train_loss: 0.8592, test_loss: 1.0728, test_f1: 0.5281
 epoch: 25, train_loss: 0.8059, test_loss: 1.0216, test_f1: 0.5382
 epoch: 26, train_loss: 0.8104, test_loss: 1.0537, test_f1: 0.5619
 epoch: 27, train_loss: 0.7983, test_loss: 1.0377, test_f1: 0.5345
 epoch: 28, train_loss: 0.8412, test_loss: 1.1012, test_f1: 0.4893
 epoch: 29, train_loss: 0.8016, test_loss: 1.3175, test_f1: 0.4801
 epoch: 30, train_loss: 0.7919, test_loss: 1.0316, test_f1: 0.5625
 epoch: 31, train_loss: 0.7948, test_loss: 1.3465, test_f1: 0.4634
 epoch: 32, train_loss: 0.8157, test_loss: 1.1436, test_f1: 0.5512
 epoch: 33, train_loss: 0.7860, test_loss: 1.0212, test_f1: 0.5558
 epoch: 34, train_loss: 0.7831, test_loss: 1.0656, test_f1: 0.5628
 epoch: 35, train_loss: 0.7619, test_loss: 1.1418, test_f1: 0.5356
 epoch: 36, train_loss: 0.7704, test_loss: 1.0666, test_f1: 0.5975
 epoch: 37, train_loss: 0.7793, test_loss: 1.0282, test_f1: 0.5749
 epoch: 38, train_loss: 0.7516, test_loss: 1.1839, test_f1: 0.5021
 epoch: 39, train_loss: 0.7556, test_loss: 1.0254, test_f1: 0.5635
 epoch: 40, train_loss: 0.7595, test_loss: 1.1261, test_f1: 0.5406
 epoch: 41, train_loss: 0.7670, test_loss: 1.0734, test_f1: 0.5345
 epoch: 42, train_loss: 0.7524, test_loss: 1.0493, test_f1: 0.5634
 epoch: 43, train_loss: 0.7402, test_loss: 0.9813, test_f1: 0.5738
 epoch: 44, train_loss: 0.7460, test_loss: 1.0858, test_f1: 0.5043
 epoch: 45, train_loss: 0.7465, test_loss: 1.0344, test_f1: 0.5633
 epoch: 46, train_loss: 0.7353, test_loss: 1.3345, test_f1: 0.4269
 epoch: 47, train_loss: 0.7392, test_loss: 0.9467, test_f1: 0.5919
 epoch: 48, train_loss: 0.7530, test_loss: 1.0997, test_f1: 0.5260
 epoch: 49, train_loss: 0.7465, test_loss: 1.1400, test_f1: 0.5368
 epoch: 50, train_loss: 0.7536, test_loss: 1.1552, test_f1: 0.5298
 epoch: 51, train_loss: 0.7262, test_loss: 1.0184, test_f1: 0.5734
 epoch: 52, train_loss: 0.7074, test_loss: 1.0086, test_f1: 0.5576
 epoch: 53, train_loss: 0.6911, test_loss: 1.0721, test_f1: 0.5292
 epoch: 54, train_loss: 0.7078, test_loss: 1.0505, test_f1: 0.5578
 epoch: 55, train_loss: 0.6787, test_loss: 1.0266, test_f1: 0.5433
 epoch: 56, train_loss: 0.6962, test_loss: 1.0402, test_f1: 0.5693
 epoch: 57, train_loss: 0.6917, test_loss: 1.1328, test_f1: 0.5718
 epoch: 58, train_loss: 0.6927, test_loss: 1.0490, test_f1: 0.5592
 epoch: 59, train_loss: 0.6734, test_loss: 1.1014, test_f1: 0.5699
 epoch: 60, train_loss: 0.6755, test_loss: 1.1076, test_f1: 0.5690
 epoch: 61, train_loss: 0.6681, test_loss: 1.0610, test_f1: 0.5602
 epoch: 62, train_loss: 0.6552, test_loss: 1.0838, test_f1: 0.5602
 epoch: 63, train_loss: 0.6793, test_loss: 1.1007, test_f1: 0.5611
 epoch: 64, train_loss: 0.6764, test_loss: 1.0820, test_f1: 0.5450
 epoch: 65, train_loss: 0.6882, test_loss: 1.0604, test_f1: 0.5774
 epoch: 66, train_loss: 0.6679, test_loss: 1.1477, test_f1: 0.4942
 epoch: 67, train_loss: 0.6322, test_loss: 1.0695, test_f1: 0.5909
 epoch: 68, train_loss: 0.6642, test_loss: 0.9996, test_f1: 0.5622
 epoch: 69, train_loss: 0.6400, test_loss: 1.1373, test_f1: 0.5482
 epoch: 70, train_loss: 0.6555, test_loss: 1.1946, test_f1: 0.5465
 epoch: 71, train_loss: 0.6602, test_loss: 1.0710, test_f1: 0.5455
 epoch: 72, train_loss: 0.6403, test_loss: 1.1226, test_f1: 0.5501
 epoch: 73, train_loss: 0.6587, test_loss: 1.2161, test_f1: 0.5785
 epoch: 74, train_loss: 0.6735, test_loss: 1.1662, test_f1: 0.5647
 epoch: 75, train_loss: 0.6395, test_loss: 1.0511, test_f1: 0.5535
 epoch: 76, train_loss: 0.6314, test_loss: 1.1311, test_f1: 0.5658
 epoch: 77, train_loss: 0.6471, test_loss: 1.2055, test_f1: 0.5485
 epoch: 78, train_loss: 0.6390, test_loss: 1.1862, test_f1: 0.5693
 epoch: 79, train_loss: 0.6452, test_loss: 1.0846, test_f1: 0.5853
 epoch: 80, train_loss: 0.6422, test_loss: 1.1276, test_f1: 0.5788
 epoch: 81, train_loss: 0.6493, test_loss: 1.1272, test_f1: 0.5918
 epoch: 82, train_loss: 0.6176, test_loss: 1.1703, test_f1: 0.5874
 epoch: 83, train_loss: 0.6399, test_loss: 1.1130, test_f1: 0.5696
 epoch: 84, train_loss: 0.6224, test_loss: 1.1178, test_f1: 0.5876
 epoch: 85, train_loss: 0.6053, test_loss: 1.2292, test_f1: 0.5416
 epoch: 86, train_loss: 0.6323, test_loss: 1.2307, test_f1: 0.5380
 epoch: 87, train_loss: 0.6345, test_loss: 1.1501, test_f1: 0.5531
 epoch: 88, train_loss: 0.6324, test_loss: 1.2876, test_f1: 0.5644
 epoch: 89, train_loss: 0.6557, test_loss: 1.1871, test_f1: 0.5533
 epoch: 90, train_loss: 0.6298, test_loss: 1.1258, test_f1: 0.6014
 epoch: 91, train_loss: 0.6210, test_loss: 1.1598, test_f1: 0.5775
 epoch: 92, train_loss: 0.6058, test_loss: 1.2767, test_f1: 0.5791
 epoch: 93, train_loss: 0.5998, test_loss: 1.4307, test_f1: 0.5052
 epoch: 94, train_loss: 0.6147, test_loss: 1.2393, test_f1: 0.5730
 epoch: 95, train_loss: 0.6211, test_loss: 1.1536, test_f1: 0.5876
 epoch: 96, train_loss: 0.6144, test_loss: 1.1960, test_f1: 0.5650
 epoch: 97, train_loss: 0.6185, test_loss: 1.1835, test_f1: 0.5874
 epoch: 98, train_loss: 0.6304, test_loss: 1.2733, test_f1: 0.5489
 epoch: 99, train_loss: 0.6389, test_loss: 1.1206, test_f1: 0.5833
##################ITERATION #2 ****************************************
 epoch: 0, train_loss: 1.2147, test_loss: 1.2381, test_f1: 0.3232
 epoch: 1, train_loss: 1.0805, test_loss: 1.1888, test_f1: 0.3871
 epoch: 2, train_loss: 1.0338, test_loss: 1.1062, test_f1: 0.4636
 epoch: 3, train_loss: 0.9983, test_loss: 1.0932, test_f1: 0.4375
 epoch: 4, train_loss: 0.9861, test_loss: 1.0586, test_f1: 0.5325
 epoch: 5, train_loss: 0.9815, test_loss: 1.0866, test_f1: 0.4863
 epoch: 6, train_loss: 0.9598, test_loss: 1.0727, test_f1: 0.4774
 epoch: 7, train_loss: 0.9757, test_loss: 1.0748, test_f1: 0.4550
 epoch: 8, train_loss: 0.9666, test_loss: 1.1014, test_f1: 0.5148
 epoch: 9, train_loss: 0.9723, test_loss: 1.0348, test_f1: 0.4912
 epoch: 10, train_loss: 0.9574, test_loss: 1.0219, test_f1: 0.5274
 epoch: 11, train_loss: 0.9571, test_loss: 1.0587, test_f1: 0.5003
 epoch: 12, train_loss: 0.9518, test_loss: 1.0794, test_f1: 0.4958
 epoch: 13, train_loss: 0.9285, test_loss: 1.0277, test_f1: 0.5615
 epoch: 14, train_loss: 0.9105, test_loss: 1.0134, test_f1: 0.5387
 epoch: 15, train_loss: 0.9131, test_loss: 1.0609, test_f1: 0.5285
 epoch: 16, train_loss: 0.9288, test_loss: 1.1670, test_f1: 0.4786
 epoch: 17, train_loss: 0.9326, test_loss: 1.0017, test_f1: 0.5447
 epoch: 18, train_loss: 0.9061, test_loss: 1.1975, test_f1: 0.4169
 epoch: 19, train_loss: 0.9026, test_loss: 1.0351, test_f1: 0.5298
 epoch: 20, train_loss: 0.9089, test_loss: 1.0234, test_f1: 0.5206
 epoch: 21, train_loss: 0.9235, test_loss: 1.0565, test_f1: 0.5630
 epoch: 22, train_loss: 0.8908, test_loss: 0.9999, test_f1: 0.5579
 epoch: 23, train_loss: 0.9116, test_loss: 1.1928, test_f1: 0.4765
 epoch: 24, train_loss: 0.9021, test_loss: 1.0980, test_f1: 0.5277
 epoch: 25, train_loss: 0.8735, test_loss: 1.0682, test_f1: 0.5084
 epoch: 26, train_loss: 0.8782, test_loss: 1.1410, test_f1: 0.5230
 epoch: 27, train_loss: 0.8592, test_loss: 1.0928, test_f1: 0.5729
 epoch: 28, train_loss: 0.8495, test_loss: 1.1004, test_f1: 0.6005
 epoch: 29, train_loss: 0.8472, test_loss: 1.0364, test_f1: 0.5803
 epoch: 30, train_loss: 0.8620, test_loss: 1.0612, test_f1: 0.5885
 epoch: 31, train_loss: 0.8528, test_loss: 1.0131, test_f1: 0.5786
 epoch: 32, train_loss: 0.8185, test_loss: 1.1897, test_f1: 0.5646
 epoch: 33, train_loss: 0.8119, test_loss: 1.0183, test_f1: 0.5643
 epoch: 34, train_loss: 0.8262, test_loss: 1.0509, test_f1: 0.5648
 epoch: 35, train_loss: 0.8076, test_loss: 1.0492, test_f1: 0.5743
 epoch: 36, train_loss: 0.8368, test_loss: 1.1264, test_f1: 0.5924
 epoch: 37, train_loss: 0.8158, test_loss: 1.1214, test_f1: 0.5953
 epoch: 38, train_loss: 0.8015, test_loss: 1.1596, test_f1: 0.5668
 epoch: 39, train_loss: 0.7960, test_loss: 1.1026, test_f1: 0.5608
 epoch: 40, train_loss: 0.7820, test_loss: 1.0784, test_f1: 0.5668
 epoch: 41, train_loss: 0.7945, test_loss: 1.0523, test_f1: 0.6198
 epoch: 42, train_loss: 0.7598, test_loss: 1.1900, test_f1: 0.5436
 epoch: 43, train_loss: 0.7809, test_loss: 1.0629, test_f1: 0.5805
 epoch: 44, train_loss: 0.7722, test_loss: 1.1353, test_f1: 0.5485
 epoch: 45, train_loss: 0.7648, test_loss: 1.1650, test_f1: 0.5881
 epoch: 46, train_loss: 0.7573, test_loss: 1.1884, test_f1: 0.5757
 epoch: 47, train_loss: 0.7795, test_loss: 1.1226, test_f1: 0.5431
 epoch: 48, train_loss: 0.7656, test_loss: 1.2546, test_f1: 0.5244
 epoch: 49, train_loss: 0.7929, test_loss: 1.1311, test_f1: 0.5587
 epoch: 50, train_loss: 0.7887, test_loss: 1.0583, test_f1: 0.5728
 epoch: 51, train_loss: 0.7441, test_loss: 1.2837, test_f1: 0.5511
 epoch: 52, train_loss: 0.7349, test_loss: 1.2466, test_f1: 0.5560
 epoch: 53, train_loss: 0.7051, test_loss: 1.1893, test_f1: 0.5589
 epoch: 54, train_loss: 0.7291, test_loss: 1.1718, test_f1: 0.5933
 epoch: 55, train_loss: 0.7123, test_loss: 1.1897, test_f1: 0.5719
 epoch: 56, train_loss: 0.7038, test_loss: 1.3380, test_f1: 0.5467
 epoch: 57, train_loss: 0.7033, test_loss: 1.3241, test_f1: 0.5626
 epoch: 58, train_loss: 0.6999, test_loss: 1.1273, test_f1: 0.5943
 epoch: 59, train_loss: 0.7000, test_loss: 1.1998, test_f1: 0.5840
 epoch: 60, train_loss: 0.6918, test_loss: 1.1451, test_f1: 0.5878
 epoch: 61, train_loss: 0.6978, test_loss: 1.1915, test_f1: 0.5965
 epoch: 62, train_loss: 0.6876, test_loss: 1.1603, test_f1: 0.5966
 epoch: 63, train_loss: 0.6966, test_loss: 1.2395, test_f1: 0.5869
 epoch: 64, train_loss: 0.7054, test_loss: 1.1317, test_f1: 0.5685
 epoch: 65, train_loss: 0.7046, test_loss: 1.3353, test_f1: 0.5704
 epoch: 66, train_loss: 0.6930, test_loss: 1.2340, test_f1: 0.5891
 epoch: 67, train_loss: 0.6735, test_loss: 1.3340, test_f1: 0.5792
 epoch: 68, train_loss: 0.6771, test_loss: 1.3020, test_f1: 0.5909
 epoch: 69, train_loss: 0.6626, test_loss: 1.2798, test_f1: 0.5865
 epoch: 70, train_loss: 0.6681, test_loss: 1.3216, test_f1: 0.5816
 epoch: 71, train_loss: 0.7038, test_loss: 1.1345, test_f1: 0.5866
 epoch: 72, train_loss: 0.6821, test_loss: 1.2476, test_f1: 0.5729
 epoch: 73, train_loss: 0.6701, test_loss: 1.2349, test_f1: 0.5762
 epoch: 74, train_loss: 0.6667, test_loss: 1.2667, test_f1: 0.5796
 epoch: 75, train_loss: 0.6899, test_loss: 1.2551, test_f1: 0.5635
 epoch: 76, train_loss: 0.6788, test_loss: 1.2690, test_f1: 0.6045
 epoch: 77, train_loss: 0.6696, test_loss: 1.3547, test_f1: 0.5935
 epoch: 78, train_loss: 0.6717, test_loss: 1.2914, test_f1: 0.5973
 epoch: 79, train_loss: 0.6601, test_loss: 1.3306, test_f1: 0.5588
 epoch: 80, train_loss: 0.6652, test_loss: 1.2969, test_f1: 0.5902
 epoch: 81, train_loss: 0.6628, test_loss: 1.3338, test_f1: 0.5992
 epoch: 82, train_loss: 0.6562, test_loss: 1.2994, test_f1: 0.5813
 epoch: 83, train_loss: 0.6487, test_loss: 1.3483, test_f1: 0.5810
 epoch: 84, train_loss: 0.6325, test_loss: 1.2396, test_f1: 0.6073
 epoch: 85, train_loss: 0.6595, test_loss: 1.5211, test_f1: 0.5743
 epoch: 86, train_loss: 0.6419, test_loss: 1.3706, test_f1: 0.5908
 epoch: 87, train_loss: 0.6630, test_loss: 1.3538, test_f1: 0.5852
 epoch: 88, train_loss: 0.6824, test_loss: 1.3846, test_f1: 0.5638
 epoch: 89, train_loss: 0.6520, test_loss: 1.2811, test_f1: 0.5757
 epoch: 90, train_loss: 0.6254, test_loss: 1.3252, test_f1: 0.6159
 epoch: 91, train_loss: 0.6745, test_loss: 1.3963, test_f1: 0.5729
 epoch: 92, train_loss: 0.6895, test_loss: 1.3953, test_f1: 0.5662
 epoch: 93, train_loss: 0.6623, test_loss: 1.3301, test_f1: 0.5789
 epoch: 94, train_loss: 0.6383, test_loss: 1.3244, test_f1: 0.6058
 epoch: 95, train_loss: 0.6479, test_loss: 1.3278, test_f1: 0.5954
 epoch: 96, train_loss: 0.6273, test_loss: 1.2700, test_f1: 0.5967
 epoch: 97, train_loss: 0.6456, test_loss: 1.3201, test_f1: 0.5993
 epoch: 98, train_loss: 0.6337, test_loss: 1.2268, test_f1: 0.6111
 epoch: 99, train_loss: 0.6231, test_loss: 1.2987, test_f1: 0.5724
##################ITERATION #3 ****************************************
 epoch: 0, train_loss: 1.2328, test_loss: 1.2557, test_f1: 0.2281
 epoch: 1, train_loss: 1.0936, test_loss: 1.1569, test_f1: 0.4182
 epoch: 2, train_loss: 1.0350, test_loss: 1.0999, test_f1: 0.4235
 epoch: 3, train_loss: 1.0173, test_loss: 1.0508, test_f1: 0.4637
 epoch: 4, train_loss: 1.0060, test_loss: 1.0500, test_f1: 0.4354
 epoch: 5, train_loss: 0.9825, test_loss: 1.0392, test_f1: 0.4234
 epoch: 6, train_loss: 0.9734, test_loss: 1.1225, test_f1: 0.5139
 epoch: 7, train_loss: 0.9704, test_loss: 1.1011, test_f1: 0.5040
 epoch: 8, train_loss: 0.9518, test_loss: 1.0765, test_f1: 0.4787
 epoch: 9, train_loss: 0.9582, test_loss: 1.1174, test_f1: 0.4911
 epoch: 10, train_loss: 0.9566, test_loss: 1.0305, test_f1: 0.4998
 epoch: 11, train_loss: 0.9348, test_loss: 1.0588, test_f1: 0.5113
 epoch: 12, train_loss: 0.9545, test_loss: 1.0782, test_f1: 0.4741
 epoch: 13, train_loss: 0.9304, test_loss: 1.0821, test_f1: 0.5084
 epoch: 14, train_loss: 0.9230, test_loss: 1.0094, test_f1: 0.5064
 epoch: 15, train_loss: 0.9073, test_loss: 1.0921, test_f1: 0.5158
 epoch: 16, train_loss: 0.9047, test_loss: 1.1073, test_f1: 0.5098
 epoch: 17, train_loss: 0.9251, test_loss: 1.1921, test_f1: 0.4973
 epoch: 18, train_loss: 0.9378, test_loss: 1.1637, test_f1: 0.4702
 epoch: 19, train_loss: 0.9232, test_loss: 0.9871, test_f1: 0.5342
 epoch: 20, train_loss: 0.9243, test_loss: 1.0058, test_f1: 0.5352
 epoch: 21, train_loss: 0.8989, test_loss: 1.0114, test_f1: 0.5546
 epoch: 22, train_loss: 0.9053, test_loss: 1.0730, test_f1: 0.4210
 epoch: 23, train_loss: 0.8899, test_loss: 0.9789, test_f1: 0.5604
 epoch: 24, train_loss: 0.8927, test_loss: 1.0263, test_f1: 0.5654
 epoch: 25, train_loss: 0.8700, test_loss: 1.0026, test_f1: 0.5577
 epoch: 26, train_loss: 0.8967, test_loss: 1.3349, test_f1: 0.4506
 epoch: 27, train_loss: 0.9019, test_loss: 1.0096, test_f1: 0.4782
 epoch: 28, train_loss: 0.8732, test_loss: 0.9925, test_f1: 0.5482
 epoch: 29, train_loss: 0.8559, test_loss: 0.9671, test_f1: 0.5375
 epoch: 30, train_loss: 0.8603, test_loss: 1.0531, test_f1: 0.5516
 epoch: 31, train_loss: 0.8622, test_loss: 1.0533, test_f1: 0.4432
 epoch: 32, train_loss: 0.8607, test_loss: 1.0204, test_f1: 0.5331
 epoch: 33, train_loss: 0.8508, test_loss: 1.0279, test_f1: 0.5437
 epoch: 34, train_loss: 0.8679, test_loss: 1.0189, test_f1: 0.5269
 epoch: 35, train_loss: 0.8691, test_loss: 0.9614, test_f1: 0.5644
 epoch: 36, train_loss: 0.8604, test_loss: 1.0172, test_f1: 0.5466
 epoch: 37, train_loss: 0.8286, test_loss: 1.0267, test_f1: 0.5596
 epoch: 38, train_loss: 0.8420, test_loss: 1.1950, test_f1: 0.4832
 epoch: 39, train_loss: 0.8508, test_loss: 0.9713, test_f1: 0.5424
 epoch: 40, train_loss: 0.8339, test_loss: 1.1653, test_f1: 0.5363
 epoch: 41, train_loss: 0.8355, test_loss: 0.9893, test_f1: 0.5614
 epoch: 42, train_loss: 0.8588, test_loss: 0.9822, test_f1: 0.5641
 epoch: 43, train_loss: 0.8555, test_loss: 1.0550, test_f1: 0.5596
 epoch: 44, train_loss: 0.8291, test_loss: 0.9936, test_f1: 0.5765
 epoch: 45, train_loss: 0.8542, test_loss: 1.0314, test_f1: 0.5486
 epoch: 46, train_loss: 0.8293, test_loss: 1.0641, test_f1: 0.5304
 epoch: 47, train_loss: 0.8194, test_loss: 1.0369, test_f1: 0.5563
 epoch: 48, train_loss: 0.8490, test_loss: 1.0563, test_f1: 0.5054
 epoch: 49, train_loss: 0.8489, test_loss: 1.1219, test_f1: 0.5490
 epoch: 50, train_loss: 0.8036, test_loss: 0.9581, test_f1: 0.5865
 epoch: 51, train_loss: 0.7999, test_loss: 1.0423, test_f1: 0.5708
 epoch: 52, train_loss: 0.7989, test_loss: 1.0664, test_f1: 0.5818
 epoch: 53, train_loss: 0.7741, test_loss: 1.0386, test_f1: 0.5844
 epoch: 54, train_loss: 0.7624, test_loss: 1.0354, test_f1: 0.5759
 epoch: 55, train_loss: 0.7649, test_loss: 1.0697, test_f1: 0.5659
 epoch: 56, train_loss: 0.7432, test_loss: 1.0929, test_f1: 0.5730
 epoch: 57, train_loss: 0.7649, test_loss: 1.0990, test_f1: 0.5486
 epoch: 58, train_loss: 0.7441, test_loss: 1.0647, test_f1: 0.5751
 epoch: 59, train_loss: 0.7563, test_loss: 1.0249, test_f1: 0.5728
 epoch: 60, train_loss: 0.7523, test_loss: 1.1059, test_f1: 0.5686
 epoch: 61, train_loss: 0.7598, test_loss: 1.0644, test_f1: 0.5744
 epoch: 62, train_loss: 0.7576, test_loss: 1.0691, test_f1: 0.5845
 epoch: 63, train_loss: 0.7221, test_loss: 1.1815, test_f1: 0.5688
 epoch: 64, train_loss: 0.7587, test_loss: 1.1578, test_f1: 0.5887
 epoch: 65, train_loss: 0.7296, test_loss: 1.0208, test_f1: 0.5426
 epoch: 66, train_loss: 0.7482, test_loss: 1.0928, test_f1: 0.5974
 epoch: 67, train_loss: 0.7570, test_loss: 1.1411, test_f1: 0.5220
 epoch: 68, train_loss: 0.7371, test_loss: 1.0780, test_f1: 0.5715
 epoch: 69, train_loss: 0.7229, test_loss: 1.0490, test_f1: 0.5756
 epoch: 70, train_loss: 0.7364, test_loss: 1.0773, test_f1: 0.5808
 epoch: 71, train_loss: 0.7329, test_loss: 1.0112, test_f1: 0.5773
 epoch: 72, train_loss: 0.7209, test_loss: 1.0619, test_f1: 0.5900
 epoch: 73, train_loss: 0.7222, test_loss: 1.1097, test_f1: 0.5612
 epoch: 74, train_loss: 0.7219, test_loss: 1.0410, test_f1: 0.5933
 epoch: 75, train_loss: 0.7420, test_loss: 1.1312, test_f1: 0.5710
 epoch: 76, train_loss: 0.7309, test_loss: 1.0879, test_f1: 0.5788
 epoch: 77, train_loss: 0.7291, test_loss: 1.0466, test_f1: 0.6062
 epoch: 78, train_loss: 0.7181, test_loss: 1.1106, test_f1: 0.5894
 epoch: 79, train_loss: 0.7042, test_loss: 1.1183, test_f1: 0.5576
 epoch: 80, train_loss: 0.7078, test_loss: 1.0833, test_f1: 0.6031
 epoch: 81, train_loss: 0.7128, test_loss: 1.0648, test_f1: 0.6154
 epoch: 82, train_loss: 0.7103, test_loss: 1.0585, test_f1: 0.5925
 epoch: 83, train_loss: 0.7005, test_loss: 1.0984, test_f1: 0.5819
 epoch: 84, train_loss: 0.7116, test_loss: 1.1335, test_f1: 0.5848
 epoch: 85, train_loss: 0.6815, test_loss: 1.1403, test_f1: 0.5731
 epoch: 86, train_loss: 0.6974, test_loss: 1.1592, test_f1: 0.5900
 epoch: 87, train_loss: 0.6996, test_loss: 1.2230, test_f1: 0.5616
 epoch: 88, train_loss: 0.6932, test_loss: 1.1645, test_f1: 0.5784
 epoch: 89, train_loss: 0.6832, test_loss: 1.1493, test_f1: 0.5408
 epoch: 90, train_loss: 0.6988, test_loss: 1.0864, test_f1: 0.5816
 epoch: 91, train_loss: 0.6688, test_loss: 1.2166, test_f1: 0.5900
 epoch: 92, train_loss: 0.6777, test_loss: 1.0945, test_f1: 0.5931
 epoch: 93, train_loss: 0.6756, test_loss: 1.2561, test_f1: 0.5556
 epoch: 94, train_loss: 0.7032, test_loss: 1.1757, test_f1: 0.5785
 epoch: 95, train_loss: 0.6882, test_loss: 1.0962, test_f1: 0.5559
 epoch: 96, train_loss: 0.6828, test_loss: 1.2563, test_f1: 0.5944
 epoch: 97, train_loss: 0.7060, test_loss: 1.2605, test_f1: 0.5549
 epoch: 98, train_loss: 0.6833, test_loss: 1.1605, test_f1: 0.5674
 epoch: 99, train_loss: 0.6831, test_loss: 1.2467, test_f1: 0.5634
##################ITERATION #4 ****************************************
 epoch: 0, train_loss: 1.3570, test_loss: 1.3512, test_f1: 0.2289
 epoch: 1, train_loss: 1.1629, test_loss: 1.1994, test_f1: 0.3699
 epoch: 2, train_loss: 1.1277, test_loss: 1.1670, test_f1: 0.3673
 epoch: 3, train_loss: 1.0852, test_loss: 1.1570, test_f1: 0.4000
 epoch: 4, train_loss: 1.0692, test_loss: 1.1506, test_f1: 0.3993
 epoch: 5, train_loss: 1.0233, test_loss: 1.0876, test_f1: 0.4997
 epoch: 6, train_loss: 0.9932, test_loss: 1.0777, test_f1: 0.4829
 epoch: 7, train_loss: 0.9858, test_loss: 1.1051, test_f1: 0.4842
 epoch: 8, train_loss: 0.9777, test_loss: 1.0915, test_f1: 0.4843
 epoch: 9, train_loss: 0.9534, test_loss: 1.1247, test_f1: 0.4341
 epoch: 10, train_loss: 0.9567, test_loss: 1.0697, test_f1: 0.5222
 epoch: 11, train_loss: 0.9577, test_loss: 1.0434, test_f1: 0.5339
 epoch: 12, train_loss: 0.9355, test_loss: 1.0608, test_f1: 0.5225
 epoch: 13, train_loss: 0.9698, test_loss: 1.0933, test_f1: 0.4962
 epoch: 14, train_loss: 0.9900, test_loss: 1.1283, test_f1: 0.4374
 epoch: 15, train_loss: 0.9927, test_loss: 1.2029, test_f1: 0.4409
 epoch: 16, train_loss: 0.9651, test_loss: 1.1030, test_f1: 0.4956
 epoch: 17, train_loss: 0.9683, test_loss: 1.0763, test_f1: 0.5092
 epoch: 18, train_loss: 0.9391, test_loss: 1.2311, test_f1: 0.4585
 epoch: 19, train_loss: 0.9455, test_loss: 1.0839, test_f1: 0.4998
 epoch: 20, train_loss: 0.9419, test_loss: 1.0755, test_f1: 0.5399
 epoch: 21, train_loss: 0.9268, test_loss: 1.0784, test_f1: 0.5037
 epoch: 22, train_loss: 0.9306, test_loss: 1.0610, test_f1: 0.5352
 epoch: 23, train_loss: 0.9245, test_loss: 1.1880, test_f1: 0.4680
 epoch: 24, train_loss: 0.9357, test_loss: 1.0840, test_f1: 0.5123
 epoch: 25, train_loss: 0.9149, test_loss: 1.0759, test_f1: 0.5362
 epoch: 26, train_loss: 0.8902, test_loss: 1.0856, test_f1: 0.5439
 epoch: 27, train_loss: 0.9025, test_loss: 1.0632, test_f1: 0.5443
 epoch: 28, train_loss: 0.9047, test_loss: 1.0326, test_f1: 0.5541
 epoch: 29, train_loss: 0.8744, test_loss: 1.0353, test_f1: 0.5514
 epoch: 30, train_loss: 0.8784, test_loss: 1.0815, test_f1: 0.5215
 epoch: 31, train_loss: 0.8885, test_loss: 1.1134, test_f1: 0.4738
 epoch: 32, train_loss: 0.8888, test_loss: 1.0492, test_f1: 0.5457
 epoch: 33, train_loss: 0.8690, test_loss: 1.0836, test_f1: 0.5535
 epoch: 34, train_loss: 0.8753, test_loss: 1.0446, test_f1: 0.5406
 epoch: 35, train_loss: 0.8627, test_loss: 1.0631, test_f1: 0.5434
 epoch: 36, train_loss: 0.8542, test_loss: 1.0628, test_f1: 0.5509
 epoch: 37, train_loss: 0.8421, test_loss: 1.0012, test_f1: 0.5713
 epoch: 38, train_loss: 0.8450, test_loss: 1.0541, test_f1: 0.5890
 epoch: 39, train_loss: 0.8351, test_loss: 1.0228, test_f1: 0.5739
 epoch: 40, train_loss: 0.8624, test_loss: 1.0015, test_f1: 0.5703
 epoch: 41, train_loss: 0.8509, test_loss: 1.0936, test_f1: 0.5403
 epoch: 42, train_loss: 0.8401, test_loss: 1.0052, test_f1: 0.5649
 epoch: 43, train_loss: 0.8254, test_loss: 1.0837, test_f1: 0.5552
 epoch: 44, train_loss: 0.8515, test_loss: 0.9933, test_f1: 0.5775
 epoch: 45, train_loss: 0.8222, test_loss: 1.0913, test_f1: 0.5572
 epoch: 46, train_loss: 0.8471, test_loss: 1.1170, test_f1: 0.5644
 epoch: 47, train_loss: 0.8444, test_loss: 1.0685, test_f1: 0.5654
 epoch: 48, train_loss: 0.8286, test_loss: 1.0346, test_f1: 0.5972
 epoch: 49, train_loss: 0.8167, test_loss: 1.0586, test_f1: 0.5666
 epoch: 50, train_loss: 0.8359, test_loss: 1.0232, test_f1: 0.5886
 epoch: 51, train_loss: 0.7939, test_loss: 0.9927, test_f1: 0.6092
 epoch: 52, train_loss: 0.7826, test_loss: 1.1074, test_f1: 0.5394
 epoch: 53, train_loss: 0.7517, test_loss: 1.0291, test_f1: 0.5677
 epoch: 54, train_loss: 0.7743, test_loss: 1.0555, test_f1: 0.5822
 epoch: 55, train_loss: 0.7505, test_loss: 1.0053, test_f1: 0.5900
 epoch: 56, train_loss: 0.7347, test_loss: 1.0467, test_f1: 0.6151
 epoch: 57, train_loss: 0.7363, test_loss: 1.1592, test_f1: 0.5772
 epoch: 58, train_loss: 0.7582, test_loss: 1.0700, test_f1: 0.5900
 epoch: 59, train_loss: 0.7474, test_loss: 1.0992, test_f1: 0.5764
 epoch: 60, train_loss: 0.7282, test_loss: 1.1486, test_f1: 0.5760
 epoch: 61, train_loss: 0.7305, test_loss: 1.1293, test_f1: 0.6044
 epoch: 62, train_loss: 0.7346, test_loss: 1.1364, test_f1: 0.5846
 epoch: 63, train_loss: 0.7138, test_loss: 1.1626, test_f1: 0.5763
 epoch: 64, train_loss: 0.7203, test_loss: 1.1505, test_f1: 0.5838
 epoch: 65, train_loss: 0.7192, test_loss: 1.0984, test_f1: 0.5677
 epoch: 66, train_loss: 0.7275, test_loss: 1.1562, test_f1: 0.5659
 epoch: 67, train_loss: 0.7113, test_loss: 1.1536, test_f1: 0.5723
 epoch: 68, train_loss: 0.7200, test_loss: 1.1290, test_f1: 0.6179
 epoch: 69, train_loss: 0.7040, test_loss: 1.0575, test_f1: 0.5873
 epoch: 70, train_loss: 0.7130, test_loss: 1.1483, test_f1: 0.5971
 epoch: 71, train_loss: 0.7041, test_loss: 1.0547, test_f1: 0.5930
 epoch: 72, train_loss: 0.7013, test_loss: 1.3092, test_f1: 0.5609
 epoch: 73, train_loss: 0.7318, test_loss: 1.1063, test_f1: 0.5844
 epoch: 74, train_loss: 0.6966, test_loss: 1.1163, test_f1: 0.5736
 epoch: 75, train_loss: 0.6830, test_loss: 1.1167, test_f1: 0.5540
 epoch: 76, train_loss: 0.6854, test_loss: 1.1267, test_f1: 0.5992
 epoch: 77, train_loss: 0.6898, test_loss: 1.3213, test_f1: 0.5858
 epoch: 78, train_loss: 0.6816, test_loss: 1.0985, test_f1: 0.6174
 epoch: 79, train_loss: 0.6805, test_loss: 1.1437, test_f1: 0.6036
 epoch: 80, train_loss: 0.7095, test_loss: 1.1520, test_f1: 0.5781
 epoch: 81, train_loss: 0.7095, test_loss: 1.3238, test_f1: 0.5463
 epoch: 82, train_loss: 0.7129, test_loss: 1.1087, test_f1: 0.5911
 epoch: 83, train_loss: 0.7116, test_loss: 1.1458, test_f1: 0.6041
 epoch: 84, train_loss: 0.7060, test_loss: 1.1397, test_f1: 0.5803
 epoch: 85, train_loss: 0.6786, test_loss: 1.1541, test_f1: 0.6140
 epoch: 86, train_loss: 0.6828, test_loss: 1.1083, test_f1: 0.5568
 epoch: 87, train_loss: 0.6737, test_loss: 1.1785, test_f1: 0.6098
 epoch: 88, train_loss: 0.6769, test_loss: 1.1760, test_f1: 0.6104
 epoch: 89, train_loss: 0.6861, test_loss: 1.2652, test_f1: 0.5326
 epoch: 90, train_loss: 0.6807, test_loss: 1.1303, test_f1: 0.5996
 epoch: 91, train_loss: 0.6861, test_loss: 1.1874, test_f1: 0.5512
 epoch: 92, train_loss: 0.6930, test_loss: 1.2145, test_f1: 0.5229
 epoch: 93, train_loss: 0.6675, test_loss: 1.1648, test_f1: 0.5767
 epoch: 94, train_loss: 0.6672, test_loss: 1.1335, test_f1: 0.5851
 epoch: 95, train_loss: 0.6618, test_loss: 1.1864, test_f1: 0.5528
 epoch: 96, train_loss: 0.6539, test_loss: 1.1954, test_f1: 0.5798
 epoch: 97, train_loss: 0.6540, test_loss: 1.2964, test_f1: 0.5854
 epoch: 98, train_loss: 0.6584, test_loss: 1.2044, test_f1: 0.5768
 epoch: 99, train_loss: 0.6640, test_loss: 1.2429, test_f1: 0.5778
##################ITERATION #5 ****************************************
 epoch: 0, train_loss: 1.2170, test_loss: 1.2766, test_f1: 0.2587
 epoch: 1, train_loss: 1.1016, test_loss: 1.1154, test_f1: 0.3722
 epoch: 2, train_loss: 1.0474, test_loss: 1.0948, test_f1: 0.4343
 epoch: 3, train_loss: 1.0067, test_loss: 1.0900, test_f1: 0.4624
 epoch: 4, train_loss: 0.9961, test_loss: 1.2016, test_f1: 0.3773
 epoch: 5, train_loss: 0.9739, test_loss: 1.2619, test_f1: 0.5253
 epoch: 6, train_loss: 0.9785, test_loss: 1.0862, test_f1: 0.5020
 epoch: 7, train_loss: 0.9717, test_loss: 1.2046, test_f1: 0.4465
 epoch: 8, train_loss: 0.9477, test_loss: 1.0513, test_f1: 0.5197
 epoch: 9, train_loss: 0.9468, test_loss: 1.0927, test_f1: 0.5307
 epoch: 10, train_loss: 0.9313, test_loss: 1.1185, test_f1: 0.4925
 epoch: 11, train_loss: 0.9318, test_loss: 1.0557, test_f1: 0.5577
 epoch: 12, train_loss: 0.9522, test_loss: 1.0273, test_f1: 0.5401
 epoch: 13, train_loss: 0.9409, test_loss: 1.0734, test_f1: 0.5203
 epoch: 14, train_loss: 0.9408, test_loss: 1.0299, test_f1: 0.5060
 epoch: 15, train_loss: 0.9324, test_loss: 0.9880, test_f1: 0.5414
 epoch: 16, train_loss: 0.9099, test_loss: 1.0067, test_f1: 0.5625
 epoch: 17, train_loss: 0.9153, test_loss: 0.9823, test_f1: 0.5718
 epoch: 18, train_loss: 0.9119, test_loss: 0.9901, test_f1: 0.5807
 epoch: 19, train_loss: 0.9140, test_loss: 1.0929, test_f1: 0.5184
 epoch: 20, train_loss: 0.9010, test_loss: 1.1321, test_f1: 0.5025
 epoch: 21, train_loss: 0.8941, test_loss: 1.1203, test_f1: 0.5554
 epoch: 22, train_loss: 0.8862, test_loss: 1.2195, test_f1: 0.4803
 epoch: 23, train_loss: 0.8876, test_loss: 1.0124, test_f1: 0.5304
 epoch: 24, train_loss: 0.8803, test_loss: 1.2357, test_f1: 0.5033
 epoch: 25, train_loss: 0.8849, test_loss: 1.0509, test_f1: 0.5470
 epoch: 26, train_loss: 0.8780, test_loss: 1.1277, test_f1: 0.5238
 epoch: 27, train_loss: 0.8663, test_loss: 0.9942, test_f1: 0.5817
 epoch: 28, train_loss: 0.8392, test_loss: 0.9711, test_f1: 0.5637
 epoch: 29, train_loss: 0.8592, test_loss: 1.0921, test_f1: 0.5742
 epoch: 30, train_loss: 0.8695, test_loss: 1.1246, test_f1: 0.5392
 epoch: 31, train_loss: 0.8287, test_loss: 1.2626, test_f1: 0.5118
 epoch: 32, train_loss: 0.8414, test_loss: 1.2302, test_f1: 0.5419
 epoch: 33, train_loss: 0.8227, test_loss: 0.9295, test_f1: 0.5909
 epoch: 34, train_loss: 0.8158, test_loss: 1.2288, test_f1: 0.5235
 epoch: 35, train_loss: 0.8251, test_loss: 1.1269, test_f1: 0.5395
 epoch: 36, train_loss: 0.8459, test_loss: 1.0144, test_f1: 0.5750
 epoch: 37, train_loss: 0.8195, test_loss: 0.9917, test_f1: 0.5507
 epoch: 38, train_loss: 0.8187, test_loss: 1.1742, test_f1: 0.5290
 epoch: 39, train_loss: 0.8034, test_loss: 1.0407, test_f1: 0.5479
 epoch: 40, train_loss: 0.7861, test_loss: 1.0025, test_f1: 0.5638
 epoch: 41, train_loss: 0.7951, test_loss: 1.1505, test_f1: 0.5290
 epoch: 42, train_loss: 0.8501, test_loss: 1.0244, test_f1: 0.5085
 epoch: 43, train_loss: 0.7888, test_loss: 1.1319, test_f1: 0.5399
 epoch: 44, train_loss: 0.8114, test_loss: 1.1462, test_f1: 0.4745
 epoch: 45, train_loss: 0.7740, test_loss: 1.5001, test_f1: 0.5557
 epoch: 46, train_loss: 0.7937, test_loss: 0.9781, test_f1: 0.5624
 epoch: 47, train_loss: 0.8173, test_loss: 1.1178, test_f1: 0.5743
 epoch: 48, train_loss: 0.7906, test_loss: 1.0396, test_f1: 0.5826
 epoch: 49, train_loss: 0.7922, test_loss: 0.9668, test_f1: 0.5908
 epoch: 50, train_loss: 0.7685, test_loss: 1.1281, test_f1: 0.5595
 epoch: 51, train_loss: 0.7565, test_loss: 1.0721, test_f1: 0.5854
 epoch: 52, train_loss: 0.7520, test_loss: 1.1885, test_f1: 0.5773
 epoch: 53, train_loss: 0.7319, test_loss: 1.1410, test_f1: 0.5464
 epoch: 54, train_loss: 0.7234, test_loss: 1.2015, test_f1: 0.5617
 epoch: 55, train_loss: 0.7308, test_loss: 1.2835, test_f1: 0.5804
 epoch: 56, train_loss: 0.7096, test_loss: 1.2957, test_f1: 0.5668
 epoch: 57, train_loss: 0.7100, test_loss: 1.4989, test_f1: 0.5579
 epoch: 58, train_loss: 0.7209, test_loss: 1.1454, test_f1: 0.5472
 epoch: 59, train_loss: 0.7171, test_loss: 1.1662, test_f1: 0.5621
 epoch: 60, train_loss: 0.7079, test_loss: 1.1533, test_f1: 0.5384
 epoch: 61, train_loss: 0.6962, test_loss: 1.2137, test_f1: 0.5667
 epoch: 62, train_loss: 0.7044, test_loss: 1.1359, test_f1: 0.5590
 epoch: 63, train_loss: 0.7185, test_loss: 1.4328, test_f1: 0.5775
 epoch: 64, train_loss: 0.6995, test_loss: 1.1075, test_f1: 0.5498
 epoch: 65, train_loss: 0.6993, test_loss: 1.2116, test_f1: 0.5563
 epoch: 66, train_loss: 0.7138, test_loss: 1.5153, test_f1: 0.5608
 epoch: 67, train_loss: 0.7135, test_loss: 1.3256, test_f1: 0.5650
 epoch: 68, train_loss: 0.7054, test_loss: 1.1788, test_f1: 0.5444
 epoch: 69, train_loss: 0.7221, test_loss: 1.2430, test_f1: 0.5384
 epoch: 70, train_loss: 0.6945, test_loss: 1.3940, test_f1: 0.5632
 epoch: 71, train_loss: 0.7270, test_loss: 1.1843, test_f1: 0.5596
 epoch: 72, train_loss: 0.7018, test_loss: 1.6831, test_f1: 0.5297
 epoch: 73, train_loss: 0.6978, test_loss: 1.0557, test_f1: 0.5666
 epoch: 74, train_loss: 0.6823, test_loss: 1.6717, test_f1: 0.5536
 epoch: 75, train_loss: 0.7027, test_loss: 1.0955, test_f1: 0.5989
 epoch: 76, train_loss: 0.6962, test_loss: 1.0959, test_f1: 0.5660
 epoch: 77, train_loss: 0.6807, test_loss: 1.3052, test_f1: 0.5634
 epoch: 78, train_loss: 0.6765, test_loss: 1.4166, test_f1: 0.5700
 epoch: 79, train_loss: 0.6687, test_loss: 1.4650, test_f1: 0.5728
 epoch: 80, train_loss: 0.6789, test_loss: 1.0402, test_f1: 0.5860
 epoch: 81, train_loss: 0.6953, test_loss: 1.5163, test_f1: 0.5536
 epoch: 82, train_loss: 0.6773, test_loss: 1.3994, test_f1: 0.5635
 epoch: 83, train_loss: 0.6768, test_loss: 1.3387, test_f1: 0.5665
 epoch: 84, train_loss: 0.6775, test_loss: 1.2707, test_f1: 0.5833
 epoch: 85, train_loss: 0.6639, test_loss: 1.4309, test_f1: 0.5677
 epoch: 86, train_loss: 0.6749, test_loss: 1.4166, test_f1: 0.5678
 epoch: 87, train_loss: 0.6512, test_loss: 1.3943, test_f1: 0.5646
 epoch: 88, train_loss: 0.7024, test_loss: 1.1395, test_f1: 0.5705
 epoch: 89, train_loss: 0.6926, test_loss: 1.3139, test_f1: 0.5742
 epoch: 90, train_loss: 0.6799, test_loss: 1.2308, test_f1: 0.5587
 epoch: 91, train_loss: 0.6636, test_loss: 1.2944, test_f1: 0.5922
 epoch: 92, train_loss: 0.6819, test_loss: 1.0915, test_f1: 0.5659
 epoch: 93, train_loss: 0.6533, test_loss: 1.4299, test_f1: 0.5795
 epoch: 94, train_loss: 0.6451, test_loss: 1.4655, test_f1: 0.5734
 epoch: 95, train_loss: 0.6562, test_loss: 1.2625, test_f1: 0.5796
 epoch: 96, train_loss: 0.6505, test_loss: 1.2660, test_f1: 0.5791
 epoch: 97, train_loss: 0.6521, test_loss: 1.2315, test_f1: 0.6220
 epoch: 98, train_loss: 0.6466, test_loss: 1.2841, test_f1: 0.5777
 epoch: 99, train_loss: 0.6719, test_loss: 1.1454, test_f1: 0.5638
##################ITERATION #6 ****************************************
 epoch: 0, train_loss: 1.2129, test_loss: 1.2219, test_f1: 0.2764
 epoch: 1, train_loss: 1.0865, test_loss: 1.1328, test_f1: 0.4162
 epoch: 2, train_loss: 1.0275, test_loss: 1.0779, test_f1: 0.4663
 epoch: 3, train_loss: 1.0135, test_loss: 1.0627, test_f1: 0.5193
 epoch: 4, train_loss: 0.9822, test_loss: 1.0702, test_f1: 0.4995
 epoch: 5, train_loss: 0.9578, test_loss: 1.0707, test_f1: 0.5248
 epoch: 6, train_loss: 0.9552, test_loss: 1.0694, test_f1: 0.4610
 epoch: 7, train_loss: 0.9527, test_loss: 1.0690, test_f1: 0.4852
 epoch: 8, train_loss: 0.9400, test_loss: 1.1565, test_f1: 0.4278
 epoch: 9, train_loss: 0.9439, test_loss: 1.0989, test_f1: 0.5074
 epoch: 10, train_loss: 0.9333, test_loss: 1.0489, test_f1: 0.5471
 epoch: 11, train_loss: 0.9136, test_loss: 1.0046, test_f1: 0.5784
 epoch: 12, train_loss: 0.9056, test_loss: 1.0549, test_f1: 0.5649
 epoch: 13, train_loss: 0.8919, test_loss: 1.0078, test_f1: 0.5385
 epoch: 14, train_loss: 0.8981, test_loss: 1.0344, test_f1: 0.5621
 epoch: 15, train_loss: 0.8881, test_loss: 1.0578, test_f1: 0.5698
 epoch: 16, train_loss: 0.8893, test_loss: 1.2539, test_f1: 0.4894
 epoch: 17, train_loss: 0.9054, test_loss: 1.0158, test_f1: 0.5691
 epoch: 18, train_loss: 0.8914, test_loss: 1.1605, test_f1: 0.4811
 epoch: 19, train_loss: 0.8979, test_loss: 1.1766, test_f1: 0.5487
 epoch: 20, train_loss: 0.8842, test_loss: 1.0767, test_f1: 0.5558
 epoch: 21, train_loss: 0.8678, test_loss: 1.0600, test_f1: 0.5351
 epoch: 22, train_loss: 0.8592, test_loss: 1.0401, test_f1: 0.5206
 epoch: 23, train_loss: 0.8687, test_loss: 1.0728, test_f1: 0.5511
 epoch: 24, train_loss: 0.8696, test_loss: 2.1740, test_f1: 0.2904
 epoch: 25, train_loss: 0.8691, test_loss: 0.9936, test_f1: 0.5503
 epoch: 26, train_loss: 0.8553, test_loss: 0.9969, test_f1: 0.5699
 epoch: 27, train_loss: 0.8401, test_loss: 1.0583, test_f1: 0.5395
 epoch: 28, train_loss: 0.8388, test_loss: 1.0103, test_f1: 0.5678
 epoch: 29, train_loss: 0.8644, test_loss: 1.0776, test_f1: 0.4457
 epoch: 30, train_loss: 0.8364, test_loss: 1.2814, test_f1: 0.5513
 epoch: 31, train_loss: 0.8203, test_loss: 0.9360, test_f1: 0.6274
 epoch: 32, train_loss: 0.7899, test_loss: 1.3055, test_f1: 0.5266
 epoch: 33, train_loss: 0.8158, test_loss: 1.1011, test_f1: 0.5041
 epoch: 34, train_loss: 0.8222, test_loss: 1.2135, test_f1: 0.4898
 epoch: 35, train_loss: 0.8109, test_loss: 0.9524, test_f1: 0.6017
 epoch: 36, train_loss: 0.8056, test_loss: 1.0420, test_f1: 0.5927
 epoch: 37, train_loss: 0.8088, test_loss: 1.0701, test_f1: 0.4757
 epoch: 38, train_loss: 0.8184, test_loss: 1.0023, test_f1: 0.5890
 epoch: 39, train_loss: 0.7827, test_loss: 1.0769, test_f1: 0.5227
 epoch: 40, train_loss: 0.7955, test_loss: 0.9670, test_f1: 0.5991
 epoch: 41, train_loss: 0.8138, test_loss: 1.0134, test_f1: 0.5779
 epoch: 42, train_loss: 0.7781, test_loss: 1.2039, test_f1: 0.5029
 epoch: 43, train_loss: 0.7688, test_loss: 0.9944, test_f1: 0.5762
 epoch: 44, train_loss: 0.7376, test_loss: 1.0437, test_f1: 0.5934
 epoch: 45, train_loss: 0.7496, test_loss: 0.9792, test_f1: 0.5950
 epoch: 46, train_loss: 0.7619, test_loss: 1.0732, test_f1: 0.5680
 epoch: 47, train_loss: 0.7418, test_loss: 0.9793, test_f1: 0.6110
 epoch: 48, train_loss: 0.7425, test_loss: 1.0869, test_f1: 0.5942
 epoch: 49, train_loss: 0.7293, test_loss: 1.1065, test_f1: 0.5433
 epoch: 50, train_loss: 0.7182, test_loss: 0.9606, test_f1: 0.5811
 epoch: 51, train_loss: 0.7075, test_loss: 0.9471, test_f1: 0.6058
 epoch: 52, train_loss: 0.6773, test_loss: 1.0616, test_f1: 0.6213
 epoch: 53, train_loss: 0.6889, test_loss: 1.0215, test_f1: 0.6029
 epoch: 54, train_loss: 0.6880, test_loss: 1.0552, test_f1: 0.5490
 epoch: 55, train_loss: 0.7099, test_loss: 1.0104, test_f1: 0.6174
 epoch: 56, train_loss: 0.6807, test_loss: 1.0980, test_f1: 0.6246
 epoch: 57, train_loss: 0.6608, test_loss: 0.9967, test_f1: 0.5918
 epoch: 58, train_loss: 0.6796, test_loss: 0.9742, test_f1: 0.6373
 epoch: 59, train_loss: 0.6911, test_loss: 0.9143, test_f1: 0.6258
 epoch: 60, train_loss: 0.6776, test_loss: 1.0527, test_f1: 0.6031
 epoch: 61, train_loss: 0.6721, test_loss: 1.1236, test_f1: 0.5896
 epoch: 62, train_loss: 0.6681, test_loss: 1.0050, test_f1: 0.6088
 epoch: 63, train_loss: 0.6771, test_loss: 1.0436, test_f1: 0.6053
 epoch: 64, train_loss: 0.6544, test_loss: 1.1545, test_f1: 0.4712
 epoch: 65, train_loss: 0.6529, test_loss: 0.9829, test_f1: 0.5968
 epoch: 66, train_loss: 0.6634, test_loss: 1.0694, test_f1: 0.5928
 epoch: 67, train_loss: 0.6523, test_loss: 1.0674, test_f1: 0.6128
 epoch: 68, train_loss: 0.6600, test_loss: 1.0284, test_f1: 0.5883
 epoch: 69, train_loss: 0.6762, test_loss: 1.1996, test_f1: 0.5967
 epoch: 70, train_loss: 0.6159, test_loss: 0.9952, test_f1: 0.6123
 epoch: 71, train_loss: 0.6421, test_loss: 1.0024, test_f1: 0.6268
 epoch: 72, train_loss: 0.6417, test_loss: 1.0728, test_f1: 0.5717
 epoch: 73, train_loss: 0.6511, test_loss: 1.1821, test_f1: 0.5140
 epoch: 74, train_loss: 0.6599, test_loss: 1.0240, test_f1: 0.6198
 epoch: 75, train_loss: 0.6342, test_loss: 1.0574, test_f1: 0.6361
 epoch: 76, train_loss: 0.6515, test_loss: 1.1848, test_f1: 0.5053
 epoch: 77, train_loss: 0.6423, test_loss: 1.1231, test_f1: 0.5679
 epoch: 78, train_loss: 0.6534, test_loss: 1.1002, test_f1: 0.5720
 epoch: 79, train_loss: 0.6375, test_loss: 1.1783, test_f1: 0.5781
 epoch: 80, train_loss: 0.6627, test_loss: 1.1046, test_f1: 0.6036
 epoch: 81, train_loss: 0.6412, test_loss: 1.0898, test_f1: 0.6186
 epoch: 82, train_loss: 0.5993, test_loss: 1.1633, test_f1: 0.5888
 epoch: 83, train_loss: 0.6251, test_loss: 0.9911, test_f1: 0.6225
 epoch: 84, train_loss: 0.6219, test_loss: 1.1434, test_f1: 0.5913
 epoch: 85, train_loss: 0.5888, test_loss: 1.1147, test_f1: 0.5276
 epoch: 86, train_loss: 0.6037, test_loss: 1.0951, test_f1: 0.5950
 epoch: 87, train_loss: 0.6066, test_loss: 1.0660, test_f1: 0.6155
 epoch: 88, train_loss: 0.6220, test_loss: 1.0686, test_f1: 0.5868
 epoch: 89, train_loss: 0.6096, test_loss: 1.2817, test_f1: 0.5061
 epoch: 90, train_loss: 0.6243, test_loss: 1.0578, test_f1: 0.6249
 epoch: 91, train_loss: 0.5969, test_loss: 1.1603, test_f1: 0.5921
 epoch: 92, train_loss: 0.6119, test_loss: 1.0549, test_f1: 0.6112
 epoch: 93, train_loss: 0.6004, test_loss: 1.1329, test_f1: 0.6172
 epoch: 94, train_loss: 0.6174, test_loss: 1.1159, test_f1: 0.5932
 epoch: 95, train_loss: 0.5952, test_loss: 1.2107, test_f1: 0.5733
 epoch: 96, train_loss: 0.5713, test_loss: 1.2646, test_f1: 0.5839
 epoch: 97, train_loss: 0.5978, test_loss: 1.1650, test_f1: 0.5834
 epoch: 98, train_loss: 0.5992, test_loss: 1.2524, test_f1: 0.5606
 epoch: 99, train_loss: 0.5807, test_loss: 1.0988, test_f1: 0.6175
##################ITERATION #7 ****************************************
 epoch: 0, train_loss: 1.3015, test_loss: 1.2142, test_f1: 0.2281
 epoch: 1, train_loss: 1.1041, test_loss: 1.1560, test_f1: 0.3716
 epoch: 2, train_loss: 1.0355, test_loss: 1.0226, test_f1: 0.4452
 epoch: 3, train_loss: 1.0059, test_loss: 1.2159, test_f1: 0.3831
 epoch: 4, train_loss: 0.9753, test_loss: 1.0733, test_f1: 0.4539
 epoch: 5, train_loss: 0.9874, test_loss: 1.0968, test_f1: 0.4406
 epoch: 6, train_loss: 0.9565, test_loss: 1.0737, test_f1: 0.4931
 epoch: 7, train_loss: 0.9649, test_loss: 1.0461, test_f1: 0.4278
 epoch: 8, train_loss: 0.9387, test_loss: 1.0261, test_f1: 0.4277
 epoch: 9, train_loss: 0.9253, test_loss: 1.0532, test_f1: 0.4396
 epoch: 10, train_loss: 0.9269, test_loss: 1.0154, test_f1: 0.4857
 epoch: 11, train_loss: 0.9063, test_loss: 1.0477, test_f1: 0.4896
 epoch: 12, train_loss: 0.8808, test_loss: 1.0125, test_f1: 0.4889
 epoch: 13, train_loss: 0.8759, test_loss: 1.1234, test_f1: 0.5392
 epoch: 14, train_loss: 0.9099, test_loss: 1.0290, test_f1: 0.4997
 epoch: 15, train_loss: 0.8648, test_loss: 1.1084, test_f1: 0.4776
 epoch: 16, train_loss: 0.8659, test_loss: 1.0178, test_f1: 0.4895
 epoch: 17, train_loss: 0.8534, test_loss: 1.2769, test_f1: 0.5025
 epoch: 18, train_loss: 0.8337, test_loss: 1.0303, test_f1: 0.5158
 epoch: 19, train_loss: 0.8207, test_loss: 1.0176, test_f1: 0.5479
 epoch: 20, train_loss: 0.8445, test_loss: 1.0351, test_f1: 0.5199
 epoch: 21, train_loss: 0.8325, test_loss: 1.0922, test_f1: 0.5473
 epoch: 22, train_loss: 0.8488, test_loss: 1.0112, test_f1: 0.4875
 epoch: 23, train_loss: 0.8670, test_loss: 1.0180, test_f1: 0.5591
 epoch: 24, train_loss: 0.8444, test_loss: 1.5239, test_f1: 0.3533
 epoch: 25, train_loss: 0.8252, test_loss: 0.9791, test_f1: 0.5845
 epoch: 26, train_loss: 0.8170, test_loss: 0.9971, test_f1: 0.5481
 epoch: 27, train_loss: 0.8283, test_loss: 1.0095, test_f1: 0.5283
 epoch: 28, train_loss: 0.8094, test_loss: 0.9724, test_f1: 0.5769
 epoch: 29, train_loss: 0.7812, test_loss: 1.1053, test_f1: 0.5244
 epoch: 30, train_loss: 0.7874, test_loss: 1.0463, test_f1: 0.5697
 epoch: 31, train_loss: 0.7915, test_loss: 1.0748, test_f1: 0.5168
 epoch: 32, train_loss: 0.7908, test_loss: 1.1291, test_f1: 0.5027
 epoch: 33, train_loss: 0.7917, test_loss: 1.1273, test_f1: 0.4483
 epoch: 34, train_loss: 0.8089, test_loss: 0.9700, test_f1: 0.5906
 epoch: 35, train_loss: 0.7760, test_loss: 0.9727, test_f1: 0.5992
 epoch: 36, train_loss: 0.7510, test_loss: 1.0380, test_f1: 0.5584
 epoch: 37, train_loss: 0.7977, test_loss: 1.1140, test_f1: 0.5347
 epoch: 38, train_loss: 0.7951, test_loss: 1.1547, test_f1: 0.4991
 epoch: 39, train_loss: 0.7836, test_loss: 1.0314, test_f1: 0.6150
 epoch: 40, train_loss: 0.7752, test_loss: 0.9849, test_f1: 0.5671
 epoch: 41, train_loss: 0.7896, test_loss: 1.0481, test_f1: 0.5358
 epoch: 42, train_loss: 0.7627, test_loss: 0.9991, test_f1: 0.5769
 epoch: 43, train_loss: 0.7560, test_loss: 1.0839, test_f1: 0.5135
 epoch: 44, train_loss: 0.7712, test_loss: 1.0747, test_f1: 0.5534
 epoch: 45, train_loss: 0.7730, test_loss: 1.0575, test_f1: 0.5557
 epoch: 46, train_loss: 0.7507, test_loss: 1.0330, test_f1: 0.5850
 epoch: 47, train_loss: 0.7907, test_loss: 1.0176, test_f1: 0.5776
 epoch: 48, train_loss: 0.7603, test_loss: 1.0693, test_f1: 0.5680
 epoch: 49, train_loss: 0.7595, test_loss: 1.1034, test_f1: 0.5362
 epoch: 50, train_loss: 0.7355, test_loss: 1.0501, test_f1: 0.5833
 epoch: 51, train_loss: 0.7158, test_loss: 1.0050, test_f1: 0.6120
 epoch: 52, train_loss: 0.6970, test_loss: 1.0671, test_f1: 0.5759
 epoch: 53, train_loss: 0.7203, test_loss: 1.0617, test_f1: 0.5632
 epoch: 54, train_loss: 0.6990, test_loss: 1.0664, test_f1: 0.6203
 epoch: 55, train_loss: 0.7014, test_loss: 1.0851, test_f1: 0.5871
 epoch: 56, train_loss: 0.6825, test_loss: 1.0794, test_f1: 0.5712
 epoch: 57, train_loss: 0.6944, test_loss: 1.1235, test_f1: 0.5505
 epoch: 58, train_loss: 0.7021, test_loss: 1.0948, test_f1: 0.5856
 epoch: 59, train_loss: 0.6921, test_loss: 1.0685, test_f1: 0.5957
 epoch: 60, train_loss: 0.6763, test_loss: 1.1242, test_f1: 0.5622
 epoch: 61, train_loss: 0.6512, test_loss: 1.0758, test_f1: 0.6011
 epoch: 62, train_loss: 0.6766, test_loss: 1.1684, test_f1: 0.5470
 epoch: 63, train_loss: 0.6989, test_loss: 1.1623, test_f1: 0.5405
 epoch: 64, train_loss: 0.7070, test_loss: 1.0412, test_f1: 0.5853
 epoch: 65, train_loss: 0.6733, test_loss: 1.0347, test_f1: 0.5842
 epoch: 66, train_loss: 0.6729, test_loss: 1.1183, test_f1: 0.5786
 epoch: 67, train_loss: 0.6653, test_loss: 1.1310, test_f1: 0.5471
 epoch: 68, train_loss: 0.6847, test_loss: 1.0795, test_f1: 0.5812
 epoch: 69, train_loss: 0.6846, test_loss: 1.1414, test_f1: 0.5758
 epoch: 70, train_loss: 0.6492, test_loss: 1.0960, test_f1: 0.5726
 epoch: 71, train_loss: 0.6553, test_loss: 1.0663, test_f1: 0.6117
 epoch: 72, train_loss: 0.6751, test_loss: 1.1183, test_f1: 0.6107
 epoch: 73, train_loss: 0.6862, test_loss: 1.1024, test_f1: 0.5852
 epoch: 74, train_loss: 0.6716, test_loss: 1.1488, test_f1: 0.5735
 epoch: 75, train_loss: 0.6538, test_loss: 1.0885, test_f1: 0.5958
 epoch: 76, train_loss: 0.6499, test_loss: 1.1606, test_f1: 0.6040
 epoch: 77, train_loss: 0.6667, test_loss: 1.3620, test_f1: 0.5169
 epoch: 78, train_loss: 0.7094, test_loss: 1.2316, test_f1: 0.5663
 epoch: 79, train_loss: 0.6520, test_loss: 1.0704, test_f1: 0.6194
 epoch: 80, train_loss: 0.6615, test_loss: 1.1324, test_f1: 0.5711
 epoch: 81, train_loss: 0.6588, test_loss: 1.1586, test_f1: 0.5733
 epoch: 82, train_loss: 0.6545, test_loss: 1.0800, test_f1: 0.5675
 epoch: 83, train_loss: 0.6322, test_loss: 1.1287, test_f1: 0.5902
 epoch: 84, train_loss: 0.6450, test_loss: 1.1827, test_f1: 0.5481
 epoch: 85, train_loss: 0.6567, test_loss: 1.1324, test_f1: 0.6002
 epoch: 86, train_loss: 0.6519, test_loss: 1.0943, test_f1: 0.6139
 epoch: 87, train_loss: 0.6341, test_loss: 1.2189, test_f1: 0.5986
 epoch: 88, train_loss: 0.6609, test_loss: 1.0909, test_f1: 0.5717
 epoch: 89, train_loss: 0.6666, test_loss: 1.1107, test_f1: 0.5966
 epoch: 90, train_loss: 0.6334, test_loss: 1.0698, test_f1: 0.5929
 epoch: 91, train_loss: 0.6430, test_loss: 1.1653, test_f1: 0.5881
 epoch: 92, train_loss: 0.6549, test_loss: 1.1689, test_f1: 0.5376
 epoch: 93, train_loss: 0.6732, test_loss: 1.1313, test_f1: 0.5790
 epoch: 94, train_loss: 0.6336, test_loss: 1.1273, test_f1: 0.5828
 epoch: 95, train_loss: 0.6375, test_loss: 1.1242, test_f1: 0.5631
 epoch: 96, train_loss: 0.6241, test_loss: 1.2030, test_f1: 0.5674
 epoch: 97, train_loss: 0.6093, test_loss: 1.2253, test_f1: 0.5514
 epoch: 98, train_loss: 0.6332, test_loss: 1.1544, test_f1: 0.5910
 epoch: 99, train_loss: 0.6384, test_loss: 1.2200, test_f1: 0.5800
##################ITERATION #8 ****************************************
 epoch: 0, train_loss: 1.2962, test_loss: 1.3450, test_f1: 0.2775
 epoch: 1, train_loss: 1.0864, test_loss: 1.2483, test_f1: 0.3936
 epoch: 2, train_loss: 1.0269, test_loss: 1.1131, test_f1: 0.4753
 epoch: 3, train_loss: 1.0054, test_loss: 1.1489, test_f1: 0.4723
 epoch: 4, train_loss: 0.9996, test_loss: 1.1739, test_f1: 0.4638
 epoch: 5, train_loss: 0.9903, test_loss: 1.1020, test_f1: 0.4452
 epoch: 6, train_loss: 0.9608, test_loss: 1.0123, test_f1: 0.4993
 epoch: 7, train_loss: 0.9540, test_loss: 1.1007, test_f1: 0.4817
 epoch: 8, train_loss: 0.9498, test_loss: 1.0642, test_f1: 0.4920
 epoch: 9, train_loss: 0.9642, test_loss: 1.0429, test_f1: 0.4985
 epoch: 10, train_loss: 0.9607, test_loss: 1.0167, test_f1: 0.5062
 epoch: 11, train_loss: 0.9455, test_loss: 1.0340, test_f1: 0.5222
 epoch: 12, train_loss: 0.9388, test_loss: 1.1320, test_f1: 0.4748
 epoch: 13, train_loss: 0.9541, test_loss: 1.0873, test_f1: 0.4842
 epoch: 14, train_loss: 0.9379, test_loss: 1.1319, test_f1: 0.5279
 epoch: 15, train_loss: 0.9422, test_loss: 1.0466, test_f1: 0.5323
 epoch: 16, train_loss: 0.9648, test_loss: 1.1542, test_f1: 0.4934
 epoch: 17, train_loss: 0.9252, test_loss: 1.0114, test_f1: 0.5341
 epoch: 18, train_loss: 0.9284, test_loss: 1.0431, test_f1: 0.5295
 epoch: 19, train_loss: 0.9091, test_loss: 1.0623, test_f1: 0.5195
 epoch: 20, train_loss: 0.9119, test_loss: 1.2244, test_f1: 0.4803
 epoch: 21, train_loss: 0.9003, test_loss: 1.1236, test_f1: 0.4885
 epoch: 22, train_loss: 0.9100, test_loss: 1.0170, test_f1: 0.5298
 epoch: 23, train_loss: 0.9022, test_loss: 1.0856, test_f1: 0.5220
 epoch: 24, train_loss: 0.9078, test_loss: 1.1381, test_f1: 0.5110
 epoch: 25, train_loss: 0.9148, test_loss: 1.0224, test_f1: 0.5422
 epoch: 26, train_loss: 0.8947, test_loss: 0.9661, test_f1: 0.4495
 epoch: 27, train_loss: 0.9002, test_loss: 1.1014, test_f1: 0.5190
 epoch: 28, train_loss: 0.8912, test_loss: 1.0253, test_f1: 0.5532
 epoch: 29, train_loss: 0.8875, test_loss: 1.0951, test_f1: 0.5235
 epoch: 30, train_loss: 0.8922, test_loss: 1.0171, test_f1: 0.5681
 epoch: 31, train_loss: 0.8968, test_loss: 1.0850, test_f1: 0.5196
 epoch: 32, train_loss: 0.8734, test_loss: 1.1001, test_f1: 0.5292
 epoch: 33, train_loss: 0.8678, test_loss: 1.0211, test_f1: 0.5583
 epoch: 34, train_loss: 0.8940, test_loss: 1.0539, test_f1: 0.5336
 epoch: 35, train_loss: 0.8829, test_loss: 1.0103, test_f1: 0.5723
 epoch: 36, train_loss: 0.8649, test_loss: 1.0471, test_f1: 0.5630
 epoch: 37, train_loss: 0.8546, test_loss: 1.1304, test_f1: 0.5570
 epoch: 38, train_loss: 0.8548, test_loss: 1.0364, test_f1: 0.5433
 epoch: 39, train_loss: 0.8571, test_loss: 1.0526, test_f1: 0.5569
 epoch: 40, train_loss: 0.8480, test_loss: 0.9700, test_f1: 0.5799
 epoch: 41, train_loss: 0.8321, test_loss: 1.1226, test_f1: 0.4900
 epoch: 42, train_loss: 0.8710, test_loss: 1.1015, test_f1: 0.5314
 epoch: 43, train_loss: 0.8354, test_loss: 1.0671, test_f1: 0.5317
 epoch: 44, train_loss: 0.8399, test_loss: 0.9783, test_f1: 0.5537
 epoch: 45, train_loss: 0.8245, test_loss: 1.0769, test_f1: 0.5078
 epoch: 46, train_loss: 0.8415, test_loss: 1.1290, test_f1: 0.5271
 epoch: 47, train_loss: 0.8359, test_loss: 0.9723, test_f1: 0.5919
 epoch: 48, train_loss: 0.8545, test_loss: 1.0871, test_f1: 0.4981
 epoch: 49, train_loss: 0.8462, test_loss: 1.0447, test_f1: 0.5464
 epoch: 50, train_loss: 0.8201, test_loss: 1.0545, test_f1: 0.5626
 epoch: 51, train_loss: 0.8079, test_loss: 0.9819, test_f1: 0.5679
 epoch: 52, train_loss: 0.7809, test_loss: 1.0060, test_f1: 0.5804
 epoch: 53, train_loss: 0.7742, test_loss: 1.0393, test_f1: 0.5386
 epoch: 54, train_loss: 0.7795, test_loss: 1.0486, test_f1: 0.5435
 epoch: 55, train_loss: 0.7510, test_loss: 0.9873, test_f1: 0.6223
 epoch: 56, train_loss: 0.7718, test_loss: 0.9997, test_f1: 0.5642
 epoch: 57, train_loss: 0.7559, test_loss: 0.9958, test_f1: 0.5706
 epoch: 58, train_loss: 0.7514, test_loss: 1.0264, test_f1: 0.5270
 epoch: 59, train_loss: 0.7312, test_loss: 0.9772, test_f1: 0.5686
 epoch: 60, train_loss: 0.7440, test_loss: 1.0238, test_f1: 0.5759
 epoch: 61, train_loss: 0.7438, test_loss: 1.0932, test_f1: 0.5768
 epoch: 62, train_loss: 0.7324, test_loss: 1.1206, test_f1: 0.5628
 epoch: 63, train_loss: 0.7449, test_loss: 1.0571, test_f1: 0.5892
 epoch: 64, train_loss: 0.7160, test_loss: 1.0447, test_f1: 0.6040
 epoch: 65, train_loss: 0.7408, test_loss: 1.0807, test_f1: 0.5576
 epoch: 66, train_loss: 0.7452, test_loss: 1.0684, test_f1: 0.5561
 epoch: 67, train_loss: 0.7437, test_loss: 0.9700, test_f1: 0.6063
 epoch: 68, train_loss: 0.7481, test_loss: 0.9789, test_f1: 0.6427
 epoch: 69, train_loss: 0.7401, test_loss: 1.0050, test_f1: 0.6410
 epoch: 70, train_loss: 0.7496, test_loss: 1.0024, test_f1: 0.6004
 epoch: 71, train_loss: 0.7324, test_loss: 1.1141, test_f1: 0.6121
 epoch: 72, train_loss: 0.7117, test_loss: 1.0379, test_f1: 0.5922
 epoch: 73, train_loss: 0.7122, test_loss: 1.3251, test_f1: 0.5272
 epoch: 74, train_loss: 0.6887, test_loss: 1.0934, test_f1: 0.6183
 epoch: 75, train_loss: 0.7015, test_loss: 1.1587, test_f1: 0.5287
 epoch: 76, train_loss: 0.7177, test_loss: 1.0499, test_f1: 0.6104
 epoch: 77, train_loss: 0.7026, test_loss: 1.1220, test_f1: 0.5591
 epoch: 78, train_loss: 0.6925, test_loss: 1.3820, test_f1: 0.4858
 epoch: 79, train_loss: 0.6845, test_loss: 1.1651, test_f1: 0.6181
 epoch: 80, train_loss: 0.7143, test_loss: 1.1635, test_f1: 0.6256
 epoch: 81, train_loss: 0.6897, test_loss: 1.1580, test_f1: 0.6283
 epoch: 82, train_loss: 0.6842, test_loss: 1.3663, test_f1: 0.5435
 epoch: 83, train_loss: 0.6764, test_loss: 1.1297, test_f1: 0.5733
 epoch: 84, train_loss: 0.6818, test_loss: 1.1913, test_f1: 0.6071
 epoch: 85, train_loss: 0.6735, test_loss: 1.1484, test_f1: 0.5997
 epoch: 86, train_loss: 0.6725, test_loss: 1.0720, test_f1: 0.5909
 epoch: 87, train_loss: 0.7062, test_loss: 1.2159, test_f1: 0.5584
 epoch: 88, train_loss: 0.6862, test_loss: 1.1107, test_f1: 0.6205
 epoch: 89, train_loss: 0.6723, test_loss: 1.1210, test_f1: 0.6105
 epoch: 90, train_loss: 0.6786, test_loss: 1.1893, test_f1: 0.5779
 epoch: 91, train_loss: 0.6783, test_loss: 1.1890, test_f1: 0.6260
 epoch: 92, train_loss: 0.6919, test_loss: 1.3848, test_f1: 0.5325
 epoch: 93, train_loss: 0.6743, test_loss: 1.2446, test_f1: 0.6013
 epoch: 94, train_loss: 0.6889, test_loss: 1.2967, test_f1: 0.5347
 epoch: 95, train_loss: 0.6818, test_loss: 1.5506, test_f1: 0.5625
 epoch: 96, train_loss: 0.6761, test_loss: 1.2642, test_f1: 0.5619
 epoch: 97, train_loss: 0.6559, test_loss: 1.0755, test_f1: 0.5771
 epoch: 98, train_loss: 0.6559, test_loss: 1.2960, test_f1: 0.5968
 epoch: 99, train_loss: 0.6656, test_loss: 1.1357, test_f1: 0.6212
##################ITERATION #9 ****************************************
 epoch: 0, train_loss: 1.2151, test_loss: 1.3195, test_f1: 0.2374
 epoch: 1, train_loss: 1.0451, test_loss: 1.1139, test_f1: 0.4478
 epoch: 2, train_loss: 1.0012, test_loss: 1.0574, test_f1: 0.4649
 epoch: 3, train_loss: 1.0008, test_loss: 1.0776, test_f1: 0.5145
 epoch: 4, train_loss: 0.9707, test_loss: 1.0524, test_f1: 0.4974
 epoch: 5, train_loss: 0.9557, test_loss: 1.1553, test_f1: 0.4792
 epoch: 6, train_loss: 0.9404, test_loss: 0.9978, test_f1: 0.5246
 epoch: 7, train_loss: 0.9337, test_loss: 1.0639, test_f1: 0.4250
 epoch: 8, train_loss: 0.9363, test_loss: 1.0527, test_f1: 0.5057
 epoch: 9, train_loss: 0.9203, test_loss: 1.0413, test_f1: 0.4963
 epoch: 10, train_loss: 0.8867, test_loss: 1.0265, test_f1: 0.5520
 epoch: 11, train_loss: 0.8996, test_loss: 1.0016, test_f1: 0.5390
 epoch: 12, train_loss: 0.8983, test_loss: 0.9959, test_f1: 0.4726
 epoch: 13, train_loss: 0.8730, test_loss: 1.0383, test_f1: 0.5586
 epoch: 14, train_loss: 0.8712, test_loss: 1.0711, test_f1: 0.5072
 epoch: 15, train_loss: 0.8796, test_loss: 0.9605, test_f1: 0.5089
 epoch: 16, train_loss: 0.8553, test_loss: 1.1299, test_f1: 0.5584
 epoch: 17, train_loss: 0.8353, test_loss: 0.9972, test_f1: 0.5963
 epoch: 18, train_loss: 0.8253, test_loss: 1.0465, test_f1: 0.6101
 epoch: 19, train_loss: 0.8187, test_loss: 1.0425, test_f1: 0.5688
 epoch: 20, train_loss: 0.8217, test_loss: 1.0101, test_f1: 0.5708
 epoch: 21, train_loss: 0.8117, test_loss: 1.0713, test_f1: 0.6006
 epoch: 22, train_loss: 0.8210, test_loss: 0.9769, test_f1: 0.5338
 epoch: 23, train_loss: 0.8244, test_loss: 1.0669, test_f1: 0.5444
 epoch: 24, train_loss: 0.8143, test_loss: 1.0482, test_f1: 0.5695
 epoch: 25, train_loss: 0.8015, test_loss: 1.0581, test_f1: 0.5375
 epoch: 26, train_loss: 0.7818, test_loss: 1.0996, test_f1: 0.4875
 epoch: 27, train_loss: 0.7764, test_loss: 1.1259, test_f1: 0.5134
 epoch: 28, train_loss: 0.7890, test_loss: 1.0659, test_f1: 0.5671
 epoch: 29, train_loss: 0.7662, test_loss: 1.1283, test_f1: 0.5350
 epoch: 30, train_loss: 0.7701, test_loss: 1.0164, test_f1: 0.5540
 epoch: 31, train_loss: 0.7402, test_loss: 1.0929, test_f1: 0.5676
 epoch: 32, train_loss: 0.7584, test_loss: 1.1726, test_f1: 0.5817
 epoch: 33, train_loss: 0.7490, test_loss: 1.0316, test_f1: 0.5916
 epoch: 34, train_loss: 0.7439, test_loss: 1.0705, test_f1: 0.5590
 epoch: 35, train_loss: 0.7508, test_loss: 1.0451, test_f1: 0.5905
 epoch: 36, train_loss: 0.7554, test_loss: 1.2394, test_f1: 0.5594
 epoch: 37, train_loss: 0.7644, test_loss: 1.0449, test_f1: 0.5580
 epoch: 38, train_loss: 0.7555, test_loss: 1.0218, test_f1: 0.5956
 epoch: 39, train_loss: 0.7542, test_loss: 1.1164, test_f1: 0.5838
 epoch: 40, train_loss: 0.7291, test_loss: 1.0057, test_f1: 0.6267
 epoch: 41, train_loss: 0.7514, test_loss: 1.1815, test_f1: 0.5335
 epoch: 42, train_loss: 0.7529, test_loss: 1.2633, test_f1: 0.5755
 epoch: 43, train_loss: 0.7232, test_loss: 1.1018, test_f1: 0.5796
 epoch: 44, train_loss: 0.7214, test_loss: 1.1058, test_f1: 0.6135
 epoch: 45, train_loss: 0.7258, test_loss: 1.0413, test_f1: 0.5934
 epoch: 46, train_loss: 0.7355, test_loss: 1.1321, test_f1: 0.5277
 epoch: 47, train_loss: 0.7418, test_loss: 1.0098, test_f1: 0.5695
 epoch: 48, train_loss: 0.7038, test_loss: 1.2489, test_f1: 0.5764
 epoch: 49, train_loss: 0.7111, test_loss: 1.0281, test_f1: 0.5935
 epoch: 50, train_loss: 0.7120, test_loss: 1.2653, test_f1: 0.5288
 epoch: 51, train_loss: 0.6932, test_loss: 1.2937, test_f1: 0.5700
 epoch: 52, train_loss: 0.6868, test_loss: 1.1318, test_f1: 0.5770
 epoch: 53, train_loss: 0.6678, test_loss: 1.2061, test_f1: 0.5648
 epoch: 54, train_loss: 0.6612, test_loss: 1.1420, test_f1: 0.6054
 epoch: 55, train_loss: 0.6500, test_loss: 2.4451, test_f1: 0.5666
 epoch: 56, train_loss: 0.6905, test_loss: 1.1011, test_f1: 0.6070
 epoch: 57, train_loss: 0.6830, test_loss: 1.0826, test_f1: 0.5751
 epoch: 58, train_loss: 0.6583, test_loss: 1.0961, test_f1: 0.6165
 epoch: 59, train_loss: 0.6646, test_loss: 1.1743, test_f1: 0.5951
 epoch: 60, train_loss: 0.6768, test_loss: 1.1658, test_f1: 0.5698
 epoch: 61, train_loss: 0.6785, test_loss: 1.1193, test_f1: 0.5691
 epoch: 62, train_loss: 0.6554, test_loss: 1.4606, test_f1: 0.5983
 epoch: 63, train_loss: 0.6481, test_loss: 1.1316, test_f1: 0.5829
 epoch: 64, train_loss: 0.6594, test_loss: 1.1373, test_f1: 0.5856
 epoch: 65, train_loss: 0.6544, test_loss: 1.1421, test_f1: 0.6081
 epoch: 66, train_loss: 0.6510, test_loss: 1.1073, test_f1: 0.6097
 epoch: 67, train_loss: 0.6313, test_loss: 1.3107, test_f1: 0.6112
 epoch: 68, train_loss: 0.6284, test_loss: 1.1003, test_f1: 0.6038
 epoch: 69, train_loss: 0.6486, test_loss: 1.1178, test_f1: 0.5975
 epoch: 70, train_loss: 0.6647, test_loss: 1.1893, test_f1: 0.5772
 epoch: 71, train_loss: 0.6687, test_loss: 1.5310, test_f1: 0.5529
 epoch: 72, train_loss: 0.6733, test_loss: 1.1153, test_f1: 0.6101
 epoch: 73, train_loss: 0.6418, test_loss: 1.1591, test_f1: 0.6182
 epoch: 74, train_loss: 0.6824, test_loss: 1.2557, test_f1: 0.5684
 epoch: 75, train_loss: 0.6438, test_loss: 1.1831, test_f1: 0.5837
 epoch: 76, train_loss: 0.6325, test_loss: 1.1750, test_f1: 0.5629
 epoch: 77, train_loss: 0.6379, test_loss: 1.1543, test_f1: 0.5939
 epoch: 78, train_loss: 0.6188, test_loss: 1.2194, test_f1: 0.5933
 epoch: 79, train_loss: 0.6562, test_loss: 1.1889, test_f1: 0.5784
 epoch: 80, train_loss: 0.6643, test_loss: 1.3815, test_f1: 0.5510
 epoch: 81, train_loss: 0.6321, test_loss: 1.1649, test_f1: 0.5806
 epoch: 82, train_loss: 0.6325, test_loss: 1.3094, test_f1: 0.5724
 epoch: 83, train_loss: 0.6089, test_loss: 1.2238, test_f1: 0.5976
 epoch: 84, train_loss: 0.6185, test_loss: 1.5650, test_f1: 0.5455
 epoch: 85, train_loss: 0.6294, test_loss: 1.3514, test_f1: 0.5671
 epoch: 86, train_loss: 0.6343, test_loss: 1.2042, test_f1: 0.5688
 epoch: 87, train_loss: 0.6259, test_loss: 1.2015, test_f1: 0.5904
 epoch: 88, train_loss: 0.6159, test_loss: 1.2690, test_f1: 0.5638
 epoch: 89, train_loss: 0.6062, test_loss: 1.3675, test_f1: 0.5805
 epoch: 90, train_loss: 0.6072, test_loss: 1.2129, test_f1: 0.5690
 epoch: 91, train_loss: 0.5970, test_loss: 1.2326, test_f1: 0.5852
 epoch: 92, train_loss: 0.5927, test_loss: 1.2930, test_f1: 0.5720
 epoch: 93, train_loss: 0.5800, test_loss: 1.3055, test_f1: 0.5666
 epoch: 94, train_loss: 0.5808, test_loss: 1.2400, test_f1: 0.5943
 epoch: 95, train_loss: 0.5961, test_loss: 1.3135, test_f1: 0.5807
 epoch: 96, train_loss: 0.5928, test_loss: 1.3744, test_f1: 0.6009
 epoch: 97, train_loss: 0.5941, test_loss: 1.2231, test_f1: 0.5628
 epoch: 98, train_loss: 0.5963, test_loss: 1.3132, test_f1: 0.5802
 epoch: 99, train_loss: 0.5718, test_loss: 1.3303, test_f1: 0.5770

Training completed in 446.07 seconds
Best F1: 0.6427 at epoch 68
Mean F1 across iterations: 0.6222  0.0109
========================FINAL RESULTS================================
FEGIN weighted F1: 0.6427  0.0109
python main.py --data ltspice_demos --representation component_net --model FEGIN --layers 4 --hiddens 16 --batch_size 64 --lr 0.01 --emb_size 250 --epochs 100 --save_appendix component_net_L4_H16_BS64_LR0.01_E250 --no_val
-----



STDERR:
  File "main.py", line 370, in <module>
    main()
  File "main.py", line 254, in main
    dataset = dataset_class(
  File "/home/philip/projects/ltspice_examples_code_repo/Circuit-Completion-Using-GNNs/component_classification_with_link_prediction_head/evaluation/FEGIN/kernel/circuit_datasets.py", line 15, in __init__
    self.data, self.slices = torch.load(self.processed_paths[0])
  File "/home/philip/.local/lib/python3.8/site-packages/torch/serialization.py", line 1040, in load
    warnings.warn(
  File "/usr/lib/python3.8/warnings.py", line 109, in _showwarnmsg
    sw(msg.message, msg.category, msg.filename, msg.lineno,
  File "main.py", line 47, in warn_with_traceback
    traceback.print_stack(file=log)
/home/philip/projects/ltspice_examples_code_repo/Circuit-Completion-Using-GNNs/component_classification_with_link_prediction_head/evaluation/FEGIN/kernel/circuit_datasets.py:15: FutureWarning: You are using `torch.load` with `weights_only=False` (the current default value), which uses the default pickle module implicitly. It is possible to construct malicious pickle data which will execute arbitrary code during unpickling (See https://github.com/pytorch/pytorch/blob/main/SECURITY.md#untrusted-models for more details). In a future release, the default value for `weights_only` will be flipped to `True`. This limits the functions that could be executed during unpickling. Arbitrary objects will no longer be allowed to be loaded via this mode unless they are explicitly allowlisted by the user via `torch.serialization.add_safe_globals`. We recommend you start setting `weights_only=True` for any use case where you don't have full control of the loaded file. Please open an issue on GitHub for any issues related to this experimental feature.
  self.data, self.slices = torch.load(self.processed_paths[0])
