STDOUT:
Results will be saved in /home/philip/projects/ltspice_examples_code_repo/Circuit-Completion-Using-GNNs/component_classification_with_link_prediction_head/evaluation/FEGIN/results/model_FEGIN_dataset_ltspice_examples
Command line input: python main.py --data ltspice_examples --representation component_pin --model FEGIN --layers 6 --hiddens 64 --batch_size 256 --lr 0.001 --emb_size 128 --epochs 100 --save_appendix component_pin_L6_H64_BS256_LR0.001_E128 --no_val
 is saved.
-----
ltspice_examples - FEGIN
Using 6 layers, 64 hidden units, h = 2
Loading component_pin representation dataset
ENTERED
Training FEGIN on component_pin representation
Train: 3560, Test: 848
##################ITERATION #0 ****************************************
 epoch: 0, train_loss: 1.3391, test_loss: 1.3311, test_f1: 0.2260
 epoch: 1, train_loss: 1.2289, test_loss: 1.3137, test_f1: 0.2585
 epoch: 2, train_loss: 1.1836, test_loss: 1.3038, test_f1: 0.2777
 epoch: 3, train_loss: 1.1344, test_loss: 1.2909, test_f1: 0.2275
 epoch: 4, train_loss: 1.0788, test_loss: 1.1380, test_f1: 0.3641
 epoch: 5, train_loss: 1.0205, test_loss: 1.0862, test_f1: 0.4391
 epoch: 6, train_loss: 0.9974, test_loss: 1.0293, test_f1: 0.4654
 epoch: 7, train_loss: 0.9706, test_loss: 1.0458, test_f1: 0.4740
 epoch: 8, train_loss: 0.9502, test_loss: 0.9970, test_f1: 0.4920
 epoch: 9, train_loss: 0.9239, test_loss: 1.0450, test_f1: 0.4476
 epoch: 10, train_loss: 0.8955, test_loss: 0.9467, test_f1: 0.4982
 epoch: 11, train_loss: 0.8627, test_loss: 0.9602, test_f1: 0.5173
 epoch: 12, train_loss: 0.8551, test_loss: 0.9272, test_f1: 0.5300
 epoch: 13, train_loss: 0.8413, test_loss: 1.0126, test_f1: 0.5390
 epoch: 14, train_loss: 0.8068, test_loss: 0.9592, test_f1: 0.5180
 epoch: 15, train_loss: 0.7939, test_loss: 0.9605, test_f1: 0.5180
 epoch: 16, train_loss: 0.8000, test_loss: 0.9495, test_f1: 0.5737
 epoch: 17, train_loss: 0.7743, test_loss: 1.3724, test_f1: 0.4234
 epoch: 18, train_loss: 0.7529, test_loss: 0.9302, test_f1: 0.5513
 epoch: 19, train_loss: 0.7247, test_loss: 0.9466, test_f1: 0.5354
 epoch: 20, train_loss: 0.7097, test_loss: 1.0432, test_f1: 0.5359
 epoch: 21, train_loss: 0.7190, test_loss: 0.9574, test_f1: 0.5413
 epoch: 22, train_loss: 0.6965, test_loss: 1.3981, test_f1: 0.4829
 epoch: 23, train_loss: 0.6906, test_loss: 0.9271, test_f1: 0.5578
 epoch: 24, train_loss: 0.6854, test_loss: 0.9572, test_f1: 0.5704
 epoch: 25, train_loss: 0.6793, test_loss: 0.9783, test_f1: 0.5565
 epoch: 26, train_loss: 0.6771, test_loss: 0.9041, test_f1: 0.5821
 epoch: 27, train_loss: 0.6760, test_loss: 1.0940, test_f1: 0.5465
 epoch: 28, train_loss: 0.6564, test_loss: 1.1954, test_f1: 0.5149
 epoch: 29, train_loss: 0.6508, test_loss: 0.9191, test_f1: 0.5941
 epoch: 30, train_loss: 0.6277, test_loss: 1.0635, test_f1: 0.5828
 epoch: 31, train_loss: 0.6180, test_loss: 0.9517, test_f1: 0.5787
 epoch: 32, train_loss: 0.6074, test_loss: 1.0521, test_f1: 0.5992
 epoch: 33, train_loss: 0.6167, test_loss: 0.9766, test_f1: 0.5824
 epoch: 34, train_loss: 0.6029, test_loss: 0.9682, test_f1: 0.6026
 epoch: 35, train_loss: 0.5942, test_loss: 0.9827, test_f1: 0.6138
 epoch: 36, train_loss: 0.5987, test_loss: 1.0360, test_f1: 0.5788
 epoch: 37, train_loss: 0.5856, test_loss: 1.3111, test_f1: 0.5356
 epoch: 38, train_loss: 0.5790, test_loss: 1.1239, test_f1: 0.5952
 epoch: 39, train_loss: 0.5946, test_loss: 1.0823, test_f1: 0.5619
 epoch: 40, train_loss: 0.5842, test_loss: 1.1245, test_f1: 0.5633
 epoch: 41, train_loss: 0.5831, test_loss: 1.0354, test_f1: 0.6036
 epoch: 42, train_loss: 0.5725, test_loss: 0.9489, test_f1: 0.5862
 epoch: 43, train_loss: 0.5537, test_loss: 1.0664, test_f1: 0.6102
 epoch: 44, train_loss: 0.5405, test_loss: 1.0216, test_f1: 0.5975
 epoch: 45, train_loss: 0.5430, test_loss: 1.0953, test_f1: 0.5869
 epoch: 46, train_loss: 0.5370, test_loss: 0.9289, test_f1: 0.6165
 epoch: 47, train_loss: 0.5359, test_loss: 0.9655, test_f1: 0.6231
 epoch: 48, train_loss: 0.5429, test_loss: 1.0417, test_f1: 0.6002
 epoch: 49, train_loss: 0.5391, test_loss: 1.0396, test_f1: 0.6142
 epoch: 50, train_loss: 0.5109, test_loss: 1.0720, test_f1: 0.6057
 epoch: 51, train_loss: 0.4828, test_loss: 1.1006, test_f1: 0.6218
 epoch: 52, train_loss: 0.4662, test_loss: 1.0877, test_f1: 0.6039
 epoch: 53, train_loss: 0.4669, test_loss: 1.1770, test_f1: 0.6249
 epoch: 54, train_loss: 0.4486, test_loss: 1.1471, test_f1: 0.6309
 epoch: 55, train_loss: 0.4466, test_loss: 1.1390, test_f1: 0.6323
 epoch: 56, train_loss: 0.4513, test_loss: 1.2162, test_f1: 0.6256
 epoch: 57, train_loss: 0.4402, test_loss: 1.2379, test_f1: 0.6008
 epoch: 58, train_loss: 0.4340, test_loss: 1.4036, test_f1: 0.5943
 epoch: 59, train_loss: 0.4256, test_loss: 1.2163, test_f1: 0.6269
 epoch: 60, train_loss: 0.4253, test_loss: 1.2827, test_f1: 0.6159
 epoch: 61, train_loss: 0.4269, test_loss: 1.3319, test_f1: 0.6066
 epoch: 62, train_loss: 0.4136, test_loss: 1.2636, test_f1: 0.6406
 epoch: 63, train_loss: 0.4143, test_loss: 1.2562, test_f1: 0.6184
 epoch: 64, train_loss: 0.4188, test_loss: 1.3100, test_f1: 0.6256
 epoch: 65, train_loss: 0.4178, test_loss: 1.3975, test_f1: 0.6145
 epoch: 66, train_loss: 0.4102, test_loss: 1.2933, test_f1: 0.6293
 epoch: 67, train_loss: 0.3988, test_loss: 1.3999, test_f1: 0.6119
 epoch: 68, train_loss: 0.4019, test_loss: 1.3861, test_f1: 0.5989
 epoch: 69, train_loss: 0.4027, test_loss: 1.3719, test_f1: 0.6287
 epoch: 70, train_loss: 0.4055, test_loss: 1.4280, test_f1: 0.6160
 epoch: 71, train_loss: 0.3857, test_loss: 1.3024, test_f1: 0.6137
 epoch: 72, train_loss: 0.3742, test_loss: 1.3069, test_f1: 0.6341
 epoch: 73, train_loss: 0.3769, test_loss: 1.4855, test_f1: 0.6193
 epoch: 74, train_loss: 0.3645, test_loss: 1.3842, test_f1: 0.6248
 epoch: 75, train_loss: 0.3751, test_loss: 1.3566, test_f1: 0.6214
 epoch: 76, train_loss: 0.3869, test_loss: 1.4425, test_f1: 0.6247
 epoch: 77, train_loss: 0.3786, test_loss: 1.3607, test_f1: 0.6324
 epoch: 78, train_loss: 0.3720, test_loss: 1.4212, test_f1: 0.6240
 epoch: 79, train_loss: 0.3702, test_loss: 1.4388, test_f1: 0.5990
 epoch: 80, train_loss: 0.3790, test_loss: 1.5732, test_f1: 0.6100
 epoch: 81, train_loss: 0.3795, test_loss: 1.6453, test_f1: 0.5948
 epoch: 82, train_loss: 0.3882, test_loss: 1.4172, test_f1: 0.6183
 epoch: 83, train_loss: 0.3628, test_loss: 1.5343, test_f1: 0.6244
 epoch: 84, train_loss: 0.3490, test_loss: 1.4333, test_f1: 0.6123
 epoch: 85, train_loss: 0.3361, test_loss: 1.5070, test_f1: 0.6277
 epoch: 86, train_loss: 0.3522, test_loss: 1.5363, test_f1: 0.6258
 epoch: 87, train_loss: 0.3334, test_loss: 1.4698, test_f1: 0.6517
 epoch: 88, train_loss: 0.3385, test_loss: 1.5390, test_f1: 0.6287
 epoch: 89, train_loss: 0.3206, test_loss: 1.6108, test_f1: 0.6095
 epoch: 90, train_loss: 0.3128, test_loss: 1.6480, test_f1: 0.6100
 epoch: 91, train_loss: 0.3253, test_loss: 1.7370, test_f1: 0.6252
 epoch: 92, train_loss: 0.3172, test_loss: 1.6338, test_f1: 0.6062
 epoch: 93, train_loss: 0.3331, test_loss: 1.6751, test_f1: 0.6251
 epoch: 94, train_loss: 0.3492, test_loss: 1.6260, test_f1: 0.6385
 epoch: 95, train_loss: 0.3290, test_loss: 1.6222, test_f1: 0.6365
 epoch: 96, train_loss: 0.3171, test_loss: 1.8643, test_f1: 0.6224
 epoch: 97, train_loss: 0.3080, test_loss: 1.5977, test_f1: 0.6359
 epoch: 98, train_loss: 0.3185, test_loss: 1.7148, test_f1: 0.6362
 epoch: 99, train_loss: 0.3013, test_loss: 1.8496, test_f1: 0.6191
##################ITERATION #1 ****************************************
 epoch: 0, train_loss: 1.2592, test_loss: 1.2927, test_f1: 0.2260
 epoch: 1, train_loss: 1.1156, test_loss: 1.2587, test_f1: 0.2260
 epoch: 2, train_loss: 1.0528, test_loss: 1.0926, test_f1: 0.3701
 epoch: 3, train_loss: 1.0005, test_loss: 0.9983, test_f1: 0.4460
 epoch: 4, train_loss: 0.9655, test_loss: 1.0186, test_f1: 0.4633
 epoch: 5, train_loss: 0.9410, test_loss: 1.0165, test_f1: 0.4841
 epoch: 6, train_loss: 0.9104, test_loss: 0.9882, test_f1: 0.4564
 epoch: 7, train_loss: 0.9053, test_loss: 0.9592, test_f1: 0.4969
 epoch: 8, train_loss: 0.8650, test_loss: 0.9586, test_f1: 0.4974
 epoch: 9, train_loss: 0.8570, test_loss: 0.9530, test_f1: 0.5244
 epoch: 10, train_loss: 0.8249, test_loss: 0.9455, test_f1: 0.5106
 epoch: 11, train_loss: 0.8164, test_loss: 0.9378, test_f1: 0.5314
 epoch: 12, train_loss: 0.8018, test_loss: 0.9380, test_f1: 0.5410
 epoch: 13, train_loss: 0.7938, test_loss: 0.9575, test_f1: 0.5190
 epoch: 14, train_loss: 0.7727, test_loss: 0.9823, test_f1: 0.5178
 epoch: 15, train_loss: 0.7486, test_loss: 0.8984, test_f1: 0.5628
 epoch: 16, train_loss: 0.7438, test_loss: 0.9779, test_f1: 0.5440
 epoch: 17, train_loss: 0.7254, test_loss: 0.9163, test_f1: 0.5533
 epoch: 18, train_loss: 0.7021, test_loss: 1.0020, test_f1: 0.5670
 epoch: 19, train_loss: 0.6931, test_loss: 0.9693, test_f1: 0.5638
 epoch: 20, train_loss: 0.6905, test_loss: 0.9819, test_f1: 0.5749
 epoch: 21, train_loss: 0.6955, test_loss: 1.0285, test_f1: 0.5979
 epoch: 22, train_loss: 0.6718, test_loss: 1.1323, test_f1: 0.5188
 epoch: 23, train_loss: 0.6394, test_loss: 1.0287, test_f1: 0.5617
 epoch: 24, train_loss: 0.6302, test_loss: 0.9951, test_f1: 0.5959
 epoch: 25, train_loss: 0.6523, test_loss: 0.9655, test_f1: 0.5685
 epoch: 26, train_loss: 0.6357, test_loss: 1.0407, test_f1: 0.5841
 epoch: 27, train_loss: 0.6196, test_loss: 1.1258, test_f1: 0.5898
 epoch: 28, train_loss: 0.6059, test_loss: 0.9411, test_f1: 0.6292
 epoch: 29, train_loss: 0.6025, test_loss: 1.1263, test_f1: 0.5785
 epoch: 30, train_loss: 0.6039, test_loss: 1.0193, test_f1: 0.5946
 epoch: 31, train_loss: 0.5869, test_loss: 0.9805, test_f1: 0.5935
 epoch: 32, train_loss: 0.5677, test_loss: 1.0895, test_f1: 0.5746
 epoch: 33, train_loss: 0.5533, test_loss: 1.0582, test_f1: 0.6007
 epoch: 34, train_loss: 0.5572, test_loss: 1.0414, test_f1: 0.6099
 epoch: 35, train_loss: 0.5566, test_loss: 1.0093, test_f1: 0.6055
 epoch: 36, train_loss: 0.5516, test_loss: 1.1853, test_f1: 0.5616
 epoch: 37, train_loss: 0.5283, test_loss: 1.0142, test_f1: 0.5907
 epoch: 38, train_loss: 0.5310, test_loss: 1.0399, test_f1: 0.6298
 epoch: 39, train_loss: 0.5529, test_loss: 1.3158, test_f1: 0.5793
 epoch: 40, train_loss: 0.5247, test_loss: 1.0164, test_f1: 0.5962
 epoch: 41, train_loss: 0.5128, test_loss: 1.1014, test_f1: 0.6066
 epoch: 42, train_loss: 0.5023, test_loss: 1.0606, test_f1: 0.6266
 epoch: 43, train_loss: 0.4943, test_loss: 0.9923, test_f1: 0.6260
 epoch: 44, train_loss: 0.4978, test_loss: 1.2268, test_f1: 0.5771
 epoch: 45, train_loss: 0.4814, test_loss: 1.0397, test_f1: 0.5828
 epoch: 46, train_loss: 0.4638, test_loss: 1.3188, test_f1: 0.6175
 epoch: 47, train_loss: 0.4591, test_loss: 1.0492, test_f1: 0.6285
 epoch: 48, train_loss: 0.4535, test_loss: 1.1107, test_f1: 0.6102
 epoch: 49, train_loss: 0.4517, test_loss: 1.1696, test_f1: 0.6165
 epoch: 50, train_loss: 0.4419, test_loss: 1.2698, test_f1: 0.5718
 epoch: 51, train_loss: 0.4148, test_loss: 1.1741, test_f1: 0.6257
 epoch: 52, train_loss: 0.4001, test_loss: 1.1872, test_f1: 0.6123
 epoch: 53, train_loss: 0.3863, test_loss: 1.1658, test_f1: 0.6188
 epoch: 54, train_loss: 0.3712, test_loss: 1.1525, test_f1: 0.6183
 epoch: 55, train_loss: 0.3480, test_loss: 1.1726, test_f1: 0.6471
 epoch: 56, train_loss: 0.3532, test_loss: 1.2405, test_f1: 0.6188
 epoch: 57, train_loss: 0.3551, test_loss: 1.3210, test_f1: 0.6140
 epoch: 58, train_loss: 0.3472, test_loss: 1.2790, test_f1: 0.6318
 epoch: 59, train_loss: 0.3462, test_loss: 1.2810, test_f1: 0.6430
 epoch: 60, train_loss: 0.3338, test_loss: 1.2268, test_f1: 0.6330
 epoch: 61, train_loss: 0.3409, test_loss: 1.4501, test_f1: 0.6107
 epoch: 62, train_loss: 0.3306, test_loss: 1.2870, test_f1: 0.6113
 epoch: 63, train_loss: 0.3222, test_loss: 1.3970, test_f1: 0.6250
 epoch: 64, train_loss: 0.3281, test_loss: 1.3248, test_f1: 0.6054
 epoch: 65, train_loss: 0.3245, test_loss: 1.3730, test_f1: 0.6264
 epoch: 66, train_loss: 0.3190, test_loss: 1.3207, test_f1: 0.6282
 epoch: 67, train_loss: 0.3090, test_loss: 1.4731, test_f1: 0.6285
 epoch: 68, train_loss: 0.3105, test_loss: 1.2913, test_f1: 0.6337
 epoch: 69, train_loss: 0.3058, test_loss: 1.4902, test_f1: 0.6284
 epoch: 70, train_loss: 0.2998, test_loss: 1.3275, test_f1: 0.6363
 epoch: 71, train_loss: 0.3047, test_loss: 1.4246, test_f1: 0.6161
 epoch: 72, train_loss: 0.2915, test_loss: 1.5900, test_f1: 0.6091
 epoch: 73, train_loss: 0.2968, test_loss: 1.3353, test_f1: 0.6335
 epoch: 74, train_loss: 0.2756, test_loss: 1.5163, test_f1: 0.6270
 epoch: 75, train_loss: 0.2686, test_loss: 1.4598, test_f1: 0.6377
 epoch: 76, train_loss: 0.2909, test_loss: 1.4954, test_f1: 0.6168
 epoch: 77, train_loss: 0.2727, test_loss: 1.5817, test_f1: 0.6329
 epoch: 78, train_loss: 0.2718, test_loss: 1.7157, test_f1: 0.6105
 epoch: 79, train_loss: 0.2637, test_loss: 1.5384, test_f1: 0.6144
 epoch: 80, train_loss: 0.2797, test_loss: 1.5988, test_f1: 0.6172
 epoch: 81, train_loss: 0.2562, test_loss: 1.7143, test_f1: 0.5897
 epoch: 82, train_loss: 0.2490, test_loss: 1.6381, test_f1: 0.6560
 epoch: 83, train_loss: 0.2654, test_loss: 1.7647, test_f1: 0.5980
 epoch: 84, train_loss: 0.2449, test_loss: 1.6998, test_f1: 0.6219
 epoch: 85, train_loss: 0.2484, test_loss: 1.5302, test_f1: 0.6268
 epoch: 86, train_loss: 0.2548, test_loss: 1.6010, test_f1: 0.6138
 epoch: 87, train_loss: 0.2546, test_loss: 1.8249, test_f1: 0.6212
 epoch: 88, train_loss: 0.2563, test_loss: 1.7486, test_f1: 0.6098
 epoch: 89, train_loss: 0.2469, test_loss: 1.5863, test_f1: 0.6458
 epoch: 90, train_loss: 0.2325, test_loss: 1.8550, test_f1: 0.5980
 epoch: 91, train_loss: 0.2249, test_loss: 1.6368, test_f1: 0.6411
 epoch: 92, train_loss: 0.2263, test_loss: 1.9113, test_f1: 0.6031
 epoch: 93, train_loss: 0.2299, test_loss: 1.7266, test_f1: 0.6237
 epoch: 94, train_loss: 0.2551, test_loss: 1.5470, test_f1: 0.6199
 epoch: 95, train_loss: 0.2345, test_loss: 1.8560, test_f1: 0.6183
 epoch: 96, train_loss: 0.2254, test_loss: 1.8591, test_f1: 0.6322
 epoch: 97, train_loss: 0.2163, test_loss: 1.8675, test_f1: 0.6232
 epoch: 98, train_loss: 0.2179, test_loss: 1.7436, test_f1: 0.6248
 epoch: 99, train_loss: 0.2119, test_loss: 1.8426, test_f1: 0.6138
##################ITERATION #2 ****************************************
 epoch: 0, train_loss: 1.2288, test_loss: 1.2830, test_f1: 0.2260
 epoch: 1, train_loss: 1.0477, test_loss: 1.2215, test_f1: 0.2311
 epoch: 2, train_loss: 0.9985, test_loss: 1.1704, test_f1: 0.2770
 epoch: 3, train_loss: 0.9609, test_loss: 1.0386, test_f1: 0.4448
 epoch: 4, train_loss: 0.9232, test_loss: 0.9708, test_f1: 0.5142
 epoch: 5, train_loss: 0.9104, test_loss: 0.9378, test_f1: 0.5388
 epoch: 6, train_loss: 0.8746, test_loss: 0.9404, test_f1: 0.5363
 epoch: 7, train_loss: 0.8500, test_loss: 0.9537, test_f1: 0.5364
 epoch: 8, train_loss: 0.8315, test_loss: 0.8748, test_f1: 0.5727
 epoch: 9, train_loss: 0.8179, test_loss: 0.9614, test_f1: 0.5450
 epoch: 10, train_loss: 0.8009, test_loss: 1.0679, test_f1: 0.5112
 epoch: 11, train_loss: 0.7888, test_loss: 0.9975, test_f1: 0.5627
 epoch: 12, train_loss: 0.7670, test_loss: 0.8957, test_f1: 0.5599
 epoch: 13, train_loss: 0.7475, test_loss: 0.9139, test_f1: 0.5549
 epoch: 14, train_loss: 0.7494, test_loss: 0.9068, test_f1: 0.5666
 epoch: 15, train_loss: 0.7306, test_loss: 0.8724, test_f1: 0.5955
 epoch: 16, train_loss: 0.7059, test_loss: 0.9318, test_f1: 0.5747
 epoch: 17, train_loss: 0.7017, test_loss: 1.0756, test_f1: 0.5487
 epoch: 18, train_loss: 0.6949, test_loss: 0.9294, test_f1: 0.5870
 epoch: 19, train_loss: 0.6750, test_loss: 1.0771, test_f1: 0.5396
 epoch: 20, train_loss: 0.6718, test_loss: 0.8698, test_f1: 0.6136
 epoch: 21, train_loss: 0.6392, test_loss: 0.9255, test_f1: 0.5775
 epoch: 22, train_loss: 0.6428, test_loss: 0.8497, test_f1: 0.6130
 epoch: 23, train_loss: 0.6545, test_loss: 0.8429, test_f1: 0.5832
 epoch: 24, train_loss: 0.6639, test_loss: 0.9462, test_f1: 0.5898
 epoch: 25, train_loss: 0.6405, test_loss: 0.8940, test_f1: 0.6125
 epoch: 26, train_loss: 0.6140, test_loss: 1.0397, test_f1: 0.5708
 epoch: 27, train_loss: 0.6088, test_loss: 0.9417, test_f1: 0.5862
 epoch: 28, train_loss: 0.6043, test_loss: 0.9247, test_f1: 0.5960
 epoch: 29, train_loss: 0.5814, test_loss: 1.0329, test_f1: 0.6114
 epoch: 30, train_loss: 0.5757, test_loss: 0.8993, test_f1: 0.6133
 epoch: 31, train_loss: 0.5554, test_loss: 0.8880, test_f1: 0.6308
 epoch: 32, train_loss: 0.5438, test_loss: 0.8415, test_f1: 0.6494
 epoch: 33, train_loss: 0.5529, test_loss: 0.9739, test_f1: 0.6303
 epoch: 34, train_loss: 0.5502, test_loss: 0.9474, test_f1: 0.6286
 epoch: 35, train_loss: 0.5544, test_loss: 0.9078, test_f1: 0.6389
 epoch: 36, train_loss: 0.5243, test_loss: 0.9424, test_f1: 0.6170
 epoch: 37, train_loss: 0.5304, test_loss: 0.9497, test_f1: 0.6353
 epoch: 38, train_loss: 0.5341, test_loss: 0.9137, test_f1: 0.6373
 epoch: 39, train_loss: 0.5188, test_loss: 0.9373, test_f1: 0.6272
 epoch: 40, train_loss: 0.5127, test_loss: 0.8682, test_f1: 0.6815
 epoch: 41, train_loss: 0.5026, test_loss: 0.9538, test_f1: 0.6040
 epoch: 42, train_loss: 0.4751, test_loss: 0.9649, test_f1: 0.6412
 epoch: 43, train_loss: 0.4815, test_loss: 1.1123, test_f1: 0.5842
 epoch: 44, train_loss: 0.4922, test_loss: 1.0069, test_f1: 0.6590
 epoch: 45, train_loss: 0.4861, test_loss: 1.0346, test_f1: 0.6343
 epoch: 46, train_loss: 0.4648, test_loss: 0.9956, test_f1: 0.6271
 epoch: 47, train_loss: 0.4657, test_loss: 0.9963, test_f1: 0.6703
 epoch: 48, train_loss: 0.4626, test_loss: 1.0127, test_f1: 0.6500
 epoch: 49, train_loss: 0.4729, test_loss: 1.0025, test_f1: 0.6535
 epoch: 50, train_loss: 0.4578, test_loss: 1.0077, test_f1: 0.6351
 epoch: 51, train_loss: 0.4327, test_loss: 1.0775, test_f1: 0.6229
 epoch: 52, train_loss: 0.4170, test_loss: 1.0104, test_f1: 0.6527
 epoch: 53, train_loss: 0.4057, test_loss: 1.0740, test_f1: 0.6634
 epoch: 54, train_loss: 0.3836, test_loss: 1.0616, test_f1: 0.6529
 epoch: 55, train_loss: 0.3927, test_loss: 1.0895, test_f1: 0.6385
 epoch: 56, train_loss: 0.3811, test_loss: 1.1286, test_f1: 0.6356
 epoch: 57, train_loss: 0.3795, test_loss: 1.1101, test_f1: 0.6339
 epoch: 58, train_loss: 0.3736, test_loss: 1.0649, test_f1: 0.6405
 epoch: 59, train_loss: 0.3664, test_loss: 1.1334, test_f1: 0.6301
 epoch: 60, train_loss: 0.3595, test_loss: 1.1208, test_f1: 0.6435
 epoch: 61, train_loss: 0.3695, test_loss: 1.0367, test_f1: 0.6445
 epoch: 62, train_loss: 0.3572, test_loss: 1.2108, test_f1: 0.6456
 epoch: 63, train_loss: 0.3662, test_loss: 1.1352, test_f1: 0.6424
 epoch: 64, train_loss: 0.3574, test_loss: 1.1381, test_f1: 0.6307
 epoch: 65, train_loss: 0.3357, test_loss: 1.2139, test_f1: 0.6230
 epoch: 66, train_loss: 0.3308, test_loss: 1.2750, test_f1: 0.6175
 epoch: 67, train_loss: 0.3203, test_loss: 1.3036, test_f1: 0.6149
 epoch: 68, train_loss: 0.3247, test_loss: 1.2483, test_f1: 0.6403
 epoch: 69, train_loss: 0.3214, test_loss: 1.3511, test_f1: 0.6040
 epoch: 70, train_loss: 0.3306, test_loss: 1.2608, test_f1: 0.6227
 epoch: 71, train_loss: 0.3206, test_loss: 1.3410, test_f1: 0.6354
 epoch: 72, train_loss: 0.3318, test_loss: 1.4815, test_f1: 0.6079
 epoch: 73, train_loss: 0.3322, test_loss: 1.2372, test_f1: 0.6389
 epoch: 74, train_loss: 0.3249, test_loss: 1.2431, test_f1: 0.6401
 epoch: 75, train_loss: 0.3186, test_loss: 1.2985, test_f1: 0.6495
 epoch: 76, train_loss: 0.3193, test_loss: 1.2456, test_f1: 0.6683
 epoch: 77, train_loss: 0.3027, test_loss: 1.4029, test_f1: 0.6239
 epoch: 78, train_loss: 0.3021, test_loss: 1.4113, test_f1: 0.6436
 epoch: 79, train_loss: 0.2960, test_loss: 1.4593, test_f1: 0.6176
 epoch: 80, train_loss: 0.3096, test_loss: 1.5432, test_f1: 0.6132
 epoch: 81, train_loss: 0.2970, test_loss: 1.4265, test_f1: 0.6352
 epoch: 82, train_loss: 0.2991, test_loss: 1.3813, test_f1: 0.6180
 epoch: 83, train_loss: 0.2917, test_loss: 1.2965, test_f1: 0.6597
 epoch: 84, train_loss: 0.2760, test_loss: 1.2824, test_f1: 0.6402
 epoch: 85, train_loss: 0.2744, test_loss: 1.4373, test_f1: 0.6381
 epoch: 86, train_loss: 0.2792, test_loss: 1.5104, test_f1: 0.6270
 epoch: 87, train_loss: 0.2711, test_loss: 1.3765, test_f1: 0.6379
 epoch: 88, train_loss: 0.2794, test_loss: 1.2852, test_f1: 0.6470
 epoch: 89, train_loss: 0.2829, test_loss: 1.4517, test_f1: 0.6237
 epoch: 90, train_loss: 0.2748, test_loss: 1.2135, test_f1: 0.6618
 epoch: 91, train_loss: 0.2771, test_loss: 1.6615, test_f1: 0.6045
 epoch: 92, train_loss: 0.2688, test_loss: 1.3376, test_f1: 0.6485
 epoch: 93, train_loss: 0.2650, test_loss: 1.5029, test_f1: 0.6305
 epoch: 94, train_loss: 0.2678, test_loss: 1.4236, test_f1: 0.6527
 epoch: 95, train_loss: 0.2545, test_loss: 1.6427, test_f1: 0.6255
 epoch: 96, train_loss: 0.2540, test_loss: 1.5535, test_f1: 0.6393
 epoch: 97, train_loss: 0.2468, test_loss: 1.6285, test_f1: 0.6325
 epoch: 98, train_loss: 0.2513, test_loss: 1.4156, test_f1: 0.6605
 epoch: 99, train_loss: 0.2511, test_loss: 1.5813, test_f1: 0.6305
##################ITERATION #3 ****************************************
 epoch: 0, train_loss: 1.2203, test_loss: 1.3578, test_f1: 0.2574
 epoch: 1, train_loss: 1.0490, test_loss: 1.3837, test_f1: 0.2599
 epoch: 2, train_loss: 0.9998, test_loss: 1.2525, test_f1: 0.3262
 epoch: 3, train_loss: 0.9522, test_loss: 1.1365, test_f1: 0.3973
 epoch: 4, train_loss: 0.9320, test_loss: 1.0398, test_f1: 0.5084
 epoch: 5, train_loss: 0.9060, test_loss: 0.8963, test_f1: 0.5323
 epoch: 6, train_loss: 0.8820, test_loss: 0.9915, test_f1: 0.5024
 epoch: 7, train_loss: 0.8469, test_loss: 0.9607, test_f1: 0.5457
 epoch: 8, train_loss: 0.8412, test_loss: 0.9183, test_f1: 0.5625
 epoch: 9, train_loss: 0.8258, test_loss: 0.9002, test_f1: 0.5808
 epoch: 10, train_loss: 0.8114, test_loss: 1.0344, test_f1: 0.5330
 epoch: 11, train_loss: 0.7869, test_loss: 0.8586, test_f1: 0.5991
 epoch: 12, train_loss: 0.7657, test_loss: 0.8885, test_f1: 0.5926
 epoch: 13, train_loss: 0.7457, test_loss: 0.8914, test_f1: 0.5652
 epoch: 14, train_loss: 0.7182, test_loss: 1.1076, test_f1: 0.5489
 epoch: 15, train_loss: 0.7166, test_loss: 0.9005, test_f1: 0.5950
 epoch: 16, train_loss: 0.7105, test_loss: 0.9443, test_f1: 0.5937
 epoch: 17, train_loss: 0.7170, test_loss: 0.8867, test_f1: 0.6013
 epoch: 18, train_loss: 0.7008, test_loss: 0.9267, test_f1: 0.5991
 epoch: 19, train_loss: 0.6948, test_loss: 0.8906, test_f1: 0.6175
 epoch: 20, train_loss: 0.7018, test_loss: 3.5192, test_f1: 0.3532
 epoch: 21, train_loss: 0.6811, test_loss: 0.8872, test_f1: 0.5904
 epoch: 22, train_loss: 0.6781, test_loss: 0.9120, test_f1: 0.5883
 epoch: 23, train_loss: 0.6455, test_loss: 0.8219, test_f1: 0.6352
 epoch: 24, train_loss: 0.6287, test_loss: 0.8226, test_f1: 0.6152
 epoch: 25, train_loss: 0.6262, test_loss: 1.1683, test_f1: 0.5353
 epoch: 26, train_loss: 0.6008, test_loss: 0.8606, test_f1: 0.6155
 epoch: 27, train_loss: 0.5948, test_loss: 0.8421, test_f1: 0.6235
 epoch: 28, train_loss: 0.5868, test_loss: 0.9061, test_f1: 0.6309
 epoch: 29, train_loss: 0.6039, test_loss: 0.8924, test_f1: 0.6401
 epoch: 30, train_loss: 0.5907, test_loss: 0.9404, test_f1: 0.6275
 epoch: 31, train_loss: 0.5776, test_loss: 0.8565, test_f1: 0.6187
 epoch: 32, train_loss: 0.5673, test_loss: 0.9510, test_f1: 0.6192
 epoch: 33, train_loss: 0.5614, test_loss: 0.8249, test_f1: 0.6509
 epoch: 34, train_loss: 0.5344, test_loss: 1.1230, test_f1: 0.6314
 epoch: 35, train_loss: 0.5550, test_loss: 2.0142, test_f1: 0.4782
 epoch: 36, train_loss: 0.5468, test_loss: 0.8947, test_f1: 0.6444
 epoch: 37, train_loss: 0.5432, test_loss: 0.7859, test_f1: 0.6558
 epoch: 38, train_loss: 0.5106, test_loss: 0.8532, test_f1: 0.6495
 epoch: 39, train_loss: 0.5228, test_loss: 0.9521, test_f1: 0.6435
 epoch: 40, train_loss: 0.5271, test_loss: 1.1822, test_f1: 0.5738
 epoch: 41, train_loss: 0.5076, test_loss: 0.8457, test_f1: 0.6504
 epoch: 42, train_loss: 0.5060, test_loss: 1.1953, test_f1: 0.5446
 epoch: 43, train_loss: 0.5001, test_loss: 0.8723, test_f1: 0.6389
 epoch: 44, train_loss: 0.4685, test_loss: 0.9051, test_f1: 0.6454
 epoch: 45, train_loss: 0.4654, test_loss: 0.8350, test_f1: 0.6529
 epoch: 46, train_loss: 0.4786, test_loss: 0.9770, test_f1: 0.6286
 epoch: 47, train_loss: 0.4564, test_loss: 0.8822, test_f1: 0.6433
 epoch: 48, train_loss: 0.4610, test_loss: 0.7794, test_f1: 0.6886
 epoch: 49, train_loss: 0.4679, test_loss: 1.1113, test_f1: 0.6185
 epoch: 50, train_loss: 0.4622, test_loss: 0.8842, test_f1: 0.6513
 epoch: 51, train_loss: 0.4297, test_loss: 0.9350, test_f1: 0.6638
 epoch: 52, train_loss: 0.4018, test_loss: 0.9655, test_f1: 0.6498
 epoch: 53, train_loss: 0.3918, test_loss: 0.9257, test_f1: 0.6475
 epoch: 54, train_loss: 0.3859, test_loss: 0.9053, test_f1: 0.6658
 epoch: 55, train_loss: 0.3982, test_loss: 0.9182, test_f1: 0.6580
 epoch: 56, train_loss: 0.3792, test_loss: 0.9621, test_f1: 0.6695
 epoch: 57, train_loss: 0.3708, test_loss: 0.9254, test_f1: 0.6652
 epoch: 58, train_loss: 0.3694, test_loss: 1.0166, test_f1: 0.6532
 epoch: 59, train_loss: 0.3680, test_loss: 0.8581, test_f1: 0.6884
 epoch: 60, train_loss: 0.3593, test_loss: 1.1791, test_f1: 0.6216
 epoch: 61, train_loss: 0.3510, test_loss: 0.9298, test_f1: 0.6624
 epoch: 62, train_loss: 0.3540, test_loss: 0.9732, test_f1: 0.6798
 epoch: 63, train_loss: 0.3409, test_loss: 1.0106, test_f1: 0.6499
 epoch: 64, train_loss: 0.3454, test_loss: 0.9567, test_f1: 0.6443
 epoch: 65, train_loss: 0.3287, test_loss: 0.9409, test_f1: 0.6668
 epoch: 66, train_loss: 0.3413, test_loss: 1.1296, test_f1: 0.6330
 epoch: 67, train_loss: 0.3280, test_loss: 1.0649, test_f1: 0.6506
 epoch: 68, train_loss: 0.3352, test_loss: 0.9547, test_f1: 0.6741
 epoch: 69, train_loss: 0.3297, test_loss: 1.0275, test_f1: 0.6577
 epoch: 70, train_loss: 0.3070, test_loss: 1.0834, test_f1: 0.6628
 epoch: 71, train_loss: 0.3177, test_loss: 1.1137, test_f1: 0.6695
 epoch: 72, train_loss: 0.3127, test_loss: 1.0628, test_f1: 0.6255
 epoch: 73, train_loss: 0.3081, test_loss: 1.0901, test_f1: 0.6705
 epoch: 74, train_loss: 0.2850, test_loss: 1.1149, test_f1: 0.7021
 epoch: 75, train_loss: 0.3024, test_loss: 1.1706, test_f1: 0.6501
 epoch: 76, train_loss: 0.2874, test_loss: 1.1253, test_f1: 0.6308
 epoch: 77, train_loss: 0.2926, test_loss: 1.3843, test_f1: 0.6631
 epoch: 78, train_loss: 0.2940, test_loss: 1.1911, test_f1: 0.6051
 epoch: 79, train_loss: 0.2938, test_loss: 1.2848, test_f1: 0.6618
 epoch: 80, train_loss: 0.2903, test_loss: 1.2016, test_f1: 0.6596
 epoch: 81, train_loss: 0.2737, test_loss: 1.2762, test_f1: 0.6370
 epoch: 82, train_loss: 0.2632, test_loss: 0.9898, test_f1: 0.6594
 epoch: 83, train_loss: 0.2679, test_loss: 1.5100, test_f1: 0.6447
 epoch: 84, train_loss: 0.2910, test_loss: 1.1544, test_f1: 0.6612
 epoch: 85, train_loss: 0.2752, test_loss: 1.2370, test_f1: 0.6684
 epoch: 86, train_loss: 0.2695, test_loss: 1.2171, test_f1: 0.6428
 epoch: 87, train_loss: 0.2721, test_loss: 1.3668, test_f1: 0.6596
 epoch: 88, train_loss: 0.2722, test_loss: 1.2647, test_f1: 0.6329
 epoch: 89, train_loss: 0.2641, test_loss: 1.4732, test_f1: 0.6757
 epoch: 90, train_loss: 0.2512, test_loss: 1.1299, test_f1: 0.6558
 epoch: 91, train_loss: 0.2469, test_loss: 1.2454, test_f1: 0.6570
 epoch: 92, train_loss: 0.2396, test_loss: 1.1423, test_f1: 0.6931
 epoch: 93, train_loss: 0.2400, test_loss: 1.4440, test_f1: 0.6872
 epoch: 94, train_loss: 0.2520, test_loss: 1.1280, test_f1: 0.6401
 epoch: 95, train_loss: 0.2422, test_loss: 1.0563, test_f1: 0.6935
 epoch: 96, train_loss: 0.2450, test_loss: 1.2189, test_f1: 0.6734
 epoch: 97, train_loss: 0.2663, test_loss: 1.6658, test_f1: 0.5994
 epoch: 98, train_loss: 0.2343, test_loss: 1.3180, test_f1: 0.6538
 epoch: 99, train_loss: 0.2322, test_loss: 1.3070, test_f1: 0.6824
##################ITERATION #4 ****************************************
 epoch: 0, train_loss: 1.1989, test_loss: 1.3690, test_f1: 0.2574
 epoch: 1, train_loss: 1.0297, test_loss: 1.3900, test_f1: 0.2260
 epoch: 2, train_loss: 0.9836, test_loss: 1.4385, test_f1: 0.2574
 epoch: 3, train_loss: 0.9395, test_loss: 1.3581, test_f1: 0.2545
 epoch: 4, train_loss: 0.8997, test_loss: 1.1199, test_f1: 0.4172
 epoch: 5, train_loss: 0.8744, test_loss: 0.9229, test_f1: 0.5477
 epoch: 6, train_loss: 0.8655, test_loss: 0.9760, test_f1: 0.5413
 epoch: 7, train_loss: 0.8307, test_loss: 0.9099, test_f1: 0.5419
 epoch: 8, train_loss: 0.8121, test_loss: 1.0017, test_f1: 0.5348
 epoch: 9, train_loss: 0.8117, test_loss: 1.1533, test_f1: 0.4942
 epoch: 10, train_loss: 0.7900, test_loss: 0.8900, test_f1: 0.5735
 epoch: 11, train_loss: 0.7681, test_loss: 0.9001, test_f1: 0.5298
 epoch: 12, train_loss: 0.7378, test_loss: 0.9504, test_f1: 0.5600
 epoch: 13, train_loss: 0.7450, test_loss: 0.9486, test_f1: 0.5592
 epoch: 14, train_loss: 0.7330, test_loss: 1.0459, test_f1: 0.5569
 epoch: 15, train_loss: 0.7196, test_loss: 1.0113, test_f1: 0.5497
 epoch: 16, train_loss: 0.7084, test_loss: 0.8944, test_f1: 0.5525
 epoch: 17, train_loss: 0.6934, test_loss: 0.9427, test_f1: 0.5701
 epoch: 18, train_loss: 0.7053, test_loss: 1.0075, test_f1: 0.5390
 epoch: 19, train_loss: 0.6891, test_loss: 0.9642, test_f1: 0.5455
 epoch: 20, train_loss: 0.6626, test_loss: 1.1977, test_f1: 0.4708
 epoch: 21, train_loss: 0.6488, test_loss: 0.9252, test_f1: 0.5503
 epoch: 22, train_loss: 0.6496, test_loss: 0.9424, test_f1: 0.5488
 epoch: 23, train_loss: 0.6494, test_loss: 0.8808, test_f1: 0.6098
 epoch: 24, train_loss: 0.6515, test_loss: 0.8923, test_f1: 0.5685
 epoch: 25, train_loss: 0.6145, test_loss: 0.8481, test_f1: 0.5987
 epoch: 26, train_loss: 0.6272, test_loss: 1.1252, test_f1: 0.5489
 epoch: 27, train_loss: 0.6158, test_loss: 0.8591, test_f1: 0.6220
 epoch: 28, train_loss: 0.6012, test_loss: 0.9637, test_f1: 0.5903
 epoch: 29, train_loss: 0.5894, test_loss: 1.0285, test_f1: 0.5710
 epoch: 30, train_loss: 0.5841, test_loss: 0.8529, test_f1: 0.6155
 epoch: 31, train_loss: 0.5807, test_loss: 0.9208, test_f1: 0.5949
 epoch: 32, train_loss: 0.5756, test_loss: 1.1167, test_f1: 0.5779
 epoch: 33, train_loss: 0.5656, test_loss: 0.9122, test_f1: 0.5971
 epoch: 34, train_loss: 0.5621, test_loss: 0.9442, test_f1: 0.6241
 epoch: 35, train_loss: 0.5688, test_loss: 0.9459, test_f1: 0.5922
 epoch: 36, train_loss: 0.5758, test_loss: 0.9210, test_f1: 0.6123
 epoch: 37, train_loss: 0.5605, test_loss: 1.0262, test_f1: 0.6291
 epoch: 38, train_loss: 0.5454, test_loss: 1.0067, test_f1: 0.5906
 epoch: 39, train_loss: 0.5215, test_loss: 0.8905, test_f1: 0.6068
 epoch: 40, train_loss: 0.5152, test_loss: 1.1054, test_f1: 0.6087
 epoch: 41, train_loss: 0.5110, test_loss: 1.0045, test_f1: 0.6300
 epoch: 42, train_loss: 0.5219, test_loss: 1.1602, test_f1: 0.6058
 epoch: 43, train_loss: 0.5175, test_loss: 0.9898, test_f1: 0.6040
 epoch: 44, train_loss: 0.5073, test_loss: 0.9166, test_f1: 0.6471
 epoch: 45, train_loss: 0.4958, test_loss: 1.0056, test_f1: 0.6280
 epoch: 46, train_loss: 0.4764, test_loss: 1.0709, test_f1: 0.6128
 epoch: 47, train_loss: 0.4850, test_loss: 1.4793, test_f1: 0.4971
 epoch: 48, train_loss: 0.4994, test_loss: 0.9724, test_f1: 0.6089
 epoch: 49, train_loss: 0.4809, test_loss: 0.8699, test_f1: 0.6405
 epoch: 50, train_loss: 0.4821, test_loss: 1.0331, test_f1: 0.6382
 epoch: 51, train_loss: 0.4404, test_loss: 0.9582, test_f1: 0.6335
 epoch: 52, train_loss: 0.4316, test_loss: 0.9988, test_f1: 0.6253
 epoch: 53, train_loss: 0.4050, test_loss: 0.9635, test_f1: 0.6325
 epoch: 54, train_loss: 0.4050, test_loss: 0.9578, test_f1: 0.6376
 epoch: 55, train_loss: 0.3947, test_loss: 1.0221, test_f1: 0.6271
 epoch: 56, train_loss: 0.3949, test_loss: 1.0879, test_f1: 0.6307
 epoch: 57, train_loss: 0.3844, test_loss: 1.1030, test_f1: 0.6578
 epoch: 58, train_loss: 0.3773, test_loss: 1.0998, test_f1: 0.6451
 epoch: 59, train_loss: 0.3836, test_loss: 1.0845, test_f1: 0.6494
 epoch: 60, train_loss: 0.3583, test_loss: 1.1597, test_f1: 0.6271
 epoch: 61, train_loss: 0.3734, test_loss: 1.2459, test_f1: 0.6453
 epoch: 62, train_loss: 0.3747, test_loss: 1.1315, test_f1: 0.6197
 epoch: 63, train_loss: 0.3548, test_loss: 1.1747, test_f1: 0.6358
 epoch: 64, train_loss: 0.3459, test_loss: 1.2324, test_f1: 0.6410
 epoch: 65, train_loss: 0.3503, test_loss: 1.2297, test_f1: 0.6240
 epoch: 66, train_loss: 0.3462, test_loss: 1.3457, test_f1: 0.6044
 epoch: 67, train_loss: 0.3607, test_loss: 1.1879, test_f1: 0.6321
 epoch: 68, train_loss: 0.3592, test_loss: 1.0939, test_f1: 0.6388
 epoch: 69, train_loss: 0.3360, test_loss: 1.2671, test_f1: 0.6293
 epoch: 70, train_loss: 0.3346, test_loss: 1.2423, test_f1: 0.6369
 epoch: 71, train_loss: 0.3412, test_loss: 1.3361, test_f1: 0.6232
 epoch: 72, train_loss: 0.3257, test_loss: 1.2433, test_f1: 0.6497
 epoch: 73, train_loss: 0.3260, test_loss: 1.2619, test_f1: 0.6331
 epoch: 74, train_loss: 0.3143, test_loss: 1.3062, test_f1: 0.6499
 epoch: 75, train_loss: 0.3215, test_loss: 1.2472, test_f1: 0.6490
 epoch: 76, train_loss: 0.3138, test_loss: 1.3031, test_f1: 0.6459
 epoch: 77, train_loss: 0.3062, test_loss: 1.1976, test_f1: 0.6457
 epoch: 78, train_loss: 0.3010, test_loss: 1.2695, test_f1: 0.6461
 epoch: 79, train_loss: 0.2944, test_loss: 1.3864, test_f1: 0.6476
 epoch: 80, train_loss: 0.2803, test_loss: 1.3749, test_f1: 0.6360
 epoch: 81, train_loss: 0.2994, test_loss: 1.4213, test_f1: 0.6495
 epoch: 82, train_loss: 0.2950, test_loss: 1.4970, test_f1: 0.6361
 epoch: 83, train_loss: 0.3015, test_loss: 1.3898, test_f1: 0.6091
 epoch: 84, train_loss: 0.2934, test_loss: 1.4545, test_f1: 0.6536
 epoch: 85, train_loss: 0.2756, test_loss: 1.4277, test_f1: 0.6463
 epoch: 86, train_loss: 0.2807, test_loss: 1.4511, test_f1: 0.6405
 epoch: 87, train_loss: 0.2884, test_loss: 1.8471, test_f1: 0.5909
 epoch: 88, train_loss: 0.3051, test_loss: 1.2752, test_f1: 0.6502
 epoch: 89, train_loss: 0.2907, test_loss: 1.4246, test_f1: 0.6579
 epoch: 90, train_loss: 0.2828, test_loss: 1.5749, test_f1: 0.6071
 epoch: 91, train_loss: 0.2860, test_loss: 1.4855, test_f1: 0.6501
 epoch: 92, train_loss: 0.2794, test_loss: 1.5605, test_f1: 0.6504
 epoch: 93, train_loss: 0.2754, test_loss: 1.4240, test_f1: 0.6581
 epoch: 94, train_loss: 0.2810, test_loss: 1.5597, test_f1: 0.6600
 epoch: 95, train_loss: 0.2784, test_loss: 1.3988, test_f1: 0.6610
 epoch: 96, train_loss: 0.2583, test_loss: 1.4722, test_f1: 0.6614
 epoch: 97, train_loss: 0.2547, test_loss: 1.4931, test_f1: 0.6641
 epoch: 98, train_loss: 0.2447, test_loss: 1.4966, test_f1: 0.6663
 epoch: 99, train_loss: 0.2547, test_loss: 1.7179, test_f1: 0.6319
##################ITERATION #5 ****************************************
 epoch: 0, train_loss: 1.2620, test_loss: 1.3332, test_f1: 0.2260
 epoch: 1, train_loss: 1.0794, test_loss: 1.3398, test_f1: 0.2311
 epoch: 2, train_loss: 1.0244, test_loss: 1.1357, test_f1: 0.3386
 epoch: 3, train_loss: 0.9990, test_loss: 1.0070, test_f1: 0.4459
 epoch: 4, train_loss: 0.9593, test_loss: 0.9801, test_f1: 0.4907
 epoch: 5, train_loss: 0.9418, test_loss: 0.9788, test_f1: 0.5056
 epoch: 6, train_loss: 0.9257, test_loss: 1.0093, test_f1: 0.4918
 epoch: 7, train_loss: 0.8935, test_loss: 0.9558, test_f1: 0.5182
 epoch: 8, train_loss: 0.8810, test_loss: 0.9590, test_f1: 0.5403
 epoch: 9, train_loss: 0.8518, test_loss: 0.9742, test_f1: 0.5594
 epoch: 10, train_loss: 0.8397, test_loss: 0.9720, test_f1: 0.5329
 epoch: 11, train_loss: 0.8340, test_loss: 0.9417, test_f1: 0.5732
 epoch: 12, train_loss: 0.8056, test_loss: 0.9415, test_f1: 0.5354
 epoch: 13, train_loss: 0.8079, test_loss: 0.9563, test_f1: 0.5332
 epoch: 14, train_loss: 0.7905, test_loss: 0.9494, test_f1: 0.5643
 epoch: 15, train_loss: 0.7719, test_loss: 0.9416, test_f1: 0.5442
 epoch: 16, train_loss: 0.7638, test_loss: 0.9760, test_f1: 0.5521
 epoch: 17, train_loss: 0.7478, test_loss: 1.0216, test_f1: 0.5364
 epoch: 18, train_loss: 0.7273, test_loss: 0.9086, test_f1: 0.6128
 epoch: 19, train_loss: 0.7285, test_loss: 1.0664, test_f1: 0.5395
 epoch: 20, train_loss: 0.7149, test_loss: 0.9647, test_f1: 0.5384
 epoch: 21, train_loss: 0.7152, test_loss: 1.0806, test_f1: 0.5520
 epoch: 22, train_loss: 0.6884, test_loss: 0.9494, test_f1: 0.5847
 epoch: 23, train_loss: 0.6856, test_loss: 0.9888, test_f1: 0.5641
 epoch: 24, train_loss: 0.6827, test_loss: 1.0303, test_f1: 0.5726
 epoch: 25, train_loss: 0.6686, test_loss: 0.9668, test_f1: 0.6003
 epoch: 26, train_loss: 0.6567, test_loss: 0.9830, test_f1: 0.5845
 epoch: 27, train_loss: 0.6665, test_loss: 0.9562, test_f1: 0.5960
 epoch: 28, train_loss: 0.6572, test_loss: 0.9143, test_f1: 0.6123
 epoch: 29, train_loss: 0.6611, test_loss: 1.0255, test_f1: 0.5513
 epoch: 30, train_loss: 0.6440, test_loss: 0.9449, test_f1: 0.5907
 epoch: 31, train_loss: 0.6329, test_loss: 1.0021, test_f1: 0.5660
 epoch: 32, train_loss: 0.6337, test_loss: 0.9913, test_f1: 0.5872
 epoch: 33, train_loss: 0.5993, test_loss: 1.0568, test_f1: 0.5852
 epoch: 34, train_loss: 0.6015, test_loss: 1.0191, test_f1: 0.5988
 epoch: 35, train_loss: 0.6059, test_loss: 0.9521, test_f1: 0.6160
 epoch: 36, train_loss: 0.6083, test_loss: 1.0242, test_f1: 0.5863
 epoch: 37, train_loss: 0.5927, test_loss: 1.0528, test_f1: 0.5844
 epoch: 38, train_loss: 0.5847, test_loss: 1.0261, test_f1: 0.5952
 epoch: 39, train_loss: 0.5722, test_loss: 1.0376, test_f1: 0.6083
 epoch: 40, train_loss: 0.5652, test_loss: 0.9879, test_f1: 0.6106
 epoch: 41, train_loss: 0.5488, test_loss: 1.0213, test_f1: 0.5881
 epoch: 42, train_loss: 0.5479, test_loss: 1.0737, test_f1: 0.5733
 epoch: 43, train_loss: 0.5337, test_loss: 1.0430, test_f1: 0.5750
 epoch: 44, train_loss: 0.5572, test_loss: 1.3464, test_f1: 0.5809
 epoch: 45, train_loss: 0.5389, test_loss: 1.0060, test_f1: 0.6149
 epoch: 46, train_loss: 0.5503, test_loss: 1.0391, test_f1: 0.6011
 epoch: 47, train_loss: 0.5351, test_loss: 0.9988, test_f1: 0.5964
 epoch: 48, train_loss: 0.5032, test_loss: 1.0539, test_f1: 0.5912
 epoch: 49, train_loss: 0.5067, test_loss: 1.1504, test_f1: 0.5863
 epoch: 50, train_loss: 0.5041, test_loss: 1.0961, test_f1: 0.5852
 epoch: 51, train_loss: 0.4835, test_loss: 1.0647, test_f1: 0.6022
 epoch: 52, train_loss: 0.4691, test_loss: 1.0427, test_f1: 0.6081
 epoch: 53, train_loss: 0.4486, test_loss: 1.0703, test_f1: 0.6088
 epoch: 54, train_loss: 0.4368, test_loss: 1.1179, test_f1: 0.5966
 epoch: 55, train_loss: 0.4230, test_loss: 1.0748, test_f1: 0.6219
 epoch: 56, train_loss: 0.4192, test_loss: 1.1689, test_f1: 0.6007
 epoch: 57, train_loss: 0.4093, test_loss: 1.1278, test_f1: 0.6216
 epoch: 58, train_loss: 0.4038, test_loss: 1.1433, test_f1: 0.6126
 epoch: 59, train_loss: 0.4145, test_loss: 1.0766, test_f1: 0.6358
 epoch: 60, train_loss: 0.4027, test_loss: 1.1259, test_f1: 0.6091
 epoch: 61, train_loss: 0.4128, test_loss: 1.1378, test_f1: 0.6226
 epoch: 62, train_loss: 0.4070, test_loss: 1.1050, test_f1: 0.6126
 epoch: 63, train_loss: 0.3892, test_loss: 1.1515, test_f1: 0.5999
 epoch: 64, train_loss: 0.3943, test_loss: 1.2391, test_f1: 0.5984
 epoch: 65, train_loss: 0.3797, test_loss: 1.1714, test_f1: 0.6172
 epoch: 66, train_loss: 0.3799, test_loss: 1.1649, test_f1: 0.6329
 epoch: 67, train_loss: 0.3661, test_loss: 1.2218, test_f1: 0.5988
 epoch: 68, train_loss: 0.3701, test_loss: 1.1433, test_f1: 0.6317
 epoch: 69, train_loss: 0.3574, test_loss: 1.2518, test_f1: 0.6039
 epoch: 70, train_loss: 0.3615, test_loss: 1.2162, test_f1: 0.6069
 epoch: 71, train_loss: 0.3735, test_loss: 1.1807, test_f1: 0.6263
 epoch: 72, train_loss: 0.3531, test_loss: 1.2143, test_f1: 0.6110
 epoch: 73, train_loss: 0.3468, test_loss: 1.1985, test_f1: 0.6140
 epoch: 74, train_loss: 0.3496, test_loss: 1.1844, test_f1: 0.6278
 epoch: 75, train_loss: 0.3439, test_loss: 1.2113, test_f1: 0.6508
 epoch: 76, train_loss: 0.3509, test_loss: 1.3103, test_f1: 0.6322
 epoch: 77, train_loss: 0.3386, test_loss: 1.1777, test_f1: 0.6497
 epoch: 78, train_loss: 0.3337, test_loss: 1.2279, test_f1: 0.6342
 epoch: 79, train_loss: 0.3442, test_loss: 1.4838, test_f1: 0.5572
 epoch: 80, train_loss: 0.3453, test_loss: 1.2862, test_f1: 0.5968
 epoch: 81, train_loss: 0.3336, test_loss: 1.2594, test_f1: 0.6230
 epoch: 82, train_loss: 0.3405, test_loss: 1.1695, test_f1: 0.6352
 epoch: 83, train_loss: 0.3240, test_loss: 1.3185, test_f1: 0.6288
 epoch: 84, train_loss: 0.3198, test_loss: 1.3846, test_f1: 0.6144
 epoch: 85, train_loss: 0.3245, test_loss: 1.3244, test_f1: 0.6116
 epoch: 86, train_loss: 0.3108, test_loss: 1.3443, test_f1: 0.6269
 epoch: 87, train_loss: 0.3111, test_loss: 1.4368, test_f1: 0.6032
 epoch: 88, train_loss: 0.3050, test_loss: 1.3522, test_f1: 0.6434
 epoch: 89, train_loss: 0.2924, test_loss: 1.3577, test_f1: 0.6112
 epoch: 90, train_loss: 0.2984, test_loss: 1.3710, test_f1: 0.6043
 epoch: 91, train_loss: 0.2867, test_loss: 1.4291, test_f1: 0.6215
 epoch: 92, train_loss: 0.2925, test_loss: 1.3484, test_f1: 0.6461
 epoch: 93, train_loss: 0.2820, test_loss: 1.3361, test_f1: 0.6325
 epoch: 94, train_loss: 0.2933, test_loss: 1.4219, test_f1: 0.6345
 epoch: 95, train_loss: 0.2846, test_loss: 1.4871, test_f1: 0.6079
 epoch: 96, train_loss: 0.2904, test_loss: 1.4908, test_f1: 0.6199
 epoch: 97, train_loss: 0.2740, test_loss: 1.4172, test_f1: 0.6233
 epoch: 98, train_loss: 0.2755, test_loss: 1.5229, test_f1: 0.6142
 epoch: 99, train_loss: 0.2721, test_loss: 1.4559, test_f1: 0.6267
##################ITERATION #6 ****************************************
 epoch: 0, train_loss: 1.3271, test_loss: 1.3335, test_f1: 0.2574
 epoch: 1, train_loss: 1.0814, test_loss: 1.2634, test_f1: 0.2355
 epoch: 2, train_loss: 1.0220, test_loss: 1.1452, test_f1: 0.3379
 epoch: 3, train_loss: 1.0020, test_loss: 1.1293, test_f1: 0.4355
 epoch: 4, train_loss: 0.9458, test_loss: 1.0749, test_f1: 0.4664
 epoch: 5, train_loss: 0.9190, test_loss: 1.0037, test_f1: 0.5072
 epoch: 6, train_loss: 0.8951, test_loss: 0.9779, test_f1: 0.5211
 epoch: 7, train_loss: 0.8718, test_loss: 0.9097, test_f1: 0.5534
 epoch: 8, train_loss: 0.8635, test_loss: 0.9415, test_f1: 0.5856
 epoch: 9, train_loss: 0.8354, test_loss: 0.9084, test_f1: 0.5912
 epoch: 10, train_loss: 0.8252, test_loss: 0.9489, test_f1: 0.5575
 epoch: 11, train_loss: 0.8083, test_loss: 0.9424, test_f1: 0.5649
 epoch: 12, train_loss: 0.7994, test_loss: 0.9627, test_f1: 0.5704
 epoch: 13, train_loss: 0.7878, test_loss: 0.9099, test_f1: 0.6075
 epoch: 14, train_loss: 0.7980, test_loss: 1.0321, test_f1: 0.5618
 epoch: 15, train_loss: 0.7703, test_loss: 0.9797, test_f1: 0.5884
 epoch: 16, train_loss: 0.7601, test_loss: 0.9025, test_f1: 0.5880
 epoch: 17, train_loss: 0.7343, test_loss: 0.8788, test_f1: 0.5885
 epoch: 18, train_loss: 0.7269, test_loss: 1.0475, test_f1: 0.5715
 epoch: 19, train_loss: 0.7106, test_loss: 0.9260, test_f1: 0.5913
 epoch: 20, train_loss: 0.6851, test_loss: 0.9663, test_f1: 0.5600
 epoch: 21, train_loss: 0.6870, test_loss: 0.9525, test_f1: 0.5589
 epoch: 22, train_loss: 0.6786, test_loss: 0.9376, test_f1: 0.5539
 epoch: 23, train_loss: 0.6529, test_loss: 0.9303, test_f1: 0.5726
 epoch: 24, train_loss: 0.6526, test_loss: 0.9399, test_f1: 0.5924
 epoch: 25, train_loss: 0.6427, test_loss: 0.8793, test_f1: 0.6254
 epoch: 26, train_loss: 0.6227, test_loss: 0.9087, test_f1: 0.5662
 epoch: 27, train_loss: 0.6461, test_loss: 1.0412, test_f1: 0.5285
 epoch: 28, train_loss: 0.6524, test_loss: 0.9476, test_f1: 0.6029
 epoch: 29, train_loss: 0.6346, test_loss: 0.8865, test_f1: 0.6254
 epoch: 30, train_loss: 0.6035, test_loss: 0.9764, test_f1: 0.5997
 epoch: 31, train_loss: 0.5963, test_loss: 0.9446, test_f1: 0.5974
 epoch: 32, train_loss: 0.5888, test_loss: 0.9226, test_f1: 0.6094
 epoch: 33, train_loss: 0.5756, test_loss: 0.9902, test_f1: 0.5812
 epoch: 34, train_loss: 0.5653, test_loss: 0.8669, test_f1: 0.5968
 epoch: 35, train_loss: 0.5725, test_loss: 1.0345, test_f1: 0.5327
 epoch: 36, train_loss: 0.5547, test_loss: 0.8904, test_f1: 0.6100
 epoch: 37, train_loss: 0.5550, test_loss: 0.9435, test_f1: 0.6108
 epoch: 38, train_loss: 0.5374, test_loss: 1.0419, test_f1: 0.5884
 epoch: 39, train_loss: 0.5314, test_loss: 1.2166, test_f1: 0.5599
 epoch: 40, train_loss: 0.5235, test_loss: 1.0119, test_f1: 0.5980
 epoch: 41, train_loss: 0.5157, test_loss: 0.9186, test_f1: 0.6560
 epoch: 42, train_loss: 0.5102, test_loss: 1.0261, test_f1: 0.5910
 epoch: 43, train_loss: 0.5094, test_loss: 0.9934, test_f1: 0.5916
 epoch: 44, train_loss: 0.4834, test_loss: 0.9283, test_f1: 0.6177
 epoch: 45, train_loss: 0.4735, test_loss: 0.9773, test_f1: 0.6367
 epoch: 46, train_loss: 0.4780, test_loss: 0.9637, test_f1: 0.6332
 epoch: 47, train_loss: 0.5010, test_loss: 1.0402, test_f1: 0.6274
 epoch: 48, train_loss: 0.4872, test_loss: 0.9449, test_f1: 0.6062
 epoch: 49, train_loss: 0.4663, test_loss: 1.1255, test_f1: 0.5890
 epoch: 50, train_loss: 0.4397, test_loss: 0.9004, test_f1: 0.6130
 epoch: 51, train_loss: 0.4248, test_loss: 0.9699, test_f1: 0.6149
 epoch: 52, train_loss: 0.3981, test_loss: 1.0429, test_f1: 0.6026
 epoch: 53, train_loss: 0.3932, test_loss: 1.0128, test_f1: 0.6418
 epoch: 54, train_loss: 0.3701, test_loss: 1.0072, test_f1: 0.6638
 epoch: 55, train_loss: 0.3736, test_loss: 1.0273, test_f1: 0.6317
 epoch: 56, train_loss: 0.3767, test_loss: 1.0648, test_f1: 0.6470
 epoch: 57, train_loss: 0.3615, test_loss: 1.2194, test_f1: 0.5993
 epoch: 58, train_loss: 0.3679, test_loss: 1.0500, test_f1: 0.6398
 epoch: 59, train_loss: 0.3563, test_loss: 1.0965, test_f1: 0.6187
 epoch: 60, train_loss: 0.3331, test_loss: 1.0485, test_f1: 0.6050
 epoch: 61, train_loss: 0.3224, test_loss: 1.1611, test_f1: 0.5941
 epoch: 62, train_loss: 0.3400, test_loss: 1.1398, test_f1: 0.6041
 epoch: 63, train_loss: 0.3319, test_loss: 1.0930, test_f1: 0.6375
 epoch: 64, train_loss: 0.3405, test_loss: 1.1834, test_f1: 0.6153
 epoch: 65, train_loss: 0.3304, test_loss: 1.1118, test_f1: 0.6523
 epoch: 66, train_loss: 0.3237, test_loss: 1.1725, test_f1: 0.6253
 epoch: 67, train_loss: 0.3056, test_loss: 1.1926, test_f1: 0.5956
 epoch: 68, train_loss: 0.3053, test_loss: 1.1586, test_f1: 0.6341
 epoch: 69, train_loss: 0.3171, test_loss: 1.2723, test_f1: 0.6096
 epoch: 70, train_loss: 0.3215, test_loss: 1.1444, test_f1: 0.6148
 epoch: 71, train_loss: 0.3081, test_loss: 1.1490, test_f1: 0.6219
 epoch: 72, train_loss: 0.3026, test_loss: 1.2705, test_f1: 0.6149
 epoch: 73, train_loss: 0.3069, test_loss: 1.2189, test_f1: 0.6130
 epoch: 74, train_loss: 0.3035, test_loss: 1.2703, test_f1: 0.6077
 epoch: 75, train_loss: 0.2825, test_loss: 1.2990, test_f1: 0.6054
 epoch: 76, train_loss: 0.2818, test_loss: 1.2352, test_f1: 0.6458
 epoch: 77, train_loss: 0.2857, test_loss: 1.3499, test_f1: 0.6023
 epoch: 78, train_loss: 0.2789, test_loss: 1.2072, test_f1: 0.6493
 epoch: 79, train_loss: 0.2668, test_loss: 1.2631, test_f1: 0.6071
 epoch: 80, train_loss: 0.2695, test_loss: 1.2239, test_f1: 0.6138
 epoch: 81, train_loss: 0.2704, test_loss: 1.4100, test_f1: 0.5895
 epoch: 82, train_loss: 0.2792, test_loss: 1.2880, test_f1: 0.6086
 epoch: 83, train_loss: 0.2727, test_loss: 1.4711, test_f1: 0.5890
 epoch: 84, train_loss: 0.2787, test_loss: 1.2594, test_f1: 0.6460
 epoch: 85, train_loss: 0.2656, test_loss: 1.3810, test_f1: 0.6111
 epoch: 86, train_loss: 0.2586, test_loss: 1.6259, test_f1: 0.5519
 epoch: 87, train_loss: 0.2614, test_loss: 1.3491, test_f1: 0.6116
 epoch: 88, train_loss: 0.2469, test_loss: 1.3504, test_f1: 0.6122
 epoch: 89, train_loss: 0.2596, test_loss: 1.5022, test_f1: 0.6120
 epoch: 90, train_loss: 0.2567, test_loss: 1.2489, test_f1: 0.6156
 epoch: 91, train_loss: 0.2594, test_loss: 1.3677, test_f1: 0.6131
 epoch: 92, train_loss: 0.2680, test_loss: 1.3694, test_f1: 0.6075
 epoch: 93, train_loss: 0.2503, test_loss: 1.4097, test_f1: 0.6049
 epoch: 94, train_loss: 0.2538, test_loss: 1.4892, test_f1: 0.5974
 epoch: 95, train_loss: 0.2377, test_loss: 1.5273, test_f1: 0.5942
 epoch: 96, train_loss: 0.2494, test_loss: 1.3735, test_f1: 0.6178
 epoch: 97, train_loss: 0.2403, test_loss: 1.5848, test_f1: 0.5900
 epoch: 98, train_loss: 0.2198, test_loss: 1.3901, test_f1: 0.6118
 epoch: 99, train_loss: 0.2455, test_loss: 1.5880, test_f1: 0.5819
##################ITERATION #7 ****************************************
 epoch: 0, train_loss: 1.3770, test_loss: 1.2998, test_f1: 0.2260
 epoch: 1, train_loss: 1.1155, test_loss: 1.2532, test_f1: 0.2311
 epoch: 2, train_loss: 1.0251, test_loss: 1.1673, test_f1: 0.3882
 epoch: 3, train_loss: 0.9959, test_loss: 1.0227, test_f1: 0.4731
 epoch: 4, train_loss: 0.9548, test_loss: 0.9666, test_f1: 0.5184
 epoch: 5, train_loss: 0.9285, test_loss: 0.9374, test_f1: 0.5282
 epoch: 6, train_loss: 0.9051, test_loss: 0.9162, test_f1: 0.5591
 epoch: 7, train_loss: 0.8902, test_loss: 0.9180, test_f1: 0.5478
 epoch: 8, train_loss: 0.8543, test_loss: 0.9206, test_f1: 0.5518
 epoch: 9, train_loss: 0.8482, test_loss: 0.9230, test_f1: 0.5767
 epoch: 10, train_loss: 0.8358, test_loss: 0.8955, test_f1: 0.5752
 epoch: 11, train_loss: 0.8067, test_loss: 0.8830, test_f1: 0.6022
 epoch: 12, train_loss: 0.7973, test_loss: 0.8878, test_f1: 0.5832
 epoch: 13, train_loss: 0.7776, test_loss: 0.8656, test_f1: 0.5748
 epoch: 14, train_loss: 0.7773, test_loss: 0.8688, test_f1: 0.5825
 epoch: 15, train_loss: 0.7488, test_loss: 0.8680, test_f1: 0.6205
 epoch: 16, train_loss: 0.7451, test_loss: 0.9074, test_f1: 0.5749
 epoch: 17, train_loss: 0.7264, test_loss: 0.8875, test_f1: 0.6081
 epoch: 18, train_loss: 0.7136, test_loss: 0.8850, test_f1: 0.6063
 epoch: 19, train_loss: 0.7148, test_loss: 0.8880, test_f1: 0.6301
 epoch: 20, train_loss: 0.6889, test_loss: 0.9085, test_f1: 0.5967
 epoch: 21, train_loss: 0.6790, test_loss: 0.8403, test_f1: 0.6128
 epoch: 22, train_loss: 0.6768, test_loss: 0.9067, test_f1: 0.5913
 epoch: 23, train_loss: 0.6672, test_loss: 0.9265, test_f1: 0.5807
 epoch: 24, train_loss: 0.6515, test_loss: 0.8641, test_f1: 0.6216
 epoch: 25, train_loss: 0.6460, test_loss: 0.9614, test_f1: 0.5688
 epoch: 26, train_loss: 0.6380, test_loss: 0.9125, test_f1: 0.6069
 epoch: 27, train_loss: 0.6241, test_loss: 0.9002, test_f1: 0.6105
 epoch: 28, train_loss: 0.5994, test_loss: 0.8706, test_f1: 0.6269
 epoch: 29, train_loss: 0.6087, test_loss: 0.9648, test_f1: 0.6032
 epoch: 30, train_loss: 0.5817, test_loss: 0.9217, test_f1: 0.5953
 epoch: 31, train_loss: 0.5852, test_loss: 0.9514, test_f1: 0.6091
 epoch: 32, train_loss: 0.5611, test_loss: 0.9407, test_f1: 0.6106
 epoch: 33, train_loss: 0.5886, test_loss: 0.9078, test_f1: 0.6366
 epoch: 34, train_loss: 0.5762, test_loss: 0.9772, test_f1: 0.5856
 epoch: 35, train_loss: 0.5665, test_loss: 0.9182, test_f1: 0.6127
 epoch: 36, train_loss: 0.5394, test_loss: 1.0227, test_f1: 0.5837
 epoch: 37, train_loss: 0.5340, test_loss: 1.0455, test_f1: 0.5855
 epoch: 38, train_loss: 0.5393, test_loss: 0.9578, test_f1: 0.5973
 epoch: 39, train_loss: 0.5238, test_loss: 1.0520, test_f1: 0.5913
 epoch: 40, train_loss: 0.5330, test_loss: 0.9220, test_f1: 0.6087
 epoch: 41, train_loss: 0.5208, test_loss: 0.9107, test_f1: 0.6231
 epoch: 42, train_loss: 0.4925, test_loss: 0.9542, test_f1: 0.6245
 epoch: 43, train_loss: 0.4958, test_loss: 1.0441, test_f1: 0.6151
 epoch: 44, train_loss: 0.5074, test_loss: 0.9415, test_f1: 0.6109
 epoch: 45, train_loss: 0.4992, test_loss: 0.9628, test_f1: 0.6108
 epoch: 46, train_loss: 0.4626, test_loss: 1.0110, test_f1: 0.6151
 epoch: 47, train_loss: 0.4615, test_loss: 0.9845, test_f1: 0.6190
 epoch: 48, train_loss: 0.4446, test_loss: 0.9859, test_f1: 0.6176
 epoch: 49, train_loss: 0.4549, test_loss: 1.0021, test_f1: 0.6399
 epoch: 50, train_loss: 0.4588, test_loss: 0.9432, test_f1: 0.6272
 epoch: 51, train_loss: 0.4199, test_loss: 0.9348, test_f1: 0.6306
 epoch: 52, train_loss: 0.3855, test_loss: 0.9782, test_f1: 0.6404
 epoch: 53, train_loss: 0.3868, test_loss: 0.9559, test_f1: 0.6378
 epoch: 54, train_loss: 0.3625, test_loss: 1.0102, test_f1: 0.6362
 epoch: 55, train_loss: 0.3655, test_loss: 1.0194, test_f1: 0.6154
 epoch: 56, train_loss: 0.3744, test_loss: 1.0228, test_f1: 0.6423
 epoch: 57, train_loss: 0.3614, test_loss: 1.0485, test_f1: 0.6236
 epoch: 58, train_loss: 0.3505, test_loss: 1.0020, test_f1: 0.6101
 epoch: 59, train_loss: 0.3512, test_loss: 1.0149, test_f1: 0.6471
 epoch: 60, train_loss: 0.3507, test_loss: 1.0737, test_f1: 0.6283
 epoch: 61, train_loss: 0.3470, test_loss: 1.0148, test_f1: 0.6233
 epoch: 62, train_loss: 0.3517, test_loss: 1.0165, test_f1: 0.6439
 epoch: 63, train_loss: 0.3406, test_loss: 1.0353, test_f1: 0.6539
 epoch: 64, train_loss: 0.3448, test_loss: 1.0209, test_f1: 0.6401
 epoch: 65, train_loss: 0.3447, test_loss: 1.1712, test_f1: 0.5976
 epoch: 66, train_loss: 0.3215, test_loss: 1.0882, test_f1: 0.6285
 epoch: 67, train_loss: 0.3339, test_loss: 1.0991, test_f1: 0.6217
 epoch: 68, train_loss: 0.3228, test_loss: 1.1716, test_f1: 0.6399
 epoch: 69, train_loss: 0.3200, test_loss: 1.1905, test_f1: 0.6218
 epoch: 70, train_loss: 0.3021, test_loss: 1.0695, test_f1: 0.6443
 epoch: 71, train_loss: 0.3245, test_loss: 1.0302, test_f1: 0.6592
 epoch: 72, train_loss: 0.3271, test_loss: 1.0780, test_f1: 0.6324
 epoch: 73, train_loss: 0.3110, test_loss: 1.1527, test_f1: 0.6294
 epoch: 74, train_loss: 0.3166, test_loss: 1.0808, test_f1: 0.6429
 epoch: 75, train_loss: 0.2976, test_loss: 1.1897, test_f1: 0.6214
 epoch: 76, train_loss: 0.3095, test_loss: 1.0991, test_f1: 0.6585
 epoch: 77, train_loss: 0.2931, test_loss: 1.1907, test_f1: 0.6397
 epoch: 78, train_loss: 0.2849, test_loss: 1.1856, test_f1: 0.6585
 epoch: 79, train_loss: 0.2833, test_loss: 1.1316, test_f1: 0.6421
 epoch: 80, train_loss: 0.2874, test_loss: 1.1775, test_f1: 0.6623
 epoch: 81, train_loss: 0.2838, test_loss: 1.1875, test_f1: 0.6286
 epoch: 82, train_loss: 0.2862, test_loss: 1.0955, test_f1: 0.6615
 epoch: 83, train_loss: 0.2756, test_loss: 1.2737, test_f1: 0.6400
 epoch: 84, train_loss: 0.2741, test_loss: 1.1414, test_f1: 0.6559
 epoch: 85, train_loss: 0.2741, test_loss: 1.2589, test_f1: 0.6238
 epoch: 86, train_loss: 0.2900, test_loss: 1.1610, test_f1: 0.6466
 epoch: 87, train_loss: 0.2977, test_loss: 1.2148, test_f1: 0.6384
 epoch: 88, train_loss: 0.2596, test_loss: 1.2200, test_f1: 0.6451
 epoch: 89, train_loss: 0.2598, test_loss: 1.2055, test_f1: 0.6313
 epoch: 90, train_loss: 0.2708, test_loss: 1.1664, test_f1: 0.6283
 epoch: 91, train_loss: 0.2762, test_loss: 1.2445, test_f1: 0.6388
 epoch: 92, train_loss: 0.2632, test_loss: 1.2661, test_f1: 0.6315
 epoch: 93, train_loss: 0.2533, test_loss: 1.3072, test_f1: 0.6338
 epoch: 94, train_loss: 0.2565, test_loss: 1.3173, test_f1: 0.6058
 epoch: 95, train_loss: 0.2391, test_loss: 1.3024, test_f1: 0.6304
 epoch: 96, train_loss: 0.2403, test_loss: 1.2762, test_f1: 0.6232
 epoch: 97, train_loss: 0.2398, test_loss: 1.4002, test_f1: 0.6391
 epoch: 98, train_loss: 0.2433, test_loss: 1.3479, test_f1: 0.6536
 epoch: 99, train_loss: 0.2242, test_loss: 1.4047, test_f1: 0.6395
##################ITERATION #8 ****************************************
 epoch: 0, train_loss: 1.4015, test_loss: 1.3613, test_f1: 0.2260
 epoch: 1, train_loss: 1.0765, test_loss: 1.2898, test_f1: 0.2260
 epoch: 2, train_loss: 1.0137, test_loss: 1.0975, test_f1: 0.3729
 epoch: 3, train_loss: 0.9545, test_loss: 1.0258, test_f1: 0.4559
 epoch: 4, train_loss: 0.9361, test_loss: 0.9547, test_f1: 0.4988
 epoch: 5, train_loss: 0.9204, test_loss: 0.9294, test_f1: 0.5241
 epoch: 6, train_loss: 0.8878, test_loss: 0.9081, test_f1: 0.5852
 epoch: 7, train_loss: 0.8802, test_loss: 0.9040, test_f1: 0.5822
 epoch: 8, train_loss: 0.8433, test_loss: 0.8544, test_f1: 0.5882
 epoch: 9, train_loss: 0.8319, test_loss: 0.8657, test_f1: 0.5963
 epoch: 10, train_loss: 0.8220, test_loss: 0.8888, test_f1: 0.5873
 epoch: 11, train_loss: 0.8172, test_loss: 0.9226, test_f1: 0.5813
 epoch: 12, train_loss: 0.7985, test_loss: 0.8844, test_f1: 0.5918
 epoch: 13, train_loss: 0.7807, test_loss: 0.8499, test_f1: 0.6002
 epoch: 14, train_loss: 0.7767, test_loss: 0.8819, test_f1: 0.5858
 epoch: 15, train_loss: 0.7667, test_loss: 0.8579, test_f1: 0.5973
 epoch: 16, train_loss: 0.7434, test_loss: 0.9031, test_f1: 0.6036
 epoch: 17, train_loss: 0.7342, test_loss: 0.8744, test_f1: 0.6090
 epoch: 18, train_loss: 0.7324, test_loss: 0.8671, test_f1: 0.5732
 epoch: 19, train_loss: 0.7162, test_loss: 0.8697, test_f1: 0.6121
 epoch: 20, train_loss: 0.7134, test_loss: 0.9244, test_f1: 0.5963
 epoch: 21, train_loss: 0.7095, test_loss: 0.8582, test_f1: 0.6068
 epoch: 22, train_loss: 0.6943, test_loss: 0.9276, test_f1: 0.6124
 epoch: 23, train_loss: 0.6806, test_loss: 0.9112, test_f1: 0.5728
 epoch: 24, train_loss: 0.6754, test_loss: 0.8947, test_f1: 0.6198
 epoch: 25, train_loss: 0.6733, test_loss: 0.9205, test_f1: 0.6274
 epoch: 26, train_loss: 0.6576, test_loss: 0.8914, test_f1: 0.6266
 epoch: 27, train_loss: 0.6480, test_loss: 0.9458, test_f1: 0.6106
 epoch: 28, train_loss: 0.6399, test_loss: 0.9707, test_f1: 0.6242
 epoch: 29, train_loss: 0.6350, test_loss: 0.9181, test_f1: 0.6346
 epoch: 30, train_loss: 0.6299, test_loss: 0.9456, test_f1: 0.6149
 epoch: 31, train_loss: 0.6220, test_loss: 1.0538, test_f1: 0.6060
 epoch: 32, train_loss: 0.6162, test_loss: 1.0519, test_f1: 0.5824
 epoch: 33, train_loss: 0.6035, test_loss: 0.9003, test_f1: 0.6275
 epoch: 34, train_loss: 0.5785, test_loss: 0.9487, test_f1: 0.6191
 epoch: 35, train_loss: 0.5832, test_loss: 0.8900, test_f1: 0.6440
 epoch: 36, train_loss: 0.5746, test_loss: 1.0242, test_f1: 0.5859
 epoch: 37, train_loss: 0.5591, test_loss: 1.0038, test_f1: 0.6072
 epoch: 38, train_loss: 0.5654, test_loss: 0.9987, test_f1: 0.5797
 epoch: 39, train_loss: 0.5584, test_loss: 0.9923, test_f1: 0.6309
 epoch: 40, train_loss: 0.5438, test_loss: 0.9500, test_f1: 0.6476
 epoch: 41, train_loss: 0.5288, test_loss: 1.0273, test_f1: 0.6122
 epoch: 42, train_loss: 0.5365, test_loss: 0.9925, test_f1: 0.6058
 epoch: 43, train_loss: 0.5529, test_loss: 0.9251, test_f1: 0.6364
 epoch: 44, train_loss: 0.5266, test_loss: 1.0901, test_f1: 0.6084
 epoch: 45, train_loss: 0.5295, test_loss: 1.0635, test_f1: 0.6035
 epoch: 46, train_loss: 0.5079, test_loss: 1.0108, test_f1: 0.6091
 epoch: 47, train_loss: 0.5038, test_loss: 1.0343, test_f1: 0.6251
 epoch: 48, train_loss: 0.5244, test_loss: 1.1524, test_f1: 0.5923
 epoch: 49, train_loss: 0.4843, test_loss: 1.1343, test_f1: 0.5934
 epoch: 50, train_loss: 0.4989, test_loss: 1.1192, test_f1: 0.6146
 epoch: 51, train_loss: 0.4569, test_loss: 1.0496, test_f1: 0.6297
 epoch: 52, train_loss: 0.4483, test_loss: 1.0160, test_f1: 0.6381
 epoch: 53, train_loss: 0.4247, test_loss: 1.0322, test_f1: 0.6554
 epoch: 54, train_loss: 0.4192, test_loss: 1.0627, test_f1: 0.6251
 epoch: 55, train_loss: 0.4065, test_loss: 1.1009, test_f1: 0.6342
 epoch: 56, train_loss: 0.4055, test_loss: 1.1255, test_f1: 0.6270
 epoch: 57, train_loss: 0.3954, test_loss: 1.1300, test_f1: 0.6432
 epoch: 58, train_loss: 0.3996, test_loss: 1.0428, test_f1: 0.6332
 epoch: 59, train_loss: 0.4058, test_loss: 1.0925, test_f1: 0.6430
 epoch: 60, train_loss: 0.3976, test_loss: 1.1311, test_f1: 0.6472
 epoch: 61, train_loss: 0.3822, test_loss: 1.1339, test_f1: 0.6488
 epoch: 62, train_loss: 0.3669, test_loss: 1.1324, test_f1: 0.6529
 epoch: 63, train_loss: 0.3796, test_loss: 1.1484, test_f1: 0.6272
 epoch: 64, train_loss: 0.3839, test_loss: 1.2222, test_f1: 0.6104
 epoch: 65, train_loss: 0.3780, test_loss: 1.1569, test_f1: 0.6465
 epoch: 66, train_loss: 0.3746, test_loss: 1.1378, test_f1: 0.6442
 epoch: 67, train_loss: 0.3783, test_loss: 1.1184, test_f1: 0.6387
 epoch: 68, train_loss: 0.3605, test_loss: 1.2096, test_f1: 0.6384
 epoch: 69, train_loss: 0.3589, test_loss: 1.1185, test_f1: 0.6487
 epoch: 70, train_loss: 0.3443, test_loss: 1.1915, test_f1: 0.6531
 epoch: 71, train_loss: 0.3592, test_loss: 1.2396, test_f1: 0.6496
 epoch: 72, train_loss: 0.3386, test_loss: 1.3187, test_f1: 0.6313
 epoch: 73, train_loss: 0.3505, test_loss: 1.1917, test_f1: 0.6520
 epoch: 74, train_loss: 0.3483, test_loss: 1.1553, test_f1: 0.6583
 epoch: 75, train_loss: 0.3422, test_loss: 1.3161, test_f1: 0.6406
 epoch: 76, train_loss: 0.3346, test_loss: 1.2829, test_f1: 0.6260
 epoch: 77, train_loss: 0.3336, test_loss: 1.2571, test_f1: 0.6472
 epoch: 78, train_loss: 0.3333, test_loss: 1.1997, test_f1: 0.6495
 epoch: 79, train_loss: 0.3271, test_loss: 1.2831, test_f1: 0.6591
 epoch: 80, train_loss: 0.3266, test_loss: 1.3447, test_f1: 0.6463
 epoch: 81, train_loss: 0.3216, test_loss: 1.2828, test_f1: 0.6550
 epoch: 82, train_loss: 0.3044, test_loss: 1.2857, test_f1: 0.6461
 epoch: 83, train_loss: 0.2908, test_loss: 1.2800, test_f1: 0.6553
 epoch: 84, train_loss: 0.3240, test_loss: 1.3658, test_f1: 0.6311
 epoch: 85, train_loss: 0.3118, test_loss: 1.2913, test_f1: 0.6554
 epoch: 86, train_loss: 0.3132, test_loss: 1.2794, test_f1: 0.6520
 epoch: 87, train_loss: 0.3106, test_loss: 1.3121, test_f1: 0.6522
 epoch: 88, train_loss: 0.2858, test_loss: 1.2110, test_f1: 0.6549
 epoch: 89, train_loss: 0.2857, test_loss: 1.3296, test_f1: 0.6413
 epoch: 90, train_loss: 0.3016, test_loss: 1.3426, test_f1: 0.6555
 epoch: 91, train_loss: 0.2984, test_loss: 1.3837, test_f1: 0.6292
 epoch: 92, train_loss: 0.2969, test_loss: 1.4421, test_f1: 0.6251
 epoch: 93, train_loss: 0.3072, test_loss: 1.3079, test_f1: 0.6367
 epoch: 94, train_loss: 0.2972, test_loss: 1.4572, test_f1: 0.6444
 epoch: 95, train_loss: 0.2903, test_loss: 1.3242, test_f1: 0.6515
 epoch: 96, train_loss: 0.2588, test_loss: 1.3418, test_f1: 0.6545
 epoch: 97, train_loss: 0.2578, test_loss: 1.3815, test_f1: 0.6461
 epoch: 98, train_loss: 0.2673, test_loss: 1.4355, test_f1: 0.6419
 epoch: 99, train_loss: 0.2596, test_loss: 1.3290, test_f1: 0.6630
##################ITERATION #9 ****************************************
 epoch: 0, train_loss: 1.4156, test_loss: 1.3119, test_f1: 0.2671
 epoch: 1, train_loss: 1.1244, test_loss: 1.2048, test_f1: 0.2502
 epoch: 2, train_loss: 1.0427, test_loss: 1.1571, test_f1: 0.3904
 epoch: 3, train_loss: 1.0207, test_loss: 1.0623, test_f1: 0.3970
 epoch: 4, train_loss: 0.9610, test_loss: 1.0270, test_f1: 0.4726
 epoch: 5, train_loss: 0.9488, test_loss: 1.0175, test_f1: 0.4937
 epoch: 6, train_loss: 0.9136, test_loss: 0.9609, test_f1: 0.5313
 epoch: 7, train_loss: 0.8982, test_loss: 1.0045, test_f1: 0.5135
 epoch: 8, train_loss: 0.8766, test_loss: 0.9020, test_f1: 0.5359
 epoch: 9, train_loss: 0.8483, test_loss: 0.9188, test_f1: 0.5549
 epoch: 10, train_loss: 0.8293, test_loss: 0.9215, test_f1: 0.5715
 epoch: 11, train_loss: 0.8358, test_loss: 0.9313, test_f1: 0.5661
 epoch: 12, train_loss: 0.8198, test_loss: 0.8530, test_f1: 0.5887
 epoch: 13, train_loss: 0.7880, test_loss: 0.9318, test_f1: 0.5331
 epoch: 14, train_loss: 0.7932, test_loss: 0.9252, test_f1: 0.5439
 epoch: 15, train_loss: 0.7778, test_loss: 1.0137, test_f1: 0.5474
 epoch: 16, train_loss: 0.7564, test_loss: 0.9339, test_f1: 0.5472
 epoch: 17, train_loss: 0.7471, test_loss: 0.8647, test_f1: 0.5569
 epoch: 18, train_loss: 0.7340, test_loss: 0.8520, test_f1: 0.5816
 epoch: 19, train_loss: 0.7321, test_loss: 1.0535, test_f1: 0.5401
 epoch: 20, train_loss: 0.7251, test_loss: 0.8869, test_f1: 0.5808
 epoch: 21, train_loss: 0.6977, test_loss: 0.9145, test_f1: 0.5822
 epoch: 22, train_loss: 0.6972, test_loss: 0.8914, test_f1: 0.5852
 epoch: 23, train_loss: 0.6977, test_loss: 0.8960, test_f1: 0.6007
 epoch: 24, train_loss: 0.6959, test_loss: 0.9104, test_f1: 0.5623
 epoch: 25, train_loss: 0.6825, test_loss: 0.9753, test_f1: 0.5364
 epoch: 26, train_loss: 0.6577, test_loss: 0.9521, test_f1: 0.5762
 epoch: 27, train_loss: 0.6491, test_loss: 0.8013, test_f1: 0.6060
 epoch: 28, train_loss: 0.6342, test_loss: 0.9496, test_f1: 0.5965
 epoch: 29, train_loss: 0.6227, test_loss: 1.0344, test_f1: 0.5725
 epoch: 30, train_loss: 0.6204, test_loss: 0.9108, test_f1: 0.5849
 epoch: 31, train_loss: 0.6085, test_loss: 0.9591, test_f1: 0.5832
 epoch: 32, train_loss: 0.6004, test_loss: 1.0244, test_f1: 0.5688
 epoch: 33, train_loss: 0.5934, test_loss: 0.9594, test_f1: 0.5762
 epoch: 34, train_loss: 0.5890, test_loss: 0.9631, test_f1: 0.5945
 epoch: 35, train_loss: 0.5879, test_loss: 1.0424, test_f1: 0.5924
 epoch: 36, train_loss: 0.5649, test_loss: 1.0430, test_f1: 0.5845
 epoch: 37, train_loss: 0.5697, test_loss: 0.9767, test_f1: 0.5982
 epoch: 38, train_loss: 0.5782, test_loss: 0.9674, test_f1: 0.6171
 epoch: 39, train_loss: 0.5727, test_loss: 1.0544, test_f1: 0.5692
 epoch: 40, train_loss: 0.5279, test_loss: 0.9408, test_f1: 0.6172
 epoch: 41, train_loss: 0.5372, test_loss: 1.1457, test_f1: 0.5906
 epoch: 42, train_loss: 0.5407, test_loss: 1.0813, test_f1: 0.6040
 epoch: 43, train_loss: 0.5282, test_loss: 1.0504, test_f1: 0.5975
 epoch: 44, train_loss: 0.5222, test_loss: 1.0127, test_f1: 0.6383
 epoch: 45, train_loss: 0.5037, test_loss: 1.0019, test_f1: 0.6413
 epoch: 46, train_loss: 0.5067, test_loss: 1.0684, test_f1: 0.6307
 epoch: 47, train_loss: 0.5040, test_loss: 1.1277, test_f1: 0.6141
 epoch: 48, train_loss: 0.4980, test_loss: 0.9777, test_f1: 0.6436
 epoch: 49, train_loss: 0.4941, test_loss: 1.0188, test_f1: 0.6257
 epoch: 50, train_loss: 0.4852, test_loss: 1.0760, test_f1: 0.6309
 epoch: 51, train_loss: 0.4591, test_loss: 1.0266, test_f1: 0.6569
 epoch: 52, train_loss: 0.4365, test_loss: 1.0645, test_f1: 0.6418
 epoch: 53, train_loss: 0.4316, test_loss: 1.0402, test_f1: 0.6481
 epoch: 54, train_loss: 0.4077, test_loss: 1.0632, test_f1: 0.6577
 epoch: 55, train_loss: 0.3947, test_loss: 1.0781, test_f1: 0.6457
 epoch: 56, train_loss: 0.3827, test_loss: 1.1789, test_f1: 0.6255
 epoch: 57, train_loss: 0.3970, test_loss: 1.1204, test_f1: 0.6116
 epoch: 58, train_loss: 0.4129, test_loss: 1.1285, test_f1: 0.6141
 epoch: 59, train_loss: 0.3963, test_loss: 1.1045, test_f1: 0.6400
 epoch: 60, train_loss: 0.3872, test_loss: 1.1052, test_f1: 0.6590
 epoch: 61, train_loss: 0.3777, test_loss: 1.0968, test_f1: 0.6616
 epoch: 62, train_loss: 0.3758, test_loss: 1.1806, test_f1: 0.6431
 epoch: 63, train_loss: 0.3743, test_loss: 1.0587, test_f1: 0.6478
 epoch: 64, train_loss: 0.3549, test_loss: 1.1227, test_f1: 0.6619
 epoch: 65, train_loss: 0.3584, test_loss: 1.1171, test_f1: 0.6555
 epoch: 66, train_loss: 0.3588, test_loss: 1.1443, test_f1: 0.6603
 epoch: 67, train_loss: 0.3765, test_loss: 1.1962, test_f1: 0.6316
 epoch: 68, train_loss: 0.3494, test_loss: 1.1045, test_f1: 0.6490
 epoch: 69, train_loss: 0.3478, test_loss: 1.0988, test_f1: 0.6732
 epoch: 70, train_loss: 0.3319, test_loss: 1.1139, test_f1: 0.6510
 epoch: 71, train_loss: 0.3468, test_loss: 1.1361, test_f1: 0.6635
 epoch: 72, train_loss: 0.3499, test_loss: 1.1694, test_f1: 0.6564
 epoch: 73, train_loss: 0.3520, test_loss: 1.1464, test_f1: 0.6397
 epoch: 74, train_loss: 0.3498, test_loss: 1.1612, test_f1: 0.6555
 epoch: 75, train_loss: 0.3362, test_loss: 1.2034, test_f1: 0.6260
 epoch: 76, train_loss: 0.3415, test_loss: 1.1934, test_f1: 0.6397
 epoch: 77, train_loss: 0.3415, test_loss: 1.1622, test_f1: 0.6585
 epoch: 78, train_loss: 0.3288, test_loss: 1.1276, test_f1: 0.6546
 epoch: 79, train_loss: 0.3274, test_loss: 1.2880, test_f1: 0.6470
 epoch: 80, train_loss: 0.3140, test_loss: 1.1960, test_f1: 0.6663
 epoch: 81, train_loss: 0.3171, test_loss: 1.2389, test_f1: 0.6269
 epoch: 82, train_loss: 0.3309, test_loss: 1.2282, test_f1: 0.6446
 epoch: 83, train_loss: 0.2954, test_loss: 1.3088, test_f1: 0.6183
 epoch: 84, train_loss: 0.3184, test_loss: 1.1669, test_f1: 0.6633
 epoch: 85, train_loss: 0.3023, test_loss: 1.1776, test_f1: 0.6456
 epoch: 86, train_loss: 0.3062, test_loss: 1.1525, test_f1: 0.6960
 epoch: 87, train_loss: 0.3103, test_loss: 1.2131, test_f1: 0.6670
 epoch: 88, train_loss: 0.3080, test_loss: 1.2029, test_f1: 0.6748
 epoch: 89, train_loss: 0.3016, test_loss: 1.4367, test_f1: 0.6237
 epoch: 90, train_loss: 0.2884, test_loss: 1.2386, test_f1: 0.6709
 epoch: 91, train_loss: 0.2810, test_loss: 1.2257, test_f1: 0.6713
 epoch: 92, train_loss: 0.2661, test_loss: 1.2677, test_f1: 0.6676
 epoch: 93, train_loss: 0.2731, test_loss: 1.3276, test_f1: 0.6684
 epoch: 94, train_loss: 0.2780, test_loss: 1.2884, test_f1: 0.6449
 epoch: 95, train_loss: 0.2802, test_loss: 1.2702, test_f1: 0.6635
 epoch: 96, train_loss: 0.2784, test_loss: 1.2712, test_f1: 0.6836
 epoch: 97, train_loss: 0.2730, test_loss: 1.2300, test_f1: 0.6750
 epoch: 98, train_loss: 0.2802, test_loss: 1.2550, test_f1: 0.6674
 epoch: 99, train_loss: 0.2843, test_loss: 1.3656, test_f1: 0.6436

Training completed in 478.95 seconds
Best F1: 0.7021 at epoch 74
Mean F1 across iterations: 0.6693  0.0170
========================FINAL RESULTS================================
FEGIN weighted F1: 0.7021  0.0170
python main.py --data ltspice_examples --representation component_pin --model FEGIN --layers 6 --hiddens 64 --batch_size 256 --lr 0.001 --emb_size 128 --epochs 100 --save_appendix component_pin_L6_H64_BS256_LR0.001_E128 --no_val
-----



STDERR:
  File "main.py", line 370, in <module>
    main()
  File "main.py", line 254, in main
    dataset = dataset_class(
  File "/home/philip/projects/ltspice_examples_code_repo/Circuit-Completion-Using-GNNs/component_classification_with_link_prediction_head/evaluation/FEGIN/kernel/circuit_datasets.py", line 15, in __init__
    self.data, self.slices = torch.load(self.processed_paths[0])
  File "/home/philip/.local/lib/python3.8/site-packages/torch/serialization.py", line 1040, in load
    warnings.warn(
  File "/usr/lib/python3.8/warnings.py", line 109, in _showwarnmsg
    sw(msg.message, msg.category, msg.filename, msg.lineno,
  File "main.py", line 47, in warn_with_traceback
    traceback.print_stack(file=log)
/home/philip/projects/ltspice_examples_code_repo/Circuit-Completion-Using-GNNs/component_classification_with_link_prediction_head/evaluation/FEGIN/kernel/circuit_datasets.py:15: FutureWarning: You are using `torch.load` with `weights_only=False` (the current default value), which uses the default pickle module implicitly. It is possible to construct malicious pickle data which will execute arbitrary code during unpickling (See https://github.com/pytorch/pytorch/blob/main/SECURITY.md#untrusted-models for more details). In a future release, the default value for `weights_only` will be flipped to `True`. This limits the functions that could be executed during unpickling. Arbitrary objects will no longer be allowed to be loaded via this mode unless they are explicitly allowlisted by the user via `torch.serialization.add_safe_globals`. We recommend you start setting `weights_only=True` for any use case where you don't have full control of the loaded file. Please open an issue on GitHub for any issues related to this experimental feature.
  self.data, self.slices = torch.load(self.processed_paths[0])
