STDOUT:
Results will be saved in /home/philip/projects/ltspice_examples_code_repo/Circuit-Completion-Using-GNNs/component_classification_with_link_prediction_head/evaluation/FEGIN/results/model_FEGIN_dataset_ltspice_demos
Command line input: python main.py --data ltspice_demos --representation component_pin --model FEGIN --layers 6 --hiddens 32 --batch_size 64 --lr 0.01 --emb_size 250 --epochs 100 --save_appendix component_pin_L6_H32_BS64_LR0.01_E250 --no_val
 is saved.
-----
ltspice_demos - FEGIN
Using 6 layers, 32 hidden units, h = 2
Loading component_pin representation dataset
ENTERED
Training FEGIN on component_pin representation
Train: 1565, Test: 383
##################ITERATION #0 ****************************************
 epoch: 0, train_loss: 1.2614, test_loss: 1.2463, test_f1: 0.3535
 epoch: 1, train_loss: 1.1630, test_loss: 1.3506, test_f1: 0.3335
 epoch: 2, train_loss: 1.0466, test_loss: 1.1081, test_f1: 0.4947
 epoch: 3, train_loss: 0.9493, test_loss: 1.1180, test_f1: 0.4621
 epoch: 4, train_loss: 0.8932, test_loss: 2.1395, test_f1: 0.4063
 epoch: 5, train_loss: 0.8480, test_loss: 1.0727, test_f1: 0.5357
 epoch: 6, train_loss: 0.8111, test_loss: 1.6561, test_f1: 0.3867
 epoch: 7, train_loss: 0.8004, test_loss: 0.9301, test_f1: 0.5955
 epoch: 8, train_loss: 0.8116, test_loss: 0.9444, test_f1: 0.5699
 epoch: 9, train_loss: 0.8101, test_loss: 1.1156, test_f1: 0.5261
 epoch: 10, train_loss: 0.8659, test_loss: 1.0020, test_f1: 0.5767
 epoch: 11, train_loss: 0.8061, test_loss: 1.0191, test_f1: 0.5706
 epoch: 12, train_loss: 0.7850, test_loss: 1.0776, test_f1: 0.5010
 epoch: 13, train_loss: 0.7701, test_loss: 1.2867, test_f1: 0.4716
 epoch: 14, train_loss: 0.7839, test_loss: 0.8708, test_f1: 0.5246
 epoch: 15, train_loss: 0.7636, test_loss: 1.0656, test_f1: 0.5340
 epoch: 16, train_loss: 0.7690, test_loss: 1.2581, test_f1: 0.4923
 epoch: 17, train_loss: 0.7594, test_loss: 1.1276, test_f1: 0.4999
 epoch: 18, train_loss: 0.7785, test_loss: 0.9336, test_f1: 0.6080
 epoch: 19, train_loss: 0.7274, test_loss: 1.0264, test_f1: 0.4316
 epoch: 20, train_loss: 0.7360, test_loss: 1.0674, test_f1: 0.5276
 epoch: 21, train_loss: 0.7540, test_loss: 0.9810, test_f1: 0.6378
 epoch: 22, train_loss: 0.7225, test_loss: 1.1028, test_f1: 0.5718
 epoch: 23, train_loss: 0.7474, test_loss: 1.1083, test_f1: 0.5577
 epoch: 24, train_loss: 0.7386, test_loss: 0.8876, test_f1: 0.6343
 epoch: 25, train_loss: 0.7158, test_loss: 1.1551, test_f1: 0.5978
 epoch: 26, train_loss: 0.6951, test_loss: 0.9347, test_f1: 0.5911
 epoch: 27, train_loss: 0.7185, test_loss: 0.9192, test_f1: 0.6178
 epoch: 28, train_loss: 0.6846, test_loss: 0.9930, test_f1: 0.6099
 epoch: 29, train_loss: 0.6817, test_loss: 1.1340, test_f1: 0.5881
 epoch: 30, train_loss: 0.6642, test_loss: 0.9075, test_f1: 0.6393
 epoch: 31, train_loss: 0.7033, test_loss: 1.3196, test_f1: 0.5074
 epoch: 32, train_loss: 0.7070, test_loss: 1.0589, test_f1: 0.5543
 epoch: 33, train_loss: 0.6841, test_loss: 1.0331, test_f1: 0.6344
 epoch: 34, train_loss: 0.6956, test_loss: 1.1906, test_f1: 0.5208
 epoch: 35, train_loss: 0.6611, test_loss: 0.9434, test_f1: 0.6797
 epoch: 36, train_loss: 0.6791, test_loss: 1.0802, test_f1: 0.5608
 epoch: 37, train_loss: 0.6775, test_loss: 0.9686, test_f1: 0.6131
 epoch: 38, train_loss: 0.6417, test_loss: 1.0741, test_f1: 0.5780
 epoch: 39, train_loss: 0.6516, test_loss: 1.1555, test_f1: 0.6230
 epoch: 40, train_loss: 0.6541, test_loss: 1.1720, test_f1: 0.5067
 epoch: 41, train_loss: 0.6677, test_loss: 1.0460, test_f1: 0.6519
 epoch: 42, train_loss: 0.6843, test_loss: 1.1126, test_f1: 0.6041
 epoch: 43, train_loss: 0.6843, test_loss: 0.9895, test_f1: 0.6627
 epoch: 44, train_loss: 0.6534, test_loss: 1.0427, test_f1: 0.5985
 epoch: 45, train_loss: 0.6540, test_loss: 1.1427, test_f1: 0.5856
 epoch: 46, train_loss: 0.6442, test_loss: 1.0402, test_f1: 0.6399
 epoch: 47, train_loss: 0.6302, test_loss: 1.1369, test_f1: 0.6280
 epoch: 48, train_loss: 0.5950, test_loss: 1.0275, test_f1: 0.6436
 epoch: 49, train_loss: 0.6236, test_loss: 0.9940, test_f1: 0.6469
 epoch: 50, train_loss: 0.6316, test_loss: 1.0399, test_f1: 0.6124
 epoch: 51, train_loss: 0.5870, test_loss: 1.0230, test_f1: 0.6274
 epoch: 52, train_loss: 0.5797, test_loss: 1.1093, test_f1: 0.6406
 epoch: 53, train_loss: 0.5641, test_loss: 1.1431, test_f1: 0.6442
 epoch: 54, train_loss: 0.5772, test_loss: 1.1219, test_f1: 0.6276
 epoch: 55, train_loss: 0.5376, test_loss: 1.0762, test_f1: 0.6562
 epoch: 56, train_loss: 0.5572, test_loss: 1.2173, test_f1: 0.6097
 epoch: 57, train_loss: 0.5270, test_loss: 1.1936, test_f1: 0.6638
 epoch: 58, train_loss: 0.5291, test_loss: 1.2782, test_f1: 0.6028
 epoch: 59, train_loss: 0.5285, test_loss: 1.4691, test_f1: 0.5816
 epoch: 60, train_loss: 0.5629, test_loss: 1.0542, test_f1: 0.6222
 epoch: 61, train_loss: 0.5487, test_loss: 1.2687, test_f1: 0.6219
 epoch: 62, train_loss: 0.5425, test_loss: 1.0624, test_f1: 0.6657
 epoch: 63, train_loss: 0.5541, test_loss: 0.9955, test_f1: 0.6515
 epoch: 64, train_loss: 0.5453, test_loss: 1.1419, test_f1: 0.6559
 epoch: 65, train_loss: 0.5060, test_loss: 1.2480, test_f1: 0.6667
 epoch: 66, train_loss: 0.5299, test_loss: 1.2152, test_f1: 0.6411
 epoch: 67, train_loss: 0.5122, test_loss: 1.4860, test_f1: 0.6642
 epoch: 68, train_loss: 0.5142, test_loss: 1.4267, test_f1: 0.6399
 epoch: 69, train_loss: 0.4872, test_loss: 1.3131, test_f1: 0.6389
 epoch: 70, train_loss: 0.5079, test_loss: 1.3688, test_f1: 0.6375
 epoch: 71, train_loss: 0.5286, test_loss: 1.4963, test_f1: 0.6349
 epoch: 72, train_loss: 0.5093, test_loss: 1.2266, test_f1: 0.6764
 epoch: 73, train_loss: 0.5053, test_loss: 1.3203, test_f1: 0.6442
 epoch: 74, train_loss: 0.4884, test_loss: 1.3058, test_f1: 0.6730
 epoch: 75, train_loss: 0.4994, test_loss: 1.2708, test_f1: 0.6272
 epoch: 76, train_loss: 0.4732, test_loss: 1.4543, test_f1: 0.6622
 epoch: 77, train_loss: 0.5042, test_loss: 1.1959, test_f1: 0.6671
 epoch: 78, train_loss: 0.4837, test_loss: 1.2750, test_f1: 0.6772
 epoch: 79, train_loss: 0.4651, test_loss: 1.2808, test_f1: 0.6378
 epoch: 80, train_loss: 0.4867, test_loss: 1.6060, test_f1: 0.6383
 epoch: 81, train_loss: 0.4736, test_loss: 1.3388, test_f1: 0.6488
 epoch: 82, train_loss: 0.4929, test_loss: 1.1616, test_f1: 0.7117
 epoch: 83, train_loss: 0.4534, test_loss: 1.4548, test_f1: 0.6989
 epoch: 84, train_loss: 0.4632, test_loss: 1.2401, test_f1: 0.6734
 epoch: 85, train_loss: 0.4413, test_loss: 1.5926, test_f1: 0.6567
 epoch: 86, train_loss: 0.4690, test_loss: 1.4021, test_f1: 0.6210
 epoch: 87, train_loss: 0.4576, test_loss: 1.3474, test_f1: 0.6592
 epoch: 88, train_loss: 0.4694, test_loss: 1.2871, test_f1: 0.6612
 epoch: 89, train_loss: 0.4453, test_loss: 1.4609, test_f1: 0.6669
 epoch: 90, train_loss: 0.4665, test_loss: 1.3548, test_f1: 0.6894
 epoch: 91, train_loss: 0.4528, test_loss: 1.3493, test_f1: 0.6596
 epoch: 92, train_loss: 0.4547, test_loss: 1.4732, test_f1: 0.6403
 epoch: 93, train_loss: 0.4450, test_loss: 1.4745, test_f1: 0.6486
 epoch: 94, train_loss: 0.4424, test_loss: 1.6746, test_f1: 0.6031
 epoch: 95, train_loss: 0.4295, test_loss: 1.5938, test_f1: 0.6260
 epoch: 96, train_loss: 0.4384, test_loss: 1.6495, test_f1: 0.6417
 epoch: 97, train_loss: 0.4583, test_loss: 1.7058, test_f1: 0.6494
 epoch: 98, train_loss: 0.4626, test_loss: 1.5458, test_f1: 0.6390
 epoch: 99, train_loss: 0.4254, test_loss: 1.6466, test_f1: 0.6804
##################ITERATION #1 ****************************************
 epoch: 0, train_loss: 1.1269, test_loss: 1.5281, test_f1: 0.2742
 epoch: 1, train_loss: 1.0332, test_loss: 1.3843, test_f1: 0.2640
 epoch: 2, train_loss: 0.9483, test_loss: 1.1599, test_f1: 0.4035
 epoch: 3, train_loss: 0.9013, test_loss: 1.1189, test_f1: 0.4819
 epoch: 4, train_loss: 0.8620, test_loss: 0.9781, test_f1: 0.5855
 epoch: 5, train_loss: 0.8412, test_loss: 1.0053, test_f1: 0.5726
 epoch: 6, train_loss: 0.8654, test_loss: 0.9866, test_f1: 0.5530
 epoch: 7, train_loss: 0.8214, test_loss: 1.0901, test_f1: 0.4348
 epoch: 8, train_loss: 0.8026, test_loss: 1.4168, test_f1: 0.3810
 epoch: 9, train_loss: 0.7983, test_loss: 1.0461, test_f1: 0.5792
 epoch: 10, train_loss: 0.8351, test_loss: 1.3864, test_f1: 0.4561
 epoch: 11, train_loss: 0.8194, test_loss: 1.1400, test_f1: 0.5319
 epoch: 12, train_loss: 0.7723, test_loss: 1.0182, test_f1: 0.5796
 epoch: 13, train_loss: 0.7788, test_loss: 1.1686, test_f1: 0.4413
 epoch: 14, train_loss: 0.7683, test_loss: 1.1018, test_f1: 0.5485
 epoch: 15, train_loss: 0.7662, test_loss: 1.1039, test_f1: 0.5236
 epoch: 16, train_loss: 0.7415, test_loss: 1.0423, test_f1: 0.5090
 epoch: 17, train_loss: 0.7722, test_loss: 1.0052, test_f1: 0.6057
 epoch: 18, train_loss: 0.7302, test_loss: 1.2483, test_f1: 0.4959
 epoch: 19, train_loss: 0.7427, test_loss: 0.9829, test_f1: 0.5984
 epoch: 20, train_loss: 0.7493, test_loss: 1.2027, test_f1: 0.5362
 epoch: 21, train_loss: 0.7240, test_loss: 1.1384, test_f1: 0.5506
 epoch: 22, train_loss: 0.7192, test_loss: 1.2135, test_f1: 0.4298
 epoch: 23, train_loss: 0.7168, test_loss: 1.1398, test_f1: 0.5458
 epoch: 24, train_loss: 0.7413, test_loss: 1.2314, test_f1: 0.5222
 epoch: 25, train_loss: 0.7481, test_loss: 1.1152, test_f1: 0.5639
 epoch: 26, train_loss: 0.7091, test_loss: 1.3732, test_f1: 0.4525
 epoch: 27, train_loss: 0.7356, test_loss: 1.1026, test_f1: 0.6163
 epoch: 28, train_loss: 0.7060, test_loss: 0.9986, test_f1: 0.5812
 epoch: 29, train_loss: 0.6802, test_loss: 0.9848, test_f1: 0.6129
 epoch: 30, train_loss: 0.6657, test_loss: 1.1048, test_f1: 0.6446
 epoch: 31, train_loss: 0.7077, test_loss: 1.0521, test_f1: 0.6071
 epoch: 32, train_loss: 0.6788, test_loss: 1.3899, test_f1: 0.5162
 epoch: 33, train_loss: 0.6920, test_loss: 1.0315, test_f1: 0.5940
 epoch: 34, train_loss: 0.6878, test_loss: 1.1753, test_f1: 0.5941
 epoch: 35, train_loss: 0.6389, test_loss: 1.2567, test_f1: 0.5982
 epoch: 36, train_loss: 0.6385, test_loss: 1.0703, test_f1: 0.6376
 epoch: 37, train_loss: 0.6405, test_loss: 1.5846, test_f1: 0.6001
 epoch: 38, train_loss: 0.6605, test_loss: 0.9815, test_f1: 0.6038
 epoch: 39, train_loss: 0.6548, test_loss: 1.1520, test_f1: 0.6474
 epoch: 40, train_loss: 0.6333, test_loss: 1.2965, test_f1: 0.6226
 epoch: 41, train_loss: 0.6119, test_loss: 1.1076, test_f1: 0.6299
 epoch: 42, train_loss: 0.6176, test_loss: 1.2312, test_f1: 0.5362
 epoch: 43, train_loss: 0.6472, test_loss: 1.4393, test_f1: 0.6313
 epoch: 44, train_loss: 0.6342, test_loss: 1.4064, test_f1: 0.4947
 epoch: 45, train_loss: 0.6738, test_loss: 1.1469, test_f1: 0.6038
 epoch: 46, train_loss: 0.6290, test_loss: 1.2059, test_f1: 0.5991
 epoch: 47, train_loss: 0.6149, test_loss: 1.1736, test_f1: 0.5705
 epoch: 48, train_loss: 0.6186, test_loss: 1.1858, test_f1: 0.6355
 epoch: 49, train_loss: 0.6205, test_loss: 1.2594, test_f1: 0.6401
 epoch: 50, train_loss: 0.6029, test_loss: 1.1656, test_f1: 0.5861
 epoch: 51, train_loss: 0.6066, test_loss: 1.0345, test_f1: 0.6468
 epoch: 52, train_loss: 0.5481, test_loss: 1.1384, test_f1: 0.6743
 epoch: 53, train_loss: 0.5708, test_loss: 1.2027, test_f1: 0.6230
 epoch: 54, train_loss: 0.5404, test_loss: 1.2094, test_f1: 0.6156
 epoch: 55, train_loss: 0.5421, test_loss: 1.1870, test_f1: 0.6312
 epoch: 56, train_loss: 0.5423, test_loss: 1.3656, test_f1: 0.6458
 epoch: 57, train_loss: 0.5471, test_loss: 1.3827, test_f1: 0.6274
 epoch: 58, train_loss: 0.5287, test_loss: 1.3076, test_f1: 0.6384
 epoch: 59, train_loss: 0.5349, test_loss: 1.3143, test_f1: 0.6378
 epoch: 60, train_loss: 0.5248, test_loss: 1.5190, test_f1: 0.6295
 epoch: 61, train_loss: 0.5017, test_loss: 1.9820, test_f1: 0.5279
 epoch: 62, train_loss: 0.5344, test_loss: 1.6570, test_f1: 0.5482
 epoch: 63, train_loss: 0.5165, test_loss: 1.3277, test_f1: 0.6596
 epoch: 64, train_loss: 0.5063, test_loss: 1.2990, test_f1: 0.6758
 epoch: 65, train_loss: 0.5123, test_loss: 1.4810, test_f1: 0.6284
 epoch: 66, train_loss: 0.4870, test_loss: 1.4994, test_f1: 0.6203
 epoch: 67, train_loss: 0.5310, test_loss: 1.5311, test_f1: 0.6498
 epoch: 68, train_loss: 0.4910, test_loss: 1.4353, test_f1: 0.6461
 epoch: 69, train_loss: 0.4872, test_loss: 1.4082, test_f1: 0.6315
 epoch: 70, train_loss: 0.5159, test_loss: 2.1376, test_f1: 0.4809
 epoch: 71, train_loss: 0.4853, test_loss: 1.3261, test_f1: 0.6284
 epoch: 72, train_loss: 0.4986, test_loss: 1.5436, test_f1: 0.5910
 epoch: 73, train_loss: 0.4975, test_loss: 1.4840, test_f1: 0.6433
 epoch: 74, train_loss: 0.4767, test_loss: 1.6688, test_f1: 0.6278
 epoch: 75, train_loss: 0.4765, test_loss: 1.4061, test_f1: 0.5979
 epoch: 76, train_loss: 0.4777, test_loss: 1.9229, test_f1: 0.5286
 epoch: 77, train_loss: 0.4856, test_loss: 1.2933, test_f1: 0.6751
 epoch: 78, train_loss: 0.5071, test_loss: 1.9168, test_f1: 0.5977
 epoch: 79, train_loss: 0.4764, test_loss: 1.4400, test_f1: 0.6201
 epoch: 80, train_loss: 0.4897, test_loss: 1.6671, test_f1: 0.6118
 epoch: 81, train_loss: 0.4774, test_loss: 1.7558, test_f1: 0.5835
 epoch: 82, train_loss: 0.4710, test_loss: 1.5236, test_f1: 0.5851
 epoch: 83, train_loss: 0.4847, test_loss: 1.9212, test_f1: 0.5548
 epoch: 84, train_loss: 0.4548, test_loss: 1.6113, test_f1: 0.6028
 epoch: 85, train_loss: 0.4678, test_loss: 1.4413, test_f1: 0.6666
 epoch: 86, train_loss: 0.4525, test_loss: 1.6006, test_f1: 0.5900
 epoch: 87, train_loss: 0.4870, test_loss: 1.7113, test_f1: 0.6005
 epoch: 88, train_loss: 0.4460, test_loss: 1.6952, test_f1: 0.5904
 epoch: 89, train_loss: 0.4573, test_loss: 1.9757, test_f1: 0.5917
 epoch: 90, train_loss: 0.4807, test_loss: 1.6148, test_f1: 0.5603
 epoch: 91, train_loss: 0.4358, test_loss: 1.5325, test_f1: 0.5875
 epoch: 92, train_loss: 0.4262, test_loss: 1.6201, test_f1: 0.5992
 epoch: 93, train_loss: 0.4382, test_loss: 1.4331, test_f1: 0.6548
 epoch: 94, train_loss: 0.4543, test_loss: 1.9896, test_f1: 0.5106
 epoch: 95, train_loss: 0.4275, test_loss: 1.6153, test_f1: 0.6297
 epoch: 96, train_loss: 0.4064, test_loss: 1.4997, test_f1: 0.5990
 epoch: 97, train_loss: 0.4018, test_loss: 1.9665, test_f1: 0.6120
 epoch: 98, train_loss: 0.4323, test_loss: 1.6007, test_f1: 0.6501
 epoch: 99, train_loss: 0.3990, test_loss: 1.7300, test_f1: 0.5991
##################ITERATION #2 ****************************************
 epoch: 0, train_loss: 1.2339, test_loss: 1.3213, test_f1: 0.3436
 epoch: 1, train_loss: 1.0633, test_loss: 1.1220, test_f1: 0.5141
 epoch: 2, train_loss: 0.9894, test_loss: 1.1027, test_f1: 0.4938
 epoch: 3, train_loss: 0.9434, test_loss: 1.1257, test_f1: 0.3748
 epoch: 4, train_loss: 0.9315, test_loss: 1.2463, test_f1: 0.3613
 epoch: 5, train_loss: 0.8934, test_loss: 0.9883, test_f1: 0.5396
 epoch: 6, train_loss: 0.8872, test_loss: 1.0323, test_f1: 0.5501
 epoch: 7, train_loss: 0.8589, test_loss: 1.0733, test_f1: 0.4420
 epoch: 8, train_loss: 0.8447, test_loss: 0.9839, test_f1: 0.5651
 epoch: 9, train_loss: 0.8443, test_loss: 1.3378, test_f1: 0.5397
 epoch: 10, train_loss: 0.8209, test_loss: 1.0295, test_f1: 0.5403
 epoch: 11, train_loss: 0.8344, test_loss: 1.1739, test_f1: 0.4117
 epoch: 12, train_loss: 0.8439, test_loss: 1.2662, test_f1: 0.5228
 epoch: 13, train_loss: 0.8147, test_loss: 1.0217, test_f1: 0.5829
 epoch: 14, train_loss: 0.8038, test_loss: 1.1475, test_f1: 0.5354
 epoch: 15, train_loss: 0.7947, test_loss: 0.9460, test_f1: 0.5793
 epoch: 16, train_loss: 0.7778, test_loss: 1.0372, test_f1: 0.5577
 epoch: 17, train_loss: 0.8134, test_loss: 1.1318, test_f1: 0.5704
 epoch: 18, train_loss: 0.7956, test_loss: 1.1404, test_f1: 0.5276
 epoch: 19, train_loss: 0.7526, test_loss: 1.0646, test_f1: 0.5763
 epoch: 20, train_loss: 0.7422, test_loss: 1.2658, test_f1: 0.4993
 epoch: 21, train_loss: 0.7548, test_loss: 1.0795, test_f1: 0.5693
 epoch: 22, train_loss: 0.7791, test_loss: 1.6028, test_f1: 0.4998
 epoch: 23, train_loss: 0.7590, test_loss: 1.0485, test_f1: 0.5828
 epoch: 24, train_loss: 0.7898, test_loss: 1.2886, test_f1: 0.5487
 epoch: 25, train_loss: 0.7375, test_loss: 1.2744, test_f1: 0.4906
 epoch: 26, train_loss: 0.7569, test_loss: 1.1728, test_f1: 0.5733
 epoch: 27, train_loss: 0.7598, test_loss: 1.0963, test_f1: 0.5592
 epoch: 28, train_loss: 0.7649, test_loss: 1.0510, test_f1: 0.5056
 epoch: 29, train_loss: 0.7270, test_loss: 1.1331, test_f1: 0.5962
 epoch: 30, train_loss: 0.7495, test_loss: 1.1799, test_f1: 0.5641
 epoch: 31, train_loss: 0.7590, test_loss: 1.1760, test_f1: 0.5185
 epoch: 32, train_loss: 0.7193, test_loss: 1.2199, test_f1: 0.5966
 epoch: 33, train_loss: 0.7001, test_loss: 1.4905, test_f1: 0.5799
 epoch: 34, train_loss: 0.7119, test_loss: 1.0610, test_f1: 0.6463
 epoch: 35, train_loss: 0.7084, test_loss: 1.3965, test_f1: 0.5574
 epoch: 36, train_loss: 0.7061, test_loss: 1.1320, test_f1: 0.6456
 epoch: 37, train_loss: 0.7337, test_loss: 1.6947, test_f1: 0.3742
 epoch: 38, train_loss: 0.7705, test_loss: 1.0712, test_f1: 0.6109
 epoch: 39, train_loss: 0.7651, test_loss: 1.0623, test_f1: 0.5582
 epoch: 40, train_loss: 0.7397, test_loss: 1.2623, test_f1: 0.5584
 epoch: 41, train_loss: 0.7162, test_loss: 1.1168, test_f1: 0.5714
 epoch: 42, train_loss: 0.6993, test_loss: 1.2690, test_f1: 0.6164
 epoch: 43, train_loss: 0.6953, test_loss: 1.0187, test_f1: 0.5932
 epoch: 44, train_loss: 0.6859, test_loss: 1.6531, test_f1: 0.4995
 epoch: 45, train_loss: 0.7163, test_loss: 1.0300, test_f1: 0.6241
 epoch: 46, train_loss: 0.7051, test_loss: 1.1205, test_f1: 0.5822
 epoch: 47, train_loss: 0.6951, test_loss: 1.2411, test_f1: 0.5639
 epoch: 48, train_loss: 0.7054, test_loss: 1.0141, test_f1: 0.6208
 epoch: 49, train_loss: 0.7004, test_loss: 1.1746, test_f1: 0.5437
 epoch: 50, train_loss: 0.6805, test_loss: 1.1357, test_f1: 0.5894
 epoch: 51, train_loss: 0.6522, test_loss: 1.3089, test_f1: 0.6028
 epoch: 52, train_loss: 0.6280, test_loss: 1.2493, test_f1: 0.6085
 epoch: 53, train_loss: 0.6236, test_loss: 1.2126, test_f1: 0.6316
 epoch: 54, train_loss: 0.6187, test_loss: 1.2583, test_f1: 0.6151
 epoch: 55, train_loss: 0.6062, test_loss: 1.3586, test_f1: 0.5939
 epoch: 56, train_loss: 0.6076, test_loss: 1.4629, test_f1: 0.5479
 epoch: 57, train_loss: 0.6084, test_loss: 1.4718, test_f1: 0.5870
 epoch: 58, train_loss: 0.6016, test_loss: 1.6448, test_f1: 0.5698
 epoch: 59, train_loss: 0.6083, test_loss: 1.9356, test_f1: 0.5414
 epoch: 60, train_loss: 0.6023, test_loss: 1.3955, test_f1: 0.5817
 epoch: 61, train_loss: 0.5879, test_loss: 1.4617, test_f1: 0.5947
 epoch: 62, train_loss: 0.5844, test_loss: 1.4132, test_f1: 0.5486
 epoch: 63, train_loss: 0.5730, test_loss: 1.5989, test_f1: 0.5511
 epoch: 64, train_loss: 0.5868, test_loss: 1.2291, test_f1: 0.5639
 epoch: 65, train_loss: 0.5938, test_loss: 1.9465, test_f1: 0.5995
 epoch: 66, train_loss: 0.5680, test_loss: 1.6461, test_f1: 0.5856
 epoch: 67, train_loss: 0.5633, test_loss: 1.4644, test_f1: 0.6177
 epoch: 68, train_loss: 0.5566, test_loss: 1.9450, test_f1: 0.5198
 epoch: 69, train_loss: 0.5626, test_loss: 1.7413, test_f1: 0.5667
 epoch: 70, train_loss: 0.5673, test_loss: 1.5599, test_f1: 0.6550
 epoch: 71, train_loss: 0.5642, test_loss: 1.5307, test_f1: 0.6022
 epoch: 72, train_loss: 0.5592, test_loss: 1.6088, test_f1: 0.6155
 epoch: 73, train_loss: 0.5669, test_loss: 1.7563, test_f1: 0.6525
 epoch: 74, train_loss: 0.5525, test_loss: 2.2812, test_f1: 0.5769
 epoch: 75, train_loss: 0.5622, test_loss: 1.9160, test_f1: 0.5759
 epoch: 76, train_loss: 0.5256, test_loss: 1.4647, test_f1: 0.5619
 epoch: 77, train_loss: 0.5687, test_loss: 1.6961, test_f1: 0.5770
 epoch: 78, train_loss: 0.6278, test_loss: 1.1848, test_f1: 0.5949
 epoch: 79, train_loss: 0.6055, test_loss: 1.1535, test_f1: 0.6107
 epoch: 80, train_loss: 0.5796, test_loss: 1.4055, test_f1: 0.6358
 epoch: 81, train_loss: 0.5589, test_loss: 1.7188, test_f1: 0.6146
 epoch: 82, train_loss: 0.5488, test_loss: 1.9629, test_f1: 0.5707
 epoch: 83, train_loss: 0.5509, test_loss: 1.5746, test_f1: 0.6054
 epoch: 84, train_loss: 0.5734, test_loss: 2.3410, test_f1: 0.4839
 epoch: 85, train_loss: 0.5973, test_loss: 1.3624, test_f1: 0.6253
 epoch: 86, train_loss: 0.5862, test_loss: 1.6232, test_f1: 0.6172
 epoch: 87, train_loss: 0.5971, test_loss: 1.3919, test_f1: 0.5569
 epoch: 88, train_loss: 0.5915, test_loss: 1.4681, test_f1: 0.5482
 epoch: 89, train_loss: 0.5600, test_loss: 1.7164, test_f1: 0.5901
 epoch: 90, train_loss: 0.5282, test_loss: 1.8046, test_f1: 0.5886
 epoch: 91, train_loss: 0.5507, test_loss: 1.9412, test_f1: 0.5542
 epoch: 92, train_loss: 0.5044, test_loss: 1.7256, test_f1: 0.6074
 epoch: 93, train_loss: 0.5318, test_loss: 1.6436, test_f1: 0.6202
 epoch: 94, train_loss: 0.5249, test_loss: 1.7574, test_f1: 0.5703
 epoch: 95, train_loss: 0.5249, test_loss: 1.8894, test_f1: 0.5830
 epoch: 96, train_loss: 0.4968, test_loss: 1.9143, test_f1: 0.5509
 epoch: 97, train_loss: 0.4974, test_loss: 1.8432, test_f1: 0.5910
 epoch: 98, train_loss: 0.4913, test_loss: 1.6312, test_f1: 0.5920
 epoch: 99, train_loss: 0.4677, test_loss: 2.0444, test_f1: 0.5773
##################ITERATION #3 ****************************************
 epoch: 0, train_loss: 1.1858, test_loss: 1.3462, test_f1: 0.2690
 epoch: 1, train_loss: 1.0211, test_loss: 1.1243, test_f1: 0.4793
 epoch: 2, train_loss: 0.9757, test_loss: 1.0199, test_f1: 0.4763
 epoch: 3, train_loss: 0.9546, test_loss: 1.2146, test_f1: 0.4780
 epoch: 4, train_loss: 0.9305, test_loss: 1.0702, test_f1: 0.5058
 epoch: 5, train_loss: 0.9018, test_loss: 0.9072, test_f1: 0.6108
 epoch: 6, train_loss: 0.8657, test_loss: 1.0222, test_f1: 0.5222
 epoch: 7, train_loss: 0.8180, test_loss: 0.9554, test_f1: 0.5525
 epoch: 8, train_loss: 0.8638, test_loss: 1.0619, test_f1: 0.5370
 epoch: 9, train_loss: 0.8498, test_loss: 1.0380, test_f1: 0.5545
 epoch: 10, train_loss: 0.8270, test_loss: 1.0408, test_f1: 0.5244
 epoch: 11, train_loss: 0.7921, test_loss: 1.2296, test_f1: 0.4877
 epoch: 12, train_loss: 0.7889, test_loss: 0.9923, test_f1: 0.5908
 epoch: 13, train_loss: 0.8110, test_loss: 1.2422, test_f1: 0.5077
 epoch: 14, train_loss: 0.7831, test_loss: 1.1369, test_f1: 0.5462
 epoch: 15, train_loss: 0.7820, test_loss: 1.1482, test_f1: 0.5687
 epoch: 16, train_loss: 0.7519, test_loss: 1.0568, test_f1: 0.5672
 epoch: 17, train_loss: 0.7628, test_loss: 1.1281, test_f1: 0.5509
 epoch: 18, train_loss: 0.7386, test_loss: 1.1626, test_f1: 0.5580
 epoch: 19, train_loss: 0.7536, test_loss: 1.1754, test_f1: 0.5465
 epoch: 20, train_loss: 0.7480, test_loss: 1.0123, test_f1: 0.5655
 epoch: 21, train_loss: 0.7718, test_loss: 1.1243, test_f1: 0.5401
 epoch: 22, train_loss: 0.7536, test_loss: 1.2615, test_f1: 0.4391
 epoch: 23, train_loss: 0.7609, test_loss: 1.0037, test_f1: 0.5557
 epoch: 24, train_loss: 0.7395, test_loss: 1.0713, test_f1: 0.5600
 epoch: 25, train_loss: 0.7218, test_loss: 1.1259, test_f1: 0.5770
 epoch: 26, train_loss: 0.7196, test_loss: 1.2083, test_f1: 0.5653
 epoch: 27, train_loss: 0.7096, test_loss: 1.2275, test_f1: 0.5391
 epoch: 28, train_loss: 0.7489, test_loss: 1.1899, test_f1: 0.4884
 epoch: 29, train_loss: 0.7096, test_loss: 1.5446, test_f1: 0.4421
 epoch: 30, train_loss: 0.7044, test_loss: 1.5618, test_f1: 0.4896
 epoch: 31, train_loss: 0.7283, test_loss: 1.1075, test_f1: 0.6246
 epoch: 32, train_loss: 0.6927, test_loss: 1.0554, test_f1: 0.5985
 epoch: 33, train_loss: 0.6958, test_loss: 1.0661, test_f1: 0.5618
 epoch: 34, train_loss: 0.6743, test_loss: 1.0099, test_f1: 0.6296
 epoch: 35, train_loss: 0.6842, test_loss: 1.2758, test_f1: 0.5039
 epoch: 36, train_loss: 0.6876, test_loss: 2.1745, test_f1: 0.3971
 epoch: 37, train_loss: 0.7095, test_loss: 1.1818, test_f1: 0.5395
 epoch: 38, train_loss: 0.7334, test_loss: 1.3305, test_f1: 0.5267
 epoch: 39, train_loss: 0.6850, test_loss: 1.1547, test_f1: 0.6053
 epoch: 40, train_loss: 0.6641, test_loss: 1.0614, test_f1: 0.6478
 epoch: 41, train_loss: 0.6857, test_loss: 1.1318, test_f1: 0.5630
 epoch: 42, train_loss: 0.6565, test_loss: 1.0637, test_f1: 0.6009
 epoch: 43, train_loss: 0.6754, test_loss: 1.1378, test_f1: 0.5184
 epoch: 44, train_loss: 0.6960, test_loss: 1.4328, test_f1: 0.5863
 epoch: 45, train_loss: 0.6636, test_loss: 1.2032, test_f1: 0.5678
 epoch: 46, train_loss: 0.6319, test_loss: 1.1097, test_f1: 0.6077
 epoch: 47, train_loss: 0.6331, test_loss: 1.5666, test_f1: 0.5726
 epoch: 48, train_loss: 0.6524, test_loss: 1.2631, test_f1: 0.5749
 epoch: 49, train_loss: 0.6329, test_loss: 1.2486, test_f1: 0.6357
 epoch: 50, train_loss: 0.6322, test_loss: 1.3419, test_f1: 0.5363
 epoch: 51, train_loss: 0.6249, test_loss: 1.3481, test_f1: 0.6151
 epoch: 52, train_loss: 0.5641, test_loss: 1.2331, test_f1: 0.6332
 epoch: 53, train_loss: 0.5545, test_loss: 1.3614, test_f1: 0.6478
 epoch: 54, train_loss: 0.5719, test_loss: 1.1608, test_f1: 0.6454
 epoch: 55, train_loss: 0.5608, test_loss: 1.4849, test_f1: 0.6311
 epoch: 56, train_loss: 0.5741, test_loss: 1.2881, test_f1: 0.5621
 epoch: 57, train_loss: 0.5486, test_loss: 1.3456, test_f1: 0.6228
 epoch: 58, train_loss: 0.5375, test_loss: 1.4155, test_f1: 0.6055
 epoch: 59, train_loss: 0.5433, test_loss: 1.5542, test_f1: 0.5780
 epoch: 60, train_loss: 0.5496, test_loss: 1.4533, test_f1: 0.5345
 epoch: 61, train_loss: 0.5399, test_loss: 1.3485, test_f1: 0.6779
 epoch: 62, train_loss: 0.5480, test_loss: 1.3934, test_f1: 0.6030
 epoch: 63, train_loss: 0.5486, test_loss: 1.4268, test_f1: 0.6185
 epoch: 64, train_loss: 0.5183, test_loss: 1.8300, test_f1: 0.5447
 epoch: 65, train_loss: 0.5508, test_loss: 1.4791, test_f1: 0.5913
 epoch: 66, train_loss: 0.5591, test_loss: 1.6822, test_f1: 0.5956
 epoch: 67, train_loss: 0.5461, test_loss: 1.6493, test_f1: 0.6324
 epoch: 68, train_loss: 0.5047, test_loss: 1.2531, test_f1: 0.6633
 epoch: 69, train_loss: 0.5150, test_loss: 1.3907, test_f1: 0.5868
 epoch: 70, train_loss: 0.5175, test_loss: 1.6129, test_f1: 0.5637
 epoch: 71, train_loss: 0.4822, test_loss: 1.5456, test_f1: 0.6662
 epoch: 72, train_loss: 0.5244, test_loss: 1.2122, test_f1: 0.6665
 epoch: 73, train_loss: 0.4924, test_loss: 1.5769, test_f1: 0.6711
 epoch: 74, train_loss: 0.5360, test_loss: 1.3708, test_f1: 0.6243
 epoch: 75, train_loss: 0.5161, test_loss: 1.1882, test_f1: 0.6669
 epoch: 76, train_loss: 0.5046, test_loss: 1.3882, test_f1: 0.5991
 epoch: 77, train_loss: 0.4833, test_loss: 1.3684, test_f1: 0.6184
 epoch: 78, train_loss: 0.4928, test_loss: 1.6314, test_f1: 0.6075
 epoch: 79, train_loss: 0.4539, test_loss: 1.6196, test_f1: 0.6140
 epoch: 80, train_loss: 0.4621, test_loss: 1.5341, test_f1: 0.6128
 epoch: 81, train_loss: 0.4851, test_loss: 1.5180, test_f1: 0.5873
 epoch: 82, train_loss: 0.4672, test_loss: 1.6165, test_f1: 0.5588
 epoch: 83, train_loss: 0.4740, test_loss: 1.3223, test_f1: 0.6160
 epoch: 84, train_loss: 0.4703, test_loss: 1.6262, test_f1: 0.5991
 epoch: 85, train_loss: 0.5100, test_loss: 1.6859, test_f1: 0.5967
 epoch: 86, train_loss: 0.4708, test_loss: 1.5624, test_f1: 0.6310
 epoch: 87, train_loss: 0.5014, test_loss: 1.5814, test_f1: 0.4732
 epoch: 88, train_loss: 0.4979, test_loss: 1.1485, test_f1: 0.6619
 epoch: 89, train_loss: 0.4957, test_loss: 1.5326, test_f1: 0.6383
 epoch: 90, train_loss: 0.4650, test_loss: 1.1880, test_f1: 0.6643
 epoch: 91, train_loss: 0.5012, test_loss: 1.6011, test_f1: 0.6594
 epoch: 92, train_loss: 0.4550, test_loss: 1.6066, test_f1: 0.6476
 epoch: 93, train_loss: 0.4783, test_loss: 1.3887, test_f1: 0.5975
 epoch: 94, train_loss: 0.4408, test_loss: 1.5421, test_f1: 0.5701
 epoch: 95, train_loss: 0.4781, test_loss: 1.3824, test_f1: 0.6765
 epoch: 96, train_loss: 0.4746, test_loss: 1.6392, test_f1: 0.6125
 epoch: 97, train_loss: 0.4680, test_loss: 1.6074, test_f1: 0.6139
 epoch: 98, train_loss: 0.4298, test_loss: 1.6973, test_f1: 0.6686
 epoch: 99, train_loss: 0.4152, test_loss: 1.4078, test_f1: 0.5969
##################ITERATION #4 ****************************************
 epoch: 0, train_loss: 1.2000, test_loss: 1.5860, test_f1: 0.0894
 epoch: 1, train_loss: 0.9882, test_loss: 1.1044, test_f1: 0.4311
 epoch: 2, train_loss: 0.9258, test_loss: 1.0374, test_f1: 0.4982
 epoch: 3, train_loss: 0.8754, test_loss: 2.5133, test_f1: 0.3356
 epoch: 4, train_loss: 0.8860, test_loss: 0.9962, test_f1: 0.5903
 epoch: 5, train_loss: 0.8688, test_loss: 1.1018, test_f1: 0.5501
 epoch: 6, train_loss: 0.8606, test_loss: 1.0290, test_f1: 0.5789
 epoch: 7, train_loss: 0.8308, test_loss: 1.0698, test_f1: 0.5204
 epoch: 8, train_loss: 0.8121, test_loss: 1.1320, test_f1: 0.5377
 epoch: 9, train_loss: 0.8249, test_loss: 1.1114, test_f1: 0.5332
 epoch: 10, train_loss: 0.7761, test_loss: 1.1642, test_f1: 0.5105
 epoch: 11, train_loss: 0.7964, test_loss: 1.1995, test_f1: 0.5444
 epoch: 12, train_loss: 0.7895, test_loss: 1.0377, test_f1: 0.4779
 epoch: 13, train_loss: 0.7719, test_loss: 1.7129, test_f1: 0.4632
 epoch: 14, train_loss: 0.7630, test_loss: 1.0263, test_f1: 0.5898
 epoch: 15, train_loss: 0.7487, test_loss: 1.1753, test_f1: 0.5664
 epoch: 16, train_loss: 0.7715, test_loss: 1.1325, test_f1: 0.5871
 epoch: 17, train_loss: 0.7553, test_loss: 1.4069, test_f1: 0.4688
 epoch: 18, train_loss: 0.7481, test_loss: 1.5654, test_f1: 0.4439
 epoch: 19, train_loss: 0.7601, test_loss: 1.4158, test_f1: 0.5519
 epoch: 20, train_loss: 0.7506, test_loss: 1.0792, test_f1: 0.5593
 epoch: 21, train_loss: 0.7360, test_loss: 1.2993, test_f1: 0.4717
 epoch: 22, train_loss: 0.7231, test_loss: 1.2152, test_f1: 0.6287
 epoch: 23, train_loss: 0.7805, test_loss: 1.3896, test_f1: 0.4392
 epoch: 24, train_loss: 0.7569, test_loss: 0.9879, test_f1: 0.5590
 epoch: 25, train_loss: 0.7709, test_loss: 1.1162, test_f1: 0.5427
 epoch: 26, train_loss: 0.7383, test_loss: 0.9557, test_f1: 0.6092
 epoch: 27, train_loss: 0.7144, test_loss: 1.0428, test_f1: 0.6021
 epoch: 28, train_loss: 0.6916, test_loss: 0.9935, test_f1: 0.6392
 epoch: 29, train_loss: 0.6966, test_loss: 1.0786, test_f1: 0.6248
 epoch: 30, train_loss: 0.6674, test_loss: 1.0844, test_f1: 0.6089
 epoch: 31, train_loss: 0.6834, test_loss: 3.2035, test_f1: 0.3298
 epoch: 32, train_loss: 0.7019, test_loss: 1.2584, test_f1: 0.5597
 epoch: 33, train_loss: 0.6613, test_loss: 1.3402, test_f1: 0.5233
 epoch: 34, train_loss: 0.6560, test_loss: 1.4280, test_f1: 0.5544
 epoch: 35, train_loss: 0.6471, test_loss: 1.1913, test_f1: 0.5867
 epoch: 36, train_loss: 0.6565, test_loss: 1.0293, test_f1: 0.5795
 epoch: 37, train_loss: 0.6424, test_loss: 1.1295, test_f1: 0.5614
 epoch: 38, train_loss: 0.6835, test_loss: 1.2450, test_f1: 0.5984
 epoch: 39, train_loss: 0.6562, test_loss: 1.1398, test_f1: 0.5760
 epoch: 40, train_loss: 0.6396, test_loss: 1.0851, test_f1: 0.6559
 epoch: 41, train_loss: 0.6779, test_loss: 1.3847, test_f1: 0.4335
 epoch: 42, train_loss: 0.7866, test_loss: 2.6059, test_f1: 0.3247
 epoch: 43, train_loss: 1.0309, test_loss: 1.0798, test_f1: 0.4216
 epoch: 44, train_loss: 0.9625, test_loss: 1.0290, test_f1: 0.5068
 epoch: 45, train_loss: 0.9292, test_loss: 1.0260, test_f1: 0.5621
 epoch: 46, train_loss: 0.8700, test_loss: 1.0411, test_f1: 0.4831
 epoch: 47, train_loss: 0.8321, test_loss: 1.0917, test_f1: 0.4851
 epoch: 48, train_loss: 0.8131, test_loss: 0.9716, test_f1: 0.5901
 epoch: 49, train_loss: 0.7569, test_loss: 1.1146, test_f1: 0.5563
 epoch: 50, train_loss: 0.7491, test_loss: 1.0401, test_f1: 0.5436
 epoch: 51, train_loss: 0.7169, test_loss: 0.9647, test_f1: 0.6052
 epoch: 52, train_loss: 0.6949, test_loss: 1.0227, test_f1: 0.5871
 epoch: 53, train_loss: 0.6783, test_loss: 1.0443, test_f1: 0.5629
 epoch: 54, train_loss: 0.6572, test_loss: 1.0658, test_f1: 0.5513
 epoch: 55, train_loss: 0.6674, test_loss: 1.0809, test_f1: 0.5917
 epoch: 56, train_loss: 0.6698, test_loss: 1.0917, test_f1: 0.5305
 epoch: 57, train_loss: 0.6351, test_loss: 1.0466, test_f1: 0.5798
 epoch: 58, train_loss: 0.6164, test_loss: 1.1490, test_f1: 0.5646
 epoch: 59, train_loss: 0.6028, test_loss: 1.1645, test_f1: 0.5870
 epoch: 60, train_loss: 0.6176, test_loss: 1.3044, test_f1: 0.6031
 epoch: 61, train_loss: 0.6013, test_loss: 1.1413, test_f1: 0.5820
 epoch: 62, train_loss: 0.6198, test_loss: 1.4463, test_f1: 0.5339
 epoch: 63, train_loss: 0.6142, test_loss: 1.1603, test_f1: 0.5993
 epoch: 64, train_loss: 0.6014, test_loss: 1.0457, test_f1: 0.6183
 epoch: 65, train_loss: 0.5933, test_loss: 1.2578, test_f1: 0.6178
 epoch: 66, train_loss: 0.6137, test_loss: 1.1502, test_f1: 0.6073
 epoch: 67, train_loss: 0.5692, test_loss: 1.1173, test_f1: 0.5870
 epoch: 68, train_loss: 0.5679, test_loss: 1.0896, test_f1: 0.6308
 epoch: 69, train_loss: 0.5802, test_loss: 1.5469, test_f1: 0.5608
 epoch: 70, train_loss: 0.5323, test_loss: 1.0747, test_f1: 0.6740
 epoch: 71, train_loss: 0.5536, test_loss: 1.2726, test_f1: 0.5974
 epoch: 72, train_loss: 0.5317, test_loss: 1.8398, test_f1: 0.5399
 epoch: 73, train_loss: 0.5616, test_loss: 1.2208, test_f1: 0.5767
 epoch: 74, train_loss: 0.5275, test_loss: 1.1308, test_f1: 0.6751
 epoch: 75, train_loss: 0.5172, test_loss: 1.2396, test_f1: 0.6347
 epoch: 76, train_loss: 0.5404, test_loss: 1.2017, test_f1: 0.6516
 epoch: 77, train_loss: 0.5117, test_loss: 1.3009, test_f1: 0.5769
 epoch: 78, train_loss: 0.5299, test_loss: 1.6564, test_f1: 0.5881
 epoch: 79, train_loss: 0.5062, test_loss: 1.2153, test_f1: 0.6072
 epoch: 80, train_loss: 0.5377, test_loss: 1.3357, test_f1: 0.5729
 epoch: 81, train_loss: 0.5112, test_loss: 1.3682, test_f1: 0.6092
 epoch: 82, train_loss: 0.5129, test_loss: 1.2884, test_f1: 0.5818
 epoch: 83, train_loss: 0.4986, test_loss: 1.4126, test_f1: 0.6093
 epoch: 84, train_loss: 0.5037, test_loss: 1.6298, test_f1: 0.5999
 epoch: 85, train_loss: 0.4651, test_loss: 1.1933, test_f1: 0.6236
 epoch: 86, train_loss: 0.5446, test_loss: 1.1285, test_f1: 0.5881
 epoch: 87, train_loss: 0.5227, test_loss: 1.4325, test_f1: 0.6133
 epoch: 88, train_loss: 0.4861, test_loss: 1.3799, test_f1: 0.6401
 epoch: 89, train_loss: 0.4764, test_loss: 1.2679, test_f1: 0.6057
 epoch: 90, train_loss: 0.4941, test_loss: 1.2788, test_f1: 0.6014
 epoch: 91, train_loss: 0.4737, test_loss: 1.2269, test_f1: 0.6224
 epoch: 92, train_loss: 0.4593, test_loss: 1.3982, test_f1: 0.5721
 epoch: 93, train_loss: 0.4637, test_loss: 1.4592, test_f1: 0.5745
 epoch: 94, train_loss: 0.4872, test_loss: 1.1959, test_f1: 0.5967
 epoch: 95, train_loss: 0.4664, test_loss: 1.4475, test_f1: 0.5621
 epoch: 96, train_loss: 0.4825, test_loss: 1.4291, test_f1: 0.5824
 epoch: 97, train_loss: 0.4695, test_loss: 1.3340, test_f1: 0.5871
 epoch: 98, train_loss: 0.4555, test_loss: 1.3025, test_f1: 0.5493
 epoch: 99, train_loss: 0.4599, test_loss: 1.4168, test_f1: 0.5989
##################ITERATION #5 ****************************************
 epoch: 0, train_loss: 1.2141, test_loss: 1.3358, test_f1: 0.3126
 epoch: 1, train_loss: 0.9927, test_loss: 1.2529, test_f1: 0.3820
 epoch: 2, train_loss: 0.9499, test_loss: 1.0375, test_f1: 0.4895
 epoch: 3, train_loss: 0.9277, test_loss: 1.2502, test_f1: 0.4094
 epoch: 4, train_loss: 0.8846, test_loss: 1.0813, test_f1: 0.5340
 epoch: 5, train_loss: 0.8549, test_loss: 1.1612, test_f1: 0.5354
 epoch: 6, train_loss: 0.8262, test_loss: 1.0548, test_f1: 0.5441
 epoch: 7, train_loss: 0.8047, test_loss: 1.1779, test_f1: 0.4932
 epoch: 8, train_loss: 0.7731, test_loss: 1.3081, test_f1: 0.4884
 epoch: 9, train_loss: 0.8185, test_loss: 1.2259, test_f1: 0.4837
 epoch: 10, train_loss: 0.8067, test_loss: 1.1927, test_f1: 0.4666
 epoch: 11, train_loss: 0.7840, test_loss: 1.0410, test_f1: 0.5444
 epoch: 12, train_loss: 0.7853, test_loss: 1.2217, test_f1: 0.5005
 epoch: 13, train_loss: 0.7926, test_loss: 0.9950, test_f1: 0.5538
 epoch: 14, train_loss: 0.7474, test_loss: 1.8702, test_f1: 0.3838
 epoch: 15, train_loss: 0.7632, test_loss: 1.2511, test_f1: 0.5066
 epoch: 16, train_loss: 0.7399, test_loss: 1.0969, test_f1: 0.5775
 epoch: 17, train_loss: 0.7480, test_loss: 1.3723, test_f1: 0.5587
 epoch: 18, train_loss: 0.7496, test_loss: 1.0873, test_f1: 0.5613
 epoch: 19, train_loss: 0.7591, test_loss: 1.1882, test_f1: 0.5507
 epoch: 20, train_loss: 0.7219, test_loss: 1.1314, test_f1: 0.5480
 epoch: 21, train_loss: 0.7118, test_loss: 1.1366, test_f1: 0.5626
 epoch: 22, train_loss: 0.7271, test_loss: 1.1290, test_f1: 0.6114
 epoch: 23, train_loss: 0.7245, test_loss: 1.1330, test_f1: 0.6062
 epoch: 24, train_loss: 0.7229, test_loss: 1.0251, test_f1: 0.6062
 epoch: 25, train_loss: 0.7275, test_loss: 1.0965, test_f1: 0.5813
 epoch: 26, train_loss: 0.7161, test_loss: 1.1451, test_f1: 0.5765
 epoch: 27, train_loss: 0.6920, test_loss: 1.2678, test_f1: 0.5694
 epoch: 28, train_loss: 0.7265, test_loss: 1.2474, test_f1: 0.5172
 epoch: 29, train_loss: 0.7177, test_loss: 1.3007, test_f1: 0.5627
 epoch: 30, train_loss: 0.7035, test_loss: 1.1441, test_f1: 0.5621
 epoch: 31, train_loss: 0.7230, test_loss: 1.0453, test_f1: 0.5985
 epoch: 32, train_loss: 0.6938, test_loss: 1.0125, test_f1: 0.5998
 epoch: 33, train_loss: 0.6663, test_loss: 1.3221, test_f1: 0.5269
 epoch: 34, train_loss: 0.6720, test_loss: 1.0310, test_f1: 0.6060
 epoch: 35, train_loss: 0.6825, test_loss: 1.1909, test_f1: 0.5717
 epoch: 36, train_loss: 0.7038, test_loss: 1.2976, test_f1: 0.5809
 epoch: 37, train_loss: 0.6905, test_loss: 1.1835, test_f1: 0.6000
 epoch: 38, train_loss: 0.6782, test_loss: 1.2985, test_f1: 0.5831
 epoch: 39, train_loss: 0.6577, test_loss: 1.1921, test_f1: 0.4671
 epoch: 40, train_loss: 0.7049, test_loss: 1.3294, test_f1: 0.5832
 epoch: 41, train_loss: 0.6862, test_loss: 1.1801, test_f1: 0.5726
 epoch: 42, train_loss: 0.6564, test_loss: 1.1582, test_f1: 0.5616
 epoch: 43, train_loss: 0.6557, test_loss: 1.2602, test_f1: 0.6184
 epoch: 44, train_loss: 0.6464, test_loss: 1.5798, test_f1: 0.5638
 epoch: 45, train_loss: 0.6446, test_loss: 1.3178, test_f1: 0.5975
 epoch: 46, train_loss: 0.6491, test_loss: 1.2598, test_f1: 0.5829
 epoch: 47, train_loss: 0.6168, test_loss: 1.1132, test_f1: 0.5902
 epoch: 48, train_loss: 0.6717, test_loss: 1.3460, test_f1: 0.5555
 epoch: 49, train_loss: 0.6633, test_loss: 1.6661, test_f1: 0.4157
 epoch: 50, train_loss: 0.6685, test_loss: 1.4346, test_f1: 0.5515
 epoch: 51, train_loss: 0.6189, test_loss: 1.2155, test_f1: 0.5618
 epoch: 52, train_loss: 0.6022, test_loss: 1.2436, test_f1: 0.5600
 epoch: 53, train_loss: 0.6147, test_loss: 1.1471, test_f1: 0.6504
 epoch: 54, train_loss: 0.5842, test_loss: 1.2600, test_f1: 0.6174
 epoch: 55, train_loss: 0.5706, test_loss: 1.4574, test_f1: 0.5561
 epoch: 56, train_loss: 0.5639, test_loss: 1.2822, test_f1: 0.5825
 epoch: 57, train_loss: 0.5741, test_loss: 1.3455, test_f1: 0.5721
 epoch: 58, train_loss: 0.5890, test_loss: 1.4643, test_f1: 0.6127
 epoch: 59, train_loss: 0.5881, test_loss: 1.4577, test_f1: 0.5877
 epoch: 60, train_loss: 0.5660, test_loss: 1.4175, test_f1: 0.5902
 epoch: 61, train_loss: 0.5505, test_loss: 1.7936, test_f1: 0.5341
 epoch: 62, train_loss: 0.5480, test_loss: 1.4085, test_f1: 0.6179
 epoch: 63, train_loss: 0.5550, test_loss: 1.2881, test_f1: 0.5574
 epoch: 64, train_loss: 0.5617, test_loss: 1.3032, test_f1: 0.6122
 epoch: 65, train_loss: 0.5348, test_loss: 1.4142, test_f1: 0.5925
 epoch: 66, train_loss: 0.5375, test_loss: 1.4383, test_f1: 0.5987
 epoch: 67, train_loss: 0.5387, test_loss: 1.4358, test_f1: 0.5917
 epoch: 68, train_loss: 0.5283, test_loss: 1.5509, test_f1: 0.5433
 epoch: 69, train_loss: 0.5397, test_loss: 1.2809, test_f1: 0.6150
 epoch: 70, train_loss: 0.5319, test_loss: 1.4115, test_f1: 0.5861
 epoch: 71, train_loss: 0.5750, test_loss: 1.4148, test_f1: 0.5486
 epoch: 72, train_loss: 0.5256, test_loss: 1.5707, test_f1: 0.5591
 epoch: 73, train_loss: 0.5209, test_loss: 1.8172, test_f1: 0.5395
 epoch: 74, train_loss: 0.5142, test_loss: 1.6165, test_f1: 0.5795
 epoch: 75, train_loss: 0.5152, test_loss: 1.7031, test_f1: 0.5823
 epoch: 76, train_loss: 0.5343, test_loss: 1.5345, test_f1: 0.6060
 epoch: 77, train_loss: 0.5266, test_loss: 1.6805, test_f1: 0.5733
 epoch: 78, train_loss: 0.5361, test_loss: 1.8258, test_f1: 0.5336
 epoch: 79, train_loss: 0.5252, test_loss: 1.5614, test_f1: 0.5823
 epoch: 80, train_loss: 0.5190, test_loss: 1.7836, test_f1: 0.5642
 epoch: 81, train_loss: 0.5374, test_loss: 1.5897, test_f1: 0.5701
 epoch: 82, train_loss: 0.5338, test_loss: 1.5164, test_f1: 0.5916
 epoch: 83, train_loss: 0.5077, test_loss: 1.4637, test_f1: 0.5275
 epoch: 84, train_loss: 0.4819, test_loss: 1.6915, test_f1: 0.5691
 epoch: 85, train_loss: 0.5041, test_loss: 1.6549, test_f1: 0.5896
 epoch: 86, train_loss: 0.4893, test_loss: 1.6738, test_f1: 0.5799
 epoch: 87, train_loss: 0.5247, test_loss: 1.8790, test_f1: 0.5744
 epoch: 88, train_loss: 0.5285, test_loss: 1.5242, test_f1: 0.5524
 epoch: 89, train_loss: 0.5400, test_loss: 1.6579, test_f1: 0.5876
 epoch: 90, train_loss: 0.5040, test_loss: 1.7126, test_f1: 0.5512
 epoch: 91, train_loss: 0.4928, test_loss: 1.7223, test_f1: 0.5596
 epoch: 92, train_loss: 0.4712, test_loss: 1.7205, test_f1: 0.5800
 epoch: 93, train_loss: 0.4872, test_loss: 1.7811, test_f1: 0.5992
 epoch: 94, train_loss: 0.4788, test_loss: 1.7521, test_f1: 0.5748
 epoch: 95, train_loss: 0.4933, test_loss: 2.4390, test_f1: 0.5113
 epoch: 96, train_loss: 0.4860, test_loss: 1.6005, test_f1: 0.5788
 epoch: 97, train_loss: 0.4793, test_loss: 1.8312, test_f1: 0.5142
 epoch: 98, train_loss: 0.4743, test_loss: 1.9880, test_f1: 0.5619
 epoch: 99, train_loss: 0.4596, test_loss: 1.7153, test_f1: 0.5503
##################ITERATION #6 ****************************************
 epoch: 0, train_loss: 1.2331, test_loss: 1.3061, test_f1: 0.2918
 epoch: 1, train_loss: 1.0087, test_loss: 1.3338, test_f1: 0.2846
 epoch: 2, train_loss: 0.9444, test_loss: 1.0268, test_f1: 0.5032
 epoch: 3, train_loss: 0.9153, test_loss: 1.0387, test_f1: 0.4204
 epoch: 4, train_loss: 0.9009, test_loss: 0.9904, test_f1: 0.5462
 epoch: 5, train_loss: 0.8537, test_loss: 0.9675, test_f1: 0.4967
 epoch: 6, train_loss: 0.8310, test_loss: 1.0437, test_f1: 0.5483
 epoch: 7, train_loss: 0.8442, test_loss: 1.7592, test_f1: 0.3936
 epoch: 8, train_loss: 0.8133, test_loss: 1.0111, test_f1: 0.5525
 epoch: 9, train_loss: 0.7980, test_loss: 1.1410, test_f1: 0.5689
 epoch: 10, train_loss: 0.7945, test_loss: 1.0806, test_f1: 0.5368
 epoch: 11, train_loss: 0.7990, test_loss: 0.9197, test_f1: 0.5743
 epoch: 12, train_loss: 0.7959, test_loss: 0.9816, test_f1: 0.5759
 epoch: 13, train_loss: 0.7752, test_loss: 0.9964, test_f1: 0.5984
 epoch: 14, train_loss: 0.7929, test_loss: 1.0795, test_f1: 0.4829
 epoch: 15, train_loss: 0.7660, test_loss: 1.1933, test_f1: 0.5271
 epoch: 16, train_loss: 0.7815, test_loss: 1.2945, test_f1: 0.4818
 epoch: 17, train_loss: 0.7644, test_loss: 1.0390, test_f1: 0.5730
 epoch: 18, train_loss: 0.7529, test_loss: 0.9894, test_f1: 0.6395
 epoch: 19, train_loss: 0.7426, test_loss: 1.9677, test_f1: 0.4476
 epoch: 20, train_loss: 0.7812, test_loss: 2.7007, test_f1: 0.3674
 epoch: 21, train_loss: 0.7790, test_loss: 1.1460, test_f1: 0.5220
 epoch: 22, train_loss: 0.7764, test_loss: 0.9676, test_f1: 0.6126
 epoch: 23, train_loss: 0.7597, test_loss: 1.0727, test_f1: 0.5648
 epoch: 24, train_loss: 0.7367, test_loss: 1.1530, test_f1: 0.5993
 epoch: 25, train_loss: 0.7492, test_loss: 0.9887, test_f1: 0.6238
 epoch: 26, train_loss: 0.7338, test_loss: 1.0277, test_f1: 0.5745
 epoch: 27, train_loss: 0.7020, test_loss: 0.9744, test_f1: 0.6248
 epoch: 28, train_loss: 0.7054, test_loss: 1.2337, test_f1: 0.5928
 epoch: 29, train_loss: 0.7069, test_loss: 0.9062, test_f1: 0.6455
 epoch: 30, train_loss: 0.7070, test_loss: 1.0938, test_f1: 0.6369
 epoch: 31, train_loss: 0.7131, test_loss: 1.0916, test_f1: 0.5459
 epoch: 32, train_loss: 0.6871, test_loss: 1.1192, test_f1: 0.6615
 epoch: 33, train_loss: 0.6901, test_loss: 1.1456, test_f1: 0.5832
 epoch: 34, train_loss: 0.6909, test_loss: 1.0560, test_f1: 0.6175
 epoch: 35, train_loss: 0.6883, test_loss: 1.0196, test_f1: 0.6064
 epoch: 36, train_loss: 0.6771, test_loss: 1.0630, test_f1: 0.6234
 epoch: 37, train_loss: 0.6787, test_loss: 1.1808, test_f1: 0.5808
 epoch: 38, train_loss: 0.6571, test_loss: 1.1336, test_f1: 0.5849
 epoch: 39, train_loss: 0.6733, test_loss: 1.0749, test_f1: 0.5890
 epoch: 40, train_loss: 0.6885, test_loss: 1.0113, test_f1: 0.5912
 epoch: 41, train_loss: 0.6453, test_loss: 1.1107, test_f1: 0.6563
 epoch: 42, train_loss: 0.6520, test_loss: 1.3370, test_f1: 0.6004
 epoch: 43, train_loss: 0.7065, test_loss: 1.3659, test_f1: 0.5804
 epoch: 44, train_loss: 0.7034, test_loss: 1.1578, test_f1: 0.5394
 epoch: 45, train_loss: 0.6408, test_loss: 1.0744, test_f1: 0.6053
 epoch: 46, train_loss: 0.6633, test_loss: 1.5481, test_f1: 0.5643
 epoch: 47, train_loss: 0.6634, test_loss: 1.0770, test_f1: 0.5787
 epoch: 48, train_loss: 0.6216, test_loss: 1.0907, test_f1: 0.6404
 epoch: 49, train_loss: 0.6420, test_loss: 1.0371, test_f1: 0.6295
 epoch: 50, train_loss: 0.6410, test_loss: 1.2588, test_f1: 0.6242
 epoch: 51, train_loss: 0.5979, test_loss: 1.0982, test_f1: 0.6358
 epoch: 52, train_loss: 0.6005, test_loss: 1.0825, test_f1: 0.6763
 epoch: 53, train_loss: 0.5786, test_loss: 0.9745, test_f1: 0.6675
 epoch: 54, train_loss: 0.5882, test_loss: 1.1374, test_f1: 0.6482
 epoch: 55, train_loss: 0.5744, test_loss: 1.1712, test_f1: 0.6328
 epoch: 56, train_loss: 0.5931, test_loss: 1.1087, test_f1: 0.6925
 epoch: 57, train_loss: 0.5711, test_loss: 1.0474, test_f1: 0.6371
 epoch: 58, train_loss: 0.5409, test_loss: 1.1317, test_f1: 0.6358
 epoch: 59, train_loss: 0.5596, test_loss: 1.6093, test_f1: 0.5775
 epoch: 60, train_loss: 0.5692, test_loss: 1.3046, test_f1: 0.5994
 epoch: 61, train_loss: 0.5392, test_loss: 1.2025, test_f1: 0.6461
 epoch: 62, train_loss: 0.5564, test_loss: 1.2388, test_f1: 0.6303
 epoch: 63, train_loss: 0.5482, test_loss: 1.1887, test_f1: 0.6307
 epoch: 64, train_loss: 0.5580, test_loss: 1.3124, test_f1: 0.5691
 epoch: 65, train_loss: 0.5713, test_loss: 1.5489, test_f1: 0.6241
 epoch: 66, train_loss: 0.5607, test_loss: 1.0599, test_f1: 0.7266
 epoch: 67, train_loss: 0.5205, test_loss: 1.2781, test_f1: 0.6489
 epoch: 68, train_loss: 0.5236, test_loss: 1.3598, test_f1: 0.6163
 epoch: 69, train_loss: 0.5357, test_loss: 1.4870, test_f1: 0.6472
 epoch: 70, train_loss: 0.5210, test_loss: 1.2673, test_f1: 0.6634
 epoch: 71, train_loss: 0.5515, test_loss: 1.3082, test_f1: 0.6510
 epoch: 72, train_loss: 0.5572, test_loss: 1.2863, test_f1: 0.6209
 epoch: 73, train_loss: 0.5230, test_loss: 1.0806, test_f1: 0.6175
 epoch: 74, train_loss: 0.5101, test_loss: 1.2409, test_f1: 0.6468
 epoch: 75, train_loss: 0.5373, test_loss: 1.3289, test_f1: 0.6677
 epoch: 76, train_loss: 0.5082, test_loss: 1.1285, test_f1: 0.6006
 epoch: 77, train_loss: 0.5181, test_loss: 1.7041, test_f1: 0.5999
 epoch: 78, train_loss: 0.5413, test_loss: 1.2203, test_f1: 0.6173
 epoch: 79, train_loss: 0.4875, test_loss: 1.2130, test_f1: 0.6385
 epoch: 80, train_loss: 0.4976, test_loss: 1.7199, test_f1: 0.6037
 epoch: 81, train_loss: 0.5181, test_loss: 1.5943, test_f1: 0.6412
 epoch: 82, train_loss: 0.5068, test_loss: 1.3993, test_f1: 0.6466
 epoch: 83, train_loss: 0.4820, test_loss: 1.5989, test_f1: 0.6200
 epoch: 84, train_loss: 0.5022, test_loss: 1.5411, test_f1: 0.6613
 epoch: 85, train_loss: 0.5429, test_loss: 3.3243, test_f1: 0.5072
 epoch: 86, train_loss: 0.6100, test_loss: 1.1398, test_f1: 0.6083
 epoch: 87, train_loss: 0.6287, test_loss: 1.0918, test_f1: 0.6670
 epoch: 88, train_loss: 0.5645, test_loss: 1.2863, test_f1: 0.6440
 epoch: 89, train_loss: 0.5213, test_loss: 1.1754, test_f1: 0.6461
 epoch: 90, train_loss: 0.4973, test_loss: 1.1992, test_f1: 0.6162
 epoch: 91, train_loss: 0.4931, test_loss: 1.4404, test_f1: 0.6323
 epoch: 92, train_loss: 0.5123, test_loss: 1.2537, test_f1: 0.6137
 epoch: 93, train_loss: 0.4923, test_loss: 1.1830, test_f1: 0.6641
 epoch: 94, train_loss: 0.4805, test_loss: 1.1404, test_f1: 0.6765
 epoch: 95, train_loss: 0.4689, test_loss: 1.1836, test_f1: 0.6666
 epoch: 96, train_loss: 0.4925, test_loss: 1.2521, test_f1: 0.6302
 epoch: 97, train_loss: 0.5143, test_loss: 1.2214, test_f1: 0.6318
 epoch: 98, train_loss: 0.4634, test_loss: 1.4029, test_f1: 0.6162
 epoch: 99, train_loss: 0.4648, test_loss: 1.2341, test_f1: 0.6549
##################ITERATION #7 ****************************************
 epoch: 0, train_loss: 1.2094, test_loss: 1.3485, test_f1: 0.3775
 epoch: 1, train_loss: 1.0177, test_loss: 1.0309, test_f1: 0.4206
 epoch: 2, train_loss: 0.9526, test_loss: 1.0462, test_f1: 0.4803
 epoch: 3, train_loss: 0.8975, test_loss: 1.0169, test_f1: 0.5165
 epoch: 4, train_loss: 0.8768, test_loss: 1.1562, test_f1: 0.5562
 epoch: 5, train_loss: 0.8928, test_loss: 1.0386, test_f1: 0.5570
 epoch: 6, train_loss: 0.8462, test_loss: 1.0277, test_f1: 0.5698
 epoch: 7, train_loss: 0.8463, test_loss: 1.0018, test_f1: 0.5657
 epoch: 8, train_loss: 0.7936, test_loss: 1.2139, test_f1: 0.5002
 epoch: 9, train_loss: 0.8266, test_loss: 1.1917, test_f1: 0.4680
 epoch: 10, train_loss: 0.8289, test_loss: 0.9318, test_f1: 0.5993
 epoch: 11, train_loss: 0.7950, test_loss: 0.9791, test_f1: 0.6071
 epoch: 12, train_loss: 0.8110, test_loss: 0.9199, test_f1: 0.5694
 epoch: 13, train_loss: 0.7769, test_loss: 1.1991, test_f1: 0.4192
 epoch: 14, train_loss: 0.7771, test_loss: 1.0032, test_f1: 0.5758
 epoch: 15, train_loss: 0.7646, test_loss: 0.9563, test_f1: 0.6173
 epoch: 16, train_loss: 0.7603, test_loss: 1.0668, test_f1: 0.5144
 epoch: 17, train_loss: 0.7522, test_loss: 1.2740, test_f1: 0.5205
 epoch: 18, train_loss: 0.7618, test_loss: 1.1334, test_f1: 0.5531
 epoch: 19, train_loss: 0.7604, test_loss: 0.9786, test_f1: 0.6256
 epoch: 20, train_loss: 0.7488, test_loss: 1.1084, test_f1: 0.5584
 epoch: 21, train_loss: 0.7474, test_loss: 1.0143, test_f1: 0.5829
 epoch: 22, train_loss: 0.7312, test_loss: 1.1494, test_f1: 0.5005
 epoch: 23, train_loss: 0.7460, test_loss: 1.2238, test_f1: 0.5531
 epoch: 24, train_loss: 0.7475, test_loss: 1.0318, test_f1: 0.5900
 epoch: 25, train_loss: 0.7318, test_loss: 1.1813, test_f1: 0.5765
 epoch: 26, train_loss: 0.7304, test_loss: 1.0348, test_f1: 0.6052
 epoch: 27, train_loss: 0.7225, test_loss: 1.0069, test_f1: 0.5918
 epoch: 28, train_loss: 0.7067, test_loss: 1.1536, test_f1: 0.5399
 epoch: 29, train_loss: 0.6941, test_loss: 1.1162, test_f1: 0.6106
 epoch: 30, train_loss: 0.7116, test_loss: 1.0439, test_f1: 0.5755
 epoch: 31, train_loss: 0.6976, test_loss: 1.0191, test_f1: 0.5763
 epoch: 32, train_loss: 0.6991, test_loss: 1.1234, test_f1: 0.5734
 epoch: 33, train_loss: 0.6972, test_loss: 1.1541, test_f1: 0.6100
 epoch: 34, train_loss: 0.6902, test_loss: 1.0790, test_f1: 0.5577
 epoch: 35, train_loss: 0.7098, test_loss: 1.1147, test_f1: 0.5014
 epoch: 36, train_loss: 0.7032, test_loss: 1.1210, test_f1: 0.6260
 epoch: 37, train_loss: 0.7006, test_loss: 1.2365, test_f1: 0.5383
 epoch: 38, train_loss: 0.6867, test_loss: 1.3617, test_f1: 0.5186
 epoch: 39, train_loss: 0.6760, test_loss: 1.0779, test_f1: 0.5396
 epoch: 40, train_loss: 0.6403, test_loss: 1.0791, test_f1: 0.6158
 epoch: 41, train_loss: 0.6436, test_loss: 1.0958, test_f1: 0.5714
 epoch: 42, train_loss: 0.6527, test_loss: 1.1355, test_f1: 0.5846
 epoch: 43, train_loss: 0.6497, test_loss: 1.2286, test_f1: 0.5516
 epoch: 44, train_loss: 0.6230, test_loss: 1.1974, test_f1: 0.5769
 epoch: 45, train_loss: 0.6494, test_loss: 1.0699, test_f1: 0.5560
 epoch: 46, train_loss: 0.6478, test_loss: 1.3180, test_f1: 0.5612
 epoch: 47, train_loss: 0.6219, test_loss: 1.4408, test_f1: 0.5078
 epoch: 48, train_loss: 0.6350, test_loss: 1.1683, test_f1: 0.5751
 epoch: 49, train_loss: 0.6383, test_loss: 1.1085, test_f1: 0.5730
 epoch: 50, train_loss: 0.6331, test_loss: 1.0393, test_f1: 0.5725
 epoch: 51, train_loss: 0.6197, test_loss: 1.1384, test_f1: 0.5847
 epoch: 52, train_loss: 0.5737, test_loss: 1.2315, test_f1: 0.5950
 epoch: 53, train_loss: 0.5791, test_loss: 1.0341, test_f1: 0.6356
 epoch: 54, train_loss: 0.5491, test_loss: 1.1992, test_f1: 0.6116
 epoch: 55, train_loss: 0.5418, test_loss: 1.1851, test_f1: 0.5998
 epoch: 56, train_loss: 0.5707, test_loss: 1.2017, test_f1: 0.6000
 epoch: 57, train_loss: 0.5601, test_loss: 1.3089, test_f1: 0.5685
 epoch: 58, train_loss: 0.5545, test_loss: 1.2387, test_f1: 0.6104
 epoch: 59, train_loss: 0.5418, test_loss: 1.3222, test_f1: 0.5288
 epoch: 60, train_loss: 0.5280, test_loss: 1.2601, test_f1: 0.6047
 epoch: 61, train_loss: 0.5368, test_loss: 1.4629, test_f1: 0.5710
 epoch: 62, train_loss: 0.5318, test_loss: 1.2385, test_f1: 0.5897
 epoch: 63, train_loss: 0.5150, test_loss: 1.3393, test_f1: 0.6460
 epoch: 64, train_loss: 0.5139, test_loss: 1.1901, test_f1: 0.6036
 epoch: 65, train_loss: 0.5189, test_loss: 1.3203, test_f1: 0.6138
 epoch: 66, train_loss: 0.5254, test_loss: 1.4013, test_f1: 0.5918
 epoch: 67, train_loss: 0.5158, test_loss: 1.6582, test_f1: 0.5895
 epoch: 68, train_loss: 0.5222, test_loss: 1.3347, test_f1: 0.5888
 epoch: 69, train_loss: 0.5255, test_loss: 1.4723, test_f1: 0.5642
 epoch: 70, train_loss: 0.5183, test_loss: 1.4212, test_f1: 0.6059
 epoch: 71, train_loss: 0.5135, test_loss: 1.4721, test_f1: 0.6245
 epoch: 72, train_loss: 0.5066, test_loss: 1.3761, test_f1: 0.6180
 epoch: 73, train_loss: 0.5302, test_loss: 1.4200, test_f1: 0.6201
 epoch: 74, train_loss: 0.4996, test_loss: 1.4276, test_f1: 0.6079
 epoch: 75, train_loss: 0.4463, test_loss: 1.5805, test_f1: 0.5877
 epoch: 76, train_loss: 0.4945, test_loss: 1.8039, test_f1: 0.5935
 epoch: 77, train_loss: 0.4865, test_loss: 1.2860, test_f1: 0.5893
 epoch: 78, train_loss: 0.4994, test_loss: 1.6548, test_f1: 0.6066
 epoch: 79, train_loss: 0.4777, test_loss: 1.4593, test_f1: 0.6016
 epoch: 80, train_loss: 0.4931, test_loss: 1.4484, test_f1: 0.6216
 epoch: 81, train_loss: 0.4721, test_loss: 1.6594, test_f1: 0.6110
 epoch: 82, train_loss: 0.4704, test_loss: 1.5838, test_f1: 0.6488
 epoch: 83, train_loss: 0.4800, test_loss: 1.4010, test_f1: 0.6065
 epoch: 84, train_loss: 0.4747, test_loss: 1.6941, test_f1: 0.5939
 epoch: 85, train_loss: 0.4476, test_loss: 1.5040, test_f1: 0.6320
 epoch: 86, train_loss: 0.4426, test_loss: 1.7159, test_f1: 0.6326
 epoch: 87, train_loss: 0.4535, test_loss: 1.5140, test_f1: 0.6104
 epoch: 88, train_loss: 0.4360, test_loss: 1.8379, test_f1: 0.6075
 epoch: 89, train_loss: 0.4787, test_loss: 1.5534, test_f1: 0.6038
 epoch: 90, train_loss: 0.4359, test_loss: 1.7534, test_f1: 0.6146
 epoch: 91, train_loss: 0.4105, test_loss: 1.4987, test_f1: 0.5973
 epoch: 92, train_loss: 0.4324, test_loss: 1.6900, test_f1: 0.5712
 epoch: 93, train_loss: 0.4544, test_loss: 1.9772, test_f1: 0.5761
 epoch: 94, train_loss: 0.4181, test_loss: 1.6153, test_f1: 0.6354
 epoch: 95, train_loss: 0.4411, test_loss: 1.7121, test_f1: 0.5705
 epoch: 96, train_loss: 0.4307, test_loss: 1.9780, test_f1: 0.5711
 epoch: 97, train_loss: 0.4687, test_loss: 1.7668, test_f1: 0.6043
 epoch: 98, train_loss: 0.4184, test_loss: 2.1984, test_f1: 0.6422
 epoch: 99, train_loss: 0.4356, test_loss: 1.7075, test_f1: 0.5945
##################ITERATION #8 ****************************************
 epoch: 0, train_loss: 1.1895, test_loss: 1.3368, test_f1: 0.3095
 epoch: 1, train_loss: 1.0377, test_loss: 1.2279, test_f1: 0.4345
 epoch: 2, train_loss: 0.9528, test_loss: 1.0712, test_f1: 0.4913
 epoch: 3, train_loss: 0.8995, test_loss: 1.0305, test_f1: 0.5010
 epoch: 4, train_loss: 0.9030, test_loss: 0.9579, test_f1: 0.5684
 epoch: 5, train_loss: 0.8758, test_loss: 1.0353, test_f1: 0.5026
 epoch: 6, train_loss: 0.8492, test_loss: 1.0260, test_f1: 0.5597
 epoch: 7, train_loss: 0.8304, test_loss: 1.0407, test_f1: 0.5648
 epoch: 8, train_loss: 0.8534, test_loss: 0.9930, test_f1: 0.5560
 epoch: 9, train_loss: 0.8296, test_loss: 0.9727, test_f1: 0.5579
 epoch: 10, train_loss: 0.8160, test_loss: 1.0072, test_f1: 0.5655
 epoch: 11, train_loss: 0.8442, test_loss: 1.0157, test_f1: 0.5226
 epoch: 12, train_loss: 0.8284, test_loss: 1.0808, test_f1: 0.5791
 epoch: 13, train_loss: 0.8143, test_loss: 1.0822, test_f1: 0.4567
 epoch: 14, train_loss: 0.8269, test_loss: 1.1806, test_f1: 0.4645
 epoch: 15, train_loss: 0.8118, test_loss: 1.0190, test_f1: 0.5666
 epoch: 16, train_loss: 0.7889, test_loss: 1.1827, test_f1: 0.5574
 epoch: 17, train_loss: 0.7912, test_loss: 1.2312, test_f1: 0.4836
 epoch: 18, train_loss: 0.7878, test_loss: 1.2319, test_f1: 0.4280
 epoch: 19, train_loss: 0.7490, test_loss: 1.7423, test_f1: 0.4434
 epoch: 20, train_loss: 0.7472, test_loss: 1.0832, test_f1: 0.5450
 epoch: 21, train_loss: 0.7818, test_loss: 1.2970, test_f1: 0.5116
 epoch: 22, train_loss: 0.7643, test_loss: 1.0737, test_f1: 0.6106
 epoch: 23, train_loss: 0.7574, test_loss: 1.0745, test_f1: 0.5717
 epoch: 24, train_loss: 0.7823, test_loss: 1.0928, test_f1: 0.6015
 epoch: 25, train_loss: 0.7626, test_loss: 1.1919, test_f1: 0.5025
 epoch: 26, train_loss: 0.7652, test_loss: 1.0905, test_f1: 0.5398
 epoch: 27, train_loss: 0.7625, test_loss: 1.0022, test_f1: 0.5760
 epoch: 28, train_loss: 0.7409, test_loss: 1.0497, test_f1: 0.5795
 epoch: 29, train_loss: 0.7727, test_loss: 1.0337, test_f1: 0.5910
 epoch: 30, train_loss: 0.7557, test_loss: 0.9493, test_f1: 0.6447
 epoch: 31, train_loss: 0.7373, test_loss: 1.1304, test_f1: 0.5046
 epoch: 32, train_loss: 0.7480, test_loss: 1.0678, test_f1: 0.5357
 epoch: 33, train_loss: 0.7368, test_loss: 1.0746, test_f1: 0.5598
 epoch: 34, train_loss: 0.7395, test_loss: 1.1516, test_f1: 0.5217
 epoch: 35, train_loss: 0.7387, test_loss: 1.0612, test_f1: 0.5948
 epoch: 36, train_loss: 0.7368, test_loss: 1.3006, test_f1: 0.6007
 epoch: 37, train_loss: 0.7275, test_loss: 1.1442, test_f1: 0.5052
 epoch: 38, train_loss: 0.7259, test_loss: 1.2079, test_f1: 0.6090
 epoch: 39, train_loss: 0.7217, test_loss: 1.2817, test_f1: 0.5133
 epoch: 40, train_loss: 0.7170, test_loss: 1.1673, test_f1: 0.5857
 epoch: 41, train_loss: 0.7194, test_loss: 1.1383, test_f1: 0.5811
 epoch: 42, train_loss: 0.7164, test_loss: 1.4324, test_f1: 0.5997
 epoch: 43, train_loss: 0.7160, test_loss: 1.1095, test_f1: 0.5252
 epoch: 44, train_loss: 0.7173, test_loss: 1.3083, test_f1: 0.5207
 epoch: 45, train_loss: 0.7541, test_loss: 1.2236, test_f1: 0.5673
 epoch: 46, train_loss: 0.7276, test_loss: 1.4946, test_f1: 0.5777
 epoch: 47, train_loss: 0.7231, test_loss: 1.3584, test_f1: 0.5133
 epoch: 48, train_loss: 0.6995, test_loss: 1.3909, test_f1: 0.5612
 epoch: 49, train_loss: 0.6972, test_loss: 1.4469, test_f1: 0.5904
 epoch: 50, train_loss: 0.6951, test_loss: 1.2771, test_f1: 0.5775
 epoch: 51, train_loss: 0.6900, test_loss: 1.1306, test_f1: 0.5829
 epoch: 52, train_loss: 0.6690, test_loss: 1.3118, test_f1: 0.5566
 epoch: 53, train_loss: 0.6482, test_loss: 1.2039, test_f1: 0.6115
 epoch: 54, train_loss: 0.6507, test_loss: 1.3560, test_f1: 0.5772
 epoch: 55, train_loss: 0.6483, test_loss: 1.3900, test_f1: 0.5810
 epoch: 56, train_loss: 0.6496, test_loss: 1.6116, test_f1: 0.5673
 epoch: 57, train_loss: 0.6355, test_loss: 1.5748, test_f1: 0.5625
 epoch: 58, train_loss: 0.6472, test_loss: 1.4815, test_f1: 0.5600
 epoch: 59, train_loss: 0.6257, test_loss: 1.5465, test_f1: 0.5761
 epoch: 60, train_loss: 0.6282, test_loss: 1.9492, test_f1: 0.5594
 epoch: 61, train_loss: 0.6640, test_loss: 1.5984, test_f1: 0.5834
 epoch: 62, train_loss: 0.6462, test_loss: 1.4379, test_f1: 0.5556
 epoch: 63, train_loss: 0.6300, test_loss: 1.8586, test_f1: 0.5600
 epoch: 64, train_loss: 0.6253, test_loss: 1.6533, test_f1: 0.5913
 epoch: 65, train_loss: 0.6191, test_loss: 2.0664, test_f1: 0.5716
 epoch: 66, train_loss: 0.6200, test_loss: 2.0240, test_f1: 0.5826
 epoch: 67, train_loss: 0.6331, test_loss: 2.0494, test_f1: 0.5825
 epoch: 68, train_loss: 0.6282, test_loss: 1.8294, test_f1: 0.5868
 epoch: 69, train_loss: 0.6062, test_loss: 1.7352, test_f1: 0.6017
 epoch: 70, train_loss: 0.6254, test_loss: 1.7644, test_f1: 0.5861
 epoch: 71, train_loss: 0.6349, test_loss: 1.7287, test_f1: 0.6085
 epoch: 72, train_loss: 0.6182, test_loss: 1.7962, test_f1: 0.5994
 epoch: 73, train_loss: 0.6195, test_loss: 2.1950, test_f1: 0.5674
 epoch: 74, train_loss: 0.6114, test_loss: 2.1375, test_f1: 0.6179
 epoch: 75, train_loss: 0.6067, test_loss: 1.2439, test_f1: 0.5911
 epoch: 76, train_loss: 0.6200, test_loss: 1.8439, test_f1: 0.6161
 epoch: 77, train_loss: 0.6074, test_loss: 2.0595, test_f1: 0.5917
 epoch: 78, train_loss: 0.6125, test_loss: 1.9727, test_f1: 0.5732
 epoch: 79, train_loss: 0.6154, test_loss: 1.7458, test_f1: 0.5637
 epoch: 80, train_loss: 0.6263, test_loss: 1.9811, test_f1: 0.5577
 epoch: 81, train_loss: 0.6362, test_loss: 2.2814, test_f1: 0.5802
 epoch: 82, train_loss: 0.6079, test_loss: 1.6709, test_f1: 0.5331
 epoch: 83, train_loss: 0.5887, test_loss: 1.8086, test_f1: 0.5703
 epoch: 84, train_loss: 0.5987, test_loss: 2.1089, test_f1: 0.6023
 epoch: 85, train_loss: 0.5874, test_loss: 1.8697, test_f1: 0.5545
 epoch: 86, train_loss: 0.5851, test_loss: 2.0892, test_f1: 0.5941
 epoch: 87, train_loss: 0.5913, test_loss: 2.0570, test_f1: 0.6058
 epoch: 88, train_loss: 0.5765, test_loss: 1.7913, test_f1: 0.6244
 epoch: 89, train_loss: 0.5952, test_loss: 2.0283, test_f1: 0.5676
 epoch: 90, train_loss: 0.6001, test_loss: 1.7222, test_f1: 0.6260
 epoch: 91, train_loss: 0.5803, test_loss: 2.2297, test_f1: 0.5962
 epoch: 92, train_loss: 0.5848, test_loss: 2.3307, test_f1: 0.5729
 epoch: 93, train_loss: 0.5867, test_loss: 1.6748, test_f1: 0.5739
 epoch: 94, train_loss: 0.6414, test_loss: 2.6812, test_f1: 0.5451
 epoch: 95, train_loss: 0.6128, test_loss: 2.1040, test_f1: 0.6025
 epoch: 96, train_loss: 0.5912, test_loss: 2.3336, test_f1: 0.6042
 epoch: 97, train_loss: 0.5911, test_loss: 2.0090, test_f1: 0.5265
 epoch: 98, train_loss: 0.5794, test_loss: 1.6359, test_f1: 0.5903
 epoch: 99, train_loss: 0.5622, test_loss: 2.1115, test_f1: 0.5917
##################ITERATION #9 ****************************************
 epoch: 0, train_loss: 1.2051, test_loss: 1.2528, test_f1: 0.3185
 epoch: 1, train_loss: 1.0527, test_loss: 1.1118, test_f1: 0.4956
 epoch: 2, train_loss: 0.9602, test_loss: 1.7171, test_f1: 0.4136
 epoch: 3, train_loss: 0.9368, test_loss: 1.0374, test_f1: 0.5118
 epoch: 4, train_loss: 0.9156, test_loss: 1.1197, test_f1: 0.4519
 epoch: 5, train_loss: 0.8959, test_loss: 1.6964, test_f1: 0.3641
 epoch: 6, train_loss: 0.8812, test_loss: 1.0793, test_f1: 0.5181
 epoch: 7, train_loss: 0.8479, test_loss: 1.2163, test_f1: 0.4366
 epoch: 8, train_loss: 0.8236, test_loss: 1.0187, test_f1: 0.5831
 epoch: 9, train_loss: 0.8204, test_loss: 0.9873, test_f1: 0.5881
 epoch: 10, train_loss: 0.8472, test_loss: 1.5379, test_f1: 0.4263
 epoch: 11, train_loss: 0.8184, test_loss: 1.0063, test_f1: 0.5473
 epoch: 12, train_loss: 0.8038, test_loss: 1.2057, test_f1: 0.5397
 epoch: 13, train_loss: 0.8186, test_loss: 0.9293, test_f1: 0.6044
 epoch: 14, train_loss: 0.7900, test_loss: 1.1382, test_f1: 0.5546
 epoch: 15, train_loss: 0.8092, test_loss: 1.0564, test_f1: 0.5809
 epoch: 16, train_loss: 0.7963, test_loss: 1.0404, test_f1: 0.5942
 epoch: 17, train_loss: 0.8031, test_loss: 1.0907, test_f1: 0.5868
 epoch: 18, train_loss: 0.7835, test_loss: 0.9444, test_f1: 0.6275
 epoch: 19, train_loss: 0.7591, test_loss: 1.0269, test_f1: 0.5357
 epoch: 20, train_loss: 0.7814, test_loss: 0.9088, test_f1: 0.6323
 epoch: 21, train_loss: 0.7697, test_loss: 1.2203, test_f1: 0.5737
 epoch: 22, train_loss: 0.7612, test_loss: 1.1240, test_f1: 0.5230
 epoch: 23, train_loss: 0.7948, test_loss: 1.1170, test_f1: 0.5351
 epoch: 24, train_loss: 0.7580, test_loss: 1.3751, test_f1: 0.4614
 epoch: 25, train_loss: 0.7345, test_loss: 1.1572, test_f1: 0.4645
 epoch: 26, train_loss: 0.7353, test_loss: 1.3892, test_f1: 0.5148
 epoch: 27, train_loss: 0.7299, test_loss: 1.3380, test_f1: 0.5073
 epoch: 28, train_loss: 0.7474, test_loss: 0.9084, test_f1: 0.6221
 epoch: 29, train_loss: 0.7505, test_loss: 0.9946, test_f1: 0.6503
 epoch: 30, train_loss: 0.7183, test_loss: 1.0521, test_f1: 0.6065
 epoch: 31, train_loss: 0.6998, test_loss: 0.9639, test_f1: 0.6343
 epoch: 32, train_loss: 0.7116, test_loss: 1.0513, test_f1: 0.5537
 epoch: 33, train_loss: 0.7259, test_loss: 1.1932, test_f1: 0.5558
 epoch: 34, train_loss: 0.7488, test_loss: 1.2694, test_f1: 0.5678
 epoch: 35, train_loss: 0.7041, test_loss: 1.0455, test_f1: 0.5769
 epoch: 36, train_loss: 0.6771, test_loss: 0.9620, test_f1: 0.5952
 epoch: 37, train_loss: 0.6895, test_loss: 1.2032, test_f1: 0.5830
 epoch: 38, train_loss: 0.6807, test_loss: 0.9625, test_f1: 0.6300
 epoch: 39, train_loss: 0.6751, test_loss: 1.5108, test_f1: 0.5256
 epoch: 40, train_loss: 0.7060, test_loss: 1.2753, test_f1: 0.4983
 epoch: 41, train_loss: 0.6915, test_loss: 1.1136, test_f1: 0.5631
 epoch: 42, train_loss: 0.7017, test_loss: 1.1555, test_f1: 0.5825
 epoch: 43, train_loss: 0.6905, test_loss: 1.1333, test_f1: 0.4899
 epoch: 44, train_loss: 0.6829, test_loss: 1.1919, test_f1: 0.6075
 epoch: 45, train_loss: 0.6818, test_loss: 1.1495, test_f1: 0.6150
 epoch: 46, train_loss: 0.6567, test_loss: 1.1091, test_f1: 0.5912
 epoch: 47, train_loss: 0.6271, test_loss: 1.2917, test_f1: 0.6231
 epoch: 48, train_loss: 0.6401, test_loss: 1.1671, test_f1: 0.6422
 epoch: 49, train_loss: 0.6408, test_loss: 1.1556, test_f1: 0.5710
 epoch: 50, train_loss: 0.6474, test_loss: 1.2288, test_f1: 0.6182
 epoch: 51, train_loss: 0.6318, test_loss: 1.2173, test_f1: 0.6331
 epoch: 52, train_loss: 0.6124, test_loss: 1.2316, test_f1: 0.6317
 epoch: 53, train_loss: 0.5886, test_loss: 1.1958, test_f1: 0.6148
 epoch: 54, train_loss: 0.6021, test_loss: 1.0989, test_f1: 0.6201
 epoch: 55, train_loss: 0.5918, test_loss: 1.2292, test_f1: 0.6173
 epoch: 56, train_loss: 0.5881, test_loss: 1.2389, test_f1: 0.6454
 epoch: 57, train_loss: 0.5841, test_loss: 1.1047, test_f1: 0.6351
 epoch: 58, train_loss: 0.5900, test_loss: 1.5134, test_f1: 0.5753
 epoch: 59, train_loss: 0.5745, test_loss: 1.2009, test_f1: 0.6086
 epoch: 60, train_loss: 0.5656, test_loss: 1.3153, test_f1: 0.6375
 epoch: 61, train_loss: 0.5677, test_loss: 1.0966, test_f1: 0.6712
 epoch: 62, train_loss: 0.5959, test_loss: 1.2789, test_f1: 0.6282
 epoch: 63, train_loss: 0.5728, test_loss: 1.5280, test_f1: 0.5826
 epoch: 64, train_loss: 0.5485, test_loss: 1.1407, test_f1: 0.6134
 epoch: 65, train_loss: 0.5682, test_loss: 1.1255, test_f1: 0.6301
 epoch: 66, train_loss: 0.5545, test_loss: 1.4531, test_f1: 0.5574
 epoch: 67, train_loss: 0.5432, test_loss: 1.4273, test_f1: 0.5432
 epoch: 68, train_loss: 0.5458, test_loss: 1.4960, test_f1: 0.6072
 epoch: 69, train_loss: 0.5637, test_loss: 1.9376, test_f1: 0.5675
 epoch: 70, train_loss: 0.5737, test_loss: 1.4173, test_f1: 0.5826
 epoch: 71, train_loss: 0.5587, test_loss: 1.2289, test_f1: 0.6164
 epoch: 72, train_loss: 0.5488, test_loss: 1.3536, test_f1: 0.5760
 epoch: 73, train_loss: 0.5485, test_loss: 1.2673, test_f1: 0.5994
 epoch: 74, train_loss: 0.5275, test_loss: 1.5617, test_f1: 0.6284
 epoch: 75, train_loss: 0.5192, test_loss: 1.5065, test_f1: 0.6052
 epoch: 76, train_loss: 0.5176, test_loss: 1.5476, test_f1: 0.6093
 epoch: 77, train_loss: 0.4997, test_loss: 1.8644, test_f1: 0.5152
 epoch: 78, train_loss: 0.5236, test_loss: 1.1366, test_f1: 0.6517
 epoch: 79, train_loss: 0.5343, test_loss: 1.6307, test_f1: 0.5870
 epoch: 80, train_loss: 0.5199, test_loss: 1.7057, test_f1: 0.6175
 epoch: 81, train_loss: 0.5010, test_loss: 1.5230, test_f1: 0.5788
 epoch: 82, train_loss: 0.4827, test_loss: 1.6331, test_f1: 0.5899
 epoch: 83, train_loss: 0.5124, test_loss: 1.9685, test_f1: 0.5545
 epoch: 84, train_loss: 0.4942, test_loss: 1.7977, test_f1: 0.6117
 epoch: 85, train_loss: 0.4706, test_loss: 1.7665, test_f1: 0.6019
 epoch: 86, train_loss: 0.4828, test_loss: 1.8138, test_f1: 0.5493
 epoch: 87, train_loss: 0.5056, test_loss: 1.4914, test_f1: 0.6237
 epoch: 88, train_loss: 0.4834, test_loss: 1.3131, test_f1: 0.6323
 epoch: 89, train_loss: 0.4794, test_loss: 1.7646, test_f1: 0.5875
 epoch: 90, train_loss: 0.4720, test_loss: 1.7924, test_f1: 0.5710
 epoch: 91, train_loss: 0.4854, test_loss: 1.2944, test_f1: 0.5883
 epoch: 92, train_loss: 0.4873, test_loss: 1.7501, test_f1: 0.6048
 epoch: 93, train_loss: 0.4817, test_loss: 1.8790, test_f1: 0.5806
 epoch: 94, train_loss: 0.4634, test_loss: 1.6186, test_f1: 0.6380
 epoch: 95, train_loss: 0.4745, test_loss: 1.6628, test_f1: 0.5982
 epoch: 96, train_loss: 0.4629, test_loss: 1.7244, test_f1: 0.6076
 epoch: 97, train_loss: 0.4896, test_loss: 1.4751, test_f1: 0.5868
 epoch: 98, train_loss: 0.4712, test_loss: 1.9074, test_f1: 0.6160
 epoch: 99, train_loss: 0.4508, test_loss: 1.7856, test_f1: 0.6019

Training completed in 777.43 seconds
Best F1: 0.7266 at epoch 66
Mean F1 across iterations: 0.6737  0.0257
========================FINAL RESULTS================================
FEGIN weighted F1: 0.7266  0.0257
python main.py --data ltspice_demos --representation component_pin --model FEGIN --layers 6 --hiddens 32 --batch_size 64 --lr 0.01 --emb_size 250 --epochs 100 --save_appendix component_pin_L6_H32_BS64_LR0.01_E250 --no_val
-----



STDERR:
  File "main.py", line 370, in <module>
    main()
  File "main.py", line 254, in main
    dataset = dataset_class(
  File "/home/philip/projects/ltspice_examples_code_repo/Circuit-Completion-Using-GNNs/component_classification_with_link_prediction_head/evaluation/FEGIN/kernel/circuit_datasets.py", line 15, in __init__
    self.data, self.slices = torch.load(self.processed_paths[0])
  File "/home/philip/.local/lib/python3.8/site-packages/torch/serialization.py", line 1040, in load
    warnings.warn(
  File "/usr/lib/python3.8/warnings.py", line 109, in _showwarnmsg
    sw(msg.message, msg.category, msg.filename, msg.lineno,
  File "main.py", line 47, in warn_with_traceback
    traceback.print_stack(file=log)
/home/philip/projects/ltspice_examples_code_repo/Circuit-Completion-Using-GNNs/component_classification_with_link_prediction_head/evaluation/FEGIN/kernel/circuit_datasets.py:15: FutureWarning: You are using `torch.load` with `weights_only=False` (the current default value), which uses the default pickle module implicitly. It is possible to construct malicious pickle data which will execute arbitrary code during unpickling (See https://github.com/pytorch/pytorch/blob/main/SECURITY.md#untrusted-models for more details). In a future release, the default value for `weights_only` will be flipped to `True`. This limits the functions that could be executed during unpickling. Arbitrary objects will no longer be allowed to be loaded via this mode unless they are explicitly allowlisted by the user via `torch.serialization.add_safe_globals`. We recommend you start setting `weights_only=True` for any use case where you don't have full control of the loaded file. Please open an issue on GitHub for any issues related to this experimental feature.
  self.data, self.slices = torch.load(self.processed_paths[0])
