STDOUT:
Results will be saved in /home/philip/projects/ltspice_examples_code_repo/Circuit-Completion-Using-GNNs/component_classification_with_link_prediction_head/evaluation/FEGIN/results/model_FEGIN_dataset_ltspice_demos
Command line input: python main.py --data ltspice_demos --representation component_pin_net --model FEGIN --layers 3 --hiddens 128 --batch_size 256 --lr 0.0001 --emb_size 128 --epochs 100 --save_appendix component_pin_net_L3_H128_BS256_LR0.0001_E128 --no_val
 is saved.
-----
ltspice_demos - FEGIN
Using 3 layers, 128 hidden units, h = 2
Loading component_pin_net representation dataset
ENTERED
Training FEGIN on component_pin_net representation
Train: 1565, Test: 383
##################ITERATION #0 ****************************************
 epoch: 0, train_loss: 1.3886, test_loss: 1.3913, test_f1: 0.0301
 epoch: 1, train_loss: 1.3787, test_loss: 1.3886, test_f1: 0.0301
 epoch: 2, train_loss: 1.3730, test_loss: 1.3855, test_f1: 0.1419
 epoch: 3, train_loss: 1.3659, test_loss: 1.3814, test_f1: 0.1365
 epoch: 4, train_loss: 1.3577, test_loss: 1.3768, test_f1: 0.1365
 epoch: 5, train_loss: 1.3492, test_loss: 1.3713, test_f1: 0.1365
 epoch: 6, train_loss: 1.3392, test_loss: 1.3640, test_f1: 0.2453
 epoch: 7, train_loss: 1.3261, test_loss: 1.3539, test_f1: 0.3420
 epoch: 8, train_loss: 1.3096, test_loss: 1.3395, test_f1: 0.3458
 epoch: 9, train_loss: 1.2933, test_loss: 1.3222, test_f1: 0.3364
 epoch: 10, train_loss: 1.2733, test_loss: 1.3039, test_f1: 0.3460
 epoch: 11, train_loss: 1.2524, test_loss: 1.2849, test_f1: 0.3414
 epoch: 12, train_loss: 1.2320, test_loss: 1.2681, test_f1: 0.3529
 epoch: 13, train_loss: 1.2120, test_loss: 1.2537, test_f1: 0.3562
 epoch: 14, train_loss: 1.1949, test_loss: 1.2412, test_f1: 0.3586
 epoch: 15, train_loss: 1.1785, test_loss: 1.2316, test_f1: 0.3636
 epoch: 16, train_loss: 1.1660, test_loss: 1.2244, test_f1: 0.3590
 epoch: 17, train_loss: 1.1538, test_loss: 1.2181, test_f1: 0.3866
 epoch: 18, train_loss: 1.1443, test_loss: 1.2130, test_f1: 0.4024
 epoch: 19, train_loss: 1.1332, test_loss: 1.2084, test_f1: 0.4200
 epoch: 20, train_loss: 1.1262, test_loss: 1.2053, test_f1: 0.4296
 epoch: 21, train_loss: 1.1205, test_loss: 1.2011, test_f1: 0.4330
 epoch: 22, train_loss: 1.1158, test_loss: 1.1998, test_f1: 0.4327
 epoch: 23, train_loss: 1.1101, test_loss: 1.1976, test_f1: 0.4328
 epoch: 24, train_loss: 1.1049, test_loss: 1.1944, test_f1: 0.4322
 epoch: 25, train_loss: 1.1038, test_loss: 1.1918, test_f1: 0.4409
 epoch: 26, train_loss: 1.1000, test_loss: 1.1890, test_f1: 0.4408
 epoch: 27, train_loss: 1.0930, test_loss: 1.1864, test_f1: 0.4397
 epoch: 28, train_loss: 1.0906, test_loss: 1.1833, test_f1: 0.4354
 epoch: 29, train_loss: 1.0824, test_loss: 1.1837, test_f1: 0.4405
 epoch: 30, train_loss: 1.0789, test_loss: 1.1794, test_f1: 0.4447
 epoch: 31, train_loss: 1.0724, test_loss: 1.1748, test_f1: 0.4454
 epoch: 32, train_loss: 1.0690, test_loss: 1.1706, test_f1: 0.4392
 epoch: 33, train_loss: 1.0672, test_loss: 1.1684, test_f1: 0.4449
 epoch: 34, train_loss: 1.0617, test_loss: 1.1669, test_f1: 0.4431
 epoch: 35, train_loss: 1.0564, test_loss: 1.1651, test_f1: 0.4428
 epoch: 36, train_loss: 1.0472, test_loss: 1.1608, test_f1: 0.4400
 epoch: 37, train_loss: 1.0457, test_loss: 1.1599, test_f1: 0.4422
 epoch: 38, train_loss: 1.0363, test_loss: 1.1568, test_f1: 0.4426
 epoch: 39, train_loss: 1.0314, test_loss: 1.1453, test_f1: 0.4504
 epoch: 40, train_loss: 1.0185, test_loss: 1.1409, test_f1: 0.4480
 epoch: 41, train_loss: 1.0144, test_loss: 1.1386, test_f1: 0.4452
 epoch: 42, train_loss: 1.0073, test_loss: 1.1297, test_f1: 0.4451
 epoch: 43, train_loss: 1.0028, test_loss: 1.1241, test_f1: 0.4606
 epoch: 44, train_loss: 0.9972, test_loss: 1.1197, test_f1: 0.4715
 epoch: 45, train_loss: 0.9895, test_loss: 1.1150, test_f1: 0.4628
 epoch: 46, train_loss: 0.9810, test_loss: 1.1117, test_f1: 0.4598
 epoch: 47, train_loss: 0.9737, test_loss: 1.1034, test_f1: 0.4714
 epoch: 48, train_loss: 0.9722, test_loss: 1.1008, test_f1: 0.4717
 epoch: 49, train_loss: 0.9593, test_loss: 1.0981, test_f1: 0.4630
 epoch: 50, train_loss: 0.9598, test_loss: 1.0967, test_f1: 0.5089
 epoch: 51, train_loss: 0.9557, test_loss: 1.0863, test_f1: 0.5111
 epoch: 52, train_loss: 0.9454, test_loss: 1.0858, test_f1: 0.5227
 epoch: 53, train_loss: 0.9480, test_loss: 1.0836, test_f1: 0.5233
 epoch: 54, train_loss: 0.9420, test_loss: 1.0784, test_f1: 0.5090
 epoch: 55, train_loss: 0.9400, test_loss: 1.0711, test_f1: 0.5180
 epoch: 56, train_loss: 0.9352, test_loss: 1.0722, test_f1: 0.4933
 epoch: 57, train_loss: 0.9319, test_loss: 1.0752, test_f1: 0.5161
 epoch: 58, train_loss: 0.9280, test_loss: 1.0687, test_f1: 0.5031
 epoch: 59, train_loss: 0.9332, test_loss: 1.0692, test_f1: 0.5026
 epoch: 60, train_loss: 0.9282, test_loss: 1.0673, test_f1: 0.5112
 epoch: 61, train_loss: 0.9246, test_loss: 1.0704, test_f1: 0.5129
 epoch: 62, train_loss: 0.9226, test_loss: 1.0668, test_f1: 0.5224
 epoch: 63, train_loss: 0.9193, test_loss: 1.0625, test_f1: 0.5200
 epoch: 64, train_loss: 0.9171, test_loss: 1.0646, test_f1: 0.5159
 epoch: 65, train_loss: 0.9171, test_loss: 1.0634, test_f1: 0.5220
 epoch: 66, train_loss: 0.9175, test_loss: 1.0621, test_f1: 0.5280
 epoch: 67, train_loss: 0.9121, test_loss: 1.0603, test_f1: 0.5371
 epoch: 68, train_loss: 0.9151, test_loss: 1.0577, test_f1: 0.5185
 epoch: 69, train_loss: 0.9105, test_loss: 1.0455, test_f1: 0.5354
 epoch: 70, train_loss: 0.9003, test_loss: 1.0468, test_f1: 0.5546
 epoch: 71, train_loss: 0.8977, test_loss: 1.0493, test_f1: 0.5437
 epoch: 72, train_loss: 0.9005, test_loss: 1.0488, test_f1: 0.5499
 epoch: 73, train_loss: 0.8995, test_loss: 1.0534, test_f1: 0.5484
 epoch: 74, train_loss: 0.9012, test_loss: 1.0452, test_f1: 0.5519
 epoch: 75, train_loss: 0.8936, test_loss: 1.0439, test_f1: 0.5638
 epoch: 76, train_loss: 0.8900, test_loss: 1.0454, test_f1: 0.5617
 epoch: 77, train_loss: 0.8901, test_loss: 1.0395, test_f1: 0.5635
 epoch: 78, train_loss: 0.8933, test_loss: 1.0410, test_f1: 0.5616
 epoch: 79, train_loss: 0.8894, test_loss: 1.0363, test_f1: 0.5680
 epoch: 80, train_loss: 0.8922, test_loss: 1.0298, test_f1: 0.5541
 epoch: 81, train_loss: 0.8820, test_loss: 1.0376, test_f1: 0.5542
 epoch: 82, train_loss: 0.8796, test_loss: 1.0360, test_f1: 0.5566
 epoch: 83, train_loss: 0.8771, test_loss: 1.0330, test_f1: 0.5524
 epoch: 84, train_loss: 0.8741, test_loss: 1.0320, test_f1: 0.5521
 epoch: 85, train_loss: 0.8745, test_loss: 1.0327, test_f1: 0.5505
 epoch: 86, train_loss: 0.8687, test_loss: 1.0279, test_f1: 0.5524
 epoch: 87, train_loss: 0.8724, test_loss: 1.0277, test_f1: 0.5503
 epoch: 88, train_loss: 0.8684, test_loss: 1.0271, test_f1: 0.5625
 epoch: 89, train_loss: 0.8660, test_loss: 1.0263, test_f1: 0.5624
 epoch: 90, train_loss: 0.8690, test_loss: 1.0265, test_f1: 0.5647
 epoch: 91, train_loss: 0.8615, test_loss: 1.0299, test_f1: 0.5640
 epoch: 92, train_loss: 0.8615, test_loss: 1.0313, test_f1: 0.5594
 epoch: 93, train_loss: 0.8503, test_loss: 1.0289, test_f1: 0.5584
 epoch: 94, train_loss: 0.8514, test_loss: 1.0246, test_f1: 0.5524
 epoch: 95, train_loss: 0.8490, test_loss: 1.0261, test_f1: 0.5560
 epoch: 96, train_loss: 0.8471, test_loss: 1.0190, test_f1: 0.5538
 epoch: 97, train_loss: 0.8482, test_loss: 1.0183, test_f1: 0.5602
 epoch: 98, train_loss: 0.8457, test_loss: 1.0121, test_f1: 0.5652
 epoch: 99, train_loss: 0.8398, test_loss: 1.0089, test_f1: 0.5696
##################ITERATION #1 ****************************************
 epoch: 0, train_loss: 1.3531, test_loss: 1.3767, test_f1: 0.1365
 epoch: 1, train_loss: 1.3155, test_loss: 1.3655, test_f1: 0.1365
 epoch: 2, train_loss: 1.2906, test_loss: 1.3499, test_f1: 0.1365
 epoch: 3, train_loss: 1.2675, test_loss: 1.3335, test_f1: 0.3302
 epoch: 4, train_loss: 1.2437, test_loss: 1.3167, test_f1: 0.3247
 epoch: 5, train_loss: 1.2209, test_loss: 1.2997, test_f1: 0.3247
 epoch: 6, train_loss: 1.1961, test_loss: 1.2821, test_f1: 0.3477
 epoch: 7, train_loss: 1.1773, test_loss: 1.2614, test_f1: 0.4153
 epoch: 8, train_loss: 1.1544, test_loss: 1.2381, test_f1: 0.4273
 epoch: 9, train_loss: 1.1402, test_loss: 1.2170, test_f1: 0.4388
 epoch: 10, train_loss: 1.1215, test_loss: 1.1969, test_f1: 0.4385
 epoch: 11, train_loss: 1.1067, test_loss: 1.1815, test_f1: 0.4515
 epoch: 12, train_loss: 1.0922, test_loss: 1.1697, test_f1: 0.4516
 epoch: 13, train_loss: 1.0840, test_loss: 1.1606, test_f1: 0.4516
 epoch: 14, train_loss: 1.0725, test_loss: 1.1530, test_f1: 0.4440
 epoch: 15, train_loss: 1.0619, test_loss: 1.1489, test_f1: 0.4418
 epoch: 16, train_loss: 1.0496, test_loss: 1.1442, test_f1: 0.4440
 epoch: 17, train_loss: 1.0423, test_loss: 1.1391, test_f1: 0.4442
 epoch: 18, train_loss: 1.0374, test_loss: 1.1321, test_f1: 0.4459
 epoch: 19, train_loss: 1.0233, test_loss: 1.1244, test_f1: 0.4463
 epoch: 20, train_loss: 1.0203, test_loss: 1.1154, test_f1: 0.4466
 epoch: 21, train_loss: 1.0140, test_loss: 1.1127, test_f1: 0.4488
 epoch: 22, train_loss: 1.0079, test_loss: 1.1107, test_f1: 0.4545
 epoch: 23, train_loss: 0.9984, test_loss: 1.1084, test_f1: 0.4553
 epoch: 24, train_loss: 0.9964, test_loss: 1.1046, test_f1: 0.4630
 epoch: 25, train_loss: 0.9918, test_loss: 1.1010, test_f1: 0.4607
 epoch: 26, train_loss: 0.9885, test_loss: 1.0989, test_f1: 0.4615
 epoch: 27, train_loss: 0.9796, test_loss: 1.0948, test_f1: 0.4579
 epoch: 28, train_loss: 0.9748, test_loss: 1.0911, test_f1: 0.4579
 epoch: 29, train_loss: 0.9752, test_loss: 1.0863, test_f1: 0.4607
 epoch: 30, train_loss: 0.9712, test_loss: 1.0913, test_f1: 0.4698
 epoch: 31, train_loss: 0.9691, test_loss: 1.0886, test_f1: 0.4512
 epoch: 32, train_loss: 0.9635, test_loss: 1.0780, test_f1: 0.4841
 epoch: 33, train_loss: 0.9614, test_loss: 1.0758, test_f1: 0.4895
 epoch: 34, train_loss: 0.9591, test_loss: 1.0746, test_f1: 0.5027
 epoch: 35, train_loss: 0.9497, test_loss: 1.0683, test_f1: 0.5177
 epoch: 36, train_loss: 0.9473, test_loss: 1.0714, test_f1: 0.5017
 epoch: 37, train_loss: 0.9396, test_loss: 1.0767, test_f1: 0.5108
 epoch: 38, train_loss: 0.9378, test_loss: 1.0814, test_f1: 0.5151
 epoch: 39, train_loss: 0.9400, test_loss: 1.0697, test_f1: 0.5039
 epoch: 40, train_loss: 0.9377, test_loss: 1.0719, test_f1: 0.5051
 epoch: 41, train_loss: 0.9326, test_loss: 1.0612, test_f1: 0.4934
 epoch: 42, train_loss: 0.9281, test_loss: 1.0624, test_f1: 0.5184
 epoch: 43, train_loss: 0.9239, test_loss: 1.0592, test_f1: 0.5389
 epoch: 44, train_loss: 0.9191, test_loss: 1.0576, test_f1: 0.5421
 epoch: 45, train_loss: 0.9168, test_loss: 1.0658, test_f1: 0.5144
 epoch: 46, train_loss: 0.9132, test_loss: 1.0592, test_f1: 0.5580
 epoch: 47, train_loss: 0.9006, test_loss: 1.0577, test_f1: 0.5566
 epoch: 48, train_loss: 0.9066, test_loss: 1.0555, test_f1: 0.5198
 epoch: 49, train_loss: 0.9039, test_loss: 1.0567, test_f1: 0.5185
 epoch: 50, train_loss: 0.8992, test_loss: 1.0599, test_f1: 0.5310
 epoch: 51, train_loss: 0.8944, test_loss: 1.0531, test_f1: 0.5279
 epoch: 52, train_loss: 0.8961, test_loss: 1.0494, test_f1: 0.5359
 epoch: 53, train_loss: 0.8935, test_loss: 1.0466, test_f1: 0.5290
 epoch: 54, train_loss: 0.8891, test_loss: 1.0509, test_f1: 0.5356
 epoch: 55, train_loss: 0.8871, test_loss: 1.0548, test_f1: 0.5359
 epoch: 56, train_loss: 0.8838, test_loss: 1.0530, test_f1: 0.5337
 epoch: 57, train_loss: 0.8782, test_loss: 1.0502, test_f1: 0.5472
 epoch: 58, train_loss: 0.8812, test_loss: 1.0451, test_f1: 0.5440
 epoch: 59, train_loss: 0.8759, test_loss: 1.0548, test_f1: 0.5337
 epoch: 60, train_loss: 0.8749, test_loss: 1.0517, test_f1: 0.5438
 epoch: 61, train_loss: 0.8753, test_loss: 1.0461, test_f1: 0.5536
 epoch: 62, train_loss: 0.8729, test_loss: 1.0442, test_f1: 0.5553
 epoch: 63, train_loss: 0.8693, test_loss: 1.0451, test_f1: 0.5466
 epoch: 64, train_loss: 0.8669, test_loss: 1.0457, test_f1: 0.5351
 epoch: 65, train_loss: 0.8693, test_loss: 1.0459, test_f1: 0.5601
 epoch: 66, train_loss: 0.8725, test_loss: 1.0436, test_f1: 0.5621
 epoch: 67, train_loss: 0.8651, test_loss: 1.0477, test_f1: 0.5507
 epoch: 68, train_loss: 0.8628, test_loss: 1.0410, test_f1: 0.5551
 epoch: 69, train_loss: 0.8578, test_loss: 1.0375, test_f1: 0.5519
 epoch: 70, train_loss: 0.8659, test_loss: 1.0353, test_f1: 0.5387
 epoch: 71, train_loss: 0.8620, test_loss: 1.0324, test_f1: 0.5437
 epoch: 72, train_loss: 0.8618, test_loss: 1.0517, test_f1: 0.5321
 epoch: 73, train_loss: 0.8562, test_loss: 1.0465, test_f1: 0.5321
 epoch: 74, train_loss: 0.8602, test_loss: 1.0313, test_f1: 0.5467
 epoch: 75, train_loss: 0.8580, test_loss: 1.0317, test_f1: 0.5641
 epoch: 76, train_loss: 0.8450, test_loss: 1.0321, test_f1: 0.5496
 epoch: 77, train_loss: 0.8478, test_loss: 1.0309, test_f1: 0.5427
 epoch: 78, train_loss: 0.8482, test_loss: 1.0341, test_f1: 0.5542
 epoch: 79, train_loss: 0.8368, test_loss: 1.0367, test_f1: 0.5419
 epoch: 80, train_loss: 0.8364, test_loss: 1.0371, test_f1: 0.5437
 epoch: 81, train_loss: 0.8359, test_loss: 1.0356, test_f1: 0.5477
 epoch: 82, train_loss: 0.8383, test_loss: 1.0284, test_f1: 0.5515
 epoch: 83, train_loss: 0.8391, test_loss: 1.0255, test_f1: 0.5489
 epoch: 84, train_loss: 0.8362, test_loss: 1.0238, test_f1: 0.5502
 epoch: 85, train_loss: 0.8313, test_loss: 1.0367, test_f1: 0.5405
 epoch: 86, train_loss: 0.8344, test_loss: 1.0354, test_f1: 0.5390
 epoch: 87, train_loss: 0.8267, test_loss: 1.0309, test_f1: 0.5441
 epoch: 88, train_loss: 0.8253, test_loss: 1.0332, test_f1: 0.5494
 epoch: 89, train_loss: 0.8211, test_loss: 1.0420, test_f1: 0.5457
 epoch: 90, train_loss: 0.8281, test_loss: 1.0371, test_f1: 0.5458
 epoch: 91, train_loss: 0.8163, test_loss: 1.0157, test_f1: 0.5513
 epoch: 92, train_loss: 0.8253, test_loss: 1.0151, test_f1: 0.5529
 epoch: 93, train_loss: 0.8159, test_loss: 1.0250, test_f1: 0.5611
 epoch: 94, train_loss: 0.8083, test_loss: 1.0230, test_f1: 0.5574
 epoch: 95, train_loss: 0.8121, test_loss: 1.0139, test_f1: 0.5425
 epoch: 96, train_loss: 0.8089, test_loss: 1.0141, test_f1: 0.5489
 epoch: 97, train_loss: 0.8063, test_loss: 1.0220, test_f1: 0.5499
 epoch: 98, train_loss: 0.8103, test_loss: 1.0243, test_f1: 0.5468
 epoch: 99, train_loss: 0.8028, test_loss: 1.0317, test_f1: 0.5551
##################ITERATION #2 ****************************************
 epoch: 0, train_loss: 1.3390, test_loss: 1.3709, test_f1: 0.1365
 epoch: 1, train_loss: 1.2802, test_loss: 1.3564, test_f1: 0.1365
 epoch: 2, train_loss: 1.2490, test_loss: 1.3382, test_f1: 0.1365
 epoch: 3, train_loss: 1.2192, test_loss: 1.3183, test_f1: 0.2028
 epoch: 4, train_loss: 1.1940, test_loss: 1.2969, test_f1: 0.3239
 epoch: 5, train_loss: 1.1707, test_loss: 1.2751, test_f1: 0.3400
 epoch: 6, train_loss: 1.1481, test_loss: 1.2534, test_f1: 0.3515
 epoch: 7, train_loss: 1.1307, test_loss: 1.2306, test_f1: 0.4135
 epoch: 8, train_loss: 1.1143, test_loss: 1.2095, test_f1: 0.4479
 epoch: 9, train_loss: 1.0992, test_loss: 1.1912, test_f1: 0.4351
 epoch: 10, train_loss: 1.0861, test_loss: 1.1773, test_f1: 0.4458
 epoch: 11, train_loss: 1.0765, test_loss: 1.1660, test_f1: 0.4518
 epoch: 12, train_loss: 1.0575, test_loss: 1.1574, test_f1: 0.4470
 epoch: 13, train_loss: 1.0515, test_loss: 1.1471, test_f1: 0.4452
 epoch: 14, train_loss: 1.0407, test_loss: 1.1406, test_f1: 0.4372
 epoch: 15, train_loss: 1.0401, test_loss: 1.1319, test_f1: 0.4439
 epoch: 16, train_loss: 1.0290, test_loss: 1.1251, test_f1: 0.4435
 epoch: 17, train_loss: 1.0226, test_loss: 1.1183, test_f1: 0.4436
 epoch: 18, train_loss: 1.0149, test_loss: 1.1095, test_f1: 0.4425
 epoch: 19, train_loss: 1.0062, test_loss: 1.1074, test_f1: 0.4502
 epoch: 20, train_loss: 0.9964, test_loss: 1.1026, test_f1: 0.4475
 epoch: 21, train_loss: 0.9986, test_loss: 1.0983, test_f1: 0.4496
 epoch: 22, train_loss: 0.9832, test_loss: 1.0953, test_f1: 0.4572
 epoch: 23, train_loss: 0.9857, test_loss: 1.0888, test_f1: 0.4722
 epoch: 24, train_loss: 0.9770, test_loss: 1.0838, test_f1: 0.4862
 epoch: 25, train_loss: 0.9666, test_loss: 1.0756, test_f1: 0.4889
 epoch: 26, train_loss: 0.9688, test_loss: 1.0718, test_f1: 0.5025
 epoch: 27, train_loss: 0.9564, test_loss: 1.0653, test_f1: 0.5092
 epoch: 28, train_loss: 0.9548, test_loss: 1.0676, test_f1: 0.5089
 epoch: 29, train_loss: 0.9503, test_loss: 1.0640, test_f1: 0.5136
 epoch: 30, train_loss: 0.9503, test_loss: 1.0624, test_f1: 0.5133
 epoch: 31, train_loss: 0.9359, test_loss: 1.0560, test_f1: 0.5013
 epoch: 32, train_loss: 0.9326, test_loss: 1.0549, test_f1: 0.5284
 epoch: 33, train_loss: 0.9306, test_loss: 1.0510, test_f1: 0.5311
 epoch: 34, train_loss: 0.9266, test_loss: 1.0512, test_f1: 0.5384
 epoch: 35, train_loss: 0.9216, test_loss: 1.0484, test_f1: 0.5334
 epoch: 36, train_loss: 0.9153, test_loss: 1.0513, test_f1: 0.5325
 epoch: 37, train_loss: 0.9122, test_loss: 1.0535, test_f1: 0.5373
 epoch: 38, train_loss: 0.9160, test_loss: 1.0407, test_f1: 0.5502
 epoch: 39, train_loss: 0.9054, test_loss: 1.0329, test_f1: 0.5560
 epoch: 40, train_loss: 0.8969, test_loss: 1.0277, test_f1: 0.5519
 epoch: 41, train_loss: 0.8994, test_loss: 1.0292, test_f1: 0.5467
 epoch: 42, train_loss: 0.8937, test_loss: 1.0224, test_f1: 0.5217
 epoch: 43, train_loss: 0.8872, test_loss: 1.0256, test_f1: 0.5350
 epoch: 44, train_loss: 0.8808, test_loss: 1.0342, test_f1: 0.5372
 epoch: 45, train_loss: 0.8824, test_loss: 1.0259, test_f1: 0.5404
 epoch: 46, train_loss: 0.8644, test_loss: 1.0164, test_f1: 0.5346
 epoch: 47, train_loss: 0.8618, test_loss: 1.0205, test_f1: 0.5401
 epoch: 48, train_loss: 0.8601, test_loss: 1.0365, test_f1: 0.5614
 epoch: 49, train_loss: 0.8639, test_loss: 1.0349, test_f1: 0.5664
 epoch: 50, train_loss: 0.8521, test_loss: 1.0229, test_f1: 0.5358
 epoch: 51, train_loss: 0.8435, test_loss: 1.0315, test_f1: 0.5352
 epoch: 52, train_loss: 0.8411, test_loss: 1.0306, test_f1: 0.5392
 epoch: 53, train_loss: 0.8476, test_loss: 1.0317, test_f1: 0.5322
 epoch: 54, train_loss: 0.8379, test_loss: 1.0229, test_f1: 0.5300
 epoch: 55, train_loss: 0.8385, test_loss: 1.0256, test_f1: 0.5279
 epoch: 56, train_loss: 0.8392, test_loss: 1.0300, test_f1: 0.5242
 epoch: 57, train_loss: 0.8353, test_loss: 1.0227, test_f1: 0.5464
 epoch: 58, train_loss: 0.8227, test_loss: 1.0216, test_f1: 0.5280
 epoch: 59, train_loss: 0.8247, test_loss: 1.0185, test_f1: 0.5375
 epoch: 60, train_loss: 0.8288, test_loss: 1.0159, test_f1: 0.5377
 epoch: 61, train_loss: 0.8226, test_loss: 1.0258, test_f1: 0.5202
 epoch: 62, train_loss: 0.8192, test_loss: 1.0272, test_f1: 0.5170
 epoch: 63, train_loss: 0.8183, test_loss: 1.0182, test_f1: 0.5243
 epoch: 64, train_loss: 0.8263, test_loss: 1.0189, test_f1: 0.5223
 epoch: 65, train_loss: 0.8116, test_loss: 1.0166, test_f1: 0.5271
 epoch: 66, train_loss: 0.8160, test_loss: 1.0163, test_f1: 0.5246
 epoch: 67, train_loss: 0.8027, test_loss: 1.0167, test_f1: 0.5250
 epoch: 68, train_loss: 0.8072, test_loss: 1.0187, test_f1: 0.5262
 epoch: 69, train_loss: 0.8091, test_loss: 1.0248, test_f1: 0.5249
 epoch: 70, train_loss: 0.8021, test_loss: 1.0218, test_f1: 0.5350
 epoch: 71, train_loss: 0.8008, test_loss: 1.0203, test_f1: 0.5401
 epoch: 72, train_loss: 0.8006, test_loss: 1.0168, test_f1: 0.5239
 epoch: 73, train_loss: 0.8010, test_loss: 1.0204, test_f1: 0.5342
 epoch: 74, train_loss: 0.7894, test_loss: 1.0194, test_f1: 0.5441
 epoch: 75, train_loss: 0.7890, test_loss: 1.0197, test_f1: 0.5394
 epoch: 76, train_loss: 0.7856, test_loss: 1.0193, test_f1: 0.5387
 epoch: 77, train_loss: 0.7878, test_loss: 1.0168, test_f1: 0.5373
 epoch: 78, train_loss: 0.7850, test_loss: 1.0229, test_f1: 0.5428
 epoch: 79, train_loss: 0.7828, test_loss: 1.0191, test_f1: 0.5406
 epoch: 80, train_loss: 0.7830, test_loss: 1.0079, test_f1: 0.5517
 epoch: 81, train_loss: 0.7814, test_loss: 1.0162, test_f1: 0.5502
 epoch: 82, train_loss: 0.7787, test_loss: 1.0139, test_f1: 0.5474
 epoch: 83, train_loss: 0.7686, test_loss: 1.0130, test_f1: 0.5588
 epoch: 84, train_loss: 0.7644, test_loss: 1.0138, test_f1: 0.5554
 epoch: 85, train_loss: 0.7714, test_loss: 1.0143, test_f1: 0.5552
 epoch: 86, train_loss: 0.7659, test_loss: 1.0177, test_f1: 0.5563
 epoch: 87, train_loss: 0.7662, test_loss: 1.0253, test_f1: 0.5461
 epoch: 88, train_loss: 0.7571, test_loss: 1.0271, test_f1: 0.5508
 epoch: 89, train_loss: 0.7626, test_loss: 1.0341, test_f1: 0.5332
 epoch: 90, train_loss: 0.7603, test_loss: 1.0349, test_f1: 0.5443
 epoch: 91, train_loss: 0.7568, test_loss: 1.0308, test_f1: 0.5437
 epoch: 92, train_loss: 0.7524, test_loss: 1.0327, test_f1: 0.5353
 epoch: 93, train_loss: 0.7552, test_loss: 1.0306, test_f1: 0.5421
 epoch: 94, train_loss: 0.7600, test_loss: 1.0259, test_f1: 0.5468
 epoch: 95, train_loss: 0.7453, test_loss: 1.0398, test_f1: 0.5422
 epoch: 96, train_loss: 0.7481, test_loss: 1.0321, test_f1: 0.5490
 epoch: 97, train_loss: 0.7411, test_loss: 1.0284, test_f1: 0.5533
 epoch: 98, train_loss: 0.7406, test_loss: 1.0273, test_f1: 0.5576
 epoch: 99, train_loss: 0.7443, test_loss: 1.0192, test_f1: 0.5544
##################ITERATION #3 ****************************************
 epoch: 0, train_loss: 1.2970, test_loss: 1.3527, test_f1: 0.1365
 epoch: 1, train_loss: 1.2310, test_loss: 1.3367, test_f1: 0.1365
 epoch: 2, train_loss: 1.1990, test_loss: 1.3214, test_f1: 0.1365
 epoch: 3, train_loss: 1.1698, test_loss: 1.3073, test_f1: 0.1365
 epoch: 4, train_loss: 1.1459, test_loss: 1.2926, test_f1: 0.1425
 epoch: 5, train_loss: 1.1246, test_loss: 1.2732, test_f1: 0.2196
 epoch: 6, train_loss: 1.1097, test_loss: 1.2434, test_f1: 0.3561
 epoch: 7, train_loss: 1.0880, test_loss: 1.2108, test_f1: 0.4279
 epoch: 8, train_loss: 1.0716, test_loss: 1.1829, test_f1: 0.4554
 epoch: 9, train_loss: 1.0597, test_loss: 1.1643, test_f1: 0.4602
 epoch: 10, train_loss: 1.0517, test_loss: 1.1498, test_f1: 0.4508
 epoch: 11, train_loss: 1.0370, test_loss: 1.1355, test_f1: 0.4318
 epoch: 12, train_loss: 1.0295, test_loss: 1.1200, test_f1: 0.4339
 epoch: 13, train_loss: 1.0235, test_loss: 1.1101, test_f1: 0.4370
 epoch: 14, train_loss: 1.0120, test_loss: 1.1021, test_f1: 0.4450
 epoch: 15, train_loss: 0.9998, test_loss: 1.0912, test_f1: 0.4685
 epoch: 16, train_loss: 0.9944, test_loss: 1.0827, test_f1: 0.4702
 epoch: 17, train_loss: 0.9921, test_loss: 1.0784, test_f1: 0.4841
 epoch: 18, train_loss: 0.9807, test_loss: 1.0741, test_f1: 0.4818
 epoch: 19, train_loss: 0.9755, test_loss: 1.0695, test_f1: 0.4864
 epoch: 20, train_loss: 0.9669, test_loss: 1.0650, test_f1: 0.4967
 epoch: 21, train_loss: 0.9649, test_loss: 1.0634, test_f1: 0.4948
 epoch: 22, train_loss: 0.9622, test_loss: 1.0605, test_f1: 0.4968
 epoch: 23, train_loss: 0.9547, test_loss: 1.0519, test_f1: 0.5007
 epoch: 24, train_loss: 0.9456, test_loss: 1.0453, test_f1: 0.5022
 epoch: 25, train_loss: 0.9370, test_loss: 1.0415, test_f1: 0.5259
 epoch: 26, train_loss: 0.9392, test_loss: 1.0433, test_f1: 0.5362
 epoch: 27, train_loss: 0.9343, test_loss: 1.0373, test_f1: 0.5402
 epoch: 28, train_loss: 0.9238, test_loss: 1.0347, test_f1: 0.5321
 epoch: 29, train_loss: 0.9198, test_loss: 1.0369, test_f1: 0.5378
 epoch: 30, train_loss: 0.9201, test_loss: 1.0391, test_f1: 0.5467
 epoch: 31, train_loss: 0.9137, test_loss: 1.0380, test_f1: 0.5363
 epoch: 32, train_loss: 0.9101, test_loss: 1.0300, test_f1: 0.5511
 epoch: 33, train_loss: 0.9011, test_loss: 1.0291, test_f1: 0.5544
 epoch: 34, train_loss: 0.8985, test_loss: 1.0203, test_f1: 0.5518
 epoch: 35, train_loss: 0.8975, test_loss: 1.0175, test_f1: 0.5704
 epoch: 36, train_loss: 0.8915, test_loss: 1.0176, test_f1: 0.5639
 epoch: 37, train_loss: 0.8909, test_loss: 1.0151, test_f1: 0.5675
 epoch: 38, train_loss: 0.8868, test_loss: 1.0159, test_f1: 0.5669
 epoch: 39, train_loss: 0.8813, test_loss: 1.0289, test_f1: 0.5401
 epoch: 40, train_loss: 0.8802, test_loss: 1.0165, test_f1: 0.5562
 epoch: 41, train_loss: 0.8783, test_loss: 1.0057, test_f1: 0.5555
 epoch: 42, train_loss: 0.8745, test_loss: 1.0096, test_f1: 0.5497
 epoch: 43, train_loss: 0.8625, test_loss: 1.0097, test_f1: 0.5303
 epoch: 44, train_loss: 0.8638, test_loss: 1.0055, test_f1: 0.5340
 epoch: 45, train_loss: 0.8569, test_loss: 1.0122, test_f1: 0.5428
 epoch: 46, train_loss: 0.8583, test_loss: 1.0053, test_f1: 0.5366
 epoch: 47, train_loss: 0.8521, test_loss: 0.9999, test_f1: 0.5050
 epoch: 48, train_loss: 0.8452, test_loss: 1.0042, test_f1: 0.5103
 epoch: 49, train_loss: 0.8448, test_loss: 0.9953, test_f1: 0.5236
 epoch: 50, train_loss: 0.8413, test_loss: 0.9921, test_f1: 0.5364
 epoch: 51, train_loss: 0.8321, test_loss: 0.9922, test_f1: 0.5366
 epoch: 52, train_loss: 0.8318, test_loss: 1.0034, test_f1: 0.5412
 epoch: 53, train_loss: 0.8272, test_loss: 1.0023, test_f1: 0.5326
 epoch: 54, train_loss: 0.8252, test_loss: 0.9998, test_f1: 0.5259
 epoch: 55, train_loss: 0.8230, test_loss: 0.9977, test_f1: 0.5277
 epoch: 56, train_loss: 0.8275, test_loss: 0.9985, test_f1: 0.5408
 epoch: 57, train_loss: 0.8243, test_loss: 0.9994, test_f1: 0.5478
 epoch: 58, train_loss: 0.8141, test_loss: 0.9982, test_f1: 0.5457
 epoch: 59, train_loss: 0.8132, test_loss: 0.9942, test_f1: 0.5306
 epoch: 60, train_loss: 0.8205, test_loss: 0.9903, test_f1: 0.5271
 epoch: 61, train_loss: 0.8108, test_loss: 0.9887, test_f1: 0.5205
 epoch: 62, train_loss: 0.8062, test_loss: 0.9900, test_f1: 0.5311
 epoch: 63, train_loss: 0.8081, test_loss: 0.9901, test_f1: 0.5192
 epoch: 64, train_loss: 0.8026, test_loss: 0.9915, test_f1: 0.5323
 epoch: 65, train_loss: 0.7983, test_loss: 1.0008, test_f1: 0.5395
 epoch: 66, train_loss: 0.7978, test_loss: 1.0009, test_f1: 0.5496
 epoch: 67, train_loss: 0.7936, test_loss: 0.9897, test_f1: 0.5438
 epoch: 68, train_loss: 0.7917, test_loss: 0.9905, test_f1: 0.5498
 epoch: 69, train_loss: 0.7931, test_loss: 0.9916, test_f1: 0.5316
 epoch: 70, train_loss: 0.7933, test_loss: 0.9860, test_f1: 0.5309
 epoch: 71, train_loss: 0.7887, test_loss: 0.9879, test_f1: 0.5235
 epoch: 72, train_loss: 0.7887, test_loss: 0.9954, test_f1: 0.5393
 epoch: 73, train_loss: 0.7959, test_loss: 0.9934, test_f1: 0.5538
 epoch: 74, train_loss: 0.7773, test_loss: 0.9903, test_f1: 0.5700
 epoch: 75, train_loss: 0.7798, test_loss: 0.9916, test_f1: 0.5524
 epoch: 76, train_loss: 0.7762, test_loss: 0.9860, test_f1: 0.5665
 epoch: 77, train_loss: 0.7749, test_loss: 0.9843, test_f1: 0.5524
 epoch: 78, train_loss: 0.7761, test_loss: 0.9890, test_f1: 0.5427
 epoch: 79, train_loss: 0.7642, test_loss: 0.9862, test_f1: 0.5419
 epoch: 80, train_loss: 0.7718, test_loss: 0.9827, test_f1: 0.5465
 epoch: 81, train_loss: 0.7652, test_loss: 0.9879, test_f1: 0.5498
 epoch: 82, train_loss: 0.7649, test_loss: 0.9932, test_f1: 0.5532
 epoch: 83, train_loss: 0.7705, test_loss: 0.9893, test_f1: 0.5369
 epoch: 84, train_loss: 0.7526, test_loss: 0.9877, test_f1: 0.5419
 epoch: 85, train_loss: 0.7617, test_loss: 0.9875, test_f1: 0.5447
 epoch: 86, train_loss: 0.7593, test_loss: 0.9895, test_f1: 0.5637
 epoch: 87, train_loss: 0.7590, test_loss: 0.9941, test_f1: 0.5580
 epoch: 88, train_loss: 0.7528, test_loss: 0.9902, test_f1: 0.5603
 epoch: 89, train_loss: 0.7530, test_loss: 0.9807, test_f1: 0.5398
 epoch: 90, train_loss: 0.7535, test_loss: 0.9848, test_f1: 0.5563
 epoch: 91, train_loss: 0.7464, test_loss: 0.9981, test_f1: 0.5506
 epoch: 92, train_loss: 0.7449, test_loss: 0.9954, test_f1: 0.5546
 epoch: 93, train_loss: 0.7383, test_loss: 0.9922, test_f1: 0.5679
 epoch: 94, train_loss: 0.7451, test_loss: 0.9899, test_f1: 0.5667
 epoch: 95, train_loss: 0.7350, test_loss: 0.9924, test_f1: 0.5583
 epoch: 96, train_loss: 0.7323, test_loss: 0.9865, test_f1: 0.5544
 epoch: 97, train_loss: 0.7334, test_loss: 0.9804, test_f1: 0.5573
 epoch: 98, train_loss: 0.7302, test_loss: 0.9879, test_f1: 0.5681
 epoch: 99, train_loss: 0.7243, test_loss: 0.9952, test_f1: 0.5663
##################ITERATION #4 ****************************************
 epoch: 0, train_loss: 1.2638, test_loss: 1.3335, test_f1: 0.1365
 epoch: 1, train_loss: 1.2088, test_loss: 1.3168, test_f1: 0.1365
 epoch: 2, train_loss: 1.1814, test_loss: 1.3033, test_f1: 0.1365
 epoch: 3, train_loss: 1.1531, test_loss: 1.2954, test_f1: 0.1437
 epoch: 4, train_loss: 1.1380, test_loss: 1.2890, test_f1: 0.3171
 epoch: 5, train_loss: 1.1209, test_loss: 1.2751, test_f1: 0.3140
 epoch: 6, train_loss: 1.1028, test_loss: 1.2491, test_f1: 0.3222
 epoch: 7, train_loss: 1.0875, test_loss: 1.2165, test_f1: 0.3583
 epoch: 8, train_loss: 1.0706, test_loss: 1.1820, test_f1: 0.4396
 epoch: 9, train_loss: 1.0549, test_loss: 1.1597, test_f1: 0.4312
 epoch: 10, train_loss: 1.0464, test_loss: 1.1473, test_f1: 0.4307
 epoch: 11, train_loss: 1.0344, test_loss: 1.1366, test_f1: 0.4307
 epoch: 12, train_loss: 1.0288, test_loss: 1.1268, test_f1: 0.4274
 epoch: 13, train_loss: 1.0181, test_loss: 1.1198, test_f1: 0.4269
 epoch: 14, train_loss: 1.0116, test_loss: 1.1111, test_f1: 0.4247
 epoch: 15, train_loss: 1.0022, test_loss: 1.1061, test_f1: 0.4318
 epoch: 16, train_loss: 0.9944, test_loss: 1.1019, test_f1: 0.4347
 epoch: 17, train_loss: 0.9877, test_loss: 1.1010, test_f1: 0.4479
 epoch: 18, train_loss: 0.9783, test_loss: 1.0917, test_f1: 0.4583
 epoch: 19, train_loss: 0.9750, test_loss: 1.0782, test_f1: 0.4713
 epoch: 20, train_loss: 0.9710, test_loss: 1.0728, test_f1: 0.4882
 epoch: 21, train_loss: 0.9661, test_loss: 1.0685, test_f1: 0.4921
 epoch: 22, train_loss: 0.9585, test_loss: 1.0700, test_f1: 0.4874
 epoch: 23, train_loss: 0.9571, test_loss: 1.0691, test_f1: 0.4879
 epoch: 24, train_loss: 0.9547, test_loss: 1.0622, test_f1: 0.4984
 epoch: 25, train_loss: 0.9438, test_loss: 1.0579, test_f1: 0.5071
 epoch: 26, train_loss: 0.9419, test_loss: 1.0554, test_f1: 0.5107
 epoch: 27, train_loss: 0.9377, test_loss: 1.0595, test_f1: 0.5082
 epoch: 28, train_loss: 0.9289, test_loss: 1.0566, test_f1: 0.5106
 epoch: 29, train_loss: 0.9255, test_loss: 1.0485, test_f1: 0.5234
 epoch: 30, train_loss: 0.9188, test_loss: 1.0446, test_f1: 0.5217
 epoch: 31, train_loss: 0.9160, test_loss: 1.0490, test_f1: 0.5144
 epoch: 32, train_loss: 0.9107, test_loss: 1.0358, test_f1: 0.5193
 epoch: 33, train_loss: 0.9078, test_loss: 1.0415, test_f1: 0.5195
 epoch: 34, train_loss: 0.9006, test_loss: 1.0440, test_f1: 0.5245
 epoch: 35, train_loss: 0.9003, test_loss: 1.0415, test_f1: 0.5252
 epoch: 36, train_loss: 0.8936, test_loss: 1.0343, test_f1: 0.5313
 epoch: 37, train_loss: 0.8854, test_loss: 1.0281, test_f1: 0.5514
 epoch: 38, train_loss: 0.8870, test_loss: 1.0315, test_f1: 0.5576
 epoch: 39, train_loss: 0.8688, test_loss: 1.0258, test_f1: 0.5627
 epoch: 40, train_loss: 0.8741, test_loss: 1.0245, test_f1: 0.5664
 epoch: 41, train_loss: 0.8699, test_loss: 1.0205, test_f1: 0.5644
 epoch: 42, train_loss: 0.8663, test_loss: 1.0213, test_f1: 0.5681
 epoch: 43, train_loss: 0.8607, test_loss: 1.0243, test_f1: 0.5684
 epoch: 44, train_loss: 0.8603, test_loss: 1.0213, test_f1: 0.5626
 epoch: 45, train_loss: 0.8515, test_loss: 1.0168, test_f1: 0.5620
 epoch: 46, train_loss: 0.8471, test_loss: 1.0077, test_f1: 0.5539
 epoch: 47, train_loss: 0.8325, test_loss: 1.0129, test_f1: 0.5450
 epoch: 48, train_loss: 0.8355, test_loss: 1.0158, test_f1: 0.5369
 epoch: 49, train_loss: 0.8259, test_loss: 1.0156, test_f1: 0.5386
 epoch: 50, train_loss: 0.8243, test_loss: 1.0215, test_f1: 0.5483
 epoch: 51, train_loss: 0.8199, test_loss: 1.0107, test_f1: 0.5501
 epoch: 52, train_loss: 0.8135, test_loss: 1.0133, test_f1: 0.5505
 epoch: 53, train_loss: 0.8082, test_loss: 1.0083, test_f1: 0.5607
 epoch: 54, train_loss: 0.8045, test_loss: 1.0095, test_f1: 0.5605
 epoch: 55, train_loss: 0.8037, test_loss: 1.0088, test_f1: 0.5532
 epoch: 56, train_loss: 0.8017, test_loss: 1.0056, test_f1: 0.5571
 epoch: 57, train_loss: 0.7990, test_loss: 1.0158, test_f1: 0.5547
 epoch: 58, train_loss: 0.7991, test_loss: 1.0231, test_f1: 0.5529
 epoch: 59, train_loss: 0.7933, test_loss: 1.0113, test_f1: 0.5606
 epoch: 60, train_loss: 0.7958, test_loss: 1.0101, test_f1: 0.5653
 epoch: 61, train_loss: 0.7933, test_loss: 1.0159, test_f1: 0.5605
 epoch: 62, train_loss: 0.7869, test_loss: 1.0204, test_f1: 0.5552
 epoch: 63, train_loss: 0.7883, test_loss: 1.0193, test_f1: 0.5524
 epoch: 64, train_loss: 0.7779, test_loss: 1.0190, test_f1: 0.5517
 epoch: 65, train_loss: 0.7854, test_loss: 1.0166, test_f1: 0.5519
 epoch: 66, train_loss: 0.7775, test_loss: 1.0160, test_f1: 0.5524
 epoch: 67, train_loss: 0.7755, test_loss: 1.0169, test_f1: 0.5359
 epoch: 68, train_loss: 0.7758, test_loss: 1.0132, test_f1: 0.5472
 epoch: 69, train_loss: 0.7745, test_loss: 1.0100, test_f1: 0.5602
 epoch: 70, train_loss: 0.7679, test_loss: 1.0181, test_f1: 0.5459
 epoch: 71, train_loss: 0.7662, test_loss: 1.0204, test_f1: 0.5433
 epoch: 72, train_loss: 0.7597, test_loss: 1.0141, test_f1: 0.5538
 epoch: 73, train_loss: 0.7627, test_loss: 1.0125, test_f1: 0.5638
 epoch: 74, train_loss: 0.7580, test_loss: 1.0204, test_f1: 0.5531
 epoch: 75, train_loss: 0.7629, test_loss: 1.0100, test_f1: 0.5602
 epoch: 76, train_loss: 0.7573, test_loss: 0.9980, test_f1: 0.5606
 epoch: 77, train_loss: 0.7496, test_loss: 1.0108, test_f1: 0.5569
 epoch: 78, train_loss: 0.7489, test_loss: 1.0209, test_f1: 0.5580
 epoch: 79, train_loss: 0.7407, test_loss: 1.0167, test_f1: 0.5651
 epoch: 80, train_loss: 0.7389, test_loss: 1.0080, test_f1: 0.5612
 epoch: 81, train_loss: 0.7355, test_loss: 1.0228, test_f1: 0.5553
 epoch: 82, train_loss: 0.7402, test_loss: 1.0251, test_f1: 0.5580
 epoch: 83, train_loss: 0.7395, test_loss: 1.0083, test_f1: 0.5793
 epoch: 84, train_loss: 0.7313, test_loss: 1.0142, test_f1: 0.5642
 epoch: 85, train_loss: 0.7279, test_loss: 1.0190, test_f1: 0.5596
 epoch: 86, train_loss: 0.7278, test_loss: 1.0102, test_f1: 0.5680
 epoch: 87, train_loss: 0.7182, test_loss: 1.0170, test_f1: 0.5654
 epoch: 88, train_loss: 0.7157, test_loss: 1.0202, test_f1: 0.5681
 epoch: 89, train_loss: 0.7169, test_loss: 1.0206, test_f1: 0.5791
 epoch: 90, train_loss: 0.7090, test_loss: 1.0138, test_f1: 0.5670
 epoch: 91, train_loss: 0.7060, test_loss: 1.0098, test_f1: 0.5671
 epoch: 92, train_loss: 0.7050, test_loss: 1.0144, test_f1: 0.5742
 epoch: 93, train_loss: 0.7085, test_loss: 1.0321, test_f1: 0.5641
 epoch: 94, train_loss: 0.7024, test_loss: 1.0410, test_f1: 0.5609
 epoch: 95, train_loss: 0.7044, test_loss: 1.0376, test_f1: 0.5682
 epoch: 96, train_loss: 0.6982, test_loss: 1.0361, test_f1: 0.5584
 epoch: 97, train_loss: 0.6961, test_loss: 1.0364, test_f1: 0.5711
 epoch: 98, train_loss: 0.7051, test_loss: 1.0421, test_f1: 0.5729
 epoch: 99, train_loss: 0.6895, test_loss: 1.0453, test_f1: 0.5732
##################ITERATION #5 ****************************************
 epoch: 0, train_loss: 1.2819, test_loss: 1.3651, test_f1: 0.1365
 epoch: 1, train_loss: 1.1805, test_loss: 1.3447, test_f1: 0.1365
 epoch: 2, train_loss: 1.1467, test_loss: 1.3205, test_f1: 0.1365
 epoch: 3, train_loss: 1.1142, test_loss: 1.3064, test_f1: 0.1365
 epoch: 4, train_loss: 1.0895, test_loss: 1.2961, test_f1: 0.1365
 epoch: 5, train_loss: 1.0705, test_loss: 1.2794, test_f1: 0.1408
 epoch: 6, train_loss: 1.0491, test_loss: 1.2532, test_f1: 0.1727
 epoch: 7, train_loss: 1.0446, test_loss: 1.2206, test_f1: 0.2797
 epoch: 8, train_loss: 1.0275, test_loss: 1.1824, test_f1: 0.3755
 epoch: 9, train_loss: 1.0184, test_loss: 1.1467, test_f1: 0.4511
 epoch: 10, train_loss: 1.0031, test_loss: 1.1166, test_f1: 0.4880
 epoch: 11, train_loss: 0.9961, test_loss: 1.0961, test_f1: 0.4613
 epoch: 12, train_loss: 0.9891, test_loss: 1.0874, test_f1: 0.4599
 epoch: 13, train_loss: 0.9804, test_loss: 1.0772, test_f1: 0.4958
 epoch: 14, train_loss: 0.9772, test_loss: 1.0673, test_f1: 0.5105
 epoch: 15, train_loss: 0.9710, test_loss: 1.0615, test_f1: 0.5331
 epoch: 16, train_loss: 0.9627, test_loss: 1.0566, test_f1: 0.5348
 epoch: 17, train_loss: 0.9534, test_loss: 1.0520, test_f1: 0.5403
 epoch: 18, train_loss: 0.9503, test_loss: 1.0462, test_f1: 0.5430
 epoch: 19, train_loss: 0.9511, test_loss: 1.0411, test_f1: 0.5590
 epoch: 20, train_loss: 0.9419, test_loss: 1.0422, test_f1: 0.5534
 epoch: 21, train_loss: 0.9389, test_loss: 1.0402, test_f1: 0.5334
 epoch: 22, train_loss: 0.9306, test_loss: 1.0441, test_f1: 0.5399
 epoch: 23, train_loss: 0.9268, test_loss: 1.0441, test_f1: 0.5432
 epoch: 24, train_loss: 0.9217, test_loss: 1.0371, test_f1: 0.5378
 epoch: 25, train_loss: 0.9272, test_loss: 1.0311, test_f1: 0.5488
 epoch: 26, train_loss: 0.9074, test_loss: 1.0317, test_f1: 0.5399
 epoch: 27, train_loss: 0.9161, test_loss: 1.0261, test_f1: 0.5506
 epoch: 28, train_loss: 0.9048, test_loss: 1.0232, test_f1: 0.5577
 epoch: 29, train_loss: 0.9016, test_loss: 1.0233, test_f1: 0.5547
 epoch: 30, train_loss: 0.8945, test_loss: 1.0225, test_f1: 0.5654
 epoch: 31, train_loss: 0.8975, test_loss: 1.0197, test_f1: 0.5506
 epoch: 32, train_loss: 0.8862, test_loss: 1.0160, test_f1: 0.5461
 epoch: 33, train_loss: 0.8854, test_loss: 1.0141, test_f1: 0.5294
 epoch: 34, train_loss: 0.8845, test_loss: 1.0185, test_f1: 0.5216
 epoch: 35, train_loss: 0.8762, test_loss: 1.0220, test_f1: 0.5241
 epoch: 36, train_loss: 0.8783, test_loss: 1.0187, test_f1: 0.5275
 epoch: 37, train_loss: 0.8634, test_loss: 1.0107, test_f1: 0.5236
 epoch: 38, train_loss: 0.8644, test_loss: 1.0089, test_f1: 0.5380
 epoch: 39, train_loss: 0.8589, test_loss: 1.0080, test_f1: 0.5763
 epoch: 40, train_loss: 0.8537, test_loss: 1.0109, test_f1: 0.5592
 epoch: 41, train_loss: 0.8528, test_loss: 1.0147, test_f1: 0.5646
 epoch: 42, train_loss: 0.8463, test_loss: 1.0109, test_f1: 0.5698
 epoch: 43, train_loss: 0.8494, test_loss: 1.0114, test_f1: 0.5782
 epoch: 44, train_loss: 0.8411, test_loss: 1.0097, test_f1: 0.5413
 epoch: 45, train_loss: 0.8373, test_loss: 1.0109, test_f1: 0.5361
 epoch: 46, train_loss: 0.8264, test_loss: 1.0126, test_f1: 0.5641
 epoch: 47, train_loss: 0.8332, test_loss: 1.0183, test_f1: 0.5522
 epoch: 48, train_loss: 0.8210, test_loss: 1.0151, test_f1: 0.5396
 epoch: 49, train_loss: 0.8159, test_loss: 1.0010, test_f1: 0.5526
 epoch: 50, train_loss: 0.8133, test_loss: 1.0014, test_f1: 0.5480
 epoch: 51, train_loss: 0.8154, test_loss: 1.0049, test_f1: 0.5345
 epoch: 52, train_loss: 0.8118, test_loss: 1.0093, test_f1: 0.5386
 epoch: 53, train_loss: 0.8077, test_loss: 1.0081, test_f1: 0.5469
 epoch: 54, train_loss: 0.7962, test_loss: 1.0039, test_f1: 0.5605
 epoch: 55, train_loss: 0.8072, test_loss: 1.0004, test_f1: 0.5808
 epoch: 56, train_loss: 0.8004, test_loss: 1.0010, test_f1: 0.5611
 epoch: 57, train_loss: 0.7959, test_loss: 1.0004, test_f1: 0.5582
 epoch: 58, train_loss: 0.8004, test_loss: 1.0060, test_f1: 0.5503
 epoch: 59, train_loss: 0.7922, test_loss: 1.0102, test_f1: 0.5395
 epoch: 60, train_loss: 0.7863, test_loss: 1.0069, test_f1: 0.5532
 epoch: 61, train_loss: 0.7855, test_loss: 1.0053, test_f1: 0.5432
 epoch: 62, train_loss: 0.7880, test_loss: 1.0039, test_f1: 0.5466
 epoch: 63, train_loss: 0.7911, test_loss: 1.0008, test_f1: 0.5560
 epoch: 64, train_loss: 0.7844, test_loss: 1.0065, test_f1: 0.5437
 epoch: 65, train_loss: 0.7786, test_loss: 1.0051, test_f1: 0.5586
 epoch: 66, train_loss: 0.7783, test_loss: 1.0063, test_f1: 0.5328
 epoch: 67, train_loss: 0.7870, test_loss: 1.0073, test_f1: 0.5421
 epoch: 68, train_loss: 0.7767, test_loss: 1.0064, test_f1: 0.5460
 epoch: 69, train_loss: 0.7653, test_loss: 1.0035, test_f1: 0.5468
 epoch: 70, train_loss: 0.7647, test_loss: 1.0069, test_f1: 0.5435
 epoch: 71, train_loss: 0.7623, test_loss: 1.0076, test_f1: 0.5470
 epoch: 72, train_loss: 0.7666, test_loss: 1.0091, test_f1: 0.5392
 epoch: 73, train_loss: 0.7656, test_loss: 1.0078, test_f1: 0.5452
 epoch: 74, train_loss: 0.7557, test_loss: 1.0063, test_f1: 0.5300
 epoch: 75, train_loss: 0.7573, test_loss: 1.0098, test_f1: 0.5377
 epoch: 76, train_loss: 0.7574, test_loss: 1.0118, test_f1: 0.5532
 epoch: 77, train_loss: 0.7517, test_loss: 1.0148, test_f1: 0.5533
 epoch: 78, train_loss: 0.7491, test_loss: 1.0163, test_f1: 0.5579
 epoch: 79, train_loss: 0.7519, test_loss: 1.0100, test_f1: 0.5560
 epoch: 80, train_loss: 0.7517, test_loss: 1.0079, test_f1: 0.5352
 epoch: 81, train_loss: 0.7381, test_loss: 1.0206, test_f1: 0.5466
 epoch: 82, train_loss: 0.7422, test_loss: 1.0252, test_f1: 0.5453
 epoch: 83, train_loss: 0.7390, test_loss: 1.0142, test_f1: 0.5570
 epoch: 84, train_loss: 0.7454, test_loss: 1.0131, test_f1: 0.5554
 epoch: 85, train_loss: 0.7385, test_loss: 1.0241, test_f1: 0.5594
 epoch: 86, train_loss: 0.7333, test_loss: 1.0244, test_f1: 0.5526
 epoch: 87, train_loss: 0.7343, test_loss: 1.0238, test_f1: 0.5578
 epoch: 88, train_loss: 0.7268, test_loss: 1.0228, test_f1: 0.5528
 epoch: 89, train_loss: 0.7274, test_loss: 1.0236, test_f1: 0.5434
 epoch: 90, train_loss: 0.7191, test_loss: 1.0199, test_f1: 0.5431
 epoch: 91, train_loss: 0.7291, test_loss: 1.0220, test_f1: 0.5432
 epoch: 92, train_loss: 0.7140, test_loss: 1.0215, test_f1: 0.5407
 epoch: 93, train_loss: 0.7224, test_loss: 1.0212, test_f1: 0.5483
 epoch: 94, train_loss: 0.7156, test_loss: 1.0248, test_f1: 0.5498
 epoch: 95, train_loss: 0.7192, test_loss: 1.0140, test_f1: 0.5616
 epoch: 96, train_loss: 0.7094, test_loss: 1.0160, test_f1: 0.5566
 epoch: 97, train_loss: 0.7141, test_loss: 1.0206, test_f1: 0.5538
 epoch: 98, train_loss: 0.7111, test_loss: 1.0226, test_f1: 0.5460
 epoch: 99, train_loss: 0.7049, test_loss: 1.0197, test_f1: 0.5529
##################ITERATION #6 ****************************************
 epoch: 0, train_loss: 1.2376, test_loss: 1.3361, test_f1: 0.2281
 epoch: 1, train_loss: 1.1629, test_loss: 1.3255, test_f1: 0.2281
 epoch: 2, train_loss: 1.1404, test_loss: 1.3166, test_f1: 0.2281
 epoch: 3, train_loss: 1.1120, test_loss: 1.3066, test_f1: 0.2281
 epoch: 4, train_loss: 1.0881, test_loss: 1.2885, test_f1: 0.2281
 epoch: 5, train_loss: 1.0757, test_loss: 1.2648, test_f1: 0.2539
 epoch: 6, train_loss: 1.0567, test_loss: 1.2328, test_f1: 0.3594
 epoch: 7, train_loss: 1.0402, test_loss: 1.1975, test_f1: 0.3810
 epoch: 8, train_loss: 1.0327, test_loss: 1.1633, test_f1: 0.3776
 epoch: 9, train_loss: 1.0148, test_loss: 1.1315, test_f1: 0.3946
 epoch: 10, train_loss: 1.0039, test_loss: 1.1048, test_f1: 0.4471
 epoch: 11, train_loss: 0.9948, test_loss: 1.0879, test_f1: 0.4484
 epoch: 12, train_loss: 0.9950, test_loss: 1.0764, test_f1: 0.4692
 epoch: 13, train_loss: 0.9818, test_loss: 1.0682, test_f1: 0.4808
 epoch: 14, train_loss: 0.9734, test_loss: 1.0634, test_f1: 0.4845
 epoch: 15, train_loss: 0.9648, test_loss: 1.0574, test_f1: 0.4990
 epoch: 16, train_loss: 0.9604, test_loss: 1.0512, test_f1: 0.5094
 epoch: 17, train_loss: 0.9546, test_loss: 1.0470, test_f1: 0.5075
 epoch: 18, train_loss: 0.9568, test_loss: 1.0414, test_f1: 0.5162
 epoch: 19, train_loss: 0.9435, test_loss: 1.0392, test_f1: 0.5216
 epoch: 20, train_loss: 0.9392, test_loss: 1.0384, test_f1: 0.5206
 epoch: 21, train_loss: 0.9384, test_loss: 1.0330, test_f1: 0.5131
 epoch: 22, train_loss: 0.9305, test_loss: 1.0320, test_f1: 0.5118
 epoch: 23, train_loss: 0.9233, test_loss: 1.0339, test_f1: 0.5255
 epoch: 24, train_loss: 0.9233, test_loss: 1.0343, test_f1: 0.5279
 epoch: 25, train_loss: 0.9080, test_loss: 1.0318, test_f1: 0.5276
 epoch: 26, train_loss: 0.9089, test_loss: 1.0285, test_f1: 0.5363
 epoch: 27, train_loss: 0.8960, test_loss: 1.0225, test_f1: 0.5341
 epoch: 28, train_loss: 0.8923, test_loss: 1.0199, test_f1: 0.5395
 epoch: 29, train_loss: 0.8894, test_loss: 1.0271, test_f1: 0.5460
 epoch: 30, train_loss: 0.8841, test_loss: 1.0304, test_f1: 0.5432
 epoch: 31, train_loss: 0.8837, test_loss: 1.0238, test_f1: 0.5462
 epoch: 32, train_loss: 0.8862, test_loss: 1.0174, test_f1: 0.5360
 epoch: 33, train_loss: 0.8765, test_loss: 1.0130, test_f1: 0.5299
 epoch: 34, train_loss: 0.8683, test_loss: 1.0177, test_f1: 0.5596
 epoch: 35, train_loss: 0.8752, test_loss: 1.0168, test_f1: 0.5565
 epoch: 36, train_loss: 0.8575, test_loss: 1.0160, test_f1: 0.5286
 epoch: 37, train_loss: 0.8573, test_loss: 1.0125, test_f1: 0.5303
 epoch: 38, train_loss: 0.8519, test_loss: 1.0115, test_f1: 0.5471
 epoch: 39, train_loss: 0.8462, test_loss: 1.0116, test_f1: 0.5500
 epoch: 40, train_loss: 0.8463, test_loss: 1.0092, test_f1: 0.5380
 epoch: 41, train_loss: 0.8405, test_loss: 1.0140, test_f1: 0.5533
 epoch: 42, train_loss: 0.8384, test_loss: 1.0099, test_f1: 0.5358
 epoch: 43, train_loss: 0.8319, test_loss: 1.0090, test_f1: 0.5421
 epoch: 44, train_loss: 0.8174, test_loss: 1.0095, test_f1: 0.5367
 epoch: 45, train_loss: 0.8126, test_loss: 1.0070, test_f1: 0.5407
 epoch: 46, train_loss: 0.8140, test_loss: 1.0075, test_f1: 0.5332
 epoch: 47, train_loss: 0.8176, test_loss: 1.0054, test_f1: 0.5330
 epoch: 48, train_loss: 0.8050, test_loss: 1.0131, test_f1: 0.5305
 epoch: 49, train_loss: 0.8038, test_loss: 1.0105, test_f1: 0.5467
 epoch: 50, train_loss: 0.7949, test_loss: 0.9951, test_f1: 0.5472
 epoch: 51, train_loss: 0.8013, test_loss: 1.0001, test_f1: 0.5568
 epoch: 52, train_loss: 0.7913, test_loss: 1.0005, test_f1: 0.5498
 epoch: 53, train_loss: 0.7800, test_loss: 1.0010, test_f1: 0.5402
 epoch: 54, train_loss: 0.7733, test_loss: 0.9999, test_f1: 0.5332
 epoch: 55, train_loss: 0.7862, test_loss: 0.9974, test_f1: 0.5511
 epoch: 56, train_loss: 0.7784, test_loss: 0.9980, test_f1: 0.5531
 epoch: 57, train_loss: 0.7829, test_loss: 0.9982, test_f1: 0.5369
 epoch: 58, train_loss: 0.7746, test_loss: 1.0023, test_f1: 0.5343
 epoch: 59, train_loss: 0.7672, test_loss: 1.0044, test_f1: 0.5425
 epoch: 60, train_loss: 0.7710, test_loss: 1.0057, test_f1: 0.5309
 epoch: 61, train_loss: 0.7766, test_loss: 1.0056, test_f1: 0.5365
 epoch: 62, train_loss: 0.7635, test_loss: 1.0070, test_f1: 0.5418
 epoch: 63, train_loss: 0.7657, test_loss: 1.0053, test_f1: 0.5484
 epoch: 64, train_loss: 0.7583, test_loss: 1.0068, test_f1: 0.5424
 epoch: 65, train_loss: 0.7481, test_loss: 1.0056, test_f1: 0.5425
 epoch: 66, train_loss: 0.7594, test_loss: 1.0108, test_f1: 0.5528
 epoch: 67, train_loss: 0.7523, test_loss: 1.0129, test_f1: 0.5417
 epoch: 68, train_loss: 0.7552, test_loss: 1.0137, test_f1: 0.5375
 epoch: 69, train_loss: 0.7414, test_loss: 1.0178, test_f1: 0.5387
 epoch: 70, train_loss: 0.7562, test_loss: 1.0145, test_f1: 0.5548
 epoch: 71, train_loss: 0.7431, test_loss: 1.0067, test_f1: 0.5638
 epoch: 72, train_loss: 0.7335, test_loss: 1.0071, test_f1: 0.5535
 epoch: 73, train_loss: 0.7370, test_loss: 1.0093, test_f1: 0.5530
 epoch: 74, train_loss: 0.7389, test_loss: 1.0045, test_f1: 0.5616
 epoch: 75, train_loss: 0.7378, test_loss: 1.0032, test_f1: 0.5647
 epoch: 76, train_loss: 0.7379, test_loss: 1.0100, test_f1: 0.5579
 epoch: 77, train_loss: 0.7281, test_loss: 0.9994, test_f1: 0.5537
 epoch: 78, train_loss: 0.7257, test_loss: 1.0090, test_f1: 0.5417
 epoch: 79, train_loss: 0.7353, test_loss: 1.0109, test_f1: 0.5421
 epoch: 80, train_loss: 0.7293, test_loss: 1.0087, test_f1: 0.5420
 epoch: 81, train_loss: 0.7161, test_loss: 1.0030, test_f1: 0.5462
 epoch: 82, train_loss: 0.7127, test_loss: 1.0034, test_f1: 0.5495
 epoch: 83, train_loss: 0.7068, test_loss: 1.0062, test_f1: 0.5565
 epoch: 84, train_loss: 0.7170, test_loss: 1.0116, test_f1: 0.5456
 epoch: 85, train_loss: 0.7037, test_loss: 1.0009, test_f1: 0.5637
 epoch: 86, train_loss: 0.7036, test_loss: 0.9993, test_f1: 0.5640
 epoch: 87, train_loss: 0.7103, test_loss: 0.9958, test_f1: 0.5594
 epoch: 88, train_loss: 0.7098, test_loss: 0.9879, test_f1: 0.5678
 epoch: 89, train_loss: 0.7023, test_loss: 0.9820, test_f1: 0.5750
 epoch: 90, train_loss: 0.7016, test_loss: 0.9864, test_f1: 0.5669
 epoch: 91, train_loss: 0.7036, test_loss: 0.9941, test_f1: 0.5546
 epoch: 92, train_loss: 0.6931, test_loss: 1.0033, test_f1: 0.5539
 epoch: 93, train_loss: 0.6960, test_loss: 1.0072, test_f1: 0.5437
 epoch: 94, train_loss: 0.6835, test_loss: 1.0143, test_f1: 0.5501
 epoch: 95, train_loss: 0.7022, test_loss: 1.0072, test_f1: 0.5570
 epoch: 96, train_loss: 0.6921, test_loss: 1.0131, test_f1: 0.5544
 epoch: 97, train_loss: 0.6908, test_loss: 1.0150, test_f1: 0.5483
 epoch: 98, train_loss: 0.6843, test_loss: 1.0064, test_f1: 0.5674
 epoch: 99, train_loss: 0.6736, test_loss: 1.0021, test_f1: 0.5680
##################ITERATION #7 ****************************************
 epoch: 0, train_loss: 1.2290, test_loss: 1.3246, test_f1: 0.2281
 epoch: 1, train_loss: 1.1306, test_loss: 1.3058, test_f1: 0.2281
 epoch: 2, train_loss: 1.1011, test_loss: 1.2968, test_f1: 0.2281
 epoch: 3, train_loss: 1.0794, test_loss: 1.3048, test_f1: 0.2281
 epoch: 4, train_loss: 1.0617, test_loss: 1.3127, test_f1: 0.2281
 epoch: 5, train_loss: 1.0399, test_loss: 1.3041, test_f1: 0.2721
 epoch: 6, train_loss: 1.0299, test_loss: 1.2668, test_f1: 0.3324
 epoch: 7, train_loss: 1.0115, test_loss: 1.2155, test_f1: 0.3594
 epoch: 8, train_loss: 1.0054, test_loss: 1.1772, test_f1: 0.4179
 epoch: 9, train_loss: 0.9969, test_loss: 1.1448, test_f1: 0.4316
 epoch: 10, train_loss: 0.9827, test_loss: 1.1203, test_f1: 0.4694
 epoch: 11, train_loss: 0.9822, test_loss: 1.1010, test_f1: 0.4850
 epoch: 12, train_loss: 0.9712, test_loss: 1.0835, test_f1: 0.5027
 epoch: 13, train_loss: 0.9623, test_loss: 1.0719, test_f1: 0.5085
 epoch: 14, train_loss: 0.9580, test_loss: 1.0637, test_f1: 0.5116
 epoch: 15, train_loss: 0.9546, test_loss: 1.0617, test_f1: 0.5153
 epoch: 16, train_loss: 0.9462, test_loss: 1.0546, test_f1: 0.5160
 epoch: 17, train_loss: 0.9344, test_loss: 1.0527, test_f1: 0.5193
 epoch: 18, train_loss: 0.9387, test_loss: 1.0586, test_f1: 0.5181
 epoch: 19, train_loss: 0.9294, test_loss: 1.0498, test_f1: 0.5193
 epoch: 20, train_loss: 0.9241, test_loss: 1.0428, test_f1: 0.5203
 epoch: 21, train_loss: 0.9161, test_loss: 1.0364, test_f1: 0.5300
 epoch: 22, train_loss: 0.9138, test_loss: 1.0345, test_f1: 0.5241
 epoch: 23, train_loss: 0.9040, test_loss: 1.0300, test_f1: 0.5360
 epoch: 24, train_loss: 0.8993, test_loss: 1.0361, test_f1: 0.5367
 epoch: 25, train_loss: 0.8937, test_loss: 1.0369, test_f1: 0.5417
 epoch: 26, train_loss: 0.8946, test_loss: 1.0288, test_f1: 0.5474
 epoch: 27, train_loss: 0.8897, test_loss: 1.0213, test_f1: 0.5415
 epoch: 28, train_loss: 0.8824, test_loss: 1.0175, test_f1: 0.5425
 epoch: 29, train_loss: 0.8728, test_loss: 1.0180, test_f1: 0.5448
 epoch: 30, train_loss: 0.8829, test_loss: 1.0237, test_f1: 0.5348
 epoch: 31, train_loss: 0.8644, test_loss: 1.0163, test_f1: 0.5392
 epoch: 32, train_loss: 0.8640, test_loss: 1.0105, test_f1: 0.5411
 epoch: 33, train_loss: 0.8543, test_loss: 1.0098, test_f1: 0.5447
 epoch: 34, train_loss: 0.8547, test_loss: 1.0077, test_f1: 0.5465
 epoch: 35, train_loss: 0.8535, test_loss: 1.0095, test_f1: 0.5516
 epoch: 36, train_loss: 0.8493, test_loss: 1.0099, test_f1: 0.5490
 epoch: 37, train_loss: 0.8368, test_loss: 1.0119, test_f1: 0.5472
 epoch: 38, train_loss: 0.8378, test_loss: 1.0231, test_f1: 0.5602
 epoch: 39, train_loss: 0.8233, test_loss: 1.0209, test_f1: 0.5524
 epoch: 40, train_loss: 0.8274, test_loss: 1.0083, test_f1: 0.5532
 epoch: 41, train_loss: 0.8227, test_loss: 1.0047, test_f1: 0.5744
 epoch: 42, train_loss: 0.8239, test_loss: 1.0053, test_f1: 0.5820
 epoch: 43, train_loss: 0.8025, test_loss: 0.9993, test_f1: 0.5590
 epoch: 44, train_loss: 0.8042, test_loss: 0.9999, test_f1: 0.5581
 epoch: 45, train_loss: 0.8023, test_loss: 1.0142, test_f1: 0.5488
 epoch: 46, train_loss: 0.7981, test_loss: 1.0204, test_f1: 0.5440
 epoch: 47, train_loss: 0.7998, test_loss: 1.0102, test_f1: 0.5587
 epoch: 48, train_loss: 0.7937, test_loss: 1.0023, test_f1: 0.5648
 epoch: 49, train_loss: 0.7869, test_loss: 1.0189, test_f1: 0.5566
 epoch: 50, train_loss: 0.7744, test_loss: 1.0215, test_f1: 0.5599
 epoch: 51, train_loss: 0.7740, test_loss: 1.0107, test_f1: 0.5433
 epoch: 52, train_loss: 0.7658, test_loss: 1.0078, test_f1: 0.5524
 epoch: 53, train_loss: 0.7674, test_loss: 1.0067, test_f1: 0.5541
 epoch: 54, train_loss: 0.7663, test_loss: 1.0106, test_f1: 0.5624
 epoch: 55, train_loss: 0.7610, test_loss: 1.0087, test_f1: 0.5580
 epoch: 56, train_loss: 0.7564, test_loss: 1.0062, test_f1: 0.5626
 epoch: 57, train_loss: 0.7606, test_loss: 1.0035, test_f1: 0.5633
 epoch: 58, train_loss: 0.7586, test_loss: 1.0112, test_f1: 0.5728
 epoch: 59, train_loss: 0.7490, test_loss: 1.0043, test_f1: 0.5638
 epoch: 60, train_loss: 0.7469, test_loss: 1.0059, test_f1: 0.5655
 epoch: 61, train_loss: 0.7494, test_loss: 1.0086, test_f1: 0.5673
 epoch: 62, train_loss: 0.7353, test_loss: 1.0136, test_f1: 0.5586
 epoch: 63, train_loss: 0.7451, test_loss: 1.0149, test_f1: 0.5684
 epoch: 64, train_loss: 0.7292, test_loss: 1.0268, test_f1: 0.5725
 epoch: 65, train_loss: 0.7374, test_loss: 1.0123, test_f1: 0.5719
 epoch: 66, train_loss: 0.7362, test_loss: 1.0132, test_f1: 0.5654
 epoch: 67, train_loss: 0.7285, test_loss: 1.0108, test_f1: 0.5663
 epoch: 68, train_loss: 0.7239, test_loss: 1.0148, test_f1: 0.5749
 epoch: 69, train_loss: 0.7342, test_loss: 1.0134, test_f1: 0.5751
 epoch: 70, train_loss: 0.7214, test_loss: 1.0149, test_f1: 0.5915
 epoch: 71, train_loss: 0.7136, test_loss: 1.0187, test_f1: 0.5842
 epoch: 72, train_loss: 0.7233, test_loss: 1.0291, test_f1: 0.5697
 epoch: 73, train_loss: 0.7155, test_loss: 1.0254, test_f1: 0.5884
 epoch: 74, train_loss: 0.7193, test_loss: 1.0204, test_f1: 0.5950
 epoch: 75, train_loss: 0.7114, test_loss: 1.0196, test_f1: 0.5897
 epoch: 76, train_loss: 0.7157, test_loss: 1.0155, test_f1: 0.5758
 epoch: 77, train_loss: 0.7036, test_loss: 1.0152, test_f1: 0.5767
 epoch: 78, train_loss: 0.7043, test_loss: 1.0071, test_f1: 0.5926
 epoch: 79, train_loss: 0.7051, test_loss: 1.0143, test_f1: 0.5917
 epoch: 80, train_loss: 0.7010, test_loss: 1.0160, test_f1: 0.5849
 epoch: 81, train_loss: 0.6926, test_loss: 1.0122, test_f1: 0.5839
 epoch: 82, train_loss: 0.6941, test_loss: 1.0165, test_f1: 0.5730
 epoch: 83, train_loss: 0.6880, test_loss: 1.0256, test_f1: 0.5765
 epoch: 84, train_loss: 0.7002, test_loss: 1.0288, test_f1: 0.5805
 epoch: 85, train_loss: 0.6833, test_loss: 1.0258, test_f1: 0.5858
 epoch: 86, train_loss: 0.6894, test_loss: 1.0168, test_f1: 0.5865
 epoch: 87, train_loss: 0.6814, test_loss: 1.0266, test_f1: 0.5885
 epoch: 88, train_loss: 0.6715, test_loss: 1.0327, test_f1: 0.5729
 epoch: 89, train_loss: 0.6846, test_loss: 1.0403, test_f1: 0.5635
 epoch: 90, train_loss: 0.6719, test_loss: 1.0369, test_f1: 0.5680
 epoch: 91, train_loss: 0.6780, test_loss: 1.0297, test_f1: 0.5848
 epoch: 92, train_loss: 0.6689, test_loss: 1.0372, test_f1: 0.5742
 epoch: 93, train_loss: 0.6689, test_loss: 1.0367, test_f1: 0.5741
 epoch: 94, train_loss: 0.6759, test_loss: 1.0398, test_f1: 0.5751
 epoch: 95, train_loss: 0.6703, test_loss: 1.0397, test_f1: 0.5777
 epoch: 96, train_loss: 0.6639, test_loss: 1.0386, test_f1: 0.5795
 epoch: 97, train_loss: 0.6608, test_loss: 1.0355, test_f1: 0.5764
 epoch: 98, train_loss: 0.6545, test_loss: 1.0405, test_f1: 0.5832
 epoch: 99, train_loss: 0.6533, test_loss: 1.0535, test_f1: 0.5645
##################ITERATION #8 ****************************************
 epoch: 0, train_loss: 1.2352, test_loss: 1.3088, test_f1: 0.1365
 epoch: 1, train_loss: 1.1397, test_loss: 1.2983, test_f1: 0.3232
 epoch: 2, train_loss: 1.1030, test_loss: 1.2849, test_f1: 0.2991
 epoch: 3, train_loss: 1.0824, test_loss: 1.2668, test_f1: 0.3235
 epoch: 4, train_loss: 1.0570, test_loss: 1.2381, test_f1: 0.3232
 epoch: 5, train_loss: 1.0379, test_loss: 1.2023, test_f1: 0.3795
 epoch: 6, train_loss: 1.0269, test_loss: 1.1686, test_f1: 0.4459
 epoch: 7, train_loss: 1.0104, test_loss: 1.1389, test_f1: 0.4387
 epoch: 8, train_loss: 0.9987, test_loss: 1.1122, test_f1: 0.4785
 epoch: 9, train_loss: 0.9895, test_loss: 1.0866, test_f1: 0.4935
 epoch: 10, train_loss: 0.9891, test_loss: 1.0712, test_f1: 0.4931
 epoch: 11, train_loss: 0.9650, test_loss: 1.0576, test_f1: 0.5039
 epoch: 12, train_loss: 0.9596, test_loss: 1.0498, test_f1: 0.5093
 epoch: 13, train_loss: 0.9544, test_loss: 1.0436, test_f1: 0.4964
 epoch: 14, train_loss: 0.9466, test_loss: 1.0384, test_f1: 0.5018
 epoch: 15, train_loss: 0.9405, test_loss: 1.0264, test_f1: 0.4998
 epoch: 16, train_loss: 0.9382, test_loss: 1.0209, test_f1: 0.5105
 epoch: 17, train_loss: 0.9313, test_loss: 1.0245, test_f1: 0.5402
 epoch: 18, train_loss: 0.9328, test_loss: 1.0190, test_f1: 0.5373
 epoch: 19, train_loss: 0.9181, test_loss: 1.0149, test_f1: 0.5331
 epoch: 20, train_loss: 0.9062, test_loss: 1.0139, test_f1: 0.5327
 epoch: 21, train_loss: 0.9068, test_loss: 1.0114, test_f1: 0.5391
 epoch: 22, train_loss: 0.9006, test_loss: 1.0147, test_f1: 0.5458
 epoch: 23, train_loss: 0.8923, test_loss: 1.0141, test_f1: 0.5288
 epoch: 24, train_loss: 0.8933, test_loss: 1.0089, test_f1: 0.5336
 epoch: 25, train_loss: 0.8927, test_loss: 1.0045, test_f1: 0.5353
 epoch: 26, train_loss: 0.8873, test_loss: 1.0056, test_f1: 0.5280
 epoch: 27, train_loss: 0.8891, test_loss: 1.0068, test_f1: 0.5238
 epoch: 28, train_loss: 0.8722, test_loss: 1.0062, test_f1: 0.5230
 epoch: 29, train_loss: 0.8652, test_loss: 1.0072, test_f1: 0.5231
 epoch: 30, train_loss: 0.8646, test_loss: 1.0003, test_f1: 0.5280
 epoch: 31, train_loss: 0.8545, test_loss: 0.9971, test_f1: 0.5288
 epoch: 32, train_loss: 0.8499, test_loss: 0.9970, test_f1: 0.5267
 epoch: 33, train_loss: 0.8571, test_loss: 1.0006, test_f1: 0.5377
 epoch: 34, train_loss: 0.8485, test_loss: 0.9977, test_f1: 0.5309
 epoch: 35, train_loss: 0.8348, test_loss: 0.9959, test_f1: 0.5303
 epoch: 36, train_loss: 0.8361, test_loss: 0.9917, test_f1: 0.5462
 epoch: 37, train_loss: 0.8307, test_loss: 0.9983, test_f1: 0.5411
 epoch: 38, train_loss: 0.8350, test_loss: 0.9952, test_f1: 0.5377
 epoch: 39, train_loss: 0.8326, test_loss: 0.9975, test_f1: 0.5383
 epoch: 40, train_loss: 0.8113, test_loss: 1.0016, test_f1: 0.5397
 epoch: 41, train_loss: 0.8181, test_loss: 1.0039, test_f1: 0.5440
 epoch: 42, train_loss: 0.8131, test_loss: 1.0005, test_f1: 0.5343
 epoch: 43, train_loss: 0.8070, test_loss: 0.9951, test_f1: 0.5428
 epoch: 44, train_loss: 0.8069, test_loss: 0.9959, test_f1: 0.5377
 epoch: 45, train_loss: 0.7934, test_loss: 0.9955, test_f1: 0.5498
 epoch: 46, train_loss: 0.7929, test_loss: 0.9882, test_f1: 0.5548
 epoch: 47, train_loss: 0.7890, test_loss: 0.9839, test_f1: 0.5688
 epoch: 48, train_loss: 0.7758, test_loss: 0.9892, test_f1: 0.5433
 epoch: 49, train_loss: 0.7761, test_loss: 1.0051, test_f1: 0.5397
 epoch: 50, train_loss: 0.7792, test_loss: 1.0132, test_f1: 0.5329
 epoch: 51, train_loss: 0.7709, test_loss: 0.9997, test_f1: 0.5457
 epoch: 52, train_loss: 0.7685, test_loss: 0.9889, test_f1: 0.5470
 epoch: 53, train_loss: 0.7659, test_loss: 0.9865, test_f1: 0.5518
 epoch: 54, train_loss: 0.7573, test_loss: 0.9863, test_f1: 0.5553
 epoch: 55, train_loss: 0.7537, test_loss: 0.9885, test_f1: 0.5604
 epoch: 56, train_loss: 0.7464, test_loss: 0.9966, test_f1: 0.5563
 epoch: 57, train_loss: 0.7536, test_loss: 0.9957, test_f1: 0.5622
 epoch: 58, train_loss: 0.7420, test_loss: 0.9916, test_f1: 0.5679
 epoch: 59, train_loss: 0.7388, test_loss: 0.9910, test_f1: 0.5591
 epoch: 60, train_loss: 0.7365, test_loss: 0.9904, test_f1: 0.5568
 epoch: 61, train_loss: 0.7458, test_loss: 0.9890, test_f1: 0.5647
 epoch: 62, train_loss: 0.7392, test_loss: 0.9873, test_f1: 0.5621
 epoch: 63, train_loss: 0.7280, test_loss: 0.9912, test_f1: 0.5523
 epoch: 64, train_loss: 0.7252, test_loss: 0.9974, test_f1: 0.5681
 epoch: 65, train_loss: 0.7251, test_loss: 0.9910, test_f1: 0.5632
 epoch: 66, train_loss: 0.7305, test_loss: 0.9891, test_f1: 0.5600
 epoch: 67, train_loss: 0.7225, test_loss: 0.9927, test_f1: 0.5791
 epoch: 68, train_loss: 0.7194, test_loss: 0.9920, test_f1: 0.5730
 epoch: 69, train_loss: 0.7304, test_loss: 0.9869, test_f1: 0.5652
 epoch: 70, train_loss: 0.7211, test_loss: 0.9915, test_f1: 0.5736
 epoch: 71, train_loss: 0.7208, test_loss: 1.0023, test_f1: 0.5752
 epoch: 72, train_loss: 0.7118, test_loss: 1.0021, test_f1: 0.5694
 epoch: 73, train_loss: 0.7049, test_loss: 0.9945, test_f1: 0.5653
 epoch: 74, train_loss: 0.7078, test_loss: 0.9983, test_f1: 0.5594
 epoch: 75, train_loss: 0.7114, test_loss: 0.9935, test_f1: 0.5721
 epoch: 76, train_loss: 0.7141, test_loss: 0.9910, test_f1: 0.5647
 epoch: 77, train_loss: 0.7096, test_loss: 0.9917, test_f1: 0.5695
 epoch: 78, train_loss: 0.7063, test_loss: 1.0040, test_f1: 0.5745
 epoch: 79, train_loss: 0.6933, test_loss: 0.9832, test_f1: 0.5758
 epoch: 80, train_loss: 0.7015, test_loss: 0.9865, test_f1: 0.5789
 epoch: 81, train_loss: 0.6912, test_loss: 0.9952, test_f1: 0.5679
 epoch: 82, train_loss: 0.6977, test_loss: 1.0099, test_f1: 0.5706
 epoch: 83, train_loss: 0.6919, test_loss: 0.9975, test_f1: 0.5811
 epoch: 84, train_loss: 0.6850, test_loss: 0.9941, test_f1: 0.5684
 epoch: 85, train_loss: 0.6829, test_loss: 0.9919, test_f1: 0.5777
 epoch: 86, train_loss: 0.6802, test_loss: 0.9895, test_f1: 0.5758
 epoch: 87, train_loss: 0.6765, test_loss: 0.9957, test_f1: 0.5720
 epoch: 88, train_loss: 0.6836, test_loss: 0.9980, test_f1: 0.5692
 epoch: 89, train_loss: 0.6791, test_loss: 1.0085, test_f1: 0.5612
 epoch: 90, train_loss: 0.6830, test_loss: 1.0004, test_f1: 0.5667
 epoch: 91, train_loss: 0.6736, test_loss: 0.9917, test_f1: 0.5714
 epoch: 92, train_loss: 0.6688, test_loss: 0.9987, test_f1: 0.5801
 epoch: 93, train_loss: 0.6622, test_loss: 1.0110, test_f1: 0.5937
 epoch: 94, train_loss: 0.6766, test_loss: 1.0026, test_f1: 0.5756
 epoch: 95, train_loss: 0.6709, test_loss: 1.0042, test_f1: 0.5682
 epoch: 96, train_loss: 0.6615, test_loss: 0.9980, test_f1: 0.5855
 epoch: 97, train_loss: 0.6558, test_loss: 0.9928, test_f1: 0.5766
 epoch: 98, train_loss: 0.6638, test_loss: 1.0014, test_f1: 0.5787
 epoch: 99, train_loss: 0.6464, test_loss: 1.0040, test_f1: 0.5968
##################ITERATION #9 ****************************************
 epoch: 0, train_loss: 1.2462, test_loss: 1.3123, test_f1: 0.2281
 epoch: 1, train_loss: 1.1084, test_loss: 1.2930, test_f1: 0.2281
 epoch: 2, train_loss: 1.0817, test_loss: 1.2829, test_f1: 0.2281
 epoch: 3, train_loss: 1.0491, test_loss: 1.2744, test_f1: 0.2281
 epoch: 4, train_loss: 1.0325, test_loss: 1.2616, test_f1: 0.2281
 epoch: 5, train_loss: 1.0132, test_loss: 1.2413, test_f1: 0.2806
 epoch: 6, train_loss: 0.9956, test_loss: 1.2106, test_f1: 0.3502
 epoch: 7, train_loss: 0.9857, test_loss: 1.1797, test_f1: 0.4248
 epoch: 8, train_loss: 0.9756, test_loss: 1.1377, test_f1: 0.4861
 epoch: 9, train_loss: 0.9628, test_loss: 1.1036, test_f1: 0.4815
 epoch: 10, train_loss: 0.9530, test_loss: 1.0719, test_f1: 0.4928
 epoch: 11, train_loss: 0.9484, test_loss: 1.0481, test_f1: 0.5060
 epoch: 12, train_loss: 0.9393, test_loss: 1.0402, test_f1: 0.5019
 epoch: 13, train_loss: 0.9384, test_loss: 1.0318, test_f1: 0.5165
 epoch: 14, train_loss: 0.9291, test_loss: 1.0287, test_f1: 0.5284
 epoch: 15, train_loss: 0.9163, test_loss: 1.0262, test_f1: 0.5270
 epoch: 16, train_loss: 0.9204, test_loss: 1.0266, test_f1: 0.5324
 epoch: 17, train_loss: 0.9194, test_loss: 1.0259, test_f1: 0.5389
 epoch: 18, train_loss: 0.9084, test_loss: 1.0161, test_f1: 0.5332
 epoch: 19, train_loss: 0.9014, test_loss: 1.0139, test_f1: 0.5229
 epoch: 20, train_loss: 0.8920, test_loss: 1.0055, test_f1: 0.5248
 epoch: 21, train_loss: 0.8851, test_loss: 1.0029, test_f1: 0.5446
 epoch: 22, train_loss: 0.8861, test_loss: 1.0113, test_f1: 0.5387
 epoch: 23, train_loss: 0.8854, test_loss: 1.0068, test_f1: 0.5435
 epoch: 24, train_loss: 0.8701, test_loss: 1.0087, test_f1: 0.5563
 epoch: 25, train_loss: 0.8689, test_loss: 1.0097, test_f1: 0.5600
 epoch: 26, train_loss: 0.8601, test_loss: 1.0142, test_f1: 0.5471
 epoch: 27, train_loss: 0.8560, test_loss: 1.0015, test_f1: 0.5583
 epoch: 28, train_loss: 0.8453, test_loss: 0.9980, test_f1: 0.5451
 epoch: 29, train_loss: 0.8462, test_loss: 0.9907, test_f1: 0.5366
 epoch: 30, train_loss: 0.8444, test_loss: 0.9921, test_f1: 0.5134
 epoch: 31, train_loss: 0.8414, test_loss: 0.9874, test_f1: 0.5435
 epoch: 32, train_loss: 0.8240, test_loss: 0.9891, test_f1: 0.5298
 epoch: 33, train_loss: 0.8319, test_loss: 0.9897, test_f1: 0.5233
 epoch: 34, train_loss: 0.8179, test_loss: 0.9837, test_f1: 0.5398
 epoch: 35, train_loss: 0.8146, test_loss: 0.9861, test_f1: 0.5524
 epoch: 36, train_loss: 0.7984, test_loss: 0.9820, test_f1: 0.5396
 epoch: 37, train_loss: 0.8035, test_loss: 0.9849, test_f1: 0.5437
 epoch: 38, train_loss: 0.8072, test_loss: 0.9965, test_f1: 0.5523
 epoch: 39, train_loss: 0.7934, test_loss: 0.9902, test_f1: 0.5306
 epoch: 40, train_loss: 0.7865, test_loss: 0.9893, test_f1: 0.5529
 epoch: 41, train_loss: 0.7855, test_loss: 0.9984, test_f1: 0.5375
 epoch: 42, train_loss: 0.7828, test_loss: 0.9964, test_f1: 0.5504
 epoch: 43, train_loss: 0.7885, test_loss: 0.9837, test_f1: 0.5566
 epoch: 44, train_loss: 0.7780, test_loss: 0.9962, test_f1: 0.5510
 epoch: 45, train_loss: 0.7677, test_loss: 0.9936, test_f1: 0.5611
 epoch: 46, train_loss: 0.7681, test_loss: 0.9947, test_f1: 0.5349
 epoch: 47, train_loss: 0.7653, test_loss: 0.9987, test_f1: 0.5481
 epoch: 48, train_loss: 0.7503, test_loss: 1.0159, test_f1: 0.5183
 epoch: 49, train_loss: 0.7488, test_loss: 1.0113, test_f1: 0.5389
 epoch: 50, train_loss: 0.7422, test_loss: 1.0198, test_f1: 0.5427
 epoch: 51, train_loss: 0.7377, test_loss: 1.0079, test_f1: 0.5562
 epoch: 52, train_loss: 0.7364, test_loss: 1.0074, test_f1: 0.5415
 epoch: 53, train_loss: 0.7368, test_loss: 1.0161, test_f1: 0.5312
 epoch: 54, train_loss: 0.7285, test_loss: 1.0100, test_f1: 0.5466
 epoch: 55, train_loss: 0.7311, test_loss: 1.0043, test_f1: 0.5490
 epoch: 56, train_loss: 0.7270, test_loss: 1.0076, test_f1: 0.5564
 epoch: 57, train_loss: 0.7234, test_loss: 1.0121, test_f1: 0.5609
 epoch: 58, train_loss: 0.7357, test_loss: 1.0293, test_f1: 0.5430
 epoch: 59, train_loss: 0.7209, test_loss: 1.0315, test_f1: 0.5326
 epoch: 60, train_loss: 0.7203, test_loss: 1.0212, test_f1: 0.5306
 epoch: 61, train_loss: 0.7139, test_loss: 1.0091, test_f1: 0.5347
 epoch: 62, train_loss: 0.7176, test_loss: 1.0075, test_f1: 0.5383
 epoch: 63, train_loss: 0.7098, test_loss: 1.0070, test_f1: 0.5402
 epoch: 64, train_loss: 0.7098, test_loss: 1.0012, test_f1: 0.5461
 epoch: 65, train_loss: 0.7128, test_loss: 1.0016, test_f1: 0.5508
 epoch: 66, train_loss: 0.7112, test_loss: 1.0075, test_f1: 0.5468
 epoch: 67, train_loss: 0.6987, test_loss: 1.0083, test_f1: 0.5523
 epoch: 68, train_loss: 0.6983, test_loss: 1.0077, test_f1: 0.5545
 epoch: 69, train_loss: 0.7102, test_loss: 1.0252, test_f1: 0.5492
 epoch: 70, train_loss: 0.6956, test_loss: 1.0171, test_f1: 0.5695
 epoch: 71, train_loss: 0.6967, test_loss: 1.0139, test_f1: 0.5647
 epoch: 72, train_loss: 0.6866, test_loss: 1.0267, test_f1: 0.5575
 epoch: 73, train_loss: 0.6885, test_loss: 1.0256, test_f1: 0.5431
 epoch: 74, train_loss: 0.6956, test_loss: 1.0215, test_f1: 0.5664
 epoch: 75, train_loss: 0.6913, test_loss: 1.0306, test_f1: 0.5666
 epoch: 76, train_loss: 0.6795, test_loss: 1.0324, test_f1: 0.5601
 epoch: 77, train_loss: 0.6740, test_loss: 1.0203, test_f1: 0.5702
 epoch: 78, train_loss: 0.6811, test_loss: 1.0275, test_f1: 0.5500
 epoch: 79, train_loss: 0.6710, test_loss: 1.0372, test_f1: 0.5647
 epoch: 80, train_loss: 0.6679, test_loss: 1.0408, test_f1: 0.5655
 epoch: 81, train_loss: 0.6683, test_loss: 1.0317, test_f1: 0.5787
 epoch: 82, train_loss: 0.6741, test_loss: 1.0337, test_f1: 0.5860
 epoch: 83, train_loss: 0.6636, test_loss: 1.0368, test_f1: 0.5790
 epoch: 84, train_loss: 0.6638, test_loss: 1.0395, test_f1: 0.5834
 epoch: 85, train_loss: 0.6689, test_loss: 1.0367, test_f1: 0.5695
 epoch: 86, train_loss: 0.6671, test_loss: 1.0169, test_f1: 0.5911
 epoch: 87, train_loss: 0.6617, test_loss: 1.0396, test_f1: 0.5863
 epoch: 88, train_loss: 0.6527, test_loss: 1.0535, test_f1: 0.5799
 epoch: 89, train_loss: 0.6537, test_loss: 1.0525, test_f1: 0.5900
 epoch: 90, train_loss: 0.6541, test_loss: 1.0306, test_f1: 0.5912
 epoch: 91, train_loss: 0.6585, test_loss: 1.0391, test_f1: 0.5811
 epoch: 92, train_loss: 0.6437, test_loss: 1.0662, test_f1: 0.5737
 epoch: 93, train_loss: 0.6485, test_loss: 1.0659, test_f1: 0.5709
 epoch: 94, train_loss: 0.6471, test_loss: 1.0549, test_f1: 0.5760
 epoch: 95, train_loss: 0.6388, test_loss: 1.0528, test_f1: 0.5731
 epoch: 96, train_loss: 0.6444, test_loss: 1.0685, test_f1: 0.5730
 epoch: 97, train_loss: 0.6331, test_loss: 1.0490, test_f1: 0.5587
 epoch: 98, train_loss: 0.6359, test_loss: 1.0426, test_f1: 0.5978
 epoch: 99, train_loss: 0.6267, test_loss: 1.0554, test_f1: 0.5863

Training completed in 399.89 seconds
Best F1: 0.5978 at epoch 98
Mean F1 across iterations: 0.5795  0.0122
========================FINAL RESULTS================================
FEGIN weighted F1: 0.5978  0.0122
python main.py --data ltspice_demos --representation component_pin_net --model FEGIN --layers 3 --hiddens 128 --batch_size 256 --lr 0.0001 --emb_size 128 --epochs 100 --save_appendix component_pin_net_L3_H128_BS256_LR0.0001_E128 --no_val
-----



STDERR:
  File "main.py", line 370, in <module>
    main()
  File "main.py", line 254, in main
    dataset = dataset_class(
  File "/home/philip/projects/ltspice_examples_code_repo/Circuit-Completion-Using-GNNs/component_classification_with_link_prediction_head/evaluation/FEGIN/kernel/circuit_datasets.py", line 15, in __init__
    self.data, self.slices = torch.load(self.processed_paths[0])
  File "/home/philip/.local/lib/python3.8/site-packages/torch/serialization.py", line 1040, in load
    warnings.warn(
  File "/usr/lib/python3.8/warnings.py", line 109, in _showwarnmsg
    sw(msg.message, msg.category, msg.filename, msg.lineno,
  File "main.py", line 47, in warn_with_traceback
    traceback.print_stack(file=log)
/home/philip/projects/ltspice_examples_code_repo/Circuit-Completion-Using-GNNs/component_classification_with_link_prediction_head/evaluation/FEGIN/kernel/circuit_datasets.py:15: FutureWarning: You are using `torch.load` with `weights_only=False` (the current default value), which uses the default pickle module implicitly. It is possible to construct malicious pickle data which will execute arbitrary code during unpickling (See https://github.com/pytorch/pytorch/blob/main/SECURITY.md#untrusted-models for more details). In a future release, the default value for `weights_only` will be flipped to `True`. This limits the functions that could be executed during unpickling. Arbitrary objects will no longer be allowed to be loaded via this mode unless they are explicitly allowlisted by the user via `torch.serialization.add_safe_globals`. We recommend you start setting `weights_only=True` for any use case where you don't have full control of the loaded file. Please open an issue on GitHub for any issues related to this experimental feature.
  self.data, self.slices = torch.load(self.processed_paths[0])
