STDOUT:
Results will be saved in /home/philip/projects/ltspice_examples_code_repo/Circuit-Completion-Using-GNNs/component_classification_with_link_prediction_head/evaluation/FEGIN/results/model_FEGIN_dataset_ltspice_examples
Command line input: python main.py --data ltspice_examples --representation component_pin --model FEGIN --layers 6 --hiddens 16 --batch_size 256 --lr 0.0001 --emb_size 512 --epochs 100 --save_appendix component_pin_L6_H16_BS256_LR0.0001_E512 --no_val
 is saved.
-----
ltspice_examples - FEGIN
Using 6 layers, 16 hidden units, h = 2
Loading component_pin representation dataset
ENTERED
Training FEGIN on component_pin representation
Train: 3560, Test: 848
##################ITERATION #0 ****************************************
 epoch: 0, train_loss: 1.4665, test_loss: 1.4547, test_f1: 0.0789
 epoch: 1, train_loss: 1.4638, test_loss: 1.4529, test_f1: 0.0789
 epoch: 2, train_loss: 1.4622, test_loss: 1.4514, test_f1: 0.0789
 epoch: 3, train_loss: 1.4605, test_loss: 1.4498, test_f1: 0.0789
 epoch: 4, train_loss: 1.4590, test_loss: 1.4484, test_f1: 0.0789
 epoch: 5, train_loss: 1.4575, test_loss: 1.4469, test_f1: 0.0789
 epoch: 6, train_loss: 1.4557, test_loss: 1.4452, test_f1: 0.0789
 epoch: 7, train_loss: 1.4541, test_loss: 1.4437, test_f1: 0.0789
 epoch: 8, train_loss: 1.4527, test_loss: 1.4422, test_f1: 0.0789
 epoch: 9, train_loss: 1.4508, test_loss: 1.4409, test_f1: 0.0789
 epoch: 10, train_loss: 1.4493, test_loss: 1.4395, test_f1: 0.0789
 epoch: 11, train_loss: 1.4478, test_loss: 1.4381, test_f1: 0.0789
 epoch: 12, train_loss: 1.4465, test_loss: 1.4366, test_f1: 0.0789
 epoch: 13, train_loss: 1.4450, test_loss: 1.4354, test_f1: 0.0789
 epoch: 14, train_loss: 1.4431, test_loss: 1.4338, test_f1: 0.0789
 epoch: 15, train_loss: 1.4414, test_loss: 1.4321, test_f1: 0.0789
 epoch: 16, train_loss: 1.4400, test_loss: 1.4307, test_f1: 0.0789
 epoch: 17, train_loss: 1.4382, test_loss: 1.4291, test_f1: 0.0789
 epoch: 18, train_loss: 1.4367, test_loss: 1.4277, test_f1: 0.0789
 epoch: 19, train_loss: 1.4350, test_loss: 1.4261, test_f1: 0.0789
 epoch: 20, train_loss: 1.4330, test_loss: 1.4245, test_f1: 0.0789
 epoch: 21, train_loss: 1.4315, test_loss: 1.4230, test_f1: 0.0789
 epoch: 22, train_loss: 1.4297, test_loss: 1.4214, test_f1: 0.0791
 epoch: 23, train_loss: 1.4284, test_loss: 1.4196, test_f1: 0.0794
 epoch: 24, train_loss: 1.4269, test_loss: 1.4183, test_f1: 0.0794
 epoch: 25, train_loss: 1.4248, test_loss: 1.4164, test_f1: 0.0875
 epoch: 26, train_loss: 1.4237, test_loss: 1.4150, test_f1: 0.1057
 epoch: 27, train_loss: 1.4214, test_loss: 1.4131, test_f1: 0.1180
 epoch: 28, train_loss: 1.4192, test_loss: 1.4113, test_f1: 0.1512
 epoch: 29, train_loss: 1.4171, test_loss: 1.4090, test_f1: 0.1611
 epoch: 30, train_loss: 1.4152, test_loss: 1.4069, test_f1: 0.1679
 epoch: 31, train_loss: 1.4126, test_loss: 1.4045, test_f1: 0.1686
 epoch: 32, train_loss: 1.4104, test_loss: 1.4019, test_f1: 0.1720
 epoch: 33, train_loss: 1.4074, test_loss: 1.3993, test_f1: 0.1897
 epoch: 34, train_loss: 1.4053, test_loss: 1.3961, test_f1: 0.1961
 epoch: 35, train_loss: 1.4003, test_loss: 1.3924, test_f1: 0.2005
 epoch: 36, train_loss: 1.3974, test_loss: 1.3889, test_f1: 0.2013
 epoch: 37, train_loss: 1.3924, test_loss: 1.3848, test_f1: 0.2011
 epoch: 38, train_loss: 1.3905, test_loss: 1.3807, test_f1: 0.1941
 epoch: 39, train_loss: 1.3851, test_loss: 1.3762, test_f1: 0.1993
 epoch: 40, train_loss: 1.3816, test_loss: 1.3716, test_f1: 0.2072
 epoch: 41, train_loss: 1.3761, test_loss: 1.3667, test_f1: 0.2063
 epoch: 42, train_loss: 1.3704, test_loss: 1.3616, test_f1: 0.2003
 epoch: 43, train_loss: 1.3644, test_loss: 1.3559, test_f1: 0.2005
 epoch: 44, train_loss: 1.3607, test_loss: 1.3502, test_f1: 0.2158
 epoch: 45, train_loss: 1.3531, test_loss: 1.3446, test_f1: 0.2627
 epoch: 46, train_loss: 1.3482, test_loss: 1.3383, test_f1: 0.2864
 epoch: 47, train_loss: 1.3430, test_loss: 1.3311, test_f1: 0.3043
 epoch: 48, train_loss: 1.3343, test_loss: 1.3243, test_f1: 0.3022
 epoch: 49, train_loss: 1.3317, test_loss: 1.3180, test_f1: 0.3174
 epoch: 50, train_loss: 1.3223, test_loss: 1.3115, test_f1: 0.3130
 epoch: 51, train_loss: 1.3184, test_loss: 1.3079, test_f1: 0.3096
 epoch: 52, train_loss: 1.3124, test_loss: 1.3053, test_f1: 0.3079
 epoch: 53, train_loss: 1.3158, test_loss: 1.3018, test_f1: 0.3154
 epoch: 54, train_loss: 1.3125, test_loss: 1.2986, test_f1: 0.3130
 epoch: 55, train_loss: 1.3115, test_loss: 1.2953, test_f1: 0.3085
 epoch: 56, train_loss: 1.3068, test_loss: 1.2924, test_f1: 0.3001
 epoch: 57, train_loss: 1.3020, test_loss: 1.2899, test_f1: 0.2927
 epoch: 58, train_loss: 1.3025, test_loss: 1.2872, test_f1: 0.2967
 epoch: 59, train_loss: 1.2992, test_loss: 1.2848, test_f1: 0.2836
 epoch: 60, train_loss: 1.2963, test_loss: 1.2824, test_f1: 0.2816
 epoch: 61, train_loss: 1.2939, test_loss: 1.2803, test_f1: 0.2839
 epoch: 62, train_loss: 1.2945, test_loss: 1.2785, test_f1: 0.2818
 epoch: 63, train_loss: 1.2933, test_loss: 1.2762, test_f1: 0.2816
 epoch: 64, train_loss: 1.2878, test_loss: 1.2739, test_f1: 0.2761
 epoch: 65, train_loss: 1.2855, test_loss: 1.2714, test_f1: 0.2717
 epoch: 66, train_loss: 1.2860, test_loss: 1.2697, test_f1: 0.2705
 epoch: 67, train_loss: 1.2808, test_loss: 1.2674, test_f1: 0.2573
 epoch: 68, train_loss: 1.2828, test_loss: 1.2653, test_f1: 0.2570
 epoch: 69, train_loss: 1.2814, test_loss: 1.2636, test_f1: 0.2451
 epoch: 70, train_loss: 1.2794, test_loss: 1.2615, test_f1: 0.2373
 epoch: 71, train_loss: 1.2775, test_loss: 1.2606, test_f1: 0.2474
 epoch: 72, train_loss: 1.2727, test_loss: 1.2590, test_f1: 0.2415
 epoch: 73, train_loss: 1.2737, test_loss: 1.2574, test_f1: 0.2460
 epoch: 74, train_loss: 1.2698, test_loss: 1.2549, test_f1: 0.2402
 epoch: 75, train_loss: 1.2713, test_loss: 1.2535, test_f1: 0.2379
 epoch: 76, train_loss: 1.2716, test_loss: 1.2524, test_f1: 0.2388
 epoch: 77, train_loss: 1.2673, test_loss: 1.2498, test_f1: 0.2420
 epoch: 78, train_loss: 1.2660, test_loss: 1.2479, test_f1: 0.2411
 epoch: 79, train_loss: 1.2652, test_loss: 1.2465, test_f1: 0.2365
 epoch: 80, train_loss: 1.2635, test_loss: 1.2456, test_f1: 0.2367
 epoch: 81, train_loss: 1.2563, test_loss: 1.2441, test_f1: 0.2370
 epoch: 82, train_loss: 1.2640, test_loss: 1.2432, test_f1: 0.2367
 epoch: 83, train_loss: 1.2625, test_loss: 1.2414, test_f1: 0.2370
 epoch: 84, train_loss: 1.2599, test_loss: 1.2402, test_f1: 0.2376
 epoch: 85, train_loss: 1.2608, test_loss: 1.2384, test_f1: 0.2379
 epoch: 86, train_loss: 1.2540, test_loss: 1.2373, test_f1: 0.2385
 epoch: 87, train_loss: 1.2548, test_loss: 1.2358, test_f1: 0.2385
 epoch: 88, train_loss: 1.2528, test_loss: 1.2347, test_f1: 0.2389
 epoch: 89, train_loss: 1.2481, test_loss: 1.2332, test_f1: 0.2387
 epoch: 90, train_loss: 1.2545, test_loss: 1.2322, test_f1: 0.2440
 epoch: 91, train_loss: 1.2493, test_loss: 1.2310, test_f1: 0.2438
 epoch: 92, train_loss: 1.2468, test_loss: 1.2304, test_f1: 0.2465
 epoch: 93, train_loss: 1.2497, test_loss: 1.2292, test_f1: 0.2463
 epoch: 94, train_loss: 1.2502, test_loss: 1.2283, test_f1: 0.2551
 epoch: 95, train_loss: 1.2478, test_loss: 1.2265, test_f1: 0.2599
 epoch: 96, train_loss: 1.2455, test_loss: 1.2251, test_f1: 0.2599
 epoch: 97, train_loss: 1.2385, test_loss: 1.2237, test_f1: 0.2638
 epoch: 98, train_loss: 1.2445, test_loss: 1.2228, test_f1: 0.2660
 epoch: 99, train_loss: 1.2425, test_loss: 1.2217, test_f1: 0.2679
##################ITERATION #1 ****************************************
 epoch: 0, train_loss: 1.4190, test_loss: 1.4122, test_f1: 0.0789
 epoch: 1, train_loss: 1.4163, test_loss: 1.4104, test_f1: 0.0789
 epoch: 2, train_loss: 1.4145, test_loss: 1.4082, test_f1: 0.0789
 epoch: 3, train_loss: 1.4129, test_loss: 1.4066, test_f1: 0.0789
 epoch: 4, train_loss: 1.4110, test_loss: 1.4048, test_f1: 0.0789
 epoch: 5, train_loss: 1.4087, test_loss: 1.4032, test_f1: 0.0789
 epoch: 6, train_loss: 1.4062, test_loss: 1.4015, test_f1: 0.0789
 epoch: 7, train_loss: 1.4025, test_loss: 1.3990, test_f1: 0.0789
 epoch: 8, train_loss: 1.3991, test_loss: 1.3961, test_f1: 0.0789
 epoch: 9, train_loss: 1.3959, test_loss: 1.3932, test_f1: 0.0789
 epoch: 10, train_loss: 1.3915, test_loss: 1.3894, test_f1: 0.0789
 epoch: 11, train_loss: 1.3884, test_loss: 1.3850, test_f1: 0.0789
 epoch: 12, train_loss: 1.3838, test_loss: 1.3804, test_f1: 0.0789
 epoch: 13, train_loss: 1.3781, test_loss: 1.3759, test_f1: 0.1320
 epoch: 14, train_loss: 1.3746, test_loss: 1.3713, test_f1: 0.1982
 epoch: 15, train_loss: 1.3678, test_loss: 1.3671, test_f1: 0.2557
 epoch: 16, train_loss: 1.3646, test_loss: 1.3630, test_f1: 0.2683
 epoch: 17, train_loss: 1.3602, test_loss: 1.3585, test_f1: 0.2670
 epoch: 18, train_loss: 1.3561, test_loss: 1.3541, test_f1: 0.2659
 epoch: 19, train_loss: 1.3512, test_loss: 1.3500, test_f1: 0.2721
 epoch: 20, train_loss: 1.3430, test_loss: 1.3457, test_f1: 0.2700
 epoch: 21, train_loss: 1.3378, test_loss: 1.3415, test_f1: 0.2710
 epoch: 22, train_loss: 1.3341, test_loss: 1.3374, test_f1: 0.2701
 epoch: 23, train_loss: 1.3310, test_loss: 1.3328, test_f1: 0.2703
 epoch: 24, train_loss: 1.3279, test_loss: 1.3283, test_f1: 0.2745
 epoch: 25, train_loss: 1.3219, test_loss: 1.3237, test_f1: 0.2777
 epoch: 26, train_loss: 1.3164, test_loss: 1.3188, test_f1: 0.2704
 epoch: 27, train_loss: 1.3086, test_loss: 1.3139, test_f1: 0.2648
 epoch: 28, train_loss: 1.3059, test_loss: 1.3102, test_f1: 0.2677
 epoch: 29, train_loss: 1.3040, test_loss: 1.3063, test_f1: 0.2587
 epoch: 30, train_loss: 1.2989, test_loss: 1.3025, test_f1: 0.2577
 epoch: 31, train_loss: 1.2942, test_loss: 1.2988, test_f1: 0.2534
 epoch: 32, train_loss: 1.2921, test_loss: 1.2955, test_f1: 0.2481
 epoch: 33, train_loss: 1.2889, test_loss: 1.2920, test_f1: 0.2494
 epoch: 34, train_loss: 1.2844, test_loss: 1.2884, test_f1: 0.2520
 epoch: 35, train_loss: 1.2804, test_loss: 1.2850, test_f1: 0.2499
 epoch: 36, train_loss: 1.2771, test_loss: 1.2823, test_f1: 0.2517
 epoch: 37, train_loss: 1.2745, test_loss: 1.2793, test_f1: 0.2506
 epoch: 38, train_loss: 1.2734, test_loss: 1.2763, test_f1: 0.2541
 epoch: 39, train_loss: 1.2680, test_loss: 1.2729, test_f1: 0.2401
 epoch: 40, train_loss: 1.2672, test_loss: 1.2698, test_f1: 0.2297
 epoch: 41, train_loss: 1.2669, test_loss: 1.2669, test_f1: 0.2298
 epoch: 42, train_loss: 1.2635, test_loss: 1.2637, test_f1: 0.2328
 epoch: 43, train_loss: 1.2611, test_loss: 1.2607, test_f1: 0.2310
 epoch: 44, train_loss: 1.2589, test_loss: 1.2575, test_f1: 0.2326
 epoch: 45, train_loss: 1.2521, test_loss: 1.2545, test_f1: 0.2313
 epoch: 46, train_loss: 1.2557, test_loss: 1.2514, test_f1: 0.2522
 epoch: 47, train_loss: 1.2524, test_loss: 1.2485, test_f1: 0.2517
 epoch: 48, train_loss: 1.2480, test_loss: 1.2462, test_f1: 0.2658
 epoch: 49, train_loss: 1.2490, test_loss: 1.2436, test_f1: 0.2598
 epoch: 50, train_loss: 1.2478, test_loss: 1.2405, test_f1: 0.2626
 epoch: 51, train_loss: 1.2454, test_loss: 1.2397, test_f1: 0.2606
 epoch: 52, train_loss: 1.2454, test_loss: 1.2388, test_f1: 0.2614
 epoch: 53, train_loss: 1.2409, test_loss: 1.2379, test_f1: 0.2621
 epoch: 54, train_loss: 1.2404, test_loss: 1.2374, test_f1: 0.2654
 epoch: 55, train_loss: 1.2404, test_loss: 1.2364, test_f1: 0.2668
 epoch: 56, train_loss: 1.2392, test_loss: 1.2357, test_f1: 0.2676
 epoch: 57, train_loss: 1.2391, test_loss: 1.2351, test_f1: 0.2664
 epoch: 58, train_loss: 1.2420, test_loss: 1.2343, test_f1: 0.2683
 epoch: 59, train_loss: 1.2366, test_loss: 1.2336, test_f1: 0.2679
 epoch: 60, train_loss: 1.2333, test_loss: 1.2330, test_f1: 0.2668
 epoch: 61, train_loss: 1.2338, test_loss: 1.2325, test_f1: 0.2679
 epoch: 62, train_loss: 1.2357, test_loss: 1.2315, test_f1: 0.2681
 epoch: 63, train_loss: 1.2346, test_loss: 1.2300, test_f1: 0.2688
 epoch: 64, train_loss: 1.2348, test_loss: 1.2296, test_f1: 0.2687
 epoch: 65, train_loss: 1.2319, test_loss: 1.2285, test_f1: 0.2685
 epoch: 66, train_loss: 1.2318, test_loss: 1.2272, test_f1: 0.2682
 epoch: 67, train_loss: 1.2319, test_loss: 1.2264, test_f1: 0.2681
 epoch: 68, train_loss: 1.2374, test_loss: 1.2259, test_f1: 0.2733
 epoch: 69, train_loss: 1.2262, test_loss: 1.2248, test_f1: 0.2688
 epoch: 70, train_loss: 1.2339, test_loss: 1.2246, test_f1: 0.2689
 epoch: 71, train_loss: 1.2302, test_loss: 1.2233, test_f1: 0.2729
 epoch: 72, train_loss: 1.2319, test_loss: 1.2227, test_f1: 0.2704
 epoch: 73, train_loss: 1.2300, test_loss: 1.2219, test_f1: 0.2766
 epoch: 74, train_loss: 1.2306, test_loss: 1.2214, test_f1: 0.2762
 epoch: 75, train_loss: 1.2282, test_loss: 1.2204, test_f1: 0.2794
 epoch: 76, train_loss: 1.2285, test_loss: 1.2199, test_f1: 0.2763
 epoch: 77, train_loss: 1.2225, test_loss: 1.2193, test_f1: 0.2762
 epoch: 78, train_loss: 1.2233, test_loss: 1.2187, test_f1: 0.2771
 epoch: 79, train_loss: 1.2280, test_loss: 1.2183, test_f1: 0.2757
 epoch: 80, train_loss: 1.2240, test_loss: 1.2173, test_f1: 0.2762
 epoch: 81, train_loss: 1.2223, test_loss: 1.2170, test_f1: 0.2759
 epoch: 82, train_loss: 1.2238, test_loss: 1.2166, test_f1: 0.2765
 epoch: 83, train_loss: 1.2230, test_loss: 1.2157, test_f1: 0.2775
 epoch: 84, train_loss: 1.2227, test_loss: 1.2150, test_f1: 0.2757
 epoch: 85, train_loss: 1.2229, test_loss: 1.2148, test_f1: 0.2755
 epoch: 86, train_loss: 1.2210, test_loss: 1.2136, test_f1: 0.2714
 epoch: 87, train_loss: 1.2234, test_loss: 1.2125, test_f1: 0.2737
 epoch: 88, train_loss: 1.2215, test_loss: 1.2116, test_f1: 0.2738
 epoch: 89, train_loss: 1.2217, test_loss: 1.2119, test_f1: 0.2774
 epoch: 90, train_loss: 1.2195, test_loss: 1.2106, test_f1: 0.2780
 epoch: 91, train_loss: 1.2201, test_loss: 1.2107, test_f1: 0.2800
 epoch: 92, train_loss: 1.2201, test_loss: 1.2107, test_f1: 0.2805
 epoch: 93, train_loss: 1.2206, test_loss: 1.2107, test_f1: 0.2812
 epoch: 94, train_loss: 1.2224, test_loss: 1.2102, test_f1: 0.2804
 epoch: 95, train_loss: 1.2200, test_loss: 1.2081, test_f1: 0.2832
 epoch: 96, train_loss: 1.2174, test_loss: 1.2086, test_f1: 0.2792
 epoch: 97, train_loss: 1.2140, test_loss: 1.2080, test_f1: 0.2791
 epoch: 98, train_loss: 1.2197, test_loss: 1.2083, test_f1: 0.2834
 epoch: 99, train_loss: 1.2105, test_loss: 1.2069, test_f1: 0.2773
##################ITERATION #2 ****************************************
 epoch: 0, train_loss: 1.3783, test_loss: 1.3785, test_f1: 0.0789
 epoch: 1, train_loss: 1.3746, test_loss: 1.3761, test_f1: 0.0789
 epoch: 2, train_loss: 1.3710, test_loss: 1.3732, test_f1: 0.0990
 epoch: 3, train_loss: 1.3687, test_loss: 1.3730, test_f1: 0.1311
 epoch: 4, train_loss: 1.3659, test_loss: 1.3697, test_f1: 0.2807
 epoch: 5, train_loss: 1.3636, test_loss: 1.3655, test_f1: 0.2813
 epoch: 6, train_loss: 1.3602, test_loss: 1.3606, test_f1: 0.2683
 epoch: 7, train_loss: 1.3566, test_loss: 1.3571, test_f1: 0.2410
 epoch: 8, train_loss: 1.3532, test_loss: 1.3536, test_f1: 0.2264
 epoch: 9, train_loss: 1.3499, test_loss: 1.3507, test_f1: 0.2262
 epoch: 10, train_loss: 1.3478, test_loss: 1.3480, test_f1: 0.2262
 epoch: 11, train_loss: 1.3451, test_loss: 1.3442, test_f1: 0.2262
 epoch: 12, train_loss: 1.3415, test_loss: 1.3412, test_f1: 0.2262
 epoch: 13, train_loss: 1.3376, test_loss: 1.3380, test_f1: 0.2260
 epoch: 14, train_loss: 1.3332, test_loss: 1.3352, test_f1: 0.2260
 epoch: 15, train_loss: 1.3318, test_loss: 1.3313, test_f1: 0.2260
 epoch: 16, train_loss: 1.3255, test_loss: 1.3277, test_f1: 0.2260
 epoch: 17, train_loss: 1.3214, test_loss: 1.3243, test_f1: 0.2260
 epoch: 18, train_loss: 1.3191, test_loss: 1.3201, test_f1: 0.2260
 epoch: 19, train_loss: 1.3139, test_loss: 1.3156, test_f1: 0.2260
 epoch: 20, train_loss: 1.3102, test_loss: 1.3112, test_f1: 0.2260
 epoch: 21, train_loss: 1.3051, test_loss: 1.3067, test_f1: 0.2260
 epoch: 22, train_loss: 1.2994, test_loss: 1.3022, test_f1: 0.2260
 epoch: 23, train_loss: 1.2933, test_loss: 1.2976, test_f1: 0.2260
 epoch: 24, train_loss: 1.2894, test_loss: 1.2918, test_f1: 0.2260
 epoch: 25, train_loss: 1.2834, test_loss: 1.2875, test_f1: 0.2260
 epoch: 26, train_loss: 1.2784, test_loss: 1.2824, test_f1: 0.2260
 epoch: 27, train_loss: 1.2739, test_loss: 1.2758, test_f1: 0.2260
 epoch: 28, train_loss: 1.2712, test_loss: 1.2725, test_f1: 0.2260
 epoch: 29, train_loss: 1.2659, test_loss: 1.2678, test_f1: 0.2260
 epoch: 30, train_loss: 1.2619, test_loss: 1.2636, test_f1: 0.2260
 epoch: 31, train_loss: 1.2597, test_loss: 1.2588, test_f1: 0.2260
 epoch: 32, train_loss: 1.2587, test_loss: 1.2558, test_f1: 0.2260
 epoch: 33, train_loss: 1.2529, test_loss: 1.2525, test_f1: 0.2260
 epoch: 34, train_loss: 1.2529, test_loss: 1.2493, test_f1: 0.2260
 epoch: 35, train_loss: 1.2489, test_loss: 1.2471, test_f1: 0.2260
 epoch: 36, train_loss: 1.2453, test_loss: 1.2446, test_f1: 0.2260
 epoch: 37, train_loss: 1.2419, test_loss: 1.2416, test_f1: 0.2260
 epoch: 38, train_loss: 1.2402, test_loss: 1.2386, test_f1: 0.2262
 epoch: 39, train_loss: 1.2393, test_loss: 1.2353, test_f1: 0.2264
 epoch: 40, train_loss: 1.2347, test_loss: 1.2327, test_f1: 0.2266
 epoch: 41, train_loss: 1.2325, test_loss: 1.2317, test_f1: 0.2266
 epoch: 42, train_loss: 1.2284, test_loss: 1.2294, test_f1: 0.2280
 epoch: 43, train_loss: 1.2271, test_loss: 1.2277, test_f1: 0.2283
 epoch: 44, train_loss: 1.2224, test_loss: 1.2255, test_f1: 0.2289
 epoch: 45, train_loss: 1.2198, test_loss: 1.2219, test_f1: 0.2299
 epoch: 46, train_loss: 1.2210, test_loss: 1.2207, test_f1: 0.2307
 epoch: 47, train_loss: 1.2206, test_loss: 1.2182, test_f1: 0.2319
 epoch: 48, train_loss: 1.2165, test_loss: 1.2155, test_f1: 0.2313
 epoch: 49, train_loss: 1.2138, test_loss: 1.2152, test_f1: 0.2339
 epoch: 50, train_loss: 1.2150, test_loss: 1.2136, test_f1: 0.2317
 epoch: 51, train_loss: 1.2113, test_loss: 1.2110, test_f1: 0.2335
 epoch: 52, train_loss: 1.2124, test_loss: 1.2097, test_f1: 0.2339
 epoch: 53, train_loss: 1.2080, test_loss: 1.2090, test_f1: 0.2337
 epoch: 54, train_loss: 1.2083, test_loss: 1.2090, test_f1: 0.2341
 epoch: 55, train_loss: 1.2110, test_loss: 1.2082, test_f1: 0.2337
 epoch: 56, train_loss: 1.2055, test_loss: 1.2071, test_f1: 0.2343
 epoch: 57, train_loss: 1.2035, test_loss: 1.2052, test_f1: 0.2345
 epoch: 58, train_loss: 1.2029, test_loss: 1.2038, test_f1: 0.2348
 epoch: 59, train_loss: 1.2081, test_loss: 1.2036, test_f1: 0.2352
 epoch: 60, train_loss: 1.2051, test_loss: 1.2026, test_f1: 0.2350
 epoch: 61, train_loss: 1.2011, test_loss: 1.2019, test_f1: 0.2356
 epoch: 62, train_loss: 1.2027, test_loss: 1.2014, test_f1: 0.2360
 epoch: 63, train_loss: 1.2027, test_loss: 1.2015, test_f1: 0.2377
 epoch: 64, train_loss: 1.1993, test_loss: 1.2008, test_f1: 0.2377
 epoch: 65, train_loss: 1.1993, test_loss: 1.1996, test_f1: 0.2362
 epoch: 66, train_loss: 1.1981, test_loss: 1.1977, test_f1: 0.2372
 epoch: 67, train_loss: 1.1982, test_loss: 1.1968, test_f1: 0.2372
 epoch: 68, train_loss: 1.1934, test_loss: 1.1959, test_f1: 0.2372
 epoch: 69, train_loss: 1.1916, test_loss: 1.1972, test_f1: 0.2375
 epoch: 70, train_loss: 1.2031, test_loss: 1.1954, test_f1: 0.2453
 epoch: 71, train_loss: 1.1927, test_loss: 1.1955, test_f1: 0.2436
 epoch: 72, train_loss: 1.1957, test_loss: 1.1936, test_f1: 0.2441
 epoch: 73, train_loss: 1.1946, test_loss: 1.1921, test_f1: 0.2433
 epoch: 74, train_loss: 1.1876, test_loss: 1.1909, test_f1: 0.2379
 epoch: 75, train_loss: 1.1886, test_loss: 1.1908, test_f1: 0.2461
 epoch: 76, train_loss: 1.1909, test_loss: 1.1898, test_f1: 0.2517
 epoch: 77, train_loss: 1.1891, test_loss: 1.1899, test_f1: 0.2486
 epoch: 78, train_loss: 1.1900, test_loss: 1.1873, test_f1: 0.2608
 epoch: 79, train_loss: 1.1856, test_loss: 1.1868, test_f1: 0.2582
 epoch: 80, train_loss: 1.1895, test_loss: 1.1859, test_f1: 0.2614
 epoch: 81, train_loss: 1.1851, test_loss: 1.1848, test_f1: 0.2606
 epoch: 82, train_loss: 1.1856, test_loss: 1.1840, test_f1: 0.2627
 epoch: 83, train_loss: 1.1826, test_loss: 1.1838, test_f1: 0.2558
 epoch: 84, train_loss: 1.1835, test_loss: 1.1825, test_f1: 0.2550
 epoch: 85, train_loss: 1.1829, test_loss: 1.1823, test_f1: 0.2577
 epoch: 86, train_loss: 1.1839, test_loss: 1.1798, test_f1: 0.2636
 epoch: 87, train_loss: 1.1843, test_loss: 1.1816, test_f1: 0.2614
 epoch: 88, train_loss: 1.1803, test_loss: 1.1803, test_f1: 0.2627
 epoch: 89, train_loss: 1.1792, test_loss: 1.1799, test_f1: 0.2798
 epoch: 90, train_loss: 1.1750, test_loss: 1.1799, test_f1: 0.2679
 epoch: 91, train_loss: 1.1802, test_loss: 1.1787, test_f1: 0.2660
 epoch: 92, train_loss: 1.1744, test_loss: 1.1791, test_f1: 0.2807
 epoch: 93, train_loss: 1.1768, test_loss: 1.1765, test_f1: 0.2728
 epoch: 94, train_loss: 1.1723, test_loss: 1.1770, test_f1: 0.2848
 epoch: 95, train_loss: 1.1765, test_loss: 1.1775, test_f1: 0.2942
 epoch: 96, train_loss: 1.1737, test_loss: 1.1757, test_f1: 0.2936
 epoch: 97, train_loss: 1.1743, test_loss: 1.1747, test_f1: 0.2987
 epoch: 98, train_loss: 1.1756, test_loss: 1.1738, test_f1: 0.2989
 epoch: 99, train_loss: 1.1737, test_loss: 1.1748, test_f1: 0.2997
##################ITERATION #3 ****************************************
 epoch: 0, train_loss: 1.3696, test_loss: 1.3709, test_f1: 0.2260
 epoch: 1, train_loss: 1.3656, test_loss: 1.3681, test_f1: 0.2260
 epoch: 2, train_loss: 1.3621, test_loss: 1.3662, test_f1: 0.2260
 epoch: 3, train_loss: 1.3595, test_loss: 1.3615, test_f1: 0.2260
 epoch: 4, train_loss: 1.3570, test_loss: 1.3596, test_f1: 0.2260
 epoch: 5, train_loss: 1.3541, test_loss: 1.3568, test_f1: 0.2260
 epoch: 6, train_loss: 1.3492, test_loss: 1.3523, test_f1: 0.2260
 epoch: 7, train_loss: 1.3459, test_loss: 1.3475, test_f1: 0.2260
 epoch: 8, train_loss: 1.3422, test_loss: 1.3432, test_f1: 0.2260
 epoch: 9, train_loss: 1.3384, test_loss: 1.3393, test_f1: 0.2260
 epoch: 10, train_loss: 1.3352, test_loss: 1.3350, test_f1: 0.2260
 epoch: 11, train_loss: 1.3301, test_loss: 1.3307, test_f1: 0.2260
 epoch: 12, train_loss: 1.3272, test_loss: 1.3258, test_f1: 0.2260
 epoch: 13, train_loss: 1.3210, test_loss: 1.3216, test_f1: 0.2260
 epoch: 14, train_loss: 1.3168, test_loss: 1.3178, test_f1: 0.2260
 epoch: 15, train_loss: 1.3124, test_loss: 1.3122, test_f1: 0.2260
 epoch: 16, train_loss: 1.3083, test_loss: 1.3079, test_f1: 0.2260
 epoch: 17, train_loss: 1.3031, test_loss: 1.3039, test_f1: 0.2260
 epoch: 18, train_loss: 1.3001, test_loss: 1.2989, test_f1: 0.2260
 epoch: 19, train_loss: 1.2943, test_loss: 1.2942, test_f1: 0.2260
 epoch: 20, train_loss: 1.2902, test_loss: 1.2902, test_f1: 0.2260
 epoch: 21, train_loss: 1.2858, test_loss: 1.2860, test_f1: 0.2260
 epoch: 22, train_loss: 1.2817, test_loss: 1.2811, test_f1: 0.2260
 epoch: 23, train_loss: 1.2806, test_loss: 1.2762, test_f1: 0.2260
 epoch: 24, train_loss: 1.2761, test_loss: 1.2723, test_f1: 0.2260
 epoch: 25, train_loss: 1.2735, test_loss: 1.2675, test_f1: 0.2260
 epoch: 26, train_loss: 1.2693, test_loss: 1.2626, test_f1: 0.2260
 epoch: 27, train_loss: 1.2670, test_loss: 1.2591, test_f1: 0.2260
 epoch: 28, train_loss: 1.2618, test_loss: 1.2556, test_f1: 0.2260
 epoch: 29, train_loss: 1.2617, test_loss: 1.2516, test_f1: 0.2260
 epoch: 30, train_loss: 1.2551, test_loss: 1.2486, test_f1: 0.2260
 epoch: 31, train_loss: 1.2536, test_loss: 1.2445, test_f1: 0.2260
 epoch: 32, train_loss: 1.2525, test_loss: 1.2422, test_f1: 0.2260
 epoch: 33, train_loss: 1.2525, test_loss: 1.2391, test_f1: 0.2260
 epoch: 34, train_loss: 1.2471, test_loss: 1.2364, test_f1: 0.2260
 epoch: 35, train_loss: 1.2442, test_loss: 1.2343, test_f1: 0.2260
 epoch: 36, train_loss: 1.2460, test_loss: 1.2315, test_f1: 0.2260
 epoch: 37, train_loss: 1.2421, test_loss: 1.2286, test_f1: 0.2260
 epoch: 38, train_loss: 1.2449, test_loss: 1.2275, test_f1: 0.2260
 epoch: 39, train_loss: 1.2360, test_loss: 1.2243, test_f1: 0.2260
 epoch: 40, train_loss: 1.2379, test_loss: 1.2223, test_f1: 0.2260
 epoch: 41, train_loss: 1.2355, test_loss: 1.2199, test_f1: 0.2260
 epoch: 42, train_loss: 1.2323, test_loss: 1.2188, test_f1: 0.2260
 epoch: 43, train_loss: 1.2345, test_loss: 1.2168, test_f1: 0.2260
 epoch: 44, train_loss: 1.2342, test_loss: 1.2145, test_f1: 0.2260
 epoch: 45, train_loss: 1.2328, test_loss: 1.2132, test_f1: 0.2260
 epoch: 46, train_loss: 1.2278, test_loss: 1.2115, test_f1: 0.2260
 epoch: 47, train_loss: 1.2306, test_loss: 1.2097, test_f1: 0.2260
 epoch: 48, train_loss: 1.2279, test_loss: 1.2078, test_f1: 0.2260
 epoch: 49, train_loss: 1.2253, test_loss: 1.2050, test_f1: 0.2260
 epoch: 50, train_loss: 1.2250, test_loss: 1.2035, test_f1: 0.2260
 epoch: 51, train_loss: 1.2247, test_loss: 1.2033, test_f1: 0.2260
 epoch: 52, train_loss: 1.2223, test_loss: 1.2026, test_f1: 0.2260
 epoch: 53, train_loss: 1.2203, test_loss: 1.2012, test_f1: 0.2260
 epoch: 54, train_loss: 1.2166, test_loss: 1.2000, test_f1: 0.2260
 epoch: 55, train_loss: 1.2191, test_loss: 1.2002, test_f1: 0.2260
 epoch: 56, train_loss: 1.2179, test_loss: 1.1991, test_f1: 0.2260
 epoch: 57, train_loss: 1.2161, test_loss: 1.1984, test_f1: 0.2260
 epoch: 58, train_loss: 1.2178, test_loss: 1.1971, test_f1: 0.2260
 epoch: 59, train_loss: 1.2138, test_loss: 1.1960, test_f1: 0.2260
 epoch: 60, train_loss: 1.2176, test_loss: 1.1947, test_f1: 0.2260
 epoch: 61, train_loss: 1.2173, test_loss: 1.1942, test_f1: 0.2260
 epoch: 62, train_loss: 1.2142, test_loss: 1.1937, test_f1: 0.2260
 epoch: 63, train_loss: 1.2155, test_loss: 1.1932, test_f1: 0.2260
 epoch: 64, train_loss: 1.2144, test_loss: 1.1920, test_f1: 0.2260
 epoch: 65, train_loss: 1.2113, test_loss: 1.1914, test_f1: 0.2260
 epoch: 66, train_loss: 1.2131, test_loss: 1.1911, test_f1: 0.2260
 epoch: 67, train_loss: 1.2121, test_loss: 1.1899, test_f1: 0.2260
 epoch: 68, train_loss: 1.2129, test_loss: 1.1889, test_f1: 0.2260
 epoch: 69, train_loss: 1.2102, test_loss: 1.1885, test_f1: 0.2260
 epoch: 70, train_loss: 1.2091, test_loss: 1.1873, test_f1: 0.2260
 epoch: 71, train_loss: 1.2102, test_loss: 1.1875, test_f1: 0.2260
 epoch: 72, train_loss: 1.2086, test_loss: 1.1870, test_f1: 0.2260
 epoch: 73, train_loss: 1.2105, test_loss: 1.1854, test_f1: 0.2260
 epoch: 74, train_loss: 1.2078, test_loss: 1.1854, test_f1: 0.2260
 epoch: 75, train_loss: 1.2064, test_loss: 1.1851, test_f1: 0.2260
 epoch: 76, train_loss: 1.2058, test_loss: 1.1843, test_f1: 0.2260
 epoch: 77, train_loss: 1.2058, test_loss: 1.1824, test_f1: 0.2260
 epoch: 78, train_loss: 1.2044, test_loss: 1.1812, test_f1: 0.2260
 epoch: 79, train_loss: 1.2044, test_loss: 1.1807, test_f1: 0.2260
 epoch: 80, train_loss: 1.2040, test_loss: 1.1807, test_f1: 0.2260
 epoch: 81, train_loss: 1.2017, test_loss: 1.1797, test_f1: 0.2286
 epoch: 82, train_loss: 1.1971, test_loss: 1.1787, test_f1: 0.2311
 epoch: 83, train_loss: 1.1995, test_loss: 1.1779, test_f1: 0.2359
 epoch: 84, train_loss: 1.1994, test_loss: 1.1773, test_f1: 0.2406
 epoch: 85, train_loss: 1.2014, test_loss: 1.1759, test_f1: 0.2452
 epoch: 86, train_loss: 1.1987, test_loss: 1.1758, test_f1: 0.2518
 epoch: 87, train_loss: 1.2009, test_loss: 1.1752, test_f1: 0.2621
 epoch: 88, train_loss: 1.1982, test_loss: 1.1751, test_f1: 0.2641
 epoch: 89, train_loss: 1.1945, test_loss: 1.1739, test_f1: 0.2680
 epoch: 90, train_loss: 1.2009, test_loss: 1.1729, test_f1: 0.2772
 epoch: 91, train_loss: 1.1956, test_loss: 1.1725, test_f1: 0.2842
 epoch: 92, train_loss: 1.1981, test_loss: 1.1719, test_f1: 0.2893
 epoch: 93, train_loss: 1.1970, test_loss: 1.1712, test_f1: 0.2988
 epoch: 94, train_loss: 1.1968, test_loss: 1.1713, test_f1: 0.2988
 epoch: 95, train_loss: 1.1936, test_loss: 1.1701, test_f1: 0.3018
 epoch: 96, train_loss: 1.1927, test_loss: 1.1701, test_f1: 0.3048
 epoch: 97, train_loss: 1.1922, test_loss: 1.1693, test_f1: 0.3062
 epoch: 98, train_loss: 1.1929, test_loss: 1.1685, test_f1: 0.3132
 epoch: 99, train_loss: 1.1889, test_loss: 1.1673, test_f1: 0.3160
##################ITERATION #4 ****************************************
 epoch: 0, train_loss: 1.3480, test_loss: 1.3616, test_f1: 0.2260
 epoch: 1, train_loss: 1.3421, test_loss: 1.3602, test_f1: 0.2260
 epoch: 2, train_loss: 1.3401, test_loss: 1.3566, test_f1: 0.2260
 epoch: 3, train_loss: 1.3352, test_loss: 1.3448, test_f1: 0.2260
 epoch: 4, train_loss: 1.3303, test_loss: 1.3349, test_f1: 0.2260
 epoch: 5, train_loss: 1.3274, test_loss: 1.3283, test_f1: 0.2260
 epoch: 6, train_loss: 1.3246, test_loss: 1.3247, test_f1: 0.2260
 epoch: 7, train_loss: 1.3204, test_loss: 1.3198, test_f1: 0.2260
 epoch: 8, train_loss: 1.3168, test_loss: 1.3148, test_f1: 0.2260
 epoch: 9, train_loss: 1.3118, test_loss: 1.3096, test_f1: 0.2260
 epoch: 10, train_loss: 1.3071, test_loss: 1.3046, test_f1: 0.2260
 epoch: 11, train_loss: 1.3044, test_loss: 1.3002, test_f1: 0.2260
 epoch: 12, train_loss: 1.2994, test_loss: 1.2968, test_f1: 0.2260
 epoch: 13, train_loss: 1.2964, test_loss: 1.2941, test_f1: 0.2260
 epoch: 14, train_loss: 1.2922, test_loss: 1.2895, test_f1: 0.2260
 epoch: 15, train_loss: 1.2873, test_loss: 1.2857, test_f1: 0.2260
 epoch: 16, train_loss: 1.2854, test_loss: 1.2816, test_f1: 0.2260
 epoch: 17, train_loss: 1.2806, test_loss: 1.2773, test_f1: 0.2260
 epoch: 18, train_loss: 1.2783, test_loss: 1.2733, test_f1: 0.2260
 epoch: 19, train_loss: 1.2756, test_loss: 1.2697, test_f1: 0.2260
 epoch: 20, train_loss: 1.2709, test_loss: 1.2649, test_f1: 0.2260
 epoch: 21, train_loss: 1.2672, test_loss: 1.2601, test_f1: 0.2260
 epoch: 22, train_loss: 1.2626, test_loss: 1.2556, test_f1: 0.2260
 epoch: 23, train_loss: 1.2548, test_loss: 1.2512, test_f1: 0.2260
 epoch: 24, train_loss: 1.2513, test_loss: 1.2454, test_f1: 0.2260
 epoch: 25, train_loss: 1.2514, test_loss: 1.2407, test_f1: 0.2260
 epoch: 26, train_loss: 1.2434, test_loss: 1.2358, test_f1: 0.2260
 epoch: 27, train_loss: 1.2417, test_loss: 1.2319, test_f1: 0.2260
 epoch: 28, train_loss: 1.2387, test_loss: 1.2275, test_f1: 0.2260
 epoch: 29, train_loss: 1.2346, test_loss: 1.2246, test_f1: 0.2260
 epoch: 30, train_loss: 1.2294, test_loss: 1.2195, test_f1: 0.2260
 epoch: 31, train_loss: 1.2305, test_loss: 1.2164, test_f1: 0.2260
 epoch: 32, train_loss: 1.2253, test_loss: 1.2148, test_f1: 0.2260
 epoch: 33, train_loss: 1.2213, test_loss: 1.2105, test_f1: 0.2260
 epoch: 34, train_loss: 1.2189, test_loss: 1.2067, test_f1: 0.2260
 epoch: 35, train_loss: 1.2213, test_loss: 1.2061, test_f1: 0.2260
 epoch: 36, train_loss: 1.2165, test_loss: 1.2034, test_f1: 0.2260
 epoch: 37, train_loss: 1.2149, test_loss: 1.2026, test_f1: 0.2260
 epoch: 38, train_loss: 1.2148, test_loss: 1.1984, test_f1: 0.2260
 epoch: 39, train_loss: 1.2124, test_loss: 1.1975, test_f1: 0.2260
 epoch: 40, train_loss: 1.2119, test_loss: 1.1962, test_f1: 0.2260
 epoch: 41, train_loss: 1.2092, test_loss: 1.1954, test_f1: 0.2260
 epoch: 42, train_loss: 1.2090, test_loss: 1.1929, test_f1: 0.2260
 epoch: 43, train_loss: 1.2071, test_loss: 1.1917, test_f1: 0.2260
 epoch: 44, train_loss: 1.2056, test_loss: 1.1907, test_f1: 0.2260
 epoch: 45, train_loss: 1.2019, test_loss: 1.1885, test_f1: 0.2260
 epoch: 46, train_loss: 1.2065, test_loss: 1.1876, test_f1: 0.2260
 epoch: 47, train_loss: 1.2040, test_loss: 1.1864, test_f1: 0.2260
 epoch: 48, train_loss: 1.2007, test_loss: 1.1835, test_f1: 0.2260
 epoch: 49, train_loss: 1.1963, test_loss: 1.1828, test_f1: 0.2260
 epoch: 50, train_loss: 1.1992, test_loss: 1.1811, test_f1: 0.2260
 epoch: 51, train_loss: 1.1975, test_loss: 1.1803, test_f1: 0.2260
 epoch: 52, train_loss: 1.1940, test_loss: 1.1801, test_f1: 0.2260
 epoch: 53, train_loss: 1.1955, test_loss: 1.1793, test_f1: 0.2260
 epoch: 54, train_loss: 1.1982, test_loss: 1.1794, test_f1: 0.2260
 epoch: 55, train_loss: 1.1931, test_loss: 1.1786, test_f1: 0.2260
 epoch: 56, train_loss: 1.1934, test_loss: 1.1774, test_f1: 0.2260
 epoch: 57, train_loss: 1.1929, test_loss: 1.1771, test_f1: 0.2260
 epoch: 58, train_loss: 1.1924, test_loss: 1.1763, test_f1: 0.2260
 epoch: 59, train_loss: 1.1893, test_loss: 1.1756, test_f1: 0.2260
 epoch: 60, train_loss: 1.1936, test_loss: 1.1752, test_f1: 0.2260
 epoch: 61, train_loss: 1.1893, test_loss: 1.1745, test_f1: 0.2260
 epoch: 62, train_loss: 1.1931, test_loss: 1.1746, test_f1: 0.2260
 epoch: 63, train_loss: 1.1940, test_loss: 1.1740, test_f1: 0.2260
 epoch: 64, train_loss: 1.1907, test_loss: 1.1737, test_f1: 0.2260
 epoch: 65, train_loss: 1.1877, test_loss: 1.1726, test_f1: 0.2260
 epoch: 66, train_loss: 1.1858, test_loss: 1.1726, test_f1: 0.2260
 epoch: 67, train_loss: 1.1889, test_loss: 1.1720, test_f1: 0.2260
 epoch: 68, train_loss: 1.1853, test_loss: 1.1716, test_f1: 0.2260
 epoch: 69, train_loss: 1.1864, test_loss: 1.1710, test_f1: 0.2260
 epoch: 70, train_loss: 1.1884, test_loss: 1.1703, test_f1: 0.2260
 epoch: 71, train_loss: 1.1845, test_loss: 1.1702, test_f1: 0.2260
 epoch: 72, train_loss: 1.1853, test_loss: 1.1691, test_f1: 0.2260
 epoch: 73, train_loss: 1.1866, test_loss: 1.1685, test_f1: 0.2260
 epoch: 74, train_loss: 1.1866, test_loss: 1.1682, test_f1: 0.2260
 epoch: 75, train_loss: 1.1856, test_loss: 1.1690, test_f1: 0.2260
 epoch: 76, train_loss: 1.1894, test_loss: 1.1684, test_f1: 0.2260
 epoch: 77, train_loss: 1.1871, test_loss: 1.1672, test_f1: 0.2260
 epoch: 78, train_loss: 1.1849, test_loss: 1.1670, test_f1: 0.2260
 epoch: 79, train_loss: 1.1849, test_loss: 1.1668, test_f1: 0.2260
 epoch: 80, train_loss: 1.1823, test_loss: 1.1663, test_f1: 0.2260
 epoch: 81, train_loss: 1.1869, test_loss: 1.1661, test_f1: 0.2260
 epoch: 82, train_loss: 1.1793, test_loss: 1.1656, test_f1: 0.2260
 epoch: 83, train_loss: 1.1813, test_loss: 1.1646, test_f1: 0.2260
 epoch: 84, train_loss: 1.1782, test_loss: 1.1641, test_f1: 0.2260
 epoch: 85, train_loss: 1.1841, test_loss: 1.1634, test_f1: 0.2260
 epoch: 86, train_loss: 1.1781, test_loss: 1.1634, test_f1: 0.2260
 epoch: 87, train_loss: 1.1768, test_loss: 1.1630, test_f1: 0.2286
 epoch: 88, train_loss: 1.1795, test_loss: 1.1617, test_f1: 0.2383
 epoch: 89, train_loss: 1.1758, test_loss: 1.1611, test_f1: 0.2641
 epoch: 90, train_loss: 1.1794, test_loss: 1.1612, test_f1: 0.3033
 epoch: 91, train_loss: 1.1750, test_loss: 1.1613, test_f1: 0.3173
 epoch: 92, train_loss: 1.1797, test_loss: 1.1609, test_f1: 0.3263
 epoch: 93, train_loss: 1.1776, test_loss: 1.1601, test_f1: 0.3311
 epoch: 94, train_loss: 1.1747, test_loss: 1.1595, test_f1: 0.3392
 epoch: 95, train_loss: 1.1766, test_loss: 1.1587, test_f1: 0.3437
 epoch: 96, train_loss: 1.1760, test_loss: 1.1584, test_f1: 0.3447
 epoch: 97, train_loss: 1.1745, test_loss: 1.1584, test_f1: 0.3447
 epoch: 98, train_loss: 1.1710, test_loss: 1.1578, test_f1: 0.3469
 epoch: 99, train_loss: 1.1725, test_loss: 1.1574, test_f1: 0.3469
##################ITERATION #5 ****************************************
 epoch: 0, train_loss: 1.3151, test_loss: 1.3330, test_f1: 0.2260
 epoch: 1, train_loss: 1.3106, test_loss: 1.3284, test_f1: 0.2260
 epoch: 2, train_loss: 1.3052, test_loss: 1.3236, test_f1: 0.2260
 epoch: 3, train_loss: 1.2999, test_loss: 1.3161, test_f1: 0.2260
 epoch: 4, train_loss: 1.2960, test_loss: 1.3074, test_f1: 0.2260
 epoch: 5, train_loss: 1.2917, test_loss: 1.2999, test_f1: 0.2260
 epoch: 6, train_loss: 1.2890, test_loss: 1.2938, test_f1: 0.2260
 epoch: 7, train_loss: 1.2845, test_loss: 1.2883, test_f1: 0.2260
 epoch: 8, train_loss: 1.2817, test_loss: 1.2836, test_f1: 0.2260
 epoch: 9, train_loss: 1.2783, test_loss: 1.2789, test_f1: 0.2260
 epoch: 10, train_loss: 1.2736, test_loss: 1.2740, test_f1: 0.2260
 epoch: 11, train_loss: 1.2714, test_loss: 1.2691, test_f1: 0.2260
 epoch: 12, train_loss: 1.2682, test_loss: 1.2640, test_f1: 0.2260
 epoch: 13, train_loss: 1.2612, test_loss: 1.2590, test_f1: 0.2260
 epoch: 14, train_loss: 1.2595, test_loss: 1.2534, test_f1: 0.2260
 epoch: 15, train_loss: 1.2544, test_loss: 1.2480, test_f1: 0.2260
 epoch: 16, train_loss: 1.2538, test_loss: 1.2441, test_f1: 0.2260
 epoch: 17, train_loss: 1.2471, test_loss: 1.2397, test_f1: 0.2260
 epoch: 18, train_loss: 1.2492, test_loss: 1.2359, test_f1: 0.2260
 epoch: 19, train_loss: 1.2430, test_loss: 1.2319, test_f1: 0.2260
 epoch: 20, train_loss: 1.2391, test_loss: 1.2279, test_f1: 0.2260
 epoch: 21, train_loss: 1.2330, test_loss: 1.2243, test_f1: 0.2260
 epoch: 22, train_loss: 1.2362, test_loss: 1.2206, test_f1: 0.2260
 epoch: 23, train_loss: 1.2366, test_loss: 1.2174, test_f1: 0.2260
 epoch: 24, train_loss: 1.2324, test_loss: 1.2147, test_f1: 0.2260
 epoch: 25, train_loss: 1.2267, test_loss: 1.2118, test_f1: 0.2260
 epoch: 26, train_loss: 1.2300, test_loss: 1.2089, test_f1: 0.2260
 epoch: 27, train_loss: 1.2212, test_loss: 1.2072, test_f1: 0.2260
 epoch: 28, train_loss: 1.2195, test_loss: 1.2039, test_f1: 0.2260
 epoch: 29, train_loss: 1.2225, test_loss: 1.2014, test_f1: 0.2260
 epoch: 30, train_loss: 1.2162, test_loss: 1.1991, test_f1: 0.2260
 epoch: 31, train_loss: 1.2123, test_loss: 1.1962, test_f1: 0.2260
 epoch: 32, train_loss: 1.2159, test_loss: 1.1943, test_f1: 0.2260
 epoch: 33, train_loss: 1.2134, test_loss: 1.1921, test_f1: 0.2260
 epoch: 34, train_loss: 1.2102, test_loss: 1.1895, test_f1: 0.2260
 epoch: 35, train_loss: 1.2074, test_loss: 1.1877, test_f1: 0.2260
 epoch: 36, train_loss: 1.2065, test_loss: 1.1859, test_f1: 0.2260
 epoch: 37, train_loss: 1.2004, test_loss: 1.1834, test_f1: 0.2260
 epoch: 38, train_loss: 1.1962, test_loss: 1.1806, test_f1: 0.2260
 epoch: 39, train_loss: 1.2008, test_loss: 1.1780, test_f1: 0.2260
 epoch: 40, train_loss: 1.1974, test_loss: 1.1767, test_f1: 0.2260
 epoch: 41, train_loss: 1.1977, test_loss: 1.1747, test_f1: 0.2311
 epoch: 42, train_loss: 1.1969, test_loss: 1.1725, test_f1: 0.2474
 epoch: 43, train_loss: 1.1885, test_loss: 1.1707, test_f1: 0.2808
 epoch: 44, train_loss: 1.1851, test_loss: 1.1686, test_f1: 0.2957
 epoch: 45, train_loss: 1.1887, test_loss: 1.1669, test_f1: 0.3146
 epoch: 46, train_loss: 1.1828, test_loss: 1.1649, test_f1: 0.3335
 epoch: 47, train_loss: 1.1849, test_loss: 1.1635, test_f1: 0.3381
 epoch: 48, train_loss: 1.1832, test_loss: 1.1618, test_f1: 0.3381
 epoch: 49, train_loss: 1.1792, test_loss: 1.1601, test_f1: 0.3404
 epoch: 50, train_loss: 1.1762, test_loss: 1.1583, test_f1: 0.3447
 epoch: 51, train_loss: 1.1784, test_loss: 1.1572, test_f1: 0.3405
 epoch: 52, train_loss: 1.1831, test_loss: 1.1566, test_f1: 0.3395
 epoch: 53, train_loss: 1.1752, test_loss: 1.1561, test_f1: 0.3363
 epoch: 54, train_loss: 1.1749, test_loss: 1.1553, test_f1: 0.3328
 epoch: 55, train_loss: 1.1718, test_loss: 1.1546, test_f1: 0.3370
 epoch: 56, train_loss: 1.1774, test_loss: 1.1544, test_f1: 0.3354
 epoch: 57, train_loss: 1.1694, test_loss: 1.1530, test_f1: 0.3364
 epoch: 58, train_loss: 1.1695, test_loss: 1.1498, test_f1: 0.3356
 epoch: 59, train_loss: 1.1664, test_loss: 1.1495, test_f1: 0.3374
 epoch: 60, train_loss: 1.1695, test_loss: 1.1482, test_f1: 0.3361
 epoch: 61, train_loss: 1.1703, test_loss: 1.1471, test_f1: 0.3361
 epoch: 62, train_loss: 1.1675, test_loss: 1.1457, test_f1: 0.3381
 epoch: 63, train_loss: 1.1667, test_loss: 1.1454, test_f1: 0.3371
 epoch: 64, train_loss: 1.1654, test_loss: 1.1436, test_f1: 0.3381
 epoch: 65, train_loss: 1.1706, test_loss: 1.1434, test_f1: 0.3381
 epoch: 66, train_loss: 1.1630, test_loss: 1.1425, test_f1: 0.3381
 epoch: 67, train_loss: 1.1647, test_loss: 1.1420, test_f1: 0.3381
 epoch: 68, train_loss: 1.1615, test_loss: 1.1407, test_f1: 0.3381
 epoch: 69, train_loss: 1.1660, test_loss: 1.1405, test_f1: 0.3381
 epoch: 70, train_loss: 1.1622, test_loss: 1.1403, test_f1: 0.3381
 epoch: 71, train_loss: 1.1594, test_loss: 1.1394, test_f1: 0.3381
 epoch: 72, train_loss: 1.1586, test_loss: 1.1383, test_f1: 0.3381
 epoch: 73, train_loss: 1.1575, test_loss: 1.1379, test_f1: 0.3381
 epoch: 74, train_loss: 1.1622, test_loss: 1.1382, test_f1: 0.3391
 epoch: 75, train_loss: 1.1530, test_loss: 1.1374, test_f1: 0.3391
 epoch: 76, train_loss: 1.1558, test_loss: 1.1365, test_f1: 0.3391
 epoch: 77, train_loss: 1.1517, test_loss: 1.1354, test_f1: 0.3391
 epoch: 78, train_loss: 1.1554, test_loss: 1.1344, test_f1: 0.3381
 epoch: 79, train_loss: 1.1554, test_loss: 1.1345, test_f1: 0.3391
 epoch: 80, train_loss: 1.1549, test_loss: 1.1345, test_f1: 0.3391
 epoch: 81, train_loss: 1.1514, test_loss: 1.1330, test_f1: 0.3391
 epoch: 82, train_loss: 1.1519, test_loss: 1.1325, test_f1: 0.3391
 epoch: 83, train_loss: 1.1482, test_loss: 1.1319, test_f1: 0.3400
 epoch: 84, train_loss: 1.1555, test_loss: 1.1316, test_f1: 0.3410
 epoch: 85, train_loss: 1.1467, test_loss: 1.1303, test_f1: 0.3400
 epoch: 86, train_loss: 1.1501, test_loss: 1.1301, test_f1: 0.3400
 epoch: 87, train_loss: 1.1461, test_loss: 1.1293, test_f1: 0.3400
 epoch: 88, train_loss: 1.1414, test_loss: 1.1292, test_f1: 0.3400
 epoch: 89, train_loss: 1.1478, test_loss: 1.1289, test_f1: 0.3410
 epoch: 90, train_loss: 1.1421, test_loss: 1.1279, test_f1: 0.3410
 epoch: 91, train_loss: 1.1438, test_loss: 1.1270, test_f1: 0.3410
 epoch: 92, train_loss: 1.1451, test_loss: 1.1258, test_f1: 0.3429
 epoch: 93, train_loss: 1.1430, test_loss: 1.1258, test_f1: 0.3429
 epoch: 94, train_loss: 1.1451, test_loss: 1.1250, test_f1: 0.3419
 epoch: 95, train_loss: 1.1377, test_loss: 1.1240, test_f1: 0.3429
 epoch: 96, train_loss: 1.1400, test_loss: 1.1238, test_f1: 0.3429
 epoch: 97, train_loss: 1.1366, test_loss: 1.1226, test_f1: 0.3429
 epoch: 98, train_loss: 1.1400, test_loss: 1.1219, test_f1: 0.3429
 epoch: 99, train_loss: 1.1376, test_loss: 1.1218, test_f1: 0.3429
##################ITERATION #6 ****************************************
 epoch: 0, train_loss: 1.3234, test_loss: 1.3284, test_f1: 0.2260
 epoch: 1, train_loss: 1.3174, test_loss: 1.3262, test_f1: 0.2260
 epoch: 2, train_loss: 1.3122, test_loss: 1.3274, test_f1: 0.2260
 epoch: 3, train_loss: 1.3101, test_loss: 1.3204, test_f1: 0.2260
 epoch: 4, train_loss: 1.3046, test_loss: 1.3121, test_f1: 0.2260
 epoch: 5, train_loss: 1.3015, test_loss: 1.3075, test_f1: 0.2260
 epoch: 6, train_loss: 1.2977, test_loss: 1.3044, test_f1: 0.2260
 epoch: 7, train_loss: 1.2944, test_loss: 1.3011, test_f1: 0.2260
 epoch: 8, train_loss: 1.2897, test_loss: 1.2979, test_f1: 0.2260
 epoch: 9, train_loss: 1.2880, test_loss: 1.2948, test_f1: 0.2260
 epoch: 10, train_loss: 1.2855, test_loss: 1.2919, test_f1: 0.2260
 epoch: 11, train_loss: 1.2835, test_loss: 1.2890, test_f1: 0.2260
 epoch: 12, train_loss: 1.2783, test_loss: 1.2860, test_f1: 0.2260
 epoch: 13, train_loss: 1.2756, test_loss: 1.2826, test_f1: 0.2260
 epoch: 14, train_loss: 1.2705, test_loss: 1.2797, test_f1: 0.2260
 epoch: 15, train_loss: 1.2682, test_loss: 1.2762, test_f1: 0.2260
 epoch: 16, train_loss: 1.2662, test_loss: 1.2716, test_f1: 0.2260
 epoch: 17, train_loss: 1.2615, test_loss: 1.2676, test_f1: 0.2260
 epoch: 18, train_loss: 1.2599, test_loss: 1.2644, test_f1: 0.2260
 epoch: 19, train_loss: 1.2558, test_loss: 1.2599, test_f1: 0.2260
 epoch: 20, train_loss: 1.2537, test_loss: 1.2564, test_f1: 0.2260
 epoch: 21, train_loss: 1.2499, test_loss: 1.2526, test_f1: 0.2260
 epoch: 22, train_loss: 1.2456, test_loss: 1.2486, test_f1: 0.2260
 epoch: 23, train_loss: 1.2449, test_loss: 1.2447, test_f1: 0.2260
 epoch: 24, train_loss: 1.2401, test_loss: 1.2409, test_f1: 0.2260
 epoch: 25, train_loss: 1.2403, test_loss: 1.2372, test_f1: 0.2260
 epoch: 26, train_loss: 1.2359, test_loss: 1.2345, test_f1: 0.2260
 epoch: 27, train_loss: 1.2375, test_loss: 1.2314, test_f1: 0.2260
 epoch: 28, train_loss: 1.2312, test_loss: 1.2262, test_f1: 0.2260
 epoch: 29, train_loss: 1.2282, test_loss: 1.2229, test_f1: 0.2260
 epoch: 30, train_loss: 1.2273, test_loss: 1.2191, test_f1: 0.2260
 epoch: 31, train_loss: 1.2253, test_loss: 1.2160, test_f1: 0.2260
 epoch: 32, train_loss: 1.2223, test_loss: 1.2137, test_f1: 0.2260
 epoch: 33, train_loss: 1.2241, test_loss: 1.2103, test_f1: 0.2260
 epoch: 34, train_loss: 1.2170, test_loss: 1.2082, test_f1: 0.2260
 epoch: 35, train_loss: 1.2161, test_loss: 1.2056, test_f1: 0.2260
 epoch: 36, train_loss: 1.2134, test_loss: 1.2028, test_f1: 0.2260
 epoch: 37, train_loss: 1.2132, test_loss: 1.2008, test_f1: 0.2260
 epoch: 38, train_loss: 1.2124, test_loss: 1.1984, test_f1: 0.2260
 epoch: 39, train_loss: 1.2092, test_loss: 1.1953, test_f1: 0.2260
 epoch: 40, train_loss: 1.2081, test_loss: 1.1936, test_f1: 0.2260
 epoch: 41, train_loss: 1.2075, test_loss: 1.1913, test_f1: 0.2286
 epoch: 42, train_loss: 1.2043, test_loss: 1.1910, test_f1: 0.2286
 epoch: 43, train_loss: 1.1987, test_loss: 1.1871, test_f1: 0.2311
 epoch: 44, train_loss: 1.1964, test_loss: 1.1845, test_f1: 0.2335
 epoch: 45, train_loss: 1.1974, test_loss: 1.1832, test_f1: 0.2359
 epoch: 46, train_loss: 1.1956, test_loss: 1.1808, test_f1: 0.2496
 epoch: 47, train_loss: 1.1950, test_loss: 1.1785, test_f1: 0.2699
 epoch: 48, train_loss: 1.1954, test_loss: 1.1759, test_f1: 0.2661
 epoch: 49, train_loss: 1.1894, test_loss: 1.1750, test_f1: 0.2736
 epoch: 50, train_loss: 1.1868, test_loss: 1.1720, test_f1: 0.2825
 epoch: 51, train_loss: 1.1847, test_loss: 1.1713, test_f1: 0.2859
 epoch: 52, train_loss: 1.1815, test_loss: 1.1698, test_f1: 0.2925
 epoch: 53, train_loss: 1.1818, test_loss: 1.1697, test_f1: 0.2925
 epoch: 54, train_loss: 1.1805, test_loss: 1.1691, test_f1: 0.3048
 epoch: 55, train_loss: 1.1803, test_loss: 1.1673, test_f1: 0.3048
 epoch: 56, train_loss: 1.1786, test_loss: 1.1664, test_f1: 0.3076
 epoch: 57, train_loss: 1.1815, test_loss: 1.1642, test_f1: 0.3146
 epoch: 58, train_loss: 1.1845, test_loss: 1.1640, test_f1: 0.3225
 epoch: 59, train_loss: 1.1780, test_loss: 1.1634, test_f1: 0.3263
 epoch: 60, train_loss: 1.1768, test_loss: 1.1616, test_f1: 0.3263
 epoch: 61, train_loss: 1.1753, test_loss: 1.1614, test_f1: 0.3263
 epoch: 62, train_loss: 1.1718, test_loss: 1.1591, test_f1: 0.3275
 epoch: 63, train_loss: 1.1737, test_loss: 1.1581, test_f1: 0.3275
 epoch: 64, train_loss: 1.1740, test_loss: 1.1572, test_f1: 0.3299
 epoch: 65, train_loss: 1.1717, test_loss: 1.1571, test_f1: 0.3311
 epoch: 66, train_loss: 1.1733, test_loss: 1.1559, test_f1: 0.3323
 epoch: 67, train_loss: 1.1693, test_loss: 1.1555, test_f1: 0.3347
 epoch: 68, train_loss: 1.1686, test_loss: 1.1543, test_f1: 0.3358
 epoch: 69, train_loss: 1.1655, test_loss: 1.1533, test_f1: 0.3370
 epoch: 70, train_loss: 1.1704, test_loss: 1.1515, test_f1: 0.3358
 epoch: 71, train_loss: 1.1663, test_loss: 1.1512, test_f1: 0.3370
 epoch: 72, train_loss: 1.1667, test_loss: 1.1499, test_f1: 0.3358
 epoch: 73, train_loss: 1.1645, test_loss: 1.1483, test_f1: 0.3392
 epoch: 74, train_loss: 1.1619, test_loss: 1.1473, test_f1: 0.3392
 epoch: 75, train_loss: 1.1660, test_loss: 1.1463, test_f1: 0.3404
 epoch: 76, train_loss: 1.1651, test_loss: 1.1469, test_f1: 0.3404
 epoch: 77, train_loss: 1.1636, test_loss: 1.1455, test_f1: 0.3415
 epoch: 78, train_loss: 1.1593, test_loss: 1.1458, test_f1: 0.3415
 epoch: 79, train_loss: 1.1587, test_loss: 1.1437, test_f1: 0.3404
 epoch: 80, train_loss: 1.1559, test_loss: 1.1442, test_f1: 0.3426
 epoch: 81, train_loss: 1.1571, test_loss: 1.1431, test_f1: 0.3426
 epoch: 82, train_loss: 1.1565, test_loss: 1.1420, test_f1: 0.3426
 epoch: 83, train_loss: 1.1552, test_loss: 1.1413, test_f1: 0.3437
 epoch: 84, train_loss: 1.1602, test_loss: 1.1392, test_f1: 0.3437
 epoch: 85, train_loss: 1.1535, test_loss: 1.1392, test_f1: 0.3458
 epoch: 86, train_loss: 1.1555, test_loss: 1.1395, test_f1: 0.3458
 epoch: 87, train_loss: 1.1468, test_loss: 1.1402, test_f1: 0.3490
 epoch: 88, train_loss: 1.1508, test_loss: 1.1391, test_f1: 0.3490
 epoch: 89, train_loss: 1.1541, test_loss: 1.1380, test_f1: 0.3476
 epoch: 90, train_loss: 1.1499, test_loss: 1.1370, test_f1: 0.3486
 epoch: 91, train_loss: 1.1511, test_loss: 1.1349, test_f1: 0.3486
 epoch: 92, train_loss: 1.1459, test_loss: 1.1348, test_f1: 0.3486
 epoch: 93, train_loss: 1.1454, test_loss: 1.1361, test_f1: 0.3490
 epoch: 94, train_loss: 1.1446, test_loss: 1.1351, test_f1: 0.3500
 epoch: 95, train_loss: 1.1495, test_loss: 1.1325, test_f1: 0.3507
 epoch: 96, train_loss: 1.1432, test_loss: 1.1319, test_f1: 0.3507
 epoch: 97, train_loss: 1.1467, test_loss: 1.1319, test_f1: 0.3532
 epoch: 98, train_loss: 1.1422, test_loss: 1.1313, test_f1: 0.3532
 epoch: 99, train_loss: 1.1415, test_loss: 1.1292, test_f1: 0.3532
##################ITERATION #7 ****************************************
 epoch: 0, train_loss: 1.3818, test_loss: 1.4145, test_f1: 0.0303
 epoch: 1, train_loss: 1.3718, test_loss: 1.4141, test_f1: 0.0303
 epoch: 2, train_loss: 1.3640, test_loss: 1.4113, test_f1: 0.0298
 epoch: 3, train_loss: 1.3577, test_loss: 1.4032, test_f1: 0.1359
 epoch: 4, train_loss: 1.3492, test_loss: 1.3895, test_f1: 0.1917
 epoch: 5, train_loss: 1.3430, test_loss: 1.3750, test_f1: 0.2018
 epoch: 6, train_loss: 1.3336, test_loss: 1.3628, test_f1: 0.2209
 epoch: 7, train_loss: 1.3285, test_loss: 1.3522, test_f1: 0.2276
 epoch: 8, train_loss: 1.3198, test_loss: 1.3411, test_f1: 0.2285
 epoch: 9, train_loss: 1.3079, test_loss: 1.3316, test_f1: 0.2289
 epoch: 10, train_loss: 1.3015, test_loss: 1.3183, test_f1: 0.2287
 epoch: 11, train_loss: 1.2928, test_loss: 1.3086, test_f1: 0.2287
 epoch: 12, train_loss: 1.2839, test_loss: 1.2979, test_f1: 0.2260
 epoch: 13, train_loss: 1.2826, test_loss: 1.2884, test_f1: 0.2260
 epoch: 14, train_loss: 1.2714, test_loss: 1.2793, test_f1: 0.2286
 epoch: 15, train_loss: 1.2651, test_loss: 1.2706, test_f1: 0.2260
 epoch: 16, train_loss: 1.2662, test_loss: 1.2625, test_f1: 0.2286
 epoch: 17, train_loss: 1.2590, test_loss: 1.2571, test_f1: 0.2286
 epoch: 18, train_loss: 1.2535, test_loss: 1.2519, test_f1: 0.2359
 epoch: 19, train_loss: 1.2429, test_loss: 1.2422, test_f1: 0.2359
 epoch: 20, train_loss: 1.2438, test_loss: 1.2376, test_f1: 0.2474
 epoch: 21, train_loss: 1.2397, test_loss: 1.2322, test_f1: 0.2601
 epoch: 22, train_loss: 1.2305, test_loss: 1.2209, test_f1: 0.2474
 epoch: 23, train_loss: 1.2279, test_loss: 1.2247, test_f1: 0.2972
 epoch: 24, train_loss: 1.2200, test_loss: 1.2127, test_f1: 0.2825
 epoch: 25, train_loss: 1.2157, test_loss: 1.2061, test_f1: 0.2842
 epoch: 26, train_loss: 1.2142, test_loss: 1.2023, test_f1: 0.3033
 epoch: 27, train_loss: 1.2100, test_loss: 1.1953, test_f1: 0.3076
 epoch: 28, train_loss: 1.2057, test_loss: 1.1933, test_f1: 0.3076
 epoch: 29, train_loss: 1.2046, test_loss: 1.1834, test_f1: 0.3033
 epoch: 30, train_loss: 1.1996, test_loss: 1.1855, test_f1: 0.3173
 epoch: 31, train_loss: 1.1938, test_loss: 1.1750, test_f1: 0.3160
 epoch: 32, train_loss: 1.1897, test_loss: 1.1762, test_f1: 0.3263
 epoch: 33, train_loss: 1.1866, test_loss: 1.1638, test_f1: 0.3186
 epoch: 34, train_loss: 1.1878, test_loss: 1.1612, test_f1: 0.3225
 epoch: 35, train_loss: 1.1843, test_loss: 1.1634, test_f1: 0.3323
 epoch: 36, train_loss: 1.1793, test_loss: 1.1617, test_f1: 0.3370
 epoch: 37, train_loss: 1.1778, test_loss: 1.1522, test_f1: 0.3335
 epoch: 38, train_loss: 1.1701, test_loss: 1.1468, test_f1: 0.3358
 epoch: 39, train_loss: 1.1703, test_loss: 1.1422, test_f1: 0.3358
 epoch: 40, train_loss: 1.1713, test_loss: 1.1411, test_f1: 0.3404
 epoch: 41, train_loss: 1.1633, test_loss: 1.1376, test_f1: 0.3426
 epoch: 42, train_loss: 1.1631, test_loss: 1.1337, test_f1: 0.3358
 epoch: 43, train_loss: 1.1642, test_loss: 1.1366, test_f1: 0.3520
 epoch: 44, train_loss: 1.1616, test_loss: 1.1279, test_f1: 0.3381
 epoch: 45, train_loss: 1.1605, test_loss: 1.1254, test_f1: 0.3488
 epoch: 46, train_loss: 1.1524, test_loss: 1.1222, test_f1: 0.3488
 epoch: 47, train_loss: 1.1495, test_loss: 1.1236, test_f1: 0.3524
 epoch: 48, train_loss: 1.1524, test_loss: 1.1191, test_f1: 0.3549
 epoch: 49, train_loss: 1.1409, test_loss: 1.1163, test_f1: 0.3584
 epoch: 50, train_loss: 1.1481, test_loss: 1.1133, test_f1: 0.3584
 epoch: 51, train_loss: 1.1405, test_loss: 1.1110, test_f1: 0.3584
 epoch: 52, train_loss: 1.1449, test_loss: 1.1106, test_f1: 0.3584
 epoch: 53, train_loss: 1.1440, test_loss: 1.1092, test_f1: 0.3584
 epoch: 54, train_loss: 1.1398, test_loss: 1.1086, test_f1: 0.3584
 epoch: 55, train_loss: 1.1338, test_loss: 1.1094, test_f1: 0.3607
 epoch: 56, train_loss: 1.1350, test_loss: 1.1078, test_f1: 0.3607
 epoch: 57, train_loss: 1.1428, test_loss: 1.1071, test_f1: 0.3652
 epoch: 58, train_loss: 1.1342, test_loss: 1.1051, test_f1: 0.3607
 epoch: 59, train_loss: 1.1386, test_loss: 1.1041, test_f1: 0.3642
 epoch: 60, train_loss: 1.1352, test_loss: 1.1036, test_f1: 0.3628
 epoch: 61, train_loss: 1.1329, test_loss: 1.1039, test_f1: 0.3638
 epoch: 62, train_loss: 1.1349, test_loss: 1.1013, test_f1: 0.3663
 epoch: 63, train_loss: 1.1291, test_loss: 1.1010, test_f1: 0.3718
 epoch: 64, train_loss: 1.1358, test_loss: 1.1002, test_f1: 0.3711
 epoch: 65, train_loss: 1.1328, test_loss: 1.0997, test_f1: 0.3713
 epoch: 66, train_loss: 1.1302, test_loss: 1.0995, test_f1: 0.3691
 epoch: 67, train_loss: 1.1294, test_loss: 1.0995, test_f1: 0.3713
 epoch: 68, train_loss: 1.1308, test_loss: 1.0978, test_f1: 0.3737
 epoch: 69, train_loss: 1.1266, test_loss: 1.0960, test_f1: 0.3667
 epoch: 70, train_loss: 1.1240, test_loss: 1.0956, test_f1: 0.3751
 epoch: 71, train_loss: 1.1287, test_loss: 1.0933, test_f1: 0.3743
 epoch: 72, train_loss: 1.1240, test_loss: 1.0941, test_f1: 0.3723
 epoch: 73, train_loss: 1.1217, test_loss: 1.0927, test_f1: 0.3763
 epoch: 74, train_loss: 1.1225, test_loss: 1.0905, test_f1: 0.3753
 epoch: 75, train_loss: 1.1226, test_loss: 1.0902, test_f1: 0.3713
 epoch: 76, train_loss: 1.1199, test_loss: 1.0894, test_f1: 0.3743
 epoch: 77, train_loss: 1.1187, test_loss: 1.0891, test_f1: 0.3753
 epoch: 78, train_loss: 1.1178, test_loss: 1.0885, test_f1: 0.3763
 epoch: 79, train_loss: 1.1148, test_loss: 1.0873, test_f1: 0.3782
 epoch: 80, train_loss: 1.1210, test_loss: 1.0854, test_f1: 0.3772
 epoch: 81, train_loss: 1.1167, test_loss: 1.0854, test_f1: 0.3772
 epoch: 82, train_loss: 1.1157, test_loss: 1.0853, test_f1: 0.3792
 epoch: 83, train_loss: 1.1188, test_loss: 1.0843, test_f1: 0.3815
 epoch: 84, train_loss: 1.1128, test_loss: 1.0843, test_f1: 0.3782
 epoch: 85, train_loss: 1.1108, test_loss: 1.0830, test_f1: 0.3772
 epoch: 86, train_loss: 1.1152, test_loss: 1.0810, test_f1: 0.3763
 epoch: 87, train_loss: 1.1113, test_loss: 1.0811, test_f1: 0.3810
 epoch: 88, train_loss: 1.1139, test_loss: 1.0805, test_f1: 0.3839
 epoch: 89, train_loss: 1.1095, test_loss: 1.0789, test_f1: 0.3815
 epoch: 90, train_loss: 1.1145, test_loss: 1.0778, test_f1: 0.3829
 epoch: 91, train_loss: 1.1096, test_loss: 1.0783, test_f1: 0.3806
 epoch: 92, train_loss: 1.1074, test_loss: 1.0783, test_f1: 0.3811
 epoch: 93, train_loss: 1.1051, test_loss: 1.0772, test_f1: 0.3835
 epoch: 94, train_loss: 1.1088, test_loss: 1.0764, test_f1: 0.3875
 epoch: 95, train_loss: 1.1076, test_loss: 1.0762, test_f1: 0.3917
 epoch: 96, train_loss: 1.1062, test_loss: 1.0761, test_f1: 0.3856
 epoch: 97, train_loss: 1.1088, test_loss: 1.0754, test_f1: 0.3875
 epoch: 98, train_loss: 1.1034, test_loss: 1.0736, test_f1: 0.3917
 epoch: 99, train_loss: 1.1043, test_loss: 1.0720, test_f1: 0.3889
##################ITERATION #8 ****************************************
 epoch: 0, train_loss: 1.3139, test_loss: 1.3263, test_f1: 0.2260
 epoch: 1, train_loss: 1.3040, test_loss: 1.3222, test_f1: 0.2260
 epoch: 2, train_loss: 1.2988, test_loss: 1.3169, test_f1: 0.2260
 epoch: 3, train_loss: 1.2922, test_loss: 1.3063, test_f1: 0.2260
 epoch: 4, train_loss: 1.2893, test_loss: 1.2986, test_f1: 0.2260
 epoch: 5, train_loss: 1.2844, test_loss: 1.2915, test_f1: 0.2260
 epoch: 6, train_loss: 1.2803, test_loss: 1.2863, test_f1: 0.2260
 epoch: 7, train_loss: 1.2761, test_loss: 1.2808, test_f1: 0.2260
 epoch: 8, train_loss: 1.2707, test_loss: 1.2746, test_f1: 0.2260
 epoch: 9, train_loss: 1.2664, test_loss: 1.2706, test_f1: 0.2260
 epoch: 10, train_loss: 1.2636, test_loss: 1.2653, test_f1: 0.2260
 epoch: 11, train_loss: 1.2604, test_loss: 1.2608, test_f1: 0.2260
 epoch: 12, train_loss: 1.2540, test_loss: 1.2565, test_f1: 0.2260
 epoch: 13, train_loss: 1.2485, test_loss: 1.2514, test_f1: 0.2260
 epoch: 14, train_loss: 1.2496, test_loss: 1.2462, test_f1: 0.2260
 epoch: 15, train_loss: 1.2472, test_loss: 1.2423, test_f1: 0.2260
 epoch: 16, train_loss: 1.2460, test_loss: 1.2396, test_f1: 0.2260
 epoch: 17, train_loss: 1.2369, test_loss: 1.2331, test_f1: 0.2260
 epoch: 18, train_loss: 1.2351, test_loss: 1.2302, test_f1: 0.2260
 epoch: 19, train_loss: 1.2313, test_loss: 1.2296, test_f1: 0.2260
 epoch: 20, train_loss: 1.2318, test_loss: 1.2203, test_f1: 0.2260
 epoch: 21, train_loss: 1.2258, test_loss: 1.2165, test_f1: 0.2260
 epoch: 22, train_loss: 1.2204, test_loss: 1.2135, test_f1: 0.2311
 epoch: 23, train_loss: 1.2174, test_loss: 1.2084, test_f1: 0.2335
 epoch: 24, train_loss: 1.2129, test_loss: 1.2022, test_f1: 0.2383
 epoch: 25, train_loss: 1.2139, test_loss: 1.1998, test_f1: 0.2452
 epoch: 26, train_loss: 1.2097, test_loss: 1.1977, test_f1: 0.2661
 epoch: 27, train_loss: 1.2031, test_loss: 1.1915, test_f1: 0.2790
 epoch: 28, train_loss: 1.2034, test_loss: 1.1874, test_f1: 0.2909
 epoch: 29, train_loss: 1.2058, test_loss: 1.1851, test_f1: 0.3048
 epoch: 30, train_loss: 1.1926, test_loss: 1.1821, test_f1: 0.3199
 epoch: 31, train_loss: 1.1946, test_loss: 1.1792, test_f1: 0.3311
 epoch: 32, train_loss: 1.1934, test_loss: 1.1745, test_f1: 0.3347
 epoch: 33, train_loss: 1.1899, test_loss: 1.1720, test_f1: 0.3381
 epoch: 34, train_loss: 1.1842, test_loss: 1.1692, test_f1: 0.3392
 epoch: 35, train_loss: 1.1823, test_loss: 1.1643, test_f1: 0.3392
 epoch: 36, train_loss: 1.1802, test_loss: 1.1615, test_f1: 0.3426
 epoch: 37, train_loss: 1.1768, test_loss: 1.1598, test_f1: 0.3455
 epoch: 38, train_loss: 1.1741, test_loss: 1.1568, test_f1: 0.3455
 epoch: 39, train_loss: 1.1754, test_loss: 1.1542, test_f1: 0.3502
 epoch: 40, train_loss: 1.1691, test_loss: 1.1490, test_f1: 0.3465
 epoch: 41, train_loss: 1.1687, test_loss: 1.1480, test_f1: 0.3440
 epoch: 42, train_loss: 1.1678, test_loss: 1.1481, test_f1: 0.3421
 epoch: 43, train_loss: 1.1652, test_loss: 1.1490, test_f1: 0.3400
 epoch: 44, train_loss: 1.1651, test_loss: 1.1453, test_f1: 0.3400
 epoch: 45, train_loss: 1.1596, test_loss: 1.1402, test_f1: 0.3400
 epoch: 46, train_loss: 1.1635, test_loss: 1.1421, test_f1: 0.3400
 epoch: 47, train_loss: 1.1580, test_loss: 1.1437, test_f1: 0.3381
 epoch: 48, train_loss: 1.1503, test_loss: 1.1405, test_f1: 0.3390
 epoch: 49, train_loss: 1.1500, test_loss: 1.1373, test_f1: 0.3381
 epoch: 50, train_loss: 1.1494, test_loss: 1.1345, test_f1: 0.3400
 epoch: 51, train_loss: 1.1450, test_loss: 1.1333, test_f1: 0.3390
 epoch: 52, train_loss: 1.1531, test_loss: 1.1292, test_f1: 0.3400
 epoch: 53, train_loss: 1.1450, test_loss: 1.1312, test_f1: 0.3390
 epoch: 54, train_loss: 1.1452, test_loss: 1.1305, test_f1: 0.3410
 epoch: 55, train_loss: 1.1428, test_loss: 1.1316, test_f1: 0.3400
 epoch: 56, train_loss: 1.1434, test_loss: 1.1282, test_f1: 0.3400
 epoch: 57, train_loss: 1.1470, test_loss: 1.1286, test_f1: 0.3400
 epoch: 58, train_loss: 1.1433, test_loss: 1.1259, test_f1: 0.3400
 epoch: 59, train_loss: 1.1419, test_loss: 1.1261, test_f1: 0.3397
 epoch: 60, train_loss: 1.1397, test_loss: 1.1237, test_f1: 0.3400
 epoch: 61, train_loss: 1.1397, test_loss: 1.1232, test_f1: 0.3400
 epoch: 62, train_loss: 1.1388, test_loss: 1.1237, test_f1: 0.3400
 epoch: 63, train_loss: 1.1357, test_loss: 1.1228, test_f1: 0.3400
 epoch: 64, train_loss: 1.1341, test_loss: 1.1197, test_f1: 0.3400
 epoch: 65, train_loss: 1.1374, test_loss: 1.1185, test_f1: 0.3400
 epoch: 66, train_loss: 1.1378, test_loss: 1.1188, test_f1: 0.3397
 epoch: 67, train_loss: 1.1327, test_loss: 1.1192, test_f1: 0.3376
 epoch: 68, train_loss: 1.1331, test_loss: 1.1173, test_f1: 0.3395
 epoch: 69, train_loss: 1.1315, test_loss: 1.1158, test_f1: 0.3376
 epoch: 70, train_loss: 1.1290, test_loss: 1.1169, test_f1: 0.3367
 epoch: 71, train_loss: 1.1325, test_loss: 1.1181, test_f1: 0.3390
 epoch: 72, train_loss: 1.1253, test_loss: 1.1148, test_f1: 0.3365
 epoch: 73, train_loss: 1.1258, test_loss: 1.1147, test_f1: 0.3392
 epoch: 74, train_loss: 1.1254, test_loss: 1.1147, test_f1: 0.3392
 epoch: 75, train_loss: 1.1303, test_loss: 1.1133, test_f1: 0.3411
 epoch: 76, train_loss: 1.1270, test_loss: 1.1109, test_f1: 0.3425
 epoch: 77, train_loss: 1.1261, test_loss: 1.1106, test_f1: 0.3485
 epoch: 78, train_loss: 1.1201, test_loss: 1.1114, test_f1: 0.3472
 epoch: 79, train_loss: 1.1224, test_loss: 1.1112, test_f1: 0.3432
 epoch: 80, train_loss: 1.1225, test_loss: 1.1118, test_f1: 0.3464
 epoch: 81, train_loss: 1.1182, test_loss: 1.1080, test_f1: 0.3508
 epoch: 82, train_loss: 1.1202, test_loss: 1.1040, test_f1: 0.3539
 epoch: 83, train_loss: 1.1238, test_loss: 1.1072, test_f1: 0.3478
 epoch: 84, train_loss: 1.1186, test_loss: 1.1066, test_f1: 0.3487
 epoch: 85, train_loss: 1.1191, test_loss: 1.1074, test_f1: 0.3485
 epoch: 86, train_loss: 1.1150, test_loss: 1.1038, test_f1: 0.3462
 epoch: 87, train_loss: 1.1153, test_loss: 1.1060, test_f1: 0.3483
 epoch: 88, train_loss: 1.1117, test_loss: 1.1037, test_f1: 0.3485
 epoch: 89, train_loss: 1.1129, test_loss: 1.1032, test_f1: 0.3487
 epoch: 90, train_loss: 1.1175, test_loss: 1.1042, test_f1: 0.3483
 epoch: 91, train_loss: 1.1093, test_loss: 1.1031, test_f1: 0.3508
 epoch: 92, train_loss: 1.1144, test_loss: 1.1015, test_f1: 0.3508
 epoch: 93, train_loss: 1.1182, test_loss: 1.0997, test_f1: 0.3510
 epoch: 94, train_loss: 1.1105, test_loss: 1.0959, test_f1: 0.3545
 epoch: 95, train_loss: 1.1100, test_loss: 1.0970, test_f1: 0.3543
 epoch: 96, train_loss: 1.1116, test_loss: 1.0960, test_f1: 0.3543
 epoch: 97, train_loss: 1.1107, test_loss: 1.0963, test_f1: 0.3510
 epoch: 98, train_loss: 1.1140, test_loss: 1.0967, test_f1: 0.3508
 epoch: 99, train_loss: 1.1044, test_loss: 1.0955, test_f1: 0.3510
##################ITERATION #9 ****************************************
 epoch: 0, train_loss: 1.3328, test_loss: 1.3505, test_f1: 0.2260
 epoch: 1, train_loss: 1.3188, test_loss: 1.3522, test_f1: 0.2260
 epoch: 2, train_loss: 1.3105, test_loss: 1.3577, test_f1: 0.2260
 epoch: 3, train_loss: 1.3011, test_loss: 1.3530, test_f1: 0.2260
 epoch: 4, train_loss: 1.2953, test_loss: 1.3355, test_f1: 0.2260
 epoch: 5, train_loss: 1.2887, test_loss: 1.3045, test_f1: 0.2260
 epoch: 6, train_loss: 1.2787, test_loss: 1.2902, test_f1: 0.2260
 epoch: 7, train_loss: 1.2742, test_loss: 1.2808, test_f1: 0.2260
 epoch: 8, train_loss: 1.2705, test_loss: 1.2740, test_f1: 0.2260
 epoch: 9, train_loss: 1.2638, test_loss: 1.2678, test_f1: 0.2260
 epoch: 10, train_loss: 1.2562, test_loss: 1.2599, test_f1: 0.2260
 epoch: 11, train_loss: 1.2531, test_loss: 1.2543, test_f1: 0.2260
 epoch: 12, train_loss: 1.2482, test_loss: 1.2489, test_f1: 0.2260
 epoch: 13, train_loss: 1.2424, test_loss: 1.2430, test_f1: 0.2260
 epoch: 14, train_loss: 1.2367, test_loss: 1.2369, test_f1: 0.2260
 epoch: 15, train_loss: 1.2350, test_loss: 1.2314, test_f1: 0.2260
 epoch: 16, train_loss: 1.2314, test_loss: 1.2265, test_f1: 0.2260
 epoch: 17, train_loss: 1.2292, test_loss: 1.2222, test_f1: 0.2260
 epoch: 18, train_loss: 1.2227, test_loss: 1.2169, test_f1: 0.2260
 epoch: 19, train_loss: 1.2240, test_loss: 1.2126, test_f1: 0.2260
 epoch: 20, train_loss: 1.2158, test_loss: 1.2075, test_f1: 0.2260
 epoch: 21, train_loss: 1.2145, test_loss: 1.2034, test_f1: 0.2260
 epoch: 22, train_loss: 1.2129, test_loss: 1.1997, test_f1: 0.2260
 epoch: 23, train_loss: 1.2122, test_loss: 1.1956, test_f1: 0.2286
 epoch: 24, train_loss: 1.2058, test_loss: 1.1927, test_f1: 0.2560
 epoch: 25, train_loss: 1.2034, test_loss: 1.1889, test_f1: 0.2859
 epoch: 26, train_loss: 1.1986, test_loss: 1.1839, test_f1: 0.3062
 epoch: 27, train_loss: 1.1956, test_loss: 1.1805, test_f1: 0.3263
 epoch: 28, train_loss: 1.1926, test_loss: 1.1786, test_f1: 0.3392
 epoch: 29, train_loss: 1.1915, test_loss: 1.1749, test_f1: 0.3484
 epoch: 30, train_loss: 1.1900, test_loss: 1.1717, test_f1: 0.3484
 epoch: 31, train_loss: 1.1872, test_loss: 1.1682, test_f1: 0.3494
 epoch: 32, train_loss: 1.1812, test_loss: 1.1628, test_f1: 0.3505
 epoch: 33, train_loss: 1.1780, test_loss: 1.1604, test_f1: 0.3505
 epoch: 34, train_loss: 1.1779, test_loss: 1.1574, test_f1: 0.3515
 epoch: 35, train_loss: 1.1738, test_loss: 1.1529, test_f1: 0.3536
 epoch: 36, train_loss: 1.1710, test_loss: 1.1480, test_f1: 0.3526
 epoch: 37, train_loss: 1.1697, test_loss: 1.1457, test_f1: 0.3526
 epoch: 38, train_loss: 1.1686, test_loss: 1.1442, test_f1: 0.3536
 epoch: 39, train_loss: 1.1661, test_loss: 1.1418, test_f1: 0.3556
 epoch: 40, train_loss: 1.1640, test_loss: 1.1383, test_f1: 0.3657
 epoch: 41, train_loss: 1.1607, test_loss: 1.1355, test_f1: 0.3667
 epoch: 42, train_loss: 1.1551, test_loss: 1.1330, test_f1: 0.3677
 epoch: 43, train_loss: 1.1545, test_loss: 1.1310, test_f1: 0.3663
 epoch: 44, train_loss: 1.1502, test_loss: 1.1295, test_f1: 0.3663
 epoch: 45, train_loss: 1.1513, test_loss: 1.1262, test_f1: 0.3690
 epoch: 46, train_loss: 1.1483, test_loss: 1.1234, test_f1: 0.3714
 epoch: 47, train_loss: 1.1457, test_loss: 1.1198, test_f1: 0.3695
 epoch: 48, train_loss: 1.1405, test_loss: 1.1187, test_f1: 0.3661
 epoch: 49, train_loss: 1.1436, test_loss: 1.1184, test_f1: 0.3686
 epoch: 50, train_loss: 1.1439, test_loss: 1.1159, test_f1: 0.3639
 epoch: 51, train_loss: 1.1371, test_loss: 1.1147, test_f1: 0.3663
 epoch: 52, train_loss: 1.1349, test_loss: 1.1139, test_f1: 0.3665
 epoch: 53, train_loss: 1.1301, test_loss: 1.1132, test_f1: 0.3663
 epoch: 54, train_loss: 1.1313, test_loss: 1.1094, test_f1: 0.3680
 epoch: 55, train_loss: 1.1330, test_loss: 1.1089, test_f1: 0.3658
 epoch: 56, train_loss: 1.1278, test_loss: 1.1066, test_f1: 0.3705
 epoch: 57, train_loss: 1.1278, test_loss: 1.1059, test_f1: 0.3868
 epoch: 58, train_loss: 1.1305, test_loss: 1.1056, test_f1: 0.3729
 epoch: 59, train_loss: 1.1323, test_loss: 1.1037, test_f1: 0.3924
 epoch: 60, train_loss: 1.1279, test_loss: 1.1044, test_f1: 0.3710
 epoch: 61, train_loss: 1.1262, test_loss: 1.1053, test_f1: 0.3668
 epoch: 62, train_loss: 1.1200, test_loss: 1.1052, test_f1: 0.3629
 epoch: 63, train_loss: 1.1260, test_loss: 1.1029, test_f1: 0.3668
 epoch: 64, train_loss: 1.1184, test_loss: 1.1018, test_f1: 0.3688
 epoch: 65, train_loss: 1.1187, test_loss: 1.1025, test_f1: 0.3678
 epoch: 66, train_loss: 1.1187, test_loss: 1.1007, test_f1: 0.3688
 epoch: 67, train_loss: 1.1214, test_loss: 1.0987, test_f1: 0.3871
 epoch: 68, train_loss: 1.1240, test_loss: 1.0986, test_f1: 0.3672
 epoch: 69, train_loss: 1.1151, test_loss: 1.0975, test_f1: 0.3656
 epoch: 70, train_loss: 1.1167, test_loss: 1.0958, test_f1: 0.3676
 epoch: 71, train_loss: 1.1153, test_loss: 1.0944, test_f1: 0.3695
 epoch: 72, train_loss: 1.1170, test_loss: 1.0927, test_f1: 0.3709
 epoch: 73, train_loss: 1.1116, test_loss: 1.0930, test_f1: 0.3642
 epoch: 74, train_loss: 1.1129, test_loss: 1.0940, test_f1: 0.3778
 epoch: 75, train_loss: 1.1111, test_loss: 1.0934, test_f1: 0.3653
 epoch: 76, train_loss: 1.1094, test_loss: 1.0920, test_f1: 0.3650
 epoch: 77, train_loss: 1.1169, test_loss: 1.0904, test_f1: 0.3694
 epoch: 78, train_loss: 1.1066, test_loss: 1.0914, test_f1: 0.3663
 epoch: 79, train_loss: 1.1047, test_loss: 1.0899, test_f1: 0.3643
 epoch: 80, train_loss: 1.1098, test_loss: 1.0887, test_f1: 0.3840
 epoch: 81, train_loss: 1.1082, test_loss: 1.0886, test_f1: 0.3922
 epoch: 82, train_loss: 1.1039, test_loss: 1.0888, test_f1: 0.3924
 epoch: 83, train_loss: 1.1034, test_loss: 1.0896, test_f1: 0.3913
 epoch: 84, train_loss: 1.1014, test_loss: 1.0870, test_f1: 0.3695
 epoch: 85, train_loss: 1.1045, test_loss: 1.0875, test_f1: 0.3909
 epoch: 86, train_loss: 1.1030, test_loss: 1.0847, test_f1: 0.3950
 epoch: 87, train_loss: 1.1036, test_loss: 1.0828, test_f1: 0.4084
 epoch: 88, train_loss: 1.0970, test_loss: 1.0842, test_f1: 0.4031
 epoch: 89, train_loss: 1.0952, test_loss: 1.0820, test_f1: 0.4113
 epoch: 90, train_loss: 1.0926, test_loss: 1.0830, test_f1: 0.4137
 epoch: 91, train_loss: 1.0943, test_loss: 1.0813, test_f1: 0.4026
 epoch: 92, train_loss: 1.0990, test_loss: 1.0826, test_f1: 0.4027
 epoch: 93, train_loss: 1.0958, test_loss: 1.0818, test_f1: 0.3868
 epoch: 94, train_loss: 1.0946, test_loss: 1.0800, test_f1: 0.4041
 epoch: 95, train_loss: 1.0926, test_loss: 1.0783, test_f1: 0.4118
 epoch: 96, train_loss: 1.0823, test_loss: 1.0786, test_f1: 0.4140
 epoch: 97, train_loss: 1.0950, test_loss: 1.0786, test_f1: 0.4157
 epoch: 98, train_loss: 1.0928, test_loss: 1.0767, test_f1: 0.4179
 epoch: 99, train_loss: 1.0926, test_loss: 1.0760, test_f1: 0.4173

Training completed in 450.72 seconds
Best F1: 0.4179 at epoch 98
Mean F1 across iterations: 0.3425  0.0388
========================FINAL RESULTS================================
FEGIN weighted F1: 0.4179  0.0388
python main.py --data ltspice_examples --representation component_pin --model FEGIN --layers 6 --hiddens 16 --batch_size 256 --lr 0.0001 --emb_size 512 --epochs 100 --save_appendix component_pin_L6_H16_BS256_LR0.0001_E512 --no_val
-----



STDERR:
  File "main.py", line 370, in <module>
    main()
  File "main.py", line 254, in main
    dataset = dataset_class(
  File "/home/philip/projects/ltspice_examples_code_repo/Circuit-Completion-Using-GNNs/component_classification_with_link_prediction_head/evaluation/FEGIN/kernel/circuit_datasets.py", line 15, in __init__
    self.data, self.slices = torch.load(self.processed_paths[0])
  File "/home/philip/.local/lib/python3.8/site-packages/torch/serialization.py", line 1040, in load
    warnings.warn(
  File "/usr/lib/python3.8/warnings.py", line 109, in _showwarnmsg
    sw(msg.message, msg.category, msg.filename, msg.lineno,
  File "main.py", line 47, in warn_with_traceback
    traceback.print_stack(file=log)
/home/philip/projects/ltspice_examples_code_repo/Circuit-Completion-Using-GNNs/component_classification_with_link_prediction_head/evaluation/FEGIN/kernel/circuit_datasets.py:15: FutureWarning: You are using `torch.load` with `weights_only=False` (the current default value), which uses the default pickle module implicitly. It is possible to construct malicious pickle data which will execute arbitrary code during unpickling (See https://github.com/pytorch/pytorch/blob/main/SECURITY.md#untrusted-models for more details). In a future release, the default value for `weights_only` will be flipped to `True`. This limits the functions that could be executed during unpickling. Arbitrary objects will no longer be allowed to be loaded via this mode unless they are explicitly allowlisted by the user via `torch.serialization.add_safe_globals`. We recommend you start setting `weights_only=True` for any use case where you don't have full control of the loaded file. Please open an issue on GitHub for any issues related to this experimental feature.
  self.data, self.slices = torch.load(self.processed_paths[0])
