STDOUT:
Results will be saved in /home/philip/projects/ltspice_examples_code_repo/Circuit-Completion-Using-GNNs/component_classification_with_link_prediction_head/evaluation/FEGIN/results/model_FEGIN_dataset_ltspice_examples
Command line input: python main.py --data ltspice_examples --representation component_pin --model FEGIN --layers 2 --hiddens 128 --batch_size 32 --lr 0.0001 --emb_size 128 --epochs 100 --save_appendix component_pin_L2_H128_BS32_LR0.0001_E128 --no_val
 is saved.
-----
ltspice_examples - FEGIN
Using 2 layers, 128 hidden units, h = 2
Loading component_pin representation dataset
ENTERED
Training FEGIN on component_pin representation
Train: 3560, Test: 848
##################ITERATION #0 ****************************************
 epoch: 0, train_loss: 1.3326, test_loss: 1.2091, test_f1: 0.3361
 epoch: 1, train_loss: 1.1552, test_loss: 1.0860, test_f1: 0.3454
 epoch: 2, train_loss: 1.0708, test_loss: 1.0596, test_f1: 0.3430
 epoch: 3, train_loss: 1.0385, test_loss: 1.0388, test_f1: 0.3716
 epoch: 4, train_loss: 1.0176, test_loss: 1.0138, test_f1: 0.4251
 epoch: 5, train_loss: 0.9933, test_loss: 1.0114, test_f1: 0.4342
 epoch: 6, train_loss: 0.9770, test_loss: 1.0118, test_f1: 0.4903
 epoch: 7, train_loss: 0.9636, test_loss: 1.0003, test_f1: 0.4962
 epoch: 8, train_loss: 0.9572, test_loss: 1.0104, test_f1: 0.4699
 epoch: 9, train_loss: 0.9351, test_loss: 0.9915, test_f1: 0.4825
 epoch: 10, train_loss: 0.9244, test_loss: 0.9994, test_f1: 0.4991
 epoch: 11, train_loss: 0.9027, test_loss: 0.9987, test_f1: 0.5114
 epoch: 12, train_loss: 0.8934, test_loss: 0.9542, test_f1: 0.5293
 epoch: 13, train_loss: 0.8797, test_loss: 0.9436, test_f1: 0.5194
 epoch: 14, train_loss: 0.8623, test_loss: 0.9285, test_f1: 0.5304
 epoch: 15, train_loss: 0.8490, test_loss: 0.9214, test_f1: 0.5231
 epoch: 16, train_loss: 0.8432, test_loss: 0.8986, test_f1: 0.5406
 epoch: 17, train_loss: 0.8275, test_loss: 0.8893, test_f1: 0.5437
 epoch: 18, train_loss: 0.8248, test_loss: 0.8807, test_f1: 0.5559
 epoch: 19, train_loss: 0.8032, test_loss: 0.9228, test_f1: 0.5219
 epoch: 20, train_loss: 0.7941, test_loss: 0.8943, test_f1: 0.5502
 epoch: 21, train_loss: 0.7880, test_loss: 0.9055, test_f1: 0.5238
 epoch: 22, train_loss: 0.7864, test_loss: 0.8762, test_f1: 0.5466
 epoch: 23, train_loss: 0.7664, test_loss: 0.8724, test_f1: 0.5530
 epoch: 24, train_loss: 0.7544, test_loss: 0.8893, test_f1: 0.5408
 epoch: 25, train_loss: 0.7583, test_loss: 0.8709, test_f1: 0.5547
 epoch: 26, train_loss: 0.7448, test_loss: 0.8687, test_f1: 0.5553
 epoch: 27, train_loss: 0.7323, test_loss: 0.8808, test_f1: 0.5570
 epoch: 28, train_loss: 0.7319, test_loss: 0.8549, test_f1: 0.5772
 epoch: 29, train_loss: 0.7219, test_loss: 0.8573, test_f1: 0.5916
 epoch: 30, train_loss: 0.7209, test_loss: 0.8516, test_f1: 0.5957
 epoch: 31, train_loss: 0.7070, test_loss: 0.8747, test_f1: 0.5844
 epoch: 32, train_loss: 0.7096, test_loss: 0.8838, test_f1: 0.5773
 epoch: 33, train_loss: 0.6950, test_loss: 0.8768, test_f1: 0.5886
 epoch: 34, train_loss: 0.6957, test_loss: 0.9057, test_f1: 0.5885
 epoch: 35, train_loss: 0.6903, test_loss: 0.8746, test_f1: 0.5884
 epoch: 36, train_loss: 0.6824, test_loss: 0.9037, test_f1: 0.5842
 epoch: 37, train_loss: 0.6913, test_loss: 0.9154, test_f1: 0.5935
 epoch: 38, train_loss: 0.6620, test_loss: 0.9000, test_f1: 0.5891
 epoch: 39, train_loss: 0.6690, test_loss: 0.9042, test_f1: 0.5664
 epoch: 40, train_loss: 0.6554, test_loss: 0.8855, test_f1: 0.5948
 epoch: 41, train_loss: 0.6489, test_loss: 0.9083, test_f1: 0.5924
 epoch: 42, train_loss: 0.6495, test_loss: 0.8914, test_f1: 0.5984
 epoch: 43, train_loss: 0.6630, test_loss: 0.8986, test_f1: 0.5950
 epoch: 44, train_loss: 0.6405, test_loss: 0.9370, test_f1: 0.6055
 epoch: 45, train_loss: 0.6377, test_loss: 0.8829, test_f1: 0.6263
 epoch: 46, train_loss: 0.6459, test_loss: 0.9478, test_f1: 0.5814
 epoch: 47, train_loss: 0.6375, test_loss: 0.9058, test_f1: 0.6094
 epoch: 48, train_loss: 0.6245, test_loss: 0.9292, test_f1: 0.6145
 epoch: 49, train_loss: 0.6234, test_loss: 0.9030, test_f1: 0.6264
 epoch: 50, train_loss: 0.6174, test_loss: 0.9082, test_f1: 0.6287
 epoch: 51, train_loss: 0.6220, test_loss: 0.9221, test_f1: 0.6241
 epoch: 52, train_loss: 0.6155, test_loss: 0.9284, test_f1: 0.6203
 epoch: 53, train_loss: 0.6013, test_loss: 0.9301, test_f1: 0.6140
 epoch: 54, train_loss: 0.5958, test_loss: 0.9706, test_f1: 0.5954
 epoch: 55, train_loss: 0.6058, test_loss: 0.9416, test_f1: 0.6183
 epoch: 56, train_loss: 0.5918, test_loss: 0.9433, test_f1: 0.6094
 epoch: 57, train_loss: 0.5820, test_loss: 0.9293, test_f1: 0.6088
 epoch: 58, train_loss: 0.5896, test_loss: 0.9179, test_f1: 0.6282
 epoch: 59, train_loss: 0.5999, test_loss: 0.9488, test_f1: 0.6461
 epoch: 60, train_loss: 0.5861, test_loss: 0.9450, test_f1: 0.6111
 epoch: 61, train_loss: 0.5794, test_loss: 0.9805, test_f1: 0.6229
 epoch: 62, train_loss: 0.5855, test_loss: 0.9348, test_f1: 0.6300
 epoch: 63, train_loss: 0.5794, test_loss: 0.9426, test_f1: 0.6386
 epoch: 64, train_loss: 0.5826, test_loss: 0.9384, test_f1: 0.6246
 epoch: 65, train_loss: 0.5705, test_loss: 0.9667, test_f1: 0.6406
 epoch: 66, train_loss: 0.5667, test_loss: 0.9567, test_f1: 0.6387
 epoch: 67, train_loss: 0.5719, test_loss: 0.9426, test_f1: 0.6185
 epoch: 68, train_loss: 0.5680, test_loss: 0.9845, test_f1: 0.6008
 epoch: 69, train_loss: 0.5527, test_loss: 0.9607, test_f1: 0.6368
 epoch: 70, train_loss: 0.5661, test_loss: 0.9629, test_f1: 0.6204
 epoch: 71, train_loss: 0.5452, test_loss: 1.0082, test_f1: 0.6338
 epoch: 72, train_loss: 0.5628, test_loss: 0.9791, test_f1: 0.6218
 epoch: 73, train_loss: 0.5600, test_loss: 0.9752, test_f1: 0.6385
 epoch: 74, train_loss: 0.5432, test_loss: 1.0122, test_f1: 0.6120
 epoch: 75, train_loss: 0.5511, test_loss: 0.9756, test_f1: 0.6475
 epoch: 76, train_loss: 0.5486, test_loss: 1.0212, test_f1: 0.6495
 epoch: 77, train_loss: 0.5429, test_loss: 0.9969, test_f1: 0.6278
 epoch: 78, train_loss: 0.5507, test_loss: 1.0095, test_f1: 0.6603
 epoch: 79, train_loss: 0.5349, test_loss: 0.9964, test_f1: 0.6508
 epoch: 80, train_loss: 0.5334, test_loss: 1.0124, test_f1: 0.6535
 epoch: 81, train_loss: 0.5323, test_loss: 1.0084, test_f1: 0.6341
 epoch: 82, train_loss: 0.5377, test_loss: 1.0104, test_f1: 0.6284
 epoch: 83, train_loss: 0.5358, test_loss: 1.0009, test_f1: 0.6372
 epoch: 84, train_loss: 0.5371, test_loss: 1.0145, test_f1: 0.6371
 epoch: 85, train_loss: 0.5338, test_loss: 1.0707, test_f1: 0.6358
 epoch: 86, train_loss: 0.5319, test_loss: 1.0063, test_f1: 0.6570
 epoch: 87, train_loss: 0.5329, test_loss: 1.0268, test_f1: 0.6448
 epoch: 88, train_loss: 0.5263, test_loss: 1.0466, test_f1: 0.6284
 epoch: 89, train_loss: 0.5241, test_loss: 1.0192, test_f1: 0.6451
 epoch: 90, train_loss: 0.5326, test_loss: 1.0502, test_f1: 0.6428
 epoch: 91, train_loss: 0.5178, test_loss: 1.0248, test_f1: 0.6512
 epoch: 92, train_loss: 0.5237, test_loss: 1.0996, test_f1: 0.6331
 epoch: 93, train_loss: 0.5260, test_loss: 1.0331, test_f1: 0.6561
 epoch: 94, train_loss: 0.5100, test_loss: 1.0606, test_f1: 0.6438
 epoch: 95, train_loss: 0.5223, test_loss: 1.0455, test_f1: 0.6127
 epoch: 96, train_loss: 0.5199, test_loss: 1.0366, test_f1: 0.6448
 epoch: 97, train_loss: 0.5190, test_loss: 1.0044, test_f1: 0.6571
 epoch: 98, train_loss: 0.4986, test_loss: 1.1024, test_f1: 0.6339
 epoch: 99, train_loss: 0.5101, test_loss: 1.0555, test_f1: 0.6414
##################ITERATION #1 ****************************************
 epoch: 0, train_loss: 1.2172, test_loss: 1.0760, test_f1: 0.3861
 epoch: 1, train_loss: 1.0556, test_loss: 1.0034, test_f1: 0.4710
 epoch: 2, train_loss: 1.0051, test_loss: 0.9805, test_f1: 0.5163
 epoch: 3, train_loss: 0.9683, test_loss: 0.9456, test_f1: 0.5018
 epoch: 4, train_loss: 0.9449, test_loss: 0.9105, test_f1: 0.5025
 epoch: 5, train_loss: 0.9118, test_loss: 0.8847, test_f1: 0.5445
 epoch: 6, train_loss: 0.8951, test_loss: 0.9081, test_f1: 0.5359
 epoch: 7, train_loss: 0.8751, test_loss: 0.8541, test_f1: 0.5318
 epoch: 8, train_loss: 0.8569, test_loss: 0.8428, test_f1: 0.5458
 epoch: 9, train_loss: 0.8427, test_loss: 0.8525, test_f1: 0.5295
 epoch: 10, train_loss: 0.8366, test_loss: 0.8536, test_f1: 0.5622
 epoch: 11, train_loss: 0.8160, test_loss: 0.8223, test_f1: 0.5581
 epoch: 12, train_loss: 0.7954, test_loss: 0.8284, test_f1: 0.5584
 epoch: 13, train_loss: 0.7881, test_loss: 0.7860, test_f1: 0.5706
 epoch: 14, train_loss: 0.7790, test_loss: 0.7858, test_f1: 0.5617
 epoch: 15, train_loss: 0.7609, test_loss: 0.8163, test_f1: 0.5690
 epoch: 16, train_loss: 0.7620, test_loss: 0.8054, test_f1: 0.5732
 epoch: 17, train_loss: 0.7607, test_loss: 0.8212, test_f1: 0.5671
 epoch: 18, train_loss: 0.7480, test_loss: 0.8395, test_f1: 0.5762
 epoch: 19, train_loss: 0.7256, test_loss: 0.7808, test_f1: 0.5640
 epoch: 20, train_loss: 0.7245, test_loss: 0.8237, test_f1: 0.5990
 epoch: 21, train_loss: 0.7232, test_loss: 0.8356, test_f1: 0.5925
 epoch: 22, train_loss: 0.7129, test_loss: 0.7702, test_f1: 0.5725
 epoch: 23, train_loss: 0.7112, test_loss: 0.8384, test_f1: 0.5745
 epoch: 24, train_loss: 0.6960, test_loss: 0.8456, test_f1: 0.6005
 epoch: 25, train_loss: 0.6946, test_loss: 0.7918, test_f1: 0.5925
 epoch: 26, train_loss: 0.6833, test_loss: 0.8463, test_f1: 0.5663
 epoch: 27, train_loss: 0.6763, test_loss: 0.7862, test_f1: 0.6023
 epoch: 28, train_loss: 0.6777, test_loss: 0.8639, test_f1: 0.5766
 epoch: 29, train_loss: 0.6796, test_loss: 0.8506, test_f1: 0.6009
 epoch: 30, train_loss: 0.6714, test_loss: 0.7727, test_f1: 0.6033
 epoch: 31, train_loss: 0.6628, test_loss: 0.8335, test_f1: 0.5895
 epoch: 32, train_loss: 0.6407, test_loss: 0.8130, test_f1: 0.6089
 epoch: 33, train_loss: 0.6517, test_loss: 0.8388, test_f1: 0.5889
 epoch: 34, train_loss: 0.6449, test_loss: 0.8026, test_f1: 0.5948
 epoch: 35, train_loss: 0.6426, test_loss: 0.7882, test_f1: 0.6101
 epoch: 36, train_loss: 0.6286, test_loss: 0.8455, test_f1: 0.6007
 epoch: 37, train_loss: 0.6289, test_loss: 0.7294, test_f1: 0.6137
 epoch: 38, train_loss: 0.6255, test_loss: 0.7823, test_f1: 0.5980
 epoch: 39, train_loss: 0.6229, test_loss: 0.8403, test_f1: 0.6127
 epoch: 40, train_loss: 0.6259, test_loss: 0.8120, test_f1: 0.5933
 epoch: 41, train_loss: 0.6046, test_loss: 0.8007, test_f1: 0.6242
 epoch: 42, train_loss: 0.5995, test_loss: 0.7810, test_f1: 0.6213
 epoch: 43, train_loss: 0.6023, test_loss: 0.8012, test_f1: 0.6234
 epoch: 44, train_loss: 0.5992, test_loss: 0.7991, test_f1: 0.6197
 epoch: 45, train_loss: 0.6032, test_loss: 0.8680, test_f1: 0.6211
 epoch: 46, train_loss: 0.6025, test_loss: 0.8220, test_f1: 0.6070
 epoch: 47, train_loss: 0.5845, test_loss: 0.8731, test_f1: 0.6270
 epoch: 48, train_loss: 0.5866, test_loss: 0.8668, test_f1: 0.6301
 epoch: 49, train_loss: 0.5864, test_loss: 0.8541, test_f1: 0.6385
 epoch: 50, train_loss: 0.5686, test_loss: 0.8117, test_f1: 0.6230
 epoch: 51, train_loss: 0.5643, test_loss: 0.8466, test_f1: 0.6100
 epoch: 52, train_loss: 0.5510, test_loss: 0.8331, test_f1: 0.6292
 epoch: 53, train_loss: 0.5501, test_loss: 0.8496, test_f1: 0.6327
 epoch: 54, train_loss: 0.5516, test_loss: 0.8404, test_f1: 0.6234
 epoch: 55, train_loss: 0.5372, test_loss: 0.7796, test_f1: 0.6442
 epoch: 56, train_loss: 0.5364, test_loss: 0.7878, test_f1: 0.6338
 epoch: 57, train_loss: 0.5382, test_loss: 0.8423, test_f1: 0.6324
 epoch: 58, train_loss: 0.5465, test_loss: 0.8235, test_f1: 0.6333
 epoch: 59, train_loss: 0.5249, test_loss: 0.8682, test_f1: 0.6338
 epoch: 60, train_loss: 0.5373, test_loss: 0.9040, test_f1: 0.6233
 epoch: 61, train_loss: 0.5355, test_loss: 0.8185, test_f1: 0.6339
 epoch: 62, train_loss: 0.5392, test_loss: 0.8913, test_f1: 0.6187
 epoch: 63, train_loss: 0.5229, test_loss: 0.8516, test_f1: 0.6321
 epoch: 64, train_loss: 0.5218, test_loss: 0.8567, test_f1: 0.6313
 epoch: 65, train_loss: 0.5182, test_loss: 0.8873, test_f1: 0.6336
 epoch: 66, train_loss: 0.5219, test_loss: 0.8940, test_f1: 0.6184
 epoch: 67, train_loss: 0.5238, test_loss: 0.8834, test_f1: 0.6316
 epoch: 68, train_loss: 0.5289, test_loss: 0.7713, test_f1: 0.6366
 epoch: 69, train_loss: 0.5187, test_loss: 0.8134, test_f1: 0.6337
 epoch: 70, train_loss: 0.5171, test_loss: 0.8300, test_f1: 0.6379
 epoch: 71, train_loss: 0.5111, test_loss: 0.9371, test_f1: 0.6333
 epoch: 72, train_loss: 0.5151, test_loss: 0.8858, test_f1: 0.6423
 epoch: 73, train_loss: 0.5227, test_loss: 0.8286, test_f1: 0.6398
 epoch: 74, train_loss: 0.5061, test_loss: 0.8585, test_f1: 0.6251
 epoch: 75, train_loss: 0.5149, test_loss: 0.7902, test_f1: 0.6376
 epoch: 76, train_loss: 0.4941, test_loss: 0.8419, test_f1: 0.6368
 epoch: 77, train_loss: 0.5021, test_loss: 0.8340, test_f1: 0.6347
 epoch: 78, train_loss: 0.4910, test_loss: 0.8486, test_f1: 0.6301
 epoch: 79, train_loss: 0.5055, test_loss: 0.7960, test_f1: 0.6385
 epoch: 80, train_loss: 0.5031, test_loss: 0.8587, test_f1: 0.6341
 epoch: 81, train_loss: 0.4836, test_loss: 0.8007, test_f1: 0.6412
 epoch: 82, train_loss: 0.4958, test_loss: 0.8769, test_f1: 0.6336
 epoch: 83, train_loss: 0.4860, test_loss: 0.8954, test_f1: 0.6462
 epoch: 84, train_loss: 0.4970, test_loss: 0.8236, test_f1: 0.6362
 epoch: 85, train_loss: 0.4793, test_loss: 0.8495, test_f1: 0.6567
 epoch: 86, train_loss: 0.4960, test_loss: 0.8216, test_f1: 0.6228
 epoch: 87, train_loss: 0.4858, test_loss: 0.7916, test_f1: 0.6261
 epoch: 88, train_loss: 0.4786, test_loss: 0.8771, test_f1: 0.6384
 epoch: 89, train_loss: 0.4826, test_loss: 0.8843, test_f1: 0.6363
 epoch: 90, train_loss: 0.4760, test_loss: 0.9118, test_f1: 0.6307
 epoch: 91, train_loss: 0.4694, test_loss: 0.8840, test_f1: 0.6467
 epoch: 92, train_loss: 0.4660, test_loss: 0.8569, test_f1: 0.6291
 epoch: 93, train_loss: 0.4740, test_loss: 0.9066, test_f1: 0.6416
 epoch: 94, train_loss: 0.4728, test_loss: 0.8967, test_f1: 0.6365
 epoch: 95, train_loss: 0.4634, test_loss: 0.8209, test_f1: 0.6528
 epoch: 96, train_loss: 0.4872, test_loss: 0.8850, test_f1: 0.6327
 epoch: 97, train_loss: 0.4640, test_loss: 0.8731, test_f1: 0.6383
 epoch: 98, train_loss: 0.4587, test_loss: 0.8309, test_f1: 0.6347
 epoch: 99, train_loss: 0.4627, test_loss: 0.8959, test_f1: 0.6444
##################ITERATION #2 ****************************************
 epoch: 0, train_loss: 1.1674, test_loss: 1.0220, test_f1: 0.4081
 epoch: 1, train_loss: 1.0289, test_loss: 0.9787, test_f1: 0.4959
 epoch: 2, train_loss: 0.9925, test_loss: 0.9738, test_f1: 0.4902
 epoch: 3, train_loss: 0.9588, test_loss: 0.9486, test_f1: 0.5407
 epoch: 4, train_loss: 0.9339, test_loss: 0.9215, test_f1: 0.5242
 epoch: 5, train_loss: 0.9179, test_loss: 0.9030, test_f1: 0.5588
 epoch: 6, train_loss: 0.9064, test_loss: 0.9133, test_f1: 0.5662
 epoch: 7, train_loss: 0.8812, test_loss: 0.9046, test_f1: 0.5441
 epoch: 8, train_loss: 0.8719, test_loss: 0.9061, test_f1: 0.5595
 epoch: 9, train_loss: 0.8535, test_loss: 0.8894, test_f1: 0.5665
 epoch: 10, train_loss: 0.8363, test_loss: 0.8632, test_f1: 0.5548
 epoch: 11, train_loss: 0.8279, test_loss: 0.8549, test_f1: 0.5821
 epoch: 12, train_loss: 0.8143, test_loss: 0.8391, test_f1: 0.5747
 epoch: 13, train_loss: 0.8049, test_loss: 0.8592, test_f1: 0.5552
 epoch: 14, train_loss: 0.7969, test_loss: 0.8334, test_f1: 0.5847
 epoch: 15, train_loss: 0.7723, test_loss: 0.8333, test_f1: 0.5667
 epoch: 16, train_loss: 0.7809, test_loss: 0.7958, test_f1: 0.5887
 epoch: 17, train_loss: 0.7710, test_loss: 0.8373, test_f1: 0.5590
 epoch: 18, train_loss: 0.7551, test_loss: 0.8274, test_f1: 0.5784
 epoch: 19, train_loss: 0.7402, test_loss: 0.8155, test_f1: 0.6012
 epoch: 20, train_loss: 0.7269, test_loss: 0.8193, test_f1: 0.6133
 epoch: 21, train_loss: 0.7293, test_loss: 0.8601, test_f1: 0.5765
 epoch: 22, train_loss: 0.7172, test_loss: 0.8285, test_f1: 0.5855
 epoch: 23, train_loss: 0.7117, test_loss: 0.8556, test_f1: 0.5904
 epoch: 24, train_loss: 0.7084, test_loss: 0.8034, test_f1: 0.6181
 epoch: 25, train_loss: 0.7036, test_loss: 0.8127, test_f1: 0.5893
 epoch: 26, train_loss: 0.7056, test_loss: 0.8490, test_f1: 0.6198
 epoch: 27, train_loss: 0.6877, test_loss: 0.7895, test_f1: 0.6325
 epoch: 28, train_loss: 0.6896, test_loss: 0.8026, test_f1: 0.6275
 epoch: 29, train_loss: 0.6704, test_loss: 0.7810, test_f1: 0.6017
 epoch: 30, train_loss: 0.6614, test_loss: 0.7987, test_f1: 0.6197
 epoch: 31, train_loss: 0.6610, test_loss: 0.7842, test_f1: 0.6269
 epoch: 32, train_loss: 0.6594, test_loss: 0.7122, test_f1: 0.6393
 epoch: 33, train_loss: 0.6517, test_loss: 0.8213, test_f1: 0.6239
 epoch: 34, train_loss: 0.6324, test_loss: 0.7588, test_f1: 0.6326
 epoch: 35, train_loss: 0.6315, test_loss: 0.7922, test_f1: 0.6060
 epoch: 36, train_loss: 0.6346, test_loss: 0.7946, test_f1: 0.6206
 epoch: 37, train_loss: 0.6198, test_loss: 0.7696, test_f1: 0.6033
 epoch: 38, train_loss: 0.6207, test_loss: 0.7477, test_f1: 0.6278
 epoch: 39, train_loss: 0.6139, test_loss: 0.7893, test_f1: 0.6277
 epoch: 40, train_loss: 0.6224, test_loss: 0.7491, test_f1: 0.6316
 epoch: 41, train_loss: 0.6080, test_loss: 0.7692, test_f1: 0.6253
 epoch: 42, train_loss: 0.6001, test_loss: 0.7799, test_f1: 0.6298
 epoch: 43, train_loss: 0.5930, test_loss: 0.8208, test_f1: 0.6225
 epoch: 44, train_loss: 0.5982, test_loss: 0.7806, test_f1: 0.6187
 epoch: 45, train_loss: 0.5945, test_loss: 0.8220, test_f1: 0.6178
 epoch: 46, train_loss: 0.5910, test_loss: 0.7386, test_f1: 0.6437
 epoch: 47, train_loss: 0.5666, test_loss: 0.7757, test_f1: 0.6467
 epoch: 48, train_loss: 0.5774, test_loss: 0.8190, test_f1: 0.6379
 epoch: 49, train_loss: 0.5689, test_loss: 0.7720, test_f1: 0.6178
 epoch: 50, train_loss: 0.5634, test_loss: 0.8882, test_f1: 0.6108
 epoch: 51, train_loss: 0.5484, test_loss: 0.8521, test_f1: 0.6129
 epoch: 52, train_loss: 0.5465, test_loss: 0.8033, test_f1: 0.6568
 epoch: 53, train_loss: 0.5312, test_loss: 0.8545, test_f1: 0.6285
 epoch: 54, train_loss: 0.5385, test_loss: 0.7659, test_f1: 0.6321
 epoch: 55, train_loss: 0.5350, test_loss: 0.7831, test_f1: 0.6412
 epoch: 56, train_loss: 0.5287, test_loss: 0.7825, test_f1: 0.6328
 epoch: 57, train_loss: 0.5270, test_loss: 0.8144, test_f1: 0.6375
 epoch: 58, train_loss: 0.5129, test_loss: 0.8224, test_f1: 0.6224
 epoch: 59, train_loss: 0.5306, test_loss: 0.7925, test_f1: 0.6411
 epoch: 60, train_loss: 0.5201, test_loss: 0.8669, test_f1: 0.6338
 epoch: 61, train_loss: 0.5329, test_loss: 0.7940, test_f1: 0.6321
 epoch: 62, train_loss: 0.5171, test_loss: 0.8865, test_f1: 0.6325
 epoch: 63, train_loss: 0.5264, test_loss: 0.8247, test_f1: 0.6516
 epoch: 64, train_loss: 0.5158, test_loss: 0.8464, test_f1: 0.6521
 epoch: 65, train_loss: 0.4972, test_loss: 0.8453, test_f1: 0.6463
 epoch: 66, train_loss: 0.5217, test_loss: 0.8306, test_f1: 0.6423
 epoch: 67, train_loss: 0.5017, test_loss: 0.8251, test_f1: 0.6684
 epoch: 68, train_loss: 0.5122, test_loss: 0.8181, test_f1: 0.6512
 epoch: 69, train_loss: 0.5089, test_loss: 0.8186, test_f1: 0.6352
 epoch: 70, train_loss: 0.5064, test_loss: 0.8043, test_f1: 0.6570
 epoch: 71, train_loss: 0.5054, test_loss: 0.9096, test_f1: 0.6233
 epoch: 72, train_loss: 0.5151, test_loss: 0.8340, test_f1: 0.6511
 epoch: 73, train_loss: 0.4900, test_loss: 0.7976, test_f1: 0.6385
 epoch: 74, train_loss: 0.4928, test_loss: 0.7967, test_f1: 0.6556
 epoch: 75, train_loss: 0.4836, test_loss: 0.8625, test_f1: 0.6573
 epoch: 76, train_loss: 0.4774, test_loss: 0.8763, test_f1: 0.6492
 epoch: 77, train_loss: 0.4861, test_loss: 0.8024, test_f1: 0.6256
 epoch: 78, train_loss: 0.4914, test_loss: 0.8040, test_f1: 0.6372
 epoch: 79, train_loss: 0.4798, test_loss: 0.9004, test_f1: 0.6410
 epoch: 80, train_loss: 0.4809, test_loss: 0.8682, test_f1: 0.6616
 epoch: 81, train_loss: 0.4811, test_loss: 0.8993, test_f1: 0.6418
 epoch: 82, train_loss: 0.4733, test_loss: 0.8386, test_f1: 0.6635
 epoch: 83, train_loss: 0.4738, test_loss: 0.8266, test_f1: 0.6484
 epoch: 84, train_loss: 0.4711, test_loss: 0.8953, test_f1: 0.6442
 epoch: 85, train_loss: 0.4621, test_loss: 0.8511, test_f1: 0.6566
 epoch: 86, train_loss: 0.4640, test_loss: 0.8884, test_f1: 0.6495
 epoch: 87, train_loss: 0.4721, test_loss: 0.8784, test_f1: 0.6514
 epoch: 88, train_loss: 0.4706, test_loss: 0.9277, test_f1: 0.6457
 epoch: 89, train_loss: 0.4548, test_loss: 0.8483, test_f1: 0.6444
 epoch: 90, train_loss: 0.4704, test_loss: 0.7942, test_f1: 0.6697
 epoch: 91, train_loss: 0.4527, test_loss: 0.9045, test_f1: 0.6489
 epoch: 92, train_loss: 0.4535, test_loss: 0.8890, test_f1: 0.6440
 epoch: 93, train_loss: 0.4567, test_loss: 0.8560, test_f1: 0.6574
 epoch: 94, train_loss: 0.4520, test_loss: 0.9372, test_f1: 0.6436
 epoch: 95, train_loss: 0.4590, test_loss: 0.8472, test_f1: 0.6671
 epoch: 96, train_loss: 0.4605, test_loss: 0.8845, test_f1: 0.6433
 epoch: 97, train_loss: 0.4536, test_loss: 0.9209, test_f1: 0.6401
 epoch: 98, train_loss: 0.4479, test_loss: 0.9456, test_f1: 0.6474
 epoch: 99, train_loss: 0.4560, test_loss: 0.9311, test_f1: 0.6664
##################ITERATION #3 ****************************************
 epoch: 0, train_loss: 1.1432, test_loss: 0.9713, test_f1: 0.4896
 epoch: 1, train_loss: 1.0280, test_loss: 0.9453, test_f1: 0.5351
 epoch: 2, train_loss: 0.9923, test_loss: 0.9293, test_f1: 0.5219
 epoch: 3, train_loss: 0.9601, test_loss: 0.9266, test_f1: 0.5676
 epoch: 4, train_loss: 0.9327, test_loss: 0.9048, test_f1: 0.5603
 epoch: 5, train_loss: 0.9246, test_loss: 0.9069, test_f1: 0.5588
 epoch: 6, train_loss: 0.9049, test_loss: 0.8840, test_f1: 0.5743
 epoch: 7, train_loss: 0.8867, test_loss: 0.8891, test_f1: 0.5888
 epoch: 8, train_loss: 0.8851, test_loss: 0.8387, test_f1: 0.5793
 epoch: 9, train_loss: 0.8727, test_loss: 0.8598, test_f1: 0.5932
 epoch: 10, train_loss: 0.8555, test_loss: 0.8520, test_f1: 0.6043
 epoch: 11, train_loss: 0.8376, test_loss: 0.8338, test_f1: 0.6056
 epoch: 12, train_loss: 0.8338, test_loss: 0.8200, test_f1: 0.6071
 epoch: 13, train_loss: 0.8090, test_loss: 0.8084, test_f1: 0.6318
 epoch: 14, train_loss: 0.8062, test_loss: 0.8215, test_f1: 0.6145
 epoch: 15, train_loss: 0.7946, test_loss: 0.7935, test_f1: 0.6128
 epoch: 16, train_loss: 0.7880, test_loss: 0.8054, test_f1: 0.6222
 epoch: 17, train_loss: 0.7747, test_loss: 0.7798, test_f1: 0.6084
 epoch: 18, train_loss: 0.7637, test_loss: 0.7874, test_f1: 0.6104
 epoch: 19, train_loss: 0.7548, test_loss: 0.8133, test_f1: 0.5966
 epoch: 20, train_loss: 0.7566, test_loss: 0.7864, test_f1: 0.6170
 epoch: 21, train_loss: 0.7401, test_loss: 0.7787, test_f1: 0.6244
 epoch: 22, train_loss: 0.7374, test_loss: 0.8059, test_f1: 0.6039
 epoch: 23, train_loss: 0.7305, test_loss: 0.8191, test_f1: 0.6188
 epoch: 24, train_loss: 0.7209, test_loss: 0.8135, test_f1: 0.6235
 epoch: 25, train_loss: 0.7181, test_loss: 0.7515, test_f1: 0.6319
 epoch: 26, train_loss: 0.6971, test_loss: 0.7857, test_f1: 0.6449
 epoch: 27, train_loss: 0.6932, test_loss: 0.7773, test_f1: 0.6283
 epoch: 28, train_loss: 0.6978, test_loss: 0.8017, test_f1: 0.6431
 epoch: 29, train_loss: 0.6923, test_loss: 0.7553, test_f1: 0.6168
 epoch: 30, train_loss: 0.6877, test_loss: 0.7873, test_f1: 0.6487
 epoch: 31, train_loss: 0.6831, test_loss: 0.7953, test_f1: 0.6241
 epoch: 32, train_loss: 0.6653, test_loss: 0.7971, test_f1: 0.6266
 epoch: 33, train_loss: 0.6628, test_loss: 0.7392, test_f1: 0.6438
 epoch: 34, train_loss: 0.6643, test_loss: 0.8002, test_f1: 0.6300
 epoch: 35, train_loss: 0.6692, test_loss: 0.7600, test_f1: 0.6531
 epoch: 36, train_loss: 0.6569, test_loss: 0.7737, test_f1: 0.6288
 epoch: 37, train_loss: 0.6539, test_loss: 0.7932, test_f1: 0.6411
 epoch: 38, train_loss: 0.6320, test_loss: 0.7769, test_f1: 0.6469
 epoch: 39, train_loss: 0.6403, test_loss: 0.7880, test_f1: 0.6085
 epoch: 40, train_loss: 0.6481, test_loss: 0.7562, test_f1: 0.6458
 epoch: 41, train_loss: 0.6302, test_loss: 0.7826, test_f1: 0.6270
 epoch: 42, train_loss: 0.6262, test_loss: 0.7167, test_f1: 0.6369
 epoch: 43, train_loss: 0.6250, test_loss: 0.8549, test_f1: 0.6277
 epoch: 44, train_loss: 0.6116, test_loss: 0.7702, test_f1: 0.6349
 epoch: 45, train_loss: 0.6194, test_loss: 0.8420, test_f1: 0.6283
 epoch: 46, train_loss: 0.6073, test_loss: 0.7594, test_f1: 0.6457
 epoch: 47, train_loss: 0.6110, test_loss: 0.7420, test_f1: 0.6560
 epoch: 48, train_loss: 0.6108, test_loss: 0.8164, test_f1: 0.6232
 epoch: 49, train_loss: 0.5939, test_loss: 0.8350, test_f1: 0.6598
 epoch: 50, train_loss: 0.6154, test_loss: 0.8013, test_f1: 0.6241
 epoch: 51, train_loss: 0.5857, test_loss: 0.8212, test_f1: 0.6154
 epoch: 52, train_loss: 0.5706, test_loss: 0.8072, test_f1: 0.6308
 epoch: 53, train_loss: 0.5628, test_loss: 0.7625, test_f1: 0.6353
 epoch: 54, train_loss: 0.5598, test_loss: 0.7725, test_f1: 0.6402
 epoch: 55, train_loss: 0.5727, test_loss: 0.8495, test_f1: 0.6089
 epoch: 56, train_loss: 0.5616, test_loss: 0.8490, test_f1: 0.6194
 epoch: 57, train_loss: 0.5609, test_loss: 0.7820, test_f1: 0.6411
 epoch: 58, train_loss: 0.5677, test_loss: 0.8372, test_f1: 0.6404
 epoch: 59, train_loss: 0.5543, test_loss: 0.8272, test_f1: 0.6273
 epoch: 60, train_loss: 0.5540, test_loss: 0.8089, test_f1: 0.6410
 epoch: 61, train_loss: 0.5592, test_loss: 0.8556, test_f1: 0.6324
 epoch: 62, train_loss: 0.5465, test_loss: 0.8509, test_f1: 0.6391
 epoch: 63, train_loss: 0.5492, test_loss: 0.8122, test_f1: 0.6369
 epoch: 64, train_loss: 0.5418, test_loss: 0.7838, test_f1: 0.6719
 epoch: 65, train_loss: 0.5414, test_loss: 0.9055, test_f1: 0.6238
 epoch: 66, train_loss: 0.5383, test_loss: 0.8393, test_f1: 0.6421
 epoch: 67, train_loss: 0.5423, test_loss: 0.7526, test_f1: 0.6703
 epoch: 68, train_loss: 0.5297, test_loss: 0.9166, test_f1: 0.6105
 epoch: 69, train_loss: 0.5328, test_loss: 0.8370, test_f1: 0.6392
 epoch: 70, train_loss: 0.5367, test_loss: 0.8266, test_f1: 0.6416
 epoch: 71, train_loss: 0.5325, test_loss: 0.8209, test_f1: 0.6019
 epoch: 72, train_loss: 0.5305, test_loss: 0.8810, test_f1: 0.6370
 epoch: 73, train_loss: 0.5211, test_loss: 0.8755, test_f1: 0.6267
 epoch: 74, train_loss: 0.5274, test_loss: 0.7889, test_f1: 0.6460
 epoch: 75, train_loss: 0.5181, test_loss: 0.8225, test_f1: 0.6281
 epoch: 76, train_loss: 0.5151, test_loss: 0.8462, test_f1: 0.6225
 epoch: 77, train_loss: 0.5221, test_loss: 0.8167, test_f1: 0.6536
 epoch: 78, train_loss: 0.5132, test_loss: 0.7697, test_f1: 0.6568
 epoch: 79, train_loss: 0.5015, test_loss: 0.8578, test_f1: 0.6401
 epoch: 80, train_loss: 0.5008, test_loss: 0.8430, test_f1: 0.6307
 epoch: 81, train_loss: 0.5077, test_loss: 0.8956, test_f1: 0.6257
 epoch: 82, train_loss: 0.5107, test_loss: 0.8661, test_f1: 0.6412
 epoch: 83, train_loss: 0.4941, test_loss: 0.8501, test_f1: 0.6389
 epoch: 84, train_loss: 0.4930, test_loss: 0.8321, test_f1: 0.6433
 epoch: 85, train_loss: 0.4941, test_loss: 0.8654, test_f1: 0.6305
 epoch: 86, train_loss: 0.4823, test_loss: 0.8235, test_f1: 0.6463
 epoch: 87, train_loss: 0.4969, test_loss: 0.8502, test_f1: 0.6524
 epoch: 88, train_loss: 0.4841, test_loss: 0.8166, test_f1: 0.6471
 epoch: 89, train_loss: 0.4923, test_loss: 0.7986, test_f1: 0.6624
 epoch: 90, train_loss: 0.4933, test_loss: 0.8538, test_f1: 0.6467
 epoch: 91, train_loss: 0.4897, test_loss: 0.8801, test_f1: 0.6491
 epoch: 92, train_loss: 0.4772, test_loss: 0.8501, test_f1: 0.6480
 epoch: 93, train_loss: 0.4798, test_loss: 0.8233, test_f1: 0.6624
 epoch: 94, train_loss: 0.4887, test_loss: 0.8489, test_f1: 0.6593
 epoch: 95, train_loss: 0.4724, test_loss: 0.8482, test_f1: 0.6570
 epoch: 96, train_loss: 0.4757, test_loss: 0.8715, test_f1: 0.6617
 epoch: 97, train_loss: 0.4723, test_loss: 0.8596, test_f1: 0.6538
 epoch: 98, train_loss: 0.4681, test_loss: 0.8809, test_f1: 0.6486
 epoch: 99, train_loss: 0.4703, test_loss: 0.8507, test_f1: 0.6519
##################ITERATION #4 ****************************************
 epoch: 0, train_loss: 1.1763, test_loss: 1.0020, test_f1: 0.4841
 epoch: 1, train_loss: 1.0453, test_loss: 0.9797, test_f1: 0.5407
 epoch: 2, train_loss: 0.9994, test_loss: 0.9644, test_f1: 0.5292
 epoch: 3, train_loss: 0.9759, test_loss: 0.9554, test_f1: 0.5340
 epoch: 4, train_loss: 0.9396, test_loss: 0.9402, test_f1: 0.5463
 epoch: 5, train_loss: 0.9360, test_loss: 0.9423, test_f1: 0.5529
 epoch: 6, train_loss: 0.9030, test_loss: 0.9409, test_f1: 0.5488
 epoch: 7, train_loss: 0.8802, test_loss: 0.9269, test_f1: 0.5770
 epoch: 8, train_loss: 0.8724, test_loss: 0.9115, test_f1: 0.5569
 epoch: 9, train_loss: 0.8570, test_loss: 0.9131, test_f1: 0.5806
 epoch: 10, train_loss: 0.8351, test_loss: 0.9000, test_f1: 0.5675
 epoch: 11, train_loss: 0.8343, test_loss: 0.9069, test_f1: 0.5474
 epoch: 12, train_loss: 0.8074, test_loss: 0.9058, test_f1: 0.6059
 epoch: 13, train_loss: 0.8027, test_loss: 0.8804, test_f1: 0.6022
 epoch: 14, train_loss: 0.8000, test_loss: 0.8580, test_f1: 0.6068
 epoch: 15, train_loss: 0.7930, test_loss: 0.8563, test_f1: 0.6195
 epoch: 16, train_loss: 0.7694, test_loss: 0.8771, test_f1: 0.5845
 epoch: 17, train_loss: 0.7685, test_loss: 0.8645, test_f1: 0.5995
 epoch: 18, train_loss: 0.7636, test_loss: 0.8672, test_f1: 0.6200
 epoch: 19, train_loss: 0.7540, test_loss: 0.8758, test_f1: 0.6263
 epoch: 20, train_loss: 0.7466, test_loss: 0.8432, test_f1: 0.6239
 epoch: 21, train_loss: 0.7322, test_loss: 0.8443, test_f1: 0.6316
 epoch: 22, train_loss: 0.7350, test_loss: 0.8396, test_f1: 0.6387
 epoch: 23, train_loss: 0.7160, test_loss: 0.8306, test_f1: 0.6337
 epoch: 24, train_loss: 0.7169, test_loss: 0.8441, test_f1: 0.6499
 epoch: 25, train_loss: 0.7061, test_loss: 0.8302, test_f1: 0.6267
 epoch: 26, train_loss: 0.6996, test_loss: 0.8309, test_f1: 0.6339
 epoch: 27, train_loss: 0.6928, test_loss: 0.8431, test_f1: 0.6278
 epoch: 28, train_loss: 0.6819, test_loss: 0.8331, test_f1: 0.6321
 epoch: 29, train_loss: 0.6701, test_loss: 0.8555, test_f1: 0.6215
 epoch: 30, train_loss: 0.6701, test_loss: 0.8261, test_f1: 0.6258
 epoch: 31, train_loss: 0.6672, test_loss: 0.8398, test_f1: 0.6576
 epoch: 32, train_loss: 0.6795, test_loss: 0.7882, test_f1: 0.6297
 epoch: 33, train_loss: 0.6571, test_loss: 0.8258, test_f1: 0.6272
 epoch: 34, train_loss: 0.6501, test_loss: 0.8187, test_f1: 0.6638
 epoch: 35, train_loss: 0.6581, test_loss: 0.8614, test_f1: 0.6402
 epoch: 36, train_loss: 0.6456, test_loss: 0.8517, test_f1: 0.6388
 epoch: 37, train_loss: 0.6402, test_loss: 0.8158, test_f1: 0.6624
 epoch: 38, train_loss: 0.6376, test_loss: 0.7965, test_f1: 0.6348
 epoch: 39, train_loss: 0.6300, test_loss: 0.8093, test_f1: 0.6552
 epoch: 40, train_loss: 0.6173, test_loss: 0.8279, test_f1: 0.6590
 epoch: 41, train_loss: 0.6229, test_loss: 0.8019, test_f1: 0.6337
 epoch: 42, train_loss: 0.6190, test_loss: 0.7582, test_f1: 0.6512
 epoch: 43, train_loss: 0.6167, test_loss: 0.8476, test_f1: 0.6713
 epoch: 44, train_loss: 0.6069, test_loss: 0.8346, test_f1: 0.6612
 epoch: 45, train_loss: 0.5984, test_loss: 0.8489, test_f1: 0.6472
 epoch: 46, train_loss: 0.5953, test_loss: 0.8428, test_f1: 0.6582
 epoch: 47, train_loss: 0.5900, test_loss: 0.8274, test_f1: 0.6806
 epoch: 48, train_loss: 0.5887, test_loss: 0.8449, test_f1: 0.6685
 epoch: 49, train_loss: 0.5796, test_loss: 0.7421, test_f1: 0.6507
 epoch: 50, train_loss: 0.5768, test_loss: 0.8278, test_f1: 0.6765
 epoch: 51, train_loss: 0.5615, test_loss: 0.8038, test_f1: 0.6639
 epoch: 52, train_loss: 0.5540, test_loss: 0.8439, test_f1: 0.6749
 epoch: 53, train_loss: 0.5516, test_loss: 0.8350, test_f1: 0.6470
 epoch: 54, train_loss: 0.5498, test_loss: 0.8156, test_f1: 0.6623
 epoch: 55, train_loss: 0.5607, test_loss: 0.8406, test_f1: 0.6634
 epoch: 56, train_loss: 0.5496, test_loss: 0.8857, test_f1: 0.6816
 epoch: 57, train_loss: 0.5415, test_loss: 0.8792, test_f1: 0.6761
 epoch: 58, train_loss: 0.5464, test_loss: 0.8547, test_f1: 0.6732
 epoch: 59, train_loss: 0.5410, test_loss: 0.8051, test_f1: 0.6798
 epoch: 60, train_loss: 0.5379, test_loss: 0.8593, test_f1: 0.6780
 epoch: 61, train_loss: 0.5416, test_loss: 0.8622, test_f1: 0.6545
 epoch: 62, train_loss: 0.5318, test_loss: 0.8299, test_f1: 0.6581
 epoch: 63, train_loss: 0.5453, test_loss: 0.8553, test_f1: 0.6697
 epoch: 64, train_loss: 0.5287, test_loss: 0.8740, test_f1: 0.6802
 epoch: 65, train_loss: 0.5389, test_loss: 0.8507, test_f1: 0.6557
 epoch: 66, train_loss: 0.5158, test_loss: 0.8419, test_f1: 0.6500
 epoch: 67, train_loss: 0.5186, test_loss: 0.8672, test_f1: 0.6536
 epoch: 68, train_loss: 0.5124, test_loss: 0.8389, test_f1: 0.6502
 epoch: 69, train_loss: 0.5089, test_loss: 0.8392, test_f1: 0.6672
 epoch: 70, train_loss: 0.5210, test_loss: 0.7862, test_f1: 0.6702
 epoch: 71, train_loss: 0.5181, test_loss: 0.8524, test_f1: 0.6612
 epoch: 72, train_loss: 0.5106, test_loss: 0.8374, test_f1: 0.6706
 epoch: 73, train_loss: 0.5222, test_loss: 0.8664, test_f1: 0.6750
 epoch: 74, train_loss: 0.5186, test_loss: 0.8547, test_f1: 0.6560
 epoch: 75, train_loss: 0.5020, test_loss: 0.8645, test_f1: 0.6820
 epoch: 76, train_loss: 0.4901, test_loss: 0.8634, test_f1: 0.6653
 epoch: 77, train_loss: 0.5003, test_loss: 0.8818, test_f1: 0.6685
 epoch: 78, train_loss: 0.4944, test_loss: 0.8839, test_f1: 0.6597
 epoch: 79, train_loss: 0.4924, test_loss: 0.9093, test_f1: 0.6645
 epoch: 80, train_loss: 0.4957, test_loss: 0.8363, test_f1: 0.6535
 epoch: 81, train_loss: 0.4985, test_loss: 0.8806, test_f1: 0.6718
 epoch: 82, train_loss: 0.4890, test_loss: 0.8849, test_f1: 0.6702
 epoch: 83, train_loss: 0.4843, test_loss: 0.8833, test_f1: 0.6789
 epoch: 84, train_loss: 0.4792, test_loss: 0.8763, test_f1: 0.6856
 epoch: 85, train_loss: 0.4828, test_loss: 0.8221, test_f1: 0.6508
 epoch: 86, train_loss: 0.4922, test_loss: 0.8505, test_f1: 0.6778
 epoch: 87, train_loss: 0.4871, test_loss: 0.8615, test_f1: 0.6728
 epoch: 88, train_loss: 0.4747, test_loss: 0.7839, test_f1: 0.6727
 epoch: 89, train_loss: 0.4614, test_loss: 0.8367, test_f1: 0.6626
 epoch: 90, train_loss: 0.4721, test_loss: 0.8536, test_f1: 0.6704
 epoch: 91, train_loss: 0.4723, test_loss: 0.8784, test_f1: 0.6725
 epoch: 92, train_loss: 0.4808, test_loss: 0.8823, test_f1: 0.6736
 epoch: 93, train_loss: 0.4603, test_loss: 0.8533, test_f1: 0.6758
 epoch: 94, train_loss: 0.4787, test_loss: 0.8362, test_f1: 0.6818
 epoch: 95, train_loss: 0.4636, test_loss: 0.8869, test_f1: 0.6686
 epoch: 96, train_loss: 0.4555, test_loss: 0.8649, test_f1: 0.6746
 epoch: 97, train_loss: 0.4635, test_loss: 0.8535, test_f1: 0.6724
 epoch: 98, train_loss: 0.4648, test_loss: 0.8811, test_f1: 0.6798
 epoch: 99, train_loss: 0.4581, test_loss: 0.9118, test_f1: 0.6639
##################ITERATION #5 ****************************************
 epoch: 0, train_loss: 1.1661, test_loss: 0.9670, test_f1: 0.4864
 epoch: 1, train_loss: 1.0286, test_loss: 0.9566, test_f1: 0.4787
 epoch: 2, train_loss: 0.9872, test_loss: 0.9459, test_f1: 0.5450
 epoch: 3, train_loss: 0.9652, test_loss: 0.9597, test_f1: 0.5235
 epoch: 4, train_loss: 0.9309, test_loss: 0.9166, test_f1: 0.5380
 epoch: 5, train_loss: 0.9274, test_loss: 0.9046, test_f1: 0.5625
 epoch: 6, train_loss: 0.8937, test_loss: 0.8931, test_f1: 0.5464
 epoch: 7, train_loss: 0.8817, test_loss: 0.8827, test_f1: 0.5846
 epoch: 8, train_loss: 0.8675, test_loss: 0.9039, test_f1: 0.5390
 epoch: 9, train_loss: 0.8423, test_loss: 0.8979, test_f1: 0.5651
 epoch: 10, train_loss: 0.8294, test_loss: 0.8544, test_f1: 0.5814
 epoch: 11, train_loss: 0.8299, test_loss: 0.8475, test_f1: 0.6065
 epoch: 12, train_loss: 0.8027, test_loss: 0.8427, test_f1: 0.5893
 epoch: 13, train_loss: 0.7979, test_loss: 0.8591, test_f1: 0.5980
 epoch: 14, train_loss: 0.7887, test_loss: 0.8696, test_f1: 0.5920
 epoch: 15, train_loss: 0.7848, test_loss: 0.8332, test_f1: 0.6120
 epoch: 16, train_loss: 0.7705, test_loss: 0.8185, test_f1: 0.6360
 epoch: 17, train_loss: 0.7666, test_loss: 0.8357, test_f1: 0.6375
 epoch: 18, train_loss: 0.7561, test_loss: 0.8389, test_f1: 0.6116
 epoch: 19, train_loss: 0.7448, test_loss: 0.8522, test_f1: 0.6309
 epoch: 20, train_loss: 0.7259, test_loss: 0.8313, test_f1: 0.6379
 epoch: 21, train_loss: 0.7284, test_loss: 0.8269, test_f1: 0.6341
 epoch: 22, train_loss: 0.7196, test_loss: 0.8234, test_f1: 0.6550
 epoch: 23, train_loss: 0.7018, test_loss: 0.8191, test_f1: 0.6395
 epoch: 24, train_loss: 0.6936, test_loss: 0.8240, test_f1: 0.6339
 epoch: 25, train_loss: 0.6937, test_loss: 0.8016, test_f1: 0.6498
 epoch: 26, train_loss: 0.6912, test_loss: 0.8265, test_f1: 0.6361
 epoch: 27, train_loss: 0.6797, test_loss: 0.8374, test_f1: 0.6498
 epoch: 28, train_loss: 0.6680, test_loss: 0.8199, test_f1: 0.6473
 epoch: 29, train_loss: 0.6669, test_loss: 0.8131, test_f1: 0.6525
 epoch: 30, train_loss: 0.6625, test_loss: 0.8459, test_f1: 0.6338
 epoch: 31, train_loss: 0.6467, test_loss: 0.8285, test_f1: 0.6356
 epoch: 32, train_loss: 0.6389, test_loss: 0.8231, test_f1: 0.6510
 epoch: 33, train_loss: 0.6477, test_loss: 0.8342, test_f1: 0.6372
 epoch: 34, train_loss: 0.6379, test_loss: 0.8321, test_f1: 0.6297
 epoch: 35, train_loss: 0.6363, test_loss: 0.8387, test_f1: 0.6553
 epoch: 36, train_loss: 0.6299, test_loss: 0.7927, test_f1: 0.6491
 epoch: 37, train_loss: 0.6408, test_loss: 0.8145, test_f1: 0.6558
 epoch: 38, train_loss: 0.6241, test_loss: 0.8172, test_f1: 0.6442
 epoch: 39, train_loss: 0.6206, test_loss: 0.8234, test_f1: 0.6667
 epoch: 40, train_loss: 0.6166, test_loss: 0.8327, test_f1: 0.6428
 epoch: 41, train_loss: 0.6130, test_loss: 0.8526, test_f1: 0.6383
 epoch: 42, train_loss: 0.6020, test_loss: 0.8308, test_f1: 0.6425
 epoch: 43, train_loss: 0.5938, test_loss: 0.8753, test_f1: 0.6528
 epoch: 44, train_loss: 0.5934, test_loss: 0.8635, test_f1: 0.6417
 epoch: 45, train_loss: 0.5830, test_loss: 0.8906, test_f1: 0.6463
 epoch: 46, train_loss: 0.5709, test_loss: 0.8432, test_f1: 0.6588
 epoch: 47, train_loss: 0.5690, test_loss: 0.8315, test_f1: 0.6619
 epoch: 48, train_loss: 0.5743, test_loss: 0.8368, test_f1: 0.6717
 epoch: 49, train_loss: 0.5709, test_loss: 0.8114, test_f1: 0.6662
 epoch: 50, train_loss: 0.5618, test_loss: 0.8399, test_f1: 0.6385
 epoch: 51, train_loss: 0.5569, test_loss: 0.8564, test_f1: 0.6520
 epoch: 52, train_loss: 0.5527, test_loss: 0.8681, test_f1: 0.6506
 epoch: 53, train_loss: 0.5381, test_loss: 0.8327, test_f1: 0.6423
 epoch: 54, train_loss: 0.5508, test_loss: 0.8452, test_f1: 0.6485
 epoch: 55, train_loss: 0.5304, test_loss: 0.8524, test_f1: 0.6640
 epoch: 56, train_loss: 0.5481, test_loss: 0.8810, test_f1: 0.6452
 epoch: 57, train_loss: 0.5236, test_loss: 0.8942, test_f1: 0.6470
 epoch: 58, train_loss: 0.5236, test_loss: 0.8609, test_f1: 0.6660
 epoch: 59, train_loss: 0.5322, test_loss: 0.8565, test_f1: 0.6582
 epoch: 60, train_loss: 0.5248, test_loss: 0.8680, test_f1: 0.6472
 epoch: 61, train_loss: 0.5217, test_loss: 0.8918, test_f1: 0.6425
 epoch: 62, train_loss: 0.5220, test_loss: 0.8622, test_f1: 0.6780
 epoch: 63, train_loss: 0.5277, test_loss: 0.8559, test_f1: 0.6453
 epoch: 64, train_loss: 0.5203, test_loss: 0.8904, test_f1: 0.6537
 epoch: 65, train_loss: 0.5176, test_loss: 0.8471, test_f1: 0.6648
 epoch: 66, train_loss: 0.5023, test_loss: 0.9081, test_f1: 0.6533
 epoch: 67, train_loss: 0.5150, test_loss: 0.9043, test_f1: 0.6515
 epoch: 68, train_loss: 0.5040, test_loss: 0.9312, test_f1: 0.6354
 epoch: 69, train_loss: 0.5019, test_loss: 0.8672, test_f1: 0.6619
 epoch: 70, train_loss: 0.5020, test_loss: 0.9112, test_f1: 0.6385
 epoch: 71, train_loss: 0.4921, test_loss: 0.8577, test_f1: 0.6635
 epoch: 72, train_loss: 0.5003, test_loss: 0.8938, test_f1: 0.6575
 epoch: 73, train_loss: 0.4961, test_loss: 0.9055, test_f1: 0.6468
 epoch: 74, train_loss: 0.4947, test_loss: 0.9342, test_f1: 0.6426
 epoch: 75, train_loss: 0.4933, test_loss: 0.9226, test_f1: 0.6373
 epoch: 76, train_loss: 0.4863, test_loss: 0.9194, test_f1: 0.6506
 epoch: 77, train_loss: 0.4860, test_loss: 0.9116, test_f1: 0.6445
 epoch: 78, train_loss: 0.4819, test_loss: 0.8770, test_f1: 0.6528
 epoch: 79, train_loss: 0.4736, test_loss: 0.8939, test_f1: 0.6527
 epoch: 80, train_loss: 0.4855, test_loss: 0.9036, test_f1: 0.6589
 epoch: 81, train_loss: 0.4761, test_loss: 0.9080, test_f1: 0.6563
 epoch: 82, train_loss: 0.4745, test_loss: 0.8989, test_f1: 0.6606
 epoch: 83, train_loss: 0.4675, test_loss: 0.8776, test_f1: 0.6543
 epoch: 84, train_loss: 0.4666, test_loss: 0.9067, test_f1: 0.6726
 epoch: 85, train_loss: 0.4638, test_loss: 0.9101, test_f1: 0.6719
 epoch: 86, train_loss: 0.4666, test_loss: 0.9662, test_f1: 0.6558
 epoch: 87, train_loss: 0.4676, test_loss: 0.9546, test_f1: 0.6497
 epoch: 88, train_loss: 0.4571, test_loss: 0.9752, test_f1: 0.6353
 epoch: 89, train_loss: 0.4589, test_loss: 0.9786, test_f1: 0.6540
 epoch: 90, train_loss: 0.4599, test_loss: 0.9297, test_f1: 0.6578
 epoch: 91, train_loss: 0.4679, test_loss: 0.9784, test_f1: 0.6547
 epoch: 92, train_loss: 0.4641, test_loss: 0.9370, test_f1: 0.6759
 epoch: 93, train_loss: 0.4567, test_loss: 0.9393, test_f1: 0.6504
 epoch: 94, train_loss: 0.4476, test_loss: 0.9989, test_f1: 0.6623
 epoch: 95, train_loss: 0.4419, test_loss: 1.0050, test_f1: 0.6650
 epoch: 96, train_loss: 0.4573, test_loss: 0.9809, test_f1: 0.6835
 epoch: 97, train_loss: 0.4477, test_loss: 1.0135, test_f1: 0.6393
 epoch: 98, train_loss: 0.4385, test_loss: 0.9899, test_f1: 0.6652
 epoch: 99, train_loss: 0.4223, test_loss: 1.0035, test_f1: 0.6486
##################ITERATION #6 ****************************************
 epoch: 0, train_loss: 1.2097, test_loss: 1.0107, test_f1: 0.5002
 epoch: 1, train_loss: 1.0741, test_loss: 0.9887, test_f1: 0.5262
 epoch: 2, train_loss: 1.0220, test_loss: 0.9700, test_f1: 0.5368
 epoch: 3, train_loss: 0.9823, test_loss: 0.9508, test_f1: 0.5148
 epoch: 4, train_loss: 0.9601, test_loss: 0.9362, test_f1: 0.5504
 epoch: 5, train_loss: 0.9460, test_loss: 0.9081, test_f1: 0.5508
 epoch: 6, train_loss: 0.9236, test_loss: 0.9171, test_f1: 0.5394
 epoch: 7, train_loss: 0.9092, test_loss: 0.9026, test_f1: 0.5714
 epoch: 8, train_loss: 0.8855, test_loss: 0.9025, test_f1: 0.5547
 epoch: 9, train_loss: 0.8731, test_loss: 0.8784, test_f1: 0.5585
 epoch: 10, train_loss: 0.8565, test_loss: 0.8645, test_f1: 0.6036
 epoch: 11, train_loss: 0.8388, test_loss: 0.8618, test_f1: 0.5754
 epoch: 12, train_loss: 0.8237, test_loss: 0.8804, test_f1: 0.5931
 epoch: 13, train_loss: 0.8174, test_loss: 0.8911, test_f1: 0.5923
 epoch: 14, train_loss: 0.8100, test_loss: 0.8329, test_f1: 0.6482
 epoch: 15, train_loss: 0.8001, test_loss: 0.8540, test_f1: 0.6141
 epoch: 16, train_loss: 0.7764, test_loss: 0.8187, test_f1: 0.6233
 epoch: 17, train_loss: 0.7765, test_loss: 0.8535, test_f1: 0.6034
 epoch: 18, train_loss: 0.7647, test_loss: 0.8152, test_f1: 0.6198
 epoch: 19, train_loss: 0.7595, test_loss: 0.8319, test_f1: 0.6292
 epoch: 20, train_loss: 0.7558, test_loss: 0.8191, test_f1: 0.6181
 epoch: 21, train_loss: 0.7471, test_loss: 0.8602, test_f1: 0.6134
 epoch: 22, train_loss: 0.7295, test_loss: 0.8429, test_f1: 0.6096
 epoch: 23, train_loss: 0.7204, test_loss: 0.8273, test_f1: 0.6072
 epoch: 24, train_loss: 0.7187, test_loss: 0.8111, test_f1: 0.6535
 epoch: 25, train_loss: 0.7147, test_loss: 0.8160, test_f1: 0.6090
 epoch: 26, train_loss: 0.7243, test_loss: 0.8229, test_f1: 0.6322
 epoch: 27, train_loss: 0.6860, test_loss: 0.8248, test_f1: 0.6296
 epoch: 28, train_loss: 0.6932, test_loss: 0.8294, test_f1: 0.6206
 epoch: 29, train_loss: 0.6769, test_loss: 0.8052, test_f1: 0.6374
 epoch: 30, train_loss: 0.6957, test_loss: 0.8120, test_f1: 0.6116
 epoch: 31, train_loss: 0.6809, test_loss: 0.8021, test_f1: 0.6376
 epoch: 32, train_loss: 0.6589, test_loss: 0.7809, test_f1: 0.6277
 epoch: 33, train_loss: 0.6636, test_loss: 0.8026, test_f1: 0.6472
 epoch: 34, train_loss: 0.6546, test_loss: 0.7870, test_f1: 0.6618
 epoch: 35, train_loss: 0.6513, test_loss: 0.8266, test_f1: 0.6451
 epoch: 36, train_loss: 0.6553, test_loss: 0.8420, test_f1: 0.6435
 epoch: 37, train_loss: 0.6498, test_loss: 0.7702, test_f1: 0.6211
 epoch: 38, train_loss: 0.6376, test_loss: 0.8088, test_f1: 0.6275
 epoch: 39, train_loss: 0.6259, test_loss: 0.8097, test_f1: 0.6373
 epoch: 40, train_loss: 0.6253, test_loss: 0.7944, test_f1: 0.6313
 epoch: 41, train_loss: 0.6194, test_loss: 0.7727, test_f1: 0.6216
 epoch: 42, train_loss: 0.6139, test_loss: 0.7878, test_f1: 0.6370
 epoch: 43, train_loss: 0.6045, test_loss: 0.7659, test_f1: 0.6528
 epoch: 44, train_loss: 0.6072, test_loss: 0.7680, test_f1: 0.6364
 epoch: 45, train_loss: 0.6039, test_loss: 0.9592, test_f1: 0.6279
 epoch: 46, train_loss: 0.5899, test_loss: 0.8034, test_f1: 0.6368
 epoch: 47, train_loss: 0.5858, test_loss: 0.8548, test_f1: 0.6390
 epoch: 48, train_loss: 0.5844, test_loss: 0.7627, test_f1: 0.6549
 epoch: 49, train_loss: 0.5828, test_loss: 0.8011, test_f1: 0.6356
 epoch: 50, train_loss: 0.5834, test_loss: 0.8189, test_f1: 0.6283
 epoch: 51, train_loss: 0.5675, test_loss: 0.8117, test_f1: 0.6381
 epoch: 52, train_loss: 0.5543, test_loss: 0.7976, test_f1: 0.6545
 epoch: 53, train_loss: 0.5645, test_loss: 0.7707, test_f1: 0.6614
 epoch: 54, train_loss: 0.5505, test_loss: 0.8079, test_f1: 0.6576
 epoch: 55, train_loss: 0.5459, test_loss: 0.8019, test_f1: 0.6422
 epoch: 56, train_loss: 0.5432, test_loss: 0.7541, test_f1: 0.6574
 epoch: 57, train_loss: 0.5547, test_loss: 0.7600, test_f1: 0.6364
 epoch: 58, train_loss: 0.5394, test_loss: 0.7540, test_f1: 0.6474
 epoch: 59, train_loss: 0.5361, test_loss: 0.7826, test_f1: 0.6565
 epoch: 60, train_loss: 0.5300, test_loss: 0.8094, test_f1: 0.6671
 epoch: 61, train_loss: 0.5348, test_loss: 0.7764, test_f1: 0.6571
 epoch: 62, train_loss: 0.5177, test_loss: 0.7860, test_f1: 0.6542
 epoch: 63, train_loss: 0.5343, test_loss: 0.8007, test_f1: 0.6279
 epoch: 64, train_loss: 0.5262, test_loss: 0.7948, test_f1: 0.6619
 epoch: 65, train_loss: 0.5246, test_loss: 0.7591, test_f1: 0.6469
 epoch: 66, train_loss: 0.5093, test_loss: 0.7727, test_f1: 0.6639
 epoch: 67, train_loss: 0.5200, test_loss: 0.7902, test_f1: 0.6557
 epoch: 68, train_loss: 0.5180, test_loss: 0.8082, test_f1: 0.6371
 epoch: 69, train_loss: 0.5099, test_loss: 0.8114, test_f1: 0.6596
 epoch: 70, train_loss: 0.5099, test_loss: 0.7716, test_f1: 0.6661
 epoch: 71, train_loss: 0.5232, test_loss: 0.7885, test_f1: 0.6292
 epoch: 72, train_loss: 0.5061, test_loss: 0.7863, test_f1: 0.6605
 epoch: 73, train_loss: 0.5053, test_loss: 0.7909, test_f1: 0.6434
 epoch: 74, train_loss: 0.5065, test_loss: 0.8061, test_f1: 0.6444
 epoch: 75, train_loss: 0.5069, test_loss: 0.8760, test_f1: 0.6335
 epoch: 76, train_loss: 0.5072, test_loss: 0.8363, test_f1: 0.6570
 epoch: 77, train_loss: 0.4836, test_loss: 0.8553, test_f1: 0.6367
 epoch: 78, train_loss: 0.4993, test_loss: 0.8347, test_f1: 0.6637
 epoch: 79, train_loss: 0.5150, test_loss: 0.8268, test_f1: 0.6342
 epoch: 80, train_loss: 0.4800, test_loss: 0.8602, test_f1: 0.6780
 epoch: 81, train_loss: 0.4753, test_loss: 0.8653, test_f1: 0.6415
 epoch: 82, train_loss: 0.4778, test_loss: 0.8698, test_f1: 0.6339
 epoch: 83, train_loss: 0.4738, test_loss: 0.8603, test_f1: 0.6474
 epoch: 84, train_loss: 0.4842, test_loss: 0.8246, test_f1: 0.6502
 epoch: 85, train_loss: 0.4832, test_loss: 0.7901, test_f1: 0.6458
 epoch: 86, train_loss: 0.4702, test_loss: 0.8190, test_f1: 0.6441
 epoch: 87, train_loss: 0.4856, test_loss: 0.8076, test_f1: 0.6518
 epoch: 88, train_loss: 0.4778, test_loss: 0.8701, test_f1: 0.6632
 epoch: 89, train_loss: 0.4683, test_loss: 0.8276, test_f1: 0.6535
 epoch: 90, train_loss: 0.4769, test_loss: 0.8317, test_f1: 0.6470
 epoch: 91, train_loss: 0.4734, test_loss: 0.9375, test_f1: 0.6318
 epoch: 92, train_loss: 0.4656, test_loss: 0.8994, test_f1: 0.6457
 epoch: 93, train_loss: 0.4818, test_loss: 0.8753, test_f1: 0.6452
 epoch: 94, train_loss: 0.4615, test_loss: 0.8871, test_f1: 0.6622
 epoch: 95, train_loss: 0.4637, test_loss: 0.9299, test_f1: 0.6362
 epoch: 96, train_loss: 0.4611, test_loss: 0.8725, test_f1: 0.6424
 epoch: 97, train_loss: 0.4574, test_loss: 0.9128, test_f1: 0.6294
 epoch: 98, train_loss: 0.4442, test_loss: 0.8536, test_f1: 0.6491
 epoch: 99, train_loss: 0.4610, test_loss: 0.8636, test_f1: 0.6517
##################ITERATION #7 ****************************************
 epoch: 0, train_loss: 1.1582, test_loss: 0.9740, test_f1: 0.4865
 epoch: 1, train_loss: 1.0371, test_loss: 0.9436, test_f1: 0.5143
 epoch: 2, train_loss: 0.9832, test_loss: 0.9596, test_f1: 0.5028
 epoch: 3, train_loss: 0.9639, test_loss: 0.9229, test_f1: 0.5386
 epoch: 4, train_loss: 0.9345, test_loss: 0.9204, test_f1: 0.5357
 epoch: 5, train_loss: 0.9144, test_loss: 0.9392, test_f1: 0.5346
 epoch: 6, train_loss: 0.8976, test_loss: 0.9168, test_f1: 0.5402
 epoch: 7, train_loss: 0.8773, test_loss: 0.9127, test_f1: 0.5620
 epoch: 8, train_loss: 0.8720, test_loss: 0.9483, test_f1: 0.5141
 epoch: 9, train_loss: 0.8590, test_loss: 0.9022, test_f1: 0.5372
 epoch: 10, train_loss: 0.8427, test_loss: 0.8998, test_f1: 0.5622
 epoch: 11, train_loss: 0.8243, test_loss: 0.9143, test_f1: 0.5521
 epoch: 12, train_loss: 0.8302, test_loss: 0.8842, test_f1: 0.5813
 epoch: 13, train_loss: 0.8169, test_loss: 0.8659, test_f1: 0.5673
 epoch: 14, train_loss: 0.8050, test_loss: 0.8998, test_f1: 0.5701
 epoch: 15, train_loss: 0.8042, test_loss: 0.8924, test_f1: 0.5951
 epoch: 16, train_loss: 0.7800, test_loss: 0.8874, test_f1: 0.6192
 epoch: 17, train_loss: 0.7705, test_loss: 0.9152, test_f1: 0.5784
 epoch: 18, train_loss: 0.7677, test_loss: 0.8694, test_f1: 0.6018
 epoch: 19, train_loss: 0.7603, test_loss: 0.8857, test_f1: 0.5824
 epoch: 20, train_loss: 0.7469, test_loss: 0.8752, test_f1: 0.5932
 epoch: 21, train_loss: 0.7446, test_loss: 0.8573, test_f1: 0.6112
 epoch: 22, train_loss: 0.7306, test_loss: 0.8856, test_f1: 0.6043
 epoch: 23, train_loss: 0.7379, test_loss: 0.8658, test_f1: 0.6325
 epoch: 24, train_loss: 0.7228, test_loss: 0.8819, test_f1: 0.6133
 epoch: 25, train_loss: 0.7134, test_loss: 0.8615, test_f1: 0.6442
 epoch: 26, train_loss: 0.7088, test_loss: 0.9110, test_f1: 0.5863
 epoch: 27, train_loss: 0.7013, test_loss: 0.8368, test_f1: 0.6218
 epoch: 28, train_loss: 0.6794, test_loss: 0.8544, test_f1: 0.6335
 epoch: 29, train_loss: 0.6799, test_loss: 0.8461, test_f1: 0.6325
 epoch: 30, train_loss: 0.6862, test_loss: 0.8849, test_f1: 0.6413
 epoch: 31, train_loss: 0.6782, test_loss: 0.8649, test_f1: 0.6295
 epoch: 32, train_loss: 0.6781, test_loss: 0.8650, test_f1: 0.6268
 epoch: 33, train_loss: 0.6539, test_loss: 0.8696, test_f1: 0.6313
 epoch: 34, train_loss: 0.6589, test_loss: 0.8095, test_f1: 0.6645
 epoch: 35, train_loss: 0.6404, test_loss: 0.8536, test_f1: 0.6450
 epoch: 36, train_loss: 0.6312, test_loss: 0.9343, test_f1: 0.6145
 epoch: 37, train_loss: 0.6372, test_loss: 0.8361, test_f1: 0.6589
 epoch: 38, train_loss: 0.6440, test_loss: 0.8580, test_f1: 0.6482
 epoch: 39, train_loss: 0.6215, test_loss: 0.8446, test_f1: 0.6547
 epoch: 40, train_loss: 0.6253, test_loss: 0.8795, test_f1: 0.6285
 epoch: 41, train_loss: 0.6234, test_loss: 0.8703, test_f1: 0.6573
 epoch: 42, train_loss: 0.6157, test_loss: 0.8833, test_f1: 0.6322
 epoch: 43, train_loss: 0.6159, test_loss: 0.8329, test_f1: 0.6621
 epoch: 44, train_loss: 0.5988, test_loss: 0.8211, test_f1: 0.6585
 epoch: 45, train_loss: 0.5956, test_loss: 0.8521, test_f1: 0.6423
 epoch: 46, train_loss: 0.5817, test_loss: 0.8132, test_f1: 0.6465
 epoch: 47, train_loss: 0.5923, test_loss: 0.9027, test_f1: 0.6474
 epoch: 48, train_loss: 0.5785, test_loss: 0.8637, test_f1: 0.6460
 epoch: 49, train_loss: 0.5878, test_loss: 0.8771, test_f1: 0.6516
 epoch: 50, train_loss: 0.5667, test_loss: 0.9052, test_f1: 0.6367
 epoch: 51, train_loss: 0.5652, test_loss: 0.9037, test_f1: 0.6295
 epoch: 52, train_loss: 0.5488, test_loss: 0.9374, test_f1: 0.6310
 epoch: 53, train_loss: 0.5570, test_loss: 0.8529, test_f1: 0.6582
 epoch: 54, train_loss: 0.5522, test_loss: 0.8509, test_f1: 0.6439
 epoch: 55, train_loss: 0.5298, test_loss: 0.8472, test_f1: 0.6754
 epoch: 56, train_loss: 0.5346, test_loss: 0.8515, test_f1: 0.6552
 epoch: 57, train_loss: 0.5389, test_loss: 0.8633, test_f1: 0.6472
 epoch: 58, train_loss: 0.5379, test_loss: 0.9206, test_f1: 0.6328
 epoch: 59, train_loss: 0.5361, test_loss: 0.8356, test_f1: 0.6767
 epoch: 60, train_loss: 0.5360, test_loss: 0.8542, test_f1: 0.6334
 epoch: 61, train_loss: 0.5232, test_loss: 0.8414, test_f1: 0.6472
 epoch: 62, train_loss: 0.5210, test_loss: 0.8721, test_f1: 0.6209
 epoch: 63, train_loss: 0.5230, test_loss: 0.8594, test_f1: 0.6416
 epoch: 64, train_loss: 0.5192, test_loss: 0.8323, test_f1: 0.6770
 epoch: 65, train_loss: 0.5154, test_loss: 0.8521, test_f1: 0.6535
 epoch: 66, train_loss: 0.5078, test_loss: 0.8637, test_f1: 0.6598
 epoch: 67, train_loss: 0.5142, test_loss: 0.8725, test_f1: 0.6484
 epoch: 68, train_loss: 0.5111, test_loss: 0.8579, test_f1: 0.6827
 epoch: 69, train_loss: 0.4943, test_loss: 0.8461, test_f1: 0.6498
 epoch: 70, train_loss: 0.5088, test_loss: 0.8900, test_f1: 0.6474
 epoch: 71, train_loss: 0.5049, test_loss: 0.8654, test_f1: 0.6576
 epoch: 72, train_loss: 0.4936, test_loss: 0.9452, test_f1: 0.6415
 epoch: 73, train_loss: 0.4924, test_loss: 0.8750, test_f1: 0.6438
 epoch: 74, train_loss: 0.4994, test_loss: 0.9051, test_f1: 0.6553
 epoch: 75, train_loss: 0.4993, test_loss: 0.8900, test_f1: 0.6465
 epoch: 76, train_loss: 0.4967, test_loss: 0.8893, test_f1: 0.6317
 epoch: 77, train_loss: 0.4848, test_loss: 0.9176, test_f1: 0.6375
 epoch: 78, train_loss: 0.4842, test_loss: 0.9183, test_f1: 0.6655
 epoch: 79, train_loss: 0.4898, test_loss: 0.8810, test_f1: 0.6654
 epoch: 80, train_loss: 0.4716, test_loss: 0.9016, test_f1: 0.6562
 epoch: 81, train_loss: 0.4913, test_loss: 0.8964, test_f1: 0.6519
 epoch: 82, train_loss: 0.4750, test_loss: 0.8677, test_f1: 0.6696
 epoch: 83, train_loss: 0.4792, test_loss: 0.9056, test_f1: 0.6264
 epoch: 84, train_loss: 0.4753, test_loss: 0.8447, test_f1: 0.6648
 epoch: 85, train_loss: 0.4813, test_loss: 0.8483, test_f1: 0.6536
 epoch: 86, train_loss: 0.4634, test_loss: 0.9405, test_f1: 0.6563
 epoch: 87, train_loss: 0.4615, test_loss: 0.8857, test_f1: 0.6480
 epoch: 88, train_loss: 0.4644, test_loss: 0.9524, test_f1: 0.6463
 epoch: 89, train_loss: 0.4621, test_loss: 0.9326, test_f1: 0.6572
 epoch: 90, train_loss: 0.4800, test_loss: 0.9252, test_f1: 0.6482
 epoch: 91, train_loss: 0.4541, test_loss: 0.8964, test_f1: 0.6666
 epoch: 92, train_loss: 0.4525, test_loss: 0.8837, test_f1: 0.6742
 epoch: 93, train_loss: 0.4596, test_loss: 0.8734, test_f1: 0.6818
 epoch: 94, train_loss: 0.4533, test_loss: 0.9027, test_f1: 0.6609
 epoch: 95, train_loss: 0.4532, test_loss: 0.9226, test_f1: 0.6385
 epoch: 96, train_loss: 0.4432, test_loss: 0.8980, test_f1: 0.6652
 epoch: 97, train_loss: 0.4513, test_loss: 0.9654, test_f1: 0.6366
 epoch: 98, train_loss: 0.4481, test_loss: 0.9131, test_f1: 0.6637
 epoch: 99, train_loss: 0.4434, test_loss: 0.9743, test_f1: 0.6338
##################ITERATION #8 ****************************************
 epoch: 0, train_loss: 1.2042, test_loss: 1.0180, test_f1: 0.4660
 epoch: 1, train_loss: 1.0691, test_loss: 0.9813, test_f1: 0.4663
 epoch: 2, train_loss: 1.0239, test_loss: 0.9613, test_f1: 0.4911
 epoch: 3, train_loss: 1.0028, test_loss: 0.9175, test_f1: 0.5442
 epoch: 4, train_loss: 0.9538, test_loss: 0.9296, test_f1: 0.4904
 epoch: 5, train_loss: 0.9502, test_loss: 0.9142, test_f1: 0.5175
 epoch: 6, train_loss: 0.9334, test_loss: 0.9187, test_f1: 0.5414
 epoch: 7, train_loss: 0.9075, test_loss: 0.8763, test_f1: 0.5605
 epoch: 8, train_loss: 0.9008, test_loss: 0.9138, test_f1: 0.5593
 epoch: 9, train_loss: 0.8822, test_loss: 0.8797, test_f1: 0.5593
 epoch: 10, train_loss: 0.8635, test_loss: 0.9065, test_f1: 0.5283
 epoch: 11, train_loss: 0.8534, test_loss: 0.8980, test_f1: 0.5569
 epoch: 12, train_loss: 0.8474, test_loss: 0.9042, test_f1: 0.5444
 epoch: 13, train_loss: 0.8290, test_loss: 0.8508, test_f1: 0.6036
 epoch: 14, train_loss: 0.8173, test_loss: 0.8632, test_f1: 0.5816
 epoch: 15, train_loss: 0.8127, test_loss: 0.8736, test_f1: 0.6212
 epoch: 16, train_loss: 0.8045, test_loss: 0.9033, test_f1: 0.5796
 epoch: 17, train_loss: 0.7951, test_loss: 0.8794, test_f1: 0.5657
 epoch: 18, train_loss: 0.7739, test_loss: 0.8346, test_f1: 0.5892
 epoch: 19, train_loss: 0.7703, test_loss: 0.8797, test_f1: 0.5847
 epoch: 20, train_loss: 0.7692, test_loss: 0.8840, test_f1: 0.5927
 epoch: 21, train_loss: 0.7590, test_loss: 0.8779, test_f1: 0.5779
 epoch: 22, train_loss: 0.7547, test_loss: 0.7868, test_f1: 0.6068
 epoch: 23, train_loss: 0.7521, test_loss: 0.8336, test_f1: 0.6081
 epoch: 24, train_loss: 0.7427, test_loss: 0.8687, test_f1: 0.5936
 epoch: 25, train_loss: 0.7328, test_loss: 0.8611, test_f1: 0.6091
 epoch: 26, train_loss: 0.7291, test_loss: 0.8319, test_f1: 0.6157
 epoch: 27, train_loss: 0.7234, test_loss: 0.8297, test_f1: 0.6243
 epoch: 28, train_loss: 0.7140, test_loss: 0.8170, test_f1: 0.6190
 epoch: 29, train_loss: 0.7115, test_loss: 0.8538, test_f1: 0.6219
 epoch: 30, train_loss: 0.7069, test_loss: 0.8396, test_f1: 0.5927
 epoch: 31, train_loss: 0.6976, test_loss: 0.8303, test_f1: 0.6120
 epoch: 32, train_loss: 0.6990, test_loss: 0.8138, test_f1: 0.6248
 epoch: 33, train_loss: 0.6775, test_loss: 0.8277, test_f1: 0.6328
 epoch: 34, train_loss: 0.6780, test_loss: 0.8180, test_f1: 0.6126
 epoch: 35, train_loss: 0.6700, test_loss: 0.8654, test_f1: 0.5950
 epoch: 36, train_loss: 0.6762, test_loss: 0.7934, test_f1: 0.6233
 epoch: 37, train_loss: 0.6677, test_loss: 0.8491, test_f1: 0.6124
 epoch: 38, train_loss: 0.6691, test_loss: 0.8478, test_f1: 0.5754
 epoch: 39, train_loss: 0.6597, test_loss: 0.8309, test_f1: 0.6333
 epoch: 40, train_loss: 0.6447, test_loss: 0.8393, test_f1: 0.6345
 epoch: 41, train_loss: 0.6401, test_loss: 0.9137, test_f1: 0.6079
 epoch: 42, train_loss: 0.6509, test_loss: 0.8420, test_f1: 0.6312
 epoch: 43, train_loss: 0.6286, test_loss: 0.8641, test_f1: 0.6133
 epoch: 44, train_loss: 0.6393, test_loss: 0.8510, test_f1: 0.6153
 epoch: 45, train_loss: 0.6134, test_loss: 0.8258, test_f1: 0.6422
 epoch: 46, train_loss: 0.6119, test_loss: 0.8467, test_f1: 0.6096
 epoch: 47, train_loss: 0.6254, test_loss: 0.8667, test_f1: 0.6192
 epoch: 48, train_loss: 0.6288, test_loss: 0.8381, test_f1: 0.6494
 epoch: 49, train_loss: 0.6167, test_loss: 0.8259, test_f1: 0.6264
 epoch: 50, train_loss: 0.6085, test_loss: 0.9114, test_f1: 0.6128
 epoch: 51, train_loss: 0.5845, test_loss: 0.8092, test_f1: 0.6297
 epoch: 52, train_loss: 0.5804, test_loss: 0.8622, test_f1: 0.6314
 epoch: 53, train_loss: 0.5830, test_loss: 0.8714, test_f1: 0.6282
 epoch: 54, train_loss: 0.5843, test_loss: 0.8454, test_f1: 0.6349
 epoch: 55, train_loss: 0.5771, test_loss: 0.8416, test_f1: 0.6252
 epoch: 56, train_loss: 0.5756, test_loss: 0.8140, test_f1: 0.6402
 epoch: 57, train_loss: 0.5651, test_loss: 0.8815, test_f1: 0.6215
 epoch: 58, train_loss: 0.5639, test_loss: 0.8638, test_f1: 0.6173
 epoch: 59, train_loss: 0.5719, test_loss: 0.7958, test_f1: 0.6330
 epoch: 60, train_loss: 0.5690, test_loss: 0.8547, test_f1: 0.6154
 epoch: 61, train_loss: 0.5618, test_loss: 0.8286, test_f1: 0.6521
 epoch: 62, train_loss: 0.5461, test_loss: 0.8357, test_f1: 0.6525
 epoch: 63, train_loss: 0.5401, test_loss: 0.7948, test_f1: 0.6346
 epoch: 64, train_loss: 0.5570, test_loss: 0.8313, test_f1: 0.6414
 epoch: 65, train_loss: 0.5522, test_loss: 0.8120, test_f1: 0.6506
 epoch: 66, train_loss: 0.5455, test_loss: 0.9132, test_f1: 0.6391
 epoch: 67, train_loss: 0.5367, test_loss: 0.8476, test_f1: 0.6442
 epoch: 68, train_loss: 0.5454, test_loss: 0.8385, test_f1: 0.6638
 epoch: 69, train_loss: 0.5336, test_loss: 0.8305, test_f1: 0.6308
 epoch: 70, train_loss: 0.5384, test_loss: 0.8186, test_f1: 0.6650
 epoch: 71, train_loss: 0.5329, test_loss: 0.8630, test_f1: 0.6453
 epoch: 72, train_loss: 0.5387, test_loss: 0.8201, test_f1: 0.6309
 epoch: 73, train_loss: 0.5233, test_loss: 0.8461, test_f1: 0.6416
 epoch: 74, train_loss: 0.5202, test_loss: 0.8328, test_f1: 0.6535
 epoch: 75, train_loss: 0.5282, test_loss: 0.9419, test_f1: 0.6283
 epoch: 76, train_loss: 0.5213, test_loss: 0.8796, test_f1: 0.6575
 epoch: 77, train_loss: 0.5211, test_loss: 0.8688, test_f1: 0.6634
 epoch: 78, train_loss: 0.5167, test_loss: 0.8834, test_f1: 0.6419
 epoch: 79, train_loss: 0.5189, test_loss: 0.9049, test_f1: 0.6250
 epoch: 80, train_loss: 0.4996, test_loss: 0.8765, test_f1: 0.6624
 epoch: 81, train_loss: 0.5194, test_loss: 0.8961, test_f1: 0.6296
 epoch: 82, train_loss: 0.5101, test_loss: 0.9050, test_f1: 0.6545
 epoch: 83, train_loss: 0.5072, test_loss: 0.9260, test_f1: 0.6324
 epoch: 84, train_loss: 0.5193, test_loss: 0.8528, test_f1: 0.6591
 epoch: 85, train_loss: 0.5047, test_loss: 0.8338, test_f1: 0.6702
 epoch: 86, train_loss: 0.5067, test_loss: 0.8503, test_f1: 0.6554
 epoch: 87, train_loss: 0.5078, test_loss: 0.8544, test_f1: 0.6514
 epoch: 88, train_loss: 0.5043, test_loss: 0.9184, test_f1: 0.6597
 epoch: 89, train_loss: 0.5041, test_loss: 0.8781, test_f1: 0.6475
 epoch: 90, train_loss: 0.4858, test_loss: 0.9173, test_f1: 0.6373
 epoch: 91, train_loss: 0.4971, test_loss: 0.8939, test_f1: 0.6464
 epoch: 92, train_loss: 0.4886, test_loss: 0.8873, test_f1: 0.6524
 epoch: 93, train_loss: 0.4981, test_loss: 0.9475, test_f1: 0.6488
 epoch: 94, train_loss: 0.4817, test_loss: 0.8737, test_f1: 0.6469
 epoch: 95, train_loss: 0.4818, test_loss: 0.9112, test_f1: 0.6503
 epoch: 96, train_loss: 0.4692, test_loss: 0.9288, test_f1: 0.6646
 epoch: 97, train_loss: 0.4896, test_loss: 0.9366, test_f1: 0.6616
 epoch: 98, train_loss: 0.4873, test_loss: 0.9216, test_f1: 0.6662
 epoch: 99, train_loss: 0.4805, test_loss: 0.9421, test_f1: 0.6507
##################ITERATION #9 ****************************************
 epoch: 0, train_loss: 1.2494, test_loss: 1.0084, test_f1: 0.5133
 epoch: 1, train_loss: 1.0730, test_loss: 0.9785, test_f1: 0.5061
 epoch: 2, train_loss: 1.0097, test_loss: 0.9407, test_f1: 0.5022
 epoch: 3, train_loss: 0.9773, test_loss: 0.9329, test_f1: 0.5532
 epoch: 4, train_loss: 0.9611, test_loss: 0.9402, test_f1: 0.5615
 epoch: 5, train_loss: 0.9467, test_loss: 0.9063, test_f1: 0.5745
 epoch: 6, train_loss: 0.9230, test_loss: 0.8924, test_f1: 0.5574
 epoch: 7, train_loss: 0.9046, test_loss: 0.9050, test_f1: 0.5850
 epoch: 8, train_loss: 0.8832, test_loss: 0.9232, test_f1: 0.5555
 epoch: 9, train_loss: 0.8760, test_loss: 0.8656, test_f1: 0.5595
 epoch: 10, train_loss: 0.8624, test_loss: 0.8447, test_f1: 0.5794
 epoch: 11, train_loss: 0.8481, test_loss: 0.8680, test_f1: 0.5632
 epoch: 12, train_loss: 0.8319, test_loss: 0.8328, test_f1: 0.6108
 epoch: 13, train_loss: 0.8292, test_loss: 0.8755, test_f1: 0.6102
 epoch: 14, train_loss: 0.8145, test_loss: 0.8410, test_f1: 0.5967
 epoch: 15, train_loss: 0.8015, test_loss: 0.8235, test_f1: 0.5946
 epoch: 16, train_loss: 0.7978, test_loss: 0.8396, test_f1: 0.6178
 epoch: 17, train_loss: 0.7961, test_loss: 0.8359, test_f1: 0.6109
 epoch: 18, train_loss: 0.7827, test_loss: 0.8076, test_f1: 0.6141
 epoch: 19, train_loss: 0.7608, test_loss: 0.8074, test_f1: 0.6296
 epoch: 20, train_loss: 0.7642, test_loss: 0.7911, test_f1: 0.6398
 epoch: 21, train_loss: 0.7486, test_loss: 0.8317, test_f1: 0.6440
 epoch: 22, train_loss: 0.7389, test_loss: 0.8462, test_f1: 0.6135
 epoch: 23, train_loss: 0.7375, test_loss: 0.8059, test_f1: 0.6305
 epoch: 24, train_loss: 0.7266, test_loss: 0.7995, test_f1: 0.6481
 epoch: 25, train_loss: 0.7348, test_loss: 0.8096, test_f1: 0.6397
 epoch: 26, train_loss: 0.7271, test_loss: 0.8109, test_f1: 0.6257
 epoch: 27, train_loss: 0.7173, test_loss: 0.7925, test_f1: 0.6381
 epoch: 28, train_loss: 0.7154, test_loss: 0.8443, test_f1: 0.6233
 epoch: 29, train_loss: 0.7071, test_loss: 0.8448, test_f1: 0.6154
 epoch: 30, train_loss: 0.6976, test_loss: 0.8085, test_f1: 0.6221
 epoch: 31, train_loss: 0.6965, test_loss: 0.8128, test_f1: 0.6463
 epoch: 32, train_loss: 0.6775, test_loss: 0.8072, test_f1: 0.6226
 epoch: 33, train_loss: 0.6886, test_loss: 0.7988, test_f1: 0.6406
 epoch: 34, train_loss: 0.6741, test_loss: 0.8669, test_f1: 0.6162
 epoch: 35, train_loss: 0.6611, test_loss: 0.8111, test_f1: 0.6270
 epoch: 36, train_loss: 0.6615, test_loss: 0.7991, test_f1: 0.6369
 epoch: 37, train_loss: 0.6567, test_loss: 0.7994, test_f1: 0.6283
 epoch: 38, train_loss: 0.6503, test_loss: 0.8272, test_f1: 0.6437
 epoch: 39, train_loss: 0.6416, test_loss: 0.7931, test_f1: 0.6493
 epoch: 40, train_loss: 0.6422, test_loss: 0.8168, test_f1: 0.6359
 epoch: 41, train_loss: 0.6385, test_loss: 0.7771, test_f1: 0.6544
 epoch: 42, train_loss: 0.6296, test_loss: 0.7697, test_f1: 0.6717
 epoch: 43, train_loss: 0.6263, test_loss: 0.7995, test_f1: 0.6394
 epoch: 44, train_loss: 0.6219, test_loss: 0.8012, test_f1: 0.6236
 epoch: 45, train_loss: 0.6093, test_loss: 0.7985, test_f1: 0.6610
 epoch: 46, train_loss: 0.6065, test_loss: 0.8267, test_f1: 0.6479
 epoch: 47, train_loss: 0.6035, test_loss: 0.7922, test_f1: 0.6366
 epoch: 48, train_loss: 0.6051, test_loss: 0.7872, test_f1: 0.6551
 epoch: 49, train_loss: 0.6012, test_loss: 0.8042, test_f1: 0.6542
 epoch: 50, train_loss: 0.5956, test_loss: 0.8089, test_f1: 0.6544
 epoch: 51, train_loss: 0.5766, test_loss: 0.8034, test_f1: 0.6623
 epoch: 52, train_loss: 0.5735, test_loss: 0.7816, test_f1: 0.6614
 epoch: 53, train_loss: 0.5559, test_loss: 0.7969, test_f1: 0.6537
 epoch: 54, train_loss: 0.5549, test_loss: 0.8042, test_f1: 0.6638
 epoch: 55, train_loss: 0.5580, test_loss: 0.7915, test_f1: 0.6690
 epoch: 56, train_loss: 0.5559, test_loss: 0.7984, test_f1: 0.6716
 epoch: 57, train_loss: 0.5542, test_loss: 0.8082, test_f1: 0.6349
 epoch: 58, train_loss: 0.5556, test_loss: 0.7814, test_f1: 0.6702
 epoch: 59, train_loss: 0.5456, test_loss: 0.7918, test_f1: 0.6747
 epoch: 60, train_loss: 0.5603, test_loss: 0.8049, test_f1: 0.6525
 epoch: 61, train_loss: 0.5435, test_loss: 0.8064, test_f1: 0.6553
 epoch: 62, train_loss: 0.5377, test_loss: 0.8088, test_f1: 0.6516
 epoch: 63, train_loss: 0.5427, test_loss: 0.8068, test_f1: 0.6756
 epoch: 64, train_loss: 0.5425, test_loss: 0.8064, test_f1: 0.6722
 epoch: 65, train_loss: 0.5428, test_loss: 0.8094, test_f1: 0.6553
 epoch: 66, train_loss: 0.5350, test_loss: 0.8011, test_f1: 0.6706
 epoch: 67, train_loss: 0.5292, test_loss: 0.7994, test_f1: 0.6441
 epoch: 68, train_loss: 0.5434, test_loss: 0.8248, test_f1: 0.6567
 epoch: 69, train_loss: 0.5332, test_loss: 0.8005, test_f1: 0.6595
 epoch: 70, train_loss: 0.5270, test_loss: 0.8002, test_f1: 0.6731
 epoch: 71, train_loss: 0.5259, test_loss: 0.8418, test_f1: 0.6497
 epoch: 72, train_loss: 0.5140, test_loss: 0.8353, test_f1: 0.6565
 epoch: 73, train_loss: 0.5289, test_loss: 0.8181, test_f1: 0.6700
 epoch: 74, train_loss: 0.5075, test_loss: 0.8305, test_f1: 0.6582
 epoch: 75, train_loss: 0.5086, test_loss: 0.8005, test_f1: 0.6710
 epoch: 76, train_loss: 0.5142, test_loss: 0.8284, test_f1: 0.6662
 epoch: 77, train_loss: 0.5130, test_loss: 0.8337, test_f1: 0.6460
 epoch: 78, train_loss: 0.5088, test_loss: 0.8474, test_f1: 0.6441
 epoch: 79, train_loss: 0.5091, test_loss: 0.8486, test_f1: 0.6465
 epoch: 80, train_loss: 0.5028, test_loss: 0.8129, test_f1: 0.6727
 epoch: 81, train_loss: 0.4952, test_loss: 0.8192, test_f1: 0.6650
 epoch: 82, train_loss: 0.4918, test_loss: 0.8151, test_f1: 0.6686
 epoch: 83, train_loss: 0.4888, test_loss: 0.8339, test_f1: 0.6524
 epoch: 84, train_loss: 0.4937, test_loss: 0.8407, test_f1: 0.6704
 epoch: 85, train_loss: 0.4873, test_loss: 0.8322, test_f1: 0.6766
 epoch: 86, train_loss: 0.4955, test_loss: 0.8542, test_f1: 0.6600
 epoch: 87, train_loss: 0.4950, test_loss: 0.8608, test_f1: 0.6837
 epoch: 88, train_loss: 0.5015, test_loss: 0.8800, test_f1: 0.6487
 epoch: 89, train_loss: 0.4985, test_loss: 0.8900, test_f1: 0.6335
 epoch: 90, train_loss: 0.4711, test_loss: 0.8630, test_f1: 0.6508
 epoch: 91, train_loss: 0.4912, test_loss: 0.8388, test_f1: 0.6644
 epoch: 92, train_loss: 0.4855, test_loss: 0.8307, test_f1: 0.6808
 epoch: 93, train_loss: 0.4903, test_loss: 0.8868, test_f1: 0.6345
 epoch: 94, train_loss: 0.4786, test_loss: 0.9088, test_f1: 0.6447
 epoch: 95, train_loss: 0.4811, test_loss: 0.8731, test_f1: 0.6575
 epoch: 96, train_loss: 0.4535, test_loss: 0.8326, test_f1: 0.6600
 epoch: 97, train_loss: 0.4569, test_loss: 0.8842, test_f1: 0.6586
 epoch: 98, train_loss: 0.4709, test_loss: 0.8278, test_f1: 0.6619
 epoch: 99, train_loss: 0.4590, test_loss: 0.8618, test_f1: 0.6499

Training completed in 820.73 seconds
Best F1: 0.6856 at epoch 84
Mean F1 across iterations: 0.6742  0.0097
========================FINAL RESULTS================================
FEGIN weighted F1: 0.6856  0.0097
python main.py --data ltspice_examples --representation component_pin --model FEGIN --layers 2 --hiddens 128 --batch_size 32 --lr 0.0001 --emb_size 128 --epochs 100 --save_appendix component_pin_L2_H128_BS32_LR0.0001_E128 --no_val
-----



STDERR:
  File "main.py", line 370, in <module>
    main()
  File "main.py", line 254, in main
    dataset = dataset_class(
  File "/home/philip/projects/ltspice_examples_code_repo/Circuit-Completion-Using-GNNs/component_classification_with_link_prediction_head/evaluation/FEGIN/kernel/circuit_datasets.py", line 15, in __init__
    self.data, self.slices = torch.load(self.processed_paths[0])
  File "/home/philip/.local/lib/python3.8/site-packages/torch/serialization.py", line 1040, in load
    warnings.warn(
  File "/usr/lib/python3.8/warnings.py", line 109, in _showwarnmsg
    sw(msg.message, msg.category, msg.filename, msg.lineno,
  File "main.py", line 47, in warn_with_traceback
    traceback.print_stack(file=log)
/home/philip/projects/ltspice_examples_code_repo/Circuit-Completion-Using-GNNs/component_classification_with_link_prediction_head/evaluation/FEGIN/kernel/circuit_datasets.py:15: FutureWarning: You are using `torch.load` with `weights_only=False` (the current default value), which uses the default pickle module implicitly. It is possible to construct malicious pickle data which will execute arbitrary code during unpickling (See https://github.com/pytorch/pytorch/blob/main/SECURITY.md#untrusted-models for more details). In a future release, the default value for `weights_only` will be flipped to `True`. This limits the functions that could be executed during unpickling. Arbitrary objects will no longer be allowed to be loaded via this mode unless they are explicitly allowlisted by the user via `torch.serialization.add_safe_globals`. We recommend you start setting `weights_only=True` for any use case where you don't have full control of the loaded file. Please open an issue on GitHub for any issues related to this experimental feature.
  self.data, self.slices = torch.load(self.processed_paths[0])
