STDOUT:
Results will be saved in /home/philip/projects/ltspice_examples_code_repo/Circuit-Completion-Using-GNNs/component_classification_with_link_prediction_head/evaluation/FEGIN/results/model_FEGIN_dataset_ltspice_demos
Command line input: python main.py --data ltspice_demos --representation component_component --model FEGIN --layers 4 --hiddens 64 --batch_size 32 --lr 0.001 --emb_size 128 --epochs 100 --save_appendix component_component_L4_H64_BS32_LR0.001_E128 --no_val
 is saved.
-----
ltspice_demos - FEGIN
Using 4 layers, 64 hidden units, h = 2
Loading component_component representation dataset
ENTERED
Training FEGIN on component_component representation
Train: 1565, Test: 383
##################ITERATION #0 ****************************************
 epoch: 0, train_loss: 1.2526, test_loss: 1.2815, test_f1: 0.3457
 epoch: 1, train_loss: 1.1664, test_loss: 1.2384, test_f1: 0.3890
 epoch: 2, train_loss: 1.1045, test_loss: 1.1945, test_f1: 0.4307
 epoch: 3, train_loss: 1.0702, test_loss: 1.1902, test_f1: 0.4395
 epoch: 4, train_loss: 1.0264, test_loss: 1.1853, test_f1: 0.4422
 epoch: 5, train_loss: 0.9955, test_loss: 1.1568, test_f1: 0.4743
 epoch: 6, train_loss: 0.9790, test_loss: 1.1252, test_f1: 0.4597
 epoch: 7, train_loss: 0.9514, test_loss: 1.1381, test_f1: 0.4710
 epoch: 8, train_loss: 0.9085, test_loss: 1.1753, test_f1: 0.4584
 epoch: 9, train_loss: 0.8855, test_loss: 1.1739, test_f1: 0.5256
 epoch: 10, train_loss: 0.8613, test_loss: 1.1106, test_f1: 0.5399
 epoch: 11, train_loss: 0.8222, test_loss: 1.0649, test_f1: 0.5378
 epoch: 12, train_loss: 0.8280, test_loss: 1.1617, test_f1: 0.4873
 epoch: 13, train_loss: 0.8030, test_loss: 1.1577, test_f1: 0.5586
 epoch: 14, train_loss: 0.7665, test_loss: 1.1478, test_f1: 0.5494
 epoch: 15, train_loss: 0.7714, test_loss: 1.2809, test_f1: 0.6100
 epoch: 16, train_loss: 0.7469, test_loss: 1.0953, test_f1: 0.6290
 epoch: 17, train_loss: 0.7398, test_loss: 1.1750, test_f1: 0.5611
 epoch: 18, train_loss: 0.7286, test_loss: 1.1797, test_f1: 0.5509
 epoch: 19, train_loss: 0.7110, test_loss: 1.2601, test_f1: 0.5593
 epoch: 20, train_loss: 0.7175, test_loss: 1.3174, test_f1: 0.5823
 epoch: 21, train_loss: 0.7127, test_loss: 1.6022, test_f1: 0.5458
 epoch: 22, train_loss: 0.6846, test_loss: 1.4564, test_f1: 0.5689
 epoch: 23, train_loss: 0.6971, test_loss: 1.4447, test_f1: 0.5777
 epoch: 24, train_loss: 0.6599, test_loss: 1.6109, test_f1: 0.5932
 epoch: 25, train_loss: 0.6496, test_loss: 1.2842, test_f1: 0.5867
 epoch: 26, train_loss: 0.6473, test_loss: 1.4911, test_f1: 0.5990
 epoch: 27, train_loss: 0.6685, test_loss: 1.5267, test_f1: 0.5715
 epoch: 28, train_loss: 0.6093, test_loss: 1.4831, test_f1: 0.5796
 epoch: 29, train_loss: 0.6107, test_loss: 1.8342, test_f1: 0.5305
 epoch: 30, train_loss: 0.5955, test_loss: 1.5089, test_f1: 0.5859
 epoch: 31, train_loss: 0.5969, test_loss: 1.4420, test_f1: 0.5978
 epoch: 32, train_loss: 0.6068, test_loss: 1.5262, test_f1: 0.6274
 epoch: 33, train_loss: 0.6114, test_loss: 1.4480, test_f1: 0.5938
 epoch: 34, train_loss: 0.5504, test_loss: 1.3889, test_f1: 0.6309
 epoch: 35, train_loss: 0.5759, test_loss: 1.5824, test_f1: 0.5885
 epoch: 36, train_loss: 0.5878, test_loss: 1.6336, test_f1: 0.5585
 epoch: 37, train_loss: 0.5840, test_loss: 1.8041, test_f1: 0.5317
 epoch: 38, train_loss: 0.5557, test_loss: 1.6454, test_f1: 0.5670
 epoch: 39, train_loss: 0.5726, test_loss: 1.7955, test_f1: 0.5823
 epoch: 40, train_loss: 0.5377, test_loss: 1.8884, test_f1: 0.6248
 epoch: 41, train_loss: 0.5626, test_loss: 1.8554, test_f1: 0.6002
 epoch: 42, train_loss: 0.5378, test_loss: 1.4816, test_f1: 0.5652
 epoch: 43, train_loss: 0.5417, test_loss: 1.9154, test_f1: 0.5522
 epoch: 44, train_loss: 0.5489, test_loss: 1.7302, test_f1: 0.5498
 epoch: 45, train_loss: 0.5066, test_loss: 1.7485, test_f1: 0.5446
 epoch: 46, train_loss: 0.5406, test_loss: 1.6102, test_f1: 0.5773
 epoch: 47, train_loss: 0.5033, test_loss: 1.8322, test_f1: 0.5352
 epoch: 48, train_loss: 0.5099, test_loss: 1.7951, test_f1: 0.5465
 epoch: 49, train_loss: 0.4797, test_loss: 1.9385, test_f1: 0.5882
 epoch: 50, train_loss: 0.5108, test_loss: 1.7425, test_f1: 0.5898
 epoch: 51, train_loss: 0.4483, test_loss: 1.9179, test_f1: 0.5828
 epoch: 52, train_loss: 0.4231, test_loss: 1.9041, test_f1: 0.5767
 epoch: 53, train_loss: 0.4184, test_loss: 1.9071, test_f1: 0.6060
 epoch: 54, train_loss: 0.3948, test_loss: 1.9219, test_f1: 0.5846
 epoch: 55, train_loss: 0.4016, test_loss: 1.9683, test_f1: 0.5759
 epoch: 56, train_loss: 0.3825, test_loss: 2.2818, test_f1: 0.5973
 epoch: 57, train_loss: 0.4040, test_loss: 1.9996, test_f1: 0.6169
 epoch: 58, train_loss: 0.3770, test_loss: 2.1735, test_f1: 0.5655
 epoch: 59, train_loss: 0.3814, test_loss: 1.8815, test_f1: 0.6333
 epoch: 60, train_loss: 0.3644, test_loss: 2.1647, test_f1: 0.6227
 epoch: 61, train_loss: 0.3629, test_loss: 2.3553, test_f1: 0.6094
 epoch: 62, train_loss: 0.4000, test_loss: 2.2958, test_f1: 0.5868
 epoch: 63, train_loss: 0.3544, test_loss: 2.3431, test_f1: 0.5803
 epoch: 64, train_loss: 0.3608, test_loss: 2.5436, test_f1: 0.5946
 epoch: 65, train_loss: 0.3700, test_loss: 2.4476, test_f1: 0.5707
 epoch: 66, train_loss: 0.3553, test_loss: 2.5083, test_f1: 0.5917
 epoch: 67, train_loss: 0.3760, test_loss: 2.5303, test_f1: 0.5888
 epoch: 68, train_loss: 0.3401, test_loss: 2.6691, test_f1: 0.6243
 epoch: 69, train_loss: 0.3651, test_loss: 2.8489, test_f1: 0.5696
 epoch: 70, train_loss: 0.3505, test_loss: 2.9359, test_f1: 0.5622
 epoch: 71, train_loss: 0.3677, test_loss: 2.6612, test_f1: 0.6019
 epoch: 72, train_loss: 0.3563, test_loss: 2.6293, test_f1: 0.6124
 epoch: 73, train_loss: 0.3206, test_loss: 2.6440, test_f1: 0.6234
 epoch: 74, train_loss: 0.3323, test_loss: 2.6256, test_f1: 0.6033
 epoch: 75, train_loss: 0.3208, test_loss: 2.5667, test_f1: 0.5876
 epoch: 76, train_loss: 0.3191, test_loss: 2.6523, test_f1: 0.5966
 epoch: 77, train_loss: 0.3570, test_loss: 2.6539, test_f1: 0.6122
 epoch: 78, train_loss: 0.3073, test_loss: 2.8641, test_f1: 0.5932
 epoch: 79, train_loss: 0.3302, test_loss: 2.7032, test_f1: 0.5849
 epoch: 80, train_loss: 0.3187, test_loss: 2.9081, test_f1: 0.5989
 epoch: 81, train_loss: 0.3406, test_loss: 3.1351, test_f1: 0.5985
 epoch: 82, train_loss: 0.3114, test_loss: 3.1940, test_f1: 0.5770
 epoch: 83, train_loss: 0.3222, test_loss: 2.6481, test_f1: 0.5935
 epoch: 84, train_loss: 0.3267, test_loss: 2.5398, test_f1: 0.5878
 epoch: 85, train_loss: 0.3065, test_loss: 2.7354, test_f1: 0.5785
 epoch: 86, train_loss: 0.3083, test_loss: 3.2100, test_f1: 0.6038
 epoch: 87, train_loss: 0.3094, test_loss: 2.8181, test_f1: 0.5940
 epoch: 88, train_loss: 0.3141, test_loss: 2.9649, test_f1: 0.5889
 epoch: 89, train_loss: 0.3105, test_loss: 2.9272, test_f1: 0.5837
 epoch: 90, train_loss: 0.2912, test_loss: 3.0325, test_f1: 0.5666
 epoch: 91, train_loss: 0.3328, test_loss: 3.0912, test_f1: 0.5797
 epoch: 92, train_loss: 0.2976, test_loss: 2.8828, test_f1: 0.5977
 epoch: 93, train_loss: 0.2805, test_loss: 3.0191, test_f1: 0.5886
 epoch: 94, train_loss: 0.2789, test_loss: 3.1251, test_f1: 0.5862
 epoch: 95, train_loss: 0.2919, test_loss: 3.2610, test_f1: 0.5631
 epoch: 96, train_loss: 0.3097, test_loss: 3.0237, test_f1: 0.5782
 epoch: 97, train_loss: 0.2678, test_loss: 3.3920, test_f1: 0.5665
 epoch: 98, train_loss: 0.2924, test_loss: 3.0031, test_f1: 0.6047
 epoch: 99, train_loss: 0.2930, test_loss: 3.1794, test_f1: 0.5185
##################ITERATION #1 ****************************************
 epoch: 0, train_loss: 1.2146, test_loss: 1.2277, test_f1: 0.4488
 epoch: 1, train_loss: 1.0870, test_loss: 1.2249, test_f1: 0.4563
 epoch: 2, train_loss: 1.0191, test_loss: 1.2218, test_f1: 0.5056
 epoch: 3, train_loss: 0.9960, test_loss: 1.1525, test_f1: 0.5293
 epoch: 4, train_loss: 0.9727, test_loss: 1.1414, test_f1: 0.4797
 epoch: 5, train_loss: 0.9507, test_loss: 1.2219, test_f1: 0.4598
 epoch: 6, train_loss: 0.9150, test_loss: 1.1715, test_f1: 0.5413
 epoch: 7, train_loss: 0.8985, test_loss: 1.3475, test_f1: 0.5521
 epoch: 8, train_loss: 0.8674, test_loss: 1.2875, test_f1: 0.5396
 epoch: 9, train_loss: 0.8189, test_loss: 1.1897, test_f1: 0.5509
 epoch: 10, train_loss: 0.8515, test_loss: 1.2280, test_f1: 0.5558
 epoch: 11, train_loss: 0.8267, test_loss: 1.2626, test_f1: 0.5461
 epoch: 12, train_loss: 0.8228, test_loss: 1.3030, test_f1: 0.5334
 epoch: 13, train_loss: 0.8130, test_loss: 1.2720, test_f1: 0.4648
 epoch: 14, train_loss: 0.7793, test_loss: 1.1954, test_f1: 0.5391
 epoch: 15, train_loss: 0.7630, test_loss: 1.4018, test_f1: 0.5565
 epoch: 16, train_loss: 0.7516, test_loss: 1.3511, test_f1: 0.5465
 epoch: 17, train_loss: 0.7405, test_loss: 1.3650, test_f1: 0.5448
 epoch: 18, train_loss: 0.7254, test_loss: 1.3705, test_f1: 0.5767
 epoch: 19, train_loss: 0.7374, test_loss: 1.3969, test_f1: 0.5926
 epoch: 20, train_loss: 0.7313, test_loss: 1.2922, test_f1: 0.5741
 epoch: 21, train_loss: 0.6948, test_loss: 1.3720, test_f1: 0.5589
 epoch: 22, train_loss: 0.6793, test_loss: 1.6509, test_f1: 0.5572
 epoch: 23, train_loss: 0.6802, test_loss: 1.3380, test_f1: 0.5363
 epoch: 24, train_loss: 0.6681, test_loss: 1.5613, test_f1: 0.5682
 epoch: 25, train_loss: 0.6543, test_loss: 1.4977, test_f1: 0.5627
 epoch: 26, train_loss: 0.6325, test_loss: 1.4496, test_f1: 0.5424
 epoch: 27, train_loss: 0.6561, test_loss: 1.3760, test_f1: 0.5594
 epoch: 28, train_loss: 0.6683, test_loss: 1.4347, test_f1: 0.5854
 epoch: 29, train_loss: 0.6152, test_loss: 1.6834, test_f1: 0.5561
 epoch: 30, train_loss: 0.5945, test_loss: 1.3985, test_f1: 0.5756
 epoch: 31, train_loss: 0.6474, test_loss: 1.3266, test_f1: 0.5821
 epoch: 32, train_loss: 0.5863, test_loss: 1.3668, test_f1: 0.5871
 epoch: 33, train_loss: 0.5945, test_loss: 1.5801, test_f1: 0.5367
 epoch: 34, train_loss: 0.5875, test_loss: 1.6574, test_f1: 0.5107
 epoch: 35, train_loss: 0.5656, test_loss: 2.0675, test_f1: 0.5244
 epoch: 36, train_loss: 0.5512, test_loss: 1.6127, test_f1: 0.5668
 epoch: 37, train_loss: 0.5896, test_loss: 1.8308, test_f1: 0.5107
 epoch: 38, train_loss: 0.5641, test_loss: 1.4576, test_f1: 0.5277
 epoch: 39, train_loss: 0.5493, test_loss: 1.5405, test_f1: 0.5704
 epoch: 40, train_loss: 0.5495, test_loss: 1.4346, test_f1: 0.5684
 epoch: 41, train_loss: 0.5426, test_loss: 1.7537, test_f1: 0.5519
 epoch: 42, train_loss: 0.5451, test_loss: 1.5224, test_f1: 0.5982
 epoch: 43, train_loss: 0.5134, test_loss: 1.8769, test_f1: 0.5628
 epoch: 44, train_loss: 0.5014, test_loss: 1.7029, test_f1: 0.5387
 epoch: 45, train_loss: 0.4803, test_loss: 1.7395, test_f1: 0.6041
 epoch: 46, train_loss: 0.5533, test_loss: 1.7449, test_f1: 0.5205
 epoch: 47, train_loss: 0.5073, test_loss: 1.5761, test_f1: 0.5689
 epoch: 48, train_loss: 0.5033, test_loss: 1.8094, test_f1: 0.5379
 epoch: 49, train_loss: 0.5125, test_loss: 1.8127, test_f1: 0.5850
 epoch: 50, train_loss: 0.5016, test_loss: 1.8565, test_f1: 0.5872
 epoch: 51, train_loss: 0.4488, test_loss: 1.6684, test_f1: 0.5586
 epoch: 52, train_loss: 0.4047, test_loss: 1.8595, test_f1: 0.5550
 epoch: 53, train_loss: 0.4012, test_loss: 1.7452, test_f1: 0.5803
 epoch: 54, train_loss: 0.4136, test_loss: 1.8282, test_f1: 0.5638
 epoch: 55, train_loss: 0.3919, test_loss: 1.8967, test_f1: 0.5590
 epoch: 56, train_loss: 0.3906, test_loss: 1.7653, test_f1: 0.5885
 epoch: 57, train_loss: 0.3988, test_loss: 1.8947, test_f1: 0.5758
 epoch: 58, train_loss: 0.3920, test_loss: 1.7856, test_f1: 0.5777
 epoch: 59, train_loss: 0.3692, test_loss: 1.9760, test_f1: 0.5990
 epoch: 60, train_loss: 0.3854, test_loss: 1.9606, test_f1: 0.5585
 epoch: 61, train_loss: 0.3814, test_loss: 1.9165, test_f1: 0.6035
 epoch: 62, train_loss: 0.3527, test_loss: 2.0758, test_f1: 0.5767
 epoch: 63, train_loss: 0.3745, test_loss: 1.8551, test_f1: 0.5856
 epoch: 64, train_loss: 0.3351, test_loss: 1.9901, test_f1: 0.6066
 epoch: 65, train_loss: 0.3750, test_loss: 1.8182, test_f1: 0.6048
 epoch: 66, train_loss: 0.3531, test_loss: 2.1719, test_f1: 0.5744
 epoch: 67, train_loss: 0.3559, test_loss: 2.0035, test_f1: 0.6152
 epoch: 68, train_loss: 0.3476, test_loss: 2.1776, test_f1: 0.5328
 epoch: 69, train_loss: 0.3604, test_loss: 1.9010, test_f1: 0.5681
 epoch: 70, train_loss: 0.3359, test_loss: 2.1264, test_f1: 0.5671
 epoch: 71, train_loss: 0.3354, test_loss: 1.9979, test_f1: 0.5662
 epoch: 72, train_loss: 0.3575, test_loss: 2.3220, test_f1: 0.5624
 epoch: 73, train_loss: 0.3366, test_loss: 2.4956, test_f1: 0.5313
 epoch: 74, train_loss: 0.3253, test_loss: 2.1799, test_f1: 0.5807
 epoch: 75, train_loss: 0.3525, test_loss: 2.1604, test_f1: 0.5746
 epoch: 76, train_loss: 0.3232, test_loss: 2.3124, test_f1: 0.5557
 epoch: 77, train_loss: 0.3339, test_loss: 2.1068, test_f1: 0.6201
 epoch: 78, train_loss: 0.3189, test_loss: 2.3241, test_f1: 0.5536
 epoch: 79, train_loss: 0.2947, test_loss: 2.1053, test_f1: 0.5775
 epoch: 80, train_loss: 0.3224, test_loss: 2.3297, test_f1: 0.5651
 epoch: 81, train_loss: 0.3336, test_loss: 2.1723, test_f1: 0.5929
 epoch: 82, train_loss: 0.3090, test_loss: 2.3342, test_f1: 0.5959
 epoch: 83, train_loss: 0.2901, test_loss: 2.6707, test_f1: 0.6219
 epoch: 84, train_loss: 0.3134, test_loss: 2.3542, test_f1: 0.6164
 epoch: 85, train_loss: 0.2916, test_loss: 2.4328, test_f1: 0.5773
 epoch: 86, train_loss: 0.3079, test_loss: 2.4075, test_f1: 0.5922
 epoch: 87, train_loss: 0.2857, test_loss: 2.3585, test_f1: 0.6073
 epoch: 88, train_loss: 0.2817, test_loss: 2.5146, test_f1: 0.6110
 epoch: 89, train_loss: 0.3085, test_loss: 2.6284, test_f1: 0.5749
 epoch: 90, train_loss: 0.3047, test_loss: 2.5249, test_f1: 0.5878
 epoch: 91, train_loss: 0.2897, test_loss: 2.3887, test_f1: 0.5925
 epoch: 92, train_loss: 0.2934, test_loss: 2.3201, test_f1: 0.6368
 epoch: 93, train_loss: 0.2941, test_loss: 2.5165, test_f1: 0.5795
 epoch: 94, train_loss: 0.2682, test_loss: 2.4993, test_f1: 0.5826
 epoch: 95, train_loss: 0.2666, test_loss: 2.3553, test_f1: 0.5856
 epoch: 96, train_loss: 0.2654, test_loss: 2.7365, test_f1: 0.5905
 epoch: 97, train_loss: 0.2857, test_loss: 2.8322, test_f1: 0.5888
 epoch: 98, train_loss: 0.2638, test_loss: 2.8687, test_f1: 0.5789
 epoch: 99, train_loss: 0.2542, test_loss: 2.7247, test_f1: 0.5968
##################ITERATION #2 ****************************************
 epoch: 0, train_loss: 1.2036, test_loss: 1.2354, test_f1: 0.3813
 epoch: 1, train_loss: 1.1034, test_loss: 1.2628, test_f1: 0.4184
 epoch: 2, train_loss: 1.0612, test_loss: 1.2150, test_f1: 0.4997
 epoch: 3, train_loss: 1.0188, test_loss: 1.1801, test_f1: 0.5405
 epoch: 4, train_loss: 0.9879, test_loss: 1.2169, test_f1: 0.5597
 epoch: 5, train_loss: 0.9478, test_loss: 1.1011, test_f1: 0.5408
 epoch: 6, train_loss: 0.9293, test_loss: 1.1357, test_f1: 0.5202
 epoch: 7, train_loss: 0.9287, test_loss: 1.1622, test_f1: 0.5182
 epoch: 8, train_loss: 0.9120, test_loss: 1.0939, test_f1: 0.5719
 epoch: 9, train_loss: 0.9053, test_loss: 1.1336, test_f1: 0.5974
 epoch: 10, train_loss: 0.8519, test_loss: 1.1652, test_f1: 0.5569
 epoch: 11, train_loss: 0.8519, test_loss: 1.3364, test_f1: 0.4634
 epoch: 12, train_loss: 0.8276, test_loss: 1.3116, test_f1: 0.5588
 epoch: 13, train_loss: 0.8205, test_loss: 1.3006, test_f1: 0.5620
 epoch: 14, train_loss: 0.7937, test_loss: 1.1397, test_f1: 0.5819
 epoch: 15, train_loss: 0.7880, test_loss: 1.2037, test_f1: 0.5600
 epoch: 16, train_loss: 0.8001, test_loss: 1.1912, test_f1: 0.5335
 epoch: 17, train_loss: 0.7941, test_loss: 1.1332, test_f1: 0.6098
 epoch: 18, train_loss: 0.7661, test_loss: 1.1558, test_f1: 0.5985
 epoch: 19, train_loss: 0.7579, test_loss: 1.3244, test_f1: 0.6136
 epoch: 20, train_loss: 0.7813, test_loss: 1.3785, test_f1: 0.5529
 epoch: 21, train_loss: 0.7523, test_loss: 1.3348, test_f1: 0.5979
 epoch: 22, train_loss: 0.7502, test_loss: 1.1456, test_f1: 0.5587
 epoch: 23, train_loss: 0.7213, test_loss: 1.1725, test_f1: 0.6296
 epoch: 24, train_loss: 0.7237, test_loss: 1.4338, test_f1: 0.5575
 epoch: 25, train_loss: 0.6770, test_loss: 1.8252, test_f1: 0.5817
 epoch: 26, train_loss: 0.6968, test_loss: 1.5016, test_f1: 0.5625
 epoch: 27, train_loss: 0.6918, test_loss: 1.6740, test_f1: 0.5178
 epoch: 28, train_loss: 0.6803, test_loss: 1.4420, test_f1: 0.5810
 epoch: 29, train_loss: 0.7009, test_loss: 1.6650, test_f1: 0.5777
 epoch: 30, train_loss: 0.6607, test_loss: 1.5802, test_f1: 0.5703
 epoch: 31, train_loss: 0.6410, test_loss: 1.4092, test_f1: 0.6249
 epoch: 32, train_loss: 0.6321, test_loss: 1.7002, test_f1: 0.6037
 epoch: 33, train_loss: 0.6390, test_loss: 1.7634, test_f1: 0.5392
 epoch: 34, train_loss: 0.6192, test_loss: 1.5621, test_f1: 0.5978
 epoch: 35, train_loss: 0.6363, test_loss: 1.4223, test_f1: 0.5955
 epoch: 36, train_loss: 0.6033, test_loss: 1.7877, test_f1: 0.5713
 epoch: 37, train_loss: 0.5986, test_loss: 1.3378, test_f1: 0.5614
 epoch: 38, train_loss: 0.5903, test_loss: 1.7975, test_f1: 0.5914
 epoch: 39, train_loss: 0.5478, test_loss: 1.5708, test_f1: 0.5837
 epoch: 40, train_loss: 0.5913, test_loss: 1.7411, test_f1: 0.5947
 epoch: 41, train_loss: 0.5583, test_loss: 1.6059, test_f1: 0.6027
 epoch: 42, train_loss: 0.5691, test_loss: 1.7841, test_f1: 0.6029
 epoch: 43, train_loss: 0.5622, test_loss: 1.7387, test_f1: 0.5811
 epoch: 44, train_loss: 0.5539, test_loss: 1.8355, test_f1: 0.4866
 epoch: 45, train_loss: 0.5354, test_loss: 1.7672, test_f1: 0.5803
 epoch: 46, train_loss: 0.5423, test_loss: 1.6880, test_f1: 0.5486
 epoch: 47, train_loss: 0.5257, test_loss: 1.7163, test_f1: 0.5854
 epoch: 48, train_loss: 0.5326, test_loss: 1.8508, test_f1: 0.5173
 epoch: 49, train_loss: 0.5201, test_loss: 1.8205, test_f1: 0.5677
 epoch: 50, train_loss: 0.5190, test_loss: 1.7319, test_f1: 0.5473
 epoch: 51, train_loss: 0.4739, test_loss: 1.5497, test_f1: 0.5832
 epoch: 52, train_loss: 0.4422, test_loss: 1.6730, test_f1: 0.5863
 epoch: 53, train_loss: 0.4416, test_loss: 1.8008, test_f1: 0.6054
 epoch: 54, train_loss: 0.4265, test_loss: 1.6584, test_f1: 0.5850
 epoch: 55, train_loss: 0.4172, test_loss: 1.8608, test_f1: 0.5880
 epoch: 56, train_loss: 0.4238, test_loss: 1.9121, test_f1: 0.5938
 epoch: 57, train_loss: 0.4073, test_loss: 1.9954, test_f1: 0.5963
 epoch: 58, train_loss: 0.4009, test_loss: 2.0656, test_f1: 0.5827
 epoch: 59, train_loss: 0.4266, test_loss: 2.0926, test_f1: 0.5839
 epoch: 60, train_loss: 0.3984, test_loss: 2.2837, test_f1: 0.5661
 epoch: 61, train_loss: 0.4057, test_loss: 1.8121, test_f1: 0.6109
 epoch: 62, train_loss: 0.4116, test_loss: 1.9515, test_f1: 0.6198
 epoch: 63, train_loss: 0.4027, test_loss: 2.2652, test_f1: 0.5622
 epoch: 64, train_loss: 0.4099, test_loss: 1.8241, test_f1: 0.6104
 epoch: 65, train_loss: 0.4115, test_loss: 2.4078, test_f1: 0.5710
 epoch: 66, train_loss: 0.3981, test_loss: 2.4071, test_f1: 0.5700
 epoch: 67, train_loss: 0.4062, test_loss: 2.5353, test_f1: 0.5776
 epoch: 68, train_loss: 0.3720, test_loss: 1.9144, test_f1: 0.5996
 epoch: 69, train_loss: 0.3926, test_loss: 4.0745, test_f1: 0.5975
 epoch: 70, train_loss: 0.3728, test_loss: 2.1206, test_f1: 0.6080
 epoch: 71, train_loss: 0.3816, test_loss: 3.3933, test_f1: 0.5899
 epoch: 72, train_loss: 0.3800, test_loss: 3.1318, test_f1: 0.6101
 epoch: 73, train_loss: 0.3688, test_loss: 2.6347, test_f1: 0.5671
 epoch: 74, train_loss: 0.3692, test_loss: 2.2097, test_f1: 0.5953
 epoch: 75, train_loss: 0.3690, test_loss: 2.3929, test_f1: 0.5273
 epoch: 76, train_loss: 0.3862, test_loss: 1.9713, test_f1: 0.6275
 epoch: 77, train_loss: 0.3587, test_loss: 2.1948, test_f1: 0.5795
 epoch: 78, train_loss: 0.3496, test_loss: 2.0826, test_f1: 0.5980
 epoch: 79, train_loss: 0.3583, test_loss: 2.0920, test_f1: 0.5761
 epoch: 80, train_loss: 0.3688, test_loss: 2.3750, test_f1: 0.5590
 epoch: 81, train_loss: 0.3371, test_loss: 2.1320, test_f1: 0.5646
 epoch: 82, train_loss: 0.3553, test_loss: 2.3019, test_f1: 0.6067
 epoch: 83, train_loss: 0.3381, test_loss: 2.3210, test_f1: 0.5904
 epoch: 84, train_loss: 0.3194, test_loss: 2.2916, test_f1: 0.6096
 epoch: 85, train_loss: 0.3527, test_loss: 2.1329, test_f1: 0.5373
 epoch: 86, train_loss: 0.3558, test_loss: 2.3120, test_f1: 0.6052
 epoch: 87, train_loss: 0.3381, test_loss: 2.4509, test_f1: 0.5632
 epoch: 88, train_loss: 0.3536, test_loss: 2.1356, test_f1: 0.5849
 epoch: 89, train_loss: 0.3282, test_loss: 2.0838, test_f1: 0.5774
 epoch: 90, train_loss: 0.3427, test_loss: 2.1888, test_f1: 0.5830
 epoch: 91, train_loss: 0.3598, test_loss: 2.4094, test_f1: 0.5960
 epoch: 92, train_loss: 0.3042, test_loss: 2.3521, test_f1: 0.5612
 epoch: 93, train_loss: 0.3292, test_loss: 2.4545, test_f1: 0.5787
 epoch: 94, train_loss: 0.3500, test_loss: 2.5536, test_f1: 0.5927
 epoch: 95, train_loss: 0.3268, test_loss: 2.0263, test_f1: 0.5819
 epoch: 96, train_loss: 0.3134, test_loss: 2.5840, test_f1: 0.5509
 epoch: 97, train_loss: 0.3446, test_loss: 2.6293, test_f1: 0.5851
 epoch: 98, train_loss: 0.2994, test_loss: 2.8121, test_f1: 0.5913
 epoch: 99, train_loss: 0.3165, test_loss: 2.8348, test_f1: 0.5641
##################ITERATION #3 ****************************************
 epoch: 0, train_loss: 1.2514, test_loss: 1.3182, test_f1: 0.3718
 epoch: 1, train_loss: 1.1493, test_loss: 1.2508, test_f1: 0.4954
 epoch: 2, train_loss: 1.0868, test_loss: 1.2336, test_f1: 0.4926
 epoch: 3, train_loss: 1.0389, test_loss: 1.1507, test_f1: 0.5007
 epoch: 4, train_loss: 1.0304, test_loss: 1.2404, test_f1: 0.4835
 epoch: 5, train_loss: 0.9896, test_loss: 1.2018, test_f1: 0.5148
 epoch: 6, train_loss: 0.9745, test_loss: 1.1650, test_f1: 0.5515
 epoch: 7, train_loss: 0.9701, test_loss: 1.3722, test_f1: 0.4879
 epoch: 8, train_loss: 0.9404, test_loss: 1.0977, test_f1: 0.5832
 epoch: 9, train_loss: 0.9066, test_loss: 1.1361, test_f1: 0.5787
 epoch: 10, train_loss: 0.8869, test_loss: 1.3025, test_f1: 0.5057
 epoch: 11, train_loss: 0.8996, test_loss: 1.1115, test_f1: 0.5642
 epoch: 12, train_loss: 0.8860, test_loss: 1.1107, test_f1: 0.6007
 epoch: 13, train_loss: 0.8592, test_loss: 1.1868, test_f1: 0.5447
 epoch: 14, train_loss: 0.8644, test_loss: 1.2122, test_f1: 0.6102
 epoch: 15, train_loss: 0.8613, test_loss: 1.1802, test_f1: 0.5472
 epoch: 16, train_loss: 0.8079, test_loss: 1.2190, test_f1: 0.6089
 epoch: 17, train_loss: 0.8224, test_loss: 1.0655, test_f1: 0.5839
 epoch: 18, train_loss: 0.8132, test_loss: 1.0631, test_f1: 0.5595
 epoch: 19, train_loss: 0.8106, test_loss: 1.2100, test_f1: 0.5636
 epoch: 20, train_loss: 0.7842, test_loss: 1.2646, test_f1: 0.5712
 epoch: 21, train_loss: 0.7512, test_loss: 1.2162, test_f1: 0.5305
 epoch: 22, train_loss: 0.7709, test_loss: 1.1625, test_f1: 0.5738
 epoch: 23, train_loss: 0.7372, test_loss: 1.1316, test_f1: 0.5746
 epoch: 24, train_loss: 0.7526, test_loss: 1.3771, test_f1: 0.5438
 epoch: 25, train_loss: 0.7446, test_loss: 1.3273, test_f1: 0.5226
 epoch: 26, train_loss: 0.7498, test_loss: 1.2895, test_f1: 0.5876
 epoch: 27, train_loss: 0.7526, test_loss: 1.3123, test_f1: 0.5718
 epoch: 28, train_loss: 0.7368, test_loss: 1.3253, test_f1: 0.5664
 epoch: 29, train_loss: 0.7372, test_loss: 1.1749, test_f1: 0.5657
 epoch: 30, train_loss: 0.7080, test_loss: 1.5278, test_f1: 0.4835
 epoch: 31, train_loss: 0.6936, test_loss: 1.2644, test_f1: 0.6116
 epoch: 32, train_loss: 0.6709, test_loss: 1.5236, test_f1: 0.5311
 epoch: 33, train_loss: 0.6629, test_loss: 1.4062, test_f1: 0.5317
 epoch: 34, train_loss: 0.6696, test_loss: 1.3987, test_f1: 0.5298
 epoch: 35, train_loss: 0.6557, test_loss: 1.2979, test_f1: 0.5674
 epoch: 36, train_loss: 0.6886, test_loss: 1.7312, test_f1: 0.4168
 epoch: 37, train_loss: 0.6561, test_loss: 1.2988, test_f1: 0.5531
 epoch: 38, train_loss: 0.6290, test_loss: 1.3752, test_f1: 0.5544
 epoch: 39, train_loss: 0.6209, test_loss: 1.4636, test_f1: 0.5512
 epoch: 40, train_loss: 0.6262, test_loss: 1.5230, test_f1: 0.5722
 epoch: 41, train_loss: 0.6116, test_loss: 1.7184, test_f1: 0.5671
 epoch: 42, train_loss: 0.6388, test_loss: 1.4727, test_f1: 0.6077
 epoch: 43, train_loss: 0.6442, test_loss: 1.5030, test_f1: 0.5403
 epoch: 44, train_loss: 0.6225, test_loss: 1.5332, test_f1: 0.6014
 epoch: 45, train_loss: 0.5967, test_loss: 1.6508, test_f1: 0.5531
 epoch: 46, train_loss: 0.5629, test_loss: 1.6794, test_f1: 0.5578
 epoch: 47, train_loss: 0.5745, test_loss: 1.5362, test_f1: 0.5633
 epoch: 48, train_loss: 0.5841, test_loss: 1.4749, test_f1: 0.5678
 epoch: 49, train_loss: 0.5713, test_loss: 1.7551, test_f1: 0.5711
 epoch: 50, train_loss: 0.5868, test_loss: 1.6804, test_f1: 0.5697
 epoch: 51, train_loss: 0.5500, test_loss: 1.8426, test_f1: 0.5622
 epoch: 52, train_loss: 0.5080, test_loss: 1.7144, test_f1: 0.5722
 epoch: 53, train_loss: 0.5059, test_loss: 1.7900, test_f1: 0.5427
 epoch: 54, train_loss: 0.4860, test_loss: 1.8689, test_f1: 0.5777
 epoch: 55, train_loss: 0.4963, test_loss: 1.7665, test_f1: 0.5537
 epoch: 56, train_loss: 0.4606, test_loss: 1.9110, test_f1: 0.5649
 epoch: 57, train_loss: 0.4730, test_loss: 1.8219, test_f1: 0.5864
 epoch: 58, train_loss: 0.4568, test_loss: 1.9781, test_f1: 0.5407
 epoch: 59, train_loss: 0.4698, test_loss: 1.8482, test_f1: 0.6028
 epoch: 60, train_loss: 0.4799, test_loss: 1.9846, test_f1: 0.5525
 epoch: 61, train_loss: 0.4471, test_loss: 1.9482, test_f1: 0.5337
 epoch: 62, train_loss: 0.4760, test_loss: 1.8442, test_f1: 0.5829
 epoch: 63, train_loss: 0.4398, test_loss: 1.9314, test_f1: 0.5717
 epoch: 64, train_loss: 0.4481, test_loss: 1.8144, test_f1: 0.5723
 epoch: 65, train_loss: 0.4433, test_loss: 1.9146, test_f1: 0.5827
 epoch: 66, train_loss: 0.4491, test_loss: 1.9125, test_f1: 0.5449
 epoch: 67, train_loss: 0.4283, test_loss: 2.0241, test_f1: 0.5586
 epoch: 68, train_loss: 0.4432, test_loss: 1.8876, test_f1: 0.5799
 epoch: 69, train_loss: 0.4285, test_loss: 2.1021, test_f1: 0.5568
 epoch: 70, train_loss: 0.4282, test_loss: 1.8830, test_f1: 0.6029
 epoch: 71, train_loss: 0.4173, test_loss: 2.0708, test_f1: 0.5853
 epoch: 72, train_loss: 0.4187, test_loss: 1.9666, test_f1: 0.5430
 epoch: 73, train_loss: 0.3981, test_loss: 2.2808, test_f1: 0.5513
 epoch: 74, train_loss: 0.3911, test_loss: 2.4317, test_f1: 0.5448
 epoch: 75, train_loss: 0.4219, test_loss: 1.9271, test_f1: 0.6079
 epoch: 76, train_loss: 0.4091, test_loss: 1.9826, test_f1: 0.5726
 epoch: 77, train_loss: 0.3999, test_loss: 2.1159, test_f1: 0.5669
 epoch: 78, train_loss: 0.4012, test_loss: 1.9831, test_f1: 0.5857
 epoch: 79, train_loss: 0.3848, test_loss: 2.0956, test_f1: 0.5688
 epoch: 80, train_loss: 0.3614, test_loss: 2.1178, test_f1: 0.5763
 epoch: 81, train_loss: 0.3866, test_loss: 2.1624, test_f1: 0.5320
 epoch: 82, train_loss: 0.3923, test_loss: 1.8295, test_f1: 0.5903
 epoch: 83, train_loss: 0.4100, test_loss: 2.1337, test_f1: 0.6060
 epoch: 84, train_loss: 0.4200, test_loss: 2.0111, test_f1: 0.5983
 epoch: 85, train_loss: 0.3730, test_loss: 2.0368, test_f1: 0.5520
 epoch: 86, train_loss: 0.3696, test_loss: 2.1522, test_f1: 0.5722
 epoch: 87, train_loss: 0.4003, test_loss: 1.9718, test_f1: 0.5980
 epoch: 88, train_loss: 0.4034, test_loss: 1.9351, test_f1: 0.5932
 epoch: 89, train_loss: 0.3856, test_loss: 1.8730, test_f1: 0.6276
 epoch: 90, train_loss: 0.3601, test_loss: 2.3236, test_f1: 0.5676
 epoch: 91, train_loss: 0.3508, test_loss: 2.1936, test_f1: 0.5508
 epoch: 92, train_loss: 0.3211, test_loss: 2.1797, test_f1: 0.5797
 epoch: 93, train_loss: 0.3627, test_loss: 2.2996, test_f1: 0.5426
 epoch: 94, train_loss: 0.3545, test_loss: 2.3926, test_f1: 0.5815
 epoch: 95, train_loss: 0.3314, test_loss: 2.4348, test_f1: 0.5666
 epoch: 96, train_loss: 0.3651, test_loss: 2.8792, test_f1: 0.5776
 epoch: 97, train_loss: 0.4030, test_loss: 2.3977, test_f1: 0.5316
 epoch: 98, train_loss: 0.3809, test_loss: 2.1078, test_f1: 0.5809
 epoch: 99, train_loss: 0.3649, test_loss: 2.2289, test_f1: 0.5806
##################ITERATION #4 ****************************************
 epoch: 0, train_loss: 1.2655, test_loss: 1.2810, test_f1: 0.4268
 epoch: 1, train_loss: 1.1698, test_loss: 1.2523, test_f1: 0.5146
 epoch: 2, train_loss: 1.0976, test_loss: 1.1996, test_f1: 0.5079
 epoch: 3, train_loss: 1.0743, test_loss: 1.2085, test_f1: 0.5474
 epoch: 4, train_loss: 1.0287, test_loss: 1.1419, test_f1: 0.5587
 epoch: 5, train_loss: 1.0068, test_loss: 1.1350, test_f1: 0.5525
 epoch: 6, train_loss: 0.9998, test_loss: 1.2315, test_f1: 0.5227
 epoch: 7, train_loss: 0.9593, test_loss: 1.3233, test_f1: 0.5397
 epoch: 8, train_loss: 0.9729, test_loss: 1.1073, test_f1: 0.4891
 epoch: 9, train_loss: 0.9437, test_loss: 1.1048, test_f1: 0.5583
 epoch: 10, train_loss: 0.9065, test_loss: 1.1606, test_f1: 0.5333
 epoch: 11, train_loss: 0.9067, test_loss: 1.0941, test_f1: 0.5579
 epoch: 12, train_loss: 0.8864, test_loss: 1.0997, test_f1: 0.5650
 epoch: 13, train_loss: 0.8981, test_loss: 1.0578, test_f1: 0.5525
 epoch: 14, train_loss: 0.8574, test_loss: 1.0571, test_f1: 0.5458
 epoch: 15, train_loss: 0.8463, test_loss: 1.1673, test_f1: 0.5231
 epoch: 16, train_loss: 0.8271, test_loss: 1.0720, test_f1: 0.6063
 epoch: 17, train_loss: 0.8626, test_loss: 1.0786, test_f1: 0.5990
 epoch: 18, train_loss: 0.8375, test_loss: 1.1288, test_f1: 0.4979
 epoch: 19, train_loss: 0.8073, test_loss: 1.1197, test_f1: 0.5381
 epoch: 20, train_loss: 0.8071, test_loss: 1.0371, test_f1: 0.5720
 epoch: 21, train_loss: 0.8063, test_loss: 1.0871, test_f1: 0.5752
 epoch: 22, train_loss: 0.7879, test_loss: 1.2468, test_f1: 0.5057
 epoch: 23, train_loss: 0.7800, test_loss: 1.0954, test_f1: 0.5733
 epoch: 24, train_loss: 0.7917, test_loss: 1.2823, test_f1: 0.5479
 epoch: 25, train_loss: 0.7464, test_loss: 1.0971, test_f1: 0.6028
 epoch: 26, train_loss: 0.7754, test_loss: 1.0768, test_f1: 0.5989
 epoch: 27, train_loss: 0.7258, test_loss: 1.2135, test_f1: 0.5511
 epoch: 28, train_loss: 0.7425, test_loss: 1.1993, test_f1: 0.5414
 epoch: 29, train_loss: 0.7208, test_loss: 1.1708, test_f1: 0.5889
 epoch: 30, train_loss: 0.7258, test_loss: 1.1456, test_f1: 0.5889
 epoch: 31, train_loss: 0.7335, test_loss: 1.2467, test_f1: 0.5515
 epoch: 32, train_loss: 0.6881, test_loss: 1.2471, test_f1: 0.5719
 epoch: 33, train_loss: 0.6879, test_loss: 1.1840, test_f1: 0.5599
 epoch: 34, train_loss: 0.7152, test_loss: 1.3760, test_f1: 0.5477
 epoch: 35, train_loss: 0.6929, test_loss: 1.2355, test_f1: 0.5915
 epoch: 36, train_loss: 0.6846, test_loss: 1.3489, test_f1: 0.5648
 epoch: 37, train_loss: 0.6572, test_loss: 1.5578, test_f1: 0.4962
 epoch: 38, train_loss: 0.6872, test_loss: 1.4315, test_f1: 0.5683
 epoch: 39, train_loss: 0.6609, test_loss: 1.5626, test_f1: 0.5765
 epoch: 40, train_loss: 0.6621, test_loss: 1.3790, test_f1: 0.5727
 epoch: 41, train_loss: 0.6129, test_loss: 1.6869, test_f1: 0.5191
 epoch: 42, train_loss: 0.6218, test_loss: 1.6920, test_f1: 0.5759
 epoch: 43, train_loss: 0.6283, test_loss: 1.6116, test_f1: 0.5763
 epoch: 44, train_loss: 0.6406, test_loss: 1.4903, test_f1: 0.5938
 epoch: 45, train_loss: 0.6114, test_loss: 1.7670, test_f1: 0.5582
 epoch: 46, train_loss: 0.6244, test_loss: 1.6825, test_f1: 0.5754
 epoch: 47, train_loss: 0.6415, test_loss: 1.7455, test_f1: 0.5790
 epoch: 48, train_loss: 0.5974, test_loss: 1.5911, test_f1: 0.6392
 epoch: 49, train_loss: 0.5925, test_loss: 1.8121, test_f1: 0.5896
 epoch: 50, train_loss: 0.5599, test_loss: 1.8908, test_f1: 0.5552
 epoch: 51, train_loss: 0.5310, test_loss: 1.5265, test_f1: 0.6064
 epoch: 52, train_loss: 0.5225, test_loss: 1.6582, test_f1: 0.5753
 epoch: 53, train_loss: 0.5337, test_loss: 1.6311, test_f1: 0.5691
 epoch: 54, train_loss: 0.5237, test_loss: 1.7547, test_f1: 0.5888
 epoch: 55, train_loss: 0.5017, test_loss: 1.8746, test_f1: 0.5681
 epoch: 56, train_loss: 0.4928, test_loss: 1.9247, test_f1: 0.5616
 epoch: 57, train_loss: 0.5126, test_loss: 1.7426, test_f1: 0.5897
 epoch: 58, train_loss: 0.5204, test_loss: 1.8075, test_f1: 0.5867
 epoch: 59, train_loss: 0.4873, test_loss: 1.9625, test_f1: 0.5665
 epoch: 60, train_loss: 0.4776, test_loss: 1.9434, test_f1: 0.5926
 epoch: 61, train_loss: 0.4760, test_loss: 1.9153, test_f1: 0.6217
 epoch: 62, train_loss: 0.4912, test_loss: 1.8753, test_f1: 0.5674
 epoch: 63, train_loss: 0.4740, test_loss: 2.1387, test_f1: 0.6097
 epoch: 64, train_loss: 0.4316, test_loss: 2.2960, test_f1: 0.5772
 epoch: 65, train_loss: 0.4403, test_loss: 2.1478, test_f1: 0.5885
 epoch: 66, train_loss: 0.4743, test_loss: 2.3290, test_f1: 0.5630
 epoch: 67, train_loss: 0.4649, test_loss: 2.1601, test_f1: 0.5761
 epoch: 68, train_loss: 0.4494, test_loss: 2.1255, test_f1: 0.6091
 epoch: 69, train_loss: 0.4473, test_loss: 2.3909, test_f1: 0.5374
 epoch: 70, train_loss: 0.4421, test_loss: 2.2186, test_f1: 0.5502
 epoch: 71, train_loss: 0.4326, test_loss: 2.5702, test_f1: 0.5554
 epoch: 72, train_loss: 0.4401, test_loss: 2.3710, test_f1: 0.5689
 epoch: 73, train_loss: 0.4387, test_loss: 2.3437, test_f1: 0.5823
 epoch: 74, train_loss: 0.4349, test_loss: 2.3232, test_f1: 0.6029
 epoch: 75, train_loss: 0.4310, test_loss: 2.3434, test_f1: 0.5564
 epoch: 76, train_loss: 0.4517, test_loss: 2.1267, test_f1: 0.6056
 epoch: 77, train_loss: 0.4256, test_loss: 2.2553, test_f1: 0.5782
 epoch: 78, train_loss: 0.4059, test_loss: 2.2308, test_f1: 0.6139
 epoch: 79, train_loss: 0.4431, test_loss: 2.4726, test_f1: 0.5451
 epoch: 80, train_loss: 0.4129, test_loss: 2.3111, test_f1: 0.5541
 epoch: 81, train_loss: 0.4163, test_loss: 2.0804, test_f1: 0.6151
 epoch: 82, train_loss: 0.3967, test_loss: 2.2154, test_f1: 0.5905
 epoch: 83, train_loss: 0.4096, test_loss: 2.1722, test_f1: 0.6170
 epoch: 84, train_loss: 0.3890, test_loss: 2.3386, test_f1: 0.6060
 epoch: 85, train_loss: 0.4159, test_loss: 2.6071, test_f1: 0.5994
 epoch: 86, train_loss: 0.3978, test_loss: 2.6894, test_f1: 0.5558
 epoch: 87, train_loss: 0.3760, test_loss: 2.6190, test_f1: 0.5909
 epoch: 88, train_loss: 0.3771, test_loss: 2.6442, test_f1: 0.5906
 epoch: 89, train_loss: 0.4056, test_loss: 2.3369, test_f1: 0.5889
 epoch: 90, train_loss: 0.3908, test_loss: 2.5642, test_f1: 0.6040
 epoch: 91, train_loss: 0.3813, test_loss: 2.5971, test_f1: 0.5691
 epoch: 92, train_loss: 0.3734, test_loss: 2.5916, test_f1: 0.6241
 epoch: 93, train_loss: 0.3983, test_loss: 2.5979, test_f1: 0.6054
 epoch: 94, train_loss: 0.4105, test_loss: 2.2953, test_f1: 0.5824
 epoch: 95, train_loss: 0.3953, test_loss: 2.2977, test_f1: 0.5907
 epoch: 96, train_loss: 0.3697, test_loss: 2.3436, test_f1: 0.5899
 epoch: 97, train_loss: 0.3591, test_loss: 2.5080, test_f1: 0.5941
 epoch: 98, train_loss: 0.3919, test_loss: 2.2089, test_f1: 0.6160
 epoch: 99, train_loss: 0.3589, test_loss: 2.4498, test_f1: 0.6158
##################ITERATION #5 ****************************************
 epoch: 0, train_loss: 1.2941, test_loss: 1.2701, test_f1: 0.3399
 epoch: 1, train_loss: 1.1459, test_loss: 1.1993, test_f1: 0.4608
 epoch: 2, train_loss: 1.0748, test_loss: 1.2044, test_f1: 0.5135
 epoch: 3, train_loss: 1.0424, test_loss: 1.1759, test_f1: 0.5396
 epoch: 4, train_loss: 1.0252, test_loss: 1.2452, test_f1: 0.5292
 epoch: 5, train_loss: 0.9675, test_loss: 1.1767, test_f1: 0.5589
 epoch: 6, train_loss: 0.9752, test_loss: 1.1578, test_f1: 0.5190
 epoch: 7, train_loss: 0.9472, test_loss: 1.2295, test_f1: 0.4998
 epoch: 8, train_loss: 0.9347, test_loss: 1.2473, test_f1: 0.4947
 epoch: 9, train_loss: 0.9146, test_loss: 1.2003, test_f1: 0.5063
 epoch: 10, train_loss: 0.8940, test_loss: 1.2298, test_f1: 0.5522
 epoch: 11, train_loss: 0.8887, test_loss: 1.3159, test_f1: 0.5653
 epoch: 12, train_loss: 0.8776, test_loss: 1.2708, test_f1: 0.5507
 epoch: 13, train_loss: 0.8374, test_loss: 1.1700, test_f1: 0.5503
 epoch: 14, train_loss: 0.8396, test_loss: 1.1818, test_f1: 0.5953
 epoch: 15, train_loss: 0.8260, test_loss: 1.3649, test_f1: 0.5507
 epoch: 16, train_loss: 0.8165, test_loss: 1.1936, test_f1: 0.5661
 epoch: 17, train_loss: 0.7779, test_loss: 1.2273, test_f1: 0.5567
 epoch: 18, train_loss: 0.8110, test_loss: 1.3769, test_f1: 0.4653
 epoch: 19, train_loss: 0.7898, test_loss: 1.1727, test_f1: 0.5887
 epoch: 20, train_loss: 0.7872, test_loss: 1.2097, test_f1: 0.5823
 epoch: 21, train_loss: 0.7806, test_loss: 1.1897, test_f1: 0.5775
 epoch: 22, train_loss: 0.7591, test_loss: 1.4737, test_f1: 0.4921
 epoch: 23, train_loss: 0.7653, test_loss: 1.3194, test_f1: 0.5684
 epoch: 24, train_loss: 0.7617, test_loss: 1.1825, test_f1: 0.5821
 epoch: 25, train_loss: 0.7262, test_loss: 1.2578, test_f1: 0.5162
 epoch: 26, train_loss: 0.7324, test_loss: 1.4421, test_f1: 0.5671
 epoch: 27, train_loss: 0.7385, test_loss: 1.2021, test_f1: 0.5899
 epoch: 28, train_loss: 0.7356, test_loss: 1.3173, test_f1: 0.5691
 epoch: 29, train_loss: 0.7120, test_loss: 1.1860, test_f1: 0.5732
 epoch: 30, train_loss: 0.7068, test_loss: 1.2295, test_f1: 0.5563
 epoch: 31, train_loss: 0.6966, test_loss: 1.4398, test_f1: 0.5132
 epoch: 32, train_loss: 0.6959, test_loss: 1.2368, test_f1: 0.5902
 epoch: 33, train_loss: 0.6889, test_loss: 1.2969, test_f1: 0.5627
 epoch: 34, train_loss: 0.6887, test_loss: 1.2754, test_f1: 0.5407
 epoch: 35, train_loss: 0.6580, test_loss: 1.3388, test_f1: 0.6023
 epoch: 36, train_loss: 0.6591, test_loss: 1.3331, test_f1: 0.5619
 epoch: 37, train_loss: 0.6634, test_loss: 1.4089, test_f1: 0.5679
 epoch: 38, train_loss: 0.6432, test_loss: 1.6029, test_f1: 0.5251
 epoch: 39, train_loss: 0.6280, test_loss: 1.5901, test_f1: 0.5250
 epoch: 40, train_loss: 0.6318, test_loss: 1.5575, test_f1: 0.5649
 epoch: 41, train_loss: 0.6449, test_loss: 1.4116, test_f1: 0.6029
 epoch: 42, train_loss: 0.6119, test_loss: 1.6754, test_f1: 0.5325
 epoch: 43, train_loss: 0.6128, test_loss: 1.6746, test_f1: 0.5570
 epoch: 44, train_loss: 0.5955, test_loss: 1.8016, test_f1: 0.5413
 epoch: 45, train_loss: 0.5879, test_loss: 1.5613, test_f1: 0.5344
 epoch: 46, train_loss: 0.6124, test_loss: 1.6561, test_f1: 0.5558
 epoch: 47, train_loss: 0.6368, test_loss: 1.5147, test_f1: 0.5820
 epoch: 48, train_loss: 0.5845, test_loss: 1.5949, test_f1: 0.5720
 epoch: 49, train_loss: 0.5853, test_loss: 1.5662, test_f1: 0.5494
 epoch: 50, train_loss: 0.5366, test_loss: 2.3038, test_f1: 0.5062
 epoch: 51, train_loss: 0.5226, test_loss: 1.8788, test_f1: 0.5773
 epoch: 52, train_loss: 0.5047, test_loss: 1.7970, test_f1: 0.5383
 epoch: 53, train_loss: 0.5023, test_loss: 1.7568, test_f1: 0.5400
 epoch: 54, train_loss: 0.4966, test_loss: 1.8146, test_f1: 0.5393
 epoch: 55, train_loss: 0.4930, test_loss: 1.8111, test_f1: 0.5650
 epoch: 56, train_loss: 0.4668, test_loss: 1.9454, test_f1: 0.5414
 epoch: 57, train_loss: 0.4642, test_loss: 1.7959, test_f1: 0.5555
 epoch: 58, train_loss: 0.4562, test_loss: 1.8459, test_f1: 0.5574
 epoch: 59, train_loss: 0.4491, test_loss: 1.9136, test_f1: 0.5805
 epoch: 60, train_loss: 0.4305, test_loss: 1.7327, test_f1: 0.5673
 epoch: 61, train_loss: 0.4371, test_loss: 1.8202, test_f1: 0.5629
 epoch: 62, train_loss: 0.4539, test_loss: 1.9151, test_f1: 0.5723
 epoch: 63, train_loss: 0.4619, test_loss: 2.1195, test_f1: 0.5685
 epoch: 64, train_loss: 0.4703, test_loss: 1.7895, test_f1: 0.5625
 epoch: 65, train_loss: 0.4620, test_loss: 1.9977, test_f1: 0.5381
 epoch: 66, train_loss: 0.4621, test_loss: 2.0415, test_f1: 0.5579
 epoch: 67, train_loss: 0.4259, test_loss: 1.7169, test_f1: 0.5794
 epoch: 68, train_loss: 0.4012, test_loss: 2.6671, test_f1: 0.5538
 epoch: 69, train_loss: 0.4296, test_loss: 1.8695, test_f1: 0.5635
 epoch: 70, train_loss: 0.4012, test_loss: 1.8875, test_f1: 0.5743
 epoch: 71, train_loss: 0.4198, test_loss: 2.3492, test_f1: 0.5126
 epoch: 72, train_loss: 0.4103, test_loss: 2.3001, test_f1: 0.5288
 epoch: 73, train_loss: 0.3996, test_loss: 2.0591, test_f1: 0.5792
 epoch: 74, train_loss: 0.3908, test_loss: 2.0552, test_f1: 0.5580
 epoch: 75, train_loss: 0.3787, test_loss: 2.0807, test_f1: 0.6085
 epoch: 76, train_loss: 0.3970, test_loss: 2.0186, test_f1: 0.5423
 epoch: 77, train_loss: 0.3855, test_loss: 1.9669, test_f1: 0.5921
 epoch: 78, train_loss: 0.3941, test_loss: 1.9010, test_f1: 0.5879
 epoch: 79, train_loss: 0.3999, test_loss: 1.8797, test_f1: 0.5926
 epoch: 80, train_loss: 0.3650, test_loss: 2.0059, test_f1: 0.5771
 epoch: 81, train_loss: 0.3573, test_loss: 2.5296, test_f1: 0.5814
 epoch: 82, train_loss: 0.3695, test_loss: 2.1711, test_f1: 0.5779
 epoch: 83, train_loss: 0.3798, test_loss: 2.1675, test_f1: 0.5800
 epoch: 84, train_loss: 0.3564, test_loss: 2.4284, test_f1: 0.5897
 epoch: 85, train_loss: 0.3513, test_loss: 2.3815, test_f1: 0.6176
 epoch: 86, train_loss: 0.3536, test_loss: 2.6304, test_f1: 0.5891
 epoch: 87, train_loss: 0.4102, test_loss: 2.5738, test_f1: 0.5827
 epoch: 88, train_loss: 0.3596, test_loss: 2.4099, test_f1: 0.5970
 epoch: 89, train_loss: 0.3594, test_loss: 2.3644, test_f1: 0.5935
 epoch: 90, train_loss: 0.3258, test_loss: 2.5006, test_f1: 0.5773
 epoch: 91, train_loss: 0.3624, test_loss: 2.4024, test_f1: 0.5840
 epoch: 92, train_loss: 0.3502, test_loss: 2.6562, test_f1: 0.6133
 epoch: 93, train_loss: 0.3506, test_loss: 2.5310, test_f1: 0.5807
 epoch: 94, train_loss: 0.3166, test_loss: 2.4786, test_f1: 0.5964
 epoch: 95, train_loss: 0.3457, test_loss: 2.4067, test_f1: 0.5869
 epoch: 96, train_loss: 0.3200, test_loss: 2.5725, test_f1: 0.5572
 epoch: 97, train_loss: 0.3343, test_loss: 2.4214, test_f1: 0.5527
 epoch: 98, train_loss: 0.3588, test_loss: 2.2790, test_f1: 0.5743
 epoch: 99, train_loss: 0.3657, test_loss: 2.5251, test_f1: 0.5555
##################ITERATION #6 ****************************************
 epoch: 0, train_loss: 1.2830, test_loss: 1.6457, test_f1: 0.4655
 epoch: 1, train_loss: 1.1269, test_loss: 1.2401, test_f1: 0.4973
 epoch: 2, train_loss: 1.0563, test_loss: 1.1684, test_f1: 0.5640
 epoch: 3, train_loss: 1.0288, test_loss: 1.1546, test_f1: 0.5228
 epoch: 4, train_loss: 0.9894, test_loss: 1.0981, test_f1: 0.5597
 epoch: 5, train_loss: 0.9711, test_loss: 1.1385, test_f1: 0.5473
 epoch: 6, train_loss: 0.9700, test_loss: 1.1904, test_f1: 0.5056
 epoch: 7, train_loss: 0.9257, test_loss: 1.3372, test_f1: 0.5707
 epoch: 8, train_loss: 0.9166, test_loss: 1.1927, test_f1: 0.5366
 epoch: 9, train_loss: 0.9099, test_loss: 1.2380, test_f1: 0.5310
 epoch: 10, train_loss: 0.8721, test_loss: 1.1891, test_f1: 0.5114
 epoch: 11, train_loss: 0.8777, test_loss: 1.1066, test_f1: 0.6061
 epoch: 12, train_loss: 0.8765, test_loss: 1.2033, test_f1: 0.5894
 epoch: 13, train_loss: 0.8492, test_loss: 1.2547, test_f1: 0.5566
 epoch: 14, train_loss: 0.8503, test_loss: 1.2657, test_f1: 0.6183
 epoch: 15, train_loss: 0.8440, test_loss: 1.2635, test_f1: 0.5647
 epoch: 16, train_loss: 0.8289, test_loss: 1.1021, test_f1: 0.6478
 epoch: 17, train_loss: 0.8204, test_loss: 1.0682, test_f1: 0.6309
 epoch: 18, train_loss: 0.7751, test_loss: 1.1021, test_f1: 0.6032
 epoch: 19, train_loss: 0.7801, test_loss: 1.1716, test_f1: 0.5860
 epoch: 20, train_loss: 0.7957, test_loss: 1.1424, test_f1: 0.5814
 epoch: 21, train_loss: 0.7851, test_loss: 1.1789, test_f1: 0.5820
 epoch: 22, train_loss: 0.7630, test_loss: 1.2319, test_f1: 0.6302
 epoch: 23, train_loss: 0.7395, test_loss: 1.2523, test_f1: 0.5828
 epoch: 24, train_loss: 0.7432, test_loss: 1.2399, test_f1: 0.5892
 epoch: 25, train_loss: 0.7268, test_loss: 1.1039, test_f1: 0.6119
 epoch: 26, train_loss: 0.7182, test_loss: 1.2519, test_f1: 0.5635
 epoch: 27, train_loss: 0.7225, test_loss: 1.1753, test_f1: 0.6318
 epoch: 28, train_loss: 0.7016, test_loss: 1.3217, test_f1: 0.6066
 epoch: 29, train_loss: 0.7008, test_loss: 1.2462, test_f1: 0.5726
 epoch: 30, train_loss: 0.6777, test_loss: 1.3385, test_f1: 0.6182
 epoch: 31, train_loss: 0.6872, test_loss: 1.2541, test_f1: 0.5620
 epoch: 32, train_loss: 0.6892, test_loss: 1.2991, test_f1: 0.6020
 epoch: 33, train_loss: 0.6646, test_loss: 1.3552, test_f1: 0.6022
 epoch: 34, train_loss: 0.6607, test_loss: 1.2108, test_f1: 0.6192
 epoch: 35, train_loss: 0.6555, test_loss: 1.3647, test_f1: 0.5572
 epoch: 36, train_loss: 0.6410, test_loss: 1.2415, test_f1: 0.5990
 epoch: 37, train_loss: 0.6421, test_loss: 1.2861, test_f1: 0.6079
 epoch: 38, train_loss: 0.6467, test_loss: 1.2511, test_f1: 0.6099
 epoch: 39, train_loss: 0.6388, test_loss: 1.2807, test_f1: 0.6028
 epoch: 40, train_loss: 0.6352, test_loss: 1.2907, test_f1: 0.6194
 epoch: 41, train_loss: 0.6334, test_loss: 1.2352, test_f1: 0.6455
 epoch: 42, train_loss: 0.6244, test_loss: 1.3268, test_f1: 0.6277
 epoch: 43, train_loss: 0.6122, test_loss: 1.4285, test_f1: 0.6089
 epoch: 44, train_loss: 0.6228, test_loss: 1.3317, test_f1: 0.6317
 epoch: 45, train_loss: 0.5929, test_loss: 1.5091, test_f1: 0.5757
 epoch: 46, train_loss: 0.5980, test_loss: 1.3446, test_f1: 0.5770
 epoch: 47, train_loss: 0.5959, test_loss: 1.4130, test_f1: 0.5600
 epoch: 48, train_loss: 0.5864, test_loss: 1.4079, test_f1: 0.6628
 epoch: 49, train_loss: 0.5731, test_loss: 1.4279, test_f1: 0.5473
 epoch: 50, train_loss: 0.5665, test_loss: 1.3559, test_f1: 0.6220
 epoch: 51, train_loss: 0.5359, test_loss: 1.4198, test_f1: 0.5904
 epoch: 52, train_loss: 0.5235, test_loss: 1.4796, test_f1: 0.5938
 epoch: 53, train_loss: 0.4983, test_loss: 1.6192, test_f1: 0.5667
 epoch: 54, train_loss: 0.4816, test_loss: 1.4306, test_f1: 0.6032
 epoch: 55, train_loss: 0.4837, test_loss: 1.5282, test_f1: 0.5743
 epoch: 56, train_loss: 0.4766, test_loss: 1.6356, test_f1: 0.5561
 epoch: 57, train_loss: 0.4899, test_loss: 1.7245, test_f1: 0.5477
 epoch: 58, train_loss: 0.4786, test_loss: 1.4994, test_f1: 0.5973
 epoch: 59, train_loss: 0.4364, test_loss: 1.5465, test_f1: 0.5677
 epoch: 60, train_loss: 0.4689, test_loss: 1.6017, test_f1: 0.5767
 epoch: 61, train_loss: 0.4751, test_loss: 1.5895, test_f1: 0.5644
 epoch: 62, train_loss: 0.4637, test_loss: 1.4556, test_f1: 0.5776
 epoch: 63, train_loss: 0.4534, test_loss: 1.5224, test_f1: 0.5937
 epoch: 64, train_loss: 0.4429, test_loss: 1.6161, test_f1: 0.5439
 epoch: 65, train_loss: 0.4427, test_loss: 1.7605, test_f1: 0.5808
 epoch: 66, train_loss: 0.4530, test_loss: 1.7006, test_f1: 0.5785
 epoch: 67, train_loss: 0.4283, test_loss: 1.8565, test_f1: 0.5557
 epoch: 68, train_loss: 0.4216, test_loss: 1.7131, test_f1: 0.6244
 epoch: 69, train_loss: 0.4398, test_loss: 1.5809, test_f1: 0.5692
 epoch: 70, train_loss: 0.4165, test_loss: 1.6918, test_f1: 0.6007
 epoch: 71, train_loss: 0.4429, test_loss: 1.5027, test_f1: 0.6005
 epoch: 72, train_loss: 0.4258, test_loss: 1.8359, test_f1: 0.5897
 epoch: 73, train_loss: 0.4031, test_loss: 1.6935, test_f1: 0.5902
 epoch: 74, train_loss: 0.4313, test_loss: 1.7626, test_f1: 0.5678
 epoch: 75, train_loss: 0.4033, test_loss: 1.9355, test_f1: 0.5542
 epoch: 76, train_loss: 0.3895, test_loss: 1.8869, test_f1: 0.5719
 epoch: 77, train_loss: 0.4003, test_loss: 1.8058, test_f1: 0.5746
 epoch: 78, train_loss: 0.4158, test_loss: 1.7482, test_f1: 0.5811
 epoch: 79, train_loss: 0.4142, test_loss: 1.8072, test_f1: 0.5901
 epoch: 80, train_loss: 0.3968, test_loss: 1.9623, test_f1: 0.5768
 epoch: 81, train_loss: 0.3530, test_loss: 1.9137, test_f1: 0.5792
 epoch: 82, train_loss: 0.3647, test_loss: 1.8920, test_f1: 0.6102
 epoch: 83, train_loss: 0.3924, test_loss: 2.1234, test_f1: 0.5921
 epoch: 84, train_loss: 0.3840, test_loss: 1.7998, test_f1: 0.6224
 epoch: 85, train_loss: 0.3696, test_loss: 2.2862, test_f1: 0.5660
 epoch: 86, train_loss: 0.3599, test_loss: 1.7433, test_f1: 0.6165
 epoch: 87, train_loss: 0.3448, test_loss: 2.3995, test_f1: 0.5904
 epoch: 88, train_loss: 0.3625, test_loss: 2.1394, test_f1: 0.5539
 epoch: 89, train_loss: 0.3832, test_loss: 1.7376, test_f1: 0.6337
 epoch: 90, train_loss: 0.3659, test_loss: 1.9040, test_f1: 0.5863
 epoch: 91, train_loss: 0.3653, test_loss: 1.9993, test_f1: 0.5886
 epoch: 92, train_loss: 0.3600, test_loss: 2.0093, test_f1: 0.6014
 epoch: 93, train_loss: 0.3651, test_loss: 2.0405, test_f1: 0.5701
 epoch: 94, train_loss: 0.3895, test_loss: 2.1669, test_f1: 0.5546
 epoch: 95, train_loss: 0.3625, test_loss: 2.1511, test_f1: 0.5921
 epoch: 96, train_loss: 0.3111, test_loss: 2.1986, test_f1: 0.5636
 epoch: 97, train_loss: 0.3460, test_loss: 2.4614, test_f1: 0.5774
 epoch: 98, train_loss: 0.3297, test_loss: 2.0838, test_f1: 0.5632
 epoch: 99, train_loss: 0.3476, test_loss: 2.2377, test_f1: 0.5668
##################ITERATION #7 ****************************************
 epoch: 0, train_loss: 1.3033, test_loss: 1.2891, test_f1: 0.3735
 epoch: 1, train_loss: 1.1088, test_loss: 1.2677, test_f1: 0.4887
 epoch: 2, train_loss: 1.0392, test_loss: 1.2829, test_f1: 0.5113
 epoch: 3, train_loss: 0.9974, test_loss: 1.1766, test_f1: 0.5218
 epoch: 4, train_loss: 0.9716, test_loss: 1.1394, test_f1: 0.5102
 epoch: 5, train_loss: 0.9597, test_loss: 1.0941, test_f1: 0.5926
 epoch: 6, train_loss: 0.9091, test_loss: 1.0838, test_f1: 0.5538
 epoch: 7, train_loss: 0.8923, test_loss: 1.1107, test_f1: 0.5661
 epoch: 8, train_loss: 0.8714, test_loss: 1.1388, test_f1: 0.6103
 epoch: 9, train_loss: 0.8744, test_loss: 1.1664, test_f1: 0.5885
 epoch: 10, train_loss: 0.8466, test_loss: 1.1466, test_f1: 0.5463
 epoch: 11, train_loss: 0.8244, test_loss: 1.1529, test_f1: 0.5609
 epoch: 12, train_loss: 0.8594, test_loss: 1.1037, test_f1: 0.5667
 epoch: 13, train_loss: 0.8148, test_loss: 1.1899, test_f1: 0.5772
 epoch: 14, train_loss: 0.8010, test_loss: 1.1216, test_f1: 0.5661
 epoch: 15, train_loss: 0.7842, test_loss: 1.2497, test_f1: 0.6125
 epoch: 16, train_loss: 0.7719, test_loss: 1.1890, test_f1: 0.6466
 epoch: 17, train_loss: 0.7504, test_loss: 1.1082, test_f1: 0.6327
 epoch: 18, train_loss: 0.7424, test_loss: 1.1757, test_f1: 0.6103
 epoch: 19, train_loss: 0.7395, test_loss: 1.2400, test_f1: 0.6075
 epoch: 20, train_loss: 0.7267, test_loss: 1.2133, test_f1: 0.6006
 epoch: 21, train_loss: 0.7010, test_loss: 1.2561, test_f1: 0.6166
 epoch: 22, train_loss: 0.6822, test_loss: 1.2414, test_f1: 0.6421
 epoch: 23, train_loss: 0.7093, test_loss: 1.2869, test_f1: 0.6220
 epoch: 24, train_loss: 0.6776, test_loss: 1.2812, test_f1: 0.6425
 epoch: 25, train_loss: 0.6662, test_loss: 1.3312, test_f1: 0.5725
 epoch: 26, train_loss: 0.6785, test_loss: 1.3137, test_f1: 0.6402
 epoch: 27, train_loss: 0.6466, test_loss: 1.2846, test_f1: 0.6086
 epoch: 28, train_loss: 0.6773, test_loss: 1.4369, test_f1: 0.6092
 epoch: 29, train_loss: 0.6337, test_loss: 1.4136, test_f1: 0.6336
 epoch: 30, train_loss: 0.6259, test_loss: 1.2953, test_f1: 0.6516
 epoch: 31, train_loss: 0.6004, test_loss: 1.4220, test_f1: 0.6355
 epoch: 32, train_loss: 0.6208, test_loss: 1.7714, test_f1: 0.6376
 epoch: 33, train_loss: 0.6410, test_loss: 1.3782, test_f1: 0.5965
 epoch: 34, train_loss: 0.6352, test_loss: 1.3710, test_f1: 0.5794
 epoch: 35, train_loss: 0.5986, test_loss: 1.5695, test_f1: 0.5843
 epoch: 36, train_loss: 0.5883, test_loss: 1.4729, test_f1: 0.6256
 epoch: 37, train_loss: 0.5706, test_loss: 1.4844, test_f1: 0.6154
 epoch: 38, train_loss: 0.5832, test_loss: 1.5058, test_f1: 0.5975
 epoch: 39, train_loss: 0.5708, test_loss: 1.5107, test_f1: 0.6205
 epoch: 40, train_loss: 0.5442, test_loss: 1.6002, test_f1: 0.6033
 epoch: 41, train_loss: 0.5561, test_loss: 1.4747, test_f1: 0.6198
 epoch: 42, train_loss: 0.5491, test_loss: 1.4738, test_f1: 0.6364
 epoch: 43, train_loss: 0.5487, test_loss: 1.5077, test_f1: 0.6244
 epoch: 44, train_loss: 0.5310, test_loss: 1.7059, test_f1: 0.6063
 epoch: 45, train_loss: 0.5581, test_loss: 1.5082, test_f1: 0.6042
 epoch: 46, train_loss: 0.5299, test_loss: 1.5239, test_f1: 0.6348
 epoch: 47, train_loss: 0.5156, test_loss: 1.8463, test_f1: 0.6421
 epoch: 48, train_loss: 0.5175, test_loss: 1.7849, test_f1: 0.6500
 epoch: 49, train_loss: 0.5454, test_loss: 1.6545, test_f1: 0.6274
 epoch: 50, train_loss: 0.5187, test_loss: 1.9993, test_f1: 0.6125
 epoch: 51, train_loss: 0.4810, test_loss: 1.9022, test_f1: 0.6239
 epoch: 52, train_loss: 0.4477, test_loss: 1.8885, test_f1: 0.6366
 epoch: 53, train_loss: 0.4106, test_loss: 1.8092, test_f1: 0.6362
 epoch: 54, train_loss: 0.4035, test_loss: 1.8482, test_f1: 0.6153
 epoch: 55, train_loss: 0.3970, test_loss: 1.7780, test_f1: 0.6449
 epoch: 56, train_loss: 0.4074, test_loss: 1.8323, test_f1: 0.6432
 epoch: 57, train_loss: 0.3967, test_loss: 2.0576, test_f1: 0.6420
 epoch: 58, train_loss: 0.3989, test_loss: 1.9725, test_f1: 0.6364
 epoch: 59, train_loss: 0.4047, test_loss: 1.9945, test_f1: 0.6488
 epoch: 60, train_loss: 0.4121, test_loss: 2.2846, test_f1: 0.6396
 epoch: 61, train_loss: 0.3950, test_loss: 2.2652, test_f1: 0.6672
 epoch: 62, train_loss: 0.3712, test_loss: 2.2188, test_f1: 0.6276
 epoch: 63, train_loss: 0.3887, test_loss: 2.0552, test_f1: 0.6389
 epoch: 64, train_loss: 0.3719, test_loss: 2.1262, test_f1: 0.6225
 epoch: 65, train_loss: 0.3830, test_loss: 2.1321, test_f1: 0.6327
 epoch: 66, train_loss: 0.3678, test_loss: 2.4031, test_f1: 0.6399
 epoch: 67, train_loss: 0.3794, test_loss: 2.3580, test_f1: 0.6478
 epoch: 68, train_loss: 0.3826, test_loss: 2.1883, test_f1: 0.6024
 epoch: 69, train_loss: 0.3757, test_loss: 2.4401, test_f1: 0.6159
 epoch: 70, train_loss: 0.3467, test_loss: 2.2908, test_f1: 0.6311
 epoch: 71, train_loss: 0.3427, test_loss: 2.2961, test_f1: 0.6248
 epoch: 72, train_loss: 0.3584, test_loss: 2.4858, test_f1: 0.6004
 epoch: 73, train_loss: 0.3794, test_loss: 2.6898, test_f1: 0.5889
 epoch: 74, train_loss: 0.3388, test_loss: 2.3741, test_f1: 0.6041
 epoch: 75, train_loss: 0.3380, test_loss: 2.2307, test_f1: 0.6261
 epoch: 76, train_loss: 0.3440, test_loss: 2.2645, test_f1: 0.6354
 epoch: 77, train_loss: 0.3447, test_loss: 2.3843, test_f1: 0.6094
 epoch: 78, train_loss: 0.3358, test_loss: 2.3084, test_f1: 0.6339
 epoch: 79, train_loss: 0.3357, test_loss: 2.2032, test_f1: 0.6397
 epoch: 80, train_loss: 0.3398, test_loss: 2.2689, test_f1: 0.6486
 epoch: 81, train_loss: 0.3447, test_loss: 2.2413, test_f1: 0.6012
 epoch: 82, train_loss: 0.3439, test_loss: 2.2053, test_f1: 0.6337
 epoch: 83, train_loss: 0.3028, test_loss: 2.1385, test_f1: 0.6361
 epoch: 84, train_loss: 0.3106, test_loss: 2.3240, test_f1: 0.6257
 epoch: 85, train_loss: 0.3352, test_loss: 2.5111, test_f1: 0.6126
 epoch: 86, train_loss: 0.3027, test_loss: 2.3125, test_f1: 0.6120
 epoch: 87, train_loss: 0.3108, test_loss: 2.3896, test_f1: 0.6317
 epoch: 88, train_loss: 0.3110, test_loss: 2.1201, test_f1: 0.6459
 epoch: 89, train_loss: 0.3288, test_loss: 2.2316, test_f1: 0.6102
 epoch: 90, train_loss: 0.3244, test_loss: 2.2726, test_f1: 0.6260
 epoch: 91, train_loss: 0.3173, test_loss: 2.5023, test_f1: 0.6269
 epoch: 92, train_loss: 0.3220, test_loss: 2.4659, test_f1: 0.6378
 epoch: 93, train_loss: 0.2918, test_loss: 2.3471, test_f1: 0.6363
 epoch: 94, train_loss: 0.2999, test_loss: 2.5110, test_f1: 0.6235
 epoch: 95, train_loss: 0.3214, test_loss: 2.3598, test_f1: 0.6324
 epoch: 96, train_loss: 0.3092, test_loss: 2.5649, test_f1: 0.6332
 epoch: 97, train_loss: 0.3171, test_loss: 2.6039, test_f1: 0.6340
 epoch: 98, train_loss: 0.2941, test_loss: 2.6202, test_f1: 0.6399
 epoch: 99, train_loss: 0.2910, test_loss: 2.4949, test_f1: 0.6392
##################ITERATION #8 ****************************************
 epoch: 0, train_loss: 1.3027, test_loss: 1.3312, test_f1: 0.4223
 epoch: 1, train_loss: 1.1502, test_loss: 1.2728, test_f1: 0.4916
 epoch: 2, train_loss: 1.0983, test_loss: 1.2631, test_f1: 0.5259
 epoch: 3, train_loss: 1.0555, test_loss: 1.3049, test_f1: 0.5157
 epoch: 4, train_loss: 1.0187, test_loss: 1.2682, test_f1: 0.4980
 epoch: 5, train_loss: 0.9930, test_loss: 1.2515, test_f1: 0.5494
 epoch: 6, train_loss: 0.9923, test_loss: 1.2819, test_f1: 0.5541
 epoch: 7, train_loss: 0.9495, test_loss: 1.1839, test_f1: 0.5134
 epoch: 8, train_loss: 0.9089, test_loss: 1.1378, test_f1: 0.5585
 epoch: 9, train_loss: 0.9200, test_loss: 1.1629, test_f1: 0.5335
 epoch: 10, train_loss: 0.8839, test_loss: 1.1427, test_f1: 0.6001
 epoch: 11, train_loss: 0.8759, test_loss: 1.1759, test_f1: 0.6011
 epoch: 12, train_loss: 0.8607, test_loss: 1.2624, test_f1: 0.5780
 epoch: 13, train_loss: 0.8337, test_loss: 1.2363, test_f1: 0.5931
 epoch: 14, train_loss: 0.8419, test_loss: 1.1770, test_f1: 0.5808
 epoch: 15, train_loss: 0.8141, test_loss: 1.3366, test_f1: 0.5393
 epoch: 16, train_loss: 0.8111, test_loss: 1.1948, test_f1: 0.5802
 epoch: 17, train_loss: 0.7649, test_loss: 1.1836, test_f1: 0.5779
 epoch: 18, train_loss: 0.8015, test_loss: 1.3296, test_f1: 0.5894
 epoch: 19, train_loss: 0.7478, test_loss: 1.2329, test_f1: 0.5718
 epoch: 20, train_loss: 0.7603, test_loss: 1.1746, test_f1: 0.5996
 epoch: 21, train_loss: 0.7389, test_loss: 1.3369, test_f1: 0.5892
 epoch: 22, train_loss: 0.7399, test_loss: 1.3627, test_f1: 0.4960
 epoch: 23, train_loss: 0.7480, test_loss: 1.3496, test_f1: 0.6198
 epoch: 24, train_loss: 0.7614, test_loss: 1.3953, test_f1: 0.5733
 epoch: 25, train_loss: 0.7362, test_loss: 1.3191, test_f1: 0.5564
 epoch: 26, train_loss: 0.7301, test_loss: 1.3854, test_f1: 0.6163
 epoch: 27, train_loss: 0.7214, test_loss: 1.4745, test_f1: 0.5938
 epoch: 28, train_loss: 0.7029, test_loss: 1.4794, test_f1: 0.5606
 epoch: 29, train_loss: 0.7095, test_loss: 1.4180, test_f1: 0.5587
 epoch: 30, train_loss: 0.6944, test_loss: 1.4030, test_f1: 0.5876
 epoch: 31, train_loss: 0.6928, test_loss: 1.5018, test_f1: 0.5440
 epoch: 32, train_loss: 0.6751, test_loss: 1.4528, test_f1: 0.5734
 epoch: 33, train_loss: 0.6712, test_loss: 1.4863, test_f1: 0.5542
 epoch: 34, train_loss: 0.6494, test_loss: 1.3514, test_f1: 0.5770
 epoch: 35, train_loss: 0.6185, test_loss: 1.5667, test_f1: 0.5871
 epoch: 36, train_loss: 0.6352, test_loss: 1.6639, test_f1: 0.5761
 epoch: 37, train_loss: 0.6424, test_loss: 1.2995, test_f1: 0.5948
 epoch: 38, train_loss: 0.6399, test_loss: 1.6642, test_f1: 0.5260
 epoch: 39, train_loss: 0.6262, test_loss: 1.5459, test_f1: 0.5481
 epoch: 40, train_loss: 0.6177, test_loss: 1.6066, test_f1: 0.5728
 epoch: 41, train_loss: 0.6149, test_loss: 1.4096, test_f1: 0.5852
 epoch: 42, train_loss: 0.5873, test_loss: 1.5195, test_f1: 0.5661
 epoch: 43, train_loss: 0.6171, test_loss: 1.9298, test_f1: 0.5048
 epoch: 44, train_loss: 0.6041, test_loss: 1.6386, test_f1: 0.5550
 epoch: 45, train_loss: 0.6173, test_loss: 1.6685, test_f1: 0.5369
 epoch: 46, train_loss: 0.5643, test_loss: 1.6079, test_f1: 0.5561
 epoch: 47, train_loss: 0.5795, test_loss: 1.5156, test_f1: 0.5533
 epoch: 48, train_loss: 0.5472, test_loss: 1.7026, test_f1: 0.6000
 epoch: 49, train_loss: 0.5573, test_loss: 1.7767, test_f1: 0.5417
 epoch: 50, train_loss: 0.5506, test_loss: 2.0184, test_f1: 0.5752
 epoch: 51, train_loss: 0.5115, test_loss: 1.6774, test_f1: 0.5464
 epoch: 52, train_loss: 0.5012, test_loss: 1.7268, test_f1: 0.6048
 epoch: 53, train_loss: 0.5083, test_loss: 1.7605, test_f1: 0.5618
 epoch: 54, train_loss: 0.4543, test_loss: 1.8350, test_f1: 0.5528
 epoch: 55, train_loss: 0.4579, test_loss: 1.7139, test_f1: 0.5830
 epoch: 56, train_loss: 0.4538, test_loss: 1.7801, test_f1: 0.5990
 epoch: 57, train_loss: 0.4261, test_loss: 1.8210, test_f1: 0.5972
 epoch: 58, train_loss: 0.4428, test_loss: 2.0348, test_f1: 0.5705
 epoch: 59, train_loss: 0.4386, test_loss: 1.9475, test_f1: 0.5957
 epoch: 60, train_loss: 0.4568, test_loss: 1.8127, test_f1: 0.5765
 epoch: 61, train_loss: 0.4455, test_loss: 1.9982, test_f1: 0.5772
 epoch: 62, train_loss: 0.4332, test_loss: 1.9685, test_f1: 0.5725
 epoch: 63, train_loss: 0.4055, test_loss: 2.1186, test_f1: 0.5764
 epoch: 64, train_loss: 0.3884, test_loss: 2.1613, test_f1: 0.5785
 epoch: 65, train_loss: 0.4061, test_loss: 2.0958, test_f1: 0.5506
 epoch: 66, train_loss: 0.4027, test_loss: 1.8770, test_f1: 0.5766
 epoch: 67, train_loss: 0.3974, test_loss: 2.5853, test_f1: 0.6001
 epoch: 68, train_loss: 0.3931, test_loss: 2.0844, test_f1: 0.5395
 epoch: 69, train_loss: 0.4203, test_loss: 1.9460, test_f1: 0.5841
 epoch: 70, train_loss: 0.3886, test_loss: 2.5643, test_f1: 0.5852
 epoch: 71, train_loss: 0.3878, test_loss: 2.4850, test_f1: 0.5561
 epoch: 72, train_loss: 0.4013, test_loss: 2.2077, test_f1: 0.5786
 epoch: 73, train_loss: 0.3900, test_loss: 2.1724, test_f1: 0.6023
 epoch: 74, train_loss: 0.3915, test_loss: 2.8585, test_f1: 0.5670
 epoch: 75, train_loss: 0.3965, test_loss: 2.6093, test_f1: 0.5934
 epoch: 76, train_loss: 0.3925, test_loss: 2.5496, test_f1: 0.5724
 epoch: 77, train_loss: 0.3948, test_loss: 2.5651, test_f1: 0.5582
 epoch: 78, train_loss: 0.3805, test_loss: 2.8792, test_f1: 0.5757
 epoch: 79, train_loss: 0.3747, test_loss: 2.3741, test_f1: 0.5866
 epoch: 80, train_loss: 0.3862, test_loss: 2.7415, test_f1: 0.5449
 epoch: 81, train_loss: 0.3804, test_loss: 2.5845, test_f1: 0.5790
 epoch: 82, train_loss: 0.3474, test_loss: 2.2456, test_f1: 0.6083
 epoch: 83, train_loss: 0.3457, test_loss: 2.5180, test_f1: 0.5597
 epoch: 84, train_loss: 0.3514, test_loss: 2.4844, test_f1: 0.5292
 epoch: 85, train_loss: 0.3514, test_loss: 2.5763, test_f1: 0.5608
 epoch: 86, train_loss: 0.3640, test_loss: 2.8086, test_f1: 0.5688
 epoch: 87, train_loss: 0.3675, test_loss: 2.3315, test_f1: 0.5807
 epoch: 88, train_loss: 0.3395, test_loss: 2.8019, test_f1: 0.5472
 epoch: 89, train_loss: 0.3494, test_loss: 2.7025, test_f1: 0.5768
 epoch: 90, train_loss: 0.3872, test_loss: 2.8185, test_f1: 0.5651
 epoch: 91, train_loss: 0.3564, test_loss: 2.5480, test_f1: 0.5663
 epoch: 92, train_loss: 0.3338, test_loss: 2.4543, test_f1: 0.5736
 epoch: 93, train_loss: 0.3702, test_loss: 3.2753, test_f1: 0.5594
 epoch: 94, train_loss: 0.3381, test_loss: 2.9036, test_f1: 0.5668
 epoch: 95, train_loss: 0.3371, test_loss: 3.3284, test_f1: 0.5326
 epoch: 96, train_loss: 0.3376, test_loss: 2.5982, test_f1: 0.5711
 epoch: 97, train_loss: 0.3269, test_loss: 2.9425, test_f1: 0.5730
 epoch: 98, train_loss: 0.3201, test_loss: 2.8916, test_f1: 0.5547
 epoch: 99, train_loss: 0.3163, test_loss: 2.7443, test_f1: 0.5789
##################ITERATION #9 ****************************************
 epoch: 0, train_loss: 1.3590, test_loss: 1.3289, test_f1: 0.3939
 epoch: 1, train_loss: 1.1838, test_loss: 1.2314, test_f1: 0.4298
 epoch: 2, train_loss: 1.1186, test_loss: 1.2099, test_f1: 0.4640
 epoch: 3, train_loss: 1.0695, test_loss: 1.1838, test_f1: 0.5588
 epoch: 4, train_loss: 1.0337, test_loss: 1.1881, test_f1: 0.5056
 epoch: 5, train_loss: 0.9970, test_loss: 1.1566, test_f1: 0.5100
 epoch: 6, train_loss: 0.9517, test_loss: 1.1589, test_f1: 0.5321
 epoch: 7, train_loss: 0.9044, test_loss: 1.1326, test_f1: 0.5862
 epoch: 8, train_loss: 0.9030, test_loss: 1.2176, test_f1: 0.5720
 epoch: 9, train_loss: 0.9112, test_loss: 1.1421, test_f1: 0.6095
 epoch: 10, train_loss: 0.8678, test_loss: 1.2210, test_f1: 0.4994
 epoch: 11, train_loss: 0.8680, test_loss: 1.1688, test_f1: 0.5532
 epoch: 12, train_loss: 0.8452, test_loss: 1.1258, test_f1: 0.5894
 epoch: 13, train_loss: 0.8171, test_loss: 1.2696, test_f1: 0.5590
 epoch: 14, train_loss: 0.8215, test_loss: 1.1789, test_f1: 0.5643
 epoch: 15, train_loss: 0.8296, test_loss: 1.3008, test_f1: 0.5829
 epoch: 16, train_loss: 0.7925, test_loss: 1.3493, test_f1: 0.6242
 epoch: 17, train_loss: 0.7905, test_loss: 1.4502, test_f1: 0.6346
 epoch: 18, train_loss: 0.7738, test_loss: 1.3675, test_f1: 0.5509
 epoch: 19, train_loss: 0.7766, test_loss: 1.3728, test_f1: 0.5448
 epoch: 20, train_loss: 0.7646, test_loss: 1.5007, test_f1: 0.5644
 epoch: 21, train_loss: 0.7495, test_loss: 1.3362, test_f1: 0.5933
 epoch: 22, train_loss: 0.7230, test_loss: 1.3686, test_f1: 0.5907
 epoch: 23, train_loss: 0.7210, test_loss: 1.4488, test_f1: 0.5690
 epoch: 24, train_loss: 0.7079, test_loss: 1.4062, test_f1: 0.5733
 epoch: 25, train_loss: 0.7021, test_loss: 1.2246, test_f1: 0.6055
 epoch: 26, train_loss: 0.7003, test_loss: 1.3949, test_f1: 0.6033
 epoch: 27, train_loss: 0.6830, test_loss: 1.5880, test_f1: 0.6033
 epoch: 28, train_loss: 0.6628, test_loss: 1.4908, test_f1: 0.5686
 epoch: 29, train_loss: 0.6522, test_loss: 1.6309, test_f1: 0.5538
 epoch: 30, train_loss: 0.6673, test_loss: 1.4978, test_f1: 0.5674
 epoch: 31, train_loss: 0.6451, test_loss: 1.5735, test_f1: 0.5619
 epoch: 32, train_loss: 0.6635, test_loss: 1.3784, test_f1: 0.5969
 epoch: 33, train_loss: 0.6256, test_loss: 1.5893, test_f1: 0.5438
 epoch: 34, train_loss: 0.6213, test_loss: 1.4953, test_f1: 0.5780
 epoch: 35, train_loss: 0.5753, test_loss: 1.7399, test_f1: 0.5803
 epoch: 36, train_loss: 0.5853, test_loss: 1.5376, test_f1: 0.6037
 epoch: 37, train_loss: 0.5738, test_loss: 1.5613, test_f1: 0.6270
 epoch: 38, train_loss: 0.5807, test_loss: 1.7263, test_f1: 0.5493
 epoch: 39, train_loss: 0.5616, test_loss: 1.7287, test_f1: 0.5799
 epoch: 40, train_loss: 0.5828, test_loss: 1.6886, test_f1: 0.5930
 epoch: 41, train_loss: 0.5761, test_loss: 1.6389, test_f1: 0.5490
 epoch: 42, train_loss: 0.5448, test_loss: 1.7705, test_f1: 0.6083
 epoch: 43, train_loss: 0.5359, test_loss: 1.7274, test_f1: 0.6024
 epoch: 44, train_loss: 0.5345, test_loss: 1.8468, test_f1: 0.5755
 epoch: 45, train_loss: 0.5062, test_loss: 2.0148, test_f1: 0.5592
 epoch: 46, train_loss: 0.4717, test_loss: 1.7370, test_f1: 0.5700
 epoch: 47, train_loss: 0.5152, test_loss: 2.0880, test_f1: 0.5563
 epoch: 48, train_loss: 0.5167, test_loss: 1.8498, test_f1: 0.5817
 epoch: 49, train_loss: 0.5113, test_loss: 1.9281, test_f1: 0.5757
 epoch: 50, train_loss: 0.5089, test_loss: 1.9256, test_f1: 0.5855
 epoch: 51, train_loss: 0.4540, test_loss: 1.7467, test_f1: 0.6070
 epoch: 52, train_loss: 0.4199, test_loss: 1.9603, test_f1: 0.5820
 epoch: 53, train_loss: 0.4037, test_loss: 2.1091, test_f1: 0.5903
 epoch: 54, train_loss: 0.4019, test_loss: 2.0878, test_f1: 0.5780
 epoch: 55, train_loss: 0.4035, test_loss: 2.1106, test_f1: 0.5897
 epoch: 56, train_loss: 0.4049, test_loss: 1.9752, test_f1: 0.6066
 epoch: 57, train_loss: 0.3872, test_loss: 1.9342, test_f1: 0.6172
 epoch: 58, train_loss: 0.3887, test_loss: 2.0323, test_f1: 0.5960
 epoch: 59, train_loss: 0.3874, test_loss: 2.0549, test_f1: 0.5923
 epoch: 60, train_loss: 0.3751, test_loss: 2.2096, test_f1: 0.5927
 epoch: 61, train_loss: 0.3751, test_loss: 2.1515, test_f1: 0.5967
 epoch: 62, train_loss: 0.3563, test_loss: 2.3358, test_f1: 0.6004
 epoch: 63, train_loss: 0.3614, test_loss: 2.1850, test_f1: 0.5837
 epoch: 64, train_loss: 0.3386, test_loss: 2.4719, test_f1: 0.5955
 epoch: 65, train_loss: 0.3496, test_loss: 2.5711, test_f1: 0.5641
 epoch: 66, train_loss: 0.3605, test_loss: 2.7824, test_f1: 0.5548
 epoch: 67, train_loss: 0.3227, test_loss: 2.5005, test_f1: 0.5908
 epoch: 68, train_loss: 0.3550, test_loss: 2.5330, test_f1: 0.5888
 epoch: 69, train_loss: 0.3530, test_loss: 2.5172, test_f1: 0.5865
 epoch: 70, train_loss: 0.3802, test_loss: 2.2295, test_f1: 0.5639
 epoch: 71, train_loss: 0.3507, test_loss: 2.3624, test_f1: 0.5754
 epoch: 72, train_loss: 0.3336, test_loss: 2.2344, test_f1: 0.6116
 epoch: 73, train_loss: 0.3430, test_loss: 2.5386, test_f1: 0.5595
 epoch: 74, train_loss: 0.3436, test_loss: 2.6753, test_f1: 0.5527
 epoch: 75, train_loss: 0.3306, test_loss: 2.4812, test_f1: 0.5736
 epoch: 76, train_loss: 0.3394, test_loss: 2.9313, test_f1: 0.5937
 epoch: 77, train_loss: 0.3143, test_loss: 2.3635, test_f1: 0.5966
 epoch: 78, train_loss: 0.3345, test_loss: 2.5989, test_f1: 0.5663
 epoch: 79, train_loss: 0.3380, test_loss: 2.3826, test_f1: 0.5993
 epoch: 80, train_loss: 0.2947, test_loss: 2.5578, test_f1: 0.5833
 epoch: 81, train_loss: 0.3155, test_loss: 2.7112, test_f1: 0.5854
 epoch: 82, train_loss: 0.3118, test_loss: 2.6673, test_f1: 0.5646
 epoch: 83, train_loss: 0.3189, test_loss: 2.8169, test_f1: 0.5850
 epoch: 84, train_loss: 0.3038, test_loss: 2.7078, test_f1: 0.6067
 epoch: 85, train_loss: 0.2973, test_loss: 2.7920, test_f1: 0.5872
 epoch: 86, train_loss: 0.3137, test_loss: 2.8218, test_f1: 0.5954
 epoch: 87, train_loss: 0.2886, test_loss: 2.7471, test_f1: 0.5858
 epoch: 88, train_loss: 0.3173, test_loss: 2.5325, test_f1: 0.5933
 epoch: 89, train_loss: 0.3057, test_loss: 2.5362, test_f1: 0.6032
 epoch: 90, train_loss: 0.2950, test_loss: 2.7559, test_f1: 0.5942
 epoch: 91, train_loss: 0.2875, test_loss: 2.8122, test_f1: 0.5800
 epoch: 92, train_loss: 0.2792, test_loss: 2.6287, test_f1: 0.5909
 epoch: 93, train_loss: 0.3090, test_loss: 2.6309, test_f1: 0.5820
 epoch: 94, train_loss: 0.3092, test_loss: 3.0133, test_f1: 0.5894
 epoch: 95, train_loss: 0.2615, test_loss: 2.6453, test_f1: 0.5682
 epoch: 96, train_loss: 0.2626, test_loss: 2.8541, test_f1: 0.5885
 epoch: 97, train_loss: 0.2883, test_loss: 2.7533, test_f1: 0.6017
 epoch: 98, train_loss: 0.2818, test_loss: 2.7395, test_f1: 0.5892
 epoch: 99, train_loss: 0.2759, test_loss: 2.9518, test_f1: 0.6225

Training completed in 971.58 seconds
Best F1: 0.6672 at epoch 61
Mean F1 across iterations: 0.6369  0.0155
========================FINAL RESULTS================================
FEGIN weighted F1: 0.6672  0.0155
python main.py --data ltspice_demos --representation component_component --model FEGIN --layers 4 --hiddens 64 --batch_size 32 --lr 0.001 --emb_size 128 --epochs 100 --save_appendix component_component_L4_H64_BS32_LR0.001_E128 --no_val
-----



STDERR:
  File "main.py", line 370, in <module>
    main()
  File "main.py", line 254, in main
    dataset = dataset_class(
  File "/home/philip/projects/ltspice_examples_code_repo/Circuit-Completion-Using-GNNs/component_classification_with_link_prediction_head/evaluation/FEGIN/kernel/circuit_datasets.py", line 15, in __init__
    self.data, self.slices = torch.load(self.processed_paths[0])
  File "/home/philip/.local/lib/python3.8/site-packages/torch/serialization.py", line 1040, in load
    warnings.warn(
  File "/usr/lib/python3.8/warnings.py", line 109, in _showwarnmsg
    sw(msg.message, msg.category, msg.filename, msg.lineno,
  File "main.py", line 47, in warn_with_traceback
    traceback.print_stack(file=log)
/home/philip/projects/ltspice_examples_code_repo/Circuit-Completion-Using-GNNs/component_classification_with_link_prediction_head/evaluation/FEGIN/kernel/circuit_datasets.py:15: FutureWarning: You are using `torch.load` with `weights_only=False` (the current default value), which uses the default pickle module implicitly. It is possible to construct malicious pickle data which will execute arbitrary code during unpickling (See https://github.com/pytorch/pytorch/blob/main/SECURITY.md#untrusted-models for more details). In a future release, the default value for `weights_only` will be flipped to `True`. This limits the functions that could be executed during unpickling. Arbitrary objects will no longer be allowed to be loaded via this mode unless they are explicitly allowlisted by the user via `torch.serialization.add_safe_globals`. We recommend you start setting `weights_only=True` for any use case where you don't have full control of the loaded file. Please open an issue on GitHub for any issues related to this experimental feature.
  self.data, self.slices = torch.load(self.processed_paths[0])
