STDOUT:
Results will be saved in /home/philip/projects/ltspice_examples_code_repo/Circuit-Completion-Using-GNNs/component_classification_with_link_prediction_head/evaluation/FEGIN/results/model_FEGIN_dataset_ltspice_demos
Command line input: python main.py --data ltspice_demos --representation component_net --model FEGIN --layers 6 --hiddens 128 --batch_size 128 --lr 0.001 --emb_size 128 --epochs 100 --save_appendix component_net_L6_H128_BS128_LR0.001_E128 --no_val
 is saved.
-----
ltspice_demos - FEGIN
Using 6 layers, 128 hidden units, h = 2
Loading component_net representation dataset
ENTERED
Training FEGIN on component_net representation
Train: 1565, Test: 383
##################ITERATION #0 ****************************************
 epoch: 0, train_loss: 1.2554, test_loss: 1.3359, test_f1: 0.2281
 epoch: 1, train_loss: 1.1294, test_loss: 1.3242, test_f1: 0.2281
 epoch: 2, train_loss: 1.0950, test_loss: 1.3009, test_f1: 0.3115
 epoch: 3, train_loss: 1.0613, test_loss: 1.1490, test_f1: 0.3413
 epoch: 4, train_loss: 1.0071, test_loss: 1.1292, test_f1: 0.3935
 epoch: 5, train_loss: 0.9774, test_loss: 1.0705, test_f1: 0.5163
 epoch: 6, train_loss: 0.9317, test_loss: 1.0341, test_f1: 0.5238
 epoch: 7, train_loss: 0.8888, test_loss: 1.0466, test_f1: 0.4996
 epoch: 8, train_loss: 0.8889, test_loss: 1.0607, test_f1: 0.5456
 epoch: 9, train_loss: 0.8501, test_loss: 0.9811, test_f1: 0.4951
 epoch: 10, train_loss: 0.8322, test_loss: 1.1548, test_f1: 0.5120
 epoch: 11, train_loss: 0.8221, test_loss: 1.1168, test_f1: 0.5733
 epoch: 12, train_loss: 0.8094, test_loss: 1.1207, test_f1: 0.5737
 epoch: 13, train_loss: 0.7898, test_loss: 1.0682, test_f1: 0.5888
 epoch: 14, train_loss: 0.7693, test_loss: 1.2578, test_f1: 0.5711
 epoch: 15, train_loss: 0.7856, test_loss: 1.1841, test_f1: 0.5801
 epoch: 16, train_loss: 0.7482, test_loss: 1.1838, test_f1: 0.5709
 epoch: 17, train_loss: 0.7253, test_loss: 1.1745, test_f1: 0.5411
 epoch: 18, train_loss: 0.7175, test_loss: 1.3123, test_f1: 0.5979
 epoch: 19, train_loss: 0.6915, test_loss: 1.3145, test_f1: 0.5191
 epoch: 20, train_loss: 0.7097, test_loss: 1.3295, test_f1: 0.5821
 epoch: 21, train_loss: 0.6896, test_loss: 1.3036, test_f1: 0.5376
 epoch: 22, train_loss: 0.6607, test_loss: 1.6251, test_f1: 0.5172
 epoch: 23, train_loss: 0.6790, test_loss: 1.3134, test_f1: 0.5667
 epoch: 24, train_loss: 0.6593, test_loss: 1.4074, test_f1: 0.5475
 epoch: 25, train_loss: 0.6267, test_loss: 1.3428, test_f1: 0.6171
 epoch: 26, train_loss: 0.6012, test_loss: 1.4013, test_f1: 0.5815
 epoch: 27, train_loss: 0.5710, test_loss: 1.6102, test_f1: 0.5628
 epoch: 28, train_loss: 0.5594, test_loss: 1.6032, test_f1: 0.5401
 epoch: 29, train_loss: 0.5390, test_loss: 1.5707, test_f1: 0.5718
 epoch: 30, train_loss: 0.5507, test_loss: 1.8429, test_f1: 0.5523
 epoch: 31, train_loss: 0.5130, test_loss: 1.8380, test_f1: 0.5656
 epoch: 32, train_loss: 0.5082, test_loss: 1.9442, test_f1: 0.6011
 epoch: 33, train_loss: 0.5020, test_loss: 1.9488, test_f1: 0.6206
 epoch: 34, train_loss: 0.4796, test_loss: 1.8671, test_f1: 0.5984
 epoch: 35, train_loss: 0.4841, test_loss: 1.9035, test_f1: 0.5744
 epoch: 36, train_loss: 0.4942, test_loss: 1.7148, test_f1: 0.6122
 epoch: 37, train_loss: 0.4942, test_loss: 2.1235, test_f1: 0.5474
 epoch: 38, train_loss: 0.4861, test_loss: 2.0110, test_f1: 0.5741
 epoch: 39, train_loss: 0.4824, test_loss: 2.2198, test_f1: 0.5686
 epoch: 40, train_loss: 0.4743, test_loss: 1.9556, test_f1: 0.6028
 epoch: 41, train_loss: 0.4887, test_loss: 2.2928, test_f1: 0.5344
 epoch: 42, train_loss: 0.4740, test_loss: 2.0389, test_f1: 0.5666
 epoch: 43, train_loss: 0.4249, test_loss: 1.9948, test_f1: 0.5597
 epoch: 44, train_loss: 0.3857, test_loss: 2.1626, test_f1: 0.5555
 epoch: 45, train_loss: 0.4052, test_loss: 2.1483, test_f1: 0.5646
 epoch: 46, train_loss: 0.4463, test_loss: 2.3910, test_f1: 0.5234
 epoch: 47, train_loss: 0.3933, test_loss: 2.0768, test_f1: 0.5915
 epoch: 48, train_loss: 0.4233, test_loss: 2.3068, test_f1: 0.5421
 epoch: 49, train_loss: 0.4161, test_loss: 2.5183, test_f1: 0.5708
 epoch: 50, train_loss: 0.4164, test_loss: 2.3581, test_f1: 0.5404
 epoch: 51, train_loss: 0.3692, test_loss: 2.1763, test_f1: 0.5588
 epoch: 52, train_loss: 0.3256, test_loss: 2.1174, test_f1: 0.5817
 epoch: 53, train_loss: 0.3024, test_loss: 2.5009, test_f1: 0.5726
 epoch: 54, train_loss: 0.2966, test_loss: 2.6580, test_f1: 0.5688
 epoch: 55, train_loss: 0.2664, test_loss: 2.7237, test_f1: 0.5708
 epoch: 56, train_loss: 0.2508, test_loss: 2.7382, test_f1: 0.5736
 epoch: 57, train_loss: 0.2836, test_loss: 2.6429, test_f1: 0.5901
 epoch: 58, train_loss: 0.2627, test_loss: 2.6083, test_f1: 0.5642
 epoch: 59, train_loss: 0.2693, test_loss: 2.8368, test_f1: 0.5845
 epoch: 60, train_loss: 0.2810, test_loss: 2.9675, test_f1: 0.5698
 epoch: 61, train_loss: 0.2571, test_loss: 2.9933, test_f1: 0.5720
 epoch: 62, train_loss: 0.2523, test_loss: 2.7573, test_f1: 0.5525
 epoch: 63, train_loss: 0.2562, test_loss: 2.5199, test_f1: 0.5794
 epoch: 64, train_loss: 0.2749, test_loss: 2.7507, test_f1: 0.5743
 epoch: 65, train_loss: 0.2396, test_loss: 2.7117, test_f1: 0.5433
 epoch: 66, train_loss: 0.2375, test_loss: 2.6823, test_f1: 0.5591
 epoch: 67, train_loss: 0.2334, test_loss: 2.9080, test_f1: 0.5947
 epoch: 68, train_loss: 0.2197, test_loss: 2.7621, test_f1: 0.5941
 epoch: 69, train_loss: 0.2409, test_loss: 3.0550, test_f1: 0.5839
 epoch: 70, train_loss: 0.2366, test_loss: 2.7477, test_f1: 0.6144
 epoch: 71, train_loss: 0.2336, test_loss: 3.0388, test_f1: 0.5658
 epoch: 72, train_loss: 0.1946, test_loss: 2.7621, test_f1: 0.6017
 epoch: 73, train_loss: 0.1964, test_loss: 3.0355, test_f1: 0.5919
 epoch: 74, train_loss: 0.2076, test_loss: 3.2192, test_f1: 0.6026
 epoch: 75, train_loss: 0.1897, test_loss: 3.0869, test_f1: 0.6027
 epoch: 76, train_loss: 0.2207, test_loss: 3.1756, test_f1: 0.5970
 epoch: 77, train_loss: 0.2144, test_loss: 3.2421, test_f1: 0.5649
 epoch: 78, train_loss: 0.2270, test_loss: 3.2348, test_f1: 0.5805
 epoch: 79, train_loss: 0.2048, test_loss: 3.7112, test_f1: 0.5799
 epoch: 80, train_loss: 0.2342, test_loss: 3.5769, test_f1: 0.5814
 epoch: 81, train_loss: 0.2068, test_loss: 3.3042, test_f1: 0.5618
 epoch: 82, train_loss: 0.2207, test_loss: 3.5042, test_f1: 0.6016
 epoch: 83, train_loss: 0.1884, test_loss: 3.3381, test_f1: 0.6047
 epoch: 84, train_loss: 0.1847, test_loss: 3.4552, test_f1: 0.5667
 epoch: 85, train_loss: 0.1889, test_loss: 3.5392, test_f1: 0.6038
 epoch: 86, train_loss: 0.1980, test_loss: 3.2698, test_f1: 0.5903
 epoch: 87, train_loss: 0.2054, test_loss: 3.5139, test_f1: 0.5537
 epoch: 88, train_loss: 0.1990, test_loss: 3.3115, test_f1: 0.5973
 epoch: 89, train_loss: 0.1804, test_loss: 3.3410, test_f1: 0.6067
 epoch: 90, train_loss: 0.1850, test_loss: 3.5054, test_f1: 0.5950
 epoch: 91, train_loss: 0.1848, test_loss: 3.5145, test_f1: 0.5766
 epoch: 92, train_loss: 0.1641, test_loss: 3.3949, test_f1: 0.5849
 epoch: 93, train_loss: 0.1627, test_loss: 3.5975, test_f1: 0.5896
 epoch: 94, train_loss: 0.1576, test_loss: 3.5174, test_f1: 0.5702
 epoch: 95, train_loss: 0.1686, test_loss: 3.7153, test_f1: 0.5865
 epoch: 96, train_loss: 0.1757, test_loss: 3.5221, test_f1: 0.5928
 epoch: 97, train_loss: 0.1758, test_loss: 3.4481, test_f1: 0.5673
 epoch: 98, train_loss: 0.2260, test_loss: 3.4096, test_f1: 0.5934
 epoch: 99, train_loss: 0.1866, test_loss: 3.8378, test_f1: 0.5745
##################ITERATION #1 ****************************************
 epoch: 0, train_loss: 1.1783, test_loss: 1.3256, test_f1: 0.2281
 epoch: 1, train_loss: 1.0427, test_loss: 1.2874, test_f1: 0.3531
 epoch: 2, train_loss: 0.9991, test_loss: 1.1292, test_f1: 0.4676
 epoch: 3, train_loss: 0.9588, test_loss: 1.1107, test_f1: 0.3790
 epoch: 4, train_loss: 0.9214, test_loss: 1.0795, test_f1: 0.4659
 epoch: 5, train_loss: 0.9005, test_loss: 1.1285, test_f1: 0.5451
 epoch: 6, train_loss: 0.8964, test_loss: 1.0362, test_f1: 0.5739
 epoch: 7, train_loss: 0.8722, test_loss: 1.0566, test_f1: 0.5280
 epoch: 8, train_loss: 0.8460, test_loss: 1.1003, test_f1: 0.5358
 epoch: 9, train_loss: 0.8298, test_loss: 1.1481, test_f1: 0.5567
 epoch: 10, train_loss: 0.8381, test_loss: 1.0065, test_f1: 0.5639
 epoch: 11, train_loss: 0.7984, test_loss: 1.1536, test_f1: 0.5806
 epoch: 12, train_loss: 0.7854, test_loss: 1.1197, test_f1: 0.5624
 epoch: 13, train_loss: 0.7888, test_loss: 1.1007, test_f1: 0.5505
 epoch: 14, train_loss: 0.7803, test_loss: 1.1317, test_f1: 0.5657
 epoch: 15, train_loss: 0.7470, test_loss: 1.1382, test_f1: 0.6205
 epoch: 16, train_loss: 0.7573, test_loss: 1.1807, test_f1: 0.5660
 epoch: 17, train_loss: 0.7308, test_loss: 1.0874, test_f1: 0.5797
 epoch: 18, train_loss: 0.7134, test_loss: 1.2455, test_f1: 0.5584
 epoch: 19, train_loss: 0.7199, test_loss: 1.2571, test_f1: 0.6057
 epoch: 20, train_loss: 0.6835, test_loss: 1.1636, test_f1: 0.6238
 epoch: 21, train_loss: 0.6535, test_loss: 1.1877, test_f1: 0.5639
 epoch: 22, train_loss: 0.6640, test_loss: 1.3469, test_f1: 0.5211
 epoch: 23, train_loss: 0.6937, test_loss: 1.4238, test_f1: 0.5415
 epoch: 24, train_loss: 0.6481, test_loss: 1.2573, test_f1: 0.5899
 epoch: 25, train_loss: 0.6639, test_loss: 1.4481, test_f1: 0.6021
 epoch: 26, train_loss: 0.6221, test_loss: 1.3307, test_f1: 0.6237
 epoch: 27, train_loss: 0.5767, test_loss: 1.5330, test_f1: 0.5984
 epoch: 28, train_loss: 0.5670, test_loss: 1.6476, test_f1: 0.5993
 epoch: 29, train_loss: 0.5549, test_loss: 1.5247, test_f1: 0.6098
 epoch: 30, train_loss: 0.5891, test_loss: 1.3794, test_f1: 0.6055
 epoch: 31, train_loss: 0.5565, test_loss: 1.7453, test_f1: 0.5895
 epoch: 32, train_loss: 0.6084, test_loss: 1.5508, test_f1: 0.6023
 epoch: 33, train_loss: 0.6058, test_loss: 1.6052, test_f1: 0.5418
 epoch: 34, train_loss: 0.5756, test_loss: 1.5564, test_f1: 0.5663
 epoch: 35, train_loss: 0.5276, test_loss: 1.7706, test_f1: 0.5822
 epoch: 36, train_loss: 0.5094, test_loss: 1.6048, test_f1: 0.5793
 epoch: 37, train_loss: 0.5357, test_loss: 1.6889, test_f1: 0.5820
 epoch: 38, train_loss: 0.5317, test_loss: 1.6011, test_f1: 0.5908
 epoch: 39, train_loss: 0.5301, test_loss: 1.5058, test_f1: 0.5858
 epoch: 40, train_loss: 0.5061, test_loss: 1.7472, test_f1: 0.5585
 epoch: 41, train_loss: 0.4921, test_loss: 1.8713, test_f1: 0.5727
 epoch: 42, train_loss: 0.4580, test_loss: 1.9234, test_f1: 0.5320
 epoch: 43, train_loss: 0.4876, test_loss: 2.2303, test_f1: 0.4712
 epoch: 44, train_loss: 0.4693, test_loss: 1.9119, test_f1: 0.6226
 epoch: 45, train_loss: 0.4651, test_loss: 1.9580, test_f1: 0.5430
 epoch: 46, train_loss: 0.4804, test_loss: 2.2172, test_f1: 0.6017
 epoch: 47, train_loss: 0.4848, test_loss: 1.7925, test_f1: 0.5887
 epoch: 48, train_loss: 0.4151, test_loss: 1.7364, test_f1: 0.6617
 epoch: 49, train_loss: 0.4103, test_loss: 2.5080, test_f1: 0.5269
 epoch: 50, train_loss: 0.4155, test_loss: 2.2425, test_f1: 0.5782
 epoch: 51, train_loss: 0.3565, test_loss: 2.1261, test_f1: 0.5711
 epoch: 52, train_loss: 0.3530, test_loss: 2.2097, test_f1: 0.5808
 epoch: 53, train_loss: 0.3384, test_loss: 2.3593, test_f1: 0.5910
 epoch: 54, train_loss: 0.3106, test_loss: 2.1707, test_f1: 0.5978
 epoch: 55, train_loss: 0.3118, test_loss: 2.3318, test_f1: 0.6067
 epoch: 56, train_loss: 0.3467, test_loss: 2.6943, test_f1: 0.5626
 epoch: 57, train_loss: 0.3138, test_loss: 2.6052, test_f1: 0.5520
 epoch: 58, train_loss: 0.3123, test_loss: 2.5075, test_f1: 0.6129
 epoch: 59, train_loss: 0.2843, test_loss: 2.6010, test_f1: 0.5691
 epoch: 60, train_loss: 0.2903, test_loss: 2.7218, test_f1: 0.5951
 epoch: 61, train_loss: 0.2934, test_loss: 2.5242, test_f1: 0.5717
 epoch: 62, train_loss: 0.2735, test_loss: 2.5208, test_f1: 0.5454
 epoch: 63, train_loss: 0.2740, test_loss: 2.7283, test_f1: 0.5712
 epoch: 64, train_loss: 0.2750, test_loss: 2.6390, test_f1: 0.6013
 epoch: 65, train_loss: 0.2692, test_loss: 2.7945, test_f1: 0.5783
 epoch: 66, train_loss: 0.2838, test_loss: 3.0808, test_f1: 0.5821
 epoch: 67, train_loss: 0.3006, test_loss: 2.9610, test_f1: 0.5673
 epoch: 68, train_loss: 0.2763, test_loss: 2.5692, test_f1: 0.5980
 epoch: 69, train_loss: 0.2751, test_loss: 3.0011, test_f1: 0.5992
 epoch: 70, train_loss: 0.2759, test_loss: 2.5588, test_f1: 0.5594
 epoch: 71, train_loss: 0.2837, test_loss: 2.2287, test_f1: 0.5738
 epoch: 72, train_loss: 0.2484, test_loss: 2.5313, test_f1: 0.5989
 epoch: 73, train_loss: 0.2360, test_loss: 2.5336, test_f1: 0.6091
 epoch: 74, train_loss: 0.2294, test_loss: 2.8422, test_f1: 0.6086
 epoch: 75, train_loss: 0.2470, test_loss: 2.9137, test_f1: 0.5753
 epoch: 76, train_loss: 0.2399, test_loss: 3.0436, test_f1: 0.6079
 epoch: 77, train_loss: 0.2343, test_loss: 2.9312, test_f1: 0.6019
 epoch: 78, train_loss: 0.2195, test_loss: 2.8043, test_f1: 0.5898
 epoch: 79, train_loss: 0.1992, test_loss: 3.0376, test_f1: 0.5693
 epoch: 80, train_loss: 0.1936, test_loss: 3.0861, test_f1: 0.5674
 epoch: 81, train_loss: 0.2126, test_loss: 3.2846, test_f1: 0.5793
 epoch: 82, train_loss: 0.2215, test_loss: 3.0828, test_f1: 0.5625
 epoch: 83, train_loss: 0.2239, test_loss: 2.9180, test_f1: 0.5563
 epoch: 84, train_loss: 0.1990, test_loss: 3.4660, test_f1: 0.5814
 epoch: 85, train_loss: 0.2138, test_loss: 2.9277, test_f1: 0.5954
 epoch: 86, train_loss: 0.2307, test_loss: 3.1904, test_f1: 0.5795
 epoch: 87, train_loss: 0.2039, test_loss: 3.2602, test_f1: 0.5782
 epoch: 88, train_loss: 0.2323, test_loss: 3.1536, test_f1: 0.5646
 epoch: 89, train_loss: 0.2523, test_loss: 2.5949, test_f1: 0.6037
 epoch: 90, train_loss: 0.2087, test_loss: 3.1333, test_f1: 0.5828
 epoch: 91, train_loss: 0.2053, test_loss: 3.4124, test_f1: 0.5705
 epoch: 92, train_loss: 0.2182, test_loss: 3.1432, test_f1: 0.5850
 epoch: 93, train_loss: 0.1955, test_loss: 2.9607, test_f1: 0.5911
 epoch: 94, train_loss: 0.1930, test_loss: 3.0744, test_f1: 0.5707
 epoch: 95, train_loss: 0.2237, test_loss: 2.8525, test_f1: 0.5883
 epoch: 96, train_loss: 0.2086, test_loss: 3.3980, test_f1: 0.5732
 epoch: 97, train_loss: 0.2139, test_loss: 3.1203, test_f1: 0.5960
 epoch: 98, train_loss: 0.2106, test_loss: 3.2297, test_f1: 0.5956
 epoch: 99, train_loss: 0.2277, test_loss: 3.3429, test_f1: 0.5819
##################ITERATION #2 ****************************************
 epoch: 0, train_loss: 1.1300, test_loss: 1.3604, test_f1: 0.1453
 epoch: 1, train_loss: 1.0625, test_loss: 1.3901, test_f1: 0.1397
 epoch: 2, train_loss: 0.9618, test_loss: 1.2735, test_f1: 0.3548
 epoch: 3, train_loss: 0.9403, test_loss: 1.1759, test_f1: 0.4202
 epoch: 4, train_loss: 0.9152, test_loss: 1.0209, test_f1: 0.5349
 epoch: 5, train_loss: 0.8959, test_loss: 1.0453, test_f1: 0.5556
 epoch: 6, train_loss: 0.8580, test_loss: 1.0101, test_f1: 0.5630
 epoch: 7, train_loss: 0.8505, test_loss: 1.1340, test_f1: 0.5596
 epoch: 8, train_loss: 0.8484, test_loss: 1.0498, test_f1: 0.5727
 epoch: 9, train_loss: 0.8335, test_loss: 1.1930, test_f1: 0.5671
 epoch: 10, train_loss: 0.8105, test_loss: 1.1661, test_f1: 0.6174
 epoch: 11, train_loss: 0.7804, test_loss: 1.3634, test_f1: 0.5541
 epoch: 12, train_loss: 0.7733, test_loss: 1.1665, test_f1: 0.6092
 epoch: 13, train_loss: 0.7478, test_loss: 1.3245, test_f1: 0.5001
 epoch: 14, train_loss: 0.7494, test_loss: 1.0700, test_f1: 0.5915
 epoch: 15, train_loss: 0.7387, test_loss: 1.2490, test_f1: 0.5587
 epoch: 16, train_loss: 0.7361, test_loss: 1.3829, test_f1: 0.5605
 epoch: 17, train_loss: 0.7299, test_loss: 1.1782, test_f1: 0.6107
 epoch: 18, train_loss: 0.6945, test_loss: 1.2791, test_f1: 0.5606
 epoch: 19, train_loss: 0.6726, test_loss: 1.2050, test_f1: 0.6370
 epoch: 20, train_loss: 0.6534, test_loss: 1.4687, test_f1: 0.5669
 epoch: 21, train_loss: 0.6449, test_loss: 1.3935, test_f1: 0.5526
 epoch: 22, train_loss: 0.6536, test_loss: 1.3052, test_f1: 0.5902
 epoch: 23, train_loss: 0.6837, test_loss: 1.4645, test_f1: 0.5422
 epoch: 24, train_loss: 0.6765, test_loss: 1.3702, test_f1: 0.5424
 epoch: 25, train_loss: 0.6989, test_loss: 1.5023, test_f1: 0.6042
 epoch: 26, train_loss: 0.6418, test_loss: 1.4082, test_f1: 0.6117
 epoch: 27, train_loss: 0.6283, test_loss: 1.3786, test_f1: 0.6243
 epoch: 28, train_loss: 0.6071, test_loss: 1.6595, test_f1: 0.5544
 epoch: 29, train_loss: 0.5940, test_loss: 1.4217, test_f1: 0.5887
 epoch: 30, train_loss: 0.5925, test_loss: 1.5628, test_f1: 0.5651
 epoch: 31, train_loss: 0.5929, test_loss: 1.8308, test_f1: 0.5556
 epoch: 32, train_loss: 0.6013, test_loss: 1.7419, test_f1: 0.5107
 epoch: 33, train_loss: 0.5627, test_loss: 1.5279, test_f1: 0.5783
 epoch: 34, train_loss: 0.5227, test_loss: 1.5664, test_f1: 0.5772
 epoch: 35, train_loss: 0.5105, test_loss: 1.7708, test_f1: 0.5587
 epoch: 36, train_loss: 0.5116, test_loss: 1.6324, test_f1: 0.6042
 epoch: 37, train_loss: 0.4873, test_loss: 1.7255, test_f1: 0.6015
 epoch: 38, train_loss: 0.4784, test_loss: 1.4996, test_f1: 0.6077
 epoch: 39, train_loss: 0.4865, test_loss: 1.6791, test_f1: 0.5941
 epoch: 40, train_loss: 0.5008, test_loss: 1.3929, test_f1: 0.6067
 epoch: 41, train_loss: 0.4570, test_loss: 1.7451, test_f1: 0.5940
 epoch: 42, train_loss: 0.4435, test_loss: 1.8078, test_f1: 0.5875
 epoch: 43, train_loss: 0.4724, test_loss: 1.8305, test_f1: 0.5982
 epoch: 44, train_loss: 0.4603, test_loss: 2.0082, test_f1: 0.5681
 epoch: 45, train_loss: 0.4615, test_loss: 1.8101, test_f1: 0.5782
 epoch: 46, train_loss: 0.4379, test_loss: 2.0543, test_f1: 0.5797
 epoch: 47, train_loss: 0.4476, test_loss: 2.1174, test_f1: 0.5847
 epoch: 48, train_loss: 0.4046, test_loss: 2.1906, test_f1: 0.5685
 epoch: 49, train_loss: 0.3763, test_loss: 2.3983, test_f1: 0.5644
 epoch: 50, train_loss: 0.3820, test_loss: 2.0410, test_f1: 0.5950
 epoch: 51, train_loss: 0.3577, test_loss: 1.9925, test_f1: 0.6033
 epoch: 52, train_loss: 0.3375, test_loss: 2.1102, test_f1: 0.5669
 epoch: 53, train_loss: 0.3047, test_loss: 1.9777, test_f1: 0.5921
 epoch: 54, train_loss: 0.2950, test_loss: 2.3025, test_f1: 0.5866
 epoch: 55, train_loss: 0.3042, test_loss: 2.4470, test_f1: 0.5738
 epoch: 56, train_loss: 0.3004, test_loss: 2.2971, test_f1: 0.5990
 epoch: 57, train_loss: 0.3002, test_loss: 2.3994, test_f1: 0.5943
 epoch: 58, train_loss: 0.2832, test_loss: 2.4569, test_f1: 0.5789
 epoch: 59, train_loss: 0.2799, test_loss: 2.7696, test_f1: 0.5993
 epoch: 60, train_loss: 0.2666, test_loss: 2.7696, test_f1: 0.5788
 epoch: 61, train_loss: 0.2652, test_loss: 2.4113, test_f1: 0.5793
 epoch: 62, train_loss: 0.2488, test_loss: 2.6396, test_f1: 0.6060
 epoch: 63, train_loss: 0.2675, test_loss: 2.5884, test_f1: 0.6187
 epoch: 64, train_loss: 0.2980, test_loss: 2.5534, test_f1: 0.5563
 epoch: 65, train_loss: 0.2554, test_loss: 2.6892, test_f1: 0.5998
 epoch: 66, train_loss: 0.2701, test_loss: 2.9566, test_f1: 0.5674
 epoch: 67, train_loss: 0.2558, test_loss: 2.4424, test_f1: 0.5991
 epoch: 68, train_loss: 0.2376, test_loss: 2.3648, test_f1: 0.6096
 epoch: 69, train_loss: 0.2261, test_loss: 2.6190, test_f1: 0.6170
 epoch: 70, train_loss: 0.2271, test_loss: 2.5343, test_f1: 0.5984
 epoch: 71, train_loss: 0.2384, test_loss: 2.4649, test_f1: 0.6052
 epoch: 72, train_loss: 0.2164, test_loss: 2.6168, test_f1: 0.6122
 epoch: 73, train_loss: 0.2209, test_loss: 2.8489, test_f1: 0.5859
 epoch: 74, train_loss: 0.2280, test_loss: 2.9239, test_f1: 0.5793
 epoch: 75, train_loss: 0.2817, test_loss: 2.9452, test_f1: 0.5694
 epoch: 76, train_loss: 0.2763, test_loss: 2.8370, test_f1: 0.5759
 epoch: 77, train_loss: 0.2555, test_loss: 3.0259, test_f1: 0.5602
 epoch: 78, train_loss: 0.2170, test_loss: 2.8680, test_f1: 0.5780
 epoch: 79, train_loss: 0.2114, test_loss: 3.1336, test_f1: 0.5646
 epoch: 80, train_loss: 0.2493, test_loss: 2.7753, test_f1: 0.6106
 epoch: 81, train_loss: 0.2219, test_loss: 2.6816, test_f1: 0.5921
 epoch: 82, train_loss: 0.2351, test_loss: 2.6925, test_f1: 0.6235
 epoch: 83, train_loss: 0.2120, test_loss: 2.8905, test_f1: 0.5799
 epoch: 84, train_loss: 0.2156, test_loss: 2.5602, test_f1: 0.6026
 epoch: 85, train_loss: 0.2182, test_loss: 2.7011, test_f1: 0.5947
 epoch: 86, train_loss: 0.1936, test_loss: 2.6886, test_f1: 0.6005
 epoch: 87, train_loss: 0.2058, test_loss: 2.6504, test_f1: 0.6006
 epoch: 88, train_loss: 0.1810, test_loss: 2.8325, test_f1: 0.5980
 epoch: 89, train_loss: 0.1708, test_loss: 2.7274, test_f1: 0.5912
 epoch: 90, train_loss: 0.1869, test_loss: 2.7654, test_f1: 0.5927
 epoch: 91, train_loss: 0.1761, test_loss: 3.0775, test_f1: 0.6072
 epoch: 92, train_loss: 0.2068, test_loss: 3.0106, test_f1: 0.5953
 epoch: 93, train_loss: 0.2200, test_loss: 2.9674, test_f1: 0.6174
 epoch: 94, train_loss: 0.2510, test_loss: 2.7517, test_f1: 0.5914
 epoch: 95, train_loss: 0.1996, test_loss: 3.0089, test_f1: 0.5627
 epoch: 96, train_loss: 0.2011, test_loss: 2.5243, test_f1: 0.5749
 epoch: 97, train_loss: 0.2055, test_loss: 2.8672, test_f1: 0.6237
 epoch: 98, train_loss: 0.1821, test_loss: 2.8774, test_f1: 0.5669
 epoch: 99, train_loss: 0.1517, test_loss: 2.7684, test_f1: 0.5816
##################ITERATION #3 ****************************************
 epoch: 0, train_loss: 1.1983, test_loss: 1.3152, test_f1: 0.4178
 epoch: 1, train_loss: 1.0375, test_loss: 1.3218, test_f1: 0.1608
 epoch: 2, train_loss: 0.9839, test_loss: 1.1782, test_f1: 0.3781
 epoch: 3, train_loss: 0.9410, test_loss: 1.0873, test_f1: 0.5404
 epoch: 4, train_loss: 0.9214, test_loss: 1.0854, test_f1: 0.4971
 epoch: 5, train_loss: 0.9119, test_loss: 1.0874, test_f1: 0.5632
 epoch: 6, train_loss: 0.8885, test_loss: 1.0561, test_f1: 0.5492
 epoch: 7, train_loss: 0.8682, test_loss: 1.0544, test_f1: 0.5725
 epoch: 8, train_loss: 0.8487, test_loss: 0.9759, test_f1: 0.5148
 epoch: 9, train_loss: 0.8337, test_loss: 1.1791, test_f1: 0.5382
 epoch: 10, train_loss: 0.8642, test_loss: 1.0901, test_f1: 0.5281
 epoch: 11, train_loss: 0.8238, test_loss: 1.1974, test_f1: 0.5634
 epoch: 12, train_loss: 0.7882, test_loss: 1.0742, test_f1: 0.5639
 epoch: 13, train_loss: 0.8015, test_loss: 1.1515, test_f1: 0.5794
 epoch: 14, train_loss: 0.7694, test_loss: 1.1413, test_f1: 0.5521
 epoch: 15, train_loss: 0.7646, test_loss: 1.2042, test_f1: 0.5712
 epoch: 16, train_loss: 0.7535, test_loss: 1.1546, test_f1: 0.5785
 epoch: 17, train_loss: 0.7358, test_loss: 1.1440, test_f1: 0.6124
 epoch: 18, train_loss: 0.7116, test_loss: 1.1301, test_f1: 0.6082
 epoch: 19, train_loss: 0.7146, test_loss: 1.0972, test_f1: 0.5992
 epoch: 20, train_loss: 0.6984, test_loss: 1.2419, test_f1: 0.5645
 epoch: 21, train_loss: 0.6772, test_loss: 1.2746, test_f1: 0.6054
 epoch: 22, train_loss: 0.6514, test_loss: 1.1914, test_f1: 0.5967
 epoch: 23, train_loss: 0.6617, test_loss: 1.2168, test_f1: 0.6294
 epoch: 24, train_loss: 0.6720, test_loss: 1.4168, test_f1: 0.6260
 epoch: 25, train_loss: 0.6512, test_loss: 1.3839, test_f1: 0.5664
 epoch: 26, train_loss: 0.6231, test_loss: 1.2433, test_f1: 0.6192
 epoch: 27, train_loss: 0.6136, test_loss: 1.4071, test_f1: 0.5572
 epoch: 28, train_loss: 0.6134, test_loss: 1.5121, test_f1: 0.5824
 epoch: 29, train_loss: 0.6444, test_loss: 1.3301, test_f1: 0.5975
 epoch: 30, train_loss: 0.6109, test_loss: 1.2340, test_f1: 0.6430
 epoch: 31, train_loss: 0.5760, test_loss: 1.5520, test_f1: 0.5947
 epoch: 32, train_loss: 0.5937, test_loss: 1.4542, test_f1: 0.5876
 epoch: 33, train_loss: 0.5821, test_loss: 1.7299, test_f1: 0.5703
 epoch: 34, train_loss: 0.5411, test_loss: 1.4701, test_f1: 0.5851
 epoch: 35, train_loss: 0.5058, test_loss: 1.5871, test_f1: 0.5833
 epoch: 36, train_loss: 0.5221, test_loss: 1.8097, test_f1: 0.5913
 epoch: 37, train_loss: 0.5113, test_loss: 1.5549, test_f1: 0.6330
 epoch: 38, train_loss: 0.5565, test_loss: 1.8665, test_f1: 0.5877
 epoch: 39, train_loss: 0.5156, test_loss: 1.4780, test_f1: 0.6045
 epoch: 40, train_loss: 0.5015, test_loss: 1.6095, test_f1: 0.6015
 epoch: 41, train_loss: 0.5066, test_loss: 1.5361, test_f1: 0.6173
 epoch: 42, train_loss: 0.4916, test_loss: 1.8511, test_f1: 0.5816
 epoch: 43, train_loss: 0.4819, test_loss: 1.6562, test_f1: 0.5779
 epoch: 44, train_loss: 0.4668, test_loss: 1.8148, test_f1: 0.5451
 epoch: 45, train_loss: 0.4440, test_loss: 1.8387, test_f1: 0.4704
 epoch: 46, train_loss: 0.4785, test_loss: 1.7057, test_f1: 0.5894
 epoch: 47, train_loss: 0.4891, test_loss: 1.8524, test_f1: 0.5790
 epoch: 48, train_loss: 0.4740, test_loss: 1.7315, test_f1: 0.6002
 epoch: 49, train_loss: 0.4437, test_loss: 2.0194, test_f1: 0.5598
 epoch: 50, train_loss: 0.4095, test_loss: 2.0591, test_f1: 0.6053
 epoch: 51, train_loss: 0.3825, test_loss: 2.0166, test_f1: 0.5856
 epoch: 52, train_loss: 0.3575, test_loss: 1.9138, test_f1: 0.6052
 epoch: 53, train_loss: 0.3702, test_loss: 2.1403, test_f1: 0.6207
 epoch: 54, train_loss: 0.3526, test_loss: 2.0995, test_f1: 0.5751
 epoch: 55, train_loss: 0.3383, test_loss: 1.9889, test_f1: 0.6008
 epoch: 56, train_loss: 0.3243, test_loss: 1.9974, test_f1: 0.5893
 epoch: 57, train_loss: 0.3042, test_loss: 2.1533, test_f1: 0.5841
 epoch: 58, train_loss: 0.3367, test_loss: 2.1236, test_f1: 0.6038
 epoch: 59, train_loss: 0.3226, test_loss: 2.2409, test_f1: 0.6108
 epoch: 60, train_loss: 0.3120, test_loss: 2.3587, test_f1: 0.5898
 epoch: 61, train_loss: 0.3007, test_loss: 2.1807, test_f1: 0.5800
 epoch: 62, train_loss: 0.3107, test_loss: 2.1457, test_f1: 0.6061
 epoch: 63, train_loss: 0.3045, test_loss: 2.0442, test_f1: 0.6002
 epoch: 64, train_loss: 0.3076, test_loss: 2.5062, test_f1: 0.6101
 epoch: 65, train_loss: 0.3250, test_loss: 2.2800, test_f1: 0.5901
 epoch: 66, train_loss: 0.3074, test_loss: 2.0676, test_f1: 0.6279
 epoch: 67, train_loss: 0.2944, test_loss: 2.3725, test_f1: 0.6257
 epoch: 68, train_loss: 0.2593, test_loss: 2.2552, test_f1: 0.6531
 epoch: 69, train_loss: 0.2619, test_loss: 2.4695, test_f1: 0.6185
 epoch: 70, train_loss: 0.2542, test_loss: 2.5058, test_f1: 0.6022
 epoch: 71, train_loss: 0.2428, test_loss: 2.5299, test_f1: 0.6094
 epoch: 72, train_loss: 0.2609, test_loss: 2.4786, test_f1: 0.6301
 epoch: 73, train_loss: 0.2526, test_loss: 2.7041, test_f1: 0.6134
 epoch: 74, train_loss: 0.2593, test_loss: 2.8239, test_f1: 0.5834
 epoch: 75, train_loss: 0.2587, test_loss: 2.3255, test_f1: 0.6030
 epoch: 76, train_loss: 0.2335, test_loss: 2.5485, test_f1: 0.6182
 epoch: 77, train_loss: 0.2405, test_loss: 2.5378, test_f1: 0.6027
 epoch: 78, train_loss: 0.2408, test_loss: 2.8899, test_f1: 0.5884
 epoch: 79, train_loss: 0.2813, test_loss: 2.7417, test_f1: 0.5871
 epoch: 80, train_loss: 0.2893, test_loss: 2.6065, test_f1: 0.6330
 epoch: 81, train_loss: 0.2821, test_loss: 2.5777, test_f1: 0.6402
 epoch: 82, train_loss: 0.2883, test_loss: 2.4116, test_f1: 0.6359
 epoch: 83, train_loss: 0.3678, test_loss: 2.4880, test_f1: 0.6245
 epoch: 84, train_loss: 0.3004, test_loss: 2.4932, test_f1: 0.6276
 epoch: 85, train_loss: 0.2705, test_loss: 2.4031, test_f1: 0.6198
 epoch: 86, train_loss: 0.2731, test_loss: 2.5673, test_f1: 0.6144
 epoch: 87, train_loss: 0.2360, test_loss: 2.3165, test_f1: 0.6181
 epoch: 88, train_loss: 0.2129, test_loss: 2.5410, test_f1: 0.6002
 epoch: 89, train_loss: 0.2075, test_loss: 2.6865, test_f1: 0.6269
 epoch: 90, train_loss: 0.1872, test_loss: 2.7310, test_f1: 0.6161
 epoch: 91, train_loss: 0.2555, test_loss: 3.0179, test_f1: 0.5795
 epoch: 92, train_loss: 0.2344, test_loss: 2.7052, test_f1: 0.6088
 epoch: 93, train_loss: 0.2319, test_loss: 2.8802, test_f1: 0.5948
 epoch: 94, train_loss: 0.2121, test_loss: 2.9749, test_f1: 0.6254
 epoch: 95, train_loss: 0.2080, test_loss: 2.8623, test_f1: 0.6035
 epoch: 96, train_loss: 0.2072, test_loss: 2.9301, test_f1: 0.6334
 epoch: 97, train_loss: 0.1873, test_loss: 2.9364, test_f1: 0.6095
 epoch: 98, train_loss: 0.1971, test_loss: 3.0561, test_f1: 0.6098
 epoch: 99, train_loss: 0.1780, test_loss: 3.1263, test_f1: 0.6158
##################ITERATION #4 ****************************************
 epoch: 0, train_loss: 1.2131, test_loss: 1.3124, test_f1: 0.4085
 epoch: 1, train_loss: 1.0409, test_loss: 1.4535, test_f1: 0.1520
 epoch: 2, train_loss: 1.0055, test_loss: 1.1743, test_f1: 0.3573
 epoch: 3, train_loss: 0.9643, test_loss: 1.1120, test_f1: 0.5104
 epoch: 4, train_loss: 0.9477, test_loss: 1.1380, test_f1: 0.5204
 epoch: 5, train_loss: 0.8880, test_loss: 1.0904, test_f1: 0.5479
 epoch: 6, train_loss: 0.9084, test_loss: 1.0078, test_f1: 0.5799
 epoch: 7, train_loss: 0.8553, test_loss: 1.1136, test_f1: 0.5270
 epoch: 8, train_loss: 0.8337, test_loss: 1.1049, test_f1: 0.5576
 epoch: 9, train_loss: 0.8339, test_loss: 1.1694, test_f1: 0.5452
 epoch: 10, train_loss: 0.8417, test_loss: 1.0916, test_f1: 0.5801
 epoch: 11, train_loss: 0.8186, test_loss: 1.2470, test_f1: 0.5355
 epoch: 12, train_loss: 0.8406, test_loss: 1.1909, test_f1: 0.5811
 epoch: 13, train_loss: 0.8162, test_loss: 1.1495, test_f1: 0.5721
 epoch: 14, train_loss: 0.7852, test_loss: 1.1693, test_f1: 0.5645
 epoch: 15, train_loss: 0.7663, test_loss: 1.1767, test_f1: 0.5596
 epoch: 16, train_loss: 0.7844, test_loss: 1.1435, test_f1: 0.5659
 epoch: 17, train_loss: 0.7655, test_loss: 1.3960, test_f1: 0.5500
 epoch: 18, train_loss: 0.7586, test_loss: 1.2430, test_f1: 0.5955
 epoch: 19, train_loss: 0.7672, test_loss: 1.2546, test_f1: 0.5626
 epoch: 20, train_loss: 0.7393, test_loss: 1.1765, test_f1: 0.5844
 epoch: 21, train_loss: 0.7306, test_loss: 1.2868, test_f1: 0.5877
 epoch: 22, train_loss: 0.7147, test_loss: 1.3167, test_f1: 0.6167
 epoch: 23, train_loss: 0.6965, test_loss: 1.2204, test_f1: 0.5968
 epoch: 24, train_loss: 0.6775, test_loss: 1.3854, test_f1: 0.5858
 epoch: 25, train_loss: 0.6799, test_loss: 1.2929, test_f1: 0.6140
 epoch: 26, train_loss: 0.6601, test_loss: 1.3784, test_f1: 0.5674
 epoch: 27, train_loss: 0.6502, test_loss: 1.5195, test_f1: 0.5426
 epoch: 28, train_loss: 0.6227, test_loss: 1.3116, test_f1: 0.6358
 epoch: 29, train_loss: 0.6424, test_loss: 1.3887, test_f1: 0.6339
 epoch: 30, train_loss: 0.6130, test_loss: 1.3812, test_f1: 0.6379
 epoch: 31, train_loss: 0.6367, test_loss: 1.4652, test_f1: 0.6392
 epoch: 32, train_loss: 0.6246, test_loss: 1.3226, test_f1: 0.6067
 epoch: 33, train_loss: 0.5994, test_loss: 1.2712, test_f1: 0.6427
 epoch: 34, train_loss: 0.5608, test_loss: 1.7531, test_f1: 0.5672
 epoch: 35, train_loss: 0.5672, test_loss: 1.5443, test_f1: 0.5877
 epoch: 36, train_loss: 0.6110, test_loss: 1.4967, test_f1: 0.6219
 epoch: 37, train_loss: 0.5741, test_loss: 1.5910, test_f1: 0.5823
 epoch: 38, train_loss: 0.5549, test_loss: 1.5708, test_f1: 0.6096
 epoch: 39, train_loss: 0.5410, test_loss: 1.4748, test_f1: 0.5713
 epoch: 40, train_loss: 0.5325, test_loss: 1.5799, test_f1: 0.5912
 epoch: 41, train_loss: 0.5432, test_loss: 1.8408, test_f1: 0.5699
 epoch: 42, train_loss: 0.5455, test_loss: 1.6523, test_f1: 0.5862
 epoch: 43, train_loss: 0.5254, test_loss: 1.6812, test_f1: 0.5944
 epoch: 44, train_loss: 0.5321, test_loss: 1.6366, test_f1: 0.5704
 epoch: 45, train_loss: 0.5361, test_loss: 1.5084, test_f1: 0.6213
 epoch: 46, train_loss: 0.5139, test_loss: 1.6768, test_f1: 0.6073
 epoch: 47, train_loss: 0.5038, test_loss: 1.4802, test_f1: 0.6152
 epoch: 48, train_loss: 0.4743, test_loss: 1.8017, test_f1: 0.6205
 epoch: 49, train_loss: 0.4581, test_loss: 1.7086, test_f1: 0.6261
 epoch: 50, train_loss: 0.4822, test_loss: 1.6394, test_f1: 0.6179
 epoch: 51, train_loss: 0.4184, test_loss: 1.7879, test_f1: 0.6248
 epoch: 52, train_loss: 0.4546, test_loss: 1.7781, test_f1: 0.6222
 epoch: 53, train_loss: 0.3866, test_loss: 1.7994, test_f1: 0.6227
 epoch: 54, train_loss: 0.3863, test_loss: 1.7080, test_f1: 0.6216
 epoch: 55, train_loss: 0.3616, test_loss: 1.8810, test_f1: 0.6421
 epoch: 56, train_loss: 0.3701, test_loss: 1.7324, test_f1: 0.6341
 epoch: 57, train_loss: 0.3570, test_loss: 1.9003, test_f1: 0.6155
 epoch: 58, train_loss: 0.3331, test_loss: 2.0193, test_f1: 0.5977
 epoch: 59, train_loss: 0.3295, test_loss: 1.9983, test_f1: 0.6203
 epoch: 60, train_loss: 0.3356, test_loss: 2.3514, test_f1: 0.5641
 epoch: 61, train_loss: 0.3387, test_loss: 2.0487, test_f1: 0.6361
 epoch: 62, train_loss: 0.3023, test_loss: 2.3984, test_f1: 0.5970
 epoch: 63, train_loss: 0.2994, test_loss: 2.1624, test_f1: 0.6366
 epoch: 64, train_loss: 0.3208, test_loss: 2.4084, test_f1: 0.6100
 epoch: 65, train_loss: 0.3534, test_loss: 2.1948, test_f1: 0.6192
 epoch: 66, train_loss: 0.3361, test_loss: 2.4799, test_f1: 0.5839
 epoch: 67, train_loss: 0.3339, test_loss: 2.1514, test_f1: 0.6219
 epoch: 68, train_loss: 0.3086, test_loss: 2.1501, test_f1: 0.6183
 epoch: 69, train_loss: 0.2878, test_loss: 2.5209, test_f1: 0.5816
 epoch: 70, train_loss: 0.2883, test_loss: 2.2130, test_f1: 0.6209
 epoch: 71, train_loss: 0.2623, test_loss: 2.2455, test_f1: 0.6273
 epoch: 72, train_loss: 0.2728, test_loss: 2.4161, test_f1: 0.6054
 epoch: 73, train_loss: 0.2787, test_loss: 2.4513, test_f1: 0.6222
 epoch: 74, train_loss: 0.2942, test_loss: 2.4454, test_f1: 0.6168
 epoch: 75, train_loss: 0.2765, test_loss: 2.4326, test_f1: 0.6341
 epoch: 76, train_loss: 0.2831, test_loss: 2.4599, test_f1: 0.6530
 epoch: 77, train_loss: 0.2704, test_loss: 2.4309, test_f1: 0.6295
 epoch: 78, train_loss: 0.2651, test_loss: 2.4218, test_f1: 0.6372
 epoch: 79, train_loss: 0.2683, test_loss: 2.7916, test_f1: 0.6159
 epoch: 80, train_loss: 0.2639, test_loss: 2.5104, test_f1: 0.6272
 epoch: 81, train_loss: 0.2290, test_loss: 2.5210, test_f1: 0.6348
 epoch: 82, train_loss: 0.2534, test_loss: 2.5952, test_f1: 0.6095
 epoch: 83, train_loss: 0.2369, test_loss: 2.7191, test_f1: 0.6092
 epoch: 84, train_loss: 0.2291, test_loss: 2.7412, test_f1: 0.6256
 epoch: 85, train_loss: 0.2294, test_loss: 2.9363, test_f1: 0.6379
 epoch: 86, train_loss: 0.2130, test_loss: 2.7621, test_f1: 0.6257
 epoch: 87, train_loss: 0.2300, test_loss: 3.0604, test_f1: 0.5989
 epoch: 88, train_loss: 0.2330, test_loss: 2.8350, test_f1: 0.6018
 epoch: 89, train_loss: 0.2690, test_loss: 2.9025, test_f1: 0.6199
 epoch: 90, train_loss: 0.2615, test_loss: 2.9002, test_f1: 0.6136
 epoch: 91, train_loss: 0.2415, test_loss: 2.9554, test_f1: 0.6123
 epoch: 92, train_loss: 0.2557, test_loss: 2.9261, test_f1: 0.6180
 epoch: 93, train_loss: 0.2419, test_loss: 2.9666, test_f1: 0.6133
 epoch: 94, train_loss: 0.2439, test_loss: 2.8909, test_f1: 0.6378
 epoch: 95, train_loss: 0.2453, test_loss: 3.0252, test_f1: 0.6129
 epoch: 96, train_loss: 0.2071, test_loss: 2.8373, test_f1: 0.6397
 epoch: 97, train_loss: 0.1844, test_loss: 2.7259, test_f1: 0.6426
 epoch: 98, train_loss: 0.2042, test_loss: 2.9810, test_f1: 0.6067
 epoch: 99, train_loss: 0.2198, test_loss: 2.8883, test_f1: 0.6281
##################ITERATION #5 ****************************************
 epoch: 0, train_loss: 1.2082, test_loss: 1.4731, test_f1: 0.0868
 epoch: 1, train_loss: 1.0490, test_loss: 1.2984, test_f1: 0.2004
 epoch: 2, train_loss: 1.0039, test_loss: 1.2172, test_f1: 0.2708
 epoch: 3, train_loss: 0.9465, test_loss: 1.3216, test_f1: 0.2368
 epoch: 4, train_loss: 0.9270, test_loss: 1.1496, test_f1: 0.4413
 epoch: 5, train_loss: 0.9062, test_loss: 1.0709, test_f1: 0.4942
 epoch: 6, train_loss: 0.8539, test_loss: 1.0088, test_f1: 0.5926
 epoch: 7, train_loss: 0.8488, test_loss: 1.0647, test_f1: 0.5725
 epoch: 8, train_loss: 0.8395, test_loss: 1.0354, test_f1: 0.5905
 epoch: 9, train_loss: 0.8261, test_loss: 1.2159, test_f1: 0.5115
 epoch: 10, train_loss: 0.8051, test_loss: 1.0760, test_f1: 0.5834
 epoch: 11, train_loss: 0.8042, test_loss: 1.0774, test_f1: 0.5693
 epoch: 12, train_loss: 0.7761, test_loss: 1.0628, test_f1: 0.6164
 epoch: 13, train_loss: 0.7654, test_loss: 1.1266, test_f1: 0.5683
 epoch: 14, train_loss: 0.7447, test_loss: 1.0845, test_f1: 0.5969
 epoch: 15, train_loss: 0.7097, test_loss: 1.1151, test_f1: 0.5968
 epoch: 16, train_loss: 0.7135, test_loss: 1.1294, test_f1: 0.6340
 epoch: 17, train_loss: 0.6820, test_loss: 1.1957, test_f1: 0.5844
 epoch: 18, train_loss: 0.7152, test_loss: 1.2338, test_f1: 0.5767
 epoch: 19, train_loss: 0.7178, test_loss: 1.2130, test_f1: 0.6090
 epoch: 20, train_loss: 0.6735, test_loss: 1.2805, test_f1: 0.6057
 epoch: 21, train_loss: 0.6531, test_loss: 1.2758, test_f1: 0.5697
 epoch: 22, train_loss: 0.6794, test_loss: 1.3451, test_f1: 0.5630
 epoch: 23, train_loss: 0.6740, test_loss: 1.2958, test_f1: 0.6063
 epoch: 24, train_loss: 0.6317, test_loss: 1.3961, test_f1: 0.5512
 epoch: 25, train_loss: 0.6108, test_loss: 1.3577, test_f1: 0.5799
 epoch: 26, train_loss: 0.6051, test_loss: 1.2869, test_f1: 0.6370
 epoch: 27, train_loss: 0.5841, test_loss: 1.3921, test_f1: 0.6172
 epoch: 28, train_loss: 0.5859, test_loss: 1.3508, test_f1: 0.6469
 epoch: 29, train_loss: 0.5875, test_loss: 1.5825, test_f1: 0.5696
 epoch: 30, train_loss: 0.5900, test_loss: 1.6121, test_f1: 0.4944
 epoch: 31, train_loss: 0.6242, test_loss: 1.5906, test_f1: 0.5517
 epoch: 32, train_loss: 0.5842, test_loss: 1.3846, test_f1: 0.6357
 epoch: 33, train_loss: 0.5389, test_loss: 1.7951, test_f1: 0.5401
 epoch: 34, train_loss: 0.5385, test_loss: 1.5081, test_f1: 0.6043
 epoch: 35, train_loss: 0.5126, test_loss: 1.4778, test_f1: 0.5922
 epoch: 36, train_loss: 0.5086, test_loss: 1.6069, test_f1: 0.6301
 epoch: 37, train_loss: 0.5166, test_loss: 1.8191, test_f1: 0.5970
 epoch: 38, train_loss: 0.4925, test_loss: 1.7363, test_f1: 0.5829
 epoch: 39, train_loss: 0.4976, test_loss: 1.6585, test_f1: 0.6269
 epoch: 40, train_loss: 0.4557, test_loss: 1.8307, test_f1: 0.6148
 epoch: 41, train_loss: 0.4680, test_loss: 1.8083, test_f1: 0.6166
 epoch: 42, train_loss: 0.4454, test_loss: 2.0020, test_f1: 0.5923
 epoch: 43, train_loss: 0.4431, test_loss: 1.6498, test_f1: 0.6194
 epoch: 44, train_loss: 0.4192, test_loss: 1.9391, test_f1: 0.5789
 epoch: 45, train_loss: 0.3923, test_loss: 2.1337, test_f1: 0.5691
 epoch: 46, train_loss: 0.4348, test_loss: 2.0330, test_f1: 0.5311
 epoch: 47, train_loss: 0.4273, test_loss: 2.1030, test_f1: 0.5760
 epoch: 48, train_loss: 0.4262, test_loss: 2.0187, test_f1: 0.5647
 epoch: 49, train_loss: 0.4069, test_loss: 2.1494, test_f1: 0.6141
 epoch: 50, train_loss: 0.4171, test_loss: 2.0173, test_f1: 0.6064
 epoch: 51, train_loss: 0.3916, test_loss: 1.9613, test_f1: 0.6164
 epoch: 52, train_loss: 0.3490, test_loss: 2.0598, test_f1: 0.5625
 epoch: 53, train_loss: 0.3201, test_loss: 1.8789, test_f1: 0.6268
 epoch: 54, train_loss: 0.3101, test_loss: 2.1716, test_f1: 0.6072
 epoch: 55, train_loss: 0.3037, test_loss: 2.2409, test_f1: 0.6200
 epoch: 56, train_loss: 0.2955, test_loss: 2.2543, test_f1: 0.6064
 epoch: 57, train_loss: 0.3222, test_loss: 2.2130, test_f1: 0.6337
 epoch: 58, train_loss: 0.3079, test_loss: 2.2083, test_f1: 0.6195
 epoch: 59, train_loss: 0.2975, test_loss: 2.2725, test_f1: 0.6110
 epoch: 60, train_loss: 0.2618, test_loss: 2.4339, test_f1: 0.5910
 epoch: 61, train_loss: 0.2708, test_loss: 2.4082, test_f1: 0.6247
 epoch: 62, train_loss: 0.2922, test_loss: 2.3504, test_f1: 0.6226
 epoch: 63, train_loss: 0.2936, test_loss: 2.7473, test_f1: 0.5914
 epoch: 64, train_loss: 0.2882, test_loss: 2.4153, test_f1: 0.6422
 epoch: 65, train_loss: 0.2641, test_loss: 2.4858, test_f1: 0.6075
 epoch: 66, train_loss: 0.2575, test_loss: 2.7316, test_f1: 0.6210
 epoch: 67, train_loss: 0.2567, test_loss: 2.7168, test_f1: 0.5961
 epoch: 68, train_loss: 0.2619, test_loss: 2.6522, test_f1: 0.5940
 epoch: 69, train_loss: 0.2355, test_loss: 2.7105, test_f1: 0.6152
 epoch: 70, train_loss: 0.2099, test_loss: 2.7817, test_f1: 0.6131
 epoch: 71, train_loss: 0.2371, test_loss: 2.9573, test_f1: 0.5616
 epoch: 72, train_loss: 0.2746, test_loss: 2.7399, test_f1: 0.6094
 epoch: 73, train_loss: 0.2625, test_loss: 2.9001, test_f1: 0.6011
 epoch: 74, train_loss: 0.2523, test_loss: 3.1132, test_f1: 0.6075
 epoch: 75, train_loss: 0.2505, test_loss: 3.1841, test_f1: 0.5730
 epoch: 76, train_loss: 0.2497, test_loss: 2.9966, test_f1: 0.6098
 epoch: 77, train_loss: 0.2229, test_loss: 2.9243, test_f1: 0.6455
 epoch: 78, train_loss: 0.2034, test_loss: 2.8985, test_f1: 0.6274
 epoch: 79, train_loss: 0.2157, test_loss: 2.9855, test_f1: 0.6208
 epoch: 80, train_loss: 0.2382, test_loss: 2.9422, test_f1: 0.6038
 epoch: 81, train_loss: 0.2656, test_loss: 2.8219, test_f1: 0.6125
 epoch: 82, train_loss: 0.2420, test_loss: 3.0255, test_f1: 0.5865
 epoch: 83, train_loss: 0.2116, test_loss: 3.1555, test_f1: 0.5917
 epoch: 84, train_loss: 0.2030, test_loss: 3.0637, test_f1: 0.6068
 epoch: 85, train_loss: 0.2050, test_loss: 3.0576, test_f1: 0.6164
 epoch: 86, train_loss: 0.1794, test_loss: 3.3137, test_f1: 0.5994
 epoch: 87, train_loss: 0.2355, test_loss: 3.2013, test_f1: 0.6166
 epoch: 88, train_loss: 0.2790, test_loss: 2.7865, test_f1: 0.6487
 epoch: 89, train_loss: 0.2300, test_loss: 2.8356, test_f1: 0.6214
 epoch: 90, train_loss: 0.2138, test_loss: 2.7520, test_f1: 0.6405
 epoch: 91, train_loss: 0.2009, test_loss: 2.8274, test_f1: 0.5905
 epoch: 92, train_loss: 0.2079, test_loss: 2.9424, test_f1: 0.6130
 epoch: 93, train_loss: 0.1965, test_loss: 3.1389, test_f1: 0.5971
 epoch: 94, train_loss: 0.1899, test_loss: 2.9161, test_f1: 0.6207
 epoch: 95, train_loss: 0.1677, test_loss: 3.2519, test_f1: 0.6299
 epoch: 96, train_loss: 0.1642, test_loss: 3.1133, test_f1: 0.6282
 epoch: 97, train_loss: 0.1709, test_loss: 3.1599, test_f1: 0.6174
 epoch: 98, train_loss: 0.1656, test_loss: 3.1347, test_f1: 0.6231
 epoch: 99, train_loss: 0.1883, test_loss: 3.1426, test_f1: 0.5993
##################ITERATION #6 ****************************************
 epoch: 0, train_loss: 1.2154, test_loss: 1.3031, test_f1: 0.2221
 epoch: 1, train_loss: 1.0819, test_loss: 1.5309, test_f1: 0.1290
 epoch: 2, train_loss: 1.0045, test_loss: 1.1722, test_f1: 0.4848
 epoch: 3, train_loss: 0.9545, test_loss: 1.1575, test_f1: 0.5165
 epoch: 4, train_loss: 0.9390, test_loss: 1.0864, test_f1: 0.5015
 epoch: 5, train_loss: 0.9074, test_loss: 1.0752, test_f1: 0.5231
 epoch: 6, train_loss: 0.9106, test_loss: 1.1104, test_f1: 0.5235
 epoch: 7, train_loss: 0.8669, test_loss: 1.0607, test_f1: 0.4981
 epoch: 8, train_loss: 0.8573, test_loss: 1.1701, test_f1: 0.5455
 epoch: 9, train_loss: 0.8378, test_loss: 1.1057, test_f1: 0.5463
 epoch: 10, train_loss: 0.8373, test_loss: 1.1610, test_f1: 0.5596
 epoch: 11, train_loss: 0.8089, test_loss: 1.0471, test_f1: 0.5450
 epoch: 12, train_loss: 0.8302, test_loss: 1.1142, test_f1: 0.5704
 epoch: 13, train_loss: 0.7818, test_loss: 1.0394, test_f1: 0.5643
 epoch: 14, train_loss: 0.7773, test_loss: 1.1122, test_f1: 0.5758
 epoch: 15, train_loss: 0.7583, test_loss: 1.2169, test_f1: 0.5447
 epoch: 16, train_loss: 0.7852, test_loss: 1.1455, test_f1: 0.5461
 epoch: 17, train_loss: 0.7677, test_loss: 1.1331, test_f1: 0.5722
 epoch: 18, train_loss: 0.7470, test_loss: 1.1414, test_f1: 0.5654
 epoch: 19, train_loss: 0.7442, test_loss: 1.0899, test_f1: 0.5904
 epoch: 20, train_loss: 0.7274, test_loss: 1.1410, test_f1: 0.5911
 epoch: 21, train_loss: 0.7221, test_loss: 1.1655, test_f1: 0.5826
 epoch: 22, train_loss: 0.6853, test_loss: 1.1686, test_f1: 0.5911
 epoch: 23, train_loss: 0.6838, test_loss: 1.2336, test_f1: 0.5895
 epoch: 24, train_loss: 0.6781, test_loss: 1.2101, test_f1: 0.5758
 epoch: 25, train_loss: 0.6966, test_loss: 1.3375, test_f1: 0.5850
 epoch: 26, train_loss: 0.6406, test_loss: 1.2436, test_f1: 0.5735
 epoch: 27, train_loss: 0.6278, test_loss: 1.3037, test_f1: 0.5718
 epoch: 28, train_loss: 0.6353, test_loss: 1.4858, test_f1: 0.5502
 epoch: 29, train_loss: 0.6057, test_loss: 1.5679, test_f1: 0.5880
 epoch: 30, train_loss: 0.6502, test_loss: 1.5175, test_f1: 0.5730
 epoch: 31, train_loss: 0.6115, test_loss: 1.3627, test_f1: 0.6023
 epoch: 32, train_loss: 0.6218, test_loss: 1.3198, test_f1: 0.5820
 epoch: 33, train_loss: 0.5948, test_loss: 1.5871, test_f1: 0.5616
 epoch: 34, train_loss: 0.5900, test_loss: 1.5738, test_f1: 0.5830
 epoch: 35, train_loss: 0.6048, test_loss: 1.6052, test_f1: 0.5801
 epoch: 36, train_loss: 0.6040, test_loss: 1.2233, test_f1: 0.6201
 epoch: 37, train_loss: 0.5935, test_loss: 1.2333, test_f1: 0.5921
 epoch: 38, train_loss: 0.5733, test_loss: 1.4574, test_f1: 0.6015
 epoch: 39, train_loss: 0.5470, test_loss: 1.3735, test_f1: 0.5942
 epoch: 40, train_loss: 0.5763, test_loss: 1.5420, test_f1: 0.6042
 epoch: 41, train_loss: 0.5881, test_loss: 1.5794, test_f1: 0.5772
 epoch: 42, train_loss: 0.5685, test_loss: 1.4661, test_f1: 0.6163
 epoch: 43, train_loss: 0.5351, test_loss: 1.6469, test_f1: 0.5364
 epoch: 44, train_loss: 0.5009, test_loss: 1.5493, test_f1: 0.5906
 epoch: 45, train_loss: 0.4744, test_loss: 1.5364, test_f1: 0.6300
 epoch: 46, train_loss: 0.4676, test_loss: 1.8430, test_f1: 0.5809
 epoch: 47, train_loss: 0.4984, test_loss: 1.8251, test_f1: 0.5842
 epoch: 48, train_loss: 0.4555, test_loss: 1.8174, test_f1: 0.5471
 epoch: 49, train_loss: 0.4435, test_loss: 2.0167, test_f1: 0.5627
 epoch: 50, train_loss: 0.5205, test_loss: 1.5956, test_f1: 0.5855
 epoch: 51, train_loss: 0.4406, test_loss: 1.9480, test_f1: 0.5788
 epoch: 52, train_loss: 0.4219, test_loss: 1.8756, test_f1: 0.5766
 epoch: 53, train_loss: 0.3868, test_loss: 1.8877, test_f1: 0.5787
 epoch: 54, train_loss: 0.3901, test_loss: 2.0700, test_f1: 0.5723
 epoch: 55, train_loss: 0.3865, test_loss: 1.9188, test_f1: 0.5825
 epoch: 56, train_loss: 0.3792, test_loss: 2.0833, test_f1: 0.5774
 epoch: 57, train_loss: 0.3431, test_loss: 2.2321, test_f1: 0.5666
 epoch: 58, train_loss: 0.3363, test_loss: 2.2291, test_f1: 0.5894
 epoch: 59, train_loss: 0.3215, test_loss: 2.1345, test_f1: 0.5473
 epoch: 60, train_loss: 0.3757, test_loss: 2.3614, test_f1: 0.5670
 epoch: 61, train_loss: 0.3359, test_loss: 2.3521, test_f1: 0.5468
 epoch: 62, train_loss: 0.3189, test_loss: 2.2945, test_f1: 0.5822
 epoch: 63, train_loss: 0.3242, test_loss: 2.3331, test_f1: 0.5549
 epoch: 64, train_loss: 0.3306, test_loss: 2.3872, test_f1: 0.5947
 epoch: 65, train_loss: 0.2875, test_loss: 2.2880, test_f1: 0.5853
 epoch: 66, train_loss: 0.3227, test_loss: 2.3398, test_f1: 0.5969
 epoch: 67, train_loss: 0.3079, test_loss: 2.4169, test_f1: 0.6068
 epoch: 68, train_loss: 0.2803, test_loss: 2.3950, test_f1: 0.5761
 epoch: 69, train_loss: 0.2996, test_loss: 2.5730, test_f1: 0.5700
 epoch: 70, train_loss: 0.3161, test_loss: 2.8701, test_f1: 0.5431
 epoch: 71, train_loss: 0.3086, test_loss: 2.7253, test_f1: 0.5494
 epoch: 72, train_loss: 0.2856, test_loss: 2.8124, test_f1: 0.5429
 epoch: 73, train_loss: 0.2777, test_loss: 2.7724, test_f1: 0.5761
 epoch: 74, train_loss: 0.2812, test_loss: 2.7253, test_f1: 0.5557
 epoch: 75, train_loss: 0.3188, test_loss: 2.8817, test_f1: 0.5272
 epoch: 76, train_loss: 0.2938, test_loss: 2.7049, test_f1: 0.5693
 epoch: 77, train_loss: 0.2921, test_loss: 2.7121, test_f1: 0.5587
 epoch: 78, train_loss: 0.2606, test_loss: 2.9301, test_f1: 0.5503
 epoch: 79, train_loss: 0.2481, test_loss: 2.9666, test_f1: 0.5366
 epoch: 80, train_loss: 0.2534, test_loss: 2.9469, test_f1: 0.5835
 epoch: 81, train_loss: 0.2554, test_loss: 2.8525, test_f1: 0.6100
 epoch: 82, train_loss: 0.2773, test_loss: 3.1525, test_f1: 0.5396
 epoch: 83, train_loss: 0.3147, test_loss: 2.6861, test_f1: 0.5994
 epoch: 84, train_loss: 0.2842, test_loss: 2.2434, test_f1: 0.5789
 epoch: 85, train_loss: 0.3004, test_loss: 2.5348, test_f1: 0.5887
 epoch: 86, train_loss: 0.2648, test_loss: 2.6964, test_f1: 0.5491
 epoch: 87, train_loss: 0.2369, test_loss: 2.6869, test_f1: 0.5798
 epoch: 88, train_loss: 0.2581, test_loss: 2.5898, test_f1: 0.5836
 epoch: 89, train_loss: 0.2584, test_loss: 2.5449, test_f1: 0.5912
 epoch: 90, train_loss: 0.2536, test_loss: 2.6204, test_f1: 0.5742
 epoch: 91, train_loss: 0.2478, test_loss: 2.7469, test_f1: 0.5610
 epoch: 92, train_loss: 0.2304, test_loss: 2.8144, test_f1: 0.5963
 epoch: 93, train_loss: 0.2259, test_loss: 3.0436, test_f1: 0.5626
 epoch: 94, train_loss: 0.2061, test_loss: 2.9722, test_f1: 0.5814
 epoch: 95, train_loss: 0.2193, test_loss: 2.9115, test_f1: 0.5720
 epoch: 96, train_loss: 0.2390, test_loss: 2.9068, test_f1: 0.5368
 epoch: 97, train_loss: 0.2191, test_loss: 2.9673, test_f1: 0.5622
 epoch: 98, train_loss: 0.2129, test_loss: 2.9017, test_f1: 0.5449
 epoch: 99, train_loss: 0.2272, test_loss: 2.6691, test_f1: 0.6192
##################ITERATION #7 ****************************************
 epoch: 0, train_loss: 1.2705, test_loss: 1.4423, test_f1: 0.0986
 epoch: 1, train_loss: 1.0889, test_loss: 1.5379, test_f1: 0.0866
 epoch: 2, train_loss: 1.0259, test_loss: 1.2897, test_f1: 0.4203
 epoch: 3, train_loss: 0.9608, test_loss: 1.0928, test_f1: 0.5042
 epoch: 4, train_loss: 0.9563, test_loss: 1.0607, test_f1: 0.4957
 epoch: 5, train_loss: 0.9056, test_loss: 1.0660, test_f1: 0.5125
 epoch: 6, train_loss: 0.8965, test_loss: 1.1504, test_f1: 0.5441
 epoch: 7, train_loss: 0.8744, test_loss: 1.0406, test_f1: 0.5506
 epoch: 8, train_loss: 0.8632, test_loss: 1.0757, test_f1: 0.5190
 epoch: 9, train_loss: 0.8408, test_loss: 1.0976, test_f1: 0.5643
 epoch: 10, train_loss: 0.8187, test_loss: 1.0455, test_f1: 0.5678
 epoch: 11, train_loss: 0.8228, test_loss: 1.1591, test_f1: 0.5502
 epoch: 12, train_loss: 0.8139, test_loss: 1.2156, test_f1: 0.5837
 epoch: 13, train_loss: 0.7722, test_loss: 1.1462, test_f1: 0.5545
 epoch: 14, train_loss: 0.7932, test_loss: 1.2068, test_f1: 0.5797
 epoch: 15, train_loss: 0.7656, test_loss: 1.1248, test_f1: 0.5759
 epoch: 16, train_loss: 0.7500, test_loss: 1.2407, test_f1: 0.6249
 epoch: 17, train_loss: 0.7390, test_loss: 1.2057, test_f1: 0.5853
 epoch: 18, train_loss: 0.7257, test_loss: 1.2092, test_f1: 0.6011
 epoch: 19, train_loss: 0.7183, test_loss: 1.4310, test_f1: 0.6144
 epoch: 20, train_loss: 0.7203, test_loss: 1.2032, test_f1: 0.5730
 epoch: 21, train_loss: 0.7211, test_loss: 1.1900, test_f1: 0.6517
 epoch: 22, train_loss: 0.7113, test_loss: 1.2597, test_f1: 0.6048
 epoch: 23, train_loss: 0.6856, test_loss: 1.4128, test_f1: 0.5928
 epoch: 24, train_loss: 0.6428, test_loss: 1.2978, test_f1: 0.6018
 epoch: 25, train_loss: 0.6702, test_loss: 1.3593, test_f1: 0.5550
 epoch: 26, train_loss: 0.6639, test_loss: 1.4304, test_f1: 0.5390
 epoch: 27, train_loss: 0.6243, test_loss: 1.3198, test_f1: 0.5490
 epoch: 28, train_loss: 0.6991, test_loss: 1.2443, test_f1: 0.5537
 epoch: 29, train_loss: 0.6846, test_loss: 1.3862, test_f1: 0.5635
 epoch: 30, train_loss: 0.6188, test_loss: 1.1599, test_f1: 0.6664
 epoch: 31, train_loss: 0.5737, test_loss: 1.2968, test_f1: 0.6349
 epoch: 32, train_loss: 0.5494, test_loss: 1.5094, test_f1: 0.5765
 epoch: 33, train_loss: 0.5407, test_loss: 1.5861, test_f1: 0.5494
 epoch: 34, train_loss: 0.5614, test_loss: 1.5378, test_f1: 0.5650
 epoch: 35, train_loss: 0.5512, test_loss: 1.7620, test_f1: 0.5596
 epoch: 36, train_loss: 0.5464, test_loss: 1.5713, test_f1: 0.5956
 epoch: 37, train_loss: 0.5339, test_loss: 1.7407, test_f1: 0.5417
 epoch: 38, train_loss: 0.5015, test_loss: 1.5826, test_f1: 0.5975
 epoch: 39, train_loss: 0.5271, test_loss: 1.5672, test_f1: 0.6007
 epoch: 40, train_loss: 0.4814, test_loss: 1.5800, test_f1: 0.6027
 epoch: 41, train_loss: 0.5566, test_loss: 1.4593, test_f1: 0.6175
 epoch: 42, train_loss: 0.5165, test_loss: 1.4905, test_f1: 0.6075
 epoch: 43, train_loss: 0.5325, test_loss: 1.4897, test_f1: 0.6289
 epoch: 44, train_loss: 0.5007, test_loss: 1.8496, test_f1: 0.5423
 epoch: 45, train_loss: 0.5192, test_loss: 1.5641, test_f1: 0.6512
 epoch: 46, train_loss: 0.4805, test_loss: 1.8640, test_f1: 0.5726
 epoch: 47, train_loss: 0.4836, test_loss: 1.8024, test_f1: 0.5990
 epoch: 48, train_loss: 0.5344, test_loss: 1.5977, test_f1: 0.5923
 epoch: 49, train_loss: 0.4982, test_loss: 1.6161, test_f1: 0.6072
 epoch: 50, train_loss: 0.4985, test_loss: 1.6801, test_f1: 0.6228
 epoch: 51, train_loss: 0.4293, test_loss: 1.7569, test_f1: 0.6051
 epoch: 52, train_loss: 0.3564, test_loss: 1.6656, test_f1: 0.6266
 epoch: 53, train_loss: 0.3664, test_loss: 1.8803, test_f1: 0.6165
 epoch: 54, train_loss: 0.3375, test_loss: 1.8387, test_f1: 0.6490
 epoch: 55, train_loss: 0.3667, test_loss: 2.0784, test_f1: 0.5607
 epoch: 56, train_loss: 0.3409, test_loss: 2.0091, test_f1: 0.5962
 epoch: 57, train_loss: 0.3640, test_loss: 2.1081, test_f1: 0.6030
 epoch: 58, train_loss: 0.3746, test_loss: 2.2425, test_f1: 0.6292
 epoch: 59, train_loss: 0.3216, test_loss: 2.0805, test_f1: 0.6084
 epoch: 60, train_loss: 0.3040, test_loss: 2.1353, test_f1: 0.6194
 epoch: 61, train_loss: 0.3005, test_loss: 2.1813, test_f1: 0.5868
 epoch: 62, train_loss: 0.3066, test_loss: 2.3294, test_f1: 0.5828
 epoch: 63, train_loss: 0.2914, test_loss: 2.3344, test_f1: 0.5929
 epoch: 64, train_loss: 0.2960, test_loss: 2.4954, test_f1: 0.6129
 epoch: 65, train_loss: 0.3145, test_loss: 2.4611, test_f1: 0.5880
 epoch: 66, train_loss: 0.2935, test_loss: 2.4536, test_f1: 0.6134
 epoch: 67, train_loss: 0.3007, test_loss: 2.6255, test_f1: 0.5597
 epoch: 68, train_loss: 0.3047, test_loss: 2.2945, test_f1: 0.5997
 epoch: 69, train_loss: 0.2998, test_loss: 2.6490, test_f1: 0.5775
 epoch: 70, train_loss: 0.2799, test_loss: 2.4079, test_f1: 0.6144
 epoch: 71, train_loss: 0.2584, test_loss: 2.4377, test_f1: 0.6248
 epoch: 72, train_loss: 0.2853, test_loss: 2.3572, test_f1: 0.6061
 epoch: 73, train_loss: 0.2948, test_loss: 2.3123, test_f1: 0.6194
 epoch: 74, train_loss: 0.3039, test_loss: 2.2942, test_f1: 0.5878
 epoch: 75, train_loss: 0.2683, test_loss: 2.4120, test_f1: 0.5698
 epoch: 76, train_loss: 0.2519, test_loss: 2.5010, test_f1: 0.5936
 epoch: 77, train_loss: 0.2567, test_loss: 2.3917, test_f1: 0.5858
 epoch: 78, train_loss: 0.2359, test_loss: 2.3018, test_f1: 0.5958
 epoch: 79, train_loss: 0.2489, test_loss: 2.5687, test_f1: 0.5875
 epoch: 80, train_loss: 0.2627, test_loss: 2.6024, test_f1: 0.5928
 epoch: 81, train_loss: 0.2793, test_loss: 2.6028, test_f1: 0.6050
 epoch: 82, train_loss: 0.2479, test_loss: 2.5766, test_f1: 0.6050
 epoch: 83, train_loss: 0.2232, test_loss: 2.3520, test_f1: 0.6153
 epoch: 84, train_loss: 0.2203, test_loss: 2.4128, test_f1: 0.6286
 epoch: 85, train_loss: 0.2311, test_loss: 2.6712, test_f1: 0.6245
 epoch: 86, train_loss: 0.2472, test_loss: 2.3751, test_f1: 0.5933
 epoch: 87, train_loss: 0.2249, test_loss: 2.6953, test_f1: 0.5905
 epoch: 88, train_loss: 0.2697, test_loss: 2.9754, test_f1: 0.5998
 epoch: 89, train_loss: 0.2467, test_loss: 2.6543, test_f1: 0.6049
 epoch: 90, train_loss: 0.2198, test_loss: 2.7657, test_f1: 0.5817
 epoch: 91, train_loss: 0.2355, test_loss: 2.8091, test_f1: 0.6046
 epoch: 92, train_loss: 0.2256, test_loss: 2.7913, test_f1: 0.6441
 epoch: 93, train_loss: 0.2231, test_loss: 2.9664, test_f1: 0.6138
 epoch: 94, train_loss: 0.2436, test_loss: 2.7327, test_f1: 0.5793
 epoch: 95, train_loss: 0.2256, test_loss: 3.1249, test_f1: 0.5614
 epoch: 96, train_loss: 0.2453, test_loss: 2.9801, test_f1: 0.5470
 epoch: 97, train_loss: 0.2008, test_loss: 2.9316, test_f1: 0.5779
 epoch: 98, train_loss: 0.2307, test_loss: 2.6178, test_f1: 0.5905
 epoch: 99, train_loss: 0.1955, test_loss: 2.7782, test_f1: 0.6102
##################ITERATION #8 ****************************************
 epoch: 0, train_loss: 1.2737, test_loss: 1.2757, test_f1: 0.3080
 epoch: 1, train_loss: 1.1007, test_loss: 1.4140, test_f1: 0.1532
 epoch: 2, train_loss: 1.0163, test_loss: 1.1616, test_f1: 0.4637
 epoch: 3, train_loss: 0.9878, test_loss: 1.1302, test_f1: 0.3679
 epoch: 4, train_loss: 0.9522, test_loss: 1.0633, test_f1: 0.5084
 epoch: 5, train_loss: 0.9189, test_loss: 1.0539, test_f1: 0.5620
 epoch: 6, train_loss: 0.8955, test_loss: 1.0767, test_f1: 0.5560
 epoch: 7, train_loss: 0.8841, test_loss: 1.0978, test_f1: 0.5619
 epoch: 8, train_loss: 0.8871, test_loss: 1.1487, test_f1: 0.5426
 epoch: 9, train_loss: 0.8592, test_loss: 1.0916, test_f1: 0.5535
 epoch: 10, train_loss: 0.8517, test_loss: 1.0313, test_f1: 0.5540
 epoch: 11, train_loss: 0.8230, test_loss: 1.1253, test_f1: 0.5757
 epoch: 12, train_loss: 0.7999, test_loss: 1.0761, test_f1: 0.5742
 epoch: 13, train_loss: 0.7742, test_loss: 1.3302, test_f1: 0.5033
 epoch: 14, train_loss: 0.7818, test_loss: 1.1986, test_f1: 0.5642
 epoch: 15, train_loss: 0.7864, test_loss: 1.1373, test_f1: 0.5727
 epoch: 16, train_loss: 0.7954, test_loss: 1.3290, test_f1: 0.5561
 epoch: 17, train_loss: 0.7691, test_loss: 1.2051, test_f1: 0.5992
 epoch: 18, train_loss: 0.7485, test_loss: 1.2571, test_f1: 0.5528
 epoch: 19, train_loss: 0.7434, test_loss: 1.2568, test_f1: 0.5611
 epoch: 20, train_loss: 0.7183, test_loss: 1.2552, test_f1: 0.5718
 epoch: 21, train_loss: 0.7189, test_loss: 1.2903, test_f1: 0.5744
 epoch: 22, train_loss: 0.6869, test_loss: 1.3433, test_f1: 0.5689
 epoch: 23, train_loss: 0.6791, test_loss: 1.2570, test_f1: 0.5637
 epoch: 24, train_loss: 0.6721, test_loss: 1.3525, test_f1: 0.6083
 epoch: 25, train_loss: 0.6789, test_loss: 1.4859, test_f1: 0.5411
 epoch: 26, train_loss: 0.6671, test_loss: 1.3126, test_f1: 0.5587
 epoch: 27, train_loss: 0.6424, test_loss: 1.3815, test_f1: 0.5858
 epoch: 28, train_loss: 0.6482, test_loss: 1.2514, test_f1: 0.6017
 epoch: 29, train_loss: 0.6202, test_loss: 1.4322, test_f1: 0.5943
 epoch: 30, train_loss: 0.6293, test_loss: 1.3230, test_f1: 0.6273
 epoch: 31, train_loss: 0.6161, test_loss: 1.4781, test_f1: 0.6094
 epoch: 32, train_loss: 0.5958, test_loss: 1.5077, test_f1: 0.5890
 epoch: 33, train_loss: 0.5833, test_loss: 1.4388, test_f1: 0.5891
 epoch: 34, train_loss: 0.5762, test_loss: 1.5295, test_f1: 0.5906
 epoch: 35, train_loss: 0.5917, test_loss: 1.5288, test_f1: 0.5890
 epoch: 36, train_loss: 0.5722, test_loss: 1.6994, test_f1: 0.5826
 epoch: 37, train_loss: 0.5464, test_loss: 1.5257, test_f1: 0.6175
 epoch: 38, train_loss: 0.5588, test_loss: 1.7438, test_f1: 0.5828
 epoch: 39, train_loss: 0.5539, test_loss: 1.7525, test_f1: 0.6697
 epoch: 40, train_loss: 0.5272, test_loss: 1.8315, test_f1: 0.5795
 epoch: 41, train_loss: 0.5586, test_loss: 1.7184, test_f1: 0.5964
 epoch: 42, train_loss: 0.5281, test_loss: 1.6157, test_f1: 0.6394
 epoch: 43, train_loss: 0.5018, test_loss: 1.7594, test_f1: 0.6064
 epoch: 44, train_loss: 0.5099, test_loss: 1.7555, test_f1: 0.5968
 epoch: 45, train_loss: 0.4809, test_loss: 1.8409, test_f1: 0.5721
 epoch: 46, train_loss: 0.4729, test_loss: 1.9613, test_f1: 0.5959
 epoch: 47, train_loss: 0.4593, test_loss: 1.9095, test_f1: 0.5889
 epoch: 48, train_loss: 0.5024, test_loss: 1.9352, test_f1: 0.5925
 epoch: 49, train_loss: 0.4851, test_loss: 1.7508, test_f1: 0.6292
 epoch: 50, train_loss: 0.4825, test_loss: 1.8897, test_f1: 0.5906
 epoch: 51, train_loss: 0.4567, test_loss: 1.7973, test_f1: 0.5792
 epoch: 52, train_loss: 0.4313, test_loss: 1.6353, test_f1: 0.6339
 epoch: 53, train_loss: 0.4009, test_loss: 2.0216, test_f1: 0.5570
 epoch: 54, train_loss: 0.3740, test_loss: 1.7635, test_f1: 0.6092
 epoch: 55, train_loss: 0.3625, test_loss: 1.8362, test_f1: 0.6054
 epoch: 56, train_loss: 0.3670, test_loss: 1.9006, test_f1: 0.6214
 epoch: 57, train_loss: 0.3685, test_loss: 1.9528, test_f1: 0.5822
 epoch: 58, train_loss: 0.3580, test_loss: 1.9227, test_f1: 0.5990
 epoch: 59, train_loss: 0.3519, test_loss: 2.0139, test_f1: 0.6124
 epoch: 60, train_loss: 0.3522, test_loss: 2.0534, test_f1: 0.6033
 epoch: 61, train_loss: 0.3206, test_loss: 2.0474, test_f1: 0.5792
 epoch: 62, train_loss: 0.3418, test_loss: 1.9837, test_f1: 0.6057
 epoch: 63, train_loss: 0.3202, test_loss: 2.1967, test_f1: 0.6117
 epoch: 64, train_loss: 0.3087, test_loss: 2.0343, test_f1: 0.6022
 epoch: 65, train_loss: 0.2996, test_loss: 2.2071, test_f1: 0.6081
 epoch: 66, train_loss: 0.3205, test_loss: 2.1818, test_f1: 0.5915
 epoch: 67, train_loss: 0.3140, test_loss: 2.3084, test_f1: 0.5943
 epoch: 68, train_loss: 0.3109, test_loss: 2.1899, test_f1: 0.6097
 epoch: 69, train_loss: 0.3083, test_loss: 1.9971, test_f1: 0.6291
 epoch: 70, train_loss: 0.3070, test_loss: 2.0168, test_f1: 0.5950
 epoch: 71, train_loss: 0.3054, test_loss: 2.0466, test_f1: 0.6245
 epoch: 72, train_loss: 0.2955, test_loss: 2.2022, test_f1: 0.6126
 epoch: 73, train_loss: 0.2878, test_loss: 2.5229, test_f1: 0.5904
 epoch: 74, train_loss: 0.2869, test_loss: 2.3279, test_f1: 0.6004
 epoch: 75, train_loss: 0.2530, test_loss: 2.5632, test_f1: 0.5963
 epoch: 76, train_loss: 0.2666, test_loss: 2.6799, test_f1: 0.5949
 epoch: 77, train_loss: 0.2923, test_loss: 2.6786, test_f1: 0.5831
 epoch: 78, train_loss: 0.3618, test_loss: 2.5291, test_f1: 0.6052
 epoch: 79, train_loss: 0.3192, test_loss: 2.3749, test_f1: 0.6157
 epoch: 80, train_loss: 0.2904, test_loss: 2.3072, test_f1: 0.6066
 epoch: 81, train_loss: 0.2906, test_loss: 2.3235, test_f1: 0.6054
 epoch: 82, train_loss: 0.2738, test_loss: 2.5438, test_f1: 0.6262
 epoch: 83, train_loss: 0.2832, test_loss: 2.5886, test_f1: 0.6169
 epoch: 84, train_loss: 0.2733, test_loss: 2.8401, test_f1: 0.5722
 epoch: 85, train_loss: 0.3124, test_loss: 2.7736, test_f1: 0.5930
 epoch: 86, train_loss: 0.3029, test_loss: 2.5959, test_f1: 0.6194
 epoch: 87, train_loss: 0.2932, test_loss: 2.4541, test_f1: 0.5870
 epoch: 88, train_loss: 0.2854, test_loss: 2.4911, test_f1: 0.5950
 epoch: 89, train_loss: 0.2600, test_loss: 2.6057, test_f1: 0.6040
 epoch: 90, train_loss: 0.2463, test_loss: 2.4627, test_f1: 0.6063
 epoch: 91, train_loss: 0.2561, test_loss: 2.5655, test_f1: 0.6090
 epoch: 92, train_loss: 0.2279, test_loss: 2.7095, test_f1: 0.6188
 epoch: 93, train_loss: 0.2212, test_loss: 2.4883, test_f1: 0.6347
 epoch: 94, train_loss: 0.2391, test_loss: 2.7420, test_f1: 0.6057
 epoch: 95, train_loss: 0.2376, test_loss: 2.7442, test_f1: 0.6101
 epoch: 96, train_loss: 0.2278, test_loss: 2.6261, test_f1: 0.6099
 epoch: 97, train_loss: 0.2091, test_loss: 2.7730, test_f1: 0.6092
 epoch: 98, train_loss: 0.3076, test_loss: 2.8170, test_f1: 0.6109
 epoch: 99, train_loss: 0.2583, test_loss: 2.3408, test_f1: 0.5859
##################ITERATION #9 ****************************************
 epoch: 0, train_loss: 1.2351, test_loss: 1.3338, test_f1: 0.1365
 epoch: 1, train_loss: 1.0798, test_loss: 1.2403, test_f1: 0.1997
 epoch: 2, train_loss: 0.9834, test_loss: 1.1835, test_f1: 0.2948
 epoch: 3, train_loss: 0.9442, test_loss: 1.2084, test_f1: 0.4347
 epoch: 4, train_loss: 0.9300, test_loss: 1.1579, test_f1: 0.5129
 epoch: 5, train_loss: 0.9041, test_loss: 1.1278, test_f1: 0.5410
 epoch: 6, train_loss: 0.8726, test_loss: 1.0715, test_f1: 0.5479
 epoch: 7, train_loss: 0.8898, test_loss: 1.2335, test_f1: 0.5470
 epoch: 8, train_loss: 0.8740, test_loss: 1.0483, test_f1: 0.5657
 epoch: 9, train_loss: 0.8541, test_loss: 1.1688, test_f1: 0.5611
 epoch: 10, train_loss: 0.8219, test_loss: 1.0157, test_f1: 0.5787
 epoch: 11, train_loss: 0.8213, test_loss: 1.1479, test_f1: 0.5806
 epoch: 12, train_loss: 0.7989, test_loss: 0.9881, test_f1: 0.5830
 epoch: 13, train_loss: 0.7804, test_loss: 1.1179, test_f1: 0.5801
 epoch: 14, train_loss: 0.7894, test_loss: 1.0656, test_f1: 0.6025
 epoch: 15, train_loss: 0.7709, test_loss: 1.0532, test_f1: 0.5975
 epoch: 16, train_loss: 0.7581, test_loss: 1.0692, test_f1: 0.6046
 epoch: 17, train_loss: 0.7515, test_loss: 1.0748, test_f1: 0.6176
 epoch: 18, train_loss: 0.7360, test_loss: 1.0455, test_f1: 0.6444
 epoch: 19, train_loss: 0.7238, test_loss: 1.1920, test_f1: 0.6335
 epoch: 20, train_loss: 0.7118, test_loss: 1.0882, test_f1: 0.6200
 epoch: 21, train_loss: 0.7009, test_loss: 1.1570, test_f1: 0.5888
 epoch: 22, train_loss: 0.6776, test_loss: 1.1711, test_f1: 0.5917
 epoch: 23, train_loss: 0.6437, test_loss: 1.2035, test_f1: 0.6188
 epoch: 24, train_loss: 0.6429, test_loss: 1.3405, test_f1: 0.5447
 epoch: 25, train_loss: 0.6424, test_loss: 1.2458, test_f1: 0.6106
 epoch: 26, train_loss: 0.6206, test_loss: 1.3905, test_f1: 0.5619
 epoch: 27, train_loss: 0.6275, test_loss: 1.3657, test_f1: 0.5869
 epoch: 28, train_loss: 0.6101, test_loss: 1.2656, test_f1: 0.6097
 epoch: 29, train_loss: 0.6100, test_loss: 1.1883, test_f1: 0.6351
 epoch: 30, train_loss: 0.6174, test_loss: 1.4527, test_f1: 0.5951
 epoch: 31, train_loss: 0.6207, test_loss: 1.2371, test_f1: 0.6404
 epoch: 32, train_loss: 0.5992, test_loss: 1.4416, test_f1: 0.5886
 epoch: 33, train_loss: 0.6251, test_loss: 1.4043, test_f1: 0.5914
 epoch: 34, train_loss: 0.5821, test_loss: 1.4034, test_f1: 0.5779
 epoch: 35, train_loss: 0.5749, test_loss: 1.4698, test_f1: 0.5418
 epoch: 36, train_loss: 0.5422, test_loss: 1.4418, test_f1: 0.5745
 epoch: 37, train_loss: 0.5146, test_loss: 1.5638, test_f1: 0.5606
 epoch: 38, train_loss: 0.5228, test_loss: 1.5735, test_f1: 0.5780
 epoch: 39, train_loss: 0.5100, test_loss: 1.4085, test_f1: 0.5850
 epoch: 40, train_loss: 0.5227, test_loss: 1.4976, test_f1: 0.5703
 epoch: 41, train_loss: 0.4987, test_loss: 1.5650, test_f1: 0.6128
 epoch: 42, train_loss: 0.4722, test_loss: 1.6430, test_f1: 0.5985
 epoch: 43, train_loss: 0.4369, test_loss: 1.6683, test_f1: 0.6187
 epoch: 44, train_loss: 0.4056, test_loss: 1.8635, test_f1: 0.5890
 epoch: 45, train_loss: 0.4629, test_loss: 1.9223, test_f1: 0.5504
 epoch: 46, train_loss: 0.5410, test_loss: 1.9788, test_f1: 0.5192
 epoch: 47, train_loss: 0.5078, test_loss: 1.4516, test_f1: 0.6015
 epoch: 48, train_loss: 0.4771, test_loss: 1.5271, test_f1: 0.5979
 epoch: 49, train_loss: 0.4368, test_loss: 1.8257, test_f1: 0.5808
 epoch: 50, train_loss: 0.4478, test_loss: 1.7354, test_f1: 0.5666
 epoch: 51, train_loss: 0.4498, test_loss: 1.5634, test_f1: 0.6557
 epoch: 52, train_loss: 0.3998, test_loss: 1.6250, test_f1: 0.6204
 epoch: 53, train_loss: 0.3853, test_loss: 1.6015, test_f1: 0.5928
 epoch: 54, train_loss: 0.3640, test_loss: 1.6088, test_f1: 0.6191
 epoch: 55, train_loss: 0.3611, test_loss: 1.8268, test_f1: 0.5869
 epoch: 56, train_loss: 0.3193, test_loss: 1.7427, test_f1: 0.6134
 epoch: 57, train_loss: 0.3135, test_loss: 1.9418, test_f1: 0.5691
 epoch: 58, train_loss: 0.3314, test_loss: 1.9373, test_f1: 0.5912
 epoch: 59, train_loss: 0.3454, test_loss: 1.6767, test_f1: 0.6207
 epoch: 60, train_loss: 0.3299, test_loss: 1.9358, test_f1: 0.5900
 epoch: 61, train_loss: 0.3159, test_loss: 2.0471, test_f1: 0.5970
 epoch: 62, train_loss: 0.3049, test_loss: 1.8386, test_f1: 0.6284
 epoch: 63, train_loss: 0.2994, test_loss: 1.9928, test_f1: 0.6161
 epoch: 64, train_loss: 0.2907, test_loss: 2.0355, test_f1: 0.6001
 epoch: 65, train_loss: 0.3131, test_loss: 2.0331, test_f1: 0.6014
 epoch: 66, train_loss: 0.2977, test_loss: 1.9674, test_f1: 0.6439
 epoch: 67, train_loss: 0.2901, test_loss: 2.1884, test_f1: 0.6045
 epoch: 68, train_loss: 0.2516, test_loss: 2.2121, test_f1: 0.6047
 epoch: 69, train_loss: 0.2690, test_loss: 2.2551, test_f1: 0.5992
 epoch: 70, train_loss: 0.2954, test_loss: 2.1463, test_f1: 0.6200
 epoch: 71, train_loss: 0.2674, test_loss: 2.6813, test_f1: 0.5788
 epoch: 72, train_loss: 0.2765, test_loss: 2.2038, test_f1: 0.5953
 epoch: 73, train_loss: 0.2665, test_loss: 2.2408, test_f1: 0.6170
 epoch: 74, train_loss: 0.2624, test_loss: 2.2118, test_f1: 0.6110
 epoch: 75, train_loss: 0.2500, test_loss: 2.3725, test_f1: 0.6198
 epoch: 76, train_loss: 0.2560, test_loss: 2.4262, test_f1: 0.6114
 epoch: 77, train_loss: 0.2692, test_loss: 2.4182, test_f1: 0.5977
 epoch: 78, train_loss: 0.2537, test_loss: 2.6235, test_f1: 0.6065
 epoch: 79, train_loss: 0.2703, test_loss: 2.5289, test_f1: 0.5921
 epoch: 80, train_loss: 0.2279, test_loss: 2.4988, test_f1: 0.5717
 epoch: 81, train_loss: 0.2251, test_loss: 2.3672, test_f1: 0.6306
 epoch: 82, train_loss: 0.2228, test_loss: 2.4220, test_f1: 0.6043
 epoch: 83, train_loss: 0.2264, test_loss: 2.7056, test_f1: 0.6068
 epoch: 84, train_loss: 0.2412, test_loss: 2.7455, test_f1: 0.6064
 epoch: 85, train_loss: 0.2372, test_loss: 2.7368, test_f1: 0.6008
 epoch: 86, train_loss: 0.2420, test_loss: 2.6505, test_f1: 0.6011
 epoch: 87, train_loss: 0.2407, test_loss: 2.8122, test_f1: 0.6037
 epoch: 88, train_loss: 0.2421, test_loss: 2.6409, test_f1: 0.5941
 epoch: 89, train_loss: 0.2391, test_loss: 2.5014, test_f1: 0.6093
 epoch: 90, train_loss: 0.2137, test_loss: 2.4223, test_f1: 0.6211
 epoch: 91, train_loss: 0.2079, test_loss: 2.4209, test_f1: 0.6323
 epoch: 92, train_loss: 0.2068, test_loss: 2.7209, test_f1: 0.6255
 epoch: 93, train_loss: 0.1933, test_loss: 2.7691, test_f1: 0.6003
 epoch: 94, train_loss: 0.1933, test_loss: 2.7994, test_f1: 0.6052
 epoch: 95, train_loss: 0.1819, test_loss: 2.6421, test_f1: 0.6132
 epoch: 96, train_loss: 0.1900, test_loss: 2.8966, test_f1: 0.5938
 epoch: 97, train_loss: 0.2337, test_loss: 3.1691, test_f1: 0.5733
 epoch: 98, train_loss: 0.2164, test_loss: 2.9083, test_f1: 0.6052
 epoch: 99, train_loss: 0.1985, test_loss: 2.7836, test_f1: 0.6451

Training completed in 510.94 seconds
Best F1: 0.6697 at epoch 39
Mean F1 across iterations: 0.6496  0.0151
========================FINAL RESULTS================================
FEGIN weighted F1: 0.6697  0.0151
python main.py --data ltspice_demos --representation component_net --model FEGIN --layers 6 --hiddens 128 --batch_size 128 --lr 0.001 --emb_size 128 --epochs 100 --save_appendix component_net_L6_H128_BS128_LR0.001_E128 --no_val
-----



STDERR:
  File "main.py", line 370, in <module>
    main()
  File "main.py", line 254, in main
    dataset = dataset_class(
  File "/home/philip/projects/ltspice_examples_code_repo/Circuit-Completion-Using-GNNs/component_classification_with_link_prediction_head/evaluation/FEGIN/kernel/circuit_datasets.py", line 15, in __init__
    self.data, self.slices = torch.load(self.processed_paths[0])
  File "/home/philip/.local/lib/python3.8/site-packages/torch/serialization.py", line 1040, in load
    warnings.warn(
  File "/usr/lib/python3.8/warnings.py", line 109, in _showwarnmsg
    sw(msg.message, msg.category, msg.filename, msg.lineno,
  File "main.py", line 47, in warn_with_traceback
    traceback.print_stack(file=log)
/home/philip/projects/ltspice_examples_code_repo/Circuit-Completion-Using-GNNs/component_classification_with_link_prediction_head/evaluation/FEGIN/kernel/circuit_datasets.py:15: FutureWarning: You are using `torch.load` with `weights_only=False` (the current default value), which uses the default pickle module implicitly. It is possible to construct malicious pickle data which will execute arbitrary code during unpickling (See https://github.com/pytorch/pytorch/blob/main/SECURITY.md#untrusted-models for more details). In a future release, the default value for `weights_only` will be flipped to `True`. This limits the functions that could be executed during unpickling. Arbitrary objects will no longer be allowed to be loaded via this mode unless they are explicitly allowlisted by the user via `torch.serialization.add_safe_globals`. We recommend you start setting `weights_only=True` for any use case where you don't have full control of the loaded file. Please open an issue on GitHub for any issues related to this experimental feature.
  self.data, self.slices = torch.load(self.processed_paths[0])
