STDOUT:
Results will be saved in /home/philip/projects/ltspice_examples_code_repo/Circuit-Completion-Using-GNNs/component_classification_with_link_prediction_head/evaluation/FEGIN/results/model_FEGIN_dataset_ltspice_examples
Command line input: python main.py --data ltspice_examples --representation component_net --model FEGIN --layers 3 --hiddens 16 --batch_size 256 --lr 0.01 --emb_size 250 --epochs 100 --save_appendix component_net_L3_H16_BS256_LR0.01_E250 --no_val
 is saved.
-----
ltspice_examples - FEGIN
Using 3 layers, 16 hidden units, h = 2
Loading component_net representation dataset
ENTERED
Training FEGIN on component_net representation
Train: 3558, Test: 846
##################ITERATION #0 ****************************************
 epoch: 0, train_loss: 1.3074, test_loss: 1.2984, test_f1: 0.2270
 epoch: 1, train_loss: 1.2202, test_loss: 1.2387, test_f1: 0.2270
 epoch: 2, train_loss: 1.1840, test_loss: 1.1815, test_f1: 0.2270
 epoch: 3, train_loss: 1.1431, test_loss: 1.1514, test_f1: 0.2270
 epoch: 4, train_loss: 1.1148, test_loss: 1.1098, test_f1: 0.4165
 epoch: 5, train_loss: 1.0663, test_loss: 1.0339, test_f1: 0.4837
 epoch: 6, train_loss: 1.0197, test_loss: 1.0102, test_f1: 0.4966
 epoch: 7, train_loss: 0.9877, test_loss: 1.0074, test_f1: 0.4889
 epoch: 8, train_loss: 0.9575, test_loss: 1.1429, test_f1: 0.4461
 epoch: 9, train_loss: 0.9574, test_loss: 0.9550, test_f1: 0.4823
 epoch: 10, train_loss: 0.9507, test_loss: 0.9853, test_f1: 0.4572
 epoch: 11, train_loss: 0.9580, test_loss: 0.9446, test_f1: 0.5525
 epoch: 12, train_loss: 0.9277, test_loss: 0.9734, test_f1: 0.5044
 epoch: 13, train_loss: 0.9087, test_loss: 0.9477, test_f1: 0.5214
 epoch: 14, train_loss: 0.9021, test_loss: 0.8817, test_f1: 0.5476
 epoch: 15, train_loss: 0.8976, test_loss: 0.9627, test_f1: 0.4943
 epoch: 16, train_loss: 0.8900, test_loss: 0.8841, test_f1: 0.5044
 epoch: 17, train_loss: 0.8769, test_loss: 1.0941, test_f1: 0.5335
 epoch: 18, train_loss: 0.8850, test_loss: 0.9876, test_f1: 0.5222
 epoch: 19, train_loss: 0.8801, test_loss: 0.9595, test_f1: 0.5247
 epoch: 20, train_loss: 0.8772, test_loss: 1.0152, test_f1: 0.5074
 epoch: 21, train_loss: 0.8748, test_loss: 0.9126, test_f1: 0.5300
 epoch: 22, train_loss: 0.8883, test_loss: 0.9572, test_f1: 0.5085
 epoch: 23, train_loss: 0.8790, test_loss: 1.0617, test_f1: 0.4968
 epoch: 24, train_loss: 0.8509, test_loss: 1.0323, test_f1: 0.5187
 epoch: 25, train_loss: 0.8551, test_loss: 1.0269, test_f1: 0.5212
 epoch: 26, train_loss: 0.8504, test_loss: 0.9421, test_f1: 0.5483
 epoch: 27, train_loss: 0.8477, test_loss: 0.9913, test_f1: 0.5124
 epoch: 28, train_loss: 0.8545, test_loss: 0.9643, test_f1: 0.5468
 epoch: 29, train_loss: 0.8438, test_loss: 1.0076, test_f1: 0.5510
 epoch: 30, train_loss: 0.8595, test_loss: 1.1769, test_f1: 0.4711
 epoch: 31, train_loss: 0.8505, test_loss: 1.0760, test_f1: 0.5172
 epoch: 32, train_loss: 0.8309, test_loss: 0.9644, test_f1: 0.5450
 epoch: 33, train_loss: 0.8485, test_loss: 0.9093, test_f1: 0.5459
 epoch: 34, train_loss: 0.8295, test_loss: 1.0215, test_f1: 0.5346
 epoch: 35, train_loss: 0.8275, test_loss: 0.9844, test_f1: 0.5455
 epoch: 36, train_loss: 0.8212, test_loss: 1.0718, test_f1: 0.5326
 epoch: 37, train_loss: 0.8496, test_loss: 1.1407, test_f1: 0.5499
 epoch: 38, train_loss: 0.8322, test_loss: 0.9538, test_f1: 0.5346
 epoch: 39, train_loss: 0.8164, test_loss: 1.0333, test_f1: 0.5425
 epoch: 40, train_loss: 0.8148, test_loss: 1.0051, test_f1: 0.5855
 epoch: 41, train_loss: 0.8138, test_loss: 1.0972, test_f1: 0.5666
 epoch: 42, train_loss: 0.8257, test_loss: 0.9908, test_f1: 0.5521
 epoch: 43, train_loss: 0.8042, test_loss: 1.1175, test_f1: 0.5423
 epoch: 44, train_loss: 0.7999, test_loss: 1.0376, test_f1: 0.5739
 epoch: 45, train_loss: 0.8096, test_loss: 1.0534, test_f1: 0.5470
 epoch: 46, train_loss: 0.8023, test_loss: 0.9800, test_f1: 0.5618
 epoch: 47, train_loss: 0.7941, test_loss: 1.0410, test_f1: 0.5657
 epoch: 48, train_loss: 0.8085, test_loss: 0.9647, test_f1: 0.5727
 epoch: 49, train_loss: 0.7927, test_loss: 1.1210, test_f1: 0.5363
 epoch: 50, train_loss: 0.8280, test_loss: 1.0417, test_f1: 0.5433
 epoch: 51, train_loss: 0.7994, test_loss: 1.0487, test_f1: 0.5734
 epoch: 52, train_loss: 0.7801, test_loss: 1.0777, test_f1: 0.5649
 epoch: 53, train_loss: 0.7733, test_loss: 1.1037, test_f1: 0.5623
 epoch: 54, train_loss: 0.7698, test_loss: 1.0641, test_f1: 0.5865
 epoch: 55, train_loss: 0.7657, test_loss: 1.0737, test_f1: 0.5712
 epoch: 56, train_loss: 0.7665, test_loss: 1.0785, test_f1: 0.5914
 epoch: 57, train_loss: 0.7625, test_loss: 1.0892, test_f1: 0.5870
 epoch: 58, train_loss: 0.7556, test_loss: 1.1207, test_f1: 0.5768
 epoch: 59, train_loss: 0.7606, test_loss: 1.1012, test_f1: 0.5651
 epoch: 60, train_loss: 0.7600, test_loss: 1.1061, test_f1: 0.5562
 epoch: 61, train_loss: 0.7708, test_loss: 1.1091, test_f1: 0.5939
 epoch: 62, train_loss: 0.7493, test_loss: 1.1147, test_f1: 0.6018
 epoch: 63, train_loss: 0.7554, test_loss: 1.0820, test_f1: 0.5998
 epoch: 64, train_loss: 0.7556, test_loss: 1.0889, test_f1: 0.5751
 epoch: 65, train_loss: 0.7488, test_loss: 1.1177, test_f1: 0.5762
 epoch: 66, train_loss: 0.7545, test_loss: 1.1263, test_f1: 0.5824
 epoch: 67, train_loss: 0.7450, test_loss: 1.1252, test_f1: 0.5882
 epoch: 68, train_loss: 0.7587, test_loss: 1.1375, test_f1: 0.5909
 epoch: 69, train_loss: 0.7637, test_loss: 1.1101, test_f1: 0.5892
 epoch: 70, train_loss: 0.7474, test_loss: 1.1593, test_f1: 0.5518
 epoch: 71, train_loss: 0.7425, test_loss: 1.0639, test_f1: 0.5992
 epoch: 72, train_loss: 0.7483, test_loss: 1.1374, test_f1: 0.5766
 epoch: 73, train_loss: 0.7387, test_loss: 1.1102, test_f1: 0.5850
 epoch: 74, train_loss: 0.7494, test_loss: 1.0934, test_f1: 0.5824
 epoch: 75, train_loss: 0.7532, test_loss: 1.1179, test_f1: 0.5827
 epoch: 76, train_loss: 0.7391, test_loss: 1.0749, test_f1: 0.5930
 epoch: 77, train_loss: 0.7367, test_loss: 1.0787, test_f1: 0.5868
 epoch: 78, train_loss: 0.7432, test_loss: 1.1807, test_f1: 0.5714
 epoch: 79, train_loss: 0.7479, test_loss: 1.0797, test_f1: 0.5888
 epoch: 80, train_loss: 0.7285, test_loss: 1.1367, test_f1: 0.5919
 epoch: 81, train_loss: 0.7305, test_loss: 1.0917, test_f1: 0.5880
 epoch: 82, train_loss: 0.7332, test_loss: 1.1082, test_f1: 0.5739
 epoch: 83, train_loss: 0.7323, test_loss: 1.1164, test_f1: 0.6044
 epoch: 84, train_loss: 0.7325, test_loss: 1.0622, test_f1: 0.5947
 epoch: 85, train_loss: 0.7236, test_loss: 1.0690, test_f1: 0.6134
 epoch: 86, train_loss: 0.7294, test_loss: 1.1351, test_f1: 0.5874
 epoch: 87, train_loss: 0.7330, test_loss: 1.1032, test_f1: 0.5970
 epoch: 88, train_loss: 0.7303, test_loss: 1.0677, test_f1: 0.5718
 epoch: 89, train_loss: 0.7217, test_loss: 1.1102, test_f1: 0.5623
 epoch: 90, train_loss: 0.7301, test_loss: 1.0681, test_f1: 0.5949
 epoch: 91, train_loss: 0.7437, test_loss: 1.1015, test_f1: 0.5785
 epoch: 92, train_loss: 0.7205, test_loss: 1.0507, test_f1: 0.5930
 epoch: 93, train_loss: 0.7217, test_loss: 1.1183, test_f1: 0.5739
 epoch: 94, train_loss: 0.7286, test_loss: 1.0930, test_f1: 0.5728
 epoch: 95, train_loss: 0.7136, test_loss: 1.1535, test_f1: 0.5824
 epoch: 96, train_loss: 0.7305, test_loss: 1.0678, test_f1: 0.5895
 epoch: 97, train_loss: 0.7348, test_loss: 1.1185, test_f1: 0.5776
 epoch: 98, train_loss: 0.7337, test_loss: 1.1141, test_f1: 0.5595
 epoch: 99, train_loss: 0.7262, test_loss: 1.0687, test_f1: 0.5839
##################ITERATION #1 ****************************************
 epoch: 0, train_loss: 1.2883, test_loss: 1.2775, test_f1: 0.2270
 epoch: 1, train_loss: 1.1658, test_loss: 1.1897, test_f1: 0.3431
 epoch: 2, train_loss: 1.0986, test_loss: 1.1829, test_f1: 0.3112
 epoch: 3, train_loss: 1.0642, test_loss: 1.0380, test_f1: 0.3671
 epoch: 4, train_loss: 1.0440, test_loss: 1.0402, test_f1: 0.3599
 epoch: 5, train_loss: 1.0304, test_loss: 1.1272, test_f1: 0.3929
 epoch: 6, train_loss: 1.0013, test_loss: 1.0844, test_f1: 0.4356
 epoch: 7, train_loss: 0.9817, test_loss: 1.0301, test_f1: 0.4386
 epoch: 8, train_loss: 0.9729, test_loss: 0.9800, test_f1: 0.4885
 epoch: 9, train_loss: 0.9734, test_loss: 0.9968, test_f1: 0.4687
 epoch: 10, train_loss: 0.9609, test_loss: 0.9988, test_f1: 0.5030
 epoch: 11, train_loss: 0.9690, test_loss: 0.9576, test_f1: 0.4800
 epoch: 12, train_loss: 0.9481, test_loss: 0.9487, test_f1: 0.5029
 epoch: 13, train_loss: 0.9410, test_loss: 0.9974, test_f1: 0.4775
 epoch: 14, train_loss: 0.9385, test_loss: 1.0522, test_f1: 0.4744
 epoch: 15, train_loss: 0.9282, test_loss: 0.9397, test_f1: 0.4994
 epoch: 16, train_loss: 0.9260, test_loss: 0.9696, test_f1: 0.5107
 epoch: 17, train_loss: 0.9191, test_loss: 0.9715, test_f1: 0.5221
 epoch: 18, train_loss: 0.9118, test_loss: 0.9527, test_f1: 0.5038
 epoch: 19, train_loss: 0.9144, test_loss: 0.9247, test_f1: 0.5228
 epoch: 20, train_loss: 0.9034, test_loss: 0.9616, test_f1: 0.5162
 epoch: 21, train_loss: 0.8977, test_loss: 0.9197, test_f1: 0.5104
 epoch: 22, train_loss: 0.9033, test_loss: 1.0130, test_f1: 0.5007
 epoch: 23, train_loss: 0.8966, test_loss: 0.9612, test_f1: 0.5066
 epoch: 24, train_loss: 0.8865, test_loss: 1.1910, test_f1: 0.4674
 epoch: 25, train_loss: 0.8765, test_loss: 0.9244, test_f1: 0.5348
 epoch: 26, train_loss: 0.9000, test_loss: 0.9900, test_f1: 0.5002
 epoch: 27, train_loss: 0.8883, test_loss: 0.9847, test_f1: 0.4751
 epoch: 28, train_loss: 0.8763, test_loss: 0.9501, test_f1: 0.5506
 epoch: 29, train_loss: 0.8735, test_loss: 0.9532, test_f1: 0.5352
 epoch: 30, train_loss: 0.8699, test_loss: 0.9569, test_f1: 0.5070
 epoch: 31, train_loss: 0.8559, test_loss: 0.9953, test_f1: 0.5372
 epoch: 32, train_loss: 0.8592, test_loss: 0.8890, test_f1: 0.5240
 epoch: 33, train_loss: 0.8740, test_loss: 0.9657, test_f1: 0.5285
 epoch: 34, train_loss: 0.8729, test_loss: 0.9773, test_f1: 0.4914
 epoch: 35, train_loss: 0.8741, test_loss: 0.9815, test_f1: 0.5044
 epoch: 36, train_loss: 0.8598, test_loss: 0.9767, test_f1: 0.5244
 epoch: 37, train_loss: 0.8528, test_loss: 0.9453, test_f1: 0.5287
 epoch: 38, train_loss: 0.8594, test_loss: 1.0730, test_f1: 0.4844
 epoch: 39, train_loss: 0.8595, test_loss: 0.9968, test_f1: 0.4951
 epoch: 40, train_loss: 0.8446, test_loss: 0.9716, test_f1: 0.5475
 epoch: 41, train_loss: 0.8427, test_loss: 0.9366, test_f1: 0.5216
 epoch: 42, train_loss: 0.8646, test_loss: 0.9302, test_f1: 0.5300
 epoch: 43, train_loss: 0.8457, test_loss: 0.9849, test_f1: 0.5107
 epoch: 44, train_loss: 0.8364, test_loss: 0.9396, test_f1: 0.5227
 epoch: 45, train_loss: 0.8383, test_loss: 0.9206, test_f1: 0.5710
 epoch: 46, train_loss: 0.8508, test_loss: 0.9805, test_f1: 0.5477
 epoch: 47, train_loss: 0.8481, test_loss: 0.9458, test_f1: 0.5307
 epoch: 48, train_loss: 0.8280, test_loss: 0.9423, test_f1: 0.5106
 epoch: 49, train_loss: 0.8356, test_loss: 0.9336, test_f1: 0.5550
 epoch: 50, train_loss: 0.8343, test_loss: 0.9773, test_f1: 0.5562
 epoch: 51, train_loss: 0.8100, test_loss: 0.9835, test_f1: 0.5086
 epoch: 52, train_loss: 0.8163, test_loss: 0.9710, test_f1: 0.5091
 epoch: 53, train_loss: 0.8084, test_loss: 0.9359, test_f1: 0.5283
 epoch: 54, train_loss: 0.8108, test_loss: 0.9286, test_f1: 0.5384
 epoch: 55, train_loss: 0.7839, test_loss: 0.9743, test_f1: 0.5552
 epoch: 56, train_loss: 0.7827, test_loss: 0.9365, test_f1: 0.5321
 epoch: 57, train_loss: 0.8040, test_loss: 0.9553, test_f1: 0.5460
 epoch: 58, train_loss: 0.7959, test_loss: 0.9991, test_f1: 0.5469
 epoch: 59, train_loss: 0.7993, test_loss: 0.9787, test_f1: 0.5338
 epoch: 60, train_loss: 0.8028, test_loss: 0.9684, test_f1: 0.5604
 epoch: 61, train_loss: 0.7939, test_loss: 0.9620, test_f1: 0.5127
 epoch: 62, train_loss: 0.7829, test_loss: 0.9985, test_f1: 0.5369
 epoch: 63, train_loss: 0.7841, test_loss: 0.9907, test_f1: 0.5547
 epoch: 64, train_loss: 0.7814, test_loss: 0.9417, test_f1: 0.5472
 epoch: 65, train_loss: 0.7809, test_loss: 1.0035, test_f1: 0.5509
 epoch: 66, train_loss: 0.7932, test_loss: 0.9634, test_f1: 0.5312
 epoch: 67, train_loss: 0.7849, test_loss: 0.9852, test_f1: 0.5320
 epoch: 68, train_loss: 0.7800, test_loss: 0.9518, test_f1: 0.5361
 epoch: 69, train_loss: 0.7657, test_loss: 0.9320, test_f1: 0.5688
 epoch: 70, train_loss: 0.7675, test_loss: 0.9577, test_f1: 0.5289
 epoch: 71, train_loss: 0.7694, test_loss: 0.9685, test_f1: 0.5640
 epoch: 72, train_loss: 0.7752, test_loss: 1.0286, test_f1: 0.5202
 epoch: 73, train_loss: 0.7722, test_loss: 0.9651, test_f1: 0.5866
 epoch: 74, train_loss: 0.7677, test_loss: 1.0002, test_f1: 0.5615
 epoch: 75, train_loss: 0.7708, test_loss: 0.9907, test_f1: 0.5502
 epoch: 76, train_loss: 0.7670, test_loss: 0.9897, test_f1: 0.5577
 epoch: 77, train_loss: 0.7648, test_loss: 0.9335, test_f1: 0.5641
 epoch: 78, train_loss: 0.7634, test_loss: 0.9849, test_f1: 0.5635
 epoch: 79, train_loss: 0.7552, test_loss: 0.9693, test_f1: 0.5723
 epoch: 80, train_loss: 0.7604, test_loss: 0.9237, test_f1: 0.5680
 epoch: 81, train_loss: 0.7596, test_loss: 0.9929, test_f1: 0.5533
 epoch: 82, train_loss: 0.7668, test_loss: 0.9961, test_f1: 0.5741
 epoch: 83, train_loss: 0.7588, test_loss: 0.9858, test_f1: 0.5444
 epoch: 84, train_loss: 0.7497, test_loss: 1.0162, test_f1: 0.5629
 epoch: 85, train_loss: 0.7610, test_loss: 1.0521, test_f1: 0.5386
 epoch: 86, train_loss: 0.7718, test_loss: 0.9634, test_f1: 0.5581
 epoch: 87, train_loss: 0.7660, test_loss: 1.2395, test_f1: 0.4763
 epoch: 88, train_loss: 0.7651, test_loss: 0.9911, test_f1: 0.5434
 epoch: 89, train_loss: 0.7551, test_loss: 0.9704, test_f1: 0.5634
 epoch: 90, train_loss: 0.7691, test_loss: 0.9770, test_f1: 0.5799
 epoch: 91, train_loss: 0.7608, test_loss: 0.9740, test_f1: 0.5525
 epoch: 92, train_loss: 0.7639, test_loss: 0.9832, test_f1: 0.5383
 epoch: 93, train_loss: 0.7509, test_loss: 0.9652, test_f1: 0.5914
 epoch: 94, train_loss: 0.7628, test_loss: 0.9414, test_f1: 0.5788
 epoch: 95, train_loss: 0.7458, test_loss: 0.9742, test_f1: 0.5753
 epoch: 96, train_loss: 0.7510, test_loss: 0.9996, test_f1: 0.5717
 epoch: 97, train_loss: 0.7495, test_loss: 0.9634, test_f1: 0.5778
 epoch: 98, train_loss: 0.7536, test_loss: 0.9858, test_f1: 0.5546
 epoch: 99, train_loss: 0.7695, test_loss: 0.9533, test_f1: 0.5322
##################ITERATION #2 ****************************************
 epoch: 0, train_loss: 1.2453, test_loss: 1.2953, test_f1: 0.2270
 epoch: 1, train_loss: 1.0988, test_loss: 1.1603, test_f1: 0.2983
 epoch: 2, train_loss: 1.0773, test_loss: 1.0993, test_f1: 0.3404
 epoch: 3, train_loss: 1.0476, test_loss: 1.1379, test_f1: 0.3350
 epoch: 4, train_loss: 1.0350, test_loss: 1.2058, test_f1: 0.3355
 epoch: 5, train_loss: 1.0288, test_loss: 1.0041, test_f1: 0.4151
 epoch: 6, train_loss: 1.0163, test_loss: 1.0261, test_f1: 0.4698
 epoch: 7, train_loss: 1.0062, test_loss: 1.2292, test_f1: 0.3458
 epoch: 8, train_loss: 0.9838, test_loss: 1.0077, test_f1: 0.4614
 epoch: 9, train_loss: 0.9765, test_loss: 0.9971, test_f1: 0.5138
 epoch: 10, train_loss: 0.9666, test_loss: 1.0159, test_f1: 0.4765
 epoch: 11, train_loss: 0.9518, test_loss: 0.9452, test_f1: 0.5208
 epoch: 12, train_loss: 0.9466, test_loss: 0.9774, test_f1: 0.4754
 epoch: 13, train_loss: 0.9319, test_loss: 1.0518, test_f1: 0.4602
 epoch: 14, train_loss: 0.9294, test_loss: 0.9318, test_f1: 0.5335
 epoch: 15, train_loss: 0.9206, test_loss: 0.9172, test_f1: 0.4973
 epoch: 16, train_loss: 0.9229, test_loss: 0.9765, test_f1: 0.5370
 epoch: 17, train_loss: 0.9152, test_loss: 0.9172, test_f1: 0.4915
 epoch: 18, train_loss: 0.9146, test_loss: 0.9686, test_f1: 0.5098
 epoch: 19, train_loss: 0.9012, test_loss: 0.8941, test_f1: 0.5406
 epoch: 20, train_loss: 0.9060, test_loss: 1.2382, test_f1: 0.4078
 epoch: 21, train_loss: 0.8928, test_loss: 1.1187, test_f1: 0.4537
 epoch: 22, train_loss: 0.9015, test_loss: 0.9103, test_f1: 0.5021
 epoch: 23, train_loss: 0.8951, test_loss: 0.9323, test_f1: 0.4850
 epoch: 24, train_loss: 0.8904, test_loss: 1.0740, test_f1: 0.4574
 epoch: 25, train_loss: 0.9095, test_loss: 0.9257, test_f1: 0.5657
 epoch: 26, train_loss: 0.8929, test_loss: 1.0564, test_f1: 0.4982
 epoch: 27, train_loss: 0.8809, test_loss: 0.9937, test_f1: 0.5417
 epoch: 28, train_loss: 0.8791, test_loss: 1.0689, test_f1: 0.4505
 epoch: 29, train_loss: 0.8812, test_loss: 0.8956, test_f1: 0.5121
 epoch: 30, train_loss: 0.8746, test_loss: 1.1107, test_f1: 0.4547
 epoch: 31, train_loss: 0.8747, test_loss: 0.9625, test_f1: 0.5489
 epoch: 32, train_loss: 0.8730, test_loss: 1.0814, test_f1: 0.4500
 epoch: 33, train_loss: 0.8631, test_loss: 0.9304, test_f1: 0.5172
 epoch: 34, train_loss: 0.8803, test_loss: 0.8990, test_f1: 0.5214
 epoch: 35, train_loss: 0.8605, test_loss: 0.9306, test_f1: 0.5007
 epoch: 36, train_loss: 0.8477, test_loss: 0.9609, test_f1: 0.5554
 epoch: 37, train_loss: 0.8557, test_loss: 0.9513, test_f1: 0.5218
 epoch: 38, train_loss: 0.8470, test_loss: 0.9460, test_f1: 0.5249
 epoch: 39, train_loss: 0.8483, test_loss: 1.1905, test_f1: 0.4499
 epoch: 40, train_loss: 0.8591, test_loss: 0.9650, test_f1: 0.5102
 epoch: 41, train_loss: 0.8588, test_loss: 1.1124, test_f1: 0.4601
 epoch: 42, train_loss: 0.8623, test_loss: 0.9548, test_f1: 0.5623
 epoch: 43, train_loss: 0.8577, test_loss: 1.0052, test_f1: 0.5175
 epoch: 44, train_loss: 0.8429, test_loss: 0.9239, test_f1: 0.5365
 epoch: 45, train_loss: 0.8379, test_loss: 0.9625, test_f1: 0.5454
 epoch: 46, train_loss: 0.8294, test_loss: 1.0496, test_f1: 0.4868
 epoch: 47, train_loss: 0.8408, test_loss: 0.9342, test_f1: 0.5182
 epoch: 48, train_loss: 0.8461, test_loss: 0.9529, test_f1: 0.5472
 epoch: 49, train_loss: 0.8451, test_loss: 0.9417, test_f1: 0.4844
 epoch: 50, train_loss: 0.8454, test_loss: 0.8637, test_f1: 0.5262
 epoch: 51, train_loss: 0.8277, test_loss: 1.0516, test_f1: 0.4840
 epoch: 52, train_loss: 0.8121, test_loss: 0.9409, test_f1: 0.5310
 epoch: 53, train_loss: 0.8067, test_loss: 0.9672, test_f1: 0.5367
 epoch: 54, train_loss: 0.8107, test_loss: 0.9673, test_f1: 0.5340
 epoch: 55, train_loss: 0.8020, test_loss: 0.9437, test_f1: 0.5617
 epoch: 56, train_loss: 0.7965, test_loss: 0.9178, test_f1: 0.5336
 epoch: 57, train_loss: 0.8000, test_loss: 0.9395, test_f1: 0.5425
 epoch: 58, train_loss: 0.7904, test_loss: 0.9080, test_f1: 0.5553
 epoch: 59, train_loss: 0.7846, test_loss: 0.9133, test_f1: 0.5645
 epoch: 60, train_loss: 0.7839, test_loss: 0.9178, test_f1: 0.5616
 epoch: 61, train_loss: 0.7871, test_loss: 0.9766, test_f1: 0.5530
 epoch: 62, train_loss: 0.7819, test_loss: 0.9906, test_f1: 0.5341
 epoch: 63, train_loss: 0.7813, test_loss: 0.9227, test_f1: 0.5780
 epoch: 64, train_loss: 0.7728, test_loss: 0.9364, test_f1: 0.5527
 epoch: 65, train_loss: 0.7705, test_loss: 1.0257, test_f1: 0.5337
 epoch: 66, train_loss: 0.7769, test_loss: 0.9907, test_f1: 0.5457
 epoch: 67, train_loss: 0.7726, test_loss: 0.9080, test_f1: 0.5640
 epoch: 68, train_loss: 0.7743, test_loss: 1.0702, test_f1: 0.5291
 epoch: 69, train_loss: 0.7717, test_loss: 1.0077, test_f1: 0.5127
 epoch: 70, train_loss: 0.7728, test_loss: 1.0016, test_f1: 0.5534
 epoch: 71, train_loss: 0.7717, test_loss: 0.9296, test_f1: 0.5673
 epoch: 72, train_loss: 0.7670, test_loss: 0.9169, test_f1: 0.5172
 epoch: 73, train_loss: 0.7703, test_loss: 0.9503, test_f1: 0.5822
 epoch: 74, train_loss: 0.7788, test_loss: 0.9352, test_f1: 0.5595
 epoch: 75, train_loss: 0.7624, test_loss: 0.9631, test_f1: 0.5886
 epoch: 76, train_loss: 0.7655, test_loss: 1.0603, test_f1: 0.5358
 epoch: 77, train_loss: 0.7640, test_loss: 0.9157, test_f1: 0.5731
 epoch: 78, train_loss: 0.7663, test_loss: 0.9642, test_f1: 0.5809
 epoch: 79, train_loss: 0.7621, test_loss: 0.9244, test_f1: 0.5760
 epoch: 80, train_loss: 0.7604, test_loss: 0.9767, test_f1: 0.5608
 epoch: 81, train_loss: 0.7692, test_loss: 0.9597, test_f1: 0.5572
 epoch: 82, train_loss: 0.7572, test_loss: 0.9591, test_f1: 0.5776
 epoch: 83, train_loss: 0.7554, test_loss: 1.0402, test_f1: 0.5374
 epoch: 84, train_loss: 0.7563, test_loss: 0.9947, test_f1: 0.5722
 epoch: 85, train_loss: 0.7462, test_loss: 0.9883, test_f1: 0.5883
 epoch: 86, train_loss: 0.7583, test_loss: 0.9427, test_f1: 0.5647
 epoch: 87, train_loss: 0.7651, test_loss: 0.9475, test_f1: 0.5720
 epoch: 88, train_loss: 0.7464, test_loss: 1.0000, test_f1: 0.5384
 epoch: 89, train_loss: 0.7492, test_loss: 0.9919, test_f1: 0.5643
 epoch: 90, train_loss: 0.7436, test_loss: 0.9302, test_f1: 0.5597
 epoch: 91, train_loss: 0.7594, test_loss: 0.9790, test_f1: 0.5885
 epoch: 92, train_loss: 0.7508, test_loss: 1.0106, test_f1: 0.5615
 epoch: 93, train_loss: 0.7491, test_loss: 1.0150, test_f1: 0.5715
 epoch: 94, train_loss: 0.7418, test_loss: 1.0097, test_f1: 0.5345
 epoch: 95, train_loss: 0.7411, test_loss: 0.9669, test_f1: 0.5718
 epoch: 96, train_loss: 0.7456, test_loss: 0.9735, test_f1: 0.5747
 epoch: 97, train_loss: 0.7435, test_loss: 1.0561, test_f1: 0.5153
 epoch: 98, train_loss: 0.7558, test_loss: 0.9156, test_f1: 0.6187
 epoch: 99, train_loss: 0.7449, test_loss: 1.0146, test_f1: 0.5267
##################ITERATION #3 ****************************************
 epoch: 0, train_loss: 1.3255, test_loss: 1.2911, test_f1: 0.2270
 epoch: 1, train_loss: 1.1985, test_loss: 1.2737, test_f1: 0.2270
 epoch: 2, train_loss: 1.1258, test_loss: 1.1040, test_f1: 0.3296
 epoch: 3, train_loss: 1.0685, test_loss: 1.0691, test_f1: 0.3767
 epoch: 4, train_loss: 1.0373, test_loss: 1.0751, test_f1: 0.3829
 epoch: 5, train_loss: 1.0256, test_loss: 1.0275, test_f1: 0.4450
 epoch: 6, train_loss: 1.0004, test_loss: 1.0748, test_f1: 0.4038
 epoch: 7, train_loss: 0.9886, test_loss: 1.0218, test_f1: 0.4303
 epoch: 8, train_loss: 0.9688, test_loss: 1.0470, test_f1: 0.4598
 epoch: 9, train_loss: 0.9534, test_loss: 1.0229, test_f1: 0.4422
 epoch: 10, train_loss: 0.9436, test_loss: 1.0652, test_f1: 0.4129
 epoch: 11, train_loss: 0.9609, test_loss: 0.9896, test_f1: 0.4543
 epoch: 12, train_loss: 0.9555, test_loss: 1.0106, test_f1: 0.4552
 epoch: 13, train_loss: 0.9368, test_loss: 0.9978, test_f1: 0.4638
 epoch: 14, train_loss: 0.9283, test_loss: 0.9869, test_f1: 0.4665
 epoch: 15, train_loss: 0.9177, test_loss: 1.0281, test_f1: 0.4761
 epoch: 16, train_loss: 0.9116, test_loss: 0.9860, test_f1: 0.4874
 epoch: 17, train_loss: 0.8982, test_loss: 0.9854, test_f1: 0.4777
 epoch: 18, train_loss: 0.9042, test_loss: 0.9782, test_f1: 0.5025
 epoch: 19, train_loss: 0.8861, test_loss: 1.0090, test_f1: 0.4887
 epoch: 20, train_loss: 0.8947, test_loss: 0.9840, test_f1: 0.4946
 epoch: 21, train_loss: 0.8896, test_loss: 0.9557, test_f1: 0.5069
 epoch: 22, train_loss: 0.8874, test_loss: 0.9863, test_f1: 0.4789
 epoch: 23, train_loss: 0.8788, test_loss: 1.0338, test_f1: 0.4268
 epoch: 24, train_loss: 0.8721, test_loss: 0.9554, test_f1: 0.4777
 epoch: 25, train_loss: 0.8767, test_loss: 1.0036, test_f1: 0.4881
 epoch: 26, train_loss: 0.8735, test_loss: 0.9882, test_f1: 0.4734
 epoch: 27, train_loss: 0.8698, test_loss: 0.9392, test_f1: 0.4906
 epoch: 28, train_loss: 0.8581, test_loss: 1.0146, test_f1: 0.4669
 epoch: 29, train_loss: 0.8623, test_loss: 1.0161, test_f1: 0.4561
 epoch: 30, train_loss: 0.8711, test_loss: 0.9402, test_f1: 0.4701
 epoch: 31, train_loss: 0.8673, test_loss: 0.9901, test_f1: 0.4707
 epoch: 32, train_loss: 0.8574, test_loss: 0.9431, test_f1: 0.4952
 epoch: 33, train_loss: 0.8586, test_loss: 1.0244, test_f1: 0.4599
 epoch: 34, train_loss: 0.8502, test_loss: 0.9475, test_f1: 0.4987
 epoch: 35, train_loss: 0.8538, test_loss: 0.9941, test_f1: 0.4800
 epoch: 36, train_loss: 0.8480, test_loss: 0.9833, test_f1: 0.5067
 epoch: 37, train_loss: 0.8402, test_loss: 0.8866, test_f1: 0.5330
 epoch: 38, train_loss: 0.8578, test_loss: 0.9688, test_f1: 0.4716
 epoch: 39, train_loss: 0.8463, test_loss: 0.9334, test_f1: 0.5176
 epoch: 40, train_loss: 0.8461, test_loss: 0.9636, test_f1: 0.5016
 epoch: 41, train_loss: 0.8372, test_loss: 0.9088, test_f1: 0.5176
 epoch: 42, train_loss: 0.8397, test_loss: 0.8999, test_f1: 0.5281
 epoch: 43, train_loss: 0.8453, test_loss: 0.9306, test_f1: 0.4973
 epoch: 44, train_loss: 0.8350, test_loss: 0.9297, test_f1: 0.4997
 epoch: 45, train_loss: 0.8297, test_loss: 0.9237, test_f1: 0.5273
 epoch: 46, train_loss: 0.8052, test_loss: 0.9409, test_f1: 0.5088
 epoch: 47, train_loss: 0.8078, test_loss: 0.9087, test_f1: 0.5246
 epoch: 48, train_loss: 0.7949, test_loss: 0.8866, test_f1: 0.5135
 epoch: 49, train_loss: 0.8255, test_loss: 0.9562, test_f1: 0.5119
 epoch: 50, train_loss: 0.8081, test_loss: 0.9469, test_f1: 0.5120
 epoch: 51, train_loss: 0.7987, test_loss: 0.9101, test_f1: 0.5230
 epoch: 52, train_loss: 0.7833, test_loss: 0.9136, test_f1: 0.5098
 epoch: 53, train_loss: 0.7700, test_loss: 0.9066, test_f1: 0.5376
 epoch: 54, train_loss: 0.7787, test_loss: 0.9382, test_f1: 0.5212
 epoch: 55, train_loss: 0.7787, test_loss: 0.8895, test_f1: 0.5219
 epoch: 56, train_loss: 0.7808, test_loss: 0.9150, test_f1: 0.5036
 epoch: 57, train_loss: 0.7737, test_loss: 0.9251, test_f1: 0.5078
 epoch: 58, train_loss: 0.7840, test_loss: 0.9061, test_f1: 0.5657
 epoch: 59, train_loss: 0.7634, test_loss: 0.9109, test_f1: 0.5273
 epoch: 60, train_loss: 0.7656, test_loss: 0.9408, test_f1: 0.5214
 epoch: 61, train_loss: 0.7598, test_loss: 0.9170, test_f1: 0.5379
 epoch: 62, train_loss: 0.7639, test_loss: 0.9523, test_f1: 0.5149
 epoch: 63, train_loss: 0.7543, test_loss: 0.8867, test_f1: 0.5289
 epoch: 64, train_loss: 0.7658, test_loss: 0.9186, test_f1: 0.5697
 epoch: 65, train_loss: 0.7574, test_loss: 0.8905, test_f1: 0.5344
 epoch: 66, train_loss: 0.7601, test_loss: 0.8976, test_f1: 0.5362
 epoch: 67, train_loss: 0.7665, test_loss: 0.9567, test_f1: 0.5282
 epoch: 68, train_loss: 0.7537, test_loss: 0.9296, test_f1: 0.5417
 epoch: 69, train_loss: 0.7584, test_loss: 0.8957, test_f1: 0.5375
 epoch: 70, train_loss: 0.7693, test_loss: 0.9233, test_f1: 0.5378
 epoch: 71, train_loss: 0.7543, test_loss: 0.9365, test_f1: 0.5299
 epoch: 72, train_loss: 0.7452, test_loss: 0.9020, test_f1: 0.5229
 epoch: 73, train_loss: 0.7453, test_loss: 0.9377, test_f1: 0.5277
 epoch: 74, train_loss: 0.7638, test_loss: 0.9667, test_f1: 0.5142
 epoch: 75, train_loss: 0.7516, test_loss: 0.9081, test_f1: 0.5407
 epoch: 76, train_loss: 0.7532, test_loss: 0.9355, test_f1: 0.5222
 epoch: 77, train_loss: 0.7573, test_loss: 0.8924, test_f1: 0.5395
 epoch: 78, train_loss: 0.7437, test_loss: 0.9203, test_f1: 0.5358
 epoch: 79, train_loss: 0.7321, test_loss: 0.9151, test_f1: 0.5356
 epoch: 80, train_loss: 0.7354, test_loss: 0.9335, test_f1: 0.5612
 epoch: 81, train_loss: 0.7315, test_loss: 0.9028, test_f1: 0.5742
 epoch: 82, train_loss: 0.7386, test_loss: 0.9474, test_f1: 0.5582
 epoch: 83, train_loss: 0.7607, test_loss: 0.9442, test_f1: 0.5265
 epoch: 84, train_loss: 0.7402, test_loss: 0.9104, test_f1: 0.5371
 epoch: 85, train_loss: 0.7382, test_loss: 0.9240, test_f1: 0.5325
 epoch: 86, train_loss: 0.7362, test_loss: 0.9400, test_f1: 0.5506
 epoch: 87, train_loss: 0.7307, test_loss: 0.9199, test_f1: 0.5593
 epoch: 88, train_loss: 0.7313, test_loss: 0.9221, test_f1: 0.5424
 epoch: 89, train_loss: 0.7215, test_loss: 0.9477, test_f1: 0.5416
 epoch: 90, train_loss: 0.7228, test_loss: 0.9303, test_f1: 0.5364
 epoch: 91, train_loss: 0.7370, test_loss: 0.9291, test_f1: 0.5558
 epoch: 92, train_loss: 0.7190, test_loss: 0.9168, test_f1: 0.5570
 epoch: 93, train_loss: 0.7394, test_loss: 0.9136, test_f1: 0.5570
 epoch: 94, train_loss: 0.7412, test_loss: 0.9552, test_f1: 0.5437
 epoch: 95, train_loss: 0.7348, test_loss: 0.9112, test_f1: 0.5633
 epoch: 96, train_loss: 0.7247, test_loss: 0.9082, test_f1: 0.6080
 epoch: 97, train_loss: 0.7284, test_loss: 0.9445, test_f1: 0.5480
 epoch: 98, train_loss: 0.7121, test_loss: 0.9341, test_f1: 0.5431
 epoch: 99, train_loss: 0.7188, test_loss: 0.9506, test_f1: 0.5879
##################ITERATION #4 ****************************************
 epoch: 0, train_loss: 1.4111, test_loss: 1.3024, test_f1: 0.2270
 epoch: 1, train_loss: 1.1871, test_loss: 1.1680, test_f1: 0.3588
 epoch: 2, train_loss: 1.1319, test_loss: 1.0911, test_f1: 0.3864
 epoch: 3, train_loss: 1.0853, test_loss: 1.0567, test_f1: 0.3656
 epoch: 4, train_loss: 1.0623, test_loss: 1.0407, test_f1: 0.3812
 epoch: 5, train_loss: 1.0363, test_loss: 1.0349, test_f1: 0.4037
 epoch: 6, train_loss: 1.0176, test_loss: 0.9916, test_f1: 0.4716
 epoch: 7, train_loss: 1.0004, test_loss: 0.9796, test_f1: 0.4732
 epoch: 8, train_loss: 0.9833, test_loss: 0.9600, test_f1: 0.4703
 epoch: 9, train_loss: 0.9737, test_loss: 1.1598, test_f1: 0.4129
 epoch: 10, train_loss: 0.9850, test_loss: 0.9581, test_f1: 0.4650
 epoch: 11, train_loss: 0.9495, test_loss: 0.9973, test_f1: 0.4744
 epoch: 12, train_loss: 0.9546, test_loss: 0.9483, test_f1: 0.4803
 epoch: 13, train_loss: 0.9430, test_loss: 0.9841, test_f1: 0.4809
 epoch: 14, train_loss: 0.9426, test_loss: 0.9437, test_f1: 0.5301
 epoch: 15, train_loss: 0.9366, test_loss: 0.9153, test_f1: 0.4840
 epoch: 16, train_loss: 0.9323, test_loss: 0.9561, test_f1: 0.5132
 epoch: 17, train_loss: 0.9273, test_loss: 0.9684, test_f1: 0.5394
 epoch: 18, train_loss: 0.9163, test_loss: 1.0717, test_f1: 0.4604
 epoch: 19, train_loss: 0.9321, test_loss: 0.9911, test_f1: 0.4961
 epoch: 20, train_loss: 0.9198, test_loss: 0.9521, test_f1: 0.5072
 epoch: 21, train_loss: 0.9121, test_loss: 0.9591, test_f1: 0.5029
 epoch: 22, train_loss: 0.8975, test_loss: 0.9688, test_f1: 0.5224
 epoch: 23, train_loss: 0.8898, test_loss: 0.9305, test_f1: 0.5359
 epoch: 24, train_loss: 0.8842, test_loss: 0.9925, test_f1: 0.5115
 epoch: 25, train_loss: 0.8877, test_loss: 1.1482, test_f1: 0.4292
 epoch: 26, train_loss: 0.8764, test_loss: 0.9374, test_f1: 0.5260
 epoch: 27, train_loss: 0.8711, test_loss: 0.9658, test_f1: 0.5173
 epoch: 28, train_loss: 0.8673, test_loss: 0.9118, test_f1: 0.5473
 epoch: 29, train_loss: 0.8818, test_loss: 0.9380, test_f1: 0.5296
 epoch: 30, train_loss: 0.8699, test_loss: 0.9577, test_f1: 0.4959
 epoch: 31, train_loss: 0.8700, test_loss: 0.9410, test_f1: 0.5299
 epoch: 32, train_loss: 0.8746, test_loss: 0.8637, test_f1: 0.5481
 epoch: 33, train_loss: 0.8645, test_loss: 0.9822, test_f1: 0.5052
 epoch: 34, train_loss: 0.8586, test_loss: 0.9399, test_f1: 0.5277
 epoch: 35, train_loss: 0.8442, test_loss: 0.9516, test_f1: 0.5301
 epoch: 36, train_loss: 0.8416, test_loss: 0.9475, test_f1: 0.5169
 epoch: 37, train_loss: 0.8502, test_loss: 0.9429, test_f1: 0.5209
 epoch: 38, train_loss: 0.8440, test_loss: 0.9515, test_f1: 0.5179
 epoch: 39, train_loss: 0.8366, test_loss: 0.9644, test_f1: 0.4968
 epoch: 40, train_loss: 0.8673, test_loss: 1.0017, test_f1: 0.5278
 epoch: 41, train_loss: 0.8813, test_loss: 1.0925, test_f1: 0.4727
 epoch: 42, train_loss: 0.8628, test_loss: 0.9628, test_f1: 0.5153
 epoch: 43, train_loss: 0.8411, test_loss: 0.9585, test_f1: 0.5113
 epoch: 44, train_loss: 0.8435, test_loss: 0.9646, test_f1: 0.5171
 epoch: 45, train_loss: 0.8885, test_loss: 1.0136, test_f1: 0.5075
 epoch: 46, train_loss: 0.8399, test_loss: 0.9372, test_f1: 0.5096
 epoch: 47, train_loss: 0.8423, test_loss: 0.8405, test_f1: 0.5246
 epoch: 48, train_loss: 0.8432, test_loss: 0.8878, test_f1: 0.5375
 epoch: 49, train_loss: 0.8407, test_loss: 0.8856, test_f1: 0.5518
 epoch: 50, train_loss: 0.8338, test_loss: 0.9242, test_f1: 0.5378
 epoch: 51, train_loss: 0.8000, test_loss: 0.8859, test_f1: 0.5588
 epoch: 52, train_loss: 0.8002, test_loss: 0.9187, test_f1: 0.5338
 epoch: 53, train_loss: 0.8045, test_loss: 0.9026, test_f1: 0.5428
 epoch: 54, train_loss: 0.8031, test_loss: 0.8892, test_f1: 0.5510
 epoch: 55, train_loss: 0.7987, test_loss: 0.9350, test_f1: 0.5408
 epoch: 56, train_loss: 0.8165, test_loss: 0.8845, test_f1: 0.5369
 epoch: 57, train_loss: 0.8052, test_loss: 0.9024, test_f1: 0.5353
 epoch: 58, train_loss: 0.7959, test_loss: 0.9300, test_f1: 0.5279
 epoch: 59, train_loss: 0.7856, test_loss: 0.9092, test_f1: 0.5375
 epoch: 60, train_loss: 0.7870, test_loss: 0.8808, test_f1: 0.5722
 epoch: 61, train_loss: 0.7843, test_loss: 0.9033, test_f1: 0.5397
 epoch: 62, train_loss: 0.7789, test_loss: 0.8878, test_f1: 0.5541
 epoch: 63, train_loss: 0.7795, test_loss: 0.8910, test_f1: 0.5544
 epoch: 64, train_loss: 0.7817, test_loss: 0.9786, test_f1: 0.5369
 epoch: 65, train_loss: 0.7791, test_loss: 0.8733, test_f1: 0.5492
 epoch: 66, train_loss: 0.7868, test_loss: 0.8928, test_f1: 0.5710
 epoch: 67, train_loss: 0.7789, test_loss: 0.8893, test_f1: 0.5636
 epoch: 68, train_loss: 0.7753, test_loss: 0.9200, test_f1: 0.5425
 epoch: 69, train_loss: 0.7699, test_loss: 0.8616, test_f1: 0.5898
 epoch: 70, train_loss: 0.7734, test_loss: 0.9028, test_f1: 0.5328
 epoch: 71, train_loss: 0.7633, test_loss: 0.8818, test_f1: 0.5787
 epoch: 72, train_loss: 0.7656, test_loss: 0.8881, test_f1: 0.5446
 epoch: 73, train_loss: 0.7712, test_loss: 0.8793, test_f1: 0.5530
 epoch: 74, train_loss: 0.7634, test_loss: 0.8786, test_f1: 0.5706
 epoch: 75, train_loss: 0.7681, test_loss: 0.8725, test_f1: 0.5795
 epoch: 76, train_loss: 0.7758, test_loss: 0.8776, test_f1: 0.5372
 epoch: 77, train_loss: 0.7846, test_loss: 0.8796, test_f1: 0.5724
 epoch: 78, train_loss: 0.7556, test_loss: 0.8655, test_f1: 0.5517
 epoch: 79, train_loss: 0.7623, test_loss: 0.8748, test_f1: 0.5316
 epoch: 80, train_loss: 0.7576, test_loss: 0.8638, test_f1: 0.5818
 epoch: 81, train_loss: 0.7570, test_loss: 0.8633, test_f1: 0.5928
 epoch: 82, train_loss: 0.7548, test_loss: 0.8323, test_f1: 0.5495
 epoch: 83, train_loss: 0.7506, test_loss: 0.8913, test_f1: 0.5982
 epoch: 84, train_loss: 0.7487, test_loss: 0.8625, test_f1: 0.5548
 epoch: 85, train_loss: 0.7458, test_loss: 0.9089, test_f1: 0.5819
 epoch: 86, train_loss: 0.7548, test_loss: 0.8617, test_f1: 0.5688
 epoch: 87, train_loss: 0.7526, test_loss: 0.8815, test_f1: 0.5607
 epoch: 88, train_loss: 0.7498, test_loss: 0.9246, test_f1: 0.5388
 epoch: 89, train_loss: 0.7478, test_loss: 0.9195, test_f1: 0.5536
 epoch: 90, train_loss: 0.7403, test_loss: 0.8975, test_f1: 0.5843
 epoch: 91, train_loss: 0.7369, test_loss: 0.8971, test_f1: 0.5621
 epoch: 92, train_loss: 0.7376, test_loss: 0.8763, test_f1: 0.5708
 epoch: 93, train_loss: 0.7430, test_loss: 0.9499, test_f1: 0.5410
 epoch: 94, train_loss: 0.7334, test_loss: 0.8124, test_f1: 0.5820
 epoch: 95, train_loss: 0.7468, test_loss: 0.9013, test_f1: 0.5589
 epoch: 96, train_loss: 0.7435, test_loss: 0.9043, test_f1: 0.5497
 epoch: 97, train_loss: 0.7289, test_loss: 0.9120, test_f1: 0.5812
 epoch: 98, train_loss: 0.7576, test_loss: 0.9133, test_f1: 0.5698
 epoch: 99, train_loss: 0.7611, test_loss: 0.9195, test_f1: 0.5510
##################ITERATION #5 ****************************************
 epoch: 0, train_loss: 1.3388, test_loss: 1.3205, test_f1: 0.2270
 epoch: 1, train_loss: 1.1795, test_loss: 1.2337, test_f1: 0.3346
 epoch: 2, train_loss: 1.1218, test_loss: 1.1732, test_f1: 0.3632
 epoch: 3, train_loss: 1.0641, test_loss: 1.1001, test_f1: 0.4080
 epoch: 4, train_loss: 1.0081, test_loss: 1.0841, test_f1: 0.4222
 epoch: 5, train_loss: 0.9925, test_loss: 1.0279, test_f1: 0.4659
 epoch: 6, train_loss: 0.9690, test_loss: 1.0254, test_f1: 0.4502
 epoch: 7, train_loss: 0.9621, test_loss: 1.2471, test_f1: 0.4283
 epoch: 8, train_loss: 0.9636, test_loss: 1.1025, test_f1: 0.4522
 epoch: 9, train_loss: 0.9539, test_loss: 0.9977, test_f1: 0.4874
 epoch: 10, train_loss: 0.9343, test_loss: 1.0565, test_f1: 0.4559
 epoch: 11, train_loss: 0.9323, test_loss: 0.9731, test_f1: 0.4846
 epoch: 12, train_loss: 0.9317, test_loss: 1.0165, test_f1: 0.4958
 epoch: 13, train_loss: 0.9191, test_loss: 1.0649, test_f1: 0.4773
 epoch: 14, train_loss: 0.9090, test_loss: 0.9745, test_f1: 0.5302
 epoch: 15, train_loss: 0.8918, test_loss: 1.0793, test_f1: 0.4988
 epoch: 16, train_loss: 0.8806, test_loss: 0.9024, test_f1: 0.5344
 epoch: 17, train_loss: 0.8750, test_loss: 1.0184, test_f1: 0.5092
 epoch: 18, train_loss: 0.8730, test_loss: 0.9804, test_f1: 0.5183
 epoch: 19, train_loss: 0.8611, test_loss: 0.9815, test_f1: 0.5217
 epoch: 20, train_loss: 0.8752, test_loss: 1.0447, test_f1: 0.4710
 epoch: 21, train_loss: 0.8645, test_loss: 1.0207, test_f1: 0.5070
 epoch: 22, train_loss: 0.8731, test_loss: 1.0117, test_f1: 0.4963
 epoch: 23, train_loss: 0.8693, test_loss: 0.9702, test_f1: 0.5358
 epoch: 24, train_loss: 0.8501, test_loss: 1.0106, test_f1: 0.5089
 epoch: 25, train_loss: 0.8524, test_loss: 0.9568, test_f1: 0.5428
 epoch: 26, train_loss: 0.8513, test_loss: 0.9312, test_f1: 0.5387
 epoch: 27, train_loss: 0.8356, test_loss: 0.9449, test_f1: 0.5414
 epoch: 28, train_loss: 0.8501, test_loss: 1.0556, test_f1: 0.5059
 epoch: 29, train_loss: 0.8565, test_loss: 0.9565, test_f1: 0.5057
 epoch: 30, train_loss: 0.8510, test_loss: 0.9373, test_f1: 0.5374
 epoch: 31, train_loss: 0.8255, test_loss: 0.9427, test_f1: 0.5435
 epoch: 32, train_loss: 0.8203, test_loss: 1.0015, test_f1: 0.5209
 epoch: 33, train_loss: 0.8412, test_loss: 1.0175, test_f1: 0.5140
 epoch: 34, train_loss: 0.8298, test_loss: 0.9023, test_f1: 0.5615
 epoch: 35, train_loss: 0.8298, test_loss: 0.9591, test_f1: 0.5526
 epoch: 36, train_loss: 0.8120, test_loss: 1.0721, test_f1: 0.4960
 epoch: 37, train_loss: 0.8258, test_loss: 0.9253, test_f1: 0.5609
 epoch: 38, train_loss: 0.8132, test_loss: 1.0333, test_f1: 0.5003
 epoch: 39, train_loss: 0.8008, test_loss: 0.9106, test_f1: 0.5745
 epoch: 40, train_loss: 0.8114, test_loss: 1.0043, test_f1: 0.5235
 epoch: 41, train_loss: 0.7981, test_loss: 0.9745, test_f1: 0.5700
 epoch: 42, train_loss: 0.8106, test_loss: 0.9458, test_f1: 0.5428
 epoch: 43, train_loss: 0.8035, test_loss: 0.9488, test_f1: 0.5615
 epoch: 44, train_loss: 0.8013, test_loss: 0.9642, test_f1: 0.5239
 epoch: 45, train_loss: 0.7986, test_loss: 1.0448, test_f1: 0.5198
 epoch: 46, train_loss: 0.8014, test_loss: 1.0046, test_f1: 0.5346
 epoch: 47, train_loss: 0.7920, test_loss: 0.9065, test_f1: 0.5804
 epoch: 48, train_loss: 0.7963, test_loss: 0.9876, test_f1: 0.5323
 epoch: 49, train_loss: 0.8009, test_loss: 1.0341, test_f1: 0.5419
 epoch: 50, train_loss: 0.7861, test_loss: 0.9113, test_f1: 0.5577
 epoch: 51, train_loss: 0.7702, test_loss: 0.9457, test_f1: 0.5881
 epoch: 52, train_loss: 0.7559, test_loss: 0.8961, test_f1: 0.5831
 epoch: 53, train_loss: 0.7489, test_loss: 0.9173, test_f1: 0.5852
 epoch: 54, train_loss: 0.7574, test_loss: 0.8964, test_f1: 0.5943
 epoch: 55, train_loss: 0.7361, test_loss: 0.9571, test_f1: 0.5697
 epoch: 56, train_loss: 0.7617, test_loss: 0.9448, test_f1: 0.5700
 epoch: 57, train_loss: 0.7449, test_loss: 1.1441, test_f1: 0.5300
 epoch: 58, train_loss: 0.7458, test_loss: 0.9464, test_f1: 0.5674
 epoch: 59, train_loss: 0.7441, test_loss: 0.9280, test_f1: 0.5853
 epoch: 60, train_loss: 0.7464, test_loss: 0.9257, test_f1: 0.6037
 epoch: 61, train_loss: 0.7252, test_loss: 0.9606, test_f1: 0.5997
 epoch: 62, train_loss: 0.7309, test_loss: 0.9097, test_f1: 0.5990
 epoch: 63, train_loss: 0.7415, test_loss: 0.9023, test_f1: 0.6105
 epoch: 64, train_loss: 0.7401, test_loss: 0.9277, test_f1: 0.5774
 epoch: 65, train_loss: 0.7304, test_loss: 1.0236, test_f1: 0.5780
 epoch: 66, train_loss: 0.7395, test_loss: 0.9334, test_f1: 0.5665
 epoch: 67, train_loss: 0.7265, test_loss: 0.9445, test_f1: 0.6024
 epoch: 68, train_loss: 0.7291, test_loss: 1.0094, test_f1: 0.5721
 epoch: 69, train_loss: 0.7225, test_loss: 0.9618, test_f1: 0.5756
 epoch: 70, train_loss: 0.7375, test_loss: 0.9124, test_f1: 0.6001
 epoch: 71, train_loss: 0.7278, test_loss: 0.9338, test_f1: 0.5822
 epoch: 72, train_loss: 0.7325, test_loss: 0.9582, test_f1: 0.6019
 epoch: 73, train_loss: 0.7328, test_loss: 0.9444, test_f1: 0.5768
 epoch: 74, train_loss: 0.7347, test_loss: 0.9312, test_f1: 0.5985
 epoch: 75, train_loss: 0.7233, test_loss: 0.9978, test_f1: 0.5677
 epoch: 76, train_loss: 0.7289, test_loss: 0.9512, test_f1: 0.5860
 epoch: 77, train_loss: 0.7093, test_loss: 0.9373, test_f1: 0.5851
 epoch: 78, train_loss: 0.7212, test_loss: 0.9242, test_f1: 0.6127
 epoch: 79, train_loss: 0.7145, test_loss: 0.9049, test_f1: 0.6197
 epoch: 80, train_loss: 0.7293, test_loss: 1.0820, test_f1: 0.5665
 epoch: 81, train_loss: 0.7179, test_loss: 0.8964, test_f1: 0.6366
 epoch: 82, train_loss: 0.7246, test_loss: 0.9241, test_f1: 0.5895
 epoch: 83, train_loss: 0.7283, test_loss: 0.9110, test_f1: 0.6064
 epoch: 84, train_loss: 0.7141, test_loss: 0.9045, test_f1: 0.6295
 epoch: 85, train_loss: 0.7273, test_loss: 0.9496, test_f1: 0.6220
 epoch: 86, train_loss: 0.7055, test_loss: 1.0219, test_f1: 0.5761
 epoch: 87, train_loss: 0.7060, test_loss: 0.9031, test_f1: 0.6147
 epoch: 88, train_loss: 0.7044, test_loss: 0.9601, test_f1: 0.5999
 epoch: 89, train_loss: 0.6899, test_loss: 1.0213, test_f1: 0.5916
 epoch: 90, train_loss: 0.7052, test_loss: 1.0054, test_f1: 0.5950
 epoch: 91, train_loss: 0.7003, test_loss: 1.0156, test_f1: 0.5545
 epoch: 92, train_loss: 0.7188, test_loss: 0.9465, test_f1: 0.5996
 epoch: 93, train_loss: 0.7208, test_loss: 0.9259, test_f1: 0.6143
 epoch: 94, train_loss: 0.7030, test_loss: 0.9826, test_f1: 0.5934
 epoch: 95, train_loss: 0.7048, test_loss: 0.9180, test_f1: 0.6215
 epoch: 96, train_loss: 0.6914, test_loss: 0.9529, test_f1: 0.6210
 epoch: 97, train_loss: 0.7039, test_loss: 0.9526, test_f1: 0.5853
 epoch: 98, train_loss: 0.6947, test_loss: 0.9759, test_f1: 0.5885
 epoch: 99, train_loss: 0.7166, test_loss: 1.0299, test_f1: 0.6052
##################ITERATION #6 ****************************************
 epoch: 0, train_loss: 1.4886, test_loss: 1.3791, test_f1: 0.2270
 epoch: 1, train_loss: 1.2316, test_loss: 1.2674, test_f1: 0.2270
 epoch: 2, train_loss: 1.1863, test_loss: 1.1984, test_f1: 0.2737
 epoch: 3, train_loss: 1.1554, test_loss: 1.0925, test_f1: 0.4258
 epoch: 4, train_loss: 1.1055, test_loss: 1.0623, test_f1: 0.4290
 epoch: 5, train_loss: 1.0730, test_loss: 1.0174, test_f1: 0.4457
 epoch: 6, train_loss: 1.0503, test_loss: 0.9660, test_f1: 0.4818
 epoch: 7, train_loss: 1.0391, test_loss: 0.9621, test_f1: 0.4956
 epoch: 8, train_loss: 1.0113, test_loss: 0.9554, test_f1: 0.4896
 epoch: 9, train_loss: 0.9860, test_loss: 0.9801, test_f1: 0.4737
 epoch: 10, train_loss: 0.9779, test_loss: 0.9186, test_f1: 0.5240
 epoch: 11, train_loss: 0.9664, test_loss: 0.9725, test_f1: 0.4653
 epoch: 12, train_loss: 0.9617, test_loss: 0.9530, test_f1: 0.5156
 epoch: 13, train_loss: 0.9499, test_loss: 0.9410, test_f1: 0.4767
 epoch: 14, train_loss: 0.9447, test_loss: 0.9627, test_f1: 0.5186
 epoch: 15, train_loss: 0.9520, test_loss: 0.9684, test_f1: 0.4888
 epoch: 16, train_loss: 0.9285, test_loss: 0.9323, test_f1: 0.4695
 epoch: 17, train_loss: 0.9248, test_loss: 0.9525, test_f1: 0.4919
 epoch: 18, train_loss: 0.9273, test_loss: 0.9516, test_f1: 0.4665
 epoch: 19, train_loss: 0.9196, test_loss: 0.9297, test_f1: 0.5102
 epoch: 20, train_loss: 0.9179, test_loss: 0.9121, test_f1: 0.5247
 epoch: 21, train_loss: 0.9161, test_loss: 0.9875, test_f1: 0.4870
 epoch: 22, train_loss: 0.9130, test_loss: 0.8837, test_f1: 0.5092
 epoch: 23, train_loss: 0.9011, test_loss: 0.8753, test_f1: 0.5311
 epoch: 24, train_loss: 0.8818, test_loss: 0.9110, test_f1: 0.5102
 epoch: 25, train_loss: 0.8835, test_loss: 0.8604, test_f1: 0.5673
 epoch: 26, train_loss: 0.8829, test_loss: 0.8836, test_f1: 0.5358
 epoch: 27, train_loss: 0.8936, test_loss: 0.9260, test_f1: 0.5064
 epoch: 28, train_loss: 0.8980, test_loss: 0.8935, test_f1: 0.5574
 epoch: 29, train_loss: 0.8829, test_loss: 0.9096, test_f1: 0.5125
 epoch: 30, train_loss: 0.8712, test_loss: 0.8603, test_f1: 0.5671
 epoch: 31, train_loss: 0.8579, test_loss: 0.8602, test_f1: 0.5672
 epoch: 32, train_loss: 0.8611, test_loss: 0.8729, test_f1: 0.5402
 epoch: 33, train_loss: 0.8459, test_loss: 0.8507, test_f1: 0.5434
 epoch: 34, train_loss: 0.8729, test_loss: 0.8711, test_f1: 0.5689
 epoch: 35, train_loss: 0.8724, test_loss: 0.9704, test_f1: 0.4919
 epoch: 36, train_loss: 0.8651, test_loss: 0.9430, test_f1: 0.5391
 epoch: 37, train_loss: 0.8559, test_loss: 0.8736, test_f1: 0.5824
 epoch: 38, train_loss: 0.8555, test_loss: 0.9589, test_f1: 0.4839
 epoch: 39, train_loss: 0.8504, test_loss: 0.9028, test_f1: 0.5039
 epoch: 40, train_loss: 0.8424, test_loss: 0.8646, test_f1: 0.5406
 epoch: 41, train_loss: 0.8431, test_loss: 0.9187, test_f1: 0.5201
 epoch: 42, train_loss: 0.8307, test_loss: 0.8898, test_f1: 0.5546
 epoch: 43, train_loss: 0.8387, test_loss: 0.9228, test_f1: 0.5450
 epoch: 44, train_loss: 0.8481, test_loss: 0.8974, test_f1: 0.5368
 epoch: 45, train_loss: 0.8423, test_loss: 0.9090, test_f1: 0.5309
 epoch: 46, train_loss: 0.8322, test_loss: 0.8715, test_f1: 0.5418
 epoch: 47, train_loss: 0.8200, test_loss: 0.9075, test_f1: 0.5641
 epoch: 48, train_loss: 0.8191, test_loss: 0.8940, test_f1: 0.5559
 epoch: 49, train_loss: 0.8284, test_loss: 0.8528, test_f1: 0.5622
 epoch: 50, train_loss: 0.8120, test_loss: 0.9242, test_f1: 0.5418
 epoch: 51, train_loss: 0.8093, test_loss: 0.8672, test_f1: 0.5475
 epoch: 52, train_loss: 0.8161, test_loss: 0.9084, test_f1: 0.5745
 epoch: 53, train_loss: 0.7963, test_loss: 0.8990, test_f1: 0.5327
 epoch: 54, train_loss: 0.7898, test_loss: 0.8778, test_f1: 0.5654
 epoch: 55, train_loss: 0.7978, test_loss: 0.9051, test_f1: 0.5554
 epoch: 56, train_loss: 0.7717, test_loss: 0.8961, test_f1: 0.5537
 epoch: 57, train_loss: 0.7800, test_loss: 0.8638, test_f1: 0.5518
 epoch: 58, train_loss: 0.7832, test_loss: 0.8962, test_f1: 0.5824
 epoch: 59, train_loss: 0.7863, test_loss: 0.8860, test_f1: 0.5295
 epoch: 60, train_loss: 0.7783, test_loss: 0.8968, test_f1: 0.5605
 epoch: 61, train_loss: 0.7821, test_loss: 0.8871, test_f1: 0.5521
 epoch: 62, train_loss: 0.7682, test_loss: 0.8751, test_f1: 0.5390
 epoch: 63, train_loss: 0.7791, test_loss: 0.8769, test_f1: 0.5540
 epoch: 64, train_loss: 0.7739, test_loss: 0.8867, test_f1: 0.5735
 epoch: 65, train_loss: 0.7581, test_loss: 0.8991, test_f1: 0.5816
 epoch: 66, train_loss: 0.7588, test_loss: 0.8905, test_f1: 0.5635
 epoch: 67, train_loss: 0.7593, test_loss: 0.9043, test_f1: 0.5566
 epoch: 68, train_loss: 0.7679, test_loss: 0.8898, test_f1: 0.5665
 epoch: 69, train_loss: 0.7666, test_loss: 0.9215, test_f1: 0.5373
 epoch: 70, train_loss: 0.7766, test_loss: 0.9028, test_f1: 0.5693
 epoch: 71, train_loss: 0.7522, test_loss: 0.9110, test_f1: 0.5558
 epoch: 72, train_loss: 0.7477, test_loss: 0.8781, test_f1: 0.5583
 epoch: 73, train_loss: 0.7545, test_loss: 0.9088, test_f1: 0.5466
 epoch: 74, train_loss: 0.7517, test_loss: 0.8938, test_f1: 0.5835
 epoch: 75, train_loss: 0.7441, test_loss: 0.8888, test_f1: 0.5677
 epoch: 76, train_loss: 0.7497, test_loss: 0.8940, test_f1: 0.5659
 epoch: 77, train_loss: 0.7381, test_loss: 0.8786, test_f1: 0.5956
 epoch: 78, train_loss: 0.7487, test_loss: 0.9250, test_f1: 0.5675
 epoch: 79, train_loss: 0.7579, test_loss: 0.8603, test_f1: 0.5869
 epoch: 80, train_loss: 0.7416, test_loss: 0.8910, test_f1: 0.5482
 epoch: 81, train_loss: 0.7511, test_loss: 0.8828, test_f1: 0.5751
 epoch: 82, train_loss: 0.7412, test_loss: 0.8601, test_f1: 0.5953
 epoch: 83, train_loss: 0.7402, test_loss: 0.8825, test_f1: 0.5509
 epoch: 84, train_loss: 0.7341, test_loss: 0.8948, test_f1: 0.5541
 epoch: 85, train_loss: 0.7447, test_loss: 0.8993, test_f1: 0.5848
 epoch: 86, train_loss: 0.7573, test_loss: 0.9267, test_f1: 0.5596
 epoch: 87, train_loss: 0.7357, test_loss: 0.8960, test_f1: 0.5803
 epoch: 88, train_loss: 0.7454, test_loss: 0.9171, test_f1: 0.5867
 epoch: 89, train_loss: 0.7394, test_loss: 0.9057, test_f1: 0.5759
 epoch: 90, train_loss: 0.7359, test_loss: 0.8867, test_f1: 0.5621
 epoch: 91, train_loss: 0.7344, test_loss: 0.8604, test_f1: 0.6018
 epoch: 92, train_loss: 0.7280, test_loss: 0.9466, test_f1: 0.5764
 epoch: 93, train_loss: 0.7415, test_loss: 0.9083, test_f1: 0.5540
 epoch: 94, train_loss: 0.7352, test_loss: 0.8765, test_f1: 0.5932
 epoch: 95, train_loss: 0.7269, test_loss: 0.8938, test_f1: 0.5708
 epoch: 96, train_loss: 0.7177, test_loss: 0.8698, test_f1: 0.5723
 epoch: 97, train_loss: 0.7199, test_loss: 0.8686, test_f1: 0.5731
 epoch: 98, train_loss: 0.7260, test_loss: 1.0090, test_f1: 0.5360
 epoch: 99, train_loss: 0.7215, test_loss: 1.0258, test_f1: 0.5180
##################ITERATION #7 ****************************************
 epoch: 0, train_loss: 1.3471, test_loss: 1.6573, test_f1: 0.2270
 epoch: 1, train_loss: 1.1298, test_loss: 1.1747, test_f1: 0.2920
 epoch: 2, train_loss: 1.0664, test_loss: 1.1046, test_f1: 0.3334
 epoch: 3, train_loss: 1.0420, test_loss: 0.9950, test_f1: 0.4618
 epoch: 4, train_loss: 1.0068, test_loss: 1.0066, test_f1: 0.4540
 epoch: 5, train_loss: 0.9914, test_loss: 0.9620, test_f1: 0.4688
 epoch: 6, train_loss: 0.9737, test_loss: 0.9868, test_f1: 0.4453
 epoch: 7, train_loss: 0.9527, test_loss: 1.0135, test_f1: 0.4763
 epoch: 8, train_loss: 0.9524, test_loss: 1.0457, test_f1: 0.4454
 epoch: 9, train_loss: 0.9412, test_loss: 0.9708, test_f1: 0.5276
 epoch: 10, train_loss: 0.9188, test_loss: 0.9728, test_f1: 0.5144
 epoch: 11, train_loss: 0.9205, test_loss: 1.0145, test_f1: 0.4837
 epoch: 12, train_loss: 0.9262, test_loss: 0.9859, test_f1: 0.4834
 epoch: 13, train_loss: 0.9385, test_loss: 0.9479, test_f1: 0.5102
 epoch: 14, train_loss: 0.9187, test_loss: 0.9660, test_f1: 0.4947
 epoch: 15, train_loss: 0.9276, test_loss: 1.1155, test_f1: 0.4782
 epoch: 16, train_loss: 0.9126, test_loss: 0.9641, test_f1: 0.5293
 epoch: 17, train_loss: 0.9043, test_loss: 0.9967, test_f1: 0.4845
 epoch: 18, train_loss: 0.9056, test_loss: 0.9688, test_f1: 0.5222
 epoch: 19, train_loss: 0.9017, test_loss: 0.9632, test_f1: 0.4968
 epoch: 20, train_loss: 0.8998, test_loss: 1.0019, test_f1: 0.5051
 epoch: 21, train_loss: 0.8926, test_loss: 1.1516, test_f1: 0.4405
 epoch: 22, train_loss: 0.9070, test_loss: 1.0003, test_f1: 0.4863
 epoch: 23, train_loss: 0.8989, test_loss: 1.1713, test_f1: 0.4549
 epoch: 24, train_loss: 0.8948, test_loss: 0.9737, test_f1: 0.5185
 epoch: 25, train_loss: 0.8889, test_loss: 0.9507, test_f1: 0.5217
 epoch: 26, train_loss: 0.8881, test_loss: 0.9760, test_f1: 0.5207
 epoch: 27, train_loss: 0.8751, test_loss: 1.0834, test_f1: 0.4511
 epoch: 28, train_loss: 0.8833, test_loss: 0.9809, test_f1: 0.5247
 epoch: 29, train_loss: 0.8587, test_loss: 0.9271, test_f1: 0.5393
 epoch: 30, train_loss: 0.8670, test_loss: 1.0150, test_f1: 0.5277
 epoch: 31, train_loss: 0.8681, test_loss: 1.0272, test_f1: 0.4771
 epoch: 32, train_loss: 0.8648, test_loss: 1.0567, test_f1: 0.4560
 epoch: 33, train_loss: 0.8604, test_loss: 1.0049, test_f1: 0.5159
 epoch: 34, train_loss: 0.8596, test_loss: 0.9727, test_f1: 0.5101
 epoch: 35, train_loss: 0.8533, test_loss: 0.9506, test_f1: 0.5415
 epoch: 36, train_loss: 0.8436, test_loss: 0.9259, test_f1: 0.5440
 epoch: 37, train_loss: 0.8403, test_loss: 1.0406, test_f1: 0.5115
 epoch: 38, train_loss: 0.8436, test_loss: 1.0083, test_f1: 0.4993
 epoch: 39, train_loss: 0.8502, test_loss: 0.9559, test_f1: 0.4932
 epoch: 40, train_loss: 0.8265, test_loss: 0.9503, test_f1: 0.5301
 epoch: 41, train_loss: 0.8466, test_loss: 0.8565, test_f1: 0.5717
 epoch: 42, train_loss: 0.8291, test_loss: 1.0436, test_f1: 0.5081
 epoch: 43, train_loss: 0.8320, test_loss: 0.9662, test_f1: 0.5231
 epoch: 44, train_loss: 0.8236, test_loss: 0.9993, test_f1: 0.5391
 epoch: 45, train_loss: 0.8328, test_loss: 1.0462, test_f1: 0.4831
 epoch: 46, train_loss: 0.8353, test_loss: 0.9798, test_f1: 0.5370
 epoch: 47, train_loss: 0.8298, test_loss: 0.9523, test_f1: 0.5127
 epoch: 48, train_loss: 0.8236, test_loss: 0.9640, test_f1: 0.5183
 epoch: 49, train_loss: 0.8215, test_loss: 0.8987, test_f1: 0.5977
 epoch: 50, train_loss: 0.8134, test_loss: 0.9337, test_f1: 0.5270
 epoch: 51, train_loss: 0.8074, test_loss: 0.9065, test_f1: 0.5422
 epoch: 52, train_loss: 0.8102, test_loss: 0.9167, test_f1: 0.5267
 epoch: 53, train_loss: 0.7979, test_loss: 0.9240, test_f1: 0.5489
 epoch: 54, train_loss: 0.7910, test_loss: 0.8894, test_f1: 0.5512
 epoch: 55, train_loss: 0.7840, test_loss: 0.9304, test_f1: 0.5375
 epoch: 56, train_loss: 0.7740, test_loss: 0.8987, test_f1: 0.5577
 epoch: 57, train_loss: 0.7846, test_loss: 0.8626, test_f1: 0.5662
 epoch: 58, train_loss: 0.7828, test_loss: 0.8961, test_f1: 0.5903
 epoch: 59, train_loss: 0.7816, test_loss: 0.8951, test_f1: 0.5556
 epoch: 60, train_loss: 0.7774, test_loss: 0.9215, test_f1: 0.5635
 epoch: 61, train_loss: 0.7843, test_loss: 0.9584, test_f1: 0.5472
 epoch: 62, train_loss: 0.7699, test_loss: 0.9107, test_f1: 0.5695
 epoch: 63, train_loss: 0.7702, test_loss: 0.8750, test_f1: 0.5663
 epoch: 64, train_loss: 0.7650, test_loss: 0.9246, test_f1: 0.5611
 epoch: 65, train_loss: 0.7691, test_loss: 0.9413, test_f1: 0.5722
 epoch: 66, train_loss: 0.7718, test_loss: 0.9350, test_f1: 0.5435
 epoch: 67, train_loss: 0.7530, test_loss: 0.9589, test_f1: 0.5583
 epoch: 68, train_loss: 0.7527, test_loss: 0.9390, test_f1: 0.5731
 epoch: 69, train_loss: 0.7656, test_loss: 0.9442, test_f1: 0.6004
 epoch: 70, train_loss: 0.7651, test_loss: 0.9122, test_f1: 0.5556
 epoch: 71, train_loss: 0.7509, test_loss: 0.9375, test_f1: 0.5522
 epoch: 72, train_loss: 0.7621, test_loss: 0.9553, test_f1: 0.5573
 epoch: 73, train_loss: 0.7606, test_loss: 0.8913, test_f1: 0.5842
 epoch: 74, train_loss: 0.7572, test_loss: 1.0071, test_f1: 0.5367
 epoch: 75, train_loss: 0.7513, test_loss: 0.9676, test_f1: 0.5500
 epoch: 76, train_loss: 0.7580, test_loss: 0.9192, test_f1: 0.6129
 epoch: 77, train_loss: 0.7567, test_loss: 0.9394, test_f1: 0.5798
 epoch: 78, train_loss: 0.7494, test_loss: 0.9169, test_f1: 0.5679
 epoch: 79, train_loss: 0.7330, test_loss: 0.8772, test_f1: 0.5888
 epoch: 80, train_loss: 0.7615, test_loss: 0.8672, test_f1: 0.6131
 epoch: 81, train_loss: 0.7585, test_loss: 0.9349, test_f1: 0.5726
 epoch: 82, train_loss: 0.7419, test_loss: 0.9538, test_f1: 0.5713
 epoch: 83, train_loss: 0.7413, test_loss: 0.9518, test_f1: 0.5959
 epoch: 84, train_loss: 0.7425, test_loss: 0.9612, test_f1: 0.5686
 epoch: 85, train_loss: 0.7456, test_loss: 0.8989, test_f1: 0.5843
 epoch: 86, train_loss: 0.7435, test_loss: 0.8962, test_f1: 0.5934
 epoch: 87, train_loss: 0.7401, test_loss: 0.9094, test_f1: 0.5957
 epoch: 88, train_loss: 0.7298, test_loss: 0.8652, test_f1: 0.6052
 epoch: 89, train_loss: 0.7443, test_loss: 0.8826, test_f1: 0.5985
 epoch: 90, train_loss: 0.7448, test_loss: 0.9090, test_f1: 0.5889
 epoch: 91, train_loss: 0.7452, test_loss: 0.9120, test_f1: 0.5733
 epoch: 92, train_loss: 0.7171, test_loss: 0.8797, test_f1: 0.6247
 epoch: 93, train_loss: 0.7238, test_loss: 1.0735, test_f1: 0.5169
 epoch: 94, train_loss: 0.7419, test_loss: 0.9819, test_f1: 0.5850
 epoch: 95, train_loss: 0.7393, test_loss: 0.9228, test_f1: 0.5784
 epoch: 96, train_loss: 0.7410, test_loss: 0.9130, test_f1: 0.6034
 epoch: 97, train_loss: 0.7406, test_loss: 0.8909, test_f1: 0.5913
 epoch: 98, train_loss: 0.7389, test_loss: 0.9297, test_f1: 0.5777
 epoch: 99, train_loss: 0.7407, test_loss: 0.8759, test_f1: 0.5959
##################ITERATION #8 ****************************************
 epoch: 0, train_loss: 1.2931, test_loss: 1.4118, test_f1: 0.2270
 epoch: 1, train_loss: 1.1075, test_loss: 1.1679, test_f1: 0.3171
 epoch: 2, train_loss: 1.0834, test_loss: 1.0611, test_f1: 0.3655
 epoch: 3, train_loss: 1.0553, test_loss: 1.0839, test_f1: 0.3559
 epoch: 4, train_loss: 1.0412, test_loss: 1.0653, test_f1: 0.3627
 epoch: 5, train_loss: 1.0196, test_loss: 1.0642, test_f1: 0.3645
 epoch: 6, train_loss: 1.0270, test_loss: 1.0976, test_f1: 0.3557
 epoch: 7, train_loss: 1.0206, test_loss: 1.0879, test_f1: 0.3660
 epoch: 8, train_loss: 1.0096, test_loss: 1.0917, test_f1: 0.4439
 epoch: 9, train_loss: 0.9899, test_loss: 1.0366, test_f1: 0.4792
 epoch: 10, train_loss: 0.9800, test_loss: 1.0392, test_f1: 0.4632
 epoch: 11, train_loss: 0.9690, test_loss: 1.0222, test_f1: 0.4862
 epoch: 12, train_loss: 0.9528, test_loss: 1.0470, test_f1: 0.5059
 epoch: 13, train_loss: 0.9430, test_loss: 1.0449, test_f1: 0.4884
 epoch: 14, train_loss: 0.9390, test_loss: 1.0127, test_f1: 0.4959
 epoch: 15, train_loss: 0.9460, test_loss: 0.9308, test_f1: 0.4891
 epoch: 16, train_loss: 0.9259, test_loss: 1.0346, test_f1: 0.4762
 epoch: 17, train_loss: 0.9233, test_loss: 0.9966, test_f1: 0.4964
 epoch: 18, train_loss: 0.9191, test_loss: 1.0468, test_f1: 0.4974
 epoch: 19, train_loss: 0.9074, test_loss: 1.2648, test_f1: 0.3776
 epoch: 20, train_loss: 0.9119, test_loss: 0.9111, test_f1: 0.5182
 epoch: 21, train_loss: 0.9036, test_loss: 1.0618, test_f1: 0.4844
 epoch: 22, train_loss: 0.8936, test_loss: 1.0005, test_f1: 0.5067
 epoch: 23, train_loss: 0.9427, test_loss: 1.7555, test_f1: 0.3193
 epoch: 24, train_loss: 0.9448, test_loss: 1.0935, test_f1: 0.4041
 epoch: 25, train_loss: 0.9309, test_loss: 1.0066, test_f1: 0.4747
 epoch: 26, train_loss: 0.8983, test_loss: 1.0348, test_f1: 0.4945
 epoch: 27, train_loss: 0.8768, test_loss: 1.0195, test_f1: 0.5268
 epoch: 28, train_loss: 0.8899, test_loss: 0.9982, test_f1: 0.5173
 epoch: 29, train_loss: 0.8895, test_loss: 0.9783, test_f1: 0.5376
 epoch: 30, train_loss: 0.8744, test_loss: 1.0211, test_f1: 0.5703
 epoch: 31, train_loss: 0.9001, test_loss: 1.2543, test_f1: 0.4382
 epoch: 32, train_loss: 0.9002, test_loss: 1.2200, test_f1: 0.4312
 epoch: 33, train_loss: 0.8800, test_loss: 1.0188, test_f1: 0.4716
 epoch: 34, train_loss: 0.8936, test_loss: 0.9602, test_f1: 0.5280
 epoch: 35, train_loss: 0.8658, test_loss: 0.9161, test_f1: 0.5565
 epoch: 36, train_loss: 0.8669, test_loss: 1.0253, test_f1: 0.5008
 epoch: 37, train_loss: 0.8606, test_loss: 0.9965, test_f1: 0.5179
 epoch: 38, train_loss: 0.8565, test_loss: 0.9844, test_f1: 0.5194
 epoch: 39, train_loss: 0.8535, test_loss: 0.9129, test_f1: 0.5399
 epoch: 40, train_loss: 0.8516, test_loss: 1.0635, test_f1: 0.5041
 epoch: 41, train_loss: 0.8419, test_loss: 1.0416, test_f1: 0.5082
 epoch: 42, train_loss: 0.8419, test_loss: 1.0034, test_f1: 0.5289
 epoch: 43, train_loss: 0.8382, test_loss: 0.9133, test_f1: 0.5840
 epoch: 44, train_loss: 0.8455, test_loss: 0.9713, test_f1: 0.5093
 epoch: 45, train_loss: 0.8579, test_loss: 0.9913, test_f1: 0.4785
 epoch: 46, train_loss: 0.8469, test_loss: 1.1629, test_f1: 0.4789
 epoch: 47, train_loss: 0.8283, test_loss: 1.1766, test_f1: 0.4705
 epoch: 48, train_loss: 0.8274, test_loss: 0.9555, test_f1: 0.5571
 epoch: 49, train_loss: 0.8154, test_loss: 0.9494, test_f1: 0.5491
 epoch: 50, train_loss: 0.8229, test_loss: 1.0041, test_f1: 0.5155
 epoch: 51, train_loss: 0.7951, test_loss: 0.9418, test_f1: 0.5369
 epoch: 52, train_loss: 0.7837, test_loss: 0.8519, test_f1: 0.6000
 epoch: 53, train_loss: 0.8000, test_loss: 0.9342, test_f1: 0.5846
 epoch: 54, train_loss: 0.7865, test_loss: 0.9022, test_f1: 0.5469
 epoch: 55, train_loss: 0.7826, test_loss: 0.9576, test_f1: 0.5483
 epoch: 56, train_loss: 0.7710, test_loss: 0.8884, test_f1: 0.5876
 epoch: 57, train_loss: 0.7787, test_loss: 0.8988, test_f1: 0.5770
 epoch: 58, train_loss: 0.7743, test_loss: 0.9251, test_f1: 0.5779
 epoch: 59, train_loss: 0.7801, test_loss: 0.8782, test_f1: 0.5759
 epoch: 60, train_loss: 0.7804, test_loss: 0.9107, test_f1: 0.5775
 epoch: 61, train_loss: 0.7567, test_loss: 0.9103, test_f1: 0.5829
 epoch: 62, train_loss: 0.7768, test_loss: 0.9157, test_f1: 0.6191
 epoch: 63, train_loss: 0.7794, test_loss: 0.9017, test_f1: 0.5779
 epoch: 64, train_loss: 0.7601, test_loss: 0.8975, test_f1: 0.5802
 epoch: 65, train_loss: 0.7671, test_loss: 0.9058, test_f1: 0.5768
 epoch: 66, train_loss: 0.7669, test_loss: 0.9664, test_f1: 0.5882
 epoch: 67, train_loss: 0.7767, test_loss: 0.9113, test_f1: 0.5326
 epoch: 68, train_loss: 0.7662, test_loss: 0.9071, test_f1: 0.5692
 epoch: 69, train_loss: 0.7631, test_loss: 0.9856, test_f1: 0.5595
 epoch: 70, train_loss: 0.7557, test_loss: 0.9385, test_f1: 0.5655
 epoch: 71, train_loss: 0.7584, test_loss: 0.8974, test_f1: 0.6121
 epoch: 72, train_loss: 0.7443, test_loss: 0.9100, test_f1: 0.5679
 epoch: 73, train_loss: 0.7662, test_loss: 0.9383, test_f1: 0.5785
 epoch: 74, train_loss: 0.7500, test_loss: 0.8873, test_f1: 0.5967
 epoch: 75, train_loss: 0.7564, test_loss: 0.9220, test_f1: 0.5635
 epoch: 76, train_loss: 0.7451, test_loss: 0.9080, test_f1: 0.6048
 epoch: 77, train_loss: 0.7585, test_loss: 0.8994, test_f1: 0.5830
 epoch: 78, train_loss: 0.7358, test_loss: 0.8904, test_f1: 0.5925
 epoch: 79, train_loss: 0.7383, test_loss: 0.9146, test_f1: 0.6125
 epoch: 80, train_loss: 0.7539, test_loss: 0.9360, test_f1: 0.5983
 epoch: 81, train_loss: 0.7401, test_loss: 0.8711, test_f1: 0.5990
 epoch: 82, train_loss: 0.7368, test_loss: 0.9045, test_f1: 0.5875
 epoch: 83, train_loss: 0.7338, test_loss: 0.9745, test_f1: 0.5797
 epoch: 84, train_loss: 0.7441, test_loss: 0.9621, test_f1: 0.5445
 epoch: 85, train_loss: 0.7473, test_loss: 0.8725, test_f1: 0.6031
 epoch: 86, train_loss: 0.7506, test_loss: 0.8592, test_f1: 0.6111
 epoch: 87, train_loss: 0.7310, test_loss: 0.8875, test_f1: 0.5962
 epoch: 88, train_loss: 0.7401, test_loss: 0.9206, test_f1: 0.5689
 epoch: 89, train_loss: 0.7656, test_loss: 0.8544, test_f1: 0.6153
 epoch: 90, train_loss: 0.7525, test_loss: 0.9219, test_f1: 0.5749
 epoch: 91, train_loss: 0.7433, test_loss: 0.8919, test_f1: 0.5771
 epoch: 92, train_loss: 0.7587, test_loss: 0.9142, test_f1: 0.5679
 epoch: 93, train_loss: 0.7345, test_loss: 0.8756, test_f1: 0.5698
 epoch: 94, train_loss: 0.7259, test_loss: 0.8756, test_f1: 0.5700
 epoch: 95, train_loss: 0.7314, test_loss: 0.8895, test_f1: 0.6069
 epoch: 96, train_loss: 0.7565, test_loss: 0.9049, test_f1: 0.5853
 epoch: 97, train_loss: 0.7338, test_loss: 0.9952, test_f1: 0.5473
 epoch: 98, train_loss: 0.7408, test_loss: 0.8689, test_f1: 0.5640
 epoch: 99, train_loss: 0.7362, test_loss: 1.0030, test_f1: 0.5632
##################ITERATION #9 ****************************************
 epoch: 0, train_loss: 1.3119, test_loss: 1.2949, test_f1: 0.2270
 epoch: 1, train_loss: 1.1294, test_loss: 1.1925, test_f1: 0.2275
 epoch: 2, train_loss: 1.0616, test_loss: 1.0672, test_f1: 0.3685
 epoch: 3, train_loss: 1.0383, test_loss: 1.0330, test_f1: 0.4049
 epoch: 4, train_loss: 1.0141, test_loss: 1.0881, test_f1: 0.3971
 epoch: 5, train_loss: 0.9872, test_loss: 1.0812, test_f1: 0.4395
 epoch: 6, train_loss: 0.9864, test_loss: 1.0267, test_f1: 0.4640
 epoch: 7, train_loss: 0.9729, test_loss: 1.0232, test_f1: 0.4544
 epoch: 8, train_loss: 0.9629, test_loss: 1.0361, test_f1: 0.4362
 epoch: 9, train_loss: 0.9635, test_loss: 0.9865, test_f1: 0.4984
 epoch: 10, train_loss: 0.9455, test_loss: 1.0039, test_f1: 0.4764
 epoch: 11, train_loss: 0.9402, test_loss: 0.9724, test_f1: 0.5062
 epoch: 12, train_loss: 0.9314, test_loss: 0.9918, test_f1: 0.4907
 epoch: 13, train_loss: 0.9104, test_loss: 0.9703, test_f1: 0.4924
 epoch: 14, train_loss: 0.9286, test_loss: 0.9878, test_f1: 0.5329
 epoch: 15, train_loss: 0.9264, test_loss: 0.9620, test_f1: 0.5104
 epoch: 16, train_loss: 0.9185, test_loss: 0.9793, test_f1: 0.4938
 epoch: 17, train_loss: 0.9122, test_loss: 0.9852, test_f1: 0.5247
 epoch: 18, train_loss: 0.9082, test_loss: 1.0100, test_f1: 0.5049
 epoch: 19, train_loss: 0.8998, test_loss: 1.1848, test_f1: 0.3920
 epoch: 20, train_loss: 0.8992, test_loss: 0.9899, test_f1: 0.5049
 epoch: 21, train_loss: 0.8831, test_loss: 1.0197, test_f1: 0.5097
 epoch: 22, train_loss: 0.8882, test_loss: 1.0217, test_f1: 0.5156
 epoch: 23, train_loss: 0.8924, test_loss: 0.9879, test_f1: 0.5008
 epoch: 24, train_loss: 0.8833, test_loss: 0.9836, test_f1: 0.5454
 epoch: 25, train_loss: 0.8892, test_loss: 1.0936, test_f1: 0.4726
 epoch: 26, train_loss: 0.8884, test_loss: 1.0197, test_f1: 0.4950
 epoch: 27, train_loss: 0.8782, test_loss: 0.9875, test_f1: 0.5159
 epoch: 28, train_loss: 0.8688, test_loss: 1.0017, test_f1: 0.5456
 epoch: 29, train_loss: 0.8650, test_loss: 0.9851, test_f1: 0.5240
 epoch: 30, train_loss: 0.8659, test_loss: 1.0649, test_f1: 0.5039
 epoch: 31, train_loss: 0.8643, test_loss: 0.9750, test_f1: 0.5374
 epoch: 32, train_loss: 0.8671, test_loss: 1.0049, test_f1: 0.5118
 epoch: 33, train_loss: 0.8613, test_loss: 1.0582, test_f1: 0.5049
 epoch: 34, train_loss: 0.8462, test_loss: 0.9742, test_f1: 0.5419
 epoch: 35, train_loss: 0.8425, test_loss: 0.9953, test_f1: 0.5335
 epoch: 36, train_loss: 0.8390, test_loss: 1.0168, test_f1: 0.5250
 epoch: 37, train_loss: 0.8546, test_loss: 0.9759, test_f1: 0.5205
 epoch: 38, train_loss: 0.8462, test_loss: 0.9892, test_f1: 0.5305
 epoch: 39, train_loss: 0.8394, test_loss: 0.9929, test_f1: 0.5584
 epoch: 40, train_loss: 0.8501, test_loss: 0.9801, test_f1: 0.5184
 epoch: 41, train_loss: 0.8365, test_loss: 1.0067, test_f1: 0.4821
 epoch: 42, train_loss: 0.8324, test_loss: 0.9829, test_f1: 0.5456
 epoch: 43, train_loss: 0.8288, test_loss: 0.9739, test_f1: 0.5108
 epoch: 44, train_loss: 0.8287, test_loss: 0.9740, test_f1: 0.5215
 epoch: 45, train_loss: 0.8261, test_loss: 0.9982, test_f1: 0.5265
 epoch: 46, train_loss: 0.8419, test_loss: 0.9929, test_f1: 0.5464
 epoch: 47, train_loss: 0.8362, test_loss: 0.9652, test_f1: 0.5325
 epoch: 48, train_loss: 0.8296, test_loss: 0.9751, test_f1: 0.5378
 epoch: 49, train_loss: 0.8333, test_loss: 0.9829, test_f1: 0.5499
 epoch: 50, train_loss: 0.8210, test_loss: 0.9586, test_f1: 0.5316
 epoch: 51, train_loss: 0.7984, test_loss: 0.9484, test_f1: 0.5469
 epoch: 52, train_loss: 0.7931, test_loss: 0.9703, test_f1: 0.5473
 epoch: 53, train_loss: 0.7879, test_loss: 0.9615, test_f1: 0.5371
 epoch: 54, train_loss: 0.7972, test_loss: 0.9479, test_f1: 0.5383
 epoch: 55, train_loss: 0.7978, test_loss: 0.9498, test_f1: 0.5649
 epoch: 56, train_loss: 0.7819, test_loss: 0.9515, test_f1: 0.5279
 epoch: 57, train_loss: 0.7862, test_loss: 0.9419, test_f1: 0.5391
 epoch: 58, train_loss: 0.7738, test_loss: 0.9704, test_f1: 0.5313
 epoch: 59, train_loss: 0.7674, test_loss: 0.9507, test_f1: 0.5387
 epoch: 60, train_loss: 0.7698, test_loss: 0.9329, test_f1: 0.5602
 epoch: 61, train_loss: 0.7739, test_loss: 0.9596, test_f1: 0.5574
 epoch: 62, train_loss: 0.7744, test_loss: 0.9618, test_f1: 0.5331
 epoch: 63, train_loss: 0.7658, test_loss: 0.9637, test_f1: 0.5488
 epoch: 64, train_loss: 0.7619, test_loss: 0.9940, test_f1: 0.5405
 epoch: 65, train_loss: 0.7726, test_loss: 0.9834, test_f1: 0.5335
 epoch: 66, train_loss: 0.7700, test_loss: 0.9252, test_f1: 0.5635
 epoch: 67, train_loss: 0.7750, test_loss: 0.9648, test_f1: 0.5306
 epoch: 68, train_loss: 0.7774, test_loss: 0.9680, test_f1: 0.5348
 epoch: 69, train_loss: 0.7741, test_loss: 0.9495, test_f1: 0.5585
 epoch: 70, train_loss: 0.7532, test_loss: 0.9183, test_f1: 0.5489
 epoch: 71, train_loss: 0.7522, test_loss: 0.9163, test_f1: 0.5776
 epoch: 72, train_loss: 0.7531, test_loss: 0.9445, test_f1: 0.5562
 epoch: 73, train_loss: 0.7590, test_loss: 0.9501, test_f1: 0.5530
 epoch: 74, train_loss: 0.7531, test_loss: 0.9966, test_f1: 0.5271
 epoch: 75, train_loss: 0.7746, test_loss: 0.9336, test_f1: 0.5543
 epoch: 76, train_loss: 0.7646, test_loss: 0.9185, test_f1: 0.5538
 epoch: 77, train_loss: 0.7539, test_loss: 0.9486, test_f1: 0.5663
 epoch: 78, train_loss: 0.7427, test_loss: 0.9308, test_f1: 0.5806
 epoch: 79, train_loss: 0.7436, test_loss: 0.9549, test_f1: 0.5653
 epoch: 80, train_loss: 0.7611, test_loss: 0.9413, test_f1: 0.5443
 epoch: 81, train_loss: 0.7513, test_loss: 0.9508, test_f1: 0.5439
 epoch: 82, train_loss: 0.7442, test_loss: 0.9536, test_f1: 0.5728
 epoch: 83, train_loss: 0.7523, test_loss: 0.9427, test_f1: 0.5742
 epoch: 84, train_loss: 0.7328, test_loss: 0.9808, test_f1: 0.5364
 epoch: 85, train_loss: 0.7474, test_loss: 0.9352, test_f1: 0.5630
 epoch: 86, train_loss: 0.7501, test_loss: 0.9534, test_f1: 0.5499
 epoch: 87, train_loss: 0.7448, test_loss: 0.9645, test_f1: 0.5663
 epoch: 88, train_loss: 0.7350, test_loss: 0.9419, test_f1: 0.5954
 epoch: 89, train_loss: 0.7488, test_loss: 0.9155, test_f1: 0.5782
 epoch: 90, train_loss: 0.7295, test_loss: 0.9525, test_f1: 0.5751
 epoch: 91, train_loss: 0.7384, test_loss: 0.9921, test_f1: 0.5411
 epoch: 92, train_loss: 0.7401, test_loss: 0.9560, test_f1: 0.5603
 epoch: 93, train_loss: 0.7212, test_loss: 0.9363, test_f1: 0.5767
 epoch: 94, train_loss: 0.7256, test_loss: 0.9083, test_f1: 0.5606
 epoch: 95, train_loss: 0.7301, test_loss: 0.9395, test_f1: 0.6179
 epoch: 96, train_loss: 0.7409, test_loss: 0.9840, test_f1: 0.5773
 epoch: 97, train_loss: 0.7132, test_loss: 0.9615, test_f1: 0.5713
 epoch: 98, train_loss: 0.7243, test_loss: 0.9964, test_f1: 0.5424
 epoch: 99, train_loss: 0.7353, test_loss: 0.9775, test_f1: 0.5630

Training completed in 385.43 seconds
Best F1: 0.6366 at epoch 81
Mean F1 across iterations: 0.6130  0.0127
========================FINAL RESULTS================================
FEGIN weighted F1: 0.6366  0.0127
python main.py --data ltspice_examples --representation component_net --model FEGIN --layers 3 --hiddens 16 --batch_size 256 --lr 0.01 --emb_size 250 --epochs 100 --save_appendix component_net_L3_H16_BS256_LR0.01_E250 --no_val
-----



STDERR:
  File "main.py", line 370, in <module>
    main()
  File "main.py", line 254, in main
    dataset = dataset_class(
  File "/home/philip/projects/ltspice_examples_code_repo/Circuit-Completion-Using-GNNs/component_classification_with_link_prediction_head/evaluation/FEGIN/kernel/circuit_datasets.py", line 15, in __init__
    self.data, self.slices = torch.load(self.processed_paths[0])
  File "/home/philip/.local/lib/python3.8/site-packages/torch/serialization.py", line 1040, in load
    warnings.warn(
  File "/usr/lib/python3.8/warnings.py", line 109, in _showwarnmsg
    sw(msg.message, msg.category, msg.filename, msg.lineno,
  File "main.py", line 47, in warn_with_traceback
    traceback.print_stack(file=log)
/home/philip/projects/ltspice_examples_code_repo/Circuit-Completion-Using-GNNs/component_classification_with_link_prediction_head/evaluation/FEGIN/kernel/circuit_datasets.py:15: FutureWarning: You are using `torch.load` with `weights_only=False` (the current default value), which uses the default pickle module implicitly. It is possible to construct malicious pickle data which will execute arbitrary code during unpickling (See https://github.com/pytorch/pytorch/blob/main/SECURITY.md#untrusted-models for more details). In a future release, the default value for `weights_only` will be flipped to `True`. This limits the functions that could be executed during unpickling. Arbitrary objects will no longer be allowed to be loaded via this mode unless they are explicitly allowlisted by the user via `torch.serialization.add_safe_globals`. We recommend you start setting `weights_only=True` for any use case where you don't have full control of the loaded file. Please open an issue on GitHub for any issues related to this experimental feature.
  self.data, self.slices = torch.load(self.processed_paths[0])
