STDOUT:
Results will be saved in /home/philip/projects/ltspice_examples_code_repo/Circuit-Completion-Using-GNNs/component_classification_with_link_prediction_head/evaluation/FEGIN/results/model_FEGIN_dataset_ltspice_demos
Command line input: python main.py --data ltspice_demos --representation component_pin_net --model FEGIN --layers 4 --hiddens 128 --batch_size 32 --lr 0.0001 --emb_size 512 --epochs 100 --save_appendix component_pin_net_L4_H128_BS32_LR0.0001_E512 --no_val
 is saved.
-----
ltspice_demos - FEGIN
Using 4 layers, 128 hidden units, h = 2
Loading component_pin_net representation dataset
ENTERED
Training FEGIN on component_pin_net representation
Train: 1565, Test: 383
##################ITERATION #0 ****************************************
 epoch: 0, train_loss: 1.3515, test_loss: 1.3433, test_f1: 0.1382
 epoch: 1, train_loss: 1.2672, test_loss: 1.2653, test_f1: 0.3349
 epoch: 2, train_loss: 1.1843, test_loss: 1.2081, test_f1: 0.3586
 epoch: 3, train_loss: 1.1297, test_loss: 1.1889, test_f1: 0.4386
 epoch: 4, train_loss: 1.0985, test_loss: 1.1614, test_f1: 0.4426
 epoch: 5, train_loss: 1.0605, test_loss: 1.1330, test_f1: 0.4441
 epoch: 6, train_loss: 1.0298, test_loss: 1.1011, test_f1: 0.4467
 epoch: 7, train_loss: 0.9995, test_loss: 1.0928, test_f1: 0.4600
 epoch: 8, train_loss: 0.9828, test_loss: 1.0840, test_f1: 0.4608
 epoch: 9, train_loss: 0.9759, test_loss: 1.0782, test_f1: 0.4811
 epoch: 10, train_loss: 0.9659, test_loss: 1.0855, test_f1: 0.4662
 epoch: 11, train_loss: 0.9505, test_loss: 1.0583, test_f1: 0.5233
 epoch: 12, train_loss: 0.9467, test_loss: 1.0656, test_f1: 0.5178
 epoch: 13, train_loss: 0.9390, test_loss: 1.0866, test_f1: 0.5282
 epoch: 14, train_loss: 0.9320, test_loss: 1.0673, test_f1: 0.5346
 epoch: 15, train_loss: 0.9245, test_loss: 1.0561, test_f1: 0.5497
 epoch: 16, train_loss: 0.9146, test_loss: 1.0307, test_f1: 0.5573
 epoch: 17, train_loss: 0.9042, test_loss: 1.0522, test_f1: 0.5540
 epoch: 18, train_loss: 0.8967, test_loss: 1.0514, test_f1: 0.5374
 epoch: 19, train_loss: 0.8862, test_loss: 1.0425, test_f1: 0.5740
 epoch: 20, train_loss: 0.8757, test_loss: 1.0534, test_f1: 0.5369
 epoch: 21, train_loss: 0.8665, test_loss: 1.0263, test_f1: 0.5349
 epoch: 22, train_loss: 0.8527, test_loss: 1.0729, test_f1: 0.5448
 epoch: 23, train_loss: 0.8330, test_loss: 1.0801, test_f1: 0.5436
 epoch: 24, train_loss: 0.8231, test_loss: 1.0706, test_f1: 0.5313
 epoch: 25, train_loss: 0.8283, test_loss: 1.0500, test_f1: 0.5715
 epoch: 26, train_loss: 0.8005, test_loss: 1.0312, test_f1: 0.5680
 epoch: 27, train_loss: 0.7992, test_loss: 1.0360, test_f1: 0.5489
 epoch: 28, train_loss: 0.7874, test_loss: 0.9716, test_f1: 0.5781
 epoch: 29, train_loss: 0.7652, test_loss: 1.0101, test_f1: 0.5734
 epoch: 30, train_loss: 0.7394, test_loss: 1.0319, test_f1: 0.5815
 epoch: 31, train_loss: 0.7299, test_loss: 1.0625, test_f1: 0.5516
 epoch: 32, train_loss: 0.7244, test_loss: 1.0812, test_f1: 0.5376
 epoch: 33, train_loss: 0.7243, test_loss: 1.0369, test_f1: 0.5793
 epoch: 34, train_loss: 0.7041, test_loss: 1.0241, test_f1: 0.5714
 epoch: 35, train_loss: 0.6787, test_loss: 1.0798, test_f1: 0.5926
 epoch: 36, train_loss: 0.6816, test_loss: 1.0481, test_f1: 0.5784
 epoch: 37, train_loss: 0.6647, test_loss: 0.9996, test_f1: 0.5923
 epoch: 38, train_loss: 0.6629, test_loss: 1.1231, test_f1: 0.6143
 epoch: 39, train_loss: 0.6282, test_loss: 1.0758, test_f1: 0.5864
 epoch: 40, train_loss: 0.6415, test_loss: 1.0489, test_f1: 0.5893
 epoch: 41, train_loss: 0.6325, test_loss: 1.0917, test_f1: 0.5865
 epoch: 42, train_loss: 0.6130, test_loss: 1.0433, test_f1: 0.6094
 epoch: 43, train_loss: 0.5946, test_loss: 1.0641, test_f1: 0.6227
 epoch: 44, train_loss: 0.5947, test_loss: 1.0858, test_f1: 0.6094
 epoch: 45, train_loss: 0.5855, test_loss: 1.1666, test_f1: 0.5931
 epoch: 46, train_loss: 0.5861, test_loss: 1.0822, test_f1: 0.6142
 epoch: 47, train_loss: 0.5715, test_loss: 1.0774, test_f1: 0.6079
 epoch: 48, train_loss: 0.5712, test_loss: 1.0963, test_f1: 0.6176
 epoch: 49, train_loss: 0.5514, test_loss: 1.1455, test_f1: 0.6106
 epoch: 50, train_loss: 0.5306, test_loss: 1.0906, test_f1: 0.6162
 epoch: 51, train_loss: 0.5128, test_loss: 1.1074, test_f1: 0.6370
 epoch: 52, train_loss: 0.5144, test_loss: 1.1441, test_f1: 0.6120
 epoch: 53, train_loss: 0.5154, test_loss: 1.1128, test_f1: 0.6118
 epoch: 54, train_loss: 0.5186, test_loss: 1.1522, test_f1: 0.6256
 epoch: 55, train_loss: 0.4938, test_loss: 1.1615, test_f1: 0.6228
 epoch: 56, train_loss: 0.4968, test_loss: 1.1680, test_f1: 0.6359
 epoch: 57, train_loss: 0.4862, test_loss: 1.1724, test_f1: 0.6108
 epoch: 58, train_loss: 0.4804, test_loss: 1.1465, test_f1: 0.6425
 epoch: 59, train_loss: 0.4787, test_loss: 1.1789, test_f1: 0.6200
 epoch: 60, train_loss: 0.4675, test_loss: 1.1797, test_f1: 0.6078
 epoch: 61, train_loss: 0.4531, test_loss: 1.1997, test_f1: 0.6358
 epoch: 62, train_loss: 0.4775, test_loss: 1.1867, test_f1: 0.6209
 epoch: 63, train_loss: 0.4512, test_loss: 1.2415, test_f1: 0.6189
 epoch: 64, train_loss: 0.4439, test_loss: 1.2080, test_f1: 0.6144
 epoch: 65, train_loss: 0.4489, test_loss: 1.2541, test_f1: 0.6217
 epoch: 66, train_loss: 0.4605, test_loss: 1.2257, test_f1: 0.6233
 epoch: 67, train_loss: 0.4392, test_loss: 1.2484, test_f1: 0.6104
 epoch: 68, train_loss: 0.4416, test_loss: 1.2409, test_f1: 0.6228
 epoch: 69, train_loss: 0.4270, test_loss: 1.2546, test_f1: 0.6158
 epoch: 70, train_loss: 0.4461, test_loss: 1.3062, test_f1: 0.6111
 epoch: 71, train_loss: 0.4329, test_loss: 1.2836, test_f1: 0.6185
 epoch: 72, train_loss: 0.4172, test_loss: 1.3341, test_f1: 0.6113
 epoch: 73, train_loss: 0.4049, test_loss: 1.3242, test_f1: 0.5926
 epoch: 74, train_loss: 0.4084, test_loss: 1.3125, test_f1: 0.6306
 epoch: 75, train_loss: 0.4494, test_loss: 1.3373, test_f1: 0.6180
 epoch: 76, train_loss: 0.4145, test_loss: 1.3151, test_f1: 0.6163
 epoch: 77, train_loss: 0.3873, test_loss: 1.3337, test_f1: 0.6166
 epoch: 78, train_loss: 0.3986, test_loss: 1.3186, test_f1: 0.6151
 epoch: 79, train_loss: 0.3903, test_loss: 1.3557, test_f1: 0.6209
 epoch: 80, train_loss: 0.3858, test_loss: 1.3661, test_f1: 0.6316
 epoch: 81, train_loss: 0.3900, test_loss: 1.3935, test_f1: 0.6276
 epoch: 82, train_loss: 0.3965, test_loss: 1.3713, test_f1: 0.6225
 epoch: 83, train_loss: 0.3777, test_loss: 1.5062, test_f1: 0.6076
 epoch: 84, train_loss: 0.3694, test_loss: 1.4426, test_f1: 0.6056
 epoch: 85, train_loss: 0.3686, test_loss: 1.5014, test_f1: 0.6034
 epoch: 86, train_loss: 0.3706, test_loss: 1.4810, test_f1: 0.6206
 epoch: 87, train_loss: 0.3757, test_loss: 1.4507, test_f1: 0.6189
 epoch: 88, train_loss: 0.3596, test_loss: 1.4503, test_f1: 0.6343
 epoch: 89, train_loss: 0.3460, test_loss: 1.4120, test_f1: 0.6279
 epoch: 90, train_loss: 0.3518, test_loss: 1.5696, test_f1: 0.6045
 epoch: 91, train_loss: 0.3558, test_loss: 1.5079, test_f1: 0.6011
 epoch: 92, train_loss: 0.3410, test_loss: 1.5001, test_f1: 0.6315
 epoch: 93, train_loss: 0.3552, test_loss: 1.5111, test_f1: 0.6382
 epoch: 94, train_loss: 0.3357, test_loss: 1.5352, test_f1: 0.6134
 epoch: 95, train_loss: 0.3178, test_loss: 1.5356, test_f1: 0.6188
 epoch: 96, train_loss: 0.3336, test_loss: 1.5132, test_f1: 0.6361
 epoch: 97, train_loss: 0.3211, test_loss: 1.6073, test_f1: 0.6062
 epoch: 98, train_loss: 0.3246, test_loss: 1.4950, test_f1: 0.6259
 epoch: 99, train_loss: 0.3252, test_loss: 1.6177, test_f1: 0.6103
##################ITERATION #1 ****************************************
 epoch: 0, train_loss: 1.2371, test_loss: 1.2757, test_f1: 0.3348
 epoch: 1, train_loss: 1.1047, test_loss: 1.1515, test_f1: 0.4379
 epoch: 2, train_loss: 1.0504, test_loss: 1.1021, test_f1: 0.4784
 epoch: 3, train_loss: 1.0086, test_loss: 1.0756, test_f1: 0.5091
 epoch: 4, train_loss: 0.9860, test_loss: 1.0562, test_f1: 0.4971
 epoch: 5, train_loss: 0.9686, test_loss: 1.0379, test_f1: 0.5375
 epoch: 6, train_loss: 0.9428, test_loss: 1.0311, test_f1: 0.5545
 epoch: 7, train_loss: 0.9253, test_loss: 1.0333, test_f1: 0.5391
 epoch: 8, train_loss: 0.9070, test_loss: 1.0141, test_f1: 0.5145
 epoch: 9, train_loss: 0.8918, test_loss: 1.0244, test_f1: 0.5206
 epoch: 10, train_loss: 0.8820, test_loss: 1.0073, test_f1: 0.5442
 epoch: 11, train_loss: 0.8743, test_loss: 1.0124, test_f1: 0.5413
 epoch: 12, train_loss: 0.8606, test_loss: 1.0039, test_f1: 0.5513
 epoch: 13, train_loss: 0.8426, test_loss: 1.0049, test_f1: 0.5698
 epoch: 14, train_loss: 0.8401, test_loss: 1.0016, test_f1: 0.5463
 epoch: 15, train_loss: 0.8205, test_loss: 0.9853, test_f1: 0.5666
 epoch: 16, train_loss: 0.7950, test_loss: 0.9969, test_f1: 0.5902
 epoch: 17, train_loss: 0.7904, test_loss: 1.0040, test_f1: 0.5604
 epoch: 18, train_loss: 0.7723, test_loss: 1.0097, test_f1: 0.5874
 epoch: 19, train_loss: 0.7742, test_loss: 0.9727, test_f1: 0.5948
 epoch: 20, train_loss: 0.7471, test_loss: 0.9794, test_f1: 0.6099
 epoch: 21, train_loss: 0.7385, test_loss: 1.0205, test_f1: 0.5941
 epoch: 22, train_loss: 0.7207, test_loss: 1.0103, test_f1: 0.5803
 epoch: 23, train_loss: 0.7012, test_loss: 1.0300, test_f1: 0.5980
 epoch: 24, train_loss: 0.7050, test_loss: 1.0371, test_f1: 0.5931
 epoch: 25, train_loss: 0.6763, test_loss: 1.0153, test_f1: 0.6044
 epoch: 26, train_loss: 0.6541, test_loss: 1.0288, test_f1: 0.6165
 epoch: 27, train_loss: 0.6582, test_loss: 1.0289, test_f1: 0.6089
 epoch: 28, train_loss: 0.6440, test_loss: 1.0204, test_f1: 0.6062
 epoch: 29, train_loss: 0.6382, test_loss: 1.1097, test_f1: 0.6064
 epoch: 30, train_loss: 0.6304, test_loss: 1.0281, test_f1: 0.6348
 epoch: 31, train_loss: 0.6032, test_loss: 1.0802, test_f1: 0.6191
 epoch: 32, train_loss: 0.5919, test_loss: 1.0503, test_f1: 0.6010
 epoch: 33, train_loss: 0.5863, test_loss: 1.0712, test_f1: 0.5651
 epoch: 34, train_loss: 0.5671, test_loss: 1.1135, test_f1: 0.6024
 epoch: 35, train_loss: 0.5674, test_loss: 1.0593, test_f1: 0.6296
 epoch: 36, train_loss: 0.5687, test_loss: 1.1133, test_f1: 0.6019
 epoch: 37, train_loss: 0.5574, test_loss: 1.0853, test_f1: 0.6399
 epoch: 38, train_loss: 0.5359, test_loss: 1.1648, test_f1: 0.5954
 epoch: 39, train_loss: 0.5376, test_loss: 1.0883, test_f1: 0.6433
 epoch: 40, train_loss: 0.5238, test_loss: 1.0964, test_f1: 0.6403
 epoch: 41, train_loss: 0.5178, test_loss: 1.1280, test_f1: 0.6227
 epoch: 42, train_loss: 0.4915, test_loss: 1.1649, test_f1: 0.6291
 epoch: 43, train_loss: 0.5093, test_loss: 1.0984, test_f1: 0.6393
 epoch: 44, train_loss: 0.4697, test_loss: 1.2496, test_f1: 0.6386
 epoch: 45, train_loss: 0.4936, test_loss: 1.2528, test_f1: 0.6318
 epoch: 46, train_loss: 0.4675, test_loss: 1.2820, test_f1: 0.6089
 epoch: 47, train_loss: 0.4512, test_loss: 1.2027, test_f1: 0.6383
 epoch: 48, train_loss: 0.4270, test_loss: 1.2155, test_f1: 0.6506
 epoch: 49, train_loss: 0.4570, test_loss: 1.2719, test_f1: 0.6327
 epoch: 50, train_loss: 0.4399, test_loss: 1.2988, test_f1: 0.5995
 epoch: 51, train_loss: 0.4130, test_loss: 1.3140, test_f1: 0.6484
 epoch: 52, train_loss: 0.4025, test_loss: 1.2502, test_f1: 0.6321
 epoch: 53, train_loss: 0.3866, test_loss: 1.3448, test_f1: 0.6175
 epoch: 54, train_loss: 0.3748, test_loss: 1.3460, test_f1: 0.6198
 epoch: 55, train_loss: 0.3775, test_loss: 1.3574, test_f1: 0.6270
 epoch: 56, train_loss: 0.3791, test_loss: 1.3740, test_f1: 0.6185
 epoch: 57, train_loss: 0.3752, test_loss: 1.4105, test_f1: 0.6190
 epoch: 58, train_loss: 0.3683, test_loss: 1.4081, test_f1: 0.6081
 epoch: 59, train_loss: 0.3529, test_loss: 1.4207, test_f1: 0.5976
 epoch: 60, train_loss: 0.3488, test_loss: 1.4065, test_f1: 0.6162
 epoch: 61, train_loss: 0.3438, test_loss: 1.4716, test_f1: 0.6184
 epoch: 62, train_loss: 0.3482, test_loss: 1.4850, test_f1: 0.6269
 epoch: 63, train_loss: 0.3507, test_loss: 1.5150, test_f1: 0.6201
 epoch: 64, train_loss: 0.3297, test_loss: 1.5245, test_f1: 0.6392
 epoch: 65, train_loss: 0.3333, test_loss: 1.5569, test_f1: 0.6100
 epoch: 66, train_loss: 0.3228, test_loss: 1.5373, test_f1: 0.6132
 epoch: 67, train_loss: 0.3130, test_loss: 1.5714, test_f1: 0.6107
 epoch: 68, train_loss: 0.3107, test_loss: 1.5650, test_f1: 0.6338
 epoch: 69, train_loss: 0.3123, test_loss: 1.5488, test_f1: 0.6074
 epoch: 70, train_loss: 0.3055, test_loss: 1.6623, test_f1: 0.6221
 epoch: 71, train_loss: 0.3054, test_loss: 1.5659, test_f1: 0.6108
 epoch: 72, train_loss: 0.3109, test_loss: 1.6021, test_f1: 0.6433
 epoch: 73, train_loss: 0.2926, test_loss: 1.7040, test_f1: 0.5957
 epoch: 74, train_loss: 0.2846, test_loss: 1.6390, test_f1: 0.6027
 epoch: 75, train_loss: 0.2835, test_loss: 1.6370, test_f1: 0.6180
 epoch: 76, train_loss: 0.2944, test_loss: 1.6577, test_f1: 0.6041
 epoch: 77, train_loss: 0.2925, test_loss: 1.7085, test_f1: 0.5948
 epoch: 78, train_loss: 0.2877, test_loss: 1.6548, test_f1: 0.6259
 epoch: 79, train_loss: 0.2711, test_loss: 1.7481, test_f1: 0.6094
 epoch: 80, train_loss: 0.2740, test_loss: 1.7550, test_f1: 0.6347
 epoch: 81, train_loss: 0.2821, test_loss: 1.6438, test_f1: 0.6185
 epoch: 82, train_loss: 0.2575, test_loss: 1.7380, test_f1: 0.6299
 epoch: 83, train_loss: 0.2503, test_loss: 1.7851, test_f1: 0.6243
 epoch: 84, train_loss: 0.2789, test_loss: 1.7613, test_f1: 0.6270
 epoch: 85, train_loss: 0.2507, test_loss: 1.6905, test_f1: 0.6348
 epoch: 86, train_loss: 0.2681, test_loss: 1.8460, test_f1: 0.6014
 epoch: 87, train_loss: 0.2642, test_loss: 1.8644, test_f1: 0.6208
 epoch: 88, train_loss: 0.2420, test_loss: 1.8638, test_f1: 0.6092
 epoch: 89, train_loss: 0.2364, test_loss: 1.8669, test_f1: 0.6108
 epoch: 90, train_loss: 0.2407, test_loss: 1.8371, test_f1: 0.6037
 epoch: 91, train_loss: 0.2332, test_loss: 1.9643, test_f1: 0.6097
 epoch: 92, train_loss: 0.2368, test_loss: 1.9091, test_f1: 0.5848
 epoch: 93, train_loss: 0.2382, test_loss: 1.9814, test_f1: 0.6038
 epoch: 94, train_loss: 0.2382, test_loss: 1.9469, test_f1: 0.6039
 epoch: 95, train_loss: 0.2183, test_loss: 1.9583, test_f1: 0.6249
 epoch: 96, train_loss: 0.2175, test_loss: 1.9858, test_f1: 0.6142
 epoch: 97, train_loss: 0.2308, test_loss: 2.0281, test_f1: 0.6207
 epoch: 98, train_loss: 0.2089, test_loss: 2.0522, test_f1: 0.6107
 epoch: 99, train_loss: 0.2237, test_loss: 1.9645, test_f1: 0.6200
##################ITERATION #2 ****************************************
 epoch: 0, train_loss: 1.1678, test_loss: 1.2099, test_f1: 0.3692
 epoch: 1, train_loss: 1.0364, test_loss: 1.0754, test_f1: 0.4833
 epoch: 2, train_loss: 0.9944, test_loss: 1.0589, test_f1: 0.5196
 epoch: 3, train_loss: 0.9692, test_loss: 1.0444, test_f1: 0.5308
 epoch: 4, train_loss: 0.9476, test_loss: 1.0234, test_f1: 0.5068
 epoch: 5, train_loss: 0.9285, test_loss: 1.0314, test_f1: 0.5387
 epoch: 6, train_loss: 0.9084, test_loss: 1.0242, test_f1: 0.5407
 epoch: 7, train_loss: 0.8997, test_loss: 1.0097, test_f1: 0.5519
 epoch: 8, train_loss: 0.8641, test_loss: 1.0214, test_f1: 0.5482
 epoch: 9, train_loss: 0.8616, test_loss: 1.0066, test_f1: 0.5590
 epoch: 10, train_loss: 0.8467, test_loss: 1.0093, test_f1: 0.5493
 epoch: 11, train_loss: 0.8398, test_loss: 1.0139, test_f1: 0.5330
 epoch: 12, train_loss: 0.8191, test_loss: 1.0148, test_f1: 0.5956
 epoch: 13, train_loss: 0.7967, test_loss: 1.0102, test_f1: 0.6024
 epoch: 14, train_loss: 0.7801, test_loss: 1.0098, test_f1: 0.6386
 epoch: 15, train_loss: 0.7736, test_loss: 1.0051, test_f1: 0.6162
 epoch: 16, train_loss: 0.7624, test_loss: 0.9930, test_f1: 0.6073
 epoch: 17, train_loss: 0.7366, test_loss: 1.0277, test_f1: 0.6131
 epoch: 18, train_loss: 0.7290, test_loss: 1.0216, test_f1: 0.6424
 epoch: 19, train_loss: 0.6958, test_loss: 1.0374, test_f1: 0.6425
 epoch: 20, train_loss: 0.6983, test_loss: 1.0508, test_f1: 0.5943
 epoch: 21, train_loss: 0.6833, test_loss: 1.0903, test_f1: 0.5882
 epoch: 22, train_loss: 0.6583, test_loss: 1.0783, test_f1: 0.5999
 epoch: 23, train_loss: 0.6574, test_loss: 1.1033, test_f1: 0.6069
 epoch: 24, train_loss: 0.6328, test_loss: 1.0864, test_f1: 0.6514
 epoch: 25, train_loss: 0.6347, test_loss: 1.1028, test_f1: 0.6092
 epoch: 26, train_loss: 0.6208, test_loss: 1.1019, test_f1: 0.6011
 epoch: 27, train_loss: 0.6085, test_loss: 1.1253, test_f1: 0.5880
 epoch: 28, train_loss: 0.5917, test_loss: 1.1205, test_f1: 0.6124
 epoch: 29, train_loss: 0.5724, test_loss: 1.1524, test_f1: 0.6103
 epoch: 30, train_loss: 0.5691, test_loss: 1.1485, test_f1: 0.6120
 epoch: 31, train_loss: 0.5644, test_loss: 1.1835, test_f1: 0.6270
 epoch: 32, train_loss: 0.5583, test_loss: 1.1838, test_f1: 0.6104
 epoch: 33, train_loss: 0.5348, test_loss: 1.1782, test_f1: 0.6101
 epoch: 34, train_loss: 0.5287, test_loss: 1.1859, test_f1: 0.6133
 epoch: 35, train_loss: 0.5146, test_loss: 1.2345, test_f1: 0.6467
 epoch: 36, train_loss: 0.5125, test_loss: 1.2704, test_f1: 0.5979
 epoch: 37, train_loss: 0.4912, test_loss: 1.2924, test_f1: 0.6143
 epoch: 38, train_loss: 0.4806, test_loss: 1.3133, test_f1: 0.6113
 epoch: 39, train_loss: 0.4893, test_loss: 1.3743, test_f1: 0.6035
 epoch: 40, train_loss: 0.4718, test_loss: 1.2792, test_f1: 0.6108
 epoch: 41, train_loss: 0.4768, test_loss: 1.4143, test_f1: 0.6184
 epoch: 42, train_loss: 0.4845, test_loss: 1.3697, test_f1: 0.6572
 epoch: 43, train_loss: 0.4460, test_loss: 1.3532, test_f1: 0.6311
 epoch: 44, train_loss: 0.4392, test_loss: 1.4499, test_f1: 0.6218
 epoch: 45, train_loss: 0.4134, test_loss: 1.4156, test_f1: 0.6278
 epoch: 46, train_loss: 0.4128, test_loss: 1.4278, test_f1: 0.6504
 epoch: 47, train_loss: 0.4070, test_loss: 1.4749, test_f1: 0.6219
 epoch: 48, train_loss: 0.4040, test_loss: 1.4829, test_f1: 0.6140
 epoch: 49, train_loss: 0.3886, test_loss: 1.4313, test_f1: 0.6324
 epoch: 50, train_loss: 0.3941, test_loss: 1.6275, test_f1: 0.6248
 epoch: 51, train_loss: 0.3838, test_loss: 1.5769, test_f1: 0.6188
 epoch: 52, train_loss: 0.3463, test_loss: 1.6441, test_f1: 0.6157
 epoch: 53, train_loss: 0.3453, test_loss: 1.6149, test_f1: 0.6315
 epoch: 54, train_loss: 0.3432, test_loss: 1.5976, test_f1: 0.6311
 epoch: 55, train_loss: 0.3245, test_loss: 1.6733, test_f1: 0.6226
 epoch: 56, train_loss: 0.3199, test_loss: 1.6769, test_f1: 0.6232
 epoch: 57, train_loss: 0.3455, test_loss: 1.6245, test_f1: 0.6338
 epoch: 58, train_loss: 0.3277, test_loss: 1.6666, test_f1: 0.6376
 epoch: 59, train_loss: 0.3061, test_loss: 1.6801, test_f1: 0.6287
 epoch: 60, train_loss: 0.3147, test_loss: 1.7435, test_f1: 0.6274
 epoch: 61, train_loss: 0.3054, test_loss: 1.7406, test_f1: 0.6338
 epoch: 62, train_loss: 0.3158, test_loss: 1.8190, test_f1: 0.6262
 epoch: 63, train_loss: 0.3068, test_loss: 1.8022, test_f1: 0.6222
 epoch: 64, train_loss: 0.3131, test_loss: 1.8557, test_f1: 0.6351
 epoch: 65, train_loss: 0.3171, test_loss: 1.7765, test_f1: 0.6194
 epoch: 66, train_loss: 0.2903, test_loss: 1.8450, test_f1: 0.6322
 epoch: 67, train_loss: 0.2994, test_loss: 1.8340, test_f1: 0.6237
 epoch: 68, train_loss: 0.2888, test_loss: 1.9016, test_f1: 0.6319
 epoch: 69, train_loss: 0.2769, test_loss: 1.8986, test_f1: 0.6259
 epoch: 70, train_loss: 0.2727, test_loss: 1.9200, test_f1: 0.6281
 epoch: 71, train_loss: 0.2651, test_loss: 1.9274, test_f1: 0.6316
 epoch: 72, train_loss: 0.2704, test_loss: 1.8886, test_f1: 0.6313
 epoch: 73, train_loss: 0.2900, test_loss: 1.9893, test_f1: 0.6187
 epoch: 74, train_loss: 0.2607, test_loss: 1.9688, test_f1: 0.6199
 epoch: 75, train_loss: 0.2718, test_loss: 1.9680, test_f1: 0.6174
 epoch: 76, train_loss: 0.2751, test_loss: 1.9993, test_f1: 0.6421
 epoch: 77, train_loss: 0.2485, test_loss: 1.9776, test_f1: 0.6173
 epoch: 78, train_loss: 0.2497, test_loss: 2.0017, test_f1: 0.6275
 epoch: 79, train_loss: 0.2614, test_loss: 1.9943, test_f1: 0.6075
 epoch: 80, train_loss: 0.2591, test_loss: 2.1064, test_f1: 0.6317
 epoch: 81, train_loss: 0.2483, test_loss: 2.0965, test_f1: 0.6264
 epoch: 82, train_loss: 0.2602, test_loss: 2.0827, test_f1: 0.6328
 epoch: 83, train_loss: 0.2312, test_loss: 2.0915, test_f1: 0.6264
 epoch: 84, train_loss: 0.2470, test_loss: 2.0263, test_f1: 0.6266
 epoch: 85, train_loss: 0.2303, test_loss: 2.0419, test_f1: 0.6329
 epoch: 86, train_loss: 0.2248, test_loss: 2.1103, test_f1: 0.6246
 epoch: 87, train_loss: 0.2378, test_loss: 2.1435, test_f1: 0.6405
 epoch: 88, train_loss: 0.2298, test_loss: 2.0984, test_f1: 0.6193
 epoch: 89, train_loss: 0.2309, test_loss: 2.2019, test_f1: 0.6250
 epoch: 90, train_loss: 0.2231, test_loss: 2.1743, test_f1: 0.6034
 epoch: 91, train_loss: 0.2470, test_loss: 2.1998, test_f1: 0.6247
 epoch: 92, train_loss: 0.2119, test_loss: 2.2572, test_f1: 0.6117
 epoch: 93, train_loss: 0.2444, test_loss: 2.1773, test_f1: 0.6018
 epoch: 94, train_loss: 0.2044, test_loss: 2.2709, test_f1: 0.6322
 epoch: 95, train_loss: 0.1974, test_loss: 2.2277, test_f1: 0.6188
 epoch: 96, train_loss: 0.2200, test_loss: 2.3618, test_f1: 0.6292
 epoch: 97, train_loss: 0.1967, test_loss: 2.2506, test_f1: 0.6268
 epoch: 98, train_loss: 0.2095, test_loss: 2.3082, test_f1: 0.6332
 epoch: 99, train_loss: 0.1884, test_loss: 2.3023, test_f1: 0.6391
##################ITERATION #3 ****************************************
 epoch: 0, train_loss: 1.1585, test_loss: 1.2347, test_f1: 0.3235
 epoch: 1, train_loss: 1.0277, test_loss: 1.0665, test_f1: 0.5088
 epoch: 2, train_loss: 0.9926, test_loss: 1.0530, test_f1: 0.5062
 epoch: 3, train_loss: 0.9849, test_loss: 1.0353, test_f1: 0.5523
 epoch: 4, train_loss: 0.9567, test_loss: 1.0203, test_f1: 0.5250
 epoch: 5, train_loss: 0.9186, test_loss: 1.0169, test_f1: 0.5416
 epoch: 6, train_loss: 0.9127, test_loss: 1.0050, test_f1: 0.5595
 epoch: 7, train_loss: 0.8975, test_loss: 0.9883, test_f1: 0.5598
 epoch: 8, train_loss: 0.8773, test_loss: 1.0109, test_f1: 0.5692
 epoch: 9, train_loss: 0.8825, test_loss: 0.9862, test_f1: 0.5681
 epoch: 10, train_loss: 0.8630, test_loss: 1.0025, test_f1: 0.5646
 epoch: 11, train_loss: 0.8580, test_loss: 0.9825, test_f1: 0.5652
 epoch: 12, train_loss: 0.8365, test_loss: 0.9894, test_f1: 0.5853
 epoch: 13, train_loss: 0.8190, test_loss: 1.0011, test_f1: 0.5714
 epoch: 14, train_loss: 0.8061, test_loss: 1.0136, test_f1: 0.5723
 epoch: 15, train_loss: 0.7966, test_loss: 0.9962, test_f1: 0.5890
 epoch: 16, train_loss: 0.7850, test_loss: 1.0045, test_f1: 0.5786
 epoch: 17, train_loss: 0.7598, test_loss: 1.0154, test_f1: 0.6090
 epoch: 18, train_loss: 0.7588, test_loss: 1.0087, test_f1: 0.5950
 epoch: 19, train_loss: 0.7407, test_loss: 1.0228, test_f1: 0.5977
 epoch: 20, train_loss: 0.7238, test_loss: 1.0201, test_f1: 0.5975
 epoch: 21, train_loss: 0.7170, test_loss: 1.0213, test_f1: 0.5980
 epoch: 22, train_loss: 0.6968, test_loss: 1.0255, test_f1: 0.5867
 epoch: 23, train_loss: 0.6830, test_loss: 1.0336, test_f1: 0.6023
 epoch: 24, train_loss: 0.6864, test_loss: 1.0385, test_f1: 0.5989
 epoch: 25, train_loss: 0.6766, test_loss: 1.0380, test_f1: 0.5939
 epoch: 26, train_loss: 0.6609, test_loss: 1.0557, test_f1: 0.6204
 epoch: 27, train_loss: 0.6660, test_loss: 1.0357, test_f1: 0.5982
 epoch: 28, train_loss: 0.6109, test_loss: 1.0865, test_f1: 0.5966
 epoch: 29, train_loss: 0.6269, test_loss: 1.0943, test_f1: 0.6118
 epoch: 30, train_loss: 0.6177, test_loss: 1.0935, test_f1: 0.5962
 epoch: 31, train_loss: 0.5885, test_loss: 1.0630, test_f1: 0.6195
 epoch: 32, train_loss: 0.5871, test_loss: 1.1574, test_f1: 0.6038
 epoch: 33, train_loss: 0.5702, test_loss: 1.1233, test_f1: 0.6178
 epoch: 34, train_loss: 0.5604, test_loss: 1.1407, test_f1: 0.5931
 epoch: 35, train_loss: 0.5627, test_loss: 1.1608, test_f1: 0.6106
 epoch: 36, train_loss: 0.5552, test_loss: 1.1393, test_f1: 0.6280
 epoch: 37, train_loss: 0.5408, test_loss: 1.1812, test_f1: 0.6136
 epoch: 38, train_loss: 0.5567, test_loss: 1.1969, test_f1: 0.6302
 epoch: 39, train_loss: 0.5132, test_loss: 1.2040, test_f1: 0.6051
 epoch: 40, train_loss: 0.5011, test_loss: 1.2224, test_f1: 0.6024
 epoch: 41, train_loss: 0.4944, test_loss: 1.1636, test_f1: 0.6229
 epoch: 42, train_loss: 0.5001, test_loss: 1.2220, test_f1: 0.6411
 epoch: 43, train_loss: 0.4984, test_loss: 1.2463, test_f1: 0.6158
 epoch: 44, train_loss: 0.4762, test_loss: 1.2861, test_f1: 0.6119
 epoch: 45, train_loss: 0.4766, test_loss: 1.2701, test_f1: 0.5973
 epoch: 46, train_loss: 0.4614, test_loss: 1.3594, test_f1: 0.6248
 epoch: 47, train_loss: 0.4641, test_loss: 1.3197, test_f1: 0.6171
 epoch: 48, train_loss: 0.4647, test_loss: 1.3145, test_f1: 0.6263
 epoch: 49, train_loss: 0.4391, test_loss: 1.3749, test_f1: 0.6135
 epoch: 50, train_loss: 0.4152, test_loss: 1.3755, test_f1: 0.6238
 epoch: 51, train_loss: 0.4163, test_loss: 1.3844, test_f1: 0.6303
 epoch: 52, train_loss: 0.4062, test_loss: 1.3740, test_f1: 0.6267
 epoch: 53, train_loss: 0.3891, test_loss: 1.3824, test_f1: 0.6154
 epoch: 54, train_loss: 0.3723, test_loss: 1.4245, test_f1: 0.6193
 epoch: 55, train_loss: 0.3570, test_loss: 1.4035, test_f1: 0.6274
 epoch: 56, train_loss: 0.3824, test_loss: 1.4233, test_f1: 0.6246
 epoch: 57, train_loss: 0.3550, test_loss: 1.4669, test_f1: 0.6189
 epoch: 58, train_loss: 0.3648, test_loss: 1.4658, test_f1: 0.6280
 epoch: 59, train_loss: 0.3577, test_loss: 1.4072, test_f1: 0.6320
 epoch: 60, train_loss: 0.3432, test_loss: 1.4857, test_f1: 0.6225
 epoch: 61, train_loss: 0.3438, test_loss: 1.4394, test_f1: 0.6252
 epoch: 62, train_loss: 0.3370, test_loss: 1.4562, test_f1: 0.6148
 epoch: 63, train_loss: 0.3380, test_loss: 1.4632, test_f1: 0.6222
 epoch: 64, train_loss: 0.3412, test_loss: 1.4961, test_f1: 0.6353
 epoch: 65, train_loss: 0.3350, test_loss: 1.5326, test_f1: 0.6081
 epoch: 66, train_loss: 0.3200, test_loss: 1.5327, test_f1: 0.6136
 epoch: 67, train_loss: 0.3289, test_loss: 1.5994, test_f1: 0.6217
 epoch: 68, train_loss: 0.3049, test_loss: 1.5957, test_f1: 0.6224
 epoch: 69, train_loss: 0.3078, test_loss: 1.5977, test_f1: 0.6226
 epoch: 70, train_loss: 0.2972, test_loss: 1.6198, test_f1: 0.6304
 epoch: 71, train_loss: 0.3005, test_loss: 1.6541, test_f1: 0.6188
 epoch: 72, train_loss: 0.2947, test_loss: 1.7180, test_f1: 0.6166
 epoch: 73, train_loss: 0.3068, test_loss: 1.6997, test_f1: 0.6164
 epoch: 74, train_loss: 0.2973, test_loss: 1.7292, test_f1: 0.6091
 epoch: 75, train_loss: 0.2889, test_loss: 1.6871, test_f1: 0.6321
 epoch: 76, train_loss: 0.3084, test_loss: 1.7606, test_f1: 0.6111
 epoch: 77, train_loss: 0.2950, test_loss: 1.7628, test_f1: 0.6310
 epoch: 78, train_loss: 0.2835, test_loss: 1.7135, test_f1: 0.6207
 epoch: 79, train_loss: 0.2898, test_loss: 1.8269, test_f1: 0.6184
 epoch: 80, train_loss: 0.2783, test_loss: 1.7809, test_f1: 0.6093
 epoch: 81, train_loss: 0.2706, test_loss: 1.8382, test_f1: 0.6127
 epoch: 82, train_loss: 0.2680, test_loss: 1.8672, test_f1: 0.6141
 epoch: 83, train_loss: 0.2878, test_loss: 1.8988, test_f1: 0.6116
 epoch: 84, train_loss: 0.2867, test_loss: 1.9509, test_f1: 0.5895
 epoch: 85, train_loss: 0.2564, test_loss: 1.9745, test_f1: 0.6228
 epoch: 86, train_loss: 0.2797, test_loss: 1.8510, test_f1: 0.6081
 epoch: 87, train_loss: 0.2596, test_loss: 1.9387, test_f1: 0.6161
 epoch: 88, train_loss: 0.2524, test_loss: 1.8662, test_f1: 0.6216
 epoch: 89, train_loss: 0.2580, test_loss: 1.9457, test_f1: 0.6024
 epoch: 90, train_loss: 0.2617, test_loss: 1.9941, test_f1: 0.6228
 epoch: 91, train_loss: 0.2403, test_loss: 1.9357, test_f1: 0.6262
 epoch: 92, train_loss: 0.2425, test_loss: 2.0578, test_f1: 0.6235
 epoch: 93, train_loss: 0.2311, test_loss: 1.9671, test_f1: 0.6186
 epoch: 94, train_loss: 0.2247, test_loss: 1.9490, test_f1: 0.6246
 epoch: 95, train_loss: 0.2447, test_loss: 2.0260, test_f1: 0.6232
 epoch: 96, train_loss: 0.2241, test_loss: 2.0118, test_f1: 0.6180
 epoch: 97, train_loss: 0.2323, test_loss: 1.9599, test_f1: 0.6143
 epoch: 98, train_loss: 0.2376, test_loss: 1.9974, test_f1: 0.6178
 epoch: 99, train_loss: 0.2306, test_loss: 2.0060, test_f1: 0.6251
##################ITERATION #4 ****************************************
 epoch: 0, train_loss: 1.1520, test_loss: 1.2956, test_f1: 0.3156
 epoch: 1, train_loss: 1.0119, test_loss: 1.0593, test_f1: 0.4731
 epoch: 2, train_loss: 0.9662, test_loss: 1.0442, test_f1: 0.5104
 epoch: 3, train_loss: 0.9434, test_loss: 1.0244, test_f1: 0.5586
 epoch: 4, train_loss: 0.9362, test_loss: 1.0177, test_f1: 0.5371
 epoch: 5, train_loss: 0.9166, test_loss: 1.0088, test_f1: 0.5135
 epoch: 6, train_loss: 0.8982, test_loss: 1.0047, test_f1: 0.5176
 epoch: 7, train_loss: 0.8945, test_loss: 1.0051, test_f1: 0.5283
 epoch: 8, train_loss: 0.8770, test_loss: 0.9857, test_f1: 0.5735
 epoch: 9, train_loss: 0.8583, test_loss: 0.9904, test_f1: 0.5653
 epoch: 10, train_loss: 0.8421, test_loss: 0.9977, test_f1: 0.5493
 epoch: 11, train_loss: 0.8231, test_loss: 0.9962, test_f1: 0.5822
 epoch: 12, train_loss: 0.8122, test_loss: 1.0139, test_f1: 0.5729
 epoch: 13, train_loss: 0.7917, test_loss: 1.0749, test_f1: 0.5562
 epoch: 14, train_loss: 0.7719, test_loss: 1.0176, test_f1: 0.5908
 epoch: 15, train_loss: 0.7798, test_loss: 1.0384, test_f1: 0.5712
 epoch: 16, train_loss: 0.7692, test_loss: 1.0594, test_f1: 0.5449
 epoch: 17, train_loss: 0.7618, test_loss: 1.0387, test_f1: 0.5608
 epoch: 18, train_loss: 0.7389, test_loss: 1.0635, test_f1: 0.5649
 epoch: 19, train_loss: 0.7366, test_loss: 1.0480, test_f1: 0.5707
 epoch: 20, train_loss: 0.7050, test_loss: 1.0487, test_f1: 0.5893
 epoch: 21, train_loss: 0.6996, test_loss: 1.0586, test_f1: 0.5682
 epoch: 22, train_loss: 0.6871, test_loss: 1.0996, test_f1: 0.5659
 epoch: 23, train_loss: 0.6853, test_loss: 1.1079, test_f1: 0.5551
 epoch: 24, train_loss: 0.6845, test_loss: 1.0964, test_f1: 0.5894
 epoch: 25, train_loss: 0.6530, test_loss: 1.1300, test_f1: 0.5922
 epoch: 26, train_loss: 0.6457, test_loss: 1.1240, test_f1: 0.5963
 epoch: 27, train_loss: 0.6566, test_loss: 1.0872, test_f1: 0.5651
 epoch: 28, train_loss: 0.6155, test_loss: 1.1117, test_f1: 0.5843
 epoch: 29, train_loss: 0.6161, test_loss: 1.1145, test_f1: 0.6212
 epoch: 30, train_loss: 0.6117, test_loss: 1.1591, test_f1: 0.5890
 epoch: 31, train_loss: 0.6087, test_loss: 1.1422, test_f1: 0.6213
 epoch: 32, train_loss: 0.5993, test_loss: 1.1400, test_f1: 0.6142
 epoch: 33, train_loss: 0.5877, test_loss: 1.1329, test_f1: 0.6258
 epoch: 34, train_loss: 0.5612, test_loss: 1.1287, test_f1: 0.6108
 epoch: 35, train_loss: 0.5605, test_loss: 1.1779, test_f1: 0.5971
 epoch: 36, train_loss: 0.5595, test_loss: 1.1753, test_f1: 0.5898
 epoch: 37, train_loss: 0.5411, test_loss: 1.2099, test_f1: 0.6029
 epoch: 38, train_loss: 0.5458, test_loss: 1.2492, test_f1: 0.5828
 epoch: 39, train_loss: 0.5403, test_loss: 1.2720, test_f1: 0.6001
 epoch: 40, train_loss: 0.5261, test_loss: 1.2418, test_f1: 0.6179
 epoch: 41, train_loss: 0.5383, test_loss: 1.3469, test_f1: 0.5846
 epoch: 42, train_loss: 0.5243, test_loss: 1.2316, test_f1: 0.6049
 epoch: 43, train_loss: 0.5085, test_loss: 1.3262, test_f1: 0.5886
 epoch: 44, train_loss: 0.5185, test_loss: 1.2887, test_f1: 0.6337
 epoch: 45, train_loss: 0.4816, test_loss: 1.3541, test_f1: 0.5760
 epoch: 46, train_loss: 0.4830, test_loss: 1.3099, test_f1: 0.6052
 epoch: 47, train_loss: 0.4709, test_loss: 1.3506, test_f1: 0.6162
 epoch: 48, train_loss: 0.4723, test_loss: 1.3515, test_f1: 0.6139
 epoch: 49, train_loss: 0.4775, test_loss: 1.3521, test_f1: 0.6190
 epoch: 50, train_loss: 0.4692, test_loss: 1.3816, test_f1: 0.5927
 epoch: 51, train_loss: 0.4307, test_loss: 1.3845, test_f1: 0.6223
 epoch: 52, train_loss: 0.4126, test_loss: 1.4479, test_f1: 0.5937
 epoch: 53, train_loss: 0.4008, test_loss: 1.4233, test_f1: 0.6146
 epoch: 54, train_loss: 0.4145, test_loss: 1.4251, test_f1: 0.6171
 epoch: 55, train_loss: 0.4099, test_loss: 1.4253, test_f1: 0.5975
 epoch: 56, train_loss: 0.4005, test_loss: 1.5184, test_f1: 0.6050
 epoch: 57, train_loss: 0.3877, test_loss: 1.4680, test_f1: 0.6128
 epoch: 58, train_loss: 0.4025, test_loss: 1.4746, test_f1: 0.6123
 epoch: 59, train_loss: 0.3687, test_loss: 1.5047, test_f1: 0.6044
 epoch: 60, train_loss: 0.3770, test_loss: 1.5416, test_f1: 0.6040
 epoch: 61, train_loss: 0.3952, test_loss: 1.5323, test_f1: 0.6010
 epoch: 62, train_loss: 0.3799, test_loss: 1.5392, test_f1: 0.6053
 epoch: 63, train_loss: 0.3799, test_loss: 1.4788, test_f1: 0.6174
 epoch: 64, train_loss: 0.3539, test_loss: 1.5961, test_f1: 0.5891
 epoch: 65, train_loss: 0.3627, test_loss: 1.6403, test_f1: 0.5964
 epoch: 66, train_loss: 0.3663, test_loss: 1.6179, test_f1: 0.5939
 epoch: 67, train_loss: 0.3663, test_loss: 1.6574, test_f1: 0.5821
 epoch: 68, train_loss: 0.3704, test_loss: 1.5886, test_f1: 0.6086
 epoch: 69, train_loss: 0.3417, test_loss: 1.6734, test_f1: 0.6060
 epoch: 70, train_loss: 0.3504, test_loss: 1.6831, test_f1: 0.5935
 epoch: 71, train_loss: 0.3562, test_loss: 1.6307, test_f1: 0.5984
 epoch: 72, train_loss: 0.3384, test_loss: 1.5942, test_f1: 0.6130
 epoch: 73, train_loss: 0.3218, test_loss: 1.6425, test_f1: 0.6241
 epoch: 74, train_loss: 0.3251, test_loss: 1.6979, test_f1: 0.6000
 epoch: 75, train_loss: 0.3320, test_loss: 1.7170, test_f1: 0.6080
 epoch: 76, train_loss: 0.3196, test_loss: 1.8325, test_f1: 0.5951
 epoch: 77, train_loss: 0.3338, test_loss: 1.7436, test_f1: 0.5867
 epoch: 78, train_loss: 0.3053, test_loss: 1.7805, test_f1: 0.5896
 epoch: 79, train_loss: 0.3372, test_loss: 1.7650, test_f1: 0.6113
 epoch: 80, train_loss: 0.3126, test_loss: 1.7629, test_f1: 0.5815
 epoch: 81, train_loss: 0.2871, test_loss: 1.7590, test_f1: 0.6015
 epoch: 82, train_loss: 0.2815, test_loss: 1.8851, test_f1: 0.5904
 epoch: 83, train_loss: 0.3032, test_loss: 1.8688, test_f1: 0.5961
 epoch: 84, train_loss: 0.2960, test_loss: 1.8690, test_f1: 0.5928
 epoch: 85, train_loss: 0.2891, test_loss: 1.9620, test_f1: 0.5864
 epoch: 86, train_loss: 0.2967, test_loss: 1.8688, test_f1: 0.5973
 epoch: 87, train_loss: 0.2587, test_loss: 1.9169, test_f1: 0.5759
 epoch: 88, train_loss: 0.2752, test_loss: 1.8827, test_f1: 0.6006
 epoch: 89, train_loss: 0.2878, test_loss: 1.9895, test_f1: 0.5681
 epoch: 90, train_loss: 0.3032, test_loss: 1.8998, test_f1: 0.5881
 epoch: 91, train_loss: 0.2713, test_loss: 2.0283, test_f1: 0.6051
 epoch: 92, train_loss: 0.2817, test_loss: 1.9415, test_f1: 0.6024
 epoch: 93, train_loss: 0.2586, test_loss: 2.0090, test_f1: 0.5765
 epoch: 94, train_loss: 0.2649, test_loss: 2.0259, test_f1: 0.6027
 epoch: 95, train_loss: 0.2631, test_loss: 2.0144, test_f1: 0.5977
 epoch: 96, train_loss: 0.2539, test_loss: 2.1093, test_f1: 0.6078
 epoch: 97, train_loss: 0.2456, test_loss: 2.0665, test_f1: 0.5820
 epoch: 98, train_loss: 0.2584, test_loss: 2.0725, test_f1: 0.5855
 epoch: 99, train_loss: 0.2650, test_loss: 2.1516, test_f1: 0.5931
##################ITERATION #5 ****************************************
 epoch: 0, train_loss: 1.1749, test_loss: 1.2516, test_f1: 0.3731
 epoch: 1, train_loss: 1.0023, test_loss: 1.0543, test_f1: 0.5145
 epoch: 2, train_loss: 0.9969, test_loss: 1.0611, test_f1: 0.5252
 epoch: 3, train_loss: 0.9461, test_loss: 1.0396, test_f1: 0.5375
 epoch: 4, train_loss: 0.9166, test_loss: 1.0391, test_f1: 0.5361
 epoch: 5, train_loss: 0.9125, test_loss: 1.0309, test_f1: 0.5731
 epoch: 6, train_loss: 0.8953, test_loss: 1.0266, test_f1: 0.5839
 epoch: 7, train_loss: 0.8725, test_loss: 1.0262, test_f1: 0.5862
 epoch: 8, train_loss: 0.8609, test_loss: 1.0311, test_f1: 0.5933
 epoch: 9, train_loss: 0.8573, test_loss: 1.0086, test_f1: 0.6011
 epoch: 10, train_loss: 0.8251, test_loss: 1.0158, test_f1: 0.5601
 epoch: 11, train_loss: 0.8158, test_loss: 1.0057, test_f1: 0.5973
 epoch: 12, train_loss: 0.8143, test_loss: 1.0045, test_f1: 0.6080
 epoch: 13, train_loss: 0.7840, test_loss: 1.0178, test_f1: 0.5798
 epoch: 14, train_loss: 0.7793, test_loss: 1.0087, test_f1: 0.5729
 epoch: 15, train_loss: 0.7621, test_loss: 1.0217, test_f1: 0.5437
 epoch: 16, train_loss: 0.7422, test_loss: 1.0396, test_f1: 0.5762
 epoch: 17, train_loss: 0.7297, test_loss: 1.0334, test_f1: 0.5753
 epoch: 18, train_loss: 0.7217, test_loss: 1.0432, test_f1: 0.5847
 epoch: 19, train_loss: 0.7002, test_loss: 1.0156, test_f1: 0.5901
 epoch: 20, train_loss: 0.6980, test_loss: 1.0207, test_f1: 0.5850
 epoch: 21, train_loss: 0.6884, test_loss: 1.0518, test_f1: 0.6125
 epoch: 22, train_loss: 0.6769, test_loss: 1.0667, test_f1: 0.6212
 epoch: 23, train_loss: 0.6582, test_loss: 1.0645, test_f1: 0.6121
 epoch: 24, train_loss: 0.6536, test_loss: 1.0472, test_f1: 0.6202
 epoch: 25, train_loss: 0.6374, test_loss: 1.0571, test_f1: 0.6156
 epoch: 26, train_loss: 0.6499, test_loss: 1.0765, test_f1: 0.6064
 epoch: 27, train_loss: 0.6043, test_loss: 1.0725, test_f1: 0.5956
 epoch: 28, train_loss: 0.5959, test_loss: 1.0954, test_f1: 0.6150
 epoch: 29, train_loss: 0.5903, test_loss: 1.0995, test_f1: 0.6081
 epoch: 30, train_loss: 0.5821, test_loss: 1.0970, test_f1: 0.5869
 epoch: 31, train_loss: 0.5779, test_loss: 1.1013, test_f1: 0.6071
 epoch: 32, train_loss: 0.5806, test_loss: 1.0689, test_f1: 0.6223
 epoch: 33, train_loss: 0.5554, test_loss: 1.0965, test_f1: 0.6290
 epoch: 34, train_loss: 0.5514, test_loss: 1.1739, test_f1: 0.6450
 epoch: 35, train_loss: 0.5351, test_loss: 1.1238, test_f1: 0.6415
 epoch: 36, train_loss: 0.5344, test_loss: 1.1366, test_f1: 0.6348
 epoch: 37, train_loss: 0.5431, test_loss: 1.1228, test_f1: 0.6346
 epoch: 38, train_loss: 0.5195, test_loss: 1.1519, test_f1: 0.6207
 epoch: 39, train_loss: 0.5095, test_loss: 1.1932, test_f1: 0.6312
 epoch: 40, train_loss: 0.4869, test_loss: 1.2228, test_f1: 0.6344
 epoch: 41, train_loss: 0.5020, test_loss: 1.2176, test_f1: 0.6481
 epoch: 42, train_loss: 0.4691, test_loss: 1.2565, test_f1: 0.6200
 epoch: 43, train_loss: 0.4821, test_loss: 1.3115, test_f1: 0.6105
 epoch: 44, train_loss: 0.4676, test_loss: 1.2656, test_f1: 0.6339
 epoch: 45, train_loss: 0.4560, test_loss: 1.3209, test_f1: 0.6488
 epoch: 46, train_loss: 0.4583, test_loss: 1.2821, test_f1: 0.6484
 epoch: 47, train_loss: 0.4286, test_loss: 1.3560, test_f1: 0.6403
 epoch: 48, train_loss: 0.4196, test_loss: 1.2857, test_f1: 0.6284
 epoch: 49, train_loss: 0.4248, test_loss: 1.3392, test_f1: 0.6521
 epoch: 50, train_loss: 0.4376, test_loss: 1.4112, test_f1: 0.6350
 epoch: 51, train_loss: 0.3998, test_loss: 1.3676, test_f1: 0.6277
 epoch: 52, train_loss: 0.3932, test_loss: 1.3734, test_f1: 0.6476
 epoch: 53, train_loss: 0.3775, test_loss: 1.3987, test_f1: 0.6504
 epoch: 54, train_loss: 0.3867, test_loss: 1.4247, test_f1: 0.6658
 epoch: 55, train_loss: 0.3944, test_loss: 1.4471, test_f1: 0.6404
 epoch: 56, train_loss: 0.3622, test_loss: 1.4464, test_f1: 0.6374
 epoch: 57, train_loss: 0.3727, test_loss: 1.5069, test_f1: 0.6236
 epoch: 58, train_loss: 0.3603, test_loss: 1.4499, test_f1: 0.6455
 epoch: 59, train_loss: 0.3412, test_loss: 1.4901, test_f1: 0.6423
 epoch: 60, train_loss: 0.3493, test_loss: 1.4639, test_f1: 0.6528
 epoch: 61, train_loss: 0.3447, test_loss: 1.5206, test_f1: 0.6463
 epoch: 62, train_loss: 0.3399, test_loss: 1.5181, test_f1: 0.6389
 epoch: 63, train_loss: 0.3411, test_loss: 1.5521, test_f1: 0.6263
 epoch: 64, train_loss: 0.3463, test_loss: 1.5443, test_f1: 0.6537
 epoch: 65, train_loss: 0.3255, test_loss: 1.5403, test_f1: 0.6534
 epoch: 66, train_loss: 0.3090, test_loss: 1.5722, test_f1: 0.6438
 epoch: 67, train_loss: 0.3359, test_loss: 1.5862, test_f1: 0.6278
 epoch: 68, train_loss: 0.3130, test_loss: 1.6182, test_f1: 0.6275
 epoch: 69, train_loss: 0.3222, test_loss: 1.5540, test_f1: 0.6557
 epoch: 70, train_loss: 0.3308, test_loss: 1.5574, test_f1: 0.6329
 epoch: 71, train_loss: 0.3030, test_loss: 1.6372, test_f1: 0.6353
 epoch: 72, train_loss: 0.3052, test_loss: 1.6400, test_f1: 0.6359
 epoch: 73, train_loss: 0.3004, test_loss: 1.6306, test_f1: 0.6352
 epoch: 74, train_loss: 0.2816, test_loss: 1.6691, test_f1: 0.6615
 epoch: 75, train_loss: 0.3015, test_loss: 1.7161, test_f1: 0.6420
 epoch: 76, train_loss: 0.2987, test_loss: 1.7399, test_f1: 0.6414
 epoch: 77, train_loss: 0.2791, test_loss: 1.7281, test_f1: 0.6283
 epoch: 78, train_loss: 0.2826, test_loss: 1.7103, test_f1: 0.6479
 epoch: 79, train_loss: 0.2740, test_loss: 1.7565, test_f1: 0.6349
 epoch: 80, train_loss: 0.2850, test_loss: 1.7959, test_f1: 0.6223
 epoch: 81, train_loss: 0.2709, test_loss: 1.7971, test_f1: 0.6169
 epoch: 82, train_loss: 0.2739, test_loss: 1.7719, test_f1: 0.6507
 epoch: 83, train_loss: 0.2583, test_loss: 1.7912, test_f1: 0.6520
 epoch: 84, train_loss: 0.2755, test_loss: 1.7907, test_f1: 0.6410
 epoch: 85, train_loss: 0.2725, test_loss: 1.8088, test_f1: 0.6375
 epoch: 86, train_loss: 0.2735, test_loss: 1.8803, test_f1: 0.6214
 epoch: 87, train_loss: 0.2511, test_loss: 1.9215, test_f1: 0.6331
 epoch: 88, train_loss: 0.2608, test_loss: 1.8733, test_f1: 0.6509
 epoch: 89, train_loss: 0.2641, test_loss: 1.8972, test_f1: 0.6028
 epoch: 90, train_loss: 0.2577, test_loss: 1.8318, test_f1: 0.6395
 epoch: 91, train_loss: 0.2436, test_loss: 1.8788, test_f1: 0.6406
 epoch: 92, train_loss: 0.2574, test_loss: 1.9284, test_f1: 0.6400
 epoch: 93, train_loss: 0.2482, test_loss: 1.9824, test_f1: 0.6177
 epoch: 94, train_loss: 0.2453, test_loss: 2.0043, test_f1: 0.6255
 epoch: 95, train_loss: 0.2642, test_loss: 1.9958, test_f1: 0.6272
 epoch: 96, train_loss: 0.2393, test_loss: 1.9621, test_f1: 0.6572
 epoch: 97, train_loss: 0.2295, test_loss: 1.9867, test_f1: 0.6567
 epoch: 98, train_loss: 0.2215, test_loss: 1.9836, test_f1: 0.6350
 epoch: 99, train_loss: 0.2384, test_loss: 2.0881, test_f1: 0.6373
##################ITERATION #6 ****************************************
 epoch: 0, train_loss: 1.1842, test_loss: 1.3900, test_f1: 0.2637
 epoch: 1, train_loss: 1.0127, test_loss: 1.0734, test_f1: 0.4949
 epoch: 2, train_loss: 0.9874, test_loss: 1.0464, test_f1: 0.5475
 epoch: 3, train_loss: 0.9393, test_loss: 1.0664, test_f1: 0.5426
 epoch: 4, train_loss: 0.9279, test_loss: 1.0488, test_f1: 0.5421
 epoch: 5, train_loss: 0.9059, test_loss: 1.0680, test_f1: 0.5482
 epoch: 6, train_loss: 0.8776, test_loss: 1.0485, test_f1: 0.5652
 epoch: 7, train_loss: 0.8603, test_loss: 1.0345, test_f1: 0.5503
 epoch: 8, train_loss: 0.8428, test_loss: 1.0615, test_f1: 0.5579
 epoch: 9, train_loss: 0.8310, test_loss: 1.0719, test_f1: 0.5741
 epoch: 10, train_loss: 0.8078, test_loss: 1.0683, test_f1: 0.5682
 epoch: 11, train_loss: 0.7847, test_loss: 1.0955, test_f1: 0.5468
 epoch: 12, train_loss: 0.7740, test_loss: 1.0988, test_f1: 0.5868
 epoch: 13, train_loss: 0.7564, test_loss: 1.0885, test_f1: 0.5720
 epoch: 14, train_loss: 0.7487, test_loss: 1.1142, test_f1: 0.5630
 epoch: 15, train_loss: 0.7430, test_loss: 1.1203, test_f1: 0.5665
 epoch: 16, train_loss: 0.7281, test_loss: 1.0928, test_f1: 0.5809
 epoch: 17, train_loss: 0.7128, test_loss: 1.1283, test_f1: 0.5541
 epoch: 18, train_loss: 0.7106, test_loss: 1.1223, test_f1: 0.5632
 epoch: 19, train_loss: 0.6947, test_loss: 1.1110, test_f1: 0.5853
 epoch: 20, train_loss: 0.6597, test_loss: 1.1337, test_f1: 0.6035
 epoch: 21, train_loss: 0.6591, test_loss: 1.0965, test_f1: 0.5997
 epoch: 22, train_loss: 0.6575, test_loss: 1.0930, test_f1: 0.6081
 epoch: 23, train_loss: 0.6341, test_loss: 1.0924, test_f1: 0.5996
 epoch: 24, train_loss: 0.6213, test_loss: 1.1964, test_f1: 0.5850
 epoch: 25, train_loss: 0.6296, test_loss: 1.1266, test_f1: 0.6221
 epoch: 26, train_loss: 0.6025, test_loss: 1.1557, test_f1: 0.6042
 epoch: 27, train_loss: 0.6025, test_loss: 1.1439, test_f1: 0.5898
 epoch: 28, train_loss: 0.5762, test_loss: 1.1115, test_f1: 0.6191
 epoch: 29, train_loss: 0.5934, test_loss: 1.1619, test_f1: 0.6366
 epoch: 30, train_loss: 0.5773, test_loss: 1.1330, test_f1: 0.6119
 epoch: 31, train_loss: 0.5484, test_loss: 1.1834, test_f1: 0.6216
 epoch: 32, train_loss: 0.5547, test_loss: 1.1539, test_f1: 0.6193
 epoch: 33, train_loss: 0.5483, test_loss: 1.2258, test_f1: 0.6048
 epoch: 34, train_loss: 0.5248, test_loss: 1.2670, test_f1: 0.6267
 epoch: 35, train_loss: 0.5189, test_loss: 1.2446, test_f1: 0.6065
 epoch: 36, train_loss: 0.4986, test_loss: 1.2780, test_f1: 0.6435
 epoch: 37, train_loss: 0.4972, test_loss: 1.2636, test_f1: 0.6172
 epoch: 38, train_loss: 0.4942, test_loss: 1.2317, test_f1: 0.6141
 epoch: 39, train_loss: 0.4767, test_loss: 1.2837, test_f1: 0.6376
 epoch: 40, train_loss: 0.4619, test_loss: 1.2912, test_f1: 0.6327
 epoch: 41, train_loss: 0.4820, test_loss: 1.2965, test_f1: 0.6175
 epoch: 42, train_loss: 0.4874, test_loss: 1.3329, test_f1: 0.6273
 epoch: 43, train_loss: 0.4746, test_loss: 1.3295, test_f1: 0.6231
 epoch: 44, train_loss: 0.4496, test_loss: 1.2985, test_f1: 0.6301
 epoch: 45, train_loss: 0.4349, test_loss: 1.3163, test_f1: 0.6298
 epoch: 46, train_loss: 0.4448, test_loss: 1.3477, test_f1: 0.6202
 epoch: 47, train_loss: 0.4223, test_loss: 1.4087, test_f1: 0.5982
 epoch: 48, train_loss: 0.4019, test_loss: 1.4118, test_f1: 0.6248
 epoch: 49, train_loss: 0.4370, test_loss: 1.4387, test_f1: 0.6180
 epoch: 50, train_loss: 0.4020, test_loss: 1.3856, test_f1: 0.6194
 epoch: 51, train_loss: 0.3974, test_loss: 1.4002, test_f1: 0.6183
 epoch: 52, train_loss: 0.3635, test_loss: 1.4442, test_f1: 0.6069
 epoch: 53, train_loss: 0.3788, test_loss: 1.4633, test_f1: 0.6133
 epoch: 54, train_loss: 0.3564, test_loss: 1.4633, test_f1: 0.6334
 epoch: 55, train_loss: 0.3450, test_loss: 1.4877, test_f1: 0.6117
 epoch: 56, train_loss: 0.3331, test_loss: 1.5476, test_f1: 0.6153
 epoch: 57, train_loss: 0.3303, test_loss: 1.5137, test_f1: 0.6298
 epoch: 58, train_loss: 0.3650, test_loss: 1.5487, test_f1: 0.6229
 epoch: 59, train_loss: 0.3487, test_loss: 1.5920, test_f1: 0.5978
 epoch: 60, train_loss: 0.3445, test_loss: 1.5413, test_f1: 0.6199
 epoch: 61, train_loss: 0.3378, test_loss: 1.6359, test_f1: 0.6042
 epoch: 62, train_loss: 0.3134, test_loss: 1.6364, test_f1: 0.5972
 epoch: 63, train_loss: 0.3371, test_loss: 1.6203, test_f1: 0.6021
 epoch: 64, train_loss: 0.3156, test_loss: 1.6176, test_f1: 0.6183
 epoch: 65, train_loss: 0.3214, test_loss: 1.6252, test_f1: 0.5969
 epoch: 66, train_loss: 0.2979, test_loss: 1.6651, test_f1: 0.6107
 epoch: 67, train_loss: 0.3206, test_loss: 1.6070, test_f1: 0.6147
 epoch: 68, train_loss: 0.2882, test_loss: 1.6966, test_f1: 0.6114
 epoch: 69, train_loss: 0.2995, test_loss: 1.6607, test_f1: 0.6106
 epoch: 70, train_loss: 0.2802, test_loss: 1.7111, test_f1: 0.6176
 epoch: 71, train_loss: 0.3022, test_loss: 1.6983, test_f1: 0.6099
 epoch: 72, train_loss: 0.2783, test_loss: 1.7183, test_f1: 0.6121
 epoch: 73, train_loss: 0.2817, test_loss: 1.7125, test_f1: 0.6147
 epoch: 74, train_loss: 0.2970, test_loss: 1.7711, test_f1: 0.6132
 epoch: 75, train_loss: 0.2864, test_loss: 1.7935, test_f1: 0.5948
 epoch: 76, train_loss: 0.2797, test_loss: 1.7847, test_f1: 0.6056
 epoch: 77, train_loss: 0.2861, test_loss: 1.7822, test_f1: 0.6108
 epoch: 78, train_loss: 0.2550, test_loss: 1.8294, test_f1: 0.6139
 epoch: 79, train_loss: 0.2764, test_loss: 1.7638, test_f1: 0.6184
 epoch: 80, train_loss: 0.2678, test_loss: 1.8503, test_f1: 0.6031
 epoch: 81, train_loss: 0.2508, test_loss: 1.8166, test_f1: 0.6106
 epoch: 82, train_loss: 0.2487, test_loss: 1.8652, test_f1: 0.6110
 epoch: 83, train_loss: 0.2624, test_loss: 1.9005, test_f1: 0.6107
 epoch: 84, train_loss: 0.2698, test_loss: 1.8401, test_f1: 0.6223
 epoch: 85, train_loss: 0.2708, test_loss: 1.9654, test_f1: 0.6005
 epoch: 86, train_loss: 0.2518, test_loss: 1.9171, test_f1: 0.6094
 epoch: 87, train_loss: 0.2322, test_loss: 1.9549, test_f1: 0.6221
 epoch: 88, train_loss: 0.2656, test_loss: 1.9599, test_f1: 0.6062
 epoch: 89, train_loss: 0.2387, test_loss: 1.9430, test_f1: 0.6059
 epoch: 90, train_loss: 0.2481, test_loss: 1.9465, test_f1: 0.6111
 epoch: 91, train_loss: 0.2289, test_loss: 1.9560, test_f1: 0.6155
 epoch: 92, train_loss: 0.2536, test_loss: 1.9690, test_f1: 0.6132
 epoch: 93, train_loss: 0.2560, test_loss: 1.9748, test_f1: 0.6195
 epoch: 94, train_loss: 0.2260, test_loss: 2.0172, test_f1: 0.6039
 epoch: 95, train_loss: 0.2227, test_loss: 2.0011, test_f1: 0.6136
 epoch: 96, train_loss: 0.2378, test_loss: 2.0689, test_f1: 0.5868
 epoch: 97, train_loss: 0.2103, test_loss: 2.0523, test_f1: 0.6142
 epoch: 98, train_loss: 0.2324, test_loss: 2.1017, test_f1: 0.6060
 epoch: 99, train_loss: 0.2256, test_loss: 2.0759, test_f1: 0.5907
##################ITERATION #7 ****************************************
 epoch: 0, train_loss: 1.1937, test_loss: 1.2563, test_f1: 0.4086
 epoch: 1, train_loss: 1.0440, test_loss: 1.0834, test_f1: 0.5073
 epoch: 2, train_loss: 0.9977, test_loss: 1.0572, test_f1: 0.5346
 epoch: 3, train_loss: 0.9695, test_loss: 1.0812, test_f1: 0.5115
 epoch: 4, train_loss: 0.9308, test_loss: 1.0295, test_f1: 0.5257
 epoch: 5, train_loss: 0.9155, test_loss: 1.0265, test_f1: 0.5644
 epoch: 6, train_loss: 0.8859, test_loss: 1.0342, test_f1: 0.5284
 epoch: 7, train_loss: 0.8626, test_loss: 1.0177, test_f1: 0.5665
 epoch: 8, train_loss: 0.8594, test_loss: 1.0450, test_f1: 0.5379
 epoch: 9, train_loss: 0.8492, test_loss: 1.0345, test_f1: 0.5363
 epoch: 10, train_loss: 0.7978, test_loss: 1.0338, test_f1: 0.5483
 epoch: 11, train_loss: 0.8058, test_loss: 1.0178, test_f1: 0.5515
 epoch: 12, train_loss: 0.7933, test_loss: 1.0357, test_f1: 0.5543
 epoch: 13, train_loss: 0.7511, test_loss: 1.0180, test_f1: 0.5912
 epoch: 14, train_loss: 0.7534, test_loss: 1.0432, test_f1: 0.5695
 epoch: 15, train_loss: 0.7311, test_loss: 1.0479, test_f1: 0.5917
 epoch: 16, train_loss: 0.7159, test_loss: 1.0386, test_f1: 0.5766
 epoch: 17, train_loss: 0.7162, test_loss: 1.0550, test_f1: 0.5803
 epoch: 18, train_loss: 0.7068, test_loss: 1.0645, test_f1: 0.5907
 epoch: 19, train_loss: 0.6870, test_loss: 1.0714, test_f1: 0.5911
 epoch: 20, train_loss: 0.6757, test_loss: 1.0868, test_f1: 0.5945
 epoch: 21, train_loss: 0.6535, test_loss: 1.0892, test_f1: 0.6128
 epoch: 22, train_loss: 0.6563, test_loss: 1.1444, test_f1: 0.6224
 epoch: 23, train_loss: 0.6451, test_loss: 1.1231, test_f1: 0.6020
 epoch: 24, train_loss: 0.6218, test_loss: 1.1074, test_f1: 0.6143
 epoch: 25, train_loss: 0.6308, test_loss: 1.1416, test_f1: 0.5775
 epoch: 26, train_loss: 0.6117, test_loss: 1.1348, test_f1: 0.6025
 epoch: 27, train_loss: 0.6171, test_loss: 1.1319, test_f1: 0.6190
 epoch: 28, train_loss: 0.5960, test_loss: 1.1696, test_f1: 0.6142
 epoch: 29, train_loss: 0.5808, test_loss: 1.1869, test_f1: 0.6160
 epoch: 30, train_loss: 0.5591, test_loss: 1.2049, test_f1: 0.6083
 epoch: 31, train_loss: 0.5801, test_loss: 1.2137, test_f1: 0.6219
 epoch: 32, train_loss: 0.5515, test_loss: 1.1960, test_f1: 0.6359
 epoch: 33, train_loss: 0.5416, test_loss: 1.2641, test_f1: 0.6023
 epoch: 34, train_loss: 0.5308, test_loss: 1.2059, test_f1: 0.6171
 epoch: 35, train_loss: 0.5220, test_loss: 1.2524, test_f1: 0.6376
 epoch: 36, train_loss: 0.5081, test_loss: 1.2829, test_f1: 0.6438
 epoch: 37, train_loss: 0.4991, test_loss: 1.3019, test_f1: 0.5930
 epoch: 38, train_loss: 0.5050, test_loss: 1.2885, test_f1: 0.6598
 epoch: 39, train_loss: 0.4797, test_loss: 1.2931, test_f1: 0.6362
 epoch: 40, train_loss: 0.4701, test_loss: 1.2859, test_f1: 0.6665
 epoch: 41, train_loss: 0.4589, test_loss: 1.3582, test_f1: 0.6385
 epoch: 42, train_loss: 0.4605, test_loss: 1.4376, test_f1: 0.6234
 epoch: 43, train_loss: 0.4724, test_loss: 1.3438, test_f1: 0.6602
 epoch: 44, train_loss: 0.4448, test_loss: 1.3307, test_f1: 0.6398
 epoch: 45, train_loss: 0.4527, test_loss: 1.3902, test_f1: 0.6476
 epoch: 46, train_loss: 0.4387, test_loss: 1.4085, test_f1: 0.6352
 epoch: 47, train_loss: 0.4223, test_loss: 1.4119, test_f1: 0.6440
 epoch: 48, train_loss: 0.4291, test_loss: 1.4198, test_f1: 0.6400
 epoch: 49, train_loss: 0.4184, test_loss: 1.4670, test_f1: 0.6282
 epoch: 50, train_loss: 0.3884, test_loss: 1.4783, test_f1: 0.6327
 epoch: 51, train_loss: 0.3661, test_loss: 1.4911, test_f1: 0.6266
 epoch: 52, train_loss: 0.3753, test_loss: 1.5683, test_f1: 0.6284
 epoch: 53, train_loss: 0.3591, test_loss: 1.5266, test_f1: 0.6333
 epoch: 54, train_loss: 0.3542, test_loss: 1.5607, test_f1: 0.6337
 epoch: 55, train_loss: 0.3425, test_loss: 1.5516, test_f1: 0.6300
 epoch: 56, train_loss: 0.3502, test_loss: 1.5508, test_f1: 0.6339
 epoch: 57, train_loss: 0.3369, test_loss: 1.6086, test_f1: 0.6474
 epoch: 58, train_loss: 0.3442, test_loss: 1.5819, test_f1: 0.6469
 epoch: 59, train_loss: 0.3298, test_loss: 1.6085, test_f1: 0.6376
 epoch: 60, train_loss: 0.3048, test_loss: 1.6512, test_f1: 0.6335
 epoch: 61, train_loss: 0.3284, test_loss: 1.6476, test_f1: 0.6345
 epoch: 62, train_loss: 0.3126, test_loss: 1.6875, test_f1: 0.6333
 epoch: 63, train_loss: 0.3134, test_loss: 1.7396, test_f1: 0.6331
 epoch: 64, train_loss: 0.2966, test_loss: 1.7227, test_f1: 0.6376
 epoch: 65, train_loss: 0.2881, test_loss: 1.7576, test_f1: 0.6345
 epoch: 66, train_loss: 0.3073, test_loss: 1.8085, test_f1: 0.6302
 epoch: 67, train_loss: 0.2888, test_loss: 1.7519, test_f1: 0.6460
 epoch: 68, train_loss: 0.3075, test_loss: 1.7682, test_f1: 0.6372
 epoch: 69, train_loss: 0.3057, test_loss: 1.7939, test_f1: 0.6379
 epoch: 70, train_loss: 0.3114, test_loss: 1.7984, test_f1: 0.6373
 epoch: 71, train_loss: 0.2850, test_loss: 1.8246, test_f1: 0.6354
 epoch: 72, train_loss: 0.2934, test_loss: 1.7919, test_f1: 0.6342
 epoch: 73, train_loss: 0.3020, test_loss: 1.8588, test_f1: 0.6389
 epoch: 74, train_loss: 0.2896, test_loss: 1.8279, test_f1: 0.6298
 epoch: 75, train_loss: 0.2791, test_loss: 1.8713, test_f1: 0.6343
 epoch: 76, train_loss: 0.2697, test_loss: 1.9492, test_f1: 0.6126
 epoch: 77, train_loss: 0.2615, test_loss: 1.9223, test_f1: 0.6239
 epoch: 78, train_loss: 0.2815, test_loss: 1.9661, test_f1: 0.6298
 epoch: 79, train_loss: 0.2774, test_loss: 1.9291, test_f1: 0.6280
 epoch: 80, train_loss: 0.2677, test_loss: 1.9964, test_f1: 0.6373
 epoch: 81, train_loss: 0.2735, test_loss: 1.9833, test_f1: 0.6276
 epoch: 82, train_loss: 0.2497, test_loss: 1.9342, test_f1: 0.6196
 epoch: 83, train_loss: 0.2452, test_loss: 1.9978, test_f1: 0.6300
 epoch: 84, train_loss: 0.2606, test_loss: 2.0021, test_f1: 0.6198
 epoch: 85, train_loss: 0.2678, test_loss: 2.0142, test_f1: 0.6228
 epoch: 86, train_loss: 0.2621, test_loss: 2.0750, test_f1: 0.6094
 epoch: 87, train_loss: 0.2500, test_loss: 2.1038, test_f1: 0.6250
 epoch: 88, train_loss: 0.2285, test_loss: 2.0666, test_f1: 0.6228
 epoch: 89, train_loss: 0.2168, test_loss: 2.1000, test_f1: 0.6178
 epoch: 90, train_loss: 0.2280, test_loss: 2.1453, test_f1: 0.6233
 epoch: 91, train_loss: 0.2262, test_loss: 2.0783, test_f1: 0.6267
 epoch: 92, train_loss: 0.2269, test_loss: 2.1304, test_f1: 0.6122
 epoch: 93, train_loss: 0.2189, test_loss: 2.1731, test_f1: 0.6337
 epoch: 94, train_loss: 0.2306, test_loss: 2.0892, test_f1: 0.6121
 epoch: 95, train_loss: 0.2209, test_loss: 2.1547, test_f1: 0.6311
 epoch: 96, train_loss: 0.2371, test_loss: 2.1808, test_f1: 0.6419
 epoch: 97, train_loss: 0.2168, test_loss: 2.1715, test_f1: 0.6236
 epoch: 98, train_loss: 0.2367, test_loss: 2.1990, test_f1: 0.6331
 epoch: 99, train_loss: 0.2247, test_loss: 2.2505, test_f1: 0.6382
##################ITERATION #8 ****************************************
 epoch: 0, train_loss: 1.2382, test_loss: 1.2867, test_f1: 0.3559
 epoch: 1, train_loss: 1.0585, test_loss: 1.0718, test_f1: 0.4918
 epoch: 2, train_loss: 1.0124, test_loss: 1.0324, test_f1: 0.5461
 epoch: 3, train_loss: 0.9672, test_loss: 1.0257, test_f1: 0.5384
 epoch: 4, train_loss: 0.9196, test_loss: 1.0212, test_f1: 0.5509
 epoch: 5, train_loss: 0.9024, test_loss: 1.0292, test_f1: 0.5307
 epoch: 6, train_loss: 0.9104, test_loss: 1.0105, test_f1: 0.5226
 epoch: 7, train_loss: 0.8652, test_loss: 1.0126, test_f1: 0.5351
 epoch: 8, train_loss: 0.8559, test_loss: 1.0355, test_f1: 0.5494
 epoch: 9, train_loss: 0.8203, test_loss: 1.0097, test_f1: 0.5496
 epoch: 10, train_loss: 0.8219, test_loss: 0.9855, test_f1: 0.5802
 epoch: 11, train_loss: 0.8019, test_loss: 1.0138, test_f1: 0.5844
 epoch: 12, train_loss: 0.7828, test_loss: 1.0120, test_f1: 0.5795
 epoch: 13, train_loss: 0.7768, test_loss: 1.0109, test_f1: 0.5763
 epoch: 14, train_loss: 0.7579, test_loss: 1.0176, test_f1: 0.5923
 epoch: 15, train_loss: 0.7517, test_loss: 1.0202, test_f1: 0.5979
 epoch: 16, train_loss: 0.7291, test_loss: 1.0184, test_f1: 0.5863
 epoch: 17, train_loss: 0.7387, test_loss: 1.0458, test_f1: 0.6163
 epoch: 18, train_loss: 0.6965, test_loss: 1.0105, test_f1: 0.6080
 epoch: 19, train_loss: 0.7193, test_loss: 1.0511, test_f1: 0.5878
 epoch: 20, train_loss: 0.6776, test_loss: 1.0754, test_f1: 0.5682
 epoch: 21, train_loss: 0.6905, test_loss: 1.0396, test_f1: 0.6115
 epoch: 22, train_loss: 0.6812, test_loss: 1.0588, test_f1: 0.6054
 epoch: 23, train_loss: 0.6582, test_loss: 1.0830, test_f1: 0.5968
 epoch: 24, train_loss: 0.6464, test_loss: 1.0540, test_f1: 0.6355
 epoch: 25, train_loss: 0.6446, test_loss: 1.1172, test_f1: 0.6157
 epoch: 26, train_loss: 0.6416, test_loss: 1.0922, test_f1: 0.6298
 epoch: 27, train_loss: 0.6036, test_loss: 1.1136, test_f1: 0.6199
 epoch: 28, train_loss: 0.6167, test_loss: 1.0974, test_f1: 0.6383
 epoch: 29, train_loss: 0.5877, test_loss: 1.1071, test_f1: 0.6452
 epoch: 30, train_loss: 0.5947, test_loss: 1.1308, test_f1: 0.6188
 epoch: 31, train_loss: 0.5781, test_loss: 1.0976, test_f1: 0.6120
 epoch: 32, train_loss: 0.5604, test_loss: 1.1332, test_f1: 0.6413
 epoch: 33, train_loss: 0.5377, test_loss: 1.1264, test_f1: 0.6558
 epoch: 34, train_loss: 0.5637, test_loss: 1.1236, test_f1: 0.6450
 epoch: 35, train_loss: 0.5384, test_loss: 1.1129, test_f1: 0.6290
 epoch: 36, train_loss: 0.5188, test_loss: 1.2060, test_f1: 0.6252
 epoch: 37, train_loss: 0.5262, test_loss: 1.2298, test_f1: 0.6265
 epoch: 38, train_loss: 0.5198, test_loss: 1.2068, test_f1: 0.6426
 epoch: 39, train_loss: 0.4979, test_loss: 1.2011, test_f1: 0.6316
 epoch: 40, train_loss: 0.5077, test_loss: 1.2006, test_f1: 0.6372
 epoch: 41, train_loss: 0.4944, test_loss: 1.2002, test_f1: 0.6378
 epoch: 42, train_loss: 0.4842, test_loss: 1.2489, test_f1: 0.6133
 epoch: 43, train_loss: 0.4655, test_loss: 1.2880, test_f1: 0.6271
 epoch: 44, train_loss: 0.4676, test_loss: 1.2914, test_f1: 0.6323
 epoch: 45, train_loss: 0.4390, test_loss: 1.2327, test_f1: 0.6540
 epoch: 46, train_loss: 0.4455, test_loss: 1.3392, test_f1: 0.6492
 epoch: 47, train_loss: 0.4433, test_loss: 1.3857, test_f1: 0.6472
 epoch: 48, train_loss: 0.4516, test_loss: 1.3659, test_f1: 0.6347
 epoch: 49, train_loss: 0.4439, test_loss: 1.3568, test_f1: 0.6341
 epoch: 50, train_loss: 0.4346, test_loss: 1.3928, test_f1: 0.6098
 epoch: 51, train_loss: 0.4119, test_loss: 1.3618, test_f1: 0.6372
 epoch: 52, train_loss: 0.3743, test_loss: 1.3677, test_f1: 0.6310
 epoch: 53, train_loss: 0.3735, test_loss: 1.3999, test_f1: 0.6363
 epoch: 54, train_loss: 0.3882, test_loss: 1.3656, test_f1: 0.6426
 epoch: 55, train_loss: 0.3760, test_loss: 1.4241, test_f1: 0.6386
 epoch: 56, train_loss: 0.3964, test_loss: 1.3803, test_f1: 0.6069
 epoch: 57, train_loss: 0.3796, test_loss: 1.3936, test_f1: 0.6417
 epoch: 58, train_loss: 0.3511, test_loss: 1.4555, test_f1: 0.6208
 epoch: 59, train_loss: 0.3624, test_loss: 1.4427, test_f1: 0.6269
 epoch: 60, train_loss: 0.3557, test_loss: 1.5063, test_f1: 0.6321
 epoch: 61, train_loss: 0.3324, test_loss: 1.4730, test_f1: 0.6301
 epoch: 62, train_loss: 0.3206, test_loss: 1.4513, test_f1: 0.6255
 epoch: 63, train_loss: 0.3345, test_loss: 1.4490, test_f1: 0.6339
 epoch: 64, train_loss: 0.3242, test_loss: 1.5294, test_f1: 0.6211
 epoch: 65, train_loss: 0.3275, test_loss: 1.5606, test_f1: 0.6231
 epoch: 66, train_loss: 0.3184, test_loss: 1.5565, test_f1: 0.6096
 epoch: 67, train_loss: 0.3098, test_loss: 1.5465, test_f1: 0.6251
 epoch: 68, train_loss: 0.3175, test_loss: 1.5457, test_f1: 0.6290
 epoch: 69, train_loss: 0.3056, test_loss: 1.5695, test_f1: 0.6258
 epoch: 70, train_loss: 0.2921, test_loss: 1.5822, test_f1: 0.6071
 epoch: 71, train_loss: 0.3156, test_loss: 1.6142, test_f1: 0.6283
 epoch: 72, train_loss: 0.2931, test_loss: 1.6221, test_f1: 0.6239
 epoch: 73, train_loss: 0.3003, test_loss: 1.6317, test_f1: 0.6156
 epoch: 74, train_loss: 0.2941, test_loss: 1.6469, test_f1: 0.6184
 epoch: 75, train_loss: 0.3013, test_loss: 1.7229, test_f1: 0.6106
 epoch: 76, train_loss: 0.3029, test_loss: 1.6776, test_f1: 0.6073
 epoch: 77, train_loss: 0.2843, test_loss: 1.7103, test_f1: 0.6144
 epoch: 78, train_loss: 0.2884, test_loss: 1.6698, test_f1: 0.6049
 epoch: 79, train_loss: 0.2786, test_loss: 1.6469, test_f1: 0.6215
 epoch: 80, train_loss: 0.2810, test_loss: 1.7582, test_f1: 0.6187
 epoch: 81, train_loss: 0.2637, test_loss: 1.6817, test_f1: 0.6108
 epoch: 82, train_loss: 0.2789, test_loss: 1.7947, test_f1: 0.6124
 epoch: 83, train_loss: 0.2669, test_loss: 1.7442, test_f1: 0.6031
 epoch: 84, train_loss: 0.2568, test_loss: 1.7387, test_f1: 0.6066
 epoch: 85, train_loss: 0.2661, test_loss: 1.7710, test_f1: 0.6091
 epoch: 86, train_loss: 0.2299, test_loss: 1.7567, test_f1: 0.6187
 epoch: 87, train_loss: 0.2667, test_loss: 1.8628, test_f1: 0.6052
 epoch: 88, train_loss: 0.2497, test_loss: 1.8904, test_f1: 0.6114
 epoch: 89, train_loss: 0.2377, test_loss: 1.8206, test_f1: 0.6222
 epoch: 90, train_loss: 0.2544, test_loss: 1.8064, test_f1: 0.6199
 epoch: 91, train_loss: 0.2639, test_loss: 1.8913, test_f1: 0.6156
 epoch: 92, train_loss: 0.2445, test_loss: 1.8535, test_f1: 0.6252
 epoch: 93, train_loss: 0.2348, test_loss: 1.8915, test_f1: 0.5916
 epoch: 94, train_loss: 0.2336, test_loss: 1.9036, test_f1: 0.6085
 epoch: 95, train_loss: 0.2352, test_loss: 1.9211, test_f1: 0.6097
 epoch: 96, train_loss: 0.2262, test_loss: 1.9426, test_f1: 0.6095
 epoch: 97, train_loss: 0.2505, test_loss: 1.9738, test_f1: 0.6107
 epoch: 98, train_loss: 0.2321, test_loss: 1.9349, test_f1: 0.6184
 epoch: 99, train_loss: 0.2270, test_loss: 1.9803, test_f1: 0.6151
##################ITERATION #9 ****************************************
 epoch: 0, train_loss: 1.2667, test_loss: 1.3218, test_f1: 0.2629
 epoch: 1, train_loss: 1.0509, test_loss: 1.0657, test_f1: 0.5193
 epoch: 2, train_loss: 1.0419, test_loss: 1.0338, test_f1: 0.5000
 epoch: 3, train_loss: 0.9516, test_loss: 1.0182, test_f1: 0.5597
 epoch: 4, train_loss: 0.9446, test_loss: 1.0044, test_f1: 0.5343
 epoch: 5, train_loss: 0.9179, test_loss: 1.0135, test_f1: 0.5473
 epoch: 6, train_loss: 0.9081, test_loss: 1.0455, test_f1: 0.5122
 epoch: 7, train_loss: 0.8564, test_loss: 1.0278, test_f1: 0.5179
 epoch: 8, train_loss: 0.8444, test_loss: 1.0024, test_f1: 0.5517
 epoch: 9, train_loss: 0.8501, test_loss: 1.0138, test_f1: 0.5633
 epoch: 10, train_loss: 0.8068, test_loss: 1.0123, test_f1: 0.5593
 epoch: 11, train_loss: 0.7921, test_loss: 1.0152, test_f1: 0.5516
 epoch: 12, train_loss: 0.7724, test_loss: 0.9920, test_f1: 0.5671
 epoch: 13, train_loss: 0.7674, test_loss: 1.0185, test_f1: 0.5762
 epoch: 14, train_loss: 0.7573, test_loss: 1.0133, test_f1: 0.5887
 epoch: 15, train_loss: 0.7391, test_loss: 1.0190, test_f1: 0.5717
 epoch: 16, train_loss: 0.7312, test_loss: 0.9956, test_f1: 0.5944
 epoch: 17, train_loss: 0.7458, test_loss: 1.0122, test_f1: 0.5996
 epoch: 18, train_loss: 0.7072, test_loss: 1.0082, test_f1: 0.5930
 epoch: 19, train_loss: 0.6936, test_loss: 1.0340, test_f1: 0.5964
 epoch: 20, train_loss: 0.7006, test_loss: 1.0370, test_f1: 0.6067
 epoch: 21, train_loss: 0.6636, test_loss: 1.0356, test_f1: 0.6036
 epoch: 22, train_loss: 0.6594, test_loss: 1.0195, test_f1: 0.6160
 epoch: 23, train_loss: 0.6502, test_loss: 1.0401, test_f1: 0.6085
 epoch: 24, train_loss: 0.6501, test_loss: 1.0492, test_f1: 0.5954
 epoch: 25, train_loss: 0.6432, test_loss: 1.0449, test_f1: 0.6129
 epoch: 26, train_loss: 0.6482, test_loss: 1.0562, test_f1: 0.6498
 epoch: 27, train_loss: 0.6133, test_loss: 1.0850, test_f1: 0.6188
 epoch: 28, train_loss: 0.6165, test_loss: 1.0944, test_f1: 0.6241
 epoch: 29, train_loss: 0.5978, test_loss: 1.0880, test_f1: 0.6246
 epoch: 30, train_loss: 0.6016, test_loss: 1.0668, test_f1: 0.6382
 epoch: 31, train_loss: 0.5579, test_loss: 1.1179, test_f1: 0.6296
 epoch: 32, train_loss: 0.5884, test_loss: 1.0891, test_f1: 0.6393
 epoch: 33, train_loss: 0.5477, test_loss: 1.1334, test_f1: 0.6214
 epoch: 34, train_loss: 0.5569, test_loss: 1.1410, test_f1: 0.6438
 epoch: 35, train_loss: 0.5479, test_loss: 1.1231, test_f1: 0.6311
 epoch: 36, train_loss: 0.5345, test_loss: 1.1236, test_f1: 0.6148
 epoch: 37, train_loss: 0.5248, test_loss: 1.1214, test_f1: 0.6209
 epoch: 38, train_loss: 0.5334, test_loss: 1.1414, test_f1: 0.6667
 epoch: 39, train_loss: 0.5278, test_loss: 1.1772, test_f1: 0.6424
 epoch: 40, train_loss: 0.5088, test_loss: 1.2271, test_f1: 0.6555
 epoch: 41, train_loss: 0.5003, test_loss: 1.2106, test_f1: 0.6504
 epoch: 42, train_loss: 0.4936, test_loss: 1.1904, test_f1: 0.6752
 epoch: 43, train_loss: 0.4714, test_loss: 1.1790, test_f1: 0.6375
 epoch: 44, train_loss: 0.4803, test_loss: 1.1877, test_f1: 0.6680
 epoch: 45, train_loss: 0.4710, test_loss: 1.2556, test_f1: 0.6608
 epoch: 46, train_loss: 0.4633, test_loss: 1.2985, test_f1: 0.6337
 epoch: 47, train_loss: 0.4566, test_loss: 1.2887, test_f1: 0.6478
 epoch: 48, train_loss: 0.4394, test_loss: 1.2825, test_f1: 0.6531
 epoch: 49, train_loss: 0.4570, test_loss: 1.2660, test_f1: 0.6513
 epoch: 50, train_loss: 0.4566, test_loss: 1.3160, test_f1: 0.6389
 epoch: 51, train_loss: 0.4160, test_loss: 1.2999, test_f1: 0.6545
 epoch: 52, train_loss: 0.4051, test_loss: 1.2986, test_f1: 0.6521
 epoch: 53, train_loss: 0.4120, test_loss: 1.3145, test_f1: 0.6632
 epoch: 54, train_loss: 0.4001, test_loss: 1.3291, test_f1: 0.6546
 epoch: 55, train_loss: 0.3899, test_loss: 1.3435, test_f1: 0.6585
 epoch: 56, train_loss: 0.3786, test_loss: 1.3470, test_f1: 0.6574
 epoch: 57, train_loss: 0.3975, test_loss: 1.3786, test_f1: 0.6415
 epoch: 58, train_loss: 0.3802, test_loss: 1.3865, test_f1: 0.6630
 epoch: 59, train_loss: 0.3638, test_loss: 1.4072, test_f1: 0.6680
 epoch: 60, train_loss: 0.3671, test_loss: 1.4486, test_f1: 0.6583
 epoch: 61, train_loss: 0.3555, test_loss: 1.3929, test_f1: 0.6525
 epoch: 62, train_loss: 0.3661, test_loss: 1.4118, test_f1: 0.6635
 epoch: 63, train_loss: 0.3531, test_loss: 1.4319, test_f1: 0.6553
 epoch: 64, train_loss: 0.3551, test_loss: 1.4321, test_f1: 0.6585
 epoch: 65, train_loss: 0.3557, test_loss: 1.4528, test_f1: 0.6501
 epoch: 66, train_loss: 0.3466, test_loss: 1.4826, test_f1: 0.6631
 epoch: 67, train_loss: 0.3275, test_loss: 1.4452, test_f1: 0.6597
 epoch: 68, train_loss: 0.3469, test_loss: 1.5034, test_f1: 0.6419
 epoch: 69, train_loss: 0.3328, test_loss: 1.4458, test_f1: 0.6539
 epoch: 70, train_loss: 0.3084, test_loss: 1.5105, test_f1: 0.6652
 epoch: 71, train_loss: 0.3342, test_loss: 1.5104, test_f1: 0.6452
 epoch: 72, train_loss: 0.3301, test_loss: 1.4981, test_f1: 0.6209
 epoch: 73, train_loss: 0.3405, test_loss: 1.5186, test_f1: 0.6507
 epoch: 74, train_loss: 0.3215, test_loss: 1.5246, test_f1: 0.6525
 epoch: 75, train_loss: 0.3207, test_loss: 1.5474, test_f1: 0.6430
 epoch: 76, train_loss: 0.3376, test_loss: 1.5498, test_f1: 0.6350
 epoch: 77, train_loss: 0.2889, test_loss: 1.5166, test_f1: 0.6452
 epoch: 78, train_loss: 0.3088, test_loss: 1.6067, test_f1: 0.6560
 epoch: 79, train_loss: 0.2934, test_loss: 1.6126, test_f1: 0.6624
 epoch: 80, train_loss: 0.3102, test_loss: 1.6517, test_f1: 0.6534
 epoch: 81, train_loss: 0.2991, test_loss: 1.6488, test_f1: 0.6408
 epoch: 82, train_loss: 0.3167, test_loss: 1.6847, test_f1: 0.6517
 epoch: 83, train_loss: 0.3000, test_loss: 1.6460, test_f1: 0.6379
 epoch: 84, train_loss: 0.2905, test_loss: 1.6648, test_f1: 0.6404
 epoch: 85, train_loss: 0.2929, test_loss: 1.6609, test_f1: 0.6462
 epoch: 86, train_loss: 0.2761, test_loss: 1.7425, test_f1: 0.6216
 epoch: 87, train_loss: 0.2883, test_loss: 1.7611, test_f1: 0.6253
 epoch: 88, train_loss: 0.2744, test_loss: 1.7425, test_f1: 0.6144
 epoch: 89, train_loss: 0.2758, test_loss: 1.7538, test_f1: 0.6392
 epoch: 90, train_loss: 0.2735, test_loss: 1.7168, test_f1: 0.6285
 epoch: 91, train_loss: 0.2737, test_loss: 1.7146, test_f1: 0.6307
 epoch: 92, train_loss: 0.2611, test_loss: 1.7464, test_f1: 0.6170
 epoch: 93, train_loss: 0.2638, test_loss: 1.7488, test_f1: 0.6415
 epoch: 94, train_loss: 0.2554, test_loss: 1.8628, test_f1: 0.6275
 epoch: 95, train_loss: 0.2616, test_loss: 1.7538, test_f1: 0.6478
 epoch: 96, train_loss: 0.2530, test_loss: 1.7821, test_f1: 0.6404
 epoch: 97, train_loss: 0.2443, test_loss: 1.8261, test_f1: 0.6392
 epoch: 98, train_loss: 0.2520, test_loss: 1.8735, test_f1: 0.6243
 epoch: 99, train_loss: 0.2748, test_loss: 1.8291, test_f1: 0.6345

Training completed in 1001.49 seconds
Best F1: 0.6752 at epoch 42
Mean F1 across iterations: 0.6532  0.0126
========================FINAL RESULTS================================
FEGIN weighted F1: 0.6752  0.0126
python main.py --data ltspice_demos --representation component_pin_net --model FEGIN --layers 4 --hiddens 128 --batch_size 32 --lr 0.0001 --emb_size 512 --epochs 100 --save_appendix component_pin_net_L4_H128_BS32_LR0.0001_E512 --no_val
-----



STDERR:
  File "main.py", line 370, in <module>
    main()
  File "main.py", line 254, in main
    dataset = dataset_class(
  File "/home/philip/projects/ltspice_examples_code_repo/Circuit-Completion-Using-GNNs/component_classification_with_link_prediction_head/evaluation/FEGIN/kernel/circuit_datasets.py", line 15, in __init__
    self.data, self.slices = torch.load(self.processed_paths[0])
  File "/home/philip/.local/lib/python3.8/site-packages/torch/serialization.py", line 1040, in load
    warnings.warn(
  File "/usr/lib/python3.8/warnings.py", line 109, in _showwarnmsg
    sw(msg.message, msg.category, msg.filename, msg.lineno,
  File "main.py", line 47, in warn_with_traceback
    traceback.print_stack(file=log)
/home/philip/projects/ltspice_examples_code_repo/Circuit-Completion-Using-GNNs/component_classification_with_link_prediction_head/evaluation/FEGIN/kernel/circuit_datasets.py:15: FutureWarning: You are using `torch.load` with `weights_only=False` (the current default value), which uses the default pickle module implicitly. It is possible to construct malicious pickle data which will execute arbitrary code during unpickling (See https://github.com/pytorch/pytorch/blob/main/SECURITY.md#untrusted-models for more details). In a future release, the default value for `weights_only` will be flipped to `True`. This limits the functions that could be executed during unpickling. Arbitrary objects will no longer be allowed to be loaded via this mode unless they are explicitly allowlisted by the user via `torch.serialization.add_safe_globals`. We recommend you start setting `weights_only=True` for any use case where you don't have full control of the loaded file. Please open an issue on GitHub for any issues related to this experimental feature.
  self.data, self.slices = torch.load(self.processed_paths[0])
