STDOUT:
Results will be saved in /home/philip/projects/ltspice_examples_code_repo/Circuit-Completion-Using-GNNs/component_classification_with_link_prediction_head/evaluation/FEGIN/results/model_FEGIN_dataset_ltspice_examples
Command line input: python main.py --data ltspice_examples --representation component_pin --model FEGIN --layers 3 --hiddens 128 --batch_size 128 --lr 0.001 --emb_size 250 --epochs 100 --save_appendix component_pin_L3_H128_BS128_LR0.001_E250 --no_val
 is saved.
-----
ltspice_examples - FEGIN
Using 3 layers, 128 hidden units, h = 2
Loading component_pin representation dataset
ENTERED
Training FEGIN on component_pin representation
Train: 3560, Test: 848
##################ITERATION #0 ****************************************
 epoch: 0, train_loss: 1.2417, test_loss: 1.2214, test_f1: 0.2335
 epoch: 1, train_loss: 1.0250, test_loss: 1.0095, test_f1: 0.4047
 epoch: 2, train_loss: 0.9295, test_loss: 0.9369, test_f1: 0.5264
 epoch: 3, train_loss: 0.8826, test_loss: 0.9448, test_f1: 0.4989
 epoch: 4, train_loss: 0.8393, test_loss: 0.9055, test_f1: 0.5483
 epoch: 5, train_loss: 0.8151, test_loss: 0.9061, test_f1: 0.5107
 epoch: 6, train_loss: 0.7943, test_loss: 0.8917, test_f1: 0.5228
 epoch: 7, train_loss: 0.7689, test_loss: 0.8617, test_f1: 0.5816
 epoch: 8, train_loss: 0.7446, test_loss: 0.9379, test_f1: 0.5433
 epoch: 9, train_loss: 0.7335, test_loss: 0.8327, test_f1: 0.5828
 epoch: 10, train_loss: 0.7263, test_loss: 0.8571, test_f1: 0.5676
 epoch: 11, train_loss: 0.7009, test_loss: 0.8240, test_f1: 0.5623
 epoch: 12, train_loss: 0.6849, test_loss: 0.8960, test_f1: 0.5612
 epoch: 13, train_loss: 0.6876, test_loss: 0.8452, test_f1: 0.5430
 epoch: 14, train_loss: 0.6910, test_loss: 0.8978, test_f1: 0.5711
 epoch: 15, train_loss: 0.6412, test_loss: 0.9647, test_f1: 0.5893
 epoch: 16, train_loss: 0.6259, test_loss: 0.8564, test_f1: 0.6242
 epoch: 17, train_loss: 0.6199, test_loss: 1.0225, test_f1: 0.5590
 epoch: 18, train_loss: 0.6022, test_loss: 0.8558, test_f1: 0.6280
 epoch: 19, train_loss: 0.5895, test_loss: 0.8926, test_f1: 0.6164
 epoch: 20, train_loss: 0.5701, test_loss: 0.8903, test_f1: 0.6390
 epoch: 21, train_loss: 0.5849, test_loss: 0.8651, test_f1: 0.5924
 epoch: 22, train_loss: 0.5654, test_loss: 0.8570, test_f1: 0.6371
 epoch: 23, train_loss: 0.5544, test_loss: 0.9825, test_f1: 0.5883
 epoch: 24, train_loss: 0.5350, test_loss: 0.9264, test_f1: 0.5779
 epoch: 25, train_loss: 0.5276, test_loss: 0.9038, test_f1: 0.6236
 epoch: 26, train_loss: 0.5182, test_loss: 0.9790, test_f1: 0.6192
 epoch: 27, train_loss: 0.5148, test_loss: 0.9091, test_f1: 0.6134
 epoch: 28, train_loss: 0.4986, test_loss: 0.8802, test_f1: 0.6279
 epoch: 29, train_loss: 0.5090, test_loss: 1.0305, test_f1: 0.6088
 epoch: 30, train_loss: 0.4817, test_loss: 1.1759, test_f1: 0.5910
 epoch: 31, train_loss: 0.4691, test_loss: 0.9705, test_f1: 0.6092
 epoch: 32, train_loss: 0.4459, test_loss: 0.9110, test_f1: 0.6486
 epoch: 33, train_loss: 0.4312, test_loss: 1.0730, test_f1: 0.6134
 epoch: 34, train_loss: 0.4317, test_loss: 1.1368, test_f1: 0.6195
 epoch: 35, train_loss: 0.4405, test_loss: 1.0439, test_f1: 0.6382
 epoch: 36, train_loss: 0.4218, test_loss: 0.9755, test_f1: 0.6411
 epoch: 37, train_loss: 0.4139, test_loss: 1.1414, test_f1: 0.5848
 epoch: 38, train_loss: 0.3918, test_loss: 1.0581, test_f1: 0.6206
 epoch: 39, train_loss: 0.3941, test_loss: 1.1895, test_f1: 0.6242
 epoch: 40, train_loss: 0.3864, test_loss: 1.0786, test_f1: 0.6090
 epoch: 41, train_loss: 0.4159, test_loss: 1.1147, test_f1: 0.6172
 epoch: 42, train_loss: 0.3596, test_loss: 1.0531, test_f1: 0.6599
 epoch: 43, train_loss: 0.3421, test_loss: 1.0737, test_f1: 0.6436
 epoch: 44, train_loss: 0.3361, test_loss: 1.0046, test_f1: 0.6761
 epoch: 45, train_loss: 0.3434, test_loss: 1.1461, test_f1: 0.6564
 epoch: 46, train_loss: 0.3374, test_loss: 1.3561, test_f1: 0.5826
 epoch: 47, train_loss: 0.3330, test_loss: 1.3468, test_f1: 0.5998
 epoch: 48, train_loss: 0.3324, test_loss: 1.4651, test_f1: 0.6310
 epoch: 49, train_loss: 0.2790, test_loss: 1.0769, test_f1: 0.6543
 epoch: 50, train_loss: 0.3075, test_loss: 1.4350, test_f1: 0.6465
 epoch: 51, train_loss: 0.2600, test_loss: 1.2447, test_f1: 0.6532
 epoch: 52, train_loss: 0.2278, test_loss: 1.1978, test_f1: 0.6709
 epoch: 53, train_loss: 0.2289, test_loss: 1.2417, test_f1: 0.6581
 epoch: 54, train_loss: 0.2135, test_loss: 1.3932, test_f1: 0.6552
 epoch: 55, train_loss: 0.2151, test_loss: 1.3633, test_f1: 0.6603
 epoch: 56, train_loss: 0.2111, test_loss: 1.3477, test_f1: 0.6680
 epoch: 57, train_loss: 0.2028, test_loss: 1.4732, test_f1: 0.6485
 epoch: 58, train_loss: 0.1886, test_loss: 1.5086, test_f1: 0.6601
 epoch: 59, train_loss: 0.1988, test_loss: 1.5496, test_f1: 0.6709
 epoch: 60, train_loss: 0.1857, test_loss: 1.6521, test_f1: 0.6321
 epoch: 61, train_loss: 0.1782, test_loss: 1.4982, test_f1: 0.6826
 epoch: 62, train_loss: 0.1844, test_loss: 1.6109, test_f1: 0.6388
 epoch: 63, train_loss: 0.1774, test_loss: 1.5194, test_f1: 0.6515
 epoch: 64, train_loss: 0.1755, test_loss: 1.7826, test_f1: 0.6496
 epoch: 65, train_loss: 0.1677, test_loss: 1.6458, test_f1: 0.6423
 epoch: 66, train_loss: 0.1875, test_loss: 1.6472, test_f1: 0.6430
 epoch: 67, train_loss: 0.1612, test_loss: 1.7314, test_f1: 0.6595
 epoch: 68, train_loss: 0.1594, test_loss: 1.6926, test_f1: 0.6489
 epoch: 69, train_loss: 0.1780, test_loss: 1.5558, test_f1: 0.6751
 epoch: 70, train_loss: 0.1694, test_loss: 1.6997, test_f1: 0.6484
 epoch: 71, train_loss: 0.1485, test_loss: 1.6770, test_f1: 0.6558
 epoch: 72, train_loss: 0.1644, test_loss: 1.9160, test_f1: 0.6156
 epoch: 73, train_loss: 0.1652, test_loss: 1.7731, test_f1: 0.6610
 epoch: 74, train_loss: 0.1397, test_loss: 1.9401, test_f1: 0.6472
 epoch: 75, train_loss: 0.1431, test_loss: 1.8532, test_f1: 0.6293
 epoch: 76, train_loss: 0.1270, test_loss: 1.6860, test_f1: 0.6673
 epoch: 77, train_loss: 0.1450, test_loss: 1.8627, test_f1: 0.6683
 epoch: 78, train_loss: 0.1405, test_loss: 1.9031, test_f1: 0.6417
 epoch: 79, train_loss: 0.1397, test_loss: 1.9296, test_f1: 0.6582
 epoch: 80, train_loss: 0.1386, test_loss: 1.9350, test_f1: 0.6648
 epoch: 81, train_loss: 0.1297, test_loss: 1.7455, test_f1: 0.6534
 epoch: 82, train_loss: 0.1123, test_loss: 1.9818, test_f1: 0.6726
 epoch: 83, train_loss: 0.1177, test_loss: 2.0751, test_f1: 0.6662
 epoch: 84, train_loss: 0.1283, test_loss: 1.9165, test_f1: 0.6506
 epoch: 85, train_loss: 0.1143, test_loss: 2.1296, test_f1: 0.6087
 epoch: 86, train_loss: 0.1270, test_loss: 2.0631, test_f1: 0.6208
 epoch: 87, train_loss: 0.1303, test_loss: 2.2836, test_f1: 0.6331
 epoch: 88, train_loss: 0.1406, test_loss: 1.7234, test_f1: 0.6701
 epoch: 89, train_loss: 0.1413, test_loss: 2.0219, test_f1: 0.6398
 epoch: 90, train_loss: 0.1307, test_loss: 2.0363, test_f1: 0.6353
 epoch: 91, train_loss: 0.1132, test_loss: 2.1348, test_f1: 0.6469
 epoch: 92, train_loss: 0.1145, test_loss: 2.0633, test_f1: 0.6615
 epoch: 93, train_loss: 0.1054, test_loss: 2.2699, test_f1: 0.6383
 epoch: 94, train_loss: 0.1201, test_loss: 2.0555, test_f1: 0.6615
 epoch: 95, train_loss: 0.1112, test_loss: 1.9736, test_f1: 0.6743
 epoch: 96, train_loss: 0.1215, test_loss: 2.0887, test_f1: 0.6813
 epoch: 97, train_loss: 0.0941, test_loss: 2.1208, test_f1: 0.6635
 epoch: 98, train_loss: 0.1065, test_loss: 2.2060, test_f1: 0.6504
 epoch: 99, train_loss: 0.0906, test_loss: 2.0815, test_f1: 0.6739
##################ITERATION #1 ****************************************
 epoch: 0, train_loss: 1.1029, test_loss: 1.2678, test_f1: 0.2260
 epoch: 1, train_loss: 0.9484, test_loss: 1.1015, test_f1: 0.4029
 epoch: 2, train_loss: 0.8829, test_loss: 0.9097, test_f1: 0.4643
 epoch: 3, train_loss: 0.8411, test_loss: 0.8463, test_f1: 0.5999
 epoch: 4, train_loss: 0.8186, test_loss: 0.9178, test_f1: 0.4998
 epoch: 5, train_loss: 0.7833, test_loss: 0.9259, test_f1: 0.5496
 epoch: 6, train_loss: 0.7448, test_loss: 0.8456, test_f1: 0.6110
 epoch: 7, train_loss: 0.7187, test_loss: 0.8886, test_f1: 0.5540
 epoch: 8, train_loss: 0.7155, test_loss: 0.8508, test_f1: 0.6385
 epoch: 9, train_loss: 0.7073, test_loss: 0.9818, test_f1: 0.5643
 epoch: 10, train_loss: 0.6760, test_loss: 0.8769, test_f1: 0.6056
 epoch: 11, train_loss: 0.6621, test_loss: 0.9363, test_f1: 0.5976
 epoch: 12, train_loss: 0.6410, test_loss: 0.9211, test_f1: 0.5767
 epoch: 13, train_loss: 0.6310, test_loss: 0.8517, test_f1: 0.6398
 epoch: 14, train_loss: 0.6530, test_loss: 0.8320, test_f1: 0.5863
 epoch: 15, train_loss: 0.6141, test_loss: 0.8913, test_f1: 0.5972
 epoch: 16, train_loss: 0.5811, test_loss: 0.8006, test_f1: 0.6455
 epoch: 17, train_loss: 0.5658, test_loss: 1.1272, test_f1: 0.5907
 epoch: 18, train_loss: 0.5456, test_loss: 0.9322, test_f1: 0.6462
 epoch: 19, train_loss: 0.5410, test_loss: 0.9003, test_f1: 0.6445
 epoch: 20, train_loss: 0.5253, test_loss: 0.9531, test_f1: 0.5973
 epoch: 21, train_loss: 0.5030, test_loss: 0.9709, test_f1: 0.6222
 epoch: 22, train_loss: 0.4884, test_loss: 1.1198, test_f1: 0.5874
 epoch: 23, train_loss: 0.4864, test_loss: 0.9611, test_f1: 0.5942
 epoch: 24, train_loss: 0.4935, test_loss: 1.0924, test_f1: 0.5811
 epoch: 25, train_loss: 0.4692, test_loss: 1.0014, test_f1: 0.6129
 epoch: 26, train_loss: 0.4561, test_loss: 1.0754, test_f1: 0.5944
 epoch: 27, train_loss: 0.4704, test_loss: 1.0606, test_f1: 0.6278
 epoch: 28, train_loss: 0.4437, test_loss: 1.0889, test_f1: 0.6613
 epoch: 29, train_loss: 0.4247, test_loss: 1.1321, test_f1: 0.6348
 epoch: 30, train_loss: 0.4269, test_loss: 1.1046, test_f1: 0.6314
 epoch: 31, train_loss: 0.3926, test_loss: 1.1350, test_f1: 0.6276
 epoch: 32, train_loss: 0.3662, test_loss: 1.1261, test_f1: 0.6539
 epoch: 33, train_loss: 0.3675, test_loss: 1.1086, test_f1: 0.6726
 epoch: 34, train_loss: 0.3500, test_loss: 1.3446, test_f1: 0.6167
 epoch: 35, train_loss: 0.3788, test_loss: 1.0594, test_f1: 0.6346
 epoch: 36, train_loss: 0.3603, test_loss: 1.3635, test_f1: 0.6379
 epoch: 37, train_loss: 0.3747, test_loss: 1.0960, test_f1: 0.6516
 epoch: 38, train_loss: 0.3635, test_loss: 1.2967, test_f1: 0.6265
 epoch: 39, train_loss: 0.3344, test_loss: 1.1639, test_f1: 0.6603
 epoch: 40, train_loss: 0.2951, test_loss: 1.4005, test_f1: 0.6262
 epoch: 41, train_loss: 0.3187, test_loss: 1.2916, test_f1: 0.6459
 epoch: 42, train_loss: 0.3226, test_loss: 1.3310, test_f1: 0.6382
 epoch: 43, train_loss: 0.3152, test_loss: 1.3050, test_f1: 0.6404
 epoch: 44, train_loss: 0.3077, test_loss: 1.2362, test_f1: 0.6492
 epoch: 45, train_loss: 0.2669, test_loss: 1.2396, test_f1: 0.6935
 epoch: 46, train_loss: 0.2824, test_loss: 1.4208, test_f1: 0.6664
 epoch: 47, train_loss: 0.2951, test_loss: 1.3736, test_f1: 0.6317
 epoch: 48, train_loss: 0.2884, test_loss: 1.5126, test_f1: 0.6140
 epoch: 49, train_loss: 0.2857, test_loss: 1.7171, test_f1: 0.6057
 epoch: 50, train_loss: 0.2743, test_loss: 1.3716, test_f1: 0.6396
 epoch: 51, train_loss: 0.2355, test_loss: 1.5079, test_f1: 0.6325
 epoch: 52, train_loss: 0.1942, test_loss: 1.5492, test_f1: 0.6240
 epoch: 53, train_loss: 0.1884, test_loss: 1.4748, test_f1: 0.6233
 epoch: 54, train_loss: 0.1952, test_loss: 1.4218, test_f1: 0.6738
 epoch: 55, train_loss: 0.1763, test_loss: 1.7112, test_f1: 0.6316
 epoch: 56, train_loss: 0.1608, test_loss: 1.6270, test_f1: 0.6602
 epoch: 57, train_loss: 0.1562, test_loss: 1.6563, test_f1: 0.6525
 epoch: 58, train_loss: 0.1668, test_loss: 1.6990, test_f1: 0.6544
 epoch: 59, train_loss: 0.1597, test_loss: 1.6233, test_f1: 0.6575
 epoch: 60, train_loss: 0.1643, test_loss: 1.9011, test_f1: 0.6237
 epoch: 61, train_loss: 0.1767, test_loss: 1.5892, test_f1: 0.6562
 epoch: 62, train_loss: 0.1469, test_loss: 1.7469, test_f1: 0.6397
 epoch: 63, train_loss: 0.1440, test_loss: 1.6092, test_f1: 0.6626
 epoch: 64, train_loss: 0.1482, test_loss: 1.9928, test_f1: 0.6249
 epoch: 65, train_loss: 0.1474, test_loss: 1.9390, test_f1: 0.6339
 epoch: 66, train_loss: 0.1558, test_loss: 1.7700, test_f1: 0.6674
 epoch: 67, train_loss: 0.1538, test_loss: 1.8177, test_f1: 0.6408
 epoch: 68, train_loss: 0.1430, test_loss: 1.7031, test_f1: 0.6641
 epoch: 69, train_loss: 0.1189, test_loss: 2.0592, test_f1: 0.6320
 epoch: 70, train_loss: 0.1260, test_loss: 1.9443, test_f1: 0.6465
 epoch: 71, train_loss: 0.1327, test_loss: 1.9240, test_f1: 0.6468
 epoch: 72, train_loss: 0.1317, test_loss: 2.1151, test_f1: 0.6271
 epoch: 73, train_loss: 0.1297, test_loss: 2.0323, test_f1: 0.6469
 epoch: 74, train_loss: 0.1290, test_loss: 1.9438, test_f1: 0.6508
 epoch: 75, train_loss: 0.1167, test_loss: 2.0649, test_f1: 0.6497
 epoch: 76, train_loss: 0.1226, test_loss: 2.0483, test_f1: 0.6273
 epoch: 77, train_loss: 0.1157, test_loss: 2.3210, test_f1: 0.6553
 epoch: 78, train_loss: 0.1279, test_loss: 1.9798, test_f1: 0.6485
 epoch: 79, train_loss: 0.1277, test_loss: 1.9855, test_f1: 0.6409
 epoch: 80, train_loss: 0.0929, test_loss: 2.1860, test_f1: 0.6181
 epoch: 81, train_loss: 0.0966, test_loss: 2.1569, test_f1: 0.6372
 epoch: 82, train_loss: 0.1098, test_loss: 2.0478, test_f1: 0.6374
 epoch: 83, train_loss: 0.1115, test_loss: 2.2423, test_f1: 0.6407
 epoch: 84, train_loss: 0.1130, test_loss: 2.0839, test_f1: 0.6592
 epoch: 85, train_loss: 0.1184, test_loss: 2.1457, test_f1: 0.6578
 epoch: 86, train_loss: 0.1057, test_loss: 2.1786, test_f1: 0.6435
 epoch: 87, train_loss: 0.1239, test_loss: 2.3269, test_f1: 0.6244
 epoch: 88, train_loss: 0.1250, test_loss: 2.0616, test_f1: 0.6753
 epoch: 89, train_loss: 0.1208, test_loss: 2.1006, test_f1: 0.6567
 epoch: 90, train_loss: 0.1038, test_loss: 2.3114, test_f1: 0.6535
 epoch: 91, train_loss: 0.0949, test_loss: 2.3406, test_f1: 0.6457
 epoch: 92, train_loss: 0.1232, test_loss: 2.2803, test_f1: 0.6078
 epoch: 93, train_loss: 0.1127, test_loss: 2.0347, test_f1: 0.6479
 epoch: 94, train_loss: 0.1133, test_loss: 2.1267, test_f1: 0.6589
 epoch: 95, train_loss: 0.1021, test_loss: 2.0283, test_f1: 0.6621
 epoch: 96, train_loss: 0.1053, test_loss: 2.2342, test_f1: 0.6399
 epoch: 97, train_loss: 0.1033, test_loss: 2.1484, test_f1: 0.6389
 epoch: 98, train_loss: 0.1023, test_loss: 2.0785, test_f1: 0.6775
 epoch: 99, train_loss: 0.0889, test_loss: 2.2497, test_f1: 0.6502
##################ITERATION #2 ****************************************
 epoch: 0, train_loss: 1.0997, test_loss: 1.1623, test_f1: 0.3114
 epoch: 1, train_loss: 0.9487, test_loss: 0.9457, test_f1: 0.4659
 epoch: 2, train_loss: 0.9010, test_loss: 0.8809, test_f1: 0.5503
 epoch: 3, train_loss: 0.8527, test_loss: 0.8962, test_f1: 0.5327
 epoch: 4, train_loss: 0.8283, test_loss: 0.9216, test_f1: 0.5469
 epoch: 5, train_loss: 0.7963, test_loss: 0.8051, test_f1: 0.5670
 epoch: 6, train_loss: 0.7685, test_loss: 0.8434, test_f1: 0.5512
 epoch: 7, train_loss: 0.7366, test_loss: 0.9359, test_f1: 0.5584
 epoch: 8, train_loss: 0.7293, test_loss: 0.8721, test_f1: 0.6061
 epoch: 9, train_loss: 0.7113, test_loss: 0.9066, test_f1: 0.5898
 epoch: 10, train_loss: 0.6972, test_loss: 0.8847, test_f1: 0.5693
 epoch: 11, train_loss: 0.6561, test_loss: 0.8527, test_f1: 0.5954
 epoch: 12, train_loss: 0.6693, test_loss: 0.7583, test_f1: 0.6233
 epoch: 13, train_loss: 0.6543, test_loss: 0.8138, test_f1: 0.6287
 epoch: 14, train_loss: 0.6280, test_loss: 0.8960, test_f1: 0.5968
 epoch: 15, train_loss: 0.6117, test_loss: 0.7612, test_f1: 0.6057
 epoch: 16, train_loss: 0.6167, test_loss: 0.7770, test_f1: 0.6305
 epoch: 17, train_loss: 0.5901, test_loss: 0.8248, test_f1: 0.6364
 epoch: 18, train_loss: 0.5899, test_loss: 1.0135, test_f1: 0.5983
 epoch: 19, train_loss: 0.5546, test_loss: 1.0063, test_f1: 0.5577
 epoch: 20, train_loss: 0.5740, test_loss: 0.8099, test_f1: 0.6498
 epoch: 21, train_loss: 0.5357, test_loss: 0.9287, test_f1: 0.6201
 epoch: 22, train_loss: 0.5391, test_loss: 0.8611, test_f1: 0.6341
 epoch: 23, train_loss: 0.5310, test_loss: 0.8285, test_f1: 0.6319
 epoch: 24, train_loss: 0.5118, test_loss: 0.8326, test_f1: 0.6597
 epoch: 25, train_loss: 0.4744, test_loss: 0.9122, test_f1: 0.5965
 epoch: 26, train_loss: 0.4784, test_loss: 0.8241, test_f1: 0.6566
 epoch: 27, train_loss: 0.4641, test_loss: 0.8978, test_f1: 0.6551
 epoch: 28, train_loss: 0.4733, test_loss: 1.0649, test_f1: 0.6122
 epoch: 29, train_loss: 0.4463, test_loss: 1.0420, test_f1: 0.6248
 epoch: 30, train_loss: 0.4512, test_loss: 0.8607, test_f1: 0.6656
 epoch: 31, train_loss: 0.4125, test_loss: 0.9136, test_f1: 0.6476
 epoch: 32, train_loss: 0.4001, test_loss: 0.9254, test_f1: 0.6607
 epoch: 33, train_loss: 0.4279, test_loss: 0.8927, test_f1: 0.6447
 epoch: 34, train_loss: 0.3925, test_loss: 1.0241, test_f1: 0.6388
 epoch: 35, train_loss: 0.4072, test_loss: 1.2367, test_f1: 0.5952
 epoch: 36, train_loss: 0.3816, test_loss: 1.0717, test_f1: 0.6328
 epoch: 37, train_loss: 0.3700, test_loss: 0.9752, test_f1: 0.6464
 epoch: 38, train_loss: 0.3440, test_loss: 1.3523, test_f1: 0.5646
 epoch: 39, train_loss: 0.3603, test_loss: 0.9949, test_f1: 0.6275
 epoch: 40, train_loss: 0.3720, test_loss: 1.0096, test_f1: 0.6374
 epoch: 41, train_loss: 0.3632, test_loss: 1.2017, test_f1: 0.6091
 epoch: 42, train_loss: 0.3445, test_loss: 0.9502, test_f1: 0.6613
 epoch: 43, train_loss: 0.3502, test_loss: 1.1433, test_f1: 0.6136
 epoch: 44, train_loss: 0.3314, test_loss: 1.0050, test_f1: 0.6336
 epoch: 45, train_loss: 0.3040, test_loss: 1.0029, test_f1: 0.6298
 epoch: 46, train_loss: 0.2844, test_loss: 1.1628, test_f1: 0.6511
 epoch: 47, train_loss: 0.3243, test_loss: 1.0501, test_f1: 0.6417
 epoch: 48, train_loss: 0.3003, test_loss: 1.1363, test_f1: 0.6272
 epoch: 49, train_loss: 0.2741, test_loss: 1.0281, test_f1: 0.6650
 epoch: 50, train_loss: 0.2671, test_loss: 1.1817, test_f1: 0.6126
 epoch: 51, train_loss: 0.2645, test_loss: 1.1118, test_f1: 0.6764
 epoch: 52, train_loss: 0.2262, test_loss: 1.1947, test_f1: 0.6556
 epoch: 53, train_loss: 0.2150, test_loss: 1.1564, test_f1: 0.6741
 epoch: 54, train_loss: 0.2066, test_loss: 1.3105, test_f1: 0.6421
 epoch: 55, train_loss: 0.2076, test_loss: 1.2124, test_f1: 0.6645
 epoch: 56, train_loss: 0.1968, test_loss: 1.3438, test_f1: 0.6371
 epoch: 57, train_loss: 0.1870, test_loss: 1.3081, test_f1: 0.6636
 epoch: 58, train_loss: 0.1837, test_loss: 1.2940, test_f1: 0.6738
 epoch: 59, train_loss: 0.1878, test_loss: 1.3012, test_f1: 0.6703
 epoch: 60, train_loss: 0.1831, test_loss: 1.3345, test_f1: 0.6456
 epoch: 61, train_loss: 0.1744, test_loss: 1.3156, test_f1: 0.6698
 epoch: 62, train_loss: 0.1662, test_loss: 1.3209, test_f1: 0.6545
 epoch: 63, train_loss: 0.1633, test_loss: 1.3989, test_f1: 0.6344
 epoch: 64, train_loss: 0.1772, test_loss: 1.4293, test_f1: 0.6565
 epoch: 65, train_loss: 0.1574, test_loss: 1.3925, test_f1: 0.6443
 epoch: 66, train_loss: 0.1639, test_loss: 1.4658, test_f1: 0.6369
 epoch: 67, train_loss: 0.1649, test_loss: 1.4759, test_f1: 0.6705
 epoch: 68, train_loss: 0.1654, test_loss: 1.4752, test_f1: 0.6769
 epoch: 69, train_loss: 0.1555, test_loss: 1.3870, test_f1: 0.6675
 epoch: 70, train_loss: 0.1577, test_loss: 1.5325, test_f1: 0.6360
 epoch: 71, train_loss: 0.1510, test_loss: 1.6050, test_f1: 0.6407
 epoch: 72, train_loss: 0.1878, test_loss: 1.5039, test_f1: 0.6510
 epoch: 73, train_loss: 0.1453, test_loss: 1.5158, test_f1: 0.6442
 epoch: 74, train_loss: 0.1443, test_loss: 1.6752, test_f1: 0.6426
 epoch: 75, train_loss: 0.1458, test_loss: 1.7283, test_f1: 0.6366
 epoch: 76, train_loss: 0.1317, test_loss: 1.6705, test_f1: 0.6478
 epoch: 77, train_loss: 0.1680, test_loss: 1.6116, test_f1: 0.6489
 epoch: 78, train_loss: 0.1479, test_loss: 1.4883, test_f1: 0.6888
 epoch: 79, train_loss: 0.1345, test_loss: 1.5925, test_f1: 0.6625
 epoch: 80, train_loss: 0.1212, test_loss: 1.9116, test_f1: 0.6046
 epoch: 81, train_loss: 0.1382, test_loss: 1.7213, test_f1: 0.6460
 epoch: 82, train_loss: 0.1247, test_loss: 1.6752, test_f1: 0.6501
 epoch: 83, train_loss: 0.1254, test_loss: 1.7289, test_f1: 0.6531
 epoch: 84, train_loss: 0.1228, test_loss: 1.6172, test_f1: 0.6609
 epoch: 85, train_loss: 0.1577, test_loss: 1.7228, test_f1: 0.6709
 epoch: 86, train_loss: 0.1507, test_loss: 1.6839, test_f1: 0.6755
 epoch: 87, train_loss: 0.1310, test_loss: 1.7435, test_f1: 0.6405
 epoch: 88, train_loss: 0.1244, test_loss: 1.7355, test_f1: 0.6544
 epoch: 89, train_loss: 0.1252, test_loss: 1.9695, test_f1: 0.6600
 epoch: 90, train_loss: 0.1198, test_loss: 1.9288, test_f1: 0.6646
 epoch: 91, train_loss: 0.1091, test_loss: 1.7692, test_f1: 0.6772
 epoch: 92, train_loss: 0.1097, test_loss: 1.8260, test_f1: 0.6649
 epoch: 93, train_loss: 0.1081, test_loss: 2.1234, test_f1: 0.6142
 epoch: 94, train_loss: 0.1062, test_loss: 1.8691, test_f1: 0.6458
 epoch: 95, train_loss: 0.1200, test_loss: 2.1103, test_f1: 0.6287
 epoch: 96, train_loss: 0.1059, test_loss: 1.8630, test_f1: 0.6414
 epoch: 97, train_loss: 0.1196, test_loss: 1.9354, test_f1: 0.6673
 epoch: 98, train_loss: 0.1113, test_loss: 1.9312, test_f1: 0.6449
 epoch: 99, train_loss: 0.1183, test_loss: 1.9536, test_f1: 0.6578
##################ITERATION #3 ****************************************
 epoch: 0, train_loss: 1.2017, test_loss: 1.3416, test_f1: 0.2772
 epoch: 1, train_loss: 0.9814, test_loss: 0.9826, test_f1: 0.4827
 epoch: 2, train_loss: 0.9178, test_loss: 0.9764, test_f1: 0.5067
 epoch: 3, train_loss: 0.8900, test_loss: 0.8886, test_f1: 0.5800
 epoch: 4, train_loss: 0.8563, test_loss: 0.8774, test_f1: 0.5991
 epoch: 5, train_loss: 0.8165, test_loss: 0.8820, test_f1: 0.5735
 epoch: 6, train_loss: 0.7998, test_loss: 0.8440, test_f1: 0.5827
 epoch: 7, train_loss: 0.7781, test_loss: 1.0307, test_f1: 0.5619
 epoch: 8, train_loss: 0.7425, test_loss: 0.9529, test_f1: 0.5399
 epoch: 9, train_loss: 0.7363, test_loss: 0.8146, test_f1: 0.6271
 epoch: 10, train_loss: 0.7006, test_loss: 0.8197, test_f1: 0.6246
 epoch: 11, train_loss: 0.7058, test_loss: 0.9163, test_f1: 0.5877
 epoch: 12, train_loss: 0.6925, test_loss: 0.7707, test_f1: 0.6619
 epoch: 13, train_loss: 0.6709, test_loss: 0.7664, test_f1: 0.6464
 epoch: 14, train_loss: 0.6650, test_loss: 0.7415, test_f1: 0.6529
 epoch: 15, train_loss: 0.6369, test_loss: 0.7603, test_f1: 0.6665
 epoch: 16, train_loss: 0.6368, test_loss: 0.7785, test_f1: 0.6601
 epoch: 17, train_loss: 0.6230, test_loss: 0.8565, test_f1: 0.6186
 epoch: 18, train_loss: 0.5786, test_loss: 1.0256, test_f1: 0.6129
 epoch: 19, train_loss: 0.5920, test_loss: 0.9201, test_f1: 0.5943
 epoch: 20, train_loss: 0.5671, test_loss: 0.8090, test_f1: 0.6485
 epoch: 21, train_loss: 0.5539, test_loss: 0.8482, test_f1: 0.6441
 epoch: 22, train_loss: 0.5503, test_loss: 0.8055, test_f1: 0.6546
 epoch: 23, train_loss: 0.5208, test_loss: 0.7627, test_f1: 0.6597
 epoch: 24, train_loss: 0.5172, test_loss: 0.8580, test_f1: 0.6653
 epoch: 25, train_loss: 0.5220, test_loss: 0.8645, test_f1: 0.6629
 epoch: 26, train_loss: 0.5027, test_loss: 0.8642, test_f1: 0.6710
 epoch: 27, train_loss: 0.4628, test_loss: 1.0797, test_f1: 0.6136
 epoch: 28, train_loss: 0.4782, test_loss: 0.9453, test_f1: 0.6425
 epoch: 29, train_loss: 0.4655, test_loss: 0.9716, test_f1: 0.6616
 epoch: 30, train_loss: 0.4562, test_loss: 0.8660, test_f1: 0.6620
 epoch: 31, train_loss: 0.4389, test_loss: 1.0477, test_f1: 0.6298
 epoch: 32, train_loss: 0.4395, test_loss: 1.0068, test_f1: 0.6524
 epoch: 33, train_loss: 0.4762, test_loss: 1.0367, test_f1: 0.5982
 epoch: 34, train_loss: 0.4386, test_loss: 1.0570, test_f1: 0.6341
 epoch: 35, train_loss: 0.4297, test_loss: 1.0080, test_f1: 0.6702
 epoch: 36, train_loss: 0.3986, test_loss: 1.1732, test_f1: 0.6076
 epoch: 37, train_loss: 0.4038, test_loss: 0.9668, test_f1: 0.6706
 epoch: 38, train_loss: 0.3866, test_loss: 1.0032, test_f1: 0.6900
 epoch: 39, train_loss: 0.3877, test_loss: 1.5924, test_f1: 0.5356
 epoch: 40, train_loss: 0.3800, test_loss: 0.9567, test_f1: 0.6821
 epoch: 41, train_loss: 0.3634, test_loss: 1.0806, test_f1: 0.6431
 epoch: 42, train_loss: 0.3624, test_loss: 1.0622, test_f1: 0.6212
 epoch: 43, train_loss: 0.3397, test_loss: 1.3558, test_f1: 0.6217
 epoch: 44, train_loss: 0.3789, test_loss: 1.2761, test_f1: 0.5469
 epoch: 45, train_loss: 0.3711, test_loss: 1.0324, test_f1: 0.6556
 epoch: 46, train_loss: 0.3478, test_loss: 1.0852, test_f1: 0.6606
 epoch: 47, train_loss: 0.3281, test_loss: 1.2345, test_f1: 0.6352
 epoch: 48, train_loss: 0.3236, test_loss: 1.0165, test_f1: 0.6662
 epoch: 49, train_loss: 0.3255, test_loss: 1.0602, test_f1: 0.6637
 epoch: 50, train_loss: 0.3174, test_loss: 1.1522, test_f1: 0.6606
 epoch: 51, train_loss: 0.2642, test_loss: 1.1129, test_f1: 0.6733
 epoch: 52, train_loss: 0.2375, test_loss: 1.1482, test_f1: 0.6941
 epoch: 53, train_loss: 0.2156, test_loss: 1.1767, test_f1: 0.6881
 epoch: 54, train_loss: 0.2340, test_loss: 1.0964, test_f1: 0.6892
 epoch: 55, train_loss: 0.2163, test_loss: 1.2438, test_f1: 0.6985
 epoch: 56, train_loss: 0.2057, test_loss: 1.2106, test_f1: 0.7011
 epoch: 57, train_loss: 0.2063, test_loss: 1.1605, test_f1: 0.6904
 epoch: 58, train_loss: 0.2108, test_loss: 1.2173, test_f1: 0.6884
 epoch: 59, train_loss: 0.2098, test_loss: 1.3173, test_f1: 0.6999
 epoch: 60, train_loss: 0.1954, test_loss: 1.3163, test_f1: 0.6687
 epoch: 61, train_loss: 0.1986, test_loss: 1.3289, test_f1: 0.6617
 epoch: 62, train_loss: 0.1946, test_loss: 1.2618, test_f1: 0.6909
 epoch: 63, train_loss: 0.1867, test_loss: 1.4749, test_f1: 0.6374
 epoch: 64, train_loss: 0.1931, test_loss: 1.4091, test_f1: 0.6914
 epoch: 65, train_loss: 0.1720, test_loss: 1.3403, test_f1: 0.6802
 epoch: 66, train_loss: 0.1706, test_loss: 1.3113, test_f1: 0.6739
 epoch: 67, train_loss: 0.1628, test_loss: 1.3677, test_f1: 0.6612
 epoch: 68, train_loss: 0.1724, test_loss: 1.4047, test_f1: 0.7058
 epoch: 69, train_loss: 0.1920, test_loss: 1.3257, test_f1: 0.6790
 epoch: 70, train_loss: 0.1725, test_loss: 1.4244, test_f1: 0.6728
 epoch: 71, train_loss: 0.1726, test_loss: 1.3795, test_f1: 0.6691
 epoch: 72, train_loss: 0.1541, test_loss: 1.3644, test_f1: 0.6934
 epoch: 73, train_loss: 0.1683, test_loss: 1.5581, test_f1: 0.6666
 epoch: 74, train_loss: 0.1803, test_loss: 1.4042, test_f1: 0.6706
 epoch: 75, train_loss: 0.1686, test_loss: 1.4196, test_f1: 0.6774
 epoch: 76, train_loss: 0.1548, test_loss: 1.4080, test_f1: 0.6736
 epoch: 77, train_loss: 0.1547, test_loss: 1.4736, test_f1: 0.6628
 epoch: 78, train_loss: 0.1461, test_loss: 1.4387, test_f1: 0.6807
 epoch: 79, train_loss: 0.1459, test_loss: 1.4551, test_f1: 0.7027
 epoch: 80, train_loss: 0.1576, test_loss: 1.6604, test_f1: 0.6588
 epoch: 81, train_loss: 0.1654, test_loss: 1.6054, test_f1: 0.6702
 epoch: 82, train_loss: 0.1394, test_loss: 1.5039, test_f1: 0.6673
 epoch: 83, train_loss: 0.1426, test_loss: 1.7532, test_f1: 0.6526
 epoch: 84, train_loss: 0.1391, test_loss: 1.4903, test_f1: 0.6858
 epoch: 85, train_loss: 0.1333, test_loss: 1.6193, test_f1: 0.6708
 epoch: 86, train_loss: 0.1479, test_loss: 1.5260, test_f1: 0.6824
 epoch: 87, train_loss: 0.1369, test_loss: 1.4886, test_f1: 0.6761
 epoch: 88, train_loss: 0.1311, test_loss: 1.6402, test_f1: 0.6745
 epoch: 89, train_loss: 0.1282, test_loss: 1.4648, test_f1: 0.6745
 epoch: 90, train_loss: 0.1360, test_loss: 1.5694, test_f1: 0.6997
 epoch: 91, train_loss: 0.1413, test_loss: 1.5189, test_f1: 0.7248
 epoch: 92, train_loss: 0.1181, test_loss: 1.7411, test_f1: 0.6719
 epoch: 93, train_loss: 0.1204, test_loss: 1.8925, test_f1: 0.6747
 epoch: 94, train_loss: 0.1272, test_loss: 1.7010, test_f1: 0.6877
 epoch: 95, train_loss: 0.1354, test_loss: 1.6688, test_f1: 0.6674
 epoch: 96, train_loss: 0.1495, test_loss: 1.5087, test_f1: 0.6859
 epoch: 97, train_loss: 0.1329, test_loss: 1.6876, test_f1: 0.6868
 epoch: 98, train_loss: 0.1254, test_loss: 1.6424, test_f1: 0.6665
 epoch: 99, train_loss: 0.1256, test_loss: 1.5775, test_f1: 0.6933
##################ITERATION #4 ****************************************
 epoch: 0, train_loss: 1.2483, test_loss: 1.2599, test_f1: 0.2709
 epoch: 1, train_loss: 1.0047, test_loss: 0.9765, test_f1: 0.4529
 epoch: 2, train_loss: 0.9358, test_loss: 0.9575, test_f1: 0.5629
 epoch: 3, train_loss: 0.8822, test_loss: 0.8928, test_f1: 0.5518
 epoch: 4, train_loss: 0.8616, test_loss: 0.8870, test_f1: 0.5572
 epoch: 5, train_loss: 0.8181, test_loss: 0.9049, test_f1: 0.5466
 epoch: 6, train_loss: 0.7896, test_loss: 0.8672, test_f1: 0.6069
 epoch: 7, train_loss: 0.7659, test_loss: 1.2953, test_f1: 0.4881
 epoch: 8, train_loss: 0.7513, test_loss: 0.8816, test_f1: 0.5883
 epoch: 9, train_loss: 0.7353, test_loss: 0.8531, test_f1: 0.6052
 epoch: 10, train_loss: 0.7175, test_loss: 0.8714, test_f1: 0.5974
 epoch: 11, train_loss: 0.6959, test_loss: 0.9068, test_f1: 0.5746
 epoch: 12, train_loss: 0.6780, test_loss: 1.1092, test_f1: 0.5407
 epoch: 13, train_loss: 0.6564, test_loss: 0.8238, test_f1: 0.5960
 epoch: 14, train_loss: 0.6407, test_loss: 0.7905, test_f1: 0.6303
 epoch: 15, train_loss: 0.6378, test_loss: 0.9261, test_f1: 0.5952
 epoch: 16, train_loss: 0.6127, test_loss: 0.8091, test_f1: 0.6587
 epoch: 17, train_loss: 0.6070, test_loss: 1.1981, test_f1: 0.5529
 epoch: 18, train_loss: 0.6031, test_loss: 0.8514, test_f1: 0.6300
 epoch: 19, train_loss: 0.5909, test_loss: 0.8396, test_f1: 0.6276
 epoch: 20, train_loss: 0.5659, test_loss: 0.9242, test_f1: 0.6193
 epoch: 21, train_loss: 0.5610, test_loss: 0.8921, test_f1: 0.6527
 epoch: 22, train_loss: 0.5384, test_loss: 1.0652, test_f1: 0.6166
 epoch: 23, train_loss: 0.5547, test_loss: 0.8637, test_f1: 0.6406
 epoch: 24, train_loss: 0.5131, test_loss: 0.8736, test_f1: 0.6420
 epoch: 25, train_loss: 0.4944, test_loss: 1.0343, test_f1: 0.6152
 epoch: 26, train_loss: 0.4975, test_loss: 1.0364, test_f1: 0.6555
 epoch: 27, train_loss: 0.5007, test_loss: 0.8779, test_f1: 0.6567
 epoch: 28, train_loss: 0.4689, test_loss: 0.8429, test_f1: 0.6569
 epoch: 29, train_loss: 0.4677, test_loss: 0.9090, test_f1: 0.6365
 epoch: 30, train_loss: 0.4755, test_loss: 0.9440, test_f1: 0.6436
 epoch: 31, train_loss: 0.4379, test_loss: 0.8840, test_f1: 0.6734
 epoch: 32, train_loss: 0.4226, test_loss: 0.9984, test_f1: 0.6321
 epoch: 33, train_loss: 0.4279, test_loss: 0.9086, test_f1: 0.6845
 epoch: 34, train_loss: 0.4133, test_loss: 1.0350, test_f1: 0.6386
 epoch: 35, train_loss: 0.4027, test_loss: 1.1194, test_f1: 0.6376
 epoch: 36, train_loss: 0.4034, test_loss: 1.0764, test_f1: 0.6155
 epoch: 37, train_loss: 0.4130, test_loss: 1.0138, test_f1: 0.6605
 epoch: 38, train_loss: 0.4041, test_loss: 1.0029, test_f1: 0.6572
 epoch: 39, train_loss: 0.3784, test_loss: 1.0792, test_f1: 0.6635
 epoch: 40, train_loss: 0.3497, test_loss: 1.0665, test_f1: 0.6166
 epoch: 41, train_loss: 0.3749, test_loss: 1.0039, test_f1: 0.6560
 epoch: 42, train_loss: 0.3587, test_loss: 1.0589, test_f1: 0.6544
 epoch: 43, train_loss: 0.3512, test_loss: 1.0780, test_f1: 0.6660
 epoch: 44, train_loss: 0.3375, test_loss: 1.1881, test_f1: 0.6507
 epoch: 45, train_loss: 0.3473, test_loss: 1.3361, test_f1: 0.6043
 epoch: 46, train_loss: 0.3304, test_loss: 1.1694, test_f1: 0.6539
 epoch: 47, train_loss: 0.3077, test_loss: 1.1694, test_f1: 0.6632
 epoch: 48, train_loss: 0.2924, test_loss: 1.2318, test_f1: 0.6350
 epoch: 49, train_loss: 0.3288, test_loss: 1.3896, test_f1: 0.6543
 epoch: 50, train_loss: 0.3406, test_loss: 1.1965, test_f1: 0.6505
 epoch: 51, train_loss: 0.2566, test_loss: 1.1285, test_f1: 0.6868
 epoch: 52, train_loss: 0.2420, test_loss: 1.3037, test_f1: 0.6534
 epoch: 53, train_loss: 0.2198, test_loss: 1.1771, test_f1: 0.7032
 epoch: 54, train_loss: 0.2154, test_loss: 1.2186, test_f1: 0.6905
 epoch: 55, train_loss: 0.2095, test_loss: 1.2147, test_f1: 0.6925
 epoch: 56, train_loss: 0.2082, test_loss: 1.2244, test_f1: 0.6682
 epoch: 57, train_loss: 0.1890, test_loss: 1.3274, test_f1: 0.6627
 epoch: 58, train_loss: 0.2179, test_loss: 1.2301, test_f1: 0.6926
 epoch: 59, train_loss: 0.1951, test_loss: 1.2761, test_f1: 0.6595
 epoch: 60, train_loss: 0.1950, test_loss: 1.3770, test_f1: 0.6564
 epoch: 61, train_loss: 0.1957, test_loss: 1.3214, test_f1: 0.6869
 epoch: 62, train_loss: 0.1794, test_loss: 1.4293, test_f1: 0.6714
 epoch: 63, train_loss: 0.1835, test_loss: 1.4412, test_f1: 0.6662
 epoch: 64, train_loss: 0.1792, test_loss: 1.4035, test_f1: 0.6635
 epoch: 65, train_loss: 0.1866, test_loss: 1.4043, test_f1: 0.6774
 epoch: 66, train_loss: 0.1780, test_loss: 1.4657, test_f1: 0.6556
 epoch: 67, train_loss: 0.1932, test_loss: 1.5610, test_f1: 0.6648
 epoch: 68, train_loss: 0.1952, test_loss: 1.4985, test_f1: 0.6908
 epoch: 69, train_loss: 0.1601, test_loss: 1.3861, test_f1: 0.6451
 epoch: 70, train_loss: 0.1655, test_loss: 1.4530, test_f1: 0.6782
 epoch: 71, train_loss: 0.1535, test_loss: 1.5703, test_f1: 0.6734
 epoch: 72, train_loss: 0.1626, test_loss: 1.5628, test_f1: 0.6665
 epoch: 73, train_loss: 0.1591, test_loss: 1.5127, test_f1: 0.6629
 epoch: 74, train_loss: 0.1624, test_loss: 1.5584, test_f1: 0.6876
 epoch: 75, train_loss: 0.1394, test_loss: 1.5551, test_f1: 0.6683
 epoch: 76, train_loss: 0.1455, test_loss: 1.6110, test_f1: 0.6442
 epoch: 77, train_loss: 0.1435, test_loss: 1.6413, test_f1: 0.6880
 epoch: 78, train_loss: 0.1324, test_loss: 1.7589, test_f1: 0.6328
 epoch: 79, train_loss: 0.1378, test_loss: 1.6946, test_f1: 0.6752
 epoch: 80, train_loss: 0.1535, test_loss: 1.6065, test_f1: 0.6780
 epoch: 81, train_loss: 0.1395, test_loss: 1.6089, test_f1: 0.6926
 epoch: 82, train_loss: 0.1352, test_loss: 1.6494, test_f1: 0.6767
 epoch: 83, train_loss: 0.1399, test_loss: 1.7390, test_f1: 0.6408
 epoch: 84, train_loss: 0.1407, test_loss: 1.6034, test_f1: 0.6750
 epoch: 85, train_loss: 0.1287, test_loss: 1.8295, test_f1: 0.6543
 epoch: 86, train_loss: 0.1280, test_loss: 1.7516, test_f1: 0.6536
 epoch: 87, train_loss: 0.1249, test_loss: 1.7478, test_f1: 0.6553
 epoch: 88, train_loss: 0.1257, test_loss: 1.6896, test_f1: 0.6810
 epoch: 89, train_loss: 0.1385, test_loss: 1.5381, test_f1: 0.6889
 epoch: 90, train_loss: 0.1283, test_loss: 1.7704, test_f1: 0.6575
 epoch: 91, train_loss: 0.1367, test_loss: 1.7757, test_f1: 0.6510
 epoch: 92, train_loss: 0.1127, test_loss: 1.7925, test_f1: 0.6555
 epoch: 93, train_loss: 0.1263, test_loss: 1.6422, test_f1: 0.6366
 epoch: 94, train_loss: 0.1473, test_loss: 1.8637, test_f1: 0.6591
 epoch: 95, train_loss: 0.1586, test_loss: 1.5983, test_f1: 0.6691
 epoch: 96, train_loss: 0.1143, test_loss: 1.6569, test_f1: 0.6682
 epoch: 97, train_loss: 0.1084, test_loss: 1.7541, test_f1: 0.6589
 epoch: 98, train_loss: 0.1195, test_loss: 1.8149, test_f1: 0.6766
 epoch: 99, train_loss: 0.1188, test_loss: 1.7540, test_f1: 0.6564
##################ITERATION #5 ****************************************
 epoch: 0, train_loss: 1.2933, test_loss: 1.5148, test_f1: 0.2804
 epoch: 1, train_loss: 1.0124, test_loss: 0.9811, test_f1: 0.5144
 epoch: 2, train_loss: 0.9270, test_loss: 0.9347, test_f1: 0.5461
 epoch: 3, train_loss: 0.8709, test_loss: 0.9090, test_f1: 0.6076
 epoch: 4, train_loss: 0.8343, test_loss: 0.8854, test_f1: 0.5975
 epoch: 5, train_loss: 0.8024, test_loss: 0.8681, test_f1: 0.6318
 epoch: 6, train_loss: 0.7999, test_loss: 0.9030, test_f1: 0.5611
 epoch: 7, train_loss: 0.7691, test_loss: 0.8293, test_f1: 0.6020
 epoch: 8, train_loss: 0.7375, test_loss: 0.8991, test_f1: 0.5788
 epoch: 9, train_loss: 0.7342, test_loss: 0.8703, test_f1: 0.6231
 epoch: 10, train_loss: 0.7076, test_loss: 0.8382, test_f1: 0.6446
 epoch: 11, train_loss: 0.7015, test_loss: 0.9741, test_f1: 0.5771
 epoch: 12, train_loss: 0.6951, test_loss: 0.8020, test_f1: 0.6144
 epoch: 13, train_loss: 0.6657, test_loss: 0.7689, test_f1: 0.6524
 epoch: 14, train_loss: 0.6638, test_loss: 0.9359, test_f1: 0.6100
 epoch: 15, train_loss: 0.6412, test_loss: 0.9160, test_f1: 0.5956
 epoch: 16, train_loss: 0.6226, test_loss: 0.9486, test_f1: 0.6036
 epoch: 17, train_loss: 0.6019, test_loss: 0.7193, test_f1: 0.6596
 epoch: 18, train_loss: 0.5960, test_loss: 1.0473, test_f1: 0.5955
 epoch: 19, train_loss: 0.5863, test_loss: 0.8781, test_f1: 0.5823
 epoch: 20, train_loss: 0.5975, test_loss: 0.9119, test_f1: 0.6078
 epoch: 21, train_loss: 0.5726, test_loss: 0.8511, test_f1: 0.6355
 epoch: 22, train_loss: 0.5638, test_loss: 0.8903, test_f1: 0.6245
 epoch: 23, train_loss: 0.5440, test_loss: 0.9812, test_f1: 0.5964
 epoch: 24, train_loss: 0.5329, test_loss: 0.8806, test_f1: 0.6265
 epoch: 25, train_loss: 0.5025, test_loss: 0.9023, test_f1: 0.6403
 epoch: 26, train_loss: 0.5042, test_loss: 0.9412, test_f1: 0.6146
 epoch: 27, train_loss: 0.5188, test_loss: 0.9597, test_f1: 0.5727
 epoch: 28, train_loss: 0.4772, test_loss: 0.8808, test_f1: 0.6391
 epoch: 29, train_loss: 0.4852, test_loss: 1.0467, test_f1: 0.6076
 epoch: 30, train_loss: 0.4472, test_loss: 0.9575, test_f1: 0.6376
 epoch: 31, train_loss: 0.4711, test_loss: 0.9395, test_f1: 0.6434
 epoch: 32, train_loss: 0.4570, test_loss: 1.1162, test_f1: 0.6011
 epoch: 33, train_loss: 0.4560, test_loss: 0.9633, test_f1: 0.6262
 epoch: 34, train_loss: 0.4284, test_loss: 1.0845, test_f1: 0.6083
 epoch: 35, train_loss: 0.4037, test_loss: 1.0320, test_f1: 0.6449
 epoch: 36, train_loss: 0.4182, test_loss: 1.1608, test_f1: 0.6072
 epoch: 37, train_loss: 0.4397, test_loss: 0.9815, test_f1: 0.6170
 epoch: 38, train_loss: 0.4100, test_loss: 1.1366, test_f1: 0.6100
 epoch: 39, train_loss: 0.3986, test_loss: 1.0879, test_f1: 0.6396
 epoch: 40, train_loss: 0.3814, test_loss: 1.0579, test_f1: 0.6334
 epoch: 41, train_loss: 0.3794, test_loss: 1.0099, test_f1: 0.6532
 epoch: 42, train_loss: 0.3719, test_loss: 1.0194, test_f1: 0.6327
 epoch: 43, train_loss: 0.3893, test_loss: 1.2697, test_f1: 0.6003
 epoch: 44, train_loss: 0.3825, test_loss: 1.0292, test_f1: 0.6581
 epoch: 45, train_loss: 0.3604, test_loss: 1.0937, test_f1: 0.6357
 epoch: 46, train_loss: 0.3410, test_loss: 1.2162, test_f1: 0.6136
 epoch: 47, train_loss: 0.3541, test_loss: 1.0664, test_f1: 0.6473
 epoch: 48, train_loss: 0.3356, test_loss: 1.0554, test_f1: 0.6571
 epoch: 49, train_loss: 0.3104, test_loss: 1.0990, test_f1: 0.6685
 epoch: 50, train_loss: 0.2929, test_loss: 1.1562, test_f1: 0.6282
 epoch: 51, train_loss: 0.2651, test_loss: 1.2712, test_f1: 0.6469
 epoch: 52, train_loss: 0.2595, test_loss: 1.2858, test_f1: 0.6404
 epoch: 53, train_loss: 0.2398, test_loss: 1.2296, test_f1: 0.6469
 epoch: 54, train_loss: 0.2331, test_loss: 1.2784, test_f1: 0.6445
 epoch: 55, train_loss: 0.2275, test_loss: 1.2317, test_f1: 0.6624
 epoch: 56, train_loss: 0.2141, test_loss: 1.2022, test_f1: 0.6464
 epoch: 57, train_loss: 0.2197, test_loss: 1.3816, test_f1: 0.6351
 epoch: 58, train_loss: 0.2105, test_loss: 1.3308, test_f1: 0.6457
 epoch: 59, train_loss: 0.2354, test_loss: 1.4636, test_f1: 0.6411
 epoch: 60, train_loss: 0.2164, test_loss: 1.3985, test_f1: 0.6493
 epoch: 61, train_loss: 0.2263, test_loss: 1.4083, test_f1: 0.6502
 epoch: 62, train_loss: 0.2125, test_loss: 1.5049, test_f1: 0.6378
 epoch: 63, train_loss: 0.2025, test_loss: 1.4485, test_f1: 0.6341
 epoch: 64, train_loss: 0.1898, test_loss: 1.4460, test_f1: 0.6477
 epoch: 65, train_loss: 0.2097, test_loss: 1.5031, test_f1: 0.6202
 epoch: 66, train_loss: 0.1984, test_loss: 1.3166, test_f1: 0.6475
 epoch: 67, train_loss: 0.1907, test_loss: 1.4452, test_f1: 0.6319
 epoch: 68, train_loss: 0.1841, test_loss: 1.4395, test_f1: 0.6562
 epoch: 69, train_loss: 0.1815, test_loss: 1.4976, test_f1: 0.6467
 epoch: 70, train_loss: 0.1815, test_loss: 1.4939, test_f1: 0.6398
 epoch: 71, train_loss: 0.1846, test_loss: 1.5890, test_f1: 0.6413
 epoch: 72, train_loss: 0.1819, test_loss: 1.7342, test_f1: 0.6101
 epoch: 73, train_loss: 0.1819, test_loss: 1.4940, test_f1: 0.6460
 epoch: 74, train_loss: 0.1876, test_loss: 1.4315, test_f1: 0.6383
 epoch: 75, train_loss: 0.1774, test_loss: 1.5621, test_f1: 0.6638
 epoch: 76, train_loss: 0.1768, test_loss: 1.4532, test_f1: 0.6513
 epoch: 77, train_loss: 0.1838, test_loss: 1.4880, test_f1: 0.6519
 epoch: 78, train_loss: 0.1807, test_loss: 1.5736, test_f1: 0.6318
 epoch: 79, train_loss: 0.1479, test_loss: 1.5276, test_f1: 0.6420
 epoch: 80, train_loss: 0.1693, test_loss: 1.6489, test_f1: 0.6422
 epoch: 81, train_loss: 0.1783, test_loss: 1.5412, test_f1: 0.6347
 epoch: 82, train_loss: 0.1722, test_loss: 1.5989, test_f1: 0.6494
 epoch: 83, train_loss: 0.1743, test_loss: 1.6511, test_f1: 0.6388
 epoch: 84, train_loss: 0.1615, test_loss: 1.6079, test_f1: 0.6542
 epoch: 85, train_loss: 0.1463, test_loss: 1.6939, test_f1: 0.6619
 epoch: 86, train_loss: 0.1588, test_loss: 1.6683, test_f1: 0.6223
 epoch: 87, train_loss: 0.1467, test_loss: 1.7007, test_f1: 0.6447
 epoch: 88, train_loss: 0.1517, test_loss: 1.7444, test_f1: 0.6577
 epoch: 89, train_loss: 0.1793, test_loss: 1.5494, test_f1: 0.6503
 epoch: 90, train_loss: 0.1396, test_loss: 1.7947, test_f1: 0.6456
 epoch: 91, train_loss: 0.1596, test_loss: 1.6244, test_f1: 0.6402
 epoch: 92, train_loss: 0.1441, test_loss: 1.8309, test_f1: 0.6340
 epoch: 93, train_loss: 0.1297, test_loss: 1.7379, test_f1: 0.6512
 epoch: 94, train_loss: 0.1274, test_loss: 1.6906, test_f1: 0.6403
 epoch: 95, train_loss: 0.1358, test_loss: 1.7928, test_f1: 0.6286
 epoch: 96, train_loss: 0.1514, test_loss: 1.8939, test_f1: 0.6122
 epoch: 97, train_loss: 0.1250, test_loss: 1.8883, test_f1: 0.6363
 epoch: 98, train_loss: 0.1364, test_loss: 1.8513, test_f1: 0.6409
 epoch: 99, train_loss: 0.1446, test_loss: 1.8944, test_f1: 0.6615
##################ITERATION #6 ****************************************
 epoch: 0, train_loss: 1.3252, test_loss: 1.2424, test_f1: 0.2831
 epoch: 1, train_loss: 1.0097, test_loss: 1.0005, test_f1: 0.4504
 epoch: 2, train_loss: 0.9514, test_loss: 0.9805, test_f1: 0.5249
 epoch: 3, train_loss: 0.9072, test_loss: 0.9593, test_f1: 0.5229
 epoch: 4, train_loss: 0.8762, test_loss: 0.9654, test_f1: 0.5517
 epoch: 5, train_loss: 0.8402, test_loss: 0.8895, test_f1: 0.6031
 epoch: 6, train_loss: 0.8034, test_loss: 0.9229, test_f1: 0.5880
 epoch: 7, train_loss: 0.8020, test_loss: 0.8710, test_f1: 0.5765
 epoch: 8, train_loss: 0.7790, test_loss: 0.9436, test_f1: 0.5732
 epoch: 9, train_loss: 0.7593, test_loss: 0.9321, test_f1: 0.5470
 epoch: 10, train_loss: 0.7346, test_loss: 0.8913, test_f1: 0.6297
 epoch: 11, train_loss: 0.7144, test_loss: 0.8854, test_f1: 0.6159
 epoch: 12, train_loss: 0.6872, test_loss: 0.8809, test_f1: 0.6012
 epoch: 13, train_loss: 0.6733, test_loss: 0.9448, test_f1: 0.5776
 epoch: 14, train_loss: 0.6559, test_loss: 0.9230, test_f1: 0.5918
 epoch: 15, train_loss: 0.6524, test_loss: 0.8907, test_f1: 0.6179
 epoch: 16, train_loss: 0.6174, test_loss: 0.8765, test_f1: 0.6232
 epoch: 17, train_loss: 0.6215, test_loss: 0.9723, test_f1: 0.6121
 epoch: 18, train_loss: 0.5915, test_loss: 0.8821, test_f1: 0.6205
 epoch: 19, train_loss: 0.5821, test_loss: 0.9074, test_f1: 0.6576
 epoch: 20, train_loss: 0.5736, test_loss: 1.0231, test_f1: 0.6189
 epoch: 21, train_loss: 0.5719, test_loss: 0.9223, test_f1: 0.6105
 epoch: 22, train_loss: 0.5499, test_loss: 1.0498, test_f1: 0.5959
 epoch: 23, train_loss: 0.5433, test_loss: 1.0003, test_f1: 0.6440
 epoch: 24, train_loss: 0.5233, test_loss: 0.9199, test_f1: 0.6399
 epoch: 25, train_loss: 0.5199, test_loss: 1.1210, test_f1: 0.6198
 epoch: 26, train_loss: 0.5061, test_loss: 0.8900, test_f1: 0.6417
 epoch: 27, train_loss: 0.4617, test_loss: 1.0549, test_f1: 0.6388
 epoch: 28, train_loss: 0.4806, test_loss: 1.0506, test_f1: 0.6297
 epoch: 29, train_loss: 0.4623, test_loss: 0.9536, test_f1: 0.6301
 epoch: 30, train_loss: 0.4660, test_loss: 1.0508, test_f1: 0.6248
 epoch: 31, train_loss: 0.4431, test_loss: 1.0742, test_f1: 0.6215
 epoch: 32, train_loss: 0.4475, test_loss: 1.0974, test_f1: 0.5904
 epoch: 33, train_loss: 0.4167, test_loss: 0.9630, test_f1: 0.6562
 epoch: 34, train_loss: 0.4081, test_loss: 1.0641, test_f1: 0.6352
 epoch: 35, train_loss: 0.4157, test_loss: 1.0634, test_f1: 0.6315
 epoch: 36, train_loss: 0.3966, test_loss: 1.1489, test_f1: 0.6064
 epoch: 37, train_loss: 0.3877, test_loss: 1.0117, test_f1: 0.6351
 epoch: 38, train_loss: 0.3658, test_loss: 1.1793, test_f1: 0.6427
 epoch: 39, train_loss: 0.3567, test_loss: 1.1624, test_f1: 0.6380
 epoch: 40, train_loss: 0.3774, test_loss: 1.0223, test_f1: 0.6600
 epoch: 41, train_loss: 0.3539, test_loss: 1.2168, test_f1: 0.6036
 epoch: 42, train_loss: 0.3182, test_loss: 1.1019, test_f1: 0.6706
 epoch: 43, train_loss: 0.3202, test_loss: 1.0819, test_f1: 0.6574
 epoch: 44, train_loss: 0.3334, test_loss: 1.1663, test_f1: 0.6471
 epoch: 45, train_loss: 0.3407, test_loss: 1.2463, test_f1: 0.6345
 epoch: 46, train_loss: 0.3248, test_loss: 1.1854, test_f1: 0.6618
 epoch: 47, train_loss: 0.3206, test_loss: 1.2305, test_f1: 0.6570
 epoch: 48, train_loss: 0.3142, test_loss: 1.2617, test_f1: 0.6277
 epoch: 49, train_loss: 0.3122, test_loss: 1.2535, test_f1: 0.6417
 epoch: 50, train_loss: 0.2733, test_loss: 1.2357, test_f1: 0.6735
 epoch: 51, train_loss: 0.2501, test_loss: 1.2318, test_f1: 0.6431
 epoch: 52, train_loss: 0.2293, test_loss: 1.3448, test_f1: 0.6384
 epoch: 53, train_loss: 0.2148, test_loss: 1.3481, test_f1: 0.6691
 epoch: 54, train_loss: 0.2159, test_loss: 1.3253, test_f1: 0.6549
 epoch: 55, train_loss: 0.2118, test_loss: 1.2628, test_f1: 0.6690
 epoch: 56, train_loss: 0.2149, test_loss: 1.3567, test_f1: 0.6630
 epoch: 57, train_loss: 0.2058, test_loss: 1.4353, test_f1: 0.6451
 epoch: 58, train_loss: 0.1801, test_loss: 1.4331, test_f1: 0.6538
 epoch: 59, train_loss: 0.1953, test_loss: 1.4429, test_f1: 0.6545
 epoch: 60, train_loss: 0.1863, test_loss: 1.3930, test_f1: 0.6715
 epoch: 61, train_loss: 0.1835, test_loss: 1.4699, test_f1: 0.6547
 epoch: 62, train_loss: 0.1923, test_loss: 1.5321, test_f1: 0.6605
 epoch: 63, train_loss: 0.1762, test_loss: 1.5801, test_f1: 0.6438
 epoch: 64, train_loss: 0.1836, test_loss: 1.5458, test_f1: 0.6577
 epoch: 65, train_loss: 0.1924, test_loss: 1.5249, test_f1: 0.6592
 epoch: 66, train_loss: 0.1800, test_loss: 1.5974, test_f1: 0.6756
 epoch: 67, train_loss: 0.1706, test_loss: 1.7124, test_f1: 0.6406
 epoch: 68, train_loss: 0.1631, test_loss: 1.6584, test_f1: 0.6558
 epoch: 69, train_loss: 0.1810, test_loss: 1.6601, test_f1: 0.6566
 epoch: 70, train_loss: 0.1730, test_loss: 1.6303, test_f1: 0.6475
 epoch: 71, train_loss: 0.1850, test_loss: 1.6888, test_f1: 0.6557
 epoch: 72, train_loss: 0.1800, test_loss: 1.6680, test_f1: 0.6512
 epoch: 73, train_loss: 0.1677, test_loss: 1.7373, test_f1: 0.6614
 epoch: 74, train_loss: 0.1586, test_loss: 1.6265, test_f1: 0.6544
 epoch: 75, train_loss: 0.1376, test_loss: 1.7972, test_f1: 0.6362
 epoch: 76, train_loss: 0.1369, test_loss: 1.7657, test_f1: 0.6756
 epoch: 77, train_loss: 0.1410, test_loss: 1.6279, test_f1: 0.6588
 epoch: 78, train_loss: 0.1454, test_loss: 1.8002, test_f1: 0.6411
 epoch: 79, train_loss: 0.1504, test_loss: 1.9573, test_f1: 0.6406
 epoch: 80, train_loss: 0.1506, test_loss: 1.6387, test_f1: 0.6515
 epoch: 81, train_loss: 0.1526, test_loss: 1.7440, test_f1: 0.6491
 epoch: 82, train_loss: 0.1635, test_loss: 1.7781, test_f1: 0.6530
 epoch: 83, train_loss: 0.1549, test_loss: 1.7921, test_f1: 0.6353
 epoch: 84, train_loss: 0.1508, test_loss: 1.8882, test_f1: 0.6423
 epoch: 85, train_loss: 0.1362, test_loss: 1.9123, test_f1: 0.6560
 epoch: 86, train_loss: 0.1322, test_loss: 1.9197, test_f1: 0.6382
 epoch: 87, train_loss: 0.1309, test_loss: 1.9009, test_f1: 0.6565
 epoch: 88, train_loss: 0.1270, test_loss: 2.0007, test_f1: 0.6499
 epoch: 89, train_loss: 0.1227, test_loss: 2.0228, test_f1: 0.6506
 epoch: 90, train_loss: 0.1412, test_loss: 1.9076, test_f1: 0.6614
 epoch: 91, train_loss: 0.1405, test_loss: 2.1178, test_f1: 0.6436
 epoch: 92, train_loss: 0.1296, test_loss: 1.8180, test_f1: 0.6381
 epoch: 93, train_loss: 0.1157, test_loss: 1.9948, test_f1: 0.6498
 epoch: 94, train_loss: 0.1153, test_loss: 2.0170, test_f1: 0.6594
 epoch: 95, train_loss: 0.1317, test_loss: 2.0832, test_f1: 0.6348
 epoch: 96, train_loss: 0.1473, test_loss: 2.2088, test_f1: 0.6309
 epoch: 97, train_loss: 0.1397, test_loss: 2.1151, test_f1: 0.6153
 epoch: 98, train_loss: 0.1214, test_loss: 2.0516, test_f1: 0.6468
 epoch: 99, train_loss: 0.1118, test_loss: 2.2849, test_f1: 0.6389
##################ITERATION #7 ****************************************
 epoch: 0, train_loss: 1.5003, test_loss: 1.5098, test_f1: 0.2841
 epoch: 1, train_loss: 0.9905, test_loss: 1.0379, test_f1: 0.4438
 epoch: 2, train_loss: 0.9239, test_loss: 0.9291, test_f1: 0.5390
 epoch: 3, train_loss: 0.8878, test_loss: 0.9265, test_f1: 0.5928
 epoch: 4, train_loss: 0.8466, test_loss: 0.9725, test_f1: 0.5251
 epoch: 5, train_loss: 0.8268, test_loss: 0.9287, test_f1: 0.5873
 epoch: 6, train_loss: 0.8172, test_loss: 0.8782, test_f1: 0.5948
 epoch: 7, train_loss: 0.7912, test_loss: 0.9513, test_f1: 0.5973
 epoch: 8, train_loss: 0.7664, test_loss: 0.8759, test_f1: 0.6230
 epoch: 9, train_loss: 0.7405, test_loss: 0.8972, test_f1: 0.5671
 epoch: 10, train_loss: 0.7271, test_loss: 0.8284, test_f1: 0.6538
 epoch: 11, train_loss: 0.7176, test_loss: 0.8614, test_f1: 0.6128
 epoch: 12, train_loss: 0.6952, test_loss: 0.8639, test_f1: 0.6289
 epoch: 13, train_loss: 0.6619, test_loss: 0.9610, test_f1: 0.5597
 epoch: 14, train_loss: 0.6732, test_loss: 0.8660, test_f1: 0.6337
 epoch: 15, train_loss: 0.6471, test_loss: 0.9600, test_f1: 0.5922
 epoch: 16, train_loss: 0.6137, test_loss: 0.9182, test_f1: 0.6243
 epoch: 17, train_loss: 0.6044, test_loss: 0.8760, test_f1: 0.6142
 epoch: 18, train_loss: 0.6112, test_loss: 0.9102, test_f1: 0.6373
 epoch: 19, train_loss: 0.5974, test_loss: 0.8100, test_f1: 0.6626
 epoch: 20, train_loss: 0.5513, test_loss: 0.8473, test_f1: 0.6357
 epoch: 21, train_loss: 0.6083, test_loss: 0.8378, test_f1: 0.6473
 epoch: 22, train_loss: 0.5430, test_loss: 0.8748, test_f1: 0.6578
 epoch: 23, train_loss: 0.5359, test_loss: 0.9523, test_f1: 0.5975
 epoch: 24, train_loss: 0.5497, test_loss: 0.9064, test_f1: 0.6446
 epoch: 25, train_loss: 0.5152, test_loss: 0.9299, test_f1: 0.6439
 epoch: 26, train_loss: 0.5427, test_loss: 0.9096, test_f1: 0.6271
 epoch: 27, train_loss: 0.4992, test_loss: 0.9422, test_f1: 0.6342
 epoch: 28, train_loss: 0.5019, test_loss: 0.9529, test_f1: 0.6128
 epoch: 29, train_loss: 0.4856, test_loss: 0.8948, test_f1: 0.6504
 epoch: 30, train_loss: 0.4778, test_loss: 0.8486, test_f1: 0.6754
 epoch: 31, train_loss: 0.4806, test_loss: 0.9804, test_f1: 0.6404
 epoch: 32, train_loss: 0.4759, test_loss: 1.0118, test_f1: 0.6169
 epoch: 33, train_loss: 0.4373, test_loss: 0.9928, test_f1: 0.6387
 epoch: 34, train_loss: 0.4175, test_loss: 0.9871, test_f1: 0.6597
 epoch: 35, train_loss: 0.4144, test_loss: 0.9537, test_f1: 0.6412
 epoch: 36, train_loss: 0.4154, test_loss: 1.0677, test_f1: 0.6509
 epoch: 37, train_loss: 0.4134, test_loss: 0.9930, test_f1: 0.6181
 epoch: 38, train_loss: 0.3923, test_loss: 1.0562, test_f1: 0.6386
 epoch: 39, train_loss: 0.3827, test_loss: 0.9845, test_f1: 0.6393
 epoch: 40, train_loss: 0.3687, test_loss: 1.0333, test_f1: 0.6581
 epoch: 41, train_loss: 0.3806, test_loss: 0.9937, test_f1: 0.6449
 epoch: 42, train_loss: 0.3745, test_loss: 0.9505, test_f1: 0.6602
 epoch: 43, train_loss: 0.3529, test_loss: 1.1664, test_f1: 0.6502
 epoch: 44, train_loss: 0.3597, test_loss: 1.0902, test_f1: 0.6319
 epoch: 45, train_loss: 0.3745, test_loss: 0.9992, test_f1: 0.6427
 epoch: 46, train_loss: 0.3648, test_loss: 1.0363, test_f1: 0.6736
 epoch: 47, train_loss: 0.3385, test_loss: 1.1123, test_f1: 0.6533
 epoch: 48, train_loss: 0.3314, test_loss: 1.1103, test_f1: 0.6216
 epoch: 49, train_loss: 0.3115, test_loss: 1.1240, test_f1: 0.6617
 epoch: 50, train_loss: 0.2960, test_loss: 1.2063, test_f1: 0.6139
 epoch: 51, train_loss: 0.2972, test_loss: 1.1218, test_f1: 0.6358
 epoch: 52, train_loss: 0.2529, test_loss: 1.0974, test_f1: 0.6904
 epoch: 53, train_loss: 0.2297, test_loss: 1.1868, test_f1: 0.6798
 epoch: 54, train_loss: 0.2288, test_loss: 1.1544, test_f1: 0.6735
 epoch: 55, train_loss: 0.2267, test_loss: 1.1149, test_f1: 0.6787
 epoch: 56, train_loss: 0.2323, test_loss: 1.2331, test_f1: 0.6759
 epoch: 57, train_loss: 0.2350, test_loss: 1.3271, test_f1: 0.6533
 epoch: 58, train_loss: 0.2193, test_loss: 1.3519, test_f1: 0.6563
 epoch: 59, train_loss: 0.2179, test_loss: 1.2430, test_f1: 0.6556
 epoch: 60, train_loss: 0.2225, test_loss: 1.3516, test_f1: 0.6669
 epoch: 61, train_loss: 0.2094, test_loss: 1.2018, test_f1: 0.6387
 epoch: 62, train_loss: 0.2067, test_loss: 1.2592, test_f1: 0.6536
 epoch: 63, train_loss: 0.2082, test_loss: 1.3650, test_f1: 0.6744
 epoch: 64, train_loss: 0.2081, test_loss: 1.3432, test_f1: 0.6451
 epoch: 65, train_loss: 0.2068, test_loss: 1.2875, test_f1: 0.6472
 epoch: 66, train_loss: 0.1915, test_loss: 1.2816, test_f1: 0.6691
 epoch: 67, train_loss: 0.1888, test_loss: 1.3099, test_f1: 0.6494
 epoch: 68, train_loss: 0.1805, test_loss: 1.4730, test_f1: 0.6554
 epoch: 69, train_loss: 0.1781, test_loss: 1.4478, test_f1: 0.6381
 epoch: 70, train_loss: 0.1875, test_loss: 1.4305, test_f1: 0.6612
 epoch: 71, train_loss: 0.1863, test_loss: 1.4669, test_f1: 0.6580
 epoch: 72, train_loss: 0.1842, test_loss: 1.4536, test_f1: 0.6514
 epoch: 73, train_loss: 0.1781, test_loss: 1.3362, test_f1: 0.6668
 epoch: 74, train_loss: 0.1710, test_loss: 1.5843, test_f1: 0.6515
 epoch: 75, train_loss: 0.1831, test_loss: 1.4359, test_f1: 0.6927
 epoch: 76, train_loss: 0.1640, test_loss: 1.4076, test_f1: 0.6830
 epoch: 77, train_loss: 0.1508, test_loss: 1.6693, test_f1: 0.6609
 epoch: 78, train_loss: 0.1745, test_loss: 1.6359, test_f1: 0.6823
 epoch: 79, train_loss: 0.1688, test_loss: 1.6743, test_f1: 0.6325
 epoch: 80, train_loss: 0.1701, test_loss: 1.5571, test_f1: 0.6423
 epoch: 81, train_loss: 0.1691, test_loss: 1.6248, test_f1: 0.6495
 epoch: 82, train_loss: 0.1754, test_loss: 1.4434, test_f1: 0.6818
 epoch: 83, train_loss: 0.1783, test_loss: 1.5948, test_f1: 0.6482
 epoch: 84, train_loss: 0.1658, test_loss: 1.4312, test_f1: 0.6607
 epoch: 85, train_loss: 0.1740, test_loss: 1.5370, test_f1: 0.6259
 epoch: 86, train_loss: 0.1629, test_loss: 1.4014, test_f1: 0.6400
 epoch: 87, train_loss: 0.1561, test_loss: 1.5281, test_f1: 0.6347
 epoch: 88, train_loss: 0.1497, test_loss: 1.5931, test_f1: 0.6567
 epoch: 89, train_loss: 0.1515, test_loss: 1.7832, test_f1: 0.6452
 epoch: 90, train_loss: 0.1339, test_loss: 1.6725, test_f1: 0.6423
 epoch: 91, train_loss: 0.1492, test_loss: 1.5133, test_f1: 0.6546
 epoch: 92, train_loss: 0.1412, test_loss: 1.6636, test_f1: 0.6598
 epoch: 93, train_loss: 0.1464, test_loss: 1.6196, test_f1: 0.6492
 epoch: 94, train_loss: 0.1516, test_loss: 1.6866, test_f1: 0.6047
 epoch: 95, train_loss: 0.1444, test_loss: 1.7668, test_f1: 0.6314
 epoch: 96, train_loss: 0.1394, test_loss: 1.6341, test_f1: 0.6385
 epoch: 97, train_loss: 0.1250, test_loss: 1.7743, test_f1: 0.6258
 epoch: 98, train_loss: 0.1456, test_loss: 1.7736, test_f1: 0.6230
 epoch: 99, train_loss: 0.1324, test_loss: 1.7131, test_f1: 0.6430
##################ITERATION #8 ****************************************
 epoch: 0, train_loss: 1.3522, test_loss: 1.3571, test_f1: 0.2260
 epoch: 1, train_loss: 0.9684, test_loss: 0.9908, test_f1: 0.4510
 epoch: 2, train_loss: 0.9116, test_loss: 0.9184, test_f1: 0.5448
 epoch: 3, train_loss: 0.8767, test_loss: 0.9100, test_f1: 0.5554
 epoch: 4, train_loss: 0.8646, test_loss: 0.8996, test_f1: 0.6093
 epoch: 5, train_loss: 0.8256, test_loss: 0.9573, test_f1: 0.5854
 epoch: 6, train_loss: 0.7908, test_loss: 0.9437, test_f1: 0.5384
 epoch: 7, train_loss: 0.7549, test_loss: 0.8854, test_f1: 0.5861
 epoch: 8, train_loss: 0.7517, test_loss: 0.8197, test_f1: 0.6112
 epoch: 9, train_loss: 0.7171, test_loss: 0.8534, test_f1: 0.6157
 epoch: 10, train_loss: 0.6956, test_loss: 0.9131, test_f1: 0.5911
 epoch: 11, train_loss: 0.6763, test_loss: 0.8302, test_f1: 0.6289
 epoch: 12, train_loss: 0.6702, test_loss: 0.8422, test_f1: 0.6087
 epoch: 13, train_loss: 0.6455, test_loss: 0.8879, test_f1: 0.6236
 epoch: 14, train_loss: 0.6382, test_loss: 0.7698, test_f1: 0.6593
 epoch: 15, train_loss: 0.6050, test_loss: 0.8219, test_f1: 0.6576
 epoch: 16, train_loss: 0.6259, test_loss: 0.8251, test_f1: 0.6239
 epoch: 17, train_loss: 0.5961, test_loss: 0.7868, test_f1: 0.6479
 epoch: 18, train_loss: 0.5884, test_loss: 0.8078, test_f1: 0.6458
 epoch: 19, train_loss: 0.5709, test_loss: 0.8417, test_f1: 0.6471
 epoch: 20, train_loss: 0.5470, test_loss: 0.7711, test_f1: 0.6485
 epoch: 21, train_loss: 0.5386, test_loss: 0.7998, test_f1: 0.6330
 epoch: 22, train_loss: 0.5223, test_loss: 0.7586, test_f1: 0.6568
 epoch: 23, train_loss: 0.5095, test_loss: 0.8347, test_f1: 0.6488
 epoch: 24, train_loss: 0.5214, test_loss: 0.7538, test_f1: 0.6774
 epoch: 25, train_loss: 0.4942, test_loss: 0.8726, test_f1: 0.6367
 epoch: 26, train_loss: 0.4712, test_loss: 0.8545, test_f1: 0.6746
 epoch: 27, train_loss: 0.4722, test_loss: 0.8246, test_f1: 0.6678
 epoch: 28, train_loss: 0.4773, test_loss: 0.9345, test_f1: 0.6503
 epoch: 29, train_loss: 0.4410, test_loss: 0.8357, test_f1: 0.6852
 epoch: 30, train_loss: 0.4271, test_loss: 0.8895, test_f1: 0.6766
 epoch: 31, train_loss: 0.4319, test_loss: 0.9438, test_f1: 0.6612
 epoch: 32, train_loss: 0.4098, test_loss: 0.8704, test_f1: 0.6840
 epoch: 33, train_loss: 0.4094, test_loss: 0.9203, test_f1: 0.6399
 epoch: 34, train_loss: 0.4286, test_loss: 0.9068, test_f1: 0.6691
 epoch: 35, train_loss: 0.3992, test_loss: 0.9002, test_f1: 0.6755
 epoch: 36, train_loss: 0.4209, test_loss: 1.0079, test_f1: 0.6536
 epoch: 37, train_loss: 0.4108, test_loss: 0.9427, test_f1: 0.6840
 epoch: 38, train_loss: 0.3736, test_loss: 0.9109, test_f1: 0.6884
 epoch: 39, train_loss: 0.3691, test_loss: 0.9074, test_f1: 0.6879
 epoch: 40, train_loss: 0.3508, test_loss: 0.9567, test_f1: 0.6931
 epoch: 41, train_loss: 0.3557, test_loss: 1.0540, test_f1: 0.6768
 epoch: 42, train_loss: 0.3358, test_loss: 1.1225, test_f1: 0.6870
 epoch: 43, train_loss: 0.4066, test_loss: 1.0136, test_f1: 0.6780
 epoch: 44, train_loss: 0.3677, test_loss: 1.1378, test_f1: 0.6595
 epoch: 45, train_loss: 0.3573, test_loss: 1.0356, test_f1: 0.6637
 epoch: 46, train_loss: 0.3226, test_loss: 0.9786, test_f1: 0.6737
 epoch: 47, train_loss: 0.3456, test_loss: 1.0596, test_f1: 0.6926
 epoch: 48, train_loss: 0.2917, test_loss: 1.1431, test_f1: 0.6751
 epoch: 49, train_loss: 0.3104, test_loss: 1.1009, test_f1: 0.6634
 epoch: 50, train_loss: 0.3078, test_loss: 1.2905, test_f1: 0.6612
 epoch: 51, train_loss: 0.2722, test_loss: 1.2503, test_f1: 0.6631
 epoch: 52, train_loss: 0.2465, test_loss: 1.2677, test_f1: 0.6841
 epoch: 53, train_loss: 0.2198, test_loss: 1.2062, test_f1: 0.6830
 epoch: 54, train_loss: 0.2169, test_loss: 1.2350, test_f1: 0.7063
 epoch: 55, train_loss: 0.1968, test_loss: 1.3516, test_f1: 0.6770
 epoch: 56, train_loss: 0.2018, test_loss: 1.3676, test_f1: 0.6809
 epoch: 57, train_loss: 0.2134, test_loss: 1.3913, test_f1: 0.6403
 epoch: 58, train_loss: 0.1876, test_loss: 1.2899, test_f1: 0.6714
 epoch: 59, train_loss: 0.1961, test_loss: 1.4094, test_f1: 0.6650
 epoch: 60, train_loss: 0.1975, test_loss: 1.3799, test_f1: 0.6578
 epoch: 61, train_loss: 0.2066, test_loss: 1.2495, test_f1: 0.6964
 epoch: 62, train_loss: 0.1824, test_loss: 1.4606, test_f1: 0.6646
 epoch: 63, train_loss: 0.1813, test_loss: 1.4374, test_f1: 0.6578
 epoch: 64, train_loss: 0.1807, test_loss: 1.3316, test_f1: 0.6960
 epoch: 65, train_loss: 0.1709, test_loss: 1.3635, test_f1: 0.6652
 epoch: 66, train_loss: 0.1728, test_loss: 1.6024, test_f1: 0.6770
 epoch: 67, train_loss: 0.1877, test_loss: 1.4841, test_f1: 0.6708
 epoch: 68, train_loss: 0.1876, test_loss: 1.4521, test_f1: 0.6758
 epoch: 69, train_loss: 0.1701, test_loss: 1.3766, test_f1: 0.6754
 epoch: 70, train_loss: 0.1576, test_loss: 1.5368, test_f1: 0.6631
 epoch: 71, train_loss: 0.1674, test_loss: 1.5776, test_f1: 0.6640
 epoch: 72, train_loss: 0.1702, test_loss: 1.6462, test_f1: 0.6678
 epoch: 73, train_loss: 0.1653, test_loss: 1.6212, test_f1: 0.6966
 epoch: 74, train_loss: 0.1643, test_loss: 1.6099, test_f1: 0.6512
 epoch: 75, train_loss: 0.1615, test_loss: 1.5232, test_f1: 0.6523
 epoch: 76, train_loss: 0.1556, test_loss: 1.5738, test_f1: 0.6606
 epoch: 77, train_loss: 0.1495, test_loss: 1.4888, test_f1: 0.6714
 epoch: 78, train_loss: 0.1429, test_loss: 1.5856, test_f1: 0.6746
 epoch: 79, train_loss: 0.1614, test_loss: 1.7907, test_f1: 0.6633
 epoch: 80, train_loss: 0.1445, test_loss: 1.7633, test_f1: 0.6538
 epoch: 81, train_loss: 0.1732, test_loss: 1.6047, test_f1: 0.6370
 epoch: 82, train_loss: 0.1680, test_loss: 1.5663, test_f1: 0.6528
 epoch: 83, train_loss: 0.1509, test_loss: 1.6439, test_f1: 0.6764
 epoch: 84, train_loss: 0.1550, test_loss: 1.7349, test_f1: 0.6637
 epoch: 85, train_loss: 0.1567, test_loss: 1.6821, test_f1: 0.6644
 epoch: 86, train_loss: 0.1378, test_loss: 1.9012, test_f1: 0.6232
 epoch: 87, train_loss: 0.1458, test_loss: 1.7595, test_f1: 0.6633
 epoch: 88, train_loss: 0.1454, test_loss: 1.8074, test_f1: 0.6489
 epoch: 89, train_loss: 0.1319, test_loss: 1.8419, test_f1: 0.6506
 epoch: 90, train_loss: 0.1451, test_loss: 1.8293, test_f1: 0.6528
 epoch: 91, train_loss: 0.1339, test_loss: 1.8560, test_f1: 0.6505
 epoch: 92, train_loss: 0.1430, test_loss: 2.0429, test_f1: 0.6158
 epoch: 93, train_loss: 0.1227, test_loss: 1.8742, test_f1: 0.6739
 epoch: 94, train_loss: 0.1189, test_loss: 1.9018, test_f1: 0.6597
 epoch: 95, train_loss: 0.1105, test_loss: 1.9125, test_f1: 0.6559
 epoch: 96, train_loss: 0.1248, test_loss: 1.8957, test_f1: 0.6510
 epoch: 97, train_loss: 0.1449, test_loss: 1.7607, test_f1: 0.6729
 epoch: 98, train_loss: 0.1329, test_loss: 1.9203, test_f1: 0.6556
 epoch: 99, train_loss: 0.1252, test_loss: 1.8285, test_f1: 0.6363
##################ITERATION #9 ****************************************
 epoch: 0, train_loss: 1.5375, test_loss: 1.3828, test_f1: 0.2363
 epoch: 1, train_loss: 1.0030, test_loss: 1.0087, test_f1: 0.5075
 epoch: 2, train_loss: 0.9363, test_loss: 0.9583, test_f1: 0.5383
 epoch: 3, train_loss: 0.8863, test_loss: 0.9862, test_f1: 0.5449
 epoch: 4, train_loss: 0.8710, test_loss: 1.0447, test_f1: 0.4923
 epoch: 5, train_loss: 0.8178, test_loss: 0.8955, test_f1: 0.5323
 epoch: 6, train_loss: 0.7882, test_loss: 0.9644, test_f1: 0.5416
 epoch: 7, train_loss: 0.7742, test_loss: 0.9270, test_f1: 0.5399
 epoch: 8, train_loss: 0.7647, test_loss: 0.9167, test_f1: 0.5752
 epoch: 9, train_loss: 0.7528, test_loss: 0.8635, test_f1: 0.5507
 epoch: 10, train_loss: 0.7195, test_loss: 0.8811, test_f1: 0.5743
 epoch: 11, train_loss: 0.6997, test_loss: 0.9198, test_f1: 0.5723
 epoch: 12, train_loss: 0.6879, test_loss: 0.9280, test_f1: 0.5607
 epoch: 13, train_loss: 0.6795, test_loss: 0.8158, test_f1: 0.5995
 epoch: 14, train_loss: 0.6573, test_loss: 0.8307, test_f1: 0.5997
 epoch: 15, train_loss: 0.6439, test_loss: 0.8101, test_f1: 0.5812
 epoch: 16, train_loss: 0.6267, test_loss: 0.8499, test_f1: 0.5990
 epoch: 17, train_loss: 0.6304, test_loss: 0.8167, test_f1: 0.6112
 epoch: 18, train_loss: 0.6117, test_loss: 0.8246, test_f1: 0.6472
 epoch: 19, train_loss: 0.5860, test_loss: 0.8995, test_f1: 0.5934
 epoch: 20, train_loss: 0.5833, test_loss: 0.7936, test_f1: 0.6143
 epoch: 21, train_loss: 0.5862, test_loss: 0.8550, test_f1: 0.6299
 epoch: 22, train_loss: 0.5643, test_loss: 0.8707, test_f1: 0.5817
 epoch: 23, train_loss: 0.5728, test_loss: 0.8225, test_f1: 0.6388
 epoch: 24, train_loss: 0.5635, test_loss: 0.8116, test_f1: 0.6253
 epoch: 25, train_loss: 0.5453, test_loss: 0.8272, test_f1: 0.6423
 epoch: 26, train_loss: 0.5119, test_loss: 0.9062, test_f1: 0.5919
 epoch: 27, train_loss: 0.5039, test_loss: 1.0372, test_f1: 0.5847
 epoch: 28, train_loss: 0.5031, test_loss: 0.7942, test_f1: 0.6527
 epoch: 29, train_loss: 0.4805, test_loss: 1.0082, test_f1: 0.5938
 epoch: 30, train_loss: 0.4906, test_loss: 0.8963, test_f1: 0.6194
 epoch: 31, train_loss: 0.4633, test_loss: 1.1413, test_f1: 0.5968
 epoch: 32, train_loss: 0.4802, test_loss: 0.8965, test_f1: 0.6103
 epoch: 33, train_loss: 0.4637, test_loss: 0.8946, test_f1: 0.6578
 epoch: 34, train_loss: 0.4603, test_loss: 1.0004, test_f1: 0.6035
 epoch: 35, train_loss: 0.4635, test_loss: 1.0118, test_f1: 0.6049
 epoch: 36, train_loss: 0.4286, test_loss: 0.9841, test_f1: 0.6224
 epoch: 37, train_loss: 0.4159, test_loss: 0.8982, test_f1: 0.6574
 epoch: 38, train_loss: 0.4357, test_loss: 1.0809, test_f1: 0.6163
 epoch: 39, train_loss: 0.4174, test_loss: 0.8357, test_f1: 0.6907
 epoch: 40, train_loss: 0.4021, test_loss: 0.9223, test_f1: 0.6500
 epoch: 41, train_loss: 0.3960, test_loss: 1.0304, test_f1: 0.6276
 epoch: 42, train_loss: 0.3803, test_loss: 0.9335, test_f1: 0.6655
 epoch: 43, train_loss: 0.3702, test_loss: 1.2058, test_f1: 0.6131
 epoch: 44, train_loss: 0.3795, test_loss: 0.9453, test_f1: 0.6486
 epoch: 45, train_loss: 0.3713, test_loss: 0.9303, test_f1: 0.6428
 epoch: 46, train_loss: 0.3665, test_loss: 1.0166, test_f1: 0.6604
 epoch: 47, train_loss: 0.3422, test_loss: 0.9781, test_f1: 0.6934
 epoch: 48, train_loss: 0.3392, test_loss: 1.1064, test_f1: 0.6432
 epoch: 49, train_loss: 0.3552, test_loss: 0.8431, test_f1: 0.6853
 epoch: 50, train_loss: 0.3724, test_loss: 1.0898, test_f1: 0.6393
 epoch: 51, train_loss: 0.3173, test_loss: 0.9913, test_f1: 0.6715
 epoch: 52, train_loss: 0.2725, test_loss: 1.0142, test_f1: 0.6520
 epoch: 53, train_loss: 0.2713, test_loss: 1.0152, test_f1: 0.6823
 epoch: 54, train_loss: 0.2558, test_loss: 1.0520, test_f1: 0.6766
 epoch: 55, train_loss: 0.2451, test_loss: 1.0897, test_f1: 0.6866
 epoch: 56, train_loss: 0.2550, test_loss: 1.1500, test_f1: 0.6684
 epoch: 57, train_loss: 0.2538, test_loss: 1.0419, test_f1: 0.6842
 epoch: 58, train_loss: 0.2421, test_loss: 1.0571, test_f1: 0.6869
 epoch: 59, train_loss: 0.2348, test_loss: 1.0811, test_f1: 0.6679
 epoch: 60, train_loss: 0.2338, test_loss: 1.0964, test_f1: 0.6678
 epoch: 61, train_loss: 0.2212, test_loss: 1.2667, test_f1: 0.6582
 epoch: 62, train_loss: 0.2208, test_loss: 1.0399, test_f1: 0.6892
 epoch: 63, train_loss: 0.2030, test_loss: 1.1515, test_f1: 0.6829
 epoch: 64, train_loss: 0.2075, test_loss: 1.2426, test_f1: 0.6649
 epoch: 65, train_loss: 0.2004, test_loss: 1.2609, test_f1: 0.6548
 epoch: 66, train_loss: 0.2057, test_loss: 1.1524, test_f1: 0.6787
 epoch: 67, train_loss: 0.2132, test_loss: 1.1845, test_f1: 0.6840
 epoch: 68, train_loss: 0.2053, test_loss: 1.2208, test_f1: 0.6776
 epoch: 69, train_loss: 0.1943, test_loss: 1.2380, test_f1: 0.6637
 epoch: 70, train_loss: 0.1908, test_loss: 1.2410, test_f1: 0.6647
 epoch: 71, train_loss: 0.2009, test_loss: 1.3602, test_f1: 0.6803
 epoch: 72, train_loss: 0.1949, test_loss: 1.3696, test_f1: 0.6801
 epoch: 73, train_loss: 0.1712, test_loss: 1.3853, test_f1: 0.6711
 epoch: 74, train_loss: 0.1745, test_loss: 1.3474, test_f1: 0.6987
 epoch: 75, train_loss: 0.1786, test_loss: 1.4035, test_f1: 0.6654
 epoch: 76, train_loss: 0.1930, test_loss: 1.3650, test_f1: 0.6808
 epoch: 77, train_loss: 0.1900, test_loss: 1.4529, test_f1: 0.6849
 epoch: 78, train_loss: 0.2046, test_loss: 1.2831, test_f1: 0.7005
 epoch: 79, train_loss: 0.1708, test_loss: 1.3820, test_f1: 0.6954
 epoch: 80, train_loss: 0.1673, test_loss: 1.3847, test_f1: 0.6596
 epoch: 81, train_loss: 0.2011, test_loss: 1.4234, test_f1: 0.6738
 epoch: 82, train_loss: 0.1683, test_loss: 1.4890, test_f1: 0.6629
 epoch: 83, train_loss: 0.1676, test_loss: 1.4418, test_f1: 0.6812
 epoch: 84, train_loss: 0.1762, test_loss: 1.5349, test_f1: 0.6835
 epoch: 85, train_loss: 0.1675, test_loss: 1.4883, test_f1: 0.6779
 epoch: 86, train_loss: 0.1642, test_loss: 1.6482, test_f1: 0.6798
 epoch: 87, train_loss: 0.1766, test_loss: 1.5099, test_f1: 0.6721
 epoch: 88, train_loss: 0.1617, test_loss: 1.5177, test_f1: 0.6802
 epoch: 89, train_loss: 0.1581, test_loss: 1.4954, test_f1: 0.7042
 epoch: 90, train_loss: 0.1424, test_loss: 1.5374, test_f1: 0.6751
 epoch: 91, train_loss: 0.1535, test_loss: 1.7988, test_f1: 0.6729
 epoch: 92, train_loss: 0.1456, test_loss: 1.6062, test_f1: 0.6616
 epoch: 93, train_loss: 0.1651, test_loss: 1.5449, test_f1: 0.6703
 epoch: 94, train_loss: 0.1342, test_loss: 1.7273, test_f1: 0.6751
 epoch: 95, train_loss: 0.1644, test_loss: 1.4866, test_f1: 0.6945
 epoch: 96, train_loss: 0.1403, test_loss: 1.6050, test_f1: 0.6782
 epoch: 97, train_loss: 0.1528, test_loss: 1.4880, test_f1: 0.6756
 epoch: 98, train_loss: 0.1582, test_loss: 1.6783, test_f1: 0.6538
 epoch: 99, train_loss: 0.1264, test_loss: 1.7008, test_f1: 0.6694

Training completed in 517.37 seconds
Best F1: 0.7248 at epoch 91
Mean F1 across iterations: 0.6940  0.0156
========================FINAL RESULTS================================
FEGIN weighted F1: 0.7248  0.0156
python main.py --data ltspice_examples --representation component_pin --model FEGIN --layers 3 --hiddens 128 --batch_size 128 --lr 0.001 --emb_size 250 --epochs 100 --save_appendix component_pin_L3_H128_BS128_LR0.001_E250 --no_val
-----



STDERR:
  File "main.py", line 370, in <module>
    main()
  File "main.py", line 254, in main
    dataset = dataset_class(
  File "/home/philip/projects/ltspice_examples_code_repo/Circuit-Completion-Using-GNNs/component_classification_with_link_prediction_head/evaluation/FEGIN/kernel/circuit_datasets.py", line 15, in __init__
    self.data, self.slices = torch.load(self.processed_paths[0])
  File "/home/philip/.local/lib/python3.8/site-packages/torch/serialization.py", line 1040, in load
    warnings.warn(
  File "/usr/lib/python3.8/warnings.py", line 109, in _showwarnmsg
    sw(msg.message, msg.category, msg.filename, msg.lineno,
  File "main.py", line 47, in warn_with_traceback
    traceback.print_stack(file=log)
/home/philip/projects/ltspice_examples_code_repo/Circuit-Completion-Using-GNNs/component_classification_with_link_prediction_head/evaluation/FEGIN/kernel/circuit_datasets.py:15: FutureWarning: You are using `torch.load` with `weights_only=False` (the current default value), which uses the default pickle module implicitly. It is possible to construct malicious pickle data which will execute arbitrary code during unpickling (See https://github.com/pytorch/pytorch/blob/main/SECURITY.md#untrusted-models for more details). In a future release, the default value for `weights_only` will be flipped to `True`. This limits the functions that could be executed during unpickling. Arbitrary objects will no longer be allowed to be loaded via this mode unless they are explicitly allowlisted by the user via `torch.serialization.add_safe_globals`. We recommend you start setting `weights_only=True` for any use case where you don't have full control of the loaded file. Please open an issue on GitHub for any issues related to this experimental feature.
  self.data, self.slices = torch.load(self.processed_paths[0])
