STDOUT:
Results will be saved in /home/philip/projects/ltspice_examples_code_repo/Circuit-Completion-Using-GNNs/component_classification_with_link_prediction_head/evaluation/FEGIN/results/model_FEGIN_dataset_ltspice_examples
Command line input: python main.py --data ltspice_examples --representation component_pin --model FEGIN --layers 5 --hiddens 16 --batch_size 256 --lr 0.001 --emb_size 128 --epochs 100 --save_appendix component_pin_L5_H16_BS256_LR0.001_E128 --no_val
 is saved.
-----
ltspice_examples - FEGIN
Using 5 layers, 16 hidden units, h = 2
Loading component_pin representation dataset
ENTERED
Training FEGIN on component_pin representation
Train: 3560, Test: 848
##################ITERATION #0 ****************************************
 epoch: 0, train_loss: 1.4368, test_loss: 1.4214, test_f1: 0.1017
 epoch: 1, train_loss: 1.4145, test_loss: 1.4059, test_f1: 0.1017
 epoch: 2, train_loss: 1.3940, test_loss: 1.3844, test_f1: 0.1017
 epoch: 3, train_loss: 1.3658, test_loss: 1.3537, test_f1: 0.2076
 epoch: 4, train_loss: 1.3377, test_loss: 1.3245, test_f1: 0.2461
 epoch: 5, train_loss: 1.3115, test_loss: 1.2997, test_f1: 0.2485
 epoch: 6, train_loss: 1.2928, test_loss: 1.2721, test_f1: 0.2532
 epoch: 7, train_loss: 1.2624, test_loss: 1.2445, test_f1: 0.2260
 epoch: 8, train_loss: 1.2362, test_loss: 1.2118, test_f1: 0.2508
 epoch: 9, train_loss: 1.2020, test_loss: 1.1775, test_f1: 0.3865
 epoch: 10, train_loss: 1.1788, test_loss: 1.1315, test_f1: 0.3963
 epoch: 11, train_loss: 1.1462, test_loss: 1.1040, test_f1: 0.3883
 epoch: 12, train_loss: 1.1169, test_loss: 1.1108, test_f1: 0.3666
 epoch: 13, train_loss: 1.0987, test_loss: 1.0843, test_f1: 0.3944
 epoch: 14, train_loss: 1.0881, test_loss: 1.2640, test_f1: 0.3356
 epoch: 15, train_loss: 1.0904, test_loss: 1.0513, test_f1: 0.3755
 epoch: 16, train_loss: 1.0772, test_loss: 1.1047, test_f1: 0.3678
 epoch: 17, train_loss: 1.0650, test_loss: 1.0266, test_f1: 0.4018
 epoch: 18, train_loss: 1.0553, test_loss: 1.0723, test_f1: 0.3875
 epoch: 19, train_loss: 1.0423, test_loss: 1.0258, test_f1: 0.3832
 epoch: 20, train_loss: 1.0323, test_loss: 1.0233, test_f1: 0.4281
 epoch: 21, train_loss: 1.0236, test_loss: 1.0116, test_f1: 0.4010
 epoch: 22, train_loss: 1.0179, test_loss: 1.0305, test_f1: 0.4286
 epoch: 23, train_loss: 1.0133, test_loss: 1.0222, test_f1: 0.4628
 epoch: 24, train_loss: 1.0079, test_loss: 1.0930, test_f1: 0.4270
 epoch: 25, train_loss: 1.0052, test_loss: 0.9960, test_f1: 0.4431
 epoch: 26, train_loss: 0.9836, test_loss: 1.0458, test_f1: 0.4499
 epoch: 27, train_loss: 0.9841, test_loss: 1.0000, test_f1: 0.4805
 epoch: 28, train_loss: 0.9742, test_loss: 1.0067, test_f1: 0.4831
 epoch: 29, train_loss: 0.9757, test_loss: 1.0499, test_f1: 0.5134
 epoch: 30, train_loss: 0.9715, test_loss: 1.1276, test_f1: 0.4264
 epoch: 31, train_loss: 0.9550, test_loss: 1.1515, test_f1: 0.4404
 epoch: 32, train_loss: 0.9548, test_loss: 1.0551, test_f1: 0.4936
 epoch: 33, train_loss: 0.9506, test_loss: 0.9879, test_f1: 0.5046
 epoch: 34, train_loss: 0.9485, test_loss: 1.0186, test_f1: 0.4872
 epoch: 35, train_loss: 0.9454, test_loss: 1.2583, test_f1: 0.4499
 epoch: 36, train_loss: 0.9370, test_loss: 1.0985, test_f1: 0.4814
 epoch: 37, train_loss: 0.9392, test_loss: 0.9944, test_f1: 0.5171
 epoch: 38, train_loss: 0.9435, test_loss: 1.1570, test_f1: 0.4873
 epoch: 39, train_loss: 0.9347, test_loss: 1.0887, test_f1: 0.4696
 epoch: 40, train_loss: 0.9415, test_loss: 1.0138, test_f1: 0.4704
 epoch: 41, train_loss: 0.9269, test_loss: 0.9781, test_f1: 0.5292
 epoch: 42, train_loss: 0.9284, test_loss: 1.0513, test_f1: 0.4781
 epoch: 43, train_loss: 0.9166, test_loss: 0.9945, test_f1: 0.4931
 epoch: 44, train_loss: 0.9090, test_loss: 0.9524, test_f1: 0.5153
 epoch: 45, train_loss: 0.9057, test_loss: 0.9760, test_f1: 0.5257
 epoch: 46, train_loss: 0.9014, test_loss: 1.0737, test_f1: 0.4845
 epoch: 47, train_loss: 0.8922, test_loss: 0.9553, test_f1: 0.5061
 epoch: 48, train_loss: 0.8949, test_loss: 1.0190, test_f1: 0.5057
 epoch: 49, train_loss: 0.8915, test_loss: 0.9798, test_f1: 0.5045
 epoch: 50, train_loss: 0.8941, test_loss: 0.9618, test_f1: 0.5144
 epoch: 51, train_loss: 0.8815, test_loss: 1.0876, test_f1: 0.5064
 epoch: 52, train_loss: 0.8742, test_loss: 1.0018, test_f1: 0.5117
 epoch: 53, train_loss: 0.8777, test_loss: 1.0043, test_f1: 0.5230
 epoch: 54, train_loss: 0.8803, test_loss: 0.9647, test_f1: 0.5298
 epoch: 55, train_loss: 0.8687, test_loss: 0.9658, test_f1: 0.5211
 epoch: 56, train_loss: 0.8694, test_loss: 1.0179, test_f1: 0.5178
 epoch: 57, train_loss: 0.8717, test_loss: 0.9614, test_f1: 0.5302
 epoch: 58, train_loss: 0.8627, test_loss: 0.9360, test_f1: 0.5203
 epoch: 59, train_loss: 0.8659, test_loss: 0.9768, test_f1: 0.5125
 epoch: 60, train_loss: 0.8554, test_loss: 0.9802, test_f1: 0.5262
 epoch: 61, train_loss: 0.8597, test_loss: 1.0648, test_f1: 0.5160
 epoch: 62, train_loss: 0.8557, test_loss: 0.9011, test_f1: 0.5225
 epoch: 63, train_loss: 0.8583, test_loss: 1.0163, test_f1: 0.5092
 epoch: 64, train_loss: 0.8574, test_loss: 0.9516, test_f1: 0.5207
 epoch: 65, train_loss: 0.8557, test_loss: 1.1076, test_f1: 0.5055
 epoch: 66, train_loss: 0.8464, test_loss: 0.9438, test_f1: 0.5244
 epoch: 67, train_loss: 0.8467, test_loss: 0.9681, test_f1: 0.5247
 epoch: 68, train_loss: 0.8456, test_loss: 0.9690, test_f1: 0.5322
 epoch: 69, train_loss: 0.8401, test_loss: 0.9478, test_f1: 0.5338
 epoch: 70, train_loss: 0.8368, test_loss: 0.9421, test_f1: 0.5414
 epoch: 71, train_loss: 0.8397, test_loss: 0.9345, test_f1: 0.5422
 epoch: 72, train_loss: 0.8323, test_loss: 0.9463, test_f1: 0.5424
 epoch: 73, train_loss: 0.8358, test_loss: 0.9652, test_f1: 0.5168
 epoch: 74, train_loss: 0.8256, test_loss: 1.0228, test_f1: 0.5251
 epoch: 75, train_loss: 0.8343, test_loss: 0.9327, test_f1: 0.5391
 epoch: 76, train_loss: 0.8264, test_loss: 0.9554, test_f1: 0.5362
 epoch: 77, train_loss: 0.8240, test_loss: 0.9141, test_f1: 0.5319
 epoch: 78, train_loss: 0.8228, test_loss: 0.9424, test_f1: 0.5220
 epoch: 79, train_loss: 0.8288, test_loss: 1.0121, test_f1: 0.5312
 epoch: 80, train_loss: 0.8236, test_loss: 0.9253, test_f1: 0.5389
 epoch: 81, train_loss: 0.8214, test_loss: 1.0125, test_f1: 0.5230
 epoch: 82, train_loss: 0.8290, test_loss: 0.9231, test_f1: 0.5633
 epoch: 83, train_loss: 0.8235, test_loss: 0.9462, test_f1: 0.5482
 epoch: 84, train_loss: 0.8113, test_loss: 0.9289, test_f1: 0.5432
 epoch: 85, train_loss: 0.8174, test_loss: 0.8908, test_f1: 0.5417
 epoch: 86, train_loss: 0.8138, test_loss: 0.9916, test_f1: 0.5227
 epoch: 87, train_loss: 0.8153, test_loss: 0.9270, test_f1: 0.5494
 epoch: 88, train_loss: 0.8055, test_loss: 0.9051, test_f1: 0.5345
 epoch: 89, train_loss: 0.8042, test_loss: 0.8922, test_f1: 0.5299
 epoch: 90, train_loss: 0.8023, test_loss: 0.9835, test_f1: 0.5413
 epoch: 91, train_loss: 0.8058, test_loss: 0.8929, test_f1: 0.5612
 epoch: 92, train_loss: 0.8042, test_loss: 0.9883, test_f1: 0.5076
 epoch: 93, train_loss: 0.8000, test_loss: 0.9414, test_f1: 0.5544
 epoch: 94, train_loss: 0.8241, test_loss: 0.8648, test_f1: 0.5659
 epoch: 95, train_loss: 0.8019, test_loss: 0.9677, test_f1: 0.5427
 epoch: 96, train_loss: 0.8002, test_loss: 0.8919, test_f1: 0.5522
 epoch: 97, train_loss: 0.7959, test_loss: 0.9253, test_f1: 0.5389
 epoch: 98, train_loss: 0.8017, test_loss: 0.9163, test_f1: 0.5516
 epoch: 99, train_loss: 0.7856, test_loss: 0.8752, test_f1: 0.5463
##################ITERATION #1 ****************************************
 epoch: 0, train_loss: 1.3513, test_loss: 1.3516, test_f1: 0.1017
 epoch: 1, train_loss: 1.2818, test_loss: 1.3267, test_f1: 0.2450
 epoch: 2, train_loss: 1.2333, test_loss: 1.2706, test_f1: 0.2260
 epoch: 3, train_loss: 1.1910, test_loss: 1.1798, test_f1: 0.3419
 epoch: 4, train_loss: 1.1536, test_loss: 1.1393, test_f1: 0.3197
 epoch: 5, train_loss: 1.1201, test_loss: 1.1259, test_f1: 0.3195
 epoch: 6, train_loss: 1.0942, test_loss: 1.1091, test_f1: 0.3307
 epoch: 7, train_loss: 1.0798, test_loss: 1.0970, test_f1: 0.3419
 epoch: 8, train_loss: 1.0587, test_loss: 1.1244, test_f1: 0.3227
 epoch: 9, train_loss: 1.0485, test_loss: 1.1310, test_f1: 0.3212
 epoch: 10, train_loss: 1.0342, test_loss: 1.0894, test_f1: 0.3667
 epoch: 11, train_loss: 1.0357, test_loss: 1.0478, test_f1: 0.3975
 epoch: 12, train_loss: 1.0302, test_loss: 1.0939, test_f1: 0.4481
 epoch: 13, train_loss: 1.0266, test_loss: 1.0926, test_f1: 0.4447
 epoch: 14, train_loss: 1.0189, test_loss: 1.0980, test_f1: 0.4346
 epoch: 15, train_loss: 1.0028, test_loss: 1.0865, test_f1: 0.4380
 epoch: 16, train_loss: 0.9956, test_loss: 1.0698, test_f1: 0.4507
 epoch: 17, train_loss: 0.9935, test_loss: 1.0769, test_f1: 0.4553
 epoch: 18, train_loss: 0.9774, test_loss: 1.0787, test_f1: 0.4342
 epoch: 19, train_loss: 0.9762, test_loss: 1.0344, test_f1: 0.4583
 epoch: 20, train_loss: 0.9739, test_loss: 1.0752, test_f1: 0.4689
 epoch: 21, train_loss: 0.9722, test_loss: 1.0603, test_f1: 0.4732
 epoch: 22, train_loss: 0.9615, test_loss: 1.0652, test_f1: 0.4750
 epoch: 23, train_loss: 0.9637, test_loss: 1.1236, test_f1: 0.4614
 epoch: 24, train_loss: 0.9514, test_loss: 1.1278, test_f1: 0.4463
 epoch: 25, train_loss: 0.9555, test_loss: 1.0214, test_f1: 0.4804
 epoch: 26, train_loss: 0.9528, test_loss: 1.0661, test_f1: 0.4692
 epoch: 27, train_loss: 0.9440, test_loss: 1.0663, test_f1: 0.4575
 epoch: 28, train_loss: 0.9324, test_loss: 1.0791, test_f1: 0.4762
 epoch: 29, train_loss: 0.9249, test_loss: 1.0971, test_f1: 0.4681
 epoch: 30, train_loss: 0.9381, test_loss: 1.0341, test_f1: 0.4801
 epoch: 31, train_loss: 0.9284, test_loss: 1.0835, test_f1: 0.4721
 epoch: 32, train_loss: 0.9295, test_loss: 1.0207, test_f1: 0.4725
 epoch: 33, train_loss: 0.9122, test_loss: 1.1391, test_f1: 0.4676
 epoch: 34, train_loss: 0.9212, test_loss: 1.0555, test_f1: 0.4813
 epoch: 35, train_loss: 0.9140, test_loss: 1.0740, test_f1: 0.4652
 epoch: 36, train_loss: 0.9041, test_loss: 1.0505, test_f1: 0.4774
 epoch: 37, train_loss: 0.8945, test_loss: 1.1067, test_f1: 0.4879
 epoch: 38, train_loss: 0.8933, test_loss: 1.0234, test_f1: 0.4864
 epoch: 39, train_loss: 0.8962, test_loss: 1.0089, test_f1: 0.4985
 epoch: 40, train_loss: 0.8975, test_loss: 1.0385, test_f1: 0.4819
 epoch: 41, train_loss: 0.8900, test_loss: 1.0903, test_f1: 0.4810
 epoch: 42, train_loss: 0.8951, test_loss: 1.0843, test_f1: 0.4840
 epoch: 43, train_loss: 0.8853, test_loss: 1.1144, test_f1: 0.4832
 epoch: 44, train_loss: 0.8884, test_loss: 1.0637, test_f1: 0.4784
 epoch: 45, train_loss: 0.8732, test_loss: 1.0112, test_f1: 0.4796
 epoch: 46, train_loss: 0.8787, test_loss: 1.0160, test_f1: 0.4853
 epoch: 47, train_loss: 0.8525, test_loss: 1.0529, test_f1: 0.5019
 epoch: 48, train_loss: 0.8655, test_loss: 1.0466, test_f1: 0.4993
 epoch: 49, train_loss: 0.8653, test_loss: 1.0225, test_f1: 0.4988
 epoch: 50, train_loss: 0.8618, test_loss: 1.1950, test_f1: 0.4805
 epoch: 51, train_loss: 0.8518, test_loss: 1.0240, test_f1: 0.5003
 epoch: 52, train_loss: 0.8437, test_loss: 1.0481, test_f1: 0.4953
 epoch: 53, train_loss: 0.8439, test_loss: 1.0365, test_f1: 0.4875
 epoch: 54, train_loss: 0.8309, test_loss: 1.0580, test_f1: 0.4943
 epoch: 55, train_loss: 0.8383, test_loss: 1.0356, test_f1: 0.5108
 epoch: 56, train_loss: 0.8485, test_loss: 1.0424, test_f1: 0.4961
 epoch: 57, train_loss: 0.8388, test_loss: 1.0499, test_f1: 0.4938
 epoch: 58, train_loss: 0.8325, test_loss: 1.0925, test_f1: 0.4845
 epoch: 59, train_loss: 0.8294, test_loss: 1.0827, test_f1: 0.4898
 epoch: 60, train_loss: 0.8314, test_loss: 1.0338, test_f1: 0.4924
 epoch: 61, train_loss: 0.8306, test_loss: 1.0583, test_f1: 0.4828
 epoch: 62, train_loss: 0.8233, test_loss: 1.0471, test_f1: 0.4869
 epoch: 63, train_loss: 0.8225, test_loss: 1.0536, test_f1: 0.4926
 epoch: 64, train_loss: 0.8257, test_loss: 1.1306, test_f1: 0.4805
 epoch: 65, train_loss: 0.8283, test_loss: 1.0281, test_f1: 0.4963
 epoch: 66, train_loss: 0.8189, test_loss: 1.0332, test_f1: 0.4893
 epoch: 67, train_loss: 0.8212, test_loss: 1.0135, test_f1: 0.5000
 epoch: 68, train_loss: 0.8142, test_loss: 1.0681, test_f1: 0.4876
 epoch: 69, train_loss: 0.8071, test_loss: 1.0634, test_f1: 0.4965
 epoch: 70, train_loss: 0.8016, test_loss: 1.0611, test_f1: 0.4899
 epoch: 71, train_loss: 0.8008, test_loss: 1.0670, test_f1: 0.5010
 epoch: 72, train_loss: 0.8147, test_loss: 1.0275, test_f1: 0.5078
 epoch: 73, train_loss: 0.8084, test_loss: 1.0694, test_f1: 0.4940
 epoch: 74, train_loss: 0.8150, test_loss: 1.0784, test_f1: 0.4906
 epoch: 75, train_loss: 0.8154, test_loss: 1.0321, test_f1: 0.4864
 epoch: 76, train_loss: 0.7973, test_loss: 1.0158, test_f1: 0.4888
 epoch: 77, train_loss: 0.7930, test_loss: 1.0986, test_f1: 0.4807
 epoch: 78, train_loss: 0.8140, test_loss: 1.0662, test_f1: 0.4859
 epoch: 79, train_loss: 0.8020, test_loss: 1.0977, test_f1: 0.4797
 epoch: 80, train_loss: 0.7967, test_loss: 1.0490, test_f1: 0.4924
 epoch: 81, train_loss: 0.7893, test_loss: 1.0524, test_f1: 0.5023
 epoch: 82, train_loss: 0.7911, test_loss: 1.0809, test_f1: 0.4964
 epoch: 83, train_loss: 0.7937, test_loss: 1.1107, test_f1: 0.4907
 epoch: 84, train_loss: 0.7985, test_loss: 1.0745, test_f1: 0.4848
 epoch: 85, train_loss: 0.7929, test_loss: 1.0275, test_f1: 0.5079
 epoch: 86, train_loss: 0.8003, test_loss: 1.0778, test_f1: 0.4995
 epoch: 87, train_loss: 0.7952, test_loss: 1.0893, test_f1: 0.4913
 epoch: 88, train_loss: 0.7709, test_loss: 1.0567, test_f1: 0.5030
 epoch: 89, train_loss: 0.7811, test_loss: 1.0962, test_f1: 0.5016
 epoch: 90, train_loss: 0.7852, test_loss: 1.0501, test_f1: 0.5021
 epoch: 91, train_loss: 0.7794, test_loss: 1.1161, test_f1: 0.4942
 epoch: 92, train_loss: 0.7863, test_loss: 1.0462, test_f1: 0.4959
 epoch: 93, train_loss: 0.7756, test_loss: 1.0540, test_f1: 0.4995
 epoch: 94, train_loss: 0.7741, test_loss: 1.0452, test_f1: 0.4986
 epoch: 95, train_loss: 0.7699, test_loss: 1.1399, test_f1: 0.4829
 epoch: 96, train_loss: 0.7791, test_loss: 1.0623, test_f1: 0.4851
 epoch: 97, train_loss: 0.7744, test_loss: 1.0658, test_f1: 0.4943
 epoch: 98, train_loss: 0.7964, test_loss: 1.1031, test_f1: 0.4797
 epoch: 99, train_loss: 0.7884, test_loss: 1.0568, test_f1: 0.5080
##################ITERATION #2 ****************************************
 epoch: 0, train_loss: 1.3260, test_loss: 1.3337, test_f1: 0.2260
 epoch: 1, train_loss: 1.2527, test_loss: 1.3133, test_f1: 0.2260
 epoch: 2, train_loss: 1.2009, test_loss: 1.2551, test_f1: 0.2260
 epoch: 3, train_loss: 1.1475, test_loss: 1.1317, test_f1: 0.3498
 epoch: 4, train_loss: 1.1078, test_loss: 1.0793, test_f1: 0.3868
 epoch: 5, train_loss: 1.0780, test_loss: 1.0525, test_f1: 0.4466
 epoch: 6, train_loss: 1.0590, test_loss: 1.0283, test_f1: 0.4554
 epoch: 7, train_loss: 1.0436, test_loss: 1.0280, test_f1: 0.4783
 epoch: 8, train_loss: 1.0225, test_loss: 1.0044, test_f1: 0.4771
 epoch: 9, train_loss: 1.0131, test_loss: 1.0216, test_f1: 0.4756
 epoch: 10, train_loss: 1.0020, test_loss: 0.9792, test_f1: 0.4809
 epoch: 11, train_loss: 0.9952, test_loss: 0.9860, test_f1: 0.4864
 epoch: 12, train_loss: 0.9776, test_loss: 0.9708, test_f1: 0.4960
 epoch: 13, train_loss: 0.9726, test_loss: 0.9920, test_f1: 0.4779
 epoch: 14, train_loss: 0.9728, test_loss: 0.9997, test_f1: 0.4803
 epoch: 15, train_loss: 0.9578, test_loss: 0.9757, test_f1: 0.4702
 epoch: 16, train_loss: 0.9424, test_loss: 0.9621, test_f1: 0.5030
 epoch: 17, train_loss: 0.9352, test_loss: 0.9738, test_f1: 0.4995
 epoch: 18, train_loss: 0.9274, test_loss: 0.9591, test_f1: 0.5047
 epoch: 19, train_loss: 0.9215, test_loss: 0.9754, test_f1: 0.4890
 epoch: 20, train_loss: 0.9127, test_loss: 0.9818, test_f1: 0.5073
 epoch: 21, train_loss: 0.9162, test_loss: 0.9587, test_f1: 0.5031
 epoch: 22, train_loss: 0.8968, test_loss: 0.9457, test_f1: 0.5014
 epoch: 23, train_loss: 0.8896, test_loss: 1.0503, test_f1: 0.4771
 epoch: 24, train_loss: 0.9028, test_loss: 0.9624, test_f1: 0.4983
 epoch: 25, train_loss: 0.9029, test_loss: 0.9722, test_f1: 0.5090
 epoch: 26, train_loss: 0.8946, test_loss: 0.9773, test_f1: 0.4950
 epoch: 27, train_loss: 0.8886, test_loss: 0.9994, test_f1: 0.4713
 epoch: 28, train_loss: 0.8695, test_loss: 0.9400, test_f1: 0.5094
 epoch: 29, train_loss: 0.8673, test_loss: 0.9890, test_f1: 0.4890
 epoch: 30, train_loss: 0.8771, test_loss: 0.9990, test_f1: 0.5018
 epoch: 31, train_loss: 0.8603, test_loss: 0.9407, test_f1: 0.5106
 epoch: 32, train_loss: 0.8507, test_loss: 1.0195, test_f1: 0.5037
 epoch: 33, train_loss: 0.8529, test_loss: 0.9705, test_f1: 0.4994
 epoch: 34, train_loss: 0.8493, test_loss: 0.9820, test_f1: 0.4957
 epoch: 35, train_loss: 0.8354, test_loss: 0.9904, test_f1: 0.4919
 epoch: 36, train_loss: 0.8429, test_loss: 0.9677, test_f1: 0.5279
 epoch: 37, train_loss: 0.8358, test_loss: 0.9935, test_f1: 0.5088
 epoch: 38, train_loss: 0.8479, test_loss: 0.9485, test_f1: 0.5185
 epoch: 39, train_loss: 0.8314, test_loss: 0.9571, test_f1: 0.5084
 epoch: 40, train_loss: 0.8392, test_loss: 1.0105, test_f1: 0.5069
 epoch: 41, train_loss: 0.8377, test_loss: 0.9823, test_f1: 0.5168
 epoch: 42, train_loss: 0.8370, test_loss: 0.9526, test_f1: 0.5028
 epoch: 43, train_loss: 0.8235, test_loss: 0.9723, test_f1: 0.5220
 epoch: 44, train_loss: 0.8134, test_loss: 0.9879, test_f1: 0.5060
 epoch: 45, train_loss: 0.8190, test_loss: 0.9618, test_f1: 0.5141
 epoch: 46, train_loss: 0.8239, test_loss: 1.0205, test_f1: 0.5203
 epoch: 47, train_loss: 0.8114, test_loss: 0.9480, test_f1: 0.5109
 epoch: 48, train_loss: 0.7988, test_loss: 0.9716, test_f1: 0.5239
 epoch: 49, train_loss: 0.8173, test_loss: 1.0106, test_f1: 0.4790
 epoch: 50, train_loss: 0.8013, test_loss: 0.9417, test_f1: 0.5294
 epoch: 51, train_loss: 0.7852, test_loss: 0.9691, test_f1: 0.5281
 epoch: 52, train_loss: 0.7875, test_loss: 0.9525, test_f1: 0.5285
 epoch: 53, train_loss: 0.7874, test_loss: 0.9379, test_f1: 0.5314
 epoch: 54, train_loss: 0.8011, test_loss: 0.9557, test_f1: 0.5028
 epoch: 55, train_loss: 0.7910, test_loss: 0.9547, test_f1: 0.5125
 epoch: 56, train_loss: 0.7809, test_loss: 0.9222, test_f1: 0.5235
 epoch: 57, train_loss: 0.7766, test_loss: 0.9975, test_f1: 0.5167
 epoch: 58, train_loss: 0.7833, test_loss: 0.9659, test_f1: 0.5090
 epoch: 59, train_loss: 0.7619, test_loss: 0.9491, test_f1: 0.5278
 epoch: 60, train_loss: 0.7692, test_loss: 0.9581, test_f1: 0.5247
 epoch: 61, train_loss: 0.7703, test_loss: 0.9715, test_f1: 0.5127
 epoch: 62, train_loss: 0.7577, test_loss: 0.9471, test_f1: 0.5245
 epoch: 63, train_loss: 0.7697, test_loss: 0.9477, test_f1: 0.5394
 epoch: 64, train_loss: 0.7652, test_loss: 0.9562, test_f1: 0.5225
 epoch: 65, train_loss: 0.7639, test_loss: 0.9820, test_f1: 0.5093
 epoch: 66, train_loss: 0.7699, test_loss: 1.0145, test_f1: 0.5164
 epoch: 67, train_loss: 0.7786, test_loss: 0.9700, test_f1: 0.5190
 epoch: 68, train_loss: 0.7694, test_loss: 0.9667, test_f1: 0.5097
 epoch: 69, train_loss: 0.7616, test_loss: 0.9644, test_f1: 0.5193
 epoch: 70, train_loss: 0.7641, test_loss: 0.9906, test_f1: 0.5161
 epoch: 71, train_loss: 0.7613, test_loss: 0.9539, test_f1: 0.5281
 epoch: 72, train_loss: 0.7584, test_loss: 0.9492, test_f1: 0.5265
 epoch: 73, train_loss: 0.7520, test_loss: 0.9726, test_f1: 0.5206
 epoch: 74, train_loss: 0.7491, test_loss: 0.9708, test_f1: 0.5417
 epoch: 75, train_loss: 0.7668, test_loss: 0.9747, test_f1: 0.5253
 epoch: 76, train_loss: 0.7530, test_loss: 0.9430, test_f1: 0.5228
 epoch: 77, train_loss: 0.7522, test_loss: 0.9743, test_f1: 0.5195
 epoch: 78, train_loss: 0.7459, test_loss: 0.9637, test_f1: 0.5359
 epoch: 79, train_loss: 0.7502, test_loss: 1.0090, test_f1: 0.4967
 epoch: 80, train_loss: 0.7516, test_loss: 0.9879, test_f1: 0.5085
 epoch: 81, train_loss: 0.7567, test_loss: 0.9535, test_f1: 0.5332
 epoch: 82, train_loss: 0.7507, test_loss: 0.9619, test_f1: 0.5175
 epoch: 83, train_loss: 0.7516, test_loss: 1.0132, test_f1: 0.5241
 epoch: 84, train_loss: 0.7370, test_loss: 0.9768, test_f1: 0.5210
 epoch: 85, train_loss: 0.7641, test_loss: 0.9639, test_f1: 0.5166
 epoch: 86, train_loss: 0.7332, test_loss: 0.9550, test_f1: 0.5413
 epoch: 87, train_loss: 0.7453, test_loss: 0.9847, test_f1: 0.5321
 epoch: 88, train_loss: 0.7476, test_loss: 0.9882, test_f1: 0.5151
 epoch: 89, train_loss: 0.7335, test_loss: 1.0086, test_f1: 0.5200
 epoch: 90, train_loss: 0.7334, test_loss: 0.9753, test_f1: 0.5287
 epoch: 91, train_loss: 0.7405, test_loss: 0.9912, test_f1: 0.5136
 epoch: 92, train_loss: 0.7436, test_loss: 1.0112, test_f1: 0.5237
 epoch: 93, train_loss: 0.7270, test_loss: 0.9775, test_f1: 0.5188
 epoch: 94, train_loss: 0.7346, test_loss: 0.9888, test_f1: 0.5197
 epoch: 95, train_loss: 0.7238, test_loss: 0.9741, test_f1: 0.5162
 epoch: 96, train_loss: 0.7352, test_loss: 0.9904, test_f1: 0.5264
 epoch: 97, train_loss: 0.7328, test_loss: 0.9708, test_f1: 0.5219
 epoch: 98, train_loss: 0.7203, test_loss: 0.9996, test_f1: 0.5015
 epoch: 99, train_loss: 0.7437, test_loss: 0.9742, test_f1: 0.5110
##################ITERATION #3 ****************************************
 epoch: 0, train_loss: 1.2853, test_loss: 1.3072, test_f1: 0.2260
 epoch: 1, train_loss: 1.2179, test_loss: 1.2909, test_f1: 0.2260
 epoch: 2, train_loss: 1.1954, test_loss: 1.2776, test_f1: 0.2260
 epoch: 3, train_loss: 1.1646, test_loss: 1.1974, test_f1: 0.2560
 epoch: 4, train_loss: 1.1388, test_loss: 1.1208, test_f1: 0.3404
 epoch: 5, train_loss: 1.1098, test_loss: 1.0827, test_f1: 0.3507
 epoch: 6, train_loss: 1.0876, test_loss: 1.0619, test_f1: 0.3423
 epoch: 7, train_loss: 1.0710, test_loss: 1.0458, test_f1: 0.3410
 epoch: 8, train_loss: 1.0618, test_loss: 1.0736, test_f1: 0.3317
 epoch: 9, train_loss: 1.0482, test_loss: 1.0352, test_f1: 0.3467
 epoch: 10, train_loss: 1.0360, test_loss: 1.0651, test_f1: 0.3403
 epoch: 11, train_loss: 1.0250, test_loss: 1.0630, test_f1: 0.3524
 epoch: 12, train_loss: 1.0211, test_loss: 1.0564, test_f1: 0.3380
 epoch: 13, train_loss: 1.0111, test_loss: 1.0281, test_f1: 0.3585
 epoch: 14, train_loss: 1.0085, test_loss: 1.0652, test_f1: 0.3558
 epoch: 15, train_loss: 1.0013, test_loss: 1.0316, test_f1: 0.3913
 epoch: 16, train_loss: 0.9895, test_loss: 1.0121, test_f1: 0.4280
 epoch: 17, train_loss: 0.9921, test_loss: 1.0517, test_f1: 0.3845
 epoch: 18, train_loss: 0.9820, test_loss: 1.0615, test_f1: 0.4169
 epoch: 19, train_loss: 0.9787, test_loss: 1.0658, test_f1: 0.4294
 epoch: 20, train_loss: 0.9696, test_loss: 1.0700, test_f1: 0.4191
 epoch: 21, train_loss: 0.9740, test_loss: 1.0579, test_f1: 0.4503
 epoch: 22, train_loss: 0.9675, test_loss: 1.0499, test_f1: 0.4498
 epoch: 23, train_loss: 0.9613, test_loss: 1.0563, test_f1: 0.4545
 epoch: 24, train_loss: 0.9558, test_loss: 1.0635, test_f1: 0.4341
 epoch: 25, train_loss: 0.9524, test_loss: 1.0537, test_f1: 0.4641
 epoch: 26, train_loss: 0.9509, test_loss: 1.0576, test_f1: 0.4710
 epoch: 27, train_loss: 0.9376, test_loss: 1.0574, test_f1: 0.4796
 epoch: 28, train_loss: 0.9435, test_loss: 1.0814, test_f1: 0.4751
 epoch: 29, train_loss: 0.9466, test_loss: 1.0359, test_f1: 0.4717
 epoch: 30, train_loss: 0.9345, test_loss: 1.0419, test_f1: 0.4767
 epoch: 31, train_loss: 0.9366, test_loss: 1.0426, test_f1: 0.4939
 epoch: 32, train_loss: 0.9304, test_loss: 1.0608, test_f1: 0.4458
 epoch: 33, train_loss: 0.9265, test_loss: 1.0365, test_f1: 0.4918
 epoch: 34, train_loss: 0.9106, test_loss: 1.0094, test_f1: 0.4874
 epoch: 35, train_loss: 0.9204, test_loss: 1.0351, test_f1: 0.4943
 epoch: 36, train_loss: 0.9226, test_loss: 0.9796, test_f1: 0.4876
 epoch: 37, train_loss: 0.9011, test_loss: 1.0074, test_f1: 0.4712
 epoch: 38, train_loss: 0.8971, test_loss: 1.0015, test_f1: 0.4889
 epoch: 39, train_loss: 0.8973, test_loss: 1.0791, test_f1: 0.4632
 epoch: 40, train_loss: 0.9052, test_loss: 1.0370, test_f1: 0.4844
 epoch: 41, train_loss: 0.8914, test_loss: 0.9907, test_f1: 0.5100
 epoch: 42, train_loss: 0.8878, test_loss: 1.0100, test_f1: 0.4858
 epoch: 43, train_loss: 0.8954, test_loss: 0.9921, test_f1: 0.4931
 epoch: 44, train_loss: 0.8881, test_loss: 1.0624, test_f1: 0.4637
 epoch: 45, train_loss: 0.8865, test_loss: 0.9612, test_f1: 0.4987
 epoch: 46, train_loss: 0.8758, test_loss: 0.9372, test_f1: 0.5086
 epoch: 47, train_loss: 0.8850, test_loss: 0.9716, test_f1: 0.4964
 epoch: 48, train_loss: 0.8882, test_loss: 0.9745, test_f1: 0.5043
 epoch: 49, train_loss: 0.8800, test_loss: 1.0354, test_f1: 0.4717
 epoch: 50, train_loss: 0.8926, test_loss: 1.0039, test_f1: 0.5040
 epoch: 51, train_loss: 0.8694, test_loss: 0.9808, test_f1: 0.5011
 epoch: 52, train_loss: 0.8546, test_loss: 0.9503, test_f1: 0.5078
 epoch: 53, train_loss: 0.8622, test_loss: 0.9647, test_f1: 0.5100
 epoch: 54, train_loss: 0.8614, test_loss: 0.9885, test_f1: 0.5047
 epoch: 55, train_loss: 0.8437, test_loss: 0.9500, test_f1: 0.4892
 epoch: 56, train_loss: 0.8535, test_loss: 0.9910, test_f1: 0.4963
 epoch: 57, train_loss: 0.8484, test_loss: 0.9086, test_f1: 0.4988
 epoch: 58, train_loss: 0.8457, test_loss: 0.9584, test_f1: 0.5037
 epoch: 59, train_loss: 0.8543, test_loss: 0.9572, test_f1: 0.4995
 epoch: 60, train_loss: 0.8452, test_loss: 0.9138, test_f1: 0.5035
 epoch: 61, train_loss: 0.8312, test_loss: 0.9377, test_f1: 0.5002
 epoch: 62, train_loss: 0.8397, test_loss: 0.9824, test_f1: 0.4977
 epoch: 63, train_loss: 0.8384, test_loss: 0.9423, test_f1: 0.5117
 epoch: 64, train_loss: 0.8387, test_loss: 0.9746, test_f1: 0.5001
 epoch: 65, train_loss: 0.8389, test_loss: 0.9358, test_f1: 0.5043
 epoch: 66, train_loss: 0.8333, test_loss: 0.9459, test_f1: 0.5000
 epoch: 67, train_loss: 0.8340, test_loss: 0.9515, test_f1: 0.5082
 epoch: 68, train_loss: 0.8325, test_loss: 0.9413, test_f1: 0.5034
 epoch: 69, train_loss: 0.8242, test_loss: 0.9607, test_f1: 0.4932
 epoch: 70, train_loss: 0.8291, test_loss: 0.9250, test_f1: 0.4998
 epoch: 71, train_loss: 0.8166, test_loss: 0.9588, test_f1: 0.5016
 epoch: 72, train_loss: 0.8234, test_loss: 0.9320, test_f1: 0.5037
 epoch: 73, train_loss: 0.8242, test_loss: 0.9002, test_f1: 0.5086
 epoch: 74, train_loss: 0.8343, test_loss: 0.9583, test_f1: 0.4960
 epoch: 75, train_loss: 0.8104, test_loss: 0.9482, test_f1: 0.5060
 epoch: 76, train_loss: 0.8198, test_loss: 0.9102, test_f1: 0.5061
 epoch: 77, train_loss: 0.8188, test_loss: 0.9512, test_f1: 0.5161
 epoch: 78, train_loss: 0.8308, test_loss: 0.9874, test_f1: 0.4987
 epoch: 79, train_loss: 0.8178, test_loss: 0.9747, test_f1: 0.5165
 epoch: 80, train_loss: 0.8066, test_loss: 0.9052, test_f1: 0.5118
 epoch: 81, train_loss: 0.8123, test_loss: 0.9377, test_f1: 0.5082
 epoch: 82, train_loss: 0.8056, test_loss: 0.9622, test_f1: 0.5153
 epoch: 83, train_loss: 0.8155, test_loss: 0.9485, test_f1: 0.5135
 epoch: 84, train_loss: 0.8228, test_loss: 1.0086, test_f1: 0.5007
 epoch: 85, train_loss: 0.8166, test_loss: 0.9736, test_f1: 0.5148
 epoch: 86, train_loss: 0.7976, test_loss: 0.9713, test_f1: 0.5084
 epoch: 87, train_loss: 0.8065, test_loss: 0.9634, test_f1: 0.5067
 epoch: 88, train_loss: 0.7943, test_loss: 0.9218, test_f1: 0.5059
 epoch: 89, train_loss: 0.8034, test_loss: 0.9693, test_f1: 0.5100
 epoch: 90, train_loss: 0.7963, test_loss: 0.9359, test_f1: 0.5086
 epoch: 91, train_loss: 0.8029, test_loss: 0.9448, test_f1: 0.5158
 epoch: 92, train_loss: 0.8065, test_loss: 0.9502, test_f1: 0.5175
 epoch: 93, train_loss: 0.8044, test_loss: 0.9400, test_f1: 0.5133
 epoch: 94, train_loss: 0.7901, test_loss: 0.9792, test_f1: 0.4927
 epoch: 95, train_loss: 0.7928, test_loss: 0.9260, test_f1: 0.4972
 epoch: 96, train_loss: 0.7967, test_loss: 0.9410, test_f1: 0.5202
 epoch: 97, train_loss: 0.7973, test_loss: 0.9442, test_f1: 0.5105
 epoch: 98, train_loss: 0.7898, test_loss: 0.9310, test_f1: 0.5032
 epoch: 99, train_loss: 0.7813, test_loss: 0.9540, test_f1: 0.5000
##################ITERATION #4 ****************************************
 epoch: 0, train_loss: 1.2950, test_loss: 1.3387, test_f1: 0.2260
 epoch: 1, train_loss: 1.2212, test_loss: 1.3322, test_f1: 0.2260
 epoch: 2, train_loss: 1.1817, test_loss: 1.3211, test_f1: 0.2260
 epoch: 3, train_loss: 1.1435, test_loss: 1.2369, test_f1: 0.2260
 epoch: 4, train_loss: 1.1094, test_loss: 1.0984, test_f1: 0.3568
 epoch: 5, train_loss: 1.0920, test_loss: 1.0650, test_f1: 0.3868
 epoch: 6, train_loss: 1.0742, test_loss: 1.0557, test_f1: 0.4189
 epoch: 7, train_loss: 1.0575, test_loss: 1.0608, test_f1: 0.4238
 epoch: 8, train_loss: 1.0387, test_loss: 1.0617, test_f1: 0.4100
 epoch: 9, train_loss: 1.0369, test_loss: 1.0574, test_f1: 0.4190
 epoch: 10, train_loss: 1.0361, test_loss: 1.0352, test_f1: 0.4114
 epoch: 11, train_loss: 1.0193, test_loss: 1.0647, test_f1: 0.4101
 epoch: 12, train_loss: 1.0147, test_loss: 1.0470, test_f1: 0.4444
 epoch: 13, train_loss: 0.9964, test_loss: 1.0328, test_f1: 0.4431
 epoch: 14, train_loss: 0.9969, test_loss: 1.0418, test_f1: 0.4677
 epoch: 15, train_loss: 0.9913, test_loss: 1.0299, test_f1: 0.4699
 epoch: 16, train_loss: 0.9840, test_loss: 1.0649, test_f1: 0.4540
 epoch: 17, train_loss: 0.9736, test_loss: 1.0516, test_f1: 0.4412
 epoch: 18, train_loss: 0.9783, test_loss: 1.0581, test_f1: 0.4580
 epoch: 19, train_loss: 0.9781, test_loss: 1.1451, test_f1: 0.4241
 epoch: 20, train_loss: 0.9632, test_loss: 1.0429, test_f1: 0.4830
 epoch: 21, train_loss: 0.9676, test_loss: 1.0758, test_f1: 0.4407
 epoch: 22, train_loss: 0.9644, test_loss: 1.0321, test_f1: 0.4829
 epoch: 23, train_loss: 0.9600, test_loss: 1.0271, test_f1: 0.4884
 epoch: 24, train_loss: 0.9546, test_loss: 1.0375, test_f1: 0.4771
 epoch: 25, train_loss: 0.9465, test_loss: 1.0296, test_f1: 0.4754
 epoch: 26, train_loss: 0.9390, test_loss: 1.0221, test_f1: 0.4959
 epoch: 27, train_loss: 0.9358, test_loss: 1.0210, test_f1: 0.4967
 epoch: 28, train_loss: 0.9249, test_loss: 1.0510, test_f1: 0.4841
 epoch: 29, train_loss: 0.9354, test_loss: 1.0032, test_f1: 0.4949
 epoch: 30, train_loss: 0.9325, test_loss: 1.0227, test_f1: 0.4923
 epoch: 31, train_loss: 0.9196, test_loss: 1.0288, test_f1: 0.4744
 epoch: 32, train_loss: 0.9201, test_loss: 1.0274, test_f1: 0.4824
 epoch: 33, train_loss: 0.9079, test_loss: 1.0136, test_f1: 0.4884
 epoch: 34, train_loss: 0.9058, test_loss: 1.0204, test_f1: 0.4902
 epoch: 35, train_loss: 0.8892, test_loss: 1.0007, test_f1: 0.5069
 epoch: 36, train_loss: 0.8947, test_loss: 1.0032, test_f1: 0.5002
 epoch: 37, train_loss: 0.8903, test_loss: 0.9952, test_f1: 0.5183
 epoch: 38, train_loss: 0.8967, test_loss: 1.0235, test_f1: 0.5010
 epoch: 39, train_loss: 0.9027, test_loss: 0.9924, test_f1: 0.5047
 epoch: 40, train_loss: 0.8833, test_loss: 1.0023, test_f1: 0.5122
 epoch: 41, train_loss: 0.8837, test_loss: 1.0125, test_f1: 0.5074
 epoch: 42, train_loss: 0.8903, test_loss: 1.0095, test_f1: 0.5121
 epoch: 43, train_loss: 0.8806, test_loss: 1.0021, test_f1: 0.5032
 epoch: 44, train_loss: 0.8752, test_loss: 0.9846, test_f1: 0.5192
 epoch: 45, train_loss: 0.8762, test_loss: 0.9978, test_f1: 0.5244
 epoch: 46, train_loss: 0.8683, test_loss: 0.9709, test_f1: 0.5276
 epoch: 47, train_loss: 0.8572, test_loss: 0.9720, test_f1: 0.5336
 epoch: 48, train_loss: 0.8521, test_loss: 1.0388, test_f1: 0.5016
 epoch: 49, train_loss: 0.8462, test_loss: 1.0398, test_f1: 0.5029
 epoch: 50, train_loss: 0.8543, test_loss: 0.9975, test_f1: 0.5197
 epoch: 51, train_loss: 0.8483, test_loss: 0.9665, test_f1: 0.5224
 epoch: 52, train_loss: 0.8318, test_loss: 0.9759, test_f1: 0.5356
 epoch: 53, train_loss: 0.8278, test_loss: 1.0071, test_f1: 0.5245
 epoch: 54, train_loss: 0.8336, test_loss: 0.9723, test_f1: 0.5262
 epoch: 55, train_loss: 0.8277, test_loss: 0.9706, test_f1: 0.5208
 epoch: 56, train_loss: 0.8166, test_loss: 0.9769, test_f1: 0.5347
 epoch: 57, train_loss: 0.8302, test_loss: 0.9819, test_f1: 0.5230
 epoch: 58, train_loss: 0.8178, test_loss: 0.9586, test_f1: 0.5325
 epoch: 59, train_loss: 0.8202, test_loss: 0.9867, test_f1: 0.5384
 epoch: 60, train_loss: 0.8214, test_loss: 0.9937, test_f1: 0.5274
 epoch: 61, train_loss: 0.8178, test_loss: 0.9813, test_f1: 0.5274
 epoch: 62, train_loss: 0.8238, test_loss: 0.9984, test_f1: 0.5201
 epoch: 63, train_loss: 0.8283, test_loss: 0.9814, test_f1: 0.5171
 epoch: 64, train_loss: 0.8192, test_loss: 1.0054, test_f1: 0.5188
 epoch: 65, train_loss: 0.8111, test_loss: 0.9955, test_f1: 0.5168
 epoch: 66, train_loss: 0.8165, test_loss: 1.0001, test_f1: 0.5226
 epoch: 67, train_loss: 0.8083, test_loss: 1.0391, test_f1: 0.5205
 epoch: 68, train_loss: 0.8176, test_loss: 1.0072, test_f1: 0.5217
 epoch: 69, train_loss: 0.8013, test_loss: 0.9744, test_f1: 0.5374
 epoch: 70, train_loss: 0.8128, test_loss: 0.9788, test_f1: 0.5317
 epoch: 71, train_loss: 0.8060, test_loss: 0.9904, test_f1: 0.5334
 epoch: 72, train_loss: 0.8108, test_loss: 1.0511, test_f1: 0.5003
 epoch: 73, train_loss: 0.8067, test_loss: 0.9981, test_f1: 0.5240
 epoch: 74, train_loss: 0.8041, test_loss: 1.0082, test_f1: 0.5152
 epoch: 75, train_loss: 0.8065, test_loss: 0.9834, test_f1: 0.5155
 epoch: 76, train_loss: 0.8046, test_loss: 0.9967, test_f1: 0.5304
 epoch: 77, train_loss: 0.7943, test_loss: 1.0124, test_f1: 0.5245
 epoch: 78, train_loss: 0.7945, test_loss: 1.0036, test_f1: 0.5204
 epoch: 79, train_loss: 0.8092, test_loss: 1.0322, test_f1: 0.5108
 epoch: 80, train_loss: 0.8029, test_loss: 1.0021, test_f1: 0.5256
 epoch: 81, train_loss: 0.8004, test_loss: 1.0183, test_f1: 0.5261
 epoch: 82, train_loss: 0.8012, test_loss: 1.0128, test_f1: 0.5199
 epoch: 83, train_loss: 0.7948, test_loss: 0.9852, test_f1: 0.5301
 epoch: 84, train_loss: 0.8149, test_loss: 0.9916, test_f1: 0.5250
 epoch: 85, train_loss: 0.7805, test_loss: 1.0180, test_f1: 0.5248
 epoch: 86, train_loss: 0.7880, test_loss: 1.0194, test_f1: 0.5170
 epoch: 87, train_loss: 0.7880, test_loss: 1.0036, test_f1: 0.5115
 epoch: 88, train_loss: 0.7906, test_loss: 0.9898, test_f1: 0.5293
 epoch: 89, train_loss: 0.7998, test_loss: 0.9995, test_f1: 0.5261
 epoch: 90, train_loss: 0.7906, test_loss: 1.0222, test_f1: 0.5289
 epoch: 91, train_loss: 0.7951, test_loss: 1.0077, test_f1: 0.5100
 epoch: 92, train_loss: 0.7798, test_loss: 0.9946, test_f1: 0.5212
 epoch: 93, train_loss: 0.7816, test_loss: 1.0076, test_f1: 0.5326
 epoch: 94, train_loss: 0.7809, test_loss: 1.0187, test_f1: 0.5203
 epoch: 95, train_loss: 0.7673, test_loss: 1.0343, test_f1: 0.5219
 epoch: 96, train_loss: 0.7827, test_loss: 1.0474, test_f1: 0.5083
 epoch: 97, train_loss: 0.7748, test_loss: 1.0089, test_f1: 0.5279
 epoch: 98, train_loss: 0.7769, test_loss: 1.0591, test_f1: 0.5259
 epoch: 99, train_loss: 0.7765, test_loss: 1.0136, test_f1: 0.5294
##################ITERATION #5 ****************************************
 epoch: 0, train_loss: 1.2805, test_loss: 1.2890, test_f1: 0.2260
 epoch: 1, train_loss: 1.2169, test_loss: 1.2617, test_f1: 0.2260
 epoch: 2, train_loss: 1.1733, test_loss: 1.2296, test_f1: 0.2474
 epoch: 3, train_loss: 1.1329, test_loss: 1.1646, test_f1: 0.3225
 epoch: 4, train_loss: 1.1026, test_loss: 1.0916, test_f1: 0.3609
 epoch: 5, train_loss: 1.0741, test_loss: 1.0640, test_f1: 0.4160
 epoch: 6, train_loss: 1.0667, test_loss: 1.0054, test_f1: 0.4134
 epoch: 7, train_loss: 1.0436, test_loss: 0.9982, test_f1: 0.4240
 epoch: 8, train_loss: 1.0254, test_loss: 0.9914, test_f1: 0.4331
 epoch: 9, train_loss: 1.0216, test_loss: 1.0067, test_f1: 0.4383
 epoch: 10, train_loss: 1.0197, test_loss: 0.9796, test_f1: 0.4566
 epoch: 11, train_loss: 0.9930, test_loss: 1.1073, test_f1: 0.4108
 epoch: 12, train_loss: 0.9841, test_loss: 0.9661, test_f1: 0.4542
 epoch: 13, train_loss: 0.9758, test_loss: 0.9789, test_f1: 0.4959
 epoch: 14, train_loss: 0.9715, test_loss: 0.9731, test_f1: 0.4744
 epoch: 15, train_loss: 0.9562, test_loss: 0.9589, test_f1: 0.4947
 epoch: 16, train_loss: 0.9525, test_loss: 0.9856, test_f1: 0.4788
 epoch: 17, train_loss: 0.9411, test_loss: 0.9786, test_f1: 0.4970
 epoch: 18, train_loss: 0.9470, test_loss: 0.9623, test_f1: 0.5053
 epoch: 19, train_loss: 0.9312, test_loss: 0.9441, test_f1: 0.4788
 epoch: 20, train_loss: 0.9287, test_loss: 0.9716, test_f1: 0.4615
 epoch: 21, train_loss: 0.9258, test_loss: 0.9546, test_f1: 0.4863
 epoch: 22, train_loss: 0.9113, test_loss: 0.9816, test_f1: 0.4876
 epoch: 23, train_loss: 0.9043, test_loss: 0.9450, test_f1: 0.4935
 epoch: 24, train_loss: 0.9009, test_loss: 0.9366, test_f1: 0.4963
 epoch: 25, train_loss: 0.9024, test_loss: 0.9355, test_f1: 0.4968
 epoch: 26, train_loss: 0.9068, test_loss: 0.9420, test_f1: 0.5000
 epoch: 27, train_loss: 0.9061, test_loss: 0.9726, test_f1: 0.5052
 epoch: 28, train_loss: 0.8933, test_loss: 0.9858, test_f1: 0.5057
 epoch: 29, train_loss: 0.8841, test_loss: 0.9512, test_f1: 0.5054
 epoch: 30, train_loss: 0.8747, test_loss: 0.9897, test_f1: 0.4951
 epoch: 31, train_loss: 0.8854, test_loss: 0.9316, test_f1: 0.5132
 epoch: 32, train_loss: 0.8667, test_loss: 0.9244, test_f1: 0.5199
 epoch: 33, train_loss: 0.8661, test_loss: 0.9223, test_f1: 0.5153
 epoch: 34, train_loss: 0.8714, test_loss: 0.9356, test_f1: 0.5087
 epoch: 35, train_loss: 0.8798, test_loss: 0.9642, test_f1: 0.5035
 epoch: 36, train_loss: 0.8859, test_loss: 1.0265, test_f1: 0.4814
 epoch: 37, train_loss: 0.8620, test_loss: 1.0181, test_f1: 0.4810
 epoch: 38, train_loss: 0.8577, test_loss: 0.9195, test_f1: 0.5232
 epoch: 39, train_loss: 0.8499, test_loss: 0.9891, test_f1: 0.4844
 epoch: 40, train_loss: 0.8577, test_loss: 0.9382, test_f1: 0.4925
 epoch: 41, train_loss: 0.8579, test_loss: 0.9033, test_f1: 0.5265
 epoch: 42, train_loss: 0.8447, test_loss: 1.0345, test_f1: 0.4949
 epoch: 43, train_loss: 0.8367, test_loss: 0.9187, test_f1: 0.5153
 epoch: 44, train_loss: 0.8331, test_loss: 0.9004, test_f1: 0.5363
 epoch: 45, train_loss: 0.8411, test_loss: 0.9117, test_f1: 0.5309
 epoch: 46, train_loss: 0.8309, test_loss: 1.0068, test_f1: 0.5130
 epoch: 47, train_loss: 0.8330, test_loss: 0.9047, test_f1: 0.5355
 epoch: 48, train_loss: 0.8292, test_loss: 0.9312, test_f1: 0.5294
 epoch: 49, train_loss: 0.8117, test_loss: 0.9460, test_f1: 0.5120
 epoch: 50, train_loss: 0.8148, test_loss: 0.9811, test_f1: 0.5170
 epoch: 51, train_loss: 0.8201, test_loss: 0.9585, test_f1: 0.5171
 epoch: 52, train_loss: 0.8109, test_loss: 0.9160, test_f1: 0.5332
 epoch: 53, train_loss: 0.8000, test_loss: 0.9243, test_f1: 0.5289
 epoch: 54, train_loss: 0.8080, test_loss: 0.8911, test_f1: 0.5390
 epoch: 55, train_loss: 0.8009, test_loss: 1.0145, test_f1: 0.5107
 epoch: 56, train_loss: 0.7947, test_loss: 0.9214, test_f1: 0.5299
 epoch: 57, train_loss: 0.7984, test_loss: 0.9110, test_f1: 0.5353
 epoch: 58, train_loss: 0.8049, test_loss: 0.9455, test_f1: 0.5190
 epoch: 59, train_loss: 0.8029, test_loss: 0.9066, test_f1: 0.5176
 epoch: 60, train_loss: 0.7983, test_loss: 0.9118, test_f1: 0.5315
 epoch: 61, train_loss: 0.7840, test_loss: 0.9283, test_f1: 0.5338
 epoch: 62, train_loss: 0.7906, test_loss: 0.9104, test_f1: 0.5285
 epoch: 63, train_loss: 0.7982, test_loss: 0.9481, test_f1: 0.5339
 epoch: 64, train_loss: 0.7831, test_loss: 0.9194, test_f1: 0.5356
 epoch: 65, train_loss: 0.7840, test_loss: 0.9420, test_f1: 0.5310
 epoch: 66, train_loss: 0.7877, test_loss: 0.8902, test_f1: 0.5395
 epoch: 67, train_loss: 0.7902, test_loss: 0.9180, test_f1: 0.5381
 epoch: 68, train_loss: 0.7855, test_loss: 0.9403, test_f1: 0.5242
 epoch: 69, train_loss: 0.7799, test_loss: 0.9104, test_f1: 0.5295
 epoch: 70, train_loss: 0.7842, test_loss: 0.9283, test_f1: 0.5323
 epoch: 71, train_loss: 0.7781, test_loss: 0.9096, test_f1: 0.5309
 epoch: 72, train_loss: 0.7790, test_loss: 0.9419, test_f1: 0.5384
 epoch: 73, train_loss: 0.7811, test_loss: 0.9797, test_f1: 0.5205
 epoch: 74, train_loss: 0.7872, test_loss: 0.9139, test_f1: 0.5353
 epoch: 75, train_loss: 0.7904, test_loss: 0.8984, test_f1: 0.5412
 epoch: 76, train_loss: 0.7830, test_loss: 0.8994, test_f1: 0.5354
 epoch: 77, train_loss: 0.7667, test_loss: 0.9455, test_f1: 0.5317
 epoch: 78, train_loss: 0.7704, test_loss: 0.9130, test_f1: 0.5407
 epoch: 79, train_loss: 0.7773, test_loss: 0.9129, test_f1: 0.5284
 epoch: 80, train_loss: 0.7702, test_loss: 0.9255, test_f1: 0.5390
 epoch: 81, train_loss: 0.7714, test_loss: 0.9158, test_f1: 0.5401
 epoch: 82, train_loss: 0.7699, test_loss: 0.9525, test_f1: 0.5302
 epoch: 83, train_loss: 0.7747, test_loss: 0.8976, test_f1: 0.5430
 epoch: 84, train_loss: 0.7624, test_loss: 0.9228, test_f1: 0.5359
 epoch: 85, train_loss: 0.7592, test_loss: 0.9149, test_f1: 0.5367
 epoch: 86, train_loss: 0.7617, test_loss: 0.9760, test_f1: 0.4974
 epoch: 87, train_loss: 0.7569, test_loss: 0.9446, test_f1: 0.5210
 epoch: 88, train_loss: 0.7682, test_loss: 0.9155, test_f1: 0.5360
 epoch: 89, train_loss: 0.7636, test_loss: 0.8853, test_f1: 0.5403
 epoch: 90, train_loss: 0.7575, test_loss: 0.9238, test_f1: 0.5338
 epoch: 91, train_loss: 0.7548, test_loss: 0.9776, test_f1: 0.5176
 epoch: 92, train_loss: 0.7684, test_loss: 0.8893, test_f1: 0.5511
 epoch: 93, train_loss: 0.7599, test_loss: 0.8984, test_f1: 0.5291
 epoch: 94, train_loss: 0.7536, test_loss: 0.9290, test_f1: 0.5342
 epoch: 95, train_loss: 0.7538, test_loss: 0.9038, test_f1: 0.5383
 epoch: 96, train_loss: 0.7614, test_loss: 0.9198, test_f1: 0.5380
 epoch: 97, train_loss: 0.7553, test_loss: 0.9397, test_f1: 0.5324
 epoch: 98, train_loss: 0.7489, test_loss: 0.9115, test_f1: 0.5360
 epoch: 99, train_loss: 0.7493, test_loss: 0.9529, test_f1: 0.5207
##################ITERATION #6 ****************************************
 epoch: 0, train_loss: 1.4856, test_loss: 1.3921, test_f1: 0.2288
 epoch: 1, train_loss: 1.3240, test_loss: 1.3446, test_f1: 0.2260
 epoch: 2, train_loss: 1.2573, test_loss: 1.2828, test_f1: 0.2540
 epoch: 3, train_loss: 1.2234, test_loss: 1.2099, test_f1: 0.2639
 epoch: 4, train_loss: 1.1797, test_loss: 1.1532, test_f1: 0.2794
 epoch: 5, train_loss: 1.1471, test_loss: 1.0881, test_f1: 0.3802
 epoch: 6, train_loss: 1.1218, test_loss: 1.0477, test_f1: 0.3893
 epoch: 7, train_loss: 1.0852, test_loss: 1.0228, test_f1: 0.4434
 epoch: 8, train_loss: 1.0512, test_loss: 0.9917, test_f1: 0.4328
 epoch: 9, train_loss: 1.0330, test_loss: 0.9937, test_f1: 0.4356
 epoch: 10, train_loss: 1.0220, test_loss: 0.9814, test_f1: 0.4578
 epoch: 11, train_loss: 1.0020, test_loss: 0.9632, test_f1: 0.4602
 epoch: 12, train_loss: 0.9824, test_loss: 0.9628, test_f1: 0.4667
 epoch: 13, train_loss: 0.9837, test_loss: 1.0045, test_f1: 0.4702
 epoch: 14, train_loss: 0.9661, test_loss: 0.9757, test_f1: 0.4532
 epoch: 15, train_loss: 0.9636, test_loss: 0.9565, test_f1: 0.4572
 epoch: 16, train_loss: 0.9552, test_loss: 0.9974, test_f1: 0.4501
 epoch: 17, train_loss: 0.9507, test_loss: 0.9822, test_f1: 0.4672
 epoch: 18, train_loss: 0.9469, test_loss: 0.9839, test_f1: 0.4523
 epoch: 19, train_loss: 0.9349, test_loss: 0.9473, test_f1: 0.4576
 epoch: 20, train_loss: 0.9306, test_loss: 0.9550, test_f1: 0.4548
 epoch: 21, train_loss: 0.9275, test_loss: 1.0483, test_f1: 0.4554
 epoch: 22, train_loss: 0.9190, test_loss: 1.0085, test_f1: 0.4625
 epoch: 23, train_loss: 0.9166, test_loss: 0.9671, test_f1: 0.4814
 epoch: 24, train_loss: 0.9092, test_loss: 0.9972, test_f1: 0.4862
 epoch: 25, train_loss: 0.9032, test_loss: 0.9711, test_f1: 0.4998
 epoch: 26, train_loss: 0.8937, test_loss: 0.9789, test_f1: 0.4841
 epoch: 27, train_loss: 0.9084, test_loss: 0.9650, test_f1: 0.5049
 epoch: 28, train_loss: 0.8911, test_loss: 0.9674, test_f1: 0.5141
 epoch: 29, train_loss: 0.8959, test_loss: 0.9685, test_f1: 0.4991
 epoch: 30, train_loss: 0.8779, test_loss: 1.0261, test_f1: 0.4891
 epoch: 31, train_loss: 0.8686, test_loss: 0.9652, test_f1: 0.4856
 epoch: 32, train_loss: 0.8815, test_loss: 0.9384, test_f1: 0.5076
 epoch: 33, train_loss: 0.8840, test_loss: 0.9894, test_f1: 0.4778
 epoch: 34, train_loss: 0.8697, test_loss: 0.9814, test_f1: 0.4923
 epoch: 35, train_loss: 0.8715, test_loss: 0.9454, test_f1: 0.5322
 epoch: 36, train_loss: 0.8517, test_loss: 1.1215, test_f1: 0.4492
 epoch: 37, train_loss: 0.8630, test_loss: 0.9662, test_f1: 0.5209
 epoch: 38, train_loss: 0.8506, test_loss: 0.9222, test_f1: 0.5185
 epoch: 39, train_loss: 0.8556, test_loss: 1.0281, test_f1: 0.5000
 epoch: 40, train_loss: 0.8641, test_loss: 0.9849, test_f1: 0.5121
 epoch: 41, train_loss: 0.8541, test_loss: 0.9139, test_f1: 0.5012
 epoch: 42, train_loss: 0.8441, test_loss: 0.9706, test_f1: 0.4907
 epoch: 43, train_loss: 0.8418, test_loss: 0.9875, test_f1: 0.5088
 epoch: 44, train_loss: 0.8397, test_loss: 0.9354, test_f1: 0.5188
 epoch: 45, train_loss: 0.8456, test_loss: 0.9158, test_f1: 0.5156
 epoch: 46, train_loss: 0.8382, test_loss: 1.0451, test_f1: 0.4781
 epoch: 47, train_loss: 0.8324, test_loss: 0.9677, test_f1: 0.4940
 epoch: 48, train_loss: 0.8237, test_loss: 0.8823, test_f1: 0.5265
 epoch: 49, train_loss: 0.8322, test_loss: 0.9316, test_f1: 0.5129
 epoch: 50, train_loss: 0.8192, test_loss: 0.9813, test_f1: 0.5025
 epoch: 51, train_loss: 0.8110, test_loss: 0.9670, test_f1: 0.5066
 epoch: 52, train_loss: 0.8073, test_loss: 0.9542, test_f1: 0.5251
 epoch: 53, train_loss: 0.8053, test_loss: 0.9588, test_f1: 0.5173
 epoch: 54, train_loss: 0.8103, test_loss: 0.9283, test_f1: 0.5119
 epoch: 55, train_loss: 0.7998, test_loss: 0.9609, test_f1: 0.5141
 epoch: 56, train_loss: 0.8106, test_loss: 0.9972, test_f1: 0.5122
 epoch: 57, train_loss: 0.7983, test_loss: 0.9177, test_f1: 0.5026
 epoch: 58, train_loss: 0.8000, test_loss: 0.9517, test_f1: 0.5282
 epoch: 59, train_loss: 0.7932, test_loss: 0.9457, test_f1: 0.5196
 epoch: 60, train_loss: 0.8067, test_loss: 0.9713, test_f1: 0.5262
 epoch: 61, train_loss: 0.7919, test_loss: 0.9424, test_f1: 0.5346
 epoch: 62, train_loss: 0.7940, test_loss: 0.9133, test_f1: 0.5401
 epoch: 63, train_loss: 0.7923, test_loss: 0.9609, test_f1: 0.5297
 epoch: 64, train_loss: 0.7981, test_loss: 0.9559, test_f1: 0.5120
 epoch: 65, train_loss: 0.7901, test_loss: 0.9922, test_f1: 0.5335
 epoch: 66, train_loss: 0.7974, test_loss: 0.9312, test_f1: 0.5359
 epoch: 67, train_loss: 0.7775, test_loss: 0.9545, test_f1: 0.5278
 epoch: 68, train_loss: 0.7892, test_loss: 1.0142, test_f1: 0.5073
 epoch: 69, train_loss: 0.7861, test_loss: 0.9433, test_f1: 0.5439
 epoch: 70, train_loss: 0.7953, test_loss: 0.9750, test_f1: 0.5107
 epoch: 71, train_loss: 0.7890, test_loss: 1.0264, test_f1: 0.4945
 epoch: 72, train_loss: 0.7836, test_loss: 0.9227, test_f1: 0.5113
 epoch: 73, train_loss: 0.7826, test_loss: 0.9771, test_f1: 0.5337
 epoch: 74, train_loss: 0.7738, test_loss: 0.9703, test_f1: 0.5255
 epoch: 75, train_loss: 0.7822, test_loss: 0.9479, test_f1: 0.5102
 epoch: 76, train_loss: 0.7888, test_loss: 0.9731, test_f1: 0.5254
 epoch: 77, train_loss: 0.7827, test_loss: 0.9733, test_f1: 0.5170
 epoch: 78, train_loss: 0.7791, test_loss: 0.9627, test_f1: 0.5349
 epoch: 79, train_loss: 0.7686, test_loss: 0.9302, test_f1: 0.5413
 epoch: 80, train_loss: 0.7818, test_loss: 0.9552, test_f1: 0.5368
 epoch: 81, train_loss: 0.7737, test_loss: 0.9303, test_f1: 0.5276
 epoch: 82, train_loss: 0.7905, test_loss: 0.9264, test_f1: 0.5285
 epoch: 83, train_loss: 0.7734, test_loss: 0.9828, test_f1: 0.5202
 epoch: 84, train_loss: 0.7716, test_loss: 0.9599, test_f1: 0.5267
 epoch: 85, train_loss: 0.7670, test_loss: 0.9411, test_f1: 0.5416
 epoch: 86, train_loss: 0.7691, test_loss: 0.9472, test_f1: 0.5409
 epoch: 87, train_loss: 0.7685, test_loss: 0.9599, test_f1: 0.5455
 epoch: 88, train_loss: 0.7675, test_loss: 1.0007, test_f1: 0.5260
 epoch: 89, train_loss: 0.7633, test_loss: 0.9833, test_f1: 0.5437
 epoch: 90, train_loss: 0.7595, test_loss: 0.9711, test_f1: 0.5455
 epoch: 91, train_loss: 0.7593, test_loss: 1.0566, test_f1: 0.5356
 epoch: 92, train_loss: 0.7622, test_loss: 0.9370, test_f1: 0.5368
 epoch: 93, train_loss: 0.7603, test_loss: 1.0245, test_f1: 0.5385
 epoch: 94, train_loss: 0.7646, test_loss: 0.9692, test_f1: 0.5273
 epoch: 95, train_loss: 0.7550, test_loss: 0.9562, test_f1: 0.5336
 epoch: 96, train_loss: 0.7566, test_loss: 0.9655, test_f1: 0.5421
 epoch: 97, train_loss: 0.7628, test_loss: 1.0388, test_f1: 0.5443
 epoch: 98, train_loss: 0.7626, test_loss: 0.9688, test_f1: 0.5487
 epoch: 99, train_loss: 0.7656, test_loss: 0.9396, test_f1: 0.5422
##################ITERATION #7 ****************************************
 epoch: 0, train_loss: 1.4070, test_loss: 1.3642, test_f1: 0.2260
 epoch: 1, train_loss: 1.2881, test_loss: 1.3238, test_f1: 0.2260
 epoch: 2, train_loss: 1.2472, test_loss: 1.2697, test_f1: 0.2336
 epoch: 3, train_loss: 1.2161, test_loss: 1.2097, test_f1: 0.2920
 epoch: 4, train_loss: 1.1860, test_loss: 1.1406, test_f1: 0.4021
 epoch: 5, train_loss: 1.1316, test_loss: 1.0773, test_f1: 0.4564
 epoch: 6, train_loss: 1.0968, test_loss: 1.0541, test_f1: 0.4441
 epoch: 7, train_loss: 1.0722, test_loss: 1.0484, test_f1: 0.4592
 epoch: 8, train_loss: 1.0609, test_loss: 1.0133, test_f1: 0.4781
 epoch: 9, train_loss: 1.0366, test_loss: 1.0107, test_f1: 0.4614
 epoch: 10, train_loss: 1.0193, test_loss: 1.0133, test_f1: 0.4499
 epoch: 11, train_loss: 1.0257, test_loss: 1.0221, test_f1: 0.4603
 epoch: 12, train_loss: 1.0167, test_loss: 0.9971, test_f1: 0.4578
 epoch: 13, train_loss: 0.9986, test_loss: 0.9750, test_f1: 0.4867
 epoch: 14, train_loss: 0.9946, test_loss: 0.9782, test_f1: 0.4924
 epoch: 15, train_loss: 0.9920, test_loss: 0.9764, test_f1: 0.4835
 epoch: 16, train_loss: 1.0000, test_loss: 0.9460, test_f1: 0.4835
 epoch: 17, train_loss: 0.9861, test_loss: 0.9528, test_f1: 0.4967
 epoch: 18, train_loss: 0.9677, test_loss: 0.9716, test_f1: 0.4907
 epoch: 19, train_loss: 0.9611, test_loss: 0.9729, test_f1: 0.5106
 epoch: 20, train_loss: 0.9631, test_loss: 0.9724, test_f1: 0.5227
 epoch: 21, train_loss: 0.9516, test_loss: 0.9331, test_f1: 0.5106
 epoch: 22, train_loss: 0.9467, test_loss: 0.9685, test_f1: 0.5073
 epoch: 23, train_loss: 0.9454, test_loss: 1.0340, test_f1: 0.4771
 epoch: 24, train_loss: 0.9459, test_loss: 0.9809, test_f1: 0.4662
 epoch: 25, train_loss: 0.9443, test_loss: 0.9515, test_f1: 0.5238
 epoch: 26, train_loss: 0.9327, test_loss: 0.9560, test_f1: 0.5111
 epoch: 27, train_loss: 0.9243, test_loss: 0.9466, test_f1: 0.5314
 epoch: 28, train_loss: 0.9225, test_loss: 0.9391, test_f1: 0.5208
 epoch: 29, train_loss: 0.9141, test_loss: 0.9436, test_f1: 0.5274
 epoch: 30, train_loss: 0.9000, test_loss: 0.9495, test_f1: 0.5382
 epoch: 31, train_loss: 0.9112, test_loss: 1.1007, test_f1: 0.4758
 epoch: 32, train_loss: 0.9009, test_loss: 0.9497, test_f1: 0.5371
 epoch: 33, train_loss: 0.9030, test_loss: 0.9761, test_f1: 0.5324
 epoch: 34, train_loss: 0.8864, test_loss: 1.0221, test_f1: 0.5016
 epoch: 35, train_loss: 0.8961, test_loss: 0.9520, test_f1: 0.5291
 epoch: 36, train_loss: 0.8970, test_loss: 0.9486, test_f1: 0.5258
 epoch: 37, train_loss: 0.8933, test_loss: 1.0041, test_f1: 0.5182
 epoch: 38, train_loss: 0.8868, test_loss: 0.9563, test_f1: 0.5230
 epoch: 39, train_loss: 0.8848, test_loss: 0.9633, test_f1: 0.5170
 epoch: 40, train_loss: 0.8713, test_loss: 0.9454, test_f1: 0.5509
 epoch: 41, train_loss: 0.8686, test_loss: 0.9319, test_f1: 0.5448
 epoch: 42, train_loss: 0.8773, test_loss: 0.9623, test_f1: 0.5570
 epoch: 43, train_loss: 0.8703, test_loss: 0.9655, test_f1: 0.5224
 epoch: 44, train_loss: 0.8673, test_loss: 0.9340, test_f1: 0.5442
 epoch: 45, train_loss: 0.8663, test_loss: 0.9446, test_f1: 0.5306
 epoch: 46, train_loss: 0.8611, test_loss: 0.9514, test_f1: 0.5628
 epoch: 47, train_loss: 0.8609, test_loss: 0.9292, test_f1: 0.5647
 epoch: 48, train_loss: 0.8496, test_loss: 0.9752, test_f1: 0.5608
 epoch: 49, train_loss: 0.8445, test_loss: 0.9485, test_f1: 0.5342
 epoch: 50, train_loss: 0.8495, test_loss: 0.9775, test_f1: 0.5215
 epoch: 51, train_loss: 0.8328, test_loss: 0.9464, test_f1: 0.5553
 epoch: 52, train_loss: 0.8326, test_loss: 0.9500, test_f1: 0.5465
 epoch: 53, train_loss: 0.8302, test_loss: 0.9314, test_f1: 0.5577
 epoch: 54, train_loss: 0.8317, test_loss: 0.9505, test_f1: 0.5575
 epoch: 55, train_loss: 0.8241, test_loss: 0.9615, test_f1: 0.5598
 epoch: 56, train_loss: 0.8251, test_loss: 0.9531, test_f1: 0.5547
 epoch: 57, train_loss: 0.8181, test_loss: 0.9505, test_f1: 0.5556
 epoch: 58, train_loss: 0.8152, test_loss: 0.9609, test_f1: 0.5522
 epoch: 59, train_loss: 0.8190, test_loss: 0.9352, test_f1: 0.5514
 epoch: 60, train_loss: 0.8126, test_loss: 0.9953, test_f1: 0.5312
 epoch: 61, train_loss: 0.8170, test_loss: 1.0080, test_f1: 0.5361
 epoch: 62, train_loss: 0.8013, test_loss: 0.9581, test_f1: 0.5430
 epoch: 63, train_loss: 0.8066, test_loss: 0.9520, test_f1: 0.5634
 epoch: 64, train_loss: 0.8123, test_loss: 0.9794, test_f1: 0.5471
 epoch: 65, train_loss: 0.8066, test_loss: 0.9438, test_f1: 0.5641
 epoch: 66, train_loss: 0.7991, test_loss: 0.9715, test_f1: 0.5550
 epoch: 67, train_loss: 0.8105, test_loss: 0.9627, test_f1: 0.5536
 epoch: 68, train_loss: 0.7964, test_loss: 1.0319, test_f1: 0.5249
 epoch: 69, train_loss: 0.8035, test_loss: 0.9537, test_f1: 0.5443
 epoch: 70, train_loss: 0.7927, test_loss: 1.0216, test_f1: 0.5396
 epoch: 71, train_loss: 0.8132, test_loss: 0.9132, test_f1: 0.5572
 epoch: 72, train_loss: 0.8049, test_loss: 0.9485, test_f1: 0.5395
 epoch: 73, train_loss: 0.7991, test_loss: 0.9331, test_f1: 0.5592
 epoch: 74, train_loss: 0.8076, test_loss: 0.9575, test_f1: 0.5571
 epoch: 75, train_loss: 0.7889, test_loss: 0.9424, test_f1: 0.5615
 epoch: 76, train_loss: 0.7908, test_loss: 0.9697, test_f1: 0.5417
 epoch: 77, train_loss: 0.7868, test_loss: 0.9732, test_f1: 0.5486
 epoch: 78, train_loss: 0.7920, test_loss: 1.0099, test_f1: 0.5470
 epoch: 79, train_loss: 0.7843, test_loss: 0.9431, test_f1: 0.5598
 epoch: 80, train_loss: 0.7838, test_loss: 1.0394, test_f1: 0.5410
 epoch: 81, train_loss: 0.7952, test_loss: 1.0147, test_f1: 0.5414
 epoch: 82, train_loss: 0.7921, test_loss: 0.9635, test_f1: 0.5483
 epoch: 83, train_loss: 0.7758, test_loss: 1.0071, test_f1: 0.5394
 epoch: 84, train_loss: 0.7833, test_loss: 0.9402, test_f1: 0.5543
 epoch: 85, train_loss: 0.7776, test_loss: 0.9682, test_f1: 0.5570
 epoch: 86, train_loss: 0.7750, test_loss: 0.9517, test_f1: 0.5588
 epoch: 87, train_loss: 0.7726, test_loss: 1.0085, test_f1: 0.5287
 epoch: 88, train_loss: 0.7910, test_loss: 0.9704, test_f1: 0.5558
 epoch: 89, train_loss: 0.7962, test_loss: 0.9730, test_f1: 0.5398
 epoch: 90, train_loss: 0.7812, test_loss: 0.9721, test_f1: 0.5424
 epoch: 91, train_loss: 0.7828, test_loss: 1.0113, test_f1: 0.5227
 epoch: 92, train_loss: 0.7823, test_loss: 0.9622, test_f1: 0.5527
 epoch: 93, train_loss: 0.7675, test_loss: 0.9852, test_f1: 0.5526
 epoch: 94, train_loss: 0.7676, test_loss: 0.9525, test_f1: 0.5621
 epoch: 95, train_loss: 0.7658, test_loss: 0.9706, test_f1: 0.5293
 epoch: 96, train_loss: 0.7654, test_loss: 0.9375, test_f1: 0.5604
 epoch: 97, train_loss: 0.7672, test_loss: 1.0183, test_f1: 0.5386
 epoch: 98, train_loss: 0.7656, test_loss: 0.9803, test_f1: 0.5355
 epoch: 99, train_loss: 0.7665, test_loss: 1.0297, test_f1: 0.5403
##################ITERATION #8 ****************************************
 epoch: 0, train_loss: 1.3534, test_loss: 1.3409, test_f1: 0.2260
 epoch: 1, train_loss: 1.1951, test_loss: 1.3164, test_f1: 0.2311
 epoch: 2, train_loss: 1.1525, test_loss: 1.2242, test_f1: 0.2706
 epoch: 3, train_loss: 1.1242, test_loss: 1.0955, test_f1: 0.4156
 epoch: 4, train_loss: 1.1044, test_loss: 1.0769, test_f1: 0.4221
 epoch: 5, train_loss: 1.0836, test_loss: 1.0708, test_f1: 0.4354
 epoch: 6, train_loss: 1.0623, test_loss: 1.0604, test_f1: 0.4283
 epoch: 7, train_loss: 1.0551, test_loss: 1.0512, test_f1: 0.4526
 epoch: 8, train_loss: 1.0337, test_loss: 1.0602, test_f1: 0.4455
 epoch: 9, train_loss: 1.0403, test_loss: 1.0532, test_f1: 0.4412
 epoch: 10, train_loss: 1.0250, test_loss: 1.0488, test_f1: 0.4405
 epoch: 11, train_loss: 1.0279, test_loss: 1.0616, test_f1: 0.4632
 epoch: 12, train_loss: 1.0197, test_loss: 1.0567, test_f1: 0.4302
 epoch: 13, train_loss: 1.0088, test_loss: 1.0654, test_f1: 0.4398
 epoch: 14, train_loss: 1.0045, test_loss: 1.0762, test_f1: 0.4381
 epoch: 15, train_loss: 0.9968, test_loss: 1.0654, test_f1: 0.4586
 epoch: 16, train_loss: 0.9884, test_loss: 1.0609, test_f1: 0.4634
 epoch: 17, train_loss: 0.9829, test_loss: 1.0984, test_f1: 0.4547
 epoch: 18, train_loss: 0.9892, test_loss: 1.0801, test_f1: 0.4583
 epoch: 19, train_loss: 0.9762, test_loss: 1.0915, test_f1: 0.4690
 epoch: 20, train_loss: 0.9661, test_loss: 1.0675, test_f1: 0.4932
 epoch: 21, train_loss: 0.9708, test_loss: 1.0793, test_f1: 0.4795
 epoch: 22, train_loss: 0.9699, test_loss: 1.0771, test_f1: 0.4863
 epoch: 23, train_loss: 0.9690, test_loss: 1.0852, test_f1: 0.4818
 epoch: 24, train_loss: 0.9639, test_loss: 1.0843, test_f1: 0.4650
 epoch: 25, train_loss: 0.9613, test_loss: 1.1685, test_f1: 0.4521
 epoch: 26, train_loss: 0.9562, test_loss: 1.1149, test_f1: 0.4571
 epoch: 27, train_loss: 0.9512, test_loss: 1.1160, test_f1: 0.4857
 epoch: 28, train_loss: 0.9507, test_loss: 1.0980, test_f1: 0.4933
 epoch: 29, train_loss: 0.9429, test_loss: 1.1462, test_f1: 0.4853
 epoch: 30, train_loss: 0.9275, test_loss: 1.0720, test_f1: 0.4798
 epoch: 31, train_loss: 0.9231, test_loss: 1.0763, test_f1: 0.4861
 epoch: 32, train_loss: 0.9304, test_loss: 1.1271, test_f1: 0.4878
 epoch: 33, train_loss: 0.9247, test_loss: 1.1028, test_f1: 0.4817
 epoch: 34, train_loss: 0.9360, test_loss: 1.0460, test_f1: 0.5144
 epoch: 35, train_loss: 0.9308, test_loss: 1.0565, test_f1: 0.5026
 epoch: 36, train_loss: 0.9196, test_loss: 1.0621, test_f1: 0.5131
 epoch: 37, train_loss: 0.9289, test_loss: 1.0774, test_f1: 0.4861
 epoch: 38, train_loss: 0.9230, test_loss: 1.0982, test_f1: 0.4990
 epoch: 39, train_loss: 0.9194, test_loss: 1.0751, test_f1: 0.5073
 epoch: 40, train_loss: 0.9114, test_loss: 1.0785, test_f1: 0.5076
 epoch: 41, train_loss: 0.9073, test_loss: 1.0808, test_f1: 0.4931
 epoch: 42, train_loss: 0.8992, test_loss: 1.0804, test_f1: 0.5112
 epoch: 43, train_loss: 0.9048, test_loss: 1.0592, test_f1: 0.5072
 epoch: 44, train_loss: 0.9172, test_loss: 1.0836, test_f1: 0.4946
 epoch: 45, train_loss: 0.8963, test_loss: 1.0807, test_f1: 0.5110
 epoch: 46, train_loss: 0.8919, test_loss: 1.1417, test_f1: 0.5120
 epoch: 47, train_loss: 0.8952, test_loss: 1.1021, test_f1: 0.5071
 epoch: 48, train_loss: 0.8978, test_loss: 1.1013, test_f1: 0.5136
 epoch: 49, train_loss: 0.8869, test_loss: 1.1076, test_f1: 0.4923
 epoch: 50, train_loss: 0.8927, test_loss: 1.1258, test_f1: 0.5118
 epoch: 51, train_loss: 0.8851, test_loss: 1.0941, test_f1: 0.5214
 epoch: 52, train_loss: 0.8738, test_loss: 1.0630, test_f1: 0.5203
 epoch: 53, train_loss: 0.8771, test_loss: 1.0784, test_f1: 0.5314
 epoch: 54, train_loss: 0.8641, test_loss: 1.0695, test_f1: 0.5156
 epoch: 55, train_loss: 0.8706, test_loss: 1.0750, test_f1: 0.5270
 epoch: 56, train_loss: 0.8676, test_loss: 1.1750, test_f1: 0.5117
 epoch: 57, train_loss: 0.8730, test_loss: 1.1191, test_f1: 0.5059
 epoch: 58, train_loss: 0.8678, test_loss: 1.1011, test_f1: 0.5198
 epoch: 59, train_loss: 0.8704, test_loss: 1.0771, test_f1: 0.5335
 epoch: 60, train_loss: 0.8660, test_loss: 1.0840, test_f1: 0.5095
 epoch: 61, train_loss: 0.8581, test_loss: 1.0608, test_f1: 0.5386
 epoch: 62, train_loss: 0.8585, test_loss: 1.1114, test_f1: 0.5106
 epoch: 63, train_loss: 0.8592, test_loss: 1.1288, test_f1: 0.5138
 epoch: 64, train_loss: 0.8626, test_loss: 1.0807, test_f1: 0.5033
 epoch: 65, train_loss: 0.8454, test_loss: 1.0731, test_f1: 0.5200
 epoch: 66, train_loss: 0.8490, test_loss: 1.1155, test_f1: 0.5003
 epoch: 67, train_loss: 0.8555, test_loss: 1.1234, test_f1: 0.5010
 epoch: 68, train_loss: 0.8520, test_loss: 1.0944, test_f1: 0.5174
 epoch: 69, train_loss: 0.8566, test_loss: 1.0974, test_f1: 0.5201
 epoch: 70, train_loss: 0.8568, test_loss: 1.0748, test_f1: 0.5093
 epoch: 71, train_loss: 0.8529, test_loss: 1.0687, test_f1: 0.5167
 epoch: 72, train_loss: 0.8530, test_loss: 1.0728, test_f1: 0.5082
 epoch: 73, train_loss: 0.8412, test_loss: 1.0927, test_f1: 0.5213
 epoch: 74, train_loss: 0.8374, test_loss: 1.1476, test_f1: 0.5023
 epoch: 75, train_loss: 0.8559, test_loss: 1.1184, test_f1: 0.5089
 epoch: 76, train_loss: 0.8419, test_loss: 1.0592, test_f1: 0.5215
 epoch: 77, train_loss: 0.8338, test_loss: 1.1295, test_f1: 0.5016
 epoch: 78, train_loss: 0.8459, test_loss: 1.1434, test_f1: 0.5019
 epoch: 79, train_loss: 0.8433, test_loss: 1.0740, test_f1: 0.5292
 epoch: 80, train_loss: 0.8437, test_loss: 1.1006, test_f1: 0.5044
 epoch: 81, train_loss: 0.8327, test_loss: 1.0582, test_f1: 0.5342
 epoch: 82, train_loss: 0.8349, test_loss: 1.0781, test_f1: 0.5228
 epoch: 83, train_loss: 0.8292, test_loss: 1.1072, test_f1: 0.5040
 epoch: 84, train_loss: 0.8217, test_loss: 1.0902, test_f1: 0.5228
 epoch: 85, train_loss: 0.8338, test_loss: 1.0925, test_f1: 0.5135
 epoch: 86, train_loss: 0.8315, test_loss: 1.0825, test_f1: 0.5080
 epoch: 87, train_loss: 0.8413, test_loss: 1.1699, test_f1: 0.4922
 epoch: 88, train_loss: 0.8337, test_loss: 1.0571, test_f1: 0.5314
 epoch: 89, train_loss: 0.8289, test_loss: 1.0895, test_f1: 0.5066
 epoch: 90, train_loss: 0.8201, test_loss: 1.0591, test_f1: 0.5213
 epoch: 91, train_loss: 0.8285, test_loss: 1.0665, test_f1: 0.5051
 epoch: 92, train_loss: 0.8220, test_loss: 1.1007, test_f1: 0.5161
 epoch: 93, train_loss: 0.8322, test_loss: 1.0874, test_f1: 0.5090
 epoch: 94, train_loss: 0.8296, test_loss: 1.1655, test_f1: 0.4922
 epoch: 95, train_loss: 0.8170, test_loss: 1.0704, test_f1: 0.5117
 epoch: 96, train_loss: 0.8192, test_loss: 1.0901, test_f1: 0.5154
 epoch: 97, train_loss: 0.8158, test_loss: 1.0862, test_f1: 0.5020
 epoch: 98, train_loss: 0.8213, test_loss: 1.0941, test_f1: 0.5120
 epoch: 99, train_loss: 0.8099, test_loss: 1.0865, test_f1: 0.5294
##################ITERATION #9 ****************************************
 epoch: 0, train_loss: 1.3639, test_loss: 1.3220, test_f1: 0.2260
 epoch: 1, train_loss: 1.1745, test_loss: 1.2479, test_f1: 0.2286
 epoch: 2, train_loss: 1.1231, test_loss: 1.1290, test_f1: 0.3660
 epoch: 3, train_loss: 1.0858, test_loss: 1.0815, test_f1: 0.3869
 epoch: 4, train_loss: 1.0714, test_loss: 1.0689, test_f1: 0.3848
 epoch: 5, train_loss: 1.0547, test_loss: 1.0672, test_f1: 0.4187
 epoch: 6, train_loss: 1.0397, test_loss: 1.0794, test_f1: 0.4164
 epoch: 7, train_loss: 1.0346, test_loss: 1.0357, test_f1: 0.4596
 epoch: 8, train_loss: 1.0252, test_loss: 1.0447, test_f1: 0.4648
 epoch: 9, train_loss: 1.0194, test_loss: 1.0470, test_f1: 0.4733
 epoch: 10, train_loss: 1.0047, test_loss: 1.0346, test_f1: 0.4689
 epoch: 11, train_loss: 1.0024, test_loss: 1.0122, test_f1: 0.4716
 epoch: 12, train_loss: 0.9908, test_loss: 1.0272, test_f1: 0.4694
 epoch: 13, train_loss: 0.9928, test_loss: 1.0192, test_f1: 0.4781
 epoch: 14, train_loss: 0.9779, test_loss: 1.0134, test_f1: 0.4619
 epoch: 15, train_loss: 0.9739, test_loss: 1.0351, test_f1: 0.4973
 epoch: 16, train_loss: 0.9651, test_loss: 1.0183, test_f1: 0.5028
 epoch: 17, train_loss: 0.9669, test_loss: 1.0103, test_f1: 0.4927
 epoch: 18, train_loss: 0.9592, test_loss: 1.0456, test_f1: 0.4946
 epoch: 19, train_loss: 0.9506, test_loss: 1.0268, test_f1: 0.4816
 epoch: 20, train_loss: 0.9616, test_loss: 1.0377, test_f1: 0.5094
 epoch: 21, train_loss: 0.9448, test_loss: 1.0245, test_f1: 0.4973
 epoch: 22, train_loss: 0.9424, test_loss: 1.0248, test_f1: 0.4938
 epoch: 23, train_loss: 0.9423, test_loss: 0.9919, test_f1: 0.5023
 epoch: 24, train_loss: 0.9282, test_loss: 1.0333, test_f1: 0.5080
 epoch: 25, train_loss: 0.9243, test_loss: 0.9940, test_f1: 0.4943
 epoch: 26, train_loss: 0.9250, test_loss: 0.9926, test_f1: 0.4921
 epoch: 27, train_loss: 0.9310, test_loss: 1.0473, test_f1: 0.4957
 epoch: 28, train_loss: 0.9159, test_loss: 1.0184, test_f1: 0.4858
 epoch: 29, train_loss: 0.9149, test_loss: 1.0403, test_f1: 0.5160
 epoch: 30, train_loss: 0.9119, test_loss: 0.9820, test_f1: 0.5025
 epoch: 31, train_loss: 0.9070, test_loss: 1.0165, test_f1: 0.5090
 epoch: 32, train_loss: 0.8896, test_loss: 0.9918, test_f1: 0.5232
 epoch: 33, train_loss: 0.9062, test_loss: 1.0192, test_f1: 0.5061
 epoch: 34, train_loss: 0.8963, test_loss: 0.9873, test_f1: 0.4934
 epoch: 35, train_loss: 0.9018, test_loss: 1.0353, test_f1: 0.5179
 epoch: 36, train_loss: 0.8813, test_loss: 0.9816, test_f1: 0.5054
 epoch: 37, train_loss: 0.8741, test_loss: 1.0142, test_f1: 0.5158
 epoch: 38, train_loss: 0.8726, test_loss: 0.9822, test_f1: 0.5211
 epoch: 39, train_loss: 0.8774, test_loss: 1.0410, test_f1: 0.5203
 epoch: 40, train_loss: 0.8632, test_loss: 1.0051, test_f1: 0.5278
 epoch: 41, train_loss: 0.8675, test_loss: 1.0198, test_f1: 0.5301
 epoch: 42, train_loss: 0.8594, test_loss: 1.0053, test_f1: 0.5335
 epoch: 43, train_loss: 0.8763, test_loss: 1.0344, test_f1: 0.5313
 epoch: 44, train_loss: 0.8713, test_loss: 1.0153, test_f1: 0.5167
 epoch: 45, train_loss: 0.8608, test_loss: 0.9922, test_f1: 0.5233
 epoch: 46, train_loss: 0.8640, test_loss: 1.0017, test_f1: 0.5374
 epoch: 47, train_loss: 0.8543, test_loss: 0.9853, test_f1: 0.5354
 epoch: 48, train_loss: 0.8499, test_loss: 0.9937, test_f1: 0.5296
 epoch: 49, train_loss: 0.8490, test_loss: 1.0151, test_f1: 0.5321
 epoch: 50, train_loss: 0.8557, test_loss: 1.0162, test_f1: 0.5357
 epoch: 51, train_loss: 0.8405, test_loss: 0.9896, test_f1: 0.5328
 epoch: 52, train_loss: 0.8229, test_loss: 1.0103, test_f1: 0.5334
 epoch: 53, train_loss: 0.8293, test_loss: 1.0328, test_f1: 0.5265
 epoch: 54, train_loss: 0.8333, test_loss: 1.0344, test_f1: 0.5182
 epoch: 55, train_loss: 0.8161, test_loss: 1.0269, test_f1: 0.5267
 epoch: 56, train_loss: 0.8258, test_loss: 1.0284, test_f1: 0.5218
 epoch: 57, train_loss: 0.8203, test_loss: 1.0135, test_f1: 0.5127
 epoch: 58, train_loss: 0.8197, test_loss: 1.0250, test_f1: 0.5361
 epoch: 59, train_loss: 0.8100, test_loss: 1.0508, test_f1: 0.5240
 epoch: 60, train_loss: 0.8195, test_loss: 1.0231, test_f1: 0.5306
 epoch: 61, train_loss: 0.8207, test_loss: 1.0575, test_f1: 0.5240
 epoch: 62, train_loss: 0.8167, test_loss: 1.0238, test_f1: 0.5344
 epoch: 63, train_loss: 0.8239, test_loss: 1.0184, test_f1: 0.5330
 epoch: 64, train_loss: 0.8066, test_loss: 1.0413, test_f1: 0.5335
 epoch: 65, train_loss: 0.8092, test_loss: 1.0153, test_f1: 0.5329
 epoch: 66, train_loss: 0.8161, test_loss: 0.9995, test_f1: 0.5447
 epoch: 67, train_loss: 0.8103, test_loss: 1.0289, test_f1: 0.5305
 epoch: 68, train_loss: 0.8017, test_loss: 1.0118, test_f1: 0.5299
 epoch: 69, train_loss: 0.8016, test_loss: 1.0266, test_f1: 0.5161
 epoch: 70, train_loss: 0.8051, test_loss: 1.0063, test_f1: 0.5267
 epoch: 71, train_loss: 0.8022, test_loss: 1.0629, test_f1: 0.5290
 epoch: 72, train_loss: 0.8007, test_loss: 1.0285, test_f1: 0.5241
 epoch: 73, train_loss: 0.8031, test_loss: 1.0532, test_f1: 0.5238
 epoch: 74, train_loss: 0.7977, test_loss: 1.0658, test_f1: 0.5235
 epoch: 75, train_loss: 0.8064, test_loss: 1.0143, test_f1: 0.5268
 epoch: 76, train_loss: 0.7857, test_loss: 1.0116, test_f1: 0.5318
 epoch: 77, train_loss: 0.7899, test_loss: 1.0377, test_f1: 0.5319
 epoch: 78, train_loss: 0.7874, test_loss: 1.0349, test_f1: 0.5310
 epoch: 79, train_loss: 0.7918, test_loss: 1.0264, test_f1: 0.5269
 epoch: 80, train_loss: 0.7837, test_loss: 1.0369, test_f1: 0.5286
 epoch: 81, train_loss: 0.7895, test_loss: 1.0242, test_f1: 0.5247
 epoch: 82, train_loss: 0.7847, test_loss: 1.0323, test_f1: 0.5343
 epoch: 83, train_loss: 0.7957, test_loss: 1.0196, test_f1: 0.5299
 epoch: 84, train_loss: 0.8009, test_loss: 0.9967, test_f1: 0.5258
 epoch: 85, train_loss: 0.7833, test_loss: 1.0404, test_f1: 0.5128
 epoch: 86, train_loss: 0.7873, test_loss: 1.0327, test_f1: 0.5182
 epoch: 87, train_loss: 0.7871, test_loss: 1.0378, test_f1: 0.5224
 epoch: 88, train_loss: 0.7827, test_loss: 1.0444, test_f1: 0.5397
 epoch: 89, train_loss: 0.7680, test_loss: 1.0371, test_f1: 0.5259
 epoch: 90, train_loss: 0.7654, test_loss: 1.0721, test_f1: 0.5378
 epoch: 91, train_loss: 0.7736, test_loss: 1.0234, test_f1: 0.5213
 epoch: 92, train_loss: 0.7690, test_loss: 1.0728, test_f1: 0.5234
 epoch: 93, train_loss: 0.7708, test_loss: 1.0166, test_f1: 0.5364
 epoch: 94, train_loss: 0.7671, test_loss: 1.0283, test_f1: 0.5413
 epoch: 95, train_loss: 0.7663, test_loss: 1.0291, test_f1: 0.5406
 epoch: 96, train_loss: 0.7724, test_loss: 0.9742, test_f1: 0.5516
 epoch: 97, train_loss: 0.7732, test_loss: 1.0366, test_f1: 0.5384
 epoch: 98, train_loss: 0.7642, test_loss: 1.0518, test_f1: 0.5329
 epoch: 99, train_loss: 0.7619, test_loss: 1.0315, test_f1: 0.5407

Training completed in 432.75 seconds
Best F1: 0.5659 at epoch 94
Mean F1 across iterations: 0.5432  0.0166
========================FINAL RESULTS================================
FEGIN weighted F1: 0.5659  0.0166
python main.py --data ltspice_examples --representation component_pin --model FEGIN --layers 5 --hiddens 16 --batch_size 256 --lr 0.001 --emb_size 128 --epochs 100 --save_appendix component_pin_L5_H16_BS256_LR0.001_E128 --no_val
-----



STDERR:
  File "main.py", line 370, in <module>
    main()
  File "main.py", line 254, in main
    dataset = dataset_class(
  File "/home/philip/projects/ltspice_examples_code_repo/Circuit-Completion-Using-GNNs/component_classification_with_link_prediction_head/evaluation/FEGIN/kernel/circuit_datasets.py", line 15, in __init__
    self.data, self.slices = torch.load(self.processed_paths[0])
  File "/home/philip/.local/lib/python3.8/site-packages/torch/serialization.py", line 1040, in load
    warnings.warn(
  File "/usr/lib/python3.8/warnings.py", line 109, in _showwarnmsg
    sw(msg.message, msg.category, msg.filename, msg.lineno,
  File "main.py", line 47, in warn_with_traceback
    traceback.print_stack(file=log)
/home/philip/projects/ltspice_examples_code_repo/Circuit-Completion-Using-GNNs/component_classification_with_link_prediction_head/evaluation/FEGIN/kernel/circuit_datasets.py:15: FutureWarning: You are using `torch.load` with `weights_only=False` (the current default value), which uses the default pickle module implicitly. It is possible to construct malicious pickle data which will execute arbitrary code during unpickling (See https://github.com/pytorch/pytorch/blob/main/SECURITY.md#untrusted-models for more details). In a future release, the default value for `weights_only` will be flipped to `True`. This limits the functions that could be executed during unpickling. Arbitrary objects will no longer be allowed to be loaded via this mode unless they are explicitly allowlisted by the user via `torch.serialization.add_safe_globals`. We recommend you start setting `weights_only=True` for any use case where you don't have full control of the loaded file. Please open an issue on GitHub for any issues related to this experimental feature.
  self.data, self.slices = torch.load(self.processed_paths[0])
