STDOUT:
Results will be saved in /home/philip/projects/ltspice_examples_code_repo/Circuit-Completion-Using-GNNs/component_classification_with_link_prediction_head/evaluation/FEGIN/results/model_FEGIN_dataset_ltspice_examples
Command line input: python main.py --data ltspice_examples --representation component_pin --model FEGIN --layers 5 --hiddens 32 --batch_size 32 --lr 0.0001 --emb_size 250 --epochs 100 --save_appendix component_pin_L5_H32_BS32_LR0.0001_E250 --no_val
 is saved.
-----
ltspice_examples - FEGIN
Using 5 layers, 32 hidden units, h = 2
Loading component_pin representation dataset
ENTERED
Training FEGIN on component_pin representation
Train: 3560, Test: 848
##################ITERATION #0 ****************************************
 epoch: 0, train_loss: 1.3901, test_loss: 1.3753, test_f1: 0.1019
 epoch: 1, train_loss: 1.3616, test_loss: 1.3511, test_f1: 0.2225
 epoch: 2, train_loss: 1.3297, test_loss: 1.3189, test_f1: 0.2340
 epoch: 3, train_loss: 1.2948, test_loss: 1.2846, test_f1: 0.2260
 epoch: 4, train_loss: 1.2672, test_loss: 1.2605, test_f1: 0.2260
 epoch: 5, train_loss: 1.2504, test_loss: 1.2385, test_f1: 0.2295
 epoch: 6, train_loss: 1.2390, test_loss: 1.2238, test_f1: 0.2311
 epoch: 7, train_loss: 1.2275, test_loss: 1.2091, test_f1: 0.2365
 epoch: 8, train_loss: 1.2139, test_loss: 1.1949, test_f1: 0.2379
 epoch: 9, train_loss: 1.2046, test_loss: 1.1850, test_f1: 0.2315
 epoch: 10, train_loss: 1.1947, test_loss: 1.1722, test_f1: 0.2974
 epoch: 11, train_loss: 1.1806, test_loss: 1.1594, test_f1: 0.3371
 epoch: 12, train_loss: 1.1717, test_loss: 1.1442, test_f1: 0.3334
 epoch: 13, train_loss: 1.1592, test_loss: 1.1271, test_f1: 0.3391
 epoch: 14, train_loss: 1.1353, test_loss: 1.1104, test_f1: 0.3371
 epoch: 15, train_loss: 1.1176, test_loss: 1.0839, test_f1: 0.3505
 epoch: 16, train_loss: 1.0985, test_loss: 1.0623, test_f1: 0.3702
 epoch: 17, train_loss: 1.0771, test_loss: 1.0420, test_f1: 0.3652
 epoch: 18, train_loss: 1.0504, test_loss: 1.0243, test_f1: 0.3706
 epoch: 19, train_loss: 1.0414, test_loss: 1.0146, test_f1: 0.3873
 epoch: 20, train_loss: 1.0293, test_loss: 1.0080, test_f1: 0.3783
 epoch: 21, train_loss: 1.0212, test_loss: 1.0013, test_f1: 0.3851
 epoch: 22, train_loss: 1.0104, test_loss: 0.9886, test_f1: 0.3879
 epoch: 23, train_loss: 1.0036, test_loss: 0.9892, test_f1: 0.4145
 epoch: 24, train_loss: 0.9946, test_loss: 0.9827, test_f1: 0.4250
 epoch: 25, train_loss: 0.9836, test_loss: 0.9847, test_f1: 0.4302
 epoch: 26, train_loss: 0.9773, test_loss: 0.9712, test_f1: 0.4600
 epoch: 27, train_loss: 0.9825, test_loss: 0.9733, test_f1: 0.4575
 epoch: 28, train_loss: 0.9768, test_loss: 0.9830, test_f1: 0.4468
 epoch: 29, train_loss: 0.9653, test_loss: 0.9911, test_f1: 0.4522
 epoch: 30, train_loss: 0.9648, test_loss: 0.9760, test_f1: 0.4436
 epoch: 31, train_loss: 0.9485, test_loss: 0.9626, test_f1: 0.4681
 epoch: 32, train_loss: 0.9557, test_loss: 0.9605, test_f1: 0.4923
 epoch: 33, train_loss: 0.9517, test_loss: 0.9563, test_f1: 0.4903
 epoch: 34, train_loss: 0.9424, test_loss: 0.9548, test_f1: 0.4941
 epoch: 35, train_loss: 0.9451, test_loss: 0.9682, test_f1: 0.4787
 epoch: 36, train_loss: 0.9341, test_loss: 0.9679, test_f1: 0.4779
 epoch: 37, train_loss: 0.9396, test_loss: 0.9633, test_f1: 0.4998
 epoch: 38, train_loss: 0.9261, test_loss: 0.9665, test_f1: 0.4834
 epoch: 39, train_loss: 0.9304, test_loss: 0.9487, test_f1: 0.4958
 epoch: 40, train_loss: 0.9242, test_loss: 0.9642, test_f1: 0.5020
 epoch: 41, train_loss: 0.9294, test_loss: 0.9788, test_f1: 0.4760
 epoch: 42, train_loss: 0.9204, test_loss: 0.9764, test_f1: 0.4863
 epoch: 43, train_loss: 0.9148, test_loss: 0.9525, test_f1: 0.4855
 epoch: 44, train_loss: 0.8975, test_loss: 0.9776, test_f1: 0.4725
 epoch: 45, train_loss: 0.9161, test_loss: 0.9439, test_f1: 0.4980
 epoch: 46, train_loss: 0.9101, test_loss: 0.9626, test_f1: 0.5087
 epoch: 47, train_loss: 0.8998, test_loss: 0.9593, test_f1: 0.5112
 epoch: 48, train_loss: 0.9024, test_loss: 0.9494, test_f1: 0.4961
 epoch: 49, train_loss: 0.8959, test_loss: 0.9489, test_f1: 0.4927
 epoch: 50, train_loss: 0.9006, test_loss: 0.9386, test_f1: 0.5111
 epoch: 51, train_loss: 0.8883, test_loss: 0.9516, test_f1: 0.5056
 epoch: 52, train_loss: 0.8874, test_loss: 0.9535, test_f1: 0.4962
 epoch: 53, train_loss: 0.8803, test_loss: 0.9355, test_f1: 0.5058
 epoch: 54, train_loss: 0.8843, test_loss: 0.9342, test_f1: 0.5225
 epoch: 55, train_loss: 0.8758, test_loss: 0.9577, test_f1: 0.4850
 epoch: 56, train_loss: 0.8769, test_loss: 0.9586, test_f1: 0.4895
 epoch: 57, train_loss: 0.8779, test_loss: 0.9352, test_f1: 0.5175
 epoch: 58, train_loss: 0.8826, test_loss: 0.9428, test_f1: 0.5077
 epoch: 59, train_loss: 0.8766, test_loss: 0.9550, test_f1: 0.4984
 epoch: 60, train_loss: 0.8807, test_loss: 0.9416, test_f1: 0.5160
 epoch: 61, train_loss: 0.8661, test_loss: 0.9532, test_f1: 0.5115
 epoch: 62, train_loss: 0.8698, test_loss: 0.9430, test_f1: 0.5118
 epoch: 63, train_loss: 0.8666, test_loss: 0.9570, test_f1: 0.5034
 epoch: 64, train_loss: 0.8691, test_loss: 0.9514, test_f1: 0.5247
 epoch: 65, train_loss: 0.8743, test_loss: 0.9431, test_f1: 0.5174
 epoch: 66, train_loss: 0.8745, test_loss: 0.9398, test_f1: 0.5166
 epoch: 67, train_loss: 0.8654, test_loss: 0.9504, test_f1: 0.5118
 epoch: 68, train_loss: 0.8667, test_loss: 0.9303, test_f1: 0.5078
 epoch: 69, train_loss: 0.8521, test_loss: 0.9363, test_f1: 0.5105
 epoch: 70, train_loss: 0.8593, test_loss: 0.9407, test_f1: 0.4994
 epoch: 71, train_loss: 0.8611, test_loss: 0.9275, test_f1: 0.5197
 epoch: 72, train_loss: 0.8651, test_loss: 0.9309, test_f1: 0.5101
 epoch: 73, train_loss: 0.8645, test_loss: 0.9326, test_f1: 0.4994
 epoch: 74, train_loss: 0.8672, test_loss: 0.9376, test_f1: 0.5128
 epoch: 75, train_loss: 0.8649, test_loss: 0.9352, test_f1: 0.5196
 epoch: 76, train_loss: 0.8622, test_loss: 0.9500, test_f1: 0.4934
 epoch: 77, train_loss: 0.8499, test_loss: 0.9257, test_f1: 0.5192
 epoch: 78, train_loss: 0.8469, test_loss: 0.9253, test_f1: 0.5238
 epoch: 79, train_loss: 0.8562, test_loss: 0.9238, test_f1: 0.5259
 epoch: 80, train_loss: 0.8485, test_loss: 0.9264, test_f1: 0.5250
 epoch: 81, train_loss: 0.8406, test_loss: 0.9310, test_f1: 0.5088
 epoch: 82, train_loss: 0.8506, test_loss: 0.9370, test_f1: 0.5007
 epoch: 83, train_loss: 0.8457, test_loss: 0.9428, test_f1: 0.5177
 epoch: 84, train_loss: 0.8418, test_loss: 0.9360, test_f1: 0.5210
 epoch: 85, train_loss: 0.8399, test_loss: 0.9294, test_f1: 0.5004
 epoch: 86, train_loss: 0.8398, test_loss: 0.9378, test_f1: 0.5155
 epoch: 87, train_loss: 0.8488, test_loss: 0.9336, test_f1: 0.5124
 epoch: 88, train_loss: 0.8361, test_loss: 0.9390, test_f1: 0.5095
 epoch: 89, train_loss: 0.8436, test_loss: 0.9384, test_f1: 0.5040
 epoch: 90, train_loss: 0.8471, test_loss: 0.9318, test_f1: 0.5072
 epoch: 91, train_loss: 0.8436, test_loss: 0.9317, test_f1: 0.5160
 epoch: 92, train_loss: 0.8369, test_loss: 0.9437, test_f1: 0.5238
 epoch: 93, train_loss: 0.8341, test_loss: 0.9483, test_f1: 0.5241
 epoch: 94, train_loss: 0.8265, test_loss: 0.9332, test_f1: 0.5020
 epoch: 95, train_loss: 0.8343, test_loss: 0.9338, test_f1: 0.5261
 epoch: 96, train_loss: 0.8382, test_loss: 0.9333, test_f1: 0.5133
 epoch: 97, train_loss: 0.8335, test_loss: 0.9491, test_f1: 0.5182
 epoch: 98, train_loss: 0.8280, test_loss: 0.9346, test_f1: 0.5125
 epoch: 99, train_loss: 0.8358, test_loss: 0.9450, test_f1: 0.5130
##################ITERATION #1 ****************************************
 epoch: 0, train_loss: 1.3282, test_loss: 1.2853, test_f1: 0.2282
 epoch: 1, train_loss: 1.2660, test_loss: 1.2295, test_f1: 0.2925
 epoch: 2, train_loss: 1.2290, test_loss: 1.1849, test_f1: 0.3392
 epoch: 3, train_loss: 1.1948, test_loss: 1.1498, test_f1: 0.3381
 epoch: 4, train_loss: 1.1607, test_loss: 1.1178, test_f1: 0.3400
 epoch: 5, train_loss: 1.1311, test_loss: 1.0920, test_f1: 0.3426
 epoch: 6, train_loss: 1.1101, test_loss: 1.0714, test_f1: 0.3429
 epoch: 7, train_loss: 1.0945, test_loss: 1.0557, test_f1: 0.3438
 epoch: 8, train_loss: 1.0743, test_loss: 1.0497, test_f1: 0.3447
 epoch: 9, train_loss: 1.0620, test_loss: 1.0505, test_f1: 0.3324
 epoch: 10, train_loss: 1.0521, test_loss: 1.0404, test_f1: 0.3459
 epoch: 11, train_loss: 1.0477, test_loss: 1.0456, test_f1: 0.3509
 epoch: 12, train_loss: 1.0392, test_loss: 1.0219, test_f1: 0.3682
 epoch: 13, train_loss: 1.0299, test_loss: 1.0195, test_f1: 0.3873
 epoch: 14, train_loss: 1.0291, test_loss: 1.0245, test_f1: 0.4063
 epoch: 15, train_loss: 1.0232, test_loss: 1.0266, test_f1: 0.4135
 epoch: 16, train_loss: 1.0057, test_loss: 1.0306, test_f1: 0.4287
 epoch: 17, train_loss: 1.0040, test_loss: 1.0026, test_f1: 0.4507
 epoch: 18, train_loss: 1.0008, test_loss: 1.0119, test_f1: 0.4345
 epoch: 19, train_loss: 0.9909, test_loss: 1.0150, test_f1: 0.4640
 epoch: 20, train_loss: 0.9858, test_loss: 1.0302, test_f1: 0.4195
 epoch: 21, train_loss: 0.9880, test_loss: 0.9837, test_f1: 0.4664
 epoch: 22, train_loss: 0.9825, test_loss: 0.9858, test_f1: 0.4701
 epoch: 23, train_loss: 0.9826, test_loss: 0.9841, test_f1: 0.4720
 epoch: 24, train_loss: 0.9773, test_loss: 0.9775, test_f1: 0.4586
 epoch: 25, train_loss: 0.9710, test_loss: 0.9730, test_f1: 0.4663
 epoch: 26, train_loss: 0.9734, test_loss: 0.9892, test_f1: 0.4755
 epoch: 27, train_loss: 0.9646, test_loss: 0.9865, test_f1: 0.4813
 epoch: 28, train_loss: 0.9612, test_loss: 0.9989, test_f1: 0.4808
 epoch: 29, train_loss: 0.9534, test_loss: 0.9771, test_f1: 0.4935
 epoch: 30, train_loss: 0.9512, test_loss: 0.9721, test_f1: 0.4959
 epoch: 31, train_loss: 0.9419, test_loss: 0.9670, test_f1: 0.4984
 epoch: 32, train_loss: 0.9474, test_loss: 0.9451, test_f1: 0.5006
 epoch: 33, train_loss: 0.9391, test_loss: 0.9676, test_f1: 0.5089
 epoch: 34, train_loss: 0.9282, test_loss: 0.9530, test_f1: 0.5051
 epoch: 35, train_loss: 0.9260, test_loss: 0.9495, test_f1: 0.5128
 epoch: 36, train_loss: 0.9196, test_loss: 0.9489, test_f1: 0.5073
 epoch: 37, train_loss: 0.9204, test_loss: 0.9463, test_f1: 0.5144
 epoch: 38, train_loss: 0.9177, test_loss: 0.9193, test_f1: 0.5044
 epoch: 39, train_loss: 0.9146, test_loss: 0.9583, test_f1: 0.5171
 epoch: 40, train_loss: 0.9151, test_loss: 0.9439, test_f1: 0.5140
 epoch: 41, train_loss: 0.8952, test_loss: 0.9231, test_f1: 0.5110
 epoch: 42, train_loss: 0.9008, test_loss: 0.9271, test_f1: 0.5353
 epoch: 43, train_loss: 0.8997, test_loss: 0.9302, test_f1: 0.5293
 epoch: 44, train_loss: 0.8974, test_loss: 0.9158, test_f1: 0.5149
 epoch: 45, train_loss: 0.8948, test_loss: 0.8935, test_f1: 0.5155
 epoch: 46, train_loss: 0.8888, test_loss: 0.8790, test_f1: 0.5230
 epoch: 47, train_loss: 0.8890, test_loss: 0.8899, test_f1: 0.5289
 epoch: 48, train_loss: 0.8804, test_loss: 0.8852, test_f1: 0.5252
 epoch: 49, train_loss: 0.8821, test_loss: 0.9021, test_f1: 0.5222
 epoch: 50, train_loss: 0.8752, test_loss: 0.8957, test_f1: 0.5122
 epoch: 51, train_loss: 0.8642, test_loss: 0.8939, test_f1: 0.5340
 epoch: 52, train_loss: 0.8668, test_loss: 0.8834, test_f1: 0.5259
 epoch: 53, train_loss: 0.8634, test_loss: 0.8893, test_f1: 0.5241
 epoch: 54, train_loss: 0.8675, test_loss: 0.8931, test_f1: 0.5236
 epoch: 55, train_loss: 0.8707, test_loss: 0.8873, test_f1: 0.5194
 epoch: 56, train_loss: 0.8627, test_loss: 0.8691, test_f1: 0.5437
 epoch: 57, train_loss: 0.8544, test_loss: 0.8858, test_f1: 0.5324
 epoch: 58, train_loss: 0.8609, test_loss: 0.8682, test_f1: 0.5459
 epoch: 59, train_loss: 0.8569, test_loss: 0.8905, test_f1: 0.5341
 epoch: 60, train_loss: 0.8581, test_loss: 0.8944, test_f1: 0.5206
 epoch: 61, train_loss: 0.8634, test_loss: 0.8783, test_f1: 0.5272
 epoch: 62, train_loss: 0.8590, test_loss: 0.8779, test_f1: 0.5332
 epoch: 63, train_loss: 0.8663, test_loss: 0.8826, test_f1: 0.5142
 epoch: 64, train_loss: 0.8592, test_loss: 0.8913, test_f1: 0.5228
 epoch: 65, train_loss: 0.8442, test_loss: 0.8711, test_f1: 0.5289
 epoch: 66, train_loss: 0.8548, test_loss: 0.8718, test_f1: 0.5200
 epoch: 67, train_loss: 0.8489, test_loss: 0.8823, test_f1: 0.5255
 epoch: 68, train_loss: 0.8499, test_loss: 0.8747, test_f1: 0.5262
 epoch: 69, train_loss: 0.8466, test_loss: 0.9041, test_f1: 0.5393
 epoch: 70, train_loss: 0.8597, test_loss: 0.8853, test_f1: 0.5275
 epoch: 71, train_loss: 0.8498, test_loss: 0.8683, test_f1: 0.5431
 epoch: 72, train_loss: 0.8499, test_loss: 0.8805, test_f1: 0.5350
 epoch: 73, train_loss: 0.8362, test_loss: 0.8868, test_f1: 0.5281
 epoch: 74, train_loss: 0.8462, test_loss: 0.8584, test_f1: 0.5419
 epoch: 75, train_loss: 0.8403, test_loss: 0.8639, test_f1: 0.5434
 epoch: 76, train_loss: 0.8422, test_loss: 0.8729, test_f1: 0.5396
 epoch: 77, train_loss: 0.8356, test_loss: 0.8675, test_f1: 0.5425
 epoch: 78, train_loss: 0.8430, test_loss: 0.8817, test_f1: 0.5335
 epoch: 79, train_loss: 0.8418, test_loss: 0.8957, test_f1: 0.5333
 epoch: 80, train_loss: 0.8376, test_loss: 0.8944, test_f1: 0.5342
 epoch: 81, train_loss: 0.8424, test_loss: 0.8986, test_f1: 0.5389
 epoch: 82, train_loss: 0.8385, test_loss: 0.8791, test_f1: 0.5287
 epoch: 83, train_loss: 0.8393, test_loss: 0.8850, test_f1: 0.5289
 epoch: 84, train_loss: 0.8332, test_loss: 0.8814, test_f1: 0.5478
 epoch: 85, train_loss: 0.8324, test_loss: 0.8955, test_f1: 0.5399
 epoch: 86, train_loss: 0.8337, test_loss: 0.8796, test_f1: 0.5441
 epoch: 87, train_loss: 0.8304, test_loss: 0.8691, test_f1: 0.5412
 epoch: 88, train_loss: 0.8318, test_loss: 0.8954, test_f1: 0.5401
 epoch: 89, train_loss: 0.8332, test_loss: 0.8820, test_f1: 0.5164
 epoch: 90, train_loss: 0.8308, test_loss: 0.8663, test_f1: 0.5315
 epoch: 91, train_loss: 0.8156, test_loss: 0.8699, test_f1: 0.5362
 epoch: 92, train_loss: 0.8250, test_loss: 0.8573, test_f1: 0.5497
 epoch: 93, train_loss: 0.8264, test_loss: 0.8732, test_f1: 0.5272
 epoch: 94, train_loss: 0.8236, test_loss: 0.8564, test_f1: 0.5302
 epoch: 95, train_loss: 0.8209, test_loss: 0.8979, test_f1: 0.5195
 epoch: 96, train_loss: 0.8286, test_loss: 0.8751, test_f1: 0.5270
 epoch: 97, train_loss: 0.8212, test_loss: 0.8670, test_f1: 0.5357
 epoch: 98, train_loss: 0.8327, test_loss: 0.9069, test_f1: 0.5439
 epoch: 99, train_loss: 0.8163, test_loss: 0.8982, test_f1: 0.5369
##################ITERATION #2 ****************************************
 epoch: 0, train_loss: 1.2898, test_loss: 1.2474, test_f1: 0.2260
 epoch: 1, train_loss: 1.2429, test_loss: 1.1998, test_f1: 0.3263
 epoch: 2, train_loss: 1.2038, test_loss: 1.1610, test_f1: 0.3326
 epoch: 3, train_loss: 1.1676, test_loss: 1.1171, test_f1: 0.3692
 epoch: 4, train_loss: 1.1413, test_loss: 1.0905, test_f1: 0.3476
 epoch: 5, train_loss: 1.1104, test_loss: 1.0683, test_f1: 0.3858
 epoch: 6, train_loss: 1.0961, test_loss: 1.0531, test_f1: 0.4171
 epoch: 7, train_loss: 1.0802, test_loss: 1.0497, test_f1: 0.4119
 epoch: 8, train_loss: 1.0674, test_loss: 1.0411, test_f1: 0.4267
 epoch: 9, train_loss: 1.0580, test_loss: 1.0430, test_f1: 0.4408
 epoch: 10, train_loss: 1.0501, test_loss: 1.0353, test_f1: 0.4381
 epoch: 11, train_loss: 1.0347, test_loss: 1.0435, test_f1: 0.4560
 epoch: 12, train_loss: 1.0334, test_loss: 1.0461, test_f1: 0.4541
 epoch: 13, train_loss: 1.0320, test_loss: 1.0430, test_f1: 0.4699
 epoch: 14, train_loss: 1.0245, test_loss: 1.0371, test_f1: 0.4660
 epoch: 15, train_loss: 1.0123, test_loss: 1.0448, test_f1: 0.4715
 epoch: 16, train_loss: 1.0104, test_loss: 1.0296, test_f1: 0.4678
 epoch: 17, train_loss: 1.0098, test_loss: 1.0344, test_f1: 0.4722
 epoch: 18, train_loss: 1.0021, test_loss: 1.0341, test_f1: 0.4687
 epoch: 19, train_loss: 1.0081, test_loss: 1.0257, test_f1: 0.4731
 epoch: 20, train_loss: 0.9979, test_loss: 1.0447, test_f1: 0.4650
 epoch: 21, train_loss: 0.9920, test_loss: 1.0383, test_f1: 0.4667
 epoch: 22, train_loss: 0.9900, test_loss: 1.0277, test_f1: 0.4718
 epoch: 23, train_loss: 0.9792, test_loss: 1.0273, test_f1: 0.4889
 epoch: 24, train_loss: 0.9811, test_loss: 1.0219, test_f1: 0.4810
 epoch: 25, train_loss: 0.9771, test_loss: 1.0269, test_f1: 0.4930
 epoch: 26, train_loss: 0.9783, test_loss: 1.0304, test_f1: 0.4836
 epoch: 27, train_loss: 0.9708, test_loss: 1.0259, test_f1: 0.4913
 epoch: 28, train_loss: 0.9687, test_loss: 1.0257, test_f1: 0.4784
 epoch: 29, train_loss: 0.9601, test_loss: 1.0215, test_f1: 0.4965
 epoch: 30, train_loss: 0.9591, test_loss: 1.0216, test_f1: 0.5018
 epoch: 31, train_loss: 0.9574, test_loss: 1.0150, test_f1: 0.5007
 epoch: 32, train_loss: 0.9496, test_loss: 1.0147, test_f1: 0.4967
 epoch: 33, train_loss: 0.9612, test_loss: 1.0106, test_f1: 0.4925
 epoch: 34, train_loss: 0.9490, test_loss: 0.9982, test_f1: 0.4966
 epoch: 35, train_loss: 0.9517, test_loss: 1.0077, test_f1: 0.5001
 epoch: 36, train_loss: 0.9299, test_loss: 1.0040, test_f1: 0.5137
 epoch: 37, train_loss: 0.9370, test_loss: 1.0048, test_f1: 0.5016
 epoch: 38, train_loss: 0.9388, test_loss: 0.9948, test_f1: 0.5122
 epoch: 39, train_loss: 0.9305, test_loss: 1.0012, test_f1: 0.5028
 epoch: 40, train_loss: 0.9397, test_loss: 1.0039, test_f1: 0.5018
 epoch: 41, train_loss: 0.9281, test_loss: 0.9916, test_f1: 0.5021
 epoch: 42, train_loss: 0.9294, test_loss: 0.9959, test_f1: 0.5113
 epoch: 43, train_loss: 0.9103, test_loss: 0.9959, test_f1: 0.5009
 epoch: 44, train_loss: 0.9166, test_loss: 0.9878, test_f1: 0.5008
 epoch: 45, train_loss: 0.9100, test_loss: 0.9819, test_f1: 0.5023
 epoch: 46, train_loss: 0.9097, test_loss: 0.9906, test_f1: 0.4965
 epoch: 47, train_loss: 0.9053, test_loss: 0.9856, test_f1: 0.5096
 epoch: 48, train_loss: 0.9107, test_loss: 1.0178, test_f1: 0.4942
 epoch: 49, train_loss: 0.8937, test_loss: 0.9813, test_f1: 0.5127
 epoch: 50, train_loss: 0.9042, test_loss: 0.9820, test_f1: 0.5087
 epoch: 51, train_loss: 0.8879, test_loss: 0.9870, test_f1: 0.5057
 epoch: 52, train_loss: 0.8826, test_loss: 0.9802, test_f1: 0.5069
 epoch: 53, train_loss: 0.8977, test_loss: 0.9807, test_f1: 0.5161
 epoch: 54, train_loss: 0.8896, test_loss: 0.9684, test_f1: 0.5117
 epoch: 55, train_loss: 0.8911, test_loss: 0.9793, test_f1: 0.5112
 epoch: 56, train_loss: 0.8799, test_loss: 0.9833, test_f1: 0.5115
 epoch: 57, train_loss: 0.8823, test_loss: 0.9851, test_f1: 0.5127
 epoch: 58, train_loss: 0.8804, test_loss: 0.9842, test_f1: 0.5089
 epoch: 59, train_loss: 0.8801, test_loss: 0.9768, test_f1: 0.5196
 epoch: 60, train_loss: 0.8748, test_loss: 0.9821, test_f1: 0.5177
 epoch: 61, train_loss: 0.8823, test_loss: 0.9674, test_f1: 0.5171
 epoch: 62, train_loss: 0.8800, test_loss: 0.9681, test_f1: 0.5287
 epoch: 63, train_loss: 0.8702, test_loss: 0.9677, test_f1: 0.5145
 epoch: 64, train_loss: 0.8698, test_loss: 0.9762, test_f1: 0.5295
 epoch: 65, train_loss: 0.8759, test_loss: 0.9652, test_f1: 0.5235
 epoch: 66, train_loss: 0.8753, test_loss: 0.9715, test_f1: 0.5141
 epoch: 67, train_loss: 0.8782, test_loss: 0.9642, test_f1: 0.5142
 epoch: 68, train_loss: 0.8635, test_loss: 0.9538, test_f1: 0.5322
 epoch: 69, train_loss: 0.8685, test_loss: 0.9659, test_f1: 0.5106
 epoch: 70, train_loss: 0.8649, test_loss: 0.9597, test_f1: 0.5357
 epoch: 71, train_loss: 0.8633, test_loss: 0.9645, test_f1: 0.5341
 epoch: 72, train_loss: 0.8678, test_loss: 0.9707, test_f1: 0.5199
 epoch: 73, train_loss: 0.8657, test_loss: 0.9594, test_f1: 0.5256
 epoch: 74, train_loss: 0.8675, test_loss: 0.9642, test_f1: 0.5374
 epoch: 75, train_loss: 0.8564, test_loss: 0.9510, test_f1: 0.5164
 epoch: 76, train_loss: 0.8587, test_loss: 0.9756, test_f1: 0.5336
 epoch: 77, train_loss: 0.8550, test_loss: 0.9705, test_f1: 0.5312
 epoch: 78, train_loss: 0.8518, test_loss: 0.9566, test_f1: 0.5321
 epoch: 79, train_loss: 0.8521, test_loss: 0.9506, test_f1: 0.5212
 epoch: 80, train_loss: 0.8559, test_loss: 0.9579, test_f1: 0.5212
 epoch: 81, train_loss: 0.8565, test_loss: 0.9544, test_f1: 0.5250
 epoch: 82, train_loss: 0.8525, test_loss: 0.9567, test_f1: 0.5205
 epoch: 83, train_loss: 0.8527, test_loss: 0.9609, test_f1: 0.5272
 epoch: 84, train_loss: 0.8508, test_loss: 0.9575, test_f1: 0.5229
 epoch: 85, train_loss: 0.8487, test_loss: 0.9594, test_f1: 0.5337
 epoch: 86, train_loss: 0.8582, test_loss: 0.9667, test_f1: 0.5294
 epoch: 87, train_loss: 0.8529, test_loss: 0.9544, test_f1: 0.5196
 epoch: 88, train_loss: 0.8462, test_loss: 0.9577, test_f1: 0.5323
 epoch: 89, train_loss: 0.8441, test_loss: 0.9589, test_f1: 0.5290
 epoch: 90, train_loss: 0.8417, test_loss: 0.9595, test_f1: 0.5354
 epoch: 91, train_loss: 0.8381, test_loss: 0.9585, test_f1: 0.5391
 epoch: 92, train_loss: 0.8494, test_loss: 0.9667, test_f1: 0.5334
 epoch: 93, train_loss: 0.8469, test_loss: 0.9577, test_f1: 0.5477
 epoch: 94, train_loss: 0.8363, test_loss: 0.9506, test_f1: 0.5380
 epoch: 95, train_loss: 0.8438, test_loss: 0.9522, test_f1: 0.5461
 epoch: 96, train_loss: 0.8256, test_loss: 0.9531, test_f1: 0.5359
 epoch: 97, train_loss: 0.8377, test_loss: 0.9496, test_f1: 0.5394
 epoch: 98, train_loss: 0.8331, test_loss: 0.9541, test_f1: 0.5376
 epoch: 99, train_loss: 0.8282, test_loss: 0.9631, test_f1: 0.5515
##################ITERATION #3 ****************************************
 epoch: 0, train_loss: 1.2697, test_loss: 1.2101, test_f1: 0.2502
 epoch: 1, train_loss: 1.2193, test_loss: 1.1723, test_f1: 0.3400
 epoch: 2, train_loss: 1.1882, test_loss: 1.1328, test_f1: 0.3480
 epoch: 3, train_loss: 1.1560, test_loss: 1.0998, test_f1: 0.4081
 epoch: 4, train_loss: 1.1318, test_loss: 1.0858, test_f1: 0.4127
 epoch: 5, train_loss: 1.1119, test_loss: 1.0606, test_f1: 0.4312
 epoch: 6, train_loss: 1.0933, test_loss: 1.0539, test_f1: 0.4213
 epoch: 7, train_loss: 1.0753, test_loss: 1.0488, test_f1: 0.4485
 epoch: 8, train_loss: 1.0559, test_loss: 1.0366, test_f1: 0.4577
 epoch: 9, train_loss: 1.0499, test_loss: 1.0267, test_f1: 0.4510
 epoch: 10, train_loss: 1.0288, test_loss: 1.0255, test_f1: 0.4597
 epoch: 11, train_loss: 1.0262, test_loss: 1.0057, test_f1: 0.4787
 epoch: 12, train_loss: 1.0124, test_loss: 1.0113, test_f1: 0.4802
 epoch: 13, train_loss: 1.0065, test_loss: 0.9950, test_f1: 0.4808
 epoch: 14, train_loss: 0.9985, test_loss: 0.9932, test_f1: 0.4717
 epoch: 15, train_loss: 0.9924, test_loss: 0.9951, test_f1: 0.4696
 epoch: 16, train_loss: 0.9845, test_loss: 0.9933, test_f1: 0.4813
 epoch: 17, train_loss: 0.9811, test_loss: 0.9978, test_f1: 0.4768
 epoch: 18, train_loss: 0.9750, test_loss: 0.9864, test_f1: 0.4781
 epoch: 19, train_loss: 0.9757, test_loss: 1.0030, test_f1: 0.4712
 epoch: 20, train_loss: 0.9672, test_loss: 0.9926, test_f1: 0.4806
 epoch: 21, train_loss: 0.9601, test_loss: 0.9860, test_f1: 0.4952
 epoch: 22, train_loss: 0.9604, test_loss: 0.9580, test_f1: 0.4862
 epoch: 23, train_loss: 0.9618, test_loss: 0.9674, test_f1: 0.4983
 epoch: 24, train_loss: 0.9444, test_loss: 0.9593, test_f1: 0.5024
 epoch: 25, train_loss: 0.9448, test_loss: 0.9859, test_f1: 0.4826
 epoch: 26, train_loss: 0.9470, test_loss: 0.9676, test_f1: 0.5041
 epoch: 27, train_loss: 0.9336, test_loss: 0.9622, test_f1: 0.4933
 epoch: 28, train_loss: 0.9329, test_loss: 0.9579, test_f1: 0.4909
 epoch: 29, train_loss: 0.9326, test_loss: 0.9997, test_f1: 0.4913
 epoch: 30, train_loss: 0.9307, test_loss: 0.9831, test_f1: 0.4988
 epoch: 31, train_loss: 0.9259, test_loss: 0.9926, test_f1: 0.4898
 epoch: 32, train_loss: 0.9188, test_loss: 0.9400, test_f1: 0.5069
 epoch: 33, train_loss: 0.9159, test_loss: 0.9794, test_f1: 0.4929
 epoch: 34, train_loss: 0.9093, test_loss: 0.9553, test_f1: 0.4975
 epoch: 35, train_loss: 0.9070, test_loss: 0.9606, test_f1: 0.4924
 epoch: 36, train_loss: 0.9069, test_loss: 0.9631, test_f1: 0.5232
 epoch: 37, train_loss: 0.9008, test_loss: 0.9709, test_f1: 0.5186
 epoch: 38, train_loss: 0.9068, test_loss: 0.9500, test_f1: 0.5131
 epoch: 39, train_loss: 0.9047, test_loss: 0.9410, test_f1: 0.5160
 epoch: 40, train_loss: 0.8930, test_loss: 0.9384, test_f1: 0.5159
 epoch: 41, train_loss: 0.8873, test_loss: 0.9688, test_f1: 0.5299
 epoch: 42, train_loss: 0.8868, test_loss: 0.9383, test_f1: 0.5281
 epoch: 43, train_loss: 0.8879, test_loss: 0.9433, test_f1: 0.5105
 epoch: 44, train_loss: 0.8874, test_loss: 0.9410, test_f1: 0.5206
 epoch: 45, train_loss: 0.8878, test_loss: 0.9325, test_f1: 0.5233
 epoch: 46, train_loss: 0.8823, test_loss: 0.9262, test_f1: 0.5359
 epoch: 47, train_loss: 0.8853, test_loss: 0.9355, test_f1: 0.5310
 epoch: 48, train_loss: 0.8714, test_loss: 0.9319, test_f1: 0.5367
 epoch: 49, train_loss: 0.8699, test_loss: 0.9576, test_f1: 0.5218
 epoch: 50, train_loss: 0.8769, test_loss: 0.9493, test_f1: 0.5260
 epoch: 51, train_loss: 0.8592, test_loss: 0.9661, test_f1: 0.4956
 epoch: 52, train_loss: 0.8623, test_loss: 0.9424, test_f1: 0.5352
 epoch: 53, train_loss: 0.8661, test_loss: 0.9310, test_f1: 0.5274
 epoch: 54, train_loss: 0.8628, test_loss: 0.9554, test_f1: 0.5388
 epoch: 55, train_loss: 0.8626, test_loss: 0.9753, test_f1: 0.5114
 epoch: 56, train_loss: 0.8572, test_loss: 0.9426, test_f1: 0.5584
 epoch: 57, train_loss: 0.8539, test_loss: 0.9346, test_f1: 0.5344
 epoch: 58, train_loss: 0.8558, test_loss: 0.9637, test_f1: 0.5099
 epoch: 59, train_loss: 0.8576, test_loss: 0.9747, test_f1: 0.5057
 epoch: 60, train_loss: 0.8449, test_loss: 0.9542, test_f1: 0.5141
 epoch: 61, train_loss: 0.8554, test_loss: 0.9413, test_f1: 0.5298
 epoch: 62, train_loss: 0.8456, test_loss: 0.9325, test_f1: 0.5306
 epoch: 63, train_loss: 0.8589, test_loss: 0.9388, test_f1: 0.5222
 epoch: 64, train_loss: 0.8506, test_loss: 0.9329, test_f1: 0.5250
 epoch: 65, train_loss: 0.8487, test_loss: 0.9373, test_f1: 0.5194
 epoch: 66, train_loss: 0.8422, test_loss: 0.9314, test_f1: 0.5285
 epoch: 67, train_loss: 0.8460, test_loss: 0.9233, test_f1: 0.5302
 epoch: 68, train_loss: 0.8454, test_loss: 0.9312, test_f1: 0.5258
 epoch: 69, train_loss: 0.8449, test_loss: 0.9149, test_f1: 0.5297
 epoch: 70, train_loss: 0.8421, test_loss: 0.9295, test_f1: 0.5174
 epoch: 71, train_loss: 0.8448, test_loss: 0.9567, test_f1: 0.5284
 epoch: 72, train_loss: 0.8397, test_loss: 0.9243, test_f1: 0.5596
 epoch: 73, train_loss: 0.8301, test_loss: 0.9274, test_f1: 0.5066
 epoch: 74, train_loss: 0.8308, test_loss: 0.9330, test_f1: 0.5142
 epoch: 75, train_loss: 0.8452, test_loss: 0.9617, test_f1: 0.4943
 epoch: 76, train_loss: 0.8345, test_loss: 0.9130, test_f1: 0.5613
 epoch: 77, train_loss: 0.8344, test_loss: 0.9410, test_f1: 0.5142
 epoch: 78, train_loss: 0.8336, test_loss: 0.9340, test_f1: 0.5411
 epoch: 79, train_loss: 0.8300, test_loss: 0.9177, test_f1: 0.5187
 epoch: 80, train_loss: 0.8321, test_loss: 0.9356, test_f1: 0.5246
 epoch: 81, train_loss: 0.8314, test_loss: 0.9191, test_f1: 0.5430
 epoch: 82, train_loss: 0.8273, test_loss: 0.9177, test_f1: 0.5454
 epoch: 83, train_loss: 0.8314, test_loss: 0.9350, test_f1: 0.5683
 epoch: 84, train_loss: 0.8298, test_loss: 0.9391, test_f1: 0.5307
 epoch: 85, train_loss: 0.8227, test_loss: 0.9676, test_f1: 0.5098
 epoch: 86, train_loss: 0.8205, test_loss: 0.9530, test_f1: 0.5269
 epoch: 87, train_loss: 0.8240, test_loss: 0.9447, test_f1: 0.5361
 epoch: 88, train_loss: 0.8283, test_loss: 0.9307, test_f1: 0.5451
 epoch: 89, train_loss: 0.8156, test_loss: 0.9519, test_f1: 0.4998
 epoch: 90, train_loss: 0.8193, test_loss: 0.9523, test_f1: 0.5001
 epoch: 91, train_loss: 0.8071, test_loss: 0.9632, test_f1: 0.5017
 epoch: 92, train_loss: 0.8103, test_loss: 0.9385, test_f1: 0.5382
 epoch: 93, train_loss: 0.8200, test_loss: 0.9418, test_f1: 0.5371
 epoch: 94, train_loss: 0.8176, test_loss: 0.9510, test_f1: 0.5457
 epoch: 95, train_loss: 0.8139, test_loss: 0.9440, test_f1: 0.5296
 epoch: 96, train_loss: 0.8145, test_loss: 0.9252, test_f1: 0.5787
 epoch: 97, train_loss: 0.8202, test_loss: 0.9398, test_f1: 0.5265
 epoch: 98, train_loss: 0.8092, test_loss: 0.9564, test_f1: 0.5127
 epoch: 99, train_loss: 0.8149, test_loss: 0.9509, test_f1: 0.5204
##################ITERATION #4 ****************************************
 epoch: 0, train_loss: 1.2876, test_loss: 1.2576, test_f1: 0.2260
 epoch: 1, train_loss: 1.2524, test_loss: 1.2324, test_f1: 0.2260
 epoch: 2, train_loss: 1.2383, test_loss: 1.2194, test_f1: 0.2392
 epoch: 3, train_loss: 1.2211, test_loss: 1.1867, test_f1: 0.3074
 epoch: 4, train_loss: 1.2015, test_loss: 1.1592, test_f1: 0.3886
 epoch: 5, train_loss: 1.1759, test_loss: 1.1277, test_f1: 0.4030
 epoch: 6, train_loss: 1.1530, test_loss: 1.1072, test_f1: 0.4225
 epoch: 7, train_loss: 1.1321, test_loss: 1.0954, test_f1: 0.4263
 epoch: 8, train_loss: 1.1134, test_loss: 1.0848, test_f1: 0.4214
 epoch: 9, train_loss: 1.1022, test_loss: 1.0740, test_f1: 0.4204
 epoch: 10, train_loss: 1.0811, test_loss: 1.0622, test_f1: 0.4194
 epoch: 11, train_loss: 1.0686, test_loss: 1.0519, test_f1: 0.4336
 epoch: 12, train_loss: 1.0603, test_loss: 1.0466, test_f1: 0.4283
 epoch: 13, train_loss: 1.0619, test_loss: 1.0397, test_f1: 0.4457
 epoch: 14, train_loss: 1.0468, test_loss: 1.0369, test_f1: 0.4656
 epoch: 15, train_loss: 1.0421, test_loss: 1.0296, test_f1: 0.4444
 epoch: 16, train_loss: 1.0313, test_loss: 1.0254, test_f1: 0.4693
 epoch: 17, train_loss: 1.0237, test_loss: 1.0255, test_f1: 0.4674
 epoch: 18, train_loss: 1.0156, test_loss: 1.0354, test_f1: 0.4739
 epoch: 19, train_loss: 1.0166, test_loss: 1.0134, test_f1: 0.4854
 epoch: 20, train_loss: 1.0091, test_loss: 1.0119, test_f1: 0.4856
 epoch: 21, train_loss: 1.0017, test_loss: 1.0078, test_f1: 0.4816
 epoch: 22, train_loss: 0.9976, test_loss: 0.9951, test_f1: 0.4850
 epoch: 23, train_loss: 0.9855, test_loss: 1.0080, test_f1: 0.4910
 epoch: 24, train_loss: 0.9913, test_loss: 1.0029, test_f1: 0.4826
 epoch: 25, train_loss: 0.9843, test_loss: 0.9992, test_f1: 0.4904
 epoch: 26, train_loss: 0.9828, test_loss: 1.0050, test_f1: 0.4799
 epoch: 27, train_loss: 0.9694, test_loss: 0.9952, test_f1: 0.4942
 epoch: 28, train_loss: 0.9772, test_loss: 0.9858, test_f1: 0.4868
 epoch: 29, train_loss: 0.9715, test_loss: 0.9906, test_f1: 0.4826
 epoch: 30, train_loss: 0.9601, test_loss: 0.9887, test_f1: 0.4883
 epoch: 31, train_loss: 0.9637, test_loss: 0.9846, test_f1: 0.4948
 epoch: 32, train_loss: 0.9504, test_loss: 0.9879, test_f1: 0.4905
 epoch: 33, train_loss: 0.9571, test_loss: 0.9716, test_f1: 0.5047
 epoch: 34, train_loss: 0.9447, test_loss: 0.9687, test_f1: 0.5011
 epoch: 35, train_loss: 0.9543, test_loss: 0.9891, test_f1: 0.4910
 epoch: 36, train_loss: 0.9397, test_loss: 0.9964, test_f1: 0.5025
 epoch: 37, train_loss: 0.9436, test_loss: 0.9679, test_f1: 0.5011
 epoch: 38, train_loss: 0.9360, test_loss: 0.9660, test_f1: 0.5026
 epoch: 39, train_loss: 0.9344, test_loss: 0.9629, test_f1: 0.5067
 epoch: 40, train_loss: 0.9360, test_loss: 0.9679, test_f1: 0.4955
 epoch: 41, train_loss: 0.9321, test_loss: 0.9412, test_f1: 0.4985
 epoch: 42, train_loss: 0.9277, test_loss: 0.9492, test_f1: 0.5109
 epoch: 43, train_loss: 0.9234, test_loss: 0.9884, test_f1: 0.4996
 epoch: 44, train_loss: 0.9198, test_loss: 0.9881, test_f1: 0.4849
 epoch: 45, train_loss: 0.9132, test_loss: 0.9575, test_f1: 0.5063
 epoch: 46, train_loss: 0.9217, test_loss: 0.9543, test_f1: 0.5125
 epoch: 47, train_loss: 0.9148, test_loss: 0.9463, test_f1: 0.5176
 epoch: 48, train_loss: 0.9136, test_loss: 0.9598, test_f1: 0.5118
 epoch: 49, train_loss: 0.9036, test_loss: 0.9502, test_f1: 0.5040
 epoch: 50, train_loss: 0.9189, test_loss: 0.9653, test_f1: 0.5062
 epoch: 51, train_loss: 0.9072, test_loss: 0.9767, test_f1: 0.5139
 epoch: 52, train_loss: 0.8980, test_loss: 0.9623, test_f1: 0.5128
 epoch: 53, train_loss: 0.9081, test_loss: 0.9531, test_f1: 0.5068
 epoch: 54, train_loss: 0.9034, test_loss: 0.9510, test_f1: 0.5201
 epoch: 55, train_loss: 0.8996, test_loss: 0.9648, test_f1: 0.4954
 epoch: 56, train_loss: 0.8984, test_loss: 0.9722, test_f1: 0.5055
 epoch: 57, train_loss: 0.9005, test_loss: 0.9743, test_f1: 0.5019
 epoch: 58, train_loss: 0.8953, test_loss: 0.9635, test_f1: 0.5114
 epoch: 59, train_loss: 0.8943, test_loss: 0.9560, test_f1: 0.5085
 epoch: 60, train_loss: 0.9006, test_loss: 0.9560, test_f1: 0.5070
 epoch: 61, train_loss: 0.9024, test_loss: 0.9693, test_f1: 0.5137
 epoch: 62, train_loss: 0.8906, test_loss: 0.9622, test_f1: 0.5008
 epoch: 63, train_loss: 0.8967, test_loss: 0.9889, test_f1: 0.5001
 epoch: 64, train_loss: 0.8898, test_loss: 0.9692, test_f1: 0.5133
 epoch: 65, train_loss: 0.8906, test_loss: 0.9700, test_f1: 0.5114
 epoch: 66, train_loss: 0.8827, test_loss: 0.9754, test_f1: 0.5102
 epoch: 67, train_loss: 0.8921, test_loss: 0.9694, test_f1: 0.5080
 epoch: 68, train_loss: 0.8925, test_loss: 0.9767, test_f1: 0.5056
 epoch: 69, train_loss: 0.8911, test_loss: 0.9626, test_f1: 0.5055
 epoch: 70, train_loss: 0.8837, test_loss: 0.9625, test_f1: 0.5164
 epoch: 71, train_loss: 0.8821, test_loss: 0.9631, test_f1: 0.4986
 epoch: 72, train_loss: 0.8841, test_loss: 0.9593, test_f1: 0.5112
 epoch: 73, train_loss: 0.8735, test_loss: 0.9660, test_f1: 0.5068
 epoch: 74, train_loss: 0.8841, test_loss: 0.9637, test_f1: 0.5083
 epoch: 75, train_loss: 0.8808, test_loss: 0.9542, test_f1: 0.4999
 epoch: 76, train_loss: 0.8866, test_loss: 0.9607, test_f1: 0.4960
 epoch: 77, train_loss: 0.8841, test_loss: 0.9589, test_f1: 0.5152
 epoch: 78, train_loss: 0.8756, test_loss: 0.9784, test_f1: 0.4958
 epoch: 79, train_loss: 0.8730, test_loss: 0.9692, test_f1: 0.5071
 epoch: 80, train_loss: 0.8749, test_loss: 0.9603, test_f1: 0.5090
 epoch: 81, train_loss: 0.8776, test_loss: 0.9654, test_f1: 0.5028
 epoch: 82, train_loss: 0.8674, test_loss: 0.9828, test_f1: 0.4895
 epoch: 83, train_loss: 0.8711, test_loss: 0.9589, test_f1: 0.5017
 epoch: 84, train_loss: 0.8800, test_loss: 0.9759, test_f1: 0.5018
 epoch: 85, train_loss: 0.8701, test_loss: 0.9652, test_f1: 0.5174
 epoch: 86, train_loss: 0.8655, test_loss: 0.9591, test_f1: 0.5051
 epoch: 87, train_loss: 0.8708, test_loss: 0.9567, test_f1: 0.5028
 epoch: 88, train_loss: 0.8613, test_loss: 0.9611, test_f1: 0.5004
 epoch: 89, train_loss: 0.8625, test_loss: 0.9577, test_f1: 0.5176
 epoch: 90, train_loss: 0.8647, test_loss: 0.9623, test_f1: 0.5120
 epoch: 91, train_loss: 0.8762, test_loss: 0.9673, test_f1: 0.5100
 epoch: 92, train_loss: 0.8731, test_loss: 0.9708, test_f1: 0.4950
 epoch: 93, train_loss: 0.8656, test_loss: 0.9596, test_f1: 0.5105
 epoch: 94, train_loss: 0.8653, test_loss: 0.9592, test_f1: 0.5107
 epoch: 95, train_loss: 0.8616, test_loss: 0.9613, test_f1: 0.5027
 epoch: 96, train_loss: 0.8611, test_loss: 0.9618, test_f1: 0.5025
 epoch: 97, train_loss: 0.8579, test_loss: 0.9608, test_f1: 0.5076
 epoch: 98, train_loss: 0.8677, test_loss: 0.9760, test_f1: 0.5074
 epoch: 99, train_loss: 0.8566, test_loss: 0.9531, test_f1: 0.5092
##################ITERATION #5 ****************************************
 epoch: 0, train_loss: 1.2896, test_loss: 1.2166, test_f1: 0.2521
 epoch: 1, train_loss: 1.2129, test_loss: 1.1711, test_f1: 0.3922
 epoch: 2, train_loss: 1.1739, test_loss: 1.1339, test_f1: 0.4002
 epoch: 3, train_loss: 1.1500, test_loss: 1.1045, test_f1: 0.4099
 epoch: 4, train_loss: 1.1248, test_loss: 1.1034, test_f1: 0.3935
 epoch: 5, train_loss: 1.1061, test_loss: 1.0571, test_f1: 0.4244
 epoch: 6, train_loss: 1.0823, test_loss: 1.0501, test_f1: 0.4503
 epoch: 7, train_loss: 1.0731, test_loss: 1.0596, test_f1: 0.4430
 epoch: 8, train_loss: 1.0619, test_loss: 1.0421, test_f1: 0.4642
 epoch: 9, train_loss: 1.0438, test_loss: 1.0484, test_f1: 0.4622
 epoch: 10, train_loss: 1.0368, test_loss: 1.0157, test_f1: 0.4801
 epoch: 11, train_loss: 1.0312, test_loss: 1.0449, test_f1: 0.4526
 epoch: 12, train_loss: 1.0233, test_loss: 1.0324, test_f1: 0.4661
 epoch: 13, train_loss: 1.0080, test_loss: 1.0187, test_f1: 0.4823
 epoch: 14, train_loss: 1.0005, test_loss: 1.0164, test_f1: 0.4958
 epoch: 15, train_loss: 1.0000, test_loss: 1.0098, test_f1: 0.4864
 epoch: 16, train_loss: 0.9869, test_loss: 1.0323, test_f1: 0.5014
 epoch: 17, train_loss: 0.9861, test_loss: 1.0141, test_f1: 0.4984
 epoch: 18, train_loss: 0.9798, test_loss: 1.0058, test_f1: 0.4968
 epoch: 19, train_loss: 0.9730, test_loss: 1.0210, test_f1: 0.4924
 epoch: 20, train_loss: 0.9774, test_loss: 1.0233, test_f1: 0.4800
 epoch: 21, train_loss: 0.9606, test_loss: 1.0177, test_f1: 0.4813
 epoch: 22, train_loss: 0.9640, test_loss: 0.9896, test_f1: 0.4996
 epoch: 23, train_loss: 0.9568, test_loss: 0.9833, test_f1: 0.5242
 epoch: 24, train_loss: 0.9536, test_loss: 1.0036, test_f1: 0.5342
 epoch: 25, train_loss: 0.9476, test_loss: 0.9754, test_f1: 0.5203
 epoch: 26, train_loss: 0.9391, test_loss: 0.9901, test_f1: 0.5185
 epoch: 27, train_loss: 0.9343, test_loss: 0.9958, test_f1: 0.5181
 epoch: 28, train_loss: 0.9424, test_loss: 1.0096, test_f1: 0.5215
 epoch: 29, train_loss: 0.9318, test_loss: 0.9656, test_f1: 0.5330
 epoch: 30, train_loss: 0.9230, test_loss: 0.9411, test_f1: 0.5396
 epoch: 31, train_loss: 0.9297, test_loss: 0.9853, test_f1: 0.5122
 epoch: 32, train_loss: 0.9219, test_loss: 0.9471, test_f1: 0.5314
 epoch: 33, train_loss: 0.9158, test_loss: 0.9504, test_f1: 0.5206
 epoch: 34, train_loss: 0.9163, test_loss: 0.9890, test_f1: 0.5148
 epoch: 35, train_loss: 0.9177, test_loss: 0.9573, test_f1: 0.5265
 epoch: 36, train_loss: 0.9154, test_loss: 0.9720, test_f1: 0.5177
 epoch: 37, train_loss: 0.9092, test_loss: 0.9976, test_f1: 0.5189
 epoch: 38, train_loss: 0.9145, test_loss: 0.9657, test_f1: 0.5106
 epoch: 39, train_loss: 0.9037, test_loss: 1.0314, test_f1: 0.5141
 epoch: 40, train_loss: 0.8975, test_loss: 0.9501, test_f1: 0.5445
 epoch: 41, train_loss: 0.9008, test_loss: 1.0084, test_f1: 0.5272
 epoch: 42, train_loss: 0.8881, test_loss: 0.9644, test_f1: 0.5216
 epoch: 43, train_loss: 0.8853, test_loss: 0.9697, test_f1: 0.5311
 epoch: 44, train_loss: 0.8944, test_loss: 1.0377, test_f1: 0.5171
 epoch: 45, train_loss: 0.8862, test_loss: 0.9822, test_f1: 0.5373
 epoch: 46, train_loss: 0.8819, test_loss: 0.9518, test_f1: 0.5524
 epoch: 47, train_loss: 0.8830, test_loss: 0.9823, test_f1: 0.5383
 epoch: 48, train_loss: 0.8811, test_loss: 0.9389, test_f1: 0.5348
 epoch: 49, train_loss: 0.8769, test_loss: 0.9613, test_f1: 0.5236
 epoch: 50, train_loss: 0.8824, test_loss: 1.0141, test_f1: 0.4989
 epoch: 51, train_loss: 0.8629, test_loss: 0.9743, test_f1: 0.5396
 epoch: 52, train_loss: 0.8609, test_loss: 0.9810, test_f1: 0.5256
 epoch: 53, train_loss: 0.8557, test_loss: 0.9752, test_f1: 0.5345
 epoch: 54, train_loss: 0.8637, test_loss: 0.9921, test_f1: 0.5329
 epoch: 55, train_loss: 0.8572, test_loss: 0.9547, test_f1: 0.5486
 epoch: 56, train_loss: 0.8602, test_loss: 0.9404, test_f1: 0.5567
 epoch: 57, train_loss: 0.8549, test_loss: 0.9679, test_f1: 0.5352
 epoch: 58, train_loss: 0.8476, test_loss: 0.9568, test_f1: 0.5231
 epoch: 59, train_loss: 0.8577, test_loss: 0.9522, test_f1: 0.5461
 epoch: 60, train_loss: 0.8552, test_loss: 0.9473, test_f1: 0.5500
 epoch: 61, train_loss: 0.8653, test_loss: 0.9914, test_f1: 0.5419
 epoch: 62, train_loss: 0.8533, test_loss: 0.9485, test_f1: 0.5394
 epoch: 63, train_loss: 0.8509, test_loss: 0.9743, test_f1: 0.5324
 epoch: 64, train_loss: 0.8378, test_loss: 0.9554, test_f1: 0.5584
 epoch: 65, train_loss: 0.8463, test_loss: 0.9428, test_f1: 0.5452
 epoch: 66, train_loss: 0.8429, test_loss: 0.9688, test_f1: 0.5664
 epoch: 67, train_loss: 0.8638, test_loss: 0.9145, test_f1: 0.5634
 epoch: 68, train_loss: 0.8477, test_loss: 0.9725, test_f1: 0.5404
 epoch: 69, train_loss: 0.8487, test_loss: 0.9553, test_f1: 0.5535
 epoch: 70, train_loss: 0.8506, test_loss: 1.0036, test_f1: 0.5390
 epoch: 71, train_loss: 0.8430, test_loss: 0.9476, test_f1: 0.5490
 epoch: 72, train_loss: 0.8417, test_loss: 1.0390, test_f1: 0.5136
 epoch: 73, train_loss: 0.8547, test_loss: 0.9646, test_f1: 0.5334
 epoch: 74, train_loss: 0.8326, test_loss: 0.9267, test_f1: 0.5395
 epoch: 75, train_loss: 0.8317, test_loss: 0.9916, test_f1: 0.5356
 epoch: 76, train_loss: 0.8338, test_loss: 0.9386, test_f1: 0.5526
 epoch: 77, train_loss: 0.8373, test_loss: 0.9771, test_f1: 0.5455
 epoch: 78, train_loss: 0.8348, test_loss: 0.9508, test_f1: 0.5411
 epoch: 79, train_loss: 0.8533, test_loss: 0.9682, test_f1: 0.5331
 epoch: 80, train_loss: 0.8336, test_loss: 0.9378, test_f1: 0.5540
 epoch: 81, train_loss: 0.8387, test_loss: 0.9838, test_f1: 0.5290
 epoch: 82, train_loss: 0.8256, test_loss: 0.9429, test_f1: 0.5611
 epoch: 83, train_loss: 0.8336, test_loss: 0.9483, test_f1: 0.5667
 epoch: 84, train_loss: 0.8414, test_loss: 0.9662, test_f1: 0.5603
 epoch: 85, train_loss: 0.8264, test_loss: 0.9540, test_f1: 0.5552
 epoch: 86, train_loss: 0.8312, test_loss: 0.9538, test_f1: 0.5575
 epoch: 87, train_loss: 0.8312, test_loss: 0.9628, test_f1: 0.5539
 epoch: 88, train_loss: 0.8253, test_loss: 1.0020, test_f1: 0.5228
 epoch: 89, train_loss: 0.8260, test_loss: 0.9748, test_f1: 0.5307
 epoch: 90, train_loss: 0.8239, test_loss: 0.9670, test_f1: 0.5475
 epoch: 91, train_loss: 0.8316, test_loss: 1.0281, test_f1: 0.5250
 epoch: 92, train_loss: 0.8262, test_loss: 0.9664, test_f1: 0.5364
 epoch: 93, train_loss: 0.8238, test_loss: 0.9449, test_f1: 0.5514
 epoch: 94, train_loss: 0.8197, test_loss: 0.9679, test_f1: 0.5663
 epoch: 95, train_loss: 0.8190, test_loss: 0.9229, test_f1: 0.5521
 epoch: 96, train_loss: 0.8140, test_loss: 0.9122, test_f1: 0.5579
 epoch: 97, train_loss: 0.8178, test_loss: 0.9555, test_f1: 0.5543
 epoch: 98, train_loss: 0.8191, test_loss: 0.9614, test_f1: 0.5524
 epoch: 99, train_loss: 0.8234, test_loss: 0.9368, test_f1: 0.5537
##################ITERATION #6 ****************************************
 epoch: 0, train_loss: 1.3265, test_loss: 1.1939, test_f1: 0.3297
 epoch: 1, train_loss: 1.2111, test_loss: 1.1311, test_f1: 0.4153
 epoch: 2, train_loss: 1.1666, test_loss: 1.0961, test_f1: 0.4134
 epoch: 3, train_loss: 1.1433, test_loss: 1.0803, test_f1: 0.4062
 epoch: 4, train_loss: 1.1142, test_loss: 1.0623, test_f1: 0.4003
 epoch: 5, train_loss: 1.0928, test_loss: 1.0365, test_f1: 0.4335
 epoch: 6, train_loss: 1.0740, test_loss: 1.0163, test_f1: 0.4429
 epoch: 7, train_loss: 1.0630, test_loss: 1.0095, test_f1: 0.4632
 epoch: 8, train_loss: 1.0488, test_loss: 1.0051, test_f1: 0.4381
 epoch: 9, train_loss: 1.0401, test_loss: 1.0006, test_f1: 0.4566
 epoch: 10, train_loss: 1.0317, test_loss: 1.0081, test_f1: 0.4422
 epoch: 11, train_loss: 1.0170, test_loss: 0.9805, test_f1: 0.4594
 epoch: 12, train_loss: 1.0034, test_loss: 1.0021, test_f1: 0.4594
 epoch: 13, train_loss: 0.9981, test_loss: 0.9645, test_f1: 0.4868
 epoch: 14, train_loss: 0.9860, test_loss: 0.9653, test_f1: 0.4819
 epoch: 15, train_loss: 0.9887, test_loss: 0.9489, test_f1: 0.4770
 epoch: 16, train_loss: 0.9769, test_loss: 0.9515, test_f1: 0.4812
 epoch: 17, train_loss: 0.9723, test_loss: 0.9517, test_f1: 0.4844
 epoch: 18, train_loss: 0.9762, test_loss: 0.9225, test_f1: 0.5042
 epoch: 19, train_loss: 0.9608, test_loss: 0.9208, test_f1: 0.5069
 epoch: 20, train_loss: 0.9528, test_loss: 0.9289, test_f1: 0.4989
 epoch: 21, train_loss: 0.9488, test_loss: 0.9117, test_f1: 0.5001
 epoch: 22, train_loss: 0.9395, test_loss: 0.9186, test_f1: 0.4914
 epoch: 23, train_loss: 0.9396, test_loss: 0.9127, test_f1: 0.5048
 epoch: 24, train_loss: 0.9331, test_loss: 0.9035, test_f1: 0.5061
 epoch: 25, train_loss: 0.9342, test_loss: 0.8922, test_f1: 0.5247
 epoch: 26, train_loss: 0.9268, test_loss: 0.8903, test_f1: 0.5154
 epoch: 27, train_loss: 0.9279, test_loss: 0.8956, test_f1: 0.5234
 epoch: 28, train_loss: 0.9180, test_loss: 0.8953, test_f1: 0.5070
 epoch: 29, train_loss: 0.9091, test_loss: 0.8888, test_f1: 0.5047
 epoch: 30, train_loss: 0.9038, test_loss: 0.9284, test_f1: 0.5027
 epoch: 31, train_loss: 0.9029, test_loss: 0.8774, test_f1: 0.5150
 epoch: 32, train_loss: 0.8994, test_loss: 0.8851, test_f1: 0.5105
 epoch: 33, train_loss: 0.8959, test_loss: 0.8944, test_f1: 0.5089
 epoch: 34, train_loss: 0.8956, test_loss: 0.8893, test_f1: 0.5088
 epoch: 35, train_loss: 0.8959, test_loss: 0.8983, test_f1: 0.5113
 epoch: 36, train_loss: 0.8846, test_loss: 0.8673, test_f1: 0.5273
 epoch: 37, train_loss: 0.8938, test_loss: 0.8578, test_f1: 0.5346
 epoch: 38, train_loss: 0.8858, test_loss: 0.8828, test_f1: 0.5294
 epoch: 39, train_loss: 0.8793, test_loss: 0.8944, test_f1: 0.5107
 epoch: 40, train_loss: 0.8760, test_loss: 0.8955, test_f1: 0.5212
 epoch: 41, train_loss: 0.8687, test_loss: 0.9042, test_f1: 0.5317
 epoch: 42, train_loss: 0.8712, test_loss: 0.8895, test_f1: 0.5273
 epoch: 43, train_loss: 0.8762, test_loss: 0.8827, test_f1: 0.5209
 epoch: 44, train_loss: 0.8759, test_loss: 0.8762, test_f1: 0.5296
 epoch: 45, train_loss: 0.8615, test_loss: 0.8746, test_f1: 0.5118
 epoch: 46, train_loss: 0.8676, test_loss: 0.8778, test_f1: 0.5331
 epoch: 47, train_loss: 0.8586, test_loss: 0.8512, test_f1: 0.5423
 epoch: 48, train_loss: 0.8503, test_loss: 0.8779, test_f1: 0.5239
 epoch: 49, train_loss: 0.8499, test_loss: 0.8590, test_f1: 0.5173
 epoch: 50, train_loss: 0.8489, test_loss: 0.8660, test_f1: 0.5299
 epoch: 51, train_loss: 0.8488, test_loss: 0.8528, test_f1: 0.5315
 epoch: 52, train_loss: 0.8391, test_loss: 0.8763, test_f1: 0.5391
 epoch: 53, train_loss: 0.8416, test_loss: 0.9039, test_f1: 0.5196
 epoch: 54, train_loss: 0.8497, test_loss: 0.8747, test_f1: 0.5163
 epoch: 55, train_loss: 0.8517, test_loss: 0.8784, test_f1: 0.5195
 epoch: 56, train_loss: 0.8334, test_loss: 0.8753, test_f1: 0.5349
 epoch: 57, train_loss: 0.8322, test_loss: 0.8530, test_f1: 0.5430
 epoch: 58, train_loss: 0.8186, test_loss: 0.8615, test_f1: 0.5491
 epoch: 59, train_loss: 0.8286, test_loss: 0.8514, test_f1: 0.5418
 epoch: 60, train_loss: 0.8274, test_loss: 0.8816, test_f1: 0.5532
 epoch: 61, train_loss: 0.8271, test_loss: 0.8774, test_f1: 0.5312
 epoch: 62, train_loss: 0.8163, test_loss: 0.9040, test_f1: 0.5446
 epoch: 63, train_loss: 0.8301, test_loss: 0.8846, test_f1: 0.5550
 epoch: 64, train_loss: 0.8313, test_loss: 0.8841, test_f1: 0.5413
 epoch: 65, train_loss: 0.8194, test_loss: 0.8779, test_f1: 0.5422
 epoch: 66, train_loss: 0.8246, test_loss: 0.8959, test_f1: 0.5294
 epoch: 67, train_loss: 0.8183, test_loss: 0.9228, test_f1: 0.5381
 epoch: 68, train_loss: 0.8202, test_loss: 0.9005, test_f1: 0.5408
 epoch: 69, train_loss: 0.8214, test_loss: 0.9358, test_f1: 0.5277
 epoch: 70, train_loss: 0.8084, test_loss: 0.8906, test_f1: 0.5405
 epoch: 71, train_loss: 0.8075, test_loss: 0.8862, test_f1: 0.5561
 epoch: 72, train_loss: 0.8071, test_loss: 0.8964, test_f1: 0.5412
 epoch: 73, train_loss: 0.8217, test_loss: 0.8970, test_f1: 0.5485
 epoch: 74, train_loss: 0.8140, test_loss: 0.8946, test_f1: 0.5306
 epoch: 75, train_loss: 0.8190, test_loss: 0.8998, test_f1: 0.5483
 epoch: 76, train_loss: 0.8050, test_loss: 0.8920, test_f1: 0.5379
 epoch: 77, train_loss: 0.8094, test_loss: 0.8939, test_f1: 0.5283
 epoch: 78, train_loss: 0.8149, test_loss: 0.9111, test_f1: 0.5362
 epoch: 79, train_loss: 0.8054, test_loss: 0.8924, test_f1: 0.5396
 epoch: 80, train_loss: 0.8031, test_loss: 0.9438, test_f1: 0.5365
 epoch: 81, train_loss: 0.8054, test_loss: 0.9076, test_f1: 0.5319
 epoch: 82, train_loss: 0.8006, test_loss: 0.9552, test_f1: 0.5378
 epoch: 83, train_loss: 0.7940, test_loss: 0.9026, test_f1: 0.5446
 epoch: 84, train_loss: 0.7980, test_loss: 0.9364, test_f1: 0.5351
 epoch: 85, train_loss: 0.7953, test_loss: 0.9472, test_f1: 0.5302
 epoch: 86, train_loss: 0.7941, test_loss: 0.9297, test_f1: 0.5409
 epoch: 87, train_loss: 0.7907, test_loss: 0.9237, test_f1: 0.5279
 epoch: 88, train_loss: 0.7864, test_loss: 0.9255, test_f1: 0.5377
 epoch: 89, train_loss: 0.7940, test_loss: 0.9033, test_f1: 0.5455
 epoch: 90, train_loss: 0.7982, test_loss: 0.8793, test_f1: 0.5456
 epoch: 91, train_loss: 0.7859, test_loss: 0.9161, test_f1: 0.5328
 epoch: 92, train_loss: 0.7932, test_loss: 0.9042, test_f1: 0.5319
 epoch: 93, train_loss: 0.7894, test_loss: 0.8847, test_f1: 0.5485
 epoch: 94, train_loss: 0.7869, test_loss: 0.8779, test_f1: 0.5412
 epoch: 95, train_loss: 0.7931, test_loss: 0.9136, test_f1: 0.5474
 epoch: 96, train_loss: 0.8022, test_loss: 0.9007, test_f1: 0.5430
 epoch: 97, train_loss: 0.7853, test_loss: 0.9320, test_f1: 0.5596
 epoch: 98, train_loss: 0.7846, test_loss: 0.9138, test_f1: 0.5479
 epoch: 99, train_loss: 0.7940, test_loss: 0.8907, test_f1: 0.5411
##################ITERATION #7 ****************************************
 epoch: 0, train_loss: 1.2787, test_loss: 1.2042, test_f1: 0.3052
 epoch: 1, train_loss: 1.2101, test_loss: 1.1624, test_f1: 0.3784
 epoch: 2, train_loss: 1.1839, test_loss: 1.1363, test_f1: 0.3989
 epoch: 3, train_loss: 1.1646, test_loss: 1.1172, test_f1: 0.4442
 epoch: 4, train_loss: 1.1368, test_loss: 1.0932, test_f1: 0.4414
 epoch: 5, train_loss: 1.1124, test_loss: 1.0656, test_f1: 0.4515
 epoch: 6, train_loss: 1.0952, test_loss: 1.0574, test_f1: 0.4635
 epoch: 7, train_loss: 1.0780, test_loss: 1.0457, test_f1: 0.4573
 epoch: 8, train_loss: 1.0694, test_loss: 1.0380, test_f1: 0.4323
 epoch: 9, train_loss: 1.0599, test_loss: 1.0277, test_f1: 0.4521
 epoch: 10, train_loss: 1.0468, test_loss: 1.0147, test_f1: 0.4663
 epoch: 11, train_loss: 1.0346, test_loss: 1.0125, test_f1: 0.4690
 epoch: 12, train_loss: 1.0249, test_loss: 1.0105, test_f1: 0.4748
 epoch: 13, train_loss: 1.0218, test_loss: 0.9837, test_f1: 0.4854
 epoch: 14, train_loss: 0.9994, test_loss: 0.9929, test_f1: 0.4885
 epoch: 15, train_loss: 0.9984, test_loss: 0.9907, test_f1: 0.4738
 epoch: 16, train_loss: 1.0050, test_loss: 1.0063, test_f1: 0.4846
 epoch: 17, train_loss: 0.9884, test_loss: 0.9726, test_f1: 0.4834
 epoch: 18, train_loss: 0.9902, test_loss: 0.9734, test_f1: 0.4989
 epoch: 19, train_loss: 0.9801, test_loss: 0.9885, test_f1: 0.4907
 epoch: 20, train_loss: 0.9714, test_loss: 0.9698, test_f1: 0.4921
 epoch: 21, train_loss: 0.9722, test_loss: 0.9741, test_f1: 0.4930
 epoch: 22, train_loss: 0.9696, test_loss: 0.9769, test_f1: 0.4809
 epoch: 23, train_loss: 0.9633, test_loss: 0.9567, test_f1: 0.5077
 epoch: 24, train_loss: 0.9500, test_loss: 0.9477, test_f1: 0.4960
 epoch: 25, train_loss: 0.9470, test_loss: 0.9723, test_f1: 0.4881
 epoch: 26, train_loss: 0.9457, test_loss: 0.9695, test_f1: 0.4990
 epoch: 27, train_loss: 0.9543, test_loss: 0.9524, test_f1: 0.5156
 epoch: 28, train_loss: 0.9451, test_loss: 0.9633, test_f1: 0.4976
 epoch: 29, train_loss: 0.9348, test_loss: 0.9515, test_f1: 0.5110
 epoch: 30, train_loss: 0.9269, test_loss: 0.9153, test_f1: 0.5143
 epoch: 31, train_loss: 0.9303, test_loss: 0.9412, test_f1: 0.5027
 epoch: 32, train_loss: 0.9208, test_loss: 0.9416, test_f1: 0.5122
 epoch: 33, train_loss: 0.9199, test_loss: 0.9522, test_f1: 0.5048
 epoch: 34, train_loss: 0.9207, test_loss: 0.9233, test_f1: 0.5073
 epoch: 35, train_loss: 0.9076, test_loss: 0.9418, test_f1: 0.4985
 epoch: 36, train_loss: 0.9075, test_loss: 0.9390, test_f1: 0.5011
 epoch: 37, train_loss: 0.9037, test_loss: 0.9336, test_f1: 0.5185
 epoch: 38, train_loss: 0.9051, test_loss: 0.9564, test_f1: 0.5178
 epoch: 39, train_loss: 0.8989, test_loss: 0.9372, test_f1: 0.5236
 epoch: 40, train_loss: 0.8993, test_loss: 0.9470, test_f1: 0.5062
 epoch: 41, train_loss: 0.8958, test_loss: 0.9612, test_f1: 0.5037
 epoch: 42, train_loss: 0.8915, test_loss: 0.9435, test_f1: 0.5111
 epoch: 43, train_loss: 0.8835, test_loss: 0.9310, test_f1: 0.4958
 epoch: 44, train_loss: 0.8851, test_loss: 0.9312, test_f1: 0.5183
 epoch: 45, train_loss: 0.8937, test_loss: 0.9444, test_f1: 0.5038
 epoch: 46, train_loss: 0.8859, test_loss: 0.9522, test_f1: 0.5046
 epoch: 47, train_loss: 0.8722, test_loss: 0.9106, test_f1: 0.5037
 epoch: 48, train_loss: 0.8745, test_loss: 0.9240, test_f1: 0.5050
 epoch: 49, train_loss: 0.8767, test_loss: 0.9430, test_f1: 0.5067
 epoch: 50, train_loss: 0.8735, test_loss: 0.9171, test_f1: 0.5103
 epoch: 51, train_loss: 0.8690, test_loss: 0.9254, test_f1: 0.5126
 epoch: 52, train_loss: 0.8600, test_loss: 0.9416, test_f1: 0.5089
 epoch: 53, train_loss: 0.8655, test_loss: 0.8878, test_f1: 0.5134
 epoch: 54, train_loss: 0.8742, test_loss: 0.9155, test_f1: 0.5198
 epoch: 55, train_loss: 0.8554, test_loss: 0.9269, test_f1: 0.5134
 epoch: 56, train_loss: 0.8637, test_loss: 0.9173, test_f1: 0.5050
 epoch: 57, train_loss: 0.8686, test_loss: 0.8911, test_f1: 0.5188
 epoch: 58, train_loss: 0.8658, test_loss: 0.9332, test_f1: 0.5238
 epoch: 59, train_loss: 0.8742, test_loss: 0.9361, test_f1: 0.5065
 epoch: 60, train_loss: 0.8526, test_loss: 0.9028, test_f1: 0.5231
 epoch: 61, train_loss: 0.8429, test_loss: 0.9027, test_f1: 0.5225
 epoch: 62, train_loss: 0.8491, test_loss: 0.9289, test_f1: 0.5131
 epoch: 63, train_loss: 0.8512, test_loss: 0.9124, test_f1: 0.5171
 epoch: 64, train_loss: 0.8621, test_loss: 0.9082, test_f1: 0.5207
 epoch: 65, train_loss: 0.8476, test_loss: 0.9192, test_f1: 0.5234
 epoch: 66, train_loss: 0.8540, test_loss: 0.8979, test_f1: 0.5190
 epoch: 67, train_loss: 0.8620, test_loss: 0.8965, test_f1: 0.5176
 epoch: 68, train_loss: 0.8454, test_loss: 0.9091, test_f1: 0.5143
 epoch: 69, train_loss: 0.8415, test_loss: 0.9031, test_f1: 0.5223
 epoch: 70, train_loss: 0.8372, test_loss: 0.8931, test_f1: 0.5190
 epoch: 71, train_loss: 0.8565, test_loss: 0.9130, test_f1: 0.5150
 epoch: 72, train_loss: 0.8384, test_loss: 0.8747, test_f1: 0.5181
 epoch: 73, train_loss: 0.8505, test_loss: 0.9009, test_f1: 0.5220
 epoch: 74, train_loss: 0.8478, test_loss: 0.9219, test_f1: 0.5247
 epoch: 75, train_loss: 0.8472, test_loss: 0.9044, test_f1: 0.5262
 epoch: 76, train_loss: 0.8404, test_loss: 0.9099, test_f1: 0.5162
 epoch: 77, train_loss: 0.8323, test_loss: 0.9245, test_f1: 0.5032
 epoch: 78, train_loss: 0.8400, test_loss: 0.9195, test_f1: 0.5016
 epoch: 79, train_loss: 0.8431, test_loss: 0.9428, test_f1: 0.4993
 epoch: 80, train_loss: 0.8381, test_loss: 0.9575, test_f1: 0.5057
 epoch: 81, train_loss: 0.8280, test_loss: 0.9189, test_f1: 0.5164
 epoch: 82, train_loss: 0.8440, test_loss: 0.9170, test_f1: 0.5151
 epoch: 83, train_loss: 0.8324, test_loss: 1.1217, test_f1: 0.5245
 epoch: 84, train_loss: 0.8385, test_loss: 0.9012, test_f1: 0.5230
 epoch: 85, train_loss: 0.8261, test_loss: 0.8762, test_f1: 0.5272
 epoch: 86, train_loss: 0.8083, test_loss: 0.9126, test_f1: 0.5147
 epoch: 87, train_loss: 0.8315, test_loss: 0.8734, test_f1: 0.5240
 epoch: 88, train_loss: 0.8421, test_loss: 0.9015, test_f1: 0.5237
 epoch: 89, train_loss: 0.8226, test_loss: 0.8981, test_f1: 0.5155
 epoch: 90, train_loss: 0.8249, test_loss: 0.9203, test_f1: 0.5106
 epoch: 91, train_loss: 0.8210, test_loss: 0.9276, test_f1: 0.5229
 epoch: 92, train_loss: 0.8293, test_loss: 0.8786, test_f1: 0.5250
 epoch: 93, train_loss: 0.8277, test_loss: 0.8678, test_f1: 0.5236
 epoch: 94, train_loss: 0.8340, test_loss: 0.8885, test_f1: 0.5192
 epoch: 95, train_loss: 0.8124, test_loss: 0.8783, test_f1: 0.5208
 epoch: 96, train_loss: 0.8202, test_loss: 0.8819, test_f1: 0.5191
 epoch: 97, train_loss: 0.8157, test_loss: 0.8899, test_f1: 0.5149
 epoch: 98, train_loss: 0.8199, test_loss: 0.8766, test_f1: 0.5131
 epoch: 99, train_loss: 0.8147, test_loss: 0.8754, test_f1: 0.5210
##################ITERATION #8 ****************************************
 epoch: 0, train_loss: 1.3500, test_loss: 1.2072, test_f1: 0.2802
 epoch: 1, train_loss: 1.2301, test_loss: 1.1659, test_f1: 0.3215
 epoch: 2, train_loss: 1.2152, test_loss: 1.1255, test_f1: 0.3965
 epoch: 3, train_loss: 1.1616, test_loss: 1.0975, test_f1: 0.4268
 epoch: 4, train_loss: 1.1411, test_loss: 1.0711, test_f1: 0.4526
 epoch: 5, train_loss: 1.1173, test_loss: 1.0669, test_f1: 0.4393
 epoch: 6, train_loss: 1.0946, test_loss: 1.0652, test_f1: 0.4613
 epoch: 7, train_loss: 1.0766, test_loss: 1.0488, test_f1: 0.4488
 epoch: 8, train_loss: 1.0690, test_loss: 1.0334, test_f1: 0.4673
 epoch: 9, train_loss: 1.0608, test_loss: 1.0240, test_f1: 0.4730
 epoch: 10, train_loss: 1.0495, test_loss: 1.0340, test_f1: 0.4689
 epoch: 11, train_loss: 1.0479, test_loss: 1.0354, test_f1: 0.4612
 epoch: 12, train_loss: 1.0376, test_loss: 1.0415, test_f1: 0.4549
 epoch: 13, train_loss: 1.0270, test_loss: 1.0298, test_f1: 0.4788
 epoch: 14, train_loss: 1.0163, test_loss: 1.0189, test_f1: 0.4630
 epoch: 15, train_loss: 1.0106, test_loss: 1.0215, test_f1: 0.4725
 epoch: 16, train_loss: 1.0031, test_loss: 1.0240, test_f1: 0.4719
 epoch: 17, train_loss: 0.9975, test_loss: 1.0201, test_f1: 0.4777
 epoch: 18, train_loss: 1.0013, test_loss: 1.0213, test_f1: 0.4708
 epoch: 19, train_loss: 0.9978, test_loss: 1.0188, test_f1: 0.4634
 epoch: 20, train_loss: 0.9944, test_loss: 1.0269, test_f1: 0.4966
 epoch: 21, train_loss: 0.9836, test_loss: 1.0021, test_f1: 0.4943
 epoch: 22, train_loss: 0.9831, test_loss: 1.0212, test_f1: 0.4756
 epoch: 23, train_loss: 0.9759, test_loss: 1.0156, test_f1: 0.4773
 epoch: 24, train_loss: 0.9661, test_loss: 1.0103, test_f1: 0.4872
 epoch: 25, train_loss: 0.9720, test_loss: 1.0176, test_f1: 0.4782
 epoch: 26, train_loss: 0.9701, test_loss: 1.0172, test_f1: 0.4797
 epoch: 27, train_loss: 0.9595, test_loss: 1.0076, test_f1: 0.4922
 epoch: 28, train_loss: 0.9533, test_loss: 1.0187, test_f1: 0.4898
 epoch: 29, train_loss: 0.9569, test_loss: 1.0463, test_f1: 0.4921
 epoch: 30, train_loss: 0.9529, test_loss: 1.0344, test_f1: 0.4812
 epoch: 31, train_loss: 0.9529, test_loss: 1.0207, test_f1: 0.4844
 epoch: 32, train_loss: 0.9416, test_loss: 0.9921, test_f1: 0.4915
 epoch: 33, train_loss: 0.9321, test_loss: 1.0278, test_f1: 0.5014
 epoch: 34, train_loss: 0.9387, test_loss: 1.0069, test_f1: 0.4950
 epoch: 35, train_loss: 0.9235, test_loss: 1.0141, test_f1: 0.4972
 epoch: 36, train_loss: 0.9229, test_loss: 0.9915, test_f1: 0.5062
 epoch: 37, train_loss: 0.9290, test_loss: 0.9851, test_f1: 0.5050
 epoch: 38, train_loss: 0.9179, test_loss: 1.0001, test_f1: 0.4944
 epoch: 39, train_loss: 0.9162, test_loss: 0.9793, test_f1: 0.5125
 epoch: 40, train_loss: 0.9235, test_loss: 0.9730, test_f1: 0.5097
 epoch: 41, train_loss: 0.9160, test_loss: 0.9860, test_f1: 0.5184
 epoch: 42, train_loss: 0.9031, test_loss: 0.9780, test_f1: 0.5051
 epoch: 43, train_loss: 0.9109, test_loss: 0.9709, test_f1: 0.5153
 epoch: 44, train_loss: 0.9152, test_loss: 0.9753, test_f1: 0.5093
 epoch: 45, train_loss: 0.9064, test_loss: 1.0034, test_f1: 0.5163
 epoch: 46, train_loss: 0.8924, test_loss: 0.9851, test_f1: 0.5175
 epoch: 47, train_loss: 0.8920, test_loss: 0.9782, test_f1: 0.5185
 epoch: 48, train_loss: 0.8961, test_loss: 0.9741, test_f1: 0.5203
 epoch: 49, train_loss: 0.8841, test_loss: 0.9627, test_f1: 0.5311
 epoch: 50, train_loss: 0.8932, test_loss: 0.9723, test_f1: 0.5305
 epoch: 51, train_loss: 0.8778, test_loss: 0.9651, test_f1: 0.5258
 epoch: 52, train_loss: 0.8783, test_loss: 0.9651, test_f1: 0.5264
 epoch: 53, train_loss: 0.8752, test_loss: 0.9571, test_f1: 0.5390
 epoch: 54, train_loss: 0.8690, test_loss: 0.9491, test_f1: 0.5446
 epoch: 55, train_loss: 0.8669, test_loss: 0.9474, test_f1: 0.5527
 epoch: 56, train_loss: 0.8626, test_loss: 0.9622, test_f1: 0.5343
 epoch: 57, train_loss: 0.8718, test_loss: 0.9642, test_f1: 0.5352
 epoch: 58, train_loss: 0.8691, test_loss: 0.9556, test_f1: 0.5359
 epoch: 59, train_loss: 0.8607, test_loss: 0.9700, test_f1: 0.5335
 epoch: 60, train_loss: 0.8756, test_loss: 0.9616, test_f1: 0.5451
 epoch: 61, train_loss: 0.8659, test_loss: 0.9651, test_f1: 0.5479
 epoch: 62, train_loss: 0.8660, test_loss: 0.9601, test_f1: 0.5419
 epoch: 63, train_loss: 0.8671, test_loss: 0.9470, test_f1: 0.5447
 epoch: 64, train_loss: 0.8632, test_loss: 0.9568, test_f1: 0.5579
 epoch: 65, train_loss: 0.8681, test_loss: 0.9585, test_f1: 0.5345
 epoch: 66, train_loss: 0.8661, test_loss: 0.9556, test_f1: 0.5531
 epoch: 67, train_loss: 0.8646, test_loss: 0.9585, test_f1: 0.5476
 epoch: 68, train_loss: 0.8534, test_loss: 0.9522, test_f1: 0.5519
 epoch: 69, train_loss: 0.8520, test_loss: 0.9576, test_f1: 0.5504
 epoch: 70, train_loss: 0.8632, test_loss: 0.9487, test_f1: 0.5478
 epoch: 71, train_loss: 0.8575, test_loss: 0.9525, test_f1: 0.5474
 epoch: 72, train_loss: 0.8500, test_loss: 0.9632, test_f1: 0.5445
 epoch: 73, train_loss: 0.8519, test_loss: 0.9477, test_f1: 0.5543
 epoch: 74, train_loss: 0.8568, test_loss: 0.9488, test_f1: 0.5596
 epoch: 75, train_loss: 0.8457, test_loss: 0.9480, test_f1: 0.5534
 epoch: 76, train_loss: 0.8550, test_loss: 0.9529, test_f1: 0.5480
 epoch: 77, train_loss: 0.8438, test_loss: 0.9366, test_f1: 0.5640
 epoch: 78, train_loss: 0.8457, test_loss: 0.9463, test_f1: 0.5580
 epoch: 79, train_loss: 0.8275, test_loss: 0.9443, test_f1: 0.5460
 epoch: 80, train_loss: 0.8415, test_loss: 0.9471, test_f1: 0.5459
 epoch: 81, train_loss: 0.8410, test_loss: 0.9466, test_f1: 0.5484
 epoch: 82, train_loss: 0.8501, test_loss: 0.9596, test_f1: 0.5639
 epoch: 83, train_loss: 0.8349, test_loss: 0.9521, test_f1: 0.5511
 epoch: 84, train_loss: 0.8425, test_loss: 0.9457, test_f1: 0.5626
 epoch: 85, train_loss: 0.8384, test_loss: 0.9421, test_f1: 0.5671
 epoch: 86, train_loss: 0.8408, test_loss: 0.9471, test_f1: 0.5542
 epoch: 87, train_loss: 0.8333, test_loss: 0.9642, test_f1: 0.5568
 epoch: 88, train_loss: 0.8342, test_loss: 0.9450, test_f1: 0.5615
 epoch: 89, train_loss: 0.8271, test_loss: 0.9425, test_f1: 0.5565
 epoch: 90, train_loss: 0.8342, test_loss: 0.9404, test_f1: 0.5476
 epoch: 91, train_loss: 0.8317, test_loss: 0.9484, test_f1: 0.5517
 epoch: 92, train_loss: 0.8252, test_loss: 0.9538, test_f1: 0.5485
 epoch: 93, train_loss: 0.8272, test_loss: 0.9359, test_f1: 0.5728
 epoch: 94, train_loss: 0.8292, test_loss: 0.9551, test_f1: 0.5585
 epoch: 95, train_loss: 0.8273, test_loss: 0.9506, test_f1: 0.5579
 epoch: 96, train_loss: 0.8354, test_loss: 0.9715, test_f1: 0.5661
 epoch: 97, train_loss: 0.8229, test_loss: 0.9444, test_f1: 0.5568
 epoch: 98, train_loss: 0.8332, test_loss: 0.9432, test_f1: 0.5631
 epoch: 99, train_loss: 0.8191, test_loss: 0.9465, test_f1: 0.5612
##################ITERATION #9 ****************************************
 epoch: 0, train_loss: 1.2875, test_loss: 1.1699, test_f1: 0.3580
 epoch: 1, train_loss: 1.2117, test_loss: 1.1473, test_f1: 0.3712
 epoch: 2, train_loss: 1.1957, test_loss: 1.1186, test_f1: 0.3769
 epoch: 3, train_loss: 1.1599, test_loss: 1.1079, test_f1: 0.3840
 epoch: 4, train_loss: 1.1527, test_loss: 1.0903, test_f1: 0.4423
 epoch: 5, train_loss: 1.1351, test_loss: 1.0889, test_f1: 0.4086
 epoch: 6, train_loss: 1.1213, test_loss: 1.0643, test_f1: 0.4116
 epoch: 7, train_loss: 1.1074, test_loss: 1.0445, test_f1: 0.4151
 epoch: 8, train_loss: 1.0980, test_loss: 1.0621, test_f1: 0.4073
 epoch: 9, train_loss: 1.0779, test_loss: 1.0347, test_f1: 0.4289
 epoch: 10, train_loss: 1.0638, test_loss: 1.0292, test_f1: 0.4195
 epoch: 11, train_loss: 1.0651, test_loss: 1.0146, test_f1: 0.4367
 epoch: 12, train_loss: 1.0426, test_loss: 1.0345, test_f1: 0.4206
 epoch: 13, train_loss: 1.0487, test_loss: 1.0063, test_f1: 0.4488
 epoch: 14, train_loss: 1.0400, test_loss: 1.0132, test_f1: 0.4567
 epoch: 15, train_loss: 1.0325, test_loss: 1.0018, test_f1: 0.4553
 epoch: 16, train_loss: 1.0172, test_loss: 1.0168, test_f1: 0.4276
 epoch: 17, train_loss: 1.0231, test_loss: 1.0048, test_f1: 0.4351
 epoch: 18, train_loss: 1.0046, test_loss: 0.9975, test_f1: 0.4730
 epoch: 19, train_loss: 1.0089, test_loss: 1.0064, test_f1: 0.4361
 epoch: 20, train_loss: 0.9958, test_loss: 1.0148, test_f1: 0.4543
 epoch: 21, train_loss: 0.9902, test_loss: 1.0078, test_f1: 0.4433
 epoch: 22, train_loss: 0.9902, test_loss: 1.0084, test_f1: 0.4660
 epoch: 23, train_loss: 0.9745, test_loss: 1.0370, test_f1: 0.4510
 epoch: 24, train_loss: 0.9811, test_loss: 1.0043, test_f1: 0.4760
 epoch: 25, train_loss: 0.9657, test_loss: 1.0409, test_f1: 0.4413
 epoch: 26, train_loss: 0.9681, test_loss: 1.0043, test_f1: 0.4660
 epoch: 27, train_loss: 0.9619, test_loss: 1.0118, test_f1: 0.4648
 epoch: 28, train_loss: 0.9483, test_loss: 1.0130, test_f1: 0.4787
 epoch: 29, train_loss: 0.9383, test_loss: 1.0039, test_f1: 0.4526
 epoch: 30, train_loss: 0.9623, test_loss: 0.9961, test_f1: 0.4571
 epoch: 31, train_loss: 0.9299, test_loss: 1.0036, test_f1: 0.4614
 epoch: 32, train_loss: 0.9422, test_loss: 1.0135, test_f1: 0.4583
 epoch: 33, train_loss: 0.9291, test_loss: 0.9906, test_f1: 0.4709
 epoch: 34, train_loss: 0.9205, test_loss: 0.9997, test_f1: 0.4617
 epoch: 35, train_loss: 0.9267, test_loss: 0.9967, test_f1: 0.4788
 epoch: 36, train_loss: 0.9267, test_loss: 0.9870, test_f1: 0.4873
 epoch: 37, train_loss: 0.9258, test_loss: 0.9903, test_f1: 0.4831
 epoch: 38, train_loss: 0.9087, test_loss: 0.9935, test_f1: 0.4754
 epoch: 39, train_loss: 0.9150, test_loss: 0.9876, test_f1: 0.4886
 epoch: 40, train_loss: 0.9175, test_loss: 0.9884, test_f1: 0.4991
 epoch: 41, train_loss: 0.9087, test_loss: 0.9944, test_f1: 0.4839
 epoch: 42, train_loss: 0.8948, test_loss: 0.9904, test_f1: 0.4911
 epoch: 43, train_loss: 0.9019, test_loss: 0.9762, test_f1: 0.5105
 epoch: 44, train_loss: 0.9014, test_loss: 0.9692, test_f1: 0.5181
 epoch: 45, train_loss: 0.8843, test_loss: 0.9696, test_f1: 0.5216
 epoch: 46, train_loss: 0.8914, test_loss: 0.9843, test_f1: 0.5191
 epoch: 47, train_loss: 0.8844, test_loss: 0.9704, test_f1: 0.5168
 epoch: 48, train_loss: 0.8887, test_loss: 0.9870, test_f1: 0.5035
 epoch: 49, train_loss: 0.8897, test_loss: 0.9683, test_f1: 0.4987
 epoch: 50, train_loss: 0.8795, test_loss: 0.9690, test_f1: 0.5057
 epoch: 51, train_loss: 0.8777, test_loss: 0.9627, test_f1: 0.5252
 epoch: 52, train_loss: 0.8771, test_loss: 0.9935, test_f1: 0.5092
 epoch: 53, train_loss: 0.8715, test_loss: 0.9599, test_f1: 0.5402
 epoch: 54, train_loss: 0.8726, test_loss: 0.9537, test_f1: 0.5254
 epoch: 55, train_loss: 0.8742, test_loss: 0.9642, test_f1: 0.5195
 epoch: 56, train_loss: 0.8698, test_loss: 0.9828, test_f1: 0.5033
 epoch: 57, train_loss: 0.8738, test_loss: 0.9600, test_f1: 0.5180
 epoch: 58, train_loss: 0.8672, test_loss: 0.9619, test_f1: 0.5332
 epoch: 59, train_loss: 0.8682, test_loss: 0.9649, test_f1: 0.5305
 epoch: 60, train_loss: 0.8613, test_loss: 0.9464, test_f1: 0.5428
 epoch: 61, train_loss: 0.8602, test_loss: 0.9468, test_f1: 0.5398
 epoch: 62, train_loss: 0.8622, test_loss: 0.9588, test_f1: 0.5349
 epoch: 63, train_loss: 0.8645, test_loss: 0.9467, test_f1: 0.5362
 epoch: 64, train_loss: 0.8613, test_loss: 0.9542, test_f1: 0.5219
 epoch: 65, train_loss: 0.8628, test_loss: 0.9619, test_f1: 0.5328
 epoch: 66, train_loss: 0.8478, test_loss: 0.9521, test_f1: 0.5262
 epoch: 67, train_loss: 0.8578, test_loss: 0.9786, test_f1: 0.5238
 epoch: 68, train_loss: 0.8560, test_loss: 0.9727, test_f1: 0.5111
 epoch: 69, train_loss: 0.8571, test_loss: 0.9706, test_f1: 0.5316
 epoch: 70, train_loss: 0.8429, test_loss: 0.9582, test_f1: 0.5296
 epoch: 71, train_loss: 0.8428, test_loss: 0.9561, test_f1: 0.5348
 epoch: 72, train_loss: 0.8561, test_loss: 0.9773, test_f1: 0.5187
 epoch: 73, train_loss: 0.8477, test_loss: 0.9502, test_f1: 0.5471
 epoch: 74, train_loss: 0.8578, test_loss: 0.9520, test_f1: 0.5222
 epoch: 75, train_loss: 0.8484, test_loss: 0.9585, test_f1: 0.5260
 epoch: 76, train_loss: 0.8459, test_loss: 0.9744, test_f1: 0.5126
 epoch: 77, train_loss: 0.8454, test_loss: 0.9500, test_f1: 0.5276
 epoch: 78, train_loss: 0.8439, test_loss: 0.9550, test_f1: 0.5467
 epoch: 79, train_loss: 0.8422, test_loss: 0.9665, test_f1: 0.5187
 epoch: 80, train_loss: 0.8468, test_loss: 0.9456, test_f1: 0.5333
 epoch: 81, train_loss: 0.8343, test_loss: 0.9533, test_f1: 0.5291
 epoch: 82, train_loss: 0.8378, test_loss: 0.9525, test_f1: 0.5246
 epoch: 83, train_loss: 0.8386, test_loss: 0.9531, test_f1: 0.5178
 epoch: 84, train_loss: 0.8447, test_loss: 0.9768, test_f1: 0.5076
 epoch: 85, train_loss: 0.8326, test_loss: 0.9595, test_f1: 0.5102
 epoch: 86, train_loss: 0.8151, test_loss: 0.9724, test_f1: 0.5105
 epoch: 87, train_loss: 0.8288, test_loss: 0.9707, test_f1: 0.5267
 epoch: 88, train_loss: 0.8339, test_loss: 0.9639, test_f1: 0.5234
 epoch: 89, train_loss: 0.8325, test_loss: 0.9561, test_f1: 0.5352
 epoch: 90, train_loss: 0.8267, test_loss: 0.9546, test_f1: 0.5192
 epoch: 91, train_loss: 0.8320, test_loss: 0.9619, test_f1: 0.5176
 epoch: 92, train_loss: 0.8269, test_loss: 0.9806, test_f1: 0.5146
 epoch: 93, train_loss: 0.8315, test_loss: 0.9560, test_f1: 0.5255
 epoch: 94, train_loss: 0.8411, test_loss: 0.9641, test_f1: 0.5260
 epoch: 95, train_loss: 0.8213, test_loss: 0.9674, test_f1: 0.5213
 epoch: 96, train_loss: 0.8216, test_loss: 0.9520, test_f1: 0.5236
 epoch: 97, train_loss: 0.8144, test_loss: 0.9790, test_f1: 0.5287
 epoch: 98, train_loss: 0.8319, test_loss: 0.9677, test_f1: 0.5196
 epoch: 99, train_loss: 0.8318, test_loss: 0.9447, test_f1: 0.5513

Training completed in 1286.84 seconds
Best F1: 0.5787 at epoch 96
Mean F1 across iterations: 0.5504  0.0193
========================FINAL RESULTS================================
FEGIN weighted F1: 0.5787  0.0193
python main.py --data ltspice_examples --representation component_pin --model FEGIN --layers 5 --hiddens 32 --batch_size 32 --lr 0.0001 --emb_size 250 --epochs 100 --save_appendix component_pin_L5_H32_BS32_LR0.0001_E250 --no_val
-----



STDERR:
  File "main.py", line 370, in <module>
    main()
  File "main.py", line 254, in main
    dataset = dataset_class(
  File "/home/philip/projects/ltspice_examples_code_repo/Circuit-Completion-Using-GNNs/component_classification_with_link_prediction_head/evaluation/FEGIN/kernel/circuit_datasets.py", line 15, in __init__
    self.data, self.slices = torch.load(self.processed_paths[0])
  File "/home/philip/.local/lib/python3.8/site-packages/torch/serialization.py", line 1040, in load
    warnings.warn(
  File "/usr/lib/python3.8/warnings.py", line 109, in _showwarnmsg
    sw(msg.message, msg.category, msg.filename, msg.lineno,
  File "main.py", line 47, in warn_with_traceback
    traceback.print_stack(file=log)
/home/philip/projects/ltspice_examples_code_repo/Circuit-Completion-Using-GNNs/component_classification_with_link_prediction_head/evaluation/FEGIN/kernel/circuit_datasets.py:15: FutureWarning: You are using `torch.load` with `weights_only=False` (the current default value), which uses the default pickle module implicitly. It is possible to construct malicious pickle data which will execute arbitrary code during unpickling (See https://github.com/pytorch/pytorch/blob/main/SECURITY.md#untrusted-models for more details). In a future release, the default value for `weights_only` will be flipped to `True`. This limits the functions that could be executed during unpickling. Arbitrary objects will no longer be allowed to be loaded via this mode unless they are explicitly allowlisted by the user via `torch.serialization.add_safe_globals`. We recommend you start setting `weights_only=True` for any use case where you don't have full control of the loaded file. Please open an issue on GitHub for any issues related to this experimental feature.
  self.data, self.slices = torch.load(self.processed_paths[0])
