STDOUT:
Results will be saved in /home/philip/projects/ltspice_examples_code_repo/Circuit-Completion-Using-GNNs/component_classification_with_link_prediction_head/evaluation/FEGIN/results/model_FEGIN_dataset_ltspice_examples
Command line input: python main.py --data ltspice_examples --representation component_pin_net --model FEGIN --layers 4 --hiddens 16 --batch_size 256 --lr 0.001 --emb_size 128 --epochs 100 --save_appendix component_pin_net_L4_H16_BS256_LR0.001_E128 --no_val
 is saved.
-----
ltspice_examples - FEGIN
Using 4 layers, 16 hidden units, h = 2
Loading component_pin_net representation dataset
ENTERED
Training FEGIN on component_pin_net representation
Train: 3558, Test: 846
##################ITERATION #0 ****************************************
 epoch: 0, train_loss: 1.4147, test_loss: 1.4126, test_f1: 0.1004
 epoch: 1, train_loss: 1.3925, test_loss: 1.3980, test_f1: 0.1004
 epoch: 2, train_loss: 1.3711, test_loss: 1.3672, test_f1: 0.1957
 epoch: 3, train_loss: 1.3431, test_loss: 1.3222, test_f1: 0.1936
 epoch: 4, train_loss: 1.3138, test_loss: 1.2803, test_f1: 0.2771
 epoch: 5, train_loss: 1.2808, test_loss: 1.2422, test_f1: 0.3244
 epoch: 6, train_loss: 1.2459, test_loss: 1.2061, test_f1: 0.2379
 epoch: 7, train_loss: 1.2146, test_loss: 1.1864, test_f1: 0.2452
 epoch: 8, train_loss: 1.1975, test_loss: 1.1644, test_f1: 0.3229
 epoch: 9, train_loss: 1.1770, test_loss: 1.1449, test_f1: 0.3330
 epoch: 10, train_loss: 1.1561, test_loss: 1.1206, test_f1: 0.3446
 epoch: 11, train_loss: 1.1419, test_loss: 1.0962, test_f1: 0.3550
 epoch: 12, train_loss: 1.1212, test_loss: 1.0694, test_f1: 0.3403
 epoch: 13, train_loss: 1.0964, test_loss: 1.0512, test_f1: 0.3543
 epoch: 14, train_loss: 1.0924, test_loss: 1.0258, test_f1: 0.3584
 epoch: 15, train_loss: 1.0601, test_loss: 1.0104, test_f1: 0.3562
 epoch: 16, train_loss: 1.0546, test_loss: 0.9887, test_f1: 0.4254
 epoch: 17, train_loss: 1.0371, test_loss: 0.9994, test_f1: 0.4109
 epoch: 18, train_loss: 1.0365, test_loss: 1.0125, test_f1: 0.4221
 epoch: 19, train_loss: 1.0218, test_loss: 0.9898, test_f1: 0.4432
 epoch: 20, train_loss: 1.0159, test_loss: 0.9794, test_f1: 0.4442
 epoch: 21, train_loss: 0.9964, test_loss: 0.9740, test_f1: 0.4511
 epoch: 22, train_loss: 0.9930, test_loss: 0.9571, test_f1: 0.4556
 epoch: 23, train_loss: 0.9858, test_loss: 0.9491, test_f1: 0.4703
 epoch: 24, train_loss: 0.9836, test_loss: 0.9405, test_f1: 0.4621
 epoch: 25, train_loss: 0.9696, test_loss: 0.9430, test_f1: 0.4759
 epoch: 26, train_loss: 0.9652, test_loss: 0.9402, test_f1: 0.4960
 epoch: 27, train_loss: 0.9610, test_loss: 0.9434, test_f1: 0.4711
 epoch: 28, train_loss: 0.9541, test_loss: 0.9378, test_f1: 0.4903
 epoch: 29, train_loss: 0.9538, test_loss: 0.9361, test_f1: 0.4794
 epoch: 30, train_loss: 0.9556, test_loss: 0.9231, test_f1: 0.4799
 epoch: 31, train_loss: 0.9423, test_loss: 0.9971, test_f1: 0.4702
 epoch: 32, train_loss: 0.9383, test_loss: 0.9287, test_f1: 0.4872
 epoch: 33, train_loss: 0.9323, test_loss: 0.9250, test_f1: 0.4880
 epoch: 34, train_loss: 0.9336, test_loss: 0.9178, test_f1: 0.4912
 epoch: 35, train_loss: 0.9350, test_loss: 0.9369, test_f1: 0.4993
 epoch: 36, train_loss: 0.9368, test_loss: 0.9095, test_f1: 0.4999
 epoch: 37, train_loss: 0.9298, test_loss: 0.9173, test_f1: 0.4917
 epoch: 38, train_loss: 0.9243, test_loss: 0.9342, test_f1: 0.4845
 epoch: 39, train_loss: 0.9091, test_loss: 0.9185, test_f1: 0.4996
 epoch: 40, train_loss: 0.9049, test_loss: 0.9258, test_f1: 0.4919
 epoch: 41, train_loss: 0.9046, test_loss: 0.9144, test_f1: 0.4960
 epoch: 42, train_loss: 0.9005, test_loss: 0.9289, test_f1: 0.4964
 epoch: 43, train_loss: 0.9005, test_loss: 0.9182, test_f1: 0.5079
 epoch: 44, train_loss: 0.8944, test_loss: 0.9293, test_f1: 0.5057
 epoch: 45, train_loss: 0.8992, test_loss: 0.9194, test_f1: 0.4955
 epoch: 46, train_loss: 0.8945, test_loss: 0.9198, test_f1: 0.4963
 epoch: 47, train_loss: 0.8954, test_loss: 0.9433, test_f1: 0.5111
 epoch: 48, train_loss: 0.8895, test_loss: 0.9270, test_f1: 0.5134
 epoch: 49, train_loss: 0.8825, test_loss: 0.9197, test_f1: 0.4917
 epoch: 50, train_loss: 0.8737, test_loss: 0.9150, test_f1: 0.5210
 epoch: 51, train_loss: 0.8682, test_loss: 0.9214, test_f1: 0.5109
 epoch: 52, train_loss: 0.8697, test_loss: 0.9175, test_f1: 0.5074
 epoch: 53, train_loss: 0.8649, test_loss: 0.9189, test_f1: 0.5028
 epoch: 54, train_loss: 0.8677, test_loss: 0.9172, test_f1: 0.5131
 epoch: 55, train_loss: 0.8655, test_loss: 0.9159, test_f1: 0.4976
 epoch: 56, train_loss: 0.8560, test_loss: 0.9408, test_f1: 0.5087
 epoch: 57, train_loss: 0.8632, test_loss: 0.9101, test_f1: 0.5116
 epoch: 58, train_loss: 0.8652, test_loss: 0.9210, test_f1: 0.5103
 epoch: 59, train_loss: 0.8593, test_loss: 0.9112, test_f1: 0.5125
 epoch: 60, train_loss: 0.8597, test_loss: 0.9369, test_f1: 0.4967
 epoch: 61, train_loss: 0.8532, test_loss: 0.9413, test_f1: 0.5171
 epoch: 62, train_loss: 0.8552, test_loss: 0.9310, test_f1: 0.5122
 epoch: 63, train_loss: 0.8536, test_loss: 0.9614, test_f1: 0.4886
 epoch: 64, train_loss: 0.8558, test_loss: 0.9379, test_f1: 0.5388
 epoch: 65, train_loss: 0.8545, test_loss: 0.9606, test_f1: 0.4946
 epoch: 66, train_loss: 0.8448, test_loss: 0.9375, test_f1: 0.5219
 epoch: 67, train_loss: 0.8438, test_loss: 0.9310, test_f1: 0.5169
 epoch: 68, train_loss: 0.8413, test_loss: 0.9286, test_f1: 0.5200
 epoch: 69, train_loss: 0.8486, test_loss: 0.9281, test_f1: 0.5244
 epoch: 70, train_loss: 0.8329, test_loss: 0.9347, test_f1: 0.5227
 epoch: 71, train_loss: 0.8440, test_loss: 0.9416, test_f1: 0.5348
 epoch: 72, train_loss: 0.8388, test_loss: 0.9477, test_f1: 0.5046
 epoch: 73, train_loss: 0.8451, test_loss: 0.9268, test_f1: 0.5240
 epoch: 74, train_loss: 0.8354, test_loss: 0.9472, test_f1: 0.5255
 epoch: 75, train_loss: 0.8309, test_loss: 0.9313, test_f1: 0.5184
 epoch: 76, train_loss: 0.8263, test_loss: 0.9460, test_f1: 0.5117
 epoch: 77, train_loss: 0.8319, test_loss: 0.9347, test_f1: 0.5325
 epoch: 78, train_loss: 0.8272, test_loss: 0.9442, test_f1: 0.5342
 epoch: 79, train_loss: 0.8211, test_loss: 0.9430, test_f1: 0.5241
 epoch: 80, train_loss: 0.8188, test_loss: 0.9466, test_f1: 0.5420
 epoch: 81, train_loss: 0.8240, test_loss: 0.9566, test_f1: 0.5149
 epoch: 82, train_loss: 0.8267, test_loss: 0.9477, test_f1: 0.5215
 epoch: 83, train_loss: 0.8229, test_loss: 0.9312, test_f1: 0.5403
 epoch: 84, train_loss: 0.8123, test_loss: 0.9506, test_f1: 0.5279
 epoch: 85, train_loss: 0.8186, test_loss: 0.9361, test_f1: 0.5262
 epoch: 86, train_loss: 0.8160, test_loss: 0.9868, test_f1: 0.5123
 epoch: 87, train_loss: 0.8212, test_loss: 0.9409, test_f1: 0.5329
 epoch: 88, train_loss: 0.8222, test_loss: 0.9508, test_f1: 0.5230
 epoch: 89, train_loss: 0.8112, test_loss: 0.9404, test_f1: 0.5356
 epoch: 90, train_loss: 0.8125, test_loss: 0.9510, test_f1: 0.5379
 epoch: 91, train_loss: 0.8076, test_loss: 0.9539, test_f1: 0.5194
 epoch: 92, train_loss: 0.8042, test_loss: 0.9565, test_f1: 0.5342
 epoch: 93, train_loss: 0.8144, test_loss: 0.9622, test_f1: 0.5247
 epoch: 94, train_loss: 0.8108, test_loss: 0.9568, test_f1: 0.5412
 epoch: 95, train_loss: 0.8103, test_loss: 0.9452, test_f1: 0.5431
 epoch: 96, train_loss: 0.8055, test_loss: 0.9688, test_f1: 0.5242
 epoch: 97, train_loss: 0.8031, test_loss: 0.9518, test_f1: 0.5287
 epoch: 98, train_loss: 0.7995, test_loss: 0.9432, test_f1: 0.5350
 epoch: 99, train_loss: 0.7995, test_loss: 0.9508, test_f1: 0.5391
##################ITERATION #1 ****************************************
 epoch: 0, train_loss: 1.3277, test_loss: 1.3368, test_f1: 0.2270
 epoch: 1, train_loss: 1.2555, test_loss: 1.3143, test_f1: 0.2270
 epoch: 2, train_loss: 1.2146, test_loss: 1.2961, test_f1: 0.2270
 epoch: 3, train_loss: 1.1701, test_loss: 1.2130, test_f1: 0.2439
 epoch: 4, train_loss: 1.1335, test_loss: 1.1185, test_f1: 0.3413
 epoch: 5, train_loss: 1.1037, test_loss: 1.0902, test_f1: 0.3430
 epoch: 6, train_loss: 1.0910, test_loss: 1.1273, test_f1: 0.3187
 epoch: 7, train_loss: 1.0758, test_loss: 1.0786, test_f1: 0.3231
 epoch: 8, train_loss: 1.0523, test_loss: 1.0788, test_f1: 0.3419
 epoch: 9, train_loss: 1.0511, test_loss: 1.0445, test_f1: 0.3759
 epoch: 10, train_loss: 1.0406, test_loss: 1.0333, test_f1: 0.3974
 epoch: 11, train_loss: 1.0357, test_loss: 1.0451, test_f1: 0.3833
 epoch: 12, train_loss: 1.0265, test_loss: 1.0598, test_f1: 0.3785
 epoch: 13, train_loss: 1.0171, test_loss: 1.0261, test_f1: 0.4228
 epoch: 14, train_loss: 1.0105, test_loss: 1.0245, test_f1: 0.4326
 epoch: 15, train_loss: 1.0007, test_loss: 1.0005, test_f1: 0.4801
 epoch: 16, train_loss: 0.9911, test_loss: 1.0176, test_f1: 0.4285
 epoch: 17, train_loss: 0.9923, test_loss: 1.0808, test_f1: 0.4148
 epoch: 18, train_loss: 0.9819, test_loss: 1.0109, test_f1: 0.4855
 epoch: 19, train_loss: 0.9706, test_loss: 0.9942, test_f1: 0.5001
 epoch: 20, train_loss: 0.9652, test_loss: 0.9790, test_f1: 0.4793
 epoch: 21, train_loss: 0.9615, test_loss: 0.9908, test_f1: 0.4977
 epoch: 22, train_loss: 0.9576, test_loss: 0.9893, test_f1: 0.4944
 epoch: 23, train_loss: 0.9503, test_loss: 0.9915, test_f1: 0.5055
 epoch: 24, train_loss: 0.9519, test_loss: 0.9917, test_f1: 0.4842
 epoch: 25, train_loss: 0.9446, test_loss: 0.9926, test_f1: 0.5042
 epoch: 26, train_loss: 0.9333, test_loss: 0.9738, test_f1: 0.5002
 epoch: 27, train_loss: 0.9379, test_loss: 0.9943, test_f1: 0.5058
 epoch: 28, train_loss: 0.9396, test_loss: 0.9754, test_f1: 0.4906
 epoch: 29, train_loss: 0.9318, test_loss: 0.9714, test_f1: 0.5013
 epoch: 30, train_loss: 0.9402, test_loss: 0.9884, test_f1: 0.4969
 epoch: 31, train_loss: 0.9262, test_loss: 0.9710, test_f1: 0.5054
 epoch: 32, train_loss: 0.9223, test_loss: 0.9704, test_f1: 0.5107
 epoch: 33, train_loss: 0.9152, test_loss: 1.0093, test_f1: 0.4908
 epoch: 34, train_loss: 0.9177, test_loss: 0.9820, test_f1: 0.5239
 epoch: 35, train_loss: 0.9085, test_loss: 1.0016, test_f1: 0.5294
 epoch: 36, train_loss: 0.9140, test_loss: 0.9534, test_f1: 0.4917
 epoch: 37, train_loss: 0.9141, test_loss: 0.9948, test_f1: 0.4896
 epoch: 38, train_loss: 0.9137, test_loss: 1.0211, test_f1: 0.4886
 epoch: 39, train_loss: 0.9097, test_loss: 0.9777, test_f1: 0.5037
 epoch: 40, train_loss: 0.9010, test_loss: 1.0065, test_f1: 0.4972
 epoch: 41, train_loss: 0.8974, test_loss: 0.9560, test_f1: 0.5146
 epoch: 42, train_loss: 0.8980, test_loss: 0.9356, test_f1: 0.5309
 epoch: 43, train_loss: 0.8987, test_loss: 0.9606, test_f1: 0.5279
 epoch: 44, train_loss: 0.8875, test_loss: 0.9838, test_f1: 0.5104
 epoch: 45, train_loss: 0.8893, test_loss: 0.9686, test_f1: 0.5116
 epoch: 46, train_loss: 0.8907, test_loss: 0.9356, test_f1: 0.5205
 epoch: 47, train_loss: 0.8914, test_loss: 1.1473, test_f1: 0.4638
 epoch: 48, train_loss: 0.8892, test_loss: 0.9270, test_f1: 0.5174
 epoch: 49, train_loss: 0.8882, test_loss: 1.0375, test_f1: 0.4665
 epoch: 50, train_loss: 0.8780, test_loss: 0.8943, test_f1: 0.5195
 epoch: 51, train_loss: 0.8728, test_loss: 0.9215, test_f1: 0.5217
 epoch: 52, train_loss: 0.8756, test_loss: 0.9347, test_f1: 0.5346
 epoch: 53, train_loss: 0.8699, test_loss: 0.9863, test_f1: 0.4986
 epoch: 54, train_loss: 0.8649, test_loss: 0.9575, test_f1: 0.5272
 epoch: 55, train_loss: 0.8711, test_loss: 0.9588, test_f1: 0.5367
 epoch: 56, train_loss: 0.8665, test_loss: 0.9426, test_f1: 0.5378
 epoch: 57, train_loss: 0.8632, test_loss: 0.9617, test_f1: 0.5312
 epoch: 58, train_loss: 0.8601, test_loss: 0.9991, test_f1: 0.5095
 epoch: 59, train_loss: 0.8553, test_loss: 0.9478, test_f1: 0.5111
 epoch: 60, train_loss: 0.8575, test_loss: 0.9319, test_f1: 0.5222
 epoch: 61, train_loss: 0.8573, test_loss: 0.9813, test_f1: 0.5239
 epoch: 62, train_loss: 0.8498, test_loss: 0.9447, test_f1: 0.5218
 epoch: 63, train_loss: 0.8533, test_loss: 0.9918, test_f1: 0.5062
 epoch: 64, train_loss: 0.8483, test_loss: 0.9022, test_f1: 0.5157
 epoch: 65, train_loss: 0.8473, test_loss: 0.9679, test_f1: 0.5064
 epoch: 66, train_loss: 0.8515, test_loss: 0.9438, test_f1: 0.5266
 epoch: 67, train_loss: 0.8478, test_loss: 0.9592, test_f1: 0.5198
 epoch: 68, train_loss: 0.8453, test_loss: 0.9670, test_f1: 0.5292
 epoch: 69, train_loss: 0.8479, test_loss: 0.9558, test_f1: 0.5441
 epoch: 70, train_loss: 0.8449, test_loss: 0.9464, test_f1: 0.5325
 epoch: 71, train_loss: 0.8455, test_loss: 0.9874, test_f1: 0.5243
 epoch: 72, train_loss: 0.8358, test_loss: 0.9639, test_f1: 0.5189
 epoch: 73, train_loss: 0.8340, test_loss: 0.9772, test_f1: 0.5233
 epoch: 74, train_loss: 0.8426, test_loss: 0.9336, test_f1: 0.5283
 epoch: 75, train_loss: 0.8462, test_loss: 1.0068, test_f1: 0.5068
 epoch: 76, train_loss: 0.8364, test_loss: 0.9348, test_f1: 0.5228
 epoch: 77, train_loss: 0.8381, test_loss: 0.9254, test_f1: 0.5390
 epoch: 78, train_loss: 0.8334, test_loss: 0.9426, test_f1: 0.5236
 epoch: 79, train_loss: 0.8356, test_loss: 0.9377, test_f1: 0.5394
 epoch: 80, train_loss: 0.8428, test_loss: 0.8944, test_f1: 0.5439
 epoch: 81, train_loss: 0.8408, test_loss: 0.9650, test_f1: 0.5339
 epoch: 82, train_loss: 0.8282, test_loss: 0.9777, test_f1: 0.5293
 epoch: 83, train_loss: 0.8354, test_loss: 0.9940, test_f1: 0.4945
 epoch: 84, train_loss: 0.8385, test_loss: 0.9577, test_f1: 0.5264
 epoch: 85, train_loss: 0.8279, test_loss: 0.9599, test_f1: 0.5400
 epoch: 86, train_loss: 0.8359, test_loss: 0.9033, test_f1: 0.5373
 epoch: 87, train_loss: 0.8247, test_loss: 0.9541, test_f1: 0.5260
 epoch: 88, train_loss: 0.8355, test_loss: 0.9583, test_f1: 0.5370
 epoch: 89, train_loss: 0.8317, test_loss: 0.9531, test_f1: 0.5212
 epoch: 90, train_loss: 0.8301, test_loss: 0.9798, test_f1: 0.5147
 epoch: 91, train_loss: 0.8307, test_loss: 0.9500, test_f1: 0.5388
 epoch: 92, train_loss: 0.8256, test_loss: 1.0166, test_f1: 0.5242
 epoch: 93, train_loss: 0.8257, test_loss: 0.9549, test_f1: 0.5261
 epoch: 94, train_loss: 0.8222, test_loss: 0.9468, test_f1: 0.5358
 epoch: 95, train_loss: 0.8235, test_loss: 0.9749, test_f1: 0.5254
 epoch: 96, train_loss: 0.8176, test_loss: 1.0145, test_f1: 0.5091
 epoch: 97, train_loss: 0.8144, test_loss: 0.9398, test_f1: 0.5327
 epoch: 98, train_loss: 0.8254, test_loss: 0.9693, test_f1: 0.5196
 epoch: 99, train_loss: 0.8156, test_loss: 0.9282, test_f1: 0.5340
##################ITERATION #2 ****************************************
 epoch: 0, train_loss: 1.3020, test_loss: 1.3226, test_f1: 0.2270
 epoch: 1, train_loss: 1.2291, test_loss: 1.3101, test_f1: 0.2270
 epoch: 2, train_loss: 1.1870, test_loss: 1.2835, test_f1: 0.2270
 epoch: 3, train_loss: 1.1540, test_loss: 1.2027, test_f1: 0.2270
 epoch: 4, train_loss: 1.1139, test_loss: 1.1132, test_f1: 0.3635
 epoch: 5, train_loss: 1.0827, test_loss: 1.0610, test_f1: 0.4135
 epoch: 6, train_loss: 1.0612, test_loss: 1.0266, test_f1: 0.4137
 epoch: 7, train_loss: 1.0368, test_loss: 1.0107, test_f1: 0.4338
 epoch: 8, train_loss: 1.0161, test_loss: 1.0044, test_f1: 0.4668
 epoch: 9, train_loss: 1.0020, test_loss: 0.9858, test_f1: 0.4707
 epoch: 10, train_loss: 0.9813, test_loss: 0.9630, test_f1: 0.4862
 epoch: 11, train_loss: 0.9824, test_loss: 0.9672, test_f1: 0.4858
 epoch: 12, train_loss: 0.9686, test_loss: 0.9659, test_f1: 0.4912
 epoch: 13, train_loss: 0.9577, test_loss: 0.9623, test_f1: 0.4997
 epoch: 14, train_loss: 0.9478, test_loss: 0.9542, test_f1: 0.4872
 epoch: 15, train_loss: 0.9438, test_loss: 0.9452, test_f1: 0.4887
 epoch: 16, train_loss: 0.9285, test_loss: 0.9265, test_f1: 0.5068
 epoch: 17, train_loss: 0.9253, test_loss: 0.9345, test_f1: 0.4997
 epoch: 18, train_loss: 0.9138, test_loss: 0.9179, test_f1: 0.4991
 epoch: 19, train_loss: 0.9130, test_loss: 0.9204, test_f1: 0.4923
 epoch: 20, train_loss: 0.9166, test_loss: 0.9360, test_f1: 0.5081
 epoch: 21, train_loss: 0.9022, test_loss: 0.9494, test_f1: 0.4855
 epoch: 22, train_loss: 0.9032, test_loss: 0.9168, test_f1: 0.5117
 epoch: 23, train_loss: 0.8945, test_loss: 0.9230, test_f1: 0.5153
 epoch: 24, train_loss: 0.8924, test_loss: 0.9527, test_f1: 0.5019
 epoch: 25, train_loss: 0.8897, test_loss: 0.9213, test_f1: 0.5043
 epoch: 26, train_loss: 0.8794, test_loss: 0.9539, test_f1: 0.4958
 epoch: 27, train_loss: 0.8790, test_loss: 0.9235, test_f1: 0.5051
 epoch: 28, train_loss: 0.8756, test_loss: 0.9167, test_f1: 0.4984
 epoch: 29, train_loss: 0.8686, test_loss: 0.9254, test_f1: 0.5209
 epoch: 30, train_loss: 0.8634, test_loss: 0.9376, test_f1: 0.5080
 epoch: 31, train_loss: 0.8537, test_loss: 0.8869, test_f1: 0.5205
 epoch: 32, train_loss: 0.8529, test_loss: 0.9315, test_f1: 0.5043
 epoch: 33, train_loss: 0.8454, test_loss: 0.9308, test_f1: 0.5043
 epoch: 34, train_loss: 0.8458, test_loss: 0.9278, test_f1: 0.5188
 epoch: 35, train_loss: 0.8578, test_loss: 0.9518, test_f1: 0.4894
 epoch: 36, train_loss: 0.8585, test_loss: 0.9892, test_f1: 0.4867
 epoch: 37, train_loss: 0.8482, test_loss: 0.9225, test_f1: 0.5106
 epoch: 38, train_loss: 0.8374, test_loss: 0.9036, test_f1: 0.5084
 epoch: 39, train_loss: 0.8315, test_loss: 0.9214, test_f1: 0.5302
 epoch: 40, train_loss: 0.8395, test_loss: 0.9723, test_f1: 0.4977
 epoch: 41, train_loss: 0.8221, test_loss: 0.8539, test_f1: 0.5290
 epoch: 42, train_loss: 0.8255, test_loss: 0.8769, test_f1: 0.5369
 epoch: 43, train_loss: 0.8109, test_loss: 1.0000, test_f1: 0.4915
 epoch: 44, train_loss: 0.8154, test_loss: 0.9044, test_f1: 0.5122
 epoch: 45, train_loss: 0.8102, test_loss: 1.0032, test_f1: 0.4762
 epoch: 46, train_loss: 0.8093, test_loss: 0.9299, test_f1: 0.5276
 epoch: 47, train_loss: 0.8038, test_loss: 0.9872, test_f1: 0.5057
 epoch: 48, train_loss: 0.8041, test_loss: 0.8813, test_f1: 0.5256
 epoch: 49, train_loss: 0.7984, test_loss: 0.8706, test_f1: 0.5187
 epoch: 50, train_loss: 0.7905, test_loss: 0.9010, test_f1: 0.5272
 epoch: 51, train_loss: 0.7764, test_loss: 0.9459, test_f1: 0.5214
 epoch: 52, train_loss: 0.7862, test_loss: 0.8903, test_f1: 0.5262
 epoch: 53, train_loss: 0.7770, test_loss: 0.9235, test_f1: 0.5243
 epoch: 54, train_loss: 0.7744, test_loss: 0.8727, test_f1: 0.5285
 epoch: 55, train_loss: 0.7692, test_loss: 0.8688, test_f1: 0.5278
 epoch: 56, train_loss: 0.7614, test_loss: 0.8658, test_f1: 0.5433
 epoch: 57, train_loss: 0.7593, test_loss: 0.8615, test_f1: 0.5378
 epoch: 58, train_loss: 0.7691, test_loss: 0.8715, test_f1: 0.5353
 epoch: 59, train_loss: 0.7633, test_loss: 0.8858, test_f1: 0.5418
 epoch: 60, train_loss: 0.7586, test_loss: 0.8546, test_f1: 0.5433
 epoch: 61, train_loss: 0.7685, test_loss: 0.8846, test_f1: 0.5295
 epoch: 62, train_loss: 0.7632, test_loss: 0.8716, test_f1: 0.5383
 epoch: 63, train_loss: 0.7596, test_loss: 0.8615, test_f1: 0.5485
 epoch: 64, train_loss: 0.7509, test_loss: 0.9041, test_f1: 0.5310
 epoch: 65, train_loss: 0.7564, test_loss: 0.9159, test_f1: 0.5137
 epoch: 66, train_loss: 0.7499, test_loss: 0.8682, test_f1: 0.5303
 epoch: 67, train_loss: 0.7561, test_loss: 0.8703, test_f1: 0.5345
 epoch: 68, train_loss: 0.7500, test_loss: 0.9153, test_f1: 0.5286
 epoch: 69, train_loss: 0.7508, test_loss: 0.8691, test_f1: 0.5322
 epoch: 70, train_loss: 0.7487, test_loss: 0.8660, test_f1: 0.5388
 epoch: 71, train_loss: 0.7361, test_loss: 0.8882, test_f1: 0.5309
 epoch: 72, train_loss: 0.7435, test_loss: 0.9495, test_f1: 0.5170
 epoch: 73, train_loss: 0.7388, test_loss: 0.8710, test_f1: 0.5382
 epoch: 74, train_loss: 0.7439, test_loss: 0.8985, test_f1: 0.5338
 epoch: 75, train_loss: 0.7334, test_loss: 0.8684, test_f1: 0.5282
 epoch: 76, train_loss: 0.7352, test_loss: 0.8808, test_f1: 0.5413
 epoch: 77, train_loss: 0.7366, test_loss: 0.8685, test_f1: 0.5410
 epoch: 78, train_loss: 0.7387, test_loss: 0.9012, test_f1: 0.5248
 epoch: 79, train_loss: 0.7291, test_loss: 0.8925, test_f1: 0.5323
 epoch: 80, train_loss: 0.7355, test_loss: 0.8837, test_f1: 0.5272
 epoch: 81, train_loss: 0.7267, test_loss: 0.9266, test_f1: 0.5087
 epoch: 82, train_loss: 0.7303, test_loss: 0.8529, test_f1: 0.5391
 epoch: 83, train_loss: 0.7316, test_loss: 0.8829, test_f1: 0.5299
 epoch: 84, train_loss: 0.7296, test_loss: 0.9189, test_f1: 0.5280
 epoch: 85, train_loss: 0.7210, test_loss: 0.8901, test_f1: 0.5348
 epoch: 86, train_loss: 0.7297, test_loss: 0.8746, test_f1: 0.5382
 epoch: 87, train_loss: 0.7338, test_loss: 0.8939, test_f1: 0.5341
 epoch: 88, train_loss: 0.7263, test_loss: 0.8698, test_f1: 0.5379
 epoch: 89, train_loss: 0.7249, test_loss: 0.8881, test_f1: 0.5370
 epoch: 90, train_loss: 0.7201, test_loss: 0.9125, test_f1: 0.5214
 epoch: 91, train_loss: 0.7156, test_loss: 0.8936, test_f1: 0.5374
 epoch: 92, train_loss: 0.7247, test_loss: 0.8889, test_f1: 0.5367
 epoch: 93, train_loss: 0.7137, test_loss: 0.9009, test_f1: 0.5309
 epoch: 94, train_loss: 0.7115, test_loss: 0.8715, test_f1: 0.5337
 epoch: 95, train_loss: 0.7210, test_loss: 0.9023, test_f1: 0.5377
 epoch: 96, train_loss: 0.7223, test_loss: 0.8927, test_f1: 0.5418
 epoch: 97, train_loss: 0.7134, test_loss: 0.8765, test_f1: 0.5396
 epoch: 98, train_loss: 0.7207, test_loss: 0.9470, test_f1: 0.5261
 epoch: 99, train_loss: 0.7080, test_loss: 0.8953, test_f1: 0.5331
##################ITERATION #3 ****************************************
 epoch: 0, train_loss: 1.3055, test_loss: 1.3472, test_f1: 0.2270
 epoch: 1, train_loss: 1.1826, test_loss: 1.3526, test_f1: 0.2270
 epoch: 2, train_loss: 1.1393, test_loss: 1.4175, test_f1: 0.2878
 epoch: 3, train_loss: 1.0959, test_loss: 1.3005, test_f1: 0.3211
 epoch: 4, train_loss: 1.0756, test_loss: 1.0586, test_f1: 0.4548
 epoch: 5, train_loss: 1.0578, test_loss: 1.0195, test_f1: 0.4436
 epoch: 6, train_loss: 1.0382, test_loss: 0.9912, test_f1: 0.4804
 epoch: 7, train_loss: 1.0311, test_loss: 0.9742, test_f1: 0.4758
 epoch: 8, train_loss: 1.0123, test_loss: 0.9676, test_f1: 0.4822
 epoch: 9, train_loss: 0.9960, test_loss: 0.9716, test_f1: 0.4901
 epoch: 10, train_loss: 0.9778, test_loss: 0.9515, test_f1: 0.4928
 epoch: 11, train_loss: 0.9815, test_loss: 0.9465, test_f1: 0.5065
 epoch: 12, train_loss: 0.9590, test_loss: 0.9409, test_f1: 0.5115
 epoch: 13, train_loss: 0.9735, test_loss: 0.9328, test_f1: 0.5231
 epoch: 14, train_loss: 0.9513, test_loss: 0.9382, test_f1: 0.4984
 epoch: 15, train_loss: 0.9480, test_loss: 0.9445, test_f1: 0.4958
 epoch: 16, train_loss: 0.9448, test_loss: 0.9137, test_f1: 0.5205
 epoch: 17, train_loss: 0.9372, test_loss: 0.9170, test_f1: 0.5066
 epoch: 18, train_loss: 0.9318, test_loss: 0.9185, test_f1: 0.5317
 epoch: 19, train_loss: 0.9316, test_loss: 0.9145, test_f1: 0.5256
 epoch: 20, train_loss: 0.9125, test_loss: 0.9199, test_f1: 0.5136
 epoch: 21, train_loss: 0.9141, test_loss: 0.8982, test_f1: 0.5196
 epoch: 22, train_loss: 0.9136, test_loss: 1.0185, test_f1: 0.4643
 epoch: 23, train_loss: 0.9026, test_loss: 0.9061, test_f1: 0.5155
 epoch: 24, train_loss: 0.9077, test_loss: 0.8886, test_f1: 0.5274
 epoch: 25, train_loss: 0.9001, test_loss: 0.8909, test_f1: 0.5370
 epoch: 26, train_loss: 0.9026, test_loss: 0.8997, test_f1: 0.5160
 epoch: 27, train_loss: 0.8863, test_loss: 0.9159, test_f1: 0.5202
 epoch: 28, train_loss: 0.8728, test_loss: 0.8893, test_f1: 0.5381
 epoch: 29, train_loss: 0.8869, test_loss: 1.0009, test_f1: 0.4689
 epoch: 30, train_loss: 0.8959, test_loss: 0.8786, test_f1: 0.5207
 epoch: 31, train_loss: 0.8761, test_loss: 0.9166, test_f1: 0.5217
 epoch: 32, train_loss: 0.8703, test_loss: 0.8960, test_f1: 0.5120
 epoch: 33, train_loss: 0.8702, test_loss: 0.9267, test_f1: 0.5031
 epoch: 34, train_loss: 0.8669, test_loss: 0.8700, test_f1: 0.5311
 epoch: 35, train_loss: 0.8681, test_loss: 0.8959, test_f1: 0.5163
 epoch: 36, train_loss: 0.8622, test_loss: 0.8798, test_f1: 0.5314
 epoch: 37, train_loss: 0.8610, test_loss: 0.8709, test_f1: 0.5360
 epoch: 38, train_loss: 0.8747, test_loss: 0.8883, test_f1: 0.5335
 epoch: 39, train_loss: 0.8728, test_loss: 0.9557, test_f1: 0.5109
 epoch: 40, train_loss: 0.8692, test_loss: 0.8775, test_f1: 0.5218
 epoch: 41, train_loss: 0.8716, test_loss: 0.8897, test_f1: 0.5299
 epoch: 42, train_loss: 0.8524, test_loss: 0.8843, test_f1: 0.5420
 epoch: 43, train_loss: 0.8576, test_loss: 0.8823, test_f1: 0.5596
 epoch: 44, train_loss: 0.8519, test_loss: 0.8544, test_f1: 0.5556
 epoch: 45, train_loss: 0.8507, test_loss: 0.9400, test_f1: 0.5167
 epoch: 46, train_loss: 0.8427, test_loss: 0.9157, test_f1: 0.5267
 epoch: 47, train_loss: 0.8508, test_loss: 0.8899, test_f1: 0.5499
 epoch: 48, train_loss: 0.8369, test_loss: 0.9377, test_f1: 0.5048
 epoch: 49, train_loss: 0.8309, test_loss: 0.8782, test_f1: 0.5412
 epoch: 50, train_loss: 0.8318, test_loss: 0.8987, test_f1: 0.5183
 epoch: 51, train_loss: 0.8234, test_loss: 0.8620, test_f1: 0.5536
 epoch: 52, train_loss: 0.8175, test_loss: 0.8798, test_f1: 0.5483
 epoch: 53, train_loss: 0.8212, test_loss: 0.9143, test_f1: 0.5369
 epoch: 54, train_loss: 0.8170, test_loss: 0.8749, test_f1: 0.5600
 epoch: 55, train_loss: 0.8210, test_loss: 0.8935, test_f1: 0.5454
 epoch: 56, train_loss: 0.8072, test_loss: 0.8663, test_f1: 0.5429
 epoch: 57, train_loss: 0.8134, test_loss: 0.8780, test_f1: 0.5603
 epoch: 58, train_loss: 0.8176, test_loss: 0.8796, test_f1: 0.5509
 epoch: 59, train_loss: 0.8051, test_loss: 0.8920, test_f1: 0.5433
 epoch: 60, train_loss: 0.8133, test_loss: 0.8788, test_f1: 0.5547
 epoch: 61, train_loss: 0.8006, test_loss: 0.9356, test_f1: 0.5382
 epoch: 62, train_loss: 0.8012, test_loss: 0.8793, test_f1: 0.5540
 epoch: 63, train_loss: 0.8002, test_loss: 0.9042, test_f1: 0.5572
 epoch: 64, train_loss: 0.8037, test_loss: 0.8705, test_f1: 0.5480
 epoch: 65, train_loss: 0.8073, test_loss: 0.8740, test_f1: 0.5641
 epoch: 66, train_loss: 0.7953, test_loss: 0.8711, test_f1: 0.5586
 epoch: 67, train_loss: 0.7889, test_loss: 0.8709, test_f1: 0.5586
 epoch: 68, train_loss: 0.7989, test_loss: 0.8714, test_f1: 0.5736
 epoch: 69, train_loss: 0.7877, test_loss: 0.8820, test_f1: 0.5479
 epoch: 70, train_loss: 0.8048, test_loss: 0.9265, test_f1: 0.5568
 epoch: 71, train_loss: 0.7985, test_loss: 0.8914, test_f1: 0.5433
 epoch: 72, train_loss: 0.7834, test_loss: 0.9068, test_f1: 0.5494
 epoch: 73, train_loss: 0.7992, test_loss: 0.9549, test_f1: 0.5496
 epoch: 74, train_loss: 0.8040, test_loss: 0.9110, test_f1: 0.5382
 epoch: 75, train_loss: 0.7961, test_loss: 0.9162, test_f1: 0.5228
 epoch: 76, train_loss: 0.8009, test_loss: 0.8731, test_f1: 0.5537
 epoch: 77, train_loss: 0.8042, test_loss: 0.9220, test_f1: 0.5423
 epoch: 78, train_loss: 0.7820, test_loss: 0.8885, test_f1: 0.5371
 epoch: 79, train_loss: 0.7878, test_loss: 0.9242, test_f1: 0.5615
 epoch: 80, train_loss: 0.7783, test_loss: 0.9272, test_f1: 0.5483
 epoch: 81, train_loss: 0.7843, test_loss: 0.9210, test_f1: 0.5446
 epoch: 82, train_loss: 0.7725, test_loss: 0.8875, test_f1: 0.5431
 epoch: 83, train_loss: 0.7789, test_loss: 0.9397, test_f1: 0.5299
 epoch: 84, train_loss: 0.7795, test_loss: 0.9373, test_f1: 0.5377
 epoch: 85, train_loss: 0.7918, test_loss: 0.8989, test_f1: 0.5764
 epoch: 86, train_loss: 0.7891, test_loss: 0.9240, test_f1: 0.5514
 epoch: 87, train_loss: 0.7898, test_loss: 0.8933, test_f1: 0.5583
 epoch: 88, train_loss: 0.7763, test_loss: 0.8949, test_f1: 0.5570
 epoch: 89, train_loss: 0.7896, test_loss: 0.9154, test_f1: 0.5558
 epoch: 90, train_loss: 0.7876, test_loss: 0.9364, test_f1: 0.5486
 epoch: 91, train_loss: 0.7765, test_loss: 0.9107, test_f1: 0.5566
 epoch: 92, train_loss: 0.7759, test_loss: 0.9131, test_f1: 0.5410
 epoch: 93, train_loss: 0.7588, test_loss: 0.8826, test_f1: 0.5525
 epoch: 94, train_loss: 0.7783, test_loss: 0.9261, test_f1: 0.5327
 epoch: 95, train_loss: 0.7729, test_loss: 0.9033, test_f1: 0.5590
 epoch: 96, train_loss: 0.7715, test_loss: 0.9370, test_f1: 0.5598
 epoch: 97, train_loss: 0.7672, test_loss: 0.9337, test_f1: 0.5341
 epoch: 98, train_loss: 0.7656, test_loss: 0.9029, test_f1: 0.5425
 epoch: 99, train_loss: 0.7701, test_loss: 0.9174, test_f1: 0.5432
##################ITERATION #4 ****************************************
 epoch: 0, train_loss: 1.4156, test_loss: 1.4049, test_f1: 0.2270
 epoch: 1, train_loss: 1.2134, test_loss: 1.3781, test_f1: 0.2270
 epoch: 2, train_loss: 1.1625, test_loss: 1.3564, test_f1: 0.2270
 epoch: 3, train_loss: 1.1294, test_loss: 1.3476, test_f1: 0.2347
 epoch: 4, train_loss: 1.0987, test_loss: 1.2326, test_f1: 0.2928
 epoch: 5, train_loss: 1.0842, test_loss: 1.1071, test_f1: 0.3508
 epoch: 6, train_loss: 1.0677, test_loss: 1.0660, test_f1: 0.3921
 epoch: 7, train_loss: 1.0545, test_loss: 1.0604, test_f1: 0.4063
 epoch: 8, train_loss: 1.0421, test_loss: 1.0494, test_f1: 0.4245
 epoch: 9, train_loss: 1.0387, test_loss: 1.0526, test_f1: 0.4266
 epoch: 10, train_loss: 1.0276, test_loss: 1.0373, test_f1: 0.4480
 epoch: 11, train_loss: 1.0136, test_loss: 1.0210, test_f1: 0.4542
 epoch: 12, train_loss: 1.0129, test_loss: 1.0330, test_f1: 0.4509
 epoch: 13, train_loss: 1.0015, test_loss: 1.0233, test_f1: 0.4593
 epoch: 14, train_loss: 0.9923, test_loss: 1.0097, test_f1: 0.4667
 epoch: 15, train_loss: 0.9864, test_loss: 0.9878, test_f1: 0.4664
 epoch: 16, train_loss: 0.9684, test_loss: 0.9853, test_f1: 0.4802
 epoch: 17, train_loss: 0.9693, test_loss: 0.9839, test_f1: 0.4835
 epoch: 18, train_loss: 0.9647, test_loss: 0.9977, test_f1: 0.4733
 epoch: 19, train_loss: 0.9607, test_loss: 0.9695, test_f1: 0.4806
 epoch: 20, train_loss: 0.9480, test_loss: 0.9436, test_f1: 0.4766
 epoch: 21, train_loss: 0.9458, test_loss: 0.9546, test_f1: 0.5040
 epoch: 22, train_loss: 0.9366, test_loss: 0.9349, test_f1: 0.4903
 epoch: 23, train_loss: 0.9409, test_loss: 0.9216, test_f1: 0.5229
 epoch: 24, train_loss: 0.9361, test_loss: 0.9618, test_f1: 0.4916
 epoch: 25, train_loss: 0.9316, test_loss: 0.9587, test_f1: 0.4930
 epoch: 26, train_loss: 0.9267, test_loss: 0.9252, test_f1: 0.5166
 epoch: 27, train_loss: 0.9285, test_loss: 0.9615, test_f1: 0.5080
 epoch: 28, train_loss: 0.9088, test_loss: 0.9320, test_f1: 0.4987
 epoch: 29, train_loss: 0.9077, test_loss: 0.9190, test_f1: 0.4918
 epoch: 30, train_loss: 0.9130, test_loss: 0.9639, test_f1: 0.4905
 epoch: 31, train_loss: 0.9084, test_loss: 0.9479, test_f1: 0.5079
 epoch: 32, train_loss: 0.9052, test_loss: 0.9266, test_f1: 0.5323
 epoch: 33, train_loss: 0.9054, test_loss: 0.9828, test_f1: 0.4772
 epoch: 34, train_loss: 0.9021, test_loss: 0.9326, test_f1: 0.5131
 epoch: 35, train_loss: 0.9009, test_loss: 0.9936, test_f1: 0.5107
 epoch: 36, train_loss: 0.8929, test_loss: 0.9433, test_f1: 0.4931
 epoch: 37, train_loss: 0.8952, test_loss: 0.9051, test_f1: 0.5277
 epoch: 38, train_loss: 0.8851, test_loss: 0.9384, test_f1: 0.5102
 epoch: 39, train_loss: 0.8853, test_loss: 0.9754, test_f1: 0.5198
 epoch: 40, train_loss: 0.8935, test_loss: 0.9651, test_f1: 0.4890
 epoch: 41, train_loss: 0.8793, test_loss: 0.9382, test_f1: 0.5219
 epoch: 42, train_loss: 0.8917, test_loss: 0.9741, test_f1: 0.5009
 epoch: 43, train_loss: 0.8735, test_loss: 0.8996, test_f1: 0.5317
 epoch: 44, train_loss: 0.8831, test_loss: 0.9276, test_f1: 0.5177
 epoch: 45, train_loss: 0.8758, test_loss: 1.0086, test_f1: 0.4941
 epoch: 46, train_loss: 0.8746, test_loss: 0.9423, test_f1: 0.5015
 epoch: 47, train_loss: 0.8685, test_loss: 0.9327, test_f1: 0.5042
 epoch: 48, train_loss: 0.8712, test_loss: 0.9442, test_f1: 0.5267
 epoch: 49, train_loss: 0.8688, test_loss: 0.9422, test_f1: 0.5118
 epoch: 50, train_loss: 0.8557, test_loss: 0.9148, test_f1: 0.5209
 epoch: 51, train_loss: 0.8600, test_loss: 0.9515, test_f1: 0.5107
 epoch: 52, train_loss: 0.8469, test_loss: 0.9303, test_f1: 0.5121
 epoch: 53, train_loss: 0.8358, test_loss: 0.9377, test_f1: 0.5205
 epoch: 54, train_loss: 0.8479, test_loss: 0.9171, test_f1: 0.5234
 epoch: 55, train_loss: 0.8417, test_loss: 0.9885, test_f1: 0.5056
 epoch: 56, train_loss: 0.8447, test_loss: 0.9676, test_f1: 0.5086
 epoch: 57, train_loss: 0.8424, test_loss: 0.9541, test_f1: 0.5115
 epoch: 58, train_loss: 0.8298, test_loss: 0.9244, test_f1: 0.5166
 epoch: 59, train_loss: 0.8467, test_loss: 0.9594, test_f1: 0.5113
 epoch: 60, train_loss: 0.8322, test_loss: 0.9510, test_f1: 0.5033
 epoch: 61, train_loss: 0.8320, test_loss: 0.9419, test_f1: 0.5214
 epoch: 62, train_loss: 0.8275, test_loss: 0.9111, test_f1: 0.5305
 epoch: 63, train_loss: 0.8328, test_loss: 0.9642, test_f1: 0.5288
 epoch: 64, train_loss: 0.8297, test_loss: 0.9685, test_f1: 0.5228
 epoch: 65, train_loss: 0.8264, test_loss: 0.9961, test_f1: 0.5113
 epoch: 66, train_loss: 0.8308, test_loss: 0.9598, test_f1: 0.5121
 epoch: 67, train_loss: 0.8284, test_loss: 0.9687, test_f1: 0.5021
 epoch: 68, train_loss: 0.8223, test_loss: 0.9537, test_f1: 0.5265
 epoch: 69, train_loss: 0.8196, test_loss: 0.9685, test_f1: 0.5310
 epoch: 70, train_loss: 0.8155, test_loss: 0.9477, test_f1: 0.5242
 epoch: 71, train_loss: 0.8022, test_loss: 0.9616, test_f1: 0.5233
 epoch: 72, train_loss: 0.8186, test_loss: 0.9343, test_f1: 0.5270
 epoch: 73, train_loss: 0.8103, test_loss: 0.9330, test_f1: 0.5183
 epoch: 74, train_loss: 0.8104, test_loss: 0.9551, test_f1: 0.5332
 epoch: 75, train_loss: 0.8202, test_loss: 0.9525, test_f1: 0.5222
 epoch: 76, train_loss: 0.8112, test_loss: 0.9290, test_f1: 0.5237
 epoch: 77, train_loss: 0.8106, test_loss: 0.9583, test_f1: 0.5305
 epoch: 78, train_loss: 0.7957, test_loss: 0.9607, test_f1: 0.5365
 epoch: 79, train_loss: 0.8081, test_loss: 0.8929, test_f1: 0.5282
 epoch: 80, train_loss: 0.8131, test_loss: 0.9374, test_f1: 0.5374
 epoch: 81, train_loss: 0.7962, test_loss: 0.9978, test_f1: 0.5318
 epoch: 82, train_loss: 0.8003, test_loss: 0.9516, test_f1: 0.5408
 epoch: 83, train_loss: 0.8093, test_loss: 0.9050, test_f1: 0.5362
 epoch: 84, train_loss: 0.8004, test_loss: 0.9261, test_f1: 0.5398
 epoch: 85, train_loss: 0.7935, test_loss: 0.9231, test_f1: 0.5290
 epoch: 86, train_loss: 0.8007, test_loss: 0.9186, test_f1: 0.5313
 epoch: 87, train_loss: 0.7936, test_loss: 0.9658, test_f1: 0.5370
 epoch: 88, train_loss: 0.8019, test_loss: 0.9248, test_f1: 0.5373
 epoch: 89, train_loss: 0.8074, test_loss: 0.9582, test_f1: 0.5335
 epoch: 90, train_loss: 0.7912, test_loss: 0.9595, test_f1: 0.5508
 epoch: 91, train_loss: 0.7915, test_loss: 0.8883, test_f1: 0.5218
 epoch: 92, train_loss: 0.7859, test_loss: 0.9284, test_f1: 0.5437
 epoch: 93, train_loss: 0.7924, test_loss: 0.9629, test_f1: 0.5402
 epoch: 94, train_loss: 0.7860, test_loss: 0.9730, test_f1: 0.5378
 epoch: 95, train_loss: 0.7989, test_loss: 0.9345, test_f1: 0.5329
 epoch: 96, train_loss: 0.7948, test_loss: 0.9106, test_f1: 0.5435
 epoch: 97, train_loss: 0.7933, test_loss: 0.9267, test_f1: 0.5461
 epoch: 98, train_loss: 0.7842, test_loss: 0.9425, test_f1: 0.5447
 epoch: 99, train_loss: 0.7777, test_loss: 0.9031, test_f1: 0.5371
##################ITERATION #5 ****************************************
 epoch: 0, train_loss: 1.2681, test_loss: 1.3450, test_f1: 0.2270
 epoch: 1, train_loss: 1.1776, test_loss: 1.3081, test_f1: 0.2270
 epoch: 2, train_loss: 1.1249, test_loss: 1.2213, test_f1: 0.3218
 epoch: 3, train_loss: 1.1015, test_loss: 1.2123, test_f1: 0.3095
 epoch: 4, train_loss: 1.0793, test_loss: 1.1736, test_f1: 0.3392
 epoch: 5, train_loss: 1.0669, test_loss: 1.1379, test_f1: 0.3562
 epoch: 6, train_loss: 1.0463, test_loss: 1.0955, test_f1: 0.3938
 epoch: 7, train_loss: 1.0318, test_loss: 1.0745, test_f1: 0.4230
 epoch: 8, train_loss: 1.0370, test_loss: 1.0755, test_f1: 0.4532
 epoch: 9, train_loss: 1.0104, test_loss: 1.0715, test_f1: 0.4640
 epoch: 10, train_loss: 1.0032, test_loss: 1.0452, test_f1: 0.4673
 epoch: 11, train_loss: 0.9984, test_loss: 1.0496, test_f1: 0.4781
 epoch: 12, train_loss: 0.9873, test_loss: 1.0361, test_f1: 0.4642
 epoch: 13, train_loss: 0.9922, test_loss: 1.0551, test_f1: 0.4774
 epoch: 14, train_loss: 0.9746, test_loss: 1.0365, test_f1: 0.4953
 epoch: 15, train_loss: 0.9691, test_loss: 1.0208, test_f1: 0.4903
 epoch: 16, train_loss: 0.9677, test_loss: 1.0627, test_f1: 0.4729
 epoch: 17, train_loss: 0.9601, test_loss: 1.0985, test_f1: 0.4579
 epoch: 18, train_loss: 0.9528, test_loss: 1.0484, test_f1: 0.5067
 epoch: 19, train_loss: 0.9562, test_loss: 1.0450, test_f1: 0.5096
 epoch: 20, train_loss: 0.9495, test_loss: 1.0156, test_f1: 0.5104
 epoch: 21, train_loss: 0.9265, test_loss: 1.0154, test_f1: 0.5178
 epoch: 22, train_loss: 0.9247, test_loss: 1.0182, test_f1: 0.5226
 epoch: 23, train_loss: 0.9309, test_loss: 1.0294, test_f1: 0.4986
 epoch: 24, train_loss: 0.9265, test_loss: 1.0475, test_f1: 0.4970
 epoch: 25, train_loss: 0.9131, test_loss: 1.0187, test_f1: 0.5155
 epoch: 26, train_loss: 0.9070, test_loss: 1.0210, test_f1: 0.5185
 epoch: 27, train_loss: 0.9091, test_loss: 1.0087, test_f1: 0.5124
 epoch: 28, train_loss: 0.9046, test_loss: 0.9962, test_f1: 0.5205
 epoch: 29, train_loss: 0.8962, test_loss: 1.0005, test_f1: 0.5214
 epoch: 30, train_loss: 0.9034, test_loss: 1.0671, test_f1: 0.5036
 epoch: 31, train_loss: 0.8951, test_loss: 1.0130, test_f1: 0.5177
 epoch: 32, train_loss: 0.8883, test_loss: 1.0387, test_f1: 0.4984
 epoch: 33, train_loss: 0.8920, test_loss: 1.0033, test_f1: 0.5335
 epoch: 34, train_loss: 0.8805, test_loss: 1.0081, test_f1: 0.5145
 epoch: 35, train_loss: 0.8749, test_loss: 1.0313, test_f1: 0.5332
 epoch: 36, train_loss: 0.8797, test_loss: 0.9884, test_f1: 0.5128
 epoch: 37, train_loss: 0.8771, test_loss: 0.9956, test_f1: 0.5104
 epoch: 38, train_loss: 0.8698, test_loss: 1.0645, test_f1: 0.5060
 epoch: 39, train_loss: 0.8683, test_loss: 1.0634, test_f1: 0.5038
 epoch: 40, train_loss: 0.8644, test_loss: 0.9985, test_f1: 0.5365
 epoch: 41, train_loss: 0.8690, test_loss: 0.9988, test_f1: 0.5341
 epoch: 42, train_loss: 0.8566, test_loss: 1.0163, test_f1: 0.5234
 epoch: 43, train_loss: 0.8522, test_loss: 1.0085, test_f1: 0.5178
 epoch: 44, train_loss: 0.8502, test_loss: 1.0052, test_f1: 0.5252
 epoch: 45, train_loss: 0.8437, test_loss: 1.0052, test_f1: 0.5154
 epoch: 46, train_loss: 0.8428, test_loss: 1.0372, test_f1: 0.5171
 epoch: 47, train_loss: 0.8463, test_loss: 1.0129, test_f1: 0.5295
 epoch: 48, train_loss: 0.8463, test_loss: 1.0167, test_f1: 0.5372
 epoch: 49, train_loss: 0.8375, test_loss: 0.9839, test_f1: 0.5355
 epoch: 50, train_loss: 0.8362, test_loss: 0.9903, test_f1: 0.5279
 epoch: 51, train_loss: 0.8190, test_loss: 0.9914, test_f1: 0.5421
 epoch: 52, train_loss: 0.8282, test_loss: 0.9914, test_f1: 0.5347
 epoch: 53, train_loss: 0.8151, test_loss: 1.0282, test_f1: 0.5149
 epoch: 54, train_loss: 0.8228, test_loss: 0.9722, test_f1: 0.5384
 epoch: 55, train_loss: 0.8232, test_loss: 0.9672, test_f1: 0.5322
 epoch: 56, train_loss: 0.8145, test_loss: 0.9528, test_f1: 0.5359
 epoch: 57, train_loss: 0.8253, test_loss: 1.0299, test_f1: 0.5152
 epoch: 58, train_loss: 0.8296, test_loss: 0.9862, test_f1: 0.5377
 epoch: 59, train_loss: 0.8163, test_loss: 1.0162, test_f1: 0.5237
 epoch: 60, train_loss: 0.8110, test_loss: 0.9651, test_f1: 0.5373
 epoch: 61, train_loss: 0.8078, test_loss: 1.0184, test_f1: 0.5139
 epoch: 62, train_loss: 0.8085, test_loss: 0.9905, test_f1: 0.5418
 epoch: 63, train_loss: 0.8029, test_loss: 0.9646, test_f1: 0.5446
 epoch: 64, train_loss: 0.7969, test_loss: 0.9638, test_f1: 0.5368
 epoch: 65, train_loss: 0.7909, test_loss: 0.9755, test_f1: 0.5418
 epoch: 66, train_loss: 0.8052, test_loss: 0.9528, test_f1: 0.5377
 epoch: 67, train_loss: 0.8080, test_loss: 0.9449, test_f1: 0.5384
 epoch: 68, train_loss: 0.8003, test_loss: 0.9145, test_f1: 0.5368
 epoch: 69, train_loss: 0.8018, test_loss: 0.9385, test_f1: 0.5319
 epoch: 70, train_loss: 0.7970, test_loss: 0.9281, test_f1: 0.5477
 epoch: 71, train_loss: 0.7978, test_loss: 0.9386, test_f1: 0.5344
 epoch: 72, train_loss: 0.7942, test_loss: 0.9715, test_f1: 0.5306
 epoch: 73, train_loss: 0.7915, test_loss: 0.9577, test_f1: 0.5418
 epoch: 74, train_loss: 0.7937, test_loss: 0.9116, test_f1: 0.5325
 epoch: 75, train_loss: 0.7952, test_loss: 0.9168, test_f1: 0.5424
 epoch: 76, train_loss: 0.7773, test_loss: 0.9353, test_f1: 0.5395
 epoch: 77, train_loss: 0.7898, test_loss: 0.9441, test_f1: 0.5295
 epoch: 78, train_loss: 0.7867, test_loss: 0.9947, test_f1: 0.5361
 epoch: 79, train_loss: 0.7976, test_loss: 0.9335, test_f1: 0.5409
 epoch: 80, train_loss: 0.7886, test_loss: 0.9245, test_f1: 0.5407
 epoch: 81, train_loss: 0.7835, test_loss: 0.9261, test_f1: 0.5499
 epoch: 82, train_loss: 0.7953, test_loss: 0.9333, test_f1: 0.5414
 epoch: 83, train_loss: 0.7870, test_loss: 1.0604, test_f1: 0.5017
 epoch: 84, train_loss: 0.7874, test_loss: 0.9197, test_f1: 0.5470
 epoch: 85, train_loss: 0.7864, test_loss: 0.9659, test_f1: 0.5397
 epoch: 86, train_loss: 0.7801, test_loss: 0.9019, test_f1: 0.5413
 epoch: 87, train_loss: 0.7769, test_loss: 0.9124, test_f1: 0.5374
 epoch: 88, train_loss: 0.7703, test_loss: 0.9400, test_f1: 0.5276
 epoch: 89, train_loss: 0.7800, test_loss: 0.8912, test_f1: 0.5437
 epoch: 90, train_loss: 0.7785, test_loss: 0.9480, test_f1: 0.5310
 epoch: 91, train_loss: 0.7811, test_loss: 0.9677, test_f1: 0.5333
 epoch: 92, train_loss: 0.7657, test_loss: 0.9107, test_f1: 0.5547
 epoch: 93, train_loss: 0.7702, test_loss: 0.9437, test_f1: 0.5325
 epoch: 94, train_loss: 0.7648, test_loss: 0.9220, test_f1: 0.5243
 epoch: 95, train_loss: 0.7628, test_loss: 0.8741, test_f1: 0.5446
 epoch: 96, train_loss: 0.7704, test_loss: 0.8918, test_f1: 0.5315
 epoch: 97, train_loss: 0.7575, test_loss: 0.8691, test_f1: 0.5550
 epoch: 98, train_loss: 0.7629, test_loss: 0.8946, test_f1: 0.5484
 epoch: 99, train_loss: 0.7691, test_loss: 0.8844, test_f1: 0.5459
##################ITERATION #6 ****************************************
 epoch: 0, train_loss: 1.2662, test_loss: 1.3398, test_f1: 0.2270
 epoch: 1, train_loss: 1.1318, test_loss: 1.3283, test_f1: 0.2270
 epoch: 2, train_loss: 1.0986, test_loss: 1.2931, test_f1: 0.2250
 epoch: 3, train_loss: 1.0555, test_loss: 1.0994, test_f1: 0.3519
 epoch: 4, train_loss: 1.0319, test_loss: 1.0464, test_f1: 0.4156
 epoch: 5, train_loss: 1.0347, test_loss: 1.0185, test_f1: 0.4358
 epoch: 6, train_loss: 1.0086, test_loss: 0.9849, test_f1: 0.4701
 epoch: 7, train_loss: 1.0008, test_loss: 1.0205, test_f1: 0.4592
 epoch: 8, train_loss: 0.9847, test_loss: 1.0052, test_f1: 0.4583
 epoch: 9, train_loss: 0.9853, test_loss: 0.9788, test_f1: 0.4690
 epoch: 10, train_loss: 0.9685, test_loss: 0.9816, test_f1: 0.4690
 epoch: 11, train_loss: 0.9724, test_loss: 0.9793, test_f1: 0.4609
 epoch: 12, train_loss: 0.9663, test_loss: 1.0119, test_f1: 0.4720
 epoch: 13, train_loss: 0.9615, test_loss: 0.9680, test_f1: 0.4899
 epoch: 14, train_loss: 0.9616, test_loss: 0.9651, test_f1: 0.4782
 epoch: 15, train_loss: 0.9603, test_loss: 1.0083, test_f1: 0.4664
 epoch: 16, train_loss: 0.9492, test_loss: 0.9672, test_f1: 0.4916
 epoch: 17, train_loss: 0.9374, test_loss: 0.9562, test_f1: 0.4814
 epoch: 18, train_loss: 0.9315, test_loss: 0.9594, test_f1: 0.4683
 epoch: 19, train_loss: 0.9253, test_loss: 0.9650, test_f1: 0.4920
 epoch: 20, train_loss: 0.9187, test_loss: 0.9519, test_f1: 0.4688
 epoch: 21, train_loss: 0.9195, test_loss: 0.9980, test_f1: 0.4822
 epoch: 22, train_loss: 0.9105, test_loss: 0.9595, test_f1: 0.4837
 epoch: 23, train_loss: 0.8987, test_loss: 1.0204, test_f1: 0.4673
 epoch: 24, train_loss: 0.9032, test_loss: 1.0287, test_f1: 0.4637
 epoch: 25, train_loss: 0.8865, test_loss: 0.9414, test_f1: 0.5113
 epoch: 26, train_loss: 0.8953, test_loss: 1.0060, test_f1: 0.4868
 epoch: 27, train_loss: 0.8927, test_loss: 0.9341, test_f1: 0.5057
 epoch: 28, train_loss: 0.8868, test_loss: 0.9461, test_f1: 0.4959
 epoch: 29, train_loss: 0.8827, test_loss: 0.9403, test_f1: 0.5104
 epoch: 30, train_loss: 0.8768, test_loss: 0.9690, test_f1: 0.5096
 epoch: 31, train_loss: 0.8618, test_loss: 1.0042, test_f1: 0.4712
 epoch: 32, train_loss: 0.8706, test_loss: 0.9165, test_f1: 0.5008
 epoch: 33, train_loss: 0.8646, test_loss: 0.9382, test_f1: 0.5057
 epoch: 34, train_loss: 0.8655, test_loss: 0.9331, test_f1: 0.5398
 epoch: 35, train_loss: 0.8637, test_loss: 1.0459, test_f1: 0.4820
 epoch: 36, train_loss: 0.8580, test_loss: 0.9065, test_f1: 0.5369
 epoch: 37, train_loss: 0.8534, test_loss: 0.9034, test_f1: 0.5379
 epoch: 38, train_loss: 0.8524, test_loss: 0.8879, test_f1: 0.5340
 epoch: 39, train_loss: 0.8476, test_loss: 0.9287, test_f1: 0.5491
 epoch: 40, train_loss: 0.8506, test_loss: 0.9151, test_f1: 0.5125
 epoch: 41, train_loss: 0.8549, test_loss: 0.9332, test_f1: 0.5079
 epoch: 42, train_loss: 0.8365, test_loss: 0.9683, test_f1: 0.4744
 epoch: 43, train_loss: 0.8394, test_loss: 0.9344, test_f1: 0.5440
 epoch: 44, train_loss: 0.8367, test_loss: 0.9239, test_f1: 0.5100
 epoch: 45, train_loss: 0.8461, test_loss: 0.9388, test_f1: 0.5038
 epoch: 46, train_loss: 0.8318, test_loss: 0.9566, test_f1: 0.5160
 epoch: 47, train_loss: 0.8315, test_loss: 0.9598, test_f1: 0.5339
 epoch: 48, train_loss: 0.8247, test_loss: 0.9321, test_f1: 0.5256
 epoch: 49, train_loss: 0.8295, test_loss: 0.9312, test_f1: 0.5290
 epoch: 50, train_loss: 0.8243, test_loss: 0.9535, test_f1: 0.5356
 epoch: 51, train_loss: 0.8175, test_loss: 0.9061, test_f1: 0.5269
 epoch: 52, train_loss: 0.8023, test_loss: 0.8990, test_f1: 0.5365
 epoch: 53, train_loss: 0.8053, test_loss: 0.9036, test_f1: 0.5507
 epoch: 54, train_loss: 0.7972, test_loss: 0.8928, test_f1: 0.5362
 epoch: 55, train_loss: 0.8058, test_loss: 0.8966, test_f1: 0.5487
 epoch: 56, train_loss: 0.8005, test_loss: 0.8806, test_f1: 0.5474
 epoch: 57, train_loss: 0.7941, test_loss: 0.8792, test_f1: 0.5421
 epoch: 58, train_loss: 0.7981, test_loss: 0.8896, test_f1: 0.5491
 epoch: 59, train_loss: 0.7911, test_loss: 0.9050, test_f1: 0.5454
 epoch: 60, train_loss: 0.7886, test_loss: 0.8945, test_f1: 0.5480
 epoch: 61, train_loss: 0.7853, test_loss: 0.9123, test_f1: 0.5281
 epoch: 62, train_loss: 0.7994, test_loss: 0.9045, test_f1: 0.5382
 epoch: 63, train_loss: 0.7919, test_loss: 0.8930, test_f1: 0.5459
 epoch: 64, train_loss: 0.7878, test_loss: 0.8965, test_f1: 0.5410
 epoch: 65, train_loss: 0.7865, test_loss: 0.9088, test_f1: 0.5484
 epoch: 66, train_loss: 0.7800, test_loss: 0.9101, test_f1: 0.5486
 epoch: 67, train_loss: 0.7781, test_loss: 0.9095, test_f1: 0.5306
 epoch: 68, train_loss: 0.7810, test_loss: 0.9307, test_f1: 0.5158
 epoch: 69, train_loss: 0.7765, test_loss: 0.8813, test_f1: 0.5498
 epoch: 70, train_loss: 0.7689, test_loss: 0.9025, test_f1: 0.5458
 epoch: 71, train_loss: 0.7745, test_loss: 0.9133, test_f1: 0.5397
 epoch: 72, train_loss: 0.7629, test_loss: 0.8948, test_f1: 0.5484
 epoch: 73, train_loss: 0.7666, test_loss: 0.9140, test_f1: 0.5437
 epoch: 74, train_loss: 0.7705, test_loss: 0.9107, test_f1: 0.5322
 epoch: 75, train_loss: 0.7774, test_loss: 0.8894, test_f1: 0.5441
 epoch: 76, train_loss: 0.7819, test_loss: 0.9518, test_f1: 0.5268
 epoch: 77, train_loss: 0.7621, test_loss: 0.9052, test_f1: 0.5603
 epoch: 78, train_loss: 0.7673, test_loss: 0.9086, test_f1: 0.5384
 epoch: 79, train_loss: 0.7756, test_loss: 0.9092, test_f1: 0.5556
 epoch: 80, train_loss: 0.7647, test_loss: 0.8956, test_f1: 0.5435
 epoch: 81, train_loss: 0.7671, test_loss: 0.9054, test_f1: 0.5592
 epoch: 82, train_loss: 0.7600, test_loss: 0.8975, test_f1: 0.5602
 epoch: 83, train_loss: 0.7685, test_loss: 0.9060, test_f1: 0.5487
 epoch: 84, train_loss: 0.7617, test_loss: 0.9064, test_f1: 0.5587
 epoch: 85, train_loss: 0.7554, test_loss: 0.9421, test_f1: 0.5482
 epoch: 86, train_loss: 0.7700, test_loss: 0.8971, test_f1: 0.5674
 epoch: 87, train_loss: 0.7574, test_loss: 0.9077, test_f1: 0.5408
 epoch: 88, train_loss: 0.7589, test_loss: 0.9193, test_f1: 0.5701
 epoch: 89, train_loss: 0.7572, test_loss: 0.9165, test_f1: 0.5493
 epoch: 90, train_loss: 0.7553, test_loss: 0.9494, test_f1: 0.5429
 epoch: 91, train_loss: 0.7534, test_loss: 0.9181, test_f1: 0.5539
 epoch: 92, train_loss: 0.7509, test_loss: 0.9162, test_f1: 0.5595
 epoch: 93, train_loss: 0.7552, test_loss: 0.9165, test_f1: 0.5622
 epoch: 94, train_loss: 0.7462, test_loss: 0.9102, test_f1: 0.5498
 epoch: 95, train_loss: 0.7408, test_loss: 0.9094, test_f1: 0.5563
 epoch: 96, train_loss: 0.7528, test_loss: 0.9022, test_f1: 0.5600
 epoch: 97, train_loss: 0.7389, test_loss: 0.9163, test_f1: 0.5633
 epoch: 98, train_loss: 0.7466, test_loss: 0.9184, test_f1: 0.5792
 epoch: 99, train_loss: 0.7443, test_loss: 0.9276, test_f1: 0.5712
##################ITERATION #7 ****************************************
 epoch: 0, train_loss: 1.5134, test_loss: 1.3233, test_f1: 0.2270
 epoch: 1, train_loss: 1.2192, test_loss: 1.3334, test_f1: 0.2270
 epoch: 2, train_loss: 1.1647, test_loss: 1.2725, test_f1: 0.2348
 epoch: 3, train_loss: 1.1402, test_loss: 1.1395, test_f1: 0.3288
 epoch: 4, train_loss: 1.1054, test_loss: 1.0663, test_f1: 0.3934
 epoch: 5, train_loss: 1.0746, test_loss: 1.0330, test_f1: 0.4266
 epoch: 6, train_loss: 1.0604, test_loss: 1.0182, test_f1: 0.4281
 epoch: 7, train_loss: 1.0526, test_loss: 1.0062, test_f1: 0.4362
 epoch: 8, train_loss: 1.0419, test_loss: 1.0023, test_f1: 0.4430
 epoch: 9, train_loss: 1.0359, test_loss: 0.9999, test_f1: 0.4474
 epoch: 10, train_loss: 1.0176, test_loss: 0.9966, test_f1: 0.4538
 epoch: 11, train_loss: 1.0201, test_loss: 0.9728, test_f1: 0.4532
 epoch: 12, train_loss: 1.0122, test_loss: 0.9658, test_f1: 0.4724
 epoch: 13, train_loss: 0.9998, test_loss: 0.9556, test_f1: 0.4727
 epoch: 14, train_loss: 0.9852, test_loss: 0.9385, test_f1: 0.4970
 epoch: 15, train_loss: 0.9769, test_loss: 0.9297, test_f1: 0.5008
 epoch: 16, train_loss: 0.9851, test_loss: 0.9286, test_f1: 0.4850
 epoch: 17, train_loss: 0.9758, test_loss: 0.9312, test_f1: 0.4916
 epoch: 18, train_loss: 0.9721, test_loss: 0.9241, test_f1: 0.4929
 epoch: 19, train_loss: 0.9590, test_loss: 0.9193, test_f1: 0.4811
 epoch: 20, train_loss: 0.9559, test_loss: 0.9082, test_f1: 0.5089
 epoch: 21, train_loss: 0.9640, test_loss: 0.9052, test_f1: 0.4896
 epoch: 22, train_loss: 0.9440, test_loss: 0.9055, test_f1: 0.5010
 epoch: 23, train_loss: 0.9473, test_loss: 0.8997, test_f1: 0.5211
 epoch: 24, train_loss: 0.9452, test_loss: 0.9015, test_f1: 0.5190
 epoch: 25, train_loss: 0.9352, test_loss: 0.8906, test_f1: 0.5033
 epoch: 26, train_loss: 0.9319, test_loss: 0.8905, test_f1: 0.5119
 epoch: 27, train_loss: 0.9251, test_loss: 0.8908, test_f1: 0.5228
 epoch: 28, train_loss: 0.9309, test_loss: 0.8911, test_f1: 0.5008
 epoch: 29, train_loss: 0.9294, test_loss: 0.9014, test_f1: 0.5027
 epoch: 30, train_loss: 0.9214, test_loss: 0.8830, test_f1: 0.5222
 epoch: 31, train_loss: 0.9143, test_loss: 0.8758, test_f1: 0.5471
 epoch: 32, train_loss: 0.9189, test_loss: 0.8695, test_f1: 0.5289
 epoch: 33, train_loss: 0.9107, test_loss: 0.8642, test_f1: 0.5509
 epoch: 34, train_loss: 0.9036, test_loss: 0.8618, test_f1: 0.5496
 epoch: 35, train_loss: 0.9059, test_loss: 0.8639, test_f1: 0.5540
 epoch: 36, train_loss: 0.8987, test_loss: 0.8844, test_f1: 0.4977
 epoch: 37, train_loss: 0.9065, test_loss: 0.8678, test_f1: 0.5461
 epoch: 38, train_loss: 0.8921, test_loss: 0.8714, test_f1: 0.5412
 epoch: 39, train_loss: 0.8918, test_loss: 0.8670, test_f1: 0.5325
 epoch: 40, train_loss: 0.8845, test_loss: 0.8708, test_f1: 0.5280
 epoch: 41, train_loss: 0.8869, test_loss: 0.8563, test_f1: 0.5246
 epoch: 42, train_loss: 0.8803, test_loss: 0.8500, test_f1: 0.5573
 epoch: 43, train_loss: 0.8865, test_loss: 0.8777, test_f1: 0.5237
 epoch: 44, train_loss: 0.8823, test_loss: 0.8650, test_f1: 0.5156
 epoch: 45, train_loss: 0.8797, test_loss: 0.8581, test_f1: 0.5247
 epoch: 46, train_loss: 0.8735, test_loss: 0.8481, test_f1: 0.5391
 epoch: 47, train_loss: 0.8601, test_loss: 0.8436, test_f1: 0.5305
 epoch: 48, train_loss: 0.8646, test_loss: 0.8565, test_f1: 0.5393
 epoch: 49, train_loss: 0.8659, test_loss: 0.8584, test_f1: 0.5424
 epoch: 50, train_loss: 0.8706, test_loss: 0.8688, test_f1: 0.5277
 epoch: 51, train_loss: 0.8501, test_loss: 0.8443, test_f1: 0.5507
 epoch: 52, train_loss: 0.8548, test_loss: 0.8380, test_f1: 0.5563
 epoch: 53, train_loss: 0.8634, test_loss: 0.8433, test_f1: 0.5616
 epoch: 54, train_loss: 0.8498, test_loss: 0.8361, test_f1: 0.5593
 epoch: 55, train_loss: 0.8469, test_loss: 0.8571, test_f1: 0.5127
 epoch: 56, train_loss: 0.8437, test_loss: 0.8495, test_f1: 0.5362
 epoch: 57, train_loss: 0.8344, test_loss: 0.8530, test_f1: 0.5319
 epoch: 58, train_loss: 0.8432, test_loss: 0.8487, test_f1: 0.5409
 epoch: 59, train_loss: 0.8328, test_loss: 0.8508, test_f1: 0.5292
 epoch: 60, train_loss: 0.8421, test_loss: 0.8575, test_f1: 0.5381
 epoch: 61, train_loss: 0.8329, test_loss: 0.8778, test_f1: 0.5340
 epoch: 62, train_loss: 0.8302, test_loss: 0.8410, test_f1: 0.5508
 epoch: 63, train_loss: 0.8334, test_loss: 0.8565, test_f1: 0.5291
 epoch: 64, train_loss: 0.8308, test_loss: 0.8509, test_f1: 0.5695
 epoch: 65, train_loss: 0.8334, test_loss: 0.8393, test_f1: 0.5299
 epoch: 66, train_loss: 0.8412, test_loss: 0.8513, test_f1: 0.5311
 epoch: 67, train_loss: 0.8364, test_loss: 0.8509, test_f1: 0.5494
 epoch: 68, train_loss: 0.8357, test_loss: 0.8453, test_f1: 0.5386
 epoch: 69, train_loss: 0.8334, test_loss: 0.8454, test_f1: 0.5502
 epoch: 70, train_loss: 0.8424, test_loss: 0.8414, test_f1: 0.5423
 epoch: 71, train_loss: 0.8275, test_loss: 0.8468, test_f1: 0.5424
 epoch: 72, train_loss: 0.8284, test_loss: 0.8544, test_f1: 0.5336
 epoch: 73, train_loss: 0.8215, test_loss: 0.8348, test_f1: 0.5572
 epoch: 74, train_loss: 0.8276, test_loss: 0.8321, test_f1: 0.5552
 epoch: 75, train_loss: 0.8367, test_loss: 0.8484, test_f1: 0.5333
 epoch: 76, train_loss: 0.8123, test_loss: 0.8482, test_f1: 0.5416
 epoch: 77, train_loss: 0.8225, test_loss: 0.8306, test_f1: 0.5442
 epoch: 78, train_loss: 0.8183, test_loss: 0.8322, test_f1: 0.5561
 epoch: 79, train_loss: 0.8160, test_loss: 0.8260, test_f1: 0.5729
 epoch: 80, train_loss: 0.8176, test_loss: 0.8583, test_f1: 0.5465
 epoch: 81, train_loss: 0.8174, test_loss: 0.8476, test_f1: 0.5451
 epoch: 82, train_loss: 0.8098, test_loss: 0.8388, test_f1: 0.5557
 epoch: 83, train_loss: 0.8097, test_loss: 0.8360, test_f1: 0.5592
 epoch: 84, train_loss: 0.8081, test_loss: 0.8404, test_f1: 0.5498
 epoch: 85, train_loss: 0.8128, test_loss: 0.8587, test_f1: 0.5496
 epoch: 86, train_loss: 0.8010, test_loss: 0.8803, test_f1: 0.5357
 epoch: 87, train_loss: 0.7943, test_loss: 0.8470, test_f1: 0.5367
 epoch: 88, train_loss: 0.8005, test_loss: 0.8290, test_f1: 0.5542
 epoch: 89, train_loss: 0.8024, test_loss: 0.8513, test_f1: 0.5376
 epoch: 90, train_loss: 0.8048, test_loss: 0.8391, test_f1: 0.5486
 epoch: 91, train_loss: 0.7938, test_loss: 0.8663, test_f1: 0.5362
 epoch: 92, train_loss: 0.7961, test_loss: 0.8285, test_f1: 0.5553
 epoch: 93, train_loss: 0.7929, test_loss: 0.8290, test_f1: 0.5440
 epoch: 94, train_loss: 0.7960, test_loss: 0.8226, test_f1: 0.5790
 epoch: 95, train_loss: 0.8026, test_loss: 0.8229, test_f1: 0.5837
 epoch: 96, train_loss: 0.7910, test_loss: 0.8538, test_f1: 0.5439
 epoch: 97, train_loss: 0.7834, test_loss: 0.8343, test_f1: 0.5516
 epoch: 98, train_loss: 0.7905, test_loss: 0.8303, test_f1: 0.5709
 epoch: 99, train_loss: 0.7894, test_loss: 0.8306, test_f1: 0.5713
##################ITERATION #8 ****************************************
 epoch: 0, train_loss: 1.4201, test_loss: 1.4613, test_f1: 0.2270
 epoch: 1, train_loss: 1.1544, test_loss: 1.2856, test_f1: 0.2270
 epoch: 2, train_loss: 1.1074, test_loss: 1.3176, test_f1: 0.3138
 epoch: 3, train_loss: 1.0733, test_loss: 1.3575, test_f1: 0.3085
 epoch: 4, train_loss: 1.0618, test_loss: 1.2948, test_f1: 0.3467
 epoch: 5, train_loss: 1.0405, test_loss: 1.1455, test_f1: 0.4343
 epoch: 6, train_loss: 1.0341, test_loss: 1.0125, test_f1: 0.4511
 epoch: 7, train_loss: 1.0263, test_loss: 0.9990, test_f1: 0.4669
 epoch: 8, train_loss: 0.9984, test_loss: 0.9943, test_f1: 0.4639
 epoch: 9, train_loss: 1.0049, test_loss: 0.9948, test_f1: 0.4749
 epoch: 10, train_loss: 0.9955, test_loss: 1.0467, test_f1: 0.4695
 epoch: 11, train_loss: 0.9931, test_loss: 0.9832, test_f1: 0.4779
 epoch: 12, train_loss: 0.9823, test_loss: 0.9745, test_f1: 0.4699
 epoch: 13, train_loss: 0.9703, test_loss: 0.9444, test_f1: 0.4906
 epoch: 14, train_loss: 0.9571, test_loss: 0.9437, test_f1: 0.5002
 epoch: 15, train_loss: 0.9615, test_loss: 0.9758, test_f1: 0.4765
 epoch: 16, train_loss: 0.9511, test_loss: 0.9363, test_f1: 0.4961
 epoch: 17, train_loss: 0.9433, test_loss: 0.9533, test_f1: 0.4823
 epoch: 18, train_loss: 0.9362, test_loss: 0.9222, test_f1: 0.5053
 epoch: 19, train_loss: 0.9371, test_loss: 0.9348, test_f1: 0.4976
 epoch: 20, train_loss: 0.9264, test_loss: 0.9855, test_f1: 0.4869
 epoch: 21, train_loss: 0.9309, test_loss: 0.9320, test_f1: 0.4840
 epoch: 22, train_loss: 0.9170, test_loss: 0.9135, test_f1: 0.5029
 epoch: 23, train_loss: 0.9179, test_loss: 0.9373, test_f1: 0.5142
 epoch: 24, train_loss: 0.9133, test_loss: 0.9676, test_f1: 0.4759
 epoch: 25, train_loss: 0.9145, test_loss: 0.9140, test_f1: 0.5169
 epoch: 26, train_loss: 0.9175, test_loss: 1.0468, test_f1: 0.4531
 epoch: 27, train_loss: 0.9085, test_loss: 0.9547, test_f1: 0.4883
 epoch: 28, train_loss: 0.9064, test_loss: 0.9087, test_f1: 0.5039
 epoch: 29, train_loss: 0.9017, test_loss: 0.9182, test_f1: 0.4838
 epoch: 30, train_loss: 0.8864, test_loss: 0.9810, test_f1: 0.4898
 epoch: 31, train_loss: 0.8862, test_loss: 0.9031, test_f1: 0.5091
 epoch: 32, train_loss: 0.8970, test_loss: 1.0461, test_f1: 0.4656
 epoch: 33, train_loss: 0.8820, test_loss: 0.9025, test_f1: 0.5264
 epoch: 34, train_loss: 0.8836, test_loss: 1.0303, test_f1: 0.4812
 epoch: 35, train_loss: 0.8747, test_loss: 0.9725, test_f1: 0.4773
 epoch: 36, train_loss: 0.8747, test_loss: 0.9785, test_f1: 0.4901
 epoch: 37, train_loss: 0.8632, test_loss: 1.0055, test_f1: 0.4896
 epoch: 38, train_loss: 0.8655, test_loss: 0.9261, test_f1: 0.5125
 epoch: 39, train_loss: 0.8716, test_loss: 0.9014, test_f1: 0.5107
 epoch: 40, train_loss: 0.8561, test_loss: 0.9510, test_f1: 0.5152
 epoch: 41, train_loss: 0.8666, test_loss: 1.0397, test_f1: 0.4856
 epoch: 42, train_loss: 0.8447, test_loss: 1.0251, test_f1: 0.4849
 epoch: 43, train_loss: 0.8479, test_loss: 0.9209, test_f1: 0.5030
 epoch: 44, train_loss: 0.8442, test_loss: 0.9553, test_f1: 0.5017
 epoch: 45, train_loss: 0.8533, test_loss: 0.9606, test_f1: 0.5201
 epoch: 46, train_loss: 0.8514, test_loss: 1.1653, test_f1: 0.4615
 epoch: 47, train_loss: 0.8313, test_loss: 0.9228, test_f1: 0.5016
 epoch: 48, train_loss: 0.8326, test_loss: 0.8849, test_f1: 0.5141
 epoch: 49, train_loss: 0.8440, test_loss: 1.1378, test_f1: 0.4934
 epoch: 50, train_loss: 0.8377, test_loss: 0.9756, test_f1: 0.5092
 epoch: 51, train_loss: 0.8179, test_loss: 0.9603, test_f1: 0.5160
 epoch: 52, train_loss: 0.8239, test_loss: 0.9319, test_f1: 0.5097
 epoch: 53, train_loss: 0.8275, test_loss: 0.9143, test_f1: 0.5263
 epoch: 54, train_loss: 0.8130, test_loss: 0.9655, test_f1: 0.5161
 epoch: 55, train_loss: 0.8171, test_loss: 0.9488, test_f1: 0.5340
 epoch: 56, train_loss: 0.8076, test_loss: 0.9442, test_f1: 0.5118
 epoch: 57, train_loss: 0.8117, test_loss: 0.9994, test_f1: 0.4908
 epoch: 58, train_loss: 0.8081, test_loss: 0.9273, test_f1: 0.5270
 epoch: 59, train_loss: 0.8137, test_loss: 1.0023, test_f1: 0.4936
 epoch: 60, train_loss: 0.8062, test_loss: 0.9324, test_f1: 0.5193
 epoch: 61, train_loss: 0.8045, test_loss: 0.9295, test_f1: 0.5271
 epoch: 62, train_loss: 0.7957, test_loss: 0.9037, test_f1: 0.5348
 epoch: 63, train_loss: 0.8192, test_loss: 1.0071, test_f1: 0.5251
 epoch: 64, train_loss: 0.8030, test_loss: 0.9140, test_f1: 0.5141
 epoch: 65, train_loss: 0.7980, test_loss: 0.9536, test_f1: 0.5335
 epoch: 66, train_loss: 0.7966, test_loss: 0.9500, test_f1: 0.5266
 epoch: 67, train_loss: 0.7976, test_loss: 0.9256, test_f1: 0.5144
 epoch: 68, train_loss: 0.7929, test_loss: 0.9310, test_f1: 0.5243
 epoch: 69, train_loss: 0.7962, test_loss: 0.9892, test_f1: 0.5229
 epoch: 70, train_loss: 0.7993, test_loss: 0.9315, test_f1: 0.5346
 epoch: 71, train_loss: 0.8085, test_loss: 0.9288, test_f1: 0.5323
 epoch: 72, train_loss: 0.7990, test_loss: 0.9534, test_f1: 0.5161
 epoch: 73, train_loss: 0.7890, test_loss: 0.8909, test_f1: 0.5338
 epoch: 74, train_loss: 0.7896, test_loss: 1.0229, test_f1: 0.5047
 epoch: 75, train_loss: 0.7900, test_loss: 0.9218, test_f1: 0.5378
 epoch: 76, train_loss: 0.7906, test_loss: 0.9685, test_f1: 0.5419
 epoch: 77, train_loss: 0.7874, test_loss: 0.9482, test_f1: 0.5161
 epoch: 78, train_loss: 0.7835, test_loss: 0.9725, test_f1: 0.5204
 epoch: 79, train_loss: 0.7823, test_loss: 0.9826, test_f1: 0.5241
 epoch: 80, train_loss: 0.7799, test_loss: 0.9214, test_f1: 0.5422
 epoch: 81, train_loss: 0.7840, test_loss: 1.0180, test_f1: 0.5286
 epoch: 82, train_loss: 0.7755, test_loss: 0.9256, test_f1: 0.5342
 epoch: 83, train_loss: 0.7744, test_loss: 0.9647, test_f1: 0.5302
 epoch: 84, train_loss: 0.7804, test_loss: 0.8999, test_f1: 0.5271
 epoch: 85, train_loss: 0.7637, test_loss: 0.9914, test_f1: 0.5167
 epoch: 86, train_loss: 0.7742, test_loss: 0.8714, test_f1: 0.5430
 epoch: 87, train_loss: 0.7738, test_loss: 0.9073, test_f1: 0.5526
 epoch: 88, train_loss: 0.7822, test_loss: 0.9598, test_f1: 0.5202
 epoch: 89, train_loss: 0.7721, test_loss: 0.9955, test_f1: 0.5082
 epoch: 90, train_loss: 0.7859, test_loss: 0.9340, test_f1: 0.5493
 epoch: 91, train_loss: 0.7738, test_loss: 0.9187, test_f1: 0.5458
 epoch: 92, train_loss: 0.7800, test_loss: 0.9373, test_f1: 0.5294
 epoch: 93, train_loss: 0.7671, test_loss: 0.9247, test_f1: 0.5321
 epoch: 94, train_loss: 0.7725, test_loss: 0.9565, test_f1: 0.5233
 epoch: 95, train_loss: 0.7692, test_loss: 0.9532, test_f1: 0.5325
 epoch: 96, train_loss: 0.7722, test_loss: 0.9622, test_f1: 0.5377
 epoch: 97, train_loss: 0.7718, test_loss: 0.9324, test_f1: 0.5282
 epoch: 98, train_loss: 0.7633, test_loss: 0.9494, test_f1: 0.5351
 epoch: 99, train_loss: 0.7592, test_loss: 0.9557, test_f1: 0.5348
##################ITERATION #9 ****************************************
 epoch: 0, train_loss: 1.3820, test_loss: 1.3734, test_f1: 0.2270
 epoch: 1, train_loss: 1.1569, test_loss: 1.3745, test_f1: 0.2270
 epoch: 2, train_loss: 1.1188, test_loss: 1.1880, test_f1: 0.2570
 epoch: 3, train_loss: 1.0868, test_loss: 1.1070, test_f1: 0.3384
 epoch: 4, train_loss: 1.0636, test_loss: 1.0790, test_f1: 0.3524
 epoch: 5, train_loss: 1.0374, test_loss: 1.0517, test_f1: 0.4031
 epoch: 6, train_loss: 1.0258, test_loss: 1.0199, test_f1: 0.4387
 epoch: 7, train_loss: 1.0094, test_loss: 1.0177, test_f1: 0.4664
 epoch: 8, train_loss: 1.0039, test_loss: 1.0204, test_f1: 0.4693
 epoch: 9, train_loss: 0.9869, test_loss: 1.0213, test_f1: 0.4652
 epoch: 10, train_loss: 0.9800, test_loss: 1.0187, test_f1: 0.4616
 epoch: 11, train_loss: 0.9713, test_loss: 1.0074, test_f1: 0.4695
 epoch: 12, train_loss: 0.9709, test_loss: 0.9989, test_f1: 0.4768
 epoch: 13, train_loss: 0.9516, test_loss: 1.0176, test_f1: 0.4806
 epoch: 14, train_loss: 0.9518, test_loss: 1.0007, test_f1: 0.5011
 epoch: 15, train_loss: 0.9467, test_loss: 0.9894, test_f1: 0.4845
 epoch: 16, train_loss: 0.9478, test_loss: 0.9974, test_f1: 0.4937
 epoch: 17, train_loss: 0.9414, test_loss: 0.9738, test_f1: 0.4885
 epoch: 18, train_loss: 0.9401, test_loss: 0.9942, test_f1: 0.4936
 epoch: 19, train_loss: 0.9335, test_loss: 0.9926, test_f1: 0.4978
 epoch: 20, train_loss: 0.9367, test_loss: 0.9762, test_f1: 0.4996
 epoch: 21, train_loss: 0.9167, test_loss: 0.9813, test_f1: 0.5042
 epoch: 22, train_loss: 0.9242, test_loss: 0.9821, test_f1: 0.5022
 epoch: 23, train_loss: 0.9130, test_loss: 0.9861, test_f1: 0.5019
 epoch: 24, train_loss: 0.9088, test_loss: 0.9742, test_f1: 0.5107
 epoch: 25, train_loss: 0.9096, test_loss: 0.9641, test_f1: 0.5113
 epoch: 26, train_loss: 0.9180, test_loss: 0.9836, test_f1: 0.5065
 epoch: 27, train_loss: 0.9053, test_loss: 0.9889, test_f1: 0.5076
 epoch: 28, train_loss: 0.9036, test_loss: 0.9937, test_f1: 0.5150
 epoch: 29, train_loss: 0.8930, test_loss: 0.9841, test_f1: 0.5189
 epoch: 30, train_loss: 0.8979, test_loss: 0.9754, test_f1: 0.5222
 epoch: 31, train_loss: 0.8975, test_loss: 0.9789, test_f1: 0.5207
 epoch: 32, train_loss: 0.8982, test_loss: 0.9759, test_f1: 0.5176
 epoch: 33, train_loss: 0.8904, test_loss: 0.9545, test_f1: 0.5164
 epoch: 34, train_loss: 0.8927, test_loss: 0.9652, test_f1: 0.5218
 epoch: 35, train_loss: 0.8878, test_loss: 0.9815, test_f1: 0.5034
 epoch: 36, train_loss: 0.8797, test_loss: 0.9712, test_f1: 0.5142
 epoch: 37, train_loss: 0.8751, test_loss: 0.9676, test_f1: 0.5301
 epoch: 38, train_loss: 0.8786, test_loss: 0.9822, test_f1: 0.5126
 epoch: 39, train_loss: 0.8806, test_loss: 0.9647, test_f1: 0.5310
 epoch: 40, train_loss: 0.8723, test_loss: 0.9788, test_f1: 0.5122
 epoch: 41, train_loss: 0.8640, test_loss: 0.9847, test_f1: 0.5118
 epoch: 42, train_loss: 0.8777, test_loss: 0.9572, test_f1: 0.5179
 epoch: 43, train_loss: 0.8691, test_loss: 0.9532, test_f1: 0.5345
 epoch: 44, train_loss: 0.8668, test_loss: 0.9725, test_f1: 0.5132
 epoch: 45, train_loss: 0.8679, test_loss: 0.9474, test_f1: 0.5333
 epoch: 46, train_loss: 0.8484, test_loss: 0.9712, test_f1: 0.5240
 epoch: 47, train_loss: 0.8535, test_loss: 0.9436, test_f1: 0.5183
 epoch: 48, train_loss: 0.8620, test_loss: 0.9692, test_f1: 0.5245
 epoch: 49, train_loss: 0.8562, test_loss: 0.9622, test_f1: 0.5271
 epoch: 50, train_loss: 0.8583, test_loss: 0.9264, test_f1: 0.5261
 epoch: 51, train_loss: 0.8523, test_loss: 0.9539, test_f1: 0.5268
 epoch: 52, train_loss: 0.8313, test_loss: 0.9516, test_f1: 0.5379
 epoch: 53, train_loss: 0.8453, test_loss: 0.9628, test_f1: 0.5312
 epoch: 54, train_loss: 0.8353, test_loss: 0.9734, test_f1: 0.5273
 epoch: 55, train_loss: 0.8470, test_loss: 0.9528, test_f1: 0.5296
 epoch: 56, train_loss: 0.8418, test_loss: 0.9537, test_f1: 0.5325
 epoch: 57, train_loss: 0.8409, test_loss: 0.9608, test_f1: 0.5296
 epoch: 58, train_loss: 0.8492, test_loss: 0.9796, test_f1: 0.5337
 epoch: 59, train_loss: 0.8484, test_loss: 0.9621, test_f1: 0.5288
 epoch: 60, train_loss: 0.8389, test_loss: 0.9709, test_f1: 0.5355
 epoch: 61, train_loss: 0.8368, test_loss: 0.9635, test_f1: 0.5404
 epoch: 62, train_loss: 0.8417, test_loss: 0.9616, test_f1: 0.5336
 epoch: 63, train_loss: 0.8389, test_loss: 0.9606, test_f1: 0.5376
 epoch: 64, train_loss: 0.8319, test_loss: 0.9749, test_f1: 0.5422
 epoch: 65, train_loss: 0.8247, test_loss: 0.9687, test_f1: 0.5330
 epoch: 66, train_loss: 0.8262, test_loss: 0.9683, test_f1: 0.5364
 epoch: 67, train_loss: 0.8350, test_loss: 0.9816, test_f1: 0.5335
 epoch: 68, train_loss: 0.8300, test_loss: 0.9872, test_f1: 0.5296
 epoch: 69, train_loss: 0.8221, test_loss: 0.9773, test_f1: 0.5302
 epoch: 70, train_loss: 0.8286, test_loss: 0.9760, test_f1: 0.5266
 epoch: 71, train_loss: 0.8262, test_loss: 0.9667, test_f1: 0.5397
 epoch: 72, train_loss: 0.8244, test_loss: 0.9850, test_f1: 0.5377
 epoch: 73, train_loss: 0.8320, test_loss: 0.9605, test_f1: 0.5299
 epoch: 74, train_loss: 0.8310, test_loss: 0.9636, test_f1: 0.5259
 epoch: 75, train_loss: 0.8233, test_loss: 0.9602, test_f1: 0.5381
 epoch: 76, train_loss: 0.8250, test_loss: 0.9936, test_f1: 0.5271
 epoch: 77, train_loss: 0.8302, test_loss: 0.9687, test_f1: 0.5385
 epoch: 78, train_loss: 0.8277, test_loss: 0.9618, test_f1: 0.5226
 epoch: 79, train_loss: 0.8166, test_loss: 0.9636, test_f1: 0.5337
 epoch: 80, train_loss: 0.8199, test_loss: 0.9556, test_f1: 0.5361
 epoch: 81, train_loss: 0.8175, test_loss: 0.9562, test_f1: 0.5383
 epoch: 82, train_loss: 0.8124, test_loss: 0.9526, test_f1: 0.5285
 epoch: 83, train_loss: 0.8115, test_loss: 0.9610, test_f1: 0.5276
 epoch: 84, train_loss: 0.8112, test_loss: 0.9580, test_f1: 0.5350
 epoch: 85, train_loss: 0.8114, test_loss: 0.9799, test_f1: 0.5296
 epoch: 86, train_loss: 0.8129, test_loss: 0.9658, test_f1: 0.5279
 epoch: 87, train_loss: 0.8162, test_loss: 0.9489, test_f1: 0.5226
 epoch: 88, train_loss: 0.8146, test_loss: 0.9736, test_f1: 0.5243
 epoch: 89, train_loss: 0.8081, test_loss: 0.9497, test_f1: 0.5417
 epoch: 90, train_loss: 0.8130, test_loss: 0.9473, test_f1: 0.5376
 epoch: 91, train_loss: 0.8112, test_loss: 0.9441, test_f1: 0.5247
 epoch: 92, train_loss: 0.8061, test_loss: 0.9464, test_f1: 0.5391
 epoch: 93, train_loss: 0.8067, test_loss: 0.9730, test_f1: 0.5451
 epoch: 94, train_loss: 0.8074, test_loss: 0.9374, test_f1: 0.5352
 epoch: 95, train_loss: 0.8004, test_loss: 0.9551, test_f1: 0.5349
 epoch: 96, train_loss: 0.8027, test_loss: 0.9530, test_f1: 0.5439
 epoch: 97, train_loss: 0.8135, test_loss: 0.9474, test_f1: 0.5294
 epoch: 98, train_loss: 0.7928, test_loss: 0.9699, test_f1: 0.5405
 epoch: 99, train_loss: 0.8042, test_loss: 0.9485, test_f1: 0.5345

Training completed in 410.76 seconds
Best F1: 0.5837 at epoch 95
Mean F1 across iterations: 0.5579  0.0149
========================FINAL RESULTS================================
FEGIN weighted F1: 0.5837  0.0149
python main.py --data ltspice_examples --representation component_pin_net --model FEGIN --layers 4 --hiddens 16 --batch_size 256 --lr 0.001 --emb_size 128 --epochs 100 --save_appendix component_pin_net_L4_H16_BS256_LR0.001_E128 --no_val
-----



STDERR:
  File "main.py", line 370, in <module>
    main()
  File "main.py", line 254, in main
    dataset = dataset_class(
  File "/home/philip/projects/ltspice_examples_code_repo/Circuit-Completion-Using-GNNs/component_classification_with_link_prediction_head/evaluation/FEGIN/kernel/circuit_datasets.py", line 15, in __init__
    self.data, self.slices = torch.load(self.processed_paths[0])
  File "/home/philip/.local/lib/python3.8/site-packages/torch/serialization.py", line 1040, in load
    warnings.warn(
  File "/usr/lib/python3.8/warnings.py", line 109, in _showwarnmsg
    sw(msg.message, msg.category, msg.filename, msg.lineno,
  File "main.py", line 47, in warn_with_traceback
    traceback.print_stack(file=log)
/home/philip/projects/ltspice_examples_code_repo/Circuit-Completion-Using-GNNs/component_classification_with_link_prediction_head/evaluation/FEGIN/kernel/circuit_datasets.py:15: FutureWarning: You are using `torch.load` with `weights_only=False` (the current default value), which uses the default pickle module implicitly. It is possible to construct malicious pickle data which will execute arbitrary code during unpickling (See https://github.com/pytorch/pytorch/blob/main/SECURITY.md#untrusted-models for more details). In a future release, the default value for `weights_only` will be flipped to `True`. This limits the functions that could be executed during unpickling. Arbitrary objects will no longer be allowed to be loaded via this mode unless they are explicitly allowlisted by the user via `torch.serialization.add_safe_globals`. We recommend you start setting `weights_only=True` for any use case where you don't have full control of the loaded file. Please open an issue on GitHub for any issues related to this experimental feature.
  self.data, self.slices = torch.load(self.processed_paths[0])
