STDOUT:
Results will be saved in /home/philip/projects/ltspice_examples_code_repo/Circuit-Completion-Using-GNNs/component_classification_with_link_prediction_head/evaluation/FEGIN/results/model_FEGIN_dataset_ltspice_demos
Command line input: python main.py --data ltspice_demos --representation component_net --model FEGIN --layers 2 --hiddens 128 --batch_size 256 --lr 0.001 --emb_size 250 --epochs 100 --save_appendix component_net_L2_H128_BS256_LR0.001_E250 --no_val
 is saved.
-----
ltspice_demos - FEGIN
Using 2 layers, 128 hidden units, h = 2
Loading component_net representation dataset
ENTERED
Training FEGIN on component_net representation
Train: 1565, Test: 383
##################ITERATION #0 ****************************************
 epoch: 0, train_loss: 1.3358, test_loss: 1.3438, test_f1: 0.2281
 epoch: 1, train_loss: 1.2075, test_loss: 1.3094, test_f1: 0.2583
 epoch: 2, train_loss: 1.1608, test_loss: 1.2832, test_f1: 0.2722
 epoch: 3, train_loss: 1.1223, test_loss: 1.2488, test_f1: 0.2723
 epoch: 4, train_loss: 1.0924, test_loss: 1.2106, test_f1: 0.3540
 epoch: 5, train_loss: 1.0484, test_loss: 1.1789, test_f1: 0.4301
 epoch: 6, train_loss: 1.0148, test_loss: 1.1469, test_f1: 0.4145
 epoch: 7, train_loss: 0.9821, test_loss: 1.1125, test_f1: 0.4354
 epoch: 8, train_loss: 0.9558, test_loss: 1.0909, test_f1: 0.4960
 epoch: 9, train_loss: 0.9339, test_loss: 1.0942, test_f1: 0.4786
 epoch: 10, train_loss: 0.9036, test_loss: 1.1021, test_f1: 0.5439
 epoch: 11, train_loss: 0.8887, test_loss: 1.1185, test_f1: 0.5466
 epoch: 12, train_loss: 0.8735, test_loss: 1.0872, test_f1: 0.5219
 epoch: 13, train_loss: 0.8718, test_loss: 1.1102, test_f1: 0.5479
 epoch: 14, train_loss: 0.8580, test_loss: 1.1548, test_f1: 0.5598
 epoch: 15, train_loss: 0.8483, test_loss: 1.1243, test_f1: 0.5352
 epoch: 16, train_loss: 0.8427, test_loss: 1.1128, test_f1: 0.5765
 epoch: 17, train_loss: 0.8462, test_loss: 1.1196, test_f1: 0.5882
 epoch: 18, train_loss: 0.8347, test_loss: 1.0865, test_f1: 0.5483
 epoch: 19, train_loss: 0.8102, test_loss: 1.0199, test_f1: 0.5897
 epoch: 20, train_loss: 0.8140, test_loss: 1.0695, test_f1: 0.5239
 epoch: 21, train_loss: 0.7783, test_loss: 1.0726, test_f1: 0.5819
 epoch: 22, train_loss: 0.7793, test_loss: 1.1935, test_f1: 0.5421
 epoch: 23, train_loss: 0.7705, test_loss: 1.1391, test_f1: 0.6112
 epoch: 24, train_loss: 0.7693, test_loss: 1.2651, test_f1: 0.5342
 epoch: 25, train_loss: 0.7317, test_loss: 1.1262, test_f1: 0.6044
 epoch: 26, train_loss: 0.7276, test_loss: 1.1125, test_f1: 0.5427
 epoch: 27, train_loss: 0.7104, test_loss: 1.0870, test_f1: 0.5840
 epoch: 28, train_loss: 0.7065, test_loss: 1.0910, test_f1: 0.5928
 epoch: 29, train_loss: 0.6787, test_loss: 1.1150, test_f1: 0.5680
 epoch: 30, train_loss: 0.6850, test_loss: 1.0622, test_f1: 0.5760
 epoch: 31, train_loss: 0.6475, test_loss: 1.0191, test_f1: 0.5436
 epoch: 32, train_loss: 0.6560, test_loss: 1.1015, test_f1: 0.5686
 epoch: 33, train_loss: 0.6244, test_loss: 1.0997, test_f1: 0.5912
 epoch: 34, train_loss: 0.6391, test_loss: 1.0955, test_f1: 0.5786
 epoch: 35, train_loss: 0.6248, test_loss: 1.1564, test_f1: 0.5952
 epoch: 36, train_loss: 0.6216, test_loss: 1.2006, test_f1: 0.5969
 epoch: 37, train_loss: 0.6118, test_loss: 1.2387, test_f1: 0.5731
 epoch: 38, train_loss: 0.6064, test_loss: 1.2175, test_f1: 0.5798
 epoch: 39, train_loss: 0.6006, test_loss: 1.2382, test_f1: 0.5419
 epoch: 40, train_loss: 0.6216, test_loss: 1.3668, test_f1: 0.5618
 epoch: 41, train_loss: 0.6067, test_loss: 1.1666, test_f1: 0.5952
 epoch: 42, train_loss: 0.6083, test_loss: 1.2827, test_f1: 0.5772
 epoch: 43, train_loss: 0.5904, test_loss: 1.5049, test_f1: 0.5537
 epoch: 44, train_loss: 0.5777, test_loss: 1.2345, test_f1: 0.5801
 epoch: 45, train_loss: 0.5834, test_loss: 1.2524, test_f1: 0.5864
 epoch: 46, train_loss: 0.5971, test_loss: 1.1960, test_f1: 0.5968
 epoch: 47, train_loss: 0.5644, test_loss: 1.3375, test_f1: 0.5924
 epoch: 48, train_loss: 0.5336, test_loss: 1.2814, test_f1: 0.6079
 epoch: 49, train_loss: 0.5397, test_loss: 1.1937, test_f1: 0.6176
 epoch: 50, train_loss: 0.5422, test_loss: 1.3728, test_f1: 0.5865
 epoch: 51, train_loss: 0.5377, test_loss: 1.2750, test_f1: 0.5977
 epoch: 52, train_loss: 0.5066, test_loss: 1.2607, test_f1: 0.6015
 epoch: 53, train_loss: 0.5110, test_loss: 1.3805, test_f1: 0.5961
 epoch: 54, train_loss: 0.4868, test_loss: 1.4458, test_f1: 0.5857
 epoch: 55, train_loss: 0.4790, test_loss: 1.3839, test_f1: 0.5955
 epoch: 56, train_loss: 0.4809, test_loss: 1.2454, test_f1: 0.6197
 epoch: 57, train_loss: 0.4728, test_loss: 1.3055, test_f1: 0.6165
 epoch: 58, train_loss: 0.4644, test_loss: 1.4338, test_f1: 0.5845
 epoch: 59, train_loss: 0.4691, test_loss: 1.5123, test_f1: 0.5589
 epoch: 60, train_loss: 0.4574, test_loss: 1.5599, test_f1: 0.5895
 epoch: 61, train_loss: 0.4497, test_loss: 1.4638, test_f1: 0.5900
 epoch: 62, train_loss: 0.4377, test_loss: 1.4486, test_f1: 0.5970
 epoch: 63, train_loss: 0.4396, test_loss: 1.5394, test_f1: 0.5598
 epoch: 64, train_loss: 0.4259, test_loss: 1.5344, test_f1: 0.5944
 epoch: 65, train_loss: 0.4058, test_loss: 1.4933, test_f1: 0.6187
 epoch: 66, train_loss: 0.4088, test_loss: 1.5771, test_f1: 0.6208
 epoch: 67, train_loss: 0.4250, test_loss: 1.5413, test_f1: 0.6193
 epoch: 68, train_loss: 0.3958, test_loss: 1.5883, test_f1: 0.6020
 epoch: 69, train_loss: 0.3952, test_loss: 1.5647, test_f1: 0.6145
 epoch: 70, train_loss: 0.3871, test_loss: 1.7353, test_f1: 0.5920
 epoch: 71, train_loss: 0.3741, test_loss: 1.6457, test_f1: 0.6046
 epoch: 72, train_loss: 0.3675, test_loss: 1.5872, test_f1: 0.5897
 epoch: 73, train_loss: 0.4035, test_loss: 1.6418, test_f1: 0.5960
 epoch: 74, train_loss: 0.4100, test_loss: 1.6967, test_f1: 0.5951
 epoch: 75, train_loss: 0.4094, test_loss: 1.6498, test_f1: 0.6141
 epoch: 76, train_loss: 0.3705, test_loss: 1.6342, test_f1: 0.5936
 epoch: 77, train_loss: 0.3749, test_loss: 1.5976, test_f1: 0.6031
 epoch: 78, train_loss: 0.3929, test_loss: 1.6126, test_f1: 0.6093
 epoch: 79, train_loss: 0.3986, test_loss: 1.6319, test_f1: 0.6183
 epoch: 80, train_loss: 0.3740, test_loss: 1.9328, test_f1: 0.6037
 epoch: 81, train_loss: 0.3885, test_loss: 1.8675, test_f1: 0.5664
 epoch: 82, train_loss: 0.4073, test_loss: 1.8488, test_f1: 0.5765
 epoch: 83, train_loss: 0.4306, test_loss: 1.7653, test_f1: 0.5893
 epoch: 84, train_loss: 0.3712, test_loss: 1.8363, test_f1: 0.5660
 epoch: 85, train_loss: 0.3618, test_loss: 1.7006, test_f1: 0.6195
 epoch: 86, train_loss: 0.3405, test_loss: 1.7482, test_f1: 0.6028
 epoch: 87, train_loss: 0.3264, test_loss: 1.8404, test_f1: 0.5862
 epoch: 88, train_loss: 0.3222, test_loss: 1.8432, test_f1: 0.6096
 epoch: 89, train_loss: 0.3215, test_loss: 1.8361, test_f1: 0.6086
 epoch: 90, train_loss: 0.3014, test_loss: 1.9202, test_f1: 0.6145
 epoch: 91, train_loss: 0.3199, test_loss: 2.0288, test_f1: 0.5937
 epoch: 92, train_loss: 0.3311, test_loss: 1.9109, test_f1: 0.6239
 epoch: 93, train_loss: 0.3151, test_loss: 2.0151, test_f1: 0.6087
 epoch: 94, train_loss: 0.3186, test_loss: 2.1718, test_f1: 0.5837
 epoch: 95, train_loss: 0.3262, test_loss: 1.9797, test_f1: 0.6083
 epoch: 96, train_loss: 0.3149, test_loss: 1.9990, test_f1: 0.6276
 epoch: 97, train_loss: 0.3244, test_loss: 1.8912, test_f1: 0.6174
 epoch: 98, train_loss: 0.3086, test_loss: 1.9457, test_f1: 0.6379
 epoch: 99, train_loss: 0.2863, test_loss: 1.8695, test_f1: 0.6369
##################ITERATION #1 ****************************************
 epoch: 0, train_loss: 1.2126, test_loss: 1.3142, test_f1: 0.1365
 epoch: 1, train_loss: 1.0650, test_loss: 1.2952, test_f1: 0.1365
 epoch: 2, train_loss: 1.0017, test_loss: 1.2599, test_f1: 0.1431
 epoch: 3, train_loss: 0.9765, test_loss: 1.1849, test_f1: 0.4302
 epoch: 4, train_loss: 0.9473, test_loss: 1.1338, test_f1: 0.4495
 epoch: 5, train_loss: 0.9227, test_loss: 1.0997, test_f1: 0.4642
 epoch: 6, train_loss: 0.8975, test_loss: 1.0859, test_f1: 0.4981
 epoch: 7, train_loss: 0.8777, test_loss: 1.0570, test_f1: 0.5071
 epoch: 8, train_loss: 0.8631, test_loss: 1.0101, test_f1: 0.5228
 epoch: 9, train_loss: 0.8356, test_loss: 1.0244, test_f1: 0.5054
 epoch: 10, train_loss: 0.8121, test_loss: 1.0606, test_f1: 0.5918
 epoch: 11, train_loss: 0.7801, test_loss: 1.0325, test_f1: 0.5840
 epoch: 12, train_loss: 0.7868, test_loss: 1.0774, test_f1: 0.5247
 epoch: 13, train_loss: 0.7627, test_loss: 1.0407, test_f1: 0.5903
 epoch: 14, train_loss: 0.7538, test_loss: 1.0911, test_f1: 0.5604
 epoch: 15, train_loss: 0.7422, test_loss: 1.2411, test_f1: 0.5452
 epoch: 16, train_loss: 0.7327, test_loss: 1.3050, test_f1: 0.5331
 epoch: 17, train_loss: 0.7166, test_loss: 1.0993, test_f1: 0.5820
 epoch: 18, train_loss: 0.6895, test_loss: 1.0602, test_f1: 0.6040
 epoch: 19, train_loss: 0.7193, test_loss: 1.1123, test_f1: 0.5273
 epoch: 20, train_loss: 0.7098, test_loss: 1.0715, test_f1: 0.5925
 epoch: 21, train_loss: 0.6747, test_loss: 0.9890, test_f1: 0.6040
 epoch: 22, train_loss: 0.6564, test_loss: 1.0531, test_f1: 0.6192
 epoch: 23, train_loss: 0.6403, test_loss: 1.1272, test_f1: 0.5734
 epoch: 24, train_loss: 0.6551, test_loss: 1.1536, test_f1: 0.6259
 epoch: 25, train_loss: 0.6407, test_loss: 1.1740, test_f1: 0.6054
 epoch: 26, train_loss: 0.6327, test_loss: 1.1421, test_f1: 0.5651
 epoch: 27, train_loss: 0.6367, test_loss: 1.1405, test_f1: 0.5837
 epoch: 28, train_loss: 0.6244, test_loss: 1.1137, test_f1: 0.6086
 epoch: 29, train_loss: 0.5960, test_loss: 1.0577, test_f1: 0.6212
 epoch: 30, train_loss: 0.6055, test_loss: 1.1016, test_f1: 0.6234
 epoch: 31, train_loss: 0.5906, test_loss: 1.0620, test_f1: 0.6149
 epoch: 32, train_loss: 0.5679, test_loss: 1.1277, test_f1: 0.6331
 epoch: 33, train_loss: 0.5892, test_loss: 1.3005, test_f1: 0.5640
 epoch: 34, train_loss: 0.5767, test_loss: 1.2140, test_f1: 0.5564
 epoch: 35, train_loss: 0.5575, test_loss: 1.1709, test_f1: 0.6131
 epoch: 36, train_loss: 0.5428, test_loss: 1.1917, test_f1: 0.6134
 epoch: 37, train_loss: 0.5280, test_loss: 1.1741, test_f1: 0.6326
 epoch: 38, train_loss: 0.5338, test_loss: 1.3265, test_f1: 0.5870
 epoch: 39, train_loss: 0.4970, test_loss: 1.2366, test_f1: 0.5803
 epoch: 40, train_loss: 0.5106, test_loss: 1.3558, test_f1: 0.6305
 epoch: 41, train_loss: 0.5040, test_loss: 1.1701, test_f1: 0.6397
 epoch: 42, train_loss: 0.4893, test_loss: 1.5358, test_f1: 0.5981
 epoch: 43, train_loss: 0.4719, test_loss: 1.4002, test_f1: 0.6135
 epoch: 44, train_loss: 0.4883, test_loss: 1.3517, test_f1: 0.6070
 epoch: 45, train_loss: 0.4599, test_loss: 1.4503, test_f1: 0.5650
 epoch: 46, train_loss: 0.4768, test_loss: 1.3809, test_f1: 0.5991
 epoch: 47, train_loss: 0.4705, test_loss: 1.3232, test_f1: 0.5981
 epoch: 48, train_loss: 0.4376, test_loss: 1.4320, test_f1: 0.5673
 epoch: 49, train_loss: 0.4466, test_loss: 1.4585, test_f1: 0.6384
 epoch: 50, train_loss: 0.4598, test_loss: 1.4733, test_f1: 0.6163
 epoch: 51, train_loss: 0.4302, test_loss: 1.4107, test_f1: 0.6321
 epoch: 52, train_loss: 0.4083, test_loss: 1.4440, test_f1: 0.6139
 epoch: 53, train_loss: 0.3947, test_loss: 1.3558, test_f1: 0.6033
 epoch: 54, train_loss: 0.3914, test_loss: 1.3971, test_f1: 0.6168
 epoch: 55, train_loss: 0.3794, test_loss: 1.3517, test_f1: 0.6404
 epoch: 56, train_loss: 0.3795, test_loss: 1.3689, test_f1: 0.6469
 epoch: 57, train_loss: 0.3961, test_loss: 1.4499, test_f1: 0.6368
 epoch: 58, train_loss: 0.3585, test_loss: 1.6384, test_f1: 0.6116
 epoch: 59, train_loss: 0.3900, test_loss: 1.5728, test_f1: 0.6271
 epoch: 60, train_loss: 0.3613, test_loss: 1.4457, test_f1: 0.6154
 epoch: 61, train_loss: 0.3562, test_loss: 1.5454, test_f1: 0.6595
 epoch: 62, train_loss: 0.3618, test_loss: 1.7425, test_f1: 0.6298
 epoch: 63, train_loss: 0.3399, test_loss: 1.5890, test_f1: 0.6378
 epoch: 64, train_loss: 0.3559, test_loss: 1.4704, test_f1: 0.6394
 epoch: 65, train_loss: 0.3579, test_loss: 1.4722, test_f1: 0.6259
 epoch: 66, train_loss: 0.3870, test_loss: 1.6757, test_f1: 0.6251
 epoch: 67, train_loss: 0.3440, test_loss: 1.5590, test_f1: 0.6202
 epoch: 68, train_loss: 0.3423, test_loss: 1.4561, test_f1: 0.6122
 epoch: 69, train_loss: 0.3397, test_loss: 1.5647, test_f1: 0.6277
 epoch: 70, train_loss: 0.3406, test_loss: 1.5364, test_f1: 0.6132
 epoch: 71, train_loss: 0.3437, test_loss: 1.4322, test_f1: 0.6235
 epoch: 72, train_loss: 0.3365, test_loss: 1.5573, test_f1: 0.6435
 epoch: 73, train_loss: 0.3095, test_loss: 1.6097, test_f1: 0.6515
 epoch: 74, train_loss: 0.3116, test_loss: 1.6155, test_f1: 0.6342
 epoch: 75, train_loss: 0.3005, test_loss: 1.6405, test_f1: 0.6421
 epoch: 76, train_loss: 0.2714, test_loss: 1.7217, test_f1: 0.6270
 epoch: 77, train_loss: 0.2750, test_loss: 1.7477, test_f1: 0.6316
 epoch: 78, train_loss: 0.2811, test_loss: 1.7881, test_f1: 0.6119
 epoch: 79, train_loss: 0.2956, test_loss: 1.6905, test_f1: 0.6061
 epoch: 80, train_loss: 0.3220, test_loss: 1.6731, test_f1: 0.6272
 epoch: 81, train_loss: 0.2856, test_loss: 1.7054, test_f1: 0.6466
 epoch: 82, train_loss: 0.2872, test_loss: 1.6288, test_f1: 0.6217
 epoch: 83, train_loss: 0.2761, test_loss: 1.7936, test_f1: 0.6109
 epoch: 84, train_loss: 0.2802, test_loss: 1.6322, test_f1: 0.6351
 epoch: 85, train_loss: 0.2712, test_loss: 1.8634, test_f1: 0.6116
 epoch: 86, train_loss: 0.2455, test_loss: 1.7871, test_f1: 0.6459
 epoch: 87, train_loss: 0.2711, test_loss: 1.7751, test_f1: 0.6366
 epoch: 88, train_loss: 0.2913, test_loss: 2.2336, test_f1: 0.6040
 epoch: 89, train_loss: 0.2840, test_loss: 1.8696, test_f1: 0.6413
 epoch: 90, train_loss: 0.2690, test_loss: 1.9323, test_f1: 0.5986
 epoch: 91, train_loss: 0.2782, test_loss: 1.8618, test_f1: 0.6362
 epoch: 92, train_loss: 0.2776, test_loss: 1.8144, test_f1: 0.6412
 epoch: 93, train_loss: 0.2836, test_loss: 2.0569, test_f1: 0.6275
 epoch: 94, train_loss: 0.2677, test_loss: 1.7793, test_f1: 0.6375
 epoch: 95, train_loss: 0.2764, test_loss: 1.7007, test_f1: 0.6497
 epoch: 96, train_loss: 0.2642, test_loss: 1.7169, test_f1: 0.6491
 epoch: 97, train_loss: 0.2536, test_loss: 1.8619, test_f1: 0.6611
 epoch: 98, train_loss: 0.2452, test_loss: 1.9425, test_f1: 0.6476
 epoch: 99, train_loss: 0.2418, test_loss: 1.9704, test_f1: 0.6380
##################ITERATION #2 ****************************************
 epoch: 0, train_loss: 1.2247, test_loss: 1.3114, test_f1: 0.1365
 epoch: 1, train_loss: 1.0495, test_loss: 1.2925, test_f1: 0.1365
 epoch: 2, train_loss: 0.9888, test_loss: 1.2460, test_f1: 0.3062
 epoch: 3, train_loss: 0.9574, test_loss: 1.1992, test_f1: 0.4109
 epoch: 4, train_loss: 0.9417, test_loss: 1.1764, test_f1: 0.4230
 epoch: 5, train_loss: 0.9129, test_loss: 1.1264, test_f1: 0.4457
 epoch: 6, train_loss: 0.8991, test_loss: 1.1167, test_f1: 0.4703
 epoch: 7, train_loss: 0.8771, test_loss: 1.1293, test_f1: 0.4332
 epoch: 8, train_loss: 0.8602, test_loss: 1.0785, test_f1: 0.5145
 epoch: 9, train_loss: 0.8457, test_loss: 1.0184, test_f1: 0.5418
 epoch: 10, train_loss: 0.8146, test_loss: 1.0315, test_f1: 0.5938
 epoch: 11, train_loss: 0.8023, test_loss: 1.0736, test_f1: 0.5537
 epoch: 12, train_loss: 0.7888, test_loss: 1.0951, test_f1: 0.5544
 epoch: 13, train_loss: 0.7994, test_loss: 1.1237, test_f1: 0.5926
 epoch: 14, train_loss: 0.7714, test_loss: 1.0481, test_f1: 0.5812
 epoch: 15, train_loss: 0.7528, test_loss: 1.0735, test_f1: 0.5754
 epoch: 16, train_loss: 0.7409, test_loss: 1.0899, test_f1: 0.6176
 epoch: 17, train_loss: 0.7338, test_loss: 1.2175, test_f1: 0.5805
 epoch: 18, train_loss: 0.7237, test_loss: 1.1607, test_f1: 0.5617
 epoch: 19, train_loss: 0.7394, test_loss: 1.1398, test_f1: 0.5669
 epoch: 20, train_loss: 0.7075, test_loss: 1.1621, test_f1: 0.5857
 epoch: 21, train_loss: 0.7136, test_loss: 1.1744, test_f1: 0.5790
 epoch: 22, train_loss: 0.7069, test_loss: 1.2335, test_f1: 0.5762
 epoch: 23, train_loss: 0.6761, test_loss: 1.1957, test_f1: 0.5449
 epoch: 24, train_loss: 0.6694, test_loss: 1.1190, test_f1: 0.5894
 epoch: 25, train_loss: 0.6575, test_loss: 1.2550, test_f1: 0.5940
 epoch: 26, train_loss: 0.6532, test_loss: 1.1726, test_f1: 0.5932
 epoch: 27, train_loss: 0.6674, test_loss: 1.1426, test_f1: 0.5694
 epoch: 28, train_loss: 0.6523, test_loss: 1.1347, test_f1: 0.5827
 epoch: 29, train_loss: 0.6421, test_loss: 1.1343, test_f1: 0.6082
 epoch: 30, train_loss: 0.6231, test_loss: 1.2183, test_f1: 0.5772
 epoch: 31, train_loss: 0.5918, test_loss: 1.1428, test_f1: 0.5957
 epoch: 32, train_loss: 0.6031, test_loss: 1.1986, test_f1: 0.5944
 epoch: 33, train_loss: 0.5974, test_loss: 1.2488, test_f1: 0.5686
 epoch: 34, train_loss: 0.6061, test_loss: 1.0773, test_f1: 0.6458
 epoch: 35, train_loss: 0.6077, test_loss: 1.2057, test_f1: 0.5898
 epoch: 36, train_loss: 0.6012, test_loss: 1.2855, test_f1: 0.5704
 epoch: 37, train_loss: 0.5894, test_loss: 1.2467, test_f1: 0.6046
 epoch: 38, train_loss: 0.5505, test_loss: 1.3618, test_f1: 0.5849
 epoch: 39, train_loss: 0.5660, test_loss: 1.1943, test_f1: 0.6305
 epoch: 40, train_loss: 0.5650, test_loss: 1.2535, test_f1: 0.5944
 epoch: 41, train_loss: 0.5308, test_loss: 1.3254, test_f1: 0.6026
 epoch: 42, train_loss: 0.5328, test_loss: 1.5625, test_f1: 0.5392
 epoch: 43, train_loss: 0.5196, test_loss: 1.3307, test_f1: 0.6056
 epoch: 44, train_loss: 0.5038, test_loss: 1.3663, test_f1: 0.5765
 epoch: 45, train_loss: 0.5156, test_loss: 1.3721, test_f1: 0.5826
 epoch: 46, train_loss: 0.5538, test_loss: 1.4031, test_f1: 0.5875
 epoch: 47, train_loss: 0.4967, test_loss: 1.2271, test_f1: 0.6109
 epoch: 48, train_loss: 0.4966, test_loss: 1.3246, test_f1: 0.6044
 epoch: 49, train_loss: 0.5283, test_loss: 1.4103, test_f1: 0.6153
 epoch: 50, train_loss: 0.4893, test_loss: 1.3203, test_f1: 0.6538
 epoch: 51, train_loss: 0.4524, test_loss: 1.2184, test_f1: 0.6523
 epoch: 52, train_loss: 0.4377, test_loss: 1.2964, test_f1: 0.6340
 epoch: 53, train_loss: 0.4411, test_loss: 1.3943, test_f1: 0.6116
 epoch: 54, train_loss: 0.4067, test_loss: 1.4416, test_f1: 0.6229
 epoch: 55, train_loss: 0.4161, test_loss: 1.4567, test_f1: 0.6115
 epoch: 56, train_loss: 0.4280, test_loss: 1.3831, test_f1: 0.6180
 epoch: 57, train_loss: 0.3852, test_loss: 1.4803, test_f1: 0.6061
 epoch: 58, train_loss: 0.4014, test_loss: 1.4660, test_f1: 0.6106
 epoch: 59, train_loss: 0.3775, test_loss: 1.5004, test_f1: 0.6285
 epoch: 60, train_loss: 0.3861, test_loss: 1.4680, test_f1: 0.6327
 epoch: 61, train_loss: 0.3954, test_loss: 1.6933, test_f1: 0.6070
 epoch: 62, train_loss: 0.3800, test_loss: 1.5604, test_f1: 0.6350
 epoch: 63, train_loss: 0.3756, test_loss: 1.5032, test_f1: 0.6290
 epoch: 64, train_loss: 0.3667, test_loss: 1.5043, test_f1: 0.6312
 epoch: 65, train_loss: 0.3498, test_loss: 1.5790, test_f1: 0.6362
 epoch: 66, train_loss: 0.3520, test_loss: 1.5605, test_f1: 0.6321
 epoch: 67, train_loss: 0.3605, test_loss: 1.5685, test_f1: 0.6372
 epoch: 68, train_loss: 0.3521, test_loss: 1.6036, test_f1: 0.6186
 epoch: 69, train_loss: 0.3645, test_loss: 1.7187, test_f1: 0.6151
 epoch: 70, train_loss: 0.3599, test_loss: 1.8055, test_f1: 0.6320
 epoch: 71, train_loss: 0.3427, test_loss: 1.6429, test_f1: 0.6253
 epoch: 72, train_loss: 0.3426, test_loss: 1.6339, test_f1: 0.6302
 epoch: 73, train_loss: 0.3440, test_loss: 1.6435, test_f1: 0.6368
 epoch: 74, train_loss: 0.3488, test_loss: 1.6892, test_f1: 0.6024
 epoch: 75, train_loss: 0.3412, test_loss: 1.6937, test_f1: 0.6442
 epoch: 76, train_loss: 0.3363, test_loss: 1.7105, test_f1: 0.6255
 epoch: 77, train_loss: 0.3321, test_loss: 1.7125, test_f1: 0.6255
 epoch: 78, train_loss: 0.3377, test_loss: 1.7085, test_f1: 0.5982
 epoch: 79, train_loss: 0.3241, test_loss: 1.8305, test_f1: 0.6204
 epoch: 80, train_loss: 0.3229, test_loss: 1.7542, test_f1: 0.6350
 epoch: 81, train_loss: 0.3052, test_loss: 1.7303, test_f1: 0.6389
 epoch: 82, train_loss: 0.3256, test_loss: 1.7525, test_f1: 0.6134
 epoch: 83, train_loss: 0.3217, test_loss: 1.7309, test_f1: 0.6300
 epoch: 84, train_loss: 0.3203, test_loss: 1.8274, test_f1: 0.6454
 epoch: 85, train_loss: 0.3257, test_loss: 1.9388, test_f1: 0.6244
 epoch: 86, train_loss: 0.3459, test_loss: 1.8460, test_f1: 0.6146
 epoch: 87, train_loss: 0.3108, test_loss: 1.7428, test_f1: 0.6185
 epoch: 88, train_loss: 0.3142, test_loss: 1.6731, test_f1: 0.6328
 epoch: 89, train_loss: 0.2890, test_loss: 1.7727, test_f1: 0.6138
 epoch: 90, train_loss: 0.2899, test_loss: 1.8044, test_f1: 0.6144
 epoch: 91, train_loss: 0.2758, test_loss: 1.8030, test_f1: 0.6251
 epoch: 92, train_loss: 0.2706, test_loss: 1.8707, test_f1: 0.6236
 epoch: 93, train_loss: 0.2714, test_loss: 1.8805, test_f1: 0.6423
 epoch: 94, train_loss: 0.2664, test_loss: 1.8141, test_f1: 0.6260
 epoch: 95, train_loss: 0.2693, test_loss: 1.8730, test_f1: 0.6311
 epoch: 96, train_loss: 0.2780, test_loss: 2.0759, test_f1: 0.6231
 epoch: 97, train_loss: 0.3228, test_loss: 2.0157, test_f1: 0.6123
 epoch: 98, train_loss: 0.3067, test_loss: 1.9541, test_f1: 0.6204
 epoch: 99, train_loss: 0.2844, test_loss: 1.9455, test_f1: 0.6278
##################ITERATION #3 ****************************************
 epoch: 0, train_loss: 1.2243, test_loss: 1.3047, test_f1: 0.1365
 epoch: 1, train_loss: 1.0504, test_loss: 1.3003, test_f1: 0.1365
 epoch: 2, train_loss: 1.0121, test_loss: 1.2266, test_f1: 0.1843
 epoch: 3, train_loss: 0.9847, test_loss: 1.1683, test_f1: 0.4127
 epoch: 4, train_loss: 0.9239, test_loss: 1.1462, test_f1: 0.3755
 epoch: 5, train_loss: 0.9085, test_loss: 1.1216, test_f1: 0.4038
 epoch: 6, train_loss: 0.8961, test_loss: 1.0913, test_f1: 0.4696
 epoch: 7, train_loss: 0.8744, test_loss: 1.0768, test_f1: 0.5144
 epoch: 8, train_loss: 0.8723, test_loss: 1.0531, test_f1: 0.4811
 epoch: 9, train_loss: 0.8512, test_loss: 1.0455, test_f1: 0.5348
 epoch: 10, train_loss: 0.8188, test_loss: 1.0540, test_f1: 0.5562
 epoch: 11, train_loss: 0.8085, test_loss: 1.0824, test_f1: 0.5649
 epoch: 12, train_loss: 0.7908, test_loss: 1.0383, test_f1: 0.5762
 epoch: 13, train_loss: 0.7998, test_loss: 1.0435, test_f1: 0.5551
 epoch: 14, train_loss: 0.7754, test_loss: 1.0654, test_f1: 0.5655
 epoch: 15, train_loss: 0.7683, test_loss: 1.0019, test_f1: 0.5967
 epoch: 16, train_loss: 0.7522, test_loss: 1.0530, test_f1: 0.5592
 epoch: 17, train_loss: 0.7288, test_loss: 1.1451, test_f1: 0.5425
 epoch: 18, train_loss: 0.7279, test_loss: 1.0697, test_f1: 0.5259
 epoch: 19, train_loss: 0.7299, test_loss: 1.0710, test_f1: 0.5885
 epoch: 20, train_loss: 0.7149, test_loss: 1.0305, test_f1: 0.6092
 epoch: 21, train_loss: 0.6978, test_loss: 1.0429, test_f1: 0.6288
 epoch: 22, train_loss: 0.6697, test_loss: 1.0753, test_f1: 0.6042
 epoch: 23, train_loss: 0.6670, test_loss: 1.1089, test_f1: 0.5973
 epoch: 24, train_loss: 0.6631, test_loss: 1.0855, test_f1: 0.5935
 epoch: 25, train_loss: 0.6366, test_loss: 1.0264, test_f1: 0.6376
 epoch: 26, train_loss: 0.6497, test_loss: 1.2151, test_f1: 0.5489
 epoch: 27, train_loss: 0.6471, test_loss: 1.1002, test_f1: 0.6103
 epoch: 28, train_loss: 0.6150, test_loss: 1.1354, test_f1: 0.6221
 epoch: 29, train_loss: 0.6157, test_loss: 1.1954, test_f1: 0.5632
 epoch: 30, train_loss: 0.6209, test_loss: 1.3189, test_f1: 0.5746
 epoch: 31, train_loss: 0.6071, test_loss: 1.2937, test_f1: 0.5895
 epoch: 32, train_loss: 0.6087, test_loss: 1.1279, test_f1: 0.5882
 epoch: 33, train_loss: 0.5928, test_loss: 1.2312, test_f1: 0.5680
 epoch: 34, train_loss: 0.5754, test_loss: 1.1407, test_f1: 0.5959
 epoch: 35, train_loss: 0.5691, test_loss: 1.1138, test_f1: 0.5670
 epoch: 36, train_loss: 0.5612, test_loss: 1.2611, test_f1: 0.5511
 epoch: 37, train_loss: 0.5283, test_loss: 1.3161, test_f1: 0.5477
 epoch: 38, train_loss: 0.5262, test_loss: 1.1995, test_f1: 0.6019
 epoch: 39, train_loss: 0.5338, test_loss: 1.3493, test_f1: 0.5464
 epoch: 40, train_loss: 0.5481, test_loss: 1.1739, test_f1: 0.5997
 epoch: 41, train_loss: 0.5144, test_loss: 1.2264, test_f1: 0.6117
 epoch: 42, train_loss: 0.5078, test_loss: 1.3634, test_f1: 0.5705
 epoch: 43, train_loss: 0.5278, test_loss: 1.3156, test_f1: 0.5556
 epoch: 44, train_loss: 0.5415, test_loss: 1.1718, test_f1: 0.6209
 epoch: 45, train_loss: 0.5131, test_loss: 1.4018, test_f1: 0.5997
 epoch: 46, train_loss: 0.5101, test_loss: 1.3467, test_f1: 0.5754
 epoch: 47, train_loss: 0.5054, test_loss: 1.3415, test_f1: 0.5781
 epoch: 48, train_loss: 0.5127, test_loss: 1.4111, test_f1: 0.5744
 epoch: 49, train_loss: 0.4704, test_loss: 1.6473, test_f1: 0.5858
 epoch: 50, train_loss: 0.4574, test_loss: 1.4767, test_f1: 0.6019
 epoch: 51, train_loss: 0.4340, test_loss: 1.4865, test_f1: 0.5946
 epoch: 52, train_loss: 0.4281, test_loss: 1.4086, test_f1: 0.5795
 epoch: 53, train_loss: 0.4095, test_loss: 1.3591, test_f1: 0.5821
 epoch: 54, train_loss: 0.4002, test_loss: 1.3630, test_f1: 0.6128
 epoch: 55, train_loss: 0.3989, test_loss: 1.3579, test_f1: 0.6049
 epoch: 56, train_loss: 0.4055, test_loss: 1.4687, test_f1: 0.5981
 epoch: 57, train_loss: 0.3994, test_loss: 1.3971, test_f1: 0.6190
 epoch: 58, train_loss: 0.3837, test_loss: 1.5662, test_f1: 0.6081
 epoch: 59, train_loss: 0.3980, test_loss: 1.5805, test_f1: 0.6055
 epoch: 60, train_loss: 0.3892, test_loss: 1.3746, test_f1: 0.5973
 epoch: 61, train_loss: 0.3817, test_loss: 1.4592, test_f1: 0.6046
 epoch: 62, train_loss: 0.3984, test_loss: 1.5573, test_f1: 0.5735
 epoch: 63, train_loss: 0.3804, test_loss: 1.6149, test_f1: 0.5766
 epoch: 64, train_loss: 0.3784, test_loss: 1.5078, test_f1: 0.6124
 epoch: 65, train_loss: 0.3694, test_loss: 1.5901, test_f1: 0.5916
 epoch: 66, train_loss: 0.3668, test_loss: 1.7055, test_f1: 0.5907
 epoch: 67, train_loss: 0.3493, test_loss: 1.7187, test_f1: 0.6119
 epoch: 68, train_loss: 0.3341, test_loss: 1.7423, test_f1: 0.5851
 epoch: 69, train_loss: 0.3317, test_loss: 1.6742, test_f1: 0.6140
 epoch: 70, train_loss: 0.3339, test_loss: 1.6986, test_f1: 0.5798
 epoch: 71, train_loss: 0.3291, test_loss: 1.6914, test_f1: 0.5944
 epoch: 72, train_loss: 0.3451, test_loss: 1.6909, test_f1: 0.6115
 epoch: 73, train_loss: 0.3356, test_loss: 1.6591, test_f1: 0.6153
 epoch: 74, train_loss: 0.3418, test_loss: 1.7956, test_f1: 0.6017
 epoch: 75, train_loss: 0.3275, test_loss: 1.7922, test_f1: 0.6011
 epoch: 76, train_loss: 0.3146, test_loss: 1.8548, test_f1: 0.6231
 epoch: 77, train_loss: 0.3105, test_loss: 1.8658, test_f1: 0.6030
 epoch: 78, train_loss: 0.2984, test_loss: 1.7751, test_f1: 0.5992
 epoch: 79, train_loss: 0.2897, test_loss: 1.8387, test_f1: 0.6022
 epoch: 80, train_loss: 0.3375, test_loss: 1.9114, test_f1: 0.6123
 epoch: 81, train_loss: 0.3123, test_loss: 1.9263, test_f1: 0.6069
 epoch: 82, train_loss: 0.3083, test_loss: 1.8980, test_f1: 0.6051
 epoch: 83, train_loss: 0.3136, test_loss: 1.9494, test_f1: 0.6276
 epoch: 84, train_loss: 0.3066, test_loss: 1.9900, test_f1: 0.5815
 epoch: 85, train_loss: 0.3010, test_loss: 1.9698, test_f1: 0.5940
 epoch: 86, train_loss: 0.3307, test_loss: 2.2072, test_f1: 0.5860
 epoch: 87, train_loss: 0.3169, test_loss: 1.9885, test_f1: 0.5833
 epoch: 88, train_loss: 0.2986, test_loss: 1.9911, test_f1: 0.6210
 epoch: 89, train_loss: 0.2891, test_loss: 2.0313, test_f1: 0.5880
 epoch: 90, train_loss: 0.3446, test_loss: 2.1350, test_f1: 0.6005
 epoch: 91, train_loss: 0.3412, test_loss: 1.9610, test_f1: 0.6228
 epoch: 92, train_loss: 0.2976, test_loss: 1.9450, test_f1: 0.6214
 epoch: 93, train_loss: 0.2808, test_loss: 2.0572, test_f1: 0.5906
 epoch: 94, train_loss: 0.3073, test_loss: 1.9933, test_f1: 0.6157
 epoch: 95, train_loss: 0.3184, test_loss: 1.8632, test_f1: 0.5902
 epoch: 96, train_loss: 0.3063, test_loss: 1.9962, test_f1: 0.5870
 epoch: 97, train_loss: 0.3804, test_loss: 1.8199, test_f1: 0.5930
 epoch: 98, train_loss: 0.3573, test_loss: 1.7222, test_f1: 0.6227
 epoch: 99, train_loss: 0.3243, test_loss: 1.7838, test_f1: 0.6199
##################ITERATION #4 ****************************************
 epoch: 0, train_loss: 1.2722, test_loss: 1.3082, test_f1: 0.1365
 epoch: 1, train_loss: 1.0916, test_loss: 1.2902, test_f1: 0.1365
 epoch: 2, train_loss: 1.0340, test_loss: 1.2388, test_f1: 0.2180
 epoch: 3, train_loss: 0.9699, test_loss: 1.1934, test_f1: 0.3706
 epoch: 4, train_loss: 0.9542, test_loss: 1.1346, test_f1: 0.4540
 epoch: 5, train_loss: 0.9236, test_loss: 1.1081, test_f1: 0.4536
 epoch: 6, train_loss: 0.8979, test_loss: 1.0717, test_f1: 0.4890
 epoch: 7, train_loss: 0.8677, test_loss: 1.0552, test_f1: 0.4867
 epoch: 8, train_loss: 0.8462, test_loss: 1.0633, test_f1: 0.5135
 epoch: 9, train_loss: 0.8495, test_loss: 1.0630, test_f1: 0.5626
 epoch: 10, train_loss: 0.8379, test_loss: 1.1145, test_f1: 0.5624
 epoch: 11, train_loss: 0.8269, test_loss: 1.1138, test_f1: 0.5591
 epoch: 12, train_loss: 0.8077, test_loss: 1.0405, test_f1: 0.5854
 epoch: 13, train_loss: 0.7990, test_loss: 1.0120, test_f1: 0.5892
 epoch: 14, train_loss: 0.7839, test_loss: 1.0311, test_f1: 0.5620
 epoch: 15, train_loss: 0.7659, test_loss: 1.0326, test_f1: 0.6256
 epoch: 16, train_loss: 0.7630, test_loss: 1.0198, test_f1: 0.6553
 epoch: 17, train_loss: 0.7665, test_loss: 1.0647, test_f1: 0.5719
 epoch: 18, train_loss: 0.7518, test_loss: 1.0094, test_f1: 0.6258
 epoch: 19, train_loss: 0.7235, test_loss: 0.9765, test_f1: 0.6247
 epoch: 20, train_loss: 0.7008, test_loss: 0.9952, test_f1: 0.6332
 epoch: 21, train_loss: 0.6900, test_loss: 0.9931, test_f1: 0.6243
 epoch: 22, train_loss: 0.6948, test_loss: 1.0236, test_f1: 0.6205
 epoch: 23, train_loss: 0.6655, test_loss: 1.1013, test_f1: 0.5863
 epoch: 24, train_loss: 0.6618, test_loss: 0.9912, test_f1: 0.6200
 epoch: 25, train_loss: 0.6753, test_loss: 1.0281, test_f1: 0.6114
 epoch: 26, train_loss: 0.6622, test_loss: 1.1074, test_f1: 0.5952
 epoch: 27, train_loss: 0.6409, test_loss: 1.1000, test_f1: 0.6058
 epoch: 28, train_loss: 0.6156, test_loss: 1.0552, test_f1: 0.6296
 epoch: 29, train_loss: 0.6290, test_loss: 1.0684, test_f1: 0.6006
 epoch: 30, train_loss: 0.6408, test_loss: 1.0870, test_f1: 0.5985
 epoch: 31, train_loss: 0.6175, test_loss: 1.1070, test_f1: 0.5991
 epoch: 32, train_loss: 0.6073, test_loss: 1.0881, test_f1: 0.6137
 epoch: 33, train_loss: 0.6174, test_loss: 1.2115, test_f1: 0.5943
 epoch: 34, train_loss: 0.6308, test_loss: 1.1002, test_f1: 0.6412
 epoch: 35, train_loss: 0.6053, test_loss: 1.1448, test_f1: 0.5912
 epoch: 36, train_loss: 0.5967, test_loss: 1.1953, test_f1: 0.6191
 epoch: 37, train_loss: 0.6095, test_loss: 1.1887, test_f1: 0.6067
 epoch: 38, train_loss: 0.6100, test_loss: 1.2182, test_f1: 0.5853
 epoch: 39, train_loss: 0.5873, test_loss: 1.1684, test_f1: 0.6416
 epoch: 40, train_loss: 0.5837, test_loss: 1.1541, test_f1: 0.6232
 epoch: 41, train_loss: 0.6147, test_loss: 1.2632, test_f1: 0.6307
 epoch: 42, train_loss: 0.5917, test_loss: 1.1700, test_f1: 0.5884
 epoch: 43, train_loss: 0.5557, test_loss: 1.2572, test_f1: 0.6011
 epoch: 44, train_loss: 0.5604, test_loss: 1.3661, test_f1: 0.5896
 epoch: 45, train_loss: 0.5623, test_loss: 1.4263, test_f1: 0.6018
 epoch: 46, train_loss: 0.5166, test_loss: 1.5307, test_f1: 0.6120
 epoch: 47, train_loss: 0.4994, test_loss: 1.4242, test_f1: 0.6213
 epoch: 48, train_loss: 0.5016, test_loss: 1.3363, test_f1: 0.6001
 epoch: 49, train_loss: 0.4782, test_loss: 1.3087, test_f1: 0.6364
 epoch: 50, train_loss: 0.5060, test_loss: 1.2981, test_f1: 0.6039
 epoch: 51, train_loss: 0.5073, test_loss: 1.2862, test_f1: 0.5920
 epoch: 52, train_loss: 0.4661, test_loss: 1.2822, test_f1: 0.6162
 epoch: 53, train_loss: 0.4743, test_loss: 1.2856, test_f1: 0.5767
 epoch: 54, train_loss: 0.4655, test_loss: 1.2115, test_f1: 0.5976
 epoch: 55, train_loss: 0.4659, test_loss: 1.2705, test_f1: 0.6652
 epoch: 56, train_loss: 0.4484, test_loss: 1.1839, test_f1: 0.6541
 epoch: 57, train_loss: 0.4527, test_loss: 1.1870, test_f1: 0.6547
 epoch: 58, train_loss: 0.4316, test_loss: 1.2554, test_f1: 0.6068
 epoch: 59, train_loss: 0.4293, test_loss: 1.2770, test_f1: 0.6339
 epoch: 60, train_loss: 0.4140, test_loss: 1.2984, test_f1: 0.6311
 epoch: 61, train_loss: 0.4198, test_loss: 1.3291, test_f1: 0.6459
 epoch: 62, train_loss: 0.4118, test_loss: 1.4068, test_f1: 0.6404
 epoch: 63, train_loss: 0.4040, test_loss: 1.4662, test_f1: 0.6271
 epoch: 64, train_loss: 0.4136, test_loss: 1.5003, test_f1: 0.6480
 epoch: 65, train_loss: 0.4294, test_loss: 1.5069, test_f1: 0.6533
 epoch: 66, train_loss: 0.4029, test_loss: 1.4654, test_f1: 0.6314
 epoch: 67, train_loss: 0.4035, test_loss: 1.4196, test_f1: 0.6602
 epoch: 68, train_loss: 0.3748, test_loss: 1.4213, test_f1: 0.6599
 epoch: 69, train_loss: 0.3964, test_loss: 1.4466, test_f1: 0.6547
 epoch: 70, train_loss: 0.3961, test_loss: 1.5403, test_f1: 0.6417
 epoch: 71, train_loss: 0.4058, test_loss: 1.4671, test_f1: 0.6105
 epoch: 72, train_loss: 0.4013, test_loss: 1.4558, test_f1: 0.6338
 epoch: 73, train_loss: 0.3758, test_loss: 1.5077, test_f1: 0.6013
 epoch: 74, train_loss: 0.3853, test_loss: 1.4932, test_f1: 0.5973
 epoch: 75, train_loss: 0.3536, test_loss: 1.4686, test_f1: 0.6217
 epoch: 76, train_loss: 0.3619, test_loss: 1.4941, test_f1: 0.6124
 epoch: 77, train_loss: 0.3578, test_loss: 1.4818, test_f1: 0.6401
 epoch: 78, train_loss: 0.3568, test_loss: 1.4869, test_f1: 0.6184
 epoch: 79, train_loss: 0.3535, test_loss: 1.6872, test_f1: 0.6107
 epoch: 80, train_loss: 0.3547, test_loss: 1.5373, test_f1: 0.6281
 epoch: 81, train_loss: 0.3408, test_loss: 1.5106, test_f1: 0.6350
 epoch: 82, train_loss: 0.3466, test_loss: 1.6661, test_f1: 0.6366
 epoch: 83, train_loss: 0.3458, test_loss: 1.6102, test_f1: 0.5976
 epoch: 84, train_loss: 0.3515, test_loss: 1.5684, test_f1: 0.6341
 epoch: 85, train_loss: 0.3382, test_loss: 1.7103, test_f1: 0.6421
 epoch: 86, train_loss: 0.3232, test_loss: 1.6107, test_f1: 0.6203
 epoch: 87, train_loss: 0.3298, test_loss: 1.6533, test_f1: 0.5989
 epoch: 88, train_loss: 0.3480, test_loss: 1.7263, test_f1: 0.6325
 epoch: 89, train_loss: 0.4194, test_loss: 1.6353, test_f1: 0.6355
 epoch: 90, train_loss: 0.3613, test_loss: 1.6593, test_f1: 0.5978
 epoch: 91, train_loss: 0.3654, test_loss: 2.0493, test_f1: 0.6181
 epoch: 92, train_loss: 0.3211, test_loss: 1.5733, test_f1: 0.6469
 epoch: 93, train_loss: 0.3036, test_loss: 1.6097, test_f1: 0.6393
 epoch: 94, train_loss: 0.3158, test_loss: 1.6963, test_f1: 0.6280
 epoch: 95, train_loss: 0.3288, test_loss: 1.6333, test_f1: 0.6172
 epoch: 96, train_loss: 0.3224, test_loss: 1.7892, test_f1: 0.6175
 epoch: 97, train_loss: 0.3222, test_loss: 1.7934, test_f1: 0.6176
 epoch: 98, train_loss: 0.3171, test_loss: 1.8130, test_f1: 0.6055
 epoch: 99, train_loss: 0.3099, test_loss: 1.8591, test_f1: 0.6242
##################ITERATION #5 ****************************************
 epoch: 0, train_loss: 1.2984, test_loss: 1.3224, test_f1: 0.1365
 epoch: 1, train_loss: 1.0735, test_loss: 1.3024, test_f1: 0.1621
 epoch: 2, train_loss: 1.0350, test_loss: 1.2557, test_f1: 0.2038
 epoch: 3, train_loss: 0.9829, test_loss: 1.1643, test_f1: 0.4515
 epoch: 4, train_loss: 0.9452, test_loss: 1.1142, test_f1: 0.4453
 epoch: 5, train_loss: 0.9321, test_loss: 1.0970, test_f1: 0.4492
 epoch: 6, train_loss: 0.9140, test_loss: 1.0481, test_f1: 0.5149
 epoch: 7, train_loss: 0.8840, test_loss: 1.0231, test_f1: 0.5536
 epoch: 8, train_loss: 0.8479, test_loss: 1.0449, test_f1: 0.5499
 epoch: 9, train_loss: 0.8408, test_loss: 1.0409, test_f1: 0.5732
 epoch: 10, train_loss: 0.8360, test_loss: 1.0543, test_f1: 0.5042
 epoch: 11, train_loss: 0.8168, test_loss: 1.0385, test_f1: 0.5875
 epoch: 12, train_loss: 0.7982, test_loss: 1.0784, test_f1: 0.6080
 epoch: 13, train_loss: 0.7778, test_loss: 1.0965, test_f1: 0.5879
 epoch: 14, train_loss: 0.7843, test_loss: 1.0951, test_f1: 0.5210
 epoch: 15, train_loss: 0.7693, test_loss: 1.1819, test_f1: 0.4932
 epoch: 16, train_loss: 0.7452, test_loss: 1.1368, test_f1: 0.5893
 epoch: 17, train_loss: 0.7424, test_loss: 1.1066, test_f1: 0.6037
 epoch: 18, train_loss: 0.7188, test_loss: 1.0759, test_f1: 0.5635
 epoch: 19, train_loss: 0.7277, test_loss: 1.1285, test_f1: 0.5606
 epoch: 20, train_loss: 0.7447, test_loss: 1.1411, test_f1: 0.6226
 epoch: 21, train_loss: 0.7376, test_loss: 1.1180, test_f1: 0.5918
 epoch: 22, train_loss: 0.6934, test_loss: 1.1903, test_f1: 0.4583
 epoch: 23, train_loss: 0.6960, test_loss: 1.1081, test_f1: 0.5683
 epoch: 24, train_loss: 0.6856, test_loss: 1.1248, test_f1: 0.5901
 epoch: 25, train_loss: 0.6809, test_loss: 1.2156, test_f1: 0.5237
 epoch: 26, train_loss: 0.6450, test_loss: 1.2269, test_f1: 0.5400
 epoch: 27, train_loss: 0.6604, test_loss: 1.1748, test_f1: 0.5832
 epoch: 28, train_loss: 0.6595, test_loss: 1.2568, test_f1: 0.5545
 epoch: 29, train_loss: 0.6363, test_loss: 1.1237, test_f1: 0.6210
 epoch: 30, train_loss: 0.6283, test_loss: 1.2009, test_f1: 0.5849
 epoch: 31, train_loss: 0.6328, test_loss: 1.1680, test_f1: 0.6770
 epoch: 32, train_loss: 0.6408, test_loss: 1.2551, test_f1: 0.6045
 epoch: 33, train_loss: 0.5959, test_loss: 1.2652, test_f1: 0.5960
 epoch: 34, train_loss: 0.5910, test_loss: 1.1954, test_f1: 0.6513
 epoch: 35, train_loss: 0.5757, test_loss: 1.1577, test_f1: 0.6318
 epoch: 36, train_loss: 0.5896, test_loss: 1.2062, test_f1: 0.6526
 epoch: 37, train_loss: 0.5888, test_loss: 1.2477, test_f1: 0.6146
 epoch: 38, train_loss: 0.5768, test_loss: 1.1951, test_f1: 0.6236
 epoch: 39, train_loss: 0.5651, test_loss: 1.2315, test_f1: 0.6267
 epoch: 40, train_loss: 0.5656, test_loss: 1.4192, test_f1: 0.5372
 epoch: 41, train_loss: 0.5512, test_loss: 1.3654, test_f1: 0.5841
 epoch: 42, train_loss: 0.5700, test_loss: 1.2192, test_f1: 0.6476
 epoch: 43, train_loss: 0.5567, test_loss: 1.3097, test_f1: 0.5727
 epoch: 44, train_loss: 0.5461, test_loss: 1.3299, test_f1: 0.6216
 epoch: 45, train_loss: 0.5349, test_loss: 1.2607, test_f1: 0.6056
 epoch: 46, train_loss: 0.5118, test_loss: 1.3592, test_f1: 0.5727
 epoch: 47, train_loss: 0.5224, test_loss: 1.2018, test_f1: 0.6476
 epoch: 48, train_loss: 0.5137, test_loss: 1.4768, test_f1: 0.5499
 epoch: 49, train_loss: 0.4876, test_loss: 1.2774, test_f1: 0.6424
 epoch: 50, train_loss: 0.5031, test_loss: 1.3324, test_f1: 0.6063
 epoch: 51, train_loss: 0.4993, test_loss: 1.3673, test_f1: 0.5938
 epoch: 52, train_loss: 0.4649, test_loss: 1.4211, test_f1: 0.6071
 epoch: 53, train_loss: 0.4722, test_loss: 1.4422, test_f1: 0.6080
 epoch: 54, train_loss: 0.4511, test_loss: 1.4253, test_f1: 0.6064
 epoch: 55, train_loss: 0.4379, test_loss: 1.3620, test_f1: 0.6061
 epoch: 56, train_loss: 0.4567, test_loss: 1.3697, test_f1: 0.6151
 epoch: 57, train_loss: 0.4396, test_loss: 1.3558, test_f1: 0.6399
 epoch: 58, train_loss: 0.4533, test_loss: 1.4770, test_f1: 0.5970
 epoch: 59, train_loss: 0.4272, test_loss: 1.4542, test_f1: 0.6012
 epoch: 60, train_loss: 0.4242, test_loss: 1.4872, test_f1: 0.6191
 epoch: 61, train_loss: 0.4191, test_loss: 1.5373, test_f1: 0.6142
 epoch: 62, train_loss: 0.4144, test_loss: 1.4817, test_f1: 0.6417
 epoch: 63, train_loss: 0.4092, test_loss: 1.4823, test_f1: 0.6159
 epoch: 64, train_loss: 0.3969, test_loss: 1.5384, test_f1: 0.6181
 epoch: 65, train_loss: 0.4057, test_loss: 1.4127, test_f1: 0.6172
 epoch: 66, train_loss: 0.3972, test_loss: 1.4857, test_f1: 0.6018
 epoch: 67, train_loss: 0.3773, test_loss: 1.4681, test_f1: 0.6059
 epoch: 68, train_loss: 0.3900, test_loss: 1.4679, test_f1: 0.6486
 epoch: 69, train_loss: 0.3982, test_loss: 1.5368, test_f1: 0.6009
 epoch: 70, train_loss: 0.3724, test_loss: 1.5427, test_f1: 0.5908
 epoch: 71, train_loss: 0.3667, test_loss: 1.6367, test_f1: 0.5890
 epoch: 72, train_loss: 0.3867, test_loss: 1.6512, test_f1: 0.6421
 epoch: 73, train_loss: 0.4072, test_loss: 1.7368, test_f1: 0.6176
 epoch: 74, train_loss: 0.3901, test_loss: 1.6414, test_f1: 0.6113
 epoch: 75, train_loss: 0.4103, test_loss: 1.6537, test_f1: 0.6342
 epoch: 76, train_loss: 0.3712, test_loss: 1.7005, test_f1: 0.5842
 epoch: 77, train_loss: 0.3768, test_loss: 1.6253, test_f1: 0.5833
 epoch: 78, train_loss: 0.3916, test_loss: 1.5035, test_f1: 0.6261
 epoch: 79, train_loss: 0.3736, test_loss: 1.5112, test_f1: 0.6558
 epoch: 80, train_loss: 0.3234, test_loss: 1.6587, test_f1: 0.6210
 epoch: 81, train_loss: 0.3468, test_loss: 1.7304, test_f1: 0.6197
 epoch: 82, train_loss: 0.3268, test_loss: 1.7200, test_f1: 0.6259
 epoch: 83, train_loss: 0.3385, test_loss: 1.6968, test_f1: 0.6341
 epoch: 84, train_loss: 0.3401, test_loss: 1.7983, test_f1: 0.6187
 epoch: 85, train_loss: 0.3362, test_loss: 1.6746, test_f1: 0.6136
 epoch: 86, train_loss: 0.3458, test_loss: 1.7235, test_f1: 0.5917
 epoch: 87, train_loss: 0.3430, test_loss: 1.7173, test_f1: 0.5905
 epoch: 88, train_loss: 0.3343, test_loss: 1.6840, test_f1: 0.6197
 epoch: 89, train_loss: 0.3118, test_loss: 1.8239, test_f1: 0.6234
 epoch: 90, train_loss: 0.2929, test_loss: 1.7738, test_f1: 0.6098
 epoch: 91, train_loss: 0.2998, test_loss: 1.8127, test_f1: 0.6075
 epoch: 92, train_loss: 0.2923, test_loss: 1.8079, test_f1: 0.6171
 epoch: 93, train_loss: 0.2957, test_loss: 1.8297, test_f1: 0.6144
 epoch: 94, train_loss: 0.3121, test_loss: 1.8513, test_f1: 0.5915
 epoch: 95, train_loss: 0.2959, test_loss: 1.9524, test_f1: 0.6018
 epoch: 96, train_loss: 0.2740, test_loss: 1.9584, test_f1: 0.5906
 epoch: 97, train_loss: 0.2804, test_loss: 1.8495, test_f1: 0.6150
 epoch: 98, train_loss: 0.2817, test_loss: 1.9520, test_f1: 0.5919
 epoch: 99, train_loss: 0.2832, test_loss: 1.9596, test_f1: 0.6217
##################ITERATION #6 ****************************************
 epoch: 0, train_loss: 1.3952, test_loss: 1.3494, test_f1: 0.1365
 epoch: 1, train_loss: 1.0750, test_loss: 1.2974, test_f1: 0.2785
 epoch: 2, train_loss: 1.0093, test_loss: 1.2384, test_f1: 0.3130
 epoch: 3, train_loss: 0.9680, test_loss: 1.1835, test_f1: 0.4283
 epoch: 4, train_loss: 0.9446, test_loss: 1.1374, test_f1: 0.3986
 epoch: 5, train_loss: 0.9213, test_loss: 1.1252, test_f1: 0.4549
 epoch: 6, train_loss: 0.9040, test_loss: 1.1288, test_f1: 0.4374
 epoch: 7, train_loss: 0.8835, test_loss: 1.1182, test_f1: 0.5072
 epoch: 8, train_loss: 0.8858, test_loss: 1.1526, test_f1: 0.5012
 epoch: 9, train_loss: 0.8621, test_loss: 1.0752, test_f1: 0.5594
 epoch: 10, train_loss: 0.8388, test_loss: 1.0436, test_f1: 0.5597
 epoch: 11, train_loss: 0.8334, test_loss: 1.0468, test_f1: 0.5858
 epoch: 12, train_loss: 0.8071, test_loss: 1.0647, test_f1: 0.6043
 epoch: 13, train_loss: 0.8282, test_loss: 1.0499, test_f1: 0.6069
 epoch: 14, train_loss: 0.8075, test_loss: 1.0487, test_f1: 0.5999
 epoch: 15, train_loss: 0.7917, test_loss: 1.0571, test_f1: 0.5968
 epoch: 16, train_loss: 0.7828, test_loss: 1.0494, test_f1: 0.5839
 epoch: 17, train_loss: 0.7728, test_loss: 1.0123, test_f1: 0.5810
 epoch: 18, train_loss: 0.7658, test_loss: 1.0087, test_f1: 0.6292
 epoch: 19, train_loss: 0.7465, test_loss: 1.0472, test_f1: 0.6107
 epoch: 20, train_loss: 0.7365, test_loss: 1.1106, test_f1: 0.6272
 epoch: 21, train_loss: 0.7254, test_loss: 1.1377, test_f1: 0.5810
 epoch: 22, train_loss: 0.7078, test_loss: 1.1143, test_f1: 0.5938
 epoch: 23, train_loss: 0.7099, test_loss: 1.0922, test_f1: 0.6033
 epoch: 24, train_loss: 0.7022, test_loss: 1.0900, test_f1: 0.6304
 epoch: 25, train_loss: 0.6647, test_loss: 1.1688, test_f1: 0.6032
 epoch: 26, train_loss: 0.6883, test_loss: 1.1623, test_f1: 0.5672
 epoch: 27, train_loss: 0.6616, test_loss: 1.1590, test_f1: 0.6035
 epoch: 28, train_loss: 0.6494, test_loss: 1.1418, test_f1: 0.5949
 epoch: 29, train_loss: 0.6602, test_loss: 1.2427, test_f1: 0.5640
 epoch: 30, train_loss: 0.6441, test_loss: 1.2338, test_f1: 0.6097
 epoch: 31, train_loss: 0.6574, test_loss: 1.2645, test_f1: 0.5661
 epoch: 32, train_loss: 0.6340, test_loss: 1.2377, test_f1: 0.5621
 epoch: 33, train_loss: 0.6512, test_loss: 1.2375, test_f1: 0.5789
 epoch: 34, train_loss: 0.6778, test_loss: 1.2164, test_f1: 0.6119
 epoch: 35, train_loss: 0.6590, test_loss: 1.2544, test_f1: 0.6088
 epoch: 36, train_loss: 0.6389, test_loss: 1.3505, test_f1: 0.6278
 epoch: 37, train_loss: 0.6128, test_loss: 1.2274, test_f1: 0.5941
 epoch: 38, train_loss: 0.6099, test_loss: 1.4668, test_f1: 0.6032
 epoch: 39, train_loss: 0.6067, test_loss: 1.2734, test_f1: 0.5589
 epoch: 40, train_loss: 0.5810, test_loss: 1.2701, test_f1: 0.4869
 epoch: 41, train_loss: 0.5578, test_loss: 1.2366, test_f1: 0.6107
 epoch: 42, train_loss: 0.5519, test_loss: 1.3181, test_f1: 0.5857
 epoch: 43, train_loss: 0.5713, test_loss: 1.3636, test_f1: 0.5965
 epoch: 44, train_loss: 0.5385, test_loss: 1.2713, test_f1: 0.6174
 epoch: 45, train_loss: 0.5561, test_loss: 1.3635, test_f1: 0.5454
 epoch: 46, train_loss: 0.5190, test_loss: 1.3738, test_f1: 0.6152
 epoch: 47, train_loss: 0.5305, test_loss: 1.4418, test_f1: 0.5917
 epoch: 48, train_loss: 0.5065, test_loss: 1.3139, test_f1: 0.6377
 epoch: 49, train_loss: 0.5310, test_loss: 1.3520, test_f1: 0.5878
 epoch: 50, train_loss: 0.5218, test_loss: 1.4613, test_f1: 0.6058
 epoch: 51, train_loss: 0.4793, test_loss: 1.3474, test_f1: 0.6262
 epoch: 52, train_loss: 0.4977, test_loss: 1.4199, test_f1: 0.5863
 epoch: 53, train_loss: 0.4975, test_loss: 1.3590, test_f1: 0.6095
 epoch: 54, train_loss: 0.4845, test_loss: 1.2488, test_f1: 0.6357
 epoch: 55, train_loss: 0.4847, test_loss: 1.1804, test_f1: 0.6568
 epoch: 56, train_loss: 0.4653, test_loss: 1.3391, test_f1: 0.6616
 epoch: 57, train_loss: 0.4658, test_loss: 1.3004, test_f1: 0.6616
 epoch: 58, train_loss: 0.4463, test_loss: 1.2556, test_f1: 0.6263
 epoch: 59, train_loss: 0.4414, test_loss: 1.3699, test_f1: 0.6561
 epoch: 60, train_loss: 0.4310, test_loss: 1.2996, test_f1: 0.6394
 epoch: 61, train_loss: 0.4427, test_loss: 1.3355, test_f1: 0.6445
 epoch: 62, train_loss: 0.4289, test_loss: 1.3501, test_f1: 0.6282
 epoch: 63, train_loss: 0.4220, test_loss: 1.4021, test_f1: 0.6081
 epoch: 64, train_loss: 0.4261, test_loss: 1.5500, test_f1: 0.5984
 epoch: 65, train_loss: 0.4084, test_loss: 1.5045, test_f1: 0.6231
 epoch: 66, train_loss: 0.4164, test_loss: 1.5105, test_f1: 0.6133
 epoch: 67, train_loss: 0.3861, test_loss: 1.4341, test_f1: 0.6242
 epoch: 68, train_loss: 0.4081, test_loss: 1.4284, test_f1: 0.6343
 epoch: 69, train_loss: 0.4066, test_loss: 1.5384, test_f1: 0.6334
 epoch: 70, train_loss: 0.4017, test_loss: 1.5522, test_f1: 0.6449
 epoch: 71, train_loss: 0.4031, test_loss: 1.5189, test_f1: 0.6069
 epoch: 72, train_loss: 0.4303, test_loss: 1.8036, test_f1: 0.6276
 epoch: 73, train_loss: 0.4295, test_loss: 1.5829, test_f1: 0.6319
 epoch: 74, train_loss: 0.3912, test_loss: 1.5845, test_f1: 0.6283
 epoch: 75, train_loss: 0.3710, test_loss: 1.5829, test_f1: 0.6260
 epoch: 76, train_loss: 0.3706, test_loss: 1.5734, test_f1: 0.6396
 epoch: 77, train_loss: 0.3714, test_loss: 1.5066, test_f1: 0.6528
 epoch: 78, train_loss: 0.3731, test_loss: 1.6203, test_f1: 0.6314
 epoch: 79, train_loss: 0.3679, test_loss: 1.4710, test_f1: 0.6210
 epoch: 80, train_loss: 0.3554, test_loss: 1.4388, test_f1: 0.6353
 epoch: 81, train_loss: 0.3799, test_loss: 1.5964, test_f1: 0.5905
 epoch: 82, train_loss: 0.3870, test_loss: 1.9106, test_f1: 0.5912
 epoch: 83, train_loss: 0.3577, test_loss: 1.8161, test_f1: 0.6209
 epoch: 84, train_loss: 0.3562, test_loss: 1.9071, test_f1: 0.6264
 epoch: 85, train_loss: 0.3387, test_loss: 1.8077, test_f1: 0.6359
 epoch: 86, train_loss: 0.3614, test_loss: 1.6287, test_f1: 0.6341
 epoch: 87, train_loss: 0.3648, test_loss: 1.7777, test_f1: 0.6065
 epoch: 88, train_loss: 0.3528, test_loss: 1.8157, test_f1: 0.6591
 epoch: 89, train_loss: 0.3465, test_loss: 1.9411, test_f1: 0.6147
 epoch: 90, train_loss: 0.3606, test_loss: 1.9726, test_f1: 0.6564
 epoch: 91, train_loss: 0.3583, test_loss: 2.0138, test_f1: 0.5981
 epoch: 92, train_loss: 0.3505, test_loss: 1.9531, test_f1: 0.6376
 epoch: 93, train_loss: 0.3337, test_loss: 1.8099, test_f1: 0.6667
 epoch: 94, train_loss: 0.3274, test_loss: 1.8590, test_f1: 0.6418
 epoch: 95, train_loss: 0.3379, test_loss: 1.8492, test_f1: 0.6248
 epoch: 96, train_loss: 0.3367, test_loss: 1.7566, test_f1: 0.6304
 epoch: 97, train_loss: 0.3139, test_loss: 1.7642, test_f1: 0.6232
 epoch: 98, train_loss: 0.3035, test_loss: 1.7590, test_f1: 0.6195
 epoch: 99, train_loss: 0.3142, test_loss: 1.8049, test_f1: 0.6596
##################ITERATION #7 ****************************************
 epoch: 0, train_loss: 1.3057, test_loss: 1.4745, test_f1: 0.1365
 epoch: 1, train_loss: 1.1067, test_loss: 1.3506, test_f1: 0.1371
 epoch: 2, train_loss: 1.0545, test_loss: 1.3126, test_f1: 0.2044
 epoch: 3, train_loss: 1.0067, test_loss: 1.2709, test_f1: 0.2234
 epoch: 4, train_loss: 0.9651, test_loss: 1.2428, test_f1: 0.2920
 epoch: 5, train_loss: 0.9388, test_loss: 1.1858, test_f1: 0.3242
 epoch: 6, train_loss: 0.9109, test_loss: 1.0881, test_f1: 0.4077
 epoch: 7, train_loss: 0.9060, test_loss: 1.0291, test_f1: 0.4908
 epoch: 8, train_loss: 0.8824, test_loss: 1.0079, test_f1: 0.5642
 epoch: 9, train_loss: 0.8468, test_loss: 0.9935, test_f1: 0.5638
 epoch: 10, train_loss: 0.8468, test_loss: 1.0284, test_f1: 0.5303
 epoch: 11, train_loss: 0.8272, test_loss: 0.9982, test_f1: 0.5933
 epoch: 12, train_loss: 0.8308, test_loss: 1.0039, test_f1: 0.5864
 epoch: 13, train_loss: 0.8213, test_loss: 1.0243, test_f1: 0.5782
 epoch: 14, train_loss: 0.7886, test_loss: 1.0516, test_f1: 0.5159
 epoch: 15, train_loss: 0.7630, test_loss: 1.0231, test_f1: 0.6100
 epoch: 16, train_loss: 0.7471, test_loss: 1.0512, test_f1: 0.5877
 epoch: 17, train_loss: 0.7385, test_loss: 1.0688, test_f1: 0.6006
 epoch: 18, train_loss: 0.7502, test_loss: 1.0520, test_f1: 0.5931
 epoch: 19, train_loss: 0.7341, test_loss: 1.0734, test_f1: 0.5938
 epoch: 20, train_loss: 0.7248, test_loss: 1.2006, test_f1: 0.5593
 epoch: 21, train_loss: 0.7398, test_loss: 1.1943, test_f1: 0.5401
 epoch: 22, train_loss: 0.7166, test_loss: 1.4068, test_f1: 0.5099
 epoch: 23, train_loss: 0.7110, test_loss: 1.1548, test_f1: 0.5776
 epoch: 24, train_loss: 0.6872, test_loss: 1.1653, test_f1: 0.5575
 epoch: 25, train_loss: 0.6764, test_loss: 1.1182, test_f1: 0.6060
 epoch: 26, train_loss: 0.6742, test_loss: 1.2476, test_f1: 0.6006
 epoch: 27, train_loss: 0.6480, test_loss: 1.1973, test_f1: 0.5861
 epoch: 28, train_loss: 0.6695, test_loss: 1.2710, test_f1: 0.5931
 epoch: 29, train_loss: 0.6537, test_loss: 1.2537, test_f1: 0.6019
 epoch: 30, train_loss: 0.6271, test_loss: 1.2493, test_f1: 0.5855
 epoch: 31, train_loss: 0.6272, test_loss: 1.1875, test_f1: 0.6025
 epoch: 32, train_loss: 0.6087, test_loss: 1.2252, test_f1: 0.5733
 epoch: 33, train_loss: 0.6127, test_loss: 1.2116, test_f1: 0.5985
 epoch: 34, train_loss: 0.5964, test_loss: 1.2228, test_f1: 0.5951
 epoch: 35, train_loss: 0.5742, test_loss: 1.2469, test_f1: 0.6002
 epoch: 36, train_loss: 0.5493, test_loss: 1.3506, test_f1: 0.5738
 epoch: 37, train_loss: 0.5701, test_loss: 1.3887, test_f1: 0.5925
 epoch: 38, train_loss: 0.5875, test_loss: 1.3414, test_f1: 0.5941
 epoch: 39, train_loss: 0.5833, test_loss: 1.3203, test_f1: 0.5471
 epoch: 40, train_loss: 0.5930, test_loss: 1.3523, test_f1: 0.6031
 epoch: 41, train_loss: 0.5957, test_loss: 1.2701, test_f1: 0.6522
 epoch: 42, train_loss: 0.5685, test_loss: 1.3195, test_f1: 0.5872
 epoch: 43, train_loss: 0.5300, test_loss: 1.2321, test_f1: 0.5783
 epoch: 44, train_loss: 0.5450, test_loss: 1.3721, test_f1: 0.6280
 epoch: 45, train_loss: 0.5094, test_loss: 1.2982, test_f1: 0.6425
 epoch: 46, train_loss: 0.4949, test_loss: 1.3761, test_f1: 0.6155
 epoch: 47, train_loss: 0.5118, test_loss: 1.3960, test_f1: 0.5940
 epoch: 48, train_loss: 0.4822, test_loss: 1.3419, test_f1: 0.6233
 epoch: 49, train_loss: 0.4741, test_loss: 1.3101, test_f1: 0.6227
 epoch: 50, train_loss: 0.4962, test_loss: 1.2073, test_f1: 0.6433
 epoch: 51, train_loss: 0.4602, test_loss: 1.4444, test_f1: 0.6218
 epoch: 52, train_loss: 0.4704, test_loss: 1.6034, test_f1: 0.6172
 epoch: 53, train_loss: 0.4864, test_loss: 1.5094, test_f1: 0.6111
 epoch: 54, train_loss: 0.4607, test_loss: 1.4783, test_f1: 0.6274
 epoch: 55, train_loss: 0.4614, test_loss: 1.5125, test_f1: 0.6108
 epoch: 56, train_loss: 0.4430, test_loss: 1.5282, test_f1: 0.6023
 epoch: 57, train_loss: 0.4338, test_loss: 1.4502, test_f1: 0.5875
 epoch: 58, train_loss: 0.4501, test_loss: 1.4500, test_f1: 0.6071
 epoch: 59, train_loss: 0.4476, test_loss: 1.5665, test_f1: 0.6189
 epoch: 60, train_loss: 0.4347, test_loss: 1.6632, test_f1: 0.6236
 epoch: 61, train_loss: 0.4355, test_loss: 1.6137, test_f1: 0.6283
 epoch: 62, train_loss: 0.4234, test_loss: 1.6415, test_f1: 0.5510
 epoch: 63, train_loss: 0.4294, test_loss: 1.5177, test_f1: 0.6261
 epoch: 64, train_loss: 0.4151, test_loss: 1.5085, test_f1: 0.6155
 epoch: 65, train_loss: 0.4042, test_loss: 1.5658, test_f1: 0.6318
 epoch: 66, train_loss: 0.3867, test_loss: 1.5107, test_f1: 0.6301
 epoch: 67, train_loss: 0.3814, test_loss: 1.4539, test_f1: 0.6141
 epoch: 68, train_loss: 0.3699, test_loss: 1.4863, test_f1: 0.6121
 epoch: 69, train_loss: 0.3829, test_loss: 1.6445, test_f1: 0.6270
 epoch: 70, train_loss: 0.3837, test_loss: 1.6944, test_f1: 0.6339
 epoch: 71, train_loss: 0.3867, test_loss: 1.6624, test_f1: 0.5963
 epoch: 72, train_loss: 0.3877, test_loss: 1.8125, test_f1: 0.5917
 epoch: 73, train_loss: 0.3638, test_loss: 1.8839, test_f1: 0.6076
 epoch: 74, train_loss: 0.3562, test_loss: 1.6630, test_f1: 0.6072
 epoch: 75, train_loss: 0.3560, test_loss: 1.6795, test_f1: 0.5990
 epoch: 76, train_loss: 0.3784, test_loss: 1.6745, test_f1: 0.6325
 epoch: 77, train_loss: 0.3473, test_loss: 1.7146, test_f1: 0.6227
 epoch: 78, train_loss: 0.3732, test_loss: 1.7874, test_f1: 0.6186
 epoch: 79, train_loss: 0.3567, test_loss: 1.7636, test_f1: 0.6069
 epoch: 80, train_loss: 0.3737, test_loss: 1.7382, test_f1: 0.6078
 epoch: 81, train_loss: 0.3598, test_loss: 1.7992, test_f1: 0.5938
 epoch: 82, train_loss: 0.3480, test_loss: 1.7620, test_f1: 0.6084
 epoch: 83, train_loss: 0.3402, test_loss: 1.8287, test_f1: 0.6304
 epoch: 84, train_loss: 0.3391, test_loss: 1.8435, test_f1: 0.6165
 epoch: 85, train_loss: 0.3409, test_loss: 1.8558, test_f1: 0.5953
 epoch: 86, train_loss: 0.3372, test_loss: 1.8612, test_f1: 0.5950
 epoch: 87, train_loss: 0.3161, test_loss: 1.8375, test_f1: 0.6083
 epoch: 88, train_loss: 0.3172, test_loss: 1.7621, test_f1: 0.6187
 epoch: 89, train_loss: 0.3241, test_loss: 1.7990, test_f1: 0.6280
 epoch: 90, train_loss: 0.3090, test_loss: 1.8405, test_f1: 0.6341
 epoch: 91, train_loss: 0.3171, test_loss: 1.8137, test_f1: 0.6240
 epoch: 92, train_loss: 0.3063, test_loss: 1.8438, test_f1: 0.6144
 epoch: 93, train_loss: 0.3271, test_loss: 1.8329, test_f1: 0.6225
 epoch: 94, train_loss: 0.3111, test_loss: 1.9237, test_f1: 0.6066
 epoch: 95, train_loss: 0.3504, test_loss: 1.9638, test_f1: 0.5811
 epoch: 96, train_loss: 0.3275, test_loss: 2.0576, test_f1: 0.5933
 epoch: 97, train_loss: 0.3160, test_loss: 2.0372, test_f1: 0.6213
 epoch: 98, train_loss: 0.3326, test_loss: 2.0377, test_f1: 0.6219
 epoch: 99, train_loss: 0.3140, test_loss: 2.0779, test_f1: 0.5965
##################ITERATION #8 ****************************************
 epoch: 0, train_loss: 1.4200, test_loss: 1.4025, test_f1: 0.1365
 epoch: 1, train_loss: 1.1064, test_loss: 1.4163, test_f1: 0.1365
 epoch: 2, train_loss: 1.0639, test_loss: 1.3687, test_f1: 0.1483
 epoch: 3, train_loss: 0.9850, test_loss: 1.2946, test_f1: 0.1879
 epoch: 4, train_loss: 0.9756, test_loss: 1.2171, test_f1: 0.3483
 epoch: 5, train_loss: 0.9265, test_loss: 1.1810, test_f1: 0.3844
 epoch: 6, train_loss: 0.9045, test_loss: 1.1293, test_f1: 0.4672
 epoch: 7, train_loss: 0.9016, test_loss: 1.0931, test_f1: 0.4699
 epoch: 8, train_loss: 0.8928, test_loss: 1.1269, test_f1: 0.4506
 epoch: 9, train_loss: 0.8380, test_loss: 1.1136, test_f1: 0.5016
 epoch: 10, train_loss: 0.8258, test_loss: 1.0883, test_f1: 0.5443
 epoch: 11, train_loss: 0.8115, test_loss: 1.0752, test_f1: 0.5734
 epoch: 12, train_loss: 0.7997, test_loss: 1.0875, test_f1: 0.5649
 epoch: 13, train_loss: 0.7928, test_loss: 1.1464, test_f1: 0.5506
 epoch: 14, train_loss: 0.7847, test_loss: 1.1900, test_f1: 0.5674
 epoch: 15, train_loss: 0.7880, test_loss: 1.1167, test_f1: 0.5654
 epoch: 16, train_loss: 0.7535, test_loss: 1.0679, test_f1: 0.6042
 epoch: 17, train_loss: 0.7635, test_loss: 1.2052, test_f1: 0.5360
 epoch: 18, train_loss: 0.7519, test_loss: 1.1034, test_f1: 0.5355
 epoch: 19, train_loss: 0.7521, test_loss: 1.1319, test_f1: 0.5912
 epoch: 20, train_loss: 0.7323, test_loss: 1.1768, test_f1: 0.5460
 epoch: 21, train_loss: 0.7190, test_loss: 1.1579, test_f1: 0.5721
 epoch: 22, train_loss: 0.7267, test_loss: 1.2744, test_f1: 0.5702
 epoch: 23, train_loss: 0.7236, test_loss: 1.1251, test_f1: 0.6488
 epoch: 24, train_loss: 0.7222, test_loss: 1.1616, test_f1: 0.5899
 epoch: 25, train_loss: 0.6994, test_loss: 1.1432, test_f1: 0.5928
 epoch: 26, train_loss: 0.6746, test_loss: 1.1393, test_f1: 0.5925
 epoch: 27, train_loss: 0.6626, test_loss: 1.1341, test_f1: 0.6053
 epoch: 28, train_loss: 0.6585, test_loss: 1.1281, test_f1: 0.5659
 epoch: 29, train_loss: 0.6386, test_loss: 1.1703, test_f1: 0.6089
 epoch: 30, train_loss: 0.6403, test_loss: 1.2864, test_f1: 0.5677
 epoch: 31, train_loss: 0.6129, test_loss: 1.2853, test_f1: 0.5287
 epoch: 32, train_loss: 0.6225, test_loss: 1.2384, test_f1: 0.5722
 epoch: 33, train_loss: 0.6107, test_loss: 1.2268, test_f1: 0.5713
 epoch: 34, train_loss: 0.6127, test_loss: 1.2815, test_f1: 0.5845
 epoch: 35, train_loss: 0.5904, test_loss: 1.1848, test_f1: 0.6024
 epoch: 36, train_loss: 0.5526, test_loss: 1.2997, test_f1: 0.5741
 epoch: 37, train_loss: 0.5835, test_loss: 1.2967, test_f1: 0.5449
 epoch: 38, train_loss: 0.5834, test_loss: 1.3088, test_f1: 0.5951
 epoch: 39, train_loss: 0.5759, test_loss: 1.1932, test_f1: 0.5475
 epoch: 40, train_loss: 0.5588, test_loss: 1.2228, test_f1: 0.5996
 epoch: 41, train_loss: 0.5802, test_loss: 1.2450, test_f1: 0.6155
 epoch: 42, train_loss: 0.5759, test_loss: 1.2770, test_f1: 0.5907
 epoch: 43, train_loss: 0.5582, test_loss: 1.3630, test_f1: 0.6018
 epoch: 44, train_loss: 0.6323, test_loss: 1.2668, test_f1: 0.6209
 epoch: 45, train_loss: 0.5575, test_loss: 1.3344, test_f1: 0.6141
 epoch: 46, train_loss: 0.5983, test_loss: 1.3088, test_f1: 0.6386
 epoch: 47, train_loss: 0.6066, test_loss: 1.3474, test_f1: 0.5999
 epoch: 48, train_loss: 0.5653, test_loss: 1.2962, test_f1: 0.5667
 epoch: 49, train_loss: 0.5732, test_loss: 1.3185, test_f1: 0.6270
 epoch: 50, train_loss: 0.5678, test_loss: 1.1762, test_f1: 0.6123
 epoch: 51, train_loss: 0.5168, test_loss: 1.1644, test_f1: 0.6215
 epoch: 52, train_loss: 0.5055, test_loss: 1.1202, test_f1: 0.6221
 epoch: 53, train_loss: 0.4996, test_loss: 1.1900, test_f1: 0.6074
 epoch: 54, train_loss: 0.4760, test_loss: 1.2867, test_f1: 0.6073
 epoch: 55, train_loss: 0.4648, test_loss: 1.2747, test_f1: 0.6076
 epoch: 56, train_loss: 0.4655, test_loss: 1.2600, test_f1: 0.6291
 epoch: 57, train_loss: 0.4436, test_loss: 1.3047, test_f1: 0.6183
 epoch: 58, train_loss: 0.4415, test_loss: 1.2716, test_f1: 0.6300
 epoch: 59, train_loss: 0.4565, test_loss: 1.2763, test_f1: 0.6180
 epoch: 60, train_loss: 0.4244, test_loss: 1.2730, test_f1: 0.6007
 epoch: 61, train_loss: 0.4260, test_loss: 1.3313, test_f1: 0.6059
 epoch: 62, train_loss: 0.4089, test_loss: 1.3906, test_f1: 0.6349
 epoch: 63, train_loss: 0.4274, test_loss: 1.3615, test_f1: 0.6181
 epoch: 64, train_loss: 0.4046, test_loss: 1.5059, test_f1: 0.5860
 epoch: 65, train_loss: 0.4089, test_loss: 1.4501, test_f1: 0.6011
 epoch: 66, train_loss: 0.3923, test_loss: 1.3383, test_f1: 0.6216
 epoch: 67, train_loss: 0.3947, test_loss: 1.4924, test_f1: 0.6362
 epoch: 68, train_loss: 0.4055, test_loss: 1.4377, test_f1: 0.6196
 epoch: 69, train_loss: 0.4024, test_loss: 1.3840, test_f1: 0.6458
 epoch: 70, train_loss: 0.4032, test_loss: 1.3806, test_f1: 0.5990
 epoch: 71, train_loss: 0.4014, test_loss: 1.3473, test_f1: 0.6018
 epoch: 72, train_loss: 0.3924, test_loss: 1.3670, test_f1: 0.6089
 epoch: 73, train_loss: 0.4088, test_loss: 1.3819, test_f1: 0.6014
 epoch: 74, train_loss: 0.3829, test_loss: 1.3929, test_f1: 0.6301
 epoch: 75, train_loss: 0.3665, test_loss: 1.3549, test_f1: 0.6354
 epoch: 76, train_loss: 0.3702, test_loss: 1.4456, test_f1: 0.6132
 epoch: 77, train_loss: 0.3600, test_loss: 1.4690, test_f1: 0.6183
 epoch: 78, train_loss: 0.3723, test_loss: 1.4775, test_f1: 0.5963
 epoch: 79, train_loss: 0.3583, test_loss: 1.5236, test_f1: 0.6206
 epoch: 80, train_loss: 0.3435, test_loss: 1.5890, test_f1: 0.6347
 epoch: 81, train_loss: 0.3442, test_loss: 1.4307, test_f1: 0.6191
 epoch: 82, train_loss: 0.3578, test_loss: 1.5511, test_f1: 0.6433
 epoch: 83, train_loss: 0.3675, test_loss: 1.5724, test_f1: 0.5968
 epoch: 84, train_loss: 0.3613, test_loss: 1.4061, test_f1: 0.6390
 epoch: 85, train_loss: 0.3314, test_loss: 1.3905, test_f1: 0.6224
 epoch: 86, train_loss: 0.3531, test_loss: 1.4776, test_f1: 0.5862
 epoch: 87, train_loss: 0.3557, test_loss: 1.5607, test_f1: 0.6050
 epoch: 88, train_loss: 0.3274, test_loss: 1.6520, test_f1: 0.6044
 epoch: 89, train_loss: 0.3641, test_loss: 1.6112, test_f1: 0.6009
 epoch: 90, train_loss: 0.3494, test_loss: 1.5110, test_f1: 0.6067
 epoch: 91, train_loss: 0.3264, test_loss: 1.4968, test_f1: 0.6063
 epoch: 92, train_loss: 0.3106, test_loss: 1.4968, test_f1: 0.5984
 epoch: 93, train_loss: 0.3228, test_loss: 1.5587, test_f1: 0.6346
 epoch: 94, train_loss: 0.3145, test_loss: 1.7226, test_f1: 0.6287
 epoch: 95, train_loss: 0.3144, test_loss: 1.5727, test_f1: 0.6205
 epoch: 96, train_loss: 0.3214, test_loss: 1.5916, test_f1: 0.6323
 epoch: 97, train_loss: 0.2950, test_loss: 1.5968, test_f1: 0.6268
 epoch: 98, train_loss: 0.3165, test_loss: 1.7555, test_f1: 0.6044
 epoch: 99, train_loss: 0.3191, test_loss: 1.7352, test_f1: 0.6197
##################ITERATION #9 ****************************************
 epoch: 0, train_loss: 1.4847, test_loss: 1.4608, test_f1: 0.1365
 epoch: 1, train_loss: 1.1304, test_loss: 1.4328, test_f1: 0.1365
 epoch: 2, train_loss: 1.0876, test_loss: 1.3164, test_f1: 0.1365
 epoch: 3, train_loss: 1.0192, test_loss: 1.2471, test_f1: 0.3023
 epoch: 4, train_loss: 0.9639, test_loss: 1.2245, test_f1: 0.3073
 epoch: 5, train_loss: 0.9442, test_loss: 1.1755, test_f1: 0.3212
 epoch: 6, train_loss: 0.9022, test_loss: 1.1450, test_f1: 0.3505
 epoch: 7, train_loss: 0.8994, test_loss: 1.1013, test_f1: 0.4029
 epoch: 8, train_loss: 0.8867, test_loss: 1.0766, test_f1: 0.4957
 epoch: 9, train_loss: 0.8550, test_loss: 1.0846, test_f1: 0.5508
 epoch: 10, train_loss: 0.8498, test_loss: 1.0803, test_f1: 0.5897
 epoch: 11, train_loss: 0.8403, test_loss: 1.0842, test_f1: 0.5598
 epoch: 12, train_loss: 0.8167, test_loss: 1.1152, test_f1: 0.5769
 epoch: 13, train_loss: 0.8115, test_loss: 1.0844, test_f1: 0.5429
 epoch: 14, train_loss: 0.7987, test_loss: 1.0860, test_f1: 0.5504
 epoch: 15, train_loss: 0.7718, test_loss: 1.1185, test_f1: 0.6269
 epoch: 16, train_loss: 0.7673, test_loss: 1.0594, test_f1: 0.6294
 epoch: 17, train_loss: 0.7791, test_loss: 1.1251, test_f1: 0.5722
 epoch: 18, train_loss: 0.7337, test_loss: 1.0728, test_f1: 0.5888
 epoch: 19, train_loss: 0.7342, test_loss: 1.1592, test_f1: 0.5663
 epoch: 20, train_loss: 0.7355, test_loss: 1.1332, test_f1: 0.5758
 epoch: 21, train_loss: 0.7394, test_loss: 1.1166, test_f1: 0.5640
 epoch: 22, train_loss: 0.7258, test_loss: 1.1857, test_f1: 0.4950
 epoch: 23, train_loss: 0.7304, test_loss: 1.2415, test_f1: 0.5671
 epoch: 24, train_loss: 0.7087, test_loss: 1.2399, test_f1: 0.5453
 epoch: 25, train_loss: 0.7178, test_loss: 1.0978, test_f1: 0.6035
 epoch: 26, train_loss: 0.6929, test_loss: 1.1337, test_f1: 0.5939
 epoch: 27, train_loss: 0.6742, test_loss: 1.1210, test_f1: 0.6063
 epoch: 28, train_loss: 0.6715, test_loss: 1.1915, test_f1: 0.6071
 epoch: 29, train_loss: 0.6850, test_loss: 1.2197, test_f1: 0.6018
 epoch: 30, train_loss: 0.6879, test_loss: 1.1612, test_f1: 0.6124
 epoch: 31, train_loss: 0.6550, test_loss: 1.2120, test_f1: 0.6060
 epoch: 32, train_loss: 0.6364, test_loss: 1.1757, test_f1: 0.6291
 epoch: 33, train_loss: 0.6309, test_loss: 1.2389, test_f1: 0.6108
 epoch: 34, train_loss: 0.6374, test_loss: 1.2740, test_f1: 0.5929
 epoch: 35, train_loss: 0.6037, test_loss: 1.2317, test_f1: 0.5648
 epoch: 36, train_loss: 0.6230, test_loss: 1.2562, test_f1: 0.5434
 epoch: 37, train_loss: 0.6189, test_loss: 1.3671, test_f1: 0.5614
 epoch: 38, train_loss: 0.6445, test_loss: 1.3367, test_f1: 0.5942
 epoch: 39, train_loss: 0.6098, test_loss: 1.2016, test_f1: 0.6249
 epoch: 40, train_loss: 0.5892, test_loss: 1.3085, test_f1: 0.5930
 epoch: 41, train_loss: 0.5939, test_loss: 1.2684, test_f1: 0.6022
 epoch: 42, train_loss: 0.5699, test_loss: 1.2559, test_f1: 0.5620
 epoch: 43, train_loss: 0.5983, test_loss: 1.2486, test_f1: 0.5768
 epoch: 44, train_loss: 0.5480, test_loss: 1.3169, test_f1: 0.5794
 epoch: 45, train_loss: 0.5513, test_loss: 1.2786, test_f1: 0.5470
 epoch: 46, train_loss: 0.5475, test_loss: 1.2630, test_f1: 0.6071
 epoch: 47, train_loss: 0.5623, test_loss: 1.2867, test_f1: 0.6127
 epoch: 48, train_loss: 0.5667, test_loss: 1.2528, test_f1: 0.6426
 epoch: 49, train_loss: 0.5484, test_loss: 1.3497, test_f1: 0.5871
 epoch: 50, train_loss: 0.5544, test_loss: 1.4296, test_f1: 0.6175
 epoch: 51, train_loss: 0.5241, test_loss: 1.3056, test_f1: 0.6082
 epoch: 52, train_loss: 0.4836, test_loss: 1.2650, test_f1: 0.5796
 epoch: 53, train_loss: 0.4877, test_loss: 1.2886, test_f1: 0.5779
 epoch: 54, train_loss: 0.4812, test_loss: 1.3017, test_f1: 0.6104
 epoch: 55, train_loss: 0.5001, test_loss: 1.2979, test_f1: 0.5711
 epoch: 56, train_loss: 0.4912, test_loss: 1.3928, test_f1: 0.6120
 epoch: 57, train_loss: 0.4910, test_loss: 1.5658, test_f1: 0.5429
 epoch: 58, train_loss: 0.4842, test_loss: 1.4091, test_f1: 0.5807
 epoch: 59, train_loss: 0.4560, test_loss: 1.4040, test_f1: 0.5966
 epoch: 60, train_loss: 0.4475, test_loss: 1.4136, test_f1: 0.5996
 epoch: 61, train_loss: 0.4384, test_loss: 1.3943, test_f1: 0.6007
 epoch: 62, train_loss: 0.4407, test_loss: 1.4394, test_f1: 0.6056
 epoch: 63, train_loss: 0.4278, test_loss: 1.4216, test_f1: 0.6016
 epoch: 64, train_loss: 0.4526, test_loss: 1.3949, test_f1: 0.5929
 epoch: 65, train_loss: 0.4482, test_loss: 1.3881, test_f1: 0.5933
 epoch: 66, train_loss: 0.4363, test_loss: 1.4124, test_f1: 0.6201
 epoch: 67, train_loss: 0.4321, test_loss: 1.4339, test_f1: 0.6004
 epoch: 68, train_loss: 0.4126, test_loss: 1.3938, test_f1: 0.5790
 epoch: 69, train_loss: 0.4046, test_loss: 1.4376, test_f1: 0.6091
 epoch: 70, train_loss: 0.4243, test_loss: 1.4345, test_f1: 0.6134
 epoch: 71, train_loss: 0.4419, test_loss: 1.5610, test_f1: 0.6099
 epoch: 72, train_loss: 0.4330, test_loss: 1.7178, test_f1: 0.5871
 epoch: 73, train_loss: 0.4477, test_loss: 1.5543, test_f1: 0.5886
 epoch: 74, train_loss: 0.4174, test_loss: 1.5094, test_f1: 0.5976
 epoch: 75, train_loss: 0.3990, test_loss: 1.4261, test_f1: 0.5981
 epoch: 76, train_loss: 0.3920, test_loss: 1.4399, test_f1: 0.5953
 epoch: 77, train_loss: 0.4120, test_loss: 1.4605, test_f1: 0.5802
 epoch: 78, train_loss: 0.3973, test_loss: 1.5565, test_f1: 0.5930
 epoch: 79, train_loss: 0.4274, test_loss: 1.5989, test_f1: 0.6191
 epoch: 80, train_loss: 0.4010, test_loss: 1.6248, test_f1: 0.5745
 epoch: 81, train_loss: 0.3727, test_loss: 1.6408, test_f1: 0.6296
 epoch: 82, train_loss: 0.3845, test_loss: 1.4902, test_f1: 0.5780
 epoch: 83, train_loss: 0.3838, test_loss: 1.5095, test_f1: 0.6035
 epoch: 84, train_loss: 0.3654, test_loss: 1.5789, test_f1: 0.5931
 epoch: 85, train_loss: 0.3517, test_loss: 1.6006, test_f1: 0.5896
 epoch: 86, train_loss: 0.3637, test_loss: 1.5823, test_f1: 0.6096
 epoch: 87, train_loss: 0.3718, test_loss: 1.5716, test_f1: 0.6031
 epoch: 88, train_loss: 0.3728, test_loss: 1.8297, test_f1: 0.6066
 epoch: 89, train_loss: 0.3845, test_loss: 1.7363, test_f1: 0.6041
 epoch: 90, train_loss: 0.3556, test_loss: 1.7507, test_f1: 0.5902
 epoch: 91, train_loss: 0.3626, test_loss: 1.7516, test_f1: 0.5640
 epoch: 92, train_loss: 0.3686, test_loss: 1.8358, test_f1: 0.5846
 epoch: 93, train_loss: 0.3495, test_loss: 1.7068, test_f1: 0.6288
 epoch: 94, train_loss: 0.3416, test_loss: 1.7347, test_f1: 0.6074
 epoch: 95, train_loss: 0.3392, test_loss: 1.8345, test_f1: 0.5913
 epoch: 96, train_loss: 0.3859, test_loss: 1.7446, test_f1: 0.6041
 epoch: 97, train_loss: 0.3353, test_loss: 1.6702, test_f1: 0.5933
 epoch: 98, train_loss: 0.3255, test_loss: 1.7479, test_f1: 0.6091
 epoch: 99, train_loss: 0.3348, test_loss: 1.7734, test_f1: 0.6038

Training completed in 339.46 seconds
Best F1: 0.6770 at epoch 31
Mean F1 across iterations: 0.6543  0.0125
========================FINAL RESULTS================================
FEGIN weighted F1: 0.6770  0.0125
python main.py --data ltspice_demos --representation component_net --model FEGIN --layers 2 --hiddens 128 --batch_size 256 --lr 0.001 --emb_size 250 --epochs 100 --save_appendix component_net_L2_H128_BS256_LR0.001_E250 --no_val
-----



STDERR:
  File "main.py", line 370, in <module>
    main()
  File "main.py", line 254, in main
    dataset = dataset_class(
  File "/home/philip/projects/ltspice_examples_code_repo/Circuit-Completion-Using-GNNs/component_classification_with_link_prediction_head/evaluation/FEGIN/kernel/circuit_datasets.py", line 15, in __init__
    self.data, self.slices = torch.load(self.processed_paths[0])
  File "/home/philip/.local/lib/python3.8/site-packages/torch/serialization.py", line 1040, in load
    warnings.warn(
  File "/usr/lib/python3.8/warnings.py", line 109, in _showwarnmsg
    sw(msg.message, msg.category, msg.filename, msg.lineno,
  File "main.py", line 47, in warn_with_traceback
    traceback.print_stack(file=log)
/home/philip/projects/ltspice_examples_code_repo/Circuit-Completion-Using-GNNs/component_classification_with_link_prediction_head/evaluation/FEGIN/kernel/circuit_datasets.py:15: FutureWarning: You are using `torch.load` with `weights_only=False` (the current default value), which uses the default pickle module implicitly. It is possible to construct malicious pickle data which will execute arbitrary code during unpickling (See https://github.com/pytorch/pytorch/blob/main/SECURITY.md#untrusted-models for more details). In a future release, the default value for `weights_only` will be flipped to `True`. This limits the functions that could be executed during unpickling. Arbitrary objects will no longer be allowed to be loaded via this mode unless they are explicitly allowlisted by the user via `torch.serialization.add_safe_globals`. We recommend you start setting `weights_only=True` for any use case where you don't have full control of the loaded file. Please open an issue on GitHub for any issues related to this experimental feature.
  self.data, self.slices = torch.load(self.processed_paths[0])
