STDOUT:
Results will be saved in /home/philip/projects/ltspice_examples_code_repo/Circuit-Completion-Using-GNNs/component_classification_with_link_prediction_head/evaluation/FEGIN/results/model_FEGIN_dataset_ltspice_demos
Command line input: python main.py --data ltspice_demos --representation component_pin --model FEGIN --layers 2 --hiddens 128 --batch_size 32 --lr 0.0001 --emb_size 250 --epochs 100 --save_appendix component_pin_L2_H128_BS32_LR0.0001_E250 --no_val
 is saved.
-----
ltspice_demos - FEGIN
Using 2 layers, 128 hidden units, h = 2
Loading component_pin representation dataset
ENTERED
Training FEGIN on component_pin representation
Train: 1565, Test: 383
##################ITERATION #0 ****************************************
 epoch: 0, train_loss: 1.3518, test_loss: 1.3472, test_f1: 0.3381
 epoch: 1, train_loss: 1.3004, test_loss: 1.3038, test_f1: 0.2850
 epoch: 2, train_loss: 1.2428, test_loss: 1.2569, test_f1: 0.2872
 epoch: 3, train_loss: 1.1858, test_loss: 1.2237, test_f1: 0.4206
 epoch: 4, train_loss: 1.1398, test_loss: 1.1912, test_f1: 0.4522
 epoch: 5, train_loss: 1.1032, test_loss: 1.1470, test_f1: 0.4490
 epoch: 6, train_loss: 1.0568, test_loss: 1.1175, test_f1: 0.4518
 epoch: 7, train_loss: 1.0257, test_loss: 1.0892, test_f1: 0.4567
 epoch: 8, train_loss: 1.0034, test_loss: 1.0681, test_f1: 0.4471
 epoch: 9, train_loss: 0.9811, test_loss: 1.0530, test_f1: 0.4513
 epoch: 10, train_loss: 0.9650, test_loss: 1.0449, test_f1: 0.4635
 epoch: 11, train_loss: 0.9482, test_loss: 1.0131, test_f1: 0.4540
 epoch: 12, train_loss: 0.9280, test_loss: 1.0234, test_f1: 0.4826
 epoch: 13, train_loss: 0.9073, test_loss: 0.9959, test_f1: 0.5338
 epoch: 14, train_loss: 0.8906, test_loss: 0.9896, test_f1: 0.5385
 epoch: 15, train_loss: 0.8761, test_loss: 0.9763, test_f1: 0.5756
 epoch: 16, train_loss: 0.8589, test_loss: 0.9640, test_f1: 0.5827
 epoch: 17, train_loss: 0.8439, test_loss: 0.9648, test_f1: 0.6065
 epoch: 18, train_loss: 0.8266, test_loss: 0.9709, test_f1: 0.6083
 epoch: 19, train_loss: 0.8004, test_loss: 0.9651, test_f1: 0.6136
 epoch: 20, train_loss: 0.7952, test_loss: 0.9642, test_f1: 0.6077
 epoch: 21, train_loss: 0.7757, test_loss: 0.9450, test_f1: 0.6279
 epoch: 22, train_loss: 0.7611, test_loss: 0.9448, test_f1: 0.6159
 epoch: 23, train_loss: 0.7543, test_loss: 0.9669, test_f1: 0.6059
 epoch: 24, train_loss: 0.7350, test_loss: 0.9462, test_f1: 0.6199
 epoch: 25, train_loss: 0.7157, test_loss: 0.9597, test_f1: 0.5984
 epoch: 26, train_loss: 0.7148, test_loss: 0.9613, test_f1: 0.5926
 epoch: 27, train_loss: 0.7009, test_loss: 0.9544, test_f1: 0.6186
 epoch: 28, train_loss: 0.6866, test_loss: 0.9661, test_f1: 0.5808
 epoch: 29, train_loss: 0.6868, test_loss: 0.9862, test_f1: 0.6079
 epoch: 30, train_loss: 0.6744, test_loss: 0.9701, test_f1: 0.5893
 epoch: 31, train_loss: 0.6682, test_loss: 1.0151, test_f1: 0.6069
 epoch: 32, train_loss: 0.6634, test_loss: 0.9998, test_f1: 0.6239
 epoch: 33, train_loss: 0.6613, test_loss: 0.9814, test_f1: 0.6137
 epoch: 34, train_loss: 0.6425, test_loss: 0.9765, test_f1: 0.6257
 epoch: 35, train_loss: 0.6270, test_loss: 1.0304, test_f1: 0.5955
 epoch: 36, train_loss: 0.6407, test_loss: 1.0125, test_f1: 0.6350
 epoch: 37, train_loss: 0.6237, test_loss: 0.9742, test_f1: 0.6044
 epoch: 38, train_loss: 0.6376, test_loss: 1.0048, test_f1: 0.6534
 epoch: 39, train_loss: 0.6130, test_loss: 1.0358, test_f1: 0.6167
 epoch: 40, train_loss: 0.6029, test_loss: 1.0522, test_f1: 0.5662
 epoch: 41, train_loss: 0.6070, test_loss: 1.0137, test_f1: 0.5604
 epoch: 42, train_loss: 0.5856, test_loss: 1.0634, test_f1: 0.5920
 epoch: 43, train_loss: 0.5704, test_loss: 1.0008, test_f1: 0.5863
 epoch: 44, train_loss: 0.5780, test_loss: 1.0733, test_f1: 0.6009
 epoch: 45, train_loss: 0.5795, test_loss: 1.0399, test_f1: 0.6086
 epoch: 46, train_loss: 0.5629, test_loss: 1.0357, test_f1: 0.5948
 epoch: 47, train_loss: 0.5777, test_loss: 1.0476, test_f1: 0.5886
 epoch: 48, train_loss: 0.5562, test_loss: 1.0204, test_f1: 0.6235
 epoch: 49, train_loss: 0.5472, test_loss: 1.0374, test_f1: 0.6394
 epoch: 50, train_loss: 0.5522, test_loss: 1.1288, test_f1: 0.5713
 epoch: 51, train_loss: 0.5167, test_loss: 1.0476, test_f1: 0.6260
 epoch: 52, train_loss: 0.5173, test_loss: 1.1019, test_f1: 0.5778
 epoch: 53, train_loss: 0.5146, test_loss: 1.0985, test_f1: 0.5832
 epoch: 54, train_loss: 0.4989, test_loss: 1.0726, test_f1: 0.6025
 epoch: 55, train_loss: 0.5121, test_loss: 1.0945, test_f1: 0.5996
 epoch: 56, train_loss: 0.5167, test_loss: 1.0515, test_f1: 0.6092
 epoch: 57, train_loss: 0.4977, test_loss: 1.0734, test_f1: 0.5860
 epoch: 58, train_loss: 0.4931, test_loss: 1.1092, test_f1: 0.5996
 epoch: 59, train_loss: 0.5000, test_loss: 1.1199, test_f1: 0.5806
 epoch: 60, train_loss: 0.4829, test_loss: 1.1243, test_f1: 0.5958
 epoch: 61, train_loss: 0.4736, test_loss: 1.1906, test_f1: 0.6075
 epoch: 62, train_loss: 0.4783, test_loss: 1.2035, test_f1: 0.5873
 epoch: 63, train_loss: 0.4726, test_loss: 1.1791, test_f1: 0.6097
 epoch: 64, train_loss: 0.4768, test_loss: 1.1637, test_f1: 0.5993
 epoch: 65, train_loss: 0.4790, test_loss: 1.1203, test_f1: 0.6179
 epoch: 66, train_loss: 0.4528, test_loss: 1.1890, test_f1: 0.6073
 epoch: 67, train_loss: 0.4710, test_loss: 1.1518, test_f1: 0.6195
 epoch: 68, train_loss: 0.4517, test_loss: 1.1492, test_f1: 0.6211
 epoch: 69, train_loss: 0.4548, test_loss: 1.2236, test_f1: 0.6043
 epoch: 70, train_loss: 0.4535, test_loss: 1.1873, test_f1: 0.6123
 epoch: 71, train_loss: 0.4504, test_loss: 1.2420, test_f1: 0.6076
 epoch: 72, train_loss: 0.4490, test_loss: 1.1305, test_f1: 0.6128
 epoch: 73, train_loss: 0.4404, test_loss: 1.2090, test_f1: 0.6039
 epoch: 74, train_loss: 0.4429, test_loss: 1.3069, test_f1: 0.5859
 epoch: 75, train_loss: 0.4355, test_loss: 1.2693, test_f1: 0.5820
 epoch: 76, train_loss: 0.4223, test_loss: 1.2579, test_f1: 0.5961
 epoch: 77, train_loss: 0.4343, test_loss: 1.2778, test_f1: 0.5943
 epoch: 78, train_loss: 0.4292, test_loss: 1.2864, test_f1: 0.5767
 epoch: 79, train_loss: 0.4159, test_loss: 1.2253, test_f1: 0.6362
 epoch: 80, train_loss: 0.4200, test_loss: 1.2932, test_f1: 0.5869
 epoch: 81, train_loss: 0.4217, test_loss: 1.3317, test_f1: 0.5967
 epoch: 82, train_loss: 0.4106, test_loss: 1.3055, test_f1: 0.5858
 epoch: 83, train_loss: 0.4173, test_loss: 1.3254, test_f1: 0.6035
 epoch: 84, train_loss: 0.4114, test_loss: 1.2895, test_f1: 0.6135
 epoch: 85, train_loss: 0.4206, test_loss: 1.3469, test_f1: 0.6058
 epoch: 86, train_loss: 0.4054, test_loss: 1.3073, test_f1: 0.6036
 epoch: 87, train_loss: 0.3849, test_loss: 1.3373, test_f1: 0.5973
 epoch: 88, train_loss: 0.4175, test_loss: 1.2996, test_f1: 0.6170
 epoch: 89, train_loss: 0.4172, test_loss: 1.2920, test_f1: 0.6054
 epoch: 90, train_loss: 0.4103, test_loss: 1.2662, test_f1: 0.6222
 epoch: 91, train_loss: 0.3866, test_loss: 1.3077, test_f1: 0.6024
 epoch: 92, train_loss: 0.3786, test_loss: 1.3222, test_f1: 0.5945
 epoch: 93, train_loss: 0.3800, test_loss: 1.3265, test_f1: 0.6141
 epoch: 94, train_loss: 0.3703, test_loss: 1.4520, test_f1: 0.5831
 epoch: 95, train_loss: 0.3728, test_loss: 1.3266, test_f1: 0.6304
 epoch: 96, train_loss: 0.3905, test_loss: 1.4186, test_f1: 0.5756
 epoch: 97, train_loss: 0.3799, test_loss: 1.4247, test_f1: 0.5976
 epoch: 98, train_loss: 0.3639, test_loss: 1.3520, test_f1: 0.5953
 epoch: 99, train_loss: 0.3684, test_loss: 1.4131, test_f1: 0.6078
##################ITERATION #1 ****************************************
 epoch: 0, train_loss: 1.2554, test_loss: 1.2931, test_f1: 0.2591
 epoch: 1, train_loss: 1.1775, test_loss: 1.2262, test_f1: 0.4073
 epoch: 2, train_loss: 1.1308, test_loss: 1.1853, test_f1: 0.4301
 epoch: 3, train_loss: 1.0708, test_loss: 1.1364, test_f1: 0.4307
 epoch: 4, train_loss: 1.0276, test_loss: 1.0989, test_f1: 0.4942
 epoch: 5, train_loss: 0.9854, test_loss: 1.0533, test_f1: 0.5173
 epoch: 6, train_loss: 0.9523, test_loss: 1.0363, test_f1: 0.5467
 epoch: 7, train_loss: 0.9199, test_loss: 1.0126, test_f1: 0.5422
 epoch: 8, train_loss: 0.9080, test_loss: 1.0100, test_f1: 0.5815
 epoch: 9, train_loss: 0.8766, test_loss: 0.9979, test_f1: 0.5932
 epoch: 10, train_loss: 0.8608, test_loss: 0.9865, test_f1: 0.6076
 epoch: 11, train_loss: 0.8425, test_loss: 0.9813, test_f1: 0.5885
 epoch: 12, train_loss: 0.8327, test_loss: 0.9710, test_f1: 0.5899
 epoch: 13, train_loss: 0.8007, test_loss: 0.9797, test_f1: 0.5867
 epoch: 14, train_loss: 0.7832, test_loss: 0.9798, test_f1: 0.5877
 epoch: 15, train_loss: 0.7762, test_loss: 0.9601, test_f1: 0.5991
 epoch: 16, train_loss: 0.7548, test_loss: 0.9729, test_f1: 0.5741
 epoch: 17, train_loss: 0.7417, test_loss: 1.0074, test_f1: 0.5754
 epoch: 18, train_loss: 0.7423, test_loss: 1.0007, test_f1: 0.5766
 epoch: 19, train_loss: 0.7214, test_loss: 1.0015, test_f1: 0.5773
 epoch: 20, train_loss: 0.7096, test_loss: 0.9980, test_f1: 0.6081
 epoch: 21, train_loss: 0.7105, test_loss: 0.9641, test_f1: 0.6015
 epoch: 22, train_loss: 0.6764, test_loss: 1.0044, test_f1: 0.5951
 epoch: 23, train_loss: 0.6786, test_loss: 1.0331, test_f1: 0.6028
 epoch: 24, train_loss: 0.6625, test_loss: 1.0506, test_f1: 0.6040
 epoch: 25, train_loss: 0.6633, test_loss: 1.0632, test_f1: 0.5832
 epoch: 26, train_loss: 0.6369, test_loss: 1.0016, test_f1: 0.5975
 epoch: 27, train_loss: 0.6486, test_loss: 1.0357, test_f1: 0.5892
 epoch: 28, train_loss: 0.6345, test_loss: 1.0106, test_f1: 0.5938
 epoch: 29, train_loss: 0.6136, test_loss: 1.0697, test_f1: 0.6195
 epoch: 30, train_loss: 0.6068, test_loss: 1.0040, test_f1: 0.6127
 epoch: 31, train_loss: 0.5930, test_loss: 1.0760, test_f1: 0.6051
 epoch: 32, train_loss: 0.5896, test_loss: 1.0545, test_f1: 0.6101
 epoch: 33, train_loss: 0.5835, test_loss: 1.2723, test_f1: 0.5959
 epoch: 34, train_loss: 0.5774, test_loss: 1.0708, test_f1: 0.5944
 epoch: 35, train_loss: 0.5844, test_loss: 1.0918, test_f1: 0.6397
 epoch: 36, train_loss: 0.5695, test_loss: 1.1096, test_f1: 0.6119
 epoch: 37, train_loss: 0.5569, test_loss: 1.2103, test_f1: 0.5749
 epoch: 38, train_loss: 0.5326, test_loss: 1.1141, test_f1: 0.6108
 epoch: 39, train_loss: 0.5423, test_loss: 1.1100, test_f1: 0.5870
 epoch: 40, train_loss: 0.5373, test_loss: 1.1651, test_f1: 0.6154
 epoch: 41, train_loss: 0.5147, test_loss: 1.1445, test_f1: 0.6136
 epoch: 42, train_loss: 0.4972, test_loss: 1.1943, test_f1: 0.5853
 epoch: 43, train_loss: 0.4972, test_loss: 1.2120, test_f1: 0.6082
 epoch: 44, train_loss: 0.5135, test_loss: 1.1959, test_f1: 0.5896
 epoch: 45, train_loss: 0.4989, test_loss: 1.2272, test_f1: 0.6012
 epoch: 46, train_loss: 0.4953, test_loss: 1.2273, test_f1: 0.6052
 epoch: 47, train_loss: 0.4706, test_loss: 1.3076, test_f1: 0.5722
 epoch: 48, train_loss: 0.4653, test_loss: 1.5445, test_f1: 0.5989
 epoch: 49, train_loss: 0.4750, test_loss: 1.3222, test_f1: 0.5820
 epoch: 50, train_loss: 0.4532, test_loss: 1.3754, test_f1: 0.6019
 epoch: 51, train_loss: 0.4373, test_loss: 1.3471, test_f1: 0.5961
 epoch: 52, train_loss: 0.4356, test_loss: 1.3857, test_f1: 0.5887
 epoch: 53, train_loss: 0.4214, test_loss: 1.3530, test_f1: 0.5981
 epoch: 54, train_loss: 0.4285, test_loss: 1.3432, test_f1: 0.6016
 epoch: 55, train_loss: 0.4317, test_loss: 1.3225, test_f1: 0.5982
 epoch: 56, train_loss: 0.4189, test_loss: 1.3731, test_f1: 0.6266
 epoch: 57, train_loss: 0.4315, test_loss: 1.3700, test_f1: 0.6357
 epoch: 58, train_loss: 0.4031, test_loss: 1.4300, test_f1: 0.5863
 epoch: 59, train_loss: 0.3950, test_loss: 1.3703, test_f1: 0.6361
 epoch: 60, train_loss: 0.4017, test_loss: 1.3276, test_f1: 0.6336
 epoch: 61, train_loss: 0.3920, test_loss: 1.3946, test_f1: 0.5933
 epoch: 62, train_loss: 0.3836, test_loss: 1.4299, test_f1: 0.5891
 epoch: 63, train_loss: 0.3794, test_loss: 1.3683, test_f1: 0.5945
 epoch: 64, train_loss: 0.3934, test_loss: 1.3995, test_f1: 0.6125
 epoch: 65, train_loss: 0.3890, test_loss: 1.4749, test_f1: 0.5925
 epoch: 66, train_loss: 0.3742, test_loss: 1.4903, test_f1: 0.6056
 epoch: 67, train_loss: 0.3730, test_loss: 1.3908, test_f1: 0.6173
 epoch: 68, train_loss: 0.3669, test_loss: 1.4662, test_f1: 0.6150
 epoch: 69, train_loss: 0.3743, test_loss: 1.4617, test_f1: 0.6209
 epoch: 70, train_loss: 0.3702, test_loss: 1.5003, test_f1: 0.6064
 epoch: 71, train_loss: 0.3738, test_loss: 1.4599, test_f1: 0.6209
 epoch: 72, train_loss: 0.3645, test_loss: 1.5810, test_f1: 0.5972
 epoch: 73, train_loss: 0.3521, test_loss: 1.5185, test_f1: 0.6022
 epoch: 74, train_loss: 0.3521, test_loss: 1.5541, test_f1: 0.6072
 epoch: 75, train_loss: 0.3449, test_loss: 1.5811, test_f1: 0.5976
 epoch: 76, train_loss: 0.3402, test_loss: 1.6447, test_f1: 0.5896
 epoch: 77, train_loss: 0.3426, test_loss: 1.6925, test_f1: 0.6026
 epoch: 78, train_loss: 0.3241, test_loss: 1.6707, test_f1: 0.5926
 epoch: 79, train_loss: 0.3281, test_loss: 1.8272, test_f1: 0.5756
 epoch: 80, train_loss: 0.3249, test_loss: 1.6636, test_f1: 0.6009
 epoch: 81, train_loss: 0.3209, test_loss: 1.6557, test_f1: 0.5917
 epoch: 82, train_loss: 0.3270, test_loss: 1.7217, test_f1: 0.6009
 epoch: 83, train_loss: 0.3403, test_loss: 1.6377, test_f1: 0.5901
 epoch: 84, train_loss: 0.3142, test_loss: 1.7749, test_f1: 0.5911
 epoch: 85, train_loss: 0.3194, test_loss: 1.8144, test_f1: 0.5947
 epoch: 86, train_loss: 0.3207, test_loss: 1.7932, test_f1: 0.5846
 epoch: 87, train_loss: 0.3133, test_loss: 1.7859, test_f1: 0.5981
 epoch: 88, train_loss: 0.3224, test_loss: 1.6666, test_f1: 0.6014
 epoch: 89, train_loss: 0.3148, test_loss: 1.7185, test_f1: 0.5887
 epoch: 90, train_loss: 0.3012, test_loss: 1.7988, test_f1: 0.5862
 epoch: 91, train_loss: 0.2967, test_loss: 1.7237, test_f1: 0.6082
 epoch: 92, train_loss: 0.2981, test_loss: 1.8914, test_f1: 0.5946
 epoch: 93, train_loss: 0.2918, test_loss: 1.8299, test_f1: 0.6073
 epoch: 94, train_loss: 0.2880, test_loss: 1.9091, test_f1: 0.6032
 epoch: 95, train_loss: 0.2796, test_loss: 1.7715, test_f1: 0.5961
 epoch: 96, train_loss: 0.2921, test_loss: 1.7526, test_f1: 0.6085
 epoch: 97, train_loss: 0.2955, test_loss: 1.7095, test_f1: 0.6123
 epoch: 98, train_loss: 0.3001, test_loss: 1.8151, test_f1: 0.5997
 epoch: 99, train_loss: 0.2889, test_loss: 2.0534, test_f1: 0.5978
##################ITERATION #2 ****************************************
 epoch: 0, train_loss: 1.2183, test_loss: 1.2572, test_f1: 0.3620
 epoch: 1, train_loss: 1.1229, test_loss: 1.1705, test_f1: 0.4418
 epoch: 2, train_loss: 1.0782, test_loss: 1.1297, test_f1: 0.4346
 epoch: 3, train_loss: 1.0366, test_loss: 1.0919, test_f1: 0.5152
 epoch: 4, train_loss: 0.9978, test_loss: 1.0592, test_f1: 0.5470
 epoch: 5, train_loss: 0.9626, test_loss: 1.0225, test_f1: 0.5578
 epoch: 6, train_loss: 0.9296, test_loss: 0.9899, test_f1: 0.5831
 epoch: 7, train_loss: 0.9131, test_loss: 0.9800, test_f1: 0.5858
 epoch: 8, train_loss: 0.8847, test_loss: 0.9695, test_f1: 0.5964
 epoch: 9, train_loss: 0.8669, test_loss: 0.9529, test_f1: 0.5871
 epoch: 10, train_loss: 0.8417, test_loss: 0.9494, test_f1: 0.6118
 epoch: 11, train_loss: 0.8230, test_loss: 0.9487, test_f1: 0.6117
 epoch: 12, train_loss: 0.8012, test_loss: 0.9501, test_f1: 0.6149
 epoch: 13, train_loss: 0.7940, test_loss: 0.9585, test_f1: 0.6244
 epoch: 14, train_loss: 0.7759, test_loss: 0.9347, test_f1: 0.6280
 epoch: 15, train_loss: 0.7441, test_loss: 0.9634, test_f1: 0.6005
 epoch: 16, train_loss: 0.7471, test_loss: 0.9546, test_f1: 0.6241
 epoch: 17, train_loss: 0.7281, test_loss: 0.9644, test_f1: 0.6231
 epoch: 18, train_loss: 0.7171, test_loss: 1.0159, test_f1: 0.5994
 epoch: 19, train_loss: 0.7068, test_loss: 1.0130, test_f1: 0.5964
 epoch: 20, train_loss: 0.6931, test_loss: 1.0142, test_f1: 0.6468
 epoch: 21, train_loss: 0.6984, test_loss: 0.9802, test_f1: 0.6073
 epoch: 22, train_loss: 0.6815, test_loss: 1.0654, test_f1: 0.6244
 epoch: 23, train_loss: 0.6698, test_loss: 0.9993, test_f1: 0.6090
 epoch: 24, train_loss: 0.6602, test_loss: 1.0556, test_f1: 0.6361
 epoch: 25, train_loss: 0.6512, test_loss: 1.0616, test_f1: 0.6149
 epoch: 26, train_loss: 0.6514, test_loss: 1.0420, test_f1: 0.5938
 epoch: 27, train_loss: 0.6252, test_loss: 1.1296, test_f1: 0.6003
 epoch: 28, train_loss: 0.6326, test_loss: 1.0646, test_f1: 0.6304
 epoch: 29, train_loss: 0.6258, test_loss: 1.0578, test_f1: 0.6193
 epoch: 30, train_loss: 0.6025, test_loss: 1.0760, test_f1: 0.5881
 epoch: 31, train_loss: 0.5964, test_loss: 1.0955, test_f1: 0.6192
 epoch: 32, train_loss: 0.5917, test_loss: 1.1334, test_f1: 0.5854
 epoch: 33, train_loss: 0.5811, test_loss: 1.0432, test_f1: 0.6236
 epoch: 34, train_loss: 0.5788, test_loss: 1.1147, test_f1: 0.6289
 epoch: 35, train_loss: 0.5743, test_loss: 1.1663, test_f1: 0.6103
 epoch: 36, train_loss: 0.5619, test_loss: 1.1682, test_f1: 0.6007
 epoch: 37, train_loss: 0.5631, test_loss: 1.1200, test_f1: 0.6053
 epoch: 38, train_loss: 0.5465, test_loss: 1.2408, test_f1: 0.5800
 epoch: 39, train_loss: 0.5364, test_loss: 1.1693, test_f1: 0.5877
 epoch: 40, train_loss: 0.5537, test_loss: 1.1031, test_f1: 0.6050
 epoch: 41, train_loss: 0.5340, test_loss: 1.2471, test_f1: 0.5972
 epoch: 42, train_loss: 0.5276, test_loss: 1.1603, test_f1: 0.6013
 epoch: 43, train_loss: 0.5127, test_loss: 1.2882, test_f1: 0.6163
 epoch: 44, train_loss: 0.5187, test_loss: 1.2448, test_f1: 0.6148
 epoch: 45, train_loss: 0.5212, test_loss: 1.2396, test_f1: 0.6035
 epoch: 46, train_loss: 0.5068, test_loss: 1.1934, test_f1: 0.6020
 epoch: 47, train_loss: 0.4766, test_loss: 1.2779, test_f1: 0.6131
 epoch: 48, train_loss: 0.4877, test_loss: 1.2597, test_f1: 0.6082
 epoch: 49, train_loss: 0.4852, test_loss: 1.2797, test_f1: 0.6042
 epoch: 50, train_loss: 0.4801, test_loss: 1.1857, test_f1: 0.6156
 epoch: 51, train_loss: 0.4659, test_loss: 1.2089, test_f1: 0.6237
 epoch: 52, train_loss: 0.4382, test_loss: 1.2762, test_f1: 0.6129
 epoch: 53, train_loss: 0.4401, test_loss: 1.2800, test_f1: 0.6296
 epoch: 54, train_loss: 0.4435, test_loss: 1.3143, test_f1: 0.6152
 epoch: 55, train_loss: 0.4451, test_loss: 1.3619, test_f1: 0.6215
 epoch: 56, train_loss: 0.4407, test_loss: 1.2934, test_f1: 0.6253
 epoch: 57, train_loss: 0.4249, test_loss: 1.2664, test_f1: 0.6157
 epoch: 58, train_loss: 0.4115, test_loss: 1.2847, test_f1: 0.6195
 epoch: 59, train_loss: 0.4288, test_loss: 1.4456, test_f1: 0.6079
 epoch: 60, train_loss: 0.4092, test_loss: 1.3119, test_f1: 0.6269
 epoch: 61, train_loss: 0.4116, test_loss: 1.4209, test_f1: 0.6192
 epoch: 62, train_loss: 0.4127, test_loss: 1.3673, test_f1: 0.6175
 epoch: 63, train_loss: 0.4049, test_loss: 1.3810, test_f1: 0.6255
 epoch: 64, train_loss: 0.4175, test_loss: 1.3717, test_f1: 0.6266
 epoch: 65, train_loss: 0.4025, test_loss: 1.3869, test_f1: 0.6110
 epoch: 66, train_loss: 0.3908, test_loss: 1.3173, test_f1: 0.6171
 epoch: 67, train_loss: 0.3953, test_loss: 1.4032, test_f1: 0.6218
 epoch: 68, train_loss: 0.3929, test_loss: 1.4543, test_f1: 0.5979
 epoch: 69, train_loss: 0.3910, test_loss: 1.4266, test_f1: 0.6169
 epoch: 70, train_loss: 0.3942, test_loss: 1.4503, test_f1: 0.6108
 epoch: 71, train_loss: 0.3859, test_loss: 1.3909, test_f1: 0.6065
 epoch: 72, train_loss: 0.3669, test_loss: 1.5486, test_f1: 0.6359
 epoch: 73, train_loss: 0.3818, test_loss: 1.4704, test_f1: 0.6291
 epoch: 74, train_loss: 0.3623, test_loss: 1.4262, test_f1: 0.6287
 epoch: 75, train_loss: 0.3606, test_loss: 1.5045, test_f1: 0.6279
 epoch: 76, train_loss: 0.3442, test_loss: 1.3990, test_f1: 0.6107
 epoch: 77, train_loss: 0.3496, test_loss: 1.5020, test_f1: 0.6271
 epoch: 78, train_loss: 0.3628, test_loss: 1.4854, test_f1: 0.6126
 epoch: 79, train_loss: 0.3662, test_loss: 1.5443, test_f1: 0.6149
 epoch: 80, train_loss: 0.3589, test_loss: 1.5622, test_f1: 0.6112
 epoch: 81, train_loss: 0.3366, test_loss: 1.5924, test_f1: 0.6231
 epoch: 82, train_loss: 0.3515, test_loss: 1.5923, test_f1: 0.6333
 epoch: 83, train_loss: 0.3516, test_loss: 1.6690, test_f1: 0.6288
 epoch: 84, train_loss: 0.3483, test_loss: 1.5654, test_f1: 0.6175
 epoch: 85, train_loss: 0.3454, test_loss: 1.5777, test_f1: 0.6252
 epoch: 86, train_loss: 0.3405, test_loss: 1.6904, test_f1: 0.6018
 epoch: 87, train_loss: 0.3329, test_loss: 1.5753, test_f1: 0.6098
 epoch: 88, train_loss: 0.3343, test_loss: 1.5494, test_f1: 0.6079
 epoch: 89, train_loss: 0.3021, test_loss: 1.5966, test_f1: 0.6001
 epoch: 90, train_loss: 0.3181, test_loss: 1.6817, test_f1: 0.6034
 epoch: 91, train_loss: 0.3149, test_loss: 1.5960, test_f1: 0.6083
 epoch: 92, train_loss: 0.3471, test_loss: 1.6989, test_f1: 0.6292
 epoch: 93, train_loss: 0.3232, test_loss: 1.6149, test_f1: 0.6287
 epoch: 94, train_loss: 0.2970, test_loss: 1.6489, test_f1: 0.6116
 epoch: 95, train_loss: 0.3003, test_loss: 1.7427, test_f1: 0.6159
 epoch: 96, train_loss: 0.3207, test_loss: 1.7043, test_f1: 0.6112
 epoch: 97, train_loss: 0.3067, test_loss: 1.7324, test_f1: 0.6118
 epoch: 98, train_loss: 0.2983, test_loss: 1.7024, test_f1: 0.6029
 epoch: 99, train_loss: 0.3135, test_loss: 1.7614, test_f1: 0.5766
##################ITERATION #3 ****************************************
 epoch: 0, train_loss: 1.2057, test_loss: 1.2321, test_f1: 0.3237
 epoch: 1, train_loss: 1.0938, test_loss: 1.1171, test_f1: 0.4893
 epoch: 2, train_loss: 1.0395, test_loss: 1.0804, test_f1: 0.5273
 epoch: 3, train_loss: 0.9934, test_loss: 1.0414, test_f1: 0.5425
 epoch: 4, train_loss: 0.9539, test_loss: 1.0226, test_f1: 0.5554
 epoch: 5, train_loss: 0.9107, test_loss: 1.0028, test_f1: 0.5979
 epoch: 6, train_loss: 0.8816, test_loss: 0.9902, test_f1: 0.6112
 epoch: 7, train_loss: 0.8499, test_loss: 0.9796, test_f1: 0.5980
 epoch: 8, train_loss: 0.8342, test_loss: 0.9431, test_f1: 0.5983
 epoch: 9, train_loss: 0.8041, test_loss: 0.9817, test_f1: 0.5636
 epoch: 10, train_loss: 0.7836, test_loss: 0.9925, test_f1: 0.5783
 epoch: 11, train_loss: 0.7758, test_loss: 1.0037, test_f1: 0.5734
 epoch: 12, train_loss: 0.7505, test_loss: 0.9587, test_f1: 0.6038
 epoch: 13, train_loss: 0.7443, test_loss: 0.9502, test_f1: 0.5891
 epoch: 14, train_loss: 0.7266, test_loss: 0.9765, test_f1: 0.5562
 epoch: 15, train_loss: 0.7095, test_loss: 0.9745, test_f1: 0.6080
 epoch: 16, train_loss: 0.7253, test_loss: 1.0272, test_f1: 0.5699
 epoch: 17, train_loss: 0.6881, test_loss: 0.9849, test_f1: 0.5681
 epoch: 18, train_loss: 0.6775, test_loss: 1.0372, test_f1: 0.5819
 epoch: 19, train_loss: 0.6783, test_loss: 1.0828, test_f1: 0.5657
 epoch: 20, train_loss: 0.6713, test_loss: 0.9614, test_f1: 0.6368
 epoch: 21, train_loss: 0.6758, test_loss: 0.9361, test_f1: 0.6040
 epoch: 22, train_loss: 0.6487, test_loss: 0.9859, test_f1: 0.6096
 epoch: 23, train_loss: 0.6549, test_loss: 0.9800, test_f1: 0.5779
 epoch: 24, train_loss: 0.6379, test_loss: 1.0480, test_f1: 0.6077
 epoch: 25, train_loss: 0.6285, test_loss: 0.9890, test_f1: 0.6025
 epoch: 26, train_loss: 0.6256, test_loss: 0.9760, test_f1: 0.5988
 epoch: 27, train_loss: 0.6088, test_loss: 1.0497, test_f1: 0.5964
 epoch: 28, train_loss: 0.5835, test_loss: 1.0094, test_f1: 0.6090
 epoch: 29, train_loss: 0.5952, test_loss: 1.0116, test_f1: 0.6042
 epoch: 30, train_loss: 0.5801, test_loss: 1.0469, test_f1: 0.5653
 epoch: 31, train_loss: 0.5819, test_loss: 1.0596, test_f1: 0.5871
 epoch: 32, train_loss: 0.5584, test_loss: 1.0280, test_f1: 0.5837
 epoch: 33, train_loss: 0.5627, test_loss: 1.0185, test_f1: 0.5483
 epoch: 34, train_loss: 0.5452, test_loss: 1.0362, test_f1: 0.6097
 epoch: 35, train_loss: 0.5470, test_loss: 1.0399, test_f1: 0.6117
 epoch: 36, train_loss: 0.5572, test_loss: 1.1218, test_f1: 0.5928
 epoch: 37, train_loss: 0.5388, test_loss: 1.0800, test_f1: 0.6306
 epoch: 38, train_loss: 0.5348, test_loss: 1.0886, test_f1: 0.5611
 epoch: 39, train_loss: 0.5435, test_loss: 1.1078, test_f1: 0.5972
 epoch: 40, train_loss: 0.5112, test_loss: 1.1034, test_f1: 0.6463
 epoch: 41, train_loss: 0.5113, test_loss: 1.1110, test_f1: 0.5785
 epoch: 42, train_loss: 0.5007, test_loss: 1.1193, test_f1: 0.6046
 epoch: 43, train_loss: 0.5064, test_loss: 1.0940, test_f1: 0.5586
 epoch: 44, train_loss: 0.5023, test_loss: 1.1168, test_f1: 0.5854
 epoch: 45, train_loss: 0.4710, test_loss: 1.1977, test_f1: 0.5838
 epoch: 46, train_loss: 0.4697, test_loss: 1.2048, test_f1: 0.5874
 epoch: 47, train_loss: 0.4705, test_loss: 1.1430, test_f1: 0.6178
 epoch: 48, train_loss: 0.4644, test_loss: 1.2352, test_f1: 0.6030
 epoch: 49, train_loss: 0.4673, test_loss: 1.2478, test_f1: 0.5855
 epoch: 50, train_loss: 0.4605, test_loss: 1.5146, test_f1: 0.5820
 epoch: 51, train_loss: 0.4451, test_loss: 1.3109, test_f1: 0.5948
 epoch: 52, train_loss: 0.4373, test_loss: 1.3144, test_f1: 0.6044
 epoch: 53, train_loss: 0.4422, test_loss: 1.2830, test_f1: 0.5851
 epoch: 54, train_loss: 0.4159, test_loss: 1.3913, test_f1: 0.6005
 epoch: 55, train_loss: 0.4160, test_loss: 1.2891, test_f1: 0.6114
 epoch: 56, train_loss: 0.4076, test_loss: 1.2574, test_f1: 0.5901
 epoch: 57, train_loss: 0.4034, test_loss: 1.3564, test_f1: 0.6060
 epoch: 58, train_loss: 0.4096, test_loss: 1.2901, test_f1: 0.5962
 epoch: 59, train_loss: 0.3995, test_loss: 1.2849, test_f1: 0.5813
 epoch: 60, train_loss: 0.4144, test_loss: 1.4257, test_f1: 0.6100
 epoch: 61, train_loss: 0.3856, test_loss: 1.4296, test_f1: 0.6152
 epoch: 62, train_loss: 0.3930, test_loss: 1.3534, test_f1: 0.6206
 epoch: 63, train_loss: 0.4178, test_loss: 1.4494, test_f1: 0.6293
 epoch: 64, train_loss: 0.3865, test_loss: 1.3513, test_f1: 0.5998
 epoch: 65, train_loss: 0.3893, test_loss: 1.4126, test_f1: 0.6321
 epoch: 66, train_loss: 0.3884, test_loss: 1.5268, test_f1: 0.6147
 epoch: 67, train_loss: 0.3610, test_loss: 1.5093, test_f1: 0.5941
 epoch: 68, train_loss: 0.3485, test_loss: 1.4226, test_f1: 0.5874
 epoch: 69, train_loss: 0.3658, test_loss: 1.4477, test_f1: 0.6202
 epoch: 70, train_loss: 0.3598, test_loss: 1.5310, test_f1: 0.6128
 epoch: 71, train_loss: 0.3804, test_loss: 1.3661, test_f1: 0.6332
 epoch: 72, train_loss: 0.3451, test_loss: 1.4742, test_f1: 0.6276
 epoch: 73, train_loss: 0.3629, test_loss: 1.4889, test_f1: 0.6260
 epoch: 74, train_loss: 0.3736, test_loss: 1.5737, test_f1: 0.5836
 epoch: 75, train_loss: 0.3572, test_loss: 1.6698, test_f1: 0.6139
 epoch: 76, train_loss: 0.3494, test_loss: 1.6162, test_f1: 0.5901
 epoch: 77, train_loss: 0.3589, test_loss: 1.6054, test_f1: 0.6203
 epoch: 78, train_loss: 0.3366, test_loss: 1.5646, test_f1: 0.6070
 epoch: 79, train_loss: 0.3482, test_loss: 1.8209, test_f1: 0.6100
 epoch: 80, train_loss: 0.3464, test_loss: 1.6600, test_f1: 0.6250
 epoch: 81, train_loss: 0.3351, test_loss: 1.6176, test_f1: 0.6252
 epoch: 82, train_loss: 0.3146, test_loss: 1.6820, test_f1: 0.6247
 epoch: 83, train_loss: 0.3396, test_loss: 1.8399, test_f1: 0.6154
 epoch: 84, train_loss: 0.3262, test_loss: 1.6500, test_f1: 0.6065
 epoch: 85, train_loss: 0.3038, test_loss: 1.7149, test_f1: 0.6088
 epoch: 86, train_loss: 0.3038, test_loss: 1.7738, test_f1: 0.5921
 epoch: 87, train_loss: 0.3282, test_loss: 1.7487, test_f1: 0.6215
 epoch: 88, train_loss: 0.3231, test_loss: 1.8153, test_f1: 0.6154
 epoch: 89, train_loss: 0.3118, test_loss: 1.7358, test_f1: 0.6117
 epoch: 90, train_loss: 0.3132, test_loss: 1.7474, test_f1: 0.5807
 epoch: 91, train_loss: 0.3008, test_loss: 1.8438, test_f1: 0.5961
 epoch: 92, train_loss: 0.3209, test_loss: 1.9039, test_f1: 0.5998
 epoch: 93, train_loss: 0.3012, test_loss: 1.8404, test_f1: 0.6167
 epoch: 94, train_loss: 0.3071, test_loss: 1.8758, test_f1: 0.5829
 epoch: 95, train_loss: 0.3008, test_loss: 1.8186, test_f1: 0.5891
 epoch: 96, train_loss: 0.3034, test_loss: 1.6387, test_f1: 0.6168
 epoch: 97, train_loss: 0.2925, test_loss: 1.8297, test_f1: 0.5921
 epoch: 98, train_loss: 0.2859, test_loss: 1.9558, test_f1: 0.5967
 epoch: 99, train_loss: 0.2724, test_loss: 1.9812, test_f1: 0.6205
##################ITERATION #4 ****************************************
 epoch: 0, train_loss: 1.1916, test_loss: 1.2058, test_f1: 0.3654
 epoch: 1, train_loss: 1.0765, test_loss: 1.1024, test_f1: 0.5106
 epoch: 2, train_loss: 1.0033, test_loss: 1.0632, test_f1: 0.5329
 epoch: 3, train_loss: 0.9778, test_loss: 1.0415, test_f1: 0.5400
 epoch: 4, train_loss: 0.9428, test_loss: 0.9999, test_f1: 0.5705
 epoch: 5, train_loss: 0.9182, test_loss: 1.0083, test_f1: 0.5301
 epoch: 6, train_loss: 0.8960, test_loss: 0.9818, test_f1: 0.5550
 epoch: 7, train_loss: 0.8764, test_loss: 0.9557, test_f1: 0.5628
 epoch: 8, train_loss: 0.8436, test_loss: 0.9873, test_f1: 0.5749
 epoch: 9, train_loss: 0.8220, test_loss: 0.9836, test_f1: 0.5430
 epoch: 10, train_loss: 0.8097, test_loss: 0.9587, test_f1: 0.5786
 epoch: 11, train_loss: 0.7939, test_loss: 0.9779, test_f1: 0.5609
 epoch: 12, train_loss: 0.7743, test_loss: 0.9821, test_f1: 0.5484
 epoch: 13, train_loss: 0.7513, test_loss: 1.0151, test_f1: 0.5636
 epoch: 14, train_loss: 0.7420, test_loss: 1.0311, test_f1: 0.5449
 epoch: 15, train_loss: 0.7384, test_loss: 0.9872, test_f1: 0.5476
 epoch: 16, train_loss: 0.7276, test_loss: 0.9772, test_f1: 0.5811
 epoch: 17, train_loss: 0.6873, test_loss: 1.0215, test_f1: 0.6010
 epoch: 18, train_loss: 0.7041, test_loss: 1.0387, test_f1: 0.5724
 epoch: 19, train_loss: 0.6919, test_loss: 1.0338, test_f1: 0.5979
 epoch: 20, train_loss: 0.6673, test_loss: 1.0900, test_f1: 0.5879
 epoch: 21, train_loss: 0.6636, test_loss: 1.0780, test_f1: 0.5728
 epoch: 22, train_loss: 0.6502, test_loss: 1.0549, test_f1: 0.6005
 epoch: 23, train_loss: 0.6452, test_loss: 1.0321, test_f1: 0.5613
 epoch: 24, train_loss: 0.6250, test_loss: 1.0896, test_f1: 0.5905
 epoch: 25, train_loss: 0.6222, test_loss: 1.1512, test_f1: 0.5709
 epoch: 26, train_loss: 0.6179, test_loss: 1.0599, test_f1: 0.5830
 epoch: 27, train_loss: 0.5946, test_loss: 1.1619, test_f1: 0.5886
 epoch: 28, train_loss: 0.5990, test_loss: 1.2595, test_f1: 0.5778
 epoch: 29, train_loss: 0.5858, test_loss: 1.1039, test_f1: 0.5545
 epoch: 30, train_loss: 0.5743, test_loss: 1.2651, test_f1: 0.5679
 epoch: 31, train_loss: 0.5830, test_loss: 1.2134, test_f1: 0.5732
 epoch: 32, train_loss: 0.5565, test_loss: 1.2007, test_f1: 0.5773
 epoch: 33, train_loss: 0.5439, test_loss: 1.2068, test_f1: 0.5870
 epoch: 34, train_loss: 0.5423, test_loss: 1.1818, test_f1: 0.5794
 epoch: 35, train_loss: 0.5403, test_loss: 1.3154, test_f1: 0.5776
 epoch: 36, train_loss: 0.5426, test_loss: 1.2191, test_f1: 0.5804
 epoch: 37, train_loss: 0.5502, test_loss: 1.2993, test_f1: 0.5849
 epoch: 38, train_loss: 0.5376, test_loss: 1.3291, test_f1: 0.5810
 epoch: 39, train_loss: 0.5314, test_loss: 1.3695, test_f1: 0.5974
 epoch: 40, train_loss: 0.5276, test_loss: 1.2610, test_f1: 0.5986
 epoch: 41, train_loss: 0.5210, test_loss: 1.3249, test_f1: 0.5839
 epoch: 42, train_loss: 0.4789, test_loss: 1.4202, test_f1: 0.5668
 epoch: 43, train_loss: 0.5007, test_loss: 1.3090, test_f1: 0.5925
 epoch: 44, train_loss: 0.4686, test_loss: 1.3747, test_f1: 0.5588
 epoch: 45, train_loss: 0.4849, test_loss: 1.4694, test_f1: 0.5750
 epoch: 46, train_loss: 0.4794, test_loss: 1.4230, test_f1: 0.5836
 epoch: 47, train_loss: 0.4719, test_loss: 1.4806, test_f1: 0.5965
 epoch: 48, train_loss: 0.4679, test_loss: 1.4675, test_f1: 0.5904
 epoch: 49, train_loss: 0.4398, test_loss: 1.3929, test_f1: 0.6047
 epoch: 50, train_loss: 0.4576, test_loss: 1.4582, test_f1: 0.6177
 epoch: 51, train_loss: 0.4304, test_loss: 1.4336, test_f1: 0.5941
 epoch: 52, train_loss: 0.4185, test_loss: 1.5497, test_f1: 0.5842
 epoch: 53, train_loss: 0.4151, test_loss: 1.5419, test_f1: 0.5717
 epoch: 54, train_loss: 0.4098, test_loss: 1.5318, test_f1: 0.5769
 epoch: 55, train_loss: 0.4079, test_loss: 1.5528, test_f1: 0.5794
 epoch: 56, train_loss: 0.3969, test_loss: 1.5896, test_f1: 0.5843
 epoch: 57, train_loss: 0.4039, test_loss: 1.5488, test_f1: 0.5797
 epoch: 58, train_loss: 0.4265, test_loss: 1.5469, test_f1: 0.5884
 epoch: 59, train_loss: 0.3977, test_loss: 1.6233, test_f1: 0.6051
 epoch: 60, train_loss: 0.3776, test_loss: 1.5720, test_f1: 0.5928
 epoch: 61, train_loss: 0.3729, test_loss: 1.6129, test_f1: 0.5953
 epoch: 62, train_loss: 0.3678, test_loss: 1.5813, test_f1: 0.5869
 epoch: 63, train_loss: 0.3849, test_loss: 1.6201, test_f1: 0.5814
 epoch: 64, train_loss: 0.3940, test_loss: 1.6338, test_f1: 0.5896
 epoch: 65, train_loss: 0.3660, test_loss: 1.6265, test_f1: 0.6116
 epoch: 66, train_loss: 0.3809, test_loss: 1.6804, test_f1: 0.5692
 epoch: 67, train_loss: 0.3550, test_loss: 1.6684, test_f1: 0.6005
 epoch: 68, train_loss: 0.3700, test_loss: 1.6263, test_f1: 0.5908
 epoch: 69, train_loss: 0.3522, test_loss: 1.6242, test_f1: 0.6015
 epoch: 70, train_loss: 0.3574, test_loss: 1.7524, test_f1: 0.6004
 epoch: 71, train_loss: 0.3586, test_loss: 1.6904, test_f1: 0.6221
 epoch: 72, train_loss: 0.3757, test_loss: 1.6953, test_f1: 0.5865
 epoch: 73, train_loss: 0.3501, test_loss: 1.7045, test_f1: 0.5981
 epoch: 74, train_loss: 0.3499, test_loss: 1.7545, test_f1: 0.5982
 epoch: 75, train_loss: 0.3621, test_loss: 1.7408, test_f1: 0.5951
 epoch: 76, train_loss: 0.3412, test_loss: 1.6999, test_f1: 0.6077
 epoch: 77, train_loss: 0.3273, test_loss: 1.7732, test_f1: 0.6068
 epoch: 78, train_loss: 0.3285, test_loss: 1.7262, test_f1: 0.6226
 epoch: 79, train_loss: 0.3229, test_loss: 1.8254, test_f1: 0.5892
 epoch: 80, train_loss: 0.3173, test_loss: 1.7643, test_f1: 0.6036
 epoch: 81, train_loss: 0.3340, test_loss: 1.8108, test_f1: 0.6028
 epoch: 82, train_loss: 0.3251, test_loss: 1.7512, test_f1: 0.5991
 epoch: 83, train_loss: 0.3230, test_loss: 1.7578, test_f1: 0.5985
 epoch: 84, train_loss: 0.3135, test_loss: 1.8616, test_f1: 0.5921
 epoch: 85, train_loss: 0.3185, test_loss: 1.8262, test_f1: 0.6014
 epoch: 86, train_loss: 0.3160, test_loss: 1.8413, test_f1: 0.6068
 epoch: 87, train_loss: 0.3050, test_loss: 1.7963, test_f1: 0.6075
 epoch: 88, train_loss: 0.3038, test_loss: 1.8178, test_f1: 0.6089
 epoch: 89, train_loss: 0.2922, test_loss: 1.8867, test_f1: 0.5985
 epoch: 90, train_loss: 0.3019, test_loss: 1.7518, test_f1: 0.6123
 epoch: 91, train_loss: 0.2977, test_loss: 1.8617, test_f1: 0.5939
 epoch: 92, train_loss: 0.2973, test_loss: 1.8989, test_f1: 0.6032
 epoch: 93, train_loss: 0.2931, test_loss: 1.9224, test_f1: 0.6043
 epoch: 94, train_loss: 0.3097, test_loss: 1.9178, test_f1: 0.6005
 epoch: 95, train_loss: 0.2901, test_loss: 1.9197, test_f1: 0.6043
 epoch: 96, train_loss: 0.2919, test_loss: 1.8624, test_f1: 0.6121
 epoch: 97, train_loss: 0.2862, test_loss: 1.8982, test_f1: 0.5922
 epoch: 98, train_loss: 0.2668, test_loss: 1.9783, test_f1: 0.6140
 epoch: 99, train_loss: 0.2707, test_loss: 1.9552, test_f1: 0.6100
##################ITERATION #5 ****************************************
 epoch: 0, train_loss: 1.1878, test_loss: 1.2598, test_f1: 0.2730
 epoch: 1, train_loss: 1.0698, test_loss: 1.0965, test_f1: 0.5061
 epoch: 2, train_loss: 1.0199, test_loss: 1.0629, test_f1: 0.5196
 epoch: 3, train_loss: 0.9930, test_loss: 1.0370, test_f1: 0.5658
 epoch: 4, train_loss: 0.9427, test_loss: 1.0190, test_f1: 0.5618
 epoch: 5, train_loss: 0.9171, test_loss: 1.0198, test_f1: 0.5835
 epoch: 6, train_loss: 0.8898, test_loss: 0.9987, test_f1: 0.5778
 epoch: 7, train_loss: 0.8606, test_loss: 1.0063, test_f1: 0.5671
 epoch: 8, train_loss: 0.8428, test_loss: 1.0103, test_f1: 0.5661
 epoch: 9, train_loss: 0.8206, test_loss: 1.0198, test_f1: 0.5380
 epoch: 10, train_loss: 0.8257, test_loss: 0.9726, test_f1: 0.6079
 epoch: 11, train_loss: 0.7965, test_loss: 1.0002, test_f1: 0.5513
 epoch: 12, train_loss: 0.7952, test_loss: 1.0118, test_f1: 0.6008
 epoch: 13, train_loss: 0.7607, test_loss: 0.9827, test_f1: 0.6616
 epoch: 14, train_loss: 0.7632, test_loss: 0.9932, test_f1: 0.6077
 epoch: 15, train_loss: 0.7488, test_loss: 1.0379, test_f1: 0.5670
 epoch: 16, train_loss: 0.7358, test_loss: 0.9614, test_f1: 0.6446
 epoch: 17, train_loss: 0.7246, test_loss: 0.9893, test_f1: 0.6462
 epoch: 18, train_loss: 0.7243, test_loss: 1.0218, test_f1: 0.6046
 epoch: 19, train_loss: 0.7076, test_loss: 1.0126, test_f1: 0.5971
 epoch: 20, train_loss: 0.7019, test_loss: 1.0507, test_f1: 0.6467
 epoch: 21, train_loss: 0.6809, test_loss: 1.0572, test_f1: 0.5997
 epoch: 22, train_loss: 0.6834, test_loss: 0.9961, test_f1: 0.6254
 epoch: 23, train_loss: 0.6811, test_loss: 1.0439, test_f1: 0.5956
 epoch: 24, train_loss: 0.6666, test_loss: 1.0427, test_f1: 0.6007
 epoch: 25, train_loss: 0.6650, test_loss: 1.1012, test_f1: 0.5947
 epoch: 26, train_loss: 0.6521, test_loss: 1.0136, test_f1: 0.6379
 epoch: 27, train_loss: 0.6497, test_loss: 1.0106, test_f1: 0.6553
 epoch: 28, train_loss: 0.6354, test_loss: 1.0700, test_f1: 0.6340
 epoch: 29, train_loss: 0.6189, test_loss: 1.0415, test_f1: 0.6554
 epoch: 30, train_loss: 0.6345, test_loss: 1.0359, test_f1: 0.6582
 epoch: 31, train_loss: 0.6109, test_loss: 1.0486, test_f1: 0.6172
 epoch: 32, train_loss: 0.5894, test_loss: 1.0257, test_f1: 0.6369
 epoch: 33, train_loss: 0.6007, test_loss: 1.0830, test_f1: 0.6203
 epoch: 34, train_loss: 0.5942, test_loss: 1.0476, test_f1: 0.6536
 epoch: 35, train_loss: 0.5621, test_loss: 1.1244, test_f1: 0.5993
 epoch: 36, train_loss: 0.6060, test_loss: 1.0989, test_f1: 0.6077
 epoch: 37, train_loss: 0.5710, test_loss: 1.0945, test_f1: 0.6221
 epoch: 38, train_loss: 0.5730, test_loss: 1.0631, test_f1: 0.6060
 epoch: 39, train_loss: 0.5672, test_loss: 1.0786, test_f1: 0.6397
 epoch: 40, train_loss: 0.5449, test_loss: 1.1442, test_f1: 0.6085
 epoch: 41, train_loss: 0.5620, test_loss: 1.1886, test_f1: 0.6273
 epoch: 42, train_loss: 0.5481, test_loss: 1.0751, test_f1: 0.6569
 epoch: 43, train_loss: 0.5618, test_loss: 1.1652, test_f1: 0.6245
 epoch: 44, train_loss: 0.5383, test_loss: 1.1095, test_f1: 0.6608
 epoch: 45, train_loss: 0.5272, test_loss: 1.1755, test_f1: 0.6361
 epoch: 46, train_loss: 0.5327, test_loss: 1.1403, test_f1: 0.6254
 epoch: 47, train_loss: 0.5014, test_loss: 1.1632, test_f1: 0.6444
 epoch: 48, train_loss: 0.4955, test_loss: 1.1876, test_f1: 0.6381
 epoch: 49, train_loss: 0.4989, test_loss: 1.1587, test_f1: 0.6297
 epoch: 50, train_loss: 0.4984, test_loss: 1.2695, test_f1: 0.6268
 epoch: 51, train_loss: 0.4594, test_loss: 1.2117, test_f1: 0.6642
 epoch: 52, train_loss: 0.4653, test_loss: 1.2865, test_f1: 0.6429
 epoch: 53, train_loss: 0.4489, test_loss: 1.2173, test_f1: 0.6565
 epoch: 54, train_loss: 0.4510, test_loss: 1.2534, test_f1: 0.6449
 epoch: 55, train_loss: 0.4779, test_loss: 1.2067, test_f1: 0.6495
 epoch: 56, train_loss: 0.4526, test_loss: 1.1942, test_f1: 0.6555
 epoch: 57, train_loss: 0.4342, test_loss: 1.3118, test_f1: 0.6353
 epoch: 58, train_loss: 0.4821, test_loss: 1.2882, test_f1: 0.6396
 epoch: 59, train_loss: 0.4471, test_loss: 1.2494, test_f1: 0.6769
 epoch: 60, train_loss: 0.4330, test_loss: 1.3313, test_f1: 0.6276
 epoch: 61, train_loss: 0.4366, test_loss: 1.3160, test_f1: 0.6352
 epoch: 62, train_loss: 0.4196, test_loss: 1.3249, test_f1: 0.6405
 epoch: 63, train_loss: 0.4464, test_loss: 1.2810, test_f1: 0.6517
 epoch: 64, train_loss: 0.4212, test_loss: 1.3431, test_f1: 0.6566
 epoch: 65, train_loss: 0.4183, test_loss: 1.3700, test_f1: 0.6319
 epoch: 66, train_loss: 0.4401, test_loss: 1.3718, test_f1: 0.6323
 epoch: 67, train_loss: 0.4260, test_loss: 1.3307, test_f1: 0.6397
 epoch: 68, train_loss: 0.4025, test_loss: 1.3191, test_f1: 0.6469
 epoch: 69, train_loss: 0.4236, test_loss: 1.4003, test_f1: 0.6423
 epoch: 70, train_loss: 0.4123, test_loss: 1.3173, test_f1: 0.6573
 epoch: 71, train_loss: 0.4042, test_loss: 1.4059, test_f1: 0.6491
 epoch: 72, train_loss: 0.4082, test_loss: 1.3410, test_f1: 0.6558
 epoch: 73, train_loss: 0.3962, test_loss: 1.4624, test_f1: 0.6367
 epoch: 74, train_loss: 0.3926, test_loss: 1.4344, test_f1: 0.6342
 epoch: 75, train_loss: 0.3893, test_loss: 1.4221, test_f1: 0.6356
 epoch: 76, train_loss: 0.4063, test_loss: 1.4421, test_f1: 0.6377
 epoch: 77, train_loss: 0.3972, test_loss: 1.4540, test_f1: 0.6508
 epoch: 78, train_loss: 0.4150, test_loss: 1.4743, test_f1: 0.6402
 epoch: 79, train_loss: 0.3899, test_loss: 1.3394, test_f1: 0.6738
 epoch: 80, train_loss: 0.3970, test_loss: 1.5058, test_f1: 0.6466
 epoch: 81, train_loss: 0.3753, test_loss: 1.5209, test_f1: 0.6253
 epoch: 82, train_loss: 0.3941, test_loss: 1.4204, test_f1: 0.6598
 epoch: 83, train_loss: 0.3709, test_loss: 1.4538, test_f1: 0.6475
 epoch: 84, train_loss: 0.3611, test_loss: 1.5414, test_f1: 0.6343
 epoch: 85, train_loss: 0.3426, test_loss: 1.4571, test_f1: 0.6475
 epoch: 86, train_loss: 0.3485, test_loss: 1.5011, test_f1: 0.6328
 epoch: 87, train_loss: 0.3565, test_loss: 1.6490, test_f1: 0.6202
 epoch: 88, train_loss: 0.3482, test_loss: 1.4816, test_f1: 0.6566
 epoch: 89, train_loss: 0.3757, test_loss: 1.4842, test_f1: 0.6559
 epoch: 90, train_loss: 0.3774, test_loss: 1.6520, test_f1: 0.6224
 epoch: 91, train_loss: 0.3494, test_loss: 1.6431, test_f1: 0.6243
 epoch: 92, train_loss: 0.3520, test_loss: 1.5167, test_f1: 0.6425
 epoch: 93, train_loss: 0.3703, test_loss: 1.5348, test_f1: 0.6511
 epoch: 94, train_loss: 0.3389, test_loss: 1.5637, test_f1: 0.6523
 epoch: 95, train_loss: 0.3509, test_loss: 1.4547, test_f1: 0.6714
 epoch: 96, train_loss: 0.3320, test_loss: 1.6852, test_f1: 0.6146
 epoch: 97, train_loss: 0.3300, test_loss: 1.5856, test_f1: 0.6414
 epoch: 98, train_loss: 0.3361, test_loss: 1.5992, test_f1: 0.6490
 epoch: 99, train_loss: 0.3230, test_loss: 1.6392, test_f1: 0.6315
##################ITERATION #6 ****************************************
 epoch: 0, train_loss: 1.2221, test_loss: 1.2323, test_f1: 0.4171
 epoch: 1, train_loss: 1.0727, test_loss: 1.1304, test_f1: 0.5334
 epoch: 2, train_loss: 1.0394, test_loss: 1.0965, test_f1: 0.5520
 epoch: 3, train_loss: 0.9830, test_loss: 1.0528, test_f1: 0.5605
 epoch: 4, train_loss: 0.9642, test_loss: 1.0301, test_f1: 0.5761
 epoch: 5, train_loss: 0.9284, test_loss: 1.0385, test_f1: 0.5507
 epoch: 6, train_loss: 0.8999, test_loss: 0.9903, test_f1: 0.5850
 epoch: 7, train_loss: 0.8885, test_loss: 0.9887, test_f1: 0.5548
 epoch: 8, train_loss: 0.8714, test_loss: 0.9867, test_f1: 0.5786
 epoch: 9, train_loss: 0.8377, test_loss: 0.9677, test_f1: 0.6133
 epoch: 10, train_loss: 0.8198, test_loss: 0.9955, test_f1: 0.5887
 epoch: 11, train_loss: 0.8165, test_loss: 0.9623, test_f1: 0.6006
 epoch: 12, train_loss: 0.8104, test_loss: 0.9598, test_f1: 0.6167
 epoch: 13, train_loss: 0.7945, test_loss: 0.9664, test_f1: 0.6116
 epoch: 14, train_loss: 0.7758, test_loss: 0.9536, test_f1: 0.6171
 epoch: 15, train_loss: 0.7615, test_loss: 0.9607, test_f1: 0.5953
 epoch: 16, train_loss: 0.7463, test_loss: 0.9590, test_f1: 0.6249
 epoch: 17, train_loss: 0.7282, test_loss: 0.9523, test_f1: 0.6110
 epoch: 18, train_loss: 0.7213, test_loss: 0.9709, test_f1: 0.5994
 epoch: 19, train_loss: 0.7056, test_loss: 0.9529, test_f1: 0.6263
 epoch: 20, train_loss: 0.7056, test_loss: 0.9660, test_f1: 0.6152
 epoch: 21, train_loss: 0.6950, test_loss: 1.0155, test_f1: 0.6426
 epoch: 22, train_loss: 0.6850, test_loss: 0.9891, test_f1: 0.6402
 epoch: 23, train_loss: 0.6910, test_loss: 0.9358, test_f1: 0.6117
 epoch: 24, train_loss: 0.6602, test_loss: 0.9377, test_f1: 0.6326
 epoch: 25, train_loss: 0.6617, test_loss: 0.9747, test_f1: 0.6435
 epoch: 26, train_loss: 0.6601, test_loss: 0.9326, test_f1: 0.6403
 epoch: 27, train_loss: 0.6475, test_loss: 1.0430, test_f1: 0.6189
 epoch: 28, train_loss: 0.6202, test_loss: 0.9655, test_f1: 0.6253
 epoch: 29, train_loss: 0.6459, test_loss: 1.0154, test_f1: 0.6259
 epoch: 30, train_loss: 0.6148, test_loss: 0.9971, test_f1: 0.6341
 epoch: 31, train_loss: 0.6069, test_loss: 1.0264, test_f1: 0.6222
 epoch: 32, train_loss: 0.6022, test_loss: 0.9735, test_f1: 0.6376
 epoch: 33, train_loss: 0.5936, test_loss: 0.9982, test_f1: 0.6357
 epoch: 34, train_loss: 0.5760, test_loss: 1.0124, test_f1: 0.6491
 epoch: 35, train_loss: 0.5638, test_loss: 1.0481, test_f1: 0.6356
 epoch: 36, train_loss: 0.5902, test_loss: 1.0665, test_f1: 0.6239
 epoch: 37, train_loss: 0.5769, test_loss: 0.9732, test_f1: 0.6445
 epoch: 38, train_loss: 0.5518, test_loss: 0.9793, test_f1: 0.6465
 epoch: 39, train_loss: 0.5583, test_loss: 1.1265, test_f1: 0.6277
 epoch: 40, train_loss: 0.5621, test_loss: 1.0523, test_f1: 0.6381
 epoch: 41, train_loss: 0.5555, test_loss: 1.2073, test_f1: 0.6080
 epoch: 42, train_loss: 0.5398, test_loss: 1.0964, test_f1: 0.6330
 epoch: 43, train_loss: 0.5453, test_loss: 1.1071, test_f1: 0.6533
 epoch: 44, train_loss: 0.5337, test_loss: 1.1486, test_f1: 0.6907
 epoch: 45, train_loss: 0.5135, test_loss: 1.1709, test_f1: 0.6440
 epoch: 46, train_loss: 0.5082, test_loss: 1.0642, test_f1: 0.6608
 epoch: 47, train_loss: 0.5111, test_loss: 1.1398, test_f1: 0.6467
 epoch: 48, train_loss: 0.5269, test_loss: 1.1777, test_f1: 0.6291
 epoch: 49, train_loss: 0.5035, test_loss: 1.2534, test_f1: 0.6384
 epoch: 50, train_loss: 0.4896, test_loss: 1.1348, test_f1: 0.6430
 epoch: 51, train_loss: 0.4725, test_loss: 1.2122, test_f1: 0.6085
 epoch: 52, train_loss: 0.4637, test_loss: 1.1628, test_f1: 0.6487
 epoch: 53, train_loss: 0.4608, test_loss: 1.1524, test_f1: 0.6320
 epoch: 54, train_loss: 0.4597, test_loss: 1.2027, test_f1: 0.6215
 epoch: 55, train_loss: 0.4910, test_loss: 1.1366, test_f1: 0.6436
 epoch: 56, train_loss: 0.4473, test_loss: 1.1358, test_f1: 0.6437
 epoch: 57, train_loss: 0.4424, test_loss: 1.2083, test_f1: 0.6593
 epoch: 58, train_loss: 0.4460, test_loss: 1.2559, test_f1: 0.6188
 epoch: 59, train_loss: 0.4526, test_loss: 1.1699, test_f1: 0.6446
 epoch: 60, train_loss: 0.4293, test_loss: 1.1978, test_f1: 0.6389
 epoch: 61, train_loss: 0.4284, test_loss: 1.1969, test_f1: 0.6289
 epoch: 62, train_loss: 0.4293, test_loss: 1.1893, test_f1: 0.6667
 epoch: 63, train_loss: 0.4419, test_loss: 1.2248, test_f1: 0.6562
 epoch: 64, train_loss: 0.4271, test_loss: 1.2167, test_f1: 0.6307
 epoch: 65, train_loss: 0.4066, test_loss: 1.1667, test_f1: 0.6487
 epoch: 66, train_loss: 0.4223, test_loss: 1.2387, test_f1: 0.6429
 epoch: 67, train_loss: 0.4084, test_loss: 1.1568, test_f1: 0.6428
 epoch: 68, train_loss: 0.3973, test_loss: 1.2305, test_f1: 0.6563
 epoch: 69, train_loss: 0.3910, test_loss: 1.2518, test_f1: 0.6586
 epoch: 70, train_loss: 0.4035, test_loss: 1.2600, test_f1: 0.6419
 epoch: 71, train_loss: 0.3827, test_loss: 1.3025, test_f1: 0.6422
 epoch: 72, train_loss: 0.4252, test_loss: 1.3302, test_f1: 0.6536
 epoch: 73, train_loss: 0.4071, test_loss: 1.3509, test_f1: 0.6185
 epoch: 74, train_loss: 0.3949, test_loss: 1.2795, test_f1: 0.6426
 epoch: 75, train_loss: 0.4108, test_loss: 1.2011, test_f1: 0.6423
 epoch: 76, train_loss: 0.3872, test_loss: 1.3227, test_f1: 0.6301
 epoch: 77, train_loss: 0.3921, test_loss: 1.2877, test_f1: 0.6227
 epoch: 78, train_loss: 0.3790, test_loss: 1.2679, test_f1: 0.6527
 epoch: 79, train_loss: 0.3839, test_loss: 1.2674, test_f1: 0.6387
 epoch: 80, train_loss: 0.3953, test_loss: 1.4243, test_f1: 0.6636
 epoch: 81, train_loss: 0.3753, test_loss: 1.3778, test_f1: 0.6424
 epoch: 82, train_loss: 0.4056, test_loss: 1.3239, test_f1: 0.6382
 epoch: 83, train_loss: 0.3696, test_loss: 1.3391, test_f1: 0.6443
 epoch: 84, train_loss: 0.3742, test_loss: 1.3708, test_f1: 0.6640
 epoch: 85, train_loss: 0.3652, test_loss: 1.3484, test_f1: 0.6173
 epoch: 86, train_loss: 0.3678, test_loss: 1.4090, test_f1: 0.6511
 epoch: 87, train_loss: 0.3704, test_loss: 1.4822, test_f1: 0.6315
 epoch: 88, train_loss: 0.3536, test_loss: 1.4572, test_f1: 0.6321
 epoch: 89, train_loss: 0.3492, test_loss: 1.4496, test_f1: 0.6403
 epoch: 90, train_loss: 0.3572, test_loss: 1.4181, test_f1: 0.6306
 epoch: 91, train_loss: 0.3480, test_loss: 1.4822, test_f1: 0.6070
 epoch: 92, train_loss: 0.3580, test_loss: 1.4834, test_f1: 0.6444
 epoch: 93, train_loss: 0.3449, test_loss: 1.5045, test_f1: 0.6170
 epoch: 94, train_loss: 0.3276, test_loss: 1.4741, test_f1: 0.6355
 epoch: 95, train_loss: 0.3439, test_loss: 1.5280, test_f1: 0.6381
 epoch: 96, train_loss: 0.3488, test_loss: 1.4490, test_f1: 0.6293
 epoch: 97, train_loss: 0.3372, test_loss: 1.5550, test_f1: 0.6143
 epoch: 98, train_loss: 0.3473, test_loss: 1.4990, test_f1: 0.6222
 epoch: 99, train_loss: 0.3265, test_loss: 1.5110, test_f1: 0.6374
##################ITERATION #7 ****************************************
 epoch: 0, train_loss: 1.2234, test_loss: 1.2731, test_f1: 0.2398
 epoch: 1, train_loss: 1.0610, test_loss: 1.1662, test_f1: 0.5348
 epoch: 2, train_loss: 1.0016, test_loss: 1.1287, test_f1: 0.5223
 epoch: 3, train_loss: 0.9763, test_loss: 1.1052, test_f1: 0.5380
 epoch: 4, train_loss: 0.9576, test_loss: 1.1253, test_f1: 0.5322
 epoch: 5, train_loss: 0.9377, test_loss: 1.0978, test_f1: 0.5150
 epoch: 6, train_loss: 0.9012, test_loss: 1.1161, test_f1: 0.5490
 epoch: 7, train_loss: 0.8657, test_loss: 1.0804, test_f1: 0.5434
 epoch: 8, train_loss: 0.8482, test_loss: 1.1120, test_f1: 0.5442
 epoch: 9, train_loss: 0.8508, test_loss: 1.0696, test_f1: 0.5411
 epoch: 10, train_loss: 0.8207, test_loss: 1.0633, test_f1: 0.5425
 epoch: 11, train_loss: 0.8004, test_loss: 1.0493, test_f1: 0.5691
 epoch: 12, train_loss: 0.7760, test_loss: 1.0616, test_f1: 0.5202
 epoch: 13, train_loss: 0.7701, test_loss: 1.0948, test_f1: 0.5484
 epoch: 14, train_loss: 0.7547, test_loss: 1.0306, test_f1: 0.5898
 epoch: 15, train_loss: 0.7484, test_loss: 1.0350, test_f1: 0.5898
 epoch: 16, train_loss: 0.7263, test_loss: 1.0872, test_f1: 0.5850
 epoch: 17, train_loss: 0.7217, test_loss: 1.1286, test_f1: 0.5982
 epoch: 18, train_loss: 0.7181, test_loss: 1.0700, test_f1: 0.5770
 epoch: 19, train_loss: 0.7038, test_loss: 1.0791, test_f1: 0.5592
 epoch: 20, train_loss: 0.6881, test_loss: 1.1511, test_f1: 0.5833
 epoch: 21, train_loss: 0.6840, test_loss: 1.1478, test_f1: 0.5760
 epoch: 22, train_loss: 0.6823, test_loss: 1.1298, test_f1: 0.5994
 epoch: 23, train_loss: 0.6638, test_loss: 1.1365, test_f1: 0.5737
 epoch: 24, train_loss: 0.6643, test_loss: 1.1328, test_f1: 0.5949
 epoch: 25, train_loss: 0.6561, test_loss: 1.1653, test_f1: 0.5694
 epoch: 26, train_loss: 0.6265, test_loss: 1.1948, test_f1: 0.6063
 epoch: 27, train_loss: 0.6289, test_loss: 1.1319, test_f1: 0.5855
 epoch: 28, train_loss: 0.6338, test_loss: 1.2268, test_f1: 0.5746
 epoch: 29, train_loss: 0.6077, test_loss: 1.1834, test_f1: 0.5943
 epoch: 30, train_loss: 0.6163, test_loss: 1.1977, test_f1: 0.6060
 epoch: 31, train_loss: 0.5946, test_loss: 1.3092, test_f1: 0.5687
 epoch: 32, train_loss: 0.6160, test_loss: 1.2533, test_f1: 0.5874
 epoch: 33, train_loss: 0.5818, test_loss: 1.2715, test_f1: 0.5995
 epoch: 34, train_loss: 0.5766, test_loss: 1.3443, test_f1: 0.5940
 epoch: 35, train_loss: 0.5713, test_loss: 1.2418, test_f1: 0.6082
 epoch: 36, train_loss: 0.5629, test_loss: 1.3065, test_f1: 0.5939
 epoch: 37, train_loss: 0.5474, test_loss: 1.2187, test_f1: 0.6401
 epoch: 38, train_loss: 0.5424, test_loss: 1.3034, test_f1: 0.6163
 epoch: 39, train_loss: 0.5245, test_loss: 1.3235, test_f1: 0.6457
 epoch: 40, train_loss: 0.5508, test_loss: 1.3590, test_f1: 0.6093
 epoch: 41, train_loss: 0.5282, test_loss: 1.3468, test_f1: 0.5905
 epoch: 42, train_loss: 0.5198, test_loss: 1.3055, test_f1: 0.6220
 epoch: 43, train_loss: 0.5071, test_loss: 1.2714, test_f1: 0.6236
 epoch: 44, train_loss: 0.5214, test_loss: 1.3055, test_f1: 0.6394
 epoch: 45, train_loss: 0.4965, test_loss: 1.3719, test_f1: 0.5931
 epoch: 46, train_loss: 0.5018, test_loss: 1.4070, test_f1: 0.6076
 epoch: 47, train_loss: 0.4959, test_loss: 1.4827, test_f1: 0.5865
 epoch: 48, train_loss: 0.4912, test_loss: 1.5350, test_f1: 0.6012
 epoch: 49, train_loss: 0.4728, test_loss: 1.4449, test_f1: 0.6382
 epoch: 50, train_loss: 0.4817, test_loss: 1.4372, test_f1: 0.6251
 epoch: 51, train_loss: 0.4542, test_loss: 1.4153, test_f1: 0.6571
 epoch: 52, train_loss: 0.4676, test_loss: 1.4582, test_f1: 0.6255
 epoch: 53, train_loss: 0.4364, test_loss: 1.4647, test_f1: 0.6339
 epoch: 54, train_loss: 0.4313, test_loss: 1.5149, test_f1: 0.6432
 epoch: 55, train_loss: 0.4318, test_loss: 1.5420, test_f1: 0.6241
 epoch: 56, train_loss: 0.4319, test_loss: 1.5249, test_f1: 0.6542
 epoch: 57, train_loss: 0.4176, test_loss: 1.5434, test_f1: 0.6158
 epoch: 58, train_loss: 0.4196, test_loss: 1.4862, test_f1: 0.6404
 epoch: 59, train_loss: 0.4267, test_loss: 1.5666, test_f1: 0.6359
 epoch: 60, train_loss: 0.4103, test_loss: 1.6050, test_f1: 0.6185
 epoch: 61, train_loss: 0.3978, test_loss: 1.5539, test_f1: 0.6294
 epoch: 62, train_loss: 0.4003, test_loss: 1.6502, test_f1: 0.6348
 epoch: 63, train_loss: 0.4162, test_loss: 1.6357, test_f1: 0.6037
 epoch: 64, train_loss: 0.4073, test_loss: 1.6899, test_f1: 0.6295
 epoch: 65, train_loss: 0.3857, test_loss: 1.6037, test_f1: 0.6228
 epoch: 66, train_loss: 0.3767, test_loss: 1.6479, test_f1: 0.6267
 epoch: 67, train_loss: 0.4021, test_loss: 1.7062, test_f1: 0.6274
 epoch: 68, train_loss: 0.3747, test_loss: 1.6416, test_f1: 0.6235
 epoch: 69, train_loss: 0.3838, test_loss: 1.7316, test_f1: 0.6117
 epoch: 70, train_loss: 0.3771, test_loss: 1.7104, test_f1: 0.6215
 epoch: 71, train_loss: 0.3702, test_loss: 1.6893, test_f1: 0.6130
 epoch: 72, train_loss: 0.3819, test_loss: 1.6982, test_f1: 0.6403
 epoch: 73, train_loss: 0.3774, test_loss: 1.5805, test_f1: 0.6460
 epoch: 74, train_loss: 0.3734, test_loss: 1.6881, test_f1: 0.6376
 epoch: 75, train_loss: 0.3548, test_loss: 1.7417, test_f1: 0.6273
 epoch: 76, train_loss: 0.3618, test_loss: 1.7414, test_f1: 0.6245
 epoch: 77, train_loss: 0.3552, test_loss: 1.6881, test_f1: 0.6550
 epoch: 78, train_loss: 0.3482, test_loss: 1.8242, test_f1: 0.6268
 epoch: 79, train_loss: 0.3424, test_loss: 1.6963, test_f1: 0.6271
 epoch: 80, train_loss: 0.3587, test_loss: 1.7516, test_f1: 0.6261
 epoch: 81, train_loss: 0.3365, test_loss: 1.7946, test_f1: 0.6319
 epoch: 82, train_loss: 0.3464, test_loss: 1.7898, test_f1: 0.6238
 epoch: 83, train_loss: 0.3334, test_loss: 1.8668, test_f1: 0.6126
 epoch: 84, train_loss: 0.3422, test_loss: 1.8924, test_f1: 0.6363
 epoch: 85, train_loss: 0.3287, test_loss: 1.8432, test_f1: 0.6178
 epoch: 86, train_loss: 0.3577, test_loss: 1.9016, test_f1: 0.6203
 epoch: 87, train_loss: 0.3172, test_loss: 1.8662, test_f1: 0.6204
 epoch: 88, train_loss: 0.3325, test_loss: 1.9022, test_f1: 0.6592
 epoch: 89, train_loss: 0.3263, test_loss: 1.9869, test_f1: 0.6129
 epoch: 90, train_loss: 0.3337, test_loss: 1.9136, test_f1: 0.6205
 epoch: 91, train_loss: 0.3255, test_loss: 2.0526, test_f1: 0.6111
 epoch: 92, train_loss: 0.3300, test_loss: 2.0211, test_f1: 0.6225
 epoch: 93, train_loss: 0.3295, test_loss: 1.9643, test_f1: 0.6297
 epoch: 94, train_loss: 0.3125, test_loss: 2.0063, test_f1: 0.6245
 epoch: 95, train_loss: 0.3084, test_loss: 1.9862, test_f1: 0.5948
 epoch: 96, train_loss: 0.3315, test_loss: 2.0177, test_f1: 0.6244
 epoch: 97, train_loss: 0.3066, test_loss: 1.9680, test_f1: 0.6291
 epoch: 98, train_loss: 0.2922, test_loss: 2.0550, test_f1: 0.6094
 epoch: 99, train_loss: 0.3180, test_loss: 2.0210, test_f1: 0.6327
##################ITERATION #8 ****************************************
 epoch: 0, train_loss: 1.2927, test_loss: 1.2454, test_f1: 0.2980
 epoch: 1, train_loss: 1.1023, test_loss: 1.0885, test_f1: 0.4592
 epoch: 2, train_loss: 1.0233, test_loss: 1.0445, test_f1: 0.5099
 epoch: 3, train_loss: 1.0135, test_loss: 1.0492, test_f1: 0.5358
 epoch: 4, train_loss: 0.9626, test_loss: 1.0456, test_f1: 0.5387
 epoch: 5, train_loss: 0.9297, test_loss: 1.0408, test_f1: 0.5464
 epoch: 6, train_loss: 0.9051, test_loss: 1.0121, test_f1: 0.5698
 epoch: 7, train_loss: 0.8847, test_loss: 1.0352, test_f1: 0.5464
 epoch: 8, train_loss: 0.8648, test_loss: 1.0343, test_f1: 0.5349
 epoch: 9, train_loss: 0.8368, test_loss: 0.9995, test_f1: 0.5885
 epoch: 10, train_loss: 0.8279, test_loss: 0.9847, test_f1: 0.6053
 epoch: 11, train_loss: 0.8052, test_loss: 1.0006, test_f1: 0.5956
 epoch: 12, train_loss: 0.8086, test_loss: 1.0191, test_f1: 0.5864
 epoch: 13, train_loss: 0.7871, test_loss: 0.9907, test_f1: 0.5358
 epoch: 14, train_loss: 0.7862, test_loss: 1.0082, test_f1: 0.6024
 epoch: 15, train_loss: 0.7649, test_loss: 0.9770, test_f1: 0.5837
 epoch: 16, train_loss: 0.7407, test_loss: 1.0231, test_f1: 0.5458
 epoch: 17, train_loss: 0.7373, test_loss: 1.0571, test_f1: 0.5935
 epoch: 18, train_loss: 0.7156, test_loss: 1.0653, test_f1: 0.6065
 epoch: 19, train_loss: 0.7202, test_loss: 1.0764, test_f1: 0.6007
 epoch: 20, train_loss: 0.7265, test_loss: 1.0407, test_f1: 0.5957
 epoch: 21, train_loss: 0.6940, test_loss: 1.0344, test_f1: 0.5958
 epoch: 22, train_loss: 0.6926, test_loss: 1.0201, test_f1: 0.6164
 epoch: 23, train_loss: 0.6801, test_loss: 1.0269, test_f1: 0.5944
 epoch: 24, train_loss: 0.6799, test_loss: 1.0861, test_f1: 0.6154
 epoch: 25, train_loss: 0.6684, test_loss: 1.0618, test_f1: 0.6117
 epoch: 26, train_loss: 0.6575, test_loss: 1.0396, test_f1: 0.6331
 epoch: 27, train_loss: 0.6499, test_loss: 1.0608, test_f1: 0.6032
 epoch: 28, train_loss: 0.6407, test_loss: 1.0311, test_f1: 0.6361
 epoch: 29, train_loss: 0.6291, test_loss: 1.0341, test_f1: 0.6203
 epoch: 30, train_loss: 0.6076, test_loss: 1.0474, test_f1: 0.6036
 epoch: 31, train_loss: 0.6120, test_loss: 1.0561, test_f1: 0.6311
 epoch: 32, train_loss: 0.6007, test_loss: 1.0776, test_f1: 0.5936
 epoch: 33, train_loss: 0.5849, test_loss: 1.0548, test_f1: 0.6309
 epoch: 34, train_loss: 0.6013, test_loss: 1.1168, test_f1: 0.5907
 epoch: 35, train_loss: 0.5787, test_loss: 1.0630, test_f1: 0.6139
 epoch: 36, train_loss: 0.5794, test_loss: 1.1291, test_f1: 0.6014
 epoch: 37, train_loss: 0.5640, test_loss: 1.1827, test_f1: 0.5909
 epoch: 38, train_loss: 0.5562, test_loss: 1.0931, test_f1: 0.6083
 epoch: 39, train_loss: 0.5552, test_loss: 1.0964, test_f1: 0.6022
 epoch: 40, train_loss: 0.5393, test_loss: 1.1174, test_f1: 0.5933
 epoch: 41, train_loss: 0.5592, test_loss: 1.0553, test_f1: 0.6322
 epoch: 42, train_loss: 0.5564, test_loss: 1.0934, test_f1: 0.6149
 epoch: 43, train_loss: 0.5145, test_loss: 1.1519, test_f1: 0.5944
 epoch: 44, train_loss: 0.5095, test_loss: 1.2360, test_f1: 0.6038
 epoch: 45, train_loss: 0.5242, test_loss: 1.2340, test_f1: 0.6143
 epoch: 46, train_loss: 0.5022, test_loss: 1.1925, test_f1: 0.5874
 epoch: 47, train_loss: 0.5008, test_loss: 1.2018, test_f1: 0.5989
 epoch: 48, train_loss: 0.5083, test_loss: 1.1677, test_f1: 0.5996
 epoch: 49, train_loss: 0.4953, test_loss: 1.2180, test_f1: 0.6246
 epoch: 50, train_loss: 0.5028, test_loss: 1.2699, test_f1: 0.6021
 epoch: 51, train_loss: 0.4547, test_loss: 1.2303, test_f1: 0.5958
 epoch: 52, train_loss: 0.4499, test_loss: 1.1990, test_f1: 0.6081
 epoch: 53, train_loss: 0.4379, test_loss: 1.2624, test_f1: 0.6033
 epoch: 54, train_loss: 0.4492, test_loss: 1.2482, test_f1: 0.6111
 epoch: 55, train_loss: 0.4384, test_loss: 1.2357, test_f1: 0.6125
 epoch: 56, train_loss: 0.4442, test_loss: 1.2439, test_f1: 0.6198
 epoch: 57, train_loss: 0.4210, test_loss: 1.2878, test_f1: 0.6117
 epoch: 58, train_loss: 0.4263, test_loss: 1.2923, test_f1: 0.5938
 epoch: 59, train_loss: 0.4361, test_loss: 1.2638, test_f1: 0.6098
 epoch: 60, train_loss: 0.4347, test_loss: 1.3383, test_f1: 0.5990
 epoch: 61, train_loss: 0.4258, test_loss: 1.2834, test_f1: 0.6086
 epoch: 62, train_loss: 0.4190, test_loss: 1.3619, test_f1: 0.5890
 epoch: 63, train_loss: 0.4018, test_loss: 1.3004, test_f1: 0.5811
 epoch: 64, train_loss: 0.4080, test_loss: 1.3368, test_f1: 0.6112
 epoch: 65, train_loss: 0.3977, test_loss: 1.3604, test_f1: 0.6148
 epoch: 66, train_loss: 0.3772, test_loss: 1.3652, test_f1: 0.6113
 epoch: 67, train_loss: 0.4134, test_loss: 1.3888, test_f1: 0.6133
 epoch: 68, train_loss: 0.3903, test_loss: 1.3996, test_f1: 0.6148
 epoch: 69, train_loss: 0.3937, test_loss: 1.3650, test_f1: 0.5642
 epoch: 70, train_loss: 0.3863, test_loss: 1.3980, test_f1: 0.6085
 epoch: 71, train_loss: 0.3661, test_loss: 1.3156, test_f1: 0.6127
 epoch: 72, train_loss: 0.3920, test_loss: 1.3784, test_f1: 0.6359
 epoch: 73, train_loss: 0.3597, test_loss: 1.4277, test_f1: 0.5811
 epoch: 74, train_loss: 0.3814, test_loss: 1.4003, test_f1: 0.6149
 epoch: 75, train_loss: 0.3898, test_loss: 1.3758, test_f1: 0.6025
 epoch: 76, train_loss: 0.3731, test_loss: 1.3902, test_f1: 0.5818
 epoch: 77, train_loss: 0.3641, test_loss: 1.4063, test_f1: 0.6234
 epoch: 78, train_loss: 0.3951, test_loss: 1.4522, test_f1: 0.6254
 epoch: 79, train_loss: 0.3495, test_loss: 1.4441, test_f1: 0.6114
 epoch: 80, train_loss: 0.3547, test_loss: 1.4177, test_f1: 0.6023
 epoch: 81, train_loss: 0.3442, test_loss: 1.5520, test_f1: 0.5994
 epoch: 82, train_loss: 0.3505, test_loss: 1.4542, test_f1: 0.5936
 epoch: 83, train_loss: 0.3415, test_loss: 1.3927, test_f1: 0.6394
 epoch: 84, train_loss: 0.3575, test_loss: 1.4801, test_f1: 0.6015
 epoch: 85, train_loss: 0.3485, test_loss: 1.4709, test_f1: 0.5959
 epoch: 86, train_loss: 0.3301, test_loss: 1.5013, test_f1: 0.6073
 epoch: 87, train_loss: 0.3378, test_loss: 1.4434, test_f1: 0.6138
 epoch: 88, train_loss: 0.3396, test_loss: 1.5463, test_f1: 0.5789
 epoch: 89, train_loss: 0.3611, test_loss: 1.4309, test_f1: 0.6450
 epoch: 90, train_loss: 0.3374, test_loss: 1.5301, test_f1: 0.5826
 epoch: 91, train_loss: 0.3434, test_loss: 1.5242, test_f1: 0.5862
 epoch: 92, train_loss: 0.3485, test_loss: 1.5729, test_f1: 0.5641
 epoch: 93, train_loss: 0.3242, test_loss: 1.5040, test_f1: 0.6046
 epoch: 94, train_loss: 0.3282, test_loss: 1.5791, test_f1: 0.6158
 epoch: 95, train_loss: 0.3237, test_loss: 1.5325, test_f1: 0.6205
 epoch: 96, train_loss: 0.2976, test_loss: 1.5733, test_f1: 0.5971
 epoch: 97, train_loss: 0.3358, test_loss: 1.5921, test_f1: 0.6327
 epoch: 98, train_loss: 0.3081, test_loss: 1.5608, test_f1: 0.5943
 epoch: 99, train_loss: 0.3157, test_loss: 1.5427, test_f1: 0.6407
##################ITERATION #9 ****************************************
 epoch: 0, train_loss: 1.2551, test_loss: 1.2643, test_f1: 0.3483
 epoch: 1, train_loss: 1.0411, test_loss: 1.1021, test_f1: 0.5357
 epoch: 2, train_loss: 0.9844, test_loss: 1.0363, test_f1: 0.5981
 epoch: 3, train_loss: 0.9428, test_loss: 1.0190, test_f1: 0.5941
 epoch: 4, train_loss: 0.9280, test_loss: 1.0086, test_f1: 0.5576
 epoch: 5, train_loss: 0.8988, test_loss: 0.9814, test_f1: 0.5829
 epoch: 6, train_loss: 0.8864, test_loss: 0.9818, test_f1: 0.5591
 epoch: 7, train_loss: 0.8518, test_loss: 1.0040, test_f1: 0.5489
 epoch: 8, train_loss: 0.8379, test_loss: 0.9769, test_f1: 0.5724
 epoch: 9, train_loss: 0.8288, test_loss: 0.9761, test_f1: 0.5774
 epoch: 10, train_loss: 0.7990, test_loss: 0.9683, test_f1: 0.5526
 epoch: 11, train_loss: 0.7958, test_loss: 0.9341, test_f1: 0.5875
 epoch: 12, train_loss: 0.7587, test_loss: 0.9500, test_f1: 0.5755
 epoch: 13, train_loss: 0.7569, test_loss: 0.9683, test_f1: 0.6077
 epoch: 14, train_loss: 0.7560, test_loss: 0.9457, test_f1: 0.5891
 epoch: 15, train_loss: 0.7355, test_loss: 0.9507, test_f1: 0.6005
 epoch: 16, train_loss: 0.7156, test_loss: 0.9767, test_f1: 0.6093
 epoch: 17, train_loss: 0.7238, test_loss: 0.9698, test_f1: 0.6141
 epoch: 18, train_loss: 0.6820, test_loss: 0.9567, test_f1: 0.5965
 epoch: 19, train_loss: 0.6871, test_loss: 0.9531, test_f1: 0.6020
 epoch: 20, train_loss: 0.6702, test_loss: 0.9757, test_f1: 0.6031
 epoch: 21, train_loss: 0.6338, test_loss: 1.0091, test_f1: 0.5940
 epoch: 22, train_loss: 0.6480, test_loss: 0.9500, test_f1: 0.6164
 epoch: 23, train_loss: 0.6316, test_loss: 0.9807, test_f1: 0.6062
 epoch: 24, train_loss: 0.6286, test_loss: 1.0029, test_f1: 0.6211
 epoch: 25, train_loss: 0.6296, test_loss: 0.9953, test_f1: 0.6016
 epoch: 26, train_loss: 0.6000, test_loss: 0.9772, test_f1: 0.6265
 epoch: 27, train_loss: 0.6012, test_loss: 1.0098, test_f1: 0.6273
 epoch: 28, train_loss: 0.5895, test_loss: 1.0152, test_f1: 0.6150
 epoch: 29, train_loss: 0.5880, test_loss: 1.0034, test_f1: 0.6271
 epoch: 30, train_loss: 0.5768, test_loss: 1.0009, test_f1: 0.6246
 epoch: 31, train_loss: 0.5757, test_loss: 1.0059, test_f1: 0.6270
 epoch: 32, train_loss: 0.5672, test_loss: 1.0836, test_f1: 0.5831
 epoch: 33, train_loss: 0.5653, test_loss: 1.0445, test_f1: 0.6134
 epoch: 34, train_loss: 0.5490, test_loss: 1.0868, test_f1: 0.6216
 epoch: 35, train_loss: 0.5630, test_loss: 1.0584, test_f1: 0.6276
 epoch: 36, train_loss: 0.5458, test_loss: 1.0506, test_f1: 0.6246
 epoch: 37, train_loss: 0.5355, test_loss: 1.0597, test_f1: 0.6132
 epoch: 38, train_loss: 0.4957, test_loss: 1.1375, test_f1: 0.6227
 epoch: 39, train_loss: 0.5070, test_loss: 1.1375, test_f1: 0.6277
 epoch: 40, train_loss: 0.5094, test_loss: 1.1537, test_f1: 0.6162
 epoch: 41, train_loss: 0.5063, test_loss: 1.1540, test_f1: 0.6178
 epoch: 42, train_loss: 0.4968, test_loss: 1.1702, test_f1: 0.6184
 epoch: 43, train_loss: 0.4839, test_loss: 1.1929, test_f1: 0.6224
 epoch: 44, train_loss: 0.4876, test_loss: 1.1693, test_f1: 0.6339
 epoch: 45, train_loss: 0.4817, test_loss: 1.2285, test_f1: 0.6037
 epoch: 46, train_loss: 0.4543, test_loss: 1.1120, test_f1: 0.6342
 epoch: 47, train_loss: 0.4581, test_loss: 1.1246, test_f1: 0.6134
 epoch: 48, train_loss: 0.4562, test_loss: 1.1662, test_f1: 0.6256
 epoch: 49, train_loss: 0.4528, test_loss: 1.1512, test_f1: 0.6420
 epoch: 50, train_loss: 0.4273, test_loss: 1.1971, test_f1: 0.6412
 epoch: 51, train_loss: 0.4132, test_loss: 1.1779, test_f1: 0.6427
 epoch: 52, train_loss: 0.4442, test_loss: 1.2184, test_f1: 0.6259
 epoch: 53, train_loss: 0.3918, test_loss: 1.1988, test_f1: 0.6414
 epoch: 54, train_loss: 0.4142, test_loss: 1.2088, test_f1: 0.6311
 epoch: 55, train_loss: 0.3919, test_loss: 1.2656, test_f1: 0.6123
 epoch: 56, train_loss: 0.3956, test_loss: 1.2637, test_f1: 0.6312
 epoch: 57, train_loss: 0.3994, test_loss: 1.3258, test_f1: 0.6229
 epoch: 58, train_loss: 0.3767, test_loss: 1.3141, test_f1: 0.6147
 epoch: 59, train_loss: 0.3831, test_loss: 1.3334, test_f1: 0.6066
 epoch: 60, train_loss: 0.3746, test_loss: 1.3232, test_f1: 0.6274
 epoch: 61, train_loss: 0.3799, test_loss: 1.3543, test_f1: 0.6156
 epoch: 62, train_loss: 0.3713, test_loss: 1.3440, test_f1: 0.6328
 epoch: 63, train_loss: 0.3614, test_loss: 1.3534, test_f1: 0.6412
 epoch: 64, train_loss: 0.3498, test_loss: 1.3298, test_f1: 0.6283
 epoch: 65, train_loss: 0.3711, test_loss: 1.4311, test_f1: 0.6322
 epoch: 66, train_loss: 0.3517, test_loss: 1.3563, test_f1: 0.6474
 epoch: 67, train_loss: 0.3465, test_loss: 1.4122, test_f1: 0.6224
 epoch: 68, train_loss: 0.3556, test_loss: 1.3374, test_f1: 0.6303
 epoch: 69, train_loss: 0.3365, test_loss: 1.4222, test_f1: 0.6326
 epoch: 70, train_loss: 0.3650, test_loss: 1.3549, test_f1: 0.6255
 epoch: 71, train_loss: 0.3336, test_loss: 1.4705, test_f1: 0.6070
 epoch: 72, train_loss: 0.3479, test_loss: 1.4152, test_f1: 0.6385
 epoch: 73, train_loss: 0.3455, test_loss: 1.4235, test_f1: 0.6179
 epoch: 74, train_loss: 0.3261, test_loss: 1.4257, test_f1: 0.6231
 epoch: 75, train_loss: 0.3397, test_loss: 1.4481, test_f1: 0.6267
 epoch: 76, train_loss: 0.3327, test_loss: 1.4741, test_f1: 0.6148
 epoch: 77, train_loss: 0.3232, test_loss: 1.4396, test_f1: 0.6250
 epoch: 78, train_loss: 0.3237, test_loss: 1.5498, test_f1: 0.6170
 epoch: 79, train_loss: 0.3105, test_loss: 1.5538, test_f1: 0.6412
 epoch: 80, train_loss: 0.3105, test_loss: 1.5362, test_f1: 0.6447
 epoch: 81, train_loss: 0.3060, test_loss: 1.5374, test_f1: 0.6117
 epoch: 82, train_loss: 0.3115, test_loss: 1.5516, test_f1: 0.6262
 epoch: 83, train_loss: 0.3144, test_loss: 1.5386, test_f1: 0.6468
 epoch: 84, train_loss: 0.3210, test_loss: 1.6083, test_f1: 0.6206
 epoch: 85, train_loss: 0.3058, test_loss: 1.6237, test_f1: 0.6229
 epoch: 86, train_loss: 0.3146, test_loss: 1.5459, test_f1: 0.6422
 epoch: 87, train_loss: 0.3042, test_loss: 1.6417, test_f1: 0.6382
 epoch: 88, train_loss: 0.2933, test_loss: 1.6290, test_f1: 0.6230
 epoch: 89, train_loss: 0.2958, test_loss: 1.5531, test_f1: 0.6395
 epoch: 90, train_loss: 0.3038, test_loss: 1.5749, test_f1: 0.6178
 epoch: 91, train_loss: 0.2975, test_loss: 1.5804, test_f1: 0.6293
 epoch: 92, train_loss: 0.2845, test_loss: 1.5674, test_f1: 0.6189
 epoch: 93, train_loss: 0.3008, test_loss: 1.6687, test_f1: 0.6166
 epoch: 94, train_loss: 0.2694, test_loss: 1.6276, test_f1: 0.6113
 epoch: 95, train_loss: 0.2875, test_loss: 1.5990, test_f1: 0.6359
 epoch: 96, train_loss: 0.2777, test_loss: 1.5603, test_f1: 0.6302
 epoch: 97, train_loss: 0.3008, test_loss: 1.6184, test_f1: 0.6140
 epoch: 98, train_loss: 0.2806, test_loss: 1.5503, test_f1: 0.6384
 epoch: 99, train_loss: 0.2739, test_loss: 1.6550, test_f1: 0.6284

Training completed in 511.50 seconds
Best F1: 0.6907 at epoch 44
Mean F1 across iterations: 0.6528  0.0182
========================FINAL RESULTS================================
FEGIN weighted F1: 0.6907  0.0182
python main.py --data ltspice_demos --representation component_pin --model FEGIN --layers 2 --hiddens 128 --batch_size 32 --lr 0.0001 --emb_size 250 --epochs 100 --save_appendix component_pin_L2_H128_BS32_LR0.0001_E250 --no_val
-----



STDERR:
  File "main.py", line 370, in <module>
    main()
  File "main.py", line 254, in main
    dataset = dataset_class(
  File "/home/philip/projects/ltspice_examples_code_repo/Circuit-Completion-Using-GNNs/component_classification_with_link_prediction_head/evaluation/FEGIN/kernel/circuit_datasets.py", line 15, in __init__
    self.data, self.slices = torch.load(self.processed_paths[0])
  File "/home/philip/.local/lib/python3.8/site-packages/torch/serialization.py", line 1040, in load
    warnings.warn(
  File "/usr/lib/python3.8/warnings.py", line 109, in _showwarnmsg
    sw(msg.message, msg.category, msg.filename, msg.lineno,
  File "main.py", line 47, in warn_with_traceback
    traceback.print_stack(file=log)
/home/philip/projects/ltspice_examples_code_repo/Circuit-Completion-Using-GNNs/component_classification_with_link_prediction_head/evaluation/FEGIN/kernel/circuit_datasets.py:15: FutureWarning: You are using `torch.load` with `weights_only=False` (the current default value), which uses the default pickle module implicitly. It is possible to construct malicious pickle data which will execute arbitrary code during unpickling (See https://github.com/pytorch/pytorch/blob/main/SECURITY.md#untrusted-models for more details). In a future release, the default value for `weights_only` will be flipped to `True`. This limits the functions that could be executed during unpickling. Arbitrary objects will no longer be allowed to be loaded via this mode unless they are explicitly allowlisted by the user via `torch.serialization.add_safe_globals`. We recommend you start setting `weights_only=True` for any use case where you don't have full control of the loaded file. Please open an issue on GitHub for any issues related to this experimental feature.
  self.data, self.slices = torch.load(self.processed_paths[0])
