STDOUT:
Results will be saved in /home/philip/projects/ltspice_examples_code_repo/Circuit-Completion-Using-GNNs/component_classification_with_link_prediction_head/evaluation/FEGIN/results/model_FEGIN_dataset_ltspice_examples
Command line input: python main.py --data ltspice_examples --representation component_net --model FEGIN --layers 5 --hiddens 128 --batch_size 64 --lr 0.0001 --emb_size 128 --epochs 100 --save_appendix component_net_L5_H128_BS64_LR0.0001_E128 --no_val
 is saved.
-----
ltspice_examples - FEGIN
Using 5 layers, 128 hidden units, h = 2
Loading component_net representation dataset
ENTERED
Training FEGIN on component_net representation
Train: 3558, Test: 846
##################ITERATION #0 ****************************************
 epoch: 0, train_loss: 1.3412, test_loss: 1.3230, test_f1: 0.2270
 epoch: 1, train_loss: 1.2633, test_loss: 1.2345, test_f1: 0.2270
 epoch: 2, train_loss: 1.2219, test_loss: 1.1797, test_f1: 0.2981
 epoch: 3, train_loss: 1.1759, test_loss: 1.1340, test_f1: 0.3927
 epoch: 4, train_loss: 1.1277, test_loss: 1.0797, test_f1: 0.4988
 epoch: 5, train_loss: 1.0810, test_loss: 1.0288, test_f1: 0.5309
 epoch: 6, train_loss: 1.0355, test_loss: 0.9869, test_f1: 0.5254
 epoch: 7, train_loss: 0.9889, test_loss: 0.9526, test_f1: 0.4968
 epoch: 8, train_loss: 0.9493, test_loss: 0.9100, test_f1: 0.5369
 epoch: 9, train_loss: 0.9308, test_loss: 0.9235, test_f1: 0.5122
 epoch: 10, train_loss: 0.9023, test_loss: 0.8980, test_f1: 0.5301
 epoch: 11, train_loss: 0.8803, test_loss: 0.9234, test_f1: 0.5222
 epoch: 12, train_loss: 0.8754, test_loss: 0.9131, test_f1: 0.5527
 epoch: 13, train_loss: 0.8557, test_loss: 0.9078, test_f1: 0.5732
 epoch: 14, train_loss: 0.8511, test_loss: 0.9285, test_f1: 0.5545
 epoch: 15, train_loss: 0.8377, test_loss: 0.9051, test_f1: 0.5521
 epoch: 16, train_loss: 0.8258, test_loss: 0.9112, test_f1: 0.5280
 epoch: 17, train_loss: 0.8148, test_loss: 0.9123, test_f1: 0.5427
 epoch: 18, train_loss: 0.8038, test_loss: 0.9234, test_f1: 0.5506
 epoch: 19, train_loss: 0.8017, test_loss: 0.9165, test_f1: 0.5297
 epoch: 20, train_loss: 0.7854, test_loss: 0.9279, test_f1: 0.5390
 epoch: 21, train_loss: 0.7918, test_loss: 0.9242, test_f1: 0.5534
 epoch: 22, train_loss: 0.7726, test_loss: 0.9326, test_f1: 0.5765
 epoch: 23, train_loss: 0.7747, test_loss: 0.9151, test_f1: 0.5570
 epoch: 24, train_loss: 0.7729, test_loss: 0.9048, test_f1: 0.5900
 epoch: 25, train_loss: 0.7510, test_loss: 0.9298, test_f1: 0.5772
 epoch: 26, train_loss: 0.7437, test_loss: 0.9266, test_f1: 0.5661
 epoch: 27, train_loss: 0.7458, test_loss: 0.9422, test_f1: 0.6092
 epoch: 28, train_loss: 0.7253, test_loss: 0.9304, test_f1: 0.6055
 epoch: 29, train_loss: 0.7228, test_loss: 0.9616, test_f1: 0.5847
 epoch: 30, train_loss: 0.7308, test_loss: 0.9394, test_f1: 0.5805
 epoch: 31, train_loss: 0.7115, test_loss: 0.9234, test_f1: 0.5998
 epoch: 32, train_loss: 0.6959, test_loss: 0.9392, test_f1: 0.5692
 epoch: 33, train_loss: 0.7079, test_loss: 0.9518, test_f1: 0.6067
 epoch: 34, train_loss: 0.6965, test_loss: 0.9494, test_f1: 0.5992
 epoch: 35, train_loss: 0.6956, test_loss: 0.9463, test_f1: 0.5947
 epoch: 36, train_loss: 0.6913, test_loss: 0.9180, test_f1: 0.5932
 epoch: 37, train_loss: 0.6799, test_loss: 0.9212, test_f1: 0.5933
 epoch: 38, train_loss: 0.6856, test_loss: 0.9399, test_f1: 0.5875
 epoch: 39, train_loss: 0.6858, test_loss: 0.9545, test_f1: 0.5810
 epoch: 40, train_loss: 0.6596, test_loss: 0.9541, test_f1: 0.6098
 epoch: 41, train_loss: 0.6617, test_loss: 0.9568, test_f1: 0.5943
 epoch: 42, train_loss: 0.6475, test_loss: 0.9733, test_f1: 0.5966
 epoch: 43, train_loss: 0.6445, test_loss: 0.9482, test_f1: 0.5986
 epoch: 44, train_loss: 0.6492, test_loss: 0.9607, test_f1: 0.5857
 epoch: 45, train_loss: 0.6389, test_loss: 0.9809, test_f1: 0.6062
 epoch: 46, train_loss: 0.6351, test_loss: 0.9986, test_f1: 0.6079
 epoch: 47, train_loss: 0.6308, test_loss: 0.9838, test_f1: 0.5941
 epoch: 48, train_loss: 0.6247, test_loss: 0.9868, test_f1: 0.6078
 epoch: 49, train_loss: 0.6312, test_loss: 0.9435, test_f1: 0.6169
 epoch: 50, train_loss: 0.6090, test_loss: 0.9639, test_f1: 0.6193
 epoch: 51, train_loss: 0.6039, test_loss: 0.9703, test_f1: 0.6108
 epoch: 52, train_loss: 0.5925, test_loss: 0.9443, test_f1: 0.6178
 epoch: 53, train_loss: 0.5801, test_loss: 0.9835, test_f1: 0.6080
 epoch: 54, train_loss: 0.5708, test_loss: 0.9617, test_f1: 0.6197
 epoch: 55, train_loss: 0.5765, test_loss: 0.9799, test_f1: 0.6165
 epoch: 56, train_loss: 0.5674, test_loss: 0.9658, test_f1: 0.6147
 epoch: 57, train_loss: 0.5676, test_loss: 0.9877, test_f1: 0.6125
 epoch: 58, train_loss: 0.5602, test_loss: 0.9746, test_f1: 0.6188
 epoch: 59, train_loss: 0.5605, test_loss: 0.9991, test_f1: 0.6103
 epoch: 60, train_loss: 0.5549, test_loss: 0.9541, test_f1: 0.6241
 epoch: 61, train_loss: 0.5507, test_loss: 0.9893, test_f1: 0.6153
 epoch: 62, train_loss: 0.5512, test_loss: 0.9627, test_f1: 0.6255
 epoch: 63, train_loss: 0.5375, test_loss: 0.9806, test_f1: 0.6339
 epoch: 64, train_loss: 0.5444, test_loss: 0.9912, test_f1: 0.6267
 epoch: 65, train_loss: 0.5406, test_loss: 1.0099, test_f1: 0.6098
 epoch: 66, train_loss: 0.5384, test_loss: 1.0341, test_f1: 0.6141
 epoch: 67, train_loss: 0.5308, test_loss: 1.0115, test_f1: 0.5951
 epoch: 68, train_loss: 0.5296, test_loss: 0.9985, test_f1: 0.6325
 epoch: 69, train_loss: 0.5287, test_loss: 0.9829, test_f1: 0.6224
 epoch: 70, train_loss: 0.5176, test_loss: 1.0167, test_f1: 0.6188
 epoch: 71, train_loss: 0.5300, test_loss: 1.0369, test_f1: 0.6174
 epoch: 72, train_loss: 0.5227, test_loss: 1.0199, test_f1: 0.6202
 epoch: 73, train_loss: 0.5172, test_loss: 1.0487, test_f1: 0.6190
 epoch: 74, train_loss: 0.5296, test_loss: 1.0561, test_f1: 0.6265
 epoch: 75, train_loss: 0.5121, test_loss: 1.0442, test_f1: 0.6149
 epoch: 76, train_loss: 0.5030, test_loss: 1.0390, test_f1: 0.6137
 epoch: 77, train_loss: 0.4960, test_loss: 1.0202, test_f1: 0.6401
 epoch: 78, train_loss: 0.5098, test_loss: 0.9923, test_f1: 0.6383
 epoch: 79, train_loss: 0.5068, test_loss: 1.0256, test_f1: 0.6334
 epoch: 80, train_loss: 0.4973, test_loss: 1.0705, test_f1: 0.6330
 epoch: 81, train_loss: 0.4919, test_loss: 1.0393, test_f1: 0.6325
 epoch: 82, train_loss: 0.4945, test_loss: 1.0307, test_f1: 0.6232
 epoch: 83, train_loss: 0.4832, test_loss: 1.0837, test_f1: 0.6419
 epoch: 84, train_loss: 0.4872, test_loss: 1.0616, test_f1: 0.6234
 epoch: 85, train_loss: 0.5006, test_loss: 1.0572, test_f1: 0.6222
 epoch: 86, train_loss: 0.4968, test_loss: 1.1124, test_f1: 0.6178
 epoch: 87, train_loss: 0.4873, test_loss: 1.0566, test_f1: 0.6113
 epoch: 88, train_loss: 0.4984, test_loss: 1.1154, test_f1: 0.6177
 epoch: 89, train_loss: 0.4835, test_loss: 1.0389, test_f1: 0.6262
 epoch: 90, train_loss: 0.4762, test_loss: 1.0899, test_f1: 0.6070
 epoch: 91, train_loss: 0.4663, test_loss: 1.0599, test_f1: 0.6175
 epoch: 92, train_loss: 0.4772, test_loss: 1.0993, test_f1: 0.6149
 epoch: 93, train_loss: 0.4689, test_loss: 1.0883, test_f1: 0.6307
 epoch: 94, train_loss: 0.4662, test_loss: 1.0850, test_f1: 0.6259
 epoch: 95, train_loss: 0.4612, test_loss: 1.0797, test_f1: 0.6296
 epoch: 96, train_loss: 0.4605, test_loss: 1.1179, test_f1: 0.6153
 epoch: 97, train_loss: 0.4508, test_loss: 1.0768, test_f1: 0.6260
 epoch: 98, train_loss: 0.4535, test_loss: 1.0853, test_f1: 0.6203
 epoch: 99, train_loss: 0.4527, test_loss: 1.1050, test_f1: 0.6229
##################ITERATION #1 ****************************************
 epoch: 0, train_loss: 1.2434, test_loss: 1.2287, test_f1: 0.3486
 epoch: 1, train_loss: 1.1311, test_loss: 1.0645, test_f1: 0.4720
 epoch: 2, train_loss: 1.0776, test_loss: 1.0121, test_f1: 0.4776
 epoch: 3, train_loss: 1.0329, test_loss: 0.9651, test_f1: 0.5037
 epoch: 4, train_loss: 0.9926, test_loss: 0.9468, test_f1: 0.4983
 epoch: 5, train_loss: 0.9678, test_loss: 0.9150, test_f1: 0.5109
 epoch: 6, train_loss: 0.9477, test_loss: 0.9201, test_f1: 0.5352
 epoch: 7, train_loss: 0.9218, test_loss: 0.8961, test_f1: 0.5160
 epoch: 8, train_loss: 0.9112, test_loss: 0.9226, test_f1: 0.5107
 epoch: 9, train_loss: 0.8893, test_loss: 0.9130, test_f1: 0.5348
 epoch: 10, train_loss: 0.8767, test_loss: 0.8966, test_f1: 0.5278
 epoch: 11, train_loss: 0.8656, test_loss: 0.9117, test_f1: 0.5314
 epoch: 12, train_loss: 0.8558, test_loss: 0.9338, test_f1: 0.5097
 epoch: 13, train_loss: 0.8424, test_loss: 0.9083, test_f1: 0.5380
 epoch: 14, train_loss: 0.8350, test_loss: 0.9153, test_f1: 0.5335
 epoch: 15, train_loss: 0.8322, test_loss: 0.8957, test_f1: 0.5470
 epoch: 16, train_loss: 0.8076, test_loss: 0.9020, test_f1: 0.5823
 epoch: 17, train_loss: 0.8071, test_loss: 0.9350, test_f1: 0.5779
 epoch: 18, train_loss: 0.7984, test_loss: 0.9186, test_f1: 0.5856
 epoch: 19, train_loss: 0.7952, test_loss: 0.8984, test_f1: 0.5904
 epoch: 20, train_loss: 0.7749, test_loss: 0.9147, test_f1: 0.5565
 epoch: 21, train_loss: 0.7771, test_loss: 0.9100, test_f1: 0.5737
 epoch: 22, train_loss: 0.7611, test_loss: 0.8870, test_f1: 0.5571
 epoch: 23, train_loss: 0.7496, test_loss: 0.8800, test_f1: 0.5872
 epoch: 24, train_loss: 0.7449, test_loss: 0.8932, test_f1: 0.5795
 epoch: 25, train_loss: 0.7276, test_loss: 0.9093, test_f1: 0.6003
 epoch: 26, train_loss: 0.7211, test_loss: 0.8916, test_f1: 0.5632
 epoch: 27, train_loss: 0.7250, test_loss: 0.9095, test_f1: 0.5695
 epoch: 28, train_loss: 0.7235, test_loss: 0.8785, test_f1: 0.6281
 epoch: 29, train_loss: 0.7044, test_loss: 0.9449, test_f1: 0.6192
 epoch: 30, train_loss: 0.7042, test_loss: 0.9050, test_f1: 0.6301
 epoch: 31, train_loss: 0.7033, test_loss: 0.8810, test_f1: 0.6177
 epoch: 32, train_loss: 0.6858, test_loss: 0.8449, test_f1: 0.6390
 epoch: 33, train_loss: 0.6892, test_loss: 0.8653, test_f1: 0.6207
 epoch: 34, train_loss: 0.6894, test_loss: 0.8891, test_f1: 0.6567
 epoch: 35, train_loss: 0.6746, test_loss: 0.8943, test_f1: 0.6333
 epoch: 36, train_loss: 0.6780, test_loss: 0.8816, test_f1: 0.6179
 epoch: 37, train_loss: 0.6565, test_loss: 0.8846, test_f1: 0.6367
 epoch: 38, train_loss: 0.6436, test_loss: 0.8967, test_f1: 0.6251
 epoch: 39, train_loss: 0.6505, test_loss: 0.9196, test_f1: 0.6396
 epoch: 40, train_loss: 0.6556, test_loss: 0.8870, test_f1: 0.6319
 epoch: 41, train_loss: 0.6418, test_loss: 0.8920, test_f1: 0.6285
 epoch: 42, train_loss: 0.6444, test_loss: 0.9243, test_f1: 0.6448
 epoch: 43, train_loss: 0.6229, test_loss: 0.9071, test_f1: 0.6183
 epoch: 44, train_loss: 0.6352, test_loss: 0.8861, test_f1: 0.6406
 epoch: 45, train_loss: 0.6124, test_loss: 0.8928, test_f1: 0.6186
 epoch: 46, train_loss: 0.6089, test_loss: 0.8980, test_f1: 0.6163
 epoch: 47, train_loss: 0.6136, test_loss: 0.8607, test_f1: 0.6433
 epoch: 48, train_loss: 0.6081, test_loss: 0.9089, test_f1: 0.6372
 epoch: 49, train_loss: 0.5868, test_loss: 0.9356, test_f1: 0.6164
 epoch: 50, train_loss: 0.5898, test_loss: 0.9270, test_f1: 0.6153
 epoch: 51, train_loss: 0.5751, test_loss: 0.9052, test_f1: 0.6369
 epoch: 52, train_loss: 0.5783, test_loss: 0.9325, test_f1: 0.6408
 epoch: 53, train_loss: 0.5563, test_loss: 0.9182, test_f1: 0.6275
 epoch: 54, train_loss: 0.5535, test_loss: 0.8925, test_f1: 0.6410
 epoch: 55, train_loss: 0.5447, test_loss: 0.9392, test_f1: 0.6373
 epoch: 56, train_loss: 0.5364, test_loss: 0.9199, test_f1: 0.6357
 epoch: 57, train_loss: 0.5538, test_loss: 0.9272, test_f1: 0.6436
 epoch: 58, train_loss: 0.5396, test_loss: 0.9416, test_f1: 0.6387
 epoch: 59, train_loss: 0.5345, test_loss: 0.9454, test_f1: 0.6431
 epoch: 60, train_loss: 0.5260, test_loss: 0.9594, test_f1: 0.6227
 epoch: 61, train_loss: 0.5282, test_loss: 0.9493, test_f1: 0.6367
 epoch: 62, train_loss: 0.5331, test_loss: 0.9450, test_f1: 0.6472
 epoch: 63, train_loss: 0.5162, test_loss: 0.9497, test_f1: 0.6481
 epoch: 64, train_loss: 0.5342, test_loss: 0.9367, test_f1: 0.6469
 epoch: 65, train_loss: 0.5152, test_loss: 0.9764, test_f1: 0.6496
 epoch: 66, train_loss: 0.5218, test_loss: 0.9716, test_f1: 0.6385
 epoch: 67, train_loss: 0.5120, test_loss: 0.9713, test_f1: 0.6380
 epoch: 68, train_loss: 0.5185, test_loss: 0.9654, test_f1: 0.6301
 epoch: 69, train_loss: 0.5151, test_loss: 0.9560, test_f1: 0.6436
 epoch: 70, train_loss: 0.5068, test_loss: 0.9586, test_f1: 0.6462
 epoch: 71, train_loss: 0.5057, test_loss: 0.9858, test_f1: 0.6423
 epoch: 72, train_loss: 0.5041, test_loss: 0.9922, test_f1: 0.6557
 epoch: 73, train_loss: 0.4888, test_loss: 1.0052, test_f1: 0.6412
 epoch: 74, train_loss: 0.4959, test_loss: 0.9883, test_f1: 0.6559
 epoch: 75, train_loss: 0.4943, test_loss: 1.0066, test_f1: 0.6331
 epoch: 76, train_loss: 0.4957, test_loss: 0.9896, test_f1: 0.6402
 epoch: 77, train_loss: 0.4843, test_loss: 0.9910, test_f1: 0.6494
 epoch: 78, train_loss: 0.4897, test_loss: 1.0190, test_f1: 0.6155
 epoch: 79, train_loss: 0.4784, test_loss: 0.9922, test_f1: 0.6473
 epoch: 80, train_loss: 0.4708, test_loss: 1.0162, test_f1: 0.6470
 epoch: 81, train_loss: 0.4759, test_loss: 1.0310, test_f1: 0.6447
 epoch: 82, train_loss: 0.4771, test_loss: 1.0387, test_f1: 0.6568
 epoch: 83, train_loss: 0.4812, test_loss: 1.0347, test_f1: 0.6394
 epoch: 84, train_loss: 0.4688, test_loss: 1.0538, test_f1: 0.6493
 epoch: 85, train_loss: 0.4607, test_loss: 1.0668, test_f1: 0.6478
 epoch: 86, train_loss: 0.4578, test_loss: 1.0234, test_f1: 0.6474
 epoch: 87, train_loss: 0.4711, test_loss: 1.0791, test_f1: 0.6384
 epoch: 88, train_loss: 0.4656, test_loss: 1.0344, test_f1: 0.6506
 epoch: 89, train_loss: 0.4589, test_loss: 1.0314, test_f1: 0.6579
 epoch: 90, train_loss: 0.4462, test_loss: 1.0532, test_f1: 0.6587
 epoch: 91, train_loss: 0.4604, test_loss: 1.0374, test_f1: 0.6486
 epoch: 92, train_loss: 0.4625, test_loss: 1.0792, test_f1: 0.6528
 epoch: 93, train_loss: 0.4498, test_loss: 1.0776, test_f1: 0.6349
 epoch: 94, train_loss: 0.4663, test_loss: 1.0807, test_f1: 0.6345
 epoch: 95, train_loss: 0.4484, test_loss: 1.0720, test_f1: 0.6658
 epoch: 96, train_loss: 0.4429, test_loss: 1.0739, test_f1: 0.6462
 epoch: 97, train_loss: 0.4437, test_loss: 1.0530, test_f1: 0.6359
 epoch: 98, train_loss: 0.4372, test_loss: 1.0735, test_f1: 0.6525
 epoch: 99, train_loss: 0.4431, test_loss: 1.0471, test_f1: 0.6806
##################ITERATION #2 ****************************************
 epoch: 0, train_loss: 1.2235, test_loss: 1.2077, test_f1: 0.3660
 epoch: 1, train_loss: 1.1117, test_loss: 1.0404, test_f1: 0.4857
 epoch: 2, train_loss: 1.0627, test_loss: 0.9918, test_f1: 0.5054
 epoch: 3, train_loss: 1.0235, test_loss: 0.9448, test_f1: 0.5096
 epoch: 4, train_loss: 0.9968, test_loss: 0.9268, test_f1: 0.5136
 epoch: 5, train_loss: 0.9703, test_loss: 0.9199, test_f1: 0.5168
 epoch: 6, train_loss: 0.9458, test_loss: 0.9054, test_f1: 0.5249
 epoch: 7, train_loss: 0.9306, test_loss: 0.9047, test_f1: 0.5082
 epoch: 8, train_loss: 0.9129, test_loss: 0.9117, test_f1: 0.5109
 epoch: 9, train_loss: 0.9070, test_loss: 0.8850, test_f1: 0.5428
 epoch: 10, train_loss: 0.8901, test_loss: 0.9089, test_f1: 0.5419
 epoch: 11, train_loss: 0.8762, test_loss: 0.9142, test_f1: 0.5480
 epoch: 12, train_loss: 0.8664, test_loss: 0.8771, test_f1: 0.5595
 epoch: 13, train_loss: 0.8622, test_loss: 0.9180, test_f1: 0.5602
 epoch: 14, train_loss: 0.8488, test_loss: 0.8977, test_f1: 0.5354
 epoch: 15, train_loss: 0.8405, test_loss: 0.9233, test_f1: 0.5558
 epoch: 16, train_loss: 0.8289, test_loss: 0.8932, test_f1: 0.5704
 epoch: 17, train_loss: 0.8217, test_loss: 0.9072, test_f1: 0.5565
 epoch: 18, train_loss: 0.8073, test_loss: 0.9152, test_f1: 0.5546
 epoch: 19, train_loss: 0.8057, test_loss: 0.9116, test_f1: 0.5801
 epoch: 20, train_loss: 0.8039, test_loss: 0.8886, test_f1: 0.5554
 epoch: 21, train_loss: 0.7840, test_loss: 0.9147, test_f1: 0.5598
 epoch: 22, train_loss: 0.7755, test_loss: 0.9041, test_f1: 0.5670
 epoch: 23, train_loss: 0.7802, test_loss: 0.9080, test_f1: 0.5995
 epoch: 24, train_loss: 0.7583, test_loss: 0.9124, test_f1: 0.5853
 epoch: 25, train_loss: 0.7581, test_loss: 0.9733, test_f1: 0.5546
 epoch: 26, train_loss: 0.7618, test_loss: 0.8830, test_f1: 0.5964
 epoch: 27, train_loss: 0.7390, test_loss: 0.9177, test_f1: 0.5769
 epoch: 28, train_loss: 0.7460, test_loss: 0.9029, test_f1: 0.5850
 epoch: 29, train_loss: 0.7372, test_loss: 0.8591, test_f1: 0.6258
 epoch: 30, train_loss: 0.7369, test_loss: 0.9138, test_f1: 0.5990
 epoch: 31, train_loss: 0.7234, test_loss: 0.8704, test_f1: 0.6038
 epoch: 32, train_loss: 0.7147, test_loss: 0.8973, test_f1: 0.5994
 epoch: 33, train_loss: 0.7145, test_loss: 0.8808, test_f1: 0.6192
 epoch: 34, train_loss: 0.7036, test_loss: 0.9182, test_f1: 0.6156
 epoch: 35, train_loss: 0.6952, test_loss: 0.9132, test_f1: 0.6297
 epoch: 36, train_loss: 0.7060, test_loss: 0.9147, test_f1: 0.6048
 epoch: 37, train_loss: 0.6824, test_loss: 0.9305, test_f1: 0.6194
 epoch: 38, train_loss: 0.6740, test_loss: 0.9255, test_f1: 0.6385
 epoch: 39, train_loss: 0.6729, test_loss: 0.9179, test_f1: 0.6303
 epoch: 40, train_loss: 0.6752, test_loss: 0.8807, test_f1: 0.6259
 epoch: 41, train_loss: 0.6647, test_loss: 0.8961, test_f1: 0.6395
 epoch: 42, train_loss: 0.6581, test_loss: 0.8876, test_f1: 0.6518
 epoch: 43, train_loss: 0.6525, test_loss: 0.9149, test_f1: 0.6213
 epoch: 44, train_loss: 0.6433, test_loss: 0.9262, test_f1: 0.6197
 epoch: 45, train_loss: 0.6305, test_loss: 0.9185, test_f1: 0.6289
 epoch: 46, train_loss: 0.6471, test_loss: 0.9210, test_f1: 0.6326
 epoch: 47, train_loss: 0.6266, test_loss: 0.9246, test_f1: 0.6668
 epoch: 48, train_loss: 0.6317, test_loss: 0.9493, test_f1: 0.6308
 epoch: 49, train_loss: 0.6216, test_loss: 0.9252, test_f1: 0.6628
 epoch: 50, train_loss: 0.6177, test_loss: 0.9094, test_f1: 0.6428
 epoch: 51, train_loss: 0.5927, test_loss: 0.9089, test_f1: 0.6596
 epoch: 52, train_loss: 0.5785, test_loss: 0.9101, test_f1: 0.6784
 epoch: 53, train_loss: 0.5770, test_loss: 0.9616, test_f1: 0.6448
 epoch: 54, train_loss: 0.5844, test_loss: 0.9564, test_f1: 0.6270
 epoch: 55, train_loss: 0.5812, test_loss: 0.9379, test_f1: 0.6419
 epoch: 56, train_loss: 0.5709, test_loss: 0.9629, test_f1: 0.6437
 epoch: 57, train_loss: 0.5701, test_loss: 0.9523, test_f1: 0.6466
 epoch: 58, train_loss: 0.5678, test_loss: 0.9689, test_f1: 0.6124
 epoch: 59, train_loss: 0.5659, test_loss: 0.9577, test_f1: 0.6337
 epoch: 60, train_loss: 0.5717, test_loss: 0.9559, test_f1: 0.6671
 epoch: 61, train_loss: 0.5459, test_loss: 0.9750, test_f1: 0.6517
 epoch: 62, train_loss: 0.5495, test_loss: 0.9899, test_f1: 0.6476
 epoch: 63, train_loss: 0.5383, test_loss: 0.9781, test_f1: 0.6441
 epoch: 64, train_loss: 0.5440, test_loss: 0.9775, test_f1: 0.6236
 epoch: 65, train_loss: 0.5532, test_loss: 0.9605, test_f1: 0.6364
 epoch: 66, train_loss: 0.5421, test_loss: 0.9800, test_f1: 0.6226
 epoch: 67, train_loss: 0.5387, test_loss: 0.9893, test_f1: 0.6323
 epoch: 68, train_loss: 0.5349, test_loss: 0.9815, test_f1: 0.6463
 epoch: 69, train_loss: 0.5309, test_loss: 1.0078, test_f1: 0.6194
 epoch: 70, train_loss: 0.5279, test_loss: 1.0094, test_f1: 0.6291
 epoch: 71, train_loss: 0.5205, test_loss: 0.9905, test_f1: 0.6432
 epoch: 72, train_loss: 0.5214, test_loss: 1.0109, test_f1: 0.6495
 epoch: 73, train_loss: 0.5213, test_loss: 1.0031, test_f1: 0.6486
 epoch: 74, train_loss: 0.5266, test_loss: 0.9602, test_f1: 0.6350
 epoch: 75, train_loss: 0.5104, test_loss: 1.0064, test_f1: 0.6276
 epoch: 76, train_loss: 0.5123, test_loss: 1.0292, test_f1: 0.6318
 epoch: 77, train_loss: 0.5131, test_loss: 1.0349, test_f1: 0.6348
 epoch: 78, train_loss: 0.5003, test_loss: 1.0290, test_f1: 0.6579
 epoch: 79, train_loss: 0.5150, test_loss: 1.0149, test_f1: 0.6301
 epoch: 80, train_loss: 0.4984, test_loss: 1.0438, test_f1: 0.6360
 epoch: 81, train_loss: 0.5098, test_loss: 1.0355, test_f1: 0.6396
 epoch: 82, train_loss: 0.5027, test_loss: 1.0685, test_f1: 0.6368
 epoch: 83, train_loss: 0.4830, test_loss: 1.0453, test_f1: 0.6396
 epoch: 84, train_loss: 0.4814, test_loss: 1.0756, test_f1: 0.6334
 epoch: 85, train_loss: 0.5008, test_loss: 1.0423, test_f1: 0.6430
 epoch: 86, train_loss: 0.4912, test_loss: 1.0430, test_f1: 0.6367
 epoch: 87, train_loss: 0.4762, test_loss: 1.0824, test_f1: 0.6306
 epoch: 88, train_loss: 0.4851, test_loss: 1.0712, test_f1: 0.6459
 epoch: 89, train_loss: 0.4872, test_loss: 1.0825, test_f1: 0.6308
 epoch: 90, train_loss: 0.4738, test_loss: 1.0811, test_f1: 0.6398
 epoch: 91, train_loss: 0.4665, test_loss: 1.0877, test_f1: 0.6434
 epoch: 92, train_loss: 0.4665, test_loss: 1.0794, test_f1: 0.6389
 epoch: 93, train_loss: 0.4773, test_loss: 1.0977, test_f1: 0.6291
 epoch: 94, train_loss: 0.4643, test_loss: 1.1153, test_f1: 0.6368
 epoch: 95, train_loss: 0.4785, test_loss: 1.0956, test_f1: 0.6476
 epoch: 96, train_loss: 0.4803, test_loss: 1.1180, test_f1: 0.6150
 epoch: 97, train_loss: 0.4666, test_loss: 1.0983, test_f1: 0.6302
 epoch: 98, train_loss: 0.4539, test_loss: 1.1179, test_f1: 0.6409
 epoch: 99, train_loss: 0.4697, test_loss: 1.1128, test_f1: 0.6374
##################ITERATION #3 ****************************************
 epoch: 0, train_loss: 1.2040, test_loss: 1.1568, test_f1: 0.4509
 epoch: 1, train_loss: 1.1002, test_loss: 1.0354, test_f1: 0.4585
 epoch: 2, train_loss: 1.0497, test_loss: 0.9984, test_f1: 0.4880
 epoch: 3, train_loss: 1.0165, test_loss: 0.9781, test_f1: 0.4868
 epoch: 4, train_loss: 0.9892, test_loss: 0.9661, test_f1: 0.4872
 epoch: 5, train_loss: 0.9713, test_loss: 0.9506, test_f1: 0.5050
 epoch: 6, train_loss: 0.9396, test_loss: 0.9436, test_f1: 0.4954
 epoch: 7, train_loss: 0.9293, test_loss: 0.9395, test_f1: 0.5117
 epoch: 8, train_loss: 0.9076, test_loss: 0.9482, test_f1: 0.5270
 epoch: 9, train_loss: 0.9012, test_loss: 0.9440, test_f1: 0.5157
 epoch: 10, train_loss: 0.8860, test_loss: 0.9346, test_f1: 0.5420
 epoch: 11, train_loss: 0.8729, test_loss: 0.9167, test_f1: 0.5529
 epoch: 12, train_loss: 0.8669, test_loss: 0.9315, test_f1: 0.5539
 epoch: 13, train_loss: 0.8469, test_loss: 0.9127, test_f1: 0.5624
 epoch: 14, train_loss: 0.8417, test_loss: 0.9348, test_f1: 0.5661
 epoch: 15, train_loss: 0.8220, test_loss: 0.9426, test_f1: 0.5657
 epoch: 16, train_loss: 0.8267, test_loss: 0.9299, test_f1: 0.5577
 epoch: 17, train_loss: 0.8095, test_loss: 0.9506, test_f1: 0.5660
 epoch: 18, train_loss: 0.8051, test_loss: 0.9249, test_f1: 0.5701
 epoch: 19, train_loss: 0.7949, test_loss: 0.9528, test_f1: 0.5792
 epoch: 20, train_loss: 0.7868, test_loss: 0.9502, test_f1: 0.5671
 epoch: 21, train_loss: 0.7775, test_loss: 0.9256, test_f1: 0.5918
 epoch: 22, train_loss: 0.7696, test_loss: 0.9183, test_f1: 0.5642
 epoch: 23, train_loss: 0.7825, test_loss: 0.9221, test_f1: 0.5846
 epoch: 24, train_loss: 0.7572, test_loss: 0.9469, test_f1: 0.5968
 epoch: 25, train_loss: 0.7585, test_loss: 0.9264, test_f1: 0.5852
 epoch: 26, train_loss: 0.7413, test_loss: 0.9467, test_f1: 0.5831
 epoch: 27, train_loss: 0.7423, test_loss: 0.9521, test_f1: 0.5857
 epoch: 28, train_loss: 0.7396, test_loss: 0.9421, test_f1: 0.5817
 epoch: 29, train_loss: 0.7298, test_loss: 0.9297, test_f1: 0.6060
 epoch: 30, train_loss: 0.7251, test_loss: 0.9390, test_f1: 0.5943
 epoch: 31, train_loss: 0.7177, test_loss: 0.9400, test_f1: 0.5986
 epoch: 32, train_loss: 0.7139, test_loss: 0.9540, test_f1: 0.6113
 epoch: 33, train_loss: 0.7053, test_loss: 0.9613, test_f1: 0.5790
 epoch: 34, train_loss: 0.6987, test_loss: 0.9535, test_f1: 0.6096
 epoch: 35, train_loss: 0.7004, test_loss: 0.9604, test_f1: 0.6057
 epoch: 36, train_loss: 0.6844, test_loss: 0.9701, test_f1: 0.5972
 epoch: 37, train_loss: 0.6812, test_loss: 0.9938, test_f1: 0.5686
 epoch: 38, train_loss: 0.6807, test_loss: 0.9426, test_f1: 0.5914
 epoch: 39, train_loss: 0.6707, test_loss: 0.9794, test_f1: 0.5790
 epoch: 40, train_loss: 0.6620, test_loss: 0.9683, test_f1: 0.6163
 epoch: 41, train_loss: 0.6635, test_loss: 0.9904, test_f1: 0.6003
 epoch: 42, train_loss: 0.6577, test_loss: 0.9491, test_f1: 0.6272
 epoch: 43, train_loss: 0.6454, test_loss: 0.9742, test_f1: 0.6150
 epoch: 44, train_loss: 0.6485, test_loss: 1.0041, test_f1: 0.5979
 epoch: 45, train_loss: 0.6368, test_loss: 1.0222, test_f1: 0.5922
 epoch: 46, train_loss: 0.6363, test_loss: 1.0075, test_f1: 0.6016
 epoch: 47, train_loss: 0.6218, test_loss: 1.0100, test_f1: 0.6043
 epoch: 48, train_loss: 0.6357, test_loss: 0.9601, test_f1: 0.6341
 epoch: 49, train_loss: 0.6070, test_loss: 1.0452, test_f1: 0.5960
 epoch: 50, train_loss: 0.6190, test_loss: 0.9925, test_f1: 0.6401
 epoch: 51, train_loss: 0.6014, test_loss: 0.9920, test_f1: 0.6214
 epoch: 52, train_loss: 0.5902, test_loss: 1.0032, test_f1: 0.6120
 epoch: 53, train_loss: 0.5870, test_loss: 1.0053, test_f1: 0.6245
 epoch: 54, train_loss: 0.5704, test_loss: 1.0085, test_f1: 0.6274
 epoch: 55, train_loss: 0.5784, test_loss: 1.0200, test_f1: 0.6322
 epoch: 56, train_loss: 0.5792, test_loss: 1.0324, test_f1: 0.6300
 epoch: 57, train_loss: 0.5646, test_loss: 1.0213, test_f1: 0.6239
 epoch: 58, train_loss: 0.5659, test_loss: 1.0393, test_f1: 0.6184
 epoch: 59, train_loss: 0.5439, test_loss: 1.0417, test_f1: 0.6280
 epoch: 60, train_loss: 0.5462, test_loss: 1.0554, test_f1: 0.6109
 epoch: 61, train_loss: 0.5521, test_loss: 1.0462, test_f1: 0.6304
 epoch: 62, train_loss: 0.5576, test_loss: 1.0405, test_f1: 0.6220
 epoch: 63, train_loss: 0.5515, test_loss: 1.0447, test_f1: 0.6375
 epoch: 64, train_loss: 0.5325, test_loss: 1.0603, test_f1: 0.6320
 epoch: 65, train_loss: 0.5437, test_loss: 1.0601, test_f1: 0.6212
 epoch: 66, train_loss: 0.5445, test_loss: 1.0428, test_f1: 0.6443
 epoch: 67, train_loss: 0.5345, test_loss: 1.0759, test_f1: 0.6172
 epoch: 68, train_loss: 0.5277, test_loss: 1.1010, test_f1: 0.6297
 epoch: 69, train_loss: 0.5269, test_loss: 1.0693, test_f1: 0.6295
 epoch: 70, train_loss: 0.5206, test_loss: 1.0583, test_f1: 0.6384
 epoch: 71, train_loss: 0.5247, test_loss: 1.0910, test_f1: 0.6334
 epoch: 72, train_loss: 0.5120, test_loss: 1.0766, test_f1: 0.6417
 epoch: 73, train_loss: 0.5165, test_loss: 1.0588, test_f1: 0.6212
 epoch: 74, train_loss: 0.5219, test_loss: 1.0869, test_f1: 0.6355
 epoch: 75, train_loss: 0.5222, test_loss: 1.0886, test_f1: 0.6345
 epoch: 76, train_loss: 0.5167, test_loss: 1.0837, test_f1: 0.6325
 epoch: 77, train_loss: 0.5061, test_loss: 1.1131, test_f1: 0.6292
 epoch: 78, train_loss: 0.4917, test_loss: 1.0881, test_f1: 0.6426
 epoch: 79, train_loss: 0.4881, test_loss: 1.0942, test_f1: 0.6253
 epoch: 80, train_loss: 0.4937, test_loss: 1.1164, test_f1: 0.6377
 epoch: 81, train_loss: 0.4860, test_loss: 1.1092, test_f1: 0.6521
 epoch: 82, train_loss: 0.4958, test_loss: 1.1125, test_f1: 0.6472
 epoch: 83, train_loss: 0.4842, test_loss: 1.0890, test_f1: 0.6326
 epoch: 84, train_loss: 0.4708, test_loss: 1.1106, test_f1: 0.6485
 epoch: 85, train_loss: 0.4791, test_loss: 1.1290, test_f1: 0.6159
 epoch: 86, train_loss: 0.4793, test_loss: 1.1412, test_f1: 0.6354
 epoch: 87, train_loss: 0.4698, test_loss: 1.1046, test_f1: 0.6343
 epoch: 88, train_loss: 0.4692, test_loss: 1.1773, test_f1: 0.6148
 epoch: 89, train_loss: 0.4664, test_loss: 1.1333, test_f1: 0.6357
 epoch: 90, train_loss: 0.4768, test_loss: 1.1626, test_f1: 0.6430
 epoch: 91, train_loss: 0.4705, test_loss: 1.1650, test_f1: 0.6266
 epoch: 92, train_loss: 0.4730, test_loss: 1.1824, test_f1: 0.6515
 epoch: 93, train_loss: 0.4601, test_loss: 1.1608, test_f1: 0.6335
 epoch: 94, train_loss: 0.4520, test_loss: 1.1834, test_f1: 0.6391
 epoch: 95, train_loss: 0.4651, test_loss: 1.1559, test_f1: 0.6449
 epoch: 96, train_loss: 0.4670, test_loss: 1.2012, test_f1: 0.6398
 epoch: 97, train_loss: 0.4525, test_loss: 1.1710, test_f1: 0.6377
 epoch: 98, train_loss: 0.4507, test_loss: 1.2070, test_f1: 0.6170
 epoch: 99, train_loss: 0.4490, test_loss: 1.2155, test_f1: 0.6372
##################ITERATION #4 ****************************************
 epoch: 0, train_loss: 1.1908, test_loss: 1.1239, test_f1: 0.4069
 epoch: 1, train_loss: 1.0678, test_loss: 0.9949, test_f1: 0.4587
 epoch: 2, train_loss: 1.0290, test_loss: 0.9539, test_f1: 0.5008
 epoch: 3, train_loss: 0.9983, test_loss: 0.9463, test_f1: 0.4913
 epoch: 4, train_loss: 0.9686, test_loss: 0.9341, test_f1: 0.5006
 epoch: 5, train_loss: 0.9451, test_loss: 0.9300, test_f1: 0.5188
 epoch: 6, train_loss: 0.9146, test_loss: 0.9197, test_f1: 0.5345
 epoch: 7, train_loss: 0.9073, test_loss: 0.9197, test_f1: 0.5345
 epoch: 8, train_loss: 0.9068, test_loss: 0.8914, test_f1: 0.5324
 epoch: 9, train_loss: 0.8789, test_loss: 0.9309, test_f1: 0.5187
 epoch: 10, train_loss: 0.8623, test_loss: 0.9080, test_f1: 0.5380
 epoch: 11, train_loss: 0.8631, test_loss: 0.9369, test_f1: 0.5319
 epoch: 12, train_loss: 0.8444, test_loss: 0.9057, test_f1: 0.5812
 epoch: 13, train_loss: 0.8332, test_loss: 0.8978, test_f1: 0.5799
 epoch: 14, train_loss: 0.8234, test_loss: 0.8977, test_f1: 0.5730
 epoch: 15, train_loss: 0.8135, test_loss: 0.9000, test_f1: 0.5960
 epoch: 16, train_loss: 0.8240, test_loss: 0.8868, test_f1: 0.5660
 epoch: 17, train_loss: 0.8125, test_loss: 0.8949, test_f1: 0.5980
 epoch: 18, train_loss: 0.8005, test_loss: 0.9001, test_f1: 0.6011
 epoch: 19, train_loss: 0.7798, test_loss: 0.9073, test_f1: 0.5594
 epoch: 20, train_loss: 0.7766, test_loss: 0.8940, test_f1: 0.5790
 epoch: 21, train_loss: 0.7715, test_loss: 0.8857, test_f1: 0.6074
 epoch: 22, train_loss: 0.7560, test_loss: 0.8935, test_f1: 0.6146
 epoch: 23, train_loss: 0.7523, test_loss: 0.8901, test_f1: 0.5962
 epoch: 24, train_loss: 0.7491, test_loss: 0.8901, test_f1: 0.5930
 epoch: 25, train_loss: 0.7387, test_loss: 0.8910, test_f1: 0.5878
 epoch: 26, train_loss: 0.7336, test_loss: 0.8852, test_f1: 0.6043
 epoch: 27, train_loss: 0.7298, test_loss: 0.9073, test_f1: 0.5910
 epoch: 28, train_loss: 0.7290, test_loss: 0.8898, test_f1: 0.6092
 epoch: 29, train_loss: 0.7163, test_loss: 0.8990, test_f1: 0.6114
 epoch: 30, train_loss: 0.7081, test_loss: 0.8894, test_f1: 0.6268
 epoch: 31, train_loss: 0.6970, test_loss: 0.8977, test_f1: 0.6254
 epoch: 32, train_loss: 0.6886, test_loss: 0.8860, test_f1: 0.6008
 epoch: 33, train_loss: 0.6856, test_loss: 0.8985, test_f1: 0.6015
 epoch: 34, train_loss: 0.6833, test_loss: 0.8935, test_f1: 0.6470
 epoch: 35, train_loss: 0.6742, test_loss: 0.8654, test_f1: 0.6382
 epoch: 36, train_loss: 0.6774, test_loss: 0.8926, test_f1: 0.6393
 epoch: 37, train_loss: 0.6660, test_loss: 0.8915, test_f1: 0.6396
 epoch: 38, train_loss: 0.6524, test_loss: 0.9070, test_f1: 0.6201
 epoch: 39, train_loss: 0.6509, test_loss: 0.8712, test_f1: 0.6432
 epoch: 40, train_loss: 0.6480, test_loss: 0.9289, test_f1: 0.6251
 epoch: 41, train_loss: 0.6566, test_loss: 0.8899, test_f1: 0.6316
 epoch: 42, train_loss: 0.6527, test_loss: 0.8777, test_f1: 0.6357
 epoch: 43, train_loss: 0.6308, test_loss: 0.9284, test_f1: 0.6359
 epoch: 44, train_loss: 0.6378, test_loss: 0.9108, test_f1: 0.6544
 epoch: 45, train_loss: 0.6105, test_loss: 0.9317, test_f1: 0.6307
 epoch: 46, train_loss: 0.6177, test_loss: 0.9029, test_f1: 0.6347
 epoch: 47, train_loss: 0.6075, test_loss: 0.9263, test_f1: 0.6329
 epoch: 48, train_loss: 0.6038, test_loss: 0.9134, test_f1: 0.6498
 epoch: 49, train_loss: 0.5965, test_loss: 0.9169, test_f1: 0.6444
 epoch: 50, train_loss: 0.5883, test_loss: 0.9244, test_f1: 0.6434
 epoch: 51, train_loss: 0.5724, test_loss: 0.9338, test_f1: 0.6660
 epoch: 52, train_loss: 0.5589, test_loss: 0.9222, test_f1: 0.6537
 epoch: 53, train_loss: 0.5610, test_loss: 0.9182, test_f1: 0.6830
 epoch: 54, train_loss: 0.5492, test_loss: 0.9190, test_f1: 0.6517
 epoch: 55, train_loss: 0.5442, test_loss: 0.8903, test_f1: 0.6791
 epoch: 56, train_loss: 0.5311, test_loss: 0.9092, test_f1: 0.6780
 epoch: 57, train_loss: 0.5320, test_loss: 0.9269, test_f1: 0.6607
 epoch: 58, train_loss: 0.5413, test_loss: 0.9439, test_f1: 0.6602
 epoch: 59, train_loss: 0.5353, test_loss: 0.9359, test_f1: 0.6619
 epoch: 60, train_loss: 0.5277, test_loss: 0.9360, test_f1: 0.6608
 epoch: 61, train_loss: 0.5199, test_loss: 0.9417, test_f1: 0.6697
 epoch: 62, train_loss: 0.5346, test_loss: 0.9349, test_f1: 0.6683
 epoch: 63, train_loss: 0.5113, test_loss: 0.9329, test_f1: 0.6677
 epoch: 64, train_loss: 0.5271, test_loss: 0.9502, test_f1: 0.6633
 epoch: 65, train_loss: 0.5096, test_loss: 0.9600, test_f1: 0.6600
 epoch: 66, train_loss: 0.5167, test_loss: 0.9589, test_f1: 0.6667
 epoch: 67, train_loss: 0.5157, test_loss: 0.9319, test_f1: 0.6763
 epoch: 68, train_loss: 0.5132, test_loss: 0.9307, test_f1: 0.6533
 epoch: 69, train_loss: 0.5147, test_loss: 0.9433, test_f1: 0.6527
 epoch: 70, train_loss: 0.5109, test_loss: 0.9597, test_f1: 0.6625
 epoch: 71, train_loss: 0.5021, test_loss: 0.9511, test_f1: 0.6686
 epoch: 72, train_loss: 0.4847, test_loss: 0.9465, test_f1: 0.6824
 epoch: 73, train_loss: 0.4927, test_loss: 0.9508, test_f1: 0.6548
 epoch: 74, train_loss: 0.4776, test_loss: 0.9706, test_f1: 0.6547
 epoch: 75, train_loss: 0.4949, test_loss: 0.9651, test_f1: 0.6734
 epoch: 76, train_loss: 0.4811, test_loss: 0.9669, test_f1: 0.6802
 epoch: 77, train_loss: 0.4773, test_loss: 0.9526, test_f1: 0.6429
 epoch: 78, train_loss: 0.4690, test_loss: 0.9472, test_f1: 0.6517
 epoch: 79, train_loss: 0.4594, test_loss: 0.9908, test_f1: 0.6727
 epoch: 80, train_loss: 0.4691, test_loss: 0.9796, test_f1: 0.6826
 epoch: 81, train_loss: 0.4637, test_loss: 0.9705, test_f1: 0.6681
 epoch: 82, train_loss: 0.4621, test_loss: 0.9820, test_f1: 0.6503
 epoch: 83, train_loss: 0.4640, test_loss: 0.9928, test_f1: 0.6729
 epoch: 84, train_loss: 0.4566, test_loss: 0.9980, test_f1: 0.6500
 epoch: 85, train_loss: 0.4479, test_loss: 0.9932, test_f1: 0.6708
 epoch: 86, train_loss: 0.4527, test_loss: 0.9851, test_f1: 0.6848
 epoch: 87, train_loss: 0.4565, test_loss: 1.0025, test_f1: 0.6537
 epoch: 88, train_loss: 0.4444, test_loss: 1.0181, test_f1: 0.6698
 epoch: 89, train_loss: 0.4459, test_loss: 0.9924, test_f1: 0.6614
 epoch: 90, train_loss: 0.4582, test_loss: 1.0323, test_f1: 0.6661
 epoch: 91, train_loss: 0.4394, test_loss: 1.0412, test_f1: 0.6437
 epoch: 92, train_loss: 0.4519, test_loss: 1.0226, test_f1: 0.6562
 epoch: 93, train_loss: 0.4416, test_loss: 1.0572, test_f1: 0.6668
 epoch: 94, train_loss: 0.4438, test_loss: 1.0165, test_f1: 0.6574
 epoch: 95, train_loss: 0.4223, test_loss: 0.9988, test_f1: 0.6766
 epoch: 96, train_loss: 0.4417, test_loss: 1.0377, test_f1: 0.6456
 epoch: 97, train_loss: 0.4178, test_loss: 1.0427, test_f1: 0.6599
 epoch: 98, train_loss: 0.4405, test_loss: 1.0205, test_f1: 0.6755
 epoch: 99, train_loss: 0.4272, test_loss: 1.0786, test_f1: 0.6777
##################ITERATION #5 ****************************************
 epoch: 0, train_loss: 1.2248, test_loss: 1.1593, test_f1: 0.4311
 epoch: 1, train_loss: 1.0837, test_loss: 0.9833, test_f1: 0.5118
 epoch: 2, train_loss: 1.0278, test_loss: 0.9602, test_f1: 0.5119
 epoch: 3, train_loss: 0.9992, test_loss: 0.9429, test_f1: 0.5122
 epoch: 4, train_loss: 0.9750, test_loss: 0.9225, test_f1: 0.5217
 epoch: 5, train_loss: 0.9541, test_loss: 0.9219, test_f1: 0.5407
 epoch: 6, train_loss: 0.9362, test_loss: 0.9154, test_f1: 0.5314
 epoch: 7, train_loss: 0.9182, test_loss: 0.8882, test_f1: 0.5424
 epoch: 8, train_loss: 0.9078, test_loss: 0.9064, test_f1: 0.5659
 epoch: 9, train_loss: 0.8955, test_loss: 0.8864, test_f1: 0.5765
 epoch: 10, train_loss: 0.8874, test_loss: 0.9021, test_f1: 0.5353
 epoch: 11, train_loss: 0.8759, test_loss: 0.8874, test_f1: 0.5601
 epoch: 12, train_loss: 0.8640, test_loss: 0.8752, test_f1: 0.5776
 epoch: 13, train_loss: 0.8550, test_loss: 0.8583, test_f1: 0.6005
 epoch: 14, train_loss: 0.8305, test_loss: 0.8620, test_f1: 0.5584
 epoch: 15, train_loss: 0.8241, test_loss: 0.8667, test_f1: 0.5775
 epoch: 16, train_loss: 0.8247, test_loss: 0.8626, test_f1: 0.5854
 epoch: 17, train_loss: 0.8123, test_loss: 0.8674, test_f1: 0.5729
 epoch: 18, train_loss: 0.7995, test_loss: 0.8391, test_f1: 0.6097
 epoch: 19, train_loss: 0.7984, test_loss: 0.8518, test_f1: 0.5984
 epoch: 20, train_loss: 0.7891, test_loss: 0.8281, test_f1: 0.6128
 epoch: 21, train_loss: 0.7722, test_loss: 0.8876, test_f1: 0.6094
 epoch: 22, train_loss: 0.7792, test_loss: 0.8480, test_f1: 0.6221
 epoch: 23, train_loss: 0.7750, test_loss: 0.8592, test_f1: 0.6288
 epoch: 24, train_loss: 0.7419, test_loss: 0.8371, test_f1: 0.6537
 epoch: 25, train_loss: 0.7460, test_loss: 0.8467, test_f1: 0.6124
 epoch: 26, train_loss: 0.7408, test_loss: 0.8798, test_f1: 0.6097
 epoch: 27, train_loss: 0.7433, test_loss: 0.8757, test_f1: 0.6225
 epoch: 28, train_loss: 0.7119, test_loss: 0.8883, test_f1: 0.6107
 epoch: 29, train_loss: 0.7120, test_loss: 0.8762, test_f1: 0.6300
 epoch: 30, train_loss: 0.7225, test_loss: 0.8794, test_f1: 0.6235
 epoch: 31, train_loss: 0.7096, test_loss: 0.8692, test_f1: 0.6271
 epoch: 32, train_loss: 0.6963, test_loss: 0.8546, test_f1: 0.6155
 epoch: 33, train_loss: 0.6992, test_loss: 0.8575, test_f1: 0.6130
 epoch: 34, train_loss: 0.6900, test_loss: 0.8896, test_f1: 0.6150
 epoch: 35, train_loss: 0.6742, test_loss: 0.8630, test_f1: 0.6353
 epoch: 36, train_loss: 0.6739, test_loss: 0.8678, test_f1: 0.6411
 epoch: 37, train_loss: 0.6787, test_loss: 0.8448, test_f1: 0.6684
 epoch: 38, train_loss: 0.6637, test_loss: 0.8662, test_f1: 0.6408
 epoch: 39, train_loss: 0.6557, test_loss: 0.8632, test_f1: 0.6493
 epoch: 40, train_loss: 0.6376, test_loss: 0.8491, test_f1: 0.6578
 epoch: 41, train_loss: 0.6722, test_loss: 0.8672, test_f1: 0.6405
 epoch: 42, train_loss: 0.6426, test_loss: 0.8813, test_f1: 0.6707
 epoch: 43, train_loss: 0.6390, test_loss: 0.8635, test_f1: 0.6287
 epoch: 44, train_loss: 0.6235, test_loss: 0.8704, test_f1: 0.6524
 epoch: 45, train_loss: 0.6233, test_loss: 0.8878, test_f1: 0.6431
 epoch: 46, train_loss: 0.6213, test_loss: 0.8689, test_f1: 0.6568
 epoch: 47, train_loss: 0.6177, test_loss: 0.8475, test_f1: 0.6389
 epoch: 48, train_loss: 0.6092, test_loss: 0.8325, test_f1: 0.6461
 epoch: 49, train_loss: 0.6059, test_loss: 0.8619, test_f1: 0.6371
 epoch: 50, train_loss: 0.5882, test_loss: 0.9213, test_f1: 0.6308
 epoch: 51, train_loss: 0.5935, test_loss: 0.8818, test_f1: 0.6503
 epoch: 52, train_loss: 0.5716, test_loss: 0.8960, test_f1: 0.6501
 epoch: 53, train_loss: 0.5677, test_loss: 0.8979, test_f1: 0.6383
 epoch: 54, train_loss: 0.5571, test_loss: 0.8840, test_f1: 0.6517
 epoch: 55, train_loss: 0.5471, test_loss: 0.9033, test_f1: 0.6562
 epoch: 56, train_loss: 0.5605, test_loss: 0.9100, test_f1: 0.6570
 epoch: 57, train_loss: 0.5548, test_loss: 0.9091, test_f1: 0.6544
 epoch: 58, train_loss: 0.5404, test_loss: 0.9153, test_f1: 0.6338
 epoch: 59, train_loss: 0.5256, test_loss: 0.9178, test_f1: 0.6419
 epoch: 60, train_loss: 0.5294, test_loss: 0.9327, test_f1: 0.6468
 epoch: 61, train_loss: 0.5377, test_loss: 0.9224, test_f1: 0.6502
 epoch: 62, train_loss: 0.5307, test_loss: 0.9342, test_f1: 0.6681
 epoch: 63, train_loss: 0.5315, test_loss: 0.9377, test_f1: 0.6685
 epoch: 64, train_loss: 0.5276, test_loss: 0.9213, test_f1: 0.6688
 epoch: 65, train_loss: 0.5310, test_loss: 0.9419, test_f1: 0.6423
 epoch: 66, train_loss: 0.5242, test_loss: 0.9653, test_f1: 0.6555
 epoch: 67, train_loss: 0.5121, test_loss: 0.9338, test_f1: 0.6657
 epoch: 68, train_loss: 0.5222, test_loss: 0.9389, test_f1: 0.6488
 epoch: 69, train_loss: 0.5019, test_loss: 0.9431, test_f1: 0.6458
 epoch: 70, train_loss: 0.5109, test_loss: 0.9631, test_f1: 0.6471
 epoch: 71, train_loss: 0.4997, test_loss: 0.9774, test_f1: 0.6562
 epoch: 72, train_loss: 0.5054, test_loss: 0.9718, test_f1: 0.6522
 epoch: 73, train_loss: 0.4965, test_loss: 0.9680, test_f1: 0.6582
 epoch: 74, train_loss: 0.4984, test_loss: 0.9949, test_f1: 0.6567
 epoch: 75, train_loss: 0.4939, test_loss: 0.9618, test_f1: 0.6656
 epoch: 76, train_loss: 0.5043, test_loss: 0.9991, test_f1: 0.6566
 epoch: 77, train_loss: 0.5051, test_loss: 0.9889, test_f1: 0.6593
 epoch: 78, train_loss: 0.4902, test_loss: 1.0194, test_f1: 0.6365
 epoch: 79, train_loss: 0.4775, test_loss: 1.0040, test_f1: 0.6498
 epoch: 80, train_loss: 0.4744, test_loss: 1.0399, test_f1: 0.6439
 epoch: 81, train_loss: 0.4825, test_loss: 1.0298, test_f1: 0.6458
 epoch: 82, train_loss: 0.4891, test_loss: 0.9643, test_f1: 0.6523
 epoch: 83, train_loss: 0.4817, test_loss: 1.0528, test_f1: 0.6343
 epoch: 84, train_loss: 0.4680, test_loss: 1.0339, test_f1: 0.6406
 epoch: 85, train_loss: 0.4618, test_loss: 0.9606, test_f1: 0.6492
 epoch: 86, train_loss: 0.4745, test_loss: 1.0116, test_f1: 0.6518
 epoch: 87, train_loss: 0.4624, test_loss: 1.0559, test_f1: 0.6576
 epoch: 88, train_loss: 0.4719, test_loss: 1.0209, test_f1: 0.6703
 epoch: 89, train_loss: 0.4588, test_loss: 1.0306, test_f1: 0.6380
 epoch: 90, train_loss: 0.4614, test_loss: 1.0587, test_f1: 0.6531
 epoch: 91, train_loss: 0.4591, test_loss: 1.0322, test_f1: 0.6612
 epoch: 92, train_loss: 0.4400, test_loss: 1.0885, test_f1: 0.6491
 epoch: 93, train_loss: 0.4521, test_loss: 1.0558, test_f1: 0.6423
 epoch: 94, train_loss: 0.4437, test_loss: 1.0401, test_f1: 0.6677
 epoch: 95, train_loss: 0.4449, test_loss: 1.0419, test_f1: 0.6614
 epoch: 96, train_loss: 0.4486, test_loss: 1.0415, test_f1: 0.6639
 epoch: 97, train_loss: 0.4344, test_loss: 1.0840, test_f1: 0.6764
 epoch: 98, train_loss: 0.4374, test_loss: 1.0503, test_f1: 0.6769
 epoch: 99, train_loss: 0.4432, test_loss: 1.0254, test_f1: 0.6504
##################ITERATION #6 ****************************************
 epoch: 0, train_loss: 1.2296, test_loss: 1.2479, test_f1: 0.3577
 epoch: 1, train_loss: 1.1089, test_loss: 1.0132, test_f1: 0.4945
 epoch: 2, train_loss: 1.0658, test_loss: 0.9988, test_f1: 0.4905
 epoch: 3, train_loss: 1.0234, test_loss: 0.9598, test_f1: 0.5072
 epoch: 4, train_loss: 0.9923, test_loss: 0.9591, test_f1: 0.5088
 epoch: 5, train_loss: 0.9802, test_loss: 0.9493, test_f1: 0.5331
 epoch: 6, train_loss: 0.9624, test_loss: 0.9333, test_f1: 0.5409
 epoch: 7, train_loss: 0.9397, test_loss: 0.9243, test_f1: 0.5285
 epoch: 8, train_loss: 0.9207, test_loss: 0.9356, test_f1: 0.5427
 epoch: 9, train_loss: 0.9179, test_loss: 0.9206, test_f1: 0.5418
 epoch: 10, train_loss: 0.9064, test_loss: 0.9201, test_f1: 0.5391
 epoch: 11, train_loss: 0.8986, test_loss: 0.9160, test_f1: 0.5715
 epoch: 12, train_loss: 0.8905, test_loss: 0.9351, test_f1: 0.5380
 epoch: 13, train_loss: 0.8742, test_loss: 0.9037, test_f1: 0.5633
 epoch: 14, train_loss: 0.8556, test_loss: 0.9233, test_f1: 0.5603
 epoch: 15, train_loss: 0.8507, test_loss: 0.9079, test_f1: 0.5680
 epoch: 16, train_loss: 0.8526, test_loss: 0.9443, test_f1: 0.5519
 epoch: 17, train_loss: 0.8353, test_loss: 0.9186, test_f1: 0.5834
 epoch: 18, train_loss: 0.8229, test_loss: 0.9175, test_f1: 0.5733
 epoch: 19, train_loss: 0.8232, test_loss: 0.8963, test_f1: 0.5716
 epoch: 20, train_loss: 0.8079, test_loss: 0.9205, test_f1: 0.5706
 epoch: 21, train_loss: 0.7980, test_loss: 0.9272, test_f1: 0.5846
 epoch: 22, train_loss: 0.7919, test_loss: 0.9148, test_f1: 0.5726
 epoch: 23, train_loss: 0.7994, test_loss: 0.9258, test_f1: 0.5795
 epoch: 24, train_loss: 0.7764, test_loss: 0.9025, test_f1: 0.5740
 epoch: 25, train_loss: 0.7618, test_loss: 0.9138, test_f1: 0.5762
 epoch: 26, train_loss: 0.7659, test_loss: 0.9136, test_f1: 0.5776
 epoch: 27, train_loss: 0.7650, test_loss: 0.9228, test_f1: 0.5775
 epoch: 28, train_loss: 0.7519, test_loss: 0.9269, test_f1: 0.5746
 epoch: 29, train_loss: 0.7569, test_loss: 0.8965, test_f1: 0.5907
 epoch: 30, train_loss: 0.7584, test_loss: 0.9592, test_f1: 0.5785
 epoch: 31, train_loss: 0.7471, test_loss: 0.9545, test_f1: 0.5785
 epoch: 32, train_loss: 0.7371, test_loss: 0.9415, test_f1: 0.5983
 epoch: 33, train_loss: 0.7263, test_loss: 0.9212, test_f1: 0.6226
 epoch: 34, train_loss: 0.7240, test_loss: 0.9459, test_f1: 0.5983
 epoch: 35, train_loss: 0.7083, test_loss: 0.9478, test_f1: 0.5903
 epoch: 36, train_loss: 0.7115, test_loss: 0.9584, test_f1: 0.5801
 epoch: 37, train_loss: 0.7002, test_loss: 0.9553, test_f1: 0.5888
 epoch: 38, train_loss: 0.7065, test_loss: 0.9662, test_f1: 0.5829
 epoch: 39, train_loss: 0.6939, test_loss: 0.9606, test_f1: 0.6084
 epoch: 40, train_loss: 0.6989, test_loss: 0.9422, test_f1: 0.6050
 epoch: 41, train_loss: 0.6953, test_loss: 0.9210, test_f1: 0.6184
 epoch: 42, train_loss: 0.6871, test_loss: 0.9518, test_f1: 0.6049
 epoch: 43, train_loss: 0.6856, test_loss: 0.9422, test_f1: 0.6188
 epoch: 44, train_loss: 0.6722, test_loss: 0.9447, test_f1: 0.6128
 epoch: 45, train_loss: 0.6735, test_loss: 0.9554, test_f1: 0.5891
 epoch: 46, train_loss: 0.6525, test_loss: 0.9541, test_f1: 0.6149
 epoch: 47, train_loss: 0.6600, test_loss: 0.9129, test_f1: 0.6359
 epoch: 48, train_loss: 0.6397, test_loss: 0.9688, test_f1: 0.5963
 epoch: 49, train_loss: 0.6310, test_loss: 0.9556, test_f1: 0.6148
 epoch: 50, train_loss: 0.6396, test_loss: 0.9400, test_f1: 0.6110
 epoch: 51, train_loss: 0.6322, test_loss: 0.9549, test_f1: 0.6201
 epoch: 52, train_loss: 0.6121, test_loss: 0.9547, test_f1: 0.6129
 epoch: 53, train_loss: 0.6094, test_loss: 0.9574, test_f1: 0.6213
 epoch: 54, train_loss: 0.5977, test_loss: 0.9861, test_f1: 0.6146
 epoch: 55, train_loss: 0.5917, test_loss: 0.9525, test_f1: 0.6148
 epoch: 56, train_loss: 0.5895, test_loss: 0.9800, test_f1: 0.6060
 epoch: 57, train_loss: 0.5977, test_loss: 0.9852, test_f1: 0.6166
 epoch: 58, train_loss: 0.5889, test_loss: 0.9909, test_f1: 0.6129
 epoch: 59, train_loss: 0.6007, test_loss: 1.0163, test_f1: 0.6188
 epoch: 60, train_loss: 0.5770, test_loss: 0.9723, test_f1: 0.6182
 epoch: 61, train_loss: 0.5812, test_loss: 1.0033, test_f1: 0.6241
 epoch: 62, train_loss: 0.5763, test_loss: 0.9888, test_f1: 0.6350
 epoch: 63, train_loss: 0.5666, test_loss: 1.0106, test_f1: 0.6212
 epoch: 64, train_loss: 0.5657, test_loss: 0.9998, test_f1: 0.6103
 epoch: 65, train_loss: 0.5657, test_loss: 0.9968, test_f1: 0.6182
 epoch: 66, train_loss: 0.5569, test_loss: 0.9889, test_f1: 0.6048
 epoch: 67, train_loss: 0.5463, test_loss: 1.0332, test_f1: 0.6067
 epoch: 68, train_loss: 0.5513, test_loss: 0.9968, test_f1: 0.6304
 epoch: 69, train_loss: 0.5425, test_loss: 1.0086, test_f1: 0.6204
 epoch: 70, train_loss: 0.5519, test_loss: 0.9974, test_f1: 0.6373
 epoch: 71, train_loss: 0.5521, test_loss: 1.0593, test_f1: 0.6194
 epoch: 72, train_loss: 0.5559, test_loss: 1.0194, test_f1: 0.6210
 epoch: 73, train_loss: 0.5438, test_loss: 1.0461, test_f1: 0.6122
 epoch: 74, train_loss: 0.5460, test_loss: 1.0126, test_f1: 0.6426
 epoch: 75, train_loss: 0.5443, test_loss: 1.0276, test_f1: 0.6206
 epoch: 76, train_loss: 0.5355, test_loss: 1.0772, test_f1: 0.6289
 epoch: 77, train_loss: 0.5353, test_loss: 1.0357, test_f1: 0.6175
 epoch: 78, train_loss: 0.5322, test_loss: 1.0601, test_f1: 0.6226
 epoch: 79, train_loss: 0.5338, test_loss: 1.0609, test_f1: 0.6392
 epoch: 80, train_loss: 0.5134, test_loss: 1.0438, test_f1: 0.6180
 epoch: 81, train_loss: 0.5250, test_loss: 1.0431, test_f1: 0.6302
 epoch: 82, train_loss: 0.5183, test_loss: 1.0255, test_f1: 0.6520
 epoch: 83, train_loss: 0.4989, test_loss: 1.0295, test_f1: 0.6452
 epoch: 84, train_loss: 0.5127, test_loss: 1.0607, test_f1: 0.6303
 epoch: 85, train_loss: 0.5110, test_loss: 1.0788, test_f1: 0.6345
 epoch: 86, train_loss: 0.5065, test_loss: 1.0789, test_f1: 0.6364
 epoch: 87, train_loss: 0.5071, test_loss: 1.0646, test_f1: 0.6446
 epoch: 88, train_loss: 0.4990, test_loss: 1.0502, test_f1: 0.6338
 epoch: 89, train_loss: 0.4947, test_loss: 1.0926, test_f1: 0.6112
 epoch: 90, train_loss: 0.4768, test_loss: 1.0685, test_f1: 0.6268
 epoch: 91, train_loss: 0.4889, test_loss: 1.0876, test_f1: 0.6509
 epoch: 92, train_loss: 0.4936, test_loss: 1.0590, test_f1: 0.6463
 epoch: 93, train_loss: 0.4793, test_loss: 1.0798, test_f1: 0.6396
 epoch: 94, train_loss: 0.4802, test_loss: 1.1269, test_f1: 0.6296
 epoch: 95, train_loss: 0.4889, test_loss: 1.1644, test_f1: 0.6373
 epoch: 96, train_loss: 0.4778, test_loss: 1.0942, test_f1: 0.6432
 epoch: 97, train_loss: 0.4780, test_loss: 1.1435, test_f1: 0.6251
 epoch: 98, train_loss: 0.4707, test_loss: 1.1436, test_f1: 0.6151
 epoch: 99, train_loss: 0.4788, test_loss: 1.1209, test_f1: 0.6177
##################ITERATION #7 ****************************************
 epoch: 0, train_loss: 1.2540, test_loss: 1.1345, test_f1: 0.3957
 epoch: 1, train_loss: 1.1015, test_loss: 1.0027, test_f1: 0.4760
 epoch: 2, train_loss: 1.0616, test_loss: 0.9393, test_f1: 0.5435
 epoch: 3, train_loss: 1.0088, test_loss: 0.9413, test_f1: 0.5297
 epoch: 4, train_loss: 1.0017, test_loss: 0.9122, test_f1: 0.5030
 epoch: 5, train_loss: 0.9678, test_loss: 0.9011, test_f1: 0.5399
 epoch: 6, train_loss: 0.9484, test_loss: 0.9183, test_f1: 0.5277
 epoch: 7, train_loss: 0.9317, test_loss: 0.8905, test_f1: 0.5327
 epoch: 8, train_loss: 0.9247, test_loss: 0.8836, test_f1: 0.5483
 epoch: 9, train_loss: 0.9037, test_loss: 0.8747, test_f1: 0.5847
 epoch: 10, train_loss: 0.8866, test_loss: 0.8899, test_f1: 0.5619
 epoch: 11, train_loss: 0.8799, test_loss: 0.8822, test_f1: 0.5716
 epoch: 12, train_loss: 0.8741, test_loss: 0.8596, test_f1: 0.5887
 epoch: 13, train_loss: 0.8691, test_loss: 0.8445, test_f1: 0.6007
 epoch: 14, train_loss: 0.8476, test_loss: 0.8556, test_f1: 0.5738
 epoch: 15, train_loss: 0.8394, test_loss: 0.8500, test_f1: 0.5960
 epoch: 16, train_loss: 0.8299, test_loss: 0.8610, test_f1: 0.5998
 epoch: 17, train_loss: 0.8031, test_loss: 0.8702, test_f1: 0.6138
 epoch: 18, train_loss: 0.8128, test_loss: 0.8864, test_f1: 0.5989
 epoch: 19, train_loss: 0.8105, test_loss: 0.8824, test_f1: 0.5823
 epoch: 20, train_loss: 0.7978, test_loss: 0.9016, test_f1: 0.5810
 epoch: 21, train_loss: 0.7882, test_loss: 0.8734, test_f1: 0.5839
 epoch: 22, train_loss: 0.7842, test_loss: 0.8893, test_f1: 0.6075
 epoch: 23, train_loss: 0.7743, test_loss: 0.8689, test_f1: 0.5816
 epoch: 24, train_loss: 0.7732, test_loss: 0.8711, test_f1: 0.5960
 epoch: 25, train_loss: 0.7608, test_loss: 0.8824, test_f1: 0.6074
 epoch: 26, train_loss: 0.7515, test_loss: 0.8779, test_f1: 0.6135
 epoch: 27, train_loss: 0.7508, test_loss: 0.9266, test_f1: 0.5891
 epoch: 28, train_loss: 0.7488, test_loss: 0.8815, test_f1: 0.6024
 epoch: 29, train_loss: 0.7324, test_loss: 0.8701, test_f1: 0.5992
 epoch: 30, train_loss: 0.7290, test_loss: 0.8955, test_f1: 0.5949
 epoch: 31, train_loss: 0.7243, test_loss: 0.8939, test_f1: 0.6050
 epoch: 32, train_loss: 0.7208, test_loss: 0.8949, test_f1: 0.6134
 epoch: 33, train_loss: 0.7085, test_loss: 0.8949, test_f1: 0.6148
 epoch: 34, train_loss: 0.7183, test_loss: 0.9002, test_f1: 0.6020
 epoch: 35, train_loss: 0.7091, test_loss: 0.9242, test_f1: 0.6286
 epoch: 36, train_loss: 0.7097, test_loss: 0.9176, test_f1: 0.6010
 epoch: 37, train_loss: 0.6962, test_loss: 0.8905, test_f1: 0.6183
 epoch: 38, train_loss: 0.6887, test_loss: 0.9068, test_f1: 0.5892
 epoch: 39, train_loss: 0.6784, test_loss: 0.9176, test_f1: 0.6313
 epoch: 40, train_loss: 0.6762, test_loss: 0.9250, test_f1: 0.6390
 epoch: 41, train_loss: 0.6757, test_loss: 0.9328, test_f1: 0.6022
 epoch: 42, train_loss: 0.6799, test_loss: 0.9477, test_f1: 0.6225
 epoch: 43, train_loss: 0.6712, test_loss: 0.9394, test_f1: 0.6232
 epoch: 44, train_loss: 0.6600, test_loss: 0.9657, test_f1: 0.6067
 epoch: 45, train_loss: 0.6490, test_loss: 0.9938, test_f1: 0.6102
 epoch: 46, train_loss: 0.6394, test_loss: 0.9492, test_f1: 0.6291
 epoch: 47, train_loss: 0.6412, test_loss: 0.9349, test_f1: 0.6285
 epoch: 48, train_loss: 0.6476, test_loss: 0.9206, test_f1: 0.6228
 epoch: 49, train_loss: 0.6196, test_loss: 0.9069, test_f1: 0.6268
 epoch: 50, train_loss: 0.6279, test_loss: 0.9696, test_f1: 0.6289
 epoch: 51, train_loss: 0.6048, test_loss: 0.9329, test_f1: 0.6284
 epoch: 52, train_loss: 0.5919, test_loss: 0.9286, test_f1: 0.6319
 epoch: 53, train_loss: 0.5864, test_loss: 0.9378, test_f1: 0.6283
 epoch: 54, train_loss: 0.6021, test_loss: 0.9728, test_f1: 0.6290
 epoch: 55, train_loss: 0.5982, test_loss: 0.9741, test_f1: 0.6269
 epoch: 56, train_loss: 0.5830, test_loss: 0.9558, test_f1: 0.6393
 epoch: 57, train_loss: 0.5839, test_loss: 0.9470, test_f1: 0.6381
 epoch: 58, train_loss: 0.5617, test_loss: 0.9482, test_f1: 0.6613
 epoch: 59, train_loss: 0.5698, test_loss: 0.9524, test_f1: 0.6434
 epoch: 60, train_loss: 0.5731, test_loss: 0.9751, test_f1: 0.6281
 epoch: 61, train_loss: 0.5706, test_loss: 0.9636, test_f1: 0.6401
 epoch: 62, train_loss: 0.5666, test_loss: 0.9503, test_f1: 0.6400
 epoch: 63, train_loss: 0.5537, test_loss: 0.9683, test_f1: 0.6424
 epoch: 64, train_loss: 0.5653, test_loss: 0.9549, test_f1: 0.6440
 epoch: 65, train_loss: 0.5490, test_loss: 0.9770, test_f1: 0.6335
 epoch: 66, train_loss: 0.5487, test_loss: 0.9739, test_f1: 0.6477
 epoch: 67, train_loss: 0.5635, test_loss: 0.9806, test_f1: 0.6372
 epoch: 68, train_loss: 0.5513, test_loss: 0.9858, test_f1: 0.6433
 epoch: 69, train_loss: 0.5413, test_loss: 0.9821, test_f1: 0.6680
 epoch: 70, train_loss: 0.5419, test_loss: 1.0056, test_f1: 0.6374
 epoch: 71, train_loss: 0.5380, test_loss: 0.9782, test_f1: 0.6453
 epoch: 72, train_loss: 0.5370, test_loss: 0.9660, test_f1: 0.6520
 epoch: 73, train_loss: 0.5401, test_loss: 0.9917, test_f1: 0.6450
 epoch: 74, train_loss: 0.5193, test_loss: 1.0349, test_f1: 0.6292
 epoch: 75, train_loss: 0.5248, test_loss: 1.0062, test_f1: 0.6399
 epoch: 76, train_loss: 0.5252, test_loss: 1.0241, test_f1: 0.6465
 epoch: 77, train_loss: 0.5250, test_loss: 1.0179, test_f1: 0.6408
 epoch: 78, train_loss: 0.5119, test_loss: 1.0338, test_f1: 0.6358
 epoch: 79, train_loss: 0.5072, test_loss: 1.0310, test_f1: 0.6406
 epoch: 80, train_loss: 0.5059, test_loss: 1.0335, test_f1: 0.6544
 epoch: 81, train_loss: 0.5065, test_loss: 1.0747, test_f1: 0.6392
 epoch: 82, train_loss: 0.5040, test_loss: 1.0743, test_f1: 0.6359
 epoch: 83, train_loss: 0.4945, test_loss: 1.0609, test_f1: 0.6413
 epoch: 84, train_loss: 0.5105, test_loss: 1.0770, test_f1: 0.6452
 epoch: 85, train_loss: 0.4959, test_loss: 1.0814, test_f1: 0.6533
 epoch: 86, train_loss: 0.4895, test_loss: 1.0472, test_f1: 0.6573
 epoch: 87, train_loss: 0.4951, test_loss: 1.0390, test_f1: 0.6495
 epoch: 88, train_loss: 0.4946, test_loss: 1.0837, test_f1: 0.6277
 epoch: 89, train_loss: 0.4925, test_loss: 1.0770, test_f1: 0.6585
 epoch: 90, train_loss: 0.4696, test_loss: 1.0621, test_f1: 0.6470
 epoch: 91, train_loss: 0.4803, test_loss: 1.1405, test_f1: 0.6399
 epoch: 92, train_loss: 0.4864, test_loss: 1.0841, test_f1: 0.6684
 epoch: 93, train_loss: 0.4663, test_loss: 1.1329, test_f1: 0.6491
 epoch: 94, train_loss: 0.4858, test_loss: 1.1112, test_f1: 0.6483
 epoch: 95, train_loss: 0.4647, test_loss: 1.1428, test_f1: 0.6505
 epoch: 96, train_loss: 0.4714, test_loss: 1.1508, test_f1: 0.6533
 epoch: 97, train_loss: 0.4736, test_loss: 1.1301, test_f1: 0.6309
 epoch: 98, train_loss: 0.4619, test_loss: 1.1072, test_f1: 0.6464
 epoch: 99, train_loss: 0.4541, test_loss: 1.1381, test_f1: 0.6463
##################ITERATION #8 ****************************************
 epoch: 0, train_loss: 1.2446, test_loss: 1.1640, test_f1: 0.4206
 epoch: 1, train_loss: 1.1028, test_loss: 0.9755, test_f1: 0.4816
 epoch: 2, train_loss: 1.0605, test_loss: 0.9836, test_f1: 0.4836
 epoch: 3, train_loss: 1.0234, test_loss: 0.9565, test_f1: 0.5225
 epoch: 4, train_loss: 1.0090, test_loss: 0.9489, test_f1: 0.5098
 epoch: 5, train_loss: 0.9738, test_loss: 0.9529, test_f1: 0.5113
 epoch: 6, train_loss: 0.9523, test_loss: 0.9454, test_f1: 0.5177
 epoch: 7, train_loss: 0.9418, test_loss: 0.9079, test_f1: 0.5286
 epoch: 8, train_loss: 0.9263, test_loss: 0.9305, test_f1: 0.5176
 epoch: 9, train_loss: 0.9122, test_loss: 0.9444, test_f1: 0.5518
 epoch: 10, train_loss: 0.8951, test_loss: 0.9081, test_f1: 0.5567
 epoch: 11, train_loss: 0.8813, test_loss: 0.9155, test_f1: 0.5279
 epoch: 12, train_loss: 0.8757, test_loss: 0.9032, test_f1: 0.5542
 epoch: 13, train_loss: 0.8676, test_loss: 0.9086, test_f1: 0.5456
 epoch: 14, train_loss: 0.8651, test_loss: 0.9124, test_f1: 0.5410
 epoch: 15, train_loss: 0.8572, test_loss: 0.9101, test_f1: 0.5582
 epoch: 16, train_loss: 0.8426, test_loss: 0.9059, test_f1: 0.5507
 epoch: 17, train_loss: 0.8371, test_loss: 0.9120, test_f1: 0.5615
 epoch: 18, train_loss: 0.8285, test_loss: 0.9001, test_f1: 0.5610
 epoch: 19, train_loss: 0.8158, test_loss: 0.9151, test_f1: 0.5774
 epoch: 20, train_loss: 0.8140, test_loss: 0.9089, test_f1: 0.5577
 epoch: 21, train_loss: 0.7999, test_loss: 0.8936, test_f1: 0.5722
 epoch: 22, train_loss: 0.7944, test_loss: 0.9072, test_f1: 0.5895
 epoch: 23, train_loss: 0.7821, test_loss: 0.9055, test_f1: 0.5634
 epoch: 24, train_loss: 0.7809, test_loss: 0.9145, test_f1: 0.5791
 epoch: 25, train_loss: 0.7679, test_loss: 0.9195, test_f1: 0.5599
 epoch: 26, train_loss: 0.7734, test_loss: 0.9493, test_f1: 0.5616
 epoch: 27, train_loss: 0.7582, test_loss: 0.9261, test_f1: 0.5450
 epoch: 28, train_loss: 0.7692, test_loss: 0.9029, test_f1: 0.5723
 epoch: 29, train_loss: 0.7555, test_loss: 0.9140, test_f1: 0.5931
 epoch: 30, train_loss: 0.7406, test_loss: 0.9154, test_f1: 0.5640
 epoch: 31, train_loss: 0.7418, test_loss: 0.9457, test_f1: 0.5833
 epoch: 32, train_loss: 0.7363, test_loss: 0.9176, test_f1: 0.5841
 epoch: 33, train_loss: 0.7247, test_loss: 0.9278, test_f1: 0.5963
 epoch: 34, train_loss: 0.7085, test_loss: 0.9249, test_f1: 0.5892
 epoch: 35, train_loss: 0.7242, test_loss: 0.9416, test_f1: 0.6041
 epoch: 36, train_loss: 0.7144, test_loss: 0.9276, test_f1: 0.5871
 epoch: 37, train_loss: 0.6951, test_loss: 0.9328, test_f1: 0.5877
 epoch: 38, train_loss: 0.6995, test_loss: 0.9680, test_f1: 0.5793
 epoch: 39, train_loss: 0.7022, test_loss: 0.9520, test_f1: 0.5931
 epoch: 40, train_loss: 0.6983, test_loss: 0.9318, test_f1: 0.5835
 epoch: 41, train_loss: 0.6906, test_loss: 0.9449, test_f1: 0.5838
 epoch: 42, train_loss: 0.6846, test_loss: 0.9022, test_f1: 0.6103
 epoch: 43, train_loss: 0.6651, test_loss: 0.9646, test_f1: 0.6105
 epoch: 44, train_loss: 0.6706, test_loss: 0.9808, test_f1: 0.5895
 epoch: 45, train_loss: 0.6616, test_loss: 0.9699, test_f1: 0.5950
 epoch: 46, train_loss: 0.6689, test_loss: 0.9768, test_f1: 0.5949
 epoch: 47, train_loss: 0.6610, test_loss: 0.9429, test_f1: 0.6169
 epoch: 48, train_loss: 0.6455, test_loss: 0.9345, test_f1: 0.6022
 epoch: 49, train_loss: 0.6479, test_loss: 0.9673, test_f1: 0.6271
 epoch: 50, train_loss: 0.6357, test_loss: 0.9662, test_f1: 0.6065
 epoch: 51, train_loss: 0.6264, test_loss: 0.9616, test_f1: 0.6256
 epoch: 52, train_loss: 0.6094, test_loss: 0.9867, test_f1: 0.6138
 epoch: 53, train_loss: 0.6011, test_loss: 0.9669, test_f1: 0.6126
 epoch: 54, train_loss: 0.6015, test_loss: 0.9661, test_f1: 0.6158
 epoch: 55, train_loss: 0.6101, test_loss: 0.9739, test_f1: 0.6125
 epoch: 56, train_loss: 0.5964, test_loss: 0.9785, test_f1: 0.6168
 epoch: 57, train_loss: 0.5911, test_loss: 1.0002, test_f1: 0.6426
 epoch: 58, train_loss: 0.5883, test_loss: 1.0306, test_f1: 0.6427
 epoch: 59, train_loss: 0.5870, test_loss: 1.0187, test_f1: 0.6187
 epoch: 60, train_loss: 0.5940, test_loss: 1.0140, test_f1: 0.6290
 epoch: 61, train_loss: 0.5827, test_loss: 1.0332, test_f1: 0.6211
 epoch: 62, train_loss: 0.5700, test_loss: 1.0170, test_f1: 0.5994
 epoch: 63, train_loss: 0.5880, test_loss: 0.9912, test_f1: 0.6160
 epoch: 64, train_loss: 0.5826, test_loss: 1.0182, test_f1: 0.6172
 epoch: 65, train_loss: 0.5690, test_loss: 1.0297, test_f1: 0.6017
 epoch: 66, train_loss: 0.5745, test_loss: 1.0351, test_f1: 0.6178
 epoch: 67, train_loss: 0.5694, test_loss: 1.0556, test_f1: 0.5940
 epoch: 68, train_loss: 0.5778, test_loss: 1.0260, test_f1: 0.6135
 epoch: 69, train_loss: 0.5566, test_loss: 1.0341, test_f1: 0.6145
 epoch: 70, train_loss: 0.5438, test_loss: 1.0438, test_f1: 0.6164
 epoch: 71, train_loss: 0.5473, test_loss: 1.0414, test_f1: 0.6294
 epoch: 72, train_loss: 0.5427, test_loss: 1.0596, test_f1: 0.6148
 epoch: 73, train_loss: 0.5340, test_loss: 1.0589, test_f1: 0.6156
 epoch: 74, train_loss: 0.5477, test_loss: 1.0640, test_f1: 0.6278
 epoch: 75, train_loss: 0.5389, test_loss: 1.0945, test_f1: 0.6194
 epoch: 76, train_loss: 0.5447, test_loss: 1.0731, test_f1: 0.6141
 epoch: 77, train_loss: 0.5515, test_loss: 1.1191, test_f1: 0.6244
 epoch: 78, train_loss: 0.5387, test_loss: 1.0606, test_f1: 0.6262
 epoch: 79, train_loss: 0.5431, test_loss: 1.0895, test_f1: 0.6215
 epoch: 80, train_loss: 0.5221, test_loss: 1.0594, test_f1: 0.6400
 epoch: 81, train_loss: 0.5323, test_loss: 1.0805, test_f1: 0.6418
 epoch: 82, train_loss: 0.5189, test_loss: 1.0794, test_f1: 0.6212
 epoch: 83, train_loss: 0.5158, test_loss: 1.0708, test_f1: 0.6156
 epoch: 84, train_loss: 0.5233, test_loss: 1.0901, test_f1: 0.6253
 epoch: 85, train_loss: 0.5246, test_loss: 1.1330, test_f1: 0.6240
 epoch: 86, train_loss: 0.5161, test_loss: 1.0960, test_f1: 0.6132
 epoch: 87, train_loss: 0.5143, test_loss: 1.1077, test_f1: 0.6347
 epoch: 88, train_loss: 0.4960, test_loss: 1.0969, test_f1: 0.6351
 epoch: 89, train_loss: 0.4964, test_loss: 1.1246, test_f1: 0.6176
 epoch: 90, train_loss: 0.4935, test_loss: 1.1532, test_f1: 0.6314
 epoch: 91, train_loss: 0.5031, test_loss: 1.1188, test_f1: 0.6402
 epoch: 92, train_loss: 0.5008, test_loss: 1.1098, test_f1: 0.6397
 epoch: 93, train_loss: 0.4961, test_loss: 1.1580, test_f1: 0.6414
 epoch: 94, train_loss: 0.4985, test_loss: 1.1598, test_f1: 0.6381
 epoch: 95, train_loss: 0.4971, test_loss: 1.1854, test_f1: 0.6206
 epoch: 96, train_loss: 0.4924, test_loss: 1.1401, test_f1: 0.6359
 epoch: 97, train_loss: 0.4694, test_loss: 1.1434, test_f1: 0.6351
 epoch: 98, train_loss: 0.4849, test_loss: 1.1940, test_f1: 0.6358
 epoch: 99, train_loss: 0.4817, test_loss: 1.2019, test_f1: 0.6346
##################ITERATION #9 ****************************************
 epoch: 0, train_loss: 1.2826, test_loss: 1.1101, test_f1: 0.4071
 epoch: 1, train_loss: 1.0971, test_loss: 0.9916, test_f1: 0.4567
 epoch: 2, train_loss: 1.0478, test_loss: 0.9589, test_f1: 0.4609
 epoch: 3, train_loss: 1.0169, test_loss: 0.9606, test_f1: 0.4628
 epoch: 4, train_loss: 1.0091, test_loss: 0.9515, test_f1: 0.4941
 epoch: 5, train_loss: 0.9876, test_loss: 0.9108, test_f1: 0.4966
 epoch: 6, train_loss: 0.9632, test_loss: 0.9185, test_f1: 0.5143
 epoch: 7, train_loss: 0.9535, test_loss: 0.9297, test_f1: 0.5076
 epoch: 8, train_loss: 0.9414, test_loss: 0.9354, test_f1: 0.5205
 epoch: 9, train_loss: 0.9126, test_loss: 0.8998, test_f1: 0.5462
 epoch: 10, train_loss: 0.9158, test_loss: 0.9029, test_f1: 0.5328
 epoch: 11, train_loss: 0.8991, test_loss: 0.9139, test_f1: 0.5219
 epoch: 12, train_loss: 0.8920, test_loss: 0.9116, test_f1: 0.5573
 epoch: 13, train_loss: 0.8832, test_loss: 0.8991, test_f1: 0.5596
 epoch: 14, train_loss: 0.8771, test_loss: 0.9120, test_f1: 0.5472
 epoch: 15, train_loss: 0.8617, test_loss: 0.8966, test_f1: 0.5603
 epoch: 16, train_loss: 0.8436, test_loss: 0.8883, test_f1: 0.5631
 epoch: 17, train_loss: 0.8466, test_loss: 0.8990, test_f1: 0.5712
 epoch: 18, train_loss: 0.8467, test_loss: 0.9048, test_f1: 0.5676
 epoch: 19, train_loss: 0.8236, test_loss: 0.8982, test_f1: 0.5635
 epoch: 20, train_loss: 0.8223, test_loss: 0.8967, test_f1: 0.5786
 epoch: 21, train_loss: 0.8120, test_loss: 0.9686, test_f1: 0.5485
 epoch: 22, train_loss: 0.8155, test_loss: 0.9231, test_f1: 0.5746
 epoch: 23, train_loss: 0.8103, test_loss: 0.8864, test_f1: 0.5985
 epoch: 24, train_loss: 0.7988, test_loss: 0.9092, test_f1: 0.5841
 epoch: 25, train_loss: 0.7915, test_loss: 0.8948, test_f1: 0.5820
 epoch: 26, train_loss: 0.7838, test_loss: 0.9046, test_f1: 0.5787
 epoch: 27, train_loss: 0.7882, test_loss: 0.9360, test_f1: 0.5659
 epoch: 28, train_loss: 0.7815, test_loss: 0.9055, test_f1: 0.5705
 epoch: 29, train_loss: 0.7706, test_loss: 0.9074, test_f1: 0.5944
 epoch: 30, train_loss: 0.7582, test_loss: 0.9021, test_f1: 0.5864
 epoch: 31, train_loss: 0.7485, test_loss: 0.9121, test_f1: 0.5778
 epoch: 32, train_loss: 0.7483, test_loss: 0.9032, test_f1: 0.5882
 epoch: 33, train_loss: 0.7473, test_loss: 0.9059, test_f1: 0.5844
 epoch: 34, train_loss: 0.7276, test_loss: 0.9490, test_f1: 0.5759
 epoch: 35, train_loss: 0.7317, test_loss: 0.8957, test_f1: 0.6001
 epoch: 36, train_loss: 0.7183, test_loss: 0.9313, test_f1: 0.5936
 epoch: 37, train_loss: 0.7198, test_loss: 0.9048, test_f1: 0.5999
 epoch: 38, train_loss: 0.7221, test_loss: 0.9023, test_f1: 0.5878
 epoch: 39, train_loss: 0.7052, test_loss: 0.9453, test_f1: 0.5764
 epoch: 40, train_loss: 0.7025, test_loss: 0.9233, test_f1: 0.5815
 epoch: 41, train_loss: 0.6985, test_loss: 0.9132, test_f1: 0.5977
 epoch: 42, train_loss: 0.6911, test_loss: 0.9439, test_f1: 0.5773
 epoch: 43, train_loss: 0.6867, test_loss: 0.9507, test_f1: 0.6080
 epoch: 44, train_loss: 0.6854, test_loss: 0.9347, test_f1: 0.5707
 epoch: 45, train_loss: 0.6783, test_loss: 0.9300, test_f1: 0.6091
 epoch: 46, train_loss: 0.6604, test_loss: 0.9401, test_f1: 0.6178
 epoch: 47, train_loss: 0.6619, test_loss: 0.9235, test_f1: 0.6032
 epoch: 48, train_loss: 0.6675, test_loss: 0.9438, test_f1: 0.6013
 epoch: 49, train_loss: 0.6602, test_loss: 0.9139, test_f1: 0.6177
 epoch: 50, train_loss: 0.6552, test_loss: 0.9671, test_f1: 0.6059
 epoch: 51, train_loss: 0.6349, test_loss: 0.9599, test_f1: 0.6185
 epoch: 52, train_loss: 0.6224, test_loss: 0.9576, test_f1: 0.5953
 epoch: 53, train_loss: 0.6265, test_loss: 0.9418, test_f1: 0.6071
 epoch: 54, train_loss: 0.6156, test_loss: 0.9331, test_f1: 0.6152
 epoch: 55, train_loss: 0.6247, test_loss: 0.9528, test_f1: 0.6112
 epoch: 56, train_loss: 0.6023, test_loss: 0.9656, test_f1: 0.6195
 epoch: 57, train_loss: 0.5988, test_loss: 0.9827, test_f1: 0.6305
 epoch: 58, train_loss: 0.6119, test_loss: 0.9618, test_f1: 0.6323
 epoch: 59, train_loss: 0.5982, test_loss: 0.9862, test_f1: 0.6278
 epoch: 60, train_loss: 0.6053, test_loss: 0.9807, test_f1: 0.6146
 epoch: 61, train_loss: 0.5994, test_loss: 0.9630, test_f1: 0.6276
 epoch: 62, train_loss: 0.5940, test_loss: 0.9727, test_f1: 0.6258
 epoch: 63, train_loss: 0.5798, test_loss: 0.9720, test_f1: 0.6263
 epoch: 64, train_loss: 0.5962, test_loss: 0.9670, test_f1: 0.6285
 epoch: 65, train_loss: 0.5886, test_loss: 0.9862, test_f1: 0.6178
 epoch: 66, train_loss: 0.5713, test_loss: 0.9751, test_f1: 0.6253
 epoch: 67, train_loss: 0.5872, test_loss: 0.9792, test_f1: 0.6279
 epoch: 68, train_loss: 0.5820, test_loss: 1.0016, test_f1: 0.6216
 epoch: 69, train_loss: 0.5597, test_loss: 0.9795, test_f1: 0.6237
 epoch: 70, train_loss: 0.5673, test_loss: 0.9816, test_f1: 0.6333
 epoch: 71, train_loss: 0.5595, test_loss: 0.9789, test_f1: 0.6362
 epoch: 72, train_loss: 0.5643, test_loss: 1.0056, test_f1: 0.6245
 epoch: 73, train_loss: 0.5586, test_loss: 1.0068, test_f1: 0.6270
 epoch: 74, train_loss: 0.5513, test_loss: 1.0145, test_f1: 0.6353
 epoch: 75, train_loss: 0.5384, test_loss: 1.0133, test_f1: 0.6273
 epoch: 76, train_loss: 0.5465, test_loss: 0.9954, test_f1: 0.6405
 epoch: 77, train_loss: 0.5372, test_loss: 1.0072, test_f1: 0.6242
 epoch: 78, train_loss: 0.5273, test_loss: 1.0116, test_f1: 0.6373
 epoch: 79, train_loss: 0.5369, test_loss: 1.0008, test_f1: 0.6399
 epoch: 80, train_loss: 0.5238, test_loss: 1.0384, test_f1: 0.6285
 epoch: 81, train_loss: 0.5293, test_loss: 1.0479, test_f1: 0.6280
 epoch: 82, train_loss: 0.5361, test_loss: 1.0660, test_f1: 0.6100
 epoch: 83, train_loss: 0.5235, test_loss: 1.0171, test_f1: 0.6349
 epoch: 84, train_loss: 0.5260, test_loss: 1.0722, test_f1: 0.6163
 epoch: 85, train_loss: 0.5146, test_loss: 1.0454, test_f1: 0.6414
 epoch: 86, train_loss: 0.5256, test_loss: 1.0499, test_f1: 0.6436
 epoch: 87, train_loss: 0.5107, test_loss: 1.0879, test_f1: 0.6190
 epoch: 88, train_loss: 0.5054, test_loss: 1.0603, test_f1: 0.6342
 epoch: 89, train_loss: 0.4981, test_loss: 1.0959, test_f1: 0.6241
 epoch: 90, train_loss: 0.5174, test_loss: 1.0973, test_f1: 0.6412
 epoch: 91, train_loss: 0.4997, test_loss: 1.0783, test_f1: 0.6117
 epoch: 92, train_loss: 0.4930, test_loss: 1.0865, test_f1: 0.6239
 epoch: 93, train_loss: 0.4944, test_loss: 1.0864, test_f1: 0.6323
 epoch: 94, train_loss: 0.4817, test_loss: 1.0840, test_f1: 0.6325
 epoch: 95, train_loss: 0.5045, test_loss: 1.1022, test_f1: 0.6202
 epoch: 96, train_loss: 0.5017, test_loss: 1.1349, test_f1: 0.6172
 epoch: 97, train_loss: 0.4899, test_loss: 1.1469, test_f1: 0.6215
 epoch: 98, train_loss: 0.4925, test_loss: 1.1305, test_f1: 0.6101
 epoch: 99, train_loss: 0.4855, test_loss: 1.1309, test_f1: 0.6247

Training completed in 797.11 seconds
Best F1: 0.6848 at epoch 86
Mean F1 across iterations: 0.6621  0.0165
========================FINAL RESULTS================================
FEGIN weighted F1: 0.6848  0.0165
python main.py --data ltspice_examples --representation component_net --model FEGIN --layers 5 --hiddens 128 --batch_size 64 --lr 0.0001 --emb_size 128 --epochs 100 --save_appendix component_net_L5_H128_BS64_LR0.0001_E128 --no_val
-----



STDERR:
  File "main.py", line 370, in <module>
    main()
  File "main.py", line 254, in main
    dataset = dataset_class(
  File "/home/philip/projects/ltspice_examples_code_repo/Circuit-Completion-Using-GNNs/component_classification_with_link_prediction_head/evaluation/FEGIN/kernel/circuit_datasets.py", line 15, in __init__
    self.data, self.slices = torch.load(self.processed_paths[0])
  File "/home/philip/.local/lib/python3.8/site-packages/torch/serialization.py", line 1040, in load
    warnings.warn(
  File "/usr/lib/python3.8/warnings.py", line 109, in _showwarnmsg
    sw(msg.message, msg.category, msg.filename, msg.lineno,
  File "main.py", line 47, in warn_with_traceback
    traceback.print_stack(file=log)
/home/philip/projects/ltspice_examples_code_repo/Circuit-Completion-Using-GNNs/component_classification_with_link_prediction_head/evaluation/FEGIN/kernel/circuit_datasets.py:15: FutureWarning: You are using `torch.load` with `weights_only=False` (the current default value), which uses the default pickle module implicitly. It is possible to construct malicious pickle data which will execute arbitrary code during unpickling (See https://github.com/pytorch/pytorch/blob/main/SECURITY.md#untrusted-models for more details). In a future release, the default value for `weights_only` will be flipped to `True`. This limits the functions that could be executed during unpickling. Arbitrary objects will no longer be allowed to be loaded via this mode unless they are explicitly allowlisted by the user via `torch.serialization.add_safe_globals`. We recommend you start setting `weights_only=True` for any use case where you don't have full control of the loaded file. Please open an issue on GitHub for any issues related to this experimental feature.
  self.data, self.slices = torch.load(self.processed_paths[0])
