STDOUT:
Results will be saved in /home/philip/projects/ltspice_examples_code_repo/Circuit-Completion-Using-GNNs/component_classification_with_link_prediction_head/evaluation/FEGIN/results/model_FEGIN_dataset_ltspice_demos
Command line input: python main.py --data ltspice_demos --representation component_pin_net --model FEGIN --layers 5 --hiddens 128 --batch_size 256 --lr 0.01 --emb_size 512 --epochs 100 --save_appendix component_pin_net_L5_H128_BS256_LR0.01_E512 --no_val
 is saved.
-----
ltspice_demos - FEGIN
Using 5 layers, 128 hidden units, h = 2
Loading component_pin_net representation dataset
Loading component_pin_net representation data...
Loaded 1948 examples (component_pin_net)
saving path: data/processed/ltspice_demos_component_pin_net_processed.pt
ENTERED
Training FEGIN on component_pin_net representation
Train: 1565, Test: 383
##################ITERATION #0 ****************************************
 epoch: 0, train_loss: 1.3157, test_loss: 1.3242, test_f1: 0.2281
 epoch: 1, train_loss: 1.1813, test_loss: 1.3051, test_f1: 0.1365
 epoch: 2, train_loss: 1.0579, test_loss: 1.4097, test_f1: 0.2281
 epoch: 3, train_loss: 1.0011, test_loss: 1.3871, test_f1: 0.2050
 epoch: 4, train_loss: 0.9652, test_loss: 1.0970, test_f1: 0.4061
 epoch: 5, train_loss: 0.9494, test_loss: 1.0030, test_f1: 0.5524
 epoch: 6, train_loss: 0.9412, test_loss: 1.5887, test_f1: 0.3859
 epoch: 7, train_loss: 0.9192, test_loss: 1.0652, test_f1: 0.5288
 epoch: 8, train_loss: 0.8918, test_loss: 1.1392, test_f1: 0.4045
 epoch: 9, train_loss: 0.8843, test_loss: 1.1902, test_f1: 0.4342
 epoch: 10, train_loss: 0.8679, test_loss: 1.4770, test_f1: 0.4933
 epoch: 11, train_loss: 0.8727, test_loss: 1.3061, test_f1: 0.3517
 epoch: 12, train_loss: 0.8471, test_loss: 1.2252, test_f1: 0.5149
 epoch: 13, train_loss: 0.8236, test_loss: 1.7418, test_f1: 0.4700
 epoch: 14, train_loss: 0.8622, test_loss: 1.2023, test_f1: 0.4726
 epoch: 15, train_loss: 0.8409, test_loss: 1.0853, test_f1: 0.5674
 epoch: 16, train_loss: 0.7829, test_loss: 1.2479, test_f1: 0.5034
 epoch: 17, train_loss: 0.7625, test_loss: 1.3196, test_f1: 0.4715
 epoch: 18, train_loss: 0.7570, test_loss: 1.2136, test_f1: 0.4958
 epoch: 19, train_loss: 0.7486, test_loss: 1.7530, test_f1: 0.3817
 epoch: 20, train_loss: 0.7677, test_loss: 1.2702, test_f1: 0.5001
 epoch: 21, train_loss: 0.8458, test_loss: 1.8502, test_f1: 0.3595
 epoch: 22, train_loss: 0.7461, test_loss: 1.4729, test_f1: 0.4011
 epoch: 23, train_loss: 0.7312, test_loss: 0.9909, test_f1: 0.5291
 epoch: 24, train_loss: 0.7107, test_loss: 1.5135, test_f1: 0.3958
 epoch: 25, train_loss: 0.6947, test_loss: 1.0435, test_f1: 0.5498
 epoch: 26, train_loss: 0.6786, test_loss: 1.0611, test_f1: 0.5942
 epoch: 27, train_loss: 0.6841, test_loss: 1.1621, test_f1: 0.4772
 epoch: 28, train_loss: 0.6856, test_loss: 1.2278, test_f1: 0.5586
 epoch: 29, train_loss: 0.6746, test_loss: 1.1526, test_f1: 0.5849
 epoch: 30, train_loss: 0.6863, test_loss: 1.0245, test_f1: 0.5669
 epoch: 31, train_loss: 0.6613, test_loss: 1.0656, test_f1: 0.5865
 epoch: 32, train_loss: 0.6418, test_loss: 1.0671, test_f1: 0.5932
 epoch: 33, train_loss: 0.6632, test_loss: 1.1760, test_f1: 0.5308
 epoch: 34, train_loss: 0.7160, test_loss: 1.0762, test_f1: 0.5650
 epoch: 35, train_loss: 0.6790, test_loss: 1.1145, test_f1: 0.5494
 epoch: 36, train_loss: 0.6558, test_loss: 1.9441, test_f1: 0.4168
 epoch: 37, train_loss: 0.6270, test_loss: 2.0004, test_f1: 0.4433
 epoch: 38, train_loss: 0.6998, test_loss: 1.2141, test_f1: 0.5232
 epoch: 39, train_loss: 0.6678, test_loss: 1.0945, test_f1: 0.5654
 epoch: 40, train_loss: 0.6888, test_loss: 1.3491, test_f1: 0.5489
 epoch: 41, train_loss: 0.6432, test_loss: 1.2663, test_f1: 0.5102
 epoch: 42, train_loss: 0.5842, test_loss: 1.0574, test_f1: 0.6034
 epoch: 43, train_loss: 0.5928, test_loss: 1.0689, test_f1: 0.5818
 epoch: 44, train_loss: 0.6173, test_loss: 1.3005, test_f1: 0.5716
 epoch: 45, train_loss: 0.5865, test_loss: 1.5544, test_f1: 0.5507
 epoch: 46, train_loss: 0.5973, test_loss: 1.2981, test_f1: 0.5034
 epoch: 47, train_loss: 0.5569, test_loss: 1.1947, test_f1: 0.5737
 epoch: 48, train_loss: 0.6064, test_loss: 1.2008, test_f1: 0.5525
 epoch: 49, train_loss: 0.6066, test_loss: 1.0682, test_f1: 0.5273
 epoch: 50, train_loss: 0.6003, test_loss: 1.1013, test_f1: 0.5591
 epoch: 51, train_loss: 0.5721, test_loss: 1.2213, test_f1: 0.5557
 epoch: 52, train_loss: 0.5148, test_loss: 1.1525, test_f1: 0.5872
 epoch: 53, train_loss: 0.5045, test_loss: 1.2329, test_f1: 0.5380
 epoch: 54, train_loss: 0.5534, test_loss: 1.2550, test_f1: 0.5328
 epoch: 55, train_loss: 0.5363, test_loss: 1.1259, test_f1: 0.5930
 epoch: 56, train_loss: 0.5258, test_loss: 1.2286, test_f1: 0.6335
 epoch: 57, train_loss: 0.4793, test_loss: 1.3882, test_f1: 0.6125
 epoch: 58, train_loss: 0.4660, test_loss: 1.4157, test_f1: 0.6205
 epoch: 59, train_loss: 0.4685, test_loss: 1.7355, test_f1: 0.5069
 epoch: 60, train_loss: 0.4993, test_loss: 1.9254, test_f1: 0.5039
 epoch: 61, train_loss: 0.4789, test_loss: 1.3843, test_f1: 0.6009
 epoch: 62, train_loss: 0.4495, test_loss: 1.4678, test_f1: 0.6076
 epoch: 63, train_loss: 0.4412, test_loss: 1.6318, test_f1: 0.6062
 epoch: 64, train_loss: 0.4552, test_loss: 1.5717, test_f1: 0.5929
 epoch: 65, train_loss: 0.4535, test_loss: 1.8830, test_f1: 0.5593
 epoch: 66, train_loss: 0.4549, test_loss: 1.7622, test_f1: 0.5775
 epoch: 67, train_loss: 0.4419, test_loss: 1.5774, test_f1: 0.5856
 epoch: 68, train_loss: 0.4215, test_loss: 1.7617, test_f1: 0.5598
 epoch: 69, train_loss: 0.4281, test_loss: 1.5394, test_f1: 0.6009
 epoch: 70, train_loss: 0.4211, test_loss: 1.6860, test_f1: 0.5821
 epoch: 71, train_loss: 0.4229, test_loss: 1.6003, test_f1: 0.5705
 epoch: 72, train_loss: 0.4046, test_loss: 1.4583, test_f1: 0.5634
 epoch: 73, train_loss: 0.4192, test_loss: 1.5324, test_f1: 0.6106
 epoch: 74, train_loss: 0.4008, test_loss: 1.6362, test_f1: 0.6206
 epoch: 75, train_loss: 0.3818, test_loss: 1.6377, test_f1: 0.6232
 epoch: 76, train_loss: 0.3657, test_loss: 1.6689, test_f1: 0.6143
 epoch: 77, train_loss: 0.3657, test_loss: 1.7802, test_f1: 0.5931
 epoch: 78, train_loss: 0.3655, test_loss: 1.6238, test_f1: 0.6051
 epoch: 79, train_loss: 0.3542, test_loss: 1.7658, test_f1: 0.5654
 epoch: 80, train_loss: 0.3435, test_loss: 2.0196, test_f1: 0.5681
 epoch: 81, train_loss: 0.3670, test_loss: 1.8565, test_f1: 0.5966
 epoch: 82, train_loss: 0.3745, test_loss: 1.5866, test_f1: 0.5964
 epoch: 83, train_loss: 0.4241, test_loss: 1.7200, test_f1: 0.5357
 epoch: 84, train_loss: 0.3669, test_loss: 1.6724, test_f1: 0.6025
 epoch: 85, train_loss: 0.4013, test_loss: 1.7857, test_f1: 0.4973
 epoch: 86, train_loss: 0.4466, test_loss: 1.6844, test_f1: 0.4972
 epoch: 87, train_loss: 0.4715, test_loss: 1.5015, test_f1: 0.5627
 epoch: 88, train_loss: 0.4363, test_loss: 1.5346, test_f1: 0.5728
 epoch: 89, train_loss: 0.4467, test_loss: 1.6390, test_f1: 0.5916
 epoch: 90, train_loss: 0.3806, test_loss: 1.7128, test_f1: 0.6071
 epoch: 91, train_loss: 0.3843, test_loss: 1.8633, test_f1: 0.5452
 epoch: 92, train_loss: 0.3559, test_loss: 1.6786, test_f1: 0.6033
 epoch: 93, train_loss: 0.3285, test_loss: 1.9157, test_f1: 0.5709
 epoch: 94, train_loss: 0.3197, test_loss: 1.8486, test_f1: 0.5547
 epoch: 95, train_loss: 0.3373, test_loss: 1.9491, test_f1: 0.5236
 epoch: 96, train_loss: 0.2851, test_loss: 1.8152, test_f1: 0.6187
 epoch: 97, train_loss: 0.3091, test_loss: 1.8799, test_f1: 0.6276
 epoch: 98, train_loss: 0.2776, test_loss: 1.9225, test_f1: 0.6161
 epoch: 99, train_loss: 0.2885, test_loss: 1.9434, test_f1: 0.6008
##################ITERATION #1 ****************************************
 epoch: 0, train_loss: 1.2955, test_loss: 1.2579, test_f1: 0.3021
 epoch: 1, train_loss: 1.0646, test_loss: 1.2827, test_f1: 0.2281
 epoch: 2, train_loss: 0.9962, test_loss: 1.1766, test_f1: 0.4766
 epoch: 3, train_loss: 0.9592, test_loss: 1.0899, test_f1: 0.3924
 epoch: 4, train_loss: 0.9497, test_loss: 1.0759, test_f1: 0.5254
 epoch: 5, train_loss: 0.9254, test_loss: 1.0578, test_f1: 0.5124
 epoch: 6, train_loss: 0.9076, test_loss: 1.0878, test_f1: 0.4909
 epoch: 7, train_loss: 0.9247, test_loss: 1.0881, test_f1: 0.4901
 epoch: 8, train_loss: 0.9080, test_loss: 1.2140, test_f1: 0.4485
 epoch: 9, train_loss: 0.9049, test_loss: 1.0065, test_f1: 0.5275
 epoch: 10, train_loss: 0.8651, test_loss: 1.0977, test_f1: 0.5042
 epoch: 11, train_loss: 0.8619, test_loss: 1.0698, test_f1: 0.4182
 epoch: 12, train_loss: 0.8636, test_loss: 1.1203, test_f1: 0.4698
 epoch: 13, train_loss: 0.9263, test_loss: 1.0618, test_f1: 0.5174
 epoch: 14, train_loss: 0.8868, test_loss: 1.3659, test_f1: 0.4307
 epoch: 15, train_loss: 0.8552, test_loss: 1.2068, test_f1: 0.5088
 epoch: 16, train_loss: 0.8226, test_loss: 1.0029, test_f1: 0.5055
 epoch: 17, train_loss: 0.7960, test_loss: 0.9884, test_f1: 0.5619
 epoch: 18, train_loss: 0.7911, test_loss: 1.0780, test_f1: 0.4806
 epoch: 19, train_loss: 0.7756, test_loss: 1.0634, test_f1: 0.5321
 epoch: 20, train_loss: 0.7661, test_loss: 1.0147, test_f1: 0.5493
 epoch: 21, train_loss: 0.7688, test_loss: 1.0468, test_f1: 0.5547
 epoch: 22, train_loss: 0.7853, test_loss: 1.2018, test_f1: 0.4955
 epoch: 23, train_loss: 0.7498, test_loss: 1.1077, test_f1: 0.4788
 epoch: 24, train_loss: 0.7544, test_loss: 1.2588, test_f1: 0.4048
 epoch: 25, train_loss: 0.7374, test_loss: 1.0382, test_f1: 0.5885
 epoch: 26, train_loss: 0.7039, test_loss: 1.0929, test_f1: 0.5210
 epoch: 27, train_loss: 0.7321, test_loss: 1.2244, test_f1: 0.5477
 epoch: 28, train_loss: 0.7168, test_loss: 1.2190, test_f1: 0.5204
 epoch: 29, train_loss: 0.6972, test_loss: 1.2871, test_f1: 0.4225
 epoch: 30, train_loss: 0.7175, test_loss: 1.3342, test_f1: 0.4817
 epoch: 31, train_loss: 0.7507, test_loss: 1.1185, test_f1: 0.4999
 epoch: 32, train_loss: 0.7171, test_loss: 1.0918, test_f1: 0.5294
 epoch: 33, train_loss: 0.6677, test_loss: 1.2725, test_f1: 0.4607
 epoch: 34, train_loss: 0.6546, test_loss: 1.0649, test_f1: 0.5609
 epoch: 35, train_loss: 0.6353, test_loss: 1.1369, test_f1: 0.5758
 epoch: 36, train_loss: 0.6150, test_loss: 1.3798, test_f1: 0.6141
 epoch: 37, train_loss: 0.6395, test_loss: 1.4898, test_f1: 0.5477
 epoch: 38, train_loss: 0.6501, test_loss: 1.1246, test_f1: 0.5568
 epoch: 39, train_loss: 0.6163, test_loss: 1.3325, test_f1: 0.5827
 epoch: 40, train_loss: 0.6553, test_loss: 1.1195, test_f1: 0.6337
 epoch: 41, train_loss: 0.6482, test_loss: 1.2745, test_f1: 0.5882
 epoch: 42, train_loss: 0.6811, test_loss: 1.2088, test_f1: 0.5058
 epoch: 43, train_loss: 0.6582, test_loss: 1.4923, test_f1: 0.4980
 epoch: 44, train_loss: 0.6429, test_loss: 1.7952, test_f1: 0.4280
 epoch: 45, train_loss: 0.6298, test_loss: 1.4311, test_f1: 0.5333
 epoch: 46, train_loss: 0.5905, test_loss: 1.5111, test_f1: 0.5441
 epoch: 47, train_loss: 0.5782, test_loss: 1.2406, test_f1: 0.6014
 epoch: 48, train_loss: 0.5981, test_loss: 1.3612, test_f1: 0.5035
 epoch: 49, train_loss: 0.6018, test_loss: 1.3716, test_f1: 0.6002
 epoch: 50, train_loss: 0.5717, test_loss: 1.2657, test_f1: 0.5288
 epoch: 51, train_loss: 0.5507, test_loss: 1.3210, test_f1: 0.5637
 epoch: 52, train_loss: 0.5207, test_loss: 1.4479, test_f1: 0.5982
 epoch: 53, train_loss: 0.5113, test_loss: 1.6117, test_f1: 0.5704
 epoch: 54, train_loss: 0.4907, test_loss: 1.6469, test_f1: 0.5388
 epoch: 55, train_loss: 0.5057, test_loss: 1.7188, test_f1: 0.5363
 epoch: 56, train_loss: 0.4892, test_loss: 1.6948, test_f1: 0.5360
 epoch: 57, train_loss: 0.4546, test_loss: 1.5736, test_f1: 0.5583
 epoch: 58, train_loss: 0.4628, test_loss: 1.5832, test_f1: 0.6033
 epoch: 59, train_loss: 0.4775, test_loss: 1.4566, test_f1: 0.5517
 epoch: 60, train_loss: 0.4632, test_loss: 1.4108, test_f1: 0.5883
 epoch: 61, train_loss: 0.4526, test_loss: 1.5686, test_f1: 0.6385
 epoch: 62, train_loss: 0.4454, test_loss: 1.4756, test_f1: 0.5967
 epoch: 63, train_loss: 0.4647, test_loss: 1.5351, test_f1: 0.5787
 epoch: 64, train_loss: 0.4258, test_loss: 1.6957, test_f1: 0.5563
 epoch: 65, train_loss: 0.4281, test_loss: 1.9260, test_f1: 0.5493
 epoch: 66, train_loss: 0.4114, test_loss: 1.8717, test_f1: 0.5733
 epoch: 67, train_loss: 0.4439, test_loss: 2.0161, test_f1: 0.5565
 epoch: 68, train_loss: 0.3874, test_loss: 1.7202, test_f1: 0.5552
 epoch: 69, train_loss: 0.4073, test_loss: 1.8308, test_f1: 0.5814
 epoch: 70, train_loss: 0.4103, test_loss: 1.8048, test_f1: 0.5701
 epoch: 71, train_loss: 0.4030, test_loss: 1.5254, test_f1: 0.5390
 epoch: 72, train_loss: 0.3927, test_loss: 1.7325, test_f1: 0.5444
 epoch: 73, train_loss: 0.3935, test_loss: 2.1707, test_f1: 0.5434
 epoch: 74, train_loss: 0.3857, test_loss: 2.2642, test_f1: 0.5344
 epoch: 75, train_loss: 0.3814, test_loss: 2.3343, test_f1: 0.5850
 epoch: 76, train_loss: 0.3814, test_loss: 2.1000, test_f1: 0.5822
 epoch: 77, train_loss: 0.3860, test_loss: 1.5613, test_f1: 0.6032
 epoch: 78, train_loss: 0.3910, test_loss: 1.4976, test_f1: 0.6164
 epoch: 79, train_loss: 0.3970, test_loss: 1.6175, test_f1: 0.6207
 epoch: 80, train_loss: 0.4076, test_loss: 1.7660, test_f1: 0.6305
 epoch: 81, train_loss: 0.3807, test_loss: 1.8684, test_f1: 0.5754
 epoch: 82, train_loss: 0.3710, test_loss: 1.9293, test_f1: 0.5936
 epoch: 83, train_loss: 0.3761, test_loss: 1.6561, test_f1: 0.5969
 epoch: 84, train_loss: 0.4061, test_loss: 1.9755, test_f1: 0.5518
 epoch: 85, train_loss: 0.3755, test_loss: 2.0183, test_f1: 0.5799
 epoch: 86, train_loss: 0.3589, test_loss: 2.0477, test_f1: 0.5732
 epoch: 87, train_loss: 0.3743, test_loss: 2.2123, test_f1: 0.5715
 epoch: 88, train_loss: 0.3892, test_loss: 1.9012, test_f1: 0.6198
 epoch: 89, train_loss: 0.3535, test_loss: 1.8933, test_f1: 0.5643
 epoch: 90, train_loss: 0.3258, test_loss: 1.7365, test_f1: 0.6115
 epoch: 91, train_loss: 0.3284, test_loss: 1.8920, test_f1: 0.6050
 epoch: 92, train_loss: 0.2800, test_loss: 1.7193, test_f1: 0.6511
 epoch: 93, train_loss: 0.3269, test_loss: 2.0545, test_f1: 0.5621
 epoch: 94, train_loss: 0.3442, test_loss: 1.8196, test_f1: 0.5674
 epoch: 95, train_loss: 0.3989, test_loss: 1.9401, test_f1: 0.5395
 epoch: 96, train_loss: 0.3143, test_loss: 2.1739, test_f1: 0.5735
 epoch: 97, train_loss: 0.3124, test_loss: 2.2268, test_f1: 0.5441
 epoch: 98, train_loss: 0.3045, test_loss: 2.4730, test_f1: 0.5688
 epoch: 99, train_loss: 0.3012, test_loss: 2.3639, test_f1: 0.5389
##################ITERATION #2 ****************************************
 epoch: 0, train_loss: 1.3720, test_loss: 1.6486, test_f1: 0.1365
 epoch: 1, train_loss: 1.0939, test_loss: 1.7228, test_f1: 0.1636
 epoch: 2, train_loss: 1.0163, test_loss: 1.4931, test_f1: 0.1589
 epoch: 3, train_loss: 0.9989, test_loss: 1.2338, test_f1: 0.3704
 epoch: 4, train_loss: 0.9413, test_loss: 1.1927, test_f1: 0.4812
 epoch: 5, train_loss: 0.9383, test_loss: 1.1076, test_f1: 0.4197
 epoch: 6, train_loss: 0.9186, test_loss: 1.1282, test_f1: 0.4787
 epoch: 7, train_loss: 0.8965, test_loss: 1.1060, test_f1: 0.5306
 epoch: 8, train_loss: 0.8831, test_loss: 1.0725, test_f1: 0.4957
 epoch: 9, train_loss: 0.8470, test_loss: 1.2073, test_f1: 0.4634
 epoch: 10, train_loss: 0.8678, test_loss: 1.1988, test_f1: 0.4711
 epoch: 11, train_loss: 0.8776, test_loss: 1.0582, test_f1: 0.5038
 epoch: 12, train_loss: 0.8502, test_loss: 1.1150, test_f1: 0.4598
 epoch: 13, train_loss: 0.7977, test_loss: 1.1609, test_f1: 0.5127
 epoch: 14, train_loss: 0.7993, test_loss: 1.3740, test_f1: 0.4919
 epoch: 15, train_loss: 0.8221, test_loss: 1.2020, test_f1: 0.5147
 epoch: 16, train_loss: 0.7694, test_loss: 1.2034, test_f1: 0.5679
 epoch: 17, train_loss: 0.7394, test_loss: 1.4096, test_f1: 0.4541
 epoch: 18, train_loss: 0.7633, test_loss: 1.2301, test_f1: 0.5270
 epoch: 19, train_loss: 0.7637, test_loss: 1.2115, test_f1: 0.5183
 epoch: 20, train_loss: 0.7968, test_loss: 1.0881, test_f1: 0.5132
 epoch: 21, train_loss: 0.8305, test_loss: 1.2405, test_f1: 0.4467
 epoch: 22, train_loss: 0.7607, test_loss: 1.0363, test_f1: 0.5722
 epoch: 23, train_loss: 0.7589, test_loss: 1.0850, test_f1: 0.5383
 epoch: 24, train_loss: 0.7190, test_loss: 1.1261, test_f1: 0.5632
 epoch: 25, train_loss: 0.6939, test_loss: 1.2089, test_f1: 0.5130
 epoch: 26, train_loss: 0.7012, test_loss: 1.2335, test_f1: 0.5452
 epoch: 27, train_loss: 0.6606, test_loss: 1.1621, test_f1: 0.5447
 epoch: 28, train_loss: 0.6888, test_loss: 1.1918, test_f1: 0.4897
 epoch: 29, train_loss: 0.6532, test_loss: 1.2731, test_f1: 0.5483
 epoch: 30, train_loss: 0.6186, test_loss: 1.2940, test_f1: 0.5199
 epoch: 31, train_loss: 0.6292, test_loss: 1.1800, test_f1: 0.6344
 epoch: 32, train_loss: 0.6002, test_loss: 1.1240, test_f1: 0.5822
 epoch: 33, train_loss: 0.5819, test_loss: 1.3078, test_f1: 0.4749
 epoch: 34, train_loss: 0.6677, test_loss: 1.2796, test_f1: 0.5626
 epoch: 35, train_loss: 0.6679, test_loss: 1.5303, test_f1: 0.4997
 epoch: 36, train_loss: 0.6893, test_loss: 1.0836, test_f1: 0.5753
 epoch: 37, train_loss: 0.6592, test_loss: 1.1047, test_f1: 0.5980
 epoch: 38, train_loss: 0.6242, test_loss: 1.1604, test_f1: 0.5887
 epoch: 39, train_loss: 0.6008, test_loss: 1.0954, test_f1: 0.6061
 epoch: 40, train_loss: 0.5915, test_loss: 1.4662, test_f1: 0.5796
 epoch: 41, train_loss: 0.5700, test_loss: 1.2244, test_f1: 0.6023
 epoch: 42, train_loss: 0.5924, test_loss: 1.2976, test_f1: 0.5821
 epoch: 43, train_loss: 0.5435, test_loss: 1.5564, test_f1: 0.5608
 epoch: 44, train_loss: 0.6806, test_loss: 1.9713, test_f1: 0.4769
 epoch: 45, train_loss: 0.6119, test_loss: 1.1441, test_f1: 0.5880
 epoch: 46, train_loss: 0.6391, test_loss: 1.3197, test_f1: 0.5396
 epoch: 47, train_loss: 0.6414, test_loss: 1.9054, test_f1: 0.5376
 epoch: 48, train_loss: 0.6012, test_loss: 1.5677, test_f1: 0.5713
 epoch: 49, train_loss: 0.6002, test_loss: 1.2356, test_f1: 0.6354
 epoch: 50, train_loss: 0.5987, test_loss: 1.4462, test_f1: 0.5341
 epoch: 51, train_loss: 0.5360, test_loss: 1.5678, test_f1: 0.5591
 epoch: 52, train_loss: 0.5203, test_loss: 1.4458, test_f1: 0.5646
 epoch: 53, train_loss: 0.4775, test_loss: 1.3557, test_f1: 0.5873
 epoch: 54, train_loss: 0.4878, test_loss: 1.3850, test_f1: 0.5660
 epoch: 55, train_loss: 0.4888, test_loss: 1.4679, test_f1: 0.5723
 epoch: 56, train_loss: 0.4683, test_loss: 1.3978, test_f1: 0.5962
 epoch: 57, train_loss: 0.4735, test_loss: 1.2525, test_f1: 0.6262
 epoch: 58, train_loss: 0.4737, test_loss: 1.4566, test_f1: 0.5787
 epoch: 59, train_loss: 0.4405, test_loss: 1.5604, test_f1: 0.5582
 epoch: 60, train_loss: 0.4464, test_loss: 1.6770, test_f1: 0.5739
 epoch: 61, train_loss: 0.4367, test_loss: 1.7590, test_f1: 0.5726
 epoch: 62, train_loss: 0.4443, test_loss: 1.6090, test_f1: 0.5980
 epoch: 63, train_loss: 0.4126, test_loss: 1.7520, test_f1: 0.5882
 epoch: 64, train_loss: 0.4039, test_loss: 1.7639, test_f1: 0.6181
 epoch: 65, train_loss: 0.3666, test_loss: 1.7309, test_f1: 0.6342
 epoch: 66, train_loss: 0.3737, test_loss: 2.0086, test_f1: 0.5965
 epoch: 67, train_loss: 0.4077, test_loss: 1.8548, test_f1: 0.6178
 epoch: 68, train_loss: 0.4197, test_loss: 1.8786, test_f1: 0.5500
 epoch: 69, train_loss: 0.4275, test_loss: 1.6258, test_f1: 0.6076
 epoch: 70, train_loss: 0.3714, test_loss: 1.4764, test_f1: 0.6141
 epoch: 71, train_loss: 0.3799, test_loss: 1.7419, test_f1: 0.6135
 epoch: 72, train_loss: 0.3627, test_loss: 1.8552, test_f1: 0.6048
 epoch: 73, train_loss: 0.4369, test_loss: 1.7370, test_f1: 0.5929
 epoch: 74, train_loss: 0.3995, test_loss: 1.6427, test_f1: 0.6356
 epoch: 75, train_loss: 0.3774, test_loss: 1.7338, test_f1: 0.6158
 epoch: 76, train_loss: 0.3618, test_loss: 1.6525, test_f1: 0.6084
 epoch: 77, train_loss: 0.3501, test_loss: 2.1479, test_f1: 0.5812
 epoch: 78, train_loss: 0.3335, test_loss: 1.9614, test_f1: 0.5875
 epoch: 79, train_loss: 0.3263, test_loss: 2.1693, test_f1: 0.5257
 epoch: 80, train_loss: 0.3352, test_loss: 1.9662, test_f1: 0.6445
 epoch: 81, train_loss: 0.3305, test_loss: 2.1051, test_f1: 0.6128
 epoch: 82, train_loss: 0.3179, test_loss: 2.0627, test_f1: 0.5999
 epoch: 83, train_loss: 0.3634, test_loss: 2.4476, test_f1: 0.5728
 epoch: 84, train_loss: 0.3492, test_loss: 1.9613, test_f1: 0.5712
 epoch: 85, train_loss: 0.3668, test_loss: 2.0372, test_f1: 0.5556
 epoch: 86, train_loss: 0.3947, test_loss: 2.4277, test_f1: 0.4958
 epoch: 87, train_loss: 0.3506, test_loss: 2.2175, test_f1: 0.5665
 epoch: 88, train_loss: 0.3161, test_loss: 2.1058, test_f1: 0.5782
 epoch: 89, train_loss: 0.3171, test_loss: 1.9180, test_f1: 0.5858
 epoch: 90, train_loss: 0.3008, test_loss: 2.2001, test_f1: 0.5888
 epoch: 91, train_loss: 0.3278, test_loss: 2.0601, test_f1: 0.6216
 epoch: 92, train_loss: 0.3834, test_loss: 2.2539, test_f1: 0.5740
 epoch: 93, train_loss: 0.3563, test_loss: 2.2376, test_f1: 0.6131
 epoch: 94, train_loss: 0.3826, test_loss: 6.1372, test_f1: 0.4386
 epoch: 95, train_loss: 0.3589, test_loss: 3.0006, test_f1: 0.5566
 epoch: 96, train_loss: 0.3592, test_loss: 1.9171, test_f1: 0.5564
 epoch: 97, train_loss: 0.3701, test_loss: 1.6378, test_f1: 0.5932
 epoch: 98, train_loss: 0.3462, test_loss: 2.3673, test_f1: 0.5574
 epoch: 99, train_loss: 0.3367, test_loss: 2.0340, test_f1: 0.5655
##################ITERATION #3 ****************************************
 epoch: 0, train_loss: 1.5041, test_loss: 1.3570, test_f1: 0.3229
 epoch: 1, train_loss: 1.0886, test_loss: 1.8488, test_f1: 0.0563
 epoch: 2, train_loss: 1.0395, test_loss: 1.1880, test_f1: 0.4231
 epoch: 3, train_loss: 0.9710, test_loss: 1.1398, test_f1: 0.4711
 epoch: 4, train_loss: 0.9192, test_loss: 1.5104, test_f1: 0.3511
 epoch: 5, train_loss: 0.9237, test_loss: 1.2830, test_f1: 0.4656
 epoch: 6, train_loss: 0.9089, test_loss: 1.0470, test_f1: 0.5335
 epoch: 7, train_loss: 0.8851, test_loss: 1.1690, test_f1: 0.4328
 epoch: 8, train_loss: 0.8694, test_loss: 1.1934, test_f1: 0.4538
 epoch: 9, train_loss: 0.8671, test_loss: 1.1460, test_f1: 0.5345
 epoch: 10, train_loss: 0.8439, test_loss: 1.7566, test_f1: 0.4144
 epoch: 11, train_loss: 0.8137, test_loss: 1.0673, test_f1: 0.5405
 epoch: 12, train_loss: 0.8169, test_loss: 1.0751, test_f1: 0.5331
 epoch: 13, train_loss: 0.7827, test_loss: 1.0734, test_f1: 0.5101
 epoch: 14, train_loss: 0.7681, test_loss: 1.1796, test_f1: 0.5026
 epoch: 15, train_loss: 0.7703, test_loss: 1.1251, test_f1: 0.5157
 epoch: 16, train_loss: 0.7523, test_loss: 2.1875, test_f1: 0.4160
 epoch: 17, train_loss: 0.7781, test_loss: 1.5145, test_f1: 0.4370
 epoch: 18, train_loss: 0.7706, test_loss: 1.1997, test_f1: 0.4893
 epoch: 19, train_loss: 0.7691, test_loss: 1.1718, test_f1: 0.5026
 epoch: 20, train_loss: 0.7949, test_loss: 1.0195, test_f1: 0.5360
 epoch: 21, train_loss: 0.7586, test_loss: 1.1118, test_f1: 0.5420
 epoch: 22, train_loss: 0.7540, test_loss: 1.7257, test_f1: 0.4227
 epoch: 23, train_loss: 0.7456, test_loss: 1.2381, test_f1: 0.5005
 epoch: 24, train_loss: 0.6998, test_loss: 1.1246, test_f1: 0.5748
 epoch: 25, train_loss: 0.6752, test_loss: 1.1032, test_f1: 0.5104
 epoch: 26, train_loss: 0.6976, test_loss: 1.0987, test_f1: 0.5864
 epoch: 27, train_loss: 0.6964, test_loss: 1.3335, test_f1: 0.4706
 epoch: 28, train_loss: 0.7190, test_loss: 1.4482, test_f1: 0.4727
 epoch: 29, train_loss: 0.6660, test_loss: 1.4394, test_f1: 0.5051
 epoch: 30, train_loss: 0.6564, test_loss: 1.3198, test_f1: 0.5716
 epoch: 31, train_loss: 0.6742, test_loss: 1.3855, test_f1: 0.4848
 epoch: 32, train_loss: 0.6865, test_loss: 1.1486, test_f1: 0.5727
 epoch: 33, train_loss: 0.6665, test_loss: 1.4676, test_f1: 0.4933
 epoch: 34, train_loss: 0.6479, test_loss: 1.4901, test_f1: 0.4489
 epoch: 35, train_loss: 0.6776, test_loss: 1.0634, test_f1: 0.5692
 epoch: 36, train_loss: 0.6576, test_loss: 1.2842, test_f1: 0.5451
 epoch: 37, train_loss: 0.6659, test_loss: 1.5777, test_f1: 0.4864
 epoch: 38, train_loss: 0.6195, test_loss: 2.1696, test_f1: 0.3807
 epoch: 39, train_loss: 0.6424, test_loss: 1.2448, test_f1: 0.5577
 epoch: 40, train_loss: 0.6524, test_loss: 1.9312, test_f1: 0.4669
 epoch: 41, train_loss: 0.6037, test_loss: 1.3547, test_f1: 0.5899
 epoch: 42, train_loss: 0.6010, test_loss: 1.1863, test_f1: 0.6391
 epoch: 43, train_loss: 0.5903, test_loss: 1.6325, test_f1: 0.4009
 epoch: 44, train_loss: 0.5921, test_loss: 1.3673, test_f1: 0.5564
 epoch: 45, train_loss: 0.5605, test_loss: 1.4411, test_f1: 0.5604
 epoch: 46, train_loss: 0.5448, test_loss: 1.5646, test_f1: 0.5316
 epoch: 47, train_loss: 0.5608, test_loss: 2.1405, test_f1: 0.3864
 epoch: 48, train_loss: 0.6801, test_loss: 1.3338, test_f1: 0.4386
 epoch: 49, train_loss: 0.6517, test_loss: 1.6892, test_f1: 0.5499
 epoch: 50, train_loss: 0.6295, test_loss: 1.3209, test_f1: 0.4899
 epoch: 51, train_loss: 0.5890, test_loss: 1.4049, test_f1: 0.5283
 epoch: 52, train_loss: 0.5450, test_loss: 1.3218, test_f1: 0.6053
 epoch: 53, train_loss: 0.5185, test_loss: 1.5089, test_f1: 0.6006
 epoch: 54, train_loss: 0.4759, test_loss: 1.5549, test_f1: 0.5747
 epoch: 55, train_loss: 0.4770, test_loss: 1.6112, test_f1: 0.5870
 epoch: 56, train_loss: 0.4771, test_loss: 1.5101, test_f1: 0.6138
 epoch: 57, train_loss: 0.4412, test_loss: 1.7844, test_f1: 0.6003
 epoch: 58, train_loss: 0.4388, test_loss: 1.7905, test_f1: 0.5992
 epoch: 59, train_loss: 0.4407, test_loss: 2.1648, test_f1: 0.6192
 epoch: 60, train_loss: 0.4740, test_loss: 2.0778, test_f1: 0.4601
 epoch: 61, train_loss: 0.4657, test_loss: 2.0755, test_f1: 0.4585
 epoch: 62, train_loss: 0.4883, test_loss: 2.0362, test_f1: 0.5578
 epoch: 63, train_loss: 0.4252, test_loss: 1.9880, test_f1: 0.6165
 epoch: 64, train_loss: 0.4291, test_loss: 1.7208, test_f1: 0.6240
 epoch: 65, train_loss: 0.4061, test_loss: 1.7704, test_f1: 0.6293
 epoch: 66, train_loss: 0.4089, test_loss: 1.7556, test_f1: 0.6217
 epoch: 67, train_loss: 0.4394, test_loss: 1.8030, test_f1: 0.5483
 epoch: 68, train_loss: 0.4430, test_loss: 1.5853, test_f1: 0.6171
 epoch: 69, train_loss: 0.4229, test_loss: 1.8427, test_f1: 0.6049
 epoch: 70, train_loss: 0.4101, test_loss: 1.5960, test_f1: 0.5993
 epoch: 71, train_loss: 0.4068, test_loss: 1.5654, test_f1: 0.6164
 epoch: 72, train_loss: 0.4005, test_loss: 1.6886, test_f1: 0.5529
 epoch: 73, train_loss: 0.3985, test_loss: 1.8984, test_f1: 0.5530
 epoch: 74, train_loss: 0.4248, test_loss: 2.5078, test_f1: 0.5263
 epoch: 75, train_loss: 0.4134, test_loss: 1.8034, test_f1: 0.5812
 epoch: 76, train_loss: 0.3854, test_loss: 1.8471, test_f1: 0.6027
 epoch: 77, train_loss: 0.3647, test_loss: 1.7149, test_f1: 0.6159
 epoch: 78, train_loss: 0.3334, test_loss: 1.8676, test_f1: 0.5730
 epoch: 79, train_loss: 0.3468, test_loss: 1.9832, test_f1: 0.5725
 epoch: 80, train_loss: 0.4297, test_loss: 1.6640, test_f1: 0.6058
 epoch: 81, train_loss: 0.4177, test_loss: 1.5109, test_f1: 0.6261
 epoch: 82, train_loss: 0.3853, test_loss: 1.6807, test_f1: 0.5881
 epoch: 83, train_loss: 0.3899, test_loss: 1.9007, test_f1: 0.6126
 epoch: 84, train_loss: 0.3866, test_loss: 1.7853, test_f1: 0.6175
 epoch: 85, train_loss: 0.3452, test_loss: 2.1384, test_f1: 0.5874
 epoch: 86, train_loss: 0.3409, test_loss: 1.9635, test_f1: 0.6159
 epoch: 87, train_loss: 0.3852, test_loss: 2.0068, test_f1: 0.6079
 epoch: 88, train_loss: 0.3364, test_loss: 2.3105, test_f1: 0.5572
 epoch: 89, train_loss: 0.3969, test_loss: 2.7904, test_f1: 0.5626
 epoch: 90, train_loss: 0.4109, test_loss: 2.8685, test_f1: 0.5532
 epoch: 91, train_loss: 0.4043, test_loss: 2.6255, test_f1: 0.5520
 epoch: 92, train_loss: 0.4221, test_loss: 2.4642, test_f1: 0.5484
 epoch: 93, train_loss: 0.3826, test_loss: 1.9511, test_f1: 0.6117
 epoch: 94, train_loss: 0.3549, test_loss: 1.8717, test_f1: 0.6080
 epoch: 95, train_loss: 0.3668, test_loss: 1.9769, test_f1: 0.5578
 epoch: 96, train_loss: 0.3676, test_loss: 1.8221, test_f1: 0.6427
 epoch: 97, train_loss: 0.3587, test_loss: 2.0193, test_f1: 0.5901
 epoch: 98, train_loss: 0.3665, test_loss: 2.3874, test_f1: 0.6339
 epoch: 99, train_loss: 0.3245, test_loss: 2.1832, test_f1: 0.6156
##################ITERATION #4 ****************************************
 epoch: 0, train_loss: 2.5703, test_loss: 1.4728, test_f1: 0.1374
 epoch: 1, train_loss: 1.1398, test_loss: 2.7465, test_f1: 0.2281
 epoch: 2, train_loss: 1.0839, test_loss: 2.2642, test_f1: 0.2281
 epoch: 3, train_loss: 1.0302, test_loss: 1.8047, test_f1: 0.2921
 epoch: 4, train_loss: 1.0087, test_loss: 1.6708, test_f1: 0.3114
 epoch: 5, train_loss: 0.9897, test_loss: 1.1366, test_f1: 0.4407
 epoch: 6, train_loss: 0.9648, test_loss: 1.0709, test_f1: 0.4285
 epoch: 7, train_loss: 0.9441, test_loss: 1.0881, test_f1: 0.4787
 epoch: 8, train_loss: 0.9263, test_loss: 1.1209, test_f1: 0.4422
 epoch: 9, train_loss: 0.9161, test_loss: 1.0965, test_f1: 0.4792
 epoch: 10, train_loss: 0.9147, test_loss: 1.0860, test_f1: 0.4904
 epoch: 11, train_loss: 0.8874, test_loss: 1.0428, test_f1: 0.5378
 epoch: 12, train_loss: 0.8861, test_loss: 1.1214, test_f1: 0.5242
 epoch: 13, train_loss: 0.8793, test_loss: 1.0709, test_f1: 0.4705
 epoch: 14, train_loss: 0.8564, test_loss: 1.1469, test_f1: 0.4970
 epoch: 15, train_loss: 0.8378, test_loss: 1.0884, test_f1: 0.5405
 epoch: 16, train_loss: 0.8237, test_loss: 1.2209, test_f1: 0.4989
 epoch: 17, train_loss: 0.8190, test_loss: 1.2847, test_f1: 0.4793
 epoch: 18, train_loss: 0.8445, test_loss: 1.1182, test_f1: 0.5518
 epoch: 19, train_loss: 0.8091, test_loss: 1.0994, test_f1: 0.5577
 epoch: 20, train_loss: 0.7962, test_loss: 1.1209, test_f1: 0.5765
 epoch: 21, train_loss: 0.7778, test_loss: 1.0640, test_f1: 0.6164
 epoch: 22, train_loss: 0.7446, test_loss: 1.2127, test_f1: 0.5129
 epoch: 23, train_loss: 0.7271, test_loss: 1.3673, test_f1: 0.6112
 epoch: 24, train_loss: 0.7176, test_loss: 1.4248, test_f1: 0.5045
 epoch: 25, train_loss: 0.7181, test_loss: 2.9325, test_f1: 0.3526
 epoch: 26, train_loss: 0.7515, test_loss: 1.7541, test_f1: 0.4917
 epoch: 27, train_loss: 0.7399, test_loss: 1.1964, test_f1: 0.5301
 epoch: 28, train_loss: 0.7092, test_loss: 1.2904, test_f1: 0.5364
 epoch: 29, train_loss: 0.7273, test_loss: 1.3113, test_f1: 0.5016
 epoch: 30, train_loss: 0.7150, test_loss: 1.3102, test_f1: 0.4482
 epoch: 31, train_loss: 0.7408, test_loss: 1.7008, test_f1: 0.4564
 epoch: 32, train_loss: 0.7028, test_loss: 1.4352, test_f1: 0.5367
 epoch: 33, train_loss: 0.7045, test_loss: 1.7960, test_f1: 0.4898
 epoch: 34, train_loss: 0.7213, test_loss: 1.0986, test_f1: 0.5562
 epoch: 35, train_loss: 0.6748, test_loss: 1.6345, test_f1: 0.4109
 epoch: 36, train_loss: 0.7044, test_loss: 1.1357, test_f1: 0.5924
 epoch: 37, train_loss: 0.6674, test_loss: 1.2078, test_f1: 0.5693
 epoch: 38, train_loss: 0.6370, test_loss: 1.3627, test_f1: 0.5017
 epoch: 39, train_loss: 0.6082, test_loss: 1.5143, test_f1: 0.4900
 epoch: 40, train_loss: 0.6294, test_loss: 1.3006, test_f1: 0.5582
 epoch: 41, train_loss: 0.6012, test_loss: 1.3066, test_f1: 0.5420
 epoch: 42, train_loss: 0.6259, test_loss: 1.4599, test_f1: 0.5490
 epoch: 43, train_loss: 0.5960, test_loss: 1.2014, test_f1: 0.6083
 epoch: 44, train_loss: 0.5968, test_loss: 2.3522, test_f1: 0.5012
 epoch: 45, train_loss: 0.5962, test_loss: 1.2970, test_f1: 0.5820
 epoch: 46, train_loss: 0.6237, test_loss: 1.3215, test_f1: 0.5441
 epoch: 47, train_loss: 0.6141, test_loss: 1.2172, test_f1: 0.5980
 epoch: 48, train_loss: 0.6484, test_loss: 1.1932, test_f1: 0.5602
 epoch: 49, train_loss: 0.5957, test_loss: 1.5299, test_f1: 0.5651
 epoch: 50, train_loss: 0.6238, test_loss: 1.6847, test_f1: 0.5511
 epoch: 51, train_loss: 0.5895, test_loss: 1.7380, test_f1: 0.5079
 epoch: 52, train_loss: 0.5543, test_loss: 1.1965, test_f1: 0.6301
 epoch: 53, train_loss: 0.5211, test_loss: 1.1006, test_f1: 0.6438
 epoch: 54, train_loss: 0.4896, test_loss: 1.3062, test_f1: 0.5422
 epoch: 55, train_loss: 0.5186, test_loss: 1.3712, test_f1: 0.5370
 epoch: 56, train_loss: 0.4813, test_loss: 1.3754, test_f1: 0.5648
 epoch: 57, train_loss: 0.4629, test_loss: 1.4754, test_f1: 0.5891
 epoch: 58, train_loss: 0.4951, test_loss: 1.5719, test_f1: 0.5993
 epoch: 59, train_loss: 0.5018, test_loss: 1.6467, test_f1: 0.6039
 epoch: 60, train_loss: 0.4691, test_loss: 1.7182, test_f1: 0.6001
 epoch: 61, train_loss: 0.4549, test_loss: 1.4502, test_f1: 0.5635
 epoch: 62, train_loss: 0.4471, test_loss: 1.2800, test_f1: 0.6179
 epoch: 63, train_loss: 0.4442, test_loss: 1.3406, test_f1: 0.6075
 epoch: 64, train_loss: 0.4708, test_loss: 1.4662, test_f1: 0.5769
 epoch: 65, train_loss: 0.4624, test_loss: 1.4854, test_f1: 0.6084
 epoch: 66, train_loss: 0.4659, test_loss: 1.7478, test_f1: 0.5890
 epoch: 67, train_loss: 0.4828, test_loss: 1.5255, test_f1: 0.5644
 epoch: 68, train_loss: 0.4924, test_loss: 1.5720, test_f1: 0.6357
 epoch: 69, train_loss: 0.4634, test_loss: 1.6273, test_f1: 0.6214
 epoch: 70, train_loss: 0.4342, test_loss: 1.5666, test_f1: 0.5893
 epoch: 71, train_loss: 0.4038, test_loss: 1.6154, test_f1: 0.6287
 epoch: 72, train_loss: 0.4054, test_loss: 1.7509, test_f1: 0.5916
 epoch: 73, train_loss: 0.4076, test_loss: 2.0274, test_f1: 0.6259
 epoch: 74, train_loss: 0.4148, test_loss: 1.5379, test_f1: 0.6058
 epoch: 75, train_loss: 0.4264, test_loss: 1.8122, test_f1: 0.6073
 epoch: 76, train_loss: 0.4852, test_loss: 1.7789, test_f1: 0.5630
 epoch: 77, train_loss: 0.4560, test_loss: 3.1659, test_f1: 0.4037
 epoch: 78, train_loss: 0.4523, test_loss: 2.6156, test_f1: 0.5021
 epoch: 79, train_loss: 0.4631, test_loss: 1.6836, test_f1: 0.6119
 epoch: 80, train_loss: 0.4115, test_loss: 1.7899, test_f1: 0.5287
 epoch: 81, train_loss: 0.5192, test_loss: 2.6916, test_f1: 0.5270
 epoch: 82, train_loss: 0.4650, test_loss: 1.6509, test_f1: 0.5919
 epoch: 83, train_loss: 0.4518, test_loss: 1.7073, test_f1: 0.5836
 epoch: 84, train_loss: 0.3942, test_loss: 1.6620, test_f1: 0.5700
 epoch: 85, train_loss: 0.4011, test_loss: 1.7454, test_f1: 0.5905
 epoch: 86, train_loss: 0.3885, test_loss: 1.9588, test_f1: 0.6066
 epoch: 87, train_loss: 0.3815, test_loss: 1.8240, test_f1: 0.5806
 epoch: 88, train_loss: 0.3948, test_loss: 1.8275, test_f1: 0.5945
 epoch: 89, train_loss: 0.4145, test_loss: 1.9837, test_f1: 0.6069
 epoch: 90, train_loss: 0.4033, test_loss: 1.8753, test_f1: 0.5975
 epoch: 91, train_loss: 0.4194, test_loss: 2.2560, test_f1: 0.5738
 epoch: 92, train_loss: 0.5833, test_loss: 1.7466, test_f1: 0.5835
 epoch: 93, train_loss: 0.5130, test_loss: 1.8959, test_f1: 0.5628
 epoch: 94, train_loss: 0.4538, test_loss: 1.7117, test_f1: 0.5593
 epoch: 95, train_loss: 0.4242, test_loss: 1.4425, test_f1: 0.5704
 epoch: 96, train_loss: 0.3929, test_loss: 1.6706, test_f1: 0.6194
 epoch: 97, train_loss: 0.3867, test_loss: 1.7099, test_f1: 0.6129
 epoch: 98, train_loss: 0.3481, test_loss: 1.8854, test_f1: 0.5985
 epoch: 99, train_loss: 0.3507, test_loss: 2.1992, test_f1: 0.6132
##################ITERATION #5 ****************************************
 epoch: 0, train_loss: 1.8597, test_loss: 1.4224, test_f1: 0.3397
 epoch: 1, train_loss: 1.1281, test_loss: 1.2746, test_f1: 0.2483
 epoch: 2, train_loss: 1.0541, test_loss: 1.2551, test_f1: 0.4156
 epoch: 3, train_loss: 1.0344, test_loss: 1.2015, test_f1: 0.3750
 epoch: 4, train_loss: 0.9950, test_loss: 1.1559, test_f1: 0.4186
 epoch: 5, train_loss: 0.9637, test_loss: 1.1784, test_f1: 0.4077
 epoch: 6, train_loss: 0.9062, test_loss: 1.0829, test_f1: 0.4643
 epoch: 7, train_loss: 0.8773, test_loss: 1.0224, test_f1: 0.5098
 epoch: 8, train_loss: 0.8870, test_loss: 1.1070, test_f1: 0.4509
 epoch: 9, train_loss: 0.8703, test_loss: 1.0871, test_f1: 0.5448
 epoch: 10, train_loss: 0.8933, test_loss: 1.1344, test_f1: 0.5049
 epoch: 11, train_loss: 0.8314, test_loss: 1.0509, test_f1: 0.4972
 epoch: 12, train_loss: 0.8067, test_loss: 1.1139, test_f1: 0.5364
 epoch: 13, train_loss: 0.7991, test_loss: 1.1509, test_f1: 0.5504
 epoch: 14, train_loss: 0.7682, test_loss: 1.4094, test_f1: 0.4793
 epoch: 15, train_loss: 0.7559, test_loss: 1.3980, test_f1: 0.5233
 epoch: 16, train_loss: 0.7803, test_loss: 1.3142, test_f1: 0.5310
 epoch: 17, train_loss: 0.7627, test_loss: 1.2053, test_f1: 0.4795
 epoch: 18, train_loss: 0.7209, test_loss: 1.4245, test_f1: 0.4943
 epoch: 19, train_loss: 0.7147, test_loss: 1.2615, test_f1: 0.5502
 epoch: 20, train_loss: 0.7188, test_loss: 1.2270, test_f1: 0.5133
 epoch: 21, train_loss: 0.7603, test_loss: 1.5599, test_f1: 0.4126
 epoch: 22, train_loss: 0.7328, test_loss: 1.2864, test_f1: 0.4994
 epoch: 23, train_loss: 0.6869, test_loss: 1.1300, test_f1: 0.5869
 epoch: 24, train_loss: 0.6801, test_loss: 1.1344, test_f1: 0.5662
 epoch: 25, train_loss: 0.6979, test_loss: 1.0252, test_f1: 0.5745
 epoch: 26, train_loss: 0.6991, test_loss: 1.2073, test_f1: 0.5257
 epoch: 27, train_loss: 0.6450, test_loss: 1.2635, test_f1: 0.5409
 epoch: 28, train_loss: 0.6485, test_loss: 1.6090, test_f1: 0.4725
 epoch: 29, train_loss: 0.6171, test_loss: 1.4268, test_f1: 0.4803
 epoch: 30, train_loss: 0.6259, test_loss: 1.1519, test_f1: 0.4999
 epoch: 31, train_loss: 0.6446, test_loss: 1.3194, test_f1: 0.5119
 epoch: 32, train_loss: 0.6372, test_loss: 1.4302, test_f1: 0.3931
 epoch: 33, train_loss: 0.6713, test_loss: 1.0949, test_f1: 0.6107
 epoch: 34, train_loss: 0.6718, test_loss: 1.1848, test_f1: 0.5008
 epoch: 35, train_loss: 0.6330, test_loss: 1.4887, test_f1: 0.4852
 epoch: 36, train_loss: 0.6024, test_loss: 1.5274, test_f1: 0.5637
 epoch: 37, train_loss: 0.5658, test_loss: 1.2504, test_f1: 0.6151
 epoch: 38, train_loss: 0.5832, test_loss: 1.4685, test_f1: 0.5642
 epoch: 39, train_loss: 0.5980, test_loss: 1.3805, test_f1: 0.5670
 epoch: 40, train_loss: 0.5825, test_loss: 1.7469, test_f1: 0.4646
 epoch: 41, train_loss: 0.5777, test_loss: 1.3952, test_f1: 0.5061
 epoch: 42, train_loss: 0.5461, test_loss: 1.5156, test_f1: 0.4849
 epoch: 43, train_loss: 0.5773, test_loss: 1.3420, test_f1: 0.5759
 epoch: 44, train_loss: 0.5967, test_loss: 1.4276, test_f1: 0.5007
 epoch: 45, train_loss: 0.6303, test_loss: 1.3231, test_f1: 0.4808
 epoch: 46, train_loss: 0.5995, test_loss: 1.6693, test_f1: 0.5653
 epoch: 47, train_loss: 0.6013, test_loss: 1.8478, test_f1: 0.5038
 epoch: 48, train_loss: 0.5801, test_loss: 1.4209, test_f1: 0.5711
 epoch: 49, train_loss: 0.5654, test_loss: 1.3248, test_f1: 0.5788
 epoch: 50, train_loss: 0.5336, test_loss: 1.4091, test_f1: 0.5895
 epoch: 51, train_loss: 0.5266, test_loss: 1.3191, test_f1: 0.6142
 epoch: 52, train_loss: 0.4931, test_loss: 1.3999, test_f1: 0.6031
 epoch: 53, train_loss: 0.4732, test_loss: 1.3780, test_f1: 0.6660
 epoch: 54, train_loss: 0.4422, test_loss: 1.5240, test_f1: 0.5736
 epoch: 55, train_loss: 0.5115, test_loss: 1.5737, test_f1: 0.5825
 epoch: 56, train_loss: 0.5122, test_loss: 1.3390, test_f1: 0.5990
 epoch: 57, train_loss: 0.5226, test_loss: 1.6726, test_f1: 0.5716
 epoch: 58, train_loss: 0.4792, test_loss: 1.4477, test_f1: 0.6185
 epoch: 59, train_loss: 0.4451, test_loss: 1.6405, test_f1: 0.5840
 epoch: 60, train_loss: 0.4103, test_loss: 1.5139, test_f1: 0.6277
 epoch: 61, train_loss: 0.4005, test_loss: 1.7478, test_f1: 0.6081
 epoch: 62, train_loss: 0.4287, test_loss: 1.5675, test_f1: 0.6214
 epoch: 63, train_loss: 0.4651, test_loss: 1.6067, test_f1: 0.6072
 epoch: 64, train_loss: 0.4229, test_loss: 1.5951, test_f1: 0.5883
 epoch: 65, train_loss: 0.4075, test_loss: 1.6073, test_f1: 0.5916
 epoch: 66, train_loss: 0.4213, test_loss: 1.4497, test_f1: 0.6523
 epoch: 67, train_loss: 0.4510, test_loss: 1.4825, test_f1: 0.6274
 epoch: 68, train_loss: 0.3925, test_loss: 1.7501, test_f1: 0.5690
 epoch: 69, train_loss: 0.3967, test_loss: 1.5903, test_f1: 0.5647
 epoch: 70, train_loss: 0.4110, test_loss: 1.5625, test_f1: 0.5920
 epoch: 71, train_loss: 0.4209, test_loss: 1.7101, test_f1: 0.5623
 epoch: 72, train_loss: 0.3986, test_loss: 1.7244, test_f1: 0.5884
 epoch: 73, train_loss: 0.3748, test_loss: 1.6692, test_f1: 0.6129
 epoch: 74, train_loss: 0.3495, test_loss: 1.8085, test_f1: 0.6035
 epoch: 75, train_loss: 0.3444, test_loss: 1.8994, test_f1: 0.6060
 epoch: 76, train_loss: 0.3353, test_loss: 1.7594, test_f1: 0.6054
 epoch: 77, train_loss: 0.3499, test_loss: 2.8148, test_f1: 0.5505
 epoch: 78, train_loss: 0.3891, test_loss: 2.2613, test_f1: 0.5811
 epoch: 79, train_loss: 0.3997, test_loss: 2.2348, test_f1: 0.6196
 epoch: 80, train_loss: 0.3637, test_loss: 1.9300, test_f1: 0.6044
 epoch: 81, train_loss: 0.3355, test_loss: 2.0751, test_f1: 0.5592
 epoch: 82, train_loss: 0.3169, test_loss: 1.6594, test_f1: 0.6469
 epoch: 83, train_loss: 0.3781, test_loss: 1.9223, test_f1: 0.5847
 epoch: 84, train_loss: 0.3899, test_loss: 1.8539, test_f1: 0.5706
 epoch: 85, train_loss: 0.3742, test_loss: 2.3462, test_f1: 0.5887
 epoch: 86, train_loss: 0.3769, test_loss: 1.8292, test_f1: 0.5949
 epoch: 87, train_loss: 0.3751, test_loss: 2.1448, test_f1: 0.5535
 epoch: 88, train_loss: 0.3426, test_loss: 1.6223, test_f1: 0.6279
 epoch: 89, train_loss: 0.3436, test_loss: 1.7066, test_f1: 0.6340
 epoch: 90, train_loss: 0.3272, test_loss: 1.7583, test_f1: 0.6306
 epoch: 91, train_loss: 0.2944, test_loss: 2.1941, test_f1: 0.5884
 epoch: 92, train_loss: 0.2950, test_loss: 1.9232, test_f1: 0.6185
 epoch: 93, train_loss: 0.2983, test_loss: 2.3075, test_f1: 0.5466
 epoch: 94, train_loss: 0.2860, test_loss: 2.1066, test_f1: 0.6102
 epoch: 95, train_loss: 0.2606, test_loss: 2.6640, test_f1: 0.6012
 epoch: 96, train_loss: 0.2854, test_loss: 2.2539, test_f1: 0.6138
 epoch: 97, train_loss: 0.2788, test_loss: 2.1107, test_f1: 0.5961
 epoch: 98, train_loss: 0.2907, test_loss: 2.2649, test_f1: 0.5727
 epoch: 99, train_loss: 0.2795, test_loss: 2.4141, test_f1: 0.5999
##################ITERATION #6 ****************************************
 epoch: 0, train_loss: 1.7842, test_loss: 1.7961, test_f1: 0.1365
 epoch: 1, train_loss: 1.1296, test_loss: 2.3760, test_f1: 0.2281
 epoch: 2, train_loss: 1.0277, test_loss: 2.1441, test_f1: 0.1485
 epoch: 3, train_loss: 0.9943, test_loss: 1.6963, test_f1: 0.1887
 epoch: 4, train_loss: 0.9980, test_loss: 1.5511, test_f1: 0.2331
 epoch: 5, train_loss: 0.9979, test_loss: 1.2382, test_f1: 0.4236
 epoch: 6, train_loss: 0.9779, test_loss: 1.2147, test_f1: 0.4378
 epoch: 7, train_loss: 0.9577, test_loss: 1.2422, test_f1: 0.4326
 epoch: 8, train_loss: 0.9444, test_loss: 1.2782, test_f1: 0.3912
 epoch: 9, train_loss: 0.9423, test_loss: 1.1326, test_f1: 0.4400
 epoch: 10, train_loss: 0.9633, test_loss: 1.2095, test_f1: 0.4200
 epoch: 11, train_loss: 0.9696, test_loss: 1.2307, test_f1: 0.3988
 epoch: 12, train_loss: 0.9653, test_loss: 1.2071, test_f1: 0.3536
 epoch: 13, train_loss: 0.9585, test_loss: 1.2641, test_f1: 0.3706
 epoch: 14, train_loss: 0.9362, test_loss: 1.2281, test_f1: 0.4042
 epoch: 15, train_loss: 0.9238, test_loss: 1.1996, test_f1: 0.4178
 epoch: 16, train_loss: 0.9252, test_loss: 1.1175, test_f1: 0.4148
 epoch: 17, train_loss: 0.9087, test_loss: 1.1424, test_f1: 0.3964
 epoch: 18, train_loss: 0.8998, test_loss: 1.2108, test_f1: 0.4566
 epoch: 19, train_loss: 0.8852, test_loss: 1.2653, test_f1: 0.3917
 epoch: 20, train_loss: 0.8762, test_loss: 1.2131, test_f1: 0.3818
 epoch: 21, train_loss: 0.8649, test_loss: 1.3584, test_f1: 0.4784
 epoch: 22, train_loss: 0.8670, test_loss: 1.2489, test_f1: 0.5091
 epoch: 23, train_loss: 0.8583, test_loss: 1.1268, test_f1: 0.4977
 epoch: 24, train_loss: 0.8532, test_loss: 1.1434, test_f1: 0.5052
 epoch: 25, train_loss: 0.8402, test_loss: 1.4318, test_f1: 0.4365
 epoch: 26, train_loss: 0.8324, test_loss: 1.1091, test_f1: 0.5273
 epoch: 27, train_loss: 0.8184, test_loss: 1.3543, test_f1: 0.4474
 epoch: 28, train_loss: 0.8421, test_loss: 1.0934, test_f1: 0.5041
 epoch: 29, train_loss: 0.8274, test_loss: 1.2312, test_f1: 0.4925
 epoch: 30, train_loss: 0.8043, test_loss: 1.2582, test_f1: 0.5337
 epoch: 31, train_loss: 0.8093, test_loss: 2.4289, test_f1: 0.4130
 epoch: 32, train_loss: 0.8081, test_loss: 1.5946, test_f1: 0.3409
 epoch: 33, train_loss: 0.7707, test_loss: 1.0651, test_f1: 0.4999
 epoch: 34, train_loss: 0.7457, test_loss: 1.6997, test_f1: 0.4872
 epoch: 35, train_loss: 0.7735, test_loss: 1.4407, test_f1: 0.5364
 epoch: 36, train_loss: 0.7752, test_loss: 1.5446, test_f1: 0.4765
 epoch: 37, train_loss: 0.7500, test_loss: 2.3150, test_f1: 0.3595
 epoch: 38, train_loss: 0.7798, test_loss: 0.9947, test_f1: 0.5675
 epoch: 39, train_loss: 0.7561, test_loss: 0.9590, test_f1: 0.5990
 epoch: 40, train_loss: 0.7484, test_loss: 1.1396, test_f1: 0.5707
 epoch: 41, train_loss: 0.7083, test_loss: 1.5229, test_f1: 0.5064
 epoch: 42, train_loss: 0.7197, test_loss: 1.3187, test_f1: 0.4304
 epoch: 43, train_loss: 0.7358, test_loss: 1.4418, test_f1: 0.4526
 epoch: 44, train_loss: 0.7849, test_loss: 1.3030, test_f1: 0.4681
 epoch: 45, train_loss: 0.7527, test_loss: 1.1250, test_f1: 0.5425
 epoch: 46, train_loss: 0.7448, test_loss: 1.3362, test_f1: 0.5098
 epoch: 47, train_loss: 0.7387, test_loss: 1.1806, test_f1: 0.5853
 epoch: 48, train_loss: 0.6965, test_loss: 1.0562, test_f1: 0.5773
 epoch: 49, train_loss: 0.6846, test_loss: 1.1101, test_f1: 0.5269
 epoch: 50, train_loss: 0.6810, test_loss: 1.2401, test_f1: 0.5215
 epoch: 51, train_loss: 0.6545, test_loss: 1.0798, test_f1: 0.5855
 epoch: 52, train_loss: 0.6300, test_loss: 1.1799, test_f1: 0.5420
 epoch: 53, train_loss: 0.6193, test_loss: 1.2215, test_f1: 0.5680
 epoch: 54, train_loss: 0.6048, test_loss: 1.2119, test_f1: 0.5816
 epoch: 55, train_loss: 0.5750, test_loss: 1.2279, test_f1: 0.5957
 epoch: 56, train_loss: 0.5722, test_loss: 1.2208, test_f1: 0.6075
 epoch: 57, train_loss: 0.6012, test_loss: 1.4176, test_f1: 0.5706
 epoch: 58, train_loss: 0.5645, test_loss: 1.1983, test_f1: 0.5647
 epoch: 59, train_loss: 0.5846, test_loss: 1.2051, test_f1: 0.5773
 epoch: 60, train_loss: 0.5740, test_loss: 1.2565, test_f1: 0.5876
 epoch: 61, train_loss: 0.5740, test_loss: 1.2120, test_f1: 0.6033
 epoch: 62, train_loss: 0.5442, test_loss: 1.1923, test_f1: 0.6320
 epoch: 63, train_loss: 0.5374, test_loss: 1.3086, test_f1: 0.5982
 epoch: 64, train_loss: 0.5453, test_loss: 1.5558, test_f1: 0.5515
 epoch: 65, train_loss: 0.5418, test_loss: 1.3369, test_f1: 0.5582
 epoch: 66, train_loss: 0.5427, test_loss: 1.2712, test_f1: 0.5887
 epoch: 67, train_loss: 0.5445, test_loss: 1.1708, test_f1: 0.6209
 epoch: 68, train_loss: 0.5787, test_loss: 1.2268, test_f1: 0.6193
 epoch: 69, train_loss: 0.5677, test_loss: 1.2437, test_f1: 0.5481
 epoch: 70, train_loss: 0.5617, test_loss: 1.3662, test_f1: 0.5530
 epoch: 71, train_loss: 0.5864, test_loss: 1.1458, test_f1: 0.6038
 epoch: 72, train_loss: 0.5634, test_loss: 1.2185, test_f1: 0.5989
 epoch: 73, train_loss: 0.5574, test_loss: 1.2411, test_f1: 0.5889
 epoch: 74, train_loss: 0.5807, test_loss: 1.1561, test_f1: 0.5912
 epoch: 75, train_loss: 0.5448, test_loss: 1.5109, test_f1: 0.5752
 epoch: 76, train_loss: 0.5426, test_loss: 1.3879, test_f1: 0.5881
 epoch: 77, train_loss: 0.5596, test_loss: 1.3390, test_f1: 0.5798
 epoch: 78, train_loss: 0.5402, test_loss: 1.2363, test_f1: 0.6019
 epoch: 79, train_loss: 0.5717, test_loss: 1.4273, test_f1: 0.5463
 epoch: 80, train_loss: 0.5601, test_loss: 1.2560, test_f1: 0.5500
 epoch: 81, train_loss: 0.5414, test_loss: 1.1289, test_f1: 0.5743
 epoch: 82, train_loss: 0.5192, test_loss: 1.1930, test_f1: 0.5852
 epoch: 83, train_loss: 0.4777, test_loss: 1.5462, test_f1: 0.5428
 epoch: 84, train_loss: 0.4835, test_loss: 1.3971, test_f1: 0.5936
 epoch: 85, train_loss: 0.4702, test_loss: 1.3191, test_f1: 0.5325
 epoch: 86, train_loss: 0.4770, test_loss: 1.2557, test_f1: 0.5924
 epoch: 87, train_loss: 0.4519, test_loss: 1.3622, test_f1: 0.6083
 epoch: 88, train_loss: 0.4388, test_loss: 1.4936, test_f1: 0.5902
 epoch: 89, train_loss: 0.4583, test_loss: 1.2766, test_f1: 0.6125
 epoch: 90, train_loss: 0.4796, test_loss: 1.6539, test_f1: 0.5669
 epoch: 91, train_loss: 0.4844, test_loss: 1.2857, test_f1: 0.6008
 epoch: 92, train_loss: 0.4796, test_loss: 1.2778, test_f1: 0.6226
 epoch: 93, train_loss: 0.4571, test_loss: 1.6442, test_f1: 0.5631
 epoch: 94, train_loss: 0.4650, test_loss: 1.5274, test_f1: 0.5380
 epoch: 95, train_loss: 0.4686, test_loss: 1.6564, test_f1: 0.5375
 epoch: 96, train_loss: 0.4528, test_loss: 1.5599, test_f1: 0.5859
 epoch: 97, train_loss: 0.4338, test_loss: 1.6582, test_f1: 0.5936
 epoch: 98, train_loss: 0.4189, test_loss: 1.9624, test_f1: 0.5888
 epoch: 99, train_loss: 0.4725, test_loss: 1.6231, test_f1: 0.5731
##################ITERATION #7 ****************************************
 epoch: 0, train_loss: 1.4273, test_loss: 1.5412, test_f1: 0.1867
 epoch: 1, train_loss: 1.2995, test_loss: 1.2954, test_f1: 0.1365
 epoch: 2, train_loss: 1.2127, test_loss: 1.3518, test_f1: 0.1938
 epoch: 3, train_loss: 1.1829, test_loss: 1.2439, test_f1: 0.3348
 epoch: 4, train_loss: 1.0758, test_loss: 1.2568, test_f1: 0.3968
 epoch: 5, train_loss: 0.9990, test_loss: 1.1046, test_f1: 0.4883
 epoch: 6, train_loss: 0.9576, test_loss: 1.0901, test_f1: 0.3391
 epoch: 7, train_loss: 0.9585, test_loss: 1.1252, test_f1: 0.3892
 epoch: 8, train_loss: 0.9500, test_loss: 1.1685, test_f1: 0.4063
 epoch: 9, train_loss: 0.9336, test_loss: 1.0678, test_f1: 0.4443
 epoch: 10, train_loss: 0.9471, test_loss: 1.6557, test_f1: 0.3458
 epoch: 11, train_loss: 0.9234, test_loss: 1.1890, test_f1: 0.3829
 epoch: 12, train_loss: 0.8705, test_loss: 1.0907, test_f1: 0.3799
 epoch: 13, train_loss: 0.8761, test_loss: 1.0563, test_f1: 0.4124
 epoch: 14, train_loss: 0.8533, test_loss: 0.9802, test_f1: 0.4366
 epoch: 15, train_loss: 0.8329, test_loss: 1.1501, test_f1: 0.4371
 epoch: 16, train_loss: 0.8183, test_loss: 1.5603, test_f1: 0.4545
 epoch: 17, train_loss: 0.8171, test_loss: 1.1450, test_f1: 0.5055
 epoch: 18, train_loss: 0.7940, test_loss: 1.1481, test_f1: 0.5298
 epoch: 19, train_loss: 0.7664, test_loss: 1.7253, test_f1: 0.4456
 epoch: 20, train_loss: 0.7625, test_loss: 1.0922, test_f1: 0.5257
 epoch: 21, train_loss: 0.7466, test_loss: 1.3101, test_f1: 0.5420
 epoch: 22, train_loss: 0.7851, test_loss: 1.2408, test_f1: 0.5942
 epoch: 23, train_loss: 0.7614, test_loss: 1.4206, test_f1: 0.5562
 epoch: 24, train_loss: 0.7861, test_loss: 1.1528, test_f1: 0.4700
 epoch: 25, train_loss: 0.7990, test_loss: 1.3376, test_f1: 0.5266
 epoch: 26, train_loss: 0.7371, test_loss: 1.0983, test_f1: 0.5518
 epoch: 27, train_loss: 0.7446, test_loss: 1.1113, test_f1: 0.5450
 epoch: 28, train_loss: 0.7327, test_loss: 1.5842, test_f1: 0.5323
 epoch: 29, train_loss: 0.7472, test_loss: 1.5258, test_f1: 0.5104
 epoch: 30, train_loss: 0.7391, test_loss: 1.2297, test_f1: 0.5272
 epoch: 31, train_loss: 0.7102, test_loss: 1.1931, test_f1: 0.5423
 epoch: 32, train_loss: 0.6909, test_loss: 1.4554, test_f1: 0.5024
 epoch: 33, train_loss: 0.6956, test_loss: 1.2275, test_f1: 0.5653
 epoch: 34, train_loss: 0.7036, test_loss: 1.3128, test_f1: 0.5844
 epoch: 35, train_loss: 0.7119, test_loss: 1.4357, test_f1: 0.5085
 epoch: 36, train_loss: 0.7467, test_loss: 1.0812, test_f1: 0.5416
 epoch: 37, train_loss: 0.6924, test_loss: 1.0543, test_f1: 0.6072
 epoch: 38, train_loss: 0.6782, test_loss: 1.3438, test_f1: 0.5290
 epoch: 39, train_loss: 0.7072, test_loss: 1.0819, test_f1: 0.5733
 epoch: 40, train_loss: 0.6692, test_loss: 1.3412, test_f1: 0.5151
 epoch: 41, train_loss: 0.6707, test_loss: 1.1573, test_f1: 0.5491
 epoch: 42, train_loss: 0.6532, test_loss: 1.4266, test_f1: 0.5568
 epoch: 43, train_loss: 0.6545, test_loss: 1.4928, test_f1: 0.4994
 epoch: 44, train_loss: 0.6796, test_loss: 1.0991, test_f1: 0.5409
 epoch: 45, train_loss: 0.6763, test_loss: 1.0623, test_f1: 0.5661
 epoch: 46, train_loss: 0.6728, test_loss: 1.5518, test_f1: 0.4330
 epoch: 47, train_loss: 0.7065, test_loss: 1.9522, test_f1: 0.4956
 epoch: 48, train_loss: 0.6511, test_loss: 1.1907, test_f1: 0.5616
 epoch: 49, train_loss: 0.6535, test_loss: 1.5167, test_f1: 0.5696
 epoch: 50, train_loss: 0.6373, test_loss: 1.4876, test_f1: 0.5685
 epoch: 51, train_loss: 0.6263, test_loss: 1.0198, test_f1: 0.5836
 epoch: 52, train_loss: 0.6093, test_loss: 1.0376, test_f1: 0.5372
 epoch: 53, train_loss: 0.5965, test_loss: 1.2418, test_f1: 0.5576
 epoch: 54, train_loss: 0.5651, test_loss: 1.2613, test_f1: 0.5913
 epoch: 55, train_loss: 0.5673, test_loss: 1.1790, test_f1: 0.5893
 epoch: 56, train_loss: 0.5750, test_loss: 1.3392, test_f1: 0.5342
 epoch: 57, train_loss: 0.6022, test_loss: 1.5534, test_f1: 0.5436
 epoch: 58, train_loss: 0.5649, test_loss: 1.3734, test_f1: 0.5959
 epoch: 59, train_loss: 0.5711, test_loss: 1.1729, test_f1: 0.5883
 epoch: 60, train_loss: 0.5531, test_loss: 1.3039, test_f1: 0.5706
 epoch: 61, train_loss: 0.5348, test_loss: 1.2167, test_f1: 0.5944
 epoch: 62, train_loss: 0.5308, test_loss: 1.3131, test_f1: 0.5668
 epoch: 63, train_loss: 0.5173, test_loss: 1.6334, test_f1: 0.5550
 epoch: 64, train_loss: 0.5062, test_loss: 1.5752, test_f1: 0.5611
 epoch: 65, train_loss: 0.5296, test_loss: 1.2434, test_f1: 0.5855
 epoch: 66, train_loss: 0.5597, test_loss: 1.3866, test_f1: 0.5481
 epoch: 67, train_loss: 0.5642, test_loss: 1.3466, test_f1: 0.6050
 epoch: 68, train_loss: 0.5455, test_loss: 1.4642, test_f1: 0.5575
 epoch: 69, train_loss: 0.5312, test_loss: 1.5022, test_f1: 0.5648
 epoch: 70, train_loss: 0.5620, test_loss: 1.3924, test_f1: 0.5934
 epoch: 71, train_loss: 0.5469, test_loss: 1.2767, test_f1: 0.6241
 epoch: 72, train_loss: 0.5568, test_loss: 1.2447, test_f1: 0.5823
 epoch: 73, train_loss: 0.5565, test_loss: 1.6908, test_f1: 0.5716
 epoch: 74, train_loss: 0.5124, test_loss: 1.4612, test_f1: 0.5832
 epoch: 75, train_loss: 0.5173, test_loss: 1.3236, test_f1: 0.6022
 epoch: 76, train_loss: 0.4607, test_loss: 1.6957, test_f1: 0.5590
 epoch: 77, train_loss: 0.4754, test_loss: 1.7718, test_f1: 0.5671
 epoch: 78, train_loss: 0.4932, test_loss: 1.8935, test_f1: 0.5608
 epoch: 79, train_loss: 0.4996, test_loss: 1.4735, test_f1: 0.5518
 epoch: 80, train_loss: 0.4776, test_loss: 1.4499, test_f1: 0.6120
 epoch: 81, train_loss: 0.4661, test_loss: 1.3440, test_f1: 0.6406
 epoch: 82, train_loss: 0.4620, test_loss: 1.4582, test_f1: 0.5980
 epoch: 83, train_loss: 0.4428, test_loss: 1.4338, test_f1: 0.6062
 epoch: 84, train_loss: 0.4305, test_loss: 1.5687, test_f1: 0.6208
 epoch: 85, train_loss: 0.4340, test_loss: 1.5731, test_f1: 0.6308
 epoch: 86, train_loss: 0.4153, test_loss: 1.6594, test_f1: 0.5960
 epoch: 87, train_loss: 0.4317, test_loss: 1.8968, test_f1: 0.6147
 epoch: 88, train_loss: 0.4546, test_loss: 1.7798, test_f1: 0.6038
 epoch: 89, train_loss: 0.4678, test_loss: 1.8103, test_f1: 0.5142
 epoch: 90, train_loss: 0.5034, test_loss: 1.6203, test_f1: 0.5764
 epoch: 91, train_loss: 0.4673, test_loss: 1.8595, test_f1: 0.5834
 epoch: 92, train_loss: 0.4867, test_loss: 1.8625, test_f1: 0.5720
 epoch: 93, train_loss: 0.4668, test_loss: 1.6252, test_f1: 0.5537
 epoch: 94, train_loss: 0.4567, test_loss: 1.1717, test_f1: 0.5358
 epoch: 95, train_loss: 0.4534, test_loss: 2.4084, test_f1: 0.5275
 epoch: 96, train_loss: 0.4760, test_loss: 1.3913, test_f1: 0.6107
 epoch: 97, train_loss: 0.4528, test_loss: 1.3278, test_f1: 0.6026
 epoch: 98, train_loss: 0.4513, test_loss: 1.5378, test_f1: 0.6020
 epoch: 99, train_loss: 0.4219, test_loss: 1.7063, test_f1: 0.6109
##################ITERATION #8 ****************************************
 epoch: 0, train_loss: 1.6079, test_loss: 1.3980, test_f1: 0.1365
 epoch: 1, train_loss: 1.2211, test_loss: 1.5658, test_f1: 0.1365
 epoch: 2, train_loss: 1.1499, test_loss: 1.4555, test_f1: 0.2336
 epoch: 3, train_loss: 1.0673, test_loss: 1.2559, test_f1: 0.3508
 epoch: 4, train_loss: 1.0390, test_loss: 1.1094, test_f1: 0.4302
 epoch: 5, train_loss: 1.0078, test_loss: 1.1572, test_f1: 0.4105
 epoch: 6, train_loss: 1.0175, test_loss: 1.1143, test_f1: 0.3827
 epoch: 7, train_loss: 1.0190, test_loss: 1.1180, test_f1: 0.4131
 epoch: 8, train_loss: 1.0018, test_loss: 1.2415, test_f1: 0.3903
 epoch: 9, train_loss: 0.9988, test_loss: 1.1820, test_f1: 0.3761
 epoch: 10, train_loss: 0.9931, test_loss: 1.0866, test_f1: 0.4166
 epoch: 11, train_loss: 0.9819, test_loss: 1.1088, test_f1: 0.4457
 epoch: 12, train_loss: 0.9622, test_loss: 1.1491, test_f1: 0.4395
 epoch: 13, train_loss: 0.9462, test_loss: 1.0011, test_f1: 0.5316
 epoch: 14, train_loss: 0.9209, test_loss: 1.1239, test_f1: 0.5153
 epoch: 15, train_loss: 0.9333, test_loss: 1.0907, test_f1: 0.5224
 epoch: 16, train_loss: 0.9155, test_loss: 1.0107, test_f1: 0.4795
 epoch: 17, train_loss: 0.9260, test_loss: 1.0400, test_f1: 0.4133
 epoch: 18, train_loss: 0.9272, test_loss: 1.0588, test_f1: 0.4966
 epoch: 19, train_loss: 0.9092, test_loss: 1.1064, test_f1: 0.4678
 epoch: 20, train_loss: 0.9132, test_loss: 1.0492, test_f1: 0.4720
 epoch: 21, train_loss: 0.9177, test_loss: 1.0531, test_f1: 0.5020
 epoch: 22, train_loss: 0.8938, test_loss: 1.0629, test_f1: 0.4891
 epoch: 23, train_loss: 0.8700, test_loss: 1.0531, test_f1: 0.4842
 epoch: 24, train_loss: 0.8685, test_loss: 1.0556, test_f1: 0.5149
 epoch: 25, train_loss: 0.8694, test_loss: 1.0831, test_f1: 0.5126
 epoch: 26, train_loss: 0.8490, test_loss: 0.9852, test_f1: 0.5285
 epoch: 27, train_loss: 0.8619, test_loss: 0.9881, test_f1: 0.5236
 epoch: 28, train_loss: 0.8536, test_loss: 1.1454, test_f1: 0.4727
 epoch: 29, train_loss: 0.8508, test_loss: 1.0228, test_f1: 0.5086
 epoch: 30, train_loss: 0.8103, test_loss: 0.9615, test_f1: 0.5609
 epoch: 31, train_loss: 0.7988, test_loss: 0.9802, test_f1: 0.5251
 epoch: 32, train_loss: 0.7977, test_loss: 1.4435, test_f1: 0.4007
 epoch: 33, train_loss: 0.8204, test_loss: 1.1064, test_f1: 0.5295
 epoch: 34, train_loss: 0.7986, test_loss: 1.0652, test_f1: 0.5230
 epoch: 35, train_loss: 0.7900, test_loss: 1.0751, test_f1: 0.5603
 epoch: 36, train_loss: 0.7797, test_loss: 0.9763, test_f1: 0.5823
 epoch: 37, train_loss: 0.7699, test_loss: 0.9931, test_f1: 0.5710
 epoch: 38, train_loss: 0.7792, test_loss: 1.1222, test_f1: 0.5530
 epoch: 39, train_loss: 0.7449, test_loss: 1.1348, test_f1: 0.5469
 epoch: 40, train_loss: 0.7297, test_loss: 1.1577, test_f1: 0.5380
 epoch: 41, train_loss: 0.7794, test_loss: 1.2387, test_f1: 0.4666
 epoch: 42, train_loss: 0.8147, test_loss: 1.3081, test_f1: 0.5444
 epoch: 43, train_loss: 0.7791, test_loss: 1.0427, test_f1: 0.5788
 epoch: 44, train_loss: 0.7506, test_loss: 1.1123, test_f1: 0.5821
 epoch: 45, train_loss: 0.7354, test_loss: 0.9864, test_f1: 0.5979
 epoch: 46, train_loss: 0.7361, test_loss: 1.1647, test_f1: 0.4700
 epoch: 47, train_loss: 0.7817, test_loss: 1.2676, test_f1: 0.4919
 epoch: 48, train_loss: 0.7703, test_loss: 1.4496, test_f1: 0.4779
 epoch: 49, train_loss: 0.7582, test_loss: 1.3638, test_f1: 0.5019
 epoch: 50, train_loss: 0.7548, test_loss: 1.5039, test_f1: 0.5608
 epoch: 51, train_loss: 0.7282, test_loss: 0.9033, test_f1: 0.6223
 epoch: 52, train_loss: 0.7060, test_loss: 0.9528, test_f1: 0.5917
 epoch: 53, train_loss: 0.6699, test_loss: 1.0014, test_f1: 0.6065
 epoch: 54, train_loss: 0.6759, test_loss: 1.1103, test_f1: 0.6200
 epoch: 55, train_loss: 0.6587, test_loss: 1.0052, test_f1: 0.6267
 epoch: 56, train_loss: 0.6578, test_loss: 1.0084, test_f1: 0.6012
 epoch: 57, train_loss: 0.6448, test_loss: 0.9740, test_f1: 0.6012
 epoch: 58, train_loss: 0.7045, test_loss: 1.1282, test_f1: 0.6255
 epoch: 59, train_loss: 0.6647, test_loss: 1.4898, test_f1: 0.5158
 epoch: 60, train_loss: 0.6460, test_loss: 1.0811, test_f1: 0.5916
 epoch: 61, train_loss: 0.6374, test_loss: 0.9589, test_f1: 0.6453
 epoch: 62, train_loss: 0.6240, test_loss: 1.0779, test_f1: 0.6162
 epoch: 63, train_loss: 0.6207, test_loss: 1.0850, test_f1: 0.5989
 epoch: 64, train_loss: 0.6239, test_loss: 1.0971, test_f1: 0.5899
 epoch: 65, train_loss: 0.6616, test_loss: 1.1770, test_f1: 0.5932
 epoch: 66, train_loss: 0.6583, test_loss: 1.1377, test_f1: 0.5697
 epoch: 67, train_loss: 0.6347, test_loss: 1.0416, test_f1: 0.5484
 epoch: 68, train_loss: 0.6191, test_loss: 0.9996, test_f1: 0.6170
 epoch: 69, train_loss: 0.6153, test_loss: 1.2985, test_f1: 0.5413
 epoch: 70, train_loss: 0.6162, test_loss: 1.0275, test_f1: 0.5918
 epoch: 71, train_loss: 0.6315, test_loss: 1.1508, test_f1: 0.5568
 epoch: 72, train_loss: 0.6433, test_loss: 1.0264, test_f1: 0.5727
 epoch: 73, train_loss: 0.5895, test_loss: 1.1565, test_f1: 0.6001
 epoch: 74, train_loss: 0.5887, test_loss: 1.2699, test_f1: 0.6240
 epoch: 75, train_loss: 0.5974, test_loss: 1.1988, test_f1: 0.6015
 epoch: 76, train_loss: 0.5596, test_loss: 1.1756, test_f1: 0.6115
 epoch: 77, train_loss: 0.5582, test_loss: 1.2125, test_f1: 0.5808
 epoch: 78, train_loss: 0.5406, test_loss: 1.0982, test_f1: 0.5695
 epoch: 79, train_loss: 0.5661, test_loss: 1.1932, test_f1: 0.6139
 epoch: 80, train_loss: 0.5758, test_loss: 1.0491, test_f1: 0.5933
 epoch: 81, train_loss: 0.5796, test_loss: 1.1794, test_f1: 0.5689
 epoch: 82, train_loss: 0.5521, test_loss: 1.1067, test_f1: 0.6179
 epoch: 83, train_loss: 0.5455, test_loss: 1.1432, test_f1: 0.6177
 epoch: 84, train_loss: 0.5225, test_loss: 1.1737, test_f1: 0.6467
 epoch: 85, train_loss: 0.5214, test_loss: 1.1078, test_f1: 0.6394
 epoch: 86, train_loss: 0.5205, test_loss: 1.3909, test_f1: 0.6068
 epoch: 87, train_loss: 0.5018, test_loss: 1.2876, test_f1: 0.6045
 epoch: 88, train_loss: 0.5091, test_loss: 1.5194, test_f1: 0.5535
 epoch: 89, train_loss: 0.4857, test_loss: 1.4187, test_f1: 0.6453
 epoch: 90, train_loss: 0.4947, test_loss: 1.4242, test_f1: 0.6377
 epoch: 91, train_loss: 0.4913, test_loss: 1.2498, test_f1: 0.6260
 epoch: 92, train_loss: 0.4813, test_loss: 1.2023, test_f1: 0.6064
 epoch: 93, train_loss: 0.4819, test_loss: 1.1394, test_f1: 0.5699
 epoch: 94, train_loss: 0.5039, test_loss: 1.4306, test_f1: 0.5723
 epoch: 95, train_loss: 0.5330, test_loss: 1.3697, test_f1: 0.5829
 epoch: 96, train_loss: 0.5110, test_loss: 1.1766, test_f1: 0.5779
 epoch: 97, train_loss: 0.5112, test_loss: 1.3401, test_f1: 0.5894
 epoch: 98, train_loss: 0.5438, test_loss: 1.2509, test_f1: 0.6205
 epoch: 99, train_loss: 0.5050, test_loss: 1.5136, test_f1: 0.6086
##################ITERATION #9 ****************************************
 epoch: 0, train_loss: 1.4877, test_loss: 1.4208, test_f1: 0.2721
 epoch: 1, train_loss: 1.2447, test_loss: 1.3279, test_f1: 0.2281
 epoch: 2, train_loss: 1.1567, test_loss: 1.2992, test_f1: 0.2713
 epoch: 3, train_loss: 1.0763, test_loss: 1.1528, test_f1: 0.3400
 epoch: 4, train_loss: 1.0170, test_loss: 1.1199, test_f1: 0.4365
 epoch: 5, train_loss: 1.0375, test_loss: 1.4854, test_f1: 0.2672
 epoch: 6, train_loss: 1.0252, test_loss: 1.2121, test_f1: 0.4163
 epoch: 7, train_loss: 0.9849, test_loss: 1.2046, test_f1: 0.4368
 epoch: 8, train_loss: 0.9968, test_loss: 1.1108, test_f1: 0.4520
 epoch: 9, train_loss: 0.9849, test_loss: 1.2595, test_f1: 0.3732
 epoch: 10, train_loss: 0.9600, test_loss: 1.3884, test_f1: 0.3543
 epoch: 11, train_loss: 0.9778, test_loss: 1.1587, test_f1: 0.3947
 epoch: 12, train_loss: 0.9747, test_loss: 1.2099, test_f1: 0.4584
 epoch: 13, train_loss: 0.9734, test_loss: 1.2237, test_f1: 0.3883
 epoch: 14, train_loss: 0.9555, test_loss: 1.0307, test_f1: 0.4902
 epoch: 15, train_loss: 0.9464, test_loss: 1.0790, test_f1: 0.4618
 epoch: 16, train_loss: 0.9761, test_loss: 1.0724, test_f1: 0.3377
 epoch: 17, train_loss: 0.9835, test_loss: 1.2431, test_f1: 0.2867
 epoch: 18, train_loss: 0.9523, test_loss: 1.0857, test_f1: 0.3945
 epoch: 19, train_loss: 0.9419, test_loss: 1.1499, test_f1: 0.4391
 epoch: 20, train_loss: 0.9158, test_loss: 1.1786, test_f1: 0.4398
 epoch: 21, train_loss: 0.9205, test_loss: 1.0906, test_f1: 0.4360
 epoch: 22, train_loss: 0.9304, test_loss: 1.1080, test_f1: 0.4419
 epoch: 23, train_loss: 0.9142, test_loss: 1.0830, test_f1: 0.4723
 epoch: 24, train_loss: 0.9267, test_loss: 1.0328, test_f1: 0.4705
 epoch: 25, train_loss: 0.9193, test_loss: 1.0981, test_f1: 0.4730
 epoch: 26, train_loss: 0.9020, test_loss: 1.0754, test_f1: 0.3911
 epoch: 27, train_loss: 0.9069, test_loss: 1.0501, test_f1: 0.4506
 epoch: 28, train_loss: 0.8848, test_loss: 1.1881, test_f1: 0.4289
 epoch: 29, train_loss: 0.8970, test_loss: 1.1623, test_f1: 0.4171
 epoch: 30, train_loss: 0.8852, test_loss: 1.1311, test_f1: 0.4271
 epoch: 31, train_loss: 0.8838, test_loss: 1.2484, test_f1: 0.4175
 epoch: 32, train_loss: 0.9083, test_loss: 1.2816, test_f1: 0.4055
 epoch: 33, train_loss: 0.9012, test_loss: 1.0732, test_f1: 0.3540
 epoch: 34, train_loss: 0.9341, test_loss: 1.2653, test_f1: 0.3865
 epoch: 35, train_loss: 0.9424, test_loss: 1.1383, test_f1: 0.4334
 epoch: 36, train_loss: 0.8979, test_loss: 1.1439, test_f1: 0.4279
 epoch: 37, train_loss: 0.8924, test_loss: 1.0361, test_f1: 0.4735
 epoch: 38, train_loss: 0.8819, test_loss: 1.0362, test_f1: 0.3524
 epoch: 39, train_loss: 0.8910, test_loss: 1.0152, test_f1: 0.4379
 epoch: 40, train_loss: 0.8829, test_loss: 1.0976, test_f1: 0.4468
 epoch: 41, train_loss: 0.8590, test_loss: 1.0859, test_f1: 0.4031
 epoch: 42, train_loss: 0.8694, test_loss: 1.0857, test_f1: 0.4823
 epoch: 43, train_loss: 0.8696, test_loss: 1.1391, test_f1: 0.4839
 epoch: 44, train_loss: 0.8441, test_loss: 1.8443, test_f1: 0.3084
 epoch: 45, train_loss: 0.8386, test_loss: 1.0760, test_f1: 0.4650
 epoch: 46, train_loss: 0.8576, test_loss: 1.0114, test_f1: 0.4670
 epoch: 47, train_loss: 0.8570, test_loss: 1.1597, test_f1: 0.4342
 epoch: 48, train_loss: 0.8481, test_loss: 1.1931, test_f1: 0.4295
 epoch: 49, train_loss: 0.8792, test_loss: 1.0855, test_f1: 0.4115
 epoch: 50, train_loss: 0.8632, test_loss: 0.9853, test_f1: 0.5477
 epoch: 51, train_loss: 0.8492, test_loss: 0.9731, test_f1: 0.5434
 epoch: 52, train_loss: 0.8247, test_loss: 1.0000, test_f1: 0.5768
 epoch: 53, train_loss: 0.7981, test_loss: 1.0264, test_f1: 0.5685
 epoch: 54, train_loss: 0.7888, test_loss: 1.1999, test_f1: 0.5263
 epoch: 55, train_loss: 0.7801, test_loss: 1.2782, test_f1: 0.5252
 epoch: 56, train_loss: 0.7751, test_loss: 1.0748, test_f1: 0.5514
 epoch: 57, train_loss: 0.7570, test_loss: 1.1567, test_f1: 0.5326
 epoch: 58, train_loss: 0.7473, test_loss: 1.3280, test_f1: 0.5191
 epoch: 59, train_loss: 0.7484, test_loss: 1.1590, test_f1: 0.5234
 epoch: 60, train_loss: 0.7609, test_loss: 1.0580, test_f1: 0.6099
 epoch: 61, train_loss: 0.7359, test_loss: 1.0188, test_f1: 0.6043
 epoch: 62, train_loss: 0.7504, test_loss: 1.1679, test_f1: 0.5333
 epoch: 63, train_loss: 0.7458, test_loss: 1.0521, test_f1: 0.5603
 epoch: 64, train_loss: 0.7448, test_loss: 1.1421, test_f1: 0.5516
 epoch: 65, train_loss: 0.7250, test_loss: 1.0977, test_f1: 0.5623
 epoch: 66, train_loss: 0.7140, test_loss: 1.3988, test_f1: 0.5588
 epoch: 67, train_loss: 0.7050, test_loss: 1.2226, test_f1: 0.5759
 epoch: 68, train_loss: 0.6943, test_loss: 1.1963, test_f1: 0.5890
 epoch: 69, train_loss: 0.6856, test_loss: 1.1414, test_f1: 0.5627
 epoch: 70, train_loss: 0.6618, test_loss: 1.2808, test_f1: 0.5207
 epoch: 71, train_loss: 0.6728, test_loss: 1.2439, test_f1: 0.5832
 epoch: 72, train_loss: 0.6634, test_loss: 1.5125, test_f1: 0.5685
 epoch: 73, train_loss: 0.6934, test_loss: 1.2352, test_f1: 0.5363
 epoch: 74, train_loss: 0.6825, test_loss: 1.4699, test_f1: 0.5142
 epoch: 75, train_loss: 0.6668, test_loss: 1.1933, test_f1: 0.5636
 epoch: 76, train_loss: 0.6974, test_loss: 1.2688, test_f1: 0.5194
 epoch: 77, train_loss: 0.6992, test_loss: 1.2186, test_f1: 0.5058
 epoch: 78, train_loss: 0.6845, test_loss: 1.3821, test_f1: 0.4595
 epoch: 79, train_loss: 0.6326, test_loss: 0.9794, test_f1: 0.6319
 epoch: 80, train_loss: 0.6020, test_loss: 1.3068, test_f1: 0.5542
 epoch: 81, train_loss: 0.6284, test_loss: 1.3373, test_f1: 0.4928
 epoch: 82, train_loss: 0.6518, test_loss: 1.0665, test_f1: 0.5691
 epoch: 83, train_loss: 0.6306, test_loss: 1.4117, test_f1: 0.4028
 epoch: 84, train_loss: 0.6227, test_loss: 1.0959, test_f1: 0.5152
 epoch: 85, train_loss: 0.5954, test_loss: 1.2788, test_f1: 0.5493
 epoch: 86, train_loss: 0.5886, test_loss: 1.3216, test_f1: 0.6333
 epoch: 87, train_loss: 0.5568, test_loss: 1.3481, test_f1: 0.5540
 epoch: 88, train_loss: 0.5597, test_loss: 1.3731, test_f1: 0.6125
 epoch: 89, train_loss: 0.5457, test_loss: 1.3657, test_f1: 0.5869
 epoch: 90, train_loss: 0.5272, test_loss: 1.5888, test_f1: 0.5503
 epoch: 91, train_loss: 0.6651, test_loss: 1.0917, test_f1: 0.5567
 epoch: 92, train_loss: 0.6006, test_loss: 1.3289, test_f1: 0.5819
 epoch: 93, train_loss: 0.5629, test_loss: 1.7358, test_f1: 0.5313
 epoch: 94, train_loss: 0.5415, test_loss: 1.7419, test_f1: 0.5004
 epoch: 95, train_loss: 0.5509, test_loss: 1.1476, test_f1: 0.5782
 epoch: 96, train_loss: 0.5495, test_loss: 1.1438, test_f1: 0.6037
 epoch: 97, train_loss: 0.5502, test_loss: 1.9595, test_f1: 0.4756
 epoch: 98, train_loss: 0.5129, test_loss: 1.5308, test_f1: 0.5142
 epoch: 99, train_loss: 0.5150, test_loss: 1.4032, test_f1: 0.5881

Training completed in 443.70 seconds
Best F1: 0.6660 at epoch 53
Mean F1 across iterations: 0.6434  0.0096
========================FINAL RESULTS================================
FEGIN weighted F1: 0.6660  0.0096
python main.py --data ltspice_demos --representation component_pin_net --model FEGIN --layers 5 --hiddens 128 --batch_size 256 --lr 0.01 --emb_size 512 --epochs 100 --save_appendix component_pin_net_L5_H128_BS256_LR0.01_E512 --no_val
-----



STDERR:
Processing...
Done!
  File "main.py", line 370, in <module>
    main()
  File "main.py", line 254, in main
    dataset = dataset_class(
  File "/home/philip/projects/ltspice_examples_code_repo/Circuit-Completion-Using-GNNs/component_classification_with_link_prediction_head/evaluation/FEGIN/kernel/circuit_datasets.py", line 15, in __init__
    self.data, self.slices = torch.load(self.processed_paths[0])
  File "/home/philip/.local/lib/python3.8/site-packages/torch/serialization.py", line 1040, in load
    warnings.warn(
  File "/usr/lib/python3.8/warnings.py", line 109, in _showwarnmsg
    sw(msg.message, msg.category, msg.filename, msg.lineno,
  File "main.py", line 47, in warn_with_traceback
    traceback.print_stack(file=log)
/home/philip/projects/ltspice_examples_code_repo/Circuit-Completion-Using-GNNs/component_classification_with_link_prediction_head/evaluation/FEGIN/kernel/circuit_datasets.py:15: FutureWarning: You are using `torch.load` with `weights_only=False` (the current default value), which uses the default pickle module implicitly. It is possible to construct malicious pickle data which will execute arbitrary code during unpickling (See https://github.com/pytorch/pytorch/blob/main/SECURITY.md#untrusted-models for more details). In a future release, the default value for `weights_only` will be flipped to `True`. This limits the functions that could be executed during unpickling. Arbitrary objects will no longer be allowed to be loaded via this mode unless they are explicitly allowlisted by the user via `torch.serialization.add_safe_globals`. We recommend you start setting `weights_only=True` for any use case where you don't have full control of the loaded file. Please open an issue on GitHub for any issues related to this experimental feature.
  self.data, self.slices = torch.load(self.processed_paths[0])
