STDOUT:
Results will be saved in /home/philip/projects/ltspice_examples_code_repo/Circuit-Completion-Using-GNNs/component_classification_with_link_prediction_head/evaluation/FEGIN/results/model_FEGIN_dataset_ltspice_examples
Command line input: python main.py --data ltspice_examples --representation component_pin_net --model FEGIN --layers 4 --hiddens 64 --batch_size 64 --lr 0.001 --emb_size 128 --epochs 100 --save_appendix component_pin_net_L4_H64_BS64_LR0.001_E128 --no_val
 is saved.
-----
ltspice_examples - FEGIN
Using 4 layers, 64 hidden units, h = 2
Loading component_pin_net representation dataset
ENTERED
Training FEGIN on component_pin_net representation
Train: 3558, Test: 846
##################ITERATION #0 ****************************************
 epoch: 0, train_loss: 1.1858, test_loss: 1.0659, test_f1: 0.3630
 epoch: 1, train_loss: 1.0044, test_loss: 1.0446, test_f1: 0.4577
 epoch: 2, train_loss: 0.9716, test_loss: 0.9206, test_f1: 0.4962
 epoch: 3, train_loss: 0.9465, test_loss: 0.9033, test_f1: 0.5216
 epoch: 4, train_loss: 0.9222, test_loss: 0.9113, test_f1: 0.4983
 epoch: 5, train_loss: 0.9071, test_loss: 0.8854, test_f1: 0.5319
 epoch: 6, train_loss: 0.8767, test_loss: 0.8807, test_f1: 0.5797
 epoch: 7, train_loss: 0.8757, test_loss: 0.8364, test_f1: 0.5444
 epoch: 8, train_loss: 0.8475, test_loss: 0.8452, test_f1: 0.5254
 epoch: 9, train_loss: 0.8457, test_loss: 0.8202, test_f1: 0.5521
 epoch: 10, train_loss: 0.8212, test_loss: 0.8645, test_f1: 0.5715
 epoch: 11, train_loss: 0.8123, test_loss: 0.8714, test_f1: 0.5293
 epoch: 12, train_loss: 0.7951, test_loss: 0.8292, test_f1: 0.5722
 epoch: 13, train_loss: 0.7869, test_loss: 0.9375, test_f1: 0.5312
 epoch: 14, train_loss: 0.7606, test_loss: 0.8673, test_f1: 0.5607
 epoch: 15, train_loss: 0.7642, test_loss: 0.9044, test_f1: 0.5749
 epoch: 16, train_loss: 0.7527, test_loss: 0.8476, test_f1: 0.5787
 epoch: 17, train_loss: 0.7213, test_loss: 0.8657, test_f1: 0.5929
 epoch: 18, train_loss: 0.7048, test_loss: 0.8578, test_f1: 0.6133
 epoch: 19, train_loss: 0.7006, test_loss: 0.9151, test_f1: 0.5530
 epoch: 20, train_loss: 0.6935, test_loss: 0.8261, test_f1: 0.5674
 epoch: 21, train_loss: 0.6748, test_loss: 0.9138, test_f1: 0.5762
 epoch: 22, train_loss: 0.6678, test_loss: 0.7779, test_f1: 0.6075
 epoch: 23, train_loss: 0.6649, test_loss: 0.8999, test_f1: 0.6190
 epoch: 24, train_loss: 0.6414, test_loss: 0.8455, test_f1: 0.6103
 epoch: 25, train_loss: 0.6284, test_loss: 0.7273, test_f1: 0.6624
 epoch: 26, train_loss: 0.6175, test_loss: 0.7691, test_f1: 0.6609
 epoch: 27, train_loss: 0.6058, test_loss: 0.7350, test_f1: 0.6299
 epoch: 28, train_loss: 0.5863, test_loss: 0.7976, test_f1: 0.6359
 epoch: 29, train_loss: 0.5984, test_loss: 0.7528, test_f1: 0.6521
 epoch: 30, train_loss: 0.5913, test_loss: 0.8379, test_f1: 0.6605
 epoch: 31, train_loss: 0.5599, test_loss: 0.7294, test_f1: 0.6729
 epoch: 32, train_loss: 0.5689, test_loss: 0.7975, test_f1: 0.6503
 epoch: 33, train_loss: 0.5687, test_loss: 0.7979, test_f1: 0.6366
 epoch: 34, train_loss: 0.5449, test_loss: 0.7244, test_f1: 0.6560
 epoch: 35, train_loss: 0.5396, test_loss: 0.7456, test_f1: 0.6778
 epoch: 36, train_loss: 0.5270, test_loss: 0.7899, test_f1: 0.6582
 epoch: 37, train_loss: 0.5410, test_loss: 0.9429, test_f1: 0.6343
 epoch: 38, train_loss: 0.5017, test_loss: 0.7256, test_f1: 0.6879
 epoch: 39, train_loss: 0.5155, test_loss: 0.9646, test_f1: 0.6232
 epoch: 40, train_loss: 0.5310, test_loss: 0.7276, test_f1: 0.6890
 epoch: 41, train_loss: 0.4963, test_loss: 0.8260, test_f1: 0.6454
 epoch: 42, train_loss: 0.5083, test_loss: 0.7512, test_f1: 0.7224
 epoch: 43, train_loss: 0.4762, test_loss: 0.7919, test_f1: 0.6588
 epoch: 44, train_loss: 0.4747, test_loss: 0.7736, test_f1: 0.6886
 epoch: 45, train_loss: 0.4895, test_loss: 0.9433, test_f1: 0.6453
 epoch: 46, train_loss: 0.4584, test_loss: 0.8214, test_f1: 0.6812
 epoch: 47, train_loss: 0.4590, test_loss: 0.7180, test_f1: 0.6907
 epoch: 48, train_loss: 0.4515, test_loss: 0.7569, test_f1: 0.6915
 epoch: 49, train_loss: 0.4405, test_loss: 0.8392, test_f1: 0.6590
 epoch: 50, train_loss: 0.4333, test_loss: 0.8832, test_f1: 0.6865
 epoch: 51, train_loss: 0.4079, test_loss: 0.8433, test_f1: 0.6867
 epoch: 52, train_loss: 0.3813, test_loss: 0.9056, test_f1: 0.6861
 epoch: 53, train_loss: 0.3781, test_loss: 0.8504, test_f1: 0.6980
 epoch: 54, train_loss: 0.3742, test_loss: 0.8337, test_f1: 0.7061
 epoch: 55, train_loss: 0.3691, test_loss: 0.9470, test_f1: 0.6792
 epoch: 56, train_loss: 0.3557, test_loss: 0.9768, test_f1: 0.6865
 epoch: 57, train_loss: 0.3464, test_loss: 0.9867, test_f1: 0.6895
 epoch: 58, train_loss: 0.3711, test_loss: 0.9804, test_f1: 0.6908
 epoch: 59, train_loss: 0.3446, test_loss: 0.9922, test_f1: 0.7140
 epoch: 60, train_loss: 0.3405, test_loss: 0.9945, test_f1: 0.6738
 epoch: 61, train_loss: 0.3396, test_loss: 1.0730, test_f1: 0.6872
 epoch: 62, train_loss: 0.3288, test_loss: 1.0721, test_f1: 0.6770
 epoch: 63, train_loss: 0.3149, test_loss: 1.0590, test_f1: 0.6988
 epoch: 64, train_loss: 0.3176, test_loss: 1.0655, test_f1: 0.7009
 epoch: 65, train_loss: 0.3364, test_loss: 1.0741, test_f1: 0.6790
 epoch: 66, train_loss: 0.3205, test_loss: 1.0488, test_f1: 0.6839
 epoch: 67, train_loss: 0.3241, test_loss: 1.1640, test_f1: 0.6862
 epoch: 68, train_loss: 0.3293, test_loss: 1.0384, test_f1: 0.6913
 epoch: 69, train_loss: 0.3135, test_loss: 1.0739, test_f1: 0.7118
 epoch: 70, train_loss: 0.3042, test_loss: 1.1353, test_f1: 0.7036
 epoch: 71, train_loss: 0.2967, test_loss: 1.0982, test_f1: 0.6948
 epoch: 72, train_loss: 0.2854, test_loss: 1.1258, test_f1: 0.6939
 epoch: 73, train_loss: 0.2827, test_loss: 1.1826, test_f1: 0.6792
 epoch: 74, train_loss: 0.3160, test_loss: 1.1530, test_f1: 0.6957
 epoch: 75, train_loss: 0.2977, test_loss: 1.1026, test_f1: 0.6886
 epoch: 76, train_loss: 0.2875, test_loss: 1.2173, test_f1: 0.7089
 epoch: 77, train_loss: 0.2875, test_loss: 1.3801, test_f1: 0.6671
 epoch: 78, train_loss: 0.2943, test_loss: 1.0576, test_f1: 0.7062
 epoch: 79, train_loss: 0.2564, test_loss: 1.1808, test_f1: 0.7033
 epoch: 80, train_loss: 0.2736, test_loss: 1.2002, test_f1: 0.6932
 epoch: 81, train_loss: 0.2740, test_loss: 1.2258, test_f1: 0.6724
 epoch: 82, train_loss: 0.2754, test_loss: 1.3255, test_f1: 0.6910
 epoch: 83, train_loss: 0.2672, test_loss: 1.2233, test_f1: 0.6837
 epoch: 84, train_loss: 0.2616, test_loss: 1.2881, test_f1: 0.7069
 epoch: 85, train_loss: 0.2663, test_loss: 1.2303, test_f1: 0.6932
 epoch: 86, train_loss: 0.2864, test_loss: 1.1594, test_f1: 0.7107
 epoch: 87, train_loss: 0.2696, test_loss: 1.3329, test_f1: 0.6753
 epoch: 88, train_loss: 0.2555, test_loss: 1.3815, test_f1: 0.6685
 epoch: 89, train_loss: 0.2454, test_loss: 1.2857, test_f1: 0.6950
 epoch: 90, train_loss: 0.2536, test_loss: 1.3525, test_f1: 0.6813
 epoch: 91, train_loss: 0.2529, test_loss: 1.3421, test_f1: 0.7139
 epoch: 92, train_loss: 0.2394, test_loss: 1.4461, test_f1: 0.6980
 epoch: 93, train_loss: 0.2434, test_loss: 1.2987, test_f1: 0.7156
 epoch: 94, train_loss: 0.2481, test_loss: 1.3383, test_f1: 0.6995
 epoch: 95, train_loss: 0.2364, test_loss: 1.3128, test_f1: 0.7013
 epoch: 96, train_loss: 0.2453, test_loss: 1.2701, test_f1: 0.7062
 epoch: 97, train_loss: 0.2458, test_loss: 1.2781, test_f1: 0.6878
 epoch: 98, train_loss: 0.2253, test_loss: 1.4544, test_f1: 0.6850
 epoch: 99, train_loss: 0.2199, test_loss: 1.4826, test_f1: 0.6780
##################ITERATION #1 ****************************************
 epoch: 0, train_loss: 1.0751, test_loss: 1.1133, test_f1: 0.3549
 epoch: 1, train_loss: 0.9628, test_loss: 0.9060, test_f1: 0.5207
 epoch: 2, train_loss: 0.9236, test_loss: 0.8985, test_f1: 0.5154
 epoch: 3, train_loss: 0.8992, test_loss: 0.8521, test_f1: 0.5302
 epoch: 4, train_loss: 0.8723, test_loss: 0.8182, test_f1: 0.6106
 epoch: 5, train_loss: 0.8488, test_loss: 0.8456, test_f1: 0.5601
 epoch: 6, train_loss: 0.8326, test_loss: 0.8069, test_f1: 0.5534
 epoch: 7, train_loss: 0.8176, test_loss: 0.7872, test_f1: 0.6269
 epoch: 8, train_loss: 0.8005, test_loss: 0.8209, test_f1: 0.5709
 epoch: 9, train_loss: 0.7901, test_loss: 0.7603, test_f1: 0.5941
 epoch: 10, train_loss: 0.7683, test_loss: 0.7166, test_f1: 0.6210
 epoch: 11, train_loss: 0.7399, test_loss: 0.7427, test_f1: 0.6130
 epoch: 12, train_loss: 0.7388, test_loss: 0.7490, test_f1: 0.6302
 epoch: 13, train_loss: 0.7155, test_loss: 0.7575, test_f1: 0.6275
 epoch: 14, train_loss: 0.7150, test_loss: 0.7093, test_f1: 0.6488
 epoch: 15, train_loss: 0.7097, test_loss: 0.6913, test_f1: 0.6449
 epoch: 16, train_loss: 0.7053, test_loss: 0.7191, test_f1: 0.6194
 epoch: 17, train_loss: 0.6675, test_loss: 0.7228, test_f1: 0.6562
 epoch: 18, train_loss: 0.6659, test_loss: 0.7628, test_f1: 0.6586
 epoch: 19, train_loss: 0.6441, test_loss: 0.7331, test_f1: 0.6647
 epoch: 20, train_loss: 0.6457, test_loss: 0.6818, test_f1: 0.6732
 epoch: 21, train_loss: 0.6375, test_loss: 0.6797, test_f1: 0.6555
 epoch: 22, train_loss: 0.6228, test_loss: 0.7773, test_f1: 0.6495
 epoch: 23, train_loss: 0.6284, test_loss: 0.7081, test_f1: 0.6579
 epoch: 24, train_loss: 0.6193, test_loss: 0.7007, test_f1: 0.6549
 epoch: 25, train_loss: 0.5960, test_loss: 0.6968, test_f1: 0.6822
 epoch: 26, train_loss: 0.5978, test_loss: 0.7363, test_f1: 0.6730
 epoch: 27, train_loss: 0.5713, test_loss: 0.7724, test_f1: 0.6474
 epoch: 28, train_loss: 0.5646, test_loss: 0.7624, test_f1: 0.6709
 epoch: 29, train_loss: 0.5856, test_loss: 0.7267, test_f1: 0.6950
 epoch: 30, train_loss: 0.5633, test_loss: 0.7331, test_f1: 0.6681
 epoch: 31, train_loss: 0.5433, test_loss: 0.7970, test_f1: 0.6554
 epoch: 32, train_loss: 0.5346, test_loss: 0.8277, test_f1: 0.6842
 epoch: 33, train_loss: 0.5283, test_loss: 0.7651, test_f1: 0.6740
 epoch: 34, train_loss: 0.5379, test_loss: 0.8906, test_f1: 0.6632
 epoch: 35, train_loss: 0.5204, test_loss: 0.8292, test_f1: 0.6648
 epoch: 36, train_loss: 0.5042, test_loss: 0.9382, test_f1: 0.6383
 epoch: 37, train_loss: 0.5262, test_loss: 0.9675, test_f1: 0.6585
 epoch: 38, train_loss: 0.5084, test_loss: 0.9141, test_f1: 0.6658
 epoch: 39, train_loss: 0.4975, test_loss: 0.9155, test_f1: 0.6598
 epoch: 40, train_loss: 0.4879, test_loss: 0.9551, test_f1: 0.6582
 epoch: 41, train_loss: 0.4782, test_loss: 0.9371, test_f1: 0.6647
 epoch: 42, train_loss: 0.4791, test_loss: 0.9078, test_f1: 0.6580
 epoch: 43, train_loss: 0.4798, test_loss: 1.0398, test_f1: 0.6421
 epoch: 44, train_loss: 0.4593, test_loss: 0.9678, test_f1: 0.6722
 epoch: 45, train_loss: 0.4640, test_loss: 0.9439, test_f1: 0.6928
 epoch: 46, train_loss: 0.4740, test_loss: 1.1055, test_f1: 0.6308
 epoch: 47, train_loss: 0.4506, test_loss: 1.0321, test_f1: 0.6693
 epoch: 48, train_loss: 0.4364, test_loss: 0.9407, test_f1: 0.6808
 epoch: 49, train_loss: 0.4225, test_loss: 1.0876, test_f1: 0.6619
 epoch: 50, train_loss: 0.4290, test_loss: 1.0721, test_f1: 0.6914
 epoch: 51, train_loss: 0.3969, test_loss: 1.0107, test_f1: 0.6822
 epoch: 52, train_loss: 0.3709, test_loss: 1.0728, test_f1: 0.6668
 epoch: 53, train_loss: 0.3615, test_loss: 1.0782, test_f1: 0.6799
 epoch: 54, train_loss: 0.3666, test_loss: 1.1360, test_f1: 0.6645
 epoch: 55, train_loss: 0.3633, test_loss: 1.0553, test_f1: 0.7021
 epoch: 56, train_loss: 0.3326, test_loss: 1.1280, test_f1: 0.6617
 epoch: 57, train_loss: 0.3302, test_loss: 1.2204, test_f1: 0.6655
 epoch: 58, train_loss: 0.3506, test_loss: 1.3508, test_f1: 0.6453
 epoch: 59, train_loss: 0.3391, test_loss: 1.0890, test_f1: 0.6913
 epoch: 60, train_loss: 0.3458, test_loss: 1.2028, test_f1: 0.6594
 epoch: 61, train_loss: 0.3433, test_loss: 1.1417, test_f1: 0.6799
 epoch: 62, train_loss: 0.3308, test_loss: 1.1717, test_f1: 0.6871
 epoch: 63, train_loss: 0.3133, test_loss: 1.3785, test_f1: 0.6683
 epoch: 64, train_loss: 0.3128, test_loss: 1.1931, test_f1: 0.6613
 epoch: 65, train_loss: 0.3288, test_loss: 1.2120, test_f1: 0.6641
 epoch: 66, train_loss: 0.3183, test_loss: 1.2280, test_f1: 0.6757
 epoch: 67, train_loss: 0.3166, test_loss: 1.2547, test_f1: 0.6725
 epoch: 68, train_loss: 0.3163, test_loss: 1.2920, test_f1: 0.6641
 epoch: 69, train_loss: 0.2963, test_loss: 1.3559, test_f1: 0.6620
 epoch: 70, train_loss: 0.2971, test_loss: 1.2862, test_f1: 0.6791
 epoch: 71, train_loss: 0.3089, test_loss: 1.4316, test_f1: 0.6765
 epoch: 72, train_loss: 0.3171, test_loss: 1.2631, test_f1: 0.6778
 epoch: 73, train_loss: 0.3009, test_loss: 1.3950, test_f1: 0.6738
 epoch: 74, train_loss: 0.3048, test_loss: 1.3558, test_f1: 0.6702
 epoch: 75, train_loss: 0.2885, test_loss: 1.3826, test_f1: 0.6596
 epoch: 76, train_loss: 0.2869, test_loss: 1.4796, test_f1: 0.6783
 epoch: 77, train_loss: 0.2782, test_loss: 1.5056, test_f1: 0.6699
 epoch: 78, train_loss: 0.2860, test_loss: 1.4565, test_f1: 0.6786
 epoch: 79, train_loss: 0.2746, test_loss: 1.4194, test_f1: 0.6700
 epoch: 80, train_loss: 0.2683, test_loss: 1.4984, test_f1: 0.6690
 epoch: 81, train_loss: 0.2770, test_loss: 1.5929, test_f1: 0.6599
 epoch: 82, train_loss: 0.2776, test_loss: 1.5399, test_f1: 0.6736
 epoch: 83, train_loss: 0.2691, test_loss: 1.5078, test_f1: 0.6593
 epoch: 84, train_loss: 0.2659, test_loss: 1.5442, test_f1: 0.6581
 epoch: 85, train_loss: 0.2777, test_loss: 1.4971, test_f1: 0.6680
 epoch: 86, train_loss: 0.2595, test_loss: 1.5268, test_f1: 0.6608
 epoch: 87, train_loss: 0.2391, test_loss: 1.5700, test_f1: 0.6682
 epoch: 88, train_loss: 0.2568, test_loss: 1.4637, test_f1: 0.6735
 epoch: 89, train_loss: 0.2347, test_loss: 1.5503, test_f1: 0.6711
 epoch: 90, train_loss: 0.2344, test_loss: 1.6226, test_f1: 0.6596
 epoch: 91, train_loss: 0.2494, test_loss: 1.6634, test_f1: 0.6706
 epoch: 92, train_loss: 0.2330, test_loss: 1.6742, test_f1: 0.6622
 epoch: 93, train_loss: 0.2457, test_loss: 1.5509, test_f1: 0.6640
 epoch: 94, train_loss: 0.2290, test_loss: 1.7694, test_f1: 0.6607
 epoch: 95, train_loss: 0.2299, test_loss: 1.7807, test_f1: 0.6624
 epoch: 96, train_loss: 0.2326, test_loss: 1.7929, test_f1: 0.6813
 epoch: 97, train_loss: 0.2422, test_loss: 1.7987, test_f1: 0.6698
 epoch: 98, train_loss: 0.2302, test_loss: 1.7349, test_f1: 0.6640
 epoch: 99, train_loss: 0.2217, test_loss: 1.7896, test_f1: 0.6685
##################ITERATION #2 ****************************************
 epoch: 0, train_loss: 1.1206, test_loss: 1.1658, test_f1: 0.3446
 epoch: 1, train_loss: 0.9690, test_loss: 0.9199, test_f1: 0.5282
 epoch: 2, train_loss: 0.9204, test_loss: 0.9063, test_f1: 0.5162
 epoch: 3, train_loss: 0.9014, test_loss: 0.8661, test_f1: 0.5172
 epoch: 4, train_loss: 0.8871, test_loss: 0.8655, test_f1: 0.5535
 epoch: 5, train_loss: 0.8482, test_loss: 0.8340, test_f1: 0.6078
 epoch: 6, train_loss: 0.8480, test_loss: 0.7974, test_f1: 0.5957
 epoch: 7, train_loss: 0.8066, test_loss: 0.7616, test_f1: 0.6164
 epoch: 8, train_loss: 0.7983, test_loss: 0.7873, test_f1: 0.6243
 epoch: 9, train_loss: 0.7776, test_loss: 0.7589, test_f1: 0.6533
 epoch: 10, train_loss: 0.7786, test_loss: 0.8134, test_f1: 0.5848
 epoch: 11, train_loss: 0.7593, test_loss: 0.7900, test_f1: 0.5869
 epoch: 12, train_loss: 0.7506, test_loss: 0.7345, test_f1: 0.6698
 epoch: 13, train_loss: 0.7411, test_loss: 0.7595, test_f1: 0.6206
 epoch: 14, train_loss: 0.7148, test_loss: 0.7405, test_f1: 0.6155
 epoch: 15, train_loss: 0.7086, test_loss: 0.6980, test_f1: 0.6919
 epoch: 16, train_loss: 0.6967, test_loss: 0.7606, test_f1: 0.6315
 epoch: 17, train_loss: 0.6855, test_loss: 0.7787, test_f1: 0.6184
 epoch: 18, train_loss: 0.6781, test_loss: 0.7626, test_f1: 0.6324
 epoch: 19, train_loss: 0.6501, test_loss: 0.7299, test_f1: 0.6629
 epoch: 20, train_loss: 0.6403, test_loss: 0.7626, test_f1: 0.6631
 epoch: 21, train_loss: 0.6526, test_loss: 0.7165, test_f1: 0.6610
 epoch: 22, train_loss: 0.6264, test_loss: 0.6976, test_f1: 0.6648
 epoch: 23, train_loss: 0.6000, test_loss: 0.7799, test_f1: 0.6523
 epoch: 24, train_loss: 0.6233, test_loss: 0.7962, test_f1: 0.6344
 epoch: 25, train_loss: 0.6037, test_loss: 0.8730, test_f1: 0.6328
 epoch: 26, train_loss: 0.5826, test_loss: 0.7421, test_f1: 0.6480
 epoch: 27, train_loss: 0.5839, test_loss: 0.7010, test_f1: 0.6702
 epoch: 28, train_loss: 0.5787, test_loss: 0.7736, test_f1: 0.6543
 epoch: 29, train_loss: 0.5737, test_loss: 0.8531, test_f1: 0.6645
 epoch: 30, train_loss: 0.5717, test_loss: 0.9157, test_f1: 0.6410
 epoch: 31, train_loss: 0.5423, test_loss: 0.7798, test_f1: 0.6594
 epoch: 32, train_loss: 0.5521, test_loss: 0.7890, test_f1: 0.6605
 epoch: 33, train_loss: 0.5383, test_loss: 0.9358, test_f1: 0.6538
 epoch: 34, train_loss: 0.5456, test_loss: 0.9261, test_f1: 0.6441
 epoch: 35, train_loss: 0.5234, test_loss: 0.7652, test_f1: 0.6850
 epoch: 36, train_loss: 0.4967, test_loss: 0.8618, test_f1: 0.6583
 epoch: 37, train_loss: 0.5010, test_loss: 0.8897, test_f1: 0.6648
 epoch: 38, train_loss: 0.4965, test_loss: 1.0568, test_f1: 0.6373
 epoch: 39, train_loss: 0.4952, test_loss: 0.8752, test_f1: 0.6473
 epoch: 40, train_loss: 0.4707, test_loss: 1.0492, test_f1: 0.6788
 epoch: 41, train_loss: 0.4943, test_loss: 1.0848, test_f1: 0.6388
 epoch: 42, train_loss: 0.4898, test_loss: 0.8509, test_f1: 0.6595
 epoch: 43, train_loss: 0.4690, test_loss: 0.9776, test_f1: 0.6569
 epoch: 44, train_loss: 0.4712, test_loss: 0.9036, test_f1: 0.6630
 epoch: 45, train_loss: 0.4473, test_loss: 0.8496, test_f1: 0.6964
 epoch: 46, train_loss: 0.4449, test_loss: 1.0567, test_f1: 0.6662
 epoch: 47, train_loss: 0.4458, test_loss: 0.9857, test_f1: 0.6703
 epoch: 48, train_loss: 0.4469, test_loss: 1.1066, test_f1: 0.6603
 epoch: 49, train_loss: 0.4403, test_loss: 0.9607, test_f1: 0.6610
 epoch: 50, train_loss: 0.4542, test_loss: 1.1049, test_f1: 0.6718
 epoch: 51, train_loss: 0.3913, test_loss: 1.1463, test_f1: 0.6939
 epoch: 52, train_loss: 0.3795, test_loss: 1.0676, test_f1: 0.6919
 epoch: 53, train_loss: 0.3573, test_loss: 1.1252, test_f1: 0.6978
 epoch: 54, train_loss: 0.3620, test_loss: 1.1214, test_f1: 0.6699
 epoch: 55, train_loss: 0.3477, test_loss: 1.1893, test_f1: 0.6709
 epoch: 56, train_loss: 0.3413, test_loss: 1.1685, test_f1: 0.6630
 epoch: 57, train_loss: 0.3425, test_loss: 1.2038, test_f1: 0.6708
 epoch: 58, train_loss: 0.3232, test_loss: 1.1453, test_f1: 0.6876
 epoch: 59, train_loss: 0.3210, test_loss: 1.2778, test_f1: 0.6747
 epoch: 60, train_loss: 0.3235, test_loss: 1.2686, test_f1: 0.6904
 epoch: 61, train_loss: 0.3239, test_loss: 1.2087, test_f1: 0.6805
 epoch: 62, train_loss: 0.3266, test_loss: 1.1548, test_f1: 0.6858
 epoch: 63, train_loss: 0.3209, test_loss: 1.1369, test_f1: 0.6928
 epoch: 64, train_loss: 0.3102, test_loss: 1.3937, test_f1: 0.6833
 epoch: 65, train_loss: 0.3008, test_loss: 1.4249, test_f1: 0.6807
 epoch: 66, train_loss: 0.3071, test_loss: 1.2818, test_f1: 0.6707
 epoch: 67, train_loss: 0.2893, test_loss: 1.3302, test_f1: 0.6880
 epoch: 68, train_loss: 0.2865, test_loss: 1.3368, test_f1: 0.6839
 epoch: 69, train_loss: 0.2875, test_loss: 1.4544, test_f1: 0.6699
 epoch: 70, train_loss: 0.2968, test_loss: 1.2422, test_f1: 0.6954
 epoch: 71, train_loss: 0.2957, test_loss: 1.3303, test_f1: 0.6763
 epoch: 72, train_loss: 0.2842, test_loss: 1.3462, test_f1: 0.6543
 epoch: 73, train_loss: 0.2791, test_loss: 1.3828, test_f1: 0.6860
 epoch: 74, train_loss: 0.2825, test_loss: 1.2665, test_f1: 0.6892
 epoch: 75, train_loss: 0.2580, test_loss: 1.4119, test_f1: 0.6829
 epoch: 76, train_loss: 0.2657, test_loss: 1.4419, test_f1: 0.6814
 epoch: 77, train_loss: 0.2665, test_loss: 1.6322, test_f1: 0.6755
 epoch: 78, train_loss: 0.2798, test_loss: 1.2545, test_f1: 0.6978
 epoch: 79, train_loss: 0.2723, test_loss: 1.4289, test_f1: 0.6663
 epoch: 80, train_loss: 0.2547, test_loss: 1.5871, test_f1: 0.6512
 epoch: 81, train_loss: 0.2621, test_loss: 1.4751, test_f1: 0.6541
 epoch: 82, train_loss: 0.2519, test_loss: 1.4906, test_f1: 0.6677
 epoch: 83, train_loss: 0.2520, test_loss: 1.4055, test_f1: 0.6901
 epoch: 84, train_loss: 0.2590, test_loss: 1.3872, test_f1: 0.6722
 epoch: 85, train_loss: 0.2516, test_loss: 1.5798, test_f1: 0.6822
 epoch: 86, train_loss: 0.2511, test_loss: 1.5524, test_f1: 0.6698
 epoch: 87, train_loss: 0.2605, test_loss: 1.7080, test_f1: 0.6724
 epoch: 88, train_loss: 0.2421, test_loss: 1.6630, test_f1: 0.6743
 epoch: 89, train_loss: 0.2417, test_loss: 1.5415, test_f1: 0.6737
 epoch: 90, train_loss: 0.2252, test_loss: 1.4520, test_f1: 0.6799
 epoch: 91, train_loss: 0.2282, test_loss: 1.7416, test_f1: 0.6712
 epoch: 92, train_loss: 0.2216, test_loss: 1.5683, test_f1: 0.6711
 epoch: 93, train_loss: 0.2329, test_loss: 1.6375, test_f1: 0.6766
 epoch: 94, train_loss: 0.2309, test_loss: 1.5950, test_f1: 0.6875
 epoch: 95, train_loss: 0.2347, test_loss: 1.5905, test_f1: 0.6763
 epoch: 96, train_loss: 0.2327, test_loss: 1.4904, test_f1: 0.6809
 epoch: 97, train_loss: 0.2233, test_loss: 1.5606, test_f1: 0.6761
 epoch: 98, train_loss: 0.2142, test_loss: 1.6248, test_f1: 0.6722
 epoch: 99, train_loss: 0.2248, test_loss: 1.5323, test_f1: 0.6854
##################ITERATION #3 ****************************************
 epoch: 0, train_loss: 1.1668, test_loss: 1.2400, test_f1: 0.3125
 epoch: 1, train_loss: 0.9806, test_loss: 0.8983, test_f1: 0.5223
 epoch: 2, train_loss: 0.9360, test_loss: 0.8742, test_f1: 0.5422
 epoch: 3, train_loss: 0.9166, test_loss: 0.8600, test_f1: 0.5528
 epoch: 4, train_loss: 0.8878, test_loss: 0.8301, test_f1: 0.6022
 epoch: 5, train_loss: 0.8624, test_loss: 0.8127, test_f1: 0.5671
 epoch: 6, train_loss: 0.8463, test_loss: 0.7948, test_f1: 0.6297
 epoch: 7, train_loss: 0.8216, test_loss: 0.8140, test_f1: 0.6071
 epoch: 8, train_loss: 0.8151, test_loss: 0.8478, test_f1: 0.5477
 epoch: 9, train_loss: 0.8024, test_loss: 0.7783, test_f1: 0.6272
 epoch: 10, train_loss: 0.7726, test_loss: 0.8271, test_f1: 0.6249
 epoch: 11, train_loss: 0.7604, test_loss: 0.7408, test_f1: 0.6509
 epoch: 12, train_loss: 0.7416, test_loss: 0.7521, test_f1: 0.6611
 epoch: 13, train_loss: 0.7340, test_loss: 0.8168, test_f1: 0.6577
 epoch: 14, train_loss: 0.7060, test_loss: 0.8148, test_f1: 0.6576
 epoch: 15, train_loss: 0.7160, test_loss: 0.7712, test_f1: 0.6852
 epoch: 16, train_loss: 0.7024, test_loss: 0.7316, test_f1: 0.6353
 epoch: 17, train_loss: 0.6859, test_loss: 0.7909, test_f1: 0.5863
 epoch: 18, train_loss: 0.6813, test_loss: 0.8635, test_f1: 0.6108
 epoch: 19, train_loss: 0.6674, test_loss: 0.7900, test_f1: 0.6539
 epoch: 20, train_loss: 0.6548, test_loss: 0.7939, test_f1: 0.6652
 epoch: 21, train_loss: 0.6398, test_loss: 0.7762, test_f1: 0.6637
 epoch: 22, train_loss: 0.6409, test_loss: 0.8881, test_f1: 0.6673
 epoch: 23, train_loss: 0.6217, test_loss: 0.9174, test_f1: 0.6530
 epoch: 24, train_loss: 0.6113, test_loss: 0.8031, test_f1: 0.6899
 epoch: 25, train_loss: 0.5971, test_loss: 0.8661, test_f1: 0.6366
 epoch: 26, train_loss: 0.6111, test_loss: 0.8696, test_f1: 0.6761
 epoch: 27, train_loss: 0.6124, test_loss: 0.9039, test_f1: 0.6551
 epoch: 28, train_loss: 0.5950, test_loss: 0.9371, test_f1: 0.6270
 epoch: 29, train_loss: 0.5970, test_loss: 0.8084, test_f1: 0.6532
 epoch: 30, train_loss: 0.5645, test_loss: 1.0096, test_f1: 0.6413
 epoch: 31, train_loss: 0.5581, test_loss: 0.9271, test_f1: 0.6424
 epoch: 32, train_loss: 0.5853, test_loss: 0.8841, test_f1: 0.6769
 epoch: 33, train_loss: 0.5567, test_loss: 0.9017, test_f1: 0.6573
 epoch: 34, train_loss: 0.5460, test_loss: 0.9740, test_f1: 0.6662
 epoch: 35, train_loss: 0.5308, test_loss: 0.9251, test_f1: 0.6503
 epoch: 36, train_loss: 0.5383, test_loss: 0.9876, test_f1: 0.6516
 epoch: 37, train_loss: 0.5443, test_loss: 0.9343, test_f1: 0.6389
 epoch: 38, train_loss: 0.5218, test_loss: 0.9679, test_f1: 0.6732
 epoch: 39, train_loss: 0.5082, test_loss: 1.0407, test_f1: 0.6598
 epoch: 40, train_loss: 0.4975, test_loss: 1.1014, test_f1: 0.6636
 epoch: 41, train_loss: 0.4928, test_loss: 1.0105, test_f1: 0.6504
 epoch: 42, train_loss: 0.4653, test_loss: 1.0838, test_f1: 0.6423
 epoch: 43, train_loss: 0.4806, test_loss: 1.1151, test_f1: 0.6416
 epoch: 44, train_loss: 0.4881, test_loss: 1.1868, test_f1: 0.6378
 epoch: 45, train_loss: 0.4527, test_loss: 1.0631, test_f1: 0.6695
 epoch: 46, train_loss: 0.4608, test_loss: 1.1302, test_f1: 0.6514
 epoch: 47, train_loss: 0.4498, test_loss: 1.0645, test_f1: 0.6583
 epoch: 48, train_loss: 0.4559, test_loss: 1.0591, test_f1: 0.6597
 epoch: 49, train_loss: 0.4195, test_loss: 1.1063, test_f1: 0.6562
 epoch: 50, train_loss: 0.4294, test_loss: 1.2060, test_f1: 0.6689
 epoch: 51, train_loss: 0.3987, test_loss: 1.1753, test_f1: 0.6732
 epoch: 52, train_loss: 0.3907, test_loss: 1.1685, test_f1: 0.6675
 epoch: 53, train_loss: 0.3630, test_loss: 1.1862, test_f1: 0.6710
 epoch: 54, train_loss: 0.3604, test_loss: 1.2800, test_f1: 0.6593
 epoch: 55, train_loss: 0.3842, test_loss: 1.2619, test_f1: 0.6721
 epoch: 56, train_loss: 0.3561, test_loss: 1.2866, test_f1: 0.6626
 epoch: 57, train_loss: 0.3597, test_loss: 1.2429, test_f1: 0.6616
 epoch: 58, train_loss: 0.3468, test_loss: 1.3254, test_f1: 0.6764
 epoch: 59, train_loss: 0.3286, test_loss: 1.3830, test_f1: 0.6625
 epoch: 60, train_loss: 0.3353, test_loss: 1.3157, test_f1: 0.6785
 epoch: 61, train_loss: 0.3419, test_loss: 1.2824, test_f1: 0.6828
 epoch: 62, train_loss: 0.3299, test_loss: 1.3203, test_f1: 0.6599
 epoch: 63, train_loss: 0.3155, test_loss: 1.4487, test_f1: 0.6640
 epoch: 64, train_loss: 0.3110, test_loss: 1.3820, test_f1: 0.6733
 epoch: 65, train_loss: 0.3328, test_loss: 1.4039, test_f1: 0.6679
 epoch: 66, train_loss: 0.3239, test_loss: 1.4140, test_f1: 0.6754
 epoch: 67, train_loss: 0.3134, test_loss: 1.4119, test_f1: 0.6824
 epoch: 68, train_loss: 0.3115, test_loss: 1.4271, test_f1: 0.6895
 epoch: 69, train_loss: 0.3210, test_loss: 1.4980, test_f1: 0.6581
 epoch: 70, train_loss: 0.3168, test_loss: 1.3741, test_f1: 0.6770
 epoch: 71, train_loss: 0.3056, test_loss: 1.3820, test_f1: 0.6496
 epoch: 72, train_loss: 0.2985, test_loss: 1.3922, test_f1: 0.6663
 epoch: 73, train_loss: 0.2863, test_loss: 1.4987, test_f1: 0.6825
 epoch: 74, train_loss: 0.2921, test_loss: 1.4681, test_f1: 0.6953
 epoch: 75, train_loss: 0.2940, test_loss: 1.3777, test_f1: 0.6855
 epoch: 76, train_loss: 0.2883, test_loss: 1.4707, test_f1: 0.6792
 epoch: 77, train_loss: 0.2949, test_loss: 1.5296, test_f1: 0.6810
 epoch: 78, train_loss: 0.2873, test_loss: 1.5751, test_f1: 0.6767
 epoch: 79, train_loss: 0.2733, test_loss: 1.5502, test_f1: 0.6873
 epoch: 80, train_loss: 0.2727, test_loss: 1.3873, test_f1: 0.6861
 epoch: 81, train_loss: 0.2734, test_loss: 1.4729, test_f1: 0.6758
 epoch: 82, train_loss: 0.2666, test_loss: 1.5747, test_f1: 0.6828
 epoch: 83, train_loss: 0.2931, test_loss: 1.5508, test_f1: 0.6800
 epoch: 84, train_loss: 0.2596, test_loss: 1.6187, test_f1: 0.6723
 epoch: 85, train_loss: 0.2561, test_loss: 1.6317, test_f1: 0.6687
 epoch: 86, train_loss: 0.2559, test_loss: 1.4775, test_f1: 0.6857
 epoch: 87, train_loss: 0.2579, test_loss: 1.6074, test_f1: 0.6652
 epoch: 88, train_loss: 0.2549, test_loss: 1.5934, test_f1: 0.6775
 epoch: 89, train_loss: 0.2537, test_loss: 1.7672, test_f1: 0.6813
 epoch: 90, train_loss: 0.2585, test_loss: 1.5533, test_f1: 0.6692
 epoch: 91, train_loss: 0.2465, test_loss: 1.7150, test_f1: 0.6676
 epoch: 92, train_loss: 0.2613, test_loss: 1.7159, test_f1: 0.6718
 epoch: 93, train_loss: 0.2471, test_loss: 1.6894, test_f1: 0.6724
 epoch: 94, train_loss: 0.2488, test_loss: 1.6637, test_f1: 0.6602
 epoch: 95, train_loss: 0.2547, test_loss: 1.6646, test_f1: 0.6641
 epoch: 96, train_loss: 0.2283, test_loss: 1.6570, test_f1: 0.6705
 epoch: 97, train_loss: 0.2324, test_loss: 1.6787, test_f1: 0.6760
 epoch: 98, train_loss: 0.2370, test_loss: 1.7151, test_f1: 0.6765
 epoch: 99, train_loss: 0.2329, test_loss: 1.8445, test_f1: 0.6613
##################ITERATION #4 ****************************************
 epoch: 0, train_loss: 1.2683, test_loss: 1.1866, test_f1: 0.4223
 epoch: 1, train_loss: 1.0093, test_loss: 0.9780, test_f1: 0.4794
 epoch: 2, train_loss: 0.9672, test_loss: 0.9362, test_f1: 0.4956
 epoch: 3, train_loss: 0.9203, test_loss: 0.9056, test_f1: 0.5230
 epoch: 4, train_loss: 0.9043, test_loss: 0.9416, test_f1: 0.5323
 epoch: 5, train_loss: 0.8649, test_loss: 0.8805, test_f1: 0.5613
 epoch: 6, train_loss: 0.8561, test_loss: 0.8898, test_f1: 0.5310
 epoch: 7, train_loss: 0.8434, test_loss: 0.8984, test_f1: 0.5490
 epoch: 8, train_loss: 0.8241, test_loss: 0.8343, test_f1: 0.5497
 epoch: 9, train_loss: 0.8079, test_loss: 0.8427, test_f1: 0.5613
 epoch: 10, train_loss: 0.7889, test_loss: 0.8453, test_f1: 0.6202
 epoch: 11, train_loss: 0.7687, test_loss: 0.7824, test_f1: 0.6094
 epoch: 12, train_loss: 0.7507, test_loss: 0.8884, test_f1: 0.5863
 epoch: 13, train_loss: 0.7426, test_loss: 0.8284, test_f1: 0.6318
 epoch: 14, train_loss: 0.7365, test_loss: 0.8012, test_f1: 0.6299
 epoch: 15, train_loss: 0.7294, test_loss: 0.7822, test_f1: 0.6172
 epoch: 16, train_loss: 0.7119, test_loss: 0.8654, test_f1: 0.5855
 epoch: 17, train_loss: 0.7161, test_loss: 0.7852, test_f1: 0.6572
 epoch: 18, train_loss: 0.6789, test_loss: 0.8224, test_f1: 0.6400
 epoch: 19, train_loss: 0.6813, test_loss: 0.8624, test_f1: 0.6206
 epoch: 20, train_loss: 0.6649, test_loss: 0.8259, test_f1: 0.6228
 epoch: 21, train_loss: 0.6517, test_loss: 0.8555, test_f1: 0.5934
 epoch: 22, train_loss: 0.6667, test_loss: 0.8456, test_f1: 0.6489
 epoch: 23, train_loss: 0.6514, test_loss: 0.8031, test_f1: 0.6451
 epoch: 24, train_loss: 0.6418, test_loss: 0.8154, test_f1: 0.6214
 epoch: 25, train_loss: 0.6319, test_loss: 0.8241, test_f1: 0.6698
 epoch: 26, train_loss: 0.6149, test_loss: 0.8264, test_f1: 0.6173
 epoch: 27, train_loss: 0.6209, test_loss: 0.8226, test_f1: 0.6554
 epoch: 28, train_loss: 0.6092, test_loss: 0.8704, test_f1: 0.6300
 epoch: 29, train_loss: 0.5892, test_loss: 0.7603, test_f1: 0.6568
 epoch: 30, train_loss: 0.5898, test_loss: 0.8220, test_f1: 0.6715
 epoch: 31, train_loss: 0.5681, test_loss: 0.8282, test_f1: 0.6352
 epoch: 32, train_loss: 0.5713, test_loss: 0.9062, test_f1: 0.6611
 epoch: 33, train_loss: 0.5919, test_loss: 0.8219, test_f1: 0.6580
 epoch: 34, train_loss: 0.5635, test_loss: 0.9923, test_f1: 0.6552
 epoch: 35, train_loss: 0.5605, test_loss: 0.8678, test_f1: 0.6473
 epoch: 36, train_loss: 0.5553, test_loss: 0.7999, test_f1: 0.6565
 epoch: 37, train_loss: 0.5539, test_loss: 0.8924, test_f1: 0.6459
 epoch: 38, train_loss: 0.5406, test_loss: 0.8989, test_f1: 0.6587
 epoch: 39, train_loss: 0.5464, test_loss: 0.9268, test_f1: 0.6473
 epoch: 40, train_loss: 0.5446, test_loss: 0.8208, test_f1: 0.6453
 epoch: 41, train_loss: 0.5473, test_loss: 0.9607, test_f1: 0.6283
 epoch: 42, train_loss: 0.5212, test_loss: 0.9364, test_f1: 0.6612
 epoch: 43, train_loss: 0.5059, test_loss: 1.0028, test_f1: 0.6272
 epoch: 44, train_loss: 0.5118, test_loss: 0.9573, test_f1: 0.6588
 epoch: 45, train_loss: 0.4951, test_loss: 0.9198, test_f1: 0.6625
 epoch: 46, train_loss: 0.4980, test_loss: 0.8877, test_f1: 0.6777
 epoch: 47, train_loss: 0.5091, test_loss: 1.0905, test_f1: 0.6124
 epoch: 48, train_loss: 0.5113, test_loss: 1.0184, test_f1: 0.6291
 epoch: 49, train_loss: 0.4993, test_loss: 0.9324, test_f1: 0.6564
 epoch: 50, train_loss: 0.4705, test_loss: 0.9036, test_f1: 0.6552
 epoch: 51, train_loss: 0.4370, test_loss: 1.0447, test_f1: 0.6613
 epoch: 52, train_loss: 0.4251, test_loss: 1.0340, test_f1: 0.6517
 epoch: 53, train_loss: 0.4116, test_loss: 1.0913, test_f1: 0.6606
 epoch: 54, train_loss: 0.4209, test_loss: 1.0337, test_f1: 0.6548
 epoch: 55, train_loss: 0.4105, test_loss: 1.0879, test_f1: 0.6777
 epoch: 56, train_loss: 0.4055, test_loss: 1.0779, test_f1: 0.6906
 epoch: 57, train_loss: 0.3867, test_loss: 1.1314, test_f1: 0.6560
 epoch: 58, train_loss: 0.3942, test_loss: 1.1484, test_f1: 0.6558
 epoch: 59, train_loss: 0.3732, test_loss: 1.2120, test_f1: 0.6483
 epoch: 60, train_loss: 0.3868, test_loss: 1.1614, test_f1: 0.6405
 epoch: 61, train_loss: 0.3875, test_loss: 1.2929, test_f1: 0.6601
 epoch: 62, train_loss: 0.3816, test_loss: 1.1985, test_f1: 0.6603
 epoch: 63, train_loss: 0.3820, test_loss: 1.1709, test_f1: 0.6628
 epoch: 64, train_loss: 0.3637, test_loss: 1.2920, test_f1: 0.6593
 epoch: 65, train_loss: 0.3639, test_loss: 1.2248, test_f1: 0.6600
 epoch: 66, train_loss: 0.3541, test_loss: 1.3285, test_f1: 0.6573
 epoch: 67, train_loss: 0.3505, test_loss: 1.2405, test_f1: 0.6732
 epoch: 68, train_loss: 0.3523, test_loss: 1.2878, test_f1: 0.6774
 epoch: 69, train_loss: 0.3651, test_loss: 1.2434, test_f1: 0.6477
 epoch: 70, train_loss: 0.3523, test_loss: 1.3394, test_f1: 0.6655
 epoch: 71, train_loss: 0.3321, test_loss: 1.4129, test_f1: 0.6546
 epoch: 72, train_loss: 0.3405, test_loss: 1.3977, test_f1: 0.6549
 epoch: 73, train_loss: 0.3461, test_loss: 1.3740, test_f1: 0.6672
 epoch: 74, train_loss: 0.3538, test_loss: 1.4853, test_f1: 0.6583
 epoch: 75, train_loss: 0.3314, test_loss: 1.3908, test_f1: 0.6851
 epoch: 76, train_loss: 0.3373, test_loss: 1.2718, test_f1: 0.6762
 epoch: 77, train_loss: 0.3243, test_loss: 1.4110, test_f1: 0.6615
 epoch: 78, train_loss: 0.3393, test_loss: 1.4084, test_f1: 0.6828
 epoch: 79, train_loss: 0.3159, test_loss: 1.3648, test_f1: 0.6709
 epoch: 80, train_loss: 0.3586, test_loss: 1.3409, test_f1: 0.6611
 epoch: 81, train_loss: 0.3384, test_loss: 1.3490, test_f1: 0.6734
 epoch: 82, train_loss: 0.3169, test_loss: 1.4436, test_f1: 0.6594
 epoch: 83, train_loss: 0.3112, test_loss: 1.3647, test_f1: 0.6684
 epoch: 84, train_loss: 0.3007, test_loss: 1.5111, test_f1: 0.6817
 epoch: 85, train_loss: 0.3051, test_loss: 1.3627, test_f1: 0.6613
 epoch: 86, train_loss: 0.2954, test_loss: 1.4608, test_f1: 0.6630
 epoch: 87, train_loss: 0.3389, test_loss: 1.5549, test_f1: 0.6670
 epoch: 88, train_loss: 0.3092, test_loss: 1.4234, test_f1: 0.6734
 epoch: 89, train_loss: 0.3022, test_loss: 1.4759, test_f1: 0.6682
 epoch: 90, train_loss: 0.3082, test_loss: 1.4412, test_f1: 0.6668
 epoch: 91, train_loss: 0.3105, test_loss: 1.4660, test_f1: 0.6698
 epoch: 92, train_loss: 0.2755, test_loss: 1.5443, test_f1: 0.6743
 epoch: 93, train_loss: 0.2829, test_loss: 1.5847, test_f1: 0.6692
 epoch: 94, train_loss: 0.2784, test_loss: 1.5942, test_f1: 0.6356
 epoch: 95, train_loss: 0.2832, test_loss: 1.6055, test_f1: 0.6897
 epoch: 96, train_loss: 0.3072, test_loss: 1.5243, test_f1: 0.6568
 epoch: 97, train_loss: 0.2910, test_loss: 1.4876, test_f1: 0.6811
 epoch: 98, train_loss: 0.2751, test_loss: 1.6220, test_f1: 0.6601
 epoch: 99, train_loss: 0.2907, test_loss: 1.6353, test_f1: 0.6661
##################ITERATION #5 ****************************************
 epoch: 0, train_loss: 1.2491, test_loss: 1.1388, test_f1: 0.4707
 epoch: 1, train_loss: 1.0074, test_loss: 0.9418, test_f1: 0.5316
 epoch: 2, train_loss: 0.9572, test_loss: 0.9137, test_f1: 0.5258
 epoch: 3, train_loss: 0.9163, test_loss: 0.9251, test_f1: 0.5719
 epoch: 4, train_loss: 0.9053, test_loss: 0.8730, test_f1: 0.5646
 epoch: 5, train_loss: 0.8636, test_loss: 0.8622, test_f1: 0.5920
 epoch: 6, train_loss: 0.8547, test_loss: 0.8802, test_f1: 0.6013
 epoch: 7, train_loss: 0.8272, test_loss: 0.8364, test_f1: 0.5843
 epoch: 8, train_loss: 0.8198, test_loss: 0.8690, test_f1: 0.5542
 epoch: 9, train_loss: 0.7936, test_loss: 0.8149, test_f1: 0.5806
 epoch: 10, train_loss: 0.7821, test_loss: 0.7614, test_f1: 0.6217
 epoch: 11, train_loss: 0.7712, test_loss: 0.7513, test_f1: 0.6476
 epoch: 12, train_loss: 0.7565, test_loss: 0.7718, test_f1: 0.6205
 epoch: 13, train_loss: 0.7350, test_loss: 0.7718, test_f1: 0.6376
 epoch: 14, train_loss: 0.7297, test_loss: 0.7596, test_f1: 0.6324
 epoch: 15, train_loss: 0.7160, test_loss: 0.7370, test_f1: 0.6519
 epoch: 16, train_loss: 0.7014, test_loss: 0.8408, test_f1: 0.6386
 epoch: 17, train_loss: 0.7010, test_loss: 0.7517, test_f1: 0.6528
 epoch: 18, train_loss: 0.6812, test_loss: 0.9042, test_f1: 0.6166
 epoch: 19, train_loss: 0.6624, test_loss: 0.8701, test_f1: 0.6599
 epoch: 20, train_loss: 0.6610, test_loss: 0.8467, test_f1: 0.6238
 epoch: 21, train_loss: 0.6350, test_loss: 0.7589, test_f1: 0.6251
 epoch: 22, train_loss: 0.6258, test_loss: 0.7704, test_f1: 0.6478
 epoch: 23, train_loss: 0.6338, test_loss: 0.7376, test_f1: 0.6529
 epoch: 24, train_loss: 0.6215, test_loss: 0.8165, test_f1: 0.6524
 epoch: 25, train_loss: 0.6154, test_loss: 0.8173, test_f1: 0.6762
 epoch: 26, train_loss: 0.5798, test_loss: 0.7957, test_f1: 0.6485
 epoch: 27, train_loss: 0.5927, test_loss: 0.8018, test_f1: 0.6688
 epoch: 28, train_loss: 0.5961, test_loss: 0.8658, test_f1: 0.6428
 epoch: 29, train_loss: 0.5888, test_loss: 0.8398, test_f1: 0.6726
 epoch: 30, train_loss: 0.5704, test_loss: 0.8747, test_f1: 0.6483
 epoch: 31, train_loss: 0.5567, test_loss: 0.9190, test_f1: 0.6521
 epoch: 32, train_loss: 0.5473, test_loss: 0.9252, test_f1: 0.6406
 epoch: 33, train_loss: 0.5516, test_loss: 0.9463, test_f1: 0.6446
 epoch: 34, train_loss: 0.5472, test_loss: 0.8681, test_f1: 0.6741
 epoch: 35, train_loss: 0.5398, test_loss: 0.9933, test_f1: 0.6252
 epoch: 36, train_loss: 0.5228, test_loss: 0.9109, test_f1: 0.6779
 epoch: 37, train_loss: 0.5183, test_loss: 0.8324, test_f1: 0.6838
 epoch: 38, train_loss: 0.5210, test_loss: 0.9152, test_f1: 0.6463
 epoch: 39, train_loss: 0.4905, test_loss: 0.9058, test_f1: 0.6765
 epoch: 40, train_loss: 0.4925, test_loss: 0.9028, test_f1: 0.6567
 epoch: 41, train_loss: 0.5054, test_loss: 0.9257, test_f1: 0.6545
 epoch: 42, train_loss: 0.4882, test_loss: 0.9432, test_f1: 0.6775
 epoch: 43, train_loss: 0.4579, test_loss: 0.9930, test_f1: 0.6819
 epoch: 44, train_loss: 0.4721, test_loss: 0.9376, test_f1: 0.6831
 epoch: 45, train_loss: 0.4676, test_loss: 0.9833, test_f1: 0.6597
 epoch: 46, train_loss: 0.5016, test_loss: 1.0284, test_f1: 0.6554
 epoch: 47, train_loss: 0.4567, test_loss: 0.9435, test_f1: 0.6864
 epoch: 48, train_loss: 0.4381, test_loss: 1.0020, test_f1: 0.6732
 epoch: 49, train_loss: 0.4307, test_loss: 0.9786, test_f1: 0.6950
 epoch: 50, train_loss: 0.4398, test_loss: 1.0211, test_f1: 0.6659
 epoch: 51, train_loss: 0.4191, test_loss: 1.0530, test_f1: 0.6880
 epoch: 52, train_loss: 0.3853, test_loss: 1.0717, test_f1: 0.6891
 epoch: 53, train_loss: 0.3925, test_loss: 1.1136, test_f1: 0.6648
 epoch: 54, train_loss: 0.3688, test_loss: 1.1051, test_f1: 0.6779
 epoch: 55, train_loss: 0.3661, test_loss: 1.1166, test_f1: 0.6774
 epoch: 56, train_loss: 0.3489, test_loss: 1.1114, test_f1: 0.6741
 epoch: 57, train_loss: 0.3478, test_loss: 1.1626, test_f1: 0.6823
 epoch: 58, train_loss: 0.3538, test_loss: 1.1759, test_f1: 0.6782
 epoch: 59, train_loss: 0.3505, test_loss: 1.1698, test_f1: 0.6692
 epoch: 60, train_loss: 0.3491, test_loss: 1.2344, test_f1: 0.6560
 epoch: 61, train_loss: 0.3291, test_loss: 1.1342, test_f1: 0.6761
 epoch: 62, train_loss: 0.3197, test_loss: 1.2304, test_f1: 0.6940
 epoch: 63, train_loss: 0.3330, test_loss: 1.2162, test_f1: 0.6635
 epoch: 64, train_loss: 0.3308, test_loss: 1.2365, test_f1: 0.6763
 epoch: 65, train_loss: 0.3386, test_loss: 1.2221, test_f1: 0.6789
 epoch: 66, train_loss: 0.3375, test_loss: 1.1884, test_f1: 0.6668
 epoch: 67, train_loss: 0.3339, test_loss: 1.2482, test_f1: 0.6757
 epoch: 68, train_loss: 0.3196, test_loss: 1.1699, test_f1: 0.6982
 epoch: 69, train_loss: 0.3172, test_loss: 1.1686, test_f1: 0.6853
 epoch: 70, train_loss: 0.3134, test_loss: 1.3376, test_f1: 0.6751
 epoch: 71, train_loss: 0.3285, test_loss: 1.2319, test_f1: 0.6772
 epoch: 72, train_loss: 0.3114, test_loss: 1.2789, test_f1: 0.6702
 epoch: 73, train_loss: 0.2897, test_loss: 1.3021, test_f1: 0.6702
 epoch: 74, train_loss: 0.3029, test_loss: 1.3806, test_f1: 0.6792
 epoch: 75, train_loss: 0.2961, test_loss: 1.4401, test_f1: 0.6634
 epoch: 76, train_loss: 0.3020, test_loss: 1.4218, test_f1: 0.6723
 epoch: 77, train_loss: 0.3102, test_loss: 1.3689, test_f1: 0.6806
 epoch: 78, train_loss: 0.3158, test_loss: 1.2840, test_f1: 0.6747
 epoch: 79, train_loss: 0.2984, test_loss: 1.3221, test_f1: 0.6925
 epoch: 80, train_loss: 0.3097, test_loss: 1.3557, test_f1: 0.6738
 epoch: 81, train_loss: 0.3007, test_loss: 1.4631, test_f1: 0.6850
 epoch: 82, train_loss: 0.2911, test_loss: 1.4342, test_f1: 0.6690
 epoch: 83, train_loss: 0.2757, test_loss: 1.4715, test_f1: 0.6599
 epoch: 84, train_loss: 0.2662, test_loss: 1.5219, test_f1: 0.6602
 epoch: 85, train_loss: 0.2774, test_loss: 1.4360, test_f1: 0.6710
 epoch: 86, train_loss: 0.2546, test_loss: 1.4488, test_f1: 0.6785
 epoch: 87, train_loss: 0.2696, test_loss: 1.3515, test_f1: 0.6770
 epoch: 88, train_loss: 0.2713, test_loss: 1.3341, test_f1: 0.6890
 epoch: 89, train_loss: 0.2885, test_loss: 1.4567, test_f1: 0.6613
 epoch: 90, train_loss: 0.2784, test_loss: 1.4399, test_f1: 0.6731
 epoch: 91, train_loss: 0.2729, test_loss: 1.4034, test_f1: 0.6732
 epoch: 92, train_loss: 0.2661, test_loss: 1.5198, test_f1: 0.6579
 epoch: 93, train_loss: 0.2413, test_loss: 1.4326, test_f1: 0.6662
 epoch: 94, train_loss: 0.2565, test_loss: 1.4838, test_f1: 0.6769
 epoch: 95, train_loss: 0.2643, test_loss: 1.4620, test_f1: 0.6833
 epoch: 96, train_loss: 0.2717, test_loss: 1.4714, test_f1: 0.6739
 epoch: 97, train_loss: 0.2664, test_loss: 1.4164, test_f1: 0.6780
 epoch: 98, train_loss: 0.2573, test_loss: 1.4314, test_f1: 0.6767
 epoch: 99, train_loss: 0.2415, test_loss: 1.5040, test_f1: 0.6733
##################ITERATION #6 ****************************************
 epoch: 0, train_loss: 1.3167, test_loss: 1.3870, test_f1: 0.3506
 epoch: 1, train_loss: 0.9938, test_loss: 0.9707, test_f1: 0.5000
 epoch: 2, train_loss: 0.9461, test_loss: 0.8592, test_f1: 0.5569
 epoch: 3, train_loss: 0.9124, test_loss: 0.9104, test_f1: 0.5506
 epoch: 4, train_loss: 0.8868, test_loss: 0.9490, test_f1: 0.5376
 epoch: 5, train_loss: 0.8714, test_loss: 0.8088, test_f1: 0.5891
 epoch: 6, train_loss: 0.8523, test_loss: 0.8542, test_f1: 0.6006
 epoch: 7, train_loss: 0.8432, test_loss: 0.8750, test_f1: 0.5774
 epoch: 8, train_loss: 0.8188, test_loss: 0.8089, test_f1: 0.5588
 epoch: 9, train_loss: 0.7990, test_loss: 0.8140, test_f1: 0.6048
 epoch: 10, train_loss: 0.7786, test_loss: 0.7741, test_f1: 0.5994
 epoch: 11, train_loss: 0.7754, test_loss: 0.8254, test_f1: 0.6141
 epoch: 12, train_loss: 0.7637, test_loss: 0.7583, test_f1: 0.6240
 epoch: 13, train_loss: 0.7451, test_loss: 0.7876, test_f1: 0.6221
 epoch: 14, train_loss: 0.7443, test_loss: 0.7918, test_f1: 0.6295
 epoch: 15, train_loss: 0.7170, test_loss: 0.7554, test_f1: 0.6199
 epoch: 16, train_loss: 0.7273, test_loss: 0.7358, test_f1: 0.6228
 epoch: 17, train_loss: 0.7068, test_loss: 0.7403, test_f1: 0.6330
 epoch: 18, train_loss: 0.6926, test_loss: 0.7425, test_f1: 0.6331
 epoch: 19, train_loss: 0.6813, test_loss: 0.8195, test_f1: 0.6000
 epoch: 20, train_loss: 0.6558, test_loss: 0.7673, test_f1: 0.6557
 epoch: 21, train_loss: 0.6720, test_loss: 0.7910, test_f1: 0.6394
 epoch: 22, train_loss: 0.6584, test_loss: 0.7492, test_f1: 0.6548
 epoch: 23, train_loss: 0.6406, test_loss: 0.7882, test_f1: 0.6641
 epoch: 24, train_loss: 0.6239, test_loss: 0.8273, test_f1: 0.6468
 epoch: 25, train_loss: 0.6225, test_loss: 0.8234, test_f1: 0.6458
 epoch: 26, train_loss: 0.6100, test_loss: 0.8244, test_f1: 0.6393
 epoch: 27, train_loss: 0.6160, test_loss: 0.8309, test_f1: 0.6425
 epoch: 28, train_loss: 0.5968, test_loss: 0.8175, test_f1: 0.6483
 epoch: 29, train_loss: 0.6042, test_loss: 0.8820, test_f1: 0.6570
 epoch: 30, train_loss: 0.5691, test_loss: 0.8788, test_f1: 0.6316
 epoch: 31, train_loss: 0.5720, test_loss: 0.9415, test_f1: 0.6614
 epoch: 32, train_loss: 0.5797, test_loss: 0.8371, test_f1: 0.6456
 epoch: 33, train_loss: 0.5683, test_loss: 0.8819, test_f1: 0.6409
 epoch: 34, train_loss: 0.5627, test_loss: 0.8305, test_f1: 0.6651
 epoch: 35, train_loss: 0.5386, test_loss: 0.8439, test_f1: 0.6498
 epoch: 36, train_loss: 0.5624, test_loss: 0.8750, test_f1: 0.6662
 epoch: 37, train_loss: 0.5278, test_loss: 0.8997, test_f1: 0.6515
 epoch: 38, train_loss: 0.5218, test_loss: 0.8758, test_f1: 0.6731
 epoch: 39, train_loss: 0.5367, test_loss: 0.8784, test_f1: 0.6599
 epoch: 40, train_loss: 0.5161, test_loss: 0.8514, test_f1: 0.6453
 epoch: 41, train_loss: 0.5316, test_loss: 0.9673, test_f1: 0.6248
 epoch: 42, train_loss: 0.5173, test_loss: 0.9118, test_f1: 0.6805
 epoch: 43, train_loss: 0.4899, test_loss: 0.8819, test_f1: 0.6504
 epoch: 44, train_loss: 0.5004, test_loss: 0.9694, test_f1: 0.6722
 epoch: 45, train_loss: 0.4930, test_loss: 0.9534, test_f1: 0.6703
 epoch: 46, train_loss: 0.5003, test_loss: 0.9061, test_f1: 0.6573
 epoch: 47, train_loss: 0.4755, test_loss: 0.8773, test_f1: 0.6635
 epoch: 48, train_loss: 0.4797, test_loss: 0.9387, test_f1: 0.6741
 epoch: 49, train_loss: 0.4779, test_loss: 0.9635, test_f1: 0.6661
 epoch: 50, train_loss: 0.4618, test_loss: 0.9358, test_f1: 0.6599
 epoch: 51, train_loss: 0.4361, test_loss: 0.9657, test_f1: 0.6552
 epoch: 52, train_loss: 0.4025, test_loss: 0.9795, test_f1: 0.6734
 epoch: 53, train_loss: 0.4056, test_loss: 0.9343, test_f1: 0.6622
 epoch: 54, train_loss: 0.3807, test_loss: 1.0233, test_f1: 0.6507
 epoch: 55, train_loss: 0.3669, test_loss: 1.1296, test_f1: 0.6558
 epoch: 56, train_loss: 0.3782, test_loss: 1.1219, test_f1: 0.6530
 epoch: 57, train_loss: 0.3731, test_loss: 1.1024, test_f1: 0.6451
 epoch: 58, train_loss: 0.3684, test_loss: 1.1230, test_f1: 0.6567
 epoch: 59, train_loss: 0.3779, test_loss: 1.0994, test_f1: 0.6585
 epoch: 60, train_loss: 0.3511, test_loss: 1.0796, test_f1: 0.6471
 epoch: 61, train_loss: 0.3362, test_loss: 1.1515, test_f1: 0.6687
 epoch: 62, train_loss: 0.3660, test_loss: 1.1611, test_f1: 0.6520
 epoch: 63, train_loss: 0.3595, test_loss: 1.1655, test_f1: 0.6631
 epoch: 64, train_loss: 0.3495, test_loss: 1.1756, test_f1: 0.6737
 epoch: 65, train_loss: 0.3347, test_loss: 1.2047, test_f1: 0.6761
 epoch: 66, train_loss: 0.3429, test_loss: 1.1607, test_f1: 0.6632
 epoch: 67, train_loss: 0.3397, test_loss: 1.1862, test_f1: 0.6570
 epoch: 68, train_loss: 0.3193, test_loss: 1.2263, test_f1: 0.6615
 epoch: 69, train_loss: 0.3302, test_loss: 1.2717, test_f1: 0.6439
 epoch: 70, train_loss: 0.3382, test_loss: 1.1262, test_f1: 0.6723
 epoch: 71, train_loss: 0.3208, test_loss: 1.2773, test_f1: 0.6620
 epoch: 72, train_loss: 0.3129, test_loss: 1.3053, test_f1: 0.6686
 epoch: 73, train_loss: 0.3261, test_loss: 1.2431, test_f1: 0.6790
 epoch: 74, train_loss: 0.3060, test_loss: 1.3019, test_f1: 0.6756
 epoch: 75, train_loss: 0.3241, test_loss: 1.2963, test_f1: 0.6540
 epoch: 76, train_loss: 0.3070, test_loss: 1.3204, test_f1: 0.6460
 epoch: 77, train_loss: 0.3030, test_loss: 1.3640, test_f1: 0.6658
 epoch: 78, train_loss: 0.3151, test_loss: 1.2961, test_f1: 0.6577
 epoch: 79, train_loss: 0.3026, test_loss: 1.3925, test_f1: 0.6699
 epoch: 80, train_loss: 0.3142, test_loss: 1.3068, test_f1: 0.6724
 epoch: 81, train_loss: 0.3052, test_loss: 1.3722, test_f1: 0.6673
 epoch: 82, train_loss: 0.2775, test_loss: 1.4010, test_f1: 0.6711
 epoch: 83, train_loss: 0.2950, test_loss: 1.3989, test_f1: 0.6751
 epoch: 84, train_loss: 0.2784, test_loss: 1.4101, test_f1: 0.6711
 epoch: 85, train_loss: 0.2843, test_loss: 1.3447, test_f1: 0.6508
 epoch: 86, train_loss: 0.3020, test_loss: 1.2524, test_f1: 0.6849
 epoch: 87, train_loss: 0.3014, test_loss: 1.3680, test_f1: 0.6739
 epoch: 88, train_loss: 0.2715, test_loss: 1.3578, test_f1: 0.6597
 epoch: 89, train_loss: 0.2850, test_loss: 1.3293, test_f1: 0.6598
 epoch: 90, train_loss: 0.2937, test_loss: 1.3876, test_f1: 0.6716
 epoch: 91, train_loss: 0.2664, test_loss: 1.4226, test_f1: 0.6761
 epoch: 92, train_loss: 0.2906, test_loss: 1.3874, test_f1: 0.6668
 epoch: 93, train_loss: 0.2758, test_loss: 1.4642, test_f1: 0.6682
 epoch: 94, train_loss: 0.2856, test_loss: 1.4293, test_f1: 0.6774
 epoch: 95, train_loss: 0.2849, test_loss: 1.4985, test_f1: 0.6719
 epoch: 96, train_loss: 0.2551, test_loss: 1.4857, test_f1: 0.6920
 epoch: 97, train_loss: 0.2764, test_loss: 1.4526, test_f1: 0.6678
 epoch: 98, train_loss: 0.2619, test_loss: 1.4000, test_f1: 0.6847
 epoch: 99, train_loss: 0.2580, test_loss: 1.5398, test_f1: 0.6676
##################ITERATION #7 ****************************************
 epoch: 0, train_loss: 1.2916, test_loss: 1.0544, test_f1: 0.4924
 epoch: 1, train_loss: 1.0376, test_loss: 0.9531, test_f1: 0.5475
 epoch: 2, train_loss: 0.9702, test_loss: 0.9152, test_f1: 0.5349
 epoch: 3, train_loss: 0.9291, test_loss: 0.9329, test_f1: 0.5729
 epoch: 4, train_loss: 0.9174, test_loss: 0.9019, test_f1: 0.5551
 epoch: 5, train_loss: 0.8907, test_loss: 0.8826, test_f1: 0.5787
 epoch: 6, train_loss: 0.8704, test_loss: 0.9079, test_f1: 0.5731
 epoch: 7, train_loss: 0.8615, test_loss: 0.8305, test_f1: 0.6050
 epoch: 8, train_loss: 0.8388, test_loss: 0.8262, test_f1: 0.5887
 epoch: 9, train_loss: 0.8150, test_loss: 0.8073, test_f1: 0.5878
 epoch: 10, train_loss: 0.7927, test_loss: 0.8473, test_f1: 0.5981
 epoch: 11, train_loss: 0.7964, test_loss: 0.8026, test_f1: 0.5737
 epoch: 12, train_loss: 0.8000, test_loss: 0.8438, test_f1: 0.5830
 epoch: 13, train_loss: 0.7699, test_loss: 0.8263, test_f1: 0.6252
 epoch: 14, train_loss: 0.7675, test_loss: 0.7761, test_f1: 0.6656
 epoch: 15, train_loss: 0.7623, test_loss: 0.7521, test_f1: 0.6106
 epoch: 16, train_loss: 0.7267, test_loss: 0.8373, test_f1: 0.6082
 epoch: 17, train_loss: 0.7299, test_loss: 0.8040, test_f1: 0.6339
 epoch: 18, train_loss: 0.7410, test_loss: 0.8310, test_f1: 0.6012
 epoch: 19, train_loss: 0.7142, test_loss: 0.7829, test_f1: 0.6413
 epoch: 20, train_loss: 0.7124, test_loss: 0.8023, test_f1: 0.6757
 epoch: 21, train_loss: 0.7106, test_loss: 0.8330, test_f1: 0.6411
 epoch: 22, train_loss: 0.6967, test_loss: 0.7650, test_f1: 0.6567
 epoch: 23, train_loss: 0.6831, test_loss: 0.8231, test_f1: 0.6486
 epoch: 24, train_loss: 0.6579, test_loss: 0.7911, test_f1: 0.6315
 epoch: 25, train_loss: 0.6619, test_loss: 0.8048, test_f1: 0.6675
 epoch: 26, train_loss: 0.6648, test_loss: 0.8311, test_f1: 0.6505
 epoch: 27, train_loss: 0.6486, test_loss: 0.8629, test_f1: 0.6300
 epoch: 28, train_loss: 0.6254, test_loss: 0.8120, test_f1: 0.6647
 epoch: 29, train_loss: 0.6262, test_loss: 0.7774, test_f1: 0.6567
 epoch: 30, train_loss: 0.6386, test_loss: 0.8101, test_f1: 0.6597
 epoch: 31, train_loss: 0.6130, test_loss: 0.8260, test_f1: 0.6430
 epoch: 32, train_loss: 0.6109, test_loss: 0.8094, test_f1: 0.6631
 epoch: 33, train_loss: 0.6105, test_loss: 0.8355, test_f1: 0.6539
 epoch: 34, train_loss: 0.6294, test_loss: 0.7784, test_f1: 0.6681
 epoch: 35, train_loss: 0.5759, test_loss: 0.7965, test_f1: 0.6597
 epoch: 36, train_loss: 0.5772, test_loss: 0.7761, test_f1: 0.6955
 epoch: 37, train_loss: 0.5801, test_loss: 0.7375, test_f1: 0.6741
 epoch: 38, train_loss: 0.5559, test_loss: 0.8701, test_f1: 0.6504
 epoch: 39, train_loss: 0.5530, test_loss: 0.8036, test_f1: 0.6859
 epoch: 40, train_loss: 0.5615, test_loss: 0.8700, test_f1: 0.6219
 epoch: 41, train_loss: 0.5633, test_loss: 0.8480, test_f1: 0.6672
 epoch: 42, train_loss: 0.5428, test_loss: 0.8838, test_f1: 0.6452
 epoch: 43, train_loss: 0.5482, test_loss: 0.7280, test_f1: 0.7025
 epoch: 44, train_loss: 0.5086, test_loss: 0.8389, test_f1: 0.6555
 epoch: 45, train_loss: 0.5128, test_loss: 0.7255, test_f1: 0.6664
 epoch: 46, train_loss: 0.5384, test_loss: 0.7072, test_f1: 0.6875
 epoch: 47, train_loss: 0.5109, test_loss: 0.8508, test_f1: 0.6681
 epoch: 48, train_loss: 0.5041, test_loss: 0.7670, test_f1: 0.6891
 epoch: 49, train_loss: 0.5087, test_loss: 0.8895, test_f1: 0.6681
 epoch: 50, train_loss: 0.5018, test_loss: 0.9090, test_f1: 0.6666
 epoch: 51, train_loss: 0.4610, test_loss: 0.8370, test_f1: 0.6916
 epoch: 52, train_loss: 0.4531, test_loss: 0.8840, test_f1: 0.6753
 epoch: 53, train_loss: 0.4378, test_loss: 0.9101, test_f1: 0.6721
 epoch: 54, train_loss: 0.4357, test_loss: 0.8581, test_f1: 0.6749
 epoch: 55, train_loss: 0.4088, test_loss: 0.9494, test_f1: 0.6770
 epoch: 56, train_loss: 0.4075, test_loss: 0.8670, test_f1: 0.6623
 epoch: 57, train_loss: 0.4012, test_loss: 0.9372, test_f1: 0.6816
 epoch: 58, train_loss: 0.4042, test_loss: 0.9287, test_f1: 0.6826
 epoch: 59, train_loss: 0.3983, test_loss: 0.9555, test_f1: 0.6911
 epoch: 60, train_loss: 0.3925, test_loss: 0.8857, test_f1: 0.6830
 epoch: 61, train_loss: 0.3877, test_loss: 0.9534, test_f1: 0.6663
 epoch: 62, train_loss: 0.3976, test_loss: 1.0033, test_f1: 0.6730
 epoch: 63, train_loss: 0.3862, test_loss: 0.9484, test_f1: 0.6847
 epoch: 64, train_loss: 0.3740, test_loss: 0.9728, test_f1: 0.6870
 epoch: 65, train_loss: 0.3822, test_loss: 0.9879, test_f1: 0.7212
 epoch: 66, train_loss: 0.3594, test_loss: 1.0930, test_f1: 0.6698
 epoch: 67, train_loss: 0.3640, test_loss: 1.0319, test_f1: 0.6660
 epoch: 68, train_loss: 0.3673, test_loss: 1.0530, test_f1: 0.7071
 epoch: 69, train_loss: 0.3497, test_loss: 1.1091, test_f1: 0.6521
 epoch: 70, train_loss: 0.3724, test_loss: 1.0227, test_f1: 0.6692
 epoch: 71, train_loss: 0.3722, test_loss: 1.0248, test_f1: 0.6915
 epoch: 72, train_loss: 0.3399, test_loss: 0.9621, test_f1: 0.6795
 epoch: 73, train_loss: 0.3500, test_loss: 1.0821, test_f1: 0.6878
 epoch: 74, train_loss: 0.3534, test_loss: 1.2207, test_f1: 0.6907
 epoch: 75, train_loss: 0.3435, test_loss: 1.1243, test_f1: 0.6670
 epoch: 76, train_loss: 0.3185, test_loss: 1.2021, test_f1: 0.6727
 epoch: 77, train_loss: 0.3360, test_loss: 1.2164, test_f1: 0.6641
 epoch: 78, train_loss: 0.3278, test_loss: 1.2757, test_f1: 0.6689
 epoch: 79, train_loss: 0.3378, test_loss: 1.1393, test_f1: 0.6819
 epoch: 80, train_loss: 0.3356, test_loss: 1.2371, test_f1: 0.6681
 epoch: 81, train_loss: 0.3381, test_loss: 1.1416, test_f1: 0.6745
 epoch: 82, train_loss: 0.3098, test_loss: 1.2887, test_f1: 0.6783
 epoch: 83, train_loss: 0.3142, test_loss: 1.1837, test_f1: 0.6705
 epoch: 84, train_loss: 0.3168, test_loss: 1.2516, test_f1: 0.6839
 epoch: 85, train_loss: 0.3196, test_loss: 1.2124, test_f1: 0.6854
 epoch: 86, train_loss: 0.3227, test_loss: 1.3279, test_f1: 0.6919
 epoch: 87, train_loss: 0.3096, test_loss: 1.2616, test_f1: 0.6917
 epoch: 88, train_loss: 0.3263, test_loss: 1.2537, test_f1: 0.6743
 epoch: 89, train_loss: 0.3118, test_loss: 1.3785, test_f1: 0.6800
 epoch: 90, train_loss: 0.2998, test_loss: 1.3210, test_f1: 0.6708
 epoch: 91, train_loss: 0.2942, test_loss: 1.3342, test_f1: 0.6702
 epoch: 92, train_loss: 0.2957, test_loss: 1.3092, test_f1: 0.6656
 epoch: 93, train_loss: 0.2878, test_loss: 1.4356, test_f1: 0.6851
 epoch: 94, train_loss: 0.3057, test_loss: 1.3632, test_f1: 0.6692
 epoch: 95, train_loss: 0.2788, test_loss: 1.4404, test_f1: 0.6838
 epoch: 96, train_loss: 0.2940, test_loss: 1.4128, test_f1: 0.6850
 epoch: 97, train_loss: 0.2900, test_loss: 1.3117, test_f1: 0.6762
 epoch: 98, train_loss: 0.2738, test_loss: 1.3221, test_f1: 0.6864
 epoch: 99, train_loss: 0.2925, test_loss: 1.3180, test_f1: 0.6763
##################ITERATION #8 ****************************************
 epoch: 0, train_loss: 1.3442, test_loss: 1.1509, test_f1: 0.3843
 epoch: 1, train_loss: 1.0054, test_loss: 0.9738, test_f1: 0.5039
 epoch: 2, train_loss: 0.9735, test_loss: 0.9764, test_f1: 0.5064
 epoch: 3, train_loss: 0.9443, test_loss: 0.9634, test_f1: 0.5219
 epoch: 4, train_loss: 0.9295, test_loss: 0.9178, test_f1: 0.5189
 epoch: 5, train_loss: 0.9086, test_loss: 0.9094, test_f1: 0.5366
 epoch: 6, train_loss: 0.8711, test_loss: 0.8510, test_f1: 0.5554
 epoch: 7, train_loss: 0.8541, test_loss: 0.8032, test_f1: 0.5913
 epoch: 8, train_loss: 0.8387, test_loss: 0.8646, test_f1: 0.5765
 epoch: 9, train_loss: 0.8237, test_loss: 0.8172, test_f1: 0.5363
 epoch: 10, train_loss: 0.8071, test_loss: 0.8079, test_f1: 0.5477
 epoch: 11, train_loss: 0.7939, test_loss: 0.8064, test_f1: 0.6006
 epoch: 12, train_loss: 0.7720, test_loss: 0.7706, test_f1: 0.5971
 epoch: 13, train_loss: 0.7711, test_loss: 0.8096, test_f1: 0.6216
 epoch: 14, train_loss: 0.7607, test_loss: 0.7914, test_f1: 0.6167
 epoch: 15, train_loss: 0.7686, test_loss: 0.8159, test_f1: 0.5810
 epoch: 16, train_loss: 0.7466, test_loss: 0.7452, test_f1: 0.6314
 epoch: 17, train_loss: 0.7218, test_loss: 0.7501, test_f1: 0.6192
 epoch: 18, train_loss: 0.7130, test_loss: 0.7793, test_f1: 0.6163
 epoch: 19, train_loss: 0.7106, test_loss: 0.7640, test_f1: 0.6465
 epoch: 20, train_loss: 0.7067, test_loss: 0.7868, test_f1: 0.6121
 epoch: 21, train_loss: 0.6956, test_loss: 0.7398, test_f1: 0.6510
 epoch: 22, train_loss: 0.6775, test_loss: 0.7518, test_f1: 0.6344
 epoch: 23, train_loss: 0.6654, test_loss: 0.8188, test_f1: 0.6448
 epoch: 24, train_loss: 0.6893, test_loss: 0.7523, test_f1: 0.6491
 epoch: 25, train_loss: 0.6550, test_loss: 0.7088, test_f1: 0.6525
 epoch: 26, train_loss: 0.6575, test_loss: 0.7189, test_f1: 0.6575
 epoch: 27, train_loss: 0.6343, test_loss: 0.7806, test_f1: 0.6335
 epoch: 28, train_loss: 0.6205, test_loss: 0.8640, test_f1: 0.6500
 epoch: 29, train_loss: 0.6242, test_loss: 0.7686, test_f1: 0.6477
 epoch: 30, train_loss: 0.6265, test_loss: 0.7847, test_f1: 0.6296
 epoch: 31, train_loss: 0.6032, test_loss: 0.8111, test_f1: 0.6297
 epoch: 32, train_loss: 0.5978, test_loss: 0.7649, test_f1: 0.6225
 epoch: 33, train_loss: 0.6068, test_loss: 0.8505, test_f1: 0.6344
 epoch: 34, train_loss: 0.6079, test_loss: 0.7275, test_f1: 0.6865
 epoch: 35, train_loss: 0.5749, test_loss: 0.7698, test_f1: 0.6839
 epoch: 36, train_loss: 0.5707, test_loss: 0.7505, test_f1: 0.6974
 epoch: 37, train_loss: 0.5748, test_loss: 0.7776, test_f1: 0.6719
 epoch: 38, train_loss: 0.5400, test_loss: 0.7608, test_f1: 0.6900
 epoch: 39, train_loss: 0.5416, test_loss: 0.8067, test_f1: 0.6513
 epoch: 40, train_loss: 0.5514, test_loss: 0.8517, test_f1: 0.6569
 epoch: 41, train_loss: 0.5648, test_loss: 0.7505, test_f1: 0.7032
 epoch: 42, train_loss: 0.5328, test_loss: 0.7752, test_f1: 0.6913
 epoch: 43, train_loss: 0.5372, test_loss: 0.8608, test_f1: 0.6958
 epoch: 44, train_loss: 0.5431, test_loss: 0.8546, test_f1: 0.6502
 epoch: 45, train_loss: 0.5312, test_loss: 0.8463, test_f1: 0.6784
 epoch: 46, train_loss: 0.5002, test_loss: 0.7835, test_f1: 0.6755
 epoch: 47, train_loss: 0.5188, test_loss: 0.8452, test_f1: 0.6597
 epoch: 48, train_loss: 0.4901, test_loss: 0.7697, test_f1: 0.6787
 epoch: 49, train_loss: 0.4964, test_loss: 0.9126, test_f1: 0.6662
 epoch: 50, train_loss: 0.5039, test_loss: 0.8052, test_f1: 0.6845
 epoch: 51, train_loss: 0.4669, test_loss: 0.8055, test_f1: 0.7012
 epoch: 52, train_loss: 0.4560, test_loss: 0.7999, test_f1: 0.7038
 epoch: 53, train_loss: 0.4384, test_loss: 0.8550, test_f1: 0.6657
 epoch: 54, train_loss: 0.4167, test_loss: 0.8499, test_f1: 0.6805
 epoch: 55, train_loss: 0.3942, test_loss: 0.9641, test_f1: 0.6832
 epoch: 56, train_loss: 0.4118, test_loss: 0.9535, test_f1: 0.6607
 epoch: 57, train_loss: 0.4008, test_loss: 0.8866, test_f1: 0.6878
 epoch: 58, train_loss: 0.4233, test_loss: 0.9687, test_f1: 0.6636
 epoch: 59, train_loss: 0.4057, test_loss: 0.8711, test_f1: 0.6876
 epoch: 60, train_loss: 0.3999, test_loss: 0.9175, test_f1: 0.6911
 epoch: 61, train_loss: 0.3907, test_loss: 0.9495, test_f1: 0.6807
 epoch: 62, train_loss: 0.3799, test_loss: 0.8938, test_f1: 0.7033
 epoch: 63, train_loss: 0.3729, test_loss: 0.9663, test_f1: 0.6946
 epoch: 64, train_loss: 0.3733, test_loss: 1.0165, test_f1: 0.6961
 epoch: 65, train_loss: 0.3789, test_loss: 0.9972, test_f1: 0.6716
 epoch: 66, train_loss: 0.3818, test_loss: 0.9985, test_f1: 0.6887
 epoch: 67, train_loss: 0.3728, test_loss: 1.0536, test_f1: 0.6800
 epoch: 68, train_loss: 0.3647, test_loss: 1.0398, test_f1: 0.6667
 epoch: 69, train_loss: 0.3609, test_loss: 1.0670, test_f1: 0.7021
 epoch: 70, train_loss: 0.3436, test_loss: 1.0412, test_f1: 0.6831
 epoch: 71, train_loss: 0.3413, test_loss: 1.0376, test_f1: 0.6788
 epoch: 72, train_loss: 0.3535, test_loss: 0.9386, test_f1: 0.6964
 epoch: 73, train_loss: 0.3417, test_loss: 1.0550, test_f1: 0.6856
 epoch: 74, train_loss: 0.3417, test_loss: 1.0668, test_f1: 0.6721
 epoch: 75, train_loss: 0.3569, test_loss: 1.0435, test_f1: 0.6875
 epoch: 76, train_loss: 0.3495, test_loss: 1.1110, test_f1: 0.6597
 epoch: 77, train_loss: 0.3302, test_loss: 1.1873, test_f1: 0.6730
 epoch: 78, train_loss: 0.3379, test_loss: 1.1785, test_f1: 0.6725
 epoch: 79, train_loss: 0.3429, test_loss: 1.0899, test_f1: 0.6924
 epoch: 80, train_loss: 0.3278, test_loss: 1.0939, test_f1: 0.6654
 epoch: 81, train_loss: 0.3239, test_loss: 1.1775, test_f1: 0.6654
 epoch: 82, train_loss: 0.3187, test_loss: 1.1156, test_f1: 0.6840
 epoch: 83, train_loss: 0.3168, test_loss: 1.1727, test_f1: 0.6709
 epoch: 84, train_loss: 0.3222, test_loss: 1.2266, test_f1: 0.6745
 epoch: 85, train_loss: 0.3370, test_loss: 1.1655, test_f1: 0.6777
 epoch: 86, train_loss: 0.3319, test_loss: 1.0537, test_f1: 0.6998
 epoch: 87, train_loss: 0.3288, test_loss: 1.1993, test_f1: 0.6792
 epoch: 88, train_loss: 0.3253, test_loss: 1.2645, test_f1: 0.6728
 epoch: 89, train_loss: 0.3162, test_loss: 1.2129, test_f1: 0.6763
 epoch: 90, train_loss: 0.3085, test_loss: 1.2515, test_f1: 0.6775
 epoch: 91, train_loss: 0.3098, test_loss: 1.2097, test_f1: 0.6792
 epoch: 92, train_loss: 0.3006, test_loss: 1.2358, test_f1: 0.6765
 epoch: 93, train_loss: 0.2947, test_loss: 1.1899, test_f1: 0.6834
 epoch: 94, train_loss: 0.2998, test_loss: 1.2155, test_f1: 0.6761
 epoch: 95, train_loss: 0.3159, test_loss: 1.2422, test_f1: 0.6761
 epoch: 96, train_loss: 0.2872, test_loss: 1.4331, test_f1: 0.6539
 epoch: 97, train_loss: 0.2902, test_loss: 1.3764, test_f1: 0.6627
 epoch: 98, train_loss: 0.3083, test_loss: 1.3623, test_f1: 0.6744
 epoch: 99, train_loss: 0.2840, test_loss: 1.3661, test_f1: 0.6609
##################ITERATION #9 ****************************************
 epoch: 0, train_loss: 1.3985, test_loss: 1.1517, test_f1: 0.3630
 epoch: 1, train_loss: 1.0089, test_loss: 0.9897, test_f1: 0.5007
 epoch: 2, train_loss: 0.9680, test_loss: 0.9659, test_f1: 0.5259
 epoch: 3, train_loss: 0.9485, test_loss: 0.9677, test_f1: 0.5270
 epoch: 4, train_loss: 0.9196, test_loss: 0.9517, test_f1: 0.5119
 epoch: 5, train_loss: 0.8955, test_loss: 0.9280, test_f1: 0.5368
 epoch: 6, train_loss: 0.8859, test_loss: 0.9761, test_f1: 0.4998
 epoch: 7, train_loss: 0.8854, test_loss: 0.9381, test_f1: 0.5551
 epoch: 8, train_loss: 0.8525, test_loss: 0.8413, test_f1: 0.5471
 epoch: 9, train_loss: 0.8329, test_loss: 0.8886, test_f1: 0.5764
 epoch: 10, train_loss: 0.7981, test_loss: 0.8609, test_f1: 0.5699
 epoch: 11, train_loss: 0.8026, test_loss: 0.8899, test_f1: 0.5433
 epoch: 12, train_loss: 0.7823, test_loss: 0.8613, test_f1: 0.5704
 epoch: 13, train_loss: 0.7672, test_loss: 0.8502, test_f1: 0.5786
 epoch: 14, train_loss: 0.7588, test_loss: 0.8749, test_f1: 0.5560
 epoch: 15, train_loss: 0.7438, test_loss: 0.7563, test_f1: 0.6026
 epoch: 16, train_loss: 0.7373, test_loss: 0.7933, test_f1: 0.5975
 epoch: 17, train_loss: 0.7384, test_loss: 0.7857, test_f1: 0.5790
 epoch: 18, train_loss: 0.7091, test_loss: 0.7459, test_f1: 0.6193
 epoch: 19, train_loss: 0.7055, test_loss: 0.7432, test_f1: 0.6195
 epoch: 20, train_loss: 0.6790, test_loss: 0.7244, test_f1: 0.6325
 epoch: 21, train_loss: 0.6837, test_loss: 0.7593, test_f1: 0.6305
 epoch: 22, train_loss: 0.6702, test_loss: 0.8422, test_f1: 0.6153
 epoch: 23, train_loss: 0.6606, test_loss: 0.7491, test_f1: 0.6574
 epoch: 24, train_loss: 0.6543, test_loss: 0.7304, test_f1: 0.6323
 epoch: 25, train_loss: 0.6527, test_loss: 0.8686, test_f1: 0.6526
 epoch: 26, train_loss: 0.6414, test_loss: 0.7780, test_f1: 0.6635
 epoch: 27, train_loss: 0.6420, test_loss: 0.7935, test_f1: 0.6497
 epoch: 28, train_loss: 0.6300, test_loss: 0.8585, test_f1: 0.6282
 epoch: 29, train_loss: 0.6291, test_loss: 0.7116, test_f1: 0.6522
 epoch: 30, train_loss: 0.6305, test_loss: 0.7768, test_f1: 0.6362
 epoch: 31, train_loss: 0.6347, test_loss: 0.7761, test_f1: 0.6438
 epoch: 32, train_loss: 0.6047, test_loss: 0.7762, test_f1: 0.6491
 epoch: 33, train_loss: 0.5807, test_loss: 0.7451, test_f1: 0.6383
 epoch: 34, train_loss: 0.5817, test_loss: 0.7668, test_f1: 0.6399
 epoch: 35, train_loss: 0.5751, test_loss: 0.8018, test_f1: 0.6387
 epoch: 36, train_loss: 0.5652, test_loss: 0.7437, test_f1: 0.6928
 epoch: 37, train_loss: 0.5539, test_loss: 0.8025, test_f1: 0.6830
 epoch: 38, train_loss: 0.5796, test_loss: 0.7596, test_f1: 0.6518
 epoch: 39, train_loss: 0.5438, test_loss: 0.7458, test_f1: 0.6703
 epoch: 40, train_loss: 0.5594, test_loss: 0.8031, test_f1: 0.6473
 epoch: 41, train_loss: 0.5530, test_loss: 0.8121, test_f1: 0.6325
 epoch: 42, train_loss: 0.5416, test_loss: 0.7845, test_f1: 0.6704
 epoch: 43, train_loss: 0.5332, test_loss: 0.8232, test_f1: 0.6693
 epoch: 44, train_loss: 0.5321, test_loss: 0.7933, test_f1: 0.6656
 epoch: 45, train_loss: 0.4999, test_loss: 0.8154, test_f1: 0.6574
 epoch: 46, train_loss: 0.5150, test_loss: 0.8773, test_f1: 0.6793
 epoch: 47, train_loss: 0.4972, test_loss: 0.7693, test_f1: 0.6668
 epoch: 48, train_loss: 0.5056, test_loss: 0.8071, test_f1: 0.6807
 epoch: 49, train_loss: 0.4957, test_loss: 0.7893, test_f1: 0.7160
 epoch: 50, train_loss: 0.4955, test_loss: 0.7968, test_f1: 0.6864
 epoch: 51, train_loss: 0.4491, test_loss: 0.8684, test_f1: 0.6868
 epoch: 52, train_loss: 0.4353, test_loss: 0.8992, test_f1: 0.6505
 epoch: 53, train_loss: 0.4399, test_loss: 0.8880, test_f1: 0.7003
 epoch: 54, train_loss: 0.4144, test_loss: 0.9375, test_f1: 0.6930
 epoch: 55, train_loss: 0.4123, test_loss: 0.9164, test_f1: 0.7037
 epoch: 56, train_loss: 0.4030, test_loss: 0.9227, test_f1: 0.6854
 epoch: 57, train_loss: 0.3971, test_loss: 0.9144, test_f1: 0.6972
 epoch: 58, train_loss: 0.4027, test_loss: 0.9489, test_f1: 0.6767
 epoch: 59, train_loss: 0.4001, test_loss: 1.0059, test_f1: 0.6966
 epoch: 60, train_loss: 0.3966, test_loss: 0.9403, test_f1: 0.6934
 epoch: 61, train_loss: 0.3904, test_loss: 0.9660, test_f1: 0.6731
 epoch: 62, train_loss: 0.3805, test_loss: 1.0095, test_f1: 0.6992
 epoch: 63, train_loss: 0.3814, test_loss: 1.0045, test_f1: 0.6650
 epoch: 64, train_loss: 0.3758, test_loss: 1.0015, test_f1: 0.6804
 epoch: 65, train_loss: 0.3897, test_loss: 0.9729, test_f1: 0.6912
 epoch: 66, train_loss: 0.3648, test_loss: 1.0849, test_f1: 0.6700
 epoch: 67, train_loss: 0.3589, test_loss: 1.0392, test_f1: 0.6652
 epoch: 68, train_loss: 0.3597, test_loss: 0.9680, test_f1: 0.6992
 epoch: 69, train_loss: 0.3649, test_loss: 0.9465, test_f1: 0.6767
 epoch: 70, train_loss: 0.3798, test_loss: 1.0232, test_f1: 0.6744
 epoch: 71, train_loss: 0.3486, test_loss: 1.0216, test_f1: 0.6622
 epoch: 72, train_loss: 0.3432, test_loss: 1.1001, test_f1: 0.6568
 epoch: 73, train_loss: 0.3434, test_loss: 1.0893, test_f1: 0.6782
 epoch: 74, train_loss: 0.3347, test_loss: 1.1537, test_f1: 0.6717
 epoch: 75, train_loss: 0.3406, test_loss: 1.0428, test_f1: 0.6885
 epoch: 76, train_loss: 0.3554, test_loss: 1.0213, test_f1: 0.6697
 epoch: 77, train_loss: 0.3501, test_loss: 1.0317, test_f1: 0.6951
 epoch: 78, train_loss: 0.3445, test_loss: 1.1462, test_f1: 0.6741
 epoch: 79, train_loss: 0.3339, test_loss: 1.0569, test_f1: 0.6755
 epoch: 80, train_loss: 0.3265, test_loss: 1.1422, test_f1: 0.6779
 epoch: 81, train_loss: 0.3121, test_loss: 1.2008, test_f1: 0.6598
 epoch: 82, train_loss: 0.3147, test_loss: 1.0381, test_f1: 0.6780
 epoch: 83, train_loss: 0.3388, test_loss: 1.1664, test_f1: 0.6964
 epoch: 84, train_loss: 0.3060, test_loss: 1.1721, test_f1: 0.6641
 epoch: 85, train_loss: 0.3025, test_loss: 1.3428, test_f1: 0.6755
 epoch: 86, train_loss: 0.3166, test_loss: 1.1892, test_f1: 0.6521
 epoch: 87, train_loss: 0.3104, test_loss: 1.3695, test_f1: 0.6587
 epoch: 88, train_loss: 0.3187, test_loss: 1.2116, test_f1: 0.6662
 epoch: 89, train_loss: 0.3026, test_loss: 1.3187, test_f1: 0.6547
 epoch: 90, train_loss: 0.3126, test_loss: 1.2418, test_f1: 0.6428
 epoch: 91, train_loss: 0.2887, test_loss: 1.3862, test_f1: 0.6581
 epoch: 92, train_loss: 0.2943, test_loss: 1.2792, test_f1: 0.6675
 epoch: 93, train_loss: 0.2948, test_loss: 1.3418, test_f1: 0.6508
 epoch: 94, train_loss: 0.2987, test_loss: 1.1669, test_f1: 0.6601
 epoch: 95, train_loss: 0.2968, test_loss: 1.2655, test_f1: 0.6506
 epoch: 96, train_loss: 0.2976, test_loss: 1.3178, test_f1: 0.6618
 epoch: 97, train_loss: 0.2860, test_loss: 1.2518, test_f1: 0.6734
 epoch: 98, train_loss: 0.2734, test_loss: 1.3824, test_f1: 0.6633
 epoch: 99, train_loss: 0.2771, test_loss: 1.2455, test_f1: 0.6708

Training completed in 708.62 seconds
Best F1: 0.7224 at epoch 42
Mean F1 across iterations: 0.7039  0.0112
========================FINAL RESULTS================================
FEGIN weighted F1: 0.7224  0.0112
python main.py --data ltspice_examples --representation component_pin_net --model FEGIN --layers 4 --hiddens 64 --batch_size 64 --lr 0.001 --emb_size 128 --epochs 100 --save_appendix component_pin_net_L4_H64_BS64_LR0.001_E128 --no_val
-----



STDERR:
  File "main.py", line 370, in <module>
    main()
  File "main.py", line 254, in main
    dataset = dataset_class(
  File "/home/philip/projects/ltspice_examples_code_repo/Circuit-Completion-Using-GNNs/component_classification_with_link_prediction_head/evaluation/FEGIN/kernel/circuit_datasets.py", line 15, in __init__
    self.data, self.slices = torch.load(self.processed_paths[0])
  File "/home/philip/.local/lib/python3.8/site-packages/torch/serialization.py", line 1040, in load
    warnings.warn(
  File "/usr/lib/python3.8/warnings.py", line 109, in _showwarnmsg
    sw(msg.message, msg.category, msg.filename, msg.lineno,
  File "main.py", line 47, in warn_with_traceback
    traceback.print_stack(file=log)
/home/philip/projects/ltspice_examples_code_repo/Circuit-Completion-Using-GNNs/component_classification_with_link_prediction_head/evaluation/FEGIN/kernel/circuit_datasets.py:15: FutureWarning: You are using `torch.load` with `weights_only=False` (the current default value), which uses the default pickle module implicitly. It is possible to construct malicious pickle data which will execute arbitrary code during unpickling (See https://github.com/pytorch/pytorch/blob/main/SECURITY.md#untrusted-models for more details). In a future release, the default value for `weights_only` will be flipped to `True`. This limits the functions that could be executed during unpickling. Arbitrary objects will no longer be allowed to be loaded via this mode unless they are explicitly allowlisted by the user via `torch.serialization.add_safe_globals`. We recommend you start setting `weights_only=True` for any use case where you don't have full control of the loaded file. Please open an issue on GitHub for any issues related to this experimental feature.
  self.data, self.slices = torch.load(self.processed_paths[0])
