STDOUT:
Results will be saved in /home/philip/projects/ltspice_examples_code_repo/Circuit-Completion-Using-GNNs/component_classification_with_link_prediction_head/evaluation/FEGIN/results/model_FEGIN_dataset_ltspice_examples
Command line input: python main.py --data ltspice_examples --representation component_pin_net --model FEGIN --layers 2 --hiddens 128 --batch_size 32 --lr 0.01 --emb_size 128 --epochs 100 --save_appendix component_pin_net_L2_H128_BS32_LR0.01_E128 --no_val
 is saved.
-----
ltspice_examples - FEGIN
Using 2 layers, 128 hidden units, h = 2
Loading component_pin_net representation dataset
ENTERED
Training FEGIN on component_pin_net representation
Train: 3558, Test: 846
##################ITERATION #0 ****************************************
 epoch: 0, train_loss: 1.1341, test_loss: 1.0550, test_f1: 0.4481
 epoch: 1, train_loss: 1.0402, test_loss: 0.9998, test_f1: 0.4475
 epoch: 2, train_loss: 0.9862, test_loss: 1.0085, test_f1: 0.4486
 epoch: 3, train_loss: 0.9754, test_loss: 1.0379, test_f1: 0.4974
 epoch: 4, train_loss: 0.9474, test_loss: 0.9840, test_f1: 0.5058
 epoch: 5, train_loss: 0.9513, test_loss: 0.9240, test_f1: 0.5473
 epoch: 6, train_loss: 0.9493, test_loss: 0.9312, test_f1: 0.4985
 epoch: 7, train_loss: 0.9130, test_loss: 1.0484, test_f1: 0.4890
 epoch: 8, train_loss: 0.9033, test_loss: 0.9300, test_f1: 0.5031
 epoch: 9, train_loss: 0.9015, test_loss: 0.8870, test_f1: 0.5537
 epoch: 10, train_loss: 0.8880, test_loss: 0.9140, test_f1: 0.5786
 epoch: 11, train_loss: 0.8869, test_loss: 1.0712, test_f1: 0.5053
 epoch: 12, train_loss: 0.9041, test_loss: 0.9595, test_f1: 0.5035
 epoch: 13, train_loss: 0.8644, test_loss: 0.9835, test_f1: 0.5355
 epoch: 14, train_loss: 0.8695, test_loss: 0.8682, test_f1: 0.5562
 epoch: 15, train_loss: 0.8602, test_loss: 0.8367, test_f1: 0.5621
 epoch: 16, train_loss: 0.8504, test_loss: 1.0462, test_f1: 0.5302
 epoch: 17, train_loss: 0.8301, test_loss: 1.0904, test_f1: 0.4981
 epoch: 18, train_loss: 0.8439, test_loss: 0.9701, test_f1: 0.5200
 epoch: 19, train_loss: 0.8243, test_loss: 0.8869, test_f1: 0.5574
 epoch: 20, train_loss: 0.8201, test_loss: 0.8647, test_f1: 0.5693
 epoch: 21, train_loss: 0.8006, test_loss: 1.0786, test_f1: 0.5386
 epoch: 22, train_loss: 0.7983, test_loss: 1.0211, test_f1: 0.5923
 epoch: 23, train_loss: 0.7986, test_loss: 0.8359, test_f1: 0.6395
 epoch: 24, train_loss: 0.7782, test_loss: 1.1664, test_f1: 0.5457
 epoch: 25, train_loss: 0.7754, test_loss: 0.8197, test_f1: 0.6461
 epoch: 26, train_loss: 0.7886, test_loss: 0.8016, test_f1: 0.5784
 epoch: 27, train_loss: 0.7592, test_loss: 0.7885, test_f1: 0.6353
 epoch: 28, train_loss: 0.7433, test_loss: 0.9573, test_f1: 0.5727
 epoch: 29, train_loss: 0.7707, test_loss: 0.8913, test_f1: 0.5876
 epoch: 30, train_loss: 0.7455, test_loss: 0.8319, test_f1: 0.6431
 epoch: 31, train_loss: 0.7260, test_loss: 0.8230, test_f1: 0.6340
 epoch: 32, train_loss: 0.7292, test_loss: 0.9099, test_f1: 0.6578
 epoch: 33, train_loss: 0.7138, test_loss: 0.8116, test_f1: 0.6461
 epoch: 34, train_loss: 0.7237, test_loss: 0.9121, test_f1: 0.6236
 epoch: 35, train_loss: 0.6874, test_loss: 0.8605, test_f1: 0.6436
 epoch: 36, train_loss: 0.7080, test_loss: 0.9542, test_f1: 0.6185
 epoch: 37, train_loss: 0.7126, test_loss: 0.8580, test_f1: 0.6403
 epoch: 38, train_loss: 0.6880, test_loss: 0.8553, test_f1: 0.5986
 epoch: 39, train_loss: 0.6876, test_loss: 1.0302, test_f1: 0.6130
 epoch: 40, train_loss: 0.7128, test_loss: 0.8196, test_f1: 0.6162
 epoch: 41, train_loss: 0.6855, test_loss: 0.9470, test_f1: 0.6152
 epoch: 42, train_loss: 0.7108, test_loss: 1.1537, test_f1: 0.6646
 epoch: 43, train_loss: 0.6968, test_loss: 0.8774, test_f1: 0.6101
 epoch: 44, train_loss: 0.6757, test_loss: 0.9846, test_f1: 0.6520
 epoch: 45, train_loss: 0.6706, test_loss: 1.0613, test_f1: 0.6356
 epoch: 46, train_loss: 0.6568, test_loss: 0.8811, test_f1: 0.6323
 epoch: 47, train_loss: 0.6519, test_loss: 0.8698, test_f1: 0.6768
 epoch: 48, train_loss: 0.6673, test_loss: 1.1720, test_f1: 0.6278
 epoch: 49, train_loss: 0.6463, test_loss: 0.9195, test_f1: 0.6040
 epoch: 50, train_loss: 0.6641, test_loss: 0.8483, test_f1: 0.5600
 epoch: 51, train_loss: 0.6045, test_loss: 0.7591, test_f1: 0.6703
 epoch: 52, train_loss: 0.5892, test_loss: 0.8329, test_f1: 0.6480
 epoch: 53, train_loss: 0.5856, test_loss: 0.8274, test_f1: 0.6575
 epoch: 54, train_loss: 0.5754, test_loss: 0.7651, test_f1: 0.6773
 epoch: 55, train_loss: 0.5680, test_loss: 0.8523, test_f1: 0.6638
 epoch: 56, train_loss: 0.5503, test_loss: 0.9352, test_f1: 0.6574
 epoch: 57, train_loss: 0.5593, test_loss: 0.9705, test_f1: 0.6572
 epoch: 58, train_loss: 0.5687, test_loss: 0.9443, test_f1: 0.6413
 epoch: 59, train_loss: 0.5517, test_loss: 0.8814, test_f1: 0.6730
 epoch: 60, train_loss: 0.5449, test_loss: 0.8909, test_f1: 0.6848
 epoch: 61, train_loss: 0.5326, test_loss: 0.9394, test_f1: 0.6689
 epoch: 62, train_loss: 0.5387, test_loss: 0.8625, test_f1: 0.6758
 epoch: 63, train_loss: 0.5132, test_loss: 0.8425, test_f1: 0.6677
 epoch: 64, train_loss: 0.5117, test_loss: 0.9219, test_f1: 0.6797
 epoch: 65, train_loss: 0.5175, test_loss: 0.9561, test_f1: 0.6798
 epoch: 66, train_loss: 0.5327, test_loss: 0.7894, test_f1: 0.6648
 epoch: 67, train_loss: 0.5152, test_loss: 0.8694, test_f1: 0.6894
 epoch: 68, train_loss: 0.5068, test_loss: 0.8600, test_f1: 0.6701
 epoch: 69, train_loss: 0.5179, test_loss: 0.8221, test_f1: 0.6538
 epoch: 70, train_loss: 0.5025, test_loss: 0.8201, test_f1: 0.6752
 epoch: 71, train_loss: 0.5029, test_loss: 0.8613, test_f1: 0.6897
 epoch: 72, train_loss: 0.4873, test_loss: 0.8989, test_f1: 0.6955
 epoch: 73, train_loss: 0.4995, test_loss: 0.9230, test_f1: 0.6834
 epoch: 74, train_loss: 0.4856, test_loss: 0.9531, test_f1: 0.6651
 epoch: 75, train_loss: 0.4855, test_loss: 0.8617, test_f1: 0.7124
 epoch: 76, train_loss: 0.4801, test_loss: 0.9636, test_f1: 0.6937
 epoch: 77, train_loss: 0.4809, test_loss: 0.8841, test_f1: 0.6992
 epoch: 78, train_loss: 0.4707, test_loss: 0.9308, test_f1: 0.6999
 epoch: 79, train_loss: 0.4722, test_loss: 1.0845, test_f1: 0.6652
 epoch: 80, train_loss: 0.4579, test_loss: 1.0649, test_f1: 0.6793
 epoch: 81, train_loss: 0.4798, test_loss: 0.9678, test_f1: 0.6760
 epoch: 82, train_loss: 0.4573, test_loss: 0.9559, test_f1: 0.6626
 epoch: 83, train_loss: 0.4764, test_loss: 0.9312, test_f1: 0.6839
 epoch: 84, train_loss: 0.4729, test_loss: 1.0375, test_f1: 0.6656
 epoch: 85, train_loss: 0.4682, test_loss: 1.0654, test_f1: 0.6815
 epoch: 86, train_loss: 0.4353, test_loss: 1.1132, test_f1: 0.6960
 epoch: 87, train_loss: 0.4448, test_loss: 1.2270, test_f1: 0.6796
 epoch: 88, train_loss: 0.4539, test_loss: 1.0664, test_f1: 0.7021
 epoch: 89, train_loss: 0.4476, test_loss: 1.2454, test_f1: 0.7085
 epoch: 90, train_loss: 0.4303, test_loss: 0.9996, test_f1: 0.6960
 epoch: 91, train_loss: 0.4315, test_loss: 1.1019, test_f1: 0.6769
 epoch: 92, train_loss: 0.4469, test_loss: 1.1400, test_f1: 0.6858
 epoch: 93, train_loss: 0.4547, test_loss: 1.2678, test_f1: 0.6792
 epoch: 94, train_loss: 0.4177, test_loss: 1.2428, test_f1: 0.6874
 epoch: 95, train_loss: 0.4196, test_loss: 1.1203, test_f1: 0.6567
 epoch: 96, train_loss: 0.4172, test_loss: 1.2064, test_f1: 0.6659
 epoch: 97, train_loss: 0.4988, test_loss: 1.0741, test_f1: 0.6718
 epoch: 98, train_loss: 0.4512, test_loss: 1.0289, test_f1: 0.6726
 epoch: 99, train_loss: 0.4226, test_loss: 1.3447, test_f1: 0.6851
##################ITERATION #1 ****************************************
 epoch: 0, train_loss: 1.0983, test_loss: 1.1004, test_f1: 0.3466
 epoch: 1, train_loss: 1.0031, test_loss: 0.9825, test_f1: 0.5001
 epoch: 2, train_loss: 0.9841, test_loss: 1.0016, test_f1: 0.4912
 epoch: 3, train_loss: 0.9732, test_loss: 1.0702, test_f1: 0.4899
 epoch: 4, train_loss: 0.9445, test_loss: 0.9346, test_f1: 0.5044
 epoch: 5, train_loss: 0.9322, test_loss: 0.9339, test_f1: 0.5132
 epoch: 6, train_loss: 0.9131, test_loss: 0.9126, test_f1: 0.5110
 epoch: 7, train_loss: 0.8918, test_loss: 0.9823, test_f1: 0.5169
 epoch: 8, train_loss: 0.8898, test_loss: 0.8942, test_f1: 0.5220
 epoch: 9, train_loss: 0.8724, test_loss: 1.0482, test_f1: 0.4900
 epoch: 10, train_loss: 0.8716, test_loss: 0.8531, test_f1: 0.5278
 epoch: 11, train_loss: 0.8613, test_loss: 0.8306, test_f1: 0.5641
 epoch: 12, train_loss: 0.8428, test_loss: 1.1757, test_f1: 0.4453
 epoch: 13, train_loss: 0.8753, test_loss: 0.8411, test_f1: 0.5367
 epoch: 14, train_loss: 0.8321, test_loss: 0.8234, test_f1: 0.5764
 epoch: 15, train_loss: 0.8208, test_loss: 0.9721, test_f1: 0.5293
 epoch: 16, train_loss: 0.8037, test_loss: 0.9435, test_f1: 0.5245
 epoch: 17, train_loss: 0.8296, test_loss: 0.8319, test_f1: 0.5468
 epoch: 18, train_loss: 0.8015, test_loss: 0.7751, test_f1: 0.5530
 epoch: 19, train_loss: 0.7964, test_loss: 0.9013, test_f1: 0.5696
 epoch: 20, train_loss: 0.8332, test_loss: 0.8394, test_f1: 0.5933
 epoch: 21, train_loss: 0.7730, test_loss: 0.8575, test_f1: 0.6003
 epoch: 22, train_loss: 0.7793, test_loss: 0.8241, test_f1: 0.5659
 epoch: 23, train_loss: 0.7824, test_loss: 0.9694, test_f1: 0.5813
 epoch: 24, train_loss: 0.7696, test_loss: 0.8526, test_f1: 0.5624
 epoch: 25, train_loss: 0.7834, test_loss: 0.8513, test_f1: 0.5607
 epoch: 26, train_loss: 0.7634, test_loss: 0.7848, test_f1: 0.5721
 epoch: 27, train_loss: 0.7579, test_loss: 1.2250, test_f1: 0.4099
 epoch: 28, train_loss: 0.7528, test_loss: 0.7880, test_f1: 0.5916
 epoch: 29, train_loss: 0.7477, test_loss: 0.7740, test_f1: 0.6320
 epoch: 30, train_loss: 0.7473, test_loss: 0.8389, test_f1: 0.6244
 epoch: 31, train_loss: 0.7375, test_loss: 0.8891, test_f1: 0.6211
 epoch: 32, train_loss: 0.7409, test_loss: 0.9486, test_f1: 0.6309
 epoch: 33, train_loss: 0.7472, test_loss: 0.7781, test_f1: 0.6437
 epoch: 34, train_loss: 0.7219, test_loss: 0.8218, test_f1: 0.5667
 epoch: 35, train_loss: 0.7338, test_loss: 0.9445, test_f1: 0.6102
 epoch: 36, train_loss: 0.7124, test_loss: 0.8172, test_f1: 0.5925
 epoch: 37, train_loss: 0.7154, test_loss: 0.7457, test_f1: 0.6345
 epoch: 38, train_loss: 0.6919, test_loss: 0.9508, test_f1: 0.5791
 epoch: 39, train_loss: 0.7105, test_loss: 0.7305, test_f1: 0.6258
 epoch: 40, train_loss: 0.6976, test_loss: 0.7660, test_f1: 0.6507
 epoch: 41, train_loss: 0.6990, test_loss: 0.8803, test_f1: 0.6360
 epoch: 42, train_loss: 0.6878, test_loss: 0.7947, test_f1: 0.6270
 epoch: 43, train_loss: 0.7546, test_loss: 0.8432, test_f1: 0.6073
 epoch: 44, train_loss: 0.7146, test_loss: 0.8193, test_f1: 0.6419
 epoch: 45, train_loss: 0.6966, test_loss: 0.7450, test_f1: 0.6412
 epoch: 46, train_loss: 0.6615, test_loss: 0.9380, test_f1: 0.6173
 epoch: 47, train_loss: 0.6831, test_loss: 0.8414, test_f1: 0.6035
 epoch: 48, train_loss: 0.6694, test_loss: 0.8367, test_f1: 0.5918
 epoch: 49, train_loss: 0.6878, test_loss: 0.7637, test_f1: 0.6386
 epoch: 50, train_loss: 0.6706, test_loss: 0.9769, test_f1: 0.6082
 epoch: 51, train_loss: 0.6264, test_loss: 0.8790, test_f1: 0.6591
 epoch: 52, train_loss: 0.6066, test_loss: 0.8815, test_f1: 0.6436
 epoch: 53, train_loss: 0.6073, test_loss: 0.9707, test_f1: 0.6573
 epoch: 54, train_loss: 0.6034, test_loss: 0.9290, test_f1: 0.6645
 epoch: 55, train_loss: 0.6129, test_loss: 0.9096, test_f1: 0.6370
 epoch: 56, train_loss: 0.5729, test_loss: 0.8667, test_f1: 0.6655
 epoch: 57, train_loss: 0.5876, test_loss: 0.8582, test_f1: 0.6625
 epoch: 58, train_loss: 0.5700, test_loss: 0.9531, test_f1: 0.6287
 epoch: 59, train_loss: 0.5692, test_loss: 0.8993, test_f1: 0.6666
 epoch: 60, train_loss: 0.5856, test_loss: 0.8102, test_f1: 0.6667
 epoch: 61, train_loss: 0.5414, test_loss: 1.0355, test_f1: 0.6405
 epoch: 62, train_loss: 0.5463, test_loss: 0.9685, test_f1: 0.6667
 epoch: 63, train_loss: 0.5711, test_loss: 0.8659, test_f1: 0.6483
 epoch: 64, train_loss: 0.5630, test_loss: 0.8338, test_f1: 0.6637
 epoch: 65, train_loss: 0.5393, test_loss: 1.0056, test_f1: 0.6558
 epoch: 66, train_loss: 0.5487, test_loss: 1.1028, test_f1: 0.6163
 epoch: 67, train_loss: 0.5422, test_loss: 0.8743, test_f1: 0.6693
 epoch: 68, train_loss: 0.5309, test_loss: 1.0289, test_f1: 0.6945
 epoch: 69, train_loss: 0.5434, test_loss: 0.9775, test_f1: 0.6721
 epoch: 70, train_loss: 0.5387, test_loss: 1.0832, test_f1: 0.6475
 epoch: 71, train_loss: 0.5337, test_loss: 0.8596, test_f1: 0.6741
 epoch: 72, train_loss: 0.5201, test_loss: 0.8861, test_f1: 0.6437
 epoch: 73, train_loss: 0.5436, test_loss: 0.8418, test_f1: 0.6546
 epoch: 74, train_loss: 0.5328, test_loss: 1.0003, test_f1: 0.6722
 epoch: 75, train_loss: 0.5426, test_loss: 0.9712, test_f1: 0.6250
 epoch: 76, train_loss: 0.5260, test_loss: 0.9684, test_f1: 0.6525
 epoch: 77, train_loss: 0.5350, test_loss: 0.9608, test_f1: 0.6511
 epoch: 78, train_loss: 0.5314, test_loss: 0.9907, test_f1: 0.6809
 epoch: 79, train_loss: 0.5380, test_loss: 0.8878, test_f1: 0.6997
 epoch: 80, train_loss: 0.5165, test_loss: 0.9009, test_f1: 0.6754
 epoch: 81, train_loss: 0.5050, test_loss: 0.9203, test_f1: 0.6753
 epoch: 82, train_loss: 0.4952, test_loss: 0.9595, test_f1: 0.6693
 epoch: 83, train_loss: 0.5010, test_loss: 0.9409, test_f1: 0.6747
 epoch: 84, train_loss: 0.5070, test_loss: 0.9906, test_f1: 0.6695
 epoch: 85, train_loss: 0.5023, test_loss: 0.9623, test_f1: 0.6608
 epoch: 86, train_loss: 0.5109, test_loss: 1.0027, test_f1: 0.6707
 epoch: 87, train_loss: 0.4989, test_loss: 0.9285, test_f1: 0.6602
 epoch: 88, train_loss: 0.5167, test_loss: 0.9444, test_f1: 0.6664
 epoch: 89, train_loss: 0.4935, test_loss: 0.9313, test_f1: 0.6731
 epoch: 90, train_loss: 0.4886, test_loss: 0.9738, test_f1: 0.6778
 epoch: 91, train_loss: 0.4732, test_loss: 0.8623, test_f1: 0.6845
 epoch: 92, train_loss: 0.4746, test_loss: 0.9132, test_f1: 0.6819
 epoch: 93, train_loss: 0.4897, test_loss: 0.9841, test_f1: 0.7017
 epoch: 94, train_loss: 0.4670, test_loss: 1.0343, test_f1: 0.6749
 epoch: 95, train_loss: 0.4838, test_loss: 0.9772, test_f1: 0.6841
 epoch: 96, train_loss: 0.4588, test_loss: 1.1291, test_f1: 0.6828
 epoch: 97, train_loss: 0.4927, test_loss: 1.0776, test_f1: 0.6809
 epoch: 98, train_loss: 0.4525, test_loss: 1.0974, test_f1: 0.6819
 epoch: 99, train_loss: 0.4647, test_loss: 0.9321, test_f1: 0.6739
##################ITERATION #2 ****************************************
 epoch: 0, train_loss: 1.1127, test_loss: 1.1966, test_f1: 0.3271
 epoch: 1, train_loss: 1.0188, test_loss: 1.0535, test_f1: 0.4423
 epoch: 2, train_loss: 0.9762, test_loss: 1.0814, test_f1: 0.4513
 epoch: 3, train_loss: 0.9581, test_loss: 1.1004, test_f1: 0.4723
 epoch: 4, train_loss: 0.9523, test_loss: 0.9990, test_f1: 0.4648
 epoch: 5, train_loss: 0.9242, test_loss: 0.9043, test_f1: 0.5137
 epoch: 6, train_loss: 0.9113, test_loss: 0.9635, test_f1: 0.4782
 epoch: 7, train_loss: 0.9032, test_loss: 0.9351, test_f1: 0.5052
 epoch: 8, train_loss: 0.8944, test_loss: 0.9376, test_f1: 0.5074
 epoch: 9, train_loss: 0.8814, test_loss: 0.9831, test_f1: 0.5213
 epoch: 10, train_loss: 0.8698, test_loss: 0.9235, test_f1: 0.5295
 epoch: 11, train_loss: 0.8598, test_loss: 0.8506, test_f1: 0.6175
 epoch: 12, train_loss: 0.8677, test_loss: 0.8853, test_f1: 0.5256
 epoch: 13, train_loss: 0.8445, test_loss: 0.8158, test_f1: 0.5249
 epoch: 14, train_loss: 0.8403, test_loss: 0.8170, test_f1: 0.5371
 epoch: 15, train_loss: 0.8363, test_loss: 0.8523, test_f1: 0.5345
 epoch: 16, train_loss: 0.8221, test_loss: 0.8205, test_f1: 0.5525
 epoch: 17, train_loss: 0.8416, test_loss: 0.8440, test_f1: 0.5423
 epoch: 18, train_loss: 0.8318, test_loss: 0.9343, test_f1: 0.5630
 epoch: 19, train_loss: 0.8091, test_loss: 0.8178, test_f1: 0.5986
 epoch: 20, train_loss: 0.8178, test_loss: 0.8392, test_f1: 0.5385
 epoch: 21, train_loss: 0.8136, test_loss: 0.8548, test_f1: 0.6050
 epoch: 22, train_loss: 0.8145, test_loss: 0.8193, test_f1: 0.6031
 epoch: 23, train_loss: 0.8024, test_loss: 0.8062, test_f1: 0.5866
 epoch: 24, train_loss: 0.7855, test_loss: 0.9409, test_f1: 0.5423
 epoch: 25, train_loss: 0.7729, test_loss: 0.7376, test_f1: 0.6265
 epoch: 26, train_loss: 0.7820, test_loss: 0.8073, test_f1: 0.5420
 epoch: 27, train_loss: 0.7559, test_loss: 1.0428, test_f1: 0.5761
 epoch: 28, train_loss: 0.7810, test_loss: 0.8069, test_f1: 0.6369
 epoch: 29, train_loss: 0.7604, test_loss: 1.0820, test_f1: 0.4202
 epoch: 30, train_loss: 0.7614, test_loss: 0.7882, test_f1: 0.6214
 epoch: 31, train_loss: 0.7617, test_loss: 0.7930, test_f1: 0.5953
 epoch: 32, train_loss: 0.7479, test_loss: 0.8347, test_f1: 0.5613
 epoch: 33, train_loss: 0.7740, test_loss: 0.8104, test_f1: 0.5901
 epoch: 34, train_loss: 0.7379, test_loss: 0.8197, test_f1: 0.5321
 epoch: 35, train_loss: 0.7374, test_loss: 0.7615, test_f1: 0.6274
 epoch: 36, train_loss: 0.7254, test_loss: 0.7528, test_f1: 0.6315
 epoch: 37, train_loss: 0.7228, test_loss: 0.7480, test_f1: 0.6250
 epoch: 38, train_loss: 0.7219, test_loss: 0.7540, test_f1: 0.6338
 epoch: 39, train_loss: 0.7238, test_loss: 0.7436, test_f1: 0.6289
 epoch: 40, train_loss: 0.7096, test_loss: 0.7873, test_f1: 0.6488
 epoch: 41, train_loss: 0.7250, test_loss: 0.7335, test_f1: 0.6586
 epoch: 42, train_loss: 0.7074, test_loss: 0.8246, test_f1: 0.6413
 epoch: 43, train_loss: 0.6880, test_loss: 0.7390, test_f1: 0.6545
 epoch: 44, train_loss: 0.6962, test_loss: 0.7355, test_f1: 0.6217
 epoch: 45, train_loss: 0.6901, test_loss: 0.7124, test_f1: 0.6383
 epoch: 46, train_loss: 0.6926, test_loss: 0.7447, test_f1: 0.6310
 epoch: 47, train_loss: 0.6772, test_loss: 0.8154, test_f1: 0.6448
 epoch: 48, train_loss: 0.6737, test_loss: 0.7929, test_f1: 0.6377
 epoch: 49, train_loss: 0.6930, test_loss: 0.7356, test_f1: 0.6510
 epoch: 50, train_loss: 0.6670, test_loss: 0.7367, test_f1: 0.6350
 epoch: 51, train_loss: 0.6279, test_loss: 0.7761, test_f1: 0.6491
 epoch: 52, train_loss: 0.5964, test_loss: 0.7172, test_f1: 0.6658
 epoch: 53, train_loss: 0.5996, test_loss: 0.7697, test_f1: 0.6582
 epoch: 54, train_loss: 0.5900, test_loss: 0.7161, test_f1: 0.6354
 epoch: 55, train_loss: 0.5934, test_loss: 0.7806, test_f1: 0.6487
 epoch: 56, train_loss: 0.5654, test_loss: 0.7561, test_f1: 0.6583
 epoch: 57, train_loss: 0.5541, test_loss: 0.7651, test_f1: 0.6651
 epoch: 58, train_loss: 0.5491, test_loss: 0.8296, test_f1: 0.6277
 epoch: 59, train_loss: 0.5459, test_loss: 0.6985, test_f1: 0.6859
 epoch: 60, train_loss: 0.5805, test_loss: 0.7285, test_f1: 0.6547
 epoch: 61, train_loss: 0.5530, test_loss: 0.7433, test_f1: 0.6941
 epoch: 62, train_loss: 0.5521, test_loss: 0.7675, test_f1: 0.6674
 epoch: 63, train_loss: 0.5490, test_loss: 0.7795, test_f1: 0.6464
 epoch: 64, train_loss: 0.5386, test_loss: 0.7352, test_f1: 0.6674
 epoch: 65, train_loss: 0.5457, test_loss: 0.7446, test_f1: 0.7006
 epoch: 66, train_loss: 0.5228, test_loss: 0.7615, test_f1: 0.6721
 epoch: 67, train_loss: 0.5405, test_loss: 0.7862, test_f1: 0.6594
 epoch: 68, train_loss: 0.5143, test_loss: 0.6889, test_f1: 0.6671
 epoch: 69, train_loss: 0.5213, test_loss: 0.7618, test_f1: 0.6555
 epoch: 70, train_loss: 0.5011, test_loss: 0.7287, test_f1: 0.6701
 epoch: 71, train_loss: 0.5331, test_loss: 0.7719, test_f1: 0.6561
 epoch: 72, train_loss: 0.5265, test_loss: 0.7667, test_f1: 0.6449
 epoch: 73, train_loss: 0.5089, test_loss: 0.7615, test_f1: 0.6650
 epoch: 74, train_loss: 0.5185, test_loss: 0.6875, test_f1: 0.7012
 epoch: 75, train_loss: 0.4972, test_loss: 0.7276, test_f1: 0.6890
 epoch: 76, train_loss: 0.4968, test_loss: 0.7422, test_f1: 0.6643
 epoch: 77, train_loss: 0.4877, test_loss: 0.7582, test_f1: 0.6675
 epoch: 78, train_loss: 0.4815, test_loss: 0.7489, test_f1: 0.6916
 epoch: 79, train_loss: 0.4770, test_loss: 0.7604, test_f1: 0.6708
 epoch: 80, train_loss: 0.5046, test_loss: 0.7626, test_f1: 0.6706
 epoch: 81, train_loss: 0.4906, test_loss: 0.7424, test_f1: 0.6809
 epoch: 82, train_loss: 0.5012, test_loss: 0.8095, test_f1: 0.6479
 epoch: 83, train_loss: 0.4917, test_loss: 0.7831, test_f1: 0.6653
 epoch: 84, train_loss: 0.4780, test_loss: 0.7349, test_f1: 0.6805
 epoch: 85, train_loss: 0.4768, test_loss: 0.7823, test_f1: 0.6408
 epoch: 86, train_loss: 0.4581, test_loss: 0.8554, test_f1: 0.6811
 epoch: 87, train_loss: 0.4751, test_loss: 0.7421, test_f1: 0.7110
 epoch: 88, train_loss: 0.4612, test_loss: 0.8140, test_f1: 0.6872
 epoch: 89, train_loss: 0.4623, test_loss: 0.7545, test_f1: 0.6811
 epoch: 90, train_loss: 0.4643, test_loss: 0.7481, test_f1: 0.6659
 epoch: 91, train_loss: 0.4682, test_loss: 0.7171, test_f1: 0.6881
 epoch: 92, train_loss: 0.4700, test_loss: 0.7106, test_f1: 0.6707
 epoch: 93, train_loss: 0.4522, test_loss: 0.8457, test_f1: 0.6677
 epoch: 94, train_loss: 0.4536, test_loss: 0.8059, test_f1: 0.6945
 epoch: 95, train_loss: 0.4444, test_loss: 0.7412, test_f1: 0.6911
 epoch: 96, train_loss: 0.4507, test_loss: 0.8325, test_f1: 0.6738
 epoch: 97, train_loss: 0.4477, test_loss: 0.7735, test_f1: 0.6936
 epoch: 98, train_loss: 0.4846, test_loss: 0.6879, test_f1: 0.7013
 epoch: 99, train_loss: 0.4574, test_loss: 0.7169, test_f1: 0.6793
##################ITERATION #3 ****************************************
 epoch: 0, train_loss: 1.1265, test_loss: 1.1013, test_f1: 0.3906
 epoch: 1, train_loss: 1.0315, test_loss: 1.0674, test_f1: 0.4683
 epoch: 2, train_loss: 1.0006, test_loss: 1.0066, test_f1: 0.4924
 epoch: 3, train_loss: 0.9695, test_loss: 1.0456, test_f1: 0.4480
 epoch: 4, train_loss: 0.9630, test_loss: 0.9659, test_f1: 0.5160
 epoch: 5, train_loss: 0.9353, test_loss: 0.9703, test_f1: 0.5143
 epoch: 6, train_loss: 0.9359, test_loss: 0.9067, test_f1: 0.4909
 epoch: 7, train_loss: 0.9278, test_loss: 1.0662, test_f1: 0.4644
 epoch: 8, train_loss: 0.9042, test_loss: 0.9572, test_f1: 0.4966
 epoch: 9, train_loss: 0.9018, test_loss: 0.9720, test_f1: 0.5115
 epoch: 10, train_loss: 0.8845, test_loss: 0.9706, test_f1: 0.5104
 epoch: 11, train_loss: 0.8793, test_loss: 0.9720, test_f1: 0.5563
 epoch: 12, train_loss: 0.8732, test_loss: 0.8537, test_f1: 0.5082
 epoch: 13, train_loss: 0.8734, test_loss: 0.8694, test_f1: 0.5269
 epoch: 14, train_loss: 0.8591, test_loss: 0.8754, test_f1: 0.5132
 epoch: 15, train_loss: 0.8425, test_loss: 0.8585, test_f1: 0.5486
 epoch: 16, train_loss: 0.8490, test_loss: 0.9117, test_f1: 0.5196
 epoch: 17, train_loss: 0.8485, test_loss: 0.9102, test_f1: 0.5602
 epoch: 18, train_loss: 0.8387, test_loss: 0.8896, test_f1: 0.5298
 epoch: 19, train_loss: 0.8318, test_loss: 0.9764, test_f1: 0.5473
 epoch: 20, train_loss: 0.8323, test_loss: 0.8696, test_f1: 0.5346
 epoch: 21, train_loss: 0.8415, test_loss: 0.8651, test_f1: 0.5361
 epoch: 22, train_loss: 0.8139, test_loss: 0.8767, test_f1: 0.5534
 epoch: 23, train_loss: 0.8004, test_loss: 0.8693, test_f1: 0.5897
 epoch: 24, train_loss: 0.8028, test_loss: 0.8825, test_f1: 0.5815
 epoch: 25, train_loss: 0.8040, test_loss: 0.9409, test_f1: 0.5412
 epoch: 26, train_loss: 0.7977, test_loss: 0.8758, test_f1: 0.5644
 epoch: 27, train_loss: 0.7827, test_loss: 0.8354, test_f1: 0.5568
 epoch: 28, train_loss: 0.7564, test_loss: 0.8821, test_f1: 0.5186
 epoch: 29, train_loss: 0.7772, test_loss: 0.8112, test_f1: 0.5630
 epoch: 30, train_loss: 0.7596, test_loss: 0.8046, test_f1: 0.5697
 epoch: 31, train_loss: 0.7647, test_loss: 0.7600, test_f1: 0.5861
 epoch: 32, train_loss: 0.7605, test_loss: 0.8397, test_f1: 0.5867
 epoch: 33, train_loss: 0.7519, test_loss: 0.8133, test_f1: 0.5438
 epoch: 34, train_loss: 0.7594, test_loss: 0.8150, test_f1: 0.5879
 epoch: 35, train_loss: 0.7744, test_loss: 1.0080, test_f1: 0.5863
 epoch: 36, train_loss: 0.7616, test_loss: 0.9496, test_f1: 0.6064
 epoch: 37, train_loss: 0.7440, test_loss: 1.0098, test_f1: 0.5897
 epoch: 38, train_loss: 0.7450, test_loss: 0.9415, test_f1: 0.5771
 epoch: 39, train_loss: 0.7284, test_loss: 0.8494, test_f1: 0.5500
 epoch: 40, train_loss: 0.7378, test_loss: 0.9410, test_f1: 0.5925
 epoch: 41, train_loss: 0.7498, test_loss: 0.8380, test_f1: 0.5689
 epoch: 42, train_loss: 0.7245, test_loss: 1.0006, test_f1: 0.6050
 epoch: 43, train_loss: 0.7284, test_loss: 0.9170, test_f1: 0.5603
 epoch: 44, train_loss: 0.7142, test_loss: 0.8511, test_f1: 0.6069
 epoch: 45, train_loss: 0.7038, test_loss: 0.8653, test_f1: 0.5647
 epoch: 46, train_loss: 0.7321, test_loss: 0.8067, test_f1: 0.5860
 epoch: 47, train_loss: 0.6939, test_loss: 0.8983, test_f1: 0.5867
 epoch: 48, train_loss: 0.7023, test_loss: 0.8687, test_f1: 0.6053
 epoch: 49, train_loss: 0.6853, test_loss: 0.8630, test_f1: 0.5695
 epoch: 50, train_loss: 0.6829, test_loss: 0.7961, test_f1: 0.5949
 epoch: 51, train_loss: 0.6635, test_loss: 0.8613, test_f1: 0.6097
 epoch: 52, train_loss: 0.6599, test_loss: 0.9863, test_f1: 0.6061
 epoch: 53, train_loss: 0.6251, test_loss: 0.9174, test_f1: 0.5951
 epoch: 54, train_loss: 0.6369, test_loss: 0.8730, test_f1: 0.6326
 epoch: 55, train_loss: 0.6113, test_loss: 0.9888, test_f1: 0.6082
 epoch: 56, train_loss: 0.6077, test_loss: 0.8917, test_f1: 0.5926
 epoch: 57, train_loss: 0.6138, test_loss: 0.7967, test_f1: 0.6060
 epoch: 58, train_loss: 0.6064, test_loss: 0.7782, test_f1: 0.6348
 epoch: 59, train_loss: 0.5806, test_loss: 0.9144, test_f1: 0.6380
 epoch: 60, train_loss: 0.5881, test_loss: 0.8452, test_f1: 0.6289
 epoch: 61, train_loss: 0.5950, test_loss: 0.8513, test_f1: 0.6210
 epoch: 62, train_loss: 0.6055, test_loss: 0.8945, test_f1: 0.5874
 epoch: 63, train_loss: 0.5893, test_loss: 0.7777, test_f1: 0.6189
 epoch: 64, train_loss: 0.5763, test_loss: 0.8943, test_f1: 0.6334
 epoch: 65, train_loss: 0.5672, test_loss: 0.9442, test_f1: 0.6485
 epoch: 66, train_loss: 0.5669, test_loss: 0.8541, test_f1: 0.6269
 epoch: 67, train_loss: 0.5802, test_loss: 1.0877, test_f1: 0.6225
 epoch: 68, train_loss: 0.5622, test_loss: 0.8587, test_f1: 0.6301
 epoch: 69, train_loss: 0.5716, test_loss: 0.7932, test_f1: 0.6517
 epoch: 70, train_loss: 0.5478, test_loss: 1.1517, test_f1: 0.6528
 epoch: 71, train_loss: 0.5449, test_loss: 0.9921, test_f1: 0.6625
 epoch: 72, train_loss: 0.5667, test_loss: 0.8569, test_f1: 0.6405
 epoch: 73, train_loss: 0.5454, test_loss: 0.9995, test_f1: 0.6511
 epoch: 74, train_loss: 0.5480, test_loss: 1.0431, test_f1: 0.6301
 epoch: 75, train_loss: 0.5459, test_loss: 0.9945, test_f1: 0.6254
 epoch: 76, train_loss: 0.5379, test_loss: 0.8851, test_f1: 0.6193
 epoch: 77, train_loss: 0.5594, test_loss: 0.9565, test_f1: 0.6846
 epoch: 78, train_loss: 0.5219, test_loss: 1.0797, test_f1: 0.6402
 epoch: 79, train_loss: 0.5161, test_loss: 1.1347, test_f1: 0.6165
 epoch: 80, train_loss: 0.5250, test_loss: 0.9885, test_f1: 0.6438
 epoch: 81, train_loss: 0.4979, test_loss: 1.2102, test_f1: 0.6802
 epoch: 82, train_loss: 0.5182, test_loss: 0.9865, test_f1: 0.6429
 epoch: 83, train_loss: 0.5172, test_loss: 1.0219, test_f1: 0.6204
 epoch: 84, train_loss: 0.5119, test_loss: 1.0518, test_f1: 0.6716
 epoch: 85, train_loss: 0.5040, test_loss: 1.0013, test_f1: 0.6408
 epoch: 86, train_loss: 0.5232, test_loss: 1.0244, test_f1: 0.6056
 epoch: 87, train_loss: 0.5014, test_loss: 0.8725, test_f1: 0.6552
 epoch: 88, train_loss: 0.4734, test_loss: 0.9661, test_f1: 0.6493
 epoch: 89, train_loss: 0.4904, test_loss: 0.8853, test_f1: 0.6485
 epoch: 90, train_loss: 0.4912, test_loss: 0.9047, test_f1: 0.6496
 epoch: 91, train_loss: 0.4939, test_loss: 1.0260, test_f1: 0.6454
 epoch: 92, train_loss: 0.4830, test_loss: 0.9477, test_f1: 0.6669
 epoch: 93, train_loss: 0.4701, test_loss: 0.9243, test_f1: 0.6772
 epoch: 94, train_loss: 0.4840, test_loss: 0.9159, test_f1: 0.6535
 epoch: 95, train_loss: 0.4951, test_loss: 1.1128, test_f1: 0.6661
 epoch: 96, train_loss: 0.4719, test_loss: 1.0334, test_f1: 0.6609
 epoch: 97, train_loss: 0.4692, test_loss: 0.9391, test_f1: 0.6941
 epoch: 98, train_loss: 0.4762, test_loss: 0.8474, test_f1: 0.6647
 epoch: 99, train_loss: 0.4582, test_loss: 1.0620, test_f1: 0.6537
##################ITERATION #4 ****************************************
 epoch: 0, train_loss: 1.0958, test_loss: 1.1097, test_f1: 0.4348
 epoch: 1, train_loss: 1.0072, test_loss: 1.1839, test_f1: 0.4485
 epoch: 2, train_loss: 0.9631, test_loss: 1.0748, test_f1: 0.4914
 epoch: 3, train_loss: 0.9661, test_loss: 0.9667, test_f1: 0.4626
 epoch: 4, train_loss: 0.9610, test_loss: 1.0069, test_f1: 0.4768
 epoch: 5, train_loss: 0.9059, test_loss: 1.0569, test_f1: 0.4573
 epoch: 6, train_loss: 0.9333, test_loss: 0.9778, test_f1: 0.4780
 epoch: 7, train_loss: 0.9386, test_loss: 0.9692, test_f1: 0.5408
 epoch: 8, train_loss: 0.8999, test_loss: 0.8863, test_f1: 0.5161
 epoch: 9, train_loss: 0.9031, test_loss: 0.9168, test_f1: 0.5111
 epoch: 10, train_loss: 0.9083, test_loss: 0.9195, test_f1: 0.5179
 epoch: 11, train_loss: 0.9012, test_loss: 0.9427, test_f1: 0.5243
 epoch: 12, train_loss: 0.8747, test_loss: 1.0074, test_f1: 0.4862
 epoch: 13, train_loss: 0.8803, test_loss: 0.9255, test_f1: 0.5623
 epoch: 14, train_loss: 0.8758, test_loss: 0.8575, test_f1: 0.5257
 epoch: 15, train_loss: 0.8698, test_loss: 0.9651, test_f1: 0.5296
 epoch: 16, train_loss: 0.8515, test_loss: 0.8746, test_f1: 0.5388
 epoch: 17, train_loss: 0.8500, test_loss: 0.8960, test_f1: 0.5683
 epoch: 18, train_loss: 0.8389, test_loss: 0.8909, test_f1: 0.5389
 epoch: 19, train_loss: 0.8759, test_loss: 0.9634, test_f1: 0.5488
 epoch: 20, train_loss: 0.8447, test_loss: 0.8300, test_f1: 0.5508
 epoch: 21, train_loss: 0.8479, test_loss: 0.9401, test_f1: 0.5240
 epoch: 22, train_loss: 0.8306, test_loss: 0.9377, test_f1: 0.5278
 epoch: 23, train_loss: 0.8084, test_loss: 0.8831, test_f1: 0.5250
 epoch: 24, train_loss: 0.8016, test_loss: 0.9045, test_f1: 0.5231
 epoch: 25, train_loss: 0.8145, test_loss: 1.0400, test_f1: 0.5249
 epoch: 26, train_loss: 0.8036, test_loss: 0.8597, test_f1: 0.5938
 epoch: 27, train_loss: 0.8426, test_loss: 0.8380, test_f1: 0.5845
 epoch: 28, train_loss: 0.7970, test_loss: 0.9119, test_f1: 0.6070
 epoch: 29, train_loss: 0.7826, test_loss: 0.8340, test_f1: 0.6031
 epoch: 30, train_loss: 0.7787, test_loss: 0.9283, test_f1: 0.5782
 epoch: 31, train_loss: 0.7549, test_loss: 0.8346, test_f1: 0.6081
 epoch: 32, train_loss: 0.7667, test_loss: 0.8424, test_f1: 0.5563
 epoch: 33, train_loss: 0.7757, test_loss: 0.9080, test_f1: 0.5804
 epoch: 34, train_loss: 0.7865, test_loss: 0.8576, test_f1: 0.5665
 epoch: 35, train_loss: 0.7584, test_loss: 0.8375, test_f1: 0.6028
 epoch: 36, train_loss: 0.7564, test_loss: 0.8855, test_f1: 0.5646
 epoch: 37, train_loss: 0.7371, test_loss: 0.8482, test_f1: 0.6127
 epoch: 38, train_loss: 0.7548, test_loss: 0.8575, test_f1: 0.6117
 epoch: 39, train_loss: 0.7691, test_loss: 0.7919, test_f1: 0.6236
 epoch: 40, train_loss: 0.8484, test_loss: 0.9423, test_f1: 0.4992
 epoch: 41, train_loss: 0.9050, test_loss: 0.8182, test_f1: 0.5404
 epoch: 42, train_loss: 0.8433, test_loss: 0.8461, test_f1: 0.5807
 epoch: 43, train_loss: 0.7898, test_loss: 0.8872, test_f1: 0.5717
 epoch: 44, train_loss: 0.8074, test_loss: 0.9034, test_f1: 0.6124
 epoch: 45, train_loss: 0.7731, test_loss: 0.8677, test_f1: 0.5922
 epoch: 46, train_loss: 0.7730, test_loss: 0.8545, test_f1: 0.5313
 epoch: 47, train_loss: 0.7487, test_loss: 0.7563, test_f1: 0.6132
 epoch: 48, train_loss: 0.7462, test_loss: 0.8602, test_f1: 0.5379
 epoch: 49, train_loss: 0.7504, test_loss: 0.8270, test_f1: 0.5713
 epoch: 50, train_loss: 0.7506, test_loss: 0.8719, test_f1: 0.5735
 epoch: 51, train_loss: 0.7186, test_loss: 0.8223, test_f1: 0.6003
 epoch: 52, train_loss: 0.6867, test_loss: 0.7901, test_f1: 0.5980
 epoch: 53, train_loss: 0.6836, test_loss: 0.9455, test_f1: 0.6149
 epoch: 54, train_loss: 0.6638, test_loss: 0.7656, test_f1: 0.6348
 epoch: 55, train_loss: 0.6656, test_loss: 0.8470, test_f1: 0.6084
 epoch: 56, train_loss: 0.6583, test_loss: 0.7716, test_f1: 0.6279
 epoch: 57, train_loss: 0.6464, test_loss: 0.9009, test_f1: 0.6043
 epoch: 58, train_loss: 0.6286, test_loss: 0.7621, test_f1: 0.6374
 epoch: 59, train_loss: 0.6513, test_loss: 0.9511, test_f1: 0.6454
 epoch: 60, train_loss: 0.6447, test_loss: 0.8474, test_f1: 0.6104
 epoch: 61, train_loss: 0.6439, test_loss: 0.9245, test_f1: 0.6331
 epoch: 62, train_loss: 0.6247, test_loss: 0.9454, test_f1: 0.6612
 epoch: 63, train_loss: 0.6510, test_loss: 0.9169, test_f1: 0.5848
 epoch: 64, train_loss: 0.7033, test_loss: 1.0396, test_f1: 0.6468
 epoch: 65, train_loss: 0.6407, test_loss: 0.9937, test_f1: 0.6424
 epoch: 66, train_loss: 0.6257, test_loss: 1.0613, test_f1: 0.6526
 epoch: 67, train_loss: 0.6221, test_loss: 0.9734, test_f1: 0.6368
 epoch: 68, train_loss: 0.6249, test_loss: 1.0321, test_f1: 0.6426
 epoch: 69, train_loss: 0.6110, test_loss: 0.8699, test_f1: 0.6468
 epoch: 70, train_loss: 0.6065, test_loss: 0.8928, test_f1: 0.6734
 epoch: 71, train_loss: 0.5982, test_loss: 1.0183, test_f1: 0.6573
 epoch: 72, train_loss: 0.5914, test_loss: 1.0958, test_f1: 0.6560
 epoch: 73, train_loss: 0.6001, test_loss: 0.8774, test_f1: 0.6472
 epoch: 74, train_loss: 0.6456, test_loss: 1.0276, test_f1: 0.6692
 epoch: 75, train_loss: 0.6011, test_loss: 0.9878, test_f1: 0.6763
 epoch: 76, train_loss: 0.5849, test_loss: 1.0531, test_f1: 0.6753
 epoch: 77, train_loss: 0.5925, test_loss: 1.0691, test_f1: 0.6662
 epoch: 78, train_loss: 0.5716, test_loss: 0.9138, test_f1: 0.6588
 epoch: 79, train_loss: 0.5856, test_loss: 0.9447, test_f1: 0.6590
 epoch: 80, train_loss: 0.5758, test_loss: 0.9694, test_f1: 0.6575
 epoch: 81, train_loss: 0.5680, test_loss: 1.0371, test_f1: 0.6491
 epoch: 82, train_loss: 0.5745, test_loss: 1.1732, test_f1: 0.6543
 epoch: 83, train_loss: 0.5846, test_loss: 1.2319, test_f1: 0.6566
 epoch: 84, train_loss: 0.5714, test_loss: 1.0632, test_f1: 0.6658
 epoch: 85, train_loss: 0.5593, test_loss: 1.0512, test_f1: 0.6482
 epoch: 86, train_loss: 0.5850, test_loss: 1.0099, test_f1: 0.6504
 epoch: 87, train_loss: 0.5655, test_loss: 1.1384, test_f1: 0.6877
 epoch: 88, train_loss: 0.5580, test_loss: 0.7968, test_f1: 0.6332
 epoch: 89, train_loss: 0.5634, test_loss: 1.0282, test_f1: 0.6405
 epoch: 90, train_loss: 0.5434, test_loss: 0.9466, test_f1: 0.6614
 epoch: 91, train_loss: 0.5517, test_loss: 1.1418, test_f1: 0.6747
 epoch: 92, train_loss: 0.5523, test_loss: 1.0088, test_f1: 0.6554
 epoch: 93, train_loss: 0.5526, test_loss: 1.3534, test_f1: 0.6534
 epoch: 94, train_loss: 0.5396, test_loss: 1.1365, test_f1: 0.6672
 epoch: 95, train_loss: 0.5211, test_loss: 1.1849, test_f1: 0.6417
 epoch: 96, train_loss: 0.5344, test_loss: 1.0620, test_f1: 0.6608
 epoch: 97, train_loss: 0.5350, test_loss: 1.0977, test_f1: 0.6349
 epoch: 98, train_loss: 0.5232, test_loss: 1.1114, test_f1: 0.6335
 epoch: 99, train_loss: 0.5447, test_loss: 0.8572, test_f1: 0.6451
##################ITERATION #5 ****************************************
 epoch: 0, train_loss: 1.1193, test_loss: 1.0425, test_f1: 0.4702
 epoch: 1, train_loss: 0.9879, test_loss: 0.9976, test_f1: 0.4776
 epoch: 2, train_loss: 0.9791, test_loss: 1.0430, test_f1: 0.5100
 epoch: 3, train_loss: 0.9611, test_loss: 1.1045, test_f1: 0.4933
 epoch: 4, train_loss: 0.9360, test_loss: 0.9302, test_f1: 0.5396
 epoch: 5, train_loss: 0.9385, test_loss: 0.9594, test_f1: 0.5184
 epoch: 6, train_loss: 0.9254, test_loss: 1.0884, test_f1: 0.4410
 epoch: 7, train_loss: 0.9100, test_loss: 0.9990, test_f1: 0.5013
 epoch: 8, train_loss: 0.9053, test_loss: 1.0346, test_f1: 0.5360
 epoch: 9, train_loss: 0.8902, test_loss: 0.9073, test_f1: 0.5794
 epoch: 10, train_loss: 0.8683, test_loss: 1.0499, test_f1: 0.5360
 epoch: 11, train_loss: 0.8789, test_loss: 0.9116, test_f1: 0.5582
 epoch: 12, train_loss: 0.8698, test_loss: 0.8217, test_f1: 0.5466
 epoch: 13, train_loss: 0.8662, test_loss: 0.9095, test_f1: 0.5649
 epoch: 14, train_loss: 0.8427, test_loss: 1.0941, test_f1: 0.5343
 epoch: 15, train_loss: 0.8385, test_loss: 0.9109, test_f1: 0.5591
 epoch: 16, train_loss: 0.8357, test_loss: 1.4469, test_f1: 0.5055
 epoch: 17, train_loss: 0.8148, test_loss: 1.0330, test_f1: 0.5019
 epoch: 18, train_loss: 0.8290, test_loss: 0.9472, test_f1: 0.6057
 epoch: 19, train_loss: 0.8092, test_loss: 0.8842, test_f1: 0.5912
 epoch: 20, train_loss: 0.8004, test_loss: 0.9868, test_f1: 0.5512
 epoch: 21, train_loss: 0.7987, test_loss: 0.9232, test_f1: 0.5934
 epoch: 22, train_loss: 0.7727, test_loss: 0.9992, test_f1: 0.6156
 epoch: 23, train_loss: 0.7761, test_loss: 0.9651, test_f1: 0.5845
 epoch: 24, train_loss: 0.7694, test_loss: 0.8872, test_f1: 0.6236
 epoch: 25, train_loss: 0.7844, test_loss: 1.0356, test_f1: 0.5275
 epoch: 26, train_loss: 0.7618, test_loss: 0.9509, test_f1: 0.5857
 epoch: 27, train_loss: 0.7629, test_loss: 0.8878, test_f1: 0.6367
 epoch: 28, train_loss: 0.7625, test_loss: 0.9418, test_f1: 0.5749
 epoch: 29, train_loss: 0.7398, test_loss: 0.8837, test_f1: 0.5813
 epoch: 30, train_loss: 0.7392, test_loss: 0.9530, test_f1: 0.6313
 epoch: 31, train_loss: 0.7509, test_loss: 1.0004, test_f1: 0.6114
 epoch: 32, train_loss: 0.7378, test_loss: 1.0706, test_f1: 0.6237
 epoch: 33, train_loss: 0.7260, test_loss: 1.1349, test_f1: 0.6066
 epoch: 34, train_loss: 0.7317, test_loss: 0.9261, test_f1: 0.5869
 epoch: 35, train_loss: 0.7138, test_loss: 1.1218, test_f1: 0.6373
 epoch: 36, train_loss: 0.7243, test_loss: 1.0971, test_f1: 0.5693
 epoch: 37, train_loss: 0.7196, test_loss: 1.0711, test_f1: 0.6088
 epoch: 38, train_loss: 0.7148, test_loss: 1.0438, test_f1: 0.6375
 epoch: 39, train_loss: 0.7279, test_loss: 0.8513, test_f1: 0.6441
 epoch: 40, train_loss: 0.7016, test_loss: 0.9521, test_f1: 0.6284
 epoch: 41, train_loss: 0.7293, test_loss: 1.0244, test_f1: 0.6196
 epoch: 42, train_loss: 0.6886, test_loss: 0.9377, test_f1: 0.6372
 epoch: 43, train_loss: 0.7054, test_loss: 0.8937, test_f1: 0.6317
 epoch: 44, train_loss: 0.6951, test_loss: 1.0191, test_f1: 0.6351
 epoch: 45, train_loss: 0.6911, test_loss: 0.8555, test_f1: 0.6519
 epoch: 46, train_loss: 0.6671, test_loss: 1.0929, test_f1: 0.6508
 epoch: 47, train_loss: 0.6571, test_loss: 1.0790, test_f1: 0.6371
 epoch: 48, train_loss: 0.6563, test_loss: 1.0509, test_f1: 0.6334
 epoch: 49, train_loss: 0.6691, test_loss: 1.0763, test_f1: 0.6362
 epoch: 50, train_loss: 0.6574, test_loss: 0.9628, test_f1: 0.6157
 epoch: 51, train_loss: 0.6102, test_loss: 0.9002, test_f1: 0.6434
 epoch: 52, train_loss: 0.6018, test_loss: 1.0131, test_f1: 0.6450
 epoch: 53, train_loss: 0.5900, test_loss: 1.1829, test_f1: 0.6341
 epoch: 54, train_loss: 0.5810, test_loss: 1.0461, test_f1: 0.6459
 epoch: 55, train_loss: 0.5956, test_loss: 1.0714, test_f1: 0.6566
 epoch: 56, train_loss: 0.5714, test_loss: 1.0499, test_f1: 0.6722
 epoch: 57, train_loss: 0.5622, test_loss: 1.0310, test_f1: 0.6479
 epoch: 58, train_loss: 0.5615, test_loss: 1.0520, test_f1: 0.6677
 epoch: 59, train_loss: 0.5352, test_loss: 1.0253, test_f1: 0.6558
 epoch: 60, train_loss: 0.5527, test_loss: 0.9890, test_f1: 0.6497
 epoch: 61, train_loss: 0.5430, test_loss: 1.0605, test_f1: 0.6649
 epoch: 62, train_loss: 0.5315, test_loss: 1.1187, test_f1: 0.6613
 epoch: 63, train_loss: 0.5399, test_loss: 1.1645, test_f1: 0.6561
 epoch: 64, train_loss: 0.5296, test_loss: 1.1204, test_f1: 0.6410
 epoch: 65, train_loss: 0.5417, test_loss: 1.1328, test_f1: 0.6767
 epoch: 66, train_loss: 0.5186, test_loss: 1.1237, test_f1: 0.6539
 epoch: 67, train_loss: 0.5266, test_loss: 1.0658, test_f1: 0.6353
 epoch: 68, train_loss: 0.5312, test_loss: 1.1409, test_f1: 0.6602
 epoch: 69, train_loss: 0.5665, test_loss: 1.1637, test_f1: 0.6276
 epoch: 70, train_loss: 0.5691, test_loss: 1.0805, test_f1: 0.6564
 epoch: 71, train_loss: 0.5319, test_loss: 1.1404, test_f1: 0.6440
 epoch: 72, train_loss: 0.5370, test_loss: 1.1037, test_f1: 0.6631
 epoch: 73, train_loss: 0.5093, test_loss: 1.1259, test_f1: 0.6637
 epoch: 74, train_loss: 0.5468, test_loss: 1.2198, test_f1: 0.6772
 epoch: 75, train_loss: 0.5555, test_loss: 1.0731, test_f1: 0.6644
 epoch: 76, train_loss: 0.5106, test_loss: 1.0817, test_f1: 0.6828
 epoch: 77, train_loss: 0.4867, test_loss: 1.1074, test_f1: 0.6630
 epoch: 78, train_loss: 0.4913, test_loss: 1.1377, test_f1: 0.6705
 epoch: 79, train_loss: 0.4822, test_loss: 1.1461, test_f1: 0.6813
 epoch: 80, train_loss: 0.4812, test_loss: 1.0696, test_f1: 0.6566
 epoch: 81, train_loss: 0.4733, test_loss: 1.1675, test_f1: 0.6483
 epoch: 82, train_loss: 0.4798, test_loss: 1.1802, test_f1: 0.6492
 epoch: 83, train_loss: 0.4772, test_loss: 1.2211, test_f1: 0.6752
 epoch: 84, train_loss: 0.4914, test_loss: 1.1515, test_f1: 0.6891
 epoch: 85, train_loss: 0.4662, test_loss: 1.2889, test_f1: 0.6497
 epoch: 86, train_loss: 0.4737, test_loss: 1.1012, test_f1: 0.6516
 epoch: 87, train_loss: 0.4634, test_loss: 1.2980, test_f1: 0.6847
 epoch: 88, train_loss: 0.4608, test_loss: 1.3277, test_f1: 0.6531
 epoch: 89, train_loss: 0.4795, test_loss: 1.1660, test_f1: 0.6634
 epoch: 90, train_loss: 0.4666, test_loss: 1.2951, test_f1: 0.6602
 epoch: 91, train_loss: 0.4625, test_loss: 1.2224, test_f1: 0.6639
 epoch: 92, train_loss: 0.4482, test_loss: 1.2563, test_f1: 0.6850
 epoch: 93, train_loss: 0.4739, test_loss: 1.4455, test_f1: 0.6577
 epoch: 94, train_loss: 0.4677, test_loss: 1.3527, test_f1: 0.6605
 epoch: 95, train_loss: 0.4422, test_loss: 1.4181, test_f1: 0.6900
 epoch: 96, train_loss: 0.4386, test_loss: 1.4107, test_f1: 0.6876
 epoch: 97, train_loss: 0.4278, test_loss: 1.2975, test_f1: 0.6623
 epoch: 98, train_loss: 0.4463, test_loss: 1.5344, test_f1: 0.6524
 epoch: 99, train_loss: 0.4293, test_loss: 1.5263, test_f1: 0.6555
##################ITERATION #6 ****************************************
 epoch: 0, train_loss: 1.1125, test_loss: 1.0163, test_f1: 0.4701
 epoch: 1, train_loss: 0.9643, test_loss: 0.9510, test_f1: 0.4992
 epoch: 2, train_loss: 0.9362, test_loss: 1.0070, test_f1: 0.4888
 epoch: 3, train_loss: 0.9177, test_loss: 0.9592, test_f1: 0.5622
 epoch: 4, train_loss: 0.9198, test_loss: 1.0688, test_f1: 0.4823
 epoch: 5, train_loss: 0.9145, test_loss: 0.8797, test_f1: 0.5137
 epoch: 6, train_loss: 0.8893, test_loss: 0.9147, test_f1: 0.5366
 epoch: 7, train_loss: 0.8900, test_loss: 0.9143, test_f1: 0.5198
 epoch: 8, train_loss: 0.8663, test_loss: 0.9754, test_f1: 0.5600
 epoch: 9, train_loss: 0.8545, test_loss: 1.0051, test_f1: 0.5790
 epoch: 10, train_loss: 0.8512, test_loss: 0.9148, test_f1: 0.5650
 epoch: 11, train_loss: 0.8431, test_loss: 0.9134, test_f1: 0.5614
 epoch: 12, train_loss: 0.8487, test_loss: 0.9273, test_f1: 0.5888
 epoch: 13, train_loss: 0.8369, test_loss: 0.9545, test_f1: 0.5876
 epoch: 14, train_loss: 0.8509, test_loss: 0.8351, test_f1: 0.6011
 epoch: 15, train_loss: 0.8203, test_loss: 0.9579, test_f1: 0.5235
 epoch: 16, train_loss: 0.8048, test_loss: 0.9636, test_f1: 0.5778
 epoch: 17, train_loss: 0.8165, test_loss: 0.8466, test_f1: 0.5518
 epoch: 18, train_loss: 0.8195, test_loss: 1.0139, test_f1: 0.5662
 epoch: 19, train_loss: 0.7997, test_loss: 1.0994, test_f1: 0.5657
 epoch: 20, train_loss: 0.7800, test_loss: 0.9440, test_f1: 0.6358
 epoch: 21, train_loss: 0.7875, test_loss: 0.8950, test_f1: 0.5983
 epoch: 22, train_loss: 0.7696, test_loss: 0.8107, test_f1: 0.6717
 epoch: 23, train_loss: 0.7620, test_loss: 0.8881, test_f1: 0.6245
 epoch: 24, train_loss: 0.7475, test_loss: 0.8596, test_f1: 0.6073
 epoch: 25, train_loss: 0.7792, test_loss: 0.8921, test_f1: 0.5917
 epoch: 26, train_loss: 0.7969, test_loss: 0.8547, test_f1: 0.6023
 epoch: 27, train_loss: 0.8150, test_loss: 0.9764, test_f1: 0.5485
 epoch: 28, train_loss: 0.7836, test_loss: 0.8758, test_f1: 0.6424
 epoch: 29, train_loss: 0.7853, test_loss: 0.8686, test_f1: 0.6473
 epoch: 30, train_loss: 0.7986, test_loss: 0.9605, test_f1: 0.5719
 epoch: 31, train_loss: 0.7888, test_loss: 0.9571, test_f1: 0.6476
 epoch: 32, train_loss: 0.7723, test_loss: 1.0238, test_f1: 0.5933
 epoch: 33, train_loss: 0.7201, test_loss: 0.9594, test_f1: 0.6039
 epoch: 34, train_loss: 0.7319, test_loss: 0.9868, test_f1: 0.6187
 epoch: 35, train_loss: 0.7309, test_loss: 1.0736, test_f1: 0.5676
 epoch: 36, train_loss: 0.7354, test_loss: 0.9275, test_f1: 0.6083
 epoch: 37, train_loss: 0.7096, test_loss: 0.8199, test_f1: 0.6569
 epoch: 38, train_loss: 0.6912, test_loss: 0.8640, test_f1: 0.5888
 epoch: 39, train_loss: 0.7350, test_loss: 0.8641, test_f1: 0.6373
 epoch: 40, train_loss: 0.7327, test_loss: 0.8946, test_f1: 0.6465
 epoch: 41, train_loss: 0.7144, test_loss: 0.9753, test_f1: 0.6156
 epoch: 42, train_loss: 0.6989, test_loss: 0.8139, test_f1: 0.6618
 epoch: 43, train_loss: 0.6837, test_loss: 0.8337, test_f1: 0.6620
 epoch: 44, train_loss: 0.6569, test_loss: 0.9038, test_f1: 0.6530
 epoch: 45, train_loss: 0.6791, test_loss: 0.8053, test_f1: 0.6591
 epoch: 46, train_loss: 0.6662, test_loss: 0.9834, test_f1: 0.6133
 epoch: 47, train_loss: 0.6693, test_loss: 0.9282, test_f1: 0.6617
 epoch: 48, train_loss: 0.6446, test_loss: 0.9032, test_f1: 0.6410
 epoch: 49, train_loss: 0.6417, test_loss: 0.8727, test_f1: 0.6785
 epoch: 50, train_loss: 0.6489, test_loss: 0.8513, test_f1: 0.6560
 epoch: 51, train_loss: 0.5997, test_loss: 0.9411, test_f1: 0.6758
 epoch: 52, train_loss: 0.5778, test_loss: 0.9304, test_f1: 0.6759
 epoch: 53, train_loss: 0.5631, test_loss: 0.9775, test_f1: 0.6940
 epoch: 54, train_loss: 0.5753, test_loss: 0.9311, test_f1: 0.6773
 epoch: 55, train_loss: 0.5637, test_loss: 1.0099, test_f1: 0.6970
 epoch: 56, train_loss: 0.5529, test_loss: 1.1348, test_f1: 0.6848
 epoch: 57, train_loss: 0.5329, test_loss: 0.9664, test_f1: 0.6774
 epoch: 58, train_loss: 0.5477, test_loss: 0.9618, test_f1: 0.6688
 epoch: 59, train_loss: 0.5379, test_loss: 1.1571, test_f1: 0.6593
 epoch: 60, train_loss: 0.5338, test_loss: 1.1058, test_f1: 0.6705
 epoch: 61, train_loss: 0.5318, test_loss: 1.1304, test_f1: 0.6601
 epoch: 62, train_loss: 0.5527, test_loss: 1.0534, test_f1: 0.6526
 epoch: 63, train_loss: 0.5465, test_loss: 0.9685, test_f1: 0.6661
 epoch: 64, train_loss: 0.5341, test_loss: 1.0947, test_f1: 0.6811
 epoch: 65, train_loss: 0.5344, test_loss: 1.0318, test_f1: 0.6554
 epoch: 66, train_loss: 0.5083, test_loss: 1.0034, test_f1: 0.6652
 epoch: 67, train_loss: 0.5280, test_loss: 1.0168, test_f1: 0.6712
 epoch: 68, train_loss: 0.5362, test_loss: 1.1509, test_f1: 0.6460
 epoch: 69, train_loss: 0.5389, test_loss: 1.0916, test_f1: 0.6558
 epoch: 70, train_loss: 0.5096, test_loss: 1.0049, test_f1: 0.6827
 epoch: 71, train_loss: 0.5143, test_loss: 1.0316, test_f1: 0.6737
 epoch: 72, train_loss: 0.4871, test_loss: 1.1257, test_f1: 0.6648
 epoch: 73, train_loss: 0.4874, test_loss: 1.0615, test_f1: 0.6683
 epoch: 74, train_loss: 0.5199, test_loss: 1.0624, test_f1: 0.6752
 epoch: 75, train_loss: 0.5333, test_loss: 1.0184, test_f1: 0.6674
 epoch: 76, train_loss: 0.5022, test_loss: 1.0564, test_f1: 0.6749
 epoch: 77, train_loss: 0.4614, test_loss: 0.9889, test_f1: 0.6674
 epoch: 78, train_loss: 0.4916, test_loss: 1.0167, test_f1: 0.6882
 epoch: 79, train_loss: 0.4819, test_loss: 0.9772, test_f1: 0.6776
 epoch: 80, train_loss: 0.4716, test_loss: 1.0169, test_f1: 0.6934
 epoch: 81, train_loss: 0.4530, test_loss: 1.0587, test_f1: 0.6797
 epoch: 82, train_loss: 0.4680, test_loss: 1.1845, test_f1: 0.6746
 epoch: 83, train_loss: 0.4826, test_loss: 1.0530, test_f1: 0.6673
 epoch: 84, train_loss: 0.4401, test_loss: 1.1481, test_f1: 0.6543
 epoch: 85, train_loss: 0.4572, test_loss: 1.0342, test_f1: 0.6811
 epoch: 86, train_loss: 0.4436, test_loss: 1.0837, test_f1: 0.6787
 epoch: 87, train_loss: 0.4667, test_loss: 1.0280, test_f1: 0.6574
 epoch: 88, train_loss: 0.4476, test_loss: 1.1386, test_f1: 0.6643
 epoch: 89, train_loss: 0.4741, test_loss: 1.2660, test_f1: 0.6524
 epoch: 90, train_loss: 0.4394, test_loss: 1.1100, test_f1: 0.6711
 epoch: 91, train_loss: 0.4312, test_loss: 1.0982, test_f1: 0.6757
 epoch: 92, train_loss: 0.4575, test_loss: 1.0089, test_f1: 0.6809
 epoch: 93, train_loss: 0.4215, test_loss: 1.1822, test_f1: 0.6523
 epoch: 94, train_loss: 0.4433, test_loss: 1.0548, test_f1: 0.6787
 epoch: 95, train_loss: 0.4337, test_loss: 1.0239, test_f1: 0.6786
 epoch: 96, train_loss: 0.4515, test_loss: 1.1348, test_f1: 0.6879
 epoch: 97, train_loss: 0.4319, test_loss: 1.0477, test_f1: 0.6781
 epoch: 98, train_loss: 0.4517, test_loss: 1.1715, test_f1: 0.6514
 epoch: 99, train_loss: 0.4397, test_loss: 1.0696, test_f1: 0.6970
##################ITERATION #7 ****************************************
 epoch: 0, train_loss: 1.1244, test_loss: 1.3709, test_f1: 0.2279
 epoch: 1, train_loss: 1.0025, test_loss: 0.9442, test_f1: 0.5201
 epoch: 2, train_loss: 0.9575, test_loss: 1.0412, test_f1: 0.5452
 epoch: 3, train_loss: 0.9443, test_loss: 0.9296, test_f1: 0.4844
 epoch: 4, train_loss: 0.9308, test_loss: 1.0504, test_f1: 0.4972
 epoch: 5, train_loss: 0.9190, test_loss: 1.0425, test_f1: 0.5088
 epoch: 6, train_loss: 0.9164, test_loss: 0.9172, test_f1: 0.5611
 epoch: 7, train_loss: 0.8828, test_loss: 0.8754, test_f1: 0.5342
 epoch: 8, train_loss: 0.8722, test_loss: 0.8941, test_f1: 0.5252
 epoch: 9, train_loss: 0.8613, test_loss: 0.8364, test_f1: 0.6310
 epoch: 10, train_loss: 0.8516, test_loss: 0.9633, test_f1: 0.5364
 epoch: 11, train_loss: 0.8716, test_loss: 0.8862, test_f1: 0.5782
 epoch: 12, train_loss: 0.8371, test_loss: 0.9617, test_f1: 0.5952
 epoch: 13, train_loss: 0.8320, test_loss: 0.9285, test_f1: 0.6194
 epoch: 14, train_loss: 0.8496, test_loss: 0.8983, test_f1: 0.5895
 epoch: 15, train_loss: 0.8225, test_loss: 0.9091, test_f1: 0.6067
 epoch: 16, train_loss: 0.8154, test_loss: 0.9295, test_f1: 0.5460
 epoch: 17, train_loss: 0.8012, test_loss: 0.8564, test_f1: 0.6241
 epoch: 18, train_loss: 0.7950, test_loss: 0.8222, test_f1: 0.6285
 epoch: 19, train_loss: 0.7859, test_loss: 0.8098, test_f1: 0.6206
 epoch: 20, train_loss: 0.7894, test_loss: 0.8732, test_f1: 0.6360
 epoch: 21, train_loss: 0.7631, test_loss: 0.8154, test_f1: 0.5946
 epoch: 22, train_loss: 0.7552, test_loss: 0.7743, test_f1: 0.6284
 epoch: 23, train_loss: 0.7894, test_loss: 0.8019, test_f1: 0.5953
 epoch: 24, train_loss: 0.7602, test_loss: 1.0454, test_f1: 0.5380
 epoch: 25, train_loss: 0.7534, test_loss: 0.8794, test_f1: 0.6133
 epoch: 26, train_loss: 0.7603, test_loss: 0.8013, test_f1: 0.6312
 epoch: 27, train_loss: 0.7376, test_loss: 0.8462, test_f1: 0.6335
 epoch: 28, train_loss: 0.7358, test_loss: 0.8348, test_f1: 0.6500
 epoch: 29, train_loss: 0.7077, test_loss: 0.9088, test_f1: 0.6220
 epoch: 30, train_loss: 0.7332, test_loss: 0.9811, test_f1: 0.6556
 epoch: 31, train_loss: 0.7171, test_loss: 0.8785, test_f1: 0.6610
 epoch: 32, train_loss: 0.7303, test_loss: 0.9263, test_f1: 0.6311
 epoch: 33, train_loss: 0.7003, test_loss: 0.9118, test_f1: 0.6621
 epoch: 34, train_loss: 0.7009, test_loss: 1.0860, test_f1: 0.5640
 epoch: 35, train_loss: 0.6947, test_loss: 0.8789, test_f1: 0.6526
 epoch: 36, train_loss: 0.6995, test_loss: 1.0261, test_f1: 0.5799
 epoch: 37, train_loss: 0.6984, test_loss: 0.8401, test_f1: 0.6279
 epoch: 38, train_loss: 0.6745, test_loss: 1.0349, test_f1: 0.6380
 epoch: 39, train_loss: 0.6619, test_loss: 0.9405, test_f1: 0.6631
 epoch: 40, train_loss: 0.6462, test_loss: 0.8017, test_f1: 0.6674
 epoch: 41, train_loss: 0.6949, test_loss: 0.8079, test_f1: 0.6756
 epoch: 42, train_loss: 0.6750, test_loss: 0.8254, test_f1: 0.6731
 epoch: 43, train_loss: 0.6528, test_loss: 0.8719, test_f1: 0.6674
 epoch: 44, train_loss: 0.6662, test_loss: 0.6765, test_f1: 0.6541
 epoch: 45, train_loss: 0.6356, test_loss: 0.7634, test_f1: 0.6649
 epoch: 46, train_loss: 0.6260, test_loss: 0.8264, test_f1: 0.6382
 epoch: 47, train_loss: 0.6607, test_loss: 0.7725, test_f1: 0.6898
 epoch: 48, train_loss: 0.6527, test_loss: 0.7903, test_f1: 0.6785
 epoch: 49, train_loss: 0.6279, test_loss: 1.0373, test_f1: 0.6002
 epoch: 50, train_loss: 0.6757, test_loss: 0.9702, test_f1: 0.6019
 epoch: 51, train_loss: 0.5916, test_loss: 0.9540, test_f1: 0.6844
 epoch: 52, train_loss: 0.5595, test_loss: 0.9046, test_f1: 0.6856
 epoch: 53, train_loss: 0.5609, test_loss: 0.8569, test_f1: 0.6699
 epoch: 54, train_loss: 0.5474, test_loss: 0.8395, test_f1: 0.6825
 epoch: 55, train_loss: 0.5389, test_loss: 0.8359, test_f1: 0.6743
 epoch: 56, train_loss: 0.5495, test_loss: 0.8852, test_f1: 0.6827
 epoch: 57, train_loss: 0.5405, test_loss: 0.9400, test_f1: 0.7077
 epoch: 58, train_loss: 0.5411, test_loss: 0.9183, test_f1: 0.6988
 epoch: 59, train_loss: 0.5163, test_loss: 0.8366, test_f1: 0.6767
 epoch: 60, train_loss: 0.5373, test_loss: 0.9064, test_f1: 0.6840
 epoch: 61, train_loss: 0.5256, test_loss: 0.8598, test_f1: 0.6834
 epoch: 62, train_loss: 0.5093, test_loss: 0.9814, test_f1: 0.6826
 epoch: 63, train_loss: 0.5024, test_loss: 0.8447, test_f1: 0.6782
 epoch: 64, train_loss: 0.4867, test_loss: 0.8437, test_f1: 0.6948
 epoch: 65, train_loss: 0.5100, test_loss: 0.8927, test_f1: 0.6826
 epoch: 66, train_loss: 0.4894, test_loss: 0.8365, test_f1: 0.6915
 epoch: 67, train_loss: 0.5093, test_loss: 0.9693, test_f1: 0.6932
 epoch: 68, train_loss: 0.4873, test_loss: 0.8541, test_f1: 0.6764
 epoch: 69, train_loss: 0.4877, test_loss: 0.9718, test_f1: 0.6940
 epoch: 70, train_loss: 0.4823, test_loss: 0.8454, test_f1: 0.6685
 epoch: 71, train_loss: 0.4712, test_loss: 0.9281, test_f1: 0.6990
 epoch: 72, train_loss: 0.4898, test_loss: 0.9776, test_f1: 0.6600
 epoch: 73, train_loss: 0.4832, test_loss: 0.9179, test_f1: 0.7018
 epoch: 74, train_loss: 0.4754, test_loss: 1.0180, test_f1: 0.6725
 epoch: 75, train_loss: 0.4715, test_loss: 0.8459, test_f1: 0.6981
 epoch: 76, train_loss: 0.4881, test_loss: 0.8671, test_f1: 0.7116
 epoch: 77, train_loss: 0.4677, test_loss: 0.7905, test_f1: 0.6844
 epoch: 78, train_loss: 0.4464, test_loss: 1.0093, test_f1: 0.6683
 epoch: 79, train_loss: 0.4568, test_loss: 0.9540, test_f1: 0.6977
 epoch: 80, train_loss: 0.4437, test_loss: 0.9084, test_f1: 0.6873
 epoch: 81, train_loss: 0.4455, test_loss: 0.9715, test_f1: 0.7021
 epoch: 82, train_loss: 0.4404, test_loss: 0.8758, test_f1: 0.7063
 epoch: 83, train_loss: 0.4355, test_loss: 0.9363, test_f1: 0.6841
 epoch: 84, train_loss: 0.4316, test_loss: 0.9770, test_f1: 0.6902
 epoch: 85, train_loss: 0.4460, test_loss: 0.9766, test_f1: 0.6789
 epoch: 86, train_loss: 0.4331, test_loss: 0.9209, test_f1: 0.6940
 epoch: 87, train_loss: 0.4232, test_loss: 1.0471, test_f1: 0.6895
 epoch: 88, train_loss: 0.4396, test_loss: 1.0686, test_f1: 0.6518
 epoch: 89, train_loss: 0.4304, test_loss: 1.0122, test_f1: 0.6905
 epoch: 90, train_loss: 0.4276, test_loss: 0.9498, test_f1: 0.6837
 epoch: 91, train_loss: 0.4309, test_loss: 0.9977, test_f1: 0.6901
 epoch: 92, train_loss: 0.4347, test_loss: 0.9521, test_f1: 0.6901
 epoch: 93, train_loss: 0.3992, test_loss: 1.0414, test_f1: 0.6905
 epoch: 94, train_loss: 0.4101, test_loss: 0.9570, test_f1: 0.6991
 epoch: 95, train_loss: 0.4391, test_loss: 0.9694, test_f1: 0.6714
 epoch: 96, train_loss: 0.4190, test_loss: 1.0341, test_f1: 0.6893
 epoch: 97, train_loss: 0.4364, test_loss: 1.0322, test_f1: 0.6664
 epoch: 98, train_loss: 0.4364, test_loss: 1.1304, test_f1: 0.6820
 epoch: 99, train_loss: 0.4158, test_loss: 0.9785, test_f1: 0.6818
##################ITERATION #8 ****************************************
 epoch: 0, train_loss: 1.1236, test_loss: 1.0006, test_f1: 0.4692
 epoch: 1, train_loss: 0.9955, test_loss: 0.9993, test_f1: 0.5239
 epoch: 2, train_loss: 0.9742, test_loss: 0.9298, test_f1: 0.5097
 epoch: 3, train_loss: 0.9681, test_loss: 0.9765, test_f1: 0.5667
 epoch: 4, train_loss: 0.9505, test_loss: 1.0444, test_f1: 0.4875
 epoch: 5, train_loss: 0.9157, test_loss: 0.9472, test_f1: 0.5726
 epoch: 6, train_loss: 0.9029, test_loss: 0.9637, test_f1: 0.4916
 epoch: 7, train_loss: 0.8908, test_loss: 0.9821, test_f1: 0.5392
 epoch: 8, train_loss: 0.8887, test_loss: 0.8852, test_f1: 0.5970
 epoch: 9, train_loss: 0.8826, test_loss: 0.8914, test_f1: 0.5817
 epoch: 10, train_loss: 0.8536, test_loss: 0.8963, test_f1: 0.5326
 epoch: 11, train_loss: 0.8428, test_loss: 0.8134, test_f1: 0.5986
 epoch: 12, train_loss: 0.8389, test_loss: 0.9221, test_f1: 0.5868
 epoch: 13, train_loss: 0.8330, test_loss: 0.8562, test_f1: 0.6139
 epoch: 14, train_loss: 0.8124, test_loss: 0.8566, test_f1: 0.5999
 epoch: 15, train_loss: 0.8383, test_loss: 0.9048, test_f1: 0.6041
 epoch: 16, train_loss: 0.8144, test_loss: 0.8725, test_f1: 0.5934
 epoch: 17, train_loss: 0.8172, test_loss: 0.8182, test_f1: 0.5859
 epoch: 18, train_loss: 0.8091, test_loss: 0.8341, test_f1: 0.5929
 epoch: 19, train_loss: 0.8443, test_loss: 0.9675, test_f1: 0.5705
 epoch: 20, train_loss: 0.8329, test_loss: 1.0040, test_f1: 0.5359
 epoch: 21, train_loss: 0.8086, test_loss: 0.8834, test_f1: 0.5727
 epoch: 22, train_loss: 0.7876, test_loss: 0.8542, test_f1: 0.5940
 epoch: 23, train_loss: 0.7833, test_loss: 1.0388, test_f1: 0.5279
 epoch: 24, train_loss: 0.7752, test_loss: 0.8732, test_f1: 0.6235
 epoch: 25, train_loss: 0.7598, test_loss: 0.8514, test_f1: 0.6230
 epoch: 26, train_loss: 0.7690, test_loss: 0.8286, test_f1: 0.5988
 epoch: 27, train_loss: 0.7932, test_loss: 0.8163, test_f1: 0.6038
 epoch: 28, train_loss: 0.7433, test_loss: 0.8120, test_f1: 0.5984
 epoch: 29, train_loss: 0.7304, test_loss: 0.8013, test_f1: 0.6246
 epoch: 30, train_loss: 0.7409, test_loss: 0.7418, test_f1: 0.6283
 epoch: 31, train_loss: 0.7492, test_loss: 0.7489, test_f1: 0.6580
 epoch: 32, train_loss: 0.7240, test_loss: 0.8106, test_f1: 0.6348
 epoch: 33, train_loss: 0.7058, test_loss: 0.8476, test_f1: 0.6057
 epoch: 34, train_loss: 0.7126, test_loss: 0.8763, test_f1: 0.6127
 epoch: 35, train_loss: 0.7116, test_loss: 0.8937, test_f1: 0.5894
 epoch: 36, train_loss: 0.7220, test_loss: 0.8158, test_f1: 0.6249
 epoch: 37, train_loss: 0.7286, test_loss: 0.7318, test_f1: 0.6379
 epoch: 38, train_loss: 0.7262, test_loss: 0.8797, test_f1: 0.6062
 epoch: 39, train_loss: 0.7052, test_loss: 0.7829, test_f1: 0.6147
 epoch: 40, train_loss: 0.7076, test_loss: 0.7875, test_f1: 0.6365
 epoch: 41, train_loss: 0.6843, test_loss: 0.7893, test_f1: 0.6397
 epoch: 42, train_loss: 0.6698, test_loss: 0.8815, test_f1: 0.6529
 epoch: 43, train_loss: 0.6954, test_loss: 0.8517, test_f1: 0.5885
 epoch: 44, train_loss: 0.6714, test_loss: 0.7646, test_f1: 0.6283
 epoch: 45, train_loss: 0.6792, test_loss: 0.7584, test_f1: 0.6435
 epoch: 46, train_loss: 0.6619, test_loss: 0.7619, test_f1: 0.6523
 epoch: 47, train_loss: 0.6863, test_loss: 0.7238, test_f1: 0.6469
 epoch: 48, train_loss: 0.6419, test_loss: 0.7286, test_f1: 0.6585
 epoch: 49, train_loss: 0.6534, test_loss: 0.7531, test_f1: 0.6617
 epoch: 50, train_loss: 0.6522, test_loss: 0.7644, test_f1: 0.6244
 epoch: 51, train_loss: 0.6003, test_loss: 0.7200, test_f1: 0.6770
 epoch: 52, train_loss: 0.5950, test_loss: 0.7719, test_f1: 0.6330
 epoch: 53, train_loss: 0.5641, test_loss: 0.7537, test_f1: 0.6392
 epoch: 54, train_loss: 0.5810, test_loss: 0.7173, test_f1: 0.6489
 epoch: 55, train_loss: 0.5642, test_loss: 0.7369, test_f1: 0.6645
 epoch: 56, train_loss: 0.5522, test_loss: 0.6894, test_f1: 0.6870
 epoch: 57, train_loss: 0.5583, test_loss: 0.7412, test_f1: 0.6664
 epoch: 58, train_loss: 0.5446, test_loss: 0.8318, test_f1: 0.6605
 epoch: 59, train_loss: 0.5683, test_loss: 0.7689, test_f1: 0.6518
 epoch: 60, train_loss: 0.5685, test_loss: 0.6891, test_f1: 0.6473
 epoch: 61, train_loss: 0.5441, test_loss: 0.8178, test_f1: 0.6398
 epoch: 62, train_loss: 0.5285, test_loss: 0.8955, test_f1: 0.6419
 epoch: 63, train_loss: 0.5226, test_loss: 0.8016, test_f1: 0.6336
 epoch: 64, train_loss: 0.5278, test_loss: 0.8402, test_f1: 0.6437
 epoch: 65, train_loss: 0.5238, test_loss: 0.8184, test_f1: 0.6539
 epoch: 66, train_loss: 0.5311, test_loss: 0.8714, test_f1: 0.6414
 epoch: 67, train_loss: 0.5193, test_loss: 0.9741, test_f1: 0.6566
 epoch: 68, train_loss: 0.5227, test_loss: 0.7989, test_f1: 0.6715
 epoch: 69, train_loss: 0.5423, test_loss: 0.7815, test_f1: 0.6442
 epoch: 70, train_loss: 0.5126, test_loss: 0.9347, test_f1: 0.6521
 epoch: 71, train_loss: 0.5125, test_loss: 0.9318, test_f1: 0.6475
 epoch: 72, train_loss: 0.5079, test_loss: 0.7534, test_f1: 0.6571
 epoch: 73, train_loss: 0.5010, test_loss: 0.8617, test_f1: 0.6439
 epoch: 74, train_loss: 0.4971, test_loss: 0.7936, test_f1: 0.6579
 epoch: 75, train_loss: 0.4867, test_loss: 0.9834, test_f1: 0.6701
 epoch: 76, train_loss: 0.4994, test_loss: 0.9266, test_f1: 0.6509
 epoch: 77, train_loss: 0.4929, test_loss: 0.8819, test_f1: 0.6509
 epoch: 78, train_loss: 0.4935, test_loss: 0.8900, test_f1: 0.6559
 epoch: 79, train_loss: 0.4909, test_loss: 0.8556, test_f1: 0.6613
 epoch: 80, train_loss: 0.4787, test_loss: 0.9697, test_f1: 0.6513
 epoch: 81, train_loss: 0.4701, test_loss: 0.9828, test_f1: 0.6511
 epoch: 82, train_loss: 0.4596, test_loss: 0.8130, test_f1: 0.6612
 epoch: 83, train_loss: 0.4635, test_loss: 0.7914, test_f1: 0.6807
 epoch: 84, train_loss: 0.4984, test_loss: 1.1397, test_f1: 0.6455
 epoch: 85, train_loss: 0.4869, test_loss: 0.9587, test_f1: 0.6658
 epoch: 86, train_loss: 0.4763, test_loss: 0.9251, test_f1: 0.6614
 epoch: 87, train_loss: 0.4831, test_loss: 0.9867, test_f1: 0.6762
 epoch: 88, train_loss: 0.4419, test_loss: 0.9604, test_f1: 0.6638
 epoch: 89, train_loss: 0.4837, test_loss: 0.8636, test_f1: 0.6937
 epoch: 90, train_loss: 0.4619, test_loss: 0.7258, test_f1: 0.6633
 epoch: 91, train_loss: 0.4544, test_loss: 0.8793, test_f1: 0.6897
 epoch: 92, train_loss: 0.4279, test_loss: 0.8081, test_f1: 0.6834
 epoch: 93, train_loss: 0.4362, test_loss: 1.0901, test_f1: 0.6766
 epoch: 94, train_loss: 0.4313, test_loss: 0.8582, test_f1: 0.6688
 epoch: 95, train_loss: 0.4612, test_loss: 0.9280, test_f1: 0.6753
 epoch: 96, train_loss: 0.4285, test_loss: 0.8917, test_f1: 0.6813
 epoch: 97, train_loss: 0.4455, test_loss: 0.8327, test_f1: 0.6785
 epoch: 98, train_loss: 0.4321, test_loss: 0.8431, test_f1: 0.6759
 epoch: 99, train_loss: 0.4367, test_loss: 0.8839, test_f1: 0.6600
##################ITERATION #9 ****************************************
 epoch: 0, train_loss: 1.1136, test_loss: 1.1134, test_f1: 0.4280
 epoch: 1, train_loss: 0.9852, test_loss: 0.9389, test_f1: 0.4947
 epoch: 2, train_loss: 0.9529, test_loss: 0.8968, test_f1: 0.5403
 epoch: 3, train_loss: 0.9346, test_loss: 0.9207, test_f1: 0.4836
 epoch: 4, train_loss: 0.9268, test_loss: 0.8910, test_f1: 0.5227
 epoch: 5, train_loss: 0.9100, test_loss: 1.4424, test_f1: 0.4314
 epoch: 6, train_loss: 0.8810, test_loss: 0.9880, test_f1: 0.5807
 epoch: 7, train_loss: 0.8701, test_loss: 0.9318, test_f1: 0.5542
 epoch: 8, train_loss: 0.8582, test_loss: 0.9465, test_f1: 0.5293
 epoch: 9, train_loss: 0.8517, test_loss: 0.8333, test_f1: 0.5275
 epoch: 10, train_loss: 0.8417, test_loss: 0.8709, test_f1: 0.5281
 epoch: 11, train_loss: 0.8386, test_loss: 0.9943, test_f1: 0.6056
 epoch: 12, train_loss: 0.8362, test_loss: 0.8238, test_f1: 0.5420
 epoch: 13, train_loss: 0.8223, test_loss: 0.9319, test_f1: 0.5504
 epoch: 14, train_loss: 0.8183, test_loss: 0.8865, test_f1: 0.5603
 epoch: 15, train_loss: 0.8022, test_loss: 0.8610, test_f1: 0.5409
 epoch: 16, train_loss: 0.7912, test_loss: 0.8248, test_f1: 0.5602
 epoch: 17, train_loss: 0.8198, test_loss: 0.8425, test_f1: 0.5800
 epoch: 18, train_loss: 0.7859, test_loss: 0.8890, test_f1: 0.5793
 epoch: 19, train_loss: 0.7673, test_loss: 0.8458, test_f1: 0.6181
 epoch: 20, train_loss: 0.7755, test_loss: 0.7817, test_f1: 0.6263
 epoch: 21, train_loss: 0.7496, test_loss: 0.8684, test_f1: 0.5745
 epoch: 22, train_loss: 0.7601, test_loss: 0.8583, test_f1: 0.6276
 epoch: 23, train_loss: 0.7658, test_loss: 0.8145, test_f1: 0.5808
 epoch: 24, train_loss: 0.7542, test_loss: 0.8116, test_f1: 0.5939
 epoch: 25, train_loss: 0.7528, test_loss: 0.8341, test_f1: 0.6347
 epoch: 26, train_loss: 0.7505, test_loss: 0.9541, test_f1: 0.6024
 epoch: 27, train_loss: 0.7505, test_loss: 0.8143, test_f1: 0.5617
 epoch: 28, train_loss: 0.7249, test_loss: 0.9227, test_f1: 0.6088
 epoch: 29, train_loss: 0.7200, test_loss: 0.8636, test_f1: 0.6055
 epoch: 30, train_loss: 0.7293, test_loss: 0.7700, test_f1: 0.6191
 epoch: 31, train_loss: 0.7795, test_loss: 0.7583, test_f1: 0.5825
 epoch: 32, train_loss: 0.7479, test_loss: 0.8731, test_f1: 0.6331
 epoch: 33, train_loss: 0.7241, test_loss: 0.7748, test_f1: 0.6440
 epoch: 34, train_loss: 0.7262, test_loss: 0.7811, test_f1: 0.6312
 epoch: 35, train_loss: 0.7031, test_loss: 0.8711, test_f1: 0.6340
 epoch: 36, train_loss: 0.7022, test_loss: 0.8044, test_f1: 0.6619
 epoch: 37, train_loss: 0.6813, test_loss: 0.8601, test_f1: 0.5989
 epoch: 38, train_loss: 0.6872, test_loss: 0.8549, test_f1: 0.6539
 epoch: 39, train_loss: 0.7057, test_loss: 0.7794, test_f1: 0.6384
 epoch: 40, train_loss: 0.6671, test_loss: 0.8317, test_f1: 0.6028
 epoch: 41, train_loss: 0.6775, test_loss: 0.7554, test_f1: 0.6430
 epoch: 42, train_loss: 0.6812, test_loss: 0.9062, test_f1: 0.6261
 epoch: 43, train_loss: 0.6462, test_loss: 0.8693, test_f1: 0.6370
 epoch: 44, train_loss: 0.6633, test_loss: 0.8358, test_f1: 0.5879
 epoch: 45, train_loss: 0.6694, test_loss: 0.9664, test_f1: 0.6195
 epoch: 46, train_loss: 0.6394, test_loss: 0.7755, test_f1: 0.6212
 epoch: 47, train_loss: 0.6336, test_loss: 0.9012, test_f1: 0.5822
 epoch: 48, train_loss: 0.6588, test_loss: 0.8593, test_f1: 0.6766
 epoch: 49, train_loss: 0.6467, test_loss: 1.0217, test_f1: 0.6330
 epoch: 50, train_loss: 0.6530, test_loss: 0.7386, test_f1: 0.6414
 epoch: 51, train_loss: 0.6139, test_loss: 0.8588, test_f1: 0.6520
 epoch: 52, train_loss: 0.5729, test_loss: 0.8753, test_f1: 0.6676
 epoch: 53, train_loss: 0.5785, test_loss: 0.7871, test_f1: 0.6658
 epoch: 54, train_loss: 0.5688, test_loss: 0.8309, test_f1: 0.6601
 epoch: 55, train_loss: 0.5575, test_loss: 0.8714, test_f1: 0.6356
 epoch: 56, train_loss: 0.5412, test_loss: 0.9122, test_f1: 0.6610
 epoch: 57, train_loss: 0.5366, test_loss: 0.8429, test_f1: 0.6804
 epoch: 58, train_loss: 0.5399, test_loss: 0.8348, test_f1: 0.6696
 epoch: 59, train_loss: 0.5377, test_loss: 0.7890, test_f1: 0.6668
 epoch: 60, train_loss: 0.5373, test_loss: 0.8441, test_f1: 0.6309
 epoch: 61, train_loss: 0.5332, test_loss: 0.9606, test_f1: 0.6525
 epoch: 62, train_loss: 0.5247, test_loss: 0.8017, test_f1: 0.6902
 epoch: 63, train_loss: 0.5130, test_loss: 0.9594, test_f1: 0.6802
 epoch: 64, train_loss: 0.5190, test_loss: 0.8517, test_f1: 0.6753
 epoch: 65, train_loss: 0.4997, test_loss: 0.8864, test_f1: 0.6518
 epoch: 66, train_loss: 0.5023, test_loss: 0.8096, test_f1: 0.6874
 epoch: 67, train_loss: 0.5009, test_loss: 1.1070, test_f1: 0.6622
 epoch: 68, train_loss: 0.5047, test_loss: 0.9441, test_f1: 0.6428
 epoch: 69, train_loss: 0.4920, test_loss: 0.8873, test_f1: 0.6699
 epoch: 70, train_loss: 0.5130, test_loss: 1.0247, test_f1: 0.6696
 epoch: 71, train_loss: 0.5021, test_loss: 1.0668, test_f1: 0.6760
 epoch: 72, train_loss: 0.4899, test_loss: 0.9300, test_f1: 0.6936
 epoch: 73, train_loss: 0.4743, test_loss: 0.9278, test_f1: 0.6979
 epoch: 74, train_loss: 0.4841, test_loss: 0.9057, test_f1: 0.6843
 epoch: 75, train_loss: 0.4739, test_loss: 1.1227, test_f1: 0.6358
 epoch: 76, train_loss: 0.4773, test_loss: 0.9397, test_f1: 0.7019
 epoch: 77, train_loss: 0.4641, test_loss: 0.9649, test_f1: 0.6930
 epoch: 78, train_loss: 0.4622, test_loss: 0.9638, test_f1: 0.7076
 epoch: 79, train_loss: 0.4580, test_loss: 1.0572, test_f1: 0.6819
 epoch: 80, train_loss: 0.4849, test_loss: 0.9534, test_f1: 0.7066
 epoch: 81, train_loss: 0.4613, test_loss: 1.0185, test_f1: 0.6701
 epoch: 82, train_loss: 0.4669, test_loss: 0.9519, test_f1: 0.7060
 epoch: 83, train_loss: 0.4698, test_loss: 1.0547, test_f1: 0.6901
 epoch: 84, train_loss: 0.4842, test_loss: 1.0851, test_f1: 0.6776
 epoch: 85, train_loss: 0.4378, test_loss: 1.0705, test_f1: 0.6741
 epoch: 86, train_loss: 0.4548, test_loss: 1.0985, test_f1: 0.6752
 epoch: 87, train_loss: 0.4278, test_loss: 1.0445, test_f1: 0.7043
 epoch: 88, train_loss: 0.4493, test_loss: 1.0508, test_f1: 0.6799
 epoch: 89, train_loss: 0.4464, test_loss: 1.1218, test_f1: 0.6964
 epoch: 90, train_loss: 0.4465, test_loss: 1.1431, test_f1: 0.7109
 epoch: 91, train_loss: 0.4290, test_loss: 1.0688, test_f1: 0.6922
 epoch: 92, train_loss: 0.4030, test_loss: 1.2086, test_f1: 0.6936
 epoch: 93, train_loss: 0.4146, test_loss: 1.2586, test_f1: 0.7032
 epoch: 94, train_loss: 0.4287, test_loss: 1.2621, test_f1: 0.6713
 epoch: 95, train_loss: 0.4259, test_loss: 1.3414, test_f1: 0.6680
 epoch: 96, train_loss: 0.4147, test_loss: 1.1863, test_f1: 0.6961
 epoch: 97, train_loss: 0.4156, test_loss: 1.2323, test_f1: 0.7029
 epoch: 98, train_loss: 0.4458, test_loss: 1.1933, test_f1: 0.6909
 epoch: 99, train_loss: 0.4475, test_loss: 1.0765, test_f1: 0.6845

Training completed in 823.06 seconds
Best F1: 0.7124 at epoch 75
Mean F1 across iterations: 0.7010  0.0093
========================FINAL RESULTS================================
FEGIN weighted F1: 0.7124  0.0093
python main.py --data ltspice_examples --representation component_pin_net --model FEGIN --layers 2 --hiddens 128 --batch_size 32 --lr 0.01 --emb_size 128 --epochs 100 --save_appendix component_pin_net_L2_H128_BS32_LR0.01_E128 --no_val
-----



STDERR:
  File "main.py", line 370, in <module>
    main()
  File "main.py", line 254, in main
    dataset = dataset_class(
  File "/home/philip/projects/ltspice_examples_code_repo/Circuit-Completion-Using-GNNs/component_classification_with_link_prediction_head/evaluation/FEGIN/kernel/circuit_datasets.py", line 15, in __init__
    self.data, self.slices = torch.load(self.processed_paths[0])
  File "/home/philip/.local/lib/python3.8/site-packages/torch/serialization.py", line 1040, in load
    warnings.warn(
  File "/usr/lib/python3.8/warnings.py", line 109, in _showwarnmsg
    sw(msg.message, msg.category, msg.filename, msg.lineno,
  File "main.py", line 47, in warn_with_traceback
    traceback.print_stack(file=log)
/home/philip/projects/ltspice_examples_code_repo/Circuit-Completion-Using-GNNs/component_classification_with_link_prediction_head/evaluation/FEGIN/kernel/circuit_datasets.py:15: FutureWarning: You are using `torch.load` with `weights_only=False` (the current default value), which uses the default pickle module implicitly. It is possible to construct malicious pickle data which will execute arbitrary code during unpickling (See https://github.com/pytorch/pytorch/blob/main/SECURITY.md#untrusted-models for more details). In a future release, the default value for `weights_only` will be flipped to `True`. This limits the functions that could be executed during unpickling. Arbitrary objects will no longer be allowed to be loaded via this mode unless they are explicitly allowlisted by the user via `torch.serialization.add_safe_globals`. We recommend you start setting `weights_only=True` for any use case where you don't have full control of the loaded file. Please open an issue on GitHub for any issues related to this experimental feature.
  self.data, self.slices = torch.load(self.processed_paths[0])
