STDOUT:
Results will be saved in /home/philip/projects/llm_inference_code_repo/Circuit-Completion-Using-GNNs/component_classification_with_link_prediction_head/evaluation/FEGIN/results/model_FEGIN_dataset_ltspice_examples
Command line input: python main.py --data ltspice_examples --representation component_pin --model FEGIN --layers 2 --hiddens 32 --batch_size 32 --lr 0.001 --emb_size 512 --epochs 100 --save_appendix component_pin_L2_H32_BS32_LR0.001_E512 --no_val
 is saved.
-----
ltspice_examples - FEGIN
Using 2 layers, 32 hidden units, h = 2
Loading component_pin representation dataset
ENTERED
Training FEGIN on component_pin representation
Train: 3560, Test: 848
##################ITERATION #0 ****************************************
 epoch: 0, train_loss: 1.2755, test_loss: 1.0951, test_f1: 0.4144
 epoch: 1, train_loss: 1.0681, test_loss: 1.0353, test_f1: 0.4356
 epoch: 2, train_loss: 1.0088, test_loss: 0.9819, test_f1: 0.4913
 epoch: 3, train_loss: 0.9889, test_loss: 1.0238, test_f1: 0.4691
 epoch: 4, train_loss: 0.9582, test_loss: 0.9725, test_f1: 0.5058
 epoch: 5, train_loss: 0.9332, test_loss: 0.9478, test_f1: 0.5173
 epoch: 6, train_loss: 0.9346, test_loss: 0.9375, test_f1: 0.5153
 epoch: 7, train_loss: 0.9104, test_loss: 0.9255, test_f1: 0.5255
 epoch: 8, train_loss: 0.8913, test_loss: 0.9029, test_f1: 0.5606
 epoch: 9, train_loss: 0.8775, test_loss: 0.8889, test_f1: 0.5391
 epoch: 10, train_loss: 0.8650, test_loss: 0.9020, test_f1: 0.5029
 epoch: 11, train_loss: 0.8758, test_loss: 0.8522, test_f1: 0.5548
 epoch: 12, train_loss: 0.8421, test_loss: 0.8663, test_f1: 0.5432
 epoch: 13, train_loss: 0.8414, test_loss: 0.8678, test_f1: 0.5265
 epoch: 14, train_loss: 0.8308, test_loss: 0.8896, test_f1: 0.5179
 epoch: 15, train_loss: 0.8271, test_loss: 0.8847, test_f1: 0.5558
 epoch: 16, train_loss: 0.8121, test_loss: 0.8773, test_f1: 0.5562
 epoch: 17, train_loss: 0.8004, test_loss: 0.8959, test_f1: 0.5649
 epoch: 18, train_loss: 0.7965, test_loss: 0.8339, test_f1: 0.5695
 epoch: 19, train_loss: 0.7837, test_loss: 0.8650, test_f1: 0.5409
 epoch: 20, train_loss: 0.7836, test_loss: 0.8568, test_f1: 0.5711
 epoch: 21, train_loss: 0.7838, test_loss: 0.8344, test_f1: 0.5880
 epoch: 22, train_loss: 0.7746, test_loss: 0.8202, test_f1: 0.5803
 epoch: 23, train_loss: 0.7743, test_loss: 0.8474, test_f1: 0.6108
 epoch: 24, train_loss: 0.7576, test_loss: 0.8486, test_f1: 0.6294
 epoch: 25, train_loss: 0.7620, test_loss: 0.8916, test_f1: 0.5884
 epoch: 26, train_loss: 0.7572, test_loss: 0.8585, test_f1: 0.5507
 epoch: 27, train_loss: 0.7638, test_loss: 0.8154, test_f1: 0.6135
 epoch: 28, train_loss: 0.7435, test_loss: 0.8975, test_f1: 0.5337
 epoch: 29, train_loss: 0.7465, test_loss: 0.8807, test_f1: 0.5595
 epoch: 30, train_loss: 0.7376, test_loss: 0.8516, test_f1: 0.5782
 epoch: 31, train_loss: 0.7272, test_loss: 0.8951, test_f1: 0.5618
 epoch: 32, train_loss: 0.7312, test_loss: 0.8842, test_f1: 0.6192
 epoch: 33, train_loss: 0.7229, test_loss: 0.8162, test_f1: 0.6349
 epoch: 34, train_loss: 0.7075, test_loss: 0.8769, test_f1: 0.6453
 epoch: 35, train_loss: 0.7142, test_loss: 0.8699, test_f1: 0.5727
 epoch: 36, train_loss: 0.6989, test_loss: 0.8484, test_f1: 0.6093
 epoch: 37, train_loss: 0.7142, test_loss: 0.8652, test_f1: 0.6205
 epoch: 38, train_loss: 0.6978, test_loss: 0.8145, test_f1: 0.6169
 epoch: 39, train_loss: 0.6939, test_loss: 0.8742, test_f1: 0.5937
 epoch: 40, train_loss: 0.6927, test_loss: 0.8074, test_f1: 0.6058
 epoch: 41, train_loss: 0.6818, test_loss: 0.8477, test_f1: 0.6062
 epoch: 42, train_loss: 0.6881, test_loss: 0.8651, test_f1: 0.6410
 epoch: 43, train_loss: 0.6846, test_loss: 0.8721, test_f1: 0.5951
 epoch: 44, train_loss: 0.6772, test_loss: 0.8893, test_f1: 0.5915
 epoch: 45, train_loss: 0.6818, test_loss: 0.8751, test_f1: 0.6101
 epoch: 46, train_loss: 0.6694, test_loss: 0.8589, test_f1: 0.6343
 epoch: 47, train_loss: 0.6838, test_loss: 0.8970, test_f1: 0.6162
 epoch: 48, train_loss: 0.6573, test_loss: 0.8841, test_f1: 0.6354
 epoch: 49, train_loss: 0.6578, test_loss: 0.8857, test_f1: 0.6531
 epoch: 50, train_loss: 0.6635, test_loss: 0.8913, test_f1: 0.6135
 epoch: 51, train_loss: 0.6473, test_loss: 0.8903, test_f1: 0.6233
 epoch: 52, train_loss: 0.6235, test_loss: 0.8718, test_f1: 0.6286
 epoch: 53, train_loss: 0.6238, test_loss: 0.9155, test_f1: 0.6278
 epoch: 54, train_loss: 0.6180, test_loss: 0.8903, test_f1: 0.6256
 epoch: 55, train_loss: 0.6140, test_loss: 0.9191, test_f1: 0.6291
 epoch: 56, train_loss: 0.6215, test_loss: 0.8987, test_f1: 0.6399
 epoch: 57, train_loss: 0.6116, test_loss: 0.9106, test_f1: 0.6323
 epoch: 58, train_loss: 0.6163, test_loss: 0.9122, test_f1: 0.6529
 epoch: 59, train_loss: 0.6100, test_loss: 0.9411, test_f1: 0.6351
 epoch: 60, train_loss: 0.6069, test_loss: 0.9766, test_f1: 0.6258
 epoch: 61, train_loss: 0.6085, test_loss: 0.8983, test_f1: 0.6339
 epoch: 62, train_loss: 0.6165, test_loss: 0.9225, test_f1: 0.6319
 epoch: 63, train_loss: 0.5955, test_loss: 1.0020, test_f1: 0.6178
 epoch: 64, train_loss: 0.6022, test_loss: 1.0016, test_f1: 0.6241
 epoch: 65, train_loss: 0.6079, test_loss: 0.9279, test_f1: 0.6464
 epoch: 66, train_loss: 0.5921, test_loss: 0.9162, test_f1: 0.6424
 epoch: 67, train_loss: 0.6099, test_loss: 0.9469, test_f1: 0.6361
 epoch: 68, train_loss: 0.6058, test_loss: 0.9332, test_f1: 0.6251
 epoch: 69, train_loss: 0.6006, test_loss: 0.9494, test_f1: 0.6378
 epoch: 70, train_loss: 0.6010, test_loss: 0.9461, test_f1: 0.6389
 epoch: 71, train_loss: 0.6046, test_loss: 0.9607, test_f1: 0.6411
 epoch: 72, train_loss: 0.5942, test_loss: 0.9437, test_f1: 0.6238
 epoch: 73, train_loss: 0.5937, test_loss: 0.9571, test_f1: 0.6364
 epoch: 74, train_loss: 0.5945, test_loss: 0.9479, test_f1: 0.6250
 epoch: 75, train_loss: 0.5912, test_loss: 0.9751, test_f1: 0.6306
 epoch: 76, train_loss: 0.5895, test_loss: 0.9352, test_f1: 0.6423
 epoch: 77, train_loss: 0.5808, test_loss: 0.9462, test_f1: 0.6348
 epoch: 78, train_loss: 0.5894, test_loss: 1.0278, test_f1: 0.6339
 epoch: 79, train_loss: 0.5788, test_loss: 0.9803, test_f1: 0.6400
 epoch: 80, train_loss: 0.5798, test_loss: 0.9540, test_f1: 0.6301
 epoch: 81, train_loss: 0.5826, test_loss: 0.9773, test_f1: 0.6386
 epoch: 82, train_loss: 0.5622, test_loss: 1.0089, test_f1: 0.6241
 epoch: 83, train_loss: 0.5796, test_loss: 0.9758, test_f1: 0.6421
 epoch: 84, train_loss: 0.5910, test_loss: 1.0175, test_f1: 0.6372
 epoch: 85, train_loss: 0.5832, test_loss: 1.0453, test_f1: 0.6320
 epoch: 86, train_loss: 0.5803, test_loss: 1.0339, test_f1: 0.6245
 epoch: 87, train_loss: 0.5899, test_loss: 0.9691, test_f1: 0.6321
 epoch: 88, train_loss: 0.5629, test_loss: 1.0833, test_f1: 0.6397
 epoch: 89, train_loss: 0.5686, test_loss: 1.0022, test_f1: 0.6305
 epoch: 90, train_loss: 0.5805, test_loss: 1.0034, test_f1: 0.6422
 epoch: 91, train_loss: 0.5651, test_loss: 1.0032, test_f1: 0.6440
 epoch: 92, train_loss: 0.5628, test_loss: 0.9827, test_f1: 0.6480
 epoch: 93, train_loss: 0.5478, test_loss: 0.9974, test_f1: 0.6282
 epoch: 94, train_loss: 0.5664, test_loss: 1.0235, test_f1: 0.6439
 epoch: 95, train_loss: 0.5622, test_loss: 0.9851, test_f1: 0.6444
 epoch: 96, train_loss: 0.5567, test_loss: 0.9995, test_f1: 0.6210
 epoch: 97, train_loss: 0.5801, test_loss: 1.0242, test_f1: 0.6347
 epoch: 98, train_loss: 0.5521, test_loss: 0.9860, test_f1: 0.6440
 epoch: 99, train_loss: 0.5578, test_loss: 0.9855, test_f1: 0.6166
##################ITERATION #1 ****************************************
 epoch: 0, train_loss: 1.0977, test_loss: 1.0002, test_f1: 0.3985
 epoch: 1, train_loss: 1.0021, test_loss: 1.0067, test_f1: 0.4903
 epoch: 2, train_loss: 0.9661, test_loss: 0.9812, test_f1: 0.5479
 epoch: 3, train_loss: 0.9470, test_loss: 0.9481, test_f1: 0.5317
 epoch: 4, train_loss: 0.9304, test_loss: 0.9383, test_f1: 0.5330
 epoch: 5, train_loss: 0.9071, test_loss: 0.8863, test_f1: 0.5319
 epoch: 6, train_loss: 0.8984, test_loss: 0.9158, test_f1: 0.5251
 epoch: 7, train_loss: 0.8812, test_loss: 0.9424, test_f1: 0.5250
 epoch: 8, train_loss: 0.8601, test_loss: 0.8951, test_f1: 0.5425
 epoch: 9, train_loss: 0.8546, test_loss: 0.8530, test_f1: 0.5465
 epoch: 10, train_loss: 0.8615, test_loss: 0.8281, test_f1: 0.5719
 epoch: 11, train_loss: 0.8383, test_loss: 0.8955, test_f1: 0.5488
 epoch: 12, train_loss: 0.8248, test_loss: 0.8069, test_f1: 0.5753
 epoch: 13, train_loss: 0.8224, test_loss: 0.8440, test_f1: 0.5580
 epoch: 14, train_loss: 0.7994, test_loss: 0.8026, test_f1: 0.5481
 epoch: 15, train_loss: 0.8012, test_loss: 0.8497, test_f1: 0.5489
 epoch: 16, train_loss: 0.7855, test_loss: 0.8250, test_f1: 0.5595
 epoch: 17, train_loss: 0.7984, test_loss: 0.8142, test_f1: 0.5730
 epoch: 18, train_loss: 0.7770, test_loss: 0.9191, test_f1: 0.5555
 epoch: 19, train_loss: 0.7769, test_loss: 0.8073, test_f1: 0.5730
 epoch: 20, train_loss: 0.7698, test_loss: 0.7939, test_f1: 0.5968
 epoch: 21, train_loss: 0.7484, test_loss: 0.7858, test_f1: 0.5745
 epoch: 22, train_loss: 0.7630, test_loss: 0.8490, test_f1: 0.5854
 epoch: 23, train_loss: 0.7515, test_loss: 0.8518, test_f1: 0.5782
 epoch: 24, train_loss: 0.7591, test_loss: 0.7868, test_f1: 0.6084
 epoch: 25, train_loss: 0.7503, test_loss: 0.8269, test_f1: 0.5744
 epoch: 26, train_loss: 0.7410, test_loss: 0.7921, test_f1: 0.5622
 epoch: 27, train_loss: 0.7276, test_loss: 0.7834, test_f1: 0.5902
 epoch: 28, train_loss: 0.7262, test_loss: 0.8649, test_f1: 0.5938
 epoch: 29, train_loss: 0.7171, test_loss: 0.7775, test_f1: 0.6141
 epoch: 30, train_loss: 0.7141, test_loss: 0.8454, test_f1: 0.5737
 epoch: 31, train_loss: 0.7139, test_loss: 0.8114, test_f1: 0.5980
 epoch: 32, train_loss: 0.7011, test_loss: 0.8069, test_f1: 0.6269
 epoch: 33, train_loss: 0.6974, test_loss: 0.8094, test_f1: 0.5958
 epoch: 34, train_loss: 0.6965, test_loss: 0.8078, test_f1: 0.5935
 epoch: 35, train_loss: 0.6791, test_loss: 0.7882, test_f1: 0.6199
 epoch: 36, train_loss: 0.6924, test_loss: 0.8154, test_f1: 0.6155
 epoch: 37, train_loss: 0.6879, test_loss: 0.7724, test_f1: 0.6510
 epoch: 38, train_loss: 0.6695, test_loss: 0.7895, test_f1: 0.6268
 epoch: 39, train_loss: 0.6813, test_loss: 0.8428, test_f1: 0.6225
 epoch: 40, train_loss: 0.6705, test_loss: 0.8121, test_f1: 0.6076
 epoch: 41, train_loss: 0.6723, test_loss: 0.8215, test_f1: 0.6198
 epoch: 42, train_loss: 0.6736, test_loss: 0.8100, test_f1: 0.6283
 epoch: 43, train_loss: 0.6548, test_loss: 0.8084, test_f1: 0.6368
 epoch: 44, train_loss: 0.6493, test_loss: 0.8255, test_f1: 0.6203
 epoch: 45, train_loss: 0.6571, test_loss: 0.8226, test_f1: 0.6228
 epoch: 46, train_loss: 0.6453, test_loss: 0.8481, test_f1: 0.6033
 epoch: 47, train_loss: 0.6616, test_loss: 0.7996, test_f1: 0.6019
 epoch: 48, train_loss: 0.6470, test_loss: 0.8241, test_f1: 0.6322
 epoch: 49, train_loss: 0.6624, test_loss: 0.8736, test_f1: 0.6390
 epoch: 50, train_loss: 0.6396, test_loss: 0.8700, test_f1: 0.6091
 epoch: 51, train_loss: 0.6242, test_loss: 0.8278, test_f1: 0.6152
 epoch: 52, train_loss: 0.6205, test_loss: 0.8452, test_f1: 0.6224
 epoch: 53, train_loss: 0.6198, test_loss: 0.8343, test_f1: 0.6253
 epoch: 54, train_loss: 0.6071, test_loss: 0.8288, test_f1: 0.6342
 epoch: 55, train_loss: 0.5877, test_loss: 0.8645, test_f1: 0.6121
 epoch: 56, train_loss: 0.6025, test_loss: 0.8197, test_f1: 0.6343
 epoch: 57, train_loss: 0.6022, test_loss: 0.8444, test_f1: 0.6536
 epoch: 58, train_loss: 0.5994, test_loss: 0.8659, test_f1: 0.6322
 epoch: 59, train_loss: 0.5849, test_loss: 0.8377, test_f1: 0.6502
 epoch: 60, train_loss: 0.5967, test_loss: 0.8732, test_f1: 0.6242
 epoch: 61, train_loss: 0.5955, test_loss: 0.8356, test_f1: 0.6448
 epoch: 62, train_loss: 0.5890, test_loss: 0.8630, test_f1: 0.6490
 epoch: 63, train_loss: 0.5902, test_loss: 0.8666, test_f1: 0.6322
 epoch: 64, train_loss: 0.5855, test_loss: 0.8752, test_f1: 0.6333
 epoch: 65, train_loss: 0.5877, test_loss: 0.8546, test_f1: 0.6439
 epoch: 66, train_loss: 0.5904, test_loss: 0.8385, test_f1: 0.6418
 epoch: 67, train_loss: 0.5868, test_loss: 0.8604, test_f1: 0.6412
 epoch: 68, train_loss: 0.5762, test_loss: 0.8651, test_f1: 0.6497
 epoch: 69, train_loss: 0.5761, test_loss: 0.8834, test_f1: 0.6207
 epoch: 70, train_loss: 0.5732, test_loss: 0.8848, test_f1: 0.6481
 epoch: 71, train_loss: 0.5679, test_loss: 0.9076, test_f1: 0.6379
 epoch: 72, train_loss: 0.5599, test_loss: 0.9318, test_f1: 0.6519
 epoch: 73, train_loss: 0.5766, test_loss: 0.9084, test_f1: 0.6346
 epoch: 74, train_loss: 0.5709, test_loss: 0.8801, test_f1: 0.6555
 epoch: 75, train_loss: 0.5588, test_loss: 0.8885, test_f1: 0.6373
 epoch: 76, train_loss: 0.5630, test_loss: 0.8930, test_f1: 0.6322
 epoch: 77, train_loss: 0.5617, test_loss: 0.9265, test_f1: 0.6285
 epoch: 78, train_loss: 0.5736, test_loss: 0.8800, test_f1: 0.6401
 epoch: 79, train_loss: 0.5776, test_loss: 0.8427, test_f1: 0.6454
 epoch: 80, train_loss: 0.5709, test_loss: 0.9591, test_f1: 0.6349
 epoch: 81, train_loss: 0.5630, test_loss: 0.9455, test_f1: 0.6322
 epoch: 82, train_loss: 0.5560, test_loss: 0.9441, test_f1: 0.6304
 epoch: 83, train_loss: 0.5639, test_loss: 0.9186, test_f1: 0.6532
 epoch: 84, train_loss: 0.5656, test_loss: 0.9156, test_f1: 0.6571
 epoch: 85, train_loss: 0.5608, test_loss: 0.9262, test_f1: 0.6460
 epoch: 86, train_loss: 0.5589, test_loss: 0.9303, test_f1: 0.6410
 epoch: 87, train_loss: 0.5576, test_loss: 0.9132, test_f1: 0.6342
 epoch: 88, train_loss: 0.5444, test_loss: 0.9128, test_f1: 0.6251
 epoch: 89, train_loss: 0.5516, test_loss: 0.9273, test_f1: 0.6426
 epoch: 90, train_loss: 0.5511, test_loss: 0.9019, test_f1: 0.6347
 epoch: 91, train_loss: 0.5538, test_loss: 0.8578, test_f1: 0.6408
 epoch: 92, train_loss: 0.5412, test_loss: 0.9502, test_f1: 0.6420
 epoch: 93, train_loss: 0.5443, test_loss: 0.9547, test_f1: 0.6511
 epoch: 94, train_loss: 0.5418, test_loss: 0.8953, test_f1: 0.6496
 epoch: 95, train_loss: 0.5449, test_loss: 0.9275, test_f1: 0.6358
 epoch: 96, train_loss: 0.5238, test_loss: 0.9709, test_f1: 0.6464
 epoch: 97, train_loss: 0.5508, test_loss: 0.9743, test_f1: 0.6412
 epoch: 98, train_loss: 0.5354, test_loss: 0.9590, test_f1: 0.6449
 epoch: 99, train_loss: 0.5220, test_loss: 0.9586, test_f1: 0.6268
##################ITERATION #2 ****************************************
 epoch: 0, train_loss: 1.1182, test_loss: 1.0533, test_f1: 0.3601
 epoch: 1, train_loss: 1.0196, test_loss: 0.9873, test_f1: 0.5081
 epoch: 2, train_loss: 0.9933, test_loss: 0.9544, test_f1: 0.5187
 epoch: 3, train_loss: 0.9624, test_loss: 0.9006, test_f1: 0.5482
 epoch: 4, train_loss: 0.9532, test_loss: 0.9255, test_f1: 0.5317
 epoch: 5, train_loss: 0.9340, test_loss: 0.9447, test_f1: 0.4976
 epoch: 6, train_loss: 0.9027, test_loss: 0.9399, test_f1: 0.5092
 epoch: 7, train_loss: 0.8947, test_loss: 0.8698, test_f1: 0.5130
 epoch: 8, train_loss: 0.8627, test_loss: 0.9145, test_f1: 0.5283
 epoch: 9, train_loss: 0.8583, test_loss: 0.8937, test_f1: 0.5547
 epoch: 10, train_loss: 0.8359, test_loss: 0.8672, test_f1: 0.5738
 epoch: 11, train_loss: 0.8476, test_loss: 0.8975, test_f1: 0.5552
 epoch: 12, train_loss: 0.8302, test_loss: 0.8546, test_f1: 0.5398
 epoch: 13, train_loss: 0.8119, test_loss: 0.9621, test_f1: 0.4970
 epoch: 14, train_loss: 0.8176, test_loss: 0.8914, test_f1: 0.5207
 epoch: 15, train_loss: 0.8088, test_loss: 0.9289, test_f1: 0.5010
 epoch: 16, train_loss: 0.8034, test_loss: 0.9241, test_f1: 0.5165
 epoch: 17, train_loss: 0.7952, test_loss: 0.8594, test_f1: 0.5356
 epoch: 18, train_loss: 0.7954, test_loss: 0.8350, test_f1: 0.5482
 epoch: 19, train_loss: 0.7725, test_loss: 0.8448, test_f1: 0.5437
 epoch: 20, train_loss: 0.7744, test_loss: 0.9278, test_f1: 0.5166
 epoch: 21, train_loss: 0.7665, test_loss: 0.8440, test_f1: 0.5872
 epoch: 22, train_loss: 0.7559, test_loss: 0.8419, test_f1: 0.5675
 epoch: 23, train_loss: 0.7524, test_loss: 0.9124, test_f1: 0.5465
 epoch: 24, train_loss: 0.7496, test_loss: 0.9183, test_f1: 0.5863
 epoch: 25, train_loss: 0.7412, test_loss: 0.7956, test_f1: 0.5670
 epoch: 26, train_loss: 0.7325, test_loss: 0.8852, test_f1: 0.5636
 epoch: 27, train_loss: 0.7364, test_loss: 0.8569, test_f1: 0.5555
 epoch: 28, train_loss: 0.7497, test_loss: 0.9643, test_f1: 0.5293
 epoch: 29, train_loss: 0.7306, test_loss: 0.8493, test_f1: 0.5436
 epoch: 30, train_loss: 0.7248, test_loss: 0.8729, test_f1: 0.5488
 epoch: 31, train_loss: 0.7201, test_loss: 0.8602, test_f1: 0.6113
 epoch: 32, train_loss: 0.7159, test_loss: 0.8193, test_f1: 0.5765
 epoch: 33, train_loss: 0.7140, test_loss: 0.8617, test_f1: 0.5696
 epoch: 34, train_loss: 0.7038, test_loss: 0.8400, test_f1: 0.5802
 epoch: 35, train_loss: 0.7002, test_loss: 0.8293, test_f1: 0.6051
 epoch: 36, train_loss: 0.6931, test_loss: 0.8496, test_f1: 0.5594
 epoch: 37, train_loss: 0.6943, test_loss: 0.8073, test_f1: 0.5995
 epoch: 38, train_loss: 0.6865, test_loss: 0.8420, test_f1: 0.6050
 epoch: 39, train_loss: 0.7007, test_loss: 0.8533, test_f1: 0.5403
 epoch: 40, train_loss: 0.6820, test_loss: 0.8436, test_f1: 0.5791
 epoch: 41, train_loss: 0.6870, test_loss: 0.8460, test_f1: 0.5755
 epoch: 42, train_loss: 0.6667, test_loss: 0.8528, test_f1: 0.6198
 epoch: 43, train_loss: 0.6789, test_loss: 0.9737, test_f1: 0.5974
 epoch: 44, train_loss: 0.6720, test_loss: 0.8867, test_f1: 0.6112
 epoch: 45, train_loss: 0.6827, test_loss: 0.8209, test_f1: 0.6107
 epoch: 46, train_loss: 0.6749, test_loss: 0.8240, test_f1: 0.5879
 epoch: 47, train_loss: 0.6614, test_loss: 0.9340, test_f1: 0.6155
 epoch: 48, train_loss: 0.6532, test_loss: 0.8155, test_f1: 0.6068
 epoch: 49, train_loss: 0.6424, test_loss: 0.8370, test_f1: 0.6281
 epoch: 50, train_loss: 0.6480, test_loss: 0.8523, test_f1: 0.6261
 epoch: 51, train_loss: 0.6320, test_loss: 0.8758, test_f1: 0.6022
 epoch: 52, train_loss: 0.6060, test_loss: 0.8667, test_f1: 0.6222
 epoch: 53, train_loss: 0.6124, test_loss: 0.9183, test_f1: 0.6245
 epoch: 54, train_loss: 0.6160, test_loss: 0.8771, test_f1: 0.6081
 epoch: 55, train_loss: 0.6120, test_loss: 0.9000, test_f1: 0.6205
 epoch: 56, train_loss: 0.6051, test_loss: 0.9583, test_f1: 0.6268
 epoch: 57, train_loss: 0.6130, test_loss: 0.9494, test_f1: 0.6010
 epoch: 58, train_loss: 0.6009, test_loss: 0.9176, test_f1: 0.6173
 epoch: 59, train_loss: 0.6035, test_loss: 0.8787, test_f1: 0.6266
 epoch: 60, train_loss: 0.6070, test_loss: 0.8772, test_f1: 0.6493
 epoch: 61, train_loss: 0.5987, test_loss: 0.8952, test_f1: 0.6201
 epoch: 62, train_loss: 0.5862, test_loss: 0.8635, test_f1: 0.6316
 epoch: 63, train_loss: 0.5830, test_loss: 0.8981, test_f1: 0.6540
 epoch: 64, train_loss: 0.5865, test_loss: 0.9015, test_f1: 0.6347
 epoch: 65, train_loss: 0.5856, test_loss: 0.9409, test_f1: 0.6250
 epoch: 66, train_loss: 0.5914, test_loss: 0.8989, test_f1: 0.6453
 epoch: 67, train_loss: 0.5908, test_loss: 0.9168, test_f1: 0.6425
 epoch: 68, train_loss: 0.5860, test_loss: 0.9193, test_f1: 0.6358
 epoch: 69, train_loss: 0.5840, test_loss: 0.9525, test_f1: 0.6182
 epoch: 70, train_loss: 0.5896, test_loss: 0.9771, test_f1: 0.6239
 epoch: 71, train_loss: 0.5786, test_loss: 0.9242, test_f1: 0.6191
 epoch: 72, train_loss: 0.5634, test_loss: 0.9266, test_f1: 0.6171
 epoch: 73, train_loss: 0.5959, test_loss: 0.9685, test_f1: 0.6132
 epoch: 74, train_loss: 0.5810, test_loss: 0.9263, test_f1: 0.6496
 epoch: 75, train_loss: 0.5740, test_loss: 0.9746, test_f1: 0.6134
 epoch: 76, train_loss: 0.5826, test_loss: 0.9077, test_f1: 0.6354
 epoch: 77, train_loss: 0.5833, test_loss: 0.9415, test_f1: 0.6066
 epoch: 78, train_loss: 0.5607, test_loss: 0.9367, test_f1: 0.6234
 epoch: 79, train_loss: 0.5791, test_loss: 0.9164, test_f1: 0.6342
 epoch: 80, train_loss: 0.5714, test_loss: 0.9372, test_f1: 0.6359
 epoch: 81, train_loss: 0.5665, test_loss: 0.9585, test_f1: 0.6381
 epoch: 82, train_loss: 0.5687, test_loss: 0.9520, test_f1: 0.6586
 epoch: 83, train_loss: 0.5717, test_loss: 0.9701, test_f1: 0.6182
 epoch: 84, train_loss: 0.5643, test_loss: 0.9392, test_f1: 0.6353
 epoch: 85, train_loss: 0.5601, test_loss: 0.9647, test_f1: 0.6455
 epoch: 86, train_loss: 0.5372, test_loss: 0.9264, test_f1: 0.6190
 epoch: 87, train_loss: 0.5602, test_loss: 0.9656, test_f1: 0.6386
 epoch: 88, train_loss: 0.5495, test_loss: 0.9566, test_f1: 0.6596
 epoch: 89, train_loss: 0.5743, test_loss: 1.0082, test_f1: 0.6602
 epoch: 90, train_loss: 0.5711, test_loss: 0.9810, test_f1: 0.6480
 epoch: 91, train_loss: 0.5710, test_loss: 0.9536, test_f1: 0.6313
 epoch: 92, train_loss: 0.5595, test_loss: 0.9459, test_f1: 0.6313
 epoch: 93, train_loss: 0.5680, test_loss: 0.9404, test_f1: 0.6351
 epoch: 94, train_loss: 0.5561, test_loss: 0.9344, test_f1: 0.6583
 epoch: 95, train_loss: 0.5668, test_loss: 0.9490, test_f1: 0.6501
 epoch: 96, train_loss: 0.5616, test_loss: 0.9048, test_f1: 0.6500
 epoch: 97, train_loss: 0.5434, test_loss: 0.9750, test_f1: 0.6432
 epoch: 98, train_loss: 0.5436, test_loss: 0.9016, test_f1: 0.6308
 epoch: 99, train_loss: 0.5494, test_loss: 0.9533, test_f1: 0.6396
##################ITERATION #3 ****************************************
 epoch: 0, train_loss: 1.1719, test_loss: 0.9849, test_f1: 0.4813
 epoch: 1, train_loss: 1.0219, test_loss: 0.9735, test_f1: 0.5029
 epoch: 2, train_loss: 0.9896, test_loss: 0.9568, test_f1: 0.5300
 epoch: 3, train_loss: 0.9697, test_loss: 0.9157, test_f1: 0.5298
 epoch: 4, train_loss: 0.9460, test_loss: 0.9334, test_f1: 0.5048
 epoch: 5, train_loss: 0.9259, test_loss: 0.9480, test_f1: 0.5167
 epoch: 6, train_loss: 0.8965, test_loss: 0.8826, test_f1: 0.5297
 epoch: 7, train_loss: 0.8712, test_loss: 0.8991, test_f1: 0.5331
 epoch: 8, train_loss: 0.8770, test_loss: 0.8900, test_f1: 0.5677
 epoch: 9, train_loss: 0.8453, test_loss: 0.8930, test_f1: 0.5483
 epoch: 10, train_loss: 0.8232, test_loss: 0.8737, test_f1: 0.5601
 epoch: 11, train_loss: 0.8352, test_loss: 0.9015, test_f1: 0.5526
 epoch: 12, train_loss: 0.8191, test_loss: 0.8275, test_f1: 0.5448
 epoch: 13, train_loss: 0.8108, test_loss: 0.8621, test_f1: 0.5538
 epoch: 14, train_loss: 0.8055, test_loss: 0.8578, test_f1: 0.5724
 epoch: 15, train_loss: 0.8014, test_loss: 0.8284, test_f1: 0.5839
 epoch: 16, train_loss: 0.7895, test_loss: 0.8544, test_f1: 0.5890
 epoch: 17, train_loss: 0.7745, test_loss: 0.8802, test_f1: 0.5479
 epoch: 18, train_loss: 0.7731, test_loss: 0.8537, test_f1: 0.5724
 epoch: 19, train_loss: 0.7758, test_loss: 0.8042, test_f1: 0.5797
 epoch: 20, train_loss: 0.7729, test_loss: 0.8254, test_f1: 0.5958
 epoch: 21, train_loss: 0.7540, test_loss: 0.8862, test_f1: 0.5672
 epoch: 22, train_loss: 0.7408, test_loss: 0.7613, test_f1: 0.6099
 epoch: 23, train_loss: 0.7273, test_loss: 0.8180, test_f1: 0.5832
 epoch: 24, train_loss: 0.7397, test_loss: 0.8213, test_f1: 0.5895
 epoch: 25, train_loss: 0.7377, test_loss: 0.7967, test_f1: 0.6028
 epoch: 26, train_loss: 0.7326, test_loss: 0.8228, test_f1: 0.5819
 epoch: 27, train_loss: 0.7314, test_loss: 0.8441, test_f1: 0.5963
 epoch: 28, train_loss: 0.7527, test_loss: 0.8817, test_f1: 0.5810
 epoch: 29, train_loss: 0.7476, test_loss: 0.8475, test_f1: 0.5964
 epoch: 30, train_loss: 0.7160, test_loss: 0.7904, test_f1: 0.5880
 epoch: 31, train_loss: 0.7268, test_loss: 0.7753, test_f1: 0.6211
 epoch: 32, train_loss: 0.7154, test_loss: 0.8002, test_f1: 0.5778
 epoch: 33, train_loss: 0.7100, test_loss: 0.7693, test_f1: 0.6076
 epoch: 34, train_loss: 0.7060, test_loss: 0.8082, test_f1: 0.6010
 epoch: 35, train_loss: 0.7294, test_loss: 0.7926, test_f1: 0.5901
 epoch: 36, train_loss: 0.6997, test_loss: 0.7774, test_f1: 0.6094
 epoch: 37, train_loss: 0.6977, test_loss: 0.8038, test_f1: 0.6076
 epoch: 38, train_loss: 0.6736, test_loss: 0.7810, test_f1: 0.6164
 epoch: 39, train_loss: 0.6870, test_loss: 0.8012, test_f1: 0.6591
 epoch: 40, train_loss: 0.7066, test_loss: 0.7755, test_f1: 0.6303
 epoch: 41, train_loss: 0.6774, test_loss: 0.7679, test_f1: 0.6121
 epoch: 42, train_loss: 0.6714, test_loss: 0.8859, test_f1: 0.6008
 epoch: 43, train_loss: 0.6737, test_loss: 0.8278, test_f1: 0.6128
 epoch: 44, train_loss: 0.6653, test_loss: 0.7781, test_f1: 0.6098
 epoch: 45, train_loss: 0.6738, test_loss: 0.7936, test_f1: 0.6036
 epoch: 46, train_loss: 0.6746, test_loss: 0.7787, test_f1: 0.6233
 epoch: 47, train_loss: 0.6678, test_loss: 0.7961, test_f1: 0.6106
 epoch: 48, train_loss: 0.6906, test_loss: 0.7660, test_f1: 0.5958
 epoch: 49, train_loss: 0.6583, test_loss: 0.7686, test_f1: 0.6052
 epoch: 50, train_loss: 0.6572, test_loss: 0.7997, test_f1: 0.6051
 epoch: 51, train_loss: 0.6460, test_loss: 0.7359, test_f1: 0.6589
 epoch: 52, train_loss: 0.6242, test_loss: 0.7859, test_f1: 0.5998
 epoch: 53, train_loss: 0.6251, test_loss: 0.7353, test_f1: 0.6387
 epoch: 54, train_loss: 0.6224, test_loss: 0.7519, test_f1: 0.6405
 epoch: 55, train_loss: 0.6222, test_loss: 0.7526, test_f1: 0.6480
 epoch: 56, train_loss: 0.6198, test_loss: 0.7524, test_f1: 0.6316
 epoch: 57, train_loss: 0.5988, test_loss: 0.7362, test_f1: 0.6295
 epoch: 58, train_loss: 0.6042, test_loss: 0.7770, test_f1: 0.6197
 epoch: 59, train_loss: 0.6010, test_loss: 0.7532, test_f1: 0.6403
 epoch: 60, train_loss: 0.6058, test_loss: 0.7539, test_f1: 0.6552
 epoch: 61, train_loss: 0.6118, test_loss: 0.7810, test_f1: 0.6395
 epoch: 62, train_loss: 0.6070, test_loss: 0.7246, test_f1: 0.6593
 epoch: 63, train_loss: 0.6016, test_loss: 0.7492, test_f1: 0.6287
 epoch: 64, train_loss: 0.5959, test_loss: 0.7541, test_f1: 0.6438
 epoch: 65, train_loss: 0.5987, test_loss: 0.7687, test_f1: 0.6308
 epoch: 66, train_loss: 0.5937, test_loss: 0.7615, test_f1: 0.6713
 epoch: 67, train_loss: 0.5892, test_loss: 0.7383, test_f1: 0.6437
 epoch: 68, train_loss: 0.6041, test_loss: 0.7575, test_f1: 0.6336
 epoch: 69, train_loss: 0.5898, test_loss: 0.7421, test_f1: 0.6589
 epoch: 70, train_loss: 0.5872, test_loss: 0.7416, test_f1: 0.6568
 epoch: 71, train_loss: 0.6148, test_loss: 0.7538, test_f1: 0.6637
 epoch: 72, train_loss: 0.5920, test_loss: 0.7387, test_f1: 0.6420
 epoch: 73, train_loss: 0.5747, test_loss: 0.7371, test_f1: 0.6679
 epoch: 74, train_loss: 0.5743, test_loss: 0.7474, test_f1: 0.6601
 epoch: 75, train_loss: 0.5945, test_loss: 0.7607, test_f1: 0.6377
 epoch: 76, train_loss: 0.5878, test_loss: 0.7484, test_f1: 0.6316
 epoch: 77, train_loss: 0.5820, test_loss: 0.7453, test_f1: 0.6664
 epoch: 78, train_loss: 0.5759, test_loss: 0.7649, test_f1: 0.6525
 epoch: 79, train_loss: 0.5774, test_loss: 0.7534, test_f1: 0.6628
 epoch: 80, train_loss: 0.5819, test_loss: 0.7920, test_f1: 0.6514
 epoch: 81, train_loss: 0.5834, test_loss: 0.7627, test_f1: 0.6592
 epoch: 82, train_loss: 0.5740, test_loss: 0.7545, test_f1: 0.6543
 epoch: 83, train_loss: 0.5734, test_loss: 0.7427, test_f1: 0.6720
 epoch: 84, train_loss: 0.5695, test_loss: 0.7267, test_f1: 0.6770
 epoch: 85, train_loss: 0.5785, test_loss: 0.7255, test_f1: 0.6584
 epoch: 86, train_loss: 0.5676, test_loss: 0.7438, test_f1: 0.6685
 epoch: 87, train_loss: 0.5658, test_loss: 0.7680, test_f1: 0.6836
 epoch: 88, train_loss: 0.5765, test_loss: 0.7474, test_f1: 0.6702
 epoch: 89, train_loss: 0.5675, test_loss: 0.7432, test_f1: 0.6796
 epoch: 90, train_loss: 0.5648, test_loss: 0.7828, test_f1: 0.6526
 epoch: 91, train_loss: 0.5825, test_loss: 0.7416, test_f1: 0.6828
 epoch: 92, train_loss: 0.5687, test_loss: 0.7540, test_f1: 0.6627
 epoch: 93, train_loss: 0.5578, test_loss: 0.7629, test_f1: 0.6831
 epoch: 94, train_loss: 0.5552, test_loss: 0.7956, test_f1: 0.6761
 epoch: 95, train_loss: 0.5624, test_loss: 0.7586, test_f1: 0.6745
 epoch: 96, train_loss: 0.5763, test_loss: 0.7536, test_f1: 0.6827
 epoch: 97, train_loss: 0.5647, test_loss: 0.7290, test_f1: 0.6551
 epoch: 98, train_loss: 0.5443, test_loss: 0.7591, test_f1: 0.6587
 epoch: 99, train_loss: 0.5527, test_loss: 0.7299, test_f1: 0.6745
##################ITERATION #4 ****************************************
 epoch: 0, train_loss: 1.1747, test_loss: 1.0793, test_f1: 0.4614
 epoch: 1, train_loss: 1.0214, test_loss: 0.9631, test_f1: 0.4973
 epoch: 2, train_loss: 0.9900, test_loss: 0.9975, test_f1: 0.4481
 epoch: 3, train_loss: 0.9444, test_loss: 0.9305, test_f1: 0.5065
 epoch: 4, train_loss: 0.9402, test_loss: 0.9780, test_f1: 0.5014
 epoch: 5, train_loss: 0.9206, test_loss: 0.9147, test_f1: 0.4998
 epoch: 6, train_loss: 0.9028, test_loss: 1.0095, test_f1: 0.5188
 epoch: 7, train_loss: 0.9018, test_loss: 0.8869, test_f1: 0.5190
 epoch: 8, train_loss: 0.8749, test_loss: 0.8906, test_f1: 0.5314
 epoch: 9, train_loss: 0.8678, test_loss: 0.8686, test_f1: 0.5419
 epoch: 10, train_loss: 0.8528, test_loss: 0.8110, test_f1: 0.5512
 epoch: 11, train_loss: 0.8511, test_loss: 0.8285, test_f1: 0.5650
 epoch: 12, train_loss: 0.8436, test_loss: 0.8230, test_f1: 0.5607
 epoch: 13, train_loss: 0.8286, test_loss: 0.8342, test_f1: 0.5574
 epoch: 14, train_loss: 0.8227, test_loss: 0.8851, test_f1: 0.5275
 epoch: 15, train_loss: 0.8060, test_loss: 0.8220, test_f1: 0.5645
 epoch: 16, train_loss: 0.7974, test_loss: 0.8470, test_f1: 0.5514
 epoch: 17, train_loss: 0.8015, test_loss: 0.8420, test_f1: 0.5748
 epoch: 18, train_loss: 0.7994, test_loss: 0.8510, test_f1: 0.5436
 epoch: 19, train_loss: 0.7876, test_loss: 0.8586, test_f1: 0.5723
 epoch: 20, train_loss: 0.7977, test_loss: 0.8165, test_f1: 0.5634
 epoch: 21, train_loss: 0.7835, test_loss: 0.8409, test_f1: 0.5785
 epoch: 22, train_loss: 0.7763, test_loss: 0.8590, test_f1: 0.5457
 epoch: 23, train_loss: 0.7741, test_loss: 0.8804, test_f1: 0.5699
 epoch: 24, train_loss: 0.7581, test_loss: 0.8570, test_f1: 0.5767
 epoch: 25, train_loss: 0.7499, test_loss: 0.7910, test_f1: 0.5990
 epoch: 26, train_loss: 0.7514, test_loss: 0.8021, test_f1: 0.6234
 epoch: 27, train_loss: 0.7476, test_loss: 0.8165, test_f1: 0.5828
 epoch: 28, train_loss: 0.7462, test_loss: 0.7731, test_f1: 0.6117
 epoch: 29, train_loss: 0.7467, test_loss: 0.8190, test_f1: 0.5830
 epoch: 30, train_loss: 0.7342, test_loss: 0.8213, test_f1: 0.5659
 epoch: 31, train_loss: 0.7257, test_loss: 0.7761, test_f1: 0.5909
 epoch: 32, train_loss: 0.7272, test_loss: 0.7920, test_f1: 0.6118
 epoch: 33, train_loss: 0.7181, test_loss: 0.7909, test_f1: 0.5794
 epoch: 34, train_loss: 0.7249, test_loss: 0.8138, test_f1: 0.6061
 epoch: 35, train_loss: 0.7005, test_loss: 0.8418, test_f1: 0.6156
 epoch: 36, train_loss: 0.6946, test_loss: 0.7984, test_f1: 0.6350
 epoch: 37, train_loss: 0.7086, test_loss: 0.8296, test_f1: 0.6193
 epoch: 38, train_loss: 0.7011, test_loss: 0.7730, test_f1: 0.6246
 epoch: 39, train_loss: 0.7021, test_loss: 0.9275, test_f1: 0.5583
 epoch: 40, train_loss: 0.7070, test_loss: 0.8116, test_f1: 0.6178
 epoch: 41, train_loss: 0.6862, test_loss: 0.8306, test_f1: 0.6044
 epoch: 42, train_loss: 0.6921, test_loss: 0.7957, test_f1: 0.6274
 epoch: 43, train_loss: 0.6834, test_loss: 0.7655, test_f1: 0.6185
 epoch: 44, train_loss: 0.6923, test_loss: 0.8091, test_f1: 0.6066
 epoch: 45, train_loss: 0.6833, test_loss: 0.7773, test_f1: 0.6358
 epoch: 46, train_loss: 0.6822, test_loss: 0.8952, test_f1: 0.5860
 epoch: 47, train_loss: 0.6844, test_loss: 0.7814, test_f1: 0.6139
 epoch: 48, train_loss: 0.6788, test_loss: 0.8361, test_f1: 0.6047
 epoch: 49, train_loss: 0.6894, test_loss: 0.8868, test_f1: 0.6180
 epoch: 50, train_loss: 0.6717, test_loss: 0.8694, test_f1: 0.6261
 epoch: 51, train_loss: 0.6456, test_loss: 0.8223, test_f1: 0.6240
 epoch: 52, train_loss: 0.6412, test_loss: 0.8051, test_f1: 0.6342
 epoch: 53, train_loss: 0.6317, test_loss: 0.7960, test_f1: 0.6236
 epoch: 54, train_loss: 0.6410, test_loss: 0.8236, test_f1: 0.6091
 epoch: 55, train_loss: 0.6318, test_loss: 0.8197, test_f1: 0.6412
 epoch: 56, train_loss: 0.6464, test_loss: 0.8027, test_f1: 0.6499
 epoch: 57, train_loss: 0.6261, test_loss: 0.8175, test_f1: 0.6317
 epoch: 58, train_loss: 0.6381, test_loss: 0.8257, test_f1: 0.6308
 epoch: 59, train_loss: 0.6263, test_loss: 0.8039, test_f1: 0.6337
 epoch: 60, train_loss: 0.6306, test_loss: 0.8093, test_f1: 0.6389
 epoch: 61, train_loss: 0.6126, test_loss: 0.7634, test_f1: 0.6605
 epoch: 62, train_loss: 0.6157, test_loss: 0.7939, test_f1: 0.6436
 epoch: 63, train_loss: 0.6274, test_loss: 0.8062, test_f1: 0.6420
 epoch: 64, train_loss: 0.6243, test_loss: 0.8543, test_f1: 0.6202
 epoch: 65, train_loss: 0.6131, test_loss: 0.8264, test_f1: 0.6484
 epoch: 66, train_loss: 0.6238, test_loss: 0.8760, test_f1: 0.6212
 epoch: 67, train_loss: 0.6234, test_loss: 0.7997, test_f1: 0.6300
 epoch: 68, train_loss: 0.6167, test_loss: 0.8364, test_f1: 0.6355
 epoch: 69, train_loss: 0.6158, test_loss: 0.8044, test_f1: 0.6501
 epoch: 70, train_loss: 0.6070, test_loss: 0.8808, test_f1: 0.6159
 epoch: 71, train_loss: 0.6164, test_loss: 0.7983, test_f1: 0.6477
 epoch: 72, train_loss: 0.6035, test_loss: 0.7919, test_f1: 0.6522
 epoch: 73, train_loss: 0.6072, test_loss: 0.8140, test_f1: 0.6202
 epoch: 74, train_loss: 0.5998, test_loss: 0.8475, test_f1: 0.6227
 epoch: 75, train_loss: 0.6009, test_loss: 0.7970, test_f1: 0.6495
 epoch: 76, train_loss: 0.6024, test_loss: 0.7898, test_f1: 0.6362
 epoch: 77, train_loss: 0.6012, test_loss: 0.8021, test_f1: 0.6152
 epoch: 78, train_loss: 0.6095, test_loss: 0.8091, test_f1: 0.6352
 epoch: 79, train_loss: 0.5938, test_loss: 0.7608, test_f1: 0.6463
 epoch: 80, train_loss: 0.5920, test_loss: 0.7912, test_f1: 0.6381
 epoch: 81, train_loss: 0.6060, test_loss: 0.8179, test_f1: 0.6429
 epoch: 82, train_loss: 0.5914, test_loss: 0.8379, test_f1: 0.6352
 epoch: 83, train_loss: 0.6129, test_loss: 0.8261, test_f1: 0.6325
 epoch: 84, train_loss: 0.5958, test_loss: 0.8426, test_f1: 0.6349
 epoch: 85, train_loss: 0.5795, test_loss: 0.8462, test_f1: 0.6204
 epoch: 86, train_loss: 0.5934, test_loss: 0.7867, test_f1: 0.6551
 epoch: 87, train_loss: 0.6055, test_loss: 0.8835, test_f1: 0.6056
 epoch: 88, train_loss: 0.5938, test_loss: 0.8448, test_f1: 0.6436
 epoch: 89, train_loss: 0.5899, test_loss: 0.8087, test_f1: 0.6512
 epoch: 90, train_loss: 0.5698, test_loss: 0.8312, test_f1: 0.6468
 epoch: 91, train_loss: 0.5825, test_loss: 0.8698, test_f1: 0.6247
 epoch: 92, train_loss: 0.5832, test_loss: 0.8495, test_f1: 0.6353
 epoch: 93, train_loss: 0.5954, test_loss: 0.8451, test_f1: 0.6292
 epoch: 94, train_loss: 0.5731, test_loss: 0.8422, test_f1: 0.6398
 epoch: 95, train_loss: 0.5800, test_loss: 0.8258, test_f1: 0.6402
 epoch: 96, train_loss: 0.5759, test_loss: 0.8735, test_f1: 0.6206
 epoch: 97, train_loss: 0.5750, test_loss: 0.8866, test_f1: 0.6280
 epoch: 98, train_loss: 0.5847, test_loss: 0.8632, test_f1: 0.6257
 epoch: 99, train_loss: 0.5834, test_loss: 0.8176, test_f1: 0.6279
##################ITERATION #5 ****************************************
 epoch: 0, train_loss: 1.1726, test_loss: 0.9734, test_f1: 0.4636
 epoch: 1, train_loss: 1.0078, test_loss: 0.9335, test_f1: 0.4946
 epoch: 2, train_loss: 0.9783, test_loss: 0.9429, test_f1: 0.5238
 epoch: 3, train_loss: 0.9671, test_loss: 0.9073, test_f1: 0.5160
 epoch: 4, train_loss: 0.9480, test_loss: 0.9549, test_f1: 0.4945
 epoch: 5, train_loss: 0.9193, test_loss: 0.8658, test_f1: 0.5138
 epoch: 6, train_loss: 0.9082, test_loss: 0.9163, test_f1: 0.5199
 epoch: 7, train_loss: 0.8901, test_loss: 0.9119, test_f1: 0.5076
 epoch: 8, train_loss: 0.8789, test_loss: 0.8885, test_f1: 0.5157
 epoch: 9, train_loss: 0.8694, test_loss: 0.9353, test_f1: 0.5128
 epoch: 10, train_loss: 0.8606, test_loss: 1.0307, test_f1: 0.4709
 epoch: 11, train_loss: 0.8445, test_loss: 0.8749, test_f1: 0.5135
 epoch: 12, train_loss: 0.8238, test_loss: 0.9064, test_f1: 0.5019
 epoch: 13, train_loss: 0.8434, test_loss: 0.9195, test_f1: 0.5294
 epoch: 14, train_loss: 0.8119, test_loss: 0.9764, test_f1: 0.5010
 epoch: 15, train_loss: 0.8161, test_loss: 0.9276, test_f1: 0.5297
 epoch: 16, train_loss: 0.7996, test_loss: 0.8532, test_f1: 0.5535
 epoch: 17, train_loss: 0.7768, test_loss: 0.9469, test_f1: 0.5375
 epoch: 18, train_loss: 0.7783, test_loss: 0.9109, test_f1: 0.5670
 epoch: 19, train_loss: 0.7944, test_loss: 0.8955, test_f1: 0.5431
 epoch: 20, train_loss: 0.7708, test_loss: 0.9164, test_f1: 0.5487
 epoch: 21, train_loss: 0.7614, test_loss: 0.8737, test_f1: 0.5505
 epoch: 22, train_loss: 0.7654, test_loss: 0.8585, test_f1: 0.5431
 epoch: 23, train_loss: 0.7726, test_loss: 0.8858, test_f1: 0.5782
 epoch: 24, train_loss: 0.7654, test_loss: 0.8481, test_f1: 0.5224
 epoch: 25, train_loss: 0.7426, test_loss: 0.9229, test_f1: 0.5327
 epoch: 26, train_loss: 0.7494, test_loss: 0.8442, test_f1: 0.5843
 epoch: 27, train_loss: 0.7359, test_loss: 0.8750, test_f1: 0.5938
 epoch: 28, train_loss: 0.7404, test_loss: 0.8238, test_f1: 0.5849
 epoch: 29, train_loss: 0.7286, test_loss: 0.9188, test_f1: 0.5256
 epoch: 30, train_loss: 0.7208, test_loss: 0.9293, test_f1: 0.5514
 epoch: 31, train_loss: 0.7303, test_loss: 0.8626, test_f1: 0.6088
 epoch: 32, train_loss: 0.7185, test_loss: 0.8633, test_f1: 0.5511
 epoch: 33, train_loss: 0.7140, test_loss: 0.8763, test_f1: 0.5410
 epoch: 34, train_loss: 0.7115, test_loss: 0.8183, test_f1: 0.5778
 epoch: 35, train_loss: 0.7045, test_loss: 0.8990, test_f1: 0.5752
 epoch: 36, train_loss: 0.6949, test_loss: 0.9787, test_f1: 0.5786
 epoch: 37, train_loss: 0.6932, test_loss: 0.8722, test_f1: 0.5932
 epoch: 38, train_loss: 0.6829, test_loss: 0.8702, test_f1: 0.5843
 epoch: 39, train_loss: 0.6923, test_loss: 0.8820, test_f1: 0.5990
 epoch: 40, train_loss: 0.6960, test_loss: 0.8670, test_f1: 0.5842
 epoch: 41, train_loss: 0.6828, test_loss: 0.8870, test_f1: 0.6013
 epoch: 42, train_loss: 0.6872, test_loss: 0.8659, test_f1: 0.5807
 epoch: 43, train_loss: 0.6810, test_loss: 0.8675, test_f1: 0.6071
 epoch: 44, train_loss: 0.6818, test_loss: 0.9354, test_f1: 0.5588
 epoch: 45, train_loss: 0.6683, test_loss: 0.8225, test_f1: 0.6052
 epoch: 46, train_loss: 0.6763, test_loss: 0.8735, test_f1: 0.6120
 epoch: 47, train_loss: 0.6691, test_loss: 0.8918, test_f1: 0.6005
 epoch: 48, train_loss: 0.6758, test_loss: 0.9075, test_f1: 0.5860
 epoch: 49, train_loss: 0.6879, test_loss: 0.8450, test_f1: 0.5599
 epoch: 50, train_loss: 0.6667, test_loss: 0.9106, test_f1: 0.5952
 epoch: 51, train_loss: 0.6363, test_loss: 0.8605, test_f1: 0.6131
 epoch: 52, train_loss: 0.6320, test_loss: 0.8881, test_f1: 0.5935
 epoch: 53, train_loss: 0.6261, test_loss: 0.8484, test_f1: 0.6155
 epoch: 54, train_loss: 0.6388, test_loss: 0.8616, test_f1: 0.6135
 epoch: 55, train_loss: 0.6139, test_loss: 0.9059, test_f1: 0.6163
 epoch: 56, train_loss: 0.6139, test_loss: 0.8660, test_f1: 0.6016
 epoch: 57, train_loss: 0.6307, test_loss: 0.8569, test_f1: 0.6241
 epoch: 58, train_loss: 0.6142, test_loss: 0.9040, test_f1: 0.6157
 epoch: 59, train_loss: 0.6135, test_loss: 0.8797, test_f1: 0.6114
 epoch: 60, train_loss: 0.6214, test_loss: 0.8716, test_f1: 0.6272
 epoch: 61, train_loss: 0.6108, test_loss: 0.9118, test_f1: 0.6122
 epoch: 62, train_loss: 0.6152, test_loss: 0.9223, test_f1: 0.5935
 epoch: 63, train_loss: 0.6019, test_loss: 0.8956, test_f1: 0.6088
 epoch: 64, train_loss: 0.6015, test_loss: 0.8922, test_f1: 0.6350
 epoch: 65, train_loss: 0.6033, test_loss: 0.8997, test_f1: 0.6277
 epoch: 66, train_loss: 0.6071, test_loss: 0.8367, test_f1: 0.6319
 epoch: 67, train_loss: 0.6049, test_loss: 0.8684, test_f1: 0.6114
 epoch: 68, train_loss: 0.6061, test_loss: 0.9092, test_f1: 0.6149
 epoch: 69, train_loss: 0.5957, test_loss: 0.9257, test_f1: 0.6000
 epoch: 70, train_loss: 0.6168, test_loss: 0.9256, test_f1: 0.6276
 epoch: 71, train_loss: 0.5934, test_loss: 0.9393, test_f1: 0.6183
 epoch: 72, train_loss: 0.5945, test_loss: 0.8697, test_f1: 0.6192
 epoch: 73, train_loss: 0.5877, test_loss: 0.9061, test_f1: 0.6075
 epoch: 74, train_loss: 0.5940, test_loss: 0.8677, test_f1: 0.6294
 epoch: 75, train_loss: 0.6071, test_loss: 0.9463, test_f1: 0.6208
 epoch: 76, train_loss: 0.5909, test_loss: 0.8934, test_f1: 0.6263
 epoch: 77, train_loss: 0.5901, test_loss: 0.8866, test_f1: 0.6063
 epoch: 78, train_loss: 0.5918, test_loss: 0.9863, test_f1: 0.6094
 epoch: 79, train_loss: 0.5875, test_loss: 0.9384, test_f1: 0.6040
 epoch: 80, train_loss: 0.5873, test_loss: 0.9228, test_f1: 0.6150
 epoch: 81, train_loss: 0.5964, test_loss: 0.9289, test_f1: 0.6198
 epoch: 82, train_loss: 0.5743, test_loss: 0.9305, test_f1: 0.6291
 epoch: 83, train_loss: 0.5777, test_loss: 0.9352, test_f1: 0.6350
 epoch: 84, train_loss: 0.5737, test_loss: 1.0468, test_f1: 0.6150
 epoch: 85, train_loss: 0.5916, test_loss: 0.9858, test_f1: 0.6150
 epoch: 86, train_loss: 0.5791, test_loss: 0.9597, test_f1: 0.6407
 epoch: 87, train_loss: 0.5690, test_loss: 1.0335, test_f1: 0.5964
 epoch: 88, train_loss: 0.5741, test_loss: 1.0344, test_f1: 0.6054
 epoch: 89, train_loss: 0.5717, test_loss: 0.9695, test_f1: 0.5959
 epoch: 90, train_loss: 0.5655, test_loss: 0.9463, test_f1: 0.6071
 epoch: 91, train_loss: 0.5749, test_loss: 0.9930, test_f1: 0.6219
 epoch: 92, train_loss: 0.5653, test_loss: 0.9456, test_f1: 0.6236
 epoch: 93, train_loss: 0.5691, test_loss: 1.0376, test_f1: 0.5935
 epoch: 94, train_loss: 0.5766, test_loss: 0.9214, test_f1: 0.6304
 epoch: 95, train_loss: 0.5550, test_loss: 0.9483, test_f1: 0.6187
 epoch: 96, train_loss: 0.5640, test_loss: 0.9513, test_f1: 0.6062
 epoch: 97, train_loss: 0.5575, test_loss: 1.0067, test_f1: 0.6223
 epoch: 98, train_loss: 0.5506, test_loss: 0.9881, test_f1: 0.6262
 epoch: 99, train_loss: 0.5648, test_loss: 0.9912, test_f1: 0.6300
##################ITERATION #6 ****************************************
 epoch: 0, train_loss: 1.2043, test_loss: 1.0306, test_f1: 0.3770
 epoch: 1, train_loss: 1.0125, test_loss: 0.9612, test_f1: 0.4895
 epoch: 2, train_loss: 0.9815, test_loss: 0.9445, test_f1: 0.4845
 epoch: 3, train_loss: 0.9611, test_loss: 0.9562, test_f1: 0.4732
 epoch: 4, train_loss: 0.9342, test_loss: 0.9033, test_f1: 0.5144
 epoch: 5, train_loss: 0.9297, test_loss: 0.9193, test_f1: 0.5042
 epoch: 6, train_loss: 0.9034, test_loss: 0.9129, test_f1: 0.4754
 epoch: 7, train_loss: 0.9018, test_loss: 0.8987, test_f1: 0.4948
 epoch: 8, train_loss: 0.8900, test_loss: 0.9404, test_f1: 0.5063
 epoch: 9, train_loss: 0.8941, test_loss: 0.9104, test_f1: 0.4899
 epoch: 10, train_loss: 0.8694, test_loss: 0.8669, test_f1: 0.5471
 epoch: 11, train_loss: 0.8533, test_loss: 0.8676, test_f1: 0.5337
 epoch: 12, train_loss: 0.8443, test_loss: 0.8877, test_f1: 0.5534
 epoch: 13, train_loss: 0.8471, test_loss: 0.8698, test_f1: 0.5720
 epoch: 14, train_loss: 0.8414, test_loss: 0.8946, test_f1: 0.5540
 epoch: 15, train_loss: 0.8234, test_loss: 0.8641, test_f1: 0.5520
 epoch: 16, train_loss: 0.8136, test_loss: 0.8898, test_f1: 0.5587
 epoch: 17, train_loss: 0.8021, test_loss: 0.9077, test_f1: 0.5387
 epoch: 18, train_loss: 0.8033, test_loss: 0.8700, test_f1: 0.5698
 epoch: 19, train_loss: 0.7986, test_loss: 0.8381, test_f1: 0.5911
 epoch: 20, train_loss: 0.7939, test_loss: 0.9337, test_f1: 0.5258
 epoch: 21, train_loss: 0.7898, test_loss: 0.8232, test_f1: 0.5633
 epoch: 22, train_loss: 0.7716, test_loss: 0.8124, test_f1: 0.5835
 epoch: 23, train_loss: 0.7831, test_loss: 0.8544, test_f1: 0.5693
 epoch: 24, train_loss: 0.7757, test_loss: 0.8214, test_f1: 0.5719
 epoch: 25, train_loss: 0.7567, test_loss: 0.9444, test_f1: 0.5505
 epoch: 26, train_loss: 0.7600, test_loss: 0.8613, test_f1: 0.5633
 epoch: 27, train_loss: 0.7605, test_loss: 0.8013, test_f1: 0.6281
 epoch: 28, train_loss: 0.7496, test_loss: 0.8789, test_f1: 0.5469
 epoch: 29, train_loss: 0.7347, test_loss: 0.8642, test_f1: 0.6015
 epoch: 30, train_loss: 0.7442, test_loss: 0.8861, test_f1: 0.5224
 epoch: 31, train_loss: 0.7424, test_loss: 0.7762, test_f1: 0.5907
 epoch: 32, train_loss: 0.7177, test_loss: 0.8034, test_f1: 0.5959
 epoch: 33, train_loss: 0.7278, test_loss: 0.8120, test_f1: 0.5755
 epoch: 34, train_loss: 0.7198, test_loss: 0.8510, test_f1: 0.5950
 epoch: 35, train_loss: 0.7248, test_loss: 0.8091, test_f1: 0.6063
 epoch: 36, train_loss: 0.7136, test_loss: 0.8235, test_f1: 0.6045
 epoch: 37, train_loss: 0.7131, test_loss: 0.8016, test_f1: 0.5786
 epoch: 38, train_loss: 0.6929, test_loss: 0.8473, test_f1: 0.5759
 epoch: 39, train_loss: 0.7012, test_loss: 0.8037, test_f1: 0.6074
 epoch: 40, train_loss: 0.7028, test_loss: 0.7766, test_f1: 0.6266
 epoch: 41, train_loss: 0.7140, test_loss: 0.8189, test_f1: 0.5781
 epoch: 42, train_loss: 0.7010, test_loss: 0.7809, test_f1: 0.5749
 epoch: 43, train_loss: 0.6945, test_loss: 0.8009, test_f1: 0.6160
 epoch: 44, train_loss: 0.6874, test_loss: 0.8911, test_f1: 0.6057
 epoch: 45, train_loss: 0.6857, test_loss: 0.9508, test_f1: 0.5729
 epoch: 46, train_loss: 0.6796, test_loss: 0.8436, test_f1: 0.6013
 epoch: 47, train_loss: 0.6650, test_loss: 0.8464, test_f1: 0.6154
 epoch: 48, train_loss: 0.6814, test_loss: 0.7983, test_f1: 0.6277
 epoch: 49, train_loss: 0.6768, test_loss: 0.8159, test_f1: 0.6169
 epoch: 50, train_loss: 0.6653, test_loss: 0.8278, test_f1: 0.5898
 epoch: 51, train_loss: 0.6456, test_loss: 0.8046, test_f1: 0.6069
 epoch: 52, train_loss: 0.6307, test_loss: 0.8045, test_f1: 0.6211
 epoch: 53, train_loss: 0.6332, test_loss: 0.8161, test_f1: 0.6226
 epoch: 54, train_loss: 0.6178, test_loss: 0.7992, test_f1: 0.6335
 epoch: 55, train_loss: 0.6247, test_loss: 0.8226, test_f1: 0.6222
 epoch: 56, train_loss: 0.6179, test_loss: 0.8037, test_f1: 0.6448
 epoch: 57, train_loss: 0.6148, test_loss: 0.7708, test_f1: 0.6603
 epoch: 58, train_loss: 0.6107, test_loss: 0.7927, test_f1: 0.6272
 epoch: 59, train_loss: 0.6103, test_loss: 0.8321, test_f1: 0.6242
 epoch: 60, train_loss: 0.6098, test_loss: 0.8603, test_f1: 0.6102
 epoch: 61, train_loss: 0.6287, test_loss: 0.8082, test_f1: 0.6359
 epoch: 62, train_loss: 0.6030, test_loss: 0.8100, test_f1: 0.6305
 epoch: 63, train_loss: 0.6019, test_loss: 0.7934, test_f1: 0.6436
 epoch: 64, train_loss: 0.6177, test_loss: 0.8151, test_f1: 0.6300
 epoch: 65, train_loss: 0.6030, test_loss: 0.7887, test_f1: 0.6430
 epoch: 66, train_loss: 0.6015, test_loss: 0.8630, test_f1: 0.6217
 epoch: 67, train_loss: 0.6309, test_loss: 0.8640, test_f1: 0.6154
 epoch: 68, train_loss: 0.5995, test_loss: 0.8118, test_f1: 0.6158
 epoch: 69, train_loss: 0.5924, test_loss: 0.8296, test_f1: 0.6412
 epoch: 70, train_loss: 0.6018, test_loss: 0.8065, test_f1: 0.6574
 epoch: 71, train_loss: 0.6043, test_loss: 0.8472, test_f1: 0.6175
 epoch: 72, train_loss: 0.5922, test_loss: 0.7876, test_f1: 0.6405
 epoch: 73, train_loss: 0.5966, test_loss: 0.8014, test_f1: 0.6532
 epoch: 74, train_loss: 0.5897, test_loss: 0.8183, test_f1: 0.6321
 epoch: 75, train_loss: 0.5817, test_loss: 0.8130, test_f1: 0.6585
 epoch: 76, train_loss: 0.5839, test_loss: 0.8127, test_f1: 0.6550
 epoch: 77, train_loss: 0.5862, test_loss: 0.8337, test_f1: 0.6200
 epoch: 78, train_loss: 0.5955, test_loss: 0.8279, test_f1: 0.6252
 epoch: 79, train_loss: 0.5934, test_loss: 0.8092, test_f1: 0.6115
 epoch: 80, train_loss: 0.5951, test_loss: 0.8189, test_f1: 0.6163
 epoch: 81, train_loss: 0.5762, test_loss: 0.8001, test_f1: 0.6455
 epoch: 82, train_loss: 0.5772, test_loss: 0.8037, test_f1: 0.6552
 epoch: 83, train_loss: 0.5751, test_loss: 0.8385, test_f1: 0.6322
 epoch: 84, train_loss: 0.5758, test_loss: 0.8064, test_f1: 0.6574
 epoch: 85, train_loss: 0.5790, test_loss: 0.8027, test_f1: 0.6403
 epoch: 86, train_loss: 0.5836, test_loss: 0.8504, test_f1: 0.6411
 epoch: 87, train_loss: 0.5749, test_loss: 0.8040, test_f1: 0.6422
 epoch: 88, train_loss: 0.5712, test_loss: 0.8570, test_f1: 0.6374
 epoch: 89, train_loss: 0.5623, test_loss: 0.8711, test_f1: 0.6207
 epoch: 90, train_loss: 0.5642, test_loss: 0.8832, test_f1: 0.6683
 epoch: 91, train_loss: 0.5805, test_loss: 0.8573, test_f1: 0.6256
 epoch: 92, train_loss: 0.5586, test_loss: 0.8712, test_f1: 0.6372
 epoch: 93, train_loss: 0.5564, test_loss: 0.8660, test_f1: 0.6640
 epoch: 94, train_loss: 0.5572, test_loss: 0.8757, test_f1: 0.6255
 epoch: 95, train_loss: 0.5577, test_loss: 0.8298, test_f1: 0.6578
 epoch: 96, train_loss: 0.5655, test_loss: 0.9195, test_f1: 0.6298
 epoch: 97, train_loss: 0.5656, test_loss: 0.9134, test_f1: 0.6376
 epoch: 98, train_loss: 0.5594, test_loss: 0.8998, test_f1: 0.6108
 epoch: 99, train_loss: 0.5594, test_loss: 0.8561, test_f1: 0.6282
##################ITERATION #7 ****************************************
 epoch: 0, train_loss: 1.1584, test_loss: 0.9860, test_f1: 0.4594
 epoch: 1, train_loss: 1.0085, test_loss: 0.9997, test_f1: 0.4950
 epoch: 2, train_loss: 0.9729, test_loss: 0.9500, test_f1: 0.5046
 epoch: 3, train_loss: 0.9537, test_loss: 0.9715, test_f1: 0.4735
 epoch: 4, train_loss: 0.9240, test_loss: 0.9153, test_f1: 0.4948
 epoch: 5, train_loss: 0.9255, test_loss: 1.0115, test_f1: 0.4960
 epoch: 6, train_loss: 0.9167, test_loss: 0.9180, test_f1: 0.5683
 epoch: 7, train_loss: 0.9039, test_loss: 0.9283, test_f1: 0.5644
 epoch: 8, train_loss: 0.8808, test_loss: 0.9151, test_f1: 0.5493
 epoch: 9, train_loss: 0.8786, test_loss: 0.9132, test_f1: 0.5229
 epoch: 10, train_loss: 0.8546, test_loss: 0.9416, test_f1: 0.5581
 epoch: 11, train_loss: 0.8544, test_loss: 0.9142, test_f1: 0.5546
 epoch: 12, train_loss: 0.8427, test_loss: 0.8861, test_f1: 0.5297
 epoch: 13, train_loss: 0.8499, test_loss: 0.9068, test_f1: 0.5335
 epoch: 14, train_loss: 0.8307, test_loss: 0.9544, test_f1: 0.5409
 epoch: 15, train_loss: 0.8318, test_loss: 0.8481, test_f1: 0.5343
 epoch: 16, train_loss: 0.8183, test_loss: 0.8699, test_f1: 0.5903
 epoch: 17, train_loss: 0.8069, test_loss: 0.8828, test_f1: 0.5707
 epoch: 18, train_loss: 0.8152, test_loss: 0.8946, test_f1: 0.5706
 epoch: 19, train_loss: 0.7943, test_loss: 0.8868, test_f1: 0.5667
 epoch: 20, train_loss: 0.7898, test_loss: 0.8704, test_f1: 0.5464
 epoch: 21, train_loss: 0.7862, test_loss: 0.8816, test_f1: 0.5492
 epoch: 22, train_loss: 0.7653, test_loss: 0.8711, test_f1: 0.6039
 epoch: 23, train_loss: 0.7777, test_loss: 0.8614, test_f1: 0.5749
 epoch: 24, train_loss: 0.7621, test_loss: 0.8398, test_f1: 0.5950
 epoch: 25, train_loss: 0.7612, test_loss: 0.8545, test_f1: 0.5807
 epoch: 26, train_loss: 0.7644, test_loss: 0.8595, test_f1: 0.5755
 epoch: 27, train_loss: 0.7416, test_loss: 0.8669, test_f1: 0.6002
 epoch: 28, train_loss: 0.7436, test_loss: 0.8802, test_f1: 0.5894
 epoch: 29, train_loss: 0.7585, test_loss: 0.8471, test_f1: 0.5859
 epoch: 30, train_loss: 0.7224, test_loss: 0.9025, test_f1: 0.5834
 epoch: 31, train_loss: 0.7390, test_loss: 0.8576, test_f1: 0.5881
 epoch: 32, train_loss: 0.7318, test_loss: 0.8510, test_f1: 0.5980
 epoch: 33, train_loss: 0.7236, test_loss: 0.8681, test_f1: 0.5698
 epoch: 34, train_loss: 0.7237, test_loss: 0.9069, test_f1: 0.5858
 epoch: 35, train_loss: 0.7188, test_loss: 0.8793, test_f1: 0.5951
 epoch: 36, train_loss: 0.7168, test_loss: 0.9762, test_f1: 0.5737
 epoch: 37, train_loss: 0.7153, test_loss: 0.9028, test_f1: 0.5918
 epoch: 38, train_loss: 0.7088, test_loss: 0.8553, test_f1: 0.5913
 epoch: 39, train_loss: 0.7215, test_loss: 0.8804, test_f1: 0.6031
 epoch: 40, train_loss: 0.7097, test_loss: 0.8833, test_f1: 0.6042
 epoch: 41, train_loss: 0.6926, test_loss: 0.9040, test_f1: 0.6325
 epoch: 42, train_loss: 0.6823, test_loss: 0.9548, test_f1: 0.5904
 epoch: 43, train_loss: 0.6930, test_loss: 0.8810, test_f1: 0.6004
 epoch: 44, train_loss: 0.6869, test_loss: 0.9084, test_f1: 0.6081
 epoch: 45, train_loss: 0.6806, test_loss: 0.8715, test_f1: 0.6403
 epoch: 46, train_loss: 0.6630, test_loss: 0.8965, test_f1: 0.6156
 epoch: 47, train_loss: 0.6865, test_loss: 0.9762, test_f1: 0.5994
 epoch: 48, train_loss: 0.6672, test_loss: 0.9037, test_f1: 0.6343
 epoch: 49, train_loss: 0.6655, test_loss: 0.8542, test_f1: 0.6481
 epoch: 50, train_loss: 0.6480, test_loss: 0.8701, test_f1: 0.5996
 epoch: 51, train_loss: 0.6762, test_loss: 0.9251, test_f1: 0.6095
 epoch: 52, train_loss: 0.6498, test_loss: 0.9322, test_f1: 0.6181
 epoch: 53, train_loss: 0.6382, test_loss: 0.8847, test_f1: 0.6198
 epoch: 54, train_loss: 0.6528, test_loss: 0.8652, test_f1: 0.6339
 epoch: 55, train_loss: 0.6370, test_loss: 0.9225, test_f1: 0.6202
 epoch: 56, train_loss: 0.6290, test_loss: 0.9225, test_f1: 0.6183
 epoch: 57, train_loss: 0.6306, test_loss: 0.9084, test_f1: 0.6334
 epoch: 58, train_loss: 0.6216, test_loss: 0.9425, test_f1: 0.6208
 epoch: 59, train_loss: 0.6243, test_loss: 0.9304, test_f1: 0.6233
 epoch: 60, train_loss: 0.6368, test_loss: 0.8973, test_f1: 0.6430
 epoch: 61, train_loss: 0.6294, test_loss: 0.9379, test_f1: 0.6251
 epoch: 62, train_loss: 0.6138, test_loss: 0.9139, test_f1: 0.6375
 epoch: 63, train_loss: 0.6199, test_loss: 0.9105, test_f1: 0.6157
 epoch: 64, train_loss: 0.6062, test_loss: 0.9196, test_f1: 0.6286
 epoch: 65, train_loss: 0.6153, test_loss: 0.9072, test_f1: 0.6321
 epoch: 66, train_loss: 0.6127, test_loss: 0.9232, test_f1: 0.6231
 epoch: 67, train_loss: 0.6174, test_loss: 0.8785, test_f1: 0.6163
 epoch: 68, train_loss: 0.6138, test_loss: 0.9401, test_f1: 0.6226
 epoch: 69, train_loss: 0.6180, test_loss: 0.9024, test_f1: 0.6271
 epoch: 70, train_loss: 0.6047, test_loss: 0.9175, test_f1: 0.6334
 epoch: 71, train_loss: 0.6129, test_loss: 0.9189, test_f1: 0.6546
 epoch: 72, train_loss: 0.5962, test_loss: 0.9350, test_f1: 0.6411
 epoch: 73, train_loss: 0.6081, test_loss: 0.9656, test_f1: 0.6104
 epoch: 74, train_loss: 0.5998, test_loss: 0.9229, test_f1: 0.6381
 epoch: 75, train_loss: 0.5907, test_loss: 0.9183, test_f1: 0.6502
 epoch: 76, train_loss: 0.5940, test_loss: 0.9703, test_f1: 0.6307
 epoch: 77, train_loss: 0.5972, test_loss: 0.9517, test_f1: 0.6300
 epoch: 78, train_loss: 0.5955, test_loss: 0.9220, test_f1: 0.6580
 epoch: 79, train_loss: 0.5787, test_loss: 0.9490, test_f1: 0.6421
 epoch: 80, train_loss: 0.5923, test_loss: 0.9895, test_f1: 0.6286
 epoch: 81, train_loss: 0.5871, test_loss: 0.9164, test_f1: 0.6271
 epoch: 82, train_loss: 0.5963, test_loss: 0.9416, test_f1: 0.6342
 epoch: 83, train_loss: 0.5870, test_loss: 0.9545, test_f1: 0.6394
 epoch: 84, train_loss: 0.5962, test_loss: 0.9355, test_f1: 0.6275
 epoch: 85, train_loss: 0.5902, test_loss: 0.9612, test_f1: 0.6250
 epoch: 86, train_loss: 0.5952, test_loss: 0.9471, test_f1: 0.6160
 epoch: 87, train_loss: 0.5948, test_loss: 0.9050, test_f1: 0.6407
 epoch: 88, train_loss: 0.5933, test_loss: 0.9405, test_f1: 0.6271
 epoch: 89, train_loss: 0.5850, test_loss: 0.9139, test_f1: 0.6477
 epoch: 90, train_loss: 0.5782, test_loss: 0.9702, test_f1: 0.6047
 epoch: 91, train_loss: 0.5930, test_loss: 0.9481, test_f1: 0.6232
 epoch: 92, train_loss: 0.5820, test_loss: 0.9525, test_f1: 0.6307
 epoch: 93, train_loss: 0.5808, test_loss: 0.9377, test_f1: 0.6130
 epoch: 94, train_loss: 0.5875, test_loss: 0.9411, test_f1: 0.6469
 epoch: 95, train_loss: 0.5730, test_loss: 0.9607, test_f1: 0.6183
 epoch: 96, train_loss: 0.5788, test_loss: 0.9476, test_f1: 0.6335
 epoch: 97, train_loss: 0.5691, test_loss: 0.9765, test_f1: 0.6242
 epoch: 98, train_loss: 0.5661, test_loss: 0.9743, test_f1: 0.6468
 epoch: 99, train_loss: 0.5659, test_loss: 1.0197, test_f1: 0.6352
##################ITERATION #8 ****************************************
 epoch: 0, train_loss: 1.1714, test_loss: 1.0431, test_f1: 0.4553
 epoch: 1, train_loss: 1.0256, test_loss: 1.0042, test_f1: 0.5173
 epoch: 2, train_loss: 1.0020, test_loss: 1.0131, test_f1: 0.4536
 epoch: 3, train_loss: 0.9774, test_loss: 0.9586, test_f1: 0.5019
 epoch: 4, train_loss: 0.9609, test_loss: 0.9675, test_f1: 0.4981
 epoch: 5, train_loss: 0.9400, test_loss: 0.9504, test_f1: 0.4702
 epoch: 6, train_loss: 0.9250, test_loss: 0.9907, test_f1: 0.4916
 epoch: 7, train_loss: 0.9077, test_loss: 0.9573, test_f1: 0.5093
 epoch: 8, train_loss: 0.8868, test_loss: 0.9603, test_f1: 0.5254
 epoch: 9, train_loss: 0.8811, test_loss: 0.9252, test_f1: 0.5066
 epoch: 10, train_loss: 0.8635, test_loss: 0.8933, test_f1: 0.5284
 epoch: 11, train_loss: 0.8789, test_loss: 0.8770, test_f1: 0.5342
 epoch: 12, train_loss: 0.8557, test_loss: 0.8813, test_f1: 0.5488
 epoch: 13, train_loss: 0.8471, test_loss: 1.0531, test_f1: 0.4955
 epoch: 14, train_loss: 0.8380, test_loss: 0.9823, test_f1: 0.5126
 epoch: 15, train_loss: 0.8311, test_loss: 0.8966, test_f1: 0.5411
 epoch: 16, train_loss: 0.8145, test_loss: 0.8967, test_f1: 0.5630
 epoch: 17, train_loss: 0.8229, test_loss: 0.8787, test_f1: 0.5512
 epoch: 18, train_loss: 0.8164, test_loss: 0.8710, test_f1: 0.5633
 epoch: 19, train_loss: 0.8043, test_loss: 0.9055, test_f1: 0.5434
 epoch: 20, train_loss: 0.7841, test_loss: 0.8586, test_f1: 0.6071
 epoch: 21, train_loss: 0.7809, test_loss: 0.8644, test_f1: 0.5510
 epoch: 22, train_loss: 0.7909, test_loss: 1.0298, test_f1: 0.5094
 epoch: 23, train_loss: 0.7886, test_loss: 0.9451, test_f1: 0.5497
 epoch: 24, train_loss: 0.7881, test_loss: 0.8753, test_f1: 0.5487
 epoch: 25, train_loss: 0.7727, test_loss: 0.9102, test_f1: 0.5626
 epoch: 26, train_loss: 0.7648, test_loss: 0.8651, test_f1: 0.5741
 epoch: 27, train_loss: 0.7696, test_loss: 0.8693, test_f1: 0.5873
 epoch: 28, train_loss: 0.7597, test_loss: 0.8748, test_f1: 0.5731
 epoch: 29, train_loss: 0.7555, test_loss: 0.8174, test_f1: 0.5923
 epoch: 30, train_loss: 0.7527, test_loss: 0.8424, test_f1: 0.5711
 epoch: 31, train_loss: 0.7439, test_loss: 0.8741, test_f1: 0.5722
 epoch: 32, train_loss: 0.7380, test_loss: 0.8543, test_f1: 0.5766
 epoch: 33, train_loss: 0.7482, test_loss: 0.8340, test_f1: 0.6155
 epoch: 34, train_loss: 0.7491, test_loss: 0.8811, test_f1: 0.5959
 epoch: 35, train_loss: 0.7238, test_loss: 0.8740, test_f1: 0.5810
 epoch: 36, train_loss: 0.7291, test_loss: 0.8546, test_f1: 0.6003
 epoch: 37, train_loss: 0.7198, test_loss: 0.8569, test_f1: 0.6028
 epoch: 38, train_loss: 0.7218, test_loss: 0.8120, test_f1: 0.6043
 epoch: 39, train_loss: 0.7296, test_loss: 0.8167, test_f1: 0.6258
 epoch: 40, train_loss: 0.7142, test_loss: 0.8102, test_f1: 0.6280
 epoch: 41, train_loss: 0.7182, test_loss: 0.9045, test_f1: 0.5754
 epoch: 42, train_loss: 0.6984, test_loss: 0.8364, test_f1: 0.6205
 epoch: 43, train_loss: 0.7017, test_loss: 0.8426, test_f1: 0.6192
 epoch: 44, train_loss: 0.6941, test_loss: 0.8461, test_f1: 0.6120
 epoch: 45, train_loss: 0.7017, test_loss: 0.9079, test_f1: 0.6066
 epoch: 46, train_loss: 0.6825, test_loss: 0.8342, test_f1: 0.6038
 epoch: 47, train_loss: 0.6950, test_loss: 0.8161, test_f1: 0.6360
 epoch: 48, train_loss: 0.6974, test_loss: 0.8558, test_f1: 0.6160
 epoch: 49, train_loss: 0.6831, test_loss: 0.8480, test_f1: 0.6235
 epoch: 50, train_loss: 0.6845, test_loss: 0.8398, test_f1: 0.6020
 epoch: 51, train_loss: 0.6663, test_loss: 0.8377, test_f1: 0.6431
 epoch: 52, train_loss: 0.6487, test_loss: 0.8597, test_f1: 0.6057
 epoch: 53, train_loss: 0.6467, test_loss: 0.8454, test_f1: 0.6206
 epoch: 54, train_loss: 0.6559, test_loss: 0.8208, test_f1: 0.6553
 epoch: 55, train_loss: 0.6441, test_loss: 0.8842, test_f1: 0.6043
 epoch: 56, train_loss: 0.6462, test_loss: 0.8361, test_f1: 0.6214
 epoch: 57, train_loss: 0.6477, test_loss: 0.8452, test_f1: 0.6301
 epoch: 58, train_loss: 0.6312, test_loss: 0.8727, test_f1: 0.6088
 epoch: 59, train_loss: 0.6303, test_loss: 0.8187, test_f1: 0.6396
 epoch: 60, train_loss: 0.6380, test_loss: 0.8448, test_f1: 0.6371
 epoch: 61, train_loss: 0.6260, test_loss: 0.8986, test_f1: 0.6166
 epoch: 62, train_loss: 0.6321, test_loss: 0.8172, test_f1: 0.6548
 epoch: 63, train_loss: 0.6246, test_loss: 0.8565, test_f1: 0.6123
 epoch: 64, train_loss: 0.6266, test_loss: 0.8054, test_f1: 0.6603
 epoch: 65, train_loss: 0.6282, test_loss: 0.8687, test_f1: 0.6299
 epoch: 66, train_loss: 0.6138, test_loss: 0.8469, test_f1: 0.6268
 epoch: 67, train_loss: 0.6192, test_loss: 0.8396, test_f1: 0.6332
 epoch: 68, train_loss: 0.6071, test_loss: 0.8698, test_f1: 0.6294
 epoch: 69, train_loss: 0.6112, test_loss: 0.8667, test_f1: 0.6475
 epoch: 70, train_loss: 0.6195, test_loss: 0.8308, test_f1: 0.6456
 epoch: 71, train_loss: 0.6092, test_loss: 0.8308, test_f1: 0.6465
 epoch: 72, train_loss: 0.6236, test_loss: 0.8437, test_f1: 0.6057
 epoch: 73, train_loss: 0.6019, test_loss: 0.8129, test_f1: 0.6767
 epoch: 74, train_loss: 0.6029, test_loss: 0.8476, test_f1: 0.6454
 epoch: 75, train_loss: 0.5791, test_loss: 0.8494, test_f1: 0.6247
 epoch: 76, train_loss: 0.5970, test_loss: 0.8717, test_f1: 0.6310
 epoch: 77, train_loss: 0.5880, test_loss: 0.8997, test_f1: 0.6322
 epoch: 78, train_loss: 0.5865, test_loss: 0.8317, test_f1: 0.6328
 epoch: 79, train_loss: 0.6103, test_loss: 0.8345, test_f1: 0.6333
 epoch: 80, train_loss: 0.5881, test_loss: 0.8450, test_f1: 0.6351
 epoch: 81, train_loss: 0.6060, test_loss: 0.8556, test_f1: 0.6403
 epoch: 82, train_loss: 0.5953, test_loss: 0.8805, test_f1: 0.6122
 epoch: 83, train_loss: 0.6024, test_loss: 0.9197, test_f1: 0.6258
 epoch: 84, train_loss: 0.6067, test_loss: 0.8383, test_f1: 0.6307
 epoch: 85, train_loss: 0.5778, test_loss: 0.8987, test_f1: 0.6352
 epoch: 86, train_loss: 0.5825, test_loss: 0.8458, test_f1: 0.6299
 epoch: 87, train_loss: 0.5945, test_loss: 0.8857, test_f1: 0.6174
 epoch: 88, train_loss: 0.5852, test_loss: 0.9089, test_f1: 0.6263
 epoch: 89, train_loss: 0.5819, test_loss: 0.8448, test_f1: 0.6408
 epoch: 90, train_loss: 0.5846, test_loss: 0.8756, test_f1: 0.6462
 epoch: 91, train_loss: 0.5844, test_loss: 0.9062, test_f1: 0.6103
 epoch: 92, train_loss: 0.5847, test_loss: 0.9060, test_f1: 0.6219
 epoch: 93, train_loss: 0.5887, test_loss: 0.9112, test_f1: 0.6420
 epoch: 94, train_loss: 0.5786, test_loss: 0.8648, test_f1: 0.6245
 epoch: 95, train_loss: 0.5707, test_loss: 0.8749, test_f1: 0.6432
 epoch: 96, train_loss: 0.5797, test_loss: 0.8669, test_f1: 0.6425
 epoch: 97, train_loss: 0.5646, test_loss: 0.9287, test_f1: 0.6391
 epoch: 98, train_loss: 0.5674, test_loss: 0.9086, test_f1: 0.6407
 epoch: 99, train_loss: 0.5699, test_loss: 0.9094, test_f1: 0.6208
##################ITERATION #9 ****************************************
 epoch: 0, train_loss: 1.2624, test_loss: 1.0342, test_f1: 0.4162
 epoch: 1, train_loss: 1.0534, test_loss: 0.9937, test_f1: 0.4930
 epoch: 2, train_loss: 1.0159, test_loss: 0.9565, test_f1: 0.5302
 epoch: 3, train_loss: 0.9879, test_loss: 0.9923, test_f1: 0.5030
 epoch: 4, train_loss: 0.9789, test_loss: 0.9506, test_f1: 0.4890
 epoch: 5, train_loss: 0.9598, test_loss: 0.9284, test_f1: 0.5510
 epoch: 6, train_loss: 0.9417, test_loss: 0.8895, test_f1: 0.5232
 epoch: 7, train_loss: 0.9320, test_loss: 0.9846, test_f1: 0.5188
 epoch: 8, train_loss: 0.9162, test_loss: 0.9354, test_f1: 0.5166
 epoch: 9, train_loss: 0.9083, test_loss: 0.9090, test_f1: 0.5255
 epoch: 10, train_loss: 0.8978, test_loss: 0.9142, test_f1: 0.5572
 epoch: 11, train_loss: 0.8882, test_loss: 0.9501, test_f1: 0.4690
 epoch: 12, train_loss: 0.8806, test_loss: 0.9011, test_f1: 0.5338
 epoch: 13, train_loss: 0.8717, test_loss: 0.9851, test_f1: 0.5088
 epoch: 14, train_loss: 0.8537, test_loss: 0.9199, test_f1: 0.5469
 epoch: 15, train_loss: 0.8601, test_loss: 0.9689, test_f1: 0.5644
 epoch: 16, train_loss: 0.8510, test_loss: 0.9097, test_f1: 0.5413
 epoch: 17, train_loss: 0.8608, test_loss: 0.8663, test_f1: 0.5615
 epoch: 18, train_loss: 0.8328, test_loss: 0.8725, test_f1: 0.5886
 epoch: 19, train_loss: 0.8299, test_loss: 0.8768, test_f1: 0.5321
 epoch: 20, train_loss: 0.8402, test_loss: 0.8702, test_f1: 0.5599
 epoch: 21, train_loss: 0.8199, test_loss: 0.8840, test_f1: 0.5381
 epoch: 22, train_loss: 0.8189, test_loss: 1.0953, test_f1: 0.5222
 epoch: 23, train_loss: 0.8303, test_loss: 0.8937, test_f1: 0.5375
 epoch: 24, train_loss: 0.8015, test_loss: 0.8889, test_f1: 0.5539
 epoch: 25, train_loss: 0.8126, test_loss: 0.8756, test_f1: 0.5863
 epoch: 26, train_loss: 0.7907, test_loss: 0.8979, test_f1: 0.5840
 epoch: 27, train_loss: 0.7994, test_loss: 0.9034, test_f1: 0.5557
 epoch: 28, train_loss: 0.7937, test_loss: 0.9332, test_f1: 0.5518
 epoch: 29, train_loss: 0.7916, test_loss: 0.8670, test_f1: 0.6003
 epoch: 30, train_loss: 0.7695, test_loss: 0.8971, test_f1: 0.5946
 epoch: 31, train_loss: 0.7733, test_loss: 0.8692, test_f1: 0.5969
 epoch: 32, train_loss: 0.7780, test_loss: 0.8650, test_f1: 0.5563
 epoch: 33, train_loss: 0.7598, test_loss: 0.8822, test_f1: 0.5703
 epoch: 34, train_loss: 0.7669, test_loss: 0.8283, test_f1: 0.5731
 epoch: 35, train_loss: 0.7634, test_loss: 0.8845, test_f1: 0.6263
 epoch: 36, train_loss: 0.7613, test_loss: 0.9367, test_f1: 0.5527
 epoch: 37, train_loss: 0.7573, test_loss: 0.9509, test_f1: 0.6137
 epoch: 38, train_loss: 0.7660, test_loss: 0.9019, test_f1: 0.5527
 epoch: 39, train_loss: 0.7569, test_loss: 0.8424, test_f1: 0.5924
 epoch: 40, train_loss: 0.7353, test_loss: 0.8768, test_f1: 0.6168
 epoch: 41, train_loss: 0.7437, test_loss: 0.8470, test_f1: 0.6019
 epoch: 42, train_loss: 0.7484, test_loss: 0.8486, test_f1: 0.5885
 epoch: 43, train_loss: 0.7358, test_loss: 0.8738, test_f1: 0.5826
 epoch: 44, train_loss: 0.7266, test_loss: 0.9140, test_f1: 0.5498
 epoch: 45, train_loss: 0.7354, test_loss: 0.8128, test_f1: 0.6091
 epoch: 46, train_loss: 0.7260, test_loss: 0.9173, test_f1: 0.6228
 epoch: 47, train_loss: 0.7285, test_loss: 0.8644, test_f1: 0.5826
 epoch: 48, train_loss: 0.7192, test_loss: 0.8729, test_f1: 0.6103
 epoch: 49, train_loss: 0.7119, test_loss: 0.9604, test_f1: 0.6022
 epoch: 50, train_loss: 0.7099, test_loss: 0.8653, test_f1: 0.6187
 epoch: 51, train_loss: 0.7028, test_loss: 0.8129, test_f1: 0.5978
 epoch: 52, train_loss: 0.6794, test_loss: 0.8481, test_f1: 0.5808
 epoch: 53, train_loss: 0.6817, test_loss: 0.8766, test_f1: 0.5870
 epoch: 54, train_loss: 0.6837, test_loss: 0.8398, test_f1: 0.6109
 epoch: 55, train_loss: 0.6825, test_loss: 0.8775, test_f1: 0.6041
 epoch: 56, train_loss: 0.6682, test_loss: 0.8307, test_f1: 0.6220
 epoch: 57, train_loss: 0.6705, test_loss: 0.9224, test_f1: 0.5927
 epoch: 58, train_loss: 0.6775, test_loss: 0.8711, test_f1: 0.5971
 epoch: 59, train_loss: 0.6711, test_loss: 0.8515, test_f1: 0.6398
 epoch: 60, train_loss: 0.6738, test_loss: 0.8283, test_f1: 0.5956
 epoch: 61, train_loss: 0.6672, test_loss: 0.8140, test_f1: 0.6106
 epoch: 62, train_loss: 0.6721, test_loss: 0.8404, test_f1: 0.5862
 epoch: 63, train_loss: 0.6615, test_loss: 0.8724, test_f1: 0.6090
 epoch: 64, train_loss: 0.6452, test_loss: 0.8047, test_f1: 0.6224
 epoch: 65, train_loss: 0.6731, test_loss: 0.8640, test_f1: 0.6413
 epoch: 66, train_loss: 0.6481, test_loss: 0.8260, test_f1: 0.5993
 epoch: 67, train_loss: 0.6706, test_loss: 0.9126, test_f1: 0.5955
 epoch: 68, train_loss: 0.6526, test_loss: 0.8550, test_f1: 0.6038
 epoch: 69, train_loss: 0.6446, test_loss: 0.9596, test_f1: 0.5997
 epoch: 70, train_loss: 0.6410, test_loss: 0.8288, test_f1: 0.6150
 epoch: 71, train_loss: 0.6525, test_loss: 0.8471, test_f1: 0.6342
 epoch: 72, train_loss: 0.6478, test_loss: 0.8707, test_f1: 0.6168
 epoch: 73, train_loss: 0.6566, test_loss: 0.8736, test_f1: 0.6036
 epoch: 74, train_loss: 0.6516, test_loss: 0.8291, test_f1: 0.6148
 epoch: 75, train_loss: 0.6369, test_loss: 0.8570, test_f1: 0.6436
 epoch: 76, train_loss: 0.6215, test_loss: 0.8712, test_f1: 0.6522
 epoch: 77, train_loss: 0.6495, test_loss: 0.8259, test_f1: 0.6481
 epoch: 78, train_loss: 0.6385, test_loss: 0.8434, test_f1: 0.6168
 epoch: 79, train_loss: 0.6382, test_loss: 0.8504, test_f1: 0.6078
 epoch: 80, train_loss: 0.6185, test_loss: 0.9255, test_f1: 0.6180
 epoch: 81, train_loss: 0.6261, test_loss: 0.8288, test_f1: 0.6419
 epoch: 82, train_loss: 0.6411, test_loss: 0.8707, test_f1: 0.6341
 epoch: 83, train_loss: 0.6181, test_loss: 0.8713, test_f1: 0.5989
 epoch: 84, train_loss: 0.6188, test_loss: 0.9048, test_f1: 0.6060
 epoch: 85, train_loss: 0.6079, test_loss: 0.9075, test_f1: 0.6177
 epoch: 86, train_loss: 0.6226, test_loss: 0.9028, test_f1: 0.6255
 epoch: 87, train_loss: 0.6359, test_loss: 0.8739, test_f1: 0.6204
 epoch: 88, train_loss: 0.6325, test_loss: 0.8393, test_f1: 0.6396
 epoch: 89, train_loss: 0.6067, test_loss: 0.8624, test_f1: 0.6194
 epoch: 90, train_loss: 0.6336, test_loss: 0.8845, test_f1: 0.6152
 epoch: 91, train_loss: 0.6136, test_loss: 0.8570, test_f1: 0.6376
 epoch: 92, train_loss: 0.6170, test_loss: 0.8589, test_f1: 0.6351
 epoch: 93, train_loss: 0.6032, test_loss: 0.8670, test_f1: 0.6408
 epoch: 94, train_loss: 0.6102, test_loss: 0.8704, test_f1: 0.6303
 epoch: 95, train_loss: 0.6068, test_loss: 0.9208, test_f1: 0.6474
 epoch: 96, train_loss: 0.6070, test_loss: 0.8778, test_f1: 0.6344
 epoch: 97, train_loss: 0.6030, test_loss: 0.8367, test_f1: 0.6434
 epoch: 98, train_loss: 0.6012, test_loss: 0.8637, test_f1: 0.6331
 epoch: 99, train_loss: 0.6159, test_loss: 0.9445, test_f1: 0.6272

Training completed in 959.95 seconds
Best F1: 0.6836 at epoch 87
Mean F1 across iterations: 0.6610  0.0118
========================FINAL RESULTS================================
FEGIN weighted F1: 0.6836  0.0118
python main.py --data ltspice_examples --representation component_pin --model FEGIN --layers 2 --hiddens 32 --batch_size 32 --lr 0.001 --emb_size 512 --epochs 100 --save_appendix component_pin_L2_H32_BS32_LR0.001_E512 --no_val
-----



STDERR:
  File "main.py", line 370, in <module>
    main()
  File "main.py", line 254, in main
    dataset = dataset_class(
  File "/home/philip/projects/llm_inference_code_repo/Circuit-Completion-Using-GNNs/component_classification_with_link_prediction_head/evaluation/FEGIN/kernel/circuit_datasets.py", line 15, in __init__
    self.data, self.slices = torch.load(self.processed_paths[0])
  File "/home/philip/.local/lib/python3.8/site-packages/torch/serialization.py", line 1040, in load
    warnings.warn(
  File "/usr/lib/python3.8/warnings.py", line 109, in _showwarnmsg
    sw(msg.message, msg.category, msg.filename, msg.lineno,
  File "main.py", line 47, in warn_with_traceback
    traceback.print_stack(file=log)
/home/philip/projects/llm_inference_code_repo/Circuit-Completion-Using-GNNs/component_classification_with_link_prediction_head/evaluation/FEGIN/kernel/circuit_datasets.py:15: FutureWarning: You are using `torch.load` with `weights_only=False` (the current default value), which uses the default pickle module implicitly. It is possible to construct malicious pickle data which will execute arbitrary code during unpickling (See https://github.com/pytorch/pytorch/blob/main/SECURITY.md#untrusted-models for more details). In a future release, the default value for `weights_only` will be flipped to `True`. This limits the functions that could be executed during unpickling. Arbitrary objects will no longer be allowed to be loaded via this mode unless they are explicitly allowlisted by the user via `torch.serialization.add_safe_globals`. We recommend you start setting `weights_only=True` for any use case where you don't have full control of the loaded file. Please open an issue on GitHub for any issues related to this experimental feature.
  self.data, self.slices = torch.load(self.processed_paths[0])
