STDOUT:
Results will be saved in /home/philip/projects/ltspice_examples_code_repo/Circuit-Completion-Using-GNNs/component_classification_with_link_prediction_head/evaluation/FEGIN/results/model_FEGIN_dataset_ltspice_demos
Command line input: python main.py --data ltspice_demos --representation component_component --model FEGIN --layers 4 --hiddens 16 --batch_size 32 --lr 0.01 --emb_size 512 --epochs 100 --save_appendix component_component_L4_H16_BS32_LR0.01_E512 --no_val
 is saved.
-----
ltspice_demos - FEGIN
Using 4 layers, 16 hidden units, h = 2
Loading component_component representation dataset
ENTERED
Training FEGIN on component_component representation
Train: 1565, Test: 383
##################ITERATION #0 ****************************************
 epoch: 0, train_loss: 1.2577, test_loss: 1.3423, test_f1: 0.3006
 epoch: 1, train_loss: 1.1753, test_loss: 1.2748, test_f1: 0.3763
 epoch: 2, train_loss: 1.1251, test_loss: 1.1621, test_f1: 0.3891
 epoch: 3, train_loss: 1.0637, test_loss: 1.1198, test_f1: 0.4313
 epoch: 4, train_loss: 1.0318, test_loss: 1.1168, test_f1: 0.4083
 epoch: 5, train_loss: 1.0018, test_loss: 1.1402, test_f1: 0.5363
 epoch: 6, train_loss: 0.9781, test_loss: 1.0944, test_f1: 0.5184
 epoch: 7, train_loss: 0.9555, test_loss: 1.0733, test_f1: 0.4531
 epoch: 8, train_loss: 0.9287, test_loss: 1.0941, test_f1: 0.4361
 epoch: 9, train_loss: 0.9168, test_loss: 1.1476, test_f1: 0.4302
 epoch: 10, train_loss: 0.8872, test_loss: 1.2521, test_f1: 0.5147
 epoch: 11, train_loss: 0.8788, test_loss: 1.0677, test_f1: 0.5772
 epoch: 12, train_loss: 0.8637, test_loss: 1.1440, test_f1: 0.5429
 epoch: 13, train_loss: 0.8731, test_loss: 1.1418, test_f1: 0.5116
 epoch: 14, train_loss: 0.8653, test_loss: 1.4477, test_f1: 0.4549
 epoch: 15, train_loss: 0.8817, test_loss: 1.0426, test_f1: 0.5208
 epoch: 16, train_loss: 0.8871, test_loss: 1.0340, test_f1: 0.5253
 epoch: 17, train_loss: 0.8687, test_loss: 0.9928, test_f1: 0.5675
 epoch: 18, train_loss: 0.8711, test_loss: 1.0539, test_f1: 0.4289
 epoch: 19, train_loss: 0.8714, test_loss: 1.0132, test_f1: 0.5850
 epoch: 20, train_loss: 0.8624, test_loss: 1.0396, test_f1: 0.5701
 epoch: 21, train_loss: 0.8578, test_loss: 1.0081, test_f1: 0.5452
 epoch: 22, train_loss: 0.8497, test_loss: 0.9998, test_f1: 0.5596
 epoch: 23, train_loss: 0.8611, test_loss: 1.0938, test_f1: 0.5161
 epoch: 24, train_loss: 0.8587, test_loss: 0.9904, test_f1: 0.5739
 epoch: 25, train_loss: 0.8505, test_loss: 1.0350, test_f1: 0.5387
 epoch: 26, train_loss: 0.8721, test_loss: 1.0440, test_f1: 0.4918
 epoch: 27, train_loss: 0.8646, test_loss: 1.0408, test_f1: 0.4905
 epoch: 28, train_loss: 0.8386, test_loss: 1.0031, test_f1: 0.5619
 epoch: 29, train_loss: 0.8612, test_loss: 1.0208, test_f1: 0.5291
 epoch: 30, train_loss: 0.8313, test_loss: 0.9889, test_f1: 0.5415
 epoch: 31, train_loss: 0.8285, test_loss: 1.0064, test_f1: 0.5881
 epoch: 32, train_loss: 0.8398, test_loss: 1.0397, test_f1: 0.5366
 epoch: 33, train_loss: 0.8384, test_loss: 1.0151, test_f1: 0.5233
 epoch: 34, train_loss: 0.8135, test_loss: 1.0426, test_f1: 0.5446
 epoch: 35, train_loss: 0.8229, test_loss: 1.0036, test_f1: 0.5574
 epoch: 36, train_loss: 0.8209, test_loss: 1.0588, test_f1: 0.5389
 epoch: 37, train_loss: 0.8301, test_loss: 1.0250, test_f1: 0.5625
 epoch: 38, train_loss: 0.8073, test_loss: 1.0617, test_f1: 0.5823
 epoch: 39, train_loss: 0.7795, test_loss: 1.0465, test_f1: 0.5347
 epoch: 40, train_loss: 0.8144, test_loss: 0.9930, test_f1: 0.5390
 epoch: 41, train_loss: 0.8199, test_loss: 1.0547, test_f1: 0.5472
 epoch: 42, train_loss: 0.8431, test_loss: 1.0557, test_f1: 0.5272
 epoch: 43, train_loss: 0.8393, test_loss: 0.9935, test_f1: 0.6036
 epoch: 44, train_loss: 0.8060, test_loss: 1.0243, test_f1: 0.5667
 epoch: 45, train_loss: 0.7852, test_loss: 1.0610, test_f1: 0.5240
 epoch: 46, train_loss: 0.8049, test_loss: 0.9880, test_f1: 0.6046
 epoch: 47, train_loss: 0.7950, test_loss: 1.0590, test_f1: 0.5562
 epoch: 48, train_loss: 0.7781, test_loss: 1.1110, test_f1: 0.4963
 epoch: 49, train_loss: 0.8080, test_loss: 0.9850, test_f1: 0.5959
 epoch: 50, train_loss: 0.7756, test_loss: 1.0228, test_f1: 0.5851
 epoch: 51, train_loss: 0.7499, test_loss: 1.0522, test_f1: 0.5497
 epoch: 52, train_loss: 0.7616, test_loss: 1.0538, test_f1: 0.5742
 epoch: 53, train_loss: 0.7628, test_loss: 1.0775, test_f1: 0.5964
 epoch: 54, train_loss: 0.7581, test_loss: 0.9904, test_f1: 0.5743
 epoch: 55, train_loss: 0.7511, test_loss: 1.0911, test_f1: 0.5622
 epoch: 56, train_loss: 0.7564, test_loss: 1.0856, test_f1: 0.5663
 epoch: 57, train_loss: 0.7342, test_loss: 1.0701, test_f1: 0.5572
 epoch: 58, train_loss: 0.7345, test_loss: 1.0893, test_f1: 0.5706
 epoch: 59, train_loss: 0.7141, test_loss: 1.0524, test_f1: 0.6031
 epoch: 60, train_loss: 0.7198, test_loss: 1.0997, test_f1: 0.5907
 epoch: 61, train_loss: 0.7213, test_loss: 1.2849, test_f1: 0.5622
 epoch: 62, train_loss: 0.7373, test_loss: 1.1582, test_f1: 0.5878
 epoch: 63, train_loss: 0.7283, test_loss: 1.3396, test_f1: 0.5579
 epoch: 64, train_loss: 0.7329, test_loss: 1.1027, test_f1: 0.5464
 epoch: 65, train_loss: 0.7133, test_loss: 1.0354, test_f1: 0.5915
 epoch: 66, train_loss: 0.7259, test_loss: 1.1654, test_f1: 0.5602
 epoch: 67, train_loss: 0.7404, test_loss: 1.1129, test_f1: 0.5535
 epoch: 68, train_loss: 0.7157, test_loss: 1.2361, test_f1: 0.5201
 epoch: 69, train_loss: 0.7035, test_loss: 1.2246, test_f1: 0.5494
 epoch: 70, train_loss: 0.7154, test_loss: 1.1666, test_f1: 0.5210
 epoch: 71, train_loss: 0.7108, test_loss: 1.2116, test_f1: 0.5829
 epoch: 72, train_loss: 0.7102, test_loss: 1.2339, test_f1: 0.5547
 epoch: 73, train_loss: 0.7223, test_loss: 1.2194, test_f1: 0.5649
 epoch: 74, train_loss: 0.7179, test_loss: 1.3124, test_f1: 0.5502
 epoch: 75, train_loss: 0.7046, test_loss: 1.2113, test_f1: 0.5732
 epoch: 76, train_loss: 0.7134, test_loss: 1.1683, test_f1: 0.5281
 epoch: 77, train_loss: 0.7002, test_loss: 1.2446, test_f1: 0.5755
 epoch: 78, train_loss: 0.6948, test_loss: 1.4058, test_f1: 0.5703
 epoch: 79, train_loss: 0.7138, test_loss: 1.2839, test_f1: 0.5191
 epoch: 80, train_loss: 0.7053, test_loss: 1.1968, test_f1: 0.5488
 epoch: 81, train_loss: 0.7022, test_loss: 1.2146, test_f1: 0.5915
 epoch: 82, train_loss: 0.7163, test_loss: 1.3367, test_f1: 0.5470
 epoch: 83, train_loss: 0.6959, test_loss: 1.3599, test_f1: 0.5681
 epoch: 84, train_loss: 0.7145, test_loss: 1.1978, test_f1: 0.5467
 epoch: 85, train_loss: 0.7116, test_loss: 1.3905, test_f1: 0.5312
 epoch: 86, train_loss: 0.6765, test_loss: 1.2732, test_f1: 0.5703
 epoch: 87, train_loss: 0.6948, test_loss: 1.4172, test_f1: 0.5311
 epoch: 88, train_loss: 0.6862, test_loss: 1.2239, test_f1: 0.5908
 epoch: 89, train_loss: 0.7017, test_loss: 1.3059, test_f1: 0.5258
 epoch: 90, train_loss: 0.7022, test_loss: 1.1615, test_f1: 0.5940
 epoch: 91, train_loss: 0.7390, test_loss: 1.1670, test_f1: 0.5331
 epoch: 92, train_loss: 0.7153, test_loss: 1.2317, test_f1: 0.6026
 epoch: 93, train_loss: 0.6731, test_loss: 1.3415, test_f1: 0.5548
 epoch: 94, train_loss: 0.6839, test_loss: 1.2523, test_f1: 0.5699
 epoch: 95, train_loss: 0.6874, test_loss: 1.2188, test_f1: 0.5815
 epoch: 96, train_loss: 0.7077, test_loss: 1.4033, test_f1: 0.5947
 epoch: 97, train_loss: 0.7006, test_loss: 1.3067, test_f1: 0.5419
 epoch: 98, train_loss: 0.6920, test_loss: 1.5634, test_f1: 0.5349
 epoch: 99, train_loss: 0.7024, test_loss: 1.1829, test_f1: 0.5733
##################ITERATION #1 ****************************************
 epoch: 0, train_loss: 1.2384, test_loss: 1.3556, test_f1: 0.2404
 epoch: 1, train_loss: 1.1432, test_loss: 1.1811, test_f1: 0.3257
 epoch: 2, train_loss: 1.0932, test_loss: 1.2767, test_f1: 0.3986
 epoch: 3, train_loss: 1.0896, test_loss: 1.2585, test_f1: 0.4386
 epoch: 4, train_loss: 1.0734, test_loss: 1.3091, test_f1: 0.4288
 epoch: 5, train_loss: 1.0586, test_loss: 1.3719, test_f1: 0.4262
 epoch: 6, train_loss: 1.0255, test_loss: 1.1924, test_f1: 0.4107
 epoch: 7, train_loss: 0.9960, test_loss: 1.1075, test_f1: 0.5509
 epoch: 8, train_loss: 0.9910, test_loss: 1.1169, test_f1: 0.5322
 epoch: 9, train_loss: 0.9682, test_loss: 1.0773, test_f1: 0.5225
 epoch: 10, train_loss: 0.9303, test_loss: 1.0913, test_f1: 0.4338
 epoch: 11, train_loss: 0.9192, test_loss: 1.0333, test_f1: 0.5188
 epoch: 12, train_loss: 0.9052, test_loss: 1.0626, test_f1: 0.4969
 epoch: 13, train_loss: 0.9305, test_loss: 0.9750, test_f1: 0.5866
 epoch: 14, train_loss: 0.8852, test_loss: 0.9675, test_f1: 0.5703
 epoch: 15, train_loss: 0.9063, test_loss: 1.1181, test_f1: 0.4451
 epoch: 16, train_loss: 0.9128, test_loss: 1.0730, test_f1: 0.4912
 epoch: 17, train_loss: 0.8807, test_loss: 1.0187, test_f1: 0.5589
 epoch: 18, train_loss: 0.8790, test_loss: 1.0271, test_f1: 0.5509
 epoch: 19, train_loss: 0.8715, test_loss: 0.9929, test_f1: 0.5423
 epoch: 20, train_loss: 0.8612, test_loss: 1.1511, test_f1: 0.5534
 epoch: 21, train_loss: 0.8530, test_loss: 1.0839, test_f1: 0.5484
 epoch: 22, train_loss: 0.9118, test_loss: 1.0608, test_f1: 0.5460
 epoch: 23, train_loss: 0.8584, test_loss: 1.0773, test_f1: 0.5596
 epoch: 24, train_loss: 0.8747, test_loss: 1.0391, test_f1: 0.5230
 epoch: 25, train_loss: 0.8476, test_loss: 1.1197, test_f1: 0.5508
 epoch: 26, train_loss: 0.8664, test_loss: 1.0076, test_f1: 0.4458
 epoch: 27, train_loss: 0.8511, test_loss: 1.0766, test_f1: 0.5520
 epoch: 28, train_loss: 0.8436, test_loss: 1.0797, test_f1: 0.5721
 epoch: 29, train_loss: 0.8364, test_loss: 1.2284, test_f1: 0.5440
 epoch: 30, train_loss: 0.8325, test_loss: 1.0626, test_f1: 0.5492
 epoch: 31, train_loss: 0.8285, test_loss: 1.1203, test_f1: 0.5601
 epoch: 32, train_loss: 0.8407, test_loss: 1.2493, test_f1: 0.5060
 epoch: 33, train_loss: 0.8404, test_loss: 1.2678, test_f1: 0.5068
 epoch: 34, train_loss: 0.8472, test_loss: 1.3500, test_f1: 0.4298
 epoch: 35, train_loss: 0.8219, test_loss: 1.1325, test_f1: 0.5420
 epoch: 36, train_loss: 0.8124, test_loss: 1.2093, test_f1: 0.4280
 epoch: 37, train_loss: 0.8337, test_loss: 1.2031, test_f1: 0.5510
 epoch: 38, train_loss: 0.8248, test_loss: 1.0860, test_f1: 0.5592
 epoch: 39, train_loss: 0.8291, test_loss: 1.1260, test_f1: 0.4678
 epoch: 40, train_loss: 0.8596, test_loss: 1.0847, test_f1: 0.5669
 epoch: 41, train_loss: 0.8356, test_loss: 1.1010, test_f1: 0.5312
 epoch: 42, train_loss: 0.8095, test_loss: 1.1499, test_f1: 0.5528
 epoch: 43, train_loss: 0.8291, test_loss: 1.1163, test_f1: 0.5419
 epoch: 44, train_loss: 0.8195, test_loss: 1.2172, test_f1: 0.5608
 epoch: 45, train_loss: 0.8255, test_loss: 1.0774, test_f1: 0.5473
 epoch: 46, train_loss: 0.8296, test_loss: 1.0469, test_f1: 0.5405
 epoch: 47, train_loss: 0.8334, test_loss: 1.0550, test_f1: 0.5845
 epoch: 48, train_loss: 0.7941, test_loss: 1.1137, test_f1: 0.5916
 epoch: 49, train_loss: 0.7937, test_loss: 1.1537, test_f1: 0.5721
 epoch: 50, train_loss: 0.7822, test_loss: 1.2675, test_f1: 0.5396
 epoch: 51, train_loss: 0.7802, test_loss: 1.2803, test_f1: 0.5604
 epoch: 52, train_loss: 0.7660, test_loss: 1.4788, test_f1: 0.5373
 epoch: 53, train_loss: 0.7533, test_loss: 1.4664, test_f1: 0.5496
 epoch: 54, train_loss: 0.7588, test_loss: 1.5377, test_f1: 0.5632
 epoch: 55, train_loss: 0.7577, test_loss: 1.6967, test_f1: 0.5439
 epoch: 56, train_loss: 0.7718, test_loss: 1.5085, test_f1: 0.5368
 epoch: 57, train_loss: 0.7593, test_loss: 1.7474, test_f1: 0.5494
 epoch: 58, train_loss: 0.7562, test_loss: 1.6656, test_f1: 0.5191
 epoch: 59, train_loss: 0.7621, test_loss: 1.6230, test_f1: 0.5787
 epoch: 60, train_loss: 0.7489, test_loss: 1.9198, test_f1: 0.5617
 epoch: 61, train_loss: 0.7568, test_loss: 1.7293, test_f1: 0.5536
 epoch: 62, train_loss: 0.7560, test_loss: 1.9125, test_f1: 0.5884
 epoch: 63, train_loss: 0.7541, test_loss: 1.5859, test_f1: 0.5709
 epoch: 64, train_loss: 0.7707, test_loss: 1.4170, test_f1: 0.5600
 epoch: 65, train_loss: 0.7548, test_loss: 1.5610, test_f1: 0.5735
 epoch: 66, train_loss: 0.7579, test_loss: 1.3702, test_f1: 0.5632
 epoch: 67, train_loss: 0.7403, test_loss: 1.2863, test_f1: 0.5711
 epoch: 68, train_loss: 0.7374, test_loss: 1.3482, test_f1: 0.6028
 epoch: 69, train_loss: 0.7427, test_loss: 1.2077, test_f1: 0.5671
 epoch: 70, train_loss: 0.7497, test_loss: 1.8109, test_f1: 0.5315
 epoch: 71, train_loss: 0.7557, test_loss: 1.8723, test_f1: 0.5642
 epoch: 72, train_loss: 0.7261, test_loss: 1.5404, test_f1: 0.5274
 epoch: 73, train_loss: 0.7397, test_loss: 1.2791, test_f1: 0.5526
 epoch: 74, train_loss: 0.7319, test_loss: 1.3432, test_f1: 0.5489
 epoch: 75, train_loss: 0.7463, test_loss: 1.6665, test_f1: 0.5866
 epoch: 76, train_loss: 0.7262, test_loss: 1.5324, test_f1: 0.5876
 epoch: 77, train_loss: 0.7292, test_loss: 1.9007, test_f1: 0.5323
 epoch: 78, train_loss: 0.7037, test_loss: 1.6952, test_f1: 0.4986
 epoch: 79, train_loss: 0.7194, test_loss: 1.5289, test_f1: 0.5544
 epoch: 80, train_loss: 0.7235, test_loss: 1.4795, test_f1: 0.5923
 epoch: 81, train_loss: 0.7346, test_loss: 1.6020, test_f1: 0.5841
 epoch: 82, train_loss: 0.7172, test_loss: 1.8711, test_f1: 0.5626
 epoch: 83, train_loss: 0.7184, test_loss: 1.7948, test_f1: 0.5818
 epoch: 84, train_loss: 0.7284, test_loss: 1.2877, test_f1: 0.5638
 epoch: 85, train_loss: 0.7133, test_loss: 1.4128, test_f1: 0.5528
 epoch: 86, train_loss: 0.7217, test_loss: 1.7549, test_f1: 0.5742
 epoch: 87, train_loss: 0.7314, test_loss: 1.6945, test_f1: 0.5716
 epoch: 88, train_loss: 0.7092, test_loss: 1.9164, test_f1: 0.5836
 epoch: 89, train_loss: 0.6902, test_loss: 1.5918, test_f1: 0.5733
 epoch: 90, train_loss: 0.6981, test_loss: 1.7291, test_f1: 0.5624
 epoch: 91, train_loss: 0.6824, test_loss: 1.8408, test_f1: 0.5652
 epoch: 92, train_loss: 0.7528, test_loss: 1.4504, test_f1: 0.5879
 epoch: 93, train_loss: 0.7105, test_loss: 1.3313, test_f1: 0.5951
 epoch: 94, train_loss: 0.7006, test_loss: 1.6379, test_f1: 0.5559
 epoch: 95, train_loss: 0.7196, test_loss: 1.7233, test_f1: 0.5666
 epoch: 96, train_loss: 0.7143, test_loss: 1.5368, test_f1: 0.6003
 epoch: 97, train_loss: 0.7205, test_loss: 1.3350, test_f1: 0.5733
 epoch: 98, train_loss: 0.7194, test_loss: 1.8075, test_f1: 0.5480
 epoch: 99, train_loss: 0.7102, test_loss: 1.7036, test_f1: 0.5386
##################ITERATION #2 ****************************************
 epoch: 0, train_loss: 1.2802, test_loss: 1.2685, test_f1: 0.3040
 epoch: 1, train_loss: 1.2119, test_loss: 1.2458, test_f1: 0.3478
 epoch: 2, train_loss: 1.1799, test_loss: 1.2691, test_f1: 0.3201
 epoch: 3, train_loss: 1.1354, test_loss: 1.3342, test_f1: 0.3174
 epoch: 4, train_loss: 1.1387, test_loss: 1.2394, test_f1: 0.3581
 epoch: 5, train_loss: 1.1044, test_loss: 1.2173, test_f1: 0.4057
 epoch: 6, train_loss: 1.0902, test_loss: 1.1305, test_f1: 0.4502
 epoch: 7, train_loss: 1.0314, test_loss: 1.1205, test_f1: 0.4223
 epoch: 8, train_loss: 0.9961, test_loss: 1.3560, test_f1: 0.3636
 epoch: 9, train_loss: 1.0184, test_loss: 1.0486, test_f1: 0.4022
 epoch: 10, train_loss: 0.9707, test_loss: 1.0254, test_f1: 0.4389
 epoch: 11, train_loss: 0.9399, test_loss: 1.0437, test_f1: 0.4416
 epoch: 12, train_loss: 0.9113, test_loss: 1.1119, test_f1: 0.4467
 epoch: 13, train_loss: 0.9145, test_loss: 1.0109, test_f1: 0.4198
 epoch: 14, train_loss: 0.9099, test_loss: 0.9683, test_f1: 0.5831
 epoch: 15, train_loss: 0.9183, test_loss: 1.0361, test_f1: 0.4644
 epoch: 16, train_loss: 0.9076, test_loss: 1.0575, test_f1: 0.4068
 epoch: 17, train_loss: 0.8859, test_loss: 1.0030, test_f1: 0.5361
 epoch: 18, train_loss: 0.8991, test_loss: 1.0216, test_f1: 0.4486
 epoch: 19, train_loss: 0.8885, test_loss: 1.0840, test_f1: 0.4698
 epoch: 20, train_loss: 0.8864, test_loss: 1.1128, test_f1: 0.5196
 epoch: 21, train_loss: 0.8774, test_loss: 1.0776, test_f1: 0.5389
 epoch: 22, train_loss: 0.8756, test_loss: 1.0992, test_f1: 0.4426
 epoch: 23, train_loss: 0.8816, test_loss: 1.1570, test_f1: 0.5148
 epoch: 24, train_loss: 0.8901, test_loss: 1.0012, test_f1: 0.5386
 epoch: 25, train_loss: 0.8675, test_loss: 1.0102, test_f1: 0.5580
 epoch: 26, train_loss: 0.8755, test_loss: 0.9945, test_f1: 0.5487
 epoch: 27, train_loss: 0.8777, test_loss: 1.0075, test_f1: 0.4990
 epoch: 28, train_loss: 0.8664, test_loss: 1.0759, test_f1: 0.4607
 epoch: 29, train_loss: 0.8649, test_loss: 1.0673, test_f1: 0.5519
 epoch: 30, train_loss: 0.8709, test_loss: 1.0162, test_f1: 0.5667
 epoch: 31, train_loss: 0.8802, test_loss: 1.0264, test_f1: 0.5299
 epoch: 32, train_loss: 0.8726, test_loss: 1.0121, test_f1: 0.5532
 epoch: 33, train_loss: 0.8586, test_loss: 0.9920, test_f1: 0.5671
 epoch: 34, train_loss: 0.8498, test_loss: 1.0689, test_f1: 0.4468
 epoch: 35, train_loss: 0.8499, test_loss: 1.3573, test_f1: 0.4318
 epoch: 36, train_loss: 0.8694, test_loss: 1.0928, test_f1: 0.5631
 epoch: 37, train_loss: 0.8601, test_loss: 1.0022, test_f1: 0.6018
 epoch: 38, train_loss: 0.8362, test_loss: 1.3216, test_f1: 0.4906
 epoch: 39, train_loss: 0.8354, test_loss: 1.1132, test_f1: 0.5860
 epoch: 40, train_loss: 0.8451, test_loss: 1.0432, test_f1: 0.5371
 epoch: 41, train_loss: 0.9058, test_loss: 1.2165, test_f1: 0.3968
 epoch: 42, train_loss: 0.9131, test_loss: 1.0941, test_f1: 0.5425
 epoch: 43, train_loss: 0.8534, test_loss: 1.0091, test_f1: 0.5516
 epoch: 44, train_loss: 0.8525, test_loss: 1.0830, test_f1: 0.5973
 epoch: 45, train_loss: 0.8344, test_loss: 1.0751, test_f1: 0.5826
 epoch: 46, train_loss: 0.8352, test_loss: 1.1174, test_f1: 0.5352
 epoch: 47, train_loss: 0.8284, test_loss: 1.0992, test_f1: 0.5859
 epoch: 48, train_loss: 0.8352, test_loss: 1.0754, test_f1: 0.4801
 epoch: 49, train_loss: 0.8316, test_loss: 1.1585, test_f1: 0.5453
 epoch: 50, train_loss: 0.8383, test_loss: 1.0594, test_f1: 0.5874
 epoch: 51, train_loss: 0.8300, test_loss: 1.1174, test_f1: 0.5920
 epoch: 52, train_loss: 0.8144, test_loss: 1.1274, test_f1: 0.5658
 epoch: 53, train_loss: 0.8151, test_loss: 1.0957, test_f1: 0.5668
 epoch: 54, train_loss: 0.8087, test_loss: 1.1736, test_f1: 0.5496
 epoch: 55, train_loss: 0.8007, test_loss: 1.1483, test_f1: 0.5385
 epoch: 56, train_loss: 0.8108, test_loss: 1.0815, test_f1: 0.5935
 epoch: 57, train_loss: 0.8162, test_loss: 1.1288, test_f1: 0.5471
 epoch: 58, train_loss: 0.8097, test_loss: 1.1837, test_f1: 0.5604
 epoch: 59, train_loss: 0.8020, test_loss: 1.3288, test_f1: 0.5295
 epoch: 60, train_loss: 0.8195, test_loss: 1.1170, test_f1: 0.5807
 epoch: 61, train_loss: 0.8007, test_loss: 1.2389, test_f1: 0.5724
 epoch: 62, train_loss: 0.7928, test_loss: 1.2347, test_f1: 0.5739
 epoch: 63, train_loss: 0.7840, test_loss: 1.2934, test_f1: 0.5255
 epoch: 64, train_loss: 0.7888, test_loss: 1.1519, test_f1: 0.5763
 epoch: 65, train_loss: 0.8010, test_loss: 1.2522, test_f1: 0.5966
 epoch: 66, train_loss: 0.7984, test_loss: 1.1304, test_f1: 0.5279
 epoch: 67, train_loss: 0.7988, test_loss: 1.2041, test_f1: 0.5685
 epoch: 68, train_loss: 0.8260, test_loss: 1.0909, test_f1: 0.5314
 epoch: 69, train_loss: 0.7914, test_loss: 1.0943, test_f1: 0.5798
 epoch: 70, train_loss: 0.7941, test_loss: 1.1361, test_f1: 0.5978
 epoch: 71, train_loss: 0.7929, test_loss: 1.3373, test_f1: 0.5648
 epoch: 72, train_loss: 0.7966, test_loss: 1.2814, test_f1: 0.5675
 epoch: 73, train_loss: 0.7970, test_loss: 1.0794, test_f1: 0.6024
 epoch: 74, train_loss: 0.7984, test_loss: 1.1513, test_f1: 0.5547
 epoch: 75, train_loss: 0.7818, test_loss: 1.1295, test_f1: 0.5839
 epoch: 76, train_loss: 0.7982, test_loss: 1.3147, test_f1: 0.5423
 epoch: 77, train_loss: 0.7774, test_loss: 1.4602, test_f1: 0.5356
 epoch: 78, train_loss: 0.7804, test_loss: 1.1830, test_f1: 0.5739
 epoch: 79, train_loss: 0.7756, test_loss: 1.3875, test_f1: 0.5391
 epoch: 80, train_loss: 0.7805, test_loss: 1.2469, test_f1: 0.4988
 epoch: 81, train_loss: 0.7760, test_loss: 1.2245, test_f1: 0.5854
 epoch: 82, train_loss: 0.7799, test_loss: 1.2698, test_f1: 0.5940
 epoch: 83, train_loss: 0.7834, test_loss: 1.3396, test_f1: 0.5303
 epoch: 84, train_loss: 0.7648, test_loss: 1.2851, test_f1: 0.5733
 epoch: 85, train_loss: 0.7849, test_loss: 1.1838, test_f1: 0.5343
 epoch: 86, train_loss: 0.7631, test_loss: 1.1909, test_f1: 0.5514
 epoch: 87, train_loss: 0.7652, test_loss: 1.2332, test_f1: 0.5403
 epoch: 88, train_loss: 0.7828, test_loss: 1.4514, test_f1: 0.5523
 epoch: 89, train_loss: 0.7705, test_loss: 1.3531, test_f1: 0.5372
 epoch: 90, train_loss: 0.7772, test_loss: 1.2748, test_f1: 0.5490
 epoch: 91, train_loss: 0.7558, test_loss: 1.2492, test_f1: 0.5815
 epoch: 92, train_loss: 0.7651, test_loss: 1.1896, test_f1: 0.5607
 epoch: 93, train_loss: 0.7478, test_loss: 1.3931, test_f1: 0.5489
 epoch: 94, train_loss: 0.7534, test_loss: 1.2436, test_f1: 0.5559
 epoch: 95, train_loss: 0.7635, test_loss: 1.2196, test_f1: 0.6049
 epoch: 96, train_loss: 0.7544, test_loss: 1.3255, test_f1: 0.5595
 epoch: 97, train_loss: 0.7650, test_loss: 1.3782, test_f1: 0.5121
 epoch: 98, train_loss: 0.7595, test_loss: 1.2238, test_f1: 0.5388
 epoch: 99, train_loss: 0.7599, test_loss: 1.1891, test_f1: 0.5704
##################ITERATION #3 ****************************************
 epoch: 0, train_loss: 1.2350, test_loss: 1.2252, test_f1: 0.4033
 epoch: 1, train_loss: 1.1536, test_loss: 1.2363, test_f1: 0.3706
 epoch: 2, train_loss: 1.1155, test_loss: 1.1908, test_f1: 0.4747
 epoch: 3, train_loss: 1.0781, test_loss: 1.2562, test_f1: 0.4175
 epoch: 4, train_loss: 1.0355, test_loss: 1.1675, test_f1: 0.4277
 epoch: 5, train_loss: 1.0238, test_loss: 1.2080, test_f1: 0.4846
 epoch: 6, train_loss: 1.0185, test_loss: 1.1479, test_f1: 0.5196
 epoch: 7, train_loss: 1.0138, test_loss: 1.1008, test_f1: 0.4950
 epoch: 8, train_loss: 0.9845, test_loss: 1.1158, test_f1: 0.4752
 epoch: 9, train_loss: 0.9712, test_loss: 1.0848, test_f1: 0.4996
 epoch: 10, train_loss: 1.0090, test_loss: 1.1676, test_f1: 0.4977
 epoch: 11, train_loss: 0.9460, test_loss: 1.1514, test_f1: 0.5256
 epoch: 12, train_loss: 1.0338, test_loss: 1.1437, test_f1: 0.4741
 epoch: 13, train_loss: 1.0412, test_loss: 1.0876, test_f1: 0.5174
 epoch: 14, train_loss: 0.9804, test_loss: 1.0266, test_f1: 0.5539
 epoch: 15, train_loss: 0.9573, test_loss: 1.0840, test_f1: 0.5428
 epoch: 16, train_loss: 0.9516, test_loss: 1.0975, test_f1: 0.5380
 epoch: 17, train_loss: 0.9616, test_loss: 1.0871, test_f1: 0.5344
 epoch: 18, train_loss: 0.9241, test_loss: 1.0807, test_f1: 0.5370
 epoch: 19, train_loss: 0.9113, test_loss: 1.0662, test_f1: 0.5130
 epoch: 20, train_loss: 0.9214, test_loss: 1.0909, test_f1: 0.5465
 epoch: 21, train_loss: 0.9039, test_loss: 1.0695, test_f1: 0.5570
 epoch: 22, train_loss: 0.9087, test_loss: 1.0597, test_f1: 0.5209
 epoch: 23, train_loss: 0.9947, test_loss: 1.1442, test_f1: 0.4646
 epoch: 24, train_loss: 0.9269, test_loss: 1.0637, test_f1: 0.5634
 epoch: 25, train_loss: 0.8937, test_loss: 1.0831, test_f1: 0.5397
 epoch: 26, train_loss: 0.8979, test_loss: 1.0608, test_f1: 0.5543
 epoch: 27, train_loss: 0.8816, test_loss: 1.0911, test_f1: 0.4821
 epoch: 28, train_loss: 0.8820, test_loss: 1.0605, test_f1: 0.5348
 epoch: 29, train_loss: 0.9004, test_loss: 1.0403, test_f1: 0.4518
 epoch: 30, train_loss: 0.9182, test_loss: 1.0480, test_f1: 0.4981
 epoch: 31, train_loss: 0.8775, test_loss: 1.0743, test_f1: 0.5233
 epoch: 32, train_loss: 0.8850, test_loss: 1.0916, test_f1: 0.4788
 epoch: 33, train_loss: 0.8891, test_loss: 1.0870, test_f1: 0.5385
 epoch: 34, train_loss: 0.8727, test_loss: 1.0607, test_f1: 0.5400
 epoch: 35, train_loss: 0.8856, test_loss: 1.0633, test_f1: 0.5193
 epoch: 36, train_loss: 0.8779, test_loss: 1.0675, test_f1: 0.5224
 epoch: 37, train_loss: 0.8676, test_loss: 1.2639, test_f1: 0.4497
 epoch: 38, train_loss: 0.8890, test_loss: 1.0872, test_f1: 0.4414
 epoch: 39, train_loss: 0.8666, test_loss: 1.0877, test_f1: 0.5301
 epoch: 40, train_loss: 0.8589, test_loss: 1.0773, test_f1: 0.5120
 epoch: 41, train_loss: 0.8745, test_loss: 1.0324, test_f1: 0.5240
 epoch: 42, train_loss: 0.8683, test_loss: 1.0998, test_f1: 0.5090
 epoch: 43, train_loss: 0.8570, test_loss: 1.0481, test_f1: 0.5407
 epoch: 44, train_loss: 0.8512, test_loss: 1.0710, test_f1: 0.4624
 epoch: 45, train_loss: 0.8672, test_loss: 1.1470, test_f1: 0.4761
 epoch: 46, train_loss: 0.8578, test_loss: 1.0826, test_f1: 0.5522
 epoch: 47, train_loss: 0.8476, test_loss: 1.0249, test_f1: 0.5164
 epoch: 48, train_loss: 0.8451, test_loss: 1.0660, test_f1: 0.5354
 epoch: 49, train_loss: 0.8455, test_loss: 1.0887, test_f1: 0.4989
 epoch: 50, train_loss: 0.8488, test_loss: 1.2131, test_f1: 0.5674
 epoch: 51, train_loss: 0.8310, test_loss: 1.0512, test_f1: 0.5481
 epoch: 52, train_loss: 0.8289, test_loss: 1.1866, test_f1: 0.5336
 epoch: 53, train_loss: 0.8307, test_loss: 1.2923, test_f1: 0.4300
 epoch: 54, train_loss: 0.8226, test_loss: 1.0566, test_f1: 0.4988
 epoch: 55, train_loss: 0.8108, test_loss: 1.0853, test_f1: 0.4895
 epoch: 56, train_loss: 0.8055, test_loss: 1.0637, test_f1: 0.4758
 epoch: 57, train_loss: 0.8131, test_loss: 1.1103, test_f1: 0.5447
 epoch: 58, train_loss: 0.8065, test_loss: 1.2267, test_f1: 0.4752
 epoch: 59, train_loss: 0.8089, test_loss: 1.1670, test_f1: 0.5064
 epoch: 60, train_loss: 0.8145, test_loss: 1.1739, test_f1: 0.5100
 epoch: 61, train_loss: 0.8210, test_loss: 1.1637, test_f1: 0.5344
 epoch: 62, train_loss: 0.8072, test_loss: 1.1052, test_f1: 0.5246
 epoch: 63, train_loss: 0.8032, test_loss: 1.1528, test_f1: 0.5560
 epoch: 64, train_loss: 0.7938, test_loss: 1.1604, test_f1: 0.5225
 epoch: 65, train_loss: 0.7985, test_loss: 1.2143, test_f1: 0.5460
 epoch: 66, train_loss: 0.8127, test_loss: 1.1585, test_f1: 0.5308
 epoch: 67, train_loss: 0.8096, test_loss: 1.1723, test_f1: 0.5308
 epoch: 68, train_loss: 0.8069, test_loss: 1.1490, test_f1: 0.5402
 epoch: 69, train_loss: 0.8094, test_loss: 1.2103, test_f1: 0.5301
 epoch: 70, train_loss: 0.7909, test_loss: 1.1826, test_f1: 0.5236
 epoch: 71, train_loss: 0.7903, test_loss: 1.1787, test_f1: 0.5123
 epoch: 72, train_loss: 0.7848, test_loss: 1.1949, test_f1: 0.5247
 epoch: 73, train_loss: 0.8167, test_loss: 1.1297, test_f1: 0.4570
 epoch: 74, train_loss: 0.7992, test_loss: 1.1836, test_f1: 0.4717
 epoch: 75, train_loss: 0.7925, test_loss: 1.3368, test_f1: 0.4681
 epoch: 76, train_loss: 0.7928, test_loss: 1.1249, test_f1: 0.5136
 epoch: 77, train_loss: 0.7813, test_loss: 1.1381, test_f1: 0.4424
 epoch: 78, train_loss: 0.7824, test_loss: 1.2270, test_f1: 0.4437
 epoch: 79, train_loss: 0.7933, test_loss: 1.2495, test_f1: 0.4228
 epoch: 80, train_loss: 0.7945, test_loss: 1.2752, test_f1: 0.4413
 epoch: 81, train_loss: 0.7900, test_loss: 1.3573, test_f1: 0.4927
 epoch: 82, train_loss: 0.7828, test_loss: 1.3415, test_f1: 0.4846
 epoch: 83, train_loss: 0.7755, test_loss: 1.2480, test_f1: 0.5010
 epoch: 84, train_loss: 0.7808, test_loss: 1.3649, test_f1: 0.4736
 epoch: 85, train_loss: 0.7890, test_loss: 1.2747, test_f1: 0.4325
 epoch: 86, train_loss: 0.7725, test_loss: 1.2333, test_f1: 0.5108
 epoch: 87, train_loss: 0.7862, test_loss: 1.1339, test_f1: 0.5224
 epoch: 88, train_loss: 0.7901, test_loss: 1.2557, test_f1: 0.5125
 epoch: 89, train_loss: 0.7743, test_loss: 1.2487, test_f1: 0.4617
 epoch: 90, train_loss: 0.7735, test_loss: 1.2626, test_f1: 0.5203
 epoch: 91, train_loss: 0.7632, test_loss: 1.3634, test_f1: 0.4985
 epoch: 92, train_loss: 0.7746, test_loss: 1.3291, test_f1: 0.4699
 epoch: 93, train_loss: 0.7700, test_loss: 1.3348, test_f1: 0.4360
 epoch: 94, train_loss: 0.7561, test_loss: 1.3254, test_f1: 0.5310
 epoch: 95, train_loss: 0.7662, test_loss: 1.2987, test_f1: 0.4405
 epoch: 96, train_loss: 0.7558, test_loss: 1.3241, test_f1: 0.4409
 epoch: 97, train_loss: 0.7750, test_loss: 1.2497, test_f1: 0.4319
 epoch: 98, train_loss: 0.7754, test_loss: 1.2117, test_f1: 0.4689
 epoch: 99, train_loss: 0.7740, test_loss: 1.3100, test_f1: 0.4402
##################ITERATION #4 ****************************************
 epoch: 0, train_loss: 1.2153, test_loss: 1.3006, test_f1: 0.2680
 epoch: 1, train_loss: 1.1407, test_loss: 1.3697, test_f1: 0.2747
 epoch: 2, train_loss: 1.0876, test_loss: 1.2053, test_f1: 0.3884
 epoch: 3, train_loss: 1.0382, test_loss: 1.1275, test_f1: 0.3728
 epoch: 4, train_loss: 1.0137, test_loss: 1.1688, test_f1: 0.4398
 epoch: 5, train_loss: 1.0423, test_loss: 1.1252, test_f1: 0.4359
 epoch: 6, train_loss: 0.9796, test_loss: 1.1908, test_f1: 0.3089
 epoch: 7, train_loss: 1.0008, test_loss: 1.1135, test_f1: 0.4891
 epoch: 8, train_loss: 0.9545, test_loss: 1.0448, test_f1: 0.4994
 epoch: 9, train_loss: 0.9689, test_loss: 1.0730, test_f1: 0.4707
 epoch: 10, train_loss: 0.9338, test_loss: 1.0489, test_f1: 0.5361
 epoch: 11, train_loss: 0.9172, test_loss: 1.0499, test_f1: 0.4522
 epoch: 12, train_loss: 0.9468, test_loss: 1.0537, test_f1: 0.4414
 epoch: 13, train_loss: 0.9117, test_loss: 1.0733, test_f1: 0.5179
 epoch: 14, train_loss: 0.9171, test_loss: 1.0321, test_f1: 0.4855
 epoch: 15, train_loss: 0.8876, test_loss: 0.9836, test_f1: 0.5195
 epoch: 16, train_loss: 0.9050, test_loss: 1.0717, test_f1: 0.4862
 epoch: 17, train_loss: 0.9220, test_loss: 1.0678, test_f1: 0.4829
 epoch: 18, train_loss: 0.9064, test_loss: 1.0132, test_f1: 0.5450
 epoch: 19, train_loss: 0.8810, test_loss: 1.0122, test_f1: 0.5119
 epoch: 20, train_loss: 0.8683, test_loss: 1.0038, test_f1: 0.5597
 epoch: 21, train_loss: 0.8789, test_loss: 1.0076, test_f1: 0.4894
 epoch: 22, train_loss: 0.8738, test_loss: 1.0305, test_f1: 0.5715
 epoch: 23, train_loss: 0.8700, test_loss: 0.9900, test_f1: 0.5622
 epoch: 24, train_loss: 0.8939, test_loss: 1.0442, test_f1: 0.5560
 epoch: 25, train_loss: 0.9074, test_loss: 1.0004, test_f1: 0.5637
 epoch: 26, train_loss: 0.8888, test_loss: 1.0289, test_f1: 0.5518
 epoch: 27, train_loss: 0.8699, test_loss: 1.0236, test_f1: 0.5768
 epoch: 28, train_loss: 0.8723, test_loss: 1.0272, test_f1: 0.5462
 epoch: 29, train_loss: 0.8719, test_loss: 1.0033, test_f1: 0.5565
 epoch: 30, train_loss: 0.8679, test_loss: 1.0132, test_f1: 0.5770
 epoch: 31, train_loss: 0.8577, test_loss: 0.9920, test_f1: 0.5522
 epoch: 32, train_loss: 0.8739, test_loss: 1.0243, test_f1: 0.5236
 epoch: 33, train_loss: 0.8678, test_loss: 1.0006, test_f1: 0.5688
 epoch: 34, train_loss: 0.8636, test_loss: 0.9843, test_f1: 0.5436
 epoch: 35, train_loss: 0.8651, test_loss: 1.0019, test_f1: 0.5701
 epoch: 36, train_loss: 0.8528, test_loss: 0.9874, test_f1: 0.5873
 epoch: 37, train_loss: 0.8490, test_loss: 1.0022, test_f1: 0.5562
 epoch: 38, train_loss: 0.8481, test_loss: 1.0104, test_f1: 0.5561
 epoch: 39, train_loss: 0.8439, test_loss: 1.0043, test_f1: 0.5807
 epoch: 40, train_loss: 0.8693, test_loss: 1.1160, test_f1: 0.4711
 epoch: 41, train_loss: 0.8668, test_loss: 1.1700, test_f1: 0.4266
 epoch: 42, train_loss: 0.8790, test_loss: 1.0117, test_f1: 0.5116
 epoch: 43, train_loss: 0.8569, test_loss: 0.9984, test_f1: 0.5607
 epoch: 44, train_loss: 0.8555, test_loss: 0.9990, test_f1: 0.5716
 epoch: 45, train_loss: 0.8379, test_loss: 0.9567, test_f1: 0.5220
 epoch: 46, train_loss: 0.8361, test_loss: 1.0174, test_f1: 0.5822
 epoch: 47, train_loss: 0.8558, test_loss: 0.9578, test_f1: 0.5357
 epoch: 48, train_loss: 0.8446, test_loss: 0.9881, test_f1: 0.5511
 epoch: 49, train_loss: 0.8322, test_loss: 0.9748, test_f1: 0.5809
 epoch: 50, train_loss: 0.8252, test_loss: 1.1228, test_f1: 0.4862
 epoch: 51, train_loss: 0.8332, test_loss: 1.0372, test_f1: 0.5761
 epoch: 52, train_loss: 0.8214, test_loss: 1.0484, test_f1: 0.5640
 epoch: 53, train_loss: 0.8220, test_loss: 1.0140, test_f1: 0.5259
 epoch: 54, train_loss: 0.8132, test_loss: 1.0811, test_f1: 0.5687
 epoch: 55, train_loss: 0.8278, test_loss: 1.0330, test_f1: 0.5798
 epoch: 56, train_loss: 0.8182, test_loss: 1.0098, test_f1: 0.5893
 epoch: 57, train_loss: 0.8295, test_loss: 0.9816, test_f1: 0.5986
 epoch: 58, train_loss: 0.8232, test_loss: 1.0192, test_f1: 0.5888
 epoch: 59, train_loss: 0.8033, test_loss: 0.9575, test_f1: 0.5434
 epoch: 60, train_loss: 0.8088, test_loss: 1.0029, test_f1: 0.5648
 epoch: 61, train_loss: 0.8096, test_loss: 0.9919, test_f1: 0.5686
 epoch: 62, train_loss: 0.8124, test_loss: 1.0350, test_f1: 0.5725
 epoch: 63, train_loss: 0.8010, test_loss: 1.0125, test_f1: 0.5943
 epoch: 64, train_loss: 0.8027, test_loss: 1.0455, test_f1: 0.5971
 epoch: 65, train_loss: 0.7982, test_loss: 1.0197, test_f1: 0.5652
 epoch: 66, train_loss: 0.8176, test_loss: 1.0222, test_f1: 0.6046
 epoch: 67, train_loss: 0.8067, test_loss: 1.0503, test_f1: 0.6157
 epoch: 68, train_loss: 0.8056, test_loss: 1.0100, test_f1: 0.6071
 epoch: 69, train_loss: 0.8023, test_loss: 1.0327, test_f1: 0.5961
 epoch: 70, train_loss: 0.7999, test_loss: 1.0055, test_f1: 0.5699
 epoch: 71, train_loss: 0.8267, test_loss: 1.0176, test_f1: 0.5668
 epoch: 72, train_loss: 0.8121, test_loss: 1.0371, test_f1: 0.5581
 epoch: 73, train_loss: 0.7947, test_loss: 1.0119, test_f1: 0.5725
 epoch: 74, train_loss: 0.8100, test_loss: 1.0870, test_f1: 0.5481
 epoch: 75, train_loss: 0.8006, test_loss: 1.0301, test_f1: 0.5770
 epoch: 76, train_loss: 0.7999, test_loss: 1.0299, test_f1: 0.5765
 epoch: 77, train_loss: 0.7958, test_loss: 1.0142, test_f1: 0.5754
 epoch: 78, train_loss: 0.8345, test_loss: 1.0812, test_f1: 0.5482
 epoch: 79, train_loss: 0.7936, test_loss: 1.0851, test_f1: 0.5516
 epoch: 80, train_loss: 0.7883, test_loss: 1.0475, test_f1: 0.5930
 epoch: 81, train_loss: 0.7750, test_loss: 1.1043, test_f1: 0.6010
 epoch: 82, train_loss: 0.7896, test_loss: 1.0481, test_f1: 0.5887
 epoch: 83, train_loss: 0.7789, test_loss: 1.0966, test_f1: 0.5643
 epoch: 84, train_loss: 0.7814, test_loss: 1.1121, test_f1: 0.5874
 epoch: 85, train_loss: 0.7771, test_loss: 1.0654, test_f1: 0.5809
 epoch: 86, train_loss: 0.7829, test_loss: 1.1009, test_f1: 0.6099
 epoch: 87, train_loss: 0.7971, test_loss: 1.0965, test_f1: 0.5860
 epoch: 88, train_loss: 0.7745, test_loss: 1.0830, test_f1: 0.5924
 epoch: 89, train_loss: 0.7701, test_loss: 1.0902, test_f1: 0.6131
 epoch: 90, train_loss: 0.7607, test_loss: 1.1954, test_f1: 0.5715
 epoch: 91, train_loss: 0.7869, test_loss: 1.1474, test_f1: 0.5698
 epoch: 92, train_loss: 0.7794, test_loss: 1.1834, test_f1: 0.6074
 epoch: 93, train_loss: 0.7825, test_loss: 1.0915, test_f1: 0.6248
 epoch: 94, train_loss: 0.7834, test_loss: 1.0579, test_f1: 0.6128
 epoch: 95, train_loss: 0.7850, test_loss: 1.0281, test_f1: 0.5978
 epoch: 96, train_loss: 0.7765, test_loss: 1.0712, test_f1: 0.5939
 epoch: 97, train_loss: 0.7574, test_loss: 1.1639, test_f1: 0.5421
 epoch: 98, train_loss: 0.7712, test_loss: 1.1359, test_f1: 0.5773
 epoch: 99, train_loss: 0.7702, test_loss: 1.1469, test_f1: 0.5753
##################ITERATION #5 ****************************************
 epoch: 0, train_loss: 1.2395, test_loss: 1.3223, test_f1: 0.2374
 epoch: 1, train_loss: 1.1466, test_loss: 1.2514, test_f1: 0.2952
 epoch: 2, train_loss: 1.0978, test_loss: 1.1484, test_f1: 0.4487
 epoch: 3, train_loss: 1.0588, test_loss: 1.0884, test_f1: 0.4432
 epoch: 4, train_loss: 1.0089, test_loss: 1.1946, test_f1: 0.3640
 epoch: 5, train_loss: 0.9694, test_loss: 1.2832, test_f1: 0.3931
 epoch: 6, train_loss: 0.9977, test_loss: 1.3483, test_f1: 0.3777
 epoch: 7, train_loss: 0.9303, test_loss: 1.0249, test_f1: 0.5716
 epoch: 8, train_loss: 0.9077, test_loss: 1.0154, test_f1: 0.4843
 epoch: 9, train_loss: 0.9066, test_loss: 1.1257, test_f1: 0.4622
 epoch: 10, train_loss: 0.8729, test_loss: 1.0337, test_f1: 0.4344
 epoch: 11, train_loss: 0.8830, test_loss: 1.0865, test_f1: 0.5090
 epoch: 12, train_loss: 0.8898, test_loss: 1.0742, test_f1: 0.5252
 epoch: 13, train_loss: 0.8954, test_loss: 1.1541, test_f1: 0.4488
 epoch: 14, train_loss: 0.9070, test_loss: 1.0526, test_f1: 0.5382
 epoch: 15, train_loss: 0.8641, test_loss: 1.0317, test_f1: 0.5639
 epoch: 16, train_loss: 0.8718, test_loss: 1.0254, test_f1: 0.5130
 epoch: 17, train_loss: 0.9011, test_loss: 0.9887, test_f1: 0.5650
 epoch: 18, train_loss: 0.8707, test_loss: 1.0472, test_f1: 0.5542
 epoch: 19, train_loss: 0.8715, test_loss: 1.0317, test_f1: 0.5522
 epoch: 20, train_loss: 0.8409, test_loss: 1.0472, test_f1: 0.5731
 epoch: 21, train_loss: 0.8575, test_loss: 1.0415, test_f1: 0.5524
 epoch: 22, train_loss: 0.8726, test_loss: 1.0699, test_f1: 0.4920
 epoch: 23, train_loss: 0.8925, test_loss: 1.0643, test_f1: 0.5636
 epoch: 24, train_loss: 0.8453, test_loss: 1.0782, test_f1: 0.5712
 epoch: 25, train_loss: 0.8408, test_loss: 1.0189, test_f1: 0.5599
 epoch: 26, train_loss: 0.8620, test_loss: 1.0631, test_f1: 0.5668
 epoch: 27, train_loss: 0.8427, test_loss: 1.0132, test_f1: 0.5778
 epoch: 28, train_loss: 0.8484, test_loss: 1.1595, test_f1: 0.5448
 epoch: 29, train_loss: 0.8315, test_loss: 1.0617, test_f1: 0.5486
 epoch: 30, train_loss: 0.8339, test_loss: 1.1465, test_f1: 0.5557
 epoch: 31, train_loss: 0.8359, test_loss: 1.3122, test_f1: 0.5434
 epoch: 32, train_loss: 0.8346, test_loss: 1.0540, test_f1: 0.5356
 epoch: 33, train_loss: 0.8118, test_loss: 1.1381, test_f1: 0.5587
 epoch: 34, train_loss: 0.8390, test_loss: 1.0720, test_f1: 0.5578
 epoch: 35, train_loss: 0.8358, test_loss: 1.3497, test_f1: 0.5282
 epoch: 36, train_loss: 0.8603, test_loss: 1.1786, test_f1: 0.5417
 epoch: 37, train_loss: 0.8273, test_loss: 1.0270, test_f1: 0.5724
 epoch: 38, train_loss: 0.8269, test_loss: 1.1764, test_f1: 0.5649
 epoch: 39, train_loss: 0.8110, test_loss: 1.2961, test_f1: 0.5347
 epoch: 40, train_loss: 0.8010, test_loss: 1.0907, test_f1: 0.5743
 epoch: 41, train_loss: 0.8120, test_loss: 1.0373, test_f1: 0.5960
 epoch: 42, train_loss: 0.8233, test_loss: 1.2565, test_f1: 0.5512
 epoch: 43, train_loss: 0.8201, test_loss: 1.1924, test_f1: 0.5065
 epoch: 44, train_loss: 0.7992, test_loss: 1.1959, test_f1: 0.5574
 epoch: 45, train_loss: 0.7945, test_loss: 1.5593, test_f1: 0.4936
 epoch: 46, train_loss: 0.8023, test_loss: 1.0970, test_f1: 0.5545
 epoch: 47, train_loss: 0.8184, test_loss: 1.1804, test_f1: 0.5335
 epoch: 48, train_loss: 0.8509, test_loss: 1.0427, test_f1: 0.5560
 epoch: 49, train_loss: 0.8093, test_loss: 1.2466, test_f1: 0.5670
 epoch: 50, train_loss: 0.8525, test_loss: 1.0393, test_f1: 0.5204
 epoch: 51, train_loss: 0.8168, test_loss: 1.0468, test_f1: 0.5614
 epoch: 52, train_loss: 0.7984, test_loss: 1.0862, test_f1: 0.5780
 epoch: 53, train_loss: 0.7711, test_loss: 1.1035, test_f1: 0.5958
 epoch: 54, train_loss: 0.8010, test_loss: 1.0645, test_f1: 0.5944
 epoch: 55, train_loss: 0.7811, test_loss: 1.0777, test_f1: 0.5764
 epoch: 56, train_loss: 0.7685, test_loss: 1.0602, test_f1: 0.5809
 epoch: 57, train_loss: 0.7732, test_loss: 1.0948, test_f1: 0.5759
 epoch: 58, train_loss: 0.7699, test_loss: 1.1702, test_f1: 0.5693
 epoch: 59, train_loss: 0.7559, test_loss: 1.1089, test_f1: 0.5781
 epoch: 60, train_loss: 0.7773, test_loss: 1.1936, test_f1: 0.5306
 epoch: 61, train_loss: 0.7474, test_loss: 1.4138, test_f1: 0.5612
 epoch: 62, train_loss: 0.7767, test_loss: 1.5342, test_f1: 0.5204
 epoch: 63, train_loss: 0.7455, test_loss: 1.3306, test_f1: 0.5647
 epoch: 64, train_loss: 0.7387, test_loss: 1.0936, test_f1: 0.5657
 epoch: 65, train_loss: 0.7516, test_loss: 1.1685, test_f1: 0.5717
 epoch: 66, train_loss: 0.7554, test_loss: 1.3379, test_f1: 0.5168
 epoch: 67, train_loss: 0.7527, test_loss: 1.0799, test_f1: 0.5737
 epoch: 68, train_loss: 0.7550, test_loss: 1.3491, test_f1: 0.5330
 epoch: 69, train_loss: 0.7429, test_loss: 1.2176, test_f1: 0.5721
 epoch: 70, train_loss: 0.7352, test_loss: 1.2876, test_f1: 0.5507
 epoch: 71, train_loss: 0.7265, test_loss: 1.4348, test_f1: 0.5438
 epoch: 72, train_loss: 0.7489, test_loss: 1.5211, test_f1: 0.5469
 epoch: 73, train_loss: 0.7475, test_loss: 1.2159, test_f1: 0.5361
 epoch: 74, train_loss: 0.7374, test_loss: 1.4229, test_f1: 0.5434
 epoch: 75, train_loss: 0.7389, test_loss: 1.2892, test_f1: 0.5573
 epoch: 76, train_loss: 0.7173, test_loss: 1.5412, test_f1: 0.5530
 epoch: 77, train_loss: 0.7276, test_loss: 1.3359, test_f1: 0.5450
 epoch: 78, train_loss: 0.7150, test_loss: 1.7837, test_f1: 0.5150
 epoch: 79, train_loss: 0.7298, test_loss: 1.2074, test_f1: 0.5393
 epoch: 80, train_loss: 0.7257, test_loss: 1.3705, test_f1: 0.5223
 epoch: 81, train_loss: 0.7259, test_loss: 1.7300, test_f1: 0.5628
 epoch: 82, train_loss: 0.7417, test_loss: 1.1691, test_f1: 0.5546
 epoch: 83, train_loss: 0.7212, test_loss: 1.3675, test_f1: 0.5445
 epoch: 84, train_loss: 0.7246, test_loss: 1.2390, test_f1: 0.5797
 epoch: 85, train_loss: 0.7106, test_loss: 1.4094, test_f1: 0.5260
 epoch: 86, train_loss: 0.7154, test_loss: 1.3580, test_f1: 0.5377
 epoch: 87, train_loss: 0.7120, test_loss: 1.1684, test_f1: 0.5617
 epoch: 88, train_loss: 0.6932, test_loss: 1.2329, test_f1: 0.5460
 epoch: 89, train_loss: 0.7218, test_loss: 1.1827, test_f1: 0.5422
 epoch: 90, train_loss: 0.7019, test_loss: 1.2307, test_f1: 0.5510
 epoch: 91, train_loss: 0.7057, test_loss: 1.2518, test_f1: 0.5601
 epoch: 92, train_loss: 0.7094, test_loss: 1.2251, test_f1: 0.5683
 epoch: 93, train_loss: 0.6898, test_loss: 1.2108, test_f1: 0.5354
 epoch: 94, train_loss: 0.7026, test_loss: 1.2025, test_f1: 0.5483
 epoch: 95, train_loss: 0.6908, test_loss: 1.3980, test_f1: 0.5537
 epoch: 96, train_loss: 0.6876, test_loss: 1.2175, test_f1: 0.5397
 epoch: 97, train_loss: 0.6841, test_loss: 1.2615, test_f1: 0.5200
 epoch: 98, train_loss: 0.6904, test_loss: 1.2460, test_f1: 0.5737
 epoch: 99, train_loss: 0.6710, test_loss: 1.2971, test_f1: 0.5435
##################ITERATION #6 ****************************************
 epoch: 0, train_loss: 1.2397, test_loss: 1.3541, test_f1: 0.2687
 epoch: 1, train_loss: 1.1249, test_loss: 1.1593, test_f1: 0.4663
 epoch: 2, train_loss: 1.0961, test_loss: 1.1947, test_f1: 0.3774
 epoch: 3, train_loss: 1.0411, test_loss: 1.1626, test_f1: 0.5348
 epoch: 4, train_loss: 0.9992, test_loss: 1.1692, test_f1: 0.3513
 epoch: 5, train_loss: 1.0230, test_loss: 1.1280, test_f1: 0.4556
 epoch: 6, train_loss: 0.9908, test_loss: 1.0736, test_f1: 0.4547
 epoch: 7, train_loss: 1.0186, test_loss: 1.1579, test_f1: 0.5044
 epoch: 8, train_loss: 0.9818, test_loss: 1.0831, test_f1: 0.4885
 epoch: 9, train_loss: 0.9459, test_loss: 1.0893, test_f1: 0.5242
 epoch: 10, train_loss: 0.9418, test_loss: 1.3239, test_f1: 0.3896
 epoch: 11, train_loss: 0.9238, test_loss: 1.0847, test_f1: 0.4981
 epoch: 12, train_loss: 0.9392, test_loss: 1.1327, test_f1: 0.3908
 epoch: 13, train_loss: 0.9406, test_loss: 1.0587, test_f1: 0.4949
 epoch: 14, train_loss: 0.9061, test_loss: 1.2726, test_f1: 0.4386
 epoch: 15, train_loss: 0.9142, test_loss: 1.1046, test_f1: 0.4776
 epoch: 16, train_loss: 0.9104, test_loss: 1.2575, test_f1: 0.3978
 epoch: 17, train_loss: 0.9066, test_loss: 1.0619, test_f1: 0.5034
 epoch: 18, train_loss: 0.9075, test_loss: 1.0158, test_f1: 0.4869
 epoch: 19, train_loss: 0.9071, test_loss: 1.1309, test_f1: 0.4800
 epoch: 20, train_loss: 0.8763, test_loss: 1.0239, test_f1: 0.5405
 epoch: 21, train_loss: 0.8879, test_loss: 1.0219, test_f1: 0.5522
 epoch: 22, train_loss: 0.8899, test_loss: 1.0038, test_f1: 0.5736
 epoch: 23, train_loss: 0.9039, test_loss: 1.4099, test_f1: 0.5060
 epoch: 24, train_loss: 0.9008, test_loss: 0.9950, test_f1: 0.4954
 epoch: 25, train_loss: 0.8818, test_loss: 1.0063, test_f1: 0.5685
 epoch: 26, train_loss: 0.8681, test_loss: 1.0821, test_f1: 0.5317
 epoch: 27, train_loss: 0.8873, test_loss: 0.9890, test_f1: 0.5274
 epoch: 28, train_loss: 0.8512, test_loss: 1.0263, test_f1: 0.5355
 epoch: 29, train_loss: 0.8677, test_loss: 1.0469, test_f1: 0.5415
 epoch: 30, train_loss: 0.8645, test_loss: 1.1958, test_f1: 0.4831
 epoch: 31, train_loss: 0.8859, test_loss: 1.0110, test_f1: 0.4615
 epoch: 32, train_loss: 0.8671, test_loss: 1.0857, test_f1: 0.5451
 epoch: 33, train_loss: 0.8657, test_loss: 1.6297, test_f1: 0.3474
 epoch: 34, train_loss: 0.8818, test_loss: 1.1092, test_f1: 0.4055
 epoch: 35, train_loss: 0.8641, test_loss: 0.9941, test_f1: 0.5300
 epoch: 36, train_loss: 0.8500, test_loss: 1.1227, test_f1: 0.5414
 epoch: 37, train_loss: 0.8416, test_loss: 1.0696, test_f1: 0.5515
 epoch: 38, train_loss: 0.8500, test_loss: 1.0622, test_f1: 0.5391
 epoch: 39, train_loss: 0.8486, test_loss: 1.1433, test_f1: 0.5311
 epoch: 40, train_loss: 0.8353, test_loss: 1.0318, test_f1: 0.5386
 epoch: 41, train_loss: 0.8310, test_loss: 1.1109, test_f1: 0.5207
 epoch: 42, train_loss: 0.8313, test_loss: 1.1292, test_f1: 0.5283
 epoch: 43, train_loss: 0.8459, test_loss: 1.0739, test_f1: 0.5156
 epoch: 44, train_loss: 0.8153, test_loss: 1.1253, test_f1: 0.5004
 epoch: 45, train_loss: 0.8298, test_loss: 1.0503, test_f1: 0.5558
 epoch: 46, train_loss: 0.8290, test_loss: 1.1176, test_f1: 0.5246
 epoch: 47, train_loss: 0.8488, test_loss: 1.1110, test_f1: 0.5718
 epoch: 48, train_loss: 0.8316, test_loss: 1.0500, test_f1: 0.5591
 epoch: 49, train_loss: 0.8222, test_loss: 1.1237, test_f1: 0.5063
 epoch: 50, train_loss: 0.8186, test_loss: 1.0940, test_f1: 0.5416
 epoch: 51, train_loss: 0.7976, test_loss: 1.1075, test_f1: 0.5729
 epoch: 52, train_loss: 0.7994, test_loss: 1.0699, test_f1: 0.5626
 epoch: 53, train_loss: 0.8078, test_loss: 1.0622, test_f1: 0.5841
 epoch: 54, train_loss: 0.7937, test_loss: 1.1447, test_f1: 0.5470
 epoch: 55, train_loss: 0.7943, test_loss: 1.1450, test_f1: 0.5234
 epoch: 56, train_loss: 0.7973, test_loss: 1.0666, test_f1: 0.5801
 epoch: 57, train_loss: 0.7847, test_loss: 1.0951, test_f1: 0.5788
 epoch: 58, train_loss: 0.7850, test_loss: 1.1438, test_f1: 0.5359
 epoch: 59, train_loss: 0.7731, test_loss: 1.0985, test_f1: 0.5471
 epoch: 60, train_loss: 0.7893, test_loss: 1.2933, test_f1: 0.5517
 epoch: 61, train_loss: 0.7947, test_loss: 1.1850, test_f1: 0.5400
 epoch: 62, train_loss: 0.7852, test_loss: 1.1916, test_f1: 0.5586
 epoch: 63, train_loss: 0.7830, test_loss: 1.1119, test_f1: 0.5657
 epoch: 64, train_loss: 0.7707, test_loss: 1.2136, test_f1: 0.5995
 epoch: 65, train_loss: 0.7882, test_loss: 1.2127, test_f1: 0.5473
 epoch: 66, train_loss: 0.7708, test_loss: 1.1637, test_f1: 0.5926
 epoch: 67, train_loss: 0.7756, test_loss: 1.1722, test_f1: 0.6027
 epoch: 68, train_loss: 0.7567, test_loss: 1.3159, test_f1: 0.5560
 epoch: 69, train_loss: 0.7585, test_loss: 1.1799, test_f1: 0.5938
 epoch: 70, train_loss: 0.7473, test_loss: 1.1666, test_f1: 0.5425
 epoch: 71, train_loss: 0.7658, test_loss: 1.2748, test_f1: 0.5756
 epoch: 72, train_loss: 0.7535, test_loss: 1.2207, test_f1: 0.5455
 epoch: 73, train_loss: 0.7666, test_loss: 1.1414, test_f1: 0.5473
 epoch: 74, train_loss: 0.7567, test_loss: 1.2865, test_f1: 0.5225
 epoch: 75, train_loss: 0.7506, test_loss: 1.2076, test_f1: 0.5248
 epoch: 76, train_loss: 0.7755, test_loss: 1.1178, test_f1: 0.5719
 epoch: 77, train_loss: 0.7749, test_loss: 1.1297, test_f1: 0.5777
 epoch: 78, train_loss: 0.7339, test_loss: 1.1763, test_f1: 0.5493
 epoch: 79, train_loss: 0.7682, test_loss: 1.2777, test_f1: 0.5677
 epoch: 80, train_loss: 0.7452, test_loss: 1.2272, test_f1: 0.5456
 epoch: 81, train_loss: 0.7339, test_loss: 1.2120, test_f1: 0.5477
 epoch: 82, train_loss: 0.7526, test_loss: 1.3204, test_f1: 0.5715
 epoch: 83, train_loss: 0.7543, test_loss: 1.2933, test_f1: 0.5685
 epoch: 84, train_loss: 0.7503, test_loss: 1.2636, test_f1: 0.5801
 epoch: 85, train_loss: 0.7617, test_loss: 1.2807, test_f1: 0.5799
 epoch: 86, train_loss: 0.7398, test_loss: 1.2347, test_f1: 0.5737
 epoch: 87, train_loss: 0.7531, test_loss: 1.3567, test_f1: 0.5684
 epoch: 88, train_loss: 0.7505, test_loss: 1.3083, test_f1: 0.6010
 epoch: 89, train_loss: 0.7309, test_loss: 1.2928, test_f1: 0.5560
 epoch: 90, train_loss: 0.7423, test_loss: 1.2648, test_f1: 0.5519
 epoch: 91, train_loss: 0.7631, test_loss: 1.3268, test_f1: 0.5303
 epoch: 92, train_loss: 0.7383, test_loss: 1.1712, test_f1: 0.5354
 epoch: 93, train_loss: 0.7323, test_loss: 1.4263, test_f1: 0.5938
 epoch: 94, train_loss: 0.7283, test_loss: 1.2134, test_f1: 0.5378
 epoch: 95, train_loss: 0.7315, test_loss: 1.3053, test_f1: 0.5697
 epoch: 96, train_loss: 0.7385, test_loss: 1.2000, test_f1: 0.5956
 epoch: 97, train_loss: 0.7323, test_loss: 1.4377, test_f1: 0.5555
 epoch: 98, train_loss: 0.7337, test_loss: 1.4418, test_f1: 0.5723
 epoch: 99, train_loss: 0.7511, test_loss: 1.1172, test_f1: 0.6234
##################ITERATION #7 ****************************************
 epoch: 0, train_loss: 1.2610, test_loss: 1.3047, test_f1: 0.2616
 epoch: 1, train_loss: 1.1601, test_loss: 1.2325, test_f1: 0.4292
 epoch: 2, train_loss: 1.1033, test_loss: 1.1933, test_f1: 0.3804
 epoch: 3, train_loss: 1.0399, test_loss: 1.2316, test_f1: 0.3941
 epoch: 4, train_loss: 1.0250, test_loss: 1.1352, test_f1: 0.4286
 epoch: 5, train_loss: 1.0122, test_loss: 1.1374, test_f1: 0.4086
 epoch: 6, train_loss: 1.0149, test_loss: 1.2424, test_f1: 0.3613
 epoch: 7, train_loss: 0.9828, test_loss: 1.1237, test_f1: 0.4688
 epoch: 8, train_loss: 0.9526, test_loss: 1.0623, test_f1: 0.5140
 epoch: 9, train_loss: 0.9477, test_loss: 1.0132, test_f1: 0.5729
 epoch: 10, train_loss: 0.9253, test_loss: 1.0278, test_f1: 0.4646
 epoch: 11, train_loss: 0.9351, test_loss: 1.0325, test_f1: 0.5378
 epoch: 12, train_loss: 0.9138, test_loss: 0.9856, test_f1: 0.5445
 epoch: 13, train_loss: 0.8855, test_loss: 1.1474, test_f1: 0.5285
 epoch: 14, train_loss: 0.8780, test_loss: 1.0053, test_f1: 0.5687
 epoch: 15, train_loss: 0.8876, test_loss: 1.0268, test_f1: 0.5619
 epoch: 16, train_loss: 0.8951, test_loss: 1.1870, test_f1: 0.4488
 epoch: 17, train_loss: 0.8796, test_loss: 0.9527, test_f1: 0.5805
 epoch: 18, train_loss: 0.8987, test_loss: 1.0412, test_f1: 0.4273
 epoch: 19, train_loss: 0.8783, test_loss: 1.0646, test_f1: 0.5478
 epoch: 20, train_loss: 0.8861, test_loss: 1.0039, test_f1: 0.5393
 epoch: 21, train_loss: 0.8743, test_loss: 0.9957, test_f1: 0.5618
 epoch: 22, train_loss: 0.8729, test_loss: 0.9883, test_f1: 0.5836
 epoch: 23, train_loss: 0.8930, test_loss: 1.0464, test_f1: 0.5273
 epoch: 24, train_loss: 0.8916, test_loss: 1.0413, test_f1: 0.5219
 epoch: 25, train_loss: 0.8774, test_loss: 1.0559, test_f1: 0.5031
 epoch: 26, train_loss: 0.8742, test_loss: 1.1620, test_f1: 0.5042
 epoch: 27, train_loss: 0.8641, test_loss: 0.9808, test_f1: 0.5421
 epoch: 28, train_loss: 0.8633, test_loss: 1.0423, test_f1: 0.5780
 epoch: 29, train_loss: 0.8622, test_loss: 1.0597, test_f1: 0.5699
 epoch: 30, train_loss: 0.8451, test_loss: 1.0782, test_f1: 0.5595
 epoch: 31, train_loss: 0.8479, test_loss: 1.1473, test_f1: 0.5581
 epoch: 32, train_loss: 0.8382, test_loss: 1.0836, test_f1: 0.5597
 epoch: 33, train_loss: 0.8488, test_loss: 0.9801, test_f1: 0.5742
 epoch: 34, train_loss: 0.8620, test_loss: 1.0041, test_f1: 0.5118
 epoch: 35, train_loss: 0.8460, test_loss: 1.0702, test_f1: 0.5222
 epoch: 36, train_loss: 0.8465, test_loss: 1.0222, test_f1: 0.5570
 epoch: 37, train_loss: 0.8467, test_loss: 1.1217, test_f1: 0.4451
 epoch: 38, train_loss: 0.8639, test_loss: 1.0132, test_f1: 0.5843
 epoch: 39, train_loss: 0.8434, test_loss: 1.0676, test_f1: 0.5700
 epoch: 40, train_loss: 0.8423, test_loss: 1.0800, test_f1: 0.5605
 epoch: 41, train_loss: 0.8448, test_loss: 1.0678, test_f1: 0.5795
 epoch: 42, train_loss: 0.8434, test_loss: 1.0262, test_f1: 0.4432
 epoch: 43, train_loss: 0.8404, test_loss: 1.0935, test_f1: 0.5681
 epoch: 44, train_loss: 0.8469, test_loss: 1.1575, test_f1: 0.5532
 epoch: 45, train_loss: 0.8139, test_loss: 1.1194, test_f1: 0.5039
 epoch: 46, train_loss: 0.8144, test_loss: 1.1011, test_f1: 0.5357
 epoch: 47, train_loss: 0.8323, test_loss: 1.3483, test_f1: 0.4899
 epoch: 48, train_loss: 0.8307, test_loss: 1.0621, test_f1: 0.5703
 epoch: 49, train_loss: 0.8157, test_loss: 1.0515, test_f1: 0.5450
 epoch: 50, train_loss: 0.8123, test_loss: 1.2786, test_f1: 0.4668
 epoch: 51, train_loss: 0.8109, test_loss: 1.1489, test_f1: 0.5014
 epoch: 52, train_loss: 0.7842, test_loss: 1.0378, test_f1: 0.5498
 epoch: 53, train_loss: 0.7950, test_loss: 1.0452, test_f1: 0.5663
 epoch: 54, train_loss: 0.7706, test_loss: 1.0668, test_f1: 0.5752
 epoch: 55, train_loss: 0.7540, test_loss: 1.0901, test_f1: 0.5703
 epoch: 56, train_loss: 0.7730, test_loss: 1.1274, test_f1: 0.5488
 epoch: 57, train_loss: 0.7726, test_loss: 1.1323, test_f1: 0.5535
 epoch: 58, train_loss: 0.7547, test_loss: 1.4507, test_f1: 0.5326
 epoch: 59, train_loss: 0.7508, test_loss: 1.3693, test_f1: 0.5574
 epoch: 60, train_loss: 0.7556, test_loss: 1.1980, test_f1: 0.5756
 epoch: 61, train_loss: 0.7639, test_loss: 1.2279, test_f1: 0.5122
 epoch: 62, train_loss: 0.7596, test_loss: 1.2804, test_f1: 0.5416
 epoch: 63, train_loss: 0.7427, test_loss: 1.2969, test_f1: 0.5645
 epoch: 64, train_loss: 0.7827, test_loss: 1.1790, test_f1: 0.5238
 epoch: 65, train_loss: 0.7547, test_loss: 1.0547, test_f1: 0.6083
 epoch: 66, train_loss: 0.7545, test_loss: 1.1823, test_f1: 0.5777
 epoch: 67, train_loss: 0.7334, test_loss: 1.2727, test_f1: 0.5454
 epoch: 68, train_loss: 0.7504, test_loss: 1.2009, test_f1: 0.5611
 epoch: 69, train_loss: 0.7584, test_loss: 1.2512, test_f1: 0.5564
 epoch: 70, train_loss: 0.7314, test_loss: 1.2976, test_f1: 0.5468
 epoch: 71, train_loss: 0.7550, test_loss: 1.4097, test_f1: 0.5256
 epoch: 72, train_loss: 0.7475, test_loss: 1.1746, test_f1: 0.5761
 epoch: 73, train_loss: 0.7439, test_loss: 1.2407, test_f1: 0.5407
 epoch: 74, train_loss: 0.7327, test_loss: 1.6823, test_f1: 0.4893
 epoch: 75, train_loss: 0.7464, test_loss: 1.5297, test_f1: 0.5119
 epoch: 76, train_loss: 0.7358, test_loss: 1.5831, test_f1: 0.5118
 epoch: 77, train_loss: 0.7153, test_loss: 1.5649, test_f1: 0.5483
 epoch: 78, train_loss: 0.7395, test_loss: 1.5913, test_f1: 0.5528
 epoch: 79, train_loss: 0.7381, test_loss: 1.4231, test_f1: 0.5585
 epoch: 80, train_loss: 0.7310, test_loss: 1.4988, test_f1: 0.5541
 epoch: 81, train_loss: 0.7346, test_loss: 1.1693, test_f1: 0.5610
 epoch: 82, train_loss: 0.7331, test_loss: 1.4729, test_f1: 0.4752
 epoch: 83, train_loss: 0.7277, test_loss: 1.5519, test_f1: 0.5411
 epoch: 84, train_loss: 0.7336, test_loss: 1.5750, test_f1: 0.5357
 epoch: 85, train_loss: 0.7720, test_loss: 1.2321, test_f1: 0.5449
 epoch: 86, train_loss: 0.7363, test_loss: 1.4611, test_f1: 0.5583
 epoch: 87, train_loss: 0.7220, test_loss: 1.4620, test_f1: 0.5578
 epoch: 88, train_loss: 0.7143, test_loss: 1.8958, test_f1: 0.5284
 epoch: 89, train_loss: 0.7080, test_loss: 1.8045, test_f1: 0.5803
 epoch: 90, train_loss: 0.7184, test_loss: 1.7493, test_f1: 0.5911
 epoch: 91, train_loss: 0.7409, test_loss: 1.5579, test_f1: 0.5619
 epoch: 92, train_loss: 0.6996, test_loss: 1.8031, test_f1: 0.5601
 epoch: 93, train_loss: 0.7178, test_loss: 1.8202, test_f1: 0.5325
 epoch: 94, train_loss: 0.7022, test_loss: 2.2694, test_f1: 0.5027
 epoch: 95, train_loss: 0.7017, test_loss: 1.3857, test_f1: 0.5840
 epoch: 96, train_loss: 0.7153, test_loss: 1.6723, test_f1: 0.5731
 epoch: 97, train_loss: 0.7158, test_loss: 1.6121, test_f1: 0.5731
 epoch: 98, train_loss: 0.7279, test_loss: 1.3334, test_f1: 0.5784
 epoch: 99, train_loss: 0.7095, test_loss: 1.4925, test_f1: 0.6132
##################ITERATION #8 ****************************************
 epoch: 0, train_loss: 1.2549, test_loss: 1.2328, test_f1: 0.3754
 epoch: 1, train_loss: 1.1430, test_loss: 1.2002, test_f1: 0.3142
 epoch: 2, train_loss: 1.1145, test_loss: 1.1593, test_f1: 0.3385
 epoch: 3, train_loss: 1.0783, test_loss: 1.1505, test_f1: 0.3975
 epoch: 4, train_loss: 1.0465, test_loss: 1.1405, test_f1: 0.4566
 epoch: 5, train_loss: 1.0246, test_loss: 1.1006, test_f1: 0.5030
 epoch: 6, train_loss: 1.0042, test_loss: 1.1323, test_f1: 0.4023
 epoch: 7, train_loss: 0.9834, test_loss: 1.0825, test_f1: 0.5068
 epoch: 8, train_loss: 0.9851, test_loss: 1.0636, test_f1: 0.5127
 epoch: 9, train_loss: 0.9710, test_loss: 1.0364, test_f1: 0.5434
 epoch: 10, train_loss: 0.9379, test_loss: 1.1118, test_f1: 0.4542
 epoch: 11, train_loss: 0.9396, test_loss: 1.0144, test_f1: 0.5401
 epoch: 12, train_loss: 0.9236, test_loss: 1.0397, test_f1: 0.5402
 epoch: 13, train_loss: 0.9038, test_loss: 1.1298, test_f1: 0.5012
 epoch: 14, train_loss: 0.9113, test_loss: 1.1578, test_f1: 0.4642
 epoch: 15, train_loss: 0.9028, test_loss: 1.0481, test_f1: 0.4975
 epoch: 16, train_loss: 0.8967, test_loss: 1.0817, test_f1: 0.5026
 epoch: 17, train_loss: 0.8958, test_loss: 1.1387, test_f1: 0.4896
 epoch: 18, train_loss: 0.8984, test_loss: 1.0616, test_f1: 0.4611
 epoch: 19, train_loss: 0.8833, test_loss: 1.0730, test_f1: 0.5018
 epoch: 20, train_loss: 0.8967, test_loss: 1.0487, test_f1: 0.5133
 epoch: 21, train_loss: 0.8730, test_loss: 1.1375, test_f1: 0.5222
 epoch: 22, train_loss: 0.8984, test_loss: 1.0902, test_f1: 0.4371
 epoch: 23, train_loss: 0.9037, test_loss: 1.0575, test_f1: 0.5363
 epoch: 24, train_loss: 0.8805, test_loss: 1.0581, test_f1: 0.5309
 epoch: 25, train_loss: 0.8610, test_loss: 1.1277, test_f1: 0.5483
 epoch: 26, train_loss: 0.8940, test_loss: 1.1035, test_f1: 0.5347
 epoch: 27, train_loss: 0.8765, test_loss: 1.0632, test_f1: 0.5073
 epoch: 28, train_loss: 0.8668, test_loss: 1.0797, test_f1: 0.5314
 epoch: 29, train_loss: 0.8585, test_loss: 1.0846, test_f1: 0.5223
 epoch: 30, train_loss: 0.8867, test_loss: 1.0926, test_f1: 0.5470
 epoch: 31, train_loss: 0.8623, test_loss: 1.0643, test_f1: 0.5366
 epoch: 32, train_loss: 0.8613, test_loss: 1.0886, test_f1: 0.5464
 epoch: 33, train_loss: 0.8689, test_loss: 1.0597, test_f1: 0.5301
 epoch: 34, train_loss: 0.8425, test_loss: 1.1306, test_f1: 0.5130
 epoch: 35, train_loss: 0.8474, test_loss: 1.1130, test_f1: 0.5042
 epoch: 36, train_loss: 0.8528, test_loss: 1.0364, test_f1: 0.5482
 epoch: 37, train_loss: 0.8567, test_loss: 1.1722, test_f1: 0.5391
 epoch: 38, train_loss: 0.8353, test_loss: 1.0377, test_f1: 0.5675
 epoch: 39, train_loss: 0.8417, test_loss: 1.0444, test_f1: 0.5613
 epoch: 40, train_loss: 0.8459, test_loss: 1.1831, test_f1: 0.5127
 epoch: 41, train_loss: 0.8786, test_loss: 1.0546, test_f1: 0.5322
 epoch: 42, train_loss: 0.8310, test_loss: 1.0548, test_f1: 0.5528
 epoch: 43, train_loss: 0.8299, test_loss: 1.1223, test_f1: 0.5430
 epoch: 44, train_loss: 0.8226, test_loss: 1.1175, test_f1: 0.5639
 epoch: 45, train_loss: 0.8251, test_loss: 1.0850, test_f1: 0.5911
 epoch: 46, train_loss: 0.8304, test_loss: 1.0698, test_f1: 0.5630
 epoch: 47, train_loss: 0.8210, test_loss: 1.0936, test_f1: 0.5742
 epoch: 48, train_loss: 0.8164, test_loss: 1.0682, test_f1: 0.4775
 epoch: 49, train_loss: 0.8121, test_loss: 1.0660, test_f1: 0.5256
 epoch: 50, train_loss: 0.8156, test_loss: 1.0623, test_f1: 0.5996
 epoch: 51, train_loss: 0.8041, test_loss: 1.0974, test_f1: 0.6070
 epoch: 52, train_loss: 0.7917, test_loss: 1.0773, test_f1: 0.5720
 epoch: 53, train_loss: 0.7746, test_loss: 1.0704, test_f1: 0.5842
 epoch: 54, train_loss: 0.7817, test_loss: 1.0987, test_f1: 0.5825
 epoch: 55, train_loss: 0.7718, test_loss: 1.1420, test_f1: 0.5741
 epoch: 56, train_loss: 0.7671, test_loss: 1.1572, test_f1: 0.5588
 epoch: 57, train_loss: 0.7735, test_loss: 1.0796, test_f1: 0.6111
 epoch: 58, train_loss: 0.7781, test_loss: 1.1352, test_f1: 0.5548
 epoch: 59, train_loss: 0.7515, test_loss: 1.0653, test_f1: 0.5597
 epoch: 60, train_loss: 0.7635, test_loss: 1.1889, test_f1: 0.5535
 epoch: 61, train_loss: 0.7691, test_loss: 1.1407, test_f1: 0.5813
 epoch: 62, train_loss: 0.7649, test_loss: 1.2063, test_f1: 0.5457
 epoch: 63, train_loss: 0.7667, test_loss: 1.1580, test_f1: 0.5607
 epoch: 64, train_loss: 0.7524, test_loss: 1.1455, test_f1: 0.5741
 epoch: 65, train_loss: 0.7586, test_loss: 1.0894, test_f1: 0.6218
 epoch: 66, train_loss: 0.7744, test_loss: 1.1309, test_f1: 0.5413
 epoch: 67, train_loss: 0.7454, test_loss: 1.2688, test_f1: 0.5783
 epoch: 68, train_loss: 0.7418, test_loss: 1.1954, test_f1: 0.5317
 epoch: 69, train_loss: 0.7454, test_loss: 1.2181, test_f1: 0.5833
 epoch: 70, train_loss: 0.7505, test_loss: 1.2203, test_f1: 0.5488
 epoch: 71, train_loss: 0.7701, test_loss: 1.1247, test_f1: 0.5684
 epoch: 72, train_loss: 0.7542, test_loss: 1.2031, test_f1: 0.5478
 epoch: 73, train_loss: 0.7446, test_loss: 1.1652, test_f1: 0.5690
 epoch: 74, train_loss: 0.7392, test_loss: 1.3048, test_f1: 0.5481
 epoch: 75, train_loss: 0.7501, test_loss: 1.2371, test_f1: 0.5165
 epoch: 76, train_loss: 0.7542, test_loss: 1.1790, test_f1: 0.5720
 epoch: 77, train_loss: 0.7264, test_loss: 1.2263, test_f1: 0.5713
 epoch: 78, train_loss: 0.7220, test_loss: 1.2242, test_f1: 0.5710
 epoch: 79, train_loss: 0.7433, test_loss: 1.1917, test_f1: 0.5737
 epoch: 80, train_loss: 0.7319, test_loss: 1.3903, test_f1: 0.5164
 epoch: 81, train_loss: 0.7369, test_loss: 1.1614, test_f1: 0.5837
 epoch: 82, train_loss: 0.7299, test_loss: 1.3745, test_f1: 0.5907
 epoch: 83, train_loss: 0.7221, test_loss: 1.2409, test_f1: 0.5688
 epoch: 84, train_loss: 0.7301, test_loss: 1.3998, test_f1: 0.5909
 epoch: 85, train_loss: 0.7364, test_loss: 1.2064, test_f1: 0.5725
 epoch: 86, train_loss: 0.7111, test_loss: 1.3076, test_f1: 0.5525
 epoch: 87, train_loss: 0.7356, test_loss: 1.2399, test_f1: 0.5332
 epoch: 88, train_loss: 0.7469, test_loss: 1.2457, test_f1: 0.5380
 epoch: 89, train_loss: 0.7349, test_loss: 1.3332, test_f1: 0.5237
 epoch: 90, train_loss: 0.7292, test_loss: 1.3126, test_f1: 0.5483
 epoch: 91, train_loss: 0.7324, test_loss: 1.2862, test_f1: 0.5469
 epoch: 92, train_loss: 0.7545, test_loss: 1.1831, test_f1: 0.5634
 epoch: 93, train_loss: 0.7441, test_loss: 1.1843, test_f1: 0.5762
 epoch: 94, train_loss: 0.7094, test_loss: 1.1940, test_f1: 0.5708
 epoch: 95, train_loss: 0.7166, test_loss: 1.2593, test_f1: 0.5646
 epoch: 96, train_loss: 0.7059, test_loss: 1.2705, test_f1: 0.5620
 epoch: 97, train_loss: 0.7166, test_loss: 1.2314, test_f1: 0.5470
 epoch: 98, train_loss: 0.7409, test_loss: 1.2580, test_f1: 0.5364
 epoch: 99, train_loss: 0.7377, test_loss: 1.3727, test_f1: 0.5510
##################ITERATION #9 ****************************************
 epoch: 0, train_loss: 1.3057, test_loss: 1.3254, test_f1: 0.2772
 epoch: 1, train_loss: 1.2449, test_loss: 1.2962, test_f1: 0.2572
 epoch: 2, train_loss: 1.2261, test_loss: 1.2767, test_f1: 0.2281
 epoch: 3, train_loss: 1.1999, test_loss: 1.2408, test_f1: 0.2365
 epoch: 4, train_loss: 1.1900, test_loss: 1.2202, test_f1: 0.3786
 epoch: 5, train_loss: 1.1742, test_loss: 1.2245, test_f1: 0.3541
 epoch: 6, train_loss: 1.1381, test_loss: 1.1997, test_f1: 0.4283
 epoch: 7, train_loss: 1.0814, test_loss: 1.2512, test_f1: 0.4354
 epoch: 8, train_loss: 1.0895, test_loss: 1.1583, test_f1: 0.3474
 epoch: 9, train_loss: 1.0558, test_loss: 1.1762, test_f1: 0.4871
 epoch: 10, train_loss: 1.0144, test_loss: 1.0664, test_f1: 0.5349
 epoch: 11, train_loss: 0.9864, test_loss: 1.1411, test_f1: 0.4339
 epoch: 12, train_loss: 0.9623, test_loss: 1.0429, test_f1: 0.4775
 epoch: 13, train_loss: 0.9643, test_loss: 1.1183, test_f1: 0.4710
 epoch: 14, train_loss: 0.9480, test_loss: 1.0729, test_f1: 0.4821
 epoch: 15, train_loss: 0.9207, test_loss: 1.0411, test_f1: 0.5578
 epoch: 16, train_loss: 0.9024, test_loss: 1.1572, test_f1: 0.4478
 epoch: 17, train_loss: 0.9422, test_loss: 1.0688, test_f1: 0.4982
 epoch: 18, train_loss: 0.8966, test_loss: 1.0498, test_f1: 0.5367
 epoch: 19, train_loss: 0.8948, test_loss: 1.2536, test_f1: 0.4280
 epoch: 20, train_loss: 0.8892, test_loss: 1.0261, test_f1: 0.4718
 epoch: 21, train_loss: 0.8907, test_loss: 0.9870, test_f1: 0.4378
 epoch: 22, train_loss: 0.8856, test_loss: 1.0452, test_f1: 0.5528
 epoch: 23, train_loss: 0.8860, test_loss: 1.0294, test_f1: 0.5667
 epoch: 24, train_loss: 0.8481, test_loss: 1.0272, test_f1: 0.5440
 epoch: 25, train_loss: 0.8690, test_loss: 1.0436, test_f1: 0.5344
 epoch: 26, train_loss: 0.8992, test_loss: 1.0482, test_f1: 0.5356
 epoch: 27, train_loss: 0.8737, test_loss: 1.0530, test_f1: 0.5417
 epoch: 28, train_loss: 0.8596, test_loss: 1.0657, test_f1: 0.5242
 epoch: 29, train_loss: 0.8593, test_loss: 1.1385, test_f1: 0.4507
 epoch: 30, train_loss: 0.8552, test_loss: 1.1590, test_f1: 0.5592
 epoch: 31, train_loss: 0.8618, test_loss: 1.2281, test_f1: 0.4200
 epoch: 32, train_loss: 0.8695, test_loss: 1.6172, test_f1: 0.5392
 epoch: 33, train_loss: 0.8305, test_loss: 1.1105, test_f1: 0.5445
 epoch: 34, train_loss: 0.8860, test_loss: 1.0578, test_f1: 0.5682
 epoch: 35, train_loss: 0.8563, test_loss: 0.9852, test_f1: 0.5753
 epoch: 36, train_loss: 0.8371, test_loss: 1.0359, test_f1: 0.5540
 epoch: 37, train_loss: 0.8287, test_loss: 1.2327, test_f1: 0.4522
 epoch: 38, train_loss: 0.8734, test_loss: 1.0624, test_f1: 0.5755
 epoch: 39, train_loss: 0.8441, test_loss: 1.1213, test_f1: 0.5481
 epoch: 40, train_loss: 0.8225, test_loss: 1.0026, test_f1: 0.5839
 epoch: 41, train_loss: 0.8557, test_loss: 1.0492, test_f1: 0.5409
 epoch: 42, train_loss: 0.8703, test_loss: 1.1919, test_f1: 0.5088
 epoch: 43, train_loss: 0.8776, test_loss: 1.2600, test_f1: 0.4372
 epoch: 44, train_loss: 0.8276, test_loss: 1.0259, test_f1: 0.5542
 epoch: 45, train_loss: 0.8088, test_loss: 1.0544, test_f1: 0.5585
 epoch: 46, train_loss: 0.8363, test_loss: 1.0496, test_f1: 0.5738
 epoch: 47, train_loss: 0.8127, test_loss: 1.1132, test_f1: 0.4900
 epoch: 48, train_loss: 0.8187, test_loss: 1.0470, test_f1: 0.6016
 epoch: 49, train_loss: 0.7952, test_loss: 1.0529, test_f1: 0.5989
 epoch: 50, train_loss: 0.8170, test_loss: 1.0513, test_f1: 0.5830
 epoch: 51, train_loss: 0.7854, test_loss: 1.0800, test_f1: 0.6007
 epoch: 52, train_loss: 0.7855, test_loss: 1.0579, test_f1: 0.6015
 epoch: 53, train_loss: 0.7797, test_loss: 1.1383, test_f1: 0.6055
 epoch: 54, train_loss: 0.7680, test_loss: 1.1382, test_f1: 0.5401
 epoch: 55, train_loss: 0.7642, test_loss: 1.1382, test_f1: 0.5592
 epoch: 56, train_loss: 0.7708, test_loss: 1.1285, test_f1: 0.5942
 epoch: 57, train_loss: 0.7654, test_loss: 1.2477, test_f1: 0.5090
 epoch: 58, train_loss: 0.7753, test_loss: 1.2449, test_f1: 0.5966
 epoch: 59, train_loss: 0.7445, test_loss: 1.2596, test_f1: 0.5568
 epoch: 60, train_loss: 0.7580, test_loss: 1.1891, test_f1: 0.5286
 epoch: 61, train_loss: 0.7345, test_loss: 1.1970, test_f1: 0.5379
 epoch: 62, train_loss: 0.7646, test_loss: 1.1147, test_f1: 0.5304
 epoch: 63, train_loss: 0.7424, test_loss: 1.2341, test_f1: 0.5600
 epoch: 64, train_loss: 0.7439, test_loss: 1.0860, test_f1: 0.5805
 epoch: 65, train_loss: 0.7476, test_loss: 1.2044, test_f1: 0.5711
 epoch: 66, train_loss: 0.7590, test_loss: 1.1350, test_f1: 0.5694
 epoch: 67, train_loss: 0.7490, test_loss: 1.0745, test_f1: 0.5822
 epoch: 68, train_loss: 0.7346, test_loss: 1.2903, test_f1: 0.5413
 epoch: 69, train_loss: 0.7265, test_loss: 1.1973, test_f1: 0.5826
 epoch: 70, train_loss: 0.7251, test_loss: 1.2391, test_f1: 0.5539
 epoch: 71, train_loss: 0.7284, test_loss: 1.3553, test_f1: 0.5457
 epoch: 72, train_loss: 0.7220, test_loss: 1.2039, test_f1: 0.5940
 epoch: 73, train_loss: 0.7214, test_loss: 1.3114, test_f1: 0.5634
 epoch: 74, train_loss: 0.7265, test_loss: 1.2512, test_f1: 0.5694
 epoch: 75, train_loss: 0.7279, test_loss: 1.1868, test_f1: 0.6048
 epoch: 76, train_loss: 0.7347, test_loss: 1.3106, test_f1: 0.5229
 epoch: 77, train_loss: 0.7237, test_loss: 1.2405, test_f1: 0.6181
 epoch: 78, train_loss: 0.7418, test_loss: 1.1320, test_f1: 0.5875
 epoch: 79, train_loss: 0.7272, test_loss: 1.3111, test_f1: 0.5601
 epoch: 80, train_loss: 0.7235, test_loss: 1.0869, test_f1: 0.5962
 epoch: 81, train_loss: 0.7104, test_loss: 1.0987, test_f1: 0.5740
 epoch: 82, train_loss: 0.7207, test_loss: 1.1794, test_f1: 0.5966
 epoch: 83, train_loss: 0.7375, test_loss: 1.1752, test_f1: 0.5803
 epoch: 84, train_loss: 0.7109, test_loss: 1.2194, test_f1: 0.6028
 epoch: 85, train_loss: 0.6930, test_loss: 1.1926, test_f1: 0.6077
 epoch: 86, train_loss: 0.7028, test_loss: 1.2227, test_f1: 0.5875
 epoch: 87, train_loss: 0.7146, test_loss: 1.2515, test_f1: 0.5454
 epoch: 88, train_loss: 0.7530, test_loss: 1.1198, test_f1: 0.5871
 epoch: 89, train_loss: 0.7078, test_loss: 1.1347, test_f1: 0.6044
 epoch: 90, train_loss: 0.6969, test_loss: 1.3349, test_f1: 0.5674
 epoch: 91, train_loss: 0.6972, test_loss: 1.3778, test_f1: 0.5707
 epoch: 92, train_loss: 0.6962, test_loss: 1.2913, test_f1: 0.5712
 epoch: 93, train_loss: 0.6827, test_loss: 1.3187, test_f1: 0.6062
 epoch: 94, train_loss: 0.6886, test_loss: 1.1850, test_f1: 0.5995
 epoch: 95, train_loss: 0.6993, test_loss: 1.2887, test_f1: 0.6053
 epoch: 96, train_loss: 0.7018, test_loss: 1.3908, test_f1: 0.5756
 epoch: 97, train_loss: 0.6908, test_loss: 1.2850, test_f1: 0.6229
 epoch: 98, train_loss: 0.7116, test_loss: 1.1614, test_f1: 0.5801
 epoch: 99, train_loss: 0.6858, test_loss: 1.3152, test_f1: 0.5980

Training completed in 658.37 seconds
Best F1: 0.6248 at epoch 93
Mean F1 across iterations: 0.6082  0.0167
========================FINAL RESULTS================================
FEGIN weighted F1: 0.6248  0.0167
python main.py --data ltspice_demos --representation component_component --model FEGIN --layers 4 --hiddens 16 --batch_size 32 --lr 0.01 --emb_size 512 --epochs 100 --save_appendix component_component_L4_H16_BS32_LR0.01_E512 --no_val
-----



STDERR:
  File "main.py", line 370, in <module>
    main()
  File "main.py", line 254, in main
    dataset = dataset_class(
  File "/home/philip/projects/ltspice_examples_code_repo/Circuit-Completion-Using-GNNs/component_classification_with_link_prediction_head/evaluation/FEGIN/kernel/circuit_datasets.py", line 15, in __init__
    self.data, self.slices = torch.load(self.processed_paths[0])
  File "/home/philip/.local/lib/python3.8/site-packages/torch/serialization.py", line 1040, in load
    warnings.warn(
  File "/usr/lib/python3.8/warnings.py", line 109, in _showwarnmsg
    sw(msg.message, msg.category, msg.filename, msg.lineno,
  File "main.py", line 47, in warn_with_traceback
    traceback.print_stack(file=log)
/home/philip/projects/ltspice_examples_code_repo/Circuit-Completion-Using-GNNs/component_classification_with_link_prediction_head/evaluation/FEGIN/kernel/circuit_datasets.py:15: FutureWarning: You are using `torch.load` with `weights_only=False` (the current default value), which uses the default pickle module implicitly. It is possible to construct malicious pickle data which will execute arbitrary code during unpickling (See https://github.com/pytorch/pytorch/blob/main/SECURITY.md#untrusted-models for more details). In a future release, the default value for `weights_only` will be flipped to `True`. This limits the functions that could be executed during unpickling. Arbitrary objects will no longer be allowed to be loaded via this mode unless they are explicitly allowlisted by the user via `torch.serialization.add_safe_globals`. We recommend you start setting `weights_only=True` for any use case where you don't have full control of the loaded file. Please open an issue on GitHub for any issues related to this experimental feature.
  self.data, self.slices = torch.load(self.processed_paths[0])
