STDOUT:
Results will be saved in /home/philip/projects/ltspice_examples_code_repo/Circuit-Completion-Using-GNNs/component_classification_with_link_prediction_head/evaluation/FEGIN/results/model_FEGIN_dataset_ltspice_examples
Command line input: python main.py --data ltspice_examples --representation component_component --model FEGIN --layers 4 --hiddens 64 --batch_size 32 --lr 0.001 --emb_size 128 --epochs 100 --save_appendix component_component_L4_H64_BS32_LR0.001_E128 --no_val
 is saved.
-----
ltspice_examples - FEGIN
Using 4 layers, 64 hidden units, h = 2
Loading component_component representation dataset
ENTERED
Training FEGIN on component_component representation
Train: 3556, Test: 845
##################ITERATION #0 ****************************************
 epoch: 0, train_loss: 1.2615, test_loss: 1.1677, test_f1: 0.3476
 epoch: 1, train_loss: 1.1559, test_loss: 1.0577, test_f1: 0.4362
 epoch: 2, train_loss: 1.0979, test_loss: 1.0172, test_f1: 0.5040
 epoch: 3, train_loss: 1.0597, test_loss: 0.9719, test_f1: 0.4632
 epoch: 4, train_loss: 1.0283, test_loss: 0.9717, test_f1: 0.4629
 epoch: 5, train_loss: 1.0091, test_loss: 1.1908, test_f1: 0.4116
 epoch: 6, train_loss: 0.9700, test_loss: 0.9654, test_f1: 0.4598
 epoch: 7, train_loss: 0.9666, test_loss: 1.0001, test_f1: 0.4753
 epoch: 8, train_loss: 0.9541, test_loss: 0.9531, test_f1: 0.4975
 epoch: 9, train_loss: 0.9195, test_loss: 0.9814, test_f1: 0.4991
 epoch: 10, train_loss: 0.9220, test_loss: 0.9966, test_f1: 0.5016
 epoch: 11, train_loss: 0.9303, test_loss: 0.9884, test_f1: 0.4714
 epoch: 12, train_loss: 0.8998, test_loss: 0.9885, test_f1: 0.4906
 epoch: 13, train_loss: 0.8986, test_loss: 1.0012, test_f1: 0.5012
 epoch: 14, train_loss: 0.8987, test_loss: 1.0118, test_f1: 0.4756
 epoch: 15, train_loss: 0.8729, test_loss: 1.0047, test_f1: 0.4951
 epoch: 16, train_loss: 0.8720, test_loss: 0.9997, test_f1: 0.5021
 epoch: 17, train_loss: 0.8549, test_loss: 0.9965, test_f1: 0.5470
 epoch: 18, train_loss: 0.8545, test_loss: 0.9744, test_f1: 0.5477
 epoch: 19, train_loss: 0.8412, test_loss: 0.9918, test_f1: 0.5453
 epoch: 20, train_loss: 0.8594, test_loss: 1.0077, test_f1: 0.5044
 epoch: 21, train_loss: 0.8309, test_loss: 1.0230, test_f1: 0.5071
 epoch: 22, train_loss: 0.8308, test_loss: 1.0642, test_f1: 0.5102
 epoch: 23, train_loss: 0.8116, test_loss: 1.0262, test_f1: 0.5555
 epoch: 24, train_loss: 0.8148, test_loss: 1.0281, test_f1: 0.5312
 epoch: 25, train_loss: 0.8031, test_loss: 1.0116, test_f1: 0.5292
 epoch: 26, train_loss: 0.7807, test_loss: 1.0477, test_f1: 0.5311
 epoch: 27, train_loss: 0.7926, test_loss: 1.0705, test_f1: 0.5804
 epoch: 28, train_loss: 0.7919, test_loss: 1.0567, test_f1: 0.5484
 epoch: 29, train_loss: 0.7843, test_loss: 1.0069, test_f1: 0.5510
 epoch: 30, train_loss: 0.7840, test_loss: 1.0272, test_f1: 0.5624
 epoch: 31, train_loss: 0.7711, test_loss: 1.0782, test_f1: 0.5252
 epoch: 32, train_loss: 0.7761, test_loss: 1.0440, test_f1: 0.5530
 epoch: 33, train_loss: 0.7583, test_loss: 1.0760, test_f1: 0.5438
 epoch: 34, train_loss: 0.7994, test_loss: 1.1248, test_f1: 0.5492
 epoch: 35, train_loss: 0.7570, test_loss: 1.1136, test_f1: 0.5378
 epoch: 36, train_loss: 0.7673, test_loss: 1.0599, test_f1: 0.5786
 epoch: 37, train_loss: 0.7412, test_loss: 1.1682, test_f1: 0.5329
 epoch: 38, train_loss: 0.7515, test_loss: 1.0936, test_f1: 0.5659
 epoch: 39, train_loss: 0.7163, test_loss: 1.1613, test_f1: 0.5247
 epoch: 40, train_loss: 0.7559, test_loss: 1.0644, test_f1: 0.5648
 epoch: 41, train_loss: 0.7298, test_loss: 1.1203, test_f1: 0.5644
 epoch: 42, train_loss: 0.7423, test_loss: 1.1717, test_f1: 0.5479
 epoch: 43, train_loss: 0.7167, test_loss: 1.1469, test_f1: 0.5348
 epoch: 44, train_loss: 0.7405, test_loss: 1.1608, test_f1: 0.5372
 epoch: 45, train_loss: 0.6988, test_loss: 1.1181, test_f1: 0.5726
 epoch: 46, train_loss: 0.7129, test_loss: 1.1502, test_f1: 0.5578
 epoch: 47, train_loss: 0.7132, test_loss: 1.1655, test_f1: 0.5225
 epoch: 48, train_loss: 0.7219, test_loss: 1.1574, test_f1: 0.5606
 epoch: 49, train_loss: 0.7021, test_loss: 1.1364, test_f1: 0.5525
 epoch: 50, train_loss: 0.6891, test_loss: 1.1329, test_f1: 0.5455
 epoch: 51, train_loss: 0.6597, test_loss: 1.1568, test_f1: 0.5580
 epoch: 52, train_loss: 0.6465, test_loss: 1.2113, test_f1: 0.5439
 epoch: 53, train_loss: 0.6489, test_loss: 1.1674, test_f1: 0.5234
 epoch: 54, train_loss: 0.6410, test_loss: 1.2600, test_f1: 0.5519
 epoch: 55, train_loss: 0.6561, test_loss: 1.2236, test_f1: 0.5750
 epoch: 56, train_loss: 0.6460, test_loss: 1.1890, test_f1: 0.5457
 epoch: 57, train_loss: 0.6176, test_loss: 1.2395, test_f1: 0.5420
 epoch: 58, train_loss: 0.6181, test_loss: 1.1773, test_f1: 0.5424
 epoch: 59, train_loss: 0.6151, test_loss: 1.1890, test_f1: 0.5380
 epoch: 60, train_loss: 0.6316, test_loss: 1.1987, test_f1: 0.5711
 epoch: 61, train_loss: 0.6442, test_loss: 1.1960, test_f1: 0.5554
 epoch: 62, train_loss: 0.6518, test_loss: 1.2080, test_f1: 0.5501
 epoch: 63, train_loss: 0.6185, test_loss: 1.1629, test_f1: 0.5854
 epoch: 64, train_loss: 0.6228, test_loss: 1.2059, test_f1: 0.5585
 epoch: 65, train_loss: 0.6090, test_loss: 1.2254, test_f1: 0.5520
 epoch: 66, train_loss: 0.5962, test_loss: 1.2901, test_f1: 0.5392
 epoch: 67, train_loss: 0.6101, test_loss: 1.2209, test_f1: 0.5541
 epoch: 68, train_loss: 0.6096, test_loss: 1.2435, test_f1: 0.5578
 epoch: 69, train_loss: 0.6081, test_loss: 1.3230, test_f1: 0.5639
 epoch: 70, train_loss: 0.6016, test_loss: 1.2541, test_f1: 0.5384
 epoch: 71, train_loss: 0.5796, test_loss: 1.2659, test_f1: 0.5648
 epoch: 72, train_loss: 0.5707, test_loss: 1.2805, test_f1: 0.5403
 epoch: 73, train_loss: 0.5710, test_loss: 1.3006, test_f1: 0.5411
 epoch: 74, train_loss: 0.5675, test_loss: 1.3210, test_f1: 0.5451
 epoch: 75, train_loss: 0.5661, test_loss: 1.3120, test_f1: 0.5631
 epoch: 76, train_loss: 0.5796, test_loss: 1.3251, test_f1: 0.5579
 epoch: 77, train_loss: 0.5807, test_loss: 1.3276, test_f1: 0.5315
 epoch: 78, train_loss: 0.5715, test_loss: 1.3670, test_f1: 0.5407
 epoch: 79, train_loss: 0.5514, test_loss: 1.2971, test_f1: 0.5531
 epoch: 80, train_loss: 0.5576, test_loss: 1.3121, test_f1: 0.5713
 epoch: 81, train_loss: 0.5699, test_loss: 1.3134, test_f1: 0.5598
 epoch: 82, train_loss: 0.5507, test_loss: 1.2952, test_f1: 0.5762
 epoch: 83, train_loss: 0.5654, test_loss: 1.3326, test_f1: 0.5774
 epoch: 84, train_loss: 0.5541, test_loss: 1.3243, test_f1: 0.5633
 epoch: 85, train_loss: 0.5380, test_loss: 1.3627, test_f1: 0.5537
 epoch: 86, train_loss: 0.5725, test_loss: 1.3514, test_f1: 0.5394
 epoch: 87, train_loss: 0.5397, test_loss: 1.3232, test_f1: 0.5731
 epoch: 88, train_loss: 0.5208, test_loss: 1.4432, test_f1: 0.5710
 epoch: 89, train_loss: 0.5251, test_loss: 1.3156, test_f1: 0.5894
 epoch: 90, train_loss: 0.5522, test_loss: 1.3123, test_f1: 0.5580
 epoch: 91, train_loss: 0.5408, test_loss: 1.3538, test_f1: 0.5632
 epoch: 92, train_loss: 0.5590, test_loss: 1.4054, test_f1: 0.5460
 epoch: 93, train_loss: 0.5298, test_loss: 1.3817, test_f1: 0.5656
 epoch: 94, train_loss: 0.5342, test_loss: 1.3177, test_f1: 0.5735
 epoch: 95, train_loss: 0.5221, test_loss: 1.3248, test_f1: 0.5718
 epoch: 96, train_loss: 0.5367, test_loss: 1.3633, test_f1: 0.5825
 epoch: 97, train_loss: 0.5218, test_loss: 1.4245, test_f1: 0.5378
 epoch: 98, train_loss: 0.5193, test_loss: 1.3834, test_f1: 0.5786
 epoch: 99, train_loss: 0.5338, test_loss: 1.3955, test_f1: 0.5796
##################ITERATION #1 ****************************************
 epoch: 0, train_loss: 1.2585, test_loss: 1.2100, test_f1: 0.3981
 epoch: 1, train_loss: 1.1685, test_loss: 1.0951, test_f1: 0.4308
 epoch: 2, train_loss: 1.1219, test_loss: 1.0932, test_f1: 0.4147
 epoch: 3, train_loss: 1.0848, test_loss: 1.0305, test_f1: 0.4674
 epoch: 4, train_loss: 1.0502, test_loss: 1.0322, test_f1: 0.4222
 epoch: 5, train_loss: 1.0234, test_loss: 0.9799, test_f1: 0.4377
 epoch: 6, train_loss: 1.0187, test_loss: 0.9522, test_f1: 0.4835
 epoch: 7, train_loss: 0.9964, test_loss: 0.9226, test_f1: 0.4976
 epoch: 8, train_loss: 0.9701, test_loss: 0.9472, test_f1: 0.4790
 epoch: 9, train_loss: 0.9521, test_loss: 0.9800, test_f1: 0.4876
 epoch: 10, train_loss: 0.9598, test_loss: 0.9400, test_f1: 0.4835
 epoch: 11, train_loss: 0.9400, test_loss: 1.0083, test_f1: 0.4986
 epoch: 12, train_loss: 0.9427, test_loss: 0.9644, test_f1: 0.5183
 epoch: 13, train_loss: 0.9136, test_loss: 0.9619, test_f1: 0.5181
 epoch: 14, train_loss: 0.9025, test_loss: 1.0021, test_f1: 0.5123
 epoch: 15, train_loss: 0.9047, test_loss: 0.9742, test_f1: 0.5270
 epoch: 16, train_loss: 0.8791, test_loss: 1.0159, test_f1: 0.5309
 epoch: 17, train_loss: 0.8811, test_loss: 1.1358, test_f1: 0.5215
 epoch: 18, train_loss: 0.8799, test_loss: 0.9648, test_f1: 0.5660
 epoch: 19, train_loss: 0.8623, test_loss: 0.9637, test_f1: 0.5240
 epoch: 20, train_loss: 0.8686, test_loss: 1.0247, test_f1: 0.5234
 epoch: 21, train_loss: 0.8491, test_loss: 1.0218, test_f1: 0.5485
 epoch: 22, train_loss: 0.8426, test_loss: 1.0194, test_f1: 0.5366
 epoch: 23, train_loss: 0.8757, test_loss: 1.0473, test_f1: 0.5697
 epoch: 24, train_loss: 0.8513, test_loss: 1.0615, test_f1: 0.5512
 epoch: 25, train_loss: 0.8624, test_loss: 1.0092, test_f1: 0.5554
 epoch: 26, train_loss: 0.8279, test_loss: 1.0598, test_f1: 0.5477
 epoch: 27, train_loss: 0.8714, test_loss: 1.0548, test_f1: 0.5750
 epoch: 28, train_loss: 0.8502, test_loss: 1.0731, test_f1: 0.5305
 epoch: 29, train_loss: 0.8695, test_loss: 1.0085, test_f1: 0.5554
 epoch: 30, train_loss: 0.8230, test_loss: 1.0486, test_f1: 0.5483
 epoch: 31, train_loss: 0.8064, test_loss: 0.9937, test_f1: 0.5441
 epoch: 32, train_loss: 0.7871, test_loss: 1.0634, test_f1: 0.5491
 epoch: 33, train_loss: 0.7876, test_loss: 1.0602, test_f1: 0.5579
 epoch: 34, train_loss: 0.7937, test_loss: 1.0345, test_f1: 0.5501
 epoch: 35, train_loss: 0.7802, test_loss: 1.1416, test_f1: 0.5266
 epoch: 36, train_loss: 0.7659, test_loss: 1.0406, test_f1: 0.5660
 epoch: 37, train_loss: 0.7846, test_loss: 1.0297, test_f1: 0.5595
 epoch: 38, train_loss: 0.8015, test_loss: 0.9820, test_f1: 0.5371
 epoch: 39, train_loss: 0.7625, test_loss: 1.0448, test_f1: 0.5636
 epoch: 40, train_loss: 0.7842, test_loss: 1.0271, test_f1: 0.5415
 epoch: 41, train_loss: 0.7684, test_loss: 1.0296, test_f1: 0.5409
 epoch: 42, train_loss: 0.7433, test_loss: 1.0997, test_f1: 0.5697
 epoch: 43, train_loss: 0.7446, test_loss: 1.1088, test_f1: 0.5090
 epoch: 44, train_loss: 0.7225, test_loss: 1.1137, test_f1: 0.5317
 epoch: 45, train_loss: 0.7267, test_loss: 1.0884, test_f1: 0.5555
 epoch: 46, train_loss: 0.7419, test_loss: 1.1545, test_f1: 0.5377
 epoch: 47, train_loss: 0.7454, test_loss: 1.1607, test_f1: 0.5509
 epoch: 48, train_loss: 0.7076, test_loss: 1.1369, test_f1: 0.5441
 epoch: 49, train_loss: 0.7133, test_loss: 1.1510, test_f1: 0.4999
 epoch: 50, train_loss: 0.7174, test_loss: 1.1394, test_f1: 0.5536
 epoch: 51, train_loss: 0.6633, test_loss: 1.1576, test_f1: 0.5512
 epoch: 52, train_loss: 0.6700, test_loss: 1.1778, test_f1: 0.5578
 epoch: 53, train_loss: 0.6552, test_loss: 1.1689, test_f1: 0.5606
 epoch: 54, train_loss: 0.6534, test_loss: 1.2091, test_f1: 0.5483
 epoch: 55, train_loss: 0.6777, test_loss: 1.2182, test_f1: 0.5395
 epoch: 56, train_loss: 0.6512, test_loss: 1.1821, test_f1: 0.5346
 epoch: 57, train_loss: 0.6332, test_loss: 1.1920, test_f1: 0.5426
 epoch: 58, train_loss: 0.6306, test_loss: 1.1628, test_f1: 0.5681
 epoch: 59, train_loss: 0.6445, test_loss: 1.1857, test_f1: 0.5584
 epoch: 60, train_loss: 0.6303, test_loss: 1.1350, test_f1: 0.5562
 epoch: 61, train_loss: 0.6186, test_loss: 1.1988, test_f1: 0.5735
 epoch: 62, train_loss: 0.6112, test_loss: 1.1986, test_f1: 0.5497
 epoch: 63, train_loss: 0.6208, test_loss: 1.2614, test_f1: 0.5577
 epoch: 64, train_loss: 0.6172, test_loss: 1.2412, test_f1: 0.5438
 epoch: 65, train_loss: 0.6022, test_loss: 1.2800, test_f1: 0.5460
 epoch: 66, train_loss: 0.6131, test_loss: 1.3101, test_f1: 0.5210
 epoch: 67, train_loss: 0.6113, test_loss: 1.2630, test_f1: 0.5380
 epoch: 68, train_loss: 0.6055, test_loss: 1.2415, test_f1: 0.5233
 epoch: 69, train_loss: 0.6043, test_loss: 1.2025, test_f1: 0.5513
 epoch: 70, train_loss: 0.6002, test_loss: 1.2089, test_f1: 0.5484
 epoch: 71, train_loss: 0.5863, test_loss: 1.3265, test_f1: 0.5290
 epoch: 72, train_loss: 0.5953, test_loss: 1.2688, test_f1: 0.5563
 epoch: 73, train_loss: 0.5791, test_loss: 1.3969, test_f1: 0.5155
 epoch: 74, train_loss: 0.5736, test_loss: 1.2363, test_f1: 0.5685
 epoch: 75, train_loss: 0.5928, test_loss: 1.1777, test_f1: 0.5556
 epoch: 76, train_loss: 0.5585, test_loss: 1.2487, test_f1: 0.5383
 epoch: 77, train_loss: 0.5722, test_loss: 1.3109, test_f1: 0.5283
 epoch: 78, train_loss: 0.5696, test_loss: 1.2860, test_f1: 0.5281
 epoch: 79, train_loss: 0.5682, test_loss: 1.3772, test_f1: 0.5325
 epoch: 80, train_loss: 0.5828, test_loss: 1.3775, test_f1: 0.5150
 epoch: 81, train_loss: 0.5593, test_loss: 1.3986, test_f1: 0.5204
 epoch: 82, train_loss: 0.5520, test_loss: 1.2789, test_f1: 0.5398
 epoch: 83, train_loss: 0.5787, test_loss: 1.3042, test_f1: 0.5499
 epoch: 84, train_loss: 0.5564, test_loss: 1.2878, test_f1: 0.5397
 epoch: 85, train_loss: 0.5564, test_loss: 1.2863, test_f1: 0.5630
 epoch: 86, train_loss: 0.5598, test_loss: 1.3180, test_f1: 0.5597
 epoch: 87, train_loss: 0.5450, test_loss: 1.2677, test_f1: 0.5495
 epoch: 88, train_loss: 0.5434, test_loss: 1.3264, test_f1: 0.5583
 epoch: 89, train_loss: 0.5650, test_loss: 1.4593, test_f1: 0.5149
 epoch: 90, train_loss: 0.5449, test_loss: 1.5198, test_f1: 0.5421
 epoch: 91, train_loss: 0.5381, test_loss: 1.3721, test_f1: 0.5595
 epoch: 92, train_loss: 0.5325, test_loss: 1.4651, test_f1: 0.5251
 epoch: 93, train_loss: 0.5196, test_loss: 1.3087, test_f1: 0.5809
 epoch: 94, train_loss: 0.5345, test_loss: 1.4629, test_f1: 0.5133
 epoch: 95, train_loss: 0.5325, test_loss: 1.2921, test_f1: 0.5505
 epoch: 96, train_loss: 0.5222, test_loss: 1.5754, test_f1: 0.4952
 epoch: 97, train_loss: 0.5246, test_loss: 1.3486, test_f1: 0.5450
 epoch: 98, train_loss: 0.5238, test_loss: 1.4118, test_f1: 0.5379
 epoch: 99, train_loss: 0.5217, test_loss: 1.3075, test_f1: 0.5723
##################ITERATION #2 ****************************************
 epoch: 0, train_loss: 1.2615, test_loss: 1.1356, test_f1: 0.4586
 epoch: 1, train_loss: 1.1435, test_loss: 1.0724, test_f1: 0.4318
 epoch: 2, train_loss: 1.0909, test_loss: 1.0593, test_f1: 0.4307
 epoch: 3, train_loss: 1.0520, test_loss: 0.9800, test_f1: 0.4824
 epoch: 4, train_loss: 1.0465, test_loss: 1.0066, test_f1: 0.4685
 epoch: 5, train_loss: 1.0222, test_loss: 0.9664, test_f1: 0.4852
 epoch: 6, train_loss: 0.9762, test_loss: 0.9949, test_f1: 0.4805
 epoch: 7, train_loss: 0.9743, test_loss: 0.9240, test_f1: 0.4909
 epoch: 8, train_loss: 0.9394, test_loss: 0.9636, test_f1: 0.4939
 epoch: 9, train_loss: 0.9334, test_loss: 1.0103, test_f1: 0.4958
 epoch: 10, train_loss: 0.9274, test_loss: 0.9704, test_f1: 0.5009
 epoch: 11, train_loss: 0.9128, test_loss: 1.0092, test_f1: 0.4910
 epoch: 12, train_loss: 0.9212, test_loss: 0.9544, test_f1: 0.5049
 epoch: 13, train_loss: 0.8999, test_loss: 0.9599, test_f1: 0.5288
 epoch: 14, train_loss: 0.8952, test_loss: 0.9520, test_f1: 0.4958
 epoch: 15, train_loss: 0.8947, test_loss: 0.9674, test_f1: 0.5004
 epoch: 16, train_loss: 0.8858, test_loss: 1.0050, test_f1: 0.5073
 epoch: 17, train_loss: 0.8877, test_loss: 0.9751, test_f1: 0.5383
 epoch: 18, train_loss: 0.8701, test_loss: 1.0536, test_f1: 0.5068
 epoch: 19, train_loss: 0.8613, test_loss: 0.9965, test_f1: 0.5458
 epoch: 20, train_loss: 0.8365, test_loss: 1.1169, test_f1: 0.4919
 epoch: 21, train_loss: 0.8327, test_loss: 0.9903, test_f1: 0.5463
 epoch: 22, train_loss: 0.8378, test_loss: 0.9584, test_f1: 0.5225
 epoch: 23, train_loss: 0.8086, test_loss: 1.0458, test_f1: 0.5312
 epoch: 24, train_loss: 0.8410, test_loss: 0.9893, test_f1: 0.5280
 epoch: 25, train_loss: 0.8161, test_loss: 0.9884, test_f1: 0.5193
 epoch: 26, train_loss: 0.8039, test_loss: 1.1188, test_f1: 0.5310
 epoch: 27, train_loss: 0.8199, test_loss: 1.0050, test_f1: 0.5325
 epoch: 28, train_loss: 0.8061, test_loss: 1.0543, test_f1: 0.5173
 epoch: 29, train_loss: 0.7607, test_loss: 1.1624, test_f1: 0.5187
 epoch: 30, train_loss: 0.7873, test_loss: 1.0289, test_f1: 0.5259
 epoch: 31, train_loss: 0.7770, test_loss: 1.0743, test_f1: 0.5376
 epoch: 32, train_loss: 0.7623, test_loss: 1.1141, test_f1: 0.5263
 epoch: 33, train_loss: 0.7527, test_loss: 1.0565, test_f1: 0.5319
 epoch: 34, train_loss: 0.7847, test_loss: 1.0418, test_f1: 0.5477
 epoch: 35, train_loss: 0.7931, test_loss: 1.0051, test_f1: 0.5256
 epoch: 36, train_loss: 0.7751, test_loss: 0.9804, test_f1: 0.5376
 epoch: 37, train_loss: 0.7662, test_loss: 1.0632, test_f1: 0.5544
 epoch: 38, train_loss: 0.7549, test_loss: 1.0696, test_f1: 0.5008
 epoch: 39, train_loss: 0.7427, test_loss: 1.1022, test_f1: 0.5405
 epoch: 40, train_loss: 0.7430, test_loss: 0.9706, test_f1: 0.5547
 epoch: 41, train_loss: 0.7175, test_loss: 0.9970, test_f1: 0.5429
 epoch: 42, train_loss: 0.7530, test_loss: 1.0397, test_f1: 0.5324
 epoch: 43, train_loss: 0.7294, test_loss: 1.0456, test_f1: 0.5493
 epoch: 44, train_loss: 0.7184, test_loss: 1.0651, test_f1: 0.5341
 epoch: 45, train_loss: 0.7169, test_loss: 1.0290, test_f1: 0.5364
 epoch: 46, train_loss: 0.7165, test_loss: 1.0499, test_f1: 0.5461
 epoch: 47, train_loss: 0.7161, test_loss: 1.0825, test_f1: 0.5362
 epoch: 48, train_loss: 0.7090, test_loss: 1.1542, test_f1: 0.5307
 epoch: 49, train_loss: 0.7012, test_loss: 1.1412, test_f1: 0.5460
 epoch: 50, train_loss: 0.7340, test_loss: 1.1242, test_f1: 0.5223
 epoch: 51, train_loss: 0.6785, test_loss: 1.1006, test_f1: 0.5372
 epoch: 52, train_loss: 0.6597, test_loss: 1.1015, test_f1: 0.5392
 epoch: 53, train_loss: 0.6553, test_loss: 1.1202, test_f1: 0.5556
 epoch: 54, train_loss: 0.6563, test_loss: 1.1531, test_f1: 0.5253
 epoch: 55, train_loss: 0.6350, test_loss: 1.1019, test_f1: 0.5512
 epoch: 56, train_loss: 0.6342, test_loss: 1.1340, test_f1: 0.5372
 epoch: 57, train_loss: 0.6295, test_loss: 1.1302, test_f1: 0.5498
 epoch: 58, train_loss: 0.6158, test_loss: 1.1305, test_f1: 0.5480
 epoch: 59, train_loss: 0.6118, test_loss: 1.1692, test_f1: 0.5664
 epoch: 60, train_loss: 0.6210, test_loss: 1.1260, test_f1: 0.5334
 epoch: 61, train_loss: 0.5973, test_loss: 1.1746, test_f1: 0.5615
 epoch: 62, train_loss: 0.6173, test_loss: 1.1946, test_f1: 0.5216
 epoch: 63, train_loss: 0.5946, test_loss: 1.2606, test_f1: 0.5417
 epoch: 64, train_loss: 0.6019, test_loss: 1.1360, test_f1: 0.5537
 epoch: 65, train_loss: 0.6007, test_loss: 1.2084, test_f1: 0.5481
 epoch: 66, train_loss: 0.5875, test_loss: 1.2511, test_f1: 0.5470
 epoch: 67, train_loss: 0.5843, test_loss: 1.2674, test_f1: 0.5465
 epoch: 68, train_loss: 0.5893, test_loss: 1.1858, test_f1: 0.5565
 epoch: 69, train_loss: 0.5768, test_loss: 1.2454, test_f1: 0.5363
 epoch: 70, train_loss: 0.5877, test_loss: 1.2600, test_f1: 0.5447
 epoch: 71, train_loss: 0.5808, test_loss: 1.3038, test_f1: 0.5517
 epoch: 72, train_loss: 0.5749, test_loss: 1.2902, test_f1: 0.5354
 epoch: 73, train_loss: 0.5729, test_loss: 1.2948, test_f1: 0.5521
 epoch: 74, train_loss: 0.5660, test_loss: 1.2940, test_f1: 0.5633
 epoch: 75, train_loss: 0.5836, test_loss: 1.2223, test_f1: 0.5563
 epoch: 76, train_loss: 0.5661, test_loss: 1.2466, test_f1: 0.5625
 epoch: 77, train_loss: 0.5830, test_loss: 1.2006, test_f1: 0.5755
 epoch: 78, train_loss: 0.5697, test_loss: 1.2017, test_f1: 0.5325
 epoch: 79, train_loss: 0.5597, test_loss: 1.3124, test_f1: 0.5470
 epoch: 80, train_loss: 0.5388, test_loss: 1.2787, test_f1: 0.5714
 epoch: 81, train_loss: 0.5634, test_loss: 1.2305, test_f1: 0.5524
 epoch: 82, train_loss: 0.5670, test_loss: 1.2541, test_f1: 0.5540
 epoch: 83, train_loss: 0.5391, test_loss: 1.2252, test_f1: 0.5500
 epoch: 84, train_loss: 0.5490, test_loss: 1.3616, test_f1: 0.5311
 epoch: 85, train_loss: 0.5529, test_loss: 1.4377, test_f1: 0.5269
 epoch: 86, train_loss: 0.5431, test_loss: 1.3313, test_f1: 0.5415
 epoch: 87, train_loss: 0.5202, test_loss: 1.3491, test_f1: 0.5562
 epoch: 88, train_loss: 0.5237, test_loss: 1.2119, test_f1: 0.5620
 epoch: 89, train_loss: 0.5443, test_loss: 1.2374, test_f1: 0.5478
 epoch: 90, train_loss: 0.5334, test_loss: 1.2806, test_f1: 0.5422
 epoch: 91, train_loss: 0.5403, test_loss: 1.2970, test_f1: 0.5645
 epoch: 92, train_loss: 0.5429, test_loss: 1.3416, test_f1: 0.5411
 epoch: 93, train_loss: 0.5223, test_loss: 1.3092, test_f1: 0.5570
 epoch: 94, train_loss: 0.5659, test_loss: 1.3099, test_f1: 0.5534
 epoch: 95, train_loss: 0.5400, test_loss: 1.3306, test_f1: 0.5409
 epoch: 96, train_loss: 0.5395, test_loss: 1.3187, test_f1: 0.5547
 epoch: 97, train_loss: 0.5314, test_loss: 1.3229, test_f1: 0.5540
 epoch: 98, train_loss: 0.5239, test_loss: 1.3184, test_f1: 0.5373
 epoch: 99, train_loss: 0.5125, test_loss: 1.3427, test_f1: 0.5428
##################ITERATION #3 ****************************************
 epoch: 0, train_loss: 1.2979, test_loss: 1.1756, test_f1: 0.3664
 epoch: 1, train_loss: 1.1490, test_loss: 1.0730, test_f1: 0.4175
 epoch: 2, train_loss: 1.1021, test_loss: 1.0215, test_f1: 0.4670
 epoch: 3, train_loss: 1.0645, test_loss: 1.0722, test_f1: 0.4037
 epoch: 4, train_loss: 1.0542, test_loss: 1.0039, test_f1: 0.4619
 epoch: 5, train_loss: 1.0189, test_loss: 0.9331, test_f1: 0.5135
 epoch: 6, train_loss: 1.0171, test_loss: 0.9426, test_f1: 0.4969
 epoch: 7, train_loss: 0.9911, test_loss: 1.0040, test_f1: 0.4508
 epoch: 8, train_loss: 1.0010, test_loss: 0.9452, test_f1: 0.5193
 epoch: 9, train_loss: 0.9750, test_loss: 0.9291, test_f1: 0.5100
 epoch: 10, train_loss: 0.9588, test_loss: 0.9141, test_f1: 0.5005
 epoch: 11, train_loss: 0.9420, test_loss: 0.9563, test_f1: 0.5195
 epoch: 12, train_loss: 0.9428, test_loss: 0.9761, test_f1: 0.5071
 epoch: 13, train_loss: 0.9247, test_loss: 0.8965, test_f1: 0.5210
 epoch: 14, train_loss: 0.9195, test_loss: 1.0214, test_f1: 0.4856
 epoch: 15, train_loss: 0.9210, test_loss: 0.9282, test_f1: 0.5424
 epoch: 16, train_loss: 0.9017, test_loss: 0.8852, test_f1: 0.5530
 epoch: 17, train_loss: 0.8812, test_loss: 0.9633, test_f1: 0.5139
 epoch: 18, train_loss: 0.8652, test_loss: 1.0423, test_f1: 0.5333
 epoch: 19, train_loss: 0.8620, test_loss: 0.9841, test_f1: 0.5283
 epoch: 20, train_loss: 0.8798, test_loss: 0.9658, test_f1: 0.5257
 epoch: 21, train_loss: 0.8832, test_loss: 1.0099, test_f1: 0.5047
 epoch: 22, train_loss: 0.8579, test_loss: 1.0349, test_f1: 0.5396
 epoch: 23, train_loss: 0.8678, test_loss: 1.0052, test_f1: 0.5147
 epoch: 24, train_loss: 0.8450, test_loss: 1.0368, test_f1: 0.5320
 epoch: 25, train_loss: 0.8323, test_loss: 0.9989, test_f1: 0.5418
 epoch: 26, train_loss: 0.8235, test_loss: 1.0877, test_f1: 0.5111
 epoch: 27, train_loss: 0.8264, test_loss: 0.9283, test_f1: 0.5511
 epoch: 28, train_loss: 0.8118, test_loss: 1.0331, test_f1: 0.5351
 epoch: 29, train_loss: 0.7860, test_loss: 1.0625, test_f1: 0.5429
 epoch: 30, train_loss: 0.7955, test_loss: 1.0403, test_f1: 0.5278
 epoch: 31, train_loss: 0.7885, test_loss: 1.2990, test_f1: 0.4973
 epoch: 32, train_loss: 0.8096, test_loss: 1.1008, test_f1: 0.5421
 epoch: 33, train_loss: 0.7923, test_loss: 1.0726, test_f1: 0.5267
 epoch: 34, train_loss: 0.8130, test_loss: 1.0560, test_f1: 0.5195
 epoch: 35, train_loss: 0.7912, test_loss: 1.0527, test_f1: 0.5481
 epoch: 36, train_loss: 0.7793, test_loss: 1.0060, test_f1: 0.5488
 epoch: 37, train_loss: 0.7638, test_loss: 1.1068, test_f1: 0.5516
 epoch: 38, train_loss: 0.7702, test_loss: 1.0792, test_f1: 0.5088
 epoch: 39, train_loss: 0.7622, test_loss: 1.1002, test_f1: 0.5529
 epoch: 40, train_loss: 0.7590, test_loss: 1.0929, test_f1: 0.5493
 epoch: 41, train_loss: 0.7495, test_loss: 1.1704, test_f1: 0.5196
 epoch: 42, train_loss: 0.7292, test_loss: 1.1514, test_f1: 0.5325
 epoch: 43, train_loss: 0.7405, test_loss: 1.1449, test_f1: 0.5331
 epoch: 44, train_loss: 0.7263, test_loss: 1.1426, test_f1: 0.5266
 epoch: 45, train_loss: 0.7258, test_loss: 1.0873, test_f1: 0.5388
 epoch: 46, train_loss: 0.7346, test_loss: 1.0896, test_f1: 0.5408
 epoch: 47, train_loss: 0.7060, test_loss: 1.1133, test_f1: 0.5313
 epoch: 48, train_loss: 0.7187, test_loss: 1.0681, test_f1: 0.5477
 epoch: 49, train_loss: 0.7244, test_loss: 1.0800, test_f1: 0.5512
 epoch: 50, train_loss: 0.7132, test_loss: 1.1163, test_f1: 0.5363
 epoch: 51, train_loss: 0.6766, test_loss: 1.0868, test_f1: 0.5494
 epoch: 52, train_loss: 0.6603, test_loss: 1.1495, test_f1: 0.5668
 epoch: 53, train_loss: 0.6573, test_loss: 1.1215, test_f1: 0.5560
 epoch: 54, train_loss: 0.6700, test_loss: 1.1123, test_f1: 0.5585
 epoch: 55, train_loss: 0.6346, test_loss: 1.1338, test_f1: 0.5544
 epoch: 56, train_loss: 0.6386, test_loss: 1.2107, test_f1: 0.5174
 epoch: 57, train_loss: 0.6790, test_loss: 1.0965, test_f1: 0.5294
 epoch: 58, train_loss: 0.6458, test_loss: 1.1274, test_f1: 0.5234
 epoch: 59, train_loss: 0.6397, test_loss: 1.1051, test_f1: 0.5474
 epoch: 60, train_loss: 0.6558, test_loss: 1.1162, test_f1: 0.5381
 epoch: 61, train_loss: 0.6372, test_loss: 1.1110, test_f1: 0.5460
 epoch: 62, train_loss: 0.6144, test_loss: 1.1177, test_f1: 0.5626
 epoch: 63, train_loss: 0.6177, test_loss: 1.1428, test_f1: 0.5731
 epoch: 64, train_loss: 0.6209, test_loss: 1.1534, test_f1: 0.5649
 epoch: 65, train_loss: 0.6129, test_loss: 1.1410, test_f1: 0.5620
 epoch: 66, train_loss: 0.5939, test_loss: 1.0801, test_f1: 0.5672
 epoch: 67, train_loss: 0.5906, test_loss: 1.1563, test_f1: 0.5769
 epoch: 68, train_loss: 0.5975, test_loss: 1.1200, test_f1: 0.5701
 epoch: 69, train_loss: 0.6297, test_loss: 1.1592, test_f1: 0.5467
 epoch: 70, train_loss: 0.6344, test_loss: 1.0862, test_f1: 0.5675
 epoch: 71, train_loss: 0.5981, test_loss: 1.0999, test_f1: 0.5857
 epoch: 72, train_loss: 0.5920, test_loss: 1.1708, test_f1: 0.5673
 epoch: 73, train_loss: 0.6233, test_loss: 1.1237, test_f1: 0.5541
 epoch: 74, train_loss: 0.6060, test_loss: 1.1417, test_f1: 0.5949
 epoch: 75, train_loss: 0.5912, test_loss: 1.1459, test_f1: 0.5650
 epoch: 76, train_loss: 0.5880, test_loss: 1.1252, test_f1: 0.5520
 epoch: 77, train_loss: 0.6122, test_loss: 1.1804, test_f1: 0.5468
 epoch: 78, train_loss: 0.5960, test_loss: 1.1464, test_f1: 0.5346
 epoch: 79, train_loss: 0.6034, test_loss: 1.1575, test_f1: 0.5551
 epoch: 80, train_loss: 0.5811, test_loss: 1.1982, test_f1: 0.5480
 epoch: 81, train_loss: 0.5639, test_loss: 1.2208, test_f1: 0.5419
 epoch: 82, train_loss: 0.5709, test_loss: 1.2947, test_f1: 0.5243
 epoch: 83, train_loss: 0.5556, test_loss: 1.2696, test_f1: 0.5577
 epoch: 84, train_loss: 0.5488, test_loss: 1.2824, test_f1: 0.5544
 epoch: 85, train_loss: 0.5551, test_loss: 1.2151, test_f1: 0.5553
 epoch: 86, train_loss: 0.5559, test_loss: 1.2519, test_f1: 0.5456
 epoch: 87, train_loss: 0.5563, test_loss: 1.2525, test_f1: 0.5352
 epoch: 88, train_loss: 0.5566, test_loss: 1.3620, test_f1: 0.5543
 epoch: 89, train_loss: 0.5349, test_loss: 1.2811, test_f1: 0.5430
 epoch: 90, train_loss: 0.6122, test_loss: 1.2146, test_f1: 0.5553
 epoch: 91, train_loss: 0.5769, test_loss: 1.2126, test_f1: 0.5481
 epoch: 92, train_loss: 0.5577, test_loss: 1.1806, test_f1: 0.5742
 epoch: 93, train_loss: 0.5453, test_loss: 1.2457, test_f1: 0.5673
 epoch: 94, train_loss: 0.5463, test_loss: 1.1972, test_f1: 0.5642
 epoch: 95, train_loss: 0.5425, test_loss: 1.2138, test_f1: 0.5717
 epoch: 96, train_loss: 0.5363, test_loss: 1.2226, test_f1: 0.5668
 epoch: 97, train_loss: 0.5202, test_loss: 1.1613, test_f1: 0.5764
 epoch: 98, train_loss: 0.5204, test_loss: 1.2932, test_f1: 0.5585
 epoch: 99, train_loss: 0.5166, test_loss: 1.2699, test_f1: 0.5880
##################ITERATION #4 ****************************************
 epoch: 0, train_loss: 1.2966, test_loss: 1.1204, test_f1: 0.4211
 epoch: 1, train_loss: 1.1713, test_loss: 1.0982, test_f1: 0.4332
 epoch: 2, train_loss: 1.1352, test_loss: 1.0564, test_f1: 0.4415
 epoch: 3, train_loss: 1.0976, test_loss: 1.0616, test_f1: 0.3999
 epoch: 4, train_loss: 1.0570, test_loss: 0.9438, test_f1: 0.4936
 epoch: 5, train_loss: 1.0405, test_loss: 1.0069, test_f1: 0.4582
 epoch: 6, train_loss: 1.0311, test_loss: 1.0317, test_f1: 0.4431
 epoch: 7, train_loss: 1.0048, test_loss: 1.0132, test_f1: 0.4195
 epoch: 8, train_loss: 0.9839, test_loss: 1.0015, test_f1: 0.4772
 epoch: 9, train_loss: 0.9802, test_loss: 1.0965, test_f1: 0.4366
 epoch: 10, train_loss: 0.9555, test_loss: 0.9692, test_f1: 0.4805
 epoch: 11, train_loss: 0.9472, test_loss: 0.9691, test_f1: 0.5130
 epoch: 12, train_loss: 0.9405, test_loss: 1.0571, test_f1: 0.4980
 epoch: 13, train_loss: 0.9443, test_loss: 1.0002, test_f1: 0.4813
 epoch: 14, train_loss: 0.9173, test_loss: 1.0588, test_f1: 0.4698
 epoch: 15, train_loss: 0.9087, test_loss: 1.0516, test_f1: 0.4757
 epoch: 16, train_loss: 0.9013, test_loss: 1.0609, test_f1: 0.4939
 epoch: 17, train_loss: 0.8899, test_loss: 1.0277, test_f1: 0.4904
 epoch: 18, train_loss: 0.8806, test_loss: 0.9400, test_f1: 0.5235
 epoch: 19, train_loss: 0.8907, test_loss: 1.0309, test_f1: 0.4984
 epoch: 20, train_loss: 0.8657, test_loss: 1.0292, test_f1: 0.5315
 epoch: 21, train_loss: 0.8856, test_loss: 1.0523, test_f1: 0.4584
 epoch: 22, train_loss: 0.8980, test_loss: 1.0881, test_f1: 0.5017
 epoch: 23, train_loss: 0.8784, test_loss: 1.0515, test_f1: 0.5207
 epoch: 24, train_loss: 0.8554, test_loss: 0.9974, test_f1: 0.5479
 epoch: 25, train_loss: 0.8492, test_loss: 1.0209, test_f1: 0.5345
 epoch: 26, train_loss: 0.8364, test_loss: 1.0223, test_f1: 0.5181
 epoch: 27, train_loss: 0.8226, test_loss: 1.0782, test_f1: 0.5128
 epoch: 28, train_loss: 0.8245, test_loss: 1.0432, test_f1: 0.5262
 epoch: 29, train_loss: 0.8198, test_loss: 1.0897, test_f1: 0.5410
 epoch: 30, train_loss: 0.8133, test_loss: 1.0651, test_f1: 0.5513
 epoch: 31, train_loss: 0.8183, test_loss: 1.1100, test_f1: 0.5520
 epoch: 32, train_loss: 0.7908, test_loss: 1.0760, test_f1: 0.5346
 epoch: 33, train_loss: 0.8007, test_loss: 1.1754, test_f1: 0.4793
 epoch: 34, train_loss: 0.7842, test_loss: 1.1374, test_f1: 0.5349
 epoch: 35, train_loss: 0.7990, test_loss: 1.1143, test_f1: 0.5232
 epoch: 36, train_loss: 0.7723, test_loss: 1.1068, test_f1: 0.5285
 epoch: 37, train_loss: 0.7919, test_loss: 1.0988, test_f1: 0.5272
 epoch: 38, train_loss: 0.7863, test_loss: 1.1680, test_f1: 0.5030
 epoch: 39, train_loss: 0.8121, test_loss: 1.0920, test_f1: 0.5387
 epoch: 40, train_loss: 0.7862, test_loss: 1.1510, test_f1: 0.5214
 epoch: 41, train_loss: 0.7775, test_loss: 1.1193, test_f1: 0.5473
 epoch: 42, train_loss: 0.7837, test_loss: 1.0733, test_f1: 0.5378
 epoch: 43, train_loss: 0.7624, test_loss: 1.1432, test_f1: 0.5046
 epoch: 44, train_loss: 0.7457, test_loss: 1.0373, test_f1: 0.5526
 epoch: 45, train_loss: 0.7431, test_loss: 1.0690, test_f1: 0.5400
 epoch: 46, train_loss: 0.7435, test_loss: 1.2119, test_f1: 0.5172
 epoch: 47, train_loss: 0.7910, test_loss: 1.0862, test_f1: 0.5457
 epoch: 48, train_loss: 0.7330, test_loss: 1.0952, test_f1: 0.5383
 epoch: 49, train_loss: 0.7095, test_loss: 1.1603, test_f1: 0.4989
 epoch: 50, train_loss: 0.7309, test_loss: 1.1058, test_f1: 0.5095
 epoch: 51, train_loss: 0.7041, test_loss: 1.1118, test_f1: 0.5261
 epoch: 52, train_loss: 0.6903, test_loss: 1.1722, test_f1: 0.5465
 epoch: 53, train_loss: 0.6780, test_loss: 1.1646, test_f1: 0.5389
 epoch: 54, train_loss: 0.6871, test_loss: 1.1289, test_f1: 0.5454
 epoch: 55, train_loss: 0.6586, test_loss: 1.2263, test_f1: 0.5584
 epoch: 56, train_loss: 0.6588, test_loss: 1.2127, test_f1: 0.5362
 epoch: 57, train_loss: 0.6640, test_loss: 1.1631, test_f1: 0.5364
 epoch: 58, train_loss: 0.6574, test_loss: 1.1930, test_f1: 0.5580
 epoch: 59, train_loss: 0.6660, test_loss: 1.1816, test_f1: 0.5410
 epoch: 60, train_loss: 0.6621, test_loss: 1.1437, test_f1: 0.5612
 epoch: 61, train_loss: 0.6328, test_loss: 1.2260, test_f1: 0.5532
 epoch: 62, train_loss: 0.6426, test_loss: 1.1904, test_f1: 0.5592
 epoch: 63, train_loss: 0.6480, test_loss: 1.2161, test_f1: 0.5332
 epoch: 64, train_loss: 0.6308, test_loss: 1.1643, test_f1: 0.5742
 epoch: 65, train_loss: 0.6351, test_loss: 1.1891, test_f1: 0.5653
 epoch: 66, train_loss: 0.6212, test_loss: 1.2007, test_f1: 0.5686
 epoch: 67, train_loss: 0.6321, test_loss: 1.2934, test_f1: 0.5469
 epoch: 68, train_loss: 0.6252, test_loss: 1.2913, test_f1: 0.5455
 epoch: 69, train_loss: 0.6410, test_loss: 1.1807, test_f1: 0.5539
 epoch: 70, train_loss: 0.6449, test_loss: 1.2032, test_f1: 0.5576
 epoch: 71, train_loss: 0.6072, test_loss: 1.2961, test_f1: 0.5444
 epoch: 72, train_loss: 0.6047, test_loss: 1.2541, test_f1: 0.5523
 epoch: 73, train_loss: 0.6186, test_loss: 1.2677, test_f1: 0.5675
 epoch: 74, train_loss: 0.6104, test_loss: 1.2558, test_f1: 0.5527
 epoch: 75, train_loss: 0.5939, test_loss: 1.2616, test_f1: 0.5663
 epoch: 76, train_loss: 0.5979, test_loss: 1.2292, test_f1: 0.5458
 epoch: 77, train_loss: 0.5714, test_loss: 1.3712, test_f1: 0.5461
 epoch: 78, train_loss: 0.6014, test_loss: 1.2760, test_f1: 0.5564
 epoch: 79, train_loss: 0.5963, test_loss: 1.2750, test_f1: 0.5522
 epoch: 80, train_loss: 0.6027, test_loss: 1.2642, test_f1: 0.5688
 epoch: 81, train_loss: 0.5972, test_loss: 1.2954, test_f1: 0.5494
 epoch: 82, train_loss: 0.5796, test_loss: 1.3600, test_f1: 0.5718
 epoch: 83, train_loss: 0.5792, test_loss: 1.2098, test_f1: 0.5497
 epoch: 84, train_loss: 0.5823, test_loss: 1.2817, test_f1: 0.5534
 epoch: 85, train_loss: 0.5750, test_loss: 1.3107, test_f1: 0.5682
 epoch: 86, train_loss: 0.6124, test_loss: 1.2542, test_f1: 0.5771
 epoch: 87, train_loss: 0.5859, test_loss: 1.2427, test_f1: 0.5594
 epoch: 88, train_loss: 0.5590, test_loss: 1.2372, test_f1: 0.5801
 epoch: 89, train_loss: 0.5750, test_loss: 1.2193, test_f1: 0.5686
 epoch: 90, train_loss: 0.5657, test_loss: 1.3334, test_f1: 0.5581
 epoch: 91, train_loss: 0.5549, test_loss: 1.2758, test_f1: 0.5905
 epoch: 92, train_loss: 0.5730, test_loss: 1.3914, test_f1: 0.5498
 epoch: 93, train_loss: 0.5285, test_loss: 1.3422, test_f1: 0.5418
 epoch: 94, train_loss: 0.5405, test_loss: 1.4007, test_f1: 0.5562
 epoch: 95, train_loss: 0.5546, test_loss: 1.2689, test_f1: 0.6002
 epoch: 96, train_loss: 0.5371, test_loss: 1.3519, test_f1: 0.5618
 epoch: 97, train_loss: 0.5299, test_loss: 1.3318, test_f1: 0.5523
 epoch: 98, train_loss: 0.5352, test_loss: 1.3870, test_f1: 0.5248
 epoch: 99, train_loss: 0.5531, test_loss: 1.3514, test_f1: 0.5495
##################ITERATION #5 ****************************************
 epoch: 0, train_loss: 1.3330, test_loss: 1.1529, test_f1: 0.3440
 epoch: 1, train_loss: 1.1771, test_loss: 1.1200, test_f1: 0.3934
 epoch: 2, train_loss: 1.1332, test_loss: 1.0791, test_f1: 0.4444
 epoch: 3, train_loss: 1.1032, test_loss: 1.0446, test_f1: 0.4241
 epoch: 4, train_loss: 1.0766, test_loss: 0.9956, test_f1: 0.4729
 epoch: 5, train_loss: 1.0613, test_loss: 1.0144, test_f1: 0.4151
 epoch: 6, train_loss: 1.0399, test_loss: 0.9568, test_f1: 0.4883
 epoch: 7, train_loss: 1.0080, test_loss: 0.9793, test_f1: 0.4570
 epoch: 8, train_loss: 0.9891, test_loss: 0.9873, test_f1: 0.4808
 epoch: 9, train_loss: 0.9763, test_loss: 1.0312, test_f1: 0.4722
 epoch: 10, train_loss: 0.9586, test_loss: 0.9742, test_f1: 0.4808
 epoch: 11, train_loss: 0.9543, test_loss: 1.0119, test_f1: 0.4736
 epoch: 12, train_loss: 0.9278, test_loss: 0.9754, test_f1: 0.4856
 epoch: 13, train_loss: 0.9345, test_loss: 1.0199, test_f1: 0.4797
 epoch: 14, train_loss: 0.9060, test_loss: 0.9720, test_f1: 0.4699
 epoch: 15, train_loss: 0.8983, test_loss: 0.9747, test_f1: 0.4988
 epoch: 16, train_loss: 0.8945, test_loss: 1.0495, test_f1: 0.4859
 epoch: 17, train_loss: 0.9213, test_loss: 1.0936, test_f1: 0.4619
 epoch: 18, train_loss: 0.8886, test_loss: 1.0742, test_f1: 0.5197
 epoch: 19, train_loss: 0.8876, test_loss: 1.0162, test_f1: 0.5047
 epoch: 20, train_loss: 0.8586, test_loss: 1.0716, test_f1: 0.4886
 epoch: 21, train_loss: 0.8820, test_loss: 1.0830, test_f1: 0.4692
 epoch: 22, train_loss: 0.8620, test_loss: 1.0605, test_f1: 0.4893
 epoch: 23, train_loss: 0.8920, test_loss: 1.0217, test_f1: 0.5054
 epoch: 24, train_loss: 0.8474, test_loss: 0.9931, test_f1: 0.5200
 epoch: 25, train_loss: 0.8375, test_loss: 1.0574, test_f1: 0.5198
 epoch: 26, train_loss: 0.8397, test_loss: 1.0461, test_f1: 0.4985
 epoch: 27, train_loss: 0.8277, test_loss: 1.1062, test_f1: 0.5306
 epoch: 28, train_loss: 0.8264, test_loss: 1.0692, test_f1: 0.5367
 epoch: 29, train_loss: 0.8690, test_loss: 0.9512, test_f1: 0.5502
 epoch: 30, train_loss: 0.8253, test_loss: 1.0350, test_f1: 0.5000
 epoch: 31, train_loss: 0.8074, test_loss: 1.0947, test_f1: 0.5280
 epoch: 32, train_loss: 0.8099, test_loss: 1.1132, test_f1: 0.5324
 epoch: 33, train_loss: 0.7939, test_loss: 1.0974, test_f1: 0.5074
 epoch: 34, train_loss: 0.7796, test_loss: 1.0362, test_f1: 0.5302
 epoch: 35, train_loss: 0.8009, test_loss: 1.1267, test_f1: 0.5232
 epoch: 36, train_loss: 0.7930, test_loss: 1.1094, test_f1: 0.5491
 epoch: 37, train_loss: 0.7764, test_loss: 1.0617, test_f1: 0.5308
 epoch: 38, train_loss: 0.7707, test_loss: 1.0656, test_f1: 0.5478
 epoch: 39, train_loss: 0.7658, test_loss: 1.1690, test_f1: 0.5331
 epoch: 40, train_loss: 0.7654, test_loss: 1.1404, test_f1: 0.5505
 epoch: 41, train_loss: 0.7665, test_loss: 1.0745, test_f1: 0.5429
 epoch: 42, train_loss: 0.7593, test_loss: 1.0687, test_f1: 0.5370
 epoch: 43, train_loss: 0.7496, test_loss: 1.2133, test_f1: 0.5298
 epoch: 44, train_loss: 0.7401, test_loss: 1.1110, test_f1: 0.5312
 epoch: 45, train_loss: 0.7302, test_loss: 1.1379, test_f1: 0.5363
 epoch: 46, train_loss: 0.7952, test_loss: 1.0542, test_f1: 0.5333
 epoch: 47, train_loss: 0.7489, test_loss: 1.0503, test_f1: 0.5621
 epoch: 48, train_loss: 0.7255, test_loss: 1.1330, test_f1: 0.5442
 epoch: 49, train_loss: 0.7271, test_loss: 1.2031, test_f1: 0.5267
 epoch: 50, train_loss: 0.7059, test_loss: 1.2668, test_f1: 0.5454
 epoch: 51, train_loss: 0.6802, test_loss: 1.1741, test_f1: 0.5441
 epoch: 52, train_loss: 0.6779, test_loss: 1.1802, test_f1: 0.5321
 epoch: 53, train_loss: 0.6843, test_loss: 1.1654, test_f1: 0.5445
 epoch: 54, train_loss: 0.6677, test_loss: 1.1966, test_f1: 0.5279
 epoch: 55, train_loss: 0.6697, test_loss: 1.2384, test_f1: 0.5461
 epoch: 56, train_loss: 0.6573, test_loss: 1.2063, test_f1: 0.5428
 epoch: 57, train_loss: 0.6392, test_loss: 1.2204, test_f1: 0.5259
 epoch: 58, train_loss: 0.6446, test_loss: 1.2047, test_f1: 0.5476
 epoch: 59, train_loss: 0.6315, test_loss: 1.1966, test_f1: 0.5468
 epoch: 60, train_loss: 0.6248, test_loss: 1.2584, test_f1: 0.5511
 epoch: 61, train_loss: 0.6250, test_loss: 1.1525, test_f1: 0.5463
 epoch: 62, train_loss: 0.6195, test_loss: 1.2932, test_f1: 0.5436
 epoch: 63, train_loss: 0.6300, test_loss: 1.1980, test_f1: 0.5418
 epoch: 64, train_loss: 0.6254, test_loss: 1.2465, test_f1: 0.5517
 epoch: 65, train_loss: 0.6013, test_loss: 1.2492, test_f1: 0.5409
 epoch: 66, train_loss: 0.6167, test_loss: 1.2944, test_f1: 0.5533
 epoch: 67, train_loss: 0.6095, test_loss: 1.2561, test_f1: 0.5364
 epoch: 68, train_loss: 0.6194, test_loss: 1.2267, test_f1: 0.5508
 epoch: 69, train_loss: 0.6021, test_loss: 1.3100, test_f1: 0.5333
 epoch: 70, train_loss: 0.5951, test_loss: 1.3191, test_f1: 0.5117
 epoch: 71, train_loss: 0.6195, test_loss: 1.3074, test_f1: 0.5436
 epoch: 72, train_loss: 0.6023, test_loss: 1.3041, test_f1: 0.5412
 epoch: 73, train_loss: 0.5968, test_loss: 1.2198, test_f1: 0.5422
 epoch: 74, train_loss: 0.5785, test_loss: 1.2721, test_f1: 0.5440
 epoch: 75, train_loss: 0.5777, test_loss: 1.3295, test_f1: 0.5431
 epoch: 76, train_loss: 0.5831, test_loss: 1.2144, test_f1: 0.5569
 epoch: 77, train_loss: 0.5768, test_loss: 1.3242, test_f1: 0.5495
 epoch: 78, train_loss: 0.5669, test_loss: 1.2332, test_f1: 0.5402
 epoch: 79, train_loss: 0.5690, test_loss: 1.2501, test_f1: 0.5606
 epoch: 80, train_loss: 0.5658, test_loss: 1.3741, test_f1: 0.5191
 epoch: 81, train_loss: 0.5798, test_loss: 1.4036, test_f1: 0.5221
 epoch: 82, train_loss: 0.5634, test_loss: 1.4107, test_f1: 0.5618
 epoch: 83, train_loss: 0.5737, test_loss: 1.3278, test_f1: 0.5384
 epoch: 84, train_loss: 0.5623, test_loss: 1.3088, test_f1: 0.5379
 epoch: 85, train_loss: 0.5595, test_loss: 1.3205, test_f1: 0.5303
 epoch: 86, train_loss: 0.5703, test_loss: 1.2992, test_f1: 0.5416
 epoch: 87, train_loss: 0.5514, test_loss: 1.3392, test_f1: 0.5283
 epoch: 88, train_loss: 0.5876, test_loss: 1.3507, test_f1: 0.5185
 epoch: 89, train_loss: 0.5710, test_loss: 1.3136, test_f1: 0.5335
 epoch: 90, train_loss: 0.5415, test_loss: 1.2861, test_f1: 0.5496
 epoch: 91, train_loss: 0.5532, test_loss: 1.2937, test_f1: 0.5528
 epoch: 92, train_loss: 0.5304, test_loss: 1.2768, test_f1: 0.5559
 epoch: 93, train_loss: 0.5331, test_loss: 1.2879, test_f1: 0.5545
 epoch: 94, train_loss: 0.5496, test_loss: 1.3462, test_f1: 0.5377
 epoch: 95, train_loss: 0.5389, test_loss: 1.3190, test_f1: 0.5621
 epoch: 96, train_loss: 0.5600, test_loss: 1.2623, test_f1: 0.5561
 epoch: 97, train_loss: 0.5354, test_loss: 1.2754, test_f1: 0.5569
 epoch: 98, train_loss: 0.5324, test_loss: 1.3816, test_f1: 0.5377
 epoch: 99, train_loss: 0.5228, test_loss: 1.3549, test_f1: 0.5694
##################ITERATION #6 ****************************************
 epoch: 0, train_loss: 1.2943, test_loss: 1.1327, test_f1: 0.4003
 epoch: 1, train_loss: 1.1470, test_loss: 1.0709, test_f1: 0.4437
 epoch: 2, train_loss: 1.1149, test_loss: 1.0026, test_f1: 0.4724
 epoch: 3, train_loss: 1.0792, test_loss: 1.0037, test_f1: 0.4725
 epoch: 4, train_loss: 1.0660, test_loss: 0.9508, test_f1: 0.4802
 epoch: 5, train_loss: 1.0296, test_loss: 0.9348, test_f1: 0.5203
 epoch: 6, train_loss: 1.0128, test_loss: 0.9299, test_f1: 0.4936
 epoch: 7, train_loss: 0.9967, test_loss: 1.0215, test_f1: 0.4742
 epoch: 8, train_loss: 0.9756, test_loss: 0.8966, test_f1: 0.5406
 epoch: 9, train_loss: 0.9685, test_loss: 0.8902, test_f1: 0.5627
 epoch: 10, train_loss: 0.9531, test_loss: 0.9196, test_f1: 0.5128
 epoch: 11, train_loss: 0.9493, test_loss: 0.9670, test_f1: 0.5098
 epoch: 12, train_loss: 0.9217, test_loss: 0.9283, test_f1: 0.5234
 epoch: 13, train_loss: 0.9599, test_loss: 0.9310, test_f1: 0.5251
 epoch: 14, train_loss: 0.9383, test_loss: 0.9662, test_f1: 0.4976
 epoch: 15, train_loss: 0.9039, test_loss: 0.9130, test_f1: 0.5366
 epoch: 16, train_loss: 0.8977, test_loss: 0.9278, test_f1: 0.5555
 epoch: 17, train_loss: 0.8931, test_loss: 0.8840, test_f1: 0.5664
 epoch: 18, train_loss: 0.9044, test_loss: 0.9175, test_f1: 0.4926
 epoch: 19, train_loss: 0.8726, test_loss: 0.9473, test_f1: 0.4926
 epoch: 20, train_loss: 0.8889, test_loss: 0.9280, test_f1: 0.5269
 epoch: 21, train_loss: 0.8681, test_loss: 0.9502, test_f1: 0.5206
 epoch: 22, train_loss: 0.8559, test_loss: 0.9611, test_f1: 0.4984
 epoch: 23, train_loss: 0.8613, test_loss: 0.8898, test_f1: 0.5519
 epoch: 24, train_loss: 0.8498, test_loss: 0.9517, test_f1: 0.5237
 epoch: 25, train_loss: 0.8412, test_loss: 0.9476, test_f1: 0.5587
 epoch: 26, train_loss: 0.8213, test_loss: 0.9335, test_f1: 0.5348
 epoch: 27, train_loss: 0.8070, test_loss: 0.9360, test_f1: 0.5524
 epoch: 28, train_loss: 0.8076, test_loss: 0.9798, test_f1: 0.5085
 epoch: 29, train_loss: 0.8207, test_loss: 1.0098, test_f1: 0.5373
 epoch: 30, train_loss: 0.8244, test_loss: 0.8922, test_f1: 0.5615
 epoch: 31, train_loss: 0.8120, test_loss: 0.9603, test_f1: 0.5350
 epoch: 32, train_loss: 0.8028, test_loss: 1.0439, test_f1: 0.5384
 epoch: 33, train_loss: 0.7899, test_loss: 1.0044, test_f1: 0.5334
 epoch: 34, train_loss: 0.7839, test_loss: 1.0691, test_f1: 0.5121
 epoch: 35, train_loss: 0.7612, test_loss: 0.9920, test_f1: 0.5313
 epoch: 36, train_loss: 0.7741, test_loss: 1.0109, test_f1: 0.5237
 epoch: 37, train_loss: 0.8431, test_loss: 0.9700, test_f1: 0.5302
 epoch: 38, train_loss: 0.7910, test_loss: 1.0091, test_f1: 0.5405
 epoch: 39, train_loss: 0.7572, test_loss: 0.9826, test_f1: 0.5203
 epoch: 40, train_loss: 0.7717, test_loss: 1.0110, test_f1: 0.5371
 epoch: 41, train_loss: 0.7502, test_loss: 0.9728, test_f1: 0.5381
 epoch: 42, train_loss: 0.7527, test_loss: 0.9682, test_f1: 0.5549
 epoch: 43, train_loss: 0.7668, test_loss: 1.0319, test_f1: 0.5374
 epoch: 44, train_loss: 0.7347, test_loss: 1.0449, test_f1: 0.5609
 epoch: 45, train_loss: 0.7379, test_loss: 1.0204, test_f1: 0.5349
 epoch: 46, train_loss: 0.7414, test_loss: 1.0691, test_f1: 0.5333
 epoch: 47, train_loss: 0.7166, test_loss: 1.0210, test_f1: 0.5500
 epoch: 48, train_loss: 0.7062, test_loss: 0.9989, test_f1: 0.5494
 epoch: 49, train_loss: 0.7101, test_loss: 1.0593, test_f1: 0.5651
 epoch: 50, train_loss: 0.7003, test_loss: 1.0681, test_f1: 0.5633
 epoch: 51, train_loss: 0.6679, test_loss: 1.0953, test_f1: 0.5338
 epoch: 52, train_loss: 0.6553, test_loss: 1.0854, test_f1: 0.5585
 epoch: 53, train_loss: 0.6449, test_loss: 1.1393, test_f1: 0.5420
 epoch: 54, train_loss: 0.6494, test_loss: 1.0777, test_f1: 0.5711
 epoch: 55, train_loss: 0.6467, test_loss: 1.1253, test_f1: 0.5489
 epoch: 56, train_loss: 0.6299, test_loss: 1.1268, test_f1: 0.5361
 epoch: 57, train_loss: 0.6361, test_loss: 1.0831, test_f1: 0.5546
 epoch: 58, train_loss: 0.6270, test_loss: 1.0498, test_f1: 0.5751
 epoch: 59, train_loss: 0.6136, test_loss: 1.1191, test_f1: 0.5631
 epoch: 60, train_loss: 0.6212, test_loss: 1.1437, test_f1: 0.5623
 epoch: 61, train_loss: 0.6029, test_loss: 1.1465, test_f1: 0.5553
 epoch: 62, train_loss: 0.6081, test_loss: 1.1519, test_f1: 0.5662
 epoch: 63, train_loss: 0.5977, test_loss: 1.1521, test_f1: 0.5558
 epoch: 64, train_loss: 0.5969, test_loss: 1.2229, test_f1: 0.5727
 epoch: 65, train_loss: 0.6003, test_loss: 1.1043, test_f1: 0.5736
 epoch: 66, train_loss: 0.5961, test_loss: 1.1523, test_f1: 0.5693
 epoch: 67, train_loss: 0.5823, test_loss: 1.2241, test_f1: 0.5489
 epoch: 68, train_loss: 0.5806, test_loss: 1.1296, test_f1: 0.5476
 epoch: 69, train_loss: 0.5786, test_loss: 1.2387, test_f1: 0.5612
 epoch: 70, train_loss: 0.5741, test_loss: 1.1793, test_f1: 0.5475
 epoch: 71, train_loss: 0.5736, test_loss: 1.1479, test_f1: 0.5528
 epoch: 72, train_loss: 0.5548, test_loss: 1.1667, test_f1: 0.5534
 epoch: 73, train_loss: 0.5708, test_loss: 1.1631, test_f1: 0.5526
 epoch: 74, train_loss: 0.5416, test_loss: 1.1980, test_f1: 0.5511
 epoch: 75, train_loss: 0.5860, test_loss: 1.1031, test_f1: 0.5593
 epoch: 76, train_loss: 0.5626, test_loss: 1.2672, test_f1: 0.5481
 epoch: 77, train_loss: 0.5715, test_loss: 1.2586, test_f1: 0.5496
 epoch: 78, train_loss: 0.5507, test_loss: 1.1781, test_f1: 0.5462
 epoch: 79, train_loss: 0.5602, test_loss: 1.3319, test_f1: 0.5529
 epoch: 80, train_loss: 0.5504, test_loss: 1.1182, test_f1: 0.5359
 epoch: 81, train_loss: 0.5299, test_loss: 1.0706, test_f1: 0.5650
 epoch: 82, train_loss: 0.5381, test_loss: 1.1411, test_f1: 0.5597
 epoch: 83, train_loss: 0.5272, test_loss: 1.2623, test_f1: 0.5520
 epoch: 84, train_loss: 0.5216, test_loss: 1.2106, test_f1: 0.5581
 epoch: 85, train_loss: 0.5436, test_loss: 1.2452, test_f1: 0.5440
 epoch: 86, train_loss: 0.5263, test_loss: 1.2335, test_f1: 0.5676
 epoch: 87, train_loss: 0.5334, test_loss: 1.0991, test_f1: 0.5866
 epoch: 88, train_loss: 0.4964, test_loss: 1.2660, test_f1: 0.5615
 epoch: 89, train_loss: 0.5363, test_loss: 1.2079, test_f1: 0.5643
 epoch: 90, train_loss: 0.5171, test_loss: 1.3531, test_f1: 0.5570
 epoch: 91, train_loss: 0.5191, test_loss: 1.2376, test_f1: 0.5587
 epoch: 92, train_loss: 0.4926, test_loss: 1.1935, test_f1: 0.5721
 epoch: 93, train_loss: 0.5023, test_loss: 1.3011, test_f1: 0.5578
 epoch: 94, train_loss: 0.4932, test_loss: 1.2602, test_f1: 0.5441
 epoch: 95, train_loss: 0.4929, test_loss: 1.3806, test_f1: 0.5552
 epoch: 96, train_loss: 0.4983, test_loss: 1.2513, test_f1: 0.5738
 epoch: 97, train_loss: 0.5000, test_loss: 1.2052, test_f1: 0.5712
 epoch: 98, train_loss: 0.5213, test_loss: 1.2646, test_f1: 0.5514
 epoch: 99, train_loss: 0.5044, test_loss: 1.2201, test_f1: 0.5592
##################ITERATION #7 ****************************************
 epoch: 0, train_loss: 1.3129, test_loss: 1.1437, test_f1: 0.4231
 epoch: 1, train_loss: 1.1694, test_loss: 1.0865, test_f1: 0.4544
 epoch: 2, train_loss: 1.1286, test_loss: 1.0298, test_f1: 0.4740
 epoch: 3, train_loss: 1.0971, test_loss: 1.0187, test_f1: 0.4989
 epoch: 4, train_loss: 1.0679, test_loss: 1.0005, test_f1: 0.4731
 epoch: 5, train_loss: 1.0374, test_loss: 0.9759, test_f1: 0.5061
 epoch: 6, train_loss: 1.0239, test_loss: 1.0670, test_f1: 0.4159
 epoch: 7, train_loss: 1.0144, test_loss: 0.9512, test_f1: 0.4826
 epoch: 8, train_loss: 0.9932, test_loss: 0.9233, test_f1: 0.5251
 epoch: 9, train_loss: 0.9722, test_loss: 0.9399, test_f1: 0.4838
 epoch: 10, train_loss: 0.9710, test_loss: 0.9559, test_f1: 0.5161
 epoch: 11, train_loss: 0.9591, test_loss: 1.0280, test_f1: 0.4837
 epoch: 12, train_loss: 0.9323, test_loss: 0.9250, test_f1: 0.5163
 epoch: 13, train_loss: 0.9332, test_loss: 1.0484, test_f1: 0.4794
 epoch: 14, train_loss: 0.9585, test_loss: 0.9376, test_f1: 0.5428
 epoch: 15, train_loss: 0.9381, test_loss: 1.0556, test_f1: 0.4664
 epoch: 16, train_loss: 0.9291, test_loss: 0.9331, test_f1: 0.5263
 epoch: 17, train_loss: 0.9142, test_loss: 0.9439, test_f1: 0.5030
 epoch: 18, train_loss: 0.8958, test_loss: 0.9812, test_f1: 0.5129
 epoch: 19, train_loss: 0.9060, test_loss: 0.9774, test_f1: 0.5502
 epoch: 20, train_loss: 0.8761, test_loss: 0.9919, test_f1: 0.5232
 epoch: 21, train_loss: 0.9028, test_loss: 1.0149, test_f1: 0.5283
 epoch: 22, train_loss: 0.8775, test_loss: 0.9685, test_f1: 0.5383
 epoch: 23, train_loss: 0.8704, test_loss: 0.9419, test_f1: 0.5284
 epoch: 24, train_loss: 0.8583, test_loss: 0.9597, test_f1: 0.5328
 epoch: 25, train_loss: 0.8565, test_loss: 0.9666, test_f1: 0.5021
 epoch: 26, train_loss: 0.8498, test_loss: 1.0030, test_f1: 0.5045
 epoch: 27, train_loss: 0.8470, test_loss: 0.9997, test_f1: 0.5242
 epoch: 28, train_loss: 0.8310, test_loss: 0.9547, test_f1: 0.5407
 epoch: 29, train_loss: 0.8315, test_loss: 0.9634, test_f1: 0.5381
 epoch: 30, train_loss: 0.8107, test_loss: 1.1608, test_f1: 0.4725
 epoch: 31, train_loss: 0.8889, test_loss: 0.9784, test_f1: 0.5260
 epoch: 32, train_loss: 0.8503, test_loss: 0.9678, test_f1: 0.5204
 epoch: 33, train_loss: 0.8362, test_loss: 1.0283, test_f1: 0.5432
 epoch: 34, train_loss: 0.8349, test_loss: 0.9979, test_f1: 0.5233
 epoch: 35, train_loss: 0.8188, test_loss: 0.9534, test_f1: 0.5235
 epoch: 36, train_loss: 0.8026, test_loss: 1.0068, test_f1: 0.5059
 epoch: 37, train_loss: 0.8220, test_loss: 0.9880, test_f1: 0.5172
 epoch: 38, train_loss: 0.8075, test_loss: 1.0039, test_f1: 0.5323
 epoch: 39, train_loss: 0.7905, test_loss: 1.0187, test_f1: 0.5311
 epoch: 40, train_loss: 0.7819, test_loss: 1.0152, test_f1: 0.5419
 epoch: 41, train_loss: 0.7764, test_loss: 1.0707, test_f1: 0.5462
 epoch: 42, train_loss: 0.7742, test_loss: 0.9932, test_f1: 0.5699
 epoch: 43, train_loss: 0.7724, test_loss: 1.1073, test_f1: 0.5158
 epoch: 44, train_loss: 0.7579, test_loss: 1.0771, test_f1: 0.5437
 epoch: 45, train_loss: 0.7661, test_loss: 1.0760, test_f1: 0.5393
 epoch: 46, train_loss: 0.7585, test_loss: 1.0765, test_f1: 0.5488
 epoch: 47, train_loss: 0.7274, test_loss: 1.1011, test_f1: 0.5342
 epoch: 48, train_loss: 0.7339, test_loss: 1.1307, test_f1: 0.5108
 epoch: 49, train_loss: 0.7154, test_loss: 1.1459, test_f1: 0.5389
 epoch: 50, train_loss: 0.7462, test_loss: 1.0817, test_f1: 0.5372
 epoch: 51, train_loss: 0.6998, test_loss: 1.0721, test_f1: 0.5655
 epoch: 52, train_loss: 0.7062, test_loss: 1.2206, test_f1: 0.5298
 epoch: 53, train_loss: 0.6775, test_loss: 1.2372, test_f1: 0.5295
 epoch: 54, train_loss: 0.6674, test_loss: 1.1481, test_f1: 0.5425
 epoch: 55, train_loss: 0.6617, test_loss: 1.1334, test_f1: 0.5634
 epoch: 56, train_loss: 0.6803, test_loss: 1.1517, test_f1: 0.5387
 epoch: 57, train_loss: 0.6483, test_loss: 1.2399, test_f1: 0.5199
 epoch: 58, train_loss: 0.6680, test_loss: 1.2096, test_f1: 0.5502
 epoch: 59, train_loss: 0.6559, test_loss: 1.1942, test_f1: 0.5132
 epoch: 60, train_loss: 0.6467, test_loss: 1.2008, test_f1: 0.5220
 epoch: 61, train_loss: 0.6480, test_loss: 1.1690, test_f1: 0.5302
 epoch: 62, train_loss: 0.6385, test_loss: 1.2267, test_f1: 0.5408
 epoch: 63, train_loss: 0.6371, test_loss: 1.3120, test_f1: 0.5275
 epoch: 64, train_loss: 0.6229, test_loss: 1.2412, test_f1: 0.5397
 epoch: 65, train_loss: 0.6278, test_loss: 1.2692, test_f1: 0.5510
 epoch: 66, train_loss: 0.6362, test_loss: 1.2893, test_f1: 0.5431
 epoch: 67, train_loss: 0.6337, test_loss: 1.2393, test_f1: 0.5279
 epoch: 68, train_loss: 0.6313, test_loss: 1.2058, test_f1: 0.5415
 epoch: 69, train_loss: 0.6181, test_loss: 1.2221, test_f1: 0.5386
 epoch: 70, train_loss: 0.6038, test_loss: 1.2552, test_f1: 0.5454
 epoch: 71, train_loss: 0.6264, test_loss: 1.2287, test_f1: 0.5406
 epoch: 72, train_loss: 0.6282, test_loss: 1.2788, test_f1: 0.5299
 epoch: 73, train_loss: 0.6210, test_loss: 1.2380, test_f1: 0.5624
 epoch: 74, train_loss: 0.6034, test_loss: 1.1819, test_f1: 0.5557
 epoch: 75, train_loss: 0.6021, test_loss: 1.2318, test_f1: 0.5494
 epoch: 76, train_loss: 0.6310, test_loss: 1.2647, test_f1: 0.5444
 epoch: 77, train_loss: 0.6101, test_loss: 1.2630, test_f1: 0.5345
 epoch: 78, train_loss: 0.6159, test_loss: 1.2913, test_f1: 0.5479
 epoch: 79, train_loss: 0.5994, test_loss: 1.3490, test_f1: 0.5385
 epoch: 80, train_loss: 0.5887, test_loss: 1.2682, test_f1: 0.5599
 epoch: 81, train_loss: 0.5814, test_loss: 1.2374, test_f1: 0.5499
 epoch: 82, train_loss: 0.6175, test_loss: 1.4636, test_f1: 0.5364
 epoch: 83, train_loss: 0.6027, test_loss: 1.2629, test_f1: 0.5450
 epoch: 84, train_loss: 0.5816, test_loss: 1.4513, test_f1: 0.5331
 epoch: 85, train_loss: 0.5811, test_loss: 1.3359, test_f1: 0.5408
 epoch: 86, train_loss: 0.5867, test_loss: 1.3402, test_f1: 0.5160
 epoch: 87, train_loss: 0.5790, test_loss: 1.2961, test_f1: 0.5324
 epoch: 88, train_loss: 0.6355, test_loss: 1.2975, test_f1: 0.5418
 epoch: 89, train_loss: 0.6106, test_loss: 1.3732, test_f1: 0.5418
 epoch: 90, train_loss: 0.5815, test_loss: 1.3094, test_f1: 0.5673
 epoch: 91, train_loss: 0.5747, test_loss: 1.3741, test_f1: 0.5271
 epoch: 92, train_loss: 0.5603, test_loss: 1.3210, test_f1: 0.5171
 epoch: 93, train_loss: 0.5570, test_loss: 1.3224, test_f1: 0.5296
 epoch: 94, train_loss: 0.5719, test_loss: 1.2862, test_f1: 0.5368
 epoch: 95, train_loss: 0.5616, test_loss: 1.3194, test_f1: 0.5402
 epoch: 96, train_loss: 0.5578, test_loss: 1.4005, test_f1: 0.5287
 epoch: 97, train_loss: 0.5254, test_loss: 1.3367, test_f1: 0.5408
 epoch: 98, train_loss: 0.5598, test_loss: 1.3134, test_f1: 0.5465
 epoch: 99, train_loss: 0.5524, test_loss: 1.3544, test_f1: 0.5518
##################ITERATION #8 ****************************************
 epoch: 0, train_loss: 1.3189, test_loss: 1.1835, test_f1: 0.3822
 epoch: 1, train_loss: 1.1960, test_loss: 1.1282, test_f1: 0.3999
 epoch: 2, train_loss: 1.1537, test_loss: 1.0837, test_f1: 0.4522
 epoch: 3, train_loss: 1.1115, test_loss: 1.0381, test_f1: 0.4572
 epoch: 4, train_loss: 1.0739, test_loss: 1.0037, test_f1: 0.4538
 epoch: 5, train_loss: 1.0496, test_loss: 1.0463, test_f1: 0.4491
 epoch: 6, train_loss: 1.0359, test_loss: 0.9573, test_f1: 0.4832
 epoch: 7, train_loss: 1.0108, test_loss: 0.9630, test_f1: 0.4650
 epoch: 8, train_loss: 0.9896, test_loss: 1.0120, test_f1: 0.4592
 epoch: 9, train_loss: 0.9757, test_loss: 0.9600, test_f1: 0.4950
 epoch: 10, train_loss: 0.9847, test_loss: 0.9900, test_f1: 0.4684
 epoch: 11, train_loss: 0.9850, test_loss: 0.9281, test_f1: 0.5090
 epoch: 12, train_loss: 0.9554, test_loss: 0.9872, test_f1: 0.4725
 epoch: 13, train_loss: 0.9466, test_loss: 0.9469, test_f1: 0.5160
 epoch: 14, train_loss: 0.9243, test_loss: 0.9115, test_f1: 0.4925
 epoch: 15, train_loss: 0.9050, test_loss: 0.9478, test_f1: 0.5004
 epoch: 16, train_loss: 0.9047, test_loss: 1.0148, test_f1: 0.4990
 epoch: 17, train_loss: 0.9211, test_loss: 0.9252, test_f1: 0.5255
 epoch: 18, train_loss: 0.9008, test_loss: 1.0215, test_f1: 0.5026
 epoch: 19, train_loss: 0.8839, test_loss: 0.9538, test_f1: 0.5377
 epoch: 20, train_loss: 0.8768, test_loss: 1.0380, test_f1: 0.5004
 epoch: 21, train_loss: 0.8737, test_loss: 0.9602, test_f1: 0.5089
 epoch: 22, train_loss: 0.8573, test_loss: 0.9840, test_f1: 0.5557
 epoch: 23, train_loss: 0.8572, test_loss: 0.9419, test_f1: 0.5386
 epoch: 24, train_loss: 0.8813, test_loss: 1.0550, test_f1: 0.4931
 epoch: 25, train_loss: 0.8625, test_loss: 1.0111, test_f1: 0.5274
 epoch: 26, train_loss: 0.8633, test_loss: 1.0111, test_f1: 0.5468
 epoch: 27, train_loss: 0.8453, test_loss: 0.9933, test_f1: 0.5598
 epoch: 28, train_loss: 0.8492, test_loss: 1.0340, test_f1: 0.5435
 epoch: 29, train_loss: 0.8418, test_loss: 1.0497, test_f1: 0.5115
 epoch: 30, train_loss: 0.8243, test_loss: 1.0477, test_f1: 0.5518
 epoch: 31, train_loss: 0.8109, test_loss: 1.0271, test_f1: 0.5213
 epoch: 32, train_loss: 0.8251, test_loss: 1.0445, test_f1: 0.5415
 epoch: 33, train_loss: 0.7859, test_loss: 1.0164, test_f1: 0.5556
 epoch: 34, train_loss: 0.7883, test_loss: 0.9879, test_f1: 0.5587
 epoch: 35, train_loss: 0.7858, test_loss: 1.0082, test_f1: 0.5106
 epoch: 36, train_loss: 0.7947, test_loss: 1.0600, test_f1: 0.5308
 epoch: 37, train_loss: 0.7755, test_loss: 1.0373, test_f1: 0.5445
 epoch: 38, train_loss: 0.7806, test_loss: 1.0413, test_f1: 0.5500
 epoch: 39, train_loss: 0.7872, test_loss: 1.0295, test_f1: 0.5346
 epoch: 40, train_loss: 0.7698, test_loss: 1.0633, test_f1: 0.5431
 epoch: 41, train_loss: 0.7513, test_loss: 1.1207, test_f1: 0.5371
 epoch: 42, train_loss: 0.7871, test_loss: 1.0578, test_f1: 0.5361
 epoch: 43, train_loss: 0.7413, test_loss: 1.0688, test_f1: 0.5076
 epoch: 44, train_loss: 0.7653, test_loss: 1.0909, test_f1: 0.5436
 epoch: 45, train_loss: 0.7330, test_loss: 1.0352, test_f1: 0.5269
 epoch: 46, train_loss: 0.8408, test_loss: 0.9908, test_f1: 0.5232
 epoch: 47, train_loss: 0.7789, test_loss: 1.0178, test_f1: 0.5441
 epoch: 48, train_loss: 0.7399, test_loss: 1.0356, test_f1: 0.5565
 epoch: 49, train_loss: 0.7305, test_loss: 1.0723, test_f1: 0.5606
 epoch: 50, train_loss: 0.7337, test_loss: 1.0255, test_f1: 0.5368
 epoch: 51, train_loss: 0.6976, test_loss: 1.0831, test_f1: 0.5531
 epoch: 52, train_loss: 0.7242, test_loss: 1.0711, test_f1: 0.5515
 epoch: 53, train_loss: 0.6940, test_loss: 1.0997, test_f1: 0.5399
 epoch: 54, train_loss: 0.6796, test_loss: 1.0432, test_f1: 0.5690
 epoch: 55, train_loss: 0.6815, test_loss: 1.0601, test_f1: 0.5472
 epoch: 56, train_loss: 0.6720, test_loss: 1.0348, test_f1: 0.5559
 epoch: 57, train_loss: 0.6712, test_loss: 1.0443, test_f1: 0.5657
 epoch: 58, train_loss: 0.6654, test_loss: 1.1398, test_f1: 0.5259
 epoch: 59, train_loss: 0.6521, test_loss: 1.0653, test_f1: 0.5625
 epoch: 60, train_loss: 0.6382, test_loss: 1.1243, test_f1: 0.5851
 epoch: 61, train_loss: 0.6589, test_loss: 1.0772, test_f1: 0.5532
 epoch: 62, train_loss: 0.6536, test_loss: 1.0534, test_f1: 0.5863
 epoch: 63, train_loss: 0.6374, test_loss: 1.1337, test_f1: 0.5529
 epoch: 64, train_loss: 0.6452, test_loss: 1.0980, test_f1: 0.5653
 epoch: 65, train_loss: 0.6392, test_loss: 1.0881, test_f1: 0.5481
 epoch: 66, train_loss: 0.6277, test_loss: 1.1051, test_f1: 0.5611
 epoch: 67, train_loss: 0.6350, test_loss: 1.1110, test_f1: 0.5485
 epoch: 68, train_loss: 0.6139, test_loss: 1.1898, test_f1: 0.5483
 epoch: 69, train_loss: 0.6362, test_loss: 1.1425, test_f1: 0.5628
 epoch: 70, train_loss: 0.6324, test_loss: 1.1487, test_f1: 0.5519
 epoch: 71, train_loss: 0.6295, test_loss: 1.1520, test_f1: 0.5744
 epoch: 72, train_loss: 0.5942, test_loss: 1.2561, test_f1: 0.5611
 epoch: 73, train_loss: 0.6021, test_loss: 1.1248, test_f1: 0.5699
 epoch: 74, train_loss: 0.6126, test_loss: 1.2460, test_f1: 0.5469
 epoch: 75, train_loss: 0.6048, test_loss: 1.1454, test_f1: 0.5707
 epoch: 76, train_loss: 0.6017, test_loss: 1.1211, test_f1: 0.5541
 epoch: 77, train_loss: 0.6168, test_loss: 1.1604, test_f1: 0.5884
 epoch: 78, train_loss: 0.5941, test_loss: 1.1384, test_f1: 0.5624
 epoch: 79, train_loss: 0.5887, test_loss: 1.1545, test_f1: 0.5906
 epoch: 80, train_loss: 0.5848, test_loss: 1.2073, test_f1: 0.5788
 epoch: 81, train_loss: 0.5868, test_loss: 1.3213, test_f1: 0.5397
 epoch: 82, train_loss: 0.5762, test_loss: 1.1573, test_f1: 0.5757
 epoch: 83, train_loss: 0.5905, test_loss: 1.2199, test_f1: 0.5858
 epoch: 84, train_loss: 0.5821, test_loss: 1.1956, test_f1: 0.5645
 epoch: 85, train_loss: 0.5839, test_loss: 1.2489, test_f1: 0.5221
 epoch: 86, train_loss: 0.5883, test_loss: 1.1895, test_f1: 0.5615
 epoch: 87, train_loss: 0.6058, test_loss: 1.1509, test_f1: 0.5758
 epoch: 88, train_loss: 0.5690, test_loss: 1.1622, test_f1: 0.5836
 epoch: 89, train_loss: 0.5851, test_loss: 1.2054, test_f1: 0.5831
 epoch: 90, train_loss: 0.5719, test_loss: 1.1298, test_f1: 0.5725
 epoch: 91, train_loss: 0.5696, test_loss: 1.2419, test_f1: 0.5485
 epoch: 92, train_loss: 0.5620, test_loss: 1.1579, test_f1: 0.5657
 epoch: 93, train_loss: 0.5534, test_loss: 1.2304, test_f1: 0.5627
 epoch: 94, train_loss: 0.5692, test_loss: 1.1402, test_f1: 0.5722
 epoch: 95, train_loss: 0.5811, test_loss: 1.1593, test_f1: 0.5831
 epoch: 96, train_loss: 0.5629, test_loss: 1.1380, test_f1: 0.5568
 epoch: 97, train_loss: 0.5541, test_loss: 1.1666, test_f1: 0.5621
 epoch: 98, train_loss: 0.5478, test_loss: 1.1697, test_f1: 0.5594
 epoch: 99, train_loss: 0.5413, test_loss: 1.2460, test_f1: 0.5614
##################ITERATION #9 ****************************************
 epoch: 0, train_loss: 1.3063, test_loss: 1.1557, test_f1: 0.3777
 epoch: 1, train_loss: 1.1618, test_loss: 1.0567, test_f1: 0.4723
 epoch: 2, train_loss: 1.1148, test_loss: 1.0105, test_f1: 0.4663
 epoch: 3, train_loss: 1.0833, test_loss: 1.0072, test_f1: 0.4888
 epoch: 4, train_loss: 1.0510, test_loss: 0.9689, test_f1: 0.4800
 epoch: 5, train_loss: 1.0310, test_loss: 0.9337, test_f1: 0.5010
 epoch: 6, train_loss: 0.9932, test_loss: 0.9677, test_f1: 0.5237
 epoch: 7, train_loss: 0.9886, test_loss: 0.9776, test_f1: 0.4946
 epoch: 8, train_loss: 0.9616, test_loss: 0.9897, test_f1: 0.4784
 epoch: 9, train_loss: 0.9524, test_loss: 0.9634, test_f1: 0.4782
 epoch: 10, train_loss: 0.9415, test_loss: 0.9718, test_f1: 0.4966
 epoch: 11, train_loss: 0.9279, test_loss: 0.9759, test_f1: 0.4934
 epoch: 12, train_loss: 0.9166, test_loss: 0.9467, test_f1: 0.5176
 epoch: 13, train_loss: 0.9289, test_loss: 0.9679, test_f1: 0.5089
 epoch: 14, train_loss: 0.8904, test_loss: 1.0198, test_f1: 0.4924
 epoch: 15, train_loss: 0.8904, test_loss: 0.9848, test_f1: 0.5109
 epoch: 16, train_loss: 0.8906, test_loss: 0.9174, test_f1: 0.5242
 epoch: 17, train_loss: 0.8944, test_loss: 1.0222, test_f1: 0.4971
 epoch: 18, train_loss: 0.8768, test_loss: 0.9401, test_f1: 0.5289
 epoch: 19, train_loss: 0.8703, test_loss: 0.9587, test_f1: 0.4963
 epoch: 20, train_loss: 0.8468, test_loss: 0.9815, test_f1: 0.5396
 epoch: 21, train_loss: 0.8612, test_loss: 0.9825, test_f1: 0.5334
 epoch: 22, train_loss: 0.8467, test_loss: 0.9729, test_f1: 0.5504
 epoch: 23, train_loss: 0.8394, test_loss: 0.9612, test_f1: 0.5260
 epoch: 24, train_loss: 0.8293, test_loss: 1.0068, test_f1: 0.4952
 epoch: 25, train_loss: 0.8388, test_loss: 0.9807, test_f1: 0.5542
 epoch: 26, train_loss: 0.8322, test_loss: 0.9857, test_f1: 0.5505
 epoch: 27, train_loss: 0.8110, test_loss: 0.9788, test_f1: 0.5387
 epoch: 28, train_loss: 0.7957, test_loss: 1.0103, test_f1: 0.5467
 epoch: 29, train_loss: 0.7873, test_loss: 1.1559, test_f1: 0.4766
 epoch: 30, train_loss: 0.8212, test_loss: 1.0118, test_f1: 0.5269
 epoch: 31, train_loss: 0.8050, test_loss: 0.9222, test_f1: 0.5446
 epoch: 32, train_loss: 0.7972, test_loss: 1.0734, test_f1: 0.5436
 epoch: 33, train_loss: 0.8063, test_loss: 0.9800, test_f1: 0.5261
 epoch: 34, train_loss: 0.7915, test_loss: 1.0073, test_f1: 0.5194
 epoch: 35, train_loss: 0.8236, test_loss: 1.0266, test_f1: 0.5356
 epoch: 36, train_loss: 0.7987, test_loss: 0.9691, test_f1: 0.5415
 epoch: 37, train_loss: 0.7839, test_loss: 0.9939, test_f1: 0.5544
 epoch: 38, train_loss: 0.7723, test_loss: 0.9854, test_f1: 0.5213
 epoch: 39, train_loss: 0.7755, test_loss: 1.0487, test_f1: 0.5173
 epoch: 40, train_loss: 0.7553, test_loss: 1.0329, test_f1: 0.5302
 epoch: 41, train_loss: 0.7702, test_loss: 1.0089, test_f1: 0.5393
 epoch: 42, train_loss: 0.7536, test_loss: 1.0106, test_f1: 0.5490
 epoch: 43, train_loss: 0.7456, test_loss: 1.0038, test_f1: 0.5691
 epoch: 44, train_loss: 0.7574, test_loss: 1.0178, test_f1: 0.5646
 epoch: 45, train_loss: 0.7331, test_loss: 0.9906, test_f1: 0.5293
 epoch: 46, train_loss: 0.7251, test_loss: 1.0380, test_f1: 0.5466
 epoch: 47, train_loss: 0.7361, test_loss: 1.0271, test_f1: 0.5554
 epoch: 48, train_loss: 0.7269, test_loss: 1.0009, test_f1: 0.5451
 epoch: 49, train_loss: 0.7140, test_loss: 0.9751, test_f1: 0.5279
 epoch: 50, train_loss: 0.7214, test_loss: 1.0462, test_f1: 0.5504
 epoch: 51, train_loss: 0.6904, test_loss: 1.0565, test_f1: 0.5303
 epoch: 52, train_loss: 0.6766, test_loss: 1.1010, test_f1: 0.5587
 epoch: 53, train_loss: 0.6697, test_loss: 1.0902, test_f1: 0.5430
 epoch: 54, train_loss: 0.6539, test_loss: 1.1199, test_f1: 0.5541
 epoch: 55, train_loss: 0.6476, test_loss: 1.0485, test_f1: 0.5558
 epoch: 56, train_loss: 0.6687, test_loss: 1.0487, test_f1: 0.5543
 epoch: 57, train_loss: 0.6418, test_loss: 1.0624, test_f1: 0.5628
 epoch: 58, train_loss: 0.6383, test_loss: 1.1655, test_f1: 0.5441
 epoch: 59, train_loss: 0.6395, test_loss: 1.1482, test_f1: 0.5782
 epoch: 60, train_loss: 0.6363, test_loss: 1.1156, test_f1: 0.5711
 epoch: 61, train_loss: 0.6331, test_loss: 1.1431, test_f1: 0.5847
 epoch: 62, train_loss: 0.6404, test_loss: 1.0900, test_f1: 0.5758
 epoch: 63, train_loss: 0.6263, test_loss: 1.0877, test_f1: 0.5771
 epoch: 64, train_loss: 0.6253, test_loss: 1.0762, test_f1: 0.5704
 epoch: 65, train_loss: 0.6024, test_loss: 1.0875, test_f1: 0.5747
 epoch: 66, train_loss: 0.6048, test_loss: 1.1461, test_f1: 0.5602
 epoch: 67, train_loss: 0.6037, test_loss: 1.0970, test_f1: 0.5708
 epoch: 68, train_loss: 0.6117, test_loss: 1.0600, test_f1: 0.5970
 epoch: 69, train_loss: 0.6058, test_loss: 1.1097, test_f1: 0.5717
 epoch: 70, train_loss: 0.5986, test_loss: 1.0929, test_f1: 0.5939
 epoch: 71, train_loss: 0.6082, test_loss: 1.0996, test_f1: 0.5844
 epoch: 72, train_loss: 0.6017, test_loss: 1.1130, test_f1: 0.5840
 epoch: 73, train_loss: 0.6031, test_loss: 1.1117, test_f1: 0.5735
 epoch: 74, train_loss: 0.5779, test_loss: 1.1817, test_f1: 0.5538
 epoch: 75, train_loss: 0.5923, test_loss: 1.0723, test_f1: 0.6177
 epoch: 76, train_loss: 0.5976, test_loss: 1.1034, test_f1: 0.5666
 epoch: 77, train_loss: 0.5981, test_loss: 1.1132, test_f1: 0.5806
 epoch: 78, train_loss: 0.5754, test_loss: 1.0689, test_f1: 0.5885
 epoch: 79, train_loss: 0.5802, test_loss: 1.0451, test_f1: 0.5964
 epoch: 80, train_loss: 0.5813, test_loss: 1.1057, test_f1: 0.6119
 epoch: 81, train_loss: 0.5738, test_loss: 1.0903, test_f1: 0.5779
 epoch: 82, train_loss: 0.5769, test_loss: 1.1037, test_f1: 0.6205
 epoch: 83, train_loss: 0.5815, test_loss: 1.1270, test_f1: 0.5849
 epoch: 84, train_loss: 0.5543, test_loss: 1.1018, test_f1: 0.5898
 epoch: 85, train_loss: 0.5484, test_loss: 1.1343, test_f1: 0.5695
 epoch: 86, train_loss: 0.5987, test_loss: 1.1553, test_f1: 0.5803
 epoch: 87, train_loss: 0.5760, test_loss: 1.0978, test_f1: 0.6133
 epoch: 88, train_loss: 0.5527, test_loss: 1.0951, test_f1: 0.6192
 epoch: 89, train_loss: 0.5476, test_loss: 1.1736, test_f1: 0.5915
 epoch: 90, train_loss: 0.5568, test_loss: 1.1235, test_f1: 0.6112
 epoch: 91, train_loss: 0.5441, test_loss: 1.1426, test_f1: 0.6052
 epoch: 92, train_loss: 0.5285, test_loss: 1.1359, test_f1: 0.6147
 epoch: 93, train_loss: 0.5296, test_loss: 1.2540, test_f1: 0.5952
 epoch: 94, train_loss: 0.5458, test_loss: 1.2959, test_f1: 0.5702
 epoch: 95, train_loss: 0.5140, test_loss: 1.1503, test_f1: 0.6194
 epoch: 96, train_loss: 0.5528, test_loss: 1.1720, test_f1: 0.5927
 epoch: 97, train_loss: 0.5592, test_loss: 1.1297, test_f1: 0.6041
 epoch: 98, train_loss: 0.5519, test_loss: 1.0590, test_f1: 0.6065
 epoch: 99, train_loss: 0.5295, test_loss: 1.1615, test_f1: 0.6021

Training completed in 1137.54 seconds
Best F1: 0.6205 at epoch 82
Mean F1 across iterations: 0.5878  0.0147
========================FINAL RESULTS================================
FEGIN weighted F1: 0.6205  0.0147
python main.py --data ltspice_examples --representation component_component --model FEGIN --layers 4 --hiddens 64 --batch_size 32 --lr 0.001 --emb_size 128 --epochs 100 --save_appendix component_component_L4_H64_BS32_LR0.001_E128 --no_val
-----



STDERR:
  File "main.py", line 370, in <module>
    main()
  File "main.py", line 254, in main
    dataset = dataset_class(
  File "/home/philip/projects/ltspice_examples_code_repo/Circuit-Completion-Using-GNNs/component_classification_with_link_prediction_head/evaluation/FEGIN/kernel/circuit_datasets.py", line 15, in __init__
    self.data, self.slices = torch.load(self.processed_paths[0])
  File "/home/philip/.local/lib/python3.8/site-packages/torch/serialization.py", line 1040, in load
    warnings.warn(
  File "/usr/lib/python3.8/warnings.py", line 109, in _showwarnmsg
    sw(msg.message, msg.category, msg.filename, msg.lineno,
  File "main.py", line 47, in warn_with_traceback
    traceback.print_stack(file=log)
/home/philip/projects/ltspice_examples_code_repo/Circuit-Completion-Using-GNNs/component_classification_with_link_prediction_head/evaluation/FEGIN/kernel/circuit_datasets.py:15: FutureWarning: You are using `torch.load` with `weights_only=False` (the current default value), which uses the default pickle module implicitly. It is possible to construct malicious pickle data which will execute arbitrary code during unpickling (See https://github.com/pytorch/pytorch/blob/main/SECURITY.md#untrusted-models for more details). In a future release, the default value for `weights_only` will be flipped to `True`. This limits the functions that could be executed during unpickling. Arbitrary objects will no longer be allowed to be loaded via this mode unless they are explicitly allowlisted by the user via `torch.serialization.add_safe_globals`. We recommend you start setting `weights_only=True` for any use case where you don't have full control of the loaded file. Please open an issue on GitHub for any issues related to this experimental feature.
  self.data, self.slices = torch.load(self.processed_paths[0])
