STDOUT:
Results will be saved in /home/philip/projects/ltspice_examples_code_repo/Circuit-Completion-Using-GNNs/component_classification_with_link_prediction_head/evaluation/FEGIN/results/model_FEGIN_dataset_ltspice_examples
Command line input: python main.py --data ltspice_examples --representation component_pin --model FEGIN --layers 3 --hiddens 16 --batch_size 128 --lr 0.01 --emb_size 250 --epochs 100 --save_appendix component_pin_L3_H16_BS128_LR0.01_E250 --no_val
 is saved.
-----
ltspice_examples - FEGIN
Using 3 layers, 16 hidden units, h = 2
Loading component_pin representation dataset
ENTERED
Training FEGIN on component_pin representation
Train: 3560, Test: 848
##################ITERATION #0 ****************************************
 epoch: 0, train_loss: 1.2615, test_loss: 1.1853, test_f1: 0.2260
 epoch: 1, train_loss: 1.1231, test_loss: 1.1023, test_f1: 0.3692
 epoch: 2, train_loss: 1.0356, test_loss: 1.0161, test_f1: 0.4293
 epoch: 3, train_loss: 1.0153, test_loss: 1.0085, test_f1: 0.4529
 epoch: 4, train_loss: 1.0143, test_loss: 1.1936, test_f1: 0.3795
 epoch: 5, train_loss: 0.9885, test_loss: 1.0133, test_f1: 0.4759
 epoch: 6, train_loss: 0.9676, test_loss: 0.9512, test_f1: 0.4739
 epoch: 7, train_loss: 0.9523, test_loss: 1.1217, test_f1: 0.3665
 epoch: 8, train_loss: 0.9263, test_loss: 0.9792, test_f1: 0.4677
 epoch: 9, train_loss: 0.9307, test_loss: 1.5637, test_f1: 0.3756
 epoch: 10, train_loss: 0.9305, test_loss: 0.9286, test_f1: 0.4964
 epoch: 11, train_loss: 0.8976, test_loss: 0.9116, test_f1: 0.5061
 epoch: 12, train_loss: 0.8912, test_loss: 0.9117, test_f1: 0.5127
 epoch: 13, train_loss: 0.8895, test_loss: 0.8960, test_f1: 0.5095
 epoch: 14, train_loss: 0.8847, test_loss: 0.9320, test_f1: 0.5194
 epoch: 15, train_loss: 0.8758, test_loss: 0.9438, test_f1: 0.4698
 epoch: 16, train_loss: 0.8641, test_loss: 1.1247, test_f1: 0.4577
 epoch: 17, train_loss: 0.8547, test_loss: 0.8863, test_f1: 0.5205
 epoch: 18, train_loss: 0.8649, test_loss: 0.8630, test_f1: 0.5195
 epoch: 19, train_loss: 0.8367, test_loss: 0.9387, test_f1: 0.5014
 epoch: 20, train_loss: 0.8574, test_loss: 0.8977, test_f1: 0.4995
 epoch: 21, train_loss: 0.8376, test_loss: 0.8521, test_f1: 0.5418
 epoch: 22, train_loss: 0.8244, test_loss: 0.9130, test_f1: 0.4918
 epoch: 23, train_loss: 0.8309, test_loss: 0.8775, test_f1: 0.5242
 epoch: 24, train_loss: 0.8158, test_loss: 0.9311, test_f1: 0.5114
 epoch: 25, train_loss: 0.8085, test_loss: 0.8448, test_f1: 0.5430
 epoch: 26, train_loss: 0.8131, test_loss: 1.0531, test_f1: 0.5027
 epoch: 27, train_loss: 0.8266, test_loss: 0.8565, test_f1: 0.5482
 epoch: 28, train_loss: 0.8056, test_loss: 0.8427, test_f1: 0.5486
 epoch: 29, train_loss: 0.8166, test_loss: 0.9028, test_f1: 0.5087
 epoch: 30, train_loss: 0.8113, test_loss: 0.8469, test_f1: 0.5383
 epoch: 31, train_loss: 0.7984, test_loss: 0.8396, test_f1: 0.5379
 epoch: 32, train_loss: 0.7836, test_loss: 0.8593, test_f1: 0.5297
 epoch: 33, train_loss: 0.8026, test_loss: 0.8741, test_f1: 0.5336
 epoch: 34, train_loss: 0.7852, test_loss: 0.8925, test_f1: 0.5212
 epoch: 35, train_loss: 0.7916, test_loss: 1.0697, test_f1: 0.4822
 epoch: 36, train_loss: 0.7925, test_loss: 0.8320, test_f1: 0.5461
 epoch: 37, train_loss: 0.7925, test_loss: 0.9061, test_f1: 0.5100
 epoch: 38, train_loss: 0.7881, test_loss: 0.8136, test_f1: 0.5593
 epoch: 39, train_loss: 0.7724, test_loss: 0.8372, test_f1: 0.5523
 epoch: 40, train_loss: 0.7739, test_loss: 0.8407, test_f1: 0.5228
 epoch: 41, train_loss: 0.7702, test_loss: 0.9525, test_f1: 0.5194
 epoch: 42, train_loss: 0.7827, test_loss: 1.0653, test_f1: 0.5125
 epoch: 43, train_loss: 0.7773, test_loss: 0.7917, test_f1: 0.5822
 epoch: 44, train_loss: 0.7708, test_loss: 0.9122, test_f1: 0.5285
 epoch: 45, train_loss: 0.7662, test_loss: 0.8652, test_f1: 0.6308
 epoch: 46, train_loss: 0.7511, test_loss: 0.8463, test_f1: 0.6092
 epoch: 47, train_loss: 0.7366, test_loss: 0.8024, test_f1: 0.5509
 epoch: 48, train_loss: 0.7450, test_loss: 0.9390, test_f1: 0.5366
 epoch: 49, train_loss: 0.7492, test_loss: 0.8514, test_f1: 0.5406
 epoch: 50, train_loss: 0.7902, test_loss: 0.8551, test_f1: 0.5336
 epoch: 51, train_loss: 0.7611, test_loss: 0.8170, test_f1: 0.5659
 epoch: 52, train_loss: 0.7244, test_loss: 0.7922, test_f1: 0.5741
 epoch: 53, train_loss: 0.7146, test_loss: 0.7641, test_f1: 0.5753
 epoch: 54, train_loss: 0.7187, test_loss: 0.7687, test_f1: 0.5622
 epoch: 55, train_loss: 0.7029, test_loss: 0.7791, test_f1: 0.5699
 epoch: 56, train_loss: 0.7000, test_loss: 0.8649, test_f1: 0.5676
 epoch: 57, train_loss: 0.7086, test_loss: 0.8773, test_f1: 0.5499
 epoch: 58, train_loss: 0.7024, test_loss: 0.8049, test_f1: 0.5704
 epoch: 59, train_loss: 0.6939, test_loss: 0.8135, test_f1: 0.5611
 epoch: 60, train_loss: 0.7036, test_loss: 0.8538, test_f1: 0.5439
 epoch: 61, train_loss: 0.6985, test_loss: 0.8127, test_f1: 0.5612
 epoch: 62, train_loss: 0.7032, test_loss: 0.9054, test_f1: 0.5355
 epoch: 63, train_loss: 0.7046, test_loss: 0.8163, test_f1: 0.5494
 epoch: 64, train_loss: 0.6895, test_loss: 0.8002, test_f1: 0.5689
 epoch: 65, train_loss: 0.6950, test_loss: 0.7916, test_f1: 0.5658
 epoch: 66, train_loss: 0.6808, test_loss: 0.7708, test_f1: 0.5764
 epoch: 67, train_loss: 0.6944, test_loss: 0.8507, test_f1: 0.5472
 epoch: 68, train_loss: 0.7124, test_loss: 0.8222, test_f1: 0.5536
 epoch: 69, train_loss: 0.6798, test_loss: 0.7974, test_f1: 0.5680
 epoch: 70, train_loss: 0.6779, test_loss: 0.8383, test_f1: 0.5565
 epoch: 71, train_loss: 0.6824, test_loss: 0.8225, test_f1: 0.5737
 epoch: 72, train_loss: 0.6812, test_loss: 0.8356, test_f1: 0.5706
 epoch: 73, train_loss: 0.6744, test_loss: 0.8288, test_f1: 0.5691
 epoch: 74, train_loss: 0.6778, test_loss: 0.8577, test_f1: 0.5338
 epoch: 75, train_loss: 0.6754, test_loss: 0.8077, test_f1: 0.5701
 epoch: 76, train_loss: 0.6774, test_loss: 0.8379, test_f1: 0.5680
 epoch: 77, train_loss: 0.6727, test_loss: 0.8489, test_f1: 0.5557
 epoch: 78, train_loss: 0.6763, test_loss: 0.8142, test_f1: 0.6228
 epoch: 79, train_loss: 0.6680, test_loss: 0.8487, test_f1: 0.5580
 epoch: 80, train_loss: 0.6701, test_loss: 0.8382, test_f1: 0.5596
 epoch: 81, train_loss: 0.6601, test_loss: 0.8956, test_f1: 0.5335
 epoch: 82, train_loss: 0.6719, test_loss: 0.8326, test_f1: 0.5775
 epoch: 83, train_loss: 0.6746, test_loss: 0.8145, test_f1: 0.5609
 epoch: 84, train_loss: 0.6637, test_loss: 0.8065, test_f1: 0.5724
 epoch: 85, train_loss: 0.6626, test_loss: 0.8138, test_f1: 0.5866
 epoch: 86, train_loss: 0.6686, test_loss: 0.8155, test_f1: 0.5920
 epoch: 87, train_loss: 0.6729, test_loss: 0.8080, test_f1: 0.5622
 epoch: 88, train_loss: 0.6743, test_loss: 0.9191, test_f1: 0.5577
 epoch: 89, train_loss: 0.6736, test_loss: 0.8229, test_f1: 0.5750
 epoch: 90, train_loss: 0.6576, test_loss: 0.8326, test_f1: 0.5796
 epoch: 91, train_loss: 0.6470, test_loss: 0.8212, test_f1: 0.5785
 epoch: 92, train_loss: 0.6585, test_loss: 0.8864, test_f1: 0.5747
 epoch: 93, train_loss: 0.6510, test_loss: 0.8303, test_f1: 0.5617
 epoch: 94, train_loss: 0.6475, test_loss: 0.9099, test_f1: 0.5702
 epoch: 95, train_loss: 0.6583, test_loss: 0.8281, test_f1: 0.5718
 epoch: 96, train_loss: 0.6531, test_loss: 0.8524, test_f1: 0.5727
 epoch: 97, train_loss: 0.6481, test_loss: 0.8379, test_f1: 0.5965
 epoch: 98, train_loss: 0.6597, test_loss: 0.8347, test_f1: 0.5617
 epoch: 99, train_loss: 0.6600, test_loss: 0.8336, test_f1: 0.5499
##################ITERATION #1 ****************************************
 epoch: 0, train_loss: 1.1704, test_loss: 1.3206, test_f1: 0.2260
 epoch: 1, train_loss: 1.0577, test_loss: 1.1578, test_f1: 0.3146
 epoch: 2, train_loss: 1.0178, test_loss: 1.4017, test_f1: 0.2408
 epoch: 3, train_loss: 1.0172, test_loss: 0.9845, test_f1: 0.4505
 epoch: 4, train_loss: 1.0116, test_loss: 1.1011, test_f1: 0.4027
 epoch: 5, train_loss: 0.9854, test_loss: 0.9732, test_f1: 0.4533
 epoch: 6, train_loss: 0.9652, test_loss: 0.9670, test_f1: 0.4726
 epoch: 7, train_loss: 0.9519, test_loss: 1.0188, test_f1: 0.4738
 epoch: 8, train_loss: 0.9399, test_loss: 0.9101, test_f1: 0.4783
 epoch: 9, train_loss: 0.9093, test_loss: 0.9630, test_f1: 0.4809
 epoch: 10, train_loss: 0.9182, test_loss: 1.0112, test_f1: 0.4711
 epoch: 11, train_loss: 0.9027, test_loss: 1.1796, test_f1: 0.4252
 epoch: 12, train_loss: 0.8952, test_loss: 1.0986, test_f1: 0.4465
 epoch: 13, train_loss: 0.8942, test_loss: 0.9141, test_f1: 0.5059
 epoch: 14, train_loss: 0.8686, test_loss: 0.8443, test_f1: 0.5337
 epoch: 15, train_loss: 0.8639, test_loss: 0.9183, test_f1: 0.5011
 epoch: 16, train_loss: 0.8662, test_loss: 1.0764, test_f1: 0.4512
 epoch: 17, train_loss: 0.8502, test_loss: 0.9448, test_f1: 0.5076
 epoch: 18, train_loss: 0.8525, test_loss: 1.1546, test_f1: 0.4582
 epoch: 19, train_loss: 0.8340, test_loss: 0.8614, test_f1: 0.5402
 epoch: 20, train_loss: 0.8501, test_loss: 1.1249, test_f1: 0.4386
 epoch: 21, train_loss: 0.8376, test_loss: 0.9270, test_f1: 0.4900
 epoch: 22, train_loss: 0.8625, test_loss: 0.8909, test_f1: 0.4992
 epoch: 23, train_loss: 0.8645, test_loss: 0.9323, test_f1: 0.5306
 epoch: 24, train_loss: 0.8449, test_loss: 0.9428, test_f1: 0.4663
 epoch: 25, train_loss: 0.8297, test_loss: 0.9382, test_f1: 0.5379
 epoch: 26, train_loss: 0.8291, test_loss: 0.8365, test_f1: 0.5328
 epoch: 27, train_loss: 0.8129, test_loss: 0.8975, test_f1: 0.6115
 epoch: 28, train_loss: 0.8559, test_loss: 1.1913, test_f1: 0.4823
 epoch: 29, train_loss: 0.8437, test_loss: 0.8463, test_f1: 0.5153
 epoch: 30, train_loss: 0.8388, test_loss: 0.9350, test_f1: 0.5385
 epoch: 31, train_loss: 0.8304, test_loss: 0.8384, test_f1: 0.5279
 epoch: 32, train_loss: 0.8104, test_loss: 0.8886, test_f1: 0.5411
 epoch: 33, train_loss: 0.8256, test_loss: 0.9456, test_f1: 0.5432
 epoch: 34, train_loss: 0.8190, test_loss: 0.8938, test_f1: 0.5338
 epoch: 35, train_loss: 0.8234, test_loss: 0.8188, test_f1: 0.5442
 epoch: 36, train_loss: 0.8233, test_loss: 0.8999, test_f1: 0.5363
 epoch: 37, train_loss: 0.8160, test_loss: 0.9235, test_f1: 0.4933
 epoch: 38, train_loss: 0.7984, test_loss: 0.8650, test_f1: 0.5439
 epoch: 39, train_loss: 0.7935, test_loss: 0.8315, test_f1: 0.5418
 epoch: 40, train_loss: 0.8043, test_loss: 0.8841, test_f1: 0.5804
 epoch: 41, train_loss: 0.7920, test_loss: 0.8453, test_f1: 0.6293
 epoch: 42, train_loss: 0.8016, test_loss: 0.8718, test_f1: 0.5199
 epoch: 43, train_loss: 0.7767, test_loss: 0.8913, test_f1: 0.5215
 epoch: 44, train_loss: 0.8005, test_loss: 0.8691, test_f1: 0.5311
 epoch: 45, train_loss: 0.7890, test_loss: 0.8342, test_f1: 0.5478
 epoch: 46, train_loss: 0.7859, test_loss: 0.8977, test_f1: 0.5089
 epoch: 47, train_loss: 0.7863, test_loss: 0.8078, test_f1: 0.5740
 epoch: 48, train_loss: 0.7799, test_loss: 0.8161, test_f1: 0.5456
 epoch: 49, train_loss: 0.7762, test_loss: 0.8212, test_f1: 0.5607
 epoch: 50, train_loss: 0.7621, test_loss: 0.7871, test_f1: 0.5598
 epoch: 51, train_loss: 0.7576, test_loss: 0.8573, test_f1: 0.5684
 epoch: 52, train_loss: 0.7512, test_loss: 0.7539, test_f1: 0.5956
 epoch: 53, train_loss: 0.7411, test_loss: 0.7557, test_f1: 0.5740
 epoch: 54, train_loss: 0.7373, test_loss: 0.7977, test_f1: 0.5590
 epoch: 55, train_loss: 0.7452, test_loss: 0.7821, test_f1: 0.5874
 epoch: 56, train_loss: 0.7566, test_loss: 0.7746, test_f1: 0.5732
 epoch: 57, train_loss: 0.7223, test_loss: 0.8053, test_f1: 0.5842
 epoch: 58, train_loss: 0.7493, test_loss: 0.8146, test_f1: 0.5858
 epoch: 59, train_loss: 0.7480, test_loss: 0.7619, test_f1: 0.5817
 epoch: 60, train_loss: 0.7337, test_loss: 0.7940, test_f1: 0.6185
 epoch: 61, train_loss: 0.7225, test_loss: 0.7854, test_f1: 0.5636
 epoch: 62, train_loss: 0.7396, test_loss: 0.8036, test_f1: 0.5823
 epoch: 63, train_loss: 0.7156, test_loss: 0.7894, test_f1: 0.6022
 epoch: 64, train_loss: 0.7221, test_loss: 0.8299, test_f1: 0.5581
 epoch: 65, train_loss: 0.7153, test_loss: 0.8087, test_f1: 0.5817
 epoch: 66, train_loss: 0.7183, test_loss: 0.8187, test_f1: 0.5690
 epoch: 67, train_loss: 0.7349, test_loss: 0.8145, test_f1: 0.6216
 epoch: 68, train_loss: 0.7230, test_loss: 0.8027, test_f1: 0.5982
 epoch: 69, train_loss: 0.7153, test_loss: 0.8629, test_f1: 0.5668
 epoch: 70, train_loss: 0.7042, test_loss: 0.7562, test_f1: 0.6291
 epoch: 71, train_loss: 0.7166, test_loss: 0.8003, test_f1: 0.6021
 epoch: 72, train_loss: 0.7089, test_loss: 0.7805, test_f1: 0.5872
 epoch: 73, train_loss: 0.7154, test_loss: 0.8133, test_f1: 0.6252
 epoch: 74, train_loss: 0.7025, test_loss: 0.7725, test_f1: 0.6253
 epoch: 75, train_loss: 0.7028, test_loss: 0.7987, test_f1: 0.5858
 epoch: 76, train_loss: 0.7054, test_loss: 0.8777, test_f1: 0.5765
 epoch: 77, train_loss: 0.6993, test_loss: 0.7928, test_f1: 0.5703
 epoch: 78, train_loss: 0.7128, test_loss: 1.0041, test_f1: 0.5107
 epoch: 79, train_loss: 0.7006, test_loss: 0.8163, test_f1: 0.5761
 epoch: 80, train_loss: 0.6859, test_loss: 0.8952, test_f1: 0.5800
 epoch: 81, train_loss: 0.7006, test_loss: 0.7893, test_f1: 0.6043
 epoch: 82, train_loss: 0.6966, test_loss: 0.8762, test_f1: 0.5775
 epoch: 83, train_loss: 0.7057, test_loss: 0.7617, test_f1: 0.5897
 epoch: 84, train_loss: 0.6810, test_loss: 0.8168, test_f1: 0.5704
 epoch: 85, train_loss: 0.7001, test_loss: 0.9171, test_f1: 0.5351
 epoch: 86, train_loss: 0.6972, test_loss: 0.8361, test_f1: 0.6052
 epoch: 87, train_loss: 0.6801, test_loss: 0.8871, test_f1: 0.5491
 epoch: 88, train_loss: 0.6964, test_loss: 0.8279, test_f1: 0.5974
 epoch: 89, train_loss: 0.7048, test_loss: 0.8417, test_f1: 0.5407
 epoch: 90, train_loss: 0.7278, test_loss: 0.8043, test_f1: 0.5890
 epoch: 91, train_loss: 0.7823, test_loss: 0.8200, test_f1: 0.5446
 epoch: 92, train_loss: 0.7339, test_loss: 0.7821, test_f1: 0.5755
 epoch: 93, train_loss: 0.7201, test_loss: 0.7609, test_f1: 0.5944
 epoch: 94, train_loss: 0.7144, test_loss: 0.7698, test_f1: 0.5811
 epoch: 95, train_loss: 0.7100, test_loss: 0.7551, test_f1: 0.5864
 epoch: 96, train_loss: 0.7197, test_loss: 1.1013, test_f1: 0.5233
 epoch: 97, train_loss: 0.7223, test_loss: 0.7375, test_f1: 0.6040
 epoch: 98, train_loss: 0.7237, test_loss: 0.7425, test_f1: 0.5996
 epoch: 99, train_loss: 0.7110, test_loss: 0.7408, test_f1: 0.5886
##################ITERATION #2 ****************************************
 epoch: 0, train_loss: 1.1737, test_loss: 1.1574, test_f1: 0.2957
 epoch: 1, train_loss: 1.0665, test_loss: 1.0916, test_f1: 0.4161
 epoch: 2, train_loss: 1.0250, test_loss: 1.0383, test_f1: 0.4658
 epoch: 3, train_loss: 0.9800, test_loss: 1.0751, test_f1: 0.4287
 epoch: 4, train_loss: 0.9832, test_loss: 1.0404, test_f1: 0.4715
 epoch: 5, train_loss: 0.9584, test_loss: 0.9510, test_f1: 0.4944
 epoch: 6, train_loss: 0.9451, test_loss: 1.0396, test_f1: 0.4586
 epoch: 7, train_loss: 0.9383, test_loss: 0.9983, test_f1: 0.4755
 epoch: 8, train_loss: 0.9379, test_loss: 0.9239, test_f1: 0.5153
 epoch: 9, train_loss: 0.9094, test_loss: 0.9473, test_f1: 0.5314
 epoch: 10, train_loss: 0.8991, test_loss: 0.9733, test_f1: 0.5182
 epoch: 11, train_loss: 0.8877, test_loss: 0.9090, test_f1: 0.5164
 epoch: 12, train_loss: 0.8978, test_loss: 0.9633, test_f1: 0.4939
 epoch: 13, train_loss: 0.8763, test_loss: 0.9753, test_f1: 0.4842
 epoch: 14, train_loss: 0.8886, test_loss: 0.9187, test_f1: 0.5086
 epoch: 15, train_loss: 0.8756, test_loss: 1.0530, test_f1: 0.4741
 epoch: 16, train_loss: 0.8752, test_loss: 0.8765, test_f1: 0.5315
 epoch: 17, train_loss: 0.8639, test_loss: 1.1520, test_f1: 0.4232
 epoch: 18, train_loss: 0.8675, test_loss: 0.8846, test_f1: 0.5339
 epoch: 19, train_loss: 0.8386, test_loss: 0.9002, test_f1: 0.5314
 epoch: 20, train_loss: 0.8413, test_loss: 0.8993, test_f1: 0.5446
 epoch: 21, train_loss: 0.8319, test_loss: 0.9148, test_f1: 0.4949
 epoch: 22, train_loss: 0.8278, test_loss: 0.9599, test_f1: 0.5461
 epoch: 23, train_loss: 0.8315, test_loss: 1.0107, test_f1: 0.4834
 epoch: 24, train_loss: 0.8190, test_loss: 0.9278, test_f1: 0.5219
 epoch: 25, train_loss: 0.8526, test_loss: 1.2142, test_f1: 0.4808
 epoch: 26, train_loss: 0.8592, test_loss: 0.9962, test_f1: 0.5164
 epoch: 27, train_loss: 0.8440, test_loss: 0.9613, test_f1: 0.5034
 epoch: 28, train_loss: 0.8270, test_loss: 0.8476, test_f1: 0.5356
 epoch: 29, train_loss: 0.7976, test_loss: 0.8647, test_f1: 0.5307
 epoch: 30, train_loss: 0.8060, test_loss: 0.8951, test_f1: 0.5441
 epoch: 31, train_loss: 0.8322, test_loss: 0.8727, test_f1: 0.5615
 epoch: 32, train_loss: 0.8103, test_loss: 0.8212, test_f1: 0.5592
 epoch: 33, train_loss: 0.7988, test_loss: 0.8767, test_f1: 0.5793
 epoch: 34, train_loss: 0.7928, test_loss: 0.8111, test_f1: 0.5565
 epoch: 35, train_loss: 0.7799, test_loss: 0.8621, test_f1: 0.5630
 epoch: 36, train_loss: 0.7745, test_loss: 0.9140, test_f1: 0.5428
 epoch: 37, train_loss: 0.7825, test_loss: 0.9249, test_f1: 0.5398
 epoch: 38, train_loss: 0.7852, test_loss: 0.9318, test_f1: 0.5661
 epoch: 39, train_loss: 0.7749, test_loss: 0.8361, test_f1: 0.5567
 epoch: 40, train_loss: 0.7785, test_loss: 0.9733, test_f1: 0.5087
 epoch: 41, train_loss: 0.7882, test_loss: 0.9125, test_f1: 0.5560
 epoch: 42, train_loss: 0.7671, test_loss: 0.8192, test_f1: 0.5559
 epoch: 43, train_loss: 0.7775, test_loss: 1.0269, test_f1: 0.5007
 epoch: 44, train_loss: 0.7827, test_loss: 0.8179, test_f1: 0.5841
 epoch: 45, train_loss: 0.7854, test_loss: 0.9002, test_f1: 0.5319
 epoch: 46, train_loss: 0.7727, test_loss: 0.9931, test_f1: 0.4832
 epoch: 47, train_loss: 0.7642, test_loss: 0.8594, test_f1: 0.5573
 epoch: 48, train_loss: 0.7747, test_loss: 0.9154, test_f1: 0.5710
 epoch: 49, train_loss: 0.7755, test_loss: 0.8204, test_f1: 0.6177
 epoch: 50, train_loss: 0.7749, test_loss: 0.9300, test_f1: 0.5366
 epoch: 51, train_loss: 0.7443, test_loss: 0.8865, test_f1: 0.5263
 epoch: 52, train_loss: 0.7301, test_loss: 0.8622, test_f1: 0.5728
 epoch: 53, train_loss: 0.7230, test_loss: 0.8550, test_f1: 0.5665
 epoch: 54, train_loss: 0.7163, test_loss: 0.8702, test_f1: 0.5690
 epoch: 55, train_loss: 0.7103, test_loss: 0.8972, test_f1: 0.5664
 epoch: 56, train_loss: 0.7176, test_loss: 0.8086, test_f1: 0.5896
 epoch: 57, train_loss: 0.7105, test_loss: 0.8601, test_f1: 0.5879
 epoch: 58, train_loss: 0.7074, test_loss: 0.8963, test_f1: 0.5542
 epoch: 59, train_loss: 0.7070, test_loss: 0.9908, test_f1: 0.5460
 epoch: 60, train_loss: 0.7002, test_loss: 0.8965, test_f1: 0.5335
 epoch: 61, train_loss: 0.7016, test_loss: 0.8198, test_f1: 0.6204
 epoch: 62, train_loss: 0.6833, test_loss: 0.9171, test_f1: 0.5928
 epoch: 63, train_loss: 0.7017, test_loss: 0.8447, test_f1: 0.6115
 epoch: 64, train_loss: 0.6922, test_loss: 0.8733, test_f1: 0.5630
 epoch: 65, train_loss: 0.7034, test_loss: 0.8277, test_f1: 0.5720
 epoch: 66, train_loss: 0.7094, test_loss: 0.8756, test_f1: 0.6039
 epoch: 67, train_loss: 0.7237, test_loss: 0.8577, test_f1: 0.5744
 epoch: 68, train_loss: 0.7102, test_loss: 0.8388, test_f1: 0.5804
 epoch: 69, train_loss: 0.6997, test_loss: 0.9114, test_f1: 0.5594
 epoch: 70, train_loss: 0.7046, test_loss: 0.9190, test_f1: 0.5320
 epoch: 71, train_loss: 0.6982, test_loss: 0.8391, test_f1: 0.5809
 epoch: 72, train_loss: 0.7083, test_loss: 0.8392, test_f1: 0.5992
 epoch: 73, train_loss: 0.6921, test_loss: 0.9129, test_f1: 0.5708
 epoch: 74, train_loss: 0.6955, test_loss: 0.8299, test_f1: 0.5948
 epoch: 75, train_loss: 0.6967, test_loss: 0.8542, test_f1: 0.5686
 epoch: 76, train_loss: 0.6810, test_loss: 0.9760, test_f1: 0.5186
 epoch: 77, train_loss: 0.6930, test_loss: 0.8475, test_f1: 0.6146
 epoch: 78, train_loss: 0.7062, test_loss: 0.7936, test_f1: 0.6327
 epoch: 79, train_loss: 0.6834, test_loss: 0.8436, test_f1: 0.5862
 epoch: 80, train_loss: 0.6915, test_loss: 0.7974, test_f1: 0.6124
 epoch: 81, train_loss: 0.6846, test_loss: 0.7941, test_f1: 0.6273
 epoch: 82, train_loss: 0.6731, test_loss: 0.8661, test_f1: 0.5715
 epoch: 83, train_loss: 0.6767, test_loss: 0.8631, test_f1: 0.6054
 epoch: 84, train_loss: 0.6691, test_loss: 0.8634, test_f1: 0.5872
 epoch: 85, train_loss: 0.6883, test_loss: 0.8860, test_f1: 0.5842
 epoch: 86, train_loss: 0.6763, test_loss: 0.7810, test_f1: 0.6232
 epoch: 87, train_loss: 0.6682, test_loss: 0.9580, test_f1: 0.5606
 epoch: 88, train_loss: 0.6654, test_loss: 0.8417, test_f1: 0.6116
 epoch: 89, train_loss: 0.6717, test_loss: 0.8243, test_f1: 0.6156
 epoch: 90, train_loss: 0.6801, test_loss: 0.8569, test_f1: 0.6144
 epoch: 91, train_loss: 0.6697, test_loss: 0.8154, test_f1: 0.6022
 epoch: 92, train_loss: 0.6592, test_loss: 0.8524, test_f1: 0.6020
 epoch: 93, train_loss: 0.6677, test_loss: 0.8444, test_f1: 0.6104
 epoch: 94, train_loss: 0.6651, test_loss: 0.8499, test_f1: 0.5905
 epoch: 95, train_loss: 0.6653, test_loss: 0.8342, test_f1: 0.6175
 epoch: 96, train_loss: 0.6671, test_loss: 0.9056, test_f1: 0.5245
 epoch: 97, train_loss: 0.6856, test_loss: 0.8038, test_f1: 0.6076
 epoch: 98, train_loss: 0.6631, test_loss: 0.8487, test_f1: 0.6019
 epoch: 99, train_loss: 0.6584, test_loss: 0.9112, test_f1: 0.6075
##################ITERATION #3 ****************************************
 epoch: 0, train_loss: 1.1878, test_loss: 1.1709, test_f1: 0.3160
 epoch: 1, train_loss: 1.0539, test_loss: 1.1359, test_f1: 0.3296
 epoch: 2, train_loss: 1.0278, test_loss: 1.1316, test_f1: 0.4232
 epoch: 3, train_loss: 1.0112, test_loss: 1.0926, test_f1: 0.4972
 epoch: 4, train_loss: 0.9892, test_loss: 1.1025, test_f1: 0.4747
 epoch: 5, train_loss: 0.9829, test_loss: 0.9944, test_f1: 0.5514
 epoch: 6, train_loss: 0.9825, test_loss: 0.9884, test_f1: 0.4904
 epoch: 7, train_loss: 0.9674, test_loss: 1.0045, test_f1: 0.4804
 epoch: 8, train_loss: 0.9613, test_loss: 1.0895, test_f1: 0.5109
 epoch: 9, train_loss: 0.9579, test_loss: 1.0915, test_f1: 0.4545
 epoch: 10, train_loss: 0.9441, test_loss: 0.9957, test_f1: 0.5034
 epoch: 11, train_loss: 0.9249, test_loss: 1.0461, test_f1: 0.4650
 epoch: 12, train_loss: 0.9547, test_loss: 1.1090, test_f1: 0.4822
 epoch: 13, train_loss: 0.9224, test_loss: 0.9900, test_f1: 0.4985
 epoch: 14, train_loss: 0.9111, test_loss: 0.9258, test_f1: 0.4912
 epoch: 15, train_loss: 0.9386, test_loss: 1.1142, test_f1: 0.4766
 epoch: 16, train_loss: 0.9183, test_loss: 0.9774, test_f1: 0.4905
 epoch: 17, train_loss: 0.8907, test_loss: 1.0115, test_f1: 0.5108
 epoch: 18, train_loss: 0.8970, test_loss: 0.9462, test_f1: 0.5226
 epoch: 19, train_loss: 0.8922, test_loss: 0.9446, test_f1: 0.5415
 epoch: 20, train_loss: 0.8917, test_loss: 0.9026, test_f1: 0.5463
 epoch: 21, train_loss: 0.8866, test_loss: 0.9765, test_f1: 0.4772
 epoch: 22, train_loss: 0.8712, test_loss: 0.8935, test_f1: 0.5273
 epoch: 23, train_loss: 0.8760, test_loss: 1.1614, test_f1: 0.4818
 epoch: 24, train_loss: 0.8763, test_loss: 0.9394, test_f1: 0.5177
 epoch: 25, train_loss: 0.8873, test_loss: 0.9193, test_f1: 0.5499
 epoch: 26, train_loss: 0.8612, test_loss: 0.9769, test_f1: 0.4811
 epoch: 27, train_loss: 0.8518, test_loss: 0.8911, test_f1: 0.5193
 epoch: 28, train_loss: 0.8652, test_loss: 0.9669, test_f1: 0.4925
 epoch: 29, train_loss: 0.8521, test_loss: 0.9215, test_f1: 0.5211
 epoch: 30, train_loss: 0.8505, test_loss: 0.9633, test_f1: 0.5028
 epoch: 31, train_loss: 0.8506, test_loss: 0.9011, test_f1: 0.5119
 epoch: 32, train_loss: 0.8583, test_loss: 0.9177, test_f1: 0.5072
 epoch: 33, train_loss: 0.8498, test_loss: 0.9236, test_f1: 0.5165
 epoch: 34, train_loss: 0.8272, test_loss: 0.9159, test_f1: 0.5412
 epoch: 35, train_loss: 0.8318, test_loss: 0.8579, test_f1: 0.5558
 epoch: 36, train_loss: 0.8333, test_loss: 0.8829, test_f1: 0.5388
 epoch: 37, train_loss: 0.8344, test_loss: 0.9428, test_f1: 0.5139
 epoch: 38, train_loss: 0.8298, test_loss: 0.8305, test_f1: 0.5527
 epoch: 39, train_loss: 0.8113, test_loss: 0.8299, test_f1: 0.5547
 epoch: 40, train_loss: 0.8205, test_loss: 0.8198, test_f1: 0.5578
 epoch: 41, train_loss: 0.8145, test_loss: 0.8824, test_f1: 0.5060
 epoch: 42, train_loss: 0.8128, test_loss: 0.9124, test_f1: 0.5637
 epoch: 43, train_loss: 0.7966, test_loss: 0.8577, test_f1: 0.5424
 epoch: 44, train_loss: 0.8131, test_loss: 0.9322, test_f1: 0.5179
 epoch: 45, train_loss: 0.8362, test_loss: 0.8517, test_f1: 0.5367
 epoch: 46, train_loss: 0.7985, test_loss: 1.0280, test_f1: 0.5027
 epoch: 47, train_loss: 0.7861, test_loss: 0.8943, test_f1: 0.5280
 epoch: 48, train_loss: 0.8075, test_loss: 0.9172, test_f1: 0.5323
 epoch: 49, train_loss: 0.8239, test_loss: 0.9388, test_f1: 0.5020
 epoch: 50, train_loss: 0.7965, test_loss: 0.8153, test_f1: 0.5777
 epoch: 51, train_loss: 0.7687, test_loss: 0.8632, test_f1: 0.5528
 epoch: 52, train_loss: 0.7635, test_loss: 0.8570, test_f1: 0.5566
 epoch: 53, train_loss: 0.7535, test_loss: 0.9224, test_f1: 0.5100
 epoch: 54, train_loss: 0.7528, test_loss: 0.8418, test_f1: 0.5566
 epoch: 55, train_loss: 0.7601, test_loss: 0.8527, test_f1: 0.5420
 epoch: 56, train_loss: 0.7540, test_loss: 0.8697, test_f1: 0.5498
 epoch: 57, train_loss: 0.7600, test_loss: 0.8533, test_f1: 0.5379
 epoch: 58, train_loss: 0.7545, test_loss: 0.8470, test_f1: 0.5468
 epoch: 59, train_loss: 0.7408, test_loss: 0.9121, test_f1: 0.5406
 epoch: 60, train_loss: 0.7579, test_loss: 0.8745, test_f1: 0.5096
 epoch: 61, train_loss: 0.7570, test_loss: 0.8652, test_f1: 0.5366
 epoch: 62, train_loss: 0.7513, test_loss: 0.8729, test_f1: 0.5392
 epoch: 63, train_loss: 0.7399, test_loss: 0.8758, test_f1: 0.5549
 epoch: 64, train_loss: 0.7476, test_loss: 0.8410, test_f1: 0.5594
 epoch: 65, train_loss: 0.7377, test_loss: 0.9003, test_f1: 0.5347
 epoch: 66, train_loss: 0.7493, test_loss: 0.8761, test_f1: 0.5562
 epoch: 67, train_loss: 0.7390, test_loss: 0.8205, test_f1: 0.5229
 epoch: 68, train_loss: 0.7331, test_loss: 0.8407, test_f1: 0.5617
 epoch: 69, train_loss: 0.7347, test_loss: 0.9160, test_f1: 0.5424
 epoch: 70, train_loss: 0.7262, test_loss: 0.8467, test_f1: 0.5503
 epoch: 71, train_loss: 0.7316, test_loss: 0.9062, test_f1: 0.5387
 epoch: 72, train_loss: 0.7267, test_loss: 0.8507, test_f1: 0.5536
 epoch: 73, train_loss: 0.7387, test_loss: 0.8295, test_f1: 0.5653
 epoch: 74, train_loss: 0.7244, test_loss: 0.8385, test_f1: 0.5654
 epoch: 75, train_loss: 0.7146, test_loss: 0.8418, test_f1: 0.5467
 epoch: 76, train_loss: 0.7173, test_loss: 0.8318, test_f1: 0.5752
 epoch: 77, train_loss: 0.7204, test_loss: 0.9178, test_f1: 0.5391
 epoch: 78, train_loss: 0.7104, test_loss: 0.8525, test_f1: 0.5810
 epoch: 79, train_loss: 0.7214, test_loss: 0.8619, test_f1: 0.5666
 epoch: 80, train_loss: 0.7193, test_loss: 0.9334, test_f1: 0.5584
 epoch: 81, train_loss: 0.7143, test_loss: 0.8516, test_f1: 0.5476
 epoch: 82, train_loss: 0.7188, test_loss: 0.9237, test_f1: 0.5471
 epoch: 83, train_loss: 0.7211, test_loss: 0.8568, test_f1: 0.5775
 epoch: 84, train_loss: 0.7232, test_loss: 0.9294, test_f1: 0.5483
 epoch: 85, train_loss: 0.7111, test_loss: 0.8471, test_f1: 0.5495
 epoch: 86, train_loss: 0.7148, test_loss: 0.9012, test_f1: 0.5528
 epoch: 87, train_loss: 0.7229, test_loss: 0.8723, test_f1: 0.5457
 epoch: 88, train_loss: 0.7094, test_loss: 0.9004, test_f1: 0.5678
 epoch: 89, train_loss: 0.7096, test_loss: 0.9137, test_f1: 0.5453
 epoch: 90, train_loss: 0.7088, test_loss: 0.9026, test_f1: 0.5458
 epoch: 91, train_loss: 0.7109, test_loss: 0.9302, test_f1: 0.5383
 epoch: 92, train_loss: 0.6912, test_loss: 0.9368, test_f1: 0.5393
 epoch: 93, train_loss: 0.6904, test_loss: 0.9656, test_f1: 0.5373
 epoch: 94, train_loss: 0.7076, test_loss: 0.8458, test_f1: 0.5616
 epoch: 95, train_loss: 0.7102, test_loss: 1.0151, test_f1: 0.5372
 epoch: 96, train_loss: 0.7182, test_loss: 0.9175, test_f1: 0.5290
 epoch: 97, train_loss: 0.7064, test_loss: 0.9349, test_f1: 0.5385
 epoch: 98, train_loss: 0.7036, test_loss: 0.8232, test_f1: 0.5810
 epoch: 99, train_loss: 0.6891, test_loss: 0.9228, test_f1: 0.5562
##################ITERATION #4 ****************************************
 epoch: 0, train_loss: 1.1631, test_loss: 1.0867, test_f1: 0.3393
 epoch: 1, train_loss: 1.0544, test_loss: 1.2046, test_f1: 0.3118
 epoch: 2, train_loss: 1.0335, test_loss: 1.0787, test_f1: 0.4312
 epoch: 3, train_loss: 1.0071, test_loss: 1.0619, test_f1: 0.3974
 epoch: 4, train_loss: 0.9903, test_loss: 1.0271, test_f1: 0.4477
 epoch: 5, train_loss: 0.9733, test_loss: 1.0270, test_f1: 0.4902
 epoch: 6, train_loss: 0.9592, test_loss: 1.1652, test_f1: 0.4440
 epoch: 7, train_loss: 0.9593, test_loss: 0.9598, test_f1: 0.4844
 epoch: 8, train_loss: 0.9287, test_loss: 0.9783, test_f1: 0.4651
 epoch: 9, train_loss: 0.9263, test_loss: 1.3229, test_f1: 0.4034
 epoch: 10, train_loss: 0.9096, test_loss: 0.9920, test_f1: 0.4816
 epoch: 11, train_loss: 0.9164, test_loss: 0.9449, test_f1: 0.5221
 epoch: 12, train_loss: 0.9047, test_loss: 1.1198, test_f1: 0.4612
 epoch: 13, train_loss: 0.8912, test_loss: 1.0373, test_f1: 0.4575
 epoch: 14, train_loss: 0.8896, test_loss: 0.9527, test_f1: 0.5088
 epoch: 15, train_loss: 0.8734, test_loss: 1.0159, test_f1: 0.5248
 epoch: 16, train_loss: 0.8912, test_loss: 0.9173, test_f1: 0.4961
 epoch: 17, train_loss: 0.8553, test_loss: 0.9029, test_f1: 0.5086
 epoch: 18, train_loss: 0.8776, test_loss: 0.9411, test_f1: 0.4809
 epoch: 19, train_loss: 0.8452, test_loss: 0.9388, test_f1: 0.4947
 epoch: 20, train_loss: 0.8456, test_loss: 0.9377, test_f1: 0.5443
 epoch: 21, train_loss: 0.8569, test_loss: 0.9045, test_f1: 0.5322
 epoch: 22, train_loss: 0.8478, test_loss: 0.9307, test_f1: 0.5118
 epoch: 23, train_loss: 0.8451, test_loss: 0.9244, test_f1: 0.5292
 epoch: 24, train_loss: 0.8359, test_loss: 0.8867, test_f1: 0.5209
 epoch: 25, train_loss: 0.8325, test_loss: 0.8980, test_f1: 0.5318
 epoch: 26, train_loss: 0.8214, test_loss: 0.9351, test_f1: 0.4966
 epoch: 27, train_loss: 0.8459, test_loss: 0.9736, test_f1: 0.4600
 epoch: 28, train_loss: 0.8263, test_loss: 0.8867, test_f1: 0.5259
 epoch: 29, train_loss: 0.8184, test_loss: 0.9632, test_f1: 0.4986
 epoch: 30, train_loss: 0.8345, test_loss: 1.0503, test_f1: 0.4780
 epoch: 31, train_loss: 0.8387, test_loss: 0.9474, test_f1: 0.5335
 epoch: 32, train_loss: 0.8133, test_loss: 0.9014, test_f1: 0.5169
 epoch: 33, train_loss: 0.7978, test_loss: 0.9642, test_f1: 0.5124
 epoch: 34, train_loss: 0.8040, test_loss: 0.8936, test_f1: 0.5251
 epoch: 35, train_loss: 0.8006, test_loss: 0.9061, test_f1: 0.5090
 epoch: 36, train_loss: 0.7877, test_loss: 0.8690, test_f1: 0.5415
 epoch: 37, train_loss: 0.8029, test_loss: 0.9331, test_f1: 0.5220
 epoch: 38, train_loss: 0.8063, test_loss: 0.8839, test_f1: 0.5246
 epoch: 39, train_loss: 0.7868, test_loss: 0.8638, test_f1: 0.5381
 epoch: 40, train_loss: 0.7739, test_loss: 0.8951, test_f1: 0.5528
 epoch: 41, train_loss: 0.7819, test_loss: 0.9446, test_f1: 0.5197
 epoch: 42, train_loss: 0.8008, test_loss: 0.8874, test_f1: 0.5210
 epoch: 43, train_loss: 0.7889, test_loss: 0.8382, test_f1: 0.5408
 epoch: 44, train_loss: 0.7731, test_loss: 0.9293, test_f1: 0.4938
 epoch: 45, train_loss: 0.7842, test_loss: 0.9140, test_f1: 0.4966
 epoch: 46, train_loss: 0.7835, test_loss: 1.0101, test_f1: 0.4822
 epoch: 47, train_loss: 0.7881, test_loss: 0.9349, test_f1: 0.5158
 epoch: 48, train_loss: 0.7759, test_loss: 1.0668, test_f1: 0.4877
 epoch: 49, train_loss: 0.8040, test_loss: 1.0848, test_f1: 0.4954
 epoch: 50, train_loss: 0.8185, test_loss: 0.9035, test_f1: 0.5370
 epoch: 51, train_loss: 0.7668, test_loss: 0.8916, test_f1: 0.5319
 epoch: 52, train_loss: 0.7475, test_loss: 0.8892, test_f1: 0.5266
 epoch: 53, train_loss: 0.7609, test_loss: 0.8523, test_f1: 0.5347
 epoch: 54, train_loss: 0.7372, test_loss: 0.8778, test_f1: 0.5407
 epoch: 55, train_loss: 0.7399, test_loss: 0.8811, test_f1: 0.5595
 epoch: 56, train_loss: 0.7318, test_loss: 0.9345, test_f1: 0.5052
 epoch: 57, train_loss: 0.7240, test_loss: 0.9130, test_f1: 0.5135
 epoch: 58, train_loss: 0.7254, test_loss: 0.8998, test_f1: 0.5298
 epoch: 59, train_loss: 0.7280, test_loss: 0.9007, test_f1: 0.5338
 epoch: 60, train_loss: 0.7227, test_loss: 0.8866, test_f1: 0.5345
 epoch: 61, train_loss: 0.7277, test_loss: 0.9089, test_f1: 0.5188
 epoch: 62, train_loss: 0.7311, test_loss: 0.8872, test_f1: 0.5579
 epoch: 63, train_loss: 0.7261, test_loss: 0.8804, test_f1: 0.5430
 epoch: 64, train_loss: 0.7182, test_loss: 0.8929, test_f1: 0.5401
 epoch: 65, train_loss: 0.7141, test_loss: 0.8935, test_f1: 0.5507
 epoch: 66, train_loss: 0.7149, test_loss: 0.8818, test_f1: 0.5392
 epoch: 67, train_loss: 0.7199, test_loss: 0.8800, test_f1: 0.5898
 epoch: 68, train_loss: 0.7100, test_loss: 0.9006, test_f1: 0.5301
 epoch: 69, train_loss: 0.7181, test_loss: 0.8834, test_f1: 0.5323
 epoch: 70, train_loss: 0.7259, test_loss: 0.9020, test_f1: 0.5661
 epoch: 71, train_loss: 0.7156, test_loss: 0.8945, test_f1: 0.5333
 epoch: 72, train_loss: 0.7271, test_loss: 0.8900, test_f1: 0.5644
 epoch: 73, train_loss: 0.7112, test_loss: 0.8597, test_f1: 0.5594
 epoch: 74, train_loss: 0.7033, test_loss: 0.8603, test_f1: 0.5764
 epoch: 75, train_loss: 0.7010, test_loss: 0.9130, test_f1: 0.5032
 epoch: 76, train_loss: 0.7135, test_loss: 0.9733, test_f1: 0.5480
 epoch: 77, train_loss: 0.7130, test_loss: 0.9221, test_f1: 0.5589
 epoch: 78, train_loss: 0.6898, test_loss: 0.8828, test_f1: 0.5361
 epoch: 79, train_loss: 0.7071, test_loss: 0.8822, test_f1: 0.5165
 epoch: 80, train_loss: 0.7125, test_loss: 0.8977, test_f1: 0.5515
 epoch: 81, train_loss: 0.7128, test_loss: 0.9422, test_f1: 0.5589
 epoch: 82, train_loss: 0.6979, test_loss: 0.8970, test_f1: 0.5553
 epoch: 83, train_loss: 0.6915, test_loss: 0.8770, test_f1: 0.5828
 epoch: 84, train_loss: 0.7020, test_loss: 0.9428, test_f1: 0.5245
 epoch: 85, train_loss: 0.7082, test_loss: 0.9478, test_f1: 0.5033
 epoch: 86, train_loss: 0.7182, test_loss: 0.9157, test_f1: 0.5727
 epoch: 87, train_loss: 0.6936, test_loss: 0.8951, test_f1: 0.5698
 epoch: 88, train_loss: 0.6986, test_loss: 0.8758, test_f1: 0.5465
 epoch: 89, train_loss: 0.7052, test_loss: 0.9844, test_f1: 0.5659
 epoch: 90, train_loss: 0.6909, test_loss: 0.8657, test_f1: 0.5738
 epoch: 91, train_loss: 0.7005, test_loss: 0.9268, test_f1: 0.5411
 epoch: 92, train_loss: 0.6897, test_loss: 0.8752, test_f1: 0.5710
 epoch: 93, train_loss: 0.6880, test_loss: 0.8932, test_f1: 0.5504
 epoch: 94, train_loss: 0.6988, test_loss: 0.8697, test_f1: 0.5631
 epoch: 95, train_loss: 0.6913, test_loss: 0.8921, test_f1: 0.5948
 epoch: 96, train_loss: 0.6829, test_loss: 0.9224, test_f1: 0.5536
 epoch: 97, train_loss: 0.7036, test_loss: 1.0787, test_f1: 0.4938
 epoch: 98, train_loss: 0.6993, test_loss: 0.9349, test_f1: 0.5838
 epoch: 99, train_loss: 0.6971, test_loss: 0.9221, test_f1: 0.5415
##################ITERATION #5 ****************************************
 epoch: 0, train_loss: 1.1797, test_loss: 1.1989, test_f1: 0.3219
 epoch: 1, train_loss: 1.0286, test_loss: 1.1584, test_f1: 0.3309
 epoch: 2, train_loss: 1.0025, test_loss: 1.0417, test_f1: 0.5093
 epoch: 3, train_loss: 1.0023, test_loss: 0.9871, test_f1: 0.4536
 epoch: 4, train_loss: 0.9743, test_loss: 1.0732, test_f1: 0.3884
 epoch: 5, train_loss: 0.9667, test_loss: 1.0262, test_f1: 0.5063
 epoch: 6, train_loss: 0.9689, test_loss: 1.0103, test_f1: 0.4935
 epoch: 7, train_loss: 0.9424, test_loss: 1.0318, test_f1: 0.5116
 epoch: 8, train_loss: 0.9220, test_loss: 1.1705, test_f1: 0.4273
 epoch: 9, train_loss: 0.9153, test_loss: 1.0101, test_f1: 0.5226
 epoch: 10, train_loss: 0.9121, test_loss: 1.0315, test_f1: 0.4915
 epoch: 11, train_loss: 0.9113, test_loss: 0.9786, test_f1: 0.5069
 epoch: 12, train_loss: 0.9132, test_loss: 0.9476, test_f1: 0.4972
 epoch: 13, train_loss: 0.8892, test_loss: 1.0207, test_f1: 0.5139
 epoch: 14, train_loss: 0.8846, test_loss: 1.1207, test_f1: 0.4501
 epoch: 15, train_loss: 0.8800, test_loss: 0.9709, test_f1: 0.5187
 epoch: 16, train_loss: 0.8706, test_loss: 0.9496, test_f1: 0.5106
 epoch: 17, train_loss: 0.8796, test_loss: 1.0886, test_f1: 0.4663
 epoch: 18, train_loss: 0.8649, test_loss: 0.9366, test_f1: 0.5359
 epoch: 19, train_loss: 0.8521, test_loss: 0.9462, test_f1: 0.5113
 epoch: 20, train_loss: 0.8385, test_loss: 0.8988, test_f1: 0.5460
 epoch: 21, train_loss: 0.8315, test_loss: 0.9936, test_f1: 0.5023
 epoch: 22, train_loss: 0.8421, test_loss: 1.1419, test_f1: 0.4535
 epoch: 23, train_loss: 0.8351, test_loss: 0.9361, test_f1: 0.5405
 epoch: 24, train_loss: 0.8280, test_loss: 0.9456, test_f1: 0.5371
 epoch: 25, train_loss: 0.8175, test_loss: 1.1304, test_f1: 0.4522
 epoch: 26, train_loss: 0.8348, test_loss: 1.0910, test_f1: 0.4955
 epoch: 27, train_loss: 0.8182, test_loss: 0.9223, test_f1: 0.5343
 epoch: 28, train_loss: 0.8082, test_loss: 0.9377, test_f1: 0.5466
 epoch: 29, train_loss: 0.8022, test_loss: 1.0299, test_f1: 0.4678
 epoch: 30, train_loss: 0.7979, test_loss: 1.0664, test_f1: 0.4572
 epoch: 31, train_loss: 0.8123, test_loss: 0.9420, test_f1: 0.5154
 epoch: 32, train_loss: 0.7987, test_loss: 0.9014, test_f1: 0.5399
 epoch: 33, train_loss: 0.7919, test_loss: 0.9488, test_f1: 0.5236
 epoch: 34, train_loss: 0.7738, test_loss: 0.9821, test_f1: 0.5247
 epoch: 35, train_loss: 0.7762, test_loss: 0.9418, test_f1: 0.4796
 epoch: 36, train_loss: 0.7960, test_loss: 1.1376, test_f1: 0.4843
 epoch: 37, train_loss: 0.7792, test_loss: 0.9545, test_f1: 0.5167
 epoch: 38, train_loss: 0.7840, test_loss: 0.9337, test_f1: 0.5253
 epoch: 39, train_loss: 0.7884, test_loss: 0.9595, test_f1: 0.5533
 epoch: 40, train_loss: 0.7724, test_loss: 0.9201, test_f1: 0.5339
 epoch: 41, train_loss: 0.7924, test_loss: 0.9453, test_f1: 0.5326
 epoch: 42, train_loss: 0.7712, test_loss: 0.8956, test_f1: 0.5467
 epoch: 43, train_loss: 0.7606, test_loss: 0.9500, test_f1: 0.5175
 epoch: 44, train_loss: 0.7636, test_loss: 1.0001, test_f1: 0.4802
 epoch: 45, train_loss: 0.7614, test_loss: 0.9377, test_f1: 0.5299
 epoch: 46, train_loss: 0.7622, test_loss: 0.9676, test_f1: 0.5190
 epoch: 47, train_loss: 0.7704, test_loss: 0.9084, test_f1: 0.5012
 epoch: 48, train_loss: 0.7547, test_loss: 1.0550, test_f1: 0.4989
 epoch: 49, train_loss: 0.7639, test_loss: 0.9277, test_f1: 0.5251
 epoch: 50, train_loss: 0.7599, test_loss: 0.9054, test_f1: 0.5991
 epoch: 51, train_loss: 0.7319, test_loss: 0.9687, test_f1: 0.5156
 epoch: 52, train_loss: 0.7268, test_loss: 0.8834, test_f1: 0.5426
 epoch: 53, train_loss: 0.7096, test_loss: 0.9130, test_f1: 0.5517
 epoch: 54, train_loss: 0.7116, test_loss: 0.9611, test_f1: 0.5312
 epoch: 55, train_loss: 0.7069, test_loss: 0.9095, test_f1: 0.5482
 epoch: 56, train_loss: 0.7152, test_loss: 0.9211, test_f1: 0.5504
 epoch: 57, train_loss: 0.7007, test_loss: 0.8878, test_f1: 0.5578
 epoch: 58, train_loss: 0.7166, test_loss: 0.8534, test_f1: 0.5576
 epoch: 59, train_loss: 0.7163, test_loss: 0.9070, test_f1: 0.5375
 epoch: 60, train_loss: 0.7075, test_loss: 0.8706, test_f1: 0.5531
 epoch: 61, train_loss: 0.6993, test_loss: 0.8567, test_f1: 0.5657
 epoch: 62, train_loss: 0.7113, test_loss: 0.8664, test_f1: 0.5551
 epoch: 63, train_loss: 0.7030, test_loss: 0.9578, test_f1: 0.5131
 epoch: 64, train_loss: 0.6943, test_loss: 0.9188, test_f1: 0.5436
 epoch: 65, train_loss: 0.6830, test_loss: 0.9040, test_f1: 0.5511
 epoch: 66, train_loss: 0.7036, test_loss: 0.9196, test_f1: 0.5472
 epoch: 67, train_loss: 0.7008, test_loss: 0.9239, test_f1: 0.5171
 epoch: 68, train_loss: 0.7049, test_loss: 0.8833, test_f1: 0.5702
 epoch: 69, train_loss: 0.6941, test_loss: 0.8572, test_f1: 0.5500
 epoch: 70, train_loss: 0.6916, test_loss: 0.9221, test_f1: 0.5559
 epoch: 71, train_loss: 0.7026, test_loss: 1.0235, test_f1: 0.5116
 epoch: 72, train_loss: 0.6867, test_loss: 0.9268, test_f1: 0.5376
 epoch: 73, train_loss: 0.6790, test_loss: 0.9964, test_f1: 0.5326
 epoch: 74, train_loss: 0.6731, test_loss: 0.9327, test_f1: 0.5418
 epoch: 75, train_loss: 0.6929, test_loss: 0.9123, test_f1: 0.5636
 epoch: 76, train_loss: 0.6792, test_loss: 1.0001, test_f1: 0.5580
 epoch: 77, train_loss: 0.6910, test_loss: 0.9754, test_f1: 0.5639
 epoch: 78, train_loss: 0.6759, test_loss: 0.9135, test_f1: 0.5460
 epoch: 79, train_loss: 0.6815, test_loss: 0.8978, test_f1: 0.5753
 epoch: 80, train_loss: 0.6729, test_loss: 0.8287, test_f1: 0.5679
 epoch: 81, train_loss: 0.6791, test_loss: 0.9818, test_f1: 0.5399
 epoch: 82, train_loss: 0.6794, test_loss: 1.0169, test_f1: 0.5427
 epoch: 83, train_loss: 0.6735, test_loss: 0.8832, test_f1: 0.5524
 epoch: 84, train_loss: 0.6737, test_loss: 0.9748, test_f1: 0.5369
 epoch: 85, train_loss: 0.6729, test_loss: 0.8942, test_f1: 0.5492
 epoch: 86, train_loss: 0.6855, test_loss: 0.8829, test_f1: 0.5472
 epoch: 87, train_loss: 0.6796, test_loss: 1.0529, test_f1: 0.5214
 epoch: 88, train_loss: 0.6863, test_loss: 0.8684, test_f1: 0.5676
 epoch: 89, train_loss: 0.6912, test_loss: 0.9495, test_f1: 0.5360
 epoch: 90, train_loss: 0.6732, test_loss: 0.9712, test_f1: 0.5589
 epoch: 91, train_loss: 0.6728, test_loss: 0.8529, test_f1: 0.5775
 epoch: 92, train_loss: 0.6739, test_loss: 0.8680, test_f1: 0.5685
 epoch: 93, train_loss: 0.6677, test_loss: 1.0022, test_f1: 0.5446
 epoch: 94, train_loss: 0.6751, test_loss: 0.9495, test_f1: 0.5435
 epoch: 95, train_loss: 0.6795, test_loss: 0.9297, test_f1: 0.5395
 epoch: 96, train_loss: 0.6647, test_loss: 0.9659, test_f1: 0.5568
 epoch: 97, train_loss: 0.6667, test_loss: 0.9461, test_f1: 0.5531
 epoch: 98, train_loss: 0.6694, test_loss: 0.8613, test_f1: 0.5563
 epoch: 99, train_loss: 0.6492, test_loss: 0.9173, test_f1: 0.5560
##################ITERATION #6 ****************************************
 epoch: 0, train_loss: 1.1382, test_loss: 1.1823, test_f1: 0.2518
 epoch: 1, train_loss: 1.0419, test_loss: 1.1041, test_f1: 0.4042
 epoch: 2, train_loss: 1.0205, test_loss: 1.0617, test_f1: 0.4346
 epoch: 3, train_loss: 1.0028, test_loss: 1.0343, test_f1: 0.4470
 epoch: 4, train_loss: 0.9866, test_loss: 1.0050, test_f1: 0.4576
 epoch: 5, train_loss: 0.9779, test_loss: 1.1418, test_f1: 0.4640
 epoch: 6, train_loss: 0.9583, test_loss: 0.9747, test_f1: 0.4783
 epoch: 7, train_loss: 0.9362, test_loss: 0.9619, test_f1: 0.5413
 epoch: 8, train_loss: 0.9157, test_loss: 1.0060, test_f1: 0.4987
 epoch: 9, train_loss: 0.9214, test_loss: 1.0737, test_f1: 0.4628
 epoch: 10, train_loss: 0.9169, test_loss: 1.0172, test_f1: 0.4806
 epoch: 11, train_loss: 0.9235, test_loss: 0.8897, test_f1: 0.5632
 epoch: 12, train_loss: 0.8972, test_loss: 0.9275, test_f1: 0.5176
 epoch: 13, train_loss: 0.8933, test_loss: 1.0804, test_f1: 0.4652
 epoch: 14, train_loss: 0.8700, test_loss: 1.0882, test_f1: 0.4805
 epoch: 15, train_loss: 0.8635, test_loss: 0.9943, test_f1: 0.4940
 epoch: 16, train_loss: 0.8576, test_loss: 0.9843, test_f1: 0.4976
 epoch: 17, train_loss: 0.8525, test_loss: 1.1033, test_f1: 0.4629
 epoch: 18, train_loss: 0.8638, test_loss: 1.0382, test_f1: 0.4716
 epoch: 19, train_loss: 0.8369, test_loss: 0.8930, test_f1: 0.5274
 epoch: 20, train_loss: 0.8580, test_loss: 0.9614, test_f1: 0.5183
 epoch: 21, train_loss: 0.8492, test_loss: 0.9304, test_f1: 0.4946
 epoch: 22, train_loss: 0.8499, test_loss: 0.9127, test_f1: 0.5094
 epoch: 23, train_loss: 0.8309, test_loss: 0.8647, test_f1: 0.5416
 epoch: 24, train_loss: 0.8232, test_loss: 0.9631, test_f1: 0.4931
 epoch: 25, train_loss: 0.8139, test_loss: 1.0548, test_f1: 0.4406
 epoch: 26, train_loss: 0.8245, test_loss: 1.1490, test_f1: 0.4311
 epoch: 27, train_loss: 0.8280, test_loss: 1.0116, test_f1: 0.4461
 epoch: 28, train_loss: 0.8095, test_loss: 0.9877, test_f1: 0.4901
 epoch: 29, train_loss: 0.8180, test_loss: 0.9151, test_f1: 0.5217
 epoch: 30, train_loss: 0.8091, test_loss: 1.3165, test_f1: 0.4175
 epoch: 31, train_loss: 0.8004, test_loss: 1.1133, test_f1: 0.4339
 epoch: 32, train_loss: 0.7977, test_loss: 0.9452, test_f1: 0.5000
 epoch: 33, train_loss: 0.7925, test_loss: 0.8583, test_f1: 0.5319
 epoch: 34, train_loss: 0.8118, test_loss: 0.9445, test_f1: 0.5002
 epoch: 35, train_loss: 0.8010, test_loss: 0.9510, test_f1: 0.5039
 epoch: 36, train_loss: 0.7892, test_loss: 0.9159, test_f1: 0.5226
 epoch: 37, train_loss: 0.8005, test_loss: 1.0378, test_f1: 0.4705
 epoch: 38, train_loss: 0.7730, test_loss: 1.0034, test_f1: 0.5193
 epoch: 39, train_loss: 0.7855, test_loss: 0.9551, test_f1: 0.5079
 epoch: 40, train_loss: 0.7769, test_loss: 0.9602, test_f1: 0.5069
 epoch: 41, train_loss: 0.7640, test_loss: 0.9635, test_f1: 0.5402
 epoch: 42, train_loss: 0.7906, test_loss: 0.9356, test_f1: 0.5105
 epoch: 43, train_loss: 0.7775, test_loss: 0.9114, test_f1: 0.5269
 epoch: 44, train_loss: 0.7510, test_loss: 0.9139, test_f1: 0.5277
 epoch: 45, train_loss: 0.7398, test_loss: 0.8723, test_f1: 0.5556
 epoch: 46, train_loss: 0.7742, test_loss: 0.8809, test_f1: 0.5349
 epoch: 47, train_loss: 0.7583, test_loss: 0.9219, test_f1: 0.5400
 epoch: 48, train_loss: 0.7478, test_loss: 0.9383, test_f1: 0.5364
 epoch: 49, train_loss: 0.7530, test_loss: 1.0030, test_f1: 0.5065
 epoch: 50, train_loss: 0.7529, test_loss: 0.9816, test_f1: 0.5238
 epoch: 51, train_loss: 0.7471, test_loss: 0.9481, test_f1: 0.5173
 epoch: 52, train_loss: 0.7122, test_loss: 0.9303, test_f1: 0.5244
 epoch: 53, train_loss: 0.7076, test_loss: 1.0249, test_f1: 0.5174
 epoch: 54, train_loss: 0.7130, test_loss: 0.9291, test_f1: 0.5450
 epoch: 55, train_loss: 0.7167, test_loss: 0.9382, test_f1: 0.5222
 epoch: 56, train_loss: 0.7017, test_loss: 0.8826, test_f1: 0.5640
 epoch: 57, train_loss: 0.6950, test_loss: 1.0410, test_f1: 0.4939
 epoch: 58, train_loss: 0.7247, test_loss: 0.9171, test_f1: 0.5573
 epoch: 59, train_loss: 0.6969, test_loss: 0.9180, test_f1: 0.5753
 epoch: 60, train_loss: 0.6977, test_loss: 0.9585, test_f1: 0.5311
 epoch: 61, train_loss: 0.6985, test_loss: 0.9255, test_f1: 0.5532
 epoch: 62, train_loss: 0.7000, test_loss: 0.9766, test_f1: 0.5454
 epoch: 63, train_loss: 0.6909, test_loss: 0.9018, test_f1: 0.5593
 epoch: 64, train_loss: 0.6967, test_loss: 1.0234, test_f1: 0.5007
 epoch: 65, train_loss: 0.6829, test_loss: 0.9013, test_f1: 0.5547
 epoch: 66, train_loss: 0.6913, test_loss: 1.0220, test_f1: 0.5325
 epoch: 67, train_loss: 0.6930, test_loss: 0.9690, test_f1: 0.5633
 epoch: 68, train_loss: 0.6751, test_loss: 1.1063, test_f1: 0.5296
 epoch: 69, train_loss: 0.6837, test_loss: 0.8958, test_f1: 0.6094
 epoch: 70, train_loss: 0.6872, test_loss: 0.9289, test_f1: 0.5821
 epoch: 71, train_loss: 0.6816, test_loss: 1.1572, test_f1: 0.4654
 epoch: 72, train_loss: 0.6985, test_loss: 0.9156, test_f1: 0.5515
 epoch: 73, train_loss: 0.6819, test_loss: 0.9765, test_f1: 0.5303
 epoch: 74, train_loss: 0.6919, test_loss: 1.0237, test_f1: 0.5280
 epoch: 75, train_loss: 0.6797, test_loss: 0.9488, test_f1: 0.5699
 epoch: 76, train_loss: 0.6705, test_loss: 0.9212, test_f1: 0.5722
 epoch: 77, train_loss: 0.6749, test_loss: 0.9117, test_f1: 0.6002
 epoch: 78, train_loss: 0.6717, test_loss: 1.0381, test_f1: 0.5518
 epoch: 79, train_loss: 0.6689, test_loss: 0.9411, test_f1: 0.5807
 epoch: 80, train_loss: 0.6770, test_loss: 0.9526, test_f1: 0.5731
 epoch: 81, train_loss: 0.6695, test_loss: 1.0448, test_f1: 0.5318
 epoch: 82, train_loss: 0.6737, test_loss: 1.1204, test_f1: 0.5208
 epoch: 83, train_loss: 0.6729, test_loss: 1.0266, test_f1: 0.5542
 epoch: 84, train_loss: 0.6678, test_loss: 0.9469, test_f1: 0.5595
 epoch: 85, train_loss: 0.6505, test_loss: 0.9964, test_f1: 0.5665
 epoch: 86, train_loss: 0.6593, test_loss: 0.9375, test_f1: 0.5471
 epoch: 87, train_loss: 0.6652, test_loss: 1.1127, test_f1: 0.5436
 epoch: 88, train_loss: 0.6713, test_loss: 0.9433, test_f1: 0.5902
 epoch: 89, train_loss: 0.6476, test_loss: 0.9303, test_f1: 0.6034
 epoch: 90, train_loss: 0.6557, test_loss: 0.9700, test_f1: 0.5634
 epoch: 91, train_loss: 0.6656, test_loss: 1.0158, test_f1: 0.5781
 epoch: 92, train_loss: 0.6600, test_loss: 0.9672, test_f1: 0.6023
 epoch: 93, train_loss: 0.6568, test_loss: 0.9471, test_f1: 0.6208
 epoch: 94, train_loss: 0.6645, test_loss: 0.9415, test_f1: 0.5747
 epoch: 95, train_loss: 0.6481, test_loss: 1.0383, test_f1: 0.5745
 epoch: 96, train_loss: 0.6482, test_loss: 0.9821, test_f1: 0.5724
 epoch: 97, train_loss: 0.6586, test_loss: 1.0030, test_f1: 0.5689
 epoch: 98, train_loss: 0.6574, test_loss: 0.9290, test_f1: 0.5899
 epoch: 99, train_loss: 0.6486, test_loss: 0.9414, test_f1: 0.5702
##################ITERATION #7 ****************************************
 epoch: 0, train_loss: 1.2685, test_loss: 1.2478, test_f1: 0.3586
 epoch: 1, train_loss: 1.0737, test_loss: 1.0485, test_f1: 0.5150
 epoch: 2, train_loss: 1.0321, test_loss: 1.0707, test_f1: 0.5135
 epoch: 3, train_loss: 1.0195, test_loss: 0.9919, test_f1: 0.5300
 epoch: 4, train_loss: 0.9886, test_loss: 1.1140, test_f1: 0.4556
 epoch: 5, train_loss: 0.9595, test_loss: 1.0127, test_f1: 0.5299
 epoch: 6, train_loss: 0.9522, test_loss: 0.9712, test_f1: 0.4871
 epoch: 7, train_loss: 0.9597, test_loss: 1.0686, test_f1: 0.4247
 epoch: 8, train_loss: 0.9371, test_loss: 0.9017, test_f1: 0.5077
 epoch: 9, train_loss: 0.9170, test_loss: 0.9477, test_f1: 0.5063
 epoch: 10, train_loss: 0.9200, test_loss: 0.9384, test_f1: 0.4940
 epoch: 11, train_loss: 0.9137, test_loss: 0.9535, test_f1: 0.5073
 epoch: 12, train_loss: 0.8930, test_loss: 0.9115, test_f1: 0.5182
 epoch: 13, train_loss: 0.8930, test_loss: 0.9756, test_f1: 0.5024
 epoch: 14, train_loss: 0.8840, test_loss: 1.0280, test_f1: 0.4891
 epoch: 15, train_loss: 0.8712, test_loss: 0.8598, test_f1: 0.5212
 epoch: 16, train_loss: 0.8639, test_loss: 0.9934, test_f1: 0.4997
 epoch: 17, train_loss: 0.8705, test_loss: 0.9634, test_f1: 0.4920
 epoch: 18, train_loss: 0.8682, test_loss: 0.9271, test_f1: 0.5245
 epoch: 19, train_loss: 0.8559, test_loss: 1.0767, test_f1: 0.4777
 epoch: 20, train_loss: 0.8703, test_loss: 0.8864, test_f1: 0.5127
 epoch: 21, train_loss: 0.8447, test_loss: 1.2180, test_f1: 0.4560
 epoch: 22, train_loss: 0.8432, test_loss: 0.9086, test_f1: 0.5190
 epoch: 23, train_loss: 0.8416, test_loss: 0.9061, test_f1: 0.5199
 epoch: 24, train_loss: 0.8391, test_loss: 0.9081, test_f1: 0.5807
 epoch: 25, train_loss: 0.8370, test_loss: 0.9993, test_f1: 0.5142
 epoch: 26, train_loss: 0.8376, test_loss: 0.8974, test_f1: 0.5191
 epoch: 27, train_loss: 0.8304, test_loss: 0.9008, test_f1: 0.5145
 epoch: 28, train_loss: 0.8404, test_loss: 0.9812, test_f1: 0.4849
 epoch: 29, train_loss: 0.8271, test_loss: 1.0852, test_f1: 0.4766
 epoch: 30, train_loss: 0.8310, test_loss: 0.9139, test_f1: 0.5259
 epoch: 31, train_loss: 0.8335, test_loss: 0.9794, test_f1: 0.5095
 epoch: 32, train_loss: 0.8064, test_loss: 1.0044, test_f1: 0.4819
 epoch: 33, train_loss: 0.8140, test_loss: 1.0310, test_f1: 0.4815
 epoch: 34, train_loss: 0.8087, test_loss: 0.9135, test_f1: 0.5147
 epoch: 35, train_loss: 0.8061, test_loss: 0.9662, test_f1: 0.5082
 epoch: 36, train_loss: 0.8154, test_loss: 1.0021, test_f1: 0.5038
 epoch: 37, train_loss: 0.8086, test_loss: 0.8251, test_f1: 0.5438
 epoch: 38, train_loss: 0.7975, test_loss: 1.0513, test_f1: 0.4795
 epoch: 39, train_loss: 0.8071, test_loss: 0.9012, test_f1: 0.5141
 epoch: 40, train_loss: 0.7978, test_loss: 0.8359, test_f1: 0.5523
 epoch: 41, train_loss: 0.7840, test_loss: 0.8749, test_f1: 0.5343
 epoch: 42, train_loss: 0.7912, test_loss: 0.9892, test_f1: 0.4918
 epoch: 43, train_loss: 0.8054, test_loss: 0.8673, test_f1: 0.5454
 epoch: 44, train_loss: 0.8081, test_loss: 0.9853, test_f1: 0.5178
 epoch: 45, train_loss: 0.8052, test_loss: 0.9928, test_f1: 0.4845
 epoch: 46, train_loss: 0.7950, test_loss: 0.9076, test_f1: 0.5248
 epoch: 47, train_loss: 0.7912, test_loss: 0.8935, test_f1: 0.5204
 epoch: 48, train_loss: 0.7734, test_loss: 0.9471, test_f1: 0.5166
 epoch: 49, train_loss: 0.7845, test_loss: 0.8811, test_f1: 0.5398
 epoch: 50, train_loss: 0.7727, test_loss: 0.8513, test_f1: 0.5371
 epoch: 51, train_loss: 0.7488, test_loss: 0.8460, test_f1: 0.5496
 epoch: 52, train_loss: 0.7430, test_loss: 0.8420, test_f1: 0.5294
 epoch: 53, train_loss: 0.7341, test_loss: 0.8359, test_f1: 0.5488
 epoch: 54, train_loss: 0.7361, test_loss: 0.9800, test_f1: 0.4831
 epoch: 55, train_loss: 0.7454, test_loss: 0.8338, test_f1: 0.5404
 epoch: 56, train_loss: 0.7272, test_loss: 0.8493, test_f1: 0.5456
 epoch: 57, train_loss: 0.7244, test_loss: 0.8391, test_f1: 0.5387
 epoch: 58, train_loss: 0.7084, test_loss: 0.9142, test_f1: 0.5347
 epoch: 59, train_loss: 0.7299, test_loss: 0.8133, test_f1: 0.5543
 epoch: 60, train_loss: 0.7178, test_loss: 0.8487, test_f1: 0.5630
 epoch: 61, train_loss: 0.7140, test_loss: 0.8855, test_f1: 0.5077
 epoch: 62, train_loss: 0.7057, test_loss: 0.8358, test_f1: 0.5459
 epoch: 63, train_loss: 0.7015, test_loss: 0.8722, test_f1: 0.5165
 epoch: 64, train_loss: 0.7072, test_loss: 0.8498, test_f1: 0.5322
 epoch: 65, train_loss: 0.7022, test_loss: 0.8266, test_f1: 0.5547
 epoch: 66, train_loss: 0.7016, test_loss: 0.9031, test_f1: 0.5315
 epoch: 67, train_loss: 0.6994, test_loss: 0.8222, test_f1: 0.5645
 epoch: 68, train_loss: 0.7176, test_loss: 0.8770, test_f1: 0.5185
 epoch: 69, train_loss: 0.7223, test_loss: 0.9037, test_f1: 0.5428
 epoch: 70, train_loss: 0.7036, test_loss: 0.8591, test_f1: 0.5412
 epoch: 71, train_loss: 0.6895, test_loss: 0.8090, test_f1: 0.5526
 epoch: 72, train_loss: 0.7061, test_loss: 0.9006, test_f1: 0.5369
 epoch: 73, train_loss: 0.7033, test_loss: 0.8996, test_f1: 0.5270
 epoch: 74, train_loss: 0.7009, test_loss: 0.8756, test_f1: 0.5384
 epoch: 75, train_loss: 0.6955, test_loss: 0.8769, test_f1: 0.5321
 epoch: 76, train_loss: 0.7047, test_loss: 0.9012, test_f1: 0.5241
 epoch: 77, train_loss: 0.6819, test_loss: 0.8494, test_f1: 0.5449
 epoch: 78, train_loss: 0.6824, test_loss: 0.8160, test_f1: 0.5848
 epoch: 79, train_loss: 0.6944, test_loss: 0.9346, test_f1: 0.5110
 epoch: 80, train_loss: 0.6935, test_loss: 0.8129, test_f1: 0.5464
 epoch: 81, train_loss: 0.6861, test_loss: 0.8223, test_f1: 0.5657
 epoch: 82, train_loss: 0.6830, test_loss: 1.1265, test_f1: 0.5132
 epoch: 83, train_loss: 0.6950, test_loss: 0.8356, test_f1: 0.5514
 epoch: 84, train_loss: 0.6985, test_loss: 0.8555, test_f1: 0.5438
 epoch: 85, train_loss: 0.6904, test_loss: 0.8851, test_f1: 0.5349
 epoch: 86, train_loss: 0.6679, test_loss: 0.8393, test_f1: 0.5435
 epoch: 87, train_loss: 0.6749, test_loss: 0.8948, test_f1: 0.5278
 epoch: 88, train_loss: 0.6813, test_loss: 0.8738, test_f1: 0.5319
 epoch: 89, train_loss: 0.6864, test_loss: 0.8571, test_f1: 0.5541
 epoch: 90, train_loss: 0.6730, test_loss: 0.8903, test_f1: 0.5068
 epoch: 91, train_loss: 0.6781, test_loss: 0.8451, test_f1: 0.5528
 epoch: 92, train_loss: 0.6867, test_loss: 0.8501, test_f1: 0.5448
 epoch: 93, train_loss: 0.6720, test_loss: 0.8238, test_f1: 0.5585
 epoch: 94, train_loss: 0.6583, test_loss: 0.9117, test_f1: 0.5254
 epoch: 95, train_loss: 0.6958, test_loss: 0.8352, test_f1: 0.5856
 epoch: 96, train_loss: 0.6641, test_loss: 0.8252, test_f1: 0.5625
 epoch: 97, train_loss: 0.6695, test_loss: 0.8153, test_f1: 0.5698
 epoch: 98, train_loss: 0.6701, test_loss: 0.8854, test_f1: 0.5294
 epoch: 99, train_loss: 0.6658, test_loss: 0.8860, test_f1: 0.5516
##################ITERATION #8 ****************************************
 epoch: 0, train_loss: 1.2574, test_loss: 1.1743, test_f1: 0.3288
 epoch: 1, train_loss: 1.0383, test_loss: 1.0946, test_f1: 0.4124
 epoch: 2, train_loss: 1.0252, test_loss: 1.0579, test_f1: 0.5110
 epoch: 3, train_loss: 0.9875, test_loss: 1.0562, test_f1: 0.4663
 epoch: 4, train_loss: 0.9679, test_loss: 1.0493, test_f1: 0.4861
 epoch: 5, train_loss: 0.9665, test_loss: 0.9643, test_f1: 0.5007
 epoch: 6, train_loss: 0.9385, test_loss: 0.9865, test_f1: 0.4832
 epoch: 7, train_loss: 0.9126, test_loss: 0.9378, test_f1: 0.5236
 epoch: 8, train_loss: 0.8852, test_loss: 0.9360, test_f1: 0.5058
 epoch: 9, train_loss: 0.8975, test_loss: 1.0362, test_f1: 0.4704
 epoch: 10, train_loss: 0.8819, test_loss: 0.8643, test_f1: 0.5259
 epoch: 11, train_loss: 0.8686, test_loss: 0.9756, test_f1: 0.4867
 epoch: 12, train_loss: 0.8583, test_loss: 1.1168, test_f1: 0.4825
 epoch: 13, train_loss: 0.8638, test_loss: 0.9355, test_f1: 0.5119
 epoch: 14, train_loss: 0.8733, test_loss: 0.9471, test_f1: 0.5078
 epoch: 15, train_loss: 0.8444, test_loss: 0.9618, test_f1: 0.5091
 epoch: 16, train_loss: 0.8354, test_loss: 0.9085, test_f1: 0.5245
 epoch: 17, train_loss: 0.8410, test_loss: 0.9487, test_f1: 0.5162
 epoch: 18, train_loss: 0.8382, test_loss: 0.8898, test_f1: 0.5275
 epoch: 19, train_loss: 0.8253, test_loss: 0.9245, test_f1: 0.5318
 epoch: 20, train_loss: 0.8010, test_loss: 0.9210, test_f1: 0.5412
 epoch: 21, train_loss: 0.8029, test_loss: 0.9485, test_f1: 0.5208
 epoch: 22, train_loss: 0.8011, test_loss: 0.9374, test_f1: 0.5122
 epoch: 23, train_loss: 0.8113, test_loss: 1.1983, test_f1: 0.4684
 epoch: 24, train_loss: 0.8312, test_loss: 0.9501, test_f1: 0.5243
 epoch: 25, train_loss: 0.7962, test_loss: 0.9498, test_f1: 0.5232
 epoch: 26, train_loss: 0.8118, test_loss: 1.0591, test_f1: 0.5066
 epoch: 27, train_loss: 0.7924, test_loss: 1.0315, test_f1: 0.5384
 epoch: 28, train_loss: 0.7853, test_loss: 1.0686, test_f1: 0.5016
 epoch: 29, train_loss: 0.7768, test_loss: 0.8492, test_f1: 0.5467
 epoch: 30, train_loss: 0.7758, test_loss: 0.9102, test_f1: 0.5414
 epoch: 31, train_loss: 0.7680, test_loss: 0.9913, test_f1: 0.5480
 epoch: 32, train_loss: 0.7733, test_loss: 0.9434, test_f1: 0.5297
 epoch: 33, train_loss: 0.7680, test_loss: 0.9398, test_f1: 0.5252
 epoch: 34, train_loss: 0.7831, test_loss: 0.9206, test_f1: 0.5338
 epoch: 35, train_loss: 0.7784, test_loss: 0.9982, test_f1: 0.5269
 epoch: 36, train_loss: 0.7839, test_loss: 1.1214, test_f1: 0.5076
 epoch: 37, train_loss: 0.7678, test_loss: 0.9224, test_f1: 0.5439
 epoch: 38, train_loss: 0.7616, test_loss: 0.9923, test_f1: 0.5343
 epoch: 39, train_loss: 0.7586, test_loss: 0.9436, test_f1: 0.5533
 epoch: 40, train_loss: 0.7649, test_loss: 0.9765, test_f1: 0.5306
 epoch: 41, train_loss: 0.7637, test_loss: 0.9101, test_f1: 0.5534
 epoch: 42, train_loss: 0.7413, test_loss: 0.9163, test_f1: 0.5593
 epoch: 43, train_loss: 0.7454, test_loss: 0.9605, test_f1: 0.5446
 epoch: 44, train_loss: 0.7549, test_loss: 0.9322, test_f1: 0.5519
 epoch: 45, train_loss: 0.7321, test_loss: 0.9208, test_f1: 0.5688
 epoch: 46, train_loss: 0.7535, test_loss: 0.9409, test_f1: 0.5392
 epoch: 47, train_loss: 0.7514, test_loss: 0.9740, test_f1: 0.5409
 epoch: 48, train_loss: 0.7597, test_loss: 0.9609, test_f1: 0.5307
 epoch: 49, train_loss: 0.7455, test_loss: 0.9558, test_f1: 0.6036
 epoch: 50, train_loss: 0.7392, test_loss: 0.9896, test_f1: 0.5329
 epoch: 51, train_loss: 0.7159, test_loss: 0.9360, test_f1: 0.5662
 epoch: 52, train_loss: 0.7037, test_loss: 0.9957, test_f1: 0.5559
 epoch: 53, train_loss: 0.6905, test_loss: 0.9362, test_f1: 0.5583
 epoch: 54, train_loss: 0.6963, test_loss: 0.9461, test_f1: 0.5545
 epoch: 55, train_loss: 0.6842, test_loss: 0.9468, test_f1: 0.5894
 epoch: 56, train_loss: 0.6797, test_loss: 0.9580, test_f1: 0.5604
 epoch: 57, train_loss: 0.6876, test_loss: 0.9801, test_f1: 0.5832
 epoch: 58, train_loss: 0.6792, test_loss: 0.9334, test_f1: 0.5895
 epoch: 59, train_loss: 0.6902, test_loss: 0.9314, test_f1: 0.5945
 epoch: 60, train_loss: 0.6748, test_loss: 0.9313, test_f1: 0.5585
 epoch: 61, train_loss: 0.6878, test_loss: 0.9423, test_f1: 0.5975
 epoch: 62, train_loss: 0.6808, test_loss: 0.9130, test_f1: 0.5843
 epoch: 63, train_loss: 0.6842, test_loss: 0.9354, test_f1: 0.5683
 epoch: 64, train_loss: 0.6769, test_loss: 0.9322, test_f1: 0.5754
 epoch: 65, train_loss: 0.6963, test_loss: 0.9505, test_f1: 0.5636
 epoch: 66, train_loss: 0.6780, test_loss: 0.9257, test_f1: 0.5609
 epoch: 67, train_loss: 0.6781, test_loss: 0.9024, test_f1: 0.5785
 epoch: 68, train_loss: 0.6746, test_loss: 0.9958, test_f1: 0.5481
 epoch: 69, train_loss: 0.6682, test_loss: 0.9228, test_f1: 0.5896
 epoch: 70, train_loss: 0.6712, test_loss: 0.9269, test_f1: 0.5530
 epoch: 71, train_loss: 0.6679, test_loss: 0.9419, test_f1: 0.5619
 epoch: 72, train_loss: 0.6682, test_loss: 0.9129, test_f1: 0.5973
 epoch: 73, train_loss: 0.6881, test_loss: 0.9432, test_f1: 0.5495
 epoch: 74, train_loss: 0.6779, test_loss: 0.9292, test_f1: 0.6173
 epoch: 75, train_loss: 0.6680, test_loss: 0.9320, test_f1: 0.5807
 epoch: 76, train_loss: 0.6699, test_loss: 1.0275, test_f1: 0.5614
 epoch: 77, train_loss: 0.6615, test_loss: 0.8993, test_f1: 0.5680
 epoch: 78, train_loss: 0.6643, test_loss: 0.9015, test_f1: 0.6233
 epoch: 79, train_loss: 0.6611, test_loss: 0.9332, test_f1: 0.6074
 epoch: 80, train_loss: 0.6698, test_loss: 0.9267, test_f1: 0.5949
 epoch: 81, train_loss: 0.6485, test_loss: 0.8995, test_f1: 0.5921
 epoch: 82, train_loss: 0.6613, test_loss: 0.9138, test_f1: 0.5998
 epoch: 83, train_loss: 0.6497, test_loss: 0.9853, test_f1: 0.5689
 epoch: 84, train_loss: 0.6599, test_loss: 0.9246, test_f1: 0.6086
 epoch: 85, train_loss: 0.6608, test_loss: 0.9260, test_f1: 0.5579
 epoch: 86, train_loss: 0.6576, test_loss: 0.9359, test_f1: 0.5632
 epoch: 87, train_loss: 0.6720, test_loss: 0.8686, test_f1: 0.5945
 epoch: 88, train_loss: 0.6524, test_loss: 0.9385, test_f1: 0.5476
 epoch: 89, train_loss: 0.6372, test_loss: 0.9739, test_f1: 0.6115
 epoch: 90, train_loss: 0.6688, test_loss: 0.9531, test_f1: 0.5714
 epoch: 91, train_loss: 0.6570, test_loss: 0.9679, test_f1: 0.6169
 epoch: 92, train_loss: 0.6391, test_loss: 0.9498, test_f1: 0.6007
 epoch: 93, train_loss: 0.6495, test_loss: 0.8955, test_f1: 0.6218
 epoch: 94, train_loss: 0.6509, test_loss: 0.9514, test_f1: 0.5813
 epoch: 95, train_loss: 0.6425, test_loss: 0.9835, test_f1: 0.5714
 epoch: 96, train_loss: 0.6407, test_loss: 0.9137, test_f1: 0.6135
 epoch: 97, train_loss: 0.6334, test_loss: 0.9014, test_f1: 0.5933
 epoch: 98, train_loss: 0.6449, test_loss: 0.9954, test_f1: 0.5470
 epoch: 99, train_loss: 0.6428, test_loss: 0.9293, test_f1: 0.5992
##################ITERATION #9 ****************************************
 epoch: 0, train_loss: 1.1937, test_loss: 1.1057, test_f1: 0.3773
 epoch: 1, train_loss: 1.0484, test_loss: 1.0015, test_f1: 0.5247
 epoch: 2, train_loss: 1.0270, test_loss: 1.0501, test_f1: 0.4440
 epoch: 3, train_loss: 1.0209, test_loss: 1.4752, test_f1: 0.3481
 epoch: 4, train_loss: 0.9882, test_loss: 1.0078, test_f1: 0.4140
 epoch: 5, train_loss: 0.9686, test_loss: 0.9846, test_f1: 0.4788
 epoch: 6, train_loss: 0.9593, test_loss: 1.0896, test_f1: 0.4931
 epoch: 7, train_loss: 0.9396, test_loss: 1.0602, test_f1: 0.4638
 epoch: 8, train_loss: 0.9325, test_loss: 0.9457, test_f1: 0.5320
 epoch: 9, train_loss: 0.9170, test_loss: 0.9443, test_f1: 0.5095
 epoch: 10, train_loss: 0.9085, test_loss: 1.3838, test_f1: 0.3992
 epoch: 11, train_loss: 0.9167, test_loss: 0.9517, test_f1: 0.5736
 epoch: 12, train_loss: 0.9078, test_loss: 1.0919, test_f1: 0.4805
 epoch: 13, train_loss: 0.8807, test_loss: 0.9484, test_f1: 0.5397
 epoch: 14, train_loss: 0.8672, test_loss: 0.9468, test_f1: 0.5165
 epoch: 15, train_loss: 0.8788, test_loss: 0.9006, test_f1: 0.5407
 epoch: 16, train_loss: 0.8791, test_loss: 0.9048, test_f1: 0.5285
 epoch: 17, train_loss: 0.8560, test_loss: 0.9196, test_f1: 0.5106
 epoch: 18, train_loss: 0.8488, test_loss: 0.8906, test_f1: 0.5619
 epoch: 19, train_loss: 0.8434, test_loss: 0.8623, test_f1: 0.5451
 epoch: 20, train_loss: 0.8334, test_loss: 0.9727, test_f1: 0.5171
 epoch: 21, train_loss: 0.8594, test_loss: 1.0523, test_f1: 0.4796
 epoch: 22, train_loss: 0.8501, test_loss: 0.9115, test_f1: 0.5150
 epoch: 23, train_loss: 0.8359, test_loss: 0.8986, test_f1: 0.5271
 epoch: 24, train_loss: 0.8370, test_loss: 0.8707, test_f1: 0.5266
 epoch: 25, train_loss: 0.8200, test_loss: 0.9106, test_f1: 0.5301
 epoch: 26, train_loss: 0.8451, test_loss: 0.8864, test_f1: 0.5211
 epoch: 27, train_loss: 0.8155, test_loss: 0.9365, test_f1: 0.5398
 epoch: 28, train_loss: 0.8028, test_loss: 0.9270, test_f1: 0.5301
 epoch: 29, train_loss: 0.8153, test_loss: 1.2056, test_f1: 0.4783
 epoch: 30, train_loss: 0.8178, test_loss: 0.8613, test_f1: 0.5451
 epoch: 31, train_loss: 0.8173, test_loss: 0.9093, test_f1: 0.5292
 epoch: 32, train_loss: 0.7952, test_loss: 0.9343, test_f1: 0.5495
 epoch: 33, train_loss: 0.8094, test_loss: 0.8591, test_f1: 0.5461
 epoch: 34, train_loss: 0.7989, test_loss: 0.9742, test_f1: 0.5252
 epoch: 35, train_loss: 0.8049, test_loss: 1.0370, test_f1: 0.5086
 epoch: 36, train_loss: 0.7979, test_loss: 0.8647, test_f1: 0.5549
 epoch: 37, train_loss: 0.7881, test_loss: 0.9194, test_f1: 0.5333
 epoch: 38, train_loss: 0.8003, test_loss: 1.1399, test_f1: 0.5034
 epoch: 39, train_loss: 0.7905, test_loss: 0.8635, test_f1: 0.5367
 epoch: 40, train_loss: 0.7839, test_loss: 0.8850, test_f1: 0.5496
 epoch: 41, train_loss: 0.7844, test_loss: 0.8755, test_f1: 0.5488
 epoch: 42, train_loss: 0.7778, test_loss: 0.8689, test_f1: 0.5547
 epoch: 43, train_loss: 0.7809, test_loss: 0.9335, test_f1: 0.5159
 epoch: 44, train_loss: 0.7737, test_loss: 0.9087, test_f1: 0.5678
 epoch: 45, train_loss: 0.7758, test_loss: 0.9410, test_f1: 0.5257
 epoch: 46, train_loss: 0.7734, test_loss: 0.9924, test_f1: 0.5366
 epoch: 47, train_loss: 0.8042, test_loss: 1.0001, test_f1: 0.5093
 epoch: 48, train_loss: 0.7924, test_loss: 0.9278, test_f1: 0.5455
 epoch: 49, train_loss: 0.7752, test_loss: 0.9595, test_f1: 0.5460
 epoch: 50, train_loss: 0.7665, test_loss: 0.9239, test_f1: 0.5632
 epoch: 51, train_loss: 0.7570, test_loss: 0.8855, test_f1: 0.5660
 epoch: 52, train_loss: 0.7308, test_loss: 0.8978, test_f1: 0.5578
 epoch: 53, train_loss: 0.7356, test_loss: 0.8887, test_f1: 0.5754
 epoch: 54, train_loss: 0.7373, test_loss: 0.8993, test_f1: 0.5856
 epoch: 55, train_loss: 0.7301, test_loss: 0.8996, test_f1: 0.5782
 epoch: 56, train_loss: 0.7276, test_loss: 0.8775, test_f1: 0.5746
 epoch: 57, train_loss: 0.7250, test_loss: 0.9179, test_f1: 0.5730
 epoch: 58, train_loss: 0.7180, test_loss: 0.9082, test_f1: 0.5634
 epoch: 59, train_loss: 0.7145, test_loss: 0.8965, test_f1: 0.5809
 epoch: 60, train_loss: 0.7283, test_loss: 0.8745, test_f1: 0.5703
 epoch: 61, train_loss: 0.7165, test_loss: 0.9288, test_f1: 0.5510
 epoch: 62, train_loss: 0.7131, test_loss: 0.9746, test_f1: 0.5795
 epoch: 63, train_loss: 0.7152, test_loss: 0.8818, test_f1: 0.5749
 epoch: 64, train_loss: 0.7107, test_loss: 0.9682, test_f1: 0.5741
 epoch: 65, train_loss: 0.7206, test_loss: 0.9478, test_f1: 0.5571
 epoch: 66, train_loss: 0.7035, test_loss: 0.9557, test_f1: 0.5746
 epoch: 67, train_loss: 0.7105, test_loss: 0.9388, test_f1: 0.5857
 epoch: 68, train_loss: 0.7110, test_loss: 0.9449, test_f1: 0.5735
 epoch: 69, train_loss: 0.7202, test_loss: 0.9431, test_f1: 0.5848
 epoch: 70, train_loss: 0.7210, test_loss: 0.9476, test_f1: 0.5418
 epoch: 71, train_loss: 0.7108, test_loss: 0.9394, test_f1: 0.5687
 epoch: 72, train_loss: 0.7094, test_loss: 0.8809, test_f1: 0.5828
 epoch: 73, train_loss: 0.7067, test_loss: 0.9022, test_f1: 0.5943
 epoch: 74, train_loss: 0.7105, test_loss: 0.9452, test_f1: 0.5747
 epoch: 75, train_loss: 0.7129, test_loss: 0.9048, test_f1: 0.5670
 epoch: 76, train_loss: 0.7085, test_loss: 0.8833, test_f1: 0.5860
 epoch: 77, train_loss: 0.6995, test_loss: 0.9021, test_f1: 0.5886
 epoch: 78, train_loss: 0.7060, test_loss: 1.0531, test_f1: 0.5273
 epoch: 79, train_loss: 0.6990, test_loss: 0.9177, test_f1: 0.5987
 epoch: 80, train_loss: 0.7016, test_loss: 0.9101, test_f1: 0.5797
 epoch: 81, train_loss: 0.6883, test_loss: 0.9089, test_f1: 0.6079
 epoch: 82, train_loss: 0.6981, test_loss: 0.8789, test_f1: 0.6134
 epoch: 83, train_loss: 0.7002, test_loss: 0.9164, test_f1: 0.5928
 epoch: 84, train_loss: 0.7098, test_loss: 0.8949, test_f1: 0.5600
 epoch: 85, train_loss: 0.6879, test_loss: 0.9770, test_f1: 0.5818
 epoch: 86, train_loss: 0.7185, test_loss: 0.9525, test_f1: 0.5973
 epoch: 87, train_loss: 0.6887, test_loss: 0.9280, test_f1: 0.5724
 epoch: 88, train_loss: 0.6926, test_loss: 0.9008, test_f1: 0.5989
 epoch: 89, train_loss: 0.6846, test_loss: 0.8777, test_f1: 0.5950
 epoch: 90, train_loss: 0.6890, test_loss: 0.9224, test_f1: 0.5762
 epoch: 91, train_loss: 0.6869, test_loss: 0.9319, test_f1: 0.5846
 epoch: 92, train_loss: 0.6894, test_loss: 0.9182, test_f1: 0.6064
 epoch: 93, train_loss: 0.6952, test_loss: 0.9620, test_f1: 0.6060
 epoch: 94, train_loss: 0.6877, test_loss: 0.9415, test_f1: 0.5771
 epoch: 95, train_loss: 0.6747, test_loss: 0.8642, test_f1: 0.6050
 epoch: 96, train_loss: 0.6852, test_loss: 0.8953, test_f1: 0.5881
 epoch: 97, train_loss: 0.6735, test_loss: 0.9096, test_f1: 0.5862
 epoch: 98, train_loss: 0.6834, test_loss: 0.8945, test_f1: 0.6075
 epoch: 99, train_loss: 0.6770, test_loss: 0.8965, test_f1: 0.5968

Training completed in 491.28 seconds
Best F1: 0.6327 at epoch 78
Mean F1 across iterations: 0.6111  0.0184
========================FINAL RESULTS================================
FEGIN weighted F1: 0.6327  0.0184
python main.py --data ltspice_examples --representation component_pin --model FEGIN --layers 3 --hiddens 16 --batch_size 128 --lr 0.01 --emb_size 250 --epochs 100 --save_appendix component_pin_L3_H16_BS128_LR0.01_E250 --no_val
-----



STDERR:
  File "main.py", line 370, in <module>
    main()
  File "main.py", line 254, in main
    dataset = dataset_class(
  File "/home/philip/projects/ltspice_examples_code_repo/Circuit-Completion-Using-GNNs/component_classification_with_link_prediction_head/evaluation/FEGIN/kernel/circuit_datasets.py", line 15, in __init__
    self.data, self.slices = torch.load(self.processed_paths[0])
  File "/home/philip/.local/lib/python3.8/site-packages/torch/serialization.py", line 1040, in load
    warnings.warn(
  File "/usr/lib/python3.8/warnings.py", line 109, in _showwarnmsg
    sw(msg.message, msg.category, msg.filename, msg.lineno,
  File "main.py", line 47, in warn_with_traceback
    traceback.print_stack(file=log)
/home/philip/projects/ltspice_examples_code_repo/Circuit-Completion-Using-GNNs/component_classification_with_link_prediction_head/evaluation/FEGIN/kernel/circuit_datasets.py:15: FutureWarning: You are using `torch.load` with `weights_only=False` (the current default value), which uses the default pickle module implicitly. It is possible to construct malicious pickle data which will execute arbitrary code during unpickling (See https://github.com/pytorch/pytorch/blob/main/SECURITY.md#untrusted-models for more details). In a future release, the default value for `weights_only` will be flipped to `True`. This limits the functions that could be executed during unpickling. Arbitrary objects will no longer be allowed to be loaded via this mode unless they are explicitly allowlisted by the user via `torch.serialization.add_safe_globals`. We recommend you start setting `weights_only=True` for any use case where you don't have full control of the loaded file. Please open an issue on GitHub for any issues related to this experimental feature.
  self.data, self.slices = torch.load(self.processed_paths[0])
