STDOUT:
Results will be saved in /home/philip/projects/ltspice_examples_code_repo/Circuit-Completion-Using-GNNs/component_classification_with_link_prediction_head/evaluation/FEGIN/results/model_FEGIN_dataset_ltspice_demos
Command line input: python main.py --data ltspice_demos --representation component_net --model FEGIN --layers 2 --hiddens 128 --batch_size 256 --lr 0.001 --emb_size 250 --epochs 100 --save_appendix component_net_L2_H128_BS256_LR0.001_E250 --no_val
 is saved.
-----
ltspice_demos - FEGIN
Using 2 layers, 128 hidden units, h = 2
Loading component_net representation dataset
ENTERED
Training FEGIN on component_net representation
Train: 1565, Test: 383
##################ITERATION #0 ****************************************
 epoch: 0, train_loss: 1.3358, test_loss: 1.3438, test_f1: 0.2281
 epoch: 1, train_loss: 1.2075, test_loss: 1.3094, test_f1: 0.2583
 epoch: 2, train_loss: 1.1608, test_loss: 1.2832, test_f1: 0.2722
 epoch: 3, train_loss: 1.1223, test_loss: 1.2489, test_f1: 0.2723
 epoch: 4, train_loss: 1.0923, test_loss: 1.2099, test_f1: 0.3540
 epoch: 5, train_loss: 1.0482, test_loss: 1.1781, test_f1: 0.4237
 epoch: 6, train_loss: 1.0150, test_loss: 1.1447, test_f1: 0.4146
 epoch: 7, train_loss: 0.9838, test_loss: 1.1198, test_f1: 0.4374
 epoch: 8, train_loss: 0.9553, test_loss: 1.1027, test_f1: 0.4938
 epoch: 9, train_loss: 0.9329, test_loss: 1.0890, test_f1: 0.4721
 epoch: 10, train_loss: 0.9027, test_loss: 1.1089, test_f1: 0.5314
 epoch: 11, train_loss: 0.8881, test_loss: 1.1153, test_f1: 0.5318
 epoch: 12, train_loss: 0.8742, test_loss: 1.0935, test_f1: 0.5380
 epoch: 13, train_loss: 0.8669, test_loss: 1.1389, test_f1: 0.5292
 epoch: 14, train_loss: 0.8606, test_loss: 1.1065, test_f1: 0.5830
 epoch: 15, train_loss: 0.8408, test_loss: 1.1451, test_f1: 0.5199
 epoch: 16, train_loss: 0.8303, test_loss: 1.1445, test_f1: 0.5779
 epoch: 17, train_loss: 0.8355, test_loss: 1.1357, test_f1: 0.5701
 epoch: 18, train_loss: 0.8245, test_loss: 1.0341, test_f1: 0.5391
 epoch: 19, train_loss: 0.8023, test_loss: 0.9984, test_f1: 0.6048
 epoch: 20, train_loss: 0.8012, test_loss: 1.1000, test_f1: 0.5197
 epoch: 21, train_loss: 0.7720, test_loss: 1.1401, test_f1: 0.5345
 epoch: 22, train_loss: 0.7778, test_loss: 1.2024, test_f1: 0.5457
 epoch: 23, train_loss: 0.7637, test_loss: 1.0774, test_f1: 0.5622
 epoch: 24, train_loss: 0.7690, test_loss: 1.1680, test_f1: 0.5490
 epoch: 25, train_loss: 0.7388, test_loss: 1.1188, test_f1: 0.5629
 epoch: 26, train_loss: 0.7265, test_loss: 1.1211, test_f1: 0.5924
 epoch: 27, train_loss: 0.7118, test_loss: 1.1193, test_f1: 0.5591
 epoch: 28, train_loss: 0.7132, test_loss: 1.0622, test_f1: 0.5846
 epoch: 29, train_loss: 0.6828, test_loss: 1.1113, test_f1: 0.5641
 epoch: 30, train_loss: 0.6846, test_loss: 1.0894, test_f1: 0.5449
 epoch: 31, train_loss: 0.6555, test_loss: 1.0517, test_f1: 0.5431
 epoch: 32, train_loss: 0.6543, test_loss: 1.1062, test_f1: 0.5554
 epoch: 33, train_loss: 0.6348, test_loss: 1.1156, test_f1: 0.5789
 epoch: 34, train_loss: 0.6268, test_loss: 1.0644, test_f1: 0.5755
 epoch: 35, train_loss: 0.6123, test_loss: 1.2169, test_f1: 0.5928
 epoch: 36, train_loss: 0.6055, test_loss: 1.1456, test_f1: 0.5698
 epoch: 37, train_loss: 0.5949, test_loss: 1.1125, test_f1: 0.6376
 epoch: 38, train_loss: 0.5993, test_loss: 1.2119, test_f1: 0.6128
 epoch: 39, train_loss: 0.5900, test_loss: 1.1527, test_f1: 0.6041
 epoch: 40, train_loss: 0.6293, test_loss: 1.1723, test_f1: 0.6255
 epoch: 41, train_loss: 0.6153, test_loss: 1.4598, test_f1: 0.4949
 epoch: 42, train_loss: 0.5960, test_loss: 1.2899, test_f1: 0.5638
 epoch: 43, train_loss: 0.5946, test_loss: 1.5341, test_f1: 0.5522
 epoch: 44, train_loss: 0.5766, test_loss: 1.4087, test_f1: 0.5284
 epoch: 45, train_loss: 0.5767, test_loss: 1.3340, test_f1: 0.6037
 epoch: 46, train_loss: 0.5856, test_loss: 1.3423, test_f1: 0.6123
 epoch: 47, train_loss: 0.5617, test_loss: 1.3793, test_f1: 0.5776
 epoch: 48, train_loss: 0.5304, test_loss: 1.2474, test_f1: 0.6104
 epoch: 49, train_loss: 0.5293, test_loss: 1.2410, test_f1: 0.6338
 epoch: 50, train_loss: 0.5896, test_loss: 1.2840, test_f1: 0.6068
 epoch: 51, train_loss: 0.5361, test_loss: 1.3307, test_f1: 0.5707
 epoch: 52, train_loss: 0.4955, test_loss: 1.4270, test_f1: 0.5691
 epoch: 53, train_loss: 0.4930, test_loss: 1.4179, test_f1: 0.5930
 epoch: 54, train_loss: 0.4816, test_loss: 1.3952, test_f1: 0.5939
 epoch: 55, train_loss: 0.4706, test_loss: 1.4210, test_f1: 0.5901
 epoch: 56, train_loss: 0.4646, test_loss: 1.4225, test_f1: 0.5898
 epoch: 57, train_loss: 0.4666, test_loss: 1.3874, test_f1: 0.5930
 epoch: 58, train_loss: 0.4446, test_loss: 1.4889, test_f1: 0.5818
 epoch: 59, train_loss: 0.4425, test_loss: 1.4035, test_f1: 0.5823
 epoch: 60, train_loss: 0.4354, test_loss: 1.3742, test_f1: 0.5963
 epoch: 61, train_loss: 0.4237, test_loss: 1.3754, test_f1: 0.6129
 epoch: 62, train_loss: 0.4076, test_loss: 1.4131, test_f1: 0.6087
 epoch: 63, train_loss: 0.4101, test_loss: 1.4935, test_f1: 0.5949
 epoch: 64, train_loss: 0.4021, test_loss: 1.3666, test_f1: 0.6168
 epoch: 65, train_loss: 0.4049, test_loss: 1.5819, test_f1: 0.5867
 epoch: 66, train_loss: 0.3909, test_loss: 1.5090, test_f1: 0.6320
 epoch: 67, train_loss: 0.3991, test_loss: 1.4761, test_f1: 0.6224
 epoch: 68, train_loss: 0.3792, test_loss: 1.4696, test_f1: 0.6073
 epoch: 69, train_loss: 0.3717, test_loss: 1.5519, test_f1: 0.5883
 epoch: 70, train_loss: 0.3811, test_loss: 1.7059, test_f1: 0.5944
 epoch: 71, train_loss: 0.3578, test_loss: 1.6350, test_f1: 0.6420
 epoch: 72, train_loss: 0.3477, test_loss: 1.5129, test_f1: 0.6289
 epoch: 73, train_loss: 0.3664, test_loss: 1.6291, test_f1: 0.5774
 epoch: 74, train_loss: 0.3692, test_loss: 1.6529, test_f1: 0.6168
 epoch: 75, train_loss: 0.3691, test_loss: 1.6995, test_f1: 0.6154
 epoch: 76, train_loss: 0.3732, test_loss: 1.6222, test_f1: 0.5661
 epoch: 77, train_loss: 0.3661, test_loss: 1.5778, test_f1: 0.6012
 epoch: 78, train_loss: 0.3607, test_loss: 1.5809, test_f1: 0.6066
 epoch: 79, train_loss: 0.3843, test_loss: 1.6345, test_f1: 0.6117
 epoch: 80, train_loss: 0.3551, test_loss: 1.6396, test_f1: 0.6303
 epoch: 81, train_loss: 0.3518, test_loss: 1.6521, test_f1: 0.6174
 epoch: 82, train_loss: 0.3551, test_loss: 1.7543, test_f1: 0.5942
 epoch: 83, train_loss: 0.3662, test_loss: 1.7126, test_f1: 0.5796
 epoch: 84, train_loss: 0.3341, test_loss: 1.6854, test_f1: 0.5813
 epoch: 85, train_loss: 0.3207, test_loss: 1.6993, test_f1: 0.5785
 epoch: 86, train_loss: 0.3125, test_loss: 1.9567, test_f1: 0.5794
 epoch: 87, train_loss: 0.3090, test_loss: 1.8306, test_f1: 0.5611
 epoch: 88, train_loss: 0.3018, test_loss: 1.8758, test_f1: 0.5705
 epoch: 89, train_loss: 0.3088, test_loss: 1.8698, test_f1: 0.6075
 epoch: 90, train_loss: 0.2969, test_loss: 1.8543, test_f1: 0.5828
 epoch: 91, train_loss: 0.3226, test_loss: 1.9794, test_f1: 0.5969
 epoch: 92, train_loss: 0.3391, test_loss: 1.9363, test_f1: 0.5937
 epoch: 93, train_loss: 0.3152, test_loss: 2.0337, test_f1: 0.5772
 epoch: 94, train_loss: 0.3218, test_loss: 1.9034, test_f1: 0.5649
 epoch: 95, train_loss: 0.3181, test_loss: 1.9380, test_f1: 0.5902
 epoch: 96, train_loss: 0.2932, test_loss: 1.9849, test_f1: 0.5913
 epoch: 97, train_loss: 0.3171, test_loss: 1.7665, test_f1: 0.5882
 epoch: 98, train_loss: 0.3179, test_loss: 1.9937, test_f1: 0.6130
 epoch: 99, train_loss: 0.2822, test_loss: 1.8930, test_f1: 0.6135
##################ITERATION #1 ****************************************
 epoch: 0, train_loss: 1.2157, test_loss: 1.3136, test_f1: 0.1365
 epoch: 1, train_loss: 1.0686, test_loss: 1.2924, test_f1: 0.1365
 epoch: 2, train_loss: 1.0090, test_loss: 1.2525, test_f1: 0.1477
 epoch: 3, train_loss: 0.9846, test_loss: 1.1875, test_f1: 0.3346
 epoch: 4, train_loss: 0.9506, test_loss: 1.1342, test_f1: 0.4124
 epoch: 5, train_loss: 0.9233, test_loss: 1.0926, test_f1: 0.4200
 epoch: 6, train_loss: 0.8960, test_loss: 1.0642, test_f1: 0.4969
 epoch: 7, train_loss: 0.8801, test_loss: 1.0417, test_f1: 0.4913
 epoch: 8, train_loss: 0.8668, test_loss: 1.0282, test_f1: 0.4900
 epoch: 9, train_loss: 0.8367, test_loss: 1.0276, test_f1: 0.5098
 epoch: 10, train_loss: 0.8120, test_loss: 1.0400, test_f1: 0.5638
 epoch: 11, train_loss: 0.7813, test_loss: 1.0340, test_f1: 0.5848
 epoch: 12, train_loss: 0.7864, test_loss: 1.0038, test_f1: 0.5547
 epoch: 13, train_loss: 0.7751, test_loss: 1.0673, test_f1: 0.5884
 epoch: 14, train_loss: 0.7803, test_loss: 1.0794, test_f1: 0.5741
 epoch: 15, train_loss: 0.7593, test_loss: 1.1235, test_f1: 0.5645
 epoch: 16, train_loss: 0.7560, test_loss: 1.1370, test_f1: 0.5401
 epoch: 17, train_loss: 0.7324, test_loss: 1.1015, test_f1: 0.5874
 epoch: 18, train_loss: 0.7164, test_loss: 1.0220, test_f1: 0.5917
 epoch: 19, train_loss: 0.7316, test_loss: 1.0607, test_f1: 0.5686
 epoch: 20, train_loss: 0.7188, test_loss: 1.1292, test_f1: 0.5146
 epoch: 21, train_loss: 0.6767, test_loss: 1.1498, test_f1: 0.5854
 epoch: 22, train_loss: 0.6598, test_loss: 1.1093, test_f1: 0.6073
 epoch: 23, train_loss: 0.6490, test_loss: 1.1373, test_f1: 0.5652
 epoch: 24, train_loss: 0.6181, test_loss: 1.1488, test_f1: 0.6022
 epoch: 25, train_loss: 0.6259, test_loss: 1.2233, test_f1: 0.6142
 epoch: 26, train_loss: 0.6269, test_loss: 1.2472, test_f1: 0.5544
 epoch: 27, train_loss: 0.6333, test_loss: 1.1631, test_f1: 0.6030
 epoch: 28, train_loss: 0.6253, test_loss: 1.1997, test_f1: 0.6034
 epoch: 29, train_loss: 0.6103, test_loss: 1.1466, test_f1: 0.6148
 epoch: 30, train_loss: 0.6327, test_loss: 1.2312, test_f1: 0.6067
 epoch: 31, train_loss: 0.5984, test_loss: 1.1831, test_f1: 0.5893
 epoch: 32, train_loss: 0.6133, test_loss: 1.1672, test_f1: 0.5850
 epoch: 33, train_loss: 0.6015, test_loss: 1.0823, test_f1: 0.6253
 epoch: 34, train_loss: 0.5878, test_loss: 1.2318, test_f1: 0.5691
 epoch: 35, train_loss: 0.5731, test_loss: 1.2760, test_f1: 0.6375
 epoch: 36, train_loss: 0.5583, test_loss: 1.3971, test_f1: 0.5819
 epoch: 37, train_loss: 0.5612, test_loss: 1.1171, test_f1: 0.6418
 epoch: 38, train_loss: 0.5386, test_loss: 1.1241, test_f1: 0.6273
 epoch: 39, train_loss: 0.5076, test_loss: 1.2526, test_f1: 0.5832
 epoch: 40, train_loss: 0.5356, test_loss: 1.3102, test_f1: 0.6265
 epoch: 41, train_loss: 0.5093, test_loss: 1.2756, test_f1: 0.6078
 epoch: 42, train_loss: 0.4973, test_loss: 1.4194, test_f1: 0.6386
 epoch: 43, train_loss: 0.4880, test_loss: 1.3755, test_f1: 0.6339
 epoch: 44, train_loss: 0.4874, test_loss: 1.3293, test_f1: 0.6290
 epoch: 45, train_loss: 0.4747, test_loss: 1.4757, test_f1: 0.5475
 epoch: 46, train_loss: 0.4807, test_loss: 1.4975, test_f1: 0.6309
 epoch: 47, train_loss: 0.4945, test_loss: 1.3641, test_f1: 0.5908
 epoch: 48, train_loss: 0.4531, test_loss: 1.3970, test_f1: 0.5965
 epoch: 49, train_loss: 0.4445, test_loss: 1.4222, test_f1: 0.6393
 epoch: 50, train_loss: 0.4595, test_loss: 1.3010, test_f1: 0.6121
 epoch: 51, train_loss: 0.4191, test_loss: 1.3611, test_f1: 0.6133
 epoch: 52, train_loss: 0.4117, test_loss: 1.4708, test_f1: 0.6308
 epoch: 53, train_loss: 0.4025, test_loss: 1.4759, test_f1: 0.6236
 epoch: 54, train_loss: 0.3842, test_loss: 1.5280, test_f1: 0.6348
 epoch: 55, train_loss: 0.3828, test_loss: 1.4625, test_f1: 0.6305
 epoch: 56, train_loss: 0.3692, test_loss: 1.4813, test_f1: 0.6370
 epoch: 57, train_loss: 0.3778, test_loss: 1.5921, test_f1: 0.6304
 epoch: 58, train_loss: 0.3590, test_loss: 1.7231, test_f1: 0.6011
 epoch: 59, train_loss: 0.3851, test_loss: 1.6384, test_f1: 0.6003
 epoch: 60, train_loss: 0.3671, test_loss: 1.5403, test_f1: 0.6058
 epoch: 61, train_loss: 0.3452, test_loss: 1.5724, test_f1: 0.6401
 epoch: 62, train_loss: 0.3569, test_loss: 1.6051, test_f1: 0.6310
 epoch: 63, train_loss: 0.3366, test_loss: 1.5500, test_f1: 0.6346
 epoch: 64, train_loss: 0.3460, test_loss: 1.6207, test_f1: 0.6281
 epoch: 65, train_loss: 0.3459, test_loss: 1.5776, test_f1: 0.6048
 epoch: 66, train_loss: 0.3532, test_loss: 1.6659, test_f1: 0.6488
 epoch: 67, train_loss: 0.3240, test_loss: 1.5609, test_f1: 0.6034
 epoch: 68, train_loss: 0.3237, test_loss: 1.5794, test_f1: 0.6194
 epoch: 69, train_loss: 0.3356, test_loss: 1.7873, test_f1: 0.6133
 epoch: 70, train_loss: 0.3284, test_loss: 1.8241, test_f1: 0.6060
 epoch: 71, train_loss: 0.3434, test_loss: 1.7674, test_f1: 0.5997
 epoch: 72, train_loss: 0.3213, test_loss: 1.7614, test_f1: 0.6308
 epoch: 73, train_loss: 0.3174, test_loss: 1.6553, test_f1: 0.6391
 epoch: 74, train_loss: 0.2984, test_loss: 1.6527, test_f1: 0.6141
 epoch: 75, train_loss: 0.3131, test_loss: 1.8794, test_f1: 0.6249
 epoch: 76, train_loss: 0.2804, test_loss: 1.7813, test_f1: 0.6310
 epoch: 77, train_loss: 0.2835, test_loss: 1.8174, test_f1: 0.6348
 epoch: 78, train_loss: 0.2949, test_loss: 1.7036, test_f1: 0.6194
 epoch: 79, train_loss: 0.3053, test_loss: 1.7359, test_f1: 0.5992
 epoch: 80, train_loss: 0.3106, test_loss: 1.9318, test_f1: 0.6307
 epoch: 81, train_loss: 0.2822, test_loss: 1.9039, test_f1: 0.6170
 epoch: 82, train_loss: 0.2970, test_loss: 1.8757, test_f1: 0.6158
 epoch: 83, train_loss: 0.2900, test_loss: 1.7858, test_f1: 0.6135
 epoch: 84, train_loss: 0.2787, test_loss: 1.7785, test_f1: 0.5881
 epoch: 85, train_loss: 0.2691, test_loss: 1.9780, test_f1: 0.5988
 epoch: 86, train_loss: 0.2557, test_loss: 1.8891, test_f1: 0.6310
 epoch: 87, train_loss: 0.2556, test_loss: 1.7944, test_f1: 0.6125
 epoch: 88, train_loss: 0.2773, test_loss: 2.0540, test_f1: 0.6344
 epoch: 89, train_loss: 0.2611, test_loss: 1.9582, test_f1: 0.6383
 epoch: 90, train_loss: 0.2607, test_loss: 1.9578, test_f1: 0.6170
 epoch: 91, train_loss: 0.2600, test_loss: 2.0109, test_f1: 0.6268
 epoch: 92, train_loss: 0.2630, test_loss: 2.0043, test_f1: 0.6352
 epoch: 93, train_loss: 0.2630, test_loss: 2.2989, test_f1: 0.6348
 epoch: 94, train_loss: 0.2806, test_loss: 2.0681, test_f1: 0.6012
 epoch: 95, train_loss: 0.2702, test_loss: 2.0551, test_f1: 0.6385
 epoch: 96, train_loss: 0.2467, test_loss: 2.1798, test_f1: 0.6261
 epoch: 97, train_loss: 0.2444, test_loss: 2.1209, test_f1: 0.6054
 epoch: 98, train_loss: 0.2384, test_loss: 2.0420, test_f1: 0.6382
 epoch: 99, train_loss: 0.2450, test_loss: 1.8823, test_f1: 0.6438
##################ITERATION #2 ****************************************
 epoch: 0, train_loss: 1.2236, test_loss: 1.3087, test_f1: 0.1365
 epoch: 1, train_loss: 1.0410, test_loss: 1.2859, test_f1: 0.1365
 epoch: 2, train_loss: 0.9929, test_loss: 1.2358, test_f1: 0.3276
 epoch: 3, train_loss: 0.9542, test_loss: 1.1950, test_f1: 0.4134
 epoch: 4, train_loss: 0.9404, test_loss: 1.1579, test_f1: 0.4659
 epoch: 5, train_loss: 0.9216, test_loss: 1.1035, test_f1: 0.5061
 epoch: 6, train_loss: 0.8938, test_loss: 1.0894, test_f1: 0.5118
 epoch: 7, train_loss: 0.8742, test_loss: 1.1038, test_f1: 0.5281
 epoch: 8, train_loss: 0.8577, test_loss: 1.0926, test_f1: 0.5526
 epoch: 9, train_loss: 0.8398, test_loss: 1.0697, test_f1: 0.5778
 epoch: 10, train_loss: 0.8126, test_loss: 1.0621, test_f1: 0.5686
 epoch: 11, train_loss: 0.8101, test_loss: 1.0166, test_f1: 0.5671
 epoch: 12, train_loss: 0.7945, test_loss: 1.0595, test_f1: 0.5727
 epoch: 13, train_loss: 0.8170, test_loss: 1.3667, test_f1: 0.4821
 epoch: 14, train_loss: 0.7958, test_loss: 0.9860, test_f1: 0.6012
 epoch: 15, train_loss: 0.7741, test_loss: 0.9911, test_f1: 0.6531
 epoch: 16, train_loss: 0.7543, test_loss: 1.0464, test_f1: 0.6232
 epoch: 17, train_loss: 0.7547, test_loss: 1.0237, test_f1: 0.6098
 epoch: 18, train_loss: 0.7232, test_loss: 1.1635, test_f1: 0.5648
 epoch: 19, train_loss: 0.7406, test_loss: 1.0730, test_f1: 0.5825
 epoch: 20, train_loss: 0.7058, test_loss: 1.0311, test_f1: 0.6407
 epoch: 21, train_loss: 0.7039, test_loss: 1.0567, test_f1: 0.6175
 epoch: 22, train_loss: 0.6982, test_loss: 1.1002, test_f1: 0.5738
 epoch: 23, train_loss: 0.6879, test_loss: 1.1450, test_f1: 0.5869
 epoch: 24, train_loss: 0.6687, test_loss: 1.1610, test_f1: 0.5647
 epoch: 25, train_loss: 0.6540, test_loss: 1.1444, test_f1: 0.5653
 epoch: 26, train_loss: 0.6562, test_loss: 1.0813, test_f1: 0.6211
 epoch: 27, train_loss: 0.6440, test_loss: 1.1145, test_f1: 0.5836
 epoch: 28, train_loss: 0.6304, test_loss: 1.2284, test_f1: 0.5547
 epoch: 29, train_loss: 0.6325, test_loss: 1.2020, test_f1: 0.6367
 epoch: 30, train_loss: 0.6212, test_loss: 1.2420, test_f1: 0.5822
 epoch: 31, train_loss: 0.6025, test_loss: 1.2610, test_f1: 0.5237
 epoch: 32, train_loss: 0.6407, test_loss: 1.2770, test_f1: 0.6052
 epoch: 33, train_loss: 0.6014, test_loss: 1.1808, test_f1: 0.5990
 epoch: 34, train_loss: 0.5902, test_loss: 1.1412, test_f1: 0.6344
 epoch: 35, train_loss: 0.5992, test_loss: 1.1087, test_f1: 0.6401
 epoch: 36, train_loss: 0.5881, test_loss: 1.2383, test_f1: 0.5916
 epoch: 37, train_loss: 0.5791, test_loss: 1.1182, test_f1: 0.6240
 epoch: 38, train_loss: 0.5634, test_loss: 1.1800, test_f1: 0.5759
 epoch: 39, train_loss: 0.5749, test_loss: 1.1500, test_f1: 0.6285
 epoch: 40, train_loss: 0.5681, test_loss: 1.2658, test_f1: 0.5727
 epoch: 41, train_loss: 0.5455, test_loss: 1.1847, test_f1: 0.6253
 epoch: 42, train_loss: 0.5544, test_loss: 1.3110, test_f1: 0.6184
 epoch: 43, train_loss: 0.5286, test_loss: 1.4660, test_f1: 0.5932
 epoch: 44, train_loss: 0.5307, test_loss: 1.3903, test_f1: 0.5764
 epoch: 45, train_loss: 0.4998, test_loss: 1.3816, test_f1: 0.5679
 epoch: 46, train_loss: 0.5105, test_loss: 1.2537, test_f1: 0.5933
 epoch: 47, train_loss: 0.4682, test_loss: 1.3102, test_f1: 0.5964
 epoch: 48, train_loss: 0.4733, test_loss: 1.2905, test_f1: 0.5900
 epoch: 49, train_loss: 0.4732, test_loss: 1.5143, test_f1: 0.6022
 epoch: 50, train_loss: 0.4574, test_loss: 1.5692, test_f1: 0.6111
 epoch: 51, train_loss: 0.4311, test_loss: 1.4773, test_f1: 0.6213
 epoch: 52, train_loss: 0.4269, test_loss: 1.3825, test_f1: 0.6072
 epoch: 53, train_loss: 0.4285, test_loss: 1.3808, test_f1: 0.6195
 epoch: 54, train_loss: 0.3949, test_loss: 1.3837, test_f1: 0.6193
 epoch: 55, train_loss: 0.4054, test_loss: 1.4821, test_f1: 0.6098
 epoch: 56, train_loss: 0.4054, test_loss: 1.4729, test_f1: 0.6116
 epoch: 57, train_loss: 0.3697, test_loss: 1.4942, test_f1: 0.6135
 epoch: 58, train_loss: 0.3896, test_loss: 1.5048, test_f1: 0.6019
 epoch: 59, train_loss: 0.3612, test_loss: 1.3739, test_f1: 0.6123
 epoch: 60, train_loss: 0.3851, test_loss: 1.5751, test_f1: 0.5884
 epoch: 61, train_loss: 0.3870, test_loss: 1.6596, test_f1: 0.5703
 epoch: 62, train_loss: 0.3603, test_loss: 1.5714, test_f1: 0.6060
 epoch: 63, train_loss: 0.3679, test_loss: 1.6050, test_f1: 0.6036
 epoch: 64, train_loss: 0.3733, test_loss: 1.6953, test_f1: 0.5793
 epoch: 65, train_loss: 0.3405, test_loss: 1.8972, test_f1: 0.5672
 epoch: 66, train_loss: 0.3550, test_loss: 1.7978, test_f1: 0.5852
 epoch: 67, train_loss: 0.3556, test_loss: 1.8524, test_f1: 0.5784
 epoch: 68, train_loss: 0.3515, test_loss: 1.8253, test_f1: 0.5819
 epoch: 69, train_loss: 0.3457, test_loss: 1.6776, test_f1: 0.6056
 epoch: 70, train_loss: 0.3418, test_loss: 1.8197, test_f1: 0.6007
 epoch: 71, train_loss: 0.3489, test_loss: 1.5936, test_f1: 0.6008
 epoch: 72, train_loss: 0.3287, test_loss: 1.7270, test_f1: 0.6109
 epoch: 73, train_loss: 0.3245, test_loss: 2.0221, test_f1: 0.5998
 epoch: 74, train_loss: 0.3281, test_loss: 1.6797, test_f1: 0.6248
 epoch: 75, train_loss: 0.3224, test_loss: 1.6372, test_f1: 0.6153
 epoch: 76, train_loss: 0.3275, test_loss: 1.7514, test_f1: 0.6058
 epoch: 77, train_loss: 0.3273, test_loss: 1.8613, test_f1: 0.5924
 epoch: 78, train_loss: 0.3351, test_loss: 1.7994, test_f1: 0.6008
 epoch: 79, train_loss: 0.3277, test_loss: 1.9623, test_f1: 0.5763
 epoch: 80, train_loss: 0.3171, test_loss: 1.7672, test_f1: 0.6050
 epoch: 81, train_loss: 0.2968, test_loss: 1.7737, test_f1: 0.5940
 epoch: 82, train_loss: 0.2853, test_loss: 1.8596, test_f1: 0.6031
 epoch: 83, train_loss: 0.3179, test_loss: 1.9406, test_f1: 0.5715
 epoch: 84, train_loss: 0.2927, test_loss: 2.1096, test_f1: 0.5743
 epoch: 85, train_loss: 0.3140, test_loss: 2.0179, test_f1: 0.5898
 epoch: 86, train_loss: 0.3114, test_loss: 2.0290, test_f1: 0.6225
 epoch: 87, train_loss: 0.2909, test_loss: 2.0531, test_f1: 0.6091
 epoch: 88, train_loss: 0.2879, test_loss: 1.8580, test_f1: 0.6127
 epoch: 89, train_loss: 0.2623, test_loss: 1.9489, test_f1: 0.6400
 epoch: 90, train_loss: 0.2787, test_loss: 1.9325, test_f1: 0.6306
 epoch: 91, train_loss: 0.2723, test_loss: 1.9498, test_f1: 0.6119
 epoch: 92, train_loss: 0.2592, test_loss: 2.0762, test_f1: 0.5878
 epoch: 93, train_loss: 0.2563, test_loss: 2.1443, test_f1: 0.5799
 epoch: 94, train_loss: 0.2547, test_loss: 1.9199, test_f1: 0.6034
 epoch: 95, train_loss: 0.2447, test_loss: 1.8415, test_f1: 0.6135
 epoch: 96, train_loss: 0.2674, test_loss: 2.0804, test_f1: 0.6032
 epoch: 97, train_loss: 0.2922, test_loss: 2.1214, test_f1: 0.5913
 epoch: 98, train_loss: 0.3177, test_loss: 2.2751, test_f1: 0.5990
 epoch: 99, train_loss: 0.2663, test_loss: 2.3076, test_f1: 0.6145
##################ITERATION #3 ****************************************
 epoch: 0, train_loss: 1.2257, test_loss: 1.3022, test_f1: 0.1365
 epoch: 1, train_loss: 1.0512, test_loss: 1.3042, test_f1: 0.1365
 epoch: 2, train_loss: 1.0209, test_loss: 1.2345, test_f1: 0.2325
 epoch: 3, train_loss: 0.9686, test_loss: 1.1901, test_f1: 0.4320
 epoch: 4, train_loss: 0.9265, test_loss: 1.1544, test_f1: 0.3964
 epoch: 5, train_loss: 0.9217, test_loss: 1.1485, test_f1: 0.4017
 epoch: 6, train_loss: 0.8952, test_loss: 1.1133, test_f1: 0.4691
 epoch: 7, train_loss: 0.8688, test_loss: 1.1316, test_f1: 0.4614
 epoch: 8, train_loss: 0.8640, test_loss: 1.0823, test_f1: 0.4823
 epoch: 9, train_loss: 0.8535, test_loss: 1.0320, test_f1: 0.5671
 epoch: 10, train_loss: 0.8108, test_loss: 1.0509, test_f1: 0.5602
 epoch: 11, train_loss: 0.8106, test_loss: 1.0597, test_f1: 0.5681
 epoch: 12, train_loss: 0.7933, test_loss: 1.0666, test_f1: 0.5638
 epoch: 13, train_loss: 0.8048, test_loss: 1.0673, test_f1: 0.5747
 epoch: 14, train_loss: 0.7830, test_loss: 1.0523, test_f1: 0.5783
 epoch: 15, train_loss: 0.7691, test_loss: 1.1166, test_f1: 0.5290
 epoch: 16, train_loss: 0.7640, test_loss: 1.0368, test_f1: 0.6029
 epoch: 17, train_loss: 0.7399, test_loss: 1.0331, test_f1: 0.5711
 epoch: 18, train_loss: 0.7282, test_loss: 1.0029, test_f1: 0.5667
 epoch: 19, train_loss: 0.7163, test_loss: 1.1383, test_f1: 0.5608
 epoch: 20, train_loss: 0.7190, test_loss: 1.0555, test_f1: 0.6072
 epoch: 21, train_loss: 0.7031, test_loss: 1.1604, test_f1: 0.5416
 epoch: 22, train_loss: 0.6943, test_loss: 1.1712, test_f1: 0.5892
 epoch: 23, train_loss: 0.6990, test_loss: 1.1308, test_f1: 0.5909
 epoch: 24, train_loss: 0.6733, test_loss: 1.1873, test_f1: 0.5391
 epoch: 25, train_loss: 0.6583, test_loss: 1.1291, test_f1: 0.4913
 epoch: 26, train_loss: 0.6553, test_loss: 1.1012, test_f1: 0.5926
 epoch: 27, train_loss: 0.6736, test_loss: 1.1398, test_f1: 0.5897
 epoch: 28, train_loss: 0.6511, test_loss: 1.3356, test_f1: 0.5357
 epoch: 29, train_loss: 0.6418, test_loss: 1.1887, test_f1: 0.5528
 epoch: 30, train_loss: 0.6337, test_loss: 1.3131, test_f1: 0.5609
 epoch: 31, train_loss: 0.6395, test_loss: 1.2101, test_f1: 0.5895
 epoch: 32, train_loss: 0.6314, test_loss: 1.1061, test_f1: 0.6217
 epoch: 33, train_loss: 0.6179, test_loss: 1.1734, test_f1: 0.6141
 epoch: 34, train_loss: 0.6310, test_loss: 1.0562, test_f1: 0.5881
 epoch: 35, train_loss: 0.5990, test_loss: 1.1198, test_f1: 0.6053
 epoch: 36, train_loss: 0.6024, test_loss: 1.2165, test_f1: 0.6144
 epoch: 37, train_loss: 0.5626, test_loss: 1.2968, test_f1: 0.5579
 epoch: 38, train_loss: 0.5681, test_loss: 1.2647, test_f1: 0.5812
 epoch: 39, train_loss: 0.5804, test_loss: 1.2530, test_f1: 0.5957
 epoch: 40, train_loss: 0.5777, test_loss: 1.1963, test_f1: 0.5917
 epoch: 41, train_loss: 0.5501, test_loss: 1.1609, test_f1: 0.6179
 epoch: 42, train_loss: 0.5496, test_loss: 1.1752, test_f1: 0.6350
 epoch: 43, train_loss: 0.5720, test_loss: 1.2017, test_f1: 0.5659
 epoch: 44, train_loss: 0.5595, test_loss: 1.1436, test_f1: 0.5926
 epoch: 45, train_loss: 0.5400, test_loss: 1.3294, test_f1: 0.5930
 epoch: 46, train_loss: 0.5355, test_loss: 1.2718, test_f1: 0.5650
 epoch: 47, train_loss: 0.5416, test_loss: 1.3690, test_f1: 0.5866
 epoch: 48, train_loss: 0.5120, test_loss: 1.2111, test_f1: 0.6185
 epoch: 49, train_loss: 0.5070, test_loss: 1.2401, test_f1: 0.6006
 epoch: 50, train_loss: 0.4849, test_loss: 1.3722, test_f1: 0.5853
 epoch: 51, train_loss: 0.4588, test_loss: 1.3830, test_f1: 0.6000
 epoch: 52, train_loss: 0.4474, test_loss: 1.4733, test_f1: 0.5948
 epoch: 53, train_loss: 0.4485, test_loss: 1.3560, test_f1: 0.6004
 epoch: 54, train_loss: 0.4291, test_loss: 1.3442, test_f1: 0.5768
 epoch: 55, train_loss: 0.4329, test_loss: 1.3049, test_f1: 0.6068
 epoch: 56, train_loss: 0.4487, test_loss: 1.4542, test_f1: 0.6015
 epoch: 57, train_loss: 0.4384, test_loss: 1.4440, test_f1: 0.6027
 epoch: 58, train_loss: 0.4427, test_loss: 1.4590, test_f1: 0.5920
 epoch: 59, train_loss: 0.4287, test_loss: 1.5269, test_f1: 0.5921
 epoch: 60, train_loss: 0.4400, test_loss: 1.3625, test_f1: 0.5906
 epoch: 61, train_loss: 0.4241, test_loss: 1.3650, test_f1: 0.6154
 epoch: 62, train_loss: 0.4395, test_loss: 1.4626, test_f1: 0.5826
 epoch: 63, train_loss: 0.4352, test_loss: 1.3342, test_f1: 0.5838
 epoch: 64, train_loss: 0.4038, test_loss: 1.2937, test_f1: 0.5851
 epoch: 65, train_loss: 0.3915, test_loss: 1.4120, test_f1: 0.5664
 epoch: 66, train_loss: 0.3974, test_loss: 1.4263, test_f1: 0.5713
 epoch: 67, train_loss: 0.3709, test_loss: 1.3587, test_f1: 0.5713
 epoch: 68, train_loss: 0.3786, test_loss: 1.4596, test_f1: 0.5798
 epoch: 69, train_loss: 0.3712, test_loss: 1.3792, test_f1: 0.5965
 epoch: 70, train_loss: 0.3622, test_loss: 1.4552, test_f1: 0.5873
 epoch: 71, train_loss: 0.3476, test_loss: 1.4869, test_f1: 0.6073
 epoch: 72, train_loss: 0.3510, test_loss: 1.5071, test_f1: 0.5731
 epoch: 73, train_loss: 0.3440, test_loss: 1.4551, test_f1: 0.6029
 epoch: 74, train_loss: 0.3358, test_loss: 1.4746, test_f1: 0.5966
 epoch: 75, train_loss: 0.3419, test_loss: 1.4131, test_f1: 0.5858
 epoch: 76, train_loss: 0.3482, test_loss: 1.6023, test_f1: 0.5718
 epoch: 77, train_loss: 0.3268, test_loss: 1.7071, test_f1: 0.5775
 epoch: 78, train_loss: 0.3192, test_loss: 1.4958, test_f1: 0.6259
 epoch: 79, train_loss: 0.3088, test_loss: 1.5258, test_f1: 0.6077
 epoch: 80, train_loss: 0.3424, test_loss: 1.5514, test_f1: 0.5903
 epoch: 81, train_loss: 0.3433, test_loss: 1.7144, test_f1: 0.6011
 epoch: 82, train_loss: 0.3333, test_loss: 1.6060, test_f1: 0.6075
 epoch: 83, train_loss: 0.3396, test_loss: 1.6363, test_f1: 0.6078
 epoch: 84, train_loss: 0.3424, test_loss: 1.6038, test_f1: 0.6375
 epoch: 85, train_loss: 0.3330, test_loss: 1.6756, test_f1: 0.5719
 epoch: 86, train_loss: 0.3440, test_loss: 1.8220, test_f1: 0.5606
 epoch: 87, train_loss: 0.3192, test_loss: 1.5964, test_f1: 0.5865
 epoch: 88, train_loss: 0.3173, test_loss: 1.6617, test_f1: 0.6016
 epoch: 89, train_loss: 0.3270, test_loss: 1.5203, test_f1: 0.6375
 epoch: 90, train_loss: 0.3596, test_loss: 1.5646, test_f1: 0.5787
 epoch: 91, train_loss: 0.3288, test_loss: 1.7497, test_f1: 0.6066
 epoch: 92, train_loss: 0.3174, test_loss: 1.6557, test_f1: 0.5791
 epoch: 93, train_loss: 0.3066, test_loss: 1.5848, test_f1: 0.5624
 epoch: 94, train_loss: 0.3389, test_loss: 1.7537, test_f1: 0.5978
 epoch: 95, train_loss: 0.3432, test_loss: 1.7800, test_f1: 0.5709
 epoch: 96, train_loss: 0.3257, test_loss: 1.7273, test_f1: 0.5683
 epoch: 97, train_loss: 0.3118, test_loss: 1.6079, test_f1: 0.6063
 epoch: 98, train_loss: 0.3186, test_loss: 1.6577, test_f1: 0.6161
 epoch: 99, train_loss: 0.3160, test_loss: 1.6664, test_f1: 0.5994
##################ITERATION #4 ****************************************
 epoch: 0, train_loss: 1.2514, test_loss: 1.3119, test_f1: 0.1365
 epoch: 1, train_loss: 1.0836, test_loss: 1.3001, test_f1: 0.1365
 epoch: 2, train_loss: 1.0185, test_loss: 1.2520, test_f1: 0.1433
 epoch: 3, train_loss: 0.9723, test_loss: 1.1875, test_f1: 0.4173
 epoch: 4, train_loss: 0.9511, test_loss: 1.1312, test_f1: 0.4297
 epoch: 5, train_loss: 0.9253, test_loss: 1.1081, test_f1: 0.4642
 epoch: 6, train_loss: 0.9033, test_loss: 1.0833, test_f1: 0.4530
 epoch: 7, train_loss: 0.8734, test_loss: 1.0786, test_f1: 0.4744
 epoch: 8, train_loss: 0.8568, test_loss: 1.0886, test_f1: 0.4790
 epoch: 9, train_loss: 0.8399, test_loss: 1.0592, test_f1: 0.5633
 epoch: 10, train_loss: 0.8249, test_loss: 1.1041, test_f1: 0.5297
 epoch: 11, train_loss: 0.8048, test_loss: 1.0660, test_f1: 0.5467
 epoch: 12, train_loss: 0.8045, test_loss: 1.0629, test_f1: 0.5520
 epoch: 13, train_loss: 0.8028, test_loss: 1.0238, test_f1: 0.5655
 epoch: 14, train_loss: 0.8069, test_loss: 1.0133, test_f1: 0.5993
 epoch: 15, train_loss: 0.7552, test_loss: 0.9972, test_f1: 0.6084
 epoch: 16, train_loss: 0.7479, test_loss: 1.0264, test_f1: 0.6272
 epoch: 17, train_loss: 0.7684, test_loss: 1.0963, test_f1: 0.5691
 epoch: 18, train_loss: 0.7453, test_loss: 1.0069, test_f1: 0.6369
 epoch: 19, train_loss: 0.7466, test_loss: 0.9844, test_f1: 0.6191
 epoch: 20, train_loss: 0.6943, test_loss: 1.1413, test_f1: 0.5304
 epoch: 21, train_loss: 0.7011, test_loss: 1.0610, test_f1: 0.5837
 epoch: 22, train_loss: 0.6906, test_loss: 1.0446, test_f1: 0.6088
 epoch: 23, train_loss: 0.6663, test_loss: 0.9877, test_f1: 0.6161
 epoch: 24, train_loss: 0.6606, test_loss: 1.0160, test_f1: 0.5953
 epoch: 25, train_loss: 0.6991, test_loss: 1.1662, test_f1: 0.5677
 epoch: 26, train_loss: 0.6972, test_loss: 1.0964, test_f1: 0.6331
 epoch: 27, train_loss: 0.6524, test_loss: 1.0571, test_f1: 0.5951
 epoch: 28, train_loss: 0.6316, test_loss: 1.0464, test_f1: 0.6441
 epoch: 29, train_loss: 0.6063, test_loss: 1.0519, test_f1: 0.6187
 epoch: 30, train_loss: 0.6153, test_loss: 1.0594, test_f1: 0.6412
 epoch: 31, train_loss: 0.6077, test_loss: 1.0522, test_f1: 0.6283
 epoch: 32, train_loss: 0.5968, test_loss: 1.0117, test_f1: 0.6689
 epoch: 33, train_loss: 0.6176, test_loss: 1.2251, test_f1: 0.6189
 epoch: 34, train_loss: 0.6004, test_loss: 1.1458, test_f1: 0.6161
 epoch: 35, train_loss: 0.5972, test_loss: 1.0997, test_f1: 0.6312
 epoch: 36, train_loss: 0.5877, test_loss: 1.1051, test_f1: 0.6506
 epoch: 37, train_loss: 0.5792, test_loss: 1.3295, test_f1: 0.5847
 epoch: 38, train_loss: 0.6285, test_loss: 1.3808, test_f1: 0.5404
 epoch: 39, train_loss: 0.5800, test_loss: 1.2068, test_f1: 0.6245
 epoch: 40, train_loss: 0.5917, test_loss: 1.1953, test_f1: 0.6262
 epoch: 41, train_loss: 0.5812, test_loss: 1.3620, test_f1: 0.5911
 epoch: 42, train_loss: 0.5908, test_loss: 1.1144, test_f1: 0.6138
 epoch: 43, train_loss: 0.5648, test_loss: 1.1174, test_f1: 0.6098
 epoch: 44, train_loss: 0.5542, test_loss: 1.1304, test_f1: 0.6358
 epoch: 45, train_loss: 0.5408, test_loss: 1.1903, test_f1: 0.6146
 epoch: 46, train_loss: 0.5226, test_loss: 1.2835, test_f1: 0.5707
 epoch: 47, train_loss: 0.5106, test_loss: 1.1950, test_f1: 0.6318
 epoch: 48, train_loss: 0.5170, test_loss: 1.3065, test_f1: 0.6184
 epoch: 49, train_loss: 0.4842, test_loss: 1.2815, test_f1: 0.6489
 epoch: 50, train_loss: 0.4943, test_loss: 1.3280, test_f1: 0.6184
 epoch: 51, train_loss: 0.4855, test_loss: 1.3240, test_f1: 0.6091
 epoch: 52, train_loss: 0.4789, test_loss: 1.2921, test_f1: 0.6103
 epoch: 53, train_loss: 0.4723, test_loss: 1.3598, test_f1: 0.6687
 epoch: 54, train_loss: 0.4550, test_loss: 1.2840, test_f1: 0.6614
 epoch: 55, train_loss: 0.4524, test_loss: 1.3219, test_f1: 0.6428
 epoch: 56, train_loss: 0.4528, test_loss: 1.3463, test_f1: 0.6072
 epoch: 57, train_loss: 0.4670, test_loss: 1.2894, test_f1: 0.6742
 epoch: 58, train_loss: 0.4416, test_loss: 1.3683, test_f1: 0.6298
 epoch: 59, train_loss: 0.4251, test_loss: 1.4142, test_f1: 0.6404
 epoch: 60, train_loss: 0.4275, test_loss: 1.3793, test_f1: 0.6325
 epoch: 61, train_loss: 0.4201, test_loss: 1.3758, test_f1: 0.6346
 epoch: 62, train_loss: 0.3788, test_loss: 1.3652, test_f1: 0.6525
 epoch: 63, train_loss: 0.4094, test_loss: 1.3796, test_f1: 0.6437
 epoch: 64, train_loss: 0.4006, test_loss: 1.4170, test_f1: 0.6083
 epoch: 65, train_loss: 0.3961, test_loss: 1.3645, test_f1: 0.6342
 epoch: 66, train_loss: 0.4058, test_loss: 1.5487, test_f1: 0.6646
 epoch: 67, train_loss: 0.4039, test_loss: 1.3225, test_f1: 0.6611
 epoch: 68, train_loss: 0.3793, test_loss: 1.4119, test_f1: 0.6665
 epoch: 69, train_loss: 0.3922, test_loss: 1.4569, test_f1: 0.6359
 epoch: 70, train_loss: 0.4049, test_loss: 1.5460, test_f1: 0.6175
 epoch: 71, train_loss: 0.3971, test_loss: 1.4081, test_f1: 0.6424
 epoch: 72, train_loss: 0.3868, test_loss: 1.4384, test_f1: 0.6441
 epoch: 73, train_loss: 0.3848, test_loss: 1.3992, test_f1: 0.6515
 epoch: 74, train_loss: 0.3819, test_loss: 1.3441, test_f1: 0.6463
 epoch: 75, train_loss: 0.3669, test_loss: 1.5550, test_f1: 0.6105
 epoch: 76, train_loss: 0.3810, test_loss: 1.5265, test_f1: 0.6251
 epoch: 77, train_loss: 0.3708, test_loss: 1.4806, test_f1: 0.6435
 epoch: 78, train_loss: 0.3569, test_loss: 1.4623, test_f1: 0.6737
 epoch: 79, train_loss: 0.3434, test_loss: 1.4855, test_f1: 0.6210
 epoch: 80, train_loss: 0.3440, test_loss: 1.4160, test_f1: 0.6287
 epoch: 81, train_loss: 0.3478, test_loss: 1.5106, test_f1: 0.6768
 epoch: 82, train_loss: 0.3580, test_loss: 1.5151, test_f1: 0.6233
 epoch: 83, train_loss: 0.3445, test_loss: 1.6992, test_f1: 0.6471
 epoch: 84, train_loss: 0.3548, test_loss: 1.5433, test_f1: 0.6270
 epoch: 85, train_loss: 0.3159, test_loss: 1.5495, test_f1: 0.6455
 epoch: 86, train_loss: 0.3162, test_loss: 1.6318, test_f1: 0.6520
 epoch: 87, train_loss: 0.3309, test_loss: 1.5956, test_f1: 0.6084
 epoch: 88, train_loss: 0.3226, test_loss: 1.5806, test_f1: 0.6308
 epoch: 89, train_loss: 0.3344, test_loss: 1.4317, test_f1: 0.6242
 epoch: 90, train_loss: 0.3274, test_loss: 1.6744, test_f1: 0.6260
 epoch: 91, train_loss: 0.3158, test_loss: 1.6602, test_f1: 0.6376
 epoch: 92, train_loss: 0.2970, test_loss: 1.6937, test_f1: 0.6247
 epoch: 93, train_loss: 0.2846, test_loss: 1.6608, test_f1: 0.6370
 epoch: 94, train_loss: 0.2963, test_loss: 1.7618, test_f1: 0.6372
 epoch: 95, train_loss: 0.2985, test_loss: 1.6721, test_f1: 0.6186
 epoch: 96, train_loss: 0.3220, test_loss: 1.8618, test_f1: 0.6404
 epoch: 97, train_loss: 0.3187, test_loss: 1.5839, test_f1: 0.6139
 epoch: 98, train_loss: 0.3127, test_loss: 1.7997, test_f1: 0.6245
 epoch: 99, train_loss: 0.3041, test_loss: 1.6926, test_f1: 0.6827
##################ITERATION #5 ****************************************
 epoch: 0, train_loss: 1.2985, test_loss: 1.3276, test_f1: 0.1365
 epoch: 1, train_loss: 1.0564, test_loss: 1.2904, test_f1: 0.1714
 epoch: 2, train_loss: 1.0258, test_loss: 1.2644, test_f1: 0.3044
 epoch: 3, train_loss: 0.9699, test_loss: 1.1942, test_f1: 0.4258
 epoch: 4, train_loss: 0.9453, test_loss: 1.1199, test_f1: 0.4862
 epoch: 5, train_loss: 0.9211, test_loss: 1.0883, test_f1: 0.4853
 epoch: 6, train_loss: 0.8913, test_loss: 1.0388, test_f1: 0.5172
 epoch: 7, train_loss: 0.8611, test_loss: 1.0430, test_f1: 0.5423
 epoch: 8, train_loss: 0.8253, test_loss: 1.0559, test_f1: 0.4949
 epoch: 9, train_loss: 0.8347, test_loss: 1.0422, test_f1: 0.5309
 epoch: 10, train_loss: 0.8153, test_loss: 1.0200, test_f1: 0.5996
 epoch: 11, train_loss: 0.7924, test_loss: 1.0115, test_f1: 0.5562
 epoch: 12, train_loss: 0.7900, test_loss: 1.0652, test_f1: 0.5984
 epoch: 13, train_loss: 0.7676, test_loss: 1.0886, test_f1: 0.5969
 epoch: 14, train_loss: 0.7745, test_loss: 1.0889, test_f1: 0.5698
 epoch: 15, train_loss: 0.7483, test_loss: 1.0803, test_f1: 0.5939
 epoch: 16, train_loss: 0.7353, test_loss: 1.0627, test_f1: 0.5981
 epoch: 17, train_loss: 0.7496, test_loss: 1.1187, test_f1: 0.5866
 epoch: 18, train_loss: 0.7093, test_loss: 1.0800, test_f1: 0.5717
 epoch: 19, train_loss: 0.7166, test_loss: 1.0629, test_f1: 0.5433
 epoch: 20, train_loss: 0.7324, test_loss: 1.1604, test_f1: 0.4764
 epoch: 21, train_loss: 0.7291, test_loss: 1.2654, test_f1: 0.5204
 epoch: 22, train_loss: 0.6979, test_loss: 1.1555, test_f1: 0.6044
 epoch: 23, train_loss: 0.6990, test_loss: 1.0793, test_f1: 0.5914
 epoch: 24, train_loss: 0.6764, test_loss: 1.1529, test_f1: 0.6080
 epoch: 25, train_loss: 0.6939, test_loss: 1.2036, test_f1: 0.6032
 epoch: 26, train_loss: 0.6652, test_loss: 1.1504, test_f1: 0.5832
 epoch: 27, train_loss: 0.6632, test_loss: 1.0982, test_f1: 0.5743
 epoch: 28, train_loss: 0.6631, test_loss: 1.0898, test_f1: 0.5769
 epoch: 29, train_loss: 0.6250, test_loss: 1.1097, test_f1: 0.5662
 epoch: 30, train_loss: 0.6342, test_loss: 1.1399, test_f1: 0.5852
 epoch: 31, train_loss: 0.6446, test_loss: 1.2812, test_f1: 0.6065
 epoch: 32, train_loss: 0.6606, test_loss: 1.2019, test_f1: 0.6105
 epoch: 33, train_loss: 0.6051, test_loss: 1.2180, test_f1: 0.5710
 epoch: 34, train_loss: 0.6062, test_loss: 1.2506, test_f1: 0.5530
 epoch: 35, train_loss: 0.5975, test_loss: 1.1831, test_f1: 0.6167
 epoch: 36, train_loss: 0.5861, test_loss: 1.1742, test_f1: 0.5981
 epoch: 37, train_loss: 0.5591, test_loss: 1.2196, test_f1: 0.6133
 epoch: 38, train_loss: 0.5582, test_loss: 1.2668, test_f1: 0.5475
 epoch: 39, train_loss: 0.5752, test_loss: 1.3731, test_f1: 0.5701
 epoch: 40, train_loss: 0.5455, test_loss: 1.4715, test_f1: 0.5797
 epoch: 41, train_loss: 0.5506, test_loss: 1.2970, test_f1: 0.6059
 epoch: 42, train_loss: 0.5640, test_loss: 1.2699, test_f1: 0.5739
 epoch: 43, train_loss: 0.5597, test_loss: 1.1854, test_f1: 0.5573
 epoch: 44, train_loss: 0.5398, test_loss: 1.2407, test_f1: 0.5995
 epoch: 45, train_loss: 0.5387, test_loss: 1.3034, test_f1: 0.5880
 epoch: 46, train_loss: 0.5116, test_loss: 1.3096, test_f1: 0.5905
 epoch: 47, train_loss: 0.5263, test_loss: 1.2321, test_f1: 0.5999
 epoch: 48, train_loss: 0.5091, test_loss: 1.2696, test_f1: 0.6283
 epoch: 49, train_loss: 0.4914, test_loss: 1.2699, test_f1: 0.6024
 epoch: 50, train_loss: 0.4929, test_loss: 1.2714, test_f1: 0.5625
 epoch: 51, train_loss: 0.4902, test_loss: 1.3070, test_f1: 0.5909
 epoch: 52, train_loss: 0.4466, test_loss: 1.3414, test_f1: 0.5826
 epoch: 53, train_loss: 0.4511, test_loss: 1.3285, test_f1: 0.5714
 epoch: 54, train_loss: 0.4611, test_loss: 1.3832, test_f1: 0.5743
 epoch: 55, train_loss: 0.4435, test_loss: 1.5139, test_f1: 0.5893
 epoch: 56, train_loss: 0.4625, test_loss: 1.4481, test_f1: 0.5875
 epoch: 57, train_loss: 0.4364, test_loss: 1.4928, test_f1: 0.6114
 epoch: 58, train_loss: 0.4531, test_loss: 1.5223, test_f1: 0.5691
 epoch: 59, train_loss: 0.4331, test_loss: 1.4793, test_f1: 0.5868
 epoch: 60, train_loss: 0.4321, test_loss: 1.4950, test_f1: 0.6033
 epoch: 61, train_loss: 0.4146, test_loss: 1.5098, test_f1: 0.6044
 epoch: 62, train_loss: 0.4108, test_loss: 1.4861, test_f1: 0.5798
 epoch: 63, train_loss: 0.4077, test_loss: 1.5124, test_f1: 0.5808
 epoch: 64, train_loss: 0.3973, test_loss: 1.5255, test_f1: 0.6269
 epoch: 65, train_loss: 0.4322, test_loss: 1.5746, test_f1: 0.6210
 epoch: 66, train_loss: 0.4019, test_loss: 1.4567, test_f1: 0.6299
 epoch: 67, train_loss: 0.3965, test_loss: 1.4784, test_f1: 0.6243
 epoch: 68, train_loss: 0.3792, test_loss: 1.4753, test_f1: 0.6141
 epoch: 69, train_loss: 0.3983, test_loss: 1.4819, test_f1: 0.6111
 epoch: 70, train_loss: 0.3949, test_loss: 1.5890, test_f1: 0.6050
 epoch: 71, train_loss: 0.3664, test_loss: 1.6401, test_f1: 0.5987
 epoch: 72, train_loss: 0.3823, test_loss: 1.6116, test_f1: 0.6210
 epoch: 73, train_loss: 0.3886, test_loss: 1.6666, test_f1: 0.5835
 epoch: 74, train_loss: 0.3782, test_loss: 1.8078, test_f1: 0.5828
 epoch: 75, train_loss: 0.3729, test_loss: 1.6580, test_f1: 0.6181
 epoch: 76, train_loss: 0.3766, test_loss: 1.6447, test_f1: 0.6054
 epoch: 77, train_loss: 0.3615, test_loss: 1.7659, test_f1: 0.5914
 epoch: 78, train_loss: 0.3645, test_loss: 1.6856, test_f1: 0.5644
 epoch: 79, train_loss: 0.3464, test_loss: 1.6239, test_f1: 0.5758
 epoch: 80, train_loss: 0.3096, test_loss: 1.7013, test_f1: 0.6142
 epoch: 81, train_loss: 0.3255, test_loss: 1.8757, test_f1: 0.5923
 epoch: 82, train_loss: 0.3248, test_loss: 1.8304, test_f1: 0.5946
 epoch: 83, train_loss: 0.3127, test_loss: 1.8173, test_f1: 0.6271
 epoch: 84, train_loss: 0.3101, test_loss: 1.8788, test_f1: 0.5998
 epoch: 85, train_loss: 0.3272, test_loss: 1.7687, test_f1: 0.6175
 epoch: 86, train_loss: 0.3517, test_loss: 1.8467, test_f1: 0.6184
 epoch: 87, train_loss: 0.3562, test_loss: 1.8000, test_f1: 0.6219
 epoch: 88, train_loss: 0.3520, test_loss: 1.7298, test_f1: 0.6119
 epoch: 89, train_loss: 0.3183, test_loss: 1.9445, test_f1: 0.5860
 epoch: 90, train_loss: 0.3138, test_loss: 1.8991, test_f1: 0.5983
 epoch: 91, train_loss: 0.3313, test_loss: 1.7707, test_f1: 0.6003
 epoch: 92, train_loss: 0.3281, test_loss: 1.7972, test_f1: 0.6145
 epoch: 93, train_loss: 0.3077, test_loss: 1.8971, test_f1: 0.5948
 epoch: 94, train_loss: 0.3274, test_loss: 1.9549, test_f1: 0.5818
 epoch: 95, train_loss: 0.3030, test_loss: 1.9456, test_f1: 0.6099
 epoch: 96, train_loss: 0.2822, test_loss: 1.8273, test_f1: 0.6006
 epoch: 97, train_loss: 0.2705, test_loss: 2.0012, test_f1: 0.6041
 epoch: 98, train_loss: 0.2915, test_loss: 1.9949, test_f1: 0.5910
 epoch: 99, train_loss: 0.2747, test_loss: 1.8894, test_f1: 0.6111
##################ITERATION #6 ****************************************
 epoch: 0, train_loss: 1.4088, test_loss: 1.3800, test_f1: 0.1365
 epoch: 1, train_loss: 1.0746, test_loss: 1.3262, test_f1: 0.1365
 epoch: 2, train_loss: 1.0316, test_loss: 1.2287, test_f1: 0.3094
 epoch: 3, train_loss: 0.9739, test_loss: 1.1705, test_f1: 0.3862
 epoch: 4, train_loss: 0.9373, test_loss: 1.1267, test_f1: 0.4126
 epoch: 5, train_loss: 0.9162, test_loss: 1.1093, test_f1: 0.4332
 epoch: 6, train_loss: 0.9064, test_loss: 1.1142, test_f1: 0.4602
 epoch: 7, train_loss: 0.8782, test_loss: 1.1070, test_f1: 0.4998
 epoch: 8, train_loss: 0.8762, test_loss: 1.1404, test_f1: 0.5145
 epoch: 9, train_loss: 0.8584, test_loss: 1.0605, test_f1: 0.5474
 epoch: 10, train_loss: 0.8533, test_loss: 1.0334, test_f1: 0.5885
 epoch: 11, train_loss: 0.8488, test_loss: 1.0433, test_f1: 0.5860
 epoch: 12, train_loss: 0.8301, test_loss: 1.0897, test_f1: 0.5882
 epoch: 13, train_loss: 0.8247, test_loss: 1.0378, test_f1: 0.6225
 epoch: 14, train_loss: 0.8038, test_loss: 1.1034, test_f1: 0.5643
 epoch: 15, train_loss: 0.8145, test_loss: 1.0689, test_f1: 0.5729
 epoch: 16, train_loss: 0.7872, test_loss: 1.0420, test_f1: 0.5729
 epoch: 17, train_loss: 0.7797, test_loss: 1.0220, test_f1: 0.5995
 epoch: 18, train_loss: 0.7836, test_loss: 1.0385, test_f1: 0.6036
 epoch: 19, train_loss: 0.7624, test_loss: 1.0780, test_f1: 0.5634
 epoch: 20, train_loss: 0.7322, test_loss: 1.0606, test_f1: 0.6064
 epoch: 21, train_loss: 0.7246, test_loss: 1.0836, test_f1: 0.6258
 epoch: 22, train_loss: 0.7225, test_loss: 1.1191, test_f1: 0.5948
 epoch: 23, train_loss: 0.7148, test_loss: 1.1060, test_f1: 0.5847
 epoch: 24, train_loss: 0.6963, test_loss: 1.1304, test_f1: 0.5813
 epoch: 25, train_loss: 0.6799, test_loss: 1.1867, test_f1: 0.6004
 epoch: 26, train_loss: 0.7045, test_loss: 1.1272, test_f1: 0.5801
 epoch: 27, train_loss: 0.6875, test_loss: 1.1427, test_f1: 0.6189
 epoch: 28, train_loss: 0.6648, test_loss: 1.1457, test_f1: 0.6207
 epoch: 29, train_loss: 0.6585, test_loss: 1.1339, test_f1: 0.5987
 epoch: 30, train_loss: 0.6668, test_loss: 1.1761, test_f1: 0.5798
 epoch: 31, train_loss: 0.6886, test_loss: 1.1624, test_f1: 0.5854
 epoch: 32, train_loss: 0.6429, test_loss: 1.1342, test_f1: 0.5816
 epoch: 33, train_loss: 0.6336, test_loss: 1.1549, test_f1: 0.6350
 epoch: 34, train_loss: 0.6470, test_loss: 1.2236, test_f1: 0.6132
 epoch: 35, train_loss: 0.6522, test_loss: 1.1890, test_f1: 0.6189
 epoch: 36, train_loss: 0.6364, test_loss: 1.2117, test_f1: 0.6198
 epoch: 37, train_loss: 0.6075, test_loss: 1.1686, test_f1: 0.6361
 epoch: 38, train_loss: 0.6024, test_loss: 1.1972, test_f1: 0.6061
 epoch: 39, train_loss: 0.6061, test_loss: 1.2741, test_f1: 0.6192
 epoch: 40, train_loss: 0.5930, test_loss: 1.3261, test_f1: 0.6045
 epoch: 41, train_loss: 0.5765, test_loss: 1.2689, test_f1: 0.6334
 epoch: 42, train_loss: 0.6020, test_loss: 1.1651, test_f1: 0.5907
 epoch: 43, train_loss: 0.5825, test_loss: 1.4941, test_f1: 0.5798
 epoch: 44, train_loss: 0.5666, test_loss: 1.3186, test_f1: 0.6188
 epoch: 45, train_loss: 0.5675, test_loss: 1.2726, test_f1: 0.5907
 epoch: 46, train_loss: 0.5609, test_loss: 1.2460, test_f1: 0.6441
 epoch: 47, train_loss: 0.5749, test_loss: 1.4307, test_f1: 0.6167
 epoch: 48, train_loss: 0.5405, test_loss: 1.2540, test_f1: 0.6101
 epoch: 49, train_loss: 0.5723, test_loss: 1.1429, test_f1: 0.6319
 epoch: 50, train_loss: 0.5800, test_loss: 1.3171, test_f1: 0.5459
 epoch: 51, train_loss: 0.5324, test_loss: 1.2368, test_f1: 0.6296
 epoch: 52, train_loss: 0.5201, test_loss: 1.2647, test_f1: 0.6128
 epoch: 53, train_loss: 0.5096, test_loss: 1.2790, test_f1: 0.6528
 epoch: 54, train_loss: 0.4938, test_loss: 1.2169, test_f1: 0.6628
 epoch: 55, train_loss: 0.4869, test_loss: 1.1917, test_f1: 0.6343
 epoch: 56, train_loss: 0.4859, test_loss: 1.2229, test_f1: 0.6355
 epoch: 57, train_loss: 0.4739, test_loss: 1.3160, test_f1: 0.6591
 epoch: 58, train_loss: 0.4718, test_loss: 1.2494, test_f1: 0.6657
 epoch: 59, train_loss: 0.4571, test_loss: 1.3878, test_f1: 0.6130
 epoch: 60, train_loss: 0.4492, test_loss: 1.4670, test_f1: 0.6006
 epoch: 61, train_loss: 0.4596, test_loss: 1.4031, test_f1: 0.6438
 epoch: 62, train_loss: 0.4473, test_loss: 1.3121, test_f1: 0.6291
 epoch: 63, train_loss: 0.4179, test_loss: 1.4449, test_f1: 0.6305
 epoch: 64, train_loss: 0.4381, test_loss: 1.5376, test_f1: 0.6064
 epoch: 65, train_loss: 0.4262, test_loss: 1.5778, test_f1: 0.6022
 epoch: 66, train_loss: 0.4510, test_loss: 1.4881, test_f1: 0.6192
 epoch: 67, train_loss: 0.4198, test_loss: 1.5356, test_f1: 0.6320
 epoch: 68, train_loss: 0.4309, test_loss: 1.5237, test_f1: 0.6403
 epoch: 69, train_loss: 0.4457, test_loss: 1.4797, test_f1: 0.6325
 epoch: 70, train_loss: 0.4339, test_loss: 1.5520, test_f1: 0.6193
 epoch: 71, train_loss: 0.3970, test_loss: 1.3563, test_f1: 0.6401
 epoch: 72, train_loss: 0.4098, test_loss: 1.4033, test_f1: 0.6598
 epoch: 73, train_loss: 0.4374, test_loss: 1.4088, test_f1: 0.6292
 epoch: 74, train_loss: 0.3897, test_loss: 1.4533, test_f1: 0.6571
 epoch: 75, train_loss: 0.3962, test_loss: 1.4661, test_f1: 0.6327
 epoch: 76, train_loss: 0.3824, test_loss: 1.3975, test_f1: 0.6233
 epoch: 77, train_loss: 0.3781, test_loss: 1.4495, test_f1: 0.6522
 epoch: 78, train_loss: 0.3951, test_loss: 1.6464, test_f1: 0.6263
 epoch: 79, train_loss: 0.3829, test_loss: 1.5874, test_f1: 0.6423
 epoch: 80, train_loss: 0.3684, test_loss: 1.4721, test_f1: 0.6413
 epoch: 81, train_loss: 0.3804, test_loss: 1.6283, test_f1: 0.6662
 epoch: 82, train_loss: 0.3882, test_loss: 1.5299, test_f1: 0.6286
 epoch: 83, train_loss: 0.3574, test_loss: 1.5009, test_f1: 0.6615
 epoch: 84, train_loss: 0.3652, test_loss: 1.5785, test_f1: 0.6607
 epoch: 85, train_loss: 0.3488, test_loss: 1.8539, test_f1: 0.6328
 epoch: 86, train_loss: 0.3805, test_loss: 1.6735, test_f1: 0.6495
 epoch: 87, train_loss: 0.3904, test_loss: 1.5847, test_f1: 0.6337
 epoch: 88, train_loss: 0.3914, test_loss: 1.6028, test_f1: 0.6458
 epoch: 89, train_loss: 0.3892, test_loss: 1.7793, test_f1: 0.5869
 epoch: 90, train_loss: 0.3694, test_loss: 1.5423, test_f1: 0.6318
 epoch: 91, train_loss: 0.4038, test_loss: 1.6201, test_f1: 0.6282
 epoch: 92, train_loss: 0.3825, test_loss: 1.7120, test_f1: 0.6252
 epoch: 93, train_loss: 0.3810, test_loss: 1.5301, test_f1: 0.6459
 epoch: 94, train_loss: 0.3806, test_loss: 1.5239, test_f1: 0.6050
 epoch: 95, train_loss: 0.3675, test_loss: 1.5495, test_f1: 0.6351
 epoch: 96, train_loss: 0.3709, test_loss: 1.5505, test_f1: 0.6371
 epoch: 97, train_loss: 0.3521, test_loss: 1.6542, test_f1: 0.6333
 epoch: 98, train_loss: 0.3532, test_loss: 1.6352, test_f1: 0.6051
 epoch: 99, train_loss: 0.3594, test_loss: 1.6149, test_f1: 0.6512
##################ITERATION #7 ****************************************
 epoch: 0, train_loss: 1.3666, test_loss: 1.4759, test_f1: 0.1365
 epoch: 1, train_loss: 1.1248, test_loss: 1.3664, test_f1: 0.1374
 epoch: 2, train_loss: 1.0426, test_loss: 1.3092, test_f1: 0.2018
 epoch: 3, train_loss: 1.0019, test_loss: 1.2815, test_f1: 0.2154
 epoch: 4, train_loss: 0.9580, test_loss: 1.2142, test_f1: 0.3062
 epoch: 5, train_loss: 0.9427, test_loss: 1.1846, test_f1: 0.3439
 epoch: 6, train_loss: 0.9139, test_loss: 1.1540, test_f1: 0.4198
 epoch: 7, train_loss: 0.8871, test_loss: 1.1071, test_f1: 0.4424
 epoch: 8, train_loss: 0.8881, test_loss: 1.0965, test_f1: 0.4990
 epoch: 9, train_loss: 0.8492, test_loss: 1.0745, test_f1: 0.5673
 epoch: 10, train_loss: 0.8360, test_loss: 1.0622, test_f1: 0.5676
 epoch: 11, train_loss: 0.8166, test_loss: 1.0160, test_f1: 0.5773
 epoch: 12, train_loss: 0.8244, test_loss: 1.0252, test_f1: 0.5986
 epoch: 13, train_loss: 0.7933, test_loss: 1.0343, test_f1: 0.5639
 epoch: 14, train_loss: 0.7812, test_loss: 1.0236, test_f1: 0.6183
 epoch: 15, train_loss: 0.7701, test_loss: 1.0176, test_f1: 0.5956
 epoch: 16, train_loss: 0.7446, test_loss: 1.0712, test_f1: 0.5897
 epoch: 17, train_loss: 0.7340, test_loss: 1.0968, test_f1: 0.5974
 epoch: 18, train_loss: 0.7456, test_loss: 1.0772, test_f1: 0.5855
 epoch: 19, train_loss: 0.7187, test_loss: 1.0828, test_f1: 0.5680
 epoch: 20, train_loss: 0.7074, test_loss: 1.0568, test_f1: 0.5933
 epoch: 21, train_loss: 0.7153, test_loss: 1.1563, test_f1: 0.5772
 epoch: 22, train_loss: 0.7251, test_loss: 1.1867, test_f1: 0.5576
 epoch: 23, train_loss: 0.7107, test_loss: 1.1361, test_f1: 0.6204
 epoch: 24, train_loss: 0.6843, test_loss: 1.1860, test_f1: 0.5315
 epoch: 25, train_loss: 0.6862, test_loss: 1.1087, test_f1: 0.6038
 epoch: 26, train_loss: 0.6697, test_loss: 1.1282, test_f1: 0.6138
 epoch: 27, train_loss: 0.6635, test_loss: 1.1392, test_f1: 0.6501
 epoch: 28, train_loss: 0.6531, test_loss: 1.1443, test_f1: 0.5874
 epoch: 29, train_loss: 0.6231, test_loss: 1.1869, test_f1: 0.6082
 epoch: 30, train_loss: 0.6264, test_loss: 1.1395, test_f1: 0.6121
 epoch: 31, train_loss: 0.6175, test_loss: 1.3013, test_f1: 0.5654
 epoch: 32, train_loss: 0.6262, test_loss: 1.2579, test_f1: 0.6619
 epoch: 33, train_loss: 0.6102, test_loss: 1.1929, test_f1: 0.6059
 epoch: 34, train_loss: 0.6212, test_loss: 1.2058, test_f1: 0.6034
 epoch: 35, train_loss: 0.6178, test_loss: 1.0412, test_f1: 0.6303
 epoch: 36, train_loss: 0.5798, test_loss: 1.1817, test_f1: 0.5529
 epoch: 37, train_loss: 0.5968, test_loss: 1.1819, test_f1: 0.5827
 epoch: 38, train_loss: 0.5869, test_loss: 1.3471, test_f1: 0.5688
 epoch: 39, train_loss: 0.5847, test_loss: 1.2493, test_f1: 0.5896
 epoch: 40, train_loss: 0.5514, test_loss: 1.2048, test_f1: 0.6230
 epoch: 41, train_loss: 0.5387, test_loss: 1.1967, test_f1: 0.6381
 epoch: 42, train_loss: 0.5465, test_loss: 1.3614, test_f1: 0.5130
 epoch: 43, train_loss: 0.5552, test_loss: 1.3056, test_f1: 0.6036
 epoch: 44, train_loss: 0.5440, test_loss: 1.3267, test_f1: 0.6075
 epoch: 45, train_loss: 0.5117, test_loss: 1.2895, test_f1: 0.6635
 epoch: 46, train_loss: 0.5038, test_loss: 1.2459, test_f1: 0.6457
 epoch: 47, train_loss: 0.5099, test_loss: 1.3200, test_f1: 0.6015
 epoch: 48, train_loss: 0.4919, test_loss: 1.3822, test_f1: 0.6196
 epoch: 49, train_loss: 0.4885, test_loss: 1.4465, test_f1: 0.6233
 epoch: 50, train_loss: 0.5291, test_loss: 1.3438, test_f1: 0.5771
 epoch: 51, train_loss: 0.4581, test_loss: 1.3454, test_f1: 0.6355
 epoch: 52, train_loss: 0.4566, test_loss: 1.4832, test_f1: 0.5912
 epoch: 53, train_loss: 0.4553, test_loss: 1.4307, test_f1: 0.5764
 epoch: 54, train_loss: 0.4371, test_loss: 1.4041, test_f1: 0.6038
 epoch: 55, train_loss: 0.4352, test_loss: 1.3611, test_f1: 0.5791
 epoch: 56, train_loss: 0.4301, test_loss: 1.5408, test_f1: 0.5933
 epoch: 57, train_loss: 0.4055, test_loss: 1.4538, test_f1: 0.5876
 epoch: 58, train_loss: 0.4071, test_loss: 1.3700, test_f1: 0.6232
 epoch: 59, train_loss: 0.4266, test_loss: 1.4871, test_f1: 0.5727
 epoch: 60, train_loss: 0.3995, test_loss: 1.5104, test_f1: 0.5963
 epoch: 61, train_loss: 0.3854, test_loss: 1.2836, test_f1: 0.6334
 epoch: 62, train_loss: 0.3836, test_loss: 1.4007, test_f1: 0.6055
 epoch: 63, train_loss: 0.4008, test_loss: 1.4898, test_f1: 0.6299
 epoch: 64, train_loss: 0.4065, test_loss: 1.4601, test_f1: 0.5992
 epoch: 65, train_loss: 0.3888, test_loss: 1.5335, test_f1: 0.6011
 epoch: 66, train_loss: 0.3589, test_loss: 1.5423, test_f1: 0.6124
 epoch: 67, train_loss: 0.3812, test_loss: 1.4464, test_f1: 0.6003
 epoch: 68, train_loss: 0.3707, test_loss: 1.5656, test_f1: 0.5957
 epoch: 69, train_loss: 0.3834, test_loss: 1.4767, test_f1: 0.6420
 epoch: 70, train_loss: 0.3752, test_loss: 1.5478, test_f1: 0.5994
 epoch: 71, train_loss: 0.3603, test_loss: 1.6343, test_f1: 0.5966
 epoch: 72, train_loss: 0.3465, test_loss: 1.6327, test_f1: 0.6186
 epoch: 73, train_loss: 0.3384, test_loss: 1.7981, test_f1: 0.5971
 epoch: 74, train_loss: 0.3426, test_loss: 1.7094, test_f1: 0.5913
 epoch: 75, train_loss: 0.3383, test_loss: 1.6493, test_f1: 0.6051
 epoch: 76, train_loss: 0.3382, test_loss: 1.6270, test_f1: 0.5998
 epoch: 77, train_loss: 0.3408, test_loss: 1.6800, test_f1: 0.6215
 epoch: 78, train_loss: 0.3563, test_loss: 1.6037, test_f1: 0.6355
 epoch: 79, train_loss: 0.3427, test_loss: 1.6547, test_f1: 0.6089
 epoch: 80, train_loss: 0.3284, test_loss: 1.5551, test_f1: 0.6069
 epoch: 81, train_loss: 0.3072, test_loss: 1.7154, test_f1: 0.5892
 epoch: 82, train_loss: 0.3156, test_loss: 1.7697, test_f1: 0.5736
 epoch: 83, train_loss: 0.3103, test_loss: 1.6741, test_f1: 0.6130
 epoch: 84, train_loss: 0.3037, test_loss: 1.7882, test_f1: 0.5899
 epoch: 85, train_loss: 0.3089, test_loss: 1.7867, test_f1: 0.5505
 epoch: 86, train_loss: 0.3183, test_loss: 1.8265, test_f1: 0.5894
 epoch: 87, train_loss: 0.3096, test_loss: 1.8617, test_f1: 0.5938
 epoch: 88, train_loss: 0.3078, test_loss: 1.8824, test_f1: 0.6036
 epoch: 89, train_loss: 0.2972, test_loss: 1.8226, test_f1: 0.6340
 epoch: 90, train_loss: 0.3332, test_loss: 1.9076, test_f1: 0.6068
 epoch: 91, train_loss: 0.3178, test_loss: 1.7050, test_f1: 0.6098
 epoch: 92, train_loss: 0.2843, test_loss: 1.7260, test_f1: 0.5928
 epoch: 93, train_loss: 0.2848, test_loss: 1.8148, test_f1: 0.6006
 epoch: 94, train_loss: 0.2672, test_loss: 1.7934, test_f1: 0.5905
 epoch: 95, train_loss: 0.2815, test_loss: 1.8728, test_f1: 0.5680
 epoch: 96, train_loss: 0.2801, test_loss: 2.0568, test_f1: 0.5777
 epoch: 97, train_loss: 0.2697, test_loss: 1.8349, test_f1: 0.5826
 epoch: 98, train_loss: 0.2757, test_loss: 1.8534, test_f1: 0.5781
 epoch: 99, train_loss: 0.2550, test_loss: 1.9528, test_f1: 0.5778
##################ITERATION #8 ****************************************
 epoch: 0, train_loss: 1.4034, test_loss: 1.4064, test_f1: 0.1365
 epoch: 1, train_loss: 1.1163, test_loss: 1.4332, test_f1: 0.1365
 epoch: 2, train_loss: 1.0431, test_loss: 1.3961, test_f1: 0.1377
 epoch: 3, train_loss: 0.9915, test_loss: 1.3324, test_f1: 0.1634
 epoch: 4, train_loss: 0.9655, test_loss: 1.2267, test_f1: 0.3156
 epoch: 5, train_loss: 0.9341, test_loss: 1.1536, test_f1: 0.4822
 epoch: 6, train_loss: 0.9073, test_loss: 1.1196, test_f1: 0.4583
 epoch: 7, train_loss: 0.8916, test_loss: 1.1146, test_f1: 0.4885
 epoch: 8, train_loss: 0.8773, test_loss: 1.1385, test_f1: 0.4727
 epoch: 9, train_loss: 0.8362, test_loss: 1.1466, test_f1: 0.5339
 epoch: 10, train_loss: 0.8256, test_loss: 1.1204, test_f1: 0.5551
 epoch: 11, train_loss: 0.8091, test_loss: 1.1053, test_f1: 0.6201
 epoch: 12, train_loss: 0.7937, test_loss: 1.1531, test_f1: 0.5459
 epoch: 13, train_loss: 0.8283, test_loss: 1.2166, test_f1: 0.5722
 epoch: 14, train_loss: 0.7938, test_loss: 1.2632, test_f1: 0.5720
 epoch: 15, train_loss: 0.7807, test_loss: 1.1747, test_f1: 0.5498
 epoch: 16, train_loss: 0.7604, test_loss: 1.1279, test_f1: 0.5718
 epoch: 17, train_loss: 0.7874, test_loss: 1.2894, test_f1: 0.5188
 epoch: 18, train_loss: 0.7594, test_loss: 1.4042, test_f1: 0.4845
 epoch: 19, train_loss: 0.7536, test_loss: 1.1696, test_f1: 0.5456
 epoch: 20, train_loss: 0.7369, test_loss: 1.1288, test_f1: 0.5786
 epoch: 21, train_loss: 0.7176, test_loss: 1.2155, test_f1: 0.5641
 epoch: 22, train_loss: 0.7031, test_loss: 1.2783, test_f1: 0.5642
 epoch: 23, train_loss: 0.7144, test_loss: 1.1517, test_f1: 0.5710
 epoch: 24, train_loss: 0.6900, test_loss: 1.2460, test_f1: 0.5774
 epoch: 25, train_loss: 0.6838, test_loss: 1.3077, test_f1: 0.5713
 epoch: 26, train_loss: 0.6572, test_loss: 1.2942, test_f1: 0.5697
 epoch: 27, train_loss: 0.6409, test_loss: 1.2842, test_f1: 0.5986
 epoch: 28, train_loss: 0.6424, test_loss: 1.3623, test_f1: 0.5509
 epoch: 29, train_loss: 0.6376, test_loss: 1.3815, test_f1: 0.5372
 epoch: 30, train_loss: 0.6326, test_loss: 1.3370, test_f1: 0.5764
 epoch: 31, train_loss: 0.6216, test_loss: 1.3292, test_f1: 0.6063
 epoch: 32, train_loss: 0.6083, test_loss: 1.3669, test_f1: 0.5811
 epoch: 33, train_loss: 0.6277, test_loss: 1.4569, test_f1: 0.5589
 epoch: 34, train_loss: 0.6106, test_loss: 1.4780, test_f1: 0.5563
 epoch: 35, train_loss: 0.6030, test_loss: 1.4360, test_f1: 0.5538
 epoch: 36, train_loss: 0.5738, test_loss: 1.4256, test_f1: 0.5822
 epoch: 37, train_loss: 0.5745, test_loss: 1.4082, test_f1: 0.6027
 epoch: 38, train_loss: 0.5641, test_loss: 1.3929, test_f1: 0.5564
 epoch: 39, train_loss: 0.5694, test_loss: 1.4928, test_f1: 0.5473
 epoch: 40, train_loss: 0.5698, test_loss: 1.4096, test_f1: 0.6014
 epoch: 41, train_loss: 0.5741, test_loss: 1.3303, test_f1: 0.6187
 epoch: 42, train_loss: 0.5693, test_loss: 1.3922, test_f1: 0.5747
 epoch: 43, train_loss: 0.5664, test_loss: 1.7541, test_f1: 0.5392
 epoch: 44, train_loss: 0.6011, test_loss: 1.3356, test_f1: 0.5922
 epoch: 45, train_loss: 0.5666, test_loss: 1.3062, test_f1: 0.5593
 epoch: 46, train_loss: 0.5909, test_loss: 1.3718, test_f1: 0.5405
 epoch: 47, train_loss: 0.5745, test_loss: 1.3817, test_f1: 0.6163
 epoch: 48, train_loss: 0.5475, test_loss: 1.3882, test_f1: 0.5645
 epoch: 49, train_loss: 0.5276, test_loss: 1.6096, test_f1: 0.5523
 epoch: 50, train_loss: 0.5620, test_loss: 1.2282, test_f1: 0.5908
 epoch: 51, train_loss: 0.5043, test_loss: 1.2528, test_f1: 0.6256
 epoch: 52, train_loss: 0.4779, test_loss: 1.3255, test_f1: 0.6149
 epoch: 53, train_loss: 0.4777, test_loss: 1.3423, test_f1: 0.6105
 epoch: 54, train_loss: 0.4618, test_loss: 1.3381, test_f1: 0.6324
 epoch: 55, train_loss: 0.4426, test_loss: 1.3372, test_f1: 0.6097
 epoch: 56, train_loss: 0.4472, test_loss: 1.3730, test_f1: 0.6085
 epoch: 57, train_loss: 0.4327, test_loss: 1.4241, test_f1: 0.6290
 epoch: 58, train_loss: 0.4230, test_loss: 1.3955, test_f1: 0.5989
 epoch: 59, train_loss: 0.4326, test_loss: 1.4495, test_f1: 0.6138
 epoch: 60, train_loss: 0.4281, test_loss: 1.4245, test_f1: 0.6319
 epoch: 61, train_loss: 0.4272, test_loss: 1.4901, test_f1: 0.6098
 epoch: 62, train_loss: 0.4013, test_loss: 1.4862, test_f1: 0.6177
 epoch: 63, train_loss: 0.4278, test_loss: 1.4719, test_f1: 0.6152
 epoch: 64, train_loss: 0.4178, test_loss: 1.6520, test_f1: 0.6210
 epoch: 65, train_loss: 0.4112, test_loss: 1.5011, test_f1: 0.6252
 epoch: 66, train_loss: 0.3921, test_loss: 1.5023, test_f1: 0.6177
 epoch: 67, train_loss: 0.3816, test_loss: 1.7369, test_f1: 0.6310
 epoch: 68, train_loss: 0.4101, test_loss: 1.6460, test_f1: 0.6173
 epoch: 69, train_loss: 0.3929, test_loss: 1.6732, test_f1: 0.5999
 epoch: 70, train_loss: 0.3964, test_loss: 1.5401, test_f1: 0.6056
 epoch: 71, train_loss: 0.3952, test_loss: 1.4526, test_f1: 0.6127
 epoch: 72, train_loss: 0.3889, test_loss: 1.4963, test_f1: 0.6073
 epoch: 73, train_loss: 0.4169, test_loss: 1.3672, test_f1: 0.6029
 epoch: 74, train_loss: 0.3938, test_loss: 1.5143, test_f1: 0.6289
 epoch: 75, train_loss: 0.3726, test_loss: 1.5543, test_f1: 0.6215
 epoch: 76, train_loss: 0.3578, test_loss: 1.6419, test_f1: 0.6181
 epoch: 77, train_loss: 0.3597, test_loss: 1.6384, test_f1: 0.6330
 epoch: 78, train_loss: 0.3612, test_loss: 1.5952, test_f1: 0.6250
 epoch: 79, train_loss: 0.3377, test_loss: 1.6165, test_f1: 0.6293
 epoch: 80, train_loss: 0.3358, test_loss: 1.5990, test_f1: 0.6217
 epoch: 81, train_loss: 0.3285, test_loss: 1.5588, test_f1: 0.6230
 epoch: 82, train_loss: 0.3275, test_loss: 1.6413, test_f1: 0.6144
 epoch: 83, train_loss: 0.3285, test_loss: 1.6096, test_f1: 0.6130
 epoch: 84, train_loss: 0.3527, test_loss: 1.5289, test_f1: 0.6438
 epoch: 85, train_loss: 0.3226, test_loss: 1.5989, test_f1: 0.6336
 epoch: 86, train_loss: 0.3297, test_loss: 1.6186, test_f1: 0.5948
 epoch: 87, train_loss: 0.3433, test_loss: 1.6032, test_f1: 0.6340
 epoch: 88, train_loss: 0.3649, test_loss: 1.6324, test_f1: 0.6031
 epoch: 89, train_loss: 0.3923, test_loss: 1.8880, test_f1: 0.5887
 epoch: 90, train_loss: 0.3754, test_loss: 1.9130, test_f1: 0.5982
 epoch: 91, train_loss: 0.3551, test_loss: 1.6866, test_f1: 0.6211
 epoch: 92, train_loss: 0.3659, test_loss: 1.7090, test_f1: 0.6015
 epoch: 93, train_loss: 0.3334, test_loss: 1.5918, test_f1: 0.6309
 epoch: 94, train_loss: 0.3474, test_loss: 1.7499, test_f1: 0.6081
 epoch: 95, train_loss: 0.3213, test_loss: 1.6645, test_f1: 0.6197
 epoch: 96, train_loss: 0.3057, test_loss: 1.5656, test_f1: 0.6181
 epoch: 97, train_loss: 0.3046, test_loss: 1.6296, test_f1: 0.6383
 epoch: 98, train_loss: 0.3119, test_loss: 1.6148, test_f1: 0.6270
 epoch: 99, train_loss: 0.3018, test_loss: 1.7471, test_f1: 0.6498
##################ITERATION #9 ****************************************
 epoch: 0, train_loss: 1.5082, test_loss: 1.4648, test_f1: 0.1365
 epoch: 1, train_loss: 1.1634, test_loss: 1.4144, test_f1: 0.1365
 epoch: 2, train_loss: 1.0753, test_loss: 1.3536, test_f1: 0.1365
 epoch: 3, train_loss: 1.0150, test_loss: 1.2382, test_f1: 0.2240
 epoch: 4, train_loss: 0.9742, test_loss: 1.1862, test_f1: 0.2823
 epoch: 5, train_loss: 0.9353, test_loss: 1.1556, test_f1: 0.3734
 epoch: 6, train_loss: 0.9007, test_loss: 1.1614, test_f1: 0.3971
 epoch: 7, train_loss: 0.8993, test_loss: 1.1745, test_f1: 0.4153
 epoch: 8, train_loss: 0.8968, test_loss: 1.1506, test_f1: 0.4227
 epoch: 9, train_loss: 0.8552, test_loss: 1.1119, test_f1: 0.4649
 epoch: 10, train_loss: 0.8396, test_loss: 1.1071, test_f1: 0.4876
 epoch: 11, train_loss: 0.8582, test_loss: 1.1305, test_f1: 0.4020
 epoch: 12, train_loss: 0.8307, test_loss: 1.1296, test_f1: 0.5539
 epoch: 13, train_loss: 0.8156, test_loss: 1.1087, test_f1: 0.5664
 epoch: 14, train_loss: 0.8025, test_loss: 1.0920, test_f1: 0.5872
 epoch: 15, train_loss: 0.7799, test_loss: 1.1027, test_f1: 0.5547
 epoch: 16, train_loss: 0.7705, test_loss: 1.1306, test_f1: 0.5866
 epoch: 17, train_loss: 0.7557, test_loss: 1.1674, test_f1: 0.6020
 epoch: 18, train_loss: 0.7369, test_loss: 1.1429, test_f1: 0.6161
 epoch: 19, train_loss: 0.7395, test_loss: 1.1877, test_f1: 0.5740
 epoch: 20, train_loss: 0.7299, test_loss: 1.1159, test_f1: 0.5732
 epoch: 21, train_loss: 0.7447, test_loss: 1.0943, test_f1: 0.5756
 epoch: 22, train_loss: 0.7097, test_loss: 1.1162, test_f1: 0.6068
 epoch: 23, train_loss: 0.6914, test_loss: 1.1433, test_f1: 0.6219
 epoch: 24, train_loss: 0.6936, test_loss: 1.1522, test_f1: 0.5909
 epoch: 25, train_loss: 0.7108, test_loss: 1.2394, test_f1: 0.5801
 epoch: 26, train_loss: 0.6711, test_loss: 1.1336, test_f1: 0.5947
 epoch: 27, train_loss: 0.6891, test_loss: 1.1047, test_f1: 0.6145
 epoch: 28, train_loss: 0.6678, test_loss: 1.2442, test_f1: 0.6069
 epoch: 29, train_loss: 0.6503, test_loss: 1.2940, test_f1: 0.5384
 epoch: 30, train_loss: 0.6427, test_loss: 1.2324, test_f1: 0.5746
 epoch: 31, train_loss: 0.6604, test_loss: 1.2734, test_f1: 0.5839
 epoch: 32, train_loss: 0.6461, test_loss: 1.2002, test_f1: 0.5759
 epoch: 33, train_loss: 0.6121, test_loss: 1.2451, test_f1: 0.6022
 epoch: 34, train_loss: 0.6096, test_loss: 1.3275, test_f1: 0.5862
 epoch: 35, train_loss: 0.6251, test_loss: 1.2101, test_f1: 0.6054
 epoch: 36, train_loss: 0.6026, test_loss: 1.2080, test_f1: 0.6160
 epoch: 37, train_loss: 0.5774, test_loss: 1.2282, test_f1: 0.6058
 epoch: 38, train_loss: 0.6136, test_loss: 1.2882, test_f1: 0.5664
 epoch: 39, train_loss: 0.5926, test_loss: 1.2654, test_f1: 0.5455
 epoch: 40, train_loss: 0.5624, test_loss: 1.2722, test_f1: 0.5443
 epoch: 41, train_loss: 0.5603, test_loss: 1.2731, test_f1: 0.5969
 epoch: 42, train_loss: 0.5283, test_loss: 1.3436, test_f1: 0.5900
 epoch: 43, train_loss: 0.5510, test_loss: 1.3026, test_f1: 0.6170
 epoch: 44, train_loss: 0.5224, test_loss: 1.3969, test_f1: 0.5630
 epoch: 45, train_loss: 0.5134, test_loss: 1.4078, test_f1: 0.5996
 epoch: 46, train_loss: 0.5176, test_loss: 1.4111, test_f1: 0.5699
 epoch: 47, train_loss: 0.4959, test_loss: 1.4036, test_f1: 0.5800
 epoch: 48, train_loss: 0.5049, test_loss: 1.4813, test_f1: 0.5740
 epoch: 49, train_loss: 0.5063, test_loss: 1.6455, test_f1: 0.5848
 epoch: 50, train_loss: 0.5068, test_loss: 1.4379, test_f1: 0.5991
 epoch: 51, train_loss: 0.5170, test_loss: 1.3988, test_f1: 0.6021
 epoch: 52, train_loss: 0.4825, test_loss: 1.3422, test_f1: 0.6102
 epoch: 53, train_loss: 0.4721, test_loss: 1.3638, test_f1: 0.5882
 epoch: 54, train_loss: 0.4881, test_loss: 1.2867, test_f1: 0.5887
 epoch: 55, train_loss: 0.4684, test_loss: 1.2764, test_f1: 0.6277
 epoch: 56, train_loss: 0.4638, test_loss: 1.4307, test_f1: 0.5921
 epoch: 57, train_loss: 0.4867, test_loss: 1.4546, test_f1: 0.5798
 epoch: 58, train_loss: 0.4723, test_loss: 1.3885, test_f1: 0.5853
 epoch: 59, train_loss: 0.4560, test_loss: 1.5697, test_f1: 0.5758
 epoch: 60, train_loss: 0.4460, test_loss: 1.4975, test_f1: 0.5776
 epoch: 61, train_loss: 0.4271, test_loss: 1.4565, test_f1: 0.5626
 epoch: 62, train_loss: 0.4331, test_loss: 1.6260, test_f1: 0.5854
 epoch: 63, train_loss: 0.4169, test_loss: 1.4502, test_f1: 0.6168
 epoch: 64, train_loss: 0.4350, test_loss: 1.4575, test_f1: 0.5814
 epoch: 65, train_loss: 0.4165, test_loss: 1.4081, test_f1: 0.6258
 epoch: 66, train_loss: 0.4198, test_loss: 1.4263, test_f1: 0.5973
 epoch: 67, train_loss: 0.4131, test_loss: 1.6255, test_f1: 0.5813
 epoch: 68, train_loss: 0.4061, test_loss: 1.5483, test_f1: 0.6365
 epoch: 69, train_loss: 0.4078, test_loss: 1.4906, test_f1: 0.6153
 epoch: 70, train_loss: 0.3867, test_loss: 1.5554, test_f1: 0.5864
 epoch: 71, train_loss: 0.4014, test_loss: 1.4576, test_f1: 0.5886
 epoch: 72, train_loss: 0.3871, test_loss: 1.6199, test_f1: 0.6216
 epoch: 73, train_loss: 0.4088, test_loss: 1.6281, test_f1: 0.5926
 epoch: 74, train_loss: 0.3877, test_loss: 1.5101, test_f1: 0.6185
 epoch: 75, train_loss: 0.3763, test_loss: 1.5224, test_f1: 0.5857
 epoch: 76, train_loss: 0.3691, test_loss: 1.5847, test_f1: 0.5921
 epoch: 77, train_loss: 0.3847, test_loss: 1.6454, test_f1: 0.6077
 epoch: 78, train_loss: 0.3688, test_loss: 1.6880, test_f1: 0.6131
 epoch: 79, train_loss: 0.3859, test_loss: 1.6442, test_f1: 0.6053
 epoch: 80, train_loss: 0.3728, test_loss: 1.8049, test_f1: 0.5959
 epoch: 81, train_loss: 0.3477, test_loss: 1.7440, test_f1: 0.6051
 epoch: 82, train_loss: 0.3824, test_loss: 1.5833, test_f1: 0.5565
 epoch: 83, train_loss: 0.3745, test_loss: 1.6421, test_f1: 0.6052
 epoch: 84, train_loss: 0.3398, test_loss: 1.6534, test_f1: 0.6145
 epoch: 85, train_loss: 0.3531, test_loss: 1.7220, test_f1: 0.6148
 epoch: 86, train_loss: 0.3466, test_loss: 1.7200, test_f1: 0.6177
 epoch: 87, train_loss: 0.3608, test_loss: 1.7874, test_f1: 0.5967
 epoch: 88, train_loss: 0.3445, test_loss: 1.9682, test_f1: 0.5797
 epoch: 89, train_loss: 0.3574, test_loss: 1.7701, test_f1: 0.6195
 epoch: 90, train_loss: 0.3402, test_loss: 1.6552, test_f1: 0.6284
 epoch: 91, train_loss: 0.3198, test_loss: 1.7703, test_f1: 0.5997
 epoch: 92, train_loss: 0.3191, test_loss: 1.7904, test_f1: 0.5804
 epoch: 93, train_loss: 0.3228, test_loss: 1.8117, test_f1: 0.5759
 epoch: 94, train_loss: 0.3208, test_loss: 1.8946, test_f1: 0.6092
 epoch: 95, train_loss: 0.3295, test_loss: 1.8913, test_f1: 0.5957
 epoch: 96, train_loss: 0.3371, test_loss: 2.0283, test_f1: 0.5829
 epoch: 97, train_loss: 0.3141, test_loss: 1.9135, test_f1: 0.5679
 epoch: 98, train_loss: 0.3158, test_loss: 2.0440, test_f1: 0.5747
 epoch: 99, train_loss: 0.3388, test_loss: 1.8777, test_f1: 0.5845

Training completed in 284.98 seconds
Best F1: 0.6827 at epoch 99
Mean F1 across iterations: 0.6510  0.0152
========================FINAL RESULTS================================
FEGIN weighted F1: 0.6827  0.0152
python main.py --data ltspice_demos --representation component_net --model FEGIN --layers 2 --hiddens 128 --batch_size 256 --lr 0.001 --emb_size 250 --epochs 100 --save_appendix component_net_L2_H128_BS256_LR0.001_E250 --no_val
-----



STDERR:
  File "main.py", line 370, in <module>
    main()
  File "main.py", line 254, in main
    dataset = dataset_class(
  File "/home/philip/projects/ltspice_examples_code_repo/Circuit-Completion-Using-GNNs/component_classification_with_link_prediction_head/evaluation/FEGIN/kernel/circuit_datasets.py", line 15, in __init__
    self.data, self.slices = torch.load(self.processed_paths[0])
  File "/home/philip/.local/lib/python3.8/site-packages/torch/serialization.py", line 1040, in load
    warnings.warn(
  File "/usr/lib/python3.8/warnings.py", line 109, in _showwarnmsg
    sw(msg.message, msg.category, msg.filename, msg.lineno,
  File "main.py", line 47, in warn_with_traceback
    traceback.print_stack(file=log)
/home/philip/projects/ltspice_examples_code_repo/Circuit-Completion-Using-GNNs/component_classification_with_link_prediction_head/evaluation/FEGIN/kernel/circuit_datasets.py:15: FutureWarning: You are using `torch.load` with `weights_only=False` (the current default value), which uses the default pickle module implicitly. It is possible to construct malicious pickle data which will execute arbitrary code during unpickling (See https://github.com/pytorch/pytorch/blob/main/SECURITY.md#untrusted-models for more details). In a future release, the default value for `weights_only` will be flipped to `True`. This limits the functions that could be executed during unpickling. Arbitrary objects will no longer be allowed to be loaded via this mode unless they are explicitly allowlisted by the user via `torch.serialization.add_safe_globals`. We recommend you start setting `weights_only=True` for any use case where you don't have full control of the loaded file. Please open an issue on GitHub for any issues related to this experimental feature.
  self.data, self.slices = torch.load(self.processed_paths[0])
