STDOUT:
Results will be saved in /home/philip/projects/ltspice_examples_code_repo/Circuit-Completion-Using-GNNs/component_classification_with_link_prediction_head/evaluation/FEGIN/results/model_FEGIN_dataset_ltspice_demos
Command line input: python main.py --data ltspice_demos --representation component_net --model FEGIN --layers 2 --hiddens 16 --batch_size 256 --lr 0.001 --emb_size 250 --epochs 100 --save_appendix component_net_L2_H16_BS256_LR0.001_E250 --no_val
 is saved.
-----
ltspice_demos - FEGIN
Using 2 layers, 16 hidden units, h = 2
Loading component_net representation dataset
ENTERED
Training FEGIN on component_net representation
Train: 1565, Test: 383
##################ITERATION #0 ****************************************
 epoch: 0, train_loss: 1.4174, test_loss: 1.4097, test_f1: 0.0507
 epoch: 1, train_loss: 1.4017, test_loss: 1.4030, test_f1: 0.0507
 epoch: 2, train_loss: 1.3920, test_loss: 1.3968, test_f1: 0.1370
 epoch: 3, train_loss: 1.3825, test_loss: 1.3908, test_f1: 0.1365
 epoch: 4, train_loss: 1.3739, test_loss: 1.3852, test_f1: 0.1365
 epoch: 5, train_loss: 1.3663, test_loss: 1.3795, test_f1: 0.1365
 epoch: 6, train_loss: 1.3556, test_loss: 1.3725, test_f1: 0.1365
 epoch: 7, train_loss: 1.3438, test_loss: 1.3638, test_f1: 0.1365
 epoch: 8, train_loss: 1.3313, test_loss: 1.3531, test_f1: 0.1365
 epoch: 9, train_loss: 1.3166, test_loss: 1.3401, test_f1: 0.1365
 epoch: 10, train_loss: 1.2997, test_loss: 1.3267, test_f1: 0.1365
 epoch: 11, train_loss: 1.2828, test_loss: 1.3122, test_f1: 0.1365
 epoch: 12, train_loss: 1.2642, test_loss: 1.2973, test_f1: 0.1430
 epoch: 13, train_loss: 1.2455, test_loss: 1.2837, test_f1: 0.2213
 epoch: 14, train_loss: 1.2293, test_loss: 1.2725, test_f1: 0.3372
 epoch: 15, train_loss: 1.2192, test_loss: 1.2648, test_f1: 0.3438
 epoch: 16, train_loss: 1.2062, test_loss: 1.2598, test_f1: 0.3279
 epoch: 17, train_loss: 1.1985, test_loss: 1.2548, test_f1: 0.3397
 epoch: 18, train_loss: 1.1944, test_loss: 1.2530, test_f1: 0.3229
 epoch: 19, train_loss: 1.1877, test_loss: 1.2519, test_f1: 0.3230
 epoch: 20, train_loss: 1.1743, test_loss: 1.2451, test_f1: 0.3230
 epoch: 21, train_loss: 1.1724, test_loss: 1.2401, test_f1: 0.3230
 epoch: 22, train_loss: 1.1668, test_loss: 1.2357, test_f1: 0.3297
 epoch: 23, train_loss: 1.1636, test_loss: 1.2312, test_f1: 0.3229
 epoch: 24, train_loss: 1.1607, test_loss: 1.2257, test_f1: 0.3268
 epoch: 25, train_loss: 1.1464, test_loss: 1.2165, test_f1: 0.3245
 epoch: 26, train_loss: 1.1503, test_loss: 1.2144, test_f1: 0.3250
 epoch: 27, train_loss: 1.1454, test_loss: 1.2087, test_f1: 0.3251
 epoch: 28, train_loss: 1.1402, test_loss: 1.2017, test_f1: 0.3305
 epoch: 29, train_loss: 1.1282, test_loss: 1.1991, test_f1: 0.3305
 epoch: 30, train_loss: 1.1265, test_loss: 1.2019, test_f1: 0.3310
 epoch: 31, train_loss: 1.1231, test_loss: 1.1991, test_f1: 0.3261
 epoch: 32, train_loss: 1.1176, test_loss: 1.1880, test_f1: 0.3265
 epoch: 33, train_loss: 1.1161, test_loss: 1.1830, test_f1: 0.3345
 epoch: 34, train_loss: 1.1076, test_loss: 1.1811, test_f1: 0.3357
 epoch: 35, train_loss: 1.1021, test_loss: 1.1741, test_f1: 0.3439
 epoch: 36, train_loss: 1.1027, test_loss: 1.1674, test_f1: 0.3534
 epoch: 37, train_loss: 1.0924, test_loss: 1.1595, test_f1: 0.3758
 epoch: 38, train_loss: 1.0881, test_loss: 1.1628, test_f1: 0.3890
 epoch: 39, train_loss: 1.0745, test_loss: 1.1741, test_f1: 0.3924
 epoch: 40, train_loss: 1.0829, test_loss: 1.1679, test_f1: 0.4180
 epoch: 41, train_loss: 1.0773, test_loss: 1.1568, test_f1: 0.4224
 epoch: 42, train_loss: 1.0721, test_loss: 1.1448, test_f1: 0.4271
 epoch: 43, train_loss: 1.0640, test_loss: 1.1444, test_f1: 0.4313
 epoch: 44, train_loss: 1.0589, test_loss: 1.1618, test_f1: 0.4309
 epoch: 45, train_loss: 1.0450, test_loss: 1.1742, test_f1: 0.4342
 epoch: 46, train_loss: 1.0457, test_loss: 1.1777, test_f1: 0.4318
 epoch: 47, train_loss: 1.0476, test_loss: 1.1669, test_f1: 0.4241
 epoch: 48, train_loss: 1.0406, test_loss: 1.1581, test_f1: 0.4241
 epoch: 49, train_loss: 1.0337, test_loss: 1.1462, test_f1: 0.4105
 epoch: 50, train_loss: 1.0377, test_loss: 1.1557, test_f1: 0.4174
 epoch: 51, train_loss: 1.0299, test_loss: 1.1484, test_f1: 0.4222
 epoch: 52, train_loss: 1.0365, test_loss: 1.1433, test_f1: 0.4222
 epoch: 53, train_loss: 1.0236, test_loss: 1.1345, test_f1: 0.4162
 epoch: 54, train_loss: 1.0189, test_loss: 1.1394, test_f1: 0.4190
 epoch: 55, train_loss: 1.0219, test_loss: 1.1460, test_f1: 0.4190
 epoch: 56, train_loss: 1.0249, test_loss: 1.1507, test_f1: 0.4197
 epoch: 57, train_loss: 1.0219, test_loss: 1.1516, test_f1: 0.4252
 epoch: 58, train_loss: 1.0197, test_loss: 1.1498, test_f1: 0.4245
 epoch: 59, train_loss: 1.0086, test_loss: 1.1481, test_f1: 0.4125
 epoch: 60, train_loss: 1.0164, test_loss: 1.1447, test_f1: 0.4226
 epoch: 61, train_loss: 1.0072, test_loss: 1.1464, test_f1: 0.4224
 epoch: 62, train_loss: 1.0162, test_loss: 1.1559, test_f1: 0.4296
 epoch: 63, train_loss: 1.0052, test_loss: 1.1670, test_f1: 0.4252
 epoch: 64, train_loss: 0.9971, test_loss: 1.1617, test_f1: 0.4174
 epoch: 65, train_loss: 1.0108, test_loss: 1.1625, test_f1: 0.4177
 epoch: 66, train_loss: 0.9968, test_loss: 1.1657, test_f1: 0.4311
 epoch: 67, train_loss: 1.0004, test_loss: 1.1579, test_f1: 0.4144
 epoch: 68, train_loss: 0.9969, test_loss: 1.1535, test_f1: 0.4315
 epoch: 69, train_loss: 1.0030, test_loss: 1.1407, test_f1: 0.4174
 epoch: 70, train_loss: 1.0021, test_loss: 1.1399, test_f1: 0.4187
 epoch: 71, train_loss: 0.9969, test_loss: 1.1471, test_f1: 0.4344
 epoch: 72, train_loss: 1.0008, test_loss: 1.1540, test_f1: 0.4319
 epoch: 73, train_loss: 0.9974, test_loss: 1.1633, test_f1: 0.4399
 epoch: 74, train_loss: 0.9880, test_loss: 1.1791, test_f1: 0.4482
 epoch: 75, train_loss: 0.9934, test_loss: 1.1578, test_f1: 0.4322
 epoch: 76, train_loss: 0.9876, test_loss: 1.1616, test_f1: 0.4301
 epoch: 77, train_loss: 0.9936, test_loss: 1.1570, test_f1: 0.4364
 epoch: 78, train_loss: 0.9918, test_loss: 1.1424, test_f1: 0.4408
 epoch: 79, train_loss: 0.9849, test_loss: 1.1460, test_f1: 0.4373
 epoch: 80, train_loss: 0.9882, test_loss: 1.1423, test_f1: 0.4241
 epoch: 81, train_loss: 0.9890, test_loss: 1.1326, test_f1: 0.4568
 epoch: 82, train_loss: 0.9942, test_loss: 1.1362, test_f1: 0.4209
 epoch: 83, train_loss: 0.9976, test_loss: 1.1564, test_f1: 0.4370
 epoch: 84, train_loss: 0.9873, test_loss: 1.1575, test_f1: 0.4208
 epoch: 85, train_loss: 0.9871, test_loss: 1.1533, test_f1: 0.4202
 epoch: 86, train_loss: 0.9793, test_loss: 1.1514, test_f1: 0.4202
 epoch: 87, train_loss: 0.9821, test_loss: 1.1559, test_f1: 0.4263
 epoch: 88, train_loss: 0.9829, test_loss: 1.1464, test_f1: 0.4344
 epoch: 89, train_loss: 0.9790, test_loss: 1.1431, test_f1: 0.4343
 epoch: 90, train_loss: 0.9815, test_loss: 1.1391, test_f1: 0.4328
 epoch: 91, train_loss: 0.9768, test_loss: 1.1342, test_f1: 0.4608
 epoch: 92, train_loss: 0.9877, test_loss: 1.1305, test_f1: 0.4657
 epoch: 93, train_loss: 0.9817, test_loss: 1.1448, test_f1: 0.4539
 epoch: 94, train_loss: 0.9765, test_loss: 1.1562, test_f1: 0.4628
 epoch: 95, train_loss: 0.9739, test_loss: 1.1388, test_f1: 0.4601
 epoch: 96, train_loss: 0.9827, test_loss: 1.1215, test_f1: 0.4542
 epoch: 97, train_loss: 0.9770, test_loss: 1.1190, test_f1: 0.4293
 epoch: 98, train_loss: 0.9687, test_loss: 1.1245, test_f1: 0.4245
 epoch: 99, train_loss: 0.9659, test_loss: 1.1335, test_f1: 0.4352
##################ITERATION #1 ****************************************
 epoch: 0, train_loss: 1.3484, test_loss: 1.3606, test_f1: 0.1365
 epoch: 1, train_loss: 1.3124, test_loss: 1.3551, test_f1: 0.1365
 epoch: 2, train_loss: 1.2933, test_loss: 1.3472, test_f1: 0.1365
 epoch: 3, train_loss: 1.2787, test_loss: 1.3390, test_f1: 0.1365
 epoch: 4, train_loss: 1.2590, test_loss: 1.3287, test_f1: 0.1365
 epoch: 5, train_loss: 1.2460, test_loss: 1.3145, test_f1: 0.1365
 epoch: 6, train_loss: 1.2338, test_loss: 1.2967, test_f1: 0.1365
 epoch: 7, train_loss: 1.2228, test_loss: 1.2772, test_f1: 0.1738
 epoch: 8, train_loss: 1.2151, test_loss: 1.2584, test_f1: 0.2259
 epoch: 9, train_loss: 1.1954, test_loss: 1.2455, test_f1: 0.2715
 epoch: 10, train_loss: 1.1865, test_loss: 1.2341, test_f1: 0.2769
 epoch: 11, train_loss: 1.1787, test_loss: 1.2244, test_f1: 0.2925
 epoch: 12, train_loss: 1.1682, test_loss: 1.2129, test_f1: 0.2600
 epoch: 13, train_loss: 1.1586, test_loss: 1.2051, test_f1: 0.2733
 epoch: 14, train_loss: 1.1497, test_loss: 1.2073, test_f1: 0.2735
 epoch: 15, train_loss: 1.1395, test_loss: 1.2120, test_f1: 0.2714
 epoch: 16, train_loss: 1.1290, test_loss: 1.2116, test_f1: 0.2981
 epoch: 17, train_loss: 1.1220, test_loss: 1.1998, test_f1: 0.3204
 epoch: 18, train_loss: 1.1150, test_loss: 1.1983, test_f1: 0.3215
 epoch: 19, train_loss: 1.1127, test_loss: 1.2055, test_f1: 0.3201
 epoch: 20, train_loss: 1.0988, test_loss: 1.2162, test_f1: 0.2981
 epoch: 21, train_loss: 1.0916, test_loss: 1.1914, test_f1: 0.3111
 epoch: 22, train_loss: 1.0996, test_loss: 1.1826, test_f1: 0.3333
 epoch: 23, train_loss: 1.0732, test_loss: 1.1953, test_f1: 0.3577
 epoch: 24, train_loss: 1.0832, test_loss: 1.1823, test_f1: 0.3574
 epoch: 25, train_loss: 1.0706, test_loss: 1.1757, test_f1: 0.3598
 epoch: 26, train_loss: 1.0762, test_loss: 1.1813, test_f1: 0.3626
 epoch: 27, train_loss: 1.0536, test_loss: 1.1834, test_f1: 0.3603
 epoch: 28, train_loss: 1.0597, test_loss: 1.1748, test_f1: 0.3603
 epoch: 29, train_loss: 1.0559, test_loss: 1.1898, test_f1: 0.3625
 epoch: 30, train_loss: 1.0526, test_loss: 1.1904, test_f1: 0.3590
 epoch: 31, train_loss: 1.0449, test_loss: 1.1838, test_f1: 0.3616
 epoch: 32, train_loss: 1.0339, test_loss: 1.1617, test_f1: 0.3669
 epoch: 33, train_loss: 1.0391, test_loss: 1.1533, test_f1: 0.3669
 epoch: 34, train_loss: 1.0239, test_loss: 1.1561, test_f1: 0.3651
 epoch: 35, train_loss: 1.0310, test_loss: 1.1669, test_f1: 0.3517
 epoch: 36, train_loss: 1.0288, test_loss: 1.1626, test_f1: 0.3517
 epoch: 37, train_loss: 1.0229, test_loss: 1.1827, test_f1: 0.3656
 epoch: 38, train_loss: 1.0297, test_loss: 1.1533, test_f1: 0.3722
 epoch: 39, train_loss: 1.0192, test_loss: 1.1668, test_f1: 0.3673
 epoch: 40, train_loss: 1.0203, test_loss: 1.1532, test_f1: 0.3623
 epoch: 41, train_loss: 1.0216, test_loss: 1.1497, test_f1: 0.3513
 epoch: 42, train_loss: 1.0136, test_loss: 1.1492, test_f1: 0.3548
 epoch: 43, train_loss: 1.0085, test_loss: 1.1519, test_f1: 0.3522
 epoch: 44, train_loss: 1.0030, test_loss: 1.1634, test_f1: 0.3524
 epoch: 45, train_loss: 1.0084, test_loss: 1.1328, test_f1: 0.3705
 epoch: 46, train_loss: 1.0073, test_loss: 1.1220, test_f1: 0.3710
 epoch: 47, train_loss: 1.0098, test_loss: 1.1193, test_f1: 0.3731
 epoch: 48, train_loss: 1.0007, test_loss: 1.1618, test_f1: 0.3693
 epoch: 49, train_loss: 1.0063, test_loss: 1.1425, test_f1: 0.3660
 epoch: 50, train_loss: 1.0061, test_loss: 1.1145, test_f1: 0.3725
 epoch: 51, train_loss: 0.9953, test_loss: 1.1291, test_f1: 0.3712
 epoch: 52, train_loss: 1.0032, test_loss: 1.1444, test_f1: 0.3682
 epoch: 53, train_loss: 0.9887, test_loss: 1.1438, test_f1: 0.3682
 epoch: 54, train_loss: 0.9824, test_loss: 1.1388, test_f1: 0.3760
 epoch: 55, train_loss: 0.9882, test_loss: 1.1392, test_f1: 0.3760
 epoch: 56, train_loss: 0.9735, test_loss: 1.1372, test_f1: 0.3755
 epoch: 57, train_loss: 0.9970, test_loss: 1.1320, test_f1: 0.3755
 epoch: 58, train_loss: 0.9948, test_loss: 1.1476, test_f1: 0.3720
 epoch: 59, train_loss: 0.9924, test_loss: 1.1339, test_f1: 0.3723
 epoch: 60, train_loss: 0.9874, test_loss: 1.1337, test_f1: 0.3733
 epoch: 61, train_loss: 0.9863, test_loss: 1.1242, test_f1: 0.3763
 epoch: 62, train_loss: 0.9850, test_loss: 1.1249, test_f1: 0.3733
 epoch: 63, train_loss: 0.9858, test_loss: 1.1330, test_f1: 0.3709
 epoch: 64, train_loss: 0.9860, test_loss: 1.1367, test_f1: 0.3709
 epoch: 65, train_loss: 0.9799, test_loss: 1.1308, test_f1: 0.3733
 epoch: 66, train_loss: 0.9806, test_loss: 1.1219, test_f1: 0.3758
 epoch: 67, train_loss: 0.9805, test_loss: 1.1329, test_f1: 0.3694
 epoch: 68, train_loss: 0.9808, test_loss: 1.1433, test_f1: 0.3704
 epoch: 69, train_loss: 0.9730, test_loss: 1.1310, test_f1: 0.3694
 epoch: 70, train_loss: 0.9754, test_loss: 1.1291, test_f1: 0.3704
 epoch: 71, train_loss: 0.9739, test_loss: 1.1267, test_f1: 0.3760
 epoch: 72, train_loss: 0.9697, test_loss: 1.1350, test_f1: 0.3766
 epoch: 73, train_loss: 0.9800, test_loss: 1.1283, test_f1: 0.3736
 epoch: 74, train_loss: 0.9792, test_loss: 1.1209, test_f1: 0.3763
 epoch: 75, train_loss: 0.9802, test_loss: 1.1257, test_f1: 0.3765
 epoch: 76, train_loss: 0.9736, test_loss: 1.1143, test_f1: 0.3777
 epoch: 77, train_loss: 0.9684, test_loss: 1.1287, test_f1: 0.3753
 epoch: 78, train_loss: 0.9676, test_loss: 1.1469, test_f1: 0.3750
 epoch: 79, train_loss: 0.9681, test_loss: 1.1365, test_f1: 0.3784
 epoch: 80, train_loss: 0.9637, test_loss: 1.1365, test_f1: 0.3806
 epoch: 81, train_loss: 0.9707, test_loss: 1.1257, test_f1: 0.3748
 epoch: 82, train_loss: 0.9721, test_loss: 1.1160, test_f1: 0.3809
 epoch: 83, train_loss: 0.9641, test_loss: 1.1205, test_f1: 0.3799
 epoch: 84, train_loss: 0.9699, test_loss: 1.1319, test_f1: 0.3699
 epoch: 85, train_loss: 0.9754, test_loss: 1.1193, test_f1: 0.3748
 epoch: 86, train_loss: 0.9580, test_loss: 1.1154, test_f1: 0.3772
 epoch: 87, train_loss: 0.9632, test_loss: 1.1227, test_f1: 0.3813
 epoch: 88, train_loss: 0.9625, test_loss: 1.1215, test_f1: 0.3799
 epoch: 89, train_loss: 0.9565, test_loss: 1.1211, test_f1: 0.3711
 epoch: 90, train_loss: 0.9508, test_loss: 1.1245, test_f1: 0.3798
 epoch: 91, train_loss: 0.9611, test_loss: 1.1277, test_f1: 0.3753
 epoch: 92, train_loss: 0.9614, test_loss: 1.1344, test_f1: 0.3817
 epoch: 93, train_loss: 0.9599, test_loss: 1.1396, test_f1: 0.3755
 epoch: 94, train_loss: 0.9528, test_loss: 1.1302, test_f1: 0.3733
 epoch: 95, train_loss: 0.9676, test_loss: 1.1225, test_f1: 0.3829
 epoch: 96, train_loss: 0.9628, test_loss: 1.1277, test_f1: 0.3806
 epoch: 97, train_loss: 0.9539, test_loss: 1.1360, test_f1: 0.3831
 epoch: 98, train_loss: 0.9613, test_loss: 1.1193, test_f1: 0.3926
 epoch: 99, train_loss: 0.9621, test_loss: 1.1389, test_f1: 0.3874
##################ITERATION #2 ****************************************
 epoch: 0, train_loss: 1.2884, test_loss: 1.3247, test_f1: 0.2281
 epoch: 1, train_loss: 1.2487, test_loss: 1.3190, test_f1: 0.1365
 epoch: 2, train_loss: 1.2245, test_loss: 1.3156, test_f1: 0.1365
 epoch: 3, train_loss: 1.2070, test_loss: 1.3138, test_f1: 0.1368
 epoch: 4, train_loss: 1.1863, test_loss: 1.3113, test_f1: 0.3312
 epoch: 5, train_loss: 1.1828, test_loss: 1.3039, test_f1: 0.2765
 epoch: 6, train_loss: 1.1629, test_loss: 1.2921, test_f1: 0.2720
 epoch: 7, train_loss: 1.1509, test_loss: 1.2754, test_f1: 0.3235
 epoch: 8, train_loss: 1.1438, test_loss: 1.2540, test_f1: 0.3288
 epoch: 9, train_loss: 1.1383, test_loss: 1.2343, test_f1: 0.3448
 epoch: 10, train_loss: 1.1327, test_loss: 1.2131, test_f1: 0.3579
 epoch: 11, train_loss: 1.1193, test_loss: 1.2098, test_f1: 0.3503
 epoch: 12, train_loss: 1.1115, test_loss: 1.1994, test_f1: 0.3616
 epoch: 13, train_loss: 1.1081, test_loss: 1.1957, test_f1: 0.3846
 epoch: 14, train_loss: 1.0927, test_loss: 1.1864, test_f1: 0.3921
 epoch: 15, train_loss: 1.0989, test_loss: 1.1840, test_f1: 0.4118
 epoch: 16, train_loss: 1.0843, test_loss: 1.1817, test_f1: 0.4179
 epoch: 17, train_loss: 1.0814, test_loss: 1.1891, test_f1: 0.4207
 epoch: 18, train_loss: 1.0862, test_loss: 1.2043, test_f1: 0.4191
 epoch: 19, train_loss: 1.0716, test_loss: 1.1926, test_f1: 0.4084
 epoch: 20, train_loss: 1.0694, test_loss: 1.1740, test_f1: 0.3988
 epoch: 21, train_loss: 1.0642, test_loss: 1.1696, test_f1: 0.4150
 epoch: 22, train_loss: 1.0588, test_loss: 1.1664, test_f1: 0.4191
 epoch: 23, train_loss: 1.0485, test_loss: 1.1609, test_f1: 0.4300
 epoch: 24, train_loss: 1.0576, test_loss: 1.1735, test_f1: 0.4412
 epoch: 25, train_loss: 1.0448, test_loss: 1.1604, test_f1: 0.4161
 epoch: 26, train_loss: 1.0433, test_loss: 1.1510, test_f1: 0.4187
 epoch: 27, train_loss: 1.0398, test_loss: 1.1620, test_f1: 0.4153
 epoch: 28, train_loss: 1.0339, test_loss: 1.1755, test_f1: 0.4130
 epoch: 29, train_loss: 1.0336, test_loss: 1.1794, test_f1: 0.4432
 epoch: 30, train_loss: 1.0271, test_loss: 1.2133, test_f1: 0.4318
 epoch: 31, train_loss: 1.0281, test_loss: 1.1763, test_f1: 0.4295
 epoch: 32, train_loss: 1.0195, test_loss: 1.1592, test_f1: 0.4322
 epoch: 33, train_loss: 1.0269, test_loss: 1.1783, test_f1: 0.4416
 epoch: 34, train_loss: 1.0055, test_loss: 1.1885, test_f1: 0.4336
 epoch: 35, train_loss: 1.0214, test_loss: 1.1501, test_f1: 0.4347
 epoch: 36, train_loss: 1.0083, test_loss: 1.2051, test_f1: 0.4395
 epoch: 37, train_loss: 1.0178, test_loss: 1.2341, test_f1: 0.4131
 epoch: 38, train_loss: 1.0024, test_loss: 1.1797, test_f1: 0.4373
 epoch: 39, train_loss: 1.0139, test_loss: 1.1613, test_f1: 0.4390
 epoch: 40, train_loss: 1.0071, test_loss: 1.1536, test_f1: 0.4380
 epoch: 41, train_loss: 1.0043, test_loss: 1.1616, test_f1: 0.4360
 epoch: 42, train_loss: 0.9967, test_loss: 1.1573, test_f1: 0.4327
 epoch: 43, train_loss: 0.9935, test_loss: 1.1649, test_f1: 0.4476
 epoch: 44, train_loss: 0.9932, test_loss: 1.1586, test_f1: 0.4599
 epoch: 45, train_loss: 1.0021, test_loss: 1.1900, test_f1: 0.4480
 epoch: 46, train_loss: 0.9959, test_loss: 1.1995, test_f1: 0.4414
 epoch: 47, train_loss: 0.9929, test_loss: 1.1970, test_f1: 0.4328
 epoch: 48, train_loss: 0.9749, test_loss: 1.1605, test_f1: 0.4323
 epoch: 49, train_loss: 0.9817, test_loss: 1.1231, test_f1: 0.4388
 epoch: 50, train_loss: 0.9767, test_loss: 1.1439, test_f1: 0.4195
 epoch: 51, train_loss: 0.9711, test_loss: 1.1590, test_f1: 0.4189
 epoch: 52, train_loss: 0.9806, test_loss: 1.1357, test_f1: 0.4271
 epoch: 53, train_loss: 0.9685, test_loss: 1.1370, test_f1: 0.4396
 epoch: 54, train_loss: 0.9681, test_loss: 1.1467, test_f1: 0.4475
 epoch: 55, train_loss: 0.9737, test_loss: 1.1679, test_f1: 0.4426
 epoch: 56, train_loss: 0.9715, test_loss: 1.1632, test_f1: 0.4372
 epoch: 57, train_loss: 0.9675, test_loss: 1.1757, test_f1: 0.4281
 epoch: 58, train_loss: 0.9719, test_loss: 1.1406, test_f1: 0.4381
 epoch: 59, train_loss: 0.9627, test_loss: 1.1207, test_f1: 0.4256
 epoch: 60, train_loss: 0.9692, test_loss: 1.1454, test_f1: 0.4369
 epoch: 61, train_loss: 0.9675, test_loss: 1.1808, test_f1: 0.4373
 epoch: 62, train_loss: 0.9614, test_loss: 1.1574, test_f1: 0.4298
 epoch: 63, train_loss: 0.9548, test_loss: 1.1155, test_f1: 0.4363
 epoch: 64, train_loss: 0.9628, test_loss: 1.1045, test_f1: 0.4356
 epoch: 65, train_loss: 0.9560, test_loss: 1.1255, test_f1: 0.4418
 epoch: 66, train_loss: 0.9470, test_loss: 1.1680, test_f1: 0.4341
 epoch: 67, train_loss: 0.9548, test_loss: 1.1460, test_f1: 0.4376
 epoch: 68, train_loss: 0.9660, test_loss: 1.1152, test_f1: 0.4390
 epoch: 69, train_loss: 0.9619, test_loss: 1.1227, test_f1: 0.4361
 epoch: 70, train_loss: 0.9515, test_loss: 1.1457, test_f1: 0.4430
 epoch: 71, train_loss: 0.9486, test_loss: 1.1258, test_f1: 0.4420
 epoch: 72, train_loss: 0.9521, test_loss: 1.1270, test_f1: 0.4435
 epoch: 73, train_loss: 0.9508, test_loss: 1.1133, test_f1: 0.4261
 epoch: 74, train_loss: 0.9455, test_loss: 1.1246, test_f1: 0.4327
 epoch: 75, train_loss: 0.9455, test_loss: 1.1208, test_f1: 0.4372
 epoch: 76, train_loss: 0.9460, test_loss: 1.1243, test_f1: 0.4408
 epoch: 77, train_loss: 0.9499, test_loss: 1.1200, test_f1: 0.4280
 epoch: 78, train_loss: 0.9510, test_loss: 1.1448, test_f1: 0.4261
 epoch: 79, train_loss: 0.9435, test_loss: 1.1398, test_f1: 0.4150
 epoch: 80, train_loss: 0.9554, test_loss: 1.1166, test_f1: 0.4332
 epoch: 81, train_loss: 0.9492, test_loss: 1.1422, test_f1: 0.4391
 epoch: 82, train_loss: 0.9332, test_loss: 1.1617, test_f1: 0.4410
 epoch: 83, train_loss: 0.9445, test_loss: 1.1607, test_f1: 0.4389
 epoch: 84, train_loss: 0.9451, test_loss: 1.1603, test_f1: 0.4363
 epoch: 85, train_loss: 0.9463, test_loss: 1.1360, test_f1: 0.4489
 epoch: 86, train_loss: 0.9369, test_loss: 1.1412, test_f1: 0.4442
 epoch: 87, train_loss: 0.9398, test_loss: 1.1702, test_f1: 0.4519
 epoch: 88, train_loss: 0.9388, test_loss: 1.1520, test_f1: 0.4551
 epoch: 89, train_loss: 0.9404, test_loss: 1.1265, test_f1: 0.4500
 epoch: 90, train_loss: 0.9332, test_loss: 1.0980, test_f1: 0.4375
 epoch: 91, train_loss: 0.9351, test_loss: 1.1218, test_f1: 0.4346
 epoch: 92, train_loss: 0.9338, test_loss: 1.1566, test_f1: 0.4368
 epoch: 93, train_loss: 0.9369, test_loss: 1.1609, test_f1: 0.4348
 epoch: 94, train_loss: 0.9379, test_loss: 1.1630, test_f1: 0.4401
 epoch: 95, train_loss: 0.9203, test_loss: 1.1472, test_f1: 0.4466
 epoch: 96, train_loss: 0.9305, test_loss: 1.1187, test_f1: 0.4446
 epoch: 97, train_loss: 0.9350, test_loss: 1.1408, test_f1: 0.4420
 epoch: 98, train_loss: 0.9261, test_loss: 1.2079, test_f1: 0.4545
 epoch: 99, train_loss: 0.9331, test_loss: 1.1984, test_f1: 0.4637
##################ITERATION #3 ****************************************
 epoch: 0, train_loss: 1.2831, test_loss: 1.3127, test_f1: 0.2281
 epoch: 1, train_loss: 1.2399, test_loss: 1.3104, test_f1: 0.2281
 epoch: 2, train_loss: 1.2277, test_loss: 1.3066, test_f1: 0.2281
 epoch: 3, train_loss: 1.2072, test_loss: 1.2998, test_f1: 0.2281
 epoch: 4, train_loss: 1.1984, test_loss: 1.2908, test_f1: 0.2281
 epoch: 5, train_loss: 1.1876, test_loss: 1.2787, test_f1: 0.2281
 epoch: 6, train_loss: 1.1808, test_loss: 1.2649, test_f1: 0.2336
 epoch: 7, train_loss: 1.1568, test_loss: 1.2521, test_f1: 0.2390
 epoch: 8, train_loss: 1.1469, test_loss: 1.2447, test_f1: 0.2599
 epoch: 9, train_loss: 1.1384, test_loss: 1.2365, test_f1: 0.2967
 epoch: 10, train_loss: 1.1379, test_loss: 1.2278, test_f1: 0.2990
 epoch: 11, train_loss: 1.1349, test_loss: 1.2233, test_f1: 0.3403
 epoch: 12, train_loss: 1.1235, test_loss: 1.2177, test_f1: 0.3499
 epoch: 13, train_loss: 1.1199, test_loss: 1.2133, test_f1: 0.3515
 epoch: 14, train_loss: 1.1166, test_loss: 1.2097, test_f1: 0.3643
 epoch: 15, train_loss: 1.0994, test_loss: 1.2061, test_f1: 0.3686
 epoch: 16, train_loss: 1.1017, test_loss: 1.1997, test_f1: 0.3798
 epoch: 17, train_loss: 1.0914, test_loss: 1.1966, test_f1: 0.3906
 epoch: 18, train_loss: 1.0908, test_loss: 1.1932, test_f1: 0.3919
 epoch: 19, train_loss: 1.0776, test_loss: 1.1897, test_f1: 0.3878
 epoch: 20, train_loss: 1.0766, test_loss: 1.1871, test_f1: 0.3946
 epoch: 21, train_loss: 1.0698, test_loss: 1.1713, test_f1: 0.3968
 epoch: 22, train_loss: 1.0685, test_loss: 1.1726, test_f1: 0.4151
 epoch: 23, train_loss: 1.0668, test_loss: 1.1804, test_f1: 0.4309
 epoch: 24, train_loss: 1.0567, test_loss: 1.1735, test_f1: 0.4278
 epoch: 25, train_loss: 1.0577, test_loss: 1.1830, test_f1: 0.4202
 epoch: 26, train_loss: 1.0510, test_loss: 1.1627, test_f1: 0.4255
 epoch: 27, train_loss: 1.0543, test_loss: 1.1541, test_f1: 0.4235
 epoch: 28, train_loss: 1.0424, test_loss: 1.1524, test_f1: 0.4263
 epoch: 29, train_loss: 1.0420, test_loss: 1.1525, test_f1: 0.4350
 epoch: 30, train_loss: 1.0282, test_loss: 1.1588, test_f1: 0.4321
 epoch: 31, train_loss: 1.0420, test_loss: 1.1814, test_f1: 0.4121
 epoch: 32, train_loss: 1.0241, test_loss: 1.1533, test_f1: 0.4334
 epoch: 33, train_loss: 1.0346, test_loss: 1.1360, test_f1: 0.4260
 epoch: 34, train_loss: 1.0205, test_loss: 1.1390, test_f1: 0.4309
 epoch: 35, train_loss: 1.0205, test_loss: 1.1532, test_f1: 0.4113
 epoch: 36, train_loss: 1.0020, test_loss: 1.1597, test_f1: 0.4168
 epoch: 37, train_loss: 1.0134, test_loss: 1.1718, test_f1: 0.4145
 epoch: 38, train_loss: 1.0038, test_loss: 1.1518, test_f1: 0.4162
 epoch: 39, train_loss: 1.0059, test_loss: 1.1453, test_f1: 0.4264
 epoch: 40, train_loss: 1.0106, test_loss: 1.1599, test_f1: 0.4188
 epoch: 41, train_loss: 1.0038, test_loss: 1.1583, test_f1: 0.4189
 epoch: 42, train_loss: 0.9964, test_loss: 1.1463, test_f1: 0.4313
 epoch: 43, train_loss: 1.0041, test_loss: 1.1502, test_f1: 0.4316
 epoch: 44, train_loss: 0.9940, test_loss: 1.1569, test_f1: 0.4455
 epoch: 45, train_loss: 0.9947, test_loss: 1.1442, test_f1: 0.4407
 epoch: 46, train_loss: 0.9964, test_loss: 1.1481, test_f1: 0.4392
 epoch: 47, train_loss: 0.9961, test_loss: 1.1559, test_f1: 0.4390
 epoch: 48, train_loss: 0.9875, test_loss: 1.1613, test_f1: 0.4376
 epoch: 49, train_loss: 0.9744, test_loss: 1.1717, test_f1: 0.4442
 epoch: 50, train_loss: 0.9825, test_loss: 1.1552, test_f1: 0.4396
 epoch: 51, train_loss: 0.9807, test_loss: 1.1487, test_f1: 0.4445
 epoch: 52, train_loss: 0.9763, test_loss: 1.1471, test_f1: 0.4451
 epoch: 53, train_loss: 0.9805, test_loss: 1.1500, test_f1: 0.4480
 epoch: 54, train_loss: 0.9719, test_loss: 1.1519, test_f1: 0.4457
 epoch: 55, train_loss: 0.9887, test_loss: 1.1549, test_f1: 0.4337
 epoch: 56, train_loss: 0.9854, test_loss: 1.1541, test_f1: 0.4314
 epoch: 57, train_loss: 0.9660, test_loss: 1.1421, test_f1: 0.4351
 epoch: 58, train_loss: 0.9691, test_loss: 1.1470, test_f1: 0.4374
 epoch: 59, train_loss: 0.9601, test_loss: 1.1472, test_f1: 0.4432
 epoch: 60, train_loss: 0.9696, test_loss: 1.1422, test_f1: 0.4477
 epoch: 61, train_loss: 0.9683, test_loss: 1.1410, test_f1: 0.4401
 epoch: 62, train_loss: 0.9669, test_loss: 1.1497, test_f1: 0.4482
 epoch: 63, train_loss: 0.9576, test_loss: 1.1454, test_f1: 0.4563
 epoch: 64, train_loss: 0.9558, test_loss: 1.1616, test_f1: 0.4536
 epoch: 65, train_loss: 0.9696, test_loss: 1.1617, test_f1: 0.4534
 epoch: 66, train_loss: 0.9637, test_loss: 1.1606, test_f1: 0.4459
 epoch: 67, train_loss: 0.9685, test_loss: 1.1610, test_f1: 0.4463
 epoch: 68, train_loss: 0.9623, test_loss: 1.1613, test_f1: 0.4458
 epoch: 69, train_loss: 0.9681, test_loss: 1.1644, test_f1: 0.4397
 epoch: 70, train_loss: 0.9559, test_loss: 1.1585, test_f1: 0.4465
 epoch: 71, train_loss: 0.9658, test_loss: 1.1448, test_f1: 0.4491
 epoch: 72, train_loss: 0.9640, test_loss: 1.1390, test_f1: 0.4509
 epoch: 73, train_loss: 0.9644, test_loss: 1.1666, test_f1: 0.4481
 epoch: 74, train_loss: 0.9571, test_loss: 1.1676, test_f1: 0.4335
 epoch: 75, train_loss: 0.9688, test_loss: 1.1524, test_f1: 0.4472
 epoch: 76, train_loss: 0.9550, test_loss: 1.1526, test_f1: 0.4472
 epoch: 77, train_loss: 0.9449, test_loss: 1.1621, test_f1: 0.4428
 epoch: 78, train_loss: 0.9490, test_loss: 1.1605, test_f1: 0.4478
 epoch: 79, train_loss: 0.9547, test_loss: 1.1575, test_f1: 0.4441
 epoch: 80, train_loss: 0.9572, test_loss: 1.1662, test_f1: 0.4476
 epoch: 81, train_loss: 0.9505, test_loss: 1.1632, test_f1: 0.4678
 epoch: 82, train_loss: 0.9479, test_loss: 1.1498, test_f1: 0.4365
 epoch: 83, train_loss: 0.9563, test_loss: 1.1527, test_f1: 0.4494
 epoch: 84, train_loss: 0.9458, test_loss: 1.1630, test_f1: 0.4456
 epoch: 85, train_loss: 0.9528, test_loss: 1.1571, test_f1: 0.4494
 epoch: 86, train_loss: 0.9376, test_loss: 1.1677, test_f1: 0.4435
 epoch: 87, train_loss: 0.9431, test_loss: 1.1602, test_f1: 0.4409
 epoch: 88, train_loss: 0.9545, test_loss: 1.1433, test_f1: 0.4498
 epoch: 89, train_loss: 0.9515, test_loss: 1.1496, test_f1: 0.4559
 epoch: 90, train_loss: 0.9481, test_loss: 1.1504, test_f1: 0.4594
 epoch: 91, train_loss: 0.9389, test_loss: 1.1564, test_f1: 0.4388
 epoch: 92, train_loss: 0.9412, test_loss: 1.1751, test_f1: 0.4387
 epoch: 93, train_loss: 0.9437, test_loss: 1.1735, test_f1: 0.4348
 epoch: 94, train_loss: 0.9335, test_loss: 1.1645, test_f1: 0.4397
 epoch: 95, train_loss: 0.9411, test_loss: 1.1639, test_f1: 0.4456
 epoch: 96, train_loss: 0.9458, test_loss: 1.1617, test_f1: 0.4423
 epoch: 97, train_loss: 0.9440, test_loss: 1.1613, test_f1: 0.4470
 epoch: 98, train_loss: 0.9402, test_loss: 1.1717, test_f1: 0.4548
 epoch: 99, train_loss: 0.9380, test_loss: 1.1584, test_f1: 0.4577
##################ITERATION #4 ****************************************
 epoch: 0, train_loss: 1.3651, test_loss: 1.3174, test_f1: 0.2281
 epoch: 1, train_loss: 1.2693, test_loss: 1.3119, test_f1: 0.2281
 epoch: 2, train_loss: 1.2408, test_loss: 1.3062, test_f1: 0.2281
 epoch: 3, train_loss: 1.2246, test_loss: 1.2978, test_f1: 0.2281
 epoch: 4, train_loss: 1.1961, test_loss: 1.2830, test_f1: 0.2281
 epoch: 5, train_loss: 1.1849, test_loss: 1.2664, test_f1: 0.2336
 epoch: 6, train_loss: 1.1750, test_loss: 1.2519, test_f1: 0.2336
 epoch: 7, train_loss: 1.1524, test_loss: 1.2367, test_f1: 0.2443
 epoch: 8, train_loss: 1.1365, test_loss: 1.2232, test_f1: 0.2570
 epoch: 9, train_loss: 1.1364, test_loss: 1.2153, test_f1: 0.2555
 epoch: 10, train_loss: 1.1137, test_loss: 1.2116, test_f1: 0.2597
 epoch: 11, train_loss: 1.1111, test_loss: 1.2052, test_f1: 0.3015
 epoch: 12, train_loss: 1.1153, test_loss: 1.1977, test_f1: 0.3102
 epoch: 13, train_loss: 1.0911, test_loss: 1.1884, test_f1: 0.3513
 epoch: 14, train_loss: 1.0806, test_loss: 1.1833, test_f1: 0.3998
 epoch: 15, train_loss: 1.0767, test_loss: 1.1775, test_f1: 0.4013
 epoch: 16, train_loss: 1.0802, test_loss: 1.1711, test_f1: 0.4059
 epoch: 17, train_loss: 1.0783, test_loss: 1.1726, test_f1: 0.4094
 epoch: 18, train_loss: 1.0617, test_loss: 1.1804, test_f1: 0.4127
 epoch: 19, train_loss: 1.0619, test_loss: 1.1759, test_f1: 0.4164
 epoch: 20, train_loss: 1.0523, test_loss: 1.1933, test_f1: 0.4396
 epoch: 21, train_loss: 1.0527, test_loss: 1.2055, test_f1: 0.4286
 epoch: 22, train_loss: 1.0646, test_loss: 1.2072, test_f1: 0.4281
 epoch: 23, train_loss: 1.0420, test_loss: 1.1912, test_f1: 0.4366
 epoch: 24, train_loss: 1.0466, test_loss: 1.1431, test_f1: 0.4196
 epoch: 25, train_loss: 1.0341, test_loss: 1.1510, test_f1: 0.4154
 epoch: 26, train_loss: 1.0254, test_loss: 1.1561, test_f1: 0.4203
 epoch: 27, train_loss: 1.0205, test_loss: 1.1631, test_f1: 0.4171
 epoch: 28, train_loss: 1.0250, test_loss: 1.1707, test_f1: 0.4337
 epoch: 29, train_loss: 1.0196, test_loss: 1.1716, test_f1: 0.4327
 epoch: 30, train_loss: 1.0166, test_loss: 1.1460, test_f1: 0.4421
 epoch: 31, train_loss: 1.0207, test_loss: 1.1499, test_f1: 0.4191
 epoch: 32, train_loss: 1.0134, test_loss: 1.1647, test_f1: 0.4189
 epoch: 33, train_loss: 1.0088, test_loss: 1.1653, test_f1: 0.4403
 epoch: 34, train_loss: 1.0124, test_loss: 1.1781, test_f1: 0.4447
 epoch: 35, train_loss: 1.0081, test_loss: 1.1477, test_f1: 0.4531
 epoch: 36, train_loss: 1.0123, test_loss: 1.1614, test_f1: 0.4479
 epoch: 37, train_loss: 1.0093, test_loss: 1.1637, test_f1: 0.4529
 epoch: 38, train_loss: 1.0053, test_loss: 1.1862, test_f1: 0.4483
 epoch: 39, train_loss: 0.9974, test_loss: 1.1664, test_f1: 0.4537
 epoch: 40, train_loss: 0.9926, test_loss: 1.1538, test_f1: 0.4204
 epoch: 41, train_loss: 0.9989, test_loss: 1.1619, test_f1: 0.4196
 epoch: 42, train_loss: 0.9841, test_loss: 1.1621, test_f1: 0.4446
 epoch: 43, train_loss: 0.9944, test_loss: 1.1509, test_f1: 0.4410
 epoch: 44, train_loss: 0.9839, test_loss: 1.1784, test_f1: 0.4594
 epoch: 45, train_loss: 0.9936, test_loss: 1.1678, test_f1: 0.4524
 epoch: 46, train_loss: 0.9796, test_loss: 1.1168, test_f1: 0.4511
 epoch: 47, train_loss: 0.9699, test_loss: 1.1661, test_f1: 0.4424
 epoch: 48, train_loss: 0.9697, test_loss: 1.1647, test_f1: 0.4432
 epoch: 49, train_loss: 0.9816, test_loss: 1.1602, test_f1: 0.4582
 epoch: 50, train_loss: 0.9763, test_loss: 1.1366, test_f1: 0.4211
 epoch: 51, train_loss: 0.9753, test_loss: 1.1418, test_f1: 0.4143
 epoch: 52, train_loss: 0.9692, test_loss: 1.1543, test_f1: 0.4375
 epoch: 53, train_loss: 0.9670, test_loss: 1.1523, test_f1: 0.4304
 epoch: 54, train_loss: 0.9662, test_loss: 1.1419, test_f1: 0.4378
 epoch: 55, train_loss: 0.9705, test_loss: 1.1244, test_f1: 0.4210
 epoch: 56, train_loss: 0.9664, test_loss: 1.1249, test_f1: 0.4210
 epoch: 57, train_loss: 0.9673, test_loss: 1.1203, test_f1: 0.4242
 epoch: 58, train_loss: 0.9589, test_loss: 1.1390, test_f1: 0.4386
 epoch: 59, train_loss: 0.9549, test_loss: 1.1505, test_f1: 0.4380
 epoch: 60, train_loss: 0.9617, test_loss: 1.1659, test_f1: 0.4511
 epoch: 61, train_loss: 0.9599, test_loss: 1.1443, test_f1: 0.4450
 epoch: 62, train_loss: 0.9588, test_loss: 1.1159, test_f1: 0.4546
 epoch: 63, train_loss: 0.9604, test_loss: 1.1429, test_f1: 0.4438
 epoch: 64, train_loss: 0.9522, test_loss: 1.1675, test_f1: 0.4410
 epoch: 65, train_loss: 0.9685, test_loss: 1.1869, test_f1: 0.4492
 epoch: 66, train_loss: 0.9537, test_loss: 1.1437, test_f1: 0.4406
 epoch: 67, train_loss: 0.9621, test_loss: 1.1221, test_f1: 0.4493
 epoch: 68, train_loss: 0.9533, test_loss: 1.1455, test_f1: 0.4538
 epoch: 69, train_loss: 0.9602, test_loss: 1.1631, test_f1: 0.4610
 epoch: 70, train_loss: 0.9542, test_loss: 1.1385, test_f1: 0.4550
 epoch: 71, train_loss: 0.9467, test_loss: 1.1152, test_f1: 0.4535
 epoch: 72, train_loss: 0.9492, test_loss: 1.1536, test_f1: 0.4556
 epoch: 73, train_loss: 0.9472, test_loss: 1.1900, test_f1: 0.4605
 epoch: 74, train_loss: 0.9494, test_loss: 1.1648, test_f1: 0.4510
 epoch: 75, train_loss: 0.9437, test_loss: 1.1409, test_f1: 0.4511
 epoch: 76, train_loss: 0.9474, test_loss: 1.1360, test_f1: 0.4452
 epoch: 77, train_loss: 0.9487, test_loss: 1.1641, test_f1: 0.4486
 epoch: 78, train_loss: 0.9469, test_loss: 1.1425, test_f1: 0.4697
 epoch: 79, train_loss: 0.9366, test_loss: 1.1569, test_f1: 0.4714
 epoch: 80, train_loss: 0.9386, test_loss: 1.1670, test_f1: 0.4625
 epoch: 81, train_loss: 0.9391, test_loss: 1.1415, test_f1: 0.4432
 epoch: 82, train_loss: 0.9419, test_loss: 1.1253, test_f1: 0.4416
 epoch: 83, train_loss: 0.9459, test_loss: 1.1270, test_f1: 0.4386
 epoch: 84, train_loss: 0.9340, test_loss: 1.1463, test_f1: 0.4565
 epoch: 85, train_loss: 0.9405, test_loss: 1.1318, test_f1: 0.4407
 epoch: 86, train_loss: 0.9336, test_loss: 1.1534, test_f1: 0.4399
 epoch: 87, train_loss: 0.9387, test_loss: 1.1617, test_f1: 0.4351
 epoch: 88, train_loss: 0.9281, test_loss: 1.1608, test_f1: 0.4394
 epoch: 89, train_loss: 0.9337, test_loss: 1.1558, test_f1: 0.4509
 epoch: 90, train_loss: 0.9426, test_loss: 1.1443, test_f1: 0.4558
 epoch: 91, train_loss: 0.9333, test_loss: 1.1437, test_f1: 0.4638
 epoch: 92, train_loss: 0.9372, test_loss: 1.1330, test_f1: 0.4551
 epoch: 93, train_loss: 0.9390, test_loss: 1.1357, test_f1: 0.4514
 epoch: 94, train_loss: 0.9184, test_loss: 1.1483, test_f1: 0.4500
 epoch: 95, train_loss: 0.9313, test_loss: 1.1580, test_f1: 0.4579
 epoch: 96, train_loss: 0.9188, test_loss: 1.1351, test_f1: 0.4521
 epoch: 97, train_loss: 0.9326, test_loss: 1.1525, test_f1: 0.4527
 epoch: 98, train_loss: 0.9284, test_loss: 1.1695, test_f1: 0.4503
 epoch: 99, train_loss: 0.9180, test_loss: 1.1586, test_f1: 0.4631
##################ITERATION #5 ****************************************
 epoch: 0, train_loss: 1.3351, test_loss: 1.3252, test_f1: 0.2281
 epoch: 1, train_loss: 1.2638, test_loss: 1.3234, test_f1: 0.2281
 epoch: 2, train_loss: 1.2429, test_loss: 1.3140, test_f1: 0.2281
 epoch: 3, train_loss: 1.2277, test_loss: 1.2981, test_f1: 0.2281
 epoch: 4, train_loss: 1.2135, test_loss: 1.2744, test_f1: 0.2281
 epoch: 5, train_loss: 1.1910, test_loss: 1.2520, test_f1: 0.2583
 epoch: 6, train_loss: 1.1780, test_loss: 1.2370, test_f1: 0.2641
 epoch: 7, train_loss: 1.1644, test_loss: 1.2230, test_f1: 0.3256
 epoch: 8, train_loss: 1.1534, test_loss: 1.2031, test_f1: 0.3359
 epoch: 9, train_loss: 1.1398, test_loss: 1.1872, test_f1: 0.3719
 epoch: 10, train_loss: 1.1347, test_loss: 1.1739, test_f1: 0.3945
 epoch: 11, train_loss: 1.1244, test_loss: 1.1643, test_f1: 0.4114
 epoch: 12, train_loss: 1.1123, test_loss: 1.1517, test_f1: 0.4240
 epoch: 13, train_loss: 1.1082, test_loss: 1.1463, test_f1: 0.4042
 epoch: 14, train_loss: 1.0884, test_loss: 1.1439, test_f1: 0.4063
 epoch: 15, train_loss: 1.0785, test_loss: 1.1418, test_f1: 0.4042
 epoch: 16, train_loss: 1.0669, test_loss: 1.1387, test_f1: 0.4040
 epoch: 17, train_loss: 1.0711, test_loss: 1.1374, test_f1: 0.4134
 epoch: 18, train_loss: 1.0642, test_loss: 1.1336, test_f1: 0.4037
 epoch: 19, train_loss: 1.0596, test_loss: 1.1334, test_f1: 0.4078
 epoch: 20, train_loss: 1.0532, test_loss: 1.1336, test_f1: 0.3981
 epoch: 21, train_loss: 1.0507, test_loss: 1.1303, test_f1: 0.4019
 epoch: 22, train_loss: 1.0419, test_loss: 1.1291, test_f1: 0.4043
 epoch: 23, train_loss: 1.0464, test_loss: 1.1239, test_f1: 0.4043
 epoch: 24, train_loss: 1.0328, test_loss: 1.1248, test_f1: 0.4040
 epoch: 25, train_loss: 1.0312, test_loss: 1.1259, test_f1: 0.4047
 epoch: 26, train_loss: 1.0183, test_loss: 1.1247, test_f1: 0.4082
 epoch: 27, train_loss: 1.0164, test_loss: 1.1298, test_f1: 0.4083
 epoch: 28, train_loss: 1.0315, test_loss: 1.1268, test_f1: 0.4025
 epoch: 29, train_loss: 1.0101, test_loss: 1.1221, test_f1: 0.4075
 epoch: 30, train_loss: 1.0094, test_loss: 1.1212, test_f1: 0.4119
 epoch: 31, train_loss: 1.0124, test_loss: 1.1143, test_f1: 0.4249
 epoch: 32, train_loss: 1.0115, test_loss: 1.1106, test_f1: 0.4238
 epoch: 33, train_loss: 1.0029, test_loss: 1.1088, test_f1: 0.4070
 epoch: 34, train_loss: 1.0161, test_loss: 1.1080, test_f1: 0.4105
 epoch: 35, train_loss: 0.9964, test_loss: 1.1019, test_f1: 0.4132
 epoch: 36, train_loss: 1.0057, test_loss: 1.0997, test_f1: 0.4086
 epoch: 37, train_loss: 0.9902, test_loss: 1.1012, test_f1: 0.4120
 epoch: 38, train_loss: 0.9936, test_loss: 1.0975, test_f1: 0.4090
 epoch: 39, train_loss: 0.9884, test_loss: 1.1036, test_f1: 0.4282
 epoch: 40, train_loss: 0.9926, test_loss: 1.1083, test_f1: 0.4193
 epoch: 41, train_loss: 0.9802, test_loss: 1.1163, test_f1: 0.4215
 epoch: 42, train_loss: 0.9902, test_loss: 1.1146, test_f1: 0.4215
 epoch: 43, train_loss: 0.9826, test_loss: 1.1140, test_f1: 0.4233
 epoch: 44, train_loss: 0.9826, test_loss: 1.1113, test_f1: 0.4157
 epoch: 45, train_loss: 0.9791, test_loss: 1.1168, test_f1: 0.4189
 epoch: 46, train_loss: 0.9813, test_loss: 1.1078, test_f1: 0.4197
 epoch: 47, train_loss: 0.9738, test_loss: 1.1003, test_f1: 0.4139
 epoch: 48, train_loss: 0.9690, test_loss: 1.0983, test_f1: 0.4290
 epoch: 49, train_loss: 0.9793, test_loss: 1.1048, test_f1: 0.4285
 epoch: 50, train_loss: 0.9600, test_loss: 1.1042, test_f1: 0.4279
 epoch: 51, train_loss: 0.9776, test_loss: 1.1030, test_f1: 0.4279
 epoch: 52, train_loss: 0.9730, test_loss: 1.1033, test_f1: 0.4233
 epoch: 53, train_loss: 0.9655, test_loss: 1.1050, test_f1: 0.4243
 epoch: 54, train_loss: 0.9653, test_loss: 1.1134, test_f1: 0.4215
 epoch: 55, train_loss: 0.9645, test_loss: 1.1145, test_f1: 0.4215
 epoch: 56, train_loss: 0.9682, test_loss: 1.1097, test_f1: 0.4219
 epoch: 57, train_loss: 0.9622, test_loss: 1.1032, test_f1: 0.4280
 epoch: 58, train_loss: 0.9562, test_loss: 1.1033, test_f1: 0.4233
 epoch: 59, train_loss: 0.9644, test_loss: 1.1022, test_f1: 0.4233
 epoch: 60, train_loss: 0.9607, test_loss: 1.0914, test_f1: 0.4278
 epoch: 61, train_loss: 0.9520, test_loss: 1.0840, test_f1: 0.4367
 epoch: 62, train_loss: 0.9613, test_loss: 1.0779, test_f1: 0.4277
 epoch: 63, train_loss: 0.9569, test_loss: 1.0847, test_f1: 0.4340
 epoch: 64, train_loss: 0.9642, test_loss: 1.0913, test_f1: 0.4228
 epoch: 65, train_loss: 0.9501, test_loss: 1.0911, test_f1: 0.4314
 epoch: 66, train_loss: 0.9526, test_loss: 1.0931, test_f1: 0.4315
 epoch: 67, train_loss: 0.9468, test_loss: 1.1019, test_f1: 0.4292
 epoch: 68, train_loss: 0.9508, test_loss: 1.1025, test_f1: 0.4263
 epoch: 69, train_loss: 0.9544, test_loss: 1.0947, test_f1: 0.4320
 epoch: 70, train_loss: 0.9490, test_loss: 1.0903, test_f1: 0.4263
 epoch: 71, train_loss: 0.9591, test_loss: 1.0868, test_f1: 0.4436
 epoch: 72, train_loss: 0.9558, test_loss: 1.0881, test_f1: 0.4363
 epoch: 73, train_loss: 0.9455, test_loss: 1.0927, test_f1: 0.4388
 epoch: 74, train_loss: 0.9533, test_loss: 1.1027, test_f1: 0.4244
 epoch: 75, train_loss: 0.9509, test_loss: 1.1075, test_f1: 0.4300
 epoch: 76, train_loss: 0.9384, test_loss: 1.0992, test_f1: 0.4307
 epoch: 77, train_loss: 0.9509, test_loss: 1.1005, test_f1: 0.4367
 epoch: 78, train_loss: 0.9458, test_loss: 1.0997, test_f1: 0.4363
 epoch: 79, train_loss: 0.9352, test_loss: 1.0882, test_f1: 0.4417
 epoch: 80, train_loss: 0.9451, test_loss: 1.0872, test_f1: 0.4465
 epoch: 81, train_loss: 0.9440, test_loss: 1.0862, test_f1: 0.4371
 epoch: 82, train_loss: 0.9482, test_loss: 1.0943, test_f1: 0.4385
 epoch: 83, train_loss: 0.9398, test_loss: 1.1005, test_f1: 0.4310
 epoch: 84, train_loss: 0.9397, test_loss: 1.0990, test_f1: 0.4429
 epoch: 85, train_loss: 0.9414, test_loss: 1.0941, test_f1: 0.4429
 epoch: 86, train_loss: 0.9514, test_loss: 1.0998, test_f1: 0.4367
 epoch: 87, train_loss: 0.9421, test_loss: 1.1017, test_f1: 0.4424
 epoch: 88, train_loss: 0.9421, test_loss: 1.1054, test_f1: 0.4428
 epoch: 89, train_loss: 0.9456, test_loss: 1.0989, test_f1: 0.4399
 epoch: 90, train_loss: 0.9379, test_loss: 1.1013, test_f1: 0.4429
 epoch: 91, train_loss: 0.9413, test_loss: 1.1051, test_f1: 0.4313
 epoch: 92, train_loss: 0.9328, test_loss: 1.1041, test_f1: 0.4319
 epoch: 93, train_loss: 0.9371, test_loss: 1.0937, test_f1: 0.4538
 epoch: 94, train_loss: 0.9343, test_loss: 1.0976, test_f1: 0.4523
 epoch: 95, train_loss: 0.9325, test_loss: 1.1054, test_f1: 0.4466
 epoch: 96, train_loss: 0.9292, test_loss: 1.1065, test_f1: 0.4553
 epoch: 97, train_loss: 0.9292, test_loss: 1.1138, test_f1: 0.4511
 epoch: 98, train_loss: 0.9193, test_loss: 1.1124, test_f1: 0.4424
 epoch: 99, train_loss: 0.9319, test_loss: 1.1028, test_f1: 0.4483
##################ITERATION #6 ****************************************
 epoch: 0, train_loss: 1.4383, test_loss: 1.3287, test_f1: 0.2281
 epoch: 1, train_loss: 1.3003, test_loss: 1.3157, test_f1: 0.2281
 epoch: 2, train_loss: 1.2748, test_loss: 1.3110, test_f1: 0.2281
 epoch: 3, train_loss: 1.2529, test_loss: 1.3055, test_f1: 0.2281
 epoch: 4, train_loss: 1.2318, test_loss: 1.2907, test_f1: 0.2281
 epoch: 5, train_loss: 1.2238, test_loss: 1.2731, test_f1: 0.2281
 epoch: 6, train_loss: 1.2069, test_loss: 1.2590, test_f1: 0.2583
 epoch: 7, train_loss: 1.1829, test_loss: 1.2485, test_f1: 0.2829
 epoch: 8, train_loss: 1.1917, test_loss: 1.2358, test_f1: 0.2829
 epoch: 9, train_loss: 1.1625, test_loss: 1.2092, test_f1: 0.2980
 epoch: 10, train_loss: 1.1457, test_loss: 1.1965, test_f1: 0.3197
 epoch: 11, train_loss: 1.1273, test_loss: 1.1880, test_f1: 0.3274
 epoch: 12, train_loss: 1.1083, test_loss: 1.1690, test_f1: 0.3943
 epoch: 13, train_loss: 1.0930, test_loss: 1.1586, test_f1: 0.4060
 epoch: 14, train_loss: 1.0957, test_loss: 1.1470, test_f1: 0.4187
 epoch: 15, train_loss: 1.0829, test_loss: 1.1408, test_f1: 0.4187
 epoch: 16, train_loss: 1.0825, test_loss: 1.1385, test_f1: 0.4196
 epoch: 17, train_loss: 1.0774, test_loss: 1.1329, test_f1: 0.4187
 epoch: 18, train_loss: 1.0631, test_loss: 1.1197, test_f1: 0.4246
 epoch: 19, train_loss: 1.0663, test_loss: 1.1199, test_f1: 0.4160
 epoch: 20, train_loss: 1.0522, test_loss: 1.1177, test_f1: 0.4189
 epoch: 21, train_loss: 1.0420, test_loss: 1.1144, test_f1: 0.4207
 epoch: 22, train_loss: 1.0521, test_loss: 1.1134, test_f1: 0.4250
 epoch: 23, train_loss: 1.0412, test_loss: 1.1072, test_f1: 0.4379
 epoch: 24, train_loss: 1.0415, test_loss: 1.1071, test_f1: 0.4333
 epoch: 25, train_loss: 1.0251, test_loss: 1.1048, test_f1: 0.4380
 epoch: 26, train_loss: 1.0197, test_loss: 1.1029, test_f1: 0.4354
 epoch: 27, train_loss: 1.0135, test_loss: 1.0997, test_f1: 0.4351
 epoch: 28, train_loss: 1.0142, test_loss: 1.0974, test_f1: 0.4278
 epoch: 29, train_loss: 1.0131, test_loss: 1.1033, test_f1: 0.4329
 epoch: 30, train_loss: 1.0118, test_loss: 1.0959, test_f1: 0.4327
 epoch: 31, train_loss: 1.0110, test_loss: 1.0849, test_f1: 0.4368
 epoch: 32, train_loss: 1.0058, test_loss: 1.0797, test_f1: 0.4387
 epoch: 33, train_loss: 1.0116, test_loss: 1.0825, test_f1: 0.4431
 epoch: 34, train_loss: 1.0091, test_loss: 1.0823, test_f1: 0.4388
 epoch: 35, train_loss: 0.9957, test_loss: 1.0768, test_f1: 0.4325
 epoch: 36, train_loss: 1.0040, test_loss: 1.0761, test_f1: 0.4358
 epoch: 37, train_loss: 0.9921, test_loss: 1.0739, test_f1: 0.4421
 epoch: 38, train_loss: 0.9929, test_loss: 1.0728, test_f1: 0.4393
 epoch: 39, train_loss: 0.9967, test_loss: 1.0700, test_f1: 0.4329
 epoch: 40, train_loss: 0.9930, test_loss: 1.0705, test_f1: 0.4358
 epoch: 41, train_loss: 0.9848, test_loss: 1.0692, test_f1: 0.4383
 epoch: 42, train_loss: 0.9895, test_loss: 1.0645, test_f1: 0.4345
 epoch: 43, train_loss: 0.9812, test_loss: 1.0584, test_f1: 0.4460
 epoch: 44, train_loss: 0.9760, test_loss: 1.0615, test_f1: 0.4395
 epoch: 45, train_loss: 0.9830, test_loss: 1.0902, test_f1: 0.4382
 epoch: 46, train_loss: 0.9830, test_loss: 1.0873, test_f1: 0.4341
 epoch: 47, train_loss: 0.9725, test_loss: 1.0609, test_f1: 0.4319
 epoch: 48, train_loss: 0.9756, test_loss: 1.0528, test_f1: 0.4285
 epoch: 49, train_loss: 0.9729, test_loss: 1.0594, test_f1: 0.4238
 epoch: 50, train_loss: 0.9625, test_loss: 1.0693, test_f1: 0.4342
 epoch: 51, train_loss: 0.9790, test_loss: 1.0720, test_f1: 0.4503
 epoch: 52, train_loss: 0.9694, test_loss: 1.0627, test_f1: 0.4361
 epoch: 53, train_loss: 0.9595, test_loss: 1.0544, test_f1: 0.4330
 epoch: 54, train_loss: 0.9640, test_loss: 1.0440, test_f1: 0.4365
 epoch: 55, train_loss: 0.9699, test_loss: 1.0524, test_f1: 0.4373
 epoch: 56, train_loss: 0.9539, test_loss: 1.0622, test_f1: 0.4311
 epoch: 57, train_loss: 0.9606, test_loss: 1.0660, test_f1: 0.4332
 epoch: 58, train_loss: 0.9565, test_loss: 1.0690, test_f1: 0.4389
 epoch: 59, train_loss: 0.9575, test_loss: 1.0677, test_f1: 0.4463
 epoch: 60, train_loss: 0.9627, test_loss: 1.0653, test_f1: 0.4469
 epoch: 61, train_loss: 0.9581, test_loss: 1.0567, test_f1: 0.4469
 epoch: 62, train_loss: 0.9567, test_loss: 1.0494, test_f1: 0.4371
 epoch: 63, train_loss: 0.9591, test_loss: 1.0528, test_f1: 0.4476
 epoch: 64, train_loss: 0.9462, test_loss: 1.0513, test_f1: 0.4437
 epoch: 65, train_loss: 0.9630, test_loss: 1.0552, test_f1: 0.4525
 epoch: 66, train_loss: 0.9512, test_loss: 1.0582, test_f1: 0.4428
 epoch: 67, train_loss: 0.9484, test_loss: 1.0578, test_f1: 0.4478
 epoch: 68, train_loss: 0.9533, test_loss: 1.0648, test_f1: 0.4289
 epoch: 69, train_loss: 0.9452, test_loss: 1.0553, test_f1: 0.4327
 epoch: 70, train_loss: 0.9530, test_loss: 1.0597, test_f1: 0.4435
 epoch: 71, train_loss: 0.9481, test_loss: 1.0605, test_f1: 0.4624
 epoch: 72, train_loss: 0.9467, test_loss: 1.0527, test_f1: 0.4454
 epoch: 73, train_loss: 0.9499, test_loss: 1.0537, test_f1: 0.4499
 epoch: 74, train_loss: 0.9529, test_loss: 1.0519, test_f1: 0.4532
 epoch: 75, train_loss: 0.9509, test_loss: 1.0494, test_f1: 0.4426
 epoch: 76, train_loss: 0.9466, test_loss: 1.0566, test_f1: 0.4577
 epoch: 77, train_loss: 0.9487, test_loss: 1.0524, test_f1: 0.4486
 epoch: 78, train_loss: 0.9464, test_loss: 1.0547, test_f1: 0.4526
 epoch: 79, train_loss: 0.9460, test_loss: 1.0608, test_f1: 0.4429
 epoch: 80, train_loss: 0.9461, test_loss: 1.0663, test_f1: 0.4277
 epoch: 81, train_loss: 0.9392, test_loss: 1.0554, test_f1: 0.4463
 epoch: 82, train_loss: 0.9350, test_loss: 1.0526, test_f1: 0.4632
 epoch: 83, train_loss: 0.9342, test_loss: 1.0621, test_f1: 0.4595
 epoch: 84, train_loss: 0.9509, test_loss: 1.0594, test_f1: 0.4496
 epoch: 85, train_loss: 0.9331, test_loss: 1.0611, test_f1: 0.4425
 epoch: 86, train_loss: 0.9407, test_loss: 1.0646, test_f1: 0.4611
 epoch: 87, train_loss: 0.9505, test_loss: 1.0738, test_f1: 0.4436
 epoch: 88, train_loss: 0.9372, test_loss: 1.0478, test_f1: 0.4469
 epoch: 89, train_loss: 0.9397, test_loss: 1.0468, test_f1: 0.4729
 epoch: 90, train_loss: 0.9430, test_loss: 1.0551, test_f1: 0.4797
 epoch: 91, train_loss: 0.9340, test_loss: 1.0549, test_f1: 0.4868
 epoch: 92, train_loss: 0.9489, test_loss: 1.0567, test_f1: 0.4805
 epoch: 93, train_loss: 0.9342, test_loss: 1.0569, test_f1: 0.4805
 epoch: 94, train_loss: 0.9329, test_loss: 1.0410, test_f1: 0.4713
 epoch: 95, train_loss: 0.9394, test_loss: 1.0414, test_f1: 0.4765
 epoch: 96, train_loss: 0.9374, test_loss: 1.0375, test_f1: 0.4644
 epoch: 97, train_loss: 0.9430, test_loss: 1.0335, test_f1: 0.4614
 epoch: 98, train_loss: 0.9346, test_loss: 1.0403, test_f1: 0.4550
 epoch: 99, train_loss: 0.9388, test_loss: 1.0419, test_f1: 0.4594
##################ITERATION #7 ****************************************
 epoch: 0, train_loss: 1.2815, test_loss: 1.3405, test_f1: 0.2281
 epoch: 1, train_loss: 1.2299, test_loss: 1.3379, test_f1: 0.2281
 epoch: 2, train_loss: 1.2148, test_loss: 1.3334, test_f1: 0.2281
 epoch: 3, train_loss: 1.2049, test_loss: 1.3309, test_f1: 0.2281
 epoch: 4, train_loss: 1.1932, test_loss: 1.3302, test_f1: 0.2281
 epoch: 5, train_loss: 1.1755, test_loss: 1.3253, test_f1: 0.2281
 epoch: 6, train_loss: 1.1591, test_loss: 1.3231, test_f1: 0.2285
 epoch: 7, train_loss: 1.1682, test_loss: 1.3066, test_f1: 0.2502
 epoch: 8, train_loss: 1.1638, test_loss: 1.2888, test_f1: 0.2777
 epoch: 9, train_loss: 1.1562, test_loss: 1.2686, test_f1: 0.2831
 epoch: 10, train_loss: 1.1432, test_loss: 1.2517, test_f1: 0.3292
 epoch: 11, train_loss: 1.1478, test_loss: 1.2361, test_f1: 0.3403
 epoch: 12, train_loss: 1.1344, test_loss: 1.2228, test_f1: 0.3341
 epoch: 13, train_loss: 1.1244, test_loss: 1.2140, test_f1: 0.3293
 epoch: 14, train_loss: 1.1168, test_loss: 1.2093, test_f1: 0.3418
 epoch: 15, train_loss: 1.1151, test_loss: 1.2029, test_f1: 0.3470
 epoch: 16, train_loss: 1.1048, test_loss: 1.1936, test_f1: 0.3495
 epoch: 17, train_loss: 1.0946, test_loss: 1.1927, test_f1: 0.3581
 epoch: 18, train_loss: 1.0993, test_loss: 1.1880, test_f1: 0.3594
 epoch: 19, train_loss: 1.0984, test_loss: 1.1914, test_f1: 0.3701
 epoch: 20, train_loss: 1.0895, test_loss: 1.1886, test_f1: 0.3742
 epoch: 21, train_loss: 1.0859, test_loss: 1.1701, test_f1: 0.3865
 epoch: 22, train_loss: 1.0854, test_loss: 1.1586, test_f1: 0.3904
 epoch: 23, train_loss: 1.0766, test_loss: 1.1620, test_f1: 0.4043
 epoch: 24, train_loss: 1.0761, test_loss: 1.1546, test_f1: 0.3957
 epoch: 25, train_loss: 1.0531, test_loss: 1.1422, test_f1: 0.4212
 epoch: 26, train_loss: 1.0517, test_loss: 1.1409, test_f1: 0.4582
 epoch: 27, train_loss: 1.0549, test_loss: 1.1374, test_f1: 0.4506
 epoch: 28, train_loss: 1.0421, test_loss: 1.1360, test_f1: 0.4458
 epoch: 29, train_loss: 1.0479, test_loss: 1.1398, test_f1: 0.4113
 epoch: 30, train_loss: 1.0452, test_loss: 1.1261, test_f1: 0.4121
 epoch: 31, train_loss: 1.0365, test_loss: 1.1162, test_f1: 0.4268
 epoch: 32, train_loss: 1.0424, test_loss: 1.1154, test_f1: 0.4439
 epoch: 33, train_loss: 1.0376, test_loss: 1.1099, test_f1: 0.4549
 epoch: 34, train_loss: 1.0386, test_loss: 1.1162, test_f1: 0.4477
 epoch: 35, train_loss: 1.0313, test_loss: 1.1098, test_f1: 0.4447
 epoch: 36, train_loss: 1.0232, test_loss: 1.1091, test_f1: 0.4444
 epoch: 37, train_loss: 1.0029, test_loss: 1.1110, test_f1: 0.4479
 epoch: 38, train_loss: 1.0068, test_loss: 1.1158, test_f1: 0.4502
 epoch: 39, train_loss: 1.0154, test_loss: 1.1015, test_f1: 0.4461
 epoch: 40, train_loss: 1.0090, test_loss: 1.1015, test_f1: 0.4503
 epoch: 41, train_loss: 1.0024, test_loss: 1.1038, test_f1: 0.4390
 epoch: 42, train_loss: 0.9997, test_loss: 1.1080, test_f1: 0.4469
 epoch: 43, train_loss: 0.9934, test_loss: 1.0911, test_f1: 0.4516
 epoch: 44, train_loss: 0.9972, test_loss: 1.0901, test_f1: 0.4538
 epoch: 45, train_loss: 0.9992, test_loss: 1.0969, test_f1: 0.4620
 epoch: 46, train_loss: 0.9958, test_loss: 1.1035, test_f1: 0.4540
 epoch: 47, train_loss: 0.9997, test_loss: 1.0883, test_f1: 0.4546
 epoch: 48, train_loss: 0.9950, test_loss: 1.0825, test_f1: 0.4251
 epoch: 49, train_loss: 0.9895, test_loss: 1.0661, test_f1: 0.4424
 epoch: 50, train_loss: 0.9786, test_loss: 1.0658, test_f1: 0.4550
 epoch: 51, train_loss: 0.9823, test_loss: 1.0702, test_f1: 0.4612
 epoch: 52, train_loss: 0.9734, test_loss: 1.0687, test_f1: 0.4451
 epoch: 53, train_loss: 0.9851, test_loss: 1.0648, test_f1: 0.4509
 epoch: 54, train_loss: 0.9896, test_loss: 1.0621, test_f1: 0.4502
 epoch: 55, train_loss: 0.9859, test_loss: 1.0668, test_f1: 0.4577
 epoch: 56, train_loss: 0.9716, test_loss: 1.0728, test_f1: 0.4609
 epoch: 57, train_loss: 0.9650, test_loss: 1.0777, test_f1: 0.4564
 epoch: 58, train_loss: 0.9782, test_loss: 1.0882, test_f1: 0.4661
 epoch: 59, train_loss: 0.9755, test_loss: 1.0798, test_f1: 0.4655
 epoch: 60, train_loss: 0.9718, test_loss: 1.0616, test_f1: 0.4472
 epoch: 61, train_loss: 0.9714, test_loss: 1.0642, test_f1: 0.4516
 epoch: 62, train_loss: 0.9677, test_loss: 1.0716, test_f1: 0.4685
 epoch: 63, train_loss: 0.9655, test_loss: 1.0750, test_f1: 0.4769
 epoch: 64, train_loss: 0.9717, test_loss: 1.0638, test_f1: 0.4661
 epoch: 65, train_loss: 0.9659, test_loss: 1.0578, test_f1: 0.4585
 epoch: 66, train_loss: 0.9646, test_loss: 1.0621, test_f1: 0.4565
 epoch: 67, train_loss: 0.9598, test_loss: 1.0710, test_f1: 0.4808
 epoch: 68, train_loss: 0.9603, test_loss: 1.0690, test_f1: 0.4630
 epoch: 69, train_loss: 0.9602, test_loss: 1.0664, test_f1: 0.4680
 epoch: 70, train_loss: 0.9699, test_loss: 1.0658, test_f1: 0.4573
 epoch: 71, train_loss: 0.9615, test_loss: 1.0558, test_f1: 0.4707
 epoch: 72, train_loss: 0.9720, test_loss: 1.0536, test_f1: 0.4798
 epoch: 73, train_loss: 0.9637, test_loss: 1.0594, test_f1: 0.4837
 epoch: 74, train_loss: 0.9513, test_loss: 1.0648, test_f1: 0.4904
 epoch: 75, train_loss: 0.9512, test_loss: 1.0619, test_f1: 0.4649
 epoch: 76, train_loss: 0.9543, test_loss: 1.0714, test_f1: 0.4754
 epoch: 77, train_loss: 0.9492, test_loss: 1.0715, test_f1: 0.4691
 epoch: 78, train_loss: 0.9570, test_loss: 1.0645, test_f1: 0.4603
 epoch: 79, train_loss: 0.9549, test_loss: 1.0697, test_f1: 0.4490
 epoch: 80, train_loss: 0.9542, test_loss: 1.0769, test_f1: 0.4415
 epoch: 81, train_loss: 0.9594, test_loss: 1.0779, test_f1: 0.4641
 epoch: 82, train_loss: 0.9504, test_loss: 1.0738, test_f1: 0.4838
 epoch: 83, train_loss: 0.9620, test_loss: 1.0666, test_f1: 0.4815
 epoch: 84, train_loss: 0.9495, test_loss: 1.0640, test_f1: 0.4955
 epoch: 85, train_loss: 0.9492, test_loss: 1.0646, test_f1: 0.4933
 epoch: 86, train_loss: 0.9510, test_loss: 1.0701, test_f1: 0.4628
 epoch: 87, train_loss: 0.9457, test_loss: 1.0565, test_f1: 0.4752
 epoch: 88, train_loss: 0.9539, test_loss: 1.0519, test_f1: 0.4871
 epoch: 89, train_loss: 0.9464, test_loss: 1.0501, test_f1: 0.4844
 epoch: 90, train_loss: 0.9513, test_loss: 1.0482, test_f1: 0.4733
 epoch: 91, train_loss: 0.9494, test_loss: 1.0427, test_f1: 0.4767
 epoch: 92, train_loss: 0.9475, test_loss: 1.0451, test_f1: 0.4673
 epoch: 93, train_loss: 0.9436, test_loss: 1.0535, test_f1: 0.4793
 epoch: 94, train_loss: 0.9523, test_loss: 1.0582, test_f1: 0.4804
 epoch: 95, train_loss: 0.9411, test_loss: 1.0580, test_f1: 0.4886
 epoch: 96, train_loss: 0.9522, test_loss: 1.0464, test_f1: 0.4815
 epoch: 97, train_loss: 0.9537, test_loss: 1.0382, test_f1: 0.4834
 epoch: 98, train_loss: 0.9357, test_loss: 1.0325, test_f1: 0.4954
 epoch: 99, train_loss: 0.9460, test_loss: 1.0412, test_f1: 0.4941
##################ITERATION #8 ****************************************
 epoch: 0, train_loss: 1.4123, test_loss: 1.3302, test_f1: 0.2281
 epoch: 1, train_loss: 1.2714, test_loss: 1.3380, test_f1: 0.2281
 epoch: 2, train_loss: 1.2391, test_loss: 1.3409, test_f1: 0.2281
 epoch: 3, train_loss: 1.2067, test_loss: 1.3351, test_f1: 0.2281
 epoch: 4, train_loss: 1.2063, test_loss: 1.3224, test_f1: 0.2465
 epoch: 5, train_loss: 1.1779, test_loss: 1.3097, test_f1: 0.2764
 epoch: 6, train_loss: 1.1666, test_loss: 1.2901, test_f1: 0.2763
 epoch: 7, train_loss: 1.1609, test_loss: 1.2724, test_f1: 0.3297
 epoch: 8, train_loss: 1.1552, test_loss: 1.2521, test_f1: 0.3507
 epoch: 9, train_loss: 1.1299, test_loss: 1.2308, test_f1: 0.3760
 epoch: 10, train_loss: 1.1182, test_loss: 1.2071, test_f1: 0.3853
 epoch: 11, train_loss: 1.1282, test_loss: 1.2002, test_f1: 0.3852
 epoch: 12, train_loss: 1.1184, test_loss: 1.1911, test_f1: 0.3693
 epoch: 13, train_loss: 1.1080, test_loss: 1.1845, test_f1: 0.3727
 epoch: 14, train_loss: 1.1146, test_loss: 1.1787, test_f1: 0.3854
 epoch: 15, train_loss: 1.0953, test_loss: 1.1733, test_f1: 0.4009
 epoch: 16, train_loss: 1.0969, test_loss: 1.1743, test_f1: 0.4126
 epoch: 17, train_loss: 1.0905, test_loss: 1.1747, test_f1: 0.4103
 epoch: 18, train_loss: 1.0753, test_loss: 1.1683, test_f1: 0.4111
 epoch: 19, train_loss: 1.0788, test_loss: 1.1596, test_f1: 0.4084
 epoch: 20, train_loss: 1.0781, test_loss: 1.1494, test_f1: 0.4255
 epoch: 21, train_loss: 1.0630, test_loss: 1.1450, test_f1: 0.4044
 epoch: 22, train_loss: 1.0702, test_loss: 1.1513, test_f1: 0.4094
 epoch: 23, train_loss: 1.0661, test_loss: 1.1541, test_f1: 0.4056
 epoch: 24, train_loss: 1.0642, test_loss: 1.1462, test_f1: 0.4088
 epoch: 25, train_loss: 1.0599, test_loss: 1.1415, test_f1: 0.4214
 epoch: 26, train_loss: 1.0546, test_loss: 1.1476, test_f1: 0.4295
 epoch: 27, train_loss: 1.0474, test_loss: 1.1568, test_f1: 0.4209
 epoch: 28, train_loss: 1.0440, test_loss: 1.1300, test_f1: 0.4108
 epoch: 29, train_loss: 1.0425, test_loss: 1.1152, test_f1: 0.4168
 epoch: 30, train_loss: 1.0466, test_loss: 1.1122, test_f1: 0.4433
 epoch: 31, train_loss: 1.0293, test_loss: 1.1197, test_f1: 0.4334
 epoch: 32, train_loss: 1.0301, test_loss: 1.1280, test_f1: 0.4326
 epoch: 33, train_loss: 1.0254, test_loss: 1.1267, test_f1: 0.4301
 epoch: 34, train_loss: 1.0157, test_loss: 1.1190, test_f1: 0.4366
 epoch: 35, train_loss: 1.0047, test_loss: 1.1063, test_f1: 0.4334
 epoch: 36, train_loss: 1.0115, test_loss: 1.0993, test_f1: 0.4426
 epoch: 37, train_loss: 1.0067, test_loss: 1.0950, test_f1: 0.4579
 epoch: 38, train_loss: 1.0058, test_loss: 1.0911, test_f1: 0.4453
 epoch: 39, train_loss: 1.0031, test_loss: 1.0936, test_f1: 0.4501
 epoch: 40, train_loss: 0.9941, test_loss: 1.0914, test_f1: 0.4469
 epoch: 41, train_loss: 0.9989, test_loss: 1.0939, test_f1: 0.4430
 epoch: 42, train_loss: 0.9953, test_loss: 1.0881, test_f1: 0.4533
 epoch: 43, train_loss: 0.9880, test_loss: 1.0851, test_f1: 0.4383
 epoch: 44, train_loss: 0.9912, test_loss: 1.0811, test_f1: 0.4438
 epoch: 45, train_loss: 0.9868, test_loss: 1.0801, test_f1: 0.4535
 epoch: 46, train_loss: 0.9969, test_loss: 1.0817, test_f1: 0.4561
 epoch: 47, train_loss: 0.9930, test_loss: 1.0759, test_f1: 0.4634
 epoch: 48, train_loss: 0.9895, test_loss: 1.0666, test_f1: 0.4348
 epoch: 49, train_loss: 0.9889, test_loss: 1.0675, test_f1: 0.4514
 epoch: 50, train_loss: 0.9821, test_loss: 1.0753, test_f1: 0.4514
 epoch: 51, train_loss: 0.9784, test_loss: 1.0716, test_f1: 0.4606
 epoch: 52, train_loss: 0.9974, test_loss: 1.0722, test_f1: 0.4577
 epoch: 53, train_loss: 0.9760, test_loss: 1.0707, test_f1: 0.4668
 epoch: 54, train_loss: 0.9823, test_loss: 1.0705, test_f1: 0.4658
 epoch: 55, train_loss: 0.9821, test_loss: 1.0689, test_f1: 0.4687
 epoch: 56, train_loss: 0.9733, test_loss: 1.0743, test_f1: 0.4637
 epoch: 57, train_loss: 0.9808, test_loss: 1.0733, test_f1: 0.4615
 epoch: 58, train_loss: 0.9673, test_loss: 1.0657, test_f1: 0.4762
 epoch: 59, train_loss: 0.9629, test_loss: 1.0632, test_f1: 0.4627
 epoch: 60, train_loss: 0.9768, test_loss: 1.0599, test_f1: 0.4618
 epoch: 61, train_loss: 0.9789, test_loss: 1.0580, test_f1: 0.4678
 epoch: 62, train_loss: 0.9701, test_loss: 1.0576, test_f1: 0.4626
 epoch: 63, train_loss: 0.9790, test_loss: 1.0618, test_f1: 0.4716
 epoch: 64, train_loss: 0.9695, test_loss: 1.0622, test_f1: 0.4682
 epoch: 65, train_loss: 0.9677, test_loss: 1.0586, test_f1: 0.4495
 epoch: 66, train_loss: 0.9713, test_loss: 1.0586, test_f1: 0.4576
 epoch: 67, train_loss: 0.9649, test_loss: 1.0594, test_f1: 0.4533
 epoch: 68, train_loss: 0.9609, test_loss: 1.0649, test_f1: 0.4468
 epoch: 69, train_loss: 0.9610, test_loss: 1.0718, test_f1: 0.4584
 epoch: 70, train_loss: 0.9647, test_loss: 1.0666, test_f1: 0.4661
 epoch: 71, train_loss: 0.9564, test_loss: 1.0725, test_f1: 0.4520
 epoch: 72, train_loss: 0.9572, test_loss: 1.0719, test_f1: 0.4642
 epoch: 73, train_loss: 0.9590, test_loss: 1.0638, test_f1: 0.4545
 epoch: 74, train_loss: 0.9675, test_loss: 1.0599, test_f1: 0.4656
 epoch: 75, train_loss: 0.9570, test_loss: 1.0608, test_f1: 0.4790
 epoch: 76, train_loss: 0.9514, test_loss: 1.0681, test_f1: 0.4701
 epoch: 77, train_loss: 0.9561, test_loss: 1.0601, test_f1: 0.4803
 epoch: 78, train_loss: 0.9577, test_loss: 1.0621, test_f1: 0.4873
 epoch: 79, train_loss: 0.9452, test_loss: 1.0568, test_f1: 0.4647
 epoch: 80, train_loss: 0.9544, test_loss: 1.0554, test_f1: 0.4740
 epoch: 81, train_loss: 0.9597, test_loss: 1.0511, test_f1: 0.4735
 epoch: 82, train_loss: 0.9490, test_loss: 1.0495, test_f1: 0.4760
 epoch: 83, train_loss: 0.9439, test_loss: 1.0614, test_f1: 0.4771
 epoch: 84, train_loss: 0.9484, test_loss: 1.0590, test_f1: 0.4735
 epoch: 85, train_loss: 0.9429, test_loss: 1.0670, test_f1: 0.4574
 epoch: 86, train_loss: 0.9486, test_loss: 1.0601, test_f1: 0.4603
 epoch: 87, train_loss: 0.9536, test_loss: 1.0540, test_f1: 0.4661
 epoch: 88, train_loss: 0.9429, test_loss: 1.0540, test_f1: 0.4694
 epoch: 89, train_loss: 0.9393, test_loss: 1.0545, test_f1: 0.4671
 epoch: 90, train_loss: 0.9506, test_loss: 1.0502, test_f1: 0.4694
 epoch: 91, train_loss: 0.9537, test_loss: 1.0407, test_f1: 0.4624
 epoch: 92, train_loss: 0.9461, test_loss: 1.0415, test_f1: 0.4776
 epoch: 93, train_loss: 0.9430, test_loss: 1.0429, test_f1: 0.4812
 epoch: 94, train_loss: 0.9413, test_loss: 1.0482, test_f1: 0.4694
 epoch: 95, train_loss: 0.9464, test_loss: 1.0726, test_f1: 0.4649
 epoch: 96, train_loss: 0.9448, test_loss: 1.0754, test_f1: 0.4707
 epoch: 97, train_loss: 0.9424, test_loss: 1.0688, test_f1: 0.4769
 epoch: 98, train_loss: 0.9518, test_loss: 1.0602, test_f1: 0.4694
 epoch: 99, train_loss: 0.9425, test_loss: 1.0429, test_f1: 0.4715
##################ITERATION #9 ****************************************
 epoch: 0, train_loss: 1.7780, test_loss: 1.4429, test_f1: 0.1723
 epoch: 1, train_loss: 1.4339, test_loss: 1.4001, test_f1: 0.2281
 epoch: 2, train_loss: 1.3636, test_loss: 1.3759, test_f1: 0.2281
 epoch: 3, train_loss: 1.3198, test_loss: 1.3518, test_f1: 0.2281
 epoch: 4, train_loss: 1.2747, test_loss: 1.3328, test_f1: 0.2281
 epoch: 5, train_loss: 1.2384, test_loss: 1.3133, test_f1: 0.2281
 epoch: 6, train_loss: 1.2050, test_loss: 1.2950, test_f1: 0.2339
 epoch: 7, train_loss: 1.1914, test_loss: 1.2620, test_f1: 0.2444
 epoch: 8, train_loss: 1.1737, test_loss: 1.2333, test_f1: 0.2540
 epoch: 9, train_loss: 1.1688, test_loss: 1.2159, test_f1: 0.3424
 epoch: 10, train_loss: 1.1456, test_loss: 1.2097, test_f1: 0.3587
 epoch: 11, train_loss: 1.1430, test_loss: 1.2047, test_f1: 0.3770
 epoch: 12, train_loss: 1.1162, test_loss: 1.2000, test_f1: 0.3743
 epoch: 13, train_loss: 1.1069, test_loss: 1.2034, test_f1: 0.3751
 epoch: 14, train_loss: 1.1151, test_loss: 1.2037, test_f1: 0.3929
 epoch: 15, train_loss: 1.1008, test_loss: 1.1984, test_f1: 0.3908
 epoch: 16, train_loss: 1.1072, test_loss: 1.1918, test_f1: 0.3888
 epoch: 17, train_loss: 1.0904, test_loss: 1.1849, test_f1: 0.4008
 epoch: 18, train_loss: 1.1005, test_loss: 1.1761, test_f1: 0.3986
 epoch: 19, train_loss: 1.0864, test_loss: 1.1729, test_f1: 0.4104
 epoch: 20, train_loss: 1.0782, test_loss: 1.1745, test_f1: 0.4101
 epoch: 21, train_loss: 1.0628, test_loss: 1.1742, test_f1: 0.3981
 epoch: 22, train_loss: 1.0685, test_loss: 1.1776, test_f1: 0.4075
 epoch: 23, train_loss: 1.0535, test_loss: 1.1633, test_f1: 0.4115
 epoch: 24, train_loss: 1.0668, test_loss: 1.1559, test_f1: 0.4151
 epoch: 25, train_loss: 1.0632, test_loss: 1.1519, test_f1: 0.3959
 epoch: 26, train_loss: 1.0566, test_loss: 1.1638, test_f1: 0.4018
 epoch: 27, train_loss: 1.0525, test_loss: 1.1805, test_f1: 0.4047
 epoch: 28, train_loss: 1.0406, test_loss: 1.1761, test_f1: 0.4065
 epoch: 29, train_loss: 1.0452, test_loss: 1.1636, test_f1: 0.4181
 epoch: 30, train_loss: 1.0476, test_loss: 1.1766, test_f1: 0.3994
 epoch: 31, train_loss: 1.0284, test_loss: 1.1609, test_f1: 0.4139
 epoch: 32, train_loss: 1.0438, test_loss: 1.1652, test_f1: 0.4199
 epoch: 33, train_loss: 1.0217, test_loss: 1.1620, test_f1: 0.4133
 epoch: 34, train_loss: 1.0261, test_loss: 1.1488, test_f1: 0.4128
 epoch: 35, train_loss: 1.0336, test_loss: 1.1527, test_f1: 0.4138
 epoch: 36, train_loss: 1.0264, test_loss: 1.1516, test_f1: 0.4234
 epoch: 37, train_loss: 1.0132, test_loss: 1.1561, test_f1: 0.3535
 epoch: 38, train_loss: 1.0192, test_loss: 1.1656, test_f1: 0.3548
 epoch: 39, train_loss: 1.0203, test_loss: 1.1511, test_f1: 0.4030
 epoch: 40, train_loss: 1.0162, test_loss: 1.1595, test_f1: 0.4126
 epoch: 41, train_loss: 1.0016, test_loss: 1.1677, test_f1: 0.4123
 epoch: 42, train_loss: 0.9965, test_loss: 1.1711, test_f1: 0.4099
 epoch: 43, train_loss: 1.0065, test_loss: 1.1682, test_f1: 0.4345
 epoch: 44, train_loss: 1.0024, test_loss: 1.1969, test_f1: 0.4316
 epoch: 45, train_loss: 0.9977, test_loss: 1.1875, test_f1: 0.4161
 epoch: 46, train_loss: 0.9956, test_loss: 1.1706, test_f1: 0.3605
 epoch: 47, train_loss: 0.9990, test_loss: 1.1563, test_f1: 0.3911
 epoch: 48, train_loss: 1.0047, test_loss: 1.1464, test_f1: 0.4396
 epoch: 49, train_loss: 1.0038, test_loss: 1.1642, test_f1: 0.4233
 epoch: 50, train_loss: 1.0048, test_loss: 1.1641, test_f1: 0.4392
 epoch: 51, train_loss: 0.9925, test_loss: 1.1511, test_f1: 0.4593
 epoch: 52, train_loss: 0.9919, test_loss: 1.1433, test_f1: 0.4500
 epoch: 53, train_loss: 0.9959, test_loss: 1.1571, test_f1: 0.4443
 epoch: 54, train_loss: 0.9891, test_loss: 1.1662, test_f1: 0.4260
 epoch: 55, train_loss: 0.9826, test_loss: 1.1714, test_f1: 0.4290
 epoch: 56, train_loss: 0.9944, test_loss: 1.1716, test_f1: 0.4402
 epoch: 57, train_loss: 0.9887, test_loss: 1.1613, test_f1: 0.4453
 epoch: 58, train_loss: 0.9897, test_loss: 1.1613, test_f1: 0.4378
 epoch: 59, train_loss: 0.9903, test_loss: 1.1616, test_f1: 0.4462
 epoch: 60, train_loss: 0.9873, test_loss: 1.1630, test_f1: 0.4494
 epoch: 61, train_loss: 0.9724, test_loss: 1.1584, test_f1: 0.4406
 epoch: 62, train_loss: 0.9795, test_loss: 1.1776, test_f1: 0.4352
 epoch: 63, train_loss: 0.9772, test_loss: 1.1802, test_f1: 0.4270
 epoch: 64, train_loss: 0.9772, test_loss: 1.1721, test_f1: 0.4267
 epoch: 65, train_loss: 0.9671, test_loss: 1.1613, test_f1: 0.4384
 epoch: 66, train_loss: 0.9614, test_loss: 1.1573, test_f1: 0.4467
 epoch: 67, train_loss: 0.9743, test_loss: 1.1639, test_f1: 0.4414
 epoch: 68, train_loss: 0.9858, test_loss: 1.1730, test_f1: 0.4447
 epoch: 69, train_loss: 0.9648, test_loss: 1.1779, test_f1: 0.4343
 epoch: 70, train_loss: 0.9712, test_loss: 1.1804, test_f1: 0.4317
 epoch: 71, train_loss: 0.9660, test_loss: 1.1753, test_f1: 0.4416
 epoch: 72, train_loss: 0.9727, test_loss: 1.1874, test_f1: 0.4480
 epoch: 73, train_loss: 0.9703, test_loss: 1.2080, test_f1: 0.4425
 epoch: 74, train_loss: 0.9648, test_loss: 1.1935, test_f1: 0.4409
 epoch: 75, train_loss: 0.9674, test_loss: 1.1731, test_f1: 0.4503
 epoch: 76, train_loss: 0.9619, test_loss: 1.1567, test_f1: 0.4474
 epoch: 77, train_loss: 0.9521, test_loss: 1.1606, test_f1: 0.4542
 epoch: 78, train_loss: 0.9614, test_loss: 1.1841, test_f1: 0.4541
 epoch: 79, train_loss: 0.9637, test_loss: 1.1880, test_f1: 0.4439
 epoch: 80, train_loss: 0.9599, test_loss: 1.1679, test_f1: 0.4443
 epoch: 81, train_loss: 0.9600, test_loss: 1.1805, test_f1: 0.4459
 epoch: 82, train_loss: 0.9712, test_loss: 1.1706, test_f1: 0.4484
 epoch: 83, train_loss: 0.9654, test_loss: 1.1780, test_f1: 0.4501
 epoch: 84, train_loss: 0.9643, test_loss: 1.1735, test_f1: 0.4489
 epoch: 85, train_loss: 0.9544, test_loss: 1.1698, test_f1: 0.4498
 epoch: 86, train_loss: 0.9605, test_loss: 1.1652, test_f1: 0.4548
 epoch: 87, train_loss: 0.9510, test_loss: 1.1720, test_f1: 0.4468
 epoch: 88, train_loss: 0.9657, test_loss: 1.1727, test_f1: 0.4543
 epoch: 89, train_loss: 0.9564, test_loss: 1.1723, test_f1: 0.4431
 epoch: 90, train_loss: 0.9603, test_loss: 1.2015, test_f1: 0.4416
 epoch: 91, train_loss: 0.9617, test_loss: 1.1942, test_f1: 0.4457
 epoch: 92, train_loss: 0.9553, test_loss: 1.1773, test_f1: 0.4498
 epoch: 93, train_loss: 0.9476, test_loss: 1.1935, test_f1: 0.4691
 epoch: 94, train_loss: 0.9465, test_loss: 1.2259, test_f1: 0.4392
 epoch: 95, train_loss: 0.9656, test_loss: 1.2065, test_f1: 0.4502
 epoch: 96, train_loss: 0.9555, test_loss: 1.1872, test_f1: 0.4707
 epoch: 97, train_loss: 0.9410, test_loss: 1.1803, test_f1: 0.4559
 epoch: 98, train_loss: 0.9441, test_loss: 1.1689, test_f1: 0.4599
 epoch: 99, train_loss: 0.9509, test_loss: 1.1771, test_f1: 0.4584

Training completed in 280.60 seconds
Best F1: 0.4955 at epoch 84
Mean F1 across iterations: 0.4657  0.0271
========================FINAL RESULTS================================
FEGIN weighted F1: 0.4955  0.0271
python main.py --data ltspice_demos --representation component_net --model FEGIN --layers 2 --hiddens 16 --batch_size 256 --lr 0.001 --emb_size 250 --epochs 100 --save_appendix component_net_L2_H16_BS256_LR0.001_E250 --no_val
-----



STDERR:
  File "main.py", line 370, in <module>
    main()
  File "main.py", line 254, in main
    dataset = dataset_class(
  File "/home/philip/projects/ltspice_examples_code_repo/Circuit-Completion-Using-GNNs/component_classification_with_link_prediction_head/evaluation/FEGIN/kernel/circuit_datasets.py", line 15, in __init__
    self.data, self.slices = torch.load(self.processed_paths[0])
  File "/home/philip/.local/lib/python3.8/site-packages/torch/serialization.py", line 1040, in load
    warnings.warn(
  File "/usr/lib/python3.8/warnings.py", line 109, in _showwarnmsg
    sw(msg.message, msg.category, msg.filename, msg.lineno,
  File "main.py", line 47, in warn_with_traceback
    traceback.print_stack(file=log)
/home/philip/projects/ltspice_examples_code_repo/Circuit-Completion-Using-GNNs/component_classification_with_link_prediction_head/evaluation/FEGIN/kernel/circuit_datasets.py:15: FutureWarning: You are using `torch.load` with `weights_only=False` (the current default value), which uses the default pickle module implicitly. It is possible to construct malicious pickle data which will execute arbitrary code during unpickling (See https://github.com/pytorch/pytorch/blob/main/SECURITY.md#untrusted-models for more details). In a future release, the default value for `weights_only` will be flipped to `True`. This limits the functions that could be executed during unpickling. Arbitrary objects will no longer be allowed to be loaded via this mode unless they are explicitly allowlisted by the user via `torch.serialization.add_safe_globals`. We recommend you start setting `weights_only=True` for any use case where you don't have full control of the loaded file. Please open an issue on GitHub for any issues related to this experimental feature.
  self.data, self.slices = torch.load(self.processed_paths[0])
