STDOUT:
Results will be saved in /home/philip/projects/ltspice_examples_code_repo/Circuit-Completion-Using-GNNs/component_classification_with_link_prediction_head/evaluation/FEGIN/results/model_FEGIN_dataset_ltspice_examples
Command line input: python main.py --data ltspice_examples --representation component_pin --model FEGIN --layers 6 --hiddens 32 --batch_size 64 --lr 0.01 --emb_size 250 --epochs 100 --save_appendix component_pin_L6_H32_BS64_LR0.01_E250 --no_val
 is saved.
-----
ltspice_examples - FEGIN
Using 6 layers, 32 hidden units, h = 2
Loading component_pin representation dataset
ENTERED
Training FEGIN on component_pin representation
Train: 3560, Test: 848
##################ITERATION #0 ****************************************
 epoch: 0, train_loss: 1.2107, test_loss: 1.4300, test_f1: 0.2957
 epoch: 1, train_loss: 1.0617, test_loss: 1.0402, test_f1: 0.4000
 epoch: 2, train_loss: 1.0518, test_loss: 1.0863, test_f1: 0.5018
 epoch: 3, train_loss: 1.0164, test_loss: 0.9794, test_f1: 0.5039
 epoch: 4, train_loss: 1.0008, test_loss: 1.3619, test_f1: 0.4024
 epoch: 5, train_loss: 0.9560, test_loss: 1.0803, test_f1: 0.4837
 epoch: 6, train_loss: 0.9337, test_loss: 1.0673, test_f1: 0.4540
 epoch: 7, train_loss: 0.9182, test_loss: 0.8992, test_f1: 0.5164
 epoch: 8, train_loss: 0.9097, test_loss: 0.9821, test_f1: 0.4657
 epoch: 9, train_loss: 0.8918, test_loss: 0.8594, test_f1: 0.5336
 epoch: 10, train_loss: 0.8796, test_loss: 0.8668, test_f1: 0.5369
 epoch: 11, train_loss: 0.8830, test_loss: 0.8860, test_f1: 0.5161
 epoch: 12, train_loss: 0.8666, test_loss: 0.8985, test_f1: 0.5789
 epoch: 13, train_loss: 0.8516, test_loss: 0.8974, test_f1: 0.5360
 epoch: 14, train_loss: 0.8573, test_loss: 0.8718, test_f1: 0.5333
 epoch: 15, train_loss: 0.8395, test_loss: 0.9693, test_f1: 0.5090
 epoch: 16, train_loss: 0.8323, test_loss: 0.9728, test_f1: 0.5489
 epoch: 17, train_loss: 0.8231, test_loss: 0.7988, test_f1: 0.5893
 epoch: 18, train_loss: 0.8200, test_loss: 0.9151, test_f1: 0.5246
 epoch: 19, train_loss: 0.8257, test_loss: 0.8832, test_f1: 0.5262
 epoch: 20, train_loss: 0.8126, test_loss: 0.8507, test_f1: 0.5375
 epoch: 21, train_loss: 0.8100, test_loss: 0.8699, test_f1: 0.5488
 epoch: 22, train_loss: 0.8090, test_loss: 0.8639, test_f1: 0.5653
 epoch: 23, train_loss: 0.7999, test_loss: 0.9696, test_f1: 0.5542
 epoch: 24, train_loss: 0.7985, test_loss: 0.7533, test_f1: 0.5725
 epoch: 25, train_loss: 0.7856, test_loss: 0.8547, test_f1: 0.6083
 epoch: 26, train_loss: 0.7778, test_loss: 0.9179, test_f1: 0.5663
 epoch: 27, train_loss: 0.7819, test_loss: 0.8297, test_f1: 0.6022
 epoch: 28, train_loss: 0.7643, test_loss: 0.9014, test_f1: 0.5559
 epoch: 29, train_loss: 0.7759, test_loss: 0.9308, test_f1: 0.5604
 epoch: 30, train_loss: 0.7563, test_loss: 0.9244, test_f1: 0.5439
 epoch: 31, train_loss: 0.7688, test_loss: 0.8269, test_f1: 0.5726
 epoch: 32, train_loss: 0.7735, test_loss: 0.7629, test_f1: 0.5580
 epoch: 33, train_loss: 0.7494, test_loss: 0.8874, test_f1: 0.5694
 epoch: 34, train_loss: 0.7322, test_loss: 0.9045, test_f1: 0.5648
 epoch: 35, train_loss: 0.7783, test_loss: 0.8904, test_f1: 0.5652
 epoch: 36, train_loss: 0.7426, test_loss: 0.8533, test_f1: 0.5696
 epoch: 37, train_loss: 0.7474, test_loss: 0.9194, test_f1: 0.5799
 epoch: 38, train_loss: 0.7332, test_loss: 0.8706, test_f1: 0.6146
 epoch: 39, train_loss: 0.7279, test_loss: 0.7854, test_f1: 0.5855
 epoch: 40, train_loss: 0.7339, test_loss: 0.9118, test_f1: 0.5906
 epoch: 41, train_loss: 0.7292, test_loss: 1.0018, test_f1: 0.5889
 epoch: 42, train_loss: 0.7223, test_loss: 0.8740, test_f1: 0.6045
 epoch: 43, train_loss: 0.7201, test_loss: 0.8223, test_f1: 0.6006
 epoch: 44, train_loss: 0.7101, test_loss: 0.8515, test_f1: 0.5954
 epoch: 45, train_loss: 0.6996, test_loss: 0.9198, test_f1: 0.6118
 epoch: 46, train_loss: 0.7135, test_loss: 0.8544, test_f1: 0.5385
 epoch: 47, train_loss: 0.7471, test_loss: 0.8039, test_f1: 0.5494
 epoch: 48, train_loss: 0.7219, test_loss: 0.8506, test_f1: 0.6380
 epoch: 49, train_loss: 0.7127, test_loss: 0.8627, test_f1: 0.6003
 epoch: 50, train_loss: 0.7184, test_loss: 0.8933, test_f1: 0.6229
 epoch: 51, train_loss: 0.6888, test_loss: 0.8515, test_f1: 0.6118
 epoch: 52, train_loss: 0.6692, test_loss: 0.8476, test_f1: 0.6337
 epoch: 53, train_loss: 0.6482, test_loss: 0.8335, test_f1: 0.6275
 epoch: 54, train_loss: 0.6523, test_loss: 0.8825, test_f1: 0.6513
 epoch: 55, train_loss: 0.6458, test_loss: 0.8338, test_f1: 0.6108
 epoch: 56, train_loss: 0.6361, test_loss: 0.8896, test_f1: 0.6687
 epoch: 57, train_loss: 0.6405, test_loss: 0.9173, test_f1: 0.6389
 epoch: 58, train_loss: 0.6406, test_loss: 0.8563, test_f1: 0.6694
 epoch: 59, train_loss: 0.6292, test_loss: 0.8600, test_f1: 0.6423
 epoch: 60, train_loss: 0.6411, test_loss: 0.8618, test_f1: 0.6458
 epoch: 61, train_loss: 0.6501, test_loss: 0.8553, test_f1: 0.6584
 epoch: 62, train_loss: 0.6435, test_loss: 0.8317, test_f1: 0.6559
 epoch: 63, train_loss: 0.6307, test_loss: 0.8749, test_f1: 0.6446
 epoch: 64, train_loss: 0.6262, test_loss: 0.9811, test_f1: 0.6279
 epoch: 65, train_loss: 0.6427, test_loss: 0.9481, test_f1: 0.6558
 epoch: 66, train_loss: 0.6188, test_loss: 0.9238, test_f1: 0.6683
 epoch: 67, train_loss: 0.6402, test_loss: 0.9063, test_f1: 0.6358
 epoch: 68, train_loss: 0.6251, test_loss: 1.0447, test_f1: 0.6613
 epoch: 69, train_loss: 0.6255, test_loss: 0.8912, test_f1: 0.6412
 epoch: 70, train_loss: 0.6161, test_loss: 0.9756, test_f1: 0.6562
 epoch: 71, train_loss: 0.5987, test_loss: 0.9782, test_f1: 0.6381
 epoch: 72, train_loss: 0.6096, test_loss: 1.0756, test_f1: 0.6311
 epoch: 73, train_loss: 0.6015, test_loss: 1.0242, test_f1: 0.6688
 epoch: 74, train_loss: 0.5969, test_loss: 0.8677, test_f1: 0.6776
 epoch: 75, train_loss: 0.6226, test_loss: 1.0728, test_f1: 0.6406
 epoch: 76, train_loss: 0.5888, test_loss: 0.8880, test_f1: 0.6668
 epoch: 77, train_loss: 0.5907, test_loss: 0.8421, test_f1: 0.6647
 epoch: 78, train_loss: 0.5930, test_loss: 0.9878, test_f1: 0.6394
 epoch: 79, train_loss: 0.5848, test_loss: 0.8736, test_f1: 0.6753
 epoch: 80, train_loss: 0.5870, test_loss: 0.9700, test_f1: 0.6345
 epoch: 81, train_loss: 0.6029, test_loss: 0.9231, test_f1: 0.6440
 epoch: 82, train_loss: 0.5962, test_loss: 0.9496, test_f1: 0.6497
 epoch: 83, train_loss: 0.5904, test_loss: 0.9582, test_f1: 0.6559
 epoch: 84, train_loss: 0.5941, test_loss: 0.9956, test_f1: 0.6470
 epoch: 85, train_loss: 0.5729, test_loss: 0.9662, test_f1: 0.6384
 epoch: 86, train_loss: 0.5585, test_loss: 0.9276, test_f1: 0.6601
 epoch: 87, train_loss: 0.5770, test_loss: 0.9755, test_f1: 0.6618
 epoch: 88, train_loss: 0.5838, test_loss: 1.0618, test_f1: 0.6374
 epoch: 89, train_loss: 0.5854, test_loss: 0.9882, test_f1: 0.6173
 epoch: 90, train_loss: 0.5506, test_loss: 1.0560, test_f1: 0.6146
 epoch: 91, train_loss: 0.5765, test_loss: 0.9632, test_f1: 0.6474
 epoch: 92, train_loss: 0.5943, test_loss: 0.9971, test_f1: 0.6621
 epoch: 93, train_loss: 0.5717, test_loss: 1.0234, test_f1: 0.6628
 epoch: 94, train_loss: 0.5837, test_loss: 0.9779, test_f1: 0.6437
 epoch: 95, train_loss: 0.5534, test_loss: 0.9708, test_f1: 0.6390
 epoch: 96, train_loss: 0.5476, test_loss: 0.9751, test_f1: 0.6597
 epoch: 97, train_loss: 0.5544, test_loss: 0.9724, test_f1: 0.6343
 epoch: 98, train_loss: 0.5529, test_loss: 0.9917, test_f1: 0.6702
 epoch: 99, train_loss: 0.5515, test_loss: 1.0561, test_f1: 0.6279
##################ITERATION #1 ****************************************
 epoch: 0, train_loss: 1.1387, test_loss: 1.0847, test_f1: 0.3997
 epoch: 1, train_loss: 1.0198, test_loss: 1.0598, test_f1: 0.4046
 epoch: 2, train_loss: 0.9930, test_loss: 1.0639, test_f1: 0.4808
 epoch: 3, train_loss: 0.9712, test_loss: 1.0040, test_f1: 0.4583
 epoch: 4, train_loss: 0.9692, test_loss: 1.8126, test_f1: 0.3653
 epoch: 5, train_loss: 0.9484, test_loss: 1.0390, test_f1: 0.4405
 epoch: 6, train_loss: 0.9321, test_loss: 0.9635, test_f1: 0.4868
 epoch: 7, train_loss: 0.8860, test_loss: 1.0188, test_f1: 0.5342
 epoch: 8, train_loss: 0.8821, test_loss: 1.0866, test_f1: 0.5105
 epoch: 9, train_loss: 0.8744, test_loss: 1.0051, test_f1: 0.5462
 epoch: 10, train_loss: 0.8739, test_loss: 0.9409, test_f1: 0.4937
 epoch: 11, train_loss: 0.8561, test_loss: 1.1136, test_f1: 0.4682
 epoch: 12, train_loss: 0.8657, test_loss: 0.8908, test_f1: 0.5318
 epoch: 13, train_loss: 0.8606, test_loss: 0.9470, test_f1: 0.5324
 epoch: 14, train_loss: 0.8379, test_loss: 0.9162, test_f1: 0.5336
 epoch: 15, train_loss: 0.8377, test_loss: 0.9943, test_f1: 0.5190
 epoch: 16, train_loss: 0.8099, test_loss: 0.8576, test_f1: 0.5780
 epoch: 17, train_loss: 0.8167, test_loss: 1.0056, test_f1: 0.5465
 epoch: 18, train_loss: 0.8079, test_loss: 0.8475, test_f1: 0.5942
 epoch: 19, train_loss: 0.8217, test_loss: 0.9581, test_f1: 0.5245
 epoch: 20, train_loss: 0.8064, test_loss: 0.8615, test_f1: 0.5227
 epoch: 21, train_loss: 0.8000, test_loss: 1.0116, test_f1: 0.5114
 epoch: 22, train_loss: 0.7924, test_loss: 0.9691, test_f1: 0.5183
 epoch: 23, train_loss: 0.7810, test_loss: 0.8681, test_f1: 0.6159
 epoch: 24, train_loss: 0.7600, test_loss: 0.8811, test_f1: 0.5586
 epoch: 25, train_loss: 0.7855, test_loss: 0.9129, test_f1: 0.5434
 epoch: 26, train_loss: 0.7614, test_loss: 0.8482, test_f1: 0.5916
 epoch: 27, train_loss: 0.7502, test_loss: 0.9395, test_f1: 0.5030
 epoch: 28, train_loss: 0.7629, test_loss: 0.8565, test_f1: 0.5251
 epoch: 29, train_loss: 0.7540, test_loss: 0.8912, test_f1: 0.5210
 epoch: 30, train_loss: 0.7570, test_loss: 0.8363, test_f1: 0.5568
 epoch: 31, train_loss: 0.7323, test_loss: 0.7781, test_f1: 0.5466
 epoch: 32, train_loss: 0.7418, test_loss: 0.8033, test_f1: 0.6114
 epoch: 33, train_loss: 0.7137, test_loss: 0.8192, test_f1: 0.6088
 epoch: 34, train_loss: 0.7288, test_loss: 1.0318, test_f1: 0.5075
 epoch: 35, train_loss: 0.7100, test_loss: 0.8034, test_f1: 0.5311
 epoch: 36, train_loss: 0.7239, test_loss: 0.7828, test_f1: 0.5447
 epoch: 37, train_loss: 0.7172, test_loss: 0.7607, test_f1: 0.6472
 epoch: 38, train_loss: 0.7263, test_loss: 0.7544, test_f1: 0.6168
 epoch: 39, train_loss: 0.7182, test_loss: 0.8337, test_f1: 0.5918
 epoch: 40, train_loss: 0.6997, test_loss: 0.7353, test_f1: 0.5832
 epoch: 41, train_loss: 0.7040, test_loss: 0.8828, test_f1: 0.5436
 epoch: 42, train_loss: 0.6907, test_loss: 0.8696, test_f1: 0.5645
 epoch: 43, train_loss: 0.7085, test_loss: 0.8560, test_f1: 0.5424
 epoch: 44, train_loss: 0.7161, test_loss: 0.7407, test_f1: 0.5913
 epoch: 45, train_loss: 0.7163, test_loss: 0.8557, test_f1: 0.6164
 epoch: 46, train_loss: 0.7150, test_loss: 0.9645, test_f1: 0.5497
 epoch: 47, train_loss: 0.6879, test_loss: 0.8437, test_f1: 0.5313
 epoch: 48, train_loss: 0.6873, test_loss: 0.8224, test_f1: 0.6041
 epoch: 49, train_loss: 0.6812, test_loss: 0.7966, test_f1: 0.6005
 epoch: 50, train_loss: 0.6938, test_loss: 0.8286, test_f1: 0.5452
 epoch: 51, train_loss: 0.6611, test_loss: 0.7174, test_f1: 0.6541
 epoch: 52, train_loss: 0.6523, test_loss: 0.7293, test_f1: 0.6230
 epoch: 53, train_loss: 0.6308, test_loss: 0.7486, test_f1: 0.6499
 epoch: 54, train_loss: 0.6128, test_loss: 0.7777, test_f1: 0.6413
 epoch: 55, train_loss: 0.6281, test_loss: 0.7783, test_f1: 0.6184
 epoch: 56, train_loss: 0.6164, test_loss: 0.7562, test_f1: 0.6104
 epoch: 57, train_loss: 0.6272, test_loss: 0.7533, test_f1: 0.6155
 epoch: 58, train_loss: 0.6121, test_loss: 0.7922, test_f1: 0.6267
 epoch: 59, train_loss: 0.6302, test_loss: 0.7780, test_f1: 0.6103
 epoch: 60, train_loss: 0.6097, test_loss: 0.8189, test_f1: 0.5845
 epoch: 61, train_loss: 0.6165, test_loss: 0.7422, test_f1: 0.6436
 epoch: 62, train_loss: 0.5998, test_loss: 0.7749, test_f1: 0.5932
 epoch: 63, train_loss: 0.6053, test_loss: 0.7872, test_f1: 0.6399
 epoch: 64, train_loss: 0.6181, test_loss: 0.7587, test_f1: 0.5934
 epoch: 65, train_loss: 0.6137, test_loss: 0.7459, test_f1: 0.6388
 epoch: 66, train_loss: 0.6094, test_loss: 0.8089, test_f1: 0.6159
 epoch: 67, train_loss: 0.6034, test_loss: 0.7674, test_f1: 0.6129
 epoch: 68, train_loss: 0.5967, test_loss: 0.7490, test_f1: 0.6419
 epoch: 69, train_loss: 0.5922, test_loss: 0.7844, test_f1: 0.6325
 epoch: 70, train_loss: 0.5947, test_loss: 0.8130, test_f1: 0.6191
 epoch: 71, train_loss: 0.6097, test_loss: 0.7340, test_f1: 0.6336
 epoch: 72, train_loss: 0.6030, test_loss: 0.7831, test_f1: 0.6287
 epoch: 73, train_loss: 0.5799, test_loss: 0.8605, test_f1: 0.6279
 epoch: 74, train_loss: 0.5965, test_loss: 0.7900, test_f1: 0.5976
 epoch: 75, train_loss: 0.5843, test_loss: 0.8191, test_f1: 0.6293
 epoch: 76, train_loss: 0.5876, test_loss: 0.8715, test_f1: 0.6356
 epoch: 77, train_loss: 0.5803, test_loss: 0.7840, test_f1: 0.6513
 epoch: 78, train_loss: 0.5898, test_loss: 0.8097, test_f1: 0.6270
 epoch: 79, train_loss: 0.5821, test_loss: 0.8196, test_f1: 0.6394
 epoch: 80, train_loss: 0.5617, test_loss: 0.8132, test_f1: 0.6196
 epoch: 81, train_loss: 0.5758, test_loss: 0.8362, test_f1: 0.6320
 epoch: 82, train_loss: 0.5779, test_loss: 0.9442, test_f1: 0.5995
 epoch: 83, train_loss: 0.5813, test_loss: 0.8217, test_f1: 0.6115
 epoch: 84, train_loss: 0.5718, test_loss: 0.7457, test_f1: 0.6580
 epoch: 85, train_loss: 0.5721, test_loss: 0.8091, test_f1: 0.6316
 epoch: 86, train_loss: 0.5713, test_loss: 0.8064, test_f1: 0.6240
 epoch: 87, train_loss: 0.5589, test_loss: 0.8724, test_f1: 0.5837
 epoch: 88, train_loss: 0.5651, test_loss: 0.8321, test_f1: 0.6172
 epoch: 89, train_loss: 0.5596, test_loss: 0.9068, test_f1: 0.5878
 epoch: 90, train_loss: 0.5653, test_loss: 0.7864, test_f1: 0.6238
 epoch: 91, train_loss: 0.5619, test_loss: 0.8573, test_f1: 0.6425
 epoch: 92, train_loss: 0.5646, test_loss: 0.8419, test_f1: 0.6342
 epoch: 93, train_loss: 0.5550, test_loss: 0.8505, test_f1: 0.6052
 epoch: 94, train_loss: 0.5484, test_loss: 0.9083, test_f1: 0.6093
 epoch: 95, train_loss: 0.5615, test_loss: 0.8764, test_f1: 0.6020
 epoch: 96, train_loss: 0.5636, test_loss: 0.8731, test_f1: 0.6143
 epoch: 97, train_loss: 0.5578, test_loss: 0.8238, test_f1: 0.6210
 epoch: 98, train_loss: 0.5799, test_loss: 0.7599, test_f1: 0.6248
 epoch: 99, train_loss: 0.5652, test_loss: 0.8673, test_f1: 0.6132
##################ITERATION #2 ****************************************
 epoch: 0, train_loss: 1.1351, test_loss: 1.0683, test_f1: 0.4741
 epoch: 1, train_loss: 1.0233, test_loss: 0.9825, test_f1: 0.4766
 epoch: 2, train_loss: 0.9938, test_loss: 1.0883, test_f1: 0.5436
 epoch: 3, train_loss: 0.9657, test_loss: 0.9357, test_f1: 0.5241
 epoch: 4, train_loss: 0.9563, test_loss: 0.9615, test_f1: 0.5026
 epoch: 5, train_loss: 0.9470, test_loss: 1.2879, test_f1: 0.4577
 epoch: 6, train_loss: 0.9368, test_loss: 1.0245, test_f1: 0.4959
 epoch: 7, train_loss: 0.9170, test_loss: 0.9804, test_f1: 0.5207
 epoch: 8, train_loss: 0.9001, test_loss: 0.9188, test_f1: 0.5182
 epoch: 9, train_loss: 0.9097, test_loss: 0.8773, test_f1: 0.5122
 epoch: 10, train_loss: 0.8850, test_loss: 0.9678, test_f1: 0.4897
 epoch: 11, train_loss: 0.8705, test_loss: 0.9397, test_f1: 0.5309
 epoch: 12, train_loss: 0.8897, test_loss: 0.9087, test_f1: 0.5040
 epoch: 13, train_loss: 0.8784, test_loss: 0.9757, test_f1: 0.4844
 epoch: 14, train_loss: 0.8651, test_loss: 0.9044, test_f1: 0.5369
 epoch: 15, train_loss: 0.8692, test_loss: 0.8938, test_f1: 0.5274
 epoch: 16, train_loss: 0.8371, test_loss: 0.8314, test_f1: 0.5559
 epoch: 17, train_loss: 0.8530, test_loss: 0.9002, test_f1: 0.5322
 epoch: 18, train_loss: 0.8557, test_loss: 1.0849, test_f1: 0.4808
 epoch: 19, train_loss: 0.8290, test_loss: 1.0455, test_f1: 0.4904
 epoch: 20, train_loss: 0.8424, test_loss: 0.8253, test_f1: 0.5457
 epoch: 21, train_loss: 0.8159, test_loss: 0.9522, test_f1: 0.5384
 epoch: 22, train_loss: 0.8315, test_loss: 0.8517, test_f1: 0.5689
 epoch: 23, train_loss: 0.8117, test_loss: 1.0101, test_f1: 0.5013
 epoch: 24, train_loss: 0.8073, test_loss: 0.9391, test_f1: 0.5709
 epoch: 25, train_loss: 0.8148, test_loss: 0.9469, test_f1: 0.5268
 epoch: 26, train_loss: 0.8054, test_loss: 0.9205, test_f1: 0.5174
 epoch: 27, train_loss: 0.8243, test_loss: 0.8430, test_f1: 0.5462
 epoch: 28, train_loss: 0.7974, test_loss: 0.9118, test_f1: 0.5666
 epoch: 29, train_loss: 0.7896, test_loss: 0.9456, test_f1: 0.5638
 epoch: 30, train_loss: 0.7954, test_loss: 1.1969, test_f1: 0.5019
 epoch: 31, train_loss: 0.7808, test_loss: 0.9179, test_f1: 0.5390
 epoch: 32, train_loss: 0.8121, test_loss: 0.8945, test_f1: 0.5498
 epoch: 33, train_loss: 0.7800, test_loss: 0.9619, test_f1: 0.5382
 epoch: 34, train_loss: 0.7922, test_loss: 0.9468, test_f1: 0.5356
 epoch: 35, train_loss: 0.7760, test_loss: 0.8852, test_f1: 0.5279
 epoch: 36, train_loss: 0.8008, test_loss: 0.8881, test_f1: 0.5657
 epoch: 37, train_loss: 0.7979, test_loss: 0.9511, test_f1: 0.5508
 epoch: 38, train_loss: 0.7568, test_loss: 1.0338, test_f1: 0.5545
 epoch: 39, train_loss: 0.7809, test_loss: 0.8683, test_f1: 0.5465
 epoch: 40, train_loss: 0.7783, test_loss: 0.8296, test_f1: 0.5765
 epoch: 41, train_loss: 0.7762, test_loss: 0.8793, test_f1: 0.5559
 epoch: 42, train_loss: 0.7617, test_loss: 0.8602, test_f1: 0.5369
 epoch: 43, train_loss: 0.7552, test_loss: 0.8969, test_f1: 0.5600
 epoch: 44, train_loss: 0.7619, test_loss: 0.9008, test_f1: 0.5645
 epoch: 45, train_loss: 0.7453, test_loss: 0.9672, test_f1: 0.5638
 epoch: 46, train_loss: 0.7608, test_loss: 0.8578, test_f1: 0.5613
 epoch: 47, train_loss: 0.7611, test_loss: 1.0687, test_f1: 0.5315
 epoch: 48, train_loss: 0.7333, test_loss: 0.9963, test_f1: 0.5399
 epoch: 49, train_loss: 0.7304, test_loss: 0.8979, test_f1: 0.5495
 epoch: 50, train_loss: 0.7435, test_loss: 0.9363, test_f1: 0.5815
 epoch: 51, train_loss: 0.6909, test_loss: 0.9630, test_f1: 0.5631
 epoch: 52, train_loss: 0.6864, test_loss: 0.9621, test_f1: 0.5754
 epoch: 53, train_loss: 0.6842, test_loss: 0.9545, test_f1: 0.5919
 epoch: 54, train_loss: 0.6973, test_loss: 0.9414, test_f1: 0.5571
 epoch: 55, train_loss: 0.6940, test_loss: 0.9051, test_f1: 0.5801
 epoch: 56, train_loss: 0.6778, test_loss: 0.9555, test_f1: 0.5814
 epoch: 57, train_loss: 0.6810, test_loss: 0.8442, test_f1: 0.5647
 epoch: 58, train_loss: 0.6642, test_loss: 0.9014, test_f1: 0.5801
 epoch: 59, train_loss: 0.6773, test_loss: 0.9816, test_f1: 0.5596
 epoch: 60, train_loss: 0.6790, test_loss: 1.1216, test_f1: 0.5459
 epoch: 61, train_loss: 0.6655, test_loss: 0.9117, test_f1: 0.6069
 epoch: 62, train_loss: 0.6804, test_loss: 0.9371, test_f1: 0.6077
 epoch: 63, train_loss: 0.6577, test_loss: 0.9699, test_f1: 0.5586
 epoch: 64, train_loss: 0.6613, test_loss: 0.8988, test_f1: 0.5967
 epoch: 65, train_loss: 0.6635, test_loss: 0.9011, test_f1: 0.5663
 epoch: 66, train_loss: 0.6592, test_loss: 0.9943, test_f1: 0.5698
 epoch: 67, train_loss: 0.6579, test_loss: 0.9703, test_f1: 0.5637
 epoch: 68, train_loss: 0.6512, test_loss: 0.9683, test_f1: 0.5877
 epoch: 69, train_loss: 0.6393, test_loss: 1.2180, test_f1: 0.5963
 epoch: 70, train_loss: 0.6507, test_loss: 0.9842, test_f1: 0.6139
 epoch: 71, train_loss: 0.6421, test_loss: 0.9304, test_f1: 0.6145
 epoch: 72, train_loss: 0.6481, test_loss: 0.9268, test_f1: 0.6179
 epoch: 73, train_loss: 0.6423, test_loss: 0.8786, test_f1: 0.6223
 epoch: 74, train_loss: 0.6571, test_loss: 1.0211, test_f1: 0.6277
 epoch: 75, train_loss: 0.6496, test_loss: 0.9564, test_f1: 0.6138
 epoch: 76, train_loss: 0.6295, test_loss: 1.0318, test_f1: 0.5993
 epoch: 77, train_loss: 0.6370, test_loss: 0.9037, test_f1: 0.6553
 epoch: 78, train_loss: 0.6184, test_loss: 0.9539, test_f1: 0.6122
 epoch: 79, train_loss: 0.6094, test_loss: 0.9802, test_f1: 0.6246
 epoch: 80, train_loss: 0.6329, test_loss: 1.1016, test_f1: 0.5945
 epoch: 81, train_loss: 0.6336, test_loss: 0.9536, test_f1: 0.5992
 epoch: 82, train_loss: 0.6402, test_loss: 0.9527, test_f1: 0.6504
 epoch: 83, train_loss: 0.6429, test_loss: 0.9356, test_f1: 0.6309
 epoch: 84, train_loss: 0.6234, test_loss: 0.9826, test_f1: 0.6227
 epoch: 85, train_loss: 0.6203, test_loss: 0.9660, test_f1: 0.5958
 epoch: 86, train_loss: 0.6349, test_loss: 0.9845, test_f1: 0.6102
 epoch: 87, train_loss: 0.6183, test_loss: 1.0145, test_f1: 0.6091
 epoch: 88, train_loss: 0.6156, test_loss: 1.0581, test_f1: 0.5918
 epoch: 89, train_loss: 0.6224, test_loss: 0.9502, test_f1: 0.6155
 epoch: 90, train_loss: 0.6170, test_loss: 1.0663, test_f1: 0.6516
 epoch: 91, train_loss: 0.6012, test_loss: 1.0527, test_f1: 0.5991
 epoch: 92, train_loss: 0.6078, test_loss: 1.0201, test_f1: 0.6175
 epoch: 93, train_loss: 0.6295, test_loss: 0.9843, test_f1: 0.6250
 epoch: 94, train_loss: 0.6297, test_loss: 0.9872, test_f1: 0.6308
 epoch: 95, train_loss: 0.5931, test_loss: 1.0891, test_f1: 0.6472
 epoch: 96, train_loss: 0.6110, test_loss: 1.0105, test_f1: 0.6203
 epoch: 97, train_loss: 0.6043, test_loss: 1.0623, test_f1: 0.6366
 epoch: 98, train_loss: 0.5956, test_loss: 1.0346, test_f1: 0.6244
 epoch: 99, train_loss: 0.6100, test_loss: 0.9135, test_f1: 0.6291
##################ITERATION #3 ****************************************
 epoch: 0, train_loss: 1.1563, test_loss: 1.0551, test_f1: 0.3574
 epoch: 1, train_loss: 1.0152, test_loss: 1.0612, test_f1: 0.4886
 epoch: 2, train_loss: 0.9785, test_loss: 1.0393, test_f1: 0.4912
 epoch: 3, train_loss: 0.9808, test_loss: 1.0096, test_f1: 0.4837
 epoch: 4, train_loss: 0.9507, test_loss: 1.2114, test_f1: 0.4175
 epoch: 5, train_loss: 0.9248, test_loss: 0.9317, test_f1: 0.5228
 epoch: 6, train_loss: 0.9133, test_loss: 0.9585, test_f1: 0.5019
 epoch: 7, train_loss: 0.8853, test_loss: 0.9025, test_f1: 0.5116
 epoch: 8, train_loss: 0.8778, test_loss: 0.9378, test_f1: 0.5421
 epoch: 9, train_loss: 0.8872, test_loss: 0.9015, test_f1: 0.5254
 epoch: 10, train_loss: 0.8608, test_loss: 0.9881, test_f1: 0.5334
 epoch: 11, train_loss: 0.8577, test_loss: 0.9405, test_f1: 0.5676
 epoch: 12, train_loss: 0.8494, test_loss: 0.9162, test_f1: 0.5402
 epoch: 13, train_loss: 0.8249, test_loss: 0.9865, test_f1: 0.5166
 epoch: 14, train_loss: 0.8243, test_loss: 0.8790, test_f1: 0.5466
 epoch: 15, train_loss: 0.8238, test_loss: 0.9053, test_f1: 0.5787
 epoch: 16, train_loss: 0.8033, test_loss: 1.0174, test_f1: 0.4950
 epoch: 17, train_loss: 0.7993, test_loss: 0.9280, test_f1: 0.6042
 epoch: 18, train_loss: 0.7891, test_loss: 0.9728, test_f1: 0.5719
 epoch: 19, train_loss: 0.7932, test_loss: 0.9960, test_f1: 0.5521
 epoch: 20, train_loss: 0.7884, test_loss: 0.9393, test_f1: 0.5675
 epoch: 21, train_loss: 0.7872, test_loss: 0.8767, test_f1: 0.5554
 epoch: 22, train_loss: 0.7679, test_loss: 0.8613, test_f1: 0.5397
 epoch: 23, train_loss: 0.7777, test_loss: 0.9233, test_f1: 0.5489
 epoch: 24, train_loss: 0.7662, test_loss: 0.9294, test_f1: 0.5283
 epoch: 25, train_loss: 0.7832, test_loss: 0.9312, test_f1: 0.5666
 epoch: 26, train_loss: 0.7525, test_loss: 0.9665, test_f1: 0.5308
 epoch: 27, train_loss: 0.7454, test_loss: 0.9408, test_f1: 0.5515
 epoch: 28, train_loss: 0.7551, test_loss: 1.0677, test_f1: 0.5358
 epoch: 29, train_loss: 0.7457, test_loss: 1.0452, test_f1: 0.5727
 epoch: 30, train_loss: 0.7362, test_loss: 0.7964, test_f1: 0.5354
 epoch: 31, train_loss: 0.7355, test_loss: 0.9596, test_f1: 0.6102
 epoch: 32, train_loss: 0.7401, test_loss: 0.9371, test_f1: 0.5651
 epoch: 33, train_loss: 0.7479, test_loss: 0.9418, test_f1: 0.5229
 epoch: 34, train_loss: 0.7497, test_loss: 0.8453, test_f1: 0.5644
 epoch: 35, train_loss: 0.7381, test_loss: 0.9172, test_f1: 0.5790
 epoch: 36, train_loss: 0.7226, test_loss: 1.1419, test_f1: 0.5999
 epoch: 37, train_loss: 0.7320, test_loss: 0.8972, test_f1: 0.5802
 epoch: 38, train_loss: 0.7126, test_loss: 1.1978, test_f1: 0.5276
 epoch: 39, train_loss: 0.7140, test_loss: 0.8666, test_f1: 0.5357
 epoch: 40, train_loss: 0.7223, test_loss: 0.8798, test_f1: 0.6103
 epoch: 41, train_loss: 0.7025, test_loss: 0.9359, test_f1: 0.5654
 epoch: 42, train_loss: 0.7047, test_loss: 0.8078, test_f1: 0.6453
 epoch: 43, train_loss: 0.7031, test_loss: 0.9402, test_f1: 0.5813
 epoch: 44, train_loss: 0.6976, test_loss: 1.0350, test_f1: 0.5833
 epoch: 45, train_loss: 0.7093, test_loss: 0.8860, test_f1: 0.6210
 epoch: 46, train_loss: 0.7046, test_loss: 1.2034, test_f1: 0.5555
 epoch: 47, train_loss: 0.6834, test_loss: 1.0916, test_f1: 0.5811
 epoch: 48, train_loss: 0.6907, test_loss: 0.9564, test_f1: 0.5933
 epoch: 49, train_loss: 0.6714, test_loss: 0.9443, test_f1: 0.5883
 epoch: 50, train_loss: 0.6736, test_loss: 0.9946, test_f1: 0.6010
 epoch: 51, train_loss: 0.6559, test_loss: 1.0457, test_f1: 0.6105
 epoch: 52, train_loss: 0.6388, test_loss: 0.9644, test_f1: 0.6381
 epoch: 53, train_loss: 0.6414, test_loss: 0.9316, test_f1: 0.6231
 epoch: 54, train_loss: 0.6380, test_loss: 0.9664, test_f1: 0.6422
 epoch: 55, train_loss: 0.6353, test_loss: 0.9433, test_f1: 0.6349
 epoch: 56, train_loss: 0.6118, test_loss: 1.0792, test_f1: 0.6212
 epoch: 57, train_loss: 0.6309, test_loss: 0.9718, test_f1: 0.6176
 epoch: 58, train_loss: 0.6157, test_loss: 1.1041, test_f1: 0.5729
 epoch: 59, train_loss: 0.6139, test_loss: 0.9552, test_f1: 0.6343
 epoch: 60, train_loss: 0.6202, test_loss: 0.9113, test_f1: 0.6580
 epoch: 61, train_loss: 0.6210, test_loss: 1.0512, test_f1: 0.5949
 epoch: 62, train_loss: 0.6175, test_loss: 0.9959, test_f1: 0.6147
 epoch: 63, train_loss: 0.6218, test_loss: 0.8927, test_f1: 0.6302
 epoch: 64, train_loss: 0.6125, test_loss: 0.9542, test_f1: 0.6189
 epoch: 65, train_loss: 0.6138, test_loss: 1.0657, test_f1: 0.6227
 epoch: 66, train_loss: 0.5986, test_loss: 0.9760, test_f1: 0.6617
 epoch: 67, train_loss: 0.5891, test_loss: 1.0351, test_f1: 0.5853
 epoch: 68, train_loss: 0.6036, test_loss: 0.9502, test_f1: 0.5895
 epoch: 69, train_loss: 0.6007, test_loss: 1.0162, test_f1: 0.5861
 epoch: 70, train_loss: 0.5954, test_loss: 1.0815, test_f1: 0.5983
 epoch: 71, train_loss: 0.5901, test_loss: 1.0552, test_f1: 0.6166
 epoch: 72, train_loss: 0.6010, test_loss: 1.0184, test_f1: 0.6008
 epoch: 73, train_loss: 0.5917, test_loss: 1.0642, test_f1: 0.6166
 epoch: 74, train_loss: 0.5940, test_loss: 0.9470, test_f1: 0.6358
 epoch: 75, train_loss: 0.5897, test_loss: 0.9217, test_f1: 0.6462
 epoch: 76, train_loss: 0.5902, test_loss: 1.0022, test_f1: 0.6295
 epoch: 77, train_loss: 0.5813, test_loss: 0.9507, test_f1: 0.6383
 epoch: 78, train_loss: 0.5873, test_loss: 1.0031, test_f1: 0.6695
 epoch: 79, train_loss: 0.5881, test_loss: 0.8488, test_f1: 0.6342
 epoch: 80, train_loss: 0.5826, test_loss: 0.8894, test_f1: 0.6302
 epoch: 81, train_loss: 0.5720, test_loss: 1.2483, test_f1: 0.5866
 epoch: 82, train_loss: 0.5612, test_loss: 1.1881, test_f1: 0.6077
 epoch: 83, train_loss: 0.5815, test_loss: 0.9852, test_f1: 0.6414
 epoch: 84, train_loss: 0.5767, test_loss: 0.9599, test_f1: 0.6203
 epoch: 85, train_loss: 0.5777, test_loss: 0.9893, test_f1: 0.6164
 epoch: 86, train_loss: 0.5581, test_loss: 0.9517, test_f1: 0.6581
 epoch: 87, train_loss: 0.5680, test_loss: 1.0978, test_f1: 0.6169
 epoch: 88, train_loss: 0.5725, test_loss: 0.9231, test_f1: 0.6443
 epoch: 89, train_loss: 0.5678, test_loss: 0.9533, test_f1: 0.6149
 epoch: 90, train_loss: 0.5654, test_loss: 1.1611, test_f1: 0.5982
 epoch: 91, train_loss: 0.5595, test_loss: 1.2943, test_f1: 0.5939
 epoch: 92, train_loss: 0.5782, test_loss: 1.0313, test_f1: 0.6339
 epoch: 93, train_loss: 0.5629, test_loss: 1.1146, test_f1: 0.6521
 epoch: 94, train_loss: 0.5601, test_loss: 1.0215, test_f1: 0.6297
 epoch: 95, train_loss: 0.5434, test_loss: 0.9540, test_f1: 0.6309
 epoch: 96, train_loss: 0.5512, test_loss: 1.0326, test_f1: 0.6341
 epoch: 97, train_loss: 0.5396, test_loss: 1.0019, test_f1: 0.6458
 epoch: 98, train_loss: 0.5451, test_loss: 1.1281, test_f1: 0.6411
 epoch: 99, train_loss: 0.5684, test_loss: 1.0475, test_f1: 0.6096
##################ITERATION #4 ****************************************
 epoch: 0, train_loss: 1.1589, test_loss: 1.0750, test_f1: 0.4467
 epoch: 1, train_loss: 1.0290, test_loss: 1.0600, test_f1: 0.4789
 epoch: 2, train_loss: 1.0113, test_loss: 1.0372, test_f1: 0.4454
 epoch: 3, train_loss: 1.0050, test_loss: 1.0792, test_f1: 0.4588
 epoch: 4, train_loss: 0.9733, test_loss: 0.9653, test_f1: 0.5194
 epoch: 5, train_loss: 0.9447, test_loss: 0.9773, test_f1: 0.5628
 epoch: 6, train_loss: 0.9400, test_loss: 0.9593, test_f1: 0.4883
 epoch: 7, train_loss: 0.9338, test_loss: 0.9549, test_f1: 0.5536
 epoch: 8, train_loss: 0.9295, test_loss: 1.1294, test_f1: 0.5099
 epoch: 9, train_loss: 0.9075, test_loss: 0.9340, test_f1: 0.4848
 epoch: 10, train_loss: 0.9212, test_loss: 0.8699, test_f1: 0.5513
 epoch: 11, train_loss: 0.9102, test_loss: 0.9500, test_f1: 0.5494
 epoch: 12, train_loss: 0.9002, test_loss: 0.9457, test_f1: 0.5682
 epoch: 13, train_loss: 0.8826, test_loss: 0.9466, test_f1: 0.5113
 epoch: 14, train_loss: 0.8923, test_loss: 0.9574, test_f1: 0.5323
 epoch: 15, train_loss: 0.8731, test_loss: 1.0337, test_f1: 0.5258
 epoch: 16, train_loss: 0.8463, test_loss: 0.9308, test_f1: 0.5086
 epoch: 17, train_loss: 0.8626, test_loss: 0.9050, test_f1: 0.5484
 epoch: 18, train_loss: 0.8647, test_loss: 0.8682, test_f1: 0.5441
 epoch: 19, train_loss: 0.8462, test_loss: 0.8786, test_f1: 0.5637
 epoch: 20, train_loss: 0.8409, test_loss: 1.0033, test_f1: 0.4877
 epoch: 21, train_loss: 0.8420, test_loss: 0.9399, test_f1: 0.5818
 epoch: 22, train_loss: 0.8330, test_loss: 0.8678, test_f1: 0.5583
 epoch: 23, train_loss: 0.8224, test_loss: 0.9352, test_f1: 0.5423
 epoch: 24, train_loss: 0.8441, test_loss: 0.9037, test_f1: 0.5375
 epoch: 25, train_loss: 0.8115, test_loss: 0.9300, test_f1: 0.5601
 epoch: 26, train_loss: 0.8074, test_loss: 0.9065, test_f1: 0.5985
 epoch: 27, train_loss: 0.8123, test_loss: 1.0013, test_f1: 0.5873
 epoch: 28, train_loss: 0.7941, test_loss: 0.9570, test_f1: 0.5587
 epoch: 29, train_loss: 0.8051, test_loss: 0.8604, test_f1: 0.5632
 epoch: 30, train_loss: 0.7991, test_loss: 0.9179, test_f1: 0.5914
 epoch: 31, train_loss: 0.7965, test_loss: 0.9804, test_f1: 0.5324
 epoch: 32, train_loss: 0.7888, test_loss: 0.8830, test_f1: 0.5530
 epoch: 33, train_loss: 0.7981, test_loss: 1.1243, test_f1: 0.5634
 epoch: 34, train_loss: 0.7820, test_loss: 0.9279, test_f1: 0.5441
 epoch: 35, train_loss: 0.7927, test_loss: 0.9355, test_f1: 0.6069
 epoch: 36, train_loss: 0.7782, test_loss: 1.0634, test_f1: 0.5664
 epoch: 37, train_loss: 0.7834, test_loss: 0.9841, test_f1: 0.5780
 epoch: 38, train_loss: 0.7803, test_loss: 1.1609, test_f1: 0.5167
 epoch: 39, train_loss: 0.7439, test_loss: 0.9041, test_f1: 0.5919
 epoch: 40, train_loss: 0.7431, test_loss: 0.9420, test_f1: 0.5866
 epoch: 41, train_loss: 0.7396, test_loss: 0.9082, test_f1: 0.5897
 epoch: 42, train_loss: 0.7602, test_loss: 0.9193, test_f1: 0.5944
 epoch: 43, train_loss: 0.7799, test_loss: 0.9870, test_f1: 0.5293
 epoch: 44, train_loss: 0.7544, test_loss: 1.0005, test_f1: 0.5626
 epoch: 45, train_loss: 0.7419, test_loss: 0.9880, test_f1: 0.5879
 epoch: 46, train_loss: 0.7387, test_loss: 1.1288, test_f1: 0.5386
 epoch: 47, train_loss: 0.7366, test_loss: 0.9488, test_f1: 0.6082
 epoch: 48, train_loss: 0.7531, test_loss: 0.8866, test_f1: 0.6205
 epoch: 49, train_loss: 0.7250, test_loss: 0.9306, test_f1: 0.5969
 epoch: 50, train_loss: 0.7128, test_loss: 0.9574, test_f1: 0.6013
 epoch: 51, train_loss: 0.7391, test_loss: 0.8843, test_f1: 0.6190
 epoch: 52, train_loss: 0.7170, test_loss: 0.9418, test_f1: 0.6056
 epoch: 53, train_loss: 0.6903, test_loss: 0.8896, test_f1: 0.6110
 epoch: 54, train_loss: 0.6603, test_loss: 0.9423, test_f1: 0.6324
 epoch: 55, train_loss: 0.6760, test_loss: 0.8983, test_f1: 0.6385
 epoch: 56, train_loss: 0.6766, test_loss: 0.8506, test_f1: 0.6317
 epoch: 57, train_loss: 0.6822, test_loss: 0.9149, test_f1: 0.6128
 epoch: 58, train_loss: 0.6717, test_loss: 0.9767, test_f1: 0.5960
 epoch: 59, train_loss: 0.6691, test_loss: 0.9549, test_f1: 0.6156
 epoch: 60, train_loss: 0.6558, test_loss: 0.9610, test_f1: 0.6177
 epoch: 61, train_loss: 0.6559, test_loss: 1.0004, test_f1: 0.5919
 epoch: 62, train_loss: 0.6506, test_loss: 1.0901, test_f1: 0.5823
 epoch: 63, train_loss: 0.6623, test_loss: 0.9748, test_f1: 0.6063
 epoch: 64, train_loss: 0.6725, test_loss: 0.9651, test_f1: 0.6207
 epoch: 65, train_loss: 0.6519, test_loss: 0.9813, test_f1: 0.6240
 epoch: 66, train_loss: 0.6376, test_loss: 0.9439, test_f1: 0.6275
 epoch: 67, train_loss: 0.6362, test_loss: 1.0123, test_f1: 0.5936
 epoch: 68, train_loss: 0.6380, test_loss: 1.0202, test_f1: 0.6168
 epoch: 69, train_loss: 0.6442, test_loss: 1.0181, test_f1: 0.6132
 epoch: 70, train_loss: 0.6234, test_loss: 0.9746, test_f1: 0.6404
 epoch: 71, train_loss: 0.6249, test_loss: 0.9974, test_f1: 0.6211
 epoch: 72, train_loss: 0.6436, test_loss: 0.9566, test_f1: 0.6184
 epoch: 73, train_loss: 0.6286, test_loss: 1.0825, test_f1: 0.6208
 epoch: 74, train_loss: 0.6283, test_loss: 0.9922, test_f1: 0.6196
 epoch: 75, train_loss: 0.6251, test_loss: 1.0326, test_f1: 0.5993
 epoch: 76, train_loss: 0.6406, test_loss: 0.9624, test_f1: 0.6196
 epoch: 77, train_loss: 0.6327, test_loss: 0.9927, test_f1: 0.6207
 epoch: 78, train_loss: 0.6229, test_loss: 0.9788, test_f1: 0.6311
 epoch: 79, train_loss: 0.6241, test_loss: 1.0171, test_f1: 0.6238
 epoch: 80, train_loss: 0.5965, test_loss: 1.0668, test_f1: 0.6009
 epoch: 81, train_loss: 0.6121, test_loss: 1.0238, test_f1: 0.6268
 epoch: 82, train_loss: 0.6149, test_loss: 1.0259, test_f1: 0.6130
 epoch: 83, train_loss: 0.6144, test_loss: 1.0254, test_f1: 0.6216
 epoch: 84, train_loss: 0.6091, test_loss: 1.0223, test_f1: 0.6235
 epoch: 85, train_loss: 0.6070, test_loss: 1.0814, test_f1: 0.6134
 epoch: 86, train_loss: 0.5923, test_loss: 1.0097, test_f1: 0.6168
 epoch: 87, train_loss: 0.6190, test_loss: 1.1224, test_f1: 0.6201
 epoch: 88, train_loss: 0.6091, test_loss: 1.0477, test_f1: 0.6105
 epoch: 89, train_loss: 0.6016, test_loss: 1.0534, test_f1: 0.6193
 epoch: 90, train_loss: 0.5972, test_loss: 1.0703, test_f1: 0.6075
 epoch: 91, train_loss: 0.5937, test_loss: 1.0687, test_f1: 0.5968
 epoch: 92, train_loss: 0.6063, test_loss: 1.0449, test_f1: 0.6284
 epoch: 93, train_loss: 0.5970, test_loss: 1.0226, test_f1: 0.6231
 epoch: 94, train_loss: 0.5925, test_loss: 1.2081, test_f1: 0.5897
 epoch: 95, train_loss: 0.5884, test_loss: 1.0796, test_f1: 0.6437
 epoch: 96, train_loss: 0.5784, test_loss: 1.0784, test_f1: 0.6270
 epoch: 97, train_loss: 0.5769, test_loss: 1.0569, test_f1: 0.6513
 epoch: 98, train_loss: 0.5912, test_loss: 1.1262, test_f1: 0.6206
 epoch: 99, train_loss: 0.5757, test_loss: 1.1241, test_f1: 0.6152
##################ITERATION #5 ****************************************
 epoch: 0, train_loss: 1.1484, test_loss: 1.5354, test_f1: 0.2842
 epoch: 1, train_loss: 1.0442, test_loss: 1.0879, test_f1: 0.4443
 epoch: 2, train_loss: 0.9913, test_loss: 1.1575, test_f1: 0.3935
 epoch: 3, train_loss: 1.0020, test_loss: 1.0012, test_f1: 0.4568
 epoch: 4, train_loss: 0.9821, test_loss: 1.2548, test_f1: 0.4179
 epoch: 5, train_loss: 0.9741, test_loss: 0.9748, test_f1: 0.5091
 epoch: 6, train_loss: 0.9704, test_loss: 1.1369, test_f1: 0.4658
 epoch: 7, train_loss: 0.9454, test_loss: 1.0723, test_f1: 0.4701
 epoch: 8, train_loss: 0.9321, test_loss: 0.9523, test_f1: 0.5465
 epoch: 9, train_loss: 0.9499, test_loss: 0.9660, test_f1: 0.5380
 epoch: 10, train_loss: 0.9183, test_loss: 0.9845, test_f1: 0.4788
 epoch: 11, train_loss: 0.9055, test_loss: 1.0158, test_f1: 0.4830
 epoch: 12, train_loss: 0.9015, test_loss: 1.0301, test_f1: 0.5096
 epoch: 13, train_loss: 0.8881, test_loss: 0.9312, test_f1: 0.5143
 epoch: 14, train_loss: 0.8811, test_loss: 0.9535, test_f1: 0.5189
 epoch: 15, train_loss: 0.8717, test_loss: 0.9237, test_f1: 0.5294
 epoch: 16, train_loss: 0.8595, test_loss: 1.0152, test_f1: 0.4759
 epoch: 17, train_loss: 0.8602, test_loss: 1.0792, test_f1: 0.5258
 epoch: 18, train_loss: 0.8575, test_loss: 0.9843, test_f1: 0.5472
 epoch: 19, train_loss: 0.8361, test_loss: 0.9255, test_f1: 0.5747
 epoch: 20, train_loss: 0.8480, test_loss: 0.9762, test_f1: 0.5526
 epoch: 21, train_loss: 0.8371, test_loss: 0.9250, test_f1: 0.5777
 epoch: 22, train_loss: 0.8205, test_loss: 0.9108, test_f1: 0.5414
 epoch: 23, train_loss: 0.8293, test_loss: 0.8647, test_f1: 0.5213
 epoch: 24, train_loss: 0.8159, test_loss: 0.9083, test_f1: 0.5710
 epoch: 25, train_loss: 0.8173, test_loss: 0.9371, test_f1: 0.5566
 epoch: 26, train_loss: 0.7989, test_loss: 0.9527, test_f1: 0.5961
 epoch: 27, train_loss: 0.7948, test_loss: 0.9162, test_f1: 0.5461
 epoch: 28, train_loss: 0.8046, test_loss: 1.0082, test_f1: 0.4922
 epoch: 29, train_loss: 0.7894, test_loss: 0.9283, test_f1: 0.5333
 epoch: 30, train_loss: 0.7755, test_loss: 0.9302, test_f1: 0.5737
 epoch: 31, train_loss: 0.7796, test_loss: 1.0228, test_f1: 0.5270
 epoch: 32, train_loss: 0.7866, test_loss: 0.9105, test_f1: 0.5810
 epoch: 33, train_loss: 0.7784, test_loss: 1.0220, test_f1: 0.5554
 epoch: 34, train_loss: 0.7696, test_loss: 0.9362, test_f1: 0.5450
 epoch: 35, train_loss: 0.7577, test_loss: 0.9117, test_f1: 0.5548
 epoch: 36, train_loss: 0.7524, test_loss: 1.0509, test_f1: 0.5685
 epoch: 37, train_loss: 0.7692, test_loss: 0.8677, test_f1: 0.6015
 epoch: 38, train_loss: 0.7596, test_loss: 0.9088, test_f1: 0.5833
 epoch: 39, train_loss: 0.7534, test_loss: 1.0229, test_f1: 0.5374
 epoch: 40, train_loss: 0.7565, test_loss: 1.0254, test_f1: 0.5331
 epoch: 41, train_loss: 0.7261, test_loss: 0.8999, test_f1: 0.5671
 epoch: 42, train_loss: 0.7342, test_loss: 0.9050, test_f1: 0.5605
 epoch: 43, train_loss: 0.7312, test_loss: 0.8499, test_f1: 0.5861
 epoch: 44, train_loss: 0.7647, test_loss: 1.1338, test_f1: 0.5511
 epoch: 45, train_loss: 0.7434, test_loss: 0.9641, test_f1: 0.6011
 epoch: 46, train_loss: 0.7271, test_loss: 0.9052, test_f1: 0.6248
 epoch: 47, train_loss: 0.7195, test_loss: 0.9389, test_f1: 0.5607
 epoch: 48, train_loss: 0.7055, test_loss: 0.9071, test_f1: 0.5652
 epoch: 49, train_loss: 0.7141, test_loss: 1.1638, test_f1: 0.5388
 epoch: 50, train_loss: 0.7129, test_loss: 0.9819, test_f1: 0.5638
 epoch: 51, train_loss: 0.6899, test_loss: 0.9454, test_f1: 0.5865
 epoch: 52, train_loss: 0.6710, test_loss: 0.8421, test_f1: 0.6110
 epoch: 53, train_loss: 0.6621, test_loss: 0.9171, test_f1: 0.6154
 epoch: 54, train_loss: 0.6603, test_loss: 0.9379, test_f1: 0.5632
 epoch: 55, train_loss: 0.6593, test_loss: 0.8782, test_f1: 0.6207
 epoch: 56, train_loss: 0.6404, test_loss: 0.9068, test_f1: 0.6041
 epoch: 57, train_loss: 0.6378, test_loss: 0.9630, test_f1: 0.5918
 epoch: 58, train_loss: 0.6345, test_loss: 1.1238, test_f1: 0.5950
 epoch: 59, train_loss: 0.6380, test_loss: 0.9501, test_f1: 0.5940
 epoch: 60, train_loss: 0.6377, test_loss: 0.9502, test_f1: 0.6444
 epoch: 61, train_loss: 0.6323, test_loss: 0.9814, test_f1: 0.6094
 epoch: 62, train_loss: 0.6217, test_loss: 0.9289, test_f1: 0.6117
 epoch: 63, train_loss: 0.6264, test_loss: 0.9741, test_f1: 0.6266
 epoch: 64, train_loss: 0.6295, test_loss: 0.9308, test_f1: 0.6114
 epoch: 65, train_loss: 0.6348, test_loss: 0.9184, test_f1: 0.6165
 epoch: 66, train_loss: 0.6267, test_loss: 1.0189, test_f1: 0.6173
 epoch: 67, train_loss: 0.6391, test_loss: 0.8969, test_f1: 0.6419
 epoch: 68, train_loss: 0.6368, test_loss: 0.9335, test_f1: 0.6393
 epoch: 69, train_loss: 0.6109, test_loss: 0.9218, test_f1: 0.6341
 epoch: 70, train_loss: 0.6093, test_loss: 0.9476, test_f1: 0.6092
 epoch: 71, train_loss: 0.5999, test_loss: 0.9643, test_f1: 0.6235
 epoch: 72, train_loss: 0.6092, test_loss: 0.8958, test_f1: 0.6508
 epoch: 73, train_loss: 0.6244, test_loss: 0.9222, test_f1: 0.6322
 epoch: 74, train_loss: 0.6217, test_loss: 0.9005, test_f1: 0.6257
 epoch: 75, train_loss: 0.6081, test_loss: 0.9766, test_f1: 0.6055
 epoch: 76, train_loss: 0.5950, test_loss: 0.9648, test_f1: 0.6177
 epoch: 77, train_loss: 0.6199, test_loss: 0.9161, test_f1: 0.6509
 epoch: 78, train_loss: 0.6112, test_loss: 0.9038, test_f1: 0.6300
 epoch: 79, train_loss: 0.6166, test_loss: 1.0458, test_f1: 0.6212
 epoch: 80, train_loss: 0.5881, test_loss: 0.9441, test_f1: 0.6320
 epoch: 81, train_loss: 0.5970, test_loss: 0.9627, test_f1: 0.6208
 epoch: 82, train_loss: 0.5881, test_loss: 0.9955, test_f1: 0.6300
 epoch: 83, train_loss: 0.5957, test_loss: 0.9057, test_f1: 0.6334
 epoch: 84, train_loss: 0.5840, test_loss: 1.1129, test_f1: 0.5726
 epoch: 85, train_loss: 0.5731, test_loss: 0.9484, test_f1: 0.6354
 epoch: 86, train_loss: 0.5721, test_loss: 0.9258, test_f1: 0.6467
 epoch: 87, train_loss: 0.5921, test_loss: 0.9640, test_f1: 0.5988
 epoch: 88, train_loss: 0.5736, test_loss: 0.9907, test_f1: 0.6455
 epoch: 89, train_loss: 0.5842, test_loss: 1.0406, test_f1: 0.5720
 epoch: 90, train_loss: 0.5939, test_loss: 0.9771, test_f1: 0.6250
 epoch: 91, train_loss: 0.5761, test_loss: 1.1651, test_f1: 0.5930
 epoch: 92, train_loss: 0.5685, test_loss: 0.9857, test_f1: 0.6252
 epoch: 93, train_loss: 0.5832, test_loss: 0.8877, test_f1: 0.6401
 epoch: 94, train_loss: 0.5798, test_loss: 0.9234, test_f1: 0.6073
 epoch: 95, train_loss: 0.5685, test_loss: 1.0176, test_f1: 0.6150
 epoch: 96, train_loss: 0.5749, test_loss: 0.9943, test_f1: 0.6221
 epoch: 97, train_loss: 0.5880, test_loss: 0.9511, test_f1: 0.6332
 epoch: 98, train_loss: 0.5595, test_loss: 1.0003, test_f1: 0.6332
 epoch: 99, train_loss: 0.5554, test_loss: 0.9743, test_f1: 0.6406
##################ITERATION #6 ****************************************
 epoch: 0, train_loss: 1.1843, test_loss: 1.0851, test_f1: 0.4524
 epoch: 1, train_loss: 1.0440, test_loss: 1.1514, test_f1: 0.4194
 epoch: 2, train_loss: 1.0037, test_loss: 1.0205, test_f1: 0.4957
 epoch: 3, train_loss: 0.9776, test_loss: 0.9481, test_f1: 0.4936
 epoch: 4, train_loss: 0.9624, test_loss: 1.0733, test_f1: 0.4954
 epoch: 5, train_loss: 0.9535, test_loss: 1.0568, test_f1: 0.4215
 epoch: 6, train_loss: 0.9399, test_loss: 0.9623, test_f1: 0.4916
 epoch: 7, train_loss: 0.9246, test_loss: 1.0207, test_f1: 0.5125
 epoch: 8, train_loss: 0.9216, test_loss: 0.9996, test_f1: 0.4870
 epoch: 9, train_loss: 0.9292, test_loss: 1.2630, test_f1: 0.4001
 epoch: 10, train_loss: 0.9204, test_loss: 0.9153, test_f1: 0.5136
 epoch: 11, train_loss: 0.9082, test_loss: 0.9239, test_f1: 0.5019
 epoch: 12, train_loss: 0.8959, test_loss: 1.0518, test_f1: 0.4695
 epoch: 13, train_loss: 0.8769, test_loss: 0.8447, test_f1: 0.5703
 epoch: 14, train_loss: 0.8600, test_loss: 0.9159, test_f1: 0.5429
 epoch: 15, train_loss: 0.8551, test_loss: 0.8439, test_f1: 0.5844
 epoch: 16, train_loss: 0.8398, test_loss: 0.9953, test_f1: 0.5220
 epoch: 17, train_loss: 0.8334, test_loss: 0.9110, test_f1: 0.5267
 epoch: 18, train_loss: 0.8311, test_loss: 1.1787, test_f1: 0.4441
 epoch: 19, train_loss: 0.8673, test_loss: 0.9041, test_f1: 0.5308
 epoch: 20, train_loss: 0.8255, test_loss: 1.0056, test_f1: 0.5775
 epoch: 21, train_loss: 0.8186, test_loss: 0.8792, test_f1: 0.5118
 epoch: 22, train_loss: 0.8354, test_loss: 1.1394, test_f1: 0.4704
 epoch: 23, train_loss: 0.8119, test_loss: 0.9221, test_f1: 0.5539
 epoch: 24, train_loss: 0.7977, test_loss: 0.8592, test_f1: 0.5541
 epoch: 25, train_loss: 0.8200, test_loss: 0.9328, test_f1: 0.4735
 epoch: 26, train_loss: 0.7849, test_loss: 0.8182, test_f1: 0.5541
 epoch: 27, train_loss: 0.7887, test_loss: 0.8984, test_f1: 0.5473
 epoch: 28, train_loss: 0.7843, test_loss: 0.7794, test_f1: 0.5542
 epoch: 29, train_loss: 0.7787, test_loss: 0.8545, test_f1: 0.5518
 epoch: 30, train_loss: 0.7652, test_loss: 0.7850, test_f1: 0.5600
 epoch: 31, train_loss: 0.7699, test_loss: 0.8128, test_f1: 0.5796
 epoch: 32, train_loss: 0.7852, test_loss: 0.7967, test_f1: 0.5773
 epoch: 33, train_loss: 0.7715, test_loss: 0.8716, test_f1: 0.5246
 epoch: 34, train_loss: 0.7618, test_loss: 0.7886, test_f1: 0.5660
 epoch: 35, train_loss: 0.7523, test_loss: 1.2894, test_f1: 0.4348
 epoch: 36, train_loss: 0.7607, test_loss: 0.9725, test_f1: 0.5706
 epoch: 37, train_loss: 0.7660, test_loss: 0.8227, test_f1: 0.6114
 epoch: 38, train_loss: 0.7646, test_loss: 0.8396, test_f1: 0.5946
 epoch: 39, train_loss: 0.7427, test_loss: 0.8397, test_f1: 0.5594
 epoch: 40, train_loss: 0.7304, test_loss: 0.8145, test_f1: 0.6082
 epoch: 41, train_loss: 0.7362, test_loss: 0.9078, test_f1: 0.5547
 epoch: 42, train_loss: 0.7306, test_loss: 0.8431, test_f1: 0.6117
 epoch: 43, train_loss: 0.7229, test_loss: 0.8216, test_f1: 0.6328
 epoch: 44, train_loss: 0.7553, test_loss: 0.8827, test_f1: 0.6176
 epoch: 45, train_loss: 0.7284, test_loss: 0.8834, test_f1: 0.6016
 epoch: 46, train_loss: 0.7335, test_loss: 0.8579, test_f1: 0.6292
 epoch: 47, train_loss: 0.7121, test_loss: 0.8133, test_f1: 0.6189
 epoch: 48, train_loss: 0.7019, test_loss: 0.9185, test_f1: 0.6132
 epoch: 49, train_loss: 0.7265, test_loss: 0.8782, test_f1: 0.5678
 epoch: 50, train_loss: 0.7207, test_loss: 0.8210, test_f1: 0.6151
 epoch: 51, train_loss: 0.6937, test_loss: 0.8055, test_f1: 0.6173
 epoch: 52, train_loss: 0.6638, test_loss: 0.8700, test_f1: 0.6237
 epoch: 53, train_loss: 0.6694, test_loss: 0.8322, test_f1: 0.6258
 epoch: 54, train_loss: 0.6541, test_loss: 0.8549, test_f1: 0.6250
 epoch: 55, train_loss: 0.6504, test_loss: 0.7634, test_f1: 0.6503
 epoch: 56, train_loss: 0.6604, test_loss: 0.8963, test_f1: 0.5937
 epoch: 57, train_loss: 0.6656, test_loss: 0.8480, test_f1: 0.6424
 epoch: 58, train_loss: 0.6411, test_loss: 0.9026, test_f1: 0.6369
 epoch: 59, train_loss: 0.6556, test_loss: 0.8571, test_f1: 0.6341
 epoch: 60, train_loss: 0.6383, test_loss: 0.8129, test_f1: 0.6450
 epoch: 61, train_loss: 0.6335, test_loss: 0.8689, test_f1: 0.6216
 epoch: 62, train_loss: 0.6381, test_loss: 0.8813, test_f1: 0.6109
 epoch: 63, train_loss: 0.6483, test_loss: 0.8163, test_f1: 0.6550
 epoch: 64, train_loss: 0.6287, test_loss: 0.8855, test_f1: 0.6218
 epoch: 65, train_loss: 0.6358, test_loss: 0.8561, test_f1: 0.6359
 epoch: 66, train_loss: 0.6222, test_loss: 0.8010, test_f1: 0.6788
 epoch: 67, train_loss: 0.6264, test_loss: 0.7946, test_f1: 0.6836
 epoch: 68, train_loss: 0.6049, test_loss: 0.8110, test_f1: 0.6538
 epoch: 69, train_loss: 0.6211, test_loss: 0.8442, test_f1: 0.6657
 epoch: 70, train_loss: 0.6151, test_loss: 0.8516, test_f1: 0.6385
 epoch: 71, train_loss: 0.6266, test_loss: 0.8032, test_f1: 0.6662
 epoch: 72, train_loss: 0.6219, test_loss: 0.8172, test_f1: 0.6388
 epoch: 73, train_loss: 0.6109, test_loss: 0.8590, test_f1: 0.6437
 epoch: 74, train_loss: 0.5983, test_loss: 0.8724, test_f1: 0.5928
 epoch: 75, train_loss: 0.6167, test_loss: 0.8190, test_f1: 0.6448
 epoch: 76, train_loss: 0.6037, test_loss: 0.8725, test_f1: 0.6357
 epoch: 77, train_loss: 0.6015, test_loss: 0.8252, test_f1: 0.6535
 epoch: 78, train_loss: 0.6058, test_loss: 0.8232, test_f1: 0.6579
 epoch: 79, train_loss: 0.6080, test_loss: 0.9160, test_f1: 0.6386
 epoch: 80, train_loss: 0.6016, test_loss: 0.8972, test_f1: 0.6542
 epoch: 81, train_loss: 0.6025, test_loss: 0.9519, test_f1: 0.5993
 epoch: 82, train_loss: 0.5985, test_loss: 0.9365, test_f1: 0.6123
 epoch: 83, train_loss: 0.5883, test_loss: 0.8743, test_f1: 0.6610
 epoch: 84, train_loss: 0.5901, test_loss: 0.9153, test_f1: 0.6477
 epoch: 85, train_loss: 0.6042, test_loss: 0.8889, test_f1: 0.6346
 epoch: 86, train_loss: 0.5850, test_loss: 0.8980, test_f1: 0.6488
 epoch: 87, train_loss: 0.5988, test_loss: 0.9473, test_f1: 0.6340
 epoch: 88, train_loss: 0.5828, test_loss: 0.9158, test_f1: 0.6519
 epoch: 89, train_loss: 0.5909, test_loss: 0.8975, test_f1: 0.6092
 epoch: 90, train_loss: 0.5942, test_loss: 0.8412, test_f1: 0.6720
 epoch: 91, train_loss: 0.5735, test_loss: 0.8785, test_f1: 0.6547
 epoch: 92, train_loss: 0.5672, test_loss: 0.9260, test_f1: 0.6337
 epoch: 93, train_loss: 0.5671, test_loss: 0.8877, test_f1: 0.6622
 epoch: 94, train_loss: 0.5887, test_loss: 0.9677, test_f1: 0.6200
 epoch: 95, train_loss: 0.5540, test_loss: 0.8923, test_f1: 0.5956
 epoch: 96, train_loss: 0.5744, test_loss: 0.9690, test_f1: 0.6338
 epoch: 97, train_loss: 0.5772, test_loss: 0.9470, test_f1: 0.6107
 epoch: 98, train_loss: 0.5619, test_loss: 0.8721, test_f1: 0.6830
 epoch: 99, train_loss: 0.5544, test_loss: 0.9626, test_f1: 0.6271
##################ITERATION #7 ****************************************
 epoch: 0, train_loss: 1.1842, test_loss: 1.2388, test_f1: 0.4286
 epoch: 1, train_loss: 1.0255, test_loss: 1.1005, test_f1: 0.4454
 epoch: 2, train_loss: 1.0105, test_loss: 1.0448, test_f1: 0.4174
 epoch: 3, train_loss: 0.9735, test_loss: 0.9950, test_f1: 0.4665
 epoch: 4, train_loss: 0.9673, test_loss: 0.9763, test_f1: 0.4979
 epoch: 5, train_loss: 0.9492, test_loss: 1.0370, test_f1: 0.4975
 epoch: 6, train_loss: 0.9462, test_loss: 0.9988, test_f1: 0.5177
 epoch: 7, train_loss: 0.9517, test_loss: 0.9950, test_f1: 0.4948
 epoch: 8, train_loss: 0.9253, test_loss: 0.9738, test_f1: 0.4931
 epoch: 9, train_loss: 0.9000, test_loss: 0.9809, test_f1: 0.4900
 epoch: 10, train_loss: 0.9346, test_loss: 1.0092, test_f1: 0.4786
 epoch: 11, train_loss: 0.9079, test_loss: 1.0478, test_f1: 0.5035
 epoch: 12, train_loss: 0.9091, test_loss: 1.0088, test_f1: 0.5072
 epoch: 13, train_loss: 0.9034, test_loss: 1.0020, test_f1: 0.4917
 epoch: 14, train_loss: 0.8836, test_loss: 0.9605, test_f1: 0.5456
 epoch: 15, train_loss: 0.8708, test_loss: 1.0367, test_f1: 0.4600
 epoch: 16, train_loss: 0.8748, test_loss: 2.1906, test_f1: 0.3480
 epoch: 17, train_loss: 0.8706, test_loss: 1.0026, test_f1: 0.4444
 epoch: 18, train_loss: 0.8554, test_loss: 0.9530, test_f1: 0.5518
 epoch: 19, train_loss: 0.8666, test_loss: 0.9236, test_f1: 0.5568
 epoch: 20, train_loss: 0.8541, test_loss: 0.9383, test_f1: 0.5000
 epoch: 21, train_loss: 0.8433, test_loss: 0.9653, test_f1: 0.5422
 epoch: 22, train_loss: 0.8557, test_loss: 1.0218, test_f1: 0.5165
 epoch: 23, train_loss: 0.8610, test_loss: 0.9830, test_f1: 0.5187
 epoch: 24, train_loss: 0.8491, test_loss: 0.8963, test_f1: 0.5921
 epoch: 25, train_loss: 0.8297, test_loss: 1.0509, test_f1: 0.5122
 epoch: 26, train_loss: 0.8524, test_loss: 0.9687, test_f1: 0.5073
 epoch: 27, train_loss: 0.8302, test_loss: 0.9776, test_f1: 0.5429
 epoch: 28, train_loss: 0.8265, test_loss: 1.0041, test_f1: 0.5209
 epoch: 29, train_loss: 0.8053, test_loss: 0.8891, test_f1: 0.5566
 epoch: 30, train_loss: 0.8200, test_loss: 0.8884, test_f1: 0.5382
 epoch: 31, train_loss: 0.8092, test_loss: 0.9433, test_f1: 0.5323
 epoch: 32, train_loss: 0.8167, test_loss: 0.9368, test_f1: 0.5756
 epoch: 33, train_loss: 0.7944, test_loss: 0.9474, test_f1: 0.5619
 epoch: 34, train_loss: 0.7838, test_loss: 1.0502, test_f1: 0.5404
 epoch: 35, train_loss: 0.7808, test_loss: 0.9775, test_f1: 0.5473
 epoch: 36, train_loss: 0.7937, test_loss: 0.9879, test_f1: 0.5431
 epoch: 37, train_loss: 0.7826, test_loss: 1.0317, test_f1: 0.5672
 epoch: 38, train_loss: 0.7830, test_loss: 1.1044, test_f1: 0.5289
 epoch: 39, train_loss: 0.7802, test_loss: 0.9573, test_f1: 0.5409
 epoch: 40, train_loss: 0.7683, test_loss: 0.9933, test_f1: 0.5652
 epoch: 41, train_loss: 0.7853, test_loss: 1.0755, test_f1: 0.5797
 epoch: 42, train_loss: 0.7949, test_loss: 0.9629, test_f1: 0.5324
 epoch: 43, train_loss: 0.7561, test_loss: 0.9780, test_f1: 0.5515
 epoch: 44, train_loss: 0.7493, test_loss: 0.9614, test_f1: 0.5446
 epoch: 45, train_loss: 0.7460, test_loss: 1.0623, test_f1: 0.5429
 epoch: 46, train_loss: 0.7449, test_loss: 1.0594, test_f1: 0.5432
 epoch: 47, train_loss: 0.7569, test_loss: 1.0353, test_f1: 0.5346
 epoch: 48, train_loss: 0.7438, test_loss: 0.9457, test_f1: 0.5701
 epoch: 49, train_loss: 0.7612, test_loss: 1.0566, test_f1: 0.4995
 epoch: 50, train_loss: 0.7516, test_loss: 0.9142, test_f1: 0.5479
 epoch: 51, train_loss: 0.7027, test_loss: 0.9418, test_f1: 0.5545
 epoch: 52, train_loss: 0.7167, test_loss: 1.0437, test_f1: 0.6024
 epoch: 53, train_loss: 0.6887, test_loss: 0.9694, test_f1: 0.5958
 epoch: 54, train_loss: 0.6845, test_loss: 0.9814, test_f1: 0.5601
 epoch: 55, train_loss: 0.6884, test_loss: 1.0310, test_f1: 0.5639
 epoch: 56, train_loss: 0.6816, test_loss: 0.9538, test_f1: 0.5602
 epoch: 57, train_loss: 0.7010, test_loss: 0.9785, test_f1: 0.5428
 epoch: 58, train_loss: 0.6879, test_loss: 0.9561, test_f1: 0.5611
 epoch: 59, train_loss: 0.6818, test_loss: 1.0230, test_f1: 0.6150
 epoch: 60, train_loss: 0.6882, test_loss: 0.9944, test_f1: 0.5991
 epoch: 61, train_loss: 0.6670, test_loss: 1.0129, test_f1: 0.5971
 epoch: 62, train_loss: 0.6793, test_loss: 0.9352, test_f1: 0.6123
 epoch: 63, train_loss: 0.6728, test_loss: 0.9539, test_f1: 0.6087
 epoch: 64, train_loss: 0.6652, test_loss: 0.9627, test_f1: 0.6127
 epoch: 65, train_loss: 0.6608, test_loss: 0.9535, test_f1: 0.5931
 epoch: 66, train_loss: 0.6540, test_loss: 0.9679, test_f1: 0.6017
 epoch: 67, train_loss: 0.6627, test_loss: 1.0431, test_f1: 0.5854
 epoch: 68, train_loss: 0.6628, test_loss: 0.9733, test_f1: 0.6175
 epoch: 69, train_loss: 0.6771, test_loss: 1.0136, test_f1: 0.5547
 epoch: 70, train_loss: 0.6693, test_loss: 0.9772, test_f1: 0.6072
 epoch: 71, train_loss: 0.6433, test_loss: 0.9505, test_f1: 0.6048
 epoch: 72, train_loss: 0.6628, test_loss: 0.8652, test_f1: 0.6236
 epoch: 73, train_loss: 0.6506, test_loss: 1.0505, test_f1: 0.6046
 epoch: 74, train_loss: 0.6306, test_loss: 0.9721, test_f1: 0.6075
 epoch: 75, train_loss: 0.6363, test_loss: 1.0275, test_f1: 0.5627
 epoch: 76, train_loss: 0.6349, test_loss: 0.9399, test_f1: 0.6179
 epoch: 77, train_loss: 0.6309, test_loss: 1.0259, test_f1: 0.5961
 epoch: 78, train_loss: 0.6198, test_loss: 0.9357, test_f1: 0.6052
 epoch: 79, train_loss: 0.6507, test_loss: 0.9467, test_f1: 0.5719
 epoch: 80, train_loss: 0.6302, test_loss: 1.0185, test_f1: 0.5846
 epoch: 81, train_loss: 0.6464, test_loss: 0.9468, test_f1: 0.5768
 epoch: 82, train_loss: 0.6504, test_loss: 0.9707, test_f1: 0.5579
 epoch: 83, train_loss: 0.6304, test_loss: 0.9142, test_f1: 0.6109
 epoch: 84, train_loss: 0.6335, test_loss: 0.9345, test_f1: 0.6185
 epoch: 85, train_loss: 0.6374, test_loss: 0.9587, test_f1: 0.6240
 epoch: 86, train_loss: 0.6160, test_loss: 0.9819, test_f1: 0.6103
 epoch: 87, train_loss: 0.6325, test_loss: 0.9028, test_f1: 0.6008
 epoch: 88, train_loss: 0.6284, test_loss: 0.9401, test_f1: 0.6356
 epoch: 89, train_loss: 0.6163, test_loss: 0.9691, test_f1: 0.6017
 epoch: 90, train_loss: 0.6120, test_loss: 0.9719, test_f1: 0.6031
 epoch: 91, train_loss: 0.6235, test_loss: 0.9260, test_f1: 0.6235
 epoch: 92, train_loss: 0.6090, test_loss: 1.2003, test_f1: 0.5699
 epoch: 93, train_loss: 0.6101, test_loss: 0.9772, test_f1: 0.5812
 epoch: 94, train_loss: 0.6141, test_loss: 0.9885, test_f1: 0.5913
 epoch: 95, train_loss: 0.6076, test_loss: 0.9540, test_f1: 0.6073
 epoch: 96, train_loss: 0.6231, test_loss: 0.9059, test_f1: 0.6094
 epoch: 97, train_loss: 0.6011, test_loss: 0.9327, test_f1: 0.6225
 epoch: 98, train_loss: 0.5962, test_loss: 0.9994, test_f1: 0.5845
 epoch: 99, train_loss: 0.6098, test_loss: 0.9310, test_f1: 0.6238
##################ITERATION #8 ****************************************
 epoch: 0, train_loss: 1.1442, test_loss: 1.1400, test_f1: 0.3359
 epoch: 1, train_loss: 1.0484, test_loss: 1.0025, test_f1: 0.4404
 epoch: 2, train_loss: 1.0185, test_loss: 0.9713, test_f1: 0.4757
 epoch: 3, train_loss: 0.9876, test_loss: 0.9743, test_f1: 0.4901
 epoch: 4, train_loss: 0.9517, test_loss: 0.9892, test_f1: 0.4729
 epoch: 5, train_loss: 0.9429, test_loss: 0.9385, test_f1: 0.5070
 epoch: 6, train_loss: 0.9330, test_loss: 1.1260, test_f1: 0.4640
 epoch: 7, train_loss: 0.9250, test_loss: 1.0604, test_f1: 0.4556
 epoch: 8, train_loss: 0.9202, test_loss: 0.9611, test_f1: 0.5171
 epoch: 9, train_loss: 0.8974, test_loss: 0.9074, test_f1: 0.5920
 epoch: 10, train_loss: 0.8784, test_loss: 0.9268, test_f1: 0.5121
 epoch: 11, train_loss: 0.8829, test_loss: 0.9139, test_f1: 0.5644
 epoch: 12, train_loss: 0.8755, test_loss: 0.8561, test_f1: 0.4981
 epoch: 13, train_loss: 0.8517, test_loss: 1.0332, test_f1: 0.4848
 epoch: 14, train_loss: 0.8349, test_loss: 0.9307, test_f1: 0.5572
 epoch: 15, train_loss: 0.8305, test_loss: 0.9357, test_f1: 0.5168
 epoch: 16, train_loss: 0.8342, test_loss: 0.9043, test_f1: 0.5361
 epoch: 17, train_loss: 0.8135, test_loss: 0.9428, test_f1: 0.5184
 epoch: 18, train_loss: 0.8403, test_loss: 0.8261, test_f1: 0.5588
 epoch: 19, train_loss: 0.8202, test_loss: 0.8501, test_f1: 0.5676
 epoch: 20, train_loss: 0.8166, test_loss: 0.9207, test_f1: 0.4956
 epoch: 21, train_loss: 0.7975, test_loss: 0.8176, test_f1: 0.5989
 epoch: 22, train_loss: 0.8048, test_loss: 0.8775, test_f1: 0.4988
 epoch: 23, train_loss: 0.7991, test_loss: 0.8819, test_f1: 0.5647
 epoch: 24, train_loss: 0.7859, test_loss: 0.9794, test_f1: 0.5417
 epoch: 25, train_loss: 0.7779, test_loss: 1.0921, test_f1: 0.4826
 epoch: 26, train_loss: 0.7698, test_loss: 0.8599, test_f1: 0.5547
 epoch: 27, train_loss: 0.8137, test_loss: 0.8557, test_f1: 0.6291
 epoch: 28, train_loss: 0.7890, test_loss: 0.8679, test_f1: 0.6455
 epoch: 29, train_loss: 0.7843, test_loss: 0.9212, test_f1: 0.5305
 epoch: 30, train_loss: 0.7564, test_loss: 0.8749, test_f1: 0.6405
 epoch: 31, train_loss: 0.7610, test_loss: 0.9034, test_f1: 0.5716
 epoch: 32, train_loss: 0.7641, test_loss: 0.9062, test_f1: 0.5636
 epoch: 33, train_loss: 0.7430, test_loss: 0.9549, test_f1: 0.6206
 epoch: 34, train_loss: 0.7411, test_loss: 0.9180, test_f1: 0.6343
 epoch: 35, train_loss: 0.7563, test_loss: 0.9266, test_f1: 0.5462
 epoch: 36, train_loss: 0.7469, test_loss: 0.8566, test_f1: 0.6196
 epoch: 37, train_loss: 0.7418, test_loss: 0.8461, test_f1: 0.6242
 epoch: 38, train_loss: 0.7227, test_loss: 1.0413, test_f1: 0.5412
 epoch: 39, train_loss: 0.7347, test_loss: 0.8146, test_f1: 0.5719
 epoch: 40, train_loss: 0.7362, test_loss: 0.8983, test_f1: 0.5837
 epoch: 41, train_loss: 0.7242, test_loss: 0.8521, test_f1: 0.6355
 epoch: 42, train_loss: 0.7074, test_loss: 0.8470, test_f1: 0.6545
 epoch: 43, train_loss: 0.7232, test_loss: 0.8132, test_f1: 0.6136
 epoch: 44, train_loss: 0.7207, test_loss: 0.8727, test_f1: 0.5804
 epoch: 45, train_loss: 0.7126, test_loss: 0.8545, test_f1: 0.6207
 epoch: 46, train_loss: 0.7308, test_loss: 0.9271, test_f1: 0.6322
 epoch: 47, train_loss: 0.6948, test_loss: 0.9143, test_f1: 0.6427
 epoch: 48, train_loss: 0.6992, test_loss: 0.8437, test_f1: 0.5879
 epoch: 49, train_loss: 0.6998, test_loss: 0.9020, test_f1: 0.6346
 epoch: 50, train_loss: 0.6888, test_loss: 0.8931, test_f1: 0.5850
 epoch: 51, train_loss: 0.6706, test_loss: 0.8589, test_f1: 0.6485
 epoch: 52, train_loss: 0.6523, test_loss: 0.8805, test_f1: 0.6405
 epoch: 53, train_loss: 0.6421, test_loss: 0.8521, test_f1: 0.6495
 epoch: 54, train_loss: 0.6463, test_loss: 0.9174, test_f1: 0.6421
 epoch: 55, train_loss: 0.6399, test_loss: 0.9072, test_f1: 0.6492
 epoch: 56, train_loss: 0.6241, test_loss: 0.9929, test_f1: 0.6361
 epoch: 57, train_loss: 0.6509, test_loss: 0.8536, test_f1: 0.6317
 epoch: 58, train_loss: 0.6245, test_loss: 0.9139, test_f1: 0.6627
 epoch: 59, train_loss: 0.6378, test_loss: 1.0178, test_f1: 0.6453
 epoch: 60, train_loss: 0.6359, test_loss: 0.8820, test_f1: 0.6584
 epoch: 61, train_loss: 0.6315, test_loss: 1.0407, test_f1: 0.6462
 epoch: 62, train_loss: 0.6419, test_loss: 0.9434, test_f1: 0.6611
 epoch: 63, train_loss: 0.6161, test_loss: 0.9814, test_f1: 0.6622
 epoch: 64, train_loss: 0.6110, test_loss: 0.8953, test_f1: 0.6465
 epoch: 65, train_loss: 0.6243, test_loss: 0.8372, test_f1: 0.6598
 epoch: 66, train_loss: 0.6170, test_loss: 0.9384, test_f1: 0.6592
 epoch: 67, train_loss: 0.6030, test_loss: 1.0903, test_f1: 0.6200
 epoch: 68, train_loss: 0.6186, test_loss: 1.1125, test_f1: 0.6456
 epoch: 69, train_loss: 0.6265, test_loss: 0.8663, test_f1: 0.6429
 epoch: 70, train_loss: 0.6267, test_loss: 0.9249, test_f1: 0.6414
 epoch: 71, train_loss: 0.6093, test_loss: 0.9143, test_f1: 0.6708
 epoch: 72, train_loss: 0.5982, test_loss: 0.8854, test_f1: 0.6423
 epoch: 73, train_loss: 0.6204, test_loss: 0.9599, test_f1: 0.6444
 epoch: 74, train_loss: 0.5881, test_loss: 0.9685, test_f1: 0.6332
 epoch: 75, train_loss: 0.6112, test_loss: 0.9516, test_f1: 0.6615
 epoch: 76, train_loss: 0.6068, test_loss: 0.9391, test_f1: 0.6439
 epoch: 77, train_loss: 0.5918, test_loss: 1.0113, test_f1: 0.6517
 epoch: 78, train_loss: 0.6006, test_loss: 1.1248, test_f1: 0.6517
 epoch: 79, train_loss: 0.5979, test_loss: 0.9650, test_f1: 0.6223
 epoch: 80, train_loss: 0.5961, test_loss: 1.0374, test_f1: 0.6463
 epoch: 81, train_loss: 0.5940, test_loss: 0.9113, test_f1: 0.6435
 epoch: 82, train_loss: 0.5936, test_loss: 1.1295, test_f1: 0.6420
 epoch: 83, train_loss: 0.5887, test_loss: 0.9438, test_f1: 0.6134
 epoch: 84, train_loss: 0.5952, test_loss: 0.8727, test_f1: 0.6542
 epoch: 85, train_loss: 0.5952, test_loss: 0.8933, test_f1: 0.6501
 epoch: 86, train_loss: 0.5937, test_loss: 1.0064, test_f1: 0.6587
 epoch: 87, train_loss: 0.5993, test_loss: 0.9785, test_f1: 0.6560
 epoch: 88, train_loss: 0.5855, test_loss: 1.0239, test_f1: 0.6465
 epoch: 89, train_loss: 0.5944, test_loss: 0.8360, test_f1: 0.6523
 epoch: 90, train_loss: 0.5811, test_loss: 0.9274, test_f1: 0.6626
 epoch: 91, train_loss: 0.5730, test_loss: 1.0936, test_f1: 0.6164
 epoch: 92, train_loss: 0.5733, test_loss: 0.8980, test_f1: 0.6475
 epoch: 93, train_loss: 0.5788, test_loss: 1.0456, test_f1: 0.6503
 epoch: 94, train_loss: 0.5768, test_loss: 0.9566, test_f1: 0.6554
 epoch: 95, train_loss: 0.5851, test_loss: 0.9550, test_f1: 0.6634
 epoch: 96, train_loss: 0.5825, test_loss: 1.1435, test_f1: 0.6492
 epoch: 97, train_loss: 0.5868, test_loss: 0.9891, test_f1: 0.6476
 epoch: 98, train_loss: 0.5848, test_loss: 1.0971, test_f1: 0.6238
 epoch: 99, train_loss: 0.5751, test_loss: 1.0741, test_f1: 0.6325
##################ITERATION #9 ****************************************
 epoch: 0, train_loss: 1.1545, test_loss: 1.1182, test_f1: 0.4164
 epoch: 1, train_loss: 1.0288, test_loss: 1.0682, test_f1: 0.5211
 epoch: 2, train_loss: 0.9871, test_loss: 1.0613, test_f1: 0.4662
 epoch: 3, train_loss: 0.9726, test_loss: 1.0404, test_f1: 0.5192
 epoch: 4, train_loss: 0.9700, test_loss: 1.0272, test_f1: 0.5082
 epoch: 5, train_loss: 0.9696, test_loss: 1.0293, test_f1: 0.4763
 epoch: 6, train_loss: 0.9533, test_loss: 1.0064, test_f1: 0.5142
 epoch: 7, train_loss: 0.9580, test_loss: 0.9379, test_f1: 0.5109
 epoch: 8, train_loss: 0.9260, test_loss: 1.0405, test_f1: 0.5129
 epoch: 9, train_loss: 0.9122, test_loss: 0.9887, test_f1: 0.5138
 epoch: 10, train_loss: 0.9083, test_loss: 1.0457, test_f1: 0.4867
 epoch: 11, train_loss: 0.8696, test_loss: 0.8910, test_f1: 0.5547
 epoch: 12, train_loss: 0.8668, test_loss: 0.9145, test_f1: 0.5242
 epoch: 13, train_loss: 0.8822, test_loss: 0.9072, test_f1: 0.5228
 epoch: 14, train_loss: 0.8573, test_loss: 1.3711, test_f1: 0.4627
 epoch: 15, train_loss: 0.8744, test_loss: 0.9435, test_f1: 0.5542
 epoch: 16, train_loss: 0.8386, test_loss: 0.9239, test_f1: 0.5556
 epoch: 17, train_loss: 0.8427, test_loss: 0.9350, test_f1: 0.5333
 epoch: 18, train_loss: 0.8381, test_loss: 0.9201, test_f1: 0.5530
 epoch: 19, train_loss: 0.8187, test_loss: 0.9963, test_f1: 0.5407
 epoch: 20, train_loss: 0.8239, test_loss: 0.9971, test_f1: 0.5802
 epoch: 21, train_loss: 0.7981, test_loss: 0.8775, test_f1: 0.5983
 epoch: 22, train_loss: 0.7965, test_loss: 0.9717, test_f1: 0.5609
 epoch: 23, train_loss: 0.7843, test_loss: 0.9234, test_f1: 0.5642
 epoch: 24, train_loss: 0.7723, test_loss: 0.9848, test_f1: 0.5281
 epoch: 25, train_loss: 0.7869, test_loss: 1.0440, test_f1: 0.5263
 epoch: 26, train_loss: 0.7737, test_loss: 0.7966, test_f1: 0.6230
 epoch: 27, train_loss: 0.7726, test_loss: 0.8444, test_f1: 0.5885
 epoch: 28, train_loss: 0.7623, test_loss: 0.9082, test_f1: 0.5683
 epoch: 29, train_loss: 0.7491, test_loss: 0.9177, test_f1: 0.6059
 epoch: 30, train_loss: 0.7679, test_loss: 0.8426, test_f1: 0.6039
 epoch: 31, train_loss: 0.7638, test_loss: 0.8788, test_f1: 0.5911
 epoch: 32, train_loss: 0.7411, test_loss: 0.8620, test_f1: 0.6128
 epoch: 33, train_loss: 0.7308, test_loss: 0.9224, test_f1: 0.5572
 epoch: 34, train_loss: 0.7408, test_loss: 0.8911, test_f1: 0.6013
 epoch: 35, train_loss: 0.7428, test_loss: 0.8525, test_f1: 0.5942
 epoch: 36, train_loss: 0.7327, test_loss: 0.8661, test_f1: 0.6102
 epoch: 37, train_loss: 0.7373, test_loss: 0.8218, test_f1: 0.6096
 epoch: 38, train_loss: 0.7240, test_loss: 0.8886, test_f1: 0.6012
 epoch: 39, train_loss: 0.7346, test_loss: 0.9012, test_f1: 0.5634
 epoch: 40, train_loss: 0.7188, test_loss: 0.9090, test_f1: 0.5663
 epoch: 41, train_loss: 0.7231, test_loss: 0.9210, test_f1: 0.5989
 epoch: 42, train_loss: 0.7343, test_loss: 0.8289, test_f1: 0.6158
 epoch: 43, train_loss: 0.7117, test_loss: 0.9148, test_f1: 0.5955
 epoch: 44, train_loss: 0.7148, test_loss: 0.8686, test_f1: 0.6403
 epoch: 45, train_loss: 0.7148, test_loss: 0.8342, test_f1: 0.6221
 epoch: 46, train_loss: 0.7088, test_loss: 0.8260, test_f1: 0.6173
 epoch: 47, train_loss: 0.6990, test_loss: 0.8203, test_f1: 0.6423
 epoch: 48, train_loss: 0.6932, test_loss: 0.9104, test_f1: 0.6221
 epoch: 49, train_loss: 0.6909, test_loss: 0.9390, test_f1: 0.5925
 epoch: 50, train_loss: 0.6805, test_loss: 1.0124, test_f1: 0.5760
 epoch: 51, train_loss: 0.6587, test_loss: 0.8484, test_f1: 0.6261
 epoch: 52, train_loss: 0.6510, test_loss: 0.9222, test_f1: 0.6321
 epoch: 53, train_loss: 0.6460, test_loss: 0.8820, test_f1: 0.6178
 epoch: 54, train_loss: 0.6309, test_loss: 0.9466, test_f1: 0.6222
 epoch: 55, train_loss: 0.6434, test_loss: 0.9229, test_f1: 0.6368
 epoch: 56, train_loss: 0.6175, test_loss: 0.8760, test_f1: 0.6232
 epoch: 57, train_loss: 0.6133, test_loss: 0.8644, test_f1: 0.6270
 epoch: 58, train_loss: 0.6214, test_loss: 0.8668, test_f1: 0.6467
 epoch: 59, train_loss: 0.6070, test_loss: 0.9058, test_f1: 0.6357
 epoch: 60, train_loss: 0.6209, test_loss: 0.8744, test_f1: 0.5812
 epoch: 61, train_loss: 0.6186, test_loss: 0.8558, test_f1: 0.6399
 epoch: 62, train_loss: 0.6092, test_loss: 0.8585, test_f1: 0.6253
 epoch: 63, train_loss: 0.5924, test_loss: 0.9162, test_f1: 0.6373
 epoch: 64, train_loss: 0.6059, test_loss: 0.8723, test_f1: 0.6313
 epoch: 65, train_loss: 0.6085, test_loss: 0.8812, test_f1: 0.6319
 epoch: 66, train_loss: 0.5864, test_loss: 1.0679, test_f1: 0.5997
 epoch: 67, train_loss: 0.6016, test_loss: 0.8901, test_f1: 0.6424
 epoch: 68, train_loss: 0.5856, test_loss: 0.9443, test_f1: 0.6349
 epoch: 69, train_loss: 0.5792, test_loss: 0.8867, test_f1: 0.6221
 epoch: 70, train_loss: 0.5879, test_loss: 0.9155, test_f1: 0.6163
 epoch: 71, train_loss: 0.5785, test_loss: 0.8848, test_f1: 0.6280
 epoch: 72, train_loss: 0.5717, test_loss: 1.0366, test_f1: 0.6412
 epoch: 73, train_loss: 0.6040, test_loss: 0.9275, test_f1: 0.6329
 epoch: 74, train_loss: 0.5878, test_loss: 0.8998, test_f1: 0.6248
 epoch: 75, train_loss: 0.5811, test_loss: 0.9618, test_f1: 0.5990
 epoch: 76, train_loss: 0.5900, test_loss: 0.9061, test_f1: 0.6245
 epoch: 77, train_loss: 0.5536, test_loss: 0.9037, test_f1: 0.6433
 epoch: 78, train_loss: 0.5611, test_loss: 0.9283, test_f1: 0.6112
 epoch: 79, train_loss: 0.5609, test_loss: 0.9995, test_f1: 0.6123
 epoch: 80, train_loss: 0.5817, test_loss: 0.8345, test_f1: 0.6666
 epoch: 81, train_loss: 0.5693, test_loss: 0.9201, test_f1: 0.6399
 epoch: 82, train_loss: 0.5853, test_loss: 0.9067, test_f1: 0.5895
 epoch: 83, train_loss: 0.5596, test_loss: 0.8832, test_f1: 0.6385
 epoch: 84, train_loss: 0.5665, test_loss: 1.0744, test_f1: 0.6254
 epoch: 85, train_loss: 0.5784, test_loss: 0.9575, test_f1: 0.6332
 epoch: 86, train_loss: 0.5468, test_loss: 0.9163, test_f1: 0.6198
 epoch: 87, train_loss: 0.5549, test_loss: 0.9204, test_f1: 0.6389
 epoch: 88, train_loss: 0.5487, test_loss: 0.9453, test_f1: 0.6135
 epoch: 89, train_loss: 0.5461, test_loss: 0.8861, test_f1: 0.6398
 epoch: 90, train_loss: 0.5306, test_loss: 0.9594, test_f1: 0.6176
 epoch: 91, train_loss: 0.5440, test_loss: 0.9668, test_f1: 0.6295
 epoch: 92, train_loss: 0.5780, test_loss: 0.9433, test_f1: 0.6249
 epoch: 93, train_loss: 0.5379, test_loss: 0.9333, test_f1: 0.6232
 epoch: 94, train_loss: 0.5412, test_loss: 0.8972, test_f1: 0.6365
 epoch: 95, train_loss: 0.5423, test_loss: 0.8935, test_f1: 0.6316
 epoch: 96, train_loss: 0.5383, test_loss: 0.8513, test_f1: 0.6430
 epoch: 97, train_loss: 0.5184, test_loss: 0.9252, test_f1: 0.6055
 epoch: 98, train_loss: 0.5186, test_loss: 0.9400, test_f1: 0.6332
 epoch: 99, train_loss: 0.5314, test_loss: 0.9245, test_f1: 0.6257

Training completed in 828.09 seconds
Best F1: 0.6836 at epoch 67
Mean F1 across iterations: 0.6619  0.0136
========================FINAL RESULTS================================
FEGIN weighted F1: 0.6836  0.0136
python main.py --data ltspice_examples --representation component_pin --model FEGIN --layers 6 --hiddens 32 --batch_size 64 --lr 0.01 --emb_size 250 --epochs 100 --save_appendix component_pin_L6_H32_BS64_LR0.01_E250 --no_val
-----



STDERR:
  File "main.py", line 370, in <module>
    main()
  File "main.py", line 254, in main
    dataset = dataset_class(
  File "/home/philip/projects/ltspice_examples_code_repo/Circuit-Completion-Using-GNNs/component_classification_with_link_prediction_head/evaluation/FEGIN/kernel/circuit_datasets.py", line 15, in __init__
    self.data, self.slices = torch.load(self.processed_paths[0])
  File "/home/philip/.local/lib/python3.8/site-packages/torch/serialization.py", line 1040, in load
    warnings.warn(
  File "/usr/lib/python3.8/warnings.py", line 109, in _showwarnmsg
    sw(msg.message, msg.category, msg.filename, msg.lineno,
  File "main.py", line 47, in warn_with_traceback
    traceback.print_stack(file=log)
/home/philip/projects/ltspice_examples_code_repo/Circuit-Completion-Using-GNNs/component_classification_with_link_prediction_head/evaluation/FEGIN/kernel/circuit_datasets.py:15: FutureWarning: You are using `torch.load` with `weights_only=False` (the current default value), which uses the default pickle module implicitly. It is possible to construct malicious pickle data which will execute arbitrary code during unpickling (See https://github.com/pytorch/pytorch/blob/main/SECURITY.md#untrusted-models for more details). In a future release, the default value for `weights_only` will be flipped to `True`. This limits the functions that could be executed during unpickling. Arbitrary objects will no longer be allowed to be loaded via this mode unless they are explicitly allowlisted by the user via `torch.serialization.add_safe_globals`. We recommend you start setting `weights_only=True` for any use case where you don't have full control of the loaded file. Please open an issue on GitHub for any issues related to this experimental feature.
  self.data, self.slices = torch.load(self.processed_paths[0])
