STDOUT:
Results will be saved in /home/philip/projects/ltspice_examples_code_repo/Circuit-Completion-Using-GNNs/component_classification_with_link_prediction_head/evaluation/FEGIN/results/model_FEGIN_dataset_ltspice_examples
Command line input: python main.py --data ltspice_examples --representation component_component --model FEGIN --layers 2 --hiddens 128 --batch_size 256 --lr 0.0001 --emb_size 128 --epochs 100 --save_appendix component_component_L2_H128_BS256_LR0.0001_E128 --no_val
 is saved.
-----
ltspice_examples - FEGIN
Using 2 layers, 128 hidden units, h = 2
Loading component_component representation dataset
ENTERED
Training FEGIN on component_component representation
Train: 3556, Test: 845
##################ITERATION #0 ****************************************
 epoch: 0, train_loss: 1.3704, test_loss: 1.3678, test_f1: 0.2274
 epoch: 1, train_loss: 1.3539, test_loss: 1.3580, test_f1: 0.2274
 epoch: 2, train_loss: 1.3434, test_loss: 1.3445, test_f1: 0.2274
 epoch: 3, train_loss: 1.3307, test_loss: 1.3278, test_f1: 0.2274
 epoch: 4, train_loss: 1.3162, test_loss: 1.3093, test_f1: 0.2274
 epoch: 5, train_loss: 1.2989, test_loss: 1.2904, test_f1: 0.2274
 epoch: 6, train_loss: 1.2840, test_loss: 1.2726, test_f1: 0.2274
 epoch: 7, train_loss: 1.2666, test_loss: 1.2556, test_f1: 0.2274
 epoch: 8, train_loss: 1.2508, test_loss: 1.2398, test_f1: 0.2395
 epoch: 9, train_loss: 1.2365, test_loss: 1.2253, test_f1: 0.2578
 epoch: 10, train_loss: 1.2208, test_loss: 1.2112, test_f1: 0.2879
 epoch: 11, train_loss: 1.2074, test_loss: 1.1987, test_f1: 0.3399
 epoch: 12, train_loss: 1.1944, test_loss: 1.1840, test_f1: 0.3505
 epoch: 13, train_loss: 1.1828, test_loss: 1.1730, test_f1: 0.3576
 epoch: 14, train_loss: 1.1686, test_loss: 1.1613, test_f1: 0.3585
 epoch: 15, train_loss: 1.1566, test_loss: 1.1501, test_f1: 0.3708
 epoch: 16, train_loss: 1.1472, test_loss: 1.1427, test_f1: 0.4143
 epoch: 17, train_loss: 1.1324, test_loss: 1.1309, test_f1: 0.4343
 epoch: 18, train_loss: 1.1162, test_loss: 1.1207, test_f1: 0.4356
 epoch: 19, train_loss: 1.1084, test_loss: 1.1135, test_f1: 0.4408
 epoch: 20, train_loss: 1.0986, test_loss: 1.1007, test_f1: 0.4426
 epoch: 21, train_loss: 1.0866, test_loss: 1.0934, test_f1: 0.4558
 epoch: 22, train_loss: 1.0721, test_loss: 1.0853, test_f1: 0.4356
 epoch: 23, train_loss: 1.0610, test_loss: 1.0757, test_f1: 0.4380
 epoch: 24, train_loss: 1.0514, test_loss: 1.0660, test_f1: 0.4452
 epoch: 25, train_loss: 1.0309, test_loss: 1.0589, test_f1: 0.4521
 epoch: 26, train_loss: 1.0298, test_loss: 1.0506, test_f1: 0.4620
 epoch: 27, train_loss: 1.0191, test_loss: 1.0415, test_f1: 0.4582
 epoch: 28, train_loss: 1.0102, test_loss: 1.0312, test_f1: 0.4742
 epoch: 29, train_loss: 0.9977, test_loss: 1.0286, test_f1: 0.4731
 epoch: 30, train_loss: 0.9853, test_loss: 1.0196, test_f1: 0.4803
 epoch: 31, train_loss: 0.9790, test_loss: 1.0144, test_f1: 0.4772
 epoch: 32, train_loss: 0.9700, test_loss: 1.0205, test_f1: 0.4854
 epoch: 33, train_loss: 0.9534, test_loss: 1.0053, test_f1: 0.4754
 epoch: 34, train_loss: 0.9451, test_loss: 1.0047, test_f1: 0.4859
 epoch: 35, train_loss: 0.9393, test_loss: 0.9946, test_f1: 0.4979
 epoch: 36, train_loss: 0.9262, test_loss: 0.9964, test_f1: 0.4898
 epoch: 37, train_loss: 0.9242, test_loss: 0.9960, test_f1: 0.4764
 epoch: 38, train_loss: 0.9118, test_loss: 0.9938, test_f1: 0.4830
 epoch: 39, train_loss: 0.9100, test_loss: 0.9785, test_f1: 0.4808
 epoch: 40, train_loss: 0.9009, test_loss: 0.9978, test_f1: 0.4826
 epoch: 41, train_loss: 0.8938, test_loss: 0.9912, test_f1: 0.4887
 epoch: 42, train_loss: 0.8814, test_loss: 0.9910, test_f1: 0.4785
 epoch: 43, train_loss: 0.8740, test_loss: 0.9833, test_f1: 0.4859
 epoch: 44, train_loss: 0.8644, test_loss: 1.0033, test_f1: 0.5002
 epoch: 45, train_loss: 0.8567, test_loss: 0.9874, test_f1: 0.4925
 epoch: 46, train_loss: 0.8533, test_loss: 0.9891, test_f1: 0.5022
 epoch: 47, train_loss: 0.8404, test_loss: 1.0069, test_f1: 0.5014
 epoch: 48, train_loss: 0.8311, test_loss: 0.9872, test_f1: 0.5007
 epoch: 49, train_loss: 0.8229, test_loss: 0.9952, test_f1: 0.4973
 epoch: 50, train_loss: 0.8283, test_loss: 1.0059, test_f1: 0.5155
 epoch: 51, train_loss: 0.8200, test_loss: 1.0020, test_f1: 0.4930
 epoch: 52, train_loss: 0.8043, test_loss: 1.0096, test_f1: 0.4975
 epoch: 53, train_loss: 0.8043, test_loss: 1.0142, test_f1: 0.4905
 epoch: 54, train_loss: 0.7965, test_loss: 1.0175, test_f1: 0.4821
 epoch: 55, train_loss: 0.7939, test_loss: 1.0189, test_f1: 0.4924
 epoch: 56, train_loss: 0.7883, test_loss: 1.0178, test_f1: 0.4870
 epoch: 57, train_loss: 0.7862, test_loss: 1.0292, test_f1: 0.4845
 epoch: 58, train_loss: 0.7844, test_loss: 1.0260, test_f1: 0.4994
 epoch: 59, train_loss: 0.7769, test_loss: 1.0318, test_f1: 0.4966
 epoch: 60, train_loss: 0.7766, test_loss: 1.0456, test_f1: 0.4979
 epoch: 61, train_loss: 0.7706, test_loss: 1.0423, test_f1: 0.4869
 epoch: 62, train_loss: 0.7694, test_loss: 1.0394, test_f1: 0.4999
 epoch: 63, train_loss: 0.7642, test_loss: 1.0398, test_f1: 0.4907
 epoch: 64, train_loss: 0.7641, test_loss: 1.0474, test_f1: 0.5095
 epoch: 65, train_loss: 0.7557, test_loss: 1.0504, test_f1: 0.4962
 epoch: 66, train_loss: 0.7554, test_loss: 1.0512, test_f1: 0.4950
 epoch: 67, train_loss: 0.7533, test_loss: 1.0621, test_f1: 0.4928
 epoch: 68, train_loss: 0.7503, test_loss: 1.0565, test_f1: 0.4909
 epoch: 69, train_loss: 0.7400, test_loss: 1.0580, test_f1: 0.4959
 epoch: 70, train_loss: 0.7431, test_loss: 1.0571, test_f1: 0.5092
 epoch: 71, train_loss: 0.7350, test_loss: 1.0592, test_f1: 0.4900
 epoch: 72, train_loss: 0.7412, test_loss: 1.0582, test_f1: 0.4927
 epoch: 73, train_loss: 0.7369, test_loss: 1.0713, test_f1: 0.5022
 epoch: 74, train_loss: 0.7294, test_loss: 1.0693, test_f1: 0.5073
 epoch: 75, train_loss: 0.7312, test_loss: 1.0787, test_f1: 0.4859
 epoch: 76, train_loss: 0.7223, test_loss: 1.0850, test_f1: 0.4915
 epoch: 77, train_loss: 0.7347, test_loss: 1.0763, test_f1: 0.4873
 epoch: 78, train_loss: 0.7249, test_loss: 1.0839, test_f1: 0.5009
 epoch: 79, train_loss: 0.7225, test_loss: 1.0860, test_f1: 0.4880
 epoch: 80, train_loss: 0.7168, test_loss: 1.1045, test_f1: 0.4961
 epoch: 81, train_loss: 0.7085, test_loss: 1.0973, test_f1: 0.4976
 epoch: 82, train_loss: 0.7056, test_loss: 1.0999, test_f1: 0.4960
 epoch: 83, train_loss: 0.7018, test_loss: 1.0985, test_f1: 0.5021
 epoch: 84, train_loss: 0.6969, test_loss: 1.1061, test_f1: 0.5014
 epoch: 85, train_loss: 0.7052, test_loss: 1.1096, test_f1: 0.4967
 epoch: 86, train_loss: 0.6944, test_loss: 1.1085, test_f1: 0.5046
 epoch: 87, train_loss: 0.7071, test_loss: 1.1147, test_f1: 0.5039
 epoch: 88, train_loss: 0.6881, test_loss: 1.1038, test_f1: 0.4976
 epoch: 89, train_loss: 0.6861, test_loss: 1.1377, test_f1: 0.5113
 epoch: 90, train_loss: 0.6856, test_loss: 1.1405, test_f1: 0.5015
 epoch: 91, train_loss: 0.6828, test_loss: 1.1358, test_f1: 0.5022
 epoch: 92, train_loss: 0.6798, test_loss: 1.1376, test_f1: 0.5001
 epoch: 93, train_loss: 0.6717, test_loss: 1.1305, test_f1: 0.5003
 epoch: 94, train_loss: 0.6740, test_loss: 1.1308, test_f1: 0.5054
 epoch: 95, train_loss: 0.6729, test_loss: 1.1328, test_f1: 0.5181
 epoch: 96, train_loss: 0.6658, test_loss: 1.1489, test_f1: 0.5162
 epoch: 97, train_loss: 0.6660, test_loss: 1.1529, test_f1: 0.5062
 epoch: 98, train_loss: 0.6718, test_loss: 1.1687, test_f1: 0.5024
 epoch: 99, train_loss: 0.6637, test_loss: 1.1492, test_f1: 0.5130
##################ITERATION #1 ****************************************
 epoch: 0, train_loss: 1.3350, test_loss: 1.3361, test_f1: 0.2274
 epoch: 1, train_loss: 1.2922, test_loss: 1.3051, test_f1: 0.2521
 epoch: 2, train_loss: 1.2714, test_loss: 1.2733, test_f1: 0.2603
 epoch: 3, train_loss: 1.2518, test_loss: 1.2409, test_f1: 0.2729
 epoch: 4, train_loss: 1.2353, test_loss: 1.2147, test_f1: 0.3118
 epoch: 5, train_loss: 1.2171, test_loss: 1.1926, test_f1: 0.3406
 epoch: 6, train_loss: 1.2068, test_loss: 1.1745, test_f1: 0.3660
 epoch: 7, train_loss: 1.1899, test_loss: 1.1589, test_f1: 0.4028
 epoch: 8, train_loss: 1.1730, test_loss: 1.1450, test_f1: 0.4237
 epoch: 9, train_loss: 1.1657, test_loss: 1.1329, test_f1: 0.4329
 epoch: 10, train_loss: 1.1515, test_loss: 1.1182, test_f1: 0.4490
 epoch: 11, train_loss: 1.1383, test_loss: 1.1054, test_f1: 0.4428
 epoch: 12, train_loss: 1.1245, test_loss: 1.0946, test_f1: 0.4471
 epoch: 13, train_loss: 1.1127, test_loss: 1.0803, test_f1: 0.4463
 epoch: 14, train_loss: 1.1002, test_loss: 1.0672, test_f1: 0.4347
 epoch: 15, train_loss: 1.0933, test_loss: 1.0568, test_f1: 0.4369
 epoch: 16, train_loss: 1.0763, test_loss: 1.0474, test_f1: 0.4457
 epoch: 17, train_loss: 1.0675, test_loss: 1.0357, test_f1: 0.4518
 epoch: 18, train_loss: 1.0547, test_loss: 1.0262, test_f1: 0.4477
 epoch: 19, train_loss: 1.0480, test_loss: 1.0178, test_f1: 0.4502
 epoch: 20, train_loss: 1.0421, test_loss: 1.0073, test_f1: 0.4514
 epoch: 21, train_loss: 1.0329, test_loss: 1.0030, test_f1: 0.4750
 epoch: 22, train_loss: 1.0253, test_loss: 0.9948, test_f1: 0.4674
 epoch: 23, train_loss: 1.0079, test_loss: 0.9848, test_f1: 0.4652
 epoch: 24, train_loss: 1.0061, test_loss: 0.9804, test_f1: 0.4957
 epoch: 25, train_loss: 0.9863, test_loss: 0.9733, test_f1: 0.4748
 epoch: 26, train_loss: 0.9837, test_loss: 0.9711, test_f1: 0.4980
 epoch: 27, train_loss: 0.9802, test_loss: 0.9634, test_f1: 0.4893
 epoch: 28, train_loss: 0.9672, test_loss: 0.9567, test_f1: 0.4853
 epoch: 29, train_loss: 0.9581, test_loss: 0.9514, test_f1: 0.4921
 epoch: 30, train_loss: 0.9585, test_loss: 0.9577, test_f1: 0.4732
 epoch: 31, train_loss: 0.9446, test_loss: 0.9463, test_f1: 0.4938
 epoch: 32, train_loss: 0.9397, test_loss: 0.9425, test_f1: 0.4836
 epoch: 33, train_loss: 0.9295, test_loss: 0.9397, test_f1: 0.4844
 epoch: 34, train_loss: 0.9284, test_loss: 0.9343, test_f1: 0.5046
 epoch: 35, train_loss: 0.9150, test_loss: 0.9367, test_f1: 0.4890
 epoch: 36, train_loss: 0.9098, test_loss: 0.9373, test_f1: 0.4823
 epoch: 37, train_loss: 0.9013, test_loss: 0.9342, test_f1: 0.4844
 epoch: 38, train_loss: 0.9014, test_loss: 0.9255, test_f1: 0.4964
 epoch: 39, train_loss: 0.8927, test_loss: 0.9446, test_f1: 0.4943
 epoch: 40, train_loss: 0.8853, test_loss: 0.9424, test_f1: 0.5133
 epoch: 41, train_loss: 0.8850, test_loss: 0.9394, test_f1: 0.5029
 epoch: 42, train_loss: 0.8739, test_loss: 0.9353, test_f1: 0.5107
 epoch: 43, train_loss: 0.8624, test_loss: 0.9388, test_f1: 0.5105
 epoch: 44, train_loss: 0.8617, test_loss: 0.9415, test_f1: 0.5003
 epoch: 45, train_loss: 0.8539, test_loss: 0.9445, test_f1: 0.5150
 epoch: 46, train_loss: 0.8520, test_loss: 0.9323, test_f1: 0.5166
 epoch: 47, train_loss: 0.8503, test_loss: 0.9437, test_f1: 0.5239
 epoch: 48, train_loss: 0.8394, test_loss: 0.9386, test_f1: 0.4940
 epoch: 49, train_loss: 0.8302, test_loss: 0.9398, test_f1: 0.5116
 epoch: 50, train_loss: 0.8236, test_loss: 0.9417, test_f1: 0.5170
 epoch: 51, train_loss: 0.8210, test_loss: 0.9426, test_f1: 0.5051
 epoch: 52, train_loss: 0.8102, test_loss: 0.9458, test_f1: 0.5144
 epoch: 53, train_loss: 0.8160, test_loss: 0.9469, test_f1: 0.5177
 epoch: 54, train_loss: 0.8089, test_loss: 0.9393, test_f1: 0.5053
 epoch: 55, train_loss: 0.8037, test_loss: 0.9454, test_f1: 0.5145
 epoch: 56, train_loss: 0.7996, test_loss: 0.9489, test_f1: 0.4991
 epoch: 57, train_loss: 0.7999, test_loss: 0.9484, test_f1: 0.5273
 epoch: 58, train_loss: 0.8075, test_loss: 0.9471, test_f1: 0.5050
 epoch: 59, train_loss: 0.7985, test_loss: 0.9474, test_f1: 0.5033
 epoch: 60, train_loss: 0.7978, test_loss: 0.9426, test_f1: 0.5089
 epoch: 61, train_loss: 0.7851, test_loss: 0.9410, test_f1: 0.5083
 epoch: 62, train_loss: 0.7886, test_loss: 0.9479, test_f1: 0.5081
 epoch: 63, train_loss: 0.7819, test_loss: 0.9459, test_f1: 0.5107
 epoch: 64, train_loss: 0.7807, test_loss: 0.9466, test_f1: 0.5093
 epoch: 65, train_loss: 0.7718, test_loss: 0.9530, test_f1: 0.5078
 epoch: 66, train_loss: 0.7841, test_loss: 0.9498, test_f1: 0.4990
 epoch: 67, train_loss: 0.7741, test_loss: 0.9465, test_f1: 0.5064
 epoch: 68, train_loss: 0.7753, test_loss: 0.9470, test_f1: 0.5086
 epoch: 69, train_loss: 0.7650, test_loss: 0.9506, test_f1: 0.5021
 epoch: 70, train_loss: 0.7741, test_loss: 0.9656, test_f1: 0.5058
 epoch: 71, train_loss: 0.7589, test_loss: 0.9640, test_f1: 0.5055
 epoch: 72, train_loss: 0.7553, test_loss: 0.9555, test_f1: 0.5092
 epoch: 73, train_loss: 0.7474, test_loss: 0.9518, test_f1: 0.5105
 epoch: 74, train_loss: 0.7568, test_loss: 0.9546, test_f1: 0.5154
 epoch: 75, train_loss: 0.7599, test_loss: 0.9620, test_f1: 0.5183
 epoch: 76, train_loss: 0.7431, test_loss: 0.9600, test_f1: 0.5054
 epoch: 77, train_loss: 0.7505, test_loss: 0.9569, test_f1: 0.5102
 epoch: 78, train_loss: 0.7472, test_loss: 0.9617, test_f1: 0.5147
 epoch: 79, train_loss: 0.7513, test_loss: 0.9598, test_f1: 0.5154
 epoch: 80, train_loss: 0.7436, test_loss: 0.9651, test_f1: 0.5137
 epoch: 81, train_loss: 0.7413, test_loss: 0.9557, test_f1: 0.5181
 epoch: 82, train_loss: 0.7280, test_loss: 0.9646, test_f1: 0.5136
 epoch: 83, train_loss: 0.7384, test_loss: 0.9684, test_f1: 0.5154
 epoch: 84, train_loss: 0.7353, test_loss: 0.9660, test_f1: 0.5201
 epoch: 85, train_loss: 0.7303, test_loss: 0.9670, test_f1: 0.5177
 epoch: 86, train_loss: 0.7281, test_loss: 0.9647, test_f1: 0.5094
 epoch: 87, train_loss: 0.7322, test_loss: 0.9798, test_f1: 0.5160
 epoch: 88, train_loss: 0.7360, test_loss: 0.9686, test_f1: 0.5217
 epoch: 89, train_loss: 0.7118, test_loss: 0.9793, test_f1: 0.5060
 epoch: 90, train_loss: 0.7229, test_loss: 0.9756, test_f1: 0.5128
 epoch: 91, train_loss: 0.7237, test_loss: 0.9797, test_f1: 0.5233
 epoch: 92, train_loss: 0.7190, test_loss: 0.9858, test_f1: 0.5204
 epoch: 93, train_loss: 0.7209, test_loss: 0.9849, test_f1: 0.5167
 epoch: 94, train_loss: 0.7078, test_loss: 0.9877, test_f1: 0.5243
 epoch: 95, train_loss: 0.7136, test_loss: 0.9920, test_f1: 0.5279
 epoch: 96, train_loss: 0.7084, test_loss: 0.9801, test_f1: 0.5218
 epoch: 97, train_loss: 0.6998, test_loss: 0.9970, test_f1: 0.5147
 epoch: 98, train_loss: 0.6962, test_loss: 0.9843, test_f1: 0.5116
 epoch: 99, train_loss: 0.6967, test_loss: 0.9812, test_f1: 0.5267
##################ITERATION #2 ****************************************
 epoch: 0, train_loss: 1.3047, test_loss: 1.3054, test_f1: 0.2274
 epoch: 1, train_loss: 1.2366, test_loss: 1.2738, test_f1: 0.2555
 epoch: 2, train_loss: 1.2173, test_loss: 1.2288, test_f1: 0.2858
 epoch: 3, train_loss: 1.1935, test_loss: 1.1893, test_f1: 0.3767
 epoch: 4, train_loss: 1.1747, test_loss: 1.1596, test_f1: 0.4179
 epoch: 5, train_loss: 1.1570, test_loss: 1.1406, test_f1: 0.4508
 epoch: 6, train_loss: 1.1437, test_loss: 1.1250, test_f1: 0.4656
 epoch: 7, train_loss: 1.1269, test_loss: 1.1072, test_f1: 0.4493
 epoch: 8, train_loss: 1.1145, test_loss: 1.0924, test_f1: 0.4723
 epoch: 9, train_loss: 1.0984, test_loss: 1.0794, test_f1: 0.4658
 epoch: 10, train_loss: 1.0900, test_loss: 1.0706, test_f1: 0.4596
 epoch: 11, train_loss: 1.0745, test_loss: 1.0585, test_f1: 0.4690
 epoch: 12, train_loss: 1.0705, test_loss: 1.0512, test_f1: 0.4634
 epoch: 13, train_loss: 1.0579, test_loss: 1.0476, test_f1: 0.4691
 epoch: 14, train_loss: 1.0505, test_loss: 1.0348, test_f1: 0.4708
 epoch: 15, train_loss: 1.0415, test_loss: 1.0280, test_f1: 0.4681
 epoch: 16, train_loss: 1.0400, test_loss: 1.0215, test_f1: 0.4706
 epoch: 17, train_loss: 1.0230, test_loss: 1.0153, test_f1: 0.4775
 epoch: 18, train_loss: 1.0247, test_loss: 1.0128, test_f1: 0.4759
 epoch: 19, train_loss: 1.0124, test_loss: 1.0125, test_f1: 0.4797
 epoch: 20, train_loss: 1.0058, test_loss: 1.0008, test_f1: 0.4813
 epoch: 21, train_loss: 0.9943, test_loss: 1.0042, test_f1: 0.4866
 epoch: 22, train_loss: 0.9884, test_loss: 0.9971, test_f1: 0.4921
 epoch: 23, train_loss: 0.9787, test_loss: 0.9894, test_f1: 0.4755
 epoch: 24, train_loss: 0.9776, test_loss: 0.9861, test_f1: 0.4950
 epoch: 25, train_loss: 0.9692, test_loss: 0.9807, test_f1: 0.4935
 epoch: 26, train_loss: 0.9581, test_loss: 0.9839, test_f1: 0.4972
 epoch: 27, train_loss: 0.9560, test_loss: 0.9846, test_f1: 0.4925
 epoch: 28, train_loss: 0.9511, test_loss: 0.9729, test_f1: 0.4990
 epoch: 29, train_loss: 0.9413, test_loss: 0.9812, test_f1: 0.4873
 epoch: 30, train_loss: 0.9359, test_loss: 0.9714, test_f1: 0.4935
 epoch: 31, train_loss: 0.9265, test_loss: 0.9771, test_f1: 0.4964
 epoch: 32, train_loss: 0.9283, test_loss: 0.9797, test_f1: 0.4875
 epoch: 33, train_loss: 0.9157, test_loss: 0.9563, test_f1: 0.5003
 epoch: 34, train_loss: 0.9020, test_loss: 0.9794, test_f1: 0.4946
 epoch: 35, train_loss: 0.9067, test_loss: 0.9534, test_f1: 0.5056
 epoch: 36, train_loss: 0.8997, test_loss: 0.9746, test_f1: 0.4971
 epoch: 37, train_loss: 0.9042, test_loss: 0.9569, test_f1: 0.5092
 epoch: 38, train_loss: 0.8922, test_loss: 0.9546, test_f1: 0.4879
 epoch: 39, train_loss: 0.8811, test_loss: 0.9647, test_f1: 0.5000
 epoch: 40, train_loss: 0.8795, test_loss: 0.9546, test_f1: 0.5001
 epoch: 41, train_loss: 0.8742, test_loss: 0.9566, test_f1: 0.5027
 epoch: 42, train_loss: 0.8657, test_loss: 0.9599, test_f1: 0.4985
 epoch: 43, train_loss: 0.8566, test_loss: 0.9591, test_f1: 0.4909
 epoch: 44, train_loss: 0.8529, test_loss: 0.9602, test_f1: 0.4926
 epoch: 45, train_loss: 0.8431, test_loss: 0.9514, test_f1: 0.5188
 epoch: 46, train_loss: 0.8557, test_loss: 0.9618, test_f1: 0.4970
 epoch: 47, train_loss: 0.8395, test_loss: 0.9864, test_f1: 0.4843
 epoch: 48, train_loss: 0.8363, test_loss: 0.9715, test_f1: 0.4940
 epoch: 49, train_loss: 0.8240, test_loss: 0.9701, test_f1: 0.5041
 epoch: 50, train_loss: 0.8234, test_loss: 0.9662, test_f1: 0.5028
 epoch: 51, train_loss: 0.8272, test_loss: 0.9731, test_f1: 0.5006
 epoch: 52, train_loss: 0.8112, test_loss: 0.9774, test_f1: 0.4996
 epoch: 53, train_loss: 0.8126, test_loss: 0.9720, test_f1: 0.4989
 epoch: 54, train_loss: 0.8051, test_loss: 0.9706, test_f1: 0.5057
 epoch: 55, train_loss: 0.7983, test_loss: 0.9796, test_f1: 0.4997
 epoch: 56, train_loss: 0.8061, test_loss: 0.9795, test_f1: 0.4955
 epoch: 57, train_loss: 0.7929, test_loss: 0.9869, test_f1: 0.4936
 epoch: 58, train_loss: 0.7918, test_loss: 0.9916, test_f1: 0.4896
 epoch: 59, train_loss: 0.7913, test_loss: 0.9931, test_f1: 0.4935
 epoch: 60, train_loss: 0.7905, test_loss: 0.9994, test_f1: 0.4864
 epoch: 61, train_loss: 0.7870, test_loss: 1.0004, test_f1: 0.4879
 epoch: 62, train_loss: 0.7820, test_loss: 1.0013, test_f1: 0.4891
 epoch: 63, train_loss: 0.7810, test_loss: 0.9975, test_f1: 0.4922
 epoch: 64, train_loss: 0.7834, test_loss: 1.0139, test_f1: 0.4637
 epoch: 65, train_loss: 0.7779, test_loss: 1.0142, test_f1: 0.4909
 epoch: 66, train_loss: 0.7818, test_loss: 1.0117, test_f1: 0.4928
 epoch: 67, train_loss: 0.7816, test_loss: 1.0075, test_f1: 0.4828
 epoch: 68, train_loss: 0.7691, test_loss: 1.0161, test_f1: 0.4571
 epoch: 69, train_loss: 0.7646, test_loss: 1.0032, test_f1: 0.4839
 epoch: 70, train_loss: 0.7699, test_loss: 1.0080, test_f1: 0.4831
 epoch: 71, train_loss: 0.7609, test_loss: 1.0167, test_f1: 0.4785
 epoch: 72, train_loss: 0.7505, test_loss: 1.0185, test_f1: 0.4666
 epoch: 73, train_loss: 0.7607, test_loss: 1.0296, test_f1: 0.4768
 epoch: 74, train_loss: 0.7567, test_loss: 1.0137, test_f1: 0.4741
 epoch: 75, train_loss: 0.7506, test_loss: 1.0305, test_f1: 0.4652
 epoch: 76, train_loss: 0.7460, test_loss: 1.0301, test_f1: 0.4843
 epoch: 77, train_loss: 0.7472, test_loss: 1.0303, test_f1: 0.4885
 epoch: 78, train_loss: 0.7428, test_loss: 1.0408, test_f1: 0.4647
 epoch: 79, train_loss: 0.7405, test_loss: 1.0288, test_f1: 0.4822
 epoch: 80, train_loss: 0.7320, test_loss: 1.0282, test_f1: 0.4752
 epoch: 81, train_loss: 0.7379, test_loss: 1.0390, test_f1: 0.4783
 epoch: 82, train_loss: 0.7357, test_loss: 1.0380, test_f1: 0.4741
 epoch: 83, train_loss: 0.7317, test_loss: 1.0459, test_f1: 0.4703
 epoch: 84, train_loss: 0.7256, test_loss: 1.0366, test_f1: 0.4645
 epoch: 85, train_loss: 0.7245, test_loss: 1.0368, test_f1: 0.4686
 epoch: 86, train_loss: 0.7294, test_loss: 1.0504, test_f1: 0.4713
 epoch: 87, train_loss: 0.7211, test_loss: 1.0563, test_f1: 0.4735
 epoch: 88, train_loss: 0.7194, test_loss: 1.0377, test_f1: 0.4841
 epoch: 89, train_loss: 0.7115, test_loss: 1.0728, test_f1: 0.4740
 epoch: 90, train_loss: 0.7133, test_loss: 1.0629, test_f1: 0.4702
 epoch: 91, train_loss: 0.7191, test_loss: 1.0733, test_f1: 0.4719
 epoch: 92, train_loss: 0.7244, test_loss: 1.0649, test_f1: 0.4711
 epoch: 93, train_loss: 0.7025, test_loss: 1.0680, test_f1: 0.4778
 epoch: 94, train_loss: 0.7075, test_loss: 1.0551, test_f1: 0.4749
 epoch: 95, train_loss: 0.7010, test_loss: 1.0817, test_f1: 0.4706
 epoch: 96, train_loss: 0.7092, test_loss: 1.0587, test_f1: 0.4912
 epoch: 97, train_loss: 0.7091, test_loss: 1.0659, test_f1: 0.4679
 epoch: 98, train_loss: 0.7027, test_loss: 1.0710, test_f1: 0.4772
 epoch: 99, train_loss: 0.7014, test_loss: 1.0963, test_f1: 0.4569
##################ITERATION #3 ****************************************
 epoch: 0, train_loss: 1.3265, test_loss: 1.3013, test_f1: 0.2274
 epoch: 1, train_loss: 1.2416, test_loss: 1.2573, test_f1: 0.2859
 epoch: 2, train_loss: 1.2126, test_loss: 1.2048, test_f1: 0.3586
 epoch: 3, train_loss: 1.1860, test_loss: 1.1655, test_f1: 0.4191
 epoch: 4, train_loss: 1.1724, test_loss: 1.1419, test_f1: 0.4415
 epoch: 5, train_loss: 1.1501, test_loss: 1.1270, test_f1: 0.4515
 epoch: 6, train_loss: 1.1371, test_loss: 1.1154, test_f1: 0.4577
 epoch: 7, train_loss: 1.1269, test_loss: 1.1047, test_f1: 0.4630
 epoch: 8, train_loss: 1.1074, test_loss: 1.0971, test_f1: 0.4612
 epoch: 9, train_loss: 1.1081, test_loss: 1.0947, test_f1: 0.4598
 epoch: 10, train_loss: 1.0850, test_loss: 1.0820, test_f1: 0.4657
 epoch: 11, train_loss: 1.0797, test_loss: 1.0733, test_f1: 0.4638
 epoch: 12, train_loss: 1.0758, test_loss: 1.0643, test_f1: 0.4532
 epoch: 13, train_loss: 1.0606, test_loss: 1.0645, test_f1: 0.4528
 epoch: 14, train_loss: 1.0478, test_loss: 1.0538, test_f1: 0.4646
 epoch: 15, train_loss: 1.0439, test_loss: 1.0440, test_f1: 0.4689
 epoch: 16, train_loss: 1.0306, test_loss: 1.0370, test_f1: 0.4610
 epoch: 17, train_loss: 1.0172, test_loss: 1.0303, test_f1: 0.4709
 epoch: 18, train_loss: 1.0170, test_loss: 1.0217, test_f1: 0.4722
 epoch: 19, train_loss: 1.0101, test_loss: 1.0118, test_f1: 0.4707
 epoch: 20, train_loss: 0.9950, test_loss: 1.0057, test_f1: 0.4832
 epoch: 21, train_loss: 0.9900, test_loss: 1.0081, test_f1: 0.4606
 epoch: 22, train_loss: 0.9885, test_loss: 0.9985, test_f1: 0.4729
 epoch: 23, train_loss: 0.9737, test_loss: 0.9980, test_f1: 0.4804
 epoch: 24, train_loss: 0.9749, test_loss: 0.9935, test_f1: 0.4834
 epoch: 25, train_loss: 0.9606, test_loss: 0.9814, test_f1: 0.4924
 epoch: 26, train_loss: 0.9575, test_loss: 0.9842, test_f1: 0.4892
 epoch: 27, train_loss: 0.9432, test_loss: 0.9827, test_f1: 0.4883
 epoch: 28, train_loss: 0.9346, test_loss: 0.9844, test_f1: 0.4880
 epoch: 29, train_loss: 0.9268, test_loss: 0.9769, test_f1: 0.4966
 epoch: 30, train_loss: 0.9257, test_loss: 0.9783, test_f1: 0.4979
 epoch: 31, train_loss: 0.9242, test_loss: 0.9710, test_f1: 0.5051
 epoch: 32, train_loss: 0.9117, test_loss: 0.9699, test_f1: 0.5001
 epoch: 33, train_loss: 0.9073, test_loss: 0.9619, test_f1: 0.5030
 epoch: 34, train_loss: 0.9006, test_loss: 0.9733, test_f1: 0.5021
 epoch: 35, train_loss: 0.8954, test_loss: 0.9724, test_f1: 0.5025
 epoch: 36, train_loss: 0.8888, test_loss: 0.9655, test_f1: 0.5115
 epoch: 37, train_loss: 0.8851, test_loss: 0.9736, test_f1: 0.5086
 epoch: 38, train_loss: 0.8766, test_loss: 0.9794, test_f1: 0.5064
 epoch: 39, train_loss: 0.8723, test_loss: 0.9670, test_f1: 0.5247
 epoch: 40, train_loss: 0.8587, test_loss: 0.9659, test_f1: 0.5114
 epoch: 41, train_loss: 0.8606, test_loss: 0.9906, test_f1: 0.5144
 epoch: 42, train_loss: 0.8512, test_loss: 0.9962, test_f1: 0.5084
 epoch: 43, train_loss: 0.8523, test_loss: 0.9840, test_f1: 0.5029
 epoch: 44, train_loss: 0.8493, test_loss: 0.9771, test_f1: 0.5109
 epoch: 45, train_loss: 0.8435, test_loss: 1.0080, test_f1: 0.5043
 epoch: 46, train_loss: 0.8332, test_loss: 0.9949, test_f1: 0.5152
 epoch: 47, train_loss: 0.8319, test_loss: 1.0018, test_f1: 0.5086
 epoch: 48, train_loss: 0.8202, test_loss: 1.0023, test_f1: 0.5092
 epoch: 49, train_loss: 0.8245, test_loss: 1.0074, test_f1: 0.5142
 epoch: 50, train_loss: 0.8214, test_loss: 1.0132, test_f1: 0.5120
 epoch: 51, train_loss: 0.8063, test_loss: 1.0078, test_f1: 0.5159
 epoch: 52, train_loss: 0.8039, test_loss: 1.0184, test_f1: 0.5117
 epoch: 53, train_loss: 0.7968, test_loss: 1.0262, test_f1: 0.5146
 epoch: 54, train_loss: 0.7972, test_loss: 1.0106, test_f1: 0.5251
 epoch: 55, train_loss: 0.8028, test_loss: 1.0121, test_f1: 0.5160
 epoch: 56, train_loss: 0.7915, test_loss: 1.0190, test_f1: 0.5152
 epoch: 57, train_loss: 0.7907, test_loss: 1.0268, test_f1: 0.5221
 epoch: 58, train_loss: 0.7828, test_loss: 1.0280, test_f1: 0.5277
 epoch: 59, train_loss: 0.7813, test_loss: 1.0366, test_f1: 0.5230
 epoch: 60, train_loss: 0.7826, test_loss: 1.0408, test_f1: 0.5201
 epoch: 61, train_loss: 0.7800, test_loss: 1.0227, test_f1: 0.5289
 epoch: 62, train_loss: 0.7842, test_loss: 1.0420, test_f1: 0.5269
 epoch: 63, train_loss: 0.7740, test_loss: 1.0454, test_f1: 0.5291
 epoch: 64, train_loss: 0.7755, test_loss: 1.0582, test_f1: 0.5230
 epoch: 65, train_loss: 0.7647, test_loss: 1.0450, test_f1: 0.5190
 epoch: 66, train_loss: 0.7731, test_loss: 1.0515, test_f1: 0.5274
 epoch: 67, train_loss: 0.7689, test_loss: 1.0569, test_f1: 0.5252
 epoch: 68, train_loss: 0.7647, test_loss: 1.0500, test_f1: 0.5352
 epoch: 69, train_loss: 0.7614, test_loss: 1.0627, test_f1: 0.5373
 epoch: 70, train_loss: 0.7531, test_loss: 1.0806, test_f1: 0.5226
 epoch: 71, train_loss: 0.7584, test_loss: 1.0735, test_f1: 0.5215
 epoch: 72, train_loss: 0.7465, test_loss: 1.0871, test_f1: 0.5137
 epoch: 73, train_loss: 0.7491, test_loss: 1.0843, test_f1: 0.5236
 epoch: 74, train_loss: 0.7517, test_loss: 1.0838, test_f1: 0.5271
 epoch: 75, train_loss: 0.7526, test_loss: 1.1059, test_f1: 0.5240
 epoch: 76, train_loss: 0.7478, test_loss: 1.1173, test_f1: 0.5043
 epoch: 77, train_loss: 0.7452, test_loss: 1.0807, test_f1: 0.5334
 epoch: 78, train_loss: 0.7416, test_loss: 1.0917, test_f1: 0.5348
 epoch: 79, train_loss: 0.7423, test_loss: 1.0877, test_f1: 0.5364
 epoch: 80, train_loss: 0.7417, test_loss: 1.0908, test_f1: 0.5348
 epoch: 81, train_loss: 0.7357, test_loss: 1.1051, test_f1: 0.5350
 epoch: 82, train_loss: 0.7409, test_loss: 1.1006, test_f1: 0.5281
 epoch: 83, train_loss: 0.7369, test_loss: 1.0903, test_f1: 0.5296
 epoch: 84, train_loss: 0.7294, test_loss: 1.1088, test_f1: 0.5354
 epoch: 85, train_loss: 0.7287, test_loss: 1.1207, test_f1: 0.5195
 epoch: 86, train_loss: 0.7273, test_loss: 1.1114, test_f1: 0.5366
 epoch: 87, train_loss: 0.7256, test_loss: 1.1132, test_f1: 0.5378
 epoch: 88, train_loss: 0.7123, test_loss: 1.1103, test_f1: 0.5440
 epoch: 89, train_loss: 0.7321, test_loss: 1.1265, test_f1: 0.5366
 epoch: 90, train_loss: 0.7120, test_loss: 1.1292, test_f1: 0.5378
 epoch: 91, train_loss: 0.7178, test_loss: 1.1216, test_f1: 0.5447
 epoch: 92, train_loss: 0.7234, test_loss: 1.1478, test_f1: 0.5160
 epoch: 93, train_loss: 0.7038, test_loss: 1.1279, test_f1: 0.5454
 epoch: 94, train_loss: 0.7046, test_loss: 1.1481, test_f1: 0.5174
 epoch: 95, train_loss: 0.7018, test_loss: 1.1355, test_f1: 0.5347
 epoch: 96, train_loss: 0.6990, test_loss: 1.1424, test_f1: 0.5426
 epoch: 97, train_loss: 0.7035, test_loss: 1.1329, test_f1: 0.5426
 epoch: 98, train_loss: 0.7079, test_loss: 1.1745, test_f1: 0.5145
 epoch: 99, train_loss: 0.7001, test_loss: 1.1516, test_f1: 0.5409
##################ITERATION #4 ****************************************
 epoch: 0, train_loss: 1.3314, test_loss: 1.2915, test_f1: 0.2301
 epoch: 1, train_loss: 1.2418, test_loss: 1.2553, test_f1: 0.3221
 epoch: 2, train_loss: 1.2070, test_loss: 1.2156, test_f1: 0.3952
 epoch: 3, train_loss: 1.1899, test_loss: 1.1746, test_f1: 0.4267
 epoch: 4, train_loss: 1.1658, test_loss: 1.1407, test_f1: 0.4432
 epoch: 5, train_loss: 1.1475, test_loss: 1.1208, test_f1: 0.4567
 epoch: 6, train_loss: 1.1282, test_loss: 1.1047, test_f1: 0.4593
 epoch: 7, train_loss: 1.1300, test_loss: 1.0920, test_f1: 0.4596
 epoch: 8, train_loss: 1.1047, test_loss: 1.0818, test_f1: 0.4625
 epoch: 9, train_loss: 1.1022, test_loss: 1.0726, test_f1: 0.4667
 epoch: 10, train_loss: 1.0881, test_loss: 1.0626, test_f1: 0.4639
 epoch: 11, train_loss: 1.0856, test_loss: 1.0483, test_f1: 0.4690
 epoch: 12, train_loss: 1.0623, test_loss: 1.0432, test_f1: 0.4588
 epoch: 13, train_loss: 1.0514, test_loss: 1.0415, test_f1: 0.4578
 epoch: 14, train_loss: 1.0421, test_loss: 1.0382, test_f1: 0.4616
 epoch: 15, train_loss: 1.0386, test_loss: 1.0251, test_f1: 0.4520
 epoch: 16, train_loss: 1.0315, test_loss: 1.0185, test_f1: 0.4664
 epoch: 17, train_loss: 1.0241, test_loss: 1.0127, test_f1: 0.4437
 epoch: 18, train_loss: 1.0158, test_loss: 1.0126, test_f1: 0.4471
 epoch: 19, train_loss: 0.9998, test_loss: 1.0027, test_f1: 0.4554
 epoch: 20, train_loss: 0.9999, test_loss: 1.0046, test_f1: 0.4418
 epoch: 21, train_loss: 0.9946, test_loss: 0.9929, test_f1: 0.4645
 epoch: 22, train_loss: 0.9940, test_loss: 0.9926, test_f1: 0.4706
 epoch: 23, train_loss: 0.9811, test_loss: 0.9880, test_f1: 0.4770
 epoch: 24, train_loss: 0.9786, test_loss: 0.9847, test_f1: 0.4764
 epoch: 25, train_loss: 0.9587, test_loss: 0.9872, test_f1: 0.4614
 epoch: 26, train_loss: 0.9538, test_loss: 0.9784, test_f1: 0.4820
 epoch: 27, train_loss: 0.9591, test_loss: 0.9782, test_f1: 0.4792
 epoch: 28, train_loss: 0.9551, test_loss: 0.9758, test_f1: 0.4792
 epoch: 29, train_loss: 0.9466, test_loss: 0.9864, test_f1: 0.4688
 epoch: 30, train_loss: 0.9431, test_loss: 0.9728, test_f1: 0.4843
 epoch: 31, train_loss: 0.9349, test_loss: 0.9743, test_f1: 0.4859
 epoch: 32, train_loss: 0.9297, test_loss: 0.9817, test_f1: 0.4640
 epoch: 33, train_loss: 0.9334, test_loss: 0.9768, test_f1: 0.4699
 epoch: 34, train_loss: 0.9160, test_loss: 0.9694, test_f1: 0.4597
 epoch: 35, train_loss: 0.9143, test_loss: 0.9876, test_f1: 0.4764
 epoch: 36, train_loss: 0.9132, test_loss: 0.9610, test_f1: 0.4879
 epoch: 37, train_loss: 0.8946, test_loss: 0.9836, test_f1: 0.4810
 epoch: 38, train_loss: 0.9011, test_loss: 0.9771, test_f1: 0.4894
 epoch: 39, train_loss: 0.8820, test_loss: 0.9631, test_f1: 0.4901
 epoch: 40, train_loss: 0.8783, test_loss: 0.9839, test_f1: 0.4930
 epoch: 41, train_loss: 0.8747, test_loss: 0.9783, test_f1: 0.4887
 epoch: 42, train_loss: 0.8715, test_loss: 0.9796, test_f1: 0.5009
 epoch: 43, train_loss: 0.8632, test_loss: 0.9754, test_f1: 0.4897
 epoch: 44, train_loss: 0.8648, test_loss: 0.9887, test_f1: 0.4876
 epoch: 45, train_loss: 0.8542, test_loss: 0.9893, test_f1: 0.4648
 epoch: 46, train_loss: 0.8586, test_loss: 0.9697, test_f1: 0.4852
 epoch: 47, train_loss: 0.8446, test_loss: 0.9896, test_f1: 0.4832
 epoch: 48, train_loss: 0.8389, test_loss: 0.9885, test_f1: 0.4889
 epoch: 49, train_loss: 0.8468, test_loss: 0.9915, test_f1: 0.4954
 epoch: 50, train_loss: 0.8291, test_loss: 0.9868, test_f1: 0.4905
 epoch: 51, train_loss: 0.8207, test_loss: 0.9824, test_f1: 0.4893
 epoch: 52, train_loss: 0.8145, test_loss: 0.9818, test_f1: 0.4926
 epoch: 53, train_loss: 0.8124, test_loss: 0.9917, test_f1: 0.4829
 epoch: 54, train_loss: 0.8099, test_loss: 0.9946, test_f1: 0.4862
 epoch: 55, train_loss: 0.8021, test_loss: 0.9942, test_f1: 0.4904
 epoch: 56, train_loss: 0.7986, test_loss: 1.0021, test_f1: 0.4873
 epoch: 57, train_loss: 0.8105, test_loss: 0.9969, test_f1: 0.4883
 epoch: 58, train_loss: 0.7966, test_loss: 1.0089, test_f1: 0.4829
 epoch: 59, train_loss: 0.8015, test_loss: 1.0049, test_f1: 0.4790
 epoch: 60, train_loss: 0.7994, test_loss: 1.0102, test_f1: 0.4860
 epoch: 61, train_loss: 0.7899, test_loss: 1.0090, test_f1: 0.4836
 epoch: 62, train_loss: 0.7965, test_loss: 1.0057, test_f1: 0.4838
 epoch: 63, train_loss: 0.7877, test_loss: 1.0068, test_f1: 0.4833
 epoch: 64, train_loss: 0.7809, test_loss: 1.0090, test_f1: 0.4871
 epoch: 65, train_loss: 0.7820, test_loss: 1.0111, test_f1: 0.4928
 epoch: 66, train_loss: 0.7786, test_loss: 1.0115, test_f1: 0.4884
 epoch: 67, train_loss: 0.7692, test_loss: 1.0115, test_f1: 0.4875
 epoch: 68, train_loss: 0.7761, test_loss: 1.0154, test_f1: 0.4866
 epoch: 69, train_loss: 0.7730, test_loss: 1.0197, test_f1: 0.4821
 epoch: 70, train_loss: 0.7716, test_loss: 1.0170, test_f1: 0.4798
 epoch: 71, train_loss: 0.7644, test_loss: 1.0199, test_f1: 0.4821
 epoch: 72, train_loss: 0.7632, test_loss: 1.0237, test_f1: 0.4866
 epoch: 73, train_loss: 0.7676, test_loss: 1.0292, test_f1: 0.4766
 epoch: 74, train_loss: 0.7678, test_loss: 1.0267, test_f1: 0.4878
 epoch: 75, train_loss: 0.7648, test_loss: 1.0200, test_f1: 0.4848
 epoch: 76, train_loss: 0.7639, test_loss: 1.0319, test_f1: 0.4800
 epoch: 77, train_loss: 0.7537, test_loss: 1.0348, test_f1: 0.4839
 epoch: 78, train_loss: 0.7608, test_loss: 1.0290, test_f1: 0.4906
 epoch: 79, train_loss: 0.7446, test_loss: 1.0393, test_f1: 0.4890
 epoch: 80, train_loss: 0.7424, test_loss: 1.0376, test_f1: 0.4861
 epoch: 81, train_loss: 0.7524, test_loss: 1.0423, test_f1: 0.4928
 epoch: 82, train_loss: 0.7497, test_loss: 1.0343, test_f1: 0.4960
 epoch: 83, train_loss: 0.7416, test_loss: 1.0446, test_f1: 0.4942
 epoch: 84, train_loss: 0.7491, test_loss: 1.0565, test_f1: 0.4816
 epoch: 85, train_loss: 0.7389, test_loss: 1.0515, test_f1: 0.4966
 epoch: 86, train_loss: 0.7284, test_loss: 1.0569, test_f1: 0.4964
 epoch: 87, train_loss: 0.7356, test_loss: 1.0602, test_f1: 0.4893
 epoch: 88, train_loss: 0.7277, test_loss: 1.0587, test_f1: 0.4948
 epoch: 89, train_loss: 0.7267, test_loss: 1.0632, test_f1: 0.5018
 epoch: 90, train_loss: 0.7295, test_loss: 1.0741, test_f1: 0.4965
 epoch: 91, train_loss: 0.7261, test_loss: 1.0812, test_f1: 0.4833
 epoch: 92, train_loss: 0.7215, test_loss: 1.0685, test_f1: 0.4886
 epoch: 93, train_loss: 0.7183, test_loss: 1.0669, test_f1: 0.4897
 epoch: 94, train_loss: 0.7130, test_loss: 1.0802, test_f1: 0.4924
 epoch: 95, train_loss: 0.7174, test_loss: 1.0746, test_f1: 0.5045
 epoch: 96, train_loss: 0.7082, test_loss: 1.0798, test_f1: 0.5075
 epoch: 97, train_loss: 0.7155, test_loss: 1.0810, test_f1: 0.5012
 epoch: 98, train_loss: 0.7041, test_loss: 1.0726, test_f1: 0.5060
 epoch: 99, train_loss: 0.7129, test_loss: 1.0749, test_f1: 0.5005
##################ITERATION #5 ****************************************
 epoch: 0, train_loss: 1.2992, test_loss: 1.2842, test_f1: 0.2274
 epoch: 1, train_loss: 1.2199, test_loss: 1.2542, test_f1: 0.2266
 epoch: 2, train_loss: 1.1961, test_loss: 1.2093, test_f1: 0.2832
 epoch: 3, train_loss: 1.1751, test_loss: 1.1606, test_f1: 0.4218
 epoch: 4, train_loss: 1.1600, test_loss: 1.1265, test_f1: 0.4602
 epoch: 5, train_loss: 1.1396, test_loss: 1.0985, test_f1: 0.4729
 epoch: 6, train_loss: 1.1287, test_loss: 1.0790, test_f1: 0.4655
 epoch: 7, train_loss: 1.1196, test_loss: 1.0698, test_f1: 0.4711
 epoch: 8, train_loss: 1.1110, test_loss: 1.0588, test_f1: 0.4735
 epoch: 9, train_loss: 1.0892, test_loss: 1.0450, test_f1: 0.4720
 epoch: 10, train_loss: 1.0759, test_loss: 1.0367, test_f1: 0.4738
 epoch: 11, train_loss: 1.0672, test_loss: 1.0313, test_f1: 0.4722
 epoch: 12, train_loss: 1.0519, test_loss: 1.0254, test_f1: 0.4740
 epoch: 13, train_loss: 1.0401, test_loss: 1.0172, test_f1: 0.4658
 epoch: 14, train_loss: 1.0374, test_loss: 1.0069, test_f1: 0.4776
 epoch: 15, train_loss: 1.0327, test_loss: 1.0023, test_f1: 0.4713
 epoch: 16, train_loss: 1.0199, test_loss: 0.9992, test_f1: 0.4810
 epoch: 17, train_loss: 1.0131, test_loss: 0.9991, test_f1: 0.4720
 epoch: 18, train_loss: 1.0049, test_loss: 0.9907, test_f1: 0.4803
 epoch: 19, train_loss: 0.9973, test_loss: 0.9795, test_f1: 0.4847
 epoch: 20, train_loss: 0.9867, test_loss: 0.9827, test_f1: 0.4912
 epoch: 21, train_loss: 0.9774, test_loss: 0.9759, test_f1: 0.4858
 epoch: 22, train_loss: 0.9758, test_loss: 0.9691, test_f1: 0.4998
 epoch: 23, train_loss: 0.9740, test_loss: 0.9632, test_f1: 0.4996
 epoch: 24, train_loss: 0.9594, test_loss: 0.9636, test_f1: 0.4936
 epoch: 25, train_loss: 0.9518, test_loss: 0.9569, test_f1: 0.4957
 epoch: 26, train_loss: 0.9510, test_loss: 0.9592, test_f1: 0.4893
 epoch: 27, train_loss: 0.9374, test_loss: 0.9610, test_f1: 0.4975
 epoch: 28, train_loss: 0.9373, test_loss: 0.9507, test_f1: 0.5035
 epoch: 29, train_loss: 0.9230, test_loss: 0.9486, test_f1: 0.5034
 epoch: 30, train_loss: 0.9156, test_loss: 0.9435, test_f1: 0.5025
 epoch: 31, train_loss: 0.9082, test_loss: 0.9511, test_f1: 0.5021
 epoch: 32, train_loss: 0.9117, test_loss: 0.9618, test_f1: 0.4986
 epoch: 33, train_loss: 0.9071, test_loss: 0.9357, test_f1: 0.5010
 epoch: 34, train_loss: 0.8952, test_loss: 0.9383, test_f1: 0.5187
 epoch: 35, train_loss: 0.8951, test_loss: 0.9526, test_f1: 0.5116
 epoch: 36, train_loss: 0.8908, test_loss: 0.9551, test_f1: 0.5083
 epoch: 37, train_loss: 0.8911, test_loss: 0.9538, test_f1: 0.4860
 epoch: 38, train_loss: 0.8754, test_loss: 0.9448, test_f1: 0.5023
 epoch: 39, train_loss: 0.8706, test_loss: 0.9704, test_f1: 0.5062
 epoch: 40, train_loss: 0.8670, test_loss: 0.9544, test_f1: 0.5109
 epoch: 41, train_loss: 0.8620, test_loss: 0.9498, test_f1: 0.5077
 epoch: 42, train_loss: 0.8611, test_loss: 0.9585, test_f1: 0.5065
 epoch: 43, train_loss: 0.8602, test_loss: 0.9635, test_f1: 0.5044
 epoch: 44, train_loss: 0.8444, test_loss: 0.9649, test_f1: 0.5228
 epoch: 45, train_loss: 0.8479, test_loss: 0.9600, test_f1: 0.5087
 epoch: 46, train_loss: 0.8419, test_loss: 0.9553, test_f1: 0.5102
 epoch: 47, train_loss: 0.8446, test_loss: 0.9666, test_f1: 0.5152
 epoch: 48, train_loss: 0.8333, test_loss: 0.9674, test_f1: 0.5165
 epoch: 49, train_loss: 0.8248, test_loss: 0.9785, test_f1: 0.4981
 epoch: 50, train_loss: 0.8196, test_loss: 0.9838, test_f1: 0.5131
 epoch: 51, train_loss: 0.8149, test_loss: 0.9776, test_f1: 0.5208
 epoch: 52, train_loss: 0.8100, test_loss: 0.9729, test_f1: 0.5256
 epoch: 53, train_loss: 0.8087, test_loss: 0.9681, test_f1: 0.5240
 epoch: 54, train_loss: 0.8035, test_loss: 0.9760, test_f1: 0.5241
 epoch: 55, train_loss: 0.8039, test_loss: 0.9736, test_f1: 0.5332
 epoch: 56, train_loss: 0.7949, test_loss: 0.9932, test_f1: 0.4932
 epoch: 57, train_loss: 0.7944, test_loss: 0.9917, test_f1: 0.4979
 epoch: 58, train_loss: 0.7978, test_loss: 0.9908, test_f1: 0.4974
 epoch: 59, train_loss: 0.7858, test_loss: 1.0026, test_f1: 0.4920
 epoch: 60, train_loss: 0.7880, test_loss: 0.9882, test_f1: 0.5226
 epoch: 61, train_loss: 0.7915, test_loss: 0.9996, test_f1: 0.4959
 epoch: 62, train_loss: 0.7830, test_loss: 0.9959, test_f1: 0.5265
 epoch: 63, train_loss: 0.7785, test_loss: 1.0022, test_f1: 0.5019
 epoch: 64, train_loss: 0.7737, test_loss: 0.9971, test_f1: 0.5012
 epoch: 65, train_loss: 0.7756, test_loss: 0.9910, test_f1: 0.5171
 epoch: 66, train_loss: 0.7801, test_loss: 0.9913, test_f1: 0.5060
 epoch: 67, train_loss: 0.7728, test_loss: 1.0181, test_f1: 0.5066
 epoch: 68, train_loss: 0.7628, test_loss: 1.0223, test_f1: 0.4804
 epoch: 69, train_loss: 0.7570, test_loss: 1.0070, test_f1: 0.5107
 epoch: 70, train_loss: 0.7588, test_loss: 1.0099, test_f1: 0.5135
 epoch: 71, train_loss: 0.7676, test_loss: 1.0293, test_f1: 0.5002
 epoch: 72, train_loss: 0.7640, test_loss: 1.0147, test_f1: 0.5191
 epoch: 73, train_loss: 0.7534, test_loss: 1.0215, test_f1: 0.5105
 epoch: 74, train_loss: 0.7561, test_loss: 1.0185, test_f1: 0.5068
 epoch: 75, train_loss: 0.7483, test_loss: 1.0187, test_f1: 0.5163
 epoch: 76, train_loss: 0.7523, test_loss: 1.0286, test_f1: 0.5262
 epoch: 77, train_loss: 0.7418, test_loss: 1.0333, test_f1: 0.5155
 epoch: 78, train_loss: 0.7509, test_loss: 1.0588, test_f1: 0.4847
 epoch: 79, train_loss: 0.7453, test_loss: 1.0625, test_f1: 0.5010
 epoch: 80, train_loss: 0.7437, test_loss: 1.0261, test_f1: 0.5280
 epoch: 81, train_loss: 0.7341, test_loss: 1.0542, test_f1: 0.5175
 epoch: 82, train_loss: 0.7421, test_loss: 1.0381, test_f1: 0.5093
 epoch: 83, train_loss: 0.7293, test_loss: 1.0437, test_f1: 0.5207
 epoch: 84, train_loss: 0.7244, test_loss: 1.0452, test_f1: 0.5183
 epoch: 85, train_loss: 0.7209, test_loss: 1.0743, test_f1: 0.5000
 epoch: 86, train_loss: 0.7190, test_loss: 1.0699, test_f1: 0.4986
 epoch: 87, train_loss: 0.7241, test_loss: 1.0623, test_f1: 0.5021
 epoch: 88, train_loss: 0.7283, test_loss: 1.0576, test_f1: 0.4962
 epoch: 89, train_loss: 0.7130, test_loss: 1.0616, test_f1: 0.5111
 epoch: 90, train_loss: 0.7189, test_loss: 1.1024, test_f1: 0.5021
 epoch: 91, train_loss: 0.7257, test_loss: 1.0900, test_f1: 0.5045
 epoch: 92, train_loss: 0.7169, test_loss: 1.0857, test_f1: 0.5087
 epoch: 93, train_loss: 0.7166, test_loss: 1.0729, test_f1: 0.5220
 epoch: 94, train_loss: 0.7064, test_loss: 1.0810, test_f1: 0.5115
 epoch: 95, train_loss: 0.6954, test_loss: 1.1302, test_f1: 0.4862
 epoch: 96, train_loss: 0.6936, test_loss: 1.1032, test_f1: 0.4970
 epoch: 97, train_loss: 0.7048, test_loss: 1.1680, test_f1: 0.4959
 epoch: 98, train_loss: 0.7035, test_loss: 1.1350, test_f1: 0.4943
 epoch: 99, train_loss: 0.7052, test_loss: 1.1053, test_f1: 0.5161
##################ITERATION #6 ****************************************
 epoch: 0, train_loss: 1.3542, test_loss: 1.2823, test_f1: 0.2276
 epoch: 1, train_loss: 1.2697, test_loss: 1.2371, test_f1: 0.2869
 epoch: 2, train_loss: 1.2232, test_loss: 1.1894, test_f1: 0.3865
 epoch: 3, train_loss: 1.2020, test_loss: 1.1487, test_f1: 0.4525
 epoch: 4, train_loss: 1.1916, test_loss: 1.1240, test_f1: 0.4599
 epoch: 5, train_loss: 1.1619, test_loss: 1.1098, test_f1: 0.4594
 epoch: 6, train_loss: 1.1422, test_loss: 1.0987, test_f1: 0.4506
 epoch: 7, train_loss: 1.1330, test_loss: 1.0865, test_f1: 0.4455
 epoch: 8, train_loss: 1.1260, test_loss: 1.0758, test_f1: 0.4352
 epoch: 9, train_loss: 1.1113, test_loss: 1.0698, test_f1: 0.4454
 epoch: 10, train_loss: 1.0899, test_loss: 1.0664, test_f1: 0.4446
 epoch: 11, train_loss: 1.0835, test_loss: 1.0592, test_f1: 0.4477
 epoch: 12, train_loss: 1.0880, test_loss: 1.0521, test_f1: 0.4572
 epoch: 13, train_loss: 1.0740, test_loss: 1.0489, test_f1: 0.4543
 epoch: 14, train_loss: 1.0578, test_loss: 1.0426, test_f1: 0.4582
 epoch: 15, train_loss: 1.0628, test_loss: 1.0368, test_f1: 0.4568
 epoch: 16, train_loss: 1.0415, test_loss: 1.0327, test_f1: 0.4429
 epoch: 17, train_loss: 1.0347, test_loss: 1.0244, test_f1: 0.4537
 epoch: 18, train_loss: 1.0251, test_loss: 1.0159, test_f1: 0.4583
 epoch: 19, train_loss: 1.0185, test_loss: 1.0110, test_f1: 0.4698
 epoch: 20, train_loss: 1.0108, test_loss: 1.0112, test_f1: 0.4618
 epoch: 21, train_loss: 1.0035, test_loss: 1.0053, test_f1: 0.4626
 epoch: 22, train_loss: 0.9960, test_loss: 1.0001, test_f1: 0.4621
 epoch: 23, train_loss: 0.9952, test_loss: 0.9960, test_f1: 0.4590
 epoch: 24, train_loss: 0.9925, test_loss: 0.9868, test_f1: 0.4707
 epoch: 25, train_loss: 0.9784, test_loss: 0.9894, test_f1: 0.4545
 epoch: 26, train_loss: 0.9724, test_loss: 0.9807, test_f1: 0.4630
 epoch: 27, train_loss: 0.9726, test_loss: 0.9732, test_f1: 0.4644
 epoch: 28, train_loss: 0.9620, test_loss: 0.9728, test_f1: 0.4695
 epoch: 29, train_loss: 0.9466, test_loss: 0.9740, test_f1: 0.4771
 epoch: 30, train_loss: 0.9426, test_loss: 0.9634, test_f1: 0.4837
 epoch: 31, train_loss: 0.9457, test_loss: 0.9688, test_f1: 0.4789
 epoch: 32, train_loss: 0.9377, test_loss: 0.9711, test_f1: 0.4818
 epoch: 33, train_loss: 0.9211, test_loss: 0.9652, test_f1: 0.4839
 epoch: 34, train_loss: 0.9256, test_loss: 0.9521, test_f1: 0.4818
 epoch: 35, train_loss: 0.9184, test_loss: 0.9613, test_f1: 0.4855
 epoch: 36, train_loss: 0.9188, test_loss: 0.9563, test_f1: 0.4950
 epoch: 37, train_loss: 0.9133, test_loss: 0.9503, test_f1: 0.4885
 epoch: 38, train_loss: 0.9055, test_loss: 0.9546, test_f1: 0.5015
 epoch: 39, train_loss: 0.9125, test_loss: 0.9500, test_f1: 0.4882
 epoch: 40, train_loss: 0.8935, test_loss: 0.9526, test_f1: 0.4809
 epoch: 41, train_loss: 0.8876, test_loss: 0.9454, test_f1: 0.4966
 epoch: 42, train_loss: 0.8951, test_loss: 0.9402, test_f1: 0.5012
 epoch: 43, train_loss: 0.8799, test_loss: 0.9557, test_f1: 0.4865
 epoch: 44, train_loss: 0.8874, test_loss: 0.9380, test_f1: 0.5022
 epoch: 45, train_loss: 0.8758, test_loss: 0.9567, test_f1: 0.5057
 epoch: 46, train_loss: 0.8814, test_loss: 0.9536, test_f1: 0.5000
 epoch: 47, train_loss: 0.8695, test_loss: 0.9798, test_f1: 0.4974
 epoch: 48, train_loss: 0.8585, test_loss: 0.9360, test_f1: 0.5283
 epoch: 49, train_loss: 0.8513, test_loss: 0.9453, test_f1: 0.5042
 epoch: 50, train_loss: 0.8572, test_loss: 0.9582, test_f1: 0.5058
 epoch: 51, train_loss: 0.8516, test_loss: 0.9500, test_f1: 0.5263
 epoch: 52, train_loss: 0.8494, test_loss: 0.9483, test_f1: 0.5139
 epoch: 53, train_loss: 0.8400, test_loss: 0.9559, test_f1: 0.5096
 epoch: 54, train_loss: 0.8242, test_loss: 0.9470, test_f1: 0.5101
 epoch: 55, train_loss: 0.8390, test_loss: 0.9511, test_f1: 0.5139
 epoch: 56, train_loss: 0.8301, test_loss: 0.9503, test_f1: 0.5222
 epoch: 57, train_loss: 0.8300, test_loss: 0.9554, test_f1: 0.5212
 epoch: 58, train_loss: 0.8282, test_loss: 0.9544, test_f1: 0.5153
 epoch: 59, train_loss: 0.8345, test_loss: 0.9490, test_f1: 0.5208
 epoch: 60, train_loss: 0.8245, test_loss: 0.9676, test_f1: 0.5146
 epoch: 61, train_loss: 0.8292, test_loss: 0.9609, test_f1: 0.5207
 epoch: 62, train_loss: 0.8149, test_loss: 0.9582, test_f1: 0.5230
 epoch: 63, train_loss: 0.8175, test_loss: 0.9762, test_f1: 0.5127
 epoch: 64, train_loss: 0.8250, test_loss: 0.9657, test_f1: 0.5239
 epoch: 65, train_loss: 0.8151, test_loss: 0.9714, test_f1: 0.5168
 epoch: 66, train_loss: 0.8074, test_loss: 0.9685, test_f1: 0.5249
 epoch: 67, train_loss: 0.8095, test_loss: 0.9770, test_f1: 0.5179
 epoch: 68, train_loss: 0.8106, test_loss: 0.9790, test_f1: 0.5245
 epoch: 69, train_loss: 0.8021, test_loss: 0.9687, test_f1: 0.5306
 epoch: 70, train_loss: 0.8136, test_loss: 0.9720, test_f1: 0.5325
 epoch: 71, train_loss: 0.7992, test_loss: 0.9869, test_f1: 0.5182
 epoch: 72, train_loss: 0.7921, test_loss: 0.9690, test_f1: 0.5242
 epoch: 73, train_loss: 0.7945, test_loss: 0.9747, test_f1: 0.5214
 epoch: 74, train_loss: 0.7959, test_loss: 0.9621, test_f1: 0.5254
 epoch: 75, train_loss: 0.7945, test_loss: 0.9669, test_f1: 0.5348
 epoch: 76, train_loss: 0.7941, test_loss: 0.9793, test_f1: 0.5219
 epoch: 77, train_loss: 0.7954, test_loss: 0.9687, test_f1: 0.5339
 epoch: 78, train_loss: 0.7793, test_loss: 0.9913, test_f1: 0.5264
 epoch: 79, train_loss: 0.7850, test_loss: 0.9932, test_f1: 0.5341
 epoch: 80, train_loss: 0.7809, test_loss: 0.9947, test_f1: 0.5324
 epoch: 81, train_loss: 0.7843, test_loss: 1.0126, test_f1: 0.5180
 epoch: 82, train_loss: 0.7870, test_loss: 0.9961, test_f1: 0.5443
 epoch: 83, train_loss: 0.7792, test_loss: 1.0066, test_f1: 0.5242
 epoch: 84, train_loss: 0.7793, test_loss: 0.9910, test_f1: 0.5231
 epoch: 85, train_loss: 0.7882, test_loss: 0.9972, test_f1: 0.5336
 epoch: 86, train_loss: 0.7672, test_loss: 0.9951, test_f1: 0.5462
 epoch: 87, train_loss: 0.7689, test_loss: 0.9876, test_f1: 0.5331
 epoch: 88, train_loss: 0.7675, test_loss: 1.0309, test_f1: 0.5342
 epoch: 89, train_loss: 0.7599, test_loss: 0.9946, test_f1: 0.5220
 epoch: 90, train_loss: 0.7650, test_loss: 1.0049, test_f1: 0.5274
 epoch: 91, train_loss: 0.7744, test_loss: 1.0311, test_f1: 0.5298
 epoch: 92, train_loss: 0.7619, test_loss: 1.0160, test_f1: 0.5489
 epoch: 93, train_loss: 0.7630, test_loss: 1.0096, test_f1: 0.5382
 epoch: 94, train_loss: 0.7447, test_loss: 1.0222, test_f1: 0.5467
 epoch: 95, train_loss: 0.7615, test_loss: 1.0262, test_f1: 0.5263
 epoch: 96, train_loss: 0.7449, test_loss: 1.0308, test_f1: 0.5321
 epoch: 97, train_loss: 0.7451, test_loss: 1.0521, test_f1: 0.5353
 epoch: 98, train_loss: 0.7545, test_loss: 1.0496, test_f1: 0.5488
 epoch: 99, train_loss: 0.7442, test_loss: 1.0288, test_f1: 0.5440
##################ITERATION #7 ****************************************
 epoch: 0, train_loss: 1.3620, test_loss: 1.2657, test_f1: 0.2274
 epoch: 1, train_loss: 1.2504, test_loss: 1.2315, test_f1: 0.2870
 epoch: 2, train_loss: 1.2160, test_loss: 1.1968, test_f1: 0.2920
 epoch: 3, train_loss: 1.1924, test_loss: 1.1539, test_f1: 0.4166
 epoch: 4, train_loss: 1.1754, test_loss: 1.1189, test_f1: 0.4618
 epoch: 5, train_loss: 1.1712, test_loss: 1.0938, test_f1: 0.4866
 epoch: 6, train_loss: 1.1396, test_loss: 1.0812, test_f1: 0.4817
 epoch: 7, train_loss: 1.1430, test_loss: 1.0659, test_f1: 0.4892
 epoch: 8, train_loss: 1.1143, test_loss: 1.0618, test_f1: 0.4854
 epoch: 9, train_loss: 1.1070, test_loss: 1.0515, test_f1: 0.4760
 epoch: 10, train_loss: 1.0922, test_loss: 1.0400, test_f1: 0.4793
 epoch: 11, train_loss: 1.0775, test_loss: 1.0352, test_f1: 0.4865
 epoch: 12, train_loss: 1.0695, test_loss: 1.0252, test_f1: 0.4893
 epoch: 13, train_loss: 1.0613, test_loss: 1.0171, test_f1: 0.4965
 epoch: 14, train_loss: 1.0440, test_loss: 1.0141, test_f1: 0.4839
 epoch: 15, train_loss: 1.0461, test_loss: 1.0056, test_f1: 0.4866
 epoch: 16, train_loss: 1.0259, test_loss: 0.9994, test_f1: 0.4890
 epoch: 17, train_loss: 1.0229, test_loss: 0.9965, test_f1: 0.4908
 epoch: 18, train_loss: 1.0177, test_loss: 0.9911, test_f1: 0.4938
 epoch: 19, train_loss: 1.0094, test_loss: 0.9917, test_f1: 0.4981
 epoch: 20, train_loss: 0.9961, test_loss: 0.9754, test_f1: 0.4977
 epoch: 21, train_loss: 0.9839, test_loss: 0.9774, test_f1: 0.4877
 epoch: 22, train_loss: 0.9743, test_loss: 0.9763, test_f1: 0.4907
 epoch: 23, train_loss: 0.9653, test_loss: 0.9747, test_f1: 0.4938
 epoch: 24, train_loss: 0.9519, test_loss: 0.9759, test_f1: 0.4917
 epoch: 25, train_loss: 0.9622, test_loss: 0.9723, test_f1: 0.4984
 epoch: 26, train_loss: 0.9522, test_loss: 0.9701, test_f1: 0.4915
 epoch: 27, train_loss: 0.9367, test_loss: 0.9626, test_f1: 0.4989
 epoch: 28, train_loss: 0.9317, test_loss: 0.9698, test_f1: 0.5010
 epoch: 29, train_loss: 0.9287, test_loss: 0.9601, test_f1: 0.5002
 epoch: 30, train_loss: 0.9050, test_loss: 0.9650, test_f1: 0.4966
 epoch: 31, train_loss: 0.9182, test_loss: 0.9640, test_f1: 0.5038
 epoch: 32, train_loss: 0.9040, test_loss: 0.9628, test_f1: 0.5032
 epoch: 33, train_loss: 0.9089, test_loss: 0.9677, test_f1: 0.5149
 epoch: 34, train_loss: 0.8932, test_loss: 0.9762, test_f1: 0.5056
 epoch: 35, train_loss: 0.8986, test_loss: 0.9781, test_f1: 0.5152
 epoch: 36, train_loss: 0.8859, test_loss: 0.9727, test_f1: 0.5062
 epoch: 37, train_loss: 0.8759, test_loss: 0.9769, test_f1: 0.5098
 epoch: 38, train_loss: 0.8741, test_loss: 0.9822, test_f1: 0.5157
 epoch: 39, train_loss: 0.8741, test_loss: 0.9914, test_f1: 0.5096
 epoch: 40, train_loss: 0.8584, test_loss: 0.9757, test_f1: 0.5163
 epoch: 41, train_loss: 0.8609, test_loss: 0.9912, test_f1: 0.5198
 epoch: 42, train_loss: 0.8540, test_loss: 0.9943, test_f1: 0.5022
 epoch: 43, train_loss: 0.8514, test_loss: 0.9976, test_f1: 0.5207
 epoch: 44, train_loss: 0.8341, test_loss: 1.0007, test_f1: 0.5233
 epoch: 45, train_loss: 0.8353, test_loss: 1.0023, test_f1: 0.5175
 epoch: 46, train_loss: 0.8272, test_loss: 1.0164, test_f1: 0.5204
 epoch: 47, train_loss: 0.8263, test_loss: 1.0242, test_f1: 0.5261
 epoch: 48, train_loss: 0.8229, test_loss: 1.0326, test_f1: 0.5254
 epoch: 49, train_loss: 0.8150, test_loss: 1.0314, test_f1: 0.5338
 epoch: 50, train_loss: 0.8071, test_loss: 1.0431, test_f1: 0.5414
 epoch: 51, train_loss: 0.7980, test_loss: 1.0442, test_f1: 0.5367
 epoch: 52, train_loss: 0.8039, test_loss: 1.0365, test_f1: 0.5245
 epoch: 53, train_loss: 0.7865, test_loss: 1.0399, test_f1: 0.5271
 epoch: 54, train_loss: 0.7914, test_loss: 1.0460, test_f1: 0.5222
 epoch: 55, train_loss: 0.7979, test_loss: 1.0526, test_f1: 0.5321
 epoch: 56, train_loss: 0.7956, test_loss: 1.0452, test_f1: 0.5262
 epoch: 57, train_loss: 0.7865, test_loss: 1.0371, test_f1: 0.5405
 epoch: 58, train_loss: 0.7780, test_loss: 1.0436, test_f1: 0.5412
 epoch: 59, train_loss: 0.7767, test_loss: 1.0549, test_f1: 0.5385
 epoch: 60, train_loss: 0.7652, test_loss: 1.0516, test_f1: 0.5376
 epoch: 61, train_loss: 0.7709, test_loss: 1.0618, test_f1: 0.5480
 epoch: 62, train_loss: 0.7670, test_loss: 1.0660, test_f1: 0.5305
 epoch: 63, train_loss: 0.7805, test_loss: 1.0598, test_f1: 0.5437
 epoch: 64, train_loss: 0.7651, test_loss: 1.0756, test_f1: 0.5403
 epoch: 65, train_loss: 0.7626, test_loss: 1.0722, test_f1: 0.5320
 epoch: 66, train_loss: 0.7580, test_loss: 1.0690, test_f1: 0.5440
 epoch: 67, train_loss: 0.7737, test_loss: 1.0650, test_f1: 0.5535
 epoch: 68, train_loss: 0.7557, test_loss: 1.0727, test_f1: 0.5445
 epoch: 69, train_loss: 0.7532, test_loss: 1.0790, test_f1: 0.5425
 epoch: 70, train_loss: 0.7636, test_loss: 1.0791, test_f1: 0.5416
 epoch: 71, train_loss: 0.7443, test_loss: 1.0842, test_f1: 0.5482
 epoch: 72, train_loss: 0.7426, test_loss: 1.0875, test_f1: 0.5405
 epoch: 73, train_loss: 0.7447, test_loss: 1.0921, test_f1: 0.5552
 epoch: 74, train_loss: 0.7463, test_loss: 1.0935, test_f1: 0.5402
 epoch: 75, train_loss: 0.7419, test_loss: 1.0929, test_f1: 0.5348
 epoch: 76, train_loss: 0.7366, test_loss: 1.1023, test_f1: 0.5333
 epoch: 77, train_loss: 0.7285, test_loss: 1.0944, test_f1: 0.5478
 epoch: 78, train_loss: 0.7332, test_loss: 1.0950, test_f1: 0.5531
 epoch: 79, train_loss: 0.7296, test_loss: 1.0928, test_f1: 0.5470
 epoch: 80, train_loss: 0.7334, test_loss: 1.0946, test_f1: 0.5360
 epoch: 81, train_loss: 0.7299, test_loss: 1.1078, test_f1: 0.5364
 epoch: 82, train_loss: 0.7314, test_loss: 1.1118, test_f1: 0.5478
 epoch: 83, train_loss: 0.7288, test_loss: 1.1007, test_f1: 0.5433
 epoch: 84, train_loss: 0.7133, test_loss: 1.1072, test_f1: 0.5423
 epoch: 85, train_loss: 0.7393, test_loss: 1.1112, test_f1: 0.5417
 epoch: 86, train_loss: 0.7174, test_loss: 1.1119, test_f1: 0.5452
 epoch: 87, train_loss: 0.7112, test_loss: 1.1106, test_f1: 0.5432
 epoch: 88, train_loss: 0.7210, test_loss: 1.1316, test_f1: 0.5454
 epoch: 89, train_loss: 0.7160, test_loss: 1.1474, test_f1: 0.5528
 epoch: 90, train_loss: 0.7085, test_loss: 1.1257, test_f1: 0.5552
 epoch: 91, train_loss: 0.7111, test_loss: 1.1329, test_f1: 0.5571
 epoch: 92, train_loss: 0.7039, test_loss: 1.1325, test_f1: 0.5605
 epoch: 93, train_loss: 0.7101, test_loss: 1.1334, test_f1: 0.5583
 epoch: 94, train_loss: 0.6897, test_loss: 1.1312, test_f1: 0.5446
 epoch: 95, train_loss: 0.7131, test_loss: 1.1366, test_f1: 0.5318
 epoch: 96, train_loss: 0.6936, test_loss: 1.1292, test_f1: 0.5429
 epoch: 97, train_loss: 0.6976, test_loss: 1.1291, test_f1: 0.5440
 epoch: 98, train_loss: 0.7010, test_loss: 1.1369, test_f1: 0.5532
 epoch: 99, train_loss: 0.6978, test_loss: 1.1433, test_f1: 0.5465
##################ITERATION #8 ****************************************
 epoch: 0, train_loss: 1.4085, test_loss: 1.2939, test_f1: 0.2476
 epoch: 1, train_loss: 1.2776, test_loss: 1.2565, test_f1: 0.2846
 epoch: 2, train_loss: 1.2359, test_loss: 1.2155, test_f1: 0.3548
 epoch: 3, train_loss: 1.1955, test_loss: 1.1625, test_f1: 0.4308
 epoch: 4, train_loss: 1.1874, test_loss: 1.1273, test_f1: 0.4427
 epoch: 5, train_loss: 1.1678, test_loss: 1.1086, test_f1: 0.4426
 epoch: 6, train_loss: 1.1495, test_loss: 1.0925, test_f1: 0.4578
 epoch: 7, train_loss: 1.1353, test_loss: 1.0802, test_f1: 0.4530
 epoch: 8, train_loss: 1.1276, test_loss: 1.0712, test_f1: 0.4544
 epoch: 9, train_loss: 1.1096, test_loss: 1.0631, test_f1: 0.4503
 epoch: 10, train_loss: 1.0801, test_loss: 1.0540, test_f1: 0.4575
 epoch: 11, train_loss: 1.0797, test_loss: 1.0451, test_f1: 0.4616
 epoch: 12, train_loss: 1.0740, test_loss: 1.0324, test_f1: 0.4598
 epoch: 13, train_loss: 1.0647, test_loss: 1.0217, test_f1: 0.4565
 epoch: 14, train_loss: 1.0575, test_loss: 1.0238, test_f1: 0.4623
 epoch: 15, train_loss: 1.0465, test_loss: 1.0128, test_f1: 0.4677
 epoch: 16, train_loss: 1.0336, test_loss: 1.0064, test_f1: 0.4697
 epoch: 17, train_loss: 1.0208, test_loss: 1.0034, test_f1: 0.4786
 epoch: 18, train_loss: 1.0112, test_loss: 0.9925, test_f1: 0.4777
 epoch: 19, train_loss: 1.0030, test_loss: 0.9915, test_f1: 0.4745
 epoch: 20, train_loss: 0.9907, test_loss: 0.9880, test_f1: 0.4629
 epoch: 21, train_loss: 0.9865, test_loss: 0.9780, test_f1: 0.4789
 epoch: 22, train_loss: 0.9786, test_loss: 0.9821, test_f1: 0.4742
 epoch: 23, train_loss: 0.9707, test_loss: 0.9860, test_f1: 0.4727
 epoch: 24, train_loss: 0.9691, test_loss: 0.9694, test_f1: 0.4776
 epoch: 25, train_loss: 0.9522, test_loss: 0.9617, test_f1: 0.4745
 epoch: 26, train_loss: 0.9610, test_loss: 0.9681, test_f1: 0.4581
 epoch: 27, train_loss: 0.9493, test_loss: 0.9612, test_f1: 0.4901
 epoch: 28, train_loss: 0.9419, test_loss: 0.9683, test_f1: 0.4735
 epoch: 29, train_loss: 0.9291, test_loss: 0.9601, test_f1: 0.4825
 epoch: 30, train_loss: 0.9343, test_loss: 0.9651, test_f1: 0.4794
 epoch: 31, train_loss: 0.9246, test_loss: 0.9649, test_f1: 0.4750
 epoch: 32, train_loss: 0.9165, test_loss: 0.9588, test_f1: 0.4909
 epoch: 33, train_loss: 0.9058, test_loss: 0.9537, test_f1: 0.4789
 epoch: 34, train_loss: 0.9099, test_loss: 0.9678, test_f1: 0.4793
 epoch: 35, train_loss: 0.9134, test_loss: 0.9726, test_f1: 0.4656
 epoch: 36, train_loss: 0.8958, test_loss: 0.9662, test_f1: 0.4821
 epoch: 37, train_loss: 0.8922, test_loss: 0.9737, test_f1: 0.4551
 epoch: 38, train_loss: 0.8812, test_loss: 0.9681, test_f1: 0.4873
 epoch: 39, train_loss: 0.8780, test_loss: 0.9652, test_f1: 0.4700
 epoch: 40, train_loss: 0.8754, test_loss: 0.9579, test_f1: 0.4677
 epoch: 41, train_loss: 0.8676, test_loss: 0.9530, test_f1: 0.5062
 epoch: 42, train_loss: 0.8670, test_loss: 0.9571, test_f1: 0.4669
 epoch: 43, train_loss: 0.8618, test_loss: 0.9727, test_f1: 0.4803
 epoch: 44, train_loss: 0.8521, test_loss: 0.9712, test_f1: 0.4783
 epoch: 45, train_loss: 0.8606, test_loss: 0.9683, test_f1: 0.4893
 epoch: 46, train_loss: 0.8435, test_loss: 0.9660, test_f1: 0.4766
 epoch: 47, train_loss: 0.8511, test_loss: 0.9766, test_f1: 0.4755
 epoch: 48, train_loss: 0.8405, test_loss: 0.9563, test_f1: 0.4853
 epoch: 49, train_loss: 0.8329, test_loss: 0.9704, test_f1: 0.4867
 epoch: 50, train_loss: 0.8310, test_loss: 0.9715, test_f1: 0.4988
 epoch: 51, train_loss: 0.8168, test_loss: 0.9688, test_f1: 0.4790
 epoch: 52, train_loss: 0.8153, test_loss: 0.9658, test_f1: 0.4841
 epoch: 53, train_loss: 0.8154, test_loss: 0.9675, test_f1: 0.4891
 epoch: 54, train_loss: 0.8178, test_loss: 0.9742, test_f1: 0.5061
 epoch: 55, train_loss: 0.7967, test_loss: 0.9782, test_f1: 0.4850
 epoch: 56, train_loss: 0.8005, test_loss: 0.9777, test_f1: 0.4929
 epoch: 57, train_loss: 0.8042, test_loss: 0.9835, test_f1: 0.4917
 epoch: 58, train_loss: 0.8001, test_loss: 0.9782, test_f1: 0.4836
 epoch: 59, train_loss: 0.8061, test_loss: 0.9750, test_f1: 0.4889
 epoch: 60, train_loss: 0.8010, test_loss: 0.9846, test_f1: 0.4763
 epoch: 61, train_loss: 0.7959, test_loss: 0.9761, test_f1: 0.4864
 epoch: 62, train_loss: 0.7962, test_loss: 0.9776, test_f1: 0.4932
 epoch: 63, train_loss: 0.7907, test_loss: 0.9930, test_f1: 0.4771
 epoch: 64, train_loss: 0.7932, test_loss: 0.9818, test_f1: 0.4816
 epoch: 65, train_loss: 0.7993, test_loss: 0.9910, test_f1: 0.4672
 epoch: 66, train_loss: 0.7821, test_loss: 0.9808, test_f1: 0.4972
 epoch: 67, train_loss: 0.7854, test_loss: 0.9885, test_f1: 0.4904
 epoch: 68, train_loss: 0.7765, test_loss: 0.9923, test_f1: 0.4910
 epoch: 69, train_loss: 0.7775, test_loss: 1.0003, test_f1: 0.4891
 epoch: 70, train_loss: 0.7727, test_loss: 0.9968, test_f1: 0.4883
 epoch: 71, train_loss: 0.7755, test_loss: 0.9945, test_f1: 0.5108
 epoch: 72, train_loss: 0.7794, test_loss: 0.9939, test_f1: 0.5001
 epoch: 73, train_loss: 0.7704, test_loss: 1.0012, test_f1: 0.4966
 epoch: 74, train_loss: 0.7600, test_loss: 0.9957, test_f1: 0.4910
 epoch: 75, train_loss: 0.7665, test_loss: 0.9991, test_f1: 0.5048
 epoch: 76, train_loss: 0.7664, test_loss: 1.0067, test_f1: 0.4998
 epoch: 77, train_loss: 0.7661, test_loss: 1.0220, test_f1: 0.4895
 epoch: 78, train_loss: 0.7691, test_loss: 1.0047, test_f1: 0.4964
 epoch: 79, train_loss: 0.7720, test_loss: 1.0106, test_f1: 0.4968
 epoch: 80, train_loss: 0.7570, test_loss: 1.0229, test_f1: 0.4942
 epoch: 81, train_loss: 0.7480, test_loss: 1.0156, test_f1: 0.4980
 epoch: 82, train_loss: 0.7599, test_loss: 1.0101, test_f1: 0.5057
 epoch: 83, train_loss: 0.7452, test_loss: 1.0171, test_f1: 0.4981
 epoch: 84, train_loss: 0.7553, test_loss: 1.0145, test_f1: 0.4853
 epoch: 85, train_loss: 0.7386, test_loss: 1.0107, test_f1: 0.4959
 epoch: 86, train_loss: 0.7474, test_loss: 1.0093, test_f1: 0.5016
 epoch: 87, train_loss: 0.7519, test_loss: 1.0211, test_f1: 0.4926
 epoch: 88, train_loss: 0.7459, test_loss: 1.0133, test_f1: 0.5017
 epoch: 89, train_loss: 0.7426, test_loss: 1.0205, test_f1: 0.4952
 epoch: 90, train_loss: 0.7397, test_loss: 1.0267, test_f1: 0.4991
 epoch: 91, train_loss: 0.7259, test_loss: 1.0153, test_f1: 0.5071
 epoch: 92, train_loss: 0.7385, test_loss: 1.0182, test_f1: 0.4990
 epoch: 93, train_loss: 0.7368, test_loss: 1.0433, test_f1: 0.4853
 epoch: 94, train_loss: 0.7280, test_loss: 1.0396, test_f1: 0.4988
 epoch: 95, train_loss: 0.7298, test_loss: 1.0425, test_f1: 0.5080
 epoch: 96, train_loss: 0.7220, test_loss: 1.0490, test_f1: 0.4989
 epoch: 97, train_loss: 0.7269, test_loss: 1.0260, test_f1: 0.5088
 epoch: 98, train_loss: 0.7167, test_loss: 1.0410, test_f1: 0.5008
 epoch: 99, train_loss: 0.7079, test_loss: 1.0372, test_f1: 0.4968
##################ITERATION #9 ****************************************
 epoch: 0, train_loss: 1.3601, test_loss: 1.2606, test_f1: 0.3225
 epoch: 1, train_loss: 1.2592, test_loss: 1.1884, test_f1: 0.3532
 epoch: 2, train_loss: 1.2194, test_loss: 1.1436, test_f1: 0.4380
 epoch: 3, train_loss: 1.1808, test_loss: 1.1027, test_f1: 0.4714
 epoch: 4, train_loss: 1.1636, test_loss: 1.0790, test_f1: 0.4807
 epoch: 5, train_loss: 1.1695, test_loss: 1.0661, test_f1: 0.4684
 epoch: 6, train_loss: 1.1425, test_loss: 1.0645, test_f1: 0.4773
 epoch: 7, train_loss: 1.1188, test_loss: 1.0522, test_f1: 0.4568
 epoch: 8, train_loss: 1.1101, test_loss: 1.0501, test_f1: 0.4670
 epoch: 9, train_loss: 1.1080, test_loss: 1.0429, test_f1: 0.4504
 epoch: 10, train_loss: 1.1042, test_loss: 1.0371, test_f1: 0.4495
 epoch: 11, train_loss: 1.0753, test_loss: 1.0306, test_f1: 0.4569
 epoch: 12, train_loss: 1.0783, test_loss: 1.0220, test_f1: 0.4634
 epoch: 13, train_loss: 1.0614, test_loss: 1.0169, test_f1: 0.4792
 epoch: 14, train_loss: 1.0537, test_loss: 1.0088, test_f1: 0.4677
 epoch: 15, train_loss: 1.0554, test_loss: 1.0076, test_f1: 0.4851
 epoch: 16, train_loss: 1.0506, test_loss: 1.0026, test_f1: 0.4915
 epoch: 17, train_loss: 1.0195, test_loss: 0.9985, test_f1: 0.4990
 epoch: 18, train_loss: 1.0300, test_loss: 0.9937, test_f1: 0.4883
 epoch: 19, train_loss: 1.0303, test_loss: 0.9929, test_f1: 0.4842
 epoch: 20, train_loss: 1.0106, test_loss: 0.9864, test_f1: 0.4933
 epoch: 21, train_loss: 1.0090, test_loss: 0.9889, test_f1: 0.4960
 epoch: 22, train_loss: 1.0061, test_loss: 0.9830, test_f1: 0.5017
 epoch: 23, train_loss: 0.9996, test_loss: 0.9856, test_f1: 0.4961
 epoch: 24, train_loss: 0.9862, test_loss: 0.9756, test_f1: 0.5089
 epoch: 25, train_loss: 0.9827, test_loss: 0.9723, test_f1: 0.5110
 epoch: 26, train_loss: 0.9760, test_loss: 0.9829, test_f1: 0.5039
 epoch: 27, train_loss: 0.9714, test_loss: 0.9696, test_f1: 0.5200
 epoch: 28, train_loss: 0.9670, test_loss: 0.9688, test_f1: 0.5139
 epoch: 29, train_loss: 0.9684, test_loss: 0.9830, test_f1: 0.4959
 epoch: 30, train_loss: 0.9457, test_loss: 1.0140, test_f1: 0.5026
 epoch: 31, train_loss: 0.9573, test_loss: 0.9680, test_f1: 0.5126
 epoch: 32, train_loss: 0.9574, test_loss: 1.0294, test_f1: 0.4836
 epoch: 33, train_loss: 0.9429, test_loss: 1.0134, test_f1: 0.4890
 epoch: 34, train_loss: 0.9433, test_loss: 0.9660, test_f1: 0.4856
 epoch: 35, train_loss: 0.9330, test_loss: 1.0169, test_f1: 0.4713
 epoch: 36, train_loss: 0.9219, test_loss: 1.0002, test_f1: 0.4779
 epoch: 37, train_loss: 0.9151, test_loss: 0.9900, test_f1: 0.4863
 epoch: 38, train_loss: 0.9157, test_loss: 1.0339, test_f1: 0.4679
 epoch: 39, train_loss: 0.9174, test_loss: 1.0268, test_f1: 0.4953
 epoch: 40, train_loss: 0.9020, test_loss: 0.9728, test_f1: 0.5057
 epoch: 41, train_loss: 0.9060, test_loss: 1.0389, test_f1: 0.4822
 epoch: 42, train_loss: 0.8954, test_loss: 1.0582, test_f1: 0.4939
 epoch: 43, train_loss: 0.8866, test_loss: 0.9700, test_f1: 0.5009
 epoch: 44, train_loss: 0.8799, test_loss: 1.1519, test_f1: 0.4695
 epoch: 45, train_loss: 0.8735, test_loss: 0.9833, test_f1: 0.4880
 epoch: 46, train_loss: 0.8748, test_loss: 1.1213, test_f1: 0.4683
 epoch: 47, train_loss: 0.8693, test_loss: 1.0287, test_f1: 0.4792
 epoch: 48, train_loss: 0.8680, test_loss: 1.1293, test_f1: 0.4733
 epoch: 49, train_loss: 0.8589, test_loss: 1.0188, test_f1: 0.4854
 epoch: 50, train_loss: 0.8556, test_loss: 1.1968, test_f1: 0.4766
 epoch: 51, train_loss: 0.8486, test_loss: 1.1350, test_f1: 0.4763
 epoch: 52, train_loss: 0.8472, test_loss: 1.1288, test_f1: 0.4862
 epoch: 53, train_loss: 0.8357, test_loss: 1.0973, test_f1: 0.4854
 epoch: 54, train_loss: 0.8468, test_loss: 1.1311, test_f1: 0.4784
 epoch: 55, train_loss: 0.8421, test_loss: 1.2292, test_f1: 0.4834
 epoch: 56, train_loss: 0.8293, test_loss: 1.1176, test_f1: 0.4873
 epoch: 57, train_loss: 0.8356, test_loss: 1.2042, test_f1: 0.4674
 epoch: 58, train_loss: 0.8311, test_loss: 1.1377, test_f1: 0.4818
 epoch: 59, train_loss: 0.8321, test_loss: 1.1321, test_f1: 0.4785
 epoch: 60, train_loss: 0.8229, test_loss: 1.1601, test_f1: 0.4634
 epoch: 61, train_loss: 0.8145, test_loss: 1.1629, test_f1: 0.4673
 epoch: 62, train_loss: 0.8151, test_loss: 1.2284, test_f1: 0.4762
 epoch: 63, train_loss: 0.8146, test_loss: 1.1796, test_f1: 0.4771
 epoch: 64, train_loss: 0.8146, test_loss: 1.2143, test_f1: 0.4687
 epoch: 65, train_loss: 0.8082, test_loss: 1.2200, test_f1: 0.4635
 epoch: 66, train_loss: 0.8171, test_loss: 1.1735, test_f1: 0.4773
 epoch: 67, train_loss: 0.8000, test_loss: 1.1289, test_f1: 0.4866
 epoch: 68, train_loss: 0.8005, test_loss: 1.1585, test_f1: 0.4823
 epoch: 69, train_loss: 0.8080, test_loss: 1.2251, test_f1: 0.4706
 epoch: 70, train_loss: 0.8095, test_loss: 1.1827, test_f1: 0.4880
 epoch: 71, train_loss: 0.8029, test_loss: 1.2116, test_f1: 0.4763
 epoch: 72, train_loss: 0.8038, test_loss: 1.2139, test_f1: 0.4799
 epoch: 73, train_loss: 0.7941, test_loss: 1.1989, test_f1: 0.4851
 epoch: 74, train_loss: 0.7864, test_loss: 1.2674, test_f1: 0.4730
 epoch: 75, train_loss: 0.7908, test_loss: 1.2470, test_f1: 0.4587
 epoch: 76, train_loss: 0.7878, test_loss: 1.1928, test_f1: 0.4754
 epoch: 77, train_loss: 0.7806, test_loss: 1.1804, test_f1: 0.4805
 epoch: 78, train_loss: 0.7718, test_loss: 1.2411, test_f1: 0.4753
 epoch: 79, train_loss: 0.7971, test_loss: 1.2277, test_f1: 0.4812
 epoch: 80, train_loss: 0.7711, test_loss: 1.1893, test_f1: 0.4890
 epoch: 81, train_loss: 0.7800, test_loss: 1.1208, test_f1: 0.4853
 epoch: 82, train_loss: 0.7707, test_loss: 1.2106, test_f1: 0.4780
 epoch: 83, train_loss: 0.7615, test_loss: 1.1954, test_f1: 0.4904
 epoch: 84, train_loss: 0.7683, test_loss: 1.2400, test_f1: 0.4765
 epoch: 85, train_loss: 0.7685, test_loss: 1.1694, test_f1: 0.4837
 epoch: 86, train_loss: 0.7548, test_loss: 1.2179, test_f1: 0.4903
 epoch: 87, train_loss: 0.7880, test_loss: 1.1884, test_f1: 0.4877
 epoch: 88, train_loss: 0.7665, test_loss: 1.2099, test_f1: 0.4873
 epoch: 89, train_loss: 0.7650, test_loss: 1.1394, test_f1: 0.4882
 epoch: 90, train_loss: 0.7568, test_loss: 1.2105, test_f1: 0.4900
 epoch: 91, train_loss: 0.7628, test_loss: 1.1774, test_f1: 0.4809
 epoch: 92, train_loss: 0.7628, test_loss: 1.1712, test_f1: 0.4775
 epoch: 93, train_loss: 0.7556, test_loss: 1.1271, test_f1: 0.4876
 epoch: 94, train_loss: 0.7473, test_loss: 1.2028, test_f1: 0.4873
 epoch: 95, train_loss: 0.7462, test_loss: 1.2270, test_f1: 0.4776
 epoch: 96, train_loss: 0.7460, test_loss: 1.1667, test_f1: 0.4842
 epoch: 97, train_loss: 0.7309, test_loss: 1.1841, test_f1: 0.4896
 epoch: 98, train_loss: 0.7476, test_loss: 1.1450, test_f1: 0.4892
 epoch: 99, train_loss: 0.7394, test_loss: 1.1396, test_f1: 0.4893

Training completed in 367.49 seconds
Best F1: 0.5605 at epoch 92
Mean F1 across iterations: 0.5291  0.0167
========================FINAL RESULTS================================
FEGIN weighted F1: 0.5605  0.0167
python main.py --data ltspice_examples --representation component_component --model FEGIN --layers 2 --hiddens 128 --batch_size 256 --lr 0.0001 --emb_size 128 --epochs 100 --save_appendix component_component_L2_H128_BS256_LR0.0001_E128 --no_val
-----



STDERR:
  File "main.py", line 370, in <module>
    main()
  File "main.py", line 254, in main
    dataset = dataset_class(
  File "/home/philip/projects/ltspice_examples_code_repo/Circuit-Completion-Using-GNNs/component_classification_with_link_prediction_head/evaluation/FEGIN/kernel/circuit_datasets.py", line 15, in __init__
    self.data, self.slices = torch.load(self.processed_paths[0])
  File "/home/philip/.local/lib/python3.8/site-packages/torch/serialization.py", line 1040, in load
    warnings.warn(
  File "/usr/lib/python3.8/warnings.py", line 109, in _showwarnmsg
    sw(msg.message, msg.category, msg.filename, msg.lineno,
  File "main.py", line 47, in warn_with_traceback
    traceback.print_stack(file=log)
/home/philip/projects/ltspice_examples_code_repo/Circuit-Completion-Using-GNNs/component_classification_with_link_prediction_head/evaluation/FEGIN/kernel/circuit_datasets.py:15: FutureWarning: You are using `torch.load` with `weights_only=False` (the current default value), which uses the default pickle module implicitly. It is possible to construct malicious pickle data which will execute arbitrary code during unpickling (See https://github.com/pytorch/pytorch/blob/main/SECURITY.md#untrusted-models for more details). In a future release, the default value for `weights_only` will be flipped to `True`. This limits the functions that could be executed during unpickling. Arbitrary objects will no longer be allowed to be loaded via this mode unless they are explicitly allowlisted by the user via `torch.serialization.add_safe_globals`. We recommend you start setting `weights_only=True` for any use case where you don't have full control of the loaded file. Please open an issue on GitHub for any issues related to this experimental feature.
  self.data, self.slices = torch.load(self.processed_paths[0])
