STDOUT:
Results will be saved in /home/philip/projects/ltspice_examples_code_repo/Circuit-Completion-Using-GNNs/component_classification_with_link_prediction_head/evaluation/FEGIN/results/model_FEGIN_dataset_ltspice_examples
Command line input: python main.py --data ltspice_examples --representation component_net --model FEGIN --layers 5 --hiddens 64 --batch_size 32 --lr 0.0001 --emb_size 250 --epochs 100 --save_appendix component_net_L5_H64_BS32_LR0.0001_E250 --no_val
 is saved.
-----
ltspice_examples - FEGIN
Using 5 layers, 64 hidden units, h = 2
Loading component_net representation dataset
ENTERED
Training FEGIN on component_net representation
Train: 3558, Test: 846
##################ITERATION #0 ****************************************
 epoch: 0, train_loss: 1.3794, test_loss: 1.3254, test_f1: 0.2968
 epoch: 1, train_loss: 1.2982, test_loss: 1.2600, test_f1: 0.2697
 epoch: 2, train_loss: 1.2541, test_loss: 1.2220, test_f1: 0.3111
 epoch: 3, train_loss: 1.2181, test_loss: 1.1820, test_f1: 0.3419
 epoch: 4, train_loss: 1.1868, test_loss: 1.1493, test_f1: 0.3435
 epoch: 5, train_loss: 1.1630, test_loss: 1.1240, test_f1: 0.3787
 epoch: 6, train_loss: 1.1406, test_loss: 1.0961, test_f1: 0.4371
 epoch: 7, train_loss: 1.1200, test_loss: 1.0690, test_f1: 0.4859
 epoch: 8, train_loss: 1.0947, test_loss: 1.0384, test_f1: 0.5080
 epoch: 9, train_loss: 1.0693, test_loss: 1.0193, test_f1: 0.5121
 epoch: 10, train_loss: 1.0477, test_loss: 1.0156, test_f1: 0.4847
 epoch: 11, train_loss: 1.0212, test_loss: 0.9825, test_f1: 0.5023
 epoch: 12, train_loss: 1.0045, test_loss: 0.9747, test_f1: 0.5002
 epoch: 13, train_loss: 0.9887, test_loss: 0.9733, test_f1: 0.4937
 epoch: 14, train_loss: 0.9815, test_loss: 0.9597, test_f1: 0.4846
 epoch: 15, train_loss: 0.9563, test_loss: 0.9702, test_f1: 0.5124
 epoch: 16, train_loss: 0.9446, test_loss: 0.9576, test_f1: 0.4982
 epoch: 17, train_loss: 0.9410, test_loss: 0.9342, test_f1: 0.5274
 epoch: 18, train_loss: 0.9228, test_loss: 0.9375, test_f1: 0.4967
 epoch: 19, train_loss: 0.9171, test_loss: 0.9444, test_f1: 0.5111
 epoch: 20, train_loss: 0.9249, test_loss: 0.9317, test_f1: 0.5296
 epoch: 21, train_loss: 0.9138, test_loss: 0.9579, test_f1: 0.4958
 epoch: 22, train_loss: 0.9070, test_loss: 0.9343, test_f1: 0.5139
 epoch: 23, train_loss: 0.8894, test_loss: 0.9239, test_f1: 0.5348
 epoch: 24, train_loss: 0.9009, test_loss: 0.9205, test_f1: 0.5243
 epoch: 25, train_loss: 0.8919, test_loss: 0.9439, test_f1: 0.5183
 epoch: 26, train_loss: 0.8889, test_loss: 0.9558, test_f1: 0.5083
 epoch: 27, train_loss: 0.8893, test_loss: 0.9392, test_f1: 0.5268
 epoch: 28, train_loss: 0.8770, test_loss: 0.9554, test_f1: 0.5087
 epoch: 29, train_loss: 0.8712, test_loss: 0.9483, test_f1: 0.5161
 epoch: 30, train_loss: 0.8646, test_loss: 0.9327, test_f1: 0.5324
 epoch: 31, train_loss: 0.8683, test_loss: 0.9653, test_f1: 0.5285
 epoch: 32, train_loss: 0.8655, test_loss: 0.9473, test_f1: 0.5208
 epoch: 33, train_loss: 0.8481, test_loss: 0.9977, test_f1: 0.5059
 epoch: 34, train_loss: 0.8583, test_loss: 0.9290, test_f1: 0.5183
 epoch: 35, train_loss: 0.8524, test_loss: 0.9340, test_f1: 0.5210
 epoch: 36, train_loss: 0.8547, test_loss: 0.9428, test_f1: 0.5319
 epoch: 37, train_loss: 0.8415, test_loss: 0.9543, test_f1: 0.5399
 epoch: 38, train_loss: 0.8404, test_loss: 0.9365, test_f1: 0.5497
 epoch: 39, train_loss: 0.8305, test_loss: 0.9349, test_f1: 0.5593
 epoch: 40, train_loss: 0.8417, test_loss: 0.9521, test_f1: 0.5597
 epoch: 41, train_loss: 0.8200, test_loss: 1.0124, test_f1: 0.5263
 epoch: 42, train_loss: 0.8263, test_loss: 0.9851, test_f1: 0.5345
 epoch: 43, train_loss: 0.8292, test_loss: 0.9474, test_f1: 0.5658
 epoch: 44, train_loss: 0.8164, test_loss: 0.9450, test_f1: 0.5779
 epoch: 45, train_loss: 0.8174, test_loss: 0.9263, test_f1: 0.5839
 epoch: 46, train_loss: 0.8152, test_loss: 0.9644, test_f1: 0.5705
 epoch: 47, train_loss: 0.8070, test_loss: 0.9481, test_f1: 0.5745
 epoch: 48, train_loss: 0.8051, test_loss: 0.9655, test_f1: 0.5910
 epoch: 49, train_loss: 0.7991, test_loss: 0.9644, test_f1: 0.5771
 epoch: 50, train_loss: 0.8036, test_loss: 0.9619, test_f1: 0.5890
 epoch: 51, train_loss: 0.8089, test_loss: 0.9768, test_f1: 0.5793
 epoch: 52, train_loss: 0.7844, test_loss: 0.9644, test_f1: 0.5830
 epoch: 53, train_loss: 0.7818, test_loss: 0.9425, test_f1: 0.5948
 epoch: 54, train_loss: 0.7856, test_loss: 0.9626, test_f1: 0.5992
 epoch: 55, train_loss: 0.7952, test_loss: 0.9661, test_f1: 0.5739
 epoch: 56, train_loss: 0.7860, test_loss: 0.9485, test_f1: 0.5944
 epoch: 57, train_loss: 0.7759, test_loss: 0.9634, test_f1: 0.5860
 epoch: 58, train_loss: 0.7853, test_loss: 0.9711, test_f1: 0.6025
 epoch: 59, train_loss: 0.7809, test_loss: 0.9462, test_f1: 0.5858
 epoch: 60, train_loss: 0.7804, test_loss: 0.9501, test_f1: 0.6055
 epoch: 61, train_loss: 0.7819, test_loss: 0.9594, test_f1: 0.5891
 epoch: 62, train_loss: 0.7851, test_loss: 0.9789, test_f1: 0.5795
 epoch: 63, train_loss: 0.7867, test_loss: 0.9656, test_f1: 0.5812
 epoch: 64, train_loss: 0.7785, test_loss: 0.9538, test_f1: 0.6022
 epoch: 65, train_loss: 0.7726, test_loss: 0.9559, test_f1: 0.5976
 epoch: 66, train_loss: 0.7606, test_loss: 0.9569, test_f1: 0.5906
 epoch: 67, train_loss: 0.7714, test_loss: 0.9728, test_f1: 0.5934
 epoch: 68, train_loss: 0.7745, test_loss: 0.9666, test_f1: 0.5867
 epoch: 69, train_loss: 0.7621, test_loss: 0.9475, test_f1: 0.6108
 epoch: 70, train_loss: 0.7698, test_loss: 0.9499, test_f1: 0.5841
 epoch: 71, train_loss: 0.7570, test_loss: 0.9701, test_f1: 0.6035
 epoch: 72, train_loss: 0.7610, test_loss: 0.9697, test_f1: 0.5927
 epoch: 73, train_loss: 0.7633, test_loss: 0.9409, test_f1: 0.6094
 epoch: 74, train_loss: 0.7596, test_loss: 0.9676, test_f1: 0.5884
 epoch: 75, train_loss: 0.7557, test_loss: 0.9755, test_f1: 0.5838
 epoch: 76, train_loss: 0.7583, test_loss: 0.9466, test_f1: 0.5997
 epoch: 77, train_loss: 0.7521, test_loss: 0.9412, test_f1: 0.5883
 epoch: 78, train_loss: 0.7472, test_loss: 0.9965, test_f1: 0.5874
 epoch: 79, train_loss: 0.7534, test_loss: 0.9500, test_f1: 0.5979
 epoch: 80, train_loss: 0.7459, test_loss: 0.9802, test_f1: 0.5792
 epoch: 81, train_loss: 0.7486, test_loss: 0.9676, test_f1: 0.5962
 epoch: 82, train_loss: 0.7616, test_loss: 0.9975, test_f1: 0.5797
 epoch: 83, train_loss: 0.7508, test_loss: 0.9734, test_f1: 0.5913
 epoch: 84, train_loss: 0.7429, test_loss: 0.9948, test_f1: 0.5884
 epoch: 85, train_loss: 0.7538, test_loss: 0.9707, test_f1: 0.5896
 epoch: 86, train_loss: 0.7390, test_loss: 0.9444, test_f1: 0.6070
 epoch: 87, train_loss: 0.7445, test_loss: 0.9615, test_f1: 0.5984
 epoch: 88, train_loss: 0.7456, test_loss: 0.9485, test_f1: 0.5953
 epoch: 89, train_loss: 0.7446, test_loss: 1.0065, test_f1: 0.5651
 epoch: 90, train_loss: 0.7412, test_loss: 0.9492, test_f1: 0.6042
 epoch: 91, train_loss: 0.7369, test_loss: 0.9421, test_f1: 0.6049
 epoch: 92, train_loss: 0.7308, test_loss: 0.9516, test_f1: 0.5941
 epoch: 93, train_loss: 0.7245, test_loss: 0.9762, test_f1: 0.6205
 epoch: 94, train_loss: 0.7351, test_loss: 0.9954, test_f1: 0.5785
 epoch: 95, train_loss: 0.7312, test_loss: 0.9756, test_f1: 0.5879
 epoch: 96, train_loss: 0.7280, test_loss: 0.9703, test_f1: 0.5953
 epoch: 97, train_loss: 0.7357, test_loss: 0.9380, test_f1: 0.5990
 epoch: 98, train_loss: 0.7308, test_loss: 0.9582, test_f1: 0.5878
 epoch: 99, train_loss: 0.7222, test_loss: 0.9750, test_f1: 0.5966
##################ITERATION #1 ****************************************
 epoch: 0, train_loss: 1.2832, test_loss: 1.2038, test_f1: 0.3258
 epoch: 1, train_loss: 1.2076, test_loss: 1.1555, test_f1: 0.4020
 epoch: 2, train_loss: 1.1666, test_loss: 1.1107, test_f1: 0.4479
 epoch: 3, train_loss: 1.1245, test_loss: 1.0660, test_f1: 0.4393
 epoch: 4, train_loss: 1.0868, test_loss: 1.0332, test_f1: 0.4511
 epoch: 5, train_loss: 1.0593, test_loss: 0.9939, test_f1: 0.4662
 epoch: 6, train_loss: 1.0271, test_loss: 0.9880, test_f1: 0.4663
 epoch: 7, train_loss: 1.0233, test_loss: 0.9614, test_f1: 0.4745
 epoch: 8, train_loss: 0.9942, test_loss: 0.9572, test_f1: 0.4659
 epoch: 9, train_loss: 0.9906, test_loss: 0.9454, test_f1: 0.4926
 epoch: 10, train_loss: 0.9687, test_loss: 0.9553, test_f1: 0.4872
 epoch: 11, train_loss: 0.9648, test_loss: 0.9381, test_f1: 0.4964
 epoch: 12, train_loss: 0.9563, test_loss: 0.9561, test_f1: 0.4921
 epoch: 13, train_loss: 0.9426, test_loss: 0.9399, test_f1: 0.4990
 epoch: 14, train_loss: 0.9475, test_loss: 0.9331, test_f1: 0.5255
 epoch: 15, train_loss: 0.9401, test_loss: 0.9161, test_f1: 0.5027
 epoch: 16, train_loss: 0.9325, test_loss: 0.9254, test_f1: 0.5102
 epoch: 17, train_loss: 0.9225, test_loss: 0.9153, test_f1: 0.5157
 epoch: 18, train_loss: 0.9136, test_loss: 0.9360, test_f1: 0.5026
 epoch: 19, train_loss: 0.9081, test_loss: 0.9063, test_f1: 0.5194
 epoch: 20, train_loss: 0.9053, test_loss: 0.9124, test_f1: 0.5131
 epoch: 21, train_loss: 0.9027, test_loss: 0.9218, test_f1: 0.5324
 epoch: 22, train_loss: 0.9059, test_loss: 0.9301, test_f1: 0.5058
 epoch: 23, train_loss: 0.8969, test_loss: 0.9234, test_f1: 0.5212
 epoch: 24, train_loss: 0.8942, test_loss: 0.9355, test_f1: 0.5269
 epoch: 25, train_loss: 0.8856, test_loss: 0.9232, test_f1: 0.5312
 epoch: 26, train_loss: 0.8803, test_loss: 0.9418, test_f1: 0.5221
 epoch: 27, train_loss: 0.8785, test_loss: 0.9334, test_f1: 0.5193
 epoch: 28, train_loss: 0.8667, test_loss: 0.9486, test_f1: 0.5281
 epoch: 29, train_loss: 0.8593, test_loss: 0.9602, test_f1: 0.5187
 epoch: 30, train_loss: 0.8617, test_loss: 0.9329, test_f1: 0.5169
 epoch: 31, train_loss: 0.8546, test_loss: 0.9285, test_f1: 0.5329
 epoch: 32, train_loss: 0.8456, test_loss: 0.9259, test_f1: 0.5344
 epoch: 33, train_loss: 0.8524, test_loss: 0.9139, test_f1: 0.5297
 epoch: 34, train_loss: 0.8427, test_loss: 0.9313, test_f1: 0.5314
 epoch: 35, train_loss: 0.8431, test_loss: 0.9474, test_f1: 0.5152
 epoch: 36, train_loss: 0.8373, test_loss: 0.9530, test_f1: 0.5211
 epoch: 37, train_loss: 0.8392, test_loss: 0.9556, test_f1: 0.5238
 epoch: 38, train_loss: 0.8402, test_loss: 0.9436, test_f1: 0.5326
 epoch: 39, train_loss: 0.8305, test_loss: 0.9376, test_f1: 0.5400
 epoch: 40, train_loss: 0.8261, test_loss: 0.9494, test_f1: 0.5187
 epoch: 41, train_loss: 0.8271, test_loss: 0.9429, test_f1: 0.5319
 epoch: 42, train_loss: 0.8158, test_loss: 0.9286, test_f1: 0.5251
 epoch: 43, train_loss: 0.8158, test_loss: 0.9364, test_f1: 0.5388
 epoch: 44, train_loss: 0.8117, test_loss: 0.9496, test_f1: 0.5314
 epoch: 45, train_loss: 0.8188, test_loss: 0.9324, test_f1: 0.5406
 epoch: 46, train_loss: 0.8174, test_loss: 0.9330, test_f1: 0.5371
 epoch: 47, train_loss: 0.8177, test_loss: 0.9115, test_f1: 0.5575
 epoch: 48, train_loss: 0.8124, test_loss: 0.9414, test_f1: 0.5415
 epoch: 49, train_loss: 0.8004, test_loss: 0.9375, test_f1: 0.5594
 epoch: 50, train_loss: 0.7934, test_loss: 0.9265, test_f1: 0.5396
 epoch: 51, train_loss: 0.7892, test_loss: 0.9455, test_f1: 0.5589
 epoch: 52, train_loss: 0.7814, test_loss: 0.9316, test_f1: 0.5655
 epoch: 53, train_loss: 0.7811, test_loss: 0.9417, test_f1: 0.5565
 epoch: 54, train_loss: 0.7869, test_loss: 0.9376, test_f1: 0.5711
 epoch: 55, train_loss: 0.7913, test_loss: 1.0077, test_f1: 0.5594
 epoch: 56, train_loss: 0.7713, test_loss: 0.9460, test_f1: 0.5816
 epoch: 57, train_loss: 0.7886, test_loss: 0.9558, test_f1: 0.5718
 epoch: 58, train_loss: 0.7662, test_loss: 0.9317, test_f1: 0.5706
 epoch: 59, train_loss: 0.7747, test_loss: 0.9542, test_f1: 0.5693
 epoch: 60, train_loss: 0.7749, test_loss: 0.9219, test_f1: 0.5792
 epoch: 61, train_loss: 0.7697, test_loss: 0.9590, test_f1: 0.5855
 epoch: 62, train_loss: 0.7712, test_loss: 0.9245, test_f1: 0.5568
 epoch: 63, train_loss: 0.7733, test_loss: 0.9421, test_f1: 0.5722
 epoch: 64, train_loss: 0.7692, test_loss: 0.9575, test_f1: 0.5612
 epoch: 65, train_loss: 0.7679, test_loss: 0.9326, test_f1: 0.5708
 epoch: 66, train_loss: 0.7620, test_loss: 0.9532, test_f1: 0.5522
 epoch: 67, train_loss: 0.7714, test_loss: 0.9693, test_f1: 0.5517
 epoch: 68, train_loss: 0.7620, test_loss: 0.9919, test_f1: 0.5782
 epoch: 69, train_loss: 0.7793, test_loss: 0.9786, test_f1: 0.5589
 epoch: 70, train_loss: 0.7650, test_loss: 0.9550, test_f1: 0.5688
 epoch: 71, train_loss: 0.7643, test_loss: 0.9315, test_f1: 0.5743
 epoch: 72, train_loss: 0.7549, test_loss: 0.9224, test_f1: 0.5580
 epoch: 73, train_loss: 0.7533, test_loss: 0.9511, test_f1: 0.5666
 epoch: 74, train_loss: 0.7559, test_loss: 0.9413, test_f1: 0.5746
 epoch: 75, train_loss: 0.7689, test_loss: 0.9367, test_f1: 0.5811
 epoch: 76, train_loss: 0.7567, test_loss: 0.9382, test_f1: 0.5785
 epoch: 77, train_loss: 0.7509, test_loss: 0.9319, test_f1: 0.5932
 epoch: 78, train_loss: 0.7553, test_loss: 0.9568, test_f1: 0.5704
 epoch: 79, train_loss: 0.7414, test_loss: 0.9318, test_f1: 0.5959
 epoch: 80, train_loss: 0.7437, test_loss: 0.9357, test_f1: 0.5709
 epoch: 81, train_loss: 0.7461, test_loss: 0.9331, test_f1: 0.5820
 epoch: 82, train_loss: 0.7458, test_loss: 0.9405, test_f1: 0.5907
 epoch: 83, train_loss: 0.7355, test_loss: 0.9320, test_f1: 0.5834
 epoch: 84, train_loss: 0.7515, test_loss: 0.9360, test_f1: 0.5722
 epoch: 85, train_loss: 0.7484, test_loss: 0.9475, test_f1: 0.5832
 epoch: 86, train_loss: 0.7468, test_loss: 0.9777, test_f1: 0.5763
 epoch: 87, train_loss: 0.7331, test_loss: 0.9984, test_f1: 0.5755
 epoch: 88, train_loss: 0.7497, test_loss: 0.9814, test_f1: 0.5719
 epoch: 89, train_loss: 0.7286, test_loss: 0.9642, test_f1: 0.5737
 epoch: 90, train_loss: 0.7340, test_loss: 0.9630, test_f1: 0.5879
 epoch: 91, train_loss: 0.7304, test_loss: 0.9461, test_f1: 0.5875
 epoch: 92, train_loss: 0.7293, test_loss: 0.9559, test_f1: 0.5828
 epoch: 93, train_loss: 0.7328, test_loss: 0.9449, test_f1: 0.5832
 epoch: 94, train_loss: 0.7293, test_loss: 0.9317, test_f1: 0.5813
 epoch: 95, train_loss: 0.7250, test_loss: 0.9310, test_f1: 0.5876
 epoch: 96, train_loss: 0.7360, test_loss: 0.9576, test_f1: 0.5855
 epoch: 97, train_loss: 0.7241, test_loss: 0.9502, test_f1: 0.6098
 epoch: 98, train_loss: 0.7445, test_loss: 0.9664, test_f1: 0.5723
 epoch: 99, train_loss: 0.7273, test_loss: 0.9653, test_f1: 0.5646
##################ITERATION #2 ****************************************
 epoch: 0, train_loss: 1.2647, test_loss: 1.1753, test_f1: 0.3557
 epoch: 1, train_loss: 1.1801, test_loss: 1.1160, test_f1: 0.4275
 epoch: 2, train_loss: 1.1367, test_loss: 1.0867, test_f1: 0.4279
 epoch: 3, train_loss: 1.1016, test_loss: 1.0329, test_f1: 0.4391
 epoch: 4, train_loss: 1.0695, test_loss: 1.0089, test_f1: 0.4528
 epoch: 5, train_loss: 1.0445, test_loss: 0.9997, test_f1: 0.4428
 epoch: 6, train_loss: 1.0167, test_loss: 0.9705, test_f1: 0.4555
 epoch: 7, train_loss: 1.0086, test_loss: 0.9529, test_f1: 0.4610
 epoch: 8, train_loss: 0.9919, test_loss: 0.9587, test_f1: 0.4589
 epoch: 9, train_loss: 0.9727, test_loss: 0.9481, test_f1: 0.4719
 epoch: 10, train_loss: 0.9623, test_loss: 0.9432, test_f1: 0.4687
 epoch: 11, train_loss: 0.9604, test_loss: 0.9177, test_f1: 0.4986
 epoch: 12, train_loss: 0.9542, test_loss: 0.9395, test_f1: 0.4924
 epoch: 13, train_loss: 0.9339, test_loss: 0.9395, test_f1: 0.4891
 epoch: 14, train_loss: 0.9273, test_loss: 0.9335, test_f1: 0.5007
 epoch: 15, train_loss: 0.9249, test_loss: 0.9188, test_f1: 0.5272
 epoch: 16, train_loss: 0.9186, test_loss: 0.9408, test_f1: 0.5262
 epoch: 17, train_loss: 0.9154, test_loss: 0.9231, test_f1: 0.5110
 epoch: 18, train_loss: 0.9056, test_loss: 0.9277, test_f1: 0.5247
 epoch: 19, train_loss: 0.8954, test_loss: 0.9125, test_f1: 0.5326
 epoch: 20, train_loss: 0.9036, test_loss: 0.9329, test_f1: 0.5361
 epoch: 21, train_loss: 0.8856, test_loss: 0.8956, test_f1: 0.5564
 epoch: 22, train_loss: 0.8940, test_loss: 0.9204, test_f1: 0.5324
 epoch: 23, train_loss: 0.8914, test_loss: 0.9243, test_f1: 0.5611
 epoch: 24, train_loss: 0.8842, test_loss: 0.9055, test_f1: 0.5255
 epoch: 25, train_loss: 0.8672, test_loss: 0.8998, test_f1: 0.5434
 epoch: 26, train_loss: 0.8695, test_loss: 0.9129, test_f1: 0.5742
 epoch: 27, train_loss: 0.8631, test_loss: 0.9214, test_f1: 0.5677
 epoch: 28, train_loss: 0.8640, test_loss: 0.8943, test_f1: 0.5783
 epoch: 29, train_loss: 0.8505, test_loss: 0.9237, test_f1: 0.5489
 epoch: 30, train_loss: 0.8556, test_loss: 0.9360, test_f1: 0.5564
 epoch: 31, train_loss: 0.8462, test_loss: 0.9302, test_f1: 0.5521
 epoch: 32, train_loss: 0.8452, test_loss: 0.9092, test_f1: 0.5695
 epoch: 33, train_loss: 0.8413, test_loss: 0.9241, test_f1: 0.5394
 epoch: 34, train_loss: 0.8279, test_loss: 0.9233, test_f1: 0.5620
 epoch: 35, train_loss: 0.8248, test_loss: 0.9150, test_f1: 0.5550
 epoch: 36, train_loss: 0.8339, test_loss: 0.9008, test_f1: 0.5577
 epoch: 37, train_loss: 0.8257, test_loss: 0.9130, test_f1: 0.5484
 epoch: 38, train_loss: 0.8201, test_loss: 0.9117, test_f1: 0.5860
 epoch: 39, train_loss: 0.8235, test_loss: 0.9160, test_f1: 0.5612
 epoch: 40, train_loss: 0.8154, test_loss: 0.9252, test_f1: 0.5657
 epoch: 41, train_loss: 0.8126, test_loss: 0.9161, test_f1: 0.5651
 epoch: 42, train_loss: 0.8162, test_loss: 0.9189, test_f1: 0.5739
 epoch: 43, train_loss: 0.8037, test_loss: 0.9350, test_f1: 0.5577
 epoch: 44, train_loss: 0.8036, test_loss: 0.9376, test_f1: 0.5856
 epoch: 45, train_loss: 0.8080, test_loss: 0.9489, test_f1: 0.5735
 epoch: 46, train_loss: 0.8036, test_loss: 0.9213, test_f1: 0.5600
 epoch: 47, train_loss: 0.7947, test_loss: 0.9425, test_f1: 0.6033
 epoch: 48, train_loss: 0.7943, test_loss: 0.9638, test_f1: 0.5619
 epoch: 49, train_loss: 0.7915, test_loss: 0.9333, test_f1: 0.5548
 epoch: 50, train_loss: 0.7777, test_loss: 0.9469, test_f1: 0.5997
 epoch: 51, train_loss: 0.7855, test_loss: 0.9458, test_f1: 0.5700
 epoch: 52, train_loss: 0.7853, test_loss: 0.9150, test_f1: 0.5598
 epoch: 53, train_loss: 0.7744, test_loss: 0.9469, test_f1: 0.5705
 epoch: 54, train_loss: 0.7679, test_loss: 0.9473, test_f1: 0.5610
 epoch: 55, train_loss: 0.7756, test_loss: 0.9372, test_f1: 0.5899
 epoch: 56, train_loss: 0.7785, test_loss: 0.9350, test_f1: 0.5950
 epoch: 57, train_loss: 0.7677, test_loss: 0.9299, test_f1: 0.5790
 epoch: 58, train_loss: 0.7720, test_loss: 0.9516, test_f1: 0.5669
 epoch: 59, train_loss: 0.7696, test_loss: 0.9096, test_f1: 0.5793
 epoch: 60, train_loss: 0.7573, test_loss: 0.9247, test_f1: 0.5996
 epoch: 61, train_loss: 0.7701, test_loss: 0.9301, test_f1: 0.5851
 epoch: 62, train_loss: 0.7584, test_loss: 0.9256, test_f1: 0.5909
 epoch: 63, train_loss: 0.7649, test_loss: 0.9109, test_f1: 0.5995
 epoch: 64, train_loss: 0.7549, test_loss: 0.9394, test_f1: 0.5917
 epoch: 65, train_loss: 0.7510, test_loss: 0.9231, test_f1: 0.5958
 epoch: 66, train_loss: 0.7458, test_loss: 0.9388, test_f1: 0.6084
 epoch: 67, train_loss: 0.7465, test_loss: 0.9488, test_f1: 0.5911
 epoch: 68, train_loss: 0.7477, test_loss: 0.9281, test_f1: 0.5821
 epoch: 69, train_loss: 0.7490, test_loss: 0.9221, test_f1: 0.5886
 epoch: 70, train_loss: 0.7498, test_loss: 0.9207, test_f1: 0.5875
 epoch: 71, train_loss: 0.7443, test_loss: 0.9308, test_f1: 0.5941
 epoch: 72, train_loss: 0.7452, test_loss: 0.9310, test_f1: 0.5996
 epoch: 73, train_loss: 0.7426, test_loss: 0.9167, test_f1: 0.5764
 epoch: 74, train_loss: 0.7494, test_loss: 0.9460, test_f1: 0.6030
 epoch: 75, train_loss: 0.7390, test_loss: 0.9133, test_f1: 0.5980
 epoch: 76, train_loss: 0.7287, test_loss: 0.9231, test_f1: 0.5622
 epoch: 77, train_loss: 0.7405, test_loss: 0.9213, test_f1: 0.6042
 epoch: 78, train_loss: 0.7373, test_loss: 0.9141, test_f1: 0.5887
 epoch: 79, train_loss: 0.7330, test_loss: 0.9489, test_f1: 0.5631
 epoch: 80, train_loss: 0.7402, test_loss: 0.9117, test_f1: 0.5880
 epoch: 81, train_loss: 0.7329, test_loss: 0.9454, test_f1: 0.5930
 epoch: 82, train_loss: 0.7340, test_loss: 0.9322, test_f1: 0.5970
 epoch: 83, train_loss: 0.7267, test_loss: 0.9258, test_f1: 0.6034
 epoch: 84, train_loss: 0.7267, test_loss: 0.9269, test_f1: 0.5999
 epoch: 85, train_loss: 0.7292, test_loss: 0.9055, test_f1: 0.5981
 epoch: 86, train_loss: 0.7291, test_loss: 0.9400, test_f1: 0.6028
 epoch: 87, train_loss: 0.7249, test_loss: 0.9204, test_f1: 0.6041
 epoch: 88, train_loss: 0.7202, test_loss: 0.9109, test_f1: 0.6163
 epoch: 89, train_loss: 0.7347, test_loss: 0.9413, test_f1: 0.5847
 epoch: 90, train_loss: 0.7232, test_loss: 0.9233, test_f1: 0.5727
 epoch: 91, train_loss: 0.7077, test_loss: 0.9293, test_f1: 0.5784
 epoch: 92, train_loss: 0.7210, test_loss: 0.9292, test_f1: 0.5838
 epoch: 93, train_loss: 0.7291, test_loss: 0.9314, test_f1: 0.5907
 epoch: 94, train_loss: 0.7269, test_loss: 0.9314, test_f1: 0.5954
 epoch: 95, train_loss: 0.7146, test_loss: 0.9384, test_f1: 0.5975
 epoch: 96, train_loss: 0.7223, test_loss: 0.9500, test_f1: 0.6087
 epoch: 97, train_loss: 0.7145, test_loss: 0.9373, test_f1: 0.5785
 epoch: 98, train_loss: 0.7086, test_loss: 0.9160, test_f1: 0.5815
 epoch: 99, train_loss: 0.7020, test_loss: 0.9279, test_f1: 0.5994
##################ITERATION #3 ****************************************
 epoch: 0, train_loss: 1.2642, test_loss: 1.1396, test_f1: 0.4092
 epoch: 1, train_loss: 1.1683, test_loss: 1.0923, test_f1: 0.4360
 epoch: 2, train_loss: 1.1259, test_loss: 1.0526, test_f1: 0.4500
 epoch: 3, train_loss: 1.0925, test_loss: 1.0201, test_f1: 0.4484
 epoch: 4, train_loss: 1.0615, test_loss: 1.0050, test_f1: 0.4587
 epoch: 5, train_loss: 1.0402, test_loss: 0.9982, test_f1: 0.4666
 epoch: 6, train_loss: 1.0142, test_loss: 0.9715, test_f1: 0.4798
 epoch: 7, train_loss: 1.0056, test_loss: 0.9619, test_f1: 0.4767
 epoch: 8, train_loss: 0.9871, test_loss: 0.9459, test_f1: 0.4985
 epoch: 9, train_loss: 0.9713, test_loss: 0.9649, test_f1: 0.4907
 epoch: 10, train_loss: 0.9588, test_loss: 0.9401, test_f1: 0.5071
 epoch: 11, train_loss: 0.9416, test_loss: 0.9346, test_f1: 0.5169
 epoch: 12, train_loss: 0.9359, test_loss: 0.9221, test_f1: 0.5181
 epoch: 13, train_loss: 0.9367, test_loss: 0.9259, test_f1: 0.5069
 epoch: 14, train_loss: 0.9232, test_loss: 0.9267, test_f1: 0.5190
 epoch: 15, train_loss: 0.9169, test_loss: 0.9380, test_f1: 0.5157
 epoch: 16, train_loss: 0.9197, test_loss: 0.9381, test_f1: 0.5224
 epoch: 17, train_loss: 0.9151, test_loss: 0.9306, test_f1: 0.5388
 epoch: 18, train_loss: 0.9157, test_loss: 0.9250, test_f1: 0.5133
 epoch: 19, train_loss: 0.9002, test_loss: 0.9347, test_f1: 0.5153
 epoch: 20, train_loss: 0.8951, test_loss: 0.9071, test_f1: 0.5379
 epoch: 21, train_loss: 0.8912, test_loss: 0.9365, test_f1: 0.5344
 epoch: 22, train_loss: 0.8954, test_loss: 0.8987, test_f1: 0.5306
 epoch: 23, train_loss: 0.8841, test_loss: 0.9094, test_f1: 0.5327
 epoch: 24, train_loss: 0.8720, test_loss: 0.9057, test_f1: 0.5528
 epoch: 25, train_loss: 0.8723, test_loss: 0.9263, test_f1: 0.5311
 epoch: 26, train_loss: 0.8733, test_loss: 0.9229, test_f1: 0.5312
 epoch: 27, train_loss: 0.8640, test_loss: 0.9077, test_f1: 0.5266
 epoch: 28, train_loss: 0.8644, test_loss: 0.9329, test_f1: 0.5391
 epoch: 29, train_loss: 0.8500, test_loss: 0.9267, test_f1: 0.5384
 epoch: 30, train_loss: 0.8479, test_loss: 0.9223, test_f1: 0.5453
 epoch: 31, train_loss: 0.8471, test_loss: 0.9256, test_f1: 0.5477
 epoch: 32, train_loss: 0.8499, test_loss: 0.9351, test_f1: 0.5459
 epoch: 33, train_loss: 0.8469, test_loss: 0.9206, test_f1: 0.5398
 epoch: 34, train_loss: 0.8406, test_loss: 0.9460, test_f1: 0.5150
 epoch: 35, train_loss: 0.8454, test_loss: 0.9259, test_f1: 0.5503
 epoch: 36, train_loss: 0.8435, test_loss: 0.9355, test_f1: 0.5524
 epoch: 37, train_loss: 0.8369, test_loss: 0.9362, test_f1: 0.5464
 epoch: 38, train_loss: 0.8268, test_loss: 0.9544, test_f1: 0.5525
 epoch: 39, train_loss: 0.8228, test_loss: 0.9252, test_f1: 0.5547
 epoch: 40, train_loss: 0.8243, test_loss: 0.9183, test_f1: 0.5720
 epoch: 41, train_loss: 0.8273, test_loss: 0.9441, test_f1: 0.5472
 epoch: 42, train_loss: 0.8112, test_loss: 0.9303, test_f1: 0.5381
 epoch: 43, train_loss: 0.8095, test_loss: 0.9507, test_f1: 0.5454
 epoch: 44, train_loss: 0.8195, test_loss: 0.9494, test_f1: 0.5771
 epoch: 45, train_loss: 0.8094, test_loss: 0.9355, test_f1: 0.5747
 epoch: 46, train_loss: 0.8121, test_loss: 0.9400, test_f1: 0.5691
 epoch: 47, train_loss: 0.7948, test_loss: 0.9213, test_f1: 0.5770
 epoch: 48, train_loss: 0.7882, test_loss: 0.9498, test_f1: 0.5492
 epoch: 49, train_loss: 0.7942, test_loss: 0.9700, test_f1: 0.5593
 epoch: 50, train_loss: 0.8016, test_loss: 0.9349, test_f1: 0.5580
 epoch: 51, train_loss: 0.7886, test_loss: 0.9763, test_f1: 0.5485
 epoch: 52, train_loss: 0.7804, test_loss: 0.9758, test_f1: 0.5575
 epoch: 53, train_loss: 0.7852, test_loss: 0.9448, test_f1: 0.5484
 epoch: 54, train_loss: 0.7824, test_loss: 0.9478, test_f1: 0.5710
 epoch: 55, train_loss: 0.7829, test_loss: 0.9382, test_f1: 0.5591
 epoch: 56, train_loss: 0.7783, test_loss: 0.9484, test_f1: 0.5556
 epoch: 57, train_loss: 0.7781, test_loss: 0.9649, test_f1: 0.5669
 epoch: 58, train_loss: 0.7788, test_loss: 0.9720, test_f1: 0.5458
 epoch: 59, train_loss: 0.7722, test_loss: 0.9586, test_f1: 0.5557
 epoch: 60, train_loss: 0.7645, test_loss: 0.9678, test_f1: 0.5547
 epoch: 61, train_loss: 0.7772, test_loss: 0.9513, test_f1: 0.5640
 epoch: 62, train_loss: 0.7648, test_loss: 0.9541, test_f1: 0.5725
 epoch: 63, train_loss: 0.7728, test_loss: 0.9423, test_f1: 0.5745
 epoch: 64, train_loss: 0.7780, test_loss: 0.9641, test_f1: 0.5692
 epoch: 65, train_loss: 0.7742, test_loss: 0.9516, test_f1: 0.5752
 epoch: 66, train_loss: 0.7681, test_loss: 0.9634, test_f1: 0.5695
 epoch: 67, train_loss: 0.7623, test_loss: 0.9500, test_f1: 0.5821
 epoch: 68, train_loss: 0.7551, test_loss: 0.9587, test_f1: 0.5749
 epoch: 69, train_loss: 0.7523, test_loss: 0.9576, test_f1: 0.5906
 epoch: 70, train_loss: 0.7527, test_loss: 0.9570, test_f1: 0.5864
 epoch: 71, train_loss: 0.7588, test_loss: 0.9834, test_f1: 0.5623
 epoch: 72, train_loss: 0.7621, test_loss: 0.9630, test_f1: 0.5832
 epoch: 73, train_loss: 0.7476, test_loss: 0.9514, test_f1: 0.5960
 epoch: 74, train_loss: 0.7499, test_loss: 0.9902, test_f1: 0.5717
 epoch: 75, train_loss: 0.7542, test_loss: 0.9429, test_f1: 0.5998
 epoch: 76, train_loss: 0.7481, test_loss: 0.9667, test_f1: 0.5882
 epoch: 77, train_loss: 0.7454, test_loss: 0.9919, test_f1: 0.5684
 epoch: 78, train_loss: 0.7448, test_loss: 0.9677, test_f1: 0.5846
 epoch: 79, train_loss: 0.7443, test_loss: 0.9573, test_f1: 0.5889
 epoch: 80, train_loss: 0.7354, test_loss: 0.9777, test_f1: 0.5725
 epoch: 81, train_loss: 0.7462, test_loss: 0.9804, test_f1: 0.5750
 epoch: 82, train_loss: 0.7394, test_loss: 0.9813, test_f1: 0.5832
 epoch: 83, train_loss: 0.7371, test_loss: 0.9805, test_f1: 0.6011
 epoch: 84, train_loss: 0.7372, test_loss: 0.9729, test_f1: 0.5839
 epoch: 85, train_loss: 0.7362, test_loss: 0.9970, test_f1: 0.5715
 epoch: 86, train_loss: 0.7218, test_loss: 0.9631, test_f1: 0.6014
 epoch: 87, train_loss: 0.7342, test_loss: 0.9854, test_f1: 0.5777
 epoch: 88, train_loss: 0.7268, test_loss: 0.9918, test_f1: 0.5733
 epoch: 89, train_loss: 0.7291, test_loss: 0.9783, test_f1: 0.5761
 epoch: 90, train_loss: 0.7294, test_loss: 0.9852, test_f1: 0.5920
 epoch: 91, train_loss: 0.7286, test_loss: 0.9690, test_f1: 0.6002
 epoch: 92, train_loss: 0.7286, test_loss: 0.9762, test_f1: 0.5968
 epoch: 93, train_loss: 0.7197, test_loss: 0.9782, test_f1: 0.5799
 epoch: 94, train_loss: 0.7143, test_loss: 0.9829, test_f1: 0.5947
 epoch: 95, train_loss: 0.7227, test_loss: 0.9775, test_f1: 0.5706
 epoch: 96, train_loss: 0.7189, test_loss: 0.9766, test_f1: 0.5834
 epoch: 97, train_loss: 0.7178, test_loss: 0.9820, test_f1: 0.5920
 epoch: 98, train_loss: 0.7259, test_loss: 0.9820, test_f1: 0.6052
 epoch: 99, train_loss: 0.7133, test_loss: 0.9934, test_f1: 0.5869
##################ITERATION #4 ****************************************
 epoch: 0, train_loss: 1.2690, test_loss: 1.1263, test_f1: 0.4034
 epoch: 1, train_loss: 1.1583, test_loss: 1.0931, test_f1: 0.4251
 epoch: 2, train_loss: 1.1269, test_loss: 1.0547, test_f1: 0.4603
 epoch: 3, train_loss: 1.0852, test_loss: 1.0251, test_f1: 0.4676
 epoch: 4, train_loss: 1.0640, test_loss: 0.9891, test_f1: 0.4787
 epoch: 5, train_loss: 1.0462, test_loss: 0.9869, test_f1: 0.4789
 epoch: 6, train_loss: 1.0271, test_loss: 0.9734, test_f1: 0.4737
 epoch: 7, train_loss: 1.0118, test_loss: 0.9601, test_f1: 0.4946
 epoch: 8, train_loss: 1.0028, test_loss: 0.9662, test_f1: 0.4942
 epoch: 9, train_loss: 0.9944, test_loss: 0.9499, test_f1: 0.5000
 epoch: 10, train_loss: 0.9873, test_loss: 0.9511, test_f1: 0.5034
 epoch: 11, train_loss: 0.9668, test_loss: 0.9453, test_f1: 0.5068
 epoch: 12, train_loss: 0.9613, test_loss: 0.9348, test_f1: 0.5090
 epoch: 13, train_loss: 0.9557, test_loss: 0.9130, test_f1: 0.5088
 epoch: 14, train_loss: 0.9531, test_loss: 0.9246, test_f1: 0.5344
 epoch: 15, train_loss: 0.9313, test_loss: 0.9057, test_f1: 0.5309
 epoch: 16, train_loss: 0.9281, test_loss: 0.9107, test_f1: 0.5253
 epoch: 17, train_loss: 0.9226, test_loss: 0.9180, test_f1: 0.5436
 epoch: 18, train_loss: 0.9252, test_loss: 0.9185, test_f1: 0.5293
 epoch: 19, train_loss: 0.9157, test_loss: 0.9117, test_f1: 0.5563
 epoch: 20, train_loss: 0.9120, test_loss: 0.9268, test_f1: 0.5463
 epoch: 21, train_loss: 0.8916, test_loss: 0.9031, test_f1: 0.5600
 epoch: 22, train_loss: 0.8848, test_loss: 0.9202, test_f1: 0.5384
 epoch: 23, train_loss: 0.8803, test_loss: 0.9201, test_f1: 0.5603
 epoch: 24, train_loss: 0.8841, test_loss: 0.9148, test_f1: 0.5540
 epoch: 25, train_loss: 0.8850, test_loss: 0.9109, test_f1: 0.5880
 epoch: 26, train_loss: 0.8750, test_loss: 0.9138, test_f1: 0.5675
 epoch: 27, train_loss: 0.8690, test_loss: 0.9019, test_f1: 0.5939
 epoch: 28, train_loss: 0.8681, test_loss: 0.9066, test_f1: 0.5703
 epoch: 29, train_loss: 0.8721, test_loss: 0.8991, test_f1: 0.5536
 epoch: 30, train_loss: 0.8610, test_loss: 0.9208, test_f1: 0.5795
 epoch: 31, train_loss: 0.8530, test_loss: 0.9276, test_f1: 0.5696
 epoch: 32, train_loss: 0.8586, test_loss: 0.9012, test_f1: 0.5872
 epoch: 33, train_loss: 0.8486, test_loss: 0.9036, test_f1: 0.5658
 epoch: 34, train_loss: 0.8526, test_loss: 0.9086, test_f1: 0.5509
 epoch: 35, train_loss: 0.8512, test_loss: 0.8944, test_f1: 0.5705
 epoch: 36, train_loss: 0.8394, test_loss: 0.9120, test_f1: 0.5808
 epoch: 37, train_loss: 0.8472, test_loss: 0.9126, test_f1: 0.5456
 epoch: 38, train_loss: 0.8273, test_loss: 0.9051, test_f1: 0.5748
 epoch: 39, train_loss: 0.8252, test_loss: 0.9143, test_f1: 0.5770
 epoch: 40, train_loss: 0.8350, test_loss: 0.9178, test_f1: 0.5395
 epoch: 41, train_loss: 0.8207, test_loss: 0.9041, test_f1: 0.5779
 epoch: 42, train_loss: 0.8051, test_loss: 0.9175, test_f1: 0.5780
 epoch: 43, train_loss: 0.8101, test_loss: 0.9650, test_f1: 0.5785
 epoch: 44, train_loss: 0.8189, test_loss: 0.8663, test_f1: 0.5563
 epoch: 45, train_loss: 0.8199, test_loss: 0.8863, test_f1: 0.5910
 epoch: 46, train_loss: 0.8072, test_loss: 0.9206, test_f1: 0.5870
 epoch: 47, train_loss: 0.7976, test_loss: 0.9033, test_f1: 0.5812
 epoch: 48, train_loss: 0.7971, test_loss: 0.9194, test_f1: 0.5919
 epoch: 49, train_loss: 0.8036, test_loss: 0.9154, test_f1: 0.5998
 epoch: 50, train_loss: 0.8000, test_loss: 0.9221, test_f1: 0.5661
 epoch: 51, train_loss: 0.7858, test_loss: 0.8969, test_f1: 0.5979
 epoch: 52, train_loss: 0.7813, test_loss: 0.9251, test_f1: 0.5531
 epoch: 53, train_loss: 0.7825, test_loss: 0.9161, test_f1: 0.5714
 epoch: 54, train_loss: 0.7869, test_loss: 0.9201, test_f1: 0.5684
 epoch: 55, train_loss: 0.7774, test_loss: 0.9220, test_f1: 0.5651
 epoch: 56, train_loss: 0.7792, test_loss: 0.9178, test_f1: 0.5658
 epoch: 57, train_loss: 0.7767, test_loss: 0.9132, test_f1: 0.5953
 epoch: 58, train_loss: 0.7742, test_loss: 0.9203, test_f1: 0.5801
 epoch: 59, train_loss: 0.7699, test_loss: 0.9303, test_f1: 0.5729
 epoch: 60, train_loss: 0.7783, test_loss: 0.9332, test_f1: 0.5625
 epoch: 61, train_loss: 0.7730, test_loss: 0.9198, test_f1: 0.5711
 epoch: 62, train_loss: 0.7659, test_loss: 0.9002, test_f1: 0.5836
 epoch: 63, train_loss: 0.7694, test_loss: 0.9176, test_f1: 0.5843
 epoch: 64, train_loss: 0.7565, test_loss: 0.9099, test_f1: 0.5729
 epoch: 65, train_loss: 0.7645, test_loss: 0.9142, test_f1: 0.5625
 epoch: 66, train_loss: 0.7617, test_loss: 0.9056, test_f1: 0.5739
 epoch: 67, train_loss: 0.7604, test_loss: 0.9183, test_f1: 0.5755
 epoch: 68, train_loss: 0.7471, test_loss: 0.9145, test_f1: 0.5861
 epoch: 69, train_loss: 0.7616, test_loss: 0.9357, test_f1: 0.5739
 epoch: 70, train_loss: 0.7568, test_loss: 0.9076, test_f1: 0.5749
 epoch: 71, train_loss: 0.7557, test_loss: 0.9049, test_f1: 0.5699
 epoch: 72, train_loss: 0.7512, test_loss: 0.9098, test_f1: 0.5679
 epoch: 73, train_loss: 0.7453, test_loss: 0.9113, test_f1: 0.5860
 epoch: 74, train_loss: 0.7456, test_loss: 0.9094, test_f1: 0.5835
 epoch: 75, train_loss: 0.7438, test_loss: 0.9242, test_f1: 0.5920
 epoch: 76, train_loss: 0.7470, test_loss: 0.9033, test_f1: 0.5862
 epoch: 77, train_loss: 0.7388, test_loss: 0.9120, test_f1: 0.5666
 epoch: 78, train_loss: 0.7335, test_loss: 0.9347, test_f1: 0.5731
 epoch: 79, train_loss: 0.7400, test_loss: 0.9234, test_f1: 0.5850
 epoch: 80, train_loss: 0.7399, test_loss: 0.9172, test_f1: 0.5705
 epoch: 81, train_loss: 0.7423, test_loss: 0.9259, test_f1: 0.5771
 epoch: 82, train_loss: 0.7372, test_loss: 0.9333, test_f1: 0.5722
 epoch: 83, train_loss: 0.7290, test_loss: 0.9189, test_f1: 0.5763
 epoch: 84, train_loss: 0.7223, test_loss: 0.9236, test_f1: 0.5919
 epoch: 85, train_loss: 0.7349, test_loss: 0.9072, test_f1: 0.5856
 epoch: 86, train_loss: 0.7346, test_loss: 0.9337, test_f1: 0.5776
 epoch: 87, train_loss: 0.7305, test_loss: 0.9177, test_f1: 0.5897
 epoch: 88, train_loss: 0.7387, test_loss: 0.9452, test_f1: 0.5902
 epoch: 89, train_loss: 0.7248, test_loss: 0.9022, test_f1: 0.5908
 epoch: 90, train_loss: 0.7303, test_loss: 0.9007, test_f1: 0.5831
 epoch: 91, train_loss: 0.7328, test_loss: 0.9469, test_f1: 0.5716
 epoch: 92, train_loss: 0.7200, test_loss: 0.9156, test_f1: 0.5906
 epoch: 93, train_loss: 0.7190, test_loss: 0.9028, test_f1: 0.5887
 epoch: 94, train_loss: 0.7206, test_loss: 0.9057, test_f1: 0.5862
 epoch: 95, train_loss: 0.7270, test_loss: 0.9087, test_f1: 0.5821
 epoch: 96, train_loss: 0.7258, test_loss: 0.9189, test_f1: 0.6073
 epoch: 97, train_loss: 0.7303, test_loss: 0.9280, test_f1: 0.5913
 epoch: 98, train_loss: 0.7154, test_loss: 0.9162, test_f1: 0.5951
 epoch: 99, train_loss: 0.7095, test_loss: 0.9230, test_f1: 0.5760
##################ITERATION #5 ****************************************
 epoch: 0, train_loss: 1.2724, test_loss: 1.1088, test_f1: 0.3900
 epoch: 1, train_loss: 1.1352, test_loss: 1.0565, test_f1: 0.4159
 epoch: 2, train_loss: 1.1132, test_loss: 1.0255, test_f1: 0.4268
 epoch: 3, train_loss: 1.0901, test_loss: 1.0123, test_f1: 0.4554
 epoch: 4, train_loss: 1.0831, test_loss: 1.0055, test_f1: 0.4739
 epoch: 5, train_loss: 1.0470, test_loss: 0.9748, test_f1: 0.4741
 epoch: 6, train_loss: 1.0284, test_loss: 0.9575, test_f1: 0.4698
 epoch: 7, train_loss: 1.0176, test_loss: 0.9613, test_f1: 0.4787
 epoch: 8, train_loss: 1.0102, test_loss: 0.9686, test_f1: 0.4718
 epoch: 9, train_loss: 0.9967, test_loss: 0.9549, test_f1: 0.4906
 epoch: 10, train_loss: 0.9946, test_loss: 0.9401, test_f1: 0.4898
 epoch: 11, train_loss: 0.9700, test_loss: 0.9502, test_f1: 0.4694
 epoch: 12, train_loss: 0.9615, test_loss: 0.9434, test_f1: 0.4909
 epoch: 13, train_loss: 0.9542, test_loss: 0.9210, test_f1: 0.4965
 epoch: 14, train_loss: 0.9495, test_loss: 0.9441, test_f1: 0.4908
 epoch: 15, train_loss: 0.9413, test_loss: 0.9558, test_f1: 0.4934
 epoch: 16, train_loss: 0.9300, test_loss: 0.9312, test_f1: 0.5137
 epoch: 17, train_loss: 0.9229, test_loss: 0.9282, test_f1: 0.5086
 epoch: 18, train_loss: 0.9200, test_loss: 0.9693, test_f1: 0.4935
 epoch: 19, train_loss: 0.9165, test_loss: 0.9507, test_f1: 0.4937
 epoch: 20, train_loss: 0.9075, test_loss: 0.9389, test_f1: 0.4774
 epoch: 21, train_loss: 0.8918, test_loss: 0.9256, test_f1: 0.5191
 epoch: 22, train_loss: 0.9011, test_loss: 0.9512, test_f1: 0.5044
 epoch: 23, train_loss: 0.8931, test_loss: 0.9268, test_f1: 0.5032
 epoch: 24, train_loss: 0.8841, test_loss: 0.9168, test_f1: 0.5178
 epoch: 25, train_loss: 0.8872, test_loss: 0.9342, test_f1: 0.5062
 epoch: 26, train_loss: 0.8832, test_loss: 0.9367, test_f1: 0.5422
 epoch: 27, train_loss: 0.8828, test_loss: 0.9297, test_f1: 0.5493
 epoch: 28, train_loss: 0.8733, test_loss: 0.9294, test_f1: 0.5536
 epoch: 29, train_loss: 0.8664, test_loss: 0.9347, test_f1: 0.5273
 epoch: 30, train_loss: 0.8714, test_loss: 0.9407, test_f1: 0.5203
 epoch: 31, train_loss: 0.8627, test_loss: 0.9326, test_f1: 0.5393
 epoch: 32, train_loss: 0.8596, test_loss: 0.9227, test_f1: 0.5207
 epoch: 33, train_loss: 0.8494, test_loss: 0.9363, test_f1: 0.5605
 epoch: 34, train_loss: 0.8539, test_loss: 0.9314, test_f1: 0.5616
 epoch: 35, train_loss: 0.8488, test_loss: 0.9395, test_f1: 0.5567
 epoch: 36, train_loss: 0.8491, test_loss: 0.9362, test_f1: 0.5264
 epoch: 37, train_loss: 0.8449, test_loss: 0.9367, test_f1: 0.5435
 epoch: 38, train_loss: 0.8275, test_loss: 0.9229, test_f1: 0.5324
 epoch: 39, train_loss: 0.8379, test_loss: 0.9313, test_f1: 0.5436
 epoch: 40, train_loss: 0.8308, test_loss: 0.8938, test_f1: 0.5749
 epoch: 41, train_loss: 0.8358, test_loss: 0.9584, test_f1: 0.5592
 epoch: 42, train_loss: 0.8244, test_loss: 0.9156, test_f1: 0.5808
 epoch: 43, train_loss: 0.8230, test_loss: 0.9358, test_f1: 0.5337
 epoch: 44, train_loss: 0.8273, test_loss: 0.9504, test_f1: 0.5651
 epoch: 45, train_loss: 0.8212, test_loss: 0.9436, test_f1: 0.5496
 epoch: 46, train_loss: 0.8039, test_loss: 0.9282, test_f1: 0.5686
 epoch: 47, train_loss: 0.8137, test_loss: 0.9447, test_f1: 0.5531
 epoch: 48, train_loss: 0.8115, test_loss: 0.9366, test_f1: 0.5529
 epoch: 49, train_loss: 0.8097, test_loss: 0.9629, test_f1: 0.5468
 epoch: 50, train_loss: 0.8140, test_loss: 0.9620, test_f1: 0.5749
 epoch: 51, train_loss: 0.8050, test_loss: 0.9614, test_f1: 0.5417
 epoch: 52, train_loss: 0.7978, test_loss: 0.9520, test_f1: 0.5800
 epoch: 53, train_loss: 0.7895, test_loss: 0.9423, test_f1: 0.5630
 epoch: 54, train_loss: 0.7879, test_loss: 0.9523, test_f1: 0.5611
 epoch: 55, train_loss: 0.7931, test_loss: 0.9564, test_f1: 0.5640
 epoch: 56, train_loss: 0.7907, test_loss: 0.9695, test_f1: 0.5537
 epoch: 57, train_loss: 0.7862, test_loss: 0.9400, test_f1: 0.5815
 epoch: 58, train_loss: 0.7708, test_loss: 0.9724, test_f1: 0.5724
 epoch: 59, train_loss: 0.7766, test_loss: 0.9537, test_f1: 0.5836
 epoch: 60, train_loss: 0.7832, test_loss: 0.9378, test_f1: 0.5687
 epoch: 61, train_loss: 0.7768, test_loss: 0.9441, test_f1: 0.5744
 epoch: 62, train_loss: 0.7724, test_loss: 0.9484, test_f1: 0.5874
 epoch: 63, train_loss: 0.7746, test_loss: 0.9901, test_f1: 0.5641
 epoch: 64, train_loss: 0.7719, test_loss: 0.9616, test_f1: 0.5728
 epoch: 65, train_loss: 0.7773, test_loss: 0.9573, test_f1: 0.5657
 epoch: 66, train_loss: 0.7639, test_loss: 0.9377, test_f1: 0.5912
 epoch: 67, train_loss: 0.7542, test_loss: 0.9450, test_f1: 0.5710
 epoch: 68, train_loss: 0.7730, test_loss: 0.9649, test_f1: 0.5671
 epoch: 69, train_loss: 0.7552, test_loss: 0.9546, test_f1: 0.5865
 epoch: 70, train_loss: 0.7604, test_loss: 0.9506, test_f1: 0.5786
 epoch: 71, train_loss: 0.7495, test_loss: 0.9302, test_f1: 0.5837
 epoch: 72, train_loss: 0.7648, test_loss: 0.9684, test_f1: 0.5706
 epoch: 73, train_loss: 0.7591, test_loss: 0.9600, test_f1: 0.5682
 epoch: 74, train_loss: 0.7574, test_loss: 0.9477, test_f1: 0.5776
 epoch: 75, train_loss: 0.7502, test_loss: 0.9466, test_f1: 0.5804
 epoch: 76, train_loss: 0.7556, test_loss: 0.9534, test_f1: 0.5829
 epoch: 77, train_loss: 0.7548, test_loss: 0.9926, test_f1: 0.5563
 epoch: 78, train_loss: 0.7508, test_loss: 0.9799, test_f1: 0.5753
 epoch: 79, train_loss: 0.7560, test_loss: 0.9577, test_f1: 0.5630
 epoch: 80, train_loss: 0.7626, test_loss: 0.9415, test_f1: 0.5790
 epoch: 81, train_loss: 0.7473, test_loss: 0.9643, test_f1: 0.5487
 epoch: 82, train_loss: 0.7356, test_loss: 0.9567, test_f1: 0.5526
 epoch: 83, train_loss: 0.7455, test_loss: 0.9595, test_f1: 0.6035
 epoch: 84, train_loss: 0.7484, test_loss: 0.9572, test_f1: 0.5945
 epoch: 85, train_loss: 0.7342, test_loss: 0.9491, test_f1: 0.6116
 epoch: 86, train_loss: 0.7335, test_loss: 0.9647, test_f1: 0.5887
 epoch: 87, train_loss: 0.7352, test_loss: 0.9599, test_f1: 0.5822
 epoch: 88, train_loss: 0.7409, test_loss: 0.9965, test_f1: 0.5724
 epoch: 89, train_loss: 0.7283, test_loss: 0.9543, test_f1: 0.5779
 epoch: 90, train_loss: 0.7405, test_loss: 0.9541, test_f1: 0.5994
 epoch: 91, train_loss: 0.7388, test_loss: 0.9816, test_f1: 0.5653
 epoch: 92, train_loss: 0.7311, test_loss: 0.9453, test_f1: 0.5958
 epoch: 93, train_loss: 0.7241, test_loss: 0.9603, test_f1: 0.5815
 epoch: 94, train_loss: 0.7293, test_loss: 0.9877, test_f1: 0.5825
 epoch: 95, train_loss: 0.7370, test_loss: 0.9709, test_f1: 0.5920
 epoch: 96, train_loss: 0.7243, test_loss: 0.9652, test_f1: 0.5970
 epoch: 97, train_loss: 0.7236, test_loss: 0.9847, test_f1: 0.6052
 epoch: 98, train_loss: 0.7153, test_loss: 0.9789, test_f1: 0.5843
 epoch: 99, train_loss: 0.7117, test_loss: 0.9570, test_f1: 0.6093
##################ITERATION #6 ****************************************
 epoch: 0, train_loss: 1.2538, test_loss: 1.1300, test_f1: 0.3766
 epoch: 1, train_loss: 1.1512, test_loss: 1.0732, test_f1: 0.4402
 epoch: 2, train_loss: 1.1027, test_loss: 1.0340, test_f1: 0.4478
 epoch: 3, train_loss: 1.0728, test_loss: 1.0164, test_f1: 0.4556
 epoch: 4, train_loss: 1.0562, test_loss: 1.0014, test_f1: 0.4423
 epoch: 5, train_loss: 1.0412, test_loss: 1.0004, test_f1: 0.4756
 epoch: 6, train_loss: 1.0163, test_loss: 0.9817, test_f1: 0.4757
 epoch: 7, train_loss: 1.0063, test_loss: 0.9554, test_f1: 0.4881
 epoch: 8, train_loss: 0.9862, test_loss: 0.9526, test_f1: 0.4831
 epoch: 9, train_loss: 0.9765, test_loss: 0.9582, test_f1: 0.5312
 epoch: 10, train_loss: 0.9718, test_loss: 0.9497, test_f1: 0.4952
 epoch: 11, train_loss: 0.9661, test_loss: 0.9582, test_f1: 0.4954
 epoch: 12, train_loss: 0.9491, test_loss: 0.9218, test_f1: 0.5118
 epoch: 13, train_loss: 0.9521, test_loss: 0.9245, test_f1: 0.5286
 epoch: 14, train_loss: 0.9344, test_loss: 0.9495, test_f1: 0.5020
 epoch: 15, train_loss: 0.9261, test_loss: 0.9413, test_f1: 0.5014
 epoch: 16, train_loss: 0.9239, test_loss: 0.9329, test_f1: 0.4913
 epoch: 17, train_loss: 0.9179, test_loss: 0.9358, test_f1: 0.5030
 epoch: 18, train_loss: 0.9117, test_loss: 0.9214, test_f1: 0.5095
 epoch: 19, train_loss: 0.8962, test_loss: 0.9381, test_f1: 0.4985
 epoch: 20, train_loss: 0.8968, test_loss: 0.9325, test_f1: 0.5161
 epoch: 21, train_loss: 0.8793, test_loss: 0.9664, test_f1: 0.4968
 epoch: 22, train_loss: 0.8823, test_loss: 0.9457, test_f1: 0.5270
 epoch: 23, train_loss: 0.8776, test_loss: 0.9396, test_f1: 0.5570
 epoch: 24, train_loss: 0.8683, test_loss: 0.9405, test_f1: 0.5587
 epoch: 25, train_loss: 0.8782, test_loss: 0.9448, test_f1: 0.5302
 epoch: 26, train_loss: 0.8677, test_loss: 0.9375, test_f1: 0.5663
 epoch: 27, train_loss: 0.8630, test_loss: 0.9273, test_f1: 0.5580
 epoch: 28, train_loss: 0.8585, test_loss: 0.9437, test_f1: 0.5316
 epoch: 29, train_loss: 0.8564, test_loss: 0.9617, test_f1: 0.5339
 epoch: 30, train_loss: 0.8553, test_loss: 0.9337, test_f1: 0.5597
 epoch: 31, train_loss: 0.8539, test_loss: 0.9644, test_f1: 0.5538
 epoch: 32, train_loss: 0.8390, test_loss: 0.9431, test_f1: 0.5523
 epoch: 33, train_loss: 0.8404, test_loss: 0.9534, test_f1: 0.6024
 epoch: 34, train_loss: 0.8372, test_loss: 0.9334, test_f1: 0.5936
 epoch: 35, train_loss: 0.8200, test_loss: 0.9383, test_f1: 0.5572
 epoch: 36, train_loss: 0.8361, test_loss: 0.9260, test_f1: 0.5965
 epoch: 37, train_loss: 0.8237, test_loss: 0.9374, test_f1: 0.5968
 epoch: 38, train_loss: 0.8239, test_loss: 0.9626, test_f1: 0.5886
 epoch: 39, train_loss: 0.8090, test_loss: 0.9456, test_f1: 0.6027
 epoch: 40, train_loss: 0.8208, test_loss: 0.9358, test_f1: 0.5988
 epoch: 41, train_loss: 0.8261, test_loss: 0.9367, test_f1: 0.6192
 epoch: 42, train_loss: 0.8091, test_loss: 0.9342, test_f1: 0.5826
 epoch: 43, train_loss: 0.7961, test_loss: 0.9396, test_f1: 0.5923
 epoch: 44, train_loss: 0.8083, test_loss: 0.9381, test_f1: 0.5931
 epoch: 45, train_loss: 0.7972, test_loss: 0.9565, test_f1: 0.5869
 epoch: 46, train_loss: 0.7941, test_loss: 0.9481, test_f1: 0.5985
 epoch: 47, train_loss: 0.7853, test_loss: 0.9345, test_f1: 0.6021
 epoch: 48, train_loss: 0.7971, test_loss: 0.9607, test_f1: 0.5793
 epoch: 49, train_loss: 0.7972, test_loss: 0.9392, test_f1: 0.5838
 epoch: 50, train_loss: 0.7950, test_loss: 0.9312, test_f1: 0.5947
 epoch: 51, train_loss: 0.7719, test_loss: 0.9532, test_f1: 0.5902
 epoch: 52, train_loss: 0.7731, test_loss: 0.9906, test_f1: 0.5739
 epoch: 53, train_loss: 0.7736, test_loss: 0.9436, test_f1: 0.6034
 epoch: 54, train_loss: 0.7696, test_loss: 0.9515, test_f1: 0.5999
 epoch: 55, train_loss: 0.7638, test_loss: 0.9265, test_f1: 0.6050
 epoch: 56, train_loss: 0.7719, test_loss: 0.9561, test_f1: 0.6020
 epoch: 57, train_loss: 0.7622, test_loss: 0.9480, test_f1: 0.6074
 epoch: 58, train_loss: 0.7638, test_loss: 0.9530, test_f1: 0.6057
 epoch: 59, train_loss: 0.7570, test_loss: 0.9568, test_f1: 0.5992
 epoch: 60, train_loss: 0.7595, test_loss: 0.9526, test_f1: 0.6058
 epoch: 61, train_loss: 0.7470, test_loss: 0.9907, test_f1: 0.5807
 epoch: 62, train_loss: 0.7587, test_loss: 0.9788, test_f1: 0.5885
 epoch: 63, train_loss: 0.7516, test_loss: 0.9742, test_f1: 0.5899
 epoch: 64, train_loss: 0.7546, test_loss: 0.9421, test_f1: 0.6082
 epoch: 65, train_loss: 0.7469, test_loss: 0.9656, test_f1: 0.5912
 epoch: 66, train_loss: 0.7523, test_loss: 0.9709, test_f1: 0.5991
 epoch: 67, train_loss: 0.7491, test_loss: 0.9732, test_f1: 0.6103
 epoch: 68, train_loss: 0.7438, test_loss: 0.9649, test_f1: 0.6115
 epoch: 69, train_loss: 0.7549, test_loss: 0.9660, test_f1: 0.5998
 epoch: 70, train_loss: 0.7572, test_loss: 0.9673, test_f1: 0.5961
 epoch: 71, train_loss: 0.7408, test_loss: 0.9654, test_f1: 0.5862
 epoch: 72, train_loss: 0.7454, test_loss: 0.9517, test_f1: 0.5901
 epoch: 73, train_loss: 0.7374, test_loss: 0.9830, test_f1: 0.5916
 epoch: 74, train_loss: 0.7432, test_loss: 0.9712, test_f1: 0.6109
 epoch: 75, train_loss: 0.7432, test_loss: 0.9627, test_f1: 0.5995
 epoch: 76, train_loss: 0.7376, test_loss: 0.9781, test_f1: 0.5734
 epoch: 77, train_loss: 0.7441, test_loss: 0.9684, test_f1: 0.6155
 epoch: 78, train_loss: 0.7332, test_loss: 0.9637, test_f1: 0.5930
 epoch: 79, train_loss: 0.7342, test_loss: 0.9943, test_f1: 0.5876
 epoch: 80, train_loss: 0.7270, test_loss: 0.9708, test_f1: 0.5759
 epoch: 81, train_loss: 0.7330, test_loss: 0.9637, test_f1: 0.6009
 epoch: 82, train_loss: 0.7219, test_loss: 0.9899, test_f1: 0.5967
 epoch: 83, train_loss: 0.7338, test_loss: 0.9743, test_f1: 0.5926
 epoch: 84, train_loss: 0.7312, test_loss: 0.9793, test_f1: 0.5984
 epoch: 85, train_loss: 0.7330, test_loss: 0.9769, test_f1: 0.6321
 epoch: 86, train_loss: 0.7223, test_loss: 0.9912, test_f1: 0.6091
 epoch: 87, train_loss: 0.7240, test_loss: 0.9563, test_f1: 0.6117
 epoch: 88, train_loss: 0.7272, test_loss: 0.9651, test_f1: 0.6105
 epoch: 89, train_loss: 0.7217, test_loss: 0.9617, test_f1: 0.6192
 epoch: 90, train_loss: 0.7207, test_loss: 0.9621, test_f1: 0.6155
 epoch: 91, train_loss: 0.7140, test_loss: 0.9943, test_f1: 0.5865
 epoch: 92, train_loss: 0.7223, test_loss: 0.9830, test_f1: 0.5924
 epoch: 93, train_loss: 0.7132, test_loss: 0.9866, test_f1: 0.6017
 epoch: 94, train_loss: 0.7152, test_loss: 1.0074, test_f1: 0.6209
 epoch: 95, train_loss: 0.7117, test_loss: 0.9978, test_f1: 0.6001
 epoch: 96, train_loss: 0.7091, test_loss: 0.9714, test_f1: 0.6259
 epoch: 97, train_loss: 0.7141, test_loss: 1.0073, test_f1: 0.6251
 epoch: 98, train_loss: 0.7159, test_loss: 0.9897, test_f1: 0.6071
 epoch: 99, train_loss: 0.7082, test_loss: 0.9743, test_f1: 0.6197
##################ITERATION #7 ****************************************
 epoch: 0, train_loss: 1.2953, test_loss: 1.1296, test_f1: 0.3872
 epoch: 1, train_loss: 1.1729, test_loss: 1.0729, test_f1: 0.4079
 epoch: 2, train_loss: 1.1463, test_loss: 1.0451, test_f1: 0.4383
 epoch: 3, train_loss: 1.1060, test_loss: 1.0173, test_f1: 0.4681
 epoch: 4, train_loss: 1.0887, test_loss: 1.0114, test_f1: 0.4600
 epoch: 5, train_loss: 1.0637, test_loss: 1.0040, test_f1: 0.4770
 epoch: 6, train_loss: 1.0505, test_loss: 0.9813, test_f1: 0.4863
 epoch: 7, train_loss: 1.0315, test_loss: 0.9884, test_f1: 0.4685
 epoch: 8, train_loss: 1.0179, test_loss: 0.9747, test_f1: 0.5001
 epoch: 9, train_loss: 1.0055, test_loss: 0.9644, test_f1: 0.4753
 epoch: 10, train_loss: 0.9922, test_loss: 0.9691, test_f1: 0.4971
 epoch: 11, train_loss: 0.9723, test_loss: 0.9572, test_f1: 0.4768
 epoch: 12, train_loss: 0.9778, test_loss: 0.9488, test_f1: 0.5077
 epoch: 13, train_loss: 0.9664, test_loss: 0.9516, test_f1: 0.4780
 epoch: 14, train_loss: 0.9527, test_loss: 0.9310, test_f1: 0.5087
 epoch: 15, train_loss: 0.9488, test_loss: 0.9616, test_f1: 0.4777
 epoch: 16, train_loss: 0.9289, test_loss: 0.9446, test_f1: 0.5007
 epoch: 17, train_loss: 0.9321, test_loss: 0.9544, test_f1: 0.4827
 epoch: 18, train_loss: 0.9299, test_loss: 0.9340, test_f1: 0.5078
 epoch: 19, train_loss: 0.9283, test_loss: 0.9439, test_f1: 0.5183
 epoch: 20, train_loss: 0.9117, test_loss: 0.9609, test_f1: 0.5047
 epoch: 21, train_loss: 0.9039, test_loss: 0.9478, test_f1: 0.4960
 epoch: 22, train_loss: 0.8937, test_loss: 0.9410, test_f1: 0.5042
 epoch: 23, train_loss: 0.9073, test_loss: 0.9548, test_f1: 0.5070
 epoch: 24, train_loss: 0.8927, test_loss: 0.9387, test_f1: 0.5004
 epoch: 25, train_loss: 0.8836, test_loss: 0.9402, test_f1: 0.5113
 epoch: 26, train_loss: 0.8810, test_loss: 0.9476, test_f1: 0.5227
 epoch: 27, train_loss: 0.8722, test_loss: 0.9413, test_f1: 0.5255
 epoch: 28, train_loss: 0.8721, test_loss: 0.9525, test_f1: 0.5069
 epoch: 29, train_loss: 0.8723, test_loss: 0.9431, test_f1: 0.5297
 epoch: 30, train_loss: 0.8657, test_loss: 0.9591, test_f1: 0.5210
 epoch: 31, train_loss: 0.8614, test_loss: 0.9445, test_f1: 0.5604
 epoch: 32, train_loss: 0.8508, test_loss: 0.9585, test_f1: 0.5228
 epoch: 33, train_loss: 0.8548, test_loss: 0.9567, test_f1: 0.5173
 epoch: 34, train_loss: 0.8457, test_loss: 0.9555, test_f1: 0.5503
 epoch: 35, train_loss: 0.8436, test_loss: 0.9621, test_f1: 0.5100
 epoch: 36, train_loss: 0.8416, test_loss: 0.9469, test_f1: 0.5282
 epoch: 37, train_loss: 0.8354, test_loss: 0.9580, test_f1: 0.5172
 epoch: 38, train_loss: 0.8289, test_loss: 0.9557, test_f1: 0.5312
 epoch: 39, train_loss: 0.8352, test_loss: 0.9769, test_f1: 0.5343
 epoch: 40, train_loss: 0.8233, test_loss: 0.9814, test_f1: 0.5323
 epoch: 41, train_loss: 0.8337, test_loss: 0.9269, test_f1: 0.5486
 epoch: 42, train_loss: 0.8255, test_loss: 0.9278, test_f1: 0.5672
 epoch: 43, train_loss: 0.8215, test_loss: 0.9548, test_f1: 0.5508
 epoch: 44, train_loss: 0.8164, test_loss: 0.9469, test_f1: 0.5475
 epoch: 45, train_loss: 0.8067, test_loss: 0.9631, test_f1: 0.5399
 epoch: 46, train_loss: 0.8013, test_loss: 0.9564, test_f1: 0.5330
 epoch: 47, train_loss: 0.7997, test_loss: 0.9830, test_f1: 0.5595
 epoch: 48, train_loss: 0.8010, test_loss: 0.9361, test_f1: 0.5530
 epoch: 49, train_loss: 0.7979, test_loss: 0.9489, test_f1: 0.5465
 epoch: 50, train_loss: 0.7947, test_loss: 0.9642, test_f1: 0.5478
 epoch: 51, train_loss: 0.7801, test_loss: 0.9415, test_f1: 0.5595
 epoch: 52, train_loss: 0.7944, test_loss: 0.9531, test_f1: 0.5573
 epoch: 53, train_loss: 0.7868, test_loss: 0.9374, test_f1: 0.5501
 epoch: 54, train_loss: 0.7823, test_loss: 0.9296, test_f1: 0.5539
 epoch: 55, train_loss: 0.7826, test_loss: 0.9499, test_f1: 0.5566
 epoch: 56, train_loss: 0.7704, test_loss: 0.9507, test_f1: 0.5486
 epoch: 57, train_loss: 0.7687, test_loss: 0.9612, test_f1: 0.5631
 epoch: 58, train_loss: 0.7592, test_loss: 0.9470, test_f1: 0.5764
 epoch: 59, train_loss: 0.7696, test_loss: 0.9631, test_f1: 0.5421
 epoch: 60, train_loss: 0.7703, test_loss: 0.9333, test_f1: 0.5709
 epoch: 61, train_loss: 0.7670, test_loss: 0.9504, test_f1: 0.5664
 epoch: 62, train_loss: 0.7576, test_loss: 0.9453, test_f1: 0.5627
 epoch: 63, train_loss: 0.7704, test_loss: 0.9464, test_f1: 0.5887
 epoch: 64, train_loss: 0.7613, test_loss: 0.9447, test_f1: 0.5663
 epoch: 65, train_loss: 0.7634, test_loss: 0.9343, test_f1: 0.5708
 epoch: 66, train_loss: 0.7560, test_loss: 0.9433, test_f1: 0.5746
 epoch: 67, train_loss: 0.7587, test_loss: 0.9485, test_f1: 0.5662
 epoch: 68, train_loss: 0.7584, test_loss: 0.9610, test_f1: 0.5854
 epoch: 69, train_loss: 0.7513, test_loss: 0.9333, test_f1: 0.5931
 epoch: 70, train_loss: 0.7539, test_loss: 0.9484, test_f1: 0.5668
 epoch: 71, train_loss: 0.7515, test_loss: 0.9502, test_f1: 0.5739
 epoch: 72, train_loss: 0.7581, test_loss: 0.9368, test_f1: 0.5713
 epoch: 73, train_loss: 0.7381, test_loss: 0.9463, test_f1: 0.5799
 epoch: 74, train_loss: 0.7596, test_loss: 0.9444, test_f1: 0.5550
 epoch: 75, train_loss: 0.7391, test_loss: 0.9495, test_f1: 0.5800
 epoch: 76, train_loss: 0.7429, test_loss: 0.9376, test_f1: 0.5720
 epoch: 77, train_loss: 0.7383, test_loss: 0.9506, test_f1: 0.5704
 epoch: 78, train_loss: 0.7373, test_loss: 0.9331, test_f1: 0.5843
 epoch: 79, train_loss: 0.7388, test_loss: 1.0022, test_f1: 0.5636
 epoch: 80, train_loss: 0.7329, test_loss: 0.9674, test_f1: 0.5809
 epoch: 81, train_loss: 0.7357, test_loss: 0.9862, test_f1: 0.5564
 epoch: 82, train_loss: 0.7259, test_loss: 0.9798, test_f1: 0.5635
 epoch: 83, train_loss: 0.7391, test_loss: 0.9876, test_f1: 0.5552
 epoch: 84, train_loss: 0.7349, test_loss: 0.9840, test_f1: 0.5594
 epoch: 85, train_loss: 0.7378, test_loss: 0.9651, test_f1: 0.5863
 epoch: 86, train_loss: 0.7482, test_loss: 0.9749, test_f1: 0.5715
 epoch: 87, train_loss: 0.7313, test_loss: 0.9679, test_f1: 0.5882
 epoch: 88, train_loss: 0.7257, test_loss: 0.9752, test_f1: 0.5782
 epoch: 89, train_loss: 0.7263, test_loss: 0.9727, test_f1: 0.5905
 epoch: 90, train_loss: 0.7172, test_loss: 0.9975, test_f1: 0.5523
 epoch: 91, train_loss: 0.7104, test_loss: 0.9645, test_f1: 0.5666
 epoch: 92, train_loss: 0.7196, test_loss: 0.9595, test_f1: 0.5791
 epoch: 93, train_loss: 0.7193, test_loss: 0.9580, test_f1: 0.5931
 epoch: 94, train_loss: 0.7291, test_loss: 0.9686, test_f1: 0.5951
 epoch: 95, train_loss: 0.7096, test_loss: 0.9676, test_f1: 0.5856
 epoch: 96, train_loss: 0.7164, test_loss: 0.9727, test_f1: 0.5876
 epoch: 97, train_loss: 0.7300, test_loss: 0.9711, test_f1: 0.5879
 epoch: 98, train_loss: 0.7235, test_loss: 0.9721, test_f1: 0.5887
 epoch: 99, train_loss: 0.7112, test_loss: 0.9905, test_f1: 0.5716
##################ITERATION #8 ****************************************
 epoch: 0, train_loss: 1.3050, test_loss: 1.1369, test_f1: 0.3648
 epoch: 1, train_loss: 1.1652, test_loss: 1.0804, test_f1: 0.4115
 epoch: 2, train_loss: 1.1304, test_loss: 1.0428, test_f1: 0.4319
 epoch: 3, train_loss: 1.1086, test_loss: 1.0183, test_f1: 0.4443
 epoch: 4, train_loss: 1.0726, test_loss: 0.9991, test_f1: 0.4518
 epoch: 5, train_loss: 1.0502, test_loss: 0.9927, test_f1: 0.4557
 epoch: 6, train_loss: 1.0302, test_loss: 0.9788, test_f1: 0.4487
 epoch: 7, train_loss: 1.0086, test_loss: 0.9402, test_f1: 0.4680
 epoch: 8, train_loss: 1.0096, test_loss: 0.9377, test_f1: 0.4871
 epoch: 9, train_loss: 0.9896, test_loss: 0.9440, test_f1: 0.5011
 epoch: 10, train_loss: 0.9786, test_loss: 0.9146, test_f1: 0.5130
 epoch: 11, train_loss: 0.9789, test_loss: 0.9338, test_f1: 0.4866
 epoch: 12, train_loss: 0.9662, test_loss: 0.9237, test_f1: 0.4894
 epoch: 13, train_loss: 0.9471, test_loss: 0.9129, test_f1: 0.5144
 epoch: 14, train_loss: 0.9534, test_loss: 0.9346, test_f1: 0.4990
 epoch: 15, train_loss: 0.9362, test_loss: 0.9306, test_f1: 0.5320
 epoch: 16, train_loss: 0.9416, test_loss: 0.9390, test_f1: 0.5344
 epoch: 17, train_loss: 0.9270, test_loss: 0.9108, test_f1: 0.5295
 epoch: 18, train_loss: 0.9259, test_loss: 0.9219, test_f1: 0.5333
 epoch: 19, train_loss: 0.9145, test_loss: 0.9224, test_f1: 0.5146
 epoch: 20, train_loss: 0.9069, test_loss: 0.9191, test_f1: 0.5251
 epoch: 21, train_loss: 0.8950, test_loss: 0.9016, test_f1: 0.5476
 epoch: 22, train_loss: 0.8975, test_loss: 0.8962, test_f1: 0.5300
 epoch: 23, train_loss: 0.8968, test_loss: 0.8992, test_f1: 0.5526
 epoch: 24, train_loss: 0.8872, test_loss: 0.9154, test_f1: 0.5508
 epoch: 25, train_loss: 0.8895, test_loss: 0.9049, test_f1: 0.5453
 epoch: 26, train_loss: 0.8694, test_loss: 0.9234, test_f1: 0.5346
 epoch: 27, train_loss: 0.8827, test_loss: 0.9193, test_f1: 0.5420
 epoch: 28, train_loss: 0.8710, test_loss: 0.9139, test_f1: 0.5458
 epoch: 29, train_loss: 0.8674, test_loss: 0.9169, test_f1: 0.5441
 epoch: 30, train_loss: 0.8655, test_loss: 0.9387, test_f1: 0.5397
 epoch: 31, train_loss: 0.8597, test_loss: 0.9168, test_f1: 0.5534
 epoch: 32, train_loss: 0.8649, test_loss: 0.9115, test_f1: 0.5613
 epoch: 33, train_loss: 0.8537, test_loss: 0.9114, test_f1: 0.5541
 epoch: 34, train_loss: 0.8594, test_loss: 0.9090, test_f1: 0.5582
 epoch: 35, train_loss: 0.8397, test_loss: 0.9151, test_f1: 0.5837
 epoch: 36, train_loss: 0.8461, test_loss: 0.9474, test_f1: 0.5568
 epoch: 37, train_loss: 0.8482, test_loss: 0.9325, test_f1: 0.5688
 epoch: 38, train_loss: 0.8383, test_loss: 0.9274, test_f1: 0.5517
 epoch: 39, train_loss: 0.8345, test_loss: 0.9029, test_f1: 0.5753
 epoch: 40, train_loss: 0.8346, test_loss: 0.9402, test_f1: 0.5607
 epoch: 41, train_loss: 0.8216, test_loss: 0.9149, test_f1: 0.5614
 epoch: 42, train_loss: 0.8244, test_loss: 0.9432, test_f1: 0.5509
 epoch: 43, train_loss: 0.8353, test_loss: 0.9403, test_f1: 0.5613
 epoch: 44, train_loss: 0.8153, test_loss: 0.9201, test_f1: 0.5576
 epoch: 45, train_loss: 0.8234, test_loss: 0.9069, test_f1: 0.5517
 epoch: 46, train_loss: 0.8089, test_loss: 0.9314, test_f1: 0.5541
 epoch: 47, train_loss: 0.8051, test_loss: 0.9185, test_f1: 0.5667
 epoch: 48, train_loss: 0.8134, test_loss: 0.9492, test_f1: 0.5619
 epoch: 49, train_loss: 0.8128, test_loss: 0.9277, test_f1: 0.5684
 epoch: 50, train_loss: 0.8057, test_loss: 0.9360, test_f1: 0.5671
 epoch: 51, train_loss: 0.7933, test_loss: 0.9200, test_f1: 0.5614
 epoch: 52, train_loss: 0.8020, test_loss: 0.9651, test_f1: 0.5585
 epoch: 53, train_loss: 0.7972, test_loss: 0.9260, test_f1: 0.5564
 epoch: 54, train_loss: 0.7819, test_loss: 0.9399, test_f1: 0.5601
 epoch: 55, train_loss: 0.7805, test_loss: 0.9305, test_f1: 0.5457
 epoch: 56, train_loss: 0.7869, test_loss: 0.9194, test_f1: 0.5601
 epoch: 57, train_loss: 0.7890, test_loss: 0.9242, test_f1: 0.5700
 epoch: 58, train_loss: 0.7789, test_loss: 0.9237, test_f1: 0.5403
 epoch: 59, train_loss: 0.7783, test_loss: 0.9465, test_f1: 0.5569
 epoch: 60, train_loss: 0.7814, test_loss: 0.9339, test_f1: 0.5550
 epoch: 61, train_loss: 0.7732, test_loss: 0.9385, test_f1: 0.5589
 epoch: 62, train_loss: 0.7777, test_loss: 0.9579, test_f1: 0.5721
 epoch: 63, train_loss: 0.7937, test_loss: 0.9482, test_f1: 0.5553
 epoch: 64, train_loss: 0.7688, test_loss: 0.9546, test_f1: 0.5572
 epoch: 65, train_loss: 0.7803, test_loss: 0.9503, test_f1: 0.5692
 epoch: 66, train_loss: 0.7668, test_loss: 0.9451, test_f1: 0.5714
 epoch: 67, train_loss: 0.7813, test_loss: 0.9369, test_f1: 0.5739
 epoch: 68, train_loss: 0.7696, test_loss: 0.9290, test_f1: 0.5637
 epoch: 69, train_loss: 0.7722, test_loss: 0.9459, test_f1: 0.5710
 epoch: 70, train_loss: 0.7678, test_loss: 0.9340, test_f1: 0.5595
 epoch: 71, train_loss: 0.7676, test_loss: 0.9244, test_f1: 0.5647
 epoch: 72, train_loss: 0.7564, test_loss: 0.9592, test_f1: 0.5442
 epoch: 73, train_loss: 0.7630, test_loss: 0.9432, test_f1: 0.5774
 epoch: 74, train_loss: 0.7482, test_loss: 0.9615, test_f1: 0.5584
 epoch: 75, train_loss: 0.7621, test_loss: 0.9482, test_f1: 0.5550
 epoch: 76, train_loss: 0.7489, test_loss: 0.9423, test_f1: 0.5580
 epoch: 77, train_loss: 0.7572, test_loss: 0.9505, test_f1: 0.5705
 epoch: 78, train_loss: 0.7585, test_loss: 0.9624, test_f1: 0.5627
 epoch: 79, train_loss: 0.7597, test_loss: 0.9764, test_f1: 0.5548
 epoch: 80, train_loss: 0.7619, test_loss: 0.9528, test_f1: 0.5667
 epoch: 81, train_loss: 0.7461, test_loss: 0.9711, test_f1: 0.5859
 epoch: 82, train_loss: 0.7590, test_loss: 0.9715, test_f1: 0.5714
 epoch: 83, train_loss: 0.7516, test_loss: 0.9677, test_f1: 0.5712
 epoch: 84, train_loss: 0.7542, test_loss: 0.9458, test_f1: 0.5838
 epoch: 85, train_loss: 0.7508, test_loss: 0.9473, test_f1: 0.5621
 epoch: 86, train_loss: 0.7456, test_loss: 0.9297, test_f1: 0.5639
 epoch: 87, train_loss: 0.7504, test_loss: 0.9688, test_f1: 0.5586
 epoch: 88, train_loss: 0.7450, test_loss: 0.9502, test_f1: 0.5625
 epoch: 89, train_loss: 0.7495, test_loss: 0.9659, test_f1: 0.5531
 epoch: 90, train_loss: 0.7375, test_loss: 0.9519, test_f1: 0.5641
 epoch: 91, train_loss: 0.7427, test_loss: 0.9506, test_f1: 0.5911
 epoch: 92, train_loss: 0.7418, test_loss: 0.9351, test_f1: 0.5594
 epoch: 93, train_loss: 0.7391, test_loss: 0.9462, test_f1: 0.5752
 epoch: 94, train_loss: 0.7404, test_loss: 0.9496, test_f1: 0.5742
 epoch: 95, train_loss: 0.7392, test_loss: 0.9463, test_f1: 0.5601
 epoch: 96, train_loss: 0.7359, test_loss: 0.9493, test_f1: 0.5599
 epoch: 97, train_loss: 0.7415, test_loss: 0.9550, test_f1: 0.5840
 epoch: 98, train_loss: 0.7450, test_loss: 0.9450, test_f1: 0.5681
 epoch: 99, train_loss: 0.7287, test_loss: 0.9903, test_f1: 0.5647
##################ITERATION #9 ****************************************
 epoch: 0, train_loss: 1.2721, test_loss: 1.1166, test_f1: 0.4143
 epoch: 1, train_loss: 1.1555, test_loss: 1.0557, test_f1: 0.4429
 epoch: 2, train_loss: 1.1263, test_loss: 1.0344, test_f1: 0.4608
 epoch: 3, train_loss: 1.1128, test_loss: 0.9994, test_f1: 0.4667
 epoch: 4, train_loss: 1.0841, test_loss: 1.0073, test_f1: 0.4492
 epoch: 5, train_loss: 1.0431, test_loss: 0.9714, test_f1: 0.4655
 epoch: 6, train_loss: 1.0389, test_loss: 0.9854, test_f1: 0.4591
 epoch: 7, train_loss: 1.0243, test_loss: 0.9712, test_f1: 0.4961
 epoch: 8, train_loss: 1.0050, test_loss: 0.9475, test_f1: 0.4869
 epoch: 9, train_loss: 1.0028, test_loss: 0.9738, test_f1: 0.4793
 epoch: 10, train_loss: 0.9785, test_loss: 0.9640, test_f1: 0.4900
 epoch: 11, train_loss: 0.9878, test_loss: 0.9475, test_f1: 0.4939
 epoch: 12, train_loss: 0.9750, test_loss: 0.9417, test_f1: 0.4783
 epoch: 13, train_loss: 0.9599, test_loss: 0.9364, test_f1: 0.4890
 epoch: 14, train_loss: 0.9498, test_loss: 0.9307, test_f1: 0.5070
 epoch: 15, train_loss: 0.9433, test_loss: 0.9174, test_f1: 0.5055
 epoch: 16, train_loss: 0.9401, test_loss: 0.9221, test_f1: 0.5097
 epoch: 17, train_loss: 0.9359, test_loss: 0.9220, test_f1: 0.4962
 epoch: 18, train_loss: 0.9261, test_loss: 0.9065, test_f1: 0.5197
 epoch: 19, train_loss: 0.9172, test_loss: 0.9153, test_f1: 0.5281
 epoch: 20, train_loss: 0.9078, test_loss: 0.9267, test_f1: 0.5228
 epoch: 21, train_loss: 0.8986, test_loss: 0.9277, test_f1: 0.5377
 epoch: 22, train_loss: 0.9011, test_loss: 0.9251, test_f1: 0.5204
 epoch: 23, train_loss: 0.9029, test_loss: 0.8951, test_f1: 0.5261
 epoch: 24, train_loss: 0.8956, test_loss: 0.9207, test_f1: 0.5447
 epoch: 25, train_loss: 0.8753, test_loss: 0.9026, test_f1: 0.5291
 epoch: 26, train_loss: 0.8756, test_loss: 0.9418, test_f1: 0.5258
 epoch: 27, train_loss: 0.8703, test_loss: 0.9308, test_f1: 0.5380
 epoch: 28, train_loss: 0.8710, test_loss: 0.9343, test_f1: 0.5309
 epoch: 29, train_loss: 0.8603, test_loss: 0.9001, test_f1: 0.5364
 epoch: 30, train_loss: 0.8524, test_loss: 0.9138, test_f1: 0.5333
 epoch: 31, train_loss: 0.8586, test_loss: 0.9215, test_f1: 0.5527
 epoch: 32, train_loss: 0.8556, test_loss: 0.8984, test_f1: 0.5365
 epoch: 33, train_loss: 0.8471, test_loss: 0.9101, test_f1: 0.5532
 epoch: 34, train_loss: 0.8447, test_loss: 0.9189, test_f1: 0.5324
 epoch: 35, train_loss: 0.8479, test_loss: 0.9085, test_f1: 0.5301
 epoch: 36, train_loss: 0.8533, test_loss: 0.8866, test_f1: 0.5399
 epoch: 37, train_loss: 0.8293, test_loss: 0.9013, test_f1: 0.5407
 epoch: 38, train_loss: 0.8230, test_loss: 0.9192, test_f1: 0.5735
 epoch: 39, train_loss: 0.8300, test_loss: 0.9054, test_f1: 0.5562
 epoch: 40, train_loss: 0.8240, test_loss: 0.8949, test_f1: 0.5581
 epoch: 41, train_loss: 0.8169, test_loss: 0.9193, test_f1: 0.5488
 epoch: 42, train_loss: 0.8285, test_loss: 0.9003, test_f1: 0.5387
 epoch: 43, train_loss: 0.8230, test_loss: 0.9151, test_f1: 0.5592
 epoch: 44, train_loss: 0.8153, test_loss: 0.8528, test_f1: 0.5721
 epoch: 45, train_loss: 0.8089, test_loss: 0.8785, test_f1: 0.5609
 epoch: 46, train_loss: 0.8156, test_loss: 0.9283, test_f1: 0.5593
 epoch: 47, train_loss: 0.7934, test_loss: 0.9140, test_f1: 0.5570
 epoch: 48, train_loss: 0.8098, test_loss: 0.9341, test_f1: 0.5602
 epoch: 49, train_loss: 0.8023, test_loss: 0.9097, test_f1: 0.5729
 epoch: 50, train_loss: 0.7894, test_loss: 0.9069, test_f1: 0.5691
 epoch: 51, train_loss: 0.7873, test_loss: 0.9250, test_f1: 0.5807
 epoch: 52, train_loss: 0.7923, test_loss: 0.9293, test_f1: 0.5756
 epoch: 53, train_loss: 0.7761, test_loss: 0.9196, test_f1: 0.5693
 epoch: 54, train_loss: 0.7779, test_loss: 0.9394, test_f1: 0.5664
 epoch: 55, train_loss: 0.7785, test_loss: 0.9266, test_f1: 0.5736
 epoch: 56, train_loss: 0.7751, test_loss: 0.9240, test_f1: 0.5730
 epoch: 57, train_loss: 0.7838, test_loss: 0.9017, test_f1: 0.5803
 epoch: 58, train_loss: 0.7710, test_loss: 0.9080, test_f1: 0.5773
 epoch: 59, train_loss: 0.7754, test_loss: 0.9274, test_f1: 0.5736
 epoch: 60, train_loss: 0.7701, test_loss: 0.9351, test_f1: 0.5743
 epoch: 61, train_loss: 0.7749, test_loss: 0.9302, test_f1: 0.5728
 epoch: 62, train_loss: 0.7703, test_loss: 0.9238, test_f1: 0.5624
 epoch: 63, train_loss: 0.7616, test_loss: 0.9226, test_f1: 0.5799
 epoch: 64, train_loss: 0.7533, test_loss: 0.9232, test_f1: 0.5732
 epoch: 65, train_loss: 0.7743, test_loss: 0.9333, test_f1: 0.5725
 epoch: 66, train_loss: 0.7674, test_loss: 0.9293, test_f1: 0.5654
 epoch: 67, train_loss: 0.7662, test_loss: 0.9120, test_f1: 0.5738
 epoch: 68, train_loss: 0.7550, test_loss: 0.9116, test_f1: 0.5708
 epoch: 69, train_loss: 0.7483, test_loss: 0.9194, test_f1: 0.5805
 epoch: 70, train_loss: 0.7620, test_loss: 0.9320, test_f1: 0.5637
 epoch: 71, train_loss: 0.7527, test_loss: 0.9326, test_f1: 0.5587
 epoch: 72, train_loss: 0.7402, test_loss: 0.9284, test_f1: 0.5712
 epoch: 73, train_loss: 0.7509, test_loss: 0.9195, test_f1: 0.5858
 epoch: 74, train_loss: 0.7447, test_loss: 0.9233, test_f1: 0.5717
 epoch: 75, train_loss: 0.7536, test_loss: 0.9098, test_f1: 0.5700
 epoch: 76, train_loss: 0.7463, test_loss: 0.9048, test_f1: 0.5768
 epoch: 77, train_loss: 0.7478, test_loss: 0.9080, test_f1: 0.5801
 epoch: 78, train_loss: 0.7569, test_loss: 0.9180, test_f1: 0.5792
 epoch: 79, train_loss: 0.7413, test_loss: 0.9297, test_f1: 0.5823
 epoch: 80, train_loss: 0.7449, test_loss: 0.9157, test_f1: 0.5869
 epoch: 81, train_loss: 0.7485, test_loss: 0.9228, test_f1: 0.5843
 epoch: 82, train_loss: 0.7338, test_loss: 0.9226, test_f1: 0.5707
 epoch: 83, train_loss: 0.7511, test_loss: 0.9208, test_f1: 0.5927
 epoch: 84, train_loss: 0.7234, test_loss: 0.9322, test_f1: 0.5976
 epoch: 85, train_loss: 0.7297, test_loss: 0.9153, test_f1: 0.5889
 epoch: 86, train_loss: 0.7234, test_loss: 0.9321, test_f1: 0.5880
 epoch: 87, train_loss: 0.7282, test_loss: 0.9522, test_f1: 0.5979
 epoch: 88, train_loss: 0.7302, test_loss: 0.9398, test_f1: 0.5961
 epoch: 89, train_loss: 0.7244, test_loss: 0.9423, test_f1: 0.5721
 epoch: 90, train_loss: 0.7289, test_loss: 0.9277, test_f1: 0.5818
 epoch: 91, train_loss: 0.7255, test_loss: 0.9450, test_f1: 0.6043
 epoch: 92, train_loss: 0.7251, test_loss: 0.9616, test_f1: 0.5799
 epoch: 93, train_loss: 0.7286, test_loss: 0.9303, test_f1: 0.6118
 epoch: 94, train_loss: 0.7245, test_loss: 0.9320, test_f1: 0.5767
 epoch: 95, train_loss: 0.7201, test_loss: 0.9420, test_f1: 0.5813
 epoch: 96, train_loss: 0.7195, test_loss: 0.9430, test_f1: 0.5795
 epoch: 97, train_loss: 0.7252, test_loss: 0.9553, test_f1: 0.6027
 epoch: 98, train_loss: 0.7133, test_loss: 0.9546, test_f1: 0.6058
 epoch: 99, train_loss: 0.7033, test_loss: 0.9587, test_f1: 0.5757

Training completed in 1280.52 seconds
Best F1: 0.6321 at epoch 85
Mean F1 across iterations: 0.6101  0.0112
========================FINAL RESULTS================================
FEGIN weighted F1: 0.6321  0.0112
python main.py --data ltspice_examples --representation component_net --model FEGIN --layers 5 --hiddens 64 --batch_size 32 --lr 0.0001 --emb_size 250 --epochs 100 --save_appendix component_net_L5_H64_BS32_LR0.0001_E250 --no_val
-----



STDERR:
  File "main.py", line 370, in <module>
    main()
  File "main.py", line 254, in main
    dataset = dataset_class(
  File "/home/philip/projects/ltspice_examples_code_repo/Circuit-Completion-Using-GNNs/component_classification_with_link_prediction_head/evaluation/FEGIN/kernel/circuit_datasets.py", line 15, in __init__
    self.data, self.slices = torch.load(self.processed_paths[0])
  File "/home/philip/.local/lib/python3.8/site-packages/torch/serialization.py", line 1040, in load
    warnings.warn(
  File "/usr/lib/python3.8/warnings.py", line 109, in _showwarnmsg
    sw(msg.message, msg.category, msg.filename, msg.lineno,
  File "main.py", line 47, in warn_with_traceback
    traceback.print_stack(file=log)
/home/philip/projects/ltspice_examples_code_repo/Circuit-Completion-Using-GNNs/component_classification_with_link_prediction_head/evaluation/FEGIN/kernel/circuit_datasets.py:15: FutureWarning: You are using `torch.load` with `weights_only=False` (the current default value), which uses the default pickle module implicitly. It is possible to construct malicious pickle data which will execute arbitrary code during unpickling (See https://github.com/pytorch/pytorch/blob/main/SECURITY.md#untrusted-models for more details). In a future release, the default value for `weights_only` will be flipped to `True`. This limits the functions that could be executed during unpickling. Arbitrary objects will no longer be allowed to be loaded via this mode unless they are explicitly allowlisted by the user via `torch.serialization.add_safe_globals`. We recommend you start setting `weights_only=True` for any use case where you don't have full control of the loaded file. Please open an issue on GitHub for any issues related to this experimental feature.
  self.data, self.slices = torch.load(self.processed_paths[0])
