STDOUT:
Results will be saved in /home/philip/projects/ltspice_examples_code_repo/Circuit-Completion-Using-GNNs/component_classification_with_link_prediction_head/evaluation/FEGIN/results/model_FEGIN_dataset_ltspice_demos
Command line input: python main.py --data ltspice_demos --representation component_component --model FEGIN --layers 4 --hiddens 32 --batch_size 32 --lr 0.0001 --emb_size 250 --epochs 100 --save_appendix component_component_L4_H32_BS32_LR0.0001_E250 --no_val
 is saved.
-----
ltspice_demos - FEGIN
Using 4 layers, 32 hidden units, h = 2
Loading component_component representation dataset
ENTERED
Training FEGIN on component_component representation
Train: 1565, Test: 383
##################ITERATION #0 ****************************************
 epoch: 0, train_loss: 1.4103, test_loss: 1.3968, test_f1: 0.0678
 epoch: 1, train_loss: 1.3983, test_loss: 1.3881, test_f1: 0.1165
 epoch: 2, train_loss: 1.3922, test_loss: 1.3816, test_f1: 0.2412
 epoch: 3, train_loss: 1.3833, test_loss: 1.3745, test_f1: 0.2826
 epoch: 4, train_loss: 1.3756, test_loss: 1.3665, test_f1: 0.2868
 epoch: 5, train_loss: 1.3617, test_loss: 1.3577, test_f1: 0.3259
 epoch: 6, train_loss: 1.3499, test_loss: 1.3453, test_f1: 0.3310
 epoch: 7, train_loss: 1.3373, test_loss: 1.3331, test_f1: 0.3125
 epoch: 8, train_loss: 1.3180, test_loss: 1.3202, test_f1: 0.3229
 epoch: 9, train_loss: 1.3010, test_loss: 1.3096, test_f1: 0.3175
 epoch: 10, train_loss: 1.2794, test_loss: 1.3017, test_f1: 0.3206
 epoch: 11, train_loss: 1.2616, test_loss: 1.2941, test_f1: 0.3192
 epoch: 12, train_loss: 1.2418, test_loss: 1.2898, test_f1: 0.3212
 epoch: 13, train_loss: 1.2233, test_loss: 1.2870, test_f1: 0.3155
 epoch: 14, train_loss: 1.2165, test_loss: 1.2708, test_f1: 0.3501
 epoch: 15, train_loss: 1.2059, test_loss: 1.2803, test_f1: 0.3294
 epoch: 16, train_loss: 1.1967, test_loss: 1.2708, test_f1: 0.3329
 epoch: 17, train_loss: 1.1870, test_loss: 1.2758, test_f1: 0.3323
 epoch: 18, train_loss: 1.1836, test_loss: 1.2668, test_f1: 0.3562
 epoch: 19, train_loss: 1.1760, test_loss: 1.2748, test_f1: 0.3483
 epoch: 20, train_loss: 1.1783, test_loss: 1.2815, test_f1: 0.3521
 epoch: 21, train_loss: 1.1678, test_loss: 1.2728, test_f1: 0.3504
 epoch: 22, train_loss: 1.1588, test_loss: 1.2734, test_f1: 0.3485
 epoch: 23, train_loss: 1.1625, test_loss: 1.2735, test_f1: 0.3550
 epoch: 24, train_loss: 1.1610, test_loss: 1.2669, test_f1: 0.3541
 epoch: 25, train_loss: 1.1597, test_loss: 1.2724, test_f1: 0.3541
 epoch: 26, train_loss: 1.1553, test_loss: 1.2637, test_f1: 0.3817
 epoch: 27, train_loss: 1.1524, test_loss: 1.2646, test_f1: 0.3919
 epoch: 28, train_loss: 1.1437, test_loss: 1.2618, test_f1: 0.3910
 epoch: 29, train_loss: 1.1384, test_loss: 1.2609, test_f1: 0.4186
 epoch: 30, train_loss: 1.1413, test_loss: 1.2632, test_f1: 0.4059
 epoch: 31, train_loss: 1.1291, test_loss: 1.2572, test_f1: 0.4083
 epoch: 32, train_loss: 1.1342, test_loss: 1.2474, test_f1: 0.4179
 epoch: 33, train_loss: 1.1332, test_loss: 1.2596, test_f1: 0.4093
 epoch: 34, train_loss: 1.1202, test_loss: 1.2517, test_f1: 0.4367
 epoch: 35, train_loss: 1.1179, test_loss: 1.2576, test_f1: 0.4281
 epoch: 36, train_loss: 1.1062, test_loss: 1.2564, test_f1: 0.4371
 epoch: 37, train_loss: 1.1147, test_loss: 1.2562, test_f1: 0.4269
 epoch: 38, train_loss: 1.1073, test_loss: 1.2484, test_f1: 0.4397
 epoch: 39, train_loss: 1.1097, test_loss: 1.2545, test_f1: 0.4378
 epoch: 40, train_loss: 1.1032, test_loss: 1.2721, test_f1: 0.4263
 epoch: 41, train_loss: 1.1014, test_loss: 1.2529, test_f1: 0.4342
 epoch: 42, train_loss: 1.1006, test_loss: 1.2527, test_f1: 0.4297
 epoch: 43, train_loss: 1.1021, test_loss: 1.2515, test_f1: 0.4276
 epoch: 44, train_loss: 1.0895, test_loss: 1.2774, test_f1: 0.4280
 epoch: 45, train_loss: 1.0950, test_loss: 1.2585, test_f1: 0.4424
 epoch: 46, train_loss: 1.0824, test_loss: 1.2742, test_f1: 0.4392
 epoch: 47, train_loss: 1.0933, test_loss: 1.2714, test_f1: 0.4396
 epoch: 48, train_loss: 1.0816, test_loss: 1.2717, test_f1: 0.4429
 epoch: 49, train_loss: 1.0828, test_loss: 1.2678, test_f1: 0.4472
 epoch: 50, train_loss: 1.0809, test_loss: 1.2877, test_f1: 0.4396
 epoch: 51, train_loss: 1.0743, test_loss: 1.2837, test_f1: 0.4448
 epoch: 52, train_loss: 1.0641, test_loss: 1.2643, test_f1: 0.4557
 epoch: 53, train_loss: 1.0755, test_loss: 1.2758, test_f1: 0.4505
 epoch: 54, train_loss: 1.0589, test_loss: 1.2739, test_f1: 0.4526
 epoch: 55, train_loss: 1.0588, test_loss: 1.2699, test_f1: 0.4392
 epoch: 56, train_loss: 1.0662, test_loss: 1.2938, test_f1: 0.4413
 epoch: 57, train_loss: 1.0514, test_loss: 1.2846, test_f1: 0.4408
 epoch: 58, train_loss: 1.0549, test_loss: 1.2998, test_f1: 0.4430
 epoch: 59, train_loss: 1.0709, test_loss: 1.3111, test_f1: 0.4257
 epoch: 60, train_loss: 1.0708, test_loss: 1.3031, test_f1: 0.4332
 epoch: 61, train_loss: 1.0632, test_loss: 1.2814, test_f1: 0.4475
 epoch: 62, train_loss: 1.0590, test_loss: 1.2934, test_f1: 0.4445
 epoch: 63, train_loss: 1.0640, test_loss: 1.3041, test_f1: 0.4426
 epoch: 64, train_loss: 1.0527, test_loss: 1.2837, test_f1: 0.4359
 epoch: 65, train_loss: 1.0555, test_loss: 1.3000, test_f1: 0.4439
 epoch: 66, train_loss: 1.0514, test_loss: 1.3060, test_f1: 0.4405
 epoch: 67, train_loss: 1.0503, test_loss: 1.2904, test_f1: 0.4445
 epoch: 68, train_loss: 1.0488, test_loss: 1.2970, test_f1: 0.4492
 epoch: 69, train_loss: 1.0553, test_loss: 1.3174, test_f1: 0.4353
 epoch: 70, train_loss: 1.0491, test_loss: 1.3076, test_f1: 0.4283
 epoch: 71, train_loss: 1.0518, test_loss: 1.3319, test_f1: 0.4327
 epoch: 72, train_loss: 1.0448, test_loss: 1.3012, test_f1: 0.4374
 epoch: 73, train_loss: 1.0313, test_loss: 1.3118, test_f1: 0.4370
 epoch: 74, train_loss: 1.0452, test_loss: 1.3031, test_f1: 0.4392
 epoch: 75, train_loss: 1.0410, test_loss: 1.3129, test_f1: 0.4304
 epoch: 76, train_loss: 1.0328, test_loss: 1.3272, test_f1: 0.4300
 epoch: 77, train_loss: 1.0274, test_loss: 1.3294, test_f1: 0.4289
 epoch: 78, train_loss: 1.0306, test_loss: 1.3109, test_f1: 0.4370
 epoch: 79, train_loss: 1.0302, test_loss: 1.3122, test_f1: 0.4348
 epoch: 80, train_loss: 1.0407, test_loss: 1.3203, test_f1: 0.4423
 epoch: 81, train_loss: 1.0365, test_loss: 1.3439, test_f1: 0.4382
 epoch: 82, train_loss: 1.0284, test_loss: 1.3243, test_f1: 0.4348
 epoch: 83, train_loss: 1.0323, test_loss: 1.3144, test_f1: 0.4370
 epoch: 84, train_loss: 1.0272, test_loss: 1.3410, test_f1: 0.4404
 epoch: 85, train_loss: 1.0287, test_loss: 1.3505, test_f1: 0.4382
 epoch: 86, train_loss: 1.0323, test_loss: 1.3152, test_f1: 0.4382
 epoch: 87, train_loss: 1.0214, test_loss: 1.3747, test_f1: 0.4405
 epoch: 88, train_loss: 1.0226, test_loss: 1.3323, test_f1: 0.4395
 epoch: 89, train_loss: 1.0175, test_loss: 1.3381, test_f1: 0.4461
 epoch: 90, train_loss: 1.0188, test_loss: 1.3317, test_f1: 0.4462
 epoch: 91, train_loss: 1.0327, test_loss: 1.3460, test_f1: 0.4555
 epoch: 92, train_loss: 1.0091, test_loss: 1.3866, test_f1: 0.4384
 epoch: 93, train_loss: 1.0091, test_loss: 1.3405, test_f1: 0.4586
 epoch: 94, train_loss: 1.0212, test_loss: 1.3282, test_f1: 0.4617
 epoch: 95, train_loss: 1.0189, test_loss: 1.3485, test_f1: 0.4508
 epoch: 96, train_loss: 1.0132, test_loss: 1.3577, test_f1: 0.4442
 epoch: 97, train_loss: 1.0166, test_loss: 1.3886, test_f1: 0.4611
 epoch: 98, train_loss: 1.0074, test_loss: 1.3641, test_f1: 0.4617
 epoch: 99, train_loss: 1.0143, test_loss: 1.3935, test_f1: 0.4609
##################ITERATION #1 ****************************************
 epoch: 0, train_loss: 1.3631, test_loss: 1.3667, test_f1: 0.3143
 epoch: 1, train_loss: 1.3281, test_loss: 1.3386, test_f1: 0.3035
 epoch: 2, train_loss: 1.3026, test_loss: 1.3217, test_f1: 0.2916
 epoch: 3, train_loss: 1.2766, test_loss: 1.3101, test_f1: 0.2682
 epoch: 4, train_loss: 1.2612, test_loss: 1.2989, test_f1: 0.2437
 epoch: 5, train_loss: 1.2411, test_loss: 1.2832, test_f1: 0.2501
 epoch: 6, train_loss: 1.2260, test_loss: 1.2731, test_f1: 0.2548
 epoch: 7, train_loss: 1.2166, test_loss: 1.2624, test_f1: 0.2438
 epoch: 8, train_loss: 1.2098, test_loss: 1.2569, test_f1: 0.2322
 epoch: 9, train_loss: 1.2010, test_loss: 1.2538, test_f1: 0.2460
 epoch: 10, train_loss: 1.1975, test_loss: 1.2507, test_f1: 0.2447
 epoch: 11, train_loss: 1.1904, test_loss: 1.2461, test_f1: 0.2483
 epoch: 12, train_loss: 1.1788, test_loss: 1.2411, test_f1: 0.2492
 epoch: 13, train_loss: 1.1836, test_loss: 1.2407, test_f1: 0.2671
 epoch: 14, train_loss: 1.1705, test_loss: 1.2366, test_f1: 0.2525
 epoch: 15, train_loss: 1.1724, test_loss: 1.2332, test_f1: 0.3224
 epoch: 16, train_loss: 1.1625, test_loss: 1.2324, test_f1: 0.3173
 epoch: 17, train_loss: 1.1711, test_loss: 1.2284, test_f1: 0.3190
 epoch: 18, train_loss: 1.1558, test_loss: 1.2246, test_f1: 0.3257
 epoch: 19, train_loss: 1.1525, test_loss: 1.2212, test_f1: 0.3637
 epoch: 20, train_loss: 1.1526, test_loss: 1.2180, test_f1: 0.3542
 epoch: 21, train_loss: 1.1507, test_loss: 1.2144, test_f1: 0.3812
 epoch: 22, train_loss: 1.1406, test_loss: 1.2084, test_f1: 0.3684
 epoch: 23, train_loss: 1.1403, test_loss: 1.2043, test_f1: 0.3449
 epoch: 24, train_loss: 1.1364, test_loss: 1.2034, test_f1: 0.3633
 epoch: 25, train_loss: 1.1291, test_loss: 1.1990, test_f1: 0.3710
 epoch: 26, train_loss: 1.1345, test_loss: 1.1997, test_f1: 0.3734
 epoch: 27, train_loss: 1.1181, test_loss: 1.1970, test_f1: 0.4040
 epoch: 28, train_loss: 1.1234, test_loss: 1.1925, test_f1: 0.3687
 epoch: 29, train_loss: 1.1212, test_loss: 1.1927, test_f1: 0.3803
 epoch: 30, train_loss: 1.1113, test_loss: 1.1972, test_f1: 0.3966
 epoch: 31, train_loss: 1.1152, test_loss: 1.1855, test_f1: 0.4110
 epoch: 32, train_loss: 1.1088, test_loss: 1.1867, test_f1: 0.3627
 epoch: 33, train_loss: 1.1061, test_loss: 1.1848, test_f1: 0.4059
 epoch: 34, train_loss: 1.1106, test_loss: 1.1803, test_f1: 0.4329
 epoch: 35, train_loss: 1.0968, test_loss: 1.1768, test_f1: 0.4196
 epoch: 36, train_loss: 1.1044, test_loss: 1.1742, test_f1: 0.3878
 epoch: 37, train_loss: 1.0933, test_loss: 1.1747, test_f1: 0.3935
 epoch: 38, train_loss: 1.0944, test_loss: 1.1713, test_f1: 0.3721
 epoch: 39, train_loss: 1.0781, test_loss: 1.1762, test_f1: 0.4152
 epoch: 40, train_loss: 1.0774, test_loss: 1.1737, test_f1: 0.4073
 epoch: 41, train_loss: 1.0927, test_loss: 1.1707, test_f1: 0.4213
 epoch: 42, train_loss: 1.0886, test_loss: 1.1718, test_f1: 0.4258
 epoch: 43, train_loss: 1.0764, test_loss: 1.1663, test_f1: 0.4239
 epoch: 44, train_loss: 1.0747, test_loss: 1.1638, test_f1: 0.4371
 epoch: 45, train_loss: 1.0635, test_loss: 1.1640, test_f1: 0.4525
 epoch: 46, train_loss: 1.0753, test_loss: 1.1564, test_f1: 0.4628
 epoch: 47, train_loss: 1.0595, test_loss: 1.1605, test_f1: 0.4329
 epoch: 48, train_loss: 1.0632, test_loss: 1.1493, test_f1: 0.4360
 epoch: 49, train_loss: 1.0553, test_loss: 1.1601, test_f1: 0.4246
 epoch: 50, train_loss: 1.0521, test_loss: 1.1466, test_f1: 0.4536
 epoch: 51, train_loss: 1.0512, test_loss: 1.1538, test_f1: 0.4622
 epoch: 52, train_loss: 1.0608, test_loss: 1.1524, test_f1: 0.4628
 epoch: 53, train_loss: 1.0505, test_loss: 1.1511, test_f1: 0.4607
 epoch: 54, train_loss: 1.0554, test_loss: 1.1538, test_f1: 0.4567
 epoch: 55, train_loss: 1.0421, test_loss: 1.1445, test_f1: 0.4545
 epoch: 56, train_loss: 1.0494, test_loss: 1.1421, test_f1: 0.4528
 epoch: 57, train_loss: 1.0385, test_loss: 1.1575, test_f1: 0.4523
 epoch: 58, train_loss: 1.0323, test_loss: 1.1504, test_f1: 0.4664
 epoch: 59, train_loss: 1.0443, test_loss: 1.1407, test_f1: 0.4611
 epoch: 60, train_loss: 1.0251, test_loss: 1.1407, test_f1: 0.4617
 epoch: 61, train_loss: 1.0353, test_loss: 1.1391, test_f1: 0.4685
 epoch: 62, train_loss: 1.0385, test_loss: 1.1397, test_f1: 0.4581
 epoch: 63, train_loss: 1.0245, test_loss: 1.1343, test_f1: 0.4574
 epoch: 64, train_loss: 1.0148, test_loss: 1.1389, test_f1: 0.4515
 epoch: 65, train_loss: 1.0386, test_loss: 1.1360, test_f1: 0.4738
 epoch: 66, train_loss: 1.0336, test_loss: 1.1393, test_f1: 0.4730
 epoch: 67, train_loss: 1.0256, test_loss: 1.1396, test_f1: 0.4732
 epoch: 68, train_loss: 1.0438, test_loss: 1.1334, test_f1: 0.4623
 epoch: 69, train_loss: 1.0306, test_loss: 1.1404, test_f1: 0.4628
 epoch: 70, train_loss: 1.0144, test_loss: 1.1385, test_f1: 0.4758
 epoch: 71, train_loss: 1.0156, test_loss: 1.1416, test_f1: 0.4528
 epoch: 72, train_loss: 1.0183, test_loss: 1.1332, test_f1: 0.4578
 epoch: 73, train_loss: 1.0260, test_loss: 1.1318, test_f1: 0.4647
 epoch: 74, train_loss: 1.0201, test_loss: 1.1276, test_f1: 0.4761
 epoch: 75, train_loss: 1.0190, test_loss: 1.1382, test_f1: 0.4807
 epoch: 76, train_loss: 1.0247, test_loss: 1.1315, test_f1: 0.4802
 epoch: 77, train_loss: 1.0029, test_loss: 1.1265, test_f1: 0.4744
 epoch: 78, train_loss: 1.0122, test_loss: 1.1320, test_f1: 0.4654
 epoch: 79, train_loss: 1.0146, test_loss: 1.1242, test_f1: 0.4799
 epoch: 80, train_loss: 1.0225, test_loss: 1.1258, test_f1: 0.4681
 epoch: 81, train_loss: 1.0152, test_loss: 1.1232, test_f1: 0.4915
 epoch: 82, train_loss: 1.0147, test_loss: 1.1235, test_f1: 0.4672
 epoch: 83, train_loss: 1.0049, test_loss: 1.1178, test_f1: 0.4719
 epoch: 84, train_loss: 1.0075, test_loss: 1.1226, test_f1: 0.4705
 epoch: 85, train_loss: 0.9998, test_loss: 1.1253, test_f1: 0.4638
 epoch: 86, train_loss: 1.0088, test_loss: 1.1198, test_f1: 0.4746
 epoch: 87, train_loss: 0.9963, test_loss: 1.1196, test_f1: 0.4636
 epoch: 88, train_loss: 1.0008, test_loss: 1.1195, test_f1: 0.4780
 epoch: 89, train_loss: 0.9975, test_loss: 1.1219, test_f1: 0.4873
 epoch: 90, train_loss: 1.0029, test_loss: 1.1151, test_f1: 0.4654
 epoch: 91, train_loss: 0.9918, test_loss: 1.1148, test_f1: 0.4622
 epoch: 92, train_loss: 0.9894, test_loss: 1.1156, test_f1: 0.4709
 epoch: 93, train_loss: 0.9902, test_loss: 1.1179, test_f1: 0.4716
 epoch: 94, train_loss: 0.9891, test_loss: 1.1214, test_f1: 0.4631
 epoch: 95, train_loss: 0.9989, test_loss: 1.1159, test_f1: 0.4766
 epoch: 96, train_loss: 0.9786, test_loss: 1.1214, test_f1: 0.4784
 epoch: 97, train_loss: 0.9810, test_loss: 1.1209, test_f1: 0.4643
 epoch: 98, train_loss: 0.9791, test_loss: 1.1180, test_f1: 0.4757
 epoch: 99, train_loss: 0.9888, test_loss: 1.1197, test_f1: 0.4670
##################ITERATION #2 ****************************************
 epoch: 0, train_loss: 1.3007, test_loss: 1.3299, test_f1: 0.2951
 epoch: 1, train_loss: 1.2720, test_loss: 1.3406, test_f1: 0.2789
 epoch: 2, train_loss: 1.2556, test_loss: 1.3229, test_f1: 0.2999
 epoch: 3, train_loss: 1.2479, test_loss: 1.3573, test_f1: 0.3110
 epoch: 4, train_loss: 1.2397, test_loss: 1.3232, test_f1: 0.3099
 epoch: 5, train_loss: 1.2290, test_loss: 1.3138, test_f1: 0.3065
 epoch: 6, train_loss: 1.2243, test_loss: 1.3183, test_f1: 0.3075
 epoch: 7, train_loss: 1.2105, test_loss: 1.3122, test_f1: 0.3076
 epoch: 8, train_loss: 1.2034, test_loss: 1.3626, test_f1: 0.3264
 epoch: 9, train_loss: 1.1997, test_loss: 1.2875, test_f1: 0.3393
 epoch: 10, train_loss: 1.1909, test_loss: 1.2837, test_f1: 0.3694
 epoch: 11, train_loss: 1.1862, test_loss: 1.2807, test_f1: 0.3824
 epoch: 12, train_loss: 1.1802, test_loss: 1.2897, test_f1: 0.3838
 epoch: 13, train_loss: 1.1650, test_loss: 1.2863, test_f1: 0.3826
 epoch: 14, train_loss: 1.1696, test_loss: 1.2709, test_f1: 0.3958
 epoch: 15, train_loss: 1.1637, test_loss: 1.2666, test_f1: 0.3975
 epoch: 16, train_loss: 1.1521, test_loss: 1.2561, test_f1: 0.4056
 epoch: 17, train_loss: 1.1473, test_loss: 1.2850, test_f1: 0.4099
 epoch: 18, train_loss: 1.1429, test_loss: 1.2483, test_f1: 0.4161
 epoch: 19, train_loss: 1.1338, test_loss: 1.2530, test_f1: 0.4204
 epoch: 20, train_loss: 1.1353, test_loss: 1.2415, test_f1: 0.4242
 epoch: 21, train_loss: 1.1247, test_loss: 1.2269, test_f1: 0.4349
 epoch: 22, train_loss: 1.1140, test_loss: 1.2408, test_f1: 0.4137
 epoch: 23, train_loss: 1.1218, test_loss: 1.2453, test_f1: 0.4315
 epoch: 24, train_loss: 1.1167, test_loss: 1.2353, test_f1: 0.4352
 epoch: 25, train_loss: 1.1115, test_loss: 1.2299, test_f1: 0.4289
 epoch: 26, train_loss: 1.1138, test_loss: 1.2308, test_f1: 0.4271
 epoch: 27, train_loss: 1.1100, test_loss: 1.2214, test_f1: 0.4214
 epoch: 28, train_loss: 1.0989, test_loss: 1.2219, test_f1: 0.4377
 epoch: 29, train_loss: 1.1105, test_loss: 1.2156, test_f1: 0.4436
 epoch: 30, train_loss: 1.0947, test_loss: 1.2153, test_f1: 0.4500
 epoch: 31, train_loss: 1.0829, test_loss: 1.2075, test_f1: 0.4489
 epoch: 32, train_loss: 1.0813, test_loss: 1.2079, test_f1: 0.4647
 epoch: 33, train_loss: 1.0804, test_loss: 1.1937, test_f1: 0.4472
 epoch: 34, train_loss: 1.0810, test_loss: 1.1902, test_f1: 0.4762
 epoch: 35, train_loss: 1.0711, test_loss: 1.2039, test_f1: 0.4406
 epoch: 36, train_loss: 1.0643, test_loss: 1.2078, test_f1: 0.4490
 epoch: 37, train_loss: 1.0685, test_loss: 1.2052, test_f1: 0.4586
 epoch: 38, train_loss: 1.0606, test_loss: 1.1903, test_f1: 0.4590
 epoch: 39, train_loss: 1.0532, test_loss: 1.1953, test_f1: 0.4581
 epoch: 40, train_loss: 1.0560, test_loss: 1.1957, test_f1: 0.4671
 epoch: 41, train_loss: 1.0468, test_loss: 1.1976, test_f1: 0.4581
 epoch: 42, train_loss: 1.0494, test_loss: 1.1889, test_f1: 0.4506
 epoch: 43, train_loss: 1.0506, test_loss: 1.1872, test_f1: 0.4243
 epoch: 44, train_loss: 1.0357, test_loss: 1.1776, test_f1: 0.4505
 epoch: 45, train_loss: 1.0461, test_loss: 1.1690, test_f1: 0.4651
 epoch: 46, train_loss: 1.0406, test_loss: 1.1821, test_f1: 0.4487
 epoch: 47, train_loss: 1.0368, test_loss: 1.1713, test_f1: 0.4609
 epoch: 48, train_loss: 1.0217, test_loss: 1.1794, test_f1: 0.4292
 epoch: 49, train_loss: 1.0383, test_loss: 1.1884, test_f1: 0.4389
 epoch: 50, train_loss: 1.0276, test_loss: 1.1898, test_f1: 0.4438
 epoch: 51, train_loss: 1.0209, test_loss: 1.1717, test_f1: 0.4324
 epoch: 52, train_loss: 1.0164, test_loss: 1.1738, test_f1: 0.4557
 epoch: 53, train_loss: 1.0233, test_loss: 1.1859, test_f1: 0.4301
 epoch: 54, train_loss: 1.0231, test_loss: 1.1943, test_f1: 0.4451
 epoch: 55, train_loss: 1.0147, test_loss: 1.1781, test_f1: 0.4661
 epoch: 56, train_loss: 1.0106, test_loss: 1.1928, test_f1: 0.4389
 epoch: 57, train_loss: 1.0094, test_loss: 1.1993, test_f1: 0.4524
 epoch: 58, train_loss: 1.0082, test_loss: 1.2041, test_f1: 0.4725
 epoch: 59, train_loss: 1.0147, test_loss: 1.1913, test_f1: 0.4580
 epoch: 60, train_loss: 1.0107, test_loss: 1.2167, test_f1: 0.4656
 epoch: 61, train_loss: 1.0060, test_loss: 1.1830, test_f1: 0.4628
 epoch: 62, train_loss: 1.0118, test_loss: 1.1964, test_f1: 0.4725
 epoch: 63, train_loss: 1.0132, test_loss: 1.1822, test_f1: 0.4789
 epoch: 64, train_loss: 1.0094, test_loss: 1.1951, test_f1: 0.4733
 epoch: 65, train_loss: 1.0153, test_loss: 1.1855, test_f1: 0.4676
 epoch: 66, train_loss: 1.0091, test_loss: 1.1813, test_f1: 0.4825
 epoch: 67, train_loss: 1.0018, test_loss: 1.1829, test_f1: 0.4777
 epoch: 68, train_loss: 1.0073, test_loss: 1.1729, test_f1: 0.4920
 epoch: 69, train_loss: 0.9845, test_loss: 1.1910, test_f1: 0.4852
 epoch: 70, train_loss: 1.0038, test_loss: 1.1889, test_f1: 0.4755
 epoch: 71, train_loss: 0.9999, test_loss: 1.1902, test_f1: 0.4861
 epoch: 72, train_loss: 1.0005, test_loss: 1.2057, test_f1: 0.4790
 epoch: 73, train_loss: 0.9855, test_loss: 1.2128, test_f1: 0.4873
 epoch: 74, train_loss: 1.0042, test_loss: 1.2120, test_f1: 0.4870
 epoch: 75, train_loss: 0.9968, test_loss: 1.2153, test_f1: 0.4977
 epoch: 76, train_loss: 0.9906, test_loss: 1.1828, test_f1: 0.4842
 epoch: 77, train_loss: 0.9977, test_loss: 1.2113, test_f1: 0.4941
 epoch: 78, train_loss: 0.9979, test_loss: 1.2234, test_f1: 0.4976
 epoch: 79, train_loss: 0.9939, test_loss: 1.1967, test_f1: 0.4790
 epoch: 80, train_loss: 0.9915, test_loss: 1.2126, test_f1: 0.4834
 epoch: 81, train_loss: 0.9906, test_loss: 1.2126, test_f1: 0.4894
 epoch: 82, train_loss: 0.9928, test_loss: 1.1946, test_f1: 0.4889
 epoch: 83, train_loss: 0.9842, test_loss: 1.2003, test_f1: 0.4824
 epoch: 84, train_loss: 0.9795, test_loss: 1.1967, test_f1: 0.4789
 epoch: 85, train_loss: 0.9874, test_loss: 1.2188, test_f1: 0.4808
 epoch: 86, train_loss: 0.9887, test_loss: 1.2119, test_f1: 0.4893
 epoch: 87, train_loss: 0.9800, test_loss: 1.2077, test_f1: 0.4931
 epoch: 88, train_loss: 0.9713, test_loss: 1.2249, test_f1: 0.4878
 epoch: 89, train_loss: 0.9850, test_loss: 1.2198, test_f1: 0.4831
 epoch: 90, train_loss: 0.9786, test_loss: 1.2187, test_f1: 0.4870
 epoch: 91, train_loss: 0.9803, test_loss: 1.2151, test_f1: 0.4850
 epoch: 92, train_loss: 0.9757, test_loss: 1.2094, test_f1: 0.4794
 epoch: 93, train_loss: 0.9813, test_loss: 1.2064, test_f1: 0.4827
 epoch: 94, train_loss: 0.9805, test_loss: 1.2339, test_f1: 0.4824
 epoch: 95, train_loss: 0.9824, test_loss: 1.2067, test_f1: 0.4851
 epoch: 96, train_loss: 0.9728, test_loss: 1.2169, test_f1: 0.4878
 epoch: 97, train_loss: 0.9708, test_loss: 1.2027, test_f1: 0.4870
 epoch: 98, train_loss: 0.9730, test_loss: 1.1981, test_f1: 0.4873
 epoch: 99, train_loss: 0.9750, test_loss: 1.2192, test_f1: 0.4953
##################ITERATION #3 ****************************************
 epoch: 0, train_loss: 1.3134, test_loss: 1.3220, test_f1: 0.2281
 epoch: 1, train_loss: 1.2799, test_loss: 1.3087, test_f1: 0.2336
 epoch: 2, train_loss: 1.2644, test_loss: 1.2982, test_f1: 0.2281
 epoch: 3, train_loss: 1.2454, test_loss: 1.2900, test_f1: 0.2274
 epoch: 4, train_loss: 1.2343, test_loss: 1.2881, test_f1: 0.2323
 epoch: 5, train_loss: 1.2278, test_loss: 1.2722, test_f1: 0.2358
 epoch: 6, train_loss: 1.2127, test_loss: 1.2674, test_f1: 0.2499
 epoch: 7, train_loss: 1.1991, test_loss: 1.2652, test_f1: 0.2690
 epoch: 8, train_loss: 1.1933, test_loss: 1.2700, test_f1: 0.2978
 epoch: 9, train_loss: 1.1894, test_loss: 1.2686, test_f1: 0.3204
 epoch: 10, train_loss: 1.1777, test_loss: 1.2594, test_f1: 0.3085
 epoch: 11, train_loss: 1.1741, test_loss: 1.2589, test_f1: 0.3095
 epoch: 12, train_loss: 1.1683, test_loss: 1.2420, test_f1: 0.3023
 epoch: 13, train_loss: 1.1628, test_loss: 1.2462, test_f1: 0.3109
 epoch: 14, train_loss: 1.1549, test_loss: 1.2417, test_f1: 0.3094
 epoch: 15, train_loss: 1.1563, test_loss: 1.2467, test_f1: 0.3255
 epoch: 16, train_loss: 1.1406, test_loss: 1.2509, test_f1: 0.3069
 epoch: 17, train_loss: 1.1383, test_loss: 1.2611, test_f1: 0.3255
 epoch: 18, train_loss: 1.1251, test_loss: 1.2634, test_f1: 0.3151
 epoch: 19, train_loss: 1.1309, test_loss: 1.2642, test_f1: 0.3142
 epoch: 20, train_loss: 1.1328, test_loss: 1.2597, test_f1: 0.3174
 epoch: 21, train_loss: 1.1203, test_loss: 1.2488, test_f1: 0.3217
 epoch: 22, train_loss: 1.1142, test_loss: 1.2538, test_f1: 0.3170
 epoch: 23, train_loss: 1.1146, test_loss: 1.2557, test_f1: 0.3188
 epoch: 24, train_loss: 1.1189, test_loss: 1.2669, test_f1: 0.3220
 epoch: 25, train_loss: 1.1080, test_loss: 1.2591, test_f1: 0.3091
 epoch: 26, train_loss: 1.1166, test_loss: 1.2623, test_f1: 0.3125
 epoch: 27, train_loss: 1.0955, test_loss: 1.2532, test_f1: 0.3214
 epoch: 28, train_loss: 1.1046, test_loss: 1.2496, test_f1: 0.3254
 epoch: 29, train_loss: 1.0965, test_loss: 1.2638, test_f1: 0.3352
 epoch: 30, train_loss: 1.0883, test_loss: 1.2503, test_f1: 0.3314
 epoch: 31, train_loss: 1.0866, test_loss: 1.2570, test_f1: 0.3261
 epoch: 32, train_loss: 1.0742, test_loss: 1.2660, test_f1: 0.3103
 epoch: 33, train_loss: 1.0769, test_loss: 1.2567, test_f1: 0.3181
 epoch: 34, train_loss: 1.0864, test_loss: 1.2620, test_f1: 0.3669
 epoch: 35, train_loss: 1.0773, test_loss: 1.2542, test_f1: 0.3513
 epoch: 36, train_loss: 1.0708, test_loss: 1.2541, test_f1: 0.3629
 epoch: 37, train_loss: 1.0749, test_loss: 1.2675, test_f1: 0.3596
 epoch: 38, train_loss: 1.0676, test_loss: 1.2597, test_f1: 0.3687
 epoch: 39, train_loss: 1.0740, test_loss: 1.2559, test_f1: 0.3373
 epoch: 40, train_loss: 1.0545, test_loss: 1.2573, test_f1: 0.3276
 epoch: 41, train_loss: 1.0611, test_loss: 1.2759, test_f1: 0.3493
 epoch: 42, train_loss: 1.0473, test_loss: 1.2725, test_f1: 0.3464
 epoch: 43, train_loss: 1.0576, test_loss: 1.2818, test_f1: 0.3444
 epoch: 44, train_loss: 1.0450, test_loss: 1.2535, test_f1: 0.3573
 epoch: 45, train_loss: 1.0458, test_loss: 1.2549, test_f1: 0.3541
 epoch: 46, train_loss: 1.0522, test_loss: 1.2292, test_f1: 0.3520
 epoch: 47, train_loss: 1.0548, test_loss: 1.2571, test_f1: 0.3502
 epoch: 48, train_loss: 1.0512, test_loss: 1.2695, test_f1: 0.3429
 epoch: 49, train_loss: 1.0456, test_loss: 1.2491, test_f1: 0.3505
 epoch: 50, train_loss: 1.0483, test_loss: 1.2552, test_f1: 0.3386
 epoch: 51, train_loss: 1.0470, test_loss: 1.2769, test_f1: 0.3504
 epoch: 52, train_loss: 1.0415, test_loss: 1.2784, test_f1: 0.3514
 epoch: 53, train_loss: 1.0232, test_loss: 1.2669, test_f1: 0.3346
 epoch: 54, train_loss: 1.0401, test_loss: 1.2472, test_f1: 0.3547
 epoch: 55, train_loss: 1.0319, test_loss: 1.2424, test_f1: 0.3628
 epoch: 56, train_loss: 1.0229, test_loss: 1.2362, test_f1: 0.3528
 epoch: 57, train_loss: 1.0435, test_loss: 1.2202, test_f1: 0.3482
 epoch: 58, train_loss: 1.0345, test_loss: 1.2476, test_f1: 0.3730
 epoch: 59, train_loss: 1.0286, test_loss: 1.2596, test_f1: 0.3562
 epoch: 60, train_loss: 1.0175, test_loss: 1.2542, test_f1: 0.3530
 epoch: 61, train_loss: 1.0306, test_loss: 1.2713, test_f1: 0.3731
 epoch: 62, train_loss: 1.0207, test_loss: 1.2547, test_f1: 0.3611
 epoch: 63, train_loss: 1.0118, test_loss: 1.2543, test_f1: 0.3735
 epoch: 64, train_loss: 1.0162, test_loss: 1.2608, test_f1: 0.3930
 epoch: 65, train_loss: 1.0146, test_loss: 1.2438, test_f1: 0.4074
 epoch: 66, train_loss: 1.0142, test_loss: 1.2428, test_f1: 0.3892
 epoch: 67, train_loss: 1.0188, test_loss: 1.2637, test_f1: 0.3935
 epoch: 68, train_loss: 1.0234, test_loss: 1.2760, test_f1: 0.4187
 epoch: 69, train_loss: 1.0099, test_loss: 1.2652, test_f1: 0.3897
 epoch: 70, train_loss: 1.0070, test_loss: 1.2438, test_f1: 0.3964
 epoch: 71, train_loss: 1.0061, test_loss: 1.2825, test_f1: 0.3947
 epoch: 72, train_loss: 1.0007, test_loss: 1.2514, test_f1: 0.4139
 epoch: 73, train_loss: 1.0073, test_loss: 1.2817, test_f1: 0.4191
 epoch: 74, train_loss: 1.0121, test_loss: 1.2651, test_f1: 0.4171
 epoch: 75, train_loss: 1.0032, test_loss: 1.2586, test_f1: 0.3968
 epoch: 76, train_loss: 1.0119, test_loss: 1.2625, test_f1: 0.4221
 epoch: 77, train_loss: 1.0021, test_loss: 1.2696, test_f1: 0.4239
 epoch: 78, train_loss: 0.9947, test_loss: 1.2807, test_f1: 0.4323
 epoch: 79, train_loss: 0.9974, test_loss: 1.2939, test_f1: 0.4319
 epoch: 80, train_loss: 1.0051, test_loss: 1.2885, test_f1: 0.4540
 epoch: 81, train_loss: 0.9988, test_loss: 1.2844, test_f1: 0.4257
 epoch: 82, train_loss: 0.9933, test_loss: 1.2733, test_f1: 0.4612
 epoch: 83, train_loss: 0.9979, test_loss: 1.2865, test_f1: 0.4446
 epoch: 84, train_loss: 1.0054, test_loss: 1.3111, test_f1: 0.4416
 epoch: 85, train_loss: 0.9893, test_loss: 1.3088, test_f1: 0.4491
 epoch: 86, train_loss: 1.0035, test_loss: 1.2908, test_f1: 0.4348
 epoch: 87, train_loss: 0.9964, test_loss: 1.3157, test_f1: 0.4354
 epoch: 88, train_loss: 0.9756, test_loss: 1.3240, test_f1: 0.4377
 epoch: 89, train_loss: 0.9787, test_loss: 1.3109, test_f1: 0.4457
 epoch: 90, train_loss: 0.9838, test_loss: 1.2794, test_f1: 0.4541
 epoch: 91, train_loss: 0.9918, test_loss: 1.2871, test_f1: 0.4489
 epoch: 92, train_loss: 0.9855, test_loss: 1.2820, test_f1: 0.4578
 epoch: 93, train_loss: 0.9873, test_loss: 1.3017, test_f1: 0.4642
 epoch: 94, train_loss: 0.9691, test_loss: 1.2817, test_f1: 0.4679
 epoch: 95, train_loss: 0.9931, test_loss: 1.2591, test_f1: 0.4624
 epoch: 96, train_loss: 0.9893, test_loss: 1.2850, test_f1: 0.4530
 epoch: 97, train_loss: 0.9795, test_loss: 1.2929, test_f1: 0.4686
 epoch: 98, train_loss: 0.9669, test_loss: 1.2888, test_f1: 0.4534
 epoch: 99, train_loss: 0.9679, test_loss: 1.3116, test_f1: 0.4496
##################ITERATION #4 ****************************************
 epoch: 0, train_loss: 1.2883, test_loss: 1.3524, test_f1: 0.2404
 epoch: 1, train_loss: 1.2640, test_loss: 1.3486, test_f1: 0.2359
 epoch: 2, train_loss: 1.2383, test_loss: 1.3396, test_f1: 0.2442
 epoch: 3, train_loss: 1.2261, test_loss: 1.3585, test_f1: 0.2700
 epoch: 4, train_loss: 1.2247, test_loss: 1.3468, test_f1: 0.2749
 epoch: 5, train_loss: 1.2121, test_loss: 1.3469, test_f1: 0.2813
 epoch: 6, train_loss: 1.2019, test_loss: 1.3318, test_f1: 0.2858
 epoch: 7, train_loss: 1.1897, test_loss: 1.3550, test_f1: 0.3071
 epoch: 8, train_loss: 1.1855, test_loss: 1.3399, test_f1: 0.3124
 epoch: 9, train_loss: 1.1676, test_loss: 1.3212, test_f1: 0.3252
 epoch: 10, train_loss: 1.1738, test_loss: 1.3263, test_f1: 0.3510
 epoch: 11, train_loss: 1.1548, test_loss: 1.3071, test_f1: 0.3666
 epoch: 12, train_loss: 1.1545, test_loss: 1.3040, test_f1: 0.3668
 epoch: 13, train_loss: 1.1428, test_loss: 1.2951, test_f1: 0.3939
 epoch: 14, train_loss: 1.1412, test_loss: 1.2917, test_f1: 0.3871
 epoch: 15, train_loss: 1.1335, test_loss: 1.3191, test_f1: 0.4101
 epoch: 16, train_loss: 1.1227, test_loss: 1.3044, test_f1: 0.3965
 epoch: 17, train_loss: 1.1305, test_loss: 1.2973, test_f1: 0.4122
 epoch: 18, train_loss: 1.1189, test_loss: 1.2968, test_f1: 0.3987
 epoch: 19, train_loss: 1.1103, test_loss: 1.3138, test_f1: 0.4115
 epoch: 20, train_loss: 1.1093, test_loss: 1.2735, test_f1: 0.3957
 epoch: 21, train_loss: 1.1095, test_loss: 1.2796, test_f1: 0.3980
 epoch: 22, train_loss: 1.1120, test_loss: 1.2765, test_f1: 0.3944
 epoch: 23, train_loss: 1.1094, test_loss: 1.2791, test_f1: 0.3955
 epoch: 24, train_loss: 1.1079, test_loss: 1.2807, test_f1: 0.4049
 epoch: 25, train_loss: 1.0857, test_loss: 1.2679, test_f1: 0.4021
 epoch: 26, train_loss: 1.0869, test_loss: 1.2728, test_f1: 0.4057
 epoch: 27, train_loss: 1.1020, test_loss: 1.2531, test_f1: 0.4111
 epoch: 28, train_loss: 1.0850, test_loss: 1.2728, test_f1: 0.4095
 epoch: 29, train_loss: 1.0924, test_loss: 1.2502, test_f1: 0.4157
 epoch: 30, train_loss: 1.0851, test_loss: 1.2506, test_f1: 0.4215
 epoch: 31, train_loss: 1.0770, test_loss: 1.3066, test_f1: 0.4057
 epoch: 32, train_loss: 1.0758, test_loss: 1.2603, test_f1: 0.4260
 epoch: 33, train_loss: 1.0851, test_loss: 1.2519, test_f1: 0.4183
 epoch: 34, train_loss: 1.0740, test_loss: 1.2665, test_f1: 0.4289
 epoch: 35, train_loss: 1.0697, test_loss: 1.2692, test_f1: 0.4383
 epoch: 36, train_loss: 1.0761, test_loss: 1.2498, test_f1: 0.4345
 epoch: 37, train_loss: 1.0622, test_loss: 1.2483, test_f1: 0.4299
 epoch: 38, train_loss: 1.0602, test_loss: 1.2745, test_f1: 0.4262
 epoch: 39, train_loss: 1.0563, test_loss: 1.2415, test_f1: 0.4185
 epoch: 40, train_loss: 1.0548, test_loss: 1.2887, test_f1: 0.4318
 epoch: 41, train_loss: 1.0439, test_loss: 1.2636, test_f1: 0.4310
 epoch: 42, train_loss: 1.0574, test_loss: 1.2787, test_f1: 0.4540
 epoch: 43, train_loss: 1.0564, test_loss: 1.2662, test_f1: 0.4516
 epoch: 44, train_loss: 1.0444, test_loss: 1.2404, test_f1: 0.4497
 epoch: 45, train_loss: 1.0417, test_loss: 1.2430, test_f1: 0.4529
 epoch: 46, train_loss: 1.0397, test_loss: 1.2518, test_f1: 0.4896
 epoch: 47, train_loss: 1.0339, test_loss: 1.2333, test_f1: 0.4735
 epoch: 48, train_loss: 1.0275, test_loss: 1.2199, test_f1: 0.4803
 epoch: 49, train_loss: 1.0319, test_loss: 1.2627, test_f1: 0.4993
 epoch: 50, train_loss: 1.0369, test_loss: 1.2738, test_f1: 0.4859
 epoch: 51, train_loss: 1.0215, test_loss: 1.2784, test_f1: 0.4761
 epoch: 52, train_loss: 1.0244, test_loss: 1.2407, test_f1: 0.4945
 epoch: 53, train_loss: 1.0273, test_loss: 1.2581, test_f1: 0.5004
 epoch: 54, train_loss: 1.0324, test_loss: 1.2728, test_f1: 0.4962
 epoch: 55, train_loss: 1.0251, test_loss: 1.2494, test_f1: 0.4856
 epoch: 56, train_loss: 1.0228, test_loss: 1.2533, test_f1: 0.4778
 epoch: 57, train_loss: 1.0267, test_loss: 1.2400, test_f1: 0.4955
 epoch: 58, train_loss: 1.0236, test_loss: 1.2353, test_f1: 0.4816
 epoch: 59, train_loss: 1.0201, test_loss: 1.2500, test_f1: 0.4871
 epoch: 60, train_loss: 1.0217, test_loss: 1.2499, test_f1: 0.4942
 epoch: 61, train_loss: 1.0045, test_loss: 1.2368, test_f1: 0.4933
 epoch: 62, train_loss: 1.0131, test_loss: 1.2301, test_f1: 0.4876
 epoch: 63, train_loss: 1.0005, test_loss: 1.2644, test_f1: 0.5098
 epoch: 64, train_loss: 1.0185, test_loss: 1.2429, test_f1: 0.4934
 epoch: 65, train_loss: 1.0065, test_loss: 1.2535, test_f1: 0.4977
 epoch: 66, train_loss: 1.0116, test_loss: 1.2525, test_f1: 0.4907
 epoch: 67, train_loss: 1.0019, test_loss: 1.2658, test_f1: 0.5041
 epoch: 68, train_loss: 1.0172, test_loss: 1.2346, test_f1: 0.4997
 epoch: 69, train_loss: 1.0171, test_loss: 1.2511, test_f1: 0.4955
 epoch: 70, train_loss: 1.0018, test_loss: 1.2568, test_f1: 0.5147
 epoch: 71, train_loss: 1.0100, test_loss: 1.2474, test_f1: 0.5073
 epoch: 72, train_loss: 1.0062, test_loss: 1.2594, test_f1: 0.5002
 epoch: 73, train_loss: 1.0032, test_loss: 1.2673, test_f1: 0.5110
 epoch: 74, train_loss: 1.0007, test_loss: 1.2471, test_f1: 0.5148
 epoch: 75, train_loss: 1.0010, test_loss: 1.2506, test_f1: 0.5105
 epoch: 76, train_loss: 0.9898, test_loss: 1.2535, test_f1: 0.5120
 epoch: 77, train_loss: 0.9964, test_loss: 1.2438, test_f1: 0.4983
 epoch: 78, train_loss: 0.9994, test_loss: 1.2339, test_f1: 0.5297
 epoch: 79, train_loss: 0.9995, test_loss: 1.2528, test_f1: 0.5159
 epoch: 80, train_loss: 0.9999, test_loss: 1.2530, test_f1: 0.5206
 epoch: 81, train_loss: 0.9957, test_loss: 1.2429, test_f1: 0.5108
 epoch: 82, train_loss: 0.9860, test_loss: 1.2590, test_f1: 0.5113
 epoch: 83, train_loss: 0.9916, test_loss: 1.2660, test_f1: 0.5151
 epoch: 84, train_loss: 0.9852, test_loss: 1.2544, test_f1: 0.5110
 epoch: 85, train_loss: 0.9883, test_loss: 1.2677, test_f1: 0.4908
 epoch: 86, train_loss: 0.9765, test_loss: 1.2645, test_f1: 0.5074
 epoch: 87, train_loss: 0.9814, test_loss: 1.2308, test_f1: 0.5184
 epoch: 88, train_loss: 0.9927, test_loss: 1.2395, test_f1: 0.5153
 epoch: 89, train_loss: 0.9762, test_loss: 1.2717, test_f1: 0.5063
 epoch: 90, train_loss: 0.9992, test_loss: 1.2542, test_f1: 0.5002
 epoch: 91, train_loss: 0.9808, test_loss: 1.2736, test_f1: 0.4948
 epoch: 92, train_loss: 0.9732, test_loss: 1.2521, test_f1: 0.5170
 epoch: 93, train_loss: 0.9838, test_loss: 1.2451, test_f1: 0.5200
 epoch: 94, train_loss: 0.9898, test_loss: 1.2569, test_f1: 0.5281
 epoch: 95, train_loss: 0.9613, test_loss: 1.2674, test_f1: 0.4996
 epoch: 96, train_loss: 0.9710, test_loss: 1.2606, test_f1: 0.5159
 epoch: 97, train_loss: 0.9768, test_loss: 1.2500, test_f1: 0.4955
 epoch: 98, train_loss: 0.9725, test_loss: 1.2808, test_f1: 0.4717
 epoch: 99, train_loss: 0.9791, test_loss: 1.2446, test_f1: 0.5251
##################ITERATION #5 ****************************************
 epoch: 0, train_loss: 1.3060, test_loss: 1.3530, test_f1: 0.2561
 epoch: 1, train_loss: 1.2746, test_loss: 1.3325, test_f1: 0.2611
 epoch: 2, train_loss: 1.2481, test_loss: 1.3293, test_f1: 0.2849
 epoch: 3, train_loss: 1.2313, test_loss: 1.3354, test_f1: 0.3095
 epoch: 4, train_loss: 1.2440, test_loss: 1.3172, test_f1: 0.3376
 epoch: 5, train_loss: 1.2346, test_loss: 1.3315, test_f1: 0.3375
 epoch: 6, train_loss: 1.2073, test_loss: 1.3296, test_f1: 0.3362
 epoch: 7, train_loss: 1.2058, test_loss: 1.3169, test_f1: 0.3486
 epoch: 8, train_loss: 1.1997, test_loss: 1.2985, test_f1: 0.3498
 epoch: 9, train_loss: 1.1941, test_loss: 1.2949, test_f1: 0.3518
 epoch: 10, train_loss: 1.1861, test_loss: 1.2911, test_f1: 0.3705
 epoch: 11, train_loss: 1.1842, test_loss: 1.2820, test_f1: 0.3729
 epoch: 12, train_loss: 1.1849, test_loss: 1.3018, test_f1: 0.3799
 epoch: 13, train_loss: 1.1554, test_loss: 1.2775, test_f1: 0.3920
 epoch: 14, train_loss: 1.1474, test_loss: 1.2818, test_f1: 0.4068
 epoch: 15, train_loss: 1.1514, test_loss: 1.3102, test_f1: 0.4133
 epoch: 16, train_loss: 1.1530, test_loss: 1.3045, test_f1: 0.4226
 epoch: 17, train_loss: 1.1490, test_loss: 1.2561, test_f1: 0.4305
 epoch: 18, train_loss: 1.1334, test_loss: 1.2565, test_f1: 0.4437
 epoch: 19, train_loss: 1.1301, test_loss: 1.2296, test_f1: 0.4288
 epoch: 20, train_loss: 1.1288, test_loss: 1.2223, test_f1: 0.4411
 epoch: 21, train_loss: 1.1133, test_loss: 1.2254, test_f1: 0.4348
 epoch: 22, train_loss: 1.1067, test_loss: 1.2272, test_f1: 0.4436
 epoch: 23, train_loss: 1.0982, test_loss: 1.2261, test_f1: 0.4348
 epoch: 24, train_loss: 1.0965, test_loss: 1.2115, test_f1: 0.4338
 epoch: 25, train_loss: 1.0944, test_loss: 1.2225, test_f1: 0.4528
 epoch: 26, train_loss: 1.0906, test_loss: 1.2191, test_f1: 0.4417
 epoch: 27, train_loss: 1.0877, test_loss: 1.2408, test_f1: 0.4414
 epoch: 28, train_loss: 1.0750, test_loss: 1.2217, test_f1: 0.4438
 epoch: 29, train_loss: 1.0873, test_loss: 1.2189, test_f1: 0.4404
 epoch: 30, train_loss: 1.0640, test_loss: 1.2377, test_f1: 0.4486
 epoch: 31, train_loss: 1.0595, test_loss: 1.2492, test_f1: 0.4374
 epoch: 32, train_loss: 1.0650, test_loss: 1.2201, test_f1: 0.4515
 epoch: 33, train_loss: 1.0702, test_loss: 1.2060, test_f1: 0.4303
 epoch: 34, train_loss: 1.0742, test_loss: 1.2378, test_f1: 0.4404
 epoch: 35, train_loss: 1.0565, test_loss: 1.2301, test_f1: 0.4388
 epoch: 36, train_loss: 1.0417, test_loss: 1.2355, test_f1: 0.4275
 epoch: 37, train_loss: 1.0509, test_loss: 1.2320, test_f1: 0.4411
 epoch: 38, train_loss: 1.0503, test_loss: 1.2298, test_f1: 0.4487
 epoch: 39, train_loss: 1.0571, test_loss: 1.2390, test_f1: 0.4332
 epoch: 40, train_loss: 1.0334, test_loss: 1.2235, test_f1: 0.4398
 epoch: 41, train_loss: 1.0264, test_loss: 1.2281, test_f1: 0.4565
 epoch: 42, train_loss: 1.0293, test_loss: 1.2092, test_f1: 0.4372
 epoch: 43, train_loss: 1.0336, test_loss: 1.2241, test_f1: 0.4357
 epoch: 44, train_loss: 1.0346, test_loss: 1.2324, test_f1: 0.4516
 epoch: 45, train_loss: 1.0173, test_loss: 1.2355, test_f1: 0.4371
 epoch: 46, train_loss: 1.0231, test_loss: 1.2400, test_f1: 0.4340
 epoch: 47, train_loss: 1.0260, test_loss: 1.2345, test_f1: 0.4258
 epoch: 48, train_loss: 1.0175, test_loss: 1.2468, test_f1: 0.4205
 epoch: 49, train_loss: 1.0070, test_loss: 1.2091, test_f1: 0.4238
 epoch: 50, train_loss: 1.0140, test_loss: 1.2528, test_f1: 0.4263
 epoch: 51, train_loss: 1.0065, test_loss: 1.2259, test_f1: 0.4444
 epoch: 52, train_loss: 1.0068, test_loss: 1.2348, test_f1: 0.4356
 epoch: 53, train_loss: 1.0170, test_loss: 1.2380, test_f1: 0.4331
 epoch: 54, train_loss: 0.9968, test_loss: 1.2290, test_f1: 0.4319
 epoch: 55, train_loss: 1.0055, test_loss: 1.2617, test_f1: 0.4313
 epoch: 56, train_loss: 1.0091, test_loss: 1.2578, test_f1: 0.4314
 epoch: 57, train_loss: 0.9875, test_loss: 1.2429, test_f1: 0.4622
 epoch: 58, train_loss: 0.9927, test_loss: 1.2381, test_f1: 0.4344
 epoch: 59, train_loss: 1.0082, test_loss: 1.2549, test_f1: 0.4379
 epoch: 60, train_loss: 1.0041, test_loss: 1.2423, test_f1: 0.4287
 epoch: 61, train_loss: 0.9879, test_loss: 1.2479, test_f1: 0.4402
 epoch: 62, train_loss: 0.9938, test_loss: 1.2486, test_f1: 0.4350
 epoch: 63, train_loss: 0.9974, test_loss: 1.2438, test_f1: 0.4495
 epoch: 64, train_loss: 0.9865, test_loss: 1.2626, test_f1: 0.4229
 epoch: 65, train_loss: 1.0080, test_loss: 1.2371, test_f1: 0.4373
 epoch: 66, train_loss: 0.9896, test_loss: 1.2385, test_f1: 0.4414
 epoch: 67, train_loss: 0.9898, test_loss: 1.2401, test_f1: 0.4542
 epoch: 68, train_loss: 0.9706, test_loss: 1.2475, test_f1: 0.4490
 epoch: 69, train_loss: 1.0034, test_loss: 1.2353, test_f1: 0.4374
 epoch: 70, train_loss: 0.9747, test_loss: 1.2555, test_f1: 0.4519
 epoch: 71, train_loss: 0.9809, test_loss: 1.2493, test_f1: 0.4630
 epoch: 72, train_loss: 0.9849, test_loss: 1.2600, test_f1: 0.4516
 epoch: 73, train_loss: 0.9735, test_loss: 1.2585, test_f1: 0.4591
 epoch: 74, train_loss: 0.9864, test_loss: 1.2535, test_f1: 0.4625
 epoch: 75, train_loss: 0.9772, test_loss: 1.2394, test_f1: 0.4539
 epoch: 76, train_loss: 0.9833, test_loss: 1.2506, test_f1: 0.4506
 epoch: 77, train_loss: 0.9781, test_loss: 1.2450, test_f1: 0.4502
 epoch: 78, train_loss: 0.9868, test_loss: 1.2286, test_f1: 0.4730
 epoch: 79, train_loss: 0.9817, test_loss: 1.2402, test_f1: 0.4635
 epoch: 80, train_loss: 0.9860, test_loss: 1.2429, test_f1: 0.4709
 epoch: 81, train_loss: 0.9815, test_loss: 1.2510, test_f1: 0.4764
 epoch: 82, train_loss: 0.9753, test_loss: 1.2395, test_f1: 0.4696
 epoch: 83, train_loss: 0.9740, test_loss: 1.2404, test_f1: 0.4485
 epoch: 84, train_loss: 0.9817, test_loss: 1.2608, test_f1: 0.4659
 epoch: 85, train_loss: 0.9741, test_loss: 1.2496, test_f1: 0.4555
 epoch: 86, train_loss: 0.9817, test_loss: 1.2771, test_f1: 0.4596
 epoch: 87, train_loss: 0.9632, test_loss: 1.2541, test_f1: 0.4563
 epoch: 88, train_loss: 0.9723, test_loss: 1.2495, test_f1: 0.4462
 epoch: 89, train_loss: 0.9701, test_loss: 1.2436, test_f1: 0.4430
 epoch: 90, train_loss: 0.9772, test_loss: 1.2708, test_f1: 0.4716
 epoch: 91, train_loss: 0.9555, test_loss: 1.2570, test_f1: 0.4719
 epoch: 92, train_loss: 0.9797, test_loss: 1.2641, test_f1: 0.4663
 epoch: 93, train_loss: 0.9629, test_loss: 1.2586, test_f1: 0.4514
 epoch: 94, train_loss: 0.9567, test_loss: 1.2597, test_f1: 0.4709
 epoch: 95, train_loss: 0.9593, test_loss: 1.2535, test_f1: 0.4630
 epoch: 96, train_loss: 0.9601, test_loss: 1.2751, test_f1: 0.4560
 epoch: 97, train_loss: 0.9547, test_loss: 1.2432, test_f1: 0.4564
 epoch: 98, train_loss: 0.9447, test_loss: 1.2586, test_f1: 0.4750
 epoch: 99, train_loss: 0.9632, test_loss: 1.2788, test_f1: 0.4554
##################ITERATION #6 ****************************************
 epoch: 0, train_loss: 1.2603, test_loss: 1.3054, test_f1: 0.2506
 epoch: 1, train_loss: 1.2270, test_loss: 1.3567, test_f1: 0.3159
 epoch: 2, train_loss: 1.2247, test_loss: 1.3578, test_f1: 0.3182
 epoch: 3, train_loss: 1.2110, test_loss: 1.3610, test_f1: 0.3353
 epoch: 4, train_loss: 1.2049, test_loss: 1.3444, test_f1: 0.3512
 epoch: 5, train_loss: 1.1957, test_loss: 1.3341, test_f1: 0.3582
 epoch: 6, train_loss: 1.1869, test_loss: 1.3175, test_f1: 0.3568
 epoch: 7, train_loss: 1.1859, test_loss: 1.3454, test_f1: 0.3565
 epoch: 8, train_loss: 1.1823, test_loss: 1.3080, test_f1: 0.3649
 epoch: 9, train_loss: 1.1665, test_loss: 1.3027, test_f1: 0.3569
 epoch: 10, train_loss: 1.1682, test_loss: 1.3096, test_f1: 0.3687
 epoch: 11, train_loss: 1.1528, test_loss: 1.2854, test_f1: 0.3833
 epoch: 12, train_loss: 1.1560, test_loss: 1.2868, test_f1: 0.3781
 epoch: 13, train_loss: 1.1481, test_loss: 1.2671, test_f1: 0.3686
 epoch: 14, train_loss: 1.1389, test_loss: 1.3088, test_f1: 0.4000
 epoch: 15, train_loss: 1.1353, test_loss: 1.2762, test_f1: 0.3865
 epoch: 16, train_loss: 1.1240, test_loss: 1.2918, test_f1: 0.3887
 epoch: 17, train_loss: 1.1296, test_loss: 1.3054, test_f1: 0.4034
 epoch: 18, train_loss: 1.1168, test_loss: 1.2908, test_f1: 0.4065
 epoch: 19, train_loss: 1.1112, test_loss: 1.2891, test_f1: 0.3934
 epoch: 20, train_loss: 1.1196, test_loss: 1.2948, test_f1: 0.4206
 epoch: 21, train_loss: 1.1082, test_loss: 1.2293, test_f1: 0.4011
 epoch: 22, train_loss: 1.1204, test_loss: 1.2293, test_f1: 0.3892
 epoch: 23, train_loss: 1.1069, test_loss: 1.2442, test_f1: 0.4002
 epoch: 24, train_loss: 1.1080, test_loss: 1.2493, test_f1: 0.4136
 epoch: 25, train_loss: 1.1050, test_loss: 1.2223, test_f1: 0.4100
 epoch: 26, train_loss: 1.1075, test_loss: 1.2293, test_f1: 0.4185
 epoch: 27, train_loss: 1.0853, test_loss: 1.2048, test_f1: 0.4049
 epoch: 28, train_loss: 1.0812, test_loss: 1.2032, test_f1: 0.4289
 epoch: 29, train_loss: 1.0844, test_loss: 1.2065, test_f1: 0.4165
 epoch: 30, train_loss: 1.0775, test_loss: 1.1970, test_f1: 0.4341
 epoch: 31, train_loss: 1.0797, test_loss: 1.2184, test_f1: 0.4192
 epoch: 32, train_loss: 1.0844, test_loss: 1.1909, test_f1: 0.4316
 epoch: 33, train_loss: 1.0725, test_loss: 1.2113, test_f1: 0.4059
 epoch: 34, train_loss: 1.0745, test_loss: 1.1849, test_f1: 0.4273
 epoch: 35, train_loss: 1.0765, test_loss: 1.2470, test_f1: 0.4212
 epoch: 36, train_loss: 1.0756, test_loss: 1.2034, test_f1: 0.4288
 epoch: 37, train_loss: 1.0661, test_loss: 1.2188, test_f1: 0.4321
 epoch: 38, train_loss: 1.0730, test_loss: 1.1971, test_f1: 0.4215
 epoch: 39, train_loss: 1.0761, test_loss: 1.1882, test_f1: 0.4368
 epoch: 40, train_loss: 1.0578, test_loss: 1.1862, test_f1: 0.4295
 epoch: 41, train_loss: 1.0695, test_loss: 1.1753, test_f1: 0.4428
 epoch: 42, train_loss: 1.0489, test_loss: 1.1820, test_f1: 0.4329
 epoch: 43, train_loss: 1.0657, test_loss: 1.1968, test_f1: 0.4364
 epoch: 44, train_loss: 1.0625, test_loss: 1.1752, test_f1: 0.4227
 epoch: 45, train_loss: 1.0533, test_loss: 1.1975, test_f1: 0.4289
 epoch: 46, train_loss: 1.0460, test_loss: 1.2054, test_f1: 0.4396
 epoch: 47, train_loss: 1.0401, test_loss: 1.2038, test_f1: 0.4458
 epoch: 48, train_loss: 1.0533, test_loss: 1.2057, test_f1: 0.4422
 epoch: 49, train_loss: 1.0412, test_loss: 1.1936, test_f1: 0.4254
 epoch: 50, train_loss: 1.0294, test_loss: 1.1968, test_f1: 0.4255
 epoch: 51, train_loss: 1.0238, test_loss: 1.1853, test_f1: 0.4414
 epoch: 52, train_loss: 1.0295, test_loss: 1.1837, test_f1: 0.4375
 epoch: 53, train_loss: 1.0420, test_loss: 1.1985, test_f1: 0.4284
 epoch: 54, train_loss: 1.0408, test_loss: 1.1995, test_f1: 0.4354
 epoch: 55, train_loss: 1.0301, test_loss: 1.2148, test_f1: 0.4354
 epoch: 56, train_loss: 1.0270, test_loss: 1.2002, test_f1: 0.4368
 epoch: 57, train_loss: 1.0280, test_loss: 1.2016, test_f1: 0.4356
 epoch: 58, train_loss: 1.0169, test_loss: 1.2075, test_f1: 0.4347
 epoch: 59, train_loss: 1.0192, test_loss: 1.2059, test_f1: 0.4392
 epoch: 60, train_loss: 1.0223, test_loss: 1.1991, test_f1: 0.4333
 epoch: 61, train_loss: 1.0219, test_loss: 1.1887, test_f1: 0.4400
 epoch: 62, train_loss: 1.0310, test_loss: 1.1936, test_f1: 0.4216
 epoch: 63, train_loss: 1.0248, test_loss: 1.1900, test_f1: 0.4424
 epoch: 64, train_loss: 1.0247, test_loss: 1.1897, test_f1: 0.4366
 epoch: 65, train_loss: 1.0233, test_loss: 1.1948, test_f1: 0.4434
 epoch: 66, train_loss: 1.0350, test_loss: 1.1990, test_f1: 0.4371
 epoch: 67, train_loss: 1.0224, test_loss: 1.2026, test_f1: 0.4309
 epoch: 68, train_loss: 1.0101, test_loss: 1.1965, test_f1: 0.4390
 epoch: 69, train_loss: 1.0231, test_loss: 1.1922, test_f1: 0.4314
 epoch: 70, train_loss: 1.0109, test_loss: 1.2048, test_f1: 0.4452
 epoch: 71, train_loss: 1.0183, test_loss: 1.2043, test_f1: 0.4365
 epoch: 72, train_loss: 1.0052, test_loss: 1.1984, test_f1: 0.4371
 epoch: 73, train_loss: 1.0082, test_loss: 1.2059, test_f1: 0.4307
 epoch: 74, train_loss: 1.0180, test_loss: 1.2008, test_f1: 0.4475
 epoch: 75, train_loss: 1.0133, test_loss: 1.1950, test_f1: 0.4488
 epoch: 76, train_loss: 1.0176, test_loss: 1.1947, test_f1: 0.4421
 epoch: 77, train_loss: 1.0033, test_loss: 1.2044, test_f1: 0.4432
 epoch: 78, train_loss: 1.0080, test_loss: 1.1952, test_f1: 0.4339
 epoch: 79, train_loss: 0.9982, test_loss: 1.2048, test_f1: 0.4575
 epoch: 80, train_loss: 1.0237, test_loss: 1.2345, test_f1: 0.4333
 epoch: 81, train_loss: 1.0047, test_loss: 1.2014, test_f1: 0.4545
 epoch: 82, train_loss: 1.0098, test_loss: 1.1864, test_f1: 0.4515
 epoch: 83, train_loss: 0.9953, test_loss: 1.2020, test_f1: 0.4562
 epoch: 84, train_loss: 1.0256, test_loss: 1.2008, test_f1: 0.4602
 epoch: 85, train_loss: 1.0076, test_loss: 1.2011, test_f1: 0.4569
 epoch: 86, train_loss: 1.0073, test_loss: 1.1926, test_f1: 0.4696
 epoch: 87, train_loss: 0.9956, test_loss: 1.1994, test_f1: 0.4458
 epoch: 88, train_loss: 0.9861, test_loss: 1.1987, test_f1: 0.4425
 epoch: 89, train_loss: 0.9878, test_loss: 1.1907, test_f1: 0.4443
 epoch: 90, train_loss: 0.9851, test_loss: 1.2145, test_f1: 0.4386
 epoch: 91, train_loss: 0.9905, test_loss: 1.1993, test_f1: 0.4413
 epoch: 92, train_loss: 1.0094, test_loss: 1.1986, test_f1: 0.4503
 epoch: 93, train_loss: 0.9954, test_loss: 1.2101, test_f1: 0.4480
 epoch: 94, train_loss: 0.9984, test_loss: 1.2035, test_f1: 0.4547
 epoch: 95, train_loss: 0.9981, test_loss: 1.2001, test_f1: 0.4554
 epoch: 96, train_loss: 0.9976, test_loss: 1.2201, test_f1: 0.4518
 epoch: 97, train_loss: 0.9891, test_loss: 1.2040, test_f1: 0.4527
 epoch: 98, train_loss: 0.9850, test_loss: 1.2216, test_f1: 0.4277
 epoch: 99, train_loss: 0.9978, test_loss: 1.2306, test_f1: 0.4639
##################ITERATION #7 ****************************************
 epoch: 0, train_loss: 1.2805, test_loss: 1.3918, test_f1: 0.2404
 epoch: 1, train_loss: 1.2440, test_loss: 1.3959, test_f1: 0.2646
 epoch: 2, train_loss: 1.2352, test_loss: 1.3847, test_f1: 0.2580
 epoch: 3, train_loss: 1.2189, test_loss: 1.3772, test_f1: 0.2638
 epoch: 4, train_loss: 1.2025, test_loss: 1.3719, test_f1: 0.2771
 epoch: 5, train_loss: 1.2011, test_loss: 1.3489, test_f1: 0.2863
 epoch: 6, train_loss: 1.1911, test_loss: 1.3588, test_f1: 0.3338
 epoch: 7, train_loss: 1.1807, test_loss: 1.3301, test_f1: 0.3431
 epoch: 8, train_loss: 1.1667, test_loss: 1.3441, test_f1: 0.3627
 epoch: 9, train_loss: 1.1584, test_loss: 1.3279, test_f1: 0.3758
 epoch: 10, train_loss: 1.1535, test_loss: 1.3169, test_f1: 0.3839
 epoch: 11, train_loss: 1.1459, test_loss: 1.3463, test_f1: 0.3843
 epoch: 12, train_loss: 1.1408, test_loss: 1.3336, test_f1: 0.3761
 epoch: 13, train_loss: 1.1444, test_loss: 1.3518, test_f1: 0.3796
 epoch: 14, train_loss: 1.1403, test_loss: 1.3469, test_f1: 0.3748
 epoch: 15, train_loss: 1.1307, test_loss: 1.3239, test_f1: 0.3977
 epoch: 16, train_loss: 1.1328, test_loss: 1.3343, test_f1: 0.3975
 epoch: 17, train_loss: 1.1316, test_loss: 1.3421, test_f1: 0.3943
 epoch: 18, train_loss: 1.1277, test_loss: 1.3183, test_f1: 0.4012
 epoch: 19, train_loss: 1.1145, test_loss: 1.3866, test_f1: 0.4068
 epoch: 20, train_loss: 1.1152, test_loss: 1.3248, test_f1: 0.3995
 epoch: 21, train_loss: 1.1101, test_loss: 1.3583, test_f1: 0.4078
 epoch: 22, train_loss: 1.1155, test_loss: 1.3349, test_f1: 0.4004
 epoch: 23, train_loss: 1.1019, test_loss: 1.3201, test_f1: 0.4107
 epoch: 24, train_loss: 1.0977, test_loss: 1.3269, test_f1: 0.4034
 epoch: 25, train_loss: 1.0998, test_loss: 1.3154, test_f1: 0.4098
 epoch: 26, train_loss: 1.0872, test_loss: 1.2942, test_f1: 0.4045
 epoch: 27, train_loss: 1.0823, test_loss: 1.3120, test_f1: 0.4214
 epoch: 28, train_loss: 1.0829, test_loss: 1.3086, test_f1: 0.4290
 epoch: 29, train_loss: 1.0790, test_loss: 1.3379, test_f1: 0.4103
 epoch: 30, train_loss: 1.0685, test_loss: 1.3016, test_f1: 0.4246
 epoch: 31, train_loss: 1.0828, test_loss: 1.3405, test_f1: 0.4355
 epoch: 32, train_loss: 1.0743, test_loss: 1.2946, test_f1: 0.4270
 epoch: 33, train_loss: 1.0630, test_loss: 1.2962, test_f1: 0.4340
 epoch: 34, train_loss: 1.0591, test_loss: 1.3156, test_f1: 0.4312
 epoch: 35, train_loss: 1.0541, test_loss: 1.2942, test_f1: 0.4303
 epoch: 36, train_loss: 1.0547, test_loss: 1.3274, test_f1: 0.4405
 epoch: 37, train_loss: 1.0571, test_loss: 1.3377, test_f1: 0.4338
 epoch: 38, train_loss: 1.0496, test_loss: 1.3103, test_f1: 0.4441
 epoch: 39, train_loss: 1.0419, test_loss: 1.2855, test_f1: 0.4352
 epoch: 40, train_loss: 1.0459, test_loss: 1.3068, test_f1: 0.4463
 epoch: 41, train_loss: 1.0435, test_loss: 1.2825, test_f1: 0.4384
 epoch: 42, train_loss: 1.0311, test_loss: 1.2925, test_f1: 0.4378
 epoch: 43, train_loss: 1.0277, test_loss: 1.2750, test_f1: 0.4384
 epoch: 44, train_loss: 1.0322, test_loss: 1.2566, test_f1: 0.4494
 epoch: 45, train_loss: 1.0273, test_loss: 1.3061, test_f1: 0.4476
 epoch: 46, train_loss: 1.0328, test_loss: 1.3411, test_f1: 0.4545
 epoch: 47, train_loss: 1.0180, test_loss: 1.3170, test_f1: 0.4564
 epoch: 48, train_loss: 1.0279, test_loss: 1.3392, test_f1: 0.4608
 epoch: 49, train_loss: 1.0080, test_loss: 1.3204, test_f1: 0.4745
 epoch: 50, train_loss: 1.0250, test_loss: 1.2724, test_f1: 0.4797
 epoch: 51, train_loss: 1.0132, test_loss: 1.3621, test_f1: 0.4704
 epoch: 52, train_loss: 1.0301, test_loss: 1.3055, test_f1: 0.4636
 epoch: 53, train_loss: 1.0061, test_loss: 1.3168, test_f1: 0.4623
 epoch: 54, train_loss: 1.0094, test_loss: 1.2840, test_f1: 0.4605
 epoch: 55, train_loss: 1.0132, test_loss: 1.2757, test_f1: 0.4777
 epoch: 56, train_loss: 1.0199, test_loss: 1.3140, test_f1: 0.4690
 epoch: 57, train_loss: 1.0088, test_loss: 1.3081, test_f1: 0.4774
 epoch: 58, train_loss: 1.0103, test_loss: 1.3130, test_f1: 0.4949
 epoch: 59, train_loss: 1.0046, test_loss: 1.3358, test_f1: 0.4903
 epoch: 60, train_loss: 1.0163, test_loss: 1.3092, test_f1: 0.4759
 epoch: 61, train_loss: 0.9885, test_loss: 1.2898, test_f1: 0.4744
 epoch: 62, train_loss: 1.0145, test_loss: 1.2458, test_f1: 0.4964
 epoch: 63, train_loss: 1.0011, test_loss: 1.2471, test_f1: 0.4798
 epoch: 64, train_loss: 1.0090, test_loss: 1.3029, test_f1: 0.4947
 epoch: 65, train_loss: 0.9930, test_loss: 1.2338, test_f1: 0.4951
 epoch: 66, train_loss: 0.9946, test_loss: 1.2837, test_f1: 0.4954
 epoch: 67, train_loss: 0.9861, test_loss: 1.2746, test_f1: 0.4872
 epoch: 68, train_loss: 0.9919, test_loss: 1.2620, test_f1: 0.4907
 epoch: 69, train_loss: 0.9877, test_loss: 1.3039, test_f1: 0.4962
 epoch: 70, train_loss: 1.0005, test_loss: 1.2639, test_f1: 0.4888
 epoch: 71, train_loss: 0.9955, test_loss: 1.2528, test_f1: 0.4930
 epoch: 72, train_loss: 0.9945, test_loss: 1.2542, test_f1: 0.4887
 epoch: 73, train_loss: 0.9810, test_loss: 1.2694, test_f1: 0.4991
 epoch: 74, train_loss: 0.9724, test_loss: 1.3401, test_f1: 0.5021
 epoch: 75, train_loss: 0.9877, test_loss: 1.2823, test_f1: 0.4842
 epoch: 76, train_loss: 0.9755, test_loss: 1.2518, test_f1: 0.5082
 epoch: 77, train_loss: 0.9877, test_loss: 1.3626, test_f1: 0.5072
 epoch: 78, train_loss: 0.9842, test_loss: 1.2301, test_f1: 0.5055
 epoch: 79, train_loss: 0.9694, test_loss: 1.2230, test_f1: 0.5200
 epoch: 80, train_loss: 0.9791, test_loss: 1.2482, test_f1: 0.5021
 epoch: 81, train_loss: 0.9811, test_loss: 1.2942, test_f1: 0.5171
 epoch: 82, train_loss: 0.9902, test_loss: 1.2873, test_f1: 0.4985
 epoch: 83, train_loss: 0.9731, test_loss: 1.2510, test_f1: 0.5177
 epoch: 84, train_loss: 0.9691, test_loss: 1.2390, test_f1: 0.5123
 epoch: 85, train_loss: 0.9827, test_loss: 1.2288, test_f1: 0.5249
 epoch: 86, train_loss: 0.9669, test_loss: 1.2660, test_f1: 0.5072
 epoch: 87, train_loss: 0.9751, test_loss: 1.2506, test_f1: 0.5089
 epoch: 88, train_loss: 0.9653, test_loss: 1.2131, test_f1: 0.5131
 epoch: 89, train_loss: 0.9656, test_loss: 1.2519, test_f1: 0.5127
 epoch: 90, train_loss: 0.9602, test_loss: 1.2712, test_f1: 0.4896
 epoch: 91, train_loss: 0.9741, test_loss: 1.2844, test_f1: 0.5001
 epoch: 92, train_loss: 0.9789, test_loss: 1.3119, test_f1: 0.4844
 epoch: 93, train_loss: 0.9571, test_loss: 1.2614, test_f1: 0.5014
 epoch: 94, train_loss: 0.9567, test_loss: 1.2379, test_f1: 0.5121
 epoch: 95, train_loss: 0.9649, test_loss: 1.2575, test_f1: 0.5285
 epoch: 96, train_loss: 0.9540, test_loss: 1.2459, test_f1: 0.5228
 epoch: 97, train_loss: 0.9702, test_loss: 1.2380, test_f1: 0.5291
 epoch: 98, train_loss: 0.9539, test_loss: 1.2628, test_f1: 0.5006
 epoch: 99, train_loss: 0.9594, test_loss: 1.2598, test_f1: 0.5325
##################ITERATION #8 ****************************************
 epoch: 0, train_loss: 1.2829, test_loss: 1.3094, test_f1: 0.2281
 epoch: 1, train_loss: 1.2465, test_loss: 1.3125, test_f1: 0.2560
 epoch: 2, train_loss: 1.2321, test_loss: 1.3156, test_f1: 0.2723
 epoch: 3, train_loss: 1.2176, test_loss: 1.3030, test_f1: 0.3129
 epoch: 4, train_loss: 1.2136, test_loss: 1.2987, test_f1: 0.3222
 epoch: 5, train_loss: 1.2026, test_loss: 1.3034, test_f1: 0.3506
 epoch: 6, train_loss: 1.1927, test_loss: 1.3014, test_f1: 0.3755
 epoch: 7, train_loss: 1.1786, test_loss: 1.3034, test_f1: 0.3945
 epoch: 8, train_loss: 1.1834, test_loss: 1.2964, test_f1: 0.4073
 epoch: 9, train_loss: 1.1751, test_loss: 1.2998, test_f1: 0.4023
 epoch: 10, train_loss: 1.1769, test_loss: 1.3004, test_f1: 0.4111
 epoch: 11, train_loss: 1.1563, test_loss: 1.2942, test_f1: 0.4126
 epoch: 12, train_loss: 1.1616, test_loss: 1.2986, test_f1: 0.4210
 epoch: 13, train_loss: 1.1532, test_loss: 1.2944, test_f1: 0.4241
 epoch: 14, train_loss: 1.1498, test_loss: 1.2939, test_f1: 0.4385
 epoch: 15, train_loss: 1.1528, test_loss: 1.2697, test_f1: 0.4324
 epoch: 16, train_loss: 1.1431, test_loss: 1.2887, test_f1: 0.4289
 epoch: 17, train_loss: 1.1320, test_loss: 1.2811, test_f1: 0.4369
 epoch: 18, train_loss: 1.1258, test_loss: 1.2890, test_f1: 0.4356
 epoch: 19, train_loss: 1.1201, test_loss: 1.2893, test_f1: 0.4219
 epoch: 20, train_loss: 1.1202, test_loss: 1.2783, test_f1: 0.4422
 epoch: 21, train_loss: 1.1212, test_loss: 1.2939, test_f1: 0.4238
 epoch: 22, train_loss: 1.1083, test_loss: 1.2842, test_f1: 0.4249
 epoch: 23, train_loss: 1.1129, test_loss: 1.2857, test_f1: 0.4493
 epoch: 24, train_loss: 1.1119, test_loss: 1.3025, test_f1: 0.4365
 epoch: 25, train_loss: 1.1038, test_loss: 1.3065, test_f1: 0.4383
 epoch: 26, train_loss: 1.0982, test_loss: 1.2798, test_f1: 0.4551
 epoch: 27, train_loss: 1.1033, test_loss: 1.2864, test_f1: 0.4601
 epoch: 28, train_loss: 1.0996, test_loss: 1.2953, test_f1: 0.4559
 epoch: 29, train_loss: 1.0861, test_loss: 1.2878, test_f1: 0.4590
 epoch: 30, train_loss: 1.0824, test_loss: 1.2895, test_f1: 0.4489
 epoch: 31, train_loss: 1.0879, test_loss: 1.2664, test_f1: 0.4538
 epoch: 32, train_loss: 1.0927, test_loss: 1.2769, test_f1: 0.4664
 epoch: 33, train_loss: 1.0947, test_loss: 1.2782, test_f1: 0.4658
 epoch: 34, train_loss: 1.0835, test_loss: 1.2912, test_f1: 0.4719
 epoch: 35, train_loss: 1.0639, test_loss: 1.2892, test_f1: 0.4773
 epoch: 36, train_loss: 1.0609, test_loss: 1.2775, test_f1: 0.4968
 epoch: 37, train_loss: 1.0684, test_loss: 1.2822, test_f1: 0.4725
 epoch: 38, train_loss: 1.0654, test_loss: 1.2970, test_f1: 0.4876
 epoch: 39, train_loss: 1.0618, test_loss: 1.3029, test_f1: 0.4845
 epoch: 40, train_loss: 1.0680, test_loss: 1.3018, test_f1: 0.5023
 epoch: 41, train_loss: 1.0585, test_loss: 1.3168, test_f1: 0.5067
 epoch: 42, train_loss: 1.0755, test_loss: 1.3079, test_f1: 0.4970
 epoch: 43, train_loss: 1.0567, test_loss: 1.2925, test_f1: 0.4935
 epoch: 44, train_loss: 1.0626, test_loss: 1.2898, test_f1: 0.5111
 epoch: 45, train_loss: 1.0371, test_loss: 1.2917, test_f1: 0.5056
 epoch: 46, train_loss: 1.0407, test_loss: 1.3006, test_f1: 0.5162
 epoch: 47, train_loss: 1.0321, test_loss: 1.2803, test_f1: 0.5245
 epoch: 48, train_loss: 1.0434, test_loss: 1.2995, test_f1: 0.5196
 epoch: 49, train_loss: 1.0454, test_loss: 1.2957, test_f1: 0.5064
 epoch: 50, train_loss: 1.0391, test_loss: 1.2943, test_f1: 0.5002
 epoch: 51, train_loss: 1.0337, test_loss: 1.2792, test_f1: 0.5100
 epoch: 52, train_loss: 1.0350, test_loss: 1.3040, test_f1: 0.5214
 epoch: 53, train_loss: 1.0307, test_loss: 1.3125, test_f1: 0.5114
 epoch: 54, train_loss: 1.0314, test_loss: 1.2931, test_f1: 0.5177
 epoch: 55, train_loss: 1.0304, test_loss: 1.3050, test_f1: 0.5275
 epoch: 56, train_loss: 1.0319, test_loss: 1.2927, test_f1: 0.5144
 epoch: 57, train_loss: 1.0448, test_loss: 1.2858, test_f1: 0.5005
 epoch: 58, train_loss: 1.0234, test_loss: 1.2842, test_f1: 0.4994
 epoch: 59, train_loss: 1.0282, test_loss: 1.2826, test_f1: 0.5126
 epoch: 60, train_loss: 1.0157, test_loss: 1.2839, test_f1: 0.5069
 epoch: 61, train_loss: 1.0420, test_loss: 1.2908, test_f1: 0.5040
 epoch: 62, train_loss: 1.0189, test_loss: 1.2950, test_f1: 0.5185
 epoch: 63, train_loss: 1.0103, test_loss: 1.3072, test_f1: 0.5141
 epoch: 64, train_loss: 1.0307, test_loss: 1.3126, test_f1: 0.5324
 epoch: 65, train_loss: 1.0075, test_loss: 1.2978, test_f1: 0.5154
 epoch: 66, train_loss: 1.0132, test_loss: 1.2810, test_f1: 0.5148
 epoch: 67, train_loss: 1.0133, test_loss: 1.2934, test_f1: 0.5219
 epoch: 68, train_loss: 1.0303, test_loss: 1.2873, test_f1: 0.5284
 epoch: 69, train_loss: 1.0079, test_loss: 1.3023, test_f1: 0.5214
 epoch: 70, train_loss: 1.0138, test_loss: 1.2819, test_f1: 0.5183
 epoch: 71, train_loss: 1.0176, test_loss: 1.2897, test_f1: 0.5120
 epoch: 72, train_loss: 1.0196, test_loss: 1.2769, test_f1: 0.5065
 epoch: 73, train_loss: 1.0140, test_loss: 1.2831, test_f1: 0.5110
 epoch: 74, train_loss: 0.9996, test_loss: 1.2857, test_f1: 0.5346
 epoch: 75, train_loss: 1.0139, test_loss: 1.3014, test_f1: 0.5164
 epoch: 76, train_loss: 0.9916, test_loss: 1.2999, test_f1: 0.5187
 epoch: 77, train_loss: 1.0092, test_loss: 1.2907, test_f1: 0.5203
 epoch: 78, train_loss: 1.0109, test_loss: 1.3108, test_f1: 0.5381
 epoch: 79, train_loss: 0.9975, test_loss: 1.2988, test_f1: 0.5346
 epoch: 80, train_loss: 0.9943, test_loss: 1.3071, test_f1: 0.5539
 epoch: 81, train_loss: 0.9918, test_loss: 1.3004, test_f1: 0.5248
 epoch: 82, train_loss: 1.0037, test_loss: 1.2907, test_f1: 0.5332
 epoch: 83, train_loss: 0.9956, test_loss: 1.2837, test_f1: 0.5276
 epoch: 84, train_loss: 0.9860, test_loss: 1.2883, test_f1: 0.5473
 epoch: 85, train_loss: 1.0114, test_loss: 1.3070, test_f1: 0.5245
 epoch: 86, train_loss: 0.9812, test_loss: 1.2931, test_f1: 0.5262
 epoch: 87, train_loss: 0.9838, test_loss: 1.3080, test_f1: 0.5231
 epoch: 88, train_loss: 0.9953, test_loss: 1.3050, test_f1: 0.5326
 epoch: 89, train_loss: 0.9776, test_loss: 1.2941, test_f1: 0.5324
 epoch: 90, train_loss: 0.9851, test_loss: 1.3178, test_f1: 0.5401
 epoch: 91, train_loss: 0.9938, test_loss: 1.2950, test_f1: 0.5350
 epoch: 92, train_loss: 0.9889, test_loss: 1.2840, test_f1: 0.5267
 epoch: 93, train_loss: 0.9870, test_loss: 1.2986, test_f1: 0.5290
 epoch: 94, train_loss: 0.9992, test_loss: 1.3138, test_f1: 0.5406
 epoch: 95, train_loss: 0.9859, test_loss: 1.2910, test_f1: 0.5200
 epoch: 96, train_loss: 0.9662, test_loss: 1.2848, test_f1: 0.5340
 epoch: 97, train_loss: 0.9879, test_loss: 1.2987, test_f1: 0.5284
 epoch: 98, train_loss: 0.9869, test_loss: 1.3286, test_f1: 0.5252
 epoch: 99, train_loss: 0.9824, test_loss: 1.3018, test_f1: 0.5291
##################ITERATION #9 ****************************************
 epoch: 0, train_loss: 1.3199, test_loss: 1.3378, test_f1: 0.2336
 epoch: 1, train_loss: 1.2743, test_loss: 1.2973, test_f1: 0.2270
 epoch: 2, train_loss: 1.2700, test_loss: 1.2896, test_f1: 0.2349
 epoch: 3, train_loss: 1.2423, test_loss: 1.2973, test_f1: 0.2384
 epoch: 4, train_loss: 1.2141, test_loss: 1.2836, test_f1: 0.2488
 epoch: 5, train_loss: 1.2211, test_loss: 1.2639, test_f1: 0.2603
 epoch: 6, train_loss: 1.2119, test_loss: 1.2750, test_f1: 0.2834
 epoch: 7, train_loss: 1.2092, test_loss: 1.2648, test_f1: 0.2890
 epoch: 8, train_loss: 1.2035, test_loss: 1.2489, test_f1: 0.3040
 epoch: 9, train_loss: 1.1825, test_loss: 1.2670, test_f1: 0.3562
 epoch: 10, train_loss: 1.1833, test_loss: 1.2336, test_f1: 0.3355
 epoch: 11, train_loss: 1.1799, test_loss: 1.2271, test_f1: 0.4289
 epoch: 12, train_loss: 1.1760, test_loss: 1.2116, test_f1: 0.4178
 epoch: 13, train_loss: 1.1705, test_loss: 1.2126, test_f1: 0.4329
 epoch: 14, train_loss: 1.1620, test_loss: 1.2197, test_f1: 0.4370
 epoch: 15, train_loss: 1.1592, test_loss: 1.1930, test_f1: 0.4263
 epoch: 16, train_loss: 1.1526, test_loss: 1.1980, test_f1: 0.4530
 epoch: 17, train_loss: 1.1470, test_loss: 1.1947, test_f1: 0.4180
 epoch: 18, train_loss: 1.1369, test_loss: 1.1904, test_f1: 0.4092
 epoch: 19, train_loss: 1.1317, test_loss: 1.1919, test_f1: 0.4414
 epoch: 20, train_loss: 1.1262, test_loss: 1.1911, test_f1: 0.4546
 epoch: 21, train_loss: 1.1272, test_loss: 1.1855, test_f1: 0.4497
 epoch: 22, train_loss: 1.1145, test_loss: 1.1787, test_f1: 0.4654
 epoch: 23, train_loss: 1.1237, test_loss: 1.1874, test_f1: 0.4781
 epoch: 24, train_loss: 1.1084, test_loss: 1.1713, test_f1: 0.4670
 epoch: 25, train_loss: 1.1050, test_loss: 1.1744, test_f1: 0.4578
 epoch: 26, train_loss: 1.1032, test_loss: 1.1727, test_f1: 0.4639
 epoch: 27, train_loss: 1.1019, test_loss: 1.1899, test_f1: 0.4802
 epoch: 28, train_loss: 1.0954, test_loss: 1.1831, test_f1: 0.4755
 epoch: 29, train_loss: 1.0861, test_loss: 1.1749, test_f1: 0.4735
 epoch: 30, train_loss: 1.0791, test_loss: 1.1675, test_f1: 0.4726
 epoch: 31, train_loss: 1.0759, test_loss: 1.1688, test_f1: 0.4800
 epoch: 32, train_loss: 1.0798, test_loss: 1.1726, test_f1: 0.4766
 epoch: 33, train_loss: 1.0731, test_loss: 1.1639, test_f1: 0.5022
 epoch: 34, train_loss: 1.0640, test_loss: 1.1658, test_f1: 0.4761
 epoch: 35, train_loss: 1.0703, test_loss: 1.1646, test_f1: 0.4912
 epoch: 36, train_loss: 1.0547, test_loss: 1.1685, test_f1: 0.4741
 epoch: 37, train_loss: 1.0621, test_loss: 1.1777, test_f1: 0.4859
 epoch: 38, train_loss: 1.0600, test_loss: 1.1628, test_f1: 0.4998
 epoch: 39, train_loss: 1.0501, test_loss: 1.1760, test_f1: 0.5023
 epoch: 40, train_loss: 1.0527, test_loss: 1.1645, test_f1: 0.5142
 epoch: 41, train_loss: 1.0417, test_loss: 1.1668, test_f1: 0.4882
 epoch: 42, train_loss: 1.0350, test_loss: 1.1580, test_f1: 0.4790
 epoch: 43, train_loss: 1.0411, test_loss: 1.1631, test_f1: 0.5102
 epoch: 44, train_loss: 1.0220, test_loss: 1.2043, test_f1: 0.4772
 epoch: 45, train_loss: 1.0310, test_loss: 1.1780, test_f1: 0.4630
 epoch: 46, train_loss: 1.0534, test_loss: 1.1609, test_f1: 0.4646
 epoch: 47, train_loss: 1.0328, test_loss: 1.1641, test_f1: 0.4714
 epoch: 48, train_loss: 1.0329, test_loss: 1.1601, test_f1: 0.4659
 epoch: 49, train_loss: 1.0184, test_loss: 1.1599, test_f1: 0.4600
 epoch: 50, train_loss: 1.0241, test_loss: 1.1781, test_f1: 0.4635
 epoch: 51, train_loss: 1.0254, test_loss: 1.1825, test_f1: 0.4517
 epoch: 52, train_loss: 1.0185, test_loss: 1.2127, test_f1: 0.4495
 epoch: 53, train_loss: 0.9978, test_loss: 1.1826, test_f1: 0.4665
 epoch: 54, train_loss: 1.0089, test_loss: 1.1903, test_f1: 0.4571
 epoch: 55, train_loss: 1.0134, test_loss: 1.1645, test_f1: 0.4779
 epoch: 56, train_loss: 1.0122, test_loss: 1.1724, test_f1: 0.4652
 epoch: 57, train_loss: 0.9987, test_loss: 1.1676, test_f1: 0.4608
 epoch: 58, train_loss: 0.9890, test_loss: 1.1576, test_f1: 0.4691
 epoch: 59, train_loss: 0.9893, test_loss: 1.1552, test_f1: 0.4739
 epoch: 60, train_loss: 0.9988, test_loss: 1.1672, test_f1: 0.4479
 epoch: 61, train_loss: 0.9959, test_loss: 1.1582, test_f1: 0.4799
 epoch: 62, train_loss: 0.9969, test_loss: 1.1649, test_f1: 0.4922
 epoch: 63, train_loss: 0.9963, test_loss: 1.1716, test_f1: 0.4798
 epoch: 64, train_loss: 0.9974, test_loss: 1.1859, test_f1: 0.4457
 epoch: 65, train_loss: 0.9939, test_loss: 1.1706, test_f1: 0.4803
 epoch: 66, train_loss: 0.9883, test_loss: 1.1754, test_f1: 0.4565
 epoch: 67, train_loss: 0.9798, test_loss: 1.1705, test_f1: 0.4582
 epoch: 68, train_loss: 0.9618, test_loss: 1.1626, test_f1: 0.4653
 epoch: 69, train_loss: 0.9930, test_loss: 1.1909, test_f1: 0.4581
 epoch: 70, train_loss: 0.9964, test_loss: 1.1773, test_f1: 0.4643
 epoch: 71, train_loss: 0.9852, test_loss: 1.1716, test_f1: 0.4853
 epoch: 72, train_loss: 0.9893, test_loss: 1.1779, test_f1: 0.4700
 epoch: 73, train_loss: 0.9778, test_loss: 1.1667, test_f1: 0.4612
 epoch: 74, train_loss: 0.9761, test_loss: 1.1786, test_f1: 0.4485
 epoch: 75, train_loss: 0.9748, test_loss: 1.1705, test_f1: 0.4671
 epoch: 76, train_loss: 0.9739, test_loss: 1.1685, test_f1: 0.4774
 epoch: 77, train_loss: 0.9702, test_loss: 1.1867, test_f1: 0.4529
 epoch: 78, train_loss: 0.9926, test_loss: 1.1744, test_f1: 0.4512
 epoch: 79, train_loss: 0.9829, test_loss: 1.1670, test_f1: 0.4766
 epoch: 80, train_loss: 0.9758, test_loss: 1.1879, test_f1: 0.4711
 epoch: 81, train_loss: 0.9659, test_loss: 1.1874, test_f1: 0.4412
 epoch: 82, train_loss: 0.9696, test_loss: 1.1832, test_f1: 0.4481
 epoch: 83, train_loss: 0.9582, test_loss: 1.1777, test_f1: 0.4513
 epoch: 84, train_loss: 0.9719, test_loss: 1.2144, test_f1: 0.4628
 epoch: 85, train_loss: 0.9735, test_loss: 1.1837, test_f1: 0.4697
 epoch: 86, train_loss: 0.9674, test_loss: 1.2054, test_f1: 0.4610
 epoch: 87, train_loss: 0.9452, test_loss: 1.1995, test_f1: 0.4627
 epoch: 88, train_loss: 0.9612, test_loss: 1.2051, test_f1: 0.4740
 epoch: 89, train_loss: 0.9518, test_loss: 1.1945, test_f1: 0.4904
 epoch: 90, train_loss: 0.9540, test_loss: 1.1762, test_f1: 0.4745
 epoch: 91, train_loss: 0.9573, test_loss: 1.2107, test_f1: 0.4854
 epoch: 92, train_loss: 0.9523, test_loss: 1.1999, test_f1: 0.4680
 epoch: 93, train_loss: 0.9389, test_loss: 1.1954, test_f1: 0.4625
 epoch: 94, train_loss: 0.9655, test_loss: 1.1963, test_f1: 0.4719
 epoch: 95, train_loss: 0.9579, test_loss: 1.1970, test_f1: 0.4708
 epoch: 96, train_loss: 0.9466, test_loss: 1.2097, test_f1: 0.4600
 epoch: 97, train_loss: 0.9331, test_loss: 1.1918, test_f1: 0.4592
 epoch: 98, train_loss: 0.9531, test_loss: 1.1853, test_f1: 0.4527
 epoch: 99, train_loss: 0.9404, test_loss: 1.2241, test_f1: 0.4568

Training completed in 663.73 seconds
Best F1: 0.5539 at epoch 80
Mean F1 across iterations: 0.4996  0.0301
========================FINAL RESULTS================================
FEGIN weighted F1: 0.5539  0.0301
python main.py --data ltspice_demos --representation component_component --model FEGIN --layers 4 --hiddens 32 --batch_size 32 --lr 0.0001 --emb_size 250 --epochs 100 --save_appendix component_component_L4_H32_BS32_LR0.0001_E250 --no_val
-----



STDERR:
  File "main.py", line 370, in <module>
    main()
  File "main.py", line 254, in main
    dataset = dataset_class(
  File "/home/philip/projects/ltspice_examples_code_repo/Circuit-Completion-Using-GNNs/component_classification_with_link_prediction_head/evaluation/FEGIN/kernel/circuit_datasets.py", line 15, in __init__
    self.data, self.slices = torch.load(self.processed_paths[0])
  File "/home/philip/.local/lib/python3.8/site-packages/torch/serialization.py", line 1040, in load
    warnings.warn(
  File "/usr/lib/python3.8/warnings.py", line 109, in _showwarnmsg
    sw(msg.message, msg.category, msg.filename, msg.lineno,
  File "main.py", line 47, in warn_with_traceback
    traceback.print_stack(file=log)
/home/philip/projects/ltspice_examples_code_repo/Circuit-Completion-Using-GNNs/component_classification_with_link_prediction_head/evaluation/FEGIN/kernel/circuit_datasets.py:15: FutureWarning: You are using `torch.load` with `weights_only=False` (the current default value), which uses the default pickle module implicitly. It is possible to construct malicious pickle data which will execute arbitrary code during unpickling (See https://github.com/pytorch/pytorch/blob/main/SECURITY.md#untrusted-models for more details). In a future release, the default value for `weights_only` will be flipped to `True`. This limits the functions that could be executed during unpickling. Arbitrary objects will no longer be allowed to be loaded via this mode unless they are explicitly allowlisted by the user via `torch.serialization.add_safe_globals`. We recommend you start setting `weights_only=True` for any use case where you don't have full control of the loaded file. Please open an issue on GitHub for any issues related to this experimental feature.
  self.data, self.slices = torch.load(self.processed_paths[0])
