STDOUT:
Results will be saved in /home/philip/projects/ltspice_examples_code_repo/Circuit-Completion-Using-GNNs/component_classification_with_link_prediction_head/evaluation/FEGIN/results/model_FEGIN_dataset_ltspice_demos
Command line input: python main.py --data ltspice_demos --representation component_component --model FEGIN --layers 4 --hiddens 32 --batch_size 32 --lr 0.0001 --emb_size 250 --epochs 100 --save_appendix component_component_L4_H32_BS32_LR0.0001_E250 --no_val
 is saved.
-----
ltspice_demos - FEGIN
Using 4 layers, 32 hidden units, h = 2
Loading component_component representation dataset
ENTERED
Training FEGIN on component_component representation
Train: 1565, Test: 383
##################ITERATION #0 ****************************************
 epoch: 0, train_loss: 1.4103, test_loss: 1.3968, test_f1: 0.0678
 epoch: 1, train_loss: 1.3983, test_loss: 1.3881, test_f1: 0.1127
 epoch: 2, train_loss: 1.3922, test_loss: 1.3815, test_f1: 0.2417
 epoch: 3, train_loss: 1.3834, test_loss: 1.3745, test_f1: 0.2833
 epoch: 4, train_loss: 1.3756, test_loss: 1.3663, test_f1: 0.2850
 epoch: 5, train_loss: 1.3618, test_loss: 1.3574, test_f1: 0.3116
 epoch: 6, train_loss: 1.3500, test_loss: 1.3452, test_f1: 0.3225
 epoch: 7, train_loss: 1.3372, test_loss: 1.3333, test_f1: 0.3054
 epoch: 8, train_loss: 1.3183, test_loss: 1.3202, test_f1: 0.3178
 epoch: 9, train_loss: 1.3023, test_loss: 1.3091, test_f1: 0.3117
 epoch: 10, train_loss: 1.2798, test_loss: 1.3007, test_f1: 0.3247
 epoch: 11, train_loss: 1.2624, test_loss: 1.2965, test_f1: 0.3284
 epoch: 12, train_loss: 1.2437, test_loss: 1.2952, test_f1: 0.3246
 epoch: 13, train_loss: 1.2244, test_loss: 1.2859, test_f1: 0.3196
 epoch: 14, train_loss: 1.2182, test_loss: 1.2681, test_f1: 0.3429
 epoch: 15, train_loss: 1.2084, test_loss: 1.2757, test_f1: 0.3200
 epoch: 16, train_loss: 1.1989, test_loss: 1.2667, test_f1: 0.3266
 epoch: 17, train_loss: 1.1877, test_loss: 1.2682, test_f1: 0.3374
 epoch: 18, train_loss: 1.1847, test_loss: 1.2601, test_f1: 0.3429
 epoch: 19, train_loss: 1.1768, test_loss: 1.2624, test_f1: 0.3425
 epoch: 20, train_loss: 1.1800, test_loss: 1.2676, test_f1: 0.3562
 epoch: 21, train_loss: 1.1675, test_loss: 1.2600, test_f1: 0.3584
 epoch: 22, train_loss: 1.1594, test_loss: 1.2697, test_f1: 0.3644
 epoch: 23, train_loss: 1.1633, test_loss: 1.2612, test_f1: 0.3504
 epoch: 24, train_loss: 1.1605, test_loss: 1.2595, test_f1: 0.3724
 epoch: 25, train_loss: 1.1583, test_loss: 1.2568, test_f1: 0.3740
 epoch: 26, train_loss: 1.1581, test_loss: 1.2532, test_f1: 0.3878
 epoch: 27, train_loss: 1.1522, test_loss: 1.2568, test_f1: 0.4029
 epoch: 28, train_loss: 1.1429, test_loss: 1.2536, test_f1: 0.4195
 epoch: 29, train_loss: 1.1404, test_loss: 1.2593, test_f1: 0.4282
 epoch: 30, train_loss: 1.1410, test_loss: 1.2611, test_f1: 0.4296
 epoch: 31, train_loss: 1.1328, test_loss: 1.2613, test_f1: 0.4177
 epoch: 32, train_loss: 1.1326, test_loss: 1.2598, test_f1: 0.4179
 epoch: 33, train_loss: 1.1336, test_loss: 1.2681, test_f1: 0.4063
 epoch: 34, train_loss: 1.1206, test_loss: 1.2555, test_f1: 0.4393
 epoch: 35, train_loss: 1.1174, test_loss: 1.2524, test_f1: 0.4495
 epoch: 36, train_loss: 1.1069, test_loss: 1.2563, test_f1: 0.4413
 epoch: 37, train_loss: 1.1151, test_loss: 1.2570, test_f1: 0.4544
 epoch: 38, train_loss: 1.1057, test_loss: 1.2497, test_f1: 0.4524
 epoch: 39, train_loss: 1.1131, test_loss: 1.2423, test_f1: 0.4497
 epoch: 40, train_loss: 1.1067, test_loss: 1.2898, test_f1: 0.4570
 epoch: 41, train_loss: 1.1048, test_loss: 1.2660, test_f1: 0.4552
 epoch: 42, train_loss: 1.0995, test_loss: 1.2635, test_f1: 0.4617
 epoch: 43, train_loss: 1.1029, test_loss: 1.2574, test_f1: 0.4525
 epoch: 44, train_loss: 1.0935, test_loss: 1.2811, test_f1: 0.4463
 epoch: 45, train_loss: 1.0961, test_loss: 1.2564, test_f1: 0.4569
 epoch: 46, train_loss: 1.0873, test_loss: 1.2712, test_f1: 0.4533
 epoch: 47, train_loss: 1.0952, test_loss: 1.2510, test_f1: 0.4290
 epoch: 48, train_loss: 1.0857, test_loss: 1.2791, test_f1: 0.4502
 epoch: 49, train_loss: 1.0875, test_loss: 1.2590, test_f1: 0.4373
 epoch: 50, train_loss: 1.0803, test_loss: 1.2633, test_f1: 0.4515
 epoch: 51, train_loss: 1.0750, test_loss: 1.2667, test_f1: 0.4695
 epoch: 52, train_loss: 1.0670, test_loss: 1.2394, test_f1: 0.4525
 epoch: 53, train_loss: 1.0775, test_loss: 1.2457, test_f1: 0.4438
 epoch: 54, train_loss: 1.0627, test_loss: 1.2596, test_f1: 0.4576
 epoch: 55, train_loss: 1.0570, test_loss: 1.2580, test_f1: 0.4700
 epoch: 56, train_loss: 1.0714, test_loss: 1.2757, test_f1: 0.4471
 epoch: 57, train_loss: 1.0550, test_loss: 1.2640, test_f1: 0.4595
 epoch: 58, train_loss: 1.0582, test_loss: 1.2770, test_f1: 0.4658
 epoch: 59, train_loss: 1.0698, test_loss: 1.2804, test_f1: 0.4512
 epoch: 60, train_loss: 1.0730, test_loss: 1.2813, test_f1: 0.4633
 epoch: 61, train_loss: 1.0650, test_loss: 1.2651, test_f1: 0.4601
 epoch: 62, train_loss: 1.0639, test_loss: 1.2598, test_f1: 0.4586
 epoch: 63, train_loss: 1.0641, test_loss: 1.2717, test_f1: 0.4633
 epoch: 64, train_loss: 1.0568, test_loss: 1.2573, test_f1: 0.4610
 epoch: 65, train_loss: 1.0561, test_loss: 1.2744, test_f1: 0.4479
 epoch: 66, train_loss: 1.0540, test_loss: 1.2782, test_f1: 0.4507
 epoch: 67, train_loss: 1.0537, test_loss: 1.2777, test_f1: 0.4424
 epoch: 68, train_loss: 1.0500, test_loss: 1.2698, test_f1: 0.4468
 epoch: 69, train_loss: 1.0591, test_loss: 1.2986, test_f1: 0.4759
 epoch: 70, train_loss: 1.0475, test_loss: 1.2808, test_f1: 0.4595
 epoch: 71, train_loss: 1.0527, test_loss: 1.2904, test_f1: 0.4506
 epoch: 72, train_loss: 1.0417, test_loss: 1.2729, test_f1: 0.4507
 epoch: 73, train_loss: 1.0339, test_loss: 1.2882, test_f1: 0.4526
 epoch: 74, train_loss: 1.0431, test_loss: 1.2940, test_f1: 0.4713
 epoch: 75, train_loss: 1.0407, test_loss: 1.2959, test_f1: 0.4669
 epoch: 76, train_loss: 1.0320, test_loss: 1.3033, test_f1: 0.4751
 epoch: 77, train_loss: 1.0284, test_loss: 1.2937, test_f1: 0.4697
 epoch: 78, train_loss: 1.0284, test_loss: 1.2804, test_f1: 0.4536
 epoch: 79, train_loss: 1.0334, test_loss: 1.2703, test_f1: 0.4523
 epoch: 80, train_loss: 1.0378, test_loss: 1.2833, test_f1: 0.4578
 epoch: 81, train_loss: 1.0351, test_loss: 1.2969, test_f1: 0.4578
 epoch: 82, train_loss: 1.0291, test_loss: 1.2898, test_f1: 0.4690
 epoch: 83, train_loss: 1.0301, test_loss: 1.2892, test_f1: 0.4709
 epoch: 84, train_loss: 1.0256, test_loss: 1.3041, test_f1: 0.4768
 epoch: 85, train_loss: 1.0312, test_loss: 1.2976, test_f1: 0.4900
 epoch: 86, train_loss: 1.0303, test_loss: 1.3029, test_f1: 0.4723
 epoch: 87, train_loss: 1.0198, test_loss: 1.2957, test_f1: 0.4782
 epoch: 88, train_loss: 1.0218, test_loss: 1.2931, test_f1: 0.4759
 epoch: 89, train_loss: 1.0174, test_loss: 1.2812, test_f1: 0.4911
 epoch: 90, train_loss: 1.0123, test_loss: 1.2946, test_f1: 0.4962
 epoch: 91, train_loss: 1.0303, test_loss: 1.2934, test_f1: 0.4839
 epoch: 92, train_loss: 1.0080, test_loss: 1.3217, test_f1: 0.4937
 epoch: 93, train_loss: 1.0061, test_loss: 1.2921, test_f1: 0.4983
 epoch: 94, train_loss: 1.0141, test_loss: 1.2963, test_f1: 0.4914
 epoch: 95, train_loss: 1.0156, test_loss: 1.3099, test_f1: 0.5136
 epoch: 96, train_loss: 1.0074, test_loss: 1.3009, test_f1: 0.4918
 epoch: 97, train_loss: 1.0115, test_loss: 1.3301, test_f1: 0.5154
 epoch: 98, train_loss: 1.0089, test_loss: 1.3307, test_f1: 0.4972
 epoch: 99, train_loss: 1.0104, test_loss: 1.3531, test_f1: 0.5098
##################ITERATION #1 ****************************************
 epoch: 0, train_loss: 1.3667, test_loss: 1.3695, test_f1: 0.3186
 epoch: 1, train_loss: 1.3305, test_loss: 1.3405, test_f1: 0.3168
 epoch: 2, train_loss: 1.3041, test_loss: 1.3241, test_f1: 0.3117
 epoch: 3, train_loss: 1.2771, test_loss: 1.3138, test_f1: 0.2954
 epoch: 4, train_loss: 1.2618, test_loss: 1.3024, test_f1: 0.2618
 epoch: 5, train_loss: 1.2416, test_loss: 1.2893, test_f1: 0.2454
 epoch: 6, train_loss: 1.2268, test_loss: 1.2770, test_f1: 0.2488
 epoch: 7, train_loss: 1.2165, test_loss: 1.2684, test_f1: 0.2489
 epoch: 8, train_loss: 1.2103, test_loss: 1.2633, test_f1: 0.2401
 epoch: 9, train_loss: 1.2021, test_loss: 1.2539, test_f1: 0.2463
 epoch: 10, train_loss: 1.1975, test_loss: 1.2544, test_f1: 0.2411
 epoch: 11, train_loss: 1.1915, test_loss: 1.2486, test_f1: 0.2376
 epoch: 12, train_loss: 1.1780, test_loss: 1.2415, test_f1: 0.2529
 epoch: 13, train_loss: 1.1841, test_loss: 1.2455, test_f1: 0.2786
 epoch: 14, train_loss: 1.1721, test_loss: 1.2349, test_f1: 0.2628
 epoch: 15, train_loss: 1.1744, test_loss: 1.2341, test_f1: 0.3018
 epoch: 16, train_loss: 1.1638, test_loss: 1.2310, test_f1: 0.3405
 epoch: 17, train_loss: 1.1723, test_loss: 1.2276, test_f1: 0.3263
 epoch: 18, train_loss: 1.1570, test_loss: 1.2236, test_f1: 0.3341
 epoch: 19, train_loss: 1.1536, test_loss: 1.2240, test_f1: 0.3496
 epoch: 20, train_loss: 1.1529, test_loss: 1.2209, test_f1: 0.3362
 epoch: 21, train_loss: 1.1502, test_loss: 1.2150, test_f1: 0.3586
 epoch: 22, train_loss: 1.1449, test_loss: 1.2105, test_f1: 0.3668
 epoch: 23, train_loss: 1.1442, test_loss: 1.2090, test_f1: 0.3455
 epoch: 24, train_loss: 1.1388, test_loss: 1.2094, test_f1: 0.3657
 epoch: 25, train_loss: 1.1285, test_loss: 1.2023, test_f1: 0.3636
 epoch: 26, train_loss: 1.1356, test_loss: 1.2059, test_f1: 0.3639
 epoch: 27, train_loss: 1.1205, test_loss: 1.2000, test_f1: 0.3778
 epoch: 28, train_loss: 1.1267, test_loss: 1.1934, test_f1: 0.3754
 epoch: 29, train_loss: 1.1255, test_loss: 1.1952, test_f1: 0.3828
 epoch: 30, train_loss: 1.1161, test_loss: 1.1966, test_f1: 0.3877
 epoch: 31, train_loss: 1.1197, test_loss: 1.1915, test_f1: 0.3848
 epoch: 32, train_loss: 1.1166, test_loss: 1.1918, test_f1: 0.3701
 epoch: 33, train_loss: 1.1098, test_loss: 1.1898, test_f1: 0.3882
 epoch: 34, train_loss: 1.1169, test_loss: 1.1828, test_f1: 0.3930
 epoch: 35, train_loss: 1.1033, test_loss: 1.1845, test_f1: 0.3956
 epoch: 36, train_loss: 1.1112, test_loss: 1.1825, test_f1: 0.3990
 epoch: 37, train_loss: 1.1001, test_loss: 1.1832, test_f1: 0.3777
 epoch: 38, train_loss: 1.1003, test_loss: 1.1850, test_f1: 0.3792
 epoch: 39, train_loss: 1.0852, test_loss: 1.1814, test_f1: 0.3774
 epoch: 40, train_loss: 1.0830, test_loss: 1.1846, test_f1: 0.3795
 epoch: 41, train_loss: 1.0978, test_loss: 1.1780, test_f1: 0.4027
 epoch: 42, train_loss: 1.0943, test_loss: 1.1794, test_f1: 0.3894
 epoch: 43, train_loss: 1.0848, test_loss: 1.1766, test_f1: 0.4073
 epoch: 44, train_loss: 1.0803, test_loss: 1.1805, test_f1: 0.4097
 epoch: 45, train_loss: 1.0705, test_loss: 1.1724, test_f1: 0.4100
 epoch: 46, train_loss: 1.0803, test_loss: 1.1748, test_f1: 0.4066
 epoch: 47, train_loss: 1.0688, test_loss: 1.1699, test_f1: 0.3994
 epoch: 48, train_loss: 1.0690, test_loss: 1.1769, test_f1: 0.4165
 epoch: 49, train_loss: 1.0599, test_loss: 1.1908, test_f1: 0.4049
 epoch: 50, train_loss: 1.0603, test_loss: 1.1528, test_f1: 0.4271
 epoch: 51, train_loss: 1.0536, test_loss: 1.1593, test_f1: 0.4368
 epoch: 52, train_loss: 1.0675, test_loss: 1.1539, test_f1: 0.4417
 epoch: 53, train_loss: 1.0572, test_loss: 1.1503, test_f1: 0.4089
 epoch: 54, train_loss: 1.0594, test_loss: 1.1474, test_f1: 0.4336
 epoch: 55, train_loss: 1.0517, test_loss: 1.1451, test_f1: 0.4466
 epoch: 56, train_loss: 1.0534, test_loss: 1.1430, test_f1: 0.4687
 epoch: 57, train_loss: 1.0467, test_loss: 1.1780, test_f1: 0.4513
 epoch: 58, train_loss: 1.0393, test_loss: 1.1721, test_f1: 0.4500
 epoch: 59, train_loss: 1.0475, test_loss: 1.1537, test_f1: 0.4690
 epoch: 60, train_loss: 1.0319, test_loss: 1.1460, test_f1: 0.4675
 epoch: 61, train_loss: 1.0418, test_loss: 1.1470, test_f1: 0.4720
 epoch: 62, train_loss: 1.0488, test_loss: 1.1413, test_f1: 0.4681
 epoch: 63, train_loss: 1.0285, test_loss: 1.1390, test_f1: 0.4859
 epoch: 64, train_loss: 1.0237, test_loss: 1.1353, test_f1: 0.4651
 epoch: 65, train_loss: 1.0437, test_loss: 1.1303, test_f1: 0.4825
 epoch: 66, train_loss: 1.0381, test_loss: 1.1447, test_f1: 0.4815
 epoch: 67, train_loss: 1.0294, test_loss: 1.1324, test_f1: 0.4825
 epoch: 68, train_loss: 1.0451, test_loss: 1.1412, test_f1: 0.4820
 epoch: 69, train_loss: 1.0282, test_loss: 1.1370, test_f1: 0.4736
 epoch: 70, train_loss: 1.0222, test_loss: 1.1507, test_f1: 0.4711
 epoch: 71, train_loss: 1.0208, test_loss: 1.1325, test_f1: 0.4695
 epoch: 72, train_loss: 1.0250, test_loss: 1.1296, test_f1: 0.4802
 epoch: 73, train_loss: 1.0278, test_loss: 1.1364, test_f1: 0.4697
 epoch: 74, train_loss: 1.0226, test_loss: 1.1217, test_f1: 0.4820
 epoch: 75, train_loss: 1.0229, test_loss: 1.1293, test_f1: 0.4788
 epoch: 76, train_loss: 1.0308, test_loss: 1.1174, test_f1: 0.4810
 epoch: 77, train_loss: 1.0116, test_loss: 1.1218, test_f1: 0.4662
 epoch: 78, train_loss: 1.0150, test_loss: 1.1250, test_f1: 0.4752
 epoch: 79, train_loss: 1.0174, test_loss: 1.1184, test_f1: 0.4846
 epoch: 80, train_loss: 1.0209, test_loss: 1.1252, test_f1: 0.4673
 epoch: 81, train_loss: 1.0245, test_loss: 1.1186, test_f1: 0.4830
 epoch: 82, train_loss: 1.0205, test_loss: 1.1141, test_f1: 0.4669
 epoch: 83, train_loss: 1.0064, test_loss: 1.1156, test_f1: 0.4730
 epoch: 84, train_loss: 1.0124, test_loss: 1.1197, test_f1: 0.4740
 epoch: 85, train_loss: 1.0021, test_loss: 1.1185, test_f1: 0.4689
 epoch: 86, train_loss: 1.0169, test_loss: 1.1154, test_f1: 0.4785
 epoch: 87, train_loss: 0.9985, test_loss: 1.1188, test_f1: 0.4762
 epoch: 88, train_loss: 1.0082, test_loss: 1.1151, test_f1: 0.4777
 epoch: 89, train_loss: 0.9984, test_loss: 1.1185, test_f1: 0.4887
 epoch: 90, train_loss: 1.0068, test_loss: 1.1156, test_f1: 0.4782
 epoch: 91, train_loss: 1.0038, test_loss: 1.1112, test_f1: 0.4675
 epoch: 92, train_loss: 0.9944, test_loss: 1.1152, test_f1: 0.4867
 epoch: 93, train_loss: 0.9889, test_loss: 1.1197, test_f1: 0.4885
 epoch: 94, train_loss: 0.9903, test_loss: 1.1513, test_f1: 0.4873
 epoch: 95, train_loss: 1.0032, test_loss: 1.1214, test_f1: 0.4775
 epoch: 96, train_loss: 0.9857, test_loss: 1.1385, test_f1: 0.4777
 epoch: 97, train_loss: 0.9865, test_loss: 1.1241, test_f1: 0.5008
 epoch: 98, train_loss: 0.9857, test_loss: 1.1144, test_f1: 0.4747
 epoch: 99, train_loss: 0.9947, test_loss: 1.1187, test_f1: 0.4803
##################ITERATION #2 ****************************************
 epoch: 0, train_loss: 1.2996, test_loss: 1.3293, test_f1: 0.3027
 epoch: 1, train_loss: 1.2721, test_loss: 1.3386, test_f1: 0.2691
 epoch: 2, train_loss: 1.2553, test_loss: 1.3244, test_f1: 0.2882
 epoch: 3, train_loss: 1.2479, test_loss: 1.3559, test_f1: 0.3064
 epoch: 4, train_loss: 1.2402, test_loss: 1.3193, test_f1: 0.3082
 epoch: 5, train_loss: 1.2289, test_loss: 1.3139, test_f1: 0.3068
 epoch: 6, train_loss: 1.2260, test_loss: 1.3167, test_f1: 0.3143
 epoch: 7, train_loss: 1.2118, test_loss: 1.3095, test_f1: 0.3196
 epoch: 8, train_loss: 1.2059, test_loss: 1.3537, test_f1: 0.3145
 epoch: 9, train_loss: 1.2014, test_loss: 1.2880, test_f1: 0.3548
 epoch: 10, train_loss: 1.1927, test_loss: 1.2844, test_f1: 0.3589
 epoch: 11, train_loss: 1.1887, test_loss: 1.2783, test_f1: 0.3751
 epoch: 12, train_loss: 1.1832, test_loss: 1.2822, test_f1: 0.3818
 epoch: 13, train_loss: 1.1680, test_loss: 1.2734, test_f1: 0.3838
 epoch: 14, train_loss: 1.1724, test_loss: 1.2659, test_f1: 0.3995
 epoch: 15, train_loss: 1.1651, test_loss: 1.2601, test_f1: 0.4030
 epoch: 16, train_loss: 1.1541, test_loss: 1.2535, test_f1: 0.4196
 epoch: 17, train_loss: 1.1480, test_loss: 1.2632, test_f1: 0.4068
 epoch: 18, train_loss: 1.1438, test_loss: 1.2391, test_f1: 0.4243
 epoch: 19, train_loss: 1.1340, test_loss: 1.2376, test_f1: 0.4329
 epoch: 20, train_loss: 1.1367, test_loss: 1.2350, test_f1: 0.4252
 epoch: 21, train_loss: 1.1241, test_loss: 1.2269, test_f1: 0.4249
 epoch: 22, train_loss: 1.1155, test_loss: 1.2347, test_f1: 0.4339
 epoch: 23, train_loss: 1.1228, test_loss: 1.2345, test_f1: 0.4379
 epoch: 24, train_loss: 1.1171, test_loss: 1.2235, test_f1: 0.4522
 epoch: 25, train_loss: 1.1087, test_loss: 1.2226, test_f1: 0.4478
 epoch: 26, train_loss: 1.1126, test_loss: 1.2228, test_f1: 0.4484
 epoch: 27, train_loss: 1.1107, test_loss: 1.2215, test_f1: 0.4359
 epoch: 28, train_loss: 1.0959, test_loss: 1.2178, test_f1: 0.4356
 epoch: 29, train_loss: 1.1069, test_loss: 1.2115, test_f1: 0.4294
 epoch: 30, train_loss: 1.0925, test_loss: 1.2210, test_f1: 0.4345
 epoch: 31, train_loss: 1.0817, test_loss: 1.2217, test_f1: 0.4360
 epoch: 32, train_loss: 1.0799, test_loss: 1.2230, test_f1: 0.4449
 epoch: 33, train_loss: 1.0778, test_loss: 1.2102, test_f1: 0.4544
 epoch: 34, train_loss: 1.0809, test_loss: 1.2102, test_f1: 0.4340
 epoch: 35, train_loss: 1.0695, test_loss: 1.2118, test_f1: 0.4409
 epoch: 36, train_loss: 1.0667, test_loss: 1.2021, test_f1: 0.4515
 epoch: 37, train_loss: 1.0644, test_loss: 1.2038, test_f1: 0.4501
 epoch: 38, train_loss: 1.0586, test_loss: 1.1920, test_f1: 0.4400
 epoch: 39, train_loss: 1.0528, test_loss: 1.1907, test_f1: 0.4382
 epoch: 40, train_loss: 1.0570, test_loss: 1.1949, test_f1: 0.4482
 epoch: 41, train_loss: 1.0423, test_loss: 1.1922, test_f1: 0.4449
 epoch: 42, train_loss: 1.0471, test_loss: 1.1891, test_f1: 0.4462
 epoch: 43, train_loss: 1.0477, test_loss: 1.1934, test_f1: 0.4506
 epoch: 44, train_loss: 1.0343, test_loss: 1.1810, test_f1: 0.4541
 epoch: 45, train_loss: 1.0419, test_loss: 1.1833, test_f1: 0.4779
 epoch: 46, train_loss: 1.0348, test_loss: 1.1909, test_f1: 0.4731
 epoch: 47, train_loss: 1.0356, test_loss: 1.1764, test_f1: 0.4761
 epoch: 48, train_loss: 1.0223, test_loss: 1.1815, test_f1: 0.4767
 epoch: 49, train_loss: 1.0365, test_loss: 1.1881, test_f1: 0.4742
 epoch: 50, train_loss: 1.0247, test_loss: 1.1825, test_f1: 0.4683
 epoch: 51, train_loss: 1.0191, test_loss: 1.1711, test_f1: 0.4686
 epoch: 52, train_loss: 1.0177, test_loss: 1.1804, test_f1: 0.4845
 epoch: 53, train_loss: 1.0202, test_loss: 1.1773, test_f1: 0.4862
 epoch: 54, train_loss: 1.0207, test_loss: 1.1861, test_f1: 0.4596
 epoch: 55, train_loss: 1.0136, test_loss: 1.1774, test_f1: 0.4991
 epoch: 56, train_loss: 1.0081, test_loss: 1.1755, test_f1: 0.4823
 epoch: 57, train_loss: 1.0102, test_loss: 1.1888, test_f1: 0.4730
 epoch: 58, train_loss: 1.0047, test_loss: 1.1835, test_f1: 0.5171
 epoch: 59, train_loss: 1.0114, test_loss: 1.1866, test_f1: 0.5024
 epoch: 60, train_loss: 1.0051, test_loss: 1.1942, test_f1: 0.4866
 epoch: 61, train_loss: 1.0051, test_loss: 1.1757, test_f1: 0.4999
 epoch: 62, train_loss: 1.0028, test_loss: 1.1804, test_f1: 0.5148
 epoch: 63, train_loss: 1.0087, test_loss: 1.1798, test_f1: 0.5012
 epoch: 64, train_loss: 1.0058, test_loss: 1.1827, test_f1: 0.4785
 epoch: 65, train_loss: 1.0120, test_loss: 1.1732, test_f1: 0.5051
 epoch: 66, train_loss: 1.0046, test_loss: 1.1842, test_f1: 0.5074
 epoch: 67, train_loss: 1.0012, test_loss: 1.1805, test_f1: 0.5066
 epoch: 68, train_loss: 1.0013, test_loss: 1.1717, test_f1: 0.5182
 epoch: 69, train_loss: 0.9811, test_loss: 1.1799, test_f1: 0.5056
 epoch: 70, train_loss: 1.0009, test_loss: 1.1803, test_f1: 0.5169
 epoch: 71, train_loss: 0.9946, test_loss: 1.1813, test_f1: 0.4946
 epoch: 72, train_loss: 0.9980, test_loss: 1.1809, test_f1: 0.5038
 epoch: 73, train_loss: 0.9825, test_loss: 1.1861, test_f1: 0.5060
 epoch: 74, train_loss: 1.0000, test_loss: 1.1894, test_f1: 0.4870
 epoch: 75, train_loss: 0.9927, test_loss: 1.2001, test_f1: 0.4950
 epoch: 76, train_loss: 0.9861, test_loss: 1.1824, test_f1: 0.5100
 epoch: 77, train_loss: 0.9964, test_loss: 1.1898, test_f1: 0.4844
 epoch: 78, train_loss: 0.9931, test_loss: 1.2036, test_f1: 0.4809
 epoch: 79, train_loss: 0.9964, test_loss: 1.1843, test_f1: 0.5009
 epoch: 80, train_loss: 0.9931, test_loss: 1.1961, test_f1: 0.4961
 epoch: 81, train_loss: 0.9887, test_loss: 1.1966, test_f1: 0.4791
 epoch: 82, train_loss: 0.9919, test_loss: 1.1901, test_f1: 0.4875
 epoch: 83, train_loss: 0.9858, test_loss: 1.1957, test_f1: 0.4850
 epoch: 84, train_loss: 0.9750, test_loss: 1.1867, test_f1: 0.4823
 epoch: 85, train_loss: 0.9861, test_loss: 1.2098, test_f1: 0.4947
 epoch: 86, train_loss: 0.9838, test_loss: 1.1956, test_f1: 0.5049
 epoch: 87, train_loss: 0.9791, test_loss: 1.1934, test_f1: 0.5038
 epoch: 88, train_loss: 0.9712, test_loss: 1.2040, test_f1: 0.4960
 epoch: 89, train_loss: 0.9813, test_loss: 1.1977, test_f1: 0.4913
 epoch: 90, train_loss: 0.9787, test_loss: 1.1908, test_f1: 0.5040
 epoch: 91, train_loss: 0.9753, test_loss: 1.2044, test_f1: 0.5085
 epoch: 92, train_loss: 0.9788, test_loss: 1.2009, test_f1: 0.5052
 epoch: 93, train_loss: 0.9736, test_loss: 1.1950, test_f1: 0.5005
 epoch: 94, train_loss: 0.9802, test_loss: 1.2142, test_f1: 0.4917
 epoch: 95, train_loss: 0.9815, test_loss: 1.1982, test_f1: 0.4976
 epoch: 96, train_loss: 0.9770, test_loss: 1.2044, test_f1: 0.5027
 epoch: 97, train_loss: 0.9654, test_loss: 1.1993, test_f1: 0.5008
 epoch: 98, train_loss: 0.9716, test_loss: 1.1852, test_f1: 0.5292
 epoch: 99, train_loss: 0.9746, test_loss: 1.1948, test_f1: 0.4980
##################ITERATION #3 ****************************************
 epoch: 0, train_loss: 1.3137, test_loss: 1.3209, test_f1: 0.2281
 epoch: 1, train_loss: 1.2794, test_loss: 1.3092, test_f1: 0.2336
 epoch: 2, train_loss: 1.2644, test_loss: 1.3005, test_f1: 0.2281
 epoch: 3, train_loss: 1.2463, test_loss: 1.2918, test_f1: 0.2270
 epoch: 4, train_loss: 1.2337, test_loss: 1.2913, test_f1: 0.2323
 epoch: 5, train_loss: 1.2279, test_loss: 1.2779, test_f1: 0.2492
 epoch: 6, train_loss: 1.2127, test_loss: 1.2693, test_f1: 0.2499
 epoch: 7, train_loss: 1.1995, test_loss: 1.2636, test_f1: 0.2450
 epoch: 8, train_loss: 1.1931, test_loss: 1.2684, test_f1: 0.2701
 epoch: 9, train_loss: 1.1897, test_loss: 1.2645, test_f1: 0.2955
 epoch: 10, train_loss: 1.1753, test_loss: 1.2565, test_f1: 0.3097
 epoch: 11, train_loss: 1.1752, test_loss: 1.2520, test_f1: 0.3102
 epoch: 12, train_loss: 1.1680, test_loss: 1.2375, test_f1: 0.3026
 epoch: 13, train_loss: 1.1631, test_loss: 1.2391, test_f1: 0.3061
 epoch: 14, train_loss: 1.1545, test_loss: 1.2358, test_f1: 0.3065
 epoch: 15, train_loss: 1.1572, test_loss: 1.2443, test_f1: 0.3269
 epoch: 16, train_loss: 1.1398, test_loss: 1.2400, test_f1: 0.3241
 epoch: 17, train_loss: 1.1381, test_loss: 1.2466, test_f1: 0.3224
 epoch: 18, train_loss: 1.1262, test_loss: 1.2439, test_f1: 0.3178
 epoch: 19, train_loss: 1.1314, test_loss: 1.2576, test_f1: 0.3192
 epoch: 20, train_loss: 1.1373, test_loss: 1.2540, test_f1: 0.3144
 epoch: 21, train_loss: 1.1217, test_loss: 1.2324, test_f1: 0.3220
 epoch: 22, train_loss: 1.1174, test_loss: 1.2434, test_f1: 0.3185
 epoch: 23, train_loss: 1.1157, test_loss: 1.2372, test_f1: 0.3104
 epoch: 24, train_loss: 1.1214, test_loss: 1.2488, test_f1: 0.3166
 epoch: 25, train_loss: 1.1085, test_loss: 1.2433, test_f1: 0.3244
 epoch: 26, train_loss: 1.1164, test_loss: 1.2486, test_f1: 0.3178
 epoch: 27, train_loss: 1.1006, test_loss: 1.2448, test_f1: 0.3429
 epoch: 28, train_loss: 1.1042, test_loss: 1.2431, test_f1: 0.3293
 epoch: 29, train_loss: 1.0975, test_loss: 1.2547, test_f1: 0.3341
 epoch: 30, train_loss: 1.0904, test_loss: 1.2425, test_f1: 0.3220
 epoch: 31, train_loss: 1.0893, test_loss: 1.2440, test_f1: 0.3302
 epoch: 32, train_loss: 1.0789, test_loss: 1.2495, test_f1: 0.3331
 epoch: 33, train_loss: 1.0776, test_loss: 1.2376, test_f1: 0.3256
 epoch: 34, train_loss: 1.0857, test_loss: 1.2375, test_f1: 0.3490
 epoch: 35, train_loss: 1.0804, test_loss: 1.2314, test_f1: 0.3338
 epoch: 36, train_loss: 1.0736, test_loss: 1.2412, test_f1: 0.3731
 epoch: 37, train_loss: 1.0775, test_loss: 1.2486, test_f1: 0.3357
 epoch: 38, train_loss: 1.0690, test_loss: 1.2579, test_f1: 0.3695
 epoch: 39, train_loss: 1.0739, test_loss: 1.2546, test_f1: 0.3487
 epoch: 40, train_loss: 1.0565, test_loss: 1.2479, test_f1: 0.3545
 epoch: 41, train_loss: 1.0633, test_loss: 1.2653, test_f1: 0.3625
 epoch: 42, train_loss: 1.0478, test_loss: 1.2586, test_f1: 0.3484
 epoch: 43, train_loss: 1.0621, test_loss: 1.2612, test_f1: 0.3403
 epoch: 44, train_loss: 1.0480, test_loss: 1.2569, test_f1: 0.3484
 epoch: 45, train_loss: 1.0479, test_loss: 1.2546, test_f1: 0.3603
 epoch: 46, train_loss: 1.0516, test_loss: 1.2507, test_f1: 0.3559
 epoch: 47, train_loss: 1.0558, test_loss: 1.2838, test_f1: 0.3562
 epoch: 48, train_loss: 1.0517, test_loss: 1.2933, test_f1: 0.3502
 epoch: 49, train_loss: 1.0430, test_loss: 1.2694, test_f1: 0.3472
 epoch: 50, train_loss: 1.0521, test_loss: 1.2860, test_f1: 0.3636
 epoch: 51, train_loss: 1.0479, test_loss: 1.3082, test_f1: 0.3450
 epoch: 52, train_loss: 1.0429, test_loss: 1.3048, test_f1: 0.3482
 epoch: 53, train_loss: 1.0265, test_loss: 1.3087, test_f1: 0.3518
 epoch: 54, train_loss: 1.0369, test_loss: 1.2901, test_f1: 0.3497
 epoch: 55, train_loss: 1.0324, test_loss: 1.2984, test_f1: 0.3513
 epoch: 56, train_loss: 1.0238, test_loss: 1.2732, test_f1: 0.3523
 epoch: 57, train_loss: 1.0440, test_loss: 1.2606, test_f1: 0.3525
 epoch: 58, train_loss: 1.0368, test_loss: 1.2998, test_f1: 0.3475
 epoch: 59, train_loss: 1.0293, test_loss: 1.3091, test_f1: 0.3543
 epoch: 60, train_loss: 1.0179, test_loss: 1.2946, test_f1: 0.3537
 epoch: 61, train_loss: 1.0368, test_loss: 1.3088, test_f1: 0.3570
 epoch: 62, train_loss: 1.0287, test_loss: 1.3021, test_f1: 0.3522
 epoch: 63, train_loss: 1.0185, test_loss: 1.2930, test_f1: 0.3722
 epoch: 64, train_loss: 1.0215, test_loss: 1.3144, test_f1: 0.3704
 epoch: 65, train_loss: 1.0168, test_loss: 1.2916, test_f1: 0.3816
 epoch: 66, train_loss: 1.0204, test_loss: 1.2903, test_f1: 0.3734
 epoch: 67, train_loss: 1.0171, test_loss: 1.3091, test_f1: 0.3755
 epoch: 68, train_loss: 1.0266, test_loss: 1.3121, test_f1: 0.3856
 epoch: 69, train_loss: 1.0161, test_loss: 1.3019, test_f1: 0.3830
 epoch: 70, train_loss: 1.0133, test_loss: 1.2883, test_f1: 0.3885
 epoch: 71, train_loss: 1.0013, test_loss: 1.3503, test_f1: 0.3847
 epoch: 72, train_loss: 1.0037, test_loss: 1.2950, test_f1: 0.3983
 epoch: 73, train_loss: 1.0143, test_loss: 1.3307, test_f1: 0.4014
 epoch: 74, train_loss: 1.0175, test_loss: 1.3092, test_f1: 0.4069
 epoch: 75, train_loss: 1.0104, test_loss: 1.3092, test_f1: 0.4010
 epoch: 76, train_loss: 1.0127, test_loss: 1.3137, test_f1: 0.3944
 epoch: 77, train_loss: 1.0034, test_loss: 1.3110, test_f1: 0.4065
 epoch: 78, train_loss: 0.9944, test_loss: 1.3169, test_f1: 0.4055
 epoch: 79, train_loss: 1.0059, test_loss: 1.3325, test_f1: 0.4100
 epoch: 80, train_loss: 1.0019, test_loss: 1.3327, test_f1: 0.4190
 epoch: 81, train_loss: 1.0002, test_loss: 1.3240, test_f1: 0.4198
 epoch: 82, train_loss: 0.9974, test_loss: 1.3325, test_f1: 0.4085
 epoch: 83, train_loss: 1.0083, test_loss: 1.3155, test_f1: 0.4216
 epoch: 84, train_loss: 1.0125, test_loss: 1.3380, test_f1: 0.4188
 epoch: 85, train_loss: 0.9906, test_loss: 1.3319, test_f1: 0.4314
 epoch: 86, train_loss: 1.0032, test_loss: 1.3273, test_f1: 0.4311
 epoch: 87, train_loss: 1.0023, test_loss: 1.3513, test_f1: 0.4211
 epoch: 88, train_loss: 0.9798, test_loss: 1.3504, test_f1: 0.4238
 epoch: 89, train_loss: 0.9841, test_loss: 1.3346, test_f1: 0.4465
 epoch: 90, train_loss: 0.9826, test_loss: 1.3177, test_f1: 0.4332
 epoch: 91, train_loss: 0.9907, test_loss: 1.3313, test_f1: 0.4425
 epoch: 92, train_loss: 0.9964, test_loss: 1.3389, test_f1: 0.4606
 epoch: 93, train_loss: 0.9953, test_loss: 1.3447, test_f1: 0.4356
 epoch: 94, train_loss: 0.9769, test_loss: 1.3262, test_f1: 0.4381
 epoch: 95, train_loss: 0.9921, test_loss: 1.2994, test_f1: 0.4284
 epoch: 96, train_loss: 0.9971, test_loss: 1.3337, test_f1: 0.4545
 epoch: 97, train_loss: 0.9760, test_loss: 1.3521, test_f1: 0.4366
 epoch: 98, train_loss: 0.9721, test_loss: 1.3258, test_f1: 0.4519
 epoch: 99, train_loss: 0.9691, test_loss: 1.3546, test_f1: 0.4575
##################ITERATION #4 ****************************************
 epoch: 0, train_loss: 1.2869, test_loss: 1.3533, test_f1: 0.2404
 epoch: 1, train_loss: 1.2624, test_loss: 1.3458, test_f1: 0.2406
 epoch: 2, train_loss: 1.2360, test_loss: 1.3355, test_f1: 0.2451
 epoch: 3, train_loss: 1.2240, test_loss: 1.3501, test_f1: 0.2693
 epoch: 4, train_loss: 1.2224, test_loss: 1.3350, test_f1: 0.2784
 epoch: 5, train_loss: 1.2087, test_loss: 1.3329, test_f1: 0.2810
 epoch: 6, train_loss: 1.1986, test_loss: 1.3276, test_f1: 0.2970
 epoch: 7, train_loss: 1.1882, test_loss: 1.3432, test_f1: 0.3006
 epoch: 8, train_loss: 1.1845, test_loss: 1.3281, test_f1: 0.3142
 epoch: 9, train_loss: 1.1686, test_loss: 1.3182, test_f1: 0.3482
 epoch: 10, train_loss: 1.1742, test_loss: 1.3226, test_f1: 0.3636
 epoch: 11, train_loss: 1.1553, test_loss: 1.3094, test_f1: 0.3743
 epoch: 12, train_loss: 1.1542, test_loss: 1.3049, test_f1: 0.3780
 epoch: 13, train_loss: 1.1437, test_loss: 1.2938, test_f1: 0.3979
 epoch: 14, train_loss: 1.1383, test_loss: 1.2877, test_f1: 0.3862
 epoch: 15, train_loss: 1.1362, test_loss: 1.3279, test_f1: 0.3850
 epoch: 16, train_loss: 1.1231, test_loss: 1.3107, test_f1: 0.3859
 epoch: 17, train_loss: 1.1322, test_loss: 1.3027, test_f1: 0.3979
 epoch: 18, train_loss: 1.1180, test_loss: 1.3013, test_f1: 0.4001
 epoch: 19, train_loss: 1.1108, test_loss: 1.3168, test_f1: 0.3987
 epoch: 20, train_loss: 1.1077, test_loss: 1.2813, test_f1: 0.3989
 epoch: 21, train_loss: 1.1070, test_loss: 1.2830, test_f1: 0.3969
 epoch: 22, train_loss: 1.1126, test_loss: 1.2764, test_f1: 0.3965
 epoch: 23, train_loss: 1.1085, test_loss: 1.2815, test_f1: 0.4088
 epoch: 24, train_loss: 1.1036, test_loss: 1.2861, test_f1: 0.4139
 epoch: 25, train_loss: 1.0835, test_loss: 1.2731, test_f1: 0.4118
 epoch: 26, train_loss: 1.0876, test_loss: 1.2861, test_f1: 0.4150
 epoch: 27, train_loss: 1.0981, test_loss: 1.2594, test_f1: 0.4142
 epoch: 28, train_loss: 1.0815, test_loss: 1.2834, test_f1: 0.4098
 epoch: 29, train_loss: 1.0891, test_loss: 1.2574, test_f1: 0.4308
 epoch: 30, train_loss: 1.0803, test_loss: 1.2613, test_f1: 0.4224
 epoch: 31, train_loss: 1.0740, test_loss: 1.2929, test_f1: 0.4163
 epoch: 32, train_loss: 1.0730, test_loss: 1.2675, test_f1: 0.4072
 epoch: 33, train_loss: 1.0831, test_loss: 1.2703, test_f1: 0.4208
 epoch: 34, train_loss: 1.0704, test_loss: 1.2810, test_f1: 0.3968
 epoch: 35, train_loss: 1.0674, test_loss: 1.2809, test_f1: 0.4242
 epoch: 36, train_loss: 1.0714, test_loss: 1.2562, test_f1: 0.4111
 epoch: 37, train_loss: 1.0584, test_loss: 1.2575, test_f1: 0.4189
 epoch: 38, train_loss: 1.0547, test_loss: 1.2822, test_f1: 0.4527
 epoch: 39, train_loss: 1.0533, test_loss: 1.2480, test_f1: 0.4336
 epoch: 40, train_loss: 1.0476, test_loss: 1.2818, test_f1: 0.4536
 epoch: 41, train_loss: 1.0399, test_loss: 1.2657, test_f1: 0.4481
 epoch: 42, train_loss: 1.0517, test_loss: 1.2781, test_f1: 0.4362
 epoch: 43, train_loss: 1.0509, test_loss: 1.2652, test_f1: 0.4587
 epoch: 44, train_loss: 1.0421, test_loss: 1.2416, test_f1: 0.4479
 epoch: 45, train_loss: 1.0367, test_loss: 1.2551, test_f1: 0.4584
 epoch: 46, train_loss: 1.0354, test_loss: 1.2610, test_f1: 0.4720
 epoch: 47, train_loss: 1.0292, test_loss: 1.2334, test_f1: 0.4647
 epoch: 48, train_loss: 1.0219, test_loss: 1.2358, test_f1: 0.4694
 epoch: 49, train_loss: 1.0273, test_loss: 1.2671, test_f1: 0.4805
 epoch: 50, train_loss: 1.0319, test_loss: 1.2663, test_f1: 0.4740
 epoch: 51, train_loss: 1.0129, test_loss: 1.2774, test_f1: 0.4661
 epoch: 52, train_loss: 1.0206, test_loss: 1.2412, test_f1: 0.4806
 epoch: 53, train_loss: 1.0265, test_loss: 1.2585, test_f1: 0.4745
 epoch: 54, train_loss: 1.0257, test_loss: 1.2501, test_f1: 0.4797
 epoch: 55, train_loss: 1.0251, test_loss: 1.2368, test_f1: 0.4767
 epoch: 56, train_loss: 1.0225, test_loss: 1.2527, test_f1: 0.4741
 epoch: 57, train_loss: 1.0202, test_loss: 1.2280, test_f1: 0.4853
 epoch: 58, train_loss: 1.0161, test_loss: 1.2403, test_f1: 0.4862
 epoch: 59, train_loss: 1.0212, test_loss: 1.2470, test_f1: 0.4832
 epoch: 60, train_loss: 1.0168, test_loss: 1.2592, test_f1: 0.4799
 epoch: 61, train_loss: 1.0016, test_loss: 1.2334, test_f1: 0.4874
 epoch: 62, train_loss: 1.0127, test_loss: 1.2491, test_f1: 0.4913
 epoch: 63, train_loss: 0.9953, test_loss: 1.2698, test_f1: 0.4885
 epoch: 64, train_loss: 1.0129, test_loss: 1.2535, test_f1: 0.4830
 epoch: 65, train_loss: 1.0034, test_loss: 1.2759, test_f1: 0.4811
 epoch: 66, train_loss: 1.0049, test_loss: 1.2683, test_f1: 0.5078
 epoch: 67, train_loss: 0.9948, test_loss: 1.2735, test_f1: 0.4931
 epoch: 68, train_loss: 1.0103, test_loss: 1.2316, test_f1: 0.4904
 epoch: 69, train_loss: 1.0129, test_loss: 1.2528, test_f1: 0.4967
 epoch: 70, train_loss: 0.9979, test_loss: 1.2533, test_f1: 0.4939
 epoch: 71, train_loss: 1.0108, test_loss: 1.2483, test_f1: 0.5089
 epoch: 72, train_loss: 0.9986, test_loss: 1.2677, test_f1: 0.4993
 epoch: 73, train_loss: 0.9991, test_loss: 1.2682, test_f1: 0.4845
 epoch: 74, train_loss: 0.9977, test_loss: 1.2490, test_f1: 0.5106
 epoch: 75, train_loss: 0.9992, test_loss: 1.2597, test_f1: 0.4963
 epoch: 76, train_loss: 0.9878, test_loss: 1.2835, test_f1: 0.4946
 epoch: 77, train_loss: 0.9913, test_loss: 1.2641, test_f1: 0.5046
 epoch: 78, train_loss: 0.9932, test_loss: 1.2371, test_f1: 0.5085
 epoch: 79, train_loss: 0.9977, test_loss: 1.2665, test_f1: 0.4881
 epoch: 80, train_loss: 0.9946, test_loss: 1.2643, test_f1: 0.5046
 epoch: 81, train_loss: 0.9921, test_loss: 1.2578, test_f1: 0.5051
 epoch: 82, train_loss: 0.9810, test_loss: 1.2749, test_f1: 0.5022
 epoch: 83, train_loss: 0.9888, test_loss: 1.2789, test_f1: 0.5100
 epoch: 84, train_loss: 0.9835, test_loss: 1.2721, test_f1: 0.5151
 epoch: 85, train_loss: 0.9814, test_loss: 1.2883, test_f1: 0.4767
 epoch: 86, train_loss: 0.9758, test_loss: 1.2759, test_f1: 0.4836
 epoch: 87, train_loss: 0.9770, test_loss: 1.2276, test_f1: 0.5145
 epoch: 88, train_loss: 0.9822, test_loss: 1.2582, test_f1: 0.5132
 epoch: 89, train_loss: 0.9697, test_loss: 1.2868, test_f1: 0.5002
 epoch: 90, train_loss: 0.9961, test_loss: 1.2518, test_f1: 0.4792
 epoch: 91, train_loss: 0.9751, test_loss: 1.2947, test_f1: 0.4696
 epoch: 92, train_loss: 0.9738, test_loss: 1.2728, test_f1: 0.4882
 epoch: 93, train_loss: 0.9824, test_loss: 1.2585, test_f1: 0.5158
 epoch: 94, train_loss: 0.9861, test_loss: 1.2845, test_f1: 0.5084
 epoch: 95, train_loss: 0.9586, test_loss: 1.2944, test_f1: 0.4958
 epoch: 96, train_loss: 0.9670, test_loss: 1.2561, test_f1: 0.5129
 epoch: 97, train_loss: 0.9770, test_loss: 1.2472, test_f1: 0.4882
 epoch: 98, train_loss: 0.9675, test_loss: 1.2877, test_f1: 0.4892
 epoch: 99, train_loss: 0.9798, test_loss: 1.2394, test_f1: 0.5156
##################ITERATION #5 ****************************************
 epoch: 0, train_loss: 1.3052, test_loss: 1.3515, test_f1: 0.2561
 epoch: 1, train_loss: 1.2755, test_loss: 1.3259, test_f1: 0.2611
 epoch: 2, train_loss: 1.2492, test_loss: 1.3245, test_f1: 0.2913
 epoch: 3, train_loss: 1.2340, test_loss: 1.3289, test_f1: 0.3425
 epoch: 4, train_loss: 1.2432, test_loss: 1.3191, test_f1: 0.3368
 epoch: 5, train_loss: 1.2342, test_loss: 1.3175, test_f1: 0.3495
 epoch: 6, train_loss: 1.2086, test_loss: 1.3206, test_f1: 0.3435
 epoch: 7, train_loss: 1.2052, test_loss: 1.3132, test_f1: 0.3480
 epoch: 8, train_loss: 1.2009, test_loss: 1.2994, test_f1: 0.3426
 epoch: 9, train_loss: 1.1954, test_loss: 1.3017, test_f1: 0.3440
 epoch: 10, train_loss: 1.1873, test_loss: 1.2902, test_f1: 0.3620
 epoch: 11, train_loss: 1.1833, test_loss: 1.2922, test_f1: 0.3697
 epoch: 12, train_loss: 1.1808, test_loss: 1.2885, test_f1: 0.3737
 epoch: 13, train_loss: 1.1525, test_loss: 1.2726, test_f1: 0.4035
 epoch: 14, train_loss: 1.1499, test_loss: 1.2849, test_f1: 0.3992
 epoch: 15, train_loss: 1.1506, test_loss: 1.2770, test_f1: 0.4098
 epoch: 16, train_loss: 1.1503, test_loss: 1.2731, test_f1: 0.4285
 epoch: 17, train_loss: 1.1485, test_loss: 1.2511, test_f1: 0.4381
 epoch: 18, train_loss: 1.1353, test_loss: 1.2474, test_f1: 0.4420
 epoch: 19, train_loss: 1.1328, test_loss: 1.2342, test_f1: 0.4397
 epoch: 20, train_loss: 1.1280, test_loss: 1.2343, test_f1: 0.4438
 epoch: 21, train_loss: 1.1134, test_loss: 1.2283, test_f1: 0.4239
 epoch: 22, train_loss: 1.1104, test_loss: 1.2231, test_f1: 0.4355
 epoch: 23, train_loss: 1.1016, test_loss: 1.2284, test_f1: 0.4428
 epoch: 24, train_loss: 1.1000, test_loss: 1.2246, test_f1: 0.4370
 epoch: 25, train_loss: 1.0949, test_loss: 1.2180, test_f1: 0.4440
 epoch: 26, train_loss: 1.0943, test_loss: 1.2104, test_f1: 0.4512
 epoch: 27, train_loss: 1.0879, test_loss: 1.2301, test_f1: 0.4528
 epoch: 28, train_loss: 1.0805, test_loss: 1.2087, test_f1: 0.4374
 epoch: 29, train_loss: 1.0904, test_loss: 1.2165, test_f1: 0.4466
 epoch: 30, train_loss: 1.0670, test_loss: 1.2138, test_f1: 0.4564
 epoch: 31, train_loss: 1.0610, test_loss: 1.2264, test_f1: 0.4448
 epoch: 32, train_loss: 1.0670, test_loss: 1.2187, test_f1: 0.4490
 epoch: 33, train_loss: 1.0746, test_loss: 1.2096, test_f1: 0.4439
 epoch: 34, train_loss: 1.0784, test_loss: 1.2289, test_f1: 0.4522
 epoch: 35, train_loss: 1.0575, test_loss: 1.2502, test_f1: 0.4513
 epoch: 36, train_loss: 1.0483, test_loss: 1.2422, test_f1: 0.4558
 epoch: 37, train_loss: 1.0521, test_loss: 1.2405, test_f1: 0.4327
 epoch: 38, train_loss: 1.0554, test_loss: 1.2438, test_f1: 0.4526
 epoch: 39, train_loss: 1.0606, test_loss: 1.2554, test_f1: 0.4342
 epoch: 40, train_loss: 1.0380, test_loss: 1.2473, test_f1: 0.4489
 epoch: 41, train_loss: 1.0368, test_loss: 1.2265, test_f1: 0.4517
 epoch: 42, train_loss: 1.0357, test_loss: 1.2230, test_f1: 0.4641
 epoch: 43, train_loss: 1.0417, test_loss: 1.2301, test_f1: 0.4531
 epoch: 44, train_loss: 1.0347, test_loss: 1.2239, test_f1: 0.4526
 epoch: 45, train_loss: 1.0232, test_loss: 1.2328, test_f1: 0.4510
 epoch: 46, train_loss: 1.0278, test_loss: 1.2377, test_f1: 0.4594
 epoch: 47, train_loss: 1.0308, test_loss: 1.2350, test_f1: 0.4359
 epoch: 48, train_loss: 1.0216, test_loss: 1.2420, test_f1: 0.4243
 epoch: 49, train_loss: 1.0152, test_loss: 1.2170, test_f1: 0.4190
 epoch: 50, train_loss: 1.0171, test_loss: 1.2492, test_f1: 0.4350
 epoch: 51, train_loss: 1.0088, test_loss: 1.2286, test_f1: 0.4327
 epoch: 52, train_loss: 1.0142, test_loss: 1.2397, test_f1: 0.4329
 epoch: 53, train_loss: 1.0228, test_loss: 1.2391, test_f1: 0.4324
 epoch: 54, train_loss: 1.0044, test_loss: 1.2394, test_f1: 0.4158
 epoch: 55, train_loss: 1.0113, test_loss: 1.2889, test_f1: 0.4141
 epoch: 56, train_loss: 1.0146, test_loss: 1.2746, test_f1: 0.4300
 epoch: 57, train_loss: 0.9995, test_loss: 1.2603, test_f1: 0.4322
 epoch: 58, train_loss: 1.0005, test_loss: 1.2543, test_f1: 0.4336
 epoch: 59, train_loss: 1.0116, test_loss: 1.2764, test_f1: 0.4433
 epoch: 60, train_loss: 1.0112, test_loss: 1.2530, test_f1: 0.4338
 epoch: 61, train_loss: 0.9925, test_loss: 1.2708, test_f1: 0.4403
 epoch: 62, train_loss: 0.9986, test_loss: 1.2752, test_f1: 0.4347
 epoch: 63, train_loss: 1.0025, test_loss: 1.2493, test_f1: 0.4325
 epoch: 64, train_loss: 0.9912, test_loss: 1.3299, test_f1: 0.4383
 epoch: 65, train_loss: 1.0140, test_loss: 1.2638, test_f1: 0.4435
 epoch: 66, train_loss: 0.9947, test_loss: 1.2645, test_f1: 0.4432
 epoch: 67, train_loss: 0.9938, test_loss: 1.2544, test_f1: 0.4333
 epoch: 68, train_loss: 0.9770, test_loss: 1.2492, test_f1: 0.4512
 epoch: 69, train_loss: 1.0087, test_loss: 1.2461, test_f1: 0.4408
 epoch: 70, train_loss: 0.9783, test_loss: 1.2814, test_f1: 0.4499
 epoch: 71, train_loss: 0.9895, test_loss: 1.2699, test_f1: 0.4409
 epoch: 72, train_loss: 0.9869, test_loss: 1.2844, test_f1: 0.4431
 epoch: 73, train_loss: 0.9783, test_loss: 1.2947, test_f1: 0.4660
 epoch: 74, train_loss: 0.9904, test_loss: 1.2927, test_f1: 0.4611
 epoch: 75, train_loss: 0.9796, test_loss: 1.2729, test_f1: 0.4491
 epoch: 76, train_loss: 0.9839, test_loss: 1.2918, test_f1: 0.4400
 epoch: 77, train_loss: 0.9775, test_loss: 1.2594, test_f1: 0.4580
 epoch: 78, train_loss: 0.9949, test_loss: 1.2669, test_f1: 0.4618
 epoch: 79, train_loss: 0.9852, test_loss: 1.2660, test_f1: 0.4468
 epoch: 80, train_loss: 0.9894, test_loss: 1.2552, test_f1: 0.4543
 epoch: 81, train_loss: 0.9850, test_loss: 1.2803, test_f1: 0.4586
 epoch: 82, train_loss: 0.9787, test_loss: 1.2732, test_f1: 0.4672
 epoch: 83, train_loss: 0.9800, test_loss: 1.2539, test_f1: 0.4435
 epoch: 84, train_loss: 0.9835, test_loss: 1.2712, test_f1: 0.4691
 epoch: 85, train_loss: 0.9836, test_loss: 1.3074, test_f1: 0.4717
 epoch: 86, train_loss: 0.9826, test_loss: 1.3190, test_f1: 0.4603
 epoch: 87, train_loss: 0.9715, test_loss: 1.2853, test_f1: 0.4566
 epoch: 88, train_loss: 0.9838, test_loss: 1.2852, test_f1: 0.4629
 epoch: 89, train_loss: 0.9751, test_loss: 1.3032, test_f1: 0.4507
 epoch: 90, train_loss: 0.9819, test_loss: 1.2939, test_f1: 0.4632
 epoch: 91, train_loss: 0.9620, test_loss: 1.2809, test_f1: 0.4561
 epoch: 92, train_loss: 0.9845, test_loss: 1.2816, test_f1: 0.4681
 epoch: 93, train_loss: 0.9652, test_loss: 1.2900, test_f1: 0.4713
 epoch: 94, train_loss: 0.9622, test_loss: 1.2922, test_f1: 0.4613
 epoch: 95, train_loss: 0.9652, test_loss: 1.2792, test_f1: 0.4578
 epoch: 96, train_loss: 0.9627, test_loss: 1.3175, test_f1: 0.4637
 epoch: 97, train_loss: 0.9605, test_loss: 1.2655, test_f1: 0.4641
 epoch: 98, train_loss: 0.9567, test_loss: 1.3038, test_f1: 0.4470
 epoch: 99, train_loss: 0.9609, test_loss: 1.2984, test_f1: 0.4618
##################ITERATION #6 ****************************************
 epoch: 0, train_loss: 1.2574, test_loss: 1.3041, test_f1: 0.2496
 epoch: 1, train_loss: 1.2265, test_loss: 1.3179, test_f1: 0.2807
 epoch: 2, train_loss: 1.2235, test_loss: 1.3400, test_f1: 0.3148
 epoch: 3, train_loss: 1.2096, test_loss: 1.3355, test_f1: 0.3141
 epoch: 4, train_loss: 1.2059, test_loss: 1.3338, test_f1: 0.3388
 epoch: 5, train_loss: 1.1941, test_loss: 1.3203, test_f1: 0.3524
 epoch: 6, train_loss: 1.1867, test_loss: 1.3081, test_f1: 0.3584
 epoch: 7, train_loss: 1.1834, test_loss: 1.3336, test_f1: 0.3569
 epoch: 8, train_loss: 1.1764, test_loss: 1.2753, test_f1: 0.3705
 epoch: 9, train_loss: 1.1621, test_loss: 1.2796, test_f1: 0.3733
 epoch: 10, train_loss: 1.1638, test_loss: 1.2968, test_f1: 0.3844
 epoch: 11, train_loss: 1.1500, test_loss: 1.2683, test_f1: 0.3829
 epoch: 12, train_loss: 1.1517, test_loss: 1.2701, test_f1: 0.3647
 epoch: 13, train_loss: 1.1442, test_loss: 1.2481, test_f1: 0.3681
 epoch: 14, train_loss: 1.1368, test_loss: 1.2699, test_f1: 0.4141
 epoch: 15, train_loss: 1.1335, test_loss: 1.2438, test_f1: 0.3876
 epoch: 16, train_loss: 1.1225, test_loss: 1.2457, test_f1: 0.3748
 epoch: 17, train_loss: 1.1293, test_loss: 1.2468, test_f1: 0.3902
 epoch: 18, train_loss: 1.1171, test_loss: 1.2235, test_f1: 0.4002
 epoch: 19, train_loss: 1.1099, test_loss: 1.2250, test_f1: 0.4170
 epoch: 20, train_loss: 1.1176, test_loss: 1.2294, test_f1: 0.4101
 epoch: 21, train_loss: 1.1049, test_loss: 1.2055, test_f1: 0.3751
 epoch: 22, train_loss: 1.1153, test_loss: 1.1991, test_f1: 0.3775
 epoch: 23, train_loss: 1.1075, test_loss: 1.1993, test_f1: 0.3875
 epoch: 24, train_loss: 1.1061, test_loss: 1.2052, test_f1: 0.4123
 epoch: 25, train_loss: 1.1009, test_loss: 1.2084, test_f1: 0.4140
 epoch: 26, train_loss: 1.1032, test_loss: 1.2306, test_f1: 0.4132
 epoch: 27, train_loss: 1.0820, test_loss: 1.2101, test_f1: 0.3941
 epoch: 28, train_loss: 1.0792, test_loss: 1.2058, test_f1: 0.4126
 epoch: 29, train_loss: 1.0793, test_loss: 1.1991, test_f1: 0.4006
 epoch: 30, train_loss: 1.0775, test_loss: 1.2005, test_f1: 0.4236
 epoch: 31, train_loss: 1.0768, test_loss: 1.2011, test_f1: 0.4277
 epoch: 32, train_loss: 1.0801, test_loss: 1.2011, test_f1: 0.4236
 epoch: 33, train_loss: 1.0698, test_loss: 1.1978, test_f1: 0.4226
 epoch: 34, train_loss: 1.0699, test_loss: 1.2003, test_f1: 0.4022
 epoch: 35, train_loss: 1.0759, test_loss: 1.1940, test_f1: 0.4149
 epoch: 36, train_loss: 1.0740, test_loss: 1.1916, test_f1: 0.3873
 epoch: 37, train_loss: 1.0631, test_loss: 1.2022, test_f1: 0.4281
 epoch: 38, train_loss: 1.0731, test_loss: 1.1882, test_f1: 0.4360
 epoch: 39, train_loss: 1.0718, test_loss: 1.1977, test_f1: 0.4280
 epoch: 40, train_loss: 1.0546, test_loss: 1.1818, test_f1: 0.4194
 epoch: 41, train_loss: 1.0674, test_loss: 1.1751, test_f1: 0.4423
 epoch: 42, train_loss: 1.0469, test_loss: 1.1904, test_f1: 0.4235
 epoch: 43, train_loss: 1.0628, test_loss: 1.1922, test_f1: 0.4266
 epoch: 44, train_loss: 1.0623, test_loss: 1.1833, test_f1: 0.4173
 epoch: 45, train_loss: 1.0503, test_loss: 1.1885, test_f1: 0.4341
 epoch: 46, train_loss: 1.0417, test_loss: 1.1879, test_f1: 0.4464
 epoch: 47, train_loss: 1.0359, test_loss: 1.2053, test_f1: 0.4344
 epoch: 48, train_loss: 1.0504, test_loss: 1.1937, test_f1: 0.4370
 epoch: 49, train_loss: 1.0390, test_loss: 1.2087, test_f1: 0.4394
 epoch: 50, train_loss: 1.0272, test_loss: 1.1966, test_f1: 0.4269
 epoch: 51, train_loss: 1.0238, test_loss: 1.1910, test_f1: 0.4260
 epoch: 52, train_loss: 1.0289, test_loss: 1.1889, test_f1: 0.4276
 epoch: 53, train_loss: 1.0376, test_loss: 1.1927, test_f1: 0.4275
 epoch: 54, train_loss: 1.0435, test_loss: 1.1928, test_f1: 0.4232
 epoch: 55, train_loss: 1.0269, test_loss: 1.2096, test_f1: 0.4311
 epoch: 56, train_loss: 1.0220, test_loss: 1.1877, test_f1: 0.4370
 epoch: 57, train_loss: 1.0241, test_loss: 1.2007, test_f1: 0.4190
 epoch: 58, train_loss: 1.0143, test_loss: 1.1985, test_f1: 0.4425
 epoch: 59, train_loss: 1.0163, test_loss: 1.2007, test_f1: 0.4380
 epoch: 60, train_loss: 1.0154, test_loss: 1.1921, test_f1: 0.4415
 epoch: 61, train_loss: 1.0167, test_loss: 1.2101, test_f1: 0.4470
 epoch: 62, train_loss: 1.0256, test_loss: 1.2032, test_f1: 0.4326
 epoch: 63, train_loss: 1.0260, test_loss: 1.1944, test_f1: 0.4373
 epoch: 64, train_loss: 1.0193, test_loss: 1.1954, test_f1: 0.4240
 epoch: 65, train_loss: 1.0170, test_loss: 1.2065, test_f1: 0.4364
 epoch: 66, train_loss: 1.0333, test_loss: 1.1968, test_f1: 0.4346
 epoch: 67, train_loss: 1.0205, test_loss: 1.2019, test_f1: 0.4360
 epoch: 68, train_loss: 1.0073, test_loss: 1.1917, test_f1: 0.4261
 epoch: 69, train_loss: 1.0215, test_loss: 1.1889, test_f1: 0.4298
 epoch: 70, train_loss: 1.0134, test_loss: 1.2022, test_f1: 0.4392
 epoch: 71, train_loss: 1.0143, test_loss: 1.1939, test_f1: 0.4408
 epoch: 72, train_loss: 1.0028, test_loss: 1.2017, test_f1: 0.4433
 epoch: 73, train_loss: 1.0043, test_loss: 1.2073, test_f1: 0.4263
 epoch: 74, train_loss: 1.0183, test_loss: 1.2046, test_f1: 0.4412
 epoch: 75, train_loss: 1.0102, test_loss: 1.1981, test_f1: 0.4328
 epoch: 76, train_loss: 1.0144, test_loss: 1.2032, test_f1: 0.4320
 epoch: 77, train_loss: 1.0015, test_loss: 1.1931, test_f1: 0.4373
 epoch: 78, train_loss: 1.0087, test_loss: 1.2104, test_f1: 0.4440
 epoch: 79, train_loss: 0.9951, test_loss: 1.2153, test_f1: 0.4428
 epoch: 80, train_loss: 1.0209, test_loss: 1.2508, test_f1: 0.4237
 epoch: 81, train_loss: 1.0037, test_loss: 1.2101, test_f1: 0.4536
 epoch: 82, train_loss: 1.0094, test_loss: 1.1859, test_f1: 0.4564
 epoch: 83, train_loss: 0.9922, test_loss: 1.2025, test_f1: 0.4466
 epoch: 84, train_loss: 1.0227, test_loss: 1.2078, test_f1: 0.4460
 epoch: 85, train_loss: 1.0065, test_loss: 1.2033, test_f1: 0.4458
 epoch: 86, train_loss: 1.0058, test_loss: 1.1976, test_f1: 0.4287
 epoch: 87, train_loss: 0.9970, test_loss: 1.2000, test_f1: 0.4445
 epoch: 88, train_loss: 0.9871, test_loss: 1.1956, test_f1: 0.4392
 epoch: 89, train_loss: 0.9913, test_loss: 1.2028, test_f1: 0.4502
 epoch: 90, train_loss: 0.9817, test_loss: 1.2198, test_f1: 0.4480
 epoch: 91, train_loss: 0.9928, test_loss: 1.2077, test_f1: 0.4518
 epoch: 92, train_loss: 1.0070, test_loss: 1.2152, test_f1: 0.4563
 epoch: 93, train_loss: 0.9928, test_loss: 1.2199, test_f1: 0.4537
 epoch: 94, train_loss: 0.9954, test_loss: 1.2154, test_f1: 0.4511
 epoch: 95, train_loss: 1.0000, test_loss: 1.2150, test_f1: 0.4401
 epoch: 96, train_loss: 0.9943, test_loss: 1.2213, test_f1: 0.4600
 epoch: 97, train_loss: 0.9892, test_loss: 1.2374, test_f1: 0.4529
 epoch: 98, train_loss: 0.9825, test_loss: 1.2284, test_f1: 0.4488
 epoch: 99, train_loss: 0.9970, test_loss: 1.2241, test_f1: 0.4506
##################ITERATION #7 ****************************************
 epoch: 0, train_loss: 1.2804, test_loss: 1.3884, test_f1: 0.2404
 epoch: 1, train_loss: 1.2438, test_loss: 1.3922, test_f1: 0.2646
 epoch: 2, train_loss: 1.2345, test_loss: 1.3837, test_f1: 0.2580
 epoch: 3, train_loss: 1.2191, test_loss: 1.3772, test_f1: 0.2682
 epoch: 4, train_loss: 1.2038, test_loss: 1.3705, test_f1: 0.2771
 epoch: 5, train_loss: 1.2012, test_loss: 1.3670, test_f1: 0.2881
 epoch: 6, train_loss: 1.1920, test_loss: 1.3629, test_f1: 0.3261
 epoch: 7, train_loss: 1.1830, test_loss: 1.3352, test_f1: 0.3404
 epoch: 8, train_loss: 1.1678, test_loss: 1.3512, test_f1: 0.3662
 epoch: 9, train_loss: 1.1577, test_loss: 1.3338, test_f1: 0.3761
 epoch: 10, train_loss: 1.1540, test_loss: 1.3133, test_f1: 0.3798
 epoch: 11, train_loss: 1.1465, test_loss: 1.3323, test_f1: 0.3841
 epoch: 12, train_loss: 1.1428, test_loss: 1.3067, test_f1: 0.3857
 epoch: 13, train_loss: 1.1458, test_loss: 1.3250, test_f1: 0.3840
 epoch: 14, train_loss: 1.1415, test_loss: 1.3235, test_f1: 0.3757
 epoch: 15, train_loss: 1.1301, test_loss: 1.3075, test_f1: 0.4062
 epoch: 16, train_loss: 1.1359, test_loss: 1.3103, test_f1: 0.3955
 epoch: 17, train_loss: 1.1310, test_loss: 1.3130, test_f1: 0.3988
 epoch: 18, train_loss: 1.1284, test_loss: 1.3007, test_f1: 0.4044
 epoch: 19, train_loss: 1.1143, test_loss: 1.3681, test_f1: 0.4046
 epoch: 20, train_loss: 1.1178, test_loss: 1.3072, test_f1: 0.4170
 epoch: 21, train_loss: 1.1102, test_loss: 1.3365, test_f1: 0.4141
 epoch: 22, train_loss: 1.1157, test_loss: 1.3149, test_f1: 0.4033
 epoch: 23, train_loss: 1.1002, test_loss: 1.3117, test_f1: 0.4161
 epoch: 24, train_loss: 1.0980, test_loss: 1.3096, test_f1: 0.4074
 epoch: 25, train_loss: 1.0988, test_loss: 1.2978, test_f1: 0.4162
 epoch: 26, train_loss: 1.0865, test_loss: 1.2686, test_f1: 0.4253
 epoch: 27, train_loss: 1.0796, test_loss: 1.2866, test_f1: 0.4262
 epoch: 28, train_loss: 1.0841, test_loss: 1.2800, test_f1: 0.4198
 epoch: 29, train_loss: 1.0763, test_loss: 1.3124, test_f1: 0.4222
 epoch: 30, train_loss: 1.0641, test_loss: 1.2850, test_f1: 0.4268
 epoch: 31, train_loss: 1.0805, test_loss: 1.3109, test_f1: 0.4347
 epoch: 32, train_loss: 1.0714, test_loss: 1.2740, test_f1: 0.4284
 epoch: 33, train_loss: 1.0622, test_loss: 1.2725, test_f1: 0.4269
 epoch: 34, train_loss: 1.0563, test_loss: 1.2872, test_f1: 0.4296
 epoch: 35, train_loss: 1.0531, test_loss: 1.2738, test_f1: 0.4351
 epoch: 36, train_loss: 1.0526, test_loss: 1.3029, test_f1: 0.4239
 epoch: 37, train_loss: 1.0573, test_loss: 1.3227, test_f1: 0.4308
 epoch: 38, train_loss: 1.0476, test_loss: 1.2915, test_f1: 0.4368
 epoch: 39, train_loss: 1.0404, test_loss: 1.2623, test_f1: 0.4352
 epoch: 40, train_loss: 1.0447, test_loss: 1.2859, test_f1: 0.4368
 epoch: 41, train_loss: 1.0371, test_loss: 1.2864, test_f1: 0.4328
 epoch: 42, train_loss: 1.0290, test_loss: 1.2697, test_f1: 0.4338
 epoch: 43, train_loss: 1.0274, test_loss: 1.2635, test_f1: 0.4246
 epoch: 44, train_loss: 1.0282, test_loss: 1.2807, test_f1: 0.4378
 epoch: 45, train_loss: 1.0266, test_loss: 1.2825, test_f1: 0.4420
 epoch: 46, train_loss: 1.0312, test_loss: 1.3220, test_f1: 0.4572
 epoch: 47, train_loss: 1.0212, test_loss: 1.2983, test_f1: 0.4596
 epoch: 48, train_loss: 1.0276, test_loss: 1.3188, test_f1: 0.4585
 epoch: 49, train_loss: 1.0049, test_loss: 1.3059, test_f1: 0.4619
 epoch: 50, train_loss: 1.0217, test_loss: 1.2920, test_f1: 0.4582
 epoch: 51, train_loss: 1.0125, test_loss: 1.3142, test_f1: 0.4650
 epoch: 52, train_loss: 1.0261, test_loss: 1.2806, test_f1: 0.4617
 epoch: 53, train_loss: 1.0056, test_loss: 1.2869, test_f1: 0.4738
 epoch: 54, train_loss: 1.0112, test_loss: 1.2728, test_f1: 0.4699
 epoch: 55, train_loss: 1.0127, test_loss: 1.2719, test_f1: 0.4697
 epoch: 56, train_loss: 1.0180, test_loss: 1.2917, test_f1: 0.4685
 epoch: 57, train_loss: 1.0110, test_loss: 1.2824, test_f1: 0.4637
 epoch: 58, train_loss: 1.0097, test_loss: 1.2808, test_f1: 0.4673
 epoch: 59, train_loss: 1.0053, test_loss: 1.3027, test_f1: 0.4669
 epoch: 60, train_loss: 1.0156, test_loss: 1.2906, test_f1: 0.4632
 epoch: 61, train_loss: 0.9879, test_loss: 1.2569, test_f1: 0.4542
 epoch: 62, train_loss: 1.0157, test_loss: 1.2708, test_f1: 0.4669
 epoch: 63, train_loss: 1.0001, test_loss: 1.2589, test_f1: 0.4672
 epoch: 64, train_loss: 1.0075, test_loss: 1.2821, test_f1: 0.4852
 epoch: 65, train_loss: 0.9927, test_loss: 1.2328, test_f1: 0.4672
 epoch: 66, train_loss: 0.9955, test_loss: 1.2525, test_f1: 0.4881
 epoch: 67, train_loss: 0.9879, test_loss: 1.2405, test_f1: 0.4793
 epoch: 68, train_loss: 0.9906, test_loss: 1.2351, test_f1: 0.4886
 epoch: 69, train_loss: 0.9861, test_loss: 1.2584, test_f1: 0.4814
 epoch: 70, train_loss: 1.0016, test_loss: 1.2384, test_f1: 0.5064
 epoch: 71, train_loss: 0.9977, test_loss: 1.2525, test_f1: 0.4709
 epoch: 72, train_loss: 0.9883, test_loss: 1.2459, test_f1: 0.4725
 epoch: 73, train_loss: 0.9815, test_loss: 1.2413, test_f1: 0.5017
 epoch: 74, train_loss: 0.9753, test_loss: 1.2616, test_f1: 0.4841
 epoch: 75, train_loss: 0.9863, test_loss: 1.2348, test_f1: 0.4845
 epoch: 76, train_loss: 0.9764, test_loss: 1.2235, test_f1: 0.4895
 epoch: 77, train_loss: 0.9887, test_loss: 1.2250, test_f1: 0.4999
 epoch: 78, train_loss: 0.9824, test_loss: 1.2619, test_f1: 0.4664
 epoch: 79, train_loss: 0.9682, test_loss: 1.2429, test_f1: 0.4712
 epoch: 80, train_loss: 0.9805, test_loss: 1.2430, test_f1: 0.4861
 epoch: 81, train_loss: 0.9752, test_loss: 1.2840, test_f1: 0.4864
 epoch: 82, train_loss: 0.9906, test_loss: 1.2818, test_f1: 0.4738
 epoch: 83, train_loss: 0.9750, test_loss: 1.2546, test_f1: 0.4933
 epoch: 84, train_loss: 0.9709, test_loss: 1.2498, test_f1: 0.4869
 epoch: 85, train_loss: 0.9816, test_loss: 1.2618, test_f1: 0.4981
 epoch: 86, train_loss: 0.9643, test_loss: 1.2374, test_f1: 0.4876
 epoch: 87, train_loss: 0.9743, test_loss: 1.2495, test_f1: 0.5099
 epoch: 88, train_loss: 0.9659, test_loss: 1.2569, test_f1: 0.4979
 epoch: 89, train_loss: 0.9645, test_loss: 1.2653, test_f1: 0.4908
 epoch: 90, train_loss: 0.9618, test_loss: 1.2747, test_f1: 0.4914
 epoch: 91, train_loss: 0.9766, test_loss: 1.3342, test_f1: 0.4707
 epoch: 92, train_loss: 0.9794, test_loss: 1.2982, test_f1: 0.4883
 epoch: 93, train_loss: 0.9592, test_loss: 1.2731, test_f1: 0.4847
 epoch: 94, train_loss: 0.9549, test_loss: 1.2458, test_f1: 0.4963
 epoch: 95, train_loss: 0.9640, test_loss: 1.2507, test_f1: 0.5147
 epoch: 96, train_loss: 0.9576, test_loss: 1.2373, test_f1: 0.5081
 epoch: 97, train_loss: 0.9682, test_loss: 1.2435, test_f1: 0.5012
 epoch: 98, train_loss: 0.9538, test_loss: 1.2428, test_f1: 0.5031
 epoch: 99, train_loss: 0.9601, test_loss: 1.2526, test_f1: 0.5275
##################ITERATION #8 ****************************************
 epoch: 0, train_loss: 1.2857, test_loss: 1.3083, test_f1: 0.2281
 epoch: 1, train_loss: 1.2461, test_loss: 1.3107, test_f1: 0.2544
 epoch: 2, train_loss: 1.2334, test_loss: 1.3154, test_f1: 0.2621
 epoch: 3, train_loss: 1.2203, test_loss: 1.3001, test_f1: 0.3041
 epoch: 4, train_loss: 1.2111, test_loss: 1.2963, test_f1: 0.3387
 epoch: 5, train_loss: 1.2030, test_loss: 1.3090, test_f1: 0.3594
 epoch: 6, train_loss: 1.1913, test_loss: 1.3035, test_f1: 0.3764
 epoch: 7, train_loss: 1.1800, test_loss: 1.3091, test_f1: 0.3975
 epoch: 8, train_loss: 1.1827, test_loss: 1.2981, test_f1: 0.3979
 epoch: 9, train_loss: 1.1764, test_loss: 1.3019, test_f1: 0.3736
 epoch: 10, train_loss: 1.1711, test_loss: 1.3086, test_f1: 0.3820
 epoch: 11, train_loss: 1.1563, test_loss: 1.3120, test_f1: 0.3977
 epoch: 12, train_loss: 1.1647, test_loss: 1.2902, test_f1: 0.3744
 epoch: 13, train_loss: 1.1549, test_loss: 1.2986, test_f1: 0.3977
 epoch: 14, train_loss: 1.1490, test_loss: 1.3041, test_f1: 0.4041
 epoch: 15, train_loss: 1.1513, test_loss: 1.2774, test_f1: 0.4079
 epoch: 16, train_loss: 1.1396, test_loss: 1.2901, test_f1: 0.4235
 epoch: 17, train_loss: 1.1339, test_loss: 1.2814, test_f1: 0.4185
 epoch: 18, train_loss: 1.1283, test_loss: 1.2796, test_f1: 0.4111
 epoch: 19, train_loss: 1.1238, test_loss: 1.2755, test_f1: 0.4144
 epoch: 20, train_loss: 1.1204, test_loss: 1.2723, test_f1: 0.4248
 epoch: 21, train_loss: 1.1247, test_loss: 1.2793, test_f1: 0.4315
 epoch: 22, train_loss: 1.1107, test_loss: 1.2789, test_f1: 0.4218
 epoch: 23, train_loss: 1.1125, test_loss: 1.2789, test_f1: 0.4298
 epoch: 24, train_loss: 1.1152, test_loss: 1.2810, test_f1: 0.4359
 epoch: 25, train_loss: 1.0999, test_loss: 1.2868, test_f1: 0.4348
 epoch: 26, train_loss: 1.1015, test_loss: 1.2762, test_f1: 0.4366
 epoch: 27, train_loss: 1.1014, test_loss: 1.2871, test_f1: 0.4401
 epoch: 28, train_loss: 1.0982, test_loss: 1.2831, test_f1: 0.4452
 epoch: 29, train_loss: 1.0891, test_loss: 1.2823, test_f1: 0.4523
 epoch: 30, train_loss: 1.0798, test_loss: 1.2862, test_f1: 0.4488
 epoch: 31, train_loss: 1.0893, test_loss: 1.2628, test_f1: 0.4589
 epoch: 32, train_loss: 1.0991, test_loss: 1.2739, test_f1: 0.4641
 epoch: 33, train_loss: 1.0947, test_loss: 1.2747, test_f1: 0.4670
 epoch: 34, train_loss: 1.0862, test_loss: 1.2718, test_f1: 0.4544
 epoch: 35, train_loss: 1.0670, test_loss: 1.2818, test_f1: 0.4665
 epoch: 36, train_loss: 1.0599, test_loss: 1.2860, test_f1: 0.4789
 epoch: 37, train_loss: 1.0700, test_loss: 1.3024, test_f1: 0.4479
 epoch: 38, train_loss: 1.0596, test_loss: 1.2863, test_f1: 0.4791
 epoch: 39, train_loss: 1.0627, test_loss: 1.2924, test_f1: 0.4772
 epoch: 40, train_loss: 1.0688, test_loss: 1.2959, test_f1: 0.4771
 epoch: 41, train_loss: 1.0593, test_loss: 1.2876, test_f1: 0.4710
 epoch: 42, train_loss: 1.0682, test_loss: 1.2938, test_f1: 0.4941
 epoch: 43, train_loss: 1.0576, test_loss: 1.2996, test_f1: 0.4775
 epoch: 44, train_loss: 1.0598, test_loss: 1.2887, test_f1: 0.4901
 epoch: 45, train_loss: 1.0431, test_loss: 1.2960, test_f1: 0.5109
 epoch: 46, train_loss: 1.0404, test_loss: 1.2907, test_f1: 0.5015
 epoch: 47, train_loss: 1.0333, test_loss: 1.2863, test_f1: 0.5039
 epoch: 48, train_loss: 1.0415, test_loss: 1.2959, test_f1: 0.5124
 epoch: 49, train_loss: 1.0444, test_loss: 1.3152, test_f1: 0.5271
 epoch: 50, train_loss: 1.0349, test_loss: 1.2924, test_f1: 0.4850
 epoch: 51, train_loss: 1.0303, test_loss: 1.2949, test_f1: 0.5278
 epoch: 52, train_loss: 1.0317, test_loss: 1.3011, test_f1: 0.5197
 epoch: 53, train_loss: 1.0281, test_loss: 1.2977, test_f1: 0.4892
 epoch: 54, train_loss: 1.0324, test_loss: 1.2901, test_f1: 0.5007
 epoch: 55, train_loss: 1.0339, test_loss: 1.2892, test_f1: 0.5096
 epoch: 56, train_loss: 1.0275, test_loss: 1.3029, test_f1: 0.4912
 epoch: 57, train_loss: 1.0356, test_loss: 1.2869, test_f1: 0.4834
 epoch: 58, train_loss: 1.0223, test_loss: 1.2962, test_f1: 0.5266
 epoch: 59, train_loss: 1.0281, test_loss: 1.2950, test_f1: 0.5106
 epoch: 60, train_loss: 1.0121, test_loss: 1.3005, test_f1: 0.4996
 epoch: 61, train_loss: 1.0425, test_loss: 1.2916, test_f1: 0.5105
 epoch: 62, train_loss: 1.0199, test_loss: 1.2917, test_f1: 0.5173
 epoch: 63, train_loss: 1.0109, test_loss: 1.2861, test_f1: 0.4969
 epoch: 64, train_loss: 1.0275, test_loss: 1.2971, test_f1: 0.4990
 epoch: 65, train_loss: 1.0072, test_loss: 1.2969, test_f1: 0.4978
 epoch: 66, train_loss: 1.0096, test_loss: 1.2899, test_f1: 0.4973
 epoch: 67, train_loss: 1.0074, test_loss: 1.2951, test_f1: 0.5192
 epoch: 68, train_loss: 1.0220, test_loss: 1.3112, test_f1: 0.5006
 epoch: 69, train_loss: 1.0098, test_loss: 1.3077, test_f1: 0.5046
 epoch: 70, train_loss: 1.0104, test_loss: 1.2999, test_f1: 0.5106
 epoch: 71, train_loss: 1.0109, test_loss: 1.2945, test_f1: 0.4936
 epoch: 72, train_loss: 1.0157, test_loss: 1.2985, test_f1: 0.4881
 epoch: 73, train_loss: 1.0050, test_loss: 1.2972, test_f1: 0.4947
 epoch: 74, train_loss: 0.9947, test_loss: 1.3168, test_f1: 0.5009
 epoch: 75, train_loss: 1.0098, test_loss: 1.3317, test_f1: 0.4932
 epoch: 76, train_loss: 0.9866, test_loss: 1.3163, test_f1: 0.5038
 epoch: 77, train_loss: 1.0052, test_loss: 1.2878, test_f1: 0.4916
 epoch: 78, train_loss: 1.0091, test_loss: 1.3081, test_f1: 0.4998
 epoch: 79, train_loss: 0.9937, test_loss: 1.3184, test_f1: 0.4998
 epoch: 80, train_loss: 0.9928, test_loss: 1.3146, test_f1: 0.4998
 epoch: 81, train_loss: 0.9949, test_loss: 1.3149, test_f1: 0.4973
 epoch: 82, train_loss: 1.0040, test_loss: 1.3080, test_f1: 0.5032
 epoch: 83, train_loss: 0.9905, test_loss: 1.2980, test_f1: 0.5092
 epoch: 84, train_loss: 0.9793, test_loss: 1.2707, test_f1: 0.5083
 epoch: 85, train_loss: 1.0144, test_loss: 1.3148, test_f1: 0.4993
 epoch: 86, train_loss: 0.9777, test_loss: 1.2988, test_f1: 0.4929
 epoch: 87, train_loss: 0.9818, test_loss: 1.3076, test_f1: 0.5042
 epoch: 88, train_loss: 0.9834, test_loss: 1.2976, test_f1: 0.5052
 epoch: 89, train_loss: 0.9736, test_loss: 1.3100, test_f1: 0.5074
 epoch: 90, train_loss: 0.9842, test_loss: 1.3015, test_f1: 0.5224
 epoch: 91, train_loss: 0.9899, test_loss: 1.2981, test_f1: 0.5004
 epoch: 92, train_loss: 0.9868, test_loss: 1.2898, test_f1: 0.5219
 epoch: 93, train_loss: 0.9802, test_loss: 1.3323, test_f1: 0.5157
 epoch: 94, train_loss: 0.9966, test_loss: 1.3179, test_f1: 0.5334
 epoch: 95, train_loss: 0.9825, test_loss: 1.3037, test_f1: 0.5077
 epoch: 96, train_loss: 0.9672, test_loss: 1.3066, test_f1: 0.5098
 epoch: 97, train_loss: 0.9880, test_loss: 1.3246, test_f1: 0.5315
 epoch: 98, train_loss: 0.9859, test_loss: 1.3368, test_f1: 0.4949
 epoch: 99, train_loss: 0.9807, test_loss: 1.3183, test_f1: 0.5115
##################ITERATION #9 ****************************************
 epoch: 0, train_loss: 1.3187, test_loss: 1.3356, test_f1: 0.2281
 epoch: 1, train_loss: 1.2742, test_loss: 1.3024, test_f1: 0.2248
 epoch: 2, train_loss: 1.2709, test_loss: 1.2967, test_f1: 0.2322
 epoch: 3, train_loss: 1.2436, test_loss: 1.2893, test_f1: 0.2246
 epoch: 4, train_loss: 1.2139, test_loss: 1.2828, test_f1: 0.2310
 epoch: 5, train_loss: 1.2233, test_loss: 1.2779, test_f1: 0.2538
 epoch: 6, train_loss: 1.2171, test_loss: 1.2764, test_f1: 0.2659
 epoch: 7, train_loss: 1.2108, test_loss: 1.2728, test_f1: 0.2630
 epoch: 8, train_loss: 1.2072, test_loss: 1.2440, test_f1: 0.2909
 epoch: 9, train_loss: 1.1828, test_loss: 1.2635, test_f1: 0.3501
 epoch: 10, train_loss: 1.1880, test_loss: 1.2358, test_f1: 0.3365
 epoch: 11, train_loss: 1.1779, test_loss: 1.2228, test_f1: 0.4199
 epoch: 12, train_loss: 1.1788, test_loss: 1.2173, test_f1: 0.3657
 epoch: 13, train_loss: 1.1715, test_loss: 1.2225, test_f1: 0.4201
 epoch: 14, train_loss: 1.1648, test_loss: 1.2155, test_f1: 0.4303
 epoch: 15, train_loss: 1.1574, test_loss: 1.2108, test_f1: 0.4051
 epoch: 16, train_loss: 1.1576, test_loss: 1.2062, test_f1: 0.4091
 epoch: 17, train_loss: 1.1410, test_loss: 1.1987, test_f1: 0.4053
 epoch: 18, train_loss: 1.1409, test_loss: 1.1923, test_f1: 0.3941
 epoch: 19, train_loss: 1.1351, test_loss: 1.1930, test_f1: 0.4143
 epoch: 20, train_loss: 1.1272, test_loss: 1.1978, test_f1: 0.4237
 epoch: 21, train_loss: 1.1268, test_loss: 1.2082, test_f1: 0.4344
 epoch: 22, train_loss: 1.1117, test_loss: 1.1872, test_f1: 0.4481
 epoch: 23, train_loss: 1.1199, test_loss: 1.1787, test_f1: 0.4612
 epoch: 24, train_loss: 1.1005, test_loss: 1.2196, test_f1: 0.4405
 epoch: 25, train_loss: 1.1032, test_loss: 1.2265, test_f1: 0.4570
 epoch: 26, train_loss: 1.0977, test_loss: 1.2240, test_f1: 0.4665
 epoch: 27, train_loss: 1.0982, test_loss: 1.1874, test_f1: 0.4644
 epoch: 28, train_loss: 1.0953, test_loss: 1.1929, test_f1: 0.4624
 epoch: 29, train_loss: 1.0854, test_loss: 1.2687, test_f1: 0.4795
 epoch: 30, train_loss: 1.0744, test_loss: 1.2576, test_f1: 0.4769
 epoch: 31, train_loss: 1.0678, test_loss: 1.2348, test_f1: 0.4800
 epoch: 32, train_loss: 1.0749, test_loss: 1.2690, test_f1: 0.4707
 epoch: 33, train_loss: 1.0665, test_loss: 1.2609, test_f1: 0.4747
 epoch: 34, train_loss: 1.0590, test_loss: 1.2207, test_f1: 0.4875
 epoch: 35, train_loss: 1.0664, test_loss: 1.2430, test_f1: 0.4846
 epoch: 36, train_loss: 1.0548, test_loss: 1.2149, test_f1: 0.4938
 epoch: 37, train_loss: 1.0623, test_loss: 1.2152, test_f1: 0.4795
 epoch: 38, train_loss: 1.0560, test_loss: 1.2205, test_f1: 0.4962
 epoch: 39, train_loss: 1.0477, test_loss: 1.2151, test_f1: 0.5141
 epoch: 40, train_loss: 1.0440, test_loss: 1.2668, test_f1: 0.4854
 epoch: 41, train_loss: 1.0386, test_loss: 1.3030, test_f1: 0.4690
 epoch: 42, train_loss: 1.0335, test_loss: 1.2079, test_f1: 0.4960
 epoch: 43, train_loss: 1.0422, test_loss: 1.1963, test_f1: 0.5062
 epoch: 44, train_loss: 1.0214, test_loss: 1.1819, test_f1: 0.5065
 epoch: 45, train_loss: 1.0215, test_loss: 1.3485, test_f1: 0.4705
 epoch: 46, train_loss: 1.0521, test_loss: 1.1975, test_f1: 0.4679
 epoch: 47, train_loss: 1.0304, test_loss: 1.1769, test_f1: 0.4791
 epoch: 48, train_loss: 1.0264, test_loss: 1.2390, test_f1: 0.4905
 epoch: 49, train_loss: 1.0161, test_loss: 1.1937, test_f1: 0.4874
 epoch: 50, train_loss: 1.0228, test_loss: 1.3032, test_f1: 0.4946
 epoch: 51, train_loss: 1.0221, test_loss: 1.2178, test_f1: 0.4752
 epoch: 52, train_loss: 1.0170, test_loss: 1.2188, test_f1: 0.4711
 epoch: 53, train_loss: 0.9957, test_loss: 1.1886, test_f1: 0.5002
 epoch: 54, train_loss: 1.0098, test_loss: 1.2082, test_f1: 0.4606
 epoch: 55, train_loss: 1.0100, test_loss: 1.1986, test_f1: 0.4821
 epoch: 56, train_loss: 1.0110, test_loss: 1.2387, test_f1: 0.4671
 epoch: 57, train_loss: 0.9994, test_loss: 1.2417, test_f1: 0.4729
 epoch: 58, train_loss: 0.9810, test_loss: 1.2374, test_f1: 0.4835
 epoch: 59, train_loss: 0.9902, test_loss: 1.2131, test_f1: 0.5005
 epoch: 60, train_loss: 1.0016, test_loss: 1.2276, test_f1: 0.4758
 epoch: 61, train_loss: 0.9891, test_loss: 1.1849, test_f1: 0.5011
 epoch: 62, train_loss: 0.9955, test_loss: 1.1914, test_f1: 0.5169
 epoch: 63, train_loss: 0.9951, test_loss: 1.2145, test_f1: 0.5010
 epoch: 64, train_loss: 0.9930, test_loss: 1.2329, test_f1: 0.4635
 epoch: 65, train_loss: 0.9935, test_loss: 1.2011, test_f1: 0.5126
 epoch: 66, train_loss: 0.9861, test_loss: 1.2155, test_f1: 0.4978
 epoch: 67, train_loss: 0.9691, test_loss: 1.2098, test_f1: 0.4966
 epoch: 68, train_loss: 0.9614, test_loss: 1.2084, test_f1: 0.4989
 epoch: 69, train_loss: 0.9946, test_loss: 1.2393, test_f1: 0.4734
 epoch: 70, train_loss: 0.9972, test_loss: 1.2116, test_f1: 0.5264
 epoch: 71, train_loss: 0.9842, test_loss: 1.1902, test_f1: 0.5420
 epoch: 72, train_loss: 1.0014, test_loss: 1.2207, test_f1: 0.5239
 epoch: 73, train_loss: 0.9752, test_loss: 1.2098, test_f1: 0.5100
 epoch: 74, train_loss: 0.9722, test_loss: 1.2309, test_f1: 0.4880
 epoch: 75, train_loss: 0.9696, test_loss: 1.2129, test_f1: 0.4802
 epoch: 76, train_loss: 0.9654, test_loss: 1.2324, test_f1: 0.5129
 epoch: 77, train_loss: 0.9709, test_loss: 1.2284, test_f1: 0.5034
 epoch: 78, train_loss: 0.9934, test_loss: 1.2362, test_f1: 0.4964
 epoch: 79, train_loss: 0.9811, test_loss: 1.2170, test_f1: 0.4956
 epoch: 80, train_loss: 0.9750, test_loss: 1.2094, test_f1: 0.5115
 epoch: 81, train_loss: 0.9656, test_loss: 1.2085, test_f1: 0.4967
 epoch: 82, train_loss: 0.9678, test_loss: 1.2026, test_f1: 0.4829
 epoch: 83, train_loss: 0.9596, test_loss: 1.2027, test_f1: 0.4790
 epoch: 84, train_loss: 0.9752, test_loss: 1.2383, test_f1: 0.4918
 epoch: 85, train_loss: 0.9726, test_loss: 1.2813, test_f1: 0.4614
 epoch: 86, train_loss: 0.9651, test_loss: 1.2210, test_f1: 0.4837
 epoch: 87, train_loss: 0.9492, test_loss: 1.2282, test_f1: 0.4948
 epoch: 88, train_loss: 0.9561, test_loss: 1.2267, test_f1: 0.5000
 epoch: 89, train_loss: 0.9473, test_loss: 1.2403, test_f1: 0.4964
 epoch: 90, train_loss: 0.9537, test_loss: 1.2010, test_f1: 0.4936
 epoch: 91, train_loss: 0.9604, test_loss: 1.1960, test_f1: 0.4984
 epoch: 92, train_loss: 0.9540, test_loss: 1.2505, test_f1: 0.4860
 epoch: 93, train_loss: 0.9391, test_loss: 1.2045, test_f1: 0.5028
 epoch: 94, train_loss: 0.9667, test_loss: 1.2149, test_f1: 0.4857
 epoch: 95, train_loss: 0.9559, test_loss: 1.2070, test_f1: 0.4938
 epoch: 96, train_loss: 0.9426, test_loss: 1.2154, test_f1: 0.4896
 epoch: 97, train_loss: 0.9390, test_loss: 1.2093, test_f1: 0.4999
 epoch: 98, train_loss: 0.9557, test_loss: 1.2105, test_f1: 0.4908
 epoch: 99, train_loss: 0.9439, test_loss: 1.2693, test_f1: 0.4780

Training completed in 666.19 seconds
Best F1: 0.5420 at epoch 71
Mean F1 across iterations: 0.5056  0.0293
========================FINAL RESULTS================================
FEGIN weighted F1: 0.5420  0.0293
python main.py --data ltspice_demos --representation component_component --model FEGIN --layers 4 --hiddens 32 --batch_size 32 --lr 0.0001 --emb_size 250 --epochs 100 --save_appendix component_component_L4_H32_BS32_LR0.0001_E250 --no_val
-----



STDERR:
  File "main.py", line 370, in <module>
    main()
  File "main.py", line 254, in main
    dataset = dataset_class(
  File "/home/philip/projects/ltspice_examples_code_repo/Circuit-Completion-Using-GNNs/component_classification_with_link_prediction_head/evaluation/FEGIN/kernel/circuit_datasets.py", line 15, in __init__
    self.data, self.slices = torch.load(self.processed_paths[0])
  File "/home/philip/.local/lib/python3.8/site-packages/torch/serialization.py", line 1040, in load
    warnings.warn(
  File "/usr/lib/python3.8/warnings.py", line 109, in _showwarnmsg
    sw(msg.message, msg.category, msg.filename, msg.lineno,
  File "main.py", line 47, in warn_with_traceback
    traceback.print_stack(file=log)
/home/philip/projects/ltspice_examples_code_repo/Circuit-Completion-Using-GNNs/component_classification_with_link_prediction_head/evaluation/FEGIN/kernel/circuit_datasets.py:15: FutureWarning: You are using `torch.load` with `weights_only=False` (the current default value), which uses the default pickle module implicitly. It is possible to construct malicious pickle data which will execute arbitrary code during unpickling (See https://github.com/pytorch/pytorch/blob/main/SECURITY.md#untrusted-models for more details). In a future release, the default value for `weights_only` will be flipped to `True`. This limits the functions that could be executed during unpickling. Arbitrary objects will no longer be allowed to be loaded via this mode unless they are explicitly allowlisted by the user via `torch.serialization.add_safe_globals`. We recommend you start setting `weights_only=True` for any use case where you don't have full control of the loaded file. Please open an issue on GitHub for any issues related to this experimental feature.
  self.data, self.slices = torch.load(self.processed_paths[0])
