STDOUT:
Results will be saved in /home/philip/projects/ltspice_examples_code_repo/Circuit-Completion-Using-GNNs/component_classification_with_link_prediction_head/evaluation/FEGIN/results/model_FEGIN_dataset_ltspice_demos
Command line input: python main.py --data ltspice_demos --representation component_pin_net --model FEGIN --layers 6 --hiddens 64 --batch_size 64 --lr 0.001 --emb_size 512 --epochs 100 --save_appendix component_pin_net_L6_H64_BS64_LR0.001_E512 --no_val
 is saved.
-----
ltspice_demos - FEGIN
Using 6 layers, 64 hidden units, h = 2
Loading component_pin_net representation dataset
ENTERED
Training FEGIN on component_pin_net representation
Train: 1565, Test: 383
##################ITERATION #0 ****************************************
 epoch: 0, train_loss: 1.2779, test_loss: 1.3381, test_f1: 0.2281
 epoch: 1, train_loss: 1.1406, test_loss: 1.2520, test_f1: 0.3547
 epoch: 2, train_loss: 1.1014, test_loss: 1.1634, test_f1: 0.4315
 epoch: 3, train_loss: 1.0336, test_loss: 1.1180, test_f1: 0.4363
 epoch: 4, train_loss: 0.9939, test_loss: 1.0707, test_f1: 0.4874
 epoch: 5, train_loss: 0.9682, test_loss: 1.0326, test_f1: 0.4573
 epoch: 6, train_loss: 0.9334, test_loss: 1.0225, test_f1: 0.5442
 epoch: 7, train_loss: 0.9067, test_loss: 1.0317, test_f1: 0.5273
 epoch: 8, train_loss: 0.8975, test_loss: 1.0164, test_f1: 0.5435
 epoch: 9, train_loss: 0.8725, test_loss: 1.0306, test_f1: 0.5120
 epoch: 10, train_loss: 0.8549, test_loss: 0.9383, test_f1: 0.5941
 epoch: 11, train_loss: 0.8165, test_loss: 0.9831, test_f1: 0.6099
 epoch: 12, train_loss: 0.7906, test_loss: 0.9942, test_f1: 0.5992
 epoch: 13, train_loss: 0.7580, test_loss: 0.9874, test_f1: 0.6079
 epoch: 14, train_loss: 0.7206, test_loss: 0.9704, test_f1: 0.5986
 epoch: 15, train_loss: 0.7288, test_loss: 1.0441, test_f1: 0.5708
 epoch: 16, train_loss: 0.7295, test_loss: 0.9735, test_f1: 0.5617
 epoch: 17, train_loss: 0.7054, test_loss: 1.0398, test_f1: 0.5482
 epoch: 18, train_loss: 0.7075, test_loss: 1.0861, test_f1: 0.5786
 epoch: 19, train_loss: 0.6696, test_loss: 1.1260, test_f1: 0.5201
 epoch: 20, train_loss: 0.6375, test_loss: 1.0804, test_f1: 0.6130
 epoch: 21, train_loss: 0.6428, test_loss: 1.0055, test_f1: 0.5682
 epoch: 22, train_loss: 0.6312, test_loss: 1.0830, test_f1: 0.5365
 epoch: 23, train_loss: 0.5862, test_loss: 1.1155, test_f1: 0.6195
 epoch: 24, train_loss: 0.5911, test_loss: 1.0827, test_f1: 0.6280
 epoch: 25, train_loss: 0.5730, test_loss: 1.1006, test_f1: 0.6051
 epoch: 26, train_loss: 0.5586, test_loss: 1.2445, test_f1: 0.5776
 epoch: 27, train_loss: 0.5372, test_loss: 1.1278, test_f1: 0.5999
 epoch: 28, train_loss: 0.5464, test_loss: 1.0880, test_f1: 0.6389
 epoch: 29, train_loss: 0.5229, test_loss: 1.1676, test_f1: 0.6082
 epoch: 30, train_loss: 0.5238, test_loss: 1.2869, test_f1: 0.5305
 epoch: 31, train_loss: 0.5006, test_loss: 1.2541, test_f1: 0.6450
 epoch: 32, train_loss: 0.4969, test_loss: 1.2904, test_f1: 0.6212
 epoch: 33, train_loss: 0.4639, test_loss: 1.2648, test_f1: 0.6203
 epoch: 34, train_loss: 0.4618, test_loss: 1.3493, test_f1: 0.5902
 epoch: 35, train_loss: 0.4639, test_loss: 1.4351, test_f1: 0.6232
 epoch: 36, train_loss: 0.4268, test_loss: 1.4426, test_f1: 0.6058
 epoch: 37, train_loss: 0.4142, test_loss: 1.5534, test_f1: 0.5733
 epoch: 38, train_loss: 0.4483, test_loss: 1.3482, test_f1: 0.5921
 epoch: 39, train_loss: 0.4220, test_loss: 1.6294, test_f1: 0.5876
 epoch: 40, train_loss: 0.3764, test_loss: 1.5750, test_f1: 0.6317
 epoch: 41, train_loss: 0.3735, test_loss: 1.5838, test_f1: 0.5923
 epoch: 42, train_loss: 0.3630, test_loss: 1.7458, test_f1: 0.5815
 epoch: 43, train_loss: 0.4231, test_loss: 1.5949, test_f1: 0.5533
 epoch: 44, train_loss: 0.3705, test_loss: 1.5671, test_f1: 0.6505
 epoch: 45, train_loss: 0.3351, test_loss: 1.7037, test_f1: 0.5911
 epoch: 46, train_loss: 0.3039, test_loss: 1.9183, test_f1: 0.5985
 epoch: 47, train_loss: 0.3396, test_loss: 1.9101, test_f1: 0.5599
 epoch: 48, train_loss: 0.3272, test_loss: 1.6428, test_f1: 0.6068
 epoch: 49, train_loss: 0.3209, test_loss: 1.7748, test_f1: 0.6226
 epoch: 50, train_loss: 0.3198, test_loss: 1.8251, test_f1: 0.5940
 epoch: 51, train_loss: 0.2538, test_loss: 1.9011, test_f1: 0.6030
 epoch: 52, train_loss: 0.2369, test_loss: 2.0878, test_f1: 0.5871
 epoch: 53, train_loss: 0.2196, test_loss: 2.0900, test_f1: 0.6129
 epoch: 54, train_loss: 0.1920, test_loss: 2.2741, test_f1: 0.5883
 epoch: 55, train_loss: 0.1823, test_loss: 2.2267, test_f1: 0.5971
 epoch: 56, train_loss: 0.1794, test_loss: 2.3426, test_f1: 0.6013
 epoch: 57, train_loss: 0.1864, test_loss: 2.2403, test_f1: 0.6022
 epoch: 58, train_loss: 0.1829, test_loss: 2.3860, test_f1: 0.6160
 epoch: 59, train_loss: 0.1829, test_loss: 2.2780, test_f1: 0.6157
 epoch: 60, train_loss: 0.1620, test_loss: 2.5517, test_f1: 0.5824
 epoch: 61, train_loss: 0.1802, test_loss: 2.5614, test_f1: 0.5982
 epoch: 62, train_loss: 0.1826, test_loss: 2.4746, test_f1: 0.6115
 epoch: 63, train_loss: 0.2043, test_loss: 2.8425, test_f1: 0.5747
 epoch: 64, train_loss: 0.2074, test_loss: 2.5602, test_f1: 0.5891
 epoch: 65, train_loss: 0.1668, test_loss: 2.5713, test_f1: 0.5931
 epoch: 66, train_loss: 0.1766, test_loss: 2.4502, test_f1: 0.5933
 epoch: 67, train_loss: 0.1657, test_loss: 2.7079, test_f1: 0.5848
 epoch: 68, train_loss: 0.1509, test_loss: 2.6309, test_f1: 0.6044
 epoch: 69, train_loss: 0.1729, test_loss: 2.8994, test_f1: 0.5868
 epoch: 70, train_loss: 0.1731, test_loss: 2.6494, test_f1: 0.5780
 epoch: 71, train_loss: 0.1490, test_loss: 2.9455, test_f1: 0.5702
 epoch: 72, train_loss: 0.1435, test_loss: 2.9118, test_f1: 0.5959
 epoch: 73, train_loss: 0.1281, test_loss: 2.9799, test_f1: 0.6206
 epoch: 74, train_loss: 0.1370, test_loss: 2.9872, test_f1: 0.5754
 epoch: 75, train_loss: 0.1561, test_loss: 2.8211, test_f1: 0.5917
 epoch: 76, train_loss: 0.1550, test_loss: 3.2725, test_f1: 0.5889
 epoch: 77, train_loss: 0.1786, test_loss: 3.0769, test_f1: 0.5718
 epoch: 78, train_loss: 0.1370, test_loss: 2.8297, test_f1: 0.5670
 epoch: 79, train_loss: 0.1078, test_loss: 2.9616, test_f1: 0.5922
 epoch: 80, train_loss: 0.1234, test_loss: 3.1874, test_f1: 0.5617
 epoch: 81, train_loss: 0.1146, test_loss: 3.1948, test_f1: 0.5918
 epoch: 82, train_loss: 0.1137, test_loss: 3.1876, test_f1: 0.5732
 epoch: 83, train_loss: 0.1091, test_loss: 3.4734, test_f1: 0.5934
 epoch: 84, train_loss: 0.0969, test_loss: 3.2676, test_f1: 0.6149
 epoch: 85, train_loss: 0.1078, test_loss: 3.2939, test_f1: 0.6145
 epoch: 86, train_loss: 0.1252, test_loss: 3.3153, test_f1: 0.5724
 epoch: 87, train_loss: 0.1479, test_loss: 3.3126, test_f1: 0.5915
 epoch: 88, train_loss: 0.1118, test_loss: 3.2545, test_f1: 0.6019
 epoch: 89, train_loss: 0.1221, test_loss: 3.3479, test_f1: 0.6027
 epoch: 90, train_loss: 0.0966, test_loss: 3.2393, test_f1: 0.6029
 epoch: 91, train_loss: 0.0979, test_loss: 3.3762, test_f1: 0.5887
 epoch: 92, train_loss: 0.0747, test_loss: 3.5284, test_f1: 0.5843
 epoch: 93, train_loss: 0.0773, test_loss: 3.8047, test_f1: 0.6020
 epoch: 94, train_loss: 0.1102, test_loss: 3.4706, test_f1: 0.6051
 epoch: 95, train_loss: 0.1089, test_loss: 3.6656, test_f1: 0.5811
 epoch: 96, train_loss: 0.1635, test_loss: 3.3213, test_f1: 0.5754
 epoch: 97, train_loss: 0.1571, test_loss: 3.3130, test_f1: 0.6121
 epoch: 98, train_loss: 0.1208, test_loss: 3.6062, test_f1: 0.5883
 epoch: 99, train_loss: 0.1111, test_loss: 3.6193, test_f1: 0.5740
##################ITERATION #1 ****************************************
 epoch: 0, train_loss: 1.1598, test_loss: 1.3405, test_f1: 0.2707
 epoch: 1, train_loss: 1.0039, test_loss: 1.2927, test_f1: 0.2613
 epoch: 2, train_loss: 0.9701, test_loss: 1.0492, test_f1: 0.5199
 epoch: 3, train_loss: 0.9492, test_loss: 1.0158, test_f1: 0.5287
 epoch: 4, train_loss: 0.9261, test_loss: 1.0516, test_f1: 0.5287
 epoch: 5, train_loss: 0.9009, test_loss: 1.0132, test_f1: 0.5400
 epoch: 6, train_loss: 0.8894, test_loss: 1.0173, test_f1: 0.5317
 epoch: 7, train_loss: 0.8581, test_loss: 1.0108, test_f1: 0.5549
 epoch: 8, train_loss: 0.8384, test_loss: 1.0307, test_f1: 0.5981
 epoch: 9, train_loss: 0.8031, test_loss: 1.1080, test_f1: 0.5801
 epoch: 10, train_loss: 0.7845, test_loss: 1.0538, test_f1: 0.5596
 epoch: 11, train_loss: 0.7778, test_loss: 1.0732, test_f1: 0.5513
 epoch: 12, train_loss: 0.7287, test_loss: 1.1221, test_f1: 0.5723
 epoch: 13, train_loss: 0.7280, test_loss: 1.0103, test_f1: 0.6222
 epoch: 14, train_loss: 0.7072, test_loss: 1.0670, test_f1: 0.5782
 epoch: 15, train_loss: 0.7066, test_loss: 0.9639, test_f1: 0.6148
 epoch: 16, train_loss: 0.6737, test_loss: 1.1388, test_f1: 0.5945
 epoch: 17, train_loss: 0.6581, test_loss: 1.0924, test_f1: 0.5918
 epoch: 18, train_loss: 0.6208, test_loss: 1.3011, test_f1: 0.5471
 epoch: 19, train_loss: 0.6320, test_loss: 1.1325, test_f1: 0.5989
 epoch: 20, train_loss: 0.6095, test_loss: 1.0132, test_f1: 0.6575
 epoch: 21, train_loss: 0.6105, test_loss: 1.0898, test_f1: 0.6319
 epoch: 22, train_loss: 0.5899, test_loss: 1.1454, test_f1: 0.6402
 epoch: 23, train_loss: 0.5699, test_loss: 1.1193, test_f1: 0.6253
 epoch: 24, train_loss: 0.5589, test_loss: 1.1808, test_f1: 0.5953
 epoch: 25, train_loss: 0.5464, test_loss: 1.1657, test_f1: 0.5915
 epoch: 26, train_loss: 0.5297, test_loss: 1.1896, test_f1: 0.6470
 epoch: 27, train_loss: 0.5209, test_loss: 1.3444, test_f1: 0.6306
 epoch: 28, train_loss: 0.5046, test_loss: 1.5313, test_f1: 0.5238
 epoch: 29, train_loss: 0.5051, test_loss: 1.3799, test_f1: 0.6302
 epoch: 30, train_loss: 0.4852, test_loss: 1.4306, test_f1: 0.5917
 epoch: 31, train_loss: 0.4835, test_loss: 1.6408, test_f1: 0.5985
 epoch: 32, train_loss: 0.5118, test_loss: 1.2767, test_f1: 0.6440
 epoch: 33, train_loss: 0.4412, test_loss: 1.3534, test_f1: 0.6329
 epoch: 34, train_loss: 0.4410, test_loss: 1.3693, test_f1: 0.6498
 epoch: 35, train_loss: 0.4359, test_loss: 1.4848, test_f1: 0.6170
 epoch: 36, train_loss: 0.4517, test_loss: 1.4004, test_f1: 0.6341
 epoch: 37, train_loss: 0.4262, test_loss: 1.3618, test_f1: 0.6473
 epoch: 38, train_loss: 0.3972, test_loss: 1.4956, test_f1: 0.6355
 epoch: 39, train_loss: 0.3890, test_loss: 1.6652, test_f1: 0.6176
 epoch: 40, train_loss: 0.3882, test_loss: 1.6405, test_f1: 0.6169
 epoch: 41, train_loss: 0.4266, test_loss: 1.7757, test_f1: 0.6280
 epoch: 42, train_loss: 0.4708, test_loss: 1.5685, test_f1: 0.5432
 epoch: 43, train_loss: 0.3879, test_loss: 1.6904, test_f1: 0.5957
 epoch: 44, train_loss: 0.3766, test_loss: 1.6663, test_f1: 0.5977
 epoch: 45, train_loss: 0.3407, test_loss: 1.5196, test_f1: 0.6555
 epoch: 46, train_loss: 0.3379, test_loss: 1.8249, test_f1: 0.6000
 epoch: 47, train_loss: 0.3531, test_loss: 1.7739, test_f1: 0.6196
 epoch: 48, train_loss: 0.3719, test_loss: 1.6822, test_f1: 0.6356
 epoch: 49, train_loss: 0.3974, test_loss: 1.5622, test_f1: 0.6339
 epoch: 50, train_loss: 0.3448, test_loss: 1.9430, test_f1: 0.6015
 epoch: 51, train_loss: 0.3006, test_loss: 1.7684, test_f1: 0.6185
 epoch: 52, train_loss: 0.2572, test_loss: 1.9022, test_f1: 0.6246
 epoch: 53, train_loss: 0.2444, test_loss: 1.9329, test_f1: 0.6057
 epoch: 54, train_loss: 0.2412, test_loss: 2.0869, test_f1: 0.6162
 epoch: 55, train_loss: 0.2082, test_loss: 2.0922, test_f1: 0.6101
 epoch: 56, train_loss: 0.2318, test_loss: 1.9878, test_f1: 0.6209
 epoch: 57, train_loss: 0.2255, test_loss: 2.0140, test_f1: 0.6132
 epoch: 58, train_loss: 0.2329, test_loss: 2.1526, test_f1: 0.6085
 epoch: 59, train_loss: 0.2248, test_loss: 2.2028, test_f1: 0.6294
 epoch: 60, train_loss: 0.2123, test_loss: 2.2836, test_f1: 0.6150
 epoch: 61, train_loss: 0.1968, test_loss: 2.3591, test_f1: 0.5857
 epoch: 62, train_loss: 0.2131, test_loss: 2.3821, test_f1: 0.6101
 epoch: 63, train_loss: 0.1946, test_loss: 2.2568, test_f1: 0.6051
 epoch: 64, train_loss: 0.1789, test_loss: 2.2269, test_f1: 0.6302
 epoch: 65, train_loss: 0.1852, test_loss: 2.4021, test_f1: 0.6323
 epoch: 66, train_loss: 0.1819, test_loss: 2.5345, test_f1: 0.6071
 epoch: 67, train_loss: 0.1801, test_loss: 2.5222, test_f1: 0.6199
 epoch: 68, train_loss: 0.1700, test_loss: 2.4485, test_f1: 0.6125
 epoch: 69, train_loss: 0.1645, test_loss: 2.6053, test_f1: 0.6081
 epoch: 70, train_loss: 0.1768, test_loss: 2.6627, test_f1: 0.5952
 epoch: 71, train_loss: 0.2069, test_loss: 2.5800, test_f1: 0.5998
 epoch: 72, train_loss: 0.1608, test_loss: 2.5668, test_f1: 0.5990
 epoch: 73, train_loss: 0.1891, test_loss: 2.8016, test_f1: 0.6140
 epoch: 74, train_loss: 0.1647, test_loss: 2.4128, test_f1: 0.6394
 epoch: 75, train_loss: 0.1423, test_loss: 2.6696, test_f1: 0.6051
 epoch: 76, train_loss: 0.1315, test_loss: 2.8556, test_f1: 0.6011
 epoch: 77, train_loss: 0.1249, test_loss: 3.0242, test_f1: 0.5762
 epoch: 78, train_loss: 0.1356, test_loss: 3.0260, test_f1: 0.5964
 epoch: 79, train_loss: 0.1198, test_loss: 3.1230, test_f1: 0.5874
 epoch: 80, train_loss: 0.1467, test_loss: 3.1871, test_f1: 0.5734
 epoch: 81, train_loss: 0.1700, test_loss: 3.3596, test_f1: 0.5621
 epoch: 82, train_loss: 0.1524, test_loss: 3.0477, test_f1: 0.5925
 epoch: 83, train_loss: 0.1245, test_loss: 3.2724, test_f1: 0.5940
 epoch: 84, train_loss: 0.1265, test_loss: 3.3923, test_f1: 0.5994
 epoch: 85, train_loss: 0.1474, test_loss: 3.2216, test_f1: 0.6004
 epoch: 86, train_loss: 0.1512, test_loss: 3.3580, test_f1: 0.5614
 epoch: 87, train_loss: 0.1671, test_loss: 3.0863, test_f1: 0.5976
 epoch: 88, train_loss: 0.1444, test_loss: 3.2732, test_f1: 0.5967
 epoch: 89, train_loss: 0.1186, test_loss: 3.1559, test_f1: 0.5909
 epoch: 90, train_loss: 0.1099, test_loss: 3.4214, test_f1: 0.5807
 epoch: 91, train_loss: 0.1151, test_loss: 3.3742, test_f1: 0.5817
 epoch: 92, train_loss: 0.1535, test_loss: 3.3519, test_f1: 0.5857
 epoch: 93, train_loss: 0.1655, test_loss: 3.2121, test_f1: 0.5875
 epoch: 94, train_loss: 0.1552, test_loss: 3.4045, test_f1: 0.5567
 epoch: 95, train_loss: 0.1440, test_loss: 3.1907, test_f1: 0.5927
 epoch: 96, train_loss: 0.1394, test_loss: 3.3111, test_f1: 0.6047
 epoch: 97, train_loss: 0.1550, test_loss: 3.3689, test_f1: 0.5884
 epoch: 98, train_loss: 0.1213, test_loss: 3.4104, test_f1: 0.5833
 epoch: 99, train_loss: 0.1140, test_loss: 3.5743, test_f1: 0.5850
##################ITERATION #2 ****************************************
 epoch: 0, train_loss: 1.1743, test_loss: 1.2962, test_f1: 0.2583
 epoch: 1, train_loss: 1.0240, test_loss: 1.3194, test_f1: 0.3373
 epoch: 2, train_loss: 0.9646, test_loss: 1.1345, test_f1: 0.4077
 epoch: 3, train_loss: 0.9367, test_loss: 1.0494, test_f1: 0.5160
 epoch: 4, train_loss: 0.9277, test_loss: 1.0237, test_f1: 0.5578
 epoch: 5, train_loss: 0.8919, test_loss: 0.9957, test_f1: 0.5989
 epoch: 6, train_loss: 0.8801, test_loss: 1.0291, test_f1: 0.5405
 epoch: 7, train_loss: 0.8537, test_loss: 1.0242, test_f1: 0.5716
 epoch: 8, train_loss: 0.8244, test_loss: 1.0180, test_f1: 0.5350
 epoch: 9, train_loss: 0.7845, test_loss: 1.1536, test_f1: 0.5599
 epoch: 10, train_loss: 0.7905, test_loss: 1.0751, test_f1: 0.5967
 epoch: 11, train_loss: 0.7596, test_loss: 1.0163, test_f1: 0.6017
 epoch: 12, train_loss: 0.7228, test_loss: 1.0277, test_f1: 0.5672
 epoch: 13, train_loss: 0.6899, test_loss: 1.1147, test_f1: 0.5690
 epoch: 14, train_loss: 0.6927, test_loss: 1.0464, test_f1: 0.5938
 epoch: 15, train_loss: 0.6689, test_loss: 1.0571, test_f1: 0.6016
 epoch: 16, train_loss: 0.6599, test_loss: 1.1516, test_f1: 0.5775
 epoch: 17, train_loss: 0.6507, test_loss: 1.0644, test_f1: 0.6172
 epoch: 18, train_loss: 0.6517, test_loss: 1.1156, test_f1: 0.5634
 epoch: 19, train_loss: 0.6124, test_loss: 1.0942, test_f1: 0.6089
 epoch: 20, train_loss: 0.5709, test_loss: 1.5233, test_f1: 0.5005
 epoch: 21, train_loss: 0.5843, test_loss: 1.1603, test_f1: 0.5956
 epoch: 22, train_loss: 0.5638, test_loss: 1.1775, test_f1: 0.5978
 epoch: 23, train_loss: 0.5696, test_loss: 1.1546, test_f1: 0.6144
 epoch: 24, train_loss: 0.5195, test_loss: 1.2404, test_f1: 0.6450
 epoch: 25, train_loss: 0.5060, test_loss: 1.3113, test_f1: 0.6161
 epoch: 26, train_loss: 0.4944, test_loss: 1.2901, test_f1: 0.6019
 epoch: 27, train_loss: 0.4941, test_loss: 1.2502, test_f1: 0.6291
 epoch: 28, train_loss: 0.4798, test_loss: 1.3560, test_f1: 0.6096
 epoch: 29, train_loss: 0.4874, test_loss: 1.3425, test_f1: 0.6151
 epoch: 30, train_loss: 0.4658, test_loss: 1.3836, test_f1: 0.6006
 epoch: 31, train_loss: 0.4765, test_loss: 1.3277, test_f1: 0.6152
 epoch: 32, train_loss: 0.4216, test_loss: 1.5036, test_f1: 0.6114
 epoch: 33, train_loss: 0.4141, test_loss: 1.4691, test_f1: 0.6089
 epoch: 34, train_loss: 0.4418, test_loss: 1.4105, test_f1: 0.6673
 epoch: 35, train_loss: 0.3863, test_loss: 1.5496, test_f1: 0.6108
 epoch: 36, train_loss: 0.3936, test_loss: 1.4945, test_f1: 0.6100
 epoch: 37, train_loss: 0.3848, test_loss: 1.5920, test_f1: 0.5810
 epoch: 38, train_loss: 0.3836, test_loss: 1.4924, test_f1: 0.6511
 epoch: 39, train_loss: 0.4009, test_loss: 1.5575, test_f1: 0.6244
 epoch: 40, train_loss: 0.3653, test_loss: 1.5991, test_f1: 0.6340
 epoch: 41, train_loss: 0.3461, test_loss: 1.7725, test_f1: 0.6386
 epoch: 42, train_loss: 0.3550, test_loss: 1.7862, test_f1: 0.5422
 epoch: 43, train_loss: 0.3538, test_loss: 1.8328, test_f1: 0.6192
 epoch: 44, train_loss: 0.3904, test_loss: 1.7220, test_f1: 0.6108
 epoch: 45, train_loss: 0.3362, test_loss: 1.8700, test_f1: 0.6005
 epoch: 46, train_loss: 0.3557, test_loss: 1.7960, test_f1: 0.6112
 epoch: 47, train_loss: 0.3451, test_loss: 1.8336, test_f1: 0.6378
 epoch: 48, train_loss: 0.3656, test_loss: 1.5722, test_f1: 0.6396
 epoch: 49, train_loss: 0.3149, test_loss: 1.8467, test_f1: 0.6395
 epoch: 50, train_loss: 0.2788, test_loss: 1.9427, test_f1: 0.6299
 epoch: 51, train_loss: 0.2725, test_loss: 1.8933, test_f1: 0.6222
 epoch: 52, train_loss: 0.2555, test_loss: 1.8770, test_f1: 0.6236
 epoch: 53, train_loss: 0.2665, test_loss: 1.9594, test_f1: 0.6357
 epoch: 54, train_loss: 0.2181, test_loss: 1.9894, test_f1: 0.6365
 epoch: 55, train_loss: 0.2050, test_loss: 2.0336, test_f1: 0.6146
 epoch: 56, train_loss: 0.2231, test_loss: 2.0377, test_f1: 0.6461
 epoch: 57, train_loss: 0.2077, test_loss: 2.1671, test_f1: 0.6422
 epoch: 58, train_loss: 0.2124, test_loss: 2.0439, test_f1: 0.6321
 epoch: 59, train_loss: 0.1940, test_loss: 2.2899, test_f1: 0.6229
 epoch: 60, train_loss: 0.1854, test_loss: 2.1520, test_f1: 0.6475
 epoch: 61, train_loss: 0.1707, test_loss: 2.2826, test_f1: 0.6252
 epoch: 62, train_loss: 0.1930, test_loss: 2.2056, test_f1: 0.6495
 epoch: 63, train_loss: 0.2078, test_loss: 2.2592, test_f1: 0.6556
 epoch: 64, train_loss: 0.1747, test_loss: 2.2704, test_f1: 0.6418
 epoch: 65, train_loss: 0.1841, test_loss: 2.4875, test_f1: 0.6280
 epoch: 66, train_loss: 0.1853, test_loss: 2.5727, test_f1: 0.6088
 epoch: 67, train_loss: 0.1822, test_loss: 2.4527, test_f1: 0.6224
 epoch: 68, train_loss: 0.1591, test_loss: 2.3789, test_f1: 0.6328
 epoch: 69, train_loss: 0.1441, test_loss: 2.4487, test_f1: 0.6428
 epoch: 70, train_loss: 0.1380, test_loss: 2.5822, test_f1: 0.6238
 epoch: 71, train_loss: 0.1693, test_loss: 2.4376, test_f1: 0.6190
 epoch: 72, train_loss: 0.1606, test_loss: 2.4855, test_f1: 0.6423
 epoch: 73, train_loss: 0.1649, test_loss: 2.5580, test_f1: 0.6215
 epoch: 74, train_loss: 0.1872, test_loss: 2.4658, test_f1: 0.6157
 epoch: 75, train_loss: 0.1649, test_loss: 2.4999, test_f1: 0.6361
 epoch: 76, train_loss: 0.1632, test_loss: 2.5533, test_f1: 0.6153
 epoch: 77, train_loss: 0.1318, test_loss: 2.5417, test_f1: 0.6302
 epoch: 78, train_loss: 0.1447, test_loss: 2.6624, test_f1: 0.6387
 epoch: 79, train_loss: 0.1491, test_loss: 2.6868, test_f1: 0.6457
 epoch: 80, train_loss: 0.1302, test_loss: 2.7924, test_f1: 0.6392
 epoch: 81, train_loss: 0.1208, test_loss: 2.8159, test_f1: 0.6357
 epoch: 82, train_loss: 0.1420, test_loss: 2.7396, test_f1: 0.6082
 epoch: 83, train_loss: 0.1380, test_loss: 2.6669, test_f1: 0.6555
 epoch: 84, train_loss: 0.1250, test_loss: 2.8545, test_f1: 0.6298
 epoch: 85, train_loss: 0.1496, test_loss: 2.7982, test_f1: 0.6214
 epoch: 86, train_loss: 0.1108, test_loss: 2.8139, test_f1: 0.6256
 epoch: 87, train_loss: 0.1390, test_loss: 3.0289, test_f1: 0.5970
 epoch: 88, train_loss: 0.1309, test_loss: 2.8153, test_f1: 0.6425
 epoch: 89, train_loss: 0.1170, test_loss: 2.9283, test_f1: 0.6334
 epoch: 90, train_loss: 0.1284, test_loss: 2.9785, test_f1: 0.6112
 epoch: 91, train_loss: 0.1563, test_loss: 2.9900, test_f1: 0.6238
 epoch: 92, train_loss: 0.1439, test_loss: 2.8516, test_f1: 0.6114
 epoch: 93, train_loss: 0.1118, test_loss: 3.0356, test_f1: 0.6233
 epoch: 94, train_loss: 0.0959, test_loss: 2.9545, test_f1: 0.6367
 epoch: 95, train_loss: 0.0956, test_loss: 3.0251, test_f1: 0.6006
 epoch: 96, train_loss: 0.0996, test_loss: 2.8533, test_f1: 0.6378
 epoch: 97, train_loss: 0.0957, test_loss: 3.2077, test_f1: 0.6171
 epoch: 98, train_loss: 0.0957, test_loss: 3.3156, test_f1: 0.5972
 epoch: 99, train_loss: 0.1003, test_loss: 2.9006, test_f1: 0.6328
##################ITERATION #3 ****************************************
 epoch: 0, train_loss: 1.2129, test_loss: 1.3039, test_f1: 0.1365
 epoch: 1, train_loss: 1.0314, test_loss: 1.1919, test_f1: 0.3951
 epoch: 2, train_loss: 0.9531, test_loss: 1.0661, test_f1: 0.4415
 epoch: 3, train_loss: 0.9281, test_loss: 1.0484, test_f1: 0.5021
 epoch: 4, train_loss: 0.9103, test_loss: 1.0721, test_f1: 0.5409
 epoch: 5, train_loss: 0.8881, test_loss: 1.0646, test_f1: 0.5863
 epoch: 6, train_loss: 0.8439, test_loss: 1.0514, test_f1: 0.5769
 epoch: 7, train_loss: 0.8333, test_loss: 1.0788, test_f1: 0.5321
 epoch: 8, train_loss: 0.8360, test_loss: 1.0899, test_f1: 0.5355
 epoch: 9, train_loss: 0.7920, test_loss: 1.0598, test_f1: 0.5601
 epoch: 10, train_loss: 0.7793, test_loss: 1.0942, test_f1: 0.5304
 epoch: 11, train_loss: 0.7538, test_loss: 1.1009, test_f1: 0.5170
 epoch: 12, train_loss: 0.7204, test_loss: 1.0462, test_f1: 0.5584
 epoch: 13, train_loss: 0.7034, test_loss: 1.1837, test_f1: 0.6157
 epoch: 14, train_loss: 0.6966, test_loss: 1.1668, test_f1: 0.5322
 epoch: 15, train_loss: 0.6733, test_loss: 1.2494, test_f1: 0.5376
 epoch: 16, train_loss: 0.6418, test_loss: 1.2227, test_f1: 0.5754
 epoch: 17, train_loss: 0.6310, test_loss: 1.2636, test_f1: 0.6429
 epoch: 18, train_loss: 0.6064, test_loss: 1.2560, test_f1: 0.6001
 epoch: 19, train_loss: 0.5816, test_loss: 1.2555, test_f1: 0.5975
 epoch: 20, train_loss: 0.5997, test_loss: 1.3833, test_f1: 0.5688
 epoch: 21, train_loss: 0.5756, test_loss: 1.2019, test_f1: 0.6246
 epoch: 22, train_loss: 0.5377, test_loss: 1.3252, test_f1: 0.6183
 epoch: 23, train_loss: 0.5103, test_loss: 1.3048, test_f1: 0.6376
 epoch: 24, train_loss: 0.5379, test_loss: 1.3935, test_f1: 0.6067
 epoch: 25, train_loss: 0.4970, test_loss: 1.3715, test_f1: 0.6572
 epoch: 26, train_loss: 0.4798, test_loss: 1.3885, test_f1: 0.5963
 epoch: 27, train_loss: 0.4628, test_loss: 1.5000, test_f1: 0.5963
 epoch: 28, train_loss: 0.4903, test_loss: 1.4933, test_f1: 0.6144
 epoch: 29, train_loss: 0.4534, test_loss: 1.4971, test_f1: 0.6536
 epoch: 30, train_loss: 0.4452, test_loss: 1.5375, test_f1: 0.6209
 epoch: 31, train_loss: 0.4948, test_loss: 1.6001, test_f1: 0.5849
 epoch: 32, train_loss: 0.4263, test_loss: 1.5189, test_f1: 0.6452
 epoch: 33, train_loss: 0.4246, test_loss: 1.4809, test_f1: 0.6425
 epoch: 34, train_loss: 0.4148, test_loss: 1.5535, test_f1: 0.6279
 epoch: 35, train_loss: 0.4103, test_loss: 1.6730, test_f1: 0.5843
 epoch: 36, train_loss: 0.3880, test_loss: 1.6214, test_f1: 0.6364
 epoch: 37, train_loss: 0.3909, test_loss: 1.6070, test_f1: 0.5968
 epoch: 38, train_loss: 0.3475, test_loss: 1.7407, test_f1: 0.6391
 epoch: 39, train_loss: 0.3362, test_loss: 1.8169, test_f1: 0.6166
 epoch: 40, train_loss: 0.3606, test_loss: 1.7045, test_f1: 0.6016
 epoch: 41, train_loss: 0.3549, test_loss: 1.7562, test_f1: 0.5955
 epoch: 42, train_loss: 0.3558, test_loss: 1.7433, test_f1: 0.6264
 epoch: 43, train_loss: 0.3510, test_loss: 1.8417, test_f1: 0.5808
 epoch: 44, train_loss: 0.3290, test_loss: 2.0283, test_f1: 0.6059
 epoch: 45, train_loss: 0.3555, test_loss: 1.9104, test_f1: 0.6099
 epoch: 46, train_loss: 0.2977, test_loss: 2.0232, test_f1: 0.6258
 epoch: 47, train_loss: 0.3035, test_loss: 1.8934, test_f1: 0.6111
 epoch: 48, train_loss: 0.2926, test_loss: 2.0782, test_f1: 0.6169
 epoch: 49, train_loss: 0.2727, test_loss: 2.2060, test_f1: 0.5932
 epoch: 50, train_loss: 0.2881, test_loss: 2.0959, test_f1: 0.5933
 epoch: 51, train_loss: 0.2551, test_loss: 2.0514, test_f1: 0.6140
 epoch: 52, train_loss: 0.2152, test_loss: 2.1975, test_f1: 0.6061
 epoch: 53, train_loss: 0.2122, test_loss: 2.1392, test_f1: 0.6070
 epoch: 54, train_loss: 0.2096, test_loss: 2.3577, test_f1: 0.6102
 epoch: 55, train_loss: 0.1888, test_loss: 2.1455, test_f1: 0.6206
 epoch: 56, train_loss: 0.2057, test_loss: 2.3592, test_f1: 0.5937
 epoch: 57, train_loss: 0.1948, test_loss: 2.3810, test_f1: 0.6110
 epoch: 58, train_loss: 0.2102, test_loss: 2.3873, test_f1: 0.6014
 epoch: 59, train_loss: 0.1989, test_loss: 2.5082, test_f1: 0.6057
 epoch: 60, train_loss: 0.1718, test_loss: 2.3907, test_f1: 0.5944
 epoch: 61, train_loss: 0.1611, test_loss: 2.5740, test_f1: 0.5900
 epoch: 62, train_loss: 0.1775, test_loss: 2.6617, test_f1: 0.6050
 epoch: 63, train_loss: 0.1749, test_loss: 2.6216, test_f1: 0.5956
 epoch: 64, train_loss: 0.1686, test_loss: 2.5926, test_f1: 0.6252
 epoch: 65, train_loss: 0.1727, test_loss: 2.8497, test_f1: 0.5847
 epoch: 66, train_loss: 0.1549, test_loss: 2.8035, test_f1: 0.6066
 epoch: 67, train_loss: 0.1687, test_loss: 2.8127, test_f1: 0.5945
 epoch: 68, train_loss: 0.2223, test_loss: 2.5978, test_f1: 0.6025
 epoch: 69, train_loss: 0.2177, test_loss: 2.7057, test_f1: 0.5968
 epoch: 70, train_loss: 0.1759, test_loss: 2.9222, test_f1: 0.5811
 epoch: 71, train_loss: 0.1860, test_loss: 2.7469, test_f1: 0.6193
 epoch: 72, train_loss: 0.1813, test_loss: 2.8447, test_f1: 0.6058
 epoch: 73, train_loss: 0.1620, test_loss: 3.0579, test_f1: 0.5961
 epoch: 74, train_loss: 0.1706, test_loss: 2.9401, test_f1: 0.6022
 epoch: 75, train_loss: 0.1498, test_loss: 3.1079, test_f1: 0.5881
 epoch: 76, train_loss: 0.1641, test_loss: 2.8870, test_f1: 0.5849
 epoch: 77, train_loss: 0.1553, test_loss: 3.0380, test_f1: 0.5857
 epoch: 78, train_loss: 0.1622, test_loss: 3.0851, test_f1: 0.5647
 epoch: 79, train_loss: 0.1687, test_loss: 2.9786, test_f1: 0.5894
 epoch: 80, train_loss: 0.1429, test_loss: 3.1808, test_f1: 0.5853
 epoch: 81, train_loss: 0.1696, test_loss: 2.9076, test_f1: 0.5986
 epoch: 82, train_loss: 0.1580, test_loss: 3.2834, test_f1: 0.5934
 epoch: 83, train_loss: 0.1311, test_loss: 2.9327, test_f1: 0.6083
 epoch: 84, train_loss: 0.1199, test_loss: 3.3316, test_f1: 0.5650
 epoch: 85, train_loss: 0.1427, test_loss: 3.2098, test_f1: 0.5877
 epoch: 86, train_loss: 0.1236, test_loss: 3.0829, test_f1: 0.6056
 epoch: 87, train_loss: 0.1339, test_loss: 3.3205, test_f1: 0.5790
 epoch: 88, train_loss: 0.1318, test_loss: 3.2501, test_f1: 0.5951
 epoch: 89, train_loss: 0.1552, test_loss: 3.2361, test_f1: 0.5844
 epoch: 90, train_loss: 0.1577, test_loss: 3.2726, test_f1: 0.5806
 epoch: 91, train_loss: 0.1658, test_loss: 3.1192, test_f1: 0.5760
 epoch: 92, train_loss: 0.1296, test_loss: 3.0838, test_f1: 0.5973
 epoch: 93, train_loss: 0.1205, test_loss: 3.3050, test_f1: 0.5784
 epoch: 94, train_loss: 0.1326, test_loss: 3.3367, test_f1: 0.6016
 epoch: 95, train_loss: 0.1342, test_loss: 3.3520, test_f1: 0.5841
 epoch: 96, train_loss: 0.1395, test_loss: 3.2444, test_f1: 0.5936
 epoch: 97, train_loss: 0.1320, test_loss: 3.3292, test_f1: 0.5844
 epoch: 98, train_loss: 0.1288, test_loss: 3.2781, test_f1: 0.6093
 epoch: 99, train_loss: 0.1302, test_loss: 3.4669, test_f1: 0.5960
##################ITERATION #4 ****************************************
 epoch: 0, train_loss: 1.2006, test_loss: 1.3885, test_f1: 0.2383
 epoch: 1, train_loss: 1.0260, test_loss: 1.2737, test_f1: 0.3715
 epoch: 2, train_loss: 0.9758, test_loss: 1.1206, test_f1: 0.4980
 epoch: 3, train_loss: 0.9274, test_loss: 1.0377, test_f1: 0.5282
 epoch: 4, train_loss: 0.9128, test_loss: 1.0684, test_f1: 0.5369
 epoch: 5, train_loss: 0.8904, test_loss: 1.0262, test_f1: 0.5232
 epoch: 6, train_loss: 0.8532, test_loss: 1.0288, test_f1: 0.5343
 epoch: 7, train_loss: 0.8487, test_loss: 0.9988, test_f1: 0.5758
 epoch: 8, train_loss: 0.8231, test_loss: 1.0202, test_f1: 0.6139
 epoch: 9, train_loss: 0.7885, test_loss: 1.0308, test_f1: 0.5399
 epoch: 10, train_loss: 0.7666, test_loss: 0.9522, test_f1: 0.5877
 epoch: 11, train_loss: 0.7422, test_loss: 1.0151, test_f1: 0.6181
 epoch: 12, train_loss: 0.7498, test_loss: 1.0044, test_f1: 0.5803
 epoch: 13, train_loss: 0.6939, test_loss: 1.0325, test_f1: 0.5943
 epoch: 14, train_loss: 0.7006, test_loss: 1.0967, test_f1: 0.6347
 epoch: 15, train_loss: 0.6756, test_loss: 1.0899, test_f1: 0.5878
 epoch: 16, train_loss: 0.6711, test_loss: 1.0441, test_f1: 0.5830
 epoch: 17, train_loss: 0.6360, test_loss: 1.0902, test_f1: 0.5996
 epoch: 18, train_loss: 0.6540, test_loss: 1.0931, test_f1: 0.6301
 epoch: 19, train_loss: 0.6297, test_loss: 1.0784, test_f1: 0.6398
 epoch: 20, train_loss: 0.6185, test_loss: 1.1041, test_f1: 0.6085
 epoch: 21, train_loss: 0.6248, test_loss: 1.1144, test_f1: 0.6627
 epoch: 22, train_loss: 0.6036, test_loss: 1.0943, test_f1: 0.6925
 epoch: 23, train_loss: 0.5795, test_loss: 1.1391, test_f1: 0.6376
 epoch: 24, train_loss: 0.5809, test_loss: 1.1696, test_f1: 0.6471
 epoch: 25, train_loss: 0.5725, test_loss: 1.2734, test_f1: 0.5368
 epoch: 26, train_loss: 0.5914, test_loss: 1.1160, test_f1: 0.5805
 epoch: 27, train_loss: 0.5690, test_loss: 1.1236, test_f1: 0.6579
 epoch: 28, train_loss: 0.5155, test_loss: 1.3359, test_f1: 0.6302
 epoch: 29, train_loss: 0.5103, test_loss: 1.2610, test_f1: 0.6038
 epoch: 30, train_loss: 0.5023, test_loss: 1.3303, test_f1: 0.6127
 epoch: 31, train_loss: 0.4855, test_loss: 1.3176, test_f1: 0.6237
 epoch: 32, train_loss: 0.4980, test_loss: 1.4076, test_f1: 0.5956
 epoch: 33, train_loss: 0.4595, test_loss: 1.2940, test_f1: 0.5992
 epoch: 34, train_loss: 0.4708, test_loss: 1.3716, test_f1: 0.6021
 epoch: 35, train_loss: 0.5165, test_loss: 1.2358, test_f1: 0.6304
 epoch: 36, train_loss: 0.4727, test_loss: 1.3886, test_f1: 0.5831
 epoch: 37, train_loss: 0.4683, test_loss: 1.4508, test_f1: 0.5777
 epoch: 38, train_loss: 0.4650, test_loss: 1.4829, test_f1: 0.6063
 epoch: 39, train_loss: 0.4521, test_loss: 1.3193, test_f1: 0.6658
 epoch: 40, train_loss: 0.4023, test_loss: 1.4761, test_f1: 0.6280
 epoch: 41, train_loss: 0.4104, test_loss: 1.6232, test_f1: 0.5888
 epoch: 42, train_loss: 0.4312, test_loss: 1.6481, test_f1: 0.6164
 epoch: 43, train_loss: 0.3950, test_loss: 1.3693, test_f1: 0.6281
 epoch: 44, train_loss: 0.3951, test_loss: 1.6389, test_f1: 0.6044
 epoch: 45, train_loss: 0.4269, test_loss: 1.5285, test_f1: 0.6172
 epoch: 46, train_loss: 0.4132, test_loss: 1.6594, test_f1: 0.6126
 epoch: 47, train_loss: 0.4351, test_loss: 1.6106, test_f1: 0.6178
 epoch: 48, train_loss: 0.3844, test_loss: 1.6622, test_f1: 0.6122
 epoch: 49, train_loss: 0.3564, test_loss: 1.5535, test_f1: 0.6207
 epoch: 50, train_loss: 0.3553, test_loss: 1.6906, test_f1: 0.6401
 epoch: 51, train_loss: 0.3028, test_loss: 1.7537, test_f1: 0.6351
 epoch: 52, train_loss: 0.3085, test_loss: 1.9362, test_f1: 0.6114
 epoch: 53, train_loss: 0.2921, test_loss: 1.9069, test_f1: 0.6114
 epoch: 54, train_loss: 0.2915, test_loss: 1.8877, test_f1: 0.6017
 epoch: 55, train_loss: 0.2738, test_loss: 1.8933, test_f1: 0.6278
 epoch: 56, train_loss: 0.2514, test_loss: 2.0338, test_f1: 0.6171
 epoch: 57, train_loss: 0.2586, test_loss: 2.0580, test_f1: 0.6183
 epoch: 58, train_loss: 0.2456, test_loss: 2.1083, test_f1: 0.6253
 epoch: 59, train_loss: 0.2267, test_loss: 2.0858, test_f1: 0.6119
 epoch: 60, train_loss: 0.2510, test_loss: 2.1344, test_f1: 0.6114
 epoch: 61, train_loss: 0.2554, test_loss: 2.0733, test_f1: 0.6234
 epoch: 62, train_loss: 0.2455, test_loss: 2.0319, test_f1: 0.6152
 epoch: 63, train_loss: 0.2370, test_loss: 2.0818, test_f1: 0.6143
 epoch: 64, train_loss: 0.2380, test_loss: 2.1631, test_f1: 0.6286
 epoch: 65, train_loss: 0.2166, test_loss: 2.0830, test_f1: 0.5967
 epoch: 66, train_loss: 0.2203, test_loss: 2.2916, test_f1: 0.6050
 epoch: 67, train_loss: 0.1988, test_loss: 2.1940, test_f1: 0.6000
 epoch: 68, train_loss: 0.2291, test_loss: 2.3648, test_f1: 0.6182
 epoch: 69, train_loss: 0.1995, test_loss: 2.2125, test_f1: 0.6052
 epoch: 70, train_loss: 0.1894, test_loss: 2.2287, test_f1: 0.6205
 epoch: 71, train_loss: 0.2060, test_loss: 2.4554, test_f1: 0.5712
 epoch: 72, train_loss: 0.1885, test_loss: 2.3521, test_f1: 0.5876
 epoch: 73, train_loss: 0.2095, test_loss: 2.2924, test_f1: 0.6222
 epoch: 74, train_loss: 0.2185, test_loss: 2.4816, test_f1: 0.5980
 epoch: 75, train_loss: 0.1998, test_loss: 2.3188, test_f1: 0.5944
 epoch: 76, train_loss: 0.1922, test_loss: 2.3163, test_f1: 0.6022
 epoch: 77, train_loss: 0.2043, test_loss: 2.3694, test_f1: 0.5963
 epoch: 78, train_loss: 0.1927, test_loss: 2.4507, test_f1: 0.6023
 epoch: 79, train_loss: 0.1851, test_loss: 2.3393, test_f1: 0.6126
 epoch: 80, train_loss: 0.1947, test_loss: 2.5498, test_f1: 0.5697
 epoch: 81, train_loss: 0.1917, test_loss: 2.4002, test_f1: 0.6136
 epoch: 82, train_loss: 0.1735, test_loss: 2.5898, test_f1: 0.5954
 epoch: 83, train_loss: 0.1988, test_loss: 2.5476, test_f1: 0.5837
 epoch: 84, train_loss: 0.1779, test_loss: 2.5584, test_f1: 0.6055
 epoch: 85, train_loss: 0.1969, test_loss: 2.5084, test_f1: 0.5953
 epoch: 86, train_loss: 0.2028, test_loss: 2.5034, test_f1: 0.5988
 epoch: 87, train_loss: 0.1798, test_loss: 2.5274, test_f1: 0.5675
 epoch: 88, train_loss: 0.1840, test_loss: 2.6060, test_f1: 0.6000
 epoch: 89, train_loss: 0.1423, test_loss: 2.7785, test_f1: 0.6012
 epoch: 90, train_loss: 0.1756, test_loss: 2.4024, test_f1: 0.6377
 epoch: 91, train_loss: 0.1635, test_loss: 2.6897, test_f1: 0.6011
 epoch: 92, train_loss: 0.2025, test_loss: 2.6310, test_f1: 0.6112
 epoch: 93, train_loss: 0.1542, test_loss: 2.6833, test_f1: 0.6280
 epoch: 94, train_loss: 0.1499, test_loss: 2.7934, test_f1: 0.6086
 epoch: 95, train_loss: 0.1433, test_loss: 2.9474, test_f1: 0.6028
 epoch: 96, train_loss: 0.1581, test_loss: 2.6988, test_f1: 0.6169
 epoch: 97, train_loss: 0.1444, test_loss: 2.7713, test_f1: 0.5917
 epoch: 98, train_loss: 0.1370, test_loss: 2.8672, test_f1: 0.5848
 epoch: 99, train_loss: 0.1696, test_loss: 2.7679, test_f1: 0.5902
##################ITERATION #5 ****************************************
 epoch: 0, train_loss: 1.2399, test_loss: 1.4391, test_f1: 0.1365
 epoch: 1, train_loss: 1.0215, test_loss: 1.2680, test_f1: 0.2422
 epoch: 2, train_loss: 0.9827, test_loss: 1.1015, test_f1: 0.4441
 epoch: 3, train_loss: 0.9076, test_loss: 1.0469, test_f1: 0.5582
 epoch: 4, train_loss: 0.9069, test_loss: 1.0241, test_f1: 0.5394
 epoch: 5, train_loss: 0.8603, test_loss: 1.1236, test_f1: 0.5250
 epoch: 6, train_loss: 0.8270, test_loss: 1.1000, test_f1: 0.5442
 epoch: 7, train_loss: 0.7980, test_loss: 1.1005, test_f1: 0.5106
 epoch: 8, train_loss: 0.7886, test_loss: 1.0986, test_f1: 0.5945
 epoch: 9, train_loss: 0.7485, test_loss: 1.1355, test_f1: 0.5726
 epoch: 10, train_loss: 0.6954, test_loss: 1.0828, test_f1: 0.5813
 epoch: 11, train_loss: 0.7132, test_loss: 1.1065, test_f1: 0.5973
 epoch: 12, train_loss: 0.6960, test_loss: 1.1351, test_f1: 0.5437
 epoch: 13, train_loss: 0.7255, test_loss: 1.1064, test_f1: 0.5648
 epoch: 14, train_loss: 0.6645, test_loss: 1.1099, test_f1: 0.5941
 epoch: 15, train_loss: 0.6786, test_loss: 1.1247, test_f1: 0.5679
 epoch: 16, train_loss: 0.6478, test_loss: 1.1280, test_f1: 0.5836
 epoch: 17, train_loss: 0.6219, test_loss: 1.2123, test_f1: 0.5879
 epoch: 18, train_loss: 0.5849, test_loss: 1.2385, test_f1: 0.5629
 epoch: 19, train_loss: 0.6109, test_loss: 1.1322, test_f1: 0.5814
 epoch: 20, train_loss: 0.5715, test_loss: 1.4376, test_f1: 0.6023
 epoch: 21, train_loss: 0.5481, test_loss: 1.2967, test_f1: 0.5709
 epoch: 22, train_loss: 0.5503, test_loss: 1.3166, test_f1: 0.5933
 epoch: 23, train_loss: 0.5451, test_loss: 1.5389, test_f1: 0.5938
 epoch: 24, train_loss: 0.5343, test_loss: 1.3653, test_f1: 0.5942
 epoch: 25, train_loss: 0.5465, test_loss: 1.3500, test_f1: 0.5963
 epoch: 26, train_loss: 0.5153, test_loss: 1.3530, test_f1: 0.5888
 epoch: 27, train_loss: 0.5144, test_loss: 1.2333, test_f1: 0.5940
 epoch: 28, train_loss: 0.4794, test_loss: 1.3307, test_f1: 0.6109
 epoch: 29, train_loss: 0.4761, test_loss: 1.3873, test_f1: 0.5764
 epoch: 30, train_loss: 0.4688, test_loss: 1.4550, test_f1: 0.6341
 epoch: 31, train_loss: 0.4462, test_loss: 1.4505, test_f1: 0.6054
 epoch: 32, train_loss: 0.4474, test_loss: 1.4127, test_f1: 0.6207
 epoch: 33, train_loss: 0.4554, test_loss: 1.5071, test_f1: 0.5554
 epoch: 34, train_loss: 0.4059, test_loss: 1.6254, test_f1: 0.6217
 epoch: 35, train_loss: 0.4423, test_loss: 1.5505, test_f1: 0.5970
 epoch: 36, train_loss: 0.4467, test_loss: 1.7299, test_f1: 0.5993
 epoch: 37, train_loss: 0.4064, test_loss: 1.6026, test_f1: 0.6297
 epoch: 38, train_loss: 0.4186, test_loss: 1.8228, test_f1: 0.5720
 epoch: 39, train_loss: 0.4305, test_loss: 1.5003, test_f1: 0.6109
 epoch: 40, train_loss: 0.3892, test_loss: 1.6412, test_f1: 0.6203
 epoch: 41, train_loss: 0.3773, test_loss: 1.8434, test_f1: 0.5827
 epoch: 42, train_loss: 0.4142, test_loss: 1.7730, test_f1: 0.5944
 epoch: 43, train_loss: 0.3472, test_loss: 1.8278, test_f1: 0.5979
 epoch: 44, train_loss: 0.3707, test_loss: 1.7745, test_f1: 0.6242
 epoch: 45, train_loss: 0.3678, test_loss: 1.7714, test_f1: 0.6265
 epoch: 46, train_loss: 0.3225, test_loss: 1.7733, test_f1: 0.5781
 epoch: 47, train_loss: 0.3245, test_loss: 2.0920, test_f1: 0.5659
 epoch: 48, train_loss: 0.3234, test_loss: 1.9785, test_f1: 0.6221
 epoch: 49, train_loss: 0.3407, test_loss: 1.9503, test_f1: 0.5794
 epoch: 50, train_loss: 0.3423, test_loss: 1.9057, test_f1: 0.6413
 epoch: 51, train_loss: 0.2607, test_loss: 1.9199, test_f1: 0.6154
 epoch: 52, train_loss: 0.2293, test_loss: 1.9521, test_f1: 0.6276
 epoch: 53, train_loss: 0.2197, test_loss: 2.0641, test_f1: 0.6245
 epoch: 54, train_loss: 0.2213, test_loss: 2.1272, test_f1: 0.6141
 epoch: 55, train_loss: 0.1930, test_loss: 2.3261, test_f1: 0.6173
 epoch: 56, train_loss: 0.1998, test_loss: 2.3053, test_f1: 0.5884
 epoch: 57, train_loss: 0.2061, test_loss: 2.1435, test_f1: 0.6181
 epoch: 58, train_loss: 0.2071, test_loss: 2.3217, test_f1: 0.6084
 epoch: 59, train_loss: 0.2441, test_loss: 2.2842, test_f1: 0.6317
 epoch: 60, train_loss: 0.2177, test_loss: 2.2674, test_f1: 0.6157
 epoch: 61, train_loss: 0.2127, test_loss: 2.3895, test_f1: 0.6233
 epoch: 62, train_loss: 0.1919, test_loss: 2.2418, test_f1: 0.6357
 epoch: 63, train_loss: 0.1987, test_loss: 2.5278, test_f1: 0.5953
 epoch: 64, train_loss: 0.2097, test_loss: 2.2557, test_f1: 0.6458
 epoch: 65, train_loss: 0.1951, test_loss: 2.5189, test_f1: 0.6112
 epoch: 66, train_loss: 0.1820, test_loss: 2.2646, test_f1: 0.6198
 epoch: 67, train_loss: 0.1839, test_loss: 2.4145, test_f1: 0.6103
 epoch: 68, train_loss: 0.1945, test_loss: 2.4410, test_f1: 0.6254
 epoch: 69, train_loss: 0.1592, test_loss: 2.4720, test_f1: 0.6187
 epoch: 70, train_loss: 0.1650, test_loss: 2.5779, test_f1: 0.6212
 epoch: 71, train_loss: 0.1524, test_loss: 2.6344, test_f1: 0.6086
 epoch: 72, train_loss: 0.1820, test_loss: 2.5188, test_f1: 0.6215
 epoch: 73, train_loss: 0.1765, test_loss: 2.6176, test_f1: 0.6125
 epoch: 74, train_loss: 0.1582, test_loss: 2.7225, test_f1: 0.6207
 epoch: 75, train_loss: 0.1422, test_loss: 2.8929, test_f1: 0.5906
 epoch: 76, train_loss: 0.1428, test_loss: 2.7804, test_f1: 0.5996
 epoch: 77, train_loss: 0.1625, test_loss: 2.7438, test_f1: 0.6284
 epoch: 78, train_loss: 0.1668, test_loss: 2.9195, test_f1: 0.5922
 epoch: 79, train_loss: 0.1610, test_loss: 2.8739, test_f1: 0.5953
 epoch: 80, train_loss: 0.1547, test_loss: 2.9182, test_f1: 0.5928
 epoch: 81, train_loss: 0.1435, test_loss: 2.7126, test_f1: 0.6374
 epoch: 82, train_loss: 0.1437, test_loss: 2.8523, test_f1: 0.6197
 epoch: 83, train_loss: 0.1398, test_loss: 3.0069, test_f1: 0.5993
 epoch: 84, train_loss: 0.1331, test_loss: 3.0498, test_f1: 0.5934
 epoch: 85, train_loss: 0.1235, test_loss: 3.0335, test_f1: 0.6064
 epoch: 86, train_loss: 0.1221, test_loss: 3.1373, test_f1: 0.5914
 epoch: 87, train_loss: 0.1329, test_loss: 3.0905, test_f1: 0.5927
 epoch: 88, train_loss: 0.1679, test_loss: 3.0342, test_f1: 0.5989
 epoch: 89, train_loss: 0.1433, test_loss: 3.1235, test_f1: 0.5728
 epoch: 90, train_loss: 0.1392, test_loss: 2.8599, test_f1: 0.6076
 epoch: 91, train_loss: 0.1149, test_loss: 3.0326, test_f1: 0.6187
 epoch: 92, train_loss: 0.1129, test_loss: 2.9945, test_f1: 0.6316
 epoch: 93, train_loss: 0.1267, test_loss: 3.0036, test_f1: 0.6011
 epoch: 94, train_loss: 0.1421, test_loss: 3.1199, test_f1: 0.5825
 epoch: 95, train_loss: 0.1159, test_loss: 3.0874, test_f1: 0.5930
 epoch: 96, train_loss: 0.1177, test_loss: 3.2160, test_f1: 0.5848
 epoch: 97, train_loss: 0.1375, test_loss: 2.9381, test_f1: 0.6334
 epoch: 98, train_loss: 0.1158, test_loss: 3.0687, test_f1: 0.6261
 epoch: 99, train_loss: 0.1161, test_loss: 3.0716, test_f1: 0.6207
##################ITERATION #6 ****************************************
 epoch: 0, train_loss: 1.3245, test_loss: 1.3633, test_f1: 0.1365
 epoch: 1, train_loss: 1.1020, test_loss: 1.4645, test_f1: 0.2488
 epoch: 2, train_loss: 1.0031, test_loss: 1.1053, test_f1: 0.4090
 epoch: 3, train_loss: 0.9640, test_loss: 1.0850, test_f1: 0.5181
 epoch: 4, train_loss: 0.9206, test_loss: 1.0693, test_f1: 0.5057
 epoch: 5, train_loss: 0.8964, test_loss: 1.0315, test_f1: 0.5574
 epoch: 6, train_loss: 0.8726, test_loss: 1.0277, test_f1: 0.5528
 epoch: 7, train_loss: 0.8742, test_loss: 1.0436, test_f1: 0.5266
 epoch: 8, train_loss: 0.8344, test_loss: 1.0106, test_f1: 0.5726
 epoch: 9, train_loss: 0.8130, test_loss: 1.0480, test_f1: 0.5447
 epoch: 10, train_loss: 0.7999, test_loss: 1.0711, test_f1: 0.5612
 epoch: 11, train_loss: 0.7915, test_loss: 1.0335, test_f1: 0.5979
 epoch: 12, train_loss: 0.7764, test_loss: 1.0455, test_f1: 0.5825
 epoch: 13, train_loss: 0.7343, test_loss: 1.0276, test_f1: 0.6037
 epoch: 14, train_loss: 0.7199, test_loss: 1.0422, test_f1: 0.6119
 epoch: 15, train_loss: 0.7024, test_loss: 1.1827, test_f1: 0.5702
 epoch: 16, train_loss: 0.7034, test_loss: 1.1694, test_f1: 0.5165
 epoch: 17, train_loss: 0.6896, test_loss: 1.0883, test_f1: 0.6232
 epoch: 18, train_loss: 0.6788, test_loss: 1.0943, test_f1: 0.6079
 epoch: 19, train_loss: 0.6595, test_loss: 1.1957, test_f1: 0.5899
 epoch: 20, train_loss: 0.6507, test_loss: 1.1087, test_f1: 0.6347
 epoch: 21, train_loss: 0.6670, test_loss: 1.1958, test_f1: 0.6052
 epoch: 22, train_loss: 0.6221, test_loss: 1.1560, test_f1: 0.5898
 epoch: 23, train_loss: 0.5923, test_loss: 1.1807, test_f1: 0.5984
 epoch: 24, train_loss: 0.6152, test_loss: 1.1799, test_f1: 0.6341
 epoch: 25, train_loss: 0.5919, test_loss: 1.1625, test_f1: 0.6115
 epoch: 26, train_loss: 0.5862, test_loss: 1.1762, test_f1: 0.6394
 epoch: 27, train_loss: 0.5720, test_loss: 1.2029, test_f1: 0.6314
 epoch: 28, train_loss: 0.5233, test_loss: 1.1946, test_f1: 0.6405
 epoch: 29, train_loss: 0.5391, test_loss: 1.2531, test_f1: 0.6055
 epoch: 30, train_loss: 0.5199, test_loss: 1.2539, test_f1: 0.6599
 epoch: 31, train_loss: 0.5173, test_loss: 1.3421, test_f1: 0.6116
 epoch: 32, train_loss: 0.5187, test_loss: 1.3206, test_f1: 0.6125
 epoch: 33, train_loss: 0.5301, test_loss: 1.2309, test_f1: 0.6422
 epoch: 34, train_loss: 0.4865, test_loss: 1.4026, test_f1: 0.5467
 epoch: 35, train_loss: 0.4998, test_loss: 1.3080, test_f1: 0.6708
 epoch: 36, train_loss: 0.4971, test_loss: 1.3627, test_f1: 0.6129
 epoch: 37, train_loss: 0.4714, test_loss: 1.4690, test_f1: 0.6087
 epoch: 38, train_loss: 0.4795, test_loss: 1.3436, test_f1: 0.6187
 epoch: 39, train_loss: 0.4632, test_loss: 1.3715, test_f1: 0.6400
 epoch: 40, train_loss: 0.4611, test_loss: 1.5036, test_f1: 0.5990
 epoch: 41, train_loss: 0.4508, test_loss: 1.2906, test_f1: 0.6426
 epoch: 42, train_loss: 0.4552, test_loss: 1.4385, test_f1: 0.6149
 epoch: 43, train_loss: 0.4343, test_loss: 1.4153, test_f1: 0.6330
 epoch: 44, train_loss: 0.4172, test_loss: 1.4571, test_f1: 0.5974
 epoch: 45, train_loss: 0.4065, test_loss: 1.4852, test_f1: 0.6282
 epoch: 46, train_loss: 0.3816, test_loss: 1.5600, test_f1: 0.6442
 epoch: 47, train_loss: 0.3990, test_loss: 1.6697, test_f1: 0.5791
 epoch: 48, train_loss: 0.4289, test_loss: 1.5463, test_f1: 0.5801
 epoch: 49, train_loss: 0.3920, test_loss: 1.5667, test_f1: 0.6246
 epoch: 50, train_loss: 0.4122, test_loss: 1.5813, test_f1: 0.5905
 epoch: 51, train_loss: 0.3464, test_loss: 1.5301, test_f1: 0.6300
 epoch: 52, train_loss: 0.3310, test_loss: 1.6205, test_f1: 0.6270
 epoch: 53, train_loss: 0.3281, test_loss: 1.5877, test_f1: 0.6355
 epoch: 54, train_loss: 0.3184, test_loss: 1.7519, test_f1: 0.6254
 epoch: 55, train_loss: 0.2671, test_loss: 1.7869, test_f1: 0.6359
 epoch: 56, train_loss: 0.2864, test_loss: 1.7685, test_f1: 0.6204
 epoch: 57, train_loss: 0.2750, test_loss: 1.8097, test_f1: 0.6232
 epoch: 58, train_loss: 0.2619, test_loss: 1.8172, test_f1: 0.6295
 epoch: 59, train_loss: 0.2652, test_loss: 1.8717, test_f1: 0.6277
 epoch: 60, train_loss: 0.2804, test_loss: 1.8593, test_f1: 0.6361
 epoch: 61, train_loss: 0.2467, test_loss: 1.9272, test_f1: 0.6164
 epoch: 62, train_loss: 0.2686, test_loss: 1.8730, test_f1: 0.5924
 epoch: 63, train_loss: 0.2526, test_loss: 1.9746, test_f1: 0.6131
 epoch: 64, train_loss: 0.2386, test_loss: 1.8723, test_f1: 0.6090
 epoch: 65, train_loss: 0.2325, test_loss: 1.9972, test_f1: 0.5891
 epoch: 66, train_loss: 0.2495, test_loss: 1.9576, test_f1: 0.6319
 epoch: 67, train_loss: 0.2558, test_loss: 1.8539, test_f1: 0.6145
 epoch: 68, train_loss: 0.2546, test_loss: 2.0892, test_f1: 0.6403
 epoch: 69, train_loss: 0.2516, test_loss: 1.9316, test_f1: 0.6271
 epoch: 70, train_loss: 0.2445, test_loss: 1.9306, test_f1: 0.6196
 epoch: 71, train_loss: 0.2241, test_loss: 2.1961, test_f1: 0.6103
 epoch: 72, train_loss: 0.2304, test_loss: 2.0526, test_f1: 0.6261
 epoch: 73, train_loss: 0.2229, test_loss: 2.1175, test_f1: 0.6234
 epoch: 74, train_loss: 0.2261, test_loss: 2.0543, test_f1: 0.6235
 epoch: 75, train_loss: 0.2461, test_loss: 2.1902, test_f1: 0.6088
 epoch: 76, train_loss: 0.2339, test_loss: 2.0929, test_f1: 0.6023
 epoch: 77, train_loss: 0.2087, test_loss: 2.1383, test_f1: 0.6191
 epoch: 78, train_loss: 0.2155, test_loss: 2.1039, test_f1: 0.6104
 epoch: 79, train_loss: 0.2044, test_loss: 2.2919, test_f1: 0.6351
 epoch: 80, train_loss: 0.2252, test_loss: 2.1935, test_f1: 0.6113
 epoch: 81, train_loss: 0.2390, test_loss: 2.1622, test_f1: 0.6357
 epoch: 82, train_loss: 0.2097, test_loss: 2.1392, test_f1: 0.6056
 epoch: 83, train_loss: 0.1935, test_loss: 2.2650, test_f1: 0.6297
 epoch: 84, train_loss: 0.1920, test_loss: 2.2400, test_f1: 0.6127
 epoch: 85, train_loss: 0.1995, test_loss: 2.3193, test_f1: 0.6148
 epoch: 86, train_loss: 0.2040, test_loss: 2.3286, test_f1: 0.6250
 epoch: 87, train_loss: 0.1967, test_loss: 2.1971, test_f1: 0.6086
 epoch: 88, train_loss: 0.2103, test_loss: 2.3314, test_f1: 0.6056
 epoch: 89, train_loss: 0.2192, test_loss: 2.3505, test_f1: 0.5964
 epoch: 90, train_loss: 0.2823, test_loss: 2.3263, test_f1: 0.6083
 epoch: 91, train_loss: 0.2033, test_loss: 2.3545, test_f1: 0.6259
 epoch: 92, train_loss: 0.2116, test_loss: 2.4213, test_f1: 0.6057
 epoch: 93, train_loss: 0.1689, test_loss: 2.2977, test_f1: 0.5993
 epoch: 94, train_loss: 0.2022, test_loss: 2.3900, test_f1: 0.6136
 epoch: 95, train_loss: 0.1839, test_loss: 2.3454, test_f1: 0.6195
 epoch: 96, train_loss: 0.1959, test_loss: 2.3773, test_f1: 0.5771
 epoch: 97, train_loss: 0.1598, test_loss: 2.4193, test_f1: 0.6166
 epoch: 98, train_loss: 0.1583, test_loss: 2.5625, test_f1: 0.5935
 epoch: 99, train_loss: 0.1599, test_loss: 2.4752, test_f1: 0.6231
##################ITERATION #7 ****************************************
 epoch: 0, train_loss: 1.4068, test_loss: 1.5452, test_f1: 0.1365
 epoch: 1, train_loss: 1.0723, test_loss: 1.4778, test_f1: 0.2622
 epoch: 2, train_loss: 0.9890, test_loss: 1.0982, test_f1: 0.4270
 epoch: 3, train_loss: 0.9732, test_loss: 1.0940, test_f1: 0.5065
 epoch: 4, train_loss: 0.9182, test_loss: 1.0406, test_f1: 0.4858
 epoch: 5, train_loss: 0.8693, test_loss: 1.0820, test_f1: 0.4853
 epoch: 6, train_loss: 0.8737, test_loss: 1.0756, test_f1: 0.4815
 epoch: 7, train_loss: 0.8552, test_loss: 1.0254, test_f1: 0.5816
 epoch: 8, train_loss: 0.8323, test_loss: 1.0261, test_f1: 0.5977
 epoch: 9, train_loss: 0.7823, test_loss: 0.9876, test_f1: 0.5950
 epoch: 10, train_loss: 0.7564, test_loss: 1.0697, test_f1: 0.6146
 epoch: 11, train_loss: 0.7490, test_loss: 1.0330, test_f1: 0.6148
 epoch: 12, train_loss: 0.7057, test_loss: 1.0480, test_f1: 0.5618
 epoch: 13, train_loss: 0.6966, test_loss: 1.0801, test_f1: 0.5905
 epoch: 14, train_loss: 0.6482, test_loss: 1.1845, test_f1: 0.5773
 epoch: 15, train_loss: 0.6328, test_loss: 1.1401, test_f1: 0.5843
 epoch: 16, train_loss: 0.6376, test_loss: 1.1224, test_f1: 0.5901
 epoch: 17, train_loss: 0.6333, test_loss: 1.1356, test_f1: 0.5978
 epoch: 18, train_loss: 0.6019, test_loss: 1.2571, test_f1: 0.5549
 epoch: 19, train_loss: 0.6002, test_loss: 1.2614, test_f1: 0.5098
 epoch: 20, train_loss: 0.6038, test_loss: 1.2742, test_f1: 0.5609
 epoch: 21, train_loss: 0.5893, test_loss: 1.3188, test_f1: 0.5324
 epoch: 22, train_loss: 0.5782, test_loss: 1.3199, test_f1: 0.5627
 epoch: 23, train_loss: 0.5479, test_loss: 1.3520, test_f1: 0.5530
 epoch: 24, train_loss: 0.5449, test_loss: 1.2169, test_f1: 0.6049
 epoch: 25, train_loss: 0.5058, test_loss: 1.3649, test_f1: 0.5997
 epoch: 26, train_loss: 0.5036, test_loss: 1.4392, test_f1: 0.5352
 epoch: 27, train_loss: 0.5122, test_loss: 1.4659, test_f1: 0.5640
 epoch: 28, train_loss: 0.4639, test_loss: 1.4128, test_f1: 0.5801
 epoch: 29, train_loss: 0.4439, test_loss: 1.4695, test_f1: 0.5885
 epoch: 30, train_loss: 0.4667, test_loss: 1.4186, test_f1: 0.5964
 epoch: 31, train_loss: 0.4689, test_loss: 1.5940, test_f1: 0.5528
 epoch: 32, train_loss: 0.4647, test_loss: 1.4751, test_f1: 0.5847
 epoch: 33, train_loss: 0.4525, test_loss: 1.5456, test_f1: 0.5913
 epoch: 34, train_loss: 0.4525, test_loss: 1.6507, test_f1: 0.5440
 epoch: 35, train_loss: 0.4301, test_loss: 1.5292, test_f1: 0.5701
 epoch: 36, train_loss: 0.4257, test_loss: 1.5465, test_f1: 0.5505
 epoch: 37, train_loss: 0.4069, test_loss: 1.5760, test_f1: 0.5851
 epoch: 38, train_loss: 0.3948, test_loss: 1.6186, test_f1: 0.5863
 epoch: 39, train_loss: 0.3840, test_loss: 1.7394, test_f1: 0.5539
 epoch: 40, train_loss: 0.3312, test_loss: 1.8782, test_f1: 0.5630
 epoch: 41, train_loss: 0.3661, test_loss: 1.8401, test_f1: 0.5861
 epoch: 42, train_loss: 0.3447, test_loss: 2.1081, test_f1: 0.5351
 epoch: 43, train_loss: 0.3497, test_loss: 1.9229, test_f1: 0.5536
 epoch: 44, train_loss: 0.3829, test_loss: 1.8573, test_f1: 0.5989
 epoch: 45, train_loss: 0.3471, test_loss: 1.9197, test_f1: 0.5468
 epoch: 46, train_loss: 0.3150, test_loss: 1.8649, test_f1: 0.5638
 epoch: 47, train_loss: 0.3153, test_loss: 1.9066, test_f1: 0.5069
 epoch: 48, train_loss: 0.3064, test_loss: 1.9600, test_f1: 0.5643
 epoch: 49, train_loss: 0.3009, test_loss: 1.9290, test_f1: 0.5660
 epoch: 50, train_loss: 0.3093, test_loss: 1.9046, test_f1: 0.5845
 epoch: 51, train_loss: 0.2789, test_loss: 2.0040, test_f1: 0.5631
 epoch: 52, train_loss: 0.2149, test_loss: 2.0566, test_f1: 0.5769
 epoch: 53, train_loss: 0.2412, test_loss: 2.1537, test_f1: 0.5453
 epoch: 54, train_loss: 0.2099, test_loss: 2.2014, test_f1: 0.5811
 epoch: 55, train_loss: 0.1947, test_loss: 2.2136, test_f1: 0.5551
 epoch: 56, train_loss: 0.1876, test_loss: 2.1669, test_f1: 0.5482
 epoch: 57, train_loss: 0.1982, test_loss: 2.1770, test_f1: 0.5680
 epoch: 58, train_loss: 0.1900, test_loss: 2.3858, test_f1: 0.5898
 epoch: 59, train_loss: 0.1965, test_loss: 2.3117, test_f1: 0.5744
 epoch: 60, train_loss: 0.2175, test_loss: 2.2809, test_f1: 0.5935
 epoch: 61, train_loss: 0.1875, test_loss: 2.2375, test_f1: 0.5844
 epoch: 62, train_loss: 0.1964, test_loss: 2.2627, test_f1: 0.5769
 epoch: 63, train_loss: 0.1725, test_loss: 2.3534, test_f1: 0.6048
 epoch: 64, train_loss: 0.1756, test_loss: 2.4478, test_f1: 0.6027
 epoch: 65, train_loss: 0.1632, test_loss: 2.3450, test_f1: 0.5609
 epoch: 66, train_loss: 0.1969, test_loss: 2.5938, test_f1: 0.5893
 epoch: 67, train_loss: 0.1955, test_loss: 2.3202, test_f1: 0.5792
 epoch: 68, train_loss: 0.1915, test_loss: 2.4076, test_f1: 0.5685
 epoch: 69, train_loss: 0.1915, test_loss: 2.4057, test_f1: 0.5790
 epoch: 70, train_loss: 0.2053, test_loss: 2.4778, test_f1: 0.5875
 epoch: 71, train_loss: 0.1694, test_loss: 2.4854, test_f1: 0.5853
 epoch: 72, train_loss: 0.1704, test_loss: 2.5044, test_f1: 0.5577
 epoch: 73, train_loss: 0.1644, test_loss: 2.5006, test_f1: 0.5889
 epoch: 74, train_loss: 0.1364, test_loss: 2.5708, test_f1: 0.5874
 epoch: 75, train_loss: 0.1716, test_loss: 2.5583, test_f1: 0.5813
 epoch: 76, train_loss: 0.1781, test_loss: 2.6265, test_f1: 0.5395
 epoch: 77, train_loss: 0.1727, test_loss: 2.7731, test_f1: 0.5444
 epoch: 78, train_loss: 0.1863, test_loss: 2.8284, test_f1: 0.5527
 epoch: 79, train_loss: 0.1674, test_loss: 2.7273, test_f1: 0.5675
 epoch: 80, train_loss: 0.1694, test_loss: 2.7217, test_f1: 0.6074
 epoch: 81, train_loss: 0.1456, test_loss: 2.5726, test_f1: 0.5708
 epoch: 82, train_loss: 0.1679, test_loss: 2.7358, test_f1: 0.5815
 epoch: 83, train_loss: 0.1492, test_loss: 2.8576, test_f1: 0.5572
 epoch: 84, train_loss: 0.1314, test_loss: 2.5700, test_f1: 0.5859
 epoch: 85, train_loss: 0.1364, test_loss: 2.8694, test_f1: 0.5989
 epoch: 86, train_loss: 0.1502, test_loss: 2.7192, test_f1: 0.5745
 epoch: 87, train_loss: 0.1240, test_loss: 2.8538, test_f1: 0.5695
 epoch: 88, train_loss: 0.1389, test_loss: 2.8741, test_f1: 0.6086
 epoch: 89, train_loss: 0.1633, test_loss: 2.8507, test_f1: 0.5604
 epoch: 90, train_loss: 0.1319, test_loss: 3.1116, test_f1: 0.5778
 epoch: 91, train_loss: 0.1343, test_loss: 3.1363, test_f1: 0.5523
 epoch: 92, train_loss: 0.1382, test_loss: 2.7676, test_f1: 0.6018
 epoch: 93, train_loss: 0.1474, test_loss: 2.9438, test_f1: 0.5726
 epoch: 94, train_loss: 0.1409, test_loss: 2.9793, test_f1: 0.5708
 epoch: 95, train_loss: 0.1983, test_loss: 2.9364, test_f1: 0.5991
 epoch: 96, train_loss: 0.1585, test_loss: 2.9148, test_f1: 0.5896
 epoch: 97, train_loss: 0.1256, test_loss: 2.9440, test_f1: 0.5687
 epoch: 98, train_loss: 0.1437, test_loss: 2.9993, test_f1: 0.5676
 epoch: 99, train_loss: 0.1379, test_loss: 2.9593, test_f1: 0.6031
##################ITERATION #8 ****************************************
 epoch: 0, train_loss: 1.4122, test_loss: 1.4026, test_f1: 0.2281
 epoch: 1, train_loss: 1.1318, test_loss: 1.2590, test_f1: 0.3978
 epoch: 2, train_loss: 1.0512, test_loss: 1.1392, test_f1: 0.4326
 epoch: 3, train_loss: 0.9893, test_loss: 1.1190, test_f1: 0.4827
 epoch: 4, train_loss: 0.9558, test_loss: 1.0391, test_f1: 0.5552
 epoch: 5, train_loss: 0.9258, test_loss: 1.0764, test_f1: 0.5165
 epoch: 6, train_loss: 0.8828, test_loss: 1.0561, test_f1: 0.5653
 epoch: 7, train_loss: 0.8443, test_loss: 1.1037, test_f1: 0.5284
 epoch: 8, train_loss: 0.8330, test_loss: 1.0794, test_f1: 0.5325
 epoch: 9, train_loss: 0.8185, test_loss: 1.0584, test_f1: 0.5589
 epoch: 10, train_loss: 0.7670, test_loss: 1.1455, test_f1: 0.5183
 epoch: 11, train_loss: 0.7927, test_loss: 1.0898, test_f1: 0.5976
 epoch: 12, train_loss: 0.7680, test_loss: 1.0962, test_f1: 0.5829
 epoch: 13, train_loss: 0.7588, test_loss: 1.0714, test_f1: 0.5824
 epoch: 14, train_loss: 0.7292, test_loss: 1.0318, test_f1: 0.5929
 epoch: 15, train_loss: 0.6994, test_loss: 1.1499, test_f1: 0.5894
 epoch: 16, train_loss: 0.6886, test_loss: 1.0753, test_f1: 0.5867
 epoch: 17, train_loss: 0.6689, test_loss: 1.1526, test_f1: 0.5765
 epoch: 18, train_loss: 0.6806, test_loss: 1.0613, test_f1: 0.5884
 epoch: 19, train_loss: 0.6312, test_loss: 1.2058, test_f1: 0.5668
 epoch: 20, train_loss: 0.6343, test_loss: 1.1695, test_f1: 0.5748
 epoch: 21, train_loss: 0.6225, test_loss: 1.2253, test_f1: 0.5827
 epoch: 22, train_loss: 0.6320, test_loss: 1.3385, test_f1: 0.5188
 epoch: 23, train_loss: 0.5783, test_loss: 1.1890, test_f1: 0.5639
 epoch: 24, train_loss: 0.5883, test_loss: 1.1836, test_f1: 0.5695
 epoch: 25, train_loss: 0.5754, test_loss: 1.1413, test_f1: 0.6129
 epoch: 26, train_loss: 0.5394, test_loss: 1.2261, test_f1: 0.6230
 epoch: 27, train_loss: 0.5346, test_loss: 1.2794, test_f1: 0.6563
 epoch: 28, train_loss: 0.5207, test_loss: 1.2648, test_f1: 0.6245
 epoch: 29, train_loss: 0.5058, test_loss: 1.2823, test_f1: 0.5992
 epoch: 30, train_loss: 0.5253, test_loss: 1.4127, test_f1: 0.5223
 epoch: 31, train_loss: 0.5330, test_loss: 1.3281, test_f1: 0.5948
 epoch: 32, train_loss: 0.5019, test_loss: 1.4019, test_f1: 0.5892
 epoch: 33, train_loss: 0.5462, test_loss: 1.2883, test_f1: 0.6321
 epoch: 34, train_loss: 0.4680, test_loss: 1.3635, test_f1: 0.6124
 epoch: 35, train_loss: 0.4497, test_loss: 1.3972, test_f1: 0.5666
 epoch: 36, train_loss: 0.4598, test_loss: 1.4346, test_f1: 0.6349
 epoch: 37, train_loss: 0.4490, test_loss: 1.4752, test_f1: 0.6509
 epoch: 38, train_loss: 0.4393, test_loss: 1.4558, test_f1: 0.5827
 epoch: 39, train_loss: 0.4501, test_loss: 1.5320, test_f1: 0.5925
 epoch: 40, train_loss: 0.4576, test_loss: 1.4041, test_f1: 0.6337
 epoch: 41, train_loss: 0.4615, test_loss: 1.4752, test_f1: 0.5886
 epoch: 42, train_loss: 0.4339, test_loss: 1.4057, test_f1: 0.6175
 epoch: 43, train_loss: 0.3906, test_loss: 1.6634, test_f1: 0.5772
 epoch: 44, train_loss: 0.3836, test_loss: 1.5727, test_f1: 0.6121
 epoch: 45, train_loss: 0.3868, test_loss: 1.8140, test_f1: 0.5550
 epoch: 46, train_loss: 0.3826, test_loss: 1.7151, test_f1: 0.5979
 epoch: 47, train_loss: 0.3660, test_loss: 1.5877, test_f1: 0.5894
 epoch: 48, train_loss: 0.3356, test_loss: 1.7127, test_f1: 0.5903
 epoch: 49, train_loss: 0.3199, test_loss: 1.6920, test_f1: 0.6304
 epoch: 50, train_loss: 0.3493, test_loss: 1.8157, test_f1: 0.5844
 epoch: 51, train_loss: 0.3385, test_loss: 1.8563, test_f1: 0.5638
 epoch: 52, train_loss: 0.2812, test_loss: 1.7070, test_f1: 0.6308
 epoch: 53, train_loss: 0.2483, test_loss: 1.8743, test_f1: 0.5884
 epoch: 54, train_loss: 0.2645, test_loss: 1.8447, test_f1: 0.6017
 epoch: 55, train_loss: 0.2728, test_loss: 1.7800, test_f1: 0.5963
 epoch: 56, train_loss: 0.2693, test_loss: 1.8688, test_f1: 0.6029
 epoch: 57, train_loss: 0.2415, test_loss: 1.9153, test_f1: 0.6371
 epoch: 58, train_loss: 0.2395, test_loss: 1.8352, test_f1: 0.6095
 epoch: 59, train_loss: 0.2275, test_loss: 1.9215, test_f1: 0.5978
 epoch: 60, train_loss: 0.2324, test_loss: 1.9674, test_f1: 0.5990
 epoch: 61, train_loss: 0.2394, test_loss: 2.1111, test_f1: 0.5866
 epoch: 62, train_loss: 0.2359, test_loss: 1.9948, test_f1: 0.5976
 epoch: 63, train_loss: 0.2174, test_loss: 1.9720, test_f1: 0.6128
 epoch: 64, train_loss: 0.1893, test_loss: 2.0492, test_f1: 0.6050
 epoch: 65, train_loss: 0.1969, test_loss: 2.0900, test_f1: 0.5916
 epoch: 66, train_loss: 0.2074, test_loss: 2.0970, test_f1: 0.6058
 epoch: 67, train_loss: 0.2049, test_loss: 2.0987, test_f1: 0.6189
 epoch: 68, train_loss: 0.1860, test_loss: 2.1448, test_f1: 0.6158
 epoch: 69, train_loss: 0.1937, test_loss: 2.2028, test_f1: 0.6141
 epoch: 70, train_loss: 0.2206, test_loss: 2.2297, test_f1: 0.5967
 epoch: 71, train_loss: 0.2295, test_loss: 2.1275, test_f1: 0.5897
 epoch: 72, train_loss: 0.2069, test_loss: 2.2137, test_f1: 0.6091
 epoch: 73, train_loss: 0.2170, test_loss: 2.3666, test_f1: 0.5882
 epoch: 74, train_loss: 0.2104, test_loss: 2.3403, test_f1: 0.6313
 epoch: 75, train_loss: 0.2110, test_loss: 2.2600, test_f1: 0.6236
 epoch: 76, train_loss: 0.2078, test_loss: 2.2673, test_f1: 0.5950
 epoch: 77, train_loss: 0.1901, test_loss: 2.3834, test_f1: 0.5917
 epoch: 78, train_loss: 0.2000, test_loss: 2.2560, test_f1: 0.6008
 epoch: 79, train_loss: 0.1901, test_loss: 2.3427, test_f1: 0.6217
 epoch: 80, train_loss: 0.1952, test_loss: 2.4560, test_f1: 0.5694
 epoch: 81, train_loss: 0.1683, test_loss: 2.4945, test_f1: 0.5833
 epoch: 82, train_loss: 0.1523, test_loss: 2.5055, test_f1: 0.6072
 epoch: 83, train_loss: 0.1552, test_loss: 2.5855, test_f1: 0.5879
 epoch: 84, train_loss: 0.1711, test_loss: 2.3890, test_f1: 0.6425
 epoch: 85, train_loss: 0.1737, test_loss: 2.4553, test_f1: 0.6326
 epoch: 86, train_loss: 0.1524, test_loss: 2.6415, test_f1: 0.6090
 epoch: 87, train_loss: 0.1504, test_loss: 2.5362, test_f1: 0.5996
 epoch: 88, train_loss: 0.1549, test_loss: 2.6300, test_f1: 0.6010
 epoch: 89, train_loss: 0.1683, test_loss: 2.5145, test_f1: 0.5982
 epoch: 90, train_loss: 0.1541, test_loss: 2.5599, test_f1: 0.6109
 epoch: 91, train_loss: 0.1277, test_loss: 2.6222, test_f1: 0.6116
 epoch: 92, train_loss: 0.1618, test_loss: 2.8030, test_f1: 0.5686
 epoch: 93, train_loss: 0.1589, test_loss: 2.6085, test_f1: 0.6069
 epoch: 94, train_loss: 0.1670, test_loss: 2.5970, test_f1: 0.6019
 epoch: 95, train_loss: 0.1633, test_loss: 2.7364, test_f1: 0.5955
 epoch: 96, train_loss: 0.1544, test_loss: 2.6559, test_f1: 0.6141
 epoch: 97, train_loss: 0.1274, test_loss: 2.7655, test_f1: 0.6077
 epoch: 98, train_loss: 0.1268, test_loss: 2.8107, test_f1: 0.5983
 epoch: 99, train_loss: 0.1532, test_loss: 2.8995, test_f1: 0.5944
##################ITERATION #9 ****************************************
 epoch: 0, train_loss: 1.4012, test_loss: 1.3325, test_f1: 0.1998
 epoch: 1, train_loss: 1.0725, test_loss: 1.2330, test_f1: 0.3353
 epoch: 2, train_loss: 1.0266, test_loss: 1.1234, test_f1: 0.4151
 epoch: 3, train_loss: 0.9911, test_loss: 1.0920, test_f1: 0.4676
 epoch: 4, train_loss: 0.9320, test_loss: 1.0560, test_f1: 0.5313
 epoch: 5, train_loss: 0.8999, test_loss: 1.0346, test_f1: 0.5180
 epoch: 6, train_loss: 0.8692, test_loss: 1.0011, test_f1: 0.5626
 epoch: 7, train_loss: 0.8435, test_loss: 1.0221, test_f1: 0.5691
 epoch: 8, train_loss: 0.8105, test_loss: 1.0850, test_f1: 0.5552
 epoch: 9, train_loss: 0.8106, test_loss: 1.0509, test_f1: 0.5946
 epoch: 10, train_loss: 0.7622, test_loss: 1.0918, test_f1: 0.5704
 epoch: 11, train_loss: 0.7616, test_loss: 1.1787, test_f1: 0.5436
 epoch: 12, train_loss: 0.7410, test_loss: 1.0817, test_f1: 0.5910
 epoch: 13, train_loss: 0.7229, test_loss: 1.1763, test_f1: 0.5889
 epoch: 14, train_loss: 0.7248, test_loss: 1.2115, test_f1: 0.5271
 epoch: 15, train_loss: 0.7092, test_loss: 1.2017, test_f1: 0.5716
 epoch: 16, train_loss: 0.6921, test_loss: 1.2123, test_f1: 0.5763
 epoch: 17, train_loss: 0.6522, test_loss: 1.1802, test_f1: 0.5785
 epoch: 18, train_loss: 0.6440, test_loss: 1.2393, test_f1: 0.5814
 epoch: 19, train_loss: 0.6487, test_loss: 1.2263, test_f1: 0.5309
 epoch: 20, train_loss: 0.5942, test_loss: 1.2094, test_f1: 0.6332
 epoch: 21, train_loss: 0.5733, test_loss: 1.2774, test_f1: 0.5329
 epoch: 22, train_loss: 0.5723, test_loss: 1.2392, test_f1: 0.5843
 epoch: 23, train_loss: 0.5552, test_loss: 1.2497, test_f1: 0.6304
 epoch: 24, train_loss: 0.5886, test_loss: 1.2429, test_f1: 0.5904
 epoch: 25, train_loss: 0.5634, test_loss: 1.3181, test_f1: 0.5745
 epoch: 26, train_loss: 0.5119, test_loss: 1.2807, test_f1: 0.5658
 epoch: 27, train_loss: 0.4953, test_loss: 1.3229, test_f1: 0.6065
 epoch: 28, train_loss: 0.4957, test_loss: 1.5659, test_f1: 0.6170
 epoch: 29, train_loss: 0.5034, test_loss: 1.4008, test_f1: 0.5380
 epoch: 30, train_loss: 0.4642, test_loss: 1.4382, test_f1: 0.6130
 epoch: 31, train_loss: 0.4638, test_loss: 1.5686, test_f1: 0.5915
 epoch: 32, train_loss: 0.4780, test_loss: 1.4372, test_f1: 0.6019
 epoch: 33, train_loss: 0.4597, test_loss: 1.5537, test_f1: 0.5881
 epoch: 34, train_loss: 0.4843, test_loss: 1.4805, test_f1: 0.5641
 epoch: 35, train_loss: 0.4629, test_loss: 1.3721, test_f1: 0.6099
 epoch: 36, train_loss: 0.4545, test_loss: 1.6798, test_f1: 0.5555
 epoch: 37, train_loss: 0.4219, test_loss: 1.4296, test_f1: 0.5749
 epoch: 38, train_loss: 0.4219, test_loss: 1.4880, test_f1: 0.5770
 epoch: 39, train_loss: 0.4313, test_loss: 1.6553, test_f1: 0.6311
 epoch: 40, train_loss: 0.4402, test_loss: 1.6164, test_f1: 0.6146
 epoch: 41, train_loss: 0.4020, test_loss: 1.6905, test_f1: 0.5992
 epoch: 42, train_loss: 0.3803, test_loss: 1.6782, test_f1: 0.5697
 epoch: 43, train_loss: 0.3620, test_loss: 1.8541, test_f1: 0.5634
 epoch: 44, train_loss: 0.3672, test_loss: 1.6664, test_f1: 0.5916
 epoch: 45, train_loss: 0.3455, test_loss: 1.6489, test_f1: 0.6141
 epoch: 46, train_loss: 0.3471, test_loss: 1.7389, test_f1: 0.6067
 epoch: 47, train_loss: 0.3792, test_loss: 1.6012, test_f1: 0.5672
 epoch: 48, train_loss: 0.3446, test_loss: 1.6681, test_f1: 0.6349
 epoch: 49, train_loss: 0.3211, test_loss: 1.8232, test_f1: 0.5932
 epoch: 50, train_loss: 0.2986, test_loss: 1.8685, test_f1: 0.6009
 epoch: 51, train_loss: 0.2791, test_loss: 1.6500, test_f1: 0.6224
 epoch: 52, train_loss: 0.2482, test_loss: 1.8376, test_f1: 0.6216
 epoch: 53, train_loss: 0.2331, test_loss: 1.9938, test_f1: 0.5722
 epoch: 54, train_loss: 0.2571, test_loss: 2.0547, test_f1: 0.5905
 epoch: 55, train_loss: 0.2184, test_loss: 1.8529, test_f1: 0.6104
 epoch: 56, train_loss: 0.2048, test_loss: 1.9631, test_f1: 0.6219
 epoch: 57, train_loss: 0.2217, test_loss: 2.0534, test_f1: 0.5738
 epoch: 58, train_loss: 0.2221, test_loss: 2.0198, test_f1: 0.6293
 epoch: 59, train_loss: 0.2059, test_loss: 2.0501, test_f1: 0.5816
 epoch: 60, train_loss: 0.1964, test_loss: 2.0282, test_f1: 0.6143
 epoch: 61, train_loss: 0.2386, test_loss: 1.9863, test_f1: 0.5961
 epoch: 62, train_loss: 0.2073, test_loss: 2.1947, test_f1: 0.6158
 epoch: 63, train_loss: 0.1894, test_loss: 2.2201, test_f1: 0.5904
 epoch: 64, train_loss: 0.2049, test_loss: 2.3114, test_f1: 0.5884
 epoch: 65, train_loss: 0.1859, test_loss: 2.1170, test_f1: 0.6188
 epoch: 66, train_loss: 0.1861, test_loss: 2.1095, test_f1: 0.6144
 epoch: 67, train_loss: 0.1888, test_loss: 2.2039, test_f1: 0.6013
 epoch: 68, train_loss: 0.1928, test_loss: 2.2495, test_f1: 0.5885
 epoch: 69, train_loss: 0.1702, test_loss: 2.3012, test_f1: 0.5836
 epoch: 70, train_loss: 0.1717, test_loss: 2.3976, test_f1: 0.5898
 epoch: 71, train_loss: 0.1896, test_loss: 2.4235, test_f1: 0.5972
 epoch: 72, train_loss: 0.1731, test_loss: 2.4129, test_f1: 0.5871
 epoch: 73, train_loss: 0.1788, test_loss: 2.4152, test_f1: 0.5964
 epoch: 74, train_loss: 0.1923, test_loss: 2.3090, test_f1: 0.5753
 epoch: 75, train_loss: 0.1767, test_loss: 2.3562, test_f1: 0.6092
 epoch: 76, train_loss: 0.1782, test_loss: 2.4117, test_f1: 0.5673
 epoch: 77, train_loss: 0.1719, test_loss: 2.3035, test_f1: 0.6182
 epoch: 78, train_loss: 0.1726, test_loss: 2.3457, test_f1: 0.5998
 epoch: 79, train_loss: 0.1714, test_loss: 2.5081, test_f1: 0.5854
 epoch: 80, train_loss: 0.1762, test_loss: 2.5083, test_f1: 0.5890
 epoch: 81, train_loss: 0.1570, test_loss: 2.4736, test_f1: 0.5789
 epoch: 82, train_loss: 0.1869, test_loss: 2.4498, test_f1: 0.5895
 epoch: 83, train_loss: 0.1482, test_loss: 2.5834, test_f1: 0.5761
 epoch: 84, train_loss: 0.1399, test_loss: 2.5003, test_f1: 0.5895
 epoch: 85, train_loss: 0.1582, test_loss: 2.5915, test_f1: 0.5846
 epoch: 86, train_loss: 0.1544, test_loss: 2.6216, test_f1: 0.5738
 epoch: 87, train_loss: 0.1624, test_loss: 2.5949, test_f1: 0.5899
 epoch: 88, train_loss: 0.1952, test_loss: 2.6000, test_f1: 0.5720
 epoch: 89, train_loss: 0.1860, test_loss: 2.3039, test_f1: 0.6102
 epoch: 90, train_loss: 0.1617, test_loss: 2.5499, test_f1: 0.5822
 epoch: 91, train_loss: 0.1672, test_loss: 2.5131, test_f1: 0.5846
 epoch: 92, train_loss: 0.1639, test_loss: 2.7061, test_f1: 0.5934
 epoch: 93, train_loss: 0.1427, test_loss: 2.7005, test_f1: 0.5907
 epoch: 94, train_loss: 0.1463, test_loss: 2.7068, test_f1: 0.5581
 epoch: 95, train_loss: 0.1437, test_loss: 2.7250, test_f1: 0.5787
 epoch: 96, train_loss: 0.1338, test_loss: 2.6882, test_f1: 0.6007
 epoch: 97, train_loss: 0.1280, test_loss: 2.6980, test_f1: 0.5928
 epoch: 98, train_loss: 0.1408, test_loss: 2.7897, test_f1: 0.5837
 epoch: 99, train_loss: 0.1447, test_loss: 2.8151, test_f1: 0.5839

Training completed in 759.50 seconds
Best F1: 0.6925 at epoch 22
Mean F1 across iterations: 0.6548  0.0199
========================FINAL RESULTS================================
FEGIN weighted F1: 0.6925  0.0199
python main.py --data ltspice_demos --representation component_pin_net --model FEGIN --layers 6 --hiddens 64 --batch_size 64 --lr 0.001 --emb_size 512 --epochs 100 --save_appendix component_pin_net_L6_H64_BS64_LR0.001_E512 --no_val
-----



STDERR:
  File "main.py", line 370, in <module>
    main()
  File "main.py", line 254, in main
    dataset = dataset_class(
  File "/home/philip/projects/ltspice_examples_code_repo/Circuit-Completion-Using-GNNs/component_classification_with_link_prediction_head/evaluation/FEGIN/kernel/circuit_datasets.py", line 15, in __init__
    self.data, self.slices = torch.load(self.processed_paths[0])
  File "/home/philip/.local/lib/python3.8/site-packages/torch/serialization.py", line 1040, in load
    warnings.warn(
  File "/usr/lib/python3.8/warnings.py", line 109, in _showwarnmsg
    sw(msg.message, msg.category, msg.filename, msg.lineno,
  File "main.py", line 47, in warn_with_traceback
    traceback.print_stack(file=log)
/home/philip/projects/ltspice_examples_code_repo/Circuit-Completion-Using-GNNs/component_classification_with_link_prediction_head/evaluation/FEGIN/kernel/circuit_datasets.py:15: FutureWarning: You are using `torch.load` with `weights_only=False` (the current default value), which uses the default pickle module implicitly. It is possible to construct malicious pickle data which will execute arbitrary code during unpickling (See https://github.com/pytorch/pytorch/blob/main/SECURITY.md#untrusted-models for more details). In a future release, the default value for `weights_only` will be flipped to `True`. This limits the functions that could be executed during unpickling. Arbitrary objects will no longer be allowed to be loaded via this mode unless they are explicitly allowlisted by the user via `torch.serialization.add_safe_globals`. We recommend you start setting `weights_only=True` for any use case where you don't have full control of the loaded file. Please open an issue on GitHub for any issues related to this experimental feature.
  self.data, self.slices = torch.load(self.processed_paths[0])
