STDOUT:
Results will be saved in /home/philip/projects/ltspice_examples_code_repo/Circuit-Completion-Using-GNNs/component_classification_with_link_prediction_head/evaluation/FEGIN/results/model_FEGIN_dataset_ltspice_demos
Command line input: python main.py --data ltspice_demos --representation component_component --model FEGIN --layers 4 --hiddens 16 --batch_size 128 --lr 0.001 --emb_size 128 --epochs 100 --save_appendix component_component_L4_H16_BS128_LR0.001_E128 --no_val
 is saved.
-----
ltspice_demos - FEGIN
Using 4 layers, 16 hidden units, h = 2
Loading component_component representation dataset
ENTERED
Training FEGIN on component_component representation
Train: 1565, Test: 383
##################ITERATION #0 ****************************************
 epoch: 0, train_loss: 1.3654, test_loss: 1.3583, test_f1: 0.2281
 epoch: 1, train_loss: 1.3497, test_loss: 1.3519, test_f1: 0.2281
 epoch: 2, train_loss: 1.3403, test_loss: 1.3455, test_f1: 0.2281
 epoch: 3, train_loss: 1.3303, test_loss: 1.3367, test_f1: 0.2281
 epoch: 4, train_loss: 1.3160, test_loss: 1.3265, test_f1: 0.2281
 epoch: 5, train_loss: 1.2971, test_loss: 1.3135, test_f1: 0.2281
 epoch: 6, train_loss: 1.2790, test_loss: 1.2983, test_f1: 0.2281
 epoch: 7, train_loss: 1.2561, test_loss: 1.2810, test_f1: 0.2281
 epoch: 8, train_loss: 1.2282, test_loss: 1.2671, test_f1: 0.2281
 epoch: 9, train_loss: 1.2139, test_loss: 1.2553, test_f1: 0.2281
 epoch: 10, train_loss: 1.2030, test_loss: 1.2468, test_f1: 0.2650
 epoch: 11, train_loss: 1.1883, test_loss: 1.2415, test_f1: 0.3228
 epoch: 12, train_loss: 1.1808, test_loss: 1.2423, test_f1: 0.3084
 epoch: 13, train_loss: 1.1674, test_loss: 1.2384, test_f1: 0.3544
 epoch: 14, train_loss: 1.1547, test_loss: 1.2402, test_f1: 0.3753
 epoch: 15, train_loss: 1.1536, test_loss: 1.2375, test_f1: 0.3442
 epoch: 16, train_loss: 1.1360, test_loss: 1.2391, test_f1: 0.3501
 epoch: 17, train_loss: 1.1353, test_loss: 1.2565, test_f1: 0.3237
 epoch: 18, train_loss: 1.1331, test_loss: 1.2752, test_f1: 0.3394
 epoch: 19, train_loss: 1.1134, test_loss: 1.2716, test_f1: 0.3482
 epoch: 20, train_loss: 1.1163, test_loss: 1.3115, test_f1: 0.3367
 epoch: 21, train_loss: 1.1009, test_loss: 1.2666, test_f1: 0.3123
 epoch: 22, train_loss: 1.0954, test_loss: 1.3021, test_f1: 0.3265
 epoch: 23, train_loss: 1.0905, test_loss: 1.2964, test_f1: 0.3352
 epoch: 24, train_loss: 1.0752, test_loss: 1.2618, test_f1: 0.3295
 epoch: 25, train_loss: 1.0752, test_loss: 1.2384, test_f1: 0.3680
 epoch: 26, train_loss: 1.0724, test_loss: 1.4133, test_f1: 0.3716
 epoch: 27, train_loss: 1.0760, test_loss: 1.3118, test_f1: 0.3654
 epoch: 28, train_loss: 1.0561, test_loss: 1.3115, test_f1: 0.3734
 epoch: 29, train_loss: 1.0691, test_loss: 1.2972, test_f1: 0.3639
 epoch: 30, train_loss: 1.0420, test_loss: 1.2754, test_f1: 0.3796
 epoch: 31, train_loss: 1.0467, test_loss: 1.2820, test_f1: 0.3853
 epoch: 32, train_loss: 1.0396, test_loss: 1.3259, test_f1: 0.3897
 epoch: 33, train_loss: 1.0299, test_loss: 1.3465, test_f1: 0.4283
 epoch: 34, train_loss: 1.0235, test_loss: 1.3528, test_f1: 0.4106
 epoch: 35, train_loss: 1.0197, test_loss: 1.3054, test_f1: 0.4056
 epoch: 36, train_loss: 1.0110, test_loss: 1.3293, test_f1: 0.4370
 epoch: 37, train_loss: 1.0201, test_loss: 1.3841, test_f1: 0.4058
 epoch: 38, train_loss: 1.0033, test_loss: 1.3576, test_f1: 0.4286
 epoch: 39, train_loss: 1.0073, test_loss: 1.3694, test_f1: 0.4127
 epoch: 40, train_loss: 0.9876, test_loss: 1.3672, test_f1: 0.4371
 epoch: 41, train_loss: 0.9985, test_loss: 1.3532, test_f1: 0.4303
 epoch: 42, train_loss: 0.9912, test_loss: 1.3999, test_f1: 0.4244
 epoch: 43, train_loss: 0.9879, test_loss: 1.3728, test_f1: 0.4541
 epoch: 44, train_loss: 0.9897, test_loss: 1.4155, test_f1: 0.4539
 epoch: 45, train_loss: 0.9758, test_loss: 1.3954, test_f1: 0.4742
 epoch: 46, train_loss: 0.9677, test_loss: 1.4231, test_f1: 0.4747
 epoch: 47, train_loss: 0.9594, test_loss: 1.4459, test_f1: 0.4832
 epoch: 48, train_loss: 0.9539, test_loss: 1.4440, test_f1: 0.4646
 epoch: 49, train_loss: 0.9497, test_loss: 1.4248, test_f1: 0.4997
 epoch: 50, train_loss: 0.9573, test_loss: 1.4121, test_f1: 0.4863
 epoch: 51, train_loss: 0.9392, test_loss: 1.4093, test_f1: 0.4944
 epoch: 52, train_loss: 0.9321, test_loss: 1.4873, test_f1: 0.4786
 epoch: 53, train_loss: 0.9352, test_loss: 1.5010, test_f1: 0.4749
 epoch: 54, train_loss: 0.9400, test_loss: 1.4585, test_f1: 0.5035
 epoch: 55, train_loss: 0.9335, test_loss: 1.4771, test_f1: 0.5061
 epoch: 56, train_loss: 0.9295, test_loss: 1.4854, test_f1: 0.4955
 epoch: 57, train_loss: 0.9190, test_loss: 1.5468, test_f1: 0.4784
 epoch: 58, train_loss: 0.9162, test_loss: 1.5271, test_f1: 0.4873
 epoch: 59, train_loss: 0.9224, test_loss: 1.5004, test_f1: 0.5072
 epoch: 60, train_loss: 0.9196, test_loss: 1.4985, test_f1: 0.4867
 epoch: 61, train_loss: 0.9195, test_loss: 1.4855, test_f1: 0.4798
 epoch: 62, train_loss: 0.9117, test_loss: 1.4510, test_f1: 0.4699
 epoch: 63, train_loss: 0.9283, test_loss: 1.5056, test_f1: 0.4580
 epoch: 64, train_loss: 0.9114, test_loss: 1.5236, test_f1: 0.4861
 epoch: 65, train_loss: 0.9001, test_loss: 1.5322, test_f1: 0.4870
 epoch: 66, train_loss: 0.9079, test_loss: 1.5085, test_f1: 0.4953
 epoch: 67, train_loss: 0.9010, test_loss: 1.4916, test_f1: 0.4945
 epoch: 68, train_loss: 0.9005, test_loss: 1.5011, test_f1: 0.4888
 epoch: 69, train_loss: 0.8937, test_loss: 1.5140, test_f1: 0.5037
 epoch: 70, train_loss: 0.9021, test_loss: 1.5184, test_f1: 0.4828
 epoch: 71, train_loss: 0.8904, test_loss: 1.5187, test_f1: 0.4900
 epoch: 72, train_loss: 0.8927, test_loss: 1.5112, test_f1: 0.4981
 epoch: 73, train_loss: 0.8894, test_loss: 1.5107, test_f1: 0.5063
 epoch: 74, train_loss: 0.8854, test_loss: 1.5242, test_f1: 0.5120
 epoch: 75, train_loss: 0.8758, test_loss: 1.5551, test_f1: 0.5051
 epoch: 76, train_loss: 0.8978, test_loss: 1.5619, test_f1: 0.5171
 epoch: 77, train_loss: 0.8881, test_loss: 1.5406, test_f1: 0.4983
 epoch: 78, train_loss: 0.8784, test_loss: 1.4605, test_f1: 0.4965
 epoch: 79, train_loss: 0.8878, test_loss: 1.4873, test_f1: 0.4719
 epoch: 80, train_loss: 0.8698, test_loss: 1.4987, test_f1: 0.4807
 epoch: 81, train_loss: 0.8798, test_loss: 1.5286, test_f1: 0.4789
 epoch: 82, train_loss: 0.8713, test_loss: 1.5400, test_f1: 0.4852
 epoch: 83, train_loss: 0.8772, test_loss: 1.5410, test_f1: 0.4926
 epoch: 84, train_loss: 0.8728, test_loss: 1.5688, test_f1: 0.4708
 epoch: 85, train_loss: 0.8736, test_loss: 1.5542, test_f1: 0.4850
 epoch: 86, train_loss: 0.8706, test_loss: 1.6064, test_f1: 0.4968
 epoch: 87, train_loss: 0.8782, test_loss: 1.6263, test_f1: 0.4699
 epoch: 88, train_loss: 0.8622, test_loss: 1.5871, test_f1: 0.5217
 epoch: 89, train_loss: 0.8673, test_loss: 1.5797, test_f1: 0.5181
 epoch: 90, train_loss: 0.8596, test_loss: 1.5882, test_f1: 0.5074
 epoch: 91, train_loss: 0.8622, test_loss: 1.5641, test_f1: 0.5057
 epoch: 92, train_loss: 0.8673, test_loss: 1.5611, test_f1: 0.5077
 epoch: 93, train_loss: 0.8518, test_loss: 1.5837, test_f1: 0.4933
 epoch: 94, train_loss: 0.8574, test_loss: 1.5784, test_f1: 0.5034
 epoch: 95, train_loss: 0.8630, test_loss: 1.5832, test_f1: 0.4982
 epoch: 96, train_loss: 0.8449, test_loss: 1.5932, test_f1: 0.5209
 epoch: 97, train_loss: 0.8462, test_loss: 1.5838, test_f1: 0.5272
 epoch: 98, train_loss: 0.8523, test_loss: 1.6105, test_f1: 0.5375
 epoch: 99, train_loss: 0.8599, test_loss: 1.5779, test_f1: 0.4987
##################ITERATION #1 ****************************************
 epoch: 0, train_loss: 1.3201, test_loss: 1.3231, test_f1: 0.2281
 epoch: 1, train_loss: 1.2690, test_loss: 1.3134, test_f1: 0.2281
 epoch: 2, train_loss: 1.2505, test_loss: 1.3080, test_f1: 0.2281
 epoch: 3, train_loss: 1.2314, test_loss: 1.3032, test_f1: 0.2281
 epoch: 4, train_loss: 1.2169, test_loss: 1.3039, test_f1: 0.2337
 epoch: 5, train_loss: 1.2170, test_loss: 1.3080, test_f1: 0.3003
 epoch: 6, train_loss: 1.2062, test_loss: 1.2985, test_f1: 0.3405
 epoch: 7, train_loss: 1.1986, test_loss: 1.2872, test_f1: 0.3329
 epoch: 8, train_loss: 1.1959, test_loss: 1.2788, test_f1: 0.3397
 epoch: 9, train_loss: 1.1845, test_loss: 1.2746, test_f1: 0.3613
 epoch: 10, train_loss: 1.1775, test_loss: 1.2620, test_f1: 0.3637
 epoch: 11, train_loss: 1.1735, test_loss: 1.2544, test_f1: 0.3592
 epoch: 12, train_loss: 1.1604, test_loss: 1.2629, test_f1: 0.3594
 epoch: 13, train_loss: 1.1564, test_loss: 1.2532, test_f1: 0.3662
 epoch: 14, train_loss: 1.1436, test_loss: 1.2560, test_f1: 0.3682
 epoch: 15, train_loss: 1.1356, test_loss: 1.2436, test_f1: 0.3897
 epoch: 16, train_loss: 1.1310, test_loss: 1.2570, test_f1: 0.3827
 epoch: 17, train_loss: 1.1134, test_loss: 1.2630, test_f1: 0.3959
 epoch: 18, train_loss: 1.1100, test_loss: 1.2644, test_f1: 0.4236
 epoch: 19, train_loss: 1.0896, test_loss: 1.2600, test_f1: 0.4194
 epoch: 20, train_loss: 1.0819, test_loss: 1.2478, test_f1: 0.4355
 epoch: 21, train_loss: 1.0839, test_loss: 1.2353, test_f1: 0.4292
 epoch: 22, train_loss: 1.0711, test_loss: 1.2428, test_f1: 0.4311
 epoch: 23, train_loss: 1.0689, test_loss: 1.2250, test_f1: 0.4555
 epoch: 24, train_loss: 1.0558, test_loss: 1.2409, test_f1: 0.4446
 epoch: 25, train_loss: 1.0536, test_loss: 1.2495, test_f1: 0.4388
 epoch: 26, train_loss: 1.0489, test_loss: 1.2317, test_f1: 0.4681
 epoch: 27, train_loss: 1.0308, test_loss: 1.2120, test_f1: 0.4773
 epoch: 28, train_loss: 1.0343, test_loss: 1.1951, test_f1: 0.4718
 epoch: 29, train_loss: 1.0071, test_loss: 1.2284, test_f1: 0.4960
 epoch: 30, train_loss: 1.0147, test_loss: 1.2039, test_f1: 0.5112
 epoch: 31, train_loss: 1.0058, test_loss: 1.2267, test_f1: 0.4896
 epoch: 32, train_loss: 1.0083, test_loss: 1.2728, test_f1: 0.5058
 epoch: 33, train_loss: 0.9878, test_loss: 1.2690, test_f1: 0.4987
 epoch: 34, train_loss: 0.9916, test_loss: 1.3246, test_f1: 0.4963
 epoch: 35, train_loss: 0.9840, test_loss: 1.2446, test_f1: 0.4667
 epoch: 36, train_loss: 0.9782, test_loss: 1.2236, test_f1: 0.4994
 epoch: 37, train_loss: 0.9875, test_loss: 1.2105, test_f1: 0.5118
 epoch: 38, train_loss: 0.9901, test_loss: 1.3134, test_f1: 0.5109
 epoch: 39, train_loss: 0.9763, test_loss: 1.2313, test_f1: 0.4691
 epoch: 40, train_loss: 0.9852, test_loss: 1.2018, test_f1: 0.5089
 epoch: 41, train_loss: 0.9670, test_loss: 1.2713, test_f1: 0.4689
 epoch: 42, train_loss: 0.9529, test_loss: 1.2161, test_f1: 0.5066
 epoch: 43, train_loss: 0.9649, test_loss: 1.2338, test_f1: 0.4990
 epoch: 44, train_loss: 0.9245, test_loss: 1.2287, test_f1: 0.5191
 epoch: 45, train_loss: 0.9339, test_loss: 1.2159, test_f1: 0.5295
 epoch: 46, train_loss: 0.9319, test_loss: 1.2287, test_f1: 0.5090
 epoch: 47, train_loss: 0.9088, test_loss: 1.1637, test_f1: 0.5594
 epoch: 48, train_loss: 0.9452, test_loss: 1.2152, test_f1: 0.4680
 epoch: 49, train_loss: 0.9401, test_loss: 1.2388, test_f1: 0.4835
 epoch: 50, train_loss: 0.9345, test_loss: 1.2420, test_f1: 0.5072
 epoch: 51, train_loss: 0.9107, test_loss: 1.1891, test_f1: 0.5136
 epoch: 52, train_loss: 0.9051, test_loss: 1.1794, test_f1: 0.5222
 epoch: 53, train_loss: 0.9055, test_loss: 1.2080, test_f1: 0.5295
 epoch: 54, train_loss: 0.8906, test_loss: 1.2340, test_f1: 0.5252
 epoch: 55, train_loss: 0.9120, test_loss: 1.2784, test_f1: 0.5172
 epoch: 56, train_loss: 0.8882, test_loss: 1.2805, test_f1: 0.5169
 epoch: 57, train_loss: 0.8905, test_loss: 1.4049, test_f1: 0.5218
 epoch: 58, train_loss: 0.8974, test_loss: 1.3335, test_f1: 0.5125
 epoch: 59, train_loss: 0.8900, test_loss: 1.3249, test_f1: 0.5038
 epoch: 60, train_loss: 0.8867, test_loss: 1.2877, test_f1: 0.5136
 epoch: 61, train_loss: 0.8812, test_loss: 1.2967, test_f1: 0.4863
 epoch: 62, train_loss: 0.8793, test_loss: 1.2907, test_f1: 0.5172
 epoch: 63, train_loss: 0.8861, test_loss: 1.3274, test_f1: 0.5125
 epoch: 64, train_loss: 0.8858, test_loss: 1.3924, test_f1: 0.4993
 epoch: 65, train_loss: 0.8774, test_loss: 1.3621, test_f1: 0.4897
 epoch: 66, train_loss: 0.8782, test_loss: 1.3294, test_f1: 0.5155
 epoch: 67, train_loss: 0.8899, test_loss: 1.3421, test_f1: 0.5247
 epoch: 68, train_loss: 0.8833, test_loss: 1.3299, test_f1: 0.5240
 epoch: 69, train_loss: 0.8703, test_loss: 1.3094, test_f1: 0.5234
 epoch: 70, train_loss: 0.8746, test_loss: 1.3492, test_f1: 0.5046
 epoch: 71, train_loss: 0.8831, test_loss: 1.3258, test_f1: 0.4785
 epoch: 72, train_loss: 0.8692, test_loss: 1.2740, test_f1: 0.5296
 epoch: 73, train_loss: 0.8736, test_loss: 1.3012, test_f1: 0.5189
 epoch: 74, train_loss: 0.8695, test_loss: 1.2135, test_f1: 0.5152
 epoch: 75, train_loss: 0.8646, test_loss: 1.2917, test_f1: 0.5290
 epoch: 76, train_loss: 0.8722, test_loss: 1.2743, test_f1: 0.4959
 epoch: 77, train_loss: 0.8690, test_loss: 1.2517, test_f1: 0.5387
 epoch: 78, train_loss: 0.8746, test_loss: 1.2739, test_f1: 0.5275
 epoch: 79, train_loss: 0.8671, test_loss: 1.3305, test_f1: 0.5288
 epoch: 80, train_loss: 0.8593, test_loss: 1.2066, test_f1: 0.5054
 epoch: 81, train_loss: 0.8513, test_loss: 1.2499, test_f1: 0.5182
 epoch: 82, train_loss: 0.8523, test_loss: 1.3129, test_f1: 0.5056
 epoch: 83, train_loss: 0.8766, test_loss: 1.2989, test_f1: 0.5067
 epoch: 84, train_loss: 0.8440, test_loss: 1.3180, test_f1: 0.5217
 epoch: 85, train_loss: 0.8384, test_loss: 1.2985, test_f1: 0.4984
 epoch: 86, train_loss: 0.8450, test_loss: 1.3248, test_f1: 0.5387
 epoch: 87, train_loss: 0.8482, test_loss: 1.3118, test_f1: 0.5256
 epoch: 88, train_loss: 0.8478, test_loss: 1.3021, test_f1: 0.5106
 epoch: 89, train_loss: 0.8366, test_loss: 1.3455, test_f1: 0.5508
 epoch: 90, train_loss: 0.8604, test_loss: 1.3918, test_f1: 0.5284
 epoch: 91, train_loss: 0.8519, test_loss: 1.3654, test_f1: 0.5562
 epoch: 92, train_loss: 0.8544, test_loss: 1.3096, test_f1: 0.5483
 epoch: 93, train_loss: 0.8494, test_loss: 1.3165, test_f1: 0.5195
 epoch: 94, train_loss: 0.8468, test_loss: 1.3196, test_f1: 0.5213
 epoch: 95, train_loss: 0.8321, test_loss: 1.3364, test_f1: 0.5317
 epoch: 96, train_loss: 0.8502, test_loss: 1.3688, test_f1: 0.5324
 epoch: 97, train_loss: 0.8488, test_loss: 1.3702, test_f1: 0.5275
 epoch: 98, train_loss: 0.8376, test_loss: 1.4006, test_f1: 0.5304
 epoch: 99, train_loss: 0.8333, test_loss: 1.3853, test_f1: 0.5499
##################ITERATION #2 ****************************************
 epoch: 0, train_loss: 1.3759, test_loss: 1.3624, test_f1: 0.2281
 epoch: 1, train_loss: 1.2834, test_loss: 1.3212, test_f1: 0.2281
 epoch: 2, train_loss: 1.2659, test_loss: 1.2990, test_f1: 0.2281
 epoch: 3, train_loss: 1.2468, test_loss: 1.2852, test_f1: 0.2281
 epoch: 4, train_loss: 1.2322, test_loss: 1.2752, test_f1: 0.2281
 epoch: 5, train_loss: 1.2198, test_loss: 1.2649, test_f1: 0.2281
 epoch: 6, train_loss: 1.2123, test_loss: 1.2571, test_f1: 0.2281
 epoch: 7, train_loss: 1.2040, test_loss: 1.2522, test_f1: 0.2281
 epoch: 8, train_loss: 1.1912, test_loss: 1.2458, test_f1: 0.2633
 epoch: 9, train_loss: 1.1877, test_loss: 1.2355, test_f1: 0.3066
 epoch: 10, train_loss: 1.1684, test_loss: 1.2238, test_f1: 0.3104
 epoch: 11, train_loss: 1.1565, test_loss: 1.2200, test_f1: 0.3725
 epoch: 12, train_loss: 1.1499, test_loss: 1.2224, test_f1: 0.3472
 epoch: 13, train_loss: 1.1423, test_loss: 1.2175, test_f1: 0.3744
 epoch: 14, train_loss: 1.1299, test_loss: 1.2116, test_f1: 0.3958
 epoch: 15, train_loss: 1.1257, test_loss: 1.2062, test_f1: 0.4107
 epoch: 16, train_loss: 1.1199, test_loss: 1.2184, test_f1: 0.3979
 epoch: 17, train_loss: 1.1078, test_loss: 1.2179, test_f1: 0.3979
 epoch: 18, train_loss: 1.1009, test_loss: 1.1997, test_f1: 0.4187
 epoch: 19, train_loss: 1.0997, test_loss: 1.2034, test_f1: 0.4249
 epoch: 20, train_loss: 1.0897, test_loss: 1.1953, test_f1: 0.4320
 epoch: 21, train_loss: 1.0759, test_loss: 1.2125, test_f1: 0.4124
 epoch: 22, train_loss: 1.0864, test_loss: 1.1792, test_f1: 0.4041
 epoch: 23, train_loss: 1.0658, test_loss: 1.2059, test_f1: 0.4097
 epoch: 24, train_loss: 1.0496, test_loss: 1.2257, test_f1: 0.4259
 epoch: 25, train_loss: 1.0420, test_loss: 1.2159, test_f1: 0.3988
 epoch: 26, train_loss: 1.0244, test_loss: 1.2244, test_f1: 0.4337
 epoch: 27, train_loss: 1.0433, test_loss: 1.2240, test_f1: 0.4733
 epoch: 28, train_loss: 1.0294, test_loss: 1.2193, test_f1: 0.4530
 epoch: 29, train_loss: 1.0216, test_loss: 1.2214, test_f1: 0.4410
 epoch: 30, train_loss: 1.0172, test_loss: 1.1943, test_f1: 0.4318
 epoch: 31, train_loss: 1.0085, test_loss: 1.2029, test_f1: 0.4392
 epoch: 32, train_loss: 0.9883, test_loss: 1.2305, test_f1: 0.4520
 epoch: 33, train_loss: 0.9894, test_loss: 1.2220, test_f1: 0.4758
 epoch: 34, train_loss: 0.9923, test_loss: 1.2252, test_f1: 0.4455
 epoch: 35, train_loss: 0.9905, test_loss: 1.2287, test_f1: 0.4450
 epoch: 36, train_loss: 0.9914, test_loss: 1.2028, test_f1: 0.4175
 epoch: 37, train_loss: 0.9754, test_loss: 1.2159, test_f1: 0.4335
 epoch: 38, train_loss: 0.9756, test_loss: 1.2149, test_f1: 0.4425
 epoch: 39, train_loss: 0.9701, test_loss: 1.2315, test_f1: 0.4576
 epoch: 40, train_loss: 0.9729, test_loss: 1.2188, test_f1: 0.4659
 epoch: 41, train_loss: 0.9635, test_loss: 1.2097, test_f1: 0.4606
 epoch: 42, train_loss: 0.9524, test_loss: 1.2165, test_f1: 0.4678
 epoch: 43, train_loss: 0.9600, test_loss: 1.2215, test_f1: 0.4611
 epoch: 44, train_loss: 0.9448, test_loss: 1.2554, test_f1: 0.4518
 epoch: 45, train_loss: 0.9467, test_loss: 1.2871, test_f1: 0.4746
 epoch: 46, train_loss: 0.9322, test_loss: 1.2138, test_f1: 0.4610
 epoch: 47, train_loss: 0.9304, test_loss: 1.2277, test_f1: 0.4582
 epoch: 48, train_loss: 0.9359, test_loss: 1.2195, test_f1: 0.4782
 epoch: 49, train_loss: 0.9154, test_loss: 1.2333, test_f1: 0.4592
 epoch: 50, train_loss: 0.9171, test_loss: 1.2242, test_f1: 0.4618
 epoch: 51, train_loss: 0.9257, test_loss: 1.2596, test_f1: 0.4151
 epoch: 52, train_loss: 0.9151, test_loss: 1.1988, test_f1: 0.4790
 epoch: 53, train_loss: 0.8920, test_loss: 1.2281, test_f1: 0.4491
 epoch: 54, train_loss: 0.9024, test_loss: 1.2196, test_f1: 0.4702
 epoch: 55, train_loss: 0.8924, test_loss: 1.2290, test_f1: 0.4790
 epoch: 56, train_loss: 0.8947, test_loss: 1.2466, test_f1: 0.4542
 epoch: 57, train_loss: 0.9036, test_loss: 1.2074, test_f1: 0.5009
 epoch: 58, train_loss: 0.8867, test_loss: 1.2211, test_f1: 0.4712
 epoch: 59, train_loss: 0.8945, test_loss: 1.2314, test_f1: 0.4654
 epoch: 60, train_loss: 0.8864, test_loss: 1.2209, test_f1: 0.4719
 epoch: 61, train_loss: 0.8791, test_loss: 1.2542, test_f1: 0.4410
 epoch: 62, train_loss: 0.8822, test_loss: 1.2563, test_f1: 0.4651
 epoch: 63, train_loss: 0.8655, test_loss: 1.2373, test_f1: 0.4489
 epoch: 64, train_loss: 0.8928, test_loss: 1.2700, test_f1: 0.4901
 epoch: 65, train_loss: 0.8855, test_loss: 1.2263, test_f1: 0.4590
 epoch: 66, train_loss: 0.8728, test_loss: 1.2122, test_f1: 0.4437
 epoch: 67, train_loss: 0.8781, test_loss: 1.2364, test_f1: 0.4714
 epoch: 68, train_loss: 0.8676, test_loss: 1.2530, test_f1: 0.4858
 epoch: 69, train_loss: 0.8689, test_loss: 1.2427, test_f1: 0.4799
 epoch: 70, train_loss: 0.8611, test_loss: 1.2280, test_f1: 0.4887
 epoch: 71, train_loss: 0.8538, test_loss: 1.2306, test_f1: 0.4761
 epoch: 72, train_loss: 0.8676, test_loss: 1.2428, test_f1: 0.4704
 epoch: 73, train_loss: 0.8588, test_loss: 1.2510, test_f1: 0.4841
 epoch: 74, train_loss: 0.8607, test_loss: 1.2807, test_f1: 0.4769
 epoch: 75, train_loss: 0.8328, test_loss: 1.2393, test_f1: 0.5027
 epoch: 76, train_loss: 0.8723, test_loss: 1.2316, test_f1: 0.4757
 epoch: 77, train_loss: 0.8539, test_loss: 1.2443, test_f1: 0.4819
 epoch: 78, train_loss: 0.8746, test_loss: 1.2473, test_f1: 0.4712
 epoch: 79, train_loss: 0.8663, test_loss: 1.2903, test_f1: 0.4827
 epoch: 80, train_loss: 0.8547, test_loss: 1.2601, test_f1: 0.4890
 epoch: 81, train_loss: 0.8598, test_loss: 1.2304, test_f1: 0.4893
 epoch: 82, train_loss: 0.8383, test_loss: 1.3024, test_f1: 0.4575
 epoch: 83, train_loss: 0.8473, test_loss: 1.2968, test_f1: 0.4633
 epoch: 84, train_loss: 0.8374, test_loss: 1.2802, test_f1: 0.4746
 epoch: 85, train_loss: 0.8458, test_loss: 1.2745, test_f1: 0.4690
 epoch: 86, train_loss: 0.8406, test_loss: 1.2899, test_f1: 0.4711
 epoch: 87, train_loss: 0.8483, test_loss: 1.2934, test_f1: 0.4667
 epoch: 88, train_loss: 0.8393, test_loss: 1.2920, test_f1: 0.4851
 epoch: 89, train_loss: 0.8209, test_loss: 1.2821, test_f1: 0.4841
 epoch: 90, train_loss: 0.8309, test_loss: 1.3032, test_f1: 0.4729
 epoch: 91, train_loss: 0.8355, test_loss: 1.3111, test_f1: 0.4792
 epoch: 92, train_loss: 0.8602, test_loss: 1.2904, test_f1: 0.4869
 epoch: 93, train_loss: 0.8238, test_loss: 1.2906, test_f1: 0.4851
 epoch: 94, train_loss: 0.8346, test_loss: 1.3354, test_f1: 0.4510
 epoch: 95, train_loss: 0.8309, test_loss: 1.2762, test_f1: 0.4789
 epoch: 96, train_loss: 0.8263, test_loss: 1.3163, test_f1: 0.4705
 epoch: 97, train_loss: 0.8182, test_loss: 1.2802, test_f1: 0.4911
 epoch: 98, train_loss: 0.8316, test_loss: 1.2872, test_f1: 0.5042
 epoch: 99, train_loss: 0.8038, test_loss: 1.3324, test_f1: 0.4659
##################ITERATION #3 ****************************************
 epoch: 0, train_loss: 1.3359, test_loss: 1.3526, test_f1: 0.2281
 epoch: 1, train_loss: 1.2505, test_loss: 1.3061, test_f1: 0.2281
 epoch: 2, train_loss: 1.2133, test_loss: 1.2902, test_f1: 0.2629
 epoch: 3, train_loss: 1.2021, test_loss: 1.2710, test_f1: 0.2686
 epoch: 4, train_loss: 1.1766, test_loss: 1.2583, test_f1: 0.3274
 epoch: 5, train_loss: 1.1501, test_loss: 1.2404, test_f1: 0.3352
 epoch: 6, train_loss: 1.1315, test_loss: 1.2353, test_f1: 0.3840
 epoch: 7, train_loss: 1.1171, test_loss: 1.2244, test_f1: 0.3834
 epoch: 8, train_loss: 1.1075, test_loss: 1.2177, test_f1: 0.3874
 epoch: 9, train_loss: 1.0974, test_loss: 1.2089, test_f1: 0.4163
 epoch: 10, train_loss: 1.0925, test_loss: 1.2099, test_f1: 0.3880
 epoch: 11, train_loss: 1.0716, test_loss: 1.2286, test_f1: 0.3950
 epoch: 12, train_loss: 1.0640, test_loss: 1.2221, test_f1: 0.4237
 epoch: 13, train_loss: 1.0619, test_loss: 1.1862, test_f1: 0.4229
 epoch: 14, train_loss: 1.0526, test_loss: 1.1855, test_f1: 0.4230
 epoch: 15, train_loss: 1.0338, test_loss: 1.1988, test_f1: 0.4274
 epoch: 16, train_loss: 1.0427, test_loss: 1.1748, test_f1: 0.4451
 epoch: 17, train_loss: 1.0191, test_loss: 1.1968, test_f1: 0.4560
 epoch: 18, train_loss: 1.0249, test_loss: 1.1889, test_f1: 0.4944
 epoch: 19, train_loss: 1.0059, test_loss: 1.1978, test_f1: 0.4888
 epoch: 20, train_loss: 1.0092, test_loss: 1.1826, test_f1: 0.5149
 epoch: 21, train_loss: 1.0025, test_loss: 1.1557, test_f1: 0.5099
 epoch: 22, train_loss: 0.9908, test_loss: 1.1507, test_f1: 0.4761
 epoch: 23, train_loss: 1.0036, test_loss: 1.1706, test_f1: 0.4842
 epoch: 24, train_loss: 0.9779, test_loss: 1.1651, test_f1: 0.4972
 epoch: 25, train_loss: 0.9672, test_loss: 1.1596, test_f1: 0.4770
 epoch: 26, train_loss: 0.9590, test_loss: 1.1417, test_f1: 0.4973
 epoch: 27, train_loss: 0.9478, test_loss: 1.1542, test_f1: 0.4852
 epoch: 28, train_loss: 0.9684, test_loss: 1.1546, test_f1: 0.4942
 epoch: 29, train_loss: 0.9571, test_loss: 1.1376, test_f1: 0.5168
 epoch: 30, train_loss: 0.9476, test_loss: 1.1386, test_f1: 0.5176
 epoch: 31, train_loss: 0.9297, test_loss: 1.1319, test_f1: 0.5105
 epoch: 32, train_loss: 0.9292, test_loss: 1.1481, test_f1: 0.5112
 epoch: 33, train_loss: 0.9151, test_loss: 1.1388, test_f1: 0.5229
 epoch: 34, train_loss: 0.9189, test_loss: 1.1540, test_f1: 0.4910
 epoch: 35, train_loss: 0.9029, test_loss: 1.1587, test_f1: 0.5095
 epoch: 36, train_loss: 0.9112, test_loss: 1.1569, test_f1: 0.5279
 epoch: 37, train_loss: 0.9220, test_loss: 1.1694, test_f1: 0.4946
 epoch: 38, train_loss: 0.9016, test_loss: 1.1592, test_f1: 0.5013
 epoch: 39, train_loss: 0.8903, test_loss: 1.1442, test_f1: 0.5256
 epoch: 40, train_loss: 0.8962, test_loss: 1.1486, test_f1: 0.4977
 epoch: 41, train_loss: 0.8946, test_loss: 1.1730, test_f1: 0.5165
 epoch: 42, train_loss: 0.9100, test_loss: 1.1816, test_f1: 0.5417
 epoch: 43, train_loss: 0.8845, test_loss: 1.1670, test_f1: 0.5049
 epoch: 44, train_loss: 0.8877, test_loss: 1.1477, test_f1: 0.5420
 epoch: 45, train_loss: 0.8819, test_loss: 1.1544, test_f1: 0.5569
 epoch: 46, train_loss: 0.8830, test_loss: 1.1780, test_f1: 0.5285
 epoch: 47, train_loss: 0.8695, test_loss: 1.1870, test_f1: 0.5403
 epoch: 48, train_loss: 0.8502, test_loss: 1.1772, test_f1: 0.5351
 epoch: 49, train_loss: 0.8781, test_loss: 1.2117, test_f1: 0.4907
 epoch: 50, train_loss: 0.8453, test_loss: 1.2327, test_f1: 0.4948
 epoch: 51, train_loss: 0.8487, test_loss: 1.2313, test_f1: 0.5057
 epoch: 52, train_loss: 0.8448, test_loss: 1.2279, test_f1: 0.4914
 epoch: 53, train_loss: 0.8481, test_loss: 1.2307, test_f1: 0.5007
 epoch: 54, train_loss: 0.8514, test_loss: 1.2600, test_f1: 0.5346
 epoch: 55, train_loss: 0.8415, test_loss: 1.2348, test_f1: 0.5230
 epoch: 56, train_loss: 0.8448, test_loss: 1.2330, test_f1: 0.4947
 epoch: 57, train_loss: 0.8432, test_loss: 1.2302, test_f1: 0.5279
 epoch: 58, train_loss: 0.8393, test_loss: 1.2425, test_f1: 0.5308
 epoch: 59, train_loss: 0.8328, test_loss: 1.2229, test_f1: 0.5210
 epoch: 60, train_loss: 0.8249, test_loss: 1.2469, test_f1: 0.4996
 epoch: 61, train_loss: 0.8303, test_loss: 1.2771, test_f1: 0.4980
 epoch: 62, train_loss: 0.8305, test_loss: 1.2884, test_f1: 0.4723
 epoch: 63, train_loss: 0.8100, test_loss: 1.2683, test_f1: 0.4808
 epoch: 64, train_loss: 0.8333, test_loss: 1.2645, test_f1: 0.5085
 epoch: 65, train_loss: 0.8265, test_loss: 1.3131, test_f1: 0.4644
 epoch: 66, train_loss: 0.8268, test_loss: 1.2768, test_f1: 0.4624
 epoch: 67, train_loss: 0.8174, test_loss: 1.3031, test_f1: 0.4835
 epoch: 68, train_loss: 0.8165, test_loss: 1.3031, test_f1: 0.4875
 epoch: 69, train_loss: 0.8114, test_loss: 1.2797, test_f1: 0.4918
 epoch: 70, train_loss: 0.8145, test_loss: 1.2885, test_f1: 0.4544
 epoch: 71, train_loss: 0.8313, test_loss: 1.2860, test_f1: 0.4986
 epoch: 72, train_loss: 0.8012, test_loss: 1.2880, test_f1: 0.4686
 epoch: 73, train_loss: 0.8194, test_loss: 1.2683, test_f1: 0.5029
 epoch: 74, train_loss: 0.8260, test_loss: 1.2623, test_f1: 0.5066
 epoch: 75, train_loss: 0.8156, test_loss: 1.3236, test_f1: 0.4753
 epoch: 76, train_loss: 0.8081, test_loss: 1.3121, test_f1: 0.4900
 epoch: 77, train_loss: 0.7968, test_loss: 1.2899, test_f1: 0.4951
 epoch: 78, train_loss: 0.7999, test_loss: 1.2781, test_f1: 0.4818
 epoch: 79, train_loss: 0.8104, test_loss: 1.2840, test_f1: 0.4983
 epoch: 80, train_loss: 0.7962, test_loss: 1.2943, test_f1: 0.4790
 epoch: 81, train_loss: 0.8244, test_loss: 1.3329, test_f1: 0.4689
 epoch: 82, train_loss: 0.7900, test_loss: 1.3409, test_f1: 0.4864
 epoch: 83, train_loss: 0.8103, test_loss: 1.3119, test_f1: 0.4914
 epoch: 84, train_loss: 0.7902, test_loss: 1.3614, test_f1: 0.4812
 epoch: 85, train_loss: 0.7917, test_loss: 1.3429, test_f1: 0.4887
 epoch: 86, train_loss: 0.8001, test_loss: 1.3700, test_f1: 0.4510
 epoch: 87, train_loss: 0.7995, test_loss: 1.3146, test_f1: 0.4668
 epoch: 88, train_loss: 0.8021, test_loss: 1.3442, test_f1: 0.4845
 epoch: 89, train_loss: 0.7873, test_loss: 1.3670, test_f1: 0.4370
 epoch: 90, train_loss: 0.7842, test_loss: 1.3667, test_f1: 0.4506
 epoch: 91, train_loss: 0.8034, test_loss: 1.3468, test_f1: 0.4643
 epoch: 92, train_loss: 0.7964, test_loss: 1.3565, test_f1: 0.4742
 epoch: 93, train_loss: 0.7826, test_loss: 1.3662, test_f1: 0.4614
 epoch: 94, train_loss: 0.7939, test_loss: 1.3417, test_f1: 0.4704
 epoch: 95, train_loss: 0.8005, test_loss: 1.3716, test_f1: 0.4802
 epoch: 96, train_loss: 0.7914, test_loss: 1.4127, test_f1: 0.4902
 epoch: 97, train_loss: 0.7849, test_loss: 1.4301, test_f1: 0.4685
 epoch: 98, train_loss: 0.7973, test_loss: 1.3961, test_f1: 0.4850
 epoch: 99, train_loss: 0.7813, test_loss: 1.3801, test_f1: 0.4959
##################ITERATION #4 ****************************************
 epoch: 0, train_loss: 1.3327, test_loss: 1.3597, test_f1: 0.2404
 epoch: 1, train_loss: 1.2385, test_loss: 1.3739, test_f1: 0.2404
 epoch: 2, train_loss: 1.2301, test_loss: 1.3748, test_f1: 0.2354
 epoch: 3, train_loss: 1.2193, test_loss: 1.3815, test_f1: 0.2659
 epoch: 4, train_loss: 1.1888, test_loss: 1.3337, test_f1: 0.2404
 epoch: 5, train_loss: 1.1892, test_loss: 1.2881, test_f1: 0.2757
 epoch: 6, train_loss: 1.1738, test_loss: 1.2702, test_f1: 0.2898
 epoch: 7, train_loss: 1.1616, test_loss: 1.2709, test_f1: 0.2965
 epoch: 8, train_loss: 1.1460, test_loss: 1.2596, test_f1: 0.3251
 epoch: 9, train_loss: 1.1461, test_loss: 1.2431, test_f1: 0.3200
 epoch: 10, train_loss: 1.1376, test_loss: 1.2393, test_f1: 0.3094
 epoch: 11, train_loss: 1.1259, test_loss: 1.2517, test_f1: 0.3126
 epoch: 12, train_loss: 1.1317, test_loss: 1.2377, test_f1: 0.3275
 epoch: 13, train_loss: 1.1213, test_loss: 1.2383, test_f1: 0.3204
 epoch: 14, train_loss: 1.1177, test_loss: 1.2131, test_f1: 0.3414
 epoch: 15, train_loss: 1.1150, test_loss: 1.2267, test_f1: 0.3270
 epoch: 16, train_loss: 1.1082, test_loss: 1.2087, test_f1: 0.3461
 epoch: 17, train_loss: 1.0942, test_loss: 1.1899, test_f1: 0.3483
 epoch: 18, train_loss: 1.0950, test_loss: 1.1864, test_f1: 0.3301
 epoch: 19, train_loss: 1.0807, test_loss: 1.1888, test_f1: 0.3288
 epoch: 20, train_loss: 1.0764, test_loss: 1.1827, test_f1: 0.3302
 epoch: 21, train_loss: 1.0735, test_loss: 1.1850, test_f1: 0.3494
 epoch: 22, train_loss: 1.0547, test_loss: 1.1886, test_f1: 0.3625
 epoch: 23, train_loss: 1.0537, test_loss: 1.1928, test_f1: 0.3359
 epoch: 24, train_loss: 1.0503, test_loss: 1.2120, test_f1: 0.3649
 epoch: 25, train_loss: 1.0448, test_loss: 1.1780, test_f1: 0.4035
 epoch: 26, train_loss: 1.0461, test_loss: 1.1973, test_f1: 0.3849
 epoch: 27, train_loss: 1.0307, test_loss: 1.1823, test_f1: 0.4024
 epoch: 28, train_loss: 1.0302, test_loss: 1.2024, test_f1: 0.3779
 epoch: 29, train_loss: 1.0435, test_loss: 1.1833, test_f1: 0.3981
 epoch: 30, train_loss: 1.0327, test_loss: 1.1624, test_f1: 0.3955
 epoch: 31, train_loss: 1.0255, test_loss: 1.1630, test_f1: 0.4131
 epoch: 32, train_loss: 1.0249, test_loss: 1.1590, test_f1: 0.4292
 epoch: 33, train_loss: 1.0067, test_loss: 1.1493, test_f1: 0.4178
 epoch: 34, train_loss: 1.0090, test_loss: 1.1424, test_f1: 0.4705
 epoch: 35, train_loss: 1.0032, test_loss: 1.1312, test_f1: 0.4884
 epoch: 36, train_loss: 1.0021, test_loss: 1.1391, test_f1: 0.4724
 epoch: 37, train_loss: 0.9874, test_loss: 1.1332, test_f1: 0.4541
 epoch: 38, train_loss: 0.9642, test_loss: 1.1321, test_f1: 0.4729
 epoch: 39, train_loss: 0.9752, test_loss: 1.1222, test_f1: 0.4873
 epoch: 40, train_loss: 0.9776, test_loss: 1.1207, test_f1: 0.4928
 epoch: 41, train_loss: 0.9684, test_loss: 1.1250, test_f1: 0.4824
 epoch: 42, train_loss: 0.9576, test_loss: 1.1095, test_f1: 0.4685
 epoch: 43, train_loss: 0.9642, test_loss: 1.1178, test_f1: 0.4890
 epoch: 44, train_loss: 0.9528, test_loss: 1.1123, test_f1: 0.5101
 epoch: 45, train_loss: 0.9550, test_loss: 1.0922, test_f1: 0.5165
 epoch: 46, train_loss: 0.9585, test_loss: 1.0953, test_f1: 0.5090
 epoch: 47, train_loss: 0.9449, test_loss: 1.0916, test_f1: 0.5011
 epoch: 48, train_loss: 0.9423, test_loss: 1.0763, test_f1: 0.5287
 epoch: 49, train_loss: 0.9450, test_loss: 1.1036, test_f1: 0.5008
 epoch: 50, train_loss: 0.9304, test_loss: 1.0974, test_f1: 0.5016
 epoch: 51, train_loss: 0.9206, test_loss: 1.0911, test_f1: 0.4998
 epoch: 52, train_loss: 0.9207, test_loss: 1.0870, test_f1: 0.5187
 epoch: 53, train_loss: 0.9212, test_loss: 1.0885, test_f1: 0.5373
 epoch: 54, train_loss: 0.9029, test_loss: 1.0803, test_f1: 0.5200
 epoch: 55, train_loss: 0.9056, test_loss: 1.1059, test_f1: 0.5245
 epoch: 56, train_loss: 0.9059, test_loss: 1.0712, test_f1: 0.5374
 epoch: 57, train_loss: 0.8962, test_loss: 1.0764, test_f1: 0.5521
 epoch: 58, train_loss: 0.8955, test_loss: 1.0832, test_f1: 0.5274
 epoch: 59, train_loss: 0.8993, test_loss: 1.0908, test_f1: 0.5123
 epoch: 60, train_loss: 0.8787, test_loss: 1.0863, test_f1: 0.5208
 epoch: 61, train_loss: 0.8857, test_loss: 1.1068, test_f1: 0.5161
 epoch: 62, train_loss: 0.8886, test_loss: 1.1067, test_f1: 0.5107
 epoch: 63, train_loss: 0.8871, test_loss: 1.0733, test_f1: 0.5355
 epoch: 64, train_loss: 0.8971, test_loss: 1.1022, test_f1: 0.5512
 epoch: 65, train_loss: 0.8910, test_loss: 1.0979, test_f1: 0.5562
 epoch: 66, train_loss: 0.8865, test_loss: 1.0738, test_f1: 0.5559
 epoch: 67, train_loss: 0.8761, test_loss: 1.0403, test_f1: 0.5645
 epoch: 68, train_loss: 0.8829, test_loss: 1.0638, test_f1: 0.5362
 epoch: 69, train_loss: 0.8749, test_loss: 1.0788, test_f1: 0.5541
 epoch: 70, train_loss: 0.8633, test_loss: 1.0466, test_f1: 0.5538
 epoch: 71, train_loss: 0.8741, test_loss: 1.0548, test_f1: 0.5539
 epoch: 72, train_loss: 0.8606, test_loss: 1.0734, test_f1: 0.5600
 epoch: 73, train_loss: 0.8557, test_loss: 1.0958, test_f1: 0.5523
 epoch: 74, train_loss: 0.8576, test_loss: 1.0973, test_f1: 0.5569
 epoch: 75, train_loss: 0.8638, test_loss: 1.0891, test_f1: 0.5852
 epoch: 76, train_loss: 0.8712, test_loss: 1.1032, test_f1: 0.5447
 epoch: 77, train_loss: 0.8544, test_loss: 1.0828, test_f1: 0.5372
 epoch: 78, train_loss: 0.8540, test_loss: 1.0633, test_f1: 0.5428
 epoch: 79, train_loss: 0.8531, test_loss: 1.0779, test_f1: 0.5455
 epoch: 80, train_loss: 0.8404, test_loss: 1.0924, test_f1: 0.5431
 epoch: 81, train_loss: 0.8534, test_loss: 1.1219, test_f1: 0.5403
 epoch: 82, train_loss: 0.8487, test_loss: 1.1093, test_f1: 0.5540
 epoch: 83, train_loss: 0.8438, test_loss: 1.0893, test_f1: 0.5469
 epoch: 84, train_loss: 0.8277, test_loss: 1.1106, test_f1: 0.5542
 epoch: 85, train_loss: 0.8288, test_loss: 1.1071, test_f1: 0.5441
 epoch: 86, train_loss: 0.8515, test_loss: 1.1295, test_f1: 0.5653
 epoch: 87, train_loss: 0.8470, test_loss: 1.1144, test_f1: 0.5950
 epoch: 88, train_loss: 0.8458, test_loss: 1.1066, test_f1: 0.5502
 epoch: 89, train_loss: 0.8355, test_loss: 1.1183, test_f1: 0.5837
 epoch: 90, train_loss: 0.8255, test_loss: 1.1257, test_f1: 0.5635
 epoch: 91, train_loss: 0.8167, test_loss: 1.1335, test_f1: 0.5590
 epoch: 92, train_loss: 0.8176, test_loss: 1.1188, test_f1: 0.5335
 epoch: 93, train_loss: 0.8159, test_loss: 1.1371, test_f1: 0.5471
 epoch: 94, train_loss: 0.8399, test_loss: 1.1103, test_f1: 0.5441
 epoch: 95, train_loss: 0.8366, test_loss: 1.1244, test_f1: 0.5419
 epoch: 96, train_loss: 0.8158, test_loss: 1.1186, test_f1: 0.5492
 epoch: 97, train_loss: 0.7987, test_loss: 1.1303, test_f1: 0.5352
 epoch: 98, train_loss: 0.8219, test_loss: 1.1576, test_f1: 0.5334
 epoch: 99, train_loss: 0.8161, test_loss: 1.1412, test_f1: 0.5348
##################ITERATION #5 ****************************************
 epoch: 0, train_loss: 1.3100, test_loss: 1.3552, test_f1: 0.2281
 epoch: 1, train_loss: 1.2742, test_loss: 1.3341, test_f1: 0.2281
 epoch: 2, train_loss: 1.2556, test_loss: 1.3147, test_f1: 0.2281
 epoch: 3, train_loss: 1.2307, test_loss: 1.3017, test_f1: 0.2224
 epoch: 4, train_loss: 1.2261, test_loss: 1.2941, test_f1: 0.2401
 epoch: 5, train_loss: 1.2118, test_loss: 1.2974, test_f1: 0.2573
 epoch: 6, train_loss: 1.2118, test_loss: 1.2980, test_f1: 0.2506
 epoch: 7, train_loss: 1.2010, test_loss: 1.2722, test_f1: 0.2613
 epoch: 8, train_loss: 1.1934, test_loss: 1.2584, test_f1: 0.2957
 epoch: 9, train_loss: 1.1833, test_loss: 1.2537, test_f1: 0.3006
 epoch: 10, train_loss: 1.1768, test_loss: 1.2445, test_f1: 0.2884
 epoch: 11, train_loss: 1.1843, test_loss: 1.2471, test_f1: 0.2863
 epoch: 12, train_loss: 1.1784, test_loss: 1.2517, test_f1: 0.2851
 epoch: 13, train_loss: 1.1703, test_loss: 1.2591, test_f1: 0.3024
 epoch: 14, train_loss: 1.1633, test_loss: 1.2447, test_f1: 0.3117
 epoch: 15, train_loss: 1.1700, test_loss: 1.2404, test_f1: 0.3058
 epoch: 16, train_loss: 1.1649, test_loss: 1.2352, test_f1: 0.3464
 epoch: 17, train_loss: 1.1602, test_loss: 1.2405, test_f1: 0.3546
 epoch: 18, train_loss: 1.1533, test_loss: 1.2267, test_f1: 0.3509
 epoch: 19, train_loss: 1.1550, test_loss: 1.2203, test_f1: 0.3617
 epoch: 20, train_loss: 1.1498, test_loss: 1.2085, test_f1: 0.3523
 epoch: 21, train_loss: 1.1364, test_loss: 1.2151, test_f1: 0.3311
 epoch: 22, train_loss: 1.1464, test_loss: 1.2249, test_f1: 0.3580
 epoch: 23, train_loss: 1.1378, test_loss: 1.2126, test_f1: 0.3577
 epoch: 24, train_loss: 1.1497, test_loss: 1.2153, test_f1: 0.3723
 epoch: 25, train_loss: 1.1366, test_loss: 1.2203, test_f1: 0.3805
 epoch: 26, train_loss: 1.1180, test_loss: 1.2423, test_f1: 0.3537
 epoch: 27, train_loss: 1.1388, test_loss: 1.2190, test_f1: 0.3603
 epoch: 28, train_loss: 1.1150, test_loss: 1.2045, test_f1: 0.3751
 epoch: 29, train_loss: 1.1274, test_loss: 1.2001, test_f1: 0.3797
 epoch: 30, train_loss: 1.1158, test_loss: 1.1952, test_f1: 0.3757
 epoch: 31, train_loss: 1.1242, test_loss: 1.2022, test_f1: 0.3640
 epoch: 32, train_loss: 1.1009, test_loss: 1.2100, test_f1: 0.3693
 epoch: 33, train_loss: 1.1061, test_loss: 1.2057, test_f1: 0.3858
 epoch: 34, train_loss: 1.0997, test_loss: 1.2123, test_f1: 0.3776
 epoch: 35, train_loss: 1.1052, test_loss: 1.1995, test_f1: 0.3495
 epoch: 36, train_loss: 1.1018, test_loss: 1.2020, test_f1: 0.3535
 epoch: 37, train_loss: 1.1086, test_loss: 1.1910, test_f1: 0.3599
 epoch: 38, train_loss: 1.0923, test_loss: 1.2073, test_f1: 0.3735
 epoch: 39, train_loss: 1.0815, test_loss: 1.2029, test_f1: 0.3853
 epoch: 40, train_loss: 1.0716, test_loss: 1.2033, test_f1: 0.3939
 epoch: 41, train_loss: 1.0937, test_loss: 1.2161, test_f1: 0.4140
 epoch: 42, train_loss: 1.0774, test_loss: 1.2137, test_f1: 0.3841
 epoch: 43, train_loss: 1.0712, test_loss: 1.1941, test_f1: 0.4108
 epoch: 44, train_loss: 1.0666, test_loss: 1.1813, test_f1: 0.3946
 epoch: 45, train_loss: 1.0715, test_loss: 1.1905, test_f1: 0.3931
 epoch: 46, train_loss: 1.0637, test_loss: 1.1854, test_f1: 0.4090
 epoch: 47, train_loss: 1.0570, test_loss: 1.2011, test_f1: 0.3815
 epoch: 48, train_loss: 1.0577, test_loss: 1.2054, test_f1: 0.4151
 epoch: 49, train_loss: 1.0471, test_loss: 1.2180, test_f1: 0.4077
 epoch: 50, train_loss: 1.0480, test_loss: 1.2097, test_f1: 0.3990
 epoch: 51, train_loss: 1.0249, test_loss: 1.1958, test_f1: 0.4249
 epoch: 52, train_loss: 1.0116, test_loss: 1.1944, test_f1: 0.4359
 epoch: 53, train_loss: 1.0310, test_loss: 1.2069, test_f1: 0.4237
 epoch: 54, train_loss: 1.0225, test_loss: 1.2136, test_f1: 0.4296
 epoch: 55, train_loss: 1.0275, test_loss: 1.1983, test_f1: 0.4250
 epoch: 56, train_loss: 1.0108, test_loss: 1.2104, test_f1: 0.4508
 epoch: 57, train_loss: 1.0304, test_loss: 1.2054, test_f1: 0.4381
 epoch: 58, train_loss: 1.0240, test_loss: 1.2108, test_f1: 0.4357
 epoch: 59, train_loss: 1.0130, test_loss: 1.2087, test_f1: 0.4307
 epoch: 60, train_loss: 1.0166, test_loss: 1.2034, test_f1: 0.4282
 epoch: 61, train_loss: 1.0032, test_loss: 1.2041, test_f1: 0.4260
 epoch: 62, train_loss: 1.0017, test_loss: 1.1996, test_f1: 0.4420
 epoch: 63, train_loss: 1.0185, test_loss: 1.1905, test_f1: 0.4505
 epoch: 64, train_loss: 0.9994, test_loss: 1.1897, test_f1: 0.4271
 epoch: 65, train_loss: 1.0198, test_loss: 1.1752, test_f1: 0.4489
 epoch: 66, train_loss: 1.0090, test_loss: 1.1810, test_f1: 0.4600
 epoch: 67, train_loss: 0.9877, test_loss: 1.1880, test_f1: 0.4519
 epoch: 68, train_loss: 0.9882, test_loss: 1.1782, test_f1: 0.4552
 epoch: 69, train_loss: 1.0000, test_loss: 1.1902, test_f1: 0.4499
 epoch: 70, train_loss: 1.0112, test_loss: 1.1755, test_f1: 0.4365
 epoch: 71, train_loss: 0.9797, test_loss: 1.1936, test_f1: 0.4517
 epoch: 72, train_loss: 0.9795, test_loss: 1.2016, test_f1: 0.4525
 epoch: 73, train_loss: 0.9946, test_loss: 1.1949, test_f1: 0.4528
 epoch: 74, train_loss: 0.9887, test_loss: 1.1910, test_f1: 0.4803
 epoch: 75, train_loss: 0.9811, test_loss: 1.1840, test_f1: 0.4715
 epoch: 76, train_loss: 0.9739, test_loss: 1.1884, test_f1: 0.4557
 epoch: 77, train_loss: 0.9844, test_loss: 1.1853, test_f1: 0.4497
 epoch: 78, train_loss: 0.9747, test_loss: 1.1926, test_f1: 0.4758
 epoch: 79, train_loss: 0.9708, test_loss: 1.1982, test_f1: 0.4665
 epoch: 80, train_loss: 0.9857, test_loss: 1.1985, test_f1: 0.4899
 epoch: 81, train_loss: 0.9713, test_loss: 1.1668, test_f1: 0.4541
 epoch: 82, train_loss: 0.9726, test_loss: 1.1700, test_f1: 0.4962
 epoch: 83, train_loss: 0.9706, test_loss: 1.1789, test_f1: 0.4772
 epoch: 84, train_loss: 0.9553, test_loss: 1.1842, test_f1: 0.4652
 epoch: 85, train_loss: 0.9819, test_loss: 1.1966, test_f1: 0.5021
 epoch: 86, train_loss: 0.9749, test_loss: 1.1999, test_f1: 0.4822
 epoch: 87, train_loss: 0.9570, test_loss: 1.1807, test_f1: 0.4665
 epoch: 88, train_loss: 0.9507, test_loss: 1.2026, test_f1: 0.4729
 epoch: 89, train_loss: 0.9348, test_loss: 1.2123, test_f1: 0.4926
 epoch: 90, train_loss: 0.9523, test_loss: 1.2065, test_f1: 0.4922
 epoch: 91, train_loss: 0.9604, test_loss: 1.2401, test_f1: 0.4620
 epoch: 92, train_loss: 0.9471, test_loss: 1.2284, test_f1: 0.4645
 epoch: 93, train_loss: 0.9590, test_loss: 1.2216, test_f1: 0.4818
 epoch: 94, train_loss: 0.9510, test_loss: 1.2290, test_f1: 0.4678
 epoch: 95, train_loss: 0.9558, test_loss: 1.2170, test_f1: 0.4763
 epoch: 96, train_loss: 0.9533, test_loss: 1.2016, test_f1: 0.4847
 epoch: 97, train_loss: 0.9373, test_loss: 1.1912, test_f1: 0.4975
 epoch: 98, train_loss: 0.9465, test_loss: 1.1951, test_f1: 0.5004
 epoch: 99, train_loss: 0.9359, test_loss: 1.2063, test_f1: 0.4561
##################ITERATION #6 ****************************************
 epoch: 0, train_loss: 1.2890, test_loss: 1.3681, test_f1: 0.2404
 epoch: 1, train_loss: 1.2401, test_loss: 1.3570, test_f1: 0.2404
 epoch: 2, train_loss: 1.2406, test_loss: 1.3460, test_f1: 0.2404
 epoch: 3, train_loss: 1.2237, test_loss: 1.3617, test_f1: 0.2518
 epoch: 4, train_loss: 1.2128, test_loss: 1.3551, test_f1: 0.2596
 epoch: 5, train_loss: 1.2109, test_loss: 1.3697, test_f1: 0.2835
 epoch: 6, train_loss: 1.1936, test_loss: 1.3313, test_f1: 0.3161
 epoch: 7, train_loss: 1.1945, test_loss: 1.3224, test_f1: 0.3169
 epoch: 8, train_loss: 1.1857, test_loss: 1.3110, test_f1: 0.3094
 epoch: 9, train_loss: 1.1875, test_loss: 1.3073, test_f1: 0.2914
 epoch: 10, train_loss: 1.1767, test_loss: 1.3092, test_f1: 0.3513
 epoch: 11, train_loss: 1.1741, test_loss: 1.3292, test_f1: 0.3600
 epoch: 12, train_loss: 1.1655, test_loss: 1.3076, test_f1: 0.3397
 epoch: 13, train_loss: 1.1740, test_loss: 1.2823, test_f1: 0.3760
 epoch: 14, train_loss: 1.1590, test_loss: 1.2744, test_f1: 0.3528
 epoch: 15, train_loss: 1.1603, test_loss: 1.2761, test_f1: 0.3493
 epoch: 16, train_loss: 1.1476, test_loss: 1.2841, test_f1: 0.3417
 epoch: 17, train_loss: 1.1458, test_loss: 1.2741, test_f1: 0.3625
 epoch: 18, train_loss: 1.1459, test_loss: 1.2862, test_f1: 0.3771
 epoch: 19, train_loss: 1.1408, test_loss: 1.2827, test_f1: 0.3479
 epoch: 20, train_loss: 1.1361, test_loss: 1.2709, test_f1: 0.3556
 epoch: 21, train_loss: 1.1446, test_loss: 1.2822, test_f1: 0.3495
 epoch: 22, train_loss: 1.1314, test_loss: 1.2850, test_f1: 0.3579
 epoch: 23, train_loss: 1.1292, test_loss: 1.2928, test_f1: 0.4025
 epoch: 24, train_loss: 1.1094, test_loss: 1.3296, test_f1: 0.3868
 epoch: 25, train_loss: 1.1215, test_loss: 1.2793, test_f1: 0.3575
 epoch: 26, train_loss: 1.1000, test_loss: 1.3159, test_f1: 0.3762
 epoch: 27, train_loss: 1.1101, test_loss: 1.3154, test_f1: 0.3918
 epoch: 28, train_loss: 1.0969, test_loss: 1.2958, test_f1: 0.4228
 epoch: 29, train_loss: 1.0880, test_loss: 1.2793, test_f1: 0.3896
 epoch: 30, train_loss: 1.0856, test_loss: 1.2780, test_f1: 0.3880
 epoch: 31, train_loss: 1.0725, test_loss: 1.2902, test_f1: 0.3975
 epoch: 32, train_loss: 1.0742, test_loss: 1.2827, test_f1: 0.4399
 epoch: 33, train_loss: 1.0873, test_loss: 1.2780, test_f1: 0.4254
 epoch: 34, train_loss: 1.0744, test_loss: 1.3204, test_f1: 0.3933
 epoch: 35, train_loss: 1.0640, test_loss: 1.2945, test_f1: 0.4593
 epoch: 36, train_loss: 1.0580, test_loss: 1.2929, test_f1: 0.4755
 epoch: 37, train_loss: 1.0500, test_loss: 1.3189, test_f1: 0.4092
 epoch: 38, train_loss: 1.0417, test_loss: 1.3024, test_f1: 0.4869
 epoch: 39, train_loss: 1.0448, test_loss: 1.2796, test_f1: 0.4779
 epoch: 40, train_loss: 1.0291, test_loss: 1.2994, test_f1: 0.4521
 epoch: 41, train_loss: 1.0488, test_loss: 1.4328, test_f1: 0.4536
 epoch: 42, train_loss: 1.0296, test_loss: 1.2900, test_f1: 0.4325
 epoch: 43, train_loss: 1.0146, test_loss: 1.3053, test_f1: 0.4177
 epoch: 44, train_loss: 1.0328, test_loss: 1.3137, test_f1: 0.4997
 epoch: 45, train_loss: 1.0200, test_loss: 1.3342, test_f1: 0.4711
 epoch: 46, train_loss: 1.0085, test_loss: 1.2973, test_f1: 0.4685
 epoch: 47, train_loss: 1.0168, test_loss: 1.2747, test_f1: 0.4371
 epoch: 48, train_loss: 0.9993, test_loss: 1.2967, test_f1: 0.4754
 epoch: 49, train_loss: 1.0108, test_loss: 1.4465, test_f1: 0.4761
 epoch: 50, train_loss: 1.0145, test_loss: 1.3477, test_f1: 0.4236
 epoch: 51, train_loss: 0.9900, test_loss: 1.2742, test_f1: 0.4541
 epoch: 52, train_loss: 0.9820, test_loss: 1.2799, test_f1: 0.4688
 epoch: 53, train_loss: 1.0025, test_loss: 1.3219, test_f1: 0.4456
 epoch: 54, train_loss: 1.0005, test_loss: 1.3462, test_f1: 0.4659
 epoch: 55, train_loss: 0.9952, test_loss: 1.3101, test_f1: 0.4415
 epoch: 56, train_loss: 0.9835, test_loss: 1.2993, test_f1: 0.4237
 epoch: 57, train_loss: 0.9964, test_loss: 1.3867, test_f1: 0.4516
 epoch: 58, train_loss: 0.9849, test_loss: 1.3363, test_f1: 0.4377
 epoch: 59, train_loss: 0.9711, test_loss: 1.3215, test_f1: 0.4388
 epoch: 60, train_loss: 0.9852, test_loss: 1.3403, test_f1: 0.4309
 epoch: 61, train_loss: 0.9733, test_loss: 1.3620, test_f1: 0.4518
 epoch: 62, train_loss: 0.9733, test_loss: 1.3087, test_f1: 0.4388
 epoch: 63, train_loss: 0.9663, test_loss: 1.3560, test_f1: 0.4503
 epoch: 64, train_loss: 0.9663, test_loss: 1.3723, test_f1: 0.4745
 epoch: 65, train_loss: 0.9711, test_loss: 1.3203, test_f1: 0.4432
 epoch: 66, train_loss: 0.9556, test_loss: 1.4430, test_f1: 0.4620
 epoch: 67, train_loss: 0.9623, test_loss: 1.4243, test_f1: 0.4675
 epoch: 68, train_loss: 0.9669, test_loss: 1.3393, test_f1: 0.4349
 epoch: 69, train_loss: 0.9670, test_loss: 1.3870, test_f1: 0.4391
 epoch: 70, train_loss: 0.9502, test_loss: 1.4314, test_f1: 0.4550
 epoch: 71, train_loss: 0.9488, test_loss: 1.3437, test_f1: 0.4626
 epoch: 72, train_loss: 0.9541, test_loss: 1.3269, test_f1: 0.4545
 epoch: 73, train_loss: 0.9691, test_loss: 1.5141, test_f1: 0.4790
 epoch: 74, train_loss: 0.9449, test_loss: 1.4080, test_f1: 0.4502
 epoch: 75, train_loss: 0.9610, test_loss: 1.4200, test_f1: 0.4727
 epoch: 76, train_loss: 0.9522, test_loss: 1.5048, test_f1: 0.4433
 epoch: 77, train_loss: 0.9541, test_loss: 1.4511, test_f1: 0.3997
 epoch: 78, train_loss: 0.9449, test_loss: 1.5786, test_f1: 0.4371
 epoch: 79, train_loss: 0.9518, test_loss: 1.5679, test_f1: 0.4258
 epoch: 80, train_loss: 0.9403, test_loss: 1.3694, test_f1: 0.4356
 epoch: 81, train_loss: 0.9412, test_loss: 1.4727, test_f1: 0.4517
 epoch: 82, train_loss: 0.9250, test_loss: 1.6308, test_f1: 0.4475
 epoch: 83, train_loss: 0.9336, test_loss: 1.5887, test_f1: 0.4474
 epoch: 84, train_loss: 0.9356, test_loss: 1.4249, test_f1: 0.4463
 epoch: 85, train_loss: 0.9300, test_loss: 1.3858, test_f1: 0.4112
 epoch: 86, train_loss: 0.9435, test_loss: 1.3990, test_f1: 0.4628
 epoch: 87, train_loss: 0.9310, test_loss: 1.4708, test_f1: 0.4833
 epoch: 88, train_loss: 0.9283, test_loss: 1.5142, test_f1: 0.4467
 epoch: 89, train_loss: 0.9246, test_loss: 1.4571, test_f1: 0.4471
 epoch: 90, train_loss: 0.9344, test_loss: 1.5177, test_f1: 0.4583
 epoch: 91, train_loss: 0.9220, test_loss: 1.4489, test_f1: 0.4624
 epoch: 92, train_loss: 0.9333, test_loss: 1.4769, test_f1: 0.4978
 epoch: 93, train_loss: 0.9336, test_loss: 1.6401, test_f1: 0.4470
 epoch: 94, train_loss: 0.9259, test_loss: 1.7809, test_f1: 0.4559
 epoch: 95, train_loss: 0.9263, test_loss: 1.5807, test_f1: 0.4622
 epoch: 96, train_loss: 0.9126, test_loss: 1.5791, test_f1: 0.4772
 epoch: 97, train_loss: 0.9186, test_loss: 1.4415, test_f1: 0.4342
 epoch: 98, train_loss: 0.9274, test_loss: 1.6182, test_f1: 0.4548
 epoch: 99, train_loss: 0.9102, test_loss: 1.5572, test_f1: 0.4374
##################ITERATION #7 ****************************************
 epoch: 0, train_loss: 1.2985, test_loss: 1.3238, test_f1: 0.2281
 epoch: 1, train_loss: 1.2355, test_loss: 1.3052, test_f1: 0.2281
 epoch: 2, train_loss: 1.2197, test_loss: 1.2895, test_f1: 0.2391
 epoch: 3, train_loss: 1.2130, test_loss: 1.2888, test_f1: 0.2849
 epoch: 4, train_loss: 1.1884, test_loss: 1.2654, test_f1: 0.2982
 epoch: 5, train_loss: 1.1606, test_loss: 1.2401, test_f1: 0.3121
 epoch: 6, train_loss: 1.1688, test_loss: 1.2588, test_f1: 0.3020
 epoch: 7, train_loss: 1.1580, test_loss: 1.2517, test_f1: 0.3230
 epoch: 8, train_loss: 1.1527, test_loss: 1.2466, test_f1: 0.3175
 epoch: 9, train_loss: 1.1406, test_loss: 1.2649, test_f1: 0.3209
 epoch: 10, train_loss: 1.1405, test_loss: 1.2422, test_f1: 0.3444
 epoch: 11, train_loss: 1.1224, test_loss: 1.2245, test_f1: 0.3621
 epoch: 12, train_loss: 1.1233, test_loss: 1.2189, test_f1: 0.3545
 epoch: 13, train_loss: 1.1086, test_loss: 1.2563, test_f1: 0.3554
 epoch: 14, train_loss: 1.0941, test_loss: 1.2392, test_f1: 0.3980
 epoch: 15, train_loss: 1.1132, test_loss: 1.2234, test_f1: 0.3993
 epoch: 16, train_loss: 1.1086, test_loss: 1.2320, test_f1: 0.4113
 epoch: 17, train_loss: 1.0890, test_loss: 1.2242, test_f1: 0.3952
 epoch: 18, train_loss: 1.0877, test_loss: 1.2219, test_f1: 0.4013
 epoch: 19, train_loss: 1.0807, test_loss: 1.2391, test_f1: 0.4013
 epoch: 20, train_loss: 1.0891, test_loss: 1.2687, test_f1: 0.3609
 epoch: 21, train_loss: 1.0719, test_loss: 1.2807, test_f1: 0.4066
 epoch: 22, train_loss: 1.0819, test_loss: 1.2511, test_f1: 0.3674
 epoch: 23, train_loss: 1.0607, test_loss: 1.2615, test_f1: 0.4077
 epoch: 24, train_loss: 1.0469, test_loss: 1.2262, test_f1: 0.4343
 epoch: 25, train_loss: 1.0432, test_loss: 1.2455, test_f1: 0.4097
 epoch: 26, train_loss: 1.0526, test_loss: 1.2297, test_f1: 0.4002
 epoch: 27, train_loss: 1.0545, test_loss: 1.2119, test_f1: 0.4323
 epoch: 28, train_loss: 1.0359, test_loss: 1.2060, test_f1: 0.4304
 epoch: 29, train_loss: 1.0205, test_loss: 1.2129, test_f1: 0.3987
 epoch: 30, train_loss: 1.0156, test_loss: 1.2558, test_f1: 0.4069
 epoch: 31, train_loss: 1.0208, test_loss: 1.2236, test_f1: 0.4108
 epoch: 32, train_loss: 0.9988, test_loss: 1.2218, test_f1: 0.4464
 epoch: 33, train_loss: 1.0023, test_loss: 1.1942, test_f1: 0.4665
 epoch: 34, train_loss: 0.9870, test_loss: 1.2070, test_f1: 0.4587
 epoch: 35, train_loss: 0.9956, test_loss: 1.2231, test_f1: 0.4973
 epoch: 36, train_loss: 0.9852, test_loss: 1.2085, test_f1: 0.4430
 epoch: 37, train_loss: 0.9925, test_loss: 1.2455, test_f1: 0.4392
 epoch: 38, train_loss: 0.9806, test_loss: 1.2052, test_f1: 0.4411
 epoch: 39, train_loss: 0.9628, test_loss: 1.2446, test_f1: 0.4132
 epoch: 40, train_loss: 0.9646, test_loss: 1.2117, test_f1: 0.4954
 epoch: 41, train_loss: 0.9738, test_loss: 1.1729, test_f1: 0.4376
 epoch: 42, train_loss: 0.9730, test_loss: 1.1827, test_f1: 0.4667
 epoch: 43, train_loss: 0.9414, test_loss: 1.2096, test_f1: 0.4277
 epoch: 44, train_loss: 0.9603, test_loss: 1.2112, test_f1: 0.4366
 epoch: 45, train_loss: 0.9463, test_loss: 1.1742, test_f1: 0.4663
 epoch: 46, train_loss: 0.9520, test_loss: 1.2006, test_f1: 0.4575
 epoch: 47, train_loss: 0.9350, test_loss: 1.2244, test_f1: 0.4746
 epoch: 48, train_loss: 0.9369, test_loss: 1.2258, test_f1: 0.5028
 epoch: 49, train_loss: 0.9439, test_loss: 1.2414, test_f1: 0.5112
 epoch: 50, train_loss: 0.9373, test_loss: 1.4114, test_f1: 0.4255
 epoch: 51, train_loss: 0.9425, test_loss: 1.2947, test_f1: 0.4923
 epoch: 52, train_loss: 0.9369, test_loss: 1.2725, test_f1: 0.4872
 epoch: 53, train_loss: 0.9416, test_loss: 1.2402, test_f1: 0.5178
 epoch: 54, train_loss: 0.9307, test_loss: 1.2160, test_f1: 0.4929
 epoch: 55, train_loss: 0.9397, test_loss: 1.2707, test_f1: 0.4824
 epoch: 56, train_loss: 0.9092, test_loss: 1.2887, test_f1: 0.4978
 epoch: 57, train_loss: 0.9071, test_loss: 1.2508, test_f1: 0.4908
 epoch: 58, train_loss: 0.9077, test_loss: 1.2503, test_f1: 0.4907
 epoch: 59, train_loss: 0.9341, test_loss: 1.2250, test_f1: 0.5031
 epoch: 60, train_loss: 0.9091, test_loss: 1.2310, test_f1: 0.4806
 epoch: 61, train_loss: 0.9055, test_loss: 1.2411, test_f1: 0.5204
 epoch: 62, train_loss: 0.9219, test_loss: 1.2058, test_f1: 0.5133
 epoch: 63, train_loss: 0.8945, test_loss: 1.2021, test_f1: 0.4965
 epoch: 64, train_loss: 0.9014, test_loss: 1.2061, test_f1: 0.4931
 epoch: 65, train_loss: 0.9032, test_loss: 1.2178, test_f1: 0.4810
 epoch: 66, train_loss: 0.8907, test_loss: 1.1974, test_f1: 0.4947
 epoch: 67, train_loss: 0.8832, test_loss: 1.2352, test_f1: 0.4987
 epoch: 68, train_loss: 0.8985, test_loss: 1.2348, test_f1: 0.5004
 epoch: 69, train_loss: 0.9047, test_loss: 1.2273, test_f1: 0.4898
 epoch: 70, train_loss: 0.9016, test_loss: 1.2375, test_f1: 0.5020
 epoch: 71, train_loss: 0.8991, test_loss: 1.2244, test_f1: 0.5169
 epoch: 72, train_loss: 0.8894, test_loss: 1.2257, test_f1: 0.5115
 epoch: 73, train_loss: 0.8864, test_loss: 1.2332, test_f1: 0.5031
 epoch: 74, train_loss: 0.8717, test_loss: 1.2393, test_f1: 0.4999
 epoch: 75, train_loss: 0.8777, test_loss: 1.2057, test_f1: 0.4878
 epoch: 76, train_loss: 0.8689, test_loss: 1.2212, test_f1: 0.4902
 epoch: 77, train_loss: 0.8725, test_loss: 1.2438, test_f1: 0.5107
 epoch: 78, train_loss: 0.8838, test_loss: 1.2477, test_f1: 0.5062
 epoch: 79, train_loss: 0.8756, test_loss: 1.2016, test_f1: 0.5225
 epoch: 80, train_loss: 0.8788, test_loss: 1.1964, test_f1: 0.5081
 epoch: 81, train_loss: 0.8729, test_loss: 1.2092, test_f1: 0.4977
 epoch: 82, train_loss: 0.8538, test_loss: 1.2349, test_f1: 0.5072
 epoch: 83, train_loss: 0.8624, test_loss: 1.2512, test_f1: 0.4844
 epoch: 84, train_loss: 0.8662, test_loss: 1.2419, test_f1: 0.5020
 epoch: 85, train_loss: 0.8567, test_loss: 1.2180, test_f1: 0.5249
 epoch: 86, train_loss: 0.8557, test_loss: 1.2823, test_f1: 0.4854
 epoch: 87, train_loss: 0.8557, test_loss: 1.2590, test_f1: 0.5110
 epoch: 88, train_loss: 0.8658, test_loss: 1.2381, test_f1: 0.4975
 epoch: 89, train_loss: 0.8502, test_loss: 1.2036, test_f1: 0.5263
 epoch: 90, train_loss: 0.8798, test_loss: 1.2448, test_f1: 0.5026
 epoch: 91, train_loss: 0.8424, test_loss: 1.2383, test_f1: 0.4830
 epoch: 92, train_loss: 0.8709, test_loss: 1.2328, test_f1: 0.5304
 epoch: 93, train_loss: 0.8447, test_loss: 1.2669, test_f1: 0.5162
 epoch: 94, train_loss: 0.8691, test_loss: 1.2754, test_f1: 0.5023
 epoch: 95, train_loss: 0.8442, test_loss: 1.2355, test_f1: 0.5404
 epoch: 96, train_loss: 0.8523, test_loss: 1.2436, test_f1: 0.5255
 epoch: 97, train_loss: 0.8513, test_loss: 1.3388, test_f1: 0.4980
 epoch: 98, train_loss: 0.8563, test_loss: 1.2674, test_f1: 0.5254
 epoch: 99, train_loss: 0.8469, test_loss: 1.2097, test_f1: 0.5392
##################ITERATION #8 ****************************************
 epoch: 0, train_loss: 1.3067, test_loss: 1.3889, test_f1: 0.2404
 epoch: 1, train_loss: 1.2613, test_loss: 1.3790, test_f1: 0.2391
 epoch: 2, train_loss: 1.2289, test_loss: 1.3605, test_f1: 0.2354
 epoch: 3, train_loss: 1.2297, test_loss: 1.3288, test_f1: 0.2597
 epoch: 4, train_loss: 1.2141, test_loss: 1.3357, test_f1: 0.2682
 epoch: 5, train_loss: 1.2077, test_loss: 1.3274, test_f1: 0.2530
 epoch: 6, train_loss: 1.2005, test_loss: 1.3135, test_f1: 0.2541
 epoch: 7, train_loss: 1.1775, test_loss: 1.2833, test_f1: 0.2649
 epoch: 8, train_loss: 1.1675, test_loss: 1.2733, test_f1: 0.2878
 epoch: 9, train_loss: 1.1611, test_loss: 1.3015, test_f1: 0.3213
 epoch: 10, train_loss: 1.1458, test_loss: 1.2871, test_f1: 0.3158
 epoch: 11, train_loss: 1.1311, test_loss: 1.2529, test_f1: 0.3302
 epoch: 12, train_loss: 1.1360, test_loss: 1.2728, test_f1: 0.3537
 epoch: 13, train_loss: 1.1318, test_loss: 1.2581, test_f1: 0.3694
 epoch: 14, train_loss: 1.1123, test_loss: 1.2772, test_f1: 0.3843
 epoch: 15, train_loss: 1.1059, test_loss: 1.2731, test_f1: 0.4174
 epoch: 16, train_loss: 1.0940, test_loss: 1.2302, test_f1: 0.4513
 epoch: 17, train_loss: 1.0778, test_loss: 1.2283, test_f1: 0.4358
 epoch: 18, train_loss: 1.0766, test_loss: 1.2148, test_f1: 0.4743
 epoch: 19, train_loss: 1.0482, test_loss: 1.2016, test_f1: 0.4913
 epoch: 20, train_loss: 1.0355, test_loss: 1.1993, test_f1: 0.4618
 epoch: 21, train_loss: 1.0490, test_loss: 1.2007, test_f1: 0.4787
 epoch: 22, train_loss: 1.0255, test_loss: 1.2179, test_f1: 0.4641
 epoch: 23, train_loss: 1.0198, test_loss: 1.1854, test_f1: 0.4757
 epoch: 24, train_loss: 1.0031, test_loss: 1.1688, test_f1: 0.5195
 epoch: 25, train_loss: 0.9836, test_loss: 1.1886, test_f1: 0.5073
 epoch: 26, train_loss: 0.9890, test_loss: 1.1957, test_f1: 0.5203
 epoch: 27, train_loss: 0.9849, test_loss: 1.1600, test_f1: 0.5403
 epoch: 28, train_loss: 0.9729, test_loss: 1.1843, test_f1: 0.5100
 epoch: 29, train_loss: 0.9634, test_loss: 1.1741, test_f1: 0.4772
 epoch: 30, train_loss: 0.9735, test_loss: 1.2263, test_f1: 0.4729
 epoch: 31, train_loss: 0.9699, test_loss: 1.1886, test_f1: 0.5304
 epoch: 32, train_loss: 0.9568, test_loss: 1.2413, test_f1: 0.4765
 epoch: 33, train_loss: 0.9594, test_loss: 1.1911, test_f1: 0.5094
 epoch: 34, train_loss: 0.9334, test_loss: 1.2210, test_f1: 0.5405
 epoch: 35, train_loss: 0.9277, test_loss: 1.2070, test_f1: 0.5182
 epoch: 36, train_loss: 0.9385, test_loss: 1.2124, test_f1: 0.5329
 epoch: 37, train_loss: 0.9302, test_loss: 1.2205, test_f1: 0.5438
 epoch: 38, train_loss: 0.9390, test_loss: 1.2298, test_f1: 0.5426
 epoch: 39, train_loss: 0.9289, test_loss: 1.2077, test_f1: 0.5241
 epoch: 40, train_loss: 0.9237, test_loss: 1.1968, test_f1: 0.5549
 epoch: 41, train_loss: 0.9102, test_loss: 1.2092, test_f1: 0.5269
 epoch: 42, train_loss: 0.8875, test_loss: 1.2541, test_f1: 0.5238
 epoch: 43, train_loss: 0.9208, test_loss: 1.1887, test_f1: 0.5221
 epoch: 44, train_loss: 0.8816, test_loss: 1.1889, test_f1: 0.5578
 epoch: 45, train_loss: 0.9157, test_loss: 1.2100, test_f1: 0.5529
 epoch: 46, train_loss: 0.8928, test_loss: 1.1976, test_f1: 0.5187
 epoch: 47, train_loss: 0.8935, test_loss: 1.2080, test_f1: 0.5357
 epoch: 48, train_loss: 0.8926, test_loss: 1.2766, test_f1: 0.4690
 epoch: 49, train_loss: 0.8721, test_loss: 1.2219, test_f1: 0.4610
 epoch: 50, train_loss: 0.8896, test_loss: 1.1931, test_f1: 0.5139
 epoch: 51, train_loss: 0.8622, test_loss: 1.1985, test_f1: 0.5143
 epoch: 52, train_loss: 0.8585, test_loss: 1.1994, test_f1: 0.5178
 epoch: 53, train_loss: 0.8629, test_loss: 1.2157, test_f1: 0.5204
 epoch: 54, train_loss: 0.8672, test_loss: 1.2650, test_f1: 0.5126
 epoch: 55, train_loss: 0.8553, test_loss: 1.2187, test_f1: 0.5416
 epoch: 56, train_loss: 0.8540, test_loss: 1.2327, test_f1: 0.5263
 epoch: 57, train_loss: 0.8536, test_loss: 1.2546, test_f1: 0.5303
 epoch: 58, train_loss: 0.8511, test_loss: 1.2331, test_f1: 0.5137
 epoch: 59, train_loss: 0.8426, test_loss: 1.2430, test_f1: 0.5155
 epoch: 60, train_loss: 0.8479, test_loss: 1.2347, test_f1: 0.5177
 epoch: 61, train_loss: 0.8501, test_loss: 1.2715, test_f1: 0.5107
 epoch: 62, train_loss: 0.8494, test_loss: 1.2817, test_f1: 0.5256
 epoch: 63, train_loss: 0.8566, test_loss: 1.2717, test_f1: 0.4953
 epoch: 64, train_loss: 0.8499, test_loss: 1.2314, test_f1: 0.5295
 epoch: 65, train_loss: 0.8425, test_loss: 1.2580, test_f1: 0.5342
 epoch: 66, train_loss: 0.8321, test_loss: 1.2753, test_f1: 0.5168
 epoch: 67, train_loss: 0.8370, test_loss: 1.2769, test_f1: 0.5262
 epoch: 68, train_loss: 0.8405, test_loss: 1.2581, test_f1: 0.5160
 epoch: 69, train_loss: 0.8444, test_loss: 1.2712, test_f1: 0.5156
 epoch: 70, train_loss: 0.8273, test_loss: 1.2758, test_f1: 0.5093
 epoch: 71, train_loss: 0.8499, test_loss: 1.2600, test_f1: 0.5105
 epoch: 72, train_loss: 0.8359, test_loss: 1.2837, test_f1: 0.5118
 epoch: 73, train_loss: 0.8429, test_loss: 1.2376, test_f1: 0.5194
 epoch: 74, train_loss: 0.8199, test_loss: 1.2495, test_f1: 0.5364
 epoch: 75, train_loss: 0.8291, test_loss: 1.2541, test_f1: 0.5411
 epoch: 76, train_loss: 0.8471, test_loss: 1.2385, test_f1: 0.5374
 epoch: 77, train_loss: 0.8251, test_loss: 1.2615, test_f1: 0.5195
 epoch: 78, train_loss: 0.8079, test_loss: 1.2908, test_f1: 0.5171
 epoch: 79, train_loss: 0.8226, test_loss: 1.2760, test_f1: 0.5294
 epoch: 80, train_loss: 0.8236, test_loss: 1.2681, test_f1: 0.5256
 epoch: 81, train_loss: 0.8141, test_loss: 1.3481, test_f1: 0.5140
 epoch: 82, train_loss: 0.8114, test_loss: 1.2933, test_f1: 0.5298
 epoch: 83, train_loss: 0.8110, test_loss: 1.2952, test_f1: 0.5443
 epoch: 84, train_loss: 0.8182, test_loss: 1.2781, test_f1: 0.5388
 epoch: 85, train_loss: 0.8348, test_loss: 1.2895, test_f1: 0.5322
 epoch: 86, train_loss: 0.8045, test_loss: 1.2629, test_f1: 0.5465
 epoch: 87, train_loss: 0.8121, test_loss: 1.2991, test_f1: 0.5426
 epoch: 88, train_loss: 0.8080, test_loss: 1.3151, test_f1: 0.5238
 epoch: 89, train_loss: 0.8056, test_loss: 1.3116, test_f1: 0.5137
 epoch: 90, train_loss: 0.8003, test_loss: 1.3242, test_f1: 0.5252
 epoch: 91, train_loss: 0.8003, test_loss: 1.2867, test_f1: 0.5433
 epoch: 92, train_loss: 0.8038, test_loss: 1.3053, test_f1: 0.4952
 epoch: 93, train_loss: 0.8124, test_loss: 1.3629, test_f1: 0.5004
 epoch: 94, train_loss: 0.7937, test_loss: 1.3048, test_f1: 0.5375
 epoch: 95, train_loss: 0.7987, test_loss: 1.2704, test_f1: 0.5360
 epoch: 96, train_loss: 0.7921, test_loss: 1.2606, test_f1: 0.5297
 epoch: 97, train_loss: 0.8013, test_loss: 1.2873, test_f1: 0.5262
 epoch: 98, train_loss: 0.7892, test_loss: 1.3150, test_f1: 0.5164
 epoch: 99, train_loss: 0.8019, test_loss: 1.3094, test_f1: 0.5555
##################ITERATION #9 ****************************************
 epoch: 0, train_loss: 2.2291, test_loss: 1.7568, test_f1: 0.0487
 epoch: 1, train_loss: 1.4949, test_loss: 1.4478, test_f1: 0.2130
 epoch: 2, train_loss: 1.3862, test_loss: 1.3866, test_f1: 0.2411
 epoch: 3, train_loss: 1.3259, test_loss: 1.3909, test_f1: 0.2681
 epoch: 4, train_loss: 1.2752, test_loss: 1.3713, test_f1: 0.2506
 epoch: 5, train_loss: 1.2556, test_loss: 1.3328, test_f1: 0.2730
 epoch: 6, train_loss: 1.2474, test_loss: 1.3688, test_f1: 0.2933
 epoch: 7, train_loss: 1.2401, test_loss: 1.3512, test_f1: 0.2998
 epoch: 8, train_loss: 1.2240, test_loss: 1.3300, test_f1: 0.3046
 epoch: 9, train_loss: 1.1958, test_loss: 1.2882, test_f1: 0.3196
 epoch: 10, train_loss: 1.1705, test_loss: 1.3023, test_f1: 0.3149
 epoch: 11, train_loss: 1.1901, test_loss: 1.2792, test_f1: 0.3291
 epoch: 12, train_loss: 1.1602, test_loss: 1.2758, test_f1: 0.3309
 epoch: 13, train_loss: 1.1593, test_loss: 1.2692, test_f1: 0.3140
 epoch: 14, train_loss: 1.1366, test_loss: 1.2696, test_f1: 0.3352
 epoch: 15, train_loss: 1.1338, test_loss: 1.3020, test_f1: 0.3261
 epoch: 16, train_loss: 1.1089, test_loss: 1.2915, test_f1: 0.3434
 epoch: 17, train_loss: 1.1254, test_loss: 1.2588, test_f1: 0.3505
 epoch: 18, train_loss: 1.1042, test_loss: 1.2513, test_f1: 0.3588
 epoch: 19, train_loss: 1.1157, test_loss: 1.2787, test_f1: 0.3683
 epoch: 20, train_loss: 1.1016, test_loss: 1.2750, test_f1: 0.3580
 epoch: 21, train_loss: 1.0810, test_loss: 1.2380, test_f1: 0.3553
 epoch: 22, train_loss: 1.0662, test_loss: 1.2360, test_f1: 0.3855
 epoch: 23, train_loss: 1.0704, test_loss: 1.1961, test_f1: 0.3752
 epoch: 24, train_loss: 1.0637, test_loss: 1.2118, test_f1: 0.3875
 epoch: 25, train_loss: 1.0569, test_loss: 1.2446, test_f1: 0.3907
 epoch: 26, train_loss: 1.0573, test_loss: 1.2684, test_f1: 0.4052
 epoch: 27, train_loss: 1.0552, test_loss: 1.2705, test_f1: 0.4080
 epoch: 28, train_loss: 1.0413, test_loss: 1.2779, test_f1: 0.4392
 epoch: 29, train_loss: 1.0408, test_loss: 1.2371, test_f1: 0.4231
 epoch: 30, train_loss: 1.0346, test_loss: 1.2077, test_f1: 0.4591
 epoch: 31, train_loss: 1.0139, test_loss: 1.2405, test_f1: 0.4397
 epoch: 32, train_loss: 1.0406, test_loss: 1.2790, test_f1: 0.4413
 epoch: 33, train_loss: 1.0179, test_loss: 1.3529, test_f1: 0.4631
 epoch: 34, train_loss: 1.0082, test_loss: 1.5576, test_f1: 0.4437
 epoch: 35, train_loss: 1.0175, test_loss: 1.6163, test_f1: 0.4405
 epoch: 36, train_loss: 1.0001, test_loss: 1.5826, test_f1: 0.4375
 epoch: 37, train_loss: 1.0013, test_loss: 1.2334, test_f1: 0.4595
 epoch: 38, train_loss: 1.0033, test_loss: 1.2900, test_f1: 0.4522
 epoch: 39, train_loss: 0.9788, test_loss: 1.2519, test_f1: 0.4960
 epoch: 40, train_loss: 0.9874, test_loss: 1.3004, test_f1: 0.4122
 epoch: 41, train_loss: 0.9719, test_loss: 1.2412, test_f1: 0.4805
 epoch: 42, train_loss: 0.9833, test_loss: 1.3009, test_f1: 0.4289
 epoch: 43, train_loss: 0.9839, test_loss: 1.2692, test_f1: 0.4952
 epoch: 44, train_loss: 0.9614, test_loss: 1.2712, test_f1: 0.5064
 epoch: 45, train_loss: 0.9697, test_loss: 1.2595, test_f1: 0.5295
 epoch: 46, train_loss: 0.9784, test_loss: 1.2499, test_f1: 0.5063
 epoch: 47, train_loss: 0.9589, test_loss: 1.2307, test_f1: 0.5073
 epoch: 48, train_loss: 0.9531, test_loss: 1.2836, test_f1: 0.5197
 epoch: 49, train_loss: 0.9494, test_loss: 1.2434, test_f1: 0.5344
 epoch: 50, train_loss: 0.9423, test_loss: 1.2211, test_f1: 0.5045
 epoch: 51, train_loss: 0.9331, test_loss: 1.2337, test_f1: 0.4894
 epoch: 52, train_loss: 0.9451, test_loss: 1.1837, test_f1: 0.5171
 epoch: 53, train_loss: 0.9254, test_loss: 1.2016, test_f1: 0.5144
 epoch: 54, train_loss: 0.9365, test_loss: 1.2135, test_f1: 0.5346
 epoch: 55, train_loss: 0.9194, test_loss: 1.2283, test_f1: 0.5288
 epoch: 56, train_loss: 0.9348, test_loss: 1.2173, test_f1: 0.5329
 epoch: 57, train_loss: 0.9287, test_loss: 1.2056, test_f1: 0.5187
 epoch: 58, train_loss: 0.9307, test_loss: 1.1971, test_f1: 0.5068
 epoch: 59, train_loss: 0.9281, test_loss: 1.1949, test_f1: 0.5305
 epoch: 60, train_loss: 0.9153, test_loss: 1.2039, test_f1: 0.5061
 epoch: 61, train_loss: 0.9061, test_loss: 1.2131, test_f1: 0.5403
 epoch: 62, train_loss: 0.9231, test_loss: 1.2070, test_f1: 0.5256
 epoch: 63, train_loss: 0.9181, test_loss: 1.2385, test_f1: 0.5289
 epoch: 64, train_loss: 0.8991, test_loss: 1.2509, test_f1: 0.5102
 epoch: 65, train_loss: 0.8990, test_loss: 1.2312, test_f1: 0.5356
 epoch: 66, train_loss: 0.9376, test_loss: 1.2225, test_f1: 0.5349
 epoch: 67, train_loss: 0.9118, test_loss: 1.2570, test_f1: 0.5329
 epoch: 68, train_loss: 0.9118, test_loss: 1.2597, test_f1: 0.5382
 epoch: 69, train_loss: 0.9248, test_loss: 1.2647, test_f1: 0.5225
 epoch: 70, train_loss: 0.9093, test_loss: 1.2965, test_f1: 0.5050
 epoch: 71, train_loss: 0.9170, test_loss: 1.3288, test_f1: 0.5152
 epoch: 72, train_loss: 0.9016, test_loss: 1.3376, test_f1: 0.4941
 epoch: 73, train_loss: 0.8976, test_loss: 1.2715, test_f1: 0.5012
 epoch: 74, train_loss: 0.8967, test_loss: 1.2986, test_f1: 0.5126
 epoch: 75, train_loss: 0.8930, test_loss: 1.3144, test_f1: 0.4848
 epoch: 76, train_loss: 0.8851, test_loss: 1.2711, test_f1: 0.5177
 epoch: 77, train_loss: 0.8889, test_loss: 1.2905, test_f1: 0.4990
 epoch: 78, train_loss: 0.8693, test_loss: 1.2832, test_f1: 0.4872
 epoch: 79, train_loss: 0.9097, test_loss: 1.3301, test_f1: 0.4648
 epoch: 80, train_loss: 0.8864, test_loss: 1.2664, test_f1: 0.5089
 epoch: 81, train_loss: 0.8672, test_loss: 1.2442, test_f1: 0.5280
 epoch: 82, train_loss: 0.8918, test_loss: 1.2850, test_f1: 0.5138
 epoch: 83, train_loss: 0.8887, test_loss: 1.2566, test_f1: 0.5230
 epoch: 84, train_loss: 0.8788, test_loss: 1.2813, test_f1: 0.5103
 epoch: 85, train_loss: 0.8755, test_loss: 1.3187, test_f1: 0.5099
 epoch: 86, train_loss: 0.9085, test_loss: 1.3119, test_f1: 0.5210
 epoch: 87, train_loss: 0.8892, test_loss: 1.3182, test_f1: 0.4962
 epoch: 88, train_loss: 0.8856, test_loss: 1.2709, test_f1: 0.5247
 epoch: 89, train_loss: 0.8694, test_loss: 1.3295, test_f1: 0.5053
 epoch: 90, train_loss: 0.8906, test_loss: 1.3269, test_f1: 0.4949
 epoch: 91, train_loss: 0.8705, test_loss: 1.3585, test_f1: 0.4795
 epoch: 92, train_loss: 0.8830, test_loss: 1.3759, test_f1: 0.4857
 epoch: 93, train_loss: 0.8718, test_loss: 1.3332, test_f1: 0.5294
 epoch: 94, train_loss: 0.8590, test_loss: 1.3089, test_f1: 0.5262
 epoch: 95, train_loss: 0.8660, test_loss: 1.3661, test_f1: 0.5182
 epoch: 96, train_loss: 0.8614, test_loss: 1.3487, test_f1: 0.5175
 epoch: 97, train_loss: 0.8597, test_loss: 1.3568, test_f1: 0.5003
 epoch: 98, train_loss: 0.8584, test_loss: 1.3428, test_f1: 0.5031
 epoch: 99, train_loss: 0.8687, test_loss: 1.3681, test_f1: 0.5009

Training completed in 432.20 seconds
Best F1: 0.5950 at epoch 87
Mean F1 across iterations: 0.5393  0.0289
========================FINAL RESULTS================================
FEGIN weighted F1: 0.5950  0.0289
python main.py --data ltspice_demos --representation component_component --model FEGIN --layers 4 --hiddens 16 --batch_size 128 --lr 0.001 --emb_size 128 --epochs 100 --save_appendix component_component_L4_H16_BS128_LR0.001_E128 --no_val
-----



STDERR:
  File "main.py", line 370, in <module>
    main()
  File "main.py", line 254, in main
    dataset = dataset_class(
  File "/home/philip/projects/ltspice_examples_code_repo/Circuit-Completion-Using-GNNs/component_classification_with_link_prediction_head/evaluation/FEGIN/kernel/circuit_datasets.py", line 15, in __init__
    self.data, self.slices = torch.load(self.processed_paths[0])
  File "/home/philip/.local/lib/python3.8/site-packages/torch/serialization.py", line 1040, in load
    warnings.warn(
  File "/usr/lib/python3.8/warnings.py", line 109, in _showwarnmsg
    sw(msg.message, msg.category, msg.filename, msg.lineno,
  File "main.py", line 47, in warn_with_traceback
    traceback.print_stack(file=log)
/home/philip/projects/ltspice_examples_code_repo/Circuit-Completion-Using-GNNs/component_classification_with_link_prediction_head/evaluation/FEGIN/kernel/circuit_datasets.py:15: FutureWarning: You are using `torch.load` with `weights_only=False` (the current default value), which uses the default pickle module implicitly. It is possible to construct malicious pickle data which will execute arbitrary code during unpickling (See https://github.com/pytorch/pytorch/blob/main/SECURITY.md#untrusted-models for more details). In a future release, the default value for `weights_only` will be flipped to `True`. This limits the functions that could be executed during unpickling. Arbitrary objects will no longer be allowed to be loaded via this mode unless they are explicitly allowlisted by the user via `torch.serialization.add_safe_globals`. We recommend you start setting `weights_only=True` for any use case where you don't have full control of the loaded file. Please open an issue on GitHub for any issues related to this experimental feature.
  self.data, self.slices = torch.load(self.processed_paths[0])
