STDOUT:
Results will be saved in /home/philip/projects/ltspice_examples_code_repo/Circuit-Completion-Using-GNNs/component_classification_with_link_prediction_head/evaluation/FEGIN/results/model_FEGIN_dataset_ltspice_demos
Command line input: python main.py --data ltspice_demos --representation component_net --model FEGIN --layers 2 --hiddens 64 --batch_size 128 --lr 0.0001 --emb_size 512 --epochs 100 --save_appendix component_net_L2_H64_BS128_LR0.0001_E512 --no_val
 is saved.
-----
ltspice_demos - FEGIN
Using 2 layers, 64 hidden units, h = 2
Loading component_net representation dataset
ENTERED
Training FEGIN on component_net representation
Train: 1565, Test: 383
##################ITERATION #0 ****************************************
 epoch: 0, train_loss: 1.3729, test_loss: 1.3675, test_f1: 0.2281
 epoch: 1, train_loss: 1.3663, test_loss: 1.3651, test_f1: 0.2281
 epoch: 2, train_loss: 1.3625, test_loss: 1.3625, test_f1: 0.2281
 epoch: 3, train_loss: 1.3589, test_loss: 1.3600, test_f1: 0.2281
 epoch: 4, train_loss: 1.3552, test_loss: 1.3573, test_f1: 0.2281
 epoch: 5, train_loss: 1.3512, test_loss: 1.3545, test_f1: 0.2281
 epoch: 6, train_loss: 1.3466, test_loss: 1.3516, test_f1: 0.2281
 epoch: 7, train_loss: 1.3421, test_loss: 1.3485, test_f1: 0.2281
 epoch: 8, train_loss: 1.3366, test_loss: 1.3448, test_f1: 0.2281
 epoch: 9, train_loss: 1.3315, test_loss: 1.3406, test_f1: 0.2281
 epoch: 10, train_loss: 1.3239, test_loss: 1.3359, test_f1: 0.2281
 epoch: 11, train_loss: 1.3171, test_loss: 1.3306, test_f1: 0.2281
 epoch: 12, train_loss: 1.3089, test_loss: 1.3250, test_f1: 0.2281
 epoch: 13, train_loss: 1.2980, test_loss: 1.3194, test_f1: 0.2281
 epoch: 14, train_loss: 1.2878, test_loss: 1.3123, test_f1: 0.2357
 epoch: 15, train_loss: 1.2781, test_loss: 1.3050, test_f1: 0.2719
 epoch: 16, train_loss: 1.2664, test_loss: 1.2971, test_f1: 0.2775
 epoch: 17, train_loss: 1.2517, test_loss: 1.2884, test_f1: 0.2746
 epoch: 18, train_loss: 1.2415, test_loss: 1.2803, test_f1: 0.2775
 epoch: 19, train_loss: 1.2311, test_loss: 1.2722, test_f1: 0.2775
 epoch: 20, train_loss: 1.2170, test_loss: 1.2629, test_f1: 0.2775
 epoch: 21, train_loss: 1.2041, test_loss: 1.2548, test_f1: 0.2818
 epoch: 22, train_loss: 1.1939, test_loss: 1.2471, test_f1: 0.2975
 epoch: 23, train_loss: 1.1867, test_loss: 1.2402, test_f1: 0.3366
 epoch: 24, train_loss: 1.1720, test_loss: 1.2340, test_f1: 0.3294
 epoch: 25, train_loss: 1.1692, test_loss: 1.2278, test_f1: 0.3386
 epoch: 26, train_loss: 1.1581, test_loss: 1.2203, test_f1: 0.3368
 epoch: 27, train_loss: 1.1478, test_loss: 1.2145, test_f1: 0.3408
 epoch: 28, train_loss: 1.1391, test_loss: 1.2097, test_f1: 0.3408
 epoch: 29, train_loss: 1.1343, test_loss: 1.2052, test_f1: 0.3495
 epoch: 30, train_loss: 1.1208, test_loss: 1.1995, test_f1: 0.3505
 epoch: 31, train_loss: 1.1185, test_loss: 1.1949, test_f1: 0.3508
 epoch: 32, train_loss: 1.1079, test_loss: 1.1892, test_f1: 0.3619
 epoch: 33, train_loss: 1.1038, test_loss: 1.1855, test_f1: 0.3669
 epoch: 34, train_loss: 1.0967, test_loss: 1.1817, test_f1: 0.3703
 epoch: 35, train_loss: 1.0903, test_loss: 1.1770, test_f1: 0.3826
 epoch: 36, train_loss: 1.0836, test_loss: 1.1750, test_f1: 0.3842
 epoch: 37, train_loss: 1.0755, test_loss: 1.1692, test_f1: 0.3923
 epoch: 38, train_loss: 1.0755, test_loss: 1.1660, test_f1: 0.4091
 epoch: 39, train_loss: 1.0660, test_loss: 1.1614, test_f1: 0.3933
 epoch: 40, train_loss: 1.0606, test_loss: 1.1517, test_f1: 0.3929
 epoch: 41, train_loss: 1.0544, test_loss: 1.1532, test_f1: 0.3873
 epoch: 42, train_loss: 1.0513, test_loss: 1.1522, test_f1: 0.3925
 epoch: 43, train_loss: 1.0431, test_loss: 1.1499, test_f1: 0.3961
 epoch: 44, train_loss: 1.0458, test_loss: 1.1421, test_f1: 0.4047
 epoch: 45, train_loss: 1.0343, test_loss: 1.1396, test_f1: 0.4153
 epoch: 46, train_loss: 1.0327, test_loss: 1.1414, test_f1: 0.4239
 epoch: 47, train_loss: 1.0322, test_loss: 1.1347, test_f1: 0.4254
 epoch: 48, train_loss: 1.0221, test_loss: 1.1361, test_f1: 0.4278
 epoch: 49, train_loss: 1.0188, test_loss: 1.1352, test_f1: 0.4250
 epoch: 50, train_loss: 1.0137, test_loss: 1.1340, test_f1: 0.4419
 epoch: 51, train_loss: 1.0122, test_loss: 1.1293, test_f1: 0.4350
 epoch: 52, train_loss: 1.0077, test_loss: 1.1306, test_f1: 0.4331
 epoch: 53, train_loss: 1.0045, test_loss: 1.1306, test_f1: 0.4321
 epoch: 54, train_loss: 1.0034, test_loss: 1.1239, test_f1: 0.4388
 epoch: 55, train_loss: 1.0047, test_loss: 1.1260, test_f1: 0.4406
 epoch: 56, train_loss: 0.9964, test_loss: 1.1228, test_f1: 0.4442
 epoch: 57, train_loss: 1.0022, test_loss: 1.1192, test_f1: 0.4406
 epoch: 58, train_loss: 0.9964, test_loss: 1.1165, test_f1: 0.4431
 epoch: 59, train_loss: 0.9982, test_loss: 1.1146, test_f1: 0.4472
 epoch: 60, train_loss: 0.9940, test_loss: 1.1065, test_f1: 0.4542
 epoch: 61, train_loss: 0.9913, test_loss: 1.1050, test_f1: 0.4521
 epoch: 62, train_loss: 0.9922, test_loss: 1.1075, test_f1: 0.4563
 epoch: 63, train_loss: 0.9884, test_loss: 1.1057, test_f1: 0.4523
 epoch: 64, train_loss: 0.9883, test_loss: 1.1080, test_f1: 0.4559
 epoch: 65, train_loss: 0.9827, test_loss: 1.1098, test_f1: 0.4579
 epoch: 66, train_loss: 0.9788, test_loss: 1.1100, test_f1: 0.4646
 epoch: 67, train_loss: 0.9864, test_loss: 1.1083, test_f1: 0.4584
 epoch: 68, train_loss: 0.9800, test_loss: 1.1028, test_f1: 0.4608
 epoch: 69, train_loss: 0.9751, test_loss: 1.1028, test_f1: 0.4678
 epoch: 70, train_loss: 0.9793, test_loss: 1.0976, test_f1: 0.4621
 epoch: 71, train_loss: 0.9750, test_loss: 1.0978, test_f1: 0.4676
 epoch: 72, train_loss: 0.9698, test_loss: 1.1055, test_f1: 0.4435
 epoch: 73, train_loss: 0.9703, test_loss: 1.0972, test_f1: 0.4632
 epoch: 74, train_loss: 0.9689, test_loss: 1.0969, test_f1: 0.4654
 epoch: 75, train_loss: 0.9729, test_loss: 1.0989, test_f1: 0.4686
 epoch: 76, train_loss: 0.9621, test_loss: 1.0959, test_f1: 0.4791
 epoch: 77, train_loss: 0.9597, test_loss: 1.0913, test_f1: 0.4729
 epoch: 78, train_loss: 0.9683, test_loss: 1.0975, test_f1: 0.4820
 epoch: 79, train_loss: 0.9619, test_loss: 1.0939, test_f1: 0.4791
 epoch: 80, train_loss: 0.9613, test_loss: 1.0943, test_f1: 0.4767
 epoch: 81, train_loss: 0.9613, test_loss: 1.0925, test_f1: 0.4760
 epoch: 82, train_loss: 0.9570, test_loss: 1.0932, test_f1: 0.4759
 epoch: 83, train_loss: 0.9598, test_loss: 1.0899, test_f1: 0.4698
 epoch: 84, train_loss: 0.9494, test_loss: 1.0940, test_f1: 0.4729
 epoch: 85, train_loss: 0.9566, test_loss: 1.0851, test_f1: 0.4698
 epoch: 86, train_loss: 0.9480, test_loss: 1.0788, test_f1: 0.4659
 epoch: 87, train_loss: 0.9555, test_loss: 1.0855, test_f1: 0.4853
 epoch: 88, train_loss: 0.9505, test_loss: 1.0867, test_f1: 0.4671
 epoch: 89, train_loss: 0.9468, test_loss: 1.0921, test_f1: 0.4764
 epoch: 90, train_loss: 0.9421, test_loss: 1.0857, test_f1: 0.4790
 epoch: 91, train_loss: 0.9436, test_loss: 1.0811, test_f1: 0.4794
 epoch: 92, train_loss: 0.9334, test_loss: 1.0873, test_f1: 0.4789
 epoch: 93, train_loss: 0.9442, test_loss: 1.0859, test_f1: 0.4773
 epoch: 94, train_loss: 0.9353, test_loss: 1.0858, test_f1: 0.4844
 epoch: 95, train_loss: 0.9388, test_loss: 1.0856, test_f1: 0.4830
 epoch: 96, train_loss: 0.9474, test_loss: 1.0908, test_f1: 0.4798
 epoch: 97, train_loss: 0.9305, test_loss: 1.0830, test_f1: 0.4696
 epoch: 98, train_loss: 0.9384, test_loss: 1.0806, test_f1: 0.4889
 epoch: 99, train_loss: 0.9308, test_loss: 1.0878, test_f1: 0.4827
##################ITERATION #1 ****************************************
 epoch: 0, train_loss: 1.3196, test_loss: 1.3378, test_f1: 0.2281
 epoch: 1, train_loss: 1.2994, test_loss: 1.3313, test_f1: 0.2281
 epoch: 2, train_loss: 1.2860, test_loss: 1.3230, test_f1: 0.2281
 epoch: 3, train_loss: 1.2741, test_loss: 1.3114, test_f1: 0.2281
 epoch: 4, train_loss: 1.2644, test_loss: 1.2992, test_f1: 0.2583
 epoch: 5, train_loss: 1.2520, test_loss: 1.2887, test_f1: 0.2583
 epoch: 6, train_loss: 1.2379, test_loss: 1.2813, test_f1: 0.2632
 epoch: 7, train_loss: 1.2252, test_loss: 1.2732, test_f1: 0.2777
 epoch: 8, train_loss: 1.2127, test_loss: 1.2649, test_f1: 0.2831
 epoch: 9, train_loss: 1.2010, test_loss: 1.2573, test_f1: 0.2831
 epoch: 10, train_loss: 1.1895, test_loss: 1.2482, test_f1: 0.2883
 epoch: 11, train_loss: 1.1764, test_loss: 1.2393, test_f1: 0.2919
 epoch: 12, train_loss: 1.1678, test_loss: 1.2313, test_f1: 0.2921
 epoch: 13, train_loss: 1.1512, test_loss: 1.2222, test_f1: 0.3012
 epoch: 14, train_loss: 1.1432, test_loss: 1.2137, test_f1: 0.3460
 epoch: 15, train_loss: 1.1320, test_loss: 1.2062, test_f1: 0.3615
 epoch: 16, train_loss: 1.1222, test_loss: 1.1983, test_f1: 0.3687
 epoch: 17, train_loss: 1.1090, test_loss: 1.1901, test_f1: 0.3877
 epoch: 18, train_loss: 1.1019, test_loss: 1.1826, test_f1: 0.3927
 epoch: 19, train_loss: 1.0932, test_loss: 1.1766, test_f1: 0.3989
 epoch: 20, train_loss: 1.0854, test_loss: 1.1677, test_f1: 0.4004
 epoch: 21, train_loss: 1.0778, test_loss: 1.1596, test_f1: 0.4029
 epoch: 22, train_loss: 1.0681, test_loss: 1.1568, test_f1: 0.4029
 epoch: 23, train_loss: 1.0565, test_loss: 1.1567, test_f1: 0.4069
 epoch: 24, train_loss: 1.0609, test_loss: 1.1493, test_f1: 0.4058
 epoch: 25, train_loss: 1.0434, test_loss: 1.1439, test_f1: 0.4058
 epoch: 26, train_loss: 1.0448, test_loss: 1.1396, test_f1: 0.4078
 epoch: 27, train_loss: 1.0411, test_loss: 1.1382, test_f1: 0.4082
 epoch: 28, train_loss: 1.0314, test_loss: 1.1352, test_f1: 0.4140
 epoch: 29, train_loss: 1.0352, test_loss: 1.1269, test_f1: 0.4122
 epoch: 30, train_loss: 1.0242, test_loss: 1.1228, test_f1: 0.4203
 epoch: 31, train_loss: 1.0099, test_loss: 1.1214, test_f1: 0.4227
 epoch: 32, train_loss: 1.0116, test_loss: 1.1159, test_f1: 0.4224
 epoch: 33, train_loss: 1.0187, test_loss: 1.1109, test_f1: 0.4284
 epoch: 34, train_loss: 1.0045, test_loss: 1.1065, test_f1: 0.4346
 epoch: 35, train_loss: 1.0093, test_loss: 1.1071, test_f1: 0.4413
 epoch: 36, train_loss: 0.9852, test_loss: 1.0958, test_f1: 0.4466
 epoch: 37, train_loss: 0.9917, test_loss: 1.1036, test_f1: 0.4331
 epoch: 38, train_loss: 0.9844, test_loss: 1.0987, test_f1: 0.4374
 epoch: 39, train_loss: 0.9847, test_loss: 1.0970, test_f1: 0.4412
 epoch: 40, train_loss: 0.9839, test_loss: 1.0911, test_f1: 0.4395
 epoch: 41, train_loss: 0.9720, test_loss: 1.0909, test_f1: 0.4465
 epoch: 42, train_loss: 0.9741, test_loss: 1.0876, test_f1: 0.4425
 epoch: 43, train_loss: 0.9707, test_loss: 1.0926, test_f1: 0.4492
 epoch: 44, train_loss: 0.9616, test_loss: 1.0818, test_f1: 0.4614
 epoch: 45, train_loss: 0.9576, test_loss: 1.0881, test_f1: 0.4538
 epoch: 46, train_loss: 0.9603, test_loss: 1.0769, test_f1: 0.4503
 epoch: 47, train_loss: 0.9588, test_loss: 1.0798, test_f1: 0.4544
 epoch: 48, train_loss: 0.9506, test_loss: 1.0816, test_f1: 0.4517
 epoch: 49, train_loss: 0.9452, test_loss: 1.0786, test_f1: 0.4931
 epoch: 50, train_loss: 0.9442, test_loss: 1.0874, test_f1: 0.4895
 epoch: 51, train_loss: 0.9386, test_loss: 1.0861, test_f1: 0.4890
 epoch: 52, train_loss: 0.9370, test_loss: 1.0794, test_f1: 0.4749
 epoch: 53, train_loss: 0.9322, test_loss: 1.0808, test_f1: 0.4780
 epoch: 54, train_loss: 0.9440, test_loss: 1.0853, test_f1: 0.4977
 epoch: 55, train_loss: 0.9327, test_loss: 1.0819, test_f1: 0.4644
 epoch: 56, train_loss: 0.9287, test_loss: 1.0851, test_f1: 0.4646
 epoch: 57, train_loss: 0.9283, test_loss: 1.0847, test_f1: 0.4677
 epoch: 58, train_loss: 0.9326, test_loss: 1.0801, test_f1: 0.4650
 epoch: 59, train_loss: 0.9266, test_loss: 1.0749, test_f1: 0.4754
 epoch: 60, train_loss: 0.9259, test_loss: 1.0808, test_f1: 0.4600
 epoch: 61, train_loss: 0.9262, test_loss: 1.0884, test_f1: 0.4888
 epoch: 62, train_loss: 0.9241, test_loss: 1.0909, test_f1: 0.4723
 epoch: 63, train_loss: 0.9259, test_loss: 1.0855, test_f1: 0.4920
 epoch: 64, train_loss: 0.9213, test_loss: 1.0860, test_f1: 0.4999
 epoch: 65, train_loss: 0.9232, test_loss: 1.0864, test_f1: 0.4731
 epoch: 66, train_loss: 0.9220, test_loss: 1.0791, test_f1: 0.4969
 epoch: 67, train_loss: 0.9208, test_loss: 1.0830, test_f1: 0.4898
 epoch: 68, train_loss: 0.9186, test_loss: 1.0835, test_f1: 0.4902
 epoch: 69, train_loss: 0.9155, test_loss: 1.0817, test_f1: 0.4796
 epoch: 70, train_loss: 0.9265, test_loss: 1.0861, test_f1: 0.4910
 epoch: 71, train_loss: 0.9169, test_loss: 1.0823, test_f1: 0.5133
 epoch: 72, train_loss: 0.9107, test_loss: 1.0870, test_f1: 0.4842
 epoch: 73, train_loss: 0.9137, test_loss: 1.0932, test_f1: 0.4885
 epoch: 74, train_loss: 0.9071, test_loss: 1.0822, test_f1: 0.4683
 epoch: 75, train_loss: 0.9131, test_loss: 1.0965, test_f1: 0.4731
 epoch: 76, train_loss: 0.9119, test_loss: 1.0930, test_f1: 0.4731
 epoch: 77, train_loss: 0.9153, test_loss: 1.0930, test_f1: 0.5039
 epoch: 78, train_loss: 0.9119, test_loss: 1.0883, test_f1: 0.5018
 epoch: 79, train_loss: 0.9073, test_loss: 1.0854, test_f1: 0.5019
 epoch: 80, train_loss: 0.9059, test_loss: 1.0894, test_f1: 0.5057
 epoch: 81, train_loss: 0.9133, test_loss: 1.0897, test_f1: 0.5013
 epoch: 82, train_loss: 0.9097, test_loss: 1.0841, test_f1: 0.5081
 epoch: 83, train_loss: 0.8999, test_loss: 1.0872, test_f1: 0.5060
 epoch: 84, train_loss: 0.9122, test_loss: 1.0982, test_f1: 0.5088
 epoch: 85, train_loss: 0.9035, test_loss: 1.0837, test_f1: 0.5080
 epoch: 86, train_loss: 0.8976, test_loss: 1.0699, test_f1: 0.5084
 epoch: 87, train_loss: 0.8999, test_loss: 1.0917, test_f1: 0.5103
 epoch: 88, train_loss: 0.8949, test_loss: 1.0908, test_f1: 0.5048
 epoch: 89, train_loss: 0.9104, test_loss: 1.0908, test_f1: 0.5081
 epoch: 90, train_loss: 0.9030, test_loss: 1.0906, test_f1: 0.5090
 epoch: 91, train_loss: 0.8990, test_loss: 1.1001, test_f1: 0.5102
 epoch: 92, train_loss: 0.8957, test_loss: 1.0958, test_f1: 0.5075
 epoch: 93, train_loss: 0.8953, test_loss: 1.0910, test_f1: 0.5002
 epoch: 94, train_loss: 0.8934, test_loss: 1.0935, test_f1: 0.5012
 epoch: 95, train_loss: 0.8914, test_loss: 1.0918, test_f1: 0.5057
 epoch: 96, train_loss: 0.8925, test_loss: 1.0860, test_f1: 0.5050
 epoch: 97, train_loss: 0.8940, test_loss: 1.0923, test_f1: 0.5134
 epoch: 98, train_loss: 0.8939, test_loss: 1.0832, test_f1: 0.5129
 epoch: 99, train_loss: 0.8857, test_loss: 1.0866, test_f1: 0.5109
##################ITERATION #2 ****************************************
 epoch: 0, train_loss: 1.3122, test_loss: 1.3321, test_f1: 0.2281
 epoch: 1, train_loss: 1.2857, test_loss: 1.3242, test_f1: 0.2281
 epoch: 2, train_loss: 1.2702, test_loss: 1.3158, test_f1: 0.2281
 epoch: 3, train_loss: 1.2555, test_loss: 1.3033, test_f1: 0.2281
 epoch: 4, train_loss: 1.2448, test_loss: 1.2896, test_f1: 0.2281
 epoch: 5, train_loss: 1.2266, test_loss: 1.2758, test_f1: 0.2281
 epoch: 6, train_loss: 1.2164, test_loss: 1.2633, test_f1: 0.2801
 epoch: 7, train_loss: 1.2004, test_loss: 1.2516, test_f1: 0.2744
 epoch: 8, train_loss: 1.1884, test_loss: 1.2418, test_f1: 0.2842
 epoch: 9, train_loss: 1.1763, test_loss: 1.2320, test_f1: 0.2873
 epoch: 10, train_loss: 1.1590, test_loss: 1.2218, test_f1: 0.2899
 epoch: 11, train_loss: 1.1495, test_loss: 1.2124, test_f1: 0.2923
 epoch: 12, train_loss: 1.1321, test_loss: 1.2049, test_f1: 0.2998
 epoch: 13, train_loss: 1.1262, test_loss: 1.1944, test_f1: 0.3183
 epoch: 14, train_loss: 1.1130, test_loss: 1.1844, test_f1: 0.3381
 epoch: 15, train_loss: 1.1088, test_loss: 1.1749, test_f1: 0.3398
 epoch: 16, train_loss: 1.0996, test_loss: 1.1686, test_f1: 0.3479
 epoch: 17, train_loss: 1.0767, test_loss: 1.1660, test_f1: 0.3530
 epoch: 18, train_loss: 1.0777, test_loss: 1.1601, test_f1: 0.3701
 epoch: 19, train_loss: 1.0710, test_loss: 1.1569, test_f1: 0.4047
 epoch: 20, train_loss: 1.0645, test_loss: 1.1510, test_f1: 0.4037
 epoch: 21, train_loss: 1.0614, test_loss: 1.1468, test_f1: 0.3986
 epoch: 22, train_loss: 1.0527, test_loss: 1.1410, test_f1: 0.4076
 epoch: 23, train_loss: 1.0425, test_loss: 1.1398, test_f1: 0.4119
 epoch: 24, train_loss: 1.0364, test_loss: 1.1374, test_f1: 0.4151
 epoch: 25, train_loss: 1.0294, test_loss: 1.1315, test_f1: 0.4104
 epoch: 26, train_loss: 1.0254, test_loss: 1.1321, test_f1: 0.4246
 epoch: 27, train_loss: 1.0235, test_loss: 1.1321, test_f1: 0.4176
 epoch: 28, train_loss: 1.0216, test_loss: 1.1308, test_f1: 0.4202
 epoch: 29, train_loss: 1.0062, test_loss: 1.1281, test_f1: 0.4155
 epoch: 30, train_loss: 1.0063, test_loss: 1.1256, test_f1: 0.4199
 epoch: 31, train_loss: 1.0051, test_loss: 1.1242, test_f1: 0.4155
 epoch: 32, train_loss: 1.0087, test_loss: 1.1250, test_f1: 0.4223
 epoch: 33, train_loss: 0.9918, test_loss: 1.1191, test_f1: 0.4280
 epoch: 34, train_loss: 0.9940, test_loss: 1.1157, test_f1: 0.4226
 epoch: 35, train_loss: 0.9863, test_loss: 1.1157, test_f1: 0.4252
 epoch: 36, train_loss: 0.9826, test_loss: 1.1291, test_f1: 0.4287
 epoch: 37, train_loss: 0.9743, test_loss: 1.1090, test_f1: 0.4309
 epoch: 38, train_loss: 0.9750, test_loss: 1.1084, test_f1: 0.4409
 epoch: 39, train_loss: 0.9770, test_loss: 1.1047, test_f1: 0.4336
 epoch: 40, train_loss: 0.9767, test_loss: 1.1092, test_f1: 0.4309
 epoch: 41, train_loss: 0.9719, test_loss: 1.1095, test_f1: 0.4360
 epoch: 42, train_loss: 0.9656, test_loss: 1.1173, test_f1: 0.4393
 epoch: 43, train_loss: 0.9606, test_loss: 1.1050, test_f1: 0.4356
 epoch: 44, train_loss: 0.9596, test_loss: 1.1168, test_f1: 0.4352
 epoch: 45, train_loss: 0.9536, test_loss: 1.1052, test_f1: 0.4391
 epoch: 46, train_loss: 0.9488, test_loss: 1.1116, test_f1: 0.4395
 epoch: 47, train_loss: 0.9494, test_loss: 1.1042, test_f1: 0.4348
 epoch: 48, train_loss: 0.9458, test_loss: 1.1060, test_f1: 0.4517
 epoch: 49, train_loss: 0.9452, test_loss: 1.1059, test_f1: 0.4411
 epoch: 50, train_loss: 0.9426, test_loss: 1.1051, test_f1: 0.4531
 epoch: 51, train_loss: 0.9307, test_loss: 1.0962, test_f1: 0.4562
 epoch: 52, train_loss: 0.9334, test_loss: 1.0981, test_f1: 0.4482
 epoch: 53, train_loss: 0.9308, test_loss: 1.1054, test_f1: 0.4470
 epoch: 54, train_loss: 0.9280, test_loss: 1.1074, test_f1: 0.4577
 epoch: 55, train_loss: 0.9320, test_loss: 1.1052, test_f1: 0.4577
 epoch: 56, train_loss: 0.9276, test_loss: 1.1010, test_f1: 0.4552
 epoch: 57, train_loss: 0.9369, test_loss: 1.1010, test_f1: 0.4567
 epoch: 58, train_loss: 0.9222, test_loss: 1.1020, test_f1: 0.4564
 epoch: 59, train_loss: 0.9259, test_loss: 1.1083, test_f1: 0.4620
 epoch: 60, train_loss: 0.9213, test_loss: 1.1023, test_f1: 0.4712
 epoch: 61, train_loss: 0.9226, test_loss: 1.1037, test_f1: 0.4651
 epoch: 62, train_loss: 0.9162, test_loss: 1.1041, test_f1: 0.4700
 epoch: 63, train_loss: 0.9279, test_loss: 1.1037, test_f1: 0.4716
 epoch: 64, train_loss: 0.9122, test_loss: 1.1021, test_f1: 0.4662
 epoch: 65, train_loss: 0.9176, test_loss: 1.0945, test_f1: 0.4699
 epoch: 66, train_loss: 0.9181, test_loss: 1.1020, test_f1: 0.4691
 epoch: 67, train_loss: 0.9247, test_loss: 1.0952, test_f1: 0.4681
 epoch: 68, train_loss: 0.9232, test_loss: 1.1005, test_f1: 0.4802
 epoch: 69, train_loss: 0.9098, test_loss: 1.0952, test_f1: 0.4706
 epoch: 70, train_loss: 0.9087, test_loss: 1.0970, test_f1: 0.4722
 epoch: 71, train_loss: 0.9071, test_loss: 1.0916, test_f1: 0.4687
 epoch: 72, train_loss: 0.9093, test_loss: 1.0925, test_f1: 0.4636
 epoch: 73, train_loss: 0.9059, test_loss: 1.0930, test_f1: 0.4765
 epoch: 74, train_loss: 0.9038, test_loss: 1.0874, test_f1: 0.4698
 epoch: 75, train_loss: 0.9068, test_loss: 1.0924, test_f1: 0.4733
 epoch: 76, train_loss: 0.9034, test_loss: 1.0958, test_f1: 0.4819
 epoch: 77, train_loss: 0.9003, test_loss: 1.0912, test_f1: 0.4856
 epoch: 78, train_loss: 0.9047, test_loss: 1.0948, test_f1: 0.4813
 epoch: 79, train_loss: 0.9063, test_loss: 1.0857, test_f1: 0.4758
 epoch: 80, train_loss: 0.9059, test_loss: 1.0869, test_f1: 0.4873
 epoch: 81, train_loss: 0.9013, test_loss: 1.0972, test_f1: 0.4870
 epoch: 82, train_loss: 0.8870, test_loss: 1.0787, test_f1: 0.4963
 epoch: 83, train_loss: 0.8918, test_loss: 1.0920, test_f1: 0.4983
 epoch: 84, train_loss: 0.8899, test_loss: 1.0912, test_f1: 0.4959
 epoch: 85, train_loss: 0.8914, test_loss: 1.0999, test_f1: 0.4835
 epoch: 86, train_loss: 0.8862, test_loss: 1.0860, test_f1: 0.4959
 epoch: 87, train_loss: 0.8939, test_loss: 1.0933, test_f1: 0.4808
 epoch: 88, train_loss: 0.8939, test_loss: 1.0855, test_f1: 0.5023
 epoch: 89, train_loss: 0.8897, test_loss: 1.1098, test_f1: 0.4949
 epoch: 90, train_loss: 0.8896, test_loss: 1.0813, test_f1: 0.5034
 epoch: 91, train_loss: 0.8858, test_loss: 1.0900, test_f1: 0.4974
 epoch: 92, train_loss: 0.8884, test_loss: 1.0888, test_f1: 0.4964
 epoch: 93, train_loss: 0.8940, test_loss: 1.0918, test_f1: 0.4992
 epoch: 94, train_loss: 0.8875, test_loss: 1.0793, test_f1: 0.5116
 epoch: 95, train_loss: 0.8909, test_loss: 1.0811, test_f1: 0.5046
 epoch: 96, train_loss: 0.8788, test_loss: 1.0841, test_f1: 0.5010
 epoch: 97, train_loss: 0.8865, test_loss: 1.0915, test_f1: 0.5100
 epoch: 98, train_loss: 0.8865, test_loss: 1.1094, test_f1: 0.5069
 epoch: 99, train_loss: 0.8858, test_loss: 1.0863, test_f1: 0.4999
##################ITERATION #3 ****************************************
 epoch: 0, train_loss: 1.3059, test_loss: 1.3343, test_f1: 0.2281
 epoch: 1, train_loss: 1.2652, test_loss: 1.3250, test_f1: 0.2281
 epoch: 2, train_loss: 1.2459, test_loss: 1.3145, test_f1: 0.2281
 epoch: 3, train_loss: 1.2262, test_loss: 1.3025, test_f1: 0.2281
 epoch: 4, train_loss: 1.2122, test_loss: 1.2827, test_f1: 0.2336
 epoch: 5, train_loss: 1.1961, test_loss: 1.2631, test_f1: 0.2444
 epoch: 6, train_loss: 1.1789, test_loss: 1.2498, test_f1: 0.2540
 epoch: 7, train_loss: 1.1714, test_loss: 1.2375, test_f1: 0.2570
 epoch: 8, train_loss: 1.1571, test_loss: 1.2265, test_f1: 0.2571
 epoch: 9, train_loss: 1.1427, test_loss: 1.2167, test_f1: 0.2992
 epoch: 10, train_loss: 1.1264, test_loss: 1.2074, test_f1: 0.3015
 epoch: 11, train_loss: 1.1231, test_loss: 1.1996, test_f1: 0.3112
 epoch: 12, train_loss: 1.1107, test_loss: 1.1911, test_f1: 0.3298
 epoch: 13, train_loss: 1.1007, test_loss: 1.1854, test_f1: 0.3451
 epoch: 14, train_loss: 1.1018, test_loss: 1.1825, test_f1: 0.3501
 epoch: 15, train_loss: 1.0879, test_loss: 1.1773, test_f1: 0.3500
 epoch: 16, train_loss: 1.0790, test_loss: 1.1723, test_f1: 0.3858
 epoch: 17, train_loss: 1.0653, test_loss: 1.1706, test_f1: 0.3972
 epoch: 18, train_loss: 1.0624, test_loss: 1.1661, test_f1: 0.3950
 epoch: 19, train_loss: 1.0558, test_loss: 1.1628, test_f1: 0.3973
 epoch: 20, train_loss: 1.0509, test_loss: 1.1587, test_f1: 0.4000
 epoch: 21, train_loss: 1.0496, test_loss: 1.1529, test_f1: 0.4009
 epoch: 22, train_loss: 1.0358, test_loss: 1.1462, test_f1: 0.4025
 epoch: 23, train_loss: 1.0384, test_loss: 1.1469, test_f1: 0.4086
 epoch: 24, train_loss: 1.0253, test_loss: 1.1427, test_f1: 0.4089
 epoch: 25, train_loss: 1.0294, test_loss: 1.1407, test_f1: 0.4028
 epoch: 26, train_loss: 1.0220, test_loss: 1.1369, test_f1: 0.4004
 epoch: 27, train_loss: 1.0214, test_loss: 1.1375, test_f1: 0.4144
 epoch: 28, train_loss: 1.0190, test_loss: 1.1267, test_f1: 0.4122
 epoch: 29, train_loss: 0.9995, test_loss: 1.1273, test_f1: 0.4207
 epoch: 30, train_loss: 0.9902, test_loss: 1.1282, test_f1: 0.4310
 epoch: 31, train_loss: 0.9934, test_loss: 1.1235, test_f1: 0.4285
 epoch: 32, train_loss: 0.9903, test_loss: 1.1228, test_f1: 0.4342
 epoch: 33, train_loss: 0.9794, test_loss: 1.1193, test_f1: 0.4349
 epoch: 34, train_loss: 0.9801, test_loss: 1.1213, test_f1: 0.4350
 epoch: 35, train_loss: 0.9724, test_loss: 1.1083, test_f1: 0.4340
 epoch: 36, train_loss: 0.9749, test_loss: 1.1146, test_f1: 0.4467
 epoch: 37, train_loss: 0.9720, test_loss: 1.1010, test_f1: 0.4611
 epoch: 38, train_loss: 0.9582, test_loss: 1.1015, test_f1: 0.4472
 epoch: 39, train_loss: 0.9541, test_loss: 1.1080, test_f1: 0.4465
 epoch: 40, train_loss: 0.9447, test_loss: 1.0956, test_f1: 0.4751
 epoch: 41, train_loss: 0.9450, test_loss: 1.0990, test_f1: 0.4534
 epoch: 42, train_loss: 0.9509, test_loss: 1.0968, test_f1: 0.4707
 epoch: 43, train_loss: 0.9352, test_loss: 1.0922, test_f1: 0.4762
 epoch: 44, train_loss: 0.9413, test_loss: 1.0954, test_f1: 0.4775
 epoch: 45, train_loss: 0.9276, test_loss: 1.0997, test_f1: 0.4810
 epoch: 46, train_loss: 0.9363, test_loss: 1.0945, test_f1: 0.4806
 epoch: 47, train_loss: 0.9246, test_loss: 1.0940, test_f1: 0.4813
 epoch: 48, train_loss: 0.9247, test_loss: 1.0988, test_f1: 0.4756
 epoch: 49, train_loss: 0.9173, test_loss: 1.0898, test_f1: 0.4849
 epoch: 50, train_loss: 0.9133, test_loss: 1.0915, test_f1: 0.4945
 epoch: 51, train_loss: 0.9078, test_loss: 1.0931, test_f1: 0.4904
 epoch: 52, train_loss: 0.9114, test_loss: 1.0918, test_f1: 0.4880
 epoch: 53, train_loss: 0.9144, test_loss: 1.1046, test_f1: 0.4848
 epoch: 54, train_loss: 0.9035, test_loss: 1.1021, test_f1: 0.4881
 epoch: 55, train_loss: 0.9029, test_loss: 1.0974, test_f1: 0.4865
 epoch: 56, train_loss: 0.9010, test_loss: 1.0979, test_f1: 0.4900
 epoch: 57, train_loss: 0.9021, test_loss: 1.1068, test_f1: 0.5005
 epoch: 58, train_loss: 0.8959, test_loss: 1.1001, test_f1: 0.4999
 epoch: 59, train_loss: 0.9067, test_loss: 1.1077, test_f1: 0.4904
 epoch: 60, train_loss: 0.8972, test_loss: 1.1054, test_f1: 0.4908
 epoch: 61, train_loss: 0.8943, test_loss: 1.1004, test_f1: 0.5042
 epoch: 62, train_loss: 0.8963, test_loss: 1.1030, test_f1: 0.5091
 epoch: 63, train_loss: 0.9009, test_loss: 1.0964, test_f1: 0.5114
 epoch: 64, train_loss: 0.8938, test_loss: 1.1031, test_f1: 0.5016
 epoch: 65, train_loss: 0.8963, test_loss: 1.1016, test_f1: 0.5082
 epoch: 66, train_loss: 0.8834, test_loss: 1.0920, test_f1: 0.5027
 epoch: 67, train_loss: 0.8803, test_loss: 1.0986, test_f1: 0.5042
 epoch: 68, train_loss: 0.8885, test_loss: 1.0905, test_f1: 0.5279
 epoch: 69, train_loss: 0.8856, test_loss: 1.0935, test_f1: 0.5084
 epoch: 70, train_loss: 0.8789, test_loss: 1.1007, test_f1: 0.5381
 epoch: 71, train_loss: 0.8777, test_loss: 1.1003, test_f1: 0.5222
 epoch: 72, train_loss: 0.8802, test_loss: 1.0986, test_f1: 0.5158
 epoch: 73, train_loss: 0.8808, test_loss: 1.1019, test_f1: 0.5123
 epoch: 74, train_loss: 0.8774, test_loss: 1.0943, test_f1: 0.5207
 epoch: 75, train_loss: 0.8822, test_loss: 1.1031, test_f1: 0.5238
 epoch: 76, train_loss: 0.8888, test_loss: 1.1016, test_f1: 0.5235
 epoch: 77, train_loss: 0.8790, test_loss: 1.0892, test_f1: 0.5243
 epoch: 78, train_loss: 0.8754, test_loss: 1.0995, test_f1: 0.5173
 epoch: 79, train_loss: 0.8843, test_loss: 1.0957, test_f1: 0.5222
 epoch: 80, train_loss: 0.8745, test_loss: 1.1071, test_f1: 0.5381
 epoch: 81, train_loss: 0.8761, test_loss: 1.0853, test_f1: 0.5408
 epoch: 82, train_loss: 0.8680, test_loss: 1.0916, test_f1: 0.5352
 epoch: 83, train_loss: 0.8727, test_loss: 1.1056, test_f1: 0.5258
 epoch: 84, train_loss: 0.8723, test_loss: 1.1080, test_f1: 0.5268
 epoch: 85, train_loss: 0.8709, test_loss: 1.1088, test_f1: 0.5317
 epoch: 86, train_loss: 0.8795, test_loss: 1.1079, test_f1: 0.5338
 epoch: 87, train_loss: 0.8665, test_loss: 1.0899, test_f1: 0.5339
 epoch: 88, train_loss: 0.8707, test_loss: 1.1109, test_f1: 0.5258
 epoch: 89, train_loss: 0.8701, test_loss: 1.0982, test_f1: 0.5412
 epoch: 90, train_loss: 0.8552, test_loss: 1.0881, test_f1: 0.5373
 epoch: 91, train_loss: 0.8658, test_loss: 1.0933, test_f1: 0.5453
 epoch: 92, train_loss: 0.8644, test_loss: 1.0861, test_f1: 0.5359
 epoch: 93, train_loss: 0.8575, test_loss: 1.0897, test_f1: 0.5321
 epoch: 94, train_loss: 0.8661, test_loss: 1.0882, test_f1: 0.5287
 epoch: 95, train_loss: 0.8569, test_loss: 1.0835, test_f1: 0.5388
 epoch: 96, train_loss: 0.8626, test_loss: 1.0944, test_f1: 0.5296
 epoch: 97, train_loss: 0.8599, test_loss: 1.0958, test_f1: 0.5385
 epoch: 98, train_loss: 0.8605, test_loss: 1.0954, test_f1: 0.5477
 epoch: 99, train_loss: 0.8556, test_loss: 1.0814, test_f1: 0.5454
##################ITERATION #4 ****************************************
 epoch: 0, train_loss: 1.3042, test_loss: 1.3253, test_f1: 0.2281
 epoch: 1, train_loss: 1.2363, test_loss: 1.3062, test_f1: 0.2281
 epoch: 2, train_loss: 1.2135, test_loss: 1.2815, test_f1: 0.2281
 epoch: 3, train_loss: 1.1949, test_loss: 1.2595, test_f1: 0.2583
 epoch: 4, train_loss: 1.1667, test_loss: 1.2401, test_f1: 0.2829
 epoch: 5, train_loss: 1.1524, test_loss: 1.2225, test_f1: 0.3026
 epoch: 6, train_loss: 1.1473, test_loss: 1.2070, test_f1: 0.3231
 epoch: 7, train_loss: 1.1254, test_loss: 1.1973, test_f1: 0.3230
 epoch: 8, train_loss: 1.1188, test_loss: 1.1864, test_f1: 0.3375
 epoch: 9, train_loss: 1.1018, test_loss: 1.1763, test_f1: 0.3458
 epoch: 10, train_loss: 1.0987, test_loss: 1.1693, test_f1: 0.3514
 epoch: 11, train_loss: 1.0867, test_loss: 1.1614, test_f1: 0.3631
 epoch: 12, train_loss: 1.0811, test_loss: 1.1539, test_f1: 0.3840
 epoch: 13, train_loss: 1.0750, test_loss: 1.1467, test_f1: 0.4111
 epoch: 14, train_loss: 1.0645, test_loss: 1.1383, test_f1: 0.4119
 epoch: 15, train_loss: 1.0513, test_loss: 1.1336, test_f1: 0.4100
 epoch: 16, train_loss: 1.0483, test_loss: 1.1258, test_f1: 0.4144
 epoch: 17, train_loss: 1.0455, test_loss: 1.1213, test_f1: 0.4132
 epoch: 18, train_loss: 1.0415, test_loss: 1.1153, test_f1: 0.4148
 epoch: 19, train_loss: 1.0336, test_loss: 1.1155, test_f1: 0.4172
 epoch: 20, train_loss: 1.0188, test_loss: 1.1134, test_f1: 0.4300
 epoch: 21, train_loss: 1.0194, test_loss: 1.1033, test_f1: 0.4272
 epoch: 22, train_loss: 1.0217, test_loss: 1.1043, test_f1: 0.4300
 epoch: 23, train_loss: 1.0120, test_loss: 1.0959, test_f1: 0.4405
 epoch: 24, train_loss: 1.0060, test_loss: 1.0967, test_f1: 0.4341
 epoch: 25, train_loss: 1.0013, test_loss: 1.0998, test_f1: 0.4298
 epoch: 26, train_loss: 0.9989, test_loss: 1.0882, test_f1: 0.4387
 epoch: 27, train_loss: 0.9928, test_loss: 1.0871, test_f1: 0.4406
 epoch: 28, train_loss: 0.9812, test_loss: 1.0811, test_f1: 0.4565
 epoch: 29, train_loss: 0.9757, test_loss: 1.0707, test_f1: 0.4750
 epoch: 30, train_loss: 0.9740, test_loss: 1.0725, test_f1: 0.4740
 epoch: 31, train_loss: 0.9670, test_loss: 1.0682, test_f1: 0.4738
 epoch: 32, train_loss: 0.9750, test_loss: 1.0624, test_f1: 0.4797
 epoch: 33, train_loss: 0.9667, test_loss: 1.0635, test_f1: 0.4803
 epoch: 34, train_loss: 0.9595, test_loss: 1.0580, test_f1: 0.4854
 epoch: 35, train_loss: 0.9525, test_loss: 1.0614, test_f1: 0.4955
 epoch: 36, train_loss: 0.9567, test_loss: 1.0523, test_f1: 0.4951
 epoch: 37, train_loss: 0.9474, test_loss: 1.0600, test_f1: 0.4925
 epoch: 38, train_loss: 0.9487, test_loss: 1.0519, test_f1: 0.5063
 epoch: 39, train_loss: 0.9439, test_loss: 1.0555, test_f1: 0.5036
 epoch: 40, train_loss: 0.9326, test_loss: 1.0480, test_f1: 0.5023
 epoch: 41, train_loss: 0.9329, test_loss: 1.0473, test_f1: 0.5215
 epoch: 42, train_loss: 0.9254, test_loss: 1.0349, test_f1: 0.5165
 epoch: 43, train_loss: 0.9242, test_loss: 1.0417, test_f1: 0.5152
 epoch: 44, train_loss: 0.9177, test_loss: 1.0413, test_f1: 0.5181
 epoch: 45, train_loss: 0.9179, test_loss: 1.0395, test_f1: 0.5197
 epoch: 46, train_loss: 0.9168, test_loss: 1.0476, test_f1: 0.5052
 epoch: 47, train_loss: 0.9062, test_loss: 1.0313, test_f1: 0.5426
 epoch: 48, train_loss: 0.9067, test_loss: 1.0467, test_f1: 0.5440
 epoch: 49, train_loss: 0.9058, test_loss: 1.0365, test_f1: 0.5521
 epoch: 50, train_loss: 0.9016, test_loss: 1.0351, test_f1: 0.5493
 epoch: 51, train_loss: 0.9026, test_loss: 1.0311, test_f1: 0.5564
 epoch: 52, train_loss: 0.8971, test_loss: 1.0279, test_f1: 0.5525
 epoch: 53, train_loss: 0.8985, test_loss: 1.0280, test_f1: 0.5563
 epoch: 54, train_loss: 0.9007, test_loss: 1.0260, test_f1: 0.5440
 epoch: 55, train_loss: 0.8970, test_loss: 1.0254, test_f1: 0.5470
 epoch: 56, train_loss: 0.8912, test_loss: 1.0379, test_f1: 0.5509
 epoch: 57, train_loss: 0.9010, test_loss: 1.0342, test_f1: 0.5470
 epoch: 58, train_loss: 0.8822, test_loss: 1.0236, test_f1: 0.5488
 epoch: 59, train_loss: 0.8903, test_loss: 1.0358, test_f1: 0.5578
 epoch: 60, train_loss: 0.8856, test_loss: 1.0373, test_f1: 0.5501
 epoch: 61, train_loss: 0.8920, test_loss: 1.0264, test_f1: 0.5590
 epoch: 62, train_loss: 0.8908, test_loss: 1.0271, test_f1: 0.5536
 epoch: 63, train_loss: 0.8799, test_loss: 1.0279, test_f1: 0.5603
 epoch: 64, train_loss: 0.8780, test_loss: 1.0269, test_f1: 0.5599
 epoch: 65, train_loss: 0.8874, test_loss: 1.0248, test_f1: 0.5787
 epoch: 66, train_loss: 0.8898, test_loss: 1.0238, test_f1: 0.5647
 epoch: 67, train_loss: 0.8747, test_loss: 1.0318, test_f1: 0.5729
 epoch: 68, train_loss: 0.8794, test_loss: 1.0321, test_f1: 0.5732
 epoch: 69, train_loss: 0.8782, test_loss: 1.0319, test_f1: 0.5663
 epoch: 70, train_loss: 0.8819, test_loss: 1.0275, test_f1: 0.5637
 epoch: 71, train_loss: 0.8831, test_loss: 1.0275, test_f1: 0.5787
 epoch: 72, train_loss: 0.8669, test_loss: 1.0242, test_f1: 0.5786
 epoch: 73, train_loss: 0.8824, test_loss: 1.0277, test_f1: 0.5771
 epoch: 74, train_loss: 0.8739, test_loss: 1.0367, test_f1: 0.5675
 epoch: 75, train_loss: 0.8684, test_loss: 1.0220, test_f1: 0.5766
 epoch: 76, train_loss: 0.8728, test_loss: 1.0300, test_f1: 0.5731
 epoch: 77, train_loss: 0.8763, test_loss: 1.0254, test_f1: 0.5770
 epoch: 78, train_loss: 0.8762, test_loss: 1.0319, test_f1: 0.5689
 epoch: 79, train_loss: 0.8652, test_loss: 1.0305, test_f1: 0.5728
 epoch: 80, train_loss: 0.8675, test_loss: 1.0294, test_f1: 0.5670
 epoch: 81, train_loss: 0.8685, test_loss: 1.0222, test_f1: 0.5728
 epoch: 82, train_loss: 0.8696, test_loss: 1.0203, test_f1: 0.5850
 epoch: 83, train_loss: 0.8656, test_loss: 1.0366, test_f1: 0.5646
 epoch: 84, train_loss: 0.8645, test_loss: 1.0252, test_f1: 0.5788
 epoch: 85, train_loss: 0.8637, test_loss: 1.0233, test_f1: 0.5840
 epoch: 86, train_loss: 0.8621, test_loss: 1.0256, test_f1: 0.5800
 epoch: 87, train_loss: 0.8534, test_loss: 1.0208, test_f1: 0.5723
 epoch: 88, train_loss: 0.8622, test_loss: 1.0277, test_f1: 0.5708
 epoch: 89, train_loss: 0.8618, test_loss: 1.0287, test_f1: 0.5824
 epoch: 90, train_loss: 0.8580, test_loss: 1.0237, test_f1: 0.5794
 epoch: 91, train_loss: 0.8476, test_loss: 1.0343, test_f1: 0.5712
 epoch: 92, train_loss: 0.8586, test_loss: 1.0352, test_f1: 0.5714
 epoch: 93, train_loss: 0.8487, test_loss: 1.0419, test_f1: 0.5644
 epoch: 94, train_loss: 0.8629, test_loss: 1.0313, test_f1: 0.5770
 epoch: 95, train_loss: 0.8551, test_loss: 1.0294, test_f1: 0.5684
 epoch: 96, train_loss: 0.8528, test_loss: 1.0229, test_f1: 0.5863
 epoch: 97, train_loss: 0.8513, test_loss: 1.0364, test_f1: 0.5755
 epoch: 98, train_loss: 0.8480, test_loss: 1.0348, test_f1: 0.5745
 epoch: 99, train_loss: 0.8503, test_loss: 1.0284, test_f1: 0.5816
##################ITERATION #5 ****************************************
 epoch: 0, train_loss: 1.2606, test_loss: 1.3105, test_f1: 0.2281
 epoch: 1, train_loss: 1.2047, test_loss: 1.2919, test_f1: 0.2281
 epoch: 2, train_loss: 1.1714, test_loss: 1.2598, test_f1: 0.2336
 epoch: 3, train_loss: 1.1548, test_loss: 1.2271, test_f1: 0.2979
 epoch: 4, train_loss: 1.1349, test_loss: 1.2024, test_f1: 0.3227
 epoch: 5, train_loss: 1.1164, test_loss: 1.1814, test_f1: 0.3203
 epoch: 6, train_loss: 1.1064, test_loss: 1.1668, test_f1: 0.3168
 epoch: 7, train_loss: 1.0910, test_loss: 1.1575, test_f1: 0.3162
 epoch: 8, train_loss: 1.0817, test_loss: 1.1508, test_f1: 0.3532
 epoch: 9, train_loss: 1.0799, test_loss: 1.1429, test_f1: 0.3528
 epoch: 10, train_loss: 1.0660, test_loss: 1.1365, test_f1: 0.3585
 epoch: 11, train_loss: 1.0557, test_loss: 1.1324, test_f1: 0.3899
 epoch: 12, train_loss: 1.0567, test_loss: 1.1296, test_f1: 0.3898
 epoch: 13, train_loss: 1.0551, test_loss: 1.1226, test_f1: 0.4075
 epoch: 14, train_loss: 1.0423, test_loss: 1.1199, test_f1: 0.4314
 epoch: 15, train_loss: 1.0400, test_loss: 1.1180, test_f1: 0.4402
 epoch: 16, train_loss: 1.0460, test_loss: 1.1152, test_f1: 0.4301
 epoch: 17, train_loss: 1.0332, test_loss: 1.1121, test_f1: 0.4271
 epoch: 18, train_loss: 1.0251, test_loss: 1.1078, test_f1: 0.4377
 epoch: 19, train_loss: 1.0276, test_loss: 1.1053, test_f1: 0.4343
 epoch: 20, train_loss: 1.0158, test_loss: 1.1011, test_f1: 0.4365
 epoch: 21, train_loss: 1.0090, test_loss: 1.0983, test_f1: 0.4434
 epoch: 22, train_loss: 1.0042, test_loss: 1.1011, test_f1: 0.4465
 epoch: 23, train_loss: 1.0019, test_loss: 1.0954, test_f1: 0.4423
 epoch: 24, train_loss: 1.0014, test_loss: 1.0892, test_f1: 0.4456
 epoch: 25, train_loss: 0.9932, test_loss: 1.0900, test_f1: 0.4611
 epoch: 26, train_loss: 0.9981, test_loss: 1.0835, test_f1: 0.4529
 epoch: 27, train_loss: 0.9950, test_loss: 1.0810, test_f1: 0.4447
 epoch: 28, train_loss: 0.9914, test_loss: 1.0802, test_f1: 0.4569
 epoch: 29, train_loss: 0.9812, test_loss: 1.0691, test_f1: 0.4529
 epoch: 30, train_loss: 0.9776, test_loss: 1.0706, test_f1: 0.4541
 epoch: 31, train_loss: 0.9776, test_loss: 1.0743, test_f1: 0.4616
 epoch: 32, train_loss: 0.9751, test_loss: 1.0690, test_f1: 0.4669
 epoch: 33, train_loss: 0.9693, test_loss: 1.0679, test_f1: 0.4746
 epoch: 34, train_loss: 0.9677, test_loss: 1.0644, test_f1: 0.4654
 epoch: 35, train_loss: 0.9667, test_loss: 1.0655, test_f1: 0.4675
 epoch: 36, train_loss: 0.9564, test_loss: 1.0628, test_f1: 0.4632
 epoch: 37, train_loss: 0.9646, test_loss: 1.0650, test_f1: 0.4633
 epoch: 38, train_loss: 0.9658, test_loss: 1.0495, test_f1: 0.4690
 epoch: 39, train_loss: 0.9560, test_loss: 1.0494, test_f1: 0.4702
 epoch: 40, train_loss: 0.9472, test_loss: 1.0619, test_f1: 0.4700
 epoch: 41, train_loss: 0.9439, test_loss: 1.0494, test_f1: 0.4725
 epoch: 42, train_loss: 0.9499, test_loss: 1.0450, test_f1: 0.4855
 epoch: 43, train_loss: 0.9395, test_loss: 1.0390, test_f1: 0.5101
 epoch: 44, train_loss: 0.9414, test_loss: 1.0453, test_f1: 0.4935
 epoch: 45, train_loss: 0.9405, test_loss: 1.0390, test_f1: 0.5001
 epoch: 46, train_loss: 0.9254, test_loss: 1.0427, test_f1: 0.4921
 epoch: 47, train_loss: 0.9335, test_loss: 1.0327, test_f1: 0.5038
 epoch: 48, train_loss: 0.9324, test_loss: 1.0272, test_f1: 0.5081
 epoch: 49, train_loss: 0.9175, test_loss: 1.0304, test_f1: 0.5060
 epoch: 50, train_loss: 0.9169, test_loss: 1.0336, test_f1: 0.5125
 epoch: 51, train_loss: 0.9127, test_loss: 1.0266, test_f1: 0.5184
 epoch: 52, train_loss: 0.9251, test_loss: 1.0247, test_f1: 0.5120
 epoch: 53, train_loss: 0.9197, test_loss: 1.0325, test_f1: 0.5097
 epoch: 54, train_loss: 0.9197, test_loss: 1.0280, test_f1: 0.5103
 epoch: 55, train_loss: 0.9203, test_loss: 1.0279, test_f1: 0.5149
 epoch: 56, train_loss: 0.9069, test_loss: 1.0296, test_f1: 0.5105
 epoch: 57, train_loss: 0.9170, test_loss: 1.0249, test_f1: 0.5188
 epoch: 58, train_loss: 0.9122, test_loss: 1.0222, test_f1: 0.5165
 epoch: 59, train_loss: 0.9170, test_loss: 1.0172, test_f1: 0.5196
 epoch: 60, train_loss: 0.9073, test_loss: 1.0225, test_f1: 0.5272
 epoch: 61, train_loss: 0.9042, test_loss: 1.0282, test_f1: 0.5249
 epoch: 62, train_loss: 0.9052, test_loss: 1.0234, test_f1: 0.5334
 epoch: 63, train_loss: 0.9100, test_loss: 1.0217, test_f1: 0.5257
 epoch: 64, train_loss: 0.9022, test_loss: 1.0195, test_f1: 0.5264
 epoch: 65, train_loss: 0.8921, test_loss: 1.0207, test_f1: 0.5230
 epoch: 66, train_loss: 0.8960, test_loss: 1.0188, test_f1: 0.5200
 epoch: 67, train_loss: 0.8945, test_loss: 1.0226, test_f1: 0.5217
 epoch: 68, train_loss: 0.8884, test_loss: 1.0127, test_f1: 0.5365
 epoch: 69, train_loss: 0.8988, test_loss: 1.0245, test_f1: 0.5246
 epoch: 70, train_loss: 0.8950, test_loss: 1.0097, test_f1: 0.5312
 epoch: 71, train_loss: 0.8959, test_loss: 1.0146, test_f1: 0.5305
 epoch: 72, train_loss: 0.8937, test_loss: 1.0168, test_f1: 0.5304
 epoch: 73, train_loss: 0.8886, test_loss: 1.0141, test_f1: 0.5301
 epoch: 74, train_loss: 0.8915, test_loss: 1.0108, test_f1: 0.5299
 epoch: 75, train_loss: 0.8932, test_loss: 1.0082, test_f1: 0.5311
 epoch: 76, train_loss: 0.8836, test_loss: 1.0109, test_f1: 0.5325
 epoch: 77, train_loss: 0.8917, test_loss: 1.0203, test_f1: 0.5165
 epoch: 78, train_loss: 0.8901, test_loss: 1.0142, test_f1: 0.5255
 epoch: 79, train_loss: 0.8917, test_loss: 1.0103, test_f1: 0.5360
 epoch: 80, train_loss: 0.8820, test_loss: 1.0127, test_f1: 0.5316
 epoch: 81, train_loss: 0.8860, test_loss: 1.0181, test_f1: 0.5175
 epoch: 82, train_loss: 0.8910, test_loss: 1.0120, test_f1: 0.5268
 epoch: 83, train_loss: 0.8901, test_loss: 1.0064, test_f1: 0.5303
 epoch: 84, train_loss: 0.8701, test_loss: 1.0068, test_f1: 0.5306
 epoch: 85, train_loss: 0.8795, test_loss: 1.0022, test_f1: 0.5363
 epoch: 86, train_loss: 0.8741, test_loss: 1.0144, test_f1: 0.5216
 epoch: 87, train_loss: 0.8762, test_loss: 1.0005, test_f1: 0.5449
 epoch: 88, train_loss: 0.8781, test_loss: 1.0159, test_f1: 0.5357
 epoch: 89, train_loss: 0.8782, test_loss: 1.0106, test_f1: 0.5259
 epoch: 90, train_loss: 0.8791, test_loss: 0.9973, test_f1: 0.5407
 epoch: 91, train_loss: 0.8761, test_loss: 1.0039, test_f1: 0.5366
 epoch: 92, train_loss: 0.8709, test_loss: 1.0029, test_f1: 0.5401
 epoch: 93, train_loss: 0.8680, test_loss: 0.9969, test_f1: 0.5428
 epoch: 94, train_loss: 0.8703, test_loss: 1.0101, test_f1: 0.5361
 epoch: 95, train_loss: 0.8567, test_loss: 1.0048, test_f1: 0.5337
 epoch: 96, train_loss: 0.8729, test_loss: 1.0114, test_f1: 0.5404
 epoch: 97, train_loss: 0.8632, test_loss: 1.0090, test_f1: 0.5331
 epoch: 98, train_loss: 0.8583, test_loss: 1.0117, test_f1: 0.5252
 epoch: 99, train_loss: 0.8731, test_loss: 1.0005, test_f1: 0.5306
##################ITERATION #6 ****************************************
 epoch: 0, train_loss: 1.2718, test_loss: 1.3064, test_f1: 0.2281
 epoch: 1, train_loss: 1.2184, test_loss: 1.2938, test_f1: 0.2281
 epoch: 2, train_loss: 1.1908, test_loss: 1.2794, test_f1: 0.2281
 epoch: 3, train_loss: 1.1695, test_loss: 1.2573, test_f1: 0.2336
 epoch: 4, train_loss: 1.1533, test_loss: 1.2346, test_f1: 0.2843
 epoch: 5, train_loss: 1.1404, test_loss: 1.2164, test_f1: 0.3062
 epoch: 6, train_loss: 1.1210, test_loss: 1.2022, test_f1: 0.3172
 epoch: 7, train_loss: 1.1193, test_loss: 1.1922, test_f1: 0.3478
 epoch: 8, train_loss: 1.1082, test_loss: 1.1847, test_f1: 0.3734
 epoch: 9, train_loss: 1.0966, test_loss: 1.1781, test_f1: 0.3935
 epoch: 10, train_loss: 1.0938, test_loss: 1.1703, test_f1: 0.4258
 epoch: 11, train_loss: 1.0778, test_loss: 1.1663, test_f1: 0.4436
 epoch: 12, train_loss: 1.0747, test_loss: 1.1605, test_f1: 0.4510
 epoch: 13, train_loss: 1.0701, test_loss: 1.1552, test_f1: 0.4546
 epoch: 14, train_loss: 1.0667, test_loss: 1.1537, test_f1: 0.4452
 epoch: 15, train_loss: 1.0551, test_loss: 1.1548, test_f1: 0.4372
 epoch: 16, train_loss: 1.0555, test_loss: 1.1511, test_f1: 0.4399
 epoch: 17, train_loss: 1.0486, test_loss: 1.1434, test_f1: 0.4553
 epoch: 18, train_loss: 1.0429, test_loss: 1.1351, test_f1: 0.4574
 epoch: 19, train_loss: 1.0337, test_loss: 1.1302, test_f1: 0.4574
 epoch: 20, train_loss: 1.0254, test_loss: 1.1317, test_f1: 0.4402
 epoch: 21, train_loss: 1.0260, test_loss: 1.1252, test_f1: 0.4541
 epoch: 22, train_loss: 1.0189, test_loss: 1.1260, test_f1: 0.4480
 epoch: 23, train_loss: 1.0091, test_loss: 1.1182, test_f1: 0.4579
 epoch: 24, train_loss: 1.0092, test_loss: 1.1185, test_f1: 0.4605
 epoch: 25, train_loss: 1.0114, test_loss: 1.1136, test_f1: 0.4618
 epoch: 26, train_loss: 0.9981, test_loss: 1.1044, test_f1: 0.4605
 epoch: 27, train_loss: 1.0018, test_loss: 1.1017, test_f1: 0.4678
 epoch: 28, train_loss: 0.9849, test_loss: 1.1021, test_f1: 0.4702
 epoch: 29, train_loss: 0.9906, test_loss: 1.0989, test_f1: 0.4712
 epoch: 30, train_loss: 0.9798, test_loss: 1.0971, test_f1: 0.4825
 epoch: 31, train_loss: 0.9813, test_loss: 1.0916, test_f1: 0.4926
 epoch: 32, train_loss: 0.9733, test_loss: 1.0833, test_f1: 0.4917
 epoch: 33, train_loss: 0.9806, test_loss: 1.0843, test_f1: 0.4950
 epoch: 34, train_loss: 0.9634, test_loss: 1.0851, test_f1: 0.5053
 epoch: 35, train_loss: 0.9617, test_loss: 1.0766, test_f1: 0.5096
 epoch: 36, train_loss: 0.9638, test_loss: 1.0718, test_f1: 0.5125
 epoch: 37, train_loss: 0.9574, test_loss: 1.0722, test_f1: 0.5120
 epoch: 38, train_loss: 0.9487, test_loss: 1.0709, test_f1: 0.5161
 epoch: 39, train_loss: 0.9464, test_loss: 1.0643, test_f1: 0.5094
 epoch: 40, train_loss: 0.9530, test_loss: 1.0635, test_f1: 0.5100
 epoch: 41, train_loss: 0.9370, test_loss: 1.0596, test_f1: 0.5107
 epoch: 42, train_loss: 0.9467, test_loss: 1.0592, test_f1: 0.5245
 epoch: 43, train_loss: 0.9380, test_loss: 1.0507, test_f1: 0.5260
 epoch: 44, train_loss: 0.9297, test_loss: 1.0466, test_f1: 0.5205
 epoch: 45, train_loss: 0.9317, test_loss: 1.0383, test_f1: 0.5215
 epoch: 46, train_loss: 0.9250, test_loss: 1.0441, test_f1: 0.5202
 epoch: 47, train_loss: 0.9285, test_loss: 1.0499, test_f1: 0.5203
 epoch: 48, train_loss: 0.9143, test_loss: 1.0481, test_f1: 0.5174
 epoch: 49, train_loss: 0.9169, test_loss: 1.0378, test_f1: 0.5247
 epoch: 50, train_loss: 0.9156, test_loss: 1.0393, test_f1: 0.5197
 epoch: 51, train_loss: 0.9062, test_loss: 1.0430, test_f1: 0.5155
 epoch: 52, train_loss: 0.9137, test_loss: 1.0404, test_f1: 0.5222
 epoch: 53, train_loss: 0.9174, test_loss: 1.0428, test_f1: 0.5303
 epoch: 54, train_loss: 0.8967, test_loss: 1.0436, test_f1: 0.5267
 epoch: 55, train_loss: 0.9129, test_loss: 1.0423, test_f1: 0.5211
 epoch: 56, train_loss: 0.9036, test_loss: 1.0406, test_f1: 0.5361
 epoch: 57, train_loss: 0.9075, test_loss: 1.0412, test_f1: 0.5268
 epoch: 58, train_loss: 0.9070, test_loss: 1.0310, test_f1: 0.5309
 epoch: 59, train_loss: 0.8989, test_loss: 1.0363, test_f1: 0.5249
 epoch: 60, train_loss: 0.9049, test_loss: 1.0462, test_f1: 0.5303
 epoch: 61, train_loss: 0.9022, test_loss: 1.0391, test_f1: 0.5348
 epoch: 62, train_loss: 0.8979, test_loss: 1.0329, test_f1: 0.5399
 epoch: 63, train_loss: 0.9031, test_loss: 1.0403, test_f1: 0.5306
 epoch: 64, train_loss: 0.8960, test_loss: 1.0425, test_f1: 0.5292
 epoch: 65, train_loss: 0.8928, test_loss: 1.0386, test_f1: 0.5337
 epoch: 66, train_loss: 0.8954, test_loss: 1.0379, test_f1: 0.5288
 epoch: 67, train_loss: 0.8910, test_loss: 1.0445, test_f1: 0.5273
 epoch: 68, train_loss: 0.8928, test_loss: 1.0521, test_f1: 0.5316
 epoch: 69, train_loss: 0.8844, test_loss: 1.0355, test_f1: 0.5359
 epoch: 70, train_loss: 0.8864, test_loss: 1.0371, test_f1: 0.5327
 epoch: 71, train_loss: 0.8899, test_loss: 1.0351, test_f1: 0.5318
 epoch: 72, train_loss: 0.8813, test_loss: 1.0448, test_f1: 0.5290
 epoch: 73, train_loss: 0.8844, test_loss: 1.0396, test_f1: 0.5291
 epoch: 74, train_loss: 0.8911, test_loss: 1.0308, test_f1: 0.5347
 epoch: 75, train_loss: 0.8854, test_loss: 1.0404, test_f1: 0.5319
 epoch: 76, train_loss: 0.8931, test_loss: 1.0369, test_f1: 0.5362
 epoch: 77, train_loss: 0.8880, test_loss: 1.0477, test_f1: 0.5290
 epoch: 78, train_loss: 0.8742, test_loss: 1.0412, test_f1: 0.5330
 epoch: 79, train_loss: 0.8849, test_loss: 1.0327, test_f1: 0.5412
 epoch: 80, train_loss: 0.8764, test_loss: 1.0367, test_f1: 0.5403
 epoch: 81, train_loss: 0.8745, test_loss: 1.0469, test_f1: 0.5252
 epoch: 82, train_loss: 0.8739, test_loss: 1.0342, test_f1: 0.5280
 epoch: 83, train_loss: 0.8712, test_loss: 1.0367, test_f1: 0.5393
 epoch: 84, train_loss: 0.8706, test_loss: 1.0329, test_f1: 0.5356
 epoch: 85, train_loss: 0.8654, test_loss: 1.0421, test_f1: 0.5338
 epoch: 86, train_loss: 0.8593, test_loss: 1.0326, test_f1: 0.5431
 epoch: 87, train_loss: 0.8684, test_loss: 1.0412, test_f1: 0.5431
 epoch: 88, train_loss: 0.8648, test_loss: 1.0508, test_f1: 0.5264
 epoch: 89, train_loss: 0.8582, test_loss: 1.0446, test_f1: 0.5362
 epoch: 90, train_loss: 0.8610, test_loss: 1.0400, test_f1: 0.5467
 epoch: 91, train_loss: 0.8644, test_loss: 1.0304, test_f1: 0.5419
 epoch: 92, train_loss: 0.8595, test_loss: 1.0420, test_f1: 0.5466
 epoch: 93, train_loss: 0.8665, test_loss: 1.0424, test_f1: 0.5367
 epoch: 94, train_loss: 0.8518, test_loss: 1.0286, test_f1: 0.5374
 epoch: 95, train_loss: 0.8726, test_loss: 1.0238, test_f1: 0.5439
 epoch: 96, train_loss: 0.8577, test_loss: 1.0329, test_f1: 0.5412
 epoch: 97, train_loss: 0.8548, test_loss: 1.0423, test_f1: 0.5324
 epoch: 98, train_loss: 0.8666, test_loss: 1.0396, test_f1: 0.5362
 epoch: 99, train_loss: 0.8533, test_loss: 1.0437, test_f1: 0.5359
##################ITERATION #7 ****************************************
 epoch: 0, train_loss: 1.3005, test_loss: 1.3183, test_f1: 0.2281
 epoch: 1, train_loss: 1.2204, test_loss: 1.3077, test_f1: 0.2281
 epoch: 2, train_loss: 1.1976, test_loss: 1.2911, test_f1: 0.2281
 epoch: 3, train_loss: 1.1786, test_loss: 1.2726, test_f1: 0.2336
 epoch: 4, train_loss: 1.1709, test_loss: 1.2527, test_f1: 0.2336
 epoch: 5, train_loss: 1.1509, test_loss: 1.2387, test_f1: 0.2452
 epoch: 6, train_loss: 1.1469, test_loss: 1.2290, test_f1: 0.2856
 epoch: 7, train_loss: 1.1425, test_loss: 1.2211, test_f1: 0.2891
 epoch: 8, train_loss: 1.1269, test_loss: 1.2145, test_f1: 0.2968
 epoch: 9, train_loss: 1.1343, test_loss: 1.2068, test_f1: 0.3183
 epoch: 10, train_loss: 1.1135, test_loss: 1.2013, test_f1: 0.3180
 epoch: 11, train_loss: 1.1160, test_loss: 1.1927, test_f1: 0.3679
 epoch: 12, train_loss: 1.1010, test_loss: 1.1848, test_f1: 0.3748
 epoch: 13, train_loss: 1.0948, test_loss: 1.1787, test_f1: 0.3840
 epoch: 14, train_loss: 1.0886, test_loss: 1.1702, test_f1: 0.3857
 epoch: 15, train_loss: 1.0856, test_loss: 1.1680, test_f1: 0.3917
 epoch: 16, train_loss: 1.0747, test_loss: 1.1655, test_f1: 0.3947
 epoch: 17, train_loss: 1.0691, test_loss: 1.1571, test_f1: 0.3990
 epoch: 18, train_loss: 1.0657, test_loss: 1.1522, test_f1: 0.4046
 epoch: 19, train_loss: 1.0591, test_loss: 1.1491, test_f1: 0.4086
 epoch: 20, train_loss: 1.0579, test_loss: 1.1433, test_f1: 0.4111
 epoch: 21, train_loss: 1.0442, test_loss: 1.1420, test_f1: 0.4215
 epoch: 22, train_loss: 1.0428, test_loss: 1.1345, test_f1: 0.4296
 epoch: 23, train_loss: 1.0358, test_loss: 1.1284, test_f1: 0.4374
 epoch: 24, train_loss: 1.0299, test_loss: 1.1277, test_f1: 0.4376
 epoch: 25, train_loss: 1.0212, test_loss: 1.1236, test_f1: 0.4475
 epoch: 26, train_loss: 1.0210, test_loss: 1.1209, test_f1: 0.4473
 epoch: 27, train_loss: 1.0157, test_loss: 1.1151, test_f1: 0.4521
 epoch: 28, train_loss: 1.0162, test_loss: 1.1124, test_f1: 0.4456
 epoch: 29, train_loss: 1.0071, test_loss: 1.1127, test_f1: 0.4538
 epoch: 30, train_loss: 0.9972, test_loss: 1.1049, test_f1: 0.4543
 epoch: 31, train_loss: 0.9982, test_loss: 1.1037, test_f1: 0.4686
 epoch: 32, train_loss: 0.9944, test_loss: 1.0979, test_f1: 0.4688
 epoch: 33, train_loss: 0.9932, test_loss: 1.0870, test_f1: 0.4840
 epoch: 34, train_loss: 0.9937, test_loss: 1.0883, test_f1: 0.4794
 epoch: 35, train_loss: 0.9855, test_loss: 1.0826, test_f1: 0.4779
 epoch: 36, train_loss: 0.9781, test_loss: 1.0816, test_f1: 0.4841
 epoch: 37, train_loss: 0.9776, test_loss: 1.0772, test_f1: 0.4882
 epoch: 38, train_loss: 0.9658, test_loss: 1.0716, test_f1: 0.4826
 epoch: 39, train_loss: 0.9635, test_loss: 1.0708, test_f1: 0.4842
 epoch: 40, train_loss: 0.9642, test_loss: 1.0649, test_f1: 0.4843
 epoch: 41, train_loss: 0.9577, test_loss: 1.0685, test_f1: 0.4876
 epoch: 42, train_loss: 0.9589, test_loss: 1.0657, test_f1: 0.4813
 epoch: 43, train_loss: 0.9573, test_loss: 1.0578, test_f1: 0.4937
 epoch: 44, train_loss: 0.9442, test_loss: 1.0556, test_f1: 0.4903
 epoch: 45, train_loss: 0.9444, test_loss: 1.0563, test_f1: 0.4903
 epoch: 46, train_loss: 0.9337, test_loss: 1.0511, test_f1: 0.4908
 epoch: 47, train_loss: 0.9252, test_loss: 1.0529, test_f1: 0.4928
 epoch: 48, train_loss: 0.9222, test_loss: 1.0451, test_f1: 0.4904
 epoch: 49, train_loss: 0.9321, test_loss: 1.0461, test_f1: 0.5028
 epoch: 50, train_loss: 0.9262, test_loss: 1.0500, test_f1: 0.4949
 epoch: 51, train_loss: 0.9245, test_loss: 1.0520, test_f1: 0.4934
 epoch: 52, train_loss: 0.9354, test_loss: 1.0485, test_f1: 0.4973
 epoch: 53, train_loss: 0.9187, test_loss: 1.0469, test_f1: 0.5021
 epoch: 54, train_loss: 0.9175, test_loss: 1.0490, test_f1: 0.4973
 epoch: 55, train_loss: 0.9177, test_loss: 1.0485, test_f1: 0.4973
 epoch: 56, train_loss: 0.9139, test_loss: 1.0466, test_f1: 0.4973
 epoch: 57, train_loss: 0.9200, test_loss: 1.0445, test_f1: 0.5011
 epoch: 58, train_loss: 0.9195, test_loss: 1.0458, test_f1: 0.5093
 epoch: 59, train_loss: 0.9247, test_loss: 1.0472, test_f1: 0.5124
 epoch: 60, train_loss: 0.9148, test_loss: 1.0462, test_f1: 0.5092
 epoch: 61, train_loss: 0.9221, test_loss: 1.0472, test_f1: 0.5078
 epoch: 62, train_loss: 0.9154, test_loss: 1.0478, test_f1: 0.5102
 epoch: 63, train_loss: 0.9135, test_loss: 1.0524, test_f1: 0.5075
 epoch: 64, train_loss: 0.9013, test_loss: 1.0461, test_f1: 0.5127
 epoch: 65, train_loss: 0.9124, test_loss: 1.0447, test_f1: 0.5126
 epoch: 66, train_loss: 0.9046, test_loss: 1.0402, test_f1: 0.5106
 epoch: 67, train_loss: 0.9092, test_loss: 1.0401, test_f1: 0.5082
 epoch: 68, train_loss: 0.9083, test_loss: 1.0444, test_f1: 0.5127
 epoch: 69, train_loss: 0.8966, test_loss: 1.0489, test_f1: 0.5097
 epoch: 70, train_loss: 0.9030, test_loss: 1.0485, test_f1: 0.5144
 epoch: 71, train_loss: 0.8990, test_loss: 1.0507, test_f1: 0.5108
 epoch: 72, train_loss: 0.8950, test_loss: 1.0428, test_f1: 0.5177
 epoch: 73, train_loss: 0.9005, test_loss: 1.0442, test_f1: 0.5113
 epoch: 74, train_loss: 0.9012, test_loss: 1.0432, test_f1: 0.5095
 epoch: 75, train_loss: 0.8998, test_loss: 1.0457, test_f1: 0.5117
 epoch: 76, train_loss: 0.8987, test_loss: 1.0445, test_f1: 0.5160
 epoch: 77, train_loss: 0.8891, test_loss: 1.0430, test_f1: 0.5164
 epoch: 78, train_loss: 0.8910, test_loss: 1.0435, test_f1: 0.5143
 epoch: 79, train_loss: 0.8928, test_loss: 1.0412, test_f1: 0.5211
 epoch: 80, train_loss: 0.8905, test_loss: 1.0438, test_f1: 0.5167
 epoch: 81, train_loss: 0.8890, test_loss: 1.0373, test_f1: 0.5175
 epoch: 82, train_loss: 0.8846, test_loss: 1.0398, test_f1: 0.5227
 epoch: 83, train_loss: 0.8881, test_loss: 1.0384, test_f1: 0.5315
 epoch: 84, train_loss: 0.8867, test_loss: 1.0380, test_f1: 0.5190
 epoch: 85, train_loss: 0.8891, test_loss: 1.0493, test_f1: 0.5189
 epoch: 86, train_loss: 0.8901, test_loss: 1.0464, test_f1: 0.5152
 epoch: 87, train_loss: 0.8816, test_loss: 1.0418, test_f1: 0.5184
 epoch: 88, train_loss: 0.8735, test_loss: 1.0419, test_f1: 0.5178
 epoch: 89, train_loss: 0.8846, test_loss: 1.0419, test_f1: 0.5185
 epoch: 90, train_loss: 0.8839, test_loss: 1.0387, test_f1: 0.5210
 epoch: 91, train_loss: 0.8945, test_loss: 1.0378, test_f1: 0.5246
 epoch: 92, train_loss: 0.8762, test_loss: 1.0390, test_f1: 0.5185
 epoch: 93, train_loss: 0.8664, test_loss: 1.0386, test_f1: 0.5231
 epoch: 94, train_loss: 0.8722, test_loss: 1.0364, test_f1: 0.5216
 epoch: 95, train_loss: 0.8738, test_loss: 1.0377, test_f1: 0.5218
 epoch: 96, train_loss: 0.8840, test_loss: 1.0404, test_f1: 0.5245
 epoch: 97, train_loss: 0.8810, test_loss: 1.0380, test_f1: 0.5254
 epoch: 98, train_loss: 0.8678, test_loss: 1.0404, test_f1: 0.5214
 epoch: 99, train_loss: 0.8746, test_loss: 1.0378, test_f1: 0.5218
##################ITERATION #8 ****************************************
 epoch: 0, train_loss: 1.2722, test_loss: 1.3375, test_f1: 0.2281
 epoch: 1, train_loss: 1.1947, test_loss: 1.3280, test_f1: 0.2583
 epoch: 2, train_loss: 1.1658, test_loss: 1.2970, test_f1: 0.2722
 epoch: 3, train_loss: 1.1506, test_loss: 1.2503, test_f1: 0.3207
 epoch: 4, train_loss: 1.1364, test_loss: 1.2054, test_f1: 0.3772
 epoch: 5, train_loss: 1.1347, test_loss: 1.1807, test_f1: 0.3981
 epoch: 6, train_loss: 1.1139, test_loss: 1.1694, test_f1: 0.4076
 epoch: 7, train_loss: 1.1076, test_loss: 1.1603, test_f1: 0.4104
 epoch: 8, train_loss: 1.0911, test_loss: 1.1501, test_f1: 0.4201
 epoch: 9, train_loss: 1.0958, test_loss: 1.1428, test_f1: 0.4301
 epoch: 10, train_loss: 1.0836, test_loss: 1.1306, test_f1: 0.4330
 epoch: 11, train_loss: 1.0776, test_loss: 1.1211, test_f1: 0.4226
 epoch: 12, train_loss: 1.0508, test_loss: 1.1159, test_f1: 0.4413
 epoch: 13, train_loss: 1.0526, test_loss: 1.1112, test_f1: 0.4514
 epoch: 14, train_loss: 1.0370, test_loss: 1.1062, test_f1: 0.4483
 epoch: 15, train_loss: 1.0343, test_loss: 1.1029, test_f1: 0.4546
 epoch: 16, train_loss: 1.0378, test_loss: 1.0950, test_f1: 0.4609
 epoch: 17, train_loss: 1.0314, test_loss: 1.0881, test_f1: 0.4615
 epoch: 18, train_loss: 1.0313, test_loss: 1.0852, test_f1: 0.4752
 epoch: 19, train_loss: 1.0241, test_loss: 1.0827, test_f1: 0.4713
 epoch: 20, train_loss: 1.0143, test_loss: 1.0780, test_f1: 0.4827
 epoch: 21, train_loss: 1.0114, test_loss: 1.0739, test_f1: 0.4855
 epoch: 22, train_loss: 1.0026, test_loss: 1.0704, test_f1: 0.4899
 epoch: 23, train_loss: 0.9987, test_loss: 1.0606, test_f1: 0.4958
 epoch: 24, train_loss: 1.0031, test_loss: 1.0580, test_f1: 0.4994
 epoch: 25, train_loss: 0.9854, test_loss: 1.0517, test_f1: 0.4964
 epoch: 26, train_loss: 0.9941, test_loss: 1.0429, test_f1: 0.4969
 epoch: 27, train_loss: 0.9847, test_loss: 1.0471, test_f1: 0.5017
 epoch: 28, train_loss: 0.9787, test_loss: 1.0452, test_f1: 0.5068
 epoch: 29, train_loss: 0.9788, test_loss: 1.0394, test_f1: 0.5065
 epoch: 30, train_loss: 0.9752, test_loss: 1.0446, test_f1: 0.5007
 epoch: 31, train_loss: 0.9693, test_loss: 1.0364, test_f1: 0.5052
 epoch: 32, train_loss: 0.9649, test_loss: 1.0371, test_f1: 0.5093
 epoch: 33, train_loss: 0.9681, test_loss: 1.0382, test_f1: 0.5058
 epoch: 34, train_loss: 0.9530, test_loss: 1.0328, test_f1: 0.5113
 epoch: 35, train_loss: 0.9584, test_loss: 1.0316, test_f1: 0.5109
 epoch: 36, train_loss: 0.9515, test_loss: 1.0267, test_f1: 0.5146
 epoch: 37, train_loss: 0.9508, test_loss: 1.0275, test_f1: 0.5048
 epoch: 38, train_loss: 0.9518, test_loss: 1.0302, test_f1: 0.5118
 epoch: 39, train_loss: 0.9420, test_loss: 1.0151, test_f1: 0.5208
 epoch: 40, train_loss: 0.9423, test_loss: 1.0170, test_f1: 0.5187
 epoch: 41, train_loss: 0.9392, test_loss: 1.0171, test_f1: 0.5319
 epoch: 42, train_loss: 0.9294, test_loss: 1.0136, test_f1: 0.5344
 epoch: 43, train_loss: 0.9333, test_loss: 1.0072, test_f1: 0.5395
 epoch: 44, train_loss: 0.9419, test_loss: 1.0178, test_f1: 0.5372
 epoch: 45, train_loss: 0.9338, test_loss: 1.0068, test_f1: 0.5456
 epoch: 46, train_loss: 0.9245, test_loss: 1.0089, test_f1: 0.5517
 epoch: 47, train_loss: 0.9276, test_loss: 1.0124, test_f1: 0.5405
 epoch: 48, train_loss: 0.9185, test_loss: 1.0024, test_f1: 0.5451
 epoch: 49, train_loss: 0.9204, test_loss: 1.0051, test_f1: 0.5465
 epoch: 50, train_loss: 0.9168, test_loss: 1.0120, test_f1: 0.5412
 epoch: 51, train_loss: 0.9106, test_loss: 1.0033, test_f1: 0.5436
 epoch: 52, train_loss: 0.9175, test_loss: 0.9995, test_f1: 0.5447
 epoch: 53, train_loss: 0.9125, test_loss: 0.9970, test_f1: 0.5404
 epoch: 54, train_loss: 0.9060, test_loss: 0.9975, test_f1: 0.5461
 epoch: 55, train_loss: 0.9074, test_loss: 1.0015, test_f1: 0.5369
 epoch: 56, train_loss: 0.9018, test_loss: 1.0063, test_f1: 0.5325
 epoch: 57, train_loss: 0.8977, test_loss: 1.0005, test_f1: 0.5423
 epoch: 58, train_loss: 0.8973, test_loss: 0.9986, test_f1: 0.5434
 epoch: 59, train_loss: 0.9005, test_loss: 1.0015, test_f1: 0.5374
 epoch: 60, train_loss: 0.9091, test_loss: 1.0047, test_f1: 0.5365
 epoch: 61, train_loss: 0.9041, test_loss: 1.0001, test_f1: 0.5249
 epoch: 62, train_loss: 0.9025, test_loss: 0.9972, test_f1: 0.5381
 epoch: 63, train_loss: 0.8928, test_loss: 0.9967, test_f1: 0.5272
 epoch: 64, train_loss: 0.9049, test_loss: 0.9973, test_f1: 0.5363
 epoch: 65, train_loss: 0.8957, test_loss: 0.9999, test_f1: 0.5323
 epoch: 66, train_loss: 0.8918, test_loss: 1.0007, test_f1: 0.5340
 epoch: 67, train_loss: 0.8981, test_loss: 1.0008, test_f1: 0.5404
 epoch: 68, train_loss: 0.8908, test_loss: 0.9957, test_f1: 0.5377
 epoch: 69, train_loss: 0.8996, test_loss: 0.9984, test_f1: 0.5334
 epoch: 70, train_loss: 0.8978, test_loss: 1.0015, test_f1: 0.5408
 epoch: 71, train_loss: 0.8920, test_loss: 1.0028, test_f1: 0.5364
 epoch: 72, train_loss: 0.8880, test_loss: 1.0055, test_f1: 0.5369
 epoch: 73, train_loss: 0.8806, test_loss: 1.0002, test_f1: 0.5409
 epoch: 74, train_loss: 0.8868, test_loss: 1.0014, test_f1: 0.5284
 epoch: 75, train_loss: 0.8824, test_loss: 1.0009, test_f1: 0.5353
 epoch: 76, train_loss: 0.8854, test_loss: 1.0066, test_f1: 0.5212
 epoch: 77, train_loss: 0.8884, test_loss: 1.0097, test_f1: 0.5243
 epoch: 78, train_loss: 0.8834, test_loss: 1.0037, test_f1: 0.5175
 epoch: 79, train_loss: 0.8873, test_loss: 1.0012, test_f1: 0.5201
 epoch: 80, train_loss: 0.8755, test_loss: 1.0089, test_f1: 0.5181
 epoch: 81, train_loss: 0.8800, test_loss: 1.0106, test_f1: 0.5169
 epoch: 82, train_loss: 0.8761, test_loss: 1.0079, test_f1: 0.5423
 epoch: 83, train_loss: 0.8692, test_loss: 1.0066, test_f1: 0.5294
 epoch: 84, train_loss: 0.8760, test_loss: 1.0084, test_f1: 0.5224
 epoch: 85, train_loss: 0.8644, test_loss: 1.0075, test_f1: 0.5220
 epoch: 86, train_loss: 0.8698, test_loss: 1.0079, test_f1: 0.5141
 epoch: 87, train_loss: 0.8768, test_loss: 1.0040, test_f1: 0.5256
 epoch: 88, train_loss: 0.8733, test_loss: 1.0034, test_f1: 0.5250
 epoch: 89, train_loss: 0.8696, test_loss: 1.0076, test_f1: 0.5230
 epoch: 90, train_loss: 0.8642, test_loss: 1.0067, test_f1: 0.5243
 epoch: 91, train_loss: 0.8765, test_loss: 1.0011, test_f1: 0.5234
 epoch: 92, train_loss: 0.8678, test_loss: 1.0039, test_f1: 0.5257
 epoch: 93, train_loss: 0.8611, test_loss: 1.0133, test_f1: 0.5141
 epoch: 94, train_loss: 0.8679, test_loss: 1.0092, test_f1: 0.5152
 epoch: 95, train_loss: 0.8624, test_loss: 1.0046, test_f1: 0.5185
 epoch: 96, train_loss: 0.8645, test_loss: 1.0015, test_f1: 0.5204
 epoch: 97, train_loss: 0.8621, test_loss: 1.0069, test_f1: 0.5302
 epoch: 98, train_loss: 0.8618, test_loss: 1.0119, test_f1: 0.5248
 epoch: 99, train_loss: 0.8516, test_loss: 1.0080, test_f1: 0.5275
##################ITERATION #9 ****************************************
 epoch: 0, train_loss: 1.2919, test_loss: 1.3078, test_f1: 0.2281
 epoch: 1, train_loss: 1.2100, test_loss: 1.2948, test_f1: 0.2281
 epoch: 2, train_loss: 1.1847, test_loss: 1.2801, test_f1: 0.2336
 epoch: 3, train_loss: 1.1649, test_loss: 1.2479, test_f1: 0.2867
 epoch: 4, train_loss: 1.1474, test_loss: 1.2089, test_f1: 0.3078
 epoch: 5, train_loss: 1.1334, test_loss: 1.1818, test_f1: 0.3058
 epoch: 6, train_loss: 1.1184, test_loss: 1.1665, test_f1: 0.3136
 epoch: 7, train_loss: 1.1055, test_loss: 1.1570, test_f1: 0.3156
 epoch: 8, train_loss: 1.1016, test_loss: 1.1467, test_f1: 0.3115
 epoch: 9, train_loss: 1.0901, test_loss: 1.1398, test_f1: 0.3156
 epoch: 10, train_loss: 1.0757, test_loss: 1.1339, test_f1: 0.3240
 epoch: 11, train_loss: 1.0705, test_loss: 1.1288, test_f1: 0.3422
 epoch: 12, train_loss: 1.0648, test_loss: 1.1234, test_f1: 0.3542
 epoch: 13, train_loss: 1.0625, test_loss: 1.1200, test_f1: 0.3562
 epoch: 14, train_loss: 1.0407, test_loss: 1.1097, test_f1: 0.3646
 epoch: 15, train_loss: 1.0377, test_loss: 1.1103, test_f1: 0.3566
 epoch: 16, train_loss: 1.0382, test_loss: 1.1034, test_f1: 0.3674
 epoch: 17, train_loss: 1.0229, test_loss: 1.0986, test_f1: 0.3725
 epoch: 18, train_loss: 1.0181, test_loss: 1.0960, test_f1: 0.3757
 epoch: 19, train_loss: 1.0118, test_loss: 1.0894, test_f1: 0.3906
 epoch: 20, train_loss: 1.0014, test_loss: 1.0852, test_f1: 0.4001
 epoch: 21, train_loss: 1.0115, test_loss: 1.0779, test_f1: 0.4050
 epoch: 22, train_loss: 1.0025, test_loss: 1.0754, test_f1: 0.4150
 epoch: 23, train_loss: 0.9971, test_loss: 1.0791, test_f1: 0.4155
 epoch: 24, train_loss: 0.9964, test_loss: 1.0750, test_f1: 0.4175
 epoch: 25, train_loss: 0.9878, test_loss: 1.0766, test_f1: 0.4200
 epoch: 26, train_loss: 0.9962, test_loss: 1.0718, test_f1: 0.4135
 epoch: 27, train_loss: 0.9760, test_loss: 1.0663, test_f1: 0.4110
 epoch: 28, train_loss: 0.9750, test_loss: 1.0589, test_f1: 0.4220
 epoch: 29, train_loss: 0.9750, test_loss: 1.0589, test_f1: 0.4474
 epoch: 30, train_loss: 0.9673, test_loss: 1.0570, test_f1: 0.4780
 epoch: 31, train_loss: 0.9726, test_loss: 1.0501, test_f1: 0.5014
 epoch: 32, train_loss: 0.9610, test_loss: 1.0446, test_f1: 0.4990
 epoch: 33, train_loss: 0.9628, test_loss: 1.0523, test_f1: 0.4938
 epoch: 34, train_loss: 0.9573, test_loss: 1.0458, test_f1: 0.4913
 epoch: 35, train_loss: 0.9477, test_loss: 1.0605, test_f1: 0.4853
 epoch: 36, train_loss: 0.9481, test_loss: 1.0602, test_f1: 0.5007
 epoch: 37, train_loss: 0.9499, test_loss: 1.0558, test_f1: 0.4963
 epoch: 38, train_loss: 0.9329, test_loss: 1.0534, test_f1: 0.5113
 epoch: 39, train_loss: 0.9345, test_loss: 1.0537, test_f1: 0.5163
 epoch: 40, train_loss: 0.9269, test_loss: 1.0519, test_f1: 0.5124
 epoch: 41, train_loss: 0.9333, test_loss: 1.0554, test_f1: 0.5200
 epoch: 42, train_loss: 0.9190, test_loss: 1.0523, test_f1: 0.5185
 epoch: 43, train_loss: 0.9132, test_loss: 1.0444, test_f1: 0.5194
 epoch: 44, train_loss: 0.9150, test_loss: 1.0439, test_f1: 0.5332
 epoch: 45, train_loss: 0.9142, test_loss: 1.0497, test_f1: 0.5242
 epoch: 46, train_loss: 0.9247, test_loss: 1.0409, test_f1: 0.5322
 epoch: 47, train_loss: 0.9122, test_loss: 1.0465, test_f1: 0.5188
 epoch: 48, train_loss: 0.9132, test_loss: 1.0573, test_f1: 0.5469
 epoch: 49, train_loss: 0.9116, test_loss: 1.0534, test_f1: 0.5479
 epoch: 50, train_loss: 0.8964, test_loss: 1.0523, test_f1: 0.5277
 epoch: 51, train_loss: 0.8944, test_loss: 1.0509, test_f1: 0.5325
 epoch: 52, train_loss: 0.9029, test_loss: 1.0536, test_f1: 0.5362
 epoch: 53, train_loss: 0.8869, test_loss: 1.0542, test_f1: 0.5264
 epoch: 54, train_loss: 0.8932, test_loss: 1.0492, test_f1: 0.5276
 epoch: 55, train_loss: 0.8944, test_loss: 1.0519, test_f1: 0.5314
 epoch: 56, train_loss: 0.8897, test_loss: 1.0553, test_f1: 0.5398
 epoch: 57, train_loss: 0.8974, test_loss: 1.0537, test_f1: 0.5340
 epoch: 58, train_loss: 0.8973, test_loss: 1.0538, test_f1: 0.5351
 epoch: 59, train_loss: 0.8926, test_loss: 1.0588, test_f1: 0.5444
 epoch: 60, train_loss: 0.8894, test_loss: 1.0587, test_f1: 0.5389
 epoch: 61, train_loss: 0.8916, test_loss: 1.0635, test_f1: 0.5383
 epoch: 62, train_loss: 0.8811, test_loss: 1.0558, test_f1: 0.5346
 epoch: 63, train_loss: 0.8864, test_loss: 1.0557, test_f1: 0.5341
 epoch: 64, train_loss: 0.8762, test_loss: 1.0617, test_f1: 0.5261
 epoch: 65, train_loss: 0.8804, test_loss: 1.0627, test_f1: 0.5418
 epoch: 66, train_loss: 0.8841, test_loss: 1.0612, test_f1: 0.5329
 epoch: 67, train_loss: 0.8770, test_loss: 1.0647, test_f1: 0.5276
 epoch: 68, train_loss: 0.8820, test_loss: 1.0610, test_f1: 0.5322
 epoch: 69, train_loss: 0.8786, test_loss: 1.0621, test_f1: 0.5350
 epoch: 70, train_loss: 0.8727, test_loss: 1.0605, test_f1: 0.5360
 epoch: 71, train_loss: 0.8801, test_loss: 1.0613, test_f1: 0.5287
 epoch: 72, train_loss: 0.8738, test_loss: 1.0666, test_f1: 0.5385
 epoch: 73, train_loss: 0.8670, test_loss: 1.0704, test_f1: 0.5406
 epoch: 74, train_loss: 0.8721, test_loss: 1.0748, test_f1: 0.5410
 epoch: 75, train_loss: 0.8662, test_loss: 1.0732, test_f1: 0.5406
 epoch: 76, train_loss: 0.8724, test_loss: 1.0683, test_f1: 0.5406
 epoch: 77, train_loss: 0.8775, test_loss: 1.0682, test_f1: 0.5381
 epoch: 78, train_loss: 0.8653, test_loss: 1.0718, test_f1: 0.5319
 epoch: 79, train_loss: 0.8708, test_loss: 1.0774, test_f1: 0.5338
 epoch: 80, train_loss: 0.8658, test_loss: 1.0727, test_f1: 0.5307
 epoch: 81, train_loss: 0.8640, test_loss: 1.0782, test_f1: 0.5289
 epoch: 82, train_loss: 0.8564, test_loss: 1.0723, test_f1: 0.5386
 epoch: 83, train_loss: 0.8712, test_loss: 1.0708, test_f1: 0.5315
 epoch: 84, train_loss: 0.8598, test_loss: 1.0720, test_f1: 0.5250
 epoch: 85, train_loss: 0.8495, test_loss: 1.0765, test_f1: 0.5315
 epoch: 86, train_loss: 0.8557, test_loss: 1.0765, test_f1: 0.5250
 epoch: 87, train_loss: 0.8580, test_loss: 1.0786, test_f1: 0.5230
 epoch: 88, train_loss: 0.8670, test_loss: 1.0745, test_f1: 0.5353
 epoch: 89, train_loss: 0.8545, test_loss: 1.0825, test_f1: 0.5279
 epoch: 90, train_loss: 0.8597, test_loss: 1.0896, test_f1: 0.5377
 epoch: 91, train_loss: 0.8615, test_loss: 1.0874, test_f1: 0.5312
 epoch: 92, train_loss: 0.8512, test_loss: 1.0823, test_f1: 0.5315
 epoch: 93, train_loss: 0.8588, test_loss: 1.0845, test_f1: 0.5283
 epoch: 94, train_loss: 0.8517, test_loss: 1.0837, test_f1: 0.5369
 epoch: 95, train_loss: 0.8556, test_loss: 1.0829, test_f1: 0.5385
 epoch: 96, train_loss: 0.8453, test_loss: 1.0898, test_f1: 0.5326
 epoch: 97, train_loss: 0.8446, test_loss: 1.0909, test_f1: 0.5262
 epoch: 98, train_loss: 0.8460, test_loss: 1.0924, test_f1: 0.5311
 epoch: 99, train_loss: 0.8459, test_loss: 1.0862, test_f1: 0.5314

Training completed in 313.25 seconds
Best F1: 0.5863 at epoch 96
Mean F1 across iterations: 0.5371  0.0257
========================FINAL RESULTS================================
FEGIN weighted F1: 0.5863  0.0257
python main.py --data ltspice_demos --representation component_net --model FEGIN --layers 2 --hiddens 64 --batch_size 128 --lr 0.0001 --emb_size 512 --epochs 100 --save_appendix component_net_L2_H64_BS128_LR0.0001_E512 --no_val
-----



STDERR:
  File "main.py", line 370, in <module>
    main()
  File "main.py", line 254, in main
    dataset = dataset_class(
  File "/home/philip/projects/ltspice_examples_code_repo/Circuit-Completion-Using-GNNs/component_classification_with_link_prediction_head/evaluation/FEGIN/kernel/circuit_datasets.py", line 15, in __init__
    self.data, self.slices = torch.load(self.processed_paths[0])
  File "/home/philip/.local/lib/python3.8/site-packages/torch/serialization.py", line 1040, in load
    warnings.warn(
  File "/usr/lib/python3.8/warnings.py", line 109, in _showwarnmsg
    sw(msg.message, msg.category, msg.filename, msg.lineno,
  File "main.py", line 47, in warn_with_traceback
    traceback.print_stack(file=log)
/home/philip/projects/ltspice_examples_code_repo/Circuit-Completion-Using-GNNs/component_classification_with_link_prediction_head/evaluation/FEGIN/kernel/circuit_datasets.py:15: FutureWarning: You are using `torch.load` with `weights_only=False` (the current default value), which uses the default pickle module implicitly. It is possible to construct malicious pickle data which will execute arbitrary code during unpickling (See https://github.com/pytorch/pytorch/blob/main/SECURITY.md#untrusted-models for more details). In a future release, the default value for `weights_only` will be flipped to `True`. This limits the functions that could be executed during unpickling. Arbitrary objects will no longer be allowed to be loaded via this mode unless they are explicitly allowlisted by the user via `torch.serialization.add_safe_globals`. We recommend you start setting `weights_only=True` for any use case where you don't have full control of the loaded file. Please open an issue on GitHub for any issues related to this experimental feature.
  self.data, self.slices = torch.load(self.processed_paths[0])
