STDOUT:
Results will be saved in /home/philip/projects/ltspice_examples_code_repo/Circuit-Completion-Using-GNNs/component_classification_with_link_prediction_head/evaluation/FEGIN/results/model_FEGIN_dataset_ltspice_demos
Command line input: python main.py --data ltspice_demos --representation component_component --model FEGIN --layers 3 --hiddens 128 --batch_size 32 --lr 0.001 --emb_size 512 --epochs 100 --save_appendix component_component_L3_H128_BS32_LR0.001_E512 --no_val
 is saved.
-----
ltspice_demos - FEGIN
Using 3 layers, 128 hidden units, h = 2
Loading component_component representation dataset
ENTERED
Training FEGIN on component_component representation
Train: 1565, Test: 383
##################ITERATION #0 ****************************************
 epoch: 0, train_loss: 1.2204, test_loss: 1.2668, test_f1: 0.3171
 epoch: 1, train_loss: 1.1118, test_loss: 1.3296, test_f1: 0.3635
 epoch: 2, train_loss: 1.0503, test_loss: 1.3374, test_f1: 0.4226
 epoch: 3, train_loss: 1.0158, test_loss: 1.1882, test_f1: 0.4771
 epoch: 4, train_loss: 0.9583, test_loss: 1.1623, test_f1: 0.5314
 epoch: 5, train_loss: 0.9263, test_loss: 1.1813, test_f1: 0.4653
 epoch: 6, train_loss: 0.8973, test_loss: 1.2442, test_f1: 0.5185
 epoch: 7, train_loss: 0.8672, test_loss: 1.1952, test_f1: 0.4657
 epoch: 8, train_loss: 0.8534, test_loss: 1.1447, test_f1: 0.5685
 epoch: 9, train_loss: 0.8549, test_loss: 1.1581, test_f1: 0.5903
 epoch: 10, train_loss: 0.7992, test_loss: 1.5066, test_f1: 0.5178
 epoch: 11, train_loss: 0.8082, test_loss: 1.2906, test_f1: 0.5442
 epoch: 12, train_loss: 0.7676, test_loss: 1.2117, test_f1: 0.4997
 epoch: 13, train_loss: 0.7602, test_loss: 1.2421, test_f1: 0.5463
 epoch: 14, train_loss: 0.7716, test_loss: 1.1487, test_f1: 0.5633
 epoch: 15, train_loss: 0.7401, test_loss: 1.1932, test_f1: 0.5852
 epoch: 16, train_loss: 0.7481, test_loss: 1.4187, test_f1: 0.5499
 epoch: 17, train_loss: 0.7092, test_loss: 1.3606, test_f1: 0.6276
 epoch: 18, train_loss: 0.6822, test_loss: 1.2855, test_f1: 0.5958
 epoch: 19, train_loss: 0.6836, test_loss: 1.4333, test_f1: 0.5607
 epoch: 20, train_loss: 0.6731, test_loss: 1.4666, test_f1: 0.5675
 epoch: 21, train_loss: 0.6751, test_loss: 1.3451, test_f1: 0.5428
 epoch: 22, train_loss: 0.6552, test_loss: 1.4621, test_f1: 0.5855
 epoch: 23, train_loss: 0.6414, test_loss: 1.4331, test_f1: 0.5430
 epoch: 24, train_loss: 0.6349, test_loss: 1.7279, test_f1: 0.5225
 epoch: 25, train_loss: 0.5882, test_loss: 1.7276, test_f1: 0.5741
 epoch: 26, train_loss: 0.5933, test_loss: 1.6081, test_f1: 0.5528
 epoch: 27, train_loss: 0.6077, test_loss: 1.6671, test_f1: 0.5519
 epoch: 28, train_loss: 0.6090, test_loss: 1.4544, test_f1: 0.5481
 epoch: 29, train_loss: 0.5645, test_loss: 1.4985, test_f1: 0.5920
 epoch: 30, train_loss: 0.5665, test_loss: 1.4935, test_f1: 0.5764
 epoch: 31, train_loss: 0.5469, test_loss: 1.7808, test_f1: 0.4921
 epoch: 32, train_loss: 0.5463, test_loss: 1.8384, test_f1: 0.5401
 epoch: 33, train_loss: 0.5273, test_loss: 1.7527, test_f1: 0.5710
 epoch: 34, train_loss: 0.5217, test_loss: 1.6502, test_f1: 0.5543
 epoch: 35, train_loss: 0.5122, test_loss: 1.7672, test_f1: 0.5311
 epoch: 36, train_loss: 0.5407, test_loss: 1.7330, test_f1: 0.5512
 epoch: 37, train_loss: 0.4947, test_loss: 1.8338, test_f1: 0.5632
 epoch: 38, train_loss: 0.5205, test_loss: 1.9575, test_f1: 0.5787
 epoch: 39, train_loss: 0.4884, test_loss: 2.0055, test_f1: 0.5887
 epoch: 40, train_loss: 0.4975, test_loss: 1.7594, test_f1: 0.5599
 epoch: 41, train_loss: 0.4785, test_loss: 2.1915, test_f1: 0.5588
 epoch: 42, train_loss: 0.4855, test_loss: 2.0481, test_f1: 0.5431
 epoch: 43, train_loss: 0.4576, test_loss: 2.4831, test_f1: 0.5774
 epoch: 44, train_loss: 0.4883, test_loss: 2.2841, test_f1: 0.5319
 epoch: 45, train_loss: 0.4860, test_loss: 2.0549, test_f1: 0.5312
 epoch: 46, train_loss: 0.4292, test_loss: 2.1438, test_f1: 0.5761
 epoch: 47, train_loss: 0.4385, test_loss: 2.0889, test_f1: 0.6058
 epoch: 48, train_loss: 0.4436, test_loss: 2.4704, test_f1: 0.5758
 epoch: 49, train_loss: 0.4392, test_loss: 1.7536, test_f1: 0.5759
 epoch: 50, train_loss: 0.4334, test_loss: 1.8626, test_f1: 0.5690
 epoch: 51, train_loss: 0.3657, test_loss: 2.1709, test_f1: 0.5536
 epoch: 52, train_loss: 0.3581, test_loss: 2.1489, test_f1: 0.5453
 epoch: 53, train_loss: 0.3719, test_loss: 1.9654, test_f1: 0.5855
 epoch: 54, train_loss: 0.3333, test_loss: 2.1799, test_f1: 0.5805
 epoch: 55, train_loss: 0.3065, test_loss: 2.3182, test_f1: 0.5692
 epoch: 56, train_loss: 0.3345, test_loss: 2.3753, test_f1: 0.5699
 epoch: 57, train_loss: 0.3293, test_loss: 2.4247, test_f1: 0.5797
 epoch: 58, train_loss: 0.3131, test_loss: 2.4455, test_f1: 0.5733
 epoch: 59, train_loss: 0.3010, test_loss: 2.4198, test_f1: 0.5859
 epoch: 60, train_loss: 0.2717, test_loss: 2.3644, test_f1: 0.5964
 epoch: 61, train_loss: 0.2792, test_loss: 2.5696, test_f1: 0.5646
 epoch: 62, train_loss: 0.3056, test_loss: 2.4483, test_f1: 0.5683
 epoch: 63, train_loss: 0.2924, test_loss: 2.6655, test_f1: 0.5810
 epoch: 64, train_loss: 0.2912, test_loss: 2.5761, test_f1: 0.5555
 epoch: 65, train_loss: 0.2974, test_loss: 2.2436, test_f1: 0.5864
 epoch: 66, train_loss: 0.3102, test_loss: 2.3797, test_f1: 0.5900
 epoch: 67, train_loss: 0.2599, test_loss: 2.4501, test_f1: 0.5805
 epoch: 68, train_loss: 0.2743, test_loss: 2.6879, test_f1: 0.5817
 epoch: 69, train_loss: 0.2579, test_loss: 2.6219, test_f1: 0.5765
 epoch: 70, train_loss: 0.2999, test_loss: 2.6731, test_f1: 0.5790
 epoch: 71, train_loss: 0.2558, test_loss: 2.8361, test_f1: 0.5858
 epoch: 72, train_loss: 0.2607, test_loss: 2.7467, test_f1: 0.5682
 epoch: 73, train_loss: 0.2596, test_loss: 2.7517, test_f1: 0.5934
 epoch: 74, train_loss: 0.2747, test_loss: 3.1352, test_f1: 0.5741
 epoch: 75, train_loss: 0.2589, test_loss: 3.1636, test_f1: 0.5649
 epoch: 76, train_loss: 0.2532, test_loss: 2.6275, test_f1: 0.5737
 epoch: 77, train_loss: 0.2428, test_loss: 2.8583, test_f1: 0.5815
 epoch: 78, train_loss: 0.2628, test_loss: 2.7649, test_f1: 0.5853
 epoch: 79, train_loss: 0.2476, test_loss: 2.8573, test_f1: 0.5926
 epoch: 80, train_loss: 0.2476, test_loss: 2.8275, test_f1: 0.5479
 epoch: 81, train_loss: 0.2220, test_loss: 2.8164, test_f1: 0.5725
 epoch: 82, train_loss: 0.2435, test_loss: 3.0781, test_f1: 0.5667
 epoch: 83, train_loss: 0.2425, test_loss: 2.8615, test_f1: 0.5842
 epoch: 84, train_loss: 0.2410, test_loss: 2.7520, test_f1: 0.5862
 epoch: 85, train_loss: 0.2117, test_loss: 2.9695, test_f1: 0.6043
 epoch: 86, train_loss: 0.2457, test_loss: 2.8958, test_f1: 0.5818
 epoch: 87, train_loss: 0.2171, test_loss: 3.0609, test_f1: 0.5784
 epoch: 88, train_loss: 0.2122, test_loss: 2.9851, test_f1: 0.5842
 epoch: 89, train_loss: 0.2529, test_loss: 2.9900, test_f1: 0.5701
 epoch: 90, train_loss: 0.2357, test_loss: 2.8431, test_f1: 0.6133
 epoch: 91, train_loss: 0.2122, test_loss: 3.0917, test_f1: 0.5542
 epoch: 92, train_loss: 0.2175, test_loss: 2.8551, test_f1: 0.5644
 epoch: 93, train_loss: 0.2119, test_loss: 3.1588, test_f1: 0.5633
 epoch: 94, train_loss: 0.2118, test_loss: 2.9753, test_f1: 0.5849
 epoch: 95, train_loss: 0.1942, test_loss: 2.9434, test_f1: 0.5827
 epoch: 96, train_loss: 0.2322, test_loss: 3.5061, test_f1: 0.5553
 epoch: 97, train_loss: 0.2120, test_loss: 3.1262, test_f1: 0.5971
 epoch: 98, train_loss: 0.2153, test_loss: 3.2561, test_f1: 0.5926
 epoch: 99, train_loss: 0.2154, test_loss: 3.0814, test_f1: 0.5925
##################ITERATION #1 ****************************************
 epoch: 0, train_loss: 1.1510, test_loss: 1.1577, test_f1: 0.4198
 epoch: 1, train_loss: 1.0812, test_loss: 1.1651, test_f1: 0.4673
 epoch: 2, train_loss: 1.0021, test_loss: 1.1329, test_f1: 0.5357
 epoch: 3, train_loss: 0.9461, test_loss: 1.1399, test_f1: 0.5050
 epoch: 4, train_loss: 0.9369, test_loss: 1.1598, test_f1: 0.5162
 epoch: 5, train_loss: 0.9079, test_loss: 1.1973, test_f1: 0.5228
 epoch: 6, train_loss: 0.8877, test_loss: 1.1106, test_f1: 0.5156
 epoch: 7, train_loss: 0.8397, test_loss: 1.1633, test_f1: 0.5937
 epoch: 8, train_loss: 0.8166, test_loss: 1.3076, test_f1: 0.5062
 epoch: 9, train_loss: 0.8376, test_loss: 1.1721, test_f1: 0.5567
 epoch: 10, train_loss: 0.8146, test_loss: 1.1797, test_f1: 0.5605
 epoch: 11, train_loss: 0.7676, test_loss: 1.1238, test_f1: 0.5605
 epoch: 12, train_loss: 0.7622, test_loss: 1.4022, test_f1: 0.4530
 epoch: 13, train_loss: 0.7586, test_loss: 1.0954, test_f1: 0.5901
 epoch: 14, train_loss: 0.7181, test_loss: 1.1756, test_f1: 0.5506
 epoch: 15, train_loss: 0.7135, test_loss: 1.2540, test_f1: 0.5684
 epoch: 16, train_loss: 0.7484, test_loss: 1.3381, test_f1: 0.5745
 epoch: 17, train_loss: 0.6991, test_loss: 1.5848, test_f1: 0.5853
 epoch: 18, train_loss: 0.6831, test_loss: 1.3542, test_f1: 0.5970
 epoch: 19, train_loss: 0.7052, test_loss: 1.2682, test_f1: 0.5812
 epoch: 20, train_loss: 0.6761, test_loss: 1.3424, test_f1: 0.6024
 epoch: 21, train_loss: 0.6859, test_loss: 1.4768, test_f1: 0.5387
 epoch: 22, train_loss: 0.6672, test_loss: 1.5313, test_f1: 0.5270
 epoch: 23, train_loss: 0.6580, test_loss: 1.3020, test_f1: 0.5716
 epoch: 24, train_loss: 0.6309, test_loss: 1.3496, test_f1: 0.6065
 epoch: 25, train_loss: 0.6000, test_loss: 1.5290, test_f1: 0.5481
 epoch: 26, train_loss: 0.6122, test_loss: 1.5732, test_f1: 0.5960
 epoch: 27, train_loss: 0.5978, test_loss: 1.3500, test_f1: 0.6333
 epoch: 28, train_loss: 0.6023, test_loss: 1.4800, test_f1: 0.5568
 epoch: 29, train_loss: 0.6068, test_loss: 1.4317, test_f1: 0.6215
 epoch: 30, train_loss: 0.5888, test_loss: 1.6369, test_f1: 0.6122
 epoch: 31, train_loss: 0.5657, test_loss: 1.4263, test_f1: 0.5942
 epoch: 32, train_loss: 0.5500, test_loss: 1.6728, test_f1: 0.5558
 epoch: 33, train_loss: 0.5356, test_loss: 1.8713, test_f1: 0.5610
 epoch: 34, train_loss: 0.5411, test_loss: 1.6109, test_f1: 0.5984
 epoch: 35, train_loss: 0.5189, test_loss: 1.9527, test_f1: 0.5368
 epoch: 36, train_loss: 0.5028, test_loss: 1.6324, test_f1: 0.5391
 epoch: 37, train_loss: 0.5278, test_loss: 2.0031, test_f1: 0.5028
 epoch: 38, train_loss: 0.5277, test_loss: 1.5751, test_f1: 0.5598
 epoch: 39, train_loss: 0.4971, test_loss: 1.6876, test_f1: 0.5381
 epoch: 40, train_loss: 0.4803, test_loss: 1.5789, test_f1: 0.5755
 epoch: 41, train_loss: 0.4714, test_loss: 2.0529, test_f1: 0.6034
 epoch: 42, train_loss: 0.4470, test_loss: 1.9523, test_f1: 0.5890
 epoch: 43, train_loss: 0.4861, test_loss: 1.8103, test_f1: 0.5757
 epoch: 44, train_loss: 0.4693, test_loss: 1.5438, test_f1: 0.6167
 epoch: 45, train_loss: 0.4665, test_loss: 1.8659, test_f1: 0.6016
 epoch: 46, train_loss: 0.4389, test_loss: 1.8987, test_f1: 0.5798
 epoch: 47, train_loss: 0.4758, test_loss: 1.7517, test_f1: 0.5375
 epoch: 48, train_loss: 0.4129, test_loss: 2.0995, test_f1: 0.6219
 epoch: 49, train_loss: 0.4897, test_loss: 2.2595, test_f1: 0.5495
 epoch: 50, train_loss: 0.4331, test_loss: 2.3717, test_f1: 0.5618
 epoch: 51, train_loss: 0.3729, test_loss: 2.3101, test_f1: 0.5632
 epoch: 52, train_loss: 0.3573, test_loss: 2.3103, test_f1: 0.5750
 epoch: 53, train_loss: 0.3574, test_loss: 2.2908, test_f1: 0.5531
 epoch: 54, train_loss: 0.3387, test_loss: 2.3217, test_f1: 0.5948
 epoch: 55, train_loss: 0.3216, test_loss: 2.7184, test_f1: 0.5568
 epoch: 56, train_loss: 0.3198, test_loss: 2.4569, test_f1: 0.5901
 epoch: 57, train_loss: 0.3132, test_loss: 2.5206, test_f1: 0.5938
 epoch: 58, train_loss: 0.3366, test_loss: 2.2369, test_f1: 0.5940
 epoch: 59, train_loss: 0.3070, test_loss: 2.5578, test_f1: 0.5682
 epoch: 60, train_loss: 0.3134, test_loss: 2.4940, test_f1: 0.5915
 epoch: 61, train_loss: 0.3339, test_loss: 2.4716, test_f1: 0.5732
 epoch: 62, train_loss: 0.2832, test_loss: 3.0411, test_f1: 0.5514
 epoch: 63, train_loss: 0.2851, test_loss: 3.5173, test_f1: 0.5686
 epoch: 64, train_loss: 0.2725, test_loss: 2.8829, test_f1: 0.5374
 epoch: 65, train_loss: 0.2687, test_loss: 2.7564, test_f1: 0.5706
 epoch: 66, train_loss: 0.2914, test_loss: 3.6677, test_f1: 0.5668
 epoch: 67, train_loss: 0.2841, test_loss: 3.1890, test_f1: 0.5461
 epoch: 68, train_loss: 0.2650, test_loss: 3.1334, test_f1: 0.6032
 epoch: 69, train_loss: 0.2911, test_loss: 2.7361, test_f1: 0.5832
 epoch: 70, train_loss: 0.2973, test_loss: 2.5765, test_f1: 0.5609
 epoch: 71, train_loss: 0.2586, test_loss: 2.7588, test_f1: 0.5873
 epoch: 72, train_loss: 0.2841, test_loss: 2.7364, test_f1: 0.5855
 epoch: 73, train_loss: 0.2641, test_loss: 2.7909, test_f1: 0.5771
 epoch: 74, train_loss: 0.2592, test_loss: 2.9057, test_f1: 0.5799
 epoch: 75, train_loss: 0.2252, test_loss: 3.1487, test_f1: 0.5906
 epoch: 76, train_loss: 0.2611, test_loss: 3.3484, test_f1: 0.5534
 epoch: 77, train_loss: 0.2522, test_loss: 3.4202, test_f1: 0.5929
 epoch: 78, train_loss: 0.2371, test_loss: 3.4794, test_f1: 0.5902
 epoch: 79, train_loss: 0.2588, test_loss: 3.3246, test_f1: 0.5776
 epoch: 80, train_loss: 0.2545, test_loss: 3.5061, test_f1: 0.5638
 epoch: 81, train_loss: 0.2362, test_loss: 3.1049, test_f1: 0.5759
 epoch: 82, train_loss: 0.2341, test_loss: 3.1430, test_f1: 0.6026
 epoch: 83, train_loss: 0.2222, test_loss: 3.1079, test_f1: 0.5631
 epoch: 84, train_loss: 0.2172, test_loss: 3.0572, test_f1: 0.5696
 epoch: 85, train_loss: 0.2656, test_loss: 3.3484, test_f1: 0.5692
 epoch: 86, train_loss: 0.2028, test_loss: 3.5045, test_f1: 0.5991
 epoch: 87, train_loss: 0.2503, test_loss: 3.2514, test_f1: 0.5919
 epoch: 88, train_loss: 0.2570, test_loss: 3.5569, test_f1: 0.5822
 epoch: 89, train_loss: 0.2623, test_loss: 3.3561, test_f1: 0.5935
 epoch: 90, train_loss: 0.2340, test_loss: 3.6464, test_f1: 0.5529
 epoch: 91, train_loss: 0.2208, test_loss: 3.2830, test_f1: 0.5458
 epoch: 92, train_loss: 0.2163, test_loss: 3.3191, test_f1: 0.6102
 epoch: 93, train_loss: 0.2111, test_loss: 3.6218, test_f1: 0.5634
 epoch: 94, train_loss: 0.2326, test_loss: 3.5758, test_f1: 0.5754
 epoch: 95, train_loss: 0.2275, test_loss: 3.2655, test_f1: 0.5991
 epoch: 96, train_loss: 0.1977, test_loss: 3.9459, test_f1: 0.5903
 epoch: 97, train_loss: 0.2227, test_loss: 2.7024, test_f1: 0.5812
 epoch: 98, train_loss: 0.2117, test_loss: 3.6390, test_f1: 0.5764
 epoch: 99, train_loss: 0.2003, test_loss: 3.6817, test_f1: 0.5682
##################ITERATION #2 ****************************************
 epoch: 0, train_loss: 1.2110, test_loss: 1.2941, test_f1: 0.4422
 epoch: 1, train_loss: 1.0860, test_loss: 1.2724, test_f1: 0.3984
 epoch: 2, train_loss: 1.0349, test_loss: 1.1830, test_f1: 0.4359
 epoch: 3, train_loss: 0.9828, test_loss: 1.1751, test_f1: 0.4735
 epoch: 4, train_loss: 0.9389, test_loss: 1.0846, test_f1: 0.5651
 epoch: 5, train_loss: 0.9293, test_loss: 1.0629, test_f1: 0.5336
 epoch: 6, train_loss: 0.8944, test_loss: 1.0973, test_f1: 0.5676
 epoch: 7, train_loss: 0.8914, test_loss: 1.0418, test_f1: 0.6185
 epoch: 8, train_loss: 0.8554, test_loss: 1.0553, test_f1: 0.5074
 epoch: 9, train_loss: 0.8351, test_loss: 1.2774, test_f1: 0.5725
 epoch: 10, train_loss: 0.8509, test_loss: 1.0468, test_f1: 0.5960
 epoch: 11, train_loss: 0.8488, test_loss: 1.0218, test_f1: 0.5898
 epoch: 12, train_loss: 0.7888, test_loss: 1.1158, test_f1: 0.6007
 epoch: 13, train_loss: 0.7691, test_loss: 1.2207, test_f1: 0.5461
 epoch: 14, train_loss: 0.7605, test_loss: 1.2311, test_f1: 0.5960
 epoch: 15, train_loss: 0.7416, test_loss: 1.1577, test_f1: 0.6026
 epoch: 16, train_loss: 0.7527, test_loss: 1.3664, test_f1: 0.6061
 epoch: 17, train_loss: 0.7182, test_loss: 1.1998, test_f1: 0.5516
 epoch: 18, train_loss: 0.7223, test_loss: 1.3001, test_f1: 0.5693
 epoch: 19, train_loss: 0.7417, test_loss: 1.1605, test_f1: 0.6260
 epoch: 20, train_loss: 0.7186, test_loss: 1.2707, test_f1: 0.5879
 epoch: 21, train_loss: 0.7101, test_loss: 1.2269, test_f1: 0.5908
 epoch: 22, train_loss: 0.6545, test_loss: 1.2635, test_f1: 0.5787
 epoch: 23, train_loss: 0.6396, test_loss: 1.5191, test_f1: 0.5798
 epoch: 24, train_loss: 0.6490, test_loss: 1.5477, test_f1: 0.5356
 epoch: 25, train_loss: 0.6420, test_loss: 1.3493, test_f1: 0.5852
 epoch: 26, train_loss: 0.5989, test_loss: 1.3737, test_f1: 0.5424
 epoch: 27, train_loss: 0.6232, test_loss: 1.4099, test_f1: 0.5896
 epoch: 28, train_loss: 0.6261, test_loss: 1.5096, test_f1: 0.5801
 epoch: 29, train_loss: 0.5684, test_loss: 1.5432, test_f1: 0.6198
 epoch: 30, train_loss: 0.6272, test_loss: 1.4967, test_f1: 0.5624
 epoch: 31, train_loss: 0.5981, test_loss: 1.4871, test_f1: 0.5773
 epoch: 32, train_loss: 0.5723, test_loss: 1.3157, test_f1: 0.6230
 epoch: 33, train_loss: 0.5483, test_loss: 1.5846, test_f1: 0.5892
 epoch: 34, train_loss: 0.5696, test_loss: 1.6546, test_f1: 0.6113
 epoch: 35, train_loss: 0.5349, test_loss: 1.5460, test_f1: 0.6135
 epoch: 36, train_loss: 0.5756, test_loss: 1.5471, test_f1: 0.5685
 epoch: 37, train_loss: 0.5522, test_loss: 1.5173, test_f1: 0.5725
 epoch: 38, train_loss: 0.5109, test_loss: 1.8094, test_f1: 0.5654
 epoch: 39, train_loss: 0.5521, test_loss: 1.6157, test_f1: 0.6597
 epoch: 40, train_loss: 0.5615, test_loss: 1.9169, test_f1: 0.5739
 epoch: 41, train_loss: 0.4716, test_loss: 1.9258, test_f1: 0.5751
 epoch: 42, train_loss: 0.5350, test_loss: 1.6902, test_f1: 0.5788
 epoch: 43, train_loss: 0.4851, test_loss: 1.9034, test_f1: 0.4919
 epoch: 44, train_loss: 0.5012, test_loss: 1.6746, test_f1: 0.5631
 epoch: 45, train_loss: 0.4860, test_loss: 1.8493, test_f1: 0.6106
 epoch: 46, train_loss: 0.4785, test_loss: 1.5693, test_f1: 0.5763
 epoch: 47, train_loss: 0.4795, test_loss: 1.7631, test_f1: 0.6018
 epoch: 48, train_loss: 0.4624, test_loss: 1.9134, test_f1: 0.5787
 epoch: 49, train_loss: 0.4625, test_loss: 2.0450, test_f1: 0.5549
 epoch: 50, train_loss: 0.4648, test_loss: 1.6313, test_f1: 0.6106
 epoch: 51, train_loss: 0.4117, test_loss: 1.7354, test_f1: 0.6007
 epoch: 52, train_loss: 0.3979, test_loss: 1.7127, test_f1: 0.5770
 epoch: 53, train_loss: 0.3748, test_loss: 1.8355, test_f1: 0.5723
 epoch: 54, train_loss: 0.3681, test_loss: 2.0168, test_f1: 0.5497
 epoch: 55, train_loss: 0.3627, test_loss: 1.9627, test_f1: 0.6392
 epoch: 56, train_loss: 0.3458, test_loss: 2.1254, test_f1: 0.5551
 epoch: 57, train_loss: 0.3133, test_loss: 1.9977, test_f1: 0.5839
 epoch: 58, train_loss: 0.3383, test_loss: 2.2667, test_f1: 0.5555
 epoch: 59, train_loss: 0.3448, test_loss: 2.0563, test_f1: 0.5824
 epoch: 60, train_loss: 0.3401, test_loss: 2.2213, test_f1: 0.5619
 epoch: 61, train_loss: 0.3480, test_loss: 1.9989, test_f1: 0.5676
 epoch: 62, train_loss: 0.3294, test_loss: 2.1968, test_f1: 0.5846
 epoch: 63, train_loss: 0.3301, test_loss: 2.3727, test_f1: 0.5263
 epoch: 64, train_loss: 0.3268, test_loss: 2.0761, test_f1: 0.5974
 epoch: 65, train_loss: 0.3197, test_loss: 2.0452, test_f1: 0.5845
 epoch: 66, train_loss: 0.3402, test_loss: 2.0969, test_f1: 0.5661
 epoch: 67, train_loss: 0.3247, test_loss: 2.0245, test_f1: 0.6066
 epoch: 68, train_loss: 0.2975, test_loss: 2.0735, test_f1: 0.5889
 epoch: 69, train_loss: 0.3001, test_loss: 2.3028, test_f1: 0.5760
 epoch: 70, train_loss: 0.3232, test_loss: 2.4391, test_f1: 0.5366
 epoch: 71, train_loss: 0.3311, test_loss: 2.3280, test_f1: 0.5293
 epoch: 72, train_loss: 0.2870, test_loss: 2.3489, test_f1: 0.5818
 epoch: 73, train_loss: 0.2682, test_loss: 2.4159, test_f1: 0.6163
 epoch: 74, train_loss: 0.3096, test_loss: 2.4280, test_f1: 0.5449
 epoch: 75, train_loss: 0.2805, test_loss: 2.6802, test_f1: 0.5342
 epoch: 76, train_loss: 0.2851, test_loss: 2.5299, test_f1: 0.5697
 epoch: 77, train_loss: 0.2764, test_loss: 2.6400, test_f1: 0.5507
 epoch: 78, train_loss: 0.2525, test_loss: 2.8447, test_f1: 0.5894
 epoch: 79, train_loss: 0.2660, test_loss: 2.6459, test_f1: 0.5684
 epoch: 80, train_loss: 0.2826, test_loss: 2.5009, test_f1: 0.5558
 epoch: 81, train_loss: 0.2553, test_loss: 1.9750, test_f1: 0.6083
 epoch: 82, train_loss: 0.2746, test_loss: 2.3601, test_f1: 0.6394
 epoch: 83, train_loss: 0.2511, test_loss: 2.2938, test_f1: 0.5380
 epoch: 84, train_loss: 0.2850, test_loss: 2.4297, test_f1: 0.5584
 epoch: 85, train_loss: 0.2348, test_loss: 2.3091, test_f1: 0.5686
 epoch: 86, train_loss: 0.2664, test_loss: 2.2357, test_f1: 0.6087
 epoch: 87, train_loss: 0.2562, test_loss: 2.2334, test_f1: 0.5874
 epoch: 88, train_loss: 0.2790, test_loss: 2.2543, test_f1: 0.5799
 epoch: 89, train_loss: 0.2516, test_loss: 2.5083, test_f1: 0.5664
 epoch: 90, train_loss: 0.2388, test_loss: 2.7308, test_f1: 0.5483
 epoch: 91, train_loss: 0.2326, test_loss: 2.5009, test_f1: 0.5979
 epoch: 92, train_loss: 0.2074, test_loss: 2.9058, test_f1: 0.5998
 epoch: 93, train_loss: 0.2318, test_loss: 2.8722, test_f1: 0.6284
 epoch: 94, train_loss: 0.2498, test_loss: 2.7110, test_f1: 0.5379
 epoch: 95, train_loss: 0.2277, test_loss: 2.6800, test_f1: 0.5784
 epoch: 96, train_loss: 0.2302, test_loss: 2.7434, test_f1: 0.5960
 epoch: 97, train_loss: 0.2322, test_loss: 3.0990, test_f1: 0.5591
 epoch: 98, train_loss: 0.2312, test_loss: 2.4506, test_f1: 0.5647
 epoch: 99, train_loss: 0.2305, test_loss: 2.5390, test_f1: 0.5844
##################ITERATION #3 ****************************************
 epoch: 0, train_loss: 1.2442, test_loss: 1.3209, test_f1: 0.4814
 epoch: 1, train_loss: 1.0784, test_loss: 1.1515, test_f1: 0.5469
 epoch: 2, train_loss: 1.0065, test_loss: 1.2259, test_f1: 0.5039
 epoch: 3, train_loss: 0.9519, test_loss: 1.1427, test_f1: 0.5109
 epoch: 4, train_loss: 0.9004, test_loss: 1.2278, test_f1: 0.4900
 epoch: 5, train_loss: 0.8908, test_loss: 1.3350, test_f1: 0.4744
 epoch: 6, train_loss: 0.8804, test_loss: 1.0956, test_f1: 0.5543
 epoch: 7, train_loss: 0.8516, test_loss: 1.1008, test_f1: 0.5439
 epoch: 8, train_loss: 0.8289, test_loss: 1.1481, test_f1: 0.5511
 epoch: 9, train_loss: 0.8190, test_loss: 1.1568, test_f1: 0.5772
 epoch: 10, train_loss: 0.7953, test_loss: 1.1146, test_f1: 0.5443
 epoch: 11, train_loss: 0.7656, test_loss: 1.0730, test_f1: 0.5850
 epoch: 12, train_loss: 0.7816, test_loss: 1.1452, test_f1: 0.5864
 epoch: 13, train_loss: 0.7277, test_loss: 1.1872, test_f1: 0.5801
 epoch: 14, train_loss: 0.7182, test_loss: 1.3000, test_f1: 0.4925
 epoch: 15, train_loss: 0.7276, test_loss: 1.3012, test_f1: 0.5614
 epoch: 16, train_loss: 0.6782, test_loss: 1.1738, test_f1: 0.6102
 epoch: 17, train_loss: 0.6724, test_loss: 1.3241, test_f1: 0.5280
 epoch: 18, train_loss: 0.6839, test_loss: 1.3429, test_f1: 0.5527
 epoch: 19, train_loss: 0.6680, test_loss: 1.3419, test_f1: 0.5347
 epoch: 20, train_loss: 0.6619, test_loss: 1.3390, test_f1: 0.6241
 epoch: 21, train_loss: 0.6134, test_loss: 1.3824, test_f1: 0.5863
 epoch: 22, train_loss: 0.6443, test_loss: 1.3547, test_f1: 0.6109
 epoch: 23, train_loss: 0.6463, test_loss: 1.3812, test_f1: 0.6023
 epoch: 24, train_loss: 0.6337, test_loss: 1.4807, test_f1: 0.5989
 epoch: 25, train_loss: 0.6589, test_loss: 1.3545, test_f1: 0.5659
 epoch: 26, train_loss: 0.6138, test_loss: 1.2868, test_f1: 0.5860
 epoch: 27, train_loss: 0.5907, test_loss: 1.3738, test_f1: 0.5556
 epoch: 28, train_loss: 0.5960, test_loss: 1.1959, test_f1: 0.6185
 epoch: 29, train_loss: 0.6123, test_loss: 1.2469, test_f1: 0.6419
 epoch: 30, train_loss: 0.5733, test_loss: 1.3082, test_f1: 0.6234
 epoch: 31, train_loss: 0.5752, test_loss: 1.4699, test_f1: 0.6414
 epoch: 32, train_loss: 0.5805, test_loss: 3.7405, test_f1: 0.6171
 epoch: 33, train_loss: 0.5871, test_loss: 1.3361, test_f1: 0.6046
 epoch: 34, train_loss: 0.5464, test_loss: 1.3414, test_f1: 0.5986
 epoch: 35, train_loss: 0.5287, test_loss: 1.4298, test_f1: 0.6195
 epoch: 36, train_loss: 0.5358, test_loss: 1.4602, test_f1: 0.6207
 epoch: 37, train_loss: 0.5324, test_loss: 1.5392, test_f1: 0.5959
 epoch: 38, train_loss: 0.5154, test_loss: 1.5877, test_f1: 0.6119
 epoch: 39, train_loss: 0.5218, test_loss: 1.4810, test_f1: 0.6240
 epoch: 40, train_loss: 0.5044, test_loss: 1.6435, test_f1: 0.5533
 epoch: 41, train_loss: 0.4773, test_loss: 2.0216, test_f1: 0.5946
 epoch: 42, train_loss: 0.4938, test_loss: 1.5805, test_f1: 0.5518
 epoch: 43, train_loss: 0.4877, test_loss: 1.5043, test_f1: 0.6436
 epoch: 44, train_loss: 0.4563, test_loss: 1.6665, test_f1: 0.6200
 epoch: 45, train_loss: 0.4615, test_loss: 1.9714, test_f1: 0.5860
 epoch: 46, train_loss: 0.4499, test_loss: 1.8393, test_f1: 0.5709
 epoch: 47, train_loss: 0.4924, test_loss: 2.2846, test_f1: 0.6053
 epoch: 48, train_loss: 0.5005, test_loss: 1.6862, test_f1: 0.5997
 epoch: 49, train_loss: 0.4523, test_loss: 1.7557, test_f1: 0.5748
 epoch: 50, train_loss: 0.5035, test_loss: 1.6501, test_f1: 0.5893
 epoch: 51, train_loss: 0.4286, test_loss: 1.5910, test_f1: 0.6015
 epoch: 52, train_loss: 0.3851, test_loss: 1.7631, test_f1: 0.6042
 epoch: 53, train_loss: 0.3647, test_loss: 1.6823, test_f1: 0.5989
 epoch: 54, train_loss: 0.3730, test_loss: 2.1517, test_f1: 0.5997
 epoch: 55, train_loss: 0.3424, test_loss: 2.0550, test_f1: 0.5670
 epoch: 56, train_loss: 0.3327, test_loss: 2.1972, test_f1: 0.5870
 epoch: 57, train_loss: 0.3341, test_loss: 2.2598, test_f1: 0.6177
 epoch: 58, train_loss: 0.3132, test_loss: 2.4223, test_f1: 0.5809
 epoch: 59, train_loss: 0.2968, test_loss: 2.4518, test_f1: 0.5725
 epoch: 60, train_loss: 0.2980, test_loss: 2.2268, test_f1: 0.6180
 epoch: 61, train_loss: 0.3497, test_loss: 2.2273, test_f1: 0.6004
 epoch: 62, train_loss: 0.3009, test_loss: 2.5658, test_f1: 0.5882
 epoch: 63, train_loss: 0.2938, test_loss: 2.8639, test_f1: 0.6008
 epoch: 64, train_loss: 0.2796, test_loss: 2.5522, test_f1: 0.5905
 epoch: 65, train_loss: 0.2922, test_loss: 2.5702, test_f1: 0.5932
 epoch: 66, train_loss: 0.2867, test_loss: 2.4889, test_f1: 0.5811
 epoch: 67, train_loss: 0.2859, test_loss: 2.7778, test_f1: 0.5864
 epoch: 68, train_loss: 0.2843, test_loss: 2.6476, test_f1: 0.5686
 epoch: 69, train_loss: 0.2801, test_loss: 2.9653, test_f1: 0.5911
 epoch: 70, train_loss: 0.2959, test_loss: 2.3817, test_f1: 0.6235
 epoch: 71, train_loss: 0.2784, test_loss: 2.5642, test_f1: 0.6147
 epoch: 72, train_loss: 0.2663, test_loss: 2.6106, test_f1: 0.5823
 epoch: 73, train_loss: 0.2666, test_loss: 2.5315, test_f1: 0.6321
 epoch: 74, train_loss: 0.2933, test_loss: 2.4919, test_f1: 0.6017
 epoch: 75, train_loss: 0.2659, test_loss: 2.9376, test_f1: 0.6462
 epoch: 76, train_loss: 0.2814, test_loss: 2.4822, test_f1: 0.5922
 epoch: 77, train_loss: 0.2476, test_loss: 3.1975, test_f1: 0.5698
 epoch: 78, train_loss: 0.2467, test_loss: 2.7497, test_f1: 0.5631
 epoch: 79, train_loss: 0.2709, test_loss: 2.7529, test_f1: 0.5886
 epoch: 80, train_loss: 0.2460, test_loss: 2.9643, test_f1: 0.6112
 epoch: 81, train_loss: 0.2132, test_loss: 2.9424, test_f1: 0.6207
 epoch: 82, train_loss: 0.2159, test_loss: 2.8302, test_f1: 0.6087
 epoch: 83, train_loss: 0.2568, test_loss: 2.6935, test_f1: 0.6109
 epoch: 84, train_loss: 0.2342, test_loss: 2.7709, test_f1: 0.5873
 epoch: 85, train_loss: 0.2248, test_loss: 2.8878, test_f1: 0.6390
 epoch: 86, train_loss: 0.2534, test_loss: 3.8203, test_f1: 0.5890
 epoch: 87, train_loss: 0.2988, test_loss: 3.1477, test_f1: 0.6126
 epoch: 88, train_loss: 0.2558, test_loss: 3.4518, test_f1: 0.6060
 epoch: 89, train_loss: 0.2235, test_loss: 3.2197, test_f1: 0.5920
 epoch: 90, train_loss: 0.2241, test_loss: 3.2533, test_f1: 0.6053
 epoch: 91, train_loss: 0.2417, test_loss: 3.1567, test_f1: 0.6160
 epoch: 92, train_loss: 0.2137, test_loss: 3.5228, test_f1: 0.6344
 epoch: 93, train_loss: 0.2241, test_loss: 3.5266, test_f1: 0.5931
 epoch: 94, train_loss: 0.2069, test_loss: 3.2976, test_f1: 0.6163
 epoch: 95, train_loss: 0.2209, test_loss: 3.0455, test_f1: 0.6002
 epoch: 96, train_loss: 0.1928, test_loss: 3.2054, test_f1: 0.6269
 epoch: 97, train_loss: 0.2246, test_loss: 3.1497, test_f1: 0.6354
 epoch: 98, train_loss: 0.2327, test_loss: 3.1760, test_f1: 0.5747
 epoch: 99, train_loss: 0.2450, test_loss: 2.9883, test_f1: 0.5962
##################ITERATION #4 ****************************************
 epoch: 0, train_loss: 1.2679, test_loss: 1.2907, test_f1: 0.3445
 epoch: 1, train_loss: 1.0955, test_loss: 1.2337, test_f1: 0.5159
 epoch: 2, train_loss: 1.0561, test_loss: 1.2144, test_f1: 0.4589
 epoch: 3, train_loss: 0.9962, test_loss: 1.2082, test_f1: 0.5402
 epoch: 4, train_loss: 0.9483, test_loss: 1.1373, test_f1: 0.5021
 epoch: 5, train_loss: 0.9380, test_loss: 1.0559, test_f1: 0.5412
 epoch: 6, train_loss: 0.9011, test_loss: 1.1635, test_f1: 0.5117
 epoch: 7, train_loss: 0.8806, test_loss: 1.0659, test_f1: 0.5911
 epoch: 8, train_loss: 0.8312, test_loss: 1.0341, test_f1: 0.5820
 epoch: 9, train_loss: 0.8329, test_loss: 1.1435, test_f1: 0.5671
 epoch: 10, train_loss: 0.8331, test_loss: 1.2386, test_f1: 0.4567
 epoch: 11, train_loss: 0.8527, test_loss: 1.1397, test_f1: 0.5867
 epoch: 12, train_loss: 0.7932, test_loss: 1.2396, test_f1: 0.5729
 epoch: 13, train_loss: 0.7769, test_loss: 1.1754, test_f1: 0.5555
 epoch: 14, train_loss: 0.7832, test_loss: 1.1635, test_f1: 0.6196
 epoch: 15, train_loss: 0.7322, test_loss: 1.2840, test_f1: 0.5853
 epoch: 16, train_loss: 0.7215, test_loss: 1.9181, test_f1: 0.5811
 epoch: 17, train_loss: 0.7493, test_loss: 1.3175, test_f1: 0.5737
 epoch: 18, train_loss: 0.7149, test_loss: 1.2757, test_f1: 0.5997
 epoch: 19, train_loss: 0.7009, test_loss: 1.3463, test_f1: 0.6130
 epoch: 20, train_loss: 0.6792, test_loss: 1.2215, test_f1: 0.6340
 epoch: 21, train_loss: 0.6607, test_loss: 1.2365, test_f1: 0.6208
 epoch: 22, train_loss: 0.6568, test_loss: 1.4292, test_f1: 0.5653
 epoch: 23, train_loss: 0.6650, test_loss: 1.4538, test_f1: 0.5352
 epoch: 24, train_loss: 0.6891, test_loss: 1.1834, test_f1: 0.5827
 epoch: 25, train_loss: 0.6339, test_loss: 1.4121, test_f1: 0.5596
 epoch: 26, train_loss: 0.6257, test_loss: 1.4742, test_f1: 0.5949
 epoch: 27, train_loss: 0.6122, test_loss: 1.5862, test_f1: 0.5923
 epoch: 28, train_loss: 0.5807, test_loss: 1.2642, test_f1: 0.6055
 epoch: 29, train_loss: 0.6373, test_loss: 1.3785, test_f1: 0.6317
 epoch: 30, train_loss: 0.6340, test_loss: 1.4547, test_f1: 0.5991
 epoch: 31, train_loss: 0.5879, test_loss: 1.5674, test_f1: 0.6063
 epoch: 32, train_loss: 0.5697, test_loss: 1.4476, test_f1: 0.6152
 epoch: 33, train_loss: 0.5372, test_loss: 1.5934, test_f1: 0.6209
 epoch: 34, train_loss: 0.5368, test_loss: 3.2705, test_f1: 0.6126
 epoch: 35, train_loss: 0.5741, test_loss: 1.5587, test_f1: 0.5080
 epoch: 36, train_loss: 0.5631, test_loss: 1.4577, test_f1: 0.6329
 epoch: 37, train_loss: 0.5210, test_loss: 1.6320, test_f1: 0.5861
 epoch: 38, train_loss: 0.5315, test_loss: 2.0852, test_f1: 0.5649
 epoch: 39, train_loss: 0.5232, test_loss: 2.3476, test_f1: 0.5279
 epoch: 40, train_loss: 0.5158, test_loss: 2.1610, test_f1: 0.5814
 epoch: 41, train_loss: 0.4943, test_loss: 3.4989, test_f1: 0.5840
 epoch: 42, train_loss: 0.4910, test_loss: 2.6219, test_f1: 0.6266
 epoch: 43, train_loss: 0.4825, test_loss: 3.5404, test_f1: 0.5674
 epoch: 44, train_loss: 0.5085, test_loss: 3.1715, test_f1: 0.5716
 epoch: 45, train_loss: 0.4898, test_loss: 2.6897, test_f1: 0.4920
 epoch: 46, train_loss: 0.4833, test_loss: 3.1678, test_f1: 0.5563
 epoch: 47, train_loss: 0.4848, test_loss: 1.8259, test_f1: 0.5919
 epoch: 48, train_loss: 0.4521, test_loss: 2.1167, test_f1: 0.5388
 epoch: 49, train_loss: 0.4644, test_loss: 2.7976, test_f1: 0.5540
 epoch: 50, train_loss: 0.4709, test_loss: 4.8092, test_f1: 0.6183
 epoch: 51, train_loss: 0.4174, test_loss: 4.5970, test_f1: 0.6115
 epoch: 52, train_loss: 0.3819, test_loss: 5.7318, test_f1: 0.5825
 epoch: 53, train_loss: 0.3912, test_loss: 4.2011, test_f1: 0.5966
 epoch: 54, train_loss: 0.4004, test_loss: 2.2562, test_f1: 0.5903
 epoch: 55, train_loss: 0.3689, test_loss: 2.3620, test_f1: 0.5717
 epoch: 56, train_loss: 0.3473, test_loss: 2.5006, test_f1: 0.5578
 epoch: 57, train_loss: 0.3533, test_loss: 2.6809, test_f1: 0.5773
 epoch: 58, train_loss: 0.3683, test_loss: 2.9415, test_f1: 0.5495
 epoch: 59, train_loss: 0.3646, test_loss: 2.7607, test_f1: 0.6130
 epoch: 60, train_loss: 0.3613, test_loss: 2.8057, test_f1: 0.6207
 epoch: 61, train_loss: 0.3217, test_loss: 2.6287, test_f1: 0.5982
 epoch: 62, train_loss: 0.3305, test_loss: 3.5203, test_f1: 0.5502
 epoch: 63, train_loss: 0.3338, test_loss: 3.0320, test_f1: 0.5675
 epoch: 64, train_loss: 0.3568, test_loss: 5.0756, test_f1: 0.5715
 epoch: 65, train_loss: 0.3479, test_loss: 3.7782, test_f1: 0.5989
 epoch: 66, train_loss: 0.3217, test_loss: 2.8145, test_f1: 0.6034
 epoch: 67, train_loss: 0.3355, test_loss: 3.4207, test_f1: 0.6322
 epoch: 68, train_loss: 0.3400, test_loss: 3.3150, test_f1: 0.6028
 epoch: 69, train_loss: 0.3394, test_loss: 3.1845, test_f1: 0.5740
 epoch: 70, train_loss: 0.3273, test_loss: 3.7247, test_f1: 0.6056
 epoch: 71, train_loss: 0.2975, test_loss: 4.7494, test_f1: 0.5955
 epoch: 72, train_loss: 0.3089, test_loss: 4.1164, test_f1: 0.6127
 epoch: 73, train_loss: 0.3062, test_loss: 3.2069, test_f1: 0.6145
 epoch: 74, train_loss: 0.2913, test_loss: 3.1529, test_f1: 0.5847
 epoch: 75, train_loss: 0.3098, test_loss: 3.5557, test_f1: 0.5962
 epoch: 76, train_loss: 0.3025, test_loss: 3.6870, test_f1: 0.5607
 epoch: 77, train_loss: 0.2927, test_loss: 3.3007, test_f1: 0.5378
 epoch: 78, train_loss: 0.3136, test_loss: 4.8006, test_f1: 0.6059
 epoch: 79, train_loss: 0.2890, test_loss: 2.9586, test_f1: 0.6057
 epoch: 80, train_loss: 0.2685, test_loss: 3.3032, test_f1: 0.5946
 epoch: 81, train_loss: 0.2831, test_loss: 3.2147, test_f1: 0.5966
 epoch: 82, train_loss: 0.2879, test_loss: 3.2796, test_f1: 0.5853
 epoch: 83, train_loss: 0.2729, test_loss: 4.4040, test_f1: 0.5525
 epoch: 84, train_loss: 0.2630, test_loss: 3.7392, test_f1: 0.5302
 epoch: 85, train_loss: 0.2652, test_loss: 3.5592, test_f1: 0.5975
 epoch: 86, train_loss: 0.2548, test_loss: 4.2609, test_f1: 0.5699
 epoch: 87, train_loss: 0.2478, test_loss: 4.1239, test_f1: 0.5858
 epoch: 88, train_loss: 0.2389, test_loss: 4.6676, test_f1: 0.5693
 epoch: 89, train_loss: 0.2481, test_loss: 4.3668, test_f1: 0.5879
 epoch: 90, train_loss: 0.2739, test_loss: 8.3077, test_f1: 0.5862
 epoch: 91, train_loss: 0.2808, test_loss: 4.7521, test_f1: 0.6136
 epoch: 92, train_loss: 0.2428, test_loss: 3.7553, test_f1: 0.5775
 epoch: 93, train_loss: 0.2653, test_loss: 5.1328, test_f1: 0.5831
 epoch: 94, train_loss: 0.2539, test_loss: 5.3058, test_f1: 0.5232
 epoch: 95, train_loss: 0.2439, test_loss: 3.7291, test_f1: 0.5781
 epoch: 96, train_loss: 0.2371, test_loss: 5.2577, test_f1: 0.5927
 epoch: 97, train_loss: 0.2657, test_loss: 4.0694, test_f1: 0.5808
 epoch: 98, train_loss: 0.2357, test_loss: 3.8554, test_f1: 0.5708
 epoch: 99, train_loss: 0.2433, test_loss: 4.1562, test_f1: 0.5816
##################ITERATION #5 ****************************************
 epoch: 0, train_loss: 1.2179, test_loss: 1.2021, test_f1: 0.5229
 epoch: 1, train_loss: 1.0491, test_loss: 1.1991, test_f1: 0.5075
 epoch: 2, train_loss: 0.9812, test_loss: 1.1549, test_f1: 0.5952
 epoch: 3, train_loss: 0.9333, test_loss: 1.0987, test_f1: 0.5371
 epoch: 4, train_loss: 0.9170, test_loss: 1.0708, test_f1: 0.5588
 epoch: 5, train_loss: 0.8912, test_loss: 1.0644, test_f1: 0.5653
 epoch: 6, train_loss: 0.8667, test_loss: 1.0965, test_f1: 0.5398
 epoch: 7, train_loss: 0.8577, test_loss: 1.0768, test_f1: 0.5599
 epoch: 8, train_loss: 0.8104, test_loss: 1.1564, test_f1: 0.6146
 epoch: 9, train_loss: 0.7891, test_loss: 1.1318, test_f1: 0.5580
 epoch: 10, train_loss: 0.8086, test_loss: 1.4347, test_f1: 0.4614
 epoch: 11, train_loss: 0.7934, test_loss: 1.2489, test_f1: 0.5449
 epoch: 12, train_loss: 0.7426, test_loss: 1.0979, test_f1: 0.5641
 epoch: 13, train_loss: 0.7496, test_loss: 1.1645, test_f1: 0.5784
 epoch: 14, train_loss: 0.7176, test_loss: 1.3062, test_f1: 0.5645
 epoch: 15, train_loss: 0.7065, test_loss: 1.1258, test_f1: 0.6070
 epoch: 16, train_loss: 0.7185, test_loss: 1.4510, test_f1: 0.4843
 epoch: 17, train_loss: 0.6969, test_loss: 1.3015, test_f1: 0.5749
 epoch: 18, train_loss: 0.6847, test_loss: 1.2180, test_f1: 0.5869
 epoch: 19, train_loss: 0.6741, test_loss: 1.3974, test_f1: 0.5464
 epoch: 20, train_loss: 0.6712, test_loss: 1.3658, test_f1: 0.5549
 epoch: 21, train_loss: 0.6095, test_loss: 1.3391, test_f1: 0.5646
 epoch: 22, train_loss: 0.6186, test_loss: 1.1682, test_f1: 0.5787
 epoch: 23, train_loss: 0.6240, test_loss: 1.3408, test_f1: 0.5754
 epoch: 24, train_loss: 0.6197, test_loss: 1.5428, test_f1: 0.6000
 epoch: 25, train_loss: 0.6100, test_loss: 1.4780, test_f1: 0.5582
 epoch: 26, train_loss: 0.6015, test_loss: 1.4608, test_f1: 0.5903
 epoch: 27, train_loss: 0.5887, test_loss: 1.2741, test_f1: 0.5908
 epoch: 28, train_loss: 0.5541, test_loss: 1.3535, test_f1: 0.6005
 epoch: 29, train_loss: 0.5737, test_loss: 1.2652, test_f1: 0.5850
 epoch: 30, train_loss: 0.5670, test_loss: 1.3436, test_f1: 0.5998
 epoch: 31, train_loss: 0.5423, test_loss: 1.5026, test_f1: 0.6005
 epoch: 32, train_loss: 0.5250, test_loss: 1.5959, test_f1: 0.5969
 epoch: 33, train_loss: 0.5135, test_loss: 1.5801, test_f1: 0.5563
 epoch: 34, train_loss: 0.5406, test_loss: 1.6009, test_f1: 0.5735
 epoch: 35, train_loss: 0.4993, test_loss: 1.6301, test_f1: 0.5747
 epoch: 36, train_loss: 0.5125, test_loss: 1.4556, test_f1: 0.6115
 epoch: 37, train_loss: 0.5131, test_loss: 1.5453, test_f1: 0.5939
 epoch: 38, train_loss: 0.4737, test_loss: 1.6420, test_f1: 0.6156
 epoch: 39, train_loss: 0.4773, test_loss: 1.9786, test_f1: 0.5458
 epoch: 40, train_loss: 0.5283, test_loss: 1.7486, test_f1: 0.6120
 epoch: 41, train_loss: 0.4623, test_loss: 2.0220, test_f1: 0.5271
 epoch: 42, train_loss: 0.4608, test_loss: 1.8216, test_f1: 0.5777
 epoch: 43, train_loss: 0.4426, test_loss: 1.8949, test_f1: 0.5528
 epoch: 44, train_loss: 0.4085, test_loss: 1.9178, test_f1: 0.5852
 epoch: 45, train_loss: 0.4810, test_loss: 2.0994, test_f1: 0.5786
 epoch: 46, train_loss: 0.4683, test_loss: 1.8745, test_f1: 0.6081
 epoch: 47, train_loss: 0.4153, test_loss: 1.8541, test_f1: 0.5798
 epoch: 48, train_loss: 0.4321, test_loss: 1.8202, test_f1: 0.6254
 epoch: 49, train_loss: 0.4057, test_loss: 2.0979, test_f1: 0.5959
 epoch: 50, train_loss: 0.4147, test_loss: 1.9985, test_f1: 0.5779
 epoch: 51, train_loss: 0.3851, test_loss: 2.0161, test_f1: 0.6008
 epoch: 52, train_loss: 0.3528, test_loss: 2.0966, test_f1: 0.6231
 epoch: 53, train_loss: 0.3216, test_loss: 2.1638, test_f1: 0.6024
 epoch: 54, train_loss: 0.3549, test_loss: 1.9455, test_f1: 0.6434
 epoch: 55, train_loss: 0.3299, test_loss: 2.1199, test_f1: 0.6300
 epoch: 56, train_loss: 0.3075, test_loss: 2.1411, test_f1: 0.6003
 epoch: 57, train_loss: 0.3234, test_loss: 2.4582, test_f1: 0.5946
 epoch: 58, train_loss: 0.2973, test_loss: 2.4852, test_f1: 0.5871
 epoch: 59, train_loss: 0.2956, test_loss: 2.2350, test_f1: 0.6302
 epoch: 60, train_loss: 0.3106, test_loss: 2.2290, test_f1: 0.6169
 epoch: 61, train_loss: 0.3207, test_loss: 2.3739, test_f1: 0.6213
 epoch: 62, train_loss: 0.3045, test_loss: 2.2224, test_f1: 0.6195
 epoch: 63, train_loss: 0.3087, test_loss: 2.4427, test_f1: 0.5955
 epoch: 64, train_loss: 0.2815, test_loss: 2.5423, test_f1: 0.6156
 epoch: 65, train_loss: 0.2625, test_loss: 2.5469, test_f1: 0.6305
 epoch: 66, train_loss: 0.2733, test_loss: 2.6715, test_f1: 0.6108
 epoch: 67, train_loss: 0.2903, test_loss: 2.5005, test_f1: 0.6106
 epoch: 68, train_loss: 0.2955, test_loss: 2.3295, test_f1: 0.6302
 epoch: 69, train_loss: 0.2696, test_loss: 2.5499, test_f1: 0.5917
 epoch: 70, train_loss: 0.2651, test_loss: 2.6754, test_f1: 0.6040
 epoch: 71, train_loss: 0.2547, test_loss: 3.0542, test_f1: 0.6149
 epoch: 72, train_loss: 0.2429, test_loss: 2.8160, test_f1: 0.5960
 epoch: 73, train_loss: 0.2423, test_loss: 2.5263, test_f1: 0.6031
 epoch: 74, train_loss: 0.2550, test_loss: 2.8543, test_f1: 0.6137
 epoch: 75, train_loss: 0.2568, test_loss: 3.0104, test_f1: 0.6065
 epoch: 76, train_loss: 0.2476, test_loss: 2.8505, test_f1: 0.6047
 epoch: 77, train_loss: 0.2463, test_loss: 3.1029, test_f1: 0.6054
 epoch: 78, train_loss: 0.2664, test_loss: 3.3111, test_f1: 0.5886
 epoch: 79, train_loss: 0.2631, test_loss: 2.9306, test_f1: 0.5933
 epoch: 80, train_loss: 0.2450, test_loss: 2.5618, test_f1: 0.6058
 epoch: 81, train_loss: 0.2497, test_loss: 2.7183, test_f1: 0.5946
 epoch: 82, train_loss: 0.2217, test_loss: 3.3157, test_f1: 0.6026
 epoch: 83, train_loss: 0.2369, test_loss: 2.8003, test_f1: 0.6272
 epoch: 84, train_loss: 0.2151, test_loss: 2.4663, test_f1: 0.6178
 epoch: 85, train_loss: 0.2337, test_loss: 2.4287, test_f1: 0.6610
 epoch: 86, train_loss: 0.2289, test_loss: 3.0164, test_f1: 0.6022
 epoch: 87, train_loss: 0.2235, test_loss: 2.6546, test_f1: 0.6239
 epoch: 88, train_loss: 0.2372, test_loss: 2.9886, test_f1: 0.6350
 epoch: 89, train_loss: 0.2447, test_loss: 2.7133, test_f1: 0.6357
 epoch: 90, train_loss: 0.2392, test_loss: 2.8959, test_f1: 0.6361
 epoch: 91, train_loss: 0.2078, test_loss: 2.7082, test_f1: 0.6318
 epoch: 92, train_loss: 0.1864, test_loss: 2.8565, test_f1: 0.6474
 epoch: 93, train_loss: 0.2297, test_loss: 2.5520, test_f1: 0.6336
 epoch: 94, train_loss: 0.1981, test_loss: 2.6664, test_f1: 0.6205
 epoch: 95, train_loss: 0.2129, test_loss: 2.5694, test_f1: 0.6479
 epoch: 96, train_loss: 0.1971, test_loss: 3.0982, test_f1: 0.6141
 epoch: 97, train_loss: 0.2016, test_loss: 2.8906, test_f1: 0.6536
 epoch: 98, train_loss: 0.2331, test_loss: 2.9702, test_f1: 0.6106
 epoch: 99, train_loss: 0.2021, test_loss: 2.7475, test_f1: 0.6351
##################ITERATION #6 ****************************************
 epoch: 0, train_loss: 1.3376, test_loss: 1.3542, test_f1: 0.2970
 epoch: 1, train_loss: 1.1220, test_loss: 1.2495, test_f1: 0.4482
 epoch: 2, train_loss: 1.0221, test_loss: 1.2062, test_f1: 0.5340
 epoch: 3, train_loss: 0.9636, test_loss: 1.1377, test_f1: 0.5805
 epoch: 4, train_loss: 0.9346, test_loss: 1.1068, test_f1: 0.5498
 epoch: 5, train_loss: 0.9161, test_loss: 1.1926, test_f1: 0.5402
 epoch: 6, train_loss: 0.8968, test_loss: 1.0879, test_f1: 0.5663
 epoch: 7, train_loss: 0.9150, test_loss: 1.1531, test_f1: 0.5427
 epoch: 8, train_loss: 0.8854, test_loss: 1.0924, test_f1: 0.6130
 epoch: 9, train_loss: 0.8473, test_loss: 1.1217, test_f1: 0.5758
 epoch: 10, train_loss: 0.8101, test_loss: 1.1176, test_f1: 0.5518
 epoch: 11, train_loss: 0.8076, test_loss: 1.2064, test_f1: 0.5457
 epoch: 12, train_loss: 0.7964, test_loss: 1.1306, test_f1: 0.6091
 epoch: 13, train_loss: 0.7757, test_loss: 1.0773, test_f1: 0.5760
 epoch: 14, train_loss: 0.7608, test_loss: 1.2177, test_f1: 0.5467
 epoch: 15, train_loss: 0.7671, test_loss: 1.1533, test_f1: 0.5770
 epoch: 16, train_loss: 0.7427, test_loss: 1.1220, test_f1: 0.5676
 epoch: 17, train_loss: 0.7403, test_loss: 1.3388, test_f1: 0.5977
 epoch: 18, train_loss: 0.7201, test_loss: 1.1429, test_f1: 0.5723
 epoch: 19, train_loss: 0.7199, test_loss: 1.2192, test_f1: 0.5765
 epoch: 20, train_loss: 0.7046, test_loss: 1.3602, test_f1: 0.5951
 epoch: 21, train_loss: 0.6814, test_loss: 1.3306, test_f1: 0.6015
 epoch: 22, train_loss: 0.7115, test_loss: 1.5511, test_f1: 0.5607
 epoch: 23, train_loss: 0.6659, test_loss: 1.4019, test_f1: 0.6140
 epoch: 24, train_loss: 0.6708, test_loss: 1.3573, test_f1: 0.5750
 epoch: 25, train_loss: 0.6618, test_loss: 1.3845, test_f1: 0.5824
 epoch: 26, train_loss: 0.6311, test_loss: 1.4730, test_f1: 0.5985
 epoch: 27, train_loss: 0.6079, test_loss: 1.7127, test_f1: 0.5220
 epoch: 28, train_loss: 0.6520, test_loss: 1.6483, test_f1: 0.5547
 epoch: 29, train_loss: 0.6174, test_loss: 1.5175, test_f1: 0.5414
 epoch: 30, train_loss: 0.6033, test_loss: 1.3882, test_f1: 0.5901
 epoch: 31, train_loss: 0.6085, test_loss: 1.5505, test_f1: 0.5867
 epoch: 32, train_loss: 0.5932, test_loss: 2.0709, test_f1: 0.5820
 epoch: 33, train_loss: 0.6151, test_loss: 1.6238, test_f1: 0.5510
 epoch: 34, train_loss: 0.5940, test_loss: 1.5448, test_f1: 0.5827
 epoch: 35, train_loss: 0.5774, test_loss: 1.7012, test_f1: 0.5821
 epoch: 36, train_loss: 0.5539, test_loss: 2.0849, test_f1: 0.5257
 epoch: 37, train_loss: 0.5468, test_loss: 1.9905, test_f1: 0.6057
 epoch: 38, train_loss: 0.5514, test_loss: 1.5531, test_f1: 0.5796
 epoch: 39, train_loss: 0.5349, test_loss: 1.6814, test_f1: 0.5347
 epoch: 40, train_loss: 0.5427, test_loss: 2.2523, test_f1: 0.5333
 epoch: 41, train_loss: 0.5477, test_loss: 1.6068, test_f1: 0.5757
 epoch: 42, train_loss: 0.5195, test_loss: 1.7461, test_f1: 0.5373
 epoch: 43, train_loss: 0.4934, test_loss: 1.8820, test_f1: 0.5599
 epoch: 44, train_loss: 0.5118, test_loss: 1.8074, test_f1: 0.5813
 epoch: 45, train_loss: 0.4925, test_loss: 1.8095, test_f1: 0.6316
 epoch: 46, train_loss: 0.4723, test_loss: 1.9639, test_f1: 0.6170
 epoch: 47, train_loss: 0.5162, test_loss: 2.3856, test_f1: 0.5472
 epoch: 48, train_loss: 0.5107, test_loss: 2.0405, test_f1: 0.5084
 epoch: 49, train_loss: 0.5033, test_loss: 1.6966, test_f1: 0.5438
 epoch: 50, train_loss: 0.4901, test_loss: 1.8424, test_f1: 0.6007
 epoch: 51, train_loss: 0.4355, test_loss: 1.7390, test_f1: 0.5912
 epoch: 52, train_loss: 0.4064, test_loss: 2.0616, test_f1: 0.5572
 epoch: 53, train_loss: 0.4050, test_loss: 2.4149, test_f1: 0.5719
 epoch: 54, train_loss: 0.3823, test_loss: 2.7202, test_f1: 0.5490
 epoch: 55, train_loss: 0.3579, test_loss: 2.6699, test_f1: 0.5960
 epoch: 56, train_loss: 0.3514, test_loss: 2.6426, test_f1: 0.6013
 epoch: 57, train_loss: 0.3811, test_loss: 2.8072, test_f1: 0.5503
 epoch: 58, train_loss: 0.3518, test_loss: 2.4684, test_f1: 0.5685
 epoch: 59, train_loss: 0.4013, test_loss: 2.6471, test_f1: 0.5687
 epoch: 60, train_loss: 0.3873, test_loss: 2.6199, test_f1: 0.6072
 epoch: 61, train_loss: 0.3733, test_loss: 2.3355, test_f1: 0.5963
 epoch: 62, train_loss: 0.3350, test_loss: 2.6360, test_f1: 0.5979
 epoch: 63, train_loss: 0.3350, test_loss: 2.5261, test_f1: 0.5907
 epoch: 64, train_loss: 0.3453, test_loss: 3.6438, test_f1: 0.5537
 epoch: 65, train_loss: 0.3301, test_loss: 3.0437, test_f1: 0.5718
 epoch: 66, train_loss: 0.3570, test_loss: 2.3112, test_f1: 0.6084
 epoch: 67, train_loss: 0.3494, test_loss: 2.7909, test_f1: 0.5650
 epoch: 68, train_loss: 0.3035, test_loss: 2.9984, test_f1: 0.6079
 epoch: 69, train_loss: 0.2942, test_loss: 2.9595, test_f1: 0.5984
 epoch: 70, train_loss: 0.3105, test_loss: 2.8913, test_f1: 0.5760
 epoch: 71, train_loss: 0.3065, test_loss: 2.7994, test_f1: 0.5825
 epoch: 72, train_loss: 0.2943, test_loss: 3.0677, test_f1: 0.5711
 epoch: 73, train_loss: 0.3109, test_loss: 2.8845, test_f1: 0.6142
 epoch: 74, train_loss: 0.3034, test_loss: 2.9577, test_f1: 0.6057
 epoch: 75, train_loss: 0.3001, test_loss: 2.9889, test_f1: 0.5886
 epoch: 76, train_loss: 0.3141, test_loss: 2.7382, test_f1: 0.6131
 epoch: 77, train_loss: 0.2700, test_loss: 2.8710, test_f1: 0.6144
 epoch: 78, train_loss: 0.2877, test_loss: 2.8413, test_f1: 0.6116
 epoch: 79, train_loss: 0.2789, test_loss: 3.4042, test_f1: 0.5788
 epoch: 80, train_loss: 0.2973, test_loss: 2.8203, test_f1: 0.5508
 epoch: 81, train_loss: 0.2592, test_loss: 2.8757, test_f1: 0.6064
 epoch: 82, train_loss: 0.2763, test_loss: 2.8108, test_f1: 0.5808
 epoch: 83, train_loss: 0.2891, test_loss: 3.2000, test_f1: 0.5899
 epoch: 84, train_loss: 0.2604, test_loss: 3.2569, test_f1: 0.5919
 epoch: 85, train_loss: 0.2695, test_loss: 3.9758, test_f1: 0.6156
 epoch: 86, train_loss: 0.2314, test_loss: 3.8154, test_f1: 0.5889
 epoch: 87, train_loss: 0.2427, test_loss: 4.3429, test_f1: 0.6040
 epoch: 88, train_loss: 0.2496, test_loss: 3.3386, test_f1: 0.6234
 epoch: 89, train_loss: 0.2489, test_loss: 3.6783, test_f1: 0.6269
 epoch: 90, train_loss: 0.2400, test_loss: 3.3116, test_f1: 0.6105
 epoch: 91, train_loss: 0.2363, test_loss: 3.3955, test_f1: 0.6210
 epoch: 92, train_loss: 0.2425, test_loss: 3.5761, test_f1: 0.5996
 epoch: 93, train_loss: 0.2355, test_loss: 3.6730, test_f1: 0.6229
 epoch: 94, train_loss: 0.2265, test_loss: 3.9058, test_f1: 0.5119
 epoch: 95, train_loss: 0.2779, test_loss: 3.5299, test_f1: 0.6121
 epoch: 96, train_loss: 0.2385, test_loss: 3.6053, test_f1: 0.5799
 epoch: 97, train_loss: 0.2309, test_loss: 3.2460, test_f1: 0.6071
 epoch: 98, train_loss: 0.2518, test_loss: 4.1608, test_f1: 0.5801
 epoch: 99, train_loss: 0.2196, test_loss: 3.2971, test_f1: 0.6019
##################ITERATION #7 ****************************************
 epoch: 0, train_loss: 1.3490, test_loss: 1.2166, test_f1: 0.4657
 epoch: 1, train_loss: 1.0974, test_loss: 1.2014, test_f1: 0.5205
 epoch: 2, train_loss: 1.0373, test_loss: 1.1922, test_f1: 0.5307
 epoch: 3, train_loss: 0.9974, test_loss: 1.1130, test_f1: 0.6120
 epoch: 4, train_loss: 0.9339, test_loss: 1.1038, test_f1: 0.5553
 epoch: 5, train_loss: 0.9220, test_loss: 1.1213, test_f1: 0.5533
 epoch: 6, train_loss: 0.8591, test_loss: 1.2576, test_f1: 0.5597
 epoch: 7, train_loss: 0.8974, test_loss: 1.1403, test_f1: 0.5644
 epoch: 8, train_loss: 0.8508, test_loss: 1.1711, test_f1: 0.5593
 epoch: 9, train_loss: 0.8294, test_loss: 1.1977, test_f1: 0.5644
 epoch: 10, train_loss: 0.8089, test_loss: 1.1464, test_f1: 0.5844
 epoch: 11, train_loss: 0.7942, test_loss: 1.1339, test_f1: 0.5749
 epoch: 12, train_loss: 0.7577, test_loss: 1.2724, test_f1: 0.5819
 epoch: 13, train_loss: 0.7634, test_loss: 1.2042, test_f1: 0.5926
 epoch: 14, train_loss: 0.7466, test_loss: 1.1770, test_f1: 0.5651
 epoch: 15, train_loss: 0.7333, test_loss: 1.5548, test_f1: 0.5616
 epoch: 16, train_loss: 0.7352, test_loss: 1.1981, test_f1: 0.5907
 epoch: 17, train_loss: 0.7437, test_loss: 1.3706, test_f1: 0.6109
 epoch: 18, train_loss: 0.7037, test_loss: 1.2004, test_f1: 0.5859
 epoch: 19, train_loss: 0.7114, test_loss: 1.1320, test_f1: 0.5998
 epoch: 20, train_loss: 0.6608, test_loss: 1.3185, test_f1: 0.6119
 epoch: 21, train_loss: 0.6596, test_loss: 1.2077, test_f1: 0.6172
 epoch: 22, train_loss: 0.6631, test_loss: 1.2825, test_f1: 0.6188
 epoch: 23, train_loss: 0.6498, test_loss: 1.3225, test_f1: 0.5839
 epoch: 24, train_loss: 0.6377, test_loss: 1.3738, test_f1: 0.5776
 epoch: 25, train_loss: 0.6295, test_loss: 1.3106, test_f1: 0.5788
 epoch: 26, train_loss: 0.6146, test_loss: 1.4030, test_f1: 0.6206
 epoch: 27, train_loss: 0.6092, test_loss: 1.3743, test_f1: 0.6376
 epoch: 28, train_loss: 0.5617, test_loss: 1.5848, test_f1: 0.5879
 epoch: 29, train_loss: 0.6187, test_loss: 1.3859, test_f1: 0.6243
 epoch: 30, train_loss: 0.6098, test_loss: 1.6409, test_f1: 0.5864
 epoch: 31, train_loss: 0.5635, test_loss: 1.5513, test_f1: 0.5766
 epoch: 32, train_loss: 0.5280, test_loss: 1.6605, test_f1: 0.5710
 epoch: 33, train_loss: 0.5555, test_loss: 1.8919, test_f1: 0.5895
 epoch: 34, train_loss: 0.5388, test_loss: 1.7259, test_f1: 0.5805
 epoch: 35, train_loss: 0.5486, test_loss: 1.8560, test_f1: 0.5663
 epoch: 36, train_loss: 0.5410, test_loss: 1.5984, test_f1: 0.5840
 epoch: 37, train_loss: 0.5270, test_loss: 1.4086, test_f1: 0.5670
 epoch: 38, train_loss: 0.5275, test_loss: 1.4833, test_f1: 0.5773
 epoch: 39, train_loss: 0.5011, test_loss: 1.7167, test_f1: 0.5774
 epoch: 40, train_loss: 0.4967, test_loss: 1.7248, test_f1: 0.5661
 epoch: 41, train_loss: 0.5081, test_loss: 1.9181, test_f1: 0.5298
 epoch: 42, train_loss: 0.5100, test_loss: 1.7958, test_f1: 0.5833
 epoch: 43, train_loss: 0.5011, test_loss: 1.7543, test_f1: 0.5640
 epoch: 44, train_loss: 0.4410, test_loss: 1.9398, test_f1: 0.5945
 epoch: 45, train_loss: 0.4929, test_loss: 1.6581, test_f1: 0.5153
 epoch: 46, train_loss: 0.4933, test_loss: 1.6639, test_f1: 0.5646
 epoch: 47, train_loss: 0.4611, test_loss: 1.7869, test_f1: 0.6033
 epoch: 48, train_loss: 0.4457, test_loss: 1.8137, test_f1: 0.6146
 epoch: 49, train_loss: 0.4375, test_loss: 1.8974, test_f1: 0.5748
 epoch: 50, train_loss: 0.4613, test_loss: 2.0704, test_f1: 0.5729
 epoch: 51, train_loss: 0.3986, test_loss: 1.8416, test_f1: 0.5795
 epoch: 52, train_loss: 0.3578, test_loss: 2.1495, test_f1: 0.5881
 epoch: 53, train_loss: 0.3495, test_loss: 2.3245, test_f1: 0.6121
 epoch: 54, train_loss: 0.3421, test_loss: 2.3464, test_f1: 0.5781
 epoch: 55, train_loss: 0.3368, test_loss: 2.2833, test_f1: 0.5974
 epoch: 56, train_loss: 0.3424, test_loss: 2.4836, test_f1: 0.5735
 epoch: 57, train_loss: 0.3386, test_loss: 2.3330, test_f1: 0.5608
 epoch: 58, train_loss: 0.3337, test_loss: 2.1991, test_f1: 0.6379
 epoch: 59, train_loss: 0.3236, test_loss: 2.4651, test_f1: 0.6009
 epoch: 60, train_loss: 0.3276, test_loss: 2.7214, test_f1: 0.5623
 epoch: 61, train_loss: 0.3248, test_loss: 2.3501, test_f1: 0.5906
 epoch: 62, train_loss: 0.3232, test_loss: 2.4852, test_f1: 0.6002
 epoch: 63, train_loss: 0.2834, test_loss: 2.4900, test_f1: 0.5928
 epoch: 64, train_loss: 0.3006, test_loss: 2.7399, test_f1: 0.6161
 epoch: 65, train_loss: 0.3251, test_loss: 2.4572, test_f1: 0.5596
 epoch: 66, train_loss: 0.2833, test_loss: 2.5960, test_f1: 0.5654
 epoch: 67, train_loss: 0.2850, test_loss: 2.7449, test_f1: 0.5657
 epoch: 68, train_loss: 0.2893, test_loss: 2.4441, test_f1: 0.5651
 epoch: 69, train_loss: 0.2829, test_loss: 2.5057, test_f1: 0.5538
 epoch: 70, train_loss: 0.2857, test_loss: 2.6224, test_f1: 0.5694
 epoch: 71, train_loss: 0.3256, test_loss: 2.7085, test_f1: 0.5777
 epoch: 72, train_loss: 0.2740, test_loss: 2.3886, test_f1: 0.5980
 epoch: 73, train_loss: 0.2583, test_loss: 2.8015, test_f1: 0.5513
 epoch: 74, train_loss: 0.2769, test_loss: 2.3096, test_f1: 0.5630
 epoch: 75, train_loss: 0.2746, test_loss: 2.6073, test_f1: 0.5657
 epoch: 76, train_loss: 0.2857, test_loss: 2.5082, test_f1: 0.5907
 epoch: 77, train_loss: 0.2721, test_loss: 2.7152, test_f1: 0.5767
 epoch: 78, train_loss: 0.2589, test_loss: 2.7309, test_f1: 0.5610
 epoch: 79, train_loss: 0.2443, test_loss: 2.3968, test_f1: 0.6244
 epoch: 80, train_loss: 0.2378, test_loss: 2.7828, test_f1: 0.6009
 epoch: 81, train_loss: 0.2566, test_loss: 2.7186, test_f1: 0.5956
 epoch: 82, train_loss: 0.2506, test_loss: 2.7465, test_f1: 0.6055
 epoch: 83, train_loss: 0.2456, test_loss: 2.6935, test_f1: 0.6017
 epoch: 84, train_loss: 0.2189, test_loss: 2.5475, test_f1: 0.5763
 epoch: 85, train_loss: 0.2239, test_loss: 2.9772, test_f1: 0.6191
 epoch: 86, train_loss: 0.2283, test_loss: 2.9584, test_f1: 0.5789
 epoch: 87, train_loss: 0.2260, test_loss: 3.2758, test_f1: 0.5860
 epoch: 88, train_loss: 0.2615, test_loss: 2.9483, test_f1: 0.6202
 epoch: 89, train_loss: 0.2311, test_loss: 3.1523, test_f1: 0.5768
 epoch: 90, train_loss: 0.2330, test_loss: 3.6689, test_f1: 0.5720
 epoch: 91, train_loss: 0.2193, test_loss: 2.8870, test_f1: 0.5817
 epoch: 92, train_loss: 0.2192, test_loss: 3.2512, test_f1: 0.5760
 epoch: 93, train_loss: 0.2074, test_loss: 2.8862, test_f1: 0.6089
 epoch: 94, train_loss: 0.2537, test_loss: 3.0221, test_f1: 0.6181
 epoch: 95, train_loss: 0.2352, test_loss: 2.8258, test_f1: 0.6421
 epoch: 96, train_loss: 0.2133, test_loss: 3.2385, test_f1: 0.5819
 epoch: 97, train_loss: 0.1963, test_loss: 2.8197, test_f1: 0.5793
 epoch: 98, train_loss: 0.2084, test_loss: 2.5874, test_f1: 0.6263
 epoch: 99, train_loss: 0.2047, test_loss: 3.3639, test_f1: 0.5580
##################ITERATION #8 ****************************************
 epoch: 0, train_loss: 1.3242, test_loss: 1.3040, test_f1: 0.4257
 epoch: 1, train_loss: 1.0909, test_loss: 1.1605, test_f1: 0.5110
 epoch: 2, train_loss: 1.0039, test_loss: 1.2287, test_f1: 0.5278
 epoch: 3, train_loss: 0.9668, test_loss: 1.1890, test_f1: 0.5343
 epoch: 4, train_loss: 0.9491, test_loss: 1.2212, test_f1: 0.5267
 epoch: 5, train_loss: 0.8963, test_loss: 1.1563, test_f1: 0.5317
 epoch: 6, train_loss: 0.8922, test_loss: 1.1378, test_f1: 0.5341
 epoch: 7, train_loss: 0.8689, test_loss: 1.2275, test_f1: 0.5507
 epoch: 8, train_loss: 0.8308, test_loss: 1.2058, test_f1: 0.5624
 epoch: 9, train_loss: 0.8327, test_loss: 1.4120, test_f1: 0.4302
 epoch: 10, train_loss: 0.8519, test_loss: 1.1613, test_f1: 0.5512
 epoch: 11, train_loss: 0.8028, test_loss: 1.2161, test_f1: 0.5463
 epoch: 12, train_loss: 0.8152, test_loss: 1.1806, test_f1: 0.5879
 epoch: 13, train_loss: 0.7605, test_loss: 1.1669, test_f1: 0.5557
 epoch: 14, train_loss: 0.7585, test_loss: 1.3474, test_f1: 0.5552
 epoch: 15, train_loss: 0.7244, test_loss: 1.1555, test_f1: 0.5041
 epoch: 16, train_loss: 0.7287, test_loss: 1.2899, test_f1: 0.5681
 epoch: 17, train_loss: 0.7110, test_loss: 1.2882, test_f1: 0.5356
 epoch: 18, train_loss: 0.6956, test_loss: 1.2968, test_f1: 0.5084
 epoch: 19, train_loss: 0.6860, test_loss: 1.1786, test_f1: 0.5672
 epoch: 20, train_loss: 0.6740, test_loss: 1.3451, test_f1: 0.5504
 epoch: 21, train_loss: 0.6703, test_loss: 1.3715, test_f1: 0.6118
 epoch: 22, train_loss: 0.6731, test_loss: 1.3152, test_f1: 0.6004
 epoch: 23, train_loss: 0.6720, test_loss: 1.2812, test_f1: 0.5776
 epoch: 24, train_loss: 0.6619, test_loss: 1.2763, test_f1: 0.6010
 epoch: 25, train_loss: 0.6135, test_loss: 1.3245, test_f1: 0.6164
 epoch: 26, train_loss: 0.5953, test_loss: 1.5447, test_f1: 0.6010
 epoch: 27, train_loss: 0.5950, test_loss: 1.5704, test_f1: 0.5298
 epoch: 28, train_loss: 0.5989, test_loss: 1.5844, test_f1: 0.5092
 epoch: 29, train_loss: 0.5999, test_loss: 1.5883, test_f1: 0.5995
 epoch: 30, train_loss: 0.5736, test_loss: 1.4734, test_f1: 0.5516
 epoch: 31, train_loss: 0.5944, test_loss: 1.7253, test_f1: 0.5545
 epoch: 32, train_loss: 0.5789, test_loss: 1.3843, test_f1: 0.5886
 epoch: 33, train_loss: 0.5929, test_loss: 1.3282, test_f1: 0.6444
 epoch: 34, train_loss: 0.5375, test_loss: 1.9400, test_f1: 0.5134
 epoch: 35, train_loss: 0.5687, test_loss: 1.5774, test_f1: 0.5630
 epoch: 36, train_loss: 0.4869, test_loss: 1.7122, test_f1: 0.5547
 epoch: 37, train_loss: 0.5549, test_loss: 1.3508, test_f1: 0.6320
 epoch: 38, train_loss: 0.5371, test_loss: 1.3925, test_f1: 0.6026
 epoch: 39, train_loss: 0.5312, test_loss: 1.5396, test_f1: 0.5834
 epoch: 40, train_loss: 0.4999, test_loss: 1.7371, test_f1: 0.5036
 epoch: 41, train_loss: 0.4938, test_loss: 1.4345, test_f1: 0.5812
 epoch: 42, train_loss: 0.4933, test_loss: 1.5694, test_f1: 0.5833
 epoch: 43, train_loss: 0.4891, test_loss: 1.5363, test_f1: 0.5887
 epoch: 44, train_loss: 0.4712, test_loss: 1.6321, test_f1: 0.5975
 epoch: 45, train_loss: 0.4786, test_loss: 1.9589, test_f1: 0.6422
 epoch: 46, train_loss: 0.4669, test_loss: 1.7855, test_f1: 0.6045
 epoch: 47, train_loss: 0.4607, test_loss: 2.0487, test_f1: 0.5610
 epoch: 48, train_loss: 0.4422, test_loss: 1.5488, test_f1: 0.6252
 epoch: 49, train_loss: 0.4793, test_loss: 2.0405, test_f1: 0.5574
 epoch: 50, train_loss: 0.4453, test_loss: 2.1511, test_f1: 0.5568
 epoch: 51, train_loss: 0.4005, test_loss: 2.0678, test_f1: 0.5605
 epoch: 52, train_loss: 0.3721, test_loss: 2.0060, test_f1: 0.5838
 epoch: 53, train_loss: 0.3574, test_loss: 2.0493, test_f1: 0.5647
 epoch: 54, train_loss: 0.3476, test_loss: 2.2058, test_f1: 0.5731
 epoch: 55, train_loss: 0.3395, test_loss: 1.9969, test_f1: 0.5715
 epoch: 56, train_loss: 0.3422, test_loss: 2.3400, test_f1: 0.5849
 epoch: 57, train_loss: 0.3291, test_loss: 2.0505, test_f1: 0.5668
 epoch: 58, train_loss: 0.3216, test_loss: 2.0619, test_f1: 0.5529
 epoch: 59, train_loss: 0.3318, test_loss: 2.2869, test_f1: 0.5550
 epoch: 60, train_loss: 0.3347, test_loss: 2.3828, test_f1: 0.6039
 epoch: 61, train_loss: 0.3148, test_loss: 2.3242, test_f1: 0.5820
 epoch: 62, train_loss: 0.3028, test_loss: 2.4459, test_f1: 0.5762
 epoch: 63, train_loss: 0.2854, test_loss: 2.5495, test_f1: 0.5611
 epoch: 64, train_loss: 0.3072, test_loss: 2.4983, test_f1: 0.5744
 epoch: 65, train_loss: 0.3241, test_loss: 2.3783, test_f1: 0.5815
 epoch: 66, train_loss: 0.3004, test_loss: 2.7801, test_f1: 0.5681
 epoch: 67, train_loss: 0.2789, test_loss: 2.6027, test_f1: 0.5874
 epoch: 68, train_loss: 0.2964, test_loss: 2.3056, test_f1: 0.5559
 epoch: 69, train_loss: 0.2906, test_loss: 2.2107, test_f1: 0.6045
 epoch: 70, train_loss: 0.2739, test_loss: 2.6229, test_f1: 0.5651
 epoch: 71, train_loss: 0.2762, test_loss: 2.6515, test_f1: 0.5307
 epoch: 72, train_loss: 0.2725, test_loss: 2.6821, test_f1: 0.5630
 epoch: 73, train_loss: 0.2652, test_loss: 2.6520, test_f1: 0.5555
 epoch: 74, train_loss: 0.2437, test_loss: 2.7024, test_f1: 0.5621
 epoch: 75, train_loss: 0.2514, test_loss: 2.7401, test_f1: 0.5507
 epoch: 76, train_loss: 0.2574, test_loss: 2.9841, test_f1: 0.5846
 epoch: 77, train_loss: 0.2596, test_loss: 2.5078, test_f1: 0.5662
 epoch: 78, train_loss: 0.2676, test_loss: 2.4792, test_f1: 0.5494
 epoch: 79, train_loss: 0.2625, test_loss: 2.4221, test_f1: 0.5908
 epoch: 80, train_loss: 0.2326, test_loss: 2.2832, test_f1: 0.5771
 epoch: 81, train_loss: 0.2874, test_loss: 2.2947, test_f1: 0.5773
 epoch: 82, train_loss: 0.2551, test_loss: 2.1826, test_f1: 0.5828
 epoch: 83, train_loss: 0.2508, test_loss: 2.4351, test_f1: 0.5878
 epoch: 84, train_loss: 0.2503, test_loss: 2.4598, test_f1: 0.5719
 epoch: 85, train_loss: 0.2534, test_loss: 2.6417, test_f1: 0.6051
 epoch: 86, train_loss: 0.2302, test_loss: 2.5114, test_f1: 0.5838
 epoch: 87, train_loss: 0.2466, test_loss: 2.6700, test_f1: 0.5884
 epoch: 88, train_loss: 0.2319, test_loss: 2.6236, test_f1: 0.5507
 epoch: 89, train_loss: 0.2264, test_loss: 2.6948, test_f1: 0.5565
 epoch: 90, train_loss: 0.2533, test_loss: 2.5366, test_f1: 0.5593
 epoch: 91, train_loss: 0.2505, test_loss: 2.3402, test_f1: 0.5849
 epoch: 92, train_loss: 0.2147, test_loss: 2.5961, test_f1: 0.5648
 epoch: 93, train_loss: 0.2067, test_loss: 2.6038, test_f1: 0.5541
 epoch: 94, train_loss: 0.2054, test_loss: 2.9434, test_f1: 0.5468
 epoch: 95, train_loss: 0.2030, test_loss: 2.8130, test_f1: 0.5882
 epoch: 96, train_loss: 0.2386, test_loss: 2.5935, test_f1: 0.5920
 epoch: 97, train_loss: 0.2373, test_loss: 2.6808, test_f1: 0.5610
 epoch: 98, train_loss: 0.2326, test_loss: 2.5373, test_f1: 0.5947
 epoch: 99, train_loss: 0.2099, test_loss: 2.8309, test_f1: 0.5703
##################ITERATION #9 ****************************************
 epoch: 0, train_loss: 1.3720, test_loss: 1.4029, test_f1: 0.2533
 epoch: 1, train_loss: 1.0938, test_loss: 1.1785, test_f1: 0.5115
 epoch: 2, train_loss: 1.0214, test_loss: 1.5010, test_f1: 0.4887
 epoch: 3, train_loss: 0.9862, test_loss: 1.1246, test_f1: 0.6126
 epoch: 4, train_loss: 0.9606, test_loss: 1.1738, test_f1: 0.5389
 epoch: 5, train_loss: 0.9459, test_loss: 1.0916, test_f1: 0.5577
 epoch: 6, train_loss: 0.8999, test_loss: 1.0559, test_f1: 0.5912
 epoch: 7, train_loss: 0.8621, test_loss: 1.1320, test_f1: 0.5650
 epoch: 8, train_loss: 0.8100, test_loss: 1.1213, test_f1: 0.5678
 epoch: 9, train_loss: 0.8592, test_loss: 1.2019, test_f1: 0.5817
 epoch: 10, train_loss: 0.8281, test_loss: 1.2069, test_f1: 0.4940
 epoch: 11, train_loss: 0.8044, test_loss: 1.1378, test_f1: 0.5767
 epoch: 12, train_loss: 0.7632, test_loss: 1.1245, test_f1: 0.6111
 epoch: 13, train_loss: 0.7550, test_loss: 1.2592, test_f1: 0.5396
 epoch: 14, train_loss: 0.7385, test_loss: 1.0951, test_f1: 0.5844
 epoch: 15, train_loss: 0.7593, test_loss: 1.2048, test_f1: 0.5745
 epoch: 16, train_loss: 0.7466, test_loss: 1.0534, test_f1: 0.6215
 epoch: 17, train_loss: 0.7098, test_loss: 1.0620, test_f1: 0.6175
 epoch: 18, train_loss: 0.6955, test_loss: 1.4954, test_f1: 0.5409
 epoch: 19, train_loss: 0.7120, test_loss: 1.2561, test_f1: 0.5377
 epoch: 20, train_loss: 0.6649, test_loss: 1.1963, test_f1: 0.6174
 epoch: 21, train_loss: 0.6766, test_loss: 1.0302, test_f1: 0.6029
 epoch: 22, train_loss: 0.6733, test_loss: 1.1553, test_f1: 0.5451
 epoch: 23, train_loss: 0.7111, test_loss: 1.0736, test_f1: 0.6109
 epoch: 24, train_loss: 0.6555, test_loss: 1.2626, test_f1: 0.5965
 epoch: 25, train_loss: 0.6565, test_loss: 1.2212, test_f1: 0.5753
 epoch: 26, train_loss: 0.6260, test_loss: 1.3392, test_f1: 0.5577
 epoch: 27, train_loss: 0.6300, test_loss: 1.1662, test_f1: 0.6083
 epoch: 28, train_loss: 0.6074, test_loss: 1.2011, test_f1: 0.6166
 epoch: 29, train_loss: 0.6367, test_loss: 1.2360, test_f1: 0.6043
 epoch: 30, train_loss: 0.5909, test_loss: 1.1247, test_f1: 0.6414
 epoch: 31, train_loss: 0.5556, test_loss: 1.4345, test_f1: 0.5557
 epoch: 32, train_loss: 0.5630, test_loss: 1.3489, test_f1: 0.5834
 epoch: 33, train_loss: 0.6140, test_loss: 1.5437, test_f1: 0.5099
 epoch: 34, train_loss: 0.5509, test_loss: 1.5320, test_f1: 0.5640
 epoch: 35, train_loss: 0.5566, test_loss: 1.2571, test_f1: 0.6066
 epoch: 36, train_loss: 0.5008, test_loss: 1.5174, test_f1: 0.5691
 epoch: 37, train_loss: 0.5093, test_loss: 1.4356, test_f1: 0.5762
 epoch: 38, train_loss: 0.5179, test_loss: 1.3487, test_f1: 0.6245
 epoch: 39, train_loss: 0.5172, test_loss: 1.4140, test_f1: 0.6219
 epoch: 40, train_loss: 0.4808, test_loss: 1.5755, test_f1: 0.5982
 epoch: 41, train_loss: 0.4836, test_loss: 1.4708, test_f1: 0.5901
 epoch: 42, train_loss: 0.5325, test_loss: 1.4547, test_f1: 0.6393
 epoch: 43, train_loss: 0.4846, test_loss: 1.5840, test_f1: 0.5669
 epoch: 44, train_loss: 0.4883, test_loss: 1.5919, test_f1: 0.5840
 epoch: 45, train_loss: 0.4655, test_loss: 1.9567, test_f1: 0.5693
 epoch: 46, train_loss: 0.4709, test_loss: 1.7542, test_f1: 0.5719
 epoch: 47, train_loss: 0.4350, test_loss: 1.9159, test_f1: 0.6228
 epoch: 48, train_loss: 0.4360, test_loss: 1.7426, test_f1: 0.5991
 epoch: 49, train_loss: 0.4757, test_loss: 1.7186, test_f1: 0.5924
 epoch: 50, train_loss: 0.4097, test_loss: 2.1390, test_f1: 0.5462
 epoch: 51, train_loss: 0.3624, test_loss: 1.8474, test_f1: 0.5908
 epoch: 52, train_loss: 0.3447, test_loss: 2.1381, test_f1: 0.5957
 epoch: 53, train_loss: 0.3367, test_loss: 2.0694, test_f1: 0.6064
 epoch: 54, train_loss: 0.3565, test_loss: 2.3139, test_f1: 0.5892
 epoch: 55, train_loss: 0.3569, test_loss: 2.1057, test_f1: 0.5938
 epoch: 56, train_loss: 0.3379, test_loss: 2.1906, test_f1: 0.5915
 epoch: 57, train_loss: 0.3355, test_loss: 2.3614, test_f1: 0.5711
 epoch: 58, train_loss: 0.3312, test_loss: 2.1753, test_f1: 0.5843
 epoch: 59, train_loss: 0.3174, test_loss: 2.3860, test_f1: 0.5869
 epoch: 60, train_loss: 0.2735, test_loss: 2.3982, test_f1: 0.5897
 epoch: 61, train_loss: 0.3118, test_loss: 2.5427, test_f1: 0.5948
 epoch: 62, train_loss: 0.3051, test_loss: 2.3445, test_f1: 0.6037
 epoch: 63, train_loss: 0.3116, test_loss: 2.1002, test_f1: 0.5690
 epoch: 64, train_loss: 0.3120, test_loss: 2.1524, test_f1: 0.5811
 epoch: 65, train_loss: 0.2774, test_loss: 2.4918, test_f1: 0.5981
 epoch: 66, train_loss: 0.2665, test_loss: 2.8098, test_f1: 0.5754
 epoch: 67, train_loss: 0.3034, test_loss: 3.0875, test_f1: 0.6103
 epoch: 68, train_loss: 0.2608, test_loss: 2.9208, test_f1: 0.5518
 epoch: 69, train_loss: 0.3128, test_loss: 2.3184, test_f1: 0.6007
 epoch: 70, train_loss: 0.2860, test_loss: 2.8481, test_f1: 0.5723
 epoch: 71, train_loss: 0.2807, test_loss: 2.7342, test_f1: 0.5866
 epoch: 72, train_loss: 0.2591, test_loss: 3.0571, test_f1: 0.5730
 epoch: 73, train_loss: 0.2664, test_loss: 2.3114, test_f1: 0.5999
 epoch: 74, train_loss: 0.2460, test_loss: 2.5343, test_f1: 0.5944
 epoch: 75, train_loss: 0.2501, test_loss: 3.0119, test_f1: 0.5452
 epoch: 76, train_loss: 0.2914, test_loss: 2.1035, test_f1: 0.6016
 epoch: 77, train_loss: 0.2623, test_loss: 2.3925, test_f1: 0.5962
 epoch: 78, train_loss: 0.2524, test_loss: 2.3984, test_f1: 0.5794
 epoch: 79, train_loss: 0.2505, test_loss: 3.0455, test_f1: 0.5398
 epoch: 80, train_loss: 0.2554, test_loss: 2.8834, test_f1: 0.6004
 epoch: 81, train_loss: 0.2273, test_loss: 2.7061, test_f1: 0.5779
 epoch: 82, train_loss: 0.2390, test_loss: 2.9439, test_f1: 0.5812
 epoch: 83, train_loss: 0.2285, test_loss: 2.9065, test_f1: 0.5573
 epoch: 84, train_loss: 0.2541, test_loss: 3.0929, test_f1: 0.5685
 epoch: 85, train_loss: 0.2528, test_loss: 2.9897, test_f1: 0.5597
 epoch: 86, train_loss: 0.2299, test_loss: 3.0003, test_f1: 0.5482
 epoch: 87, train_loss: 0.2333, test_loss: 2.8735, test_f1: 0.5673
 epoch: 88, train_loss: 0.2545, test_loss: 2.6273, test_f1: 0.6223
 epoch: 89, train_loss: 0.2411, test_loss: 2.5562, test_f1: 0.6099
 epoch: 90, train_loss: 0.2211, test_loss: 2.6968, test_f1: 0.6057
 epoch: 91, train_loss: 0.2037, test_loss: 2.8196, test_f1: 0.5860
 epoch: 92, train_loss: 0.2060, test_loss: 3.6026, test_f1: 0.5632
 epoch: 93, train_loss: 0.2511, test_loss: 2.9383, test_f1: 0.5665
 epoch: 94, train_loss: 0.2294, test_loss: 3.0856, test_f1: 0.6009
 epoch: 95, train_loss: 0.1996, test_loss: 2.9074, test_f1: 0.5432
 epoch: 96, train_loss: 0.2082, test_loss: 2.8453, test_f1: 0.5889
 epoch: 97, train_loss: 0.2163, test_loss: 3.1984, test_f1: 0.5709
 epoch: 98, train_loss: 0.2363, test_loss: 2.9106, test_f1: 0.5896
 epoch: 99, train_loss: 0.2470, test_loss: 3.0471, test_f1: 0.5667

Training completed in 590.56 seconds
Best F1: 0.6610 at epoch 85
Mean F1 across iterations: 0.6421  0.0107
========================FINAL RESULTS================================
FEGIN weighted F1: 0.6610  0.0107
python main.py --data ltspice_demos --representation component_component --model FEGIN --layers 3 --hiddens 128 --batch_size 32 --lr 0.001 --emb_size 512 --epochs 100 --save_appendix component_component_L3_H128_BS32_LR0.001_E512 --no_val
-----



STDERR:
  File "main.py", line 370, in <module>
    main()
  File "main.py", line 254, in main
    dataset = dataset_class(
  File "/home/philip/projects/ltspice_examples_code_repo/Circuit-Completion-Using-GNNs/component_classification_with_link_prediction_head/evaluation/FEGIN/kernel/circuit_datasets.py", line 15, in __init__
    self.data, self.slices = torch.load(self.processed_paths[0])
  File "/home/philip/.local/lib/python3.8/site-packages/torch/serialization.py", line 1040, in load
    warnings.warn(
  File "/usr/lib/python3.8/warnings.py", line 109, in _showwarnmsg
    sw(msg.message, msg.category, msg.filename, msg.lineno,
  File "main.py", line 47, in warn_with_traceback
    traceback.print_stack(file=log)
/home/philip/projects/ltspice_examples_code_repo/Circuit-Completion-Using-GNNs/component_classification_with_link_prediction_head/evaluation/FEGIN/kernel/circuit_datasets.py:15: FutureWarning: You are using `torch.load` with `weights_only=False` (the current default value), which uses the default pickle module implicitly. It is possible to construct malicious pickle data which will execute arbitrary code during unpickling (See https://github.com/pytorch/pytorch/blob/main/SECURITY.md#untrusted-models for more details). In a future release, the default value for `weights_only` will be flipped to `True`. This limits the functions that could be executed during unpickling. Arbitrary objects will no longer be allowed to be loaded via this mode unless they are explicitly allowlisted by the user via `torch.serialization.add_safe_globals`. We recommend you start setting `weights_only=True` for any use case where you don't have full control of the loaded file. Please open an issue on GitHub for any issues related to this experimental feature.
  self.data, self.slices = torch.load(self.processed_paths[0])
