STDOUT:
Results will be saved in /home/philip/projects/ltspice_examples_code_repo/Circuit-Completion-Using-GNNs/component_classification_with_link_prediction_head/evaluation/FEGIN/results/model_FEGIN_dataset_ltspice_examples
Command line input: python main.py --data ltspice_examples --representation component_component --model FEGIN --layers 2 --hiddens 64 --batch_size 32 --lr 0.0001 --emb_size 128 --epochs 100 --save_appendix component_component_L2_H64_BS32_LR0.0001_E128 --no_val
 is saved.
-----
ltspice_examples - FEGIN
Using 2 layers, 64 hidden units, h = 2
Loading component_component representation dataset
ENTERED
Training FEGIN on component_component representation
Train: 3556, Test: 845
##################ITERATION #0 ****************************************
 epoch: 0, train_loss: 1.3779, test_loss: 1.3513, test_f1: 0.2659
 epoch: 1, train_loss: 1.3336, test_loss: 1.3074, test_f1: 0.2541
 epoch: 2, train_loss: 1.2919, test_loss: 1.2635, test_f1: 0.2585
 epoch: 3, train_loss: 1.2591, test_loss: 1.2278, test_f1: 0.3035
 epoch: 4, train_loss: 1.2352, test_loss: 1.2010, test_f1: 0.3301
 epoch: 5, train_loss: 1.2219, test_loss: 1.1808, test_f1: 0.3513
 epoch: 6, train_loss: 1.2050, test_loss: 1.1652, test_f1: 0.3509
 epoch: 7, train_loss: 1.1905, test_loss: 1.1553, test_f1: 0.3492
 epoch: 8, train_loss: 1.1758, test_loss: 1.1414, test_f1: 0.3580
 epoch: 9, train_loss: 1.1703, test_loss: 1.1264, test_f1: 0.3916
 epoch: 10, train_loss: 1.1551, test_loss: 1.1132, test_f1: 0.4024
 epoch: 11, train_loss: 1.1457, test_loss: 1.1019, test_f1: 0.4273
 epoch: 12, train_loss: 1.1374, test_loss: 1.0897, test_f1: 0.4283
 epoch: 13, train_loss: 1.1219, test_loss: 1.0804, test_f1: 0.4256
 epoch: 14, train_loss: 1.1142, test_loss: 1.0789, test_f1: 0.4426
 epoch: 15, train_loss: 1.1061, test_loss: 1.0665, test_f1: 0.4562
 epoch: 16, train_loss: 1.1025, test_loss: 1.0493, test_f1: 0.4606
 epoch: 17, train_loss: 1.0900, test_loss: 1.0460, test_f1: 0.4551
 epoch: 18, train_loss: 1.0803, test_loss: 1.0332, test_f1: 0.4600
 epoch: 19, train_loss: 1.0737, test_loss: 1.0202, test_f1: 0.4635
 epoch: 20, train_loss: 1.0694, test_loss: 1.0105, test_f1: 0.4608
 epoch: 21, train_loss: 1.0617, test_loss: 1.0176, test_f1: 0.4651
 epoch: 22, train_loss: 1.0502, test_loss: 1.0086, test_f1: 0.4528
 epoch: 23, train_loss: 1.0431, test_loss: 0.9961, test_f1: 0.4606
 epoch: 24, train_loss: 1.0380, test_loss: 1.0018, test_f1: 0.4595
 epoch: 25, train_loss: 1.0292, test_loss: 0.9805, test_f1: 0.4892
 epoch: 26, train_loss: 1.0285, test_loss: 0.9784, test_f1: 0.4710
 epoch: 27, train_loss: 1.0094, test_loss: 0.9665, test_f1: 0.4851
 epoch: 28, train_loss: 1.0147, test_loss: 0.9599, test_f1: 0.4839
 epoch: 29, train_loss: 1.0037, test_loss: 0.9582, test_f1: 0.4930
 epoch: 30, train_loss: 1.0020, test_loss: 0.9612, test_f1: 0.4721
 epoch: 31, train_loss: 1.0028, test_loss: 0.9555, test_f1: 0.4939
 epoch: 32, train_loss: 0.9885, test_loss: 0.9644, test_f1: 0.4910
 epoch: 33, train_loss: 0.9772, test_loss: 0.9515, test_f1: 0.4877
 epoch: 34, train_loss: 0.9958, test_loss: 0.9534, test_f1: 0.4893
 epoch: 35, train_loss: 0.9856, test_loss: 0.9523, test_f1: 0.4796
 epoch: 36, train_loss: 0.9783, test_loss: 0.9527, test_f1: 0.4946
 epoch: 37, train_loss: 0.9716, test_loss: 0.9567, test_f1: 0.4886
 epoch: 38, train_loss: 0.9643, test_loss: 0.9370, test_f1: 0.4921
 epoch: 39, train_loss: 0.9571, test_loss: 0.9402, test_f1: 0.5025
 epoch: 40, train_loss: 0.9626, test_loss: 0.9311, test_f1: 0.4874
 epoch: 41, train_loss: 0.9526, test_loss: 0.9342, test_f1: 0.5111
 epoch: 42, train_loss: 0.9543, test_loss: 0.9419, test_f1: 0.5117
 epoch: 43, train_loss: 0.9397, test_loss: 0.9363, test_f1: 0.4995
 epoch: 44, train_loss: 0.9387, test_loss: 0.9307, test_f1: 0.5125
 epoch: 45, train_loss: 0.9433, test_loss: 0.9340, test_f1: 0.5073
 epoch: 46, train_loss: 0.9357, test_loss: 0.9329, test_f1: 0.4976
 epoch: 47, train_loss: 0.9482, test_loss: 0.9210, test_f1: 0.4947
 epoch: 48, train_loss: 0.9336, test_loss: 0.9345, test_f1: 0.5198
 epoch: 49, train_loss: 0.9296, test_loss: 0.9341, test_f1: 0.5136
 epoch: 50, train_loss: 0.9259, test_loss: 0.9287, test_f1: 0.4976
 epoch: 51, train_loss: 0.9180, test_loss: 0.9300, test_f1: 0.5106
 epoch: 52, train_loss: 0.9107, test_loss: 0.9236, test_f1: 0.5087
 epoch: 53, train_loss: 0.9135, test_loss: 0.9186, test_f1: 0.5227
 epoch: 54, train_loss: 0.9121, test_loss: 0.9460, test_f1: 0.5026
 epoch: 55, train_loss: 0.9075, test_loss: 0.9329, test_f1: 0.5181
 epoch: 56, train_loss: 0.9077, test_loss: 0.9234, test_f1: 0.5208
 epoch: 57, train_loss: 0.9031, test_loss: 0.9307, test_f1: 0.5283
 epoch: 58, train_loss: 0.9072, test_loss: 0.9399, test_f1: 0.5220
 epoch: 59, train_loss: 0.8965, test_loss: 0.9321, test_f1: 0.5179
 epoch: 60, train_loss: 0.9018, test_loss: 0.9295, test_f1: 0.5292
 epoch: 61, train_loss: 0.9006, test_loss: 0.9366, test_f1: 0.5016
 epoch: 62, train_loss: 0.9031, test_loss: 0.9358, test_f1: 0.5279
 epoch: 63, train_loss: 0.9006, test_loss: 0.9412, test_f1: 0.5217
 epoch: 64, train_loss: 0.8934, test_loss: 0.9426, test_f1: 0.5261
 epoch: 65, train_loss: 0.9054, test_loss: 0.9385, test_f1: 0.5276
 epoch: 66, train_loss: 0.8877, test_loss: 0.9402, test_f1: 0.5272
 epoch: 67, train_loss: 0.8981, test_loss: 0.9406, test_f1: 0.5242
 epoch: 68, train_loss: 0.8943, test_loss: 0.9418, test_f1: 0.5266
 epoch: 69, train_loss: 0.8975, test_loss: 0.9489, test_f1: 0.5255
 epoch: 70, train_loss: 0.8892, test_loss: 0.9456, test_f1: 0.5165
 epoch: 71, train_loss: 0.8806, test_loss: 0.9350, test_f1: 0.5317
 epoch: 72, train_loss: 0.8894, test_loss: 0.9408, test_f1: 0.5187
 epoch: 73, train_loss: 0.8857, test_loss: 0.9391, test_f1: 0.5297
 epoch: 74, train_loss: 0.8841, test_loss: 0.9414, test_f1: 0.5068
 epoch: 75, train_loss: 0.8884, test_loss: 0.9521, test_f1: 0.5247
 epoch: 76, train_loss: 0.8790, test_loss: 0.9451, test_f1: 0.5258
 epoch: 77, train_loss: 0.8832, test_loss: 0.9509, test_f1: 0.5010
 epoch: 78, train_loss: 0.8799, test_loss: 0.9425, test_f1: 0.5142
 epoch: 79, train_loss: 0.8790, test_loss: 0.9511, test_f1: 0.5243
 epoch: 80, train_loss: 0.8792, test_loss: 0.9649, test_f1: 0.5059
 epoch: 81, train_loss: 0.8686, test_loss: 0.9557, test_f1: 0.5374
 epoch: 82, train_loss: 0.8666, test_loss: 0.9532, test_f1: 0.5270
 epoch: 83, train_loss: 0.8626, test_loss: 0.9634, test_f1: 0.5118
 epoch: 84, train_loss: 0.8659, test_loss: 0.9566, test_f1: 0.5065
 epoch: 85, train_loss: 0.8764, test_loss: 0.9535, test_f1: 0.5149
 epoch: 86, train_loss: 0.8624, test_loss: 0.9505, test_f1: 0.5279
 epoch: 87, train_loss: 0.8667, test_loss: 0.9471, test_f1: 0.5235
 epoch: 88, train_loss: 0.8632, test_loss: 0.9556, test_f1: 0.5118
 epoch: 89, train_loss: 0.8690, test_loss: 0.9663, test_f1: 0.5217
 epoch: 90, train_loss: 0.8535, test_loss: 0.9639, test_f1: 0.5292
 epoch: 91, train_loss: 0.8575, test_loss: 0.9616, test_f1: 0.5285
 epoch: 92, train_loss: 0.8665, test_loss: 0.9532, test_f1: 0.5318
 epoch: 93, train_loss: 0.8584, test_loss: 0.9625, test_f1: 0.5328
 epoch: 94, train_loss: 0.8649, test_loss: 0.9709, test_f1: 0.5235
 epoch: 95, train_loss: 0.8618, test_loss: 0.9723, test_f1: 0.5226
 epoch: 96, train_loss: 0.8573, test_loss: 0.9495, test_f1: 0.5413
 epoch: 97, train_loss: 0.8536, test_loss: 0.9685, test_f1: 0.5221
 epoch: 98, train_loss: 0.8595, test_loss: 0.9744, test_f1: 0.5302
 epoch: 99, train_loss: 0.8555, test_loss: 0.9552, test_f1: 0.5048
##################ITERATION #1 ****************************************
 epoch: 0, train_loss: 1.3101, test_loss: 1.2424, test_f1: 0.3529
 epoch: 1, train_loss: 1.2395, test_loss: 1.2065, test_f1: 0.3900
 epoch: 2, train_loss: 1.2107, test_loss: 1.1774, test_f1: 0.4018
 epoch: 3, train_loss: 1.1860, test_loss: 1.1446, test_f1: 0.4252
 epoch: 4, train_loss: 1.1659, test_loss: 1.1253, test_f1: 0.4306
 epoch: 5, train_loss: 1.1455, test_loss: 1.1034, test_f1: 0.4284
 epoch: 6, train_loss: 1.1235, test_loss: 1.0801, test_f1: 0.4442
 epoch: 7, train_loss: 1.1108, test_loss: 1.0692, test_f1: 0.4488
 epoch: 8, train_loss: 1.0989, test_loss: 1.0507, test_f1: 0.4564
 epoch: 9, train_loss: 1.0870, test_loss: 1.0366, test_f1: 0.4574
 epoch: 10, train_loss: 1.0754, test_loss: 1.0272, test_f1: 0.4502
 epoch: 11, train_loss: 1.0681, test_loss: 1.0264, test_f1: 0.4533
 epoch: 12, train_loss: 1.0557, test_loss: 1.0014, test_f1: 0.4697
 epoch: 13, train_loss: 1.0462, test_loss: 1.0087, test_f1: 0.4756
 epoch: 14, train_loss: 1.0329, test_loss: 0.9930, test_f1: 0.4790
 epoch: 15, train_loss: 1.0386, test_loss: 0.9941, test_f1: 0.4570
 epoch: 16, train_loss: 1.0266, test_loss: 0.9941, test_f1: 0.4701
 epoch: 17, train_loss: 1.0107, test_loss: 0.9700, test_f1: 0.4964
 epoch: 18, train_loss: 1.0111, test_loss: 0.9688, test_f1: 0.5022
 epoch: 19, train_loss: 0.9966, test_loss: 0.9694, test_f1: 0.4894
 epoch: 20, train_loss: 0.9963, test_loss: 0.9774, test_f1: 0.4996
 epoch: 21, train_loss: 0.9912, test_loss: 0.9643, test_f1: 0.4918
 epoch: 22, train_loss: 0.9881, test_loss: 0.9495, test_f1: 0.5127
 epoch: 23, train_loss: 0.9821, test_loss: 0.9586, test_f1: 0.4937
 epoch: 24, train_loss: 0.9738, test_loss: 0.9507, test_f1: 0.4732
 epoch: 25, train_loss: 0.9692, test_loss: 0.9602, test_f1: 0.5048
 epoch: 26, train_loss: 0.9544, test_loss: 0.9594, test_f1: 0.4829
 epoch: 27, train_loss: 0.9706, test_loss: 0.9418, test_f1: 0.5041
 epoch: 28, train_loss: 0.9664, test_loss: 0.9508, test_f1: 0.5152
 epoch: 29, train_loss: 0.9477, test_loss: 0.9407, test_f1: 0.5078
 epoch: 30, train_loss: 0.9457, test_loss: 0.9379, test_f1: 0.5186
 epoch: 31, train_loss: 0.9342, test_loss: 0.9431, test_f1: 0.5176
 epoch: 32, train_loss: 0.9371, test_loss: 0.9368, test_f1: 0.5049
 epoch: 33, train_loss: 0.9317, test_loss: 0.9333, test_f1: 0.5255
 epoch: 34, train_loss: 0.9284, test_loss: 0.9240, test_f1: 0.5220
 epoch: 35, train_loss: 0.9291, test_loss: 0.9350, test_f1: 0.5210
 epoch: 36, train_loss: 0.9254, test_loss: 0.9113, test_f1: 0.5475
 epoch: 37, train_loss: 0.9194, test_loss: 0.9219, test_f1: 0.5327
 epoch: 38, train_loss: 0.9040, test_loss: 0.9422, test_f1: 0.5301
 epoch: 39, train_loss: 0.8996, test_loss: 0.9382, test_f1: 0.5421
 epoch: 40, train_loss: 0.9098, test_loss: 0.9556, test_f1: 0.5225
 epoch: 41, train_loss: 0.9023, test_loss: 0.9391, test_f1: 0.5522
 epoch: 42, train_loss: 0.9022, test_loss: 0.9243, test_f1: 0.5562
 epoch: 43, train_loss: 0.8956, test_loss: 0.9282, test_f1: 0.5314
 epoch: 44, train_loss: 0.8851, test_loss: 0.9291, test_f1: 0.5396
 epoch: 45, train_loss: 0.8844, test_loss: 0.9334, test_f1: 0.5315
 epoch: 46, train_loss: 0.8969, test_loss: 0.9257, test_f1: 0.5347
 epoch: 47, train_loss: 0.8683, test_loss: 0.9383, test_f1: 0.5541
 epoch: 48, train_loss: 0.8768, test_loss: 0.9400, test_f1: 0.5385
 epoch: 49, train_loss: 0.8772, test_loss: 0.9386, test_f1: 0.5304
 epoch: 50, train_loss: 0.8781, test_loss: 0.9247, test_f1: 0.5527
 epoch: 51, train_loss: 0.8628, test_loss: 0.9364, test_f1: 0.5505
 epoch: 52, train_loss: 0.8617, test_loss: 0.9414, test_f1: 0.5405
 epoch: 53, train_loss: 0.8699, test_loss: 0.9332, test_f1: 0.5449
 epoch: 54, train_loss: 0.8611, test_loss: 0.9311, test_f1: 0.5583
 epoch: 55, train_loss: 0.8585, test_loss: 0.9281, test_f1: 0.5438
 epoch: 56, train_loss: 0.8600, test_loss: 0.9339, test_f1: 0.5427
 epoch: 57, train_loss: 0.8531, test_loss: 0.9372, test_f1: 0.5360
 epoch: 58, train_loss: 0.8531, test_loss: 0.9322, test_f1: 0.5475
 epoch: 59, train_loss: 0.8477, test_loss: 0.9341, test_f1: 0.5172
 epoch: 60, train_loss: 0.8405, test_loss: 0.9428, test_f1: 0.5599
 epoch: 61, train_loss: 0.8543, test_loss: 0.9514, test_f1: 0.5700
 epoch: 62, train_loss: 0.8464, test_loss: 0.9276, test_f1: 0.5313
 epoch: 63, train_loss: 0.8415, test_loss: 0.9398, test_f1: 0.5469
 epoch: 64, train_loss: 0.8384, test_loss: 0.9305, test_f1: 0.5485
 epoch: 65, train_loss: 0.8410, test_loss: 0.9221, test_f1: 0.5630
 epoch: 66, train_loss: 0.8465, test_loss: 0.9309, test_f1: 0.5521
 epoch: 67, train_loss: 0.8406, test_loss: 0.9232, test_f1: 0.5479
 epoch: 68, train_loss: 0.8308, test_loss: 0.9435, test_f1: 0.5313
 epoch: 69, train_loss: 0.8324, test_loss: 0.9501, test_f1: 0.5529
 epoch: 70, train_loss: 0.8329, test_loss: 0.9466, test_f1: 0.5393
 epoch: 71, train_loss: 0.8322, test_loss: 0.9445, test_f1: 0.5492
 epoch: 72, train_loss: 0.8310, test_loss: 0.9419, test_f1: 0.5410
 epoch: 73, train_loss: 0.8432, test_loss: 0.9336, test_f1: 0.5740
 epoch: 74, train_loss: 0.8310, test_loss: 0.9525, test_f1: 0.5705
 epoch: 75, train_loss: 0.8404, test_loss: 0.9345, test_f1: 0.5676
 epoch: 76, train_loss: 0.8276, test_loss: 0.9367, test_f1: 0.5466
 epoch: 77, train_loss: 0.8141, test_loss: 0.9311, test_f1: 0.5598
 epoch: 78, train_loss: 0.8273, test_loss: 0.9353, test_f1: 0.5473
 epoch: 79, train_loss: 0.8255, test_loss: 0.9354, test_f1: 0.5407
 epoch: 80, train_loss: 0.8100, test_loss: 0.9448, test_f1: 0.5430
 epoch: 81, train_loss: 0.8138, test_loss: 0.9532, test_f1: 0.5442
 epoch: 82, train_loss: 0.8276, test_loss: 0.9550, test_f1: 0.5606
 epoch: 83, train_loss: 0.8113, test_loss: 0.9465, test_f1: 0.5496
 epoch: 84, train_loss: 0.8124, test_loss: 0.9516, test_f1: 0.5605
 epoch: 85, train_loss: 0.8173, test_loss: 0.9346, test_f1: 0.5538
 epoch: 86, train_loss: 0.8105, test_loss: 0.9544, test_f1: 0.5538
 epoch: 87, train_loss: 0.8000, test_loss: 0.9547, test_f1: 0.5480
 epoch: 88, train_loss: 0.8043, test_loss: 0.9599, test_f1: 0.5490
 epoch: 89, train_loss: 0.8149, test_loss: 0.9518, test_f1: 0.5501
 epoch: 90, train_loss: 0.8111, test_loss: 0.9553, test_f1: 0.5489
 epoch: 91, train_loss: 0.8076, test_loss: 0.9508, test_f1: 0.5654
 epoch: 92, train_loss: 0.8061, test_loss: 0.9527, test_f1: 0.5464
 epoch: 93, train_loss: 0.7969, test_loss: 0.9641, test_f1: 0.5740
 epoch: 94, train_loss: 0.7991, test_loss: 0.9400, test_f1: 0.5498
 epoch: 95, train_loss: 0.8083, test_loss: 0.9712, test_f1: 0.5438
 epoch: 96, train_loss: 0.7979, test_loss: 0.9584, test_f1: 0.5565
 epoch: 97, train_loss: 0.7854, test_loss: 0.9493, test_f1: 0.5288
 epoch: 98, train_loss: 0.7900, test_loss: 0.9866, test_f1: 0.5404
 epoch: 99, train_loss: 0.7996, test_loss: 0.9491, test_f1: 0.5649
##################ITERATION #2 ****************************************
 epoch: 0, train_loss: 1.3043, test_loss: 1.2365, test_f1: 0.3171
 epoch: 1, train_loss: 1.2448, test_loss: 1.2084, test_f1: 0.3409
 epoch: 2, train_loss: 1.2140, test_loss: 1.1864, test_f1: 0.4086
 epoch: 3, train_loss: 1.1984, test_loss: 1.1568, test_f1: 0.4531
 epoch: 4, train_loss: 1.1787, test_loss: 1.1384, test_f1: 0.4413
 epoch: 5, train_loss: 1.1556, test_loss: 1.1163, test_f1: 0.4437
 epoch: 6, train_loss: 1.1485, test_loss: 1.0986, test_f1: 0.4567
 epoch: 7, train_loss: 1.1227, test_loss: 1.0722, test_f1: 0.4624
 epoch: 8, train_loss: 1.1135, test_loss: 1.0627, test_f1: 0.4504
 epoch: 9, train_loss: 1.0962, test_loss: 1.0550, test_f1: 0.4360
 epoch: 10, train_loss: 1.0894, test_loss: 1.0428, test_f1: 0.4615
 epoch: 11, train_loss: 1.0852, test_loss: 1.0343, test_f1: 0.4696
 epoch: 12, train_loss: 1.0641, test_loss: 1.0130, test_f1: 0.4633
 epoch: 13, train_loss: 1.0634, test_loss: 1.0088, test_f1: 0.4772
 epoch: 14, train_loss: 1.0437, test_loss: 0.9932, test_f1: 0.4771
 epoch: 15, train_loss: 1.0281, test_loss: 0.9907, test_f1: 0.4876
 epoch: 16, train_loss: 1.0320, test_loss: 0.9942, test_f1: 0.4906
 epoch: 17, train_loss: 1.0218, test_loss: 0.9800, test_f1: 0.4817
 epoch: 18, train_loss: 1.0124, test_loss: 0.9724, test_f1: 0.4943
 epoch: 19, train_loss: 1.0050, test_loss: 0.9652, test_f1: 0.4924
 epoch: 20, train_loss: 0.9981, test_loss: 0.9869, test_f1: 0.4762
 epoch: 21, train_loss: 0.9932, test_loss: 0.9687, test_f1: 0.5136
 epoch: 22, train_loss: 0.9871, test_loss: 0.9774, test_f1: 0.4995
 epoch: 23, train_loss: 0.9821, test_loss: 0.9659, test_f1: 0.4935
 epoch: 24, train_loss: 0.9814, test_loss: 0.9803, test_f1: 0.4961
 epoch: 25, train_loss: 0.9688, test_loss: 0.9705, test_f1: 0.5020
 epoch: 26, train_loss: 0.9754, test_loss: 0.9653, test_f1: 0.5104
 epoch: 27, train_loss: 0.9694, test_loss: 0.9674, test_f1: 0.4993
 epoch: 28, train_loss: 0.9702, test_loss: 0.9665, test_f1: 0.5107
 epoch: 29, train_loss: 0.9563, test_loss: 0.9667, test_f1: 0.5131
 epoch: 30, train_loss: 0.9422, test_loss: 0.9915, test_f1: 0.5050
 epoch: 31, train_loss: 0.9472, test_loss: 0.9825, test_f1: 0.4969
 epoch: 32, train_loss: 0.9355, test_loss: 0.9719, test_f1: 0.5216
 epoch: 33, train_loss: 0.9254, test_loss: 0.9793, test_f1: 0.5185
 epoch: 34, train_loss: 0.9313, test_loss: 0.9736, test_f1: 0.5216
 epoch: 35, train_loss: 0.9261, test_loss: 0.9799, test_f1: 0.5275
 epoch: 36, train_loss: 0.9290, test_loss: 0.9598, test_f1: 0.5021
 epoch: 37, train_loss: 0.9273, test_loss: 0.9726, test_f1: 0.5131
 epoch: 38, train_loss: 0.9167, test_loss: 0.9709, test_f1: 0.5178
 epoch: 39, train_loss: 0.9131, test_loss: 0.9713, test_f1: 0.5067
 epoch: 40, train_loss: 0.9020, test_loss: 0.9582, test_f1: 0.5018
 epoch: 41, train_loss: 0.9057, test_loss: 0.9733, test_f1: 0.5105
 epoch: 42, train_loss: 0.8967, test_loss: 0.9792, test_f1: 0.5281
 epoch: 43, train_loss: 0.9023, test_loss: 0.9848, test_f1: 0.5167
 epoch: 44, train_loss: 0.8982, test_loss: 0.9941, test_f1: 0.5056
 epoch: 45, train_loss: 0.8854, test_loss: 1.0047, test_f1: 0.5133
 epoch: 46, train_loss: 0.8821, test_loss: 1.0020, test_f1: 0.5243
 epoch: 47, train_loss: 0.8806, test_loss: 1.0136, test_f1: 0.5007
 epoch: 48, train_loss: 0.8847, test_loss: 0.9977, test_f1: 0.5238
 epoch: 49, train_loss: 0.8678, test_loss: 1.0168, test_f1: 0.5274
 epoch: 50, train_loss: 0.8788, test_loss: 0.9922, test_f1: 0.5344
 epoch: 51, train_loss: 0.8717, test_loss: 1.0045, test_f1: 0.5274
 epoch: 52, train_loss: 0.8719, test_loss: 0.9862, test_f1: 0.5287
 epoch: 53, train_loss: 0.8573, test_loss: 0.9954, test_f1: 0.5394
 epoch: 54, train_loss: 0.8681, test_loss: 1.0080, test_f1: 0.5289
 epoch: 55, train_loss: 0.8619, test_loss: 1.0093, test_f1: 0.5129
 epoch: 56, train_loss: 0.8631, test_loss: 0.9992, test_f1: 0.5398
 epoch: 57, train_loss: 0.8642, test_loss: 1.0057, test_f1: 0.5198
 epoch: 58, train_loss: 0.8658, test_loss: 1.0112, test_f1: 0.5194
 epoch: 59, train_loss: 0.8510, test_loss: 1.0067, test_f1: 0.5281
 epoch: 60, train_loss: 0.8560, test_loss: 1.0024, test_f1: 0.5298
 epoch: 61, train_loss: 0.8503, test_loss: 1.0043, test_f1: 0.5225
 epoch: 62, train_loss: 0.8565, test_loss: 1.0029, test_f1: 0.5247
 epoch: 63, train_loss: 0.8421, test_loss: 1.0131, test_f1: 0.5330
 epoch: 64, train_loss: 0.8552, test_loss: 1.0114, test_f1: 0.5251
 epoch: 65, train_loss: 0.8429, test_loss: 0.9993, test_f1: 0.5422
 epoch: 66, train_loss: 0.8467, test_loss: 0.9974, test_f1: 0.5374
 epoch: 67, train_loss: 0.8427, test_loss: 1.0130, test_f1: 0.5410
 epoch: 68, train_loss: 0.8429, test_loss: 1.0219, test_f1: 0.5179
 epoch: 69, train_loss: 0.8397, test_loss: 1.0148, test_f1: 0.5348
 epoch: 70, train_loss: 0.8423, test_loss: 1.0089, test_f1: 0.5366
 epoch: 71, train_loss: 0.8303, test_loss: 1.0379, test_f1: 0.5242
 epoch: 72, train_loss: 0.8313, test_loss: 1.0294, test_f1: 0.5325
 epoch: 73, train_loss: 0.8380, test_loss: 1.0231, test_f1: 0.5441
 epoch: 74, train_loss: 0.8402, test_loss: 1.0137, test_f1: 0.5400
 epoch: 75, train_loss: 0.8350, test_loss: 1.0074, test_f1: 0.5277
 epoch: 76, train_loss: 0.8381, test_loss: 1.0022, test_f1: 0.5226
 epoch: 77, train_loss: 0.8375, test_loss: 1.0341, test_f1: 0.5286
 epoch: 78, train_loss: 0.8330, test_loss: 1.0111, test_f1: 0.5153
 epoch: 79, train_loss: 0.8258, test_loss: 1.0083, test_f1: 0.5370
 epoch: 80, train_loss: 0.8227, test_loss: 1.0069, test_f1: 0.5283
 epoch: 81, train_loss: 0.8307, test_loss: 1.0043, test_f1: 0.5441
 epoch: 82, train_loss: 0.8267, test_loss: 1.0239, test_f1: 0.5272
 epoch: 83, train_loss: 0.8252, test_loss: 1.0346, test_f1: 0.5252
 epoch: 84, train_loss: 0.8233, test_loss: 1.0299, test_f1: 0.5276
 epoch: 85, train_loss: 0.8192, test_loss: 1.0392, test_f1: 0.5324
 epoch: 86, train_loss: 0.8261, test_loss: 1.0177, test_f1: 0.5288
 epoch: 87, train_loss: 0.8176, test_loss: 1.0325, test_f1: 0.5420
 epoch: 88, train_loss: 0.8157, test_loss: 1.0319, test_f1: 0.5374
 epoch: 89, train_loss: 0.8091, test_loss: 0.9981, test_f1: 0.5453
 epoch: 90, train_loss: 0.8022, test_loss: 1.0252, test_f1: 0.5441
 epoch: 91, train_loss: 0.8112, test_loss: 1.0268, test_f1: 0.5423
 epoch: 92, train_loss: 0.8168, test_loss: 1.0102, test_f1: 0.5505
 epoch: 93, train_loss: 0.8234, test_loss: 1.0210, test_f1: 0.5573
 epoch: 94, train_loss: 0.8204, test_loss: 1.0466, test_f1: 0.5400
 epoch: 95, train_loss: 0.8141, test_loss: 1.0341, test_f1: 0.5531
 epoch: 96, train_loss: 0.8215, test_loss: 1.0284, test_f1: 0.5340
 epoch: 97, train_loss: 0.8078, test_loss: 1.0332, test_f1: 0.5421
 epoch: 98, train_loss: 0.8202, test_loss: 1.0321, test_f1: 0.5325
 epoch: 99, train_loss: 0.8123, test_loss: 1.0543, test_f1: 0.5336
##################ITERATION #3 ****************************************
 epoch: 0, train_loss: 1.3020, test_loss: 1.2127, test_f1: 0.3651
 epoch: 1, train_loss: 1.2274, test_loss: 1.1768, test_f1: 0.4158
 epoch: 2, train_loss: 1.2100, test_loss: 1.1720, test_f1: 0.4131
 epoch: 3, train_loss: 1.1848, test_loss: 1.1471, test_f1: 0.4408
 epoch: 4, train_loss: 1.1803, test_loss: 1.1299, test_f1: 0.4502
 epoch: 5, train_loss: 1.1736, test_loss: 1.1208, test_f1: 0.4532
 epoch: 6, train_loss: 1.1487, test_loss: 1.1100, test_f1: 0.4571
 epoch: 7, train_loss: 1.1391, test_loss: 1.0932, test_f1: 0.4520
 epoch: 8, train_loss: 1.1176, test_loss: 1.0911, test_f1: 0.4621
 epoch: 9, train_loss: 1.1219, test_loss: 1.0773, test_f1: 0.4707
 epoch: 10, train_loss: 1.1071, test_loss: 1.0696, test_f1: 0.4579
 epoch: 11, train_loss: 1.1031, test_loss: 1.0670, test_f1: 0.4560
 epoch: 12, train_loss: 1.0987, test_loss: 1.0573, test_f1: 0.4791
 epoch: 13, train_loss: 1.0823, test_loss: 1.0563, test_f1: 0.4595
 epoch: 14, train_loss: 1.0803, test_loss: 1.0372, test_f1: 0.4687
 epoch: 15, train_loss: 1.0703, test_loss: 1.0325, test_f1: 0.4759
 epoch: 16, train_loss: 1.0721, test_loss: 1.0296, test_f1: 0.4596
 epoch: 17, train_loss: 1.0561, test_loss: 1.0274, test_f1: 0.4675
 epoch: 18, train_loss: 1.0471, test_loss: 1.0120, test_f1: 0.4724
 epoch: 19, train_loss: 1.0429, test_loss: 1.0178, test_f1: 0.4686
 epoch: 20, train_loss: 1.0377, test_loss: 1.0110, test_f1: 0.4506
 epoch: 21, train_loss: 1.0242, test_loss: 1.0003, test_f1: 0.4553
 epoch: 22, train_loss: 1.0203, test_loss: 1.0077, test_f1: 0.4621
 epoch: 23, train_loss: 1.0234, test_loss: 1.0099, test_f1: 0.4590
 epoch: 24, train_loss: 1.0186, test_loss: 0.9999, test_f1: 0.4647
 epoch: 25, train_loss: 1.0063, test_loss: 0.9891, test_f1: 0.4726
 epoch: 26, train_loss: 1.0050, test_loss: 0.9829, test_f1: 0.4768
 epoch: 27, train_loss: 1.0127, test_loss: 0.9847, test_f1: 0.4710
 epoch: 28, train_loss: 1.0051, test_loss: 0.9837, test_f1: 0.4776
 epoch: 29, train_loss: 0.9968, test_loss: 0.9933, test_f1: 0.4592
 epoch: 30, train_loss: 0.9846, test_loss: 0.9796, test_f1: 0.4725
 epoch: 31, train_loss: 0.9842, test_loss: 0.9858, test_f1: 0.4770
 epoch: 32, train_loss: 0.9754, test_loss: 0.9698, test_f1: 0.4709
 epoch: 33, train_loss: 0.9800, test_loss: 0.9940, test_f1: 0.4751
 epoch: 34, train_loss: 0.9680, test_loss: 0.9793, test_f1: 0.4843
 epoch: 35, train_loss: 0.9678, test_loss: 0.9755, test_f1: 0.4859
 epoch: 36, train_loss: 0.9722, test_loss: 0.9763, test_f1: 0.5077
 epoch: 37, train_loss: 0.9654, test_loss: 0.9795, test_f1: 0.4776
 epoch: 38, train_loss: 0.9657, test_loss: 0.9888, test_f1: 0.4814
 epoch: 39, train_loss: 0.9568, test_loss: 1.0057, test_f1: 0.4902
 epoch: 40, train_loss: 0.9536, test_loss: 0.9899, test_f1: 0.5073
 epoch: 41, train_loss: 0.9542, test_loss: 0.9973, test_f1: 0.4850
 epoch: 42, train_loss: 0.9419, test_loss: 0.9681, test_f1: 0.4983
 epoch: 43, train_loss: 0.9437, test_loss: 1.0028, test_f1: 0.4956
 epoch: 44, train_loss: 0.9385, test_loss: 0.9741, test_f1: 0.5096
 epoch: 45, train_loss: 0.9281, test_loss: 0.9891, test_f1: 0.5083
 epoch: 46, train_loss: 0.9151, test_loss: 0.9773, test_f1: 0.5096
 epoch: 47, train_loss: 0.9242, test_loss: 0.9974, test_f1: 0.5012
 epoch: 48, train_loss: 0.9154, test_loss: 0.9765, test_f1: 0.5113
 epoch: 49, train_loss: 0.9245, test_loss: 0.9850, test_f1: 0.5062
 epoch: 50, train_loss: 0.9080, test_loss: 0.9773, test_f1: 0.5308
 epoch: 51, train_loss: 0.9068, test_loss: 0.9757, test_f1: 0.5160
 epoch: 52, train_loss: 0.9017, test_loss: 0.9866, test_f1: 0.5072
 epoch: 53, train_loss: 0.9046, test_loss: 0.9846, test_f1: 0.5234
 epoch: 54, train_loss: 0.9032, test_loss: 0.9732, test_f1: 0.5267
 epoch: 55, train_loss: 0.9081, test_loss: 0.9802, test_f1: 0.5234
 epoch: 56, train_loss: 0.8873, test_loss: 0.9684, test_f1: 0.5296
 epoch: 57, train_loss: 0.9059, test_loss: 0.9900, test_f1: 0.5134
 epoch: 58, train_loss: 0.9036, test_loss: 0.9696, test_f1: 0.5341
 epoch: 59, train_loss: 0.9000, test_loss: 0.9755, test_f1: 0.5102
 epoch: 60, train_loss: 0.8986, test_loss: 0.9855, test_f1: 0.5310
 epoch: 61, train_loss: 0.8853, test_loss: 0.9777, test_f1: 0.5093
 epoch: 62, train_loss: 0.8943, test_loss: 0.9989, test_f1: 0.5175
 epoch: 63, train_loss: 0.8967, test_loss: 0.9845, test_f1: 0.4981
 epoch: 64, train_loss: 0.8934, test_loss: 0.9975, test_f1: 0.5242
 epoch: 65, train_loss: 0.8953, test_loss: 0.9941, test_f1: 0.4989
 epoch: 66, train_loss: 0.8871, test_loss: 0.9736, test_f1: 0.5312
 epoch: 67, train_loss: 0.8875, test_loss: 0.9719, test_f1: 0.5204
 epoch: 68, train_loss: 0.8834, test_loss: 0.9827, test_f1: 0.5217
 epoch: 69, train_loss: 0.8922, test_loss: 0.9844, test_f1: 0.5276
 epoch: 70, train_loss: 0.8842, test_loss: 0.9885, test_f1: 0.5204
 epoch: 71, train_loss: 0.8838, test_loss: 0.9941, test_f1: 0.5247
 epoch: 72, train_loss: 0.8731, test_loss: 0.9976, test_f1: 0.5399
 epoch: 73, train_loss: 0.8841, test_loss: 0.9961, test_f1: 0.5252
 epoch: 74, train_loss: 0.8653, test_loss: 0.9942, test_f1: 0.5308
 epoch: 75, train_loss: 0.8742, test_loss: 1.0137, test_f1: 0.5098
 epoch: 76, train_loss: 0.8756, test_loss: 1.0055, test_f1: 0.5308
 epoch: 77, train_loss: 0.8664, test_loss: 0.9831, test_f1: 0.5306
 epoch: 78, train_loss: 0.8739, test_loss: 0.9984, test_f1: 0.5226
 epoch: 79, train_loss: 0.8670, test_loss: 0.9907, test_f1: 0.5253
 epoch: 80, train_loss: 0.8720, test_loss: 1.0096, test_f1: 0.5292
 epoch: 81, train_loss: 0.8701, test_loss: 1.0055, test_f1: 0.5423
 epoch: 82, train_loss: 0.8696, test_loss: 0.9970, test_f1: 0.5537
 epoch: 83, train_loss: 0.8741, test_loss: 1.0059, test_f1: 0.5176
 epoch: 84, train_loss: 0.8618, test_loss: 0.9766, test_f1: 0.5327
 epoch: 85, train_loss: 0.8607, test_loss: 1.0163, test_f1: 0.5324
 epoch: 86, train_loss: 0.8480, test_loss: 1.0040, test_f1: 0.5358
 epoch: 87, train_loss: 0.8704, test_loss: 0.9996, test_f1: 0.5259
 epoch: 88, train_loss: 0.8632, test_loss: 1.0076, test_f1: 0.5434
 epoch: 89, train_loss: 0.8553, test_loss: 1.0086, test_f1: 0.5260
 epoch: 90, train_loss: 0.8545, test_loss: 1.0186, test_f1: 0.5316
 epoch: 91, train_loss: 0.8475, test_loss: 1.0193, test_f1: 0.5351
 epoch: 92, train_loss: 0.8515, test_loss: 1.0055, test_f1: 0.5485
 epoch: 93, train_loss: 0.8510, test_loss: 0.9801, test_f1: 0.5517
 epoch: 94, train_loss: 0.8459, test_loss: 1.0381, test_f1: 0.5264
 epoch: 95, train_loss: 0.8502, test_loss: 1.0102, test_f1: 0.5364
 epoch: 96, train_loss: 0.8400, test_loss: 1.0328, test_f1: 0.5355
 epoch: 97, train_loss: 0.8502, test_loss: 1.0026, test_f1: 0.5333
 epoch: 98, train_loss: 0.8487, test_loss: 1.0192, test_f1: 0.5430
 epoch: 99, train_loss: 0.8404, test_loss: 1.0052, test_f1: 0.5233
##################ITERATION #4 ****************************************
 epoch: 0, train_loss: 1.2811, test_loss: 1.2007, test_f1: 0.3562
 epoch: 1, train_loss: 1.2298, test_loss: 1.1801, test_f1: 0.3924
 epoch: 2, train_loss: 1.2000, test_loss: 1.1518, test_f1: 0.4119
 epoch: 3, train_loss: 1.1891, test_loss: 1.1341, test_f1: 0.4264
 epoch: 4, train_loss: 1.1783, test_loss: 1.1169, test_f1: 0.4285
 epoch: 5, train_loss: 1.1613, test_loss: 1.1041, test_f1: 0.4451
 epoch: 6, train_loss: 1.1518, test_loss: 1.0870, test_f1: 0.4471
 epoch: 7, train_loss: 1.1319, test_loss: 1.0794, test_f1: 0.4509
 epoch: 8, train_loss: 1.1166, test_loss: 1.0651, test_f1: 0.4440
 epoch: 9, train_loss: 1.1091, test_loss: 1.0516, test_f1: 0.4438
 epoch: 10, train_loss: 1.1062, test_loss: 1.0338, test_f1: 0.4595
 epoch: 11, train_loss: 1.0810, test_loss: 1.0376, test_f1: 0.4747
 epoch: 12, train_loss: 1.0784, test_loss: 1.0401, test_f1: 0.4599
 epoch: 13, train_loss: 1.0734, test_loss: 1.0130, test_f1: 0.4760
 epoch: 14, train_loss: 1.0637, test_loss: 1.0165, test_f1: 0.4793
 epoch: 15, train_loss: 1.0574, test_loss: 1.0038, test_f1: 0.4873
 epoch: 16, train_loss: 1.0465, test_loss: 1.0009, test_f1: 0.4933
 epoch: 17, train_loss: 1.0373, test_loss: 1.0039, test_f1: 0.4895
 epoch: 18, train_loss: 1.0343, test_loss: 1.0079, test_f1: 0.5016
 epoch: 19, train_loss: 1.0319, test_loss: 0.9950, test_f1: 0.4833
 epoch: 20, train_loss: 1.0257, test_loss: 0.9860, test_f1: 0.4826
 epoch: 21, train_loss: 1.0160, test_loss: 0.9927, test_f1: 0.4835
 epoch: 22, train_loss: 1.0134, test_loss: 0.9810, test_f1: 0.4828
 epoch: 23, train_loss: 0.9995, test_loss: 0.9813, test_f1: 0.4827
 epoch: 24, train_loss: 1.0020, test_loss: 0.9728, test_f1: 0.4931
 epoch: 25, train_loss: 1.0067, test_loss: 0.9718, test_f1: 0.4879
 epoch: 26, train_loss: 0.9850, test_loss: 0.9865, test_f1: 0.4815
 epoch: 27, train_loss: 0.9948, test_loss: 0.9769, test_f1: 0.4892
 epoch: 28, train_loss: 0.9802, test_loss: 0.9977, test_f1: 0.4846
 epoch: 29, train_loss: 0.9811, test_loss: 0.9843, test_f1: 0.4869
 epoch: 30, train_loss: 0.9772, test_loss: 0.9772, test_f1: 0.4914
 epoch: 31, train_loss: 0.9772, test_loss: 0.9665, test_f1: 0.4987
 epoch: 32, train_loss: 0.9789, test_loss: 0.9945, test_f1: 0.4863
 epoch: 33, train_loss: 0.9642, test_loss: 0.9716, test_f1: 0.4847
 epoch: 34, train_loss: 0.9591, test_loss: 0.9837, test_f1: 0.4931
 epoch: 35, train_loss: 0.9644, test_loss: 0.9622, test_f1: 0.4998
 epoch: 36, train_loss: 0.9543, test_loss: 0.9883, test_f1: 0.4787
 epoch: 37, train_loss: 0.9575, test_loss: 0.9829, test_f1: 0.5008
 epoch: 38, train_loss: 0.9546, test_loss: 0.9967, test_f1: 0.4966
 epoch: 39, train_loss: 0.9539, test_loss: 0.9805, test_f1: 0.4936
 epoch: 40, train_loss: 0.9475, test_loss: 0.9739, test_f1: 0.4990
 epoch: 41, train_loss: 0.9491, test_loss: 0.9717, test_f1: 0.4891
 epoch: 42, train_loss: 0.9394, test_loss: 0.9670, test_f1: 0.4719
 epoch: 43, train_loss: 0.9350, test_loss: 0.9850, test_f1: 0.4849
 epoch: 44, train_loss: 0.9478, test_loss: 0.9786, test_f1: 0.4987
 epoch: 45, train_loss: 0.9365, test_loss: 0.9877, test_f1: 0.4903
 epoch: 46, train_loss: 0.9250, test_loss: 0.9775, test_f1: 0.4922
 epoch: 47, train_loss: 0.9322, test_loss: 0.9669, test_f1: 0.5021
 epoch: 48, train_loss: 0.9332, test_loss: 0.9833, test_f1: 0.4925
 epoch: 49, train_loss: 0.9305, test_loss: 0.9617, test_f1: 0.4855
 epoch: 50, train_loss: 0.9230, test_loss: 0.9792, test_f1: 0.5092
 epoch: 51, train_loss: 0.9220, test_loss: 0.9931, test_f1: 0.5029
 epoch: 52, train_loss: 0.9287, test_loss: 0.9888, test_f1: 0.4993
 epoch: 53, train_loss: 0.9066, test_loss: 0.9901, test_f1: 0.4913
 epoch: 54, train_loss: 0.9216, test_loss: 0.9921, test_f1: 0.5014
 epoch: 55, train_loss: 0.9065, test_loss: 0.9673, test_f1: 0.4940
 epoch: 56, train_loss: 0.9006, test_loss: 1.0065, test_f1: 0.4887
 epoch: 57, train_loss: 0.8971, test_loss: 0.9803, test_f1: 0.4914
 epoch: 58, train_loss: 0.9139, test_loss: 0.9921, test_f1: 0.5135
 epoch: 59, train_loss: 0.9046, test_loss: 0.9807, test_f1: 0.4969
 epoch: 60, train_loss: 0.8959, test_loss: 1.0060, test_f1: 0.5058
 epoch: 61, train_loss: 0.9028, test_loss: 0.9812, test_f1: 0.4903
 epoch: 62, train_loss: 0.9031, test_loss: 1.0165, test_f1: 0.4972
 epoch: 63, train_loss: 0.9097, test_loss: 1.0100, test_f1: 0.4997
 epoch: 64, train_loss: 0.9098, test_loss: 0.9837, test_f1: 0.5152
 epoch: 65, train_loss: 0.8977, test_loss: 1.0036, test_f1: 0.4930
 epoch: 66, train_loss: 0.9082, test_loss: 0.9898, test_f1: 0.4996
 epoch: 67, train_loss: 0.9017, test_loss: 0.9825, test_f1: 0.5053
 epoch: 68, train_loss: 0.8957, test_loss: 0.9927, test_f1: 0.5147
 epoch: 69, train_loss: 0.8959, test_loss: 1.0097, test_f1: 0.4991
 epoch: 70, train_loss: 0.8880, test_loss: 0.9771, test_f1: 0.4964
 epoch: 71, train_loss: 0.8928, test_loss: 1.0060, test_f1: 0.5088
 epoch: 72, train_loss: 0.8923, test_loss: 1.0070, test_f1: 0.5093
 epoch: 73, train_loss: 0.9031, test_loss: 0.9944, test_f1: 0.5206
 epoch: 74, train_loss: 0.8871, test_loss: 1.0011, test_f1: 0.5147
 epoch: 75, train_loss: 0.8821, test_loss: 1.0056, test_f1: 0.5096
 epoch: 76, train_loss: 0.8852, test_loss: 1.0114, test_f1: 0.5053
 epoch: 77, train_loss: 0.8891, test_loss: 0.9777, test_f1: 0.5010
 epoch: 78, train_loss: 0.8882, test_loss: 1.0003, test_f1: 0.5096
 epoch: 79, train_loss: 0.8863, test_loss: 1.0056, test_f1: 0.5118
 epoch: 80, train_loss: 0.8803, test_loss: 1.0011, test_f1: 0.5070
 epoch: 81, train_loss: 0.8888, test_loss: 0.9787, test_f1: 0.5066
 epoch: 82, train_loss: 0.8872, test_loss: 1.0104, test_f1: 0.5046
 epoch: 83, train_loss: 0.8869, test_loss: 1.0200, test_f1: 0.5123
 epoch: 84, train_loss: 0.8825, test_loss: 1.0295, test_f1: 0.5130
 epoch: 85, train_loss: 0.8774, test_loss: 1.0035, test_f1: 0.5109
 epoch: 86, train_loss: 0.8876, test_loss: 1.0177, test_f1: 0.5130
 epoch: 87, train_loss: 0.8798, test_loss: 1.0279, test_f1: 0.5168
 epoch: 88, train_loss: 0.8770, test_loss: 1.0225, test_f1: 0.5101
 epoch: 89, train_loss: 0.8705, test_loss: 1.0196, test_f1: 0.5065
 epoch: 90, train_loss: 0.8749, test_loss: 1.0154, test_f1: 0.5125
 epoch: 91, train_loss: 0.8716, test_loss: 1.0338, test_f1: 0.5109
 epoch: 92, train_loss: 0.8689, test_loss: 1.0368, test_f1: 0.5185
 epoch: 93, train_loss: 0.8761, test_loss: 1.0472, test_f1: 0.5116
 epoch: 94, train_loss: 0.8716, test_loss: 0.9916, test_f1: 0.5178
 epoch: 95, train_loss: 0.8641, test_loss: 1.0081, test_f1: 0.5194
 epoch: 96, train_loss: 0.8668, test_loss: 1.0274, test_f1: 0.5114
 epoch: 97, train_loss: 0.8611, test_loss: 1.0519, test_f1: 0.5161
 epoch: 98, train_loss: 0.8564, test_loss: 1.0014, test_f1: 0.5150
 epoch: 99, train_loss: 0.8803, test_loss: 1.0170, test_f1: 0.5167
##################ITERATION #5 ****************************************
 epoch: 0, train_loss: 1.3053, test_loss: 1.1876, test_f1: 0.3786
 epoch: 1, train_loss: 1.2144, test_loss: 1.1495, test_f1: 0.4448
 epoch: 2, train_loss: 1.1944, test_loss: 1.1250, test_f1: 0.4664
 epoch: 3, train_loss: 1.1796, test_loss: 1.1161, test_f1: 0.4710
 epoch: 4, train_loss: 1.1519, test_loss: 1.1008, test_f1: 0.4512
 epoch: 5, train_loss: 1.1423, test_loss: 1.0873, test_f1: 0.4586
 epoch: 6, train_loss: 1.1263, test_loss: 1.0617, test_f1: 0.4628
 epoch: 7, train_loss: 1.1131, test_loss: 1.0540, test_f1: 0.4686
 epoch: 8, train_loss: 1.1004, test_loss: 1.0550, test_f1: 0.4868
 epoch: 9, train_loss: 1.1003, test_loss: 1.0361, test_f1: 0.4929
 epoch: 10, train_loss: 1.0905, test_loss: 1.0327, test_f1: 0.4777
 epoch: 11, train_loss: 1.0900, test_loss: 1.0207, test_f1: 0.4768
 epoch: 12, train_loss: 1.0734, test_loss: 1.0255, test_f1: 0.4554
 epoch: 13, train_loss: 1.0672, test_loss: 1.0118, test_f1: 0.4683
 epoch: 14, train_loss: 1.0466, test_loss: 1.0108, test_f1: 0.4667
 epoch: 15, train_loss: 1.0513, test_loss: 1.0204, test_f1: 0.4739
 epoch: 16, train_loss: 1.0479, test_loss: 0.9999, test_f1: 0.4477
 epoch: 17, train_loss: 1.0370, test_loss: 0.9883, test_f1: 0.4718
 epoch: 18, train_loss: 1.0326, test_loss: 1.0011, test_f1: 0.4574
 epoch: 19, train_loss: 1.0369, test_loss: 0.9865, test_f1: 0.4857
 epoch: 20, train_loss: 1.0280, test_loss: 0.9915, test_f1: 0.4677
 epoch: 21, train_loss: 1.0208, test_loss: 0.9968, test_f1: 0.4669
 epoch: 22, train_loss: 1.0199, test_loss: 0.9862, test_f1: 0.4868
 epoch: 23, train_loss: 1.0227, test_loss: 0.9924, test_f1: 0.4754
 epoch: 24, train_loss: 1.0160, test_loss: 1.0014, test_f1: 0.4483
 epoch: 25, train_loss: 1.0123, test_loss: 0.9667, test_f1: 0.4769
 epoch: 26, train_loss: 1.0057, test_loss: 0.9911, test_f1: 0.4597
 epoch: 27, train_loss: 0.9981, test_loss: 1.0096, test_f1: 0.4567
 epoch: 28, train_loss: 1.0087, test_loss: 1.0054, test_f1: 0.4535
 epoch: 29, train_loss: 0.9827, test_loss: 0.9884, test_f1: 0.4564
 epoch: 30, train_loss: 0.9949, test_loss: 1.0079, test_f1: 0.4548
 epoch: 31, train_loss: 0.9788, test_loss: 0.9750, test_f1: 0.4668
 epoch: 32, train_loss: 0.9864, test_loss: 0.9824, test_f1: 0.4646
 epoch: 33, train_loss: 0.9804, test_loss: 0.9730, test_f1: 0.4719
 epoch: 34, train_loss: 0.9760, test_loss: 0.9862, test_f1: 0.4581
 epoch: 35, train_loss: 0.9782, test_loss: 0.9785, test_f1: 0.4668
 epoch: 36, train_loss: 0.9681, test_loss: 0.9750, test_f1: 0.4744
 epoch: 37, train_loss: 0.9767, test_loss: 0.9741, test_f1: 0.4818
 epoch: 38, train_loss: 0.9589, test_loss: 0.9597, test_f1: 0.4781
 epoch: 39, train_loss: 0.9549, test_loss: 0.9455, test_f1: 0.4817
 epoch: 40, train_loss: 0.9600, test_loss: 0.9852, test_f1: 0.4529
 epoch: 41, train_loss: 0.9564, test_loss: 0.9781, test_f1: 0.4663
 epoch: 42, train_loss: 0.9436, test_loss: 0.9634, test_f1: 0.4703
 epoch: 43, train_loss: 0.9476, test_loss: 0.9561, test_f1: 0.4768
 epoch: 44, train_loss: 0.9426, test_loss: 0.9345, test_f1: 0.5049
 epoch: 45, train_loss: 0.9434, test_loss: 0.9643, test_f1: 0.4664
 epoch: 46, train_loss: 0.9371, test_loss: 0.9410, test_f1: 0.4887
 epoch: 47, train_loss: 0.9239, test_loss: 0.9288, test_f1: 0.4919
 epoch: 48, train_loss: 0.9388, test_loss: 0.9431, test_f1: 0.4790
 epoch: 49, train_loss: 0.9324, test_loss: 0.9403, test_f1: 0.4728
 epoch: 50, train_loss: 0.9267, test_loss: 0.9357, test_f1: 0.4915
 epoch: 51, train_loss: 0.9179, test_loss: 0.9356, test_f1: 0.4928
 epoch: 52, train_loss: 0.9099, test_loss: 0.9350, test_f1: 0.5016
 epoch: 53, train_loss: 0.9178, test_loss: 0.9579, test_f1: 0.4913
 epoch: 54, train_loss: 0.9126, test_loss: 0.9429, test_f1: 0.4993
 epoch: 55, train_loss: 0.9105, test_loss: 0.9355, test_f1: 0.4915
 epoch: 56, train_loss: 0.9105, test_loss: 0.9580, test_f1: 0.4825
 epoch: 57, train_loss: 0.9096, test_loss: 0.9397, test_f1: 0.4771
 epoch: 58, train_loss: 0.9087, test_loss: 0.9256, test_f1: 0.5041
 epoch: 59, train_loss: 0.9053, test_loss: 0.9433, test_f1: 0.5015
 epoch: 60, train_loss: 0.8941, test_loss: 0.9246, test_f1: 0.5149
 epoch: 61, train_loss: 0.9144, test_loss: 0.9367, test_f1: 0.4875
 epoch: 62, train_loss: 0.9063, test_loss: 0.9217, test_f1: 0.5058
 epoch: 63, train_loss: 0.8994, test_loss: 0.9210, test_f1: 0.5006
 epoch: 64, train_loss: 0.9065, test_loss: 0.9258, test_f1: 0.4955
 epoch: 65, train_loss: 0.9122, test_loss: 0.9407, test_f1: 0.4948
 epoch: 66, train_loss: 0.8891, test_loss: 0.9284, test_f1: 0.5051
 epoch: 67, train_loss: 0.9035, test_loss: 0.9734, test_f1: 0.4723
 epoch: 68, train_loss: 0.9010, test_loss: 0.9231, test_f1: 0.5003
 epoch: 69, train_loss: 0.8966, test_loss: 0.9291, test_f1: 0.4906
 epoch: 70, train_loss: 0.8983, test_loss: 0.9414, test_f1: 0.4876
 epoch: 71, train_loss: 0.8951, test_loss: 0.9665, test_f1: 0.4806
 epoch: 72, train_loss: 0.9013, test_loss: 0.9348, test_f1: 0.5032
 epoch: 73, train_loss: 0.8993, test_loss: 0.9416, test_f1: 0.5000
 epoch: 74, train_loss: 0.8847, test_loss: 0.9309, test_f1: 0.4921
 epoch: 75, train_loss: 0.8843, test_loss: 0.9188, test_f1: 0.5000
 epoch: 76, train_loss: 0.8823, test_loss: 0.9210, test_f1: 0.5101
 epoch: 77, train_loss: 0.8900, test_loss: 0.9692, test_f1: 0.4767
 epoch: 78, train_loss: 0.8895, test_loss: 0.9261, test_f1: 0.5030
 epoch: 79, train_loss: 0.8832, test_loss: 0.9426, test_f1: 0.5040
 epoch: 80, train_loss: 0.8768, test_loss: 0.9356, test_f1: 0.5120
 epoch: 81, train_loss: 0.8769, test_loss: 0.9861, test_f1: 0.4818
 epoch: 82, train_loss: 0.8722, test_loss: 0.9549, test_f1: 0.4940
 epoch: 83, train_loss: 0.8781, test_loss: 0.9758, test_f1: 0.4821
 epoch: 84, train_loss: 0.8762, test_loss: 0.9282, test_f1: 0.4999
 epoch: 85, train_loss: 0.8690, test_loss: 0.9816, test_f1: 0.4809
 epoch: 86, train_loss: 0.8815, test_loss: 0.9549, test_f1: 0.5055
 epoch: 87, train_loss: 0.8843, test_loss: 0.9403, test_f1: 0.4940
 epoch: 88, train_loss: 0.8750, test_loss: 0.9438, test_f1: 0.4932
 epoch: 89, train_loss: 0.8766, test_loss: 0.9398, test_f1: 0.5266
 epoch: 90, train_loss: 0.8757, test_loss: 0.9639, test_f1: 0.5019
 epoch: 91, train_loss: 0.8637, test_loss: 0.9536, test_f1: 0.5072
 epoch: 92, train_loss: 0.8648, test_loss: 0.9542, test_f1: 0.5070
 epoch: 93, train_loss: 0.8800, test_loss: 0.9398, test_f1: 0.5026
 epoch: 94, train_loss: 0.8629, test_loss: 0.9960, test_f1: 0.4979
 epoch: 95, train_loss: 0.8751, test_loss: 0.9362, test_f1: 0.5065
 epoch: 96, train_loss: 0.8678, test_loss: 0.9642, test_f1: 0.5031
 epoch: 97, train_loss: 0.8683, test_loss: 0.9607, test_f1: 0.5128
 epoch: 98, train_loss: 0.8705, test_loss: 0.9621, test_f1: 0.5208
 epoch: 99, train_loss: 0.8617, test_loss: 0.9452, test_f1: 0.5067
##################ITERATION #6 ****************************************
 epoch: 0, train_loss: 1.3382, test_loss: 1.1895, test_f1: 0.3831
 epoch: 1, train_loss: 1.2318, test_loss: 1.1650, test_f1: 0.4070
 epoch: 2, train_loss: 1.2074, test_loss: 1.1479, test_f1: 0.4298
 epoch: 3, train_loss: 1.1953, test_loss: 1.1281, test_f1: 0.4386
 epoch: 4, train_loss: 1.1847, test_loss: 1.1147, test_f1: 0.4404
 epoch: 5, train_loss: 1.1631, test_loss: 1.1107, test_f1: 0.4290
 epoch: 6, train_loss: 1.1512, test_loss: 1.1017, test_f1: 0.4525
 epoch: 7, train_loss: 1.1312, test_loss: 1.0869, test_f1: 0.4556
 epoch: 8, train_loss: 1.1289, test_loss: 1.0789, test_f1: 0.4547
 epoch: 9, train_loss: 1.1209, test_loss: 1.0774, test_f1: 0.4517
 epoch: 10, train_loss: 1.1197, test_loss: 1.0600, test_f1: 0.4650
 epoch: 11, train_loss: 1.1017, test_loss: 1.0623, test_f1: 0.4532
 epoch: 12, train_loss: 1.1018, test_loss: 1.0649, test_f1: 0.4432
 epoch: 13, train_loss: 1.0777, test_loss: 1.0462, test_f1: 0.4551
 epoch: 14, train_loss: 1.0857, test_loss: 1.0402, test_f1: 0.4638
 epoch: 15, train_loss: 1.0677, test_loss: 1.0289, test_f1: 0.4320
 epoch: 16, train_loss: 1.0636, test_loss: 1.0290, test_f1: 0.4377
 epoch: 17, train_loss: 1.0622, test_loss: 1.0113, test_f1: 0.4451
 epoch: 18, train_loss: 1.0626, test_loss: 1.0181, test_f1: 0.4443
 epoch: 19, train_loss: 1.0502, test_loss: 1.0046, test_f1: 0.4516
 epoch: 20, train_loss: 1.0538, test_loss: 1.0005, test_f1: 0.4473
 epoch: 21, train_loss: 1.0338, test_loss: 0.9887, test_f1: 0.4756
 epoch: 22, train_loss: 1.0268, test_loss: 0.9999, test_f1: 0.4781
 epoch: 23, train_loss: 1.0264, test_loss: 1.0027, test_f1: 0.4533
 epoch: 24, train_loss: 1.0297, test_loss: 0.9991, test_f1: 0.4451
 epoch: 25, train_loss: 1.0090, test_loss: 0.9944, test_f1: 0.4743
 epoch: 26, train_loss: 1.0177, test_loss: 0.9817, test_f1: 0.4578
 epoch: 27, train_loss: 1.0031, test_loss: 0.9933, test_f1: 0.4401
 epoch: 28, train_loss: 1.0008, test_loss: 0.9852, test_f1: 0.4629
 epoch: 29, train_loss: 1.0008, test_loss: 0.9752, test_f1: 0.4734
 epoch: 30, train_loss: 0.9949, test_loss: 0.9771, test_f1: 0.4594
 epoch: 31, train_loss: 0.9915, test_loss: 0.9734, test_f1: 0.4768
 epoch: 32, train_loss: 0.9834, test_loss: 0.9898, test_f1: 0.4609
 epoch: 33, train_loss: 0.9747, test_loss: 0.9827, test_f1: 0.4799
 epoch: 34, train_loss: 0.9838, test_loss: 0.9999, test_f1: 0.4643
 epoch: 35, train_loss: 0.9701, test_loss: 0.9926, test_f1: 0.4521
 epoch: 36, train_loss: 0.9817, test_loss: 0.9801, test_f1: 0.4703
 epoch: 37, train_loss: 0.9599, test_loss: 0.9870, test_f1: 0.4486
 epoch: 38, train_loss: 0.9596, test_loss: 0.9854, test_f1: 0.4582
 epoch: 39, train_loss: 0.9580, test_loss: 0.9872, test_f1: 0.4413
 epoch: 40, train_loss: 0.9569, test_loss: 0.9964, test_f1: 0.4690
 epoch: 41, train_loss: 0.9531, test_loss: 0.9894, test_f1: 0.4801
 epoch: 42, train_loss: 0.9496, test_loss: 0.9710, test_f1: 0.4741
 epoch: 43, train_loss: 0.9444, test_loss: 0.9797, test_f1: 0.4770
 epoch: 44, train_loss: 0.9450, test_loss: 0.9818, test_f1: 0.4694
 epoch: 45, train_loss: 0.9433, test_loss: 0.9739, test_f1: 0.4504
 epoch: 46, train_loss: 0.9279, test_loss: 0.9816, test_f1: 0.4787
 epoch: 47, train_loss: 0.9296, test_loss: 0.9899, test_f1: 0.4492
 epoch: 48, train_loss: 0.9238, test_loss: 0.9779, test_f1: 0.4563
 epoch: 49, train_loss: 0.9178, test_loss: 0.9900, test_f1: 0.4727
 epoch: 50, train_loss: 0.9228, test_loss: 0.9924, test_f1: 0.4666
 epoch: 51, train_loss: 0.9169, test_loss: 0.9766, test_f1: 0.4756
 epoch: 52, train_loss: 0.9132, test_loss: 0.9938, test_f1: 0.4633
 epoch: 53, train_loss: 0.9201, test_loss: 1.0010, test_f1: 0.4407
 epoch: 54, train_loss: 0.9035, test_loss: 0.9912, test_f1: 0.4644
 epoch: 55, train_loss: 0.9073, test_loss: 0.9883, test_f1: 0.4710
 epoch: 56, train_loss: 0.9037, test_loss: 0.9854, test_f1: 0.4638
 epoch: 57, train_loss: 0.9003, test_loss: 0.9865, test_f1: 0.4689
 epoch: 58, train_loss: 0.9105, test_loss: 0.9888, test_f1: 0.4662
 epoch: 59, train_loss: 0.8939, test_loss: 1.0009, test_f1: 0.4591
 epoch: 60, train_loss: 0.9051, test_loss: 0.9924, test_f1: 0.4619
 epoch: 61, train_loss: 0.9027, test_loss: 1.0067, test_f1: 0.4609
 epoch: 62, train_loss: 0.8920, test_loss: 1.0025, test_f1: 0.4663
 epoch: 63, train_loss: 0.8806, test_loss: 1.0349, test_f1: 0.4359
 epoch: 64, train_loss: 0.9010, test_loss: 1.0085, test_f1: 0.4501
 epoch: 65, train_loss: 0.8885, test_loss: 0.9958, test_f1: 0.4738
 epoch: 66, train_loss: 0.8952, test_loss: 0.9952, test_f1: 0.4779
 epoch: 67, train_loss: 0.8987, test_loss: 1.0358, test_f1: 0.4481
 epoch: 68, train_loss: 0.8884, test_loss: 1.0108, test_f1: 0.4531
 epoch: 69, train_loss: 0.8941, test_loss: 1.0001, test_f1: 0.4433
 epoch: 70, train_loss: 0.8904, test_loss: 1.0239, test_f1: 0.4451
 epoch: 71, train_loss: 0.8851, test_loss: 1.0019, test_f1: 0.4724
 epoch: 72, train_loss: 0.8907, test_loss: 1.0081, test_f1: 0.4497
 epoch: 73, train_loss: 0.8781, test_loss: 1.0248, test_f1: 0.4569
 epoch: 74, train_loss: 0.8831, test_loss: 1.0306, test_f1: 0.4454
 epoch: 75, train_loss: 0.8812, test_loss: 0.9966, test_f1: 0.4681
 epoch: 76, train_loss: 0.8752, test_loss: 1.0264, test_f1: 0.4429
 epoch: 77, train_loss: 0.8697, test_loss: 0.9972, test_f1: 0.4604
 epoch: 78, train_loss: 0.8802, test_loss: 1.0375, test_f1: 0.4292
 epoch: 79, train_loss: 0.8699, test_loss: 1.0161, test_f1: 0.4451
 epoch: 80, train_loss: 0.8631, test_loss: 1.0164, test_f1: 0.4677
 epoch: 81, train_loss: 0.8706, test_loss: 1.0193, test_f1: 0.4617
 epoch: 82, train_loss: 0.8650, test_loss: 0.9918, test_f1: 0.4920
 epoch: 83, train_loss: 0.8624, test_loss: 1.0135, test_f1: 0.4688
 epoch: 84, train_loss: 0.8691, test_loss: 1.0018, test_f1: 0.4856
 epoch: 85, train_loss: 0.8665, test_loss: 0.9938, test_f1: 0.4829
 epoch: 86, train_loss: 0.8544, test_loss: 0.9924, test_f1: 0.4719
 epoch: 87, train_loss: 0.8707, test_loss: 1.0195, test_f1: 0.4712
 epoch: 88, train_loss: 0.8629, test_loss: 1.0297, test_f1: 0.4757
 epoch: 89, train_loss: 0.8718, test_loss: 1.0294, test_f1: 0.4465
 epoch: 90, train_loss: 0.8553, test_loss: 1.0646, test_f1: 0.4443
 epoch: 91, train_loss: 0.8566, test_loss: 1.0625, test_f1: 0.4431
 epoch: 92, train_loss: 0.8599, test_loss: 1.0525, test_f1: 0.4612
 epoch: 93, train_loss: 0.8625, test_loss: 1.0424, test_f1: 0.4562
 epoch: 94, train_loss: 0.8448, test_loss: 1.0073, test_f1: 0.4580
 epoch: 95, train_loss: 0.8483, test_loss: 1.0423, test_f1: 0.4559
 epoch: 96, train_loss: 0.8564, test_loss: 1.0233, test_f1: 0.4794
 epoch: 97, train_loss: 0.8444, test_loss: 1.0542, test_f1: 0.4632
 epoch: 98, train_loss: 0.8623, test_loss: 1.0388, test_f1: 0.4564
 epoch: 99, train_loss: 0.8518, test_loss: 1.0230, test_f1: 0.4674
##################ITERATION #7 ****************************************
 epoch: 0, train_loss: 1.3271, test_loss: 1.2078, test_f1: 0.4066
 epoch: 1, train_loss: 1.2512, test_loss: 1.1842, test_f1: 0.4087
 epoch: 2, train_loss: 1.2306, test_loss: 1.1698, test_f1: 0.3793
 epoch: 3, train_loss: 1.2286, test_loss: 1.1638, test_f1: 0.4006
 epoch: 4, train_loss: 1.2068, test_loss: 1.1405, test_f1: 0.4428
 epoch: 5, train_loss: 1.1795, test_loss: 1.1315, test_f1: 0.4480
 epoch: 6, train_loss: 1.1792, test_loss: 1.1219, test_f1: 0.4428
 epoch: 7, train_loss: 1.1692, test_loss: 1.1115, test_f1: 0.4653
 epoch: 8, train_loss: 1.1537, test_loss: 1.0986, test_f1: 0.4425
 epoch: 9, train_loss: 1.1476, test_loss: 1.0890, test_f1: 0.4667
 epoch: 10, train_loss: 1.1354, test_loss: 1.0867, test_f1: 0.4189
 epoch: 11, train_loss: 1.1361, test_loss: 1.0796, test_f1: 0.4140
 epoch: 12, train_loss: 1.1297, test_loss: 1.0665, test_f1: 0.4207
 epoch: 13, train_loss: 1.1189, test_loss: 1.0650, test_f1: 0.4309
 epoch: 14, train_loss: 1.1070, test_loss: 1.0595, test_f1: 0.4236
 epoch: 15, train_loss: 1.1039, test_loss: 1.0477, test_f1: 0.4393
 epoch: 16, train_loss: 1.0917, test_loss: 1.0475, test_f1: 0.4117
 epoch: 17, train_loss: 1.0846, test_loss: 1.0332, test_f1: 0.4339
 epoch: 18, train_loss: 1.0773, test_loss: 1.0368, test_f1: 0.4271
 epoch: 19, train_loss: 1.0731, test_loss: 1.0294, test_f1: 0.4361
 epoch: 20, train_loss: 1.0697, test_loss: 1.0279, test_f1: 0.4320
 epoch: 21, train_loss: 1.0617, test_loss: 1.0179, test_f1: 0.4424
 epoch: 22, train_loss: 1.0511, test_loss: 1.0147, test_f1: 0.4404
 epoch: 23, train_loss: 1.0478, test_loss: 1.0071, test_f1: 0.4488
 epoch: 24, train_loss: 1.0363, test_loss: 1.0188, test_f1: 0.4355
 epoch: 25, train_loss: 1.0324, test_loss: 1.0052, test_f1: 0.4447
 epoch: 26, train_loss: 1.0379, test_loss: 0.9950, test_f1: 0.4521
 epoch: 27, train_loss: 1.0306, test_loss: 1.0038, test_f1: 0.4381
 epoch: 28, train_loss: 1.0330, test_loss: 1.0021, test_f1: 0.4449
 epoch: 29, train_loss: 1.0254, test_loss: 0.9904, test_f1: 0.4517
 epoch: 30, train_loss: 1.0110, test_loss: 0.9872, test_f1: 0.4484
 epoch: 31, train_loss: 1.0114, test_loss: 0.9935, test_f1: 0.4413
 epoch: 32, train_loss: 1.0087, test_loss: 1.0045, test_f1: 0.4411
 epoch: 33, train_loss: 0.9995, test_loss: 0.9840, test_f1: 0.4579
 epoch: 34, train_loss: 1.0025, test_loss: 0.9988, test_f1: 0.4452
 epoch: 35, train_loss: 0.9932, test_loss: 0.9881, test_f1: 0.4505
 epoch: 36, train_loss: 1.0023, test_loss: 0.9841, test_f1: 0.4480
 epoch: 37, train_loss: 0.9931, test_loss: 0.9954, test_f1: 0.4610
 epoch: 38, train_loss: 0.9861, test_loss: 0.9958, test_f1: 0.4377
 epoch: 39, train_loss: 0.9892, test_loss: 0.9979, test_f1: 0.4351
 epoch: 40, train_loss: 0.9726, test_loss: 0.9845, test_f1: 0.4638
 epoch: 41, train_loss: 0.9863, test_loss: 0.9941, test_f1: 0.4571
 epoch: 42, train_loss: 0.9789, test_loss: 0.9998, test_f1: 0.4479
 epoch: 43, train_loss: 0.9665, test_loss: 0.9919, test_f1: 0.4820
 epoch: 44, train_loss: 0.9691, test_loss: 0.9653, test_f1: 0.4575
 epoch: 45, train_loss: 0.9670, test_loss: 0.9768, test_f1: 0.4483
 epoch: 46, train_loss: 0.9633, test_loss: 0.9921, test_f1: 0.4583
 epoch: 47, train_loss: 0.9550, test_loss: 0.9906, test_f1: 0.4756
 epoch: 48, train_loss: 0.9579, test_loss: 0.9819, test_f1: 0.4665
 epoch: 49, train_loss: 0.9544, test_loss: 0.9890, test_f1: 0.4612
 epoch: 50, train_loss: 0.9582, test_loss: 0.9715, test_f1: 0.4495
 epoch: 51, train_loss: 0.9466, test_loss: 0.9874, test_f1: 0.4538
 epoch: 52, train_loss: 0.9551, test_loss: 0.9803, test_f1: 0.4604
 epoch: 53, train_loss: 0.9400, test_loss: 0.9821, test_f1: 0.4537
 epoch: 54, train_loss: 0.9512, test_loss: 0.9910, test_f1: 0.4576
 epoch: 55, train_loss: 0.9356, test_loss: 0.9859, test_f1: 0.4990
 epoch: 56, train_loss: 0.9390, test_loss: 0.9649, test_f1: 0.4965
 epoch: 57, train_loss: 0.9366, test_loss: 0.9781, test_f1: 0.4855
 epoch: 58, train_loss: 0.9450, test_loss: 0.9844, test_f1: 0.4991
 epoch: 59, train_loss: 0.9298, test_loss: 0.9811, test_f1: 0.4774
 epoch: 60, train_loss: 0.9324, test_loss: 0.9856, test_f1: 0.4581
 epoch: 61, train_loss: 0.9380, test_loss: 0.9862, test_f1: 0.4533
 epoch: 62, train_loss: 0.9255, test_loss: 0.9807, test_f1: 0.4942
 epoch: 63, train_loss: 0.9296, test_loss: 0.9597, test_f1: 0.4782
 epoch: 64, train_loss: 0.9286, test_loss: 0.9825, test_f1: 0.4849
 epoch: 65, train_loss: 0.9303, test_loss: 0.9719, test_f1: 0.4872
 epoch: 66, train_loss: 0.9331, test_loss: 1.0002, test_f1: 0.4729
 epoch: 67, train_loss: 0.9294, test_loss: 0.9793, test_f1: 0.4685
 epoch: 68, train_loss: 0.9222, test_loss: 0.9791, test_f1: 0.4759
 epoch: 69, train_loss: 0.9178, test_loss: 0.9778, test_f1: 0.4567
 epoch: 70, train_loss: 0.9279, test_loss: 0.9780, test_f1: 0.5062
 epoch: 71, train_loss: 0.9187, test_loss: 0.9825, test_f1: 0.5003
 epoch: 72, train_loss: 0.9246, test_loss: 0.9654, test_f1: 0.4843
 epoch: 73, train_loss: 0.9272, test_loss: 0.9794, test_f1: 0.4983
 epoch: 74, train_loss: 0.9266, test_loss: 0.9930, test_f1: 0.4764
 epoch: 75, train_loss: 0.9219, test_loss: 0.9709, test_f1: 0.4788
 epoch: 76, train_loss: 0.9091, test_loss: 0.9807, test_f1: 0.4828
 epoch: 77, train_loss: 0.9117, test_loss: 0.9673, test_f1: 0.4865
 epoch: 78, train_loss: 0.9107, test_loss: 0.9837, test_f1: 0.4913
 epoch: 79, train_loss: 0.9065, test_loss: 0.9790, test_f1: 0.4958
 epoch: 80, train_loss: 0.9205, test_loss: 0.9743, test_f1: 0.5011
 epoch: 81, train_loss: 0.9023, test_loss: 0.9781, test_f1: 0.4948
 epoch: 82, train_loss: 0.9000, test_loss: 0.9807, test_f1: 0.5160
 epoch: 83, train_loss: 0.9027, test_loss: 0.9939, test_f1: 0.4947
 epoch: 84, train_loss: 0.9092, test_loss: 0.9667, test_f1: 0.4797
 epoch: 85, train_loss: 0.9055, test_loss: 0.9604, test_f1: 0.4782
 epoch: 86, train_loss: 0.8987, test_loss: 0.9746, test_f1: 0.4861
 epoch: 87, train_loss: 0.9062, test_loss: 0.9917, test_f1: 0.5019
 epoch: 88, train_loss: 0.9041, test_loss: 0.9761, test_f1: 0.5004
 epoch: 89, train_loss: 0.9002, test_loss: 0.9785, test_f1: 0.4774
 epoch: 90, train_loss: 0.9028, test_loss: 0.9777, test_f1: 0.4893
 epoch: 91, train_loss: 0.9049, test_loss: 0.9934, test_f1: 0.4918
 epoch: 92, train_loss: 0.9023, test_loss: 0.9795, test_f1: 0.4957
 epoch: 93, train_loss: 0.8994, test_loss: 0.9706, test_f1: 0.5051
 epoch: 94, train_loss: 0.8923, test_loss: 0.9703, test_f1: 0.4722
 epoch: 95, train_loss: 0.9101, test_loss: 0.9838, test_f1: 0.4852
 epoch: 96, train_loss: 0.8955, test_loss: 0.9894, test_f1: 0.4708
 epoch: 97, train_loss: 0.8975, test_loss: 0.9835, test_f1: 0.5097
 epoch: 98, train_loss: 0.8922, test_loss: 0.9757, test_f1: 0.4962
 epoch: 99, train_loss: 0.8884, test_loss: 0.9692, test_f1: 0.5172
##################ITERATION #8 ****************************************
 epoch: 0, train_loss: 1.3596, test_loss: 1.1988, test_f1: 0.3478
 epoch: 1, train_loss: 1.2580, test_loss: 1.1728, test_f1: 0.4171
 epoch: 2, train_loss: 1.2333, test_loss: 1.1483, test_f1: 0.4187
 epoch: 3, train_loss: 1.2136, test_loss: 1.1498, test_f1: 0.4002
 epoch: 4, train_loss: 1.2000, test_loss: 1.1294, test_f1: 0.4213
 epoch: 5, train_loss: 1.1778, test_loss: 1.1079, test_f1: 0.4369
 epoch: 6, train_loss: 1.1740, test_loss: 1.1158, test_f1: 0.4375
 epoch: 7, train_loss: 1.1588, test_loss: 1.0928, test_f1: 0.4510
 epoch: 8, train_loss: 1.1476, test_loss: 1.0730, test_f1: 0.4776
 epoch: 9, train_loss: 1.1332, test_loss: 1.0727, test_f1: 0.4681
 epoch: 10, train_loss: 1.1218, test_loss: 1.0562, test_f1: 0.4821
 epoch: 11, train_loss: 1.1164, test_loss: 1.0456, test_f1: 0.4857
 epoch: 12, train_loss: 1.1071, test_loss: 1.0339, test_f1: 0.4812
 epoch: 13, train_loss: 1.0962, test_loss: 1.0286, test_f1: 0.4873
 epoch: 14, train_loss: 1.0825, test_loss: 1.0244, test_f1: 0.4889
 epoch: 15, train_loss: 1.0869, test_loss: 1.0057, test_f1: 0.4779
 epoch: 16, train_loss: 1.0736, test_loss: 1.0079, test_f1: 0.4790
 epoch: 17, train_loss: 1.0619, test_loss: 1.0019, test_f1: 0.5003
 epoch: 18, train_loss: 1.0590, test_loss: 0.9970, test_f1: 0.5173
 epoch: 19, train_loss: 1.0601, test_loss: 0.9929, test_f1: 0.4895
 epoch: 20, train_loss: 1.0478, test_loss: 0.9755, test_f1: 0.4959
 epoch: 21, train_loss: 1.0334, test_loss: 0.9820, test_f1: 0.5166
 epoch: 22, train_loss: 1.0356, test_loss: 0.9900, test_f1: 0.5046
 epoch: 23, train_loss: 1.0294, test_loss: 0.9664, test_f1: 0.5078
 epoch: 24, train_loss: 1.0227, test_loss: 0.9684, test_f1: 0.5153
 epoch: 25, train_loss: 1.0257, test_loss: 0.9607, test_f1: 0.4848
 epoch: 26, train_loss: 1.0167, test_loss: 0.9533, test_f1: 0.5031
 epoch: 27, train_loss: 1.0074, test_loss: 0.9511, test_f1: 0.5052
 epoch: 28, train_loss: 0.9930, test_loss: 0.9587, test_f1: 0.4942
 epoch: 29, train_loss: 0.9996, test_loss: 0.9517, test_f1: 0.5049
 epoch: 30, train_loss: 0.9908, test_loss: 0.9627, test_f1: 0.4828
 epoch: 31, train_loss: 0.9871, test_loss: 0.9546, test_f1: 0.4808
 epoch: 32, train_loss: 0.9898, test_loss: 0.9492, test_f1: 0.5078
 epoch: 33, train_loss: 0.9816, test_loss: 0.9430, test_f1: 0.4835
 epoch: 34, train_loss: 0.9834, test_loss: 0.9394, test_f1: 0.5091
 epoch: 35, train_loss: 0.9800, test_loss: 0.9476, test_f1: 0.4986
 epoch: 36, train_loss: 0.9661, test_loss: 0.9361, test_f1: 0.5002
 epoch: 37, train_loss: 0.9611, test_loss: 0.9494, test_f1: 0.4916
 epoch: 38, train_loss: 0.9496, test_loss: 0.9354, test_f1: 0.5053
 epoch: 39, train_loss: 0.9471, test_loss: 0.9335, test_f1: 0.5110
 epoch: 40, train_loss: 0.9448, test_loss: 0.9128, test_f1: 0.5196
 epoch: 41, train_loss: 0.9375, test_loss: 0.9225, test_f1: 0.5007
 epoch: 42, train_loss: 0.9323, test_loss: 0.9059, test_f1: 0.5189
 epoch: 43, train_loss: 0.9318, test_loss: 0.9235, test_f1: 0.5192
 epoch: 44, train_loss: 0.9252, test_loss: 0.9146, test_f1: 0.5022
 epoch: 45, train_loss: 0.9411, test_loss: 0.9298, test_f1: 0.5014
 epoch: 46, train_loss: 0.9292, test_loss: 0.9323, test_f1: 0.5057
 epoch: 47, train_loss: 0.9170, test_loss: 0.9124, test_f1: 0.5170
 epoch: 48, train_loss: 0.9162, test_loss: 0.9360, test_f1: 0.5027
 epoch: 49, train_loss: 0.9088, test_loss: 0.9386, test_f1: 0.5017
 epoch: 50, train_loss: 0.9041, test_loss: 0.9347, test_f1: 0.4921
 epoch: 51, train_loss: 0.8996, test_loss: 0.9409, test_f1: 0.4855
 epoch: 52, train_loss: 0.9105, test_loss: 0.9241, test_f1: 0.5048
 epoch: 53, train_loss: 0.8927, test_loss: 0.9206, test_f1: 0.4996
 epoch: 54, train_loss: 0.8950, test_loss: 0.9202, test_f1: 0.5043
 epoch: 55, train_loss: 0.8924, test_loss: 0.9524, test_f1: 0.5029
 epoch: 56, train_loss: 0.8926, test_loss: 0.9133, test_f1: 0.4956
 epoch: 57, train_loss: 0.8808, test_loss: 0.9370, test_f1: 0.4844
 epoch: 58, train_loss: 0.8970, test_loss: 0.9467, test_f1: 0.5076
 epoch: 59, train_loss: 0.8997, test_loss: 0.9138, test_f1: 0.5177
 epoch: 60, train_loss: 0.8821, test_loss: 0.9372, test_f1: 0.5059
 epoch: 61, train_loss: 0.8867, test_loss: 0.9215, test_f1: 0.4935
 epoch: 62, train_loss: 0.8873, test_loss: 0.9601, test_f1: 0.5077
 epoch: 63, train_loss: 0.8864, test_loss: 0.9293, test_f1: 0.5094
 epoch: 64, train_loss: 0.8816, test_loss: 0.9559, test_f1: 0.4892
 epoch: 65, train_loss: 0.8848, test_loss: 0.9340, test_f1: 0.5120
 epoch: 66, train_loss: 0.8733, test_loss: 0.9370, test_f1: 0.4939
 epoch: 67, train_loss: 0.8820, test_loss: 0.9866, test_f1: 0.4945
 epoch: 68, train_loss: 0.8858, test_loss: 0.9264, test_f1: 0.4932
 epoch: 69, train_loss: 0.8840, test_loss: 0.9314, test_f1: 0.5165
 epoch: 70, train_loss: 0.8623, test_loss: 0.9454, test_f1: 0.5080
 epoch: 71, train_loss: 0.8632, test_loss: 0.9529, test_f1: 0.5099
 epoch: 72, train_loss: 0.8799, test_loss: 0.9509, test_f1: 0.4901
 epoch: 73, train_loss: 0.8717, test_loss: 0.9448, test_f1: 0.5050
 epoch: 74, train_loss: 0.8572, test_loss: 0.9274, test_f1: 0.4877
 epoch: 75, train_loss: 0.8599, test_loss: 0.9282, test_f1: 0.5093
 epoch: 76, train_loss: 0.8656, test_loss: 0.9455, test_f1: 0.4891
 epoch: 77, train_loss: 0.8635, test_loss: 0.9388, test_f1: 0.4944
 epoch: 78, train_loss: 0.8573, test_loss: 0.9400, test_f1: 0.4968
 epoch: 79, train_loss: 0.8598, test_loss: 0.9378, test_f1: 0.4985
 epoch: 80, train_loss: 0.8599, test_loss: 1.0007, test_f1: 0.4990
 epoch: 81, train_loss: 0.8635, test_loss: 0.9453, test_f1: 0.5289
 epoch: 82, train_loss: 0.8612, test_loss: 0.9516, test_f1: 0.5118
 epoch: 83, train_loss: 0.8634, test_loss: 0.9493, test_f1: 0.5115
 epoch: 84, train_loss: 0.8514, test_loss: 0.9553, test_f1: 0.5070
 epoch: 85, train_loss: 0.8483, test_loss: 0.9824, test_f1: 0.5239
 epoch: 86, train_loss: 0.8510, test_loss: 0.9624, test_f1: 0.5102
 epoch: 87, train_loss: 0.8546, test_loss: 0.9608, test_f1: 0.5110
 epoch: 88, train_loss: 0.8489, test_loss: 0.9447, test_f1: 0.5156
 epoch: 89, train_loss: 0.8547, test_loss: 0.9643, test_f1: 0.5110
 epoch: 90, train_loss: 0.8441, test_loss: 0.9608, test_f1: 0.5172
 epoch: 91, train_loss: 0.8413, test_loss: 0.9678, test_f1: 0.5269
 epoch: 92, train_loss: 0.8437, test_loss: 0.9536, test_f1: 0.5229
 epoch: 93, train_loss: 0.8450, test_loss: 0.9602, test_f1: 0.5162
 epoch: 94, train_loss: 0.8556, test_loss: 0.9759, test_f1: 0.5347
 epoch: 95, train_loss: 0.8259, test_loss: 0.9643, test_f1: 0.5239
 epoch: 96, train_loss: 0.8300, test_loss: 0.9641, test_f1: 0.5127
 epoch: 97, train_loss: 0.8417, test_loss: 0.9795, test_f1: 0.5132
 epoch: 98, train_loss: 0.8294, test_loss: 0.9721, test_f1: 0.5287
 epoch: 99, train_loss: 0.8304, test_loss: 0.9954, test_f1: 0.5110
##################ITERATION #9 ****************************************
 epoch: 0, train_loss: 1.3569, test_loss: 1.2150, test_f1: 0.3183
 epoch: 1, train_loss: 1.2630, test_loss: 1.1742, test_f1: 0.3876
 epoch: 2, train_loss: 1.2409, test_loss: 1.1539, test_f1: 0.3829
 epoch: 3, train_loss: 1.2304, test_loss: 1.1492, test_f1: 0.3827
 epoch: 4, train_loss: 1.2062, test_loss: 1.1203, test_f1: 0.4199
 epoch: 5, train_loss: 1.1840, test_loss: 1.1735, test_f1: 0.4259
 epoch: 6, train_loss: 1.1684, test_loss: 1.0931, test_f1: 0.4424
 epoch: 7, train_loss: 1.1443, test_loss: 1.0858, test_f1: 0.4394
 epoch: 8, train_loss: 1.1472, test_loss: 1.0757, test_f1: 0.4527
 epoch: 9, train_loss: 1.1330, test_loss: 1.0629, test_f1: 0.4457
 epoch: 10, train_loss: 1.1078, test_loss: 1.0505, test_f1: 0.4400
 epoch: 11, train_loss: 1.1115, test_loss: 1.0387, test_f1: 0.4796
 epoch: 12, train_loss: 1.1005, test_loss: 1.0336, test_f1: 0.4550
 epoch: 13, train_loss: 1.0963, test_loss: 1.0251, test_f1: 0.4714
 epoch: 14, train_loss: 1.0883, test_loss: 1.0230, test_f1: 0.4829
 epoch: 15, train_loss: 1.0861, test_loss: 1.0195, test_f1: 0.4613
 epoch: 16, train_loss: 1.0730, test_loss: 1.0053, test_f1: 0.4708
 epoch: 17, train_loss: 1.0621, test_loss: 1.0100, test_f1: 0.4574
 epoch: 18, train_loss: 1.0515, test_loss: 1.0021, test_f1: 0.4706
 epoch: 19, train_loss: 1.0473, test_loss: 0.9925, test_f1: 0.4625
 epoch: 20, train_loss: 1.0414, test_loss: 0.9887, test_f1: 0.5041
 epoch: 21, train_loss: 1.0411, test_loss: 0.9853, test_f1: 0.4735
 epoch: 22, train_loss: 1.0356, test_loss: 0.9896, test_f1: 0.4822
 epoch: 23, train_loss: 1.0188, test_loss: 0.9780, test_f1: 0.4907
 epoch: 24, train_loss: 1.0214, test_loss: 0.9698, test_f1: 0.4877
 epoch: 25, train_loss: 1.0177, test_loss: 0.9755, test_f1: 0.4895
 epoch: 26, train_loss: 1.0129, test_loss: 0.9652, test_f1: 0.4773
 epoch: 27, train_loss: 1.0084, test_loss: 0.9549, test_f1: 0.4980
 epoch: 28, train_loss: 1.0176, test_loss: 0.9506, test_f1: 0.4749
 epoch: 29, train_loss: 0.9966, test_loss: 0.9469, test_f1: 0.4624
 epoch: 30, train_loss: 0.9986, test_loss: 0.9414, test_f1: 0.4912
 epoch: 31, train_loss: 0.9979, test_loss: 0.9447, test_f1: 0.4802
 epoch: 32, train_loss: 0.9913, test_loss: 0.9467, test_f1: 0.4953
 epoch: 33, train_loss: 0.9752, test_loss: 0.9456, test_f1: 0.4825
 epoch: 34, train_loss: 0.9869, test_loss: 0.9308, test_f1: 0.4882
 epoch: 35, train_loss: 0.9784, test_loss: 0.9518, test_f1: 0.4738
 epoch: 36, train_loss: 0.9687, test_loss: 0.9391, test_f1: 0.4997
 epoch: 37, train_loss: 0.9588, test_loss: 0.9283, test_f1: 0.4865
 epoch: 38, train_loss: 0.9666, test_loss: 0.9187, test_f1: 0.5014
 epoch: 39, train_loss: 0.9539, test_loss: 0.9113, test_f1: 0.5099
 epoch: 40, train_loss: 0.9458, test_loss: 0.9491, test_f1: 0.4832
 epoch: 41, train_loss: 0.9522, test_loss: 0.9500, test_f1: 0.4575
 epoch: 42, train_loss: 0.9453, test_loss: 0.9304, test_f1: 0.4885
 epoch: 43, train_loss: 0.9442, test_loss: 0.9357, test_f1: 0.5047
 epoch: 44, train_loss: 0.9505, test_loss: 0.9379, test_f1: 0.4913
 epoch: 45, train_loss: 0.9432, test_loss: 0.9225, test_f1: 0.5054
 epoch: 46, train_loss: 0.9289, test_loss: 0.9180, test_f1: 0.5154
 epoch: 47, train_loss: 0.9351, test_loss: 0.9326, test_f1: 0.5008
 epoch: 48, train_loss: 0.9293, test_loss: 0.9281, test_f1: 0.5053
 epoch: 49, train_loss: 0.9306, test_loss: 0.9186, test_f1: 0.5117
 epoch: 50, train_loss: 0.9182, test_loss: 0.9224, test_f1: 0.4986
 epoch: 51, train_loss: 0.9154, test_loss: 0.9220, test_f1: 0.4980
 epoch: 52, train_loss: 0.9177, test_loss: 0.9155, test_f1: 0.5078
 epoch: 53, train_loss: 0.9101, test_loss: 0.9548, test_f1: 0.5086
 epoch: 54, train_loss: 0.9090, test_loss: 0.9235, test_f1: 0.5022
 epoch: 55, train_loss: 0.9196, test_loss: 0.9311, test_f1: 0.4980
 epoch: 56, train_loss: 0.9144, test_loss: 0.9224, test_f1: 0.5127
 epoch: 57, train_loss: 0.9104, test_loss: 0.9248, test_f1: 0.5028
 epoch: 58, train_loss: 0.9034, test_loss: 0.9200, test_f1: 0.5128
 epoch: 59, train_loss: 0.9097, test_loss: 0.9224, test_f1: 0.5227
 epoch: 60, train_loss: 0.9059, test_loss: 0.9293, test_f1: 0.5024
 epoch: 61, train_loss: 0.8996, test_loss: 0.9224, test_f1: 0.5014
 epoch: 62, train_loss: 0.9144, test_loss: 0.9293, test_f1: 0.5115
 epoch: 63, train_loss: 0.8951, test_loss: 0.9392, test_f1: 0.5018
 epoch: 64, train_loss: 0.9026, test_loss: 0.9342, test_f1: 0.5208
 epoch: 65, train_loss: 0.8981, test_loss: 0.9249, test_f1: 0.5252
 epoch: 66, train_loss: 0.9080, test_loss: 0.9313, test_f1: 0.5113
 epoch: 67, train_loss: 0.9073, test_loss: 0.9288, test_f1: 0.5303
 epoch: 68, train_loss: 0.8923, test_loss: 0.9250, test_f1: 0.5190
 epoch: 69, train_loss: 0.8917, test_loss: 0.9204, test_f1: 0.5247
 epoch: 70, train_loss: 0.8861, test_loss: 0.9469, test_f1: 0.4982
 epoch: 71, train_loss: 0.8886, test_loss: 0.9440, test_f1: 0.5174
 epoch: 72, train_loss: 0.9103, test_loss: 0.9418, test_f1: 0.5093
 epoch: 73, train_loss: 0.8878, test_loss: 0.9217, test_f1: 0.5275
 epoch: 74, train_loss: 0.8907, test_loss: 0.9352, test_f1: 0.5004
 epoch: 75, train_loss: 0.8791, test_loss: 0.9634, test_f1: 0.5209
 epoch: 76, train_loss: 0.8820, test_loss: 0.9447, test_f1: 0.5209
 epoch: 77, train_loss: 0.8929, test_loss: 0.9306, test_f1: 0.5242
 epoch: 78, train_loss: 0.8796, test_loss: 0.9375, test_f1: 0.5205
 epoch: 79, train_loss: 0.8883, test_loss: 0.9408, test_f1: 0.5194
 epoch: 80, train_loss: 0.8782, test_loss: 0.9564, test_f1: 0.5130
 epoch: 81, train_loss: 0.8710, test_loss: 0.9447, test_f1: 0.5181
 epoch: 82, train_loss: 0.8802, test_loss: 0.9408, test_f1: 0.5046
 epoch: 83, train_loss: 0.8733, test_loss: 0.9216, test_f1: 0.5104
 epoch: 84, train_loss: 0.8778, test_loss: 0.9299, test_f1: 0.5264
 epoch: 85, train_loss: 0.8660, test_loss: 0.9450, test_f1: 0.5147
 epoch: 86, train_loss: 0.8755, test_loss: 0.9348, test_f1: 0.5332
 epoch: 87, train_loss: 0.8765, test_loss: 0.9652, test_f1: 0.5044
 epoch: 88, train_loss: 0.8721, test_loss: 0.9574, test_f1: 0.5221
 epoch: 89, train_loss: 0.8736, test_loss: 0.9621, test_f1: 0.5177
 epoch: 90, train_loss: 0.8738, test_loss: 0.9771, test_f1: 0.5049
 epoch: 91, train_loss: 0.8609, test_loss: 0.9521, test_f1: 0.5260
 epoch: 92, train_loss: 0.8667, test_loss: 0.9504, test_f1: 0.5205
 epoch: 93, train_loss: 0.8506, test_loss: 0.9645, test_f1: 0.5182
 epoch: 94, train_loss: 0.8554, test_loss: 0.9533, test_f1: 0.5315
 epoch: 95, train_loss: 0.8670, test_loss: 0.9627, test_f1: 0.5225
 epoch: 96, train_loss: 0.8688, test_loss: 0.9706, test_f1: 0.5262
 epoch: 97, train_loss: 0.8652, test_loss: 0.9703, test_f1: 0.5204
 epoch: 98, train_loss: 0.8612, test_loss: 0.9577, test_f1: 0.5185
 epoch: 99, train_loss: 0.8446, test_loss: 0.9645, test_f1: 0.5344

Training completed in 787.01 seconds
Best F1: 0.5740 at epoch 93
Mean F1 across iterations: 0.5352  0.0220
========================FINAL RESULTS================================
FEGIN weighted F1: 0.5740  0.0220
python main.py --data ltspice_examples --representation component_component --model FEGIN --layers 2 --hiddens 64 --batch_size 32 --lr 0.0001 --emb_size 128 --epochs 100 --save_appendix component_component_L2_H64_BS32_LR0.0001_E128 --no_val
-----



STDERR:
  File "main.py", line 370, in <module>
    main()
  File "main.py", line 254, in main
    dataset = dataset_class(
  File "/home/philip/projects/ltspice_examples_code_repo/Circuit-Completion-Using-GNNs/component_classification_with_link_prediction_head/evaluation/FEGIN/kernel/circuit_datasets.py", line 15, in __init__
    self.data, self.slices = torch.load(self.processed_paths[0])
  File "/home/philip/.local/lib/python3.8/site-packages/torch/serialization.py", line 1040, in load
    warnings.warn(
  File "/usr/lib/python3.8/warnings.py", line 109, in _showwarnmsg
    sw(msg.message, msg.category, msg.filename, msg.lineno,
  File "main.py", line 47, in warn_with_traceback
    traceback.print_stack(file=log)
/home/philip/projects/ltspice_examples_code_repo/Circuit-Completion-Using-GNNs/component_classification_with_link_prediction_head/evaluation/FEGIN/kernel/circuit_datasets.py:15: FutureWarning: You are using `torch.load` with `weights_only=False` (the current default value), which uses the default pickle module implicitly. It is possible to construct malicious pickle data which will execute arbitrary code during unpickling (See https://github.com/pytorch/pytorch/blob/main/SECURITY.md#untrusted-models for more details). In a future release, the default value for `weights_only` will be flipped to `True`. This limits the functions that could be executed during unpickling. Arbitrary objects will no longer be allowed to be loaded via this mode unless they are explicitly allowlisted by the user via `torch.serialization.add_safe_globals`. We recommend you start setting `weights_only=True` for any use case where you don't have full control of the loaded file. Please open an issue on GitHub for any issues related to this experimental feature.
  self.data, self.slices = torch.load(self.processed_paths[0])
