STDOUT:
Results will be saved in /home/philip/projects/ltspice_examples_code_repo/Circuit-Completion-Using-GNNs/component_classification_with_link_prediction_head/evaluation/FEGIN/results/model_FEGIN_dataset_ltspice_examples
Command line input: python main.py --data ltspice_examples --representation component_pin_net --model FEGIN --layers 6 --hiddens 64 --batch_size 64 --lr 0.001 --emb_size 512 --epochs 100 --save_appendix component_pin_net_L6_H64_BS64_LR0.001_E512 --no_val
 is saved.
-----
ltspice_examples - FEGIN
Using 6 layers, 64 hidden units, h = 2
Loading component_pin_net representation dataset
ENTERED
Training FEGIN on component_pin_net representation
Train: 3558, Test: 846
##################ITERATION #0 ****************************************
 epoch: 0, train_loss: 1.2079, test_loss: 1.1289, test_f1: 0.3601
 epoch: 1, train_loss: 1.0358, test_loss: 0.9888, test_f1: 0.5048
 epoch: 2, train_loss: 0.9951, test_loss: 0.9839, test_f1: 0.5250
 epoch: 3, train_loss: 0.9562, test_loss: 0.9581, test_f1: 0.5040
 epoch: 4, train_loss: 0.9217, test_loss: 0.9298, test_f1: 0.4841
 epoch: 5, train_loss: 0.9116, test_loss: 0.9630, test_f1: 0.5051
 epoch: 6, train_loss: 0.8784, test_loss: 0.9228, test_f1: 0.5073
 epoch: 7, train_loss: 0.8787, test_loss: 0.8406, test_f1: 0.5451
 epoch: 8, train_loss: 0.8535, test_loss: 0.8619, test_f1: 0.5245
 epoch: 9, train_loss: 0.8297, test_loss: 0.9536, test_f1: 0.4974
 epoch: 10, train_loss: 0.8325, test_loss: 0.9086, test_f1: 0.5521
 epoch: 11, train_loss: 0.8195, test_loss: 0.8413, test_f1: 0.5598
 epoch: 12, train_loss: 0.7864, test_loss: 0.8189, test_f1: 0.6055
 epoch: 13, train_loss: 0.7915, test_loss: 0.9423, test_f1: 0.5587
 epoch: 14, train_loss: 0.7687, test_loss: 0.8571, test_f1: 0.5595
 epoch: 15, train_loss: 0.7437, test_loss: 0.8172, test_f1: 0.5931
 epoch: 16, train_loss: 0.7414, test_loss: 0.7404, test_f1: 0.5975
 epoch: 17, train_loss: 0.7292, test_loss: 0.7724, test_f1: 0.5862
 epoch: 18, train_loss: 0.7278, test_loss: 0.7253, test_f1: 0.6283
 epoch: 19, train_loss: 0.7062, test_loss: 0.7840, test_f1: 0.6186
 epoch: 20, train_loss: 0.6793, test_loss: 0.7670, test_f1: 0.6174
 epoch: 21, train_loss: 0.6847, test_loss: 0.7924, test_f1: 0.6014
 epoch: 22, train_loss: 0.6730, test_loss: 0.7186, test_f1: 0.6652
 epoch: 23, train_loss: 0.6505, test_loss: 0.9419, test_f1: 0.5515
 epoch: 24, train_loss: 0.6356, test_loss: 0.7793, test_f1: 0.6444
 epoch: 25, train_loss: 0.6289, test_loss: 0.7416, test_f1: 0.6444
 epoch: 26, train_loss: 0.6132, test_loss: 0.8883, test_f1: 0.6181
 epoch: 27, train_loss: 0.6214, test_loss: 0.7792, test_f1: 0.6123
 epoch: 28, train_loss: 0.5993, test_loss: 0.7901, test_f1: 0.6624
 epoch: 29, train_loss: 0.6077, test_loss: 0.7375, test_f1: 0.6333
 epoch: 30, train_loss: 0.5863, test_loss: 0.7491, test_f1: 0.6373
 epoch: 31, train_loss: 0.5855, test_loss: 0.7375, test_f1: 0.6447
 epoch: 32, train_loss: 0.5643, test_loss: 0.8435, test_f1: 0.6369
 epoch: 33, train_loss: 0.5510, test_loss: 0.7586, test_f1: 0.6587
 epoch: 34, train_loss: 0.5559, test_loss: 0.8415, test_f1: 0.6378
 epoch: 35, train_loss: 0.5493, test_loss: 0.7445, test_f1: 0.6717
 epoch: 36, train_loss: 0.5475, test_loss: 0.8713, test_f1: 0.6648
 epoch: 37, train_loss: 0.5680, test_loss: 0.8821, test_f1: 0.6290
 epoch: 38, train_loss: 0.5333, test_loss: 0.8999, test_f1: 0.6162
 epoch: 39, train_loss: 0.5171, test_loss: 0.8068, test_f1: 0.6644
 epoch: 40, train_loss: 0.5196, test_loss: 0.8962, test_f1: 0.6384
 epoch: 41, train_loss: 0.5174, test_loss: 0.8632, test_f1: 0.6365
 epoch: 42, train_loss: 0.5262, test_loss: 0.8984, test_f1: 0.6336
 epoch: 43, train_loss: 0.5051, test_loss: 0.8080, test_f1: 0.6731
 epoch: 44, train_loss: 0.5054, test_loss: 0.8067, test_f1: 0.6548
 epoch: 45, train_loss: 0.5018, test_loss: 0.8400, test_f1: 0.6363
 epoch: 46, train_loss: 0.5071, test_loss: 0.9284, test_f1: 0.6401
 epoch: 47, train_loss: 0.4795, test_loss: 0.9003, test_f1: 0.6662
 epoch: 48, train_loss: 0.4777, test_loss: 0.8444, test_f1: 0.6685
 epoch: 49, train_loss: 0.4710, test_loss: 0.7912, test_f1: 0.6579
 epoch: 50, train_loss: 0.4653, test_loss: 0.9059, test_f1: 0.6610
 epoch: 51, train_loss: 0.4325, test_loss: 0.8802, test_f1: 0.6497
 epoch: 52, train_loss: 0.4120, test_loss: 0.9063, test_f1: 0.6684
 epoch: 53, train_loss: 0.3817, test_loss: 0.9569, test_f1: 0.6672
 epoch: 54, train_loss: 0.3854, test_loss: 1.0209, test_f1: 0.6811
 epoch: 55, train_loss: 0.3964, test_loss: 0.9408, test_f1: 0.6602
 epoch: 56, train_loss: 0.3916, test_loss: 1.0647, test_f1: 0.6615
 epoch: 57, train_loss: 0.3789, test_loss: 1.0153, test_f1: 0.6627
 epoch: 58, train_loss: 0.3750, test_loss: 0.9982, test_f1: 0.6688
 epoch: 59, train_loss: 0.3521, test_loss: 1.0022, test_f1: 0.6721
 epoch: 60, train_loss: 0.3680, test_loss: 1.1045, test_f1: 0.6551
 epoch: 61, train_loss: 0.3524, test_loss: 1.0699, test_f1: 0.6695
 epoch: 62, train_loss: 0.3473, test_loss: 1.1978, test_f1: 0.6600
 epoch: 63, train_loss: 0.3447, test_loss: 1.1450, test_f1: 0.6672
 epoch: 64, train_loss: 0.3368, test_loss: 0.9725, test_f1: 0.6710
 epoch: 65, train_loss: 0.3482, test_loss: 1.0819, test_f1: 0.6536
 epoch: 66, train_loss: 0.3398, test_loss: 1.1040, test_f1: 0.6670
 epoch: 67, train_loss: 0.3350, test_loss: 1.1849, test_f1: 0.6447
 epoch: 68, train_loss: 0.3388, test_loss: 1.0560, test_f1: 0.6671
 epoch: 69, train_loss: 0.3338, test_loss: 1.1244, test_f1: 0.6731
 epoch: 70, train_loss: 0.3161, test_loss: 1.0968, test_f1: 0.6763
 epoch: 71, train_loss: 0.3170, test_loss: 1.1613, test_f1: 0.6764
 epoch: 72, train_loss: 0.3203, test_loss: 1.2135, test_f1: 0.6668
 epoch: 73, train_loss: 0.3244, test_loss: 1.2486, test_f1: 0.6736
 epoch: 74, train_loss: 0.3011, test_loss: 1.2972, test_f1: 0.6478
 epoch: 75, train_loss: 0.3203, test_loss: 1.0652, test_f1: 0.6961
 epoch: 76, train_loss: 0.3140, test_loss: 1.2092, test_f1: 0.6812
 epoch: 77, train_loss: 0.3069, test_loss: 1.2663, test_f1: 0.6721
 epoch: 78, train_loss: 0.3221, test_loss: 1.2429, test_f1: 0.6602
 epoch: 79, train_loss: 0.2988, test_loss: 1.2294, test_f1: 0.6638
 epoch: 80, train_loss: 0.2766, test_loss: 1.1676, test_f1: 0.6759
 epoch: 81, train_loss: 0.2740, test_loss: 1.3804, test_f1: 0.6965
 epoch: 82, train_loss: 0.2774, test_loss: 1.5261, test_f1: 0.6541
 epoch: 83, train_loss: 0.2773, test_loss: 1.3041, test_f1: 0.6707
 epoch: 84, train_loss: 0.2959, test_loss: 1.2768, test_f1: 0.6895
 epoch: 85, train_loss: 0.2709, test_loss: 1.2174, test_f1: 0.6651
 epoch: 86, train_loss: 0.2825, test_loss: 1.4711, test_f1: 0.6763
 epoch: 87, train_loss: 0.2747, test_loss: 1.5430, test_f1: 0.6744
 epoch: 88, train_loss: 0.2487, test_loss: 1.4453, test_f1: 0.6837
 epoch: 89, train_loss: 0.2721, test_loss: 1.4623, test_f1: 0.6833
 epoch: 90, train_loss: 0.2609, test_loss: 1.3425, test_f1: 0.6802
 epoch: 91, train_loss: 0.2652, test_loss: 1.4478, test_f1: 0.6855
 epoch: 92, train_loss: 0.2544, test_loss: 1.4629, test_f1: 0.6743
 epoch: 93, train_loss: 0.2656, test_loss: 1.5691, test_f1: 0.6567
 epoch: 94, train_loss: 0.2734, test_loss: 1.6528, test_f1: 0.6537
 epoch: 95, train_loss: 0.2442, test_loss: 1.4329, test_f1: 0.6680
 epoch: 96, train_loss: 0.2372, test_loss: 1.5362, test_f1: 0.6804
 epoch: 97, train_loss: 0.2318, test_loss: 1.5566, test_f1: 0.6686
 epoch: 98, train_loss: 0.2419, test_loss: 1.6705, test_f1: 0.6826
 epoch: 99, train_loss: 0.2423, test_loss: 1.6072, test_f1: 0.6651
##################ITERATION #1 ****************************************
 epoch: 0, train_loss: 1.0814, test_loss: 1.1527, test_f1: 0.3630
 epoch: 1, train_loss: 0.9766, test_loss: 0.9511, test_f1: 0.5241
 epoch: 2, train_loss: 0.9360, test_loss: 0.9094, test_f1: 0.5209
 epoch: 3, train_loss: 0.9171, test_loss: 0.9157, test_f1: 0.5019
 epoch: 4, train_loss: 0.9082, test_loss: 0.8974, test_f1: 0.5273
 epoch: 5, train_loss: 0.8988, test_loss: 0.8612, test_f1: 0.5581
 epoch: 6, train_loss: 0.8687, test_loss: 0.8643, test_f1: 0.5564
 epoch: 7, train_loss: 0.8546, test_loss: 0.8391, test_f1: 0.5760
 epoch: 8, train_loss: 0.8410, test_loss: 0.8759, test_f1: 0.5827
 epoch: 9, train_loss: 0.8120, test_loss: 0.8357, test_f1: 0.5971
 epoch: 10, train_loss: 0.8096, test_loss: 0.8022, test_f1: 0.6258
 epoch: 11, train_loss: 0.7888, test_loss: 0.8335, test_f1: 0.6089
 epoch: 12, train_loss: 0.7723, test_loss: 0.7881, test_f1: 0.6263
 epoch: 13, train_loss: 0.7583, test_loss: 0.7643, test_f1: 0.6335
 epoch: 14, train_loss: 0.7403, test_loss: 0.8524, test_f1: 0.6278
 epoch: 15, train_loss: 0.7370, test_loss: 0.7548, test_f1: 0.6596
 epoch: 16, train_loss: 0.7190, test_loss: 0.7235, test_f1: 0.6430
 epoch: 17, train_loss: 0.7127, test_loss: 0.6996, test_f1: 0.6953
 epoch: 18, train_loss: 0.6984, test_loss: 0.7300, test_f1: 0.6325
 epoch: 19, train_loss: 0.6783, test_loss: 0.7181, test_f1: 0.6623
 epoch: 20, train_loss: 0.6831, test_loss: 0.7412, test_f1: 0.6437
 epoch: 21, train_loss: 0.6590, test_loss: 0.7909, test_f1: 0.6489
 epoch: 22, train_loss: 0.6544, test_loss: 0.7124, test_f1: 0.6564
 epoch: 23, train_loss: 0.6457, test_loss: 0.7687, test_f1: 0.6530
 epoch: 24, train_loss: 0.6400, test_loss: 0.7433, test_f1: 0.6483
 epoch: 25, train_loss: 0.6289, test_loss: 0.8077, test_f1: 0.6577
 epoch: 26, train_loss: 0.6251, test_loss: 0.7332, test_f1: 0.6614
 epoch: 27, train_loss: 0.5993, test_loss: 0.7214, test_f1: 0.6623
 epoch: 28, train_loss: 0.5999, test_loss: 0.7111, test_f1: 0.6722
 epoch: 29, train_loss: 0.5713, test_loss: 0.7740, test_f1: 0.6634
 epoch: 30, train_loss: 0.5964, test_loss: 0.7233, test_f1: 0.6810
 epoch: 31, train_loss: 0.5766, test_loss: 0.7196, test_f1: 0.6946
 epoch: 32, train_loss: 0.5616, test_loss: 0.7905, test_f1: 0.6586
 epoch: 33, train_loss: 0.5549, test_loss: 0.7671, test_f1: 0.6656
 epoch: 34, train_loss: 0.5658, test_loss: 0.7406, test_f1: 0.6917
 epoch: 35, train_loss: 0.5446, test_loss: 0.7414, test_f1: 0.6876
 epoch: 36, train_loss: 0.5444, test_loss: 0.7942, test_f1: 0.6599
 epoch: 37, train_loss: 0.5387, test_loss: 0.8018, test_f1: 0.6582
 epoch: 38, train_loss: 0.5404, test_loss: 0.7901, test_f1: 0.6814
 epoch: 39, train_loss: 0.5277, test_loss: 0.7838, test_f1: 0.6693
 epoch: 40, train_loss: 0.5012, test_loss: 0.9139, test_f1: 0.6515
 epoch: 41, train_loss: 0.5107, test_loss: 0.7868, test_f1: 0.6827
 epoch: 42, train_loss: 0.5108, test_loss: 0.7468, test_f1: 0.7231
 epoch: 43, train_loss: 0.5039, test_loss: 0.9100, test_f1: 0.6311
 epoch: 44, train_loss: 0.4939, test_loss: 0.7870, test_f1: 0.6749
 epoch: 45, train_loss: 0.4860, test_loss: 0.8486, test_f1: 0.6859
 epoch: 46, train_loss: 0.4686, test_loss: 0.9323, test_f1: 0.6361
 epoch: 47, train_loss: 0.4806, test_loss: 0.9590, test_f1: 0.6555
 epoch: 48, train_loss: 0.4680, test_loss: 0.9383, test_f1: 0.6806
 epoch: 49, train_loss: 0.4611, test_loss: 1.0161, test_f1: 0.6461
 epoch: 50, train_loss: 0.4568, test_loss: 0.8976, test_f1: 0.6874
 epoch: 51, train_loss: 0.4071, test_loss: 0.9262, test_f1: 0.6873
 epoch: 52, train_loss: 0.3966, test_loss: 0.9886, test_f1: 0.6930
 epoch: 53, train_loss: 0.3862, test_loss: 1.0097, test_f1: 0.6584
 epoch: 54, train_loss: 0.3751, test_loss: 1.0008, test_f1: 0.6830
 epoch: 55, train_loss: 0.3783, test_loss: 1.1428, test_f1: 0.6881
 epoch: 56, train_loss: 0.3696, test_loss: 1.1120, test_f1: 0.6641
 epoch: 57, train_loss: 0.3817, test_loss: 1.1121, test_f1: 0.6761
 epoch: 58, train_loss: 0.3726, test_loss: 1.0782, test_f1: 0.6843
 epoch: 59, train_loss: 0.3637, test_loss: 1.1413, test_f1: 0.6767
 epoch: 60, train_loss: 0.3501, test_loss: 1.1746, test_f1: 0.6670
 epoch: 61, train_loss: 0.3355, test_loss: 1.1772, test_f1: 0.6887
 epoch: 62, train_loss: 0.3536, test_loss: 1.2022, test_f1: 0.6833
 epoch: 63, train_loss: 0.3635, test_loss: 1.2402, test_f1: 0.6794
 epoch: 64, train_loss: 0.3476, test_loss: 1.1266, test_f1: 0.6748
 epoch: 65, train_loss: 0.3788, test_loss: 1.2389, test_f1: 0.6774
 epoch: 66, train_loss: 0.3198, test_loss: 1.2250, test_f1: 0.6721
 epoch: 67, train_loss: 0.3307, test_loss: 1.2809, test_f1: 0.6637
 epoch: 68, train_loss: 0.3183, test_loss: 1.3894, test_f1: 0.6559
 epoch: 69, train_loss: 0.3124, test_loss: 1.3140, test_f1: 0.6917
 epoch: 70, train_loss: 0.3370, test_loss: 1.3944, test_f1: 0.6734
 epoch: 71, train_loss: 0.3191, test_loss: 1.1841, test_f1: 0.6750
 epoch: 72, train_loss: 0.3109, test_loss: 1.3148, test_f1: 0.6743
 epoch: 73, train_loss: 0.3287, test_loss: 1.2617, test_f1: 0.6727
 epoch: 74, train_loss: 0.3112, test_loss: 1.3164, test_f1: 0.6678
 epoch: 75, train_loss: 0.3136, test_loss: 1.2875, test_f1: 0.6708
 epoch: 76, train_loss: 0.2906, test_loss: 1.2779, test_f1: 0.6937
 epoch: 77, train_loss: 0.3042, test_loss: 1.3460, test_f1: 0.6763
 epoch: 78, train_loss: 0.2889, test_loss: 1.3983, test_f1: 0.6749
 epoch: 79, train_loss: 0.2916, test_loss: 1.4374, test_f1: 0.6653
 epoch: 80, train_loss: 0.2880, test_loss: 1.4314, test_f1: 0.6698
 epoch: 81, train_loss: 0.2840, test_loss: 1.3608, test_f1: 0.6750
 epoch: 82, train_loss: 0.2723, test_loss: 1.5115, test_f1: 0.6547
 epoch: 83, train_loss: 0.2769, test_loss: 1.4417, test_f1: 0.6709
 epoch: 84, train_loss: 0.2735, test_loss: 1.4316, test_f1: 0.6761
 epoch: 85, train_loss: 0.2714, test_loss: 1.5549, test_f1: 0.6687
 epoch: 86, train_loss: 0.2540, test_loss: 1.4689, test_f1: 0.6625
 epoch: 87, train_loss: 0.2927, test_loss: 1.4746, test_f1: 0.6683
 epoch: 88, train_loss: 0.2757, test_loss: 1.4981, test_f1: 0.6607
 epoch: 89, train_loss: 0.2649, test_loss: 1.5466, test_f1: 0.6715
 epoch: 90, train_loss: 0.2543, test_loss: 1.4308, test_f1: 0.6585
 epoch: 91, train_loss: 0.2580, test_loss: 1.6568, test_f1: 0.6731
 epoch: 92, train_loss: 0.2465, test_loss: 1.6667, test_f1: 0.6659
 epoch: 93, train_loss: 0.2502, test_loss: 1.6284, test_f1: 0.6543
 epoch: 94, train_loss: 0.2590, test_loss: 1.6036, test_f1: 0.6573
 epoch: 95, train_loss: 0.2715, test_loss: 1.5871, test_f1: 0.6692
 epoch: 96, train_loss: 0.2503, test_loss: 1.5749, test_f1: 0.6680
 epoch: 97, train_loss: 0.2656, test_loss: 1.5821, test_f1: 0.6776
 epoch: 98, train_loss: 0.2605, test_loss: 1.6102, test_f1: 0.6677
 epoch: 99, train_loss: 0.2520, test_loss: 1.5678, test_f1: 0.6670
##################ITERATION #2 ****************************************
 epoch: 0, train_loss: 1.1146, test_loss: 1.2026, test_f1: 0.3219
 epoch: 1, train_loss: 0.9887, test_loss: 0.9869, test_f1: 0.4894
 epoch: 2, train_loss: 0.9540, test_loss: 0.9296, test_f1: 0.5165
 epoch: 3, train_loss: 0.9385, test_loss: 0.9375, test_f1: 0.5416
 epoch: 4, train_loss: 0.9002, test_loss: 0.8831, test_f1: 0.5323
 epoch: 5, train_loss: 0.8809, test_loss: 0.8655, test_f1: 0.5419
 epoch: 6, train_loss: 0.8477, test_loss: 0.8687, test_f1: 0.5505
 epoch: 7, train_loss: 0.8408, test_loss: 0.8889, test_f1: 0.5639
 epoch: 8, train_loss: 0.8111, test_loss: 0.8637, test_f1: 0.6123
 epoch: 9, train_loss: 0.8043, test_loss: 0.8653, test_f1: 0.5764
 epoch: 10, train_loss: 0.7974, test_loss: 0.8146, test_f1: 0.6124
 epoch: 11, train_loss: 0.7798, test_loss: 0.7593, test_f1: 0.6264
 epoch: 12, train_loss: 0.7467, test_loss: 0.7962, test_f1: 0.5890
 epoch: 13, train_loss: 0.7448, test_loss: 0.7474, test_f1: 0.6254
 epoch: 14, train_loss: 0.7209, test_loss: 0.8002, test_f1: 0.6058
 epoch: 15, train_loss: 0.7089, test_loss: 0.7927, test_f1: 0.6545
 epoch: 16, train_loss: 0.6949, test_loss: 0.8031, test_f1: 0.6338
 epoch: 17, train_loss: 0.7094, test_loss: 0.7674, test_f1: 0.6500
 epoch: 18, train_loss: 0.6745, test_loss: 0.7737, test_f1: 0.6567
 epoch: 19, train_loss: 0.6690, test_loss: 0.7790, test_f1: 0.6285
 epoch: 20, train_loss: 0.6531, test_loss: 0.7668, test_f1: 0.6362
 epoch: 21, train_loss: 0.6435, test_loss: 0.8620, test_f1: 0.6297
 epoch: 22, train_loss: 0.6360, test_loss: 0.8063, test_f1: 0.6510
 epoch: 23, train_loss: 0.6275, test_loss: 0.8266, test_f1: 0.6198
 epoch: 24, train_loss: 0.6135, test_loss: 0.8493, test_f1: 0.6395
 epoch: 25, train_loss: 0.6243, test_loss: 0.8102, test_f1: 0.6307
 epoch: 26, train_loss: 0.6085, test_loss: 0.7863, test_f1: 0.6304
 epoch: 27, train_loss: 0.6088, test_loss: 0.7995, test_f1: 0.6468
 epoch: 28, train_loss: 0.5865, test_loss: 0.8581, test_f1: 0.6206
 epoch: 29, train_loss: 0.5684, test_loss: 0.8134, test_f1: 0.6663
 epoch: 30, train_loss: 0.5644, test_loss: 0.8147, test_f1: 0.6220
 epoch: 31, train_loss: 0.5812, test_loss: 0.8015, test_f1: 0.6642
 epoch: 32, train_loss: 0.5457, test_loss: 0.7622, test_f1: 0.6925
 epoch: 33, train_loss: 0.5559, test_loss: 0.8388, test_f1: 0.6404
 epoch: 34, train_loss: 0.5524, test_loss: 0.8185, test_f1: 0.6564
 epoch: 35, train_loss: 0.5333, test_loss: 0.7977, test_f1: 0.6675
 epoch: 36, train_loss: 0.5281, test_loss: 0.7902, test_f1: 0.6650
 epoch: 37, train_loss: 0.5254, test_loss: 0.8409, test_f1: 0.6657
 epoch: 38, train_loss: 0.5061, test_loss: 0.8535, test_f1: 0.6718
 epoch: 39, train_loss: 0.5085, test_loss: 0.8122, test_f1: 0.6531
 epoch: 40, train_loss: 0.5117, test_loss: 0.9212, test_f1: 0.6383
 epoch: 41, train_loss: 0.5057, test_loss: 0.8881, test_f1: 0.6521
 epoch: 42, train_loss: 0.4774, test_loss: 0.9991, test_f1: 0.6368
 epoch: 43, train_loss: 0.4840, test_loss: 0.8374, test_f1: 0.6378
 epoch: 44, train_loss: 0.4917, test_loss: 0.9075, test_f1: 0.6332
 epoch: 45, train_loss: 0.4772, test_loss: 0.8003, test_f1: 0.6853
 epoch: 46, train_loss: 0.4729, test_loss: 0.8718, test_f1: 0.6874
 epoch: 47, train_loss: 0.4558, test_loss: 1.0265, test_f1: 0.6501
 epoch: 48, train_loss: 0.4484, test_loss: 1.0059, test_f1: 0.6439
 epoch: 49, train_loss: 0.4590, test_loss: 0.9499, test_f1: 0.6588
 epoch: 50, train_loss: 0.4380, test_loss: 0.9724, test_f1: 0.6694
 epoch: 51, train_loss: 0.4147, test_loss: 1.0151, test_f1: 0.6662
 epoch: 52, train_loss: 0.3855, test_loss: 1.0591, test_f1: 0.6712
 epoch: 53, train_loss: 0.3882, test_loss: 0.9406, test_f1: 0.6773
 epoch: 54, train_loss: 0.3598, test_loss: 1.0651, test_f1: 0.6621
 epoch: 55, train_loss: 0.3547, test_loss: 1.1836, test_f1: 0.6687
 epoch: 56, train_loss: 0.3686, test_loss: 1.1488, test_f1: 0.6472
 epoch: 57, train_loss: 0.3549, test_loss: 1.1384, test_f1: 0.6770
 epoch: 58, train_loss: 0.3389, test_loss: 1.1599, test_f1: 0.6789
 epoch: 59, train_loss: 0.3562, test_loss: 1.0962, test_f1: 0.6599
 epoch: 60, train_loss: 0.3322, test_loss: 1.2248, test_f1: 0.6725
 epoch: 61, train_loss: 0.3494, test_loss: 1.1293, test_f1: 0.6882
 epoch: 62, train_loss: 0.3351, test_loss: 1.2136, test_f1: 0.6622
 epoch: 63, train_loss: 0.3297, test_loss: 1.1104, test_f1: 0.6835
 epoch: 64, train_loss: 0.3237, test_loss: 1.1663, test_f1: 0.7010
 epoch: 65, train_loss: 0.3474, test_loss: 1.2185, test_f1: 0.6809
 epoch: 66, train_loss: 0.3077, test_loss: 1.1976, test_f1: 0.6704
 epoch: 67, train_loss: 0.3122, test_loss: 1.2931, test_f1: 0.6693
 epoch: 68, train_loss: 0.3099, test_loss: 1.2258, test_f1: 0.6821
 epoch: 69, train_loss: 0.3179, test_loss: 1.2465, test_f1: 0.6719
 epoch: 70, train_loss: 0.3210, test_loss: 1.2586, test_f1: 0.6799
 epoch: 71, train_loss: 0.2979, test_loss: 1.3144, test_f1: 0.6983
 epoch: 72, train_loss: 0.3014, test_loss: 1.3710, test_f1: 0.6795
 epoch: 73, train_loss: 0.3143, test_loss: 1.3014, test_f1: 0.6806
 epoch: 74, train_loss: 0.3056, test_loss: 1.2107, test_f1: 0.6827
 epoch: 75, train_loss: 0.2884, test_loss: 1.2597, test_f1: 0.7034
 epoch: 76, train_loss: 0.3048, test_loss: 1.0510, test_f1: 0.7082
 epoch: 77, train_loss: 0.2773, test_loss: 1.4938, test_f1: 0.6773
 epoch: 78, train_loss: 0.2709, test_loss: 1.4736, test_f1: 0.6846
 epoch: 79, train_loss: 0.2887, test_loss: 1.3553, test_f1: 0.6915
 epoch: 80, train_loss: 0.2737, test_loss: 1.4391, test_f1: 0.6782
 epoch: 81, train_loss: 0.2916, test_loss: 1.4631, test_f1: 0.6714
 epoch: 82, train_loss: 0.2822, test_loss: 1.3703, test_f1: 0.6840
 epoch: 83, train_loss: 0.2593, test_loss: 1.4786, test_f1: 0.6833
 epoch: 84, train_loss: 0.2787, test_loss: 1.5177, test_f1: 0.6741
 epoch: 85, train_loss: 0.2805, test_loss: 1.4993, test_f1: 0.6763
 epoch: 86, train_loss: 0.2616, test_loss: 1.5103, test_f1: 0.6825
 epoch: 87, train_loss: 0.2920, test_loss: 1.5741, test_f1: 0.6731
 epoch: 88, train_loss: 0.2712, test_loss: 1.5398, test_f1: 0.6677
 epoch: 89, train_loss: 0.2601, test_loss: 1.4481, test_f1: 0.6979
 epoch: 90, train_loss: 0.2576, test_loss: 1.4297, test_f1: 0.6826
 epoch: 91, train_loss: 0.2543, test_loss: 1.5657, test_f1: 0.6814
 epoch: 92, train_loss: 0.2515, test_loss: 1.5784, test_f1: 0.6653
 epoch: 93, train_loss: 0.2593, test_loss: 1.5817, test_f1: 0.6872
 epoch: 94, train_loss: 0.2477, test_loss: 1.6085, test_f1: 0.6817
 epoch: 95, train_loss: 0.2507, test_loss: 1.5341, test_f1: 0.6730
 epoch: 96, train_loss: 0.2538, test_loss: 1.6198, test_f1: 0.6757
 epoch: 97, train_loss: 0.2518, test_loss: 1.5257, test_f1: 0.6894
 epoch: 98, train_loss: 0.2421, test_loss: 1.5165, test_f1: 0.6825
 epoch: 99, train_loss: 0.2419, test_loss: 1.6627, test_f1: 0.6683
##################ITERATION #3 ****************************************
 epoch: 0, train_loss: 1.1572, test_loss: 1.1152, test_f1: 0.4431
 epoch: 1, train_loss: 0.9850, test_loss: 1.0279, test_f1: 0.5204
 epoch: 2, train_loss: 0.9558, test_loss: 0.9653, test_f1: 0.5441
 epoch: 3, train_loss: 0.9234, test_loss: 0.9127, test_f1: 0.5212
 epoch: 4, train_loss: 0.9011, test_loss: 0.9401, test_f1: 0.5506
 epoch: 5, train_loss: 0.8749, test_loss: 0.8900, test_f1: 0.5642
 epoch: 6, train_loss: 0.8582, test_loss: 0.8851, test_f1: 0.5827
 epoch: 7, train_loss: 0.8366, test_loss: 0.8674, test_f1: 0.5719
 epoch: 8, train_loss: 0.8244, test_loss: 0.7969, test_f1: 0.6170
 epoch: 9, train_loss: 0.8101, test_loss: 0.8277, test_f1: 0.5983
 epoch: 10, train_loss: 0.7993, test_loss: 0.7921, test_f1: 0.6106
 epoch: 11, train_loss: 0.7717, test_loss: 0.8332, test_f1: 0.6171
 epoch: 12, train_loss: 0.7549, test_loss: 0.8494, test_f1: 0.6047
 epoch: 13, train_loss: 0.7484, test_loss: 0.8215, test_f1: 0.5925
 epoch: 14, train_loss: 0.7469, test_loss: 0.7518, test_f1: 0.6251
 epoch: 15, train_loss: 0.7210, test_loss: 0.8242, test_f1: 0.6553
 epoch: 16, train_loss: 0.7012, test_loss: 0.7843, test_f1: 0.6197
 epoch: 17, train_loss: 0.7051, test_loss: 0.7685, test_f1: 0.6231
 epoch: 18, train_loss: 0.6856, test_loss: 0.8165, test_f1: 0.6248
 epoch: 19, train_loss: 0.6727, test_loss: 0.8350, test_f1: 0.6350
 epoch: 20, train_loss: 0.6628, test_loss: 0.7649, test_f1: 0.6320
 epoch: 21, train_loss: 0.6490, test_loss: 0.8265, test_f1: 0.6067
 epoch: 22, train_loss: 0.6448, test_loss: 0.7764, test_f1: 0.6359
 epoch: 23, train_loss: 0.6176, test_loss: 0.8203, test_f1: 0.6420
 epoch: 24, train_loss: 0.6153, test_loss: 0.8166, test_f1: 0.6502
 epoch: 25, train_loss: 0.6121, test_loss: 0.8214, test_f1: 0.6585
 epoch: 26, train_loss: 0.5979, test_loss: 0.8699, test_f1: 0.6710
 epoch: 27, train_loss: 0.6106, test_loss: 0.8474, test_f1: 0.6623
 epoch: 28, train_loss: 0.6093, test_loss: 0.7196, test_f1: 0.6755
 epoch: 29, train_loss: 0.5800, test_loss: 0.7453, test_f1: 0.6728
 epoch: 30, train_loss: 0.5919, test_loss: 0.8734, test_f1: 0.6587
 epoch: 31, train_loss: 0.5581, test_loss: 0.8079, test_f1: 0.6461
 epoch: 32, train_loss: 0.5651, test_loss: 0.9900, test_f1: 0.6466
 epoch: 33, train_loss: 0.5367, test_loss: 0.8862, test_f1: 0.6597
 epoch: 34, train_loss: 0.5534, test_loss: 0.9200, test_f1: 0.6545
 epoch: 35, train_loss: 0.5353, test_loss: 0.8124, test_f1: 0.6958
 epoch: 36, train_loss: 0.5228, test_loss: 0.8361, test_f1: 0.7083
 epoch: 37, train_loss: 0.5247, test_loss: 0.9379, test_f1: 0.6566
 epoch: 38, train_loss: 0.5039, test_loss: 0.9348, test_f1: 0.6574
 epoch: 39, train_loss: 0.5174, test_loss: 0.9128, test_f1: 0.6499
 epoch: 40, train_loss: 0.4901, test_loss: 0.9589, test_f1: 0.6506
 epoch: 41, train_loss: 0.4919, test_loss: 1.0139, test_f1: 0.6406
 epoch: 42, train_loss: 0.4712, test_loss: 0.9241, test_f1: 0.6516
 epoch: 43, train_loss: 0.4828, test_loss: 1.0292, test_f1: 0.6586
 epoch: 44, train_loss: 0.4865, test_loss: 1.0293, test_f1: 0.6253
 epoch: 45, train_loss: 0.5002, test_loss: 0.9853, test_f1: 0.6576
 epoch: 46, train_loss: 0.4527, test_loss: 0.9941, test_f1: 0.6388
 epoch: 47, train_loss: 0.4604, test_loss: 1.0008, test_f1: 0.6626
 epoch: 48, train_loss: 0.4812, test_loss: 1.0184, test_f1: 0.6510
 epoch: 49, train_loss: 0.4486, test_loss: 1.1322, test_f1: 0.6515
 epoch: 50, train_loss: 0.4356, test_loss: 1.1378, test_f1: 0.6537
 epoch: 51, train_loss: 0.3970, test_loss: 1.1080, test_f1: 0.6626
 epoch: 52, train_loss: 0.3705, test_loss: 1.1349, test_f1: 0.6553
 epoch: 53, train_loss: 0.3655, test_loss: 1.1931, test_f1: 0.6548
 epoch: 54, train_loss: 0.3551, test_loss: 1.2653, test_f1: 0.6574
 epoch: 55, train_loss: 0.3535, test_loss: 1.2736, test_f1: 0.6527
 epoch: 56, train_loss: 0.3482, test_loss: 1.2818, test_f1: 0.6486
 epoch: 57, train_loss: 0.3536, test_loss: 1.2333, test_f1: 0.6686
 epoch: 58, train_loss: 0.3360, test_loss: 1.2123, test_f1: 0.6665
 epoch: 59, train_loss: 0.3510, test_loss: 1.3027, test_f1: 0.6507
 epoch: 60, train_loss: 0.3336, test_loss: 1.3652, test_f1: 0.6755
 epoch: 61, train_loss: 0.3428, test_loss: 1.3006, test_f1: 0.6647
 epoch: 62, train_loss: 0.3241, test_loss: 1.2979, test_f1: 0.6699
 epoch: 63, train_loss: 0.3368, test_loss: 1.4076, test_f1: 0.6493
 epoch: 64, train_loss: 0.3371, test_loss: 1.3006, test_f1: 0.6647
 epoch: 65, train_loss: 0.3292, test_loss: 1.3299, test_f1: 0.6602
 epoch: 66, train_loss: 0.3112, test_loss: 1.3389, test_f1: 0.6655
 epoch: 67, train_loss: 0.3319, test_loss: 1.3802, test_f1: 0.6622
 epoch: 68, train_loss: 0.2987, test_loss: 1.3657, test_f1: 0.6623
 epoch: 69, train_loss: 0.3037, test_loss: 1.4767, test_f1: 0.6623
 epoch: 70, train_loss: 0.2988, test_loss: 1.3558, test_f1: 0.6710
 epoch: 71, train_loss: 0.3050, test_loss: 1.5897, test_f1: 0.6554
 epoch: 72, train_loss: 0.3054, test_loss: 1.6271, test_f1: 0.6464
 epoch: 73, train_loss: 0.3163, test_loss: 1.3780, test_f1: 0.6615
 epoch: 74, train_loss: 0.2799, test_loss: 1.4285, test_f1: 0.6616
 epoch: 75, train_loss: 0.2884, test_loss: 1.4103, test_f1: 0.6569
 epoch: 76, train_loss: 0.2953, test_loss: 1.4551, test_f1: 0.6845
 epoch: 77, train_loss: 0.2937, test_loss: 1.3934, test_f1: 0.6633
 epoch: 78, train_loss: 0.2658, test_loss: 1.4954, test_f1: 0.6825
 epoch: 79, train_loss: 0.2991, test_loss: 1.5356, test_f1: 0.6256
 epoch: 80, train_loss: 0.2762, test_loss: 1.4785, test_f1: 0.6696
 epoch: 81, train_loss: 0.2743, test_loss: 1.4023, test_f1: 0.6373
 epoch: 82, train_loss: 0.2675, test_loss: 1.4913, test_f1: 0.6657
 epoch: 83, train_loss: 0.2574, test_loss: 1.4657, test_f1: 0.6655
 epoch: 84, train_loss: 0.2690, test_loss: 1.5214, test_f1: 0.6677
 epoch: 85, train_loss: 0.2496, test_loss: 1.5383, test_f1: 0.6655
 epoch: 86, train_loss: 0.2557, test_loss: 1.6079, test_f1: 0.6666
 epoch: 87, train_loss: 0.2596, test_loss: 1.5897, test_f1: 0.6627
 epoch: 88, train_loss: 0.2415, test_loss: 1.5681, test_f1: 0.6685
 epoch: 89, train_loss: 0.2388, test_loss: 1.5897, test_f1: 0.6562
 epoch: 90, train_loss: 0.2503, test_loss: 1.5917, test_f1: 0.6573
 epoch: 91, train_loss: 0.2680, test_loss: 1.6013, test_f1: 0.6731
 epoch: 92, train_loss: 0.2572, test_loss: 1.6312, test_f1: 0.6588
 epoch: 93, train_loss: 0.2411, test_loss: 1.5361, test_f1: 0.6510
 epoch: 94, train_loss: 0.2521, test_loss: 1.5642, test_f1: 0.6710
 epoch: 95, train_loss: 0.2477, test_loss: 1.6854, test_f1: 0.6652
 epoch: 96, train_loss: 0.2432, test_loss: 1.7074, test_f1: 0.6681
 epoch: 97, train_loss: 0.2388, test_loss: 1.7123, test_f1: 0.6591
 epoch: 98, train_loss: 0.2358, test_loss: 1.7016, test_f1: 0.6624
 epoch: 99, train_loss: 0.2240, test_loss: 1.7477, test_f1: 0.6558
##################ITERATION #4 ****************************************
 epoch: 0, train_loss: 1.2102, test_loss: 1.3052, test_f1: 0.2806
 epoch: 1, train_loss: 1.0173, test_loss: 1.0346, test_f1: 0.5035
 epoch: 2, train_loss: 0.9553, test_loss: 0.9728, test_f1: 0.5273
 epoch: 3, train_loss: 0.9288, test_loss: 0.9332, test_f1: 0.5455
 epoch: 4, train_loss: 0.9252, test_loss: 0.9183, test_f1: 0.5768
 epoch: 5, train_loss: 0.8852, test_loss: 0.9160, test_f1: 0.5424
 epoch: 6, train_loss: 0.8457, test_loss: 0.8670, test_f1: 0.6043
 epoch: 7, train_loss: 0.8529, test_loss: 0.9088, test_f1: 0.5750
 epoch: 8, train_loss: 0.8142, test_loss: 0.8364, test_f1: 0.5843
 epoch: 9, train_loss: 0.8006, test_loss: 0.8747, test_f1: 0.6041
 epoch: 10, train_loss: 0.7915, test_loss: 0.7739, test_f1: 0.6324
 epoch: 11, train_loss: 0.7688, test_loss: 0.8162, test_f1: 0.6471
 epoch: 12, train_loss: 0.7547, test_loss: 0.7919, test_f1: 0.6324
 epoch: 13, train_loss: 0.7386, test_loss: 0.7803, test_f1: 0.6375
 epoch: 14, train_loss: 0.7324, test_loss: 0.8373, test_f1: 0.6393
 epoch: 15, train_loss: 0.7170, test_loss: 0.8211, test_f1: 0.6194
 epoch: 16, train_loss: 0.6912, test_loss: 0.8519, test_f1: 0.6263
 epoch: 17, train_loss: 0.6746, test_loss: 0.7739, test_f1: 0.6635
 epoch: 18, train_loss: 0.6811, test_loss: 0.8768, test_f1: 0.6057
 epoch: 19, train_loss: 0.6810, test_loss: 0.7593, test_f1: 0.6544
 epoch: 20, train_loss: 0.6656, test_loss: 0.8010, test_f1: 0.6332
 epoch: 21, train_loss: 0.6461, test_loss: 0.8496, test_f1: 0.6095
 epoch: 22, train_loss: 0.6371, test_loss: 0.7695, test_f1: 0.6599
 epoch: 23, train_loss: 0.6347, test_loss: 0.7939, test_f1: 0.6388
 epoch: 24, train_loss: 0.6047, test_loss: 0.7399, test_f1: 0.6826
 epoch: 25, train_loss: 0.6105, test_loss: 0.7611, test_f1: 0.6727
 epoch: 26, train_loss: 0.6150, test_loss: 0.8879, test_f1: 0.6201
 epoch: 27, train_loss: 0.5788, test_loss: 0.8609, test_f1: 0.6647
 epoch: 28, train_loss: 0.6017, test_loss: 0.8172, test_f1: 0.6683
 epoch: 29, train_loss: 0.5835, test_loss: 0.9081, test_f1: 0.6421
 epoch: 30, train_loss: 0.5593, test_loss: 0.8796, test_f1: 0.6521
 epoch: 31, train_loss: 0.5757, test_loss: 0.7644, test_f1: 0.6615
 epoch: 32, train_loss: 0.5501, test_loss: 0.9787, test_f1: 0.6398
 epoch: 33, train_loss: 0.5518, test_loss: 0.9065, test_f1: 0.6442
 epoch: 34, train_loss: 0.5415, test_loss: 0.8519, test_f1: 0.6668
 epoch: 35, train_loss: 0.5188, test_loss: 0.9462, test_f1: 0.6643
 epoch: 36, train_loss: 0.5159, test_loss: 1.0714, test_f1: 0.6432
 epoch: 37, train_loss: 0.5479, test_loss: 0.9472, test_f1: 0.6605
 epoch: 38, train_loss: 0.5114, test_loss: 0.9464, test_f1: 0.6480
 epoch: 39, train_loss: 0.4819, test_loss: 1.0540, test_f1: 0.6476
 epoch: 40, train_loss: 0.4938, test_loss: 0.9658, test_f1: 0.6869
 epoch: 41, train_loss: 0.4855, test_loss: 0.9849, test_f1: 0.6504
 epoch: 42, train_loss: 0.4739, test_loss: 0.9958, test_f1: 0.6616
 epoch: 43, train_loss: 0.4715, test_loss: 1.1597, test_f1: 0.6408
 epoch: 44, train_loss: 0.4645, test_loss: 0.9326, test_f1: 0.6822
 epoch: 45, train_loss: 0.4509, test_loss: 1.0561, test_f1: 0.6684
 epoch: 46, train_loss: 0.4432, test_loss: 1.1130, test_f1: 0.6639
 epoch: 47, train_loss: 0.4554, test_loss: 0.9994, test_f1: 0.6403
 epoch: 48, train_loss: 0.4455, test_loss: 1.1882, test_f1: 0.6427
 epoch: 49, train_loss: 0.4478, test_loss: 1.1360, test_f1: 0.6628
 epoch: 50, train_loss: 0.4287, test_loss: 1.0851, test_f1: 0.6558
 epoch: 51, train_loss: 0.3871, test_loss: 1.1037, test_f1: 0.6509
 epoch: 52, train_loss: 0.3702, test_loss: 1.1203, test_f1: 0.7026
 epoch: 53, train_loss: 0.3677, test_loss: 1.2340, test_f1: 0.6642
 epoch: 54, train_loss: 0.3478, test_loss: 1.2602, test_f1: 0.6570
 epoch: 55, train_loss: 0.3473, test_loss: 1.2306, test_f1: 0.6488
 epoch: 56, train_loss: 0.3273, test_loss: 1.3117, test_f1: 0.6526
 epoch: 57, train_loss: 0.3444, test_loss: 1.2513, test_f1: 0.6603
 epoch: 58, train_loss: 0.3409, test_loss: 1.3714, test_f1: 0.6405
 epoch: 59, train_loss: 0.3177, test_loss: 1.3916, test_f1: 0.6620
 epoch: 60, train_loss: 0.3170, test_loss: 1.2875, test_f1: 0.6719
 epoch: 61, train_loss: 0.3193, test_loss: 1.4225, test_f1: 0.6600
 epoch: 62, train_loss: 0.3188, test_loss: 1.4966, test_f1: 0.6581
 epoch: 63, train_loss: 0.3097, test_loss: 1.4694, test_f1: 0.6450
 epoch: 64, train_loss: 0.3236, test_loss: 1.2662, test_f1: 0.6551
 epoch: 65, train_loss: 0.2973, test_loss: 1.3389, test_f1: 0.6620
 epoch: 66, train_loss: 0.3157, test_loss: 1.5263, test_f1: 0.6503
 epoch: 67, train_loss: 0.3014, test_loss: 1.4943, test_f1: 0.6480
 epoch: 68, train_loss: 0.3058, test_loss: 1.4912, test_f1: 0.6529
 epoch: 69, train_loss: 0.2851, test_loss: 1.4633, test_f1: 0.6548
 epoch: 70, train_loss: 0.3117, test_loss: 1.5035, test_f1: 0.6532
 epoch: 71, train_loss: 0.2887, test_loss: 1.4217, test_f1: 0.6394
 epoch: 72, train_loss: 0.2923, test_loss: 1.6746, test_f1: 0.6613
 epoch: 73, train_loss: 0.2895, test_loss: 1.6848, test_f1: 0.6469
 epoch: 74, train_loss: 0.2917, test_loss: 1.6343, test_f1: 0.6634
 epoch: 75, train_loss: 0.2625, test_loss: 1.6081, test_f1: 0.6444
 epoch: 76, train_loss: 0.2664, test_loss: 1.4480, test_f1: 0.6514
 epoch: 77, train_loss: 0.2698, test_loss: 1.6471, test_f1: 0.6657
 epoch: 78, train_loss: 0.2826, test_loss: 1.6356, test_f1: 0.6389
 epoch: 79, train_loss: 0.2647, test_loss: 1.6007, test_f1: 0.6436
 epoch: 80, train_loss: 0.2717, test_loss: 1.5578, test_f1: 0.6438
 epoch: 81, train_loss: 0.2538, test_loss: 1.6277, test_f1: 0.6543
 epoch: 82, train_loss: 0.2461, test_loss: 1.7362, test_f1: 0.6391
 epoch: 83, train_loss: 0.2611, test_loss: 1.6934, test_f1: 0.6522
 epoch: 84, train_loss: 0.2594, test_loss: 1.7233, test_f1: 0.6532
 epoch: 85, train_loss: 0.2559, test_loss: 1.6954, test_f1: 0.6440
 epoch: 86, train_loss: 0.2564, test_loss: 1.8337, test_f1: 0.6347
 epoch: 87, train_loss: 0.2514, test_loss: 1.6872, test_f1: 0.6515
 epoch: 88, train_loss: 0.2369, test_loss: 1.8055, test_f1: 0.6357
 epoch: 89, train_loss: 0.2600, test_loss: 1.8482, test_f1: 0.6389
 epoch: 90, train_loss: 0.2248, test_loss: 1.8152, test_f1: 0.6455
 epoch: 91, train_loss: 0.2335, test_loss: 1.9074, test_f1: 0.6489
 epoch: 92, train_loss: 0.2305, test_loss: 1.8227, test_f1: 0.6650
 epoch: 93, train_loss: 0.2652, test_loss: 1.9973, test_f1: 0.6467
 epoch: 94, train_loss: 0.2385, test_loss: 1.9858, test_f1: 0.6513
 epoch: 95, train_loss: 0.2192, test_loss: 2.0041, test_f1: 0.6415
 epoch: 96, train_loss: 0.2393, test_loss: 1.9481, test_f1: 0.6375
 epoch: 97, train_loss: 0.2227, test_loss: 1.9338, test_f1: 0.6335
 epoch: 98, train_loss: 0.2145, test_loss: 1.9825, test_f1: 0.6648
 epoch: 99, train_loss: 0.2393, test_loss: 1.9164, test_f1: 0.6515
##################ITERATION #5 ****************************************
 epoch: 0, train_loss: 1.2609, test_loss: 2.6294, test_f1: 0.1710
 epoch: 1, train_loss: 1.0409, test_loss: 0.9671, test_f1: 0.5140
 epoch: 2, train_loss: 0.9637, test_loss: 0.9100, test_f1: 0.5529
 epoch: 3, train_loss: 0.9503, test_loss: 0.9198, test_f1: 0.5554
 epoch: 4, train_loss: 0.9166, test_loss: 0.8596, test_f1: 0.5530
 epoch: 5, train_loss: 0.8957, test_loss: 0.8924, test_f1: 0.5555
 epoch: 6, train_loss: 0.8798, test_loss: 0.8484, test_f1: 0.5676
 epoch: 7, train_loss: 0.8688, test_loss: 0.8218, test_f1: 0.5912
 epoch: 8, train_loss: 0.8480, test_loss: 0.8069, test_f1: 0.5834
 epoch: 9, train_loss: 0.8397, test_loss: 0.8181, test_f1: 0.5770
 epoch: 10, train_loss: 0.8154, test_loss: 0.8015, test_f1: 0.5740
 epoch: 11, train_loss: 0.8132, test_loss: 0.7883, test_f1: 0.5832
 epoch: 12, train_loss: 0.7956, test_loss: 0.7965, test_f1: 0.5948
 epoch: 13, train_loss: 0.7736, test_loss: 0.7725, test_f1: 0.6381
 epoch: 14, train_loss: 0.7624, test_loss: 0.7612, test_f1: 0.5972
 epoch: 15, train_loss: 0.7467, test_loss: 0.7939, test_f1: 0.6379
 epoch: 16, train_loss: 0.7488, test_loss: 0.7610, test_f1: 0.6280
 epoch: 17, train_loss: 0.7255, test_loss: 0.7180, test_f1: 0.6711
 epoch: 18, train_loss: 0.7363, test_loss: 0.7216, test_f1: 0.6650
 epoch: 19, train_loss: 0.7125, test_loss: 0.7813, test_f1: 0.6269
 epoch: 20, train_loss: 0.7119, test_loss: 0.7451, test_f1: 0.6353
 epoch: 21, train_loss: 0.7078, test_loss: 0.7574, test_f1: 0.6210
 epoch: 22, train_loss: 0.7067, test_loss: 0.7134, test_f1: 0.6701
 epoch: 23, train_loss: 0.6671, test_loss: 0.7250, test_f1: 0.6501
 epoch: 24, train_loss: 0.6638, test_loss: 0.7281, test_f1: 0.6590
 epoch: 25, train_loss: 0.6591, test_loss: 0.7432, test_f1: 0.6325
 epoch: 26, train_loss: 0.6425, test_loss: 0.7533, test_f1: 0.6320
 epoch: 27, train_loss: 0.6303, test_loss: 0.8178, test_f1: 0.6290
 epoch: 28, train_loss: 0.6280, test_loss: 0.7230, test_f1: 0.6474
 epoch: 29, train_loss: 0.6121, test_loss: 0.7023, test_f1: 0.6747
 epoch: 30, train_loss: 0.6041, test_loss: 0.7508, test_f1: 0.6566
 epoch: 31, train_loss: 0.5972, test_loss: 0.7358, test_f1: 0.6607
 epoch: 32, train_loss: 0.6087, test_loss: 0.7427, test_f1: 0.6787
 epoch: 33, train_loss: 0.5918, test_loss: 0.6978, test_f1: 0.6623
 epoch: 34, train_loss: 0.5874, test_loss: 0.6522, test_f1: 0.7053
 epoch: 35, train_loss: 0.5768, test_loss: 0.7801, test_f1: 0.6316
 epoch: 36, train_loss: 0.5632, test_loss: 0.7443, test_f1: 0.6453
 epoch: 37, train_loss: 0.5693, test_loss: 0.8110, test_f1: 0.6569
 epoch: 38, train_loss: 0.5416, test_loss: 0.7276, test_f1: 0.6961
 epoch: 39, train_loss: 0.5469, test_loss: 0.7210, test_f1: 0.6990
 epoch: 40, train_loss: 0.5436, test_loss: 0.7181, test_f1: 0.6694
 epoch: 41, train_loss: 0.5373, test_loss: 0.7294, test_f1: 0.6717
 epoch: 42, train_loss: 0.5067, test_loss: 0.7703, test_f1: 0.6685
 epoch: 43, train_loss: 0.5056, test_loss: 0.7720, test_f1: 0.6944
 epoch: 44, train_loss: 0.5154, test_loss: 0.7900, test_f1: 0.6539
 epoch: 45, train_loss: 0.4976, test_loss: 0.8219, test_f1: 0.6767
 epoch: 46, train_loss: 0.5102, test_loss: 0.8789, test_f1: 0.6600
 epoch: 47, train_loss: 0.4916, test_loss: 0.8544, test_f1: 0.6515
 epoch: 48, train_loss: 0.5195, test_loss: 0.7805, test_f1: 0.6969
 epoch: 49, train_loss: 0.4885, test_loss: 0.8677, test_f1: 0.6678
 epoch: 50, train_loss: 0.4823, test_loss: 0.9151, test_f1: 0.6699
 epoch: 51, train_loss: 0.4544, test_loss: 0.7939, test_f1: 0.6927
 epoch: 52, train_loss: 0.4136, test_loss: 0.8124, test_f1: 0.7078
 epoch: 53, train_loss: 0.4249, test_loss: 0.8477, test_f1: 0.6925
 epoch: 54, train_loss: 0.3994, test_loss: 0.8406, test_f1: 0.6941
 epoch: 55, train_loss: 0.4035, test_loss: 0.8636, test_f1: 0.6852
 epoch: 56, train_loss: 0.3971, test_loss: 0.9363, test_f1: 0.6714
 epoch: 57, train_loss: 0.3816, test_loss: 0.9246, test_f1: 0.6967
 epoch: 58, train_loss: 0.3716, test_loss: 0.8944, test_f1: 0.6712
 epoch: 59, train_loss: 0.3778, test_loss: 1.0327, test_f1: 0.6617
 epoch: 60, train_loss: 0.3788, test_loss: 0.9758, test_f1: 0.6846
 epoch: 61, train_loss: 0.3754, test_loss: 0.9533, test_f1: 0.6728
 epoch: 62, train_loss: 0.3564, test_loss: 0.9156, test_f1: 0.6735
 epoch: 63, train_loss: 0.3563, test_loss: 1.0594, test_f1: 0.6530
 epoch: 64, train_loss: 0.3504, test_loss: 1.1544, test_f1: 0.6544
 epoch: 65, train_loss: 0.3575, test_loss: 1.0653, test_f1: 0.6651
 epoch: 66, train_loss: 0.3594, test_loss: 1.0304, test_f1: 0.6845
 epoch: 67, train_loss: 0.3589, test_loss: 0.9878, test_f1: 0.6723
 epoch: 68, train_loss: 0.3320, test_loss: 1.0366, test_f1: 0.6606
 epoch: 69, train_loss: 0.3429, test_loss: 1.1183, test_f1: 0.6621
 epoch: 70, train_loss: 0.3222, test_loss: 1.0085, test_f1: 0.6741
 epoch: 71, train_loss: 0.3443, test_loss: 1.0731, test_f1: 0.6609
 epoch: 72, train_loss: 0.3248, test_loss: 1.1274, test_f1: 0.6612
 epoch: 73, train_loss: 0.3153, test_loss: 1.1027, test_f1: 0.6496
 epoch: 74, train_loss: 0.3278, test_loss: 1.1220, test_f1: 0.6906
 epoch: 75, train_loss: 0.3194, test_loss: 1.1258, test_f1: 0.6651
 epoch: 76, train_loss: 0.3123, test_loss: 1.0848, test_f1: 0.6779
 epoch: 77, train_loss: 0.3040, test_loss: 1.2484, test_f1: 0.6487
 epoch: 78, train_loss: 0.3205, test_loss: 1.1406, test_f1: 0.6756
 epoch: 79, train_loss: 0.3037, test_loss: 1.1182, test_f1: 0.6805
 epoch: 80, train_loss: 0.3129, test_loss: 1.0562, test_f1: 0.6730
 epoch: 81, train_loss: 0.3137, test_loss: 1.1628, test_f1: 0.6554
 epoch: 82, train_loss: 0.2891, test_loss: 1.1042, test_f1: 0.6680
 epoch: 83, train_loss: 0.2945, test_loss: 1.2365, test_f1: 0.6624
 epoch: 84, train_loss: 0.2851, test_loss: 1.2480, test_f1: 0.6893
 epoch: 85, train_loss: 0.2837, test_loss: 1.2424, test_f1: 0.6725
 epoch: 86, train_loss: 0.2863, test_loss: 1.2688, test_f1: 0.6742
 epoch: 87, train_loss: 0.2817, test_loss: 1.2654, test_f1: 0.6720
 epoch: 88, train_loss: 0.2941, test_loss: 1.3055, test_f1: 0.6548
 epoch: 89, train_loss: 0.2796, test_loss: 1.3104, test_f1: 0.6488
 epoch: 90, train_loss: 0.2808, test_loss: 1.3225, test_f1: 0.6646
 epoch: 91, train_loss: 0.2690, test_loss: 1.2398, test_f1: 0.6415
 epoch: 92, train_loss: 0.2648, test_loss: 1.2382, test_f1: 0.6705
 epoch: 93, train_loss: 0.2546, test_loss: 1.3331, test_f1: 0.6498
 epoch: 94, train_loss: 0.2821, test_loss: 1.3096, test_f1: 0.6564
 epoch: 95, train_loss: 0.2445, test_loss: 1.2452, test_f1: 0.6514
 epoch: 96, train_loss: 0.2746, test_loss: 1.2379, test_f1: 0.6557
 epoch: 97, train_loss: 0.2488, test_loss: 1.3621, test_f1: 0.6467
 epoch: 98, train_loss: 0.2731, test_loss: 1.2210, test_f1: 0.6548
 epoch: 99, train_loss: 0.2670, test_loss: 1.4564, test_f1: 0.6577
##################ITERATION #6 ****************************************
 epoch: 0, train_loss: 1.3069, test_loss: 1.2289, test_f1: 0.3443
 epoch: 1, train_loss: 1.0188, test_loss: 0.9895, test_f1: 0.4928
 epoch: 2, train_loss: 0.9557, test_loss: 0.9632, test_f1: 0.5158
 epoch: 3, train_loss: 0.9300, test_loss: 0.9524, test_f1: 0.5256
 epoch: 4, train_loss: 0.9024, test_loss: 0.9010, test_f1: 0.5408
 epoch: 5, train_loss: 0.8952, test_loss: 0.9187, test_f1: 0.5596
 epoch: 6, train_loss: 0.8654, test_loss: 0.8799, test_f1: 0.5666
 epoch: 7, train_loss: 0.8383, test_loss: 0.8470, test_f1: 0.5762
 epoch: 8, train_loss: 0.8297, test_loss: 0.8277, test_f1: 0.5722
 epoch: 9, train_loss: 0.8211, test_loss: 0.8070, test_f1: 0.5910
 epoch: 10, train_loss: 0.8017, test_loss: 0.8106, test_f1: 0.5939
 epoch: 11, train_loss: 0.8028, test_loss: 0.8061, test_f1: 0.5765
 epoch: 12, train_loss: 0.7958, test_loss: 0.7827, test_f1: 0.6129
 epoch: 13, train_loss: 0.7670, test_loss: 0.8173, test_f1: 0.6103
 epoch: 14, train_loss: 0.7538, test_loss: 0.7990, test_f1: 0.6274
 epoch: 15, train_loss: 0.7530, test_loss: 0.8109, test_f1: 0.6369
 epoch: 16, train_loss: 0.7379, test_loss: 0.8090, test_f1: 0.6213
 epoch: 17, train_loss: 0.7153, test_loss: 0.8088, test_f1: 0.6396
 epoch: 18, train_loss: 0.7206, test_loss: 0.7714, test_f1: 0.6508
 epoch: 19, train_loss: 0.7049, test_loss: 0.9031, test_f1: 0.6460
 epoch: 20, train_loss: 0.6897, test_loss: 0.7731, test_f1: 0.6473
 epoch: 21, train_loss: 0.6991, test_loss: 0.7637, test_f1: 0.6327
 epoch: 22, train_loss: 0.6781, test_loss: 0.7720, test_f1: 0.6790
 epoch: 23, train_loss: 0.6577, test_loss: 0.7951, test_f1: 0.6580
 epoch: 24, train_loss: 0.6768, test_loss: 0.7914, test_f1: 0.6501
 epoch: 25, train_loss: 0.6572, test_loss: 0.8485, test_f1: 0.6115
 epoch: 26, train_loss: 0.6529, test_loss: 0.7601, test_f1: 0.6238
 epoch: 27, train_loss: 0.6362, test_loss: 0.7782, test_f1: 0.6521
 epoch: 28, train_loss: 0.6365, test_loss: 0.7590, test_f1: 0.6580
 epoch: 29, train_loss: 0.6283, test_loss: 0.7708, test_f1: 0.6278
 epoch: 30, train_loss: 0.6054, test_loss: 0.7471, test_f1: 0.6649
 epoch: 31, train_loss: 0.6019, test_loss: 0.7639, test_f1: 0.6797
 epoch: 32, train_loss: 0.5953, test_loss: 0.8250, test_f1: 0.6449
 epoch: 33, train_loss: 0.5980, test_loss: 0.8309, test_f1: 0.6470
 epoch: 34, train_loss: 0.5858, test_loss: 0.8287, test_f1: 0.6682
 epoch: 35, train_loss: 0.5877, test_loss: 0.7773, test_f1: 0.6521
 epoch: 36, train_loss: 0.5699, test_loss: 0.8160, test_f1: 0.6626
 epoch: 37, train_loss: 0.5514, test_loss: 0.8522, test_f1: 0.6651
 epoch: 38, train_loss: 0.5587, test_loss: 0.8349, test_f1: 0.6614
 epoch: 39, train_loss: 0.5593, test_loss: 0.8896, test_f1: 0.6041
 epoch: 40, train_loss: 0.5534, test_loss: 0.9397, test_f1: 0.6539
 epoch: 41, train_loss: 0.5450, test_loss: 0.7948, test_f1: 0.6653
 epoch: 42, train_loss: 0.5233, test_loss: 0.8227, test_f1: 0.6678
 epoch: 43, train_loss: 0.5252, test_loss: 0.8682, test_f1: 0.6973
 epoch: 44, train_loss: 0.5320, test_loss: 0.8886, test_f1: 0.6747
 epoch: 45, train_loss: 0.4925, test_loss: 0.8568, test_f1: 0.7020
 epoch: 46, train_loss: 0.4954, test_loss: 0.8792, test_f1: 0.6646
 epoch: 47, train_loss: 0.5156, test_loss: 0.8565, test_f1: 0.6796
 epoch: 48, train_loss: 0.4972, test_loss: 0.9071, test_f1: 0.6726
 epoch: 49, train_loss: 0.4782, test_loss: 0.9150, test_f1: 0.6388
 epoch: 50, train_loss: 0.5063, test_loss: 0.8761, test_f1: 0.6536
 epoch: 51, train_loss: 0.4548, test_loss: 0.9186, test_f1: 0.6746
 epoch: 52, train_loss: 0.4257, test_loss: 0.9641, test_f1: 0.6639
 epoch: 53, train_loss: 0.4023, test_loss: 1.0040, test_f1: 0.6565
 epoch: 54, train_loss: 0.3973, test_loss: 0.9936, test_f1: 0.6901
 epoch: 55, train_loss: 0.4039, test_loss: 0.9638, test_f1: 0.6777
 epoch: 56, train_loss: 0.3873, test_loss: 0.9954, test_f1: 0.6683
 epoch: 57, train_loss: 0.3875, test_loss: 0.9506, test_f1: 0.6774
 epoch: 58, train_loss: 0.3932, test_loss: 1.0418, test_f1: 0.6515
 epoch: 59, train_loss: 0.3841, test_loss: 1.1077, test_f1: 0.6378
 epoch: 60, train_loss: 0.3823, test_loss: 1.0681, test_f1: 0.6589
 epoch: 61, train_loss: 0.3831, test_loss: 1.0762, test_f1: 0.6445
 epoch: 62, train_loss: 0.3612, test_loss: 1.1377, test_f1: 0.6695
 epoch: 63, train_loss: 0.3814, test_loss: 1.0974, test_f1: 0.6845
 epoch: 64, train_loss: 0.3599, test_loss: 1.0512, test_f1: 0.6701
 epoch: 65, train_loss: 0.3611, test_loss: 1.1061, test_f1: 0.6633
 epoch: 66, train_loss: 0.3688, test_loss: 1.1269, test_f1: 0.6562
 epoch: 67, train_loss: 0.3821, test_loss: 1.0506, test_f1: 0.6829
 epoch: 68, train_loss: 0.3557, test_loss: 1.0504, test_f1: 0.6819
 epoch: 69, train_loss: 0.3440, test_loss: 1.1020, test_f1: 0.6656
 epoch: 70, train_loss: 0.3418, test_loss: 1.2026, test_f1: 0.6464
 epoch: 71, train_loss: 0.3453, test_loss: 1.1856, test_f1: 0.6701
 epoch: 72, train_loss: 0.3344, test_loss: 1.1418, test_f1: 0.6570
 epoch: 73, train_loss: 0.3617, test_loss: 1.1284, test_f1: 0.6509
 epoch: 74, train_loss: 0.3452, test_loss: 1.1129, test_f1: 0.6834
 epoch: 75, train_loss: 0.3268, test_loss: 1.1406, test_f1: 0.6608
 epoch: 76, train_loss: 0.3277, test_loss: 1.2242, test_f1: 0.6594
 epoch: 77, train_loss: 0.3255, test_loss: 1.1937, test_f1: 0.6629
 epoch: 78, train_loss: 0.3375, test_loss: 1.1794, test_f1: 0.6639
 epoch: 79, train_loss: 0.3162, test_loss: 1.2166, test_f1: 0.6603
 epoch: 80, train_loss: 0.2964, test_loss: 1.2174, test_f1: 0.6532
 epoch: 81, train_loss: 0.3109, test_loss: 1.2124, test_f1: 0.6498
 epoch: 82, train_loss: 0.3349, test_loss: 1.1969, test_f1: 0.6713
 epoch: 83, train_loss: 0.3224, test_loss: 1.1617, test_f1: 0.6684
 epoch: 84, train_loss: 0.3127, test_loss: 1.2308, test_f1: 0.6649
 epoch: 85, train_loss: 0.3050, test_loss: 1.2240, test_f1: 0.6663
 epoch: 86, train_loss: 0.2913, test_loss: 1.2346, test_f1: 0.6715
 epoch: 87, train_loss: 0.2779, test_loss: 1.2364, test_f1: 0.6548
 epoch: 88, train_loss: 0.2951, test_loss: 1.2664, test_f1: 0.6680
 epoch: 89, train_loss: 0.2865, test_loss: 1.2290, test_f1: 0.6677
 epoch: 90, train_loss: 0.2838, test_loss: 1.3502, test_f1: 0.6535
 epoch: 91, train_loss: 0.2982, test_loss: 1.3175, test_f1: 0.6476
 epoch: 92, train_loss: 0.2971, test_loss: 1.3643, test_f1: 0.6639
 epoch: 93, train_loss: 0.2958, test_loss: 1.4922, test_f1: 0.6339
 epoch: 94, train_loss: 0.3101, test_loss: 1.3349, test_f1: 0.6564
 epoch: 95, train_loss: 0.2789, test_loss: 1.4731, test_f1: 0.6451
 epoch: 96, train_loss: 0.2854, test_loss: 1.4137, test_f1: 0.6620
 epoch: 97, train_loss: 0.2889, test_loss: 1.3540, test_f1: 0.6576
 epoch: 98, train_loss: 0.2789, test_loss: 1.4395, test_f1: 0.6513
 epoch: 99, train_loss: 0.2803, test_loss: 1.4203, test_f1: 0.6450
##################ITERATION #7 ****************************************
 epoch: 0, train_loss: 1.3311, test_loss: 1.0270, test_f1: 0.3873
 epoch: 1, train_loss: 1.0098, test_loss: 0.9539, test_f1: 0.4975
 epoch: 2, train_loss: 0.9622, test_loss: 0.9220, test_f1: 0.4947
 epoch: 3, train_loss: 0.9530, test_loss: 0.9297, test_f1: 0.5054
 epoch: 4, train_loss: 0.9265, test_loss: 0.8720, test_f1: 0.5349
 epoch: 5, train_loss: 0.9090, test_loss: 0.8818, test_f1: 0.5437
 epoch: 6, train_loss: 0.9092, test_loss: 0.8955, test_f1: 0.5749
 epoch: 7, train_loss: 0.8812, test_loss: 0.8855, test_f1: 0.5462
 epoch: 8, train_loss: 0.8557, test_loss: 0.9027, test_f1: 0.5601
 epoch: 9, train_loss: 0.8591, test_loss: 0.8124, test_f1: 0.5675
 epoch: 10, train_loss: 0.8472, test_loss: 0.8191, test_f1: 0.5922
 epoch: 11, train_loss: 0.8238, test_loss: 0.8541, test_f1: 0.5922
 epoch: 12, train_loss: 0.8157, test_loss: 0.8547, test_f1: 0.5726
 epoch: 13, train_loss: 0.7845, test_loss: 0.8255, test_f1: 0.5503
 epoch: 14, train_loss: 0.7961, test_loss: 0.8407, test_f1: 0.6180
 epoch: 15, train_loss: 0.7706, test_loss: 0.8285, test_f1: 0.5649
 epoch: 16, train_loss: 0.7561, test_loss: 0.8090, test_f1: 0.6144
 epoch: 17, train_loss: 0.7688, test_loss: 0.7621, test_f1: 0.5967
 epoch: 18, train_loss: 0.7494, test_loss: 0.7656, test_f1: 0.6172
 epoch: 19, train_loss: 0.7372, test_loss: 0.8013, test_f1: 0.6270
 epoch: 20, train_loss: 0.7264, test_loss: 0.8258, test_f1: 0.6224
 epoch: 21, train_loss: 0.7308, test_loss: 0.9006, test_f1: 0.6245
 epoch: 22, train_loss: 0.7260, test_loss: 0.8280, test_f1: 0.6478
 epoch: 23, train_loss: 0.7052, test_loss: 0.8174, test_f1: 0.6268
 epoch: 24, train_loss: 0.6799, test_loss: 0.8593, test_f1: 0.6313
 epoch: 25, train_loss: 0.6781, test_loss: 0.8696, test_f1: 0.6065
 epoch: 26, train_loss: 0.6439, test_loss: 0.8024, test_f1: 0.6569
 epoch: 27, train_loss: 0.6609, test_loss: 0.7752, test_f1: 0.6566
 epoch: 28, train_loss: 0.6576, test_loss: 0.8340, test_f1: 0.6514
 epoch: 29, train_loss: 0.6537, test_loss: 0.7617, test_f1: 0.6629
 epoch: 30, train_loss: 0.6587, test_loss: 0.7816, test_f1: 0.6424
 epoch: 31, train_loss: 0.6546, test_loss: 0.8404, test_f1: 0.6476
 epoch: 32, train_loss: 0.6277, test_loss: 0.7897, test_f1: 0.6537
 epoch: 33, train_loss: 0.6246, test_loss: 0.7683, test_f1: 0.6834
 epoch: 34, train_loss: 0.6173, test_loss: 0.7703, test_f1: 0.6454
 epoch: 35, train_loss: 0.6172, test_loss: 0.8327, test_f1: 0.6343
 epoch: 36, train_loss: 0.6000, test_loss: 0.8133, test_f1: 0.6561
 epoch: 37, train_loss: 0.6123, test_loss: 0.7907, test_f1: 0.6752
 epoch: 38, train_loss: 0.5904, test_loss: 0.8072, test_f1: 0.6570
 epoch: 39, train_loss: 0.5905, test_loss: 0.8059, test_f1: 0.6538
 epoch: 40, train_loss: 0.5879, test_loss: 0.8199, test_f1: 0.6159
 epoch: 41, train_loss: 0.5739, test_loss: 0.8243, test_f1: 0.6529
 epoch: 42, train_loss: 0.5577, test_loss: 0.8693, test_f1: 0.6103
 epoch: 43, train_loss: 0.5657, test_loss: 0.8383, test_f1: 0.6455
 epoch: 44, train_loss: 0.5466, test_loss: 0.8335, test_f1: 0.6698
 epoch: 45, train_loss: 0.5441, test_loss: 0.8659, test_f1: 0.6659
 epoch: 46, train_loss: 0.5352, test_loss: 0.8885, test_f1: 0.6643
 epoch: 47, train_loss: 0.5288, test_loss: 0.9601, test_f1: 0.6472
 epoch: 48, train_loss: 0.5313, test_loss: 0.9703, test_f1: 0.6534
 epoch: 49, train_loss: 0.5394, test_loss: 0.8615, test_f1: 0.6870
 epoch: 50, train_loss: 0.5220, test_loss: 0.8755, test_f1: 0.6409
 epoch: 51, train_loss: 0.4881, test_loss: 0.8957, test_f1: 0.6765
 epoch: 52, train_loss: 0.4648, test_loss: 0.8927, test_f1: 0.6834
 epoch: 53, train_loss: 0.4588, test_loss: 0.9006, test_f1: 0.6697
 epoch: 54, train_loss: 0.4365, test_loss: 0.9113, test_f1: 0.6742
 epoch: 55, train_loss: 0.4280, test_loss: 0.9565, test_f1: 0.6816
 epoch: 56, train_loss: 0.4250, test_loss: 0.9878, test_f1: 0.6652
 epoch: 57, train_loss: 0.4478, test_loss: 0.9530, test_f1: 0.6678
 epoch: 58, train_loss: 0.4056, test_loss: 0.9063, test_f1: 0.7007
 epoch: 59, train_loss: 0.3998, test_loss: 0.9387, test_f1: 0.6742
 epoch: 60, train_loss: 0.4090, test_loss: 1.0076, test_f1: 0.6568
 epoch: 61, train_loss: 0.4048, test_loss: 1.0079, test_f1: 0.6784
 epoch: 62, train_loss: 0.3999, test_loss: 0.9835, test_f1: 0.6723
 epoch: 63, train_loss: 0.4024, test_loss: 0.9683, test_f1: 0.6575
 epoch: 64, train_loss: 0.3895, test_loss: 1.0138, test_f1: 0.6530
 epoch: 65, train_loss: 0.4003, test_loss: 0.9288, test_f1: 0.6786
 epoch: 66, train_loss: 0.3780, test_loss: 1.0433, test_f1: 0.6682
 epoch: 67, train_loss: 0.3803, test_loss: 1.0928, test_f1: 0.6404
 epoch: 68, train_loss: 0.3911, test_loss: 1.0490, test_f1: 0.6697
 epoch: 69, train_loss: 0.3852, test_loss: 1.1242, test_f1: 0.6788
 epoch: 70, train_loss: 0.3728, test_loss: 1.1871, test_f1: 0.6696
 epoch: 71, train_loss: 0.3754, test_loss: 1.1520, test_f1: 0.6698
 epoch: 72, train_loss: 0.3782, test_loss: 1.1349, test_f1: 0.6868
 epoch: 73, train_loss: 0.3469, test_loss: 1.2123, test_f1: 0.6561
 epoch: 74, train_loss: 0.3801, test_loss: 1.1283, test_f1: 0.6719
 epoch: 75, train_loss: 0.3576, test_loss: 1.0979, test_f1: 0.6662
 epoch: 76, train_loss: 0.3634, test_loss: 1.0666, test_f1: 0.6695
 epoch: 77, train_loss: 0.3484, test_loss: 1.0960, test_f1: 0.6673
 epoch: 78, train_loss: 0.3514, test_loss: 1.2143, test_f1: 0.6506
 epoch: 79, train_loss: 0.3339, test_loss: 1.2162, test_f1: 0.6593
 epoch: 80, train_loss: 0.3633, test_loss: 1.1881, test_f1: 0.6720
 epoch: 81, train_loss: 0.3340, test_loss: 1.1557, test_f1: 0.6613
 epoch: 82, train_loss: 0.3436, test_loss: 1.2201, test_f1: 0.6674
 epoch: 83, train_loss: 0.3225, test_loss: 1.2434, test_f1: 0.6618
 epoch: 84, train_loss: 0.3285, test_loss: 1.1983, test_f1: 0.6781
 epoch: 85, train_loss: 0.3506, test_loss: 1.1443, test_f1: 0.6598
 epoch: 86, train_loss: 0.3272, test_loss: 1.2279, test_f1: 0.6521
 epoch: 87, train_loss: 0.2900, test_loss: 1.2902, test_f1: 0.6660
 epoch: 88, train_loss: 0.3338, test_loss: 1.3154, test_f1: 0.6561
 epoch: 89, train_loss: 0.3432, test_loss: 1.3374, test_f1: 0.6527
 epoch: 90, train_loss: 0.3140, test_loss: 1.3625, test_f1: 0.6530
 epoch: 91, train_loss: 0.3158, test_loss: 1.3502, test_f1: 0.6697
 epoch: 92, train_loss: 0.2956, test_loss: 1.3770, test_f1: 0.6554
 epoch: 93, train_loss: 0.3086, test_loss: 1.4165, test_f1: 0.6477
 epoch: 94, train_loss: 0.3013, test_loss: 1.2823, test_f1: 0.6565
 epoch: 95, train_loss: 0.2949, test_loss: 1.3383, test_f1: 0.6595
 epoch: 96, train_loss: 0.2999, test_loss: 1.2723, test_f1: 0.6593
 epoch: 97, train_loss: 0.3038, test_loss: 1.3322, test_f1: 0.6597
 epoch: 98, train_loss: 0.2999, test_loss: 1.3805, test_f1: 0.6527
 epoch: 99, train_loss: 0.2902, test_loss: 1.4336, test_f1: 0.6494
##################ITERATION #8 ****************************************
 epoch: 0, train_loss: 1.2521, test_loss: 1.0900, test_f1: 0.4207
 epoch: 1, train_loss: 1.0032, test_loss: 0.9554, test_f1: 0.5292
 epoch: 2, train_loss: 0.9605, test_loss: 0.9481, test_f1: 0.5296
 epoch: 3, train_loss: 0.9384, test_loss: 0.9741, test_f1: 0.5194
 epoch: 4, train_loss: 0.9114, test_loss: 0.8862, test_f1: 0.5180
 epoch: 5, train_loss: 0.8972, test_loss: 0.8819, test_f1: 0.5429
 epoch: 6, train_loss: 0.8646, test_loss: 0.8843, test_f1: 0.5032
 epoch: 7, train_loss: 0.8585, test_loss: 0.8487, test_f1: 0.6140
 epoch: 8, train_loss: 0.8277, test_loss: 0.8187, test_f1: 0.5961
 epoch: 9, train_loss: 0.8150, test_loss: 0.8209, test_f1: 0.5916
 epoch: 10, train_loss: 0.8040, test_loss: 0.8485, test_f1: 0.5669
 epoch: 11, train_loss: 0.7882, test_loss: 0.7728, test_f1: 0.6273
 epoch: 12, train_loss: 0.7637, test_loss: 0.7891, test_f1: 0.6484
 epoch: 13, train_loss: 0.7554, test_loss: 0.7606, test_f1: 0.6345
 epoch: 14, train_loss: 0.7408, test_loss: 0.7456, test_f1: 0.6433
 epoch: 15, train_loss: 0.7303, test_loss: 0.7024, test_f1: 0.6952
 epoch: 16, train_loss: 0.7193, test_loss: 0.7385, test_f1: 0.6936
 epoch: 17, train_loss: 0.7000, test_loss: 0.7229, test_f1: 0.6450
 epoch: 18, train_loss: 0.6977, test_loss: 0.7841, test_f1: 0.6384
 epoch: 19, train_loss: 0.6773, test_loss: 0.6971, test_f1: 0.6676
 epoch: 20, train_loss: 0.6726, test_loss: 0.6771, test_f1: 0.6659
 epoch: 21, train_loss: 0.6601, test_loss: 0.7266, test_f1: 0.6462
 epoch: 22, train_loss: 0.6377, test_loss: 0.7216, test_f1: 0.6780
 epoch: 23, train_loss: 0.6324, test_loss: 0.7720, test_f1: 0.6557
 epoch: 24, train_loss: 0.6370, test_loss: 0.7573, test_f1: 0.6696
 epoch: 25, train_loss: 0.6230, test_loss: 0.6939, test_f1: 0.6933
 epoch: 26, train_loss: 0.6138, test_loss: 0.7254, test_f1: 0.6958
 epoch: 27, train_loss: 0.6138, test_loss: 0.7034, test_f1: 0.6564
 epoch: 28, train_loss: 0.5925, test_loss: 0.7374, test_f1: 0.6747
 epoch: 29, train_loss: 0.5856, test_loss: 0.7126, test_f1: 0.6726
 epoch: 30, train_loss: 0.5643, test_loss: 0.6926, test_f1: 0.7004
 epoch: 31, train_loss: 0.5930, test_loss: 0.6815, test_f1: 0.6981
 epoch: 32, train_loss: 0.5584, test_loss: 0.7482, test_f1: 0.6934
 epoch: 33, train_loss: 0.5509, test_loss: 0.7888, test_f1: 0.6867
 epoch: 34, train_loss: 0.5648, test_loss: 0.7149, test_f1: 0.6808
 epoch: 35, train_loss: 0.5488, test_loss: 0.7223, test_f1: 0.6875
 epoch: 36, train_loss: 0.5323, test_loss: 0.7361, test_f1: 0.6493
 epoch: 37, train_loss: 0.5300, test_loss: 0.6984, test_f1: 0.6725
 epoch: 38, train_loss: 0.5267, test_loss: 0.7782, test_f1: 0.6907
 epoch: 39, train_loss: 0.5185, test_loss: 0.7908, test_f1: 0.6604
 epoch: 40, train_loss: 0.5260, test_loss: 0.8023, test_f1: 0.6621
 epoch: 41, train_loss: 0.5051, test_loss: 0.8411, test_f1: 0.6623
 epoch: 42, train_loss: 0.4991, test_loss: 0.8452, test_f1: 0.6751
 epoch: 43, train_loss: 0.4920, test_loss: 0.7972, test_f1: 0.6632
 epoch: 44, train_loss: 0.4924, test_loss: 0.8630, test_f1: 0.6767
 epoch: 45, train_loss: 0.4892, test_loss: 0.8972, test_f1: 0.6418
 epoch: 46, train_loss: 0.5133, test_loss: 0.8311, test_f1: 0.6739
 epoch: 47, train_loss: 0.4842, test_loss: 0.9081, test_f1: 0.7063
 epoch: 48, train_loss: 0.4678, test_loss: 0.9152, test_f1: 0.6810
 epoch: 49, train_loss: 0.4667, test_loss: 0.9522, test_f1: 0.6468
 epoch: 50, train_loss: 0.4636, test_loss: 0.8179, test_f1: 0.6720
 epoch: 51, train_loss: 0.4011, test_loss: 0.9005, test_f1: 0.6674
 epoch: 52, train_loss: 0.3907, test_loss: 0.9592, test_f1: 0.6920
 epoch: 53, train_loss: 0.3784, test_loss: 0.9868, test_f1: 0.6736
 epoch: 54, train_loss: 0.3610, test_loss: 0.9817, test_f1: 0.6817
 epoch: 55, train_loss: 0.3647, test_loss: 1.0857, test_f1: 0.6540
 epoch: 56, train_loss: 0.3588, test_loss: 1.0461, test_f1: 0.6810
 epoch: 57, train_loss: 0.3761, test_loss: 0.9544, test_f1: 0.6796
 epoch: 58, train_loss: 0.3631, test_loss: 1.0272, test_f1: 0.6835
 epoch: 59, train_loss: 0.3547, test_loss: 1.0595, test_f1: 0.6560
 epoch: 60, train_loss: 0.3493, test_loss: 1.1192, test_f1: 0.6578
 epoch: 61, train_loss: 0.3483, test_loss: 1.1206, test_f1: 0.6895
 epoch: 62, train_loss: 0.3699, test_loss: 1.1069, test_f1: 0.6683
 epoch: 63, train_loss: 0.3345, test_loss: 1.1054, test_f1: 0.6471
 epoch: 64, train_loss: 0.3126, test_loss: 1.2237, test_f1: 0.6711
 epoch: 65, train_loss: 0.3318, test_loss: 1.2294, test_f1: 0.6577
 epoch: 66, train_loss: 0.3300, test_loss: 1.2115, test_f1: 0.6668
 epoch: 67, train_loss: 0.3303, test_loss: 1.1592, test_f1: 0.6788
 epoch: 68, train_loss: 0.3135, test_loss: 1.2498, test_f1: 0.6767
 epoch: 69, train_loss: 0.3214, test_loss: 1.1868, test_f1: 0.6702
 epoch: 70, train_loss: 0.3233, test_loss: 1.3255, test_f1: 0.6677
 epoch: 71, train_loss: 0.3053, test_loss: 1.3362, test_f1: 0.6675
 epoch: 72, train_loss: 0.2987, test_loss: 1.3003, test_f1: 0.6592
 epoch: 73, train_loss: 0.3130, test_loss: 1.3683, test_f1: 0.6813
 epoch: 74, train_loss: 0.2861, test_loss: 1.3456, test_f1: 0.6579
 epoch: 75, train_loss: 0.3124, test_loss: 1.3520, test_f1: 0.6502
 epoch: 76, train_loss: 0.2917, test_loss: 1.3131, test_f1: 0.6837
 epoch: 77, train_loss: 0.2882, test_loss: 1.3556, test_f1: 0.6672
 epoch: 78, train_loss: 0.2790, test_loss: 1.3459, test_f1: 0.6656
 epoch: 79, train_loss: 0.2960, test_loss: 1.3883, test_f1: 0.6772
 epoch: 80, train_loss: 0.2928, test_loss: 1.4107, test_f1: 0.6649
 epoch: 81, train_loss: 0.2990, test_loss: 1.3303, test_f1: 0.6687
 epoch: 82, train_loss: 0.2995, test_loss: 1.4337, test_f1: 0.6582
 epoch: 83, train_loss: 0.2787, test_loss: 1.4432, test_f1: 0.6742
 epoch: 84, train_loss: 0.2866, test_loss: 1.3501, test_f1: 0.6715
 epoch: 85, train_loss: 0.2713, test_loss: 1.4545, test_f1: 0.6767
 epoch: 86, train_loss: 0.2750, test_loss: 1.4142, test_f1: 0.6816
 epoch: 87, train_loss: 0.2676, test_loss: 1.4188, test_f1: 0.6694
 epoch: 88, train_loss: 0.2794, test_loss: 1.4691, test_f1: 0.6603
 epoch: 89, train_loss: 0.2561, test_loss: 1.4113, test_f1: 0.6846
 epoch: 90, train_loss: 0.2730, test_loss: 1.4113, test_f1: 0.6656
 epoch: 91, train_loss: 0.2534, test_loss: 1.4589, test_f1: 0.6811
 epoch: 92, train_loss: 0.2516, test_loss: 1.5476, test_f1: 0.6775
 epoch: 93, train_loss: 0.2596, test_loss: 1.5689, test_f1: 0.6623
 epoch: 94, train_loss: 0.2718, test_loss: 1.4869, test_f1: 0.6636
 epoch: 95, train_loss: 0.2462, test_loss: 1.6512, test_f1: 0.6633
 epoch: 96, train_loss: 0.2572, test_loss: 1.5654, test_f1: 0.6596
 epoch: 97, train_loss: 0.2494, test_loss: 1.5768, test_f1: 0.6656
 epoch: 98, train_loss: 0.2229, test_loss: 1.6307, test_f1: 0.6623
 epoch: 99, train_loss: 0.2348, test_loss: 1.7371, test_f1: 0.6599
##################ITERATION #9 ****************************************
 epoch: 0, train_loss: 1.3496, test_loss: 1.2061, test_f1: 0.3980
 epoch: 1, train_loss: 1.0297, test_loss: 0.9866, test_f1: 0.5001
 epoch: 2, train_loss: 0.9762, test_loss: 0.9154, test_f1: 0.5255
 epoch: 3, train_loss: 0.9550, test_loss: 0.9575, test_f1: 0.5256
 epoch: 4, train_loss: 0.9322, test_loss: 0.9131, test_f1: 0.5262
 epoch: 5, train_loss: 0.9089, test_loss: 0.8962, test_f1: 0.5409
 epoch: 6, train_loss: 0.8950, test_loss: 0.8490, test_f1: 0.5531
 epoch: 7, train_loss: 0.8735, test_loss: 0.8496, test_f1: 0.5748
 epoch: 8, train_loss: 0.8524, test_loss: 0.8944, test_f1: 0.5380
 epoch: 9, train_loss: 0.8562, test_loss: 0.8366, test_f1: 0.5803
 epoch: 10, train_loss: 0.8467, test_loss: 0.8546, test_f1: 0.5803
 epoch: 11, train_loss: 0.8222, test_loss: 0.8293, test_f1: 0.6013
 epoch: 12, train_loss: 0.8014, test_loss: 0.8183, test_f1: 0.6169
 epoch: 13, train_loss: 0.7837, test_loss: 0.7976, test_f1: 0.5962
 epoch: 14, train_loss: 0.7648, test_loss: 0.8382, test_f1: 0.6052
 epoch: 15, train_loss: 0.7409, test_loss: 0.7930, test_f1: 0.6340
 epoch: 16, train_loss: 0.7436, test_loss: 0.7884, test_f1: 0.6072
 epoch: 17, train_loss: 0.7484, test_loss: 0.8250, test_f1: 0.5813
 epoch: 18, train_loss: 0.7380, test_loss: 0.8207, test_f1: 0.6007
 epoch: 19, train_loss: 0.7194, test_loss: 0.7861, test_f1: 0.6155
 epoch: 20, train_loss: 0.6866, test_loss: 0.7644, test_f1: 0.6414
 epoch: 21, train_loss: 0.6819, test_loss: 0.7722, test_f1: 0.6311
 epoch: 22, train_loss: 0.6816, test_loss: 0.8426, test_f1: 0.6226
 epoch: 23, train_loss: 0.6694, test_loss: 0.8658, test_f1: 0.6280
 epoch: 24, train_loss: 0.6593, test_loss: 0.8200, test_f1: 0.6498
 epoch: 25, train_loss: 0.6629, test_loss: 0.8095, test_f1: 0.6167
 epoch: 26, train_loss: 0.6505, test_loss: 0.8500, test_f1: 0.6532
 epoch: 27, train_loss: 0.6243, test_loss: 0.8160, test_f1: 0.6552
 epoch: 28, train_loss: 0.6073, test_loss: 0.8074, test_f1: 0.6578
 epoch: 29, train_loss: 0.6198, test_loss: 0.8172, test_f1: 0.6295
 epoch: 30, train_loss: 0.6049, test_loss: 0.8059, test_f1: 0.6462
 epoch: 31, train_loss: 0.6138, test_loss: 0.8634, test_f1: 0.6428
 epoch: 32, train_loss: 0.5969, test_loss: 1.0468, test_f1: 0.6090
 epoch: 33, train_loss: 0.5920, test_loss: 0.7561, test_f1: 0.6579
 epoch: 34, train_loss: 0.5668, test_loss: 0.8192, test_f1: 0.6662
 epoch: 35, train_loss: 0.5597, test_loss: 0.8125, test_f1: 0.6485
 epoch: 36, train_loss: 0.5858, test_loss: 0.7716, test_f1: 0.6856
 epoch: 37, train_loss: 0.5578, test_loss: 0.8785, test_f1: 0.6340
 epoch: 38, train_loss: 0.5529, test_loss: 0.8080, test_f1: 0.6573
 epoch: 39, train_loss: 0.5297, test_loss: 0.7758, test_f1: 0.6697
 epoch: 40, train_loss: 0.5341, test_loss: 0.8226, test_f1: 0.6417
 epoch: 41, train_loss: 0.5398, test_loss: 0.7635, test_f1: 0.6698
 epoch: 42, train_loss: 0.5357, test_loss: 0.7859, test_f1: 0.6331
 epoch: 43, train_loss: 0.4922, test_loss: 0.8098, test_f1: 0.6691
 epoch: 44, train_loss: 0.5277, test_loss: 0.8632, test_f1: 0.6535
 epoch: 45, train_loss: 0.4992, test_loss: 0.8522, test_f1: 0.6433
 epoch: 46, train_loss: 0.5197, test_loss: 0.8145, test_f1: 0.6510
 epoch: 47, train_loss: 0.5302, test_loss: 0.9026, test_f1: 0.6473
 epoch: 48, train_loss: 0.5141, test_loss: 0.8237, test_f1: 0.6772
 epoch: 49, train_loss: 0.5100, test_loss: 0.7855, test_f1: 0.6832
 epoch: 50, train_loss: 0.4738, test_loss: 0.8934, test_f1: 0.6267
 epoch: 51, train_loss: 0.4344, test_loss: 0.8050, test_f1: 0.6619
 epoch: 52, train_loss: 0.4136, test_loss: 0.9059, test_f1: 0.6775
 epoch: 53, train_loss: 0.4058, test_loss: 0.9784, test_f1: 0.6719
 epoch: 54, train_loss: 0.3990, test_loss: 0.9216, test_f1: 0.6629
 epoch: 55, train_loss: 0.3862, test_loss: 0.9456, test_f1: 0.6792
 epoch: 56, train_loss: 0.3876, test_loss: 0.9995, test_f1: 0.6568
 epoch: 57, train_loss: 0.3873, test_loss: 0.8793, test_f1: 0.6663
 epoch: 58, train_loss: 0.3792, test_loss: 0.9134, test_f1: 0.6810
 epoch: 59, train_loss: 0.3877, test_loss: 0.9573, test_f1: 0.6721
 epoch: 60, train_loss: 0.3670, test_loss: 0.9034, test_f1: 0.6717
 epoch: 61, train_loss: 0.3549, test_loss: 1.0008, test_f1: 0.6757
 epoch: 62, train_loss: 0.3667, test_loss: 0.8893, test_f1: 0.6716
 epoch: 63, train_loss: 0.3601, test_loss: 0.9765, test_f1: 0.6735
 epoch: 64, train_loss: 0.3599, test_loss: 1.0554, test_f1: 0.6733
 epoch: 65, train_loss: 0.3530, test_loss: 0.9511, test_f1: 0.6719
 epoch: 66, train_loss: 0.3565, test_loss: 0.9805, test_f1: 0.6661
 epoch: 67, train_loss: 0.3542, test_loss: 0.9551, test_f1: 0.6926
 epoch: 68, train_loss: 0.3455, test_loss: 1.0290, test_f1: 0.6803
 epoch: 69, train_loss: 0.3431, test_loss: 1.0741, test_f1: 0.6753
 epoch: 70, train_loss: 0.3287, test_loss: 1.1049, test_f1: 0.6759
 epoch: 71, train_loss: 0.3157, test_loss: 1.0928, test_f1: 0.6778
 epoch: 72, train_loss: 0.3318, test_loss: 1.1047, test_f1: 0.6652
 epoch: 73, train_loss: 0.3289, test_loss: 0.9983, test_f1: 0.6886
 epoch: 74, train_loss: 0.3421, test_loss: 1.0811, test_f1: 0.6776
 epoch: 75, train_loss: 0.3211, test_loss: 1.0960, test_f1: 0.6603
 epoch: 76, train_loss: 0.3230, test_loss: 1.1139, test_f1: 0.6644
 epoch: 77, train_loss: 0.3159, test_loss: 1.0953, test_f1: 0.6923
 epoch: 78, train_loss: 0.3079, test_loss: 1.0988, test_f1: 0.6831
 epoch: 79, train_loss: 0.3114, test_loss: 1.1422, test_f1: 0.6736
 epoch: 80, train_loss: 0.2931, test_loss: 1.1314, test_f1: 0.6595
 epoch: 81, train_loss: 0.3016, test_loss: 1.0625, test_f1: 0.6834
 epoch: 82, train_loss: 0.3062, test_loss: 1.2073, test_f1: 0.6568
 epoch: 83, train_loss: 0.3063, test_loss: 1.1675, test_f1: 0.6773
 epoch: 84, train_loss: 0.3001, test_loss: 1.1611, test_f1: 0.6812
 epoch: 85, train_loss: 0.2925, test_loss: 1.1904, test_f1: 0.6870
 epoch: 86, train_loss: 0.3052, test_loss: 1.1726, test_f1: 0.6824
 epoch: 87, train_loss: 0.2809, test_loss: 1.3004, test_f1: 0.6654
 epoch: 88, train_loss: 0.2859, test_loss: 1.2269, test_f1: 0.6765
 epoch: 89, train_loss: 0.2929, test_loss: 1.2047, test_f1: 0.6537
 epoch: 90, train_loss: 0.2710, test_loss: 1.3146, test_f1: 0.6641
 epoch: 91, train_loss: 0.2690, test_loss: 1.3005, test_f1: 0.6507
 epoch: 92, train_loss: 0.2837, test_loss: 1.2408, test_f1: 0.6736
 epoch: 93, train_loss: 0.2842, test_loss: 1.1907, test_f1: 0.6610
 epoch: 94, train_loss: 0.2726, test_loss: 1.2200, test_f1: 0.6701
 epoch: 95, train_loss: 0.2705, test_loss: 1.2741, test_f1: 0.6694
 epoch: 96, train_loss: 0.2642, test_loss: 1.3974, test_f1: 0.6756
 epoch: 97, train_loss: 0.2677, test_loss: 1.3877, test_f1: 0.6752
 epoch: 98, train_loss: 0.2676, test_loss: 1.4513, test_f1: 0.6666
 epoch: 99, train_loss: 0.2635, test_loss: 1.3495, test_f1: 0.6674

Training completed in 895.36 seconds
Best F1: 0.7231 at epoch 42
Mean F1 across iterations: 0.7048  0.0079
========================FINAL RESULTS================================
FEGIN weighted F1: 0.7231  0.0079
python main.py --data ltspice_examples --representation component_pin_net --model FEGIN --layers 6 --hiddens 64 --batch_size 64 --lr 0.001 --emb_size 512 --epochs 100 --save_appendix component_pin_net_L6_H64_BS64_LR0.001_E512 --no_val
-----



STDERR:
  File "main.py", line 370, in <module>
    main()
  File "main.py", line 254, in main
    dataset = dataset_class(
  File "/home/philip/projects/ltspice_examples_code_repo/Circuit-Completion-Using-GNNs/component_classification_with_link_prediction_head/evaluation/FEGIN/kernel/circuit_datasets.py", line 15, in __init__
    self.data, self.slices = torch.load(self.processed_paths[0])
  File "/home/philip/.local/lib/python3.8/site-packages/torch/serialization.py", line 1040, in load
    warnings.warn(
  File "/usr/lib/python3.8/warnings.py", line 109, in _showwarnmsg
    sw(msg.message, msg.category, msg.filename, msg.lineno,
  File "main.py", line 47, in warn_with_traceback
    traceback.print_stack(file=log)
/home/philip/projects/ltspice_examples_code_repo/Circuit-Completion-Using-GNNs/component_classification_with_link_prediction_head/evaluation/FEGIN/kernel/circuit_datasets.py:15: FutureWarning: You are using `torch.load` with `weights_only=False` (the current default value), which uses the default pickle module implicitly. It is possible to construct malicious pickle data which will execute arbitrary code during unpickling (See https://github.com/pytorch/pytorch/blob/main/SECURITY.md#untrusted-models for more details). In a future release, the default value for `weights_only` will be flipped to `True`. This limits the functions that could be executed during unpickling. Arbitrary objects will no longer be allowed to be loaded via this mode unless they are explicitly allowlisted by the user via `torch.serialization.add_safe_globals`. We recommend you start setting `weights_only=True` for any use case where you don't have full control of the loaded file. Please open an issue on GitHub for any issues related to this experimental feature.
  self.data, self.slices = torch.load(self.processed_paths[0])
