STDOUT:
Results will be saved in /home/philip/projects/ltspice_examples_code_repo/Circuit-Completion-Using-GNNs/component_classification_with_link_prediction_head/evaluation/FEGIN/results/model_FEGIN_dataset_ltspice_demos
Command line input: python main.py --data ltspice_demos --representation component_net --model FEGIN --layers 6 --hiddens 64 --batch_size 256 --lr 0.0001 --emb_size 512 --epochs 100 --save_appendix component_net_L6_H64_BS256_LR0.0001_E512 --no_val
 is saved.
-----
ltspice_demos - FEGIN
Using 6 layers, 64 hidden units, h = 2
Loading component_net representation dataset
ENTERED
Training FEGIN on component_net representation
Train: 1565, Test: 383
##################ITERATION #0 ****************************************
 epoch: 0, train_loss: 1.3844, test_loss: 1.3928, test_f1: 0.1365
 epoch: 1, train_loss: 1.3757, test_loss: 1.3922, test_f1: 0.1365
 epoch: 2, train_loss: 1.3717, test_loss: 1.3907, test_f1: 0.1365
 epoch: 3, train_loss: 1.3660, test_loss: 1.3874, test_f1: 0.1365
 epoch: 4, train_loss: 1.3604, test_loss: 1.3834, test_f1: 0.1365
 epoch: 5, train_loss: 1.3559, test_loss: 1.3807, test_f1: 0.1365
 epoch: 6, train_loss: 1.3482, test_loss: 1.3791, test_f1: 0.1365
 epoch: 7, train_loss: 1.3426, test_loss: 1.3760, test_f1: 0.1365
 epoch: 8, train_loss: 1.3373, test_loss: 1.3713, test_f1: 0.1365
 epoch: 9, train_loss: 1.3288, test_loss: 1.3656, test_f1: 0.1365
 epoch: 10, train_loss: 1.3207, test_loss: 1.3591, test_f1: 0.1365
 epoch: 11, train_loss: 1.3111, test_loss: 1.3509, test_f1: 0.1365
 epoch: 12, train_loss: 1.3027, test_loss: 1.3422, test_f1: 0.1365
 epoch: 13, train_loss: 1.2929, test_loss: 1.3327, test_f1: 0.1365
 epoch: 14, train_loss: 1.2823, test_loss: 1.3214, test_f1: 0.1365
 epoch: 15, train_loss: 1.2720, test_loss: 1.3105, test_f1: 0.1365
 epoch: 16, train_loss: 1.2594, test_loss: 1.3017, test_f1: 0.1365
 epoch: 17, train_loss: 1.2480, test_loss: 1.2928, test_f1: 0.1365
 epoch: 18, train_loss: 1.2379, test_loss: 1.2838, test_f1: 0.1420
 epoch: 19, train_loss: 1.2263, test_loss: 1.2716, test_f1: 0.1498
 epoch: 20, train_loss: 1.2165, test_loss: 1.2633, test_f1: 0.1738
 epoch: 21, train_loss: 1.2053, test_loss: 1.2557, test_f1: 0.1902
 epoch: 22, train_loss: 1.1986, test_loss: 1.2490, test_f1: 0.2410
 epoch: 23, train_loss: 1.1901, test_loss: 1.2399, test_f1: 0.2553
 epoch: 24, train_loss: 1.1816, test_loss: 1.2352, test_f1: 0.2816
 epoch: 25, train_loss: 1.1758, test_loss: 1.2289, test_f1: 0.2871
 epoch: 26, train_loss: 1.1659, test_loss: 1.2225, test_f1: 0.3219
 epoch: 27, train_loss: 1.1590, test_loss: 1.2155, test_f1: 0.3443
 epoch: 28, train_loss: 1.1571, test_loss: 1.2124, test_f1: 0.3505
 epoch: 29, train_loss: 1.1488, test_loss: 1.2098, test_f1: 0.3342
 epoch: 30, train_loss: 1.1461, test_loss: 1.2063, test_f1: 0.3340
 epoch: 31, train_loss: 1.1402, test_loss: 1.1998, test_f1: 0.3319
 epoch: 32, train_loss: 1.1390, test_loss: 1.1947, test_f1: 0.3083
 epoch: 33, train_loss: 1.1281, test_loss: 1.1922, test_f1: 0.3123
 epoch: 34, train_loss: 1.1308, test_loss: 1.1876, test_f1: 0.2977
 epoch: 35, train_loss: 1.1250, test_loss: 1.1849, test_f1: 0.3168
 epoch: 36, train_loss: 1.1257, test_loss: 1.1806, test_f1: 0.3015
 epoch: 37, train_loss: 1.1213, test_loss: 1.1770, test_f1: 0.2673
 epoch: 38, train_loss: 1.1204, test_loss: 1.1757, test_f1: 0.2724
 epoch: 39, train_loss: 1.1115, test_loss: 1.1718, test_f1: 0.2741
 epoch: 40, train_loss: 1.1072, test_loss: 1.1721, test_f1: 0.2721
 epoch: 41, train_loss: 1.1033, test_loss: 1.1722, test_f1: 0.2871
 epoch: 42, train_loss: 1.1056, test_loss: 1.1668, test_f1: 0.3193
 epoch: 43, train_loss: 1.1020, test_loss: 1.1635, test_f1: 0.3316
 epoch: 44, train_loss: 1.1008, test_loss: 1.1628, test_f1: 0.3300
 epoch: 45, train_loss: 1.0926, test_loss: 1.1596, test_f1: 0.3055
 epoch: 46, train_loss: 1.0898, test_loss: 1.1554, test_f1: 0.3348
 epoch: 47, train_loss: 1.0877, test_loss: 1.1546, test_f1: 0.3430
 epoch: 48, train_loss: 1.0875, test_loss: 1.1489, test_f1: 0.3372
 epoch: 49, train_loss: 1.0832, test_loss: 1.1458, test_f1: 0.3409
 epoch: 50, train_loss: 1.0857, test_loss: 1.1454, test_f1: 0.3662
 epoch: 51, train_loss: 1.0778, test_loss: 1.1438, test_f1: 0.3656
 epoch: 52, train_loss: 1.0805, test_loss: 1.1422, test_f1: 0.3672
 epoch: 53, train_loss: 1.0752, test_loss: 1.1403, test_f1: 0.3609
 epoch: 54, train_loss: 1.0734, test_loss: 1.1388, test_f1: 0.3831
 epoch: 55, train_loss: 1.0732, test_loss: 1.1372, test_f1: 0.3764
 epoch: 56, train_loss: 1.0704, test_loss: 1.1375, test_f1: 0.3725
 epoch: 57, train_loss: 1.0676, test_loss: 1.1365, test_f1: 0.3784
 epoch: 58, train_loss: 1.0673, test_loss: 1.1352, test_f1: 0.4002
 epoch: 59, train_loss: 1.0720, test_loss: 1.1337, test_f1: 0.4156
 epoch: 60, train_loss: 1.0637, test_loss: 1.1316, test_f1: 0.4033
 epoch: 61, train_loss: 1.0658, test_loss: 1.1302, test_f1: 0.4026
 epoch: 62, train_loss: 1.0646, test_loss: 1.1316, test_f1: 0.3992
 epoch: 63, train_loss: 1.0644, test_loss: 1.1276, test_f1: 0.4155
 epoch: 64, train_loss: 1.0598, test_loss: 1.1288, test_f1: 0.4098
 epoch: 65, train_loss: 1.0610, test_loss: 1.1306, test_f1: 0.4019
 epoch: 66, train_loss: 1.0556, test_loss: 1.1272, test_f1: 0.4134
 epoch: 67, train_loss: 1.0600, test_loss: 1.1232, test_f1: 0.4128
 epoch: 68, train_loss: 1.0543, test_loss: 1.1212, test_f1: 0.4206
 epoch: 69, train_loss: 1.0531, test_loss: 1.1205, test_f1: 0.4194
 epoch: 70, train_loss: 1.0491, test_loss: 1.1177, test_f1: 0.4121
 epoch: 71, train_loss: 1.0548, test_loss: 1.1159, test_f1: 0.4145
 epoch: 72, train_loss: 1.0543, test_loss: 1.1145, test_f1: 0.4207
 epoch: 73, train_loss: 1.0500, test_loss: 1.1156, test_f1: 0.4337
 epoch: 74, train_loss: 1.0441, test_loss: 1.1136, test_f1: 0.4316
 epoch: 75, train_loss: 1.0430, test_loss: 1.1122, test_f1: 0.4373
 epoch: 76, train_loss: 1.0434, test_loss: 1.1096, test_f1: 0.4442
 epoch: 77, train_loss: 1.0398, test_loss: 1.1084, test_f1: 0.4641
 epoch: 78, train_loss: 1.0402, test_loss: 1.1100, test_f1: 0.4661
 epoch: 79, train_loss: 1.0416, test_loss: 1.1086, test_f1: 0.4863
 epoch: 80, train_loss: 1.0395, test_loss: 1.1073, test_f1: 0.4652
 epoch: 81, train_loss: 1.0318, test_loss: 1.1035, test_f1: 0.4671
 epoch: 82, train_loss: 1.0347, test_loss: 1.1023, test_f1: 0.4814
 epoch: 83, train_loss: 1.0297, test_loss: 1.1005, test_f1: 0.5058
 epoch: 84, train_loss: 1.0316, test_loss: 1.0994, test_f1: 0.4979
 epoch: 85, train_loss: 1.0302, test_loss: 1.0978, test_f1: 0.5096
 epoch: 86, train_loss: 1.0274, test_loss: 1.0982, test_f1: 0.5031
 epoch: 87, train_loss: 1.0249, test_loss: 1.1002, test_f1: 0.4952
 epoch: 88, train_loss: 1.0246, test_loss: 1.0992, test_f1: 0.4885
 epoch: 89, train_loss: 1.0271, test_loss: 1.0953, test_f1: 0.4812
 epoch: 90, train_loss: 1.0273, test_loss: 1.0952, test_f1: 0.4763
 epoch: 91, train_loss: 1.0273, test_loss: 1.0923, test_f1: 0.4891
 epoch: 92, train_loss: 1.0201, test_loss: 1.0909, test_f1: 0.5024
 epoch: 93, train_loss: 1.0143, test_loss: 1.0886, test_f1: 0.4973
 epoch: 94, train_loss: 1.0178, test_loss: 1.0889, test_f1: 0.5010
 epoch: 95, train_loss: 1.0254, test_loss: 1.0918, test_f1: 0.4985
 epoch: 96, train_loss: 1.0135, test_loss: 1.0878, test_f1: 0.4997
 epoch: 97, train_loss: 1.0164, test_loss: 1.0922, test_f1: 0.4863
 epoch: 98, train_loss: 1.0175, test_loss: 1.0932, test_f1: 0.4921
 epoch: 99, train_loss: 1.0069, test_loss: 1.0887, test_f1: 0.5019
##################ITERATION #1 ****************************************
 epoch: 0, train_loss: 1.3436, test_loss: 1.3761, test_f1: 0.1365
 epoch: 1, train_loss: 1.3265, test_loss: 1.3760, test_f1: 0.1365
 epoch: 2, train_loss: 1.3149, test_loss: 1.3741, test_f1: 0.1365
 epoch: 3, train_loss: 1.3050, test_loss: 1.3715, test_f1: 0.1365
 epoch: 4, train_loss: 1.2944, test_loss: 1.3640, test_f1: 0.1365
 epoch: 5, train_loss: 1.2838, test_loss: 1.3499, test_f1: 0.1365
 epoch: 6, train_loss: 1.2723, test_loss: 1.3343, test_f1: 0.1365
 epoch: 7, train_loss: 1.2605, test_loss: 1.3252, test_f1: 0.1365
 epoch: 8, train_loss: 1.2497, test_loss: 1.3076, test_f1: 0.1691
 epoch: 9, train_loss: 1.2368, test_loss: 1.2892, test_f1: 0.2199
 epoch: 10, train_loss: 1.2238, test_loss: 1.2757, test_f1: 0.2858
 epoch: 11, train_loss: 1.2152, test_loss: 1.2629, test_f1: 0.3196
 epoch: 12, train_loss: 1.2036, test_loss: 1.2492, test_f1: 0.3264
 epoch: 13, train_loss: 1.1924, test_loss: 1.2356, test_f1: 0.3471
 epoch: 14, train_loss: 1.1873, test_loss: 1.2286, test_f1: 0.3481
 epoch: 15, train_loss: 1.1774, test_loss: 1.2224, test_f1: 0.3651
 epoch: 16, train_loss: 1.1689, test_loss: 1.2158, test_f1: 0.3686
 epoch: 17, train_loss: 1.1608, test_loss: 1.2097, test_f1: 0.3440
 epoch: 18, train_loss: 1.1545, test_loss: 1.2050, test_f1: 0.3320
 epoch: 19, train_loss: 1.1476, test_loss: 1.2021, test_f1: 0.3386
 epoch: 20, train_loss: 1.1431, test_loss: 1.1978, test_f1: 0.3382
 epoch: 21, train_loss: 1.1347, test_loss: 1.1930, test_f1: 0.3274
 epoch: 22, train_loss: 1.1396, test_loss: 1.1869, test_f1: 0.3194
 epoch: 23, train_loss: 1.1282, test_loss: 1.1826, test_f1: 0.3248
 epoch: 24, train_loss: 1.1244, test_loss: 1.1815, test_f1: 0.3282
 epoch: 25, train_loss: 1.1212, test_loss: 1.1794, test_f1: 0.3299
 epoch: 26, train_loss: 1.1151, test_loss: 1.1790, test_f1: 0.3399
 epoch: 27, train_loss: 1.1116, test_loss: 1.1779, test_f1: 0.3422
 epoch: 28, train_loss: 1.1127, test_loss: 1.1768, test_f1: 0.3439
 epoch: 29, train_loss: 1.1079, test_loss: 1.1787, test_f1: 0.3523
 epoch: 30, train_loss: 1.1058, test_loss: 1.1714, test_f1: 0.3587
 epoch: 31, train_loss: 1.1008, test_loss: 1.1703, test_f1: 0.3519
 epoch: 32, train_loss: 1.0990, test_loss: 1.1686, test_f1: 0.3469
 epoch: 33, train_loss: 1.0951, test_loss: 1.1656, test_f1: 0.3511
 epoch: 34, train_loss: 1.0906, test_loss: 1.1616, test_f1: 0.3592
 epoch: 35, train_loss: 1.0882, test_loss: 1.1592, test_f1: 0.3668
 epoch: 36, train_loss: 1.0888, test_loss: 1.1558, test_f1: 0.3667
 epoch: 37, train_loss: 1.0789, test_loss: 1.1535, test_f1: 0.3704
 epoch: 38, train_loss: 1.0804, test_loss: 1.1549, test_f1: 0.3683
 epoch: 39, train_loss: 1.0735, test_loss: 1.1479, test_f1: 0.3756
 epoch: 40, train_loss: 1.0737, test_loss: 1.1450, test_f1: 0.3773
 epoch: 41, train_loss: 1.0693, test_loss: 1.1386, test_f1: 0.3836
 epoch: 42, train_loss: 1.0706, test_loss: 1.1445, test_f1: 0.3895
 epoch: 43, train_loss: 1.0628, test_loss: 1.1387, test_f1: 0.3941
 epoch: 44, train_loss: 1.0579, test_loss: 1.1342, test_f1: 0.4062
 epoch: 45, train_loss: 1.0569, test_loss: 1.1377, test_f1: 0.4085
 epoch: 46, train_loss: 1.0514, test_loss: 1.1357, test_f1: 0.4180
 epoch: 47, train_loss: 1.0463, test_loss: 1.1336, test_f1: 0.4514
 epoch: 48, train_loss: 1.0484, test_loss: 1.1346, test_f1: 0.4425
 epoch: 49, train_loss: 1.0441, test_loss: 1.1233, test_f1: 0.4539
 epoch: 50, train_loss: 1.0456, test_loss: 1.1260, test_f1: 0.4677
 epoch: 51, train_loss: 1.0373, test_loss: 1.1231, test_f1: 0.4595
 epoch: 52, train_loss: 1.0365, test_loss: 1.1263, test_f1: 0.4614
 epoch: 53, train_loss: 1.0401, test_loss: 1.1248, test_f1: 0.4589
 epoch: 54, train_loss: 1.0348, test_loss: 1.1221, test_f1: 0.4709
 epoch: 55, train_loss: 1.0256, test_loss: 1.1226, test_f1: 0.4676
 epoch: 56, train_loss: 1.0295, test_loss: 1.1188, test_f1: 0.4640
 epoch: 57, train_loss: 1.0310, test_loss: 1.1244, test_f1: 0.4596
 epoch: 58, train_loss: 1.0298, test_loss: 1.1343, test_f1: 0.4633
 epoch: 59, train_loss: 1.0264, test_loss: 1.1184, test_f1: 0.4670
 epoch: 60, train_loss: 1.0260, test_loss: 1.1192, test_f1: 0.4754
 epoch: 61, train_loss: 1.0269, test_loss: 1.1150, test_f1: 0.4823
 epoch: 62, train_loss: 1.0201, test_loss: 1.1234, test_f1: 0.4835
 epoch: 63, train_loss: 1.0200, test_loss: 1.1167, test_f1: 0.4875
 epoch: 64, train_loss: 1.0232, test_loss: 1.1149, test_f1: 0.4858
 epoch: 65, train_loss: 1.0187, test_loss: 1.1141, test_f1: 0.4828
 epoch: 66, train_loss: 1.0188, test_loss: 1.1082, test_f1: 0.4879
 epoch: 67, train_loss: 1.0088, test_loss: 1.1067, test_f1: 0.4828
 epoch: 68, train_loss: 1.0106, test_loss: 1.1101, test_f1: 0.4799
 epoch: 69, train_loss: 1.0099, test_loss: 1.1142, test_f1: 0.4873
 epoch: 70, train_loss: 1.0081, test_loss: 1.1091, test_f1: 0.4900
 epoch: 71, train_loss: 1.0027, test_loss: 1.1034, test_f1: 0.4887
 epoch: 72, train_loss: 1.0029, test_loss: 1.1038, test_f1: 0.4895
 epoch: 73, train_loss: 1.0085, test_loss: 1.1126, test_f1: 0.4989
 epoch: 74, train_loss: 1.0080, test_loss: 1.0975, test_f1: 0.4992
 epoch: 75, train_loss: 1.0015, test_loss: 1.1010, test_f1: 0.5048
 epoch: 76, train_loss: 1.0041, test_loss: 1.1066, test_f1: 0.4952
 epoch: 77, train_loss: 0.9981, test_loss: 1.1111, test_f1: 0.4994
 epoch: 78, train_loss: 0.9961, test_loss: 1.1006, test_f1: 0.5026
 epoch: 79, train_loss: 0.9884, test_loss: 1.1022, test_f1: 0.4998
 epoch: 80, train_loss: 0.9867, test_loss: 1.1024, test_f1: 0.5019
 epoch: 81, train_loss: 0.9869, test_loss: 1.0975, test_f1: 0.5023
 epoch: 82, train_loss: 0.9917, test_loss: 1.1001, test_f1: 0.5001
 epoch: 83, train_loss: 0.9896, test_loss: 1.0963, test_f1: 0.5031
 epoch: 84, train_loss: 0.9808, test_loss: 1.0966, test_f1: 0.4966
 epoch: 85, train_loss: 0.9876, test_loss: 1.0852, test_f1: 0.5180
 epoch: 86, train_loss: 0.9794, test_loss: 1.0847, test_f1: 0.5176
 epoch: 87, train_loss: 0.9790, test_loss: 1.0896, test_f1: 0.5143
 epoch: 88, train_loss: 0.9808, test_loss: 1.0932, test_f1: 0.5075
 epoch: 89, train_loss: 0.9832, test_loss: 1.0892, test_f1: 0.5187
 epoch: 90, train_loss: 0.9789, test_loss: 1.0910, test_f1: 0.5144
 epoch: 91, train_loss: 0.9753, test_loss: 1.0935, test_f1: 0.5178
 epoch: 92, train_loss: 0.9682, test_loss: 1.0979, test_f1: 0.5204
 epoch: 93, train_loss: 0.9683, test_loss: 1.0984, test_f1: 0.5171
 epoch: 94, train_loss: 0.9718, test_loss: 1.1046, test_f1: 0.5192
 epoch: 95, train_loss: 0.9653, test_loss: 1.0905, test_f1: 0.5205
 epoch: 96, train_loss: 0.9631, test_loss: 1.0941, test_f1: 0.5186
 epoch: 97, train_loss: 0.9615, test_loss: 1.0922, test_f1: 0.5243
 epoch: 98, train_loss: 0.9711, test_loss: 1.0858, test_f1: 0.5271
 epoch: 99, train_loss: 0.9598, test_loss: 1.0847, test_f1: 0.5241
##################ITERATION #2 ****************************************
 epoch: 0, train_loss: 1.3110, test_loss: 1.3619, test_f1: 0.1365
 epoch: 1, train_loss: 1.2848, test_loss: 1.3578, test_f1: 0.1365
 epoch: 2, train_loss: 1.2707, test_loss: 1.3568, test_f1: 0.1365
 epoch: 3, train_loss: 1.2584, test_loss: 1.3567, test_f1: 0.1365
 epoch: 4, train_loss: 1.2453, test_loss: 1.3509, test_f1: 0.1365
 epoch: 5, train_loss: 1.2294, test_loss: 1.3421, test_f1: 0.1492
 epoch: 6, train_loss: 1.2205, test_loss: 1.3348, test_f1: 0.2299
 epoch: 7, train_loss: 1.2075, test_loss: 1.3270, test_f1: 0.2607
 epoch: 8, train_loss: 1.2012, test_loss: 1.3157, test_f1: 0.2966
 epoch: 9, train_loss: 1.1963, test_loss: 1.3006, test_f1: 0.3069
 epoch: 10, train_loss: 1.1848, test_loss: 1.2894, test_f1: 0.3495
 epoch: 11, train_loss: 1.1795, test_loss: 1.2758, test_f1: 0.3601
 epoch: 12, train_loss: 1.1666, test_loss: 1.2586, test_f1: 0.3261
 epoch: 13, train_loss: 1.1602, test_loss: 1.2426, test_f1: 0.2912
 epoch: 14, train_loss: 1.1551, test_loss: 1.2246, test_f1: 0.2487
 epoch: 15, train_loss: 1.1481, test_loss: 1.2128, test_f1: 0.2736
 epoch: 16, train_loss: 1.1413, test_loss: 1.2043, test_f1: 0.2687
 epoch: 17, train_loss: 1.1364, test_loss: 1.1984, test_f1: 0.2687
 epoch: 18, train_loss: 1.1322, test_loss: 1.1943, test_f1: 0.2739
 epoch: 19, train_loss: 1.1242, test_loss: 1.1902, test_f1: 0.2752
 epoch: 20, train_loss: 1.1217, test_loss: 1.1851, test_f1: 0.2752
 epoch: 21, train_loss: 1.1149, test_loss: 1.1818, test_f1: 0.3051
 epoch: 22, train_loss: 1.1166, test_loss: 1.1755, test_f1: 0.2954
 epoch: 23, train_loss: 1.1045, test_loss: 1.1696, test_f1: 0.2890
 epoch: 24, train_loss: 1.1009, test_loss: 1.1677, test_f1: 0.2589
 epoch: 25, train_loss: 1.0970, test_loss: 1.1643, test_f1: 0.2634
 epoch: 26, train_loss: 1.0901, test_loss: 1.1624, test_f1: 0.2878
 epoch: 27, train_loss: 1.0848, test_loss: 1.1609, test_f1: 0.2965
 epoch: 28, train_loss: 1.0824, test_loss: 1.1559, test_f1: 0.3384
 epoch: 29, train_loss: 1.0788, test_loss: 1.1508, test_f1: 0.3437
 epoch: 30, train_loss: 1.0776, test_loss: 1.1457, test_f1: 0.3663
 epoch: 31, train_loss: 1.0763, test_loss: 1.1415, test_f1: 0.3717
 epoch: 32, train_loss: 1.0708, test_loss: 1.1442, test_f1: 0.3915
 epoch: 33, train_loss: 1.0631, test_loss: 1.1455, test_f1: 0.3942
 epoch: 34, train_loss: 1.0689, test_loss: 1.1497, test_f1: 0.4030
 epoch: 35, train_loss: 1.0556, test_loss: 1.1398, test_f1: 0.3965
 epoch: 36, train_loss: 1.0506, test_loss: 1.1416, test_f1: 0.4118
 epoch: 37, train_loss: 1.0483, test_loss: 1.1360, test_f1: 0.4058
 epoch: 38, train_loss: 1.0521, test_loss: 1.1310, test_f1: 0.4133
 epoch: 39, train_loss: 1.0427, test_loss: 1.1279, test_f1: 0.4229
 epoch: 40, train_loss: 1.0396, test_loss: 1.1277, test_f1: 0.4270
 epoch: 41, train_loss: 1.0322, test_loss: 1.1294, test_f1: 0.4599
 epoch: 42, train_loss: 1.0307, test_loss: 1.1243, test_f1: 0.4556
 epoch: 43, train_loss: 1.0280, test_loss: 1.1237, test_f1: 0.4577
 epoch: 44, train_loss: 1.0199, test_loss: 1.1248, test_f1: 0.4507
 epoch: 45, train_loss: 1.0218, test_loss: 1.1232, test_f1: 0.4472
 epoch: 46, train_loss: 1.0145, test_loss: 1.1216, test_f1: 0.4539
 epoch: 47, train_loss: 1.0134, test_loss: 1.1107, test_f1: 0.4555
 epoch: 48, train_loss: 1.0085, test_loss: 1.1039, test_f1: 0.4707
 epoch: 49, train_loss: 0.9951, test_loss: 1.1001, test_f1: 0.4760
 epoch: 50, train_loss: 1.0035, test_loss: 1.0903, test_f1: 0.4788
 epoch: 51, train_loss: 0.9968, test_loss: 1.0914, test_f1: 0.4805
 epoch: 52, train_loss: 0.9930, test_loss: 1.0916, test_f1: 0.4910
 epoch: 53, train_loss: 0.9889, test_loss: 1.0905, test_f1: 0.4810
 epoch: 54, train_loss: 0.9912, test_loss: 1.0927, test_f1: 0.4867
 epoch: 55, train_loss: 0.9892, test_loss: 1.0885, test_f1: 0.4828
 epoch: 56, train_loss: 0.9887, test_loss: 1.0894, test_f1: 0.4831
 epoch: 57, train_loss: 0.9782, test_loss: 1.0949, test_f1: 0.4881
 epoch: 58, train_loss: 0.9771, test_loss: 1.0918, test_f1: 0.4846
 epoch: 59, train_loss: 0.9757, test_loss: 1.0895, test_f1: 0.4847
 epoch: 60, train_loss: 0.9808, test_loss: 1.0812, test_f1: 0.4934
 epoch: 61, train_loss: 0.9716, test_loss: 1.0872, test_f1: 0.4772
 epoch: 62, train_loss: 0.9701, test_loss: 1.0863, test_f1: 0.4907
 epoch: 63, train_loss: 0.9646, test_loss: 1.0904, test_f1: 0.4942
 epoch: 64, train_loss: 0.9712, test_loss: 1.0922, test_f1: 0.4942
 epoch: 65, train_loss: 0.9684, test_loss: 1.0851, test_f1: 0.4963
 epoch: 66, train_loss: 0.9656, test_loss: 1.0829, test_f1: 0.5009
 epoch: 67, train_loss: 0.9673, test_loss: 1.0877, test_f1: 0.5039
 epoch: 68, train_loss: 0.9661, test_loss: 1.0943, test_f1: 0.5203
 epoch: 69, train_loss: 0.9607, test_loss: 1.0916, test_f1: 0.5102
 epoch: 70, train_loss: 0.9550, test_loss: 1.0846, test_f1: 0.5114
 epoch: 71, train_loss: 0.9539, test_loss: 1.0789, test_f1: 0.5096
 epoch: 72, train_loss: 0.9498, test_loss: 1.0791, test_f1: 0.5048
 epoch: 73, train_loss: 0.9501, test_loss: 1.0800, test_f1: 0.5009
 epoch: 74, train_loss: 0.9502, test_loss: 1.0862, test_f1: 0.5190
 epoch: 75, train_loss: 0.9429, test_loss: 1.0987, test_f1: 0.5114
 epoch: 76, train_loss: 0.9510, test_loss: 1.0924, test_f1: 0.5114
 epoch: 77, train_loss: 0.9428, test_loss: 1.0798, test_f1: 0.5162
 epoch: 78, train_loss: 0.9486, test_loss: 1.0737, test_f1: 0.5171
 epoch: 79, train_loss: 0.9424, test_loss: 1.0748, test_f1: 0.5257
 epoch: 80, train_loss: 0.9379, test_loss: 1.0745, test_f1: 0.5293
 epoch: 81, train_loss: 0.9344, test_loss: 1.0822, test_f1: 0.5184
 epoch: 82, train_loss: 0.9358, test_loss: 1.0756, test_f1: 0.5205
 epoch: 83, train_loss: 0.9372, test_loss: 1.0830, test_f1: 0.5221
 epoch: 84, train_loss: 0.9354, test_loss: 1.0801, test_f1: 0.5233
 epoch: 85, train_loss: 0.9312, test_loss: 1.0673, test_f1: 0.5315
 epoch: 86, train_loss: 0.9318, test_loss: 1.0616, test_f1: 0.5226
 epoch: 87, train_loss: 0.9295, test_loss: 1.0784, test_f1: 0.5313
 epoch: 88, train_loss: 0.9263, test_loss: 1.0813, test_f1: 0.5256
 epoch: 89, train_loss: 0.9274, test_loss: 1.0779, test_f1: 0.5235
 epoch: 90, train_loss: 0.9268, test_loss: 1.0735, test_f1: 0.5213
 epoch: 91, train_loss: 0.9166, test_loss: 1.0703, test_f1: 0.5195
 epoch: 92, train_loss: 0.9234, test_loss: 1.0690, test_f1: 0.5237
 epoch: 93, train_loss: 0.9125, test_loss: 1.0664, test_f1: 0.5241
 epoch: 94, train_loss: 0.9212, test_loss: 1.0747, test_f1: 0.5330
 epoch: 95, train_loss: 0.9170, test_loss: 1.0809, test_f1: 0.5278
 epoch: 96, train_loss: 0.9060, test_loss: 1.0802, test_f1: 0.5288
 epoch: 97, train_loss: 0.9102, test_loss: 1.0754, test_f1: 0.5331
 epoch: 98, train_loss: 0.9090, test_loss: 1.0837, test_f1: 0.5257
 epoch: 99, train_loss: 0.9087, test_loss: 1.0820, test_f1: 0.5221
##################ITERATION #3 ****************************************
 epoch: 0, train_loss: 1.2774, test_loss: 1.3578, test_f1: 0.2281
 epoch: 1, train_loss: 1.2370, test_loss: 1.3524, test_f1: 0.2281
 epoch: 2, train_loss: 1.2238, test_loss: 1.3494, test_f1: 0.2281
 epoch: 3, train_loss: 1.2065, test_loss: 1.3471, test_f1: 0.2281
 epoch: 4, train_loss: 1.1947, test_loss: 1.3435, test_f1: 0.2281
 epoch: 5, train_loss: 1.1891, test_loss: 1.3348, test_f1: 0.2281
 epoch: 6, train_loss: 1.1793, test_loss: 1.3197, test_f1: 0.2281
 epoch: 7, train_loss: 1.1724, test_loss: 1.2927, test_f1: 0.2281
 epoch: 8, train_loss: 1.1619, test_loss: 1.2587, test_f1: 0.2270
 epoch: 9, train_loss: 1.1503, test_loss: 1.2349, test_f1: 0.2259
 epoch: 10, train_loss: 1.1472, test_loss: 1.2201, test_f1: 0.2304
 epoch: 11, train_loss: 1.1441, test_loss: 1.2046, test_f1: 0.2315
 epoch: 12, train_loss: 1.1341, test_loss: 1.1956, test_f1: 0.2381
 epoch: 13, train_loss: 1.1334, test_loss: 1.1894, test_f1: 0.2386
 epoch: 14, train_loss: 1.1222, test_loss: 1.1855, test_f1: 0.2448
 epoch: 15, train_loss: 1.1235, test_loss: 1.1794, test_f1: 0.2514
 epoch: 16, train_loss: 1.1163, test_loss: 1.1757, test_f1: 0.2545
 epoch: 17, train_loss: 1.1109, test_loss: 1.1724, test_f1: 0.2539
 epoch: 18, train_loss: 1.1049, test_loss: 1.1669, test_f1: 0.2552
 epoch: 19, train_loss: 1.1014, test_loss: 1.1604, test_f1: 0.2921
 epoch: 20, train_loss: 1.1009, test_loss: 1.1575, test_f1: 0.3469
 epoch: 21, train_loss: 1.0926, test_loss: 1.1535, test_f1: 0.3649
 epoch: 22, train_loss: 1.0974, test_loss: 1.1491, test_f1: 0.3691
 epoch: 23, train_loss: 1.0843, test_loss: 1.1464, test_f1: 0.3733
 epoch: 24, train_loss: 1.0783, test_loss: 1.1420, test_f1: 0.4032
 epoch: 25, train_loss: 1.0791, test_loss: 1.1389, test_f1: 0.4122
 epoch: 26, train_loss: 1.0682, test_loss: 1.1385, test_f1: 0.4066
 epoch: 27, train_loss: 1.0606, test_loss: 1.1354, test_f1: 0.4153
 epoch: 28, train_loss: 1.0677, test_loss: 1.1422, test_f1: 0.4179
 epoch: 29, train_loss: 1.0637, test_loss: 1.1300, test_f1: 0.4287
 epoch: 30, train_loss: 1.0577, test_loss: 1.1255, test_f1: 0.4485
 epoch: 31, train_loss: 1.0497, test_loss: 1.1263, test_f1: 0.4541
 epoch: 32, train_loss: 1.0474, test_loss: 1.1237, test_f1: 0.4474
 epoch: 33, train_loss: 1.0441, test_loss: 1.1259, test_f1: 0.4446
 epoch: 34, train_loss: 1.0417, test_loss: 1.1169, test_f1: 0.4607
 epoch: 35, train_loss: 1.0421, test_loss: 1.1163, test_f1: 0.4411
 epoch: 36, train_loss: 1.0228, test_loss: 1.1096, test_f1: 0.4283
 epoch: 37, train_loss: 1.0336, test_loss: 1.1064, test_f1: 0.4358
 epoch: 38, train_loss: 1.0258, test_loss: 1.1027, test_f1: 0.4078
 epoch: 39, train_loss: 1.0200, test_loss: 1.1074, test_f1: 0.4232
 epoch: 40, train_loss: 1.0148, test_loss: 1.1103, test_f1: 0.4218
 epoch: 41, train_loss: 1.0177, test_loss: 1.1100, test_f1: 0.4491
 epoch: 42, train_loss: 1.0148, test_loss: 1.1003, test_f1: 0.4613
 epoch: 43, train_loss: 1.0073, test_loss: 1.0999, test_f1: 0.4509
 epoch: 44, train_loss: 1.0049, test_loss: 1.0953, test_f1: 0.4495
 epoch: 45, train_loss: 1.0001, test_loss: 1.0949, test_f1: 0.4496
 epoch: 46, train_loss: 0.9927, test_loss: 1.0936, test_f1: 0.4572
 epoch: 47, train_loss: 0.9865, test_loss: 1.0921, test_f1: 0.4794
 epoch: 48, train_loss: 0.9838, test_loss: 1.0823, test_f1: 0.4918
 epoch: 49, train_loss: 0.9844, test_loss: 1.0754, test_f1: 0.4903
 epoch: 50, train_loss: 0.9786, test_loss: 1.0765, test_f1: 0.4679
 epoch: 51, train_loss: 0.9772, test_loss: 1.0794, test_f1: 0.4822
 epoch: 52, train_loss: 0.9707, test_loss: 1.0867, test_f1: 0.4966
 epoch: 53, train_loss: 0.9670, test_loss: 1.0773, test_f1: 0.4900
 epoch: 54, train_loss: 0.9690, test_loss: 1.0738, test_f1: 0.4980
 epoch: 55, train_loss: 0.9629, test_loss: 1.0725, test_f1: 0.5039
 epoch: 56, train_loss: 0.9590, test_loss: 1.0687, test_f1: 0.5121
 epoch: 57, train_loss: 0.9626, test_loss: 1.0692, test_f1: 0.4987
 epoch: 58, train_loss: 0.9610, test_loss: 1.0687, test_f1: 0.5131
 epoch: 59, train_loss: 0.9548, test_loss: 1.0646, test_f1: 0.5246
 epoch: 60, train_loss: 0.9563, test_loss: 1.0593, test_f1: 0.5203
 epoch: 61, train_loss: 0.9576, test_loss: 1.0563, test_f1: 0.5145
 epoch: 62, train_loss: 0.9490, test_loss: 1.0549, test_f1: 0.5280
 epoch: 63, train_loss: 0.9477, test_loss: 1.0540, test_f1: 0.5233
 epoch: 64, train_loss: 0.9551, test_loss: 1.0512, test_f1: 0.5268
 epoch: 65, train_loss: 0.9471, test_loss: 1.0531, test_f1: 0.5182
 epoch: 66, train_loss: 0.9508, test_loss: 1.0603, test_f1: 0.5233
 epoch: 67, train_loss: 0.9409, test_loss: 1.0616, test_f1: 0.5269
 epoch: 68, train_loss: 0.9339, test_loss: 1.0552, test_f1: 0.5262
 epoch: 69, train_loss: 0.9379, test_loss: 1.0522, test_f1: 0.5312
 epoch: 70, train_loss: 0.9493, test_loss: 1.0431, test_f1: 0.5286
 epoch: 71, train_loss: 0.9445, test_loss: 1.0389, test_f1: 0.5280
 epoch: 72, train_loss: 0.9430, test_loss: 1.0364, test_f1: 0.5297
 epoch: 73, train_loss: 0.9351, test_loss: 1.0429, test_f1: 0.5200
 epoch: 74, train_loss: 0.9317, test_loss: 1.0414, test_f1: 0.5296
 epoch: 75, train_loss: 0.9176, test_loss: 1.0401, test_f1: 0.5323
 epoch: 76, train_loss: 0.9275, test_loss: 1.0430, test_f1: 0.5275
 epoch: 77, train_loss: 0.9229, test_loss: 1.0453, test_f1: 0.5219
 epoch: 78, train_loss: 0.9175, test_loss: 1.0420, test_f1: 0.5266
 epoch: 79, train_loss: 0.9206, test_loss: 1.0406, test_f1: 0.5242
 epoch: 80, train_loss: 0.9192, test_loss: 1.0526, test_f1: 0.5240
 epoch: 81, train_loss: 0.9181, test_loss: 1.0413, test_f1: 0.5180
 epoch: 82, train_loss: 0.9166, test_loss: 1.0345, test_f1: 0.5374
 epoch: 83, train_loss: 0.9251, test_loss: 1.0348, test_f1: 0.5314
 epoch: 84, train_loss: 0.9218, test_loss: 1.0413, test_f1: 0.5357
 epoch: 85, train_loss: 0.9043, test_loss: 1.0465, test_f1: 0.5362
 epoch: 86, train_loss: 0.9032, test_loss: 1.0534, test_f1: 0.5367
 epoch: 87, train_loss: 0.9115, test_loss: 1.0475, test_f1: 0.5391
 epoch: 88, train_loss: 0.9191, test_loss: 1.0295, test_f1: 0.5367
 epoch: 89, train_loss: 0.9136, test_loss: 1.0350, test_f1: 0.5422
 epoch: 90, train_loss: 0.9094, test_loss: 1.0300, test_f1: 0.5473
 epoch: 91, train_loss: 0.9060, test_loss: 1.0313, test_f1: 0.5488
 epoch: 92, train_loss: 0.8955, test_loss: 1.0409, test_f1: 0.5363
 epoch: 93, train_loss: 0.9036, test_loss: 1.0369, test_f1: 0.5346
 epoch: 94, train_loss: 0.9013, test_loss: 1.0261, test_f1: 0.5444
 epoch: 95, train_loss: 0.8915, test_loss: 1.0239, test_f1: 0.5569
 epoch: 96, train_loss: 0.8936, test_loss: 1.0357, test_f1: 0.5530
 epoch: 97, train_loss: 0.8908, test_loss: 1.0320, test_f1: 0.5394
 epoch: 98, train_loss: 0.8912, test_loss: 1.0348, test_f1: 0.5505
 epoch: 99, train_loss: 0.8969, test_loss: 1.0351, test_f1: 0.5430
##################ITERATION #4 ****************************************
 epoch: 0, train_loss: 1.2824, test_loss: 1.3487, test_f1: 0.2281
 epoch: 1, train_loss: 1.2415, test_loss: 1.3435, test_f1: 0.2973
 epoch: 2, train_loss: 1.2273, test_loss: 1.3360, test_f1: 0.1815
 epoch: 3, train_loss: 1.2149, test_loss: 1.3234, test_f1: 0.2802
 epoch: 4, train_loss: 1.1985, test_loss: 1.3184, test_f1: 0.3084
 epoch: 5, train_loss: 1.1864, test_loss: 1.3137, test_f1: 0.2599
 epoch: 6, train_loss: 1.1788, test_loss: 1.3086, test_f1: 0.2815
 epoch: 7, train_loss: 1.1685, test_loss: 1.2941, test_f1: 0.2721
 epoch: 8, train_loss: 1.1556, test_loss: 1.2650, test_f1: 0.2750
 epoch: 9, train_loss: 1.1499, test_loss: 1.2387, test_f1: 0.3075
 epoch: 10, train_loss: 1.1508, test_loss: 1.2213, test_f1: 0.3340
 epoch: 11, train_loss: 1.1382, test_loss: 1.2111, test_f1: 0.3378
 epoch: 12, train_loss: 1.1299, test_loss: 1.1976, test_f1: 0.3637
 epoch: 13, train_loss: 1.1208, test_loss: 1.1854, test_f1: 0.3827
 epoch: 14, train_loss: 1.1199, test_loss: 1.1778, test_f1: 0.3843
 epoch: 15, train_loss: 1.1130, test_loss: 1.1701, test_f1: 0.3990
 epoch: 16, train_loss: 1.1112, test_loss: 1.1669, test_f1: 0.3977
 epoch: 17, train_loss: 1.0988, test_loss: 1.1588, test_f1: 0.4161
 epoch: 18, train_loss: 1.1003, test_loss: 1.1523, test_f1: 0.4225
 epoch: 19, train_loss: 1.0938, test_loss: 1.1473, test_f1: 0.4208
 epoch: 20, train_loss: 1.0872, test_loss: 1.1423, test_f1: 0.4301
 epoch: 21, train_loss: 1.0838, test_loss: 1.1380, test_f1: 0.4305
 epoch: 22, train_loss: 1.0717, test_loss: 1.1352, test_f1: 0.4359
 epoch: 23, train_loss: 1.0697, test_loss: 1.1325, test_f1: 0.4536
 epoch: 24, train_loss: 1.0629, test_loss: 1.1326, test_f1: 0.4858
 epoch: 25, train_loss: 1.0629, test_loss: 1.1377, test_f1: 0.4618
 epoch: 26, train_loss: 1.0555, test_loss: 1.1262, test_f1: 0.4734
 epoch: 27, train_loss: 1.0490, test_loss: 1.1267, test_f1: 0.4595
 epoch: 28, train_loss: 1.0493, test_loss: 1.1225, test_f1: 0.4779
 epoch: 29, train_loss: 1.0431, test_loss: 1.1155, test_f1: 0.4756
 epoch: 30, train_loss: 1.0345, test_loss: 1.1097, test_f1: 0.4925
 epoch: 31, train_loss: 1.0341, test_loss: 1.1052, test_f1: 0.4943
 epoch: 32, train_loss: 1.0281, test_loss: 1.1018, test_f1: 0.5240
 epoch: 33, train_loss: 1.0212, test_loss: 1.1003, test_f1: 0.5083
 epoch: 34, train_loss: 1.0197, test_loss: 1.1021, test_f1: 0.5037
 epoch: 35, train_loss: 1.0188, test_loss: 1.0967, test_f1: 0.5168
 epoch: 36, train_loss: 1.0157, test_loss: 1.0947, test_f1: 0.5278
 epoch: 37, train_loss: 1.0134, test_loss: 1.0899, test_f1: 0.5158
 epoch: 38, train_loss: 1.0065, test_loss: 1.0894, test_f1: 0.5033
 epoch: 39, train_loss: 1.0059, test_loss: 1.0852, test_f1: 0.4917
 epoch: 40, train_loss: 0.9912, test_loss: 1.0868, test_f1: 0.4845
 epoch: 41, train_loss: 1.0006, test_loss: 1.0859, test_f1: 0.5054
 epoch: 42, train_loss: 0.9944, test_loss: 1.0825, test_f1: 0.5000
 epoch: 43, train_loss: 0.9950, test_loss: 1.0871, test_f1: 0.5020
 epoch: 44, train_loss: 0.9882, test_loss: 1.1007, test_f1: 0.5026
 epoch: 45, train_loss: 0.9961, test_loss: 1.0959, test_f1: 0.5057
 epoch: 46, train_loss: 0.9837, test_loss: 1.0816, test_f1: 0.5083
 epoch: 47, train_loss: 0.9826, test_loss: 1.0788, test_f1: 0.5182
 epoch: 48, train_loss: 0.9795, test_loss: 1.0940, test_f1: 0.5125
 epoch: 49, train_loss: 0.9702, test_loss: 1.0928, test_f1: 0.5077
 epoch: 50, train_loss: 0.9620, test_loss: 1.0873, test_f1: 0.5170
 epoch: 51, train_loss: 0.9638, test_loss: 1.0770, test_f1: 0.5234
 epoch: 52, train_loss: 0.9616, test_loss: 1.0776, test_f1: 0.5131
 epoch: 53, train_loss: 0.9605, test_loss: 1.0820, test_f1: 0.5151
 epoch: 54, train_loss: 0.9648, test_loss: 1.0771, test_f1: 0.5161
 epoch: 55, train_loss: 0.9506, test_loss: 1.0805, test_f1: 0.5228
 epoch: 56, train_loss: 0.9550, test_loss: 1.0818, test_f1: 0.5167
 epoch: 57, train_loss: 0.9494, test_loss: 1.0801, test_f1: 0.5232
 epoch: 58, train_loss: 0.9535, test_loss: 1.0793, test_f1: 0.5254
 epoch: 59, train_loss: 0.9571, test_loss: 1.0832, test_f1: 0.5300
 epoch: 60, train_loss: 0.9487, test_loss: 1.0830, test_f1: 0.5205
 epoch: 61, train_loss: 0.9508, test_loss: 1.0796, test_f1: 0.5176
 epoch: 62, train_loss: 0.9589, test_loss: 1.0727, test_f1: 0.5175
 epoch: 63, train_loss: 0.9453, test_loss: 1.0723, test_f1: 0.5236
 epoch: 64, train_loss: 0.9483, test_loss: 1.0789, test_f1: 0.5271
 epoch: 65, train_loss: 0.9473, test_loss: 1.0884, test_f1: 0.5210
 epoch: 66, train_loss: 0.9465, test_loss: 1.0900, test_f1: 0.5181
 epoch: 67, train_loss: 0.9456, test_loss: 1.0877, test_f1: 0.5152
 epoch: 68, train_loss: 0.9356, test_loss: 1.0908, test_f1: 0.5162
 epoch: 69, train_loss: 0.9386, test_loss: 1.0865, test_f1: 0.5142
 epoch: 70, train_loss: 0.9440, test_loss: 1.0854, test_f1: 0.5159
 epoch: 71, train_loss: 0.9421, test_loss: 1.0848, test_f1: 0.5154
 epoch: 72, train_loss: 0.9361, test_loss: 1.0853, test_f1: 0.5177
 epoch: 73, train_loss: 0.9254, test_loss: 1.0868, test_f1: 0.5171
 epoch: 74, train_loss: 0.9242, test_loss: 1.0819, test_f1: 0.5171
 epoch: 75, train_loss: 0.9288, test_loss: 1.0753, test_f1: 0.5245
 epoch: 76, train_loss: 0.9318, test_loss: 1.0735, test_f1: 0.5195
 epoch: 77, train_loss: 0.9245, test_loss: 1.0858, test_f1: 0.5140
 epoch: 78, train_loss: 0.9216, test_loss: 1.1008, test_f1: 0.5088
 epoch: 79, train_loss: 0.9238, test_loss: 1.0938, test_f1: 0.5185
 epoch: 80, train_loss: 0.9209, test_loss: 1.0969, test_f1: 0.5196
 epoch: 81, train_loss: 0.9233, test_loss: 1.0921, test_f1: 0.5199
 epoch: 82, train_loss: 0.9225, test_loss: 1.0890, test_f1: 0.5090
 epoch: 83, train_loss: 0.9231, test_loss: 1.0808, test_f1: 0.5193
 epoch: 84, train_loss: 0.9203, test_loss: 1.0924, test_f1: 0.5097
 epoch: 85, train_loss: 0.9102, test_loss: 1.0820, test_f1: 0.5172
 epoch: 86, train_loss: 0.9120, test_loss: 1.0683, test_f1: 0.5108
 epoch: 87, train_loss: 0.9042, test_loss: 1.0718, test_f1: 0.5135
 epoch: 88, train_loss: 0.9175, test_loss: 1.0788, test_f1: 0.5197
 epoch: 89, train_loss: 0.9138, test_loss: 1.0762, test_f1: 0.5213
 epoch: 90, train_loss: 0.9137, test_loss: 1.0792, test_f1: 0.5215
 epoch: 91, train_loss: 0.9161, test_loss: 1.0789, test_f1: 0.5120
 epoch: 92, train_loss: 0.9059, test_loss: 1.0790, test_f1: 0.5159
 epoch: 93, train_loss: 0.9043, test_loss: 1.0822, test_f1: 0.5140
 epoch: 94, train_loss: 0.9030, test_loss: 1.0952, test_f1: 0.5127
 epoch: 95, train_loss: 0.9015, test_loss: 1.1046, test_f1: 0.5180
 epoch: 96, train_loss: 0.8995, test_loss: 1.1021, test_f1: 0.5123
 epoch: 97, train_loss: 0.9046, test_loss: 1.1017, test_f1: 0.5190
 epoch: 98, train_loss: 0.8960, test_loss: 1.1086, test_f1: 0.4948
 epoch: 99, train_loss: 0.9020, test_loss: 1.1037, test_f1: 0.5161
##################ITERATION #5 ****************************************
 epoch: 0, train_loss: 1.2865, test_loss: 1.3526, test_f1: 0.2281
 epoch: 1, train_loss: 1.2430, test_loss: 1.3505, test_f1: 0.2281
 epoch: 2, train_loss: 1.2283, test_loss: 1.3472, test_f1: 0.2281
 epoch: 3, train_loss: 1.2154, test_loss: 1.3454, test_f1: 0.2281
 epoch: 4, train_loss: 1.2011, test_loss: 1.3416, test_f1: 0.2281
 epoch: 5, train_loss: 1.1956, test_loss: 1.3336, test_f1: 0.2281
 epoch: 6, train_loss: 1.1815, test_loss: 1.3236, test_f1: 0.2281
 epoch: 7, train_loss: 1.1731, test_loss: 1.3070, test_f1: 0.2390
 epoch: 8, train_loss: 1.1601, test_loss: 1.2781, test_f1: 0.2586
 epoch: 9, train_loss: 1.1551, test_loss: 1.2567, test_f1: 0.2570
 epoch: 10, train_loss: 1.1509, test_loss: 1.2368, test_f1: 0.2556
 epoch: 11, train_loss: 1.1368, test_loss: 1.2140, test_f1: 0.3067
 epoch: 12, train_loss: 1.1275, test_loss: 1.1979, test_f1: 0.3396
 epoch: 13, train_loss: 1.1275, test_loss: 1.1898, test_f1: 0.3609
 epoch: 14, train_loss: 1.1182, test_loss: 1.1841, test_f1: 0.3691
 epoch: 15, train_loss: 1.1114, test_loss: 1.1811, test_f1: 0.3792
 epoch: 16, train_loss: 1.1048, test_loss: 1.1730, test_f1: 0.4225
 epoch: 17, train_loss: 1.0971, test_loss: 1.1679, test_f1: 0.4202
 epoch: 18, train_loss: 1.0868, test_loss: 1.1645, test_f1: 0.4326
 epoch: 19, train_loss: 1.0894, test_loss: 1.1592, test_f1: 0.4300
 epoch: 20, train_loss: 1.0842, test_loss: 1.1536, test_f1: 0.4290
 epoch: 21, train_loss: 1.0763, test_loss: 1.1494, test_f1: 0.4271
 epoch: 22, train_loss: 1.0688, test_loss: 1.1429, test_f1: 0.4344
 epoch: 23, train_loss: 1.0630, test_loss: 1.1371, test_f1: 0.4283
 epoch: 24, train_loss: 1.0550, test_loss: 1.1366, test_f1: 0.4293
 epoch: 25, train_loss: 1.0508, test_loss: 1.1362, test_f1: 0.4313
 epoch: 26, train_loss: 1.0522, test_loss: 1.1328, test_f1: 0.4477
 epoch: 27, train_loss: 1.0471, test_loss: 1.1319, test_f1: 0.4544
 epoch: 28, train_loss: 1.0412, test_loss: 1.1283, test_f1: 0.4538
 epoch: 29, train_loss: 1.0374, test_loss: 1.1237, test_f1: 0.4672
 epoch: 30, train_loss: 1.0383, test_loss: 1.1182, test_f1: 0.4730
 epoch: 31, train_loss: 1.0268, test_loss: 1.1159, test_f1: 0.4655
 epoch: 32, train_loss: 1.0263, test_loss: 1.1150, test_f1: 0.4708
 epoch: 33, train_loss: 1.0224, test_loss: 1.1135, test_f1: 0.4721
 epoch: 34, train_loss: 1.0100, test_loss: 1.1084, test_f1: 0.4768
 epoch: 35, train_loss: 1.0172, test_loss: 1.1077, test_f1: 0.4846
 epoch: 36, train_loss: 1.0043, test_loss: 1.1071, test_f1: 0.4956
 epoch: 37, train_loss: 0.9983, test_loss: 1.1069, test_f1: 0.4889
 epoch: 38, train_loss: 0.9978, test_loss: 1.1129, test_f1: 0.4856
 epoch: 39, train_loss: 0.9967, test_loss: 1.1098, test_f1: 0.4821
 epoch: 40, train_loss: 0.9895, test_loss: 1.1063, test_f1: 0.4944
 epoch: 41, train_loss: 0.9807, test_loss: 1.1017, test_f1: 0.4936
 epoch: 42, train_loss: 0.9857, test_loss: 1.0993, test_f1: 0.4955
 epoch: 43, train_loss: 0.9922, test_loss: 1.0982, test_f1: 0.4906
 epoch: 44, train_loss: 0.9838, test_loss: 1.0934, test_f1: 0.4933
 epoch: 45, train_loss: 0.9720, test_loss: 1.0953, test_f1: 0.4911
 epoch: 46, train_loss: 0.9715, test_loss: 1.0974, test_f1: 0.4904
 epoch: 47, train_loss: 0.9683, test_loss: 1.0904, test_f1: 0.5033
 epoch: 48, train_loss: 0.9682, test_loss: 1.0878, test_f1: 0.4913
 epoch: 49, train_loss: 0.9522, test_loss: 1.0955, test_f1: 0.4865
 epoch: 50, train_loss: 0.9629, test_loss: 1.0956, test_f1: 0.4905
 epoch: 51, train_loss: 0.9545, test_loss: 1.1010, test_f1: 0.4886
 epoch: 52, train_loss: 0.9488, test_loss: 1.1060, test_f1: 0.5037
 epoch: 53, train_loss: 0.9490, test_loss: 1.1029, test_f1: 0.5041
 epoch: 54, train_loss: 0.9516, test_loss: 1.0987, test_f1: 0.5078
 epoch: 55, train_loss: 0.9491, test_loss: 1.0941, test_f1: 0.5114
 epoch: 56, train_loss: 0.9435, test_loss: 1.0907, test_f1: 0.5010
 epoch: 57, train_loss: 0.9384, test_loss: 1.0844, test_f1: 0.5143
 epoch: 58, train_loss: 0.9457, test_loss: 1.0903, test_f1: 0.5119
 epoch: 59, train_loss: 0.9342, test_loss: 1.0870, test_f1: 0.5119
 epoch: 60, train_loss: 0.9383, test_loss: 1.0934, test_f1: 0.5042
 epoch: 61, train_loss: 0.9360, test_loss: 1.0970, test_f1: 0.5067
 epoch: 62, train_loss: 0.9317, test_loss: 1.0933, test_f1: 0.4975
 epoch: 63, train_loss: 0.9296, test_loss: 1.0913, test_f1: 0.4982
 epoch: 64, train_loss: 0.9285, test_loss: 1.0878, test_f1: 0.5047
 epoch: 65, train_loss: 0.9307, test_loss: 1.0892, test_f1: 0.5060
 epoch: 66, train_loss: 0.9206, test_loss: 1.0918, test_f1: 0.5125
 epoch: 67, train_loss: 0.9289, test_loss: 1.0955, test_f1: 0.5189
 epoch: 68, train_loss: 0.9243, test_loss: 1.1014, test_f1: 0.5131
 epoch: 69, train_loss: 0.9221, test_loss: 1.1063, test_f1: 0.5143
 epoch: 70, train_loss: 0.9185, test_loss: 1.1066, test_f1: 0.5129
 epoch: 71, train_loss: 0.9178, test_loss: 1.1014, test_f1: 0.5170
 epoch: 72, train_loss: 0.9162, test_loss: 1.1064, test_f1: 0.5169
 epoch: 73, train_loss: 0.9198, test_loss: 1.1036, test_f1: 0.5005
 epoch: 74, train_loss: 0.9119, test_loss: 1.1087, test_f1: 0.4962
 epoch: 75, train_loss: 0.9107, test_loss: 1.1114, test_f1: 0.4995
 epoch: 76, train_loss: 0.9138, test_loss: 1.1144, test_f1: 0.5031
 epoch: 77, train_loss: 0.9138, test_loss: 1.1059, test_f1: 0.5144
 epoch: 78, train_loss: 0.9045, test_loss: 1.1034, test_f1: 0.5109
 epoch: 79, train_loss: 0.9031, test_loss: 1.1076, test_f1: 0.5109
 epoch: 80, train_loss: 0.9118, test_loss: 1.1100, test_f1: 0.4957
 epoch: 81, train_loss: 0.9013, test_loss: 1.1093, test_f1: 0.4989
 epoch: 82, train_loss: 0.9218, test_loss: 1.1246, test_f1: 0.4998
 epoch: 83, train_loss: 0.9102, test_loss: 1.1262, test_f1: 0.4925
 epoch: 84, train_loss: 0.9001, test_loss: 1.1125, test_f1: 0.5051
 epoch: 85, train_loss: 0.9053, test_loss: 1.1023, test_f1: 0.5094
 epoch: 86, train_loss: 0.8920, test_loss: 1.0994, test_f1: 0.4999
 epoch: 87, train_loss: 0.8984, test_loss: 1.0943, test_f1: 0.5054
 epoch: 88, train_loss: 0.9006, test_loss: 1.0972, test_f1: 0.5017
 epoch: 89, train_loss: 0.8968, test_loss: 1.1068, test_f1: 0.5117
 epoch: 90, train_loss: 0.8949, test_loss: 1.1167, test_f1: 0.5103
 epoch: 91, train_loss: 0.8900, test_loss: 1.1105, test_f1: 0.5093
 epoch: 92, train_loss: 0.8863, test_loss: 1.1121, test_f1: 0.5116
 epoch: 93, train_loss: 0.8929, test_loss: 1.1229, test_f1: 0.5115
 epoch: 94, train_loss: 0.8925, test_loss: 1.1173, test_f1: 0.5235
 epoch: 95, train_loss: 0.8938, test_loss: 1.1045, test_f1: 0.5118
 epoch: 96, train_loss: 0.8900, test_loss: 1.1141, test_f1: 0.5141
 epoch: 97, train_loss: 0.8790, test_loss: 1.1153, test_f1: 0.5125
 epoch: 98, train_loss: 0.8856, test_loss: 1.1211, test_f1: 0.5124
 epoch: 99, train_loss: 0.8724, test_loss: 1.1236, test_f1: 0.5028
##################ITERATION #6 ****************************************
 epoch: 0, train_loss: 1.2694, test_loss: 1.3740, test_f1: 0.2281
 epoch: 1, train_loss: 1.2101, test_loss: 1.3613, test_f1: 0.2281
 epoch: 2, train_loss: 1.1931, test_loss: 1.3572, test_f1: 0.2281
 epoch: 3, train_loss: 1.1799, test_loss: 1.3487, test_f1: 0.2281
 epoch: 4, train_loss: 1.1574, test_loss: 1.3371, test_f1: 0.2929
 epoch: 5, train_loss: 1.1484, test_loss: 1.3174, test_f1: 0.2989
 epoch: 6, train_loss: 1.1345, test_loss: 1.2888, test_f1: 0.3025
 epoch: 7, train_loss: 1.1288, test_loss: 1.2728, test_f1: 0.3027
 epoch: 8, train_loss: 1.1220, test_loss: 1.2583, test_f1: 0.3014
 epoch: 9, train_loss: 1.1157, test_loss: 1.2320, test_f1: 0.3266
 epoch: 10, train_loss: 1.1016, test_loss: 1.2033, test_f1: 0.3948
 epoch: 11, train_loss: 1.1030, test_loss: 1.1867, test_f1: 0.4102
 epoch: 12, train_loss: 1.0901, test_loss: 1.1745, test_f1: 0.4099
 epoch: 13, train_loss: 1.0867, test_loss: 1.1614, test_f1: 0.4281
 epoch: 14, train_loss: 1.0773, test_loss: 1.1593, test_f1: 0.4427
 epoch: 15, train_loss: 1.0785, test_loss: 1.1547, test_f1: 0.4419
 epoch: 16, train_loss: 1.0658, test_loss: 1.1509, test_f1: 0.4464
 epoch: 17, train_loss: 1.0577, test_loss: 1.1465, test_f1: 0.4642
 epoch: 18, train_loss: 1.0515, test_loss: 1.1435, test_f1: 0.4596
 epoch: 19, train_loss: 1.0507, test_loss: 1.1410, test_f1: 0.4684
 epoch: 20, train_loss: 1.0541, test_loss: 1.1370, test_f1: 0.4590
 epoch: 21, train_loss: 1.0371, test_loss: 1.1311, test_f1: 0.4626
 epoch: 22, train_loss: 1.0399, test_loss: 1.1273, test_f1: 0.4729
 epoch: 23, train_loss: 1.0292, test_loss: 1.1270, test_f1: 0.4731
 epoch: 24, train_loss: 1.0192, test_loss: 1.1269, test_f1: 0.4659
 epoch: 25, train_loss: 1.0208, test_loss: 1.1260, test_f1: 0.4653
 epoch: 26, train_loss: 1.0075, test_loss: 1.1243, test_f1: 0.4738
 epoch: 27, train_loss: 1.0058, test_loss: 1.1171, test_f1: 0.4623
 epoch: 28, train_loss: 0.9981, test_loss: 1.1114, test_f1: 0.4785
 epoch: 29, train_loss: 1.0009, test_loss: 1.1120, test_f1: 0.4753
 epoch: 30, train_loss: 1.0043, test_loss: 1.1135, test_f1: 0.4702
 epoch: 31, train_loss: 1.0002, test_loss: 1.1139, test_f1: 0.4907
 epoch: 32, train_loss: 0.9982, test_loss: 1.1075, test_f1: 0.4817
 epoch: 33, train_loss: 0.9873, test_loss: 1.1001, test_f1: 0.4772
 epoch: 34, train_loss: 0.9793, test_loss: 1.0979, test_f1: 0.4794
 epoch: 35, train_loss: 0.9772, test_loss: 1.0989, test_f1: 0.4978
 epoch: 36, train_loss: 0.9829, test_loss: 1.1012, test_f1: 0.5008
 epoch: 37, train_loss: 0.9697, test_loss: 1.0928, test_f1: 0.5165
 epoch: 38, train_loss: 0.9681, test_loss: 1.0863, test_f1: 0.5165
 epoch: 39, train_loss: 0.9550, test_loss: 1.0913, test_f1: 0.5031
 epoch: 40, train_loss: 0.9504, test_loss: 1.0918, test_f1: 0.5019
 epoch: 41, train_loss: 0.9508, test_loss: 1.0922, test_f1: 0.5018
 epoch: 42, train_loss: 0.9465, test_loss: 1.0776, test_f1: 0.5140
 epoch: 43, train_loss: 0.9401, test_loss: 1.0809, test_f1: 0.5349
 epoch: 44, train_loss: 0.9368, test_loss: 1.0774, test_f1: 0.5321
 epoch: 45, train_loss: 0.9356, test_loss: 1.0754, test_f1: 0.5363
 epoch: 46, train_loss: 0.9434, test_loss: 1.0872, test_f1: 0.5168
 epoch: 47, train_loss: 0.9338, test_loss: 1.0763, test_f1: 0.5129
 epoch: 48, train_loss: 0.9364, test_loss: 1.0896, test_f1: 0.5186
 epoch: 49, train_loss: 0.9255, test_loss: 1.0961, test_f1: 0.5288
 epoch: 50, train_loss: 0.9273, test_loss: 1.0842, test_f1: 0.5362
 epoch: 51, train_loss: 0.9158, test_loss: 1.0760, test_f1: 0.5323
 epoch: 52, train_loss: 0.9225, test_loss: 1.0774, test_f1: 0.5249
 epoch: 53, train_loss: 0.9204, test_loss: 1.0631, test_f1: 0.5251
 epoch: 54, train_loss: 0.9260, test_loss: 1.0520, test_f1: 0.5286
 epoch: 55, train_loss: 0.9162, test_loss: 1.0526, test_f1: 0.5345
 epoch: 56, train_loss: 0.9118, test_loss: 1.0514, test_f1: 0.5233
 epoch: 57, train_loss: 0.9047, test_loss: 1.0556, test_f1: 0.5277
 epoch: 58, train_loss: 0.8967, test_loss: 1.0565, test_f1: 0.5349
 epoch: 59, train_loss: 0.9152, test_loss: 1.0545, test_f1: 0.5271
 epoch: 60, train_loss: 0.9005, test_loss: 1.0626, test_f1: 0.5314
 epoch: 61, train_loss: 0.9131, test_loss: 1.0540, test_f1: 0.5401
 epoch: 62, train_loss: 0.9034, test_loss: 1.0496, test_f1: 0.5290
 epoch: 63, train_loss: 0.9036, test_loss: 1.0556, test_f1: 0.5273
 epoch: 64, train_loss: 0.8816, test_loss: 1.0796, test_f1: 0.5262
 epoch: 65, train_loss: 0.8906, test_loss: 1.0742, test_f1: 0.5269
 epoch: 66, train_loss: 0.8947, test_loss: 1.0598, test_f1: 0.5301
 epoch: 67, train_loss: 0.9031, test_loss: 1.0571, test_f1: 0.5428
 epoch: 68, train_loss: 0.8980, test_loss: 1.0656, test_f1: 0.5371
 epoch: 69, train_loss: 0.8954, test_loss: 1.0594, test_f1: 0.5470
 epoch: 70, train_loss: 0.8996, test_loss: 1.0519, test_f1: 0.5421
 epoch: 71, train_loss: 0.8914, test_loss: 1.0563, test_f1: 0.5414
 epoch: 72, train_loss: 0.8896, test_loss: 1.0616, test_f1: 0.5362
 epoch: 73, train_loss: 0.8880, test_loss: 1.0531, test_f1: 0.5372
 epoch: 74, train_loss: 0.8894, test_loss: 1.0539, test_f1: 0.5380
 epoch: 75, train_loss: 0.8904, test_loss: 1.0597, test_f1: 0.5395
 epoch: 76, train_loss: 0.8816, test_loss: 1.0569, test_f1: 0.5440
 epoch: 77, train_loss: 0.8771, test_loss: 1.0615, test_f1: 0.5374
 epoch: 78, train_loss: 0.8819, test_loss: 1.0610, test_f1: 0.5411
 epoch: 79, train_loss: 0.8809, test_loss: 1.0603, test_f1: 0.5281
 epoch: 80, train_loss: 0.8840, test_loss: 1.0606, test_f1: 0.5437
 epoch: 81, train_loss: 0.8797, test_loss: 1.0710, test_f1: 0.5401
 epoch: 82, train_loss: 0.8677, test_loss: 1.0587, test_f1: 0.5530
 epoch: 83, train_loss: 0.8810, test_loss: 1.0557, test_f1: 0.5557
 epoch: 84, train_loss: 0.8771, test_loss: 1.0502, test_f1: 0.5491
 epoch: 85, train_loss: 0.8778, test_loss: 1.0564, test_f1: 0.5612
 epoch: 86, train_loss: 0.8713, test_loss: 1.0598, test_f1: 0.5544
 epoch: 87, train_loss: 0.8741, test_loss: 1.0641, test_f1: 0.5510
 epoch: 88, train_loss: 0.8631, test_loss: 1.0595, test_f1: 0.5665
 epoch: 89, train_loss: 0.8635, test_loss: 1.0573, test_f1: 0.5657
 epoch: 90, train_loss: 0.8715, test_loss: 1.0617, test_f1: 0.5634
 epoch: 91, train_loss: 0.8610, test_loss: 1.0561, test_f1: 0.5665
 epoch: 92, train_loss: 0.8689, test_loss: 1.0584, test_f1: 0.5606
 epoch: 93, train_loss: 0.8706, test_loss: 1.0542, test_f1: 0.5721
 epoch: 94, train_loss: 0.8652, test_loss: 1.0732, test_f1: 0.5552
 epoch: 95, train_loss: 0.8596, test_loss: 1.0739, test_f1: 0.5440
 epoch: 96, train_loss: 0.8488, test_loss: 1.0676, test_f1: 0.5378
 epoch: 97, train_loss: 0.8633, test_loss: 1.0765, test_f1: 0.5418
 epoch: 98, train_loss: 0.8566, test_loss: 1.0677, test_f1: 0.5500
 epoch: 99, train_loss: 0.8640, test_loss: 1.0865, test_f1: 0.5456
##################ITERATION #7 ****************************************
 epoch: 0, train_loss: 1.2531, test_loss: 1.3580, test_f1: 0.2281
 epoch: 1, train_loss: 1.2117, test_loss: 1.3318, test_f1: 0.2281
 epoch: 2, train_loss: 1.1943, test_loss: 1.3072, test_f1: 0.2281
 epoch: 3, train_loss: 1.1741, test_loss: 1.2876, test_f1: 0.2281
 epoch: 4, train_loss: 1.1667, test_loss: 1.2829, test_f1: 0.2441
 epoch: 5, train_loss: 1.1577, test_loss: 1.3024, test_f1: 0.2832
 epoch: 6, train_loss: 1.1446, test_loss: 1.2978, test_f1: 0.2836
 epoch: 7, train_loss: 1.1244, test_loss: 1.2897, test_f1: 0.2774
 epoch: 8, train_loss: 1.1231, test_loss: 1.2750, test_f1: 0.2895
 epoch: 9, train_loss: 1.1148, test_loss: 1.2671, test_f1: 0.3107
 epoch: 10, train_loss: 1.1138, test_loss: 1.2488, test_f1: 0.3541
 epoch: 11, train_loss: 1.1025, test_loss: 1.2264, test_f1: 0.3835
 epoch: 12, train_loss: 1.0943, test_loss: 1.2085, test_f1: 0.3946
 epoch: 13, train_loss: 1.0901, test_loss: 1.1874, test_f1: 0.4294
 epoch: 14, train_loss: 1.0859, test_loss: 1.1782, test_f1: 0.4235
 epoch: 15, train_loss: 1.0836, test_loss: 1.1711, test_f1: 0.4301
 epoch: 16, train_loss: 1.0787, test_loss: 1.1636, test_f1: 0.4355
 epoch: 17, train_loss: 1.0725, test_loss: 1.1596, test_f1: 0.4287
 epoch: 18, train_loss: 1.0634, test_loss: 1.1521, test_f1: 0.4367
 epoch: 19, train_loss: 1.0610, test_loss: 1.1509, test_f1: 0.4338
 epoch: 20, train_loss: 1.0554, test_loss: 1.1448, test_f1: 0.4282
 epoch: 21, train_loss: 1.0469, test_loss: 1.1436, test_f1: 0.4315
 epoch: 22, train_loss: 1.0368, test_loss: 1.1359, test_f1: 0.4356
 epoch: 23, train_loss: 1.0333, test_loss: 1.1309, test_f1: 0.4461
 epoch: 24, train_loss: 1.0322, test_loss: 1.1264, test_f1: 0.4420
 epoch: 25, train_loss: 1.0251, test_loss: 1.1211, test_f1: 0.4409
 epoch: 26, train_loss: 1.0283, test_loss: 1.1267, test_f1: 0.4310
 epoch: 27, train_loss: 1.0258, test_loss: 1.1228, test_f1: 0.4464
 epoch: 28, train_loss: 1.0199, test_loss: 1.1152, test_f1: 0.4646
 epoch: 29, train_loss: 1.0097, test_loss: 1.1092, test_f1: 0.4571
 epoch: 30, train_loss: 1.0061, test_loss: 1.1097, test_f1: 0.4638
 epoch: 31, train_loss: 1.0014, test_loss: 1.0995, test_f1: 0.4725
 epoch: 32, train_loss: 0.9999, test_loss: 1.0894, test_f1: 0.4753
 epoch: 33, train_loss: 1.0011, test_loss: 1.0871, test_f1: 0.4792
 epoch: 34, train_loss: 0.9871, test_loss: 1.0818, test_f1: 0.4776
 epoch: 35, train_loss: 0.9771, test_loss: 1.0840, test_f1: 0.4823
 epoch: 36, train_loss: 0.9862, test_loss: 1.0844, test_f1: 0.4829
 epoch: 37, train_loss: 0.9771, test_loss: 1.0895, test_f1: 0.4850
 epoch: 38, train_loss: 0.9746, test_loss: 1.0800, test_f1: 0.4858
 epoch: 39, train_loss: 0.9693, test_loss: 1.0772, test_f1: 0.4811
 epoch: 40, train_loss: 0.9630, test_loss: 1.0719, test_f1: 0.4829
 epoch: 41, train_loss: 0.9602, test_loss: 1.0647, test_f1: 0.4897
 epoch: 42, train_loss: 0.9656, test_loss: 1.0602, test_f1: 0.4922
 epoch: 43, train_loss: 0.9611, test_loss: 1.0715, test_f1: 0.4972
 epoch: 44, train_loss: 0.9546, test_loss: 1.0793, test_f1: 0.4808
 epoch: 45, train_loss: 0.9538, test_loss: 1.0632, test_f1: 0.5124
 epoch: 46, train_loss: 0.9481, test_loss: 1.0632, test_f1: 0.5151
 epoch: 47, train_loss: 0.9475, test_loss: 1.0647, test_f1: 0.5121
 epoch: 48, train_loss: 0.9440, test_loss: 1.0677, test_f1: 0.5042
 epoch: 49, train_loss: 0.9388, test_loss: 1.0674, test_f1: 0.5128
 epoch: 50, train_loss: 0.9380, test_loss: 1.0615, test_f1: 0.5154
 epoch: 51, train_loss: 0.9361, test_loss: 1.0619, test_f1: 0.4995
 epoch: 52, train_loss: 0.9359, test_loss: 1.0631, test_f1: 0.5030
 epoch: 53, train_loss: 0.9289, test_loss: 1.0656, test_f1: 0.4940
 epoch: 54, train_loss: 0.9313, test_loss: 1.0569, test_f1: 0.5008
 epoch: 55, train_loss: 0.9374, test_loss: 1.0525, test_f1: 0.5168
 epoch: 56, train_loss: 0.9297, test_loss: 1.0477, test_f1: 0.5156
 epoch: 57, train_loss: 0.9175, test_loss: 1.0464, test_f1: 0.5109
 epoch: 58, train_loss: 0.9251, test_loss: 1.0461, test_f1: 0.5113
 epoch: 59, train_loss: 0.9312, test_loss: 1.0487, test_f1: 0.5168
 epoch: 60, train_loss: 0.9172, test_loss: 1.0468, test_f1: 0.5123
 epoch: 61, train_loss: 0.9156, test_loss: 1.0450, test_f1: 0.5091
 epoch: 62, train_loss: 0.9269, test_loss: 1.0410, test_f1: 0.5118
 epoch: 63, train_loss: 0.9180, test_loss: 1.0580, test_f1: 0.5118
 epoch: 64, train_loss: 0.9142, test_loss: 1.0523, test_f1: 0.5005
 epoch: 65, train_loss: 0.9153, test_loss: 1.0459, test_f1: 0.5050
 epoch: 66, train_loss: 0.9121, test_loss: 1.0401, test_f1: 0.5079
 epoch: 67, train_loss: 0.8991, test_loss: 1.0482, test_f1: 0.4977
 epoch: 68, train_loss: 0.9146, test_loss: 1.0464, test_f1: 0.4922
 epoch: 69, train_loss: 0.9099, test_loss: 1.0392, test_f1: 0.5090
 epoch: 70, train_loss: 0.9078, test_loss: 1.0385, test_f1: 0.5156
 epoch: 71, train_loss: 0.9019, test_loss: 1.0428, test_f1: 0.5107
 epoch: 72, train_loss: 0.9061, test_loss: 1.0493, test_f1: 0.5289
 epoch: 73, train_loss: 0.9068, test_loss: 1.0554, test_f1: 0.5171
 epoch: 74, train_loss: 0.8982, test_loss: 1.0424, test_f1: 0.5225
 epoch: 75, train_loss: 0.8953, test_loss: 1.0479, test_f1: 0.5078
 epoch: 76, train_loss: 0.8924, test_loss: 1.0515, test_f1: 0.5086
 epoch: 77, train_loss: 0.8955, test_loss: 1.0510, test_f1: 0.5145
 epoch: 78, train_loss: 0.8993, test_loss: 1.0525, test_f1: 0.5100
 epoch: 79, train_loss: 0.8876, test_loss: 1.0491, test_f1: 0.5181
 epoch: 80, train_loss: 0.8834, test_loss: 1.0461, test_f1: 0.5192
 epoch: 81, train_loss: 0.8893, test_loss: 1.0476, test_f1: 0.5271
 epoch: 82, train_loss: 0.8901, test_loss: 1.0475, test_f1: 0.5261
 epoch: 83, train_loss: 0.8852, test_loss: 1.0452, test_f1: 0.5227
 epoch: 84, train_loss: 0.8792, test_loss: 1.0428, test_f1: 0.5184
 epoch: 85, train_loss: 0.8859, test_loss: 1.0411, test_f1: 0.5155
 epoch: 86, train_loss: 0.8852, test_loss: 1.0460, test_f1: 0.5244
 epoch: 87, train_loss: 0.8880, test_loss: 1.0400, test_f1: 0.5268
 epoch: 88, train_loss: 0.8847, test_loss: 1.0414, test_f1: 0.5277
 epoch: 89, train_loss: 0.8820, test_loss: 1.0402, test_f1: 0.5229
 epoch: 90, train_loss: 0.8787, test_loss: 1.0379, test_f1: 0.5267
 epoch: 91, train_loss: 0.8831, test_loss: 1.0369, test_f1: 0.5260
 epoch: 92, train_loss: 0.8781, test_loss: 1.0360, test_f1: 0.5327
 epoch: 93, train_loss: 0.8681, test_loss: 1.0281, test_f1: 0.5383
 epoch: 94, train_loss: 0.8835, test_loss: 1.0378, test_f1: 0.5392
 epoch: 95, train_loss: 0.8746, test_loss: 1.0441, test_f1: 0.5150
 epoch: 96, train_loss: 0.8658, test_loss: 1.0370, test_f1: 0.5260
 epoch: 97, train_loss: 0.8759, test_loss: 1.0479, test_f1: 0.5228
 epoch: 98, train_loss: 0.8745, test_loss: 1.0381, test_f1: 0.5311
 epoch: 99, train_loss: 0.8714, test_loss: 1.0284, test_f1: 0.5387
##################ITERATION #8 ****************************************
 epoch: 0, train_loss: 1.2641, test_loss: 1.3404, test_f1: 0.2281
 epoch: 1, train_loss: 1.2017, test_loss: 1.3341, test_f1: 0.2281
 epoch: 2, train_loss: 1.1885, test_loss: 1.3292, test_f1: 0.2281
 epoch: 3, train_loss: 1.1691, test_loss: 1.3235, test_f1: 0.2281
 epoch: 4, train_loss: 1.1498, test_loss: 1.3134, test_f1: 0.2281
 epoch: 5, train_loss: 1.1442, test_loss: 1.3107, test_f1: 0.2682
 epoch: 6, train_loss: 1.1298, test_loss: 1.2967, test_f1: 0.2435
 epoch: 7, train_loss: 1.1133, test_loss: 1.2617, test_f1: 0.2676
 epoch: 8, train_loss: 1.1085, test_loss: 1.2345, test_f1: 0.3116
 epoch: 9, train_loss: 1.1045, test_loss: 1.2151, test_f1: 0.3648
 epoch: 10, train_loss: 1.0934, test_loss: 1.2052, test_f1: 0.3815
 epoch: 11, train_loss: 1.0892, test_loss: 1.2023, test_f1: 0.3520
 epoch: 12, train_loss: 1.0837, test_loss: 1.1855, test_f1: 0.4403
 epoch: 13, train_loss: 1.0759, test_loss: 1.1759, test_f1: 0.4522
 epoch: 14, train_loss: 1.0769, test_loss: 1.1763, test_f1: 0.4619
 epoch: 15, train_loss: 1.0663, test_loss: 1.1744, test_f1: 0.4466
 epoch: 16, train_loss: 1.0586, test_loss: 1.1747, test_f1: 0.4417
 epoch: 17, train_loss: 1.0489, test_loss: 1.1754, test_f1: 0.4472
 epoch: 18, train_loss: 1.0415, test_loss: 1.1759, test_f1: 0.4425
 epoch: 19, train_loss: 1.0485, test_loss: 1.1723, test_f1: 0.4420
 epoch: 20, train_loss: 1.0382, test_loss: 1.1694, test_f1: 0.4471
 epoch: 21, train_loss: 1.0323, test_loss: 1.1607, test_f1: 0.4480
 epoch: 22, train_loss: 1.0326, test_loss: 1.1557, test_f1: 0.4453
 epoch: 23, train_loss: 1.0237, test_loss: 1.1497, test_f1: 0.4717
 epoch: 24, train_loss: 1.0148, test_loss: 1.1429, test_f1: 0.4716
 epoch: 25, train_loss: 1.0149, test_loss: 1.1405, test_f1: 0.4821
 epoch: 26, train_loss: 1.0179, test_loss: 1.1362, test_f1: 0.4890
 epoch: 27, train_loss: 1.0086, test_loss: 1.1301, test_f1: 0.4759
 epoch: 28, train_loss: 1.0097, test_loss: 1.1281, test_f1: 0.4837
 epoch: 29, train_loss: 1.0034, test_loss: 1.1237, test_f1: 0.4861
 epoch: 30, train_loss: 0.9909, test_loss: 1.1208, test_f1: 0.5007
 epoch: 31, train_loss: 0.9850, test_loss: 1.1285, test_f1: 0.5014
 epoch: 32, train_loss: 1.0030, test_loss: 1.1285, test_f1: 0.5046
 epoch: 33, train_loss: 0.9839, test_loss: 1.1261, test_f1: 0.4950
 epoch: 34, train_loss: 0.9764, test_loss: 1.1289, test_f1: 0.5014
 epoch: 35, train_loss: 0.9716, test_loss: 1.1211, test_f1: 0.4925
 epoch: 36, train_loss: 0.9763, test_loss: 1.1216, test_f1: 0.4975
 epoch: 37, train_loss: 0.9738, test_loss: 1.1303, test_f1: 0.4992
 epoch: 38, train_loss: 0.9554, test_loss: 1.1364, test_f1: 0.4965
 epoch: 39, train_loss: 0.9662, test_loss: 1.1226, test_f1: 0.5108
 epoch: 40, train_loss: 0.9625, test_loss: 1.1228, test_f1: 0.5037
 epoch: 41, train_loss: 0.9568, test_loss: 1.1185, test_f1: 0.5111
 epoch: 42, train_loss: 0.9574, test_loss: 1.1077, test_f1: 0.5151
 epoch: 43, train_loss: 0.9458, test_loss: 1.1098, test_f1: 0.5124
 epoch: 44, train_loss: 0.9460, test_loss: 1.1147, test_f1: 0.5088
 epoch: 45, train_loss: 0.9431, test_loss: 1.1114, test_f1: 0.5122
 epoch: 46, train_loss: 0.9400, test_loss: 1.1141, test_f1: 0.5119
 epoch: 47, train_loss: 0.9342, test_loss: 1.1055, test_f1: 0.5120
 epoch: 48, train_loss: 0.9338, test_loss: 1.1069, test_f1: 0.5098
 epoch: 49, train_loss: 0.9271, test_loss: 1.1020, test_f1: 0.5096
 epoch: 50, train_loss: 0.9270, test_loss: 1.1019, test_f1: 0.5102
 epoch: 51, train_loss: 0.9322, test_loss: 1.1002, test_f1: 0.5219
 epoch: 52, train_loss: 0.9284, test_loss: 1.1066, test_f1: 0.5254
 epoch: 53, train_loss: 0.9287, test_loss: 1.0974, test_f1: 0.5298
 epoch: 54, train_loss: 0.9220, test_loss: 1.0892, test_f1: 0.5299
 epoch: 55, train_loss: 0.9290, test_loss: 1.0955, test_f1: 0.5278
 epoch: 56, train_loss: 0.9133, test_loss: 1.0999, test_f1: 0.5301
 epoch: 57, train_loss: 0.9206, test_loss: 1.1029, test_f1: 0.5290
 epoch: 58, train_loss: 0.9120, test_loss: 1.1045, test_f1: 0.5263
 epoch: 59, train_loss: 0.9200, test_loss: 1.1037, test_f1: 0.5233
 epoch: 60, train_loss: 0.9101, test_loss: 1.1039, test_f1: 0.5327
 epoch: 61, train_loss: 0.9106, test_loss: 1.1047, test_f1: 0.5291
 epoch: 62, train_loss: 0.9128, test_loss: 1.0975, test_f1: 0.5363
 epoch: 63, train_loss: 0.9058, test_loss: 1.0989, test_f1: 0.5281
 epoch: 64, train_loss: 0.9094, test_loss: 1.0999, test_f1: 0.5260
 epoch: 65, train_loss: 0.9098, test_loss: 1.1008, test_f1: 0.5257
 epoch: 66, train_loss: 0.9040, test_loss: 1.1040, test_f1: 0.5334
 epoch: 67, train_loss: 0.9007, test_loss: 1.0970, test_f1: 0.5305
 epoch: 68, train_loss: 0.9024, test_loss: 1.0997, test_f1: 0.5370
 epoch: 69, train_loss: 0.8979, test_loss: 1.0895, test_f1: 0.5417
 epoch: 70, train_loss: 0.9009, test_loss: 1.0907, test_f1: 0.5392
 epoch: 71, train_loss: 0.8852, test_loss: 1.0922, test_f1: 0.5393
 epoch: 72, train_loss: 0.8954, test_loss: 1.0896, test_f1: 0.5450
 epoch: 73, train_loss: 0.8961, test_loss: 1.0887, test_f1: 0.5427
 epoch: 74, train_loss: 0.8915, test_loss: 1.1017, test_f1: 0.5415
 epoch: 75, train_loss: 0.8900, test_loss: 1.0964, test_f1: 0.5409
 epoch: 76, train_loss: 0.8925, test_loss: 1.0876, test_f1: 0.5401
 epoch: 77, train_loss: 0.8889, test_loss: 1.0792, test_f1: 0.5427
 epoch: 78, train_loss: 0.8950, test_loss: 1.0796, test_f1: 0.5421
 epoch: 79, train_loss: 0.8795, test_loss: 1.0833, test_f1: 0.5443
 epoch: 80, train_loss: 0.8872, test_loss: 1.0779, test_f1: 0.5558
 epoch: 81, train_loss: 0.8801, test_loss: 1.0791, test_f1: 0.5473
 epoch: 82, train_loss: 0.8854, test_loss: 1.0960, test_f1: 0.5427
 epoch: 83, train_loss: 0.8880, test_loss: 1.1032, test_f1: 0.5323
 epoch: 84, train_loss: 0.8765, test_loss: 1.1035, test_f1: 0.5377
 epoch: 85, train_loss: 0.8827, test_loss: 1.0986, test_f1: 0.5537
 epoch: 86, train_loss: 0.8715, test_loss: 1.0985, test_f1: 0.5594
 epoch: 87, train_loss: 0.8784, test_loss: 1.0950, test_f1: 0.5548
 epoch: 88, train_loss: 0.8780, test_loss: 1.0900, test_f1: 0.5561
 epoch: 89, train_loss: 0.8904, test_loss: 1.0949, test_f1: 0.5515
 epoch: 90, train_loss: 0.8714, test_loss: 1.0929, test_f1: 0.5492
 epoch: 91, train_loss: 0.8651, test_loss: 1.0932, test_f1: 0.5514
 epoch: 92, train_loss: 0.8700, test_loss: 1.1008, test_f1: 0.5414
 epoch: 93, train_loss: 0.8651, test_loss: 1.1034, test_f1: 0.5334
 epoch: 94, train_loss: 0.8709, test_loss: 1.1025, test_f1: 0.5516
 epoch: 95, train_loss: 0.8605, test_loss: 1.1036, test_f1: 0.5440
 epoch: 96, train_loss: 0.8728, test_loss: 1.0995, test_f1: 0.5530
 epoch: 97, train_loss: 0.8734, test_loss: 1.0952, test_f1: 0.5376
 epoch: 98, train_loss: 0.8606, test_loss: 1.0957, test_f1: 0.5422
 epoch: 99, train_loss: 0.8715, test_loss: 1.0883, test_f1: 0.5539
##################ITERATION #9 ****************************************
 epoch: 0, train_loss: 1.3107, test_loss: 1.3819, test_f1: 0.2281
 epoch: 1, train_loss: 1.2392, test_loss: 1.3626, test_f1: 0.2281
 epoch: 2, train_loss: 1.2237, test_loss: 1.3437, test_f1: 0.2281
 epoch: 3, train_loss: 1.2007, test_loss: 1.3250, test_f1: 0.2281
 epoch: 4, train_loss: 1.1848, test_loss: 1.3047, test_f1: 0.2281
 epoch: 5, train_loss: 1.1712, test_loss: 1.2905, test_f1: 0.2336
 epoch: 6, train_loss: 1.1583, test_loss: 1.2746, test_f1: 0.2741
 epoch: 7, train_loss: 1.1526, test_loss: 1.2804, test_f1: 0.3049
 epoch: 8, train_loss: 1.1254, test_loss: 1.2782, test_f1: 0.2952
 epoch: 9, train_loss: 1.1321, test_loss: 1.2470, test_f1: 0.2938
 epoch: 10, train_loss: 1.1156, test_loss: 1.2193, test_f1: 0.2967
 epoch: 11, train_loss: 1.1006, test_loss: 1.2009, test_f1: 0.2948
 epoch: 12, train_loss: 1.0967, test_loss: 1.1898, test_f1: 0.2907
 epoch: 13, train_loss: 1.1005, test_loss: 1.1797, test_f1: 0.2979
 epoch: 14, train_loss: 1.0839, test_loss: 1.1786, test_f1: 0.3130
 epoch: 15, train_loss: 1.0738, test_loss: 1.1745, test_f1: 0.3211
 epoch: 16, train_loss: 1.0676, test_loss: 1.1679, test_f1: 0.3175
 epoch: 17, train_loss: 1.0718, test_loss: 1.1600, test_f1: 0.3251
 epoch: 18, train_loss: 1.0699, test_loss: 1.1655, test_f1: 0.3209
 epoch: 19, train_loss: 1.0587, test_loss: 1.1590, test_f1: 0.3205
 epoch: 20, train_loss: 1.0518, test_loss: 1.1522, test_f1: 0.3452
 epoch: 21, train_loss: 1.0415, test_loss: 1.1374, test_f1: 0.3600
 epoch: 22, train_loss: 1.0485, test_loss: 1.1302, test_f1: 0.3543
 epoch: 23, train_loss: 1.0337, test_loss: 1.1259, test_f1: 0.3709
 epoch: 24, train_loss: 1.0312, test_loss: 1.1231, test_f1: 0.3670
 epoch: 25, train_loss: 1.0209, test_loss: 1.1163, test_f1: 0.3689
 epoch: 26, train_loss: 1.0142, test_loss: 1.1208, test_f1: 0.4016
 epoch: 27, train_loss: 1.0108, test_loss: 1.1224, test_f1: 0.3872
 epoch: 28, train_loss: 1.0105, test_loss: 1.1212, test_f1: 0.4169
 epoch: 29, train_loss: 1.0040, test_loss: 1.1102, test_f1: 0.4347
 epoch: 30, train_loss: 1.0022, test_loss: 1.1012, test_f1: 0.4551
 epoch: 31, train_loss: 0.9956, test_loss: 1.1045, test_f1: 0.4354
 epoch: 32, train_loss: 0.9901, test_loss: 1.1080, test_f1: 0.4342
 epoch: 33, train_loss: 0.9940, test_loss: 1.1108, test_f1: 0.4477
 epoch: 34, train_loss: 0.9798, test_loss: 1.1011, test_f1: 0.4469
 epoch: 35, train_loss: 0.9846, test_loss: 1.0885, test_f1: 0.4509
 epoch: 36, train_loss: 0.9832, test_loss: 1.0761, test_f1: 0.4697
 epoch: 37, train_loss: 0.9744, test_loss: 1.0777, test_f1: 0.4625
 epoch: 38, train_loss: 0.9696, test_loss: 1.0740, test_f1: 0.4639
 epoch: 39, train_loss: 0.9620, test_loss: 1.0788, test_f1: 0.4744
 epoch: 40, train_loss: 0.9603, test_loss: 1.0724, test_f1: 0.4957
 epoch: 41, train_loss: 0.9620, test_loss: 1.0626, test_f1: 0.4931
 epoch: 42, train_loss: 0.9518, test_loss: 1.0594, test_f1: 0.4936
 epoch: 43, train_loss: 0.9529, test_loss: 1.0653, test_f1: 0.4945
 epoch: 44, train_loss: 0.9566, test_loss: 1.0652, test_f1: 0.5084
 epoch: 45, train_loss: 0.9454, test_loss: 1.0581, test_f1: 0.5026
 epoch: 46, train_loss: 0.9518, test_loss: 1.0571, test_f1: 0.5002
 epoch: 47, train_loss: 0.9453, test_loss: 1.0557, test_f1: 0.4948
 epoch: 48, train_loss: 0.9454, test_loss: 1.0593, test_f1: 0.5065
 epoch: 49, train_loss: 0.9311, test_loss: 1.0639, test_f1: 0.4908
 epoch: 50, train_loss: 0.9327, test_loss: 1.0585, test_f1: 0.5004
 epoch: 51, train_loss: 0.9264, test_loss: 1.0587, test_f1: 0.5033
 epoch: 52, train_loss: 0.9207, test_loss: 1.0547, test_f1: 0.5058
 epoch: 53, train_loss: 0.9159, test_loss: 1.0566, test_f1: 0.5035
 epoch: 54, train_loss: 0.9256, test_loss: 1.0484, test_f1: 0.5044
 epoch: 55, train_loss: 0.9190, test_loss: 1.0400, test_f1: 0.5067
 epoch: 56, train_loss: 0.9071, test_loss: 1.0462, test_f1: 0.5066
 epoch: 57, train_loss: 0.9193, test_loss: 1.0501, test_f1: 0.5097
 epoch: 58, train_loss: 0.9084, test_loss: 1.0483, test_f1: 0.5054
 epoch: 59, train_loss: 0.9128, test_loss: 1.0505, test_f1: 0.5055
 epoch: 60, train_loss: 0.9194, test_loss: 1.0495, test_f1: 0.5108
 epoch: 61, train_loss: 0.9175, test_loss: 1.0532, test_f1: 0.5043
 epoch: 62, train_loss: 0.9189, test_loss: 1.0391, test_f1: 0.5136
 epoch: 63, train_loss: 0.9087, test_loss: 1.0364, test_f1: 0.5185
 epoch: 64, train_loss: 0.9197, test_loss: 1.0373, test_f1: 0.5173
 epoch: 65, train_loss: 0.9075, test_loss: 1.0472, test_f1: 0.5113
 epoch: 66, train_loss: 0.9145, test_loss: 1.0513, test_f1: 0.4991
 epoch: 67, train_loss: 0.9022, test_loss: 1.0480, test_f1: 0.5053
 epoch: 68, train_loss: 0.9005, test_loss: 1.0503, test_f1: 0.5043
 epoch: 69, train_loss: 0.8938, test_loss: 1.0510, test_f1: 0.4972
 epoch: 70, train_loss: 0.9043, test_loss: 1.0386, test_f1: 0.5099
 epoch: 71, train_loss: 0.8995, test_loss: 1.0363, test_f1: 0.5106
 epoch: 72, train_loss: 0.8898, test_loss: 1.0340, test_f1: 0.5104
 epoch: 73, train_loss: 0.8978, test_loss: 1.0347, test_f1: 0.5084
 epoch: 74, train_loss: 0.8944, test_loss: 1.0402, test_f1: 0.5033
 epoch: 75, train_loss: 0.8790, test_loss: 1.0449, test_f1: 0.5086
 epoch: 76, train_loss: 0.8857, test_loss: 1.0387, test_f1: 0.5127
 epoch: 77, train_loss: 0.8886, test_loss: 1.0453, test_f1: 0.5047
 epoch: 78, train_loss: 0.8951, test_loss: 1.0441, test_f1: 0.5047
 epoch: 79, train_loss: 0.8862, test_loss: 1.0465, test_f1: 0.5046
 epoch: 80, train_loss: 0.8935, test_loss: 1.0440, test_f1: 0.5052
 epoch: 81, train_loss: 0.8862, test_loss: 1.0514, test_f1: 0.5150
 epoch: 82, train_loss: 0.8908, test_loss: 1.0470, test_f1: 0.5136
 epoch: 83, train_loss: 0.8797, test_loss: 1.0570, test_f1: 0.5103
 epoch: 84, train_loss: 0.8855, test_loss: 1.0491, test_f1: 0.5115
 epoch: 85, train_loss: 0.8803, test_loss: 1.0522, test_f1: 0.5116
 epoch: 86, train_loss: 0.8765, test_loss: 1.0451, test_f1: 0.5154
 epoch: 87, train_loss: 0.8826, test_loss: 1.0508, test_f1: 0.5094
 epoch: 88, train_loss: 0.8772, test_loss: 1.0481, test_f1: 0.5117
 epoch: 89, train_loss: 0.8702, test_loss: 1.0386, test_f1: 0.5201
 epoch: 90, train_loss: 0.8899, test_loss: 1.0443, test_f1: 0.5066
 epoch: 91, train_loss: 0.8670, test_loss: 1.0409, test_f1: 0.5044
 epoch: 92, train_loss: 0.8714, test_loss: 1.0381, test_f1: 0.5023
 epoch: 93, train_loss: 0.8739, test_loss: 1.0406, test_f1: 0.5093
 epoch: 94, train_loss: 0.8715, test_loss: 1.0460, test_f1: 0.5071
 epoch: 95, train_loss: 0.8702, test_loss: 1.0347, test_f1: 0.5142
 epoch: 96, train_loss: 0.8702, test_loss: 1.0266, test_f1: 0.5179
 epoch: 97, train_loss: 0.8730, test_loss: 1.0337, test_f1: 0.5205
 epoch: 98, train_loss: 0.8735, test_loss: 1.0404, test_f1: 0.5108
 epoch: 99, train_loss: 0.8737, test_loss: 1.0439, test_f1: 0.5088

Training completed in 317.53 seconds
Best F1: 0.5721 at epoch 93
Mean F1 across iterations: 0.5372  0.0187
========================FINAL RESULTS================================
FEGIN weighted F1: 0.5721  0.0187
python main.py --data ltspice_demos --representation component_net --model FEGIN --layers 6 --hiddens 64 --batch_size 256 --lr 0.0001 --emb_size 512 --epochs 100 --save_appendix component_net_L6_H64_BS256_LR0.0001_E512 --no_val
-----



STDERR:
  File "main.py", line 370, in <module>
    main()
  File "main.py", line 254, in main
    dataset = dataset_class(
  File "/home/philip/projects/ltspice_examples_code_repo/Circuit-Completion-Using-GNNs/component_classification_with_link_prediction_head/evaluation/FEGIN/kernel/circuit_datasets.py", line 15, in __init__
    self.data, self.slices = torch.load(self.processed_paths[0])
  File "/home/philip/.local/lib/python3.8/site-packages/torch/serialization.py", line 1040, in load
    warnings.warn(
  File "/usr/lib/python3.8/warnings.py", line 109, in _showwarnmsg
    sw(msg.message, msg.category, msg.filename, msg.lineno,
  File "main.py", line 47, in warn_with_traceback
    traceback.print_stack(file=log)
/home/philip/projects/ltspice_examples_code_repo/Circuit-Completion-Using-GNNs/component_classification_with_link_prediction_head/evaluation/FEGIN/kernel/circuit_datasets.py:15: FutureWarning: You are using `torch.load` with `weights_only=False` (the current default value), which uses the default pickle module implicitly. It is possible to construct malicious pickle data which will execute arbitrary code during unpickling (See https://github.com/pytorch/pytorch/blob/main/SECURITY.md#untrusted-models for more details). In a future release, the default value for `weights_only` will be flipped to `True`. This limits the functions that could be executed during unpickling. Arbitrary objects will no longer be allowed to be loaded via this mode unless they are explicitly allowlisted by the user via `torch.serialization.add_safe_globals`. We recommend you start setting `weights_only=True` for any use case where you don't have full control of the loaded file. Please open an issue on GitHub for any issues related to this experimental feature.
  self.data, self.slices = torch.load(self.processed_paths[0])
