STDOUT:
Results will be saved in /home/philip/projects/ltspice_examples_code_repo/Circuit-Completion-Using-GNNs/component_classification_with_link_prediction_head/evaluation/FEGIN/results/model_FEGIN_dataset_ltspice_demos
Command line input: python main.py --data ltspice_demos --representation component_component --model FEGIN --layers 5 --hiddens 128 --batch_size 256 --lr 0.001 --emb_size 250 --epochs 100 --save_appendix component_component_L5_H128_BS256_LR0.001_E250 --no_val
 is saved.
-----
ltspice_demos - FEGIN
Using 5 layers, 128 hidden units, h = 2
Loading component_component representation dataset
ENTERED
Training FEGIN on component_component representation
Train: 1565, Test: 383
##################ITERATION #0 ****************************************
 epoch: 0, train_loss: 1.3417, test_loss: 1.3404, test_f1: 0.1432
 epoch: 1, train_loss: 1.2077, test_loss: 1.3069, test_f1: 0.3466
 epoch: 2, train_loss: 1.1665, test_loss: 1.3065, test_f1: 0.3569
 epoch: 3, train_loss: 1.1199, test_loss: 1.2625, test_f1: 0.3619
 epoch: 4, train_loss: 1.0784, test_loss: 1.2983, test_f1: 0.3643
 epoch: 5, train_loss: 1.0451, test_loss: 1.2848, test_f1: 0.3940
 epoch: 6, train_loss: 1.0230, test_loss: 1.2093, test_f1: 0.3933
 epoch: 7, train_loss: 0.9832, test_loss: 1.1671, test_f1: 0.4555
 epoch: 8, train_loss: 0.9648, test_loss: 1.1975, test_f1: 0.4331
 epoch: 9, train_loss: 0.9441, test_loss: 1.1887, test_f1: 0.4349
 epoch: 10, train_loss: 0.9229, test_loss: 1.1955, test_f1: 0.4608
 epoch: 11, train_loss: 0.9053, test_loss: 1.1842, test_f1: 0.4500
 epoch: 12, train_loss: 0.8674, test_loss: 1.2316, test_f1: 0.5652
 epoch: 13, train_loss: 0.8464, test_loss: 1.2655, test_f1: 0.4892
 epoch: 14, train_loss: 0.8711, test_loss: 1.2572, test_f1: 0.4982
 epoch: 15, train_loss: 0.8425, test_loss: 1.2591, test_f1: 0.5089
 epoch: 16, train_loss: 0.8033, test_loss: 1.2477, test_f1: 0.4817
 epoch: 17, train_loss: 0.7894, test_loss: 1.2437, test_f1: 0.5108
 epoch: 18, train_loss: 0.7708, test_loss: 1.1581, test_f1: 0.5543
 epoch: 19, train_loss: 0.7439, test_loss: 1.1898, test_f1: 0.5424
 epoch: 20, train_loss: 0.7448, test_loss: 1.2887, test_f1: 0.5305
 epoch: 21, train_loss: 0.7460, test_loss: 1.4376, test_f1: 0.5280
 epoch: 22, train_loss: 0.7603, test_loss: 1.3323, test_f1: 0.4962
 epoch: 23, train_loss: 0.7431, test_loss: 1.3058, test_f1: 0.4705
 epoch: 24, train_loss: 0.7442, test_loss: 1.2554, test_f1: 0.5014
 epoch: 25, train_loss: 0.7204, test_loss: 1.5143, test_f1: 0.5266
 epoch: 26, train_loss: 0.6718, test_loss: 1.6037, test_f1: 0.5300
 epoch: 27, train_loss: 0.6651, test_loss: 1.3805, test_f1: 0.5699
 epoch: 28, train_loss: 0.6278, test_loss: 1.5671, test_f1: 0.5141
 epoch: 29, train_loss: 0.6396, test_loss: 1.5834, test_f1: 0.5578
 epoch: 30, train_loss: 0.6436, test_loss: 1.5095, test_f1: 0.5522
 epoch: 31, train_loss: 0.6455, test_loss: 1.5213, test_f1: 0.5336
 epoch: 32, train_loss: 0.6478, test_loss: 1.5771, test_f1: 0.5436
 epoch: 33, train_loss: 0.6304, test_loss: 1.4080, test_f1: 0.5165
 epoch: 34, train_loss: 0.6339, test_loss: 1.3920, test_f1: 0.5415
 epoch: 35, train_loss: 0.6144, test_loss: 1.4376, test_f1: 0.5738
 epoch: 36, train_loss: 0.5575, test_loss: 1.4525, test_f1: 0.5891
 epoch: 37, train_loss: 0.5568, test_loss: 1.6757, test_f1: 0.5312
 epoch: 38, train_loss: 0.5794, test_loss: 1.9550, test_f1: 0.4727
 epoch: 39, train_loss: 0.5462, test_loss: 1.8562, test_f1: 0.5031
 epoch: 40, train_loss: 0.5637, test_loss: 1.3738, test_f1: 0.5502
 epoch: 41, train_loss: 0.5666, test_loss: 1.4334, test_f1: 0.5746
 epoch: 42, train_loss: 0.5363, test_loss: 1.4892, test_f1: 0.5584
 epoch: 43, train_loss: 0.5246, test_loss: 1.6099, test_f1: 0.5418
 epoch: 44, train_loss: 0.5396, test_loss: 1.6215, test_f1: 0.4977
 epoch: 45, train_loss: 0.5474, test_loss: 1.6711, test_f1: 0.5165
 epoch: 46, train_loss: 0.5689, test_loss: 1.6695, test_f1: 0.5653
 epoch: 47, train_loss: 0.5420, test_loss: 1.7612, test_f1: 0.5339
 epoch: 48, train_loss: 0.5227, test_loss: 1.7816, test_f1: 0.4720
 epoch: 49, train_loss: 0.4937, test_loss: 1.7406, test_f1: 0.5017
 epoch: 50, train_loss: 0.4580, test_loss: 1.5990, test_f1: 0.4957
 epoch: 51, train_loss: 0.4329, test_loss: 1.6194, test_f1: 0.5475
 epoch: 52, train_loss: 0.4102, test_loss: 1.5396, test_f1: 0.5708
 epoch: 53, train_loss: 0.4216, test_loss: 1.5328, test_f1: 0.5530
 epoch: 54, train_loss: 0.4297, test_loss: 1.7036, test_f1: 0.5332
 epoch: 55, train_loss: 0.4132, test_loss: 1.8294, test_f1: 0.5221
 epoch: 56, train_loss: 0.3837, test_loss: 1.7684, test_f1: 0.5474
 epoch: 57, train_loss: 0.3836, test_loss: 1.8366, test_f1: 0.5531
 epoch: 58, train_loss: 0.3679, test_loss: 1.9458, test_f1: 0.5518
 epoch: 59, train_loss: 0.3744, test_loss: 1.9239, test_f1: 0.5458
 epoch: 60, train_loss: 0.3499, test_loss: 2.0819, test_f1: 0.5176
 epoch: 61, train_loss: 0.3625, test_loss: 2.1329, test_f1: 0.4955
 epoch: 62, train_loss: 0.3456, test_loss: 2.1385, test_f1: 0.5112
 epoch: 63, train_loss: 0.3379, test_loss: 2.2188, test_f1: 0.5474
 epoch: 64, train_loss: 0.3519, test_loss: 2.1394, test_f1: 0.5346
 epoch: 65, train_loss: 0.3364, test_loss: 2.1907, test_f1: 0.5252
 epoch: 66, train_loss: 0.3401, test_loss: 2.1556, test_f1: 0.5194
 epoch: 67, train_loss: 0.3282, test_loss: 2.2632, test_f1: 0.5265
 epoch: 68, train_loss: 0.3343, test_loss: 2.2287, test_f1: 0.5391
 epoch: 69, train_loss: 0.3253, test_loss: 2.2224, test_f1: 0.5332
 epoch: 70, train_loss: 0.3168, test_loss: 2.2213, test_f1: 0.5517
 epoch: 71, train_loss: 0.3118, test_loss: 2.3857, test_f1: 0.5321
 epoch: 72, train_loss: 0.3120, test_loss: 2.6987, test_f1: 0.4804
 epoch: 73, train_loss: 0.2943, test_loss: 2.5935, test_f1: 0.4821
 epoch: 74, train_loss: 0.2988, test_loss: 2.3944, test_f1: 0.5247
 epoch: 75, train_loss: 0.3462, test_loss: 2.4210, test_f1: 0.5597
 epoch: 76, train_loss: 0.3650, test_loss: 2.4072, test_f1: 0.5244
 epoch: 77, train_loss: 0.3212, test_loss: 2.4477, test_f1: 0.5408
 epoch: 78, train_loss: 0.2939, test_loss: 2.4812, test_f1: 0.5227
 epoch: 79, train_loss: 0.3126, test_loss: 2.4896, test_f1: 0.5199
 epoch: 80, train_loss: 0.3534, test_loss: 2.4721, test_f1: 0.5142
 epoch: 81, train_loss: 0.3246, test_loss: 2.4304, test_f1: 0.5065
 epoch: 82, train_loss: 0.3528, test_loss: 2.5775, test_f1: 0.4794
 epoch: 83, train_loss: 0.3786, test_loss: 2.6517, test_f1: 0.4679
 epoch: 84, train_loss: 0.3565, test_loss: 2.4064, test_f1: 0.4890
 epoch: 85, train_loss: 0.3391, test_loss: 2.2872, test_f1: 0.5569
 epoch: 86, train_loss: 0.3345, test_loss: 2.3473, test_f1: 0.5288
 epoch: 87, train_loss: 0.3261, test_loss: 2.5749, test_f1: 0.4551
 epoch: 88, train_loss: 0.3520, test_loss: 2.4913, test_f1: 0.4634
 epoch: 89, train_loss: 0.3422, test_loss: 2.5599, test_f1: 0.4857
 epoch: 90, train_loss: 0.3818, test_loss: 2.6030, test_f1: 0.4979
 epoch: 91, train_loss: 0.3920, test_loss: 2.4071, test_f1: 0.4894
 epoch: 92, train_loss: 0.3879, test_loss: 2.4141, test_f1: 0.5139
 epoch: 93, train_loss: 0.3735, test_loss: 2.2599, test_f1: 0.5227
 epoch: 94, train_loss: 0.3488, test_loss: 2.1425, test_f1: 0.5350
 epoch: 95, train_loss: 0.3135, test_loss: 2.1591, test_f1: 0.5300
 epoch: 96, train_loss: 0.3201, test_loss: 2.0946, test_f1: 0.5193
 epoch: 97, train_loss: 0.2836, test_loss: 2.0066, test_f1: 0.5855
 epoch: 98, train_loss: 0.3144, test_loss: 1.9938, test_f1: 0.5592
 epoch: 99, train_loss: 0.3042, test_loss: 2.3018, test_f1: 0.5204
##################ITERATION #1 ****************************************
 epoch: 0, train_loss: 1.2510, test_loss: 1.3248, test_f1: 0.3198
 epoch: 1, train_loss: 1.1261, test_loss: 1.2896, test_f1: 0.3749
 epoch: 2, train_loss: 1.0704, test_loss: 1.2306, test_f1: 0.4458
 epoch: 3, train_loss: 1.0138, test_loss: 1.1954, test_f1: 0.4624
 epoch: 4, train_loss: 0.9605, test_loss: 1.1913, test_f1: 0.4775
 epoch: 5, train_loss: 0.9120, test_loss: 1.2073, test_f1: 0.4777
 epoch: 6, train_loss: 0.8837, test_loss: 1.2151, test_f1: 0.5084
 epoch: 7, train_loss: 0.8734, test_loss: 1.2649, test_f1: 0.5122
 epoch: 8, train_loss: 0.8392, test_loss: 1.1603, test_f1: 0.5559
 epoch: 9, train_loss: 0.7953, test_loss: 1.2030, test_f1: 0.5224
 epoch: 10, train_loss: 0.7950, test_loss: 1.3337, test_f1: 0.5020
 epoch: 11, train_loss: 0.8071, test_loss: 1.4594, test_f1: 0.5443
 epoch: 12, train_loss: 0.7935, test_loss: 1.5092, test_f1: 0.5340
 epoch: 13, train_loss: 0.7507, test_loss: 1.3742, test_f1: 0.5604
 epoch: 14, train_loss: 0.7157, test_loss: 1.6125, test_f1: 0.5485
 epoch: 15, train_loss: 0.7152, test_loss: 1.5083, test_f1: 0.5364
 epoch: 16, train_loss: 0.7011, test_loss: 1.3988, test_f1: 0.5534
 epoch: 17, train_loss: 0.6896, test_loss: 1.5419, test_f1: 0.5182
 epoch: 18, train_loss: 0.6637, test_loss: 1.8986, test_f1: 0.4802
 epoch: 19, train_loss: 0.6379, test_loss: 1.5465, test_f1: 0.5550
 epoch: 20, train_loss: 0.6834, test_loss: 1.4815, test_f1: 0.6097
 epoch: 21, train_loss: 0.6545, test_loss: 1.6345, test_f1: 0.5576
 epoch: 22, train_loss: 0.6260, test_loss: 1.6778, test_f1: 0.5548
 epoch: 23, train_loss: 0.5883, test_loss: 1.5553, test_f1: 0.5953
 epoch: 24, train_loss: 0.5824, test_loss: 1.5521, test_f1: 0.6182
 epoch: 25, train_loss: 0.5731, test_loss: 1.6783, test_f1: 0.5637
 epoch: 26, train_loss: 0.6249, test_loss: 2.3101, test_f1: 0.5067
 epoch: 27, train_loss: 0.6567, test_loss: 2.6207, test_f1: 0.4901
 epoch: 28, train_loss: 0.6610, test_loss: 2.0915, test_f1: 0.5149
 epoch: 29, train_loss: 0.6361, test_loss: 1.7077, test_f1: 0.5887
 epoch: 30, train_loss: 0.6180, test_loss: 1.7569, test_f1: 0.5868
 epoch: 31, train_loss: 0.5999, test_loss: 1.5759, test_f1: 0.5736
 epoch: 32, train_loss: 0.5979, test_loss: 1.6501, test_f1: 0.5377
 epoch: 33, train_loss: 0.6009, test_loss: 2.1318, test_f1: 0.4595
 epoch: 34, train_loss: 0.5869, test_loss: 1.9616, test_f1: 0.4854
 epoch: 35, train_loss: 0.5543, test_loss: 1.7962, test_f1: 0.5952
 epoch: 36, train_loss: 0.5425, test_loss: 2.1382, test_f1: 0.5612
 epoch: 37, train_loss: 0.5562, test_loss: 1.8820, test_f1: 0.6007
 epoch: 38, train_loss: 0.5166, test_loss: 1.9872, test_f1: 0.5303
 epoch: 39, train_loss: 0.5584, test_loss: 2.0121, test_f1: 0.5217
 epoch: 40, train_loss: 0.5413, test_loss: 2.0660, test_f1: 0.5284
 epoch: 41, train_loss: 0.5419, test_loss: 2.0341, test_f1: 0.5762
 epoch: 42, train_loss: 0.5322, test_loss: 1.7359, test_f1: 0.5943
 epoch: 43, train_loss: 0.5145, test_loss: 1.7099, test_f1: 0.5783
 epoch: 44, train_loss: 0.5352, test_loss: 1.7755, test_f1: 0.5406
 epoch: 45, train_loss: 0.5279, test_loss: 1.6615, test_f1: 0.5648
 epoch: 46, train_loss: 0.4742, test_loss: 1.8402, test_f1: 0.5694
 epoch: 47, train_loss: 0.4968, test_loss: 1.8788, test_f1: 0.5543
 epoch: 48, train_loss: 0.4655, test_loss: 2.0746, test_f1: 0.4928
 epoch: 49, train_loss: 0.4676, test_loss: 1.9968, test_f1: 0.5605
 epoch: 50, train_loss: 0.4496, test_loss: 1.8413, test_f1: 0.5567
 epoch: 51, train_loss: 0.4419, test_loss: 1.7818, test_f1: 0.5580
 epoch: 52, train_loss: 0.3947, test_loss: 1.7933, test_f1: 0.5605
 epoch: 53, train_loss: 0.3986, test_loss: 1.8714, test_f1: 0.5395
 epoch: 54, train_loss: 0.4151, test_loss: 1.8150, test_f1: 0.5578
 epoch: 55, train_loss: 0.3843, test_loss: 1.7686, test_f1: 0.5715
 epoch: 56, train_loss: 0.3679, test_loss: 1.8040, test_f1: 0.5646
 epoch: 57, train_loss: 0.3465, test_loss: 1.8593, test_f1: 0.5688
 epoch: 58, train_loss: 0.3547, test_loss: 1.7927, test_f1: 0.5838
 epoch: 59, train_loss: 0.3913, test_loss: 1.9791, test_f1: 0.5511
 epoch: 60, train_loss: 0.4175, test_loss: 1.8309, test_f1: 0.5590
 epoch: 61, train_loss: 0.4042, test_loss: 1.8896, test_f1: 0.5901
 epoch: 62, train_loss: 0.3943, test_loss: 1.8833, test_f1: 0.5142
 epoch: 63, train_loss: 0.4134, test_loss: 2.3494, test_f1: 0.5525
 epoch: 64, train_loss: 0.3752, test_loss: 2.0513, test_f1: 0.5803
 epoch: 65, train_loss: 0.3996, test_loss: 1.8683, test_f1: 0.5642
 epoch: 66, train_loss: 0.3796, test_loss: 2.0305, test_f1: 0.5422
 epoch: 67, train_loss: 0.3453, test_loss: 2.0706, test_f1: 0.5527
 epoch: 68, train_loss: 0.3696, test_loss: 1.8739, test_f1: 0.5701
 epoch: 69, train_loss: 0.3506, test_loss: 1.8858, test_f1: 0.5798
 epoch: 70, train_loss: 0.3854, test_loss: 1.9651, test_f1: 0.5638
 epoch: 71, train_loss: 0.3693, test_loss: 2.0388, test_f1: 0.5499
 epoch: 72, train_loss: 0.3578, test_loss: 2.0558, test_f1: 0.5590
 epoch: 73, train_loss: 0.3296, test_loss: 2.1037, test_f1: 0.5497
 epoch: 74, train_loss: 0.3262, test_loss: 2.0470, test_f1: 0.5668
 epoch: 75, train_loss: 0.3572, test_loss: 1.9246, test_f1: 0.5869
 epoch: 76, train_loss: 0.3779, test_loss: 1.8920, test_f1: 0.5652
 epoch: 77, train_loss: 0.3943, test_loss: 2.0388, test_f1: 0.5164
 epoch: 78, train_loss: 0.4116, test_loss: 2.0251, test_f1: 0.5250
 epoch: 79, train_loss: 0.3688, test_loss: 2.0543, test_f1: 0.5467
 epoch: 80, train_loss: 0.3309, test_loss: 2.2107, test_f1: 0.5444
 epoch: 81, train_loss: 0.3346, test_loss: 2.2932, test_f1: 0.5554
 epoch: 82, train_loss: 0.3088, test_loss: 2.4648, test_f1: 0.5308
 epoch: 83, train_loss: 0.2966, test_loss: 2.5333, test_f1: 0.5196
 epoch: 84, train_loss: 0.3087, test_loss: 3.0245, test_f1: 0.5026
 epoch: 85, train_loss: 0.3097, test_loss: 3.2636, test_f1: 0.5197
 epoch: 86, train_loss: 0.3135, test_loss: 3.3021, test_f1: 0.5157
 epoch: 87, train_loss: 0.3103, test_loss: 3.4612, test_f1: 0.5134
 epoch: 88, train_loss: 0.2924, test_loss: 3.1877, test_f1: 0.5083
 epoch: 89, train_loss: 0.2878, test_loss: 3.0617, test_f1: 0.5037
 epoch: 90, train_loss: 0.2798, test_loss: 2.8487, test_f1: 0.5160
 epoch: 91, train_loss: 0.2738, test_loss: 2.4078, test_f1: 0.5265
 epoch: 92, train_loss: 0.2991, test_loss: 2.2491, test_f1: 0.5614
 epoch: 93, train_loss: 0.2979, test_loss: 2.4587, test_f1: 0.5462
 epoch: 94, train_loss: 0.2909, test_loss: 2.5667, test_f1: 0.5181
 epoch: 95, train_loss: 0.2528, test_loss: 2.3007, test_f1: 0.5454
 epoch: 96, train_loss: 0.2583, test_loss: 2.7545, test_f1: 0.5197
 epoch: 97, train_loss: 0.2481, test_loss: 3.3486, test_f1: 0.5029
 epoch: 98, train_loss: 0.2633, test_loss: 3.4617, test_f1: 0.5308
 epoch: 99, train_loss: 0.2587, test_loss: 3.0484, test_f1: 0.5386
##################ITERATION #2 ****************************************
 epoch: 0, train_loss: 1.2506, test_loss: 1.3385, test_f1: 0.1420
 epoch: 1, train_loss: 1.1059, test_loss: 1.2836, test_f1: 0.3490
 epoch: 2, train_loss: 1.0481, test_loss: 1.2347, test_f1: 0.4433
 epoch: 3, train_loss: 1.0096, test_loss: 1.2173, test_f1: 0.4655
 epoch: 4, train_loss: 0.9909, test_loss: 1.2010, test_f1: 0.4906
 epoch: 5, train_loss: 0.9289, test_loss: 1.1872, test_f1: 0.4758
 epoch: 6, train_loss: 0.9134, test_loss: 1.2093, test_f1: 0.4835
 epoch: 7, train_loss: 0.8768, test_loss: 1.1431, test_f1: 0.5638
 epoch: 8, train_loss: 0.8578, test_loss: 1.2029, test_f1: 0.5182
 epoch: 9, train_loss: 0.8225, test_loss: 1.1906, test_f1: 0.5416
 epoch: 10, train_loss: 0.7865, test_loss: 1.4266, test_f1: 0.4416
 epoch: 11, train_loss: 0.7851, test_loss: 1.6121, test_f1: 0.5207
 epoch: 12, train_loss: 0.7497, test_loss: 1.4024, test_f1: 0.5666
 epoch: 13, train_loss: 0.7772, test_loss: 1.3949, test_f1: 0.5426
 epoch: 14, train_loss: 0.7993, test_loss: 1.3005, test_f1: 0.5281
 epoch: 15, train_loss: 0.7587, test_loss: 1.3936, test_f1: 0.5483
 epoch: 16, train_loss: 0.7539, test_loss: 1.6041, test_f1: 0.5270
 epoch: 17, train_loss: 0.7392, test_loss: 1.3465, test_f1: 0.5548
 epoch: 18, train_loss: 0.7515, test_loss: 1.4699, test_f1: 0.5208
 epoch: 19, train_loss: 0.7281, test_loss: 1.5432, test_f1: 0.4910
 epoch: 20, train_loss: 0.6909, test_loss: 1.3850, test_f1: 0.5431
 epoch: 21, train_loss: 0.6933, test_loss: 1.5701, test_f1: 0.5281
 epoch: 22, train_loss: 0.6884, test_loss: 1.4923, test_f1: 0.5261
 epoch: 23, train_loss: 0.6494, test_loss: 1.5230, test_f1: 0.4928
 epoch: 24, train_loss: 0.6525, test_loss: 1.5813, test_f1: 0.5503
 epoch: 25, train_loss: 0.6352, test_loss: 1.5638, test_f1: 0.5194
 epoch: 26, train_loss: 0.6244, test_loss: 1.5833, test_f1: 0.5751
 epoch: 27, train_loss: 0.6339, test_loss: 1.5151, test_f1: 0.5353
 epoch: 28, train_loss: 0.6259, test_loss: 1.5025, test_f1: 0.5572
 epoch: 29, train_loss: 0.6268, test_loss: 1.5558, test_f1: 0.5571
 epoch: 30, train_loss: 0.6244, test_loss: 1.4445, test_f1: 0.5677
 epoch: 31, train_loss: 0.6181, test_loss: 1.7570, test_f1: 0.4581
 epoch: 32, train_loss: 0.6326, test_loss: 1.8047, test_f1: 0.4894
 epoch: 33, train_loss: 0.6032, test_loss: 1.7172, test_f1: 0.5344
 epoch: 34, train_loss: 0.5978, test_loss: 1.7615, test_f1: 0.5258
 epoch: 35, train_loss: 0.5884, test_loss: 1.6462, test_f1: 0.5393
 epoch: 36, train_loss: 0.5889, test_loss: 1.7618, test_f1: 0.5382
 epoch: 37, train_loss: 0.5757, test_loss: 1.7952, test_f1: 0.5396
 epoch: 38, train_loss: 0.5446, test_loss: 1.8315, test_f1: 0.5280
 epoch: 39, train_loss: 0.5194, test_loss: 1.8916, test_f1: 0.5480
 epoch: 40, train_loss: 0.5190, test_loss: 1.9803, test_f1: 0.5788
 epoch: 41, train_loss: 0.5288, test_loss: 2.4760, test_f1: 0.5520
 epoch: 42, train_loss: 0.5977, test_loss: 2.1122, test_f1: 0.5577
 epoch: 43, train_loss: 0.5502, test_loss: 1.7032, test_f1: 0.5609
 epoch: 44, train_loss: 0.5725, test_loss: 1.9404, test_f1: 0.5435
 epoch: 45, train_loss: 0.5521, test_loss: 1.7729, test_f1: 0.5691
 epoch: 46, train_loss: 0.5124, test_loss: 1.9367, test_f1: 0.5764
 epoch: 47, train_loss: 0.5558, test_loss: 2.3615, test_f1: 0.5223
 epoch: 48, train_loss: 0.5105, test_loss: 2.0114, test_f1: 0.5840
 epoch: 49, train_loss: 0.5370, test_loss: 1.8864, test_f1: 0.5330
 epoch: 50, train_loss: 0.5467, test_loss: 1.9171, test_f1: 0.5829
 epoch: 51, train_loss: 0.4863, test_loss: 1.9122, test_f1: 0.5566
 epoch: 52, train_loss: 0.4602, test_loss: 1.9144, test_f1: 0.5339
 epoch: 53, train_loss: 0.4411, test_loss: 1.7809, test_f1: 0.5653
 epoch: 54, train_loss: 0.4253, test_loss: 1.8464, test_f1: 0.5454
 epoch: 55, train_loss: 0.4327, test_loss: 2.0969, test_f1: 0.5479
 epoch: 56, train_loss: 0.4329, test_loss: 2.2954, test_f1: 0.5520
 epoch: 57, train_loss: 0.4354, test_loss: 2.1122, test_f1: 0.5557
 epoch: 58, train_loss: 0.4584, test_loss: 2.0906, test_f1: 0.5369
 epoch: 59, train_loss: 0.4780, test_loss: 2.0574, test_f1: 0.5169
 epoch: 60, train_loss: 0.4684, test_loss: 2.7691, test_f1: 0.4950
 epoch: 61, train_loss: 0.4829, test_loss: 1.9183, test_f1: 0.5886
 epoch: 62, train_loss: 0.4540, test_loss: 1.7613, test_f1: 0.5883
 epoch: 63, train_loss: 0.4471, test_loss: 1.8683, test_f1: 0.5679
 epoch: 64, train_loss: 0.4377, test_loss: 1.7778, test_f1: 0.5741
 epoch: 65, train_loss: 0.4271, test_loss: 1.7591, test_f1: 0.5547
 epoch: 66, train_loss: 0.4289, test_loss: 1.7919, test_f1: 0.5814
 epoch: 67, train_loss: 0.3887, test_loss: 1.9124, test_f1: 0.5834
 epoch: 68, train_loss: 0.4103, test_loss: 2.0791, test_f1: 0.5511
 epoch: 69, train_loss: 0.3953, test_loss: 1.9770, test_f1: 0.5661
 epoch: 70, train_loss: 0.3814, test_loss: 1.8592, test_f1: 0.5700
 epoch: 71, train_loss: 0.3721, test_loss: 1.9920, test_f1: 0.5469
 epoch: 72, train_loss: 0.3666, test_loss: 2.0557, test_f1: 0.5719
 epoch: 73, train_loss: 0.3759, test_loss: 2.1487, test_f1: 0.5756
 epoch: 74, train_loss: 0.3606, test_loss: 2.1758, test_f1: 0.5436
 epoch: 75, train_loss: 0.3591, test_loss: 2.1106, test_f1: 0.5412
 epoch: 76, train_loss: 0.3743, test_loss: 2.2511, test_f1: 0.5371
 epoch: 77, train_loss: 0.3567, test_loss: 2.2356, test_f1: 0.5412
 epoch: 78, train_loss: 0.3508, test_loss: 2.2530, test_f1: 0.5695
 epoch: 79, train_loss: 0.3701, test_loss: 2.4872, test_f1: 0.5619
 epoch: 80, train_loss: 0.3617, test_loss: 2.4354, test_f1: 0.5371
 epoch: 81, train_loss: 0.3535, test_loss: 2.4924, test_f1: 0.5521
 epoch: 82, train_loss: 0.3467, test_loss: 2.4748, test_f1: 0.5677
 epoch: 83, train_loss: 0.3404, test_loss: 2.4522, test_f1: 0.5467
 epoch: 84, train_loss: 0.3399, test_loss: 2.4878, test_f1: 0.5673
 epoch: 85, train_loss: 0.3388, test_loss: 2.3761, test_f1: 0.5573
 epoch: 86, train_loss: 0.3442, test_loss: 2.4186, test_f1: 0.5520
 epoch: 87, train_loss: 0.3331, test_loss: 2.6800, test_f1: 0.5479
 epoch: 88, train_loss: 0.3384, test_loss: 2.4502, test_f1: 0.5528
 epoch: 89, train_loss: 0.3058, test_loss: 2.4041, test_f1: 0.5632
 epoch: 90, train_loss: 0.3130, test_loss: 2.3822, test_f1: 0.5405
 epoch: 91, train_loss: 0.3060, test_loss: 2.0306, test_f1: 0.5712
 epoch: 92, train_loss: 0.3311, test_loss: 2.1298, test_f1: 0.5612
 epoch: 93, train_loss: 0.3417, test_loss: 2.3350, test_f1: 0.5934
 epoch: 94, train_loss: 0.3410, test_loss: 2.2964, test_f1: 0.5783
 epoch: 95, train_loss: 0.3372, test_loss: 2.4551, test_f1: 0.5516
 epoch: 96, train_loss: 0.3263, test_loss: 2.4235, test_f1: 0.5640
 epoch: 97, train_loss: 0.3243, test_loss: 2.4837, test_f1: 0.5529
 epoch: 98, train_loss: 0.3022, test_loss: 2.4176, test_f1: 0.5460
 epoch: 99, train_loss: 0.3108, test_loss: 2.2428, test_f1: 0.5374
##################ITERATION #3 ****************************************
 epoch: 0, train_loss: 1.2250, test_loss: 1.3056, test_f1: 0.2143
 epoch: 1, train_loss: 1.0924, test_loss: 1.3040, test_f1: 0.1661
 epoch: 2, train_loss: 1.0363, test_loss: 1.2612, test_f1: 0.2770
 epoch: 3, train_loss: 0.9900, test_loss: 1.2084, test_f1: 0.4079
 epoch: 4, train_loss: 0.9429, test_loss: 1.2191, test_f1: 0.4375
 epoch: 5, train_loss: 0.9093, test_loss: 1.1947, test_f1: 0.5196
 epoch: 6, train_loss: 0.8886, test_loss: 1.2051, test_f1: 0.4860
 epoch: 7, train_loss: 0.8544, test_loss: 1.1728, test_f1: 0.4929
 epoch: 8, train_loss: 0.8552, test_loss: 1.1218, test_f1: 0.5847
 epoch: 9, train_loss: 0.8084, test_loss: 1.1078, test_f1: 0.5709
 epoch: 10, train_loss: 0.7722, test_loss: 1.1564, test_f1: 0.5748
 epoch: 11, train_loss: 0.7760, test_loss: 1.1972, test_f1: 0.5317
 epoch: 12, train_loss: 0.7824, test_loss: 1.2245, test_f1: 0.5410
 epoch: 13, train_loss: 0.7678, test_loss: 1.3063, test_f1: 0.5387
 epoch: 14, train_loss: 0.7848, test_loss: 1.3515, test_f1: 0.5124
 epoch: 15, train_loss: 0.7555, test_loss: 1.4132, test_f1: 0.5070
 epoch: 16, train_loss: 0.7592, test_loss: 1.5265, test_f1: 0.4910
 epoch: 17, train_loss: 0.7523, test_loss: 1.4359, test_f1: 0.5406
 epoch: 18, train_loss: 0.7178, test_loss: 1.3647, test_f1: 0.4901
 epoch: 19, train_loss: 0.7221, test_loss: 1.3592, test_f1: 0.5105
 epoch: 20, train_loss: 0.6865, test_loss: 1.3718, test_f1: 0.5453
 epoch: 21, train_loss: 0.6725, test_loss: 1.3430, test_f1: 0.5340
 epoch: 22, train_loss: 0.6481, test_loss: 1.5108, test_f1: 0.5429
 epoch: 23, train_loss: 0.6442, test_loss: 1.3030, test_f1: 0.6158
 epoch: 24, train_loss: 0.6134, test_loss: 1.3622, test_f1: 0.5740
 epoch: 25, train_loss: 0.6008, test_loss: 1.4566, test_f1: 0.5520
 epoch: 26, train_loss: 0.6070, test_loss: 1.3813, test_f1: 0.5677
 epoch: 27, train_loss: 0.5635, test_loss: 1.4323, test_f1: 0.5523
 epoch: 28, train_loss: 0.5883, test_loss: 1.4235, test_f1: 0.5340
 epoch: 29, train_loss: 0.5745, test_loss: 1.4322, test_f1: 0.5898
 epoch: 30, train_loss: 0.5580, test_loss: 1.5145, test_f1: 0.5725
 epoch: 31, train_loss: 0.5567, test_loss: 1.6224, test_f1: 0.5346
 epoch: 32, train_loss: 0.5476, test_loss: 1.5945, test_f1: 0.5476
 epoch: 33, train_loss: 0.5775, test_loss: 1.4527, test_f1: 0.5854
 epoch: 34, train_loss: 0.5821, test_loss: 1.5510, test_f1: 0.5391
 epoch: 35, train_loss: 0.5759, test_loss: 1.5989, test_f1: 0.5361
 epoch: 36, train_loss: 0.5497, test_loss: 1.5062, test_f1: 0.5472
 epoch: 37, train_loss: 0.5283, test_loss: 1.4864, test_f1: 0.5625
 epoch: 38, train_loss: 0.5557, test_loss: 1.5947, test_f1: 0.5669
 epoch: 39, train_loss: 0.5984, test_loss: 1.6658, test_f1: 0.5345
 epoch: 40, train_loss: 0.5865, test_loss: 1.5421, test_f1: 0.5747
 epoch: 41, train_loss: 0.5901, test_loss: 1.5171, test_f1: 0.5749
 epoch: 42, train_loss: 0.5639, test_loss: 1.5056, test_f1: 0.5605
 epoch: 43, train_loss: 0.5128, test_loss: 1.9185, test_f1: 0.4512
 epoch: 44, train_loss: 0.4894, test_loss: 1.6286, test_f1: 0.5161
 epoch: 45, train_loss: 0.5036, test_loss: 1.6065, test_f1: 0.5479
 epoch: 46, train_loss: 0.5364, test_loss: 1.6255, test_f1: 0.5670
 epoch: 47, train_loss: 0.5051, test_loss: 1.6697, test_f1: 0.5339
 epoch: 48, train_loss: 0.4705, test_loss: 1.6259, test_f1: 0.5596
 epoch: 49, train_loss: 0.4532, test_loss: 1.7328, test_f1: 0.5549
 epoch: 50, train_loss: 0.4533, test_loss: 1.8994, test_f1: 0.5157
 epoch: 51, train_loss: 0.4410, test_loss: 1.8746, test_f1: 0.5274
 epoch: 52, train_loss: 0.4008, test_loss: 1.8693, test_f1: 0.5372
 epoch: 53, train_loss: 0.4094, test_loss: 1.9795, test_f1: 0.4859
 epoch: 54, train_loss: 0.3683, test_loss: 1.8332, test_f1: 0.5241
 epoch: 55, train_loss: 0.3591, test_loss: 1.7787, test_f1: 0.5286
 epoch: 56, train_loss: 0.3669, test_loss: 1.9942, test_f1: 0.5428
 epoch: 57, train_loss: 0.3759, test_loss: 1.9829, test_f1: 0.5542
 epoch: 58, train_loss: 0.3787, test_loss: 2.0111, test_f1: 0.5568
 epoch: 59, train_loss: 0.4148, test_loss: 2.0218, test_f1: 0.5176
 epoch: 60, train_loss: 0.3798, test_loss: 2.1217, test_f1: 0.5276
 epoch: 61, train_loss: 0.3504, test_loss: 2.2347, test_f1: 0.5275
 epoch: 62, train_loss: 0.3470, test_loss: 2.0676, test_f1: 0.5474
 epoch: 63, train_loss: 0.3802, test_loss: 2.0970, test_f1: 0.5543
 epoch: 64, train_loss: 0.3774, test_loss: 2.2544, test_f1: 0.5341
 epoch: 65, train_loss: 0.3537, test_loss: 2.1663, test_f1: 0.5189
 epoch: 66, train_loss: 0.3577, test_loss: 1.9607, test_f1: 0.5517
 epoch: 67, train_loss: 0.3609, test_loss: 1.7825, test_f1: 0.5873
 epoch: 68, train_loss: 0.3612, test_loss: 1.8143, test_f1: 0.5643
 epoch: 69, train_loss: 0.3305, test_loss: 2.0071, test_f1: 0.5153
 epoch: 70, train_loss: 0.3199, test_loss: 2.0770, test_f1: 0.5045
 epoch: 71, train_loss: 0.3211, test_loss: 1.9476, test_f1: 0.5305
 epoch: 72, train_loss: 0.3346, test_loss: 1.8893, test_f1: 0.5264
 epoch: 73, train_loss: 0.3412, test_loss: 1.9884, test_f1: 0.5045
 epoch: 74, train_loss: 0.3247, test_loss: 2.0261, test_f1: 0.5495
 epoch: 75, train_loss: 0.3403, test_loss: 2.1340, test_f1: 0.5129
 epoch: 76, train_loss: 0.3398, test_loss: 2.4304, test_f1: 0.5078
 epoch: 77, train_loss: 0.3103, test_loss: 2.4454, test_f1: 0.5045
 epoch: 78, train_loss: 0.3187, test_loss: 2.4285, test_f1: 0.4834
 epoch: 79, train_loss: 0.3135, test_loss: 2.1127, test_f1: 0.5369
 epoch: 80, train_loss: 0.2988, test_loss: 2.1450, test_f1: 0.5419
 epoch: 81, train_loss: 0.2822, test_loss: 2.3900, test_f1: 0.5276
 epoch: 82, train_loss: 0.2946, test_loss: 2.4731, test_f1: 0.4635
 epoch: 83, train_loss: 0.2769, test_loss: 2.2923, test_f1: 0.5273
 epoch: 84, train_loss: 0.2805, test_loss: 2.3169, test_f1: 0.5231
 epoch: 85, train_loss: 0.2975, test_loss: 2.2889, test_f1: 0.5265
 epoch: 86, train_loss: 0.2963, test_loss: 2.1884, test_f1: 0.5395
 epoch: 87, train_loss: 0.3695, test_loss: 2.2203, test_f1: 0.5471
 epoch: 88, train_loss: 0.4335, test_loss: 2.5983, test_f1: 0.4978
 epoch: 89, train_loss: 0.3536, test_loss: 2.4417, test_f1: 0.5412
 epoch: 90, train_loss: 0.3537, test_loss: 2.1594, test_f1: 0.5302
 epoch: 91, train_loss: 0.3420, test_loss: 1.9963, test_f1: 0.5821
 epoch: 92, train_loss: 0.3322, test_loss: 2.0880, test_f1: 0.5573
 epoch: 93, train_loss: 0.3274, test_loss: 2.1423, test_f1: 0.5430
 epoch: 94, train_loss: 0.3184, test_loss: 2.2200, test_f1: 0.5818
 epoch: 95, train_loss: 0.3254, test_loss: 2.2847, test_f1: 0.5526
 epoch: 96, train_loss: 0.3081, test_loss: 2.1736, test_f1: 0.5599
 epoch: 97, train_loss: 0.2923, test_loss: 2.1544, test_f1: 0.5394
 epoch: 98, train_loss: 0.3008, test_loss: 2.2040, test_f1: 0.5470
 epoch: 99, train_loss: 0.3024, test_loss: 2.0792, test_f1: 0.5687
##################ITERATION #4 ****************************************
 epoch: 0, train_loss: 1.2788, test_loss: 1.3693, test_f1: 0.1365
 epoch: 1, train_loss: 1.1074, test_loss: 1.3042, test_f1: 0.1365
 epoch: 2, train_loss: 1.0332, test_loss: 1.2715, test_f1: 0.1948
 epoch: 3, train_loss: 1.0092, test_loss: 1.2570, test_f1: 0.3129
 epoch: 4, train_loss: 0.9671, test_loss: 1.1682, test_f1: 0.4825
 epoch: 5, train_loss: 0.9366, test_loss: 1.1894, test_f1: 0.5214
 epoch: 6, train_loss: 0.8970, test_loss: 1.2341, test_f1: 0.4665
 epoch: 7, train_loss: 0.8633, test_loss: 1.1447, test_f1: 0.5406
 epoch: 8, train_loss: 0.8691, test_loss: 1.2467, test_f1: 0.5087
 epoch: 9, train_loss: 0.8658, test_loss: 1.2047, test_f1: 0.5324
 epoch: 10, train_loss: 0.8543, test_loss: 1.1654, test_f1: 0.5014
 epoch: 11, train_loss: 0.8238, test_loss: 1.1139, test_f1: 0.5110
 epoch: 12, train_loss: 0.8086, test_loss: 1.1112, test_f1: 0.5831
 epoch: 13, train_loss: 0.7879, test_loss: 1.2176, test_f1: 0.5580
 epoch: 14, train_loss: 0.7654, test_loss: 1.3044, test_f1: 0.5213
 epoch: 15, train_loss: 0.7372, test_loss: 1.3000, test_f1: 0.5444
 epoch: 16, train_loss: 0.7280, test_loss: 1.4975, test_f1: 0.5089
 epoch: 17, train_loss: 0.7351, test_loss: 1.2226, test_f1: 0.5033
 epoch: 18, train_loss: 0.7278, test_loss: 1.2848, test_f1: 0.4846
 epoch: 19, train_loss: 0.7151, test_loss: 1.2571, test_f1: 0.5003
 epoch: 20, train_loss: 0.7290, test_loss: 1.2089, test_f1: 0.5600
 epoch: 21, train_loss: 0.7046, test_loss: 1.2198, test_f1: 0.5321
 epoch: 22, train_loss: 0.7157, test_loss: 1.4196, test_f1: 0.5984
 epoch: 23, train_loss: 0.7374, test_loss: 1.4209, test_f1: 0.5037
 epoch: 24, train_loss: 0.6958, test_loss: 1.3166, test_f1: 0.5637
 epoch: 25, train_loss: 0.6684, test_loss: 1.4895, test_f1: 0.4966
 epoch: 26, train_loss: 0.6704, test_loss: 1.7439, test_f1: 0.4606
 epoch: 27, train_loss: 0.6669, test_loss: 1.3838, test_f1: 0.5761
 epoch: 28, train_loss: 0.6553, test_loss: 1.3944, test_f1: 0.5802
 epoch: 29, train_loss: 0.6317, test_loss: 1.4018, test_f1: 0.5413
 epoch: 30, train_loss: 0.6391, test_loss: 1.6012, test_f1: 0.4907
 epoch: 31, train_loss: 0.6339, test_loss: 1.5736, test_f1: 0.5021
 epoch: 32, train_loss: 0.6207, test_loss: 1.7907, test_f1: 0.4750
 epoch: 33, train_loss: 0.6405, test_loss: 2.2395, test_f1: 0.4230
 epoch: 34, train_loss: 0.6059, test_loss: 1.4855, test_f1: 0.4900
 epoch: 35, train_loss: 0.5955, test_loss: 1.4406, test_f1: 0.5130
 epoch: 36, train_loss: 0.5728, test_loss: 1.4013, test_f1: 0.5314
 epoch: 37, train_loss: 0.5568, test_loss: 1.5096, test_f1: 0.5009
 epoch: 38, train_loss: 0.5661, test_loss: 1.4706, test_f1: 0.5440
 epoch: 39, train_loss: 0.5554, test_loss: 1.5652, test_f1: 0.5760
 epoch: 40, train_loss: 0.5937, test_loss: 1.4593, test_f1: 0.5732
 epoch: 41, train_loss: 0.5568, test_loss: 1.5215, test_f1: 0.5260
 epoch: 42, train_loss: 0.5840, test_loss: 1.4878, test_f1: 0.5640
 epoch: 43, train_loss: 0.5952, test_loss: 1.6272, test_f1: 0.5300
 epoch: 44, train_loss: 0.5700, test_loss: 1.8808, test_f1: 0.4954
 epoch: 45, train_loss: 0.5080, test_loss: 1.7996, test_f1: 0.4862
 epoch: 46, train_loss: 0.5269, test_loss: 1.7672, test_f1: 0.5633
 epoch: 47, train_loss: 0.5592, test_loss: 1.7921, test_f1: 0.5603
 epoch: 48, train_loss: 0.5538, test_loss: 1.7147, test_f1: 0.4720
 epoch: 49, train_loss: 0.5352, test_loss: 1.8248, test_f1: 0.4877
 epoch: 50, train_loss: 0.5260, test_loss: 1.6670, test_f1: 0.5507
 epoch: 51, train_loss: 0.5044, test_loss: 1.6127, test_f1: 0.5562
 epoch: 52, train_loss: 0.4952, test_loss: 1.6341, test_f1: 0.5487
 epoch: 53, train_loss: 0.4662, test_loss: 1.6727, test_f1: 0.4825
 epoch: 54, train_loss: 0.4460, test_loss: 1.7104, test_f1: 0.4706
 epoch: 55, train_loss: 0.4573, test_loss: 1.7195, test_f1: 0.4910
 epoch: 56, train_loss: 0.4303, test_loss: 1.7807, test_f1: 0.5002
 epoch: 57, train_loss: 0.4253, test_loss: 1.8080, test_f1: 0.5263
 epoch: 58, train_loss: 0.4187, test_loss: 1.8351, test_f1: 0.5316
 epoch: 59, train_loss: 0.4190, test_loss: 1.8038, test_f1: 0.5243
 epoch: 60, train_loss: 0.4038, test_loss: 1.8795, test_f1: 0.5430
 epoch: 61, train_loss: 0.3928, test_loss: 1.8250, test_f1: 0.5433
 epoch: 62, train_loss: 0.4025, test_loss: 1.9271, test_f1: 0.5342
 epoch: 63, train_loss: 0.3932, test_loss: 2.1008, test_f1: 0.5133
 epoch: 64, train_loss: 0.3934, test_loss: 2.1079, test_f1: 0.5183
 epoch: 65, train_loss: 0.3729, test_loss: 1.9567, test_f1: 0.4772
 epoch: 66, train_loss: 0.3955, test_loss: 1.8651, test_f1: 0.5458
 epoch: 67, train_loss: 0.3817, test_loss: 2.0163, test_f1: 0.5484
 epoch: 68, train_loss: 0.4088, test_loss: 2.0624, test_f1: 0.5362
 epoch: 69, train_loss: 0.3850, test_loss: 2.0082, test_f1: 0.5498
 epoch: 70, train_loss: 0.3777, test_loss: 2.0210, test_f1: 0.5328
 epoch: 71, train_loss: 0.3784, test_loss: 2.6026, test_f1: 0.4668
 epoch: 72, train_loss: 0.3711, test_loss: 2.2964, test_f1: 0.4775
 epoch: 73, train_loss: 0.3652, test_loss: 2.3634, test_f1: 0.4985
 epoch: 74, train_loss: 0.3525, test_loss: 2.2289, test_f1: 0.5422
 epoch: 75, train_loss: 0.3625, test_loss: 2.0172, test_f1: 0.5332
 epoch: 76, train_loss: 0.3665, test_loss: 2.1048, test_f1: 0.5358
 epoch: 77, train_loss: 0.3442, test_loss: 2.1517, test_f1: 0.5318
 epoch: 78, train_loss: 0.3404, test_loss: 2.2844, test_f1: 0.5503
 epoch: 79, train_loss: 0.3397, test_loss: 2.1060, test_f1: 0.5809
 epoch: 80, train_loss: 0.3517, test_loss: 1.8903, test_f1: 0.5552
 epoch: 81, train_loss: 0.3474, test_loss: 2.1383, test_f1: 0.5146
 epoch: 82, train_loss: 0.3566, test_loss: 2.2413, test_f1: 0.5361
 epoch: 83, train_loss: 0.3659, test_loss: 2.1007, test_f1: 0.5301
 epoch: 84, train_loss: 0.3403, test_loss: 2.1435, test_f1: 0.5417
 epoch: 85, train_loss: 0.3531, test_loss: 2.2797, test_f1: 0.5287
 epoch: 86, train_loss: 0.3489, test_loss: 1.9567, test_f1: 0.5651
 epoch: 87, train_loss: 0.3335, test_loss: 1.9510, test_f1: 0.5652
 epoch: 88, train_loss: 0.3285, test_loss: 2.1372, test_f1: 0.5130
 epoch: 89, train_loss: 0.3353, test_loss: 1.9948, test_f1: 0.5507
 epoch: 90, train_loss: 0.3182, test_loss: 1.9699, test_f1: 0.5488
 epoch: 91, train_loss: 0.3447, test_loss: 1.9068, test_f1: 0.5679
 epoch: 92, train_loss: 0.3454, test_loss: 2.0554, test_f1: 0.5428
 epoch: 93, train_loss: 0.3398, test_loss: 2.2273, test_f1: 0.4901
 epoch: 94, train_loss: 0.3345, test_loss: 2.2823, test_f1: 0.5474
 epoch: 95, train_loss: 0.3299, test_loss: 2.3142, test_f1: 0.5266
 epoch: 96, train_loss: 0.3207, test_loss: 2.3408, test_f1: 0.5313
 epoch: 97, train_loss: 0.3556, test_loss: 2.1681, test_f1: 0.5535
 epoch: 98, train_loss: 0.3423, test_loss: 2.1479, test_f1: 0.5285
 epoch: 99, train_loss: 0.3563, test_loss: 2.1168, test_f1: 0.5102
##################ITERATION #5 ****************************************
 epoch: 0, train_loss: 1.2726, test_loss: 1.3881, test_f1: 0.1365
 epoch: 1, train_loss: 1.1120, test_loss: 1.3214, test_f1: 0.1809
 epoch: 2, train_loss: 1.0536, test_loss: 1.2579, test_f1: 0.3962
 epoch: 3, train_loss: 1.0125, test_loss: 1.2571, test_f1: 0.4332
 epoch: 4, train_loss: 0.9716, test_loss: 1.2478, test_f1: 0.4276
 epoch: 5, train_loss: 0.9428, test_loss: 1.2792, test_f1: 0.4035
 epoch: 6, train_loss: 0.9319, test_loss: 1.3665, test_f1: 0.4271
 epoch: 7, train_loss: 0.8942, test_loss: 1.2928, test_f1: 0.4929
 epoch: 8, train_loss: 0.8813, test_loss: 1.2546, test_f1: 0.4819
 epoch: 9, train_loss: 0.8575, test_loss: 1.3358, test_f1: 0.4758
 epoch: 10, train_loss: 0.8259, test_loss: 1.2654, test_f1: 0.5343
 epoch: 11, train_loss: 0.8037, test_loss: 1.2856, test_f1: 0.5247
 epoch: 12, train_loss: 0.7730, test_loss: 1.3081, test_f1: 0.5260
 epoch: 13, train_loss: 0.7819, test_loss: 1.3226, test_f1: 0.5296
 epoch: 14, train_loss: 0.7781, test_loss: 1.4486, test_f1: 0.4966
 epoch: 15, train_loss: 0.7708, test_loss: 1.3460, test_f1: 0.5281
 epoch: 16, train_loss: 0.7618, test_loss: 1.3628, test_f1: 0.5175
 epoch: 17, train_loss: 0.7579, test_loss: 1.3290, test_f1: 0.5363
 epoch: 18, train_loss: 0.7579, test_loss: 1.2714, test_f1: 0.5619
 epoch: 19, train_loss: 0.7604, test_loss: 1.2861, test_f1: 0.5684
 epoch: 20, train_loss: 0.7376, test_loss: 1.3084, test_f1: 0.5663
 epoch: 21, train_loss: 0.7347, test_loss: 1.3474, test_f1: 0.5504
 epoch: 22, train_loss: 0.6795, test_loss: 1.3888, test_f1: 0.5442
 epoch: 23, train_loss: 0.6817, test_loss: 1.4908, test_f1: 0.5347
 epoch: 24, train_loss: 0.6750, test_loss: 1.3631, test_f1: 0.5733
 epoch: 25, train_loss: 0.6723, test_loss: 1.4490, test_f1: 0.5400
 epoch: 26, train_loss: 0.6677, test_loss: 1.3867, test_f1: 0.5722
 epoch: 27, train_loss: 0.6292, test_loss: 1.3529, test_f1: 0.5894
 epoch: 28, train_loss: 0.6205, test_loss: 1.4559, test_f1: 0.6029
 epoch: 29, train_loss: 0.6102, test_loss: 1.5446, test_f1: 0.5763
 epoch: 30, train_loss: 0.5897, test_loss: 1.7179, test_f1: 0.5374
 epoch: 31, train_loss: 0.6014, test_loss: 1.6479, test_f1: 0.5311
 epoch: 32, train_loss: 0.6409, test_loss: 1.4874, test_f1: 0.5428
 epoch: 33, train_loss: 0.6673, test_loss: 1.5988, test_f1: 0.5572
 epoch: 34, train_loss: 0.6855, test_loss: 2.0813, test_f1: 0.5029
 epoch: 35, train_loss: 0.6390, test_loss: 1.6137, test_f1: 0.5851
 epoch: 36, train_loss: 0.6133, test_loss: 1.4162, test_f1: 0.5640
 epoch: 37, train_loss: 0.5840, test_loss: 1.4792, test_f1: 0.5687
 epoch: 38, train_loss: 0.5821, test_loss: 1.5465, test_f1: 0.5113
 epoch: 39, train_loss: 0.5869, test_loss: 1.5668, test_f1: 0.5710
 epoch: 40, train_loss: 0.5836, test_loss: 1.7402, test_f1: 0.5248
 epoch: 41, train_loss: 0.6157, test_loss: 1.7067, test_f1: 0.5427
 epoch: 42, train_loss: 0.5694, test_loss: 1.6274, test_f1: 0.5621
 epoch: 43, train_loss: 0.5494, test_loss: 1.7548, test_f1: 0.5202
 epoch: 44, train_loss: 0.5298, test_loss: 1.7043, test_f1: 0.5034
 epoch: 45, train_loss: 0.5121, test_loss: 1.6180, test_f1: 0.5508
 epoch: 46, train_loss: 0.5151, test_loss: 1.8425, test_f1: 0.5365
 epoch: 47, train_loss: 0.5176, test_loss: 1.6287, test_f1: 0.5593
 epoch: 48, train_loss: 0.5164, test_loss: 1.5269, test_f1: 0.5627
 epoch: 49, train_loss: 0.5229, test_loss: 1.6137, test_f1: 0.5376
 epoch: 50, train_loss: 0.5348, test_loss: 1.7625, test_f1: 0.5766
 epoch: 51, train_loss: 0.5167, test_loss: 1.7098, test_f1: 0.5393
 epoch: 52, train_loss: 0.4912, test_loss: 1.6719, test_f1: 0.5613
 epoch: 53, train_loss: 0.4754, test_loss: 1.8250, test_f1: 0.5257
 epoch: 54, train_loss: 0.4839, test_loss: 1.8017, test_f1: 0.5343
 epoch: 55, train_loss: 0.4442, test_loss: 1.8694, test_f1: 0.5617
 epoch: 56, train_loss: 0.4606, test_loss: 1.8043, test_f1: 0.5434
 epoch: 57, train_loss: 0.4163, test_loss: 1.8684, test_f1: 0.5484
 epoch: 58, train_loss: 0.4112, test_loss: 1.7364, test_f1: 0.5734
 epoch: 59, train_loss: 0.4182, test_loss: 1.7789, test_f1: 0.5493
 epoch: 60, train_loss: 0.4339, test_loss: 1.8020, test_f1: 0.5456
 epoch: 61, train_loss: 0.4250, test_loss: 1.7709, test_f1: 0.5743
 epoch: 62, train_loss: 0.4025, test_loss: 1.8302, test_f1: 0.5476
 epoch: 63, train_loss: 0.3890, test_loss: 2.1396, test_f1: 0.5632
 epoch: 64, train_loss: 0.3903, test_loss: 2.0362, test_f1: 0.5633
 epoch: 65, train_loss: 0.3818, test_loss: 1.9225, test_f1: 0.5854
 epoch: 66, train_loss: 0.3773, test_loss: 2.0822, test_f1: 0.5484
 epoch: 67, train_loss: 0.3966, test_loss: 1.8763, test_f1: 0.5673
 epoch: 68, train_loss: 0.4151, test_loss: 2.0392, test_f1: 0.5444
 epoch: 69, train_loss: 0.3819, test_loss: 1.9182, test_f1: 0.5710
 epoch: 70, train_loss: 0.3667, test_loss: 1.8357, test_f1: 0.5739
 epoch: 71, train_loss: 0.3514, test_loss: 1.9612, test_f1: 0.5866
 epoch: 72, train_loss: 0.3602, test_loss: 1.9744, test_f1: 0.5971
 epoch: 73, train_loss: 0.3701, test_loss: 2.1893, test_f1: 0.5756
 epoch: 74, train_loss: 0.3833, test_loss: 2.2648, test_f1: 0.5105
 epoch: 75, train_loss: 0.3753, test_loss: 2.3112, test_f1: 0.5351
 epoch: 76, train_loss: 0.3585, test_loss: 2.3833, test_f1: 0.5668
 epoch: 77, train_loss: 0.3664, test_loss: 2.2827, test_f1: 0.5702
 epoch: 78, train_loss: 0.3546, test_loss: 2.1132, test_f1: 0.5809
 epoch: 79, train_loss: 0.3525, test_loss: 2.1362, test_f1: 0.5565
 epoch: 80, train_loss: 0.3525, test_loss: 2.3258, test_f1: 0.5607
 epoch: 81, train_loss: 0.3590, test_loss: 2.5716, test_f1: 0.5441
 epoch: 82, train_loss: 0.3695, test_loss: 2.4552, test_f1: 0.5356
 epoch: 83, train_loss: 0.3622, test_loss: 2.8167, test_f1: 0.5100
 epoch: 84, train_loss: 0.3639, test_loss: 2.3125, test_f1: 0.5267
 epoch: 85, train_loss: 0.3382, test_loss: 2.1827, test_f1: 0.5740
 epoch: 86, train_loss: 0.3474, test_loss: 2.3517, test_f1: 0.5543
 epoch: 87, train_loss: 0.3456, test_loss: 2.8178, test_f1: 0.5453
 epoch: 88, train_loss: 0.3125, test_loss: 2.8071, test_f1: 0.5520
 epoch: 89, train_loss: 0.3380, test_loss: 2.2351, test_f1: 0.5633
 epoch: 90, train_loss: 0.3445, test_loss: 2.1236, test_f1: 0.5833
 epoch: 91, train_loss: 0.3432, test_loss: 2.3354, test_f1: 0.5860
 epoch: 92, train_loss: 0.3636, test_loss: 2.3940, test_f1: 0.5697
 epoch: 93, train_loss: 0.3430, test_loss: 2.3615, test_f1: 0.5795
 epoch: 94, train_loss: 0.3204, test_loss: 2.2717, test_f1: 0.5919
 epoch: 95, train_loss: 0.3570, test_loss: 2.1329, test_f1: 0.5953
 epoch: 96, train_loss: 0.3337, test_loss: 2.0558, test_f1: 0.5922
 epoch: 97, train_loss: 0.3616, test_loss: 1.9283, test_f1: 0.6032
 epoch: 98, train_loss: 0.3267, test_loss: 1.8808, test_f1: 0.6001
 epoch: 99, train_loss: 0.3300, test_loss: 2.0933, test_f1: 0.5795
##################ITERATION #6 ****************************************
 epoch: 0, train_loss: 1.2521, test_loss: 1.3315, test_f1: 0.1551
 epoch: 1, train_loss: 1.1232, test_loss: 1.3348, test_f1: 0.3919
 epoch: 2, train_loss: 1.0688, test_loss: 1.3141, test_f1: 0.3853
 epoch: 3, train_loss: 1.0287, test_loss: 1.2406, test_f1: 0.4236
 epoch: 4, train_loss: 0.9682, test_loss: 1.2151, test_f1: 0.5098
 epoch: 5, train_loss: 0.9625, test_loss: 1.2209, test_f1: 0.5265
 epoch: 6, train_loss: 0.9038, test_loss: 1.2520, test_f1: 0.5316
 epoch: 7, train_loss: 0.8950, test_loss: 1.2273, test_f1: 0.5672
 epoch: 8, train_loss: 0.8554, test_loss: 1.2559, test_f1: 0.5593
 epoch: 9, train_loss: 0.8687, test_loss: 1.2192, test_f1: 0.5066
 epoch: 10, train_loss: 0.8658, test_loss: 1.2231, test_f1: 0.5148
 epoch: 11, train_loss: 0.8335, test_loss: 1.3077, test_f1: 0.5180
 epoch: 12, train_loss: 0.7933, test_loss: 1.2740, test_f1: 0.5094
 epoch: 13, train_loss: 0.7950, test_loss: 1.3932, test_f1: 0.4916
 epoch: 14, train_loss: 0.7593, test_loss: 1.2991, test_f1: 0.4916
 epoch: 15, train_loss: 0.7505, test_loss: 1.2895, test_f1: 0.5531
 epoch: 16, train_loss: 0.7619, test_loss: 1.3767, test_f1: 0.5332
 epoch: 17, train_loss: 0.7774, test_loss: 1.6876, test_f1: 0.5268
 epoch: 18, train_loss: 0.7744, test_loss: 1.7150, test_f1: 0.4993
 epoch: 19, train_loss: 0.7196, test_loss: 1.4641, test_f1: 0.5006
 epoch: 20, train_loss: 0.7029, test_loss: 1.4419, test_f1: 0.5381
 epoch: 21, train_loss: 0.7120, test_loss: 1.6556, test_f1: 0.5194
 epoch: 22, train_loss: 0.7242, test_loss: 1.5867, test_f1: 0.4863
 epoch: 23, train_loss: 0.7179, test_loss: 1.5804, test_f1: 0.4763
 epoch: 24, train_loss: 0.7075, test_loss: 1.4071, test_f1: 0.5268
 epoch: 25, train_loss: 0.6950, test_loss: 1.3655, test_f1: 0.5974
 epoch: 26, train_loss: 0.6687, test_loss: 1.6783, test_f1: 0.5067
 epoch: 27, train_loss: 0.6629, test_loss: 1.5412, test_f1: 0.5792
 epoch: 28, train_loss: 0.6444, test_loss: 2.0076, test_f1: 0.5623
 epoch: 29, train_loss: 0.6467, test_loss: 1.8328, test_f1: 0.5359
 epoch: 30, train_loss: 0.6333, test_loss: 1.7101, test_f1: 0.5776
 epoch: 31, train_loss: 0.6311, test_loss: 2.4135, test_f1: 0.5281
 epoch: 32, train_loss: 0.6115, test_loss: 2.1182, test_f1: 0.5448
 epoch: 33, train_loss: 0.6516, test_loss: 1.9913, test_f1: 0.4864
 epoch: 34, train_loss: 0.6496, test_loss: 1.9501, test_f1: 0.5308
 epoch: 35, train_loss: 0.6641, test_loss: 1.7721, test_f1: 0.5328
 epoch: 36, train_loss: 0.6242, test_loss: 1.6023, test_f1: 0.5728
 epoch: 37, train_loss: 0.6519, test_loss: 1.5436, test_f1: 0.5304
 epoch: 38, train_loss: 0.6605, test_loss: 1.4999, test_f1: 0.5385
 epoch: 39, train_loss: 0.6082, test_loss: 1.5409, test_f1: 0.5186
 epoch: 40, train_loss: 0.6001, test_loss: 1.7167, test_f1: 0.5084
 epoch: 41, train_loss: 0.6147, test_loss: 1.5666, test_f1: 0.5847
 epoch: 42, train_loss: 0.6052, test_loss: 1.5507, test_f1: 0.5767
 epoch: 43, train_loss: 0.5859, test_loss: 1.4773, test_f1: 0.5629
 epoch: 44, train_loss: 0.5687, test_loss: 1.5103, test_f1: 0.5725
 epoch: 45, train_loss: 0.5789, test_loss: 2.2670, test_f1: 0.4392
 epoch: 46, train_loss: 0.6203, test_loss: 1.5849, test_f1: 0.5245
 epoch: 47, train_loss: 0.5826, test_loss: 1.7551, test_f1: 0.5507
 epoch: 48, train_loss: 0.5750, test_loss: 1.6761, test_f1: 0.5748
 epoch: 49, train_loss: 0.5437, test_loss: 1.6568, test_f1: 0.5963
 epoch: 50, train_loss: 0.5263, test_loss: 1.6416, test_f1: 0.5538
 epoch: 51, train_loss: 0.5094, test_loss: 1.8835, test_f1: 0.5570
 epoch: 52, train_loss: 0.4939, test_loss: 1.8625, test_f1: 0.5316
 epoch: 53, train_loss: 0.4660, test_loss: 1.7851, test_f1: 0.5270
 epoch: 54, train_loss: 0.4463, test_loss: 1.9422, test_f1: 0.5333
 epoch: 55, train_loss: 0.4543, test_loss: 1.9741, test_f1: 0.5540
 epoch: 56, train_loss: 0.4192, test_loss: 1.9160, test_f1: 0.5499
 epoch: 57, train_loss: 0.4489, test_loss: 1.8929, test_f1: 0.5217
 epoch: 58, train_loss: 0.4517, test_loss: 2.0314, test_f1: 0.5326
 epoch: 59, train_loss: 0.4335, test_loss: 2.0489, test_f1: 0.5590
 epoch: 60, train_loss: 0.4378, test_loss: 1.9452, test_f1: 0.5447
 epoch: 61, train_loss: 0.4170, test_loss: 1.9905, test_f1: 0.5566
 epoch: 62, train_loss: 0.4180, test_loss: 2.0232, test_f1: 0.5484
 epoch: 63, train_loss: 0.4189, test_loss: 2.0138, test_f1: 0.5508
 epoch: 64, train_loss: 0.3984, test_loss: 1.9396, test_f1: 0.5280
 epoch: 65, train_loss: 0.3820, test_loss: 1.9378, test_f1: 0.5510
 epoch: 66, train_loss: 0.3936, test_loss: 1.9765, test_f1: 0.5786
 epoch: 67, train_loss: 0.4102, test_loss: 2.3089, test_f1: 0.5167
 epoch: 68, train_loss: 0.4150, test_loss: 2.2502, test_f1: 0.5312
 epoch: 69, train_loss: 0.4001, test_loss: 2.1053, test_f1: 0.5361
 epoch: 70, train_loss: 0.3703, test_loss: 1.9945, test_f1: 0.5514
 epoch: 71, train_loss: 0.3642, test_loss: 2.0073, test_f1: 0.5552
 epoch: 72, train_loss: 0.3654, test_loss: 1.9716, test_f1: 0.5519
 epoch: 73, train_loss: 0.3873, test_loss: 2.0177, test_f1: 0.5472
 epoch: 74, train_loss: 0.3461, test_loss: 2.1183, test_f1: 0.5282
 epoch: 75, train_loss: 0.3405, test_loss: 2.2868, test_f1: 0.5340
 epoch: 76, train_loss: 0.3525, test_loss: 2.3300, test_f1: 0.5237
 epoch: 77, train_loss: 0.3522, test_loss: 2.2455, test_f1: 0.5468
 epoch: 78, train_loss: 0.3311, test_loss: 2.1632, test_f1: 0.5485
 epoch: 79, train_loss: 0.3398, test_loss: 2.1862, test_f1: 0.5475
 epoch: 80, train_loss: 0.3294, test_loss: 2.2294, test_f1: 0.5354
 epoch: 81, train_loss: 0.3248, test_loss: 2.3521, test_f1: 0.5318
 epoch: 82, train_loss: 0.3061, test_loss: 2.2609, test_f1: 0.5581
 epoch: 83, train_loss: 0.3363, test_loss: 2.6999, test_f1: 0.5243
 epoch: 84, train_loss: 0.3611, test_loss: 2.7834, test_f1: 0.5198
 epoch: 85, train_loss: 0.3326, test_loss: 2.3641, test_f1: 0.5452
 epoch: 86, train_loss: 0.3520, test_loss: 2.4846, test_f1: 0.5043
 epoch: 87, train_loss: 0.3388, test_loss: 2.3349, test_f1: 0.5255
 epoch: 88, train_loss: 0.3476, test_loss: 2.3768, test_f1: 0.4894
 epoch: 89, train_loss: 0.3545, test_loss: 2.5505, test_f1: 0.5026
 epoch: 90, train_loss: 0.3292, test_loss: 2.7974, test_f1: 0.5127
 epoch: 91, train_loss: 0.3344, test_loss: 2.7825, test_f1: 0.5031
 epoch: 92, train_loss: 0.3556, test_loss: 2.4365, test_f1: 0.5463
 epoch: 93, train_loss: 0.3571, test_loss: 2.5601, test_f1: 0.5300
 epoch: 94, train_loss: 0.3811, test_loss: 2.6400, test_f1: 0.5070
 epoch: 95, train_loss: 0.3408, test_loss: 2.5073, test_f1: 0.5320
 epoch: 96, train_loss: 0.3358, test_loss: 2.5048, test_f1: 0.5375
 epoch: 97, train_loss: 0.3166, test_loss: 2.5990, test_f1: 0.5083
 epoch: 98, train_loss: 0.3202, test_loss: 2.3278, test_f1: 0.5309
 epoch: 99, train_loss: 0.3722, test_loss: 2.3004, test_f1: 0.4859
##################ITERATION #7 ****************************************
 epoch: 0, train_loss: 1.2978, test_loss: 1.4030, test_f1: 0.1365
 epoch: 1, train_loss: 1.1164, test_loss: 1.2634, test_f1: 0.2838
 epoch: 2, train_loss: 1.0522, test_loss: 1.2873, test_f1: 0.3075
 epoch: 3, train_loss: 1.0116, test_loss: 1.2826, test_f1: 0.3046
 epoch: 4, train_loss: 0.9582, test_loss: 1.3109, test_f1: 0.3520
 epoch: 5, train_loss: 0.9262, test_loss: 1.2699, test_f1: 0.3690
 epoch: 6, train_loss: 0.8958, test_loss: 1.2029, test_f1: 0.3961
 epoch: 7, train_loss: 0.8470, test_loss: 1.1728, test_f1: 0.4680
 epoch: 8, train_loss: 0.8437, test_loss: 1.2047, test_f1: 0.4147
 epoch: 9, train_loss: 0.8135, test_loss: 1.1196, test_f1: 0.5423
 epoch: 10, train_loss: 0.8056, test_loss: 1.2230, test_f1: 0.5024
 epoch: 11, train_loss: 0.8069, test_loss: 1.3643, test_f1: 0.4573
 epoch: 12, train_loss: 0.7956, test_loss: 1.2402, test_f1: 0.5450
 epoch: 13, train_loss: 0.7547, test_loss: 1.1138, test_f1: 0.5976
 epoch: 14, train_loss: 0.7323, test_loss: 1.1806, test_f1: 0.5615
 epoch: 15, train_loss: 0.7184, test_loss: 1.1770, test_f1: 0.5965
 epoch: 16, train_loss: 0.6924, test_loss: 1.3163, test_f1: 0.5921
 epoch: 17, train_loss: 0.7021, test_loss: 1.3718, test_f1: 0.5574
 epoch: 18, train_loss: 0.6737, test_loss: 1.3329, test_f1: 0.5859
 epoch: 19, train_loss: 0.6600, test_loss: 1.3676, test_f1: 0.5567
 epoch: 20, train_loss: 0.6796, test_loss: 1.5511, test_f1: 0.5077
 epoch: 21, train_loss: 0.6678, test_loss: 1.5134, test_f1: 0.5631
 epoch: 22, train_loss: 0.6566, test_loss: 1.4072, test_f1: 0.5869
 epoch: 23, train_loss: 0.6964, test_loss: 1.4544, test_f1: 0.5651
 epoch: 24, train_loss: 0.6718, test_loss: 1.4458, test_f1: 0.5833
 epoch: 25, train_loss: 0.6544, test_loss: 1.5085, test_f1: 0.5722
 epoch: 26, train_loss: 0.6359, test_loss: 1.4217, test_f1: 0.5862
 epoch: 27, train_loss: 0.6067, test_loss: 1.4735, test_f1: 0.5921
 epoch: 28, train_loss: 0.5947, test_loss: 1.4766, test_f1: 0.5277
 epoch: 29, train_loss: 0.5900, test_loss: 1.3954, test_f1: 0.5989
 epoch: 30, train_loss: 0.5669, test_loss: 1.4604, test_f1: 0.5758
 epoch: 31, train_loss: 0.6175, test_loss: 1.7591, test_f1: 0.5442
 epoch: 32, train_loss: 0.6323, test_loss: 1.7704, test_f1: 0.5212
 epoch: 33, train_loss: 0.6230, test_loss: 1.4819, test_f1: 0.5591
 epoch: 34, train_loss: 0.5851, test_loss: 1.4703, test_f1: 0.5133
 epoch: 35, train_loss: 0.5557, test_loss: 1.6097, test_f1: 0.5230
 epoch: 36, train_loss: 0.5144, test_loss: 1.4239, test_f1: 0.5433
 epoch: 37, train_loss: 0.5095, test_loss: 1.4767, test_f1: 0.5536
 epoch: 38, train_loss: 0.4848, test_loss: 1.6686, test_f1: 0.5537
 epoch: 39, train_loss: 0.5329, test_loss: 1.7707, test_f1: 0.5271
 epoch: 40, train_loss: 0.5301, test_loss: 1.7094, test_f1: 0.5598
 epoch: 41, train_loss: 0.5106, test_loss: 1.8734, test_f1: 0.5600
 epoch: 42, train_loss: 0.5179, test_loss: 2.0850, test_f1: 0.5356
 epoch: 43, train_loss: 0.4918, test_loss: 1.6974, test_f1: 0.5489
 epoch: 44, train_loss: 0.4984, test_loss: 1.6403, test_f1: 0.5781
 epoch: 45, train_loss: 0.4768, test_loss: 1.7612, test_f1: 0.5604
 epoch: 46, train_loss: 0.4742, test_loss: 1.5078, test_f1: 0.5604
 epoch: 47, train_loss: 0.4714, test_loss: 1.5755, test_f1: 0.5800
 epoch: 48, train_loss: 0.4505, test_loss: 1.7027, test_f1: 0.5711
 epoch: 49, train_loss: 0.4176, test_loss: 1.7047, test_f1: 0.5915
 epoch: 50, train_loss: 0.4109, test_loss: 1.5581, test_f1: 0.5904
 epoch: 51, train_loss: 0.4122, test_loss: 1.5718, test_f1: 0.5860
 epoch: 52, train_loss: 0.4110, test_loss: 1.8587, test_f1: 0.5526
 epoch: 53, train_loss: 0.3705, test_loss: 1.9578, test_f1: 0.5538
 epoch: 54, train_loss: 0.3622, test_loss: 1.9556, test_f1: 0.5850
 epoch: 55, train_loss: 0.3742, test_loss: 1.8921, test_f1: 0.5606
 epoch: 56, train_loss: 0.3844, test_loss: 1.8577, test_f1: 0.5703
 epoch: 57, train_loss: 0.3742, test_loss: 1.9247, test_f1: 0.5920
 epoch: 58, train_loss: 0.4008, test_loss: 1.9628, test_f1: 0.5750
 epoch: 59, train_loss: 0.3869, test_loss: 1.9289, test_f1: 0.5680
 epoch: 60, train_loss: 0.4088, test_loss: 1.9557, test_f1: 0.5779
 epoch: 61, train_loss: 0.3792, test_loss: 1.8268, test_f1: 0.5698
 epoch: 62, train_loss: 0.3616, test_loss: 1.8584, test_f1: 0.5532
 epoch: 63, train_loss: 0.3902, test_loss: 1.9185, test_f1: 0.5502
 epoch: 64, train_loss: 0.3555, test_loss: 2.1088, test_f1: 0.5561
 epoch: 65, train_loss: 0.3272, test_loss: 2.3078, test_f1: 0.5300
 epoch: 66, train_loss: 0.3681, test_loss: 2.2286, test_f1: 0.5482
 epoch: 67, train_loss: 0.3334, test_loss: 2.1768, test_f1: 0.5628
 epoch: 68, train_loss: 0.3465, test_loss: 2.2514, test_f1: 0.5621
 epoch: 69, train_loss: 0.3324, test_loss: 2.2078, test_f1: 0.5542
 epoch: 70, train_loss: 0.3294, test_loss: 2.4636, test_f1: 0.5615
 epoch: 71, train_loss: 0.3396, test_loss: 2.4190, test_f1: 0.5554
 epoch: 72, train_loss: 0.3305, test_loss: 2.2779, test_f1: 0.5486
 epoch: 73, train_loss: 0.3310, test_loss: 2.1697, test_f1: 0.5589
 epoch: 74, train_loss: 0.3378, test_loss: 2.2130, test_f1: 0.5918
 epoch: 75, train_loss: 0.3141, test_loss: 2.3880, test_f1: 0.5531
 epoch: 76, train_loss: 0.3299, test_loss: 2.3833, test_f1: 0.5784
 epoch: 77, train_loss: 0.3494, test_loss: 2.3308, test_f1: 0.5511
 epoch: 78, train_loss: 0.3165, test_loss: 2.4663, test_f1: 0.5539
 epoch: 79, train_loss: 0.2919, test_loss: 2.4808, test_f1: 0.5554
 epoch: 80, train_loss: 0.2675, test_loss: 2.3235, test_f1: 0.5716
 epoch: 81, train_loss: 0.2852, test_loss: 2.5231, test_f1: 0.5727
 epoch: 82, train_loss: 0.2692, test_loss: 2.7856, test_f1: 0.5574
 epoch: 83, train_loss: 0.2973, test_loss: 2.7208, test_f1: 0.5400
 epoch: 84, train_loss: 0.2979, test_loss: 2.5363, test_f1: 0.5527
 epoch: 85, train_loss: 0.2989, test_loss: 2.4752, test_f1: 0.5809
 epoch: 86, train_loss: 0.3100, test_loss: 2.5106, test_f1: 0.5526
 epoch: 87, train_loss: 0.3163, test_loss: 2.4620, test_f1: 0.5551
 epoch: 88, train_loss: 0.3080, test_loss: 2.4654, test_f1: 0.5551
 epoch: 89, train_loss: 0.3046, test_loss: 2.2938, test_f1: 0.5858
 epoch: 90, train_loss: 0.3009, test_loss: 2.0876, test_f1: 0.6376
 epoch: 91, train_loss: 0.2958, test_loss: 2.1657, test_f1: 0.6070
 epoch: 92, train_loss: 0.3019, test_loss: 2.4206, test_f1: 0.5577
 epoch: 93, train_loss: 0.2997, test_loss: 2.4790, test_f1: 0.5267
 epoch: 94, train_loss: 0.3190, test_loss: 2.3952, test_f1: 0.5380
 epoch: 95, train_loss: 0.3045, test_loss: 2.7247, test_f1: 0.5337
 epoch: 96, train_loss: 0.2809, test_loss: 2.8126, test_f1: 0.5160
 epoch: 97, train_loss: 0.2839, test_loss: 2.5264, test_f1: 0.5223
 epoch: 98, train_loss: 0.2908, test_loss: 2.3218, test_f1: 0.5675
 epoch: 99, train_loss: 0.2940, test_loss: 2.3436, test_f1: 0.5530
##################ITERATION #8 ****************************************
 epoch: 0, train_loss: 1.2469, test_loss: 1.3468, test_f1: 0.1365
 epoch: 1, train_loss: 1.1339, test_loss: 1.3219, test_f1: 0.2098
 epoch: 2, train_loss: 1.0484, test_loss: 1.3106, test_f1: 0.3372
 epoch: 3, train_loss: 1.0317, test_loss: 1.2289, test_f1: 0.4709
 epoch: 4, train_loss: 0.9892, test_loss: 1.2200, test_f1: 0.4473
 epoch: 5, train_loss: 0.9750, test_loss: 1.2164, test_f1: 0.4597
 epoch: 6, train_loss: 0.9432, test_loss: 1.1961, test_f1: 0.4095
 epoch: 7, train_loss: 0.8933, test_loss: 1.1789, test_f1: 0.5279
 epoch: 8, train_loss: 0.8484, test_loss: 1.2195, test_f1: 0.5031
 epoch: 9, train_loss: 0.8484, test_loss: 1.1348, test_f1: 0.5281
 epoch: 10, train_loss: 0.8415, test_loss: 1.2461, test_f1: 0.5351
 epoch: 11, train_loss: 0.8239, test_loss: 1.2777, test_f1: 0.5034
 epoch: 12, train_loss: 0.8064, test_loss: 1.3216, test_f1: 0.4957
 epoch: 13, train_loss: 0.7884, test_loss: 1.2837, test_f1: 0.5565
 epoch: 14, train_loss: 0.7811, test_loss: 1.2594, test_f1: 0.5200
 epoch: 15, train_loss: 0.7302, test_loss: 1.3185, test_f1: 0.5456
 epoch: 16, train_loss: 0.7590, test_loss: 1.1643, test_f1: 0.6206
 epoch: 17, train_loss: 0.7855, test_loss: 1.2825, test_f1: 0.6393
 epoch: 18, train_loss: 0.7667, test_loss: 1.2233, test_f1: 0.5746
 epoch: 19, train_loss: 0.7593, test_loss: 1.3025, test_f1: 0.5504
 epoch: 20, train_loss: 0.7051, test_loss: 1.3785, test_f1: 0.5234
 epoch: 21, train_loss: 0.6784, test_loss: 1.3323, test_f1: 0.5297
 epoch: 22, train_loss: 0.6623, test_loss: 1.4055, test_f1: 0.5637
 epoch: 23, train_loss: 0.6542, test_loss: 1.4647, test_f1: 0.5480
 epoch: 24, train_loss: 0.6380, test_loss: 1.5347, test_f1: 0.5366
 epoch: 25, train_loss: 0.6377, test_loss: 1.5105, test_f1: 0.5068
 epoch: 26, train_loss: 0.6405, test_loss: 1.3123, test_f1: 0.5563
 epoch: 27, train_loss: 0.6268, test_loss: 1.3327, test_f1: 0.6020
 epoch: 28, train_loss: 0.6046, test_loss: 1.3601, test_f1: 0.5528
 epoch: 29, train_loss: 0.6197, test_loss: 1.2846, test_f1: 0.5876
 epoch: 30, train_loss: 0.6382, test_loss: 1.3740, test_f1: 0.5696
 epoch: 31, train_loss: 0.6039, test_loss: 1.3562, test_f1: 0.5062
 epoch: 32, train_loss: 0.5985, test_loss: 1.8303, test_f1: 0.4544
 epoch: 33, train_loss: 0.5970, test_loss: 1.4737, test_f1: 0.5627
 epoch: 34, train_loss: 0.5799, test_loss: 1.6572, test_f1: 0.5710
 epoch: 35, train_loss: 0.5396, test_loss: 1.5344, test_f1: 0.5327
 epoch: 36, train_loss: 0.5359, test_loss: 1.4945, test_f1: 0.5401
 epoch: 37, train_loss: 0.5831, test_loss: 1.6477, test_f1: 0.4986
 epoch: 38, train_loss: 0.5513, test_loss: 1.5855, test_f1: 0.5708
 epoch: 39, train_loss: 0.5810, test_loss: 1.5752, test_f1: 0.5296
 epoch: 40, train_loss: 0.5686, test_loss: 1.5970, test_f1: 0.5299
 epoch: 41, train_loss: 0.5787, test_loss: 1.6681, test_f1: 0.4899
 epoch: 42, train_loss: 0.5805, test_loss: 1.9599, test_f1: 0.4871
 epoch: 43, train_loss: 0.5329, test_loss: 2.5813, test_f1: 0.5409
 epoch: 44, train_loss: 0.5150, test_loss: 2.0496, test_f1: 0.5491
 epoch: 45, train_loss: 0.5370, test_loss: 1.8516, test_f1: 0.4989
 epoch: 46, train_loss: 0.5418, test_loss: 1.7034, test_f1: 0.4981
 epoch: 47, train_loss: 0.5096, test_loss: 1.4785, test_f1: 0.5806
 epoch: 48, train_loss: 0.5277, test_loss: 1.5918, test_f1: 0.5375
 epoch: 49, train_loss: 0.4827, test_loss: 1.7108, test_f1: 0.5277
 epoch: 50, train_loss: 0.5063, test_loss: 2.1079, test_f1: 0.4983
 epoch: 51, train_loss: 0.4449, test_loss: 1.8981, test_f1: 0.5773
 epoch: 52, train_loss: 0.4293, test_loss: 1.7628, test_f1: 0.5950
 epoch: 53, train_loss: 0.4569, test_loss: 1.7477, test_f1: 0.5770
 epoch: 54, train_loss: 0.4282, test_loss: 1.9136, test_f1: 0.5677
 epoch: 55, train_loss: 0.4498, test_loss: 1.6973, test_f1: 0.5516
 epoch: 56, train_loss: 0.4150, test_loss: 1.7449, test_f1: 0.5365
 epoch: 57, train_loss: 0.4013, test_loss: 1.7770, test_f1: 0.5192
 epoch: 58, train_loss: 0.3756, test_loss: 1.7318, test_f1: 0.5594
 epoch: 59, train_loss: 0.3848, test_loss: 1.7346, test_f1: 0.5669
 epoch: 60, train_loss: 0.3721, test_loss: 1.8457, test_f1: 0.5644
 epoch: 61, train_loss: 0.3587, test_loss: 1.7935, test_f1: 0.5965
 epoch: 62, train_loss: 0.3563, test_loss: 1.8299, test_f1: 0.5634
 epoch: 63, train_loss: 0.3677, test_loss: 1.7134, test_f1: 0.5589
 epoch: 64, train_loss: 0.3501, test_loss: 1.6414, test_f1: 0.5636
 epoch: 65, train_loss: 0.3345, test_loss: 1.6735, test_f1: 0.5672
 epoch: 66, train_loss: 0.3598, test_loss: 1.8217, test_f1: 0.5831
 epoch: 67, train_loss: 0.3650, test_loss: 2.0687, test_f1: 0.5621
 epoch: 68, train_loss: 0.3379, test_loss: 2.0945, test_f1: 0.5414
 epoch: 69, train_loss: 0.3561, test_loss: 2.0402, test_f1: 0.5475
 epoch: 70, train_loss: 0.3774, test_loss: 1.9781, test_f1: 0.5718
 epoch: 71, train_loss: 0.3349, test_loss: 2.1030, test_f1: 0.5233
 epoch: 72, train_loss: 0.3241, test_loss: 2.0178, test_f1: 0.5661
 epoch: 73, train_loss: 0.3373, test_loss: 1.9916, test_f1: 0.5722
 epoch: 74, train_loss: 0.3383, test_loss: 1.9653, test_f1: 0.5721
 epoch: 75, train_loss: 0.3688, test_loss: 1.8423, test_f1: 0.5642
 epoch: 76, train_loss: 0.3483, test_loss: 1.8928, test_f1: 0.5610
 epoch: 77, train_loss: 0.3704, test_loss: 1.8655, test_f1: 0.5495
 epoch: 78, train_loss: 0.3425, test_loss: 1.9074, test_f1: 0.6059
 epoch: 79, train_loss: 0.3494, test_loss: 2.1371, test_f1: 0.5540
 epoch: 80, train_loss: 0.3601, test_loss: 2.1884, test_f1: 0.5425
 epoch: 81, train_loss: 0.3563, test_loss: 2.3211, test_f1: 0.5293
 epoch: 82, train_loss: 0.3438, test_loss: 2.4127, test_f1: 0.5622
 epoch: 83, train_loss: 0.3278, test_loss: 2.3021, test_f1: 0.5758
 epoch: 84, train_loss: 0.3390, test_loss: 1.9971, test_f1: 0.5866
 epoch: 85, train_loss: 0.3238, test_loss: 2.0239, test_f1: 0.5810
 epoch: 86, train_loss: 0.3195, test_loss: 2.1104, test_f1: 0.5669
 epoch: 87, train_loss: 0.3662, test_loss: 1.9328, test_f1: 0.5375
 epoch: 88, train_loss: 0.4029, test_loss: 1.9413, test_f1: 0.5294
 epoch: 89, train_loss: 0.3790, test_loss: 1.8553, test_f1: 0.5575
 epoch: 90, train_loss: 0.3704, test_loss: 2.0567, test_f1: 0.5563
 epoch: 91, train_loss: 0.3729, test_loss: 2.0234, test_f1: 0.5708
 epoch: 92, train_loss: 0.3501, test_loss: 1.8952, test_f1: 0.5378
 epoch: 93, train_loss: 0.3441, test_loss: 2.0020, test_f1: 0.5396
 epoch: 94, train_loss: 0.3483, test_loss: 2.1884, test_f1: 0.4965
 epoch: 95, train_loss: 0.3416, test_loss: 2.3284, test_f1: 0.4997
 epoch: 96, train_loss: 0.3780, test_loss: 2.0217, test_f1: 0.5358
 epoch: 97, train_loss: 0.3718, test_loss: 1.9141, test_f1: 0.5682
 epoch: 98, train_loss: 0.3455, test_loss: 2.1276, test_f1: 0.5767
 epoch: 99, train_loss: 0.2875, test_loss: 2.3610, test_f1: 0.5765
##################ITERATION #9 ****************************************
 epoch: 0, train_loss: 1.2717, test_loss: 1.4434, test_f1: 0.1365
 epoch: 1, train_loss: 1.0880, test_loss: 1.3745, test_f1: 0.1420
 epoch: 2, train_loss: 1.0201, test_loss: 1.2817, test_f1: 0.1979
 epoch: 3, train_loss: 0.9733, test_loss: 1.2812, test_f1: 0.3271
 epoch: 4, train_loss: 0.9230, test_loss: 1.2415, test_f1: 0.3698
 epoch: 5, train_loss: 0.8976, test_loss: 1.1243, test_f1: 0.5235
 epoch: 6, train_loss: 0.8737, test_loss: 1.1545, test_f1: 0.4700
 epoch: 7, train_loss: 0.8748, test_loss: 1.1216, test_f1: 0.4978
 epoch: 8, train_loss: 0.8571, test_loss: 1.1087, test_f1: 0.5292
 epoch: 9, train_loss: 0.8361, test_loss: 1.2394, test_f1: 0.4623
 epoch: 10, train_loss: 0.8307, test_loss: 1.3313, test_f1: 0.5153
 epoch: 11, train_loss: 0.8023, test_loss: 1.4902, test_f1: 0.4746
 epoch: 12, train_loss: 0.7475, test_loss: 1.2865, test_f1: 0.5165
 epoch: 13, train_loss: 0.7358, test_loss: 1.2707, test_f1: 0.5450
 epoch: 14, train_loss: 0.7181, test_loss: 1.2252, test_f1: 0.5554
 epoch: 15, train_loss: 0.7105, test_loss: 1.2885, test_f1: 0.5389
 epoch: 16, train_loss: 0.7022, test_loss: 1.4446, test_f1: 0.5308
 epoch: 17, train_loss: 0.6811, test_loss: 1.3294, test_f1: 0.5567
 epoch: 18, train_loss: 0.6901, test_loss: 1.2576, test_f1: 0.5525
 epoch: 19, train_loss: 0.6672, test_loss: 1.3903, test_f1: 0.5102
 epoch: 20, train_loss: 0.6718, test_loss: 1.4723, test_f1: 0.5491
 epoch: 21, train_loss: 0.6899, test_loss: 1.3679, test_f1: 0.5732
 epoch: 22, train_loss: 0.6673, test_loss: 1.4647, test_f1: 0.5456
 epoch: 23, train_loss: 0.6595, test_loss: 1.4702, test_f1: 0.5487
 epoch: 24, train_loss: 0.6360, test_loss: 1.3561, test_f1: 0.5822
 epoch: 25, train_loss: 0.6229, test_loss: 1.5733, test_f1: 0.5303
 epoch: 26, train_loss: 0.6146, test_loss: 1.7854, test_f1: 0.5604
 epoch: 27, train_loss: 0.6351, test_loss: 1.7857, test_f1: 0.5507
 epoch: 28, train_loss: 0.6717, test_loss: 1.7249, test_f1: 0.5602
 epoch: 29, train_loss: 0.6453, test_loss: 1.6850, test_f1: 0.5566
 epoch: 30, train_loss: 0.6139, test_loss: 1.3567, test_f1: 0.5689
 epoch: 31, train_loss: 0.6154, test_loss: 1.4073, test_f1: 0.5335
 epoch: 32, train_loss: 0.6033, test_loss: 1.5023, test_f1: 0.5530
 epoch: 33, train_loss: 0.5581, test_loss: 1.3594, test_f1: 0.5918
 epoch: 34, train_loss: 0.5403, test_loss: 1.5972, test_f1: 0.5352
 epoch: 35, train_loss: 0.5534, test_loss: 1.6155, test_f1: 0.5184
 epoch: 36, train_loss: 0.5117, test_loss: 1.3916, test_f1: 0.5511
 epoch: 37, train_loss: 0.5043, test_loss: 1.4750, test_f1: 0.5787
 epoch: 38, train_loss: 0.5253, test_loss: 1.4836, test_f1: 0.5575
 epoch: 39, train_loss: 0.5138, test_loss: 1.6354, test_f1: 0.5612
 epoch: 40, train_loss: 0.5305, test_loss: 1.6797, test_f1: 0.5695
 epoch: 41, train_loss: 0.5195, test_loss: 1.6721, test_f1: 0.5542
 epoch: 42, train_loss: 0.5242, test_loss: 1.7559, test_f1: 0.5621
 epoch: 43, train_loss: 0.5112, test_loss: 1.6078, test_f1: 0.5521
 epoch: 44, train_loss: 0.4961, test_loss: 1.7236, test_f1: 0.5710
 epoch: 45, train_loss: 0.4871, test_loss: 1.6470, test_f1: 0.5741
 epoch: 46, train_loss: 0.4861, test_loss: 1.7013, test_f1: 0.5296
 epoch: 47, train_loss: 0.4354, test_loss: 1.6086, test_f1: 0.5622
 epoch: 48, train_loss: 0.4914, test_loss: 1.8393, test_f1: 0.4882
 epoch: 49, train_loss: 0.4939, test_loss: 1.8566, test_f1: 0.5304
 epoch: 50, train_loss: 0.5305, test_loss: 1.5714, test_f1: 0.5706
 epoch: 51, train_loss: 0.4846, test_loss: 1.5251, test_f1: 0.5682
 epoch: 52, train_loss: 0.4596, test_loss: 1.5781, test_f1: 0.5753
 epoch: 53, train_loss: 0.4364, test_loss: 1.6043, test_f1: 0.5825
 epoch: 54, train_loss: 0.4540, test_loss: 1.6128, test_f1: 0.5703
 epoch: 55, train_loss: 0.4331, test_loss: 1.6958, test_f1: 0.5790
 epoch: 56, train_loss: 0.4164, test_loss: 1.7344, test_f1: 0.5579
 epoch: 57, train_loss: 0.3872, test_loss: 1.8006, test_f1: 0.5512
 epoch: 58, train_loss: 0.3662, test_loss: 1.8779, test_f1: 0.5444
 epoch: 59, train_loss: 0.3718, test_loss: 1.8588, test_f1: 0.5823
 epoch: 60, train_loss: 0.4105, test_loss: 1.8416, test_f1: 0.5549
 epoch: 61, train_loss: 0.4058, test_loss: 1.8126, test_f1: 0.5731
 epoch: 62, train_loss: 0.3847, test_loss: 1.7704, test_f1: 0.5797
 epoch: 63, train_loss: 0.3994, test_loss: 1.8331, test_f1: 0.5759
 epoch: 64, train_loss: 0.3726, test_loss: 1.7146, test_f1: 0.5584
 epoch: 65, train_loss: 0.3604, test_loss: 1.7142, test_f1: 0.5636
 epoch: 66, train_loss: 0.3682, test_loss: 1.7249, test_f1: 0.5818
 epoch: 67, train_loss: 0.3183, test_loss: 1.8385, test_f1: 0.5725
 epoch: 68, train_loss: 0.3502, test_loss: 1.9824, test_f1: 0.5812
 epoch: 69, train_loss: 0.3145, test_loss: 2.0811, test_f1: 0.5691
 epoch: 70, train_loss: 0.3355, test_loss: 2.1106, test_f1: 0.5643
 epoch: 71, train_loss: 0.3456, test_loss: 2.0963, test_f1: 0.5744
 epoch: 72, train_loss: 0.3346, test_loss: 1.9544, test_f1: 0.5587
 epoch: 73, train_loss: 0.3425, test_loss: 1.9766, test_f1: 0.5841
 epoch: 74, train_loss: 0.3037, test_loss: 1.9481, test_f1: 0.5902
 epoch: 75, train_loss: 0.3127, test_loss: 1.9429, test_f1: 0.5788
 epoch: 76, train_loss: 0.2943, test_loss: 1.8707, test_f1: 0.5954
 epoch: 77, train_loss: 0.3143, test_loss: 2.0259, test_f1: 0.5720
 epoch: 78, train_loss: 0.2959, test_loss: 2.0242, test_f1: 0.5360
 epoch: 79, train_loss: 0.2936, test_loss: 1.9740, test_f1: 0.5789
 epoch: 80, train_loss: 0.3055, test_loss: 2.1623, test_f1: 0.5727
 epoch: 81, train_loss: 0.3192, test_loss: 2.2031, test_f1: 0.5732
 epoch: 82, train_loss: 0.2987, test_loss: 2.1160, test_f1: 0.5693
 epoch: 83, train_loss: 0.3249, test_loss: 2.0685, test_f1: 0.5743
 epoch: 84, train_loss: 0.3028, test_loss: 2.0377, test_f1: 0.6007
 epoch: 85, train_loss: 0.2983, test_loss: 2.2071, test_f1: 0.5974
 epoch: 86, train_loss: 0.2893, test_loss: 2.1081, test_f1: 0.5942
 epoch: 87, train_loss: 0.3149, test_loss: 2.0343, test_f1: 0.5790
 epoch: 88, train_loss: 0.3874, test_loss: 1.9899, test_f1: 0.5875
 epoch: 89, train_loss: 0.3633, test_loss: 1.9106, test_f1: 0.5866
 epoch: 90, train_loss: 0.3462, test_loss: 1.8753, test_f1: 0.5655
 epoch: 91, train_loss: 0.3498, test_loss: 1.9558, test_f1: 0.5630
 epoch: 92, train_loss: 0.3420, test_loss: 1.8699, test_f1: 0.5854
 epoch: 93, train_loss: 0.3226, test_loss: 1.8050, test_f1: 0.5830
 epoch: 94, train_loss: 0.3123, test_loss: 1.8984, test_f1: 0.5688
 epoch: 95, train_loss: 0.3127, test_loss: 1.8351, test_f1: 0.5655
 epoch: 96, train_loss: 0.3125, test_loss: 2.0339, test_f1: 0.5629
 epoch: 97, train_loss: 0.3106, test_loss: 1.9444, test_f1: 0.5965
 epoch: 98, train_loss: 0.3076, test_loss: 1.9554, test_f1: 0.5550
 epoch: 99, train_loss: 0.3234, test_loss: 1.9041, test_f1: 0.5888

Training completed in 310.88 seconds
Best F1: 0.6393 at epoch 17
Mean F1 across iterations: 0.6093  0.0169
========================FINAL RESULTS================================
FEGIN weighted F1: 0.6393  0.0169
python main.py --data ltspice_demos --representation component_component --model FEGIN --layers 5 --hiddens 128 --batch_size 256 --lr 0.001 --emb_size 250 --epochs 100 --save_appendix component_component_L5_H128_BS256_LR0.001_E250 --no_val
-----



STDERR:
  File "main.py", line 370, in <module>
    main()
  File "main.py", line 254, in main
    dataset = dataset_class(
  File "/home/philip/projects/ltspice_examples_code_repo/Circuit-Completion-Using-GNNs/component_classification_with_link_prediction_head/evaluation/FEGIN/kernel/circuit_datasets.py", line 15, in __init__
    self.data, self.slices = torch.load(self.processed_paths[0])
  File "/home/philip/.local/lib/python3.8/site-packages/torch/serialization.py", line 1040, in load
    warnings.warn(
  File "/usr/lib/python3.8/warnings.py", line 109, in _showwarnmsg
    sw(msg.message, msg.category, msg.filename, msg.lineno,
  File "main.py", line 47, in warn_with_traceback
    traceback.print_stack(file=log)
/home/philip/projects/ltspice_examples_code_repo/Circuit-Completion-Using-GNNs/component_classification_with_link_prediction_head/evaluation/FEGIN/kernel/circuit_datasets.py:15: FutureWarning: You are using `torch.load` with `weights_only=False` (the current default value), which uses the default pickle module implicitly. It is possible to construct malicious pickle data which will execute arbitrary code during unpickling (See https://github.com/pytorch/pytorch/blob/main/SECURITY.md#untrusted-models for more details). In a future release, the default value for `weights_only` will be flipped to `True`. This limits the functions that could be executed during unpickling. Arbitrary objects will no longer be allowed to be loaded via this mode unless they are explicitly allowlisted by the user via `torch.serialization.add_safe_globals`. We recommend you start setting `weights_only=True` for any use case where you don't have full control of the loaded file. Please open an issue on GitHub for any issues related to this experimental feature.
  self.data, self.slices = torch.load(self.processed_paths[0])
