STDOUT:
Results will be saved in /home/philip/projects/ltspice_examples_code_repo/Circuit-Completion-Using-GNNs/component_classification_with_link_prediction_head/evaluation/FEGIN/results/model_FEGIN_dataset_ltspice_examples
Command line input: python main.py --data ltspice_examples --representation component_pin_net --model FEGIN --layers 6 --hiddens 128 --batch_size 128 --lr 0.01 --emb_size 250 --epochs 100 --save_appendix component_pin_net_L6_H128_BS128_LR0.01_E250 --no_val
 is saved.
-----
ltspice_examples - FEGIN
Using 6 layers, 128 hidden units, h = 2
Loading component_pin_net representation dataset
ENTERED
Training FEGIN on component_pin_net representation
Train: 3558, Test: 846
##################ITERATION #0 ****************************************
 epoch: 0, train_loss: 1.1778, test_loss: 1.2862, test_f1: 0.3124
 epoch: 1, train_loss: 1.0360, test_loss: 1.0717, test_f1: 0.4440
 epoch: 2, train_loss: 0.9793, test_loss: 1.3656, test_f1: 0.3826
 epoch: 3, train_loss: 0.9582, test_loss: 0.9776, test_f1: 0.4759
 epoch: 4, train_loss: 0.9318, test_loss: 1.2133, test_f1: 0.4817
 epoch: 5, train_loss: 0.9351, test_loss: 0.9429, test_f1: 0.4984
 epoch: 6, train_loss: 0.8897, test_loss: 0.9205, test_f1: 0.4892
 epoch: 7, train_loss: 0.8779, test_loss: 1.0113, test_f1: 0.5747
 epoch: 8, train_loss: 0.8521, test_loss: 1.0143, test_f1: 0.5191
 epoch: 9, train_loss: 0.8711, test_loss: 0.9192, test_f1: 0.5599
 epoch: 10, train_loss: 0.8568, test_loss: 0.9949, test_f1: 0.5256
 epoch: 11, train_loss: 0.8347, test_loss: 0.9296, test_f1: 0.5867
 epoch: 12, train_loss: 0.8373, test_loss: 0.9330, test_f1: 0.5494
 epoch: 13, train_loss: 0.8056, test_loss: 0.9163, test_f1: 0.5429
 epoch: 14, train_loss: 0.8064, test_loss: 0.9869, test_f1: 0.5626
 epoch: 15, train_loss: 0.7968, test_loss: 0.9075, test_f1: 0.5874
 epoch: 16, train_loss: 0.7900, test_loss: 1.0528, test_f1: 0.5398
 epoch: 17, train_loss: 0.7668, test_loss: 0.8679, test_f1: 0.5686
 epoch: 18, train_loss: 0.7541, test_loss: 0.8302, test_f1: 0.6268
 epoch: 19, train_loss: 0.7506, test_loss: 0.8881, test_f1: 0.5658
 epoch: 20, train_loss: 0.7557, test_loss: 1.0158, test_f1: 0.6017
 epoch: 21, train_loss: 0.7187, test_loss: 0.8927, test_f1: 0.5959
 epoch: 22, train_loss: 0.7170, test_loss: 0.9947, test_f1: 0.6169
 epoch: 23, train_loss: 0.7273, test_loss: 0.9017, test_f1: 0.5867
 epoch: 24, train_loss: 0.7020, test_loss: 1.2311, test_f1: 0.5280
 epoch: 25, train_loss: 0.7188, test_loss: 0.9858, test_f1: 0.6126
 epoch: 26, train_loss: 0.7047, test_loss: 1.0890, test_f1: 0.6420
 epoch: 27, train_loss: 0.6754, test_loss: 1.0994, test_f1: 0.5854
 epoch: 28, train_loss: 0.6881, test_loss: 0.8057, test_f1: 0.6113
 epoch: 29, train_loss: 0.6756, test_loss: 0.8332, test_f1: 0.6793
 epoch: 30, train_loss: 0.6892, test_loss: 0.7419, test_f1: 0.6646
 epoch: 31, train_loss: 0.6495, test_loss: 0.9064, test_f1: 0.6807
 epoch: 32, train_loss: 0.6442, test_loss: 0.7971, test_f1: 0.6289
 epoch: 33, train_loss: 0.6511, test_loss: 0.8627, test_f1: 0.6068
 epoch: 34, train_loss: 0.6698, test_loss: 0.8429, test_f1: 0.5842
 epoch: 35, train_loss: 0.6706, test_loss: 0.8437, test_f1: 0.6341
 epoch: 36, train_loss: 0.6434, test_loss: 0.8849, test_f1: 0.6250
 epoch: 37, train_loss: 0.6177, test_loss: 0.8405, test_f1: 0.6157
 epoch: 38, train_loss: 0.6103, test_loss: 1.0666, test_f1: 0.5989
 epoch: 39, train_loss: 0.6280, test_loss: 1.0110, test_f1: 0.5702
 epoch: 40, train_loss: 0.6064, test_loss: 0.9106, test_f1: 0.6499
 epoch: 41, train_loss: 0.5949, test_loss: 0.8642, test_f1: 0.6296
 epoch: 42, train_loss: 0.6159, test_loss: 1.1418, test_f1: 0.6109
 epoch: 43, train_loss: 0.6295, test_loss: 0.9016, test_f1: 0.6623
 epoch: 44, train_loss: 0.5803, test_loss: 0.8313, test_f1: 0.6589
 epoch: 45, train_loss: 0.5731, test_loss: 0.9459, test_f1: 0.6408
 epoch: 46, train_loss: 0.5789, test_loss: 0.9804, test_f1: 0.6030
 epoch: 47, train_loss: 0.6063, test_loss: 0.9533, test_f1: 0.6834
 epoch: 48, train_loss: 0.5603, test_loss: 0.9485, test_f1: 0.6385
 epoch: 49, train_loss: 0.5913, test_loss: 0.7380, test_f1: 0.6679
 epoch: 50, train_loss: 0.5495, test_loss: 0.9007, test_f1: 0.6153
 epoch: 51, train_loss: 0.5197, test_loss: 0.9844, test_f1: 0.6471
 epoch: 52, train_loss: 0.5022, test_loss: 0.9219, test_f1: 0.6552
 epoch: 53, train_loss: 0.4819, test_loss: 1.0435, test_f1: 0.6643
 epoch: 54, train_loss: 0.4827, test_loss: 0.8995, test_f1: 0.6608
 epoch: 55, train_loss: 0.4612, test_loss: 0.9014, test_f1: 0.6609
 epoch: 56, train_loss: 0.4572, test_loss: 0.9272, test_f1: 0.6569
 epoch: 57, train_loss: 0.4615, test_loss: 0.8647, test_f1: 0.6799
 epoch: 58, train_loss: 0.4478, test_loss: 0.9240, test_f1: 0.6486
 epoch: 59, train_loss: 0.4398, test_loss: 0.9315, test_f1: 0.6620
 epoch: 60, train_loss: 0.4531, test_loss: 0.9663, test_f1: 0.6693
 epoch: 61, train_loss: 0.4198, test_loss: 1.0658, test_f1: 0.6856
 epoch: 62, train_loss: 0.4334, test_loss: 0.8515, test_f1: 0.6691
 epoch: 63, train_loss: 0.4180, test_loss: 0.9738, test_f1: 0.6577
 epoch: 64, train_loss: 0.4224, test_loss: 1.0202, test_f1: 0.6737
 epoch: 65, train_loss: 0.4296, test_loss: 0.9219, test_f1: 0.6814
 epoch: 66, train_loss: 0.4232, test_loss: 0.8860, test_f1: 0.6687
 epoch: 67, train_loss: 0.3886, test_loss: 1.0262, test_f1: 0.6536
 epoch: 68, train_loss: 0.4138, test_loss: 0.9209, test_f1: 0.6863
 epoch: 69, train_loss: 0.4127, test_loss: 1.0072, test_f1: 0.6571
 epoch: 70, train_loss: 0.3948, test_loss: 1.0220, test_f1: 0.6605
 epoch: 71, train_loss: 0.3946, test_loss: 1.1115, test_f1: 0.6313
 epoch: 72, train_loss: 0.3826, test_loss: 1.0481, test_f1: 0.6761
 epoch: 73, train_loss: 0.3746, test_loss: 1.0253, test_f1: 0.6837
 epoch: 74, train_loss: 0.3555, test_loss: 1.0579, test_f1: 0.6302
 epoch: 75, train_loss: 0.3717, test_loss: 1.0457, test_f1: 0.6791
 epoch: 76, train_loss: 0.3640, test_loss: 1.0746, test_f1: 0.6428
 epoch: 77, train_loss: 0.3483, test_loss: 1.0212, test_f1: 0.6680
 epoch: 78, train_loss: 0.3841, test_loss: 1.1267, test_f1: 0.6211
 epoch: 79, train_loss: 0.3696, test_loss: 0.9143, test_f1: 0.6813
 epoch: 80, train_loss: 0.3625, test_loss: 1.2460, test_f1: 0.6389
 epoch: 81, train_loss: 0.3674, test_loss: 0.9484, test_f1: 0.6650
 epoch: 82, train_loss: 0.3410, test_loss: 1.0866, test_f1: 0.6594
 epoch: 83, train_loss: 0.3212, test_loss: 1.1690, test_f1: 0.6762
 epoch: 84, train_loss: 0.3682, test_loss: 1.1593, test_f1: 0.6690
 epoch: 85, train_loss: 0.3413, test_loss: 1.1399, test_f1: 0.6531
 epoch: 86, train_loss: 0.3516, test_loss: 1.0751, test_f1: 0.6867
 epoch: 87, train_loss: 0.3079, test_loss: 1.1408, test_f1: 0.6863
 epoch: 88, train_loss: 0.3140, test_loss: 1.1588, test_f1: 0.6614
 epoch: 89, train_loss: 0.3596, test_loss: 1.0495, test_f1: 0.6595
 epoch: 90, train_loss: 0.3214, test_loss: 1.2182, test_f1: 0.6928
 epoch: 91, train_loss: 0.3290, test_loss: 1.2525, test_f1: 0.6636
 epoch: 92, train_loss: 0.3253, test_loss: 1.2116, test_f1: 0.6618
 epoch: 93, train_loss: 0.3046, test_loss: 1.3096, test_f1: 0.6477
 epoch: 94, train_loss: 0.3035, test_loss: 1.1779, test_f1: 0.6747
 epoch: 95, train_loss: 0.3222, test_loss: 1.2372, test_f1: 0.6748
 epoch: 96, train_loss: 0.3083, test_loss: 1.1935, test_f1: 0.6569
 epoch: 97, train_loss: 0.3122, test_loss: 1.3720, test_f1: 0.6514
 epoch: 98, train_loss: 0.2943, test_loss: 1.1574, test_f1: 0.6873
 epoch: 99, train_loss: 0.2883, test_loss: 1.2707, test_f1: 0.6671
##################ITERATION #1 ****************************************
 epoch: 0, train_loss: 1.2856, test_loss: 1.2143, test_f1: 0.3655
 epoch: 1, train_loss: 1.0601, test_loss: 1.0979, test_f1: 0.3893
 epoch: 2, train_loss: 1.0114, test_loss: 1.0296, test_f1: 0.4879
 epoch: 3, train_loss: 0.9661, test_loss: 0.9515, test_f1: 0.4805
 epoch: 4, train_loss: 0.9499, test_loss: 0.9538, test_f1: 0.5069
 epoch: 5, train_loss: 0.9304, test_loss: 0.9811, test_f1: 0.5063
 epoch: 6, train_loss: 0.9078, test_loss: 0.9533, test_f1: 0.5397
 epoch: 7, train_loss: 0.8887, test_loss: 0.9476, test_f1: 0.5470
 epoch: 8, train_loss: 0.8847, test_loss: 0.8775, test_f1: 0.5581
 epoch: 9, train_loss: 0.8505, test_loss: 0.9247, test_f1: 0.5304
 epoch: 10, train_loss: 0.8430, test_loss: 0.9010, test_f1: 0.5371
 epoch: 11, train_loss: 0.8331, test_loss: 0.9865, test_f1: 0.5336
 epoch: 12, train_loss: 0.8291, test_loss: 0.9981, test_f1: 0.5256
 epoch: 13, train_loss: 0.8223, test_loss: 0.8948, test_f1: 0.5303
 epoch: 14, train_loss: 0.8054, test_loss: 0.8437, test_f1: 0.5766
 epoch: 15, train_loss: 0.7795, test_loss: 0.7881, test_f1: 0.5607
 epoch: 16, train_loss: 0.7598, test_loss: 0.8112, test_f1: 0.6258
 epoch: 17, train_loss: 0.7543, test_loss: 0.8071, test_f1: 0.6036
 epoch: 18, train_loss: 0.7412, test_loss: 0.8787, test_f1: 0.5763
 epoch: 19, train_loss: 0.7437, test_loss: 0.8270, test_f1: 0.5892
 epoch: 20, train_loss: 0.7070, test_loss: 0.8177, test_f1: 0.6176
 epoch: 21, train_loss: 0.6988, test_loss: 0.7698, test_f1: 0.6133
 epoch: 22, train_loss: 0.6961, test_loss: 0.7970, test_f1: 0.6145
 epoch: 23, train_loss: 0.6765, test_loss: 0.8556, test_f1: 0.5994
 epoch: 24, train_loss: 0.6825, test_loss: 0.7128, test_f1: 0.6234
 epoch: 25, train_loss: 0.6679, test_loss: 0.7759, test_f1: 0.6028
 epoch: 26, train_loss: 0.6874, test_loss: 0.7856, test_f1: 0.6123
 epoch: 27, train_loss: 0.6443, test_loss: 1.0200, test_f1: 0.5530
 epoch: 28, train_loss: 0.6688, test_loss: 0.9049, test_f1: 0.6038
 epoch: 29, train_loss: 0.6824, test_loss: 0.8109, test_f1: 0.6118
 epoch: 30, train_loss: 0.6232, test_loss: 0.7550, test_f1: 0.6119
 epoch: 31, train_loss: 0.6210, test_loss: 0.8300, test_f1: 0.5934
 epoch: 32, train_loss: 0.6242, test_loss: 0.9943, test_f1: 0.5708
 epoch: 33, train_loss: 0.6156, test_loss: 0.7249, test_f1: 0.6609
 epoch: 34, train_loss: 0.6152, test_loss: 0.7649, test_f1: 0.6706
 epoch: 35, train_loss: 0.5925, test_loss: 0.8645, test_f1: 0.5932
 epoch: 36, train_loss: 0.5819, test_loss: 0.8363, test_f1: 0.6523
 epoch: 37, train_loss: 0.6141, test_loss: 0.7893, test_f1: 0.6473
 epoch: 38, train_loss: 0.5849, test_loss: 0.7733, test_f1: 0.6482
 epoch: 39, train_loss: 0.5891, test_loss: 0.8081, test_f1: 0.6479
 epoch: 40, train_loss: 0.5642, test_loss: 0.8101, test_f1: 0.6552
 epoch: 41, train_loss: 0.5590, test_loss: 0.9443, test_f1: 0.6014
 epoch: 42, train_loss: 0.5648, test_loss: 0.8050, test_f1: 0.6894
 epoch: 43, train_loss: 0.5533, test_loss: 0.7957, test_f1: 0.6742
 epoch: 44, train_loss: 0.5461, test_loss: 0.9220, test_f1: 0.6280
 epoch: 45, train_loss: 0.5510, test_loss: 0.7337, test_f1: 0.6531
 epoch: 46, train_loss: 0.5156, test_loss: 0.7963, test_f1: 0.6757
 epoch: 47, train_loss: 0.5206, test_loss: 0.8018, test_f1: 0.6419
 epoch: 48, train_loss: 0.5179, test_loss: 0.7825, test_f1: 0.6562
 epoch: 49, train_loss: 0.5354, test_loss: 0.9208, test_f1: 0.6095
 epoch: 50, train_loss: 0.4775, test_loss: 0.9012, test_f1: 0.6596
 epoch: 51, train_loss: 0.4387, test_loss: 0.7695, test_f1: 0.6780
 epoch: 52, train_loss: 0.4187, test_loss: 0.8085, test_f1: 0.6795
 epoch: 53, train_loss: 0.4328, test_loss: 0.8720, test_f1: 0.6870
 epoch: 54, train_loss: 0.3962, test_loss: 0.8051, test_f1: 0.6972
 epoch: 55, train_loss: 0.4080, test_loss: 0.8659, test_f1: 0.6578
 epoch: 56, train_loss: 0.3987, test_loss: 0.8677, test_f1: 0.7036
 epoch: 57, train_loss: 0.3826, test_loss: 0.8375, test_f1: 0.6685
 epoch: 58, train_loss: 0.3933, test_loss: 0.8885, test_f1: 0.6870
 epoch: 59, train_loss: 0.3950, test_loss: 0.8432, test_f1: 0.6680
 epoch: 60, train_loss: 0.3867, test_loss: 0.9033, test_f1: 0.6799
 epoch: 61, train_loss: 0.3683, test_loss: 0.8444, test_f1: 0.6619
 epoch: 62, train_loss: 0.3775, test_loss: 1.0530, test_f1: 0.6235
 epoch: 63, train_loss: 0.3913, test_loss: 0.8807, test_f1: 0.6743
 epoch: 64, train_loss: 0.3866, test_loss: 1.0345, test_f1: 0.6717
 epoch: 65, train_loss: 0.3673, test_loss: 1.0763, test_f1: 0.6666
 epoch: 66, train_loss: 0.3452, test_loss: 0.9697, test_f1: 0.6862
 epoch: 67, train_loss: 0.3693, test_loss: 0.8909, test_f1: 0.6911
 epoch: 68, train_loss: 0.3631, test_loss: 0.8721, test_f1: 0.6705
 epoch: 69, train_loss: 0.3540, test_loss: 0.8190, test_f1: 0.6904
 epoch: 70, train_loss: 0.3318, test_loss: 0.9608, test_f1: 0.6853
 epoch: 71, train_loss: 0.3519, test_loss: 0.9487, test_f1: 0.6664
 epoch: 72, train_loss: 0.3367, test_loss: 0.9895, test_f1: 0.6757
 epoch: 73, train_loss: 0.3509, test_loss: 1.0467, test_f1: 0.6710
 epoch: 74, train_loss: 0.3393, test_loss: 0.9680, test_f1: 0.6761
 epoch: 75, train_loss: 0.3606, test_loss: 0.9309, test_f1: 0.6843
 epoch: 76, train_loss: 0.3336, test_loss: 1.0735, test_f1: 0.6621
 epoch: 77, train_loss: 0.3139, test_loss: 1.1300, test_f1: 0.6565
 epoch: 78, train_loss: 0.3384, test_loss: 0.9268, test_f1: 0.6530
 epoch: 79, train_loss: 0.3175, test_loss: 1.0009, test_f1: 0.6736
 epoch: 80, train_loss: 0.3305, test_loss: 1.0152, test_f1: 0.6624
 epoch: 81, train_loss: 0.3352, test_loss: 1.2034, test_f1: 0.6655
 epoch: 82, train_loss: 0.3066, test_loss: 1.0120, test_f1: 0.6714
 epoch: 83, train_loss: 0.3070, test_loss: 1.0070, test_f1: 0.6682
 epoch: 84, train_loss: 0.3147, test_loss: 1.0265, test_f1: 0.6619
 epoch: 85, train_loss: 0.2905, test_loss: 1.1363, test_f1: 0.6622
 epoch: 86, train_loss: 0.3056, test_loss: 1.1685, test_f1: 0.6625
 epoch: 87, train_loss: 0.3064, test_loss: 0.9460, test_f1: 0.6763
 epoch: 88, train_loss: 0.3103, test_loss: 1.1330, test_f1: 0.6725
 epoch: 89, train_loss: 0.2753, test_loss: 1.0993, test_f1: 0.6742
 epoch: 90, train_loss: 0.3003, test_loss: 1.0894, test_f1: 0.6679
 epoch: 91, train_loss: 0.3536, test_loss: 0.9494, test_f1: 0.6746
 epoch: 92, train_loss: 0.2986, test_loss: 1.1361, test_f1: 0.6650
 epoch: 93, train_loss: 0.2738, test_loss: 1.0878, test_f1: 0.6642
 epoch: 94, train_loss: 0.2769, test_loss: 0.9980, test_f1: 0.6756
 epoch: 95, train_loss: 0.2742, test_loss: 1.1147, test_f1: 0.6637
 epoch: 96, train_loss: 0.2796, test_loss: 1.0764, test_f1: 0.6635
 epoch: 97, train_loss: 0.2658, test_loss: 0.9518, test_f1: 0.6778
 epoch: 98, train_loss: 0.2702, test_loss: 1.1025, test_f1: 0.6667
 epoch: 99, train_loss: 0.2638, test_loss: 1.1626, test_f1: 0.6621
##################ITERATION #2 ****************************************
 epoch: 0, train_loss: 1.2306, test_loss: 1.3076, test_f1: 0.2317
 epoch: 1, train_loss: 1.0311, test_loss: 1.1039, test_f1: 0.3868
 epoch: 2, train_loss: 1.0063, test_loss: 0.9509, test_f1: 0.5010
 epoch: 3, train_loss: 0.9606, test_loss: 1.0427, test_f1: 0.4296
 epoch: 4, train_loss: 0.9404, test_loss: 0.9466, test_f1: 0.4849
 epoch: 5, train_loss: 0.9242, test_loss: 0.9176, test_f1: 0.4769
 epoch: 6, train_loss: 0.9182, test_loss: 0.9867, test_f1: 0.5054
 epoch: 7, train_loss: 0.8960, test_loss: 1.0142, test_f1: 0.4751
 epoch: 8, train_loss: 0.8744, test_loss: 1.0247, test_f1: 0.4893
 epoch: 9, train_loss: 0.8757, test_loss: 0.9449, test_f1: 0.5140
 epoch: 10, train_loss: 0.8558, test_loss: 1.6991, test_f1: 0.5084
 epoch: 11, train_loss: 0.8919, test_loss: 0.9120, test_f1: 0.5525
 epoch: 12, train_loss: 0.8452, test_loss: 0.9232, test_f1: 0.5572
 epoch: 13, train_loss: 0.8266, test_loss: 0.9166, test_f1: 0.5616
 epoch: 14, train_loss: 0.8245, test_loss: 0.8771, test_f1: 0.5899
 epoch: 15, train_loss: 0.7876, test_loss: 0.8765, test_f1: 0.5835
 epoch: 16, train_loss: 0.7824, test_loss: 1.1717, test_f1: 0.4863
 epoch: 17, train_loss: 0.7820, test_loss: 0.9374, test_f1: 0.5569
 epoch: 18, train_loss: 0.7394, test_loss: 0.8148, test_f1: 0.6161
 epoch: 19, train_loss: 0.7255, test_loss: 0.8670, test_f1: 0.5612
 epoch: 20, train_loss: 0.7282, test_loss: 0.8673, test_f1: 0.5791
 epoch: 21, train_loss: 0.7133, test_loss: 0.8760, test_f1: 0.5862
 epoch: 22, train_loss: 0.7404, test_loss: 0.8123, test_f1: 0.6131
 epoch: 23, train_loss: 0.7180, test_loss: 0.8460, test_f1: 0.6030
 epoch: 24, train_loss: 0.7078, test_loss: 0.8454, test_f1: 0.5771
 epoch: 25, train_loss: 0.7059, test_loss: 0.8050, test_f1: 0.6098
 epoch: 26, train_loss: 0.7002, test_loss: 0.8035, test_f1: 0.6465
 epoch: 27, train_loss: 0.6858, test_loss: 0.9379, test_f1: 0.5675
 epoch: 28, train_loss: 0.6872, test_loss: 0.8196, test_f1: 0.6053
 epoch: 29, train_loss: 0.6737, test_loss: 0.8055, test_f1: 0.6294
 epoch: 30, train_loss: 0.6651, test_loss: 0.9338, test_f1: 0.6053
 epoch: 31, train_loss: 0.6584, test_loss: 0.7855, test_f1: 0.6080
 epoch: 32, train_loss: 0.6516, test_loss: 0.8407, test_f1: 0.6239
 epoch: 33, train_loss: 0.6424, test_loss: 0.8338, test_f1: 0.6026
 epoch: 34, train_loss: 0.6336, test_loss: 0.7567, test_f1: 0.6355
 epoch: 35, train_loss: 0.6385, test_loss: 0.8840, test_f1: 0.6039
 epoch: 36, train_loss: 0.6218, test_loss: 0.8194, test_f1: 0.5958
 epoch: 37, train_loss: 0.6297, test_loss: 0.7535, test_f1: 0.6531
 epoch: 38, train_loss: 0.6061, test_loss: 0.8435, test_f1: 0.6298
 epoch: 39, train_loss: 0.6213, test_loss: 0.9909, test_f1: 0.5732
 epoch: 40, train_loss: 0.6163, test_loss: 0.7380, test_f1: 0.6646
 epoch: 41, train_loss: 0.6126, test_loss: 0.7799, test_f1: 0.6334
 epoch: 42, train_loss: 0.6235, test_loss: 0.8308, test_f1: 0.5939
 epoch: 43, train_loss: 0.5971, test_loss: 0.9460, test_f1: 0.5729
 epoch: 44, train_loss: 0.6102, test_loss: 0.8532, test_f1: 0.6249
 epoch: 45, train_loss: 0.5609, test_loss: 0.7631, test_f1: 0.6420
 epoch: 46, train_loss: 0.5531, test_loss: 0.7366, test_f1: 0.6595
 epoch: 47, train_loss: 0.5577, test_loss: 1.1873, test_f1: 0.5413
 epoch: 48, train_loss: 0.5578, test_loss: 0.7634, test_f1: 0.6344
 epoch: 49, train_loss: 0.5356, test_loss: 0.8230, test_f1: 0.6254
 epoch: 50, train_loss: 0.5522, test_loss: 0.7790, test_f1: 0.6229
 epoch: 51, train_loss: 0.5297, test_loss: 0.7069, test_f1: 0.6678
 epoch: 52, train_loss: 0.4898, test_loss: 0.7174, test_f1: 0.6576
 epoch: 53, train_loss: 0.4633, test_loss: 0.7248, test_f1: 0.6731
 epoch: 54, train_loss: 0.4628, test_loss: 0.7570, test_f1: 0.6872
 epoch: 55, train_loss: 0.4562, test_loss: 0.7934, test_f1: 0.6791
 epoch: 56, train_loss: 0.4502, test_loss: 0.7773, test_f1: 0.6419
 epoch: 57, train_loss: 0.4339, test_loss: 0.7456, test_f1: 0.6845
 epoch: 58, train_loss: 0.4325, test_loss: 0.7316, test_f1: 0.6726
 epoch: 59, train_loss: 0.4314, test_loss: 0.7776, test_f1: 0.6599
 epoch: 60, train_loss: 0.4325, test_loss: 0.8410, test_f1: 0.6309
 epoch: 61, train_loss: 0.4182, test_loss: 0.8303, test_f1: 0.6581
 epoch: 62, train_loss: 0.4232, test_loss: 0.8700, test_f1: 0.6315
 epoch: 63, train_loss: 0.4191, test_loss: 0.9297, test_f1: 0.6413
 epoch: 64, train_loss: 0.4039, test_loss: 0.8882, test_f1: 0.6485
 epoch: 65, train_loss: 0.4016, test_loss: 0.9244, test_f1: 0.6529
 epoch: 66, train_loss: 0.3821, test_loss: 0.8742, test_f1: 0.6352
 epoch: 67, train_loss: 0.3998, test_loss: 0.8333, test_f1: 0.6662
 epoch: 68, train_loss: 0.4148, test_loss: 0.8463, test_f1: 0.6655
 epoch: 69, train_loss: 0.4131, test_loss: 0.8762, test_f1: 0.6435
 epoch: 70, train_loss: 0.4106, test_loss: 0.8951, test_f1: 0.6299
 epoch: 71, train_loss: 0.4117, test_loss: 0.8703, test_f1: 0.6600
 epoch: 72, train_loss: 0.4052, test_loss: 0.8704, test_f1: 0.6518
 epoch: 73, train_loss: 0.3967, test_loss: 0.8222, test_f1: 0.6698
 epoch: 74, train_loss: 0.3601, test_loss: 0.9806, test_f1: 0.6282
 epoch: 75, train_loss: 0.3583, test_loss: 1.0170, test_f1: 0.6499
 epoch: 76, train_loss: 0.3670, test_loss: 0.9038, test_f1: 0.6660
 epoch: 77, train_loss: 0.3814, test_loss: 0.8806, test_f1: 0.6486
 epoch: 78, train_loss: 0.3843, test_loss: 0.8937, test_f1: 0.6610
 epoch: 79, train_loss: 0.3625, test_loss: 0.8480, test_f1: 0.6780
 epoch: 80, train_loss: 0.3429, test_loss: 0.8216, test_f1: 0.6657
 epoch: 81, train_loss: 0.3440, test_loss: 0.8596, test_f1: 0.6686
 epoch: 82, train_loss: 0.3619, test_loss: 0.8903, test_f1: 0.6624
 epoch: 83, train_loss: 0.3851, test_loss: 0.9113, test_f1: 0.6285
 epoch: 84, train_loss: 0.3576, test_loss: 0.7686, test_f1: 0.6933
 epoch: 85, train_loss: 0.3557, test_loss: 0.9405, test_f1: 0.6491
 epoch: 86, train_loss: 0.3346, test_loss: 0.9666, test_f1: 0.6499
 epoch: 87, train_loss: 0.3229, test_loss: 0.8025, test_f1: 0.6805
 epoch: 88, train_loss: 0.3416, test_loss: 0.8633, test_f1: 0.6759
 epoch: 89, train_loss: 0.3414, test_loss: 0.8362, test_f1: 0.6857
 epoch: 90, train_loss: 0.3492, test_loss: 1.0211, test_f1: 0.6641
 epoch: 91, train_loss: 0.3311, test_loss: 0.9212, test_f1: 0.6631
 epoch: 92, train_loss: 0.3450, test_loss: 0.8970, test_f1: 0.6610
 epoch: 93, train_loss: 0.3243, test_loss: 1.0054, test_f1: 0.6589
 epoch: 94, train_loss: 0.2992, test_loss: 0.9155, test_f1: 0.6804
 epoch: 95, train_loss: 0.3320, test_loss: 0.8951, test_f1: 0.6777
 epoch: 96, train_loss: 0.3386, test_loss: 0.8897, test_f1: 0.6776
 epoch: 97, train_loss: 0.3037, test_loss: 0.9553, test_f1: 0.6492
 epoch: 98, train_loss: 0.3254, test_loss: 0.8815, test_f1: 0.6498
 epoch: 99, train_loss: 0.3318, test_loss: 0.9901, test_f1: 0.6475
##################ITERATION #3 ****************************************
 epoch: 0, train_loss: 1.2267, test_loss: 1.1687, test_f1: 0.3981
 epoch: 1, train_loss: 1.0469, test_loss: 1.1345, test_f1: 0.4286
 epoch: 2, train_loss: 0.9926, test_loss: 1.0065, test_f1: 0.4742
 epoch: 3, train_loss: 0.9655, test_loss: 1.0399, test_f1: 0.4717
 epoch: 4, train_loss: 0.9462, test_loss: 1.0014, test_f1: 0.4828
 epoch: 5, train_loss: 0.9267, test_loss: 1.2387, test_f1: 0.3913
 epoch: 6, train_loss: 0.9158, test_loss: 0.9582, test_f1: 0.4528
 epoch: 7, train_loss: 0.9044, test_loss: 0.9604, test_f1: 0.5408
 epoch: 8, train_loss: 0.9045, test_loss: 0.9181, test_f1: 0.4909
 epoch: 9, train_loss: 0.8787, test_loss: 0.8912, test_f1: 0.5361
 epoch: 10, train_loss: 0.8592, test_loss: 0.9288, test_f1: 0.5802
 epoch: 11, train_loss: 0.8355, test_loss: 0.9122, test_f1: 0.5218
 epoch: 12, train_loss: 0.8289, test_loss: 0.8441, test_f1: 0.6013
 epoch: 13, train_loss: 0.8022, test_loss: 0.8740, test_f1: 0.5965
 epoch: 14, train_loss: 0.8268, test_loss: 0.9260, test_f1: 0.5001
 epoch: 15, train_loss: 0.8045, test_loss: 1.3478, test_f1: 0.4014
 epoch: 16, train_loss: 0.8211, test_loss: 0.8480, test_f1: 0.6017
 epoch: 17, train_loss: 0.7877, test_loss: 0.9429, test_f1: 0.5200
 epoch: 18, train_loss: 0.7693, test_loss: 1.2125, test_f1: 0.4591
 epoch: 19, train_loss: 0.7732, test_loss: 1.0253, test_f1: 0.5419
 epoch: 20, train_loss: 0.7728, test_loss: 0.9022, test_f1: 0.5271
 epoch: 21, train_loss: 0.7536, test_loss: 0.9044, test_f1: 0.5477
 epoch: 22, train_loss: 0.7356, test_loss: 0.8149, test_f1: 0.5828
 epoch: 23, train_loss: 0.7132, test_loss: 0.8764, test_f1: 0.5845
 epoch: 24, train_loss: 0.7221, test_loss: 0.8333, test_f1: 0.5886
 epoch: 25, train_loss: 0.7049, test_loss: 0.9533, test_f1: 0.6021
 epoch: 26, train_loss: 0.7102, test_loss: 0.9861, test_f1: 0.5590
 epoch: 27, train_loss: 0.7221, test_loss: 0.9440, test_f1: 0.5784
 epoch: 28, train_loss: 0.6856, test_loss: 0.9272, test_f1: 0.5899
 epoch: 29, train_loss: 0.6746, test_loss: 0.9855, test_f1: 0.5584
 epoch: 30, train_loss: 0.7013, test_loss: 0.8697, test_f1: 0.5989
 epoch: 31, train_loss: 0.6888, test_loss: 0.7967, test_f1: 0.6185
 epoch: 32, train_loss: 0.6841, test_loss: 0.8129, test_f1: 0.6162
 epoch: 33, train_loss: 0.6613, test_loss: 0.8924, test_f1: 0.5845
 epoch: 34, train_loss: 0.6596, test_loss: 0.9222, test_f1: 0.5766
 epoch: 35, train_loss: 0.6714, test_loss: 0.8343, test_f1: 0.6057
 epoch: 36, train_loss: 0.6233, test_loss: 0.7658, test_f1: 0.6378
 epoch: 37, train_loss: 0.6296, test_loss: 0.9498, test_f1: 0.6338
 epoch: 38, train_loss: 0.6397, test_loss: 0.7629, test_f1: 0.6239
 epoch: 39, train_loss: 0.6197, test_loss: 0.7181, test_f1: 0.6612
 epoch: 40, train_loss: 0.6195, test_loss: 0.7360, test_f1: 0.6571
 epoch: 41, train_loss: 0.6311, test_loss: 0.8363, test_f1: 0.6285
 epoch: 42, train_loss: 0.5788, test_loss: 0.9199, test_f1: 0.6214
 epoch: 43, train_loss: 0.5861, test_loss: 0.8067, test_f1: 0.6471
 epoch: 44, train_loss: 0.6002, test_loss: 0.9101, test_f1: 0.6072
 epoch: 45, train_loss: 0.5988, test_loss: 0.8106, test_f1: 0.6236
 epoch: 46, train_loss: 0.5969, test_loss: 1.0014, test_f1: 0.5935
 epoch: 47, train_loss: 0.5809, test_loss: 0.8628, test_f1: 0.6082
 epoch: 48, train_loss: 0.5826, test_loss: 0.8199, test_f1: 0.6680
 epoch: 49, train_loss: 0.5745, test_loss: 0.8400, test_f1: 0.6182
 epoch: 50, train_loss: 0.5948, test_loss: 0.7904, test_f1: 0.6553
 epoch: 51, train_loss: 0.5547, test_loss: 0.7823, test_f1: 0.6806
 epoch: 52, train_loss: 0.5048, test_loss: 0.7734, test_f1: 0.6501
 epoch: 53, train_loss: 0.4859, test_loss: 0.8375, test_f1: 0.6556
 epoch: 54, train_loss: 0.4838, test_loss: 0.8198, test_f1: 0.6603
 epoch: 55, train_loss: 0.4496, test_loss: 0.8623, test_f1: 0.6416
 epoch: 56, train_loss: 0.4473, test_loss: 0.8577, test_f1: 0.6695
 epoch: 57, train_loss: 0.4776, test_loss: 0.8064, test_f1: 0.6458
 epoch: 58, train_loss: 0.4455, test_loss: 0.8084, test_f1: 0.6458
 epoch: 59, train_loss: 0.4515, test_loss: 0.8224, test_f1: 0.6763
 epoch: 60, train_loss: 0.4285, test_loss: 0.8513, test_f1: 0.6691
 epoch: 61, train_loss: 0.4218, test_loss: 0.8055, test_f1: 0.6583
 epoch: 62, train_loss: 0.4686, test_loss: 0.7779, test_f1: 0.6705
 epoch: 63, train_loss: 0.4515, test_loss: 0.8021, test_f1: 0.6484
 epoch: 64, train_loss: 0.4585, test_loss: 0.8381, test_f1: 0.6781
 epoch: 65, train_loss: 0.4287, test_loss: 0.8758, test_f1: 0.6292
 epoch: 66, train_loss: 0.4089, test_loss: 0.8861, test_f1: 0.6733
 epoch: 67, train_loss: 0.4318, test_loss: 0.8703, test_f1: 0.6469
 epoch: 68, train_loss: 0.3840, test_loss: 0.7794, test_f1: 0.6772
 epoch: 69, train_loss: 0.4089, test_loss: 0.8505, test_f1: 0.6468
 epoch: 70, train_loss: 0.4018, test_loss: 0.8119, test_f1: 0.6792
 epoch: 71, train_loss: 0.4015, test_loss: 0.8771, test_f1: 0.6569
 epoch: 72, train_loss: 0.4024, test_loss: 0.7515, test_f1: 0.6787
 epoch: 73, train_loss: 0.3945, test_loss: 0.7989, test_f1: 0.6701
 epoch: 74, train_loss: 0.3993, test_loss: 0.7993, test_f1: 0.6900
 epoch: 75, train_loss: 0.3897, test_loss: 0.8363, test_f1: 0.6819
 epoch: 76, train_loss: 0.3648, test_loss: 0.9512, test_f1: 0.6401
 epoch: 77, train_loss: 0.4014, test_loss: 0.9547, test_f1: 0.6446
 epoch: 78, train_loss: 0.3939, test_loss: 0.8451, test_f1: 0.6625
 epoch: 79, train_loss: 0.3873, test_loss: 0.7998, test_f1: 0.6733
 epoch: 80, train_loss: 0.3608, test_loss: 0.9991, test_f1: 0.6477
 epoch: 81, train_loss: 0.3752, test_loss: 0.9155, test_f1: 0.6330
 epoch: 82, train_loss: 0.3475, test_loss: 0.9329, test_f1: 0.6656
 epoch: 83, train_loss: 0.3483, test_loss: 0.9302, test_f1: 0.6621
 epoch: 84, train_loss: 0.3908, test_loss: 0.9757, test_f1: 0.6473
 epoch: 85, train_loss: 0.3800, test_loss: 0.8788, test_f1: 0.6785
 epoch: 86, train_loss: 0.3568, test_loss: 0.8885, test_f1: 0.6656
 epoch: 87, train_loss: 0.3414, test_loss: 0.8849, test_f1: 0.6655
 epoch: 88, train_loss: 0.3276, test_loss: 1.0353, test_f1: 0.6510
 epoch: 89, train_loss: 0.3619, test_loss: 0.8919, test_f1: 0.6683
 epoch: 90, train_loss: 0.3280, test_loss: 0.9892, test_f1: 0.6555
 epoch: 91, train_loss: 0.3325, test_loss: 0.9589, test_f1: 0.6453
 epoch: 92, train_loss: 0.3461, test_loss: 0.8033, test_f1: 0.6928
 epoch: 93, train_loss: 0.3188, test_loss: 1.0222, test_f1: 0.6656
 epoch: 94, train_loss: 0.3346, test_loss: 0.9930, test_f1: 0.6640
 epoch: 95, train_loss: 0.3281, test_loss: 0.9754, test_f1: 0.6747
 epoch: 96, train_loss: 0.3073, test_loss: 1.0461, test_f1: 0.6471
 epoch: 97, train_loss: 0.3268, test_loss: 1.0044, test_f1: 0.6498
 epoch: 98, train_loss: 0.3491, test_loss: 0.7859, test_f1: 0.6978
 epoch: 99, train_loss: 0.3482, test_loss: 1.0381, test_f1: 0.6485
##################ITERATION #4 ****************************************
 epoch: 0, train_loss: 1.2960, test_loss: 1.1973, test_f1: 0.3548
 epoch: 1, train_loss: 1.0113, test_loss: 1.0252, test_f1: 0.4601
 epoch: 2, train_loss: 0.9533, test_loss: 1.0202, test_f1: 0.4716
 epoch: 3, train_loss: 0.9388, test_loss: 0.9827, test_f1: 0.4795
 epoch: 4, train_loss: 0.9135, test_loss: 0.9287, test_f1: 0.5272
 epoch: 5, train_loss: 0.9130, test_loss: 0.9220, test_f1: 0.4796
 epoch: 6, train_loss: 0.8891, test_loss: 1.0748, test_f1: 0.5208
 epoch: 7, train_loss: 0.8710, test_loss: 0.9312, test_f1: 0.4884
 epoch: 8, train_loss: 0.8557, test_loss: 0.8917, test_f1: 0.5617
 epoch: 9, train_loss: 0.8332, test_loss: 1.0209, test_f1: 0.5084
 epoch: 10, train_loss: 0.8167, test_loss: 0.9391, test_f1: 0.5459
 epoch: 11, train_loss: 0.8016, test_loss: 1.0323, test_f1: 0.5368
 epoch: 12, train_loss: 0.7898, test_loss: 1.0746, test_f1: 0.5478
 epoch: 13, train_loss: 0.7820, test_loss: 0.7762, test_f1: 0.5807
 epoch: 14, train_loss: 0.7651, test_loss: 0.8326, test_f1: 0.5765
 epoch: 15, train_loss: 0.7502, test_loss: 0.9008, test_f1: 0.5929
 epoch: 16, train_loss: 0.7469, test_loss: 1.0056, test_f1: 0.5694
 epoch: 17, train_loss: 0.7367, test_loss: 0.9847, test_f1: 0.5955
 epoch: 18, train_loss: 0.7212, test_loss: 0.8996, test_f1: 0.5887
 epoch: 19, train_loss: 0.7141, test_loss: 0.9205, test_f1: 0.6141
 epoch: 20, train_loss: 0.7053, test_loss: 1.0510, test_f1: 0.5285
 epoch: 21, train_loss: 0.6898, test_loss: 1.2381, test_f1: 0.5335
 epoch: 22, train_loss: 0.6887, test_loss: 1.2670, test_f1: 0.5432
 epoch: 23, train_loss: 0.6739, test_loss: 0.9882, test_f1: 0.5602
 epoch: 24, train_loss: 0.6661, test_loss: 1.0922, test_f1: 0.5716
 epoch: 25, train_loss: 0.6333, test_loss: 0.9864, test_f1: 0.6103
 epoch: 26, train_loss: 0.6355, test_loss: 1.1187, test_f1: 0.6079
 epoch: 27, train_loss: 0.6558, test_loss: 0.8596, test_f1: 0.5984
 epoch: 28, train_loss: 0.6844, test_loss: 0.9703, test_f1: 0.6187
 epoch: 29, train_loss: 0.6197, test_loss: 0.9699, test_f1: 0.5645
 epoch: 30, train_loss: 0.6399, test_loss: 1.0113, test_f1: 0.5553
 epoch: 31, train_loss: 0.6196, test_loss: 0.9828, test_f1: 0.6305
 epoch: 32, train_loss: 0.6299, test_loss: 0.9354, test_f1: 0.5895
 epoch: 33, train_loss: 0.5978, test_loss: 0.9555, test_f1: 0.5898
 epoch: 34, train_loss: 0.5854, test_loss: 0.9798, test_f1: 0.5948
 epoch: 35, train_loss: 0.5903, test_loss: 2932.8045, test_f1: 0.3282
 epoch: 36, train_loss: 0.5951, test_loss: 1.0447, test_f1: 0.5846
 epoch: 37, train_loss: 0.5698, test_loss: 0.9820, test_f1: 0.6243
 epoch: 38, train_loss: 0.5746, test_loss: 0.8503, test_f1: 0.5983
 epoch: 39, train_loss: 0.5540, test_loss: 1.3363, test_f1: 0.6253
 epoch: 40, train_loss: 0.5587, test_loss: 0.9573, test_f1: 0.6040
 epoch: 41, train_loss: 0.5269, test_loss: 1.1581, test_f1: 0.6428
 epoch: 42, train_loss: 0.5219, test_loss: 1.1258, test_f1: 0.6283
 epoch: 43, train_loss: 0.5627, test_loss: 0.9081, test_f1: 0.5868
 epoch: 44, train_loss: 0.5636, test_loss: 0.9146, test_f1: 0.6713
 epoch: 45, train_loss: 0.5231, test_loss: 1.1626, test_f1: 0.5918
 epoch: 46, train_loss: 0.5445, test_loss: 0.9832, test_f1: 0.6214
 epoch: 47, train_loss: 0.5190, test_loss: 1.0254, test_f1: 0.6535
 epoch: 48, train_loss: 0.5210, test_loss: 1.2605, test_f1: 0.6303
 epoch: 49, train_loss: 0.5205, test_loss: 1.1782, test_f1: 0.5954
 epoch: 50, train_loss: 0.5095, test_loss: 0.9669, test_f1: 0.6440
 epoch: 51, train_loss: 0.4898, test_loss: 0.9181, test_f1: 0.6389
 epoch: 52, train_loss: 0.4387, test_loss: 0.9246, test_f1: 0.6826
 epoch: 53, train_loss: 0.4160, test_loss: 1.0777, test_f1: 0.6362
 epoch: 54, train_loss: 0.4118, test_loss: 1.0350, test_f1: 0.6626
 epoch: 55, train_loss: 0.3928, test_loss: 1.0687, test_f1: 0.6634
 epoch: 56, train_loss: 0.3840, test_loss: 1.0223, test_f1: 0.6790
 epoch: 57, train_loss: 0.3918, test_loss: 1.2075, test_f1: 0.6425
 epoch: 58, train_loss: 0.3932, test_loss: 1.1161, test_f1: 0.6073
 epoch: 59, train_loss: 0.3816, test_loss: 1.0500, test_f1: 0.6566
 epoch: 60, train_loss: 0.3789, test_loss: 1.1506, test_f1: 0.6396
 epoch: 61, train_loss: 0.3626, test_loss: 1.0989, test_f1: 0.6300
 epoch: 62, train_loss: 0.3812, test_loss: 1.0096, test_f1: 0.6591
 epoch: 63, train_loss: 0.3811, test_loss: 1.0713, test_f1: 0.6303
 epoch: 64, train_loss: 0.3548, test_loss: 1.1486, test_f1: 0.6590
 epoch: 65, train_loss: 0.3341, test_loss: 1.3141, test_f1: 0.6479
 epoch: 66, train_loss: 0.3709, test_loss: 1.1264, test_f1: 0.6480
 epoch: 67, train_loss: 0.3538, test_loss: 1.4042, test_f1: 0.6345
 epoch: 68, train_loss: 0.3568, test_loss: 1.2733, test_f1: 0.6460
 epoch: 69, train_loss: 0.3428, test_loss: 1.2968, test_f1: 0.6361
 epoch: 70, train_loss: 0.3427, test_loss: 1.1745, test_f1: 0.6292
 epoch: 71, train_loss: 0.3600, test_loss: 1.4474, test_f1: 0.6343
 epoch: 72, train_loss: 0.3600, test_loss: 1.3537, test_f1: 0.6418
 epoch: 73, train_loss: 0.3468, test_loss: 1.2569, test_f1: 0.6550
 epoch: 74, train_loss: 0.3199, test_loss: 1.2875, test_f1: 0.6394
 epoch: 75, train_loss: 0.3227, test_loss: 1.2045, test_f1: 0.6573
 epoch: 76, train_loss: 0.3264, test_loss: 1.3462, test_f1: 0.6419
 epoch: 77, train_loss: 0.3232, test_loss: 1.3324, test_f1: 0.6415
 epoch: 78, train_loss: 0.3179, test_loss: 1.3673, test_f1: 0.6564
 epoch: 79, train_loss: 0.2970, test_loss: 1.3844, test_f1: 0.6409
 epoch: 80, train_loss: 0.3144, test_loss: 1.3434, test_f1: 0.6605
 epoch: 81, train_loss: 0.3144, test_loss: 1.1386, test_f1: 0.6662
 epoch: 82, train_loss: 0.2954, test_loss: 1.4106, test_f1: 0.6636
 epoch: 83, train_loss: 0.3134, test_loss: 1.4340, test_f1: 0.6538
 epoch: 84, train_loss: 0.2935, test_loss: 1.4700, test_f1: 0.6281
 epoch: 85, train_loss: 0.3082, test_loss: 1.4118, test_f1: 0.6286
 epoch: 86, train_loss: 0.2965, test_loss: 1.4777, test_f1: 0.6561
 epoch: 87, train_loss: 0.2746, test_loss: 1.4876, test_f1: 0.6189
 epoch: 88, train_loss: 0.2685, test_loss: 1.6218, test_f1: 0.6509
 epoch: 89, train_loss: 0.2864, test_loss: 1.6072, test_f1: 0.6244
 epoch: 90, train_loss: 0.3035, test_loss: 1.3466, test_f1: 0.6426
 epoch: 91, train_loss: 0.2993, test_loss: 1.3221, test_f1: 0.6346
 epoch: 92, train_loss: 0.2986, test_loss: 1.5588, test_f1: 0.6373
 epoch: 93, train_loss: 0.2829, test_loss: 1.4772, test_f1: 0.6536
 epoch: 94, train_loss: 0.2706, test_loss: 1.3929, test_f1: 0.6215
 epoch: 95, train_loss: 0.2736, test_loss: 1.4753, test_f1: 0.6382
 epoch: 96, train_loss: 0.2913, test_loss: 1.5240, test_f1: 0.6394
 epoch: 97, train_loss: 0.2943, test_loss: 1.2376, test_f1: 0.6510
 epoch: 98, train_loss: 0.2677, test_loss: 1.3133, test_f1: 0.6434
 epoch: 99, train_loss: 0.2743, test_loss: 1.2834, test_f1: 0.6601
##################ITERATION #5 ****************************************
 epoch: 0, train_loss: 1.3530, test_loss: 1.3634, test_f1: 0.3568
 epoch: 1, train_loss: 0.9928, test_loss: 1.0224, test_f1: 0.4982
 epoch: 2, train_loss: 0.9510, test_loss: 0.9037, test_f1: 0.5532
 epoch: 3, train_loss: 0.9328, test_loss: 0.9406, test_f1: 0.5546
 epoch: 4, train_loss: 0.9431, test_loss: 0.9197, test_f1: 0.5115
 epoch: 5, train_loss: 0.9118, test_loss: 0.9103, test_f1: 0.5057
 epoch: 6, train_loss: 0.8789, test_loss: 0.9000, test_f1: 0.5289
 epoch: 7, train_loss: 0.8554, test_loss: 1.0635, test_f1: 0.5091
 epoch: 8, train_loss: 0.8414, test_loss: 0.8812, test_f1: 0.5039
 epoch: 9, train_loss: 0.8334, test_loss: 0.8127, test_f1: 0.5483
 epoch: 10, train_loss: 0.7961, test_loss: 0.8388, test_f1: 0.6032
 epoch: 11, train_loss: 0.8004, test_loss: 0.9375, test_f1: 0.5431
 epoch: 12, train_loss: 0.7890, test_loss: 0.8427, test_f1: 0.5492
 epoch: 13, train_loss: 0.7936, test_loss: 0.8227, test_f1: 0.5918
 epoch: 14, train_loss: 0.7930, test_loss: 0.9142, test_f1: 0.5209
 epoch: 15, train_loss: 0.7735, test_loss: 0.8050, test_f1: 0.6243
 epoch: 16, train_loss: 0.7677, test_loss: 0.8332, test_f1: 0.5919
 epoch: 17, train_loss: 0.7549, test_loss: 0.7815, test_f1: 0.5728
 epoch: 18, train_loss: 0.7275, test_loss: 0.7528, test_f1: 0.5974
 epoch: 19, train_loss: 0.7318, test_loss: 0.8315, test_f1: 0.6106
 epoch: 20, train_loss: 0.7121, test_loss: 0.7679, test_f1: 0.6401
 epoch: 21, train_loss: 0.7093, test_loss: 0.7928, test_f1: 0.6326
 epoch: 22, train_loss: 0.6997, test_loss: 0.7740, test_f1: 0.6291
 epoch: 23, train_loss: 0.6819, test_loss: 0.8260, test_f1: 0.6003
 epoch: 24, train_loss: 0.6973, test_loss: 0.7601, test_f1: 0.6316
 epoch: 25, train_loss: 0.6880, test_loss: 0.8176, test_f1: 0.5996
 epoch: 26, train_loss: 0.6949, test_loss: 0.9429, test_f1: 0.5753
 epoch: 27, train_loss: 0.6934, test_loss: 1.1504, test_f1: 0.5284
 epoch: 28, train_loss: 0.6699, test_loss: 0.8267, test_f1: 0.6212
 epoch: 29, train_loss: 0.6507, test_loss: 0.8078, test_f1: 0.6216
 epoch: 30, train_loss: 0.6486, test_loss: 0.9310, test_f1: 0.5566
 epoch: 31, train_loss: 0.6907, test_loss: 0.7797, test_f1: 0.6315
 epoch: 32, train_loss: 0.6633, test_loss: 0.9913, test_f1: 0.5261
 epoch: 33, train_loss: 0.6378, test_loss: 0.8042, test_f1: 0.5946
 epoch: 34, train_loss: 0.6410, test_loss: 0.7552, test_f1: 0.6550
 epoch: 35, train_loss: 0.6361, test_loss: 0.7884, test_f1: 0.6254
 epoch: 36, train_loss: 0.6252, test_loss: 0.8279, test_f1: 0.5961
 epoch: 37, train_loss: 0.6273, test_loss: 0.8544, test_f1: 0.6000
 epoch: 38, train_loss: 0.6314, test_loss: 0.7792, test_f1: 0.6109
 epoch: 39, train_loss: 0.6146, test_loss: 0.7583, test_f1: 0.6406
 epoch: 40, train_loss: 0.6350, test_loss: 0.7625, test_f1: 0.6408
 epoch: 41, train_loss: 0.6043, test_loss: 0.8318, test_f1: 0.6273
 epoch: 42, train_loss: 0.6152, test_loss: 0.8778, test_f1: 0.6221
 epoch: 43, train_loss: 0.6045, test_loss: 0.9148, test_f1: 0.6103
 epoch: 44, train_loss: 0.6100, test_loss: 0.8893, test_f1: 0.6372
 epoch: 45, train_loss: 0.5384, test_loss: 0.8431, test_f1: 0.5962
 epoch: 46, train_loss: 0.5643, test_loss: 0.7513, test_f1: 0.6289
 epoch: 47, train_loss: 0.5847, test_loss: 0.7852, test_f1: 0.6372
 epoch: 48, train_loss: 0.5716, test_loss: 0.7793, test_f1: 0.6470
 epoch: 49, train_loss: 0.5473, test_loss: 0.7358, test_f1: 0.6400
 epoch: 50, train_loss: 0.5583, test_loss: 0.7611, test_f1: 0.6442
 epoch: 51, train_loss: 0.5123, test_loss: 0.8115, test_f1: 0.6336
 epoch: 52, train_loss: 0.4871, test_loss: 0.7316, test_f1: 0.6684
 epoch: 53, train_loss: 0.4909, test_loss: 0.7810, test_f1: 0.6367
 epoch: 54, train_loss: 0.4795, test_loss: 1.1675, test_f1: 0.5567
 epoch: 55, train_loss: 0.4667, test_loss: 0.7384, test_f1: 0.6445
 epoch: 56, train_loss: 0.4462, test_loss: 0.7728, test_f1: 0.6518
 epoch: 57, train_loss: 0.4580, test_loss: 0.7668, test_f1: 0.6850
 epoch: 58, train_loss: 0.4399, test_loss: 0.7787, test_f1: 0.6712
 epoch: 59, train_loss: 0.4313, test_loss: 0.7718, test_f1: 0.6579
 epoch: 60, train_loss: 0.4282, test_loss: 0.8838, test_f1: 0.6470
 epoch: 61, train_loss: 0.4247, test_loss: 0.9390, test_f1: 0.5820
 epoch: 62, train_loss: 0.4181, test_loss: 0.8995, test_f1: 0.6381
 epoch: 63, train_loss: 0.4301, test_loss: 0.8328, test_f1: 0.6437
 epoch: 64, train_loss: 0.4194, test_loss: 0.7690, test_f1: 0.6798
 epoch: 65, train_loss: 0.4454, test_loss: 0.7439, test_f1: 0.6785
 epoch: 66, train_loss: 0.4436, test_loss: 0.9368, test_f1: 0.6441
 epoch: 67, train_loss: 0.4271, test_loss: 0.8760, test_f1: 0.6268
 epoch: 68, train_loss: 0.4227, test_loss: 0.8388, test_f1: 0.6621
 epoch: 69, train_loss: 0.3912, test_loss: 0.8671, test_f1: 0.6513
 epoch: 70, train_loss: 0.3823, test_loss: 0.8291, test_f1: 0.6438
 epoch: 71, train_loss: 0.4178, test_loss: 1.0719, test_f1: 0.6594
 epoch: 72, train_loss: 0.3912, test_loss: 0.8990, test_f1: 0.6174
 epoch: 73, train_loss: 0.4076, test_loss: 0.7863, test_f1: 0.6455
 epoch: 74, train_loss: 0.3942, test_loss: 0.8563, test_f1: 0.6318
 epoch: 75, train_loss: 0.3942, test_loss: 0.8532, test_f1: 0.6703
 epoch: 76, train_loss: 0.4118, test_loss: 0.9062, test_f1: 0.6309
 epoch: 77, train_loss: 0.3937, test_loss: 0.8297, test_f1: 0.6525
 epoch: 78, train_loss: 0.3812, test_loss: 0.8350, test_f1: 0.6534
 epoch: 79, train_loss: 0.3535, test_loss: 0.9116, test_f1: 0.6209
 epoch: 80, train_loss: 0.3788, test_loss: 0.9459, test_f1: 0.6291
 epoch: 81, train_loss: 0.3913, test_loss: 0.9906, test_f1: 0.6295
 epoch: 82, train_loss: 0.3826, test_loss: 0.8342, test_f1: 0.6539
 epoch: 83, train_loss: 0.3746, test_loss: 0.9500, test_f1: 0.6117
 epoch: 84, train_loss: 0.3565, test_loss: 0.9185, test_f1: 0.6275
 epoch: 85, train_loss: 0.3933, test_loss: 1.0478, test_f1: 0.6151
 epoch: 86, train_loss: 0.3754, test_loss: 0.8615, test_f1: 0.6334
 epoch: 87, train_loss: 0.3731, test_loss: 1.0434, test_f1: 0.6088
 epoch: 88, train_loss: 0.3512, test_loss: 0.9877, test_f1: 0.6248
 epoch: 89, train_loss: 0.3782, test_loss: 0.8926, test_f1: 0.6392
 epoch: 90, train_loss: 0.3603, test_loss: 0.9772, test_f1: 0.6298
 epoch: 91, train_loss: 0.3502, test_loss: 0.9454, test_f1: 0.6401
 epoch: 92, train_loss: 0.3568, test_loss: 0.9879, test_f1: 0.6186
 epoch: 93, train_loss: 0.3507, test_loss: 0.9244, test_f1: 0.6538
 epoch: 94, train_loss: 0.3255, test_loss: 1.0928, test_f1: 0.6045
 epoch: 95, train_loss: 0.3491, test_loss: 1.0200, test_f1: 0.6314
 epoch: 96, train_loss: 0.3561, test_loss: 1.0882, test_f1: 0.6180
 epoch: 97, train_loss: 0.3481, test_loss: 1.0463, test_f1: 0.6078
 epoch: 98, train_loss: 0.3115, test_loss: 1.0822, test_f1: 0.6118
 epoch: 99, train_loss: 0.3313, test_loss: 0.9611, test_f1: 0.6237
##################ITERATION #6 ****************************************
 epoch: 0, train_loss: 1.2557, test_loss: 1.2558, test_f1: 0.3545
 epoch: 1, train_loss: 1.0047, test_loss: 1.0533, test_f1: 0.4732
 epoch: 2, train_loss: 0.9731, test_loss: 1.0285, test_f1: 0.4960
 epoch: 3, train_loss: 0.9544, test_loss: 1.0089, test_f1: 0.4748
 epoch: 4, train_loss: 0.9375, test_loss: 0.9899, test_f1: 0.4773
 epoch: 5, train_loss: 0.9292, test_loss: 0.9694, test_f1: 0.4793
 epoch: 6, train_loss: 0.9240, test_loss: 1.0727, test_f1: 0.4685
 epoch: 7, train_loss: 0.8963, test_loss: 0.9989, test_f1: 0.4989
 epoch: 8, train_loss: 0.9063, test_loss: 1.0690, test_f1: 0.4925
 epoch: 9, train_loss: 0.8779, test_loss: 0.9503, test_f1: 0.5559
 epoch: 10, train_loss: 0.8687, test_loss: 0.9050, test_f1: 0.5372
 epoch: 11, train_loss: 0.8729, test_loss: 0.9155, test_f1: 0.5204
 epoch: 12, train_loss: 0.8314, test_loss: 0.8781, test_f1: 0.5568
 epoch: 13, train_loss: 0.8387, test_loss: 0.9301, test_f1: 0.4859
 epoch: 14, train_loss: 0.8078, test_loss: 0.7974, test_f1: 0.5620
 epoch: 15, train_loss: 0.7897, test_loss: 0.7552, test_f1: 0.5815
 epoch: 16, train_loss: 0.7760, test_loss: 0.9633, test_f1: 0.4887
 epoch: 17, train_loss: 0.7824, test_loss: 0.8371, test_f1: 0.5508
 epoch: 18, train_loss: 0.7754, test_loss: 0.8113, test_f1: 0.5667
 epoch: 19, train_loss: 0.7584, test_loss: 0.8228, test_f1: 0.5684
 epoch: 20, train_loss: 0.7687, test_loss: 0.9407, test_f1: 0.5482
 epoch: 21, train_loss: 0.7436, test_loss: 0.7912, test_f1: 0.6230
 epoch: 22, train_loss: 0.7134, test_loss: 0.7299, test_f1: 0.5990
 epoch: 23, train_loss: 0.7338, test_loss: 0.7879, test_f1: 0.6313
 epoch: 24, train_loss: 0.7318, test_loss: 0.7678, test_f1: 0.6205
 epoch: 25, train_loss: 0.7154, test_loss: 0.7390, test_f1: 0.6377
 epoch: 26, train_loss: 0.7104, test_loss: 0.7985, test_f1: 0.6114
 epoch: 27, train_loss: 0.7016, test_loss: 0.7487, test_f1: 0.6153
 epoch: 28, train_loss: 0.6679, test_loss: 0.7252, test_f1: 0.6346
 epoch: 29, train_loss: 0.6774, test_loss: 0.7319, test_f1: 0.6414
 epoch: 30, train_loss: 0.6872, test_loss: 0.8030, test_f1: 0.5838
 epoch: 31, train_loss: 0.6671, test_loss: 0.7481, test_f1: 0.6158
 epoch: 32, train_loss: 0.6653, test_loss: 0.8491, test_f1: 0.6104
 epoch: 33, train_loss: 0.6788, test_loss: 0.8242, test_f1: 0.5937
 epoch: 34, train_loss: 0.6723, test_loss: 0.7368, test_f1: 0.6233
 epoch: 35, train_loss: 0.6495, test_loss: 0.7757, test_f1: 0.6465
 epoch: 36, train_loss: 0.6741, test_loss: 0.7548, test_f1: 0.6023
 epoch: 37, train_loss: 0.6481, test_loss: 0.7772, test_f1: 0.6561
 epoch: 38, train_loss: 0.6393, test_loss: 0.7343, test_f1: 0.6493
 epoch: 39, train_loss: 0.6630, test_loss: 0.7480, test_f1: 0.6274
 epoch: 40, train_loss: 0.6317, test_loss: 0.7780, test_f1: 0.6636
 epoch: 41, train_loss: 0.6502, test_loss: 0.7586, test_f1: 0.6417
 epoch: 42, train_loss: 0.6245, test_loss: 0.8144, test_f1: 0.5744
 epoch: 43, train_loss: 0.6001, test_loss: 0.7160, test_f1: 0.6694
 epoch: 44, train_loss: 0.6425, test_loss: 0.8054, test_f1: 0.5729
 epoch: 45, train_loss: 0.6179, test_loss: 0.7778, test_f1: 0.6365
 epoch: 46, train_loss: 0.6366, test_loss: 0.8343, test_f1: 0.6486
 epoch: 47, train_loss: 0.6040, test_loss: 0.7496, test_f1: 0.6203
 epoch: 48, train_loss: 0.5890, test_loss: 0.7541, test_f1: 0.6376
 epoch: 49, train_loss: 0.5940, test_loss: 0.8132, test_f1: 0.6371
 epoch: 50, train_loss: 0.5849, test_loss: 0.8296, test_f1: 0.5623
 epoch: 51, train_loss: 0.5283, test_loss: 0.7071, test_f1: 0.6857
 epoch: 52, train_loss: 0.5203, test_loss: 0.7243, test_f1: 0.6783
 epoch: 53, train_loss: 0.5101, test_loss: 0.6824, test_f1: 0.6748
 epoch: 54, train_loss: 0.4864, test_loss: 0.7086, test_f1: 0.6828
 epoch: 55, train_loss: 0.4877, test_loss: 0.6817, test_f1: 0.6680
 epoch: 56, train_loss: 0.4854, test_loss: 0.7323, test_f1: 0.6819
 epoch: 57, train_loss: 0.4725, test_loss: 0.7359, test_f1: 0.6722
 epoch: 58, train_loss: 0.4572, test_loss: 0.7153, test_f1: 0.6884
 epoch: 59, train_loss: 0.4738, test_loss: 0.7399, test_f1: 0.7050
 epoch: 60, train_loss: 0.4942, test_loss: 0.7556, test_f1: 0.6883
 epoch: 61, train_loss: 0.4668, test_loss: 0.7378, test_f1: 0.6635
 epoch: 62, train_loss: 0.4570, test_loss: 0.8291, test_f1: 0.6466
 epoch: 63, train_loss: 0.4651, test_loss: 0.7093, test_f1: 0.7023
 epoch: 64, train_loss: 0.4403, test_loss: 0.8151, test_f1: 0.6603
 epoch: 65, train_loss: 0.4446, test_loss: 0.7066, test_f1: 0.6938
 epoch: 66, train_loss: 0.4196, test_loss: 0.7532, test_f1: 0.6809
 epoch: 67, train_loss: 0.4331, test_loss: 0.8434, test_f1: 0.6569
 epoch: 68, train_loss: 0.4360, test_loss: 0.7416, test_f1: 0.6671
 epoch: 69, train_loss: 0.4418, test_loss: 0.7766, test_f1: 0.6717
 epoch: 70, train_loss: 0.4140, test_loss: 0.7535, test_f1: 0.6896
 epoch: 71, train_loss: 0.4074, test_loss: 0.7588, test_f1: 0.6690
 epoch: 72, train_loss: 0.4149, test_loss: 0.7441, test_f1: 0.6801
 epoch: 73, train_loss: 0.4362, test_loss: 0.7801, test_f1: 0.6578
 epoch: 74, train_loss: 0.4027, test_loss: 0.7655, test_f1: 0.6887
 epoch: 75, train_loss: 0.4347, test_loss: 0.7771, test_f1: 0.6776
 epoch: 76, train_loss: 0.4151, test_loss: 0.8121, test_f1: 0.6832
 epoch: 77, train_loss: 0.4269, test_loss: 0.8379, test_f1: 0.6583
 epoch: 78, train_loss: 0.4130, test_loss: 0.8440, test_f1: 0.6902
 epoch: 79, train_loss: 0.4339, test_loss: 0.7625, test_f1: 0.6760
 epoch: 80, train_loss: 0.3929, test_loss: 0.8471, test_f1: 0.6704
 epoch: 81, train_loss: 0.3986, test_loss: 0.7665, test_f1: 0.6745
 epoch: 82, train_loss: 0.3838, test_loss: 0.8137, test_f1: 0.6727
 epoch: 83, train_loss: 0.3863, test_loss: 0.8654, test_f1: 0.6554
 epoch: 84, train_loss: 0.3964, test_loss: 0.9113, test_f1: 0.6619
 epoch: 85, train_loss: 0.3727, test_loss: 0.8453, test_f1: 0.6777
 epoch: 86, train_loss: 0.3922, test_loss: 0.8781, test_f1: 0.6748
 epoch: 87, train_loss: 0.3897, test_loss: 0.7867, test_f1: 0.6814
 epoch: 88, train_loss: 0.3859, test_loss: 0.9756, test_f1: 0.6430
 epoch: 89, train_loss: 0.4158, test_loss: 0.9009, test_f1: 0.6788
 epoch: 90, train_loss: 0.3798, test_loss: 0.8152, test_f1: 0.6610
 epoch: 91, train_loss: 0.3944, test_loss: 0.8481, test_f1: 0.6763
 epoch: 92, train_loss: 0.3712, test_loss: 0.8177, test_f1: 0.6810
 epoch: 93, train_loss: 0.3537, test_loss: 0.7535, test_f1: 0.7126
 epoch: 94, train_loss: 0.3637, test_loss: 0.8675, test_f1: 0.6664
 epoch: 95, train_loss: 0.3524, test_loss: 0.9176, test_f1: 0.6576
 epoch: 96, train_loss: 0.3647, test_loss: 0.8343, test_f1: 0.6840
 epoch: 97, train_loss: 0.3298, test_loss: 0.9882, test_f1: 0.6695
 epoch: 98, train_loss: 0.3613, test_loss: 0.9368, test_f1: 0.6550
 epoch: 99, train_loss: 0.3405, test_loss: 0.7644, test_f1: 0.6737
##################ITERATION #7 ****************************************
 epoch: 0, train_loss: 1.3850, test_loss: 1.2355, test_f1: 0.4246
 epoch: 1, train_loss: 0.9814, test_loss: 1.0516, test_f1: 0.4592
 epoch: 2, train_loss: 0.9410, test_loss: 0.9901, test_f1: 0.4806
 epoch: 3, train_loss: 0.9324, test_loss: 0.9401, test_f1: 0.4736
 epoch: 4, train_loss: 0.8978, test_loss: 0.9014, test_f1: 0.5603
 epoch: 5, train_loss: 0.8842, test_loss: 0.9752, test_f1: 0.5304
 epoch: 6, train_loss: 0.8854, test_loss: 0.9899, test_f1: 0.4949
 epoch: 7, train_loss: 0.8671, test_loss: 0.8671, test_f1: 0.5192
 epoch: 8, train_loss: 0.8337, test_loss: 0.9568, test_f1: 0.5303
 epoch: 9, train_loss: 0.8106, test_loss: 0.9656, test_f1: 0.5551
 epoch: 10, train_loss: 0.8059, test_loss: 1.0671, test_f1: 0.5372
 epoch: 11, train_loss: 0.7911, test_loss: 0.8906, test_f1: 0.6287
 epoch: 12, train_loss: 0.7888, test_loss: 0.9756, test_f1: 0.5346
 epoch: 13, train_loss: 0.7892, test_loss: 0.9175, test_f1: 0.5797
 epoch: 14, train_loss: 0.8059, test_loss: 1.2123, test_f1: 0.4959
 epoch: 15, train_loss: 0.7798, test_loss: 0.9059, test_f1: 0.5488
 epoch: 16, train_loss: 0.7531, test_loss: 0.9523, test_f1: 0.5392
 epoch: 17, train_loss: 0.7702, test_loss: 0.9162, test_f1: 0.6067
 epoch: 18, train_loss: 0.7498, test_loss: 1.0038, test_f1: 0.5500
 epoch: 19, train_loss: 0.7222, test_loss: 1.0497, test_f1: 0.5001
 epoch: 20, train_loss: 0.7127, test_loss: 0.8613, test_f1: 0.6045
 epoch: 21, train_loss: 0.7053, test_loss: 1.0479, test_f1: 0.5713
 epoch: 22, train_loss: 0.7023, test_loss: 0.9883, test_f1: 0.5788
 epoch: 23, train_loss: 0.6748, test_loss: 0.7893, test_f1: 0.6044
 epoch: 24, train_loss: 0.6881, test_loss: 0.8748, test_f1: 0.5640
 epoch: 25, train_loss: 0.6976, test_loss: 1.0678, test_f1: 0.5351
 epoch: 26, train_loss: 0.6884, test_loss: 0.8506, test_f1: 0.5722
 epoch: 27, train_loss: 0.6441, test_loss: 0.7943, test_f1: 0.6389
 epoch: 28, train_loss: 0.6566, test_loss: 0.8706, test_f1: 0.5722
 epoch: 29, train_loss: 0.6430, test_loss: 0.8375, test_f1: 0.5932
 epoch: 30, train_loss: 0.6562, test_loss: 0.8638, test_f1: 0.5910
 epoch: 31, train_loss: 0.6404, test_loss: 0.7782, test_f1: 0.6317
 epoch: 32, train_loss: 0.6584, test_loss: 0.9116, test_f1: 0.5729
 epoch: 33, train_loss: 0.6152, test_loss: 0.7665, test_f1: 0.6448
 epoch: 34, train_loss: 0.6136, test_loss: 0.7784, test_f1: 0.6182
 epoch: 35, train_loss: 0.5987, test_loss: 0.8696, test_f1: 0.6401
 epoch: 36, train_loss: 0.6129, test_loss: 0.9631, test_f1: 0.6216
 epoch: 37, train_loss: 0.6039, test_loss: 0.7659, test_f1: 0.6510
 epoch: 38, train_loss: 0.6024, test_loss: 0.7774, test_f1: 0.6477
 epoch: 39, train_loss: 0.5831, test_loss: 0.8180, test_f1: 0.6276
 epoch: 40, train_loss: 0.5986, test_loss: 0.7405, test_f1: 0.6155
 epoch: 41, train_loss: 0.5927, test_loss: 1.0150, test_f1: 0.6247
 epoch: 42, train_loss: 0.5849, test_loss: 0.9481, test_f1: 0.6166
 epoch: 43, train_loss: 0.5659, test_loss: 0.9488, test_f1: 0.5986
 epoch: 44, train_loss: 0.5860, test_loss: 0.8674, test_f1: 0.6216
 epoch: 45, train_loss: 0.5864, test_loss: 0.7208, test_f1: 0.6852
 epoch: 46, train_loss: 0.5581, test_loss: 0.9211, test_f1: 0.6407
 epoch: 47, train_loss: 0.5237, test_loss: 0.9391, test_f1: 0.6545
 epoch: 48, train_loss: 0.5593, test_loss: 0.8975, test_f1: 0.5927
 epoch: 49, train_loss: 0.5476, test_loss: 0.9303, test_f1: 0.6409
 epoch: 50, train_loss: 0.5347, test_loss: 0.9135, test_f1: 0.6404
 epoch: 51, train_loss: 0.5123, test_loss: 0.9858, test_f1: 0.6302
 epoch: 52, train_loss: 0.4716, test_loss: 0.9221, test_f1: 0.6316
 epoch: 53, train_loss: 0.4473, test_loss: 1.0200, test_f1: 0.6862
 epoch: 54, train_loss: 0.4354, test_loss: 0.9998, test_f1: 0.6611
 epoch: 55, train_loss: 0.4294, test_loss: 0.9479, test_f1: 0.6593
 epoch: 56, train_loss: 0.4544, test_loss: 0.9542, test_f1: 0.6711
 epoch: 57, train_loss: 0.4281, test_loss: 1.0069, test_f1: 0.6436
 epoch: 58, train_loss: 0.4248, test_loss: 1.0458, test_f1: 0.6832
 epoch: 59, train_loss: 0.4374, test_loss: 0.9335, test_f1: 0.6828
 epoch: 60, train_loss: 0.4157, test_loss: 0.9219, test_f1: 0.6868
 epoch: 61, train_loss: 0.4320, test_loss: 0.9306, test_f1: 0.6799
 epoch: 62, train_loss: 0.4387, test_loss: 0.9842, test_f1: 0.6878
 epoch: 63, train_loss: 0.4006, test_loss: 0.9652, test_f1: 0.6753
 epoch: 64, train_loss: 0.3815, test_loss: 0.9073, test_f1: 0.7070
 epoch: 65, train_loss: 0.3797, test_loss: 1.0640, test_f1: 0.6743
 epoch: 66, train_loss: 0.4020, test_loss: 1.0957, test_f1: 0.6755
 epoch: 67, train_loss: 0.3897, test_loss: 1.0994, test_f1: 0.6568
 epoch: 68, train_loss: 0.4175, test_loss: 1.1142, test_f1: 0.6768
 epoch: 69, train_loss: 0.4085, test_loss: 0.9489, test_f1: 0.7171
 epoch: 70, train_loss: 0.3877, test_loss: 1.0224, test_f1: 0.6487
 epoch: 71, train_loss: 0.4028, test_loss: 1.0213, test_f1: 0.6730
 epoch: 72, train_loss: 0.3773, test_loss: 0.9921, test_f1: 0.6930
 epoch: 73, train_loss: 0.4097, test_loss: 1.0941, test_f1: 0.6746
 epoch: 74, train_loss: 0.3767, test_loss: 0.9626, test_f1: 0.6891
 epoch: 75, train_loss: 0.3542, test_loss: 1.0628, test_f1: 0.6827
 epoch: 76, train_loss: 0.3727, test_loss: 0.9688, test_f1: 0.6958
 epoch: 77, train_loss: 0.4093, test_loss: 0.9755, test_f1: 0.6608
 epoch: 78, train_loss: 0.3671, test_loss: 1.2066, test_f1: 0.6820
 epoch: 79, train_loss: 0.3582, test_loss: 1.1455, test_f1: 0.6967
 epoch: 80, train_loss: 0.3646, test_loss: 1.1151, test_f1: 0.6479
 epoch: 81, train_loss: 0.3663, test_loss: 0.9700, test_f1: 0.6645
 epoch: 82, train_loss: 0.3378, test_loss: 1.0152, test_f1: 0.6574
 epoch: 83, train_loss: 0.3721, test_loss: 1.3521, test_f1: 0.6952
 epoch: 84, train_loss: 0.3423, test_loss: 1.1058, test_f1: 0.6590
 epoch: 85, train_loss: 0.3582, test_loss: 1.0921, test_f1: 0.6743
 epoch: 86, train_loss: 0.3475, test_loss: 0.9680, test_f1: 0.7061
 epoch: 87, train_loss: 0.3277, test_loss: 0.9109, test_f1: 0.6966
 epoch: 88, train_loss: 0.3516, test_loss: 1.0207, test_f1: 0.6805
 epoch: 89, train_loss: 0.3143, test_loss: 0.9633, test_f1: 0.7055
 epoch: 90, train_loss: 0.3338, test_loss: 1.3788, test_f1: 0.6704
 epoch: 91, train_loss: 0.3442, test_loss: 1.0974, test_f1: 0.6715
 epoch: 92, train_loss: 0.3255, test_loss: 1.1013, test_f1: 0.6752
 epoch: 93, train_loss: 0.3181, test_loss: 1.2708, test_f1: 0.6787
 epoch: 94, train_loss: 0.3020, test_loss: 1.2161, test_f1: 0.6823
 epoch: 95, train_loss: 0.3145, test_loss: 1.5009, test_f1: 0.6680
 epoch: 96, train_loss: 0.3287, test_loss: 1.1703, test_f1: 0.6734
 epoch: 97, train_loss: 0.2989, test_loss: 1.2244, test_f1: 0.6498
 epoch: 98, train_loss: 0.3122, test_loss: 0.9758, test_f1: 0.6711
 epoch: 99, train_loss: 0.3139, test_loss: 1.0290, test_f1: 0.6801
##################ITERATION #8 ****************************************
 epoch: 0, train_loss: 1.4254, test_loss: 1.1340, test_f1: 0.3929
 epoch: 1, train_loss: 1.0093, test_loss: 1.0240, test_f1: 0.4828
 epoch: 2, train_loss: 0.9692, test_loss: 1.0704, test_f1: 0.4511
 epoch: 3, train_loss: 0.9410, test_loss: 1.0159, test_f1: 0.4550
 epoch: 4, train_loss: 0.9501, test_loss: 0.9323, test_f1: 0.4843
 epoch: 5, train_loss: 0.9548, test_loss: 0.9775, test_f1: 0.5020
 epoch: 6, train_loss: 0.9109, test_loss: 0.9494, test_f1: 0.5213
 epoch: 7, train_loss: 0.8939, test_loss: 0.9388, test_f1: 0.5382
 epoch: 8, train_loss: 0.8768, test_loss: 1.0064, test_f1: 0.4558
 epoch: 9, train_loss: 0.8647, test_loss: 0.9733, test_f1: 0.4870
 epoch: 10, train_loss: 0.8712, test_loss: 0.9678, test_f1: 0.5189
 epoch: 11, train_loss: 0.8713, test_loss: 0.9528, test_f1: 0.5405
 epoch: 12, train_loss: 0.8485, test_loss: 0.9447, test_f1: 0.4891
 epoch: 13, train_loss: 0.8203, test_loss: 0.8617, test_f1: 0.5547
 epoch: 14, train_loss: 0.8187, test_loss: 0.9534, test_f1: 0.5169
 epoch: 15, train_loss: 0.8180, test_loss: 0.9388, test_f1: 0.5191
 epoch: 16, train_loss: 0.8010, test_loss: 0.9713, test_f1: 0.4775
 epoch: 17, train_loss: 0.7843, test_loss: 0.9359, test_f1: 0.4891
 epoch: 18, train_loss: 0.7684, test_loss: 0.8933, test_f1: 0.5977
 epoch: 19, train_loss: 0.7744, test_loss: 0.9642, test_f1: 0.4989
 epoch: 20, train_loss: 0.7645, test_loss: 0.9041, test_f1: 0.5273
 epoch: 21, train_loss: 0.7723, test_loss: 0.8898, test_f1: 0.5910
 epoch: 22, train_loss: 0.7181, test_loss: 0.8094, test_f1: 0.5744
 epoch: 23, train_loss: 0.7442, test_loss: 0.9955, test_f1: 0.5409
 epoch: 24, train_loss: 0.7348, test_loss: 0.8832, test_f1: 0.6090
 epoch: 25, train_loss: 0.7175, test_loss: 0.9277, test_f1: 0.5759
 epoch: 26, train_loss: 0.7288, test_loss: 0.9161, test_f1: 0.6088
 epoch: 27, train_loss: 0.7052, test_loss: 1.0335, test_f1: 0.5169
 epoch: 28, train_loss: 0.7095, test_loss: 0.9342, test_f1: 0.5717
 epoch: 29, train_loss: 0.7041, test_loss: 0.8848, test_f1: 0.5551
 epoch: 30, train_loss: 0.7207, test_loss: 0.8897, test_f1: 0.5700
 epoch: 31, train_loss: 0.6937, test_loss: 0.8803, test_f1: 0.5943
 epoch: 32, train_loss: 0.6625, test_loss: 0.8470, test_f1: 0.5954
 epoch: 33, train_loss: 0.6879, test_loss: 1.2161, test_f1: 0.5060
 epoch: 34, train_loss: 0.6732, test_loss: 0.8357, test_f1: 0.5717
 epoch: 35, train_loss: 0.7150, test_loss: 0.8714, test_f1: 0.6176
 epoch: 36, train_loss: 0.6883, test_loss: 0.8924, test_f1: 0.5858
 epoch: 37, train_loss: 0.6472, test_loss: 0.8847, test_f1: 0.6245
 epoch: 38, train_loss: 0.6507, test_loss: 0.7840, test_f1: 0.6421
 epoch: 39, train_loss: 0.6261, test_loss: 0.8865, test_f1: 0.5866
 epoch: 40, train_loss: 0.6420, test_loss: 0.9196, test_f1: 0.6314
 epoch: 41, train_loss: 0.6220, test_loss: 0.8528, test_f1: 0.6357
 epoch: 42, train_loss: 0.6028, test_loss: 0.8851, test_f1: 0.5689
 epoch: 43, train_loss: 0.6368, test_loss: 0.8005, test_f1: 0.6344
 epoch: 44, train_loss: 0.5999, test_loss: 0.7813, test_f1: 0.6411
 epoch: 45, train_loss: 0.6014, test_loss: 0.8880, test_f1: 0.6521
 epoch: 46, train_loss: 0.6078, test_loss: 1.0038, test_f1: 0.6032
 epoch: 47, train_loss: 0.5982, test_loss: 0.7991, test_f1: 0.6368
 epoch: 48, train_loss: 0.5934, test_loss: 1.0846, test_f1: 0.6424
 epoch: 49, train_loss: 0.5840, test_loss: 0.8651, test_f1: 0.6358
 epoch: 50, train_loss: 0.5653, test_loss: 1.1122, test_f1: 0.6117
 epoch: 51, train_loss: 0.5235, test_loss: 0.9926, test_f1: 0.6294
 epoch: 52, train_loss: 0.4808, test_loss: 0.8585, test_f1: 0.6757
 epoch: 53, train_loss: 0.4797, test_loss: 0.7857, test_f1: 0.6779
 epoch: 54, train_loss: 0.4568, test_loss: 0.8686, test_f1: 0.6741
 epoch: 55, train_loss: 0.4675, test_loss: 0.9604, test_f1: 0.6295
 epoch: 56, train_loss: 0.4798, test_loss: 0.8409, test_f1: 0.6662
 epoch: 57, train_loss: 0.4503, test_loss: 0.8722, test_f1: 0.6835
 epoch: 58, train_loss: 0.4602, test_loss: 0.9547, test_f1: 0.6545
 epoch: 59, train_loss: 0.4568, test_loss: 1.1662, test_f1: 0.6303
 epoch: 60, train_loss: 0.4452, test_loss: 0.8092, test_f1: 0.6761
 epoch: 61, train_loss: 0.4464, test_loss: 1.1851, test_f1: 0.6634
 epoch: 62, train_loss: 0.4452, test_loss: 1.0334, test_f1: 0.6500
 epoch: 63, train_loss: 0.4258, test_loss: 0.9297, test_f1: 0.6792
 epoch: 64, train_loss: 0.4376, test_loss: 0.9514, test_f1: 0.6295
 epoch: 65, train_loss: 0.4259, test_loss: 0.9162, test_f1: 0.6931
 epoch: 66, train_loss: 0.4327, test_loss: 0.9205, test_f1: 0.6643
 epoch: 67, train_loss: 0.4098, test_loss: 1.1345, test_f1: 0.6854
 epoch: 68, train_loss: 0.4060, test_loss: 1.0317, test_f1: 0.6490
 epoch: 69, train_loss: 0.3941, test_loss: 1.3320, test_f1: 0.6384
 epoch: 70, train_loss: 0.3945, test_loss: 1.1697, test_f1: 0.6580
 epoch: 71, train_loss: 0.3839, test_loss: 1.0207, test_f1: 0.6487
 epoch: 72, train_loss: 0.3763, test_loss: 1.2899, test_f1: 0.6638
 epoch: 73, train_loss: 0.3817, test_loss: 0.9604, test_f1: 0.6685
 epoch: 74, train_loss: 0.3837, test_loss: 0.9844, test_f1: 0.6623
 epoch: 75, train_loss: 0.3895, test_loss: 1.2782, test_f1: 0.6245
 epoch: 76, train_loss: 0.3963, test_loss: 0.9973, test_f1: 0.6571
 epoch: 77, train_loss: 0.3968, test_loss: 0.9032, test_f1: 0.6813
 epoch: 78, train_loss: 0.4130, test_loss: 1.3162, test_f1: 0.6406
 epoch: 79, train_loss: 0.4040, test_loss: 1.0268, test_f1: 0.6584
 epoch: 80, train_loss: 0.3714, test_loss: 1.3203, test_f1: 0.6178
 epoch: 81, train_loss: 0.3660, test_loss: 1.1674, test_f1: 0.6725
 epoch: 82, train_loss: 0.3621, test_loss: 1.1945, test_f1: 0.6632
 epoch: 83, train_loss: 0.3636, test_loss: 1.1342, test_f1: 0.6488
 epoch: 84, train_loss: 0.3553, test_loss: 1.2159, test_f1: 0.6576
 epoch: 85, train_loss: 0.3311, test_loss: 1.5461, test_f1: 0.6729
 epoch: 86, train_loss: 0.3527, test_loss: 1.1329, test_f1: 0.6474
 epoch: 87, train_loss: 0.3273, test_loss: 1.1095, test_f1: 0.6559
 epoch: 88, train_loss: 0.3368, test_loss: 1.3778, test_f1: 0.6415
 epoch: 89, train_loss: 0.3380, test_loss: 1.3272, test_f1: 0.6530
 epoch: 90, train_loss: 0.3738, test_loss: 1.4532, test_f1: 0.6270
 epoch: 91, train_loss: 0.3596, test_loss: 1.0949, test_f1: 0.6602
 epoch: 92, train_loss: 0.3477, test_loss: 1.2885, test_f1: 0.6216
 epoch: 93, train_loss: 0.3154, test_loss: 1.0525, test_f1: 0.6566
 epoch: 94, train_loss: 0.3471, test_loss: 1.3282, test_f1: 0.6683
 epoch: 95, train_loss: 0.3490, test_loss: 1.2358, test_f1: 0.6339
 epoch: 96, train_loss: 0.3253, test_loss: 1.1761, test_f1: 0.6063
 epoch: 97, train_loss: 0.3392, test_loss: 1.3003, test_f1: 0.6097
 epoch: 98, train_loss: 0.3102, test_loss: 1.2743, test_f1: 0.6351
 epoch: 99, train_loss: 0.3240, test_loss: 1.1163, test_f1: 0.6524
##################ITERATION #9 ****************************************
 epoch: 0, train_loss: 1.2670, test_loss: 1.1007, test_f1: 0.4428
 epoch: 1, train_loss: 1.0005, test_loss: 0.9432, test_f1: 0.4744
 epoch: 2, train_loss: 0.9639, test_loss: 0.9919, test_f1: 0.4823
 epoch: 3, train_loss: 0.9393, test_loss: 0.9335, test_f1: 0.5029
 epoch: 4, train_loss: 0.9110, test_loss: 0.9130, test_f1: 0.4978
 epoch: 5, train_loss: 0.8947, test_loss: 0.8977, test_f1: 0.5274
 epoch: 6, train_loss: 0.8813, test_loss: 0.8565, test_f1: 0.5478
 epoch: 7, train_loss: 0.8633, test_loss: 0.9272, test_f1: 0.5370
 epoch: 8, train_loss: 0.8297, test_loss: 0.8614, test_f1: 0.5927
 epoch: 9, train_loss: 0.8319, test_loss: 0.8275, test_f1: 0.5108
 epoch: 10, train_loss: 0.8284, test_loss: 0.8480, test_f1: 0.5557
 epoch: 11, train_loss: 0.8076, test_loss: 0.9641, test_f1: 0.5004
 epoch: 12, train_loss: 0.7953, test_loss: 0.9135, test_f1: 0.5667
 epoch: 13, train_loss: 0.7871, test_loss: 0.9471, test_f1: 0.5620
 epoch: 14, train_loss: 0.7752, test_loss: 1.1401, test_f1: 0.5368
 epoch: 15, train_loss: 0.7383, test_loss: 0.8545, test_f1: 0.5879
 epoch: 16, train_loss: 0.7556, test_loss: 0.9995, test_f1: 0.5148
 epoch: 17, train_loss: 0.7819, test_loss: 0.8101, test_f1: 0.6204
 epoch: 18, train_loss: 0.7498, test_loss: 0.8831, test_f1: 0.5503
 epoch: 19, train_loss: 0.7113, test_loss: 0.7630, test_f1: 0.6202
 epoch: 20, train_loss: 0.7046, test_loss: 0.8902, test_f1: 0.5659
 epoch: 21, train_loss: 0.7174, test_loss: 1.0054, test_f1: 0.5047
 epoch: 22, train_loss: 0.7062, test_loss: 0.8283, test_f1: 0.6446
 epoch: 23, train_loss: 0.6723, test_loss: 0.8983, test_f1: 0.6213
 epoch: 24, train_loss: 0.6947, test_loss: 0.8748, test_f1: 0.6032
 epoch: 25, train_loss: 0.6763, test_loss: 0.7132, test_f1: 0.6560
 epoch: 26, train_loss: 0.6614, test_loss: 0.7918, test_f1: 0.6055
 epoch: 27, train_loss: 0.6592, test_loss: 0.7223, test_f1: 0.6748
 epoch: 28, train_loss: 0.6518, test_loss: 0.8802, test_f1: 0.6153
 epoch: 29, train_loss: 0.6362, test_loss: 0.7247, test_f1: 0.6612
 epoch: 30, train_loss: 0.6290, test_loss: 0.9588, test_f1: 0.5515
 epoch: 31, train_loss: 0.6425, test_loss: 0.8328, test_f1: 0.5992
 epoch: 32, train_loss: 0.6339, test_loss: 0.7634, test_f1: 0.6435
 epoch: 33, train_loss: 0.6048, test_loss: 0.7428, test_f1: 0.6775
 epoch: 34, train_loss: 0.6234, test_loss: 0.9655, test_f1: 0.6097
 epoch: 35, train_loss: 0.6374, test_loss: 0.8488, test_f1: 0.6390
 epoch: 36, train_loss: 0.5897, test_loss: 0.7841, test_f1: 0.6514
 epoch: 37, train_loss: 0.5895, test_loss: 1.1413, test_f1: 0.5703
 epoch: 38, train_loss: 0.5818, test_loss: 0.8326, test_f1: 0.6502
 epoch: 39, train_loss: 0.6078, test_loss: 0.9540, test_f1: 0.6047
 epoch: 40, train_loss: 0.5724, test_loss: 0.8104, test_f1: 0.6572
 epoch: 41, train_loss: 0.5908, test_loss: 1.1593, test_f1: 0.5439
 epoch: 42, train_loss: 0.5722, test_loss: 0.7421, test_f1: 0.6794
 epoch: 43, train_loss: 0.5499, test_loss: 0.7989, test_f1: 0.6804
 epoch: 44, train_loss: 0.5659, test_loss: 0.7798, test_f1: 0.6331
 epoch: 45, train_loss: 0.5808, test_loss: 0.7934, test_f1: 0.6446
 epoch: 46, train_loss: 0.5646, test_loss: 0.7500, test_f1: 0.6859
 epoch: 47, train_loss: 0.5444, test_loss: 0.7459, test_f1: 0.6710
 epoch: 48, train_loss: 0.5233, test_loss: 0.7834, test_f1: 0.6990
 epoch: 49, train_loss: 0.5451, test_loss: 0.7833, test_f1: 0.6218
 epoch: 50, train_loss: 0.5443, test_loss: 0.6755, test_f1: 0.6886
 epoch: 51, train_loss: 0.5057, test_loss: 0.7433, test_f1: 0.6887
 epoch: 52, train_loss: 0.4613, test_loss: 0.7051, test_f1: 0.7126
 epoch: 53, train_loss: 0.4416, test_loss: 0.6890, test_f1: 0.7280
 epoch: 54, train_loss: 0.4352, test_loss: 0.7173, test_f1: 0.7327
 epoch: 55, train_loss: 0.4332, test_loss: 0.8815, test_f1: 0.6933
 epoch: 56, train_loss: 0.4202, test_loss: 0.6691, test_f1: 0.7164
 epoch: 57, train_loss: 0.4189, test_loss: 0.7933, test_f1: 0.7228
 epoch: 58, train_loss: 0.4296, test_loss: 0.7849, test_f1: 0.6972
 epoch: 59, train_loss: 0.4220, test_loss: 0.7279, test_f1: 0.7212
 epoch: 60, train_loss: 0.3973, test_loss: 0.7516, test_f1: 0.7341
 epoch: 61, train_loss: 0.4137, test_loss: 0.7055, test_f1: 0.7375
 epoch: 62, train_loss: 0.3928, test_loss: 0.6701, test_f1: 0.7332
 epoch: 63, train_loss: 0.4110, test_loss: 0.7999, test_f1: 0.6735
 epoch: 64, train_loss: 0.3911, test_loss: 0.8357, test_f1: 0.6755
 epoch: 65, train_loss: 0.4086, test_loss: 0.7420, test_f1: 0.6817
 epoch: 66, train_loss: 0.3878, test_loss: 0.9154, test_f1: 0.6861
 epoch: 67, train_loss: 0.3832, test_loss: 0.7924, test_f1: 0.7449
 epoch: 68, train_loss: 0.3821, test_loss: 0.8480, test_f1: 0.7061
 epoch: 69, train_loss: 0.3624, test_loss: 0.7915, test_f1: 0.7289
 epoch: 70, train_loss: 0.3728, test_loss: 0.8838, test_f1: 0.6969
 epoch: 71, train_loss: 0.3631, test_loss: 0.8621, test_f1: 0.6892
 epoch: 72, train_loss: 0.3799, test_loss: 0.9063, test_f1: 0.6735
 epoch: 73, train_loss: 0.3803, test_loss: 0.7063, test_f1: 0.7516
 epoch: 74, train_loss: 0.3590, test_loss: 0.8705, test_f1: 0.7159
 epoch: 75, train_loss: 0.3649, test_loss: 0.8529, test_f1: 0.7086
 epoch: 76, train_loss: 0.3575, test_loss: 0.9728, test_f1: 0.6808
 epoch: 77, train_loss: 0.3541, test_loss: 0.8356, test_f1: 0.7093
 epoch: 78, train_loss: 0.3338, test_loss: 0.8237, test_f1: 0.6921
 epoch: 79, train_loss: 0.3631, test_loss: 0.8274, test_f1: 0.6933
 epoch: 80, train_loss: 0.3370, test_loss: 0.8346, test_f1: 0.7171
 epoch: 81, train_loss: 0.3348, test_loss: 0.8559, test_f1: 0.6849
 epoch: 82, train_loss: 0.3172, test_loss: 0.8672, test_f1: 0.6939
 epoch: 83, train_loss: 0.3199, test_loss: 0.8249, test_f1: 0.7169
 epoch: 84, train_loss: 0.3462, test_loss: 0.8487, test_f1: 0.7173
 epoch: 85, train_loss: 0.3200, test_loss: 0.9494, test_f1: 0.6728
 epoch: 86, train_loss: 0.3369, test_loss: 0.8390, test_f1: 0.7049
 epoch: 87, train_loss: 0.3063, test_loss: 0.9222, test_f1: 0.6937
 epoch: 88, train_loss: 0.3398, test_loss: 0.8918, test_f1: 0.7012
 epoch: 89, train_loss: 0.3260, test_loss: 0.9973, test_f1: 0.6735
 epoch: 90, train_loss: 0.3074, test_loss: 0.8117, test_f1: 0.7170
 epoch: 91, train_loss: 0.3173, test_loss: 0.9697, test_f1: 0.7029
 epoch: 92, train_loss: 0.3221, test_loss: 0.9045, test_f1: 0.6772
 epoch: 93, train_loss: 0.3109, test_loss: 0.9413, test_f1: 0.6590
 epoch: 94, train_loss: 0.2847, test_loss: 0.9403, test_f1: 0.7243
 epoch: 95, train_loss: 0.3039, test_loss: 0.9846, test_f1: 0.7222
 epoch: 96, train_loss: 0.3154, test_loss: 0.9524, test_f1: 0.6872
 epoch: 97, train_loss: 0.2978, test_loss: 0.8240, test_f1: 0.7142
 epoch: 98, train_loss: 0.3050, test_loss: 1.0875, test_f1: 0.6832
 epoch: 99, train_loss: 0.2902, test_loss: 1.0480, test_f1: 0.7251

Training completed in 608.73 seconds
Best F1: 0.7516 at epoch 73
Mean F1 across iterations: 0.7030  0.0193
========================FINAL RESULTS================================
FEGIN weighted F1: 0.7516  0.0193
python main.py --data ltspice_examples --representation component_pin_net --model FEGIN --layers 6 --hiddens 128 --batch_size 128 --lr 0.01 --emb_size 250 --epochs 100 --save_appendix component_pin_net_L6_H128_BS128_LR0.01_E250 --no_val
-----



STDERR:
  File "main.py", line 370, in <module>
    main()
  File "main.py", line 254, in main
    dataset = dataset_class(
  File "/home/philip/projects/ltspice_examples_code_repo/Circuit-Completion-Using-GNNs/component_classification_with_link_prediction_head/evaluation/FEGIN/kernel/circuit_datasets.py", line 15, in __init__
    self.data, self.slices = torch.load(self.processed_paths[0])
  File "/home/philip/.local/lib/python3.8/site-packages/torch/serialization.py", line 1040, in load
    warnings.warn(
  File "/usr/lib/python3.8/warnings.py", line 109, in _showwarnmsg
    sw(msg.message, msg.category, msg.filename, msg.lineno,
  File "main.py", line 47, in warn_with_traceback
    traceback.print_stack(file=log)
/home/philip/projects/ltspice_examples_code_repo/Circuit-Completion-Using-GNNs/component_classification_with_link_prediction_head/evaluation/FEGIN/kernel/circuit_datasets.py:15: FutureWarning: You are using `torch.load` with `weights_only=False` (the current default value), which uses the default pickle module implicitly. It is possible to construct malicious pickle data which will execute arbitrary code during unpickling (See https://github.com/pytorch/pytorch/blob/main/SECURITY.md#untrusted-models for more details). In a future release, the default value for `weights_only` will be flipped to `True`. This limits the functions that could be executed during unpickling. Arbitrary objects will no longer be allowed to be loaded via this mode unless they are explicitly allowlisted by the user via `torch.serialization.add_safe_globals`. We recommend you start setting `weights_only=True` for any use case where you don't have full control of the loaded file. Please open an issue on GitHub for any issues related to this experimental feature.
  self.data, self.slices = torch.load(self.processed_paths[0])
