STDOUT:
Results will be saved in /home/philip/projects/ltspice_examples_code_repo/Circuit-Completion-Using-GNNs/component_classification_with_link_prediction_head/evaluation/FEGIN/results/model_FEGIN_dataset_ltspice_demos
Command line input: python main.py --data ltspice_demos --representation component_component --model FEGIN --layers 6 --hiddens 64 --batch_size 64 --lr 0.001 --emb_size 512 --epochs 100 --save_appendix component_component_L6_H64_BS64_LR0.001_E512 --no_val
 is saved.
-----
ltspice_demos - FEGIN
Using 6 layers, 64 hidden units, h = 2
Loading component_component representation dataset
ENTERED
Training FEGIN on component_component representation
Train: 1565, Test: 383
##################ITERATION #0 ****************************************
 epoch: 0, train_loss: 1.2765, test_loss: 1.2995, test_f1: 0.2281
 epoch: 1, train_loss: 1.1922, test_loss: 1.2501, test_f1: 0.3550
 epoch: 2, train_loss: 1.1539, test_loss: 1.2256, test_f1: 0.3743
 epoch: 3, train_loss: 1.1059, test_loss: 1.2499, test_f1: 0.3875
 epoch: 4, train_loss: 1.0800, test_loss: 1.1971, test_f1: 0.4725
 epoch: 5, train_loss: 1.0270, test_loss: 1.2174, test_f1: 0.4110
 epoch: 6, train_loss: 0.9929, test_loss: 1.1996, test_f1: 0.3764
 epoch: 7, train_loss: 0.9589, test_loss: 1.2412, test_f1: 0.4185
 epoch: 8, train_loss: 0.9328, test_loss: 1.3183, test_f1: 0.4662
 epoch: 9, train_loss: 0.8768, test_loss: 1.1969, test_f1: 0.5259
 epoch: 10, train_loss: 0.8838, test_loss: 1.1714, test_f1: 0.4916
 epoch: 11, train_loss: 0.8550, test_loss: 1.3219, test_f1: 0.4903
 epoch: 12, train_loss: 0.8534, test_loss: 1.2592, test_f1: 0.5446
 epoch: 13, train_loss: 0.8419, test_loss: 1.2492, test_f1: 0.5630
 epoch: 14, train_loss: 0.7967, test_loss: 1.1905, test_f1: 0.5588
 epoch: 15, train_loss: 0.7860, test_loss: 1.3009, test_f1: 0.5023
 epoch: 16, train_loss: 0.7609, test_loss: 1.4141, test_f1: 0.5075
 epoch: 17, train_loss: 0.7534, test_loss: 1.5643, test_f1: 0.5406
 epoch: 18, train_loss: 0.7472, test_loss: 2.1304, test_f1: 0.5247
 epoch: 19, train_loss: 0.7426, test_loss: 1.4539, test_f1: 0.5438
 epoch: 20, train_loss: 0.7173, test_loss: 1.3501, test_f1: 0.5605
 epoch: 21, train_loss: 0.6753, test_loss: 1.3839, test_f1: 0.5282
 epoch: 22, train_loss: 0.7060, test_loss: 1.5088, test_f1: 0.5169
 epoch: 23, train_loss: 0.6903, test_loss: 1.3748, test_f1: 0.5448
 epoch: 24, train_loss: 0.6544, test_loss: 1.4988, test_f1: 0.5235
 epoch: 25, train_loss: 0.6578, test_loss: 1.6933, test_f1: 0.4726
 epoch: 26, train_loss: 0.6230, test_loss: 1.7253, test_f1: 0.5443
 epoch: 27, train_loss: 0.6494, test_loss: 1.5832, test_f1: 0.4661
 epoch: 28, train_loss: 0.6411, test_loss: 1.6466, test_f1: 0.5221
 epoch: 29, train_loss: 0.6046, test_loss: 1.6724, test_f1: 0.4594
 epoch: 30, train_loss: 0.5989, test_loss: 1.5734, test_f1: 0.4628
 epoch: 31, train_loss: 0.5770, test_loss: 1.5539, test_f1: 0.5426
 epoch: 32, train_loss: 0.6150, test_loss: 1.7513, test_f1: 0.5168
 epoch: 33, train_loss: 0.5600, test_loss: 1.7197, test_f1: 0.4844
 epoch: 34, train_loss: 0.5727, test_loss: 1.7925, test_f1: 0.5489
 epoch: 35, train_loss: 0.5794, test_loss: 1.8941, test_f1: 0.4625
 epoch: 36, train_loss: 0.5898, test_loss: 1.8395, test_f1: 0.5199
 epoch: 37, train_loss: 0.5449, test_loss: 1.5982, test_f1: 0.5244
 epoch: 38, train_loss: 0.5481, test_loss: 1.7105, test_f1: 0.5023
 epoch: 39, train_loss: 0.5156, test_loss: 1.6328, test_f1: 0.5249
 epoch: 40, train_loss: 0.5192, test_loss: 1.8529, test_f1: 0.5207
 epoch: 41, train_loss: 0.5438, test_loss: 2.0656, test_f1: 0.5043
 epoch: 42, train_loss: 0.5494, test_loss: 1.9426, test_f1: 0.4811
 epoch: 43, train_loss: 0.5301, test_loss: 2.7249, test_f1: 0.4192
 epoch: 44, train_loss: 0.5219, test_loss: 1.9393, test_f1: 0.4778
 epoch: 45, train_loss: 0.4876, test_loss: 1.8633, test_f1: 0.5539
 epoch: 46, train_loss: 0.5000, test_loss: 1.7927, test_f1: 0.5261
 epoch: 47, train_loss: 0.5006, test_loss: 1.9394, test_f1: 0.5545
 epoch: 48, train_loss: 0.4818, test_loss: 2.0709, test_f1: 0.5746
 epoch: 49, train_loss: 0.4739, test_loss: 2.0129, test_f1: 0.5208
 epoch: 50, train_loss: 0.4925, test_loss: 2.0094, test_f1: 0.5411
 epoch: 51, train_loss: 0.4374, test_loss: 1.8822, test_f1: 0.5299
 epoch: 52, train_loss: 0.4289, test_loss: 1.8569, test_f1: 0.5388
 epoch: 53, train_loss: 0.4087, test_loss: 2.0812, test_f1: 0.5378
 epoch: 54, train_loss: 0.3960, test_loss: 1.8723, test_f1: 0.5693
 epoch: 55, train_loss: 0.3672, test_loss: 1.9193, test_f1: 0.5508
 epoch: 56, train_loss: 0.3611, test_loss: 2.0996, test_f1: 0.4824
 epoch: 57, train_loss: 0.3662, test_loss: 2.1471, test_f1: 0.5541
 epoch: 58, train_loss: 0.3762, test_loss: 2.0246, test_f1: 0.5580
 epoch: 59, train_loss: 0.3604, test_loss: 1.9764, test_f1: 0.5303
 epoch: 60, train_loss: 0.3653, test_loss: 1.9774, test_f1: 0.5679
 epoch: 61, train_loss: 0.3755, test_loss: 2.1463, test_f1: 0.5708
 epoch: 62, train_loss: 0.3524, test_loss: 2.1661, test_f1: 0.5591
 epoch: 63, train_loss: 0.3636, test_loss: 2.4490, test_f1: 0.4985
 epoch: 64, train_loss: 0.3321, test_loss: 2.1555, test_f1: 0.5418
 epoch: 65, train_loss: 0.3147, test_loss: 2.2741, test_f1: 0.5124
 epoch: 66, train_loss: 0.3153, test_loss: 2.4221, test_f1: 0.5458
 epoch: 67, train_loss: 0.3800, test_loss: 2.2095, test_f1: 0.5623
 epoch: 68, train_loss: 0.3717, test_loss: 2.2891, test_f1: 0.5632
 epoch: 69, train_loss: 0.3532, test_loss: 2.4264, test_f1: 0.5264
 epoch: 70, train_loss: 0.3581, test_loss: 2.3375, test_f1: 0.5506
 epoch: 71, train_loss: 0.3167, test_loss: 2.4931, test_f1: 0.5206
 epoch: 72, train_loss: 0.3158, test_loss: 2.4605, test_f1: 0.5693
 epoch: 73, train_loss: 0.3032, test_loss: 2.5394, test_f1: 0.5548
 epoch: 74, train_loss: 0.3141, test_loss: 2.5152, test_f1: 0.5167
 epoch: 75, train_loss: 0.3042, test_loss: 2.6779, test_f1: 0.5302
 epoch: 76, train_loss: 0.2962, test_loss: 2.5005, test_f1: 0.5460
 epoch: 77, train_loss: 0.3266, test_loss: 2.4705, test_f1: 0.5454
 epoch: 78, train_loss: 0.2961, test_loss: 2.6274, test_f1: 0.5501
 epoch: 79, train_loss: 0.3100, test_loss: 2.4420, test_f1: 0.5541
 epoch: 80, train_loss: 0.2837, test_loss: 2.6071, test_f1: 0.5650
 epoch: 81, train_loss: 0.2907, test_loss: 2.7166, test_f1: 0.5407
 epoch: 82, train_loss: 0.2951, test_loss: 2.4118, test_f1: 0.5648
 epoch: 83, train_loss: 0.2635, test_loss: 2.7936, test_f1: 0.5547
 epoch: 84, train_loss: 0.2784, test_loss: 2.7965, test_f1: 0.5688
 epoch: 85, train_loss: 0.2946, test_loss: 2.6561, test_f1: 0.5541
 epoch: 86, train_loss: 0.2923, test_loss: 3.0083, test_f1: 0.5301
 epoch: 87, train_loss: 0.2642, test_loss: 2.7391, test_f1: 0.5029
 epoch: 88, train_loss: 0.2889, test_loss: 2.7186, test_f1: 0.5210
 epoch: 89, train_loss: 0.2818, test_loss: 3.0246, test_f1: 0.5085
 epoch: 90, train_loss: 0.2670, test_loss: 2.7098, test_f1: 0.5589
 epoch: 91, train_loss: 0.2725, test_loss: 2.6103, test_f1: 0.5744
 epoch: 92, train_loss: 0.2577, test_loss: 2.6211, test_f1: 0.5350
 epoch: 93, train_loss: 0.2664, test_loss: 2.6114, test_f1: 0.5738
 epoch: 94, train_loss: 0.2508, test_loss: 2.6978, test_f1: 0.5791
 epoch: 95, train_loss: 0.2348, test_loss: 2.8668, test_f1: 0.5837
 epoch: 96, train_loss: 0.2570, test_loss: 3.0082, test_f1: 0.5398
 epoch: 97, train_loss: 0.2498, test_loss: 2.7364, test_f1: 0.5553
 epoch: 98, train_loss: 0.2656, test_loss: 2.5136, test_f1: 0.5472
 epoch: 99, train_loss: 0.2666, test_loss: 2.5878, test_f1: 0.5800
##################ITERATION #1 ****************************************
 epoch: 0, train_loss: 1.2306, test_loss: 1.2802, test_f1: 0.3210
 epoch: 1, train_loss: 1.1212, test_loss: 1.1981, test_f1: 0.4434
 epoch: 2, train_loss: 1.0485, test_loss: 1.1769, test_f1: 0.5148
 epoch: 3, train_loss: 0.9997, test_loss: 1.1200, test_f1: 0.5011
 epoch: 4, train_loss: 0.9740, test_loss: 1.2132, test_f1: 0.4295
 epoch: 5, train_loss: 0.9288, test_loss: 1.4783, test_f1: 0.5242
 epoch: 6, train_loss: 0.9012, test_loss: 1.2400, test_f1: 0.5570
 epoch: 7, train_loss: 0.8962, test_loss: 1.3229, test_f1: 0.5224
 epoch: 8, train_loss: 0.8653, test_loss: 1.1140, test_f1: 0.5445
 epoch: 9, train_loss: 0.8349, test_loss: 1.3107, test_f1: 0.5332
 epoch: 10, train_loss: 0.8194, test_loss: 1.2534, test_f1: 0.5709
 epoch: 11, train_loss: 0.7987, test_loss: 1.5561, test_f1: 0.5678
 epoch: 12, train_loss: 0.7864, test_loss: 1.3267, test_f1: 0.5807
 epoch: 13, train_loss: 0.7739, test_loss: 1.3201, test_f1: 0.5148
 epoch: 14, train_loss: 0.7709, test_loss: 1.5732, test_f1: 0.5499
 epoch: 15, train_loss: 0.7888, test_loss: 1.5215, test_f1: 0.5609
 epoch: 16, train_loss: 0.7249, test_loss: 1.2228, test_f1: 0.5550
 epoch: 17, train_loss: 0.7507, test_loss: 1.2793, test_f1: 0.5549
 epoch: 18, train_loss: 0.7223, test_loss: 1.3425, test_f1: 0.5681
 epoch: 19, train_loss: 0.7587, test_loss: 1.3728, test_f1: 0.5612
 epoch: 20, train_loss: 0.6883, test_loss: 1.3175, test_f1: 0.5607
 epoch: 21, train_loss: 0.6966, test_loss: 1.4655, test_f1: 0.4717
 epoch: 22, train_loss: 0.7030, test_loss: 1.2830, test_f1: 0.5661
 epoch: 23, train_loss: 0.6631, test_loss: 1.3813, test_f1: 0.5564
 epoch: 24, train_loss: 0.6444, test_loss: 1.4279, test_f1: 0.5536
 epoch: 25, train_loss: 0.6440, test_loss: 1.4104, test_f1: 0.5697
 epoch: 26, train_loss: 0.6249, test_loss: 1.4318, test_f1: 0.5689
 epoch: 27, train_loss: 0.6236, test_loss: 1.6049, test_f1: 0.5423
 epoch: 28, train_loss: 0.6065, test_loss: 1.6356, test_f1: 0.5933
 epoch: 29, train_loss: 0.6464, test_loss: 1.7054, test_f1: 0.5054
 epoch: 30, train_loss: 0.6503, test_loss: 1.4344, test_f1: 0.5894
 epoch: 31, train_loss: 0.6322, test_loss: 1.4227, test_f1: 0.6026
 epoch: 32, train_loss: 0.5978, test_loss: 1.8305, test_f1: 0.5425
 epoch: 33, train_loss: 0.5983, test_loss: 1.5775, test_f1: 0.5970
 epoch: 34, train_loss: 0.5723, test_loss: 1.8899, test_f1: 0.5638
 epoch: 35, train_loss: 0.5842, test_loss: 1.8707, test_f1: 0.5571
 epoch: 36, train_loss: 0.5636, test_loss: 2.1344, test_f1: 0.5676
 epoch: 37, train_loss: 0.5731, test_loss: 1.6541, test_f1: 0.6197
 epoch: 38, train_loss: 0.5448, test_loss: 2.1934, test_f1: 0.5381
 epoch: 39, train_loss: 0.5143, test_loss: 1.7599, test_f1: 0.5772
 epoch: 40, train_loss: 0.5080, test_loss: 1.9402, test_f1: 0.5720
 epoch: 41, train_loss: 0.5099, test_loss: 2.0705, test_f1: 0.5835
 epoch: 42, train_loss: 0.4980, test_loss: 2.0318, test_f1: 0.6118
 epoch: 43, train_loss: 0.5011, test_loss: 2.2925, test_f1: 0.5592
 epoch: 44, train_loss: 0.5079, test_loss: 2.2127, test_f1: 0.5722
 epoch: 45, train_loss: 0.4798, test_loss: 2.0926, test_f1: 0.5393
 epoch: 46, train_loss: 0.4883, test_loss: 1.9584, test_f1: 0.5671
 epoch: 47, train_loss: 0.4735, test_loss: 2.4536, test_f1: 0.5101
 epoch: 48, train_loss: 0.5169, test_loss: 2.1345, test_f1: 0.5618
 epoch: 49, train_loss: 0.4930, test_loss: 2.3825, test_f1: 0.5150
 epoch: 50, train_loss: 0.4668, test_loss: 2.0379, test_f1: 0.5385
 epoch: 51, train_loss: 0.4336, test_loss: 2.2040, test_f1: 0.5510
 epoch: 52, train_loss: 0.4040, test_loss: 2.2351, test_f1: 0.5357
 epoch: 53, train_loss: 0.3896, test_loss: 2.0190, test_f1: 0.5591
 epoch: 54, train_loss: 0.3930, test_loss: 2.5033, test_f1: 0.5681
 epoch: 55, train_loss: 0.3762, test_loss: 2.4586, test_f1: 0.5465
 epoch: 56, train_loss: 0.3734, test_loss: 2.5056, test_f1: 0.5562
 epoch: 57, train_loss: 0.3754, test_loss: 2.3256, test_f1: 0.5481
 epoch: 58, train_loss: 0.3681, test_loss: 2.3887, test_f1: 0.5536
 epoch: 59, train_loss: 0.3827, test_loss: 2.7261, test_f1: 0.5094
 epoch: 60, train_loss: 0.3502, test_loss: 2.3297, test_f1: 0.5730
 epoch: 61, train_loss: 0.3650, test_loss: 2.4307, test_f1: 0.5548
 epoch: 62, train_loss: 0.3364, test_loss: 2.2567, test_f1: 0.5741
 epoch: 63, train_loss: 0.3150, test_loss: 2.2285, test_f1: 0.5800
 epoch: 64, train_loss: 0.3350, test_loss: 2.6419, test_f1: 0.5359
 epoch: 65, train_loss: 0.3500, test_loss: 2.4446, test_f1: 0.5281
 epoch: 66, train_loss: 0.3284, test_loss: 2.4701, test_f1: 0.5335
 epoch: 67, train_loss: 0.3234, test_loss: 2.4432, test_f1: 0.5846
 epoch: 68, train_loss: 0.3233, test_loss: 2.5326, test_f1: 0.5402
 epoch: 69, train_loss: 0.3400, test_loss: 2.3625, test_f1: 0.5706
 epoch: 70, train_loss: 0.3377, test_loss: 2.7404, test_f1: 0.5505
 epoch: 71, train_loss: 0.3557, test_loss: 2.7635, test_f1: 0.5451
 epoch: 72, train_loss: 0.3184, test_loss: 2.6782, test_f1: 0.5555
 epoch: 73, train_loss: 0.3224, test_loss: 2.7393, test_f1: 0.5346
 epoch: 74, train_loss: 0.3141, test_loss: 2.9202, test_f1: 0.5853
 epoch: 75, train_loss: 0.2943, test_loss: 2.6830, test_f1: 0.5484
 epoch: 76, train_loss: 0.3304, test_loss: 2.8073, test_f1: 0.5165
 epoch: 77, train_loss: 0.3325, test_loss: 2.2656, test_f1: 0.5849
 epoch: 78, train_loss: 0.3644, test_loss: 3.7183, test_f1: 0.5755
 epoch: 79, train_loss: 0.3226, test_loss: 3.0911, test_f1: 0.5772
 epoch: 80, train_loss: 0.3061, test_loss: 4.0933, test_f1: 0.5763
 epoch: 81, train_loss: 0.3332, test_loss: 2.7647, test_f1: 0.5633
 epoch: 82, train_loss: 0.2951, test_loss: 2.9620, test_f1: 0.5822
 epoch: 83, train_loss: 0.3000, test_loss: 3.0020, test_f1: 0.5525
 epoch: 84, train_loss: 0.2762, test_loss: 3.1783, test_f1: 0.5507
 epoch: 85, train_loss: 0.2902, test_loss: 2.5359, test_f1: 0.5548
 epoch: 86, train_loss: 0.2614, test_loss: 3.2271, test_f1: 0.5885
 epoch: 87, train_loss: 0.2728, test_loss: 2.7115, test_f1: 0.5665
 epoch: 88, train_loss: 0.2596, test_loss: 3.2403, test_f1: 0.5762
 epoch: 89, train_loss: 0.2724, test_loss: 2.8536, test_f1: 0.5836
 epoch: 90, train_loss: 0.2555, test_loss: 3.4205, test_f1: 0.5457
 epoch: 91, train_loss: 0.2710, test_loss: 3.0662, test_f1: 0.5614
 epoch: 92, train_loss: 0.2710, test_loss: 3.4851, test_f1: 0.5341
 epoch: 93, train_loss: 0.2753, test_loss: 3.1058, test_f1: 0.5611
 epoch: 94, train_loss: 0.2530, test_loss: 3.1245, test_f1: 0.5663
 epoch: 95, train_loss: 0.2694, test_loss: 3.1028, test_f1: 0.5620
 epoch: 96, train_loss: 0.2671, test_loss: 3.0090, test_f1: 0.5708
 epoch: 97, train_loss: 0.2844, test_loss: 3.1573, test_f1: 0.5803
 epoch: 98, train_loss: 0.2469, test_loss: 3.1442, test_f1: 0.5989
 epoch: 99, train_loss: 0.2574, test_loss: 3.1900, test_f1: 0.5748
##################ITERATION #2 ****************************************
 epoch: 0, train_loss: 1.2431, test_loss: 1.3020, test_f1: 0.3163
 epoch: 1, train_loss: 1.1377, test_loss: 1.2470, test_f1: 0.4165
 epoch: 2, train_loss: 1.0976, test_loss: 1.1888, test_f1: 0.4702
 epoch: 3, train_loss: 1.0759, test_loss: 1.1991, test_f1: 0.5406
 epoch: 4, train_loss: 1.0249, test_loss: 1.1789, test_f1: 0.5364
 epoch: 5, train_loss: 0.9929, test_loss: 1.2070, test_f1: 0.5327
 epoch: 6, train_loss: 0.9792, test_loss: 1.1558, test_f1: 0.5787
 epoch: 7, train_loss: 0.9635, test_loss: 1.0939, test_f1: 0.5521
 epoch: 8, train_loss: 0.9269, test_loss: 1.0828, test_f1: 0.5546
 epoch: 9, train_loss: 0.8995, test_loss: 1.0972, test_f1: 0.6062
 epoch: 10, train_loss: 0.8941, test_loss: 1.1591, test_f1: 0.5412
 epoch: 11, train_loss: 0.8795, test_loss: 1.2205, test_f1: 0.5189
 epoch: 12, train_loss: 0.8803, test_loss: 1.1180, test_f1: 0.5713
 epoch: 13, train_loss: 0.8443, test_loss: 1.2915, test_f1: 0.4877
 epoch: 14, train_loss: 0.8210, test_loss: 1.1338, test_f1: 0.5998
 epoch: 15, train_loss: 0.7959, test_loss: 1.4013, test_f1: 0.6117
 epoch: 16, train_loss: 0.7870, test_loss: 1.1510, test_f1: 0.5884
 epoch: 17, train_loss: 0.7532, test_loss: 1.1926, test_f1: 0.5869
 epoch: 18, train_loss: 0.7567, test_loss: 1.2793, test_f1: 0.6008
 epoch: 19, train_loss: 0.7383, test_loss: 1.1736, test_f1: 0.6121
 epoch: 20, train_loss: 0.7208, test_loss: 1.1726, test_f1: 0.5967
 epoch: 21, train_loss: 0.7099, test_loss: 1.2110, test_f1: 0.5540
 epoch: 22, train_loss: 0.7191, test_loss: 1.1910, test_f1: 0.6409
 epoch: 23, train_loss: 0.6768, test_loss: 1.2698, test_f1: 0.5841
 epoch: 24, train_loss: 0.6832, test_loss: 1.3710, test_f1: 0.5805
 epoch: 25, train_loss: 0.6845, test_loss: 1.3440, test_f1: 0.5570
 epoch: 26, train_loss: 0.6970, test_loss: 1.3422, test_f1: 0.5973
 epoch: 27, train_loss: 0.6806, test_loss: 1.3320, test_f1: 0.5867
 epoch: 28, train_loss: 0.6512, test_loss: 1.2693, test_f1: 0.5803
 epoch: 29, train_loss: 0.6479, test_loss: 1.2560, test_f1: 0.5780
 epoch: 30, train_loss: 0.6265, test_loss: 1.5621, test_f1: 0.5967
 epoch: 31, train_loss: 0.6531, test_loss: 1.2700, test_f1: 0.6437
 epoch: 32, train_loss: 0.6195, test_loss: 1.2241, test_f1: 0.6093
 epoch: 33, train_loss: 0.6402, test_loss: 1.2787, test_f1: 0.6646
 epoch: 34, train_loss: 0.6533, test_loss: 1.3248, test_f1: 0.5799
 epoch: 35, train_loss: 0.6059, test_loss: 1.4257, test_f1: 0.5970
 epoch: 36, train_loss: 0.6459, test_loss: 1.2904, test_f1: 0.6254
 epoch: 37, train_loss: 0.6132, test_loss: 1.7416, test_f1: 0.5700
 epoch: 38, train_loss: 0.5941, test_loss: 1.6081, test_f1: 0.6275
 epoch: 39, train_loss: 0.5799, test_loss: 1.6057, test_f1: 0.6069
 epoch: 40, train_loss: 0.5844, test_loss: 2.2308, test_f1: 0.5818
 epoch: 41, train_loss: 0.5784, test_loss: 1.4390, test_f1: 0.6002
 epoch: 42, train_loss: 0.5688, test_loss: 1.4787, test_f1: 0.5642
 epoch: 43, train_loss: 0.5426, test_loss: 1.4175, test_f1: 0.5950
 epoch: 44, train_loss: 0.5475, test_loss: 1.6291, test_f1: 0.5640
 epoch: 45, train_loss: 0.5771, test_loss: 1.3622, test_f1: 0.5888
 epoch: 46, train_loss: 0.5593, test_loss: 1.4832, test_f1: 0.5997
 epoch: 47, train_loss: 0.5315, test_loss: 1.4807, test_f1: 0.5696
 epoch: 48, train_loss: 0.5457, test_loss: 1.7640, test_f1: 0.5680
 epoch: 49, train_loss: 0.5564, test_loss: 1.4390, test_f1: 0.6196
 epoch: 50, train_loss: 0.5249, test_loss: 1.5388, test_f1: 0.5783
 epoch: 51, train_loss: 0.4676, test_loss: 1.6893, test_f1: 0.6000
 epoch: 52, train_loss: 0.4587, test_loss: 1.5989, test_f1: 0.5941
 epoch: 53, train_loss: 0.4253, test_loss: 1.7537, test_f1: 0.6036
 epoch: 54, train_loss: 0.4340, test_loss: 1.6544, test_f1: 0.6044
 epoch: 55, train_loss: 0.4534, test_loss: 1.5235, test_f1: 0.5982
 epoch: 56, train_loss: 0.4232, test_loss: 1.7711, test_f1: 0.5777
 epoch: 57, train_loss: 0.4006, test_loss: 1.7050, test_f1: 0.5552
 epoch: 58, train_loss: 0.4001, test_loss: 1.7945, test_f1: 0.6083
 epoch: 59, train_loss: 0.4100, test_loss: 1.7889, test_f1: 0.5895
 epoch: 60, train_loss: 0.4084, test_loss: 1.6338, test_f1: 0.6086
 epoch: 61, train_loss: 0.4057, test_loss: 1.6329, test_f1: 0.6013
 epoch: 62, train_loss: 0.3947, test_loss: 1.7275, test_f1: 0.5865
 epoch: 63, train_loss: 0.4052, test_loss: 1.8076, test_f1: 0.5931
 epoch: 64, train_loss: 0.4118, test_loss: 1.7390, test_f1: 0.5997
 epoch: 65, train_loss: 0.3998, test_loss: 1.7679, test_f1: 0.5716
 epoch: 66, train_loss: 0.3681, test_loss: 2.0508, test_f1: 0.5875
 epoch: 67, train_loss: 0.3778, test_loss: 2.1445, test_f1: 0.5706
 epoch: 68, train_loss: 0.3733, test_loss: 2.3059, test_f1: 0.5547
 epoch: 69, train_loss: 0.4024, test_loss: 1.9921, test_f1: 0.5737
 epoch: 70, train_loss: 0.3622, test_loss: 2.0894, test_f1: 0.5680
 epoch: 71, train_loss: 0.3580, test_loss: 2.1418, test_f1: 0.5762
 epoch: 72, train_loss: 0.3796, test_loss: 2.3196, test_f1: 0.5413
 epoch: 73, train_loss: 0.3600, test_loss: 2.2453, test_f1: 0.5785
 epoch: 74, train_loss: 0.3429, test_loss: 2.0327, test_f1: 0.5620
 epoch: 75, train_loss: 0.3553, test_loss: 2.0549, test_f1: 0.5850
 epoch: 76, train_loss: 0.3648, test_loss: 2.0465, test_f1: 0.5811
 epoch: 77, train_loss: 0.3625, test_loss: 2.0599, test_f1: 0.6016
 epoch: 78, train_loss: 0.3488, test_loss: 2.0234, test_f1: 0.5784
 epoch: 79, train_loss: 0.3519, test_loss: 2.0134, test_f1: 0.5938
 epoch: 80, train_loss: 0.3494, test_loss: 2.0225, test_f1: 0.5735
 epoch: 81, train_loss: 0.3466, test_loss: 2.1650, test_f1: 0.5608
 epoch: 82, train_loss: 0.3153, test_loss: 2.2556, test_f1: 0.5760
 epoch: 83, train_loss: 0.3477, test_loss: 2.2736, test_f1: 0.5600
 epoch: 84, train_loss: 0.3563, test_loss: 2.2972, test_f1: 0.5787
 epoch: 85, train_loss: 0.3191, test_loss: 2.1843, test_f1: 0.5799
 epoch: 86, train_loss: 0.3107, test_loss: 2.3299, test_f1: 0.5720
 epoch: 87, train_loss: 0.3407, test_loss: 2.3110, test_f1: 0.5673
 epoch: 88, train_loss: 0.3309, test_loss: 2.1092, test_f1: 0.5879
 epoch: 89, train_loss: 0.3050, test_loss: 2.2815, test_f1: 0.5795
 epoch: 90, train_loss: 0.3490, test_loss: 2.2616, test_f1: 0.5349
 epoch: 91, train_loss: 0.3157, test_loss: 2.2388, test_f1: 0.5653
 epoch: 92, train_loss: 0.3378, test_loss: 2.1548, test_f1: 0.5773
 epoch: 93, train_loss: 0.3234, test_loss: 2.0371, test_f1: 0.5801
 epoch: 94, train_loss: 0.3047, test_loss: 2.1940, test_f1: 0.5563
 epoch: 95, train_loss: 0.3260, test_loss: 2.2572, test_f1: 0.5519
 epoch: 96, train_loss: 0.3270, test_loss: 2.2600, test_f1: 0.5901
 epoch: 97, train_loss: 0.3125, test_loss: 2.2813, test_f1: 0.5830
 epoch: 98, train_loss: 0.3244, test_loss: 2.2646, test_f1: 0.5630
 epoch: 99, train_loss: 0.3079, test_loss: 2.4448, test_f1: 0.5621
##################ITERATION #3 ****************************************
 epoch: 0, train_loss: 1.2711, test_loss: 1.2899, test_f1: 0.3325
 epoch: 1, train_loss: 1.1845, test_loss: 1.1949, test_f1: 0.4573
 epoch: 2, train_loss: 1.1271, test_loss: 1.1987, test_f1: 0.4974
 epoch: 3, train_loss: 1.0969, test_loss: 1.1362, test_f1: 0.4804
 epoch: 4, train_loss: 1.0564, test_loss: 1.1805, test_f1: 0.5093
 epoch: 5, train_loss: 1.0082, test_loss: 1.1290, test_f1: 0.5361
 epoch: 6, train_loss: 0.9871, test_loss: 1.2213, test_f1: 0.4905
 epoch: 7, train_loss: 0.9644, test_loss: 1.2204, test_f1: 0.5289
 epoch: 8, train_loss: 0.9543, test_loss: 1.2118, test_f1: 0.4987
 epoch: 9, train_loss: 0.9355, test_loss: 1.1609, test_f1: 0.5350
 epoch: 10, train_loss: 0.9144, test_loss: 1.2145, test_f1: 0.5522
 epoch: 11, train_loss: 0.8940, test_loss: 1.1707, test_f1: 0.4942
 epoch: 12, train_loss: 0.8762, test_loss: 1.2089, test_f1: 0.5626
 epoch: 13, train_loss: 0.8619, test_loss: 1.1940, test_f1: 0.5180
 epoch: 14, train_loss: 0.8413, test_loss: 1.3478, test_f1: 0.5435
 epoch: 15, train_loss: 0.8313, test_loss: 1.3216, test_f1: 0.5556
 epoch: 16, train_loss: 0.8366, test_loss: 1.3764, test_f1: 0.5483
 epoch: 17, train_loss: 0.8183, test_loss: 1.4005, test_f1: 0.5181
 epoch: 18, train_loss: 0.8181, test_loss: 1.3187, test_f1: 0.6077
 epoch: 19, train_loss: 0.7893, test_loss: 1.4313, test_f1: 0.5824
 epoch: 20, train_loss: 0.7668, test_loss: 1.4776, test_f1: 0.5655
 epoch: 21, train_loss: 0.7691, test_loss: 1.5053, test_f1: 0.5062
 epoch: 22, train_loss: 0.7950, test_loss: 1.5626, test_f1: 0.5559
 epoch: 23, train_loss: 0.7750, test_loss: 1.5449, test_f1: 0.5475
 epoch: 24, train_loss: 0.7232, test_loss: 1.4344, test_f1: 0.5643
 epoch: 25, train_loss: 0.7412, test_loss: 1.4608, test_f1: 0.5610
 epoch: 26, train_loss: 0.7268, test_loss: 1.6763, test_f1: 0.5370
 epoch: 27, train_loss: 0.7243, test_loss: 1.7076, test_f1: 0.5517
 epoch: 28, train_loss: 0.7259, test_loss: 1.6165, test_f1: 0.5930
 epoch: 29, train_loss: 0.7198, test_loss: 1.6741, test_f1: 0.5487
 epoch: 30, train_loss: 0.7070, test_loss: 1.7145, test_f1: 0.5283
 epoch: 31, train_loss: 0.6881, test_loss: 1.9197, test_f1: 0.5951
 epoch: 32, train_loss: 0.6895, test_loss: 1.8608, test_f1: 0.5504
 epoch: 33, train_loss: 0.6562, test_loss: 1.9092, test_f1: 0.5580
 epoch: 34, train_loss: 0.6602, test_loss: 1.7809, test_f1: 0.5607
 epoch: 35, train_loss: 0.6351, test_loss: 2.0900, test_f1: 0.5117
 epoch: 36, train_loss: 0.6482, test_loss: 1.8894, test_f1: 0.5736
 epoch: 37, train_loss: 0.6394, test_loss: 1.9163, test_f1: 0.5576
 epoch: 38, train_loss: 0.6551, test_loss: 1.8526, test_f1: 0.5682
 epoch: 39, train_loss: 0.6315, test_loss: 1.9055, test_f1: 0.5660
 epoch: 40, train_loss: 0.6058, test_loss: 2.2914, test_f1: 0.5790
 epoch: 41, train_loss: 0.6736, test_loss: 2.0070, test_f1: 0.5504
 epoch: 42, train_loss: 0.6359, test_loss: 1.9537, test_f1: 0.5649
 epoch: 43, train_loss: 0.6044, test_loss: 1.8827, test_f1: 0.5508
 epoch: 44, train_loss: 0.5985, test_loss: 1.9733, test_f1: 0.5234
 epoch: 45, train_loss: 0.6170, test_loss: 1.9468, test_f1: 0.5290
 epoch: 46, train_loss: 0.6015, test_loss: 2.3478, test_f1: 0.5130
 epoch: 47, train_loss: 0.5794, test_loss: 2.0346, test_f1: 0.5614
 epoch: 48, train_loss: 0.5578, test_loss: 2.2530, test_f1: 0.5573
 epoch: 49, train_loss: 0.5705, test_loss: 2.3219, test_f1: 0.5487
 epoch: 50, train_loss: 0.5720, test_loss: 2.5368, test_f1: 0.5743
 epoch: 51, train_loss: 0.5497, test_loss: 2.3107, test_f1: 0.5491
 epoch: 52, train_loss: 0.4979, test_loss: 2.2188, test_f1: 0.5731
 epoch: 53, train_loss: 0.4855, test_loss: 2.5844, test_f1: 0.5412
 epoch: 54, train_loss: 0.4979, test_loss: 2.4666, test_f1: 0.5807
 epoch: 55, train_loss: 0.4656, test_loss: 2.4540, test_f1: 0.6033
 epoch: 56, train_loss: 0.4455, test_loss: 2.5362, test_f1: 0.5804
 epoch: 57, train_loss: 0.4546, test_loss: 2.7126, test_f1: 0.5286
 epoch: 58, train_loss: 0.4637, test_loss: 2.5489, test_f1: 0.5765
 epoch: 59, train_loss: 0.4460, test_loss: 2.4343, test_f1: 0.5687
 epoch: 60, train_loss: 0.4426, test_loss: 2.5251, test_f1: 0.5410
 epoch: 61, train_loss: 0.4268, test_loss: 2.4151, test_f1: 0.5504
 epoch: 62, train_loss: 0.4432, test_loss: 2.7842, test_f1: 0.5917
 epoch: 63, train_loss: 0.4256, test_loss: 2.5350, test_f1: 0.5744
 epoch: 64, train_loss: 0.4236, test_loss: 2.6611, test_f1: 0.5585
 epoch: 65, train_loss: 0.4469, test_loss: 2.5162, test_f1: 0.5925
 epoch: 66, train_loss: 0.4313, test_loss: 2.5547, test_f1: 0.5327
 epoch: 67, train_loss: 0.4123, test_loss: 2.7970, test_f1: 0.5956
 epoch: 68, train_loss: 0.4296, test_loss: 2.8196, test_f1: 0.5325
 epoch: 69, train_loss: 0.4230, test_loss: 2.8460, test_f1: 0.5408
 epoch: 70, train_loss: 0.3928, test_loss: 3.0958, test_f1: 0.5896
 epoch: 71, train_loss: 0.4198, test_loss: 3.0259, test_f1: 0.5647
 epoch: 72, train_loss: 0.4165, test_loss: 2.6471, test_f1: 0.5668
 epoch: 73, train_loss: 0.4017, test_loss: 2.8795, test_f1: 0.5928
 epoch: 74, train_loss: 0.3928, test_loss: 3.3470, test_f1: 0.5343
 epoch: 75, train_loss: 0.3767, test_loss: 3.0440, test_f1: 0.5797
 epoch: 76, train_loss: 0.3948, test_loss: 2.7083, test_f1: 0.5630
 epoch: 77, train_loss: 0.3890, test_loss: 3.2794, test_f1: 0.5545
 epoch: 78, train_loss: 0.4119, test_loss: 3.0937, test_f1: 0.5803
 epoch: 79, train_loss: 0.3787, test_loss: 2.9966, test_f1: 0.5564
 epoch: 80, train_loss: 0.4054, test_loss: 2.9423, test_f1: 0.5639
 epoch: 81, train_loss: 0.3929, test_loss: 3.0599, test_f1: 0.5217
 epoch: 82, train_loss: 0.3962, test_loss: 2.8870, test_f1: 0.5643
 epoch: 83, train_loss: 0.3633, test_loss: 3.1463, test_f1: 0.5417
 epoch: 84, train_loss: 0.3808, test_loss: 3.3259, test_f1: 0.5661
 epoch: 85, train_loss: 0.3627, test_loss: 3.0601, test_f1: 0.5791
 epoch: 86, train_loss: 0.3694, test_loss: 2.9232, test_f1: 0.5665
 epoch: 87, train_loss: 0.3388, test_loss: 3.4859, test_f1: 0.5667
 epoch: 88, train_loss: 0.3417, test_loss: 3.1057, test_f1: 0.5829
 epoch: 89, train_loss: 0.3693, test_loss: 3.2021, test_f1: 0.5705
 epoch: 90, train_loss: 0.3374, test_loss: 3.3487, test_f1: 0.5739
 epoch: 91, train_loss: 0.3725, test_loss: 3.1817, test_f1: 0.5710
 epoch: 92, train_loss: 0.3770, test_loss: 2.8240, test_f1: 0.5812
 epoch: 93, train_loss: 0.3601, test_loss: 3.0237, test_f1: 0.5915
 epoch: 94, train_loss: 0.3452, test_loss: 3.0541, test_f1: 0.5906
 epoch: 95, train_loss: 0.3412, test_loss: 3.1319, test_f1: 0.5809
 epoch: 96, train_loss: 0.3435, test_loss: 3.2351, test_f1: 0.5944
 epoch: 97, train_loss: 0.3404, test_loss: 3.5022, test_f1: 0.5545
 epoch: 98, train_loss: 0.3213, test_loss: 3.2998, test_f1: 0.5515
 epoch: 99, train_loss: 0.3238, test_loss: 2.9385, test_f1: 0.5998
##################ITERATION #4 ****************************************
 epoch: 0, train_loss: 1.2609, test_loss: 1.2769, test_f1: 0.2718
 epoch: 1, train_loss: 1.1668, test_loss: 1.3022, test_f1: 0.4608
 epoch: 2, train_loss: 1.1260, test_loss: 1.2089, test_f1: 0.4718
 epoch: 3, train_loss: 1.0663, test_loss: 1.1986, test_f1: 0.4392
 epoch: 4, train_loss: 1.0045, test_loss: 1.2041, test_f1: 0.5176
 epoch: 5, train_loss: 0.9884, test_loss: 1.3081, test_f1: 0.4746
 epoch: 6, train_loss: 0.9599, test_loss: 1.1947, test_f1: 0.5126
 epoch: 7, train_loss: 0.9235, test_loss: 1.2437, test_f1: 0.4860
 epoch: 8, train_loss: 0.9172, test_loss: 1.2756, test_f1: 0.5652
 epoch: 9, train_loss: 0.9086, test_loss: 1.2246, test_f1: 0.5073
 epoch: 10, train_loss: 0.8778, test_loss: 1.1583, test_f1: 0.5263
 epoch: 11, train_loss: 0.8397, test_loss: 1.4704, test_f1: 0.4764
 epoch: 12, train_loss: 0.8390, test_loss: 1.3502, test_f1: 0.4951
 epoch: 13, train_loss: 0.8477, test_loss: 1.2078, test_f1: 0.5562
 epoch: 14, train_loss: 0.8198, test_loss: 1.2699, test_f1: 0.5926
 epoch: 15, train_loss: 0.7946, test_loss: 1.2364, test_f1: 0.5768
 epoch: 16, train_loss: 0.7809, test_loss: 1.3669, test_f1: 0.5274
 epoch: 17, train_loss: 0.7457, test_loss: 1.1743, test_f1: 0.5629
 epoch: 18, train_loss: 0.7747, test_loss: 1.3317, test_f1: 0.5259
 epoch: 19, train_loss: 0.7640, test_loss: 1.4665, test_f1: 0.4751
 epoch: 20, train_loss: 0.7656, test_loss: 1.3233, test_f1: 0.5312
 epoch: 21, train_loss: 0.7607, test_loss: 1.3369, test_f1: 0.5274
 epoch: 22, train_loss: 0.7301, test_loss: 1.3271, test_f1: 0.5059
 epoch: 23, train_loss: 0.7414, test_loss: 1.2804, test_f1: 0.5523
 epoch: 24, train_loss: 0.6920, test_loss: 1.2646, test_f1: 0.5663
 epoch: 25, train_loss: 0.6834, test_loss: 1.3766, test_f1: 0.5497
 epoch: 26, train_loss: 0.6798, test_loss: 1.4335, test_f1: 0.5405
 epoch: 27, train_loss: 0.6879, test_loss: 1.4962, test_f1: 0.5315
 epoch: 28, train_loss: 0.6886, test_loss: 1.4341, test_f1: 0.5153
 epoch: 29, train_loss: 0.6513, test_loss: 1.5108, test_f1: 0.5829
 epoch: 30, train_loss: 0.6500, test_loss: 1.5873, test_f1: 0.5559
 epoch: 31, train_loss: 0.6465, test_loss: 1.9045, test_f1: 0.5179
 epoch: 32, train_loss: 0.6575, test_loss: 1.8239, test_f1: 0.4940
 epoch: 33, train_loss: 0.6766, test_loss: 1.6044, test_f1: 0.5295
 epoch: 34, train_loss: 0.6391, test_loss: 1.6880, test_f1: 0.5247
 epoch: 35, train_loss: 0.6051, test_loss: 1.9289, test_f1: 0.5360
 epoch: 36, train_loss: 0.6106, test_loss: 2.2294, test_f1: 0.5469
 epoch: 37, train_loss: 0.5979, test_loss: 1.7393, test_f1: 0.5353
 epoch: 38, train_loss: 0.5898, test_loss: 1.8141, test_f1: 0.5654
 epoch: 39, train_loss: 0.5898, test_loss: 2.0613, test_f1: 0.5591
 epoch: 40, train_loss: 0.5873, test_loss: 1.8578, test_f1: 0.5486
 epoch: 41, train_loss: 0.5476, test_loss: 1.8492, test_f1: 0.5334
 epoch: 42, train_loss: 0.5766, test_loss: 1.9524, test_f1: 0.5210
 epoch: 43, train_loss: 0.5796, test_loss: 1.9217, test_f1: 0.5323
 epoch: 44, train_loss: 0.5788, test_loss: 2.1656, test_f1: 0.5514
 epoch: 45, train_loss: 0.5291, test_loss: 2.3635, test_f1: 0.5623
 epoch: 46, train_loss: 0.5243, test_loss: 2.4053, test_f1: 0.5452
 epoch: 47, train_loss: 0.5403, test_loss: 2.4813, test_f1: 0.5049
 epoch: 48, train_loss: 0.5166, test_loss: 2.0964, test_f1: 0.4907
 epoch: 49, train_loss: 0.5256, test_loss: 2.1893, test_f1: 0.5761
 epoch: 50, train_loss: 0.5181, test_loss: 1.9038, test_f1: 0.5253
 epoch: 51, train_loss: 0.4638, test_loss: 2.0050, test_f1: 0.5243
 epoch: 52, train_loss: 0.4517, test_loss: 1.9870, test_f1: 0.5572
 epoch: 53, train_loss: 0.4141, test_loss: 2.2195, test_f1: 0.5623
 epoch: 54, train_loss: 0.4175, test_loss: 2.2330, test_f1: 0.5539
 epoch: 55, train_loss: 0.4118, test_loss: 2.2199, test_f1: 0.5024
 epoch: 56, train_loss: 0.4132, test_loss: 2.5536, test_f1: 0.5404
 epoch: 57, train_loss: 0.4225, test_loss: 2.4960, test_f1: 0.5244
 epoch: 58, train_loss: 0.4209, test_loss: 2.4139, test_f1: 0.5411
 epoch: 59, train_loss: 0.4308, test_loss: 2.5043, test_f1: 0.5575
 epoch: 60, train_loss: 0.4073, test_loss: 2.7999, test_f1: 0.5115
 epoch: 61, train_loss: 0.3854, test_loss: 2.6808, test_f1: 0.5396
 epoch: 62, train_loss: 0.4105, test_loss: 2.5636, test_f1: 0.5174
 epoch: 63, train_loss: 0.3942, test_loss: 2.5465, test_f1: 0.5471
 epoch: 64, train_loss: 0.3716, test_loss: 2.7650, test_f1: 0.5401
 epoch: 65, train_loss: 0.3928, test_loss: 2.8579, test_f1: 0.5523
 epoch: 66, train_loss: 0.3880, test_loss: 2.9040, test_f1: 0.5080
 epoch: 67, train_loss: 0.3869, test_loss: 2.5652, test_f1: 0.5645
 epoch: 68, train_loss: 0.3813, test_loss: 3.1962, test_f1: 0.5619
 epoch: 69, train_loss: 0.3533, test_loss: 2.7892, test_f1: 0.5371
 epoch: 70, train_loss: 0.3452, test_loss: 2.9980, test_f1: 0.5485
 epoch: 71, train_loss: 0.3619, test_loss: 3.3590, test_f1: 0.5363
 epoch: 72, train_loss: 0.3715, test_loss: 3.2771, test_f1: 0.5618
 epoch: 73, train_loss: 0.3431, test_loss: 3.1047, test_f1: 0.5504
 epoch: 74, train_loss: 0.3958, test_loss: 3.1960, test_f1: 0.5471
 epoch: 75, train_loss: 0.3594, test_loss: 3.0414, test_f1: 0.5351
 epoch: 76, train_loss: 0.3353, test_loss: 3.0440, test_f1: 0.5386
 epoch: 77, train_loss: 0.3877, test_loss: 2.7833, test_f1: 0.5416
 epoch: 78, train_loss: 0.3593, test_loss: 3.0462, test_f1: 0.5732
 epoch: 79, train_loss: 0.3391, test_loss: 3.0920, test_f1: 0.5555
 epoch: 80, train_loss: 0.3458, test_loss: 3.0551, test_f1: 0.5608
 epoch: 81, train_loss: 0.3260, test_loss: 3.0402, test_f1: 0.5614
 epoch: 82, train_loss: 0.3265, test_loss: 2.8646, test_f1: 0.5552
 epoch: 83, train_loss: 0.3528, test_loss: 3.4101, test_f1: 0.5199
 epoch: 84, train_loss: 0.3430, test_loss: 2.9733, test_f1: 0.5652
 epoch: 85, train_loss: 0.3237, test_loss: 2.8081, test_f1: 0.5784
 epoch: 86, train_loss: 0.3084, test_loss: 3.6298, test_f1: 0.5216
 epoch: 87, train_loss: 0.2950, test_loss: 4.1173, test_f1: 0.5580
 epoch: 88, train_loss: 0.3060, test_loss: 4.2230, test_f1: 0.5702
 epoch: 89, train_loss: 0.3049, test_loss: 3.4554, test_f1: 0.5197
 epoch: 90, train_loss: 0.3158, test_loss: 3.5349, test_f1: 0.5718
 epoch: 91, train_loss: 0.3156, test_loss: 3.7002, test_f1: 0.5677
 epoch: 92, train_loss: 0.3267, test_loss: 3.4941, test_f1: 0.5515
 epoch: 93, train_loss: 0.3009, test_loss: 3.3823, test_f1: 0.5478
 epoch: 94, train_loss: 0.3103, test_loss: 3.4399, test_f1: 0.5698
 epoch: 95, train_loss: 0.3038, test_loss: 3.1542, test_f1: 0.5667
 epoch: 96, train_loss: 0.3039, test_loss: 3.7488, test_f1: 0.5567
 epoch: 97, train_loss: 0.3114, test_loss: 3.1289, test_f1: 0.5456
 epoch: 98, train_loss: 0.2944, test_loss: 3.6915, test_f1: 0.5678
 epoch: 99, train_loss: 0.3085, test_loss: 3.2519, test_f1: 0.5239
##################ITERATION #5 ****************************************
 epoch: 0, train_loss: 1.2616, test_loss: 1.3431, test_f1: 0.2639
 epoch: 1, train_loss: 1.1715, test_loss: 1.2642, test_f1: 0.4525
 epoch: 2, train_loss: 1.1082, test_loss: 1.1987, test_f1: 0.5014
 epoch: 3, train_loss: 1.0711, test_loss: 1.1841, test_f1: 0.5185
 epoch: 4, train_loss: 1.0520, test_loss: 1.2012, test_f1: 0.4883
 epoch: 5, train_loss: 1.0266, test_loss: 1.1837, test_f1: 0.5038
 epoch: 6, train_loss: 0.9976, test_loss: 1.1621, test_f1: 0.4834
 epoch: 7, train_loss: 0.9460, test_loss: 1.1752, test_f1: 0.5504
 epoch: 8, train_loss: 0.9365, test_loss: 1.1276, test_f1: 0.5539
 epoch: 9, train_loss: 0.9101, test_loss: 1.1283, test_f1: 0.5790
 epoch: 10, train_loss: 0.8984, test_loss: 1.1763, test_f1: 0.5297
 epoch: 11, train_loss: 0.8579, test_loss: 1.1021, test_f1: 0.6006
 epoch: 12, train_loss: 0.8565, test_loss: 1.3330, test_f1: 0.4647
 epoch: 13, train_loss: 0.8451, test_loss: 1.2493, test_f1: 0.5861
 epoch: 14, train_loss: 0.8429, test_loss: 1.2915, test_f1: 0.5133
 epoch: 15, train_loss: 0.8321, test_loss: 1.1613, test_f1: 0.5825
 epoch: 16, train_loss: 0.8240, test_loss: 1.1348, test_f1: 0.5907
 epoch: 17, train_loss: 0.8141, test_loss: 1.4553, test_f1: 0.4782
 epoch: 18, train_loss: 0.7891, test_loss: 1.1932, test_f1: 0.6022
 epoch: 19, train_loss: 0.7930, test_loss: 1.2570, test_f1: 0.6290
 epoch: 20, train_loss: 0.7610, test_loss: 1.2124, test_f1: 0.5785
 epoch: 21, train_loss: 0.7680, test_loss: 1.2644, test_f1: 0.5971
 epoch: 22, train_loss: 0.7677, test_loss: 1.1834, test_f1: 0.5965
 epoch: 23, train_loss: 0.7251, test_loss: 1.4294, test_f1: 0.5430
 epoch: 24, train_loss: 0.7354, test_loss: 1.2548, test_f1: 0.5687
 epoch: 25, train_loss: 0.7395, test_loss: 1.3210, test_f1: 0.5640
 epoch: 26, train_loss: 0.7206, test_loss: 1.3536, test_f1: 0.5438
 epoch: 27, train_loss: 0.7118, test_loss: 1.2950, test_f1: 0.5930
 epoch: 28, train_loss: 0.7162, test_loss: 1.2915, test_f1: 0.5660
 epoch: 29, train_loss: 0.7045, test_loss: 1.4404, test_f1: 0.5452
 epoch: 30, train_loss: 0.6864, test_loss: 1.4176, test_f1: 0.5544
 epoch: 31, train_loss: 0.6709, test_loss: 1.3772, test_f1: 0.5740
 epoch: 32, train_loss: 0.6531, test_loss: 1.3229, test_f1: 0.6037
 epoch: 33, train_loss: 0.6407, test_loss: 1.3441, test_f1: 0.6237
 epoch: 34, train_loss: 0.6433, test_loss: 1.5590, test_f1: 0.5365
 epoch: 35, train_loss: 0.6553, test_loss: 1.5438, test_f1: 0.5208
 epoch: 36, train_loss: 0.6210, test_loss: 1.4201, test_f1: 0.5962
 epoch: 37, train_loss: 0.6916, test_loss: 1.4284, test_f1: 0.5815
 epoch: 38, train_loss: 0.6303, test_loss: 1.2777, test_f1: 0.5762
 epoch: 39, train_loss: 0.6039, test_loss: 1.5237, test_f1: 0.5530
 epoch: 40, train_loss: 0.5998, test_loss: 1.3261, test_f1: 0.5552
 epoch: 41, train_loss: 0.6011, test_loss: 1.3972, test_f1: 0.5792
 epoch: 42, train_loss: 0.6061, test_loss: 1.4792, test_f1: 0.5977
 epoch: 43, train_loss: 0.5671, test_loss: 1.5494, test_f1: 0.5649
 epoch: 44, train_loss: 0.5513, test_loss: 1.4613, test_f1: 0.6043
 epoch: 45, train_loss: 0.5802, test_loss: 1.6007, test_f1: 0.5582
 epoch: 46, train_loss: 0.5904, test_loss: 1.8144, test_f1: 0.5181
 epoch: 47, train_loss: 0.5747, test_loss: 1.8017, test_f1: 0.5265
 epoch: 48, train_loss: 0.5845, test_loss: 1.9937, test_f1: 0.5299
 epoch: 49, train_loss: 0.5680, test_loss: 1.6522, test_f1: 0.5349
 epoch: 50, train_loss: 0.5699, test_loss: 1.6952, test_f1: 0.5421
 epoch: 51, train_loss: 0.5472, test_loss: 1.6555, test_f1: 0.5920
 epoch: 52, train_loss: 0.4859, test_loss: 1.5612, test_f1: 0.5823
 epoch: 53, train_loss: 0.4868, test_loss: 1.8444, test_f1: 0.5650
 epoch: 54, train_loss: 0.4780, test_loss: 1.7706, test_f1: 0.5836
 epoch: 55, train_loss: 0.4538, test_loss: 1.5579, test_f1: 0.6045
 epoch: 56, train_loss: 0.4717, test_loss: 1.8931, test_f1: 0.5784
 epoch: 57, train_loss: 0.4466, test_loss: 1.5649, test_f1: 0.5907
 epoch: 58, train_loss: 0.4447, test_loss: 1.7047, test_f1: 0.5703
 epoch: 59, train_loss: 0.4252, test_loss: 1.6631, test_f1: 0.5600
 epoch: 60, train_loss: 0.4380, test_loss: 1.7971, test_f1: 0.5728
 epoch: 61, train_loss: 0.4419, test_loss: 1.8915, test_f1: 0.5722
 epoch: 62, train_loss: 0.4421, test_loss: 1.8723, test_f1: 0.5578
 epoch: 63, train_loss: 0.4250, test_loss: 1.8801, test_f1: 0.5679
 epoch: 64, train_loss: 0.4398, test_loss: 2.0360, test_f1: 0.5576
 epoch: 65, train_loss: 0.4153, test_loss: 1.9400, test_f1: 0.5826
 epoch: 66, train_loss: 0.4150, test_loss: 1.9564, test_f1: 0.5860
 epoch: 67, train_loss: 0.3835, test_loss: 1.8755, test_f1: 0.5828
 epoch: 68, train_loss: 0.3757, test_loss: 2.2211, test_f1: 0.5488
 epoch: 69, train_loss: 0.3905, test_loss: 2.0723, test_f1: 0.5603
 epoch: 70, train_loss: 0.4022, test_loss: 2.2412, test_f1: 0.5432
 epoch: 71, train_loss: 0.3935, test_loss: 2.3793, test_f1: 0.5475
 epoch: 72, train_loss: 0.3965, test_loss: 2.4793, test_f1: 0.5308
 epoch: 73, train_loss: 0.4057, test_loss: 2.2196, test_f1: 0.5719
 epoch: 74, train_loss: 0.3769, test_loss: 2.0771, test_f1: 0.5677
 epoch: 75, train_loss: 0.4004, test_loss: 2.0155, test_f1: 0.5626
 epoch: 76, train_loss: 0.3655, test_loss: 1.9905, test_f1: 0.5707
 epoch: 77, train_loss: 0.3906, test_loss: 1.9565, test_f1: 0.5533
 epoch: 78, train_loss: 0.3800, test_loss: 2.0367, test_f1: 0.5733
 epoch: 79, train_loss: 0.3668, test_loss: 2.0916, test_f1: 0.5521
 epoch: 80, train_loss: 0.3458, test_loss: 1.9905, test_f1: 0.5810
 epoch: 81, train_loss: 0.3776, test_loss: 2.0535, test_f1: 0.5526
 epoch: 82, train_loss: 0.3600, test_loss: 2.1748, test_f1: 0.5532
 epoch: 83, train_loss: 0.3709, test_loss: 2.0597, test_f1: 0.5678
 epoch: 84, train_loss: 0.3504, test_loss: 2.1587, test_f1: 0.5764
 epoch: 85, train_loss: 0.3488, test_loss: 2.1333, test_f1: 0.5912
 epoch: 86, train_loss: 0.3505, test_loss: 2.2364, test_f1: 0.5539
 epoch: 87, train_loss: 0.3522, test_loss: 2.0237, test_f1: 0.5779
 epoch: 88, train_loss: 0.3540, test_loss: 2.3374, test_f1: 0.5903
 epoch: 89, train_loss: 0.3651, test_loss: 2.1954, test_f1: 0.5995
 epoch: 90, train_loss: 0.3563, test_loss: 2.2989, test_f1: 0.5608
 epoch: 91, train_loss: 0.3370, test_loss: 2.5272, test_f1: 0.5810
 epoch: 92, train_loss: 0.3277, test_loss: 2.6154, test_f1: 0.5439
 epoch: 93, train_loss: 0.3212, test_loss: 2.4604, test_f1: 0.5786
 epoch: 94, train_loss: 0.3303, test_loss: 2.3608, test_f1: 0.5503
 epoch: 95, train_loss: 0.3034, test_loss: 2.1708, test_f1: 0.5665
 epoch: 96, train_loss: 0.3002, test_loss: 2.3069, test_f1: 0.5786
 epoch: 97, train_loss: 0.3026, test_loss: 2.3847, test_f1: 0.5734
 epoch: 98, train_loss: 0.3127, test_loss: 2.2698, test_f1: 0.5943
 epoch: 99, train_loss: 0.2853, test_loss: 2.3442, test_f1: 0.5850
##################ITERATION #6 ****************************************
 epoch: 0, train_loss: 1.2926, test_loss: 1.3288, test_f1: 0.2281
 epoch: 1, train_loss: 1.1828, test_loss: 1.2945, test_f1: 0.3563
 epoch: 2, train_loss: 1.1036, test_loss: 1.2667, test_f1: 0.5216
 epoch: 3, train_loss: 1.0522, test_loss: 1.2989, test_f1: 0.5324
 epoch: 4, train_loss: 1.0524, test_loss: 1.2760, test_f1: 0.5168
 epoch: 5, train_loss: 1.0042, test_loss: 1.2160, test_f1: 0.5359
 epoch: 6, train_loss: 0.9678, test_loss: 1.2095, test_f1: 0.5374
 epoch: 7, train_loss: 0.9625, test_loss: 1.2559, test_f1: 0.4731
 epoch: 8, train_loss: 0.9086, test_loss: 1.2048, test_f1: 0.5386
 epoch: 9, train_loss: 0.9196, test_loss: 1.1323, test_f1: 0.5344
 epoch: 10, train_loss: 0.8839, test_loss: 1.1404, test_f1: 0.5663
 epoch: 11, train_loss: 0.8596, test_loss: 1.1437, test_f1: 0.5496
 epoch: 12, train_loss: 0.8377, test_loss: 1.2381, test_f1: 0.5507
 epoch: 13, train_loss: 0.8355, test_loss: 1.1729, test_f1: 0.5673
 epoch: 14, train_loss: 0.8408, test_loss: 1.2149, test_f1: 0.5430
 epoch: 15, train_loss: 0.8281, test_loss: 1.2353, test_f1: 0.5727
 epoch: 16, train_loss: 0.8067, test_loss: 1.1895, test_f1: 0.5381
 epoch: 17, train_loss: 0.7724, test_loss: 1.3164, test_f1: 0.5300
 epoch: 18, train_loss: 0.7847, test_loss: 1.2485, test_f1: 0.5283
 epoch: 19, train_loss: 0.7739, test_loss: 1.1856, test_f1: 0.5907
 epoch: 20, train_loss: 0.7771, test_loss: 1.3487, test_f1: 0.5471
 epoch: 21, train_loss: 0.7306, test_loss: 1.3079, test_f1: 0.5840
 epoch: 22, train_loss: 0.7168, test_loss: 1.2999, test_f1: 0.5734
 epoch: 23, train_loss: 0.7342, test_loss: 1.5448, test_f1: 0.5456
 epoch: 24, train_loss: 0.6978, test_loss: 1.5812, test_f1: 0.5776
 epoch: 25, train_loss: 0.7078, test_loss: 1.5851, test_f1: 0.5422
 epoch: 26, train_loss: 0.6906, test_loss: 1.8757, test_f1: 0.5342
 epoch: 27, train_loss: 0.7050, test_loss: 1.5378, test_f1: 0.5669
 epoch: 28, train_loss: 0.7239, test_loss: 1.6652, test_f1: 0.5198
 epoch: 29, train_loss: 0.7123, test_loss: 1.4655, test_f1: 0.5414
 epoch: 30, train_loss: 0.6859, test_loss: 1.5978, test_f1: 0.5686
 epoch: 31, train_loss: 0.6750, test_loss: 1.6357, test_f1: 0.5594
 epoch: 32, train_loss: 0.6787, test_loss: 1.7556, test_f1: 0.5754
 epoch: 33, train_loss: 0.6636, test_loss: 1.4758, test_f1: 0.5571
 epoch: 34, train_loss: 0.6305, test_loss: 1.8758, test_f1: 0.5400
 epoch: 35, train_loss: 0.6322, test_loss: 1.7234, test_f1: 0.5822
 epoch: 36, train_loss: 0.6468, test_loss: 1.5259, test_f1: 0.5576
 epoch: 37, train_loss: 0.6163, test_loss: 2.0011, test_f1: 0.5332
 epoch: 38, train_loss: 0.6273, test_loss: 1.9128, test_f1: 0.5496
 epoch: 39, train_loss: 0.6083, test_loss: 2.3093, test_f1: 0.5299
 epoch: 40, train_loss: 0.5866, test_loss: 1.9080, test_f1: 0.5388
 epoch: 41, train_loss: 0.6042, test_loss: 1.8061, test_f1: 0.5555
 epoch: 42, train_loss: 0.5860, test_loss: 2.1872, test_f1: 0.5032
 epoch: 43, train_loss: 0.6056, test_loss: 1.7778, test_f1: 0.5798
 epoch: 44, train_loss: 0.5573, test_loss: 1.7600, test_f1: 0.5360
 epoch: 45, train_loss: 0.5657, test_loss: 1.6807, test_f1: 0.6194
 epoch: 46, train_loss: 0.5838, test_loss: 2.1831, test_f1: 0.5189
 epoch: 47, train_loss: 0.5684, test_loss: 1.9458, test_f1: 0.5919
 epoch: 48, train_loss: 0.5294, test_loss: 1.9615, test_f1: 0.5489
 epoch: 49, train_loss: 0.5551, test_loss: 1.7105, test_f1: 0.5629
 epoch: 50, train_loss: 0.5532, test_loss: 1.7470, test_f1: 0.5535
 epoch: 51, train_loss: 0.4986, test_loss: 1.8581, test_f1: 0.5758
 epoch: 52, train_loss: 0.4590, test_loss: 1.9578, test_f1: 0.5916
 epoch: 53, train_loss: 0.4770, test_loss: 2.0128, test_f1: 0.5428
 epoch: 54, train_loss: 0.4509, test_loss: 1.9547, test_f1: 0.5926
 epoch: 55, train_loss: 0.4390, test_loss: 2.2928, test_f1: 0.5616
 epoch: 56, train_loss: 0.4563, test_loss: 2.1233, test_f1: 0.6053
 epoch: 57, train_loss: 0.4307, test_loss: 2.3998, test_f1: 0.5690
 epoch: 58, train_loss: 0.4140, test_loss: 2.7868, test_f1: 0.5617
 epoch: 59, train_loss: 0.4266, test_loss: 2.7498, test_f1: 0.5490
 epoch: 60, train_loss: 0.3933, test_loss: 2.2710, test_f1: 0.6075
 epoch: 61, train_loss: 0.4104, test_loss: 2.3362, test_f1: 0.5766
 epoch: 62, train_loss: 0.3866, test_loss: 2.2868, test_f1: 0.5973
 epoch: 63, train_loss: 0.4096, test_loss: 2.3011, test_f1: 0.5683
 epoch: 64, train_loss: 0.4121, test_loss: 2.4706, test_f1: 0.5756
 epoch: 65, train_loss: 0.4327, test_loss: 2.7449, test_f1: 0.5614
 epoch: 66, train_loss: 0.3920, test_loss: 2.6008, test_f1: 0.5621
 epoch: 67, train_loss: 0.3949, test_loss: 3.0416, test_f1: 0.5656
 epoch: 68, train_loss: 0.3821, test_loss: 2.5260, test_f1: 0.5611
 epoch: 69, train_loss: 0.3866, test_loss: 2.3413, test_f1: 0.5777
 epoch: 70, train_loss: 0.3673, test_loss: 2.6387, test_f1: 0.5842
 epoch: 71, train_loss: 0.3513, test_loss: 2.5946, test_f1: 0.5914
 epoch: 72, train_loss: 0.3485, test_loss: 3.1007, test_f1: 0.5314
 epoch: 73, train_loss: 0.3889, test_loss: 3.0238, test_f1: 0.5885
 epoch: 74, train_loss: 0.3774, test_loss: 2.9841, test_f1: 0.5592
 epoch: 75, train_loss: 0.3869, test_loss: 2.7913, test_f1: 0.5950
 epoch: 76, train_loss: 0.3638, test_loss: 2.5208, test_f1: 0.5995
 epoch: 77, train_loss: 0.3570, test_loss: 2.9866, test_f1: 0.5852
 epoch: 78, train_loss: 0.3405, test_loss: 2.7065, test_f1: 0.5685
 epoch: 79, train_loss: 0.3342, test_loss: 2.6637, test_f1: 0.5787
 epoch: 80, train_loss: 0.3317, test_loss: 3.1972, test_f1: 0.5572
 epoch: 81, train_loss: 0.3412, test_loss: 3.4791, test_f1: 0.5657
 epoch: 82, train_loss: 0.3701, test_loss: 3.9708, test_f1: 0.5724
 epoch: 83, train_loss: 0.3353, test_loss: 3.2820, test_f1: 0.5704
 epoch: 84, train_loss: 0.3252, test_loss: 3.4592, test_f1: 0.5955
 epoch: 85, train_loss: 0.3574, test_loss: 3.2047, test_f1: 0.5620
 epoch: 86, train_loss: 0.3434, test_loss: 3.2029, test_f1: 0.5695
 epoch: 87, train_loss: 0.3408, test_loss: 3.2122, test_f1: 0.5784
 epoch: 88, train_loss: 0.3065, test_loss: 3.0236, test_f1: 0.5840
 epoch: 89, train_loss: 0.2959, test_loss: 3.0393, test_f1: 0.5957
 epoch: 90, train_loss: 0.3188, test_loss: 3.3097, test_f1: 0.5686
 epoch: 91, train_loss: 0.3193, test_loss: 2.9813, test_f1: 0.5868
 epoch: 92, train_loss: 0.3567, test_loss: 3.0280, test_f1: 0.5745
 epoch: 93, train_loss: 0.3300, test_loss: 2.6609, test_f1: 0.5762
 epoch: 94, train_loss: 0.3393, test_loss: 3.0959, test_f1: 0.5557
 epoch: 95, train_loss: 0.3132, test_loss: 3.1086, test_f1: 0.5946
 epoch: 96, train_loss: 0.3058, test_loss: 3.2014, test_f1: 0.5728
 epoch: 97, train_loss: 0.2658, test_loss: 2.7063, test_f1: 0.5555
 epoch: 98, train_loss: 0.2930, test_loss: 2.9797, test_f1: 0.5964
 epoch: 99, train_loss: 0.3305, test_loss: 2.8229, test_f1: 0.6151
##################ITERATION #7 ****************************************
 epoch: 0, train_loss: 1.3244, test_loss: 1.3586, test_f1: 0.2759
 epoch: 1, train_loss: 1.2132, test_loss: 1.3105, test_f1: 0.2917
 epoch: 2, train_loss: 1.1549, test_loss: 1.2652, test_f1: 0.4345
 epoch: 3, train_loss: 1.0975, test_loss: 1.2012, test_f1: 0.4866
 epoch: 4, train_loss: 1.0475, test_loss: 1.1976, test_f1: 0.4779
 epoch: 5, train_loss: 1.0327, test_loss: 1.2212, test_f1: 0.5190
 epoch: 6, train_loss: 1.0118, test_loss: 1.2295, test_f1: 0.5136
 epoch: 7, train_loss: 0.9681, test_loss: 1.2700, test_f1: 0.4884
 epoch: 8, train_loss: 0.9470, test_loss: 1.2221, test_f1: 0.5349
 epoch: 9, train_loss: 0.9569, test_loss: 1.2146, test_f1: 0.4910
 epoch: 10, train_loss: 0.9149, test_loss: 1.2536, test_f1: 0.5018
 epoch: 11, train_loss: 0.9321, test_loss: 1.1841, test_f1: 0.5267
 epoch: 12, train_loss: 0.8699, test_loss: 1.3449, test_f1: 0.4898
 epoch: 13, train_loss: 0.8711, test_loss: 1.3801, test_f1: 0.5420
 epoch: 14, train_loss: 0.8616, test_loss: 1.4259, test_f1: 0.5480
 epoch: 15, train_loss: 0.8330, test_loss: 1.4139, test_f1: 0.5472
 epoch: 16, train_loss: 0.8219, test_loss: 1.2967, test_f1: 0.5446
 epoch: 17, train_loss: 0.8133, test_loss: 1.4835, test_f1: 0.5037
 epoch: 18, train_loss: 0.8005, test_loss: 1.2741, test_f1: 0.5608
 epoch: 19, train_loss: 0.7892, test_loss: 1.4586, test_f1: 0.5194
 epoch: 20, train_loss: 0.7793, test_loss: 1.4839, test_f1: 0.5503
 epoch: 21, train_loss: 0.7478, test_loss: 1.5919, test_f1: 0.5337
 epoch: 22, train_loss: 0.7785, test_loss: 1.3484, test_f1: 0.5535
 epoch: 23, train_loss: 0.7599, test_loss: 1.4251, test_f1: 0.5415
 epoch: 24, train_loss: 0.7289, test_loss: 1.3769, test_f1: 0.5582
 epoch: 25, train_loss: 0.7244, test_loss: 1.5588, test_f1: 0.5558
 epoch: 26, train_loss: 0.7266, test_loss: 1.3092, test_f1: 0.5793
 epoch: 27, train_loss: 0.7046, test_loss: 1.6222, test_f1: 0.5384
 epoch: 28, train_loss: 0.7245, test_loss: 1.5949, test_f1: 0.5051
 epoch: 29, train_loss: 0.7184, test_loss: 1.3172, test_f1: 0.5250
 epoch: 30, train_loss: 0.7047, test_loss: 1.6130, test_f1: 0.5671
 epoch: 31, train_loss: 0.6638, test_loss: 1.3431, test_f1: 0.6077
 epoch: 32, train_loss: 0.6641, test_loss: 1.5880, test_f1: 0.5182
 epoch: 33, train_loss: 0.6159, test_loss: 1.5066, test_f1: 0.5722
 epoch: 34, train_loss: 0.6202, test_loss: 1.5130, test_f1: 0.5884
 epoch: 35, train_loss: 0.6194, test_loss: 1.7311, test_f1: 0.5322
 epoch: 36, train_loss: 0.6204, test_loss: 1.5579, test_f1: 0.5624
 epoch: 37, train_loss: 0.6445, test_loss: 1.6171, test_f1: 0.5254
 epoch: 38, train_loss: 0.6149, test_loss: 1.8251, test_f1: 0.6157
 epoch: 39, train_loss: 0.5920, test_loss: 1.6197, test_f1: 0.5707
 epoch: 40, train_loss: 0.5933, test_loss: 2.1951, test_f1: 0.5389
 epoch: 41, train_loss: 0.5867, test_loss: 2.3185, test_f1: 0.5190
 epoch: 42, train_loss: 0.5980, test_loss: 2.0289, test_f1: 0.5876
 epoch: 43, train_loss: 0.5718, test_loss: 1.9552, test_f1: 0.5150
 epoch: 44, train_loss: 0.5768, test_loss: 2.1788, test_f1: 0.5867
 epoch: 45, train_loss: 0.5767, test_loss: 2.2851, test_f1: 0.5730
 epoch: 46, train_loss: 0.5756, test_loss: 1.5963, test_f1: 0.6088
 epoch: 47, train_loss: 0.5518, test_loss: 1.7660, test_f1: 0.5529
 epoch: 48, train_loss: 0.5379, test_loss: 1.9816, test_f1: 0.5609
 epoch: 49, train_loss: 0.5534, test_loss: 1.8975, test_f1: 0.5579
 epoch: 50, train_loss: 0.5252, test_loss: 2.0305, test_f1: 0.5537
 epoch: 51, train_loss: 0.4862, test_loss: 2.1142, test_f1: 0.5607
 epoch: 52, train_loss: 0.4805, test_loss: 2.0922, test_f1: 0.5463
 epoch: 53, train_loss: 0.4591, test_loss: 2.1883, test_f1: 0.5548
 epoch: 54, train_loss: 0.4746, test_loss: 2.2870, test_f1: 0.5712
 epoch: 55, train_loss: 0.4465, test_loss: 2.2813, test_f1: 0.5642
 epoch: 56, train_loss: 0.4437, test_loss: 2.4199, test_f1: 0.5861
 epoch: 57, train_loss: 0.4532, test_loss: 2.4653, test_f1: 0.5357
 epoch: 58, train_loss: 0.4169, test_loss: 2.5449, test_f1: 0.5389
 epoch: 59, train_loss: 0.4050, test_loss: 2.5446, test_f1: 0.5624
 epoch: 60, train_loss: 0.4227, test_loss: 2.1389, test_f1: 0.5782
 epoch: 61, train_loss: 0.4145, test_loss: 2.4910, test_f1: 0.5440
 epoch: 62, train_loss: 0.4395, test_loss: 2.5659, test_f1: 0.5183
 epoch: 63, train_loss: 0.3999, test_loss: 2.4369, test_f1: 0.5554
 epoch: 64, train_loss: 0.4304, test_loss: 2.7096, test_f1: 0.5383
 epoch: 65, train_loss: 0.4037, test_loss: 2.7022, test_f1: 0.5709
 epoch: 66, train_loss: 0.3939, test_loss: 2.5298, test_f1: 0.5439
 epoch: 67, train_loss: 0.4342, test_loss: 2.7727, test_f1: 0.5311
 epoch: 68, train_loss: 0.4103, test_loss: 2.6477, test_f1: 0.5470
 epoch: 69, train_loss: 0.3909, test_loss: 2.4376, test_f1: 0.5450
 epoch: 70, train_loss: 0.3898, test_loss: 2.4257, test_f1: 0.5690
 epoch: 71, train_loss: 0.4007, test_loss: 2.5520, test_f1: 0.5507
 epoch: 72, train_loss: 0.3825, test_loss: 2.5240, test_f1: 0.5386
 epoch: 73, train_loss: 0.3633, test_loss: 2.6137, test_f1: 0.5543
 epoch: 74, train_loss: 0.3662, test_loss: 2.7449, test_f1: 0.5282
 epoch: 75, train_loss: 0.3793, test_loss: 2.5743, test_f1: 0.5429
 epoch: 76, train_loss: 0.3625, test_loss: 2.3226, test_f1: 0.5595
 epoch: 77, train_loss: 0.3602, test_loss: 2.8550, test_f1: 0.5379
 epoch: 78, train_loss: 0.3588, test_loss: 2.5318, test_f1: 0.5558
 epoch: 79, train_loss: 0.3425, test_loss: 2.7603, test_f1: 0.5344
 epoch: 80, train_loss: 0.3394, test_loss: 2.6389, test_f1: 0.5213
 epoch: 81, train_loss: 0.3468, test_loss: 2.8338, test_f1: 0.5401
 epoch: 82, train_loss: 0.3167, test_loss: 2.8097, test_f1: 0.5427
 epoch: 83, train_loss: 0.3442, test_loss: 2.7835, test_f1: 0.5445
 epoch: 84, train_loss: 0.3159, test_loss: 3.0403, test_f1: 0.5236
 epoch: 85, train_loss: 0.3400, test_loss: 2.9052, test_f1: 0.5626
 epoch: 86, train_loss: 0.3274, test_loss: 2.7027, test_f1: 0.5927
 epoch: 87, train_loss: 0.3212, test_loss: 3.1679, test_f1: 0.5487
 epoch: 88, train_loss: 0.3278, test_loss: 2.7604, test_f1: 0.5518
 epoch: 89, train_loss: 0.3286, test_loss: 3.0726, test_f1: 0.5678
 epoch: 90, train_loss: 0.3155, test_loss: 3.2729, test_f1: 0.5468
 epoch: 91, train_loss: 0.3550, test_loss: 3.0286, test_f1: 0.5586
 epoch: 92, train_loss: 0.3337, test_loss: 3.2260, test_f1: 0.5614
 epoch: 93, train_loss: 0.3552, test_loss: 3.1379, test_f1: 0.5367
 epoch: 94, train_loss: 0.3319, test_loss: 3.0292, test_f1: 0.5458
 epoch: 95, train_loss: 0.3386, test_loss: 3.0860, test_f1: 0.5860
 epoch: 96, train_loss: 0.3464, test_loss: 3.4833, test_f1: 0.5188
 epoch: 97, train_loss: 0.3367, test_loss: 3.0653, test_f1: 0.5464
 epoch: 98, train_loss: 0.3105, test_loss: 3.1157, test_f1: 0.5590
 epoch: 99, train_loss: 0.2950, test_loss: 3.2638, test_f1: 0.5362
##################ITERATION #8 ****************************************
 epoch: 0, train_loss: 1.3501, test_loss: 1.3358, test_f1: 0.2904
 epoch: 1, train_loss: 1.1956, test_loss: 1.2461, test_f1: 0.4670
 epoch: 2, train_loss: 1.1056, test_loss: 1.2636, test_f1: 0.5150
 epoch: 3, train_loss: 1.0753, test_loss: 1.1702, test_f1: 0.5544
 epoch: 4, train_loss: 1.0350, test_loss: 1.1755, test_f1: 0.5286
 epoch: 5, train_loss: 1.0377, test_loss: 1.1706, test_f1: 0.5498
 epoch: 6, train_loss: 1.0108, test_loss: 1.2414, test_f1: 0.5133
 epoch: 7, train_loss: 0.9576, test_loss: 1.1344, test_f1: 0.5776
 epoch: 8, train_loss: 0.9377, test_loss: 1.1788, test_f1: 0.5131
 epoch: 9, train_loss: 0.9147, test_loss: 1.1735, test_f1: 0.4981
 epoch: 10, train_loss: 0.9098, test_loss: 1.1435, test_f1: 0.5319
 epoch: 11, train_loss: 0.8727, test_loss: 1.2007, test_f1: 0.4846
 epoch: 12, train_loss: 0.8814, test_loss: 1.0152, test_f1: 0.5902
 epoch: 13, train_loss: 0.8427, test_loss: 1.1295, test_f1: 0.5511
 epoch: 14, train_loss: 0.8358, test_loss: 1.0762, test_f1: 0.5740
 epoch: 15, train_loss: 0.8287, test_loss: 1.0584, test_f1: 0.5692
 epoch: 16, train_loss: 0.8006, test_loss: 1.0568, test_f1: 0.6003
 epoch: 17, train_loss: 0.8137, test_loss: 1.1071, test_f1: 0.5905
 epoch: 18, train_loss: 0.8160, test_loss: 1.3007, test_f1: 0.5927
 epoch: 19, train_loss: 0.8008, test_loss: 1.2819, test_f1: 0.5407
 epoch: 20, train_loss: 0.7878, test_loss: 1.2039, test_f1: 0.5376
 epoch: 21, train_loss: 0.7748, test_loss: 1.2203, test_f1: 0.5713
 epoch: 22, train_loss: 0.7641, test_loss: 1.3116, test_f1: 0.4914
 epoch: 23, train_loss: 0.7597, test_loss: 1.1187, test_f1: 0.5792
 epoch: 24, train_loss: 0.7729, test_loss: 1.0751, test_f1: 0.5543
 epoch: 25, train_loss: 0.7279, test_loss: 1.1883, test_f1: 0.5779
 epoch: 26, train_loss: 0.7285, test_loss: 1.1309, test_f1: 0.5747
 epoch: 27, train_loss: 0.7566, test_loss: 1.1864, test_f1: 0.6204
 epoch: 28, train_loss: 0.7262, test_loss: 1.1687, test_f1: 0.5606
 epoch: 29, train_loss: 0.7019, test_loss: 1.1055, test_f1: 0.5758
 epoch: 30, train_loss: 0.6802, test_loss: 1.0514, test_f1: 0.6109
 epoch: 31, train_loss: 0.6795, test_loss: 1.2560, test_f1: 0.6158
 epoch: 32, train_loss: 0.6899, test_loss: 1.2648, test_f1: 0.5906
 epoch: 33, train_loss: 0.6594, test_loss: 1.1044, test_f1: 0.6191
 epoch: 34, train_loss: 0.6676, test_loss: 1.1908, test_f1: 0.5904
 epoch: 35, train_loss: 0.6406, test_loss: 1.1702, test_f1: 0.5655
 epoch: 36, train_loss: 0.6553, test_loss: 1.2819, test_f1: 0.5552
 epoch: 37, train_loss: 0.6551, test_loss: 2.1754, test_f1: 0.5982
 epoch: 38, train_loss: 0.6589, test_loss: 1.1817, test_f1: 0.5951
 epoch: 39, train_loss: 0.6471, test_loss: 1.6381, test_f1: 0.5761
 epoch: 40, train_loss: 0.6340, test_loss: 1.5556, test_f1: 0.5531
 epoch: 41, train_loss: 0.6257, test_loss: 1.4817, test_f1: 0.5875
 epoch: 42, train_loss: 0.6331, test_loss: 1.2710, test_f1: 0.5896
 epoch: 43, train_loss: 0.6007, test_loss: 1.4474, test_f1: 0.5829
 epoch: 44, train_loss: 0.5980, test_loss: 1.4298, test_f1: 0.5933
 epoch: 45, train_loss: 0.6245, test_loss: 1.5750, test_f1: 0.5469
 epoch: 46, train_loss: 0.5755, test_loss: 1.3468, test_f1: 0.5913
 epoch: 47, train_loss: 0.5676, test_loss: 1.3024, test_f1: 0.6166
 epoch: 48, train_loss: 0.5701, test_loss: 1.5122, test_f1: 0.5613
 epoch: 49, train_loss: 0.6031, test_loss: 1.4290, test_f1: 0.5873
 epoch: 50, train_loss: 0.5604, test_loss: 1.4928, test_f1: 0.5928
 epoch: 51, train_loss: 0.5419, test_loss: 1.2601, test_f1: 0.6148
 epoch: 52, train_loss: 0.5085, test_loss: 1.4422, test_f1: 0.5861
 epoch: 53, train_loss: 0.4985, test_loss: 1.5160, test_f1: 0.6023
 epoch: 54, train_loss: 0.4887, test_loss: 1.2548, test_f1: 0.6148
 epoch: 55, train_loss: 0.4954, test_loss: 1.4449, test_f1: 0.5860
 epoch: 56, train_loss: 0.4992, test_loss: 1.3538, test_f1: 0.6138
 epoch: 57, train_loss: 0.4796, test_loss: 1.5254, test_f1: 0.6224
 epoch: 58, train_loss: 0.4560, test_loss: 1.5844, test_f1: 0.6131
 epoch: 59, train_loss: 0.4741, test_loss: 1.8776, test_f1: 0.5872
 epoch: 60, train_loss: 0.4521, test_loss: 1.5782, test_f1: 0.6031
 epoch: 61, train_loss: 0.4543, test_loss: 1.5199, test_f1: 0.6392
 epoch: 62, train_loss: 0.4538, test_loss: 1.6497, test_f1: 0.6170
 epoch: 63, train_loss: 0.4463, test_loss: 1.6246, test_f1: 0.6086
 epoch: 64, train_loss: 0.4541, test_loss: 1.5980, test_f1: 0.6351
 epoch: 65, train_loss: 0.4324, test_loss: 1.9081, test_f1: 0.5796
 epoch: 66, train_loss: 0.4173, test_loss: 1.7023, test_f1: 0.5999
 epoch: 67, train_loss: 0.4434, test_loss: 1.6421, test_f1: 0.5944
 epoch: 68, train_loss: 0.4306, test_loss: 1.7685, test_f1: 0.5740
 epoch: 69, train_loss: 0.4384, test_loss: 1.7855, test_f1: 0.5747
 epoch: 70, train_loss: 0.4284, test_loss: 1.8791, test_f1: 0.5513
 epoch: 71, train_loss: 0.4064, test_loss: 1.6161, test_f1: 0.6044
 epoch: 72, train_loss: 0.4156, test_loss: 1.7624, test_f1: 0.5937
 epoch: 73, train_loss: 0.4180, test_loss: 1.9288, test_f1: 0.5726
 epoch: 74, train_loss: 0.4341, test_loss: 1.8639, test_f1: 0.5879
 epoch: 75, train_loss: 0.4295, test_loss: 1.7576, test_f1: 0.6169
 epoch: 76, train_loss: 0.4064, test_loss: 1.6853, test_f1: 0.5779
 epoch: 77, train_loss: 0.3857, test_loss: 1.7359, test_f1: 0.5862
 epoch: 78, train_loss: 0.3763, test_loss: 1.8962, test_f1: 0.5592
 epoch: 79, train_loss: 0.3986, test_loss: 1.8135, test_f1: 0.6008
 epoch: 80, train_loss: 0.4109, test_loss: 2.2815, test_f1: 0.5533
 epoch: 81, train_loss: 0.4171, test_loss: 1.9569, test_f1: 0.6191
 epoch: 82, train_loss: 0.4124, test_loss: 1.9114, test_f1: 0.6099
 epoch: 83, train_loss: 0.3706, test_loss: 1.8540, test_f1: 0.6036
 epoch: 84, train_loss: 0.3644, test_loss: 1.9066, test_f1: 0.5951
 epoch: 85, train_loss: 0.3643, test_loss: 2.1985, test_f1: 0.5821
 epoch: 86, train_loss: 0.3453, test_loss: 2.0971, test_f1: 0.5960
 epoch: 87, train_loss: 0.3980, test_loss: 1.9542, test_f1: 0.5902
 epoch: 88, train_loss: 0.3822, test_loss: 2.4779, test_f1: 0.5725
 epoch: 89, train_loss: 0.3776, test_loss: 2.2723, test_f1: 0.5590
 epoch: 90, train_loss: 0.3617, test_loss: 2.0778, test_f1: 0.5948
 epoch: 91, train_loss: 0.3581, test_loss: 2.1544, test_f1: 0.6165
 epoch: 92, train_loss: 0.3548, test_loss: 2.0940, test_f1: 0.5734
 epoch: 93, train_loss: 0.3543, test_loss: 2.1365, test_f1: 0.6209
 epoch: 94, train_loss: 0.3519, test_loss: 2.2148, test_f1: 0.6184
 epoch: 95, train_loss: 0.3251, test_loss: 2.0829, test_f1: 0.6014
 epoch: 96, train_loss: 0.3390, test_loss: 2.2315, test_f1: 0.6072
 epoch: 97, train_loss: 0.3210, test_loss: 2.7817, test_f1: 0.5843
 epoch: 98, train_loss: 0.3489, test_loss: 2.5270, test_f1: 0.5686
 epoch: 99, train_loss: 0.3094, test_loss: 2.0990, test_f1: 0.6078
##################ITERATION #9 ****************************************
 epoch: 0, train_loss: 1.2868, test_loss: 1.3022, test_f1: 0.2728
 epoch: 1, train_loss: 1.1294, test_loss: 1.2148, test_f1: 0.4547
 epoch: 2, train_loss: 1.0587, test_loss: 1.1539, test_f1: 0.5508
 epoch: 3, train_loss: 1.0751, test_loss: 1.1435, test_f1: 0.5304
 epoch: 4, train_loss: 1.0117, test_loss: 1.1511, test_f1: 0.5119
 epoch: 5, train_loss: 0.9712, test_loss: 1.1803, test_f1: 0.5517
 epoch: 6, train_loss: 0.9449, test_loss: 1.1857, test_f1: 0.5342
 epoch: 7, train_loss: 0.9274, test_loss: 1.2098, test_f1: 0.5496
 epoch: 8, train_loss: 0.9034, test_loss: 1.1133, test_f1: 0.5701
 epoch: 9, train_loss: 0.8919, test_loss: 1.2021, test_f1: 0.5604
 epoch: 10, train_loss: 0.8597, test_loss: 1.1023, test_f1: 0.5791
 epoch: 11, train_loss: 0.8638, test_loss: 1.0648, test_f1: 0.5954
 epoch: 12, train_loss: 0.8413, test_loss: 1.1217, test_f1: 0.5807
 epoch: 13, train_loss: 0.8122, test_loss: 1.2346, test_f1: 0.5216
 epoch: 14, train_loss: 0.8016, test_loss: 1.2140, test_f1: 0.6022
 epoch: 15, train_loss: 0.7642, test_loss: 1.2344, test_f1: 0.6308
 epoch: 16, train_loss: 0.7641, test_loss: 1.2918, test_f1: 0.6107
 epoch: 17, train_loss: 0.7432, test_loss: 1.3046, test_f1: 0.5896
 epoch: 18, train_loss: 0.7324, test_loss: 1.4627, test_f1: 0.5381
 epoch: 19, train_loss: 0.7380, test_loss: 1.3890, test_f1: 0.5792
 epoch: 20, train_loss: 0.7010, test_loss: 1.3633, test_f1: 0.6190
 epoch: 21, train_loss: 0.7384, test_loss: 1.3723, test_f1: 0.5785
 epoch: 22, train_loss: 0.7198, test_loss: 1.3068, test_f1: 0.5974
 epoch: 23, train_loss: 0.6606, test_loss: 1.3992, test_f1: 0.6206
 epoch: 24, train_loss: 0.6704, test_loss: 1.4030, test_f1: 0.5664
 epoch: 25, train_loss: 0.6444, test_loss: 1.5099, test_f1: 0.6057
 epoch: 26, train_loss: 0.6667, test_loss: 1.3501, test_f1: 0.5967
 epoch: 27, train_loss: 0.6507, test_loss: 1.4848, test_f1: 0.5663
 epoch: 28, train_loss: 0.6327, test_loss: 1.3681, test_f1: 0.6182
 epoch: 29, train_loss: 0.6352, test_loss: 1.4798, test_f1: 0.5960
 epoch: 30, train_loss: 0.6382, test_loss: 1.5898, test_f1: 0.6002
 epoch: 31, train_loss: 0.6036, test_loss: 1.7191, test_f1: 0.6336
 epoch: 32, train_loss: 0.6222, test_loss: 1.7112, test_f1: 0.5909
 epoch: 33, train_loss: 0.5576, test_loss: 1.6660, test_f1: 0.6001
 epoch: 34, train_loss: 0.5622, test_loss: 1.8126, test_f1: 0.5615
 epoch: 35, train_loss: 0.5936, test_loss: 1.5866, test_f1: 0.5753
 epoch: 36, train_loss: 0.5811, test_loss: 1.7698, test_f1: 0.5897
 epoch: 37, train_loss: 0.5364, test_loss: 1.9452, test_f1: 0.5439
 epoch: 38, train_loss: 0.5583, test_loss: 1.6732, test_f1: 0.5641
 epoch: 39, train_loss: 0.5394, test_loss: 1.6554, test_f1: 0.6070
 epoch: 40, train_loss: 0.5082, test_loss: 1.8888, test_f1: 0.5471
 epoch: 41, train_loss: 0.5330, test_loss: 1.9176, test_f1: 0.5485
 epoch: 42, train_loss: 0.5209, test_loss: 1.7578, test_f1: 0.6132
 epoch: 43, train_loss: 0.5279, test_loss: 1.7083, test_f1: 0.5537
 epoch: 44, train_loss: 0.4865, test_loss: 1.7297, test_f1: 0.5708
 epoch: 45, train_loss: 0.4962, test_loss: 2.0576, test_f1: 0.5794
 epoch: 46, train_loss: 0.4849, test_loss: 1.8909, test_f1: 0.5309
 epoch: 47, train_loss: 0.4795, test_loss: 2.0439, test_f1: 0.5699
 epoch: 48, train_loss: 0.4930, test_loss: 1.9759, test_f1: 0.5789
 epoch: 49, train_loss: 0.4764, test_loss: 1.7481, test_f1: 0.5463
 epoch: 50, train_loss: 0.4556, test_loss: 2.4523, test_f1: 0.5878
 epoch: 51, train_loss: 0.4353, test_loss: 2.3674, test_f1: 0.5926
 epoch: 52, train_loss: 0.3766, test_loss: 2.4727, test_f1: 0.5902
 epoch: 53, train_loss: 0.3896, test_loss: 2.3988, test_f1: 0.5479
 epoch: 54, train_loss: 0.3837, test_loss: 2.6269, test_f1: 0.5697
 epoch: 55, train_loss: 0.3480, test_loss: 2.7238, test_f1: 0.5506
 epoch: 56, train_loss: 0.3810, test_loss: 2.3332, test_f1: 0.5485
 epoch: 57, train_loss: 0.3644, test_loss: 2.6271, test_f1: 0.5881
 epoch: 58, train_loss: 0.3659, test_loss: 2.5225, test_f1: 0.5892
 epoch: 59, train_loss: 0.3566, test_loss: 2.6504, test_f1: 0.5594
 epoch: 60, train_loss: 0.3524, test_loss: 2.2282, test_f1: 0.5914
 epoch: 61, train_loss: 0.3431, test_loss: 2.4062, test_f1: 0.5641
 epoch: 62, train_loss: 0.3461, test_loss: 2.2209, test_f1: 0.5939
 epoch: 63, train_loss: 0.3432, test_loss: 2.0964, test_f1: 0.5854
 epoch: 64, train_loss: 0.3232, test_loss: 2.7655, test_f1: 0.5568
 epoch: 65, train_loss: 0.3145, test_loss: 2.2539, test_f1: 0.5859
 epoch: 66, train_loss: 0.3272, test_loss: 2.5057, test_f1: 0.5445
 epoch: 67, train_loss: 0.3311, test_loss: 2.3817, test_f1: 0.5820
 epoch: 68, train_loss: 0.3224, test_loss: 2.5709, test_f1: 0.5884
 epoch: 69, train_loss: 0.3158, test_loss: 2.8156, test_f1: 0.5898
 epoch: 70, train_loss: 0.3130, test_loss: 2.6747, test_f1: 0.5880
 epoch: 71, train_loss: 0.3181, test_loss: 2.5135, test_f1: 0.5839
 epoch: 72, train_loss: 0.2747, test_loss: 2.5692, test_f1: 0.6025
 epoch: 73, train_loss: 0.2929, test_loss: 2.8137, test_f1: 0.5793
 epoch: 74, train_loss: 0.2664, test_loss: 2.7200, test_f1: 0.5773
 epoch: 75, train_loss: 0.2879, test_loss: 2.8509, test_f1: 0.5791
 epoch: 76, train_loss: 0.3138, test_loss: 2.8908, test_f1: 0.5517
 epoch: 77, train_loss: 0.2695, test_loss: 3.1133, test_f1: 0.5612
 epoch: 78, train_loss: 0.2960, test_loss: 3.3702, test_f1: 0.5602
 epoch: 79, train_loss: 0.2763, test_loss: 3.0202, test_f1: 0.5573
 epoch: 80, train_loss: 0.2728, test_loss: 3.3100, test_f1: 0.5955
 epoch: 81, train_loss: 0.2763, test_loss: 3.8636, test_f1: 0.5990
 epoch: 82, train_loss: 0.2694, test_loss: 3.0532, test_f1: 0.5842
 epoch: 83, train_loss: 0.3117, test_loss: 3.2023, test_f1: 0.5512
 epoch: 84, train_loss: 0.2625, test_loss: 3.1065, test_f1: 0.5875
 epoch: 85, train_loss: 0.2637, test_loss: 3.2307, test_f1: 0.5814
 epoch: 86, train_loss: 0.2716, test_loss: 3.2023, test_f1: 0.5928
 epoch: 87, train_loss: 0.2600, test_loss: 3.1125, test_f1: 0.6004
 epoch: 88, train_loss: 0.2542, test_loss: 3.5504, test_f1: 0.5594
 epoch: 89, train_loss: 0.2764, test_loss: 3.3205, test_f1: 0.5894
 epoch: 90, train_loss: 0.2762, test_loss: 3.6635, test_f1: 0.5978
 epoch: 91, train_loss: 0.2773, test_loss: 3.5772, test_f1: 0.5513
 epoch: 92, train_loss: 0.2839, test_loss: 2.8984, test_f1: 0.5870
 epoch: 93, train_loss: 0.2535, test_loss: 3.6032, test_f1: 0.5786
 epoch: 94, train_loss: 0.2573, test_loss: 3.3045, test_f1: 0.5573
 epoch: 95, train_loss: 0.2375, test_loss: 3.1117, test_f1: 0.5791
 epoch: 96, train_loss: 0.2616, test_loss: 2.9487, test_f1: 0.5843
 epoch: 97, train_loss: 0.2545, test_loss: 2.9437, test_f1: 0.5758
 epoch: 98, train_loss: 0.2515, test_loss: 2.9449, test_f1: 0.5865
 epoch: 99, train_loss: 0.2313, test_loss: 3.1151, test_f1: 0.6201

Training completed in 688.72 seconds
Best F1: 0.6646 at epoch 33
Mean F1 across iterations: 0.6205  0.0220
========================FINAL RESULTS================================
FEGIN weighted F1: 0.6646  0.0220
python main.py --data ltspice_demos --representation component_component --model FEGIN --layers 6 --hiddens 64 --batch_size 64 --lr 0.001 --emb_size 512 --epochs 100 --save_appendix component_component_L6_H64_BS64_LR0.001_E512 --no_val
-----



STDERR:
  File "main.py", line 370, in <module>
    main()
  File "main.py", line 254, in main
    dataset = dataset_class(
  File "/home/philip/projects/ltspice_examples_code_repo/Circuit-Completion-Using-GNNs/component_classification_with_link_prediction_head/evaluation/FEGIN/kernel/circuit_datasets.py", line 15, in __init__
    self.data, self.slices = torch.load(self.processed_paths[0])
  File "/home/philip/.local/lib/python3.8/site-packages/torch/serialization.py", line 1040, in load
    warnings.warn(
  File "/usr/lib/python3.8/warnings.py", line 109, in _showwarnmsg
    sw(msg.message, msg.category, msg.filename, msg.lineno,
  File "main.py", line 47, in warn_with_traceback
    traceback.print_stack(file=log)
/home/philip/projects/ltspice_examples_code_repo/Circuit-Completion-Using-GNNs/component_classification_with_link_prediction_head/evaluation/FEGIN/kernel/circuit_datasets.py:15: FutureWarning: You are using `torch.load` with `weights_only=False` (the current default value), which uses the default pickle module implicitly. It is possible to construct malicious pickle data which will execute arbitrary code during unpickling (See https://github.com/pytorch/pytorch/blob/main/SECURITY.md#untrusted-models for more details). In a future release, the default value for `weights_only` will be flipped to `True`. This limits the functions that could be executed during unpickling. Arbitrary objects will no longer be allowed to be loaded via this mode unless they are explicitly allowlisted by the user via `torch.serialization.add_safe_globals`. We recommend you start setting `weights_only=True` for any use case where you don't have full control of the loaded file. Please open an issue on GitHub for any issues related to this experimental feature.
  self.data, self.slices = torch.load(self.processed_paths[0])
