STDOUT:
Results will be saved in /home/philip/projects/ltspice_examples_code_repo/Circuit-Completion-Using-GNNs/component_classification_with_link_prediction_head/evaluation/FEGIN/results/model_FEGIN_dataset_ltspice_examples
Command line input: python main.py --data ltspice_examples --representation component_component --model FEGIN --layers 4 --hiddens 64 --batch_size 32 --lr 0.001 --emb_size 128 --epochs 100 --save_appendix component_component_L4_H64_BS32_LR0.001_E128 --no_val
 is saved.
-----
ltspice_examples - FEGIN
Using 4 layers, 64 hidden units, h = 2
Loading component_component representation dataset
ENTERED
Training FEGIN on component_component representation
Train: 3556, Test: 845
##################ITERATION #0 ****************************************
 epoch: 0, train_loss: 1.2636, test_loss: 1.1685, test_f1: 0.3497
 epoch: 1, train_loss: 1.1689, test_loss: 1.0766, test_f1: 0.4744
 epoch: 2, train_loss: 1.1112, test_loss: 1.0297, test_f1: 0.4791
 epoch: 3, train_loss: 1.0638, test_loss: 0.9906, test_f1: 0.4716
 epoch: 4, train_loss: 1.0378, test_loss: 0.9776, test_f1: 0.4442
 epoch: 5, train_loss: 1.0075, test_loss: 0.9731, test_f1: 0.4943
 epoch: 6, train_loss: 0.9751, test_loss: 0.9911, test_f1: 0.4868
 epoch: 7, train_loss: 0.9832, test_loss: 0.9771, test_f1: 0.4942
 epoch: 8, train_loss: 0.9560, test_loss: 0.9770, test_f1: 0.5169
 epoch: 9, train_loss: 0.9321, test_loss: 1.0124, test_f1: 0.5272
 epoch: 10, train_loss: 0.9287, test_loss: 1.0512, test_f1: 0.5067
 epoch: 11, train_loss: 0.9287, test_loss: 0.9594, test_f1: 0.5343
 epoch: 12, train_loss: 0.9015, test_loss: 0.9341, test_f1: 0.5428
 epoch: 13, train_loss: 0.9010, test_loss: 0.9983, test_f1: 0.5035
 epoch: 14, train_loss: 0.8836, test_loss: 1.0635, test_f1: 0.5162
 epoch: 15, train_loss: 0.8734, test_loss: 1.0647, test_f1: 0.5331
 epoch: 16, train_loss: 0.8628, test_loss: 1.0153, test_f1: 0.4992
 epoch: 17, train_loss: 0.8480, test_loss: 1.0309, test_f1: 0.5492
 epoch: 18, train_loss: 0.8521, test_loss: 0.9762, test_f1: 0.5331
 epoch: 19, train_loss: 0.8702, test_loss: 1.0082, test_f1: 0.5419
 epoch: 20, train_loss: 0.8691, test_loss: 1.0278, test_f1: 0.4784
 epoch: 21, train_loss: 0.8522, test_loss: 1.0693, test_f1: 0.4966
 epoch: 22, train_loss: 0.8373, test_loss: 1.0300, test_f1: 0.5354
 epoch: 23, train_loss: 0.8267, test_loss: 1.0387, test_f1: 0.5416
 epoch: 24, train_loss: 0.8164, test_loss: 1.0721, test_f1: 0.5363
 epoch: 25, train_loss: 0.8045, test_loss: 1.0445, test_f1: 0.5259
 epoch: 26, train_loss: 0.7956, test_loss: 1.0401, test_f1: 0.5321
 epoch: 27, train_loss: 0.7857, test_loss: 1.0684, test_f1: 0.5523
 epoch: 28, train_loss: 0.7893, test_loss: 1.0679, test_f1: 0.5294
 epoch: 29, train_loss: 0.7758, test_loss: 1.1898, test_f1: 0.4790
 epoch: 30, train_loss: 0.7731, test_loss: 1.1557, test_f1: 0.5374
 epoch: 31, train_loss: 0.7612, test_loss: 1.2047, test_f1: 0.5019
 epoch: 32, train_loss: 0.7673, test_loss: 1.0611, test_f1: 0.5689
 epoch: 33, train_loss: 0.7626, test_loss: 1.0703, test_f1: 0.5429
 epoch: 34, train_loss: 0.7584, test_loss: 1.0964, test_f1: 0.5480
 epoch: 35, train_loss: 0.7413, test_loss: 1.0655, test_f1: 0.5421
 epoch: 36, train_loss: 0.7393, test_loss: 1.0642, test_f1: 0.5745
 epoch: 37, train_loss: 0.7393, test_loss: 1.1215, test_f1: 0.5558
 epoch: 38, train_loss: 0.7273, test_loss: 1.0271, test_f1: 0.5649
 epoch: 39, train_loss: 0.7203, test_loss: 1.1703, test_f1: 0.5718
 epoch: 40, train_loss: 0.7269, test_loss: 1.1228, test_f1: 0.5421
 epoch: 41, train_loss: 0.7141, test_loss: 1.0239, test_f1: 0.5589
 epoch: 42, train_loss: 0.7175, test_loss: 1.1276, test_f1: 0.5491
 epoch: 43, train_loss: 0.6855, test_loss: 1.1568, test_f1: 0.5391
 epoch: 44, train_loss: 0.7141, test_loss: 1.1101, test_f1: 0.5636
 epoch: 45, train_loss: 0.6881, test_loss: 1.1169, test_f1: 0.5572
 epoch: 46, train_loss: 0.6819, test_loss: 1.1308, test_f1: 0.5681
 epoch: 47, train_loss: 0.6883, test_loss: 1.1281, test_f1: 0.5446
 epoch: 48, train_loss: 0.7316, test_loss: 1.0789, test_f1: 0.5798
 epoch: 49, train_loss: 0.6863, test_loss: 1.0884, test_f1: 0.5553
 epoch: 50, train_loss: 0.6669, test_loss: 1.1676, test_f1: 0.5520
 epoch: 51, train_loss: 0.6300, test_loss: 1.1649, test_f1: 0.5431
 epoch: 52, train_loss: 0.6055, test_loss: 1.2121, test_f1: 0.5728
 epoch: 53, train_loss: 0.6080, test_loss: 1.1928, test_f1: 0.5145
 epoch: 54, train_loss: 0.6056, test_loss: 1.1812, test_f1: 0.5767
 epoch: 55, train_loss: 0.6095, test_loss: 1.1814, test_f1: 0.5538
 epoch: 56, train_loss: 0.6029, test_loss: 1.1068, test_f1: 0.5625
 epoch: 57, train_loss: 0.5808, test_loss: 1.1667, test_f1: 0.5667
 epoch: 58, train_loss: 0.5870, test_loss: 1.2095, test_f1: 0.5664
 epoch: 59, train_loss: 0.5775, test_loss: 1.2670, test_f1: 0.5567
 epoch: 60, train_loss: 0.5769, test_loss: 1.2625, test_f1: 0.5567
 epoch: 61, train_loss: 0.5945, test_loss: 1.2541, test_f1: 0.5497
 epoch: 62, train_loss: 0.5806, test_loss: 1.3342, test_f1: 0.5432
 epoch: 63, train_loss: 0.6006, test_loss: 1.1787, test_f1: 0.5715
 epoch: 64, train_loss: 0.5734, test_loss: 1.2408, test_f1: 0.5771
 epoch: 65, train_loss: 0.5633, test_loss: 1.2481, test_f1: 0.5524
 epoch: 66, train_loss: 0.5846, test_loss: 1.2363, test_f1: 0.5593
 epoch: 67, train_loss: 0.5745, test_loss: 1.2470, test_f1: 0.5611
 epoch: 68, train_loss: 0.5595, test_loss: 1.2598, test_f1: 0.5766
 epoch: 69, train_loss: 0.5822, test_loss: 1.3097, test_f1: 0.5349
 epoch: 70, train_loss: 0.6292, test_loss: 1.2416, test_f1: 0.5639
 epoch: 71, train_loss: 0.5856, test_loss: 1.2322, test_f1: 0.5653
 epoch: 72, train_loss: 0.5548, test_loss: 1.2361, test_f1: 0.5772
 epoch: 73, train_loss: 0.5516, test_loss: 1.2655, test_f1: 0.5753
 epoch: 74, train_loss: 0.5348, test_loss: 1.3040, test_f1: 0.5628
 epoch: 75, train_loss: 0.5469, test_loss: 1.2655, test_f1: 0.5612
 epoch: 76, train_loss: 0.5400, test_loss: 1.2028, test_f1: 0.5575
 epoch: 77, train_loss: 0.5413, test_loss: 1.2831, test_f1: 0.5606
 epoch: 78, train_loss: 0.5373, test_loss: 1.3404, test_f1: 0.5770
 epoch: 79, train_loss: 0.5335, test_loss: 1.3915, test_f1: 0.5739
 epoch: 80, train_loss: 0.5261, test_loss: 1.2935, test_f1: 0.5662
 epoch: 81, train_loss: 0.5068, test_loss: 1.4225, test_f1: 0.5540
 epoch: 82, train_loss: 0.5198, test_loss: 1.4375, test_f1: 0.5430
 epoch: 83, train_loss: 0.5154, test_loss: 1.4292, test_f1: 0.5657
 epoch: 84, train_loss: 0.5085, test_loss: 1.4002, test_f1: 0.5621
 epoch: 85, train_loss: 0.5274, test_loss: 1.4104, test_f1: 0.5672
 epoch: 86, train_loss: 0.4942, test_loss: 1.4434, test_f1: 0.5188
 epoch: 87, train_loss: 0.4926, test_loss: 1.5002, test_f1: 0.5584
 epoch: 88, train_loss: 0.5012, test_loss: 1.4961, test_f1: 0.5782
 epoch: 89, train_loss: 0.4957, test_loss: 1.4206, test_f1: 0.5894
 epoch: 90, train_loss: 0.5178, test_loss: 1.3052, test_f1: 0.5832
 epoch: 91, train_loss: 0.4935, test_loss: 1.3600, test_f1: 0.6086
 epoch: 92, train_loss: 0.4860, test_loss: 1.4021, test_f1: 0.5830
 epoch: 93, train_loss: 0.5182, test_loss: 1.3307, test_f1: 0.5877
 epoch: 94, train_loss: 0.4860, test_loss: 1.4038, test_f1: 0.5880
 epoch: 95, train_loss: 0.4727, test_loss: 1.4137, test_f1: 0.5541
 epoch: 96, train_loss: 0.4890, test_loss: 1.3839, test_f1: 0.5887
 epoch: 97, train_loss: 0.5200, test_loss: 1.4244, test_f1: 0.5647
 epoch: 98, train_loss: 0.4767, test_loss: 1.4727, test_f1: 0.5762
 epoch: 99, train_loss: 0.4748, test_loss: 1.3922, test_f1: 0.5718
##################ITERATION #1 ****************************************
 epoch: 0, train_loss: 1.2511, test_loss: 1.1833, test_f1: 0.3900
 epoch: 1, train_loss: 1.1289, test_loss: 1.0524, test_f1: 0.4496
 epoch: 2, train_loss: 1.0831, test_loss: 1.0202, test_f1: 0.4680
 epoch: 3, train_loss: 1.0422, test_loss: 1.0468, test_f1: 0.4245
 epoch: 4, train_loss: 1.0451, test_loss: 1.0525, test_f1: 0.4201
 epoch: 5, train_loss: 1.0121, test_loss: 0.9467, test_f1: 0.4831
 epoch: 6, train_loss: 0.9910, test_loss: 0.9684, test_f1: 0.4818
 epoch: 7, train_loss: 0.9993, test_loss: 0.9151, test_f1: 0.4909
 epoch: 8, train_loss: 0.9800, test_loss: 0.9853, test_f1: 0.4553
 epoch: 9, train_loss: 0.9738, test_loss: 1.0060, test_f1: 0.4385
 epoch: 10, train_loss: 0.9540, test_loss: 0.9852, test_f1: 0.4834
 epoch: 11, train_loss: 0.9437, test_loss: 0.9586, test_f1: 0.5032
 epoch: 12, train_loss: 0.9257, test_loss: 0.9640, test_f1: 0.5099
 epoch: 13, train_loss: 0.9186, test_loss: 0.9834, test_f1: 0.5238
 epoch: 14, train_loss: 0.9008, test_loss: 1.0063, test_f1: 0.5028
 epoch: 15, train_loss: 0.8958, test_loss: 0.9885, test_f1: 0.5234
 epoch: 16, train_loss: 0.8867, test_loss: 0.9400, test_f1: 0.5139
 epoch: 17, train_loss: 0.8831, test_loss: 1.0558, test_f1: 0.5052
 epoch: 18, train_loss: 0.8822, test_loss: 0.9966, test_f1: 0.5341
 epoch: 19, train_loss: 0.8676, test_loss: 0.9873, test_f1: 0.5369
 epoch: 20, train_loss: 0.8585, test_loss: 0.9782, test_f1: 0.5173
 epoch: 21, train_loss: 0.8778, test_loss: 0.9948, test_f1: 0.5289
 epoch: 22, train_loss: 0.8415, test_loss: 0.9860, test_f1: 0.5565
 epoch: 23, train_loss: 0.8407, test_loss: 1.0173, test_f1: 0.5577
 epoch: 24, train_loss: 0.8332, test_loss: 1.0402, test_f1: 0.5400
 epoch: 25, train_loss: 0.8171, test_loss: 1.0380, test_f1: 0.5517
 epoch: 26, train_loss: 0.8211, test_loss: 1.0549, test_f1: 0.5607
 epoch: 27, train_loss: 0.8617, test_loss: 0.9905, test_f1: 0.5431
 epoch: 28, train_loss: 0.8429, test_loss: 1.0313, test_f1: 0.5058
 epoch: 29, train_loss: 0.8174, test_loss: 1.0390, test_f1: 0.5203
 epoch: 30, train_loss: 0.8049, test_loss: 1.0567, test_f1: 0.5778
 epoch: 31, train_loss: 0.7950, test_loss: 1.0518, test_f1: 0.5369
 epoch: 32, train_loss: 0.7931, test_loss: 1.0709, test_f1: 0.4961
 epoch: 33, train_loss: 0.7928, test_loss: 1.1096, test_f1: 0.5207
 epoch: 34, train_loss: 0.7868, test_loss: 1.0746, test_f1: 0.5519
 epoch: 35, train_loss: 0.7782, test_loss: 1.0726, test_f1: 0.5284
 epoch: 36, train_loss: 0.7579, test_loss: 1.0339, test_f1: 0.5391
 epoch: 37, train_loss: 0.7597, test_loss: 1.1277, test_f1: 0.5323
 epoch: 38, train_loss: 0.7556, test_loss: 1.1204, test_f1: 0.5583
 epoch: 39, train_loss: 0.7388, test_loss: 1.1346, test_f1: 0.5434
 epoch: 40, train_loss: 0.7493, test_loss: 1.0743, test_f1: 0.5784
 epoch: 41, train_loss: 0.7329, test_loss: 1.0516, test_f1: 0.5593
 epoch: 42, train_loss: 0.7335, test_loss: 1.1567, test_f1: 0.5496
 epoch: 43, train_loss: 0.7483, test_loss: 1.1292, test_f1: 0.5190
 epoch: 44, train_loss: 0.7417, test_loss: 1.1088, test_f1: 0.5647
 epoch: 45, train_loss: 0.7196, test_loss: 1.0832, test_f1: 0.5727
 epoch: 46, train_loss: 0.7324, test_loss: 1.1171, test_f1: 0.5552
 epoch: 47, train_loss: 0.7225, test_loss: 1.1947, test_f1: 0.5255
 epoch: 48, train_loss: 0.6978, test_loss: 1.2239, test_f1: 0.5340
 epoch: 49, train_loss: 0.6781, test_loss: 1.3518, test_f1: 0.5124
 epoch: 50, train_loss: 0.7059, test_loss: 1.5864, test_f1: 0.5271
 epoch: 51, train_loss: 0.6474, test_loss: 1.2257, test_f1: 0.5557
 epoch: 52, train_loss: 0.6369, test_loss: 1.2421, test_f1: 0.5382
 epoch: 53, train_loss: 0.6399, test_loss: 1.2779, test_f1: 0.5256
 epoch: 54, train_loss: 0.6270, test_loss: 1.2708, test_f1: 0.5391
 epoch: 55, train_loss: 0.6413, test_loss: 1.3108, test_f1: 0.5264
 epoch: 56, train_loss: 0.6202, test_loss: 1.4146, test_f1: 0.5144
 epoch: 57, train_loss: 0.6070, test_loss: 1.2584, test_f1: 0.5578
 epoch: 58, train_loss: 0.6060, test_loss: 1.3411, test_f1: 0.5382
 epoch: 59, train_loss: 0.6152, test_loss: 1.4092, test_f1: 0.5291
 epoch: 60, train_loss: 0.5944, test_loss: 1.3366, test_f1: 0.5352
 epoch: 61, train_loss: 0.5876, test_loss: 1.3940, test_f1: 0.5436
 epoch: 62, train_loss: 0.5974, test_loss: 1.4374, test_f1: 0.5123
 epoch: 63, train_loss: 0.5850, test_loss: 1.3675, test_f1: 0.5316
 epoch: 64, train_loss: 0.6012, test_loss: 1.2976, test_f1: 0.5228
 epoch: 65, train_loss: 0.5759, test_loss: 1.3589, test_f1: 0.5197
 epoch: 66, train_loss: 0.5885, test_loss: 1.3339, test_f1: 0.5361
 epoch: 67, train_loss: 0.5942, test_loss: 1.3683, test_f1: 0.5511
 epoch: 68, train_loss: 0.5822, test_loss: 1.3981, test_f1: 0.5258
 epoch: 69, train_loss: 0.5696, test_loss: 1.3637, test_f1: 0.5489
 epoch: 70, train_loss: 0.5682, test_loss: 1.2915, test_f1: 0.5477
 epoch: 71, train_loss: 0.5699, test_loss: 1.5794, test_f1: 0.5168
 epoch: 72, train_loss: 0.5760, test_loss: 1.4817, test_f1: 0.5131
 epoch: 73, train_loss: 0.5618, test_loss: 1.4623, test_f1: 0.5400
 epoch: 74, train_loss: 0.5618, test_loss: 1.4157, test_f1: 0.5494
 epoch: 75, train_loss: 0.5558, test_loss: 1.4133, test_f1: 0.5375
 epoch: 76, train_loss: 0.5567, test_loss: 1.6919, test_f1: 0.5221
 epoch: 77, train_loss: 0.5389, test_loss: 1.4123, test_f1: 0.5564
 epoch: 78, train_loss: 0.5354, test_loss: 1.5101, test_f1: 0.5017
 epoch: 79, train_loss: 0.5443, test_loss: 1.5833, test_f1: 0.5211
 epoch: 80, train_loss: 0.5784, test_loss: 1.3747, test_f1: 0.5454
 epoch: 81, train_loss: 0.5328, test_loss: 1.4092, test_f1: 0.5446
 epoch: 82, train_loss: 0.5391, test_loss: 1.3942, test_f1: 0.5484
 epoch: 83, train_loss: 0.5483, test_loss: 1.3896, test_f1: 0.5580
 epoch: 84, train_loss: 0.5452, test_loss: 1.3112, test_f1: 0.5409
 epoch: 85, train_loss: 0.5226, test_loss: 1.3361, test_f1: 0.5619
 epoch: 86, train_loss: 0.5301, test_loss: 1.3203, test_f1: 0.5738
 epoch: 87, train_loss: 0.5273, test_loss: 1.3774, test_f1: 0.5651
 epoch: 88, train_loss: 0.5292, test_loss: 1.4133, test_f1: 0.5668
 epoch: 89, train_loss: 0.5207, test_loss: 1.5829, test_f1: 0.5597
 epoch: 90, train_loss: 0.5275, test_loss: 1.3904, test_f1: 0.5714
 epoch: 91, train_loss: 0.4993, test_loss: 1.4314, test_f1: 0.5420
 epoch: 92, train_loss: 0.4989, test_loss: 1.4518, test_f1: 0.5446
 epoch: 93, train_loss: 0.5091, test_loss: 1.4343, test_f1: 0.5628
 epoch: 94, train_loss: 0.5048, test_loss: 1.4800, test_f1: 0.5419
 epoch: 95, train_loss: 0.5065, test_loss: 1.3902, test_f1: 0.5421
 epoch: 96, train_loss: 0.4930, test_loss: 1.3941, test_f1: 0.5656
 epoch: 97, train_loss: 0.4995, test_loss: 1.5276, test_f1: 0.5521
 epoch: 98, train_loss: 0.5095, test_loss: 1.4225, test_f1: 0.5628
 epoch: 99, train_loss: 0.4969, test_loss: 1.4287, test_f1: 0.5812
##################ITERATION #2 ****************************************
 epoch: 0, train_loss: 1.2448, test_loss: 1.1708, test_f1: 0.4638
 epoch: 1, train_loss: 1.1258, test_loss: 1.0658, test_f1: 0.4274
 epoch: 2, train_loss: 1.0893, test_loss: 1.0010, test_f1: 0.4370
 epoch: 3, train_loss: 1.0547, test_loss: 0.9816, test_f1: 0.4748
 epoch: 4, train_loss: 1.0345, test_loss: 0.9924, test_f1: 0.4277
 epoch: 5, train_loss: 1.0257, test_loss: 0.9928, test_f1: 0.4449
 epoch: 6, train_loss: 0.9971, test_loss: 0.9762, test_f1: 0.4609
 epoch: 7, train_loss: 0.9875, test_loss: 0.9528, test_f1: 0.4366
 epoch: 8, train_loss: 0.9699, test_loss: 0.9628, test_f1: 0.4615
 epoch: 9, train_loss: 0.9521, test_loss: 0.9631, test_f1: 0.4932
 epoch: 10, train_loss: 0.9493, test_loss: 0.9654, test_f1: 0.4650
 epoch: 11, train_loss: 0.9386, test_loss: 0.9778, test_f1: 0.4844
 epoch: 12, train_loss: 0.9325, test_loss: 0.9139, test_f1: 0.5069
 epoch: 13, train_loss: 0.9304, test_loss: 0.9080, test_f1: 0.4968
 epoch: 14, train_loss: 0.9269, test_loss: 0.9379, test_f1: 0.4654
 epoch: 15, train_loss: 0.9226, test_loss: 0.9113, test_f1: 0.5054
 epoch: 16, train_loss: 0.9108, test_loss: 0.9533, test_f1: 0.5045
 epoch: 17, train_loss: 0.9190, test_loss: 0.9053, test_f1: 0.5114
 epoch: 18, train_loss: 0.9128, test_loss: 0.9737, test_f1: 0.4911
 epoch: 19, train_loss: 0.8923, test_loss: 0.9902, test_f1: 0.4745
 epoch: 20, train_loss: 0.8869, test_loss: 0.9665, test_f1: 0.5101
 epoch: 21, train_loss: 0.8934, test_loss: 0.9551, test_f1: 0.5299
 epoch: 22, train_loss: 0.8624, test_loss: 0.9101, test_f1: 0.5559
 epoch: 23, train_loss: 0.8803, test_loss: 0.9540, test_f1: 0.5603
 epoch: 24, train_loss: 0.8751, test_loss: 0.9317, test_f1: 0.5351
 epoch: 25, train_loss: 0.8560, test_loss: 0.9994, test_f1: 0.5202
 epoch: 26, train_loss: 0.8555, test_loss: 1.0226, test_f1: 0.4916
 epoch: 27, train_loss: 0.9076, test_loss: 0.9786, test_f1: 0.5310
 epoch: 28, train_loss: 0.8897, test_loss: 0.9384, test_f1: 0.5569
 epoch: 29, train_loss: 0.8397, test_loss: 0.9716, test_f1: 0.5147
 epoch: 30, train_loss: 0.8370, test_loss: 0.9918, test_f1: 0.5410
 epoch: 31, train_loss: 0.8346, test_loss: 1.0205, test_f1: 0.5469
 epoch: 32, train_loss: 0.8371, test_loss: 1.0228, test_f1: 0.5229
 epoch: 33, train_loss: 0.8289, test_loss: 0.9819, test_f1: 0.5188
 epoch: 34, train_loss: 0.8333, test_loss: 1.0155, test_f1: 0.5373
 epoch: 35, train_loss: 0.8242, test_loss: 0.9709, test_f1: 0.5470
 epoch: 36, train_loss: 0.8071, test_loss: 0.9973, test_f1: 0.5468
 epoch: 37, train_loss: 0.7860, test_loss: 0.9757, test_f1: 0.5518
 epoch: 38, train_loss: 0.7855, test_loss: 0.9904, test_f1: 0.5496
 epoch: 39, train_loss: 0.7852, test_loss: 0.9684, test_f1: 0.5377
 epoch: 40, train_loss: 0.7990, test_loss: 0.9507, test_f1: 0.5379
 epoch: 41, train_loss: 0.7856, test_loss: 0.9511, test_f1: 0.5567
 epoch: 42, train_loss: 0.7881, test_loss: 1.0166, test_f1: 0.5318
 epoch: 43, train_loss: 0.7831, test_loss: 0.9937, test_f1: 0.5661
 epoch: 44, train_loss: 0.7583, test_loss: 0.9708, test_f1: 0.5696
 epoch: 45, train_loss: 0.7507, test_loss: 1.0113, test_f1: 0.5712
 epoch: 46, train_loss: 0.7442, test_loss: 1.0110, test_f1: 0.5671
 epoch: 47, train_loss: 0.7546, test_loss: 1.0840, test_f1: 0.5339
 epoch: 48, train_loss: 0.7697, test_loss: 0.9500, test_f1: 0.5447
 epoch: 49, train_loss: 0.7495, test_loss: 0.9553, test_f1: 0.5525
 epoch: 50, train_loss: 0.7439, test_loss: 1.0745, test_f1: 0.5237
 epoch: 51, train_loss: 0.6938, test_loss: 1.0548, test_f1: 0.5590
 epoch: 52, train_loss: 0.6961, test_loss: 1.0143, test_f1: 0.5907
 epoch: 53, train_loss: 0.6780, test_loss: 1.0088, test_f1: 0.5672
 epoch: 54, train_loss: 0.6834, test_loss: 1.0383, test_f1: 0.5712
 epoch: 55, train_loss: 0.6633, test_loss: 1.0585, test_f1: 0.5519
 epoch: 56, train_loss: 0.6731, test_loss: 1.0534, test_f1: 0.5659
 epoch: 57, train_loss: 0.6651, test_loss: 1.1126, test_f1: 0.5498
 epoch: 58, train_loss: 0.6494, test_loss: 1.0829, test_f1: 0.5626
 epoch: 59, train_loss: 0.6657, test_loss: 1.0633, test_f1: 0.5416
 epoch: 60, train_loss: 0.6577, test_loss: 1.0401, test_f1: 0.5726
 epoch: 61, train_loss: 0.6485, test_loss: 1.0667, test_f1: 0.5736
 epoch: 62, train_loss: 0.6575, test_loss: 1.0694, test_f1: 0.5624
 epoch: 63, train_loss: 0.6345, test_loss: 1.1106, test_f1: 0.5360
 epoch: 64, train_loss: 0.6281, test_loss: 1.1032, test_f1: 0.5787
 epoch: 65, train_loss: 0.6318, test_loss: 1.0795, test_f1: 0.5597
 epoch: 66, train_loss: 0.6292, test_loss: 1.1202, test_f1: 0.5554
 epoch: 67, train_loss: 0.6187, test_loss: 1.1966, test_f1: 0.5599
 epoch: 68, train_loss: 0.6677, test_loss: 1.1217, test_f1: 0.5671
 epoch: 69, train_loss: 0.6272, test_loss: 1.0947, test_f1: 0.5772
 epoch: 70, train_loss: 0.6367, test_loss: 1.1672, test_f1: 0.5820
 epoch: 71, train_loss: 0.6159, test_loss: 1.0815, test_f1: 0.5846
 epoch: 72, train_loss: 0.6216, test_loss: 1.1127, test_f1: 0.5477
 epoch: 73, train_loss: 0.6150, test_loss: 1.1309, test_f1: 0.5763
 epoch: 74, train_loss: 0.6052, test_loss: 1.1442, test_f1: 0.5613
 epoch: 75, train_loss: 0.6192, test_loss: 1.1023, test_f1: 0.5596
 epoch: 76, train_loss: 0.6099, test_loss: 1.1581, test_f1: 0.5578
 epoch: 77, train_loss: 0.6035, test_loss: 1.1724, test_f1: 0.5669
 epoch: 78, train_loss: 0.6009, test_loss: 1.1129, test_f1: 0.5669
 epoch: 79, train_loss: 0.5927, test_loss: 1.2533, test_f1: 0.5599
 epoch: 80, train_loss: 0.5801, test_loss: 1.1910, test_f1: 0.5796
 epoch: 81, train_loss: 0.5951, test_loss: 1.1851, test_f1: 0.5742
 epoch: 82, train_loss: 0.5771, test_loss: 1.1298, test_f1: 0.5596
 epoch: 83, train_loss: 0.5746, test_loss: 1.2069, test_f1: 0.5625
 epoch: 84, train_loss: 0.5797, test_loss: 1.2105, test_f1: 0.5846
 epoch: 85, train_loss: 0.6234, test_loss: 1.2149, test_f1: 0.5396
 epoch: 86, train_loss: 0.5929, test_loss: 1.2107, test_f1: 0.5739
 epoch: 87, train_loss: 0.5702, test_loss: 1.2249, test_f1: 0.5502
 epoch: 88, train_loss: 0.5503, test_loss: 1.1853, test_f1: 0.5630
 epoch: 89, train_loss: 0.5673, test_loss: 1.3025, test_f1: 0.5486
 epoch: 90, train_loss: 0.5586, test_loss: 1.2302, test_f1: 0.5459
 epoch: 91, train_loss: 0.5612, test_loss: 1.2949, test_f1: 0.5604
 epoch: 92, train_loss: 0.5787, test_loss: 1.2510, test_f1: 0.5364
 epoch: 93, train_loss: 0.6185, test_loss: 1.1432, test_f1: 0.5609
 epoch: 94, train_loss: 0.5951, test_loss: 1.1463, test_f1: 0.5739
 epoch: 95, train_loss: 0.6523, test_loss: 1.1322, test_f1: 0.5674
 epoch: 96, train_loss: 0.5992, test_loss: 1.1743, test_f1: 0.5635
 epoch: 97, train_loss: 0.5661, test_loss: 1.1965, test_f1: 0.5946
 epoch: 98, train_loss: 0.5566, test_loss: 1.1821, test_f1: 0.5771
 epoch: 99, train_loss: 0.5724, test_loss: 1.2346, test_f1: 0.5690
##################ITERATION #3 ****************************************
 epoch: 0, train_loss: 1.2692, test_loss: 1.2114, test_f1: 0.3372
 epoch: 1, train_loss: 1.1346, test_loss: 1.0503, test_f1: 0.4367
 epoch: 2, train_loss: 1.0855, test_loss: 1.0119, test_f1: 0.4586
 epoch: 3, train_loss: 1.0565, test_loss: 1.0213, test_f1: 0.4535
 epoch: 4, train_loss: 1.0363, test_loss: 0.9559, test_f1: 0.4525
 epoch: 5, train_loss: 1.0183, test_loss: 0.9393, test_f1: 0.4829
 epoch: 6, train_loss: 0.9951, test_loss: 0.9318, test_f1: 0.4933
 epoch: 7, train_loss: 0.9841, test_loss: 0.9434, test_f1: 0.4654
 epoch: 8, train_loss: 0.9827, test_loss: 0.9613, test_f1: 0.4906
 epoch: 9, train_loss: 0.9914, test_loss: 0.9965, test_f1: 0.4380
 epoch: 10, train_loss: 0.9792, test_loss: 0.9769, test_f1: 0.4912
 epoch: 11, train_loss: 0.9557, test_loss: 0.9270, test_f1: 0.5010
 epoch: 12, train_loss: 0.9620, test_loss: 0.9578, test_f1: 0.4558
 epoch: 13, train_loss: 0.9457, test_loss: 0.9492, test_f1: 0.4784
 epoch: 14, train_loss: 0.9393, test_loss: 0.8925, test_f1: 0.5204
 epoch: 15, train_loss: 0.9214, test_loss: 0.9085, test_f1: 0.5252
 epoch: 16, train_loss: 0.9148, test_loss: 0.8828, test_f1: 0.5352
 epoch: 17, train_loss: 0.9172, test_loss: 0.8952, test_f1: 0.5415
 epoch: 18, train_loss: 0.8863, test_loss: 0.9839, test_f1: 0.4999
 epoch: 19, train_loss: 0.8888, test_loss: 0.9368, test_f1: 0.5121
 epoch: 20, train_loss: 0.8810, test_loss: 1.0052, test_f1: 0.5003
 epoch: 21, train_loss: 0.9035, test_loss: 0.9237, test_f1: 0.5256
 epoch: 22, train_loss: 0.8731, test_loss: 1.0016, test_f1: 0.5178
 epoch: 23, train_loss: 0.8708, test_loss: 0.9740, test_f1: 0.5034
 epoch: 24, train_loss: 0.8842, test_loss: 1.0097, test_f1: 0.5075
 epoch: 25, train_loss: 0.8449, test_loss: 1.0127, test_f1: 0.5324
 epoch: 26, train_loss: 0.8546, test_loss: 1.0634, test_f1: 0.5031
 epoch: 27, train_loss: 0.8478, test_loss: 0.9721, test_f1: 0.5162
 epoch: 28, train_loss: 0.8393, test_loss: 1.0179, test_f1: 0.5058
 epoch: 29, train_loss: 0.8455, test_loss: 0.9591, test_f1: 0.5480
 epoch: 30, train_loss: 0.8357, test_loss: 0.9912, test_f1: 0.5375
 epoch: 31, train_loss: 0.8177, test_loss: 1.0471, test_f1: 0.5378
 epoch: 32, train_loss: 0.8295, test_loss: 1.0193, test_f1: 0.5572
 epoch: 33, train_loss: 0.7951, test_loss: 1.0862, test_f1: 0.5447
 epoch: 34, train_loss: 0.8130, test_loss: 1.0138, test_f1: 0.5552
 epoch: 35, train_loss: 0.8014, test_loss: 1.0328, test_f1: 0.5466
 epoch: 36, train_loss: 0.8111, test_loss: 1.0419, test_f1: 0.5584
 epoch: 37, train_loss: 0.7880, test_loss: 1.0774, test_f1: 0.5269
 epoch: 38, train_loss: 0.7955, test_loss: 1.0144, test_f1: 0.5706
 epoch: 39, train_loss: 0.7944, test_loss: 0.9595, test_f1: 0.5592
 epoch: 40, train_loss: 0.7816, test_loss: 1.0321, test_f1: 0.5422
 epoch: 41, train_loss: 0.7796, test_loss: 1.0120, test_f1: 0.5477
 epoch: 42, train_loss: 0.7845, test_loss: 0.9902, test_f1: 0.5451
 epoch: 43, train_loss: 0.7656, test_loss: 1.0128, test_f1: 0.5550
 epoch: 44, train_loss: 0.7738, test_loss: 1.0012, test_f1: 0.5294
 epoch: 45, train_loss: 0.7677, test_loss: 0.9733, test_f1: 0.5373
 epoch: 46, train_loss: 0.7734, test_loss: 1.0161, test_f1: 0.5387
 epoch: 47, train_loss: 0.7540, test_loss: 0.9499, test_f1: 0.5600
 epoch: 48, train_loss: 0.7496, test_loss: 0.9734, test_f1: 0.5515
 epoch: 49, train_loss: 0.7386, test_loss: 0.9681, test_f1: 0.5581
 epoch: 50, train_loss: 0.7688, test_loss: 1.0687, test_f1: 0.5126
 epoch: 51, train_loss: 0.7141, test_loss: 0.9998, test_f1: 0.5437
 epoch: 52, train_loss: 0.7119, test_loss: 1.0151, test_f1: 0.5515
 epoch: 53, train_loss: 0.6814, test_loss: 1.0286, test_f1: 0.5636
 epoch: 54, train_loss: 0.6899, test_loss: 1.0409, test_f1: 0.5598
 epoch: 55, train_loss: 0.6653, test_loss: 1.0710, test_f1: 0.5680
 epoch: 56, train_loss: 0.6828, test_loss: 1.0837, test_f1: 0.5622
 epoch: 57, train_loss: 0.6753, test_loss: 1.0764, test_f1: 0.5843
 epoch: 58, train_loss: 0.6630, test_loss: 1.0843, test_f1: 0.5260
 epoch: 59, train_loss: 0.6700, test_loss: 1.0270, test_f1: 0.5421
 epoch: 60, train_loss: 0.6560, test_loss: 1.0687, test_f1: 0.5379
 epoch: 61, train_loss: 0.6573, test_loss: 1.0764, test_f1: 0.5408
 epoch: 62, train_loss: 0.6540, test_loss: 1.0855, test_f1: 0.5414
 epoch: 63, train_loss: 0.6657, test_loss: 1.0872, test_f1: 0.5286
 epoch: 64, train_loss: 0.6597, test_loss: 1.0906, test_f1: 0.5486
 epoch: 65, train_loss: 0.6554, test_loss: 1.1230, test_f1: 0.5338
 epoch: 66, train_loss: 0.6233, test_loss: 1.0892, test_f1: 0.5744
 epoch: 67, train_loss: 0.6390, test_loss: 1.1277, test_f1: 0.5453
 epoch: 68, train_loss: 0.6198, test_loss: 1.0778, test_f1: 0.5777
 epoch: 69, train_loss: 0.6165, test_loss: 1.0699, test_f1: 0.5611
 epoch: 70, train_loss: 0.6196, test_loss: 1.0971, test_f1: 0.5523
 epoch: 71, train_loss: 0.6233, test_loss: 1.1345, test_f1: 0.5375
 epoch: 72, train_loss: 0.6181, test_loss: 1.1298, test_f1: 0.5408
 epoch: 73, train_loss: 0.6177, test_loss: 1.2119, test_f1: 0.5608
 epoch: 74, train_loss: 0.6360, test_loss: 1.1051, test_f1: 0.5525
 epoch: 75, train_loss: 0.6142, test_loss: 1.1208, test_f1: 0.5738
 epoch: 76, train_loss: 0.6120, test_loss: 1.1086, test_f1: 0.5727
 epoch: 77, train_loss: 0.6096, test_loss: 1.1381, test_f1: 0.5576
 epoch: 78, train_loss: 0.6146, test_loss: 1.1042, test_f1: 0.5384
 epoch: 79, train_loss: 0.6348, test_loss: 1.0815, test_f1: 0.5563
 epoch: 80, train_loss: 0.6011, test_loss: 1.2321, test_f1: 0.5460
 epoch: 81, train_loss: 0.6022, test_loss: 1.1537, test_f1: 0.5620
 epoch: 82, train_loss: 0.6152, test_loss: 1.1586, test_f1: 0.5326
 epoch: 83, train_loss: 0.5800, test_loss: 1.2115, test_f1: 0.5605
 epoch: 84, train_loss: 0.5779, test_loss: 1.2072, test_f1: 0.5792
 epoch: 85, train_loss: 0.6041, test_loss: 1.1385, test_f1: 0.5527
 epoch: 86, train_loss: 0.5744, test_loss: 1.3529, test_f1: 0.5618
 epoch: 87, train_loss: 0.5940, test_loss: 1.2331, test_f1: 0.5415
 epoch: 88, train_loss: 0.5789, test_loss: 1.1955, test_f1: 0.5476
 epoch: 89, train_loss: 0.5734, test_loss: 1.1862, test_f1: 0.5458
 epoch: 90, train_loss: 0.5749, test_loss: 1.1870, test_f1: 0.5665
 epoch: 91, train_loss: 0.5778, test_loss: 1.1379, test_f1: 0.5571
 epoch: 92, train_loss: 0.5691, test_loss: 1.1923, test_f1: 0.5592
 epoch: 93, train_loss: 0.5606, test_loss: 1.1918, test_f1: 0.5852
 epoch: 94, train_loss: 0.5707, test_loss: 1.2805, test_f1: 0.5585
 epoch: 95, train_loss: 0.5668, test_loss: 1.1866, test_f1: 0.5466
 epoch: 96, train_loss: 0.5459, test_loss: 1.2698, test_f1: 0.5414
 epoch: 97, train_loss: 0.5656, test_loss: 1.2198, test_f1: 0.5568
 epoch: 98, train_loss: 0.5682, test_loss: 1.2582, test_f1: 0.5506
 epoch: 99, train_loss: 0.5622, test_loss: 1.2353, test_f1: 0.5535
##################ITERATION #4 ****************************************
 epoch: 0, train_loss: 1.3137, test_loss: 1.1277, test_f1: 0.4150
 epoch: 1, train_loss: 1.1674, test_loss: 1.1019, test_f1: 0.3998
 epoch: 2, train_loss: 1.1133, test_loss: 1.0525, test_f1: 0.4538
 epoch: 3, train_loss: 1.0927, test_loss: 1.0205, test_f1: 0.4487
 epoch: 4, train_loss: 1.0549, test_loss: 0.9846, test_f1: 0.4647
 epoch: 5, train_loss: 1.0341, test_loss: 1.0141, test_f1: 0.4864
 epoch: 6, train_loss: 1.0166, test_loss: 1.0058, test_f1: 0.4612
 epoch: 7, train_loss: 0.9982, test_loss: 0.9854, test_f1: 0.4334
 epoch: 8, train_loss: 0.9831, test_loss: 0.9179, test_f1: 0.4902
 epoch: 9, train_loss: 0.9631, test_loss: 0.9377, test_f1: 0.5296
 epoch: 10, train_loss: 0.9582, test_loss: 1.0351, test_f1: 0.4586
 epoch: 11, train_loss: 0.9399, test_loss: 0.9018, test_f1: 0.5287
 epoch: 12, train_loss: 0.9419, test_loss: 0.9521, test_f1: 0.4917
 epoch: 13, train_loss: 0.9209, test_loss: 0.9502, test_f1: 0.5121
 epoch: 14, train_loss: 0.9127, test_loss: 1.0084, test_f1: 0.4874
 epoch: 15, train_loss: 0.9171, test_loss: 0.9706, test_f1: 0.5059
 epoch: 16, train_loss: 0.8981, test_loss: 0.9269, test_f1: 0.4969
 epoch: 17, train_loss: 0.8856, test_loss: 0.9435, test_f1: 0.4951
 epoch: 18, train_loss: 0.8943, test_loss: 0.9435, test_f1: 0.5189
 epoch: 19, train_loss: 0.8824, test_loss: 1.0243, test_f1: 0.4794
 epoch: 20, train_loss: 0.8715, test_loss: 1.0547, test_f1: 0.5055
 epoch: 21, train_loss: 0.8588, test_loss: 1.0166, test_f1: 0.5199
 epoch: 22, train_loss: 0.8586, test_loss: 1.0960, test_f1: 0.5034
 epoch: 23, train_loss: 0.8419, test_loss: 1.0435, test_f1: 0.5087
 epoch: 24, train_loss: 0.8340, test_loss: 1.0063, test_f1: 0.5284
 epoch: 25, train_loss: 0.8383, test_loss: 0.9720, test_f1: 0.5317
 epoch: 26, train_loss: 0.8190, test_loss: 1.0223, test_f1: 0.5040
 epoch: 27, train_loss: 0.8134, test_loss: 1.0141, test_f1: 0.4900
 epoch: 28, train_loss: 0.8128, test_loss: 0.9478, test_f1: 0.5318
 epoch: 29, train_loss: 0.7953, test_loss: 0.9978, test_f1: 0.5510
 epoch: 30, train_loss: 0.7973, test_loss: 1.0190, test_f1: 0.5143
 epoch: 31, train_loss: 0.8174, test_loss: 1.0445, test_f1: 0.5469
 epoch: 32, train_loss: 0.7938, test_loss: 0.9976, test_f1: 0.5449
 epoch: 33, train_loss: 0.7978, test_loss: 1.0509, test_f1: 0.5170
 epoch: 34, train_loss: 0.7739, test_loss: 1.0863, test_f1: 0.5458
 epoch: 35, train_loss: 0.7603, test_loss: 1.0805, test_f1: 0.5294
 epoch: 36, train_loss: 0.7664, test_loss: 1.0704, test_f1: 0.5166
 epoch: 37, train_loss: 0.7761, test_loss: 1.0239, test_f1: 0.5282
 epoch: 38, train_loss: 0.7848, test_loss: 1.0140, test_f1: 0.5407
 epoch: 39, train_loss: 0.7738, test_loss: 1.0831, test_f1: 0.4998
 epoch: 40, train_loss: 0.7768, test_loss: 1.0320, test_f1: 0.5456
 epoch: 41, train_loss: 0.7683, test_loss: 1.0015, test_f1: 0.5207
 epoch: 42, train_loss: 0.7634, test_loss: 1.0303, test_f1: 0.5325
 epoch: 43, train_loss: 0.7457, test_loss: 1.0365, test_f1: 0.5247
 epoch: 44, train_loss: 0.7341, test_loss: 1.0365, test_f1: 0.5194
 epoch: 45, train_loss: 0.7286, test_loss: 1.0584, test_f1: 0.5369
 epoch: 46, train_loss: 0.7471, test_loss: 1.0599, test_f1: 0.5357
 epoch: 47, train_loss: 0.7151, test_loss: 1.0648, test_f1: 0.5419
 epoch: 48, train_loss: 0.7279, test_loss: 1.0667, test_f1: 0.5546
 epoch: 49, train_loss: 0.7154, test_loss: 1.0792, test_f1: 0.5378
 epoch: 50, train_loss: 0.7313, test_loss: 1.0275, test_f1: 0.5623
 epoch: 51, train_loss: 0.6850, test_loss: 1.0581, test_f1: 0.5607
 epoch: 52, train_loss: 0.6660, test_loss: 1.0957, test_f1: 0.5545
 epoch: 53, train_loss: 0.6625, test_loss: 1.1343, test_f1: 0.5477
 epoch: 54, train_loss: 0.6459, test_loss: 1.0632, test_f1: 0.5741
 epoch: 55, train_loss: 0.6438, test_loss: 1.1151, test_f1: 0.5312
 epoch: 56, train_loss: 0.6543, test_loss: 1.0945, test_f1: 0.5688
 epoch: 57, train_loss: 0.6233, test_loss: 1.0914, test_f1: 0.5519
 epoch: 58, train_loss: 0.6238, test_loss: 1.1262, test_f1: 0.5451
 epoch: 59, train_loss: 0.7222, test_loss: 1.1318, test_f1: 0.5237
 epoch: 60, train_loss: 0.6840, test_loss: 1.0617, test_f1: 0.5686
 epoch: 61, train_loss: 0.6536, test_loss: 1.0909, test_f1: 0.5527
 epoch: 62, train_loss: 0.6529, test_loss: 1.1192, test_f1: 0.5548
 epoch: 63, train_loss: 0.6360, test_loss: 1.1057, test_f1: 0.5600
 epoch: 64, train_loss: 0.6257, test_loss: 1.1126, test_f1: 0.5691
 epoch: 65, train_loss: 0.6275, test_loss: 1.0981, test_f1: 0.5619
 epoch: 66, train_loss: 0.6020, test_loss: 1.0761, test_f1: 0.5851
 epoch: 67, train_loss: 0.6210, test_loss: 1.1565, test_f1: 0.5392
 epoch: 68, train_loss: 0.5924, test_loss: 1.1318, test_f1: 0.5500
 epoch: 69, train_loss: 0.6081, test_loss: 1.0916, test_f1: 0.5783
 epoch: 70, train_loss: 0.6219, test_loss: 1.1034, test_f1: 0.5724
 epoch: 71, train_loss: 0.5940, test_loss: 1.1827, test_f1: 0.5381
 epoch: 72, train_loss: 0.5778, test_loss: 1.1780, test_f1: 0.5551
 epoch: 73, train_loss: 0.5858, test_loss: 1.1374, test_f1: 0.5555
 epoch: 74, train_loss: 0.5940, test_loss: 1.1668, test_f1: 0.5526
 epoch: 75, train_loss: 0.5696, test_loss: 1.1590, test_f1: 0.5812
 epoch: 76, train_loss: 0.5903, test_loss: 1.2014, test_f1: 0.5641
 epoch: 77, train_loss: 0.5683, test_loss: 1.1464, test_f1: 0.5552
 epoch: 78, train_loss: 0.5693, test_loss: 1.1398, test_f1: 0.5715
 epoch: 79, train_loss: 0.5722, test_loss: 1.1295, test_f1: 0.5904
 epoch: 80, train_loss: 0.5723, test_loss: 1.1671, test_f1: 0.5735
 epoch: 81, train_loss: 0.5714, test_loss: 1.1568, test_f1: 0.5635
 epoch: 82, train_loss: 0.5581, test_loss: 1.1998, test_f1: 0.5518
 epoch: 83, train_loss: 0.5513, test_loss: 1.1711, test_f1: 0.5482
 epoch: 84, train_loss: 0.5732, test_loss: 1.2012, test_f1: 0.5560
 epoch: 85, train_loss: 0.5750, test_loss: 1.2074, test_f1: 0.5968
 epoch: 86, train_loss: 0.5564, test_loss: 1.2333, test_f1: 0.5537
 epoch: 87, train_loss: 0.5628, test_loss: 1.2093, test_f1: 0.5678
 epoch: 88, train_loss: 0.5619, test_loss: 1.1367, test_f1: 0.5694
 epoch: 89, train_loss: 0.5592, test_loss: 1.2239, test_f1: 0.5592
 epoch: 90, train_loss: 0.5530, test_loss: 1.2386, test_f1: 0.5650
 epoch: 91, train_loss: 0.5365, test_loss: 1.2157, test_f1: 0.5597
 epoch: 92, train_loss: 0.5677, test_loss: 1.1542, test_f1: 0.5683
 epoch: 93, train_loss: 0.5336, test_loss: 1.1968, test_f1: 0.5689
 epoch: 94, train_loss: 0.5354, test_loss: 1.2223, test_f1: 0.5516
 epoch: 95, train_loss: 0.5503, test_loss: 1.1750, test_f1: 0.5682
 epoch: 96, train_loss: 0.5413, test_loss: 1.2375, test_f1: 0.5587
 epoch: 97, train_loss: 0.5207, test_loss: 1.2115, test_f1: 0.5653
 epoch: 98, train_loss: 0.5354, test_loss: 1.1788, test_f1: 0.5604
 epoch: 99, train_loss: 0.5302, test_loss: 1.2446, test_f1: 0.5695
##################ITERATION #5 ****************************************
 epoch: 0, train_loss: 1.3013, test_loss: 1.1499, test_f1: 0.4040
 epoch: 1, train_loss: 1.1693, test_loss: 1.0756, test_f1: 0.4454
 epoch: 2, train_loss: 1.1262, test_loss: 1.0352, test_f1: 0.4485
 epoch: 3, train_loss: 1.1026, test_loss: 1.0315, test_f1: 0.4424
 epoch: 4, train_loss: 1.0633, test_loss: 0.9614, test_f1: 0.4844
 epoch: 5, train_loss: 1.0398, test_loss: 0.9523, test_f1: 0.4745
 epoch: 6, train_loss: 1.0194, test_loss: 0.9429, test_f1: 0.4967
 epoch: 7, train_loss: 1.0117, test_loss: 1.0007, test_f1: 0.4540
 epoch: 8, train_loss: 0.9783, test_loss: 0.9479, test_f1: 0.4779
 epoch: 9, train_loss: 0.9787, test_loss: 0.9420, test_f1: 0.4684
 epoch: 10, train_loss: 0.9607, test_loss: 0.9165, test_f1: 0.4777
 epoch: 11, train_loss: 0.9565, test_loss: 0.9704, test_f1: 0.4659
 epoch: 12, train_loss: 0.9420, test_loss: 0.9267, test_f1: 0.4884
 epoch: 13, train_loss: 0.9384, test_loss: 0.9327, test_f1: 0.5076
 epoch: 14, train_loss: 0.9199, test_loss: 0.9844, test_f1: 0.4893
 epoch: 15, train_loss: 0.9015, test_loss: 1.0117, test_f1: 0.5269
 epoch: 16, train_loss: 0.8923, test_loss: 1.0662, test_f1: 0.5086
 epoch: 17, train_loss: 0.8890, test_loss: 0.9827, test_f1: 0.4913
 epoch: 18, train_loss: 0.8829, test_loss: 0.9964, test_f1: 0.5017
 epoch: 19, train_loss: 0.8853, test_loss: 0.9759, test_f1: 0.5026
 epoch: 20, train_loss: 0.8648, test_loss: 1.0525, test_f1: 0.4880
 epoch: 21, train_loss: 0.8671, test_loss: 1.0035, test_f1: 0.5118
 epoch: 22, train_loss: 0.8501, test_loss: 1.0289, test_f1: 0.4944
 epoch: 23, train_loss: 0.8701, test_loss: 1.0125, test_f1: 0.5117
 epoch: 24, train_loss: 0.8410, test_loss: 1.0034, test_f1: 0.5345
 epoch: 25, train_loss: 0.8329, test_loss: 1.1196, test_f1: 0.5219
 epoch: 26, train_loss: 0.8281, test_loss: 1.0701, test_f1: 0.5111
 epoch: 27, train_loss: 0.8504, test_loss: 1.0998, test_f1: 0.5139
 epoch: 28, train_loss: 0.8182, test_loss: 1.0238, test_f1: 0.5076
 epoch: 29, train_loss: 0.8295, test_loss: 1.0514, test_f1: 0.5319
 epoch: 30, train_loss: 0.8090, test_loss: 1.0121, test_f1: 0.5111
 epoch: 31, train_loss: 0.7926, test_loss: 1.0937, test_f1: 0.5355
 epoch: 32, train_loss: 0.8121, test_loss: 1.0260, test_f1: 0.5341
 epoch: 33, train_loss: 0.7828, test_loss: 1.0640, test_f1: 0.5308
 epoch: 34, train_loss: 0.7878, test_loss: 1.0728, test_f1: 0.5643
 epoch: 35, train_loss: 0.7818, test_loss: 1.1320, test_f1: 0.5417
 epoch: 36, train_loss: 0.7925, test_loss: 1.0355, test_f1: 0.5615
 epoch: 37, train_loss: 0.7687, test_loss: 1.0894, test_f1: 0.5587
 epoch: 38, train_loss: 0.7714, test_loss: 1.0666, test_f1: 0.5415
 epoch: 39, train_loss: 0.7745, test_loss: 1.0402, test_f1: 0.5410
 epoch: 40, train_loss: 0.7869, test_loss: 1.1434, test_f1: 0.5208
 epoch: 41, train_loss: 0.7449, test_loss: 1.1657, test_f1: 0.5322
 epoch: 42, train_loss: 0.7563, test_loss: 1.1934, test_f1: 0.5439
 epoch: 43, train_loss: 0.7462, test_loss: 1.2728, test_f1: 0.5222
 epoch: 44, train_loss: 0.7400, test_loss: 1.1469, test_f1: 0.5340
 epoch: 45, train_loss: 0.7484, test_loss: 1.1304, test_f1: 0.5322
 epoch: 46, train_loss: 0.7377, test_loss: 1.1137, test_f1: 0.5291
 epoch: 47, train_loss: 0.7287, test_loss: 1.1716, test_f1: 0.5226
 epoch: 48, train_loss: 0.7178, test_loss: 1.1073, test_f1: 0.5453
 epoch: 49, train_loss: 0.7193, test_loss: 1.1391, test_f1: 0.5528
 epoch: 50, train_loss: 0.7252, test_loss: 1.1260, test_f1: 0.5728
 epoch: 51, train_loss: 0.6897, test_loss: 1.1829, test_f1: 0.5688
 epoch: 52, train_loss: 0.6795, test_loss: 1.1308, test_f1: 0.5553
 epoch: 53, train_loss: 0.6778, test_loss: 1.1162, test_f1: 0.5782
 epoch: 54, train_loss: 0.6488, test_loss: 1.1588, test_f1: 0.5512
 epoch: 55, train_loss: 0.6707, test_loss: 1.1773, test_f1: 0.5646
 epoch: 56, train_loss: 0.6715, test_loss: 1.1518, test_f1: 0.5421
 epoch: 57, train_loss: 0.6418, test_loss: 1.1590, test_f1: 0.5638
 epoch: 58, train_loss: 0.6507, test_loss: 1.1899, test_f1: 0.5593
 epoch: 59, train_loss: 0.6283, test_loss: 1.2227, test_f1: 0.5468
 epoch: 60, train_loss: 0.6422, test_loss: 1.2563, test_f1: 0.5579
 epoch: 61, train_loss: 0.6299, test_loss: 1.2345, test_f1: 0.5371
 epoch: 62, train_loss: 0.6116, test_loss: 1.2738, test_f1: 0.5698
 epoch: 63, train_loss: 0.6245, test_loss: 1.3591, test_f1: 0.5335
 epoch: 64, train_loss: 0.6267, test_loss: 1.2824, test_f1: 0.5678
 epoch: 65, train_loss: 0.6179, test_loss: 1.2773, test_f1: 0.5650
 epoch: 66, train_loss: 0.6232, test_loss: 1.3020, test_f1: 0.5542
 epoch: 67, train_loss: 0.6067, test_loss: 1.3547, test_f1: 0.5208
 epoch: 68, train_loss: 0.6160, test_loss: 1.2276, test_f1: 0.5512
 epoch: 69, train_loss: 0.6017, test_loss: 1.2857, test_f1: 0.5483
 epoch: 70, train_loss: 0.6035, test_loss: 1.3441, test_f1: 0.5344
 epoch: 71, train_loss: 0.6051, test_loss: 1.2810, test_f1: 0.5541
 epoch: 72, train_loss: 0.5967, test_loss: 1.2686, test_f1: 0.5841
 epoch: 73, train_loss: 0.5769, test_loss: 1.3161, test_f1: 0.5583
 epoch: 74, train_loss: 0.5862, test_loss: 1.3340, test_f1: 0.5443
 epoch: 75, train_loss: 0.5914, test_loss: 1.3593, test_f1: 0.5479
 epoch: 76, train_loss: 0.5946, test_loss: 1.2227, test_f1: 0.5841
 epoch: 77, train_loss: 0.6018, test_loss: 1.3021, test_f1: 0.5602
 epoch: 78, train_loss: 0.5738, test_loss: 1.2976, test_f1: 0.5776
 epoch: 79, train_loss: 0.5731, test_loss: 1.3714, test_f1: 0.5734
 epoch: 80, train_loss: 0.5874, test_loss: 1.4268, test_f1: 0.5404
 epoch: 81, train_loss: 0.5757, test_loss: 1.4884, test_f1: 0.5272
 epoch: 82, train_loss: 0.5631, test_loss: 1.3675, test_f1: 0.5554
 epoch: 83, train_loss: 0.5684, test_loss: 1.4039, test_f1: 0.5387
 epoch: 84, train_loss: 0.5753, test_loss: 1.3824, test_f1: 0.5621
 epoch: 85, train_loss: 0.5684, test_loss: 1.2964, test_f1: 0.5806
 epoch: 86, train_loss: 0.5613, test_loss: 1.3888, test_f1: 0.5629
 epoch: 87, train_loss: 0.5523, test_loss: 1.3800, test_f1: 0.5490
 epoch: 88, train_loss: 0.5499, test_loss: 1.4212, test_f1: 0.5367
 epoch: 89, train_loss: 0.5511, test_loss: 1.4216, test_f1: 0.5272
 epoch: 90, train_loss: 0.5388, test_loss: 1.3849, test_f1: 0.5841
 epoch: 91, train_loss: 0.5592, test_loss: 1.3903, test_f1: 0.5588
 epoch: 92, train_loss: 0.5554, test_loss: 1.4341, test_f1: 0.5427
 epoch: 93, train_loss: 0.5417, test_loss: 1.4022, test_f1: 0.5702
 epoch: 94, train_loss: 0.5477, test_loss: 1.4514, test_f1: 0.5355
 epoch: 95, train_loss: 0.5325, test_loss: 1.4247, test_f1: 0.5280
 epoch: 96, train_loss: 0.5310, test_loss: 1.4318, test_f1: 0.5667
 epoch: 97, train_loss: 0.5244, test_loss: 1.4450, test_f1: 0.5553
 epoch: 98, train_loss: 0.5604, test_loss: 1.4584, test_f1: 0.5470
 epoch: 99, train_loss: 0.5147, test_loss: 1.4515, test_f1: 0.5548
##################ITERATION #6 ****************************************
 epoch: 0, train_loss: 1.2957, test_loss: 1.1487, test_f1: 0.3677
 epoch: 1, train_loss: 1.1705, test_loss: 1.0797, test_f1: 0.4354
 epoch: 2, train_loss: 1.1203, test_loss: 1.0313, test_f1: 0.4416
 epoch: 3, train_loss: 1.0835, test_loss: 0.9953, test_f1: 0.4706
 epoch: 4, train_loss: 1.0627, test_loss: 0.9822, test_f1: 0.5103
 epoch: 5, train_loss: 1.0358, test_loss: 0.9753, test_f1: 0.4812
 epoch: 6, train_loss: 1.0282, test_loss: 0.9743, test_f1: 0.4784
 epoch: 7, train_loss: 0.9923, test_loss: 0.9986, test_f1: 0.4707
 epoch: 8, train_loss: 0.9756, test_loss: 0.9380, test_f1: 0.5149
 epoch: 9, train_loss: 0.9689, test_loss: 0.9908, test_f1: 0.5020
 epoch: 10, train_loss: 0.9668, test_loss: 0.9289, test_f1: 0.4953
 epoch: 11, train_loss: 0.9364, test_loss: 0.9105, test_f1: 0.4973
 epoch: 12, train_loss: 0.9276, test_loss: 0.9346, test_f1: 0.4944
 epoch: 13, train_loss: 0.9259, test_loss: 0.9764, test_f1: 0.4900
 epoch: 14, train_loss: 0.9020, test_loss: 0.9673, test_f1: 0.4900
 epoch: 15, train_loss: 0.8948, test_loss: 0.9433, test_f1: 0.5078
 epoch: 16, train_loss: 0.8949, test_loss: 1.0149, test_f1: 0.4917
 epoch: 17, train_loss: 0.9092, test_loss: 0.9098, test_f1: 0.5386
 epoch: 18, train_loss: 0.8877, test_loss: 0.9125, test_f1: 0.5319
 epoch: 19, train_loss: 0.8756, test_loss: 0.9668, test_f1: 0.4967
 epoch: 20, train_loss: 0.8601, test_loss: 0.9939, test_f1: 0.5178
 epoch: 21, train_loss: 0.8566, test_loss: 0.9875, test_f1: 0.5106
 epoch: 22, train_loss: 0.8450, test_loss: 1.0649, test_f1: 0.5318
 epoch: 23, train_loss: 0.8467, test_loss: 1.0553, test_f1: 0.5241
 epoch: 24, train_loss: 0.8345, test_loss: 0.9702, test_f1: 0.5145
 epoch: 25, train_loss: 0.8314, test_loss: 1.0241, test_f1: 0.5221
 epoch: 26, train_loss: 0.8120, test_loss: 0.9702, test_f1: 0.5270
 epoch: 27, train_loss: 0.8101, test_loss: 0.9514, test_f1: 0.5376
 epoch: 28, train_loss: 0.8062, test_loss: 1.0361, test_f1: 0.5064
 epoch: 29, train_loss: 0.7901, test_loss: 0.9750, test_f1: 0.4948
 epoch: 30, train_loss: 0.8060, test_loss: 1.0280, test_f1: 0.5173
 epoch: 31, train_loss: 0.7837, test_loss: 1.0270, test_f1: 0.5206
 epoch: 32, train_loss: 0.7785, test_loss: 1.1176, test_f1: 0.5510
 epoch: 33, train_loss: 0.7765, test_loss: 1.1036, test_f1: 0.4957
 epoch: 34, train_loss: 0.7799, test_loss: 1.1478, test_f1: 0.5442
 epoch: 35, train_loss: 0.7718, test_loss: 1.0184, test_f1: 0.5030
 epoch: 36, train_loss: 0.7531, test_loss: 0.9616, test_f1: 0.5211
 epoch: 37, train_loss: 0.7648, test_loss: 0.9986, test_f1: 0.5361
 epoch: 38, train_loss: 0.7467, test_loss: 1.1008, test_f1: 0.5228
 epoch: 39, train_loss: 0.7518, test_loss: 1.0375, test_f1: 0.5445
 epoch: 40, train_loss: 0.7407, test_loss: 1.0425, test_f1: 0.5429
 epoch: 41, train_loss: 0.7472, test_loss: 1.0618, test_f1: 0.5015
 epoch: 42, train_loss: 0.7402, test_loss: 1.0506, test_f1: 0.5405
 epoch: 43, train_loss: 0.7487, test_loss: 1.1001, test_f1: 0.5190
 epoch: 44, train_loss: 0.7356, test_loss: 1.0676, test_f1: 0.5211
 epoch: 45, train_loss: 0.7076, test_loss: 1.0751, test_f1: 0.5518
 epoch: 46, train_loss: 0.7186, test_loss: 1.1153, test_f1: 0.5306
 epoch: 47, train_loss: 0.6967, test_loss: 0.9918, test_f1: 0.5504
 epoch: 48, train_loss: 0.6832, test_loss: 1.1360, test_f1: 0.5487
 epoch: 49, train_loss: 0.6896, test_loss: 1.0937, test_f1: 0.5497
 epoch: 50, train_loss: 0.6837, test_loss: 1.2192, test_f1: 0.5650
 epoch: 51, train_loss: 0.6590, test_loss: 1.2178, test_f1: 0.5465
 epoch: 52, train_loss: 0.6722, test_loss: 1.1912, test_f1: 0.5583
 epoch: 53, train_loss: 0.6361, test_loss: 1.1730, test_f1: 0.5552
 epoch: 54, train_loss: 0.6332, test_loss: 1.1006, test_f1: 0.5493
 epoch: 55, train_loss: 0.6426, test_loss: 1.1501, test_f1: 0.5693
 epoch: 56, train_loss: 0.6131, test_loss: 1.1909, test_f1: 0.5609
 epoch: 57, train_loss: 0.6234, test_loss: 1.2305, test_f1: 0.5559
 epoch: 58, train_loss: 0.6145, test_loss: 1.1597, test_f1: 0.5688
 epoch: 59, train_loss: 0.6006, test_loss: 1.2305, test_f1: 0.5400
 epoch: 60, train_loss: 0.6091, test_loss: 1.2209, test_f1: 0.5458
 epoch: 61, train_loss: 0.5944, test_loss: 1.3424, test_f1: 0.5187
 epoch: 62, train_loss: 0.5921, test_loss: 1.2685, test_f1: 0.5398
 epoch: 63, train_loss: 0.5869, test_loss: 1.3725, test_f1: 0.5483
 epoch: 64, train_loss: 0.5829, test_loss: 1.3512, test_f1: 0.5423
 epoch: 65, train_loss: 0.5838, test_loss: 1.2795, test_f1: 0.5444
 epoch: 66, train_loss: 0.5853, test_loss: 1.2938, test_f1: 0.5553
 epoch: 67, train_loss: 0.5782, test_loss: 1.3910, test_f1: 0.5048
 epoch: 68, train_loss: 0.6072, test_loss: 1.3462, test_f1: 0.5185
 epoch: 69, train_loss: 0.5823, test_loss: 1.3118, test_f1: 0.5575
 epoch: 70, train_loss: 0.5662, test_loss: 1.3836, test_f1: 0.5253
 epoch: 71, train_loss: 0.5645, test_loss: 1.3380, test_f1: 0.5737
 epoch: 72, train_loss: 0.5507, test_loss: 1.3515, test_f1: 0.5699
 epoch: 73, train_loss: 0.5554, test_loss: 1.3732, test_f1: 0.5644
 epoch: 74, train_loss: 0.5258, test_loss: 1.3239, test_f1: 0.5506
 epoch: 75, train_loss: 0.5500, test_loss: 1.2717, test_f1: 0.5603
 epoch: 76, train_loss: 0.5292, test_loss: 1.3543, test_f1: 0.5642
 epoch: 77, train_loss: 0.5558, test_loss: 1.3295, test_f1: 0.5638
 epoch: 78, train_loss: 0.5284, test_loss: 1.3304, test_f1: 0.5479
 epoch: 79, train_loss: 0.5393, test_loss: 1.3627, test_f1: 0.5629
 epoch: 80, train_loss: 0.5424, test_loss: 1.4177, test_f1: 0.5583
 epoch: 81, train_loss: 0.5268, test_loss: 1.4781, test_f1: 0.5211
 epoch: 82, train_loss: 0.5498, test_loss: 1.3513, test_f1: 0.5394
 epoch: 83, train_loss: 0.5249, test_loss: 1.3123, test_f1: 0.5881
 epoch: 84, train_loss: 0.5277, test_loss: 1.2974, test_f1: 0.5691
 epoch: 85, train_loss: 0.5208, test_loss: 1.3988, test_f1: 0.5546
 epoch: 86, train_loss: 0.5062, test_loss: 1.4720, test_f1: 0.5345
 epoch: 87, train_loss: 0.5182, test_loss: 1.4519, test_f1: 0.5287
 epoch: 88, train_loss: 0.5114, test_loss: 1.4384, test_f1: 0.5511
 epoch: 89, train_loss: 0.5129, test_loss: 1.4396, test_f1: 0.5490
 epoch: 90, train_loss: 0.5359, test_loss: 1.4656, test_f1: 0.5552
 epoch: 91, train_loss: 0.5255, test_loss: 1.3893, test_f1: 0.5542
 epoch: 92, train_loss: 0.4815, test_loss: 1.4695, test_f1: 0.5454
 epoch: 93, train_loss: 0.4921, test_loss: 1.4316, test_f1: 0.5517
 epoch: 94, train_loss: 0.4965, test_loss: 1.4465, test_f1: 0.5388
 epoch: 95, train_loss: 0.4958, test_loss: 1.5386, test_f1: 0.5436
 epoch: 96, train_loss: 0.4978, test_loss: 1.4149, test_f1: 0.5580
 epoch: 97, train_loss: 0.4887, test_loss: 1.4560, test_f1: 0.5260
 epoch: 98, train_loss: 0.4931, test_loss: 1.4918, test_f1: 0.5625
 epoch: 99, train_loss: 0.4845, test_loss: 1.4710, test_f1: 0.5380
##################ITERATION #7 ****************************************
 epoch: 0, train_loss: 1.2860, test_loss: 1.1521, test_f1: 0.4077
 epoch: 1, train_loss: 1.1796, test_loss: 1.0784, test_f1: 0.4417
 epoch: 2, train_loss: 1.1281, test_loss: 1.0581, test_f1: 0.4208
 epoch: 3, train_loss: 1.0854, test_loss: 1.0204, test_f1: 0.4831
 epoch: 4, train_loss: 1.0540, test_loss: 0.9893, test_f1: 0.4562
 epoch: 5, train_loss: 1.0334, test_loss: 0.9488, test_f1: 0.4725
 epoch: 6, train_loss: 1.0271, test_loss: 1.0086, test_f1: 0.4573
 epoch: 7, train_loss: 0.9946, test_loss: 0.9746, test_f1: 0.4683
 epoch: 8, train_loss: 0.9893, test_loss: 0.9403, test_f1: 0.4977
 epoch: 9, train_loss: 0.9801, test_loss: 0.9760, test_f1: 0.4779
 epoch: 10, train_loss: 0.9483, test_loss: 1.0062, test_f1: 0.4598
 epoch: 11, train_loss: 0.9627, test_loss: 1.0832, test_f1: 0.4851
 epoch: 12, train_loss: 0.9340, test_loss: 0.9241, test_f1: 0.4985
 epoch: 13, train_loss: 0.9184, test_loss: 0.9124, test_f1: 0.5175
 epoch: 14, train_loss: 0.9138, test_loss: 0.9495, test_f1: 0.5230
 epoch: 15, train_loss: 0.9087, test_loss: 1.0445, test_f1: 0.4682
 epoch: 16, train_loss: 0.8929, test_loss: 0.9552, test_f1: 0.4858
 epoch: 17, train_loss: 0.8868, test_loss: 0.9588, test_f1: 0.4964
 epoch: 18, train_loss: 0.8822, test_loss: 0.9074, test_f1: 0.5182
 epoch: 19, train_loss: 0.8858, test_loss: 0.9344, test_f1: 0.5217
 epoch: 20, train_loss: 0.8549, test_loss: 1.0428, test_f1: 0.5414
 epoch: 21, train_loss: 0.8630, test_loss: 1.0494, test_f1: 0.5090
 epoch: 22, train_loss: 0.8639, test_loss: 0.9510, test_f1: 0.5388
 epoch: 23, train_loss: 0.8484, test_loss: 0.9465, test_f1: 0.5226
 epoch: 24, train_loss: 0.8476, test_loss: 0.8899, test_f1: 0.5204
 epoch: 25, train_loss: 0.8396, test_loss: 0.9642, test_f1: 0.5420
 epoch: 26, train_loss: 0.8273, test_loss: 1.0043, test_f1: 0.5152
 epoch: 27, train_loss: 0.8211, test_loss: 1.0245, test_f1: 0.5563
 epoch: 28, train_loss: 0.8271, test_loss: 0.9623, test_f1: 0.5546
 epoch: 29, train_loss: 0.8617, test_loss: 0.9797, test_f1: 0.5279
 epoch: 30, train_loss: 0.8407, test_loss: 1.0035, test_f1: 0.5466
 epoch: 31, train_loss: 0.8073, test_loss: 1.0438, test_f1: 0.5236
 epoch: 32, train_loss: 0.8233, test_loss: 1.0177, test_f1: 0.5643
 epoch: 33, train_loss: 0.8017, test_loss: 0.9991, test_f1: 0.5717
 epoch: 34, train_loss: 0.8049, test_loss: 0.9900, test_f1: 0.5496
 epoch: 35, train_loss: 0.7923, test_loss: 1.0062, test_f1: 0.5421
 epoch: 36, train_loss: 0.7791, test_loss: 0.9884, test_f1: 0.5447
 epoch: 37, train_loss: 0.7792, test_loss: 1.0518, test_f1: 0.5027
 epoch: 38, train_loss: 0.7937, test_loss: 0.9340, test_f1: 0.5504
 epoch: 39, train_loss: 0.7702, test_loss: 0.9783, test_f1: 0.5603
 epoch: 40, train_loss: 0.7617, test_loss: 1.0235, test_f1: 0.5410
 epoch: 41, train_loss: 0.7800, test_loss: 1.0101, test_f1: 0.5799
 epoch: 42, train_loss: 0.7891, test_loss: 1.0112, test_f1: 0.5777
 epoch: 43, train_loss: 0.7542, test_loss: 0.9560, test_f1: 0.5604
 epoch: 44, train_loss: 0.7688, test_loss: 0.9492, test_f1: 0.5697
 epoch: 45, train_loss: 0.7335, test_loss: 0.9891, test_f1: 0.5207
 epoch: 46, train_loss: 0.7342, test_loss: 0.9933, test_f1: 0.5598
 epoch: 47, train_loss: 0.7413, test_loss: 1.0539, test_f1: 0.5272
 epoch: 48, train_loss: 0.7172, test_loss: 1.0131, test_f1: 0.5467
 epoch: 49, train_loss: 0.7146, test_loss: 1.0727, test_f1: 0.5249
 epoch: 50, train_loss: 0.7474, test_loss: 1.0276, test_f1: 0.5453
 epoch: 51, train_loss: 0.6946, test_loss: 1.0666, test_f1: 0.5537
 epoch: 52, train_loss: 0.6959, test_loss: 1.0953, test_f1: 0.5582
 epoch: 53, train_loss: 0.6678, test_loss: 1.1698, test_f1: 0.5383
 epoch: 54, train_loss: 0.6649, test_loss: 1.1380, test_f1: 0.5082
 epoch: 55, train_loss: 0.6478, test_loss: 1.1012, test_f1: 0.5379
 epoch: 56, train_loss: 0.6483, test_loss: 1.0633, test_f1: 0.5240
 epoch: 57, train_loss: 0.6494, test_loss: 1.1043, test_f1: 0.5081
 epoch: 58, train_loss: 0.6702, test_loss: 1.0571, test_f1: 0.5507
 epoch: 59, train_loss: 0.6325, test_loss: 1.1924, test_f1: 0.5382
 epoch: 60, train_loss: 0.6553, test_loss: 1.1968, test_f1: 0.5384
 epoch: 61, train_loss: 0.6261, test_loss: 1.1610, test_f1: 0.5370
 epoch: 62, train_loss: 0.6235, test_loss: 1.1817, test_f1: 0.5354
 epoch: 63, train_loss: 0.6369, test_loss: 1.0854, test_f1: 0.5469
 epoch: 64, train_loss: 0.6513, test_loss: 1.1225, test_f1: 0.5352
 epoch: 65, train_loss: 0.6360, test_loss: 1.1383, test_f1: 0.5350
 epoch: 66, train_loss: 0.6211, test_loss: 1.2060, test_f1: 0.5294
 epoch: 67, train_loss: 0.6063, test_loss: 1.2458, test_f1: 0.5205
 epoch: 68, train_loss: 0.6092, test_loss: 1.0827, test_f1: 0.5706
 epoch: 69, train_loss: 0.5987, test_loss: 1.0632, test_f1: 0.5606
 epoch: 70, train_loss: 0.6066, test_loss: 1.1014, test_f1: 0.5325
 epoch: 71, train_loss: 0.5878, test_loss: 1.1261, test_f1: 0.5347
 epoch: 72, train_loss: 0.5903, test_loss: 1.1620, test_f1: 0.5406
 epoch: 73, train_loss: 0.6044, test_loss: 1.0785, test_f1: 0.5445
 epoch: 74, train_loss: 0.5945, test_loss: 1.1398, test_f1: 0.5633
 epoch: 75, train_loss: 0.5929, test_loss: 1.3005, test_f1: 0.5144
 epoch: 76, train_loss: 0.6065, test_loss: 1.1711, test_f1: 0.5396
 epoch: 77, train_loss: 0.5867, test_loss: 1.0936, test_f1: 0.5626
 epoch: 78, train_loss: 0.5859, test_loss: 1.0994, test_f1: 0.5696
 epoch: 79, train_loss: 0.5750, test_loss: 1.2398, test_f1: 0.5313
 epoch: 80, train_loss: 0.5719, test_loss: 1.1978, test_f1: 0.5565
 epoch: 81, train_loss: 0.5571, test_loss: 1.0915, test_f1: 0.5751
 epoch: 82, train_loss: 0.5972, test_loss: 1.1485, test_f1: 0.5626
 epoch: 83, train_loss: 0.5661, test_loss: 1.1649, test_f1: 0.5453
 epoch: 84, train_loss: 0.5548, test_loss: 1.1986, test_f1: 0.5799
 epoch: 85, train_loss: 0.5639, test_loss: 1.2087, test_f1: 0.5333
 epoch: 86, train_loss: 0.5660, test_loss: 1.1510, test_f1: 0.5495
 epoch: 87, train_loss: 0.5522, test_loss: 1.1410, test_f1: 0.5744
 epoch: 88, train_loss: 0.5444, test_loss: 1.1636, test_f1: 0.5399
 epoch: 89, train_loss: 0.5686, test_loss: 1.1726, test_f1: 0.5443
 epoch: 90, train_loss: 0.5474, test_loss: 1.1431, test_f1: 0.5373
 epoch: 91, train_loss: 0.5497, test_loss: 1.2357, test_f1: 0.5509
 epoch: 92, train_loss: 0.5781, test_loss: 1.2489, test_f1: 0.5417
 epoch: 93, train_loss: 0.5421, test_loss: 1.1360, test_f1: 0.5554
 epoch: 94, train_loss: 0.5350, test_loss: 1.2243, test_f1: 0.5635
 epoch: 95, train_loss: 0.5386, test_loss: 1.1716, test_f1: 0.5629
 epoch: 96, train_loss: 0.5146, test_loss: 1.2919, test_f1: 0.5705
 epoch: 97, train_loss: 0.5265, test_loss: 1.1859, test_f1: 0.5674
 epoch: 98, train_loss: 0.5311, test_loss: 1.1787, test_f1: 0.5409
 epoch: 99, train_loss: 0.5268, test_loss: 1.2347, test_f1: 0.5559
##################ITERATION #8 ****************************************
 epoch: 0, train_loss: 1.3135, test_loss: 1.1455, test_f1: 0.4190
 epoch: 1, train_loss: 1.1734, test_loss: 1.0939, test_f1: 0.4058
 epoch: 2, train_loss: 1.1312, test_loss: 1.0292, test_f1: 0.4476
 epoch: 3, train_loss: 1.1022, test_loss: 1.0355, test_f1: 0.4499
 epoch: 4, train_loss: 1.0771, test_loss: 0.9587, test_f1: 0.4716
 epoch: 5, train_loss: 1.0474, test_loss: 1.0379, test_f1: 0.4337
 epoch: 6, train_loss: 1.0328, test_loss: 0.9669, test_f1: 0.4720
 epoch: 7, train_loss: 1.0333, test_loss: 0.9546, test_f1: 0.4829
 epoch: 8, train_loss: 1.0017, test_loss: 1.0147, test_f1: 0.4554
 epoch: 9, train_loss: 0.9816, test_loss: 0.9863, test_f1: 0.4777
 epoch: 10, train_loss: 0.9889, test_loss: 0.9614, test_f1: 0.4721
 epoch: 11, train_loss: 0.9965, test_loss: 0.9241, test_f1: 0.4842
 epoch: 12, train_loss: 0.9768, test_loss: 0.9625, test_f1: 0.4786
 epoch: 13, train_loss: 0.9577, test_loss: 1.0013, test_f1: 0.4535
 epoch: 14, train_loss: 0.9467, test_loss: 0.9879, test_f1: 0.4723
 epoch: 15, train_loss: 0.9206, test_loss: 0.9709, test_f1: 0.4642
 epoch: 16, train_loss: 0.9095, test_loss: 1.0530, test_f1: 0.4781
 epoch: 17, train_loss: 0.9079, test_loss: 0.9545, test_f1: 0.4829
 epoch: 18, train_loss: 0.8971, test_loss: 1.0567, test_f1: 0.4167
 epoch: 19, train_loss: 0.8932, test_loss: 1.0693, test_f1: 0.4298
 epoch: 20, train_loss: 0.8835, test_loss: 1.1036, test_f1: 0.4820
 epoch: 21, train_loss: 0.8902, test_loss: 1.0120, test_f1: 0.5049
 epoch: 22, train_loss: 0.8769, test_loss: 0.9761, test_f1: 0.5286
 epoch: 23, train_loss: 0.8686, test_loss: 1.0062, test_f1: 0.4762
 epoch: 24, train_loss: 0.8508, test_loss: 1.0175, test_f1: 0.4866
 epoch: 25, train_loss: 0.8659, test_loss: 0.9513, test_f1: 0.5269
 epoch: 26, train_loss: 0.9102, test_loss: 0.9752, test_f1: 0.5163
 epoch: 27, train_loss: 0.8486, test_loss: 1.0234, test_f1: 0.4888
 epoch: 28, train_loss: 0.8384, test_loss: 1.0170, test_f1: 0.5201
 epoch: 29, train_loss: 0.8627, test_loss: 0.9898, test_f1: 0.5042
 epoch: 30, train_loss: 0.8216, test_loss: 1.0590, test_f1: 0.4877
 epoch: 31, train_loss: 0.8244, test_loss: 1.0265, test_f1: 0.4834
 epoch: 32, train_loss: 0.8363, test_loss: 0.9899, test_f1: 0.5236
 epoch: 33, train_loss: 0.8105, test_loss: 0.9898, test_f1: 0.5474
 epoch: 34, train_loss: 0.8030, test_loss: 1.1006, test_f1: 0.5392
 epoch: 35, train_loss: 0.8070, test_loss: 0.9796, test_f1: 0.5040
 epoch: 36, train_loss: 0.8017, test_loss: 1.0597, test_f1: 0.4917
 epoch: 37, train_loss: 0.7829, test_loss: 0.9668, test_f1: 0.5164
 epoch: 38, train_loss: 0.7801, test_loss: 1.0698, test_f1: 0.5364
 epoch: 39, train_loss: 0.7954, test_loss: 1.0275, test_f1: 0.5386
 epoch: 40, train_loss: 0.7782, test_loss: 1.0544, test_f1: 0.5495
 epoch: 41, train_loss: 0.7580, test_loss: 1.0835, test_f1: 0.5075
 epoch: 42, train_loss: 0.7561, test_loss: 1.0541, test_f1: 0.5524
 epoch: 43, train_loss: 0.7613, test_loss: 1.0621, test_f1: 0.5213
 epoch: 44, train_loss: 0.7510, test_loss: 1.0283, test_f1: 0.5253
 epoch: 45, train_loss: 0.7678, test_loss: 1.0356, test_f1: 0.5397
 epoch: 46, train_loss: 0.7447, test_loss: 0.9926, test_f1: 0.5339
 epoch: 47, train_loss: 0.7415, test_loss: 1.0521, test_f1: 0.5341
 epoch: 48, train_loss: 0.7301, test_loss: 1.0725, test_f1: 0.5409
 epoch: 49, train_loss: 0.7344, test_loss: 1.1164, test_f1: 0.5400
 epoch: 50, train_loss: 0.7425, test_loss: 1.1099, test_f1: 0.5367
 epoch: 51, train_loss: 0.6957, test_loss: 1.1006, test_f1: 0.5475
 epoch: 52, train_loss: 0.6793, test_loss: 1.1447, test_f1: 0.5332
 epoch: 53, train_loss: 0.6785, test_loss: 1.1907, test_f1: 0.5209
 epoch: 54, train_loss: 0.6693, test_loss: 1.1237, test_f1: 0.5277
 epoch: 55, train_loss: 0.6635, test_loss: 1.1048, test_f1: 0.5443
 epoch: 56, train_loss: 0.6551, test_loss: 1.1326, test_f1: 0.5295
 epoch: 57, train_loss: 0.6429, test_loss: 1.1397, test_f1: 0.5345
 epoch: 58, train_loss: 0.6532, test_loss: 1.1235, test_f1: 0.5313
 epoch: 59, train_loss: 0.6443, test_loss: 1.1246, test_f1: 0.5627
 epoch: 60, train_loss: 0.6353, test_loss: 1.1514, test_f1: 0.5505
 epoch: 61, train_loss: 0.6478, test_loss: 1.1053, test_f1: 0.5333
 epoch: 62, train_loss: 0.6296, test_loss: 1.1351, test_f1: 0.5324
 epoch: 63, train_loss: 0.6229, test_loss: 1.0955, test_f1: 0.5475
 epoch: 64, train_loss: 0.6263, test_loss: 1.1288, test_f1: 0.5380
 epoch: 65, train_loss: 0.6183, test_loss: 1.1719, test_f1: 0.5366
 epoch: 66, train_loss: 0.6132, test_loss: 1.1866, test_f1: 0.5226
 epoch: 67, train_loss: 0.6294, test_loss: 1.0872, test_f1: 0.5487
 epoch: 68, train_loss: 0.6250, test_loss: 1.1855, test_f1: 0.5351
 epoch: 69, train_loss: 0.6236, test_loss: 1.1409, test_f1: 0.5355
 epoch: 70, train_loss: 0.6181, test_loss: 1.0991, test_f1: 0.5335
 epoch: 71, train_loss: 0.6167, test_loss: 1.1086, test_f1: 0.5700
 epoch: 72, train_loss: 0.5890, test_loss: 1.1560, test_f1: 0.5379
 epoch: 73, train_loss: 0.5890, test_loss: 1.2029, test_f1: 0.5447
 epoch: 74, train_loss: 0.5927, test_loss: 1.1702, test_f1: 0.5479
 epoch: 75, train_loss: 0.5753, test_loss: 1.2198, test_f1: 0.5569
 epoch: 76, train_loss: 0.5963, test_loss: 1.1386, test_f1: 0.5400
 epoch: 77, train_loss: 0.5953, test_loss: 1.2066, test_f1: 0.5474
 epoch: 78, train_loss: 0.5817, test_loss: 1.1282, test_f1: 0.5652
 epoch: 79, train_loss: 0.5814, test_loss: 1.1896, test_f1: 0.5292
 epoch: 80, train_loss: 0.5565, test_loss: 1.2727, test_f1: 0.5027
 epoch: 81, train_loss: 0.5687, test_loss: 1.2435, test_f1: 0.5240
 epoch: 82, train_loss: 0.5647, test_loss: 1.2227, test_f1: 0.5566
 epoch: 83, train_loss: 0.5620, test_loss: 1.2705, test_f1: 0.5535
 epoch: 84, train_loss: 0.5735, test_loss: 1.1803, test_f1: 0.5486
 epoch: 85, train_loss: 0.5520, test_loss: 1.2597, test_f1: 0.5544
 epoch: 86, train_loss: 0.5733, test_loss: 1.2118, test_f1: 0.5328
 epoch: 87, train_loss: 0.5668, test_loss: 1.1936, test_f1: 0.5331
 epoch: 88, train_loss: 0.5505, test_loss: 1.2008, test_f1: 0.5780
 epoch: 89, train_loss: 0.5358, test_loss: 1.2911, test_f1: 0.5299
 epoch: 90, train_loss: 0.5601, test_loss: 1.2712, test_f1: 0.5302
 epoch: 91, train_loss: 0.6475, test_loss: 1.2469, test_f1: 0.5294
 epoch: 92, train_loss: 0.5884, test_loss: 1.1562, test_f1: 0.5363
 epoch: 93, train_loss: 0.5568, test_loss: 1.2211, test_f1: 0.5418
 epoch: 94, train_loss: 0.5649, test_loss: 1.2285, test_f1: 0.5392
 epoch: 95, train_loss: 0.5567, test_loss: 1.2301, test_f1: 0.5612
 epoch: 96, train_loss: 0.5260, test_loss: 1.3065, test_f1: 0.5283
 epoch: 97, train_loss: 0.5420, test_loss: 1.1893, test_f1: 0.5816
 epoch: 98, train_loss: 0.5357, test_loss: 1.2428, test_f1: 0.5595
 epoch: 99, train_loss: 0.5376, test_loss: 1.2715, test_f1: 0.5452
##################ITERATION #9 ****************************************
 epoch: 0, train_loss: 1.3480, test_loss: 1.1885, test_f1: 0.3102
 epoch: 1, train_loss: 1.1800, test_loss: 1.0763, test_f1: 0.4279
 epoch: 2, train_loss: 1.1240, test_loss: 1.0232, test_f1: 0.4559
 epoch: 3, train_loss: 1.0950, test_loss: 0.9952, test_f1: 0.4856
 epoch: 4, train_loss: 1.0721, test_loss: 0.9751, test_f1: 0.4709
 epoch: 5, train_loss: 1.0311, test_loss: 0.9823, test_f1: 0.4932
 epoch: 6, train_loss: 1.0081, test_loss: 0.9943, test_f1: 0.4704
 epoch: 7, train_loss: 1.0020, test_loss: 0.9641, test_f1: 0.4815
 epoch: 8, train_loss: 0.9904, test_loss: 0.9476, test_f1: 0.4918
 epoch: 9, train_loss: 0.9719, test_loss: 0.9477, test_f1: 0.4875
 epoch: 10, train_loss: 0.9277, test_loss: 0.9614, test_f1: 0.4872
 epoch: 11, train_loss: 0.9324, test_loss: 0.9358, test_f1: 0.4981
 epoch: 12, train_loss: 0.9174, test_loss: 1.0405, test_f1: 0.4838
 epoch: 13, train_loss: 0.9128, test_loss: 0.9437, test_f1: 0.5170
 epoch: 14, train_loss: 0.8984, test_loss: 0.9480, test_f1: 0.5351
 epoch: 15, train_loss: 0.8994, test_loss: 0.9693, test_f1: 0.5121
 epoch: 16, train_loss: 0.8935, test_loss: 0.9633, test_f1: 0.5225
 epoch: 17, train_loss: 0.8814, test_loss: 0.9415, test_f1: 0.5362
 epoch: 18, train_loss: 0.8598, test_loss: 0.9497, test_f1: 0.5297
 epoch: 19, train_loss: 0.8567, test_loss: 0.9985, test_f1: 0.5104
 epoch: 20, train_loss: 0.8615, test_loss: 0.9407, test_f1: 0.5270
 epoch: 21, train_loss: 0.8391, test_loss: 0.9934, test_f1: 0.5530
 epoch: 22, train_loss: 0.8455, test_loss: 0.9677, test_f1: 0.5392
 epoch: 23, train_loss: 0.8382, test_loss: 0.9720, test_f1: 0.5512
 epoch: 24, train_loss: 0.8319, test_loss: 0.9893, test_f1: 0.5109
 epoch: 25, train_loss: 0.8320, test_loss: 0.9771, test_f1: 0.5429
 epoch: 26, train_loss: 0.8001, test_loss: 0.9752, test_f1: 0.5472
 epoch: 27, train_loss: 0.8016, test_loss: 1.0269, test_f1: 0.5409
 epoch: 28, train_loss: 0.8015, test_loss: 1.0798, test_f1: 0.5439
 epoch: 29, train_loss: 0.7893, test_loss: 1.0224, test_f1: 0.5187
 epoch: 30, train_loss: 0.7924, test_loss: 0.9668, test_f1: 0.5551
 epoch: 31, train_loss: 0.7778, test_loss: 1.0709, test_f1: 0.5366
 epoch: 32, train_loss: 0.7721, test_loss: 1.0680, test_f1: 0.5350
 epoch: 33, train_loss: 0.7860, test_loss: 1.0467, test_f1: 0.5369
 epoch: 34, train_loss: 0.7618, test_loss: 1.0396, test_f1: 0.5534
 epoch: 35, train_loss: 0.7651, test_loss: 1.0530, test_f1: 0.5705
 epoch: 36, train_loss: 0.7451, test_loss: 1.1020, test_f1: 0.5481
 epoch: 37, train_loss: 0.7519, test_loss: 1.0056, test_f1: 0.5270
 epoch: 38, train_loss: 0.7419, test_loss: 1.0457, test_f1: 0.5359
 epoch: 39, train_loss: 0.7387, test_loss: 1.0807, test_f1: 0.5151
 epoch: 40, train_loss: 0.7331, test_loss: 1.0478, test_f1: 0.5462
 epoch: 41, train_loss: 0.7166, test_loss: 1.0303, test_f1: 0.5629
 epoch: 42, train_loss: 0.7270, test_loss: 1.0047, test_f1: 0.5373
 epoch: 43, train_loss: 0.7146, test_loss: 1.0735, test_f1: 0.5660
 epoch: 44, train_loss: 0.7183, test_loss: 1.1195, test_f1: 0.5179
 epoch: 45, train_loss: 0.6933, test_loss: 1.0858, test_f1: 0.5621
 epoch: 46, train_loss: 0.7018, test_loss: 1.0441, test_f1: 0.5545
 epoch: 47, train_loss: 0.7366, test_loss: 1.0118, test_f1: 0.5565
 epoch: 48, train_loss: 0.6924, test_loss: 1.0671, test_f1: 0.5619
 epoch: 49, train_loss: 0.6879, test_loss: 1.1156, test_f1: 0.5316
 epoch: 50, train_loss: 0.7247, test_loss: 1.0345, test_f1: 0.5445
 epoch: 51, train_loss: 0.6800, test_loss: 1.0062, test_f1: 0.5883
 epoch: 52, train_loss: 0.6453, test_loss: 1.0725, test_f1: 0.5667
 epoch: 53, train_loss: 0.6280, test_loss: 1.0875, test_f1: 0.5629
 epoch: 54, train_loss: 0.6239, test_loss: 1.0466, test_f1: 0.5652
 epoch: 55, train_loss: 0.6255, test_loss: 1.0732, test_f1: 0.5538
 epoch: 56, train_loss: 0.6642, test_loss: 1.0247, test_f1: 0.5366
 epoch: 57, train_loss: 0.6206, test_loss: 1.0152, test_f1: 0.5562
 epoch: 58, train_loss: 0.6198, test_loss: 1.1065, test_f1: 0.5700
 epoch: 59, train_loss: 0.6255, test_loss: 1.0775, test_f1: 0.5822
 epoch: 60, train_loss: 0.6063, test_loss: 1.1567, test_f1: 0.5492
 epoch: 61, train_loss: 0.6120, test_loss: 1.1220, test_f1: 0.6013
 epoch: 62, train_loss: 0.5972, test_loss: 1.0929, test_f1: 0.5747
 epoch: 63, train_loss: 0.6104, test_loss: 1.1030, test_f1: 0.5664
 epoch: 64, train_loss: 0.5961, test_loss: 1.1534, test_f1: 0.5373
 epoch: 65, train_loss: 0.5835, test_loss: 1.1076, test_f1: 0.5661
 epoch: 66, train_loss: 0.5814, test_loss: 1.1479, test_f1: 0.5525
 epoch: 67, train_loss: 0.5787, test_loss: 1.1100, test_f1: 0.5744
 epoch: 68, train_loss: 0.5870, test_loss: 1.1344, test_f1: 0.5656
 epoch: 69, train_loss: 0.5753, test_loss: 1.1670, test_f1: 0.5771
 epoch: 70, train_loss: 0.5767, test_loss: 1.1372, test_f1: 0.5608
 epoch: 71, train_loss: 0.5766, test_loss: 1.1280, test_f1: 0.5648
 epoch: 72, train_loss: 0.5728, test_loss: 1.1687, test_f1: 0.5391
 epoch: 73, train_loss: 0.5664, test_loss: 1.1600, test_f1: 0.5652
 epoch: 74, train_loss: 0.5761, test_loss: 1.1655, test_f1: 0.5561
 epoch: 75, train_loss: 0.5559, test_loss: 1.2022, test_f1: 0.5680
 epoch: 76, train_loss: 0.5618, test_loss: 1.2023, test_f1: 0.5659
 epoch: 77, train_loss: 0.5621, test_loss: 1.1650, test_f1: 0.5441
 epoch: 78, train_loss: 0.5463, test_loss: 1.2061, test_f1: 0.5539
 epoch: 79, train_loss: 0.5495, test_loss: 1.1489, test_f1: 0.5950
 epoch: 80, train_loss: 0.5586, test_loss: 1.1307, test_f1: 0.5929
 epoch: 81, train_loss: 0.5426, test_loss: 1.1654, test_f1: 0.5612
 epoch: 82, train_loss: 0.5397, test_loss: 1.2318, test_f1: 0.5517
 epoch: 83, train_loss: 0.5359, test_loss: 1.2126, test_f1: 0.5378
 epoch: 84, train_loss: 0.5173, test_loss: 1.1637, test_f1: 0.5741
 epoch: 85, train_loss: 0.5187, test_loss: 1.2517, test_f1: 0.5541
 epoch: 86, train_loss: 0.5361, test_loss: 1.2751, test_f1: 0.5533
 epoch: 87, train_loss: 0.5303, test_loss: 1.1976, test_f1: 0.5903
 epoch: 88, train_loss: 0.5256, test_loss: 1.1966, test_f1: 0.5642
 epoch: 89, train_loss: 0.5173, test_loss: 1.2309, test_f1: 0.5716
 epoch: 90, train_loss: 0.5208, test_loss: 1.1967, test_f1: 0.5843
 epoch: 91, train_loss: 0.5283, test_loss: 1.2750, test_f1: 0.5499
 epoch: 92, train_loss: 0.5137, test_loss: 1.2013, test_f1: 0.5611
 epoch: 93, train_loss: 0.5342, test_loss: 1.2963, test_f1: 0.5298
 epoch: 94, train_loss: 0.5186, test_loss: 1.3360, test_f1: 0.5268
 epoch: 95, train_loss: 0.5165, test_loss: 1.1857, test_f1: 0.5677
 epoch: 96, train_loss: 0.5372, test_loss: 1.2159, test_f1: 0.5634
 epoch: 97, train_loss: 0.5401, test_loss: 1.2014, test_f1: 0.5633
 epoch: 98, train_loss: 0.4933, test_loss: 1.2351, test_f1: 0.5681
 epoch: 99, train_loss: 0.4919, test_loss: 1.2702, test_f1: 0.5515

Training completed in 1145.10 seconds
Best F1: 0.6086 at epoch 91
Mean F1 across iterations: 0.5901  0.0092
========================FINAL RESULTS================================
FEGIN weighted F1: 0.6086  0.0092
python main.py --data ltspice_examples --representation component_component --model FEGIN --layers 4 --hiddens 64 --batch_size 32 --lr 0.001 --emb_size 128 --epochs 100 --save_appendix component_component_L4_H64_BS32_LR0.001_E128 --no_val
-----



STDERR:
  File "main.py", line 370, in <module>
    main()
  File "main.py", line 254, in main
    dataset = dataset_class(
  File "/home/philip/projects/ltspice_examples_code_repo/Circuit-Completion-Using-GNNs/component_classification_with_link_prediction_head/evaluation/FEGIN/kernel/circuit_datasets.py", line 15, in __init__
    self.data, self.slices = torch.load(self.processed_paths[0])
  File "/home/philip/.local/lib/python3.8/site-packages/torch/serialization.py", line 1040, in load
    warnings.warn(
  File "/usr/lib/python3.8/warnings.py", line 109, in _showwarnmsg
    sw(msg.message, msg.category, msg.filename, msg.lineno,
  File "main.py", line 47, in warn_with_traceback
    traceback.print_stack(file=log)
/home/philip/projects/ltspice_examples_code_repo/Circuit-Completion-Using-GNNs/component_classification_with_link_prediction_head/evaluation/FEGIN/kernel/circuit_datasets.py:15: FutureWarning: You are using `torch.load` with `weights_only=False` (the current default value), which uses the default pickle module implicitly. It is possible to construct malicious pickle data which will execute arbitrary code during unpickling (See https://github.com/pytorch/pytorch/blob/main/SECURITY.md#untrusted-models for more details). In a future release, the default value for `weights_only` will be flipped to `True`. This limits the functions that could be executed during unpickling. Arbitrary objects will no longer be allowed to be loaded via this mode unless they are explicitly allowlisted by the user via `torch.serialization.add_safe_globals`. We recommend you start setting `weights_only=True` for any use case where you don't have full control of the loaded file. Please open an issue on GitHub for any issues related to this experimental feature.
  self.data, self.slices = torch.load(self.processed_paths[0])
