STDOUT:
Results will be saved in /home/philip/projects/ltspice_examples_code_repo/Circuit-Completion-Using-GNNs/component_classification_with_link_prediction_head/evaluation/FEGIN/results/model_FEGIN_dataset_ltspice_demos
Command line input: python main.py --data ltspice_demos --representation component_component --model FEGIN --layers 2 --hiddens 64 --batch_size 128 --lr 0.001 --emb_size 250 --epochs 100 --save_appendix component_component_L2_H64_BS128_LR0.001_E250 --no_val
 is saved.
-----
ltspice_demos - FEGIN
Using 2 layers, 64 hidden units, h = 2
Loading component_component representation dataset
ENTERED
Training FEGIN on component_component representation
Train: 1565, Test: 383
##################ITERATION #0 ****************************************
 epoch: 0, train_loss: 1.3633, test_loss: 1.3471, test_f1: 0.2281
 epoch: 1, train_loss: 1.2465, test_loss: 1.2923, test_f1: 0.2659
 epoch: 2, train_loss: 1.1965, test_loss: 1.2816, test_f1: 0.2672
 epoch: 3, train_loss: 1.1584, test_loss: 1.2548, test_f1: 0.2866
 epoch: 4, train_loss: 1.1347, test_loss: 1.2356, test_f1: 0.4045
 epoch: 5, train_loss: 1.0968, test_loss: 1.1898, test_f1: 0.4051
 epoch: 6, train_loss: 1.0619, test_loss: 1.1699, test_f1: 0.4464
 epoch: 7, train_loss: 1.0214, test_loss: 1.1802, test_f1: 0.4402
 epoch: 8, train_loss: 1.0048, test_loss: 1.2274, test_f1: 0.4381
 epoch: 9, train_loss: 0.9763, test_loss: 1.2201, test_f1: 0.4704
 epoch: 10, train_loss: 0.9451, test_loss: 1.2120, test_f1: 0.5010
 epoch: 11, train_loss: 0.9326, test_loss: 1.2177, test_f1: 0.5289
 epoch: 12, train_loss: 0.9073, test_loss: 1.2704, test_f1: 0.4951
 epoch: 13, train_loss: 0.8946, test_loss: 1.1638, test_f1: 0.5363
 epoch: 14, train_loss: 0.8599, test_loss: 1.2483, test_f1: 0.4745
 epoch: 15, train_loss: 0.8627, test_loss: 1.2112, test_f1: 0.5389
 epoch: 16, train_loss: 0.8498, test_loss: 1.2804, test_f1: 0.5073
 epoch: 17, train_loss: 0.8528, test_loss: 1.3190, test_f1: 0.5169
 epoch: 18, train_loss: 0.8155, test_loss: 1.2477, test_f1: 0.5363
 epoch: 19, train_loss: 0.7713, test_loss: 1.2639, test_f1: 0.5666
 epoch: 20, train_loss: 0.7524, test_loss: 1.2225, test_f1: 0.5358
 epoch: 21, train_loss: 0.7568, test_loss: 1.4347, test_f1: 0.5290
 epoch: 22, train_loss: 0.7430, test_loss: 1.2990, test_f1: 0.5472
 epoch: 23, train_loss: 0.7228, test_loss: 1.2678, test_f1: 0.5393
 epoch: 24, train_loss: 0.7065, test_loss: 1.3278, test_f1: 0.5434
 epoch: 25, train_loss: 0.6966, test_loss: 1.4091, test_f1: 0.5333
 epoch: 26, train_loss: 0.6742, test_loss: 1.4083, test_f1: 0.5570
 epoch: 27, train_loss: 0.6606, test_loss: 1.2805, test_f1: 0.5280
 epoch: 28, train_loss: 0.6462, test_loss: 1.5924, test_f1: 0.5091
 epoch: 29, train_loss: 0.6242, test_loss: 1.6253, test_f1: 0.4886
 epoch: 30, train_loss: 0.6191, test_loss: 1.6297, test_f1: 0.5176
 epoch: 31, train_loss: 0.6156, test_loss: 1.4891, test_f1: 0.5260
 epoch: 32, train_loss: 0.5963, test_loss: 1.5332, test_f1: 0.5130
 epoch: 33, train_loss: 0.6133, test_loss: 1.5524, test_f1: 0.5329
 epoch: 34, train_loss: 0.6221, test_loss: 1.6142, test_f1: 0.5781
 epoch: 35, train_loss: 0.6090, test_loss: 1.6356, test_f1: 0.5165
 epoch: 36, train_loss: 0.5761, test_loss: 1.4890, test_f1: 0.5635
 epoch: 37, train_loss: 0.5681, test_loss: 1.5761, test_f1: 0.5565
 epoch: 38, train_loss: 0.5517, test_loss: 1.7444, test_f1: 0.5490
 epoch: 39, train_loss: 0.5472, test_loss: 1.7133, test_f1: 0.5242
 epoch: 40, train_loss: 0.5961, test_loss: 2.3164, test_f1: 0.4823
 epoch: 41, train_loss: 0.5435, test_loss: 1.6972, test_f1: 0.5305
 epoch: 42, train_loss: 0.5203, test_loss: 1.7927, test_f1: 0.5227
 epoch: 43, train_loss: 0.5157, test_loss: 1.8269, test_f1: 0.4848
 epoch: 44, train_loss: 0.5037, test_loss: 1.6739, test_f1: 0.5464
 epoch: 45, train_loss: 0.5185, test_loss: 1.8138, test_f1: 0.5237
 epoch: 46, train_loss: 0.4929, test_loss: 1.7221, test_f1: 0.5430
 epoch: 47, train_loss: 0.4841, test_loss: 2.1213, test_f1: 0.5179
 epoch: 48, train_loss: 0.4750, test_loss: 1.8081, test_f1: 0.5498
 epoch: 49, train_loss: 0.4710, test_loss: 2.0288, test_f1: 0.5226
 epoch: 50, train_loss: 0.4593, test_loss: 1.8562, test_f1: 0.5504
 epoch: 51, train_loss: 0.4544, test_loss: 1.8579, test_f1: 0.5269
 epoch: 52, train_loss: 0.4069, test_loss: 1.9610, test_f1: 0.5131
 epoch: 53, train_loss: 0.4097, test_loss: 2.2357, test_f1: 0.5023
 epoch: 54, train_loss: 0.4014, test_loss: 1.9932, test_f1: 0.5108
 epoch: 55, train_loss: 0.4117, test_loss: 2.0407, test_f1: 0.5237
 epoch: 56, train_loss: 0.4035, test_loss: 2.3019, test_f1: 0.5147
 epoch: 57, train_loss: 0.3984, test_loss: 2.0205, test_f1: 0.5316
 epoch: 58, train_loss: 0.3874, test_loss: 2.3467, test_f1: 0.5158
 epoch: 59, train_loss: 0.3777, test_loss: 2.2690, test_f1: 0.5124
 epoch: 60, train_loss: 0.3742, test_loss: 2.1053, test_f1: 0.5255
 epoch: 61, train_loss: 0.3588, test_loss: 2.2868, test_f1: 0.5097
 epoch: 62, train_loss: 0.3481, test_loss: 2.0753, test_f1: 0.5548
 epoch: 63, train_loss: 0.3523, test_loss: 2.3506, test_f1: 0.5622
 epoch: 64, train_loss: 0.3547, test_loss: 2.2855, test_f1: 0.4933
 epoch: 65, train_loss: 0.3711, test_loss: 2.1523, test_f1: 0.5289
 epoch: 66, train_loss: 0.3626, test_loss: 2.1930, test_f1: 0.5390
 epoch: 67, train_loss: 0.3186, test_loss: 2.4783, test_f1: 0.4966
 epoch: 68, train_loss: 0.3351, test_loss: 2.2657, test_f1: 0.5117
 epoch: 69, train_loss: 0.3297, test_loss: 2.3610, test_f1: 0.5308
 epoch: 70, train_loss: 0.3180, test_loss: 2.3646, test_f1: 0.5371
 epoch: 71, train_loss: 0.3293, test_loss: 2.7363, test_f1: 0.5013
 epoch: 72, train_loss: 0.3337, test_loss: 2.7168, test_f1: 0.5262
 epoch: 73, train_loss: 0.3253, test_loss: 2.7557, test_f1: 0.5176
 epoch: 74, train_loss: 0.3162, test_loss: 2.7611, test_f1: 0.5477
 epoch: 75, train_loss: 0.3415, test_loss: 2.7156, test_f1: 0.5048
 epoch: 76, train_loss: 0.3180, test_loss: 2.4403, test_f1: 0.5003
 epoch: 77, train_loss: 0.2823, test_loss: 2.4442, test_f1: 0.5452
 epoch: 78, train_loss: 0.2994, test_loss: 2.5756, test_f1: 0.5120
 epoch: 79, train_loss: 0.2904, test_loss: 2.5120, test_f1: 0.5368
 epoch: 80, train_loss: 0.3115, test_loss: 2.6440, test_f1: 0.5491
 epoch: 81, train_loss: 0.2898, test_loss: 2.8035, test_f1: 0.4966
 epoch: 82, train_loss: 0.2792, test_loss: 2.6548, test_f1: 0.5509
 epoch: 83, train_loss: 0.2844, test_loss: 2.7244, test_f1: 0.5216
 epoch: 84, train_loss: 0.3333, test_loss: 2.7474, test_f1: 0.5041
 epoch: 85, train_loss: 0.2903, test_loss: 2.7264, test_f1: 0.5214
 epoch: 86, train_loss: 0.3120, test_loss: 2.7339, test_f1: 0.5528
 epoch: 87, train_loss: 0.2904, test_loss: 2.6487, test_f1: 0.4914
 epoch: 88, train_loss: 0.2871, test_loss: 2.8574, test_f1: 0.5402
 epoch: 89, train_loss: 0.2942, test_loss: 2.7176, test_f1: 0.5174
 epoch: 90, train_loss: 0.2915, test_loss: 2.5511, test_f1: 0.5598
 epoch: 91, train_loss: 0.2782, test_loss: 2.8050, test_f1: 0.5311
 epoch: 92, train_loss: 0.2619, test_loss: 2.7679, test_f1: 0.5362
 epoch: 93, train_loss: 0.2555, test_loss: 2.9039, test_f1: 0.5250
 epoch: 94, train_loss: 0.2271, test_loss: 2.9877, test_f1: 0.5056
 epoch: 95, train_loss: 0.2550, test_loss: 2.7498, test_f1: 0.5320
 epoch: 96, train_loss: 0.2574, test_loss: 3.1233, test_f1: 0.5179
 epoch: 97, train_loss: 0.2727, test_loss: 3.0660, test_f1: 0.5149
 epoch: 98, train_loss: 0.2694, test_loss: 2.8887, test_f1: 0.5198
 epoch: 99, train_loss: 0.2552, test_loss: 3.0435, test_f1: 0.5487
##################ITERATION #1 ****************************************
 epoch: 0, train_loss: 1.2857, test_loss: 1.3096, test_f1: 0.3014
 epoch: 1, train_loss: 1.1578, test_loss: 1.2836, test_f1: 0.3810
 epoch: 2, train_loss: 1.1082, test_loss: 1.2264, test_f1: 0.4294
 epoch: 3, train_loss: 1.0486, test_loss: 1.1727, test_f1: 0.4476
 epoch: 4, train_loss: 1.0221, test_loss: 1.1963, test_f1: 0.5141
 epoch: 5, train_loss: 0.9727, test_loss: 1.1634, test_f1: 0.5104
 epoch: 6, train_loss: 0.9335, test_loss: 1.1764, test_f1: 0.5259
 epoch: 7, train_loss: 0.9087, test_loss: 1.2236, test_f1: 0.5253
 epoch: 8, train_loss: 0.8858, test_loss: 1.2472, test_f1: 0.5383
 epoch: 9, train_loss: 0.8606, test_loss: 1.2053, test_f1: 0.5805
 epoch: 10, train_loss: 0.8450, test_loss: 1.3030, test_f1: 0.5479
 epoch: 11, train_loss: 0.8297, test_loss: 1.2996, test_f1: 0.5946
 epoch: 12, train_loss: 0.7992, test_loss: 1.3129, test_f1: 0.5742
 epoch: 13, train_loss: 0.7876, test_loss: 1.3036, test_f1: 0.5428
 epoch: 14, train_loss: 0.7732, test_loss: 1.3142, test_f1: 0.5397
 epoch: 15, train_loss: 0.7527, test_loss: 1.3487, test_f1: 0.5658
 epoch: 16, train_loss: 0.7539, test_loss: 1.3811, test_f1: 0.5820
 epoch: 17, train_loss: 0.7205, test_loss: 1.3584, test_f1: 0.5067
 epoch: 18, train_loss: 0.7257, test_loss: 1.3309, test_f1: 0.5964
 epoch: 19, train_loss: 0.7120, test_loss: 1.3656, test_f1: 0.6070
 epoch: 20, train_loss: 0.7094, test_loss: 1.4010, test_f1: 0.5763
 epoch: 21, train_loss: 0.6739, test_loss: 1.4915, test_f1: 0.5993
 epoch: 22, train_loss: 0.6609, test_loss: 1.2916, test_f1: 0.5985
 epoch: 23, train_loss: 0.6633, test_loss: 1.3778, test_f1: 0.6073
 epoch: 24, train_loss: 0.6496, test_loss: 1.4039, test_f1: 0.5871
 epoch: 25, train_loss: 0.6286, test_loss: 1.4650, test_f1: 0.5719
 epoch: 26, train_loss: 0.6256, test_loss: 1.4721, test_f1: 0.5893
 epoch: 27, train_loss: 0.6018, test_loss: 1.5692, test_f1: 0.5903
 epoch: 28, train_loss: 0.5933, test_loss: 1.6233, test_f1: 0.5915
 epoch: 29, train_loss: 0.5605, test_loss: 1.6864, test_f1: 0.5838
 epoch: 30, train_loss: 0.5710, test_loss: 1.5093, test_f1: 0.6041
 epoch: 31, train_loss: 0.5968, test_loss: 1.8297, test_f1: 0.5883
 epoch: 32, train_loss: 0.5712, test_loss: 1.7823, test_f1: 0.5792
 epoch: 33, train_loss: 0.5609, test_loss: 1.8095, test_f1: 0.5956
 epoch: 34, train_loss: 0.5559, test_loss: 1.6649, test_f1: 0.5573
 epoch: 35, train_loss: 0.5357, test_loss: 1.6806, test_f1: 0.5707
 epoch: 36, train_loss: 0.5481, test_loss: 1.4852, test_f1: 0.5976
 epoch: 37, train_loss: 0.5313, test_loss: 1.9008, test_f1: 0.6204
 epoch: 38, train_loss: 0.5115, test_loss: 1.8849, test_f1: 0.5709
 epoch: 39, train_loss: 0.5097, test_loss: 1.5697, test_f1: 0.5794
 epoch: 40, train_loss: 0.4906, test_loss: 1.7134, test_f1: 0.5864
 epoch: 41, train_loss: 0.4922, test_loss: 1.8901, test_f1: 0.5969
 epoch: 42, train_loss: 0.4593, test_loss: 1.9978, test_f1: 0.5750
 epoch: 43, train_loss: 0.4904, test_loss: 1.7630, test_f1: 0.5409
 epoch: 44, train_loss: 0.4966, test_loss: 2.0344, test_f1: 0.6238
 epoch: 45, train_loss: 0.4588, test_loss: 1.7655, test_f1: 0.5448
 epoch: 46, train_loss: 0.4337, test_loss: 1.8148, test_f1: 0.5400
 epoch: 47, train_loss: 0.4549, test_loss: 2.0643, test_f1: 0.5484
 epoch: 48, train_loss: 0.4724, test_loss: 2.0144, test_f1: 0.5950
 epoch: 49, train_loss: 0.4474, test_loss: 1.8731, test_f1: 0.6098
 epoch: 50, train_loss: 0.4474, test_loss: 2.2369, test_f1: 0.5346
 epoch: 51, train_loss: 0.4300, test_loss: 2.0699, test_f1: 0.6090
 epoch: 52, train_loss: 0.3873, test_loss: 2.0130, test_f1: 0.6005
 epoch: 53, train_loss: 0.3963, test_loss: 2.0053, test_f1: 0.5587
 epoch: 54, train_loss: 0.3780, test_loss: 2.2045, test_f1: 0.5903
 epoch: 55, train_loss: 0.4000, test_loss: 2.0900, test_f1: 0.5924
 epoch: 56, train_loss: 0.3826, test_loss: 1.8462, test_f1: 0.6054
 epoch: 57, train_loss: 0.3895, test_loss: 2.0359, test_f1: 0.5753
 epoch: 58, train_loss: 0.3808, test_loss: 1.9824, test_f1: 0.6050
 epoch: 59, train_loss: 0.3676, test_loss: 1.8307, test_f1: 0.6036
 epoch: 60, train_loss: 0.3785, test_loss: 1.9724, test_f1: 0.5629
 epoch: 61, train_loss: 0.3709, test_loss: 2.0918, test_f1: 0.5920
 epoch: 62, train_loss: 0.3310, test_loss: 1.9864, test_f1: 0.6371
 epoch: 63, train_loss: 0.3454, test_loss: 2.0641, test_f1: 0.6116
 epoch: 64, train_loss: 0.3209, test_loss: 2.0125, test_f1: 0.6079
 epoch: 65, train_loss: 0.3306, test_loss: 2.1589, test_f1: 0.6133
 epoch: 66, train_loss: 0.3335, test_loss: 2.1193, test_f1: 0.5956
 epoch: 67, train_loss: 0.3480, test_loss: 2.2435, test_f1: 0.5601
 epoch: 68, train_loss: 0.3592, test_loss: 2.3193, test_f1: 0.5832
 epoch: 69, train_loss: 0.3623, test_loss: 2.3319, test_f1: 0.6177
 epoch: 70, train_loss: 0.3302, test_loss: 2.0683, test_f1: 0.5974
 epoch: 71, train_loss: 0.3469, test_loss: 2.2936, test_f1: 0.5906
 epoch: 72, train_loss: 0.3280, test_loss: 2.2285, test_f1: 0.5591
 epoch: 73, train_loss: 0.3364, test_loss: 2.2646, test_f1: 0.5904
 epoch: 74, train_loss: 0.3310, test_loss: 2.2596, test_f1: 0.5920
 epoch: 75, train_loss: 0.2912, test_loss: 2.1510, test_f1: 0.5970
 epoch: 76, train_loss: 0.3071, test_loss: 2.3203, test_f1: 0.5868
 epoch: 77, train_loss: 0.3170, test_loss: 2.4072, test_f1: 0.5773
 epoch: 78, train_loss: 0.3078, test_loss: 2.3749, test_f1: 0.5537
 epoch: 79, train_loss: 0.2946, test_loss: 2.2532, test_f1: 0.6028
 epoch: 80, train_loss: 0.2977, test_loss: 2.7356, test_f1: 0.5844
 epoch: 81, train_loss: 0.2975, test_loss: 2.4777, test_f1: 0.5902
 epoch: 82, train_loss: 0.3152, test_loss: 2.6087, test_f1: 0.5950
 epoch: 83, train_loss: 0.2990, test_loss: 2.6401, test_f1: 0.5863
 epoch: 84, train_loss: 0.2818, test_loss: 2.4728, test_f1: 0.6095
 epoch: 85, train_loss: 0.2935, test_loss: 2.3442, test_f1: 0.5767
 epoch: 86, train_loss: 0.2971, test_loss: 2.3315, test_f1: 0.6011
 epoch: 87, train_loss: 0.3023, test_loss: 2.5425, test_f1: 0.5534
 epoch: 88, train_loss: 0.2993, test_loss: 2.3367, test_f1: 0.5874
 epoch: 89, train_loss: 0.2817, test_loss: 2.3011, test_f1: 0.5813
 epoch: 90, train_loss: 0.2739, test_loss: 2.5965, test_f1: 0.5860
 epoch: 91, train_loss: 0.2860, test_loss: 2.6792, test_f1: 0.6011
 epoch: 92, train_loss: 0.2570, test_loss: 2.6796, test_f1: 0.5976
 epoch: 93, train_loss: 0.2533, test_loss: 2.5527, test_f1: 0.6038
 epoch: 94, train_loss: 0.2815, test_loss: 2.8593, test_f1: 0.5745
 epoch: 95, train_loss: 0.2807, test_loss: 2.5812, test_f1: 0.6108
 epoch: 96, train_loss: 0.3155, test_loss: 2.6935, test_f1: 0.6045
 epoch: 97, train_loss: 0.2865, test_loss: 2.6416, test_f1: 0.5979
 epoch: 98, train_loss: 0.2760, test_loss: 2.7486, test_f1: 0.5970
 epoch: 99, train_loss: 0.2655, test_loss: 2.7351, test_f1: 0.5869
##################ITERATION #2 ****************************************
 epoch: 0, train_loss: 1.2978, test_loss: 1.3519, test_f1: 0.3433
 epoch: 1, train_loss: 1.1422, test_loss: 1.2798, test_f1: 0.4092
 epoch: 2, train_loss: 1.1043, test_loss: 1.2101, test_f1: 0.4546
 epoch: 3, train_loss: 1.0669, test_loss: 1.1657, test_f1: 0.4780
 epoch: 4, train_loss: 1.0182, test_loss: 1.1148, test_f1: 0.4984
 epoch: 5, train_loss: 0.9846, test_loss: 1.1005, test_f1: 0.5375
 epoch: 6, train_loss: 0.9553, test_loss: 1.1052, test_f1: 0.5294
 epoch: 7, train_loss: 0.9372, test_loss: 1.0594, test_f1: 0.5569
 epoch: 8, train_loss: 0.9140, test_loss: 1.0847, test_f1: 0.5635
 epoch: 9, train_loss: 0.8987, test_loss: 1.1081, test_f1: 0.5193
 epoch: 10, train_loss: 0.8708, test_loss: 1.0677, test_f1: 0.5723
 epoch: 11, train_loss: 0.8614, test_loss: 1.0918, test_f1: 0.5442
 epoch: 12, train_loss: 0.8382, test_loss: 1.0608, test_f1: 0.5786
 epoch: 13, train_loss: 0.8285, test_loss: 0.9942, test_f1: 0.5980
 epoch: 14, train_loss: 0.7935, test_loss: 1.0758, test_f1: 0.5909
 epoch: 15, train_loss: 0.7954, test_loss: 1.1184, test_f1: 0.5702
 epoch: 16, train_loss: 0.7840, test_loss: 1.2510, test_f1: 0.5543
 epoch: 17, train_loss: 0.7726, test_loss: 1.3037, test_f1: 0.5122
 epoch: 18, train_loss: 0.7483, test_loss: 1.1171, test_f1: 0.5839
 epoch: 19, train_loss: 0.7398, test_loss: 1.0658, test_f1: 0.6604
 epoch: 20, train_loss: 0.7324, test_loss: 1.1108, test_f1: 0.6112
 epoch: 21, train_loss: 0.7306, test_loss: 1.3714, test_f1: 0.5267
 epoch: 22, train_loss: 0.7246, test_loss: 1.2984, test_f1: 0.5332
 epoch: 23, train_loss: 0.7120, test_loss: 1.1873, test_f1: 0.6467
 epoch: 24, train_loss: 0.7020, test_loss: 1.3673, test_f1: 0.5355
 epoch: 25, train_loss: 0.7089, test_loss: 1.2551, test_f1: 0.5906
 epoch: 26, train_loss: 0.6902, test_loss: 1.4839, test_f1: 0.5957
 epoch: 27, train_loss: 0.6774, test_loss: 1.4606, test_f1: 0.5279
 epoch: 28, train_loss: 0.6860, test_loss: 1.3242, test_f1: 0.5532
 epoch: 29, train_loss: 0.6597, test_loss: 1.3591, test_f1: 0.5365
 epoch: 30, train_loss: 0.6451, test_loss: 1.2734, test_f1: 0.5784
 epoch: 31, train_loss: 0.6284, test_loss: 1.3462, test_f1: 0.5789
 epoch: 32, train_loss: 0.6621, test_loss: 1.4432, test_f1: 0.5497
 epoch: 33, train_loss: 0.6508, test_loss: 1.6110, test_f1: 0.5334
 epoch: 34, train_loss: 0.6276, test_loss: 1.3216, test_f1: 0.5810
 epoch: 35, train_loss: 0.6139, test_loss: 1.3500, test_f1: 0.5997
 epoch: 36, train_loss: 0.5888, test_loss: 1.6242, test_f1: 0.5147
 epoch: 37, train_loss: 0.5952, test_loss: 1.5063, test_f1: 0.5525
 epoch: 38, train_loss: 0.5888, test_loss: 1.2815, test_f1: 0.6188
 epoch: 39, train_loss: 0.5646, test_loss: 1.3964, test_f1: 0.6078
 epoch: 40, train_loss: 0.5622, test_loss: 1.6686, test_f1: 0.5765
 epoch: 41, train_loss: 0.5827, test_loss: 1.4393, test_f1: 0.6252
 epoch: 42, train_loss: 0.5481, test_loss: 1.6843, test_f1: 0.5652
 epoch: 43, train_loss: 0.5581, test_loss: 1.6185, test_f1: 0.6134
 epoch: 44, train_loss: 0.5260, test_loss: 1.5053, test_f1: 0.5967
 epoch: 45, train_loss: 0.5327, test_loss: 1.6658, test_f1: 0.5538
 epoch: 46, train_loss: 0.5202, test_loss: 1.5405, test_f1: 0.5817
 epoch: 47, train_loss: 0.5191, test_loss: 1.7236, test_f1: 0.5269
 epoch: 48, train_loss: 0.4960, test_loss: 1.6771, test_f1: 0.5240
 epoch: 49, train_loss: 0.4779, test_loss: 1.8228, test_f1: 0.5642
 epoch: 50, train_loss: 0.4913, test_loss: 1.8260, test_f1: 0.5795
 epoch: 51, train_loss: 0.4760, test_loss: 1.7002, test_f1: 0.5685
 epoch: 52, train_loss: 0.4245, test_loss: 1.6988, test_f1: 0.5710
 epoch: 53, train_loss: 0.4232, test_loss: 1.6899, test_f1: 0.5430
 epoch: 54, train_loss: 0.4151, test_loss: 1.7132, test_f1: 0.5558
 epoch: 55, train_loss: 0.4308, test_loss: 1.7801, test_f1: 0.5243
 epoch: 56, train_loss: 0.4489, test_loss: 1.7751, test_f1: 0.5768
 epoch: 57, train_loss: 0.4207, test_loss: 1.7754, test_f1: 0.5676
 epoch: 58, train_loss: 0.3981, test_loss: 1.8124, test_f1: 0.5297
 epoch: 59, train_loss: 0.4160, test_loss: 1.8263, test_f1: 0.5826
 epoch: 60, train_loss: 0.4083, test_loss: 1.9043, test_f1: 0.5893
 epoch: 61, train_loss: 0.4282, test_loss: 1.8008, test_f1: 0.5661
 epoch: 62, train_loss: 0.4137, test_loss: 1.8269, test_f1: 0.5797
 epoch: 63, train_loss: 0.3756, test_loss: 1.9405, test_f1: 0.5251
 epoch: 64, train_loss: 0.3873, test_loss: 1.9074, test_f1: 0.5248
 epoch: 65, train_loss: 0.3727, test_loss: 1.9606, test_f1: 0.5605
 epoch: 66, train_loss: 0.3731, test_loss: 1.8919, test_f1: 0.5761
 epoch: 67, train_loss: 0.3992, test_loss: 2.0054, test_f1: 0.5383
 epoch: 68, train_loss: 0.3650, test_loss: 1.9172, test_f1: 0.5677
 epoch: 69, train_loss: 0.3550, test_loss: 2.1181, test_f1: 0.5080
 epoch: 70, train_loss: 0.3534, test_loss: 1.9554, test_f1: 0.5800
 epoch: 71, train_loss: 0.3542, test_loss: 1.9902, test_f1: 0.5540
 epoch: 72, train_loss: 0.3496, test_loss: 2.1843, test_f1: 0.5169
 epoch: 73, train_loss: 0.3475, test_loss: 2.0960, test_f1: 0.5187
 epoch: 74, train_loss: 0.3722, test_loss: 2.1424, test_f1: 0.5332
 epoch: 75, train_loss: 0.3550, test_loss: 2.0531, test_f1: 0.5506
 epoch: 76, train_loss: 0.3360, test_loss: 2.0652, test_f1: 0.5640
 epoch: 77, train_loss: 0.3420, test_loss: 2.1828, test_f1: 0.5769
 epoch: 78, train_loss: 0.3465, test_loss: 2.1238, test_f1: 0.5301
 epoch: 79, train_loss: 0.3154, test_loss: 2.1613, test_f1: 0.5766
 epoch: 80, train_loss: 0.3251, test_loss: 1.9700, test_f1: 0.5619
 epoch: 81, train_loss: 0.3184, test_loss: 2.0980, test_f1: 0.5602
 epoch: 82, train_loss: 0.3249, test_loss: 2.2603, test_f1: 0.5511
 epoch: 83, train_loss: 0.3459, test_loss: 2.1957, test_f1: 0.5509
 epoch: 84, train_loss: 0.3354, test_loss: 2.2290, test_f1: 0.5330
 epoch: 85, train_loss: 0.3148, test_loss: 2.3661, test_f1: 0.5778
 epoch: 86, train_loss: 0.3391, test_loss: 2.1529, test_f1: 0.5766
 epoch: 87, train_loss: 0.3292, test_loss: 2.5425, test_f1: 0.5051
 epoch: 88, train_loss: 0.3354, test_loss: 2.1824, test_f1: 0.5670
 epoch: 89, train_loss: 0.3779, test_loss: 2.5191, test_f1: 0.5506
 epoch: 90, train_loss: 0.3458, test_loss: 2.5843, test_f1: 0.5643
 epoch: 91, train_loss: 0.3349, test_loss: 2.6446, test_f1: 0.5520
 epoch: 92, train_loss: 0.3209, test_loss: 2.3715, test_f1: 0.5646
 epoch: 93, train_loss: 0.3036, test_loss: 2.3572, test_f1: 0.5248
 epoch: 94, train_loss: 0.3248, test_loss: 2.3741, test_f1: 0.5443
 epoch: 95, train_loss: 0.3050, test_loss: 2.4039, test_f1: 0.5583
 epoch: 96, train_loss: 0.3249, test_loss: 2.3637, test_f1: 0.5427
 epoch: 97, train_loss: 0.3156, test_loss: 2.3490, test_f1: 0.5710
 epoch: 98, train_loss: 0.3283, test_loss: 2.1287, test_f1: 0.5630
 epoch: 99, train_loss: 0.3085, test_loss: 2.2095, test_f1: 0.5480
##################ITERATION #3 ****************************************
 epoch: 0, train_loss: 1.3684, test_loss: 1.4085, test_f1: 0.2139
 epoch: 1, train_loss: 1.1450, test_loss: 1.3597, test_f1: 0.2040
 epoch: 2, train_loss: 1.0857, test_loss: 1.2762, test_f1: 0.4349
 epoch: 3, train_loss: 1.0493, test_loss: 1.1963, test_f1: 0.4760
 epoch: 4, train_loss: 1.0354, test_loss: 1.1536, test_f1: 0.5131
 epoch: 5, train_loss: 0.9915, test_loss: 1.1728, test_f1: 0.5226
 epoch: 6, train_loss: 0.9733, test_loss: 1.1943, test_f1: 0.5132
 epoch: 7, train_loss: 0.9483, test_loss: 1.1953, test_f1: 0.5351
 epoch: 8, train_loss: 0.9360, test_loss: 1.1775, test_f1: 0.5529
 epoch: 9, train_loss: 0.9408, test_loss: 1.2293, test_f1: 0.5300
 epoch: 10, train_loss: 0.8961, test_loss: 1.2138, test_f1: 0.5933
 epoch: 11, train_loss: 0.8958, test_loss: 1.1983, test_f1: 0.5633
 epoch: 12, train_loss: 0.8880, test_loss: 1.2085, test_f1: 0.4829
 epoch: 13, train_loss: 0.8753, test_loss: 1.4096, test_f1: 0.5495
 epoch: 14, train_loss: 0.8683, test_loss: 1.2256, test_f1: 0.5576
 epoch: 15, train_loss: 0.8522, test_loss: 1.2789, test_f1: 0.5401
 epoch: 16, train_loss: 0.8416, test_loss: 1.2636, test_f1: 0.5285
 epoch: 17, train_loss: 0.8146, test_loss: 1.3039, test_f1: 0.5241
 epoch: 18, train_loss: 0.8130, test_loss: 1.1878, test_f1: 0.5643
 epoch: 19, train_loss: 0.8107, test_loss: 1.3788, test_f1: 0.4818
 epoch: 20, train_loss: 0.7962, test_loss: 1.2684, test_f1: 0.5382
 epoch: 21, train_loss: 0.7884, test_loss: 1.2490, test_f1: 0.5902
 epoch: 22, train_loss: 0.7787, test_loss: 1.2531, test_f1: 0.5713
 epoch: 23, train_loss: 0.7720, test_loss: 1.3384, test_f1: 0.4875
 epoch: 24, train_loss: 0.7678, test_loss: 1.2164, test_f1: 0.5303
 epoch: 25, train_loss: 0.7305, test_loss: 1.1995, test_f1: 0.6013
 epoch: 26, train_loss: 0.7313, test_loss: 1.2251, test_f1: 0.6291
 epoch: 27, train_loss: 0.7427, test_loss: 1.4019, test_f1: 0.5486
 epoch: 28, train_loss: 0.7160, test_loss: 1.2273, test_f1: 0.5864
 epoch: 29, train_loss: 0.6981, test_loss: 1.3893, test_f1: 0.5327
 epoch: 30, train_loss: 0.7152, test_loss: 1.3144, test_f1: 0.5423
 epoch: 31, train_loss: 0.7157, test_loss: 1.4518, test_f1: 0.5245
 epoch: 32, train_loss: 0.6913, test_loss: 1.2925, test_f1: 0.5282
 epoch: 33, train_loss: 0.6705, test_loss: 1.2849, test_f1: 0.5473
 epoch: 34, train_loss: 0.6632, test_loss: 1.4653, test_f1: 0.5355
 epoch: 35, train_loss: 0.6338, test_loss: 1.4556, test_f1: 0.5099
 epoch: 36, train_loss: 0.6481, test_loss: 1.4211, test_f1: 0.5749
 epoch: 37, train_loss: 0.6643, test_loss: 1.4600, test_f1: 0.5428
 epoch: 38, train_loss: 0.6551, test_loss: 1.8338, test_f1: 0.4005
 epoch: 39, train_loss: 0.6606, test_loss: 1.4547, test_f1: 0.5575
 epoch: 40, train_loss: 0.6494, test_loss: 1.4998, test_f1: 0.4985
 epoch: 41, train_loss: 0.6105, test_loss: 1.3588, test_f1: 0.5320
 epoch: 42, train_loss: 0.6184, test_loss: 1.5556, test_f1: 0.5264
 epoch: 43, train_loss: 0.5970, test_loss: 1.4605, test_f1: 0.5570
 epoch: 44, train_loss: 0.5961, test_loss: 1.6113, test_f1: 0.5701
 epoch: 45, train_loss: 0.5880, test_loss: 1.5008, test_f1: 0.5313
 epoch: 46, train_loss: 0.5900, test_loss: 1.4631, test_f1: 0.5647
 epoch: 47, train_loss: 0.5699, test_loss: 1.9146, test_f1: 0.4921
 epoch: 48, train_loss: 0.5842, test_loss: 1.6002, test_f1: 0.5788
 epoch: 49, train_loss: 0.5665, test_loss: 1.3961, test_f1: 0.5724
 epoch: 50, train_loss: 0.5965, test_loss: 1.6570, test_f1: 0.5488
 epoch: 51, train_loss: 0.5479, test_loss: 1.6210, test_f1: 0.5063
 epoch: 52, train_loss: 0.5185, test_loss: 1.6310, test_f1: 0.5516
 epoch: 53, train_loss: 0.5451, test_loss: 1.4875, test_f1: 0.5609
 epoch: 54, train_loss: 0.5150, test_loss: 1.6971, test_f1: 0.5408
 epoch: 55, train_loss: 0.4877, test_loss: 1.7468, test_f1: 0.5519
 epoch: 56, train_loss: 0.4736, test_loss: 1.7035, test_f1: 0.5840
 epoch: 57, train_loss: 0.4894, test_loss: 1.8983, test_f1: 0.5314
 epoch: 58, train_loss: 0.4766, test_loss: 1.7413, test_f1: 0.5502
 epoch: 59, train_loss: 0.4744, test_loss: 1.5797, test_f1: 0.5659
 epoch: 60, train_loss: 0.4702, test_loss: 1.8632, test_f1: 0.5634
 epoch: 61, train_loss: 0.4667, test_loss: 1.8805, test_f1: 0.5709
 epoch: 62, train_loss: 0.4594, test_loss: 1.7531, test_f1: 0.5434
 epoch: 63, train_loss: 0.4635, test_loss: 1.9650, test_f1: 0.5680
 epoch: 64, train_loss: 0.4310, test_loss: 1.8373, test_f1: 0.5453
 epoch: 65, train_loss: 0.4391, test_loss: 1.8617, test_f1: 0.5548
 epoch: 66, train_loss: 0.4353, test_loss: 1.7964, test_f1: 0.5561
 epoch: 67, train_loss: 0.4181, test_loss: 1.9132, test_f1: 0.5925
 epoch: 68, train_loss: 0.4305, test_loss: 1.9320, test_f1: 0.5363
 epoch: 69, train_loss: 0.4442, test_loss: 1.8641, test_f1: 0.5819
 epoch: 70, train_loss: 0.4550, test_loss: 1.8739, test_f1: 0.5490
 epoch: 71, train_loss: 0.4374, test_loss: 1.9184, test_f1: 0.5489
 epoch: 72, train_loss: 0.4411, test_loss: 1.9001, test_f1: 0.5571
 epoch: 73, train_loss: 0.4170, test_loss: 1.9843, test_f1: 0.5558
 epoch: 74, train_loss: 0.4197, test_loss: 1.8570, test_f1: 0.5528
 epoch: 75, train_loss: 0.4272, test_loss: 1.9791, test_f1: 0.5211
 epoch: 76, train_loss: 0.3986, test_loss: 2.0243, test_f1: 0.5724
 epoch: 77, train_loss: 0.4237, test_loss: 2.0117, test_f1: 0.5661
 epoch: 78, train_loss: 0.4272, test_loss: 1.9811, test_f1: 0.5602
 epoch: 79, train_loss: 0.3967, test_loss: 1.9867, test_f1: 0.5563
 epoch: 80, train_loss: 0.4004, test_loss: 2.0505, test_f1: 0.5529
 epoch: 81, train_loss: 0.4300, test_loss: 2.0005, test_f1: 0.5384
 epoch: 82, train_loss: 0.3867, test_loss: 2.1036, test_f1: 0.5511
 epoch: 83, train_loss: 0.4013, test_loss: 2.2264, test_f1: 0.5177
 epoch: 84, train_loss: 0.3949, test_loss: 2.2497, test_f1: 0.5661
 epoch: 85, train_loss: 0.4266, test_loss: 2.1574, test_f1: 0.5588
 epoch: 86, train_loss: 0.3918, test_loss: 2.2356, test_f1: 0.5148
 epoch: 87, train_loss: 0.3958, test_loss: 2.1400, test_f1: 0.5315
 epoch: 88, train_loss: 0.3789, test_loss: 2.2735, test_f1: 0.5748
 epoch: 89, train_loss: 0.4000, test_loss: 2.2748, test_f1: 0.5012
 epoch: 90, train_loss: 0.3671, test_loss: 2.1896, test_f1: 0.5382
 epoch: 91, train_loss: 0.3938, test_loss: 2.1454, test_f1: 0.5723
 epoch: 92, train_loss: 0.3791, test_loss: 2.3319, test_f1: 0.5104
 epoch: 93, train_loss: 0.3461, test_loss: 2.1706, test_f1: 0.5604
 epoch: 94, train_loss: 0.3579, test_loss: 2.1134, test_f1: 0.5505
 epoch: 95, train_loss: 0.3493, test_loss: 2.1718, test_f1: 0.5722
 epoch: 96, train_loss: 0.3634, test_loss: 2.2088, test_f1: 0.5307
 epoch: 97, train_loss: 0.3467, test_loss: 2.2693, test_f1: 0.5746
 epoch: 98, train_loss: 0.3517, test_loss: 2.1909, test_f1: 0.5288
 epoch: 99, train_loss: 0.3367, test_loss: 2.0432, test_f1: 0.5706
##################ITERATION #4 ****************************************
 epoch: 0, train_loss: 1.2872, test_loss: 1.3418, test_f1: 0.2415
 epoch: 1, train_loss: 1.1377, test_loss: 1.3228, test_f1: 0.3180
 epoch: 2, train_loss: 1.0653, test_loss: 1.2832, test_f1: 0.4629
 epoch: 3, train_loss: 1.0198, test_loss: 1.1749, test_f1: 0.5308
 epoch: 4, train_loss: 0.9587, test_loss: 1.1673, test_f1: 0.5237
 epoch: 5, train_loss: 0.9713, test_loss: 1.2722, test_f1: 0.5337
 epoch: 6, train_loss: 0.9409, test_loss: 1.2215, test_f1: 0.5980
 epoch: 7, train_loss: 0.8940, test_loss: 1.3202, test_f1: 0.5106
 epoch: 8, train_loss: 0.8896, test_loss: 1.2896, test_f1: 0.5788
 epoch: 9, train_loss: 0.8638, test_loss: 1.2520, test_f1: 0.5649
 epoch: 10, train_loss: 0.8533, test_loss: 1.2334, test_f1: 0.5207
 epoch: 11, train_loss: 0.8356, test_loss: 1.4712, test_f1: 0.5570
 epoch: 12, train_loss: 0.8176, test_loss: 1.1203, test_f1: 0.6341
 epoch: 13, train_loss: 0.8046, test_loss: 1.3182, test_f1: 0.5910
 epoch: 14, train_loss: 0.8008, test_loss: 1.2700, test_f1: 0.5499
 epoch: 15, train_loss: 0.7905, test_loss: 1.3199, test_f1: 0.5367
 epoch: 16, train_loss: 0.7476, test_loss: 1.2248, test_f1: 0.5773
 epoch: 17, train_loss: 0.7693, test_loss: 1.3360, test_f1: 0.6070
 epoch: 18, train_loss: 0.7402, test_loss: 1.5785, test_f1: 0.5267
 epoch: 19, train_loss: 0.7051, test_loss: 1.4276, test_f1: 0.5598
 epoch: 20, train_loss: 0.7012, test_loss: 1.2219, test_f1: 0.5876
 epoch: 21, train_loss: 0.7116, test_loss: 1.2720, test_f1: 0.5361
 epoch: 22, train_loss: 0.7066, test_loss: 1.3165, test_f1: 0.5279
 epoch: 23, train_loss: 0.6924, test_loss: 1.3386, test_f1: 0.5415
 epoch: 24, train_loss: 0.6759, test_loss: 1.2714, test_f1: 0.5960
 epoch: 25, train_loss: 0.6389, test_loss: 1.3752, test_f1: 0.5662
 epoch: 26, train_loss: 0.6351, test_loss: 1.3315, test_f1: 0.5828
 epoch: 27, train_loss: 0.6538, test_loss: 1.3149, test_f1: 0.5840
 epoch: 28, train_loss: 0.6481, test_loss: 1.6715, test_f1: 0.5738
 epoch: 29, train_loss: 0.6311, test_loss: 1.5902, test_f1: 0.5782
 epoch: 30, train_loss: 0.6192, test_loss: 1.3763, test_f1: 0.5661
 epoch: 31, train_loss: 0.6198, test_loss: 1.4771, test_f1: 0.5734
 epoch: 32, train_loss: 0.6168, test_loss: 1.4161, test_f1: 0.5723
 epoch: 33, train_loss: 0.5775, test_loss: 1.4852, test_f1: 0.5847
 epoch: 34, train_loss: 0.5957, test_loss: 1.7007, test_f1: 0.5377
 epoch: 35, train_loss: 0.5642, test_loss: 1.5105, test_f1: 0.6134
 epoch: 36, train_loss: 0.5627, test_loss: 1.4950, test_f1: 0.5721
 epoch: 37, train_loss: 0.5947, test_loss: 1.8602, test_f1: 0.4900
 epoch: 38, train_loss: 0.5622, test_loss: 1.5797, test_f1: 0.5662
 epoch: 39, train_loss: 0.5608, test_loss: 1.6787, test_f1: 0.5747
 epoch: 40, train_loss: 0.5363, test_loss: 1.6207, test_f1: 0.5536
 epoch: 41, train_loss: 0.5466, test_loss: 1.6699, test_f1: 0.5600
 epoch: 42, train_loss: 0.5154, test_loss: 1.6842, test_f1: 0.5723
 epoch: 43, train_loss: 0.5305, test_loss: 1.8736, test_f1: 0.5454
 epoch: 44, train_loss: 0.5100, test_loss: 1.7078, test_f1: 0.5702
 epoch: 45, train_loss: 0.5496, test_loss: 2.0310, test_f1: 0.5770
 epoch: 46, train_loss: 0.5243, test_loss: 2.2627, test_f1: 0.5796
 epoch: 47, train_loss: 0.5194, test_loss: 1.9560, test_f1: 0.5566
 epoch: 48, train_loss: 0.4916, test_loss: 1.9057, test_f1: 0.5463
 epoch: 49, train_loss: 0.4785, test_loss: 1.8749, test_f1: 0.6003
 epoch: 50, train_loss: 0.4550, test_loss: 2.1172, test_f1: 0.4979
 epoch: 51, train_loss: 0.4546, test_loss: 1.9388, test_f1: 0.5335
 epoch: 52, train_loss: 0.4167, test_loss: 2.0282, test_f1: 0.5896
 epoch: 53, train_loss: 0.3965, test_loss: 1.8827, test_f1: 0.5886
 epoch: 54, train_loss: 0.4329, test_loss: 1.7803, test_f1: 0.5811
 epoch: 55, train_loss: 0.4364, test_loss: 2.1506, test_f1: 0.5550
 epoch: 56, train_loss: 0.4047, test_loss: 2.0636, test_f1: 0.5788
 epoch: 57, train_loss: 0.4042, test_loss: 2.1562, test_f1: 0.5929
 epoch: 58, train_loss: 0.3862, test_loss: 2.0850, test_f1: 0.5817
 epoch: 59, train_loss: 0.3848, test_loss: 2.0975, test_f1: 0.5686
 epoch: 60, train_loss: 0.3697, test_loss: 2.1681, test_f1: 0.5913
 epoch: 61, train_loss: 0.3702, test_loss: 2.1583, test_f1: 0.5839
 epoch: 62, train_loss: 0.3802, test_loss: 2.3097, test_f1: 0.5552
 epoch: 63, train_loss: 0.3895, test_loss: 2.0431, test_f1: 0.5815
 epoch: 64, train_loss: 0.3746, test_loss: 2.0180, test_f1: 0.5666
 epoch: 65, train_loss: 0.4037, test_loss: 2.0156, test_f1: 0.6010
 epoch: 66, train_loss: 0.3647, test_loss: 1.9592, test_f1: 0.5930
 epoch: 67, train_loss: 0.3806, test_loss: 2.2921, test_f1: 0.5608
 epoch: 68, train_loss: 0.3660, test_loss: 2.3867, test_f1: 0.5401
 epoch: 69, train_loss: 0.3385, test_loss: 2.1979, test_f1: 0.5859
 epoch: 70, train_loss: 0.3514, test_loss: 2.1208, test_f1: 0.5595
 epoch: 71, train_loss: 0.3442, test_loss: 2.3022, test_f1: 0.5975
 epoch: 72, train_loss: 0.3633, test_loss: 2.1041, test_f1: 0.5812
 epoch: 73, train_loss: 0.3621, test_loss: 2.3031, test_f1: 0.5866
 epoch: 74, train_loss: 0.3413, test_loss: 2.2189, test_f1: 0.5775
 epoch: 75, train_loss: 0.3234, test_loss: 2.1788, test_f1: 0.5914
 epoch: 76, train_loss: 0.3292, test_loss: 2.1970, test_f1: 0.5941
 epoch: 77, train_loss: 0.3179, test_loss: 2.2455, test_f1: 0.5965
 epoch: 78, train_loss: 0.3489, test_loss: 2.5079, test_f1: 0.5296
 epoch: 79, train_loss: 0.3672, test_loss: 2.4825, test_f1: 0.5247
 epoch: 80, train_loss: 0.3746, test_loss: 2.4557, test_f1: 0.5421
 epoch: 81, train_loss: 0.3424, test_loss: 2.5370, test_f1: 0.5729
 epoch: 82, train_loss: 0.3468, test_loss: 2.3973, test_f1: 0.5839
 epoch: 83, train_loss: 0.3301, test_loss: 2.3886, test_f1: 0.5817
 epoch: 84, train_loss: 0.3522, test_loss: 2.4841, test_f1: 0.5294
 epoch: 85, train_loss: 0.3433, test_loss: 2.3551, test_f1: 0.5898
 epoch: 86, train_loss: 0.3454, test_loss: 2.4919, test_f1: 0.5624
 epoch: 87, train_loss: 0.3600, test_loss: 2.1743, test_f1: 0.5638
 epoch: 88, train_loss: 0.3608, test_loss: 2.6766, test_f1: 0.5532
 epoch: 89, train_loss: 0.3756, test_loss: 2.1640, test_f1: 0.5622
 epoch: 90, train_loss: 0.3411, test_loss: 2.2398, test_f1: 0.6139
 epoch: 91, train_loss: 0.3299, test_loss: 2.3439, test_f1: 0.5629
 epoch: 92, train_loss: 0.3275, test_loss: 2.3817, test_f1: 0.5761
 epoch: 93, train_loss: 0.3474, test_loss: 2.6428, test_f1: 0.5369
 epoch: 94, train_loss: 0.3396, test_loss: 2.2723, test_f1: 0.5921
 epoch: 95, train_loss: 0.3045, test_loss: 2.3230, test_f1: 0.5590
 epoch: 96, train_loss: 0.2994, test_loss: 2.3776, test_f1: 0.5818
 epoch: 97, train_loss: 0.3319, test_loss: 2.6326, test_f1: 0.5685
 epoch: 98, train_loss: 0.3071, test_loss: 2.5877, test_f1: 0.5788
 epoch: 99, train_loss: 0.3287, test_loss: 2.5992, test_f1: 0.5667
##################ITERATION #5 ****************************************
 epoch: 0, train_loss: 1.4277, test_loss: 1.4144, test_f1: 0.1873
 epoch: 1, train_loss: 1.1879, test_loss: 1.2824, test_f1: 0.2277
 epoch: 2, train_loss: 1.1309, test_loss: 1.2224, test_f1: 0.3629
 epoch: 3, train_loss: 1.0950, test_loss: 1.1675, test_f1: 0.4834
 epoch: 4, train_loss: 1.0479, test_loss: 1.1650, test_f1: 0.4743
 epoch: 5, train_loss: 1.0100, test_loss: 1.1661, test_f1: 0.5213
 epoch: 6, train_loss: 0.9909, test_loss: 1.1747, test_f1: 0.4870
 epoch: 7, train_loss: 0.9755, test_loss: 1.1276, test_f1: 0.5367
 epoch: 8, train_loss: 0.9565, test_loss: 1.1665, test_f1: 0.5061
 epoch: 9, train_loss: 0.9498, test_loss: 1.1937, test_f1: 0.5478
 epoch: 10, train_loss: 0.9215, test_loss: 1.1722, test_f1: 0.5519
 epoch: 11, train_loss: 0.9145, test_loss: 1.2176, test_f1: 0.4860
 epoch: 12, train_loss: 0.8876, test_loss: 1.1915, test_f1: 0.5375
 epoch: 13, train_loss: 0.8768, test_loss: 1.2077, test_f1: 0.5270
 epoch: 14, train_loss: 0.8540, test_loss: 1.1283, test_f1: 0.5671
 epoch: 15, train_loss: 0.8647, test_loss: 1.1459, test_f1: 0.5542
 epoch: 16, train_loss: 0.8302, test_loss: 1.1640, test_f1: 0.5565
 epoch: 17, train_loss: 0.8129, test_loss: 1.1861, test_f1: 0.5568
 epoch: 18, train_loss: 0.8277, test_loss: 1.5747, test_f1: 0.4485
 epoch: 19, train_loss: 0.8306, test_loss: 1.1962, test_f1: 0.5830
 epoch: 20, train_loss: 0.8274, test_loss: 1.3199, test_f1: 0.5936
 epoch: 21, train_loss: 0.8170, test_loss: 1.3291, test_f1: 0.5630
 epoch: 22, train_loss: 0.8053, test_loss: 1.2149, test_f1: 0.5774
 epoch: 23, train_loss: 0.7638, test_loss: 1.3285, test_f1: 0.5565
 epoch: 24, train_loss: 0.7560, test_loss: 1.3162, test_f1: 0.5812
 epoch: 25, train_loss: 0.7532, test_loss: 1.2175, test_f1: 0.6029
 epoch: 26, train_loss: 0.7597, test_loss: 1.3607, test_f1: 0.5389
 epoch: 27, train_loss: 0.7334, test_loss: 1.3414, test_f1: 0.5809
 epoch: 28, train_loss: 0.7157, test_loss: 1.2085, test_f1: 0.6055
 epoch: 29, train_loss: 0.7122, test_loss: 1.3223, test_f1: 0.5856
 epoch: 30, train_loss: 0.6964, test_loss: 1.3538, test_f1: 0.5721
 epoch: 31, train_loss: 0.7016, test_loss: 1.4284, test_f1: 0.5946
 epoch: 32, train_loss: 0.6685, test_loss: 1.2197, test_f1: 0.6112
 epoch: 33, train_loss: 0.6705, test_loss: 1.3571, test_f1: 0.6153
 epoch: 34, train_loss: 0.6488, test_loss: 1.2536, test_f1: 0.6291
 epoch: 35, train_loss: 0.6476, test_loss: 1.3078, test_f1: 0.5876
 epoch: 36, train_loss: 0.6383, test_loss: 1.4101, test_f1: 0.6010
 epoch: 37, train_loss: 0.6396, test_loss: 1.3517, test_f1: 0.6237
 epoch: 38, train_loss: 0.6295, test_loss: 1.3593, test_f1: 0.5645
 epoch: 39, train_loss: 0.6109, test_loss: 1.3689, test_f1: 0.6130
 epoch: 40, train_loss: 0.6339, test_loss: 1.3929, test_f1: 0.6263
 epoch: 41, train_loss: 0.6509, test_loss: 1.5095, test_f1: 0.5610
 epoch: 42, train_loss: 0.6114, test_loss: 1.3806, test_f1: 0.5790
 epoch: 43, train_loss: 0.6055, test_loss: 1.5424, test_f1: 0.5469
 epoch: 44, train_loss: 0.6142, test_loss: 1.4811, test_f1: 0.5713
 epoch: 45, train_loss: 0.5797, test_loss: 1.4045, test_f1: 0.5902
 epoch: 46, train_loss: 0.5576, test_loss: 1.3486, test_f1: 0.5799
 epoch: 47, train_loss: 0.5590, test_loss: 1.5149, test_f1: 0.5692
 epoch: 48, train_loss: 0.5464, test_loss: 1.8066, test_f1: 0.5497
 epoch: 49, train_loss: 0.5495, test_loss: 1.5638, test_f1: 0.6061
 epoch: 50, train_loss: 0.5409, test_loss: 1.5989, test_f1: 0.6129
 epoch: 51, train_loss: 0.5000, test_loss: 1.6045, test_f1: 0.5953
 epoch: 52, train_loss: 0.5050, test_loss: 1.6757, test_f1: 0.6048
 epoch: 53, train_loss: 0.4991, test_loss: 1.7205, test_f1: 0.5874
 epoch: 54, train_loss: 0.4743, test_loss: 1.7028, test_f1: 0.5917
 epoch: 55, train_loss: 0.4948, test_loss: 1.7113, test_f1: 0.6096
 epoch: 56, train_loss: 0.4739, test_loss: 1.7401, test_f1: 0.6071
 epoch: 57, train_loss: 0.4904, test_loss: 1.6613, test_f1: 0.5963
 epoch: 58, train_loss: 0.4605, test_loss: 1.6809, test_f1: 0.6177
 epoch: 59, train_loss: 0.4846, test_loss: 1.8079, test_f1: 0.5988
 epoch: 60, train_loss: 0.4564, test_loss: 1.8482, test_f1: 0.5760
 epoch: 61, train_loss: 0.4524, test_loss: 1.8596, test_f1: 0.5833
 epoch: 62, train_loss: 0.4533, test_loss: 1.8600, test_f1: 0.6019
 epoch: 63, train_loss: 0.4696, test_loss: 1.7892, test_f1: 0.5878
 epoch: 64, train_loss: 0.4597, test_loss: 1.8381, test_f1: 0.5913
 epoch: 65, train_loss: 0.4488, test_loss: 1.8540, test_f1: 0.5748
 epoch: 66, train_loss: 0.4285, test_loss: 1.8937, test_f1: 0.5936
 epoch: 67, train_loss: 0.4105, test_loss: 1.7729, test_f1: 0.6206
 epoch: 68, train_loss: 0.4106, test_loss: 1.8927, test_f1: 0.6168
 epoch: 69, train_loss: 0.4280, test_loss: 1.9966, test_f1: 0.5835
 epoch: 70, train_loss: 0.3908, test_loss: 2.0113, test_f1: 0.5918
 epoch: 71, train_loss: 0.4126, test_loss: 2.0584, test_f1: 0.5944
 epoch: 72, train_loss: 0.4186, test_loss: 2.0493, test_f1: 0.5751
 epoch: 73, train_loss: 0.3996, test_loss: 2.0363, test_f1: 0.5901
 epoch: 74, train_loss: 0.4075, test_loss: 1.9542, test_f1: 0.5879
 epoch: 75, train_loss: 0.3919, test_loss: 2.0431, test_f1: 0.6014
 epoch: 76, train_loss: 0.4134, test_loss: 2.0230, test_f1: 0.6017
 epoch: 77, train_loss: 0.3974, test_loss: 1.9691, test_f1: 0.6122
 epoch: 78, train_loss: 0.3899, test_loss: 2.0000, test_f1: 0.6080
 epoch: 79, train_loss: 0.3886, test_loss: 2.0950, test_f1: 0.5877
 epoch: 80, train_loss: 0.3982, test_loss: 1.9998, test_f1: 0.6186
 epoch: 81, train_loss: 0.3923, test_loss: 2.1014, test_f1: 0.6257
 epoch: 82, train_loss: 0.4011, test_loss: 1.9657, test_f1: 0.5979
 epoch: 83, train_loss: 0.3704, test_loss: 2.0504, test_f1: 0.5979
 epoch: 84, train_loss: 0.3798, test_loss: 2.0821, test_f1: 0.5980
 epoch: 85, train_loss: 0.3969, test_loss: 2.1345, test_f1: 0.6089
 epoch: 86, train_loss: 0.3752, test_loss: 2.0451, test_f1: 0.6046
 epoch: 87, train_loss: 0.3801, test_loss: 2.0672, test_f1: 0.5803
 epoch: 88, train_loss: 0.3832, test_loss: 2.0289, test_f1: 0.5937
 epoch: 89, train_loss: 0.3799, test_loss: 2.0751, test_f1: 0.5869
 epoch: 90, train_loss: 0.3444, test_loss: 1.9567, test_f1: 0.6111
 epoch: 91, train_loss: 0.3718, test_loss: 2.0890, test_f1: 0.6129
 epoch: 92, train_loss: 0.3453, test_loss: 2.2107, test_f1: 0.5970
 epoch: 93, train_loss: 0.3435, test_loss: 2.1911, test_f1: 0.5968
 epoch: 94, train_loss: 0.3406, test_loss: 2.0630, test_f1: 0.6062
 epoch: 95, train_loss: 0.3393, test_loss: 2.0588, test_f1: 0.6122
 epoch: 96, train_loss: 0.3533, test_loss: 2.1552, test_f1: 0.6268
 epoch: 97, train_loss: 0.3502, test_loss: 2.1861, test_f1: 0.5938
 epoch: 98, train_loss: 0.3689, test_loss: 2.2656, test_f1: 0.6100
 epoch: 99, train_loss: 0.3555, test_loss: 2.1713, test_f1: 0.5914
##################ITERATION #6 ****************************************
 epoch: 0, train_loss: 1.3969, test_loss: 1.5653, test_f1: 0.1527
 epoch: 1, train_loss: 1.1800, test_loss: 1.4614, test_f1: 0.3034
 epoch: 2, train_loss: 1.1095, test_loss: 1.3769, test_f1: 0.3676
 epoch: 3, train_loss: 1.0463, test_loss: 1.2746, test_f1: 0.4713
 epoch: 4, train_loss: 1.0057, test_loss: 1.2789, test_f1: 0.4988
 epoch: 5, train_loss: 0.9944, test_loss: 1.1909, test_f1: 0.5401
 epoch: 6, train_loss: 0.9858, test_loss: 1.1820, test_f1: 0.5336
 epoch: 7, train_loss: 0.9404, test_loss: 1.1533, test_f1: 0.5516
 epoch: 8, train_loss: 0.8999, test_loss: 1.1825, test_f1: 0.5086
 epoch: 9, train_loss: 0.8959, test_loss: 1.1687, test_f1: 0.4798
 epoch: 10, train_loss: 0.8625, test_loss: 1.2890, test_f1: 0.4947
 epoch: 11, train_loss: 0.8703, test_loss: 1.1049, test_f1: 0.6243
 epoch: 12, train_loss: 0.8627, test_loss: 1.0901, test_f1: 0.6013
 epoch: 13, train_loss: 0.8314, test_loss: 1.1159, test_f1: 0.5850
 epoch: 14, train_loss: 0.8156, test_loss: 1.1834, test_f1: 0.5651
 epoch: 15, train_loss: 0.7827, test_loss: 1.1591, test_f1: 0.6138
 epoch: 16, train_loss: 0.7501, test_loss: 1.1232, test_f1: 0.6211
 epoch: 17, train_loss: 0.7618, test_loss: 1.3051, test_f1: 0.5412
 epoch: 18, train_loss: 0.7825, test_loss: 1.1538, test_f1: 0.5939
 epoch: 19, train_loss: 0.7431, test_loss: 1.1125, test_f1: 0.6295
 epoch: 20, train_loss: 0.7331, test_loss: 1.3352, test_f1: 0.5384
 epoch: 21, train_loss: 0.7526, test_loss: 1.1474, test_f1: 0.6056
 epoch: 22, train_loss: 0.7333, test_loss: 1.1340, test_f1: 0.5811
 epoch: 23, train_loss: 0.7223, test_loss: 1.2083, test_f1: 0.5260
 epoch: 24, train_loss: 0.6918, test_loss: 1.1605, test_f1: 0.5901
 epoch: 25, train_loss: 0.6857, test_loss: 1.1836, test_f1: 0.5976
 epoch: 26, train_loss: 0.6823, test_loss: 1.2374, test_f1: 0.6454
 epoch: 27, train_loss: 0.6639, test_loss: 1.1346, test_f1: 0.6418
 epoch: 28, train_loss: 0.6487, test_loss: 1.2382, test_f1: 0.5688
 epoch: 29, train_loss: 0.6693, test_loss: 1.2882, test_f1: 0.5772
 epoch: 30, train_loss: 0.6394, test_loss: 1.4038, test_f1: 0.5623
 epoch: 31, train_loss: 0.6479, test_loss: 1.3212, test_f1: 0.5633
 epoch: 32, train_loss: 0.6160, test_loss: 1.1916, test_f1: 0.5996
 epoch: 33, train_loss: 0.6058, test_loss: 1.4841, test_f1: 0.5486
 epoch: 34, train_loss: 0.5976, test_loss: 1.3081, test_f1: 0.5859
 epoch: 35, train_loss: 0.6298, test_loss: 1.4360, test_f1: 0.5716
 epoch: 36, train_loss: 0.6525, test_loss: 1.4407, test_f1: 0.5729
 epoch: 37, train_loss: 0.5932, test_loss: 1.4259, test_f1: 0.6038
 epoch: 38, train_loss: 0.5428, test_loss: 1.3275, test_f1: 0.6024
 epoch: 39, train_loss: 0.5496, test_loss: 1.7029, test_f1: 0.5538
 epoch: 40, train_loss: 0.5621, test_loss: 1.4878, test_f1: 0.5310
 epoch: 41, train_loss: 0.5331, test_loss: 1.6717, test_f1: 0.5727
 epoch: 42, train_loss: 0.5437, test_loss: 1.4123, test_f1: 0.5928
 epoch: 43, train_loss: 0.5461, test_loss: 1.4668, test_f1: 0.6069
 epoch: 44, train_loss: 0.5243, test_loss: 1.4719, test_f1: 0.5754
 epoch: 45, train_loss: 0.5279, test_loss: 1.5156, test_f1: 0.5423
 epoch: 46, train_loss: 0.5089, test_loss: 1.8432, test_f1: 0.5633
 epoch: 47, train_loss: 0.5080, test_loss: 1.4337, test_f1: 0.6272
 epoch: 48, train_loss: 0.4981, test_loss: 1.4682, test_f1: 0.5562
 epoch: 49, train_loss: 0.5356, test_loss: 1.4342, test_f1: 0.5977
 epoch: 50, train_loss: 0.4919, test_loss: 1.6526, test_f1: 0.5456
 epoch: 51, train_loss: 0.4678, test_loss: 1.4765, test_f1: 0.6244
 epoch: 52, train_loss: 0.4496, test_loss: 1.5078, test_f1: 0.5870
 epoch: 53, train_loss: 0.4237, test_loss: 1.4047, test_f1: 0.6127
 epoch: 54, train_loss: 0.4280, test_loss: 1.6392, test_f1: 0.5670
 epoch: 55, train_loss: 0.4169, test_loss: 1.4950, test_f1: 0.5859
 epoch: 56, train_loss: 0.4047, test_loss: 1.6267, test_f1: 0.5777
 epoch: 57, train_loss: 0.4162, test_loss: 1.6073, test_f1: 0.5776
 epoch: 58, train_loss: 0.3922, test_loss: 1.5365, test_f1: 0.6081
 epoch: 59, train_loss: 0.3928, test_loss: 1.6884, test_f1: 0.5527
 epoch: 60, train_loss: 0.4099, test_loss: 1.7224, test_f1: 0.5753
 epoch: 61, train_loss: 0.3920, test_loss: 1.7184, test_f1: 0.5512
 epoch: 62, train_loss: 0.3983, test_loss: 1.7827, test_f1: 0.5570
 epoch: 63, train_loss: 0.3934, test_loss: 1.6055, test_f1: 0.6105
 epoch: 64, train_loss: 0.3670, test_loss: 1.8114, test_f1: 0.5586
 epoch: 65, train_loss: 0.3585, test_loss: 1.7286, test_f1: 0.6058
 epoch: 66, train_loss: 0.3730, test_loss: 1.8968, test_f1: 0.5488
 epoch: 67, train_loss: 0.3460, test_loss: 1.9825, test_f1: 0.5509
 epoch: 68, train_loss: 0.3766, test_loss: 1.8267, test_f1: 0.5733
 epoch: 69, train_loss: 0.4206, test_loss: 1.8142, test_f1: 0.6066
 epoch: 70, train_loss: 0.4247, test_loss: 2.1765, test_f1: 0.5456
 epoch: 71, train_loss: 0.3658, test_loss: 1.8673, test_f1: 0.5703
 epoch: 72, train_loss: 0.3612, test_loss: 1.8825, test_f1: 0.5707
 epoch: 73, train_loss: 0.3616, test_loss: 1.8840, test_f1: 0.5743
 epoch: 74, train_loss: 0.3512, test_loss: 1.8985, test_f1: 0.5861
 epoch: 75, train_loss: 0.3747, test_loss: 1.8858, test_f1: 0.5823
 epoch: 76, train_loss: 0.3460, test_loss: 1.8882, test_f1: 0.5588
 epoch: 77, train_loss: 0.3453, test_loss: 1.8844, test_f1: 0.5521
 epoch: 78, train_loss: 0.3128, test_loss: 1.8570, test_f1: 0.5907
 epoch: 79, train_loss: 0.3360, test_loss: 2.0532, test_f1: 0.5512
 epoch: 80, train_loss: 0.3192, test_loss: 1.9669, test_f1: 0.5812
 epoch: 81, train_loss: 0.3154, test_loss: 2.0574, test_f1: 0.5679
 epoch: 82, train_loss: 0.3003, test_loss: 1.9569, test_f1: 0.5817
 epoch: 83, train_loss: 0.3559, test_loss: 1.9561, test_f1: 0.5578
 epoch: 84, train_loss: 0.3416, test_loss: 2.1431, test_f1: 0.5676
 epoch: 85, train_loss: 0.3419, test_loss: 2.0646, test_f1: 0.5821
 epoch: 86, train_loss: 0.3129, test_loss: 2.0079, test_f1: 0.5706
 epoch: 87, train_loss: 0.3276, test_loss: 2.2122, test_f1: 0.5541
 epoch: 88, train_loss: 0.3464, test_loss: 2.0314, test_f1: 0.5846
 epoch: 89, train_loss: 0.2839, test_loss: 2.0892, test_f1: 0.5864
 epoch: 90, train_loss: 0.3046, test_loss: 2.1776, test_f1: 0.5816
 epoch: 91, train_loss: 0.2959, test_loss: 2.2960, test_f1: 0.5820
 epoch: 92, train_loss: 0.3002, test_loss: 2.0455, test_f1: 0.5999
 epoch: 93, train_loss: 0.3245, test_loss: 2.1347, test_f1: 0.5848
 epoch: 94, train_loss: 0.3223, test_loss: 1.9872, test_f1: 0.6022
 epoch: 95, train_loss: 0.2947, test_loss: 2.1822, test_f1: 0.5810
 epoch: 96, train_loss: 0.3016, test_loss: 2.2343, test_f1: 0.5549
 epoch: 97, train_loss: 0.2970, test_loss: 2.1242, test_f1: 0.5540
 epoch: 98, train_loss: 0.3075, test_loss: 2.1564, test_f1: 0.5836
 epoch: 99, train_loss: 0.2860, test_loss: 2.0721, test_f1: 0.6031
##################ITERATION #7 ****************************************
 epoch: 0, train_loss: 1.4719, test_loss: 1.3559, test_f1: 0.2908
 epoch: 1, train_loss: 1.1930, test_loss: 1.3335, test_f1: 0.3648
 epoch: 2, train_loss: 1.0895, test_loss: 1.2310, test_f1: 0.4653
 epoch: 3, train_loss: 1.0331, test_loss: 1.1522, test_f1: 0.4986
 epoch: 4, train_loss: 1.0226, test_loss: 1.1358, test_f1: 0.5363
 epoch: 5, train_loss: 0.9767, test_loss: 1.6190, test_f1: 0.5323
 epoch: 6, train_loss: 0.9612, test_loss: 1.8634, test_f1: 0.5420
 epoch: 7, train_loss: 0.9336, test_loss: 1.7659, test_f1: 0.5555
 epoch: 8, train_loss: 0.9216, test_loss: 1.6453, test_f1: 0.5425
 epoch: 9, train_loss: 0.8878, test_loss: 1.3150, test_f1: 0.5939
 epoch: 10, train_loss: 0.8711, test_loss: 1.3990, test_f1: 0.5317
 epoch: 11, train_loss: 0.8527, test_loss: 1.3725, test_f1: 0.6078
 epoch: 12, train_loss: 0.8605, test_loss: 1.5662, test_f1: 0.5952
 epoch: 13, train_loss: 0.8414, test_loss: 1.3811, test_f1: 0.5829
 epoch: 14, train_loss: 0.8149, test_loss: 1.7917, test_f1: 0.5765
 epoch: 15, train_loss: 0.8160, test_loss: 1.6564, test_f1: 0.5744
 epoch: 16, train_loss: 0.8080, test_loss: 1.8344, test_f1: 0.5859
 epoch: 17, train_loss: 0.7773, test_loss: 1.4241, test_f1: 0.5414
 epoch: 18, train_loss: 0.7679, test_loss: 1.7545, test_f1: 0.5615
 epoch: 19, train_loss: 0.7606, test_loss: 1.5409, test_f1: 0.5471
 epoch: 20, train_loss: 0.7406, test_loss: 1.4225, test_f1: 0.5657
 epoch: 21, train_loss: 0.7434, test_loss: 1.4126, test_f1: 0.6088
 epoch: 22, train_loss: 0.7254, test_loss: 1.2670, test_f1: 0.5635
 epoch: 23, train_loss: 0.7209, test_loss: 1.5925, test_f1: 0.5550
 epoch: 24, train_loss: 0.7143, test_loss: 1.4286, test_f1: 0.5905
 epoch: 25, train_loss: 0.7090, test_loss: 1.3772, test_f1: 0.5825
 epoch: 26, train_loss: 0.6874, test_loss: 1.4709, test_f1: 0.5625
 epoch: 27, train_loss: 0.6956, test_loss: 1.9533, test_f1: 0.5335
 epoch: 28, train_loss: 0.6774, test_loss: 1.5520, test_f1: 0.6401
 epoch: 29, train_loss: 0.6599, test_loss: 1.3699, test_f1: 0.5686
 epoch: 30, train_loss: 0.6512, test_loss: 1.3776, test_f1: 0.5917
 epoch: 31, train_loss: 0.6603, test_loss: 1.6645, test_f1: 0.6058
 epoch: 32, train_loss: 0.6443, test_loss: 1.3256, test_f1: 0.5895
 epoch: 33, train_loss: 0.6346, test_loss: 1.5561, test_f1: 0.5647
 epoch: 34, train_loss: 0.6374, test_loss: 1.4771, test_f1: 0.5512
 epoch: 35, train_loss: 0.6099, test_loss: 1.8046, test_f1: 0.5546
 epoch: 36, train_loss: 0.6085, test_loss: 1.6423, test_f1: 0.5805
 epoch: 37, train_loss: 0.6038, test_loss: 1.9948, test_f1: 0.5920
 epoch: 38, train_loss: 0.5969, test_loss: 1.6777, test_f1: 0.5672
 epoch: 39, train_loss: 0.5740, test_loss: 1.8618, test_f1: 0.5461
 epoch: 40, train_loss: 0.6028, test_loss: 1.7358, test_f1: 0.5659
 epoch: 41, train_loss: 0.5883, test_loss: 1.7449, test_f1: 0.5256
 epoch: 42, train_loss: 0.5689, test_loss: 1.7300, test_f1: 0.5676
 epoch: 43, train_loss: 0.5756, test_loss: 1.6624, test_f1: 0.5807
 epoch: 44, train_loss: 0.5953, test_loss: 1.6406, test_f1: 0.6155
 epoch: 45, train_loss: 0.5879, test_loss: 2.0177, test_f1: 0.5808
 epoch: 46, train_loss: 0.5971, test_loss: 1.7149, test_f1: 0.5672
 epoch: 47, train_loss: 0.5486, test_loss: 1.6679, test_f1: 0.5785
 epoch: 48, train_loss: 0.5082, test_loss: 2.1489, test_f1: 0.5857
 epoch: 49, train_loss: 0.5114, test_loss: 2.0003, test_f1: 0.5991
 epoch: 50, train_loss: 0.5125, test_loss: 2.0714, test_f1: 0.5915
 epoch: 51, train_loss: 0.5044, test_loss: 2.0595, test_f1: 0.5700
 epoch: 52, train_loss: 0.5021, test_loss: 2.0386, test_f1: 0.5907
 epoch: 53, train_loss: 0.4887, test_loss: 1.9317, test_f1: 0.5948
 epoch: 54, train_loss: 0.4570, test_loss: 1.7876, test_f1: 0.5938
 epoch: 55, train_loss: 0.4518, test_loss: 2.3972, test_f1: 0.5602
 epoch: 56, train_loss: 0.4315, test_loss: 2.2798, test_f1: 0.5800
 epoch: 57, train_loss: 0.4424, test_loss: 2.2185, test_f1: 0.5747
 epoch: 58, train_loss: 0.4189, test_loss: 2.2472, test_f1: 0.5673
 epoch: 59, train_loss: 0.4346, test_loss: 2.3197, test_f1: 0.5638
 epoch: 60, train_loss: 0.4239, test_loss: 2.4076, test_f1: 0.5599
 epoch: 61, train_loss: 0.4142, test_loss: 2.2066, test_f1: 0.5724
 epoch: 62, train_loss: 0.4232, test_loss: 1.9393, test_f1: 0.5805
 epoch: 63, train_loss: 0.4414, test_loss: 2.2106, test_f1: 0.5376
 epoch: 64, train_loss: 0.4240, test_loss: 3.5491, test_f1: 0.5557
 epoch: 65, train_loss: 0.4294, test_loss: 3.6935, test_f1: 0.5597
 epoch: 66, train_loss: 0.4593, test_loss: 2.5709, test_f1: 0.5812
 epoch: 67, train_loss: 0.4493, test_loss: 3.4094, test_f1: 0.5531
 epoch: 68, train_loss: 0.4225, test_loss: 2.9327, test_f1: 0.5593
 epoch: 69, train_loss: 0.4259, test_loss: 4.2844, test_f1: 0.5596
 epoch: 70, train_loss: 0.4039, test_loss: 3.2549, test_f1: 0.5545
 epoch: 71, train_loss: 0.4089, test_loss: 3.5655, test_f1: 0.5504
 epoch: 72, train_loss: 0.4081, test_loss: 3.3692, test_f1: 0.5357
 epoch: 73, train_loss: 0.3945, test_loss: 2.7996, test_f1: 0.5525
 epoch: 74, train_loss: 0.3656, test_loss: 2.9423, test_f1: 0.5684
 epoch: 75, train_loss: 0.3674, test_loss: 3.3330, test_f1: 0.5520
 epoch: 76, train_loss: 0.3557, test_loss: 2.7515, test_f1: 0.5798
 epoch: 77, train_loss: 0.3796, test_loss: 3.2425, test_f1: 0.5690
 epoch: 78, train_loss: 0.3683, test_loss: 4.8380, test_f1: 0.5627
 epoch: 79, train_loss: 0.3461, test_loss: 3.0226, test_f1: 0.5830
 epoch: 80, train_loss: 0.3661, test_loss: 2.4848, test_f1: 0.5491
 epoch: 81, train_loss: 0.3537, test_loss: 2.9686, test_f1: 0.5499
 epoch: 82, train_loss: 0.3556, test_loss: 4.8148, test_f1: 0.5302
 epoch: 83, train_loss: 0.3437, test_loss: 4.3285, test_f1: 0.5431
 epoch: 84, train_loss: 0.3409, test_loss: 3.6167, test_f1: 0.5422
 epoch: 85, train_loss: 0.3400, test_loss: 3.2774, test_f1: 0.5688
 epoch: 86, train_loss: 0.3403, test_loss: 4.5073, test_f1: 0.5675
 epoch: 87, train_loss: 0.3313, test_loss: 3.4292, test_f1: 0.5257
 epoch: 88, train_loss: 0.3624, test_loss: 3.2067, test_f1: 0.5319
 epoch: 89, train_loss: 0.3265, test_loss: 3.4972, test_f1: 0.5520
 epoch: 90, train_loss: 0.3482, test_loss: 3.2796, test_f1: 0.5793
 epoch: 91, train_loss: 0.3087, test_loss: 2.9267, test_f1: 0.5619
 epoch: 92, train_loss: 0.3062, test_loss: 3.0428, test_f1: 0.5648
 epoch: 93, train_loss: 0.3182, test_loss: 3.1451, test_f1: 0.5718
 epoch: 94, train_loss: 0.3131, test_loss: 2.9810, test_f1: 0.5527
 epoch: 95, train_loss: 0.3044, test_loss: 3.3398, test_f1: 0.5731
 epoch: 96, train_loss: 0.3142, test_loss: 4.9144, test_f1: 0.5590
 epoch: 97, train_loss: 0.3121, test_loss: 5.6577, test_f1: 0.5419
 epoch: 98, train_loss: 0.2996, test_loss: 5.4250, test_f1: 0.5767
 epoch: 99, train_loss: 0.3183, test_loss: 3.5148, test_f1: 0.5542
##################ITERATION #8 ****************************************
 epoch: 0, train_loss: 1.5452, test_loss: 1.3222, test_f1: 0.3365
 epoch: 1, train_loss: 1.2132, test_loss: 1.3734, test_f1: 0.3565
 epoch: 2, train_loss: 1.1362, test_loss: 1.3432, test_f1: 0.4397
 epoch: 3, train_loss: 1.0676, test_loss: 1.2832, test_f1: 0.5196
 epoch: 4, train_loss: 1.0456, test_loss: 1.2011, test_f1: 0.5234
 epoch: 5, train_loss: 0.9985, test_loss: 1.1919, test_f1: 0.5502
 epoch: 6, train_loss: 0.9807, test_loss: 1.2325, test_f1: 0.4804
 epoch: 7, train_loss: 0.9598, test_loss: 1.2070, test_f1: 0.5617
 epoch: 8, train_loss: 0.9340, test_loss: 1.2183, test_f1: 0.5444
 epoch: 9, train_loss: 0.9316, test_loss: 1.0908, test_f1: 0.5482
 epoch: 10, train_loss: 0.9086, test_loss: 1.1766, test_f1: 0.5627
 epoch: 11, train_loss: 0.8828, test_loss: 1.1679, test_f1: 0.5853
 epoch: 12, train_loss: 0.8978, test_loss: 1.2573, test_f1: 0.5335
 epoch: 13, train_loss: 0.8671, test_loss: 1.1329, test_f1: 0.5955
 epoch: 14, train_loss: 0.8579, test_loss: 1.1555, test_f1: 0.5925
 epoch: 15, train_loss: 0.8619, test_loss: 1.2562, test_f1: 0.4926
 epoch: 16, train_loss: 0.8238, test_loss: 1.1824, test_f1: 0.5553
 epoch: 17, train_loss: 0.8246, test_loss: 1.1684, test_f1: 0.5748
 epoch: 18, train_loss: 0.8076, test_loss: 1.1306, test_f1: 0.6003
 epoch: 19, train_loss: 0.7854, test_loss: 1.1189, test_f1: 0.6241
 epoch: 20, train_loss: 0.7970, test_loss: 1.3191, test_f1: 0.5094
 epoch: 21, train_loss: 0.7879, test_loss: 1.2407, test_f1: 0.5463
 epoch: 22, train_loss: 0.7864, test_loss: 1.2085, test_f1: 0.5548
 epoch: 23, train_loss: 0.7693, test_loss: 1.1870, test_f1: 0.5603
 epoch: 24, train_loss: 0.7634, test_loss: 1.1463, test_f1: 0.6026
 epoch: 25, train_loss: 0.7481, test_loss: 1.2980, test_f1: 0.5627
 epoch: 26, train_loss: 0.7392, test_loss: 1.2527, test_f1: 0.5842
 epoch: 27, train_loss: 0.7293, test_loss: 1.2458, test_f1: 0.6236
 epoch: 28, train_loss: 0.7464, test_loss: 1.2431, test_f1: 0.5629
 epoch: 29, train_loss: 0.7396, test_loss: 1.3069, test_f1: 0.5309
 epoch: 30, train_loss: 0.7060, test_loss: 1.3081, test_f1: 0.5051
 epoch: 31, train_loss: 0.7153, test_loss: 1.3930, test_f1: 0.5340
 epoch: 32, train_loss: 0.7051, test_loss: 1.2441, test_f1: 0.5702
 epoch: 33, train_loss: 0.6828, test_loss: 1.3640, test_f1: 0.5031
 epoch: 34, train_loss: 0.6790, test_loss: 1.3200, test_f1: 0.5386
 epoch: 35, train_loss: 0.6823, test_loss: 1.4019, test_f1: 0.5260
 epoch: 36, train_loss: 0.6554, test_loss: 1.5373, test_f1: 0.5587
 epoch: 37, train_loss: 0.6668, test_loss: 1.1998, test_f1: 0.5957
 epoch: 38, train_loss: 0.6612, test_loss: 1.2948, test_f1: 0.5820
 epoch: 39, train_loss: 0.6405, test_loss: 1.3600, test_f1: 0.5381
 epoch: 40, train_loss: 0.6436, test_loss: 1.2506, test_f1: 0.5924
 epoch: 41, train_loss: 0.6039, test_loss: 1.3972, test_f1: 0.5753
 epoch: 42, train_loss: 0.6173, test_loss: 1.4177, test_f1: 0.5390
 epoch: 43, train_loss: 0.6281, test_loss: 1.3774, test_f1: 0.5354
 epoch: 44, train_loss: 0.6126, test_loss: 1.4181, test_f1: 0.5717
 epoch: 45, train_loss: 0.5938, test_loss: 1.3241, test_f1: 0.5981
 epoch: 46, train_loss: 0.5941, test_loss: 1.4646, test_f1: 0.5712
 epoch: 47, train_loss: 0.5923, test_loss: 1.3681, test_f1: 0.5704
 epoch: 48, train_loss: 0.5647, test_loss: 1.6520, test_f1: 0.5374
 epoch: 49, train_loss: 0.5806, test_loss: 1.5034, test_f1: 0.6036
 epoch: 50, train_loss: 0.5747, test_loss: 1.4639, test_f1: 0.5332
 epoch: 51, train_loss: 0.5735, test_loss: 1.4940, test_f1: 0.5992
 epoch: 52, train_loss: 0.5387, test_loss: 1.5623, test_f1: 0.5683
 epoch: 53, train_loss: 0.5191, test_loss: 1.4995, test_f1: 0.5778
 epoch: 54, train_loss: 0.5294, test_loss: 1.4806, test_f1: 0.5907
 epoch: 55, train_loss: 0.5113, test_loss: 1.4940, test_f1: 0.5723
 epoch: 56, train_loss: 0.5117, test_loss: 1.5292, test_f1: 0.5758
 epoch: 57, train_loss: 0.5292, test_loss: 1.5364, test_f1: 0.5655
 epoch: 58, train_loss: 0.4853, test_loss: 1.5144, test_f1: 0.5833
 epoch: 59, train_loss: 0.4757, test_loss: 1.6281, test_f1: 0.5742
 epoch: 60, train_loss: 0.4906, test_loss: 1.5977, test_f1: 0.5455
 epoch: 61, train_loss: 0.4904, test_loss: 1.5593, test_f1: 0.5695
 epoch: 62, train_loss: 0.4765, test_loss: 1.5392, test_f1: 0.5578
 epoch: 63, train_loss: 0.4681, test_loss: 1.6472, test_f1: 0.5515
 epoch: 64, train_loss: 0.4586, test_loss: 1.5167, test_f1: 0.5785
 epoch: 65, train_loss: 0.4552, test_loss: 1.6814, test_f1: 0.5764
 epoch: 66, train_loss: 0.4645, test_loss: 1.6171, test_f1: 0.5840
 epoch: 67, train_loss: 0.4791, test_loss: 1.6607, test_f1: 0.5649
 epoch: 68, train_loss: 0.4684, test_loss: 1.6219, test_f1: 0.5712
 epoch: 69, train_loss: 0.4526, test_loss: 1.6521, test_f1: 0.5514
 epoch: 70, train_loss: 0.4343, test_loss: 1.7480, test_f1: 0.5562
 epoch: 71, train_loss: 0.4645, test_loss: 1.7546, test_f1: 0.5610
 epoch: 72, train_loss: 0.4482, test_loss: 1.6995, test_f1: 0.5571
 epoch: 73, train_loss: 0.4290, test_loss: 1.5892, test_f1: 0.5675
 epoch: 74, train_loss: 0.4436, test_loss: 1.6848, test_f1: 0.5720
 epoch: 75, train_loss: 0.4300, test_loss: 1.6662, test_f1: 0.5455
 epoch: 76, train_loss: 0.4130, test_loss: 1.7670, test_f1: 0.5477
 epoch: 77, train_loss: 0.4093, test_loss: 1.7659, test_f1: 0.5760
 epoch: 78, train_loss: 0.4290, test_loss: 1.7580, test_f1: 0.5775
 epoch: 79, train_loss: 0.3893, test_loss: 1.8181, test_f1: 0.5735
 epoch: 80, train_loss: 0.4221, test_loss: 1.8431, test_f1: 0.5589
 epoch: 81, train_loss: 0.4526, test_loss: 1.8822, test_f1: 0.6003
 epoch: 82, train_loss: 0.4200, test_loss: 1.7747, test_f1: 0.5730
 epoch: 83, train_loss: 0.4266, test_loss: 1.8169, test_f1: 0.5921
 epoch: 84, train_loss: 0.4018, test_loss: 1.7873, test_f1: 0.5806
 epoch: 85, train_loss: 0.4162, test_loss: 1.6123, test_f1: 0.5896
 epoch: 86, train_loss: 0.3939, test_loss: 1.7587, test_f1: 0.5685
 epoch: 87, train_loss: 0.4163, test_loss: 1.9126, test_f1: 0.5678
 epoch: 88, train_loss: 0.3878, test_loss: 1.7932, test_f1: 0.5759
 epoch: 89, train_loss: 0.4031, test_loss: 1.8809, test_f1: 0.5707
 epoch: 90, train_loss: 0.4039, test_loss: 1.8974, test_f1: 0.5734
 epoch: 91, train_loss: 0.4090, test_loss: 1.7508, test_f1: 0.5696
 epoch: 92, train_loss: 0.3740, test_loss: 1.7375, test_f1: 0.5796
 epoch: 93, train_loss: 0.3607, test_loss: 1.7483, test_f1: 0.5722
 epoch: 94, train_loss: 0.3629, test_loss: 1.8121, test_f1: 0.5688
 epoch: 95, train_loss: 0.3488, test_loss: 2.0369, test_f1: 0.5703
 epoch: 96, train_loss: 0.3665, test_loss: 1.9254, test_f1: 0.5637
 epoch: 97, train_loss: 0.3668, test_loss: 1.9206, test_f1: 0.5667
 epoch: 98, train_loss: 0.3569, test_loss: 1.8703, test_f1: 0.5933
 epoch: 99, train_loss: 0.3524, test_loss: 1.9847, test_f1: 0.5675
##################ITERATION #9 ****************************************
 epoch: 0, train_loss: 1.5291, test_loss: 1.4342, test_f1: 0.2030
 epoch: 1, train_loss: 1.2145, test_loss: 1.4330, test_f1: 0.2308
 epoch: 2, train_loss: 1.1591, test_loss: 1.3301, test_f1: 0.4415
 epoch: 3, train_loss: 1.1079, test_loss: 1.1683, test_f1: 0.4906
 epoch: 4, train_loss: 1.0619, test_loss: 1.1978, test_f1: 0.4956
 epoch: 5, train_loss: 1.0418, test_loss: 1.1550, test_f1: 0.5417
 epoch: 6, train_loss: 1.0104, test_loss: 1.1629, test_f1: 0.5642
 epoch: 7, train_loss: 0.9974, test_loss: 1.1544, test_f1: 0.5408
 epoch: 8, train_loss: 0.9481, test_loss: 1.1555, test_f1: 0.5467
 epoch: 9, train_loss: 0.9447, test_loss: 1.1226, test_f1: 0.5514
 epoch: 10, train_loss: 0.9262, test_loss: 1.1382, test_f1: 0.5561
 epoch: 11, train_loss: 0.9083, test_loss: 1.1403, test_f1: 0.5651
 epoch: 12, train_loss: 0.8828, test_loss: 1.1255, test_f1: 0.5954
 epoch: 13, train_loss: 0.8660, test_loss: 1.0898, test_f1: 0.5681
 epoch: 14, train_loss: 0.8441, test_loss: 1.0997, test_f1: 0.5623
 epoch: 15, train_loss: 0.8349, test_loss: 1.0461, test_f1: 0.6294
 epoch: 16, train_loss: 0.8214, test_loss: 1.0963, test_f1: 0.5628
 epoch: 17, train_loss: 0.8182, test_loss: 1.1289, test_f1: 0.5870
 epoch: 18, train_loss: 0.7976, test_loss: 1.0965, test_f1: 0.5680
 epoch: 19, train_loss: 0.7907, test_loss: 1.3364, test_f1: 0.5153
 epoch: 20, train_loss: 0.7819, test_loss: 1.1066, test_f1: 0.5819
 epoch: 21, train_loss: 0.7820, test_loss: 1.0971, test_f1: 0.5922
 epoch: 22, train_loss: 0.7553, test_loss: 1.1040, test_f1: 0.5775
 epoch: 23, train_loss: 0.7246, test_loss: 1.1285, test_f1: 0.5711
 epoch: 24, train_loss: 0.7198, test_loss: 1.1508, test_f1: 0.5755
 epoch: 25, train_loss: 0.6792, test_loss: 1.1575, test_f1: 0.5548
 epoch: 26, train_loss: 0.7016, test_loss: 1.2050, test_f1: 0.5546
 epoch: 27, train_loss: 0.6921, test_loss: 1.1464, test_f1: 0.5800
 epoch: 28, train_loss: 0.6735, test_loss: 1.2710, test_f1: 0.5029
 epoch: 29, train_loss: 0.6734, test_loss: 1.1857, test_f1: 0.5405
 epoch: 30, train_loss: 0.6576, test_loss: 1.4666, test_f1: 0.4934
 epoch: 31, train_loss: 0.6639, test_loss: 1.1915, test_f1: 0.5691
 epoch: 32, train_loss: 0.6420, test_loss: 1.2092, test_f1: 0.5465
 epoch: 33, train_loss: 0.6379, test_loss: 1.1468, test_f1: 0.5719
 epoch: 34, train_loss: 0.6080, test_loss: 1.2686, test_f1: 0.5472
 epoch: 35, train_loss: 0.6152, test_loss: 1.1841, test_f1: 0.5845
 epoch: 36, train_loss: 0.6108, test_loss: 1.4402, test_f1: 0.5256
 epoch: 37, train_loss: 0.5982, test_loss: 1.2510, test_f1: 0.5423
 epoch: 38, train_loss: 0.6039, test_loss: 1.3680, test_f1: 0.5695
 epoch: 39, train_loss: 0.5984, test_loss: 1.2796, test_f1: 0.5787
 epoch: 40, train_loss: 0.6026, test_loss: 1.3949, test_f1: 0.5611
 epoch: 41, train_loss: 0.5965, test_loss: 1.2472, test_f1: 0.5823
 epoch: 42, train_loss: 0.5493, test_loss: 1.3597, test_f1: 0.5703
 epoch: 43, train_loss: 0.5868, test_loss: 1.3564, test_f1: 0.5541
 epoch: 44, train_loss: 0.5611, test_loss: 1.3778, test_f1: 0.5681
 epoch: 45, train_loss: 0.5306, test_loss: 1.4081, test_f1: 0.5765
 epoch: 46, train_loss: 0.5333, test_loss: 1.3920, test_f1: 0.5899
 epoch: 47, train_loss: 0.5093, test_loss: 1.4243, test_f1: 0.5466
 epoch: 48, train_loss: 0.5505, test_loss: 1.4863, test_f1: 0.5624
 epoch: 49, train_loss: 0.5010, test_loss: 1.5419, test_f1: 0.5621
 epoch: 50, train_loss: 0.4981, test_loss: 1.5425, test_f1: 0.5741
 epoch: 51, train_loss: 0.4936, test_loss: 1.5241, test_f1: 0.5619
 epoch: 52, train_loss: 0.4530, test_loss: 1.4290, test_f1: 0.5639
 epoch: 53, train_loss: 0.4581, test_loss: 1.5239, test_f1: 0.5484
 epoch: 54, train_loss: 0.4670, test_loss: 1.5614, test_f1: 0.5600
 epoch: 55, train_loss: 0.4516, test_loss: 1.5216, test_f1: 0.5715
 epoch: 56, train_loss: 0.4390, test_loss: 1.4246, test_f1: 0.5733
 epoch: 57, train_loss: 0.4451, test_loss: 1.4644, test_f1: 0.5715
 epoch: 58, train_loss: 0.4348, test_loss: 1.5091, test_f1: 0.5507
 epoch: 59, train_loss: 0.4570, test_loss: 1.7087, test_f1: 0.5614
 epoch: 60, train_loss: 0.4267, test_loss: 1.6086, test_f1: 0.5614
 epoch: 61, train_loss: 0.4350, test_loss: 1.5211, test_f1: 0.5724
 epoch: 62, train_loss: 0.4160, test_loss: 1.5080, test_f1: 0.5964
 epoch: 63, train_loss: 0.4418, test_loss: 1.5102, test_f1: 0.5890
 epoch: 64, train_loss: 0.4252, test_loss: 1.6235, test_f1: 0.5739
 epoch: 65, train_loss: 0.4183, test_loss: 1.5000, test_f1: 0.5687
 epoch: 66, train_loss: 0.4078, test_loss: 1.5782, test_f1: 0.5862
 epoch: 67, train_loss: 0.3947, test_loss: 1.5676, test_f1: 0.6017
 epoch: 68, train_loss: 0.3792, test_loss: 1.6491, test_f1: 0.5789
 epoch: 69, train_loss: 0.4157, test_loss: 1.6812, test_f1: 0.5716
 epoch: 70, train_loss: 0.3956, test_loss: 1.6994, test_f1: 0.5615
 epoch: 71, train_loss: 0.3773, test_loss: 1.6408, test_f1: 0.5958
 epoch: 72, train_loss: 0.3792, test_loss: 1.6408, test_f1: 0.5931
 epoch: 73, train_loss: 0.3907, test_loss: 1.6906, test_f1: 0.5609
 epoch: 74, train_loss: 0.3899, test_loss: 1.6888, test_f1: 0.5679
 epoch: 75, train_loss: 0.3843, test_loss: 1.7036, test_f1: 0.5956
 epoch: 76, train_loss: 0.3741, test_loss: 1.7494, test_f1: 0.5789
 epoch: 77, train_loss: 0.3830, test_loss: 1.7584, test_f1: 0.5909
 epoch: 78, train_loss: 0.3714, test_loss: 1.6950, test_f1: 0.5962
 epoch: 79, train_loss: 0.3633, test_loss: 1.7165, test_f1: 0.6044
 epoch: 80, train_loss: 0.3521, test_loss: 1.7532, test_f1: 0.6016
 epoch: 81, train_loss: 0.3612, test_loss: 1.9167, test_f1: 0.5654
 epoch: 82, train_loss: 0.3510, test_loss: 1.8643, test_f1: 0.5857
 epoch: 83, train_loss: 0.3529, test_loss: 1.7497, test_f1: 0.5913
 epoch: 84, train_loss: 0.3634, test_loss: 1.7331, test_f1: 0.5924
 epoch: 85, train_loss: 0.3572, test_loss: 1.8520, test_f1: 0.5699
 epoch: 86, train_loss: 0.3739, test_loss: 1.7935, test_f1: 0.5804
 epoch: 87, train_loss: 0.3576, test_loss: 1.7907, test_f1: 0.5943
 epoch: 88, train_loss: 0.3467, test_loss: 1.7816, test_f1: 0.5752
 epoch: 89, train_loss: 0.3081, test_loss: 1.7825, test_f1: 0.5949
 epoch: 90, train_loss: 0.3329, test_loss: 1.9534, test_f1: 0.5755
 epoch: 91, train_loss: 0.3311, test_loss: 1.7619, test_f1: 0.6049
 epoch: 92, train_loss: 0.3340, test_loss: 1.8867, test_f1: 0.5809
 epoch: 93, train_loss: 0.3497, test_loss: 1.7617, test_f1: 0.5751
 epoch: 94, train_loss: 0.3431, test_loss: 1.8731, test_f1: 0.5751
 epoch: 95, train_loss: 0.2965, test_loss: 1.8175, test_f1: 0.5879
 epoch: 96, train_loss: 0.3202, test_loss: 1.8833, test_f1: 0.5856
 epoch: 97, train_loss: 0.3091, test_loss: 1.8299, test_f1: 0.5987
 epoch: 98, train_loss: 0.3163, test_loss: 1.8698, test_f1: 0.5817
 epoch: 99, train_loss: 0.3110, test_loss: 1.9579, test_f1: 0.5981

Training completed in 310.07 seconds
Best F1: 0.6604 at epoch 19
Mean F1 across iterations: 0.6307  0.0201
========================FINAL RESULTS================================
FEGIN weighted F1: 0.6604  0.0201
python main.py --data ltspice_demos --representation component_component --model FEGIN --layers 2 --hiddens 64 --batch_size 128 --lr 0.001 --emb_size 250 --epochs 100 --save_appendix component_component_L2_H64_BS128_LR0.001_E250 --no_val
-----



STDERR:
  File "main.py", line 370, in <module>
    main()
  File "main.py", line 254, in main
    dataset = dataset_class(
  File "/home/philip/projects/ltspice_examples_code_repo/Circuit-Completion-Using-GNNs/component_classification_with_link_prediction_head/evaluation/FEGIN/kernel/circuit_datasets.py", line 15, in __init__
    self.data, self.slices = torch.load(self.processed_paths[0])
  File "/home/philip/.local/lib/python3.8/site-packages/torch/serialization.py", line 1040, in load
    warnings.warn(
  File "/usr/lib/python3.8/warnings.py", line 109, in _showwarnmsg
    sw(msg.message, msg.category, msg.filename, msg.lineno,
  File "main.py", line 47, in warn_with_traceback
    traceback.print_stack(file=log)
/home/philip/projects/ltspice_examples_code_repo/Circuit-Completion-Using-GNNs/component_classification_with_link_prediction_head/evaluation/FEGIN/kernel/circuit_datasets.py:15: FutureWarning: You are using `torch.load` with `weights_only=False` (the current default value), which uses the default pickle module implicitly. It is possible to construct malicious pickle data which will execute arbitrary code during unpickling (See https://github.com/pytorch/pytorch/blob/main/SECURITY.md#untrusted-models for more details). In a future release, the default value for `weights_only` will be flipped to `True`. This limits the functions that could be executed during unpickling. Arbitrary objects will no longer be allowed to be loaded via this mode unless they are explicitly allowlisted by the user via `torch.serialization.add_safe_globals`. We recommend you start setting `weights_only=True` for any use case where you don't have full control of the loaded file. Please open an issue on GitHub for any issues related to this experimental feature.
  self.data, self.slices = torch.load(self.processed_paths[0])
