STDOUT:
Results will be saved in /home/philip/projects/ltspice_examples_code_repo/Circuit-Completion-Using-GNNs/component_classification_with_link_prediction_head/evaluation/FEGIN/results/model_FEGIN_dataset_ltspice_demos
Command line input: python main.py --data ltspice_demos --representation component_component --model FEGIN --layers 2 --hiddens 64 --batch_size 128 --lr 0.001 --emb_size 250 --epochs 100 --save_appendix component_component_L2_H64_BS128_LR0.001_E250 --no_val
 is saved.
-----
ltspice_demos - FEGIN
Using 2 layers, 64 hidden units, h = 2
Loading component_component representation dataset
ENTERED
Training FEGIN on component_component representation
Train: 1565, Test: 383
##################ITERATION #0 ****************************************
 epoch: 0, train_loss: 1.3633, test_loss: 1.3471, test_f1: 0.2281
 epoch: 1, train_loss: 1.2465, test_loss: 1.2923, test_f1: 0.2659
 epoch: 2, train_loss: 1.1965, test_loss: 1.2817, test_f1: 0.2672
 epoch: 3, train_loss: 1.1584, test_loss: 1.2545, test_f1: 0.2866
 epoch: 4, train_loss: 1.1347, test_loss: 1.2346, test_f1: 0.4079
 epoch: 5, train_loss: 1.0967, test_loss: 1.2019, test_f1: 0.4108
 epoch: 6, train_loss: 1.0617, test_loss: 1.1793, test_f1: 0.4273
 epoch: 7, train_loss: 1.0217, test_loss: 1.1881, test_f1: 0.4321
 epoch: 8, train_loss: 1.0046, test_loss: 1.2224, test_f1: 0.4428
 epoch: 9, train_loss: 0.9772, test_loss: 1.2009, test_f1: 0.4806
 epoch: 10, train_loss: 0.9457, test_loss: 1.1598, test_f1: 0.5050
 epoch: 11, train_loss: 0.9270, test_loss: 1.1615, test_f1: 0.5255
 epoch: 12, train_loss: 0.9073, test_loss: 1.2761, test_f1: 0.5001
 epoch: 13, train_loss: 0.8960, test_loss: 1.1533, test_f1: 0.5196
 epoch: 14, train_loss: 0.8579, test_loss: 1.2447, test_f1: 0.5286
 epoch: 15, train_loss: 0.8591, test_loss: 1.2515, test_f1: 0.5451
 epoch: 16, train_loss: 0.8459, test_loss: 1.2928, test_f1: 0.5272
 epoch: 17, train_loss: 0.8495, test_loss: 1.2363, test_f1: 0.5413
 epoch: 18, train_loss: 0.8111, test_loss: 1.2562, test_f1: 0.5107
 epoch: 19, train_loss: 0.7725, test_loss: 1.1904, test_f1: 0.5465
 epoch: 20, train_loss: 0.7431, test_loss: 1.1799, test_f1: 0.5840
 epoch: 21, train_loss: 0.7552, test_loss: 1.5029, test_f1: 0.5255
 epoch: 22, train_loss: 0.7336, test_loss: 1.4421, test_f1: 0.5418
 epoch: 23, train_loss: 0.7118, test_loss: 1.4377, test_f1: 0.4886
 epoch: 24, train_loss: 0.6922, test_loss: 1.5384, test_f1: 0.5110
 epoch: 25, train_loss: 0.6982, test_loss: 1.5501, test_f1: 0.5213
 epoch: 26, train_loss: 0.6593, test_loss: 1.4049, test_f1: 0.5504
 epoch: 27, train_loss: 0.6459, test_loss: 1.3902, test_f1: 0.5576
 epoch: 28, train_loss: 0.6527, test_loss: 1.5341, test_f1: 0.5220
 epoch: 29, train_loss: 0.6258, test_loss: 1.5826, test_f1: 0.4455
 epoch: 30, train_loss: 0.6071, test_loss: 1.5097, test_f1: 0.5630
 epoch: 31, train_loss: 0.6089, test_loss: 1.4945, test_f1: 0.5599
 epoch: 32, train_loss: 0.5978, test_loss: 1.7351, test_f1: 0.5503
 epoch: 33, train_loss: 0.6038, test_loss: 1.7572, test_f1: 0.4977
 epoch: 34, train_loss: 0.5894, test_loss: 1.5690, test_f1: 0.5279
 epoch: 35, train_loss: 0.5935, test_loss: 1.6241, test_f1: 0.4919
 epoch: 36, train_loss: 0.5592, test_loss: 1.8754, test_f1: 0.5584
 epoch: 37, train_loss: 0.5532, test_loss: 1.6061, test_f1: 0.5829
 epoch: 38, train_loss: 0.5441, test_loss: 1.7250, test_f1: 0.5626
 epoch: 39, train_loss: 0.5419, test_loss: 1.7895, test_f1: 0.5318
 epoch: 40, train_loss: 0.5859, test_loss: 2.0996, test_f1: 0.4568
 epoch: 41, train_loss: 0.5238, test_loss: 1.9189, test_f1: 0.5505
 epoch: 42, train_loss: 0.5264, test_loss: 1.8017, test_f1: 0.5347
 epoch: 43, train_loss: 0.5176, test_loss: 1.8055, test_f1: 0.5271
 epoch: 44, train_loss: 0.4949, test_loss: 1.6087, test_f1: 0.5833
 epoch: 45, train_loss: 0.5164, test_loss: 1.8699, test_f1: 0.5239
 epoch: 46, train_loss: 0.5031, test_loss: 1.9030, test_f1: 0.5142
 epoch: 47, train_loss: 0.4794, test_loss: 1.9403, test_f1: 0.5007
 epoch: 48, train_loss: 0.4746, test_loss: 1.9003, test_f1: 0.5469
 epoch: 49, train_loss: 0.4625, test_loss: 1.8992, test_f1: 0.5200
 epoch: 50, train_loss: 0.4709, test_loss: 2.0492, test_f1: 0.5373
 epoch: 51, train_loss: 0.4759, test_loss: 1.8222, test_f1: 0.6159
 epoch: 52, train_loss: 0.4393, test_loss: 2.0399, test_f1: 0.5311
 epoch: 53, train_loss: 0.4157, test_loss: 1.9094, test_f1: 0.5555
 epoch: 54, train_loss: 0.4093, test_loss: 1.9771, test_f1: 0.5572
 epoch: 55, train_loss: 0.4194, test_loss: 2.0578, test_f1: 0.5537
 epoch: 56, train_loss: 0.4041, test_loss: 2.0401, test_f1: 0.5414
 epoch: 57, train_loss: 0.4031, test_loss: 2.1205, test_f1: 0.5617
 epoch: 58, train_loss: 0.3822, test_loss: 2.1396, test_f1: 0.5403
 epoch: 59, train_loss: 0.3766, test_loss: 2.2792, test_f1: 0.5668
 epoch: 60, train_loss: 0.3787, test_loss: 2.1977, test_f1: 0.5427
 epoch: 61, train_loss: 0.3832, test_loss: 2.1670, test_f1: 0.5185
 epoch: 62, train_loss: 0.3607, test_loss: 2.0701, test_f1: 0.5398
 epoch: 63, train_loss: 0.3691, test_loss: 2.0475, test_f1: 0.5834
 epoch: 64, train_loss: 0.3697, test_loss: 2.4424, test_f1: 0.5333
 epoch: 65, train_loss: 0.3950, test_loss: 2.3429, test_f1: 0.5618
 epoch: 66, train_loss: 0.3582, test_loss: 2.2009, test_f1: 0.5870
 epoch: 67, train_loss: 0.3366, test_loss: 2.3708, test_f1: 0.5123
 epoch: 68, train_loss: 0.3600, test_loss: 2.2728, test_f1: 0.5355
 epoch: 69, train_loss: 0.3506, test_loss: 2.3464, test_f1: 0.5572
 epoch: 70, train_loss: 0.3458, test_loss: 2.3565, test_f1: 0.5386
 epoch: 71, train_loss: 0.3294, test_loss: 2.3589, test_f1: 0.5436
 epoch: 72, train_loss: 0.3262, test_loss: 2.4295, test_f1: 0.5672
 epoch: 73, train_loss: 0.3309, test_loss: 2.5541, test_f1: 0.5553
 epoch: 74, train_loss: 0.3149, test_loss: 2.5719, test_f1: 0.5776
 epoch: 75, train_loss: 0.3338, test_loss: 2.6420, test_f1: 0.5432
 epoch: 76, train_loss: 0.3463, test_loss: 2.4147, test_f1: 0.5586
 epoch: 77, train_loss: 0.3165, test_loss: 2.5618, test_f1: 0.5667
 epoch: 78, train_loss: 0.3256, test_loss: 2.6975, test_f1: 0.5392
 epoch: 79, train_loss: 0.3282, test_loss: 2.6918, test_f1: 0.5508
 epoch: 80, train_loss: 0.3131, test_loss: 2.7313, test_f1: 0.5661
 epoch: 81, train_loss: 0.2976, test_loss: 2.7634, test_f1: 0.5603
 epoch: 82, train_loss: 0.2839, test_loss: 2.8175, test_f1: 0.5664
 epoch: 83, train_loss: 0.3211, test_loss: 2.9086, test_f1: 0.5380
 epoch: 84, train_loss: 0.2876, test_loss: 3.0647, test_f1: 0.5180
 epoch: 85, train_loss: 0.2818, test_loss: 3.1320, test_f1: 0.5145
 epoch: 86, train_loss: 0.2944, test_loss: 3.0208, test_f1: 0.5451
 epoch: 87, train_loss: 0.2880, test_loss: 2.9494, test_f1: 0.5357
 epoch: 88, train_loss: 0.2787, test_loss: 3.0500, test_f1: 0.5586
 epoch: 89, train_loss: 0.2895, test_loss: 2.7499, test_f1: 0.5698
 epoch: 90, train_loss: 0.2820, test_loss: 2.9004, test_f1: 0.5539
 epoch: 91, train_loss: 0.2872, test_loss: 3.2599, test_f1: 0.5475
 epoch: 92, train_loss: 0.2715, test_loss: 3.0065, test_f1: 0.5708
 epoch: 93, train_loss: 0.2408, test_loss: 3.2611, test_f1: 0.5527
 epoch: 94, train_loss: 0.2555, test_loss: 3.0765, test_f1: 0.5513
 epoch: 95, train_loss: 0.2970, test_loss: 3.2676, test_f1: 0.5439
 epoch: 96, train_loss: 0.2913, test_loss: 3.0997, test_f1: 0.5392
 epoch: 97, train_loss: 0.2758, test_loss: 3.1006, test_f1: 0.5720
 epoch: 98, train_loss: 0.2744, test_loss: 2.8304, test_f1: 0.5615
 epoch: 99, train_loss: 0.2582, test_loss: 3.0793, test_f1: 0.5429
##################ITERATION #1 ****************************************
 epoch: 0, train_loss: 1.2904, test_loss: 1.3146, test_f1: 0.3247
 epoch: 1, train_loss: 1.1612, test_loss: 1.3001, test_f1: 0.3720
 epoch: 2, train_loss: 1.1068, test_loss: 1.2460, test_f1: 0.4251
 epoch: 3, train_loss: 1.0447, test_loss: 1.1903, test_f1: 0.4385
 epoch: 4, train_loss: 1.0209, test_loss: 1.1886, test_f1: 0.5073
 epoch: 5, train_loss: 0.9758, test_loss: 1.2245, test_f1: 0.5115
 epoch: 6, train_loss: 0.9324, test_loss: 1.1919, test_f1: 0.5267
 epoch: 7, train_loss: 0.9139, test_loss: 1.1515, test_f1: 0.5342
 epoch: 8, train_loss: 0.8797, test_loss: 1.2695, test_f1: 0.5130
 epoch: 9, train_loss: 0.8534, test_loss: 1.2582, test_f1: 0.5209
 epoch: 10, train_loss: 0.8286, test_loss: 1.2367, test_f1: 0.5274
 epoch: 11, train_loss: 0.8137, test_loss: 1.3624, test_f1: 0.5752
 epoch: 12, train_loss: 0.7930, test_loss: 1.3644, test_f1: 0.5019
 epoch: 13, train_loss: 0.7675, test_loss: 1.2324, test_f1: 0.5834
 epoch: 14, train_loss: 0.7648, test_loss: 1.5113, test_f1: 0.5251
 epoch: 15, train_loss: 0.7495, test_loss: 1.4038, test_f1: 0.5656
 epoch: 16, train_loss: 0.7462, test_loss: 1.5167, test_f1: 0.5594
 epoch: 17, train_loss: 0.7141, test_loss: 1.3393, test_f1: 0.5359
 epoch: 18, train_loss: 0.7139, test_loss: 1.2954, test_f1: 0.5301
 epoch: 19, train_loss: 0.6972, test_loss: 1.3381, test_f1: 0.5529
 epoch: 20, train_loss: 0.6940, test_loss: 1.4499, test_f1: 0.5564
 epoch: 21, train_loss: 0.6881, test_loss: 1.4712, test_f1: 0.5510
 epoch: 22, train_loss: 0.6829, test_loss: 1.5208, test_f1: 0.5330
 epoch: 23, train_loss: 0.6501, test_loss: 1.5170, test_f1: 0.5345
 epoch: 24, train_loss: 0.6313, test_loss: 1.5118, test_f1: 0.5553
 epoch: 25, train_loss: 0.6159, test_loss: 1.7515, test_f1: 0.5449
 epoch: 26, train_loss: 0.6318, test_loss: 1.7522, test_f1: 0.5302
 epoch: 27, train_loss: 0.6027, test_loss: 1.8772, test_f1: 0.4702
 epoch: 28, train_loss: 0.6142, test_loss: 1.8003, test_f1: 0.5250
 epoch: 29, train_loss: 0.5904, test_loss: 1.8433, test_f1: 0.5475
 epoch: 30, train_loss: 0.5692, test_loss: 1.7972, test_f1: 0.5569
 epoch: 31, train_loss: 0.5976, test_loss: 2.1455, test_f1: 0.4618
 epoch: 32, train_loss: 0.5660, test_loss: 1.8246, test_f1: 0.5745
 epoch: 33, train_loss: 0.5377, test_loss: 1.8561, test_f1: 0.5405
 epoch: 34, train_loss: 0.5452, test_loss: 2.0091, test_f1: 0.5712
 epoch: 35, train_loss: 0.5313, test_loss: 2.0294, test_f1: 0.5072
 epoch: 36, train_loss: 0.5447, test_loss: 2.0738, test_f1: 0.5642
 epoch: 37, train_loss: 0.5082, test_loss: 2.0587, test_f1: 0.5352
 epoch: 38, train_loss: 0.5197, test_loss: 2.4199, test_f1: 0.4804
 epoch: 39, train_loss: 0.4819, test_loss: 2.2750, test_f1: 0.5590
 epoch: 40, train_loss: 0.4837, test_loss: 2.3566, test_f1: 0.5719
 epoch: 41, train_loss: 0.4904, test_loss: 2.2686, test_f1: 0.5730
 epoch: 42, train_loss: 0.4755, test_loss: 2.1568, test_f1: 0.5201
 epoch: 43, train_loss: 0.4800, test_loss: 2.1998, test_f1: 0.5568
 epoch: 44, train_loss: 0.4824, test_loss: 2.5350, test_f1: 0.5340
 epoch: 45, train_loss: 0.4540, test_loss: 2.1850, test_f1: 0.5605
 epoch: 46, train_loss: 0.4586, test_loss: 2.1369, test_f1: 0.5772
 epoch: 47, train_loss: 0.4928, test_loss: 2.3220, test_f1: 0.5739
 epoch: 48, train_loss: 0.4837, test_loss: 1.9500, test_f1: 0.5533
 epoch: 49, train_loss: 0.4664, test_loss: 2.2053, test_f1: 0.5648
 epoch: 50, train_loss: 0.4191, test_loss: 2.5633, test_f1: 0.5183
 epoch: 51, train_loss: 0.4042, test_loss: 2.4246, test_f1: 0.5950
 epoch: 52, train_loss: 0.3828, test_loss: 2.6089, test_f1: 0.5704
 epoch: 53, train_loss: 0.3825, test_loss: 2.3480, test_f1: 0.5844
 epoch: 54, train_loss: 0.3597, test_loss: 2.5047, test_f1: 0.5711
 epoch: 55, train_loss: 0.3580, test_loss: 2.8340, test_f1: 0.5789
 epoch: 56, train_loss: 0.3549, test_loss: 2.4129, test_f1: 0.5843
 epoch: 57, train_loss: 0.3560, test_loss: 2.6036, test_f1: 0.5647
 epoch: 58, train_loss: 0.3796, test_loss: 2.6428, test_f1: 0.5668
 epoch: 59, train_loss: 0.3616, test_loss: 2.6797, test_f1: 0.5571
 epoch: 60, train_loss: 0.3837, test_loss: 2.7309, test_f1: 0.5779
 epoch: 61, train_loss: 0.3500, test_loss: 2.7360, test_f1: 0.5502
 epoch: 62, train_loss: 0.3172, test_loss: 2.6828, test_f1: 0.5625
 epoch: 63, train_loss: 0.3327, test_loss: 2.9197, test_f1: 0.5683
 epoch: 64, train_loss: 0.3268, test_loss: 2.6449, test_f1: 0.5610
 epoch: 65, train_loss: 0.3399, test_loss: 2.8455, test_f1: 0.6004
 epoch: 66, train_loss: 0.3389, test_loss: 2.7679, test_f1: 0.5816
 epoch: 67, train_loss: 0.3257, test_loss: 2.7008, test_f1: 0.6105
 epoch: 68, train_loss: 0.3470, test_loss: 2.9885, test_f1: 0.5534
 epoch: 69, train_loss: 0.3409, test_loss: 2.8503, test_f1: 0.5883
 epoch: 70, train_loss: 0.3164, test_loss: 2.8451, test_f1: 0.5465
 epoch: 71, train_loss: 0.3248, test_loss: 2.6494, test_f1: 0.5799
 epoch: 72, train_loss: 0.3114, test_loss: 2.8304, test_f1: 0.5895
 epoch: 73, train_loss: 0.3267, test_loss: 2.9372, test_f1: 0.5920
 epoch: 74, train_loss: 0.3104, test_loss: 2.6690, test_f1: 0.5748
 epoch: 75, train_loss: 0.2635, test_loss: 2.6181, test_f1: 0.5715
 epoch: 76, train_loss: 0.2880, test_loss: 2.7058, test_f1: 0.5923
 epoch: 77, train_loss: 0.2987, test_loss: 2.8077, test_f1: 0.5466
 epoch: 78, train_loss: 0.3092, test_loss: 2.6466, test_f1: 0.5829
 epoch: 79, train_loss: 0.2980, test_loss: 2.6876, test_f1: 0.6236
 epoch: 80, train_loss: 0.2948, test_loss: 2.8139, test_f1: 0.5702
 epoch: 81, train_loss: 0.2956, test_loss: 2.9366, test_f1: 0.5945
 epoch: 82, train_loss: 0.3012, test_loss: 3.2891, test_f1: 0.5814
 epoch: 83, train_loss: 0.2868, test_loss: 2.8727, test_f1: 0.5756
 epoch: 84, train_loss: 0.2972, test_loss: 2.7920, test_f1: 0.5615
 epoch: 85, train_loss: 0.2952, test_loss: 2.7887, test_f1: 0.5545
 epoch: 86, train_loss: 0.3086, test_loss: 2.9075, test_f1: 0.5790
 epoch: 87, train_loss: 0.3044, test_loss: 3.2124, test_f1: 0.5624
 epoch: 88, train_loss: 0.2982, test_loss: 3.0323, test_f1: 0.5845
 epoch: 89, train_loss: 0.2522, test_loss: 3.3856, test_f1: 0.5511
 epoch: 90, train_loss: 0.2535, test_loss: 3.7439, test_f1: 0.5665
 epoch: 91, train_loss: 0.2694, test_loss: 3.3460, test_f1: 0.5777
 epoch: 92, train_loss: 0.2618, test_loss: 3.4804, test_f1: 0.5695
 epoch: 93, train_loss: 0.2621, test_loss: 3.5829, test_f1: 0.5605
 epoch: 94, train_loss: 0.2758, test_loss: 3.5920, test_f1: 0.5929
 epoch: 95, train_loss: 0.3108, test_loss: 3.3772, test_f1: 0.5800
 epoch: 96, train_loss: 0.2981, test_loss: 3.9651, test_f1: 0.5717
 epoch: 97, train_loss: 0.2801, test_loss: 3.1620, test_f1: 0.5717
 epoch: 98, train_loss: 0.2555, test_loss: 3.3984, test_f1: 0.5805
 epoch: 99, train_loss: 0.2602, test_loss: 3.0679, test_f1: 0.5794
##################ITERATION #2 ****************************************
 epoch: 0, train_loss: 1.3028, test_loss: 1.3615, test_f1: 0.3372
 epoch: 1, train_loss: 1.1486, test_loss: 1.3040, test_f1: 0.3714
 epoch: 2, train_loss: 1.1079, test_loss: 1.2460, test_f1: 0.4427
 epoch: 3, train_loss: 1.0776, test_loss: 1.1956, test_f1: 0.4797
 epoch: 4, train_loss: 1.0248, test_loss: 1.1252, test_f1: 0.5108
 epoch: 5, train_loss: 1.0006, test_loss: 1.1067, test_f1: 0.5302
 epoch: 6, train_loss: 0.9667, test_loss: 1.1610, test_f1: 0.4620
 epoch: 7, train_loss: 0.9513, test_loss: 1.0801, test_f1: 0.5251
 epoch: 8, train_loss: 0.9311, test_loss: 1.1566, test_f1: 0.5075
 epoch: 9, train_loss: 0.8950, test_loss: 1.1293, test_f1: 0.5332
 epoch: 10, train_loss: 0.8631, test_loss: 1.0534, test_f1: 0.5572
 epoch: 11, train_loss: 0.8485, test_loss: 1.0623, test_f1: 0.5769
 epoch: 12, train_loss: 0.8274, test_loss: 1.1198, test_f1: 0.5345
 epoch: 13, train_loss: 0.8228, test_loss: 1.0742, test_f1: 0.5697
 epoch: 14, train_loss: 0.8152, test_loss: 1.0899, test_f1: 0.5398
 epoch: 15, train_loss: 0.7902, test_loss: 1.0574, test_f1: 0.6469
 epoch: 16, train_loss: 0.7849, test_loss: 1.2256, test_f1: 0.5375
 epoch: 17, train_loss: 0.7731, test_loss: 1.0579, test_f1: 0.5352
 epoch: 18, train_loss: 0.7610, test_loss: 1.0632, test_f1: 0.5981
 epoch: 19, train_loss: 0.7326, test_loss: 1.0515, test_f1: 0.5765
 epoch: 20, train_loss: 0.7267, test_loss: 1.2308, test_f1: 0.4922
 epoch: 21, train_loss: 0.7255, test_loss: 1.1877, test_f1: 0.5360
 epoch: 22, train_loss: 0.7062, test_loss: 1.0893, test_f1: 0.6024
 epoch: 23, train_loss: 0.6866, test_loss: 1.1085, test_f1: 0.5790
 epoch: 24, train_loss: 0.6932, test_loss: 1.0604, test_f1: 0.6459
 epoch: 25, train_loss: 0.6670, test_loss: 1.0774, test_f1: 0.6233
 epoch: 26, train_loss: 0.6506, test_loss: 1.1563, test_f1: 0.6534
 epoch: 27, train_loss: 0.6427, test_loss: 1.2045, test_f1: 0.5928
 epoch: 28, train_loss: 0.6594, test_loss: 1.1379, test_f1: 0.5910
 epoch: 29, train_loss: 0.6542, test_loss: 1.2347, test_f1: 0.5487
 epoch: 30, train_loss: 0.6460, test_loss: 1.1146, test_f1: 0.5868
 epoch: 31, train_loss: 0.6261, test_loss: 1.4074, test_f1: 0.5450
 epoch: 32, train_loss: 0.6231, test_loss: 1.1995, test_f1: 0.5737
 epoch: 33, train_loss: 0.5989, test_loss: 1.2152, test_f1: 0.6402
 epoch: 34, train_loss: 0.5714, test_loss: 1.2231, test_f1: 0.5870
 epoch: 35, train_loss: 0.5707, test_loss: 1.2347, test_f1: 0.6418
 epoch: 36, train_loss: 0.5729, test_loss: 1.4456, test_f1: 0.5537
 epoch: 37, train_loss: 0.5556, test_loss: 1.3727, test_f1: 0.5922
 epoch: 38, train_loss: 0.5816, test_loss: 1.3366, test_f1: 0.5785
 epoch: 39, train_loss: 0.5526, test_loss: 1.4855, test_f1: 0.5164
 epoch: 40, train_loss: 0.5506, test_loss: 1.4587, test_f1: 0.5846
 epoch: 41, train_loss: 0.5404, test_loss: 1.3363, test_f1: 0.5798
 epoch: 42, train_loss: 0.5189, test_loss: 1.3625, test_f1: 0.6100
 epoch: 43, train_loss: 0.5208, test_loss: 1.5121, test_f1: 0.5120
 epoch: 44, train_loss: 0.5066, test_loss: 1.2424, test_f1: 0.6305
 epoch: 45, train_loss: 0.5041, test_loss: 1.3151, test_f1: 0.6345
 epoch: 46, train_loss: 0.5049, test_loss: 1.4399, test_f1: 0.6153
 epoch: 47, train_loss: 0.4921, test_loss: 1.4133, test_f1: 0.6145
 epoch: 48, train_loss: 0.4713, test_loss: 1.6453, test_f1: 0.5009
 epoch: 49, train_loss: 0.4781, test_loss: 1.5464, test_f1: 0.5560
 epoch: 50, train_loss: 0.4892, test_loss: 1.5835, test_f1: 0.5665
 epoch: 51, train_loss: 0.4794, test_loss: 1.4427, test_f1: 0.5895
 epoch: 52, train_loss: 0.4274, test_loss: 1.5183, test_f1: 0.5809
 epoch: 53, train_loss: 0.3986, test_loss: 1.7374, test_f1: 0.5788
 epoch: 54, train_loss: 0.3918, test_loss: 1.5564, test_f1: 0.5836
 epoch: 55, train_loss: 0.4112, test_loss: 1.5413, test_f1: 0.5904
 epoch: 56, train_loss: 0.3987, test_loss: 1.6079, test_f1: 0.5835
 epoch: 57, train_loss: 0.3752, test_loss: 1.5796, test_f1: 0.5785
 epoch: 58, train_loss: 0.3807, test_loss: 1.5613, test_f1: 0.5964
 epoch: 59, train_loss: 0.3761, test_loss: 1.5457, test_f1: 0.5827
 epoch: 60, train_loss: 0.3811, test_loss: 1.5141, test_f1: 0.5859
 epoch: 61, train_loss: 0.3841, test_loss: 1.5294, test_f1: 0.5626
 epoch: 62, train_loss: 0.3737, test_loss: 1.5472, test_f1: 0.5604
 epoch: 63, train_loss: 0.3521, test_loss: 1.7056, test_f1: 0.5655
 epoch: 64, train_loss: 0.3523, test_loss: 1.7331, test_f1: 0.5811
 epoch: 65, train_loss: 0.3623, test_loss: 1.6935, test_f1: 0.5702
 epoch: 66, train_loss: 0.3483, test_loss: 1.8726, test_f1: 0.5494
 epoch: 67, train_loss: 0.3709, test_loss: 1.9836, test_f1: 0.5458
 epoch: 68, train_loss: 0.3258, test_loss: 2.0429, test_f1: 0.5622
 epoch: 69, train_loss: 0.3355, test_loss: 1.9834, test_f1: 0.5616
 epoch: 70, train_loss: 0.3476, test_loss: 2.0496, test_f1: 0.5992
 epoch: 71, train_loss: 0.3345, test_loss: 1.8477, test_f1: 0.5516
 epoch: 72, train_loss: 0.3341, test_loss: 2.0584, test_f1: 0.5605
 epoch: 73, train_loss: 0.3173, test_loss: 2.2141, test_f1: 0.5461
 epoch: 74, train_loss: 0.3511, test_loss: 2.0523, test_f1: 0.5351
 epoch: 75, train_loss: 0.3392, test_loss: 1.9633, test_f1: 0.5755
 epoch: 76, train_loss: 0.3342, test_loss: 1.9456, test_f1: 0.5632
 epoch: 77, train_loss: 0.3308, test_loss: 1.7075, test_f1: 0.5876
 epoch: 78, train_loss: 0.3364, test_loss: 1.7587, test_f1: 0.5802
 epoch: 79, train_loss: 0.2990, test_loss: 1.8324, test_f1: 0.5701
 epoch: 80, train_loss: 0.3244, test_loss: 1.8425, test_f1: 0.5700
 epoch: 81, train_loss: 0.2984, test_loss: 2.3500, test_f1: 0.5626
 epoch: 82, train_loss: 0.3288, test_loss: 2.1744, test_f1: 0.5574
 epoch: 83, train_loss: 0.3391, test_loss: 2.0531, test_f1: 0.5460
 epoch: 84, train_loss: 0.2964, test_loss: 1.9856, test_f1: 0.5482
 epoch: 85, train_loss: 0.2922, test_loss: 1.9030, test_f1: 0.5530
 epoch: 86, train_loss: 0.2941, test_loss: 2.2328, test_f1: 0.5520
 epoch: 87, train_loss: 0.3064, test_loss: 2.2532, test_f1: 0.5320
 epoch: 88, train_loss: 0.3422, test_loss: 2.0596, test_f1: 0.5656
 epoch: 89, train_loss: 0.3415, test_loss: 2.0056, test_f1: 0.5493
 epoch: 90, train_loss: 0.3144, test_loss: 1.9869, test_f1: 0.5384
 epoch: 91, train_loss: 0.3329, test_loss: 2.1423, test_f1: 0.5606
 epoch: 92, train_loss: 0.3064, test_loss: 2.0947, test_f1: 0.5626
 epoch: 93, train_loss: 0.2906, test_loss: 1.9869, test_f1: 0.5589
 epoch: 94, train_loss: 0.2841, test_loss: 1.9474, test_f1: 0.5670
 epoch: 95, train_loss: 0.2909, test_loss: 2.0274, test_f1: 0.5618
 epoch: 96, train_loss: 0.2918, test_loss: 1.9137, test_f1: 0.5849
 epoch: 97, train_loss: 0.3009, test_loss: 1.9716, test_f1: 0.5769
 epoch: 98, train_loss: 0.3030, test_loss: 1.9184, test_f1: 0.5607
 epoch: 99, train_loss: 0.2796, test_loss: 1.8192, test_f1: 0.5845
##################ITERATION #3 ****************************************
 epoch: 0, train_loss: 1.4018, test_loss: 1.4424, test_f1: 0.2227
 epoch: 1, train_loss: 1.1440, test_loss: 1.3544, test_f1: 0.1958
 epoch: 2, train_loss: 1.0916, test_loss: 1.2541, test_f1: 0.4143
 epoch: 3, train_loss: 1.0523, test_loss: 1.1943, test_f1: 0.5074
 epoch: 4, train_loss: 1.0310, test_loss: 1.1891, test_f1: 0.4938
 epoch: 5, train_loss: 0.9899, test_loss: 1.1624, test_f1: 0.5081
 epoch: 6, train_loss: 0.9787, test_loss: 1.1996, test_f1: 0.5180
 epoch: 7, train_loss: 0.9509, test_loss: 1.1738, test_f1: 0.5101
 epoch: 8, train_loss: 0.9423, test_loss: 1.2242, test_f1: 0.4859
 epoch: 9, train_loss: 0.9469, test_loss: 1.2299, test_f1: 0.5103
 epoch: 10, train_loss: 0.9217, test_loss: 1.2759, test_f1: 0.4631
 epoch: 11, train_loss: 0.9150, test_loss: 1.1831, test_f1: 0.5577
 epoch: 12, train_loss: 0.9017, test_loss: 1.1371, test_f1: 0.5615
 epoch: 13, train_loss: 0.9018, test_loss: 1.3062, test_f1: 0.4915
 epoch: 14, train_loss: 0.8965, test_loss: 1.2245, test_f1: 0.5025
 epoch: 15, train_loss: 0.8701, test_loss: 1.1842, test_f1: 0.5158
 epoch: 16, train_loss: 0.8590, test_loss: 1.1819, test_f1: 0.5202
 epoch: 17, train_loss: 0.8363, test_loss: 1.2607, test_f1: 0.5268
 epoch: 18, train_loss: 0.8276, test_loss: 1.2130, test_f1: 0.5112
 epoch: 19, train_loss: 0.8305, test_loss: 1.3218, test_f1: 0.4876
 epoch: 20, train_loss: 0.8109, test_loss: 1.1466, test_f1: 0.5631
 epoch: 21, train_loss: 0.8110, test_loss: 1.2193, test_f1: 0.4794
 epoch: 22, train_loss: 0.7860, test_loss: 1.2917, test_f1: 0.5239
 epoch: 23, train_loss: 0.7800, test_loss: 1.1118, test_f1: 0.5926
 epoch: 24, train_loss: 0.7739, test_loss: 1.2265, test_f1: 0.5976
 epoch: 25, train_loss: 0.7406, test_loss: 1.1913, test_f1: 0.5344
 epoch: 26, train_loss: 0.7375, test_loss: 1.3239, test_f1: 0.5900
 epoch: 27, train_loss: 0.7374, test_loss: 1.4072, test_f1: 0.4620
 epoch: 28, train_loss: 0.7212, test_loss: 1.3312, test_f1: 0.5136
 epoch: 29, train_loss: 0.7124, test_loss: 1.2955, test_f1: 0.5468
 epoch: 30, train_loss: 0.7153, test_loss: 1.2687, test_f1: 0.5954
 epoch: 31, train_loss: 0.6900, test_loss: 1.2766, test_f1: 0.5579
 epoch: 32, train_loss: 0.6816, test_loss: 1.4338, test_f1: 0.5367
 epoch: 33, train_loss: 0.6947, test_loss: 1.3049, test_f1: 0.5311
 epoch: 34, train_loss: 0.6810, test_loss: 1.3344, test_f1: 0.5626
 epoch: 35, train_loss: 0.6638, test_loss: 1.2777, test_f1: 0.5210
 epoch: 36, train_loss: 0.6746, test_loss: 1.2778, test_f1: 0.5652
 epoch: 37, train_loss: 0.6448, test_loss: 1.2543, test_f1: 0.5722
 epoch: 38, train_loss: 0.6597, test_loss: 1.4031, test_f1: 0.5408
 epoch: 39, train_loss: 0.6255, test_loss: 1.5428, test_f1: 0.5253
 epoch: 40, train_loss: 0.6861, test_loss: 1.5716, test_f1: 0.4880
 epoch: 41, train_loss: 0.6350, test_loss: 1.3402, test_f1: 0.5760
 epoch: 42, train_loss: 0.6191, test_loss: 1.7029, test_f1: 0.5126
 epoch: 43, train_loss: 0.6209, test_loss: 1.4122, test_f1: 0.5426
 epoch: 44, train_loss: 0.6048, test_loss: 1.4166, test_f1: 0.5734
 epoch: 45, train_loss: 0.5706, test_loss: 1.6482, test_f1: 0.5093
 epoch: 46, train_loss: 0.5904, test_loss: 1.4517, test_f1: 0.5660
 epoch: 47, train_loss: 0.5965, test_loss: 1.5136, test_f1: 0.5986
 epoch: 48, train_loss: 0.5958, test_loss: 1.6563, test_f1: 0.5916
 epoch: 49, train_loss: 0.5984, test_loss: 1.4844, test_f1: 0.5477
 epoch: 50, train_loss: 0.5870, test_loss: 1.4060, test_f1: 0.5519
 epoch: 51, train_loss: 0.5387, test_loss: 1.5559, test_f1: 0.5486
 epoch: 52, train_loss: 0.5202, test_loss: 1.5019, test_f1: 0.5872
 epoch: 53, train_loss: 0.5396, test_loss: 1.4394, test_f1: 0.5839
 epoch: 54, train_loss: 0.5097, test_loss: 1.5324, test_f1: 0.5976
 epoch: 55, train_loss: 0.4885, test_loss: 1.5502, test_f1: 0.5633
 epoch: 56, train_loss: 0.4841, test_loss: 1.5481, test_f1: 0.5691
 epoch: 57, train_loss: 0.4791, test_loss: 1.5498, test_f1: 0.5807
 epoch: 58, train_loss: 0.4758, test_loss: 1.7276, test_f1: 0.5826
 epoch: 59, train_loss: 0.4650, test_loss: 1.6188, test_f1: 0.5934
 epoch: 60, train_loss: 0.4641, test_loss: 1.7299, test_f1: 0.5583
 epoch: 61, train_loss: 0.4612, test_loss: 1.6104, test_f1: 0.6063
 epoch: 62, train_loss: 0.4853, test_loss: 1.6224, test_f1: 0.5630
 epoch: 63, train_loss: 0.4782, test_loss: 1.6548, test_f1: 0.5937
 epoch: 64, train_loss: 0.4772, test_loss: 1.7087, test_f1: 0.5587
 epoch: 65, train_loss: 0.4800, test_loss: 1.6496, test_f1: 0.5961
 epoch: 66, train_loss: 0.4626, test_loss: 1.6123, test_f1: 0.5767
 epoch: 67, train_loss: 0.4476, test_loss: 1.6207, test_f1: 0.5673
 epoch: 68, train_loss: 0.4378, test_loss: 1.7610, test_f1: 0.5677
 epoch: 69, train_loss: 0.4373, test_loss: 1.6917, test_f1: 0.5419
 epoch: 70, train_loss: 0.4536, test_loss: 1.8259, test_f1: 0.5367
 epoch: 71, train_loss: 0.4260, test_loss: 1.8557, test_f1: 0.5606
 epoch: 72, train_loss: 0.4514, test_loss: 1.9700, test_f1: 0.5830
 epoch: 73, train_loss: 0.4348, test_loss: 1.8607, test_f1: 0.5419
 epoch: 74, train_loss: 0.4032, test_loss: 1.7791, test_f1: 0.6064
 epoch: 75, train_loss: 0.4073, test_loss: 1.9502, test_f1: 0.5549
 epoch: 76, train_loss: 0.4098, test_loss: 1.8425, test_f1: 0.5942
 epoch: 77, train_loss: 0.3951, test_loss: 1.9362, test_f1: 0.5629
 epoch: 78, train_loss: 0.4111, test_loss: 2.0331, test_f1: 0.5498
 epoch: 79, train_loss: 0.4037, test_loss: 1.9633, test_f1: 0.5924
 epoch: 80, train_loss: 0.3978, test_loss: 1.8855, test_f1: 0.5820
 epoch: 81, train_loss: 0.3939, test_loss: 2.0061, test_f1: 0.5594
 epoch: 82, train_loss: 0.3912, test_loss: 2.0345, test_f1: 0.5810
 epoch: 83, train_loss: 0.4062, test_loss: 1.9268, test_f1: 0.5613
 epoch: 84, train_loss: 0.4376, test_loss: 2.0275, test_f1: 0.5737
 epoch: 85, train_loss: 0.4116, test_loss: 2.0752, test_f1: 0.5832
 epoch: 86, train_loss: 0.3836, test_loss: 2.0935, test_f1: 0.5642
 epoch: 87, train_loss: 0.3827, test_loss: 2.0180, test_f1: 0.5901
 epoch: 88, train_loss: 0.3696, test_loss: 2.1414, test_f1: 0.5640
 epoch: 89, train_loss: 0.3819, test_loss: 1.9110, test_f1: 0.5731
 epoch: 90, train_loss: 0.3659, test_loss: 2.1225, test_f1: 0.5962
 epoch: 91, train_loss: 0.3852, test_loss: 2.1479, test_f1: 0.5413
 epoch: 92, train_loss: 0.3881, test_loss: 2.3270, test_f1: 0.5809
 epoch: 93, train_loss: 0.3579, test_loss: 2.1029, test_f1: 0.5629
 epoch: 94, train_loss: 0.3744, test_loss: 2.1995, test_f1: 0.5487
 epoch: 95, train_loss: 0.3568, test_loss: 2.2028, test_f1: 0.5643
 epoch: 96, train_loss: 0.3598, test_loss: 2.0897, test_f1: 0.5728
 epoch: 97, train_loss: 0.3450, test_loss: 2.2953, test_f1: 0.5846
 epoch: 98, train_loss: 0.3741, test_loss: 2.4589, test_f1: 0.5466
 epoch: 99, train_loss: 0.3490, test_loss: 1.9724, test_f1: 0.6147
##################ITERATION #4 ****************************************
 epoch: 0, train_loss: 1.2966, test_loss: 1.3498, test_f1: 0.3026
 epoch: 1, train_loss: 1.1318, test_loss: 1.2806, test_f1: 0.3835
 epoch: 2, train_loss: 1.0449, test_loss: 1.2037, test_f1: 0.4652
 epoch: 3, train_loss: 1.0196, test_loss: 1.1833, test_f1: 0.4976
 epoch: 4, train_loss: 0.9671, test_loss: 1.1401, test_f1: 0.5217
 epoch: 5, train_loss: 0.9577, test_loss: 1.1330, test_f1: 0.5102
 epoch: 6, train_loss: 0.9286, test_loss: 1.1101, test_f1: 0.5473
 epoch: 7, train_loss: 0.8862, test_loss: 1.1369, test_f1: 0.5308
 epoch: 8, train_loss: 0.8858, test_loss: 1.1470, test_f1: 0.5419
 epoch: 9, train_loss: 0.8561, test_loss: 1.2295, test_f1: 0.5390
 epoch: 10, train_loss: 0.8369, test_loss: 1.2566, test_f1: 0.4941
 epoch: 11, train_loss: 0.8288, test_loss: 1.1854, test_f1: 0.5539
 epoch: 12, train_loss: 0.8111, test_loss: 1.1824, test_f1: 0.6011
 epoch: 13, train_loss: 0.8077, test_loss: 1.1240, test_f1: 0.5785
 epoch: 14, train_loss: 0.7698, test_loss: 1.3152, test_f1: 0.5684
 epoch: 15, train_loss: 0.7903, test_loss: 1.2920, test_f1: 0.5476
 epoch: 16, train_loss: 0.7420, test_loss: 1.1966, test_f1: 0.5786
 epoch: 17, train_loss: 0.7671, test_loss: 1.2895, test_f1: 0.5422
 epoch: 18, train_loss: 0.7579, test_loss: 1.3345, test_f1: 0.4907
 epoch: 19, train_loss: 0.7172, test_loss: 1.1965, test_f1: 0.5787
 epoch: 20, train_loss: 0.7024, test_loss: 1.2093, test_f1: 0.5815
 epoch: 21, train_loss: 0.6948, test_loss: 1.2544, test_f1: 0.5737
 epoch: 22, train_loss: 0.6987, test_loss: 1.2768, test_f1: 0.5647
 epoch: 23, train_loss: 0.6693, test_loss: 1.4882, test_f1: 0.5370
 epoch: 24, train_loss: 0.6935, test_loss: 1.2834, test_f1: 0.6112
 epoch: 25, train_loss: 0.6559, test_loss: 1.3797, test_f1: 0.5232
 epoch: 26, train_loss: 0.6330, test_loss: 1.5625, test_f1: 0.4671
 epoch: 27, train_loss: 0.6491, test_loss: 1.4057, test_f1: 0.5872
 epoch: 28, train_loss: 0.6421, test_loss: 1.7665, test_f1: 0.4632
 epoch: 29, train_loss: 0.6311, test_loss: 1.3715, test_f1: 0.5646
 epoch: 30, train_loss: 0.6184, test_loss: 1.3073, test_f1: 0.5675
 epoch: 31, train_loss: 0.6253, test_loss: 1.5673, test_f1: 0.5051
 epoch: 32, train_loss: 0.6131, test_loss: 1.6198, test_f1: 0.5982
 epoch: 33, train_loss: 0.5836, test_loss: 1.4375, test_f1: 0.5767
 epoch: 34, train_loss: 0.5956, test_loss: 1.3522, test_f1: 0.5588
 epoch: 35, train_loss: 0.5863, test_loss: 1.3270, test_f1: 0.5745
 epoch: 36, train_loss: 0.5710, test_loss: 1.4421, test_f1: 0.5647
 epoch: 37, train_loss: 0.5596, test_loss: 1.5630, test_f1: 0.5404
 epoch: 38, train_loss: 0.5528, test_loss: 1.4673, test_f1: 0.5737
 epoch: 39, train_loss: 0.5562, test_loss: 1.4736, test_f1: 0.5956
 epoch: 40, train_loss: 0.5895, test_loss: 1.5291, test_f1: 0.5822
 epoch: 41, train_loss: 0.5948, test_loss: 1.3690, test_f1: 0.5689
 epoch: 42, train_loss: 0.5259, test_loss: 1.3497, test_f1: 0.5467
 epoch: 43, train_loss: 0.5195, test_loss: 1.6859, test_f1: 0.5179
 epoch: 44, train_loss: 0.5334, test_loss: 1.4615, test_f1: 0.5756
 epoch: 45, train_loss: 0.5789, test_loss: 1.9064, test_f1: 0.5694
 epoch: 46, train_loss: 0.5387, test_loss: 1.6728, test_f1: 0.5633
 epoch: 47, train_loss: 0.5100, test_loss: 1.7181, test_f1: 0.5809
 epoch: 48, train_loss: 0.5051, test_loss: 1.5876, test_f1: 0.5820
 epoch: 49, train_loss: 0.4972, test_loss: 1.4595, test_f1: 0.5539
 epoch: 50, train_loss: 0.4957, test_loss: 1.8969, test_f1: 0.5552
 epoch: 51, train_loss: 0.4563, test_loss: 1.5370, test_f1: 0.5604
 epoch: 52, train_loss: 0.4329, test_loss: 1.5608, test_f1: 0.5694
 epoch: 53, train_loss: 0.4231, test_loss: 1.6679, test_f1: 0.5572
 epoch: 54, train_loss: 0.4404, test_loss: 1.7628, test_f1: 0.5594
 epoch: 55, train_loss: 0.4467, test_loss: 1.6244, test_f1: 0.5415
 epoch: 56, train_loss: 0.4414, test_loss: 1.7610, test_f1: 0.5389
 epoch: 57, train_loss: 0.4255, test_loss: 1.6742, test_f1: 0.5548
 epoch: 58, train_loss: 0.4059, test_loss: 1.7903, test_f1: 0.5463
 epoch: 59, train_loss: 0.3966, test_loss: 1.8972, test_f1: 0.5579
 epoch: 60, train_loss: 0.3972, test_loss: 1.9785, test_f1: 0.5689
 epoch: 61, train_loss: 0.4174, test_loss: 1.6449, test_f1: 0.5923
 epoch: 62, train_loss: 0.3909, test_loss: 2.0016, test_f1: 0.5660
 epoch: 63, train_loss: 0.4162, test_loss: 1.8696, test_f1: 0.5917
 epoch: 64, train_loss: 0.3806, test_loss: 1.8713, test_f1: 0.5469
 epoch: 65, train_loss: 0.3979, test_loss: 1.8022, test_f1: 0.5788
 epoch: 66, train_loss: 0.3710, test_loss: 1.9972, test_f1: 0.5729
 epoch: 67, train_loss: 0.4017, test_loss: 1.7674, test_f1: 0.5735
 epoch: 68, train_loss: 0.3900, test_loss: 1.9427, test_f1: 0.5336
 epoch: 69, train_loss: 0.3579, test_loss: 1.8781, test_f1: 0.5812
 epoch: 70, train_loss: 0.3799, test_loss: 1.9258, test_f1: 0.5599
 epoch: 71, train_loss: 0.3743, test_loss: 1.9415, test_f1: 0.5869
 epoch: 72, train_loss: 0.3773, test_loss: 2.0271, test_f1: 0.5406
 epoch: 73, train_loss: 0.3856, test_loss: 1.8804, test_f1: 0.5529
 epoch: 74, train_loss: 0.3776, test_loss: 1.9540, test_f1: 0.5731
 epoch: 75, train_loss: 0.3835, test_loss: 1.9592, test_f1: 0.6079
 epoch: 76, train_loss: 0.3588, test_loss: 2.0105, test_f1: 0.5634
 epoch: 77, train_loss: 0.3428, test_loss: 1.9103, test_f1: 0.5729
 epoch: 78, train_loss: 0.3456, test_loss: 2.0429, test_f1: 0.5609
 epoch: 79, train_loss: 0.3577, test_loss: 2.0120, test_f1: 0.5675
 epoch: 80, train_loss: 0.3268, test_loss: 2.1393, test_f1: 0.5934
 epoch: 81, train_loss: 0.3396, test_loss: 2.0346, test_f1: 0.5653
 epoch: 82, train_loss: 0.3332, test_loss: 2.0773, test_f1: 0.5806
 epoch: 83, train_loss: 0.3283, test_loss: 1.9738, test_f1: 0.5746
 epoch: 84, train_loss: 0.3369, test_loss: 2.1810, test_f1: 0.5574
 epoch: 85, train_loss: 0.3659, test_loss: 1.9728, test_f1: 0.6184
 epoch: 86, train_loss: 0.3531, test_loss: 2.1684, test_f1: 0.5542
 epoch: 87, train_loss: 0.3466, test_loss: 2.0686, test_f1: 0.5374
 epoch: 88, train_loss: 0.3300, test_loss: 2.1682, test_f1: 0.6098
 epoch: 89, train_loss: 0.3218, test_loss: 2.2740, test_f1: 0.5588
 epoch: 90, train_loss: 0.3480, test_loss: 2.0336, test_f1: 0.5822
 epoch: 91, train_loss: 0.3562, test_loss: 2.1800, test_f1: 0.5652
 epoch: 92, train_loss: 0.3237, test_loss: 2.1990, test_f1: 0.5557
 epoch: 93, train_loss: 0.3089, test_loss: 2.1925, test_f1: 0.5365
 epoch: 94, train_loss: 0.3142, test_loss: 2.1177, test_f1: 0.5886
 epoch: 95, train_loss: 0.3098, test_loss: 2.2755, test_f1: 0.5553
 epoch: 96, train_loss: 0.3189, test_loss: 2.0325, test_f1: 0.6018
 epoch: 97, train_loss: 0.3258, test_loss: 2.1321, test_f1: 0.5633
 epoch: 98, train_loss: 0.3084, test_loss: 2.1494, test_f1: 0.5683
 epoch: 99, train_loss: 0.3303, test_loss: 2.2327, test_f1: 0.5673
##################ITERATION #5 ****************************************
 epoch: 0, train_loss: 1.4074, test_loss: 1.4425, test_f1: 0.1395
 epoch: 1, train_loss: 1.1896, test_loss: 1.2864, test_f1: 0.2517
 epoch: 2, train_loss: 1.1267, test_loss: 1.2214, test_f1: 0.3499
 epoch: 3, train_loss: 1.0917, test_loss: 1.1652, test_f1: 0.4472
 epoch: 4, train_loss: 1.0418, test_loss: 1.1596, test_f1: 0.4839
 epoch: 5, train_loss: 1.0010, test_loss: 1.1661, test_f1: 0.4886
 epoch: 6, train_loss: 0.9894, test_loss: 1.1227, test_f1: 0.5169
 epoch: 7, train_loss: 0.9435, test_loss: 1.1658, test_f1: 0.5063
 epoch: 8, train_loss: 0.9380, test_loss: 1.2489, test_f1: 0.4744
 epoch: 9, train_loss: 0.9508, test_loss: 1.2449, test_f1: 0.5240
 epoch: 10, train_loss: 0.9223, test_loss: 1.3073, test_f1: 0.5309
 epoch: 11, train_loss: 0.9136, test_loss: 1.3152, test_f1: 0.5043
 epoch: 12, train_loss: 0.8957, test_loss: 1.2610, test_f1: 0.4933
 epoch: 13, train_loss: 0.8706, test_loss: 1.2816, test_f1: 0.5041
 epoch: 14, train_loss: 0.8573, test_loss: 1.2067, test_f1: 0.5872
 epoch: 15, train_loss: 0.8507, test_loss: 1.3103, test_f1: 0.5157
 epoch: 16, train_loss: 0.8280, test_loss: 1.2966, test_f1: 0.5172
 epoch: 17, train_loss: 0.7992, test_loss: 1.3220, test_f1: 0.5972
 epoch: 18, train_loss: 0.8177, test_loss: 1.3566, test_f1: 0.5145
 epoch: 19, train_loss: 0.8066, test_loss: 1.2618, test_f1: 0.5627
 epoch: 20, train_loss: 0.7978, test_loss: 1.3294, test_f1: 0.6003
 epoch: 21, train_loss: 0.8096, test_loss: 1.2908, test_f1: 0.5807
 epoch: 22, train_loss: 0.7902, test_loss: 1.2120, test_f1: 0.5968
 epoch: 23, train_loss: 0.7556, test_loss: 1.3152, test_f1: 0.5364
 epoch: 24, train_loss: 0.7450, test_loss: 1.3738, test_f1: 0.5647
 epoch: 25, train_loss: 0.7146, test_loss: 1.1942, test_f1: 0.6129
 epoch: 26, train_loss: 0.7252, test_loss: 1.4476, test_f1: 0.5467
 epoch: 27, train_loss: 0.7285, test_loss: 1.4853, test_f1: 0.5808
 epoch: 28, train_loss: 0.7147, test_loss: 1.3466, test_f1: 0.6038
 epoch: 29, train_loss: 0.6947, test_loss: 1.3625, test_f1: 0.5881
 epoch: 30, train_loss: 0.6823, test_loss: 1.6190, test_f1: 0.5496
 epoch: 31, train_loss: 0.6728, test_loss: 1.5772, test_f1: 0.5611
 epoch: 32, train_loss: 0.6678, test_loss: 1.4851, test_f1: 0.5704
 epoch: 33, train_loss: 0.6662, test_loss: 1.5075, test_f1: 0.5879
 epoch: 34, train_loss: 0.6339, test_loss: 1.3306, test_f1: 0.6208
 epoch: 35, train_loss: 0.6303, test_loss: 1.5999, test_f1: 0.5419
 epoch: 36, train_loss: 0.6307, test_loss: 1.4664, test_f1: 0.5818
 epoch: 37, train_loss: 0.6126, test_loss: 1.4096, test_f1: 0.5886
 epoch: 38, train_loss: 0.6201, test_loss: 1.6644, test_f1: 0.5881
 epoch: 39, train_loss: 0.6267, test_loss: 1.7446, test_f1: 0.5559
 epoch: 40, train_loss: 0.6254, test_loss: 1.6344, test_f1: 0.5748
 epoch: 41, train_loss: 0.6208, test_loss: 1.8931, test_f1: 0.5209
 epoch: 42, train_loss: 0.6036, test_loss: 1.6874, test_f1: 0.5738
 epoch: 43, train_loss: 0.5889, test_loss: 1.7431, test_f1: 0.5910
 epoch: 44, train_loss: 0.5746, test_loss: 1.7822, test_f1: 0.5695
 epoch: 45, train_loss: 0.5785, test_loss: 1.8877, test_f1: 0.5612
 epoch: 46, train_loss: 0.5771, test_loss: 1.6599, test_f1: 0.5808
 epoch: 47, train_loss: 0.5393, test_loss: 1.8518, test_f1: 0.5759
 epoch: 48, train_loss: 0.5490, test_loss: 2.1211, test_f1: 0.5616
 epoch: 49, train_loss: 0.5531, test_loss: 1.8972, test_f1: 0.5883
 epoch: 50, train_loss: 0.5338, test_loss: 1.9176, test_f1: 0.5897
 epoch: 51, train_loss: 0.5100, test_loss: 1.9074, test_f1: 0.5525
 epoch: 52, train_loss: 0.4972, test_loss: 1.9716, test_f1: 0.5988
 epoch: 53, train_loss: 0.4703, test_loss: 1.9569, test_f1: 0.5859
 epoch: 54, train_loss: 0.4588, test_loss: 2.0024, test_f1: 0.5967
 epoch: 55, train_loss: 0.4844, test_loss: 2.1500, test_f1: 0.6047
 epoch: 56, train_loss: 0.4510, test_loss: 2.1031, test_f1: 0.6179
 epoch: 57, train_loss: 0.4676, test_loss: 1.9507, test_f1: 0.6033
 epoch: 58, train_loss: 0.4497, test_loss: 2.0392, test_f1: 0.5996
 epoch: 59, train_loss: 0.4950, test_loss: 2.2114, test_f1: 0.5947
 epoch: 60, train_loss: 0.4529, test_loss: 2.1472, test_f1: 0.5877
 epoch: 61, train_loss: 0.4444, test_loss: 2.0619, test_f1: 0.5866
 epoch: 62, train_loss: 0.4332, test_loss: 2.0632, test_f1: 0.5885
 epoch: 63, train_loss: 0.4215, test_loss: 2.0562, test_f1: 0.6045
 epoch: 64, train_loss: 0.4248, test_loss: 2.1164, test_f1: 0.5632
 epoch: 65, train_loss: 0.4195, test_loss: 2.2279, test_f1: 0.5819
 epoch: 66, train_loss: 0.4204, test_loss: 2.0445, test_f1: 0.5786
 epoch: 67, train_loss: 0.3863, test_loss: 2.0998, test_f1: 0.5983
 epoch: 68, train_loss: 0.4370, test_loss: 2.3331, test_f1: 0.5618
 epoch: 69, train_loss: 0.4132, test_loss: 2.2331, test_f1: 0.5842
 epoch: 70, train_loss: 0.4017, test_loss: 2.1561, test_f1: 0.5978
 epoch: 71, train_loss: 0.4051, test_loss: 2.1788, test_f1: 0.5873
 epoch: 72, train_loss: 0.4103, test_loss: 2.4230, test_f1: 0.5929
 epoch: 73, train_loss: 0.4130, test_loss: 2.4447, test_f1: 0.5639
 epoch: 74, train_loss: 0.3856, test_loss: 2.5782, test_f1: 0.5715
 epoch: 75, train_loss: 0.3778, test_loss: 2.4959, test_f1: 0.5763
 epoch: 76, train_loss: 0.3782, test_loss: 2.7327, test_f1: 0.5856
 epoch: 77, train_loss: 0.3829, test_loss: 2.5679, test_f1: 0.5862
 epoch: 78, train_loss: 0.3729, test_loss: 2.4775, test_f1: 0.5837
 epoch: 79, train_loss: 0.3726, test_loss: 2.3618, test_f1: 0.6030
 epoch: 80, train_loss: 0.3699, test_loss: 2.4736, test_f1: 0.5766
 epoch: 81, train_loss: 0.3724, test_loss: 2.3600, test_f1: 0.6024
 epoch: 82, train_loss: 0.3793, test_loss: 2.4797, test_f1: 0.5750
 epoch: 83, train_loss: 0.3994, test_loss: 2.3220, test_f1: 0.5754
 epoch: 84, train_loss: 0.3712, test_loss: 2.4909, test_f1: 0.5915
 epoch: 85, train_loss: 0.3984, test_loss: 2.5566, test_f1: 0.5799
 epoch: 86, train_loss: 0.3593, test_loss: 2.5167, test_f1: 0.5762
 epoch: 87, train_loss: 0.3543, test_loss: 2.5597, test_f1: 0.5640
 epoch: 88, train_loss: 0.3501, test_loss: 2.5106, test_f1: 0.5756
 epoch: 89, train_loss: 0.3621, test_loss: 2.6837, test_f1: 0.5661
 epoch: 90, train_loss: 0.3134, test_loss: 2.4296, test_f1: 0.5930
 epoch: 91, train_loss: 0.3283, test_loss: 2.5640, test_f1: 0.5851
 epoch: 92, train_loss: 0.3296, test_loss: 2.9303, test_f1: 0.5845
 epoch: 93, train_loss: 0.3330, test_loss: 2.9866, test_f1: 0.5643
 epoch: 94, train_loss: 0.3435, test_loss: 2.7888, test_f1: 0.5845
 epoch: 95, train_loss: 0.3128, test_loss: 2.8160, test_f1: 0.5962
 epoch: 96, train_loss: 0.3167, test_loss: 2.7472, test_f1: 0.5836
 epoch: 97, train_loss: 0.3285, test_loss: 2.8662, test_f1: 0.5906
 epoch: 98, train_loss: 0.3411, test_loss: 2.7663, test_f1: 0.5653
 epoch: 99, train_loss: 0.3580, test_loss: 2.6583, test_f1: 0.5879
##################ITERATION #6 ****************************************
 epoch: 0, train_loss: 1.3993, test_loss: 1.6533, test_f1: 0.1365
 epoch: 1, train_loss: 1.1896, test_loss: 1.4801, test_f1: 0.2876
 epoch: 2, train_loss: 1.1175, test_loss: 1.3943, test_f1: 0.3359
 epoch: 3, train_loss: 1.0780, test_loss: 1.2944, test_f1: 0.4753
 epoch: 4, train_loss: 1.0466, test_loss: 1.2798, test_f1: 0.4684
 epoch: 5, train_loss: 0.9974, test_loss: 1.2154, test_f1: 0.4904
 epoch: 6, train_loss: 1.0029, test_loss: 1.2197, test_f1: 0.5294
 epoch: 7, train_loss: 0.9555, test_loss: 1.2761, test_f1: 0.5438
 epoch: 8, train_loss: 0.9454, test_loss: 1.1894, test_f1: 0.5463
 epoch: 9, train_loss: 0.9147, test_loss: 1.1535, test_f1: 0.5421
 epoch: 10, train_loss: 0.8975, test_loss: 1.1870, test_f1: 0.5861
 epoch: 11, train_loss: 0.8778, test_loss: 1.1618, test_f1: 0.5698
 epoch: 12, train_loss: 0.8628, test_loss: 1.0955, test_f1: 0.6338
 epoch: 13, train_loss: 0.8594, test_loss: 1.1305, test_f1: 0.5783
 epoch: 14, train_loss: 0.8323, test_loss: 1.1485, test_f1: 0.5974
 epoch: 15, train_loss: 0.8277, test_loss: 1.1396, test_f1: 0.5935
 epoch: 16, train_loss: 0.7809, test_loss: 1.1157, test_f1: 0.5666
 epoch: 17, train_loss: 0.8092, test_loss: 1.1910, test_f1: 0.5464
 epoch: 18, train_loss: 0.7856, test_loss: 1.0923, test_f1: 0.5897
 epoch: 19, train_loss: 0.7704, test_loss: 1.1397, test_f1: 0.5903
 epoch: 20, train_loss: 0.7493, test_loss: 1.2519, test_f1: 0.5406
 epoch: 21, train_loss: 0.7527, test_loss: 1.0855, test_f1: 0.6439
 epoch: 22, train_loss: 0.7503, test_loss: 1.1890, test_f1: 0.6259
 epoch: 23, train_loss: 0.7374, test_loss: 1.2598, test_f1: 0.5744
 epoch: 24, train_loss: 0.7008, test_loss: 1.1487, test_f1: 0.5647
 epoch: 25, train_loss: 0.6842, test_loss: 1.1573, test_f1: 0.6314
 epoch: 26, train_loss: 0.6974, test_loss: 1.1589, test_f1: 0.5799
 epoch: 27, train_loss: 0.6900, test_loss: 1.1915, test_f1: 0.6286
 epoch: 28, train_loss: 0.6574, test_loss: 1.2726, test_f1: 0.5513
 epoch: 29, train_loss: 0.6575, test_loss: 1.3139, test_f1: 0.5496
 epoch: 30, train_loss: 0.6445, test_loss: 1.1575, test_f1: 0.6470
 epoch: 31, train_loss: 0.6500, test_loss: 1.1987, test_f1: 0.6546
 epoch: 32, train_loss: 0.6260, test_loss: 1.4410, test_f1: 0.5577
 epoch: 33, train_loss: 0.6165, test_loss: 1.3338, test_f1: 0.6024
 epoch: 34, train_loss: 0.6085, test_loss: 1.3813, test_f1: 0.5686
 epoch: 35, train_loss: 0.5973, test_loss: 1.3486, test_f1: 0.6162
 epoch: 36, train_loss: 0.6082, test_loss: 1.4295, test_f1: 0.5578
 epoch: 37, train_loss: 0.5997, test_loss: 1.3699, test_f1: 0.5824
 epoch: 38, train_loss: 0.5611, test_loss: 1.3328, test_f1: 0.6108
 epoch: 39, train_loss: 0.5525, test_loss: 1.4822, test_f1: 0.6077
 epoch: 40, train_loss: 0.5476, test_loss: 1.4426, test_f1: 0.6042
 epoch: 41, train_loss: 0.5329, test_loss: 1.5557, test_f1: 0.5876
 epoch: 42, train_loss: 0.5260, test_loss: 1.5007, test_f1: 0.6275
 epoch: 43, train_loss: 0.5340, test_loss: 1.5119, test_f1: 0.6354
 epoch: 44, train_loss: 0.5368, test_loss: 1.4361, test_f1: 0.6125
 epoch: 45, train_loss: 0.5261, test_loss: 1.4773, test_f1: 0.5776
 epoch: 46, train_loss: 0.5250, test_loss: 1.5511, test_f1: 0.5984
 epoch: 47, train_loss: 0.4939, test_loss: 1.6189, test_f1: 0.5857
 epoch: 48, train_loss: 0.4864, test_loss: 1.5780, test_f1: 0.5515
 epoch: 49, train_loss: 0.5209, test_loss: 1.5949, test_f1: 0.6163
 epoch: 50, train_loss: 0.5011, test_loss: 1.6536, test_f1: 0.5888
 epoch: 51, train_loss: 0.4753, test_loss: 1.6636, test_f1: 0.6139
 epoch: 52, train_loss: 0.4321, test_loss: 1.6654, test_f1: 0.5799
 epoch: 53, train_loss: 0.4405, test_loss: 1.5963, test_f1: 0.5845
 epoch: 54, train_loss: 0.4255, test_loss: 1.6137, test_f1: 0.5988
 epoch: 55, train_loss: 0.4250, test_loss: 1.5903, test_f1: 0.6068
 epoch: 56, train_loss: 0.4064, test_loss: 1.6019, test_f1: 0.6116
 epoch: 57, train_loss: 0.4346, test_loss: 1.6736, test_f1: 0.5987
 epoch: 58, train_loss: 0.4261, test_loss: 1.7679, test_f1: 0.5530
 epoch: 59, train_loss: 0.4265, test_loss: 1.8010, test_f1: 0.6021
 epoch: 60, train_loss: 0.3891, test_loss: 1.8283, test_f1: 0.5827
 epoch: 61, train_loss: 0.4028, test_loss: 1.7794, test_f1: 0.5945
 epoch: 62, train_loss: 0.3963, test_loss: 1.8995, test_f1: 0.5800
 epoch: 63, train_loss: 0.3959, test_loss: 1.9156, test_f1: 0.6132
 epoch: 64, train_loss: 0.3828, test_loss: 1.9803, test_f1: 0.5865
 epoch: 65, train_loss: 0.3910, test_loss: 1.8260, test_f1: 0.6156
 epoch: 66, train_loss: 0.3684, test_loss: 1.8624, test_f1: 0.6042
 epoch: 67, train_loss: 0.3706, test_loss: 1.9087, test_f1: 0.5835
 epoch: 68, train_loss: 0.3638, test_loss: 1.8802, test_f1: 0.5881
 epoch: 69, train_loss: 0.3615, test_loss: 1.9824, test_f1: 0.6007
 epoch: 70, train_loss: 0.3591, test_loss: 2.1048, test_f1: 0.5788
 epoch: 71, train_loss: 0.3713, test_loss: 1.9834, test_f1: 0.5859
 epoch: 72, train_loss: 0.3601, test_loss: 2.0921, test_f1: 0.5977
 epoch: 73, train_loss: 0.3648, test_loss: 2.1304, test_f1: 0.6007
 epoch: 74, train_loss: 0.3728, test_loss: 1.9399, test_f1: 0.6270
 epoch: 75, train_loss: 0.3808, test_loss: 2.0055, test_f1: 0.6088
 epoch: 76, train_loss: 0.3474, test_loss: 2.0939, test_f1: 0.5771
 epoch: 77, train_loss: 0.3532, test_loss: 2.1036, test_f1: 0.5883
 epoch: 78, train_loss: 0.3154, test_loss: 2.0073, test_f1: 0.6006
 epoch: 79, train_loss: 0.3397, test_loss: 2.1054, test_f1: 0.5913
 epoch: 80, train_loss: 0.3563, test_loss: 2.0282, test_f1: 0.5811
 epoch: 81, train_loss: 0.3282, test_loss: 2.1262, test_f1: 0.5899
 epoch: 82, train_loss: 0.3204, test_loss: 2.0867, test_f1: 0.6014
 epoch: 83, train_loss: 0.3208, test_loss: 2.1452, test_f1: 0.5850
 epoch: 84, train_loss: 0.3205, test_loss: 2.1656, test_f1: 0.6103
 epoch: 85, train_loss: 0.3261, test_loss: 2.2518, test_f1: 0.5838
 epoch: 86, train_loss: 0.3281, test_loss: 2.0954, test_f1: 0.6153
 epoch: 87, train_loss: 0.3150, test_loss: 2.2947, test_f1: 0.5894
 epoch: 88, train_loss: 0.3124, test_loss: 2.2237, test_f1: 0.6059
 epoch: 89, train_loss: 0.2811, test_loss: 2.2158, test_f1: 0.6166
 epoch: 90, train_loss: 0.3293, test_loss: 2.3622, test_f1: 0.5868
 epoch: 91, train_loss: 0.3436, test_loss: 2.2531, test_f1: 0.5945
 epoch: 92, train_loss: 0.3285, test_loss: 2.1745, test_f1: 0.6204
 epoch: 93, train_loss: 0.3027, test_loss: 2.3367, test_f1: 0.5938
 epoch: 94, train_loss: 0.3235, test_loss: 2.2687, test_f1: 0.5936
 epoch: 95, train_loss: 0.3214, test_loss: 2.3400, test_f1: 0.5987
 epoch: 96, train_loss: 0.3157, test_loss: 2.3346, test_f1: 0.6002
 epoch: 97, train_loss: 0.2970, test_loss: 2.3662, test_f1: 0.6132
 epoch: 98, train_loss: 0.2994, test_loss: 2.4017, test_f1: 0.5707
 epoch: 99, train_loss: 0.2776, test_loss: 2.3152, test_f1: 0.6103
##################ITERATION #7 ****************************************
 epoch: 0, train_loss: 1.4450, test_loss: 1.3076, test_f1: 0.3238
 epoch: 1, train_loss: 1.1744, test_loss: 1.3012, test_f1: 0.4284
 epoch: 2, train_loss: 1.0803, test_loss: 1.2839, test_f1: 0.4841
 epoch: 3, train_loss: 1.0274, test_loss: 1.2846, test_f1: 0.5439
 epoch: 4, train_loss: 1.0008, test_loss: 1.2246, test_f1: 0.5382
 epoch: 5, train_loss: 0.9610, test_loss: 1.1052, test_f1: 0.5620
 epoch: 6, train_loss: 0.9578, test_loss: 1.1250, test_f1: 0.5636
 epoch: 7, train_loss: 0.9285, test_loss: 1.2872, test_f1: 0.5539
 epoch: 8, train_loss: 0.9031, test_loss: 1.2585, test_f1: 0.5639
 epoch: 9, train_loss: 0.8839, test_loss: 1.0575, test_f1: 0.5984
 epoch: 10, train_loss: 0.8688, test_loss: 1.0647, test_f1: 0.6268
 epoch: 11, train_loss: 0.8482, test_loss: 1.0799, test_f1: 0.5983
 epoch: 12, train_loss: 0.8493, test_loss: 1.1608, test_f1: 0.6088
 epoch: 13, train_loss: 0.8300, test_loss: 1.5057, test_f1: 0.5596
 epoch: 14, train_loss: 0.8044, test_loss: 1.3074, test_f1: 0.6006
 epoch: 15, train_loss: 0.8233, test_loss: 1.2565, test_f1: 0.6138
 epoch: 16, train_loss: 0.8007, test_loss: 1.1448, test_f1: 0.6065
 epoch: 17, train_loss: 0.7896, test_loss: 1.1207, test_f1: 0.6054
 epoch: 18, train_loss: 0.7754, test_loss: 1.2436, test_f1: 0.5577
 epoch: 19, train_loss: 0.7702, test_loss: 1.6592, test_f1: 0.5465
 epoch: 20, train_loss: 0.7391, test_loss: 1.3241, test_f1: 0.5688
 epoch: 21, train_loss: 0.7426, test_loss: 1.2674, test_f1: 0.5840
 epoch: 22, train_loss: 0.7249, test_loss: 1.3226, test_f1: 0.6207
 epoch: 23, train_loss: 0.7106, test_loss: 1.3698, test_f1: 0.5836
 epoch: 24, train_loss: 0.7104, test_loss: 1.4175, test_f1: 0.5696
 epoch: 25, train_loss: 0.7141, test_loss: 1.4273, test_f1: 0.5492
 epoch: 26, train_loss: 0.6902, test_loss: 1.4333, test_f1: 0.5779
 epoch: 27, train_loss: 0.6866, test_loss: 1.4937, test_f1: 0.5162
 epoch: 28, train_loss: 0.6706, test_loss: 1.4460, test_f1: 0.5782
 epoch: 29, train_loss: 0.6542, test_loss: 1.5337, test_f1: 0.5816
 epoch: 30, train_loss: 0.6610, test_loss: 1.3769, test_f1: 0.5263
 epoch: 31, train_loss: 0.6515, test_loss: 1.4046, test_f1: 0.5982
 epoch: 32, train_loss: 0.6327, test_loss: 1.4797, test_f1: 0.5808
 epoch: 33, train_loss: 0.6517, test_loss: 1.3759, test_f1: 0.5519
 epoch: 34, train_loss: 0.6196, test_loss: 1.6407, test_f1: 0.5600
 epoch: 35, train_loss: 0.6195, test_loss: 1.5050, test_f1: 0.5611
 epoch: 36, train_loss: 0.5942, test_loss: 1.4981, test_f1: 0.5957
 epoch: 37, train_loss: 0.5943, test_loss: 1.5747, test_f1: 0.5770
 epoch: 38, train_loss: 0.5818, test_loss: 1.4776, test_f1: 0.5927
 epoch: 39, train_loss: 0.5857, test_loss: 1.7389, test_f1: 0.5676
 epoch: 40, train_loss: 0.5984, test_loss: 1.6213, test_f1: 0.5682
 epoch: 41, train_loss: 0.5659, test_loss: 1.4740, test_f1: 0.6007
 epoch: 42, train_loss: 0.5882, test_loss: 1.5246, test_f1: 0.5964
 epoch: 43, train_loss: 0.5678, test_loss: 1.9561, test_f1: 0.5834
 epoch: 44, train_loss: 0.5493, test_loss: 1.7541, test_f1: 0.5782
 epoch: 45, train_loss: 0.5220, test_loss: 1.7325, test_f1: 0.5974
 epoch: 46, train_loss: 0.5344, test_loss: 1.7771, test_f1: 0.5721
 epoch: 47, train_loss: 0.5041, test_loss: 1.7208, test_f1: 0.5891
 epoch: 48, train_loss: 0.4916, test_loss: 1.9480, test_f1: 0.5731
 epoch: 49, train_loss: 0.5116, test_loss: 1.9903, test_f1: 0.5626
 epoch: 50, train_loss: 0.5055, test_loss: 1.8896, test_f1: 0.5532
 epoch: 51, train_loss: 0.4835, test_loss: 1.6719, test_f1: 0.6027
 epoch: 52, train_loss: 0.4909, test_loss: 1.8846, test_f1: 0.5696
 epoch: 53, train_loss: 0.4451, test_loss: 1.8514, test_f1: 0.5666
 epoch: 54, train_loss: 0.4446, test_loss: 1.8865, test_f1: 0.5669
 epoch: 55, train_loss: 0.4306, test_loss: 1.9769, test_f1: 0.5692
 epoch: 56, train_loss: 0.4183, test_loss: 2.0074, test_f1: 0.5464
 epoch: 57, train_loss: 0.4457, test_loss: 2.1715, test_f1: 0.5585
 epoch: 58, train_loss: 0.4151, test_loss: 2.1002, test_f1: 0.5551
 epoch: 59, train_loss: 0.4100, test_loss: 1.9682, test_f1: 0.5540
 epoch: 60, train_loss: 0.4158, test_loss: 2.1294, test_f1: 0.5498
 epoch: 61, train_loss: 0.4065, test_loss: 1.9068, test_f1: 0.5896
 epoch: 62, train_loss: 0.4333, test_loss: 2.0516, test_f1: 0.5516
 epoch: 63, train_loss: 0.4827, test_loss: 1.9165, test_f1: 0.5534
 epoch: 64, train_loss: 0.4563, test_loss: 1.8889, test_f1: 0.5655
 epoch: 65, train_loss: 0.4381, test_loss: 1.9759, test_f1: 0.5672
 epoch: 66, train_loss: 0.4318, test_loss: 1.9449, test_f1: 0.5641
 epoch: 67, train_loss: 0.4210, test_loss: 2.3052, test_f1: 0.5609
 epoch: 68, train_loss: 0.4001, test_loss: 2.0095, test_f1: 0.5705
 epoch: 69, train_loss: 0.3787, test_loss: 2.0650, test_f1: 0.5692
 epoch: 70, train_loss: 0.3903, test_loss: 1.9722, test_f1: 0.5771
 epoch: 71, train_loss: 0.3653, test_loss: 1.9991, test_f1: 0.5565
 epoch: 72, train_loss: 0.3909, test_loss: 1.9667, test_f1: 0.5686
 epoch: 73, train_loss: 0.3817, test_loss: 1.9474, test_f1: 0.6003
 epoch: 74, train_loss: 0.3527, test_loss: 1.9672, test_f1: 0.5636
 epoch: 75, train_loss: 0.3465, test_loss: 2.0779, test_f1: 0.5590
 epoch: 76, train_loss: 0.3259, test_loss: 2.1026, test_f1: 0.5790
 epoch: 77, train_loss: 0.3523, test_loss: 1.9143, test_f1: 0.5983
 epoch: 78, train_loss: 0.3421, test_loss: 2.2861, test_f1: 0.5638
 epoch: 79, train_loss: 0.3343, test_loss: 2.2882, test_f1: 0.5694
 epoch: 80, train_loss: 0.3275, test_loss: 2.4293, test_f1: 0.5485
 epoch: 81, train_loss: 0.3462, test_loss: 2.2790, test_f1: 0.5639
 epoch: 82, train_loss: 0.3220, test_loss: 2.3184, test_f1: 0.5849
 epoch: 83, train_loss: 0.3201, test_loss: 2.3627, test_f1: 0.5796
 epoch: 84, train_loss: 0.3248, test_loss: 2.0384, test_f1: 0.5941
 epoch: 85, train_loss: 0.3114, test_loss: 2.2103, test_f1: 0.5778
 epoch: 86, train_loss: 0.3242, test_loss: 2.2972, test_f1: 0.5790
 epoch: 87, train_loss: 0.3358, test_loss: 2.2476, test_f1: 0.5838
 epoch: 88, train_loss: 0.3252, test_loss: 2.2570, test_f1: 0.5835
 epoch: 89, train_loss: 0.3358, test_loss: 2.2519, test_f1: 0.6105
 epoch: 90, train_loss: 0.3648, test_loss: 2.1098, test_f1: 0.5763
 epoch: 91, train_loss: 0.3059, test_loss: 2.1118, test_f1: 0.5847
 epoch: 92, train_loss: 0.2903, test_loss: 2.1689, test_f1: 0.6112
 epoch: 93, train_loss: 0.3265, test_loss: 2.2632, test_f1: 0.5784
 epoch: 94, train_loss: 0.3088, test_loss: 2.0779, test_f1: 0.6125
 epoch: 95, train_loss: 0.3105, test_loss: 2.1768, test_f1: 0.5977
 epoch: 96, train_loss: 0.3144, test_loss: 2.1828, test_f1: 0.5977
 epoch: 97, train_loss: 0.3008, test_loss: 2.5449, test_f1: 0.5975
 epoch: 98, train_loss: 0.2932, test_loss: 2.1497, test_f1: 0.6071
 epoch: 99, train_loss: 0.3016, test_loss: 2.3186, test_f1: 0.5874
##################ITERATION #8 ****************************************
 epoch: 0, train_loss: 1.5353, test_loss: 1.3507, test_f1: 0.3317
 epoch: 1, train_loss: 1.2199, test_loss: 1.3535, test_f1: 0.3651
 epoch: 2, train_loss: 1.1304, test_loss: 1.3055, test_f1: 0.4399
 epoch: 3, train_loss: 1.0921, test_loss: 1.2485, test_f1: 0.5496
 epoch: 4, train_loss: 1.0323, test_loss: 1.1866, test_f1: 0.5631
 epoch: 5, train_loss: 0.9904, test_loss: 1.1949, test_f1: 0.5826
 epoch: 6, train_loss: 0.9743, test_loss: 1.1204, test_f1: 0.5831
 epoch: 7, train_loss: 0.9564, test_loss: 1.1294, test_f1: 0.6156
 epoch: 8, train_loss: 0.9239, test_loss: 1.1434, test_f1: 0.5970
 epoch: 9, train_loss: 0.9304, test_loss: 1.1606, test_f1: 0.5687
 epoch: 10, train_loss: 0.8835, test_loss: 1.1837, test_f1: 0.6086
 epoch: 11, train_loss: 0.8702, test_loss: 1.0757, test_f1: 0.5950
 epoch: 12, train_loss: 0.8754, test_loss: 1.1062, test_f1: 0.5621
 epoch: 13, train_loss: 0.8418, test_loss: 1.2253, test_f1: 0.5490
 epoch: 14, train_loss: 0.8369, test_loss: 1.1569, test_f1: 0.5992
 epoch: 15, train_loss: 0.8290, test_loss: 1.1637, test_f1: 0.5748
 epoch: 16, train_loss: 0.7922, test_loss: 1.1777, test_f1: 0.6087
 epoch: 17, train_loss: 0.7873, test_loss: 1.1418, test_f1: 0.6168
 epoch: 18, train_loss: 0.7827, test_loss: 1.1114, test_f1: 0.5869
 epoch: 19, train_loss: 0.7555, test_loss: 1.1416, test_f1: 0.5897
 epoch: 20, train_loss: 0.7580, test_loss: 1.2012, test_f1: 0.6109
 epoch: 21, train_loss: 0.7542, test_loss: 1.2121, test_f1: 0.5870
 epoch: 22, train_loss: 0.7672, test_loss: 1.1460, test_f1: 0.5773
 epoch: 23, train_loss: 0.7295, test_loss: 1.1895, test_f1: 0.5798
 epoch: 24, train_loss: 0.7310, test_loss: 1.1755, test_f1: 0.5865
 epoch: 25, train_loss: 0.7169, test_loss: 1.1895, test_f1: 0.6114
 epoch: 26, train_loss: 0.6843, test_loss: 1.2377, test_f1: 0.5681
 epoch: 27, train_loss: 0.6995, test_loss: 1.1805, test_f1: 0.6191
 epoch: 28, train_loss: 0.6934, test_loss: 1.1723, test_f1: 0.5896
 epoch: 29, train_loss: 0.6838, test_loss: 1.2242, test_f1: 0.6012
 epoch: 30, train_loss: 0.6569, test_loss: 1.3472, test_f1: 0.5867
 epoch: 31, train_loss: 0.6801, test_loss: 1.2456, test_f1: 0.5777
 epoch: 32, train_loss: 0.6382, test_loss: 1.2302, test_f1: 0.6023
 epoch: 33, train_loss: 0.6499, test_loss: 1.1571, test_f1: 0.5908
 epoch: 34, train_loss: 0.6474, test_loss: 1.1794, test_f1: 0.6222
 epoch: 35, train_loss: 0.6614, test_loss: 1.4651, test_f1: 0.5758
 epoch: 36, train_loss: 0.6224, test_loss: 1.1935, test_f1: 0.5935
 epoch: 37, train_loss: 0.6336, test_loss: 1.3185, test_f1: 0.5780
 epoch: 38, train_loss: 0.6332, test_loss: 1.3124, test_f1: 0.5869
 epoch: 39, train_loss: 0.6197, test_loss: 1.3597, test_f1: 0.5410
 epoch: 40, train_loss: 0.5971, test_loss: 1.3388, test_f1: 0.5851
 epoch: 41, train_loss: 0.5879, test_loss: 1.2364, test_f1: 0.6033
 epoch: 42, train_loss: 0.5802, test_loss: 1.2219, test_f1: 0.6509
 epoch: 43, train_loss: 0.5985, test_loss: 1.4877, test_f1: 0.5538
 epoch: 44, train_loss: 0.5509, test_loss: 1.5117, test_f1: 0.5488
 epoch: 45, train_loss: 0.5514, test_loss: 1.3964, test_f1: 0.5889
 epoch: 46, train_loss: 0.5405, test_loss: 1.6379, test_f1: 0.5738
 epoch: 47, train_loss: 0.5373, test_loss: 1.3136, test_f1: 0.5938
 epoch: 48, train_loss: 0.5316, test_loss: 1.5594, test_f1: 0.5539
 epoch: 49, train_loss: 0.5588, test_loss: 1.3880, test_f1: 0.5683
 epoch: 50, train_loss: 0.5378, test_loss: 1.8969, test_f1: 0.5419
 epoch: 51, train_loss: 0.5342, test_loss: 1.5792, test_f1: 0.5800
 epoch: 52, train_loss: 0.4851, test_loss: 1.5451, test_f1: 0.5797
 epoch: 53, train_loss: 0.4751, test_loss: 1.5538, test_f1: 0.5735
 epoch: 54, train_loss: 0.4919, test_loss: 1.6407, test_f1: 0.5700
 epoch: 55, train_loss: 0.4697, test_loss: 1.5347, test_f1: 0.5743
 epoch: 56, train_loss: 0.4634, test_loss: 1.5615, test_f1: 0.5805
 epoch: 57, train_loss: 0.4380, test_loss: 1.6015, test_f1: 0.5619
 epoch: 58, train_loss: 0.4561, test_loss: 1.5841, test_f1: 0.5686
 epoch: 59, train_loss: 0.4388, test_loss: 1.6538, test_f1: 0.5492
 epoch: 60, train_loss: 0.4489, test_loss: 1.8327, test_f1: 0.5514
 epoch: 61, train_loss: 0.4469, test_loss: 1.7205, test_f1: 0.5615
 epoch: 62, train_loss: 0.4480, test_loss: 1.7057, test_f1: 0.5522
 epoch: 63, train_loss: 0.4437, test_loss: 1.7339, test_f1: 0.5720
 epoch: 64, train_loss: 0.4347, test_loss: 1.6614, test_f1: 0.5763
 epoch: 65, train_loss: 0.4326, test_loss: 1.8919, test_f1: 0.5620
 epoch: 66, train_loss: 0.4422, test_loss: 1.8330, test_f1: 0.5742
 epoch: 67, train_loss: 0.4311, test_loss: 1.7102, test_f1: 0.5763
 epoch: 68, train_loss: 0.4284, test_loss: 1.8454, test_f1: 0.5573
 epoch: 69, train_loss: 0.4257, test_loss: 2.0226, test_f1: 0.5751
 epoch: 70, train_loss: 0.4052, test_loss: 1.8519, test_f1: 0.5807
 epoch: 71, train_loss: 0.4196, test_loss: 2.0541, test_f1: 0.5341
 epoch: 72, train_loss: 0.4030, test_loss: 2.1132, test_f1: 0.5672
 epoch: 73, train_loss: 0.3833, test_loss: 2.0334, test_f1: 0.5506
 epoch: 74, train_loss: 0.4005, test_loss: 2.0533, test_f1: 0.5705
 epoch: 75, train_loss: 0.3876, test_loss: 2.0036, test_f1: 0.5870
 epoch: 76, train_loss: 0.4050, test_loss: 1.9496, test_f1: 0.5692
 epoch: 77, train_loss: 0.3776, test_loss: 2.2189, test_f1: 0.5527
 epoch: 78, train_loss: 0.3956, test_loss: 1.8563, test_f1: 0.5464
 epoch: 79, train_loss: 0.3989, test_loss: 1.8567, test_f1: 0.5697
 epoch: 80, train_loss: 0.4259, test_loss: 2.0266, test_f1: 0.5772
 epoch: 81, train_loss: 0.4218, test_loss: 1.8288, test_f1: 0.5927
 epoch: 82, train_loss: 0.4080, test_loss: 1.9648, test_f1: 0.5505
 epoch: 83, train_loss: 0.3996, test_loss: 1.8389, test_f1: 0.5763
 epoch: 84, train_loss: 0.3643, test_loss: 1.9333, test_f1: 0.5502
 epoch: 85, train_loss: 0.3509, test_loss: 2.0002, test_f1: 0.5769
 epoch: 86, train_loss: 0.4036, test_loss: 1.8964, test_f1: 0.5877
 epoch: 87, train_loss: 0.3649, test_loss: 1.8798, test_f1: 0.5801
 epoch: 88, train_loss: 0.3477, test_loss: 2.1170, test_f1: 0.5775
 epoch: 89, train_loss: 0.3933, test_loss: 2.2962, test_f1: 0.5580
 epoch: 90, train_loss: 0.3512, test_loss: 2.2656, test_f1: 0.5371
 epoch: 91, train_loss: 0.3594, test_loss: 2.1451, test_f1: 0.5655
 epoch: 92, train_loss: 0.3675, test_loss: 2.0683, test_f1: 0.5658
 epoch: 93, train_loss: 0.3321, test_loss: 2.2834, test_f1: 0.5636
 epoch: 94, train_loss: 0.3479, test_loss: 2.0012, test_f1: 0.5466
 epoch: 95, train_loss: 0.3347, test_loss: 2.1017, test_f1: 0.5754
 epoch: 96, train_loss: 0.3296, test_loss: 2.3299, test_f1: 0.5734
 epoch: 97, train_loss: 0.3244, test_loss: 2.4734, test_f1: 0.5724
 epoch: 98, train_loss: 0.3314, test_loss: 2.4824, test_f1: 0.5731
 epoch: 99, train_loss: 0.4234, test_loss: 2.7060, test_f1: 0.5754
##################ITERATION #9 ****************************************
 epoch: 0, train_loss: 1.5497, test_loss: 1.4772, test_f1: 0.2126
 epoch: 1, train_loss: 1.2270, test_loss: 1.4015, test_f1: 0.2983
 epoch: 2, train_loss: 1.1451, test_loss: 1.3383, test_f1: 0.3500
 epoch: 3, train_loss: 1.1037, test_loss: 1.2197, test_f1: 0.5087
 epoch: 4, train_loss: 1.0648, test_loss: 1.1915, test_f1: 0.5163
 epoch: 5, train_loss: 1.0321, test_loss: 1.1778, test_f1: 0.5198
 epoch: 6, train_loss: 1.0049, test_loss: 1.1504, test_f1: 0.5293
 epoch: 7, train_loss: 0.9924, test_loss: 1.1121, test_f1: 0.5683
 epoch: 8, train_loss: 0.9501, test_loss: 1.1320, test_f1: 0.5276
 epoch: 9, train_loss: 0.9290, test_loss: 1.1875, test_f1: 0.5626
 epoch: 10, train_loss: 0.9152, test_loss: 1.1347, test_f1: 0.5592
 epoch: 11, train_loss: 0.8898, test_loss: 1.1253, test_f1: 0.5512
 epoch: 12, train_loss: 0.8767, test_loss: 1.1666, test_f1: 0.5511
 epoch: 13, train_loss: 0.8659, test_loss: 1.0772, test_f1: 0.6003
 epoch: 14, train_loss: 0.8304, test_loss: 1.1680, test_f1: 0.5704
 epoch: 15, train_loss: 0.8176, test_loss: 1.0781, test_f1: 0.5742
 epoch: 16, train_loss: 0.8090, test_loss: 1.2152, test_f1: 0.5410
 epoch: 17, train_loss: 0.8070, test_loss: 1.1743, test_f1: 0.5578
 epoch: 18, train_loss: 0.8070, test_loss: 1.0506, test_f1: 0.5868
 epoch: 19, train_loss: 0.7690, test_loss: 1.1530, test_f1: 0.5267
 epoch: 20, train_loss: 0.7646, test_loss: 1.1508, test_f1: 0.5958
 epoch: 21, train_loss: 0.7463, test_loss: 1.1643, test_f1: 0.5862
 epoch: 22, train_loss: 0.7335, test_loss: 1.1376, test_f1: 0.5986
 epoch: 23, train_loss: 0.7198, test_loss: 1.1762, test_f1: 0.5651
 epoch: 24, train_loss: 0.7091, test_loss: 1.2712, test_f1: 0.5539
 epoch: 25, train_loss: 0.6785, test_loss: 1.2356, test_f1: 0.5581
 epoch: 26, train_loss: 0.6920, test_loss: 1.2346, test_f1: 0.5594
 epoch: 27, train_loss: 0.6816, test_loss: 1.1846, test_f1: 0.5720
 epoch: 28, train_loss: 0.6539, test_loss: 1.2784, test_f1: 0.5793
 epoch: 29, train_loss: 0.6508, test_loss: 1.2532, test_f1: 0.5614
 epoch: 30, train_loss: 0.6470, test_loss: 1.3025, test_f1: 0.5438
 epoch: 31, train_loss: 0.6508, test_loss: 1.5069, test_f1: 0.5414
 epoch: 32, train_loss: 0.6301, test_loss: 1.2819, test_f1: 0.5996
 epoch: 33, train_loss: 0.6068, test_loss: 1.4044, test_f1: 0.5302
 epoch: 34, train_loss: 0.5988, test_loss: 1.5600, test_f1: 0.5043
 epoch: 35, train_loss: 0.6042, test_loss: 1.4353, test_f1: 0.5628
 epoch: 36, train_loss: 0.5846, test_loss: 1.5080, test_f1: 0.5386
 epoch: 37, train_loss: 0.5691, test_loss: 1.4004, test_f1: 0.5656
 epoch: 38, train_loss: 0.5862, test_loss: 1.3968, test_f1: 0.5599
 epoch: 39, train_loss: 0.5512, test_loss: 1.3441, test_f1: 0.5957
 epoch: 40, train_loss: 0.5581, test_loss: 1.4293, test_f1: 0.5372
 epoch: 41, train_loss: 0.5873, test_loss: 1.5090, test_f1: 0.5331
 epoch: 42, train_loss: 0.5456, test_loss: 1.5686, test_f1: 0.5810
 epoch: 43, train_loss: 0.5796, test_loss: 1.4204, test_f1: 0.5677
 epoch: 44, train_loss: 0.5425, test_loss: 1.4580, test_f1: 0.5622
 epoch: 45, train_loss: 0.5337, test_loss: 1.4922, test_f1: 0.5759
 epoch: 46, train_loss: 0.5143, test_loss: 1.4259, test_f1: 0.5610
 epoch: 47, train_loss: 0.4808, test_loss: 1.6278, test_f1: 0.5363
 epoch: 48, train_loss: 0.4967, test_loss: 1.7537, test_f1: 0.5871
 epoch: 49, train_loss: 0.4756, test_loss: 1.7050, test_f1: 0.5550
 epoch: 50, train_loss: 0.4768, test_loss: 1.7171, test_f1: 0.5187
 epoch: 51, train_loss: 0.4584, test_loss: 1.6844, test_f1: 0.5432
 epoch: 52, train_loss: 0.4467, test_loss: 1.7079, test_f1: 0.5480
 epoch: 53, train_loss: 0.4455, test_loss: 1.6360, test_f1: 0.5458
 epoch: 54, train_loss: 0.4205, test_loss: 1.5969, test_f1: 0.5528
 epoch: 55, train_loss: 0.4419, test_loss: 1.6348, test_f1: 0.5577
 epoch: 56, train_loss: 0.4225, test_loss: 1.6800, test_f1: 0.5502
 epoch: 57, train_loss: 0.4129, test_loss: 1.6284, test_f1: 0.5653
 epoch: 58, train_loss: 0.4042, test_loss: 1.7086, test_f1: 0.5263
 epoch: 59, train_loss: 0.4392, test_loss: 1.8393, test_f1: 0.5344
 epoch: 60, train_loss: 0.3998, test_loss: 1.7080, test_f1: 0.5291
 epoch: 61, train_loss: 0.3870, test_loss: 1.6799, test_f1: 0.5582
 epoch: 62, train_loss: 0.3876, test_loss: 1.6543, test_f1: 0.5419
 epoch: 63, train_loss: 0.4025, test_loss: 1.7573, test_f1: 0.5421
 epoch: 64, train_loss: 0.4047, test_loss: 1.8719, test_f1: 0.5178
 epoch: 65, train_loss: 0.3851, test_loss: 1.7748, test_f1: 0.5452
 epoch: 66, train_loss: 0.3766, test_loss: 1.6876, test_f1: 0.5674
 epoch: 67, train_loss: 0.3755, test_loss: 1.8400, test_f1: 0.5480
 epoch: 68, train_loss: 0.3492, test_loss: 1.7471, test_f1: 0.5737
 epoch: 69, train_loss: 0.3739, test_loss: 1.7340, test_f1: 0.5813
 epoch: 70, train_loss: 0.3724, test_loss: 1.7267, test_f1: 0.5709
 epoch: 71, train_loss: 0.3790, test_loss: 1.8878, test_f1: 0.5486
 epoch: 72, train_loss: 0.3614, test_loss: 1.8268, test_f1: 0.5580
 epoch: 73, train_loss: 0.3746, test_loss: 1.8078, test_f1: 0.5502
 epoch: 74, train_loss: 0.3613, test_loss: 1.8154, test_f1: 0.5454
 epoch: 75, train_loss: 0.3565, test_loss: 1.8737, test_f1: 0.5568
 epoch: 76, train_loss: 0.3686, test_loss: 1.7719, test_f1: 0.5521
 epoch: 77, train_loss: 0.3548, test_loss: 1.8233, test_f1: 0.5800
 epoch: 78, train_loss: 0.3504, test_loss: 1.8692, test_f1: 0.5724
 epoch: 79, train_loss: 0.3458, test_loss: 1.7990, test_f1: 0.5701
 epoch: 80, train_loss: 0.3367, test_loss: 1.8748, test_f1: 0.5817
 epoch: 81, train_loss: 0.3477, test_loss: 2.1021, test_f1: 0.5478
 epoch: 82, train_loss: 0.3343, test_loss: 1.9675, test_f1: 0.5665
 epoch: 83, train_loss: 0.3303, test_loss: 1.8911, test_f1: 0.5600
 epoch: 84, train_loss: 0.3223, test_loss: 1.8540, test_f1: 0.5783
 epoch: 85, train_loss: 0.3373, test_loss: 2.0175, test_f1: 0.5518
 epoch: 86, train_loss: 0.3342, test_loss: 1.9519, test_f1: 0.5428
 epoch: 87, train_loss: 0.3246, test_loss: 1.9125, test_f1: 0.5507
 epoch: 88, train_loss: 0.3094, test_loss: 1.9191, test_f1: 0.5591
 epoch: 89, train_loss: 0.2833, test_loss: 2.0888, test_f1: 0.5517
 epoch: 90, train_loss: 0.3146, test_loss: 2.0483, test_f1: 0.5464
 epoch: 91, train_loss: 0.3214, test_loss: 2.0333, test_f1: 0.5625
 epoch: 92, train_loss: 0.3206, test_loss: 1.9555, test_f1: 0.5717
 epoch: 93, train_loss: 0.3437, test_loss: 1.9468, test_f1: 0.5641
 epoch: 94, train_loss: 0.3341, test_loss: 2.0602, test_f1: 0.5528
 epoch: 95, train_loss: 0.3067, test_loss: 1.9728, test_f1: 0.5817
 epoch: 96, train_loss: 0.3280, test_loss: 2.0932, test_f1: 0.5689
 epoch: 97, train_loss: 0.2906, test_loss: 1.8974, test_f1: 0.5599
 epoch: 98, train_loss: 0.2876, test_loss: 1.9851, test_f1: 0.5491
 epoch: 99, train_loss: 0.3016, test_loss: 1.9363, test_f1: 0.5458

Training completed in 309.76 seconds
Best F1: 0.6546 at epoch 31
Mean F1 across iterations: 0.6279  0.0177
========================FINAL RESULTS================================
FEGIN weighted F1: 0.6546  0.0177
python main.py --data ltspice_demos --representation component_component --model FEGIN --layers 2 --hiddens 64 --batch_size 128 --lr 0.001 --emb_size 250 --epochs 100 --save_appendix component_component_L2_H64_BS128_LR0.001_E250 --no_val
-----



STDERR:
  File "main.py", line 370, in <module>
    main()
  File "main.py", line 254, in main
    dataset = dataset_class(
  File "/home/philip/projects/ltspice_examples_code_repo/Circuit-Completion-Using-GNNs/component_classification_with_link_prediction_head/evaluation/FEGIN/kernel/circuit_datasets.py", line 15, in __init__
    self.data, self.slices = torch.load(self.processed_paths[0])
  File "/home/philip/.local/lib/python3.8/site-packages/torch/serialization.py", line 1040, in load
    warnings.warn(
  File "/usr/lib/python3.8/warnings.py", line 109, in _showwarnmsg
    sw(msg.message, msg.category, msg.filename, msg.lineno,
  File "main.py", line 47, in warn_with_traceback
    traceback.print_stack(file=log)
/home/philip/projects/ltspice_examples_code_repo/Circuit-Completion-Using-GNNs/component_classification_with_link_prediction_head/evaluation/FEGIN/kernel/circuit_datasets.py:15: FutureWarning: You are using `torch.load` with `weights_only=False` (the current default value), which uses the default pickle module implicitly. It is possible to construct malicious pickle data which will execute arbitrary code during unpickling (See https://github.com/pytorch/pytorch/blob/main/SECURITY.md#untrusted-models for more details). In a future release, the default value for `weights_only` will be flipped to `True`. This limits the functions that could be executed during unpickling. Arbitrary objects will no longer be allowed to be loaded via this mode unless they are explicitly allowlisted by the user via `torch.serialization.add_safe_globals`. We recommend you start setting `weights_only=True` for any use case where you don't have full control of the loaded file. Please open an issue on GitHub for any issues related to this experimental feature.
  self.data, self.slices = torch.load(self.processed_paths[0])
