STDOUT:
Results will be saved in /home/philip/projects/ltspice_examples_code_repo/Circuit-Completion-Using-GNNs/component_classification_with_link_prediction_head/evaluation/FEGIN/results/model_FEGIN_dataset_ltspice_demos
Command line input: python main.py --data ltspice_demos --representation component_component --model FEGIN --layers 5 --hiddens 32 --batch_size 32 --lr 0.0001 --emb_size 512 --epochs 100 --save_appendix component_component_L5_H32_BS32_LR0.0001_E512 --no_val
 is saved.
-----
ltspice_demos - FEGIN
Using 5 layers, 32 hidden units, h = 2
Loading component_component representation dataset
ENTERED
Training FEGIN on component_component representation
Train: 1565, Test: 383
##################ITERATION #0 ****************************************
 epoch: 0, train_loss: 1.3601, test_loss: 1.3600, test_f1: 0.2281
 epoch: 1, train_loss: 1.3496, test_loss: 1.3541, test_f1: 0.2281
 epoch: 2, train_loss: 1.3410, test_loss: 1.3461, test_f1: 0.2281
 epoch: 3, train_loss: 1.3326, test_loss: 1.3399, test_f1: 0.2281
 epoch: 4, train_loss: 1.3221, test_loss: 1.3302, test_f1: 0.2281
 epoch: 5, train_loss: 1.3105, test_loss: 1.3223, test_f1: 0.2281
 epoch: 6, train_loss: 1.2996, test_loss: 1.3098, test_f1: 0.2281
 epoch: 7, train_loss: 1.2859, test_loss: 1.3017, test_f1: 0.2281
 epoch: 8, train_loss: 1.2735, test_loss: 1.2919, test_f1: 0.2281
 epoch: 9, train_loss: 1.2597, test_loss: 1.2833, test_f1: 0.2281
 epoch: 10, train_loss: 1.2451, test_loss: 1.2745, test_f1: 0.2281
 epoch: 11, train_loss: 1.2351, test_loss: 1.2695, test_f1: 0.2281
 epoch: 12, train_loss: 1.2258, test_loss: 1.2633, test_f1: 0.2281
 epoch: 13, train_loss: 1.2155, test_loss: 1.2640, test_f1: 0.2281
 epoch: 14, train_loss: 1.2058, test_loss: 1.2608, test_f1: 0.2281
 epoch: 15, train_loss: 1.2040, test_loss: 1.2564, test_f1: 0.2281
 epoch: 16, train_loss: 1.1914, test_loss: 1.2566, test_f1: 0.2337
 epoch: 17, train_loss: 1.1888, test_loss: 1.2581, test_f1: 0.2692
 epoch: 18, train_loss: 1.1830, test_loss: 1.2567, test_f1: 0.2640
 epoch: 19, train_loss: 1.1838, test_loss: 1.2511, test_f1: 0.3113
 epoch: 20, train_loss: 1.1726, test_loss: 1.2579, test_f1: 0.3155
 epoch: 21, train_loss: 1.1746, test_loss: 1.2559, test_f1: 0.3050
 epoch: 22, train_loss: 1.1745, test_loss: 1.2551, test_f1: 0.3123
 epoch: 23, train_loss: 1.1586, test_loss: 1.2568, test_f1: 0.3053
 epoch: 24, train_loss: 1.1598, test_loss: 1.2576, test_f1: 0.3034
 epoch: 25, train_loss: 1.1583, test_loss: 1.2563, test_f1: 0.3204
 epoch: 26, train_loss: 1.1608, test_loss: 1.2559, test_f1: 0.3017
 epoch: 27, train_loss: 1.1507, test_loss: 1.2602, test_f1: 0.3379
 epoch: 28, train_loss: 1.1475, test_loss: 1.2496, test_f1: 0.3312
 epoch: 29, train_loss: 1.1474, test_loss: 1.2516, test_f1: 0.3221
 epoch: 30, train_loss: 1.1403, test_loss: 1.2508, test_f1: 0.3374
 epoch: 31, train_loss: 1.1418, test_loss: 1.2412, test_f1: 0.3465
 epoch: 32, train_loss: 1.1351, test_loss: 1.2428, test_f1: 0.3474
 epoch: 33, train_loss: 1.1357, test_loss: 1.2442, test_f1: 0.3446
 epoch: 34, train_loss: 1.1275, test_loss: 1.2551, test_f1: 0.3307
 epoch: 35, train_loss: 1.1233, test_loss: 1.2441, test_f1: 0.3203
 epoch: 36, train_loss: 1.1218, test_loss: 1.2461, test_f1: 0.3409
 epoch: 37, train_loss: 1.1120, test_loss: 1.2375, test_f1: 0.3281
 epoch: 38, train_loss: 1.1253, test_loss: 1.2372, test_f1: 0.3154
 epoch: 39, train_loss: 1.1200, test_loss: 1.2513, test_f1: 0.3295
 epoch: 40, train_loss: 1.1177, test_loss: 1.2400, test_f1: 0.3420
 epoch: 41, train_loss: 1.1009, test_loss: 1.2453, test_f1: 0.3543
 epoch: 42, train_loss: 1.1115, test_loss: 1.2377, test_f1: 0.3801
 epoch: 43, train_loss: 1.1026, test_loss: 1.2263, test_f1: 0.3899
 epoch: 44, train_loss: 1.0984, test_loss: 1.2314, test_f1: 0.3996
 epoch: 45, train_loss: 1.0933, test_loss: 1.2315, test_f1: 0.4078
 epoch: 46, train_loss: 1.0990, test_loss: 1.2251, test_f1: 0.4190
 epoch: 47, train_loss: 1.0952, test_loss: 1.2319, test_f1: 0.4052
 epoch: 48, train_loss: 1.0883, test_loss: 1.2302, test_f1: 0.4204
 epoch: 49, train_loss: 1.0885, test_loss: 1.2344, test_f1: 0.4090
 epoch: 50, train_loss: 1.0746, test_loss: 1.2404, test_f1: 0.4145
 epoch: 51, train_loss: 1.0706, test_loss: 1.2331, test_f1: 0.4245
 epoch: 52, train_loss: 1.0827, test_loss: 1.2270, test_f1: 0.4161
 epoch: 53, train_loss: 1.0794, test_loss: 1.2254, test_f1: 0.4234
 epoch: 54, train_loss: 1.0708, test_loss: 1.2226, test_f1: 0.4293
 epoch: 55, train_loss: 1.0695, test_loss: 1.2338, test_f1: 0.4155
 epoch: 56, train_loss: 1.0669, test_loss: 1.2123, test_f1: 0.4111
 epoch: 57, train_loss: 1.0710, test_loss: 1.2315, test_f1: 0.4277
 epoch: 58, train_loss: 1.0651, test_loss: 1.2275, test_f1: 0.4261
 epoch: 59, train_loss: 1.0698, test_loss: 1.2301, test_f1: 0.4251
 epoch: 60, train_loss: 1.0668, test_loss: 1.2450, test_f1: 0.4249
 epoch: 61, train_loss: 1.0577, test_loss: 1.2296, test_f1: 0.4456
 epoch: 62, train_loss: 1.0593, test_loss: 1.2133, test_f1: 0.4421
 epoch: 63, train_loss: 1.0598, test_loss: 1.2450, test_f1: 0.4350
 epoch: 64, train_loss: 1.0583, test_loss: 1.2276, test_f1: 0.4374
 epoch: 65, train_loss: 1.0430, test_loss: 1.2448, test_f1: 0.4375
 epoch: 66, train_loss: 1.0651, test_loss: 1.2193, test_f1: 0.4397
 epoch: 67, train_loss: 1.0503, test_loss: 1.2332, test_f1: 0.4375
 epoch: 68, train_loss: 1.0465, test_loss: 1.2199, test_f1: 0.4555
 epoch: 69, train_loss: 1.0526, test_loss: 1.2252, test_f1: 0.4650
 epoch: 70, train_loss: 1.0440, test_loss: 1.2262, test_f1: 0.4590
 epoch: 71, train_loss: 1.0328, test_loss: 1.2391, test_f1: 0.4779
 epoch: 72, train_loss: 1.0487, test_loss: 1.2191, test_f1: 0.4692
 epoch: 73, train_loss: 1.0432, test_loss: 1.2209, test_f1: 0.4712
 epoch: 74, train_loss: 1.0454, test_loss: 1.2137, test_f1: 0.5096
 epoch: 75, train_loss: 1.0341, test_loss: 1.2410, test_f1: 0.4873
 epoch: 76, train_loss: 1.0354, test_loss: 1.2291, test_f1: 0.5001
 epoch: 77, train_loss: 1.0308, test_loss: 1.2293, test_f1: 0.4997
 epoch: 78, train_loss: 1.0367, test_loss: 1.2253, test_f1: 0.5026
 epoch: 79, train_loss: 1.0265, test_loss: 1.2097, test_f1: 0.5030
 epoch: 80, train_loss: 1.0277, test_loss: 1.2101, test_f1: 0.4853
 epoch: 81, train_loss: 1.0306, test_loss: 1.2126, test_f1: 0.5148
 epoch: 82, train_loss: 1.0202, test_loss: 1.2137, test_f1: 0.5150
 epoch: 83, train_loss: 1.0367, test_loss: 1.2281, test_f1: 0.5107
 epoch: 84, train_loss: 1.0223, test_loss: 1.2383, test_f1: 0.5117
 epoch: 85, train_loss: 1.0269, test_loss: 1.2423, test_f1: 0.5066
 epoch: 86, train_loss: 1.0244, test_loss: 1.2160, test_f1: 0.5179
 epoch: 87, train_loss: 1.0342, test_loss: 1.2292, test_f1: 0.5192
 epoch: 88, train_loss: 1.0045, test_loss: 1.2202, test_f1: 0.5166
 epoch: 89, train_loss: 1.0192, test_loss: 1.2457, test_f1: 0.5193
 epoch: 90, train_loss: 1.0047, test_loss: 1.2411, test_f1: 0.5353
 epoch: 91, train_loss: 1.0050, test_loss: 1.2335, test_f1: 0.5297
 epoch: 92, train_loss: 1.0083, test_loss: 1.2354, test_f1: 0.5270
 epoch: 93, train_loss: 0.9991, test_loss: 1.2333, test_f1: 0.5232
 epoch: 94, train_loss: 1.0117, test_loss: 1.2507, test_f1: 0.5330
 epoch: 95, train_loss: 1.0059, test_loss: 1.2248, test_f1: 0.5308
 epoch: 96, train_loss: 1.0088, test_loss: 1.2260, test_f1: 0.5370
 epoch: 97, train_loss: 1.0039, test_loss: 1.2331, test_f1: 0.5335
 epoch: 98, train_loss: 1.0048, test_loss: 1.2402, test_f1: 0.5349
 epoch: 99, train_loss: 0.9969, test_loss: 1.2241, test_f1: 0.5538
##################ITERATION #1 ****************************************
 epoch: 0, train_loss: 1.3191, test_loss: 1.3757, test_f1: 0.2281
 epoch: 1, train_loss: 1.2935, test_loss: 1.4089, test_f1: 0.2281
 epoch: 2, train_loss: 1.2781, test_loss: 1.3768, test_f1: 0.2281
 epoch: 3, train_loss: 1.2597, test_loss: 1.3637, test_f1: 0.2281
 epoch: 4, train_loss: 1.2475, test_loss: 1.3789, test_f1: 0.2281
 epoch: 5, train_loss: 1.2326, test_loss: 1.3630, test_f1: 0.2281
 epoch: 6, train_loss: 1.2238, test_loss: 1.3359, test_f1: 0.2281
 epoch: 7, train_loss: 1.2181, test_loss: 1.3279, test_f1: 0.2281
 epoch: 8, train_loss: 1.2116, test_loss: 1.3331, test_f1: 0.2281
 epoch: 9, train_loss: 1.2089, test_loss: 1.3304, test_f1: 0.2281
 epoch: 10, train_loss: 1.2028, test_loss: 1.3247, test_f1: 0.2281
 epoch: 11, train_loss: 1.1985, test_loss: 1.3019, test_f1: 0.2281
 epoch: 12, train_loss: 1.1836, test_loss: 1.3019, test_f1: 0.2325
 epoch: 13, train_loss: 1.1831, test_loss: 1.2972, test_f1: 0.2544
 epoch: 14, train_loss: 1.1812, test_loss: 1.2930, test_f1: 0.2325
 epoch: 15, train_loss: 1.1831, test_loss: 1.2949, test_f1: 0.2314
 epoch: 16, train_loss: 1.1777, test_loss: 1.2772, test_f1: 0.2337
 epoch: 17, train_loss: 1.1768, test_loss: 1.2641, test_f1: 0.2337
 epoch: 18, train_loss: 1.1700, test_loss: 1.2773, test_f1: 0.2325
 epoch: 19, train_loss: 1.1728, test_loss: 1.2633, test_f1: 0.2314
 epoch: 20, train_loss: 1.1595, test_loss: 1.2910, test_f1: 0.2527
 epoch: 21, train_loss: 1.1499, test_loss: 1.2799, test_f1: 0.2359
 epoch: 22, train_loss: 1.1619, test_loss: 1.2861, test_f1: 0.2546
 epoch: 23, train_loss: 1.1481, test_loss: 1.2810, test_f1: 0.2733
 epoch: 24, train_loss: 1.1477, test_loss: 1.2910, test_f1: 0.2960
 epoch: 25, train_loss: 1.1423, test_loss: 1.2700, test_f1: 0.2721
 epoch: 26, train_loss: 1.1507, test_loss: 1.2959, test_f1: 0.2923
 epoch: 27, train_loss: 1.1314, test_loss: 1.2561, test_f1: 0.2978
 epoch: 28, train_loss: 1.1333, test_loss: 1.2387, test_f1: 0.2957
 epoch: 29, train_loss: 1.1329, test_loss: 1.2503, test_f1: 0.3001
 epoch: 30, train_loss: 1.1334, test_loss: 1.2583, test_f1: 0.3089
 epoch: 31, train_loss: 1.1232, test_loss: 1.2697, test_f1: 0.3258
 epoch: 32, train_loss: 1.1234, test_loss: 1.2636, test_f1: 0.3261
 epoch: 33, train_loss: 1.1169, test_loss: 1.2635, test_f1: 0.3444
 epoch: 34, train_loss: 1.1186, test_loss: 1.2566, test_f1: 0.3255
 epoch: 35, train_loss: 1.1127, test_loss: 1.2539, test_f1: 0.3464
 epoch: 36, train_loss: 1.1029, test_loss: 1.2506, test_f1: 0.3296
 epoch: 37, train_loss: 1.0983, test_loss: 1.2527, test_f1: 0.3605
 epoch: 38, train_loss: 1.0871, test_loss: 1.2508, test_f1: 0.3506
 epoch: 39, train_loss: 1.0900, test_loss: 1.2317, test_f1: 0.3407
 epoch: 40, train_loss: 1.0911, test_loss: 1.2815, test_f1: 0.3524
 epoch: 41, train_loss: 1.0772, test_loss: 1.2649, test_f1: 0.3613
 epoch: 42, train_loss: 1.0788, test_loss: 1.3078, test_f1: 0.3625
 epoch: 43, train_loss: 1.0756, test_loss: 1.3251, test_f1: 0.3662
 epoch: 44, train_loss: 1.0682, test_loss: 1.3593, test_f1: 0.3817
 epoch: 45, train_loss: 1.0649, test_loss: 1.3059, test_f1: 0.3892
 epoch: 46, train_loss: 1.0605, test_loss: 1.2629, test_f1: 0.4041
 epoch: 47, train_loss: 1.0750, test_loss: 1.3357, test_f1: 0.3676
 epoch: 48, train_loss: 1.0607, test_loss: 1.3014, test_f1: 0.3877
 epoch: 49, train_loss: 1.0479, test_loss: 1.2881, test_f1: 0.4123
 epoch: 50, train_loss: 1.0461, test_loss: 1.3939, test_f1: 0.4498
 epoch: 51, train_loss: 1.0336, test_loss: 1.3448, test_f1: 0.4233
 epoch: 52, train_loss: 1.0358, test_loss: 1.3262, test_f1: 0.4393
 epoch: 53, train_loss: 1.0480, test_loss: 1.3035, test_f1: 0.3954
 epoch: 54, train_loss: 1.0521, test_loss: 1.3603, test_f1: 0.3831
 epoch: 55, train_loss: 1.0448, test_loss: 1.3266, test_f1: 0.4101
 epoch: 56, train_loss: 1.0396, test_loss: 1.3308, test_f1: 0.4098
 epoch: 57, train_loss: 1.0358, test_loss: 1.3727, test_f1: 0.3999
 epoch: 58, train_loss: 1.0401, test_loss: 1.3526, test_f1: 0.4042
 epoch: 59, train_loss: 1.0404, test_loss: 1.3813, test_f1: 0.4169
 epoch: 60, train_loss: 1.0325, test_loss: 1.3538, test_f1: 0.3885
 epoch: 61, train_loss: 1.0402, test_loss: 1.2748, test_f1: 0.4022
 epoch: 62, train_loss: 1.0238, test_loss: 1.3534, test_f1: 0.3994
 epoch: 63, train_loss: 1.0235, test_loss: 1.3457, test_f1: 0.4302
 epoch: 64, train_loss: 1.0341, test_loss: 1.3623, test_f1: 0.4264
 epoch: 65, train_loss: 1.0240, test_loss: 1.3086, test_f1: 0.3979
 epoch: 66, train_loss: 1.0138, test_loss: 1.3523, test_f1: 0.3973
 epoch: 67, train_loss: 1.0316, test_loss: 1.2812, test_f1: 0.4598
 epoch: 68, train_loss: 1.0288, test_loss: 1.3083, test_f1: 0.4115
 epoch: 69, train_loss: 1.0042, test_loss: 1.3050, test_f1: 0.4448
 epoch: 70, train_loss: 1.0176, test_loss: 1.3595, test_f1: 0.4038
 epoch: 71, train_loss: 1.0060, test_loss: 1.3351, test_f1: 0.4052
 epoch: 72, train_loss: 1.0157, test_loss: 1.3169, test_f1: 0.4297
 epoch: 73, train_loss: 1.0055, test_loss: 1.3519, test_f1: 0.4632
 epoch: 74, train_loss: 1.0106, test_loss: 1.3512, test_f1: 0.4545
 epoch: 75, train_loss: 1.0201, test_loss: 1.3235, test_f1: 0.4920
 epoch: 76, train_loss: 1.0093, test_loss: 1.2693, test_f1: 0.4535
 epoch: 77, train_loss: 1.0132, test_loss: 1.2867, test_f1: 0.4443
 epoch: 78, train_loss: 1.0101, test_loss: 1.3800, test_f1: 0.4575
 epoch: 79, train_loss: 0.9970, test_loss: 1.3351, test_f1: 0.4937
 epoch: 80, train_loss: 0.9980, test_loss: 1.3527, test_f1: 0.5036
 epoch: 81, train_loss: 1.0104, test_loss: 1.3484, test_f1: 0.4923
 epoch: 82, train_loss: 0.9914, test_loss: 1.2832, test_f1: 0.4837
 epoch: 83, train_loss: 1.0014, test_loss: 1.3495, test_f1: 0.4819
 epoch: 84, train_loss: 1.0024, test_loss: 1.2329, test_f1: 0.5188
 epoch: 85, train_loss: 0.9918, test_loss: 1.3092, test_f1: 0.4916
 epoch: 86, train_loss: 1.0044, test_loss: 1.3165, test_f1: 0.5201
 epoch: 87, train_loss: 0.9938, test_loss: 1.3753, test_f1: 0.4999
 epoch: 88, train_loss: 0.9845, test_loss: 1.3148, test_f1: 0.5113
 epoch: 89, train_loss: 0.9914, test_loss: 1.3596, test_f1: 0.5059
 epoch: 90, train_loss: 0.9821, test_loss: 1.3058, test_f1: 0.5265
 epoch: 91, train_loss: 0.9942, test_loss: 1.3929, test_f1: 0.5074
 epoch: 92, train_loss: 0.9895, test_loss: 1.2749, test_f1: 0.5269
 epoch: 93, train_loss: 0.9779, test_loss: 1.3693, test_f1: 0.5342
 epoch: 94, train_loss: 0.9837, test_loss: 1.2781, test_f1: 0.5209
 epoch: 95, train_loss: 0.9713, test_loss: 1.3400, test_f1: 0.5264
 epoch: 96, train_loss: 0.9731, test_loss: 1.3587, test_f1: 0.5105
 epoch: 97, train_loss: 0.9708, test_loss: 1.3744, test_f1: 0.4928
 epoch: 98, train_loss: 0.9882, test_loss: 1.3960, test_f1: 0.5115
 epoch: 99, train_loss: 0.9849, test_loss: 1.4216, test_f1: 0.5246
##################ITERATION #2 ****************************************
 epoch: 0, train_loss: 1.2910, test_loss: 1.3230, test_f1: 0.2281
 epoch: 1, train_loss: 1.2720, test_loss: 1.3947, test_f1: 0.2311
 epoch: 2, train_loss: 1.2594, test_loss: 1.4252, test_f1: 0.2270
 epoch: 3, train_loss: 1.2500, test_loss: 1.4165, test_f1: 0.2274
 epoch: 4, train_loss: 1.2379, test_loss: 1.4223, test_f1: 0.2281
 epoch: 5, train_loss: 1.2344, test_loss: 1.4020, test_f1: 0.2289
 epoch: 6, train_loss: 1.2240, test_loss: 1.4059, test_f1: 0.2281
 epoch: 7, train_loss: 1.2243, test_loss: 1.4589, test_f1: 0.2561
 epoch: 8, train_loss: 1.2192, test_loss: 1.3591, test_f1: 0.2285
 epoch: 9, train_loss: 1.2081, test_loss: 1.4423, test_f1: 0.2285
 epoch: 10, train_loss: 1.2127, test_loss: 1.4715, test_f1: 0.2272
 epoch: 11, train_loss: 1.2050, test_loss: 1.3542, test_f1: 0.2458
 epoch: 12, train_loss: 1.2049, test_loss: 1.4004, test_f1: 0.2462
 epoch: 13, train_loss: 1.1938, test_loss: 1.4703, test_f1: 0.2454
 epoch: 14, train_loss: 1.1871, test_loss: 1.3806, test_f1: 0.2545
 epoch: 15, train_loss: 1.1860, test_loss: 1.3072, test_f1: 0.2675
 epoch: 16, train_loss: 1.1811, test_loss: 1.3629, test_f1: 0.2687
 epoch: 17, train_loss: 1.1768, test_loss: 1.4092, test_f1: 0.3053
 epoch: 18, train_loss: 1.1787, test_loss: 1.3115, test_f1: 0.3211
 epoch: 19, train_loss: 1.1613, test_loss: 1.4121, test_f1: 0.3298
 epoch: 20, train_loss: 1.1642, test_loss: 1.3472, test_f1: 0.3448
 epoch: 21, train_loss: 1.1518, test_loss: 1.3365, test_f1: 0.3626
 epoch: 22, train_loss: 1.1522, test_loss: 1.3351, test_f1: 0.3599
 epoch: 23, train_loss: 1.1511, test_loss: 1.3769, test_f1: 0.3679
 epoch: 24, train_loss: 1.1478, test_loss: 1.3577, test_f1: 0.3733
 epoch: 25, train_loss: 1.1403, test_loss: 1.3305, test_f1: 0.4025
 epoch: 26, train_loss: 1.1355, test_loss: 1.3696, test_f1: 0.3947
 epoch: 27, train_loss: 1.1301, test_loss: 1.3681, test_f1: 0.4259
 epoch: 28, train_loss: 1.1261, test_loss: 1.2756, test_f1: 0.4343
 epoch: 29, train_loss: 1.1180, test_loss: 1.3150, test_f1: 0.4296
 epoch: 30, train_loss: 1.1170, test_loss: 1.3579, test_f1: 0.4355
 epoch: 31, train_loss: 1.1044, test_loss: 1.3369, test_f1: 0.4324
 epoch: 32, train_loss: 1.1103, test_loss: 1.3126, test_f1: 0.4310
 epoch: 33, train_loss: 1.0986, test_loss: 1.3692, test_f1: 0.4342
 epoch: 34, train_loss: 1.0985, test_loss: 1.2638, test_f1: 0.4395
 epoch: 35, train_loss: 1.0913, test_loss: 1.2631, test_f1: 0.4231
 epoch: 36, train_loss: 1.0852, test_loss: 1.4095, test_f1: 0.4337
 epoch: 37, train_loss: 1.0859, test_loss: 1.3873, test_f1: 0.4402
 epoch: 38, train_loss: 1.0856, test_loss: 1.4037, test_f1: 0.4555
 epoch: 39, train_loss: 1.0725, test_loss: 1.4116, test_f1: 0.4454
 epoch: 40, train_loss: 1.0710, test_loss: 1.3481, test_f1: 0.4433
 epoch: 41, train_loss: 1.0774, test_loss: 1.2908, test_f1: 0.4458
 epoch: 42, train_loss: 1.0657, test_loss: 1.3573, test_f1: 0.4543
 epoch: 43, train_loss: 1.0538, test_loss: 1.3614, test_f1: 0.4599
 epoch: 44, train_loss: 1.0604, test_loss: 1.3199, test_f1: 0.4373
 epoch: 45, train_loss: 1.0613, test_loss: 1.3551, test_f1: 0.4468
 epoch: 46, train_loss: 1.0471, test_loss: 1.3527, test_f1: 0.4447
 epoch: 47, train_loss: 1.0563, test_loss: 1.2718, test_f1: 0.4496
 epoch: 48, train_loss: 1.0507, test_loss: 1.3758, test_f1: 0.4404
 epoch: 49, train_loss: 1.0444, test_loss: 1.3648, test_f1: 0.4527
 epoch: 50, train_loss: 1.0342, test_loss: 1.5206, test_f1: 0.4604
 epoch: 51, train_loss: 1.0379, test_loss: 1.3953, test_f1: 0.4593
 epoch: 52, train_loss: 1.0319, test_loss: 1.3710, test_f1: 0.4536
 epoch: 53, train_loss: 1.0286, test_loss: 1.3043, test_f1: 0.4677
 epoch: 54, train_loss: 1.0498, test_loss: 1.4460, test_f1: 0.4748
 epoch: 55, train_loss: 1.0236, test_loss: 1.3183, test_f1: 0.4661
 epoch: 56, train_loss: 1.0329, test_loss: 1.3442, test_f1: 0.4588
 epoch: 57, train_loss: 1.0136, test_loss: 1.4169, test_f1: 0.4624
 epoch: 58, train_loss: 1.0228, test_loss: 1.4182, test_f1: 0.4613
 epoch: 59, train_loss: 1.0257, test_loss: 1.3257, test_f1: 0.4592
 epoch: 60, train_loss: 1.0205, test_loss: 1.3787, test_f1: 0.4863
 epoch: 61, train_loss: 1.0205, test_loss: 1.2824, test_f1: 0.4890
 epoch: 62, train_loss: 1.0186, test_loss: 1.3879, test_f1: 0.4667
 epoch: 63, train_loss: 1.0237, test_loss: 1.3771, test_f1: 0.4901
 epoch: 64, train_loss: 1.0231, test_loss: 1.3578, test_f1: 0.5011
 epoch: 65, train_loss: 1.0223, test_loss: 1.4000, test_f1: 0.5074
 epoch: 66, train_loss: 1.0096, test_loss: 1.3921, test_f1: 0.5050
 epoch: 67, train_loss: 1.0116, test_loss: 1.2940, test_f1: 0.5240
 epoch: 68, train_loss: 1.0108, test_loss: 1.4224, test_f1: 0.5030
 epoch: 69, train_loss: 1.0080, test_loss: 1.3099, test_f1: 0.4984
 epoch: 70, train_loss: 1.0195, test_loss: 1.3970, test_f1: 0.5110
 epoch: 71, train_loss: 0.9982, test_loss: 1.3964, test_f1: 0.5171
 epoch: 72, train_loss: 1.0065, test_loss: 1.4932, test_f1: 0.5334
 epoch: 73, train_loss: 1.0098, test_loss: 1.4236, test_f1: 0.5161
 epoch: 74, train_loss: 1.0214, test_loss: 1.2970, test_f1: 0.5159
 epoch: 75, train_loss: 1.0234, test_loss: 1.4931, test_f1: 0.5337
 epoch: 76, train_loss: 1.0046, test_loss: 1.4018, test_f1: 0.5493
 epoch: 77, train_loss: 0.9976, test_loss: 1.3243, test_f1: 0.5368
 epoch: 78, train_loss: 0.9939, test_loss: 1.4078, test_f1: 0.5446
 epoch: 79, train_loss: 1.0169, test_loss: 1.4081, test_f1: 0.5438
 epoch: 80, train_loss: 0.9954, test_loss: 1.3381, test_f1: 0.5330
 epoch: 81, train_loss: 1.0040, test_loss: 1.3708, test_f1: 0.5267
 epoch: 82, train_loss: 1.0074, test_loss: 1.3386, test_f1: 0.5294
 epoch: 83, train_loss: 0.9928, test_loss: 1.3025, test_f1: 0.5237
 epoch: 84, train_loss: 0.9862, test_loss: 1.3307, test_f1: 0.5347
 epoch: 85, train_loss: 0.9805, test_loss: 1.3988, test_f1: 0.5286
 epoch: 86, train_loss: 0.9746, test_loss: 1.4017, test_f1: 0.5461
 epoch: 87, train_loss: 0.9946, test_loss: 1.4218, test_f1: 0.5244
 epoch: 88, train_loss: 0.9734, test_loss: 1.3451, test_f1: 0.5303
 epoch: 89, train_loss: 0.9812, test_loss: 1.3027, test_f1: 0.5415
 epoch: 90, train_loss: 0.9844, test_loss: 1.4634, test_f1: 0.5168
 epoch: 91, train_loss: 0.9808, test_loss: 1.4212, test_f1: 0.5328
 epoch: 92, train_loss: 0.9788, test_loss: 1.3712, test_f1: 0.5302
 epoch: 93, train_loss: 0.9791, test_loss: 1.5281, test_f1: 0.5244
 epoch: 94, train_loss: 0.9695, test_loss: 1.4126, test_f1: 0.5358
 epoch: 95, train_loss: 0.9724, test_loss: 1.3861, test_f1: 0.5340
 epoch: 96, train_loss: 0.9721, test_loss: 1.3453, test_f1: 0.5299
 epoch: 97, train_loss: 0.9799, test_loss: 1.3460, test_f1: 0.5350
 epoch: 98, train_loss: 0.9684, test_loss: 1.3784, test_f1: 0.5342
 epoch: 99, train_loss: 0.9660, test_loss: 1.3800, test_f1: 0.5295
##################ITERATION #3 ****************************************
 epoch: 0, train_loss: 1.2789, test_loss: 1.3090, test_f1: 0.2281
 epoch: 1, train_loss: 1.2535, test_loss: 1.3033, test_f1: 0.2227
 epoch: 2, train_loss: 1.2449, test_loss: 1.2920, test_f1: 0.2259
 epoch: 3, train_loss: 1.2292, test_loss: 1.2976, test_f1: 0.2387
 epoch: 4, train_loss: 1.2273, test_loss: 1.2852, test_f1: 0.2571
 epoch: 5, train_loss: 1.2167, test_loss: 1.2873, test_f1: 0.2573
 epoch: 6, train_loss: 1.2157, test_loss: 1.2789, test_f1: 0.2481
 epoch: 7, train_loss: 1.2058, test_loss: 1.2678, test_f1: 0.2185
 epoch: 8, train_loss: 1.2051, test_loss: 1.2667, test_f1: 0.2193
 epoch: 9, train_loss: 1.1923, test_loss: 1.2663, test_f1: 0.2662
 epoch: 10, train_loss: 1.1921, test_loss: 1.2540, test_f1: 0.2525
 epoch: 11, train_loss: 1.1807, test_loss: 1.2504, test_f1: 0.2662
 epoch: 12, train_loss: 1.1816, test_loss: 1.2525, test_f1: 0.2735
 epoch: 13, train_loss: 1.1723, test_loss: 1.2440, test_f1: 0.3138
 epoch: 14, train_loss: 1.1708, test_loss: 1.2508, test_f1: 0.2947
 epoch: 15, train_loss: 1.1749, test_loss: 1.2558, test_f1: 0.2953
 epoch: 16, train_loss: 1.1499, test_loss: 1.2456, test_f1: 0.3155
 epoch: 17, train_loss: 1.1541, test_loss: 1.2407, test_f1: 0.3436
 epoch: 18, train_loss: 1.1488, test_loss: 1.2463, test_f1: 0.3483
 epoch: 19, train_loss: 1.1449, test_loss: 1.2257, test_f1: 0.3532
 epoch: 20, train_loss: 1.1327, test_loss: 1.2320, test_f1: 0.3783
 epoch: 21, train_loss: 1.1358, test_loss: 1.2225, test_f1: 0.3716
 epoch: 22, train_loss: 1.1341, test_loss: 1.2314, test_f1: 0.3800
 epoch: 23, train_loss: 1.1240, test_loss: 1.2343, test_f1: 0.3802
 epoch: 24, train_loss: 1.1167, test_loss: 1.2214, test_f1: 0.3832
 epoch: 25, train_loss: 1.1161, test_loss: 1.2171, test_f1: 0.3838
 epoch: 26, train_loss: 1.1075, test_loss: 1.2165, test_f1: 0.4063
 epoch: 27, train_loss: 1.1088, test_loss: 1.2133, test_f1: 0.4092
 epoch: 28, train_loss: 1.1091, test_loss: 1.2077, test_f1: 0.4060
 epoch: 29, train_loss: 1.1097, test_loss: 1.2080, test_f1: 0.4098
 epoch: 30, train_loss: 1.0990, test_loss: 1.2061, test_f1: 0.4118
 epoch: 31, train_loss: 1.0957, test_loss: 1.2083, test_f1: 0.4113
 epoch: 32, train_loss: 1.1041, test_loss: 1.2074, test_f1: 0.4099
 epoch: 33, train_loss: 1.0854, test_loss: 1.2129, test_f1: 0.4113
 epoch: 34, train_loss: 1.0870, test_loss: 1.2052, test_f1: 0.4275
 epoch: 35, train_loss: 1.0819, test_loss: 1.2087, test_f1: 0.4190
 epoch: 36, train_loss: 1.0776, test_loss: 1.1988, test_f1: 0.4509
 epoch: 37, train_loss: 1.0720, test_loss: 1.1932, test_f1: 0.4409
 epoch: 38, train_loss: 1.0637, test_loss: 1.2041, test_f1: 0.4594
 epoch: 39, train_loss: 1.0672, test_loss: 1.2075, test_f1: 0.4519
 epoch: 40, train_loss: 1.0788, test_loss: 1.1979, test_f1: 0.4784
 epoch: 41, train_loss: 1.0529, test_loss: 1.1933, test_f1: 0.4808
 epoch: 42, train_loss: 1.0533, test_loss: 1.1939, test_f1: 0.5025
 epoch: 43, train_loss: 1.0536, test_loss: 1.1873, test_f1: 0.5026
 epoch: 44, train_loss: 1.0440, test_loss: 1.1992, test_f1: 0.5146
 epoch: 45, train_loss: 1.0401, test_loss: 1.1934, test_f1: 0.4992
 epoch: 46, train_loss: 1.0330, test_loss: 1.1943, test_f1: 0.4940
 epoch: 47, train_loss: 1.0423, test_loss: 1.1853, test_f1: 0.5116
 epoch: 48, train_loss: 1.0381, test_loss: 1.2039, test_f1: 0.5183
 epoch: 49, train_loss: 1.0348, test_loss: 1.1953, test_f1: 0.4785
 epoch: 50, train_loss: 1.0372, test_loss: 1.1871, test_f1: 0.5052
 epoch: 51, train_loss: 1.0297, test_loss: 1.1935, test_f1: 0.5177
 epoch: 52, train_loss: 1.0230, test_loss: 1.1982, test_f1: 0.4959
 epoch: 53, train_loss: 1.0120, test_loss: 1.1872, test_f1: 0.5017
 epoch: 54, train_loss: 1.0202, test_loss: 1.1978, test_f1: 0.5143
 epoch: 55, train_loss: 1.0295, test_loss: 1.1912, test_f1: 0.5185
 epoch: 56, train_loss: 1.0223, test_loss: 1.1976, test_f1: 0.5141
 epoch: 57, train_loss: 1.0329, test_loss: 1.1824, test_f1: 0.5288
 epoch: 58, train_loss: 1.0210, test_loss: 1.1874, test_f1: 0.5055
 epoch: 59, train_loss: 1.0052, test_loss: 1.1865, test_f1: 0.5132
 epoch: 60, train_loss: 1.0237, test_loss: 1.1876, test_f1: 0.5090
 epoch: 61, train_loss: 1.0166, test_loss: 1.1887, test_f1: 0.4982
 epoch: 62, train_loss: 1.0096, test_loss: 1.1845, test_f1: 0.5255
 epoch: 63, train_loss: 1.0177, test_loss: 1.1814, test_f1: 0.5077
 epoch: 64, train_loss: 1.0139, test_loss: 1.1844, test_f1: 0.4990
 epoch: 65, train_loss: 1.0132, test_loss: 1.1821, test_f1: 0.5134
 epoch: 66, train_loss: 1.0044, test_loss: 1.1901, test_f1: 0.5351
 epoch: 67, train_loss: 1.0012, test_loss: 1.1888, test_f1: 0.5566
 epoch: 68, train_loss: 1.0158, test_loss: 1.1892, test_f1: 0.5369
 epoch: 69, train_loss: 1.0071, test_loss: 1.1879, test_f1: 0.5424
 epoch: 70, train_loss: 0.9927, test_loss: 1.1905, test_f1: 0.5150
 epoch: 71, train_loss: 1.0095, test_loss: 1.1907, test_f1: 0.5483
 epoch: 72, train_loss: 1.0121, test_loss: 1.1946, test_f1: 0.5210
 epoch: 73, train_loss: 1.0031, test_loss: 1.2072, test_f1: 0.5455
 epoch: 74, train_loss: 1.0025, test_loss: 1.1951, test_f1: 0.5647
 epoch: 75, train_loss: 0.9808, test_loss: 1.1979, test_f1: 0.5327
 epoch: 76, train_loss: 0.9925, test_loss: 1.1992, test_f1: 0.5528
 epoch: 77, train_loss: 0.9823, test_loss: 1.1920, test_f1: 0.5346
 epoch: 78, train_loss: 0.9932, test_loss: 1.1993, test_f1: 0.5500
 epoch: 79, train_loss: 0.9875, test_loss: 1.1958, test_f1: 0.5556
 epoch: 80, train_loss: 0.9719, test_loss: 1.2046, test_f1: 0.5491
 epoch: 81, train_loss: 0.9907, test_loss: 1.2036, test_f1: 0.5539
 epoch: 82, train_loss: 0.9886, test_loss: 1.1892, test_f1: 0.5491
 epoch: 83, train_loss: 0.9843, test_loss: 1.1988, test_f1: 0.5594
 epoch: 84, train_loss: 0.9979, test_loss: 1.2104, test_f1: 0.5438
 epoch: 85, train_loss: 1.0011, test_loss: 1.2001, test_f1: 0.5593
 epoch: 86, train_loss: 0.9761, test_loss: 1.2032, test_f1: 0.5465
 epoch: 87, train_loss: 0.9690, test_loss: 1.2063, test_f1: 0.5625
 epoch: 88, train_loss: 0.9834, test_loss: 1.2039, test_f1: 0.5539
 epoch: 89, train_loss: 0.9612, test_loss: 1.2066, test_f1: 0.5590
 epoch: 90, train_loss: 0.9815, test_loss: 1.1996, test_f1: 0.5670
 epoch: 91, train_loss: 0.9794, test_loss: 1.2034, test_f1: 0.5626
 epoch: 92, train_loss: 0.9789, test_loss: 1.2048, test_f1: 0.5751
 epoch: 93, train_loss: 0.9811, test_loss: 1.2083, test_f1: 0.5723
 epoch: 94, train_loss: 0.9755, test_loss: 1.2086, test_f1: 0.5680
 epoch: 95, train_loss: 0.9668, test_loss: 1.2114, test_f1: 0.5698
 epoch: 96, train_loss: 0.9696, test_loss: 1.2213, test_f1: 0.5349
 epoch: 97, train_loss: 0.9709, test_loss: 1.2073, test_f1: 0.5596
 epoch: 98, train_loss: 0.9590, test_loss: 1.2034, test_f1: 0.5594
 epoch: 99, train_loss: 0.9704, test_loss: 1.2182, test_f1: 0.5673
##################ITERATION #4 ****************************************
 epoch: 0, train_loss: 1.2841, test_loss: 1.3432, test_f1: 0.2281
 epoch: 1, train_loss: 1.2606, test_loss: 1.5114, test_f1: 0.2285
 epoch: 2, train_loss: 1.2426, test_loss: 1.4029, test_f1: 0.2640
 epoch: 3, train_loss: 1.2272, test_loss: 1.4332, test_f1: 0.2433
 epoch: 4, train_loss: 1.2270, test_loss: 1.4937, test_f1: 0.2424
 epoch: 5, train_loss: 1.2257, test_loss: 1.4628, test_f1: 0.2452
 epoch: 6, train_loss: 1.2087, test_loss: 1.3447, test_f1: 0.2578
 epoch: 7, train_loss: 1.2034, test_loss: 1.5184, test_f1: 0.2583
 epoch: 8, train_loss: 1.2060, test_loss: 1.3666, test_f1: 0.2694
 epoch: 9, train_loss: 1.1929, test_loss: 1.3821, test_f1: 0.2771
 epoch: 10, train_loss: 1.1861, test_loss: 1.3837, test_f1: 0.3083
 epoch: 11, train_loss: 1.1813, test_loss: 1.4421, test_f1: 0.3379
 epoch: 12, train_loss: 1.1681, test_loss: 1.3398, test_f1: 0.3292
 epoch: 13, train_loss: 1.1692, test_loss: 1.3338, test_f1: 0.3520
 epoch: 14, train_loss: 1.1692, test_loss: 1.3737, test_f1: 0.3672
 epoch: 15, train_loss: 1.1478, test_loss: 1.3680, test_f1: 0.3683
 epoch: 16, train_loss: 1.1514, test_loss: 1.3365, test_f1: 0.3851
 epoch: 17, train_loss: 1.1458, test_loss: 1.2617, test_f1: 0.3781
 epoch: 18, train_loss: 1.1344, test_loss: 1.2970, test_f1: 0.4150
 epoch: 19, train_loss: 1.1346, test_loss: 1.2874, test_f1: 0.3946
 epoch: 20, train_loss: 1.1335, test_loss: 1.2714, test_f1: 0.3731
 epoch: 21, train_loss: 1.1189, test_loss: 1.2665, test_f1: 0.4053
 epoch: 22, train_loss: 1.1124, test_loss: 1.2386, test_f1: 0.4143
 epoch: 23, train_loss: 1.1224, test_loss: 1.2819, test_f1: 0.3940
 epoch: 24, train_loss: 1.1045, test_loss: 1.2588, test_f1: 0.4139
 epoch: 25, train_loss: 1.0931, test_loss: 1.2587, test_f1: 0.4015
 epoch: 26, train_loss: 1.0836, test_loss: 1.2414, test_f1: 0.3812
 epoch: 27, train_loss: 1.0878, test_loss: 1.2637, test_f1: 0.4253
 epoch: 28, train_loss: 1.0846, test_loss: 1.2696, test_f1: 0.4260
 epoch: 29, train_loss: 1.0737, test_loss: 1.2711, test_f1: 0.4215
 epoch: 30, train_loss: 1.0825, test_loss: 1.2770, test_f1: 0.4374
 epoch: 31, train_loss: 1.0672, test_loss: 1.2861, test_f1: 0.4052
 epoch: 32, train_loss: 1.0499, test_loss: 1.2816, test_f1: 0.4334
 epoch: 33, train_loss: 1.0710, test_loss: 1.2992, test_f1: 0.4368
 epoch: 34, train_loss: 1.0545, test_loss: 1.2881, test_f1: 0.4515
 epoch: 35, train_loss: 1.0579, test_loss: 1.3088, test_f1: 0.4430
 epoch: 36, train_loss: 1.0404, test_loss: 1.2701, test_f1: 0.4693
 epoch: 37, train_loss: 1.0423, test_loss: 1.2898, test_f1: 0.4661
 epoch: 38, train_loss: 1.0431, test_loss: 1.2438, test_f1: 0.4710
 epoch: 39, train_loss: 1.0217, test_loss: 1.2416, test_f1: 0.4908
 epoch: 40, train_loss: 1.0389, test_loss: 1.2684, test_f1: 0.5041
 epoch: 41, train_loss: 1.0284, test_loss: 1.2629, test_f1: 0.4909
 epoch: 42, train_loss: 1.0282, test_loss: 1.2739, test_f1: 0.4812
 epoch: 43, train_loss: 1.0250, test_loss: 1.2782, test_f1: 0.4786
 epoch: 44, train_loss: 1.0169, test_loss: 1.2845, test_f1: 0.4848
 epoch: 45, train_loss: 1.0184, test_loss: 1.2755, test_f1: 0.5000
 epoch: 46, train_loss: 1.0182, test_loss: 1.3097, test_f1: 0.5063
 epoch: 47, train_loss: 1.0013, test_loss: 1.3251, test_f1: 0.4979
 epoch: 48, train_loss: 1.0107, test_loss: 1.2916, test_f1: 0.4871
 epoch: 49, train_loss: 1.0134, test_loss: 1.2921, test_f1: 0.4974
 epoch: 50, train_loss: 0.9959, test_loss: 1.3316, test_f1: 0.4996
 epoch: 51, train_loss: 1.0060, test_loss: 1.3190, test_f1: 0.5174
 epoch: 52, train_loss: 0.9891, test_loss: 1.3059, test_f1: 0.4903
 epoch: 53, train_loss: 1.0041, test_loss: 1.3393, test_f1: 0.4915
 epoch: 54, train_loss: 0.9924, test_loss: 1.3132, test_f1: 0.4976
 epoch: 55, train_loss: 0.9896, test_loss: 1.3186, test_f1: 0.4850
 epoch: 56, train_loss: 0.9836, test_loss: 1.3302, test_f1: 0.5105
 epoch: 57, train_loss: 0.9919, test_loss: 1.3445, test_f1: 0.5014
 epoch: 58, train_loss: 0.9914, test_loss: 1.3165, test_f1: 0.5165
 epoch: 59, train_loss: 0.9996, test_loss: 1.3204, test_f1: 0.5166
 epoch: 60, train_loss: 0.9746, test_loss: 1.3219, test_f1: 0.5016
 epoch: 61, train_loss: 0.9918, test_loss: 1.3119, test_f1: 0.5401
 epoch: 62, train_loss: 0.9823, test_loss: 1.3293, test_f1: 0.5180
 epoch: 63, train_loss: 0.9752, test_loss: 1.3273, test_f1: 0.5171
 epoch: 64, train_loss: 0.9743, test_loss: 1.3470, test_f1: 0.5144
 epoch: 65, train_loss: 0.9749, test_loss: 1.3719, test_f1: 0.4885
 epoch: 66, train_loss: 0.9878, test_loss: 1.3814, test_f1: 0.5214
 epoch: 67, train_loss: 0.9728, test_loss: 1.3774, test_f1: 0.5035
 epoch: 68, train_loss: 0.9671, test_loss: 1.3597, test_f1: 0.4934
 epoch: 69, train_loss: 0.9732, test_loss: 1.3761, test_f1: 0.5176
 epoch: 70, train_loss: 0.9719, test_loss: 1.3603, test_f1: 0.5199
 epoch: 71, train_loss: 0.9710, test_loss: 1.3880, test_f1: 0.5183
 epoch: 72, train_loss: 0.9679, test_loss: 1.3627, test_f1: 0.5233
 epoch: 73, train_loss: 0.9654, test_loss: 1.3884, test_f1: 0.5414
 epoch: 74, train_loss: 0.9645, test_loss: 1.3836, test_f1: 0.5271
 epoch: 75, train_loss: 0.9553, test_loss: 1.3823, test_f1: 0.5130
 epoch: 76, train_loss: 0.9654, test_loss: 1.3591, test_f1: 0.5254
 epoch: 77, train_loss: 0.9665, test_loss: 1.4086, test_f1: 0.5415
 epoch: 78, train_loss: 0.9471, test_loss: 1.3950, test_f1: 0.5373
 epoch: 79, train_loss: 0.9656, test_loss: 1.4146, test_f1: 0.5345
 epoch: 80, train_loss: 0.9501, test_loss: 1.4843, test_f1: 0.5173
 epoch: 81, train_loss: 0.9459, test_loss: 1.4437, test_f1: 0.5196
 epoch: 82, train_loss: 0.9599, test_loss: 1.4181, test_f1: 0.5104
 epoch: 83, train_loss: 0.9446, test_loss: 1.4395, test_f1: 0.5144
 epoch: 84, train_loss: 0.9573, test_loss: 1.4885, test_f1: 0.5319
 epoch: 85, train_loss: 0.9529, test_loss: 1.4467, test_f1: 0.5336
 epoch: 86, train_loss: 0.9585, test_loss: 1.5566, test_f1: 0.5132
 epoch: 87, train_loss: 0.9394, test_loss: 1.4175, test_f1: 0.5192
 epoch: 88, train_loss: 0.9444, test_loss: 1.4865, test_f1: 0.5165
 epoch: 89, train_loss: 0.9376, test_loss: 1.4258, test_f1: 0.5012
 epoch: 90, train_loss: 0.9427, test_loss: 1.5271, test_f1: 0.5249
 epoch: 91, train_loss: 0.9485, test_loss: 1.4564, test_f1: 0.5206
 epoch: 92, train_loss: 0.9302, test_loss: 1.4693, test_f1: 0.5335
 epoch: 93, train_loss: 0.9504, test_loss: 1.3885, test_f1: 0.5262
 epoch: 94, train_loss: 0.9342, test_loss: 1.4261, test_f1: 0.5249
 epoch: 95, train_loss: 0.9411, test_loss: 1.4557, test_f1: 0.5230
 epoch: 96, train_loss: 0.9447, test_loss: 1.4375, test_f1: 0.5045
 epoch: 97, train_loss: 0.9252, test_loss: 1.4474, test_f1: 0.5036
 epoch: 98, train_loss: 0.9499, test_loss: 1.4923, test_f1: 0.5366
 epoch: 99, train_loss: 0.9357, test_loss: 1.4949, test_f1: 0.5196
##################ITERATION #5 ****************************************
 epoch: 0, train_loss: 1.2778, test_loss: 1.3565, test_f1: 0.2378
 epoch: 1, train_loss: 1.2529, test_loss: 1.3743, test_f1: 0.2553
 epoch: 2, train_loss: 1.2428, test_loss: 1.5396, test_f1: 0.3203
 epoch: 3, train_loss: 1.2273, test_loss: 1.5048, test_f1: 0.3277
 epoch: 4, train_loss: 1.2195, test_loss: 1.4514, test_f1: 0.3454
 epoch: 5, train_loss: 1.2058, test_loss: 1.5810, test_f1: 0.3859
 epoch: 6, train_loss: 1.1956, test_loss: 1.4633, test_f1: 0.4050
 epoch: 7, train_loss: 1.1855, test_loss: 1.4001, test_f1: 0.4131
 epoch: 8, train_loss: 1.1903, test_loss: 1.3852, test_f1: 0.4004
 epoch: 9, train_loss: 1.1696, test_loss: 1.4052, test_f1: 0.4291
 epoch: 10, train_loss: 1.1660, test_loss: 1.3369, test_f1: 0.4193
 epoch: 11, train_loss: 1.1566, test_loss: 1.3741, test_f1: 0.4428
 epoch: 12, train_loss: 1.1511, test_loss: 1.4347, test_f1: 0.4385
 epoch: 13, train_loss: 1.1381, test_loss: 1.3608, test_f1: 0.4429
 epoch: 14, train_loss: 1.1399, test_loss: 1.2939, test_f1: 0.4340
 epoch: 15, train_loss: 1.1237, test_loss: 1.3468, test_f1: 0.4390
 epoch: 16, train_loss: 1.1382, test_loss: 1.2833, test_f1: 0.4601
 epoch: 17, train_loss: 1.1217, test_loss: 1.3221, test_f1: 0.4528
 epoch: 18, train_loss: 1.1260, test_loss: 1.3604, test_f1: 0.4406
 epoch: 19, train_loss: 1.1101, test_loss: 1.2820, test_f1: 0.4584
 epoch: 20, train_loss: 1.1124, test_loss: 1.2959, test_f1: 0.4411
 epoch: 21, train_loss: 1.1234, test_loss: 1.2781, test_f1: 0.4265
 epoch: 22, train_loss: 1.1002, test_loss: 1.2969, test_f1: 0.4339
 epoch: 23, train_loss: 1.0884, test_loss: 1.2801, test_f1: 0.4660
 epoch: 24, train_loss: 1.0895, test_loss: 1.2778, test_f1: 0.4308
 epoch: 25, train_loss: 1.0880, test_loss: 1.2773, test_f1: 0.4732
 epoch: 26, train_loss: 1.0854, test_loss: 1.2670, test_f1: 0.4525
 epoch: 27, train_loss: 1.0772, test_loss: 1.3546, test_f1: 0.4416
 epoch: 28, train_loss: 1.0654, test_loss: 1.2563, test_f1: 0.4632
 epoch: 29, train_loss: 1.0726, test_loss: 1.2953, test_f1: 0.4739
 epoch: 30, train_loss: 1.0599, test_loss: 1.3615, test_f1: 0.4442
 epoch: 31, train_loss: 1.0623, test_loss: 1.2270, test_f1: 0.4692
 epoch: 32, train_loss: 1.0590, test_loss: 1.2435, test_f1: 0.4657
 epoch: 33, train_loss: 1.0653, test_loss: 1.2705, test_f1: 0.4626
 epoch: 34, train_loss: 1.0599, test_loss: 1.2863, test_f1: 0.4722
 epoch: 35, train_loss: 1.0443, test_loss: 1.2930, test_f1: 0.4554
 epoch: 36, train_loss: 1.0451, test_loss: 1.2386, test_f1: 0.4645
 epoch: 37, train_loss: 1.0548, test_loss: 1.2970, test_f1: 0.4584
 epoch: 38, train_loss: 1.0353, test_loss: 1.3010, test_f1: 0.4674
 epoch: 39, train_loss: 1.0497, test_loss: 1.4024, test_f1: 0.4688
 epoch: 40, train_loss: 1.0328, test_loss: 1.8634, test_f1: 0.4497
 epoch: 41, train_loss: 1.0610, test_loss: 1.4037, test_f1: 0.4779
 epoch: 42, train_loss: 1.0383, test_loss: 1.2639, test_f1: 0.4854
 epoch: 43, train_loss: 1.0418, test_loss: 2.1463, test_f1: 0.4641
 epoch: 44, train_loss: 1.0220, test_loss: 1.3386, test_f1: 0.4765
 epoch: 45, train_loss: 1.0249, test_loss: 1.3092, test_f1: 0.4913
 epoch: 46, train_loss: 1.0022, test_loss: 1.3196, test_f1: 0.4814
 epoch: 47, train_loss: 1.0165, test_loss: 1.4115, test_f1: 0.4967
 epoch: 48, train_loss: 1.0214, test_loss: 1.5271, test_f1: 0.4829
 epoch: 49, train_loss: 1.0131, test_loss: 1.3568, test_f1: 0.4987
 epoch: 50, train_loss: 0.9968, test_loss: 1.3636, test_f1: 0.4965
 epoch: 51, train_loss: 1.0070, test_loss: 1.2729, test_f1: 0.5073
 epoch: 52, train_loss: 0.9970, test_loss: 1.3794, test_f1: 0.4957
 epoch: 53, train_loss: 1.0060, test_loss: 1.4194, test_f1: 0.5136
 epoch: 54, train_loss: 0.9975, test_loss: 1.3483, test_f1: 0.4970
 epoch: 55, train_loss: 1.0054, test_loss: 1.3979, test_f1: 0.5015
 epoch: 56, train_loss: 0.9879, test_loss: 1.3862, test_f1: 0.4947
 epoch: 57, train_loss: 1.0025, test_loss: 1.4060, test_f1: 0.5088
 epoch: 58, train_loss: 0.9904, test_loss: 1.3143, test_f1: 0.5091
 epoch: 59, train_loss: 0.9987, test_loss: 1.4082, test_f1: 0.5161
 epoch: 60, train_loss: 0.9872, test_loss: 1.2299, test_f1: 0.4990
 epoch: 61, train_loss: 0.9851, test_loss: 1.3977, test_f1: 0.5117
 epoch: 62, train_loss: 0.9909, test_loss: 1.3806, test_f1: 0.4894
 epoch: 63, train_loss: 0.9885, test_loss: 1.5586, test_f1: 0.5002
 epoch: 64, train_loss: 0.9931, test_loss: 1.6038, test_f1: 0.5023
 epoch: 65, train_loss: 0.9858, test_loss: 1.5065, test_f1: 0.5098
 epoch: 66, train_loss: 0.9967, test_loss: 1.2798, test_f1: 0.5115
 epoch: 67, train_loss: 0.9775, test_loss: 2.1423, test_f1: 0.4920
 epoch: 68, train_loss: 0.9879, test_loss: 1.2814, test_f1: 0.5262
 epoch: 69, train_loss: 0.9812, test_loss: 2.0110, test_f1: 0.5338
 epoch: 70, train_loss: 0.9857, test_loss: 2.4271, test_f1: 0.5329
 epoch: 71, train_loss: 0.9763, test_loss: 1.3518, test_f1: 0.5219
 epoch: 72, train_loss: 0.9740, test_loss: 1.4517, test_f1: 0.5051
 epoch: 73, train_loss: 0.9646, test_loss: 3.4578, test_f1: 0.5173
 epoch: 74, train_loss: 0.9921, test_loss: 2.8576, test_f1: 0.5166
 epoch: 75, train_loss: 0.9720, test_loss: 1.6725, test_f1: 0.5013
 epoch: 76, train_loss: 0.9742, test_loss: 1.5329, test_f1: 0.5138
 epoch: 77, train_loss: 0.9663, test_loss: 1.5245, test_f1: 0.5086
 epoch: 78, train_loss: 0.9630, test_loss: 1.6362, test_f1: 0.5226
 epoch: 79, train_loss: 0.9570, test_loss: 2.2596, test_f1: 0.5193
 epoch: 80, train_loss: 0.9610, test_loss: 1.3344, test_f1: 0.5310
 epoch: 81, train_loss: 0.9613, test_loss: 1.9090, test_f1: 0.5471
 epoch: 82, train_loss: 0.9638, test_loss: 1.3417, test_f1: 0.5287
 epoch: 83, train_loss: 0.9531, test_loss: 1.3237, test_f1: 0.5315
 epoch: 84, train_loss: 0.9603, test_loss: 1.4307, test_f1: 0.5258
 epoch: 85, train_loss: 0.9655, test_loss: 1.7302, test_f1: 0.5346
 epoch: 86, train_loss: 0.9444, test_loss: 2.1274, test_f1: 0.5398
 epoch: 87, train_loss: 0.9690, test_loss: 1.8545, test_f1: 0.5331
 epoch: 88, train_loss: 0.9442, test_loss: 1.7184, test_f1: 0.5032
 epoch: 89, train_loss: 0.9463, test_loss: 2.0221, test_f1: 0.5253
 epoch: 90, train_loss: 0.9513, test_loss: 1.6666, test_f1: 0.5237
 epoch: 91, train_loss: 0.9328, test_loss: 1.4620, test_f1: 0.5450
 epoch: 92, train_loss: 0.9510, test_loss: 1.4713, test_f1: 0.5331
 epoch: 93, train_loss: 0.9432, test_loss: 1.4927, test_f1: 0.5322
 epoch: 94, train_loss: 0.9506, test_loss: 2.1119, test_f1: 0.5193
 epoch: 95, train_loss: 0.9672, test_loss: 1.3777, test_f1: 0.5376
 epoch: 96, train_loss: 0.9427, test_loss: 1.4840, test_f1: 0.5397
 epoch: 97, train_loss: 0.9501, test_loss: 1.7407, test_f1: 0.5409
 epoch: 98, train_loss: 0.9227, test_loss: 1.3798, test_f1: 0.5247
 epoch: 99, train_loss: 0.9619, test_loss: 1.3181, test_f1: 0.5431
##################ITERATION #6 ****************************************
 epoch: 0, train_loss: 1.3002, test_loss: 1.3386, test_f1: 0.3201
 epoch: 1, train_loss: 1.2677, test_loss: 1.3605, test_f1: 0.3174
 epoch: 2, train_loss: 1.2517, test_loss: 1.3428, test_f1: 0.3380
 epoch: 3, train_loss: 1.2449, test_loss: 1.3651, test_f1: 0.3006
 epoch: 4, train_loss: 1.2336, test_loss: 1.3484, test_f1: 0.3240
 epoch: 5, train_loss: 1.2354, test_loss: 1.3600, test_f1: 0.3214
 epoch: 6, train_loss: 1.2158, test_loss: 1.3671, test_f1: 0.3092
 epoch: 7, train_loss: 1.2074, test_loss: 1.3392, test_f1: 0.3282
 epoch: 8, train_loss: 1.1955, test_loss: 1.3492, test_f1: 0.3428
 epoch: 9, train_loss: 1.1957, test_loss: 1.3182, test_f1: 0.2952
 epoch: 10, train_loss: 1.1871, test_loss: 1.3372, test_f1: 0.3128
 epoch: 11, train_loss: 1.1855, test_loss: 1.3268, test_f1: 0.3278
 epoch: 12, train_loss: 1.1736, test_loss: 1.3823, test_f1: 0.3283
 epoch: 13, train_loss: 1.1780, test_loss: 1.3438, test_f1: 0.3461
 epoch: 14, train_loss: 1.1738, test_loss: 1.3386, test_f1: 0.3544
 epoch: 15, train_loss: 1.1679, test_loss: 1.3263, test_f1: 0.3335
 epoch: 16, train_loss: 1.1620, test_loss: 1.2800, test_f1: 0.3054
 epoch: 17, train_loss: 1.1493, test_loss: 1.3111, test_f1: 0.3620
 epoch: 18, train_loss: 1.1503, test_loss: 1.2951, test_f1: 0.3555
 epoch: 19, train_loss: 1.1428, test_loss: 1.2776, test_f1: 0.3608
 epoch: 20, train_loss: 1.1305, test_loss: 1.2722, test_f1: 0.3659
 epoch: 21, train_loss: 1.1400, test_loss: 1.3043, test_f1: 0.3978
 epoch: 22, train_loss: 1.1224, test_loss: 1.2785, test_f1: 0.3719
 epoch: 23, train_loss: 1.1228, test_loss: 1.2433, test_f1: 0.3832
 epoch: 24, train_loss: 1.1096, test_loss: 1.2852, test_f1: 0.4082
 epoch: 25, train_loss: 1.1124, test_loss: 1.2393, test_f1: 0.3342
 epoch: 26, train_loss: 1.1148, test_loss: 1.2846, test_f1: 0.3859
 epoch: 27, train_loss: 1.1077, test_loss: 1.2707, test_f1: 0.3998
 epoch: 28, train_loss: 1.1045, test_loss: 1.2627, test_f1: 0.4239
 epoch: 29, train_loss: 1.0905, test_loss: 1.2738, test_f1: 0.4077
 epoch: 30, train_loss: 1.0884, test_loss: 1.2721, test_f1: 0.4151
 epoch: 31, train_loss: 1.0999, test_loss: 1.2557, test_f1: 0.4285
 epoch: 32, train_loss: 1.0793, test_loss: 1.2206, test_f1: 0.3924
 epoch: 33, train_loss: 1.0877, test_loss: 1.2398, test_f1: 0.4471
 epoch: 34, train_loss: 1.0931, test_loss: 1.2390, test_f1: 0.4325
 epoch: 35, train_loss: 1.0784, test_loss: 1.2556, test_f1: 0.4220
 epoch: 36, train_loss: 1.0928, test_loss: 1.2047, test_f1: 0.4221
 epoch: 37, train_loss: 1.0622, test_loss: 1.2348, test_f1: 0.4215
 epoch: 38, train_loss: 1.0682, test_loss: 1.2233, test_f1: 0.4194
 epoch: 39, train_loss: 1.0557, test_loss: 1.2361, test_f1: 0.4548
 epoch: 40, train_loss: 1.0664, test_loss: 1.2323, test_f1: 0.4478
 epoch: 41, train_loss: 1.0596, test_loss: 1.2257, test_f1: 0.4369
 epoch: 42, train_loss: 1.0673, test_loss: 1.2069, test_f1: 0.4417
 epoch: 43, train_loss: 1.0502, test_loss: 1.2184, test_f1: 0.4244
 epoch: 44, train_loss: 1.0427, test_loss: 1.2429, test_f1: 0.4801
 epoch: 45, train_loss: 1.0492, test_loss: 1.1959, test_f1: 0.4573
 epoch: 46, train_loss: 1.0371, test_loss: 1.2249, test_f1: 0.4453
 epoch: 47, train_loss: 1.0455, test_loss: 1.2113, test_f1: 0.4581
 epoch: 48, train_loss: 1.0504, test_loss: 1.1985, test_f1: 0.4539
 epoch: 49, train_loss: 1.0339, test_loss: 1.2361, test_f1: 0.4493
 epoch: 50, train_loss: 1.0274, test_loss: 1.2112, test_f1: 0.4504
 epoch: 51, train_loss: 1.0292, test_loss: 1.2161, test_f1: 0.4590
 epoch: 52, train_loss: 1.0225, test_loss: 1.1739, test_f1: 0.4489
 epoch: 53, train_loss: 1.0356, test_loss: 1.2033, test_f1: 0.4401
 epoch: 54, train_loss: 1.0150, test_loss: 1.2153, test_f1: 0.4562
 epoch: 55, train_loss: 1.0182, test_loss: 1.1929, test_f1: 0.4572
 epoch: 56, train_loss: 1.0259, test_loss: 1.1969, test_f1: 0.4569
 epoch: 57, train_loss: 1.0389, test_loss: 1.2224, test_f1: 0.4640
 epoch: 58, train_loss: 1.0230, test_loss: 1.2102, test_f1: 0.4609
 epoch: 59, train_loss: 1.0097, test_loss: 1.1924, test_f1: 0.4501
 epoch: 60, train_loss: 1.0222, test_loss: 1.2084, test_f1: 0.4420
 epoch: 61, train_loss: 1.0059, test_loss: 1.1789, test_f1: 0.4648
 epoch: 62, train_loss: 1.0135, test_loss: 1.2085, test_f1: 0.4494
 epoch: 63, train_loss: 1.0159, test_loss: 1.1967, test_f1: 0.4588
 epoch: 64, train_loss: 1.0204, test_loss: 1.1825, test_f1: 0.4562
 epoch: 65, train_loss: 1.0063, test_loss: 1.2034, test_f1: 0.4498
 epoch: 66, train_loss: 1.0074, test_loss: 1.1935, test_f1: 0.4727
 epoch: 67, train_loss: 1.0058, test_loss: 1.1723, test_f1: 0.4800
 epoch: 68, train_loss: 1.0201, test_loss: 1.1816, test_f1: 0.4728
 epoch: 69, train_loss: 1.0019, test_loss: 1.1984, test_f1: 0.4539
 epoch: 70, train_loss: 1.0041, test_loss: 1.1753, test_f1: 0.4797
 epoch: 71, train_loss: 0.9931, test_loss: 1.1813, test_f1: 0.4545
 epoch: 72, train_loss: 1.0146, test_loss: 1.1780, test_f1: 0.4702
 epoch: 73, train_loss: 1.0038, test_loss: 1.1748, test_f1: 0.4590
 epoch: 74, train_loss: 0.9944, test_loss: 1.1874, test_f1: 0.4813
 epoch: 75, train_loss: 0.9991, test_loss: 1.1837, test_f1: 0.4724
 epoch: 76, train_loss: 0.9977, test_loss: 1.1646, test_f1: 0.4569
 epoch: 77, train_loss: 0.9829, test_loss: 1.1790, test_f1: 0.4564
 epoch: 78, train_loss: 1.0063, test_loss: 1.1881, test_f1: 0.4533
 epoch: 79, train_loss: 0.9988, test_loss: 1.1967, test_f1: 0.4678
 epoch: 80, train_loss: 0.9799, test_loss: 1.2000, test_f1: 0.4714
 epoch: 81, train_loss: 0.9862, test_loss: 1.1959, test_f1: 0.4573
 epoch: 82, train_loss: 0.9919, test_loss: 1.1741, test_f1: 0.4760
 epoch: 83, train_loss: 0.9865, test_loss: 1.2067, test_f1: 0.4942
 epoch: 84, train_loss: 0.9886, test_loss: 1.2033, test_f1: 0.4575
 epoch: 85, train_loss: 0.9764, test_loss: 1.2084, test_f1: 0.4765
 epoch: 86, train_loss: 0.9972, test_loss: 1.2142, test_f1: 0.4985
 epoch: 87, train_loss: 0.9765, test_loss: 1.2042, test_f1: 0.4756
 epoch: 88, train_loss: 0.9625, test_loss: 1.1766, test_f1: 0.5030
 epoch: 89, train_loss: 0.9856, test_loss: 1.2145, test_f1: 0.4795
 epoch: 90, train_loss: 0.9877, test_loss: 1.1947, test_f1: 0.4951
 epoch: 91, train_loss: 0.9864, test_loss: 1.2452, test_f1: 0.4891
 epoch: 92, train_loss: 0.9892, test_loss: 1.1976, test_f1: 0.4809
 epoch: 93, train_loss: 0.9839, test_loss: 1.1945, test_f1: 0.4830
 epoch: 94, train_loss: 0.9720, test_loss: 1.2168, test_f1: 0.5016
 epoch: 95, train_loss: 0.9676, test_loss: 1.1982, test_f1: 0.4967
 epoch: 96, train_loss: 0.9605, test_loss: 1.2186, test_f1: 0.5071
 epoch: 97, train_loss: 0.9686, test_loss: 1.1902, test_f1: 0.4593
 epoch: 98, train_loss: 0.9662, test_loss: 1.2051, test_f1: 0.4977
 epoch: 99, train_loss: 0.9759, test_loss: 1.2465, test_f1: 0.4925
##################ITERATION #7 ****************************************
 epoch: 0, train_loss: 1.2947, test_loss: 1.3217, test_f1: 0.2281
 epoch: 1, train_loss: 1.2581, test_loss: 1.2918, test_f1: 0.2602
 epoch: 2, train_loss: 1.2550, test_loss: 1.3230, test_f1: 0.2809
 epoch: 3, train_loss: 1.2473, test_loss: 1.2986, test_f1: 0.3046
 epoch: 4, train_loss: 1.2396, test_loss: 1.3492, test_f1: 0.2718
 epoch: 5, train_loss: 1.2368, test_loss: 1.3536, test_f1: 0.2989
 epoch: 6, train_loss: 1.2235, test_loss: 1.2892, test_f1: 0.3019
 epoch: 7, train_loss: 1.2119, test_loss: 1.2808, test_f1: 0.3014
 epoch: 8, train_loss: 1.2161, test_loss: 1.2804, test_f1: 0.3035
 epoch: 9, train_loss: 1.2129, test_loss: 1.2797, test_f1: 0.3430
 epoch: 10, train_loss: 1.2058, test_loss: 1.3056, test_f1: 0.3331
 epoch: 11, train_loss: 1.2034, test_loss: 1.3240, test_f1: 0.3484
 epoch: 12, train_loss: 1.1935, test_loss: 1.2840, test_f1: 0.3405
 epoch: 13, train_loss: 1.1964, test_loss: 1.2865, test_f1: 0.3712
 epoch: 14, train_loss: 1.1954, test_loss: 1.2789, test_f1: 0.3718
 epoch: 15, train_loss: 1.1851, test_loss: 1.2927, test_f1: 0.3540
 epoch: 16, train_loss: 1.1872, test_loss: 1.2540, test_f1: 0.3412
 epoch: 17, train_loss: 1.1712, test_loss: 1.2648, test_f1: 0.3578
 epoch: 18, train_loss: 1.1757, test_loss: 1.2699, test_f1: 0.3751
 epoch: 19, train_loss: 1.1756, test_loss: 1.2944, test_f1: 0.3207
 epoch: 20, train_loss: 1.1679, test_loss: 1.3468, test_f1: 0.3570
 epoch: 21, train_loss: 1.1596, test_loss: 1.2639, test_f1: 0.3381
 epoch: 22, train_loss: 1.1582, test_loss: 1.2677, test_f1: 0.3389
 epoch: 23, train_loss: 1.1677, test_loss: 1.2869, test_f1: 0.3523
 epoch: 24, train_loss: 1.1701, test_loss: 1.2607, test_f1: 0.3530
 epoch: 25, train_loss: 1.1546, test_loss: 1.3792, test_f1: 0.3361
 epoch: 26, train_loss: 1.1639, test_loss: 1.3608, test_f1: 0.3615
 epoch: 27, train_loss: 1.1668, test_loss: 1.3837, test_f1: 0.3776
 epoch: 28, train_loss: 1.1450, test_loss: 1.3229, test_f1: 0.3566
 epoch: 29, train_loss: 1.1438, test_loss: 1.4224, test_f1: 0.3764
 epoch: 30, train_loss: 1.1349, test_loss: 1.5049, test_f1: 0.3852
 epoch: 31, train_loss: 1.1338, test_loss: 1.2880, test_f1: 0.3840
 epoch: 32, train_loss: 1.1366, test_loss: 1.3405, test_f1: 0.3833
 epoch: 33, train_loss: 1.1405, test_loss: 1.3369, test_f1: 0.3945
 epoch: 34, train_loss: 1.1276, test_loss: 1.4083, test_f1: 0.3804
 epoch: 35, train_loss: 1.1324, test_loss: 1.3015, test_f1: 0.3705
 epoch: 36, train_loss: 1.1298, test_loss: 1.2633, test_f1: 0.4243
 epoch: 37, train_loss: 1.1308, test_loss: 1.2772, test_f1: 0.4104
 epoch: 38, train_loss: 1.1310, test_loss: 1.3563, test_f1: 0.3984
 epoch: 39, train_loss: 1.1229, test_loss: 1.2952, test_f1: 0.4300
 epoch: 40, train_loss: 1.1194, test_loss: 1.3849, test_f1: 0.4019
 epoch: 41, train_loss: 1.1143, test_loss: 1.5767, test_f1: 0.3924
 epoch: 42, train_loss: 1.1163, test_loss: 1.4069, test_f1: 0.4058
 epoch: 43, train_loss: 1.1094, test_loss: 1.3032, test_f1: 0.3920
 epoch: 44, train_loss: 1.1146, test_loss: 1.3156, test_f1: 0.3876
 epoch: 45, train_loss: 1.0997, test_loss: 1.3482, test_f1: 0.3990
 epoch: 46, train_loss: 1.1042, test_loss: 1.3258, test_f1: 0.3679
 epoch: 47, train_loss: 1.1006, test_loss: 1.6342, test_f1: 0.3943
 epoch: 48, train_loss: 1.0985, test_loss: 1.3521, test_f1: 0.3878
 epoch: 49, train_loss: 1.1003, test_loss: 1.3257, test_f1: 0.4051
 epoch: 50, train_loss: 1.0883, test_loss: 1.4747, test_f1: 0.3712
 epoch: 51, train_loss: 1.0818, test_loss: 1.3468, test_f1: 0.4053
 epoch: 52, train_loss: 1.0922, test_loss: 1.2745, test_f1: 0.4102
 epoch: 53, train_loss: 1.0903, test_loss: 1.3685, test_f1: 0.3947
 epoch: 54, train_loss: 1.0809, test_loss: 1.5986, test_f1: 0.3992
 epoch: 55, train_loss: 1.0846, test_loss: 1.4735, test_f1: 0.4122
 epoch: 56, train_loss: 1.0764, test_loss: 1.3260, test_f1: 0.3979
 epoch: 57, train_loss: 1.0829, test_loss: 1.3817, test_f1: 0.4030
 epoch: 58, train_loss: 1.0893, test_loss: 1.3082, test_f1: 0.3902
 epoch: 59, train_loss: 1.0625, test_loss: 1.3039, test_f1: 0.4124
 epoch: 60, train_loss: 1.0758, test_loss: 1.4959, test_f1: 0.4229
 epoch: 61, train_loss: 1.0798, test_loss: 1.4701, test_f1: 0.3964
 epoch: 62, train_loss: 1.0791, test_loss: 1.3236, test_f1: 0.4180
 epoch: 63, train_loss: 1.0650, test_loss: 1.3018, test_f1: 0.4513
 epoch: 64, train_loss: 1.0811, test_loss: 1.4069, test_f1: 0.4282
 epoch: 65, train_loss: 1.0692, test_loss: 1.8004, test_f1: 0.4173
 epoch: 66, train_loss: 1.0722, test_loss: 1.4296, test_f1: 0.3973
 epoch: 67, train_loss: 1.0772, test_loss: 1.4006, test_f1: 0.3817
 epoch: 68, train_loss: 1.0658, test_loss: 2.0412, test_f1: 0.3935
 epoch: 69, train_loss: 1.0564, test_loss: 1.5040, test_f1: 0.4030
 epoch: 70, train_loss: 1.0725, test_loss: 1.3901, test_f1: 0.3974
 epoch: 71, train_loss: 1.0713, test_loss: 1.4545, test_f1: 0.3872
 epoch: 72, train_loss: 1.0649, test_loss: 1.4774, test_f1: 0.4288
 epoch: 73, train_loss: 1.0495, test_loss: 1.5194, test_f1: 0.3959
 epoch: 74, train_loss: 1.0722, test_loss: 1.4544, test_f1: 0.4126
 epoch: 75, train_loss: 1.0545, test_loss: 1.4427, test_f1: 0.4309
 epoch: 76, train_loss: 1.0583, test_loss: 1.3274, test_f1: 0.4373
 epoch: 77, train_loss: 1.0646, test_loss: 1.3579, test_f1: 0.4025
 epoch: 78, train_loss: 1.0523, test_loss: 1.3772, test_f1: 0.4433
 epoch: 79, train_loss: 1.0603, test_loss: 1.3499, test_f1: 0.4002
 epoch: 80, train_loss: 1.0457, test_loss: 1.5648, test_f1: 0.4165
 epoch: 81, train_loss: 1.0437, test_loss: 1.3871, test_f1: 0.4425
 epoch: 82, train_loss: 1.0492, test_loss: 1.5336, test_f1: 0.4236
 epoch: 83, train_loss: 1.0627, test_loss: 1.6659, test_f1: 0.4151
 epoch: 84, train_loss: 1.0689, test_loss: 1.4165, test_f1: 0.4486
 epoch: 85, train_loss: 1.0484, test_loss: 1.4480, test_f1: 0.4400
 epoch: 86, train_loss: 1.0462, test_loss: 1.4014, test_f1: 0.4412
 epoch: 87, train_loss: 1.0490, test_loss: 1.5470, test_f1: 0.4384
 epoch: 88, train_loss: 1.0443, test_loss: 1.8976, test_f1: 0.4386
 epoch: 89, train_loss: 1.0339, test_loss: 1.4672, test_f1: 0.4491
 epoch: 90, train_loss: 1.0483, test_loss: 1.4289, test_f1: 0.4377
 epoch: 91, train_loss: 1.0437, test_loss: 1.6515, test_f1: 0.4362
 epoch: 92, train_loss: 1.0491, test_loss: 1.3474, test_f1: 0.4364
 epoch: 93, train_loss: 1.0551, test_loss: 1.3630, test_f1: 0.4562
 epoch: 94, train_loss: 1.0340, test_loss: 1.3507, test_f1: 0.4280
 epoch: 95, train_loss: 1.0377, test_loss: 1.3288, test_f1: 0.4509
 epoch: 96, train_loss: 1.0470, test_loss: 1.3610, test_f1: 0.4371
 epoch: 97, train_loss: 1.0252, test_loss: 1.3889, test_f1: 0.4409
 epoch: 98, train_loss: 1.0434, test_loss: 1.3583, test_f1: 0.4143
 epoch: 99, train_loss: 1.0335, test_loss: 1.3916, test_f1: 0.4230
##################ITERATION #8 ****************************************
 epoch: 0, train_loss: 1.2556, test_loss: 1.2996, test_f1: 0.2516
 epoch: 1, train_loss: 1.2443, test_loss: 1.3204, test_f1: 0.2807
 epoch: 2, train_loss: 1.2281, test_loss: 1.3042, test_f1: 0.2981
 epoch: 3, train_loss: 1.2195, test_loss: 1.3154, test_f1: 0.2943
 epoch: 4, train_loss: 1.2044, test_loss: 1.3116, test_f1: 0.3142
 epoch: 5, train_loss: 1.1925, test_loss: 1.2985, test_f1: 0.3219
 epoch: 6, train_loss: 1.1996, test_loss: 1.3038, test_f1: 0.3287
 epoch: 7, train_loss: 1.1763, test_loss: 1.2975, test_f1: 0.3733
 epoch: 8, train_loss: 1.1846, test_loss: 1.3020, test_f1: 0.3780
 epoch: 9, train_loss: 1.1763, test_loss: 1.2815, test_f1: 0.3703
 epoch: 10, train_loss: 1.1730, test_loss: 1.2932, test_f1: 0.3768
 epoch: 11, train_loss: 1.1643, test_loss: 1.2808, test_f1: 0.3888
 epoch: 12, train_loss: 1.1474, test_loss: 1.2986, test_f1: 0.4061
 epoch: 13, train_loss: 1.1542, test_loss: 1.2573, test_f1: 0.4423
 epoch: 14, train_loss: 1.1389, test_loss: 1.2748, test_f1: 0.4169
 epoch: 15, train_loss: 1.1337, test_loss: 1.2404, test_f1: 0.4206
 epoch: 16, train_loss: 1.1342, test_loss: 1.2531, test_f1: 0.4397
 epoch: 17, train_loss: 1.1357, test_loss: 1.2608, test_f1: 0.4442
 epoch: 18, train_loss: 1.1330, test_loss: 1.2355, test_f1: 0.4772
 epoch: 19, train_loss: 1.1221, test_loss: 1.2406, test_f1: 0.4652
 epoch: 20, train_loss: 1.1148, test_loss: 1.2449, test_f1: 0.4498
 epoch: 21, train_loss: 1.1111, test_loss: 1.2441, test_f1: 0.4529
 epoch: 22, train_loss: 1.0962, test_loss: 1.2131, test_f1: 0.4721
 epoch: 23, train_loss: 1.1109, test_loss: 1.2126, test_f1: 0.4869
 epoch: 24, train_loss: 1.0979, test_loss: 1.2265, test_f1: 0.4823
 epoch: 25, train_loss: 1.1061, test_loss: 1.2417, test_f1: 0.4740
 epoch: 26, train_loss: 1.0978, test_loss: 1.2205, test_f1: 0.4845
 epoch: 27, train_loss: 1.0791, test_loss: 1.2223, test_f1: 0.4501
 epoch: 28, train_loss: 1.0753, test_loss: 1.2036, test_f1: 0.4594
 epoch: 29, train_loss: 1.0707, test_loss: 1.2018, test_f1: 0.4782
 epoch: 30, train_loss: 1.0648, test_loss: 1.1949, test_f1: 0.4889
 epoch: 31, train_loss: 1.0604, test_loss: 1.2099, test_f1: 0.4710
 epoch: 32, train_loss: 1.0566, test_loss: 1.2255, test_f1: 0.4669
 epoch: 33, train_loss: 1.0720, test_loss: 1.2145, test_f1: 0.4724
 epoch: 34, train_loss: 1.0572, test_loss: 1.2076, test_f1: 0.4771
 epoch: 35, train_loss: 1.0538, test_loss: 1.2110, test_f1: 0.4631
 epoch: 36, train_loss: 1.0607, test_loss: 1.2052, test_f1: 0.4594
 epoch: 37, train_loss: 1.0327, test_loss: 1.2179, test_f1: 0.4613
 epoch: 38, train_loss: 1.0476, test_loss: 1.2005, test_f1: 0.4621
 epoch: 39, train_loss: 1.0399, test_loss: 1.2470, test_f1: 0.4599
 epoch: 40, train_loss: 1.0235, test_loss: 1.2249, test_f1: 0.4575
 epoch: 41, train_loss: 1.0152, test_loss: 1.2112, test_f1: 0.4738
 epoch: 42, train_loss: 1.0090, test_loss: 1.2161, test_f1: 0.4779
 epoch: 43, train_loss: 1.0218, test_loss: 1.2256, test_f1: 0.4521
 epoch: 44, train_loss: 1.0109, test_loss: 1.2117, test_f1: 0.4788
 epoch: 45, train_loss: 1.0266, test_loss: 1.2245, test_f1: 0.4646
 epoch: 46, train_loss: 1.0189, test_loss: 1.2307, test_f1: 0.4752
 epoch: 47, train_loss: 1.0090, test_loss: 1.2398, test_f1: 0.4667
 epoch: 48, train_loss: 1.0093, test_loss: 1.2635, test_f1: 0.4602
 epoch: 49, train_loss: 1.0112, test_loss: 1.2366, test_f1: 0.4800
 epoch: 50, train_loss: 1.0052, test_loss: 1.2368, test_f1: 0.4811
 epoch: 51, train_loss: 1.0022, test_loss: 1.2370, test_f1: 0.4779
 epoch: 52, train_loss: 0.9950, test_loss: 1.2499, test_f1: 0.4642
 epoch: 53, train_loss: 0.9915, test_loss: 1.2543, test_f1: 0.4726
 epoch: 54, train_loss: 0.9765, test_loss: 1.2858, test_f1: 0.4759
 epoch: 55, train_loss: 0.9772, test_loss: 1.2740, test_f1: 0.4797
 epoch: 56, train_loss: 0.9902, test_loss: 1.2730, test_f1: 0.4819
 epoch: 57, train_loss: 0.9952, test_loss: 1.2729, test_f1: 0.4737
 epoch: 58, train_loss: 0.9779, test_loss: 1.2783, test_f1: 0.4761
 epoch: 59, train_loss: 0.9969, test_loss: 1.2686, test_f1: 0.4796
 epoch: 60, train_loss: 0.9744, test_loss: 1.2587, test_f1: 0.4792
 epoch: 61, train_loss: 0.9700, test_loss: 1.3156, test_f1: 0.4792
 epoch: 62, train_loss: 0.9727, test_loss: 1.2880, test_f1: 0.4755
 epoch: 63, train_loss: 0.9620, test_loss: 1.2846, test_f1: 0.4723
 epoch: 64, train_loss: 0.9825, test_loss: 1.2970, test_f1: 0.4669
 epoch: 65, train_loss: 0.9760, test_loss: 1.2872, test_f1: 0.4759
 epoch: 66, train_loss: 0.9583, test_loss: 1.2946, test_f1: 0.4662
 epoch: 67, train_loss: 0.9701, test_loss: 1.3024, test_f1: 0.4649
 epoch: 68, train_loss: 0.9640, test_loss: 1.2799, test_f1: 0.4627
 epoch: 69, train_loss: 0.9632, test_loss: 1.2659, test_f1: 0.4755
 epoch: 70, train_loss: 0.9785, test_loss: 1.2799, test_f1: 0.4750
 epoch: 71, train_loss: 0.9709, test_loss: 1.3005, test_f1: 0.4872
 epoch: 72, train_loss: 0.9596, test_loss: 1.2921, test_f1: 0.4870
 epoch: 73, train_loss: 0.9664, test_loss: 1.3089, test_f1: 0.4902
 epoch: 74, train_loss: 0.9667, test_loss: 1.2956, test_f1: 0.4909
 epoch: 75, train_loss: 0.9579, test_loss: 1.2946, test_f1: 0.5001
 epoch: 76, train_loss: 0.9490, test_loss: 1.3101, test_f1: 0.4801
 epoch: 77, train_loss: 0.9484, test_loss: 1.3070, test_f1: 0.4824
 epoch: 78, train_loss: 0.9494, test_loss: 1.3214, test_f1: 0.4834
 epoch: 79, train_loss: 0.9587, test_loss: 1.2945, test_f1: 0.4732
 epoch: 80, train_loss: 0.9660, test_loss: 1.3402, test_f1: 0.4894
 epoch: 81, train_loss: 0.9527, test_loss: 1.3425, test_f1: 0.4783
 epoch: 82, train_loss: 0.9480, test_loss: 1.3084, test_f1: 0.4908
 epoch: 83, train_loss: 0.9529, test_loss: 1.3289, test_f1: 0.4719
 epoch: 84, train_loss: 0.9383, test_loss: 1.3228, test_f1: 0.4771
 epoch: 85, train_loss: 0.9486, test_loss: 1.3160, test_f1: 0.4759
 epoch: 86, train_loss: 0.9398, test_loss: 1.3136, test_f1: 0.4837
 epoch: 87, train_loss: 0.9377, test_loss: 1.3069, test_f1: 0.4673
 epoch: 88, train_loss: 0.9519, test_loss: 1.3048, test_f1: 0.4712
 epoch: 89, train_loss: 0.9439, test_loss: 1.3411, test_f1: 0.4930
 epoch: 90, train_loss: 0.9510, test_loss: 1.3500, test_f1: 0.4911
 epoch: 91, train_loss: 0.9507, test_loss: 1.3226, test_f1: 0.4835
 epoch: 92, train_loss: 0.9469, test_loss: 1.3287, test_f1: 0.4827
 epoch: 93, train_loss: 0.9355, test_loss: 1.3440, test_f1: 0.4936
 epoch: 94, train_loss: 0.9262, test_loss: 1.3388, test_f1: 0.4901
 epoch: 95, train_loss: 0.9355, test_loss: 1.3131, test_f1: 0.4843
 epoch: 96, train_loss: 0.9347, test_loss: 1.3337, test_f1: 0.4871
 epoch: 97, train_loss: 0.9370, test_loss: 1.3522, test_f1: 0.4837
 epoch: 98, train_loss: 0.9254, test_loss: 1.3439, test_f1: 0.4843
 epoch: 99, train_loss: 0.9254, test_loss: 1.3157, test_f1: 0.4825
##################ITERATION #9 ****************************************
 epoch: 0, train_loss: 1.2903, test_loss: 1.3482, test_f1: 0.2988
 epoch: 1, train_loss: 1.2472, test_loss: 1.3254, test_f1: 0.2449
 epoch: 2, train_loss: 1.2384, test_loss: 1.3162, test_f1: 0.2472
 epoch: 3, train_loss: 1.2255, test_loss: 1.3439, test_f1: 0.2563
 epoch: 4, train_loss: 1.2392, test_loss: 1.2837, test_f1: 0.3132
 epoch: 5, train_loss: 1.2071, test_loss: 1.2926, test_f1: 0.3041
 epoch: 6, train_loss: 1.2132, test_loss: 1.2989, test_f1: 0.3221
 epoch: 7, train_loss: 1.1961, test_loss: 1.2953, test_f1: 0.3163
 epoch: 8, train_loss: 1.2015, test_loss: 1.2868, test_f1: 0.3494
 epoch: 9, train_loss: 1.1963, test_loss: 1.2749, test_f1: 0.3424
 epoch: 10, train_loss: 1.1742, test_loss: 1.2595, test_f1: 0.3700
 epoch: 11, train_loss: 1.1858, test_loss: 1.2779, test_f1: 0.3726
 epoch: 12, train_loss: 1.1773, test_loss: 1.2750, test_f1: 0.3841
 epoch: 13, train_loss: 1.1693, test_loss: 1.2595, test_f1: 0.3754
 epoch: 14, train_loss: 1.1635, test_loss: 1.2413, test_f1: 0.3841
 epoch: 15, train_loss: 1.1684, test_loss: 1.2998, test_f1: 0.3948
 epoch: 16, train_loss: 1.1556, test_loss: 1.2455, test_f1: 0.3855
 epoch: 17, train_loss: 1.1361, test_loss: 1.2502, test_f1: 0.4008
 epoch: 18, train_loss: 1.1414, test_loss: 1.2307, test_f1: 0.3832
 epoch: 19, train_loss: 1.1546, test_loss: 1.2533, test_f1: 0.3849
 epoch: 20, train_loss: 1.1390, test_loss: 1.2388, test_f1: 0.3844
 epoch: 21, train_loss: 1.1341, test_loss: 1.2355, test_f1: 0.3926
 epoch: 22, train_loss: 1.1324, test_loss: 1.2328, test_f1: 0.4032
 epoch: 23, train_loss: 1.1202, test_loss: 1.2303, test_f1: 0.3989
 epoch: 24, train_loss: 1.1347, test_loss: 1.2222, test_f1: 0.4266
 epoch: 25, train_loss: 1.1228, test_loss: 1.2266, test_f1: 0.4184
 epoch: 26, train_loss: 1.1239, test_loss: 1.2223, test_f1: 0.4207
 epoch: 27, train_loss: 1.1172, test_loss: 1.2178, test_f1: 0.4555
 epoch: 28, train_loss: 1.1211, test_loss: 1.2164, test_f1: 0.4476
 epoch: 29, train_loss: 1.1080, test_loss: 1.2206, test_f1: 0.4585
 epoch: 30, train_loss: 1.1154, test_loss: 1.2123, test_f1: 0.4437
 epoch: 31, train_loss: 1.1051, test_loss: 1.2104, test_f1: 0.4687
 epoch: 32, train_loss: 1.0954, test_loss: 1.2057, test_f1: 0.4937
 epoch: 33, train_loss: 1.0919, test_loss: 1.2206, test_f1: 0.4614
 epoch: 34, train_loss: 1.0901, test_loss: 1.2072, test_f1: 0.4679
 epoch: 35, train_loss: 1.0967, test_loss: 1.1974, test_f1: 0.4643
 epoch: 36, train_loss: 1.0895, test_loss: 1.1982, test_f1: 0.4610
 epoch: 37, train_loss: 1.0868, test_loss: 1.2081, test_f1: 0.4522
 epoch: 38, train_loss: 1.0839, test_loss: 1.2167, test_f1: 0.4397
 epoch: 39, train_loss: 1.0819, test_loss: 1.2096, test_f1: 0.4760
 epoch: 40, train_loss: 1.0744, test_loss: 1.2087, test_f1: 0.4598
 epoch: 41, train_loss: 1.0795, test_loss: 1.2239, test_f1: 0.4678
 epoch: 42, train_loss: 1.0765, test_loss: 1.1955, test_f1: 0.4722
 epoch: 43, train_loss: 1.0706, test_loss: 1.2029, test_f1: 0.4668
 epoch: 44, train_loss: 1.0705, test_loss: 1.1955, test_f1: 0.4727
 epoch: 45, train_loss: 1.0684, test_loss: 1.2047, test_f1: 0.4733
 epoch: 46, train_loss: 1.0684, test_loss: 1.2182, test_f1: 0.4631
 epoch: 47, train_loss: 1.0689, test_loss: 1.2001, test_f1: 0.4812
 epoch: 48, train_loss: 1.0450, test_loss: 1.2245, test_f1: 0.4867
 epoch: 49, train_loss: 1.0590, test_loss: 1.2015, test_f1: 0.4855
 epoch: 50, train_loss: 1.0517, test_loss: 1.2071, test_f1: 0.4667
 epoch: 51, train_loss: 1.0474, test_loss: 1.2112, test_f1: 0.4770
 epoch: 52, train_loss: 1.0388, test_loss: 1.2239, test_f1: 0.4731
 epoch: 53, train_loss: 1.0443, test_loss: 1.1929, test_f1: 0.4907
 epoch: 54, train_loss: 1.0464, test_loss: 1.2109, test_f1: 0.4744
 epoch: 55, train_loss: 1.0567, test_loss: 1.1967, test_f1: 0.4823
 epoch: 56, train_loss: 1.0343, test_loss: 1.2159, test_f1: 0.4885
 epoch: 57, train_loss: 1.0389, test_loss: 1.2142, test_f1: 0.4946
 epoch: 58, train_loss: 1.0482, test_loss: 1.2092, test_f1: 0.4864
 epoch: 59, train_loss: 1.0528, test_loss: 1.1993, test_f1: 0.4898
 epoch: 60, train_loss: 1.0337, test_loss: 1.2030, test_f1: 0.4944
 epoch: 61, train_loss: 1.0211, test_loss: 1.2068, test_f1: 0.5058
 epoch: 62, train_loss: 1.0370, test_loss: 1.2054, test_f1: 0.4985
 epoch: 63, train_loss: 1.0369, test_loss: 1.2033, test_f1: 0.4943
 epoch: 64, train_loss: 1.0374, test_loss: 1.2175, test_f1: 0.4907
 epoch: 65, train_loss: 1.0228, test_loss: 1.1962, test_f1: 0.5075
 epoch: 66, train_loss: 1.0318, test_loss: 1.2122, test_f1: 0.5037
 epoch: 67, train_loss: 1.0317, test_loss: 1.2143, test_f1: 0.5034
 epoch: 68, train_loss: 1.0385, test_loss: 1.2197, test_f1: 0.4693
 epoch: 69, train_loss: 1.0349, test_loss: 1.2190, test_f1: 0.4667
 epoch: 70, train_loss: 1.0351, test_loss: 1.2074, test_f1: 0.4844
 epoch: 71, train_loss: 1.0134, test_loss: 1.2048, test_f1: 0.4982
 epoch: 72, train_loss: 1.0252, test_loss: 1.2211, test_f1: 0.5071
 epoch: 73, train_loss: 1.0236, test_loss: 1.2378, test_f1: 0.4917
 epoch: 74, train_loss: 1.0274, test_loss: 1.2384, test_f1: 0.5126
 epoch: 75, train_loss: 1.0369, test_loss: 1.2082, test_f1: 0.5043
 epoch: 76, train_loss: 1.0323, test_loss: 1.2170, test_f1: 0.5019
 epoch: 77, train_loss: 1.0146, test_loss: 1.2130, test_f1: 0.4954
 epoch: 78, train_loss: 1.0104, test_loss: 1.2240, test_f1: 0.5021
 epoch: 79, train_loss: 1.0150, test_loss: 1.2156, test_f1: 0.4632
 epoch: 80, train_loss: 1.0193, test_loss: 1.2293, test_f1: 0.4774
 epoch: 81, train_loss: 1.0138, test_loss: 1.2141, test_f1: 0.5012
 epoch: 82, train_loss: 1.0118, test_loss: 1.2221, test_f1: 0.4729
 epoch: 83, train_loss: 1.0040, test_loss: 1.2143, test_f1: 0.5097
 epoch: 84, train_loss: 1.0041, test_loss: 1.2322, test_f1: 0.4765
 epoch: 85, train_loss: 1.0080, test_loss: 1.2329, test_f1: 0.4878
 epoch: 86, train_loss: 1.0048, test_loss: 1.2118, test_f1: 0.4845
 epoch: 87, train_loss: 1.0129, test_loss: 1.2334, test_f1: 0.5042
 epoch: 88, train_loss: 1.0062, test_loss: 1.1997, test_f1: 0.4949
 epoch: 89, train_loss: 1.0068, test_loss: 1.2086, test_f1: 0.4985
 epoch: 90, train_loss: 1.0139, test_loss: 1.2070, test_f1: 0.4849
 epoch: 91, train_loss: 1.0033, test_loss: 1.1882, test_f1: 0.5086
 epoch: 92, train_loss: 1.0102, test_loss: 1.1830, test_f1: 0.5080
 epoch: 93, train_loss: 0.9995, test_loss: 1.1936, test_f1: 0.5012
 epoch: 94, train_loss: 1.0050, test_loss: 1.2018, test_f1: 0.4853
 epoch: 95, train_loss: 1.0027, test_loss: 1.1976, test_f1: 0.5056
 epoch: 96, train_loss: 1.0092, test_loss: 1.2021, test_f1: 0.5082
 epoch: 97, train_loss: 0.9926, test_loss: 1.1969, test_f1: 0.4910
 epoch: 98, train_loss: 1.0062, test_loss: 1.1897, test_f1: 0.4887
 epoch: 99, train_loss: 0.9958, test_loss: 1.1989, test_f1: 0.4940

Training completed in 718.68 seconds
Best F1: 0.5751 at epoch 92
Mean F1 across iterations: 0.5277  0.0324
========================FINAL RESULTS================================
FEGIN weighted F1: 0.5751  0.0324
python main.py --data ltspice_demos --representation component_component --model FEGIN --layers 5 --hiddens 32 --batch_size 32 --lr 0.0001 --emb_size 512 --epochs 100 --save_appendix component_component_L5_H32_BS32_LR0.0001_E512 --no_val
-----



STDERR:
  File "main.py", line 370, in <module>
    main()
  File "main.py", line 254, in main
    dataset = dataset_class(
  File "/home/philip/projects/ltspice_examples_code_repo/Circuit-Completion-Using-GNNs/component_classification_with_link_prediction_head/evaluation/FEGIN/kernel/circuit_datasets.py", line 15, in __init__
    self.data, self.slices = torch.load(self.processed_paths[0])
  File "/home/philip/.local/lib/python3.8/site-packages/torch/serialization.py", line 1040, in load
    warnings.warn(
  File "/usr/lib/python3.8/warnings.py", line 109, in _showwarnmsg
    sw(msg.message, msg.category, msg.filename, msg.lineno,
  File "main.py", line 47, in warn_with_traceback
    traceback.print_stack(file=log)
/home/philip/projects/ltspice_examples_code_repo/Circuit-Completion-Using-GNNs/component_classification_with_link_prediction_head/evaluation/FEGIN/kernel/circuit_datasets.py:15: FutureWarning: You are using `torch.load` with `weights_only=False` (the current default value), which uses the default pickle module implicitly. It is possible to construct malicious pickle data which will execute arbitrary code during unpickling (See https://github.com/pytorch/pytorch/blob/main/SECURITY.md#untrusted-models for more details). In a future release, the default value for `weights_only` will be flipped to `True`. This limits the functions that could be executed during unpickling. Arbitrary objects will no longer be allowed to be loaded via this mode unless they are explicitly allowlisted by the user via `torch.serialization.add_safe_globals`. We recommend you start setting `weights_only=True` for any use case where you don't have full control of the loaded file. Please open an issue on GitHub for any issues related to this experimental feature.
  self.data, self.slices = torch.load(self.processed_paths[0])
