STDOUT:
Results will be saved in /home/philip/projects/ltspice_examples_code_repo/Circuit-Completion-Using-GNNs/component_classification_with_link_prediction_head/evaluation/FEGIN/results/model_FEGIN_dataset_ltspice_examples
Command line input: python main.py --data ltspice_examples --representation component_net --model FEGIN --layers 2 --hiddens 16 --batch_size 32 --lr 0.001 --emb_size 250 --epochs 100 --save_appendix component_net_L2_H16_BS32_LR0.001_E250 --no_val
 is saved.
-----
ltspice_examples - FEGIN
Using 2 layers, 16 hidden units, h = 2
Loading component_net representation dataset
ENTERED
Training FEGIN on component_net representation
Train: 3558, Test: 846
##################ITERATION #0 ****************************************
 epoch: 0, train_loss: 1.3456, test_loss: 1.2652, test_f1: 0.2270
 epoch: 1, train_loss: 1.2455, test_loss: 1.2095, test_f1: 0.2637
 epoch: 2, train_loss: 1.1994, test_loss: 1.1371, test_f1: 0.3603
 epoch: 3, train_loss: 1.1412, test_loss: 1.0699, test_f1: 0.3613
 epoch: 4, train_loss: 1.0828, test_loss: 1.0420, test_f1: 0.3566
 epoch: 5, train_loss: 1.0631, test_loss: 1.0505, test_f1: 0.3525
 epoch: 6, train_loss: 1.0435, test_loss: 1.0411, test_f1: 0.3644
 epoch: 7, train_loss: 1.0373, test_loss: 1.0146, test_f1: 0.3668
 epoch: 8, train_loss: 1.0291, test_loss: 1.0567, test_f1: 0.4196
 epoch: 9, train_loss: 1.0205, test_loss: 0.9822, test_f1: 0.4403
 epoch: 10, train_loss: 1.0040, test_loss: 0.9968, test_f1: 0.4435
 epoch: 11, train_loss: 0.9946, test_loss: 1.0265, test_f1: 0.4861
 epoch: 12, train_loss: 0.9928, test_loss: 0.9911, test_f1: 0.4500
 epoch: 13, train_loss: 0.9909, test_loss: 1.0213, test_f1: 0.4415
 epoch: 14, train_loss: 0.9777, test_loss: 0.9642, test_f1: 0.4660
 epoch: 15, train_loss: 0.9685, test_loss: 0.9954, test_f1: 0.4686
 epoch: 16, train_loss: 0.9636, test_loss: 0.9879, test_f1: 0.4692
 epoch: 17, train_loss: 0.9604, test_loss: 0.9535, test_f1: 0.5070
 epoch: 18, train_loss: 0.9497, test_loss: 1.0059, test_f1: 0.4882
 epoch: 19, train_loss: 0.9526, test_loss: 0.9465, test_f1: 0.4973
 epoch: 20, train_loss: 0.9508, test_loss: 1.0142, test_f1: 0.4938
 epoch: 21, train_loss: 0.9489, test_loss: 0.9952, test_f1: 0.4946
 epoch: 22, train_loss: 0.9362, test_loss: 0.9761, test_f1: 0.5043
 epoch: 23, train_loss: 0.9356, test_loss: 0.9538, test_f1: 0.4954
 epoch: 24, train_loss: 0.9475, test_loss: 0.9369, test_f1: 0.5049
 epoch: 25, train_loss: 0.9419, test_loss: 0.9789, test_f1: 0.4888
 epoch: 26, train_loss: 0.9340, test_loss: 0.9622, test_f1: 0.5202
 epoch: 27, train_loss: 0.9186, test_loss: 0.9782, test_f1: 0.4965
 epoch: 28, train_loss: 0.9221, test_loss: 0.9806, test_f1: 0.5078
 epoch: 29, train_loss: 0.9209, test_loss: 0.9358, test_f1: 0.5215
 epoch: 30, train_loss: 0.9135, test_loss: 0.9524, test_f1: 0.4938
 epoch: 31, train_loss: 0.9204, test_loss: 0.9569, test_f1: 0.4878
 epoch: 32, train_loss: 0.9078, test_loss: 0.9660, test_f1: 0.5450
 epoch: 33, train_loss: 0.9147, test_loss: 0.9192, test_f1: 0.5034
 epoch: 34, train_loss: 0.8979, test_loss: 0.9523, test_f1: 0.5119
 epoch: 35, train_loss: 0.9104, test_loss: 0.9547, test_f1: 0.5086
 epoch: 36, train_loss: 0.9070, test_loss: 0.9316, test_f1: 0.5252
 epoch: 37, train_loss: 0.8994, test_loss: 0.9527, test_f1: 0.5028
 epoch: 38, train_loss: 0.9057, test_loss: 0.9497, test_f1: 0.5227
 epoch: 39, train_loss: 0.9020, test_loss: 0.9524, test_f1: 0.4942
 epoch: 40, train_loss: 0.8934, test_loss: 0.9350, test_f1: 0.5080
 epoch: 41, train_loss: 0.8967, test_loss: 0.9387, test_f1: 0.5169
 epoch: 42, train_loss: 0.8910, test_loss: 0.9327, test_f1: 0.5180
 epoch: 43, train_loss: 0.8926, test_loss: 0.9210, test_f1: 0.5286
 epoch: 44, train_loss: 0.8856, test_loss: 0.9305, test_f1: 0.5189
 epoch: 45, train_loss: 0.8860, test_loss: 0.9073, test_f1: 0.5100
 epoch: 46, train_loss: 0.8963, test_loss: 0.8990, test_f1: 0.5229
 epoch: 47, train_loss: 0.8666, test_loss: 0.9221, test_f1: 0.5267
 epoch: 48, train_loss: 0.8807, test_loss: 0.9353, test_f1: 0.5227
 epoch: 49, train_loss: 0.8918, test_loss: 0.9012, test_f1: 0.5248
 epoch: 50, train_loss: 0.8828, test_loss: 0.9274, test_f1: 0.5475
 epoch: 51, train_loss: 0.8635, test_loss: 0.9015, test_f1: 0.5175
 epoch: 52, train_loss: 0.8605, test_loss: 0.9235, test_f1: 0.5251
 epoch: 53, train_loss: 0.8704, test_loss: 0.9243, test_f1: 0.5192
 epoch: 54, train_loss: 0.8682, test_loss: 0.9221, test_f1: 0.5194
 epoch: 55, train_loss: 0.8562, test_loss: 0.8928, test_f1: 0.5387
 epoch: 56, train_loss: 0.8552, test_loss: 0.9144, test_f1: 0.5153
 epoch: 57, train_loss: 0.8661, test_loss: 0.9147, test_f1: 0.5152
 epoch: 58, train_loss: 0.8624, test_loss: 0.9084, test_f1: 0.5276
 epoch: 59, train_loss: 0.8601, test_loss: 0.9342, test_f1: 0.5245
 epoch: 60, train_loss: 0.8636, test_loss: 0.9141, test_f1: 0.5257
 epoch: 61, train_loss: 0.8593, test_loss: 0.9167, test_f1: 0.5292
 epoch: 62, train_loss: 0.8551, test_loss: 0.9186, test_f1: 0.5363
 epoch: 63, train_loss: 0.8502, test_loss: 0.8936, test_f1: 0.5358
 epoch: 64, train_loss: 0.8654, test_loss: 0.9217, test_f1: 0.5312
 epoch: 65, train_loss: 0.8456, test_loss: 0.9243, test_f1: 0.5249
 epoch: 66, train_loss: 0.8563, test_loss: 0.9035, test_f1: 0.5428
 epoch: 67, train_loss: 0.8485, test_loss: 0.9150, test_f1: 0.5529
 epoch: 68, train_loss: 0.8513, test_loss: 0.9106, test_f1: 0.5462
 epoch: 69, train_loss: 0.8493, test_loss: 0.9297, test_f1: 0.5547
 epoch: 70, train_loss: 0.8544, test_loss: 0.9313, test_f1: 0.5306
 epoch: 71, train_loss: 0.8457, test_loss: 0.9174, test_f1: 0.5258
 epoch: 72, train_loss: 0.8514, test_loss: 0.8933, test_f1: 0.5396
 epoch: 73, train_loss: 0.8442, test_loss: 0.9214, test_f1: 0.5426
 epoch: 74, train_loss: 0.8557, test_loss: 0.9154, test_f1: 0.5270
 epoch: 75, train_loss: 0.8432, test_loss: 0.9016, test_f1: 0.5178
 epoch: 76, train_loss: 0.8513, test_loss: 0.9095, test_f1: 0.5300
 epoch: 77, train_loss: 0.8392, test_loss: 0.8916, test_f1: 0.5520
 epoch: 78, train_loss: 0.8494, test_loss: 0.9183, test_f1: 0.5195
 epoch: 79, train_loss: 0.8403, test_loss: 0.8805, test_f1: 0.5495
 epoch: 80, train_loss: 0.8429, test_loss: 0.9175, test_f1: 0.5284
 epoch: 81, train_loss: 0.8507, test_loss: 0.9265, test_f1: 0.5462
 epoch: 82, train_loss: 0.8430, test_loss: 0.8991, test_f1: 0.5674
 epoch: 83, train_loss: 0.8428, test_loss: 0.9118, test_f1: 0.5360
 epoch: 84, train_loss: 0.8360, test_loss: 0.9173, test_f1: 0.5332
 epoch: 85, train_loss: 0.8276, test_loss: 0.9165, test_f1: 0.5356
 epoch: 86, train_loss: 0.8348, test_loss: 0.9156, test_f1: 0.5418
 epoch: 87, train_loss: 0.8481, test_loss: 0.9331, test_f1: 0.5441
 epoch: 88, train_loss: 0.8392, test_loss: 0.9335, test_f1: 0.5314
 epoch: 89, train_loss: 0.8444, test_loss: 0.9256, test_f1: 0.5343
 epoch: 90, train_loss: 0.8350, test_loss: 0.9254, test_f1: 0.5430
 epoch: 91, train_loss: 0.8375, test_loss: 0.9219, test_f1: 0.5293
 epoch: 92, train_loss: 0.8301, test_loss: 0.9154, test_f1: 0.5376
 epoch: 93, train_loss: 0.8508, test_loss: 0.9209, test_f1: 0.5344
 epoch: 94, train_loss: 0.8365, test_loss: 0.8950, test_f1: 0.5303
 epoch: 95, train_loss: 0.8359, test_loss: 0.9131, test_f1: 0.5367
 epoch: 96, train_loss: 0.8360, test_loss: 0.9174, test_f1: 0.5316
 epoch: 97, train_loss: 0.8465, test_loss: 0.9270, test_f1: 0.5264
 epoch: 98, train_loss: 0.8402, test_loss: 0.9555, test_f1: 0.5045
 epoch: 99, train_loss: 0.8439, test_loss: 0.9226, test_f1: 0.5354
##################ITERATION #1 ****************************************
 epoch: 0, train_loss: 1.2425, test_loss: 1.1497, test_f1: 0.2581
 epoch: 1, train_loss: 1.1533, test_loss: 1.0721, test_f1: 0.3526
 epoch: 2, train_loss: 1.0928, test_loss: 1.0558, test_f1: 0.3642
 epoch: 3, train_loss: 1.0699, test_loss: 1.0461, test_f1: 0.3840
 epoch: 4, train_loss: 1.0474, test_loss: 1.0372, test_f1: 0.4139
 epoch: 5, train_loss: 1.0287, test_loss: 1.0275, test_f1: 0.4015
 epoch: 6, train_loss: 1.0183, test_loss: 1.0341, test_f1: 0.4602
 epoch: 7, train_loss: 1.0108, test_loss: 1.0142, test_f1: 0.4660
 epoch: 8, train_loss: 0.9943, test_loss: 1.0072, test_f1: 0.4817
 epoch: 9, train_loss: 0.9885, test_loss: 1.0054, test_f1: 0.4716
 epoch: 10, train_loss: 0.9883, test_loss: 0.9897, test_f1: 0.4925
 epoch: 11, train_loss: 0.9751, test_loss: 1.0196, test_f1: 0.4731
 epoch: 12, train_loss: 0.9678, test_loss: 1.0005, test_f1: 0.4962
 epoch: 13, train_loss: 0.9610, test_loss: 0.9631, test_f1: 0.5075
 epoch: 14, train_loss: 0.9569, test_loss: 0.9816, test_f1: 0.4961
 epoch: 15, train_loss: 0.9612, test_loss: 0.9970, test_f1: 0.4998
 epoch: 16, train_loss: 0.9572, test_loss: 1.0086, test_f1: 0.4915
 epoch: 17, train_loss: 0.9482, test_loss: 1.0216, test_f1: 0.4729
 epoch: 18, train_loss: 0.9514, test_loss: 1.0041, test_f1: 0.4668
 epoch: 19, train_loss: 0.9402, test_loss: 1.0453, test_f1: 0.4793
 epoch: 20, train_loss: 0.9415, test_loss: 1.0306, test_f1: 0.4869
 epoch: 21, train_loss: 0.9253, test_loss: 1.0140, test_f1: 0.4990
 epoch: 22, train_loss: 0.9389, test_loss: 1.0305, test_f1: 0.4900
 epoch: 23, train_loss: 0.9300, test_loss: 0.9656, test_f1: 0.5152
 epoch: 24, train_loss: 0.9386, test_loss: 0.9515, test_f1: 0.5054
 epoch: 25, train_loss: 0.9231, test_loss: 0.9666, test_f1: 0.5053
 epoch: 26, train_loss: 0.9190, test_loss: 0.9600, test_f1: 0.5036
 epoch: 27, train_loss: 0.9225, test_loss: 1.0303, test_f1: 0.5161
 epoch: 28, train_loss: 0.9141, test_loss: 0.9596, test_f1: 0.5142
 epoch: 29, train_loss: 0.9030, test_loss: 0.9646, test_f1: 0.5493
 epoch: 30, train_loss: 0.9101, test_loss: 0.9784, test_f1: 0.5133
 epoch: 31, train_loss: 0.9169, test_loss: 0.9556, test_f1: 0.5251
 epoch: 32, train_loss: 0.9068, test_loss: 0.9366, test_f1: 0.5169
 epoch: 33, train_loss: 0.9116, test_loss: 0.9306, test_f1: 0.5339
 epoch: 34, train_loss: 0.9026, test_loss: 0.9564, test_f1: 0.5140
 epoch: 35, train_loss: 0.9041, test_loss: 0.9502, test_f1: 0.5444
 epoch: 36, train_loss: 0.8969, test_loss: 0.9966, test_f1: 0.5251
 epoch: 37, train_loss: 0.9096, test_loss: 0.9646, test_f1: 0.5210
 epoch: 38, train_loss: 0.8991, test_loss: 0.9407, test_f1: 0.5144
 epoch: 39, train_loss: 0.8963, test_loss: 0.9310, test_f1: 0.5174
 epoch: 40, train_loss: 0.8949, test_loss: 0.9284, test_f1: 0.5362
 epoch: 41, train_loss: 0.8941, test_loss: 0.9541, test_f1: 0.5243
 epoch: 42, train_loss: 0.8911, test_loss: 0.9491, test_f1: 0.5198
 epoch: 43, train_loss: 0.8757, test_loss: 0.9273, test_f1: 0.5485
 epoch: 44, train_loss: 0.8788, test_loss: 0.9265, test_f1: 0.5334
 epoch: 45, train_loss: 0.8736, test_loss: 0.9268, test_f1: 0.5523
 epoch: 46, train_loss: 0.8763, test_loss: 0.9430, test_f1: 0.5508
 epoch: 47, train_loss: 0.8864, test_loss: 0.9554, test_f1: 0.5354
 epoch: 48, train_loss: 0.8801, test_loss: 0.9173, test_f1: 0.5130
 epoch: 49, train_loss: 0.8763, test_loss: 0.9214, test_f1: 0.5373
 epoch: 50, train_loss: 0.8650, test_loss: 0.9230, test_f1: 0.5323
 epoch: 51, train_loss: 0.8648, test_loss: 0.9213, test_f1: 0.5308
 epoch: 52, train_loss: 0.8642, test_loss: 0.9226, test_f1: 0.5304
 epoch: 53, train_loss: 0.8681, test_loss: 0.9179, test_f1: 0.5284
 epoch: 54, train_loss: 0.8614, test_loss: 0.9017, test_f1: 0.5293
 epoch: 55, train_loss: 0.8667, test_loss: 0.9228, test_f1: 0.5260
 epoch: 56, train_loss: 0.8688, test_loss: 0.9150, test_f1: 0.5206
 epoch: 57, train_loss: 0.8618, test_loss: 0.9167, test_f1: 0.5285
 epoch: 58, train_loss: 0.8603, test_loss: 0.9357, test_f1: 0.5297
 epoch: 59, train_loss: 0.8536, test_loss: 0.9320, test_f1: 0.5304
 epoch: 60, train_loss: 0.8589, test_loss: 0.9159, test_f1: 0.5235
 epoch: 61, train_loss: 0.8616, test_loss: 0.9181, test_f1: 0.5202
 epoch: 62, train_loss: 0.8642, test_loss: 0.9222, test_f1: 0.5293
 epoch: 63, train_loss: 0.8532, test_loss: 0.9317, test_f1: 0.5185
 epoch: 64, train_loss: 0.8533, test_loss: 0.9400, test_f1: 0.5240
 epoch: 65, train_loss: 0.8541, test_loss: 0.9418, test_f1: 0.5153
 epoch: 66, train_loss: 0.8567, test_loss: 0.9324, test_f1: 0.5254
 epoch: 67, train_loss: 0.8560, test_loss: 0.9154, test_f1: 0.5268
 epoch: 68, train_loss: 0.8495, test_loss: 0.9371, test_f1: 0.5160
 epoch: 69, train_loss: 0.8488, test_loss: 0.9198, test_f1: 0.5296
 epoch: 70, train_loss: 0.8464, test_loss: 0.9271, test_f1: 0.5236
 epoch: 71, train_loss: 0.8571, test_loss: 0.8996, test_f1: 0.5214
 epoch: 72, train_loss: 0.8456, test_loss: 0.9374, test_f1: 0.5337
 epoch: 73, train_loss: 0.8549, test_loss: 0.9249, test_f1: 0.5376
 epoch: 74, train_loss: 0.8571, test_loss: 0.9047, test_f1: 0.5283
 epoch: 75, train_loss: 0.8430, test_loss: 0.9093, test_f1: 0.5189
 epoch: 76, train_loss: 0.8455, test_loss: 0.9239, test_f1: 0.5237
 epoch: 77, train_loss: 0.8465, test_loss: 0.9264, test_f1: 0.5234
 epoch: 78, train_loss: 0.8452, test_loss: 0.9028, test_f1: 0.5254
 epoch: 79, train_loss: 0.8544, test_loss: 0.9136, test_f1: 0.5278
 epoch: 80, train_loss: 0.8429, test_loss: 0.9187, test_f1: 0.5257
 epoch: 81, train_loss: 0.8556, test_loss: 0.9199, test_f1: 0.5259
 epoch: 82, train_loss: 0.8431, test_loss: 0.9153, test_f1: 0.5232
 epoch: 83, train_loss: 0.8471, test_loss: 0.9217, test_f1: 0.5256
 epoch: 84, train_loss: 0.8448, test_loss: 0.9112, test_f1: 0.5298
 epoch: 85, train_loss: 0.8281, test_loss: 0.9115, test_f1: 0.5313
 epoch: 86, train_loss: 0.8411, test_loss: 0.9069, test_f1: 0.5444
 epoch: 87, train_loss: 0.8407, test_loss: 0.9176, test_f1: 0.5502
 epoch: 88, train_loss: 0.8427, test_loss: 0.9281, test_f1: 0.5295
 epoch: 89, train_loss: 0.8479, test_loss: 0.9290, test_f1: 0.5436
 epoch: 90, train_loss: 0.8431, test_loss: 0.9191, test_f1: 0.5356
 epoch: 91, train_loss: 0.8366, test_loss: 0.9152, test_f1: 0.5386
 epoch: 92, train_loss: 0.8467, test_loss: 0.9212, test_f1: 0.5384
 epoch: 93, train_loss: 0.8374, test_loss: 0.9225, test_f1: 0.5378
 epoch: 94, train_loss: 0.8436, test_loss: 0.9216, test_f1: 0.5267
 epoch: 95, train_loss: 0.8471, test_loss: 0.9054, test_f1: 0.5326
 epoch: 96, train_loss: 0.8223, test_loss: 0.9186, test_f1: 0.5216
 epoch: 97, train_loss: 0.8419, test_loss: 0.9365, test_f1: 0.5462
 epoch: 98, train_loss: 0.8443, test_loss: 0.9138, test_f1: 0.5241
 epoch: 99, train_loss: 0.8284, test_loss: 0.9245, test_f1: 0.5240
##################ITERATION #2 ****************************************
 epoch: 0, train_loss: 1.2164, test_loss: 1.0943, test_f1: 0.4070
 epoch: 1, train_loss: 1.1234, test_loss: 1.0594, test_f1: 0.3854
 epoch: 2, train_loss: 1.0877, test_loss: 1.0400, test_f1: 0.3930
 epoch: 3, train_loss: 1.0650, test_loss: 1.0277, test_f1: 0.4087
 epoch: 4, train_loss: 1.0381, test_loss: 1.0262, test_f1: 0.4259
 epoch: 5, train_loss: 1.0293, test_loss: 1.0064, test_f1: 0.4381
 epoch: 6, train_loss: 1.0141, test_loss: 1.0086, test_f1: 0.4608
 epoch: 7, train_loss: 0.9934, test_loss: 0.9952, test_f1: 0.4313
 epoch: 8, train_loss: 0.9885, test_loss: 0.9858, test_f1: 0.4375
 epoch: 9, train_loss: 0.9803, test_loss: 0.9732, test_f1: 0.4749
 epoch: 10, train_loss: 0.9761, test_loss: 0.9570, test_f1: 0.4653
 epoch: 11, train_loss: 0.9675, test_loss: 0.9580, test_f1: 0.5033
 epoch: 12, train_loss: 0.9539, test_loss: 0.9704, test_f1: 0.5045
 epoch: 13, train_loss: 0.9518, test_loss: 0.9719, test_f1: 0.5129
 epoch: 14, train_loss: 0.9538, test_loss: 0.9557, test_f1: 0.5011
 epoch: 15, train_loss: 0.9402, test_loss: 0.9839, test_f1: 0.5037
 epoch: 16, train_loss: 0.9540, test_loss: 0.9895, test_f1: 0.5005
 epoch: 17, train_loss: 0.9412, test_loss: 0.9730, test_f1: 0.4808
 epoch: 18, train_loss: 0.9503, test_loss: 0.9730, test_f1: 0.5072
 epoch: 19, train_loss: 0.9329, test_loss: 0.9697, test_f1: 0.4873
 epoch: 20, train_loss: 0.9303, test_loss: 0.9480, test_f1: 0.5189
 epoch: 21, train_loss: 0.9360, test_loss: 0.9735, test_f1: 0.5060
 epoch: 22, train_loss: 0.9243, test_loss: 0.9388, test_f1: 0.5344
 epoch: 23, train_loss: 0.9214, test_loss: 0.9450, test_f1: 0.5078
 epoch: 24, train_loss: 0.9270, test_loss: 0.9540, test_f1: 0.5225
 epoch: 25, train_loss: 0.9259, test_loss: 0.9624, test_f1: 0.5195
 epoch: 26, train_loss: 0.9140, test_loss: 0.9556, test_f1: 0.5329
 epoch: 27, train_loss: 0.9168, test_loss: 0.9368, test_f1: 0.5041
 epoch: 28, train_loss: 0.9098, test_loss: 0.8971, test_f1: 0.5174
 epoch: 29, train_loss: 0.9109, test_loss: 0.9288, test_f1: 0.5191
 epoch: 30, train_loss: 0.9088, test_loss: 0.9621, test_f1: 0.5127
 epoch: 31, train_loss: 0.9046, test_loss: 0.9398, test_f1: 0.5182
 epoch: 32, train_loss: 0.9054, test_loss: 0.9374, test_f1: 0.5213
 epoch: 33, train_loss: 0.8981, test_loss: 0.9384, test_f1: 0.5132
 epoch: 34, train_loss: 0.9003, test_loss: 0.9225, test_f1: 0.5288
 epoch: 35, train_loss: 0.8971, test_loss: 0.9361, test_f1: 0.5404
 epoch: 36, train_loss: 0.8918, test_loss: 0.9168, test_f1: 0.5249
 epoch: 37, train_loss: 0.8915, test_loss: 0.9111, test_f1: 0.5265
 epoch: 38, train_loss: 0.8984, test_loss: 0.9018, test_f1: 0.5193
 epoch: 39, train_loss: 0.8821, test_loss: 0.9292, test_f1: 0.5263
 epoch: 40, train_loss: 0.8765, test_loss: 0.9391, test_f1: 0.5276
 epoch: 41, train_loss: 0.8873, test_loss: 0.9222, test_f1: 0.5407
 epoch: 42, train_loss: 0.8899, test_loss: 0.9162, test_f1: 0.5297
 epoch: 43, train_loss: 0.8957, test_loss: 0.9434, test_f1: 0.5231
 epoch: 44, train_loss: 0.8887, test_loss: 0.9321, test_f1: 0.5188
 epoch: 45, train_loss: 0.8849, test_loss: 0.8947, test_f1: 0.5422
 epoch: 46, train_loss: 0.8690, test_loss: 0.9166, test_f1: 0.5369
 epoch: 47, train_loss: 0.8848, test_loss: 0.9012, test_f1: 0.5424
 epoch: 48, train_loss: 0.8813, test_loss: 0.9256, test_f1: 0.5320
 epoch: 49, train_loss: 0.8765, test_loss: 0.9200, test_f1: 0.5160
 epoch: 50, train_loss: 0.8709, test_loss: 0.9203, test_f1: 0.5080
 epoch: 51, train_loss: 0.8653, test_loss: 0.9121, test_f1: 0.5297
 epoch: 52, train_loss: 0.8623, test_loss: 0.9043, test_f1: 0.5456
 epoch: 53, train_loss: 0.8555, test_loss: 0.9186, test_f1: 0.5419
 epoch: 54, train_loss: 0.8600, test_loss: 0.9246, test_f1: 0.5271
 epoch: 55, train_loss: 0.8508, test_loss: 0.9271, test_f1: 0.5300
 epoch: 56, train_loss: 0.8591, test_loss: 0.9041, test_f1: 0.5511
 epoch: 57, train_loss: 0.8412, test_loss: 0.9164, test_f1: 0.5363
 epoch: 58, train_loss: 0.8543, test_loss: 0.9008, test_f1: 0.5424
 epoch: 59, train_loss: 0.8503, test_loss: 0.8976, test_f1: 0.5479
 epoch: 60, train_loss: 0.8600, test_loss: 0.9291, test_f1: 0.5468
 epoch: 61, train_loss: 0.8486, test_loss: 0.9282, test_f1: 0.5267
 epoch: 62, train_loss: 0.8538, test_loss: 0.9197, test_f1: 0.5468
 epoch: 63, train_loss: 0.8549, test_loss: 0.9190, test_f1: 0.5214
 epoch: 64, train_loss: 0.8517, test_loss: 0.9388, test_f1: 0.5237
 epoch: 65, train_loss: 0.8517, test_loss: 0.9307, test_f1: 0.5400
 epoch: 66, train_loss: 0.8548, test_loss: 0.8829, test_f1: 0.5429
 epoch: 67, train_loss: 0.8460, test_loss: 0.8834, test_f1: 0.5319
 epoch: 68, train_loss: 0.8419, test_loss: 0.9167, test_f1: 0.5420
 epoch: 69, train_loss: 0.8394, test_loss: 0.9272, test_f1: 0.5144
 epoch: 70, train_loss: 0.8534, test_loss: 0.8947, test_f1: 0.5289
 epoch: 71, train_loss: 0.8481, test_loss: 0.9382, test_f1: 0.5181
 epoch: 72, train_loss: 0.8438, test_loss: 0.9076, test_f1: 0.5384
 epoch: 73, train_loss: 0.8515, test_loss: 0.9005, test_f1: 0.5465
 epoch: 74, train_loss: 0.8310, test_loss: 0.9345, test_f1: 0.5274
 epoch: 75, train_loss: 0.8518, test_loss: 0.8956, test_f1: 0.5537
 epoch: 76, train_loss: 0.8333, test_loss: 0.9087, test_f1: 0.5417
 epoch: 77, train_loss: 0.8390, test_loss: 0.9100, test_f1: 0.5270
 epoch: 78, train_loss: 0.8397, test_loss: 0.8879, test_f1: 0.5429
 epoch: 79, train_loss: 0.8380, test_loss: 0.9106, test_f1: 0.5441
 epoch: 80, train_loss: 0.8390, test_loss: 0.9149, test_f1: 0.5483
 epoch: 81, train_loss: 0.8365, test_loss: 0.9193, test_f1: 0.5495
 epoch: 82, train_loss: 0.8402, test_loss: 0.9132, test_f1: 0.5515
 epoch: 83, train_loss: 0.8350, test_loss: 0.9057, test_f1: 0.5351
 epoch: 84, train_loss: 0.8430, test_loss: 0.9246, test_f1: 0.5338
 epoch: 85, train_loss: 0.8318, test_loss: 0.9041, test_f1: 0.5361
 epoch: 86, train_loss: 0.8338, test_loss: 0.8911, test_f1: 0.5550
 epoch: 87, train_loss: 0.8419, test_loss: 0.9009, test_f1: 0.5522
 epoch: 88, train_loss: 0.8423, test_loss: 0.9078, test_f1: 0.5264
 epoch: 89, train_loss: 0.8317, test_loss: 0.9184, test_f1: 0.5427
 epoch: 90, train_loss: 0.8341, test_loss: 0.9228, test_f1: 0.5437
 epoch: 91, train_loss: 0.8223, test_loss: 0.9214, test_f1: 0.5320
 epoch: 92, train_loss: 0.8143, test_loss: 0.9135, test_f1: 0.5436
 epoch: 93, train_loss: 0.8291, test_loss: 0.9060, test_f1: 0.5311
 epoch: 94, train_loss: 0.8300, test_loss: 0.9072, test_f1: 0.5333
 epoch: 95, train_loss: 0.8398, test_loss: 0.9111, test_f1: 0.5537
 epoch: 96, train_loss: 0.8443, test_loss: 0.9398, test_f1: 0.5560
 epoch: 97, train_loss: 0.8286, test_loss: 0.9255, test_f1: 0.5613
 epoch: 98, train_loss: 0.8321, test_loss: 0.8968, test_f1: 0.5674
 epoch: 99, train_loss: 0.8215, test_loss: 0.9178, test_f1: 0.5471
##################ITERATION #3 ****************************************
 epoch: 0, train_loss: 1.2478, test_loss: 1.1457, test_f1: 0.3635
 epoch: 1, train_loss: 1.1437, test_loss: 1.0596, test_f1: 0.4444
 epoch: 2, train_loss: 1.1104, test_loss: 1.0260, test_f1: 0.4509
 epoch: 3, train_loss: 1.0760, test_loss: 0.9999, test_f1: 0.4480
 epoch: 4, train_loss: 1.0543, test_loss: 1.0056, test_f1: 0.4552
 epoch: 5, train_loss: 1.0344, test_loss: 0.9812, test_f1: 0.4696
 epoch: 6, train_loss: 1.0190, test_loss: 0.9866, test_f1: 0.4461
 epoch: 7, train_loss: 1.0073, test_loss: 1.0022, test_f1: 0.4686
 epoch: 8, train_loss: 0.9937, test_loss: 0.9893, test_f1: 0.4686
 epoch: 9, train_loss: 0.9817, test_loss: 0.9641, test_f1: 0.4656
 epoch: 10, train_loss: 0.9840, test_loss: 0.9807, test_f1: 0.4830
 epoch: 11, train_loss: 0.9749, test_loss: 0.9548, test_f1: 0.4871
 epoch: 12, train_loss: 0.9853, test_loss: 0.9669, test_f1: 0.4837
 epoch: 13, train_loss: 0.9777, test_loss: 0.9926, test_f1: 0.4858
 epoch: 14, train_loss: 0.9679, test_loss: 0.9855, test_f1: 0.4765
 epoch: 15, train_loss: 0.9575, test_loss: 0.9851, test_f1: 0.4920
 epoch: 16, train_loss: 0.9523, test_loss: 0.9749, test_f1: 0.4968
 epoch: 17, train_loss: 0.9494, test_loss: 1.0288, test_f1: 0.4698
 epoch: 18, train_loss: 0.9491, test_loss: 0.9839, test_f1: 0.5035
 epoch: 19, train_loss: 0.9490, test_loss: 1.0001, test_f1: 0.4714
 epoch: 20, train_loss: 0.9303, test_loss: 0.9893, test_f1: 0.4913
 epoch: 21, train_loss: 0.9302, test_loss: 0.9686, test_f1: 0.4974
 epoch: 22, train_loss: 0.9327, test_loss: 1.0096, test_f1: 0.4749
 epoch: 23, train_loss: 0.9349, test_loss: 0.9460, test_f1: 0.4994
 epoch: 24, train_loss: 0.9353, test_loss: 0.9760, test_f1: 0.5094
 epoch: 25, train_loss: 0.9229, test_loss: 0.9928, test_f1: 0.4966
 epoch: 26, train_loss: 0.9220, test_loss: 1.0165, test_f1: 0.5109
 epoch: 27, train_loss: 0.9210, test_loss: 0.9535, test_f1: 0.4891
 epoch: 28, train_loss: 0.9266, test_loss: 0.9986, test_f1: 0.4683
 epoch: 29, train_loss: 0.9236, test_loss: 0.9434, test_f1: 0.4862
 epoch: 30, train_loss: 0.9294, test_loss: 0.9571, test_f1: 0.4880
 epoch: 31, train_loss: 0.9220, test_loss: 0.9829, test_f1: 0.4902
 epoch: 32, train_loss: 0.9136, test_loss: 0.9722, test_f1: 0.4733
 epoch: 33, train_loss: 0.9034, test_loss: 0.9756, test_f1: 0.4947
 epoch: 34, train_loss: 0.9117, test_loss: 0.9565, test_f1: 0.4932
 epoch: 35, train_loss: 0.9126, test_loss: 0.9588, test_f1: 0.5268
 epoch: 36, train_loss: 0.9208, test_loss: 0.9902, test_f1: 0.4822
 epoch: 37, train_loss: 0.9173, test_loss: 0.9413, test_f1: 0.4930
 epoch: 38, train_loss: 0.9257, test_loss: 0.9719, test_f1: 0.4884
 epoch: 39, train_loss: 0.9032, test_loss: 0.9565, test_f1: 0.5009
 epoch: 40, train_loss: 0.9122, test_loss: 1.0010, test_f1: 0.4653
 epoch: 41, train_loss: 0.9114, test_loss: 0.9986, test_f1: 0.4861
 epoch: 42, train_loss: 0.9068, test_loss: 0.9787, test_f1: 0.4898
 epoch: 43, train_loss: 0.8966, test_loss: 0.9930, test_f1: 0.4950
 epoch: 44, train_loss: 0.8985, test_loss: 1.0110, test_f1: 0.4928
 epoch: 45, train_loss: 0.9028, test_loss: 0.9724, test_f1: 0.5004
 epoch: 46, train_loss: 0.9038, test_loss: 1.0103, test_f1: 0.4729
 epoch: 47, train_loss: 0.9056, test_loss: 0.9687, test_f1: 0.5160
 epoch: 48, train_loss: 0.9064, test_loss: 0.9552, test_f1: 0.4986
 epoch: 49, train_loss: 0.8982, test_loss: 0.9608, test_f1: 0.5032
 epoch: 50, train_loss: 0.8998, test_loss: 0.9832, test_f1: 0.4983
 epoch: 51, train_loss: 0.8920, test_loss: 0.9592, test_f1: 0.5054
 epoch: 52, train_loss: 0.8853, test_loss: 0.9620, test_f1: 0.4977
 epoch: 53, train_loss: 0.8836, test_loss: 0.9777, test_f1: 0.5123
 epoch: 54, train_loss: 0.8781, test_loss: 0.9668, test_f1: 0.5078
 epoch: 55, train_loss: 0.8832, test_loss: 0.9436, test_f1: 0.5216
 epoch: 56, train_loss: 0.8710, test_loss: 0.9624, test_f1: 0.5122
 epoch: 57, train_loss: 0.8765, test_loss: 0.9765, test_f1: 0.5020
 epoch: 58, train_loss: 0.8764, test_loss: 0.9938, test_f1: 0.4924
 epoch: 59, train_loss: 0.8835, test_loss: 0.9587, test_f1: 0.5084
 epoch: 60, train_loss: 0.8752, test_loss: 0.9420, test_f1: 0.5009
 epoch: 61, train_loss: 0.8802, test_loss: 0.9546, test_f1: 0.5097
 epoch: 62, train_loss: 0.8665, test_loss: 0.9696, test_f1: 0.5060
 epoch: 63, train_loss: 0.8715, test_loss: 0.9558, test_f1: 0.5219
 epoch: 64, train_loss: 0.8857, test_loss: 0.9610, test_f1: 0.5044
 epoch: 65, train_loss: 0.8699, test_loss: 0.9838, test_f1: 0.5165
 epoch: 66, train_loss: 0.8688, test_loss: 0.9722, test_f1: 0.5000
 epoch: 67, train_loss: 0.8566, test_loss: 0.9747, test_f1: 0.4965
 epoch: 68, train_loss: 0.8671, test_loss: 1.0010, test_f1: 0.4804
 epoch: 69, train_loss: 0.8628, test_loss: 0.9727, test_f1: 0.5334
 epoch: 70, train_loss: 0.8672, test_loss: 0.9688, test_f1: 0.5292
 epoch: 71, train_loss: 0.8683, test_loss: 0.9666, test_f1: 0.5314
 epoch: 72, train_loss: 0.8714, test_loss: 0.9558, test_f1: 0.5120
 epoch: 73, train_loss: 0.8680, test_loss: 0.9619, test_f1: 0.5194
 epoch: 74, train_loss: 0.8690, test_loss: 0.9496, test_f1: 0.5270
 epoch: 75, train_loss: 0.8628, test_loss: 0.9618, test_f1: 0.5307
 epoch: 76, train_loss: 0.8554, test_loss: 0.9524, test_f1: 0.5096
 epoch: 77, train_loss: 0.8585, test_loss: 0.9417, test_f1: 0.5223
 epoch: 78, train_loss: 0.8632, test_loss: 0.9531, test_f1: 0.4991
 epoch: 79, train_loss: 0.8727, test_loss: 0.9996, test_f1: 0.4934
 epoch: 80, train_loss: 0.8501, test_loss: 0.9750, test_f1: 0.5175
 epoch: 81, train_loss: 0.8609, test_loss: 0.9494, test_f1: 0.5050
 epoch: 82, train_loss: 0.8671, test_loss: 0.9488, test_f1: 0.5490
 epoch: 83, train_loss: 0.8571, test_loss: 0.9542, test_f1: 0.5189
 epoch: 84, train_loss: 0.8535, test_loss: 0.9543, test_f1: 0.5246
 epoch: 85, train_loss: 0.8542, test_loss: 0.9679, test_f1: 0.5372
 epoch: 86, train_loss: 0.8504, test_loss: 0.9591, test_f1: 0.5272
 epoch: 87, train_loss: 0.8420, test_loss: 0.9510, test_f1: 0.5127
 epoch: 88, train_loss: 0.8522, test_loss: 0.9604, test_f1: 0.5052
 epoch: 89, train_loss: 0.8444, test_loss: 0.9604, test_f1: 0.5082
 epoch: 90, train_loss: 0.8594, test_loss: 0.9513, test_f1: 0.5102
 epoch: 91, train_loss: 0.8557, test_loss: 0.9583, test_f1: 0.5281
 epoch: 92, train_loss: 0.8463, test_loss: 0.9502, test_f1: 0.5470
 epoch: 93, train_loss: 0.8565, test_loss: 0.9385, test_f1: 0.5351
 epoch: 94, train_loss: 0.8558, test_loss: 0.9535, test_f1: 0.5251
 epoch: 95, train_loss: 0.8485, test_loss: 0.9483, test_f1: 0.5397
 epoch: 96, train_loss: 0.8448, test_loss: 0.9630, test_f1: 0.5457
 epoch: 97, train_loss: 0.8496, test_loss: 0.9371, test_f1: 0.5554
 epoch: 98, train_loss: 0.8371, test_loss: 0.9365, test_f1: 0.5295
 epoch: 99, train_loss: 0.8506, test_loss: 0.9337, test_f1: 0.5333
##################ITERATION #4 ****************************************
 epoch: 0, train_loss: 1.2650, test_loss: 1.1040, test_f1: 0.4068
 epoch: 1, train_loss: 1.1482, test_loss: 1.0568, test_f1: 0.4101
 epoch: 2, train_loss: 1.1104, test_loss: 1.0273, test_f1: 0.4553
 epoch: 3, train_loss: 1.0876, test_loss: 1.0098, test_f1: 0.4642
 epoch: 4, train_loss: 1.0635, test_loss: 1.0128, test_f1: 0.4560
 epoch: 5, train_loss: 1.0496, test_loss: 0.9917, test_f1: 0.4772
 epoch: 6, train_loss: 1.0315, test_loss: 1.0058, test_f1: 0.4515
 epoch: 7, train_loss: 1.0256, test_loss: 0.9834, test_f1: 0.4966
 epoch: 8, train_loss: 1.0167, test_loss: 0.9769, test_f1: 0.4801
 epoch: 9, train_loss: 1.0096, test_loss: 0.9866, test_f1: 0.4570
 epoch: 10, train_loss: 0.9993, test_loss: 0.9792, test_f1: 0.4906
 epoch: 11, train_loss: 0.9913, test_loss: 0.9945, test_f1: 0.4498
 epoch: 12, train_loss: 0.9851, test_loss: 0.9997, test_f1: 0.4907
 epoch: 13, train_loss: 0.9931, test_loss: 0.9628, test_f1: 0.4651
 epoch: 14, train_loss: 0.9776, test_loss: 0.9979, test_f1: 0.4932
 epoch: 15, train_loss: 0.9728, test_loss: 0.9890, test_f1: 0.4742
 epoch: 16, train_loss: 0.9631, test_loss: 0.9752, test_f1: 0.4660
 epoch: 17, train_loss: 0.9559, test_loss: 0.9648, test_f1: 0.4865
 epoch: 18, train_loss: 0.9675, test_loss: 0.9447, test_f1: 0.5031
 epoch: 19, train_loss: 0.9554, test_loss: 0.9723, test_f1: 0.5157
 epoch: 20, train_loss: 0.9603, test_loss: 0.9891, test_f1: 0.5070
 epoch: 21, train_loss: 0.9447, test_loss: 0.9338, test_f1: 0.4863
 epoch: 22, train_loss: 0.9347, test_loss: 0.9537, test_f1: 0.5014
 epoch: 23, train_loss: 0.9388, test_loss: 0.9768, test_f1: 0.4747
 epoch: 24, train_loss: 0.9324, test_loss: 0.9447, test_f1: 0.5092
 epoch: 25, train_loss: 0.9265, test_loss: 0.9586, test_f1: 0.5192
 epoch: 26, train_loss: 0.9290, test_loss: 0.9377, test_f1: 0.5169
 epoch: 27, train_loss: 0.9172, test_loss: 0.8968, test_f1: 0.4997
 epoch: 28, train_loss: 0.9302, test_loss: 0.9598, test_f1: 0.5226
 epoch: 29, train_loss: 0.9168, test_loss: 0.9054, test_f1: 0.5259
 epoch: 30, train_loss: 0.9057, test_loss: 0.9124, test_f1: 0.5476
 epoch: 31, train_loss: 0.9041, test_loss: 0.9229, test_f1: 0.5379
 epoch: 32, train_loss: 0.9243, test_loss: 0.8966, test_f1: 0.5369
 epoch: 33, train_loss: 0.9140, test_loss: 0.9373, test_f1: 0.5391
 epoch: 34, train_loss: 0.9047, test_loss: 0.9539, test_f1: 0.4926
 epoch: 35, train_loss: 0.9014, test_loss: 0.9421, test_f1: 0.4944
 epoch: 36, train_loss: 0.9072, test_loss: 0.9096, test_f1: 0.5009
 epoch: 37, train_loss: 0.9077, test_loss: 0.8623, test_f1: 0.5183
 epoch: 38, train_loss: 0.8951, test_loss: 0.8937, test_f1: 0.5238
 epoch: 39, train_loss: 0.8938, test_loss: 0.8585, test_f1: 0.5135
 epoch: 40, train_loss: 0.8903, test_loss: 0.8990, test_f1: 0.5320
 epoch: 41, train_loss: 0.8971, test_loss: 0.8686, test_f1: 0.5317
 epoch: 42, train_loss: 0.8890, test_loss: 0.9070, test_f1: 0.5241
 epoch: 43, train_loss: 0.8925, test_loss: 0.8899, test_f1: 0.5219
 epoch: 44, train_loss: 0.8872, test_loss: 0.9160, test_f1: 0.5212
 epoch: 45, train_loss: 0.8834, test_loss: 0.8668, test_f1: 0.5206
 epoch: 46, train_loss: 0.8713, test_loss: 0.9027, test_f1: 0.5099
 epoch: 47, train_loss: 0.8818, test_loss: 0.9039, test_f1: 0.5308
 epoch: 48, train_loss: 0.8854, test_loss: 0.8671, test_f1: 0.5307
 epoch: 49, train_loss: 0.8806, test_loss: 0.9087, test_f1: 0.5059
 epoch: 50, train_loss: 0.8742, test_loss: 0.8651, test_f1: 0.5141
 epoch: 51, train_loss: 0.8673, test_loss: 0.8575, test_f1: 0.5203
 epoch: 52, train_loss: 0.8669, test_loss: 0.8641, test_f1: 0.5282
 epoch: 53, train_loss: 0.8689, test_loss: 0.8628, test_f1: 0.5232
 epoch: 54, train_loss: 0.8545, test_loss: 0.8673, test_f1: 0.5307
 epoch: 55, train_loss: 0.8652, test_loss: 0.8862, test_f1: 0.5099
 epoch: 56, train_loss: 0.8554, test_loss: 0.8799, test_f1: 0.5218
 epoch: 57, train_loss: 0.8559, test_loss: 0.8718, test_f1: 0.5171
 epoch: 58, train_loss: 0.8517, test_loss: 0.8388, test_f1: 0.5299
 epoch: 59, train_loss: 0.8599, test_loss: 0.8864, test_f1: 0.5335
 epoch: 60, train_loss: 0.8530, test_loss: 0.8513, test_f1: 0.5287
 epoch: 61, train_loss: 0.8515, test_loss: 0.8888, test_f1: 0.5195
 epoch: 62, train_loss: 0.8473, test_loss: 0.8597, test_f1: 0.5379
 epoch: 63, train_loss: 0.8629, test_loss: 0.8737, test_f1: 0.5421
 epoch: 64, train_loss: 0.8525, test_loss: 0.8773, test_f1: 0.5273
 epoch: 65, train_loss: 0.8493, test_loss: 0.8795, test_f1: 0.5276
 epoch: 66, train_loss: 0.8486, test_loss: 0.8607, test_f1: 0.5266
 epoch: 67, train_loss: 0.8565, test_loss: 0.8782, test_f1: 0.5255
 epoch: 68, train_loss: 0.8464, test_loss: 0.8499, test_f1: 0.5528
 epoch: 69, train_loss: 0.8379, test_loss: 0.8573, test_f1: 0.5375
 epoch: 70, train_loss: 0.8528, test_loss: 0.8574, test_f1: 0.5456
 epoch: 71, train_loss: 0.8454, test_loss: 0.8605, test_f1: 0.5459
 epoch: 72, train_loss: 0.8347, test_loss: 0.8442, test_f1: 0.5438
 epoch: 73, train_loss: 0.8476, test_loss: 0.8619, test_f1: 0.5352
 epoch: 74, train_loss: 0.8436, test_loss: 0.8705, test_f1: 0.5466
 epoch: 75, train_loss: 0.8516, test_loss: 0.8548, test_f1: 0.5507
 epoch: 76, train_loss: 0.8326, test_loss: 0.8440, test_f1: 0.5606
 epoch: 77, train_loss: 0.8450, test_loss: 0.8454, test_f1: 0.5578
 epoch: 78, train_loss: 0.8312, test_loss: 0.8600, test_f1: 0.5463
 epoch: 79, train_loss: 0.8360, test_loss: 0.8459, test_f1: 0.5573
 epoch: 80, train_loss: 0.8298, test_loss: 0.8640, test_f1: 0.5433
 epoch: 81, train_loss: 0.8307, test_loss: 0.8622, test_f1: 0.5523
 epoch: 82, train_loss: 0.8407, test_loss: 0.8627, test_f1: 0.5578
 epoch: 83, train_loss: 0.8209, test_loss: 0.8458, test_f1: 0.5353
 epoch: 84, train_loss: 0.8374, test_loss: 0.8677, test_f1: 0.5470
 epoch: 85, train_loss: 0.8243, test_loss: 0.8931, test_f1: 0.5513
 epoch: 86, train_loss: 0.8253, test_loss: 0.8452, test_f1: 0.5479
 epoch: 87, train_loss: 0.8239, test_loss: 0.8638, test_f1: 0.5459
 epoch: 88, train_loss: 0.8279, test_loss: 0.8655, test_f1: 0.5426
 epoch: 89, train_loss: 0.8301, test_loss: 0.8776, test_f1: 0.5556
 epoch: 90, train_loss: 0.8343, test_loss: 0.8686, test_f1: 0.5593
 epoch: 91, train_loss: 0.8195, test_loss: 0.8744, test_f1: 0.5602
 epoch: 92, train_loss: 0.8171, test_loss: 0.8747, test_f1: 0.5670
 epoch: 93, train_loss: 0.8331, test_loss: 0.8820, test_f1: 0.5577
 epoch: 94, train_loss: 0.8210, test_loss: 0.8513, test_f1: 0.5533
 epoch: 95, train_loss: 0.8225, test_loss: 0.8726, test_f1: 0.5500
 epoch: 96, train_loss: 0.8317, test_loss: 0.8639, test_f1: 0.5542
 epoch: 97, train_loss: 0.8152, test_loss: 0.8598, test_f1: 0.5494
 epoch: 98, train_loss: 0.8168, test_loss: 0.8421, test_f1: 0.5419
 epoch: 99, train_loss: 0.8167, test_loss: 0.8457, test_f1: 0.5668
##################ITERATION #5 ****************************************
 epoch: 0, train_loss: 1.3182, test_loss: 1.0857, test_f1: 0.3725
 epoch: 1, train_loss: 1.1242, test_loss: 1.0587, test_f1: 0.3911
 epoch: 2, train_loss: 1.0917, test_loss: 1.0508, test_f1: 0.3872
 epoch: 3, train_loss: 1.0693, test_loss: 1.0418, test_f1: 0.4044
 epoch: 4, train_loss: 1.0535, test_loss: 1.0486, test_f1: 0.4096
 epoch: 5, train_loss: 1.0416, test_loss: 1.0310, test_f1: 0.4111
 epoch: 6, train_loss: 1.0330, test_loss: 1.0389, test_f1: 0.4515
 epoch: 7, train_loss: 1.0242, test_loss: 1.0295, test_f1: 0.4568
 epoch: 8, train_loss: 1.0084, test_loss: 1.0106, test_f1: 0.4637
 epoch: 9, train_loss: 1.0003, test_loss: 1.0268, test_f1: 0.4831
 epoch: 10, train_loss: 1.0034, test_loss: 1.0284, test_f1: 0.4852
 epoch: 11, train_loss: 0.9916, test_loss: 1.0393, test_f1: 0.4501
 epoch: 12, train_loss: 0.9937, test_loss: 1.0156, test_f1: 0.4739
 epoch: 13, train_loss: 0.9945, test_loss: 1.0040, test_f1: 0.4761
 epoch: 14, train_loss: 0.9803, test_loss: 1.0107, test_f1: 0.5066
 epoch: 15, train_loss: 0.9807, test_loss: 1.0157, test_f1: 0.4595
 epoch: 16, train_loss: 0.9767, test_loss: 0.9917, test_f1: 0.5123
 epoch: 17, train_loss: 0.9728, test_loss: 0.9716, test_f1: 0.4847
 epoch: 18, train_loss: 0.9641, test_loss: 1.0214, test_f1: 0.5076
 epoch: 19, train_loss: 0.9610, test_loss: 1.0056, test_f1: 0.4704
 epoch: 20, train_loss: 0.9646, test_loss: 0.9928, test_f1: 0.5122
 epoch: 21, train_loss: 0.9584, test_loss: 0.9921, test_f1: 0.5066
 epoch: 22, train_loss: 0.9506, test_loss: 0.9889, test_f1: 0.4941
 epoch: 23, train_loss: 0.9528, test_loss: 0.9904, test_f1: 0.4662
 epoch: 24, train_loss: 0.9457, test_loss: 0.9995, test_f1: 0.4721
 epoch: 25, train_loss: 0.9468, test_loss: 1.0079, test_f1: 0.4829
 epoch: 26, train_loss: 0.9467, test_loss: 0.9753, test_f1: 0.5368
 epoch: 27, train_loss: 0.9416, test_loss: 0.9769, test_f1: 0.5034
 epoch: 28, train_loss: 0.9375, test_loss: 0.9974, test_f1: 0.5243
 epoch: 29, train_loss: 0.9365, test_loss: 0.9711, test_f1: 0.5065
 epoch: 30, train_loss: 0.9435, test_loss: 0.9737, test_f1: 0.5159
 epoch: 31, train_loss: 0.9282, test_loss: 0.9804, test_f1: 0.4994
 epoch: 32, train_loss: 0.9295, test_loss: 0.9877, test_f1: 0.4978
 epoch: 33, train_loss: 0.9274, test_loss: 0.9708, test_f1: 0.5142
 epoch: 34, train_loss: 0.9338, test_loss: 0.9769, test_f1: 0.4891
 epoch: 35, train_loss: 0.9153, test_loss: 0.9585, test_f1: 0.5152
 epoch: 36, train_loss: 0.9294, test_loss: 0.9654, test_f1: 0.5535
 epoch: 37, train_loss: 0.9233, test_loss: 0.9846, test_f1: 0.4948
 epoch: 38, train_loss: 0.9151, test_loss: 0.9690, test_f1: 0.5266
 epoch: 39, train_loss: 0.9168, test_loss: 0.9625, test_f1: 0.5394
 epoch: 40, train_loss: 0.9174, test_loss: 0.9759, test_f1: 0.5007
 epoch: 41, train_loss: 0.9117, test_loss: 0.9851, test_f1: 0.4992
 epoch: 42, train_loss: 0.9152, test_loss: 0.9510, test_f1: 0.5288
 epoch: 43, train_loss: 0.9046, test_loss: 0.9650, test_f1: 0.5168
 epoch: 44, train_loss: 0.9064, test_loss: 0.9566, test_f1: 0.5098
 epoch: 45, train_loss: 0.9090, test_loss: 0.9526, test_f1: 0.4924
 epoch: 46, train_loss: 0.8997, test_loss: 0.9586, test_f1: 0.5028
 epoch: 47, train_loss: 0.8969, test_loss: 0.9372, test_f1: 0.5445
 epoch: 48, train_loss: 0.9164, test_loss: 0.9761, test_f1: 0.4762
 epoch: 49, train_loss: 0.9038, test_loss: 0.9644, test_f1: 0.5041
 epoch: 50, train_loss: 0.9042, test_loss: 0.9553, test_f1: 0.5263
 epoch: 51, train_loss: 0.8931, test_loss: 0.9725, test_f1: 0.4802
 epoch: 52, train_loss: 0.8931, test_loss: 0.9624, test_f1: 0.5296
 epoch: 53, train_loss: 0.9011, test_loss: 0.9631, test_f1: 0.4878
 epoch: 54, train_loss: 0.8903, test_loss: 0.9402, test_f1: 0.5191
 epoch: 55, train_loss: 0.8945, test_loss: 0.9514, test_f1: 0.5058
 epoch: 56, train_loss: 0.8903, test_loss: 0.9523, test_f1: 0.5318
 epoch: 57, train_loss: 0.8808, test_loss: 0.9591, test_f1: 0.5352
 epoch: 58, train_loss: 0.8850, test_loss: 0.9540, test_f1: 0.5110
 epoch: 59, train_loss: 0.8853, test_loss: 0.9524, test_f1: 0.5307
 epoch: 60, train_loss: 0.8913, test_loss: 0.9571, test_f1: 0.5194
 epoch: 61, train_loss: 0.8888, test_loss: 0.9602, test_f1: 0.5309
 epoch: 62, train_loss: 0.8783, test_loss: 0.9483, test_f1: 0.5192
 epoch: 63, train_loss: 0.8964, test_loss: 0.9410, test_f1: 0.5176
 epoch: 64, train_loss: 0.8777, test_loss: 0.9629, test_f1: 0.5144
 epoch: 65, train_loss: 0.8896, test_loss: 0.9571, test_f1: 0.5191
 epoch: 66, train_loss: 0.8908, test_loss: 0.9564, test_f1: 0.5364
 epoch: 67, train_loss: 0.8865, test_loss: 0.9612, test_f1: 0.5311
 epoch: 68, train_loss: 0.8813, test_loss: 0.9631, test_f1: 0.5258
 epoch: 69, train_loss: 0.8729, test_loss: 0.9502, test_f1: 0.5079
 epoch: 70, train_loss: 0.8729, test_loss: 0.9507, test_f1: 0.5179
 epoch: 71, train_loss: 0.8765, test_loss: 0.9375, test_f1: 0.5160
 epoch: 72, train_loss: 0.8792, test_loss: 0.9862, test_f1: 0.5334
 epoch: 73, train_loss: 0.8765, test_loss: 0.9371, test_f1: 0.5616
 epoch: 74, train_loss: 0.8792, test_loss: 0.9468, test_f1: 0.5382
 epoch: 75, train_loss: 0.8798, test_loss: 0.9464, test_f1: 0.5426
 epoch: 76, train_loss: 0.8935, test_loss: 0.9536, test_f1: 0.5269
 epoch: 77, train_loss: 0.8859, test_loss: 0.9385, test_f1: 0.5298
 epoch: 78, train_loss: 0.8689, test_loss: 0.9398, test_f1: 0.5235
 epoch: 79, train_loss: 0.8816, test_loss: 0.9453, test_f1: 0.5439
 epoch: 80, train_loss: 0.8700, test_loss: 0.9540, test_f1: 0.5068
 epoch: 81, train_loss: 0.8736, test_loss: 0.9729, test_f1: 0.5144
 epoch: 82, train_loss: 0.8772, test_loss: 0.9587, test_f1: 0.5414
 epoch: 83, train_loss: 0.8624, test_loss: 0.9433, test_f1: 0.5252
 epoch: 84, train_loss: 0.8665, test_loss: 0.9606, test_f1: 0.5293
 epoch: 85, train_loss: 0.8729, test_loss: 0.9445, test_f1: 0.5246
 epoch: 86, train_loss: 0.8670, test_loss: 0.9368, test_f1: 0.5567
 epoch: 87, train_loss: 0.8718, test_loss: 0.9436, test_f1: 0.5361
 epoch: 88, train_loss: 0.8673, test_loss: 0.9482, test_f1: 0.5437
 epoch: 89, train_loss: 0.8622, test_loss: 0.9653, test_f1: 0.5244
 epoch: 90, train_loss: 0.8665, test_loss: 0.9557, test_f1: 0.5286
 epoch: 91, train_loss: 0.8680, test_loss: 0.9385, test_f1: 0.5594
 epoch: 92, train_loss: 0.8741, test_loss: 0.9334, test_f1: 0.5550
 epoch: 93, train_loss: 0.8650, test_loss: 0.9341, test_f1: 0.5324
 epoch: 94, train_loss: 0.8569, test_loss: 0.9620, test_f1: 0.5212
 epoch: 95, train_loss: 0.8659, test_loss: 0.9385, test_f1: 0.5359
 epoch: 96, train_loss: 0.8624, test_loss: 0.9539, test_f1: 0.5166
 epoch: 97, train_loss: 0.8569, test_loss: 0.9617, test_f1: 0.5349
 epoch: 98, train_loss: 0.8583, test_loss: 0.9312, test_f1: 0.5568
 epoch: 99, train_loss: 0.8591, test_loss: 0.9470, test_f1: 0.5594
##################ITERATION #6 ****************************************
 epoch: 0, train_loss: 1.2701, test_loss: 1.0830, test_f1: 0.3447
 epoch: 1, train_loss: 1.1305, test_loss: 1.0453, test_f1: 0.3830
 epoch: 2, train_loss: 1.0861, test_loss: 1.0164, test_f1: 0.4203
 epoch: 3, train_loss: 1.0594, test_loss: 1.0471, test_f1: 0.4406
 epoch: 4, train_loss: 1.0439, test_loss: 1.0384, test_f1: 0.4486
 epoch: 5, train_loss: 1.0358, test_loss: 1.0477, test_f1: 0.4396
 epoch: 6, train_loss: 1.0177, test_loss: 0.9915, test_f1: 0.4411
 epoch: 7, train_loss: 1.0100, test_loss: 1.0085, test_f1: 0.4490
 epoch: 8, train_loss: 0.9995, test_loss: 1.0039, test_f1: 0.4281
 epoch: 9, train_loss: 0.9936, test_loss: 1.0267, test_f1: 0.4547
 epoch: 10, train_loss: 0.9893, test_loss: 0.9921, test_f1: 0.4715
 epoch: 11, train_loss: 0.9867, test_loss: 1.0233, test_f1: 0.4536
 epoch: 12, train_loss: 0.9880, test_loss: 0.9789, test_f1: 0.4745
 epoch: 13, train_loss: 0.9747, test_loss: 0.9915, test_f1: 0.4734
 epoch: 14, train_loss: 0.9640, test_loss: 1.0318, test_f1: 0.4472
 epoch: 15, train_loss: 0.9588, test_loss: 0.9952, test_f1: 0.4912
 epoch: 16, train_loss: 0.9592, test_loss: 0.9719, test_f1: 0.4758
 epoch: 17, train_loss: 0.9615, test_loss: 0.9831, test_f1: 0.4694
 epoch: 18, train_loss: 0.9537, test_loss: 0.9720, test_f1: 0.4739
 epoch: 19, train_loss: 0.9430, test_loss: 0.9472, test_f1: 0.4832
 epoch: 20, train_loss: 0.9478, test_loss: 0.9289, test_f1: 0.4757
 epoch: 21, train_loss: 0.9490, test_loss: 0.9406, test_f1: 0.4633
 epoch: 22, train_loss: 0.9434, test_loss: 0.9321, test_f1: 0.4809
 epoch: 23, train_loss: 0.9406, test_loss: 0.9352, test_f1: 0.4839
 epoch: 24, train_loss: 0.9369, test_loss: 0.9456, test_f1: 0.5276
 epoch: 25, train_loss: 0.9373, test_loss: 0.9720, test_f1: 0.4607
 epoch: 26, train_loss: 0.9391, test_loss: 0.9571, test_f1: 0.5063
 epoch: 27, train_loss: 0.9313, test_loss: 0.9026, test_f1: 0.4825
 epoch: 28, train_loss: 0.9245, test_loss: 0.9256, test_f1: 0.4829
 epoch: 29, train_loss: 0.9221, test_loss: 0.9666, test_f1: 0.4794
 epoch: 30, train_loss: 0.9118, test_loss: 0.9795, test_f1: 0.4931
 epoch: 31, train_loss: 0.9176, test_loss: 0.9340, test_f1: 0.5015
 epoch: 32, train_loss: 0.9227, test_loss: 0.9193, test_f1: 0.5019
 epoch: 33, train_loss: 0.9077, test_loss: 0.9289, test_f1: 0.4993
 epoch: 34, train_loss: 0.9069, test_loss: 0.9798, test_f1: 0.5088
 epoch: 35, train_loss: 0.9104, test_loss: 0.9306, test_f1: 0.5034
 epoch: 36, train_loss: 0.9066, test_loss: 0.9444, test_f1: 0.5014
 epoch: 37, train_loss: 0.9101, test_loss: 0.9473, test_f1: 0.5164
 epoch: 38, train_loss: 0.9049, test_loss: 0.9460, test_f1: 0.5078
 epoch: 39, train_loss: 0.8983, test_loss: 0.9295, test_f1: 0.5083
 epoch: 40, train_loss: 0.9016, test_loss: 0.9547, test_f1: 0.5212
 epoch: 41, train_loss: 0.9112, test_loss: 0.9398, test_f1: 0.5073
 epoch: 42, train_loss: 0.9018, test_loss: 0.9498, test_f1: 0.5020
 epoch: 43, train_loss: 0.8893, test_loss: 0.9321, test_f1: 0.4988
 epoch: 44, train_loss: 0.8961, test_loss: 0.9284, test_f1: 0.5078
 epoch: 45, train_loss: 0.8906, test_loss: 0.9160, test_f1: 0.5161
 epoch: 46, train_loss: 0.8871, test_loss: 0.8893, test_f1: 0.5305
 epoch: 47, train_loss: 0.8860, test_loss: 0.8917, test_f1: 0.5267
 epoch: 48, train_loss: 0.8748, test_loss: 0.9231, test_f1: 0.5130
 epoch: 49, train_loss: 0.8726, test_loss: 0.9210, test_f1: 0.5207
 epoch: 50, train_loss: 0.8820, test_loss: 0.9215, test_f1: 0.5434
 epoch: 51, train_loss: 0.8728, test_loss: 0.9189, test_f1: 0.5231
 epoch: 52, train_loss: 0.8642, test_loss: 0.9251, test_f1: 0.5177
 epoch: 53, train_loss: 0.8633, test_loss: 0.8797, test_f1: 0.5219
 epoch: 54, train_loss: 0.8658, test_loss: 0.8710, test_f1: 0.5218
 epoch: 55, train_loss: 0.8647, test_loss: 0.8771, test_f1: 0.5290
 epoch: 56, train_loss: 0.8715, test_loss: 0.8882, test_f1: 0.5336
 epoch: 57, train_loss: 0.8672, test_loss: 0.8952, test_f1: 0.5233
 epoch: 58, train_loss: 0.8657, test_loss: 0.9177, test_f1: 0.5214
 epoch: 59, train_loss: 0.8590, test_loss: 0.9078, test_f1: 0.5316
 epoch: 60, train_loss: 0.8576, test_loss: 0.9129, test_f1: 0.5325
 epoch: 61, train_loss: 0.8555, test_loss: 0.9104, test_f1: 0.5366
 epoch: 62, train_loss: 0.8670, test_loss: 0.9056, test_f1: 0.5231
 epoch: 63, train_loss: 0.8482, test_loss: 0.8736, test_f1: 0.5257
 epoch: 64, train_loss: 0.8537, test_loss: 0.8917, test_f1: 0.5395
 epoch: 65, train_loss: 0.8517, test_loss: 0.8909, test_f1: 0.5320
 epoch: 66, train_loss: 0.8577, test_loss: 0.8859, test_f1: 0.5404
 epoch: 67, train_loss: 0.8521, test_loss: 0.9048, test_f1: 0.5277
 epoch: 68, train_loss: 0.8633, test_loss: 0.8895, test_f1: 0.5495
 epoch: 69, train_loss: 0.8460, test_loss: 0.8742, test_f1: 0.5195
 epoch: 70, train_loss: 0.8540, test_loss: 0.8935, test_f1: 0.5425
 epoch: 71, train_loss: 0.8547, test_loss: 0.9110, test_f1: 0.5367
 epoch: 72, train_loss: 0.8366, test_loss: 0.8792, test_f1: 0.5637
 epoch: 73, train_loss: 0.8408, test_loss: 0.8855, test_f1: 0.5413
 epoch: 74, train_loss: 0.8394, test_loss: 0.8757, test_f1: 0.5482
 epoch: 75, train_loss: 0.8437, test_loss: 0.8906, test_f1: 0.5498
 epoch: 76, train_loss: 0.8403, test_loss: 0.8828, test_f1: 0.5511
 epoch: 77, train_loss: 0.8354, test_loss: 0.8994, test_f1: 0.5345
 epoch: 78, train_loss: 0.8433, test_loss: 0.8992, test_f1: 0.5485
 epoch: 79, train_loss: 0.8388, test_loss: 0.8859, test_f1: 0.5423
 epoch: 80, train_loss: 0.8406, test_loss: 0.8947, test_f1: 0.5370
 epoch: 81, train_loss: 0.8388, test_loss: 0.8922, test_f1: 0.5629
 epoch: 82, train_loss: 0.8434, test_loss: 0.8951, test_f1: 0.5536
 epoch: 83, train_loss: 0.8319, test_loss: 0.8867, test_f1: 0.5410
 epoch: 84, train_loss: 0.8259, test_loss: 0.8791, test_f1: 0.5496
 epoch: 85, train_loss: 0.8326, test_loss: 0.8869, test_f1: 0.5346
 epoch: 86, train_loss: 0.8386, test_loss: 0.8780, test_f1: 0.5636
 epoch: 87, train_loss: 0.8214, test_loss: 0.8800, test_f1: 0.5562
 epoch: 88, train_loss: 0.8394, test_loss: 0.8953, test_f1: 0.5495
 epoch: 89, train_loss: 0.8232, test_loss: 0.8847, test_f1: 0.5550
 epoch: 90, train_loss: 0.8391, test_loss: 0.8811, test_f1: 0.5666
 epoch: 91, train_loss: 0.8260, test_loss: 0.8814, test_f1: 0.5555
 epoch: 92, train_loss: 0.8312, test_loss: 0.8740, test_f1: 0.5513
 epoch: 93, train_loss: 0.8268, test_loss: 0.8859, test_f1: 0.5715
 epoch: 94, train_loss: 0.8406, test_loss: 0.8861, test_f1: 0.5521
 epoch: 95, train_loss: 0.8177, test_loss: 0.8790, test_f1: 0.5654
 epoch: 96, train_loss: 0.8248, test_loss: 0.8851, test_f1: 0.5496
 epoch: 97, train_loss: 0.8451, test_loss: 0.8886, test_f1: 0.5646
 epoch: 98, train_loss: 0.8307, test_loss: 0.8821, test_f1: 0.5415
 epoch: 99, train_loss: 0.8292, test_loss: 0.8809, test_f1: 0.5802
##################ITERATION #7 ****************************************
 epoch: 0, train_loss: 1.2691, test_loss: 1.0767, test_f1: 0.4442
 epoch: 1, train_loss: 1.1108, test_loss: 1.0271, test_f1: 0.4804
 epoch: 2, train_loss: 1.0775, test_loss: 0.9939, test_f1: 0.4781
 epoch: 3, train_loss: 1.0449, test_loss: 1.0081, test_f1: 0.4872
 epoch: 4, train_loss: 1.0418, test_loss: 0.9808, test_f1: 0.4899
 epoch: 5, train_loss: 1.0242, test_loss: 0.9885, test_f1: 0.4776
 epoch: 6, train_loss: 1.0160, test_loss: 0.9666, test_f1: 0.4948
 epoch: 7, train_loss: 1.0076, test_loss: 0.9678, test_f1: 0.4951
 epoch: 8, train_loss: 1.0048, test_loss: 0.9853, test_f1: 0.4610
 epoch: 9, train_loss: 0.9901, test_loss: 0.9806, test_f1: 0.4897
 epoch: 10, train_loss: 0.9964, test_loss: 0.9980, test_f1: 0.4997
 epoch: 11, train_loss: 0.9884, test_loss: 0.9514, test_f1: 0.4881
 epoch: 12, train_loss: 0.9806, test_loss: 0.9801, test_f1: 0.4997
 epoch: 13, train_loss: 0.9716, test_loss: 0.9583, test_f1: 0.4911
 epoch: 14, train_loss: 0.9673, test_loss: 1.0257, test_f1: 0.4679
 epoch: 15, train_loss: 0.9649, test_loss: 1.0183, test_f1: 0.4748
 epoch: 16, train_loss: 0.9626, test_loss: 1.0165, test_f1: 0.5004
 epoch: 17, train_loss: 0.9553, test_loss: 1.0064, test_f1: 0.5053
 epoch: 18, train_loss: 0.9567, test_loss: 1.0084, test_f1: 0.4516
 epoch: 19, train_loss: 0.9465, test_loss: 0.9900, test_f1: 0.4695
 epoch: 20, train_loss: 0.9367, test_loss: 1.0001, test_f1: 0.4667
 epoch: 21, train_loss: 0.9407, test_loss: 1.0092, test_f1: 0.4828
 epoch: 22, train_loss: 0.9302, test_loss: 0.9870, test_f1: 0.4664
 epoch: 23, train_loss: 0.9277, test_loss: 1.0065, test_f1: 0.4796
 epoch: 24, train_loss: 0.9239, test_loss: 1.0358, test_f1: 0.4920
 epoch: 25, train_loss: 0.9228, test_loss: 0.9973, test_f1: 0.4702
 epoch: 26, train_loss: 0.9283, test_loss: 0.9886, test_f1: 0.4775
 epoch: 27, train_loss: 0.9233, test_loss: 1.0192, test_f1: 0.4775
 epoch: 28, train_loss: 0.9235, test_loss: 0.9674, test_f1: 0.4892
 epoch: 29, train_loss: 0.9147, test_loss: 0.9825, test_f1: 0.4907
 epoch: 30, train_loss: 0.9168, test_loss: 0.9987, test_f1: 0.5121
 epoch: 31, train_loss: 0.9154, test_loss: 0.9898, test_f1: 0.4739
 epoch: 32, train_loss: 0.9010, test_loss: 0.9823, test_f1: 0.4885
 epoch: 33, train_loss: 0.9149, test_loss: 0.9867, test_f1: 0.4885
 epoch: 34, train_loss: 0.9023, test_loss: 0.9761, test_f1: 0.4926
 epoch: 35, train_loss: 0.9068, test_loss: 0.9663, test_f1: 0.4922
 epoch: 36, train_loss: 0.8916, test_loss: 0.9664, test_f1: 0.4889
 epoch: 37, train_loss: 0.8976, test_loss: 0.9672, test_f1: 0.5030
 epoch: 38, train_loss: 0.8977, test_loss: 0.9309, test_f1: 0.5033
 epoch: 39, train_loss: 0.8942, test_loss: 0.9740, test_f1: 0.4895
 epoch: 40, train_loss: 0.8869, test_loss: 0.9457, test_f1: 0.4949
 epoch: 41, train_loss: 0.8955, test_loss: 0.9712, test_f1: 0.5112
 epoch: 42, train_loss: 0.8916, test_loss: 0.9760, test_f1: 0.4966
 epoch: 43, train_loss: 0.8958, test_loss: 0.9667, test_f1: 0.5250
 epoch: 44, train_loss: 0.8897, test_loss: 0.9726, test_f1: 0.5000
 epoch: 45, train_loss: 0.8864, test_loss: 0.9168, test_f1: 0.5184
 epoch: 46, train_loss: 0.8793, test_loss: 0.9847, test_f1: 0.4687
 epoch: 47, train_loss: 0.8677, test_loss: 0.9700, test_f1: 0.4892
 epoch: 48, train_loss: 0.8724, test_loss: 0.9587, test_f1: 0.4908
 epoch: 49, train_loss: 0.8679, test_loss: 0.9579, test_f1: 0.5155
 epoch: 50, train_loss: 0.8713, test_loss: 0.9810, test_f1: 0.5094
 epoch: 51, train_loss: 0.8557, test_loss: 0.9528, test_f1: 0.5096
 epoch: 52, train_loss: 0.8683, test_loss: 0.9546, test_f1: 0.5106
 epoch: 53, train_loss: 0.8641, test_loss: 0.9527, test_f1: 0.5164
 epoch: 54, train_loss: 0.8415, test_loss: 0.9592, test_f1: 0.5266
 epoch: 55, train_loss: 0.8635, test_loss: 0.9631, test_f1: 0.5281
 epoch: 56, train_loss: 0.8554, test_loss: 0.9629, test_f1: 0.5120
 epoch: 57, train_loss: 0.8593, test_loss: 0.9722, test_f1: 0.5175
 epoch: 58, train_loss: 0.8508, test_loss: 0.9441, test_f1: 0.5472
 epoch: 59, train_loss: 0.8636, test_loss: 0.9668, test_f1: 0.5367
 epoch: 60, train_loss: 0.8555, test_loss: 0.9697, test_f1: 0.5147
 epoch: 61, train_loss: 0.8561, test_loss: 0.9535, test_f1: 0.5380
 epoch: 62, train_loss: 0.8514, test_loss: 0.9662, test_f1: 0.5267
 epoch: 63, train_loss: 0.8480, test_loss: 0.9936, test_f1: 0.5221
 epoch: 64, train_loss: 0.8550, test_loss: 0.9863, test_f1: 0.5142
 epoch: 65, train_loss: 0.8403, test_loss: 0.9750, test_f1: 0.5294
 epoch: 66, train_loss: 0.8526, test_loss: 0.9616, test_f1: 0.5074
 epoch: 67, train_loss: 0.8538, test_loss: 0.9688, test_f1: 0.5401
 epoch: 68, train_loss: 0.8580, test_loss: 0.9642, test_f1: 0.5325
 epoch: 69, train_loss: 0.8473, test_loss: 0.9929, test_f1: 0.5265
 epoch: 70, train_loss: 0.8405, test_loss: 0.9775, test_f1: 0.5346
 epoch: 71, train_loss: 0.8304, test_loss: 0.9882, test_f1: 0.5268
 epoch: 72, train_loss: 0.8374, test_loss: 0.9522, test_f1: 0.5329
 epoch: 73, train_loss: 0.8431, test_loss: 0.9830, test_f1: 0.5277
 epoch: 74, train_loss: 0.8448, test_loss: 0.9537, test_f1: 0.5380
 epoch: 75, train_loss: 0.8376, test_loss: 0.9869, test_f1: 0.5469
 epoch: 76, train_loss: 0.8389, test_loss: 0.9947, test_f1: 0.5249
 epoch: 77, train_loss: 0.8464, test_loss: 0.9705, test_f1: 0.5373
 epoch: 78, train_loss: 0.8344, test_loss: 0.9678, test_f1: 0.5313
 epoch: 79, train_loss: 0.8385, test_loss: 0.9828, test_f1: 0.5300
 epoch: 80, train_loss: 0.8260, test_loss: 0.9871, test_f1: 0.5379
 epoch: 81, train_loss: 0.8413, test_loss: 0.9865, test_f1: 0.5264
 epoch: 82, train_loss: 0.8322, test_loss: 1.0151, test_f1: 0.5180
 epoch: 83, train_loss: 0.8296, test_loss: 0.9902, test_f1: 0.5395
 epoch: 84, train_loss: 0.8349, test_loss: 0.9738, test_f1: 0.5292
 epoch: 85, train_loss: 0.8234, test_loss: 1.0207, test_f1: 0.4845
 epoch: 86, train_loss: 0.8375, test_loss: 0.9963, test_f1: 0.5457
 epoch: 87, train_loss: 0.8304, test_loss: 0.9653, test_f1: 0.5263
 epoch: 88, train_loss: 0.8330, test_loss: 1.0035, test_f1: 0.5310
 epoch: 89, train_loss: 0.8337, test_loss: 0.9798, test_f1: 0.5347
 epoch: 90, train_loss: 0.8285, test_loss: 1.0185, test_f1: 0.5243
 epoch: 91, train_loss: 0.8362, test_loss: 0.9544, test_f1: 0.5378
 epoch: 92, train_loss: 0.8233, test_loss: 0.9865, test_f1: 0.5303
 epoch: 93, train_loss: 0.8209, test_loss: 0.9655, test_f1: 0.5444
 epoch: 94, train_loss: 0.8375, test_loss: 0.9944, test_f1: 0.5270
 epoch: 95, train_loss: 0.8270, test_loss: 0.9828, test_f1: 0.5290
 epoch: 96, train_loss: 0.8247, test_loss: 0.9672, test_f1: 0.5303
 epoch: 97, train_loss: 0.8280, test_loss: 0.9814, test_f1: 0.5340
 epoch: 98, train_loss: 0.8207, test_loss: 0.9705, test_f1: 0.5312
 epoch: 99, train_loss: 0.8206, test_loss: 1.0192, test_f1: 0.5132
##################ITERATION #8 ****************************************
 epoch: 0, train_loss: 1.2796, test_loss: 1.1076, test_f1: 0.3592
 epoch: 1, train_loss: 1.1447, test_loss: 1.0460, test_f1: 0.3875
 epoch: 2, train_loss: 1.0939, test_loss: 1.0293, test_f1: 0.4509
 epoch: 3, train_loss: 1.0669, test_loss: 1.0329, test_f1: 0.4428
 epoch: 4, train_loss: 1.0452, test_loss: 1.0249, test_f1: 0.4393
 epoch: 5, train_loss: 1.0259, test_loss: 1.0204, test_f1: 0.4561
 epoch: 6, train_loss: 1.0149, test_loss: 1.0233, test_f1: 0.4732
 epoch: 7, train_loss: 1.0133, test_loss: 1.0089, test_f1: 0.4741
 epoch: 8, train_loss: 0.9983, test_loss: 1.0229, test_f1: 0.4718
 epoch: 9, train_loss: 0.9951, test_loss: 0.9989, test_f1: 0.4626
 epoch: 10, train_loss: 0.9882, test_loss: 1.0145, test_f1: 0.4745
 epoch: 11, train_loss: 0.9791, test_loss: 0.9806, test_f1: 0.4803
 epoch: 12, train_loss: 0.9787, test_loss: 0.9862, test_f1: 0.4795
 epoch: 13, train_loss: 0.9783, test_loss: 1.0067, test_f1: 0.4649
 epoch: 14, train_loss: 0.9768, test_loss: 0.9956, test_f1: 0.4752
 epoch: 15, train_loss: 0.9656, test_loss: 0.9783, test_f1: 0.4759
 epoch: 16, train_loss: 0.9582, test_loss: 0.9772, test_f1: 0.4987
 epoch: 17, train_loss: 0.9655, test_loss: 0.9863, test_f1: 0.4836
 epoch: 18, train_loss: 0.9643, test_loss: 0.9737, test_f1: 0.4942
 epoch: 19, train_loss: 0.9544, test_loss: 0.9786, test_f1: 0.4949
 epoch: 20, train_loss: 0.9488, test_loss: 0.9924, test_f1: 0.4981
 epoch: 21, train_loss: 0.9419, test_loss: 0.9971, test_f1: 0.4986
 epoch: 22, train_loss: 0.9570, test_loss: 0.9764, test_f1: 0.4979
 epoch: 23, train_loss: 0.9386, test_loss: 0.9673, test_f1: 0.5002
 epoch: 24, train_loss: 0.9290, test_loss: 0.9715, test_f1: 0.5040
 epoch: 25, train_loss: 0.9357, test_loss: 0.9604, test_f1: 0.5138
 epoch: 26, train_loss: 0.9344, test_loss: 0.9676, test_f1: 0.5112
 epoch: 27, train_loss: 0.9277, test_loss: 0.9624, test_f1: 0.5113
 epoch: 28, train_loss: 0.9291, test_loss: 0.9588, test_f1: 0.5202
 epoch: 29, train_loss: 0.9242, test_loss: 0.9678, test_f1: 0.5133
 epoch: 30, train_loss: 0.9322, test_loss: 0.9549, test_f1: 0.5156
 epoch: 31, train_loss: 0.9170, test_loss: 0.9602, test_f1: 0.5209
 epoch: 32, train_loss: 0.9287, test_loss: 0.9416, test_f1: 0.5214
 epoch: 33, train_loss: 0.9253, test_loss: 0.9748, test_f1: 0.5027
 epoch: 34, train_loss: 0.9171, test_loss: 0.9529, test_f1: 0.4974
 epoch: 35, train_loss: 0.9164, test_loss: 0.9520, test_f1: 0.5149
 epoch: 36, train_loss: 0.9093, test_loss: 0.9513, test_f1: 0.5154
 epoch: 37, train_loss: 0.9196, test_loss: 0.9474, test_f1: 0.5122
 epoch: 38, train_loss: 0.9060, test_loss: 0.9429, test_f1: 0.5218
 epoch: 39, train_loss: 0.8865, test_loss: 0.9550, test_f1: 0.5169
 epoch: 40, train_loss: 0.8869, test_loss: 0.9467, test_f1: 0.5302
 epoch: 41, train_loss: 0.9030, test_loss: 0.9716, test_f1: 0.4986
 epoch: 42, train_loss: 0.8951, test_loss: 0.9523, test_f1: 0.5262
 epoch: 43, train_loss: 0.8915, test_loss: 0.9504, test_f1: 0.5368
 epoch: 44, train_loss: 0.8914, test_loss: 0.9381, test_f1: 0.5321
 epoch: 45, train_loss: 0.8840, test_loss: 0.9357, test_f1: 0.5241
 epoch: 46, train_loss: 0.8988, test_loss: 0.9446, test_f1: 0.5018
 epoch: 47, train_loss: 0.8906, test_loss: 0.9250, test_f1: 0.5103
 epoch: 48, train_loss: 0.8973, test_loss: 0.9462, test_f1: 0.5069
 epoch: 49, train_loss: 0.8843, test_loss: 0.9342, test_f1: 0.5179
 epoch: 50, train_loss: 0.8779, test_loss: 0.9564, test_f1: 0.5043
 epoch: 51, train_loss: 0.8799, test_loss: 0.9242, test_f1: 0.5267
 epoch: 52, train_loss: 0.8762, test_loss: 0.9267, test_f1: 0.5306
 epoch: 53, train_loss: 0.8683, test_loss: 0.9284, test_f1: 0.5381
 epoch: 54, train_loss: 0.8689, test_loss: 0.9294, test_f1: 0.5202
 epoch: 55, train_loss: 0.8730, test_loss: 0.9138, test_f1: 0.5407
 epoch: 56, train_loss: 0.8743, test_loss: 0.9263, test_f1: 0.5361
 epoch: 57, train_loss: 0.8761, test_loss: 0.9252, test_f1: 0.5456
 epoch: 58, train_loss: 0.8615, test_loss: 0.9205, test_f1: 0.5376
 epoch: 59, train_loss: 0.8663, test_loss: 0.9303, test_f1: 0.5415
 epoch: 60, train_loss: 0.8551, test_loss: 0.9266, test_f1: 0.5422
 epoch: 61, train_loss: 0.8534, test_loss: 0.9163, test_f1: 0.5386
 epoch: 62, train_loss: 0.8541, test_loss: 0.9108, test_f1: 0.5432
 epoch: 63, train_loss: 0.8621, test_loss: 0.9124, test_f1: 0.5468
 epoch: 64, train_loss: 0.8707, test_loss: 0.9043, test_f1: 0.5438
 epoch: 65, train_loss: 0.8596, test_loss: 0.9094, test_f1: 0.5425
 epoch: 66, train_loss: 0.8531, test_loss: 0.9126, test_f1: 0.5399
 epoch: 67, train_loss: 0.8565, test_loss: 0.9055, test_f1: 0.5320
 epoch: 68, train_loss: 0.8545, test_loss: 0.9082, test_f1: 0.5311
 epoch: 69, train_loss: 0.8475, test_loss: 0.9138, test_f1: 0.5303
 epoch: 70, train_loss: 0.8657, test_loss: 0.9108, test_f1: 0.5222
 epoch: 71, train_loss: 0.8727, test_loss: 0.8993, test_f1: 0.5462
 epoch: 72, train_loss: 0.8543, test_loss: 0.9070, test_f1: 0.5527
 epoch: 73, train_loss: 0.8508, test_loss: 0.9051, test_f1: 0.5402
 epoch: 74, train_loss: 0.8690, test_loss: 0.9118, test_f1: 0.5292
 epoch: 75, train_loss: 0.8521, test_loss: 0.9064, test_f1: 0.5267
 epoch: 76, train_loss: 0.8485, test_loss: 0.9043, test_f1: 0.5510
 epoch: 77, train_loss: 0.8546, test_loss: 0.9149, test_f1: 0.5399
 epoch: 78, train_loss: 0.8505, test_loss: 0.9093, test_f1: 0.5519
 epoch: 79, train_loss: 0.8390, test_loss: 0.9070, test_f1: 0.5623
 epoch: 80, train_loss: 0.8481, test_loss: 0.9175, test_f1: 0.5420
 epoch: 81, train_loss: 0.8393, test_loss: 0.8935, test_f1: 0.5459
 epoch: 82, train_loss: 0.8529, test_loss: 0.8951, test_f1: 0.5556
 epoch: 83, train_loss: 0.8477, test_loss: 0.8921, test_f1: 0.5568
 epoch: 84, train_loss: 0.8554, test_loss: 0.8922, test_f1: 0.5463
 epoch: 85, train_loss: 0.8453, test_loss: 0.8971, test_f1: 0.5520
 epoch: 86, train_loss: 0.8391, test_loss: 0.8973, test_f1: 0.5461
 epoch: 87, train_loss: 0.8356, test_loss: 0.9045, test_f1: 0.5428
 epoch: 88, train_loss: 0.8413, test_loss: 0.9022, test_f1: 0.5467
 epoch: 89, train_loss: 0.8477, test_loss: 0.8859, test_f1: 0.5562
 epoch: 90, train_loss: 0.8374, test_loss: 0.8886, test_f1: 0.5496
 epoch: 91, train_loss: 0.8418, test_loss: 0.8937, test_f1: 0.5548
 epoch: 92, train_loss: 0.8379, test_loss: 0.8762, test_f1: 0.5744
 epoch: 93, train_loss: 0.8288, test_loss: 0.9032, test_f1: 0.5504
 epoch: 94, train_loss: 0.8479, test_loss: 0.8928, test_f1: 0.5474
 epoch: 95, train_loss: 0.8329, test_loss: 0.8669, test_f1: 0.5533
 epoch: 96, train_loss: 0.8412, test_loss: 0.8881, test_f1: 0.5561
 epoch: 97, train_loss: 0.8257, test_loss: 0.8806, test_f1: 0.5500
 epoch: 98, train_loss: 0.8286, test_loss: 0.9107, test_f1: 0.5365
 epoch: 99, train_loss: 0.8362, test_loss: 0.8922, test_f1: 0.5478
##################ITERATION #9 ****************************************
 epoch: 0, train_loss: 1.4718, test_loss: 1.1388, test_f1: 0.4268
 epoch: 1, train_loss: 1.1802, test_loss: 1.0764, test_f1: 0.4243
 epoch: 2, train_loss: 1.1224, test_loss: 1.0366, test_f1: 0.4593
 epoch: 3, train_loss: 1.0897, test_loss: 1.0390, test_f1: 0.4430
 epoch: 4, train_loss: 1.0754, test_loss: 1.0211, test_f1: 0.4488
 epoch: 5, train_loss: 1.0604, test_loss: 1.0155, test_f1: 0.4759
 epoch: 6, train_loss: 1.0386, test_loss: 1.0087, test_f1: 0.4739
 epoch: 7, train_loss: 1.0134, test_loss: 1.0187, test_f1: 0.5065
 epoch: 8, train_loss: 1.0143, test_loss: 0.9941, test_f1: 0.4742
 epoch: 9, train_loss: 0.9989, test_loss: 1.0006, test_f1: 0.4816
 epoch: 10, train_loss: 0.9962, test_loss: 0.9901, test_f1: 0.4607
 epoch: 11, train_loss: 1.0016, test_loss: 0.9943, test_f1: 0.4722
 epoch: 12, train_loss: 0.9778, test_loss: 0.9874, test_f1: 0.4568
 epoch: 13, train_loss: 0.9777, test_loss: 0.9960, test_f1: 0.4810
 epoch: 14, train_loss: 0.9797, test_loss: 0.9796, test_f1: 0.4841
 epoch: 15, train_loss: 0.9716, test_loss: 0.9722, test_f1: 0.4870
 epoch: 16, train_loss: 0.9737, test_loss: 0.9983, test_f1: 0.4862
 epoch: 17, train_loss: 0.9698, test_loss: 0.9715, test_f1: 0.4846
 epoch: 18, train_loss: 0.9692, test_loss: 0.9501, test_f1: 0.4837
 epoch: 19, train_loss: 0.9501, test_loss: 0.9638, test_f1: 0.4936
 epoch: 20, train_loss: 0.9606, test_loss: 0.9481, test_f1: 0.5475
 epoch: 21, train_loss: 0.9511, test_loss: 0.9572, test_f1: 0.5054
 epoch: 22, train_loss: 0.9461, test_loss: 0.9699, test_f1: 0.4981
 epoch: 23, train_loss: 0.9452, test_loss: 0.9601, test_f1: 0.4699
 epoch: 24, train_loss: 0.9456, test_loss: 0.9565, test_f1: 0.4988
 epoch: 25, train_loss: 0.9337, test_loss: 0.9528, test_f1: 0.5009
 epoch: 26, train_loss: 0.9354, test_loss: 0.9556, test_f1: 0.5074
 epoch: 27, train_loss: 0.9217, test_loss: 0.9532, test_f1: 0.5300
 epoch: 28, train_loss: 0.9310, test_loss: 0.9547, test_f1: 0.5393
 epoch: 29, train_loss: 0.9242, test_loss: 0.9625, test_f1: 0.5322
 epoch: 30, train_loss: 0.9169, test_loss: 0.9557, test_f1: 0.5231
 epoch: 31, train_loss: 0.9239, test_loss: 0.9612, test_f1: 0.5419
 epoch: 32, train_loss: 0.9195, test_loss: 0.9539, test_f1: 0.5410
 epoch: 33, train_loss: 0.9271, test_loss: 1.0610, test_f1: 0.4830
 epoch: 34, train_loss: 0.9241, test_loss: 0.9467, test_f1: 0.5202
 epoch: 35, train_loss: 0.9173, test_loss: 0.9494, test_f1: 0.5398
 epoch: 36, train_loss: 0.9128, test_loss: 0.9156, test_f1: 0.5196
 epoch: 37, train_loss: 0.8971, test_loss: 0.9442, test_f1: 0.5503
 epoch: 38, train_loss: 0.9109, test_loss: 0.9215, test_f1: 0.5417
 epoch: 39, train_loss: 0.9040, test_loss: 0.9500, test_f1: 0.5175
 epoch: 40, train_loss: 0.9003, test_loss: 0.9185, test_f1: 0.5326
 epoch: 41, train_loss: 0.9086, test_loss: 0.9333, test_f1: 0.5260
 epoch: 42, train_loss: 0.8966, test_loss: 0.9315, test_f1: 0.5238
 epoch: 43, train_loss: 0.8988, test_loss: 0.9069, test_f1: 0.5189
 epoch: 44, train_loss: 0.9020, test_loss: 0.9554, test_f1: 0.5219
 epoch: 45, train_loss: 0.8903, test_loss: 0.9012, test_f1: 0.5224
 epoch: 46, train_loss: 0.8898, test_loss: 0.8917, test_f1: 0.5020
 epoch: 47, train_loss: 0.8923, test_loss: 0.9215, test_f1: 0.5260
 epoch: 48, train_loss: 0.8805, test_loss: 0.9496, test_f1: 0.5285
 epoch: 49, train_loss: 0.8868, test_loss: 0.8803, test_f1: 0.5494
 epoch: 50, train_loss: 0.8928, test_loss: 0.9218, test_f1: 0.5539
 epoch: 51, train_loss: 0.8770, test_loss: 0.9313, test_f1: 0.5565
 epoch: 52, train_loss: 0.8708, test_loss: 0.9126, test_f1: 0.5348
 epoch: 53, train_loss: 0.8761, test_loss: 0.9354, test_f1: 0.5188
 epoch: 54, train_loss: 0.8699, test_loss: 0.9244, test_f1: 0.5206
 epoch: 55, train_loss: 0.8783, test_loss: 0.9287, test_f1: 0.5425
 epoch: 56, train_loss: 0.8623, test_loss: 0.9062, test_f1: 0.5507
 epoch: 57, train_loss: 0.8757, test_loss: 0.9212, test_f1: 0.5563
 epoch: 58, train_loss: 0.8654, test_loss: 0.9231, test_f1: 0.5390
 epoch: 59, train_loss: 0.8687, test_loss: 0.9018, test_f1: 0.5510
 epoch: 60, train_loss: 0.8625, test_loss: 0.9161, test_f1: 0.5314
 epoch: 61, train_loss: 0.8669, test_loss: 0.9209, test_f1: 0.5482
 epoch: 62, train_loss: 0.8702, test_loss: 0.9354, test_f1: 0.5415
 epoch: 63, train_loss: 0.8662, test_loss: 0.9169, test_f1: 0.5515
 epoch: 64, train_loss: 0.8688, test_loss: 0.9041, test_f1: 0.5577
 epoch: 65, train_loss: 0.8574, test_loss: 0.9095, test_f1: 0.5363
 epoch: 66, train_loss: 0.8707, test_loss: 0.9270, test_f1: 0.5490
 epoch: 67, train_loss: 0.8565, test_loss: 0.9140, test_f1: 0.5387
 epoch: 68, train_loss: 0.8580, test_loss: 0.9034, test_f1: 0.5458
 epoch: 69, train_loss: 0.8554, test_loss: 0.9317, test_f1: 0.5476
 epoch: 70, train_loss: 0.8567, test_loss: 0.9304, test_f1: 0.5312
 epoch: 71, train_loss: 0.8563, test_loss: 0.9211, test_f1: 0.5568
 epoch: 72, train_loss: 0.8507, test_loss: 0.9053, test_f1: 0.5508
 epoch: 73, train_loss: 0.8480, test_loss: 0.9213, test_f1: 0.5464
 epoch: 74, train_loss: 0.8522, test_loss: 0.9067, test_f1: 0.5508
 epoch: 75, train_loss: 0.8542, test_loss: 0.9474, test_f1: 0.5329
 epoch: 76, train_loss: 0.8785, test_loss: 0.9538, test_f1: 0.5321
 epoch: 77, train_loss: 0.8540, test_loss: 0.9275, test_f1: 0.5514
 epoch: 78, train_loss: 0.8540, test_loss: 0.9170, test_f1: 0.5388
 epoch: 79, train_loss: 0.8503, test_loss: 0.9254, test_f1: 0.5333
 epoch: 80, train_loss: 0.8480, test_loss: 0.9235, test_f1: 0.5490
 epoch: 81, train_loss: 0.8559, test_loss: 0.9130, test_f1: 0.5341
 epoch: 82, train_loss: 0.8545, test_loss: 0.9172, test_f1: 0.5570
 epoch: 83, train_loss: 0.8519, test_loss: 0.9324, test_f1: 0.5431
 epoch: 84, train_loss: 0.8527, test_loss: 0.9208, test_f1: 0.5719
 epoch: 85, train_loss: 0.8422, test_loss: 0.9119, test_f1: 0.5687
 epoch: 86, train_loss: 0.8345, test_loss: 0.9229, test_f1: 0.5332
 epoch: 87, train_loss: 0.8488, test_loss: 0.9218, test_f1: 0.5401
 epoch: 88, train_loss: 0.8448, test_loss: 0.9185, test_f1: 0.5416
 epoch: 89, train_loss: 0.8498, test_loss: 0.9345, test_f1: 0.5397
 epoch: 90, train_loss: 0.8428, test_loss: 0.9156, test_f1: 0.5565
 epoch: 91, train_loss: 0.8430, test_loss: 0.9281, test_f1: 0.5508
 epoch: 92, train_loss: 0.8390, test_loss: 0.9114, test_f1: 0.5566
 epoch: 93, train_loss: 0.8389, test_loss: 0.9231, test_f1: 0.5481
 epoch: 94, train_loss: 0.8405, test_loss: 0.9071, test_f1: 0.5248
 epoch: 95, train_loss: 0.8472, test_loss: 0.9035, test_f1: 0.5428
 epoch: 96, train_loss: 0.8513, test_loss: 0.9218, test_f1: 0.5460
 epoch: 97, train_loss: 0.8495, test_loss: 0.9001, test_f1: 0.5589
 epoch: 98, train_loss: 0.8420, test_loss: 0.9083, test_f1: 0.5724
 epoch: 99, train_loss: 0.8501, test_loss: 0.9063, test_f1: 0.5639

Training completed in 792.18 seconds
Best F1: 0.5802 at epoch 99
Mean F1 across iterations: 0.5645  0.0098
========================FINAL RESULTS================================
FEGIN weighted F1: 0.5802  0.0098
python main.py --data ltspice_examples --representation component_net --model FEGIN --layers 2 --hiddens 16 --batch_size 32 --lr 0.001 --emb_size 250 --epochs 100 --save_appendix component_net_L2_H16_BS32_LR0.001_E250 --no_val
-----



STDERR:
  File "main.py", line 370, in <module>
    main()
  File "main.py", line 254, in main
    dataset = dataset_class(
  File "/home/philip/projects/ltspice_examples_code_repo/Circuit-Completion-Using-GNNs/component_classification_with_link_prediction_head/evaluation/FEGIN/kernel/circuit_datasets.py", line 15, in __init__
    self.data, self.slices = torch.load(self.processed_paths[0])
  File "/home/philip/.local/lib/python3.8/site-packages/torch/serialization.py", line 1040, in load
    warnings.warn(
  File "/usr/lib/python3.8/warnings.py", line 109, in _showwarnmsg
    sw(msg.message, msg.category, msg.filename, msg.lineno,
  File "main.py", line 47, in warn_with_traceback
    traceback.print_stack(file=log)
/home/philip/projects/ltspice_examples_code_repo/Circuit-Completion-Using-GNNs/component_classification_with_link_prediction_head/evaluation/FEGIN/kernel/circuit_datasets.py:15: FutureWarning: You are using `torch.load` with `weights_only=False` (the current default value), which uses the default pickle module implicitly. It is possible to construct malicious pickle data which will execute arbitrary code during unpickling (See https://github.com/pytorch/pytorch/blob/main/SECURITY.md#untrusted-models for more details). In a future release, the default value for `weights_only` will be flipped to `True`. This limits the functions that could be executed during unpickling. Arbitrary objects will no longer be allowed to be loaded via this mode unless they are explicitly allowlisted by the user via `torch.serialization.add_safe_globals`. We recommend you start setting `weights_only=True` for any use case where you don't have full control of the loaded file. Please open an issue on GitHub for any issues related to this experimental feature.
  self.data, self.slices = torch.load(self.processed_paths[0])
