STDOUT:
Results will be saved in /home/philip/projects/ltspice_examples_code_repo/Circuit-Completion-Using-GNNs/component_classification_with_link_prediction_head/evaluation/FEGIN/results/model_FEGIN_dataset_ltspice_examples
Command line input: python main.py --data ltspice_examples --representation component_pin_net --model FEGIN --layers 5 --hiddens 32 --batch_size 32 --lr 0.001 --emb_size 128 --epochs 100 --save_appendix component_pin_net_L5_H32_BS32_LR0.001_E128 --no_val
 is saved.
-----
ltspice_examples - FEGIN
Using 5 layers, 32 hidden units, h = 2
Loading component_pin_net representation dataset
ENTERED
Training FEGIN on component_pin_net representation
Train: 3558, Test: 846
##################ITERATION #0 ****************************************
 epoch: 0, train_loss: 1.2143, test_loss: 1.0687, test_f1: 0.3913
 epoch: 1, train_loss: 1.0492, test_loss: 1.0665, test_f1: 0.4212
 epoch: 2, train_loss: 1.0204, test_loss: 1.0101, test_f1: 0.5121
 epoch: 3, train_loss: 1.0115, test_loss: 0.9824, test_f1: 0.4917
 epoch: 4, train_loss: 0.9760, test_loss: 1.0207, test_f1: 0.5058
 epoch: 5, train_loss: 0.9584, test_loss: 0.9585, test_f1: 0.5089
 epoch: 6, train_loss: 0.9510, test_loss: 0.9459, test_f1: 0.5264
 epoch: 7, train_loss: 0.9256, test_loss: 0.9339, test_f1: 0.5638
 epoch: 8, train_loss: 0.9288, test_loss: 0.8990, test_f1: 0.5655
 epoch: 9, train_loss: 0.9019, test_loss: 0.9300, test_f1: 0.5323
 epoch: 10, train_loss: 0.8994, test_loss: 0.9412, test_f1: 0.5124
 epoch: 11, train_loss: 0.8877, test_loss: 0.8930, test_f1: 0.5546
 epoch: 12, train_loss: 0.8932, test_loss: 0.8799, test_f1: 0.5691
 epoch: 13, train_loss: 0.8688, test_loss: 0.9358, test_f1: 0.5723
 epoch: 14, train_loss: 0.8598, test_loss: 0.9085, test_f1: 0.5840
 epoch: 15, train_loss: 0.8575, test_loss: 0.8775, test_f1: 0.5852
 epoch: 16, train_loss: 0.8511, test_loss: 0.9235, test_f1: 0.5098
 epoch: 17, train_loss: 0.8408, test_loss: 0.9225, test_f1: 0.5424
 epoch: 18, train_loss: 0.8302, test_loss: 0.9170, test_f1: 0.5336
 epoch: 19, train_loss: 0.8289, test_loss: 0.9003, test_f1: 0.5769
 epoch: 20, train_loss: 0.8121, test_loss: 0.8936, test_f1: 0.5777
 epoch: 21, train_loss: 0.8112, test_loss: 0.8851, test_f1: 0.5699
 epoch: 22, train_loss: 0.8065, test_loss: 0.9295, test_f1: 0.5589
 epoch: 23, train_loss: 0.7941, test_loss: 0.8879, test_f1: 0.5986
 epoch: 24, train_loss: 0.7988, test_loss: 0.9063, test_f1: 0.6011
 epoch: 25, train_loss: 0.7716, test_loss: 0.9158, test_f1: 0.5212
 epoch: 26, train_loss: 0.7664, test_loss: 0.9034, test_f1: 0.6182
 epoch: 27, train_loss: 0.7771, test_loss: 0.8712, test_f1: 0.5852
 epoch: 28, train_loss: 0.7774, test_loss: 0.8847, test_f1: 0.6151
 epoch: 29, train_loss: 0.7647, test_loss: 0.8518, test_f1: 0.5569
 epoch: 30, train_loss: 0.7566, test_loss: 0.9228, test_f1: 0.5800
 epoch: 31, train_loss: 0.7415, test_loss: 0.9125, test_f1: 0.5745
 epoch: 32, train_loss: 0.7451, test_loss: 0.8870, test_f1: 0.6088
 epoch: 33, train_loss: 0.7434, test_loss: 0.8085, test_f1: 0.6026
 epoch: 34, train_loss: 0.7355, test_loss: 0.8381, test_f1: 0.5776
 epoch: 35, train_loss: 0.7282, test_loss: 0.8631, test_f1: 0.6347
 epoch: 36, train_loss: 0.7157, test_loss: 0.8841, test_f1: 0.6274
 epoch: 37, train_loss: 0.7212, test_loss: 0.8967, test_f1: 0.6070
 epoch: 38, train_loss: 0.7266, test_loss: 0.9127, test_f1: 0.5766
 epoch: 39, train_loss: 0.7109, test_loss: 0.9057, test_f1: 0.5995
 epoch: 40, train_loss: 0.7047, test_loss: 0.8738, test_f1: 0.6128
 epoch: 41, train_loss: 0.7014, test_loss: 0.8892, test_f1: 0.6444
 epoch: 42, train_loss: 0.6746, test_loss: 0.8392, test_f1: 0.6351
 epoch: 43, train_loss: 0.6891, test_loss: 0.8389, test_f1: 0.6497
 epoch: 44, train_loss: 0.7042, test_loss: 0.8975, test_f1: 0.6122
 epoch: 45, train_loss: 0.7045, test_loss: 0.7995, test_f1: 0.6371
 epoch: 46, train_loss: 0.6783, test_loss: 0.8066, test_f1: 0.6457
 epoch: 47, train_loss: 0.6733, test_loss: 0.8511, test_f1: 0.6393
 epoch: 48, train_loss: 0.6700, test_loss: 0.8525, test_f1: 0.6380
 epoch: 49, train_loss: 0.6697, test_loss: 0.8218, test_f1: 0.6550
 epoch: 50, train_loss: 0.6550, test_loss: 0.8840, test_f1: 0.6286
 epoch: 51, train_loss: 0.6408, test_loss: 0.7979, test_f1: 0.6850
 epoch: 52, train_loss: 0.6143, test_loss: 0.8044, test_f1: 0.6570
 epoch: 53, train_loss: 0.6000, test_loss: 0.8046, test_f1: 0.6625
 epoch: 54, train_loss: 0.5949, test_loss: 0.8457, test_f1: 0.6426
 epoch: 55, train_loss: 0.5968, test_loss: 0.8192, test_f1: 0.6616
 epoch: 56, train_loss: 0.6057, test_loss: 0.7978, test_f1: 0.6387
 epoch: 57, train_loss: 0.5995, test_loss: 0.8302, test_f1: 0.6487
 epoch: 58, train_loss: 0.5830, test_loss: 0.8226, test_f1: 0.6626
 epoch: 59, train_loss: 0.5942, test_loss: 0.8275, test_f1: 0.6686
 epoch: 60, train_loss: 0.5876, test_loss: 0.9372, test_f1: 0.6355
 epoch: 61, train_loss: 0.5785, test_loss: 0.8052, test_f1: 0.6623
 epoch: 62, train_loss: 0.5870, test_loss: 0.8417, test_f1: 0.6659
 epoch: 63, train_loss: 0.5922, test_loss: 0.8480, test_f1: 0.6437
 epoch: 64, train_loss: 0.5861, test_loss: 0.8194, test_f1: 0.6522
 epoch: 65, train_loss: 0.5847, test_loss: 0.8797, test_f1: 0.6436
 epoch: 66, train_loss: 0.5825, test_loss: 0.8534, test_f1: 0.6551
 epoch: 67, train_loss: 0.5854, test_loss: 0.8423, test_f1: 0.6400
 epoch: 68, train_loss: 0.5832, test_loss: 0.8305, test_f1: 0.6577
 epoch: 69, train_loss: 0.5562, test_loss: 0.7967, test_f1: 0.6730
 epoch: 70, train_loss: 0.5520, test_loss: 0.8498, test_f1: 0.6547
 epoch: 71, train_loss: 0.5628, test_loss: 0.8281, test_f1: 0.6707
 epoch: 72, train_loss: 0.5735, test_loss: 0.8729, test_f1: 0.6401
 epoch: 73, train_loss: 0.5665, test_loss: 0.8649, test_f1: 0.6511
 epoch: 74, train_loss: 0.5553, test_loss: 0.8188, test_f1: 0.6623
 epoch: 75, train_loss: 0.5575, test_loss: 0.8490, test_f1: 0.6576
 epoch: 76, train_loss: 0.5526, test_loss: 0.7978, test_f1: 0.6757
 epoch: 77, train_loss: 0.5476, test_loss: 0.7994, test_f1: 0.6858
 epoch: 78, train_loss: 0.5394, test_loss: 0.8957, test_f1: 0.6251
 epoch: 79, train_loss: 0.5503, test_loss: 0.8849, test_f1: 0.6518
 epoch: 80, train_loss: 0.5508, test_loss: 0.8833, test_f1: 0.6438
 epoch: 81, train_loss: 0.5572, test_loss: 0.9030, test_f1: 0.6372
 epoch: 82, train_loss: 0.5313, test_loss: 0.8196, test_f1: 0.6347
 epoch: 83, train_loss: 0.5194, test_loss: 0.8969, test_f1: 0.6473
 epoch: 84, train_loss: 0.5281, test_loss: 0.8742, test_f1: 0.6469
 epoch: 85, train_loss: 0.5334, test_loss: 0.8441, test_f1: 0.6582
 epoch: 86, train_loss: 0.5230, test_loss: 0.7328, test_f1: 0.6613
 epoch: 87, train_loss: 0.5230, test_loss: 0.8569, test_f1: 0.6913
 epoch: 88, train_loss: 0.5319, test_loss: 0.8560, test_f1: 0.6503
 epoch: 89, train_loss: 0.5373, test_loss: 0.8087, test_f1: 0.6658
 epoch: 90, train_loss: 0.5403, test_loss: 0.8855, test_f1: 0.6585
 epoch: 91, train_loss: 0.5239, test_loss: 0.8627, test_f1: 0.6489
 epoch: 92, train_loss: 0.5189, test_loss: 0.9053, test_f1: 0.6562
 epoch: 93, train_loss: 0.6160, test_loss: 0.9275, test_f1: 0.6633
 epoch: 94, train_loss: 0.5507, test_loss: 0.8380, test_f1: 0.6809
 epoch: 95, train_loss: 0.5298, test_loss: 0.9176, test_f1: 0.6231
 epoch: 96, train_loss: 0.5090, test_loss: 0.9326, test_f1: 0.6590
 epoch: 97, train_loss: 0.5149, test_loss: 0.9215, test_f1: 0.6374
 epoch: 98, train_loss: 0.5161, test_loss: 0.9061, test_f1: 0.6729
 epoch: 99, train_loss: 0.5092, test_loss: 0.8866, test_f1: 0.6519
##################ITERATION #1 ****************************************
 epoch: 0, train_loss: 1.1370, test_loss: 1.0129, test_f1: 0.4590
 epoch: 1, train_loss: 1.0102, test_loss: 0.9945, test_f1: 0.4657
 epoch: 2, train_loss: 0.9777, test_loss: 0.9673, test_f1: 0.5021
 epoch: 3, train_loss: 0.9561, test_loss: 0.9524, test_f1: 0.5366
 epoch: 4, train_loss: 0.9425, test_loss: 0.9964, test_f1: 0.5143
 epoch: 5, train_loss: 0.9338, test_loss: 0.9117, test_f1: 0.4898
 epoch: 6, train_loss: 0.9314, test_loss: 0.9704, test_f1: 0.5058
 epoch: 7, train_loss: 0.8979, test_loss: 0.9215, test_f1: 0.5007
 epoch: 8, train_loss: 0.8818, test_loss: 0.9014, test_f1: 0.5355
 epoch: 9, train_loss: 0.8743, test_loss: 0.9038, test_f1: 0.5467
 epoch: 10, train_loss: 0.8719, test_loss: 0.9018, test_f1: 0.5650
 epoch: 11, train_loss: 0.8389, test_loss: 0.8998, test_f1: 0.5468
 epoch: 12, train_loss: 0.8571, test_loss: 0.9152, test_f1: 0.5689
 epoch: 13, train_loss: 0.8275, test_loss: 0.9714, test_f1: 0.5140
 epoch: 14, train_loss: 0.8220, test_loss: 0.8720, test_f1: 0.5906
 epoch: 15, train_loss: 0.8150, test_loss: 0.8961, test_f1: 0.5746
 epoch: 16, train_loss: 0.8053, test_loss: 0.8659, test_f1: 0.5792
 epoch: 17, train_loss: 0.8035, test_loss: 0.8148, test_f1: 0.6045
 epoch: 18, train_loss: 0.7867, test_loss: 0.8699, test_f1: 0.5776
 epoch: 19, train_loss: 0.7945, test_loss: 0.7775, test_f1: 0.5673
 epoch: 20, train_loss: 0.7779, test_loss: 0.7708, test_f1: 0.6087
 epoch: 21, train_loss: 0.7809, test_loss: 0.8133, test_f1: 0.5780
 epoch: 22, train_loss: 0.7561, test_loss: 0.8052, test_f1: 0.6011
 epoch: 23, train_loss: 0.7686, test_loss: 0.8344, test_f1: 0.5882
 epoch: 24, train_loss: 0.7432, test_loss: 0.8420, test_f1: 0.6336
 epoch: 25, train_loss: 0.7520, test_loss: 0.8757, test_f1: 0.5389
 epoch: 26, train_loss: 0.7603, test_loss: 0.7720, test_f1: 0.6151
 epoch: 27, train_loss: 0.7340, test_loss: 0.8107, test_f1: 0.5911
 epoch: 28, train_loss: 0.7367, test_loss: 0.8083, test_f1: 0.6137
 epoch: 29, train_loss: 0.7228, test_loss: 0.7471, test_f1: 0.6535
 epoch: 30, train_loss: 0.7138, test_loss: 0.7671, test_f1: 0.6720
 epoch: 31, train_loss: 0.7133, test_loss: 0.7737, test_f1: 0.6395
 epoch: 32, train_loss: 0.7137, test_loss: 0.8500, test_f1: 0.6185
 epoch: 33, train_loss: 0.6961, test_loss: 0.8248, test_f1: 0.6152
 epoch: 34, train_loss: 0.7059, test_loss: 0.7236, test_f1: 0.6340
 epoch: 35, train_loss: 0.7099, test_loss: 0.7255, test_f1: 0.6550
 epoch: 36, train_loss: 0.6823, test_loss: 0.7785, test_f1: 0.5841
 epoch: 37, train_loss: 0.6788, test_loss: 0.7878, test_f1: 0.6219
 epoch: 38, train_loss: 0.6732, test_loss: 0.8001, test_f1: 0.6395
 epoch: 39, train_loss: 0.6780, test_loss: 0.7520, test_f1: 0.6550
 epoch: 40, train_loss: 0.6742, test_loss: 0.7995, test_f1: 0.6642
 epoch: 41, train_loss: 0.6785, test_loss: 0.7249, test_f1: 0.6790
 epoch: 42, train_loss: 0.6712, test_loss: 0.7301, test_f1: 0.6283
 epoch: 43, train_loss: 0.6503, test_loss: 0.7915, test_f1: 0.6733
 epoch: 44, train_loss: 0.6508, test_loss: 0.7602, test_f1: 0.6240
 epoch: 45, train_loss: 0.6424, test_loss: 0.8020, test_f1: 0.6813
 epoch: 46, train_loss: 0.6356, test_loss: 0.7631, test_f1: 0.6905
 epoch: 47, train_loss: 0.6427, test_loss: 0.8050, test_f1: 0.6394
 epoch: 48, train_loss: 0.6281, test_loss: 0.7922, test_f1: 0.6690
 epoch: 49, train_loss: 0.6241, test_loss: 0.8054, test_f1: 0.6523
 epoch: 50, train_loss: 0.6211, test_loss: 0.7303, test_f1: 0.6458
 epoch: 51, train_loss: 0.5949, test_loss: 0.7994, test_f1: 0.6705
 epoch: 52, train_loss: 0.6020, test_loss: 0.7896, test_f1: 0.6753
 epoch: 53, train_loss: 0.5763, test_loss: 0.7818, test_f1: 0.6773
 epoch: 54, train_loss: 0.5766, test_loss: 0.7489, test_f1: 0.6870
 epoch: 55, train_loss: 0.5713, test_loss: 0.7611, test_f1: 0.6662
 epoch: 56, train_loss: 0.5716, test_loss: 0.7731, test_f1: 0.6699
 epoch: 57, train_loss: 0.5776, test_loss: 0.7866, test_f1: 0.6982
 epoch: 58, train_loss: 0.5762, test_loss: 0.7952, test_f1: 0.6775
 epoch: 59, train_loss: 0.5775, test_loss: 0.7291, test_f1: 0.6902
 epoch: 60, train_loss: 0.5668, test_loss: 0.7720, test_f1: 0.6600
 epoch: 61, train_loss: 0.5708, test_loss: 0.7399, test_f1: 0.6978
 epoch: 62, train_loss: 0.5499, test_loss: 0.7946, test_f1: 0.6500
 epoch: 63, train_loss: 0.5616, test_loss: 0.8054, test_f1: 0.6571
 epoch: 64, train_loss: 0.5543, test_loss: 0.8281, test_f1: 0.6749
 epoch: 65, train_loss: 0.5640, test_loss: 0.8295, test_f1: 0.6535
 epoch: 66, train_loss: 0.5599, test_loss: 0.8484, test_f1: 0.6837
 epoch: 67, train_loss: 0.5532, test_loss: 0.7970, test_f1: 0.6711
 epoch: 68, train_loss: 0.5454, test_loss: 0.8105, test_f1: 0.6948
 epoch: 69, train_loss: 0.5522, test_loss: 0.7818, test_f1: 0.6845
 epoch: 70, train_loss: 0.5352, test_loss: 0.8427, test_f1: 0.6626
 epoch: 71, train_loss: 0.5452, test_loss: 0.8490, test_f1: 0.6500
 epoch: 72, train_loss: 0.5434, test_loss: 0.8157, test_f1: 0.6488
 epoch: 73, train_loss: 0.5338, test_loss: 0.8294, test_f1: 0.6829
 epoch: 74, train_loss: 0.5454, test_loss: 0.8224, test_f1: 0.6908
 epoch: 75, train_loss: 0.5394, test_loss: 0.8562, test_f1: 0.6742
 epoch: 76, train_loss: 0.5399, test_loss: 0.8213, test_f1: 0.6826
 epoch: 77, train_loss: 0.5400, test_loss: 0.8549, test_f1: 0.6517
 epoch: 78, train_loss: 0.5362, test_loss: 0.8577, test_f1: 0.6639
 epoch: 79, train_loss: 0.5166, test_loss: 0.7817, test_f1: 0.6594
 epoch: 80, train_loss: 0.5275, test_loss: 0.8702, test_f1: 0.6814
 epoch: 81, train_loss: 0.5149, test_loss: 0.8708, test_f1: 0.7008
 epoch: 82, train_loss: 0.5210, test_loss: 0.8589, test_f1: 0.6633
 epoch: 83, train_loss: 0.5269, test_loss: 0.8831, test_f1: 0.6861
 epoch: 84, train_loss: 0.5299, test_loss: 0.8592, test_f1: 0.6954
 epoch: 85, train_loss: 0.5119, test_loss: 0.9027, test_f1: 0.6790
 epoch: 86, train_loss: 0.5061, test_loss: 0.8732, test_f1: 0.6806
 epoch: 87, train_loss: 0.5019, test_loss: 0.9641, test_f1: 0.6653
 epoch: 88, train_loss: 0.5130, test_loss: 0.9510, test_f1: 0.6557
 epoch: 89, train_loss: 0.5147, test_loss: 0.9150, test_f1: 0.6678
 epoch: 90, train_loss: 0.4988, test_loss: 0.8638, test_f1: 0.6813
 epoch: 91, train_loss: 0.5124, test_loss: 0.9357, test_f1: 0.6788
 epoch: 92, train_loss: 0.5081, test_loss: 0.9626, test_f1: 0.6903
 epoch: 93, train_loss: 0.4984, test_loss: 0.8743, test_f1: 0.6650
 epoch: 94, train_loss: 0.5032, test_loss: 0.9092, test_f1: 0.6720
 epoch: 95, train_loss: 0.4953, test_loss: 0.9468, test_f1: 0.6767
 epoch: 96, train_loss: 0.4995, test_loss: 0.9348, test_f1: 0.6553
 epoch: 97, train_loss: 0.5014, test_loss: 0.9821, test_f1: 0.6648
 epoch: 98, train_loss: 0.4994, test_loss: 0.9387, test_f1: 0.6743
 epoch: 99, train_loss: 0.4913, test_loss: 0.9381, test_f1: 0.6960
##################ITERATION #2 ****************************************
 epoch: 0, train_loss: 1.1165, test_loss: 0.9901, test_f1: 0.4296
 epoch: 1, train_loss: 0.9839, test_loss: 0.9080, test_f1: 0.5290
 epoch: 2, train_loss: 0.9568, test_loss: 0.9009, test_f1: 0.5167
 epoch: 3, train_loss: 0.9347, test_loss: 0.8993, test_f1: 0.4981
 epoch: 4, train_loss: 0.9130, test_loss: 0.9320, test_f1: 0.5004
 epoch: 5, train_loss: 0.9162, test_loss: 0.9203, test_f1: 0.5141
 epoch: 6, train_loss: 0.9028, test_loss: 0.8642, test_f1: 0.5576
 epoch: 7, train_loss: 0.8862, test_loss: 0.9026, test_f1: 0.5338
 epoch: 8, train_loss: 0.8663, test_loss: 0.8421, test_f1: 0.5595
 epoch: 9, train_loss: 0.8611, test_loss: 0.8453, test_f1: 0.5563
 epoch: 10, train_loss: 0.8659, test_loss: 0.9821, test_f1: 0.4902
 epoch: 11, train_loss: 0.8575, test_loss: 0.8067, test_f1: 0.6021
 epoch: 12, train_loss: 0.8273, test_loss: 0.8394, test_f1: 0.6105
 epoch: 13, train_loss: 0.8233, test_loss: 0.8354, test_f1: 0.5694
 epoch: 14, train_loss: 0.8243, test_loss: 0.8836, test_f1: 0.5688
 epoch: 15, train_loss: 0.7969, test_loss: 0.8719, test_f1: 0.5753
 epoch: 16, train_loss: 0.7921, test_loss: 0.7918, test_f1: 0.5964
 epoch: 17, train_loss: 0.7886, test_loss: 0.7852, test_f1: 0.6216
 epoch: 18, train_loss: 0.7842, test_loss: 0.8475, test_f1: 0.5889
 epoch: 19, train_loss: 0.7649, test_loss: 0.8245, test_f1: 0.6074
 epoch: 20, train_loss: 0.7503, test_loss: 0.8634, test_f1: 0.6365
 epoch: 21, train_loss: 0.7506, test_loss: 0.7875, test_f1: 0.6272
 epoch: 22, train_loss: 0.7537, test_loss: 0.7844, test_f1: 0.6292
 epoch: 23, train_loss: 0.7430, test_loss: 0.8320, test_f1: 0.6209
 epoch: 24, train_loss: 0.7456, test_loss: 0.8297, test_f1: 0.6183
 epoch: 25, train_loss: 0.7237, test_loss: 0.8495, test_f1: 0.6252
 epoch: 26, train_loss: 0.7255, test_loss: 0.8460, test_f1: 0.6408
 epoch: 27, train_loss: 0.7400, test_loss: 0.8307, test_f1: 0.6181
 epoch: 28, train_loss: 0.7307, test_loss: 0.8326, test_f1: 0.6416
 epoch: 29, train_loss: 0.7234, test_loss: 0.8943, test_f1: 0.6336
 epoch: 30, train_loss: 0.7108, test_loss: 0.8934, test_f1: 0.6164
 epoch: 31, train_loss: 0.7104, test_loss: 0.8723, test_f1: 0.6307
 epoch: 32, train_loss: 0.6924, test_loss: 0.8476, test_f1: 0.6344
 epoch: 33, train_loss: 0.6864, test_loss: 0.8728, test_f1: 0.6582
 epoch: 34, train_loss: 0.6846, test_loss: 0.8699, test_f1: 0.6589
 epoch: 35, train_loss: 0.6742, test_loss: 0.8771, test_f1: 0.6481
 epoch: 36, train_loss: 0.6761, test_loss: 0.8232, test_f1: 0.6431
 epoch: 37, train_loss: 0.6713, test_loss: 0.8681, test_f1: 0.6145
 epoch: 38, train_loss: 0.6626, test_loss: 0.8674, test_f1: 0.6339
 epoch: 39, train_loss: 0.6748, test_loss: 0.8188, test_f1: 0.6722
 epoch: 40, train_loss: 0.6569, test_loss: 0.8686, test_f1: 0.6517
 epoch: 41, train_loss: 0.6544, test_loss: 0.8713, test_f1: 0.6251
 epoch: 42, train_loss: 0.6631, test_loss: 0.9223, test_f1: 0.6736
 epoch: 43, train_loss: 0.6593, test_loss: 0.8429, test_f1: 0.6560
 epoch: 44, train_loss: 0.6412, test_loss: 0.8391, test_f1: 0.6378
 epoch: 45, train_loss: 0.6471, test_loss: 0.9607, test_f1: 0.6104
 epoch: 46, train_loss: 0.6456, test_loss: 0.8473, test_f1: 0.6480
 epoch: 47, train_loss: 0.6444, test_loss: 0.8621, test_f1: 0.6420
 epoch: 48, train_loss: 0.6522, test_loss: 0.9239, test_f1: 0.6294
 epoch: 49, train_loss: 0.6465, test_loss: 0.9622, test_f1: 0.6279
 epoch: 50, train_loss: 0.6305, test_loss: 0.8530, test_f1: 0.6517
 epoch: 51, train_loss: 0.6042, test_loss: 0.8423, test_f1: 0.6414
 epoch: 52, train_loss: 0.5936, test_loss: 0.8989, test_f1: 0.6663
 epoch: 53, train_loss: 0.5925, test_loss: 0.8978, test_f1: 0.6784
 epoch: 54, train_loss: 0.5739, test_loss: 0.8823, test_f1: 0.6574
 epoch: 55, train_loss: 0.5773, test_loss: 0.8478, test_f1: 0.6646
 epoch: 56, train_loss: 0.5759, test_loss: 0.8988, test_f1: 0.6728
 epoch: 57, train_loss: 0.5738, test_loss: 0.8888, test_f1: 0.6500
 epoch: 58, train_loss: 0.5654, test_loss: 0.9268, test_f1: 0.6513
 epoch: 59, train_loss: 0.5689, test_loss: 0.9740, test_f1: 0.6705
 epoch: 60, train_loss: 0.5507, test_loss: 0.9523, test_f1: 0.6670
 epoch: 61, train_loss: 0.5673, test_loss: 0.9434, test_f1: 0.6868
 epoch: 62, train_loss: 0.5562, test_loss: 0.8603, test_f1: 0.6780
 epoch: 63, train_loss: 0.5463, test_loss: 0.9563, test_f1: 0.6551
 epoch: 64, train_loss: 0.5485, test_loss: 0.9524, test_f1: 0.6647
 epoch: 65, train_loss: 0.5527, test_loss: 0.8467, test_f1: 0.6564
 epoch: 66, train_loss: 0.5568, test_loss: 1.0020, test_f1: 0.6563
 epoch: 67, train_loss: 0.5381, test_loss: 0.8437, test_f1: 0.6641
 epoch: 68, train_loss: 0.5390, test_loss: 0.8887, test_f1: 0.6784
 epoch: 69, train_loss: 0.5499, test_loss: 0.9154, test_f1: 0.6566
 epoch: 70, train_loss: 0.5488, test_loss: 0.9239, test_f1: 0.6667
 epoch: 71, train_loss: 0.5507, test_loss: 0.8244, test_f1: 0.6749
 epoch: 72, train_loss: 0.5346, test_loss: 0.9267, test_f1: 0.6698
 epoch: 73, train_loss: 0.5287, test_loss: 0.9543, test_f1: 0.6582
 epoch: 74, train_loss: 0.5260, test_loss: 0.9910, test_f1: 0.6656
 epoch: 75, train_loss: 0.5345, test_loss: 0.9970, test_f1: 0.6584
 epoch: 76, train_loss: 0.5192, test_loss: 0.9573, test_f1: 0.6680
 epoch: 77, train_loss: 0.5235, test_loss: 0.9339, test_f1: 0.6825
 epoch: 78, train_loss: 0.5092, test_loss: 1.0116, test_f1: 0.6591
 epoch: 79, train_loss: 0.5365, test_loss: 0.9505, test_f1: 0.6869
 epoch: 80, train_loss: 0.5090, test_loss: 0.9947, test_f1: 0.6588
 epoch: 81, train_loss: 0.5022, test_loss: 0.9761, test_f1: 0.6698
 epoch: 82, train_loss: 0.5209, test_loss: 0.9945, test_f1: 0.6844
 epoch: 83, train_loss: 0.5369, test_loss: 0.9626, test_f1: 0.6342
 epoch: 84, train_loss: 0.5135, test_loss: 0.9514, test_f1: 0.6478
 epoch: 85, train_loss: 0.5070, test_loss: 0.9892, test_f1: 0.6841
 epoch: 86, train_loss: 0.5134, test_loss: 0.9865, test_f1: 0.6554
 epoch: 87, train_loss: 0.5136, test_loss: 1.0617, test_f1: 0.6542
 epoch: 88, train_loss: 0.5115, test_loss: 0.9552, test_f1: 0.6867
 epoch: 89, train_loss: 0.4963, test_loss: 0.9433, test_f1: 0.6767
 epoch: 90, train_loss: 0.5175, test_loss: 0.9383, test_f1: 0.6820
 epoch: 91, train_loss: 0.5164, test_loss: 0.9822, test_f1: 0.6641
 epoch: 92, train_loss: 0.5020, test_loss: 0.9569, test_f1: 0.6583
 epoch: 93, train_loss: 0.4993, test_loss: 1.0610, test_f1: 0.6505
 epoch: 94, train_loss: 0.4871, test_loss: 0.9875, test_f1: 0.6682
 epoch: 95, train_loss: 0.5008, test_loss: 1.0121, test_f1: 0.6652
 epoch: 96, train_loss: 0.4971, test_loss: 0.8831, test_f1: 0.6744
 epoch: 97, train_loss: 0.4827, test_loss: 0.9977, test_f1: 0.6744
 epoch: 98, train_loss: 0.4877, test_loss: 0.9147, test_f1: 0.6861
 epoch: 99, train_loss: 0.4913, test_loss: 0.9479, test_f1: 0.6908
##################ITERATION #3 ****************************************
 epoch: 0, train_loss: 1.1472, test_loss: 1.0411, test_f1: 0.4983
 epoch: 1, train_loss: 1.0015, test_loss: 0.9514, test_f1: 0.4953
 epoch: 2, train_loss: 0.9867, test_loss: 0.9765, test_f1: 0.4873
 epoch: 3, train_loss: 0.9595, test_loss: 0.9275, test_f1: 0.4869
 epoch: 4, train_loss: 0.9419, test_loss: 0.9188, test_f1: 0.5375
 epoch: 5, train_loss: 0.9200, test_loss: 0.9357, test_f1: 0.5223
 epoch: 6, train_loss: 0.9208, test_loss: 0.8747, test_f1: 0.5257
 epoch: 7, train_loss: 0.9138, test_loss: 0.9246, test_f1: 0.5297
 epoch: 8, train_loss: 0.8883, test_loss: 0.8520, test_f1: 0.5458
 epoch: 9, train_loss: 0.8978, test_loss: 0.8351, test_f1: 0.5319
 epoch: 10, train_loss: 0.8747, test_loss: 0.8616, test_f1: 0.5365
 epoch: 11, train_loss: 0.8664, test_loss: 0.9102, test_f1: 0.5388
 epoch: 12, train_loss: 0.8454, test_loss: 0.8339, test_f1: 0.5517
 epoch: 13, train_loss: 0.8348, test_loss: 0.8225, test_f1: 0.5703
 epoch: 14, train_loss: 0.8343, test_loss: 0.8166, test_f1: 0.5783
 epoch: 15, train_loss: 0.8369, test_loss: 0.8257, test_f1: 0.5479
 epoch: 16, train_loss: 0.8298, test_loss: 0.8650, test_f1: 0.5482
 epoch: 17, train_loss: 0.8310, test_loss: 0.9034, test_f1: 0.5479
 epoch: 18, train_loss: 0.8151, test_loss: 0.7911, test_f1: 0.6054
 epoch: 19, train_loss: 0.8068, test_loss: 0.7761, test_f1: 0.6038
 epoch: 20, train_loss: 0.7903, test_loss: 0.7885, test_f1: 0.5871
 epoch: 21, train_loss: 0.7723, test_loss: 0.7960, test_f1: 0.5979
 epoch: 22, train_loss: 0.7774, test_loss: 0.7670, test_f1: 0.6167
 epoch: 23, train_loss: 0.7671, test_loss: 0.8578, test_f1: 0.6402
 epoch: 24, train_loss: 0.7614, test_loss: 0.8486, test_f1: 0.5548
 epoch: 25, train_loss: 0.7440, test_loss: 0.7651, test_f1: 0.5784
 epoch: 26, train_loss: 0.7591, test_loss: 0.8036, test_f1: 0.6148
 epoch: 27, train_loss: 0.7442, test_loss: 0.7788, test_f1: 0.6055
 epoch: 28, train_loss: 0.7388, test_loss: 0.9137, test_f1: 0.5809
 epoch: 29, train_loss: 0.7211, test_loss: 0.8096, test_f1: 0.5887
 epoch: 30, train_loss: 0.7125, test_loss: 0.7618, test_f1: 0.6135
 epoch: 31, train_loss: 0.7260, test_loss: 0.7232, test_f1: 0.6368
 epoch: 32, train_loss: 0.7301, test_loss: 0.8344, test_f1: 0.6224
 epoch: 33, train_loss: 0.7006, test_loss: 0.8858, test_f1: 0.6039
 epoch: 34, train_loss: 0.7118, test_loss: 0.8681, test_f1: 0.6258
 epoch: 35, train_loss: 0.7082, test_loss: 0.8547, test_f1: 0.6369
 epoch: 36, train_loss: 0.7036, test_loss: 0.8571, test_f1: 0.6409
 epoch: 37, train_loss: 0.6890, test_loss: 0.8479, test_f1: 0.6548
 epoch: 38, train_loss: 0.6737, test_loss: 0.8667, test_f1: 0.6289
 epoch: 39, train_loss: 0.6898, test_loss: 0.8537, test_f1: 0.6230
 epoch: 40, train_loss: 0.6821, test_loss: 0.8216, test_f1: 0.6476
 epoch: 41, train_loss: 0.6671, test_loss: 0.8918, test_f1: 0.6185
 epoch: 42, train_loss: 0.7113, test_loss: 0.7228, test_f1: 0.6365
 epoch: 43, train_loss: 0.6884, test_loss: 0.8429, test_f1: 0.6615
 epoch: 44, train_loss: 0.6566, test_loss: 0.7335, test_f1: 0.6420
 epoch: 45, train_loss: 0.6515, test_loss: 0.8390, test_f1: 0.6190
 epoch: 46, train_loss: 0.6361, test_loss: 0.9092, test_f1: 0.6447
 epoch: 47, train_loss: 0.6591, test_loss: 0.8126, test_f1: 0.6229
 epoch: 48, train_loss: 0.6450, test_loss: 0.7291, test_f1: 0.6795
 epoch: 49, train_loss: 0.6486, test_loss: 0.8322, test_f1: 0.6108
 epoch: 50, train_loss: 0.6443, test_loss: 0.8378, test_f1: 0.6327
 epoch: 51, train_loss: 0.6171, test_loss: 0.8396, test_f1: 0.6405
 epoch: 52, train_loss: 0.5988, test_loss: 0.8643, test_f1: 0.6764
 epoch: 53, train_loss: 0.5964, test_loss: 0.8539, test_f1: 0.6525
 epoch: 54, train_loss: 0.5961, test_loss: 0.8918, test_f1: 0.6515
 epoch: 55, train_loss: 0.5848, test_loss: 0.8778, test_f1: 0.6537
 epoch: 56, train_loss: 0.5973, test_loss: 0.8273, test_f1: 0.6711
 epoch: 57, train_loss: 0.5757, test_loss: 0.8503, test_f1: 0.6804
 epoch: 58, train_loss: 0.5689, test_loss: 0.8119, test_f1: 0.6793
 epoch: 59, train_loss: 0.5768, test_loss: 0.9338, test_f1: 0.6634
 epoch: 60, train_loss: 0.5939, test_loss: 0.9095, test_f1: 0.6839
 epoch: 61, train_loss: 0.5812, test_loss: 0.9163, test_f1: 0.6515
 epoch: 62, train_loss: 0.5711, test_loss: 0.8860, test_f1: 0.6735
 epoch: 63, train_loss: 0.5811, test_loss: 0.8882, test_f1: 0.6702
 epoch: 64, train_loss: 0.5582, test_loss: 0.9157, test_f1: 0.6613
 epoch: 65, train_loss: 0.5786, test_loss: 0.9288, test_f1: 0.6637
 epoch: 66, train_loss: 0.5659, test_loss: 0.8944, test_f1: 0.6801
 epoch: 67, train_loss: 0.5586, test_loss: 0.9361, test_f1: 0.6702
 epoch: 68, train_loss: 0.5819, test_loss: 0.9016, test_f1: 0.6421
 epoch: 69, train_loss: 0.5556, test_loss: 0.8763, test_f1: 0.6726
 epoch: 70, train_loss: 0.5445, test_loss: 0.9797, test_f1: 0.6466
 epoch: 71, train_loss: 0.5555, test_loss: 0.9691, test_f1: 0.6377
 epoch: 72, train_loss: 0.5460, test_loss: 0.9656, test_f1: 0.6608
 epoch: 73, train_loss: 0.5471, test_loss: 0.9974, test_f1: 0.6411
 epoch: 74, train_loss: 0.5559, test_loss: 0.9914, test_f1: 0.6717
 epoch: 75, train_loss: 0.5532, test_loss: 0.8336, test_f1: 0.6616
 epoch: 76, train_loss: 0.5439, test_loss: 0.8948, test_f1: 0.6537
 epoch: 77, train_loss: 0.5403, test_loss: 0.8335, test_f1: 0.6735
 epoch: 78, train_loss: 0.5381, test_loss: 0.9651, test_f1: 0.6755
 epoch: 79, train_loss: 0.5298, test_loss: 0.9542, test_f1: 0.6402
 epoch: 80, train_loss: 0.5437, test_loss: 0.9107, test_f1: 0.6655
 epoch: 81, train_loss: 0.5376, test_loss: 0.9310, test_f1: 0.6576
 epoch: 82, train_loss: 0.5631, test_loss: 0.9295, test_f1: 0.6893
 epoch: 83, train_loss: 0.5396, test_loss: 0.8101, test_f1: 0.6706
 epoch: 84, train_loss: 0.5237, test_loss: 0.9523, test_f1: 0.6539
 epoch: 85, train_loss: 0.5197, test_loss: 0.9059, test_f1: 0.6523
 epoch: 86, train_loss: 0.5312, test_loss: 0.9470, test_f1: 0.6476
 epoch: 87, train_loss: 0.5224, test_loss: 0.9059, test_f1: 0.6809
 epoch: 88, train_loss: 0.5170, test_loss: 0.9502, test_f1: 0.6573
 epoch: 89, train_loss: 0.5086, test_loss: 0.9961, test_f1: 0.6483
 epoch: 90, train_loss: 0.5240, test_loss: 0.8480, test_f1: 0.6654
 epoch: 91, train_loss: 0.5216, test_loss: 0.9140, test_f1: 0.6576
 epoch: 92, train_loss: 0.5144, test_loss: 0.9539, test_f1: 0.6625
 epoch: 93, train_loss: 0.5067, test_loss: 0.8980, test_f1: 0.6671
 epoch: 94, train_loss: 0.5155, test_loss: 0.9026, test_f1: 0.6807
 epoch: 95, train_loss: 0.4976, test_loss: 0.9996, test_f1: 0.6644
 epoch: 96, train_loss: 0.5045, test_loss: 1.0491, test_f1: 0.6468
 epoch: 97, train_loss: 0.4962, test_loss: 1.0291, test_f1: 0.6580
 epoch: 98, train_loss: 0.5163, test_loss: 0.9839, test_f1: 0.6469
 epoch: 99, train_loss: 0.5170, test_loss: 1.0271, test_f1: 0.6693
##################ITERATION #4 ****************************************
 epoch: 0, train_loss: 1.1641, test_loss: 1.0503, test_f1: 0.4607
 epoch: 1, train_loss: 1.0129, test_loss: 0.9976, test_f1: 0.4535
 epoch: 2, train_loss: 0.9719, test_loss: 0.9765, test_f1: 0.4942
 epoch: 3, train_loss: 0.9687, test_loss: 0.9444, test_f1: 0.5237
 epoch: 4, train_loss: 0.9293, test_loss: 0.8832, test_f1: 0.5206
 epoch: 5, train_loss: 0.9300, test_loss: 0.8819, test_f1: 0.5322
 epoch: 6, train_loss: 0.9152, test_loss: 0.9169, test_f1: 0.5335
 epoch: 7, train_loss: 0.9198, test_loss: 0.8475, test_f1: 0.5425
 epoch: 8, train_loss: 0.8879, test_loss: 0.8677, test_f1: 0.5384
 epoch: 9, train_loss: 0.8823, test_loss: 0.8643, test_f1: 0.5539
 epoch: 10, train_loss: 0.8751, test_loss: 0.8472, test_f1: 0.5744
 epoch: 11, train_loss: 0.8637, test_loss: 0.8311, test_f1: 0.5611
 epoch: 12, train_loss: 0.8586, test_loss: 0.8020, test_f1: 0.5713
 epoch: 13, train_loss: 0.8669, test_loss: 0.8363, test_f1: 0.5820
 epoch: 14, train_loss: 0.8395, test_loss: 0.7818, test_f1: 0.6117
 epoch: 15, train_loss: 0.8264, test_loss: 0.7938, test_f1: 0.5777
 epoch: 16, train_loss: 0.8190, test_loss: 0.8136, test_f1: 0.5902
 epoch: 17, train_loss: 0.8092, test_loss: 0.7783, test_f1: 0.5930
 epoch: 18, train_loss: 0.7931, test_loss: 0.7759, test_f1: 0.5816
 epoch: 19, train_loss: 0.7775, test_loss: 0.7500, test_f1: 0.6236
 epoch: 20, train_loss: 0.7732, test_loss: 0.8261, test_f1: 0.5740
 epoch: 21, train_loss: 0.7860, test_loss: 0.7226, test_f1: 0.6219
 epoch: 22, train_loss: 0.7690, test_loss: 0.7408, test_f1: 0.6267
 epoch: 23, train_loss: 0.7586, test_loss: 0.7373, test_f1: 0.6423
 epoch: 24, train_loss: 0.7478, test_loss: 0.7471, test_f1: 0.6232
 epoch: 25, train_loss: 0.7510, test_loss: 0.7120, test_f1: 0.6591
 epoch: 26, train_loss: 0.7388, test_loss: 0.7278, test_f1: 0.6410
 epoch: 27, train_loss: 0.7311, test_loss: 0.6994, test_f1: 0.6656
 epoch: 28, train_loss: 0.7291, test_loss: 0.7378, test_f1: 0.6221
 epoch: 29, train_loss: 0.7366, test_loss: 0.7023, test_f1: 0.6659
 epoch: 30, train_loss: 0.7205, test_loss: 0.6920, test_f1: 0.6390
 epoch: 31, train_loss: 0.7160, test_loss: 0.6816, test_f1: 0.6704
 epoch: 32, train_loss: 0.7104, test_loss: 0.6836, test_f1: 0.6632
 epoch: 33, train_loss: 0.6993, test_loss: 0.7101, test_f1: 0.6754
 epoch: 34, train_loss: 0.6981, test_loss: 0.7070, test_f1: 0.6635
 epoch: 35, train_loss: 0.6882, test_loss: 0.6823, test_f1: 0.6567
 epoch: 36, train_loss: 0.7084, test_loss: 0.6875, test_f1: 0.6744
 epoch: 37, train_loss: 0.6917, test_loss: 0.6859, test_f1: 0.6427
 epoch: 38, train_loss: 0.6888, test_loss: 0.7359, test_f1: 0.6216
 epoch: 39, train_loss: 0.6834, test_loss: 0.7310, test_f1: 0.6488
 epoch: 40, train_loss: 0.6818, test_loss: 0.7058, test_f1: 0.6532
 epoch: 41, train_loss: 0.6638, test_loss: 0.6832, test_f1: 0.6524
 epoch: 42, train_loss: 0.6630, test_loss: 0.7046, test_f1: 0.6498
 epoch: 43, train_loss: 0.6574, test_loss: 0.7227, test_f1: 0.6575
 epoch: 44, train_loss: 0.6588, test_loss: 0.6816, test_f1: 0.6767
 epoch: 45, train_loss: 0.6350, test_loss: 0.7011, test_f1: 0.6775
 epoch: 46, train_loss: 0.6443, test_loss: 0.6774, test_f1: 0.7195
 epoch: 47, train_loss: 0.6461, test_loss: 0.7082, test_f1: 0.6644
 epoch: 48, train_loss: 0.6247, test_loss: 0.7570, test_f1: 0.6194
 epoch: 49, train_loss: 0.6593, test_loss: 0.7129, test_f1: 0.6567
 epoch: 50, train_loss: 0.6418, test_loss: 0.7558, test_f1: 0.6399
 epoch: 51, train_loss: 0.5991, test_loss: 0.7177, test_f1: 0.6712
 epoch: 52, train_loss: 0.5946, test_loss: 0.6798, test_f1: 0.6724
 epoch: 53, train_loss: 0.5958, test_loss: 0.7047, test_f1: 0.6695
 epoch: 54, train_loss: 0.5757, test_loss: 0.6953, test_f1: 0.6763
 epoch: 55, train_loss: 0.5865, test_loss: 0.7690, test_f1: 0.6665
 epoch: 56, train_loss: 0.5782, test_loss: 0.6955, test_f1: 0.6761
 epoch: 57, train_loss: 0.5617, test_loss: 0.6780, test_f1: 0.6889
 epoch: 58, train_loss: 0.5517, test_loss: 0.7090, test_f1: 0.6851
 epoch: 59, train_loss: 0.5601, test_loss: 0.6890, test_f1: 0.6905
 epoch: 60, train_loss: 0.5562, test_loss: 0.7244, test_f1: 0.6761
 epoch: 61, train_loss: 0.5651, test_loss: 0.6650, test_f1: 0.7015
 epoch: 62, train_loss: 0.5484, test_loss: 0.7152, test_f1: 0.6959
 epoch: 63, train_loss: 0.5643, test_loss: 0.7302, test_f1: 0.6881
 epoch: 64, train_loss: 0.5762, test_loss: 0.7315, test_f1: 0.6824
 epoch: 65, train_loss: 0.5360, test_loss: 0.7065, test_f1: 0.6962
 epoch: 66, train_loss: 0.5410, test_loss: 0.7549, test_f1: 0.6689
 epoch: 67, train_loss: 0.5546, test_loss: 0.7674, test_f1: 0.6778
 epoch: 68, train_loss: 0.5306, test_loss: 0.8140, test_f1: 0.6651
 epoch: 69, train_loss: 0.5389, test_loss: 0.7657, test_f1: 0.6719
 epoch: 70, train_loss: 0.5412, test_loss: 0.7299, test_f1: 0.6771
 epoch: 71, train_loss: 0.5275, test_loss: 0.7907, test_f1: 0.6605
 epoch: 72, train_loss: 0.5357, test_loss: 0.8000, test_f1: 0.6615
 epoch: 73, train_loss: 0.5339, test_loss: 0.7885, test_f1: 0.6662
 epoch: 74, train_loss: 0.5365, test_loss: 0.8099, test_f1: 0.6722
 epoch: 75, train_loss: 0.5262, test_loss: 0.8148, test_f1: 0.6779
 epoch: 76, train_loss: 0.5395, test_loss: 0.7958, test_f1: 0.6744
 epoch: 77, train_loss: 0.5255, test_loss: 0.8341, test_f1: 0.6737
 epoch: 78, train_loss: 0.5190, test_loss: 0.7784, test_f1: 0.6783
 epoch: 79, train_loss: 0.5021, test_loss: 0.8112, test_f1: 0.6724
 epoch: 80, train_loss: 0.5075, test_loss: 0.7858, test_f1: 0.6789
 epoch: 81, train_loss: 0.5208, test_loss: 0.7753, test_f1: 0.6867
 epoch: 82, train_loss: 0.5161, test_loss: 0.7926, test_f1: 0.6764
 epoch: 83, train_loss: 0.5129, test_loss: 0.8026, test_f1: 0.6803
 epoch: 84, train_loss: 0.4913, test_loss: 0.8247, test_f1: 0.6801
 epoch: 85, train_loss: 0.5055, test_loss: 0.7849, test_f1: 0.6816
 epoch: 86, train_loss: 0.4926, test_loss: 0.7938, test_f1: 0.7033
 epoch: 87, train_loss: 0.4993, test_loss: 0.8360, test_f1: 0.6827
 epoch: 88, train_loss: 0.4879, test_loss: 0.7977, test_f1: 0.6831
 epoch: 89, train_loss: 0.4950, test_loss: 0.8344, test_f1: 0.6970
 epoch: 90, train_loss: 0.4909, test_loss: 0.8641, test_f1: 0.6746
 epoch: 91, train_loss: 0.4882, test_loss: 0.8583, test_f1: 0.6737
 epoch: 92, train_loss: 0.4970, test_loss: 0.8334, test_f1: 0.6930
 epoch: 93, train_loss: 0.5023, test_loss: 0.8138, test_f1: 0.6900
 epoch: 94, train_loss: 0.4786, test_loss: 0.7925, test_f1: 0.6847
 epoch: 95, train_loss: 0.4634, test_loss: 0.8430, test_f1: 0.6834
 epoch: 96, train_loss: 0.4775, test_loss: 0.7957, test_f1: 0.6868
 epoch: 97, train_loss: 0.4708, test_loss: 0.8571, test_f1: 0.6823
 epoch: 98, train_loss: 0.4602, test_loss: 0.8175, test_f1: 0.6894
 epoch: 99, train_loss: 0.4675, test_loss: 0.8616, test_f1: 0.6819
##################ITERATION #5 ****************************************
 epoch: 0, train_loss: 1.2100, test_loss: 1.1222, test_f1: 0.4396
 epoch: 1, train_loss: 1.0316, test_loss: 1.0392, test_f1: 0.4629
 epoch: 2, train_loss: 1.0073, test_loss: 0.9826, test_f1: 0.4995
 epoch: 3, train_loss: 0.9737, test_loss: 0.9912, test_f1: 0.4737
 epoch: 4, train_loss: 0.9510, test_loss: 0.9871, test_f1: 0.4881
 epoch: 5, train_loss: 0.9423, test_loss: 0.9780, test_f1: 0.5106
 epoch: 6, train_loss: 0.9326, test_loss: 0.9979, test_f1: 0.4784
 epoch: 7, train_loss: 0.9216, test_loss: 1.0394, test_f1: 0.4752
 epoch: 8, train_loss: 0.9021, test_loss: 0.9594, test_f1: 0.5496
 epoch: 9, train_loss: 0.9053, test_loss: 0.9099, test_f1: 0.5646
 epoch: 10, train_loss: 0.8875, test_loss: 0.9171, test_f1: 0.5401
 epoch: 11, train_loss: 0.8858, test_loss: 0.9393, test_f1: 0.5506
 epoch: 12, train_loss: 0.8690, test_loss: 0.9095, test_f1: 0.5615
 epoch: 13, train_loss: 0.8669, test_loss: 0.9001, test_f1: 0.6069
 epoch: 14, train_loss: 0.8295, test_loss: 0.9321, test_f1: 0.5751
 epoch: 15, train_loss: 0.8400, test_loss: 0.8924, test_f1: 0.6012
 epoch: 16, train_loss: 0.8317, test_loss: 0.8790, test_f1: 0.5868
 epoch: 17, train_loss: 0.8184, test_loss: 0.8807, test_f1: 0.5757
 epoch: 18, train_loss: 0.8143, test_loss: 0.8932, test_f1: 0.5922
 epoch: 19, train_loss: 0.7989, test_loss: 0.8479, test_f1: 0.6079
 epoch: 20, train_loss: 0.7945, test_loss: 0.8454, test_f1: 0.5894
 epoch: 21, train_loss: 0.7765, test_loss: 0.8176, test_f1: 0.6096
 epoch: 22, train_loss: 0.7725, test_loss: 0.8454, test_f1: 0.6055
 epoch: 23, train_loss: 0.7664, test_loss: 0.8799, test_f1: 0.5911
 epoch: 24, train_loss: 0.7620, test_loss: 0.8109, test_f1: 0.6008
 epoch: 25, train_loss: 0.7738, test_loss: 0.8196, test_f1: 0.6273
 epoch: 26, train_loss: 0.7584, test_loss: 0.8036, test_f1: 0.6152
 epoch: 27, train_loss: 0.7491, test_loss: 0.8178, test_f1: 0.5905
 epoch: 28, train_loss: 0.7432, test_loss: 0.8389, test_f1: 0.5961
 epoch: 29, train_loss: 0.7447, test_loss: 0.7850, test_f1: 0.6123
 epoch: 30, train_loss: 0.7391, test_loss: 0.8705, test_f1: 0.6067
 epoch: 31, train_loss: 0.7261, test_loss: 0.8345, test_f1: 0.6395
 epoch: 32, train_loss: 0.7293, test_loss: 0.8247, test_f1: 0.6292
 epoch: 33, train_loss: 0.7169, test_loss: 0.8654, test_f1: 0.5866
 epoch: 34, train_loss: 0.7161, test_loss: 0.8224, test_f1: 0.6057
 epoch: 35, train_loss: 0.7108, test_loss: 0.8243, test_f1: 0.6427
 epoch: 36, train_loss: 0.7053, test_loss: 0.8668, test_f1: 0.6245
 epoch: 37, train_loss: 0.7116, test_loss: 0.8647, test_f1: 0.6228
 epoch: 38, train_loss: 0.7001, test_loss: 0.7241, test_f1: 0.6585
 epoch: 39, train_loss: 0.6762, test_loss: 0.8333, test_f1: 0.6243
 epoch: 40, train_loss: 0.6899, test_loss: 0.7323, test_f1: 0.6638
 epoch: 41, train_loss: 0.6893, test_loss: 0.7682, test_f1: 0.6684
 epoch: 42, train_loss: 0.6900, test_loss: 0.8310, test_f1: 0.6212
 epoch: 43, train_loss: 0.6729, test_loss: 0.7156, test_f1: 0.6759
 epoch: 44, train_loss: 0.6712, test_loss: 0.7496, test_f1: 0.6570
 epoch: 45, train_loss: 0.6832, test_loss: 0.8626, test_f1: 0.6212
 epoch: 46, train_loss: 0.6696, test_loss: 0.7479, test_f1: 0.6572
 epoch: 47, train_loss: 0.6569, test_loss: 0.7870, test_f1: 0.6719
 epoch: 48, train_loss: 0.6564, test_loss: 0.7654, test_f1: 0.6846
 epoch: 49, train_loss: 0.6446, test_loss: 0.8433, test_f1: 0.6516
 epoch: 50, train_loss: 0.6462, test_loss: 0.8510, test_f1: 0.6297
 epoch: 51, train_loss: 0.6258, test_loss: 0.8951, test_f1: 0.6650
 epoch: 52, train_loss: 0.6165, test_loss: 0.8088, test_f1: 0.6498
 epoch: 53, train_loss: 0.6193, test_loss: 0.8174, test_f1: 0.6534
 epoch: 54, train_loss: 0.6098, test_loss: 0.8265, test_f1: 0.6534
 epoch: 55, train_loss: 0.6111, test_loss: 0.7890, test_f1: 0.6618
 epoch: 56, train_loss: 0.5971, test_loss: 0.8526, test_f1: 0.6505
 epoch: 57, train_loss: 0.5866, test_loss: 0.8351, test_f1: 0.6702
 epoch: 58, train_loss: 0.5856, test_loss: 0.8563, test_f1: 0.6509
 epoch: 59, train_loss: 0.5951, test_loss: 0.8724, test_f1: 0.6489
 epoch: 60, train_loss: 0.5867, test_loss: 0.8536, test_f1: 0.6545
 epoch: 61, train_loss: 0.5814, test_loss: 0.9242, test_f1: 0.6531
 epoch: 62, train_loss: 0.5696, test_loss: 0.8607, test_f1: 0.6502
 epoch: 63, train_loss: 0.5730, test_loss: 0.8992, test_f1: 0.6634
 epoch: 64, train_loss: 0.5652, test_loss: 0.8949, test_f1: 0.6586
 epoch: 65, train_loss: 0.5669, test_loss: 0.8954, test_f1: 0.6866
 epoch: 66, train_loss: 0.5664, test_loss: 0.8868, test_f1: 0.6738
 epoch: 67, train_loss: 0.5786, test_loss: 0.9369, test_f1: 0.6536
 epoch: 68, train_loss: 0.5741, test_loss: 0.8654, test_f1: 0.6729
 epoch: 69, train_loss: 0.5844, test_loss: 0.8547, test_f1: 0.6600
 epoch: 70, train_loss: 0.5542, test_loss: 0.9291, test_f1: 0.6516
 epoch: 71, train_loss: 0.5621, test_loss: 0.8175, test_f1: 0.6648
 epoch: 72, train_loss: 0.5646, test_loss: 0.8861, test_f1: 0.6591
 epoch: 73, train_loss: 0.5507, test_loss: 0.9572, test_f1: 0.6517
 epoch: 74, train_loss: 0.5490, test_loss: 0.9178, test_f1: 0.6593
 epoch: 75, train_loss: 0.5647, test_loss: 0.9414, test_f1: 0.6649
 epoch: 76, train_loss: 0.5379, test_loss: 0.9236, test_f1: 0.6672
 epoch: 77, train_loss: 0.5522, test_loss: 0.9428, test_f1: 0.6558
 epoch: 78, train_loss: 0.5521, test_loss: 0.9669, test_f1: 0.6645
 epoch: 79, train_loss: 0.5418, test_loss: 0.9806, test_f1: 0.6467
 epoch: 80, train_loss: 0.5554, test_loss: 0.9090, test_f1: 0.6755
 epoch: 81, train_loss: 0.5435, test_loss: 0.9446, test_f1: 0.6688
 epoch: 82, train_loss: 0.5288, test_loss: 0.8872, test_f1: 0.6806
 epoch: 83, train_loss: 0.5446, test_loss: 0.8786, test_f1: 0.6724
 epoch: 84, train_loss: 0.5389, test_loss: 0.8425, test_f1: 0.6690
 epoch: 85, train_loss: 0.5376, test_loss: 0.9361, test_f1: 0.6798
 epoch: 86, train_loss: 0.5328, test_loss: 0.8886, test_f1: 0.6810
 epoch: 87, train_loss: 0.5350, test_loss: 0.9313, test_f1: 0.6711
 epoch: 88, train_loss: 0.5230, test_loss: 0.9829, test_f1: 0.6607
 epoch: 89, train_loss: 0.5310, test_loss: 0.9184, test_f1: 0.6717
 epoch: 90, train_loss: 0.5266, test_loss: 0.8987, test_f1: 0.6598
 epoch: 91, train_loss: 0.5225, test_loss: 0.9420, test_f1: 0.6642
 epoch: 92, train_loss: 0.5209, test_loss: 0.9484, test_f1: 0.6905
 epoch: 93, train_loss: 0.5165, test_loss: 0.8798, test_f1: 0.6760
 epoch: 94, train_loss: 0.5086, test_loss: 0.9724, test_f1: 0.6510
 epoch: 95, train_loss: 0.5106, test_loss: 1.0161, test_f1: 0.6631
 epoch: 96, train_loss: 0.5380, test_loss: 0.9051, test_f1: 0.6467
 epoch: 97, train_loss: 0.5095, test_loss: 0.8698, test_f1: 0.6706
 epoch: 98, train_loss: 0.5088, test_loss: 1.0189, test_f1: 0.6542
 epoch: 99, train_loss: 0.4992, test_loss: 1.1026, test_f1: 0.6488
##################ITERATION #6 ****************************************
 epoch: 0, train_loss: 1.2549, test_loss: 0.9946, test_f1: 0.4908
 epoch: 1, train_loss: 1.0265, test_loss: 0.9493, test_f1: 0.5439
 epoch: 2, train_loss: 0.9935, test_loss: 0.9337, test_f1: 0.4955
 epoch: 3, train_loss: 0.9821, test_loss: 0.9281, test_f1: 0.5066
 epoch: 4, train_loss: 0.9634, test_loss: 0.9246, test_f1: 0.5576
 epoch: 5, train_loss: 0.9322, test_loss: 0.9185, test_f1: 0.5110
 epoch: 6, train_loss: 0.9138, test_loss: 0.8994, test_f1: 0.5421
 epoch: 7, train_loss: 0.9142, test_loss: 0.8716, test_f1: 0.5404
 epoch: 8, train_loss: 0.8897, test_loss: 0.8822, test_f1: 0.5422
 epoch: 9, train_loss: 0.8840, test_loss: 0.9486, test_f1: 0.5560
 epoch: 10, train_loss: 0.8664, test_loss: 0.8766, test_f1: 0.5796
 epoch: 11, train_loss: 0.8622, test_loss: 0.9141, test_f1: 0.5917
 epoch: 12, train_loss: 0.8538, test_loss: 0.8489, test_f1: 0.5786
 epoch: 13, train_loss: 0.8365, test_loss: 0.8166, test_f1: 0.5828
 epoch: 14, train_loss: 0.8326, test_loss: 0.8736, test_f1: 0.5859
 epoch: 15, train_loss: 0.8015, test_loss: 0.8589, test_f1: 0.6113
 epoch: 16, train_loss: 0.8119, test_loss: 0.8182, test_f1: 0.6021
 epoch: 17, train_loss: 0.7888, test_loss: 0.8037, test_f1: 0.6430
 epoch: 18, train_loss: 0.7833, test_loss: 0.7949, test_f1: 0.6208
 epoch: 19, train_loss: 0.7679, test_loss: 0.7830, test_f1: 0.6275
 epoch: 20, train_loss: 0.7897, test_loss: 0.7749, test_f1: 0.6250
 epoch: 21, train_loss: 0.7680, test_loss: 0.7751, test_f1: 0.6228
 epoch: 22, train_loss: 0.7514, test_loss: 0.7291, test_f1: 0.6426
 epoch: 23, train_loss: 0.7515, test_loss: 0.7894, test_f1: 0.6198
 epoch: 24, train_loss: 0.7368, test_loss: 0.7140, test_f1: 0.6365
 epoch: 25, train_loss: 0.7318, test_loss: 0.7762, test_f1: 0.6354
 epoch: 26, train_loss: 0.7332, test_loss: 0.8594, test_f1: 0.6114
 epoch: 27, train_loss: 0.7405, test_loss: 0.7307, test_f1: 0.6515
 epoch: 28, train_loss: 0.7200, test_loss: 0.7720, test_f1: 0.6459
 epoch: 29, train_loss: 0.7291, test_loss: 0.7123, test_f1: 0.6578
 epoch: 30, train_loss: 0.7092, test_loss: 0.7582, test_f1: 0.6378
 epoch: 31, train_loss: 0.7016, test_loss: 0.7451, test_f1: 0.6427
 epoch: 32, train_loss: 0.7014, test_loss: 0.7591, test_f1: 0.6344
 epoch: 33, train_loss: 0.6980, test_loss: 0.7334, test_f1: 0.6668
 epoch: 34, train_loss: 0.7006, test_loss: 0.6775, test_f1: 0.6793
 epoch: 35, train_loss: 0.6738, test_loss: 0.6633, test_f1: 0.6554
 epoch: 36, train_loss: 0.6803, test_loss: 0.6745, test_f1: 0.6913
 epoch: 37, train_loss: 0.6705, test_loss: 0.7788, test_f1: 0.6382
 epoch: 38, train_loss: 0.6820, test_loss: 0.7695, test_f1: 0.6576
 epoch: 39, train_loss: 0.6625, test_loss: 0.7012, test_f1: 0.6558
 epoch: 40, train_loss: 0.6675, test_loss: 0.7587, test_f1: 0.6452
 epoch: 41, train_loss: 0.6666, test_loss: 0.7821, test_f1: 0.6486
 epoch: 42, train_loss: 0.6456, test_loss: 0.7142, test_f1: 0.6607
 epoch: 43, train_loss: 0.6510, test_loss: 0.7729, test_f1: 0.6380
 epoch: 44, train_loss: 0.6425, test_loss: 0.7239, test_f1: 0.6510
 epoch: 45, train_loss: 0.6638, test_loss: 0.7670, test_f1: 0.6639
 epoch: 46, train_loss: 0.6559, test_loss: 0.7845, test_f1: 0.6488
 epoch: 47, train_loss: 0.6470, test_loss: 0.7490, test_f1: 0.6731
 epoch: 48, train_loss: 0.6558, test_loss: 0.7378, test_f1: 0.6347
 epoch: 49, train_loss: 0.6434, test_loss: 0.7118, test_f1: 0.6819
 epoch: 50, train_loss: 0.6191, test_loss: 0.7207, test_f1: 0.6638
 epoch: 51, train_loss: 0.6021, test_loss: 0.7724, test_f1: 0.6663
 epoch: 52, train_loss: 0.5784, test_loss: 0.7434, test_f1: 0.6635
 epoch: 53, train_loss: 0.5751, test_loss: 0.7343, test_f1: 0.6724
 epoch: 54, train_loss: 0.5729, test_loss: 0.7486, test_f1: 0.6656
 epoch: 55, train_loss: 0.5740, test_loss: 0.8019, test_f1: 0.6544
 epoch: 56, train_loss: 0.5841, test_loss: 0.7696, test_f1: 0.6524
 epoch: 57, train_loss: 0.5694, test_loss: 0.7409, test_f1: 0.6618
 epoch: 58, train_loss: 0.5718, test_loss: 0.8147, test_f1: 0.6803
 epoch: 59, train_loss: 0.5741, test_loss: 0.8061, test_f1: 0.6686
 epoch: 60, train_loss: 0.5553, test_loss: 0.7219, test_f1: 0.6671
 epoch: 61, train_loss: 0.5525, test_loss: 0.7015, test_f1: 0.6593
 epoch: 62, train_loss: 0.5669, test_loss: 0.7688, test_f1: 0.6601
 epoch: 63, train_loss: 0.5514, test_loss: 0.6906, test_f1: 0.6765
 epoch: 64, train_loss: 0.5561, test_loss: 0.8149, test_f1: 0.6544
 epoch: 65, train_loss: 0.5362, test_loss: 0.7159, test_f1: 0.6648
 epoch: 66, train_loss: 0.5573, test_loss: 0.7578, test_f1: 0.6582
 epoch: 67, train_loss: 0.5519, test_loss: 0.7467, test_f1: 0.6677
 epoch: 68, train_loss: 0.5432, test_loss: 0.7330, test_f1: 0.6621
 epoch: 69, train_loss: 0.5471, test_loss: 0.7441, test_f1: 0.6693
 epoch: 70, train_loss: 0.5553, test_loss: 0.7912, test_f1: 0.6787
 epoch: 71, train_loss: 0.5403, test_loss: 0.7409, test_f1: 0.7037
 epoch: 72, train_loss: 0.5433, test_loss: 0.7786, test_f1: 0.6715
 epoch: 73, train_loss: 0.5527, test_loss: 0.7854, test_f1: 0.6643
 epoch: 74, train_loss: 0.5426, test_loss: 0.7762, test_f1: 0.6751
 epoch: 75, train_loss: 0.5232, test_loss: 0.8482, test_f1: 0.6731
 epoch: 76, train_loss: 0.5197, test_loss: 0.7273, test_f1: 0.6660
 epoch: 77, train_loss: 0.5155, test_loss: 0.8040, test_f1: 0.6544
 epoch: 78, train_loss: 0.5233, test_loss: 0.8010, test_f1: 0.6519
 epoch: 79, train_loss: 0.5342, test_loss: 0.8194, test_f1: 0.6773
 epoch: 80, train_loss: 0.5132, test_loss: 0.8262, test_f1: 0.7016
 epoch: 81, train_loss: 0.5302, test_loss: 0.8479, test_f1: 0.6493
 epoch: 82, train_loss: 0.5294, test_loss: 0.8340, test_f1: 0.6833
 epoch: 83, train_loss: 0.5317, test_loss: 0.8232, test_f1: 0.6804
 epoch: 84, train_loss: 0.5125, test_loss: 0.7522, test_f1: 0.6667
 epoch: 85, train_loss: 0.5198, test_loss: 0.8082, test_f1: 0.6487
 epoch: 86, train_loss: 0.5054, test_loss: 0.8807, test_f1: 0.6533
 epoch: 87, train_loss: 0.5122, test_loss: 0.8926, test_f1: 0.6664
 epoch: 88, train_loss: 0.5163, test_loss: 0.8635, test_f1: 0.6577
 epoch: 89, train_loss: 0.5014, test_loss: 0.9006, test_f1: 0.6765
 epoch: 90, train_loss: 0.5045, test_loss: 0.8621, test_f1: 0.6677
 epoch: 91, train_loss: 0.4909, test_loss: 0.8811, test_f1: 0.6565
 epoch: 92, train_loss: 0.4883, test_loss: 0.8810, test_f1: 0.6777
 epoch: 93, train_loss: 0.5044, test_loss: 0.7905, test_f1: 0.6660
 epoch: 94, train_loss: 0.5065, test_loss: 0.9155, test_f1: 0.6400
 epoch: 95, train_loss: 0.4859, test_loss: 0.8162, test_f1: 0.6668
 epoch: 96, train_loss: 0.4797, test_loss: 0.7731, test_f1: 0.6700
 epoch: 97, train_loss: 0.5029, test_loss: 0.8030, test_f1: 0.6811
 epoch: 98, train_loss: 0.4873, test_loss: 0.9171, test_f1: 0.6616
 epoch: 99, train_loss: 0.5021, test_loss: 0.8578, test_f1: 0.6402
##################ITERATION #7 ****************************************
 epoch: 0, train_loss: 1.2723, test_loss: 1.0563, test_f1: 0.4923
 epoch: 1, train_loss: 1.0459, test_loss: 1.0143, test_f1: 0.4505
 epoch: 2, train_loss: 0.9853, test_loss: 0.9630, test_f1: 0.4928
 epoch: 3, train_loss: 0.9741, test_loss: 0.9516, test_f1: 0.5160
 epoch: 4, train_loss: 0.9424, test_loss: 0.8843, test_f1: 0.5143
 epoch: 5, train_loss: 0.9272, test_loss: 0.9233, test_f1: 0.5306
 epoch: 6, train_loss: 0.9133, test_loss: 0.8781, test_f1: 0.5339
 epoch: 7, train_loss: 0.9035, test_loss: 0.8799, test_f1: 0.5422
 epoch: 8, train_loss: 0.9171, test_loss: 0.9428, test_f1: 0.5441
 epoch: 9, train_loss: 0.8847, test_loss: 0.9081, test_f1: 0.5517
 epoch: 10, train_loss: 0.8734, test_loss: 0.8789, test_f1: 0.5550
 epoch: 11, train_loss: 0.8605, test_loss: 0.8303, test_f1: 0.5630
 epoch: 12, train_loss: 0.8608, test_loss: 0.8807, test_f1: 0.5506
 epoch: 13, train_loss: 0.8459, test_loss: 0.9008, test_f1: 0.5618
 epoch: 14, train_loss: 0.8343, test_loss: 0.8547, test_f1: 0.5766
 epoch: 15, train_loss: 0.8452, test_loss: 0.8531, test_f1: 0.5722
 epoch: 16, train_loss: 0.8268, test_loss: 0.8473, test_f1: 0.5723
 epoch: 17, train_loss: 0.8160, test_loss: 0.8503, test_f1: 0.5755
 epoch: 18, train_loss: 0.8120, test_loss: 0.8686, test_f1: 0.5980
 epoch: 19, train_loss: 0.8033, test_loss: 0.9068, test_f1: 0.5625
 epoch: 20, train_loss: 0.8024, test_loss: 0.7982, test_f1: 0.5807
 epoch: 21, train_loss: 0.7978, test_loss: 0.8514, test_f1: 0.5825
 epoch: 22, train_loss: 0.7897, test_loss: 0.8329, test_f1: 0.5858
 epoch: 23, train_loss: 0.7811, test_loss: 0.8364, test_f1: 0.5779
 epoch: 24, train_loss: 0.7560, test_loss: 0.8416, test_f1: 0.5948
 epoch: 25, train_loss: 0.7555, test_loss: 0.8215, test_f1: 0.5796
 epoch: 26, train_loss: 0.7359, test_loss: 0.7487, test_f1: 0.6052
 epoch: 27, train_loss: 0.7508, test_loss: 0.8045, test_f1: 0.5940
 epoch: 28, train_loss: 0.7670, test_loss: 0.7393, test_f1: 0.6042
 epoch: 29, train_loss: 0.7463, test_loss: 0.8340, test_f1: 0.6189
 epoch: 30, train_loss: 0.7470, test_loss: 0.8337, test_f1: 0.6176
 epoch: 31, train_loss: 0.7351, test_loss: 0.7605, test_f1: 0.6116
 epoch: 32, train_loss: 0.7229, test_loss: 0.8935, test_f1: 0.5771
 epoch: 33, train_loss: 0.7222, test_loss: 0.7720, test_f1: 0.6274
 epoch: 34, train_loss: 0.7312, test_loss: 0.8781, test_f1: 0.5905
 epoch: 35, train_loss: 0.7133, test_loss: 0.7764, test_f1: 0.6463
 epoch: 36, train_loss: 0.7068, test_loss: 0.7819, test_f1: 0.6451
 epoch: 37, train_loss: 0.6872, test_loss: 0.7969, test_f1: 0.6372
 epoch: 38, train_loss: 0.6971, test_loss: 0.7813, test_f1: 0.6310
 epoch: 39, train_loss: 0.6858, test_loss: 0.7953, test_f1: 0.6405
 epoch: 40, train_loss: 0.6889, test_loss: 0.8147, test_f1: 0.6577
 epoch: 41, train_loss: 0.6832, test_loss: 0.7959, test_f1: 0.6405
 epoch: 42, train_loss: 0.6850, test_loss: 0.7327, test_f1: 0.6510
 epoch: 43, train_loss: 0.6719, test_loss: 0.8293, test_f1: 0.6161
 epoch: 44, train_loss: 0.6634, test_loss: 0.7758, test_f1: 0.6590
 epoch: 45, train_loss: 0.6729, test_loss: 0.8327, test_f1: 0.6305
 epoch: 46, train_loss: 0.6692, test_loss: 0.8404, test_f1: 0.6414
 epoch: 47, train_loss: 0.6495, test_loss: 0.8285, test_f1: 0.6572
 epoch: 48, train_loss: 0.6647, test_loss: 0.7536, test_f1: 0.6394
 epoch: 49, train_loss: 0.6427, test_loss: 0.8472, test_f1: 0.6402
 epoch: 50, train_loss: 0.6581, test_loss: 0.8587, test_f1: 0.6369
 epoch: 51, train_loss: 0.6086, test_loss: 0.8086, test_f1: 0.6595
 epoch: 52, train_loss: 0.6056, test_loss: 0.8134, test_f1: 0.6675
 epoch: 53, train_loss: 0.6093, test_loss: 0.8277, test_f1: 0.6476
 epoch: 54, train_loss: 0.5983, test_loss: 0.8167, test_f1: 0.6633
 epoch: 55, train_loss: 0.5913, test_loss: 0.7970, test_f1: 0.6693
 epoch: 56, train_loss: 0.5808, test_loss: 0.8287, test_f1: 0.6593
 epoch: 57, train_loss: 0.5869, test_loss: 0.8666, test_f1: 0.6499
 epoch: 58, train_loss: 0.5840, test_loss: 0.8620, test_f1: 0.6619
 epoch: 59, train_loss: 0.5836, test_loss: 0.8598, test_f1: 0.6421
 epoch: 60, train_loss: 0.5820, test_loss: 0.8531, test_f1: 0.6739
 epoch: 61, train_loss: 0.5837, test_loss: 0.8757, test_f1: 0.6549
 epoch: 62, train_loss: 0.5740, test_loss: 0.8430, test_f1: 0.6572
 epoch: 63, train_loss: 0.5742, test_loss: 0.8870, test_f1: 0.6906
 epoch: 64, train_loss: 0.5748, test_loss: 0.8679, test_f1: 0.6687
 epoch: 65, train_loss: 0.5647, test_loss: 0.8676, test_f1: 0.6573
 epoch: 66, train_loss: 0.5623, test_loss: 0.8614, test_f1: 0.6767
 epoch: 67, train_loss: 0.5454, test_loss: 0.8416, test_f1: 0.6505
 epoch: 68, train_loss: 0.5492, test_loss: 0.8289, test_f1: 0.6594
 epoch: 69, train_loss: 0.5527, test_loss: 0.7886, test_f1: 0.6647
 epoch: 70, train_loss: 0.5600, test_loss: 0.8278, test_f1: 0.6595
 epoch: 71, train_loss: 0.5313, test_loss: 0.9047, test_f1: 0.6517
 epoch: 72, train_loss: 0.5418, test_loss: 0.8627, test_f1: 0.6377
 epoch: 73, train_loss: 0.5454, test_loss: 0.8350, test_f1: 0.6520
 epoch: 74, train_loss: 0.5667, test_loss: 0.8507, test_f1: 0.6607
 epoch: 75, train_loss: 0.5404, test_loss: 0.8291, test_f1: 0.6723
 epoch: 76, train_loss: 0.5337, test_loss: 0.8925, test_f1: 0.6503
 epoch: 77, train_loss: 0.5296, test_loss: 0.8663, test_f1: 0.6519
 epoch: 78, train_loss: 0.5387, test_loss: 0.8652, test_f1: 0.6749
 epoch: 79, train_loss: 0.5395, test_loss: 0.9101, test_f1: 0.6676
 epoch: 80, train_loss: 0.5334, test_loss: 0.9083, test_f1: 0.6674
 epoch: 81, train_loss: 0.5291, test_loss: 0.9092, test_f1: 0.6426
 epoch: 82, train_loss: 0.5296, test_loss: 0.9760, test_f1: 0.6407
 epoch: 83, train_loss: 0.5412, test_loss: 0.9420, test_f1: 0.6562
 epoch: 84, train_loss: 0.5279, test_loss: 1.0122, test_f1: 0.6706
 epoch: 85, train_loss: 0.5284, test_loss: 0.9800, test_f1: 0.6585
 epoch: 86, train_loss: 0.5371, test_loss: 0.9574, test_f1: 0.6532
 epoch: 87, train_loss: 0.5129, test_loss: 0.9617, test_f1: 0.6749
 epoch: 88, train_loss: 0.5341, test_loss: 0.9879, test_f1: 0.6694
 epoch: 89, train_loss: 0.5158, test_loss: 0.9928, test_f1: 0.6699
 epoch: 90, train_loss: 0.5170, test_loss: 1.0319, test_f1: 0.6697
 epoch: 91, train_loss: 0.5125, test_loss: 0.9076, test_f1: 0.6581
 epoch: 92, train_loss: 0.5073, test_loss: 0.9590, test_f1: 0.6792
 epoch: 93, train_loss: 0.5159, test_loss: 0.8914, test_f1: 0.6637
 epoch: 94, train_loss: 0.5105, test_loss: 0.9815, test_f1: 0.6766
 epoch: 95, train_loss: 0.4971, test_loss: 0.9339, test_f1: 0.6649
 epoch: 96, train_loss: 0.5016, test_loss: 0.9614, test_f1: 0.6738
 epoch: 97, train_loss: 0.4963, test_loss: 0.9537, test_f1: 0.6690
 epoch: 98, train_loss: 0.5056, test_loss: 0.9856, test_f1: 0.6921
 epoch: 99, train_loss: 0.4950, test_loss: 0.9603, test_f1: 0.6696
##################ITERATION #8 ****************************************
 epoch: 0, train_loss: 1.2218, test_loss: 0.9743, test_f1: 0.5009
 epoch: 1, train_loss: 1.0199, test_loss: 0.9308, test_f1: 0.5098
 epoch: 2, train_loss: 0.9918, test_loss: 0.9220, test_f1: 0.5146
 epoch: 3, train_loss: 0.9737, test_loss: 0.9597, test_f1: 0.5238
 epoch: 4, train_loss: 0.9496, test_loss: 0.9271, test_f1: 0.5186
 epoch: 5, train_loss: 0.9360, test_loss: 0.8775, test_f1: 0.5110
 epoch: 6, train_loss: 0.9354, test_loss: 0.8799, test_f1: 0.5543
 epoch: 7, train_loss: 0.9057, test_loss: 0.9089, test_f1: 0.5363
 epoch: 8, train_loss: 0.9012, test_loss: 0.8960, test_f1: 0.5633
 epoch: 9, train_loss: 0.8845, test_loss: 0.8692, test_f1: 0.5441
 epoch: 10, train_loss: 0.8776, test_loss: 0.8645, test_f1: 0.5554
 epoch: 11, train_loss: 0.8745, test_loss: 0.8424, test_f1: 0.5478
 epoch: 12, train_loss: 0.8737, test_loss: 0.8315, test_f1: 0.5844
 epoch: 13, train_loss: 0.8373, test_loss: 0.8207, test_f1: 0.5743
 epoch: 14, train_loss: 0.8604, test_loss: 0.8458, test_f1: 0.6071
 epoch: 15, train_loss: 0.8459, test_loss: 0.8401, test_f1: 0.5876
 epoch: 16, train_loss: 0.8342, test_loss: 0.8052, test_f1: 0.5835
 epoch: 17, train_loss: 0.8188, test_loss: 0.8268, test_f1: 0.5485
 epoch: 18, train_loss: 0.8114, test_loss: 0.8024, test_f1: 0.6055
 epoch: 19, train_loss: 0.8058, test_loss: 0.8303, test_f1: 0.6156
 epoch: 20, train_loss: 0.7991, test_loss: 0.8047, test_f1: 0.6138
 epoch: 21, train_loss: 0.7850, test_loss: 0.8128, test_f1: 0.6455
 epoch: 22, train_loss: 0.7782, test_loss: 0.7518, test_f1: 0.6115
 epoch: 23, train_loss: 0.7877, test_loss: 0.7795, test_f1: 0.5850
 epoch: 24, train_loss: 0.7657, test_loss: 0.8554, test_f1: 0.5903
 epoch: 25, train_loss: 0.7573, test_loss: 0.7959, test_f1: 0.6522
 epoch: 26, train_loss: 0.7473, test_loss: 0.7680, test_f1: 0.6209
 epoch: 27, train_loss: 0.7548, test_loss: 0.8011, test_f1: 0.6379
 epoch: 28, train_loss: 0.7620, test_loss: 0.8186, test_f1: 0.6089
 epoch: 29, train_loss: 0.7502, test_loss: 0.7858, test_f1: 0.6414
 epoch: 30, train_loss: 0.7311, test_loss: 0.7715, test_f1: 0.6332
 epoch: 31, train_loss: 0.7408, test_loss: 0.7624, test_f1: 0.6446
 epoch: 32, train_loss: 0.7158, test_loss: 0.7987, test_f1: 0.6463
 epoch: 33, train_loss: 0.7089, test_loss: 0.7702, test_f1: 0.6378
 epoch: 34, train_loss: 0.7018, test_loss: 0.7801, test_f1: 0.6720
 epoch: 35, train_loss: 0.6931, test_loss: 0.7064, test_f1: 0.6449
 epoch: 36, train_loss: 0.6988, test_loss: 0.8088, test_f1: 0.6237
 epoch: 37, train_loss: 0.7204, test_loss: 0.7698, test_f1: 0.6432
 epoch: 38, train_loss: 0.6905, test_loss: 0.7720, test_f1: 0.6563
 epoch: 39, train_loss: 0.7012, test_loss: 0.7896, test_f1: 0.6482
 epoch: 40, train_loss: 0.6778, test_loss: 0.7510, test_f1: 0.6479
 epoch: 41, train_loss: 0.6654, test_loss: 0.7835, test_f1: 0.6241
 epoch: 42, train_loss: 0.6639, test_loss: 0.7344, test_f1: 0.6813
 epoch: 43, train_loss: 0.7037, test_loss: 0.7851, test_f1: 0.6214
 epoch: 44, train_loss: 0.6772, test_loss: 0.8120, test_f1: 0.6252
 epoch: 45, train_loss: 0.6735, test_loss: 0.8083, test_f1: 0.6862
 epoch: 46, train_loss: 0.6659, test_loss: 0.7572, test_f1: 0.6482
 epoch: 47, train_loss: 0.6689, test_loss: 0.7806, test_f1: 0.6542
 epoch: 48, train_loss: 0.6564, test_loss: 0.7726, test_f1: 0.6668
 epoch: 49, train_loss: 0.6586, test_loss: 0.7238, test_f1: 0.6477
 epoch: 50, train_loss: 0.6319, test_loss: 0.7680, test_f1: 0.6564
 epoch: 51, train_loss: 0.6166, test_loss: 0.7945, test_f1: 0.6462
 epoch: 52, train_loss: 0.5946, test_loss: 0.7635, test_f1: 0.6714
 epoch: 53, train_loss: 0.5937, test_loss: 0.8176, test_f1: 0.6544
 epoch: 54, train_loss: 0.5890, test_loss: 0.7687, test_f1: 0.6697
 epoch: 55, train_loss: 0.5848, test_loss: 0.7876, test_f1: 0.6639
 epoch: 56, train_loss: 0.5787, test_loss: 0.8019, test_f1: 0.6653
 epoch: 57, train_loss: 0.5744, test_loss: 0.7804, test_f1: 0.6756
 epoch: 58, train_loss: 0.5746, test_loss: 0.7881, test_f1: 0.6614
 epoch: 59, train_loss: 0.5700, test_loss: 0.7813, test_f1: 0.6557
 epoch: 60, train_loss: 0.5879, test_loss: 0.7688, test_f1: 0.6721
 epoch: 61, train_loss: 0.5635, test_loss: 0.7476, test_f1: 0.6813
 epoch: 62, train_loss: 0.5684, test_loss: 0.7832, test_f1: 0.6698
 epoch: 63, train_loss: 0.5669, test_loss: 0.8010, test_f1: 0.6736
 epoch: 64, train_loss: 0.5641, test_loss: 0.8427, test_f1: 0.6464
 epoch: 65, train_loss: 0.5532, test_loss: 0.8066, test_f1: 0.6694
 epoch: 66, train_loss: 0.5523, test_loss: 0.7812, test_f1: 0.6550
 epoch: 67, train_loss: 0.5313, test_loss: 0.8019, test_f1: 0.6644
 epoch: 68, train_loss: 0.5633, test_loss: 0.8065, test_f1: 0.6491
 epoch: 69, train_loss: 0.5354, test_loss: 0.7871, test_f1: 0.6676
 epoch: 70, train_loss: 0.5510, test_loss: 0.8145, test_f1: 0.6667
 epoch: 71, train_loss: 0.5526, test_loss: 0.7964, test_f1: 0.6736
 epoch: 72, train_loss: 0.5550, test_loss: 0.8098, test_f1: 0.6647
 epoch: 73, train_loss: 0.5424, test_loss: 0.8256, test_f1: 0.6534
 epoch: 74, train_loss: 0.5289, test_loss: 0.8087, test_f1: 0.6733
 epoch: 75, train_loss: 0.5223, test_loss: 0.7874, test_f1: 0.6631
 epoch: 76, train_loss: 0.5285, test_loss: 0.8111, test_f1: 0.6725
 epoch: 77, train_loss: 0.5286, test_loss: 0.8234, test_f1: 0.6581
 epoch: 78, train_loss: 0.5253, test_loss: 0.8520, test_f1: 0.6426
 epoch: 79, train_loss: 0.5141, test_loss: 0.8505, test_f1: 0.6519
 epoch: 80, train_loss: 0.5185, test_loss: 0.7870, test_f1: 0.6785
 epoch: 81, train_loss: 0.5237, test_loss: 0.8225, test_f1: 0.6587
 epoch: 82, train_loss: 0.5204, test_loss: 0.7795, test_f1: 0.6751
 epoch: 83, train_loss: 0.5172, test_loss: 0.8353, test_f1: 0.6553
 epoch: 84, train_loss: 0.5011, test_loss: 0.8184, test_f1: 0.6560
 epoch: 85, train_loss: 0.4921, test_loss: 0.8577, test_f1: 0.6621
 epoch: 86, train_loss: 0.4977, test_loss: 0.8298, test_f1: 0.6562
 epoch: 87, train_loss: 0.5028, test_loss: 0.8265, test_f1: 0.6667
 epoch: 88, train_loss: 0.4974, test_loss: 0.8552, test_f1: 0.6620
 epoch: 89, train_loss: 0.4968, test_loss: 0.7899, test_f1: 0.6791
 epoch: 90, train_loss: 0.4849, test_loss: 0.8381, test_f1: 0.6521
 epoch: 91, train_loss: 0.4867, test_loss: 0.8341, test_f1: 0.6508
 epoch: 92, train_loss: 0.4844, test_loss: 0.8875, test_f1: 0.6737
 epoch: 93, train_loss: 0.5143, test_loss: 0.8568, test_f1: 0.6882
 epoch: 94, train_loss: 0.4928, test_loss: 0.8352, test_f1: 0.6664
 epoch: 95, train_loss: 0.4946, test_loss: 0.9118, test_f1: 0.6569
 epoch: 96, train_loss: 0.5052, test_loss: 0.8560, test_f1: 0.6705
 epoch: 97, train_loss: 0.5018, test_loss: 0.9072, test_f1: 0.6680
 epoch: 98, train_loss: 0.5159, test_loss: 0.8930, test_f1: 0.6658
 epoch: 99, train_loss: 0.4878, test_loss: 0.8456, test_f1: 0.6755
##################ITERATION #9 ****************************************
 epoch: 0, train_loss: 1.2527, test_loss: 1.0410, test_f1: 0.4722
 epoch: 1, train_loss: 1.0304, test_loss: 0.9478, test_f1: 0.5249
 epoch: 2, train_loss: 0.9954, test_loss: 0.9918, test_f1: 0.5230
 epoch: 3, train_loss: 0.9707, test_loss: 0.9650, test_f1: 0.5358
 epoch: 4, train_loss: 0.9503, test_loss: 0.9284, test_f1: 0.5189
 epoch: 5, train_loss: 0.9310, test_loss: 0.9147, test_f1: 0.5024
 epoch: 6, train_loss: 0.9236, test_loss: 0.9110, test_f1: 0.5315
 epoch: 7, train_loss: 0.9144, test_loss: 0.8856, test_f1: 0.5209
 epoch: 8, train_loss: 0.9033, test_loss: 0.9123, test_f1: 0.5230
 epoch: 9, train_loss: 0.8938, test_loss: 0.8813, test_f1: 0.5495
 epoch: 10, train_loss: 0.8851, test_loss: 0.8562, test_f1: 0.5439
 epoch: 11, train_loss: 0.8627, test_loss: 0.8311, test_f1: 0.5418
 epoch: 12, train_loss: 0.8554, test_loss: 0.8235, test_f1: 0.5540
 epoch: 13, train_loss: 0.8523, test_loss: 0.7955, test_f1: 0.5825
 epoch: 14, train_loss: 0.8319, test_loss: 0.7657, test_f1: 0.5853
 epoch: 15, train_loss: 0.8300, test_loss: 0.7958, test_f1: 0.5662
 epoch: 16, train_loss: 0.8343, test_loss: 0.7707, test_f1: 0.6384
 epoch: 17, train_loss: 0.8152, test_loss: 0.8262, test_f1: 0.5731
 epoch: 18, train_loss: 0.8059, test_loss: 0.7723, test_f1: 0.5841
 epoch: 19, train_loss: 0.8164, test_loss: 0.7540, test_f1: 0.5924
 epoch: 20, train_loss: 0.7932, test_loss: 0.7635, test_f1: 0.6101
 epoch: 21, train_loss: 0.7891, test_loss: 0.7626, test_f1: 0.6120
 epoch: 22, train_loss: 0.7817, test_loss: 0.7552, test_f1: 0.6461
 epoch: 23, train_loss: 0.7972, test_loss: 0.7608, test_f1: 0.6554
 epoch: 24, train_loss: 0.7625, test_loss: 0.8260, test_f1: 0.5734
 epoch: 25, train_loss: 0.7620, test_loss: 0.7352, test_f1: 0.6404
 epoch: 26, train_loss: 0.7552, test_loss: 0.7483, test_f1: 0.6637
 epoch: 27, train_loss: 0.7468, test_loss: 0.7405, test_f1: 0.6240
 epoch: 28, train_loss: 0.7370, test_loss: 0.7255, test_f1: 0.6283
 epoch: 29, train_loss: 0.7611, test_loss: 0.7816, test_f1: 0.6575
 epoch: 30, train_loss: 0.7409, test_loss: 0.7098, test_f1: 0.6801
 epoch: 31, train_loss: 0.7306, test_loss: 0.7248, test_f1: 0.6391
 epoch: 32, train_loss: 0.7320, test_loss: 0.6882, test_f1: 0.6795
 epoch: 33, train_loss: 0.7436, test_loss: 0.6978, test_f1: 0.6707
 epoch: 34, train_loss: 0.7362, test_loss: 0.7151, test_f1: 0.6450
 epoch: 35, train_loss: 0.7121, test_loss: 0.7563, test_f1: 0.6471
 epoch: 36, train_loss: 0.7246, test_loss: 0.7151, test_f1: 0.6515
 epoch: 37, train_loss: 0.7079, test_loss: 0.7801, test_f1: 0.6575
 epoch: 38, train_loss: 0.6884, test_loss: 0.7432, test_f1: 0.6578
 epoch: 39, train_loss: 0.7007, test_loss: 0.7443, test_f1: 0.6533
 epoch: 40, train_loss: 0.6982, test_loss: 0.6898, test_f1: 0.6769
 epoch: 41, train_loss: 0.7107, test_loss: 0.6825, test_f1: 0.7018
 epoch: 42, train_loss: 0.6906, test_loss: 0.7197, test_f1: 0.6716
 epoch: 43, train_loss: 0.6885, test_loss: 0.7273, test_f1: 0.6551
 epoch: 44, train_loss: 0.6713, test_loss: 0.7262, test_f1: 0.6658
 epoch: 45, train_loss: 0.6662, test_loss: 0.6814, test_f1: 0.6908
 epoch: 46, train_loss: 0.6858, test_loss: 0.6816, test_f1: 0.6951
 epoch: 47, train_loss: 0.6705, test_loss: 0.6940, test_f1: 0.6452
 epoch: 48, train_loss: 0.6647, test_loss: 0.6990, test_f1: 0.6837
 epoch: 49, train_loss: 0.6645, test_loss: 0.6928, test_f1: 0.6960
 epoch: 50, train_loss: 0.6629, test_loss: 0.7074, test_f1: 0.6815
 epoch: 51, train_loss: 0.6365, test_loss: 0.6789, test_f1: 0.6906
 epoch: 52, train_loss: 0.6470, test_loss: 0.6771, test_f1: 0.7096
 epoch: 53, train_loss: 0.6290, test_loss: 0.6941, test_f1: 0.6808
 epoch: 54, train_loss: 0.6026, test_loss: 0.7249, test_f1: 0.6641
 epoch: 55, train_loss: 0.6004, test_loss: 0.7079, test_f1: 0.6901
 epoch: 56, train_loss: 0.6055, test_loss: 0.6939, test_f1: 0.6712
 epoch: 57, train_loss: 0.5961, test_loss: 0.7131, test_f1: 0.6698
 epoch: 58, train_loss: 0.6091, test_loss: 0.7062, test_f1: 0.6773
 epoch: 59, train_loss: 0.6092, test_loss: 0.6812, test_f1: 0.6913
 epoch: 60, train_loss: 0.5961, test_loss: 0.6904, test_f1: 0.6942
 epoch: 61, train_loss: 0.5966, test_loss: 0.7077, test_f1: 0.6872
 epoch: 62, train_loss: 0.5775, test_loss: 0.7320, test_f1: 0.6718
 epoch: 63, train_loss: 0.5822, test_loss: 0.6810, test_f1: 0.6831
 epoch: 64, train_loss: 0.5908, test_loss: 0.6773, test_f1: 0.6835
 epoch: 65, train_loss: 0.5865, test_loss: 0.7048, test_f1: 0.7091
 epoch: 66, train_loss: 0.5926, test_loss: 0.7280, test_f1: 0.6644
 epoch: 67, train_loss: 0.5748, test_loss: 0.7087, test_f1: 0.6817
 epoch: 68, train_loss: 0.5805, test_loss: 0.7330, test_f1: 0.6757
 epoch: 69, train_loss: 0.5915, test_loss: 0.7409, test_f1: 0.6694
 epoch: 70, train_loss: 0.5794, test_loss: 0.7061, test_f1: 0.6751
 epoch: 71, train_loss: 0.5629, test_loss: 0.6793, test_f1: 0.6704
 epoch: 72, train_loss: 0.5601, test_loss: 0.7210, test_f1: 0.7101
 epoch: 73, train_loss: 0.5646, test_loss: 0.7210, test_f1: 0.6819
 epoch: 74, train_loss: 0.5648, test_loss: 0.7296, test_f1: 0.6732
 epoch: 75, train_loss: 0.5731, test_loss: 0.6959, test_f1: 0.6930
 epoch: 76, train_loss: 0.5833, test_loss: 0.7172, test_f1: 0.6777
 epoch: 77, train_loss: 0.5633, test_loss: 0.7007, test_f1: 0.6791
 epoch: 78, train_loss: 0.5575, test_loss: 0.7206, test_f1: 0.6908
 epoch: 79, train_loss: 0.5555, test_loss: 0.6946, test_f1: 0.6954
 epoch: 80, train_loss: 0.5609, test_loss: 0.7073, test_f1: 0.6685
 epoch: 81, train_loss: 0.5574, test_loss: 0.6815, test_f1: 0.6990
 epoch: 82, train_loss: 0.5664, test_loss: 0.7281, test_f1: 0.6828
 epoch: 83, train_loss: 0.5557, test_loss: 0.7091, test_f1: 0.6919
 epoch: 84, train_loss: 0.5549, test_loss: 0.7073, test_f1: 0.6960
 epoch: 85, train_loss: 0.5598, test_loss: 0.7150, test_f1: 0.7048
 epoch: 86, train_loss: 0.5588, test_loss: 0.7074, test_f1: 0.7024
 epoch: 87, train_loss: 0.5222, test_loss: 0.7173, test_f1: 0.7308
 epoch: 88, train_loss: 0.5519, test_loss: 0.7712, test_f1: 0.6729
 epoch: 89, train_loss: 0.5420, test_loss: 0.7094, test_f1: 0.7021
 epoch: 90, train_loss: 0.5430, test_loss: 0.7550, test_f1: 0.7142
 epoch: 91, train_loss: 0.5415, test_loss: 0.7102, test_f1: 0.6996
 epoch: 92, train_loss: 0.5329, test_loss: 0.7542, test_f1: 0.6747
 epoch: 93, train_loss: 0.5392, test_loss: 0.7038, test_f1: 0.6843
 epoch: 94, train_loss: 0.5464, test_loss: 0.6994, test_f1: 0.6820
 epoch: 95, train_loss: 0.5303, test_loss: 0.7522, test_f1: 0.6783
 epoch: 96, train_loss: 0.5236, test_loss: 0.7121, test_f1: 0.6872
 epoch: 97, train_loss: 0.5405, test_loss: 0.7208, test_f1: 0.6736
 epoch: 98, train_loss: 0.5142, test_loss: 0.6965, test_f1: 0.6830
 epoch: 99, train_loss: 0.5338, test_loss: 0.7335, test_f1: 0.6963

Training completed in 1301.27 seconds
Best F1: 0.7308 at epoch 87
Mean F1 across iterations: 0.6997  0.0138
========================FINAL RESULTS================================
FEGIN weighted F1: 0.7308  0.0138
python main.py --data ltspice_examples --representation component_pin_net --model FEGIN --layers 5 --hiddens 32 --batch_size 32 --lr 0.001 --emb_size 128 --epochs 100 --save_appendix component_pin_net_L5_H32_BS32_LR0.001_E128 --no_val
-----



STDERR:
  File "main.py", line 370, in <module>
    main()
  File "main.py", line 254, in main
    dataset = dataset_class(
  File "/home/philip/projects/ltspice_examples_code_repo/Circuit-Completion-Using-GNNs/component_classification_with_link_prediction_head/evaluation/FEGIN/kernel/circuit_datasets.py", line 15, in __init__
    self.data, self.slices = torch.load(self.processed_paths[0])
  File "/home/philip/.local/lib/python3.8/site-packages/torch/serialization.py", line 1040, in load
    warnings.warn(
  File "/usr/lib/python3.8/warnings.py", line 109, in _showwarnmsg
    sw(msg.message, msg.category, msg.filename, msg.lineno,
  File "main.py", line 47, in warn_with_traceback
    traceback.print_stack(file=log)
/home/philip/projects/ltspice_examples_code_repo/Circuit-Completion-Using-GNNs/component_classification_with_link_prediction_head/evaluation/FEGIN/kernel/circuit_datasets.py:15: FutureWarning: You are using `torch.load` with `weights_only=False` (the current default value), which uses the default pickle module implicitly. It is possible to construct malicious pickle data which will execute arbitrary code during unpickling (See https://github.com/pytorch/pytorch/blob/main/SECURITY.md#untrusted-models for more details). In a future release, the default value for `weights_only` will be flipped to `True`. This limits the functions that could be executed during unpickling. Arbitrary objects will no longer be allowed to be loaded via this mode unless they are explicitly allowlisted by the user via `torch.serialization.add_safe_globals`. We recommend you start setting `weights_only=True` for any use case where you don't have full control of the loaded file. Please open an issue on GitHub for any issues related to this experimental feature.
  self.data, self.slices = torch.load(self.processed_paths[0])
