STDOUT:
Results will be saved in /home/philip/projects/ltspice_examples_code_repo/Circuit-Completion-Using-GNNs/component_classification_with_link_prediction_head/evaluation/FEGIN/results/model_FEGIN_dataset_ltspice_examples
Command line input: python main.py --data ltspice_examples --representation component_component --model FEGIN --layers 4 --hiddens 64 --batch_size 64 --lr 0.0001 --emb_size 250 --epochs 100 --save_appendix component_component_L4_H64_BS64_LR0.0001_E250 --no_val
 is saved.
-----
ltspice_examples - FEGIN
Using 4 layers, 64 hidden units, h = 2
Loading component_component representation dataset
ENTERED
Training FEGIN on component_component representation
Train: 3556, Test: 845
##################ITERATION #0 ****************************************
 epoch: 0, train_loss: 1.3625, test_loss: 1.3549, test_f1: 0.2274
 epoch: 1, train_loss: 1.3370, test_loss: 1.3304, test_f1: 0.2274
 epoch: 2, train_loss: 1.3118, test_loss: 1.2985, test_f1: 0.2274
 epoch: 3, train_loss: 1.2819, test_loss: 1.2713, test_f1: 0.2274
 epoch: 4, train_loss: 1.2660, test_loss: 1.2485, test_f1: 0.2274
 epoch: 5, train_loss: 1.2524, test_loss: 1.2284, test_f1: 0.2274
 epoch: 6, train_loss: 1.2355, test_loss: 1.2147, test_f1: 0.2443
 epoch: 7, train_loss: 1.2249, test_loss: 1.1990, test_f1: 0.2663
 epoch: 8, train_loss: 1.2132, test_loss: 1.1861, test_f1: 0.3268
 epoch: 9, train_loss: 1.2004, test_loss: 1.1697, test_f1: 0.3684
 epoch: 10, train_loss: 1.1883, test_loss: 1.1503, test_f1: 0.3718
 epoch: 11, train_loss: 1.1726, test_loss: 1.1384, test_f1: 0.3783
 epoch: 12, train_loss: 1.1572, test_loss: 1.1209, test_f1: 0.3859
 epoch: 13, train_loss: 1.1451, test_loss: 1.1074, test_f1: 0.3849
 epoch: 14, train_loss: 1.1341, test_loss: 1.0958, test_f1: 0.3808
 epoch: 15, train_loss: 1.1218, test_loss: 1.0800, test_f1: 0.3891
 epoch: 16, train_loss: 1.1103, test_loss: 1.0686, test_f1: 0.4563
 epoch: 17, train_loss: 1.1027, test_loss: 1.0654, test_f1: 0.4543
 epoch: 18, train_loss: 1.0887, test_loss: 1.0515, test_f1: 0.4617
 epoch: 19, train_loss: 1.0749, test_loss: 1.0549, test_f1: 0.4591
 epoch: 20, train_loss: 1.0661, test_loss: 1.0464, test_f1: 0.4645
 epoch: 21, train_loss: 1.0646, test_loss: 1.0490, test_f1: 0.4589
 epoch: 22, train_loss: 1.0579, test_loss: 1.0300, test_f1: 0.4663
 epoch: 23, train_loss: 1.0451, test_loss: 1.0214, test_f1: 0.4645
 epoch: 24, train_loss: 1.0390, test_loss: 1.0293, test_f1: 0.4657
 epoch: 25, train_loss: 1.0350, test_loss: 1.0349, test_f1: 0.4696
 epoch: 26, train_loss: 1.0172, test_loss: 1.0330, test_f1: 0.4760
 epoch: 27, train_loss: 1.0151, test_loss: 1.0433, test_f1: 0.4509
 epoch: 28, train_loss: 1.0144, test_loss: 1.0238, test_f1: 0.4584
 epoch: 29, train_loss: 1.0029, test_loss: 1.0084, test_f1: 0.4709
 epoch: 30, train_loss: 0.9930, test_loss: 1.0175, test_f1: 0.4723
 epoch: 31, train_loss: 0.9913, test_loss: 1.0260, test_f1: 0.4678
 epoch: 32, train_loss: 0.9918, test_loss: 1.0136, test_f1: 0.4686
 epoch: 33, train_loss: 0.9833, test_loss: 1.0343, test_f1: 0.4590
 epoch: 34, train_loss: 0.9784, test_loss: 1.0165, test_f1: 0.4575
 epoch: 35, train_loss: 0.9729, test_loss: 1.0086, test_f1: 0.4726
 epoch: 36, train_loss: 0.9704, test_loss: 0.9938, test_f1: 0.4828
 epoch: 37, train_loss: 0.9699, test_loss: 1.0009, test_f1: 0.4747
 epoch: 38, train_loss: 0.9614, test_loss: 1.0098, test_f1: 0.4719
 epoch: 39, train_loss: 0.9510, test_loss: 0.9889, test_f1: 0.4856
 epoch: 40, train_loss: 0.9616, test_loss: 1.0055, test_f1: 0.4601
 epoch: 41, train_loss: 0.9588, test_loss: 1.0008, test_f1: 0.4751
 epoch: 42, train_loss: 0.9536, test_loss: 1.0056, test_f1: 0.4676
 epoch: 43, train_loss: 0.9395, test_loss: 0.9989, test_f1: 0.4841
 epoch: 44, train_loss: 0.9387, test_loss: 0.9766, test_f1: 0.4858
 epoch: 45, train_loss: 0.9237, test_loss: 0.9976, test_f1: 0.4764
 epoch: 46, train_loss: 0.9381, test_loss: 1.0003, test_f1: 0.4567
 epoch: 47, train_loss: 0.9287, test_loss: 0.9938, test_f1: 0.4660
 epoch: 48, train_loss: 0.9275, test_loss: 0.9777, test_f1: 0.5027
 epoch: 49, train_loss: 0.9127, test_loss: 0.9964, test_f1: 0.4847
 epoch: 50, train_loss: 0.9172, test_loss: 0.9825, test_f1: 0.4669
 epoch: 51, train_loss: 0.9211, test_loss: 0.9825, test_f1: 0.4776
 epoch: 52, train_loss: 0.9042, test_loss: 0.9714, test_f1: 0.5002
 epoch: 53, train_loss: 0.9132, test_loss: 0.9864, test_f1: 0.4902
 epoch: 54, train_loss: 0.9077, test_loss: 0.9936, test_f1: 0.4830
 epoch: 55, train_loss: 0.8952, test_loss: 0.9888, test_f1: 0.4920
 epoch: 56, train_loss: 0.8966, test_loss: 0.9915, test_f1: 0.4836
 epoch: 57, train_loss: 0.8880, test_loss: 0.9865, test_f1: 0.4928
 epoch: 58, train_loss: 0.9043, test_loss: 0.9810, test_f1: 0.4819
 epoch: 59, train_loss: 0.8874, test_loss: 0.9864, test_f1: 0.4941
 epoch: 60, train_loss: 0.9024, test_loss: 0.9796, test_f1: 0.4810
 epoch: 61, train_loss: 0.8878, test_loss: 0.9905, test_f1: 0.4794
 epoch: 62, train_loss: 0.8861, test_loss: 0.9725, test_f1: 0.5063
 epoch: 63, train_loss: 0.8915, test_loss: 0.9723, test_f1: 0.5116
 epoch: 64, train_loss: 0.9029, test_loss: 0.9611, test_f1: 0.5032
 epoch: 65, train_loss: 0.8824, test_loss: 0.9872, test_f1: 0.4964
 epoch: 66, train_loss: 0.8926, test_loss: 0.9743, test_f1: 0.4979
 epoch: 67, train_loss: 0.8858, test_loss: 0.9835, test_f1: 0.4943
 epoch: 68, train_loss: 0.8767, test_loss: 0.9722, test_f1: 0.5082
 epoch: 69, train_loss: 0.8842, test_loss: 0.9772, test_f1: 0.4997
 epoch: 70, train_loss: 0.8659, test_loss: 1.0000, test_f1: 0.4668
 epoch: 71, train_loss: 0.8751, test_loss: 0.9912, test_f1: 0.4850
 epoch: 72, train_loss: 0.8708, test_loss: 0.9797, test_f1: 0.5035
 epoch: 73, train_loss: 0.8849, test_loss: 0.9805, test_f1: 0.4848
 epoch: 74, train_loss: 0.8709, test_loss: 0.9750, test_f1: 0.4982
 epoch: 75, train_loss: 0.8819, test_loss: 0.9697, test_f1: 0.5036
 epoch: 76, train_loss: 0.8641, test_loss: 0.9730, test_f1: 0.5034
 epoch: 77, train_loss: 0.8703, test_loss: 0.9814, test_f1: 0.4841
 epoch: 78, train_loss: 0.8718, test_loss: 0.9777, test_f1: 0.5056
 epoch: 79, train_loss: 0.8636, test_loss: 0.9760, test_f1: 0.4981
 epoch: 80, train_loss: 0.8641, test_loss: 0.9716, test_f1: 0.5077
 epoch: 81, train_loss: 0.8674, test_loss: 0.9971, test_f1: 0.5043
 epoch: 82, train_loss: 0.8628, test_loss: 0.9652, test_f1: 0.5122
 epoch: 83, train_loss: 0.8585, test_loss: 0.9607, test_f1: 0.5211
 epoch: 84, train_loss: 0.8571, test_loss: 0.9737, test_f1: 0.5093
 epoch: 85, train_loss: 0.8474, test_loss: 0.9811, test_f1: 0.5078
 epoch: 86, train_loss: 0.8458, test_loss: 0.9820, test_f1: 0.4996
 epoch: 87, train_loss: 0.8683, test_loss: 0.9621, test_f1: 0.5244
 epoch: 88, train_loss: 0.8533, test_loss: 0.9688, test_f1: 0.5116
 epoch: 89, train_loss: 0.8413, test_loss: 0.9915, test_f1: 0.5089
 epoch: 90, train_loss: 0.8625, test_loss: 0.9712, test_f1: 0.5208
 epoch: 91, train_loss: 0.8565, test_loss: 0.9808, test_f1: 0.5206
 epoch: 92, train_loss: 0.8417, test_loss: 0.9829, test_f1: 0.5049
 epoch: 93, train_loss: 0.8450, test_loss: 0.9591, test_f1: 0.5148
 epoch: 94, train_loss: 0.8480, test_loss: 0.9910, test_f1: 0.4919
 epoch: 95, train_loss: 0.8492, test_loss: 0.9857, test_f1: 0.5128
 epoch: 96, train_loss: 0.8615, test_loss: 0.9907, test_f1: 0.4857
 epoch: 97, train_loss: 0.8502, test_loss: 0.9707, test_f1: 0.5134
 epoch: 98, train_loss: 0.8466, test_loss: 0.9754, test_f1: 0.5208
 epoch: 99, train_loss: 0.8291, test_loss: 0.9793, test_f1: 0.5040
##################ITERATION #1 ****************************************
 epoch: 0, train_loss: 1.3518, test_loss: 1.3067, test_f1: 0.2465
 epoch: 1, train_loss: 1.2867, test_loss: 1.2576, test_f1: 0.2583
 epoch: 2, train_loss: 1.2566, test_loss: 1.2271, test_f1: 0.3037
 epoch: 3, train_loss: 1.2342, test_loss: 1.2044, test_f1: 0.3597
 epoch: 4, train_loss: 1.2150, test_loss: 1.1854, test_f1: 0.3894
 epoch: 5, train_loss: 1.1972, test_loss: 1.1679, test_f1: 0.4120
 epoch: 6, train_loss: 1.1909, test_loss: 1.1538, test_f1: 0.4162
 epoch: 7, train_loss: 1.1717, test_loss: 1.1354, test_f1: 0.4276
 epoch: 8, train_loss: 1.1651, test_loss: 1.1265, test_f1: 0.4384
 epoch: 9, train_loss: 1.1522, test_loss: 1.1165, test_f1: 0.4317
 epoch: 10, train_loss: 1.1433, test_loss: 1.1086, test_f1: 0.4393
 epoch: 11, train_loss: 1.1292, test_loss: 1.1046, test_f1: 0.4434
 epoch: 12, train_loss: 1.1199, test_loss: 1.0954, test_f1: 0.4479
 epoch: 13, train_loss: 1.1116, test_loss: 1.0880, test_f1: 0.4485
 epoch: 14, train_loss: 1.1039, test_loss: 1.0814, test_f1: 0.4563
 epoch: 15, train_loss: 1.0970, test_loss: 1.0865, test_f1: 0.4564
 epoch: 16, train_loss: 1.0902, test_loss: 1.0847, test_f1: 0.4491
 epoch: 17, train_loss: 1.0834, test_loss: 1.0750, test_f1: 0.4432
 epoch: 18, train_loss: 1.0792, test_loss: 1.0922, test_f1: 0.4375
 epoch: 19, train_loss: 1.0750, test_loss: 1.0814, test_f1: 0.4476
 epoch: 20, train_loss: 1.0607, test_loss: 1.0605, test_f1: 0.4587
 epoch: 21, train_loss: 1.0605, test_loss: 1.0641, test_f1: 0.4557
 epoch: 22, train_loss: 1.0467, test_loss: 1.0520, test_f1: 0.4569
 epoch: 23, train_loss: 1.0442, test_loss: 1.0385, test_f1: 0.4534
 epoch: 24, train_loss: 1.0374, test_loss: 1.0558, test_f1: 0.4595
 epoch: 25, train_loss: 1.0388, test_loss: 1.0429, test_f1: 0.4620
 epoch: 26, train_loss: 1.0337, test_loss: 1.0496, test_f1: 0.4583
 epoch: 27, train_loss: 1.0172, test_loss: 1.0491, test_f1: 0.4610
 epoch: 28, train_loss: 1.0126, test_loss: 1.0528, test_f1: 0.4668
 epoch: 29, train_loss: 1.0126, test_loss: 1.0262, test_f1: 0.4658
 epoch: 30, train_loss: 1.0023, test_loss: 1.0358, test_f1: 0.4659
 epoch: 31, train_loss: 1.0057, test_loss: 1.0079, test_f1: 0.4834
 epoch: 32, train_loss: 0.9958, test_loss: 1.0169, test_f1: 0.4715
 epoch: 33, train_loss: 0.9787, test_loss: 1.0231, test_f1: 0.4673
 epoch: 34, train_loss: 0.9918, test_loss: 1.0393, test_f1: 0.4573
 epoch: 35, train_loss: 0.9843, test_loss: 1.0388, test_f1: 0.4595
 epoch: 36, train_loss: 0.9689, test_loss: 1.0407, test_f1: 0.4620
 epoch: 37, train_loss: 0.9557, test_loss: 1.0120, test_f1: 0.4641
 epoch: 38, train_loss: 0.9576, test_loss: 1.0321, test_f1: 0.4590
 epoch: 39, train_loss: 0.9565, test_loss: 1.0178, test_f1: 0.4632
 epoch: 40, train_loss: 0.9400, test_loss: 1.0147, test_f1: 0.4720
 epoch: 41, train_loss: 0.9423, test_loss: 1.0281, test_f1: 0.4317
 epoch: 42, train_loss: 0.9373, test_loss: 1.0012, test_f1: 0.4895
 epoch: 43, train_loss: 0.9376, test_loss: 1.0251, test_f1: 0.4774
 epoch: 44, train_loss: 0.9274, test_loss: 1.0002, test_f1: 0.4843
 epoch: 45, train_loss: 0.9376, test_loss: 0.9984, test_f1: 0.4667
 epoch: 46, train_loss: 0.9221, test_loss: 1.0109, test_f1: 0.4815
 epoch: 47, train_loss: 0.9256, test_loss: 1.0198, test_f1: 0.4688
 epoch: 48, train_loss: 0.9181, test_loss: 1.0461, test_f1: 0.4646
 epoch: 49, train_loss: 0.9031, test_loss: 0.9980, test_f1: 0.4698
 epoch: 50, train_loss: 0.8911, test_loss: 1.0536, test_f1: 0.4679
 epoch: 51, train_loss: 0.8798, test_loss: 1.0550, test_f1: 0.4654
 epoch: 52, train_loss: 0.8986, test_loss: 1.0485, test_f1: 0.4671
 epoch: 53, train_loss: 0.8852, test_loss: 1.0467, test_f1: 0.4616
 epoch: 54, train_loss: 0.8734, test_loss: 1.0520, test_f1: 0.4687
 epoch: 55, train_loss: 0.8821, test_loss: 1.0344, test_f1: 0.4745
 epoch: 56, train_loss: 0.8739, test_loss: 1.0342, test_f1: 0.4985
 epoch: 57, train_loss: 0.8718, test_loss: 1.0312, test_f1: 0.4931
 epoch: 58, train_loss: 0.8750, test_loss: 1.0271, test_f1: 0.4946
 epoch: 59, train_loss: 0.8773, test_loss: 1.0363, test_f1: 0.4900
 epoch: 60, train_loss: 0.8741, test_loss: 1.0386, test_f1: 0.4718
 epoch: 61, train_loss: 0.8641, test_loss: 1.0329, test_f1: 0.4700
 epoch: 62, train_loss: 0.8638, test_loss: 1.0240, test_f1: 0.5009
 epoch: 63, train_loss: 0.8518, test_loss: 1.0320, test_f1: 0.4896
 epoch: 64, train_loss: 0.8640, test_loss: 1.0461, test_f1: 0.4789
 epoch: 65, train_loss: 0.8552, test_loss: 1.0350, test_f1: 0.5058
 epoch: 66, train_loss: 0.8502, test_loss: 1.0474, test_f1: 0.4848
 epoch: 67, train_loss: 0.8527, test_loss: 1.0302, test_f1: 0.4836
 epoch: 68, train_loss: 0.8481, test_loss: 1.0431, test_f1: 0.4979
 epoch: 69, train_loss: 0.8484, test_loss: 1.0479, test_f1: 0.4766
 epoch: 70, train_loss: 0.8391, test_loss: 1.0566, test_f1: 0.4713
 epoch: 71, train_loss: 0.8552, test_loss: 1.0615, test_f1: 0.4899
 epoch: 72, train_loss: 0.8368, test_loss: 1.0294, test_f1: 0.5051
 epoch: 73, train_loss: 0.8368, test_loss: 1.0403, test_f1: 0.4930
 epoch: 74, train_loss: 0.8375, test_loss: 1.0492, test_f1: 0.4955
 epoch: 75, train_loss: 0.8312, test_loss: 1.0326, test_f1: 0.5030
 epoch: 76, train_loss: 0.8233, test_loss: 1.0524, test_f1: 0.4947
 epoch: 77, train_loss: 0.8311, test_loss: 1.0678, test_f1: 0.4720
 epoch: 78, train_loss: 0.8164, test_loss: 1.0597, test_f1: 0.4925
 epoch: 79, train_loss: 0.8170, test_loss: 1.0620, test_f1: 0.5012
 epoch: 80, train_loss: 0.8330, test_loss: 1.0474, test_f1: 0.4948
 epoch: 81, train_loss: 0.8116, test_loss: 1.1069, test_f1: 0.4775
 epoch: 82, train_loss: 0.8206, test_loss: 1.0731, test_f1: 0.4927
 epoch: 83, train_loss: 0.8155, test_loss: 1.0702, test_f1: 0.5031
 epoch: 84, train_loss: 0.8224, test_loss: 1.0679, test_f1: 0.4892
 epoch: 85, train_loss: 0.8031, test_loss: 1.0596, test_f1: 0.4998
 epoch: 86, train_loss: 0.8067, test_loss: 1.0597, test_f1: 0.4792
 epoch: 87, train_loss: 0.8104, test_loss: 1.0919, test_f1: 0.4991
 epoch: 88, train_loss: 0.8280, test_loss: 1.0737, test_f1: 0.5007
 epoch: 89, train_loss: 0.8079, test_loss: 1.0854, test_f1: 0.4943
 epoch: 90, train_loss: 0.8137, test_loss: 1.0899, test_f1: 0.4803
 epoch: 91, train_loss: 0.8015, test_loss: 1.0841, test_f1: 0.5057
 epoch: 92, train_loss: 0.7912, test_loss: 1.0662, test_f1: 0.5025
 epoch: 93, train_loss: 0.8086, test_loss: 1.0820, test_f1: 0.4915
 epoch: 94, train_loss: 0.8026, test_loss: 1.0973, test_f1: 0.4884
 epoch: 95, train_loss: 0.8026, test_loss: 1.0868, test_f1: 0.4949
 epoch: 96, train_loss: 0.7913, test_loss: 1.1095, test_f1: 0.5028
 epoch: 97, train_loss: 0.7940, test_loss: 1.1153, test_f1: 0.4953
 epoch: 98, train_loss: 0.7972, test_loss: 1.0964, test_f1: 0.5068
 epoch: 99, train_loss: 0.7944, test_loss: 1.1088, test_f1: 0.4914
##################ITERATION #2 ****************************************
 epoch: 0, train_loss: 1.3185, test_loss: 1.2990, test_f1: 0.3019
 epoch: 1, train_loss: 1.2585, test_loss: 1.2361, test_f1: 0.3189
 epoch: 2, train_loss: 1.2358, test_loss: 1.2130, test_f1: 0.3571
 epoch: 3, train_loss: 1.2197, test_loss: 1.1946, test_f1: 0.3795
 epoch: 4, train_loss: 1.2100, test_loss: 1.1767, test_f1: 0.3953
 epoch: 5, train_loss: 1.1994, test_loss: 1.1638, test_f1: 0.3964
 epoch: 6, train_loss: 1.1852, test_loss: 1.1521, test_f1: 0.4286
 epoch: 7, train_loss: 1.1717, test_loss: 1.1416, test_f1: 0.4171
 epoch: 8, train_loss: 1.1576, test_loss: 1.1276, test_f1: 0.4276
 epoch: 9, train_loss: 1.1514, test_loss: 1.1165, test_f1: 0.4203
 epoch: 10, train_loss: 1.1374, test_loss: 1.1081, test_f1: 0.4236
 epoch: 11, train_loss: 1.1229, test_loss: 1.0943, test_f1: 0.4218
 epoch: 12, train_loss: 1.1182, test_loss: 1.0854, test_f1: 0.4415
 epoch: 13, train_loss: 1.1043, test_loss: 1.0749, test_f1: 0.4162
 epoch: 14, train_loss: 1.0982, test_loss: 1.0640, test_f1: 0.4352
 epoch: 15, train_loss: 1.0881, test_loss: 1.0598, test_f1: 0.4166
 epoch: 16, train_loss: 1.0808, test_loss: 1.0437, test_f1: 0.4357
 epoch: 17, train_loss: 1.0687, test_loss: 1.0441, test_f1: 0.4377
 epoch: 18, train_loss: 1.0619, test_loss: 1.0270, test_f1: 0.4509
 epoch: 19, train_loss: 1.0492, test_loss: 1.0250, test_f1: 0.4341
 epoch: 20, train_loss: 1.0468, test_loss: 1.0241, test_f1: 0.4534
 epoch: 21, train_loss: 1.0374, test_loss: 1.0184, test_f1: 0.4358
 epoch: 22, train_loss: 1.0325, test_loss: 1.0099, test_f1: 0.4351
 epoch: 23, train_loss: 1.0144, test_loss: 1.0048, test_f1: 0.4411
 epoch: 24, train_loss: 1.0110, test_loss: 0.9963, test_f1: 0.4540
 epoch: 25, train_loss: 1.0060, test_loss: 1.0015, test_f1: 0.4414
 epoch: 26, train_loss: 0.9998, test_loss: 0.9876, test_f1: 0.4509
 epoch: 27, train_loss: 0.9913, test_loss: 0.9950, test_f1: 0.4654
 epoch: 28, train_loss: 0.9833, test_loss: 0.9966, test_f1: 0.4313
 epoch: 29, train_loss: 0.9740, test_loss: 0.9858, test_f1: 0.4399
 epoch: 30, train_loss: 0.9723, test_loss: 0.9863, test_f1: 0.4467
 epoch: 31, train_loss: 0.9648, test_loss: 0.9798, test_f1: 0.4429
 epoch: 32, train_loss: 0.9542, test_loss: 0.9934, test_f1: 0.4558
 epoch: 33, train_loss: 0.9562, test_loss: 0.9718, test_f1: 0.4592
 epoch: 34, train_loss: 0.9497, test_loss: 0.9812, test_f1: 0.4509
 epoch: 35, train_loss: 0.9369, test_loss: 0.9816, test_f1: 0.4651
 epoch: 36, train_loss: 0.9409, test_loss: 0.9714, test_f1: 0.4639
 epoch: 37, train_loss: 0.9347, test_loss: 0.9780, test_f1: 0.4515
 epoch: 38, train_loss: 0.9346, test_loss: 0.9627, test_f1: 0.4735
 epoch: 39, train_loss: 0.9311, test_loss: 0.9650, test_f1: 0.4665
 epoch: 40, train_loss: 0.9193, test_loss: 0.9741, test_f1: 0.4690
 epoch: 41, train_loss: 0.9141, test_loss: 0.9656, test_f1: 0.4815
 epoch: 42, train_loss: 0.9125, test_loss: 0.9630, test_f1: 0.4859
 epoch: 43, train_loss: 0.9029, test_loss: 0.9634, test_f1: 0.4952
 epoch: 44, train_loss: 0.8961, test_loss: 0.9621, test_f1: 0.4962
 epoch: 45, train_loss: 0.8988, test_loss: 0.9670, test_f1: 0.4937
 epoch: 46, train_loss: 0.9021, test_loss: 0.9681, test_f1: 0.4755
 epoch: 47, train_loss: 0.8895, test_loss: 0.9565, test_f1: 0.4967
 epoch: 48, train_loss: 0.8850, test_loss: 0.9837, test_f1: 0.5174
 epoch: 49, train_loss: 0.8807, test_loss: 0.9550, test_f1: 0.4884
 epoch: 50, train_loss: 0.8724, test_loss: 0.9497, test_f1: 0.5082
 epoch: 51, train_loss: 0.8643, test_loss: 0.9505, test_f1: 0.5103
 epoch: 52, train_loss: 0.8673, test_loss: 0.9368, test_f1: 0.5014
 epoch: 53, train_loss: 0.8593, test_loss: 0.9408, test_f1: 0.5054
 epoch: 54, train_loss: 0.8657, test_loss: 0.9560, test_f1: 0.5034
 epoch: 55, train_loss: 0.8540, test_loss: 0.9592, test_f1: 0.5091
 epoch: 56, train_loss: 0.8643, test_loss: 0.9538, test_f1: 0.5071
 epoch: 57, train_loss: 0.8537, test_loss: 0.9767, test_f1: 0.4889
 epoch: 58, train_loss: 0.8671, test_loss: 0.9623, test_f1: 0.4909
 epoch: 59, train_loss: 0.8480, test_loss: 0.9609, test_f1: 0.4996
 epoch: 60, train_loss: 0.8525, test_loss: 0.9588, test_f1: 0.5007
 epoch: 61, train_loss: 0.8441, test_loss: 0.9584, test_f1: 0.4971
 epoch: 62, train_loss: 0.8483, test_loss: 0.9736, test_f1: 0.4886
 epoch: 63, train_loss: 0.8428, test_loss: 0.9590, test_f1: 0.4923
 epoch: 64, train_loss: 0.8394, test_loss: 0.9757, test_f1: 0.4880
 epoch: 65, train_loss: 0.8378, test_loss: 0.9570, test_f1: 0.5240
 epoch: 66, train_loss: 0.8263, test_loss: 0.9709, test_f1: 0.5061
 epoch: 67, train_loss: 0.8308, test_loss: 0.9712, test_f1: 0.5111
 epoch: 68, train_loss: 0.8320, test_loss: 0.9710, test_f1: 0.5120
 epoch: 69, train_loss: 0.8294, test_loss: 0.9706, test_f1: 0.5150
 epoch: 70, train_loss: 0.8258, test_loss: 0.9774, test_f1: 0.5112
 epoch: 71, train_loss: 0.8325, test_loss: 0.9739, test_f1: 0.4979
 epoch: 72, train_loss: 0.8175, test_loss: 0.9544, test_f1: 0.5154
 epoch: 73, train_loss: 0.8149, test_loss: 0.9798, test_f1: 0.5029
 epoch: 74, train_loss: 0.8227, test_loss: 0.9711, test_f1: 0.4982
 epoch: 75, train_loss: 0.8208, test_loss: 0.9684, test_f1: 0.5077
 epoch: 76, train_loss: 0.8234, test_loss: 0.9733, test_f1: 0.5271
 epoch: 77, train_loss: 0.8221, test_loss: 0.9813, test_f1: 0.5160
 epoch: 78, train_loss: 0.8140, test_loss: 0.9740, test_f1: 0.5163
 epoch: 79, train_loss: 0.8092, test_loss: 0.9653, test_f1: 0.5211
 epoch: 80, train_loss: 0.8082, test_loss: 0.9907, test_f1: 0.5078
 epoch: 81, train_loss: 0.8115, test_loss: 0.9822, test_f1: 0.5188
 epoch: 82, train_loss: 0.8168, test_loss: 0.9844, test_f1: 0.5187
 epoch: 83, train_loss: 0.8159, test_loss: 0.9921, test_f1: 0.5109
 epoch: 84, train_loss: 0.8124, test_loss: 0.9778, test_f1: 0.5142
 epoch: 85, train_loss: 0.8098, test_loss: 0.9786, test_f1: 0.5157
 epoch: 86, train_loss: 0.8078, test_loss: 0.9741, test_f1: 0.5223
 epoch: 87, train_loss: 0.8003, test_loss: 0.9785, test_f1: 0.5193
 epoch: 88, train_loss: 0.7974, test_loss: 0.9954, test_f1: 0.5475
 epoch: 89, train_loss: 0.7993, test_loss: 0.9924, test_f1: 0.5342
 epoch: 90, train_loss: 0.7992, test_loss: 1.0024, test_f1: 0.5062
 epoch: 91, train_loss: 0.8106, test_loss: 1.0037, test_f1: 0.5102
 epoch: 92, train_loss: 0.7966, test_loss: 1.0184, test_f1: 0.5115
 epoch: 93, train_loss: 0.7973, test_loss: 1.0115, test_f1: 0.5118
 epoch: 94, train_loss: 0.7960, test_loss: 1.0142, test_f1: 0.5115
 epoch: 95, train_loss: 0.7853, test_loss: 1.0051, test_f1: 0.5199
 epoch: 96, train_loss: 0.8112, test_loss: 1.0005, test_f1: 0.5213
 epoch: 97, train_loss: 0.7860, test_loss: 1.0001, test_f1: 0.5278
 epoch: 98, train_loss: 0.7880, test_loss: 1.0164, test_f1: 0.5198
 epoch: 99, train_loss: 0.7886, test_loss: 0.9964, test_f1: 0.5383
##################ITERATION #3 ****************************************
 epoch: 0, train_loss: 1.3101, test_loss: 1.2567, test_f1: 0.2865
 epoch: 1, train_loss: 1.2512, test_loss: 1.2166, test_f1: 0.3259
 epoch: 2, train_loss: 1.2321, test_loss: 1.1979, test_f1: 0.3673
 epoch: 3, train_loss: 1.2122, test_loss: 1.1849, test_f1: 0.3877
 epoch: 4, train_loss: 1.2028, test_loss: 1.1674, test_f1: 0.3925
 epoch: 5, train_loss: 1.1890, test_loss: 1.1523, test_f1: 0.4043
 epoch: 6, train_loss: 1.1739, test_loss: 1.1385, test_f1: 0.4223
 epoch: 7, train_loss: 1.1629, test_loss: 1.1344, test_f1: 0.4117
 epoch: 8, train_loss: 1.1559, test_loss: 1.1230, test_f1: 0.4252
 epoch: 9, train_loss: 1.1426, test_loss: 1.1218, test_f1: 0.4311
 epoch: 10, train_loss: 1.1427, test_loss: 1.1126, test_f1: 0.4397
 epoch: 11, train_loss: 1.1270, test_loss: 1.1072, test_f1: 0.4286
 epoch: 12, train_loss: 1.1186, test_loss: 1.0986, test_f1: 0.4321
 epoch: 13, train_loss: 1.1123, test_loss: 1.0933, test_f1: 0.4293
 epoch: 14, train_loss: 1.0999, test_loss: 1.0865, test_f1: 0.4391
 epoch: 15, train_loss: 1.0955, test_loss: 1.0764, test_f1: 0.4367
 epoch: 16, train_loss: 1.0852, test_loss: 1.0685, test_f1: 0.4323
 epoch: 17, train_loss: 1.0914, test_loss: 1.0685, test_f1: 0.4398
 epoch: 18, train_loss: 1.0655, test_loss: 1.0707, test_f1: 0.4473
 epoch: 19, train_loss: 1.0655, test_loss: 1.0648, test_f1: 0.4553
 epoch: 20, train_loss: 1.0633, test_loss: 1.0548, test_f1: 0.4460
 epoch: 21, train_loss: 1.0598, test_loss: 1.0646, test_f1: 0.4362
 epoch: 22, train_loss: 1.0466, test_loss: 1.0580, test_f1: 0.4567
 epoch: 23, train_loss: 1.0474, test_loss: 1.0502, test_f1: 0.4617
 epoch: 24, train_loss: 1.0410, test_loss: 1.0422, test_f1: 0.4692
 epoch: 25, train_loss: 1.0313, test_loss: 1.0475, test_f1: 0.4473
 epoch: 26, train_loss: 1.0307, test_loss: 1.0321, test_f1: 0.4689
 epoch: 27, train_loss: 1.0277, test_loss: 1.0329, test_f1: 0.4648
 epoch: 28, train_loss: 1.0200, test_loss: 1.0183, test_f1: 0.4695
 epoch: 29, train_loss: 1.0160, test_loss: 1.0285, test_f1: 0.4660
 epoch: 30, train_loss: 1.0057, test_loss: 1.0173, test_f1: 0.4731
 epoch: 31, train_loss: 1.0004, test_loss: 1.0131, test_f1: 0.4642
 epoch: 32, train_loss: 0.9919, test_loss: 1.0167, test_f1: 0.4784
 epoch: 33, train_loss: 0.9907, test_loss: 1.0178, test_f1: 0.4700
 epoch: 34, train_loss: 0.9791, test_loss: 1.0205, test_f1: 0.4792
 epoch: 35, train_loss: 0.9779, test_loss: 1.0252, test_f1: 0.4716
 epoch: 36, train_loss: 0.9723, test_loss: 1.0232, test_f1: 0.4648
 epoch: 37, train_loss: 0.9680, test_loss: 1.0116, test_f1: 0.4716
 epoch: 38, train_loss: 0.9642, test_loss: 1.0188, test_f1: 0.4795
 epoch: 39, train_loss: 0.9548, test_loss: 1.0108, test_f1: 0.4895
 epoch: 40, train_loss: 0.9437, test_loss: 1.0102, test_f1: 0.4877
 epoch: 41, train_loss: 0.9479, test_loss: 1.0250, test_f1: 0.4729
 epoch: 42, train_loss: 0.9488, test_loss: 0.9984, test_f1: 0.4897
 epoch: 43, train_loss: 0.9416, test_loss: 1.0300, test_f1: 0.4693
 epoch: 44, train_loss: 0.9376, test_loss: 1.0181, test_f1: 0.4794
 epoch: 45, train_loss: 0.9287, test_loss: 1.0121, test_f1: 0.4827
 epoch: 46, train_loss: 0.9202, test_loss: 1.0354, test_f1: 0.4659
 epoch: 47, train_loss: 0.9140, test_loss: 1.0148, test_f1: 0.4662
 epoch: 48, train_loss: 0.9224, test_loss: 1.0193, test_f1: 0.4801
 epoch: 49, train_loss: 0.9183, test_loss: 1.0077, test_f1: 0.4784
 epoch: 50, train_loss: 0.9097, test_loss: 1.0143, test_f1: 0.4686
 epoch: 51, train_loss: 0.9033, test_loss: 1.0234, test_f1: 0.4761
 epoch: 52, train_loss: 0.8946, test_loss: 1.0151, test_f1: 0.4828
 epoch: 53, train_loss: 0.8917, test_loss: 1.0185, test_f1: 0.4906
 epoch: 54, train_loss: 0.9041, test_loss: 1.0151, test_f1: 0.4835
 epoch: 55, train_loss: 0.8787, test_loss: 1.0255, test_f1: 0.4834
 epoch: 56, train_loss: 0.8831, test_loss: 1.0181, test_f1: 0.4821
 epoch: 57, train_loss: 0.8855, test_loss: 1.0144, test_f1: 0.4893
 epoch: 58, train_loss: 0.8772, test_loss: 1.0274, test_f1: 0.4769
 epoch: 59, train_loss: 0.8780, test_loss: 1.0164, test_f1: 0.4934
 epoch: 60, train_loss: 0.8753, test_loss: 1.0200, test_f1: 0.4830
 epoch: 61, train_loss: 0.8774, test_loss: 1.0128, test_f1: 0.4878
 epoch: 62, train_loss: 0.8667, test_loss: 1.0252, test_f1: 0.4822
 epoch: 63, train_loss: 0.8598, test_loss: 1.0026, test_f1: 0.4912
 epoch: 64, train_loss: 0.8752, test_loss: 1.0248, test_f1: 0.5039
 epoch: 65, train_loss: 0.8819, test_loss: 1.0238, test_f1: 0.4762
 epoch: 66, train_loss: 0.8679, test_loss: 1.0300, test_f1: 0.4878
 epoch: 67, train_loss: 0.8605, test_loss: 1.0204, test_f1: 0.4874
 epoch: 68, train_loss: 0.8617, test_loss: 1.0301, test_f1: 0.4987
 epoch: 69, train_loss: 0.8638, test_loss: 1.0341, test_f1: 0.4926
 epoch: 70, train_loss: 0.8532, test_loss: 1.0291, test_f1: 0.4954
 epoch: 71, train_loss: 0.8632, test_loss: 1.0334, test_f1: 0.4924
 epoch: 72, train_loss: 0.8544, test_loss: 1.0336, test_f1: 0.4951
 epoch: 73, train_loss: 0.8707, test_loss: 1.0194, test_f1: 0.4900
 epoch: 74, train_loss: 0.8520, test_loss: 1.0443, test_f1: 0.4851
 epoch: 75, train_loss: 0.8504, test_loss: 1.0336, test_f1: 0.5061
 epoch: 76, train_loss: 0.8531, test_loss: 1.0267, test_f1: 0.5005
 epoch: 77, train_loss: 0.8439, test_loss: 1.0175, test_f1: 0.5122
 epoch: 78, train_loss: 0.8470, test_loss: 1.0230, test_f1: 0.4991
 epoch: 79, train_loss: 0.8496, test_loss: 1.0562, test_f1: 0.4951
 epoch: 80, train_loss: 0.8373, test_loss: 1.0302, test_f1: 0.5094
 epoch: 81, train_loss: 0.8391, test_loss: 1.0312, test_f1: 0.5087
 epoch: 82, train_loss: 0.8349, test_loss: 1.0543, test_f1: 0.5097
 epoch: 83, train_loss: 0.8318, test_loss: 1.0510, test_f1: 0.4954
 epoch: 84, train_loss: 0.8451, test_loss: 1.0401, test_f1: 0.5069
 epoch: 85, train_loss: 0.8222, test_loss: 1.0441, test_f1: 0.5141
 epoch: 86, train_loss: 0.8358, test_loss: 1.0405, test_f1: 0.5142
 epoch: 87, train_loss: 0.8362, test_loss: 1.0265, test_f1: 0.5070
 epoch: 88, train_loss: 0.8261, test_loss: 1.0536, test_f1: 0.5182
 epoch: 89, train_loss: 0.8350, test_loss: 1.0338, test_f1: 0.5156
 epoch: 90, train_loss: 0.8263, test_loss: 1.0481, test_f1: 0.5066
 epoch: 91, train_loss: 0.8165, test_loss: 1.0654, test_f1: 0.5044
 epoch: 92, train_loss: 0.8325, test_loss: 1.0697, test_f1: 0.5060
 epoch: 93, train_loss: 0.8171, test_loss: 1.0534, test_f1: 0.5106
 epoch: 94, train_loss: 0.8181, test_loss: 1.0532, test_f1: 0.4996
 epoch: 95, train_loss: 0.8081, test_loss: 1.0730, test_f1: 0.5131
 epoch: 96, train_loss: 0.8140, test_loss: 1.0534, test_f1: 0.5219
 epoch: 97, train_loss: 0.8075, test_loss: 1.0624, test_f1: 0.5151
 epoch: 98, train_loss: 0.8065, test_loss: 1.0493, test_f1: 0.5192
 epoch: 99, train_loss: 0.8116, test_loss: 1.0490, test_f1: 0.5135
##################ITERATION #4 ****************************************
 epoch: 0, train_loss: 1.3107, test_loss: 1.2659, test_f1: 0.3150
 epoch: 1, train_loss: 1.2474, test_loss: 1.2223, test_f1: 0.3538
 epoch: 2, train_loss: 1.2326, test_loss: 1.2075, test_f1: 0.3688
 epoch: 3, train_loss: 1.2121, test_loss: 1.1897, test_f1: 0.4048
 epoch: 4, train_loss: 1.2078, test_loss: 1.1734, test_f1: 0.4177
 epoch: 5, train_loss: 1.1948, test_loss: 1.1607, test_f1: 0.4193
 epoch: 6, train_loss: 1.1944, test_loss: 1.1594, test_f1: 0.4133
 epoch: 7, train_loss: 1.1750, test_loss: 1.1490, test_f1: 0.4227
 epoch: 8, train_loss: 1.1688, test_loss: 1.1429, test_f1: 0.4142
 epoch: 9, train_loss: 1.1487, test_loss: 1.1294, test_f1: 0.4169
 epoch: 10, train_loss: 1.1596, test_loss: 1.1257, test_f1: 0.4133
 epoch: 11, train_loss: 1.1424, test_loss: 1.1245, test_f1: 0.4128
 epoch: 12, train_loss: 1.1356, test_loss: 1.1136, test_f1: 0.4037
 epoch: 13, train_loss: 1.1240, test_loss: 1.1024, test_f1: 0.4247
 epoch: 14, train_loss: 1.1147, test_loss: 1.0947, test_f1: 0.4358
 epoch: 15, train_loss: 1.0992, test_loss: 1.0889, test_f1: 0.4272
 epoch: 16, train_loss: 1.1106, test_loss: 1.0820, test_f1: 0.4331
 epoch: 17, train_loss: 1.1022, test_loss: 1.0657, test_f1: 0.4355
 epoch: 18, train_loss: 1.0895, test_loss: 1.0443, test_f1: 0.4407
 epoch: 19, train_loss: 1.0804, test_loss: 1.0456, test_f1: 0.4530
 epoch: 20, train_loss: 1.0729, test_loss: 1.0388, test_f1: 0.4804
 epoch: 21, train_loss: 1.0667, test_loss: 1.0341, test_f1: 0.4496
 epoch: 22, train_loss: 1.0553, test_loss: 1.0331, test_f1: 0.4551
 epoch: 23, train_loss: 1.0526, test_loss: 1.0265, test_f1: 0.4565
 epoch: 24, train_loss: 1.0474, test_loss: 1.0152, test_f1: 0.4659
 epoch: 25, train_loss: 1.0392, test_loss: 1.0253, test_f1: 0.4610
 epoch: 26, train_loss: 1.0360, test_loss: 1.0180, test_f1: 0.4538
 epoch: 27, train_loss: 1.0171, test_loss: 1.0009, test_f1: 0.4947
 epoch: 28, train_loss: 1.0188, test_loss: 1.0142, test_f1: 0.4656
 epoch: 29, train_loss: 1.0126, test_loss: 1.0085, test_f1: 0.4679
 epoch: 30, train_loss: 1.0123, test_loss: 1.0008, test_f1: 0.4581
 epoch: 31, train_loss: 1.0096, test_loss: 0.9927, test_f1: 0.4640
 epoch: 32, train_loss: 1.0028, test_loss: 1.0080, test_f1: 0.4489
 epoch: 33, train_loss: 1.0038, test_loss: 1.0024, test_f1: 0.4764
 epoch: 34, train_loss: 1.0049, test_loss: 0.9964, test_f1: 0.4535
 epoch: 35, train_loss: 0.9924, test_loss: 0.9890, test_f1: 0.4667
 epoch: 36, train_loss: 0.9772, test_loss: 0.9843, test_f1: 0.4640
 epoch: 37, train_loss: 0.9778, test_loss: 0.9917, test_f1: 0.4681
 epoch: 38, train_loss: 0.9726, test_loss: 0.9842, test_f1: 0.4793
 epoch: 39, train_loss: 0.9607, test_loss: 0.9944, test_f1: 0.4715
 epoch: 40, train_loss: 0.9634, test_loss: 0.9950, test_f1: 0.4469
 epoch: 41, train_loss: 0.9560, test_loss: 0.9905, test_f1: 0.4697
 epoch: 42, train_loss: 0.9535, test_loss: 0.9954, test_f1: 0.4729
 epoch: 43, train_loss: 0.9610, test_loss: 0.9941, test_f1: 0.4676
 epoch: 44, train_loss: 0.9476, test_loss: 1.0008, test_f1: 0.4622
 epoch: 45, train_loss: 0.9498, test_loss: 0.9824, test_f1: 0.4744
 epoch: 46, train_loss: 0.9418, test_loss: 0.9756, test_f1: 0.4780
 epoch: 47, train_loss: 0.9394, test_loss: 0.9810, test_f1: 0.4785
 epoch: 48, train_loss: 0.9428, test_loss: 0.9811, test_f1: 0.4946
 epoch: 49, train_loss: 0.9228, test_loss: 0.9790, test_f1: 0.4812
 epoch: 50, train_loss: 0.9328, test_loss: 0.9662, test_f1: 0.4930
 epoch: 51, train_loss: 0.9204, test_loss: 0.9952, test_f1: 0.4769
 epoch: 52, train_loss: 0.9089, test_loss: 0.9759, test_f1: 0.5016
 epoch: 53, train_loss: 0.9096, test_loss: 0.9832, test_f1: 0.4915
 epoch: 54, train_loss: 0.9060, test_loss: 0.9993, test_f1: 0.4872
 epoch: 55, train_loss: 0.9032, test_loss: 0.9680, test_f1: 0.5117
 epoch: 56, train_loss: 0.8981, test_loss: 0.9852, test_f1: 0.5045
 epoch: 57, train_loss: 0.9062, test_loss: 0.9877, test_f1: 0.5071
 epoch: 58, train_loss: 0.8945, test_loss: 0.9980, test_f1: 0.4797
 epoch: 59, train_loss: 0.8956, test_loss: 0.9985, test_f1: 0.5180
 epoch: 60, train_loss: 0.8882, test_loss: 0.9924, test_f1: 0.4960
 epoch: 61, train_loss: 0.8900, test_loss: 0.9840, test_f1: 0.4965
 epoch: 62, train_loss: 0.8998, test_loss: 0.9996, test_f1: 0.4925
 epoch: 63, train_loss: 0.8874, test_loss: 0.9884, test_f1: 0.5032
 epoch: 64, train_loss: 0.8912, test_loss: 0.9751, test_f1: 0.4878
 epoch: 65, train_loss: 0.8858, test_loss: 0.9980, test_f1: 0.5057
 epoch: 66, train_loss: 0.8676, test_loss: 0.9843, test_f1: 0.5102
 epoch: 67, train_loss: 0.8818, test_loss: 0.9923, test_f1: 0.4996
 epoch: 68, train_loss: 0.8819, test_loss: 1.0000, test_f1: 0.5036
 epoch: 69, train_loss: 0.8739, test_loss: 0.9966, test_f1: 0.5055
 epoch: 70, train_loss: 0.8692, test_loss: 1.0077, test_f1: 0.4864
 epoch: 71, train_loss: 0.8664, test_loss: 0.9828, test_f1: 0.4989
 epoch: 72, train_loss: 0.8672, test_loss: 0.9968, test_f1: 0.5164
 epoch: 73, train_loss: 0.8615, test_loss: 1.0038, test_f1: 0.4983
 epoch: 74, train_loss: 0.8716, test_loss: 1.0043, test_f1: 0.5037
 epoch: 75, train_loss: 0.8737, test_loss: 1.0044, test_f1: 0.5086
 epoch: 76, train_loss: 0.8683, test_loss: 0.9939, test_f1: 0.5015
 epoch: 77, train_loss: 0.8588, test_loss: 0.9866, test_f1: 0.5109
 epoch: 78, train_loss: 0.8614, test_loss: 1.0090, test_f1: 0.5195
 epoch: 79, train_loss: 0.8675, test_loss: 1.0039, test_f1: 0.5128
 epoch: 80, train_loss: 0.8600, test_loss: 1.0122, test_f1: 0.4887
 epoch: 81, train_loss: 0.8653, test_loss: 0.9964, test_f1: 0.5114
 epoch: 82, train_loss: 0.8457, test_loss: 1.0209, test_f1: 0.4920
 epoch: 83, train_loss: 0.8534, test_loss: 1.0079, test_f1: 0.5102
 epoch: 84, train_loss: 0.8564, test_loss: 0.9989, test_f1: 0.5185
 epoch: 85, train_loss: 0.8461, test_loss: 1.0218, test_f1: 0.5138
 epoch: 86, train_loss: 0.8488, test_loss: 1.0311, test_f1: 0.4941
 epoch: 87, train_loss: 0.8415, test_loss: 1.0214, test_f1: 0.5014
 epoch: 88, train_loss: 0.8447, test_loss: 1.0168, test_f1: 0.5105
 epoch: 89, train_loss: 0.8426, test_loss: 1.0193, test_f1: 0.4969
 epoch: 90, train_loss: 0.8402, test_loss: 1.0092, test_f1: 0.5152
 epoch: 91, train_loss: 0.8519, test_loss: 1.0538, test_f1: 0.5069
 epoch: 92, train_loss: 0.8415, test_loss: 1.0171, test_f1: 0.4972
 epoch: 93, train_loss: 0.8397, test_loss: 1.0354, test_f1: 0.5083
 epoch: 94, train_loss: 0.8286, test_loss: 0.9980, test_f1: 0.5192
 epoch: 95, train_loss: 0.8391, test_loss: 1.0171, test_f1: 0.4960
 epoch: 96, train_loss: 0.8389, test_loss: 1.0264, test_f1: 0.5099
 epoch: 97, train_loss: 0.8188, test_loss: 1.0224, test_f1: 0.5105
 epoch: 98, train_loss: 0.8353, test_loss: 1.0208, test_f1: 0.5150
 epoch: 99, train_loss: 0.8347, test_loss: 1.0219, test_f1: 0.4963
##################ITERATION #5 ****************************************
 epoch: 0, train_loss: 1.3036, test_loss: 1.2555, test_f1: 0.3122
 epoch: 1, train_loss: 1.2418, test_loss: 1.1940, test_f1: 0.3968
 epoch: 2, train_loss: 1.2198, test_loss: 1.1708, test_f1: 0.4137
 epoch: 3, train_loss: 1.2033, test_loss: 1.1567, test_f1: 0.4030
 epoch: 4, train_loss: 1.1896, test_loss: 1.1474, test_f1: 0.4054
 epoch: 5, train_loss: 1.1873, test_loss: 1.1346, test_f1: 0.4276
 epoch: 6, train_loss: 1.1656, test_loss: 1.1308, test_f1: 0.4178
 epoch: 7, train_loss: 1.1692, test_loss: 1.1234, test_f1: 0.4272
 epoch: 8, train_loss: 1.1484, test_loss: 1.1149, test_f1: 0.4288
 epoch: 9, train_loss: 1.1455, test_loss: 1.1126, test_f1: 0.4314
 epoch: 10, train_loss: 1.1395, test_loss: 1.1022, test_f1: 0.4457
 epoch: 11, train_loss: 1.1247, test_loss: 1.1054, test_f1: 0.4349
 epoch: 12, train_loss: 1.1253, test_loss: 1.0909, test_f1: 0.4308
 epoch: 13, train_loss: 1.1162, test_loss: 1.0804, test_f1: 0.4390
 epoch: 14, train_loss: 1.1006, test_loss: 1.0847, test_f1: 0.4298
 epoch: 15, train_loss: 1.1012, test_loss: 1.0833, test_f1: 0.4255
 epoch: 16, train_loss: 1.1001, test_loss: 1.0659, test_f1: 0.4319
 epoch: 17, train_loss: 1.0796, test_loss: 1.0682, test_f1: 0.4227
 epoch: 18, train_loss: 1.0857, test_loss: 1.0496, test_f1: 0.4346
 epoch: 19, train_loss: 1.0799, test_loss: 1.0550, test_f1: 0.4403
 epoch: 20, train_loss: 1.0781, test_loss: 1.0524, test_f1: 0.4457
 epoch: 21, train_loss: 1.0626, test_loss: 1.0354, test_f1: 0.4357
 epoch: 22, train_loss: 1.0490, test_loss: 1.0284, test_f1: 0.4435
 epoch: 23, train_loss: 1.0524, test_loss: 1.0377, test_f1: 0.4328
 epoch: 24, train_loss: 1.0555, test_loss: 1.0287, test_f1: 0.4489
 epoch: 25, train_loss: 1.0435, test_loss: 1.0431, test_f1: 0.4259
 epoch: 26, train_loss: 1.0366, test_loss: 1.0281, test_f1: 0.4325
 epoch: 27, train_loss: 1.0314, test_loss: 1.0148, test_f1: 0.4234
 epoch: 28, train_loss: 1.0150, test_loss: 1.0094, test_f1: 0.4382
 epoch: 29, train_loss: 1.0194, test_loss: 1.0043, test_f1: 0.4330
 epoch: 30, train_loss: 1.0181, test_loss: 1.0006, test_f1: 0.4308
 epoch: 31, train_loss: 1.0012, test_loss: 1.0031, test_f1: 0.4344
 epoch: 32, train_loss: 0.9924, test_loss: 0.9939, test_f1: 0.4335
 epoch: 33, train_loss: 0.9865, test_loss: 1.0096, test_f1: 0.4230
 epoch: 34, train_loss: 0.9798, test_loss: 0.9954, test_f1: 0.4459
 epoch: 35, train_loss: 0.9817, test_loss: 0.9992, test_f1: 0.4415
 epoch: 36, train_loss: 0.9718, test_loss: 1.0000, test_f1: 0.4453
 epoch: 37, train_loss: 0.9539, test_loss: 1.0368, test_f1: 0.4114
 epoch: 38, train_loss: 0.9545, test_loss: 1.0162, test_f1: 0.4222
 epoch: 39, train_loss: 0.9680, test_loss: 1.0244, test_f1: 0.4252
 epoch: 40, train_loss: 0.9691, test_loss: 1.0087, test_f1: 0.4417
 epoch: 41, train_loss: 0.9486, test_loss: 1.0113, test_f1: 0.4410
 epoch: 42, train_loss: 0.9509, test_loss: 1.0143, test_f1: 0.4346
 epoch: 43, train_loss: 0.9366, test_loss: 1.0134, test_f1: 0.4448
 epoch: 44, train_loss: 0.9329, test_loss: 1.0377, test_f1: 0.4414
 epoch: 45, train_loss: 0.9323, test_loss: 1.0123, test_f1: 0.4581
 epoch: 46, train_loss: 0.9195, test_loss: 1.0032, test_f1: 0.4480
 epoch: 47, train_loss: 0.9309, test_loss: 1.0058, test_f1: 0.4381
 epoch: 48, train_loss: 0.9222, test_loss: 1.0178, test_f1: 0.4525
 epoch: 49, train_loss: 0.9287, test_loss: 0.9955, test_f1: 0.4827
 epoch: 50, train_loss: 0.9035, test_loss: 1.0296, test_f1: 0.4381
 epoch: 51, train_loss: 0.9075, test_loss: 1.0256, test_f1: 0.4477
 epoch: 52, train_loss: 0.9028, test_loss: 1.0145, test_f1: 0.4558
 epoch: 53, train_loss: 0.9004, test_loss: 1.0086, test_f1: 0.4549
 epoch: 54, train_loss: 0.8961, test_loss: 1.0061, test_f1: 0.4553
 epoch: 55, train_loss: 0.8900, test_loss: 1.0203, test_f1: 0.4474
 epoch: 56, train_loss: 0.8920, test_loss: 1.0177, test_f1: 0.4496
 epoch: 57, train_loss: 0.8858, test_loss: 1.0043, test_f1: 0.4587
 epoch: 58, train_loss: 0.8922, test_loss: 1.0174, test_f1: 0.4429
 epoch: 59, train_loss: 0.9033, test_loss: 1.0406, test_f1: 0.4306
 epoch: 60, train_loss: 0.8860, test_loss: 0.9995, test_f1: 0.4651
 epoch: 61, train_loss: 0.8827, test_loss: 1.0236, test_f1: 0.4576
 epoch: 62, train_loss: 0.8715, test_loss: 1.0405, test_f1: 0.4442
 epoch: 63, train_loss: 0.8898, test_loss: 1.0281, test_f1: 0.4338
 epoch: 64, train_loss: 0.8657, test_loss: 1.0190, test_f1: 0.4594
 epoch: 65, train_loss: 0.8740, test_loss: 1.0153, test_f1: 0.4708
 epoch: 66, train_loss: 0.8708, test_loss: 1.0384, test_f1: 0.4578
 epoch: 67, train_loss: 0.8646, test_loss: 1.0411, test_f1: 0.4514
 epoch: 68, train_loss: 0.8696, test_loss: 1.0086, test_f1: 0.4640
 epoch: 69, train_loss: 0.8526, test_loss: 1.0215, test_f1: 0.4544
 epoch: 70, train_loss: 0.8655, test_loss: 1.0255, test_f1: 0.4371
 epoch: 71, train_loss: 0.8890, test_loss: 1.0273, test_f1: 0.4651
 epoch: 72, train_loss: 0.8646, test_loss: 1.0416, test_f1: 0.4550
 epoch: 73, train_loss: 0.8604, test_loss: 1.0589, test_f1: 0.4383
 epoch: 74, train_loss: 0.8607, test_loss: 1.0163, test_f1: 0.4659
 epoch: 75, train_loss: 0.8541, test_loss: 1.0373, test_f1: 0.4417
 epoch: 76, train_loss: 0.8728, test_loss: 1.0241, test_f1: 0.4879
 epoch: 77, train_loss: 0.8511, test_loss: 1.0345, test_f1: 0.4612
 epoch: 78, train_loss: 0.8490, test_loss: 1.0218, test_f1: 0.4782
 epoch: 79, train_loss: 0.8563, test_loss: 1.0309, test_f1: 0.4659
 epoch: 80, train_loss: 0.8488, test_loss: 1.0548, test_f1: 0.4370
 epoch: 81, train_loss: 0.8487, test_loss: 1.0496, test_f1: 0.4775
 epoch: 82, train_loss: 0.8416, test_loss: 1.0384, test_f1: 0.4777
 epoch: 83, train_loss: 0.8377, test_loss: 1.0554, test_f1: 0.4429
 epoch: 84, train_loss: 0.8405, test_loss: 1.0742, test_f1: 0.4377
 epoch: 85, train_loss: 0.8496, test_loss: 1.0441, test_f1: 0.4778
 epoch: 86, train_loss: 0.8427, test_loss: 1.0407, test_f1: 0.4780
 epoch: 87, train_loss: 0.8301, test_loss: 1.0769, test_f1: 0.4578
 epoch: 88, train_loss: 0.8319, test_loss: 1.0545, test_f1: 0.4550
 epoch: 89, train_loss: 0.8429, test_loss: 1.0453, test_f1: 0.4565
 epoch: 90, train_loss: 0.8341, test_loss: 1.0645, test_f1: 0.4445
 epoch: 91, train_loss: 0.8362, test_loss: 1.0467, test_f1: 0.4604
 epoch: 92, train_loss: 0.8362, test_loss: 1.0997, test_f1: 0.4447
 epoch: 93, train_loss: 0.8222, test_loss: 1.0677, test_f1: 0.4504
 epoch: 94, train_loss: 0.8292, test_loss: 1.0775, test_f1: 0.4491
 epoch: 95, train_loss: 0.8176, test_loss: 1.0485, test_f1: 0.4590
 epoch: 96, train_loss: 0.8305, test_loss: 1.0564, test_f1: 0.4632
 epoch: 97, train_loss: 0.8052, test_loss: 1.0661, test_f1: 0.4534
 epoch: 98, train_loss: 0.8148, test_loss: 1.0969, test_f1: 0.4386
 epoch: 99, train_loss: 0.8097, test_loss: 1.0466, test_f1: 0.4859
##################ITERATION #6 ****************************************
 epoch: 0, train_loss: 1.3147, test_loss: 1.2454, test_f1: 0.3425
 epoch: 1, train_loss: 1.2395, test_loss: 1.1991, test_f1: 0.4054
 epoch: 2, train_loss: 1.2075, test_loss: 1.1739, test_f1: 0.4298
 epoch: 3, train_loss: 1.1889, test_loss: 1.1598, test_f1: 0.4331
 epoch: 4, train_loss: 1.1790, test_loss: 1.1436, test_f1: 0.4466
 epoch: 5, train_loss: 1.1586, test_loss: 1.1296, test_f1: 0.4475
 epoch: 6, train_loss: 1.1475, test_loss: 1.1241, test_f1: 0.4593
 epoch: 7, train_loss: 1.1251, test_loss: 1.1054, test_f1: 0.4619
 epoch: 8, train_loss: 1.1242, test_loss: 1.0906, test_f1: 0.4614
 epoch: 9, train_loss: 1.1116, test_loss: 1.0897, test_f1: 0.4675
 epoch: 10, train_loss: 1.1127, test_loss: 1.0788, test_f1: 0.4589
 epoch: 11, train_loss: 1.0946, test_loss: 1.0753, test_f1: 0.4669
 epoch: 12, train_loss: 1.0828, test_loss: 1.0656, test_f1: 0.4673
 epoch: 13, train_loss: 1.0809, test_loss: 1.0576, test_f1: 0.4802
 epoch: 14, train_loss: 1.0630, test_loss: 1.0475, test_f1: 0.4789
 epoch: 15, train_loss: 1.0591, test_loss: 1.0498, test_f1: 0.4687
 epoch: 16, train_loss: 1.0594, test_loss: 1.0529, test_f1: 0.4758
 epoch: 17, train_loss: 1.0438, test_loss: 1.0405, test_f1: 0.4824
 epoch: 18, train_loss: 1.0440, test_loss: 1.0381, test_f1: 0.4740
 epoch: 19, train_loss: 1.0375, test_loss: 1.0425, test_f1: 0.4745
 epoch: 20, train_loss: 1.0289, test_loss: 1.0428, test_f1: 0.4714
 epoch: 21, train_loss: 1.0215, test_loss: 1.0142, test_f1: 0.4780
 epoch: 22, train_loss: 1.0187, test_loss: 1.0237, test_f1: 0.4721
 epoch: 23, train_loss: 1.0169, test_loss: 1.0232, test_f1: 0.4783
 epoch: 24, train_loss: 1.0088, test_loss: 1.0148, test_f1: 0.4859
 epoch: 25, train_loss: 0.9907, test_loss: 1.0170, test_f1: 0.4848
 epoch: 26, train_loss: 0.9982, test_loss: 1.0287, test_f1: 0.4770
 epoch: 27, train_loss: 0.9845, test_loss: 0.9927, test_f1: 0.4685
 epoch: 28, train_loss: 0.9839, test_loss: 1.0049, test_f1: 0.4809
 epoch: 29, train_loss: 0.9802, test_loss: 1.0155, test_f1: 0.4644
 epoch: 30, train_loss: 0.9840, test_loss: 1.0109, test_f1: 0.4523
 epoch: 31, train_loss: 0.9783, test_loss: 0.9984, test_f1: 0.4700
 epoch: 32, train_loss: 0.9719, test_loss: 0.9860, test_f1: 0.4716
 epoch: 33, train_loss: 0.9603, test_loss: 1.0036, test_f1: 0.4710
 epoch: 34, train_loss: 0.9530, test_loss: 0.9913, test_f1: 0.4785
 epoch: 35, train_loss: 0.9531, test_loss: 0.9857, test_f1: 0.4710
 epoch: 36, train_loss: 0.9556, test_loss: 0.9856, test_f1: 0.4740
 epoch: 37, train_loss: 0.9643, test_loss: 0.9838, test_f1: 0.4944
 epoch: 38, train_loss: 0.9529, test_loss: 0.9983, test_f1: 0.4758
 epoch: 39, train_loss: 0.9277, test_loss: 0.9968, test_f1: 0.4870
 epoch: 40, train_loss: 0.9289, test_loss: 0.9947, test_f1: 0.4813
 epoch: 41, train_loss: 0.9348, test_loss: 0.9863, test_f1: 0.4849
 epoch: 42, train_loss: 0.9232, test_loss: 0.9992, test_f1: 0.4705
 epoch: 43, train_loss: 0.9325, test_loss: 1.0044, test_f1: 0.4922
 epoch: 44, train_loss: 0.9239, test_loss: 1.0030, test_f1: 0.4791
 epoch: 45, train_loss: 0.9210, test_loss: 1.0066, test_f1: 0.4843
 epoch: 46, train_loss: 0.9138, test_loss: 0.9833, test_f1: 0.4883
 epoch: 47, train_loss: 0.9091, test_loss: 1.0021, test_f1: 0.4802
 epoch: 48, train_loss: 0.9020, test_loss: 1.0137, test_f1: 0.4753
 epoch: 49, train_loss: 0.8919, test_loss: 1.0062, test_f1: 0.4804
 epoch: 50, train_loss: 0.8979, test_loss: 0.9834, test_f1: 0.4924
 epoch: 51, train_loss: 0.8836, test_loss: 0.9982, test_f1: 0.4854
 epoch: 52, train_loss: 0.8854, test_loss: 1.0105, test_f1: 0.4837
 epoch: 53, train_loss: 0.8877, test_loss: 1.0170, test_f1: 0.4981
 epoch: 54, train_loss: 0.8887, test_loss: 1.0066, test_f1: 0.5004
 epoch: 55, train_loss: 0.8729, test_loss: 1.0183, test_f1: 0.4960
 epoch: 56, train_loss: 0.8833, test_loss: 1.0192, test_f1: 0.4904
 epoch: 57, train_loss: 0.8735, test_loss: 1.0089, test_f1: 0.4988
 epoch: 58, train_loss: 0.8755, test_loss: 1.0121, test_f1: 0.5058
 epoch: 59, train_loss: 0.8792, test_loss: 1.0160, test_f1: 0.5034
 epoch: 60, train_loss: 0.8792, test_loss: 1.0308, test_f1: 0.5114
 epoch: 61, train_loss: 0.8722, test_loss: 1.0247, test_f1: 0.5067
 epoch: 62, train_loss: 0.8751, test_loss: 1.0214, test_f1: 0.4981
 epoch: 63, train_loss: 0.8654, test_loss: 1.0283, test_f1: 0.4993
 epoch: 64, train_loss: 0.8576, test_loss: 1.0255, test_f1: 0.5083
 epoch: 65, train_loss: 0.8593, test_loss: 1.0237, test_f1: 0.5052
 epoch: 66, train_loss: 0.8705, test_loss: 1.0299, test_f1: 0.5156
 epoch: 67, train_loss: 0.8639, test_loss: 1.0049, test_f1: 0.5259
 epoch: 68, train_loss: 0.8522, test_loss: 1.0347, test_f1: 0.5127
 epoch: 69, train_loss: 0.8633, test_loss: 1.0172, test_f1: 0.5185
 epoch: 70, train_loss: 0.8625, test_loss: 1.0313, test_f1: 0.5000
 epoch: 71, train_loss: 0.8588, test_loss: 1.0173, test_f1: 0.5071
 epoch: 72, train_loss: 0.8483, test_loss: 1.0183, test_f1: 0.5257
 epoch: 73, train_loss: 0.8576, test_loss: 1.0239, test_f1: 0.5237
 epoch: 74, train_loss: 0.8486, test_loss: 1.0414, test_f1: 0.5024
 epoch: 75, train_loss: 0.8409, test_loss: 1.0217, test_f1: 0.5023
 epoch: 76, train_loss: 0.8545, test_loss: 1.0468, test_f1: 0.5136
 epoch: 77, train_loss: 0.8539, test_loss: 1.0519, test_f1: 0.5065
 epoch: 78, train_loss: 0.8573, test_loss: 1.0491, test_f1: 0.5137
 epoch: 79, train_loss: 0.8326, test_loss: 1.0365, test_f1: 0.5109
 epoch: 80, train_loss: 0.8429, test_loss: 1.0313, test_f1: 0.5342
 epoch: 81, train_loss: 0.8299, test_loss: 1.0533, test_f1: 0.5184
 epoch: 82, train_loss: 0.8376, test_loss: 1.0406, test_f1: 0.5222
 epoch: 83, train_loss: 0.8307, test_loss: 1.0402, test_f1: 0.5246
 epoch: 84, train_loss: 0.8257, test_loss: 1.0622, test_f1: 0.5253
 epoch: 85, train_loss: 0.8332, test_loss: 1.0480, test_f1: 0.5253
 epoch: 86, train_loss: 0.8335, test_loss: 1.0356, test_f1: 0.5149
 epoch: 87, train_loss: 0.8319, test_loss: 1.0545, test_f1: 0.5174
 epoch: 88, train_loss: 0.8311, test_loss: 1.0426, test_f1: 0.5097
 epoch: 89, train_loss: 0.8291, test_loss: 1.0409, test_f1: 0.5143
 epoch: 90, train_loss: 0.8218, test_loss: 1.0448, test_f1: 0.5214
 epoch: 91, train_loss: 0.8315, test_loss: 1.0420, test_f1: 0.5176
 epoch: 92, train_loss: 0.8152, test_loss: 1.0425, test_f1: 0.5008
 epoch: 93, train_loss: 0.8260, test_loss: 1.0384, test_f1: 0.5056
 epoch: 94, train_loss: 0.8227, test_loss: 1.0538, test_f1: 0.5039
 epoch: 95, train_loss: 0.8106, test_loss: 1.0516, test_f1: 0.5260
 epoch: 96, train_loss: 0.8101, test_loss: 1.0532, test_f1: 0.5279
 epoch: 97, train_loss: 0.8278, test_loss: 1.0657, test_f1: 0.5108
 epoch: 98, train_loss: 0.8128, test_loss: 1.0610, test_f1: 0.5107
 epoch: 99, train_loss: 0.8280, test_loss: 1.0613, test_f1: 0.5269
##################ITERATION #7 ****************************************
 epoch: 0, train_loss: 1.3062, test_loss: 1.2443, test_f1: 0.3786
 epoch: 1, train_loss: 1.2403, test_loss: 1.1974, test_f1: 0.4016
 epoch: 2, train_loss: 1.2257, test_loss: 1.1694, test_f1: 0.4138
 epoch: 3, train_loss: 1.1963, test_loss: 1.1446, test_f1: 0.4179
 epoch: 4, train_loss: 1.1897, test_loss: 1.1302, test_f1: 0.4176
 epoch: 5, train_loss: 1.1641, test_loss: 1.1179, test_f1: 0.4396
 epoch: 6, train_loss: 1.1649, test_loss: 1.1045, test_f1: 0.4463
 epoch: 7, train_loss: 1.1467, test_loss: 1.0971, test_f1: 0.4366
 epoch: 8, train_loss: 1.1478, test_loss: 1.0869, test_f1: 0.4439
 epoch: 9, train_loss: 1.1265, test_loss: 1.0744, test_f1: 0.4259
 epoch: 10, train_loss: 1.1294, test_loss: 1.0755, test_f1: 0.4379
 epoch: 11, train_loss: 1.1141, test_loss: 1.0707, test_f1: 0.4434
 epoch: 12, train_loss: 1.1062, test_loss: 1.0501, test_f1: 0.4538
 epoch: 13, train_loss: 1.0905, test_loss: 1.0524, test_f1: 0.4526
 epoch: 14, train_loss: 1.0850, test_loss: 1.0419, test_f1: 0.4614
 epoch: 15, train_loss: 1.0778, test_loss: 1.0437, test_f1: 0.4513
 epoch: 16, train_loss: 1.0822, test_loss: 1.0275, test_f1: 0.4569
 epoch: 17, train_loss: 1.0765, test_loss: 1.0265, test_f1: 0.4702
 epoch: 18, train_loss: 1.0726, test_loss: 1.0309, test_f1: 0.4603
 epoch: 19, train_loss: 1.0611, test_loss: 1.0196, test_f1: 0.4729
 epoch: 20, train_loss: 1.0518, test_loss: 1.0294, test_f1: 0.4538
 epoch: 21, train_loss: 1.0377, test_loss: 1.0196, test_f1: 0.4677
 epoch: 22, train_loss: 1.0511, test_loss: 1.0186, test_f1: 0.4634
 epoch: 23, train_loss: 1.0301, test_loss: 1.0054, test_f1: 0.4889
 epoch: 24, train_loss: 1.0288, test_loss: 1.0048, test_f1: 0.4805
 epoch: 25, train_loss: 1.0209, test_loss: 1.0197, test_f1: 0.4722
 epoch: 26, train_loss: 1.0255, test_loss: 1.0118, test_f1: 0.4817
 epoch: 27, train_loss: 1.0130, test_loss: 1.0069, test_f1: 0.4643
 epoch: 28, train_loss: 1.0097, test_loss: 1.0098, test_f1: 0.4836
 epoch: 29, train_loss: 1.0044, test_loss: 0.9904, test_f1: 0.4983
 epoch: 30, train_loss: 0.9941, test_loss: 0.9925, test_f1: 0.4908
 epoch: 31, train_loss: 0.9925, test_loss: 1.0010, test_f1: 0.4852
 epoch: 32, train_loss: 1.0004, test_loss: 1.0049, test_f1: 0.4953
 epoch: 33, train_loss: 0.9859, test_loss: 1.0054, test_f1: 0.4489
 epoch: 34, train_loss: 0.9692, test_loss: 1.0071, test_f1: 0.4558
 epoch: 35, train_loss: 0.9701, test_loss: 0.9986, test_f1: 0.4475
 epoch: 36, train_loss: 0.9762, test_loss: 0.9895, test_f1: 0.4783
 epoch: 37, train_loss: 0.9845, test_loss: 0.9932, test_f1: 0.4582
 epoch: 38, train_loss: 0.9698, test_loss: 0.9919, test_f1: 0.4604
 epoch: 39, train_loss: 0.9607, test_loss: 0.9991, test_f1: 0.4478
 epoch: 40, train_loss: 0.9458, test_loss: 0.9980, test_f1: 0.4808
 epoch: 41, train_loss: 0.9470, test_loss: 0.9905, test_f1: 0.4615
 epoch: 42, train_loss: 0.9451, test_loss: 0.9921, test_f1: 0.4761
 epoch: 43, train_loss: 0.9458, test_loss: 0.9896, test_f1: 0.4718
 epoch: 44, train_loss: 0.9486, test_loss: 0.9995, test_f1: 0.4668
 epoch: 45, train_loss: 0.9400, test_loss: 0.9947, test_f1: 0.4601
 epoch: 46, train_loss: 0.9350, test_loss: 0.9880, test_f1: 0.4822
 epoch: 47, train_loss: 0.9268, test_loss: 1.0096, test_f1: 0.4665
 epoch: 48, train_loss: 0.9262, test_loss: 1.0069, test_f1: 0.4507
 epoch: 49, train_loss: 0.9201, test_loss: 1.0164, test_f1: 0.4435
 epoch: 50, train_loss: 0.9086, test_loss: 1.0160, test_f1: 0.4598
 epoch: 51, train_loss: 0.9082, test_loss: 0.9977, test_f1: 0.4734
 epoch: 52, train_loss: 0.9163, test_loss: 1.0238, test_f1: 0.4584
 epoch: 53, train_loss: 0.9073, test_loss: 0.9930, test_f1: 0.4742
 epoch: 54, train_loss: 0.9061, test_loss: 1.0056, test_f1: 0.4758
 epoch: 55, train_loss: 0.8946, test_loss: 1.0127, test_f1: 0.4622
 epoch: 56, train_loss: 0.8950, test_loss: 1.0195, test_f1: 0.4608
 epoch: 57, train_loss: 0.9004, test_loss: 1.0265, test_f1: 0.4649
 epoch: 58, train_loss: 0.8932, test_loss: 1.0165, test_f1: 0.4621
 epoch: 59, train_loss: 0.8790, test_loss: 1.0252, test_f1: 0.4722
 epoch: 60, train_loss: 0.8936, test_loss: 1.0167, test_f1: 0.4655
 epoch: 61, train_loss: 0.8782, test_loss: 1.0219, test_f1: 0.4573
 epoch: 62, train_loss: 0.8861, test_loss: 1.0330, test_f1: 0.4526
 epoch: 63, train_loss: 0.8884, test_loss: 1.0295, test_f1: 0.4434
 epoch: 64, train_loss: 0.8908, test_loss: 1.0606, test_f1: 0.4502
 epoch: 65, train_loss: 0.8756, test_loss: 1.0441, test_f1: 0.4564
 epoch: 66, train_loss: 0.8733, test_loss: 1.0527, test_f1: 0.4644
 epoch: 67, train_loss: 0.8810, test_loss: 1.0313, test_f1: 0.4653
 epoch: 68, train_loss: 0.8687, test_loss: 1.0203, test_f1: 0.4629
 epoch: 69, train_loss: 0.8662, test_loss: 1.0334, test_f1: 0.4690
 epoch: 70, train_loss: 0.8663, test_loss: 1.0396, test_f1: 0.4765
 epoch: 71, train_loss: 0.8661, test_loss: 1.0113, test_f1: 0.4708
 epoch: 72, train_loss: 0.8710, test_loss: 1.0532, test_f1: 0.4712
 epoch: 73, train_loss: 0.8687, test_loss: 1.0389, test_f1: 0.4553
 epoch: 74, train_loss: 0.8723, test_loss: 1.0344, test_f1: 0.4687
 epoch: 75, train_loss: 0.8687, test_loss: 1.0205, test_f1: 0.4734
 epoch: 76, train_loss: 0.8580, test_loss: 1.0538, test_f1: 0.4711
 epoch: 77, train_loss: 0.8660, test_loss: 1.0427, test_f1: 0.4716
 epoch: 78, train_loss: 0.8565, test_loss: 1.0612, test_f1: 0.4648
 epoch: 79, train_loss: 0.8607, test_loss: 1.0713, test_f1: 0.4533
 epoch: 80, train_loss: 0.8437, test_loss: 1.0374, test_f1: 0.4744
 epoch: 81, train_loss: 0.8491, test_loss: 1.0503, test_f1: 0.4705
 epoch: 82, train_loss: 0.8674, test_loss: 1.0404, test_f1: 0.4761
 epoch: 83, train_loss: 0.8508, test_loss: 1.0407, test_f1: 0.4671
 epoch: 84, train_loss: 0.8522, test_loss: 1.0492, test_f1: 0.4603
 epoch: 85, train_loss: 0.8394, test_loss: 1.0659, test_f1: 0.4714
 epoch: 86, train_loss: 0.8392, test_loss: 1.0575, test_f1: 0.4650
 epoch: 87, train_loss: 0.8459, test_loss: 1.0540, test_f1: 0.4641
 epoch: 88, train_loss: 0.8454, test_loss: 1.0468, test_f1: 0.4739
 epoch: 89, train_loss: 0.8526, test_loss: 1.0294, test_f1: 0.4691
 epoch: 90, train_loss: 0.8457, test_loss: 1.0479, test_f1: 0.4650
 epoch: 91, train_loss: 0.8271, test_loss: 1.0730, test_f1: 0.4706
 epoch: 92, train_loss: 0.8264, test_loss: 1.0561, test_f1: 0.4785
 epoch: 93, train_loss: 0.8262, test_loss: 1.0731, test_f1: 0.4664
 epoch: 94, train_loss: 0.8290, test_loss: 1.0784, test_f1: 0.4796
 epoch: 95, train_loss: 0.8237, test_loss: 1.0711, test_f1: 0.4744
 epoch: 96, train_loss: 0.8289, test_loss: 1.0512, test_f1: 0.4709
 epoch: 97, train_loss: 0.8142, test_loss: 1.0776, test_f1: 0.4773
 epoch: 98, train_loss: 0.8114, test_loss: 1.0561, test_f1: 0.4721
 epoch: 99, train_loss: 0.8310, test_loss: 1.0555, test_f1: 0.4711
##################ITERATION #8 ****************************************
 epoch: 0, train_loss: 1.3166, test_loss: 1.1926, test_f1: 0.4195
 epoch: 1, train_loss: 1.2437, test_loss: 1.1579, test_f1: 0.4202
 epoch: 2, train_loss: 1.2205, test_loss: 1.1400, test_f1: 0.4307
 epoch: 3, train_loss: 1.2018, test_loss: 1.1272, test_f1: 0.4524
 epoch: 4, train_loss: 1.1908, test_loss: 1.1121, test_f1: 0.4591
 epoch: 5, train_loss: 1.1660, test_loss: 1.0922, test_f1: 0.4563
 epoch: 6, train_loss: 1.1607, test_loss: 1.0781, test_f1: 0.4613
 epoch: 7, train_loss: 1.1408, test_loss: 1.0648, test_f1: 0.4634
 epoch: 8, train_loss: 1.1376, test_loss: 1.0534, test_f1: 0.4862
 epoch: 9, train_loss: 1.1169, test_loss: 1.0466, test_f1: 0.4723
 epoch: 10, train_loss: 1.1189, test_loss: 1.0543, test_f1: 0.4469
 epoch: 11, train_loss: 1.1036, test_loss: 1.0333, test_f1: 0.4874
 epoch: 12, train_loss: 1.0954, test_loss: 1.0211, test_f1: 0.4715
 epoch: 13, train_loss: 1.0917, test_loss: 1.0121, test_f1: 0.4764
 epoch: 14, train_loss: 1.0773, test_loss: 1.0148, test_f1: 0.4658
 epoch: 15, train_loss: 1.0707, test_loss: 1.0012, test_f1: 0.4691
 epoch: 16, train_loss: 1.0606, test_loss: 0.9952, test_f1: 0.4961
 epoch: 17, train_loss: 1.0634, test_loss: 0.9754, test_f1: 0.4971
 epoch: 18, train_loss: 1.0549, test_loss: 0.9830, test_f1: 0.4910
 epoch: 19, train_loss: 1.0525, test_loss: 0.9891, test_f1: 0.4883
 epoch: 20, train_loss: 1.0423, test_loss: 0.9681, test_f1: 0.4985
 epoch: 21, train_loss: 1.0335, test_loss: 0.9706, test_f1: 0.4767
 epoch: 22, train_loss: 1.0267, test_loss: 0.9713, test_f1: 0.4858
 epoch: 23, train_loss: 1.0363, test_loss: 0.9573, test_f1: 0.5039
 epoch: 24, train_loss: 1.0182, test_loss: 0.9660, test_f1: 0.4903
 epoch: 25, train_loss: 1.0220, test_loss: 0.9494, test_f1: 0.5032
 epoch: 26, train_loss: 1.0138, test_loss: 0.9525, test_f1: 0.4857
 epoch: 27, train_loss: 1.0141, test_loss: 0.9694, test_f1: 0.4826
 epoch: 28, train_loss: 0.9979, test_loss: 0.9600, test_f1: 0.4950
 epoch: 29, train_loss: 1.0080, test_loss: 0.9628, test_f1: 0.4875
 epoch: 30, train_loss: 0.9917, test_loss: 0.9519, test_f1: 0.5035
 epoch: 31, train_loss: 0.9859, test_loss: 0.9477, test_f1: 0.4846
 epoch: 32, train_loss: 0.9811, test_loss: 0.9462, test_f1: 0.4952
 epoch: 33, train_loss: 0.9876, test_loss: 0.9475, test_f1: 0.4770
 epoch: 34, train_loss: 0.9863, test_loss: 0.9394, test_f1: 0.4983
 epoch: 35, train_loss: 0.9772, test_loss: 0.9567, test_f1: 0.4729
 epoch: 36, train_loss: 0.9656, test_loss: 0.9431, test_f1: 0.4814
 epoch: 37, train_loss: 0.9594, test_loss: 0.9518, test_f1: 0.4831
 epoch: 38, train_loss: 0.9666, test_loss: 0.9479, test_f1: 0.4765
 epoch: 39, train_loss: 0.9540, test_loss: 0.9284, test_f1: 0.5023
 epoch: 40, train_loss: 0.9438, test_loss: 0.9403, test_f1: 0.5003
 epoch: 41, train_loss: 0.9551, test_loss: 0.9467, test_f1: 0.4900
 epoch: 42, train_loss: 0.9561, test_loss: 0.9552, test_f1: 0.4926
 epoch: 43, train_loss: 0.9457, test_loss: 0.9392, test_f1: 0.4847
 epoch: 44, train_loss: 0.9382, test_loss: 0.9516, test_f1: 0.4759
 epoch: 45, train_loss: 0.9386, test_loss: 0.9515, test_f1: 0.4989
 epoch: 46, train_loss: 0.9287, test_loss: 0.9453, test_f1: 0.4953
 epoch: 47, train_loss: 0.9309, test_loss: 0.9551, test_f1: 0.4856
 epoch: 48, train_loss: 0.9284, test_loss: 0.9393, test_f1: 0.4940
 epoch: 49, train_loss: 0.9298, test_loss: 0.9741, test_f1: 0.5060
 epoch: 50, train_loss: 0.9263, test_loss: 0.9479, test_f1: 0.4918
 epoch: 51, train_loss: 0.9145, test_loss: 0.9311, test_f1: 0.5046
 epoch: 52, train_loss: 0.9121, test_loss: 0.9588, test_f1: 0.4837
 epoch: 53, train_loss: 0.8993, test_loss: 0.9459, test_f1: 0.4955
 epoch: 54, train_loss: 0.9115, test_loss: 0.9370, test_f1: 0.4909
 epoch: 55, train_loss: 0.9103, test_loss: 0.9446, test_f1: 0.4773
 epoch: 56, train_loss: 0.9091, test_loss: 0.9475, test_f1: 0.4889
 epoch: 57, train_loss: 0.8940, test_loss: 0.9386, test_f1: 0.4933
 epoch: 58, train_loss: 0.8936, test_loss: 0.9521, test_f1: 0.4978
 epoch: 59, train_loss: 0.8983, test_loss: 0.9400, test_f1: 0.5179
 epoch: 60, train_loss: 0.8922, test_loss: 0.9431, test_f1: 0.5005
 epoch: 61, train_loss: 0.8962, test_loss: 0.9514, test_f1: 0.4973
 epoch: 62, train_loss: 0.8853, test_loss: 0.9462, test_f1: 0.4983
 epoch: 63, train_loss: 0.8941, test_loss: 0.9375, test_f1: 0.5077
 epoch: 64, train_loss: 0.8940, test_loss: 0.9314, test_f1: 0.4994
 epoch: 65, train_loss: 0.8874, test_loss: 0.9584, test_f1: 0.4826
 epoch: 66, train_loss: 0.8858, test_loss: 0.9611, test_f1: 0.4906
 epoch: 67, train_loss: 0.8831, test_loss: 0.9522, test_f1: 0.5022
 epoch: 68, train_loss: 0.8729, test_loss: 0.9566, test_f1: 0.5022
 epoch: 69, train_loss: 0.8893, test_loss: 0.9636, test_f1: 0.4820
 epoch: 70, train_loss: 0.8748, test_loss: 0.9432, test_f1: 0.5215
 epoch: 71, train_loss: 0.8694, test_loss: 0.9495, test_f1: 0.5175
 epoch: 72, train_loss: 0.8739, test_loss: 0.9347, test_f1: 0.5006
 epoch: 73, train_loss: 0.8631, test_loss: 0.9597, test_f1: 0.5041
 epoch: 74, train_loss: 0.8725, test_loss: 0.9450, test_f1: 0.5009
 epoch: 75, train_loss: 0.8711, test_loss: 0.9425, test_f1: 0.5194
 epoch: 76, train_loss: 0.8684, test_loss: 0.9384, test_f1: 0.5144
 epoch: 77, train_loss: 0.8733, test_loss: 0.9467, test_f1: 0.5246
 epoch: 78, train_loss: 0.8694, test_loss: 0.9409, test_f1: 0.5286
 epoch: 79, train_loss: 0.8604, test_loss: 0.9303, test_f1: 0.5314
 epoch: 80, train_loss: 0.8556, test_loss: 0.9366, test_f1: 0.5192
 epoch: 81, train_loss: 0.8601, test_loss: 0.9376, test_f1: 0.5298
 epoch: 82, train_loss: 0.8558, test_loss: 0.9456, test_f1: 0.5179
 epoch: 83, train_loss: 0.8587, test_loss: 0.9649, test_f1: 0.5092
 epoch: 84, train_loss: 0.8567, test_loss: 0.9337, test_f1: 0.5071
 epoch: 85, train_loss: 0.8547, test_loss: 0.9521, test_f1: 0.5242
 epoch: 86, train_loss: 0.8692, test_loss: 0.9374, test_f1: 0.4982
 epoch: 87, train_loss: 0.8393, test_loss: 0.9584, test_f1: 0.5152
 epoch: 88, train_loss: 0.8480, test_loss: 0.9433, test_f1: 0.5263
 epoch: 89, train_loss: 0.8447, test_loss: 0.9405, test_f1: 0.5141
 epoch: 90, train_loss: 0.8542, test_loss: 0.9675, test_f1: 0.5116
 epoch: 91, train_loss: 0.8424, test_loss: 0.9622, test_f1: 0.5152
 epoch: 92, train_loss: 0.8485, test_loss: 0.9525, test_f1: 0.5141
 epoch: 93, train_loss: 0.8405, test_loss: 0.9516, test_f1: 0.5229
 epoch: 94, train_loss: 0.8363, test_loss: 0.9615, test_f1: 0.5319
 epoch: 95, train_loss: 0.8463, test_loss: 0.9628, test_f1: 0.5189
 epoch: 96, train_loss: 0.8320, test_loss: 0.9600, test_f1: 0.5043
 epoch: 97, train_loss: 0.8365, test_loss: 0.9430, test_f1: 0.5176
 epoch: 98, train_loss: 0.8452, test_loss: 0.9441, test_f1: 0.5345
 epoch: 99, train_loss: 0.8427, test_loss: 0.9333, test_f1: 0.5275
##################ITERATION #9 ****************************************
 epoch: 0, train_loss: 1.3259, test_loss: 1.2256, test_f1: 0.3288
 epoch: 1, train_loss: 1.2519, test_loss: 1.1986, test_f1: 0.4240
 epoch: 2, train_loss: 1.2298, test_loss: 1.2538, test_f1: 0.4275
 epoch: 3, train_loss: 1.2085, test_loss: 1.1624, test_f1: 0.4713
 epoch: 4, train_loss: 1.1820, test_loss: 1.2047, test_f1: 0.4339
 epoch: 5, train_loss: 1.1738, test_loss: 1.1917, test_f1: 0.4339
 epoch: 6, train_loss: 1.1652, test_loss: 1.3045, test_f1: 0.4333
 epoch: 7, train_loss: 1.1678, test_loss: 1.1924, test_f1: 0.4222
 epoch: 8, train_loss: 1.1355, test_loss: 1.1266, test_f1: 0.4337
 epoch: 9, train_loss: 1.1388, test_loss: 1.1452, test_f1: 0.4371
 epoch: 10, train_loss: 1.1216, test_loss: 1.1190, test_f1: 0.4284
 epoch: 11, train_loss: 1.1057, test_loss: 1.0541, test_f1: 0.4713
 epoch: 12, train_loss: 1.1016, test_loss: 1.0484, test_f1: 0.4734
 epoch: 13, train_loss: 1.0846, test_loss: 1.0502, test_f1: 0.4699
 epoch: 14, train_loss: 1.0763, test_loss: 1.0458, test_f1: 0.4648
 epoch: 15, train_loss: 1.0675, test_loss: 1.0293, test_f1: 0.4833
 epoch: 16, train_loss: 1.0728, test_loss: 1.0571, test_f1: 0.4581
 epoch: 17, train_loss: 1.0695, test_loss: 1.0218, test_f1: 0.4700
 epoch: 18, train_loss: 1.0540, test_loss: 1.1015, test_f1: 0.4398
 epoch: 19, train_loss: 1.0438, test_loss: 0.9992, test_f1: 0.4831
 epoch: 20, train_loss: 1.0484, test_loss: 1.0204, test_f1: 0.4725
 epoch: 21, train_loss: 1.0364, test_loss: 1.0134, test_f1: 0.4693
 epoch: 22, train_loss: 1.0359, test_loss: 1.0123, test_f1: 0.4881
 epoch: 23, train_loss: 1.0222, test_loss: 1.0137, test_f1: 0.4798
 epoch: 24, train_loss: 1.0197, test_loss: 1.0159, test_f1: 0.4811
 epoch: 25, train_loss: 1.0217, test_loss: 0.9847, test_f1: 0.4726
 epoch: 26, train_loss: 1.0138, test_loss: 0.9806, test_f1: 0.4882
 epoch: 27, train_loss: 1.0015, test_loss: 1.0099, test_f1: 0.4744
 epoch: 28, train_loss: 0.9886, test_loss: 0.9917, test_f1: 0.4822
 epoch: 29, train_loss: 0.9877, test_loss: 0.9972, test_f1: 0.4858
 epoch: 30, train_loss: 0.9793, test_loss: 0.9816, test_f1: 0.4752
 epoch: 31, train_loss: 0.9766, test_loss: 0.9924, test_f1: 0.4858
 epoch: 32, train_loss: 0.9760, test_loss: 1.0193, test_f1: 0.4676
 epoch: 33, train_loss: 0.9589, test_loss: 0.9959, test_f1: 0.4539
 epoch: 34, train_loss: 0.9636, test_loss: 0.9923, test_f1: 0.4815
 epoch: 35, train_loss: 0.9444, test_loss: 1.0019, test_f1: 0.5044
 epoch: 36, train_loss: 0.9613, test_loss: 1.0340, test_f1: 0.4681
 epoch: 37, train_loss: 0.9460, test_loss: 1.0261, test_f1: 0.4821
 epoch: 38, train_loss: 0.9531, test_loss: 1.0569, test_f1: 0.4737
 epoch: 39, train_loss: 0.9410, test_loss: 1.0480, test_f1: 0.4750
 epoch: 40, train_loss: 0.9370, test_loss: 1.0067, test_f1: 0.4918
 epoch: 41, train_loss: 0.9387, test_loss: 1.0359, test_f1: 0.4829
 epoch: 42, train_loss: 0.9203, test_loss: 1.0985, test_f1: 0.4689
 epoch: 43, train_loss: 0.9226, test_loss: 1.0381, test_f1: 0.4720
 epoch: 44, train_loss: 0.9109, test_loss: 1.0744, test_f1: 0.4612
 epoch: 45, train_loss: 0.9202, test_loss: 1.0498, test_f1: 0.4598
 epoch: 46, train_loss: 0.9022, test_loss: 1.0718, test_f1: 0.4629
 epoch: 47, train_loss: 0.9190, test_loss: 1.0436, test_f1: 0.4571
 epoch: 48, train_loss: 0.9001, test_loss: 1.0301, test_f1: 0.4833
 epoch: 49, train_loss: 0.9073, test_loss: 1.1125, test_f1: 0.4770
 epoch: 50, train_loss: 0.9010, test_loss: 1.1306, test_f1: 0.4762
 epoch: 51, train_loss: 0.8982, test_loss: 1.0562, test_f1: 0.4712
 epoch: 52, train_loss: 0.8859, test_loss: 1.0608, test_f1: 0.4704
 epoch: 53, train_loss: 0.8886, test_loss: 1.0693, test_f1: 0.4650
 epoch: 54, train_loss: 0.8809, test_loss: 1.0622, test_f1: 0.4677
 epoch: 55, train_loss: 0.8797, test_loss: 1.0809, test_f1: 0.4628
 epoch: 56, train_loss: 0.8850, test_loss: 1.1315, test_f1: 0.4720
 epoch: 57, train_loss: 0.8766, test_loss: 1.1543, test_f1: 0.4680
 epoch: 58, train_loss: 0.8811, test_loss: 1.1039, test_f1: 0.4671
 epoch: 59, train_loss: 0.8677, test_loss: 1.0778, test_f1: 0.4681
 epoch: 60, train_loss: 0.8655, test_loss: 1.0549, test_f1: 0.4918
 epoch: 61, train_loss: 0.8775, test_loss: 1.0668, test_f1: 0.4711
 epoch: 62, train_loss: 0.8784, test_loss: 1.0487, test_f1: 0.4790
 epoch: 63, train_loss: 0.8680, test_loss: 1.0415, test_f1: 0.4850
 epoch: 64, train_loss: 0.8665, test_loss: 1.0719, test_f1: 0.4688
 epoch: 65, train_loss: 0.8604, test_loss: 1.0626, test_f1: 0.4811
 epoch: 66, train_loss: 0.8618, test_loss: 1.0537, test_f1: 0.4705
 epoch: 67, train_loss: 0.8547, test_loss: 1.0542, test_f1: 0.4829
 epoch: 68, train_loss: 0.8601, test_loss: 1.0797, test_f1: 0.4885
 epoch: 69, train_loss: 0.8587, test_loss: 1.0817, test_f1: 0.4767
 epoch: 70, train_loss: 0.8510, test_loss: 1.1109, test_f1: 0.4818
 epoch: 71, train_loss: 0.8443, test_loss: 1.0734, test_f1: 0.4809
 epoch: 72, train_loss: 0.8593, test_loss: 1.0990, test_f1: 0.4712
 epoch: 73, train_loss: 0.8400, test_loss: 1.0734, test_f1: 0.4804
 epoch: 74, train_loss: 0.8429, test_loss: 1.1226, test_f1: 0.4892
 epoch: 75, train_loss: 0.8434, test_loss: 1.1027, test_f1: 0.4760
 epoch: 76, train_loss: 0.8599, test_loss: 1.1196, test_f1: 0.4915
 epoch: 77, train_loss: 0.8471, test_loss: 1.0996, test_f1: 0.4849
 epoch: 78, train_loss: 0.8427, test_loss: 1.1100, test_f1: 0.4835
 epoch: 79, train_loss: 0.8297, test_loss: 1.1282, test_f1: 0.4833
 epoch: 80, train_loss: 0.8393, test_loss: 1.1279, test_f1: 0.4800
 epoch: 81, train_loss: 0.8558, test_loss: 1.1220, test_f1: 0.4858
 epoch: 82, train_loss: 0.8380, test_loss: 1.1036, test_f1: 0.4827
 epoch: 83, train_loss: 0.8410, test_loss: 1.1163, test_f1: 0.4840
 epoch: 84, train_loss: 0.8315, test_loss: 1.1106, test_f1: 0.4886
 epoch: 85, train_loss: 0.8183, test_loss: 1.1376, test_f1: 0.4917
 epoch: 86, train_loss: 0.8381, test_loss: 1.1657, test_f1: 0.4824
 epoch: 87, train_loss: 0.8293, test_loss: 1.1656, test_f1: 0.4893
 epoch: 88, train_loss: 0.8280, test_loss: 1.1528, test_f1: 0.4851
 epoch: 89, train_loss: 0.8165, test_loss: 1.1318, test_f1: 0.4983
 epoch: 90, train_loss: 0.8258, test_loss: 1.1686, test_f1: 0.4989
 epoch: 91, train_loss: 0.8177, test_loss: 1.1639, test_f1: 0.4881
 epoch: 92, train_loss: 0.8199, test_loss: 1.1362, test_f1: 0.4902
 epoch: 93, train_loss: 0.8136, test_loss: 1.1715, test_f1: 0.5018
 epoch: 94, train_loss: 0.8149, test_loss: 1.1362, test_f1: 0.5024
 epoch: 95, train_loss: 0.8192, test_loss: 1.1586, test_f1: 0.4920
 epoch: 96, train_loss: 0.8180, test_loss: 1.1744, test_f1: 0.4843
 epoch: 97, train_loss: 0.8091, test_loss: 1.1698, test_f1: 0.4974
 epoch: 98, train_loss: 0.8153, test_loss: 1.1604, test_f1: 0.5003
 epoch: 99, train_loss: 0.8011, test_loss: 1.1820, test_f1: 0.5049

Training completed in 671.12 seconds
Best F1: 0.5475 at epoch 88
Mean F1 across iterations: 0.5180  0.0175
========================FINAL RESULTS================================
FEGIN weighted F1: 0.5475  0.0175
python main.py --data ltspice_examples --representation component_component --model FEGIN --layers 4 --hiddens 64 --batch_size 64 --lr 0.0001 --emb_size 250 --epochs 100 --save_appendix component_component_L4_H64_BS64_LR0.0001_E250 --no_val
-----



STDERR:
  File "main.py", line 370, in <module>
    main()
  File "main.py", line 254, in main
    dataset = dataset_class(
  File "/home/philip/projects/ltspice_examples_code_repo/Circuit-Completion-Using-GNNs/component_classification_with_link_prediction_head/evaluation/FEGIN/kernel/circuit_datasets.py", line 15, in __init__
    self.data, self.slices = torch.load(self.processed_paths[0])
  File "/home/philip/.local/lib/python3.8/site-packages/torch/serialization.py", line 1040, in load
    warnings.warn(
  File "/usr/lib/python3.8/warnings.py", line 109, in _showwarnmsg
    sw(msg.message, msg.category, msg.filename, msg.lineno,
  File "main.py", line 47, in warn_with_traceback
    traceback.print_stack(file=log)
/home/philip/projects/ltspice_examples_code_repo/Circuit-Completion-Using-GNNs/component_classification_with_link_prediction_head/evaluation/FEGIN/kernel/circuit_datasets.py:15: FutureWarning: You are using `torch.load` with `weights_only=False` (the current default value), which uses the default pickle module implicitly. It is possible to construct malicious pickle data which will execute arbitrary code during unpickling (See https://github.com/pytorch/pytorch/blob/main/SECURITY.md#untrusted-models for more details). In a future release, the default value for `weights_only` will be flipped to `True`. This limits the functions that could be executed during unpickling. Arbitrary objects will no longer be allowed to be loaded via this mode unless they are explicitly allowlisted by the user via `torch.serialization.add_safe_globals`. We recommend you start setting `weights_only=True` for any use case where you don't have full control of the loaded file. Please open an issue on GitHub for any issues related to this experimental feature.
  self.data, self.slices = torch.load(self.processed_paths[0])
