STDOUT:
Results will be saved in /home/philip/projects/llm_inference_code_repo/Circuit-Completion-Using-GNNs/component_classification_with_link_prediction_head/evaluation/FEGIN/results/model_FEGIN_dataset_ltspice_examples
Command line input: python main.py --data ltspice_examples --representation component_net --model FEGIN --layers 5 --hiddens 32 --batch_size 128 --lr 0.0001 --emb_size 250 --epochs 100 --save_appendix component_net_L5_H32_BS128_LR0.0001_E250 --no_val
 is saved.
-----
ltspice_examples - FEGIN
Using 5 layers, 32 hidden units, h = 2
Loading component_net representation dataset
ENTERED
Training FEGIN on component_net representation
Train: 3558, Test: 846
##################ITERATION #0 ****************************************
 epoch: 0, train_loss: 1.4195, test_loss: 1.4184, test_f1: 0.1004
 epoch: 1, train_loss: 1.4095, test_loss: 1.4099, test_f1: 0.1063
 epoch: 2, train_loss: 1.4027, test_loss: 1.4024, test_f1: 0.1055
 epoch: 3, train_loss: 1.3968, test_loss: 1.3926, test_f1: 0.1057
 epoch: 4, train_loss: 1.3891, test_loss: 1.3858, test_f1: 0.1121
 epoch: 5, train_loss: 1.3819, test_loss: 1.3777, test_f1: 0.1208
 epoch: 6, train_loss: 1.3745, test_loss: 1.3697, test_f1: 0.2155
 epoch: 7, train_loss: 1.3658, test_loss: 1.3600, test_f1: 0.3354
 epoch: 8, train_loss: 1.3553, test_loss: 1.3490, test_f1: 0.3883
 epoch: 9, train_loss: 1.3439, test_loss: 1.3371, test_f1: 0.3510
 epoch: 10, train_loss: 1.3310, test_loss: 1.3214, test_f1: 0.3525
 epoch: 11, train_loss: 1.3171, test_loss: 1.3075, test_f1: 0.3280
 epoch: 12, train_loss: 1.3047, test_loss: 1.2901, test_f1: 0.2986
 epoch: 13, train_loss: 1.2926, test_loss: 1.2772, test_f1: 0.2905
 epoch: 14, train_loss: 1.2773, test_loss: 1.2648, test_f1: 0.2896
 epoch: 15, train_loss: 1.2663, test_loss: 1.2526, test_f1: 0.2933
 epoch: 16, train_loss: 1.2594, test_loss: 1.2384, test_f1: 0.2913
 epoch: 17, train_loss: 1.2487, test_loss: 1.2348, test_f1: 0.3076
 epoch: 18, train_loss: 1.2400, test_loss: 1.2165, test_f1: 0.3066
 epoch: 19, train_loss: 1.2269, test_loss: 1.2191, test_f1: 0.3102
 epoch: 20, train_loss: 1.2223, test_loss: 1.2022, test_f1: 0.3167
 epoch: 21, train_loss: 1.2142, test_loss: 1.1976, test_f1: 0.3231
 epoch: 22, train_loss: 1.2102, test_loss: 1.1840, test_f1: 0.3209
 epoch: 23, train_loss: 1.2035, test_loss: 1.1781, test_f1: 0.3263
 epoch: 24, train_loss: 1.1961, test_loss: 1.1723, test_f1: 0.3264
 epoch: 25, train_loss: 1.1894, test_loss: 1.1647, test_f1: 0.3310
 epoch: 26, train_loss: 1.1876, test_loss: 1.1632, test_f1: 0.3448
 epoch: 27, train_loss: 1.1826, test_loss: 1.1544, test_f1: 0.3411
 epoch: 28, train_loss: 1.1837, test_loss: 1.1492, test_f1: 0.3357
 epoch: 29, train_loss: 1.1723, test_loss: 1.1432, test_f1: 0.3448
 epoch: 30, train_loss: 1.1647, test_loss: 1.1501, test_f1: 0.3500
 epoch: 31, train_loss: 1.1631, test_loss: 1.1369, test_f1: 0.3588
 epoch: 32, train_loss: 1.1572, test_loss: 1.1376, test_f1: 0.3551
 epoch: 33, train_loss: 1.1516, test_loss: 1.1248, test_f1: 0.3584
 epoch: 34, train_loss: 1.1453, test_loss: 1.1216, test_f1: 0.3649
 epoch: 35, train_loss: 1.1417, test_loss: 1.1145, test_f1: 0.3683
 epoch: 36, train_loss: 1.1404, test_loss: 1.1095, test_f1: 0.3820
 epoch: 37, train_loss: 1.1358, test_loss: 1.1057, test_f1: 0.4029
 epoch: 38, train_loss: 1.1277, test_loss: 1.1096, test_f1: 0.3767
 epoch: 39, train_loss: 1.1273, test_loss: 1.0966, test_f1: 0.4209
 epoch: 40, train_loss: 1.1178, test_loss: 1.0904, test_f1: 0.4396
 epoch: 41, train_loss: 1.1138, test_loss: 1.0859, test_f1: 0.4483
 epoch: 42, train_loss: 1.1115, test_loss: 1.0799, test_f1: 0.4546
 epoch: 43, train_loss: 1.1043, test_loss: 1.1030, test_f1: 0.4633
 epoch: 44, train_loss: 1.0955, test_loss: 1.0887, test_f1: 0.4507
 epoch: 45, train_loss: 1.0884, test_loss: 1.0657, test_f1: 0.4617
 epoch: 46, train_loss: 1.0910, test_loss: 1.0601, test_f1: 0.4774
 epoch: 47, train_loss: 1.0763, test_loss: 1.0565, test_f1: 0.4754
 epoch: 48, train_loss: 1.0766, test_loss: 1.0543, test_f1: 0.4739
 epoch: 49, train_loss: 1.0701, test_loss: 1.0441, test_f1: 0.4870
 epoch: 50, train_loss: 1.0643, test_loss: 1.0553, test_f1: 0.4820
 epoch: 51, train_loss: 1.0597, test_loss: 1.0440, test_f1: 0.4806
 epoch: 52, train_loss: 1.0553, test_loss: 1.0395, test_f1: 0.4831
 epoch: 53, train_loss: 1.0413, test_loss: 1.0345, test_f1: 0.4811
 epoch: 54, train_loss: 1.0468, test_loss: 1.0350, test_f1: 0.4847
 epoch: 55, train_loss: 1.0522, test_loss: 1.0300, test_f1: 0.4901
 epoch: 56, train_loss: 1.0430, test_loss: 1.0327, test_f1: 0.4845
 epoch: 57, train_loss: 1.0411, test_loss: 1.0213, test_f1: 0.4839
 epoch: 58, train_loss: 1.0330, test_loss: 1.0258, test_f1: 0.4852
 epoch: 59, train_loss: 1.0316, test_loss: 1.0252, test_f1: 0.4842
 epoch: 60, train_loss: 1.0315, test_loss: 1.0169, test_f1: 0.4846
 epoch: 61, train_loss: 1.0266, test_loss: 1.0184, test_f1: 0.4833
 epoch: 62, train_loss: 1.0241, test_loss: 1.0190, test_f1: 0.4818
 epoch: 63, train_loss: 1.0230, test_loss: 1.0140, test_f1: 0.4923
 epoch: 64, train_loss: 1.0169, test_loss: 1.0143, test_f1: 0.4905
 epoch: 65, train_loss: 1.0152, test_loss: 1.0130, test_f1: 0.4851
 epoch: 66, train_loss: 1.0109, test_loss: 1.0064, test_f1: 0.4945
 epoch: 67, train_loss: 1.0153, test_loss: 1.0110, test_f1: 0.4754
 epoch: 68, train_loss: 1.0100, test_loss: 1.0067, test_f1: 0.4828
 epoch: 69, train_loss: 1.0133, test_loss: 1.0059, test_f1: 0.4950
 epoch: 70, train_loss: 1.0094, test_loss: 1.0100, test_f1: 0.4743
 epoch: 71, train_loss: 1.0116, test_loss: 0.9993, test_f1: 0.4864
 epoch: 72, train_loss: 1.0024, test_loss: 0.9975, test_f1: 0.4908
 epoch: 73, train_loss: 1.0027, test_loss: 0.9956, test_f1: 0.4898
 epoch: 74, train_loss: 1.0060, test_loss: 0.9920, test_f1: 0.4814
 epoch: 75, train_loss: 0.9926, test_loss: 0.9907, test_f1: 0.4812
 epoch: 76, train_loss: 0.9908, test_loss: 0.9929, test_f1: 0.4889
 epoch: 77, train_loss: 0.9909, test_loss: 0.9917, test_f1: 0.4800
 epoch: 78, train_loss: 0.9813, test_loss: 0.9921, test_f1: 0.4981
 epoch: 79, train_loss: 0.9864, test_loss: 0.9908, test_f1: 0.4915
 epoch: 80, train_loss: 0.9845, test_loss: 0.9853, test_f1: 0.4908
 epoch: 81, train_loss: 0.9806, test_loss: 0.9870, test_f1: 0.4914
 epoch: 82, train_loss: 0.9763, test_loss: 0.9828, test_f1: 0.4887
 epoch: 83, train_loss: 0.9797, test_loss: 0.9786, test_f1: 0.4947
 epoch: 84, train_loss: 0.9789, test_loss: 0.9882, test_f1: 0.4843
 epoch: 85, train_loss: 0.9777, test_loss: 0.9752, test_f1: 0.4817
 epoch: 86, train_loss: 0.9811, test_loss: 0.9816, test_f1: 0.4871
 epoch: 87, train_loss: 0.9809, test_loss: 0.9816, test_f1: 0.4871
 epoch: 88, train_loss: 0.9643, test_loss: 0.9698, test_f1: 0.4879
 epoch: 89, train_loss: 0.9709, test_loss: 0.9745, test_f1: 0.4872
 epoch: 90, train_loss: 0.9617, test_loss: 0.9744, test_f1: 0.4851
 epoch: 91, train_loss: 0.9735, test_loss: 0.9732, test_f1: 0.4817
 epoch: 92, train_loss: 0.9739, test_loss: 0.9741, test_f1: 0.4859
 epoch: 93, train_loss: 0.9625, test_loss: 0.9706, test_f1: 0.4919
 epoch: 94, train_loss: 0.9617, test_loss: 0.9653, test_f1: 0.4873
 epoch: 95, train_loss: 0.9446, test_loss: 0.9673, test_f1: 0.4827
 epoch: 96, train_loss: 0.9600, test_loss: 0.9691, test_f1: 0.4925
 epoch: 97, train_loss: 0.9495, test_loss: 0.9665, test_f1: 0.4818
 epoch: 98, train_loss: 0.9567, test_loss: 0.9659, test_f1: 0.4927
 epoch: 99, train_loss: 0.9439, test_loss: 0.9615, test_f1: 0.4945
##################ITERATION #1 ****************************************
 epoch: 0, train_loss: 1.3601, test_loss: 1.3787, test_f1: 0.1004
 epoch: 1, train_loss: 1.3359, test_loss: 1.3541, test_f1: 0.2706
 epoch: 2, train_loss: 1.3202, test_loss: 1.3357, test_f1: 0.2903
 epoch: 3, train_loss: 1.3040, test_loss: 1.3055, test_f1: 0.3151
 epoch: 4, train_loss: 1.2884, test_loss: 1.2861, test_f1: 0.3287
 epoch: 5, train_loss: 1.2731, test_loss: 1.2726, test_f1: 0.3283
 epoch: 6, train_loss: 1.2638, test_loss: 1.2589, test_f1: 0.3327
 epoch: 7, train_loss: 1.2509, test_loss: 1.2448, test_f1: 0.3147
 epoch: 8, train_loss: 1.2403, test_loss: 1.2350, test_f1: 0.3296
 epoch: 9, train_loss: 1.2320, test_loss: 1.2243, test_f1: 0.3208
 epoch: 10, train_loss: 1.2251, test_loss: 1.2129, test_f1: 0.3244
 epoch: 11, train_loss: 1.2130, test_loss: 1.2027, test_f1: 0.3242
 epoch: 12, train_loss: 1.2059, test_loss: 1.1975, test_f1: 0.3234
 epoch: 13, train_loss: 1.2000, test_loss: 1.1854, test_f1: 0.3294
 epoch: 14, train_loss: 1.1904, test_loss: 1.1770, test_f1: 0.3379
 epoch: 15, train_loss: 1.1842, test_loss: 1.1670, test_f1: 0.3400
 epoch: 16, train_loss: 1.1691, test_loss: 1.1574, test_f1: 0.3499
 epoch: 17, train_loss: 1.1663, test_loss: 1.1443, test_f1: 0.3606
 epoch: 18, train_loss: 1.1584, test_loss: 1.1381, test_f1: 0.3734
 epoch: 19, train_loss: 1.1487, test_loss: 1.1268, test_f1: 0.4082
 epoch: 20, train_loss: 1.1416, test_loss: 1.1201, test_f1: 0.4378
 epoch: 21, train_loss: 1.1271, test_loss: 1.1090, test_f1: 0.4278
 epoch: 22, train_loss: 1.1294, test_loss: 1.0956, test_f1: 0.4387
 epoch: 23, train_loss: 1.1171, test_loss: 1.0881, test_f1: 0.4492
 epoch: 24, train_loss: 1.1119, test_loss: 1.0785, test_f1: 0.4552
 epoch: 25, train_loss: 1.1020, test_loss: 1.0697, test_f1: 0.4580
 epoch: 26, train_loss: 1.0980, test_loss: 1.0655, test_f1: 0.4697
 epoch: 27, train_loss: 1.0898, test_loss: 1.0567, test_f1: 0.4679
 epoch: 28, train_loss: 1.0841, test_loss: 1.0463, test_f1: 0.4865
 epoch: 29, train_loss: 1.0733, test_loss: 1.0380, test_f1: 0.4967
 epoch: 30, train_loss: 1.0743, test_loss: 1.0296, test_f1: 0.4946
 epoch: 31, train_loss: 1.0609, test_loss: 1.0216, test_f1: 0.5008
 epoch: 32, train_loss: 1.0538, test_loss: 1.0193, test_f1: 0.4992
 epoch: 33, train_loss: 1.0407, test_loss: 1.0171, test_f1: 0.5101
 epoch: 34, train_loss: 1.0457, test_loss: 1.0051, test_f1: 0.5159
 epoch: 35, train_loss: 1.0302, test_loss: 1.0011, test_f1: 0.5173
 epoch: 36, train_loss: 1.0304, test_loss: 0.9980, test_f1: 0.5127
 epoch: 37, train_loss: 1.0174, test_loss: 0.9937, test_f1: 0.5038
 epoch: 38, train_loss: 1.0175, test_loss: 0.9812, test_f1: 0.5042
 epoch: 39, train_loss: 1.0083, test_loss: 0.9854, test_f1: 0.5051
 epoch: 40, train_loss: 1.0056, test_loss: 0.9738, test_f1: 0.5133
 epoch: 41, train_loss: 0.9996, test_loss: 0.9715, test_f1: 0.5168
 epoch: 42, train_loss: 0.9987, test_loss: 0.9691, test_f1: 0.5052
 epoch: 43, train_loss: 0.9927, test_loss: 0.9690, test_f1: 0.5108
 epoch: 44, train_loss: 0.9849, test_loss: 0.9614, test_f1: 0.5240
 epoch: 45, train_loss: 0.9876, test_loss: 0.9614, test_f1: 0.5215
 epoch: 46, train_loss: 0.9747, test_loss: 0.9577, test_f1: 0.5119
 epoch: 47, train_loss: 0.9780, test_loss: 0.9551, test_f1: 0.5177
 epoch: 48, train_loss: 0.9649, test_loss: 0.9576, test_f1: 0.5106
 epoch: 49, train_loss: 0.9627, test_loss: 0.9580, test_f1: 0.5095
 epoch: 50, train_loss: 0.9554, test_loss: 0.9507, test_f1: 0.5140
 epoch: 51, train_loss: 0.9531, test_loss: 0.9520, test_f1: 0.5190
 epoch: 52, train_loss: 0.9532, test_loss: 0.9499, test_f1: 0.5186
 epoch: 53, train_loss: 0.9579, test_loss: 0.9470, test_f1: 0.5194
 epoch: 54, train_loss: 0.9471, test_loss: 0.9455, test_f1: 0.5187
 epoch: 55, train_loss: 0.9406, test_loss: 0.9436, test_f1: 0.5178
 epoch: 56, train_loss: 0.9445, test_loss: 0.9441, test_f1: 0.5163
 epoch: 57, train_loss: 0.9496, test_loss: 0.9438, test_f1: 0.5223
 epoch: 58, train_loss: 0.9372, test_loss: 0.9440, test_f1: 0.5191
 epoch: 59, train_loss: 0.9479, test_loss: 0.9417, test_f1: 0.5181
 epoch: 60, train_loss: 0.9382, test_loss: 0.9391, test_f1: 0.5095
 epoch: 61, train_loss: 0.9394, test_loss: 0.9412, test_f1: 0.5073
 epoch: 62, train_loss: 0.9414, test_loss: 0.9380, test_f1: 0.5156
 epoch: 63, train_loss: 0.9417, test_loss: 0.9397, test_f1: 0.5099
 epoch: 64, train_loss: 0.9430, test_loss: 0.9398, test_f1: 0.5126
 epoch: 65, train_loss: 0.9404, test_loss: 0.9405, test_f1: 0.5128
 epoch: 66, train_loss: 0.9389, test_loss: 0.9359, test_f1: 0.5243
 epoch: 67, train_loss: 0.9335, test_loss: 0.9399, test_f1: 0.5170
 epoch: 68, train_loss: 0.9282, test_loss: 0.9328, test_f1: 0.5190
 epoch: 69, train_loss: 0.9330, test_loss: 0.9345, test_f1: 0.5207
 epoch: 70, train_loss: 0.9262, test_loss: 0.9383, test_f1: 0.5147
 epoch: 71, train_loss: 0.9272, test_loss: 0.9349, test_f1: 0.5123
 epoch: 72, train_loss: 0.9267, test_loss: 0.9339, test_f1: 0.5063
 epoch: 73, train_loss: 0.9200, test_loss: 0.9371, test_f1: 0.5078
 epoch: 74, train_loss: 0.9239, test_loss: 0.9330, test_f1: 0.5125
 epoch: 75, train_loss: 0.9182, test_loss: 0.9378, test_f1: 0.5076
 epoch: 76, train_loss: 0.9251, test_loss: 0.9359, test_f1: 0.5182
 epoch: 77, train_loss: 0.9148, test_loss: 0.9299, test_f1: 0.5173
 epoch: 78, train_loss: 0.9189, test_loss: 0.9330, test_f1: 0.5124
 epoch: 79, train_loss: 0.9221, test_loss: 0.9323, test_f1: 0.5141
 epoch: 80, train_loss: 0.9118, test_loss: 0.9342, test_f1: 0.5171
 epoch: 81, train_loss: 0.9188, test_loss: 0.9317, test_f1: 0.5190
 epoch: 82, train_loss: 0.9155, test_loss: 0.9278, test_f1: 0.5166
 epoch: 83, train_loss: 0.9119, test_loss: 0.9281, test_f1: 0.5155
 epoch: 84, train_loss: 0.9124, test_loss: 0.9311, test_f1: 0.5198
 epoch: 85, train_loss: 0.9108, test_loss: 0.9320, test_f1: 0.5114
 epoch: 86, train_loss: 0.9046, test_loss: 0.9265, test_f1: 0.5088
 epoch: 87, train_loss: 0.9107, test_loss: 0.9312, test_f1: 0.5129
 epoch: 88, train_loss: 0.9137, test_loss: 0.9310, test_f1: 0.5149
 epoch: 89, train_loss: 0.9044, test_loss: 0.9291, test_f1: 0.5139
 epoch: 90, train_loss: 0.9011, test_loss: 0.9277, test_f1: 0.5132
 epoch: 91, train_loss: 0.9033, test_loss: 0.9284, test_f1: 0.5138
 epoch: 92, train_loss: 0.9015, test_loss: 0.9282, test_f1: 0.5091
 epoch: 93, train_loss: 0.9003, test_loss: 0.9320, test_f1: 0.5050
 epoch: 94, train_loss: 0.8944, test_loss: 0.9302, test_f1: 0.5148
 epoch: 95, train_loss: 0.9050, test_loss: 0.9306, test_f1: 0.5161
 epoch: 96, train_loss: 0.8996, test_loss: 0.9323, test_f1: 0.5179
 epoch: 97, train_loss: 0.9035, test_loss: 0.9294, test_f1: 0.5183
 epoch: 98, train_loss: 0.8959, test_loss: 0.9325, test_f1: 0.5205
 epoch: 99, train_loss: 0.8890, test_loss: 0.9301, test_f1: 0.5156
##################ITERATION #2 ****************************************
 epoch: 0, train_loss: 1.3395, test_loss: 1.3635, test_f1: 0.2270
 epoch: 1, train_loss: 1.3081, test_loss: 1.3239, test_f1: 0.3111
 epoch: 2, train_loss: 1.2917, test_loss: 1.2967, test_f1: 0.3114
 epoch: 3, train_loss: 1.2747, test_loss: 1.2787, test_f1: 0.3151
 epoch: 4, train_loss: 1.2596, test_loss: 1.2638, test_f1: 0.3109
 epoch: 5, train_loss: 1.2483, test_loss: 1.2551, test_f1: 0.3071
 epoch: 6, train_loss: 1.2421, test_loss: 1.2461, test_f1: 0.3098
 epoch: 7, train_loss: 1.2309, test_loss: 1.2315, test_f1: 0.3402
 epoch: 8, train_loss: 1.2222, test_loss: 1.2207, test_f1: 0.3572
 epoch: 9, train_loss: 1.2155, test_loss: 1.2151, test_f1: 0.3821
 epoch: 10, train_loss: 1.1988, test_loss: 1.1992, test_f1: 0.3888
 epoch: 11, train_loss: 1.1923, test_loss: 1.1861, test_f1: 0.3873
 epoch: 12, train_loss: 1.1866, test_loss: 1.1796, test_f1: 0.4075
 epoch: 13, train_loss: 1.1767, test_loss: 1.1673, test_f1: 0.4129
 epoch: 14, train_loss: 1.1601, test_loss: 1.1605, test_f1: 0.4337
 epoch: 15, train_loss: 1.1596, test_loss: 1.1496, test_f1: 0.4644
 epoch: 16, train_loss: 1.1497, test_loss: 1.1304, test_f1: 0.4568
 epoch: 17, train_loss: 1.1406, test_loss: 1.1207, test_f1: 0.4695
 epoch: 18, train_loss: 1.1289, test_loss: 1.1138, test_f1: 0.4779
 epoch: 19, train_loss: 1.1148, test_loss: 1.0980, test_f1: 0.4715
 epoch: 20, train_loss: 1.1161, test_loss: 1.0935, test_f1: 0.4861
 epoch: 21, train_loss: 1.1041, test_loss: 1.0786, test_f1: 0.4886
 epoch: 22, train_loss: 1.0946, test_loss: 1.0742, test_f1: 0.4969
 epoch: 23, train_loss: 1.0865, test_loss: 1.0651, test_f1: 0.4958
 epoch: 24, train_loss: 1.0824, test_loss: 1.0584, test_f1: 0.4952
 epoch: 25, train_loss: 1.0786, test_loss: 1.0459, test_f1: 0.4906
 epoch: 26, train_loss: 1.0673, test_loss: 1.0475, test_f1: 0.4892
 epoch: 27, train_loss: 1.0682, test_loss: 1.0365, test_f1: 0.5020
 epoch: 28, train_loss: 1.0645, test_loss: 1.0340, test_f1: 0.4859
 epoch: 29, train_loss: 1.0535, test_loss: 1.0286, test_f1: 0.5053
 epoch: 30, train_loss: 1.0519, test_loss: 1.0255, test_f1: 0.4847
 epoch: 31, train_loss: 1.0359, test_loss: 1.0167, test_f1: 0.4970
 epoch: 32, train_loss: 1.0370, test_loss: 1.0102, test_f1: 0.4949
 epoch: 33, train_loss: 1.0270, test_loss: 1.0066, test_f1: 0.4860
 epoch: 34, train_loss: 1.0252, test_loss: 0.9985, test_f1: 0.4888
 epoch: 35, train_loss: 1.0164, test_loss: 0.9943, test_f1: 0.4928
 epoch: 36, train_loss: 1.0119, test_loss: 0.9962, test_f1: 0.4818
 epoch: 37, train_loss: 1.0126, test_loss: 0.9869, test_f1: 0.4924
 epoch: 38, train_loss: 1.0018, test_loss: 0.9835, test_f1: 0.4991
 epoch: 39, train_loss: 1.0022, test_loss: 0.9802, test_f1: 0.4983
 epoch: 40, train_loss: 1.0012, test_loss: 0.9768, test_f1: 0.4954
 epoch: 41, train_loss: 0.9964, test_loss: 0.9745, test_f1: 0.5069
 epoch: 42, train_loss: 0.9926, test_loss: 0.9669, test_f1: 0.5097
 epoch: 43, train_loss: 0.9872, test_loss: 0.9677, test_f1: 0.5030
 epoch: 44, train_loss: 0.9860, test_loss: 0.9746, test_f1: 0.5086
 epoch: 45, train_loss: 0.9833, test_loss: 0.9651, test_f1: 0.5050
 epoch: 46, train_loss: 0.9868, test_loss: 0.9615, test_f1: 0.5165
 epoch: 47, train_loss: 0.9686, test_loss: 0.9609, test_f1: 0.5271
 epoch: 48, train_loss: 0.9782, test_loss: 0.9579, test_f1: 0.5229
 epoch: 49, train_loss: 0.9716, test_loss: 0.9582, test_f1: 0.5240
 epoch: 50, train_loss: 0.9652, test_loss: 0.9577, test_f1: 0.5217
 epoch: 51, train_loss: 0.9647, test_loss: 0.9537, test_f1: 0.5247
 epoch: 52, train_loss: 0.9588, test_loss: 0.9423, test_f1: 0.5295
 epoch: 53, train_loss: 0.9582, test_loss: 0.9517, test_f1: 0.5287
 epoch: 54, train_loss: 0.9538, test_loss: 0.9508, test_f1: 0.5345
 epoch: 55, train_loss: 0.9537, test_loss: 0.9485, test_f1: 0.5323
 epoch: 56, train_loss: 0.9592, test_loss: 0.9516, test_f1: 0.5278
 epoch: 57, train_loss: 0.9527, test_loss: 0.9382, test_f1: 0.5330
 epoch: 58, train_loss: 0.9568, test_loss: 0.9355, test_f1: 0.5353
 epoch: 59, train_loss: 0.9462, test_loss: 0.9433, test_f1: 0.5315
 epoch: 60, train_loss: 0.9422, test_loss: 0.9338, test_f1: 0.5304
 epoch: 61, train_loss: 0.9404, test_loss: 0.9418, test_f1: 0.5317
 epoch: 62, train_loss: 0.9347, test_loss: 0.9419, test_f1: 0.5277
 epoch: 63, train_loss: 0.9382, test_loss: 0.9385, test_f1: 0.5320
 epoch: 64, train_loss: 0.9439, test_loss: 0.9368, test_f1: 0.5345
 epoch: 65, train_loss: 0.9388, test_loss: 0.9465, test_f1: 0.5298
 epoch: 66, train_loss: 0.9401, test_loss: 0.9450, test_f1: 0.5276
 epoch: 67, train_loss: 0.9369, test_loss: 0.9403, test_f1: 0.5293
 epoch: 68, train_loss: 0.9294, test_loss: 0.9326, test_f1: 0.5316
 epoch: 69, train_loss: 0.9254, test_loss: 0.9406, test_f1: 0.5292
 epoch: 70, train_loss: 0.9285, test_loss: 0.9443, test_f1: 0.5369
 epoch: 71, train_loss: 0.9280, test_loss: 0.9511, test_f1: 0.5346
 epoch: 72, train_loss: 0.9294, test_loss: 0.9338, test_f1: 0.5275
 epoch: 73, train_loss: 0.9214, test_loss: 0.9406, test_f1: 0.5375
 epoch: 74, train_loss: 0.9304, test_loss: 0.9378, test_f1: 0.5348
 epoch: 75, train_loss: 0.9259, test_loss: 0.9389, test_f1: 0.5420
 epoch: 76, train_loss: 0.9267, test_loss: 0.9297, test_f1: 0.5324
 epoch: 77, train_loss: 0.9280, test_loss: 0.9370, test_f1: 0.5336
 epoch: 78, train_loss: 0.9263, test_loss: 0.9333, test_f1: 0.5371
 epoch: 79, train_loss: 0.9231, test_loss: 0.9397, test_f1: 0.5414
 epoch: 80, train_loss: 0.9187, test_loss: 0.9379, test_f1: 0.5370
 epoch: 81, train_loss: 0.9217, test_loss: 0.9333, test_f1: 0.5419
 epoch: 82, train_loss: 0.9211, test_loss: 0.9352, test_f1: 0.5372
 epoch: 83, train_loss: 0.9167, test_loss: 0.9408, test_f1: 0.5448
 epoch: 84, train_loss: 0.9144, test_loss: 0.9330, test_f1: 0.5397
 epoch: 85, train_loss: 0.9141, test_loss: 0.9374, test_f1: 0.5393
 epoch: 86, train_loss: 0.9044, test_loss: 0.9366, test_f1: 0.5437
 epoch: 87, train_loss: 0.9053, test_loss: 0.9415, test_f1: 0.5350
 epoch: 88, train_loss: 0.9069, test_loss: 0.9370, test_f1: 0.5367
 epoch: 89, train_loss: 0.9088, test_loss: 0.9483, test_f1: 0.5358
 epoch: 90, train_loss: 0.9006, test_loss: 0.9362, test_f1: 0.5405
 epoch: 91, train_loss: 0.9040, test_loss: 0.9295, test_f1: 0.5486
 epoch: 92, train_loss: 0.9065, test_loss: 0.9414, test_f1: 0.5355
 epoch: 93, train_loss: 0.9068, test_loss: 0.9399, test_f1: 0.5428
 epoch: 94, train_loss: 0.8968, test_loss: 0.9340, test_f1: 0.5390
 epoch: 95, train_loss: 0.9100, test_loss: 0.9351, test_f1: 0.5469
 epoch: 96, train_loss: 0.9042, test_loss: 0.9330, test_f1: 0.5454
 epoch: 97, train_loss: 0.8979, test_loss: 0.9338, test_f1: 0.5466
 epoch: 98, train_loss: 0.8996, test_loss: 0.9287, test_f1: 0.5488
 epoch: 99, train_loss: 0.8924, test_loss: 0.9429, test_f1: 0.5419
##################ITERATION #3 ****************************************
 epoch: 0, train_loss: 1.3563, test_loss: 1.3938, test_f1: 0.1350
 epoch: 1, train_loss: 1.3080, test_loss: 1.3308, test_f1: 0.2799
 epoch: 2, train_loss: 1.2880, test_loss: 1.2888, test_f1: 0.2717
 epoch: 3, train_loss: 1.2724, test_loss: 1.2634, test_f1: 0.2708
 epoch: 4, train_loss: 1.2624, test_loss: 1.2414, test_f1: 0.2875
 epoch: 5, train_loss: 1.2506, test_loss: 1.2257, test_f1: 0.3057
 epoch: 6, train_loss: 1.2356, test_loss: 1.2111, test_f1: 0.3241
 epoch: 7, train_loss: 1.2240, test_loss: 1.1981, test_f1: 0.3338
 epoch: 8, train_loss: 1.2140, test_loss: 1.1879, test_f1: 0.3669
 epoch: 9, train_loss: 1.2028, test_loss: 1.1745, test_f1: 0.3734
 epoch: 10, train_loss: 1.1990, test_loss: 1.1632, test_f1: 0.3805
 epoch: 11, train_loss: 1.1808, test_loss: 1.1554, test_f1: 0.4070
 epoch: 12, train_loss: 1.1734, test_loss: 1.1424, test_f1: 0.4056
 epoch: 13, train_loss: 1.1634, test_loss: 1.1306, test_f1: 0.4101
 epoch: 14, train_loss: 1.1483, test_loss: 1.1219, test_f1: 0.4177
 epoch: 15, train_loss: 1.1469, test_loss: 1.1059, test_f1: 0.4392
 epoch: 16, train_loss: 1.1306, test_loss: 1.0945, test_f1: 0.4302
 epoch: 17, train_loss: 1.1228, test_loss: 1.0804, test_f1: 0.4492
 epoch: 18, train_loss: 1.1148, test_loss: 1.0679, test_f1: 0.4501
 epoch: 19, train_loss: 1.1015, test_loss: 1.0570, test_f1: 0.4708
 epoch: 20, train_loss: 1.0892, test_loss: 1.0514, test_f1: 0.4545
 epoch: 21, train_loss: 1.0798, test_loss: 1.0412, test_f1: 0.4639
 epoch: 22, train_loss: 1.0733, test_loss: 1.0292, test_f1: 0.4779
 epoch: 23, train_loss: 1.0597, test_loss: 1.0185, test_f1: 0.4767
 epoch: 24, train_loss: 1.0464, test_loss: 1.0108, test_f1: 0.4705
 epoch: 25, train_loss: 1.0417, test_loss: 0.9993, test_f1: 0.4768
 epoch: 26, train_loss: 1.0375, test_loss: 0.9953, test_f1: 0.4680
 epoch: 27, train_loss: 1.0319, test_loss: 0.9885, test_f1: 0.4825
 epoch: 28, train_loss: 1.0131, test_loss: 0.9810, test_f1: 0.4700
 epoch: 29, train_loss: 1.0156, test_loss: 0.9768, test_f1: 0.4708
 epoch: 30, train_loss: 0.9989, test_loss: 0.9739, test_f1: 0.4819
 epoch: 31, train_loss: 0.9999, test_loss: 0.9703, test_f1: 0.4899
 epoch: 32, train_loss: 0.9947, test_loss: 0.9638, test_f1: 0.4900
 epoch: 33, train_loss: 0.9851, test_loss: 0.9548, test_f1: 0.4937
 epoch: 34, train_loss: 0.9754, test_loss: 0.9553, test_f1: 0.4888
 epoch: 35, train_loss: 0.9775, test_loss: 0.9531, test_f1: 0.4898
 epoch: 36, train_loss: 0.9751, test_loss: 0.9467, test_f1: 0.5001
 epoch: 37, train_loss: 0.9594, test_loss: 0.9552, test_f1: 0.4889
 epoch: 38, train_loss: 0.9653, test_loss: 0.9483, test_f1: 0.4907
 epoch: 39, train_loss: 0.9615, test_loss: 0.9471, test_f1: 0.4955
 epoch: 40, train_loss: 0.9451, test_loss: 0.9488, test_f1: 0.4956
 epoch: 41, train_loss: 0.9543, test_loss: 0.9404, test_f1: 0.4936
 epoch: 42, train_loss: 0.9478, test_loss: 0.9451, test_f1: 0.4970
 epoch: 43, train_loss: 0.9389, test_loss: 0.9386, test_f1: 0.4974
 epoch: 44, train_loss: 0.9399, test_loss: 0.9400, test_f1: 0.4957
 epoch: 45, train_loss: 0.9338, test_loss: 0.9496, test_f1: 0.4978
 epoch: 46, train_loss: 0.9394, test_loss: 0.9465, test_f1: 0.5021
 epoch: 47, train_loss: 0.9434, test_loss: 0.9323, test_f1: 0.5081
 epoch: 48, train_loss: 0.9306, test_loss: 0.9401, test_f1: 0.5008
 epoch: 49, train_loss: 0.9258, test_loss: 0.9332, test_f1: 0.5006
 epoch: 50, train_loss: 0.9218, test_loss: 0.9356, test_f1: 0.5039
 epoch: 51, train_loss: 0.9181, test_loss: 0.9407, test_f1: 0.5035
 epoch: 52, train_loss: 0.9095, test_loss: 0.9391, test_f1: 0.4957
 epoch: 53, train_loss: 0.9186, test_loss: 0.9359, test_f1: 0.5070
 epoch: 54, train_loss: 0.9159, test_loss: 0.9386, test_f1: 0.5051
 epoch: 55, train_loss: 0.9115, test_loss: 0.9388, test_f1: 0.5059
 epoch: 56, train_loss: 0.9175, test_loss: 0.9351, test_f1: 0.5090
 epoch: 57, train_loss: 0.9171, test_loss: 0.9386, test_f1: 0.5090
 epoch: 58, train_loss: 0.9102, test_loss: 0.9366, test_f1: 0.5112
 epoch: 59, train_loss: 0.9107, test_loss: 0.9277, test_f1: 0.5085
 epoch: 60, train_loss: 0.9091, test_loss: 0.9359, test_f1: 0.5079
 epoch: 61, train_loss: 0.9119, test_loss: 0.9336, test_f1: 0.5066
 epoch: 62, train_loss: 0.9175, test_loss: 0.9393, test_f1: 0.5071
 epoch: 63, train_loss: 0.9105, test_loss: 0.9373, test_f1: 0.5122
 epoch: 64, train_loss: 0.9083, test_loss: 0.9321, test_f1: 0.5121
 epoch: 65, train_loss: 0.9013, test_loss: 0.9377, test_f1: 0.5079
 epoch: 66, train_loss: 0.9064, test_loss: 0.9399, test_f1: 0.5117
 epoch: 67, train_loss: 0.8943, test_loss: 0.9275, test_f1: 0.5171
 epoch: 68, train_loss: 0.9068, test_loss: 0.9312, test_f1: 0.5121
 epoch: 69, train_loss: 0.8968, test_loss: 0.9339, test_f1: 0.5056
 epoch: 70, train_loss: 0.9007, test_loss: 0.9370, test_f1: 0.5049
 epoch: 71, train_loss: 0.9049, test_loss: 0.9311, test_f1: 0.5107
 epoch: 72, train_loss: 0.8963, test_loss: 0.9339, test_f1: 0.5109
 epoch: 73, train_loss: 0.8936, test_loss: 0.9279, test_f1: 0.5181
 epoch: 74, train_loss: 0.8840, test_loss: 0.9318, test_f1: 0.5025
 epoch: 75, train_loss: 0.8899, test_loss: 0.9320, test_f1: 0.5093
 epoch: 76, train_loss: 0.9003, test_loss: 0.9335, test_f1: 0.5058
 epoch: 77, train_loss: 0.8864, test_loss: 0.9306, test_f1: 0.5121
 epoch: 78, train_loss: 0.8868, test_loss: 0.9322, test_f1: 0.5147
 epoch: 79, train_loss: 0.8868, test_loss: 0.9338, test_f1: 0.5167
 epoch: 80, train_loss: 0.8935, test_loss: 0.9374, test_f1: 0.5166
 epoch: 81, train_loss: 0.8883, test_loss: 0.9457, test_f1: 0.5075
 epoch: 82, train_loss: 0.8937, test_loss: 0.9376, test_f1: 0.5097
 epoch: 83, train_loss: 0.8843, test_loss: 0.9341, test_f1: 0.5093
 epoch: 84, train_loss: 0.8808, test_loss: 0.9344, test_f1: 0.5138
 epoch: 85, train_loss: 0.8856, test_loss: 0.9300, test_f1: 0.5197
 epoch: 86, train_loss: 0.8855, test_loss: 0.9313, test_f1: 0.5139
 epoch: 87, train_loss: 0.8793, test_loss: 0.9358, test_f1: 0.5213
 epoch: 88, train_loss: 0.8876, test_loss: 0.9267, test_f1: 0.5230
 epoch: 89, train_loss: 0.8862, test_loss: 0.9266, test_f1: 0.5122
 epoch: 90, train_loss: 0.8748, test_loss: 0.9318, test_f1: 0.5262
 epoch: 91, train_loss: 0.8882, test_loss: 0.9311, test_f1: 0.5115
 epoch: 92, train_loss: 0.8817, test_loss: 0.9369, test_f1: 0.5092
 epoch: 93, train_loss: 0.8760, test_loss: 0.9248, test_f1: 0.5144
 epoch: 94, train_loss: 0.8775, test_loss: 0.9313, test_f1: 0.5160
 epoch: 95, train_loss: 0.8731, test_loss: 0.9316, test_f1: 0.5157
 epoch: 96, train_loss: 0.8857, test_loss: 0.9357, test_f1: 0.5181
 epoch: 97, train_loss: 0.8792, test_loss: 0.9293, test_f1: 0.5132
 epoch: 98, train_loss: 0.8769, test_loss: 0.9321, test_f1: 0.5228
 epoch: 99, train_loss: 0.8744, test_loss: 0.9282, test_f1: 0.5252
##################ITERATION #4 ****************************************
 epoch: 0, train_loss: 1.4224, test_loss: 1.5748, test_f1: 0.0304
 epoch: 1, train_loss: 1.3444, test_loss: 1.3899, test_f1: 0.2244
 epoch: 2, train_loss: 1.3078, test_loss: 1.3049, test_f1: 0.3119
 epoch: 3, train_loss: 1.2858, test_loss: 1.2661, test_f1: 0.3494
 epoch: 4, train_loss: 1.2680, test_loss: 1.2406, test_f1: 0.3589
 epoch: 5, train_loss: 1.2432, test_loss: 1.2228, test_f1: 0.3695
 epoch: 6, train_loss: 1.2289, test_loss: 1.2002, test_f1: 0.3762
 epoch: 7, train_loss: 1.2147, test_loss: 1.1851, test_f1: 0.3803
 epoch: 8, train_loss: 1.2019, test_loss: 1.1693, test_f1: 0.3960
 epoch: 9, train_loss: 1.1860, test_loss: 1.1492, test_f1: 0.4166
 epoch: 10, train_loss: 1.1737, test_loss: 1.1374, test_f1: 0.4237
 epoch: 11, train_loss: 1.1645, test_loss: 1.1240, test_f1: 0.4178
 epoch: 12, train_loss: 1.1581, test_loss: 1.1100, test_f1: 0.4206
 epoch: 13, train_loss: 1.1386, test_loss: 1.0991, test_f1: 0.4187
 epoch: 14, train_loss: 1.1323, test_loss: 1.0843, test_f1: 0.4238
 epoch: 15, train_loss: 1.1191, test_loss: 1.0786, test_f1: 0.4236
 epoch: 16, train_loss: 1.1122, test_loss: 1.0639, test_f1: 0.4306
 epoch: 17, train_loss: 1.0998, test_loss: 1.0518, test_f1: 0.4302
 epoch: 18, train_loss: 1.0970, test_loss: 1.0437, test_f1: 0.4323
 epoch: 19, train_loss: 1.0796, test_loss: 1.0359, test_f1: 0.4316
 epoch: 20, train_loss: 1.0720, test_loss: 1.0334, test_f1: 0.4290
 epoch: 21, train_loss: 1.0747, test_loss: 1.0248, test_f1: 0.4279
 epoch: 22, train_loss: 1.0570, test_loss: 1.0155, test_f1: 0.4398
 epoch: 23, train_loss: 1.0509, test_loss: 1.0160, test_f1: 0.4356
 epoch: 24, train_loss: 1.0394, test_loss: 1.0086, test_f1: 0.4448
 epoch: 25, train_loss: 1.0369, test_loss: 1.0045, test_f1: 0.4337
 epoch: 26, train_loss: 1.0327, test_loss: 0.9968, test_f1: 0.4375
 epoch: 27, train_loss: 1.0317, test_loss: 0.9937, test_f1: 0.4391
 epoch: 28, train_loss: 1.0246, test_loss: 0.9867, test_f1: 0.4455
 epoch: 29, train_loss: 1.0157, test_loss: 0.9859, test_f1: 0.4703
 epoch: 30, train_loss: 1.0111, test_loss: 0.9741, test_f1: 0.4713
 epoch: 31, train_loss: 1.0030, test_loss: 0.9823, test_f1: 0.4618
 epoch: 32, train_loss: 1.0125, test_loss: 0.9872, test_f1: 0.4676
 epoch: 33, train_loss: 0.9986, test_loss: 0.9797, test_f1: 0.4724
 epoch: 34, train_loss: 0.9838, test_loss: 0.9757, test_f1: 0.4672
 epoch: 35, train_loss: 0.9848, test_loss: 0.9675, test_f1: 0.4910
 epoch: 36, train_loss: 0.9822, test_loss: 0.9752, test_f1: 0.4798
 epoch: 37, train_loss: 0.9690, test_loss: 0.9650, test_f1: 0.4913
 epoch: 38, train_loss: 0.9804, test_loss: 0.9753, test_f1: 0.4805
 epoch: 39, train_loss: 0.9689, test_loss: 0.9722, test_f1: 0.4831
 epoch: 40, train_loss: 0.9661, test_loss: 0.9805, test_f1: 0.4958
 epoch: 41, train_loss: 0.9677, test_loss: 0.9683, test_f1: 0.5025
 epoch: 42, train_loss: 0.9651, test_loss: 0.9637, test_f1: 0.5092
 epoch: 43, train_loss: 0.9523, test_loss: 0.9621, test_f1: 0.5118
 epoch: 44, train_loss: 0.9490, test_loss: 0.9579, test_f1: 0.5153
 epoch: 45, train_loss: 0.9492, test_loss: 0.9599, test_f1: 0.5130
 epoch: 46, train_loss: 0.9459, test_loss: 0.9597, test_f1: 0.5090
 epoch: 47, train_loss: 0.9437, test_loss: 0.9556, test_f1: 0.5116
 epoch: 48, train_loss: 0.9389, test_loss: 0.9546, test_f1: 0.5083
 epoch: 49, train_loss: 0.9330, test_loss: 0.9532, test_f1: 0.5205
 epoch: 50, train_loss: 0.9448, test_loss: 0.9614, test_f1: 0.5058
 epoch: 51, train_loss: 0.9324, test_loss: 0.9498, test_f1: 0.5110
 epoch: 52, train_loss: 0.9287, test_loss: 0.9462, test_f1: 0.5163
 epoch: 53, train_loss: 0.9277, test_loss: 0.9514, test_f1: 0.5123
 epoch: 54, train_loss: 0.9255, test_loss: 0.9503, test_f1: 0.5237
 epoch: 55, train_loss: 0.9202, test_loss: 0.9507, test_f1: 0.5086
 epoch: 56, train_loss: 0.9272, test_loss: 0.9442, test_f1: 0.5143
 epoch: 57, train_loss: 0.9252, test_loss: 0.9487, test_f1: 0.5136
 epoch: 58, train_loss: 0.9305, test_loss: 0.9551, test_f1: 0.5119
 epoch: 59, train_loss: 0.9195, test_loss: 0.9564, test_f1: 0.5103
 epoch: 60, train_loss: 0.9216, test_loss: 0.9505, test_f1: 0.5142
 epoch: 61, train_loss: 0.9159, test_loss: 0.9516, test_f1: 0.5112
 epoch: 62, train_loss: 0.9228, test_loss: 0.9467, test_f1: 0.5157
 epoch: 63, train_loss: 0.9134, test_loss: 0.9486, test_f1: 0.5159
 epoch: 64, train_loss: 0.9179, test_loss: 0.9508, test_f1: 0.5112
 epoch: 65, train_loss: 0.9216, test_loss: 0.9487, test_f1: 0.5127
 epoch: 66, train_loss: 0.9133, test_loss: 0.9443, test_f1: 0.5154
 epoch: 67, train_loss: 0.9130, test_loss: 0.9475, test_f1: 0.5151
 epoch: 68, train_loss: 0.9154, test_loss: 0.9461, test_f1: 0.5120
 epoch: 69, train_loss: 0.9162, test_loss: 0.9440, test_f1: 0.5098
 epoch: 70, train_loss: 0.9113, test_loss: 0.9369, test_f1: 0.5161
 epoch: 71, train_loss: 0.9072, test_loss: 0.9388, test_f1: 0.5151
 epoch: 72, train_loss: 0.9036, test_loss: 0.9432, test_f1: 0.5102
 epoch: 73, train_loss: 0.9018, test_loss: 0.9460, test_f1: 0.5169
 epoch: 74, train_loss: 0.9001, test_loss: 0.9389, test_f1: 0.5201
 epoch: 75, train_loss: 0.9097, test_loss: 0.9439, test_f1: 0.5161
 epoch: 76, train_loss: 0.8985, test_loss: 0.9445, test_f1: 0.5143
 epoch: 77, train_loss: 0.9072, test_loss: 0.9373, test_f1: 0.5157
 epoch: 78, train_loss: 0.9026, test_loss: 0.9428, test_f1: 0.5151
 epoch: 79, train_loss: 0.9022, test_loss: 0.9435, test_f1: 0.5144
 epoch: 80, train_loss: 0.8987, test_loss: 0.9431, test_f1: 0.5175
 epoch: 81, train_loss: 0.9026, test_loss: 0.9415, test_f1: 0.5255
 epoch: 82, train_loss: 0.9015, test_loss: 0.9396, test_f1: 0.5229
 epoch: 83, train_loss: 0.9017, test_loss: 0.9392, test_f1: 0.5216
 epoch: 84, train_loss: 0.8928, test_loss: 0.9377, test_f1: 0.5221
 epoch: 85, train_loss: 0.9020, test_loss: 0.9385, test_f1: 0.5194
 epoch: 86, train_loss: 0.9002, test_loss: 0.9399, test_f1: 0.5163
 epoch: 87, train_loss: 0.8942, test_loss: 0.9390, test_f1: 0.5203
 epoch: 88, train_loss: 0.8929, test_loss: 0.9374, test_f1: 0.5164
 epoch: 89, train_loss: 0.8910, test_loss: 0.9365, test_f1: 0.5198
 epoch: 90, train_loss: 0.8966, test_loss: 0.9415, test_f1: 0.5170
 epoch: 91, train_loss: 0.8901, test_loss: 0.9344, test_f1: 0.5202
 epoch: 92, train_loss: 0.8918, test_loss: 0.9471, test_f1: 0.5120
 epoch: 93, train_loss: 0.8889, test_loss: 0.9389, test_f1: 0.5216
 epoch: 94, train_loss: 0.8900, test_loss: 0.9475, test_f1: 0.5101
 epoch: 95, train_loss: 0.8867, test_loss: 0.9413, test_f1: 0.5223
 epoch: 96, train_loss: 0.8867, test_loss: 0.9377, test_f1: 0.5159
 epoch: 97, train_loss: 0.8795, test_loss: 0.9365, test_f1: 0.5227
 epoch: 98, train_loss: 0.8917, test_loss: 0.9294, test_f1: 0.5243
 epoch: 99, train_loss: 0.8858, test_loss: 0.9404, test_f1: 0.5236
##################ITERATION #5 ****************************************
 epoch: 0, train_loss: 1.2976, test_loss: 1.3082, test_f1: 0.2270
 epoch: 1, train_loss: 1.2639, test_loss: 1.2678, test_f1: 0.2270
 epoch: 2, train_loss: 1.2492, test_loss: 1.2215, test_f1: 0.3012
 epoch: 3, train_loss: 1.2346, test_loss: 1.2008, test_f1: 0.3347
 epoch: 4, train_loss: 1.2181, test_loss: 1.1818, test_f1: 0.3498
 epoch: 5, train_loss: 1.2034, test_loss: 1.1675, test_f1: 0.3766
 epoch: 6, train_loss: 1.2053, test_loss: 1.1527, test_f1: 0.3989
 epoch: 7, train_loss: 1.1852, test_loss: 1.1448, test_f1: 0.4011
 epoch: 8, train_loss: 1.1788, test_loss: 1.1298, test_f1: 0.4117
 epoch: 9, train_loss: 1.1790, test_loss: 1.1155, test_f1: 0.4279
 epoch: 10, train_loss: 1.1569, test_loss: 1.1055, test_f1: 0.4428
 epoch: 11, train_loss: 1.1509, test_loss: 1.0952, test_f1: 0.4461
 epoch: 12, train_loss: 1.1394, test_loss: 1.0867, test_f1: 0.4392
 epoch: 13, train_loss: 1.1238, test_loss: 1.0762, test_f1: 0.4401
 epoch: 14, train_loss: 1.1115, test_loss: 1.0616, test_f1: 0.4430
 epoch: 15, train_loss: 1.1110, test_loss: 1.0561, test_f1: 0.4467
 epoch: 16, train_loss: 1.0984, test_loss: 1.0506, test_f1: 0.4604
 epoch: 17, train_loss: 1.0889, test_loss: 1.0382, test_f1: 0.4514
 epoch: 18, train_loss: 1.0793, test_loss: 1.0293, test_f1: 0.4546
 epoch: 19, train_loss: 1.0713, test_loss: 1.0188, test_f1: 0.4486
 epoch: 20, train_loss: 1.0611, test_loss: 1.0140, test_f1: 0.4660
 epoch: 21, train_loss: 1.0588, test_loss: 1.0069, test_f1: 0.4539
 epoch: 22, train_loss: 1.0503, test_loss: 1.0028, test_f1: 0.4517
 epoch: 23, train_loss: 1.0521, test_loss: 0.9934, test_f1: 0.4652
 epoch: 24, train_loss: 1.0375, test_loss: 0.9917, test_f1: 0.4624
 epoch: 25, train_loss: 1.0346, test_loss: 0.9872, test_f1: 0.4629
 epoch: 26, train_loss: 1.0271, test_loss: 0.9821, test_f1: 0.4718
 epoch: 27, train_loss: 1.0185, test_loss: 0.9790, test_f1: 0.4729
 epoch: 28, train_loss: 1.0158, test_loss: 0.9743, test_f1: 0.4792
 epoch: 29, train_loss: 1.0045, test_loss: 0.9755, test_f1: 0.4716
 epoch: 30, train_loss: 1.0089, test_loss: 0.9732, test_f1: 0.4754
 epoch: 31, train_loss: 1.0000, test_loss: 0.9641, test_f1: 0.4884
 epoch: 32, train_loss: 1.0052, test_loss: 0.9704, test_f1: 0.4712
 epoch: 33, train_loss: 0.9943, test_loss: 0.9633, test_f1: 0.4833
 epoch: 34, train_loss: 0.9825, test_loss: 0.9708, test_f1: 0.4790
 epoch: 35, train_loss: 0.9867, test_loss: 0.9564, test_f1: 0.4752
 epoch: 36, train_loss: 0.9764, test_loss: 0.9529, test_f1: 0.4870
 epoch: 37, train_loss: 0.9720, test_loss: 0.9533, test_f1: 0.4851
 epoch: 38, train_loss: 0.9713, test_loss: 0.9545, test_f1: 0.4727
 epoch: 39, train_loss: 0.9694, test_loss: 0.9552, test_f1: 0.4784
 epoch: 40, train_loss: 0.9663, test_loss: 0.9478, test_f1: 0.4814
 epoch: 41, train_loss: 0.9547, test_loss: 0.9483, test_f1: 0.4750
 epoch: 42, train_loss: 0.9536, test_loss: 0.9460, test_f1: 0.4926
 epoch: 43, train_loss: 0.9563, test_loss: 0.9441, test_f1: 0.4911
 epoch: 44, train_loss: 0.9449, test_loss: 0.9455, test_f1: 0.4788
 epoch: 45, train_loss: 0.9465, test_loss: 0.9433, test_f1: 0.4869
 epoch: 46, train_loss: 0.9484, test_loss: 0.9483, test_f1: 0.4795
 epoch: 47, train_loss: 0.9513, test_loss: 0.9418, test_f1: 0.4845
 epoch: 48, train_loss: 0.9362, test_loss: 0.9401, test_f1: 0.4923
 epoch: 49, train_loss: 0.9251, test_loss: 0.9385, test_f1: 0.4997
 epoch: 50, train_loss: 0.9322, test_loss: 0.9401, test_f1: 0.5003
 epoch: 51, train_loss: 0.9317, test_loss: 0.9407, test_f1: 0.5026
 epoch: 52, train_loss: 0.9312, test_loss: 0.9395, test_f1: 0.4968
 epoch: 53, train_loss: 0.9167, test_loss: 0.9421, test_f1: 0.5044
 epoch: 54, train_loss: 0.9277, test_loss: 0.9407, test_f1: 0.5083
 epoch: 55, train_loss: 0.9284, test_loss: 0.9446, test_f1: 0.5106
 epoch: 56, train_loss: 0.9263, test_loss: 0.9414, test_f1: 0.5067
 epoch: 57, train_loss: 0.9161, test_loss: 0.9422, test_f1: 0.5134
 epoch: 58, train_loss: 0.9238, test_loss: 0.9486, test_f1: 0.5002
 epoch: 59, train_loss: 0.9171, test_loss: 0.9440, test_f1: 0.5005
 epoch: 60, train_loss: 0.9141, test_loss: 0.9484, test_f1: 0.5003
 epoch: 61, train_loss: 0.9129, test_loss: 0.9406, test_f1: 0.5051
 epoch: 62, train_loss: 0.9113, test_loss: 0.9402, test_f1: 0.5043
 epoch: 63, train_loss: 0.9208, test_loss: 0.9447, test_f1: 0.5023
 epoch: 64, train_loss: 0.9122, test_loss: 0.9420, test_f1: 0.5087
 epoch: 65, train_loss: 0.9100, test_loss: 0.9415, test_f1: 0.4993
 epoch: 66, train_loss: 0.9024, test_loss: 0.9433, test_f1: 0.5029
 epoch: 67, train_loss: 0.9125, test_loss: 0.9433, test_f1: 0.5103
 epoch: 68, train_loss: 0.9109, test_loss: 0.9438, test_f1: 0.5041
 epoch: 69, train_loss: 0.9109, test_loss: 0.9412, test_f1: 0.4981
 epoch: 70, train_loss: 0.9042, test_loss: 0.9436, test_f1: 0.5052
 epoch: 71, train_loss: 0.9092, test_loss: 0.9415, test_f1: 0.5112
 epoch: 72, train_loss: 0.9026, test_loss: 0.9413, test_f1: 0.5191
 epoch: 73, train_loss: 0.8976, test_loss: 0.9464, test_f1: 0.5179
 epoch: 74, train_loss: 0.8977, test_loss: 0.9384, test_f1: 0.5043
 epoch: 75, train_loss: 0.8995, test_loss: 0.9398, test_f1: 0.5100
 epoch: 76, train_loss: 0.8985, test_loss: 0.9401, test_f1: 0.5097
 epoch: 77, train_loss: 0.8987, test_loss: 0.9443, test_f1: 0.5108
 epoch: 78, train_loss: 0.8897, test_loss: 0.9398, test_f1: 0.5106
 epoch: 79, train_loss: 0.8966, test_loss: 0.9421, test_f1: 0.5072
 epoch: 80, train_loss: 0.9027, test_loss: 0.9369, test_f1: 0.5108
 epoch: 81, train_loss: 0.8969, test_loss: 0.9403, test_f1: 0.5129
 epoch: 82, train_loss: 0.8959, test_loss: 0.9409, test_f1: 0.5123
 epoch: 83, train_loss: 0.8860, test_loss: 0.9382, test_f1: 0.5173
 epoch: 84, train_loss: 0.8986, test_loss: 0.9375, test_f1: 0.5136
 epoch: 85, train_loss: 0.8919, test_loss: 0.9425, test_f1: 0.5079
 epoch: 86, train_loss: 0.9008, test_loss: 0.9437, test_f1: 0.5136
 epoch: 87, train_loss: 0.8892, test_loss: 0.9399, test_f1: 0.5164
 epoch: 88, train_loss: 0.8853, test_loss: 0.9361, test_f1: 0.5108
 epoch: 89, train_loss: 0.8868, test_loss: 0.9377, test_f1: 0.5211
 epoch: 90, train_loss: 0.8896, test_loss: 0.9365, test_f1: 0.5248
 epoch: 91, train_loss: 0.8810, test_loss: 0.9423, test_f1: 0.5211
 epoch: 92, train_loss: 0.8865, test_loss: 0.9416, test_f1: 0.5177
 epoch: 93, train_loss: 0.8803, test_loss: 0.9390, test_f1: 0.5151
 epoch: 94, train_loss: 0.8832, test_loss: 0.9364, test_f1: 0.5210
 epoch: 95, train_loss: 0.8834, test_loss: 0.9463, test_f1: 0.5149
 epoch: 96, train_loss: 0.8804, test_loss: 0.9420, test_f1: 0.5192
 epoch: 97, train_loss: 0.8802, test_loss: 0.9451, test_f1: 0.5206
 epoch: 98, train_loss: 0.8765, test_loss: 0.9486, test_f1: 0.5156
 epoch: 99, train_loss: 0.8790, test_loss: 0.9408, test_f1: 0.5172
##################ITERATION #6 ****************************************
 epoch: 0, train_loss: 1.2751, test_loss: 1.3129, test_f1: 0.2270
 epoch: 1, train_loss: 1.2371, test_loss: 1.2470, test_f1: 0.2696
 epoch: 2, train_loss: 1.2186, test_loss: 1.1892, test_f1: 0.3684
 epoch: 3, train_loss: 1.2024, test_loss: 1.1558, test_f1: 0.3732
 epoch: 4, train_loss: 1.1815, test_loss: 1.1431, test_f1: 0.3943
 epoch: 5, train_loss: 1.1738, test_loss: 1.1279, test_f1: 0.4154
 epoch: 6, train_loss: 1.1641, test_loss: 1.1150, test_f1: 0.4104
 epoch: 7, train_loss: 1.1531, test_loss: 1.1063, test_f1: 0.4189
 epoch: 8, train_loss: 1.1485, test_loss: 1.0927, test_f1: 0.4246
 epoch: 9, train_loss: 1.1332, test_loss: 1.0829, test_f1: 0.4351
 epoch: 10, train_loss: 1.1275, test_loss: 1.0719, test_f1: 0.4345
 epoch: 11, train_loss: 1.1187, test_loss: 1.0633, test_f1: 0.4344
 epoch: 12, train_loss: 1.1053, test_loss: 1.0530, test_f1: 0.4374
 epoch: 13, train_loss: 1.0972, test_loss: 1.0404, test_f1: 0.4610
 epoch: 14, train_loss: 1.0915, test_loss: 1.0282, test_f1: 0.4581
 epoch: 15, train_loss: 1.0792, test_loss: 1.0253, test_f1: 0.4401
 epoch: 16, train_loss: 1.0639, test_loss: 1.0156, test_f1: 0.4555
 epoch: 17, train_loss: 1.0633, test_loss: 1.0129, test_f1: 0.4566
 epoch: 18, train_loss: 1.0649, test_loss: 1.0033, test_f1: 0.4572
 epoch: 19, train_loss: 1.0495, test_loss: 1.0006, test_f1: 0.4612
 epoch: 20, train_loss: 1.0430, test_loss: 0.9884, test_f1: 0.4741
 epoch: 21, train_loss: 1.0346, test_loss: 0.9852, test_f1: 0.4690
 epoch: 22, train_loss: 1.0229, test_loss: 0.9785, test_f1: 0.4615
 epoch: 23, train_loss: 1.0309, test_loss: 0.9728, test_f1: 0.4737
 epoch: 24, train_loss: 1.0107, test_loss: 0.9784, test_f1: 0.4583
 epoch: 25, train_loss: 1.0100, test_loss: 0.9711, test_f1: 0.4562
 epoch: 26, train_loss: 1.0123, test_loss: 0.9616, test_f1: 0.4680
 epoch: 27, train_loss: 1.0004, test_loss: 0.9559, test_f1: 0.4697
 epoch: 28, train_loss: 0.9951, test_loss: 0.9551, test_f1: 0.4711
 epoch: 29, train_loss: 0.9882, test_loss: 0.9591, test_f1: 0.4804
 epoch: 30, train_loss: 0.9842, test_loss: 0.9574, test_f1: 0.4643
 epoch: 31, train_loss: 0.9788, test_loss: 0.9539, test_f1: 0.4689
 epoch: 32, train_loss: 0.9743, test_loss: 0.9410, test_f1: 0.4805
 epoch: 33, train_loss: 0.9750, test_loss: 0.9442, test_f1: 0.4752
 epoch: 34, train_loss: 0.9672, test_loss: 0.9496, test_f1: 0.4758
 epoch: 35, train_loss: 0.9772, test_loss: 0.9308, test_f1: 0.5210
 epoch: 36, train_loss: 0.9609, test_loss: 0.9358, test_f1: 0.5035
 epoch: 37, train_loss: 0.9550, test_loss: 0.9431, test_f1: 0.4756
 epoch: 38, train_loss: 0.9471, test_loss: 0.9351, test_f1: 0.5133
 epoch: 39, train_loss: 0.9589, test_loss: 0.9438, test_f1: 0.4773
 epoch: 40, train_loss: 0.9542, test_loss: 0.9269, test_f1: 0.5101
 epoch: 41, train_loss: 0.9468, test_loss: 0.9361, test_f1: 0.5224
 epoch: 42, train_loss: 0.9449, test_loss: 0.9309, test_f1: 0.5027
 epoch: 43, train_loss: 0.9385, test_loss: 0.9464, test_f1: 0.5085
 epoch: 44, train_loss: 0.9304, test_loss: 0.9285, test_f1: 0.5080
 epoch: 45, train_loss: 0.9313, test_loss: 0.9423, test_f1: 0.4970
 epoch: 46, train_loss: 0.9336, test_loss: 0.9211, test_f1: 0.5255
 epoch: 47, train_loss: 0.9288, test_loss: 0.9342, test_f1: 0.4964
 epoch: 48, train_loss: 0.9329, test_loss: 0.9284, test_f1: 0.5097
 epoch: 49, train_loss: 0.9206, test_loss: 0.9215, test_f1: 0.5210
 epoch: 50, train_loss: 0.9229, test_loss: 0.9310, test_f1: 0.5213
 epoch: 51, train_loss: 0.9198, test_loss: 0.9199, test_f1: 0.5244
 epoch: 52, train_loss: 0.9135, test_loss: 0.9261, test_f1: 0.5063
 epoch: 53, train_loss: 0.9166, test_loss: 0.9227, test_f1: 0.5172
 epoch: 54, train_loss: 0.9207, test_loss: 0.9269, test_f1: 0.5268
 epoch: 55, train_loss: 0.9166, test_loss: 0.9134, test_f1: 0.5238
 epoch: 56, train_loss: 0.9056, test_loss: 0.9359, test_f1: 0.5270
 epoch: 57, train_loss: 0.9167, test_loss: 0.9272, test_f1: 0.5046
 epoch: 58, train_loss: 0.9047, test_loss: 0.9224, test_f1: 0.5280
 epoch: 59, train_loss: 0.9099, test_loss: 0.9238, test_f1: 0.5267
 epoch: 60, train_loss: 0.9109, test_loss: 0.9190, test_f1: 0.5270
 epoch: 61, train_loss: 0.9000, test_loss: 0.9266, test_f1: 0.5214
 epoch: 62, train_loss: 0.9025, test_loss: 0.9249, test_f1: 0.5379
 epoch: 63, train_loss: 0.9086, test_loss: 0.9260, test_f1: 0.5160
 epoch: 64, train_loss: 0.9061, test_loss: 0.9309, test_f1: 0.5207
 epoch: 65, train_loss: 0.9042, test_loss: 0.9315, test_f1: 0.5162
 epoch: 66, train_loss: 0.9018, test_loss: 0.9274, test_f1: 0.5229
 epoch: 67, train_loss: 0.8926, test_loss: 0.9372, test_f1: 0.5226
 epoch: 68, train_loss: 0.8929, test_loss: 0.9224, test_f1: 0.5270
 epoch: 69, train_loss: 0.8983, test_loss: 0.9423, test_f1: 0.5264
 epoch: 70, train_loss: 0.8994, test_loss: 0.9344, test_f1: 0.5192
 epoch: 71, train_loss: 0.9060, test_loss: 0.9239, test_f1: 0.5186
 epoch: 72, train_loss: 0.8842, test_loss: 0.9150, test_f1: 0.5237
 epoch: 73, train_loss: 0.8906, test_loss: 0.9293, test_f1: 0.5298
 epoch: 74, train_loss: 0.8925, test_loss: 0.9279, test_f1: 0.5253
 epoch: 75, train_loss: 0.8879, test_loss: 0.9327, test_f1: 0.5337
 epoch: 76, train_loss: 0.9001, test_loss: 0.9321, test_f1: 0.5234
 epoch: 77, train_loss: 0.8874, test_loss: 0.9351, test_f1: 0.5286
 epoch: 78, train_loss: 0.8897, test_loss: 0.9353, test_f1: 0.5267
 epoch: 79, train_loss: 0.8863, test_loss: 0.9336, test_f1: 0.5273
 epoch: 80, train_loss: 0.8872, test_loss: 0.9378, test_f1: 0.5298
 epoch: 81, train_loss: 0.8840, test_loss: 0.9335, test_f1: 0.5393
 epoch: 82, train_loss: 0.8836, test_loss: 0.9344, test_f1: 0.5322
 epoch: 83, train_loss: 0.8756, test_loss: 0.9331, test_f1: 0.5431
 epoch: 84, train_loss: 0.8845, test_loss: 0.9356, test_f1: 0.5223
 epoch: 85, train_loss: 0.8836, test_loss: 0.9388, test_f1: 0.5321
 epoch: 86, train_loss: 0.8868, test_loss: 0.9340, test_f1: 0.5313
 epoch: 87, train_loss: 0.8843, test_loss: 0.9325, test_f1: 0.5254
 epoch: 88, train_loss: 0.8822, test_loss: 0.9301, test_f1: 0.5247
 epoch: 89, train_loss: 0.8742, test_loss: 0.9276, test_f1: 0.5454
 epoch: 90, train_loss: 0.8832, test_loss: 0.9323, test_f1: 0.5357
 epoch: 91, train_loss: 0.8702, test_loss: 0.9333, test_f1: 0.5260
 epoch: 92, train_loss: 0.8682, test_loss: 0.9274, test_f1: 0.5333
 epoch: 93, train_loss: 0.8688, test_loss: 0.9311, test_f1: 0.5232
 epoch: 94, train_loss: 0.8705, test_loss: 0.9276, test_f1: 0.5358
 epoch: 95, train_loss: 0.8897, test_loss: 0.9381, test_f1: 0.5253
 epoch: 96, train_loss: 0.8803, test_loss: 0.9470, test_f1: 0.5421
 epoch: 97, train_loss: 0.8762, test_loss: 0.9317, test_f1: 0.5402
 epoch: 98, train_loss: 0.8770, test_loss: 0.9322, test_f1: 0.5378
 epoch: 99, train_loss: 0.8745, test_loss: 0.9245, test_f1: 0.5425
##################ITERATION #7 ****************************************
 epoch: 0, train_loss: 1.3382, test_loss: 1.3163, test_f1: 0.2270
 epoch: 1, train_loss: 1.2758, test_loss: 1.3042, test_f1: 0.2853
 epoch: 2, train_loss: 1.2449, test_loss: 1.2188, test_f1: 0.3159
 epoch: 3, train_loss: 1.2246, test_loss: 1.1805, test_f1: 0.3424
 epoch: 4, train_loss: 1.2092, test_loss: 1.1575, test_f1: 0.3694
 epoch: 5, train_loss: 1.1921, test_loss: 1.1388, test_f1: 0.3841
 epoch: 6, train_loss: 1.1755, test_loss: 1.1215, test_f1: 0.3960
 epoch: 7, train_loss: 1.1548, test_loss: 1.1028, test_f1: 0.3947
 epoch: 8, train_loss: 1.1465, test_loss: 1.0913, test_f1: 0.4020
 epoch: 9, train_loss: 1.1301, test_loss: 1.0754, test_f1: 0.4120
 epoch: 10, train_loss: 1.1245, test_loss: 1.0591, test_f1: 0.4550
 epoch: 11, train_loss: 1.1026, test_loss: 1.0502, test_f1: 0.4635
 epoch: 12, train_loss: 1.0916, test_loss: 1.0419, test_f1: 0.4534
 epoch: 13, train_loss: 1.0874, test_loss: 1.0262, test_f1: 0.4738
 epoch: 14, train_loss: 1.0778, test_loss: 1.0190, test_f1: 0.4799
 epoch: 15, train_loss: 1.0702, test_loss: 1.0057, test_f1: 0.4811
 epoch: 16, train_loss: 1.0610, test_loss: 1.0041, test_f1: 0.4950
 epoch: 17, train_loss: 1.0617, test_loss: 0.9939, test_f1: 0.4920
 epoch: 18, train_loss: 1.0443, test_loss: 0.9900, test_f1: 0.5091
 epoch: 19, train_loss: 1.0374, test_loss: 0.9857, test_f1: 0.4905
 epoch: 20, train_loss: 1.0331, test_loss: 0.9877, test_f1: 0.4856
 epoch: 21, train_loss: 1.0182, test_loss: 0.9758, test_f1: 0.4982
 epoch: 22, train_loss: 1.0235, test_loss: 0.9729, test_f1: 0.4926
 epoch: 23, train_loss: 1.0126, test_loss: 0.9641, test_f1: 0.4801
 epoch: 24, train_loss: 0.9996, test_loss: 0.9709, test_f1: 0.4841
 epoch: 25, train_loss: 1.0099, test_loss: 0.9713, test_f1: 0.4926
 epoch: 26, train_loss: 1.0036, test_loss: 0.9597, test_f1: 0.4866
 epoch: 27, train_loss: 0.9883, test_loss: 0.9521, test_f1: 0.4966
 epoch: 28, train_loss: 0.9916, test_loss: 0.9547, test_f1: 0.4962
 epoch: 29, train_loss: 0.9849, test_loss: 0.9618, test_f1: 0.5079
 epoch: 30, train_loss: 0.9840, test_loss: 0.9529, test_f1: 0.5007
 epoch: 31, train_loss: 0.9754, test_loss: 0.9563, test_f1: 0.5046
 epoch: 32, train_loss: 0.9630, test_loss: 0.9539, test_f1: 0.5111
 epoch: 33, train_loss: 0.9673, test_loss: 0.9494, test_f1: 0.5001
 epoch: 34, train_loss: 0.9615, test_loss: 0.9504, test_f1: 0.5177
 epoch: 35, train_loss: 0.9554, test_loss: 0.9597, test_f1: 0.4973
 epoch: 36, train_loss: 0.9587, test_loss: 0.9470, test_f1: 0.5081
 epoch: 37, train_loss: 0.9536, test_loss: 0.9405, test_f1: 0.5123
 epoch: 38, train_loss: 0.9544, test_loss: 0.9447, test_f1: 0.5065
 epoch: 39, train_loss: 0.9466, test_loss: 0.9474, test_f1: 0.5074
 epoch: 40, train_loss: 0.9439, test_loss: 0.9495, test_f1: 0.5225
 epoch: 41, train_loss: 0.9372, test_loss: 0.9380, test_f1: 0.5161
 epoch: 42, train_loss: 0.9454, test_loss: 0.9330, test_f1: 0.5258
 epoch: 43, train_loss: 0.9353, test_loss: 0.9318, test_f1: 0.5275
 epoch: 44, train_loss: 0.9280, test_loss: 0.9427, test_f1: 0.5299
 epoch: 45, train_loss: 0.9299, test_loss: 0.9421, test_f1: 0.5136
 epoch: 46, train_loss: 0.9257, test_loss: 0.9490, test_f1: 0.5191
 epoch: 47, train_loss: 0.9273, test_loss: 0.9267, test_f1: 0.5220
 epoch: 48, train_loss: 0.9231, test_loss: 0.9379, test_f1: 0.5159
 epoch: 49, train_loss: 0.9166, test_loss: 0.9384, test_f1: 0.5226
 epoch: 50, train_loss: 0.9148, test_loss: 0.9236, test_f1: 0.5236
 epoch: 51, train_loss: 0.9139, test_loss: 0.9313, test_f1: 0.5290
 epoch: 52, train_loss: 0.9160, test_loss: 0.9272, test_f1: 0.5255
 epoch: 53, train_loss: 0.8971, test_loss: 0.9369, test_f1: 0.5307
 epoch: 54, train_loss: 0.9154, test_loss: 0.9373, test_f1: 0.5254
 epoch: 55, train_loss: 0.9111, test_loss: 0.9307, test_f1: 0.5301
 epoch: 56, train_loss: 0.9095, test_loss: 0.9324, test_f1: 0.5190
 epoch: 57, train_loss: 0.9067, test_loss: 0.9299, test_f1: 0.5307
 epoch: 58, train_loss: 0.9082, test_loss: 0.9305, test_f1: 0.5132
 epoch: 59, train_loss: 0.8979, test_loss: 0.9255, test_f1: 0.5382
 epoch: 60, train_loss: 0.8958, test_loss: 0.9317, test_f1: 0.5234
 epoch: 61, train_loss: 0.9060, test_loss: 0.9302, test_f1: 0.5216
 epoch: 62, train_loss: 0.8970, test_loss: 0.9259, test_f1: 0.5257
 epoch: 63, train_loss: 0.8916, test_loss: 0.9347, test_f1: 0.5266
 epoch: 64, train_loss: 0.8948, test_loss: 0.9280, test_f1: 0.5355
 epoch: 65, train_loss: 0.9027, test_loss: 0.9362, test_f1: 0.5234
 epoch: 66, train_loss: 0.8960, test_loss: 0.9325, test_f1: 0.5363
 epoch: 67, train_loss: 0.8871, test_loss: 0.9326, test_f1: 0.5342
 epoch: 68, train_loss: 0.8939, test_loss: 0.9327, test_f1: 0.5350
 epoch: 69, train_loss: 0.9030, test_loss: 0.9301, test_f1: 0.5335
 epoch: 70, train_loss: 0.8890, test_loss: 0.9326, test_f1: 0.5334
 epoch: 71, train_loss: 0.8919, test_loss: 0.9329, test_f1: 0.5338
 epoch: 72, train_loss: 0.8789, test_loss: 0.9296, test_f1: 0.5363
 epoch: 73, train_loss: 0.8834, test_loss: 0.9340, test_f1: 0.5297
 epoch: 74, train_loss: 0.8766, test_loss: 0.9268, test_f1: 0.5291
 epoch: 75, train_loss: 0.8895, test_loss: 0.9358, test_f1: 0.5312
 epoch: 76, train_loss: 0.8879, test_loss: 0.9319, test_f1: 0.5299
 epoch: 77, train_loss: 0.8868, test_loss: 0.9316, test_f1: 0.5404
 epoch: 78, train_loss: 0.8817, test_loss: 0.9232, test_f1: 0.5324
 epoch: 79, train_loss: 0.8792, test_loss: 0.9218, test_f1: 0.5390
 epoch: 80, train_loss: 0.8772, test_loss: 0.9270, test_f1: 0.5357
 epoch: 81, train_loss: 0.8760, test_loss: 0.9285, test_f1: 0.5349
 epoch: 82, train_loss: 0.8878, test_loss: 0.9215, test_f1: 0.5366
 epoch: 83, train_loss: 0.8741, test_loss: 0.9285, test_f1: 0.5389
 epoch: 84, train_loss: 0.8754, test_loss: 0.9256, test_f1: 0.5410
 epoch: 85, train_loss: 0.8721, test_loss: 0.9275, test_f1: 0.5387
 epoch: 86, train_loss: 0.8727, test_loss: 0.9278, test_f1: 0.5306
 epoch: 87, train_loss: 0.8649, test_loss: 0.9268, test_f1: 0.5347
 epoch: 88, train_loss: 0.8818, test_loss: 0.9172, test_f1: 0.5386
 epoch: 89, train_loss: 0.8717, test_loss: 0.9212, test_f1: 0.5383
 epoch: 90, train_loss: 0.8781, test_loss: 0.9186, test_f1: 0.5400
 epoch: 91, train_loss: 0.8654, test_loss: 0.9220, test_f1: 0.5409
 epoch: 92, train_loss: 0.8759, test_loss: 0.9132, test_f1: 0.5339
 epoch: 93, train_loss: 0.8766, test_loss: 0.9178, test_f1: 0.5406
 epoch: 94, train_loss: 0.8680, test_loss: 0.9258, test_f1: 0.5418
 epoch: 95, train_loss: 0.8585, test_loss: 0.9258, test_f1: 0.5345
 epoch: 96, train_loss: 0.8637, test_loss: 0.9257, test_f1: 0.5302
 epoch: 97, train_loss: 0.8648, test_loss: 0.9245, test_f1: 0.5470
 epoch: 98, train_loss: 0.8607, test_loss: 0.9333, test_f1: 0.5392
 epoch: 99, train_loss: 0.8760, test_loss: 0.9346, test_f1: 0.5248
##################ITERATION #8 ****************************************
 epoch: 0, train_loss: 1.3359, test_loss: 1.3660, test_f1: 0.2270
 epoch: 1, train_loss: 1.2657, test_loss: 1.2826, test_f1: 0.2738
 epoch: 2, train_loss: 1.2399, test_loss: 1.2197, test_f1: 0.2864
 epoch: 3, train_loss: 1.2202, test_loss: 1.1697, test_f1: 0.3368
 epoch: 4, train_loss: 1.2002, test_loss: 1.1444, test_f1: 0.3893
 epoch: 5, train_loss: 1.1736, test_loss: 1.1269, test_f1: 0.4231
 epoch: 6, train_loss: 1.1596, test_loss: 1.1137, test_f1: 0.4327
 epoch: 7, train_loss: 1.1583, test_loss: 1.1051, test_f1: 0.4261
 epoch: 8, train_loss: 1.1428, test_loss: 1.0887, test_f1: 0.4307
 epoch: 9, train_loss: 1.1258, test_loss: 1.0792, test_f1: 0.4373
 epoch: 10, train_loss: 1.1229, test_loss: 1.0653, test_f1: 0.4533
 epoch: 11, train_loss: 1.1039, test_loss: 1.0585, test_f1: 0.4616
 epoch: 12, train_loss: 1.1015, test_loss: 1.0503, test_f1: 0.4538
 epoch: 13, train_loss: 1.0906, test_loss: 1.0467, test_f1: 0.4457
 epoch: 14, train_loss: 1.0923, test_loss: 1.0350, test_f1: 0.4447
 epoch: 15, train_loss: 1.0834, test_loss: 1.0285, test_f1: 0.4450
 epoch: 16, train_loss: 1.0786, test_loss: 1.0234, test_f1: 0.4508
 epoch: 17, train_loss: 1.0688, test_loss: 1.0178, test_f1: 0.4510
 epoch: 18, train_loss: 1.0624, test_loss: 1.0109, test_f1: 0.4618
 epoch: 19, train_loss: 1.0468, test_loss: 1.0123, test_f1: 0.4553
 epoch: 20, train_loss: 1.0468, test_loss: 1.0086, test_f1: 0.4405
 epoch: 21, train_loss: 1.0418, test_loss: 0.9983, test_f1: 0.4756
 epoch: 22, train_loss: 1.0391, test_loss: 0.9896, test_f1: 0.4603
 epoch: 23, train_loss: 1.0333, test_loss: 0.9837, test_f1: 0.4772
 epoch: 24, train_loss: 1.0302, test_loss: 0.9789, test_f1: 0.4798
 epoch: 25, train_loss: 1.0263, test_loss: 0.9798, test_f1: 0.4883
 epoch: 26, train_loss: 1.0174, test_loss: 0.9724, test_f1: 0.4994
 epoch: 27, train_loss: 1.0074, test_loss: 0.9633, test_f1: 0.4920
 epoch: 28, train_loss: 1.0048, test_loss: 0.9625, test_f1: 0.4942
 epoch: 29, train_loss: 1.0007, test_loss: 0.9690, test_f1: 0.4917
 epoch: 30, train_loss: 1.0055, test_loss: 0.9626, test_f1: 0.5052
 epoch: 31, train_loss: 0.9953, test_loss: 0.9747, test_f1: 0.4998
 epoch: 32, train_loss: 0.9903, test_loss: 0.9559, test_f1: 0.4975
 epoch: 33, train_loss: 0.9856, test_loss: 0.9495, test_f1: 0.5048
 epoch: 34, train_loss: 0.9838, test_loss: 0.9493, test_f1: 0.5139
 epoch: 35, train_loss: 0.9674, test_loss: 0.9553, test_f1: 0.5077
 epoch: 36, train_loss: 0.9735, test_loss: 0.9528, test_f1: 0.5073
 epoch: 37, train_loss: 0.9695, test_loss: 0.9438, test_f1: 0.5124
 epoch: 38, train_loss: 0.9639, test_loss: 0.9456, test_f1: 0.5068
 epoch: 39, train_loss: 0.9665, test_loss: 0.9441, test_f1: 0.5145
 epoch: 40, train_loss: 0.9615, test_loss: 0.9378, test_f1: 0.5252
 epoch: 41, train_loss: 0.9616, test_loss: 0.9531, test_f1: 0.5101
 epoch: 42, train_loss: 0.9547, test_loss: 0.9401, test_f1: 0.5164
 epoch: 43, train_loss: 0.9580, test_loss: 0.9365, test_f1: 0.5207
 epoch: 44, train_loss: 0.9426, test_loss: 0.9412, test_f1: 0.5243
 epoch: 45, train_loss: 0.9464, test_loss: 0.9273, test_f1: 0.5235
 epoch: 46, train_loss: 0.9463, test_loss: 0.9378, test_f1: 0.5178
 epoch: 47, train_loss: 0.9419, test_loss: 0.9415, test_f1: 0.5270
 epoch: 48, train_loss: 0.9445, test_loss: 0.9303, test_f1: 0.5365
 epoch: 49, train_loss: 0.9457, test_loss: 0.9524, test_f1: 0.5058
 epoch: 50, train_loss: 0.9358, test_loss: 0.9312, test_f1: 0.5271
 epoch: 51, train_loss: 0.9341, test_loss: 0.9389, test_f1: 0.5322
 epoch: 52, train_loss: 0.9296, test_loss: 0.9329, test_f1: 0.5368
 epoch: 53, train_loss: 0.9230, test_loss: 0.9314, test_f1: 0.5322
 epoch: 54, train_loss: 0.9231, test_loss: 0.9332, test_f1: 0.5261
 epoch: 55, train_loss: 0.9327, test_loss: 0.9343, test_f1: 0.5214
 epoch: 56, train_loss: 0.9314, test_loss: 0.9249, test_f1: 0.5340
 epoch: 57, train_loss: 0.9189, test_loss: 0.9330, test_f1: 0.5351
 epoch: 58, train_loss: 0.9239, test_loss: 0.9234, test_f1: 0.5334
 epoch: 59, train_loss: 0.9226, test_loss: 0.9313, test_f1: 0.5348
 epoch: 60, train_loss: 0.9196, test_loss: 0.9351, test_f1: 0.5202
 epoch: 61, train_loss: 0.9224, test_loss: 0.9369, test_f1: 0.5327
 epoch: 62, train_loss: 0.9242, test_loss: 0.9342, test_f1: 0.5368
 epoch: 63, train_loss: 0.9158, test_loss: 0.9243, test_f1: 0.5444
 epoch: 64, train_loss: 0.9153, test_loss: 0.9373, test_f1: 0.5339
 epoch: 65, train_loss: 0.9146, test_loss: 0.9422, test_f1: 0.5344
 epoch: 66, train_loss: 0.9150, test_loss: 0.9300, test_f1: 0.5342
 epoch: 67, train_loss: 0.9150, test_loss: 0.9363, test_f1: 0.5399
 epoch: 68, train_loss: 0.9134, test_loss: 0.9269, test_f1: 0.5317
 epoch: 69, train_loss: 0.9128, test_loss: 0.9453, test_f1: 0.5270
 epoch: 70, train_loss: 0.9209, test_loss: 0.9439, test_f1: 0.5291
 epoch: 71, train_loss: 0.9095, test_loss: 0.9461, test_f1: 0.5380
 epoch: 72, train_loss: 0.9061, test_loss: 0.9387, test_f1: 0.5346
 epoch: 73, train_loss: 0.9064, test_loss: 0.9330, test_f1: 0.5311
 epoch: 74, train_loss: 0.8989, test_loss: 0.9385, test_f1: 0.5332
 epoch: 75, train_loss: 0.9004, test_loss: 0.9337, test_f1: 0.5485
 epoch: 76, train_loss: 0.9022, test_loss: 0.9441, test_f1: 0.5319
 epoch: 77, train_loss: 0.9128, test_loss: 0.9332, test_f1: 0.5393
 epoch: 78, train_loss: 0.8977, test_loss: 0.9229, test_f1: 0.5536
 epoch: 79, train_loss: 0.8945, test_loss: 0.9396, test_f1: 0.5357
 epoch: 80, train_loss: 0.9005, test_loss: 0.9355, test_f1: 0.5326
 epoch: 81, train_loss: 0.8986, test_loss: 0.9472, test_f1: 0.5318
 epoch: 82, train_loss: 0.8992, test_loss: 0.9365, test_f1: 0.5340
 epoch: 83, train_loss: 0.8952, test_loss: 0.9287, test_f1: 0.5477
 epoch: 84, train_loss: 0.8944, test_loss: 0.9363, test_f1: 0.5395
 epoch: 85, train_loss: 0.8914, test_loss: 0.9368, test_f1: 0.5384
 epoch: 86, train_loss: 0.8881, test_loss: 0.9449, test_f1: 0.5381
 epoch: 87, train_loss: 0.8927, test_loss: 0.9361, test_f1: 0.5386
 epoch: 88, train_loss: 0.8829, test_loss: 0.9532, test_f1: 0.5248
 epoch: 89, train_loss: 0.8854, test_loss: 0.9400, test_f1: 0.5364
 epoch: 90, train_loss: 0.8890, test_loss: 0.9347, test_f1: 0.5445
 epoch: 91, train_loss: 0.8923, test_loss: 0.9434, test_f1: 0.5445
 epoch: 92, train_loss: 0.8935, test_loss: 0.9522, test_f1: 0.5459
 epoch: 93, train_loss: 0.8843, test_loss: 0.9431, test_f1: 0.5416
 epoch: 94, train_loss: 0.8789, test_loss: 0.9404, test_f1: 0.5487
 epoch: 95, train_loss: 0.8921, test_loss: 0.9486, test_f1: 0.5410
 epoch: 96, train_loss: 0.8897, test_loss: 0.9484, test_f1: 0.5426
 epoch: 97, train_loss: 0.8759, test_loss: 0.9306, test_f1: 0.5502
 epoch: 98, train_loss: 0.8834, test_loss: 0.9358, test_f1: 0.5464
 epoch: 99, train_loss: 0.8733, test_loss: 0.9341, test_f1: 0.5519
##################ITERATION #9 ****************************************
 epoch: 0, train_loss: 1.3352, test_loss: 1.3372, test_f1: 0.2270
 epoch: 1, train_loss: 1.2795, test_loss: 1.2938, test_f1: 0.2337
 epoch: 2, train_loss: 1.2681, test_loss: 1.2557, test_f1: 0.2996
 epoch: 3, train_loss: 1.2366, test_loss: 1.2202, test_f1: 0.2955
 epoch: 4, train_loss: 1.2270, test_loss: 1.2026, test_f1: 0.3124
 epoch: 5, train_loss: 1.2169, test_loss: 1.1931, test_f1: 0.3222
 epoch: 6, train_loss: 1.2021, test_loss: 1.1792, test_f1: 0.3195
 epoch: 7, train_loss: 1.1905, test_loss: 1.1678, test_f1: 0.3334
 epoch: 8, train_loss: 1.1832, test_loss: 1.1554, test_f1: 0.3428
 epoch: 9, train_loss: 1.1702, test_loss: 1.1458, test_f1: 0.3507
 epoch: 10, train_loss: 1.1739, test_loss: 1.1408, test_f1: 0.3630
 epoch: 11, train_loss: 1.1623, test_loss: 1.1272, test_f1: 0.3734
 epoch: 12, train_loss: 1.1586, test_loss: 1.1139, test_f1: 0.3807
 epoch: 13, train_loss: 1.1404, test_loss: 1.1048, test_f1: 0.3911
 epoch: 14, train_loss: 1.1478, test_loss: 1.0917, test_f1: 0.4073
 epoch: 15, train_loss: 1.1269, test_loss: 1.0805, test_f1: 0.4124
 epoch: 16, train_loss: 1.1165, test_loss: 1.0740, test_f1: 0.4172
 epoch: 17, train_loss: 1.1126, test_loss: 1.0614, test_f1: 0.4336
 epoch: 18, train_loss: 1.1015, test_loss: 1.0607, test_f1: 0.4307
 epoch: 19, train_loss: 1.0981, test_loss: 1.0567, test_f1: 0.4392
 epoch: 20, train_loss: 1.0855, test_loss: 1.0487, test_f1: 0.4492
 epoch: 21, train_loss: 1.0755, test_loss: 1.0442, test_f1: 0.4465
 epoch: 22, train_loss: 1.0739, test_loss: 1.0294, test_f1: 0.4515
 epoch: 23, train_loss: 1.0629, test_loss: 1.0272, test_f1: 0.4598
 epoch: 24, train_loss: 1.0616, test_loss: 1.0250, test_f1: 0.4671
 epoch: 25, train_loss: 1.0515, test_loss: 1.0224, test_f1: 0.4687
 epoch: 26, train_loss: 1.0484, test_loss: 1.0121, test_f1: 0.4697
 epoch: 27, train_loss: 1.0447, test_loss: 1.0021, test_f1: 0.4848
 epoch: 28, train_loss: 1.0465, test_loss: 1.0007, test_f1: 0.4808
 epoch: 29, train_loss: 1.0332, test_loss: 1.0048, test_f1: 0.4738
 epoch: 30, train_loss: 1.0286, test_loss: 0.9916, test_f1: 0.4777
 epoch: 31, train_loss: 1.0314, test_loss: 0.9929, test_f1: 0.4781
 epoch: 32, train_loss: 1.0095, test_loss: 0.9847, test_f1: 0.4804
 epoch: 33, train_loss: 1.0173, test_loss: 0.9882, test_f1: 0.4827
 epoch: 34, train_loss: 1.0085, test_loss: 0.9819, test_f1: 0.4718
 epoch: 35, train_loss: 1.0040, test_loss: 0.9902, test_f1: 0.4798
 epoch: 36, train_loss: 0.9994, test_loss: 0.9829, test_f1: 0.4921
 epoch: 37, train_loss: 1.0020, test_loss: 0.9848, test_f1: 0.4778
 epoch: 38, train_loss: 0.9951, test_loss: 0.9791, test_f1: 0.4737
 epoch: 39, train_loss: 0.9952, test_loss: 0.9776, test_f1: 0.4766
 epoch: 40, train_loss: 0.9884, test_loss: 0.9718, test_f1: 0.4801
 epoch: 41, train_loss: 0.9916, test_loss: 0.9691, test_f1: 0.4827
 epoch: 42, train_loss: 0.9850, test_loss: 0.9708, test_f1: 0.4927
 epoch: 43, train_loss: 0.9856, test_loss: 0.9713, test_f1: 0.4858
 epoch: 44, train_loss: 0.9753, test_loss: 0.9809, test_f1: 0.4835
 epoch: 45, train_loss: 0.9866, test_loss: 0.9747, test_f1: 0.4835
 epoch: 46, train_loss: 0.9798, test_loss: 0.9760, test_f1: 0.4809
 epoch: 47, train_loss: 0.9686, test_loss: 0.9718, test_f1: 0.4825
 epoch: 48, train_loss: 0.9701, test_loss: 0.9681, test_f1: 0.4823
 epoch: 49, train_loss: 0.9704, test_loss: 0.9658, test_f1: 0.4864
 epoch: 50, train_loss: 0.9683, test_loss: 0.9650, test_f1: 0.4876
 epoch: 51, train_loss: 0.9669, test_loss: 0.9672, test_f1: 0.4883
 epoch: 52, train_loss: 0.9596, test_loss: 0.9666, test_f1: 0.4859
 epoch: 53, train_loss: 0.9544, test_loss: 0.9638, test_f1: 0.4902
 epoch: 54, train_loss: 0.9544, test_loss: 0.9670, test_f1: 0.4860
 epoch: 55, train_loss: 0.9508, test_loss: 0.9670, test_f1: 0.4817
 epoch: 56, train_loss: 0.9518, test_loss: 0.9694, test_f1: 0.4904
 epoch: 57, train_loss: 0.9567, test_loss: 0.9646, test_f1: 0.4842
 epoch: 58, train_loss: 0.9558, test_loss: 0.9649, test_f1: 0.4861
 epoch: 59, train_loss: 0.9496, test_loss: 0.9664, test_f1: 0.4876
 epoch: 60, train_loss: 0.9430, test_loss: 0.9621, test_f1: 0.4952
 epoch: 61, train_loss: 0.9493, test_loss: 0.9692, test_f1: 0.4879
 epoch: 62, train_loss: 0.9455, test_loss: 0.9680, test_f1: 0.4851
 epoch: 63, train_loss: 0.9413, test_loss: 0.9697, test_f1: 0.4932
 epoch: 64, train_loss: 0.9384, test_loss: 0.9671, test_f1: 0.4841
 epoch: 65, train_loss: 0.9433, test_loss: 0.9665, test_f1: 0.4915
 epoch: 66, train_loss: 0.9284, test_loss: 0.9632, test_f1: 0.4960
 epoch: 67, train_loss: 0.9368, test_loss: 0.9664, test_f1: 0.4835
 epoch: 68, train_loss: 0.9369, test_loss: 0.9677, test_f1: 0.4898
 epoch: 69, train_loss: 0.9422, test_loss: 0.9693, test_f1: 0.4850
 epoch: 70, train_loss: 0.9385, test_loss: 0.9671, test_f1: 0.4874
 epoch: 71, train_loss: 0.9262, test_loss: 0.9616, test_f1: 0.4917
 epoch: 72, train_loss: 0.9411, test_loss: 0.9652, test_f1: 0.4985
 epoch: 73, train_loss: 0.9259, test_loss: 0.9634, test_f1: 0.4884
 epoch: 74, train_loss: 0.9300, test_loss: 0.9633, test_f1: 0.4844
 epoch: 75, train_loss: 0.9364, test_loss: 0.9612, test_f1: 0.4937
 epoch: 76, train_loss: 0.9363, test_loss: 0.9710, test_f1: 0.4878
 epoch: 77, train_loss: 0.9302, test_loss: 0.9639, test_f1: 0.4892
 epoch: 78, train_loss: 0.9324, test_loss: 0.9639, test_f1: 0.4891
 epoch: 79, train_loss: 0.9303, test_loss: 0.9571, test_f1: 0.4879
 epoch: 80, train_loss: 0.9249, test_loss: 0.9621, test_f1: 0.5067
 epoch: 81, train_loss: 0.9236, test_loss: 0.9665, test_f1: 0.4953
 epoch: 82, train_loss: 0.9305, test_loss: 0.9614, test_f1: 0.5018
 epoch: 83, train_loss: 0.9284, test_loss: 0.9640, test_f1: 0.5028
 epoch: 84, train_loss: 0.9256, test_loss: 0.9670, test_f1: 0.4991
 epoch: 85, train_loss: 0.9221, test_loss: 0.9676, test_f1: 0.5055
 epoch: 86, train_loss: 0.9318, test_loss: 0.9672, test_f1: 0.4995
 epoch: 87, train_loss: 0.9115, test_loss: 0.9697, test_f1: 0.5019
 epoch: 88, train_loss: 0.9277, test_loss: 0.9689, test_f1: 0.4907
 epoch: 89, train_loss: 0.9258, test_loss: 0.9663, test_f1: 0.5000
 epoch: 90, train_loss: 0.9148, test_loss: 0.9665, test_f1: 0.5090
 epoch: 91, train_loss: 0.9076, test_loss: 0.9666, test_f1: 0.5005
 epoch: 92, train_loss: 0.9161, test_loss: 0.9682, test_f1: 0.5028
 epoch: 93, train_loss: 0.9182, test_loss: 0.9733, test_f1: 0.5043
 epoch: 94, train_loss: 0.9072, test_loss: 0.9706, test_f1: 0.4982
 epoch: 95, train_loss: 0.9138, test_loss: 0.9658, test_f1: 0.5026
 epoch: 96, train_loss: 0.9076, test_loss: 0.9738, test_f1: 0.5143
 epoch: 97, train_loss: 0.9039, test_loss: 0.9798, test_f1: 0.5123
 epoch: 98, train_loss: 0.9095, test_loss: 0.9703, test_f1: 0.4910
 epoch: 99, train_loss: 0.9069, test_loss: 0.9701, test_f1: 0.5091

Training completed in 697.09 seconds
Best F1: 0.5536 at epoch 78
Mean F1 across iterations: 0.5308  0.0167
========================FINAL RESULTS================================
FEGIN weighted F1: 0.5536  0.0167
python main.py --data ltspice_examples --representation component_net --model FEGIN --layers 5 --hiddens 32 --batch_size 128 --lr 0.0001 --emb_size 250 --epochs 100 --save_appendix component_net_L5_H32_BS128_LR0.0001_E250 --no_val
-----



STDERR:
  File "main.py", line 370, in <module>
    main()
  File "main.py", line 254, in main
    dataset = dataset_class(
  File "/home/philip/projects/llm_inference_code_repo/Circuit-Completion-Using-GNNs/component_classification_with_link_prediction_head/evaluation/FEGIN/kernel/circuit_datasets.py", line 15, in __init__
    self.data, self.slices = torch.load(self.processed_paths[0])
  File "/home/philip/.local/lib/python3.8/site-packages/torch/serialization.py", line 1040, in load
    warnings.warn(
  File "/usr/lib/python3.8/warnings.py", line 109, in _showwarnmsg
    sw(msg.message, msg.category, msg.filename, msg.lineno,
  File "main.py", line 47, in warn_with_traceback
    traceback.print_stack(file=log)
/home/philip/projects/llm_inference_code_repo/Circuit-Completion-Using-GNNs/component_classification_with_link_prediction_head/evaluation/FEGIN/kernel/circuit_datasets.py:15: FutureWarning: You are using `torch.load` with `weights_only=False` (the current default value), which uses the default pickle module implicitly. It is possible to construct malicious pickle data which will execute arbitrary code during unpickling (See https://github.com/pytorch/pytorch/blob/main/SECURITY.md#untrusted-models for more details). In a future release, the default value for `weights_only` will be flipped to `True`. This limits the functions that could be executed during unpickling. Arbitrary objects will no longer be allowed to be loaded via this mode unless they are explicitly allowlisted by the user via `torch.serialization.add_safe_globals`. We recommend you start setting `weights_only=True` for any use case where you don't have full control of the loaded file. Please open an issue on GitHub for any issues related to this experimental feature.
  self.data, self.slices = torch.load(self.processed_paths[0])
