STDOUT:
Results will be saved in /home/philip/projects/ltspice_examples_code_repo/Circuit-Completion-Using-GNNs/component_classification_with_link_prediction_head/evaluation/FEGIN/results/model_FEGIN_dataset_ltspice_examples
Command line input: python main.py --data ltspice_examples --representation component_pin_net --model FEGIN --layers 3 --hiddens 32 --batch_size 64 --lr 0.01 --emb_size 512 --epochs 100 --save_appendix component_pin_net_L3_H32_BS64_LR0.01_E512 --no_val
 is saved.
-----
ltspice_examples - FEGIN
Using 3 layers, 32 hidden units, h = 2
Loading component_pin_net representation dataset
ENTERED
Training FEGIN on component_pin_net representation
Train: 3558, Test: 846
##################ITERATION #0 ****************************************
 epoch: 0, train_loss: 1.1919, test_loss: 1.0779, test_f1: 0.4311
 epoch: 1, train_loss: 1.0217, test_loss: 1.1310, test_f1: 0.4255
 epoch: 2, train_loss: 1.0023, test_loss: 1.0320, test_f1: 0.4776
 epoch: 3, train_loss: 0.9678, test_loss: 0.9800, test_f1: 0.4550
 epoch: 4, train_loss: 0.9501, test_loss: 0.9856, test_f1: 0.5139
 epoch: 5, train_loss: 0.9539, test_loss: 1.0933, test_f1: 0.4493
 epoch: 6, train_loss: 0.9259, test_loss: 0.9004, test_f1: 0.5133
 epoch: 7, train_loss: 0.9262, test_loss: 0.8893, test_f1: 0.5428
 epoch: 8, train_loss: 0.9229, test_loss: 0.9318, test_f1: 0.5372
 epoch: 9, train_loss: 0.8841, test_loss: 0.9231, test_f1: 0.5191
 epoch: 10, train_loss: 0.8915, test_loss: 0.8389, test_f1: 0.5376
 epoch: 11, train_loss: 0.8639, test_loss: 1.0316, test_f1: 0.4699
 epoch: 12, train_loss: 0.8720, test_loss: 0.8884, test_f1: 0.5418
 epoch: 13, train_loss: 0.8587, test_loss: 0.9242, test_f1: 0.5264
 epoch: 14, train_loss: 0.8725, test_loss: 0.8751, test_f1: 0.5323
 epoch: 15, train_loss: 0.8408, test_loss: 1.0023, test_f1: 0.5167
 epoch: 16, train_loss: 0.8471, test_loss: 0.9560, test_f1: 0.5172
 epoch: 17, train_loss: 0.8145, test_loss: 0.8270, test_f1: 0.5654
 epoch: 18, train_loss: 0.8290, test_loss: 0.8738, test_f1: 0.5402
 epoch: 19, train_loss: 0.8282, test_loss: 0.8149, test_f1: 0.5483
 epoch: 20, train_loss: 0.8135, test_loss: 0.8951, test_f1: 0.5489
 epoch: 21, train_loss: 0.7980, test_loss: 0.7999, test_f1: 0.5766
 epoch: 22, train_loss: 0.7907, test_loss: 0.9321, test_f1: 0.5658
 epoch: 23, train_loss: 0.8130, test_loss: 0.8361, test_f1: 0.5383
 epoch: 24, train_loss: 0.7806, test_loss: 1.0872, test_f1: 0.4760
 epoch: 25, train_loss: 0.7791, test_loss: 0.9170, test_f1: 0.5042
 epoch: 26, train_loss: 0.7869, test_loss: 0.8663, test_f1: 0.5543
 epoch: 27, train_loss: 0.7676, test_loss: 0.8890, test_f1: 0.6167
 epoch: 28, train_loss: 0.7874, test_loss: 0.8354, test_f1: 0.5907
 epoch: 29, train_loss: 0.7647, test_loss: 0.8220, test_f1: 0.5518
 epoch: 30, train_loss: 0.7618, test_loss: 0.9082, test_f1: 0.5699
 epoch: 31, train_loss: 0.7555, test_loss: 0.8366, test_f1: 0.5857
 epoch: 32, train_loss: 0.7526, test_loss: 0.8417, test_f1: 0.6077
 epoch: 33, train_loss: 0.7396, test_loss: 0.8292, test_f1: 0.6468
 epoch: 34, train_loss: 0.7478, test_loss: 0.8797, test_f1: 0.5871
 epoch: 35, train_loss: 0.7545, test_loss: 0.8428, test_f1: 0.6133
 epoch: 36, train_loss: 0.7504, test_loss: 0.8820, test_f1: 0.6412
 epoch: 37, train_loss: 0.7424, test_loss: 0.7947, test_f1: 0.5917
 epoch: 38, train_loss: 0.7377, test_loss: 0.8551, test_f1: 0.6339
 epoch: 39, train_loss: 0.7327, test_loss: 0.8353, test_f1: 0.6082
 epoch: 40, train_loss: 0.7323, test_loss: 0.7961, test_f1: 0.6202
 epoch: 41, train_loss: 0.7277, test_loss: 0.8090, test_f1: 0.6329
 epoch: 42, train_loss: 0.7324, test_loss: 0.8972, test_f1: 0.6267
 epoch: 43, train_loss: 0.7267, test_loss: 0.8108, test_f1: 0.6009
 epoch: 44, train_loss: 0.7218, test_loss: 0.9184, test_f1: 0.6099
 epoch: 45, train_loss: 0.6965, test_loss: 0.7979, test_f1: 0.6477
 epoch: 46, train_loss: 0.7216, test_loss: 0.9278, test_f1: 0.5985
 epoch: 47, train_loss: 0.7106, test_loss: 0.8031, test_f1: 0.6511
 epoch: 48, train_loss: 0.7028, test_loss: 0.9038, test_f1: 0.5915
 epoch: 49, train_loss: 0.7190, test_loss: 0.8512, test_f1: 0.5920
 epoch: 50, train_loss: 0.7039, test_loss: 0.8683, test_f1: 0.6158
 epoch: 51, train_loss: 0.6805, test_loss: 0.8444, test_f1: 0.6485
 epoch: 52, train_loss: 0.6492, test_loss: 0.8373, test_f1: 0.6477
 epoch: 53, train_loss: 0.6637, test_loss: 0.7711, test_f1: 0.6546
 epoch: 54, train_loss: 0.6340, test_loss: 0.7944, test_f1: 0.6670
 epoch: 55, train_loss: 0.6444, test_loss: 0.8247, test_f1: 0.6242
 epoch: 56, train_loss: 0.6387, test_loss: 0.8792, test_f1: 0.6503
 epoch: 57, train_loss: 0.6466, test_loss: 0.9209, test_f1: 0.6205
 epoch: 58, train_loss: 0.6351, test_loss: 0.9361, test_f1: 0.6250
 epoch: 59, train_loss: 0.6504, test_loss: 0.8747, test_f1: 0.6684
 epoch: 60, train_loss: 0.6362, test_loss: 0.8490, test_f1: 0.6528
 epoch: 61, train_loss: 0.6308, test_loss: 0.9083, test_f1: 0.6868
 epoch: 62, train_loss: 0.6415, test_loss: 0.8968, test_f1: 0.6611
 epoch: 63, train_loss: 0.6316, test_loss: 0.9942, test_f1: 0.6563
 epoch: 64, train_loss: 0.6225, test_loss: 0.8968, test_f1: 0.6551
 epoch: 65, train_loss: 0.6283, test_loss: 0.9808, test_f1: 0.6534
 epoch: 66, train_loss: 0.6202, test_loss: 0.9143, test_f1: 0.6498
 epoch: 67, train_loss: 0.6089, test_loss: 0.9814, test_f1: 0.6914
 epoch: 68, train_loss: 0.6246, test_loss: 0.9890, test_f1: 0.6504
 epoch: 69, train_loss: 0.6146, test_loss: 0.9048, test_f1: 0.6606
 epoch: 70, train_loss: 0.6018, test_loss: 0.9173, test_f1: 0.6620
 epoch: 71, train_loss: 0.6057, test_loss: 1.0023, test_f1: 0.6557
 epoch: 72, train_loss: 0.6187, test_loss: 1.0122, test_f1: 0.6759
 epoch: 73, train_loss: 0.6109, test_loss: 0.9758, test_f1: 0.6550
 epoch: 74, train_loss: 0.6117, test_loss: 1.1336, test_f1: 0.6512
 epoch: 75, train_loss: 0.6113, test_loss: 1.0536, test_f1: 0.6528
 epoch: 76, train_loss: 0.6288, test_loss: 0.9262, test_f1: 0.6433
 epoch: 77, train_loss: 0.6220, test_loss: 0.9282, test_f1: 0.6627
 epoch: 78, train_loss: 0.6024, test_loss: 0.9771, test_f1: 0.6651
 epoch: 79, train_loss: 0.6112, test_loss: 0.9289, test_f1: 0.6411
 epoch: 80, train_loss: 0.5975, test_loss: 0.9750, test_f1: 0.6587
 epoch: 81, train_loss: 0.5870, test_loss: 0.9882, test_f1: 0.6764
 epoch: 82, train_loss: 0.5910, test_loss: 1.0114, test_f1: 0.6690
 epoch: 83, train_loss: 0.6006, test_loss: 1.0290, test_f1: 0.6729
 epoch: 84, train_loss: 0.5889, test_loss: 0.8969, test_f1: 0.6590
 epoch: 85, train_loss: 0.5877, test_loss: 0.9773, test_f1: 0.6765
 epoch: 86, train_loss: 0.5810, test_loss: 0.9635, test_f1: 0.6639
 epoch: 87, train_loss: 0.5757, test_loss: 0.9875, test_f1: 0.6535
 epoch: 88, train_loss: 0.6053, test_loss: 0.9122, test_f1: 0.6743
 epoch: 89, train_loss: 0.5775, test_loss: 0.9611, test_f1: 0.6705
 epoch: 90, train_loss: 0.5795, test_loss: 1.0078, test_f1: 0.6600
 epoch: 91, train_loss: 0.5827, test_loss: 0.9397, test_f1: 0.6624
 epoch: 92, train_loss: 0.5794, test_loss: 0.9731, test_f1: 0.6847
 epoch: 93, train_loss: 0.5740, test_loss: 0.9001, test_f1: 0.6686
 epoch: 94, train_loss: 0.5897, test_loss: 0.9259, test_f1: 0.6616
 epoch: 95, train_loss: 0.5881, test_loss: 1.0494, test_f1: 0.6648
 epoch: 96, train_loss: 0.5758, test_loss: 0.9848, test_f1: 0.6628
 epoch: 97, train_loss: 0.5763, test_loss: 1.1048, test_f1: 0.6676
 epoch: 98, train_loss: 0.5782, test_loss: 1.0085, test_f1: 0.6693
 epoch: 99, train_loss: 0.5637, test_loss: 1.0101, test_f1: 0.6640
##################ITERATION #1 ****************************************
 epoch: 0, train_loss: 1.1027, test_loss: 1.1116, test_f1: 0.4009
 epoch: 1, train_loss: 0.9847, test_loss: 1.0505, test_f1: 0.4752
 epoch: 2, train_loss: 0.9573, test_loss: 1.0909, test_f1: 0.4777
 epoch: 3, train_loss: 0.9434, test_loss: 1.0360, test_f1: 0.5338
 epoch: 4, train_loss: 0.9416, test_loss: 1.0393, test_f1: 0.4672
 epoch: 5, train_loss: 0.9106, test_loss: 1.0170, test_f1: 0.4934
 epoch: 6, train_loss: 0.9010, test_loss: 0.8989, test_f1: 0.5352
 epoch: 7, train_loss: 0.8905, test_loss: 0.9746, test_f1: 0.5610
 epoch: 8, train_loss: 0.8834, test_loss: 1.0690, test_f1: 0.5348
 epoch: 9, train_loss: 0.8992, test_loss: 0.9256, test_f1: 0.5242
 epoch: 10, train_loss: 0.8733, test_loss: 0.9606, test_f1: 0.5242
 epoch: 11, train_loss: 0.8386, test_loss: 1.0466, test_f1: 0.5115
 epoch: 12, train_loss: 0.8381, test_loss: 0.9054, test_f1: 0.6158
 epoch: 13, train_loss: 0.8291, test_loss: 0.8739, test_f1: 0.5533
 epoch: 14, train_loss: 0.8200, test_loss: 0.9854, test_f1: 0.5511
 epoch: 15, train_loss: 0.8369, test_loss: 0.9158, test_f1: 0.5600
 epoch: 16, train_loss: 0.8220, test_loss: 1.1088, test_f1: 0.5061
 epoch: 17, train_loss: 0.8184, test_loss: 0.9874, test_f1: 0.5960
 epoch: 18, train_loss: 0.7994, test_loss: 0.9746, test_f1: 0.5179
 epoch: 19, train_loss: 0.7880, test_loss: 0.8017, test_f1: 0.6239
 epoch: 20, train_loss: 0.7965, test_loss: 0.9840, test_f1: 0.5654
 epoch: 21, train_loss: 0.7752, test_loss: 0.8705, test_f1: 0.6113
 epoch: 22, train_loss: 0.7633, test_loss: 0.8088, test_f1: 0.6035
 epoch: 23, train_loss: 0.7799, test_loss: 1.0621, test_f1: 0.5844
 epoch: 24, train_loss: 0.7853, test_loss: 0.9047, test_f1: 0.5611
 epoch: 25, train_loss: 0.8254, test_loss: 0.9591, test_f1: 0.6077
 epoch: 26, train_loss: 0.8036, test_loss: 0.7962, test_f1: 0.6227
 epoch: 27, train_loss: 0.7686, test_loss: 0.8783, test_f1: 0.6124
 epoch: 28, train_loss: 0.7859, test_loss: 0.9511, test_f1: 0.5454
 epoch: 29, train_loss: 0.7789, test_loss: 0.8719, test_f1: 0.6072
 epoch: 30, train_loss: 0.7530, test_loss: 0.9748, test_f1: 0.6084
 epoch: 31, train_loss: 0.7256, test_loss: 0.9039, test_f1: 0.5989
 epoch: 32, train_loss: 0.7387, test_loss: 1.0229, test_f1: 0.5621
 epoch: 33, train_loss: 0.7376, test_loss: 0.9767, test_f1: 0.5777
 epoch: 34, train_loss: 0.7458, test_loss: 0.9223, test_f1: 0.6027
 epoch: 35, train_loss: 0.7193, test_loss: 0.9242, test_f1: 0.6303
 epoch: 36, train_loss: 0.7265, test_loss: 0.9469, test_f1: 0.6408
 epoch: 37, train_loss: 0.7449, test_loss: 1.0821, test_f1: 0.5780
 epoch: 38, train_loss: 0.7225, test_loss: 0.7898, test_f1: 0.6460
 epoch: 39, train_loss: 0.7046, test_loss: 0.9067, test_f1: 0.6164
 epoch: 40, train_loss: 0.7225, test_loss: 0.9648, test_f1: 0.6120
 epoch: 41, train_loss: 0.7056, test_loss: 0.8155, test_f1: 0.6131
 epoch: 42, train_loss: 0.7007, test_loss: 0.7947, test_f1: 0.6343
 epoch: 43, train_loss: 0.6982, test_loss: 0.8389, test_f1: 0.6271
 epoch: 44, train_loss: 0.6855, test_loss: 0.8389, test_f1: 0.6081
 epoch: 45, train_loss: 0.7293, test_loss: 0.8308, test_f1: 0.6534
 epoch: 46, train_loss: 0.6849, test_loss: 0.8591, test_f1: 0.6558
 epoch: 47, train_loss: 0.6977, test_loss: 0.8334, test_f1: 0.6403
 epoch: 48, train_loss: 0.6724, test_loss: 0.9455, test_f1: 0.6381
 epoch: 49, train_loss: 0.6728, test_loss: 0.7918, test_f1: 0.6418
 epoch: 50, train_loss: 0.6751, test_loss: 0.9089, test_f1: 0.6512
 epoch: 51, train_loss: 0.6436, test_loss: 0.8575, test_f1: 0.6391
 epoch: 52, train_loss: 0.6436, test_loss: 0.8955, test_f1: 0.6589
 epoch: 53, train_loss: 0.6116, test_loss: 0.8731, test_f1: 0.6443
 epoch: 54, train_loss: 0.6279, test_loss: 0.7867, test_f1: 0.6739
 epoch: 55, train_loss: 0.6112, test_loss: 0.7687, test_f1: 0.6648
 epoch: 56, train_loss: 0.5976, test_loss: 0.8304, test_f1: 0.6552
 epoch: 57, train_loss: 0.5858, test_loss: 0.8377, test_f1: 0.6677
 epoch: 58, train_loss: 0.5929, test_loss: 0.8200, test_f1: 0.6553
 epoch: 59, train_loss: 0.6139, test_loss: 0.8227, test_f1: 0.6582
 epoch: 60, train_loss: 0.5835, test_loss: 0.7859, test_f1: 0.6616
 epoch: 61, train_loss: 0.6029, test_loss: 0.8680, test_f1: 0.6693
 epoch: 62, train_loss: 0.5949, test_loss: 0.9095, test_f1: 0.6589
 epoch: 63, train_loss: 0.5886, test_loss: 0.8700, test_f1: 0.6532
 epoch: 64, train_loss: 0.5801, test_loss: 0.8839, test_f1: 0.6541
 epoch: 65, train_loss: 0.5663, test_loss: 0.9476, test_f1: 0.6608
 epoch: 66, train_loss: 0.5809, test_loss: 0.8183, test_f1: 0.6691
 epoch: 67, train_loss: 0.5949, test_loss: 0.8994, test_f1: 0.6578
 epoch: 68, train_loss: 0.5860, test_loss: 0.7759, test_f1: 0.6734
 epoch: 69, train_loss: 0.5748, test_loss: 0.8900, test_f1: 0.6487
 epoch: 70, train_loss: 0.5529, test_loss: 0.9543, test_f1: 0.6670
 epoch: 71, train_loss: 0.5519, test_loss: 0.9021, test_f1: 0.6501
 epoch: 72, train_loss: 0.5669, test_loss: 0.9654, test_f1: 0.6618
 epoch: 73, train_loss: 0.5463, test_loss: 0.8517, test_f1: 0.6562
 epoch: 74, train_loss: 0.5701, test_loss: 0.9061, test_f1: 0.6689
 epoch: 75, train_loss: 0.5683, test_loss: 0.9236, test_f1: 0.6417
 epoch: 76, train_loss: 0.5579, test_loss: 0.9166, test_f1: 0.6533
 epoch: 77, train_loss: 0.5458, test_loss: 0.9356, test_f1: 0.6714
 epoch: 78, train_loss: 0.5301, test_loss: 0.9981, test_f1: 0.6136
 epoch: 79, train_loss: 0.5497, test_loss: 0.9690, test_f1: 0.6900
 epoch: 80, train_loss: 0.5422, test_loss: 0.8399, test_f1: 0.6541
 epoch: 81, train_loss: 0.5383, test_loss: 0.9028, test_f1: 0.6610
 epoch: 82, train_loss: 0.5531, test_loss: 0.9012, test_f1: 0.6507
 epoch: 83, train_loss: 0.5542, test_loss: 0.9321, test_f1: 0.6988
 epoch: 84, train_loss: 0.5360, test_loss: 0.9620, test_f1: 0.6735
 epoch: 85, train_loss: 0.5385, test_loss: 1.0480, test_f1: 0.6649
 epoch: 86, train_loss: 0.5362, test_loss: 0.8405, test_f1: 0.6716
 epoch: 87, train_loss: 0.5272, test_loss: 0.8659, test_f1: 0.6737
 epoch: 88, train_loss: 0.5371, test_loss: 1.0427, test_f1: 0.6670
 epoch: 89, train_loss: 0.5356, test_loss: 1.0460, test_f1: 0.6345
 epoch: 90, train_loss: 0.5167, test_loss: 1.0084, test_f1: 0.6669
 epoch: 91, train_loss: 0.5190, test_loss: 0.9554, test_f1: 0.6540
 epoch: 92, train_loss: 0.5275, test_loss: 0.9848, test_f1: 0.6350
 epoch: 93, train_loss: 0.5049, test_loss: 1.0826, test_f1: 0.6690
 epoch: 94, train_loss: 0.5243, test_loss: 1.1138, test_f1: 0.6428
 epoch: 95, train_loss: 0.5200, test_loss: 0.9910, test_f1: 0.6227
 epoch: 96, train_loss: 0.5166, test_loss: 1.0542, test_f1: 0.6411
 epoch: 97, train_loss: 0.5181, test_loss: 0.9159, test_f1: 0.6716
 epoch: 98, train_loss: 0.5034, test_loss: 1.0572, test_f1: 0.6518
 epoch: 99, train_loss: 0.5090, test_loss: 0.9973, test_f1: 0.6589
##################ITERATION #2 ****************************************
 epoch: 0, train_loss: 1.0999, test_loss: 1.1760, test_f1: 0.4065
 epoch: 1, train_loss: 0.9857, test_loss: 1.0131, test_f1: 0.4782
 epoch: 2, train_loss: 0.9527, test_loss: 0.9746, test_f1: 0.5080
 epoch: 3, train_loss: 0.9610, test_loss: 0.9611, test_f1: 0.4743
 epoch: 4, train_loss: 0.9343, test_loss: 0.8895, test_f1: 0.5391
 epoch: 5, train_loss: 0.9213, test_loss: 0.8882, test_f1: 0.5029
 epoch: 6, train_loss: 0.9057, test_loss: 0.8749, test_f1: 0.5239
 epoch: 7, train_loss: 0.9091, test_loss: 0.9181, test_f1: 0.5207
 epoch: 8, train_loss: 0.8800, test_loss: 0.8824, test_f1: 0.5346
 epoch: 9, train_loss: 0.8843, test_loss: 0.8371, test_f1: 0.6146
 epoch: 10, train_loss: 0.8781, test_loss: 0.8604, test_f1: 0.5603
 epoch: 11, train_loss: 0.8634, test_loss: 0.9521, test_f1: 0.4820
 epoch: 12, train_loss: 0.8383, test_loss: 0.7795, test_f1: 0.5692
 epoch: 13, train_loss: 0.8344, test_loss: 0.8261, test_f1: 0.5478
 epoch: 14, train_loss: 0.8211, test_loss: 0.8995, test_f1: 0.5604
 epoch: 15, train_loss: 0.8124, test_loss: 0.9246, test_f1: 0.5889
 epoch: 16, train_loss: 0.8014, test_loss: 0.8205, test_f1: 0.6401
 epoch: 17, train_loss: 0.8012, test_loss: 0.8501, test_f1: 0.5931
 epoch: 18, train_loss: 0.7902, test_loss: 0.8150, test_f1: 0.6211
 epoch: 19, train_loss: 0.7769, test_loss: 0.7525, test_f1: 0.5910
 epoch: 20, train_loss: 0.7999, test_loss: 0.8384, test_f1: 0.5821
 epoch: 21, train_loss: 0.7637, test_loss: 0.8103, test_f1: 0.5854
 epoch: 22, train_loss: 0.7759, test_loss: 0.7449, test_f1: 0.6434
 epoch: 23, train_loss: 0.7569, test_loss: 0.8040, test_f1: 0.5821
 epoch: 24, train_loss: 0.7750, test_loss: 0.7580, test_f1: 0.6269
 epoch: 25, train_loss: 0.7325, test_loss: 0.9549, test_f1: 0.5651
 epoch: 26, train_loss: 0.7495, test_loss: 0.7545, test_f1: 0.6016
 epoch: 27, train_loss: 0.7484, test_loss: 0.8397, test_f1: 0.5825
 epoch: 28, train_loss: 0.7269, test_loss: 0.9002, test_f1: 0.6352
 epoch: 29, train_loss: 0.7302, test_loss: 0.7601, test_f1: 0.6189
 epoch: 30, train_loss: 0.7428, test_loss: 0.7468, test_f1: 0.6408
 epoch: 31, train_loss: 0.7388, test_loss: 0.7650, test_f1: 0.6521
 epoch: 32, train_loss: 0.7171, test_loss: 0.7886, test_f1: 0.6310
 epoch: 33, train_loss: 0.7438, test_loss: 0.8397, test_f1: 0.6231
 epoch: 34, train_loss: 0.7244, test_loss: 0.7976, test_f1: 0.6099
 epoch: 35, train_loss: 0.7299, test_loss: 0.7996, test_f1: 0.6350
 epoch: 36, train_loss: 0.7372, test_loss: 0.9264, test_f1: 0.5682
 epoch: 37, train_loss: 0.7220, test_loss: 0.8795, test_f1: 0.5978
 epoch: 38, train_loss: 0.7089, test_loss: 0.7678, test_f1: 0.6656
 epoch: 39, train_loss: 0.7247, test_loss: 0.8531, test_f1: 0.6206
 epoch: 40, train_loss: 0.7159, test_loss: 0.7567, test_f1: 0.6691
 epoch: 41, train_loss: 0.7190, test_loss: 0.8888, test_f1: 0.5287
 epoch: 42, train_loss: 0.7114, test_loss: 0.7459, test_f1: 0.6285
 epoch: 43, train_loss: 0.7040, test_loss: 0.8149, test_f1: 0.6437
 epoch: 44, train_loss: 0.6972, test_loss: 0.7088, test_f1: 0.6517
 epoch: 45, train_loss: 0.6875, test_loss: 0.7693, test_f1: 0.6541
 epoch: 46, train_loss: 0.7176, test_loss: 0.7536, test_f1: 0.6318
 epoch: 47, train_loss: 0.6802, test_loss: 0.8681, test_f1: 0.5894
 epoch: 48, train_loss: 0.6872, test_loss: 0.9072, test_f1: 0.6363
 epoch: 49, train_loss: 0.6944, test_loss: 0.8140, test_f1: 0.6306
 epoch: 50, train_loss: 0.6780, test_loss: 0.8075, test_f1: 0.6244
 epoch: 51, train_loss: 0.6464, test_loss: 0.7478, test_f1: 0.6527
 epoch: 52, train_loss: 0.6414, test_loss: 0.7581, test_f1: 0.6514
 epoch: 53, train_loss: 0.6260, test_loss: 0.7800, test_f1: 0.6208
 epoch: 54, train_loss: 0.6135, test_loss: 0.8162, test_f1: 0.6461
 epoch: 55, train_loss: 0.6150, test_loss: 0.7491, test_f1: 0.6387
 epoch: 56, train_loss: 0.6068, test_loss: 0.7852, test_f1: 0.6389
 epoch: 57, train_loss: 0.6161, test_loss: 0.6970, test_f1: 0.6624
 epoch: 58, train_loss: 0.6072, test_loss: 0.8155, test_f1: 0.6441
 epoch: 59, train_loss: 0.6130, test_loss: 0.7228, test_f1: 0.6609
 epoch: 60, train_loss: 0.6039, test_loss: 0.7361, test_f1: 0.6731
 epoch: 61, train_loss: 0.5945, test_loss: 0.7473, test_f1: 0.6736
 epoch: 62, train_loss: 0.6064, test_loss: 0.7623, test_f1: 0.6446
 epoch: 63, train_loss: 0.6052, test_loss: 0.7005, test_f1: 0.6735
 epoch: 64, train_loss: 0.6092, test_loss: 0.7541, test_f1: 0.6574
 epoch: 65, train_loss: 0.5912, test_loss: 0.6883, test_f1: 0.6928
 epoch: 66, train_loss: 0.5863, test_loss: 0.7698, test_f1: 0.6534
 epoch: 67, train_loss: 0.5924, test_loss: 0.7468, test_f1: 0.6777
 epoch: 68, train_loss: 0.5909, test_loss: 0.7113, test_f1: 0.6885
 epoch: 69, train_loss: 0.5850, test_loss: 0.7809, test_f1: 0.6919
 epoch: 70, train_loss: 0.6071, test_loss: 0.7326, test_f1: 0.6718
 epoch: 71, train_loss: 0.5675, test_loss: 0.7630, test_f1: 0.6380
 epoch: 72, train_loss: 0.5847, test_loss: 0.7542, test_f1: 0.6911
 epoch: 73, train_loss: 0.6008, test_loss: 0.7185, test_f1: 0.6579
 epoch: 74, train_loss: 0.5845, test_loss: 0.7978, test_f1: 0.6589
 epoch: 75, train_loss: 0.5710, test_loss: 0.6860, test_f1: 0.7025
 epoch: 76, train_loss: 0.5661, test_loss: 0.7170, test_f1: 0.6706
 epoch: 77, train_loss: 0.5640, test_loss: 0.7506, test_f1: 0.6561
 epoch: 78, train_loss: 0.5947, test_loss: 0.7134, test_f1: 0.6754
 epoch: 79, train_loss: 0.5710, test_loss: 0.7147, test_f1: 0.6625
 epoch: 80, train_loss: 0.5526, test_loss: 0.7282, test_f1: 0.6661
 epoch: 81, train_loss: 0.5575, test_loss: 0.7523, test_f1: 0.6758
 epoch: 82, train_loss: 0.5493, test_loss: 0.7827, test_f1: 0.6621
 epoch: 83, train_loss: 0.5654, test_loss: 0.7012, test_f1: 0.6762
 epoch: 84, train_loss: 0.5757, test_loss: 0.7177, test_f1: 0.6935
 epoch: 85, train_loss: 0.5562, test_loss: 0.7256, test_f1: 0.6890
 epoch: 86, train_loss: 0.5515, test_loss: 0.7588, test_f1: 0.6836
 epoch: 87, train_loss: 0.5418, test_loss: 0.7681, test_f1: 0.6598
 epoch: 88, train_loss: 0.5695, test_loss: 0.7616, test_f1: 0.6691
 epoch: 89, train_loss: 0.5579, test_loss: 0.7362, test_f1: 0.6675
 epoch: 90, train_loss: 0.5503, test_loss: 0.8299, test_f1: 0.6916
 epoch: 91, train_loss: 0.5725, test_loss: 0.7299, test_f1: 0.6639
 epoch: 92, train_loss: 0.5638, test_loss: 0.7443, test_f1: 0.6838
 epoch: 93, train_loss: 0.5446, test_loss: 0.7603, test_f1: 0.6778
 epoch: 94, train_loss: 0.5415, test_loss: 0.7572, test_f1: 0.6688
 epoch: 95, train_loss: 0.5448, test_loss: 0.7336, test_f1: 0.6748
 epoch: 96, train_loss: 0.5485, test_loss: 0.7558, test_f1: 0.6825
 epoch: 97, train_loss: 0.5312, test_loss: 0.7893, test_f1: 0.6519
 epoch: 98, train_loss: 0.5314, test_loss: 0.7119, test_f1: 0.6622
 epoch: 99, train_loss: 0.5321, test_loss: 0.7452, test_f1: 0.6599
##################ITERATION #3 ****************************************
 epoch: 0, train_loss: 1.0873, test_loss: 1.0410, test_f1: 0.4050
 epoch: 1, train_loss: 0.9933, test_loss: 0.9404, test_f1: 0.5124
 epoch: 2, train_loss: 0.9663, test_loss: 1.0161, test_f1: 0.4853
 epoch: 3, train_loss: 0.9386, test_loss: 0.9803, test_f1: 0.5109
 epoch: 4, train_loss: 0.9219, test_loss: 0.9958, test_f1: 0.5165
 epoch: 5, train_loss: 0.9043, test_loss: 0.9547, test_f1: 0.4800
 epoch: 6, train_loss: 0.8910, test_loss: 0.8327, test_f1: 0.5815
 epoch: 7, train_loss: 0.8884, test_loss: 0.9707, test_f1: 0.5242
 epoch: 8, train_loss: 0.8650, test_loss: 0.9156, test_f1: 0.5070
 epoch: 9, train_loss: 0.8594, test_loss: 0.8805, test_f1: 0.4958
 epoch: 10, train_loss: 0.8527, test_loss: 0.8221, test_f1: 0.5580
 epoch: 11, train_loss: 0.8426, test_loss: 0.8368, test_f1: 0.5623
 epoch: 12, train_loss: 0.8286, test_loss: 0.9073, test_f1: 0.5478
 epoch: 13, train_loss: 0.8278, test_loss: 0.8738, test_f1: 0.5414
 epoch: 14, train_loss: 0.8252, test_loss: 1.0164, test_f1: 0.5108
 epoch: 15, train_loss: 0.8312, test_loss: 0.8059, test_f1: 0.5704
 epoch: 16, train_loss: 0.8016, test_loss: 0.9982, test_f1: 0.5860
 epoch: 17, train_loss: 0.8059, test_loss: 0.9288, test_f1: 0.5816
 epoch: 18, train_loss: 0.7864, test_loss: 0.8572, test_f1: 0.6005
 epoch: 19, train_loss: 0.7818, test_loss: 0.8892, test_f1: 0.5994
 epoch: 20, train_loss: 0.7784, test_loss: 1.0090, test_f1: 0.5426
 epoch: 21, train_loss: 0.7810, test_loss: 0.9197, test_f1: 0.5455
 epoch: 22, train_loss: 0.7875, test_loss: 1.0617, test_f1: 0.5596
 epoch: 23, train_loss: 0.7666, test_loss: 0.8491, test_f1: 0.5631
 epoch: 24, train_loss: 0.7723, test_loss: 0.9228, test_f1: 0.5735
 epoch: 25, train_loss: 0.7612, test_loss: 0.9143, test_f1: 0.5985
 epoch: 26, train_loss: 0.7566, test_loss: 0.8410, test_f1: 0.6203
 epoch: 27, train_loss: 0.7594, test_loss: 1.0203, test_f1: 0.5656
 epoch: 28, train_loss: 0.7480, test_loss: 0.9175, test_f1: 0.6061
 epoch: 29, train_loss: 0.7490, test_loss: 0.8790, test_f1: 0.6164
 epoch: 30, train_loss: 0.7473, test_loss: 0.9599, test_f1: 0.6004
 epoch: 31, train_loss: 0.7319, test_loss: 0.8972, test_f1: 0.6324
 epoch: 32, train_loss: 0.7235, test_loss: 0.8638, test_f1: 0.6172
 epoch: 33, train_loss: 0.7149, test_loss: 1.1444, test_f1: 0.5956
 epoch: 34, train_loss: 0.7231, test_loss: 0.8924, test_f1: 0.6379
 epoch: 35, train_loss: 0.6981, test_loss: 0.9272, test_f1: 0.6122
 epoch: 36, train_loss: 0.7195, test_loss: 0.9821, test_f1: 0.5863
 epoch: 37, train_loss: 0.7097, test_loss: 0.9160, test_f1: 0.5936
 epoch: 38, train_loss: 0.7115, test_loss: 0.9144, test_f1: 0.6325
 epoch: 39, train_loss: 0.6948, test_loss: 0.9250, test_f1: 0.6343
 epoch: 40, train_loss: 0.7090, test_loss: 0.9296, test_f1: 0.6514
 epoch: 41, train_loss: 0.7016, test_loss: 1.1492, test_f1: 0.5575
 epoch: 42, train_loss: 0.6972, test_loss: 0.8903, test_f1: 0.6492
 epoch: 43, train_loss: 0.6931, test_loss: 1.0192, test_f1: 0.6084
 epoch: 44, train_loss: 0.7071, test_loss: 0.9719, test_f1: 0.6119
 epoch: 45, train_loss: 0.6931, test_loss: 0.8961, test_f1: 0.6674
 epoch: 46, train_loss: 0.6795, test_loss: 0.9162, test_f1: 0.6707
 epoch: 47, train_loss: 0.6784, test_loss: 0.9177, test_f1: 0.6395
 epoch: 48, train_loss: 0.6803, test_loss: 0.9806, test_f1: 0.6000
 epoch: 49, train_loss: 0.6781, test_loss: 1.0576, test_f1: 0.5492
 epoch: 50, train_loss: 0.7089, test_loss: 0.8125, test_f1: 0.6084
 epoch: 51, train_loss: 0.6652, test_loss: 0.8654, test_f1: 0.6237
 epoch: 52, train_loss: 0.6338, test_loss: 0.8581, test_f1: 0.6593
 epoch: 53, train_loss: 0.6421, test_loss: 0.9000, test_f1: 0.6552
 epoch: 54, train_loss: 0.6282, test_loss: 0.8809, test_f1: 0.6640
 epoch: 55, train_loss: 0.6126, test_loss: 0.8698, test_f1: 0.6760
 epoch: 56, train_loss: 0.6084, test_loss: 0.8990, test_f1: 0.6553
 epoch: 57, train_loss: 0.6237, test_loss: 0.9528, test_f1: 0.6711
 epoch: 58, train_loss: 0.6005, test_loss: 0.9725, test_f1: 0.6566
 epoch: 59, train_loss: 0.6015, test_loss: 0.9851, test_f1: 0.6340
 epoch: 60, train_loss: 0.6088, test_loss: 0.9635, test_f1: 0.6522
 epoch: 61, train_loss: 0.6075, test_loss: 0.9806, test_f1: 0.6633
 epoch: 62, train_loss: 0.5955, test_loss: 0.9466, test_f1: 0.6538
 epoch: 63, train_loss: 0.6091, test_loss: 0.9639, test_f1: 0.6560
 epoch: 64, train_loss: 0.6199, test_loss: 1.0018, test_f1: 0.6677
 epoch: 65, train_loss: 0.5902, test_loss: 0.9917, test_f1: 0.6680
 epoch: 66, train_loss: 0.5833, test_loss: 1.0314, test_f1: 0.6708
 epoch: 67, train_loss: 0.5779, test_loss: 1.0249, test_f1: 0.6867
 epoch: 68, train_loss: 0.6012, test_loss: 0.9692, test_f1: 0.6907
 epoch: 69, train_loss: 0.5830, test_loss: 1.0373, test_f1: 0.6770
 epoch: 70, train_loss: 0.5844, test_loss: 0.9688, test_f1: 0.6543
 epoch: 71, train_loss: 0.5905, test_loss: 1.0268, test_f1: 0.6970
 epoch: 72, train_loss: 0.5860, test_loss: 0.9855, test_f1: 0.6656
 epoch: 73, train_loss: 0.5854, test_loss: 1.0135, test_f1: 0.6938
 epoch: 74, train_loss: 0.5796, test_loss: 1.0208, test_f1: 0.7024
 epoch: 75, train_loss: 0.5856, test_loss: 1.0249, test_f1: 0.6713
 epoch: 76, train_loss: 0.5898, test_loss: 1.0305, test_f1: 0.6885
 epoch: 77, train_loss: 0.6026, test_loss: 1.0208, test_f1: 0.6819
 epoch: 78, train_loss: 0.5690, test_loss: 1.0340, test_f1: 0.6732
 epoch: 79, train_loss: 0.5874, test_loss: 1.0744, test_f1: 0.6916
 epoch: 80, train_loss: 0.5684, test_loss: 1.0143, test_f1: 0.6585
 epoch: 81, train_loss: 0.5593, test_loss: 0.9980, test_f1: 0.6791
 epoch: 82, train_loss: 0.5573, test_loss: 1.0532, test_f1: 0.6905
 epoch: 83, train_loss: 0.5487, test_loss: 0.9990, test_f1: 0.6787
 epoch: 84, train_loss: 0.5730, test_loss: 0.9577, test_f1: 0.6674
 epoch: 85, train_loss: 0.5501, test_loss: 1.0281, test_f1: 0.7029
 epoch: 86, train_loss: 0.5518, test_loss: 1.0844, test_f1: 0.6796
 epoch: 87, train_loss: 0.5458, test_loss: 1.0245, test_f1: 0.6726
 epoch: 88, train_loss: 0.5340, test_loss: 1.1944, test_f1: 0.7027
 epoch: 89, train_loss: 0.5716, test_loss: 1.0561, test_f1: 0.7088
 epoch: 90, train_loss: 0.5768, test_loss: 1.0459, test_f1: 0.6639
 epoch: 91, train_loss: 0.5611, test_loss: 1.0407, test_f1: 0.6766
 epoch: 92, train_loss: 0.5459, test_loss: 1.0727, test_f1: 0.6937
 epoch: 93, train_loss: 0.5511, test_loss: 1.0690, test_f1: 0.6934
 epoch: 94, train_loss: 0.5502, test_loss: 1.0307, test_f1: 0.7147
 epoch: 95, train_loss: 0.5464, test_loss: 1.0357, test_f1: 0.6865
 epoch: 96, train_loss: 0.5491, test_loss: 0.9896, test_f1: 0.7002
 epoch: 97, train_loss: 0.5293, test_loss: 1.0551, test_f1: 0.6824
 epoch: 98, train_loss: 0.5526, test_loss: 1.0008, test_f1: 0.6787
 epoch: 99, train_loss: 0.5405, test_loss: 1.0920, test_f1: 0.6829
##################ITERATION #4 ****************************************
 epoch: 0, train_loss: 1.0912, test_loss: 1.1155, test_f1: 0.4422
 epoch: 1, train_loss: 0.9992, test_loss: 1.0060, test_f1: 0.4635
 epoch: 2, train_loss: 0.9632, test_loss: 0.9495, test_f1: 0.4948
 epoch: 3, train_loss: 0.9445, test_loss: 0.9135, test_f1: 0.5071
 epoch: 4, train_loss: 0.9180, test_loss: 0.9718, test_f1: 0.5102
 epoch: 5, train_loss: 0.9063, test_loss: 0.9340, test_f1: 0.5273
 epoch: 6, train_loss: 0.8811, test_loss: 0.9331, test_f1: 0.5260
 epoch: 7, train_loss: 0.8622, test_loss: 0.8540, test_f1: 0.5180
 epoch: 8, train_loss: 0.8774, test_loss: 0.9092, test_f1: 0.5911
 epoch: 9, train_loss: 0.8526, test_loss: 0.8681, test_f1: 0.4917
 epoch: 10, train_loss: 0.8569, test_loss: 0.8786, test_f1: 0.5221
 epoch: 11, train_loss: 0.8445, test_loss: 0.8119, test_f1: 0.5503
 epoch: 12, train_loss: 0.8259, test_loss: 0.8714, test_f1: 0.5244
 epoch: 13, train_loss: 0.8132, test_loss: 0.7839, test_f1: 0.5674
 epoch: 14, train_loss: 0.8147, test_loss: 0.8003, test_f1: 0.5612
 epoch: 15, train_loss: 0.8183, test_loss: 1.0505, test_f1: 0.5550
 epoch: 16, train_loss: 0.8298, test_loss: 0.9224, test_f1: 0.5047
 epoch: 17, train_loss: 0.8144, test_loss: 0.8275, test_f1: 0.5992
 epoch: 18, train_loss: 0.7980, test_loss: 0.8417, test_f1: 0.6055
 epoch: 19, train_loss: 0.8005, test_loss: 0.8551, test_f1: 0.6057
 epoch: 20, train_loss: 0.7956, test_loss: 0.8108, test_f1: 0.6125
 epoch: 21, train_loss: 0.7816, test_loss: 0.7505, test_f1: 0.6477
 epoch: 22, train_loss: 0.7679, test_loss: 0.8784, test_f1: 0.5745
 epoch: 23, train_loss: 0.7776, test_loss: 0.7969, test_f1: 0.5836
 epoch: 24, train_loss: 0.7650, test_loss: 0.7565, test_f1: 0.6413
 epoch: 25, train_loss: 0.7583, test_loss: 0.7865, test_f1: 0.6063
 epoch: 26, train_loss: 0.7456, test_loss: 0.7315, test_f1: 0.6500
 epoch: 27, train_loss: 0.7504, test_loss: 0.8040, test_f1: 0.6382
 epoch: 28, train_loss: 0.7471, test_loss: 0.7837, test_f1: 0.5955
 epoch: 29, train_loss: 0.7463, test_loss: 0.7724, test_f1: 0.6723
 epoch: 30, train_loss: 0.7395, test_loss: 0.7417, test_f1: 0.6178
 epoch: 31, train_loss: 0.7469, test_loss: 0.8032, test_f1: 0.6461
 epoch: 32, train_loss: 0.7537, test_loss: 0.7900, test_f1: 0.6072
 epoch: 33, train_loss: 0.7210, test_loss: 0.7372, test_f1: 0.6882
 epoch: 34, train_loss: 0.7276, test_loss: 0.7508, test_f1: 0.6392
 epoch: 35, train_loss: 0.7300, test_loss: 0.7634, test_f1: 0.6135
 epoch: 36, train_loss: 0.7147, test_loss: 0.8431, test_f1: 0.6327
 epoch: 37, train_loss: 0.7296, test_loss: 0.8083, test_f1: 0.6214
 epoch: 38, train_loss: 0.7191, test_loss: 0.7992, test_f1: 0.6342
 epoch: 39, train_loss: 0.7156, test_loss: 0.8416, test_f1: 0.6329
 epoch: 40, train_loss: 0.7006, test_loss: 0.8320, test_f1: 0.6909
 epoch: 41, train_loss: 0.7089, test_loss: 0.8652, test_f1: 0.6427
 epoch: 42, train_loss: 0.7052, test_loss: 0.8179, test_f1: 0.5980
 epoch: 43, train_loss: 0.6969, test_loss: 0.8538, test_f1: 0.6024
 epoch: 44, train_loss: 0.6909, test_loss: 0.8932, test_f1: 0.6445
 epoch: 45, train_loss: 0.6824, test_loss: 0.7957, test_f1: 0.6182
 epoch: 46, train_loss: 0.6875, test_loss: 0.9641, test_f1: 0.5827
 epoch: 47, train_loss: 0.6861, test_loss: 0.8712, test_f1: 0.6213
 epoch: 48, train_loss: 0.6836, test_loss: 0.8397, test_f1: 0.6813
 epoch: 49, train_loss: 0.6813, test_loss: 1.0296, test_f1: 0.6052
 epoch: 50, train_loss: 0.6794, test_loss: 0.8586, test_f1: 0.6669
 epoch: 51, train_loss: 0.6533, test_loss: 0.8442, test_f1: 0.6629
 epoch: 52, train_loss: 0.6333, test_loss: 0.8775, test_f1: 0.6512
 epoch: 53, train_loss: 0.6193, test_loss: 0.8891, test_f1: 0.6492
 epoch: 54, train_loss: 0.6239, test_loss: 0.8793, test_f1: 0.6818
 epoch: 55, train_loss: 0.6209, test_loss: 0.8961, test_f1: 0.6816
 epoch: 56, train_loss: 0.6248, test_loss: 0.8504, test_f1: 0.6610
 epoch: 57, train_loss: 0.6183, test_loss: 0.8429, test_f1: 0.6846
 epoch: 58, train_loss: 0.6061, test_loss: 0.8125, test_f1: 0.6474
 epoch: 59, train_loss: 0.6088, test_loss: 0.8942, test_f1: 0.6878
 epoch: 60, train_loss: 0.6171, test_loss: 0.9275, test_f1: 0.6506
 epoch: 61, train_loss: 0.6168, test_loss: 0.8794, test_f1: 0.6584
 epoch: 62, train_loss: 0.5976, test_loss: 0.9412, test_f1: 0.6592
 epoch: 63, train_loss: 0.6059, test_loss: 0.9155, test_f1: 0.6632
 epoch: 64, train_loss: 0.5918, test_loss: 0.9093, test_f1: 0.6656
 epoch: 65, train_loss: 0.6013, test_loss: 0.8862, test_f1: 0.6789
 epoch: 66, train_loss: 0.5873, test_loss: 0.9718, test_f1: 0.6642
 epoch: 67, train_loss: 0.5975, test_loss: 0.9428, test_f1: 0.6547
 epoch: 68, train_loss: 0.5955, test_loss: 0.9502, test_f1: 0.6799
 epoch: 69, train_loss: 0.6013, test_loss: 0.9209, test_f1: 0.6471
 epoch: 70, train_loss: 0.5696, test_loss: 0.9699, test_f1: 0.6797
 epoch: 71, train_loss: 0.5716, test_loss: 0.9441, test_f1: 0.6467
 epoch: 72, train_loss: 0.5788, test_loss: 0.9743, test_f1: 0.6498
 epoch: 73, train_loss: 0.5874, test_loss: 0.9377, test_f1: 0.6746
 epoch: 74, train_loss: 0.5826, test_loss: 0.9322, test_f1: 0.7042
 epoch: 75, train_loss: 0.5812, test_loss: 1.0113, test_f1: 0.6421
 epoch: 76, train_loss: 0.5715, test_loss: 0.9500, test_f1: 0.6594
 epoch: 77, train_loss: 0.5676, test_loss: 0.9998, test_f1: 0.6682
 epoch: 78, train_loss: 0.5749, test_loss: 0.9629, test_f1: 0.6527
 epoch: 79, train_loss: 0.5650, test_loss: 1.0211, test_f1: 0.6639
 epoch: 80, train_loss: 0.5669, test_loss: 0.9175, test_f1: 0.6394
 epoch: 81, train_loss: 0.5539, test_loss: 0.9900, test_f1: 0.6343
 epoch: 82, train_loss: 0.5689, test_loss: 0.9623, test_f1: 0.6410
 epoch: 83, train_loss: 0.5543, test_loss: 0.9850, test_f1: 0.6597
 epoch: 84, train_loss: 0.5615, test_loss: 0.9524, test_f1: 0.6714
 epoch: 85, train_loss: 0.5565, test_loss: 1.0232, test_f1: 0.6569
 epoch: 86, train_loss: 0.5456, test_loss: 1.0109, test_f1: 0.6845
 epoch: 87, train_loss: 0.5294, test_loss: 1.0483, test_f1: 0.6789
 epoch: 88, train_loss: 0.5591, test_loss: 0.9779, test_f1: 0.6517
 epoch: 89, train_loss: 0.5590, test_loss: 1.0083, test_f1: 0.6574
 epoch: 90, train_loss: 0.5405, test_loss: 1.0044, test_f1: 0.6543
 epoch: 91, train_loss: 0.5331, test_loss: 1.0664, test_f1: 0.6820
 epoch: 92, train_loss: 0.5391, test_loss: 0.9413, test_f1: 0.6823
 epoch: 93, train_loss: 0.5246, test_loss: 0.9920, test_f1: 0.6590
 epoch: 94, train_loss: 0.5561, test_loss: 1.0898, test_f1: 0.6411
 epoch: 95, train_loss: 0.5551, test_loss: 1.0480, test_f1: 0.6611
 epoch: 96, train_loss: 0.5415, test_loss: 0.9488, test_f1: 0.6798
 epoch: 97, train_loss: 0.5424, test_loss: 1.0046, test_f1: 0.6532
 epoch: 98, train_loss: 0.5617, test_loss: 1.0521, test_f1: 0.6634
 epoch: 99, train_loss: 0.5323, test_loss: 1.1000, test_f1: 0.6503
##################ITERATION #5 ****************************************
 epoch: 0, train_loss: 1.1188, test_loss: 1.1917, test_f1: 0.3645
 epoch: 1, train_loss: 1.0003, test_loss: 0.9413, test_f1: 0.4715
 epoch: 2, train_loss: 0.9653, test_loss: 1.0302, test_f1: 0.4911
 epoch: 3, train_loss: 0.9451, test_loss: 0.9689, test_f1: 0.5030
 epoch: 4, train_loss: 0.9079, test_loss: 1.0057, test_f1: 0.4823
 epoch: 5, train_loss: 0.8992, test_loss: 1.2434, test_f1: 0.3990
 epoch: 6, train_loss: 0.8968, test_loss: 0.9356, test_f1: 0.5322
 epoch: 7, train_loss: 0.8866, test_loss: 0.9408, test_f1: 0.5368
 epoch: 8, train_loss: 0.8810, test_loss: 0.9159, test_f1: 0.5095
 epoch: 9, train_loss: 0.8595, test_loss: 0.9525, test_f1: 0.5371
 epoch: 10, train_loss: 0.8560, test_loss: 0.9906, test_f1: 0.5235
 epoch: 11, train_loss: 0.8377, test_loss: 0.7964, test_f1: 0.5793
 epoch: 12, train_loss: 0.8314, test_loss: 0.9490, test_f1: 0.5299
 epoch: 13, train_loss: 0.8231, test_loss: 0.8160, test_f1: 0.5480
 epoch: 14, train_loss: 0.8189, test_loss: 0.9099, test_f1: 0.5601
 epoch: 15, train_loss: 0.8112, test_loss: 0.9137, test_f1: 0.5501
 epoch: 16, train_loss: 0.7962, test_loss: 0.9167, test_f1: 0.5670
 epoch: 17, train_loss: 0.8068, test_loss: 1.1258, test_f1: 0.5215
 epoch: 18, train_loss: 0.7841, test_loss: 0.8738, test_f1: 0.5758
 epoch: 19, train_loss: 0.7880, test_loss: 0.8914, test_f1: 0.6060
 epoch: 20, train_loss: 0.7930, test_loss: 0.8810, test_f1: 0.6117
 epoch: 21, train_loss: 0.7796, test_loss: 0.9080, test_f1: 0.5590
 epoch: 22, train_loss: 0.7969, test_loss: 0.9250, test_f1: 0.5500
 epoch: 23, train_loss: 0.8034, test_loss: 0.9252, test_f1: 0.5323
 epoch: 24, train_loss: 0.7801, test_loss: 0.9107, test_f1: 0.5957
 epoch: 25, train_loss: 0.7711, test_loss: 0.8617, test_f1: 0.5595
 epoch: 26, train_loss: 0.7545, test_loss: 0.8643, test_f1: 0.5877
 epoch: 27, train_loss: 0.7453, test_loss: 0.7994, test_f1: 0.6183
 epoch: 28, train_loss: 0.7593, test_loss: 0.8644, test_f1: 0.5938
 epoch: 29, train_loss: 0.7652, test_loss: 0.9268, test_f1: 0.5657
 epoch: 30, train_loss: 0.7424, test_loss: 0.8169, test_f1: 0.6171
 epoch: 31, train_loss: 0.7511, test_loss: 0.9509, test_f1: 0.5838
 epoch: 32, train_loss: 0.7353, test_loss: 0.9039, test_f1: 0.6198
 epoch: 33, train_loss: 0.7338, test_loss: 0.9029, test_f1: 0.5978
 epoch: 34, train_loss: 0.7272, test_loss: 0.9654, test_f1: 0.5820
 epoch: 35, train_loss: 0.7426, test_loss: 0.9000, test_f1: 0.5915
 epoch: 36, train_loss: 0.7325, test_loss: 0.9434, test_f1: 0.5868
 epoch: 37, train_loss: 0.7223, test_loss: 0.8998, test_f1: 0.6411
 epoch: 38, train_loss: 0.7416, test_loss: 0.8014, test_f1: 0.6055
 epoch: 39, train_loss: 0.7346, test_loss: 0.8210, test_f1: 0.6415
 epoch: 40, train_loss: 0.7104, test_loss: 0.9012, test_f1: 0.6331
 epoch: 41, train_loss: 0.7083, test_loss: 0.8750, test_f1: 0.6096
 epoch: 42, train_loss: 0.7116, test_loss: 0.9389, test_f1: 0.5771
 epoch: 43, train_loss: 0.7158, test_loss: 0.7732, test_f1: 0.6572
 epoch: 44, train_loss: 0.7155, test_loss: 0.9269, test_f1: 0.5963
 epoch: 45, train_loss: 0.7104, test_loss: 0.9403, test_f1: 0.5640
 epoch: 46, train_loss: 0.6928, test_loss: 0.8960, test_f1: 0.6400
 epoch: 47, train_loss: 0.6749, test_loss: 0.9643, test_f1: 0.5988
 epoch: 48, train_loss: 0.6969, test_loss: 0.8956, test_f1: 0.6481
 epoch: 49, train_loss: 0.6853, test_loss: 0.8575, test_f1: 0.6087
 epoch: 50, train_loss: 0.6958, test_loss: 0.8724, test_f1: 0.6351
 epoch: 51, train_loss: 0.6534, test_loss: 0.9203, test_f1: 0.6161
 epoch: 52, train_loss: 0.6616, test_loss: 0.8422, test_f1: 0.6447
 epoch: 53, train_loss: 0.6515, test_loss: 0.9269, test_f1: 0.6603
 epoch: 54, train_loss: 0.6359, test_loss: 0.8775, test_f1: 0.6586
 epoch: 55, train_loss: 0.6544, test_loss: 0.8425, test_f1: 0.6708
 epoch: 56, train_loss: 0.6200, test_loss: 0.7709, test_f1: 0.6420
 epoch: 57, train_loss: 0.6225, test_loss: 0.8799, test_f1: 0.6719
 epoch: 58, train_loss: 0.6464, test_loss: 0.8869, test_f1: 0.6535
 epoch: 59, train_loss: 0.6320, test_loss: 0.8734, test_f1: 0.6577
 epoch: 60, train_loss: 0.6296, test_loss: 0.7957, test_f1: 0.6530
 epoch: 61, train_loss: 0.6244, test_loss: 0.8863, test_f1: 0.6431
 epoch: 62, train_loss: 0.6207, test_loss: 0.7687, test_f1: 0.6578
 epoch: 63, train_loss: 0.6300, test_loss: 0.8579, test_f1: 0.6552
 epoch: 64, train_loss: 0.6234, test_loss: 0.8839, test_f1: 0.6565
 epoch: 65, train_loss: 0.6163, test_loss: 0.9254, test_f1: 0.6387
 epoch: 66, train_loss: 0.6219, test_loss: 0.8614, test_f1: 0.6574
 epoch: 67, train_loss: 0.6130, test_loss: 0.9123, test_f1: 0.6490
 epoch: 68, train_loss: 0.6027, test_loss: 0.8116, test_f1: 0.6600
 epoch: 69, train_loss: 0.6339, test_loss: 1.0177, test_f1: 0.6458
 epoch: 70, train_loss: 0.6119, test_loss: 0.7813, test_f1: 0.6325
 epoch: 71, train_loss: 0.6009, test_loss: 0.8667, test_f1: 0.6669
 epoch: 72, train_loss: 0.6146, test_loss: 0.8727, test_f1: 0.6465
 epoch: 73, train_loss: 0.6001, test_loss: 0.8855, test_f1: 0.6734
 epoch: 74, train_loss: 0.5964, test_loss: 0.9487, test_f1: 0.6281
 epoch: 75, train_loss: 0.6017, test_loss: 0.9605, test_f1: 0.6625
 epoch: 76, train_loss: 0.6154, test_loss: 0.8008, test_f1: 0.6780
 epoch: 77, train_loss: 0.5957, test_loss: 0.7997, test_f1: 0.6567
 epoch: 78, train_loss: 0.5993, test_loss: 0.8739, test_f1: 0.6544
 epoch: 79, train_loss: 0.5730, test_loss: 0.9630, test_f1: 0.6649
 epoch: 80, train_loss: 0.5797, test_loss: 1.0280, test_f1: 0.6801
 epoch: 81, train_loss: 0.5841, test_loss: 0.9988, test_f1: 0.6548
 epoch: 82, train_loss: 0.5962, test_loss: 0.9236, test_f1: 0.6705
 epoch: 83, train_loss: 0.5695, test_loss: 0.9265, test_f1: 0.6430
 epoch: 84, train_loss: 0.5902, test_loss: 0.8744, test_f1: 0.6627
 epoch: 85, train_loss: 0.5697, test_loss: 0.8554, test_f1: 0.6567
 epoch: 86, train_loss: 0.5562, test_loss: 1.0140, test_f1: 0.6510
 epoch: 87, train_loss: 0.5888, test_loss: 0.8975, test_f1: 0.6703
 epoch: 88, train_loss: 0.5486, test_loss: 0.8270, test_f1: 0.6669
 epoch: 89, train_loss: 0.5632, test_loss: 0.9419, test_f1: 0.6564
 epoch: 90, train_loss: 0.5640, test_loss: 0.9803, test_f1: 0.6433
 epoch: 91, train_loss: 0.5628, test_loss: 0.9468, test_f1: 0.6611
 epoch: 92, train_loss: 0.5491, test_loss: 1.0578, test_f1: 0.6491
 epoch: 93, train_loss: 0.5577, test_loss: 0.8670, test_f1: 0.6678
 epoch: 94, train_loss: 0.5695, test_loss: 1.0711, test_f1: 0.6390
 epoch: 95, train_loss: 0.5518, test_loss: 0.9255, test_f1: 0.6446
 epoch: 96, train_loss: 0.5615, test_loss: 0.8828, test_f1: 0.6543
 epoch: 97, train_loss: 0.5489, test_loss: 0.9210, test_f1: 0.6707
 epoch: 98, train_loss: 0.5495, test_loss: 0.9639, test_f1: 0.6385
 epoch: 99, train_loss: 0.5713, test_loss: 0.9969, test_f1: 0.6640
##################ITERATION #6 ****************************************
 epoch: 0, train_loss: 1.1361, test_loss: 1.1472, test_f1: 0.3817
 epoch: 1, train_loss: 1.0035, test_loss: 1.0422, test_f1: 0.5306
 epoch: 2, train_loss: 0.9825, test_loss: 1.0463, test_f1: 0.4891
 epoch: 3, train_loss: 0.9725, test_loss: 1.0183, test_f1: 0.4428
 epoch: 4, train_loss: 0.9640, test_loss: 1.0047, test_f1: 0.4919
 epoch: 5, train_loss: 0.9522, test_loss: 0.9725, test_f1: 0.4921
 epoch: 6, train_loss: 0.9420, test_loss: 1.0259, test_f1: 0.4610
 epoch: 7, train_loss: 0.9191, test_loss: 1.0196, test_f1: 0.5149
 epoch: 8, train_loss: 0.9266, test_loss: 0.9756, test_f1: 0.5214
 epoch: 9, train_loss: 0.9132, test_loss: 0.9972, test_f1: 0.4893
 epoch: 10, train_loss: 0.8977, test_loss: 0.9431, test_f1: 0.5170
 epoch: 11, train_loss: 0.8807, test_loss: 0.9651, test_f1: 0.5397
 epoch: 12, train_loss: 0.8881, test_loss: 0.9762, test_f1: 0.5476
 epoch: 13, train_loss: 0.8677, test_loss: 0.9169, test_f1: 0.5165
 epoch: 14, train_loss: 0.8589, test_loss: 0.9954, test_f1: 0.5377
 epoch: 15, train_loss: 0.8673, test_loss: 0.9999, test_f1: 0.5203
 epoch: 16, train_loss: 0.8387, test_loss: 1.0683, test_f1: 0.5279
 epoch: 17, train_loss: 0.8621, test_loss: 0.9746, test_f1: 0.5675
 epoch: 18, train_loss: 0.8540, test_loss: 0.9280, test_f1: 0.5412
 epoch: 19, train_loss: 0.8382, test_loss: 0.9553, test_f1: 0.5581
 epoch: 20, train_loss: 0.8506, test_loss: 0.9351, test_f1: 0.5775
 epoch: 21, train_loss: 0.8368, test_loss: 0.8923, test_f1: 0.5277
 epoch: 22, train_loss: 0.8123, test_loss: 0.9479, test_f1: 0.5943
 epoch: 23, train_loss: 0.8092, test_loss: 0.9676, test_f1: 0.5865
 epoch: 24, train_loss: 0.8109, test_loss: 0.9628, test_f1: 0.5925
 epoch: 25, train_loss: 0.8105, test_loss: 1.1214, test_f1: 0.5038
 epoch: 26, train_loss: 0.8016, test_loss: 0.9603, test_f1: 0.5951
 epoch: 27, train_loss: 0.7903, test_loss: 1.0441, test_f1: 0.5200
 epoch: 28, train_loss: 0.7973, test_loss: 0.9274, test_f1: 0.5357
 epoch: 29, train_loss: 0.7857, test_loss: 0.9015, test_f1: 0.5890
 epoch: 30, train_loss: 0.7782, test_loss: 0.9266, test_f1: 0.6444
 epoch: 31, train_loss: 0.7709, test_loss: 0.9469, test_f1: 0.5823
 epoch: 32, train_loss: 0.7885, test_loss: 0.9617, test_f1: 0.6046
 epoch: 33, train_loss: 0.7768, test_loss: 1.0107, test_f1: 0.5427
 epoch: 34, train_loss: 0.7712, test_loss: 0.9222, test_f1: 0.5942
 epoch: 35, train_loss: 0.7662, test_loss: 0.9604, test_f1: 0.5646
 epoch: 36, train_loss: 0.7597, test_loss: 0.9251, test_f1: 0.6050
 epoch: 37, train_loss: 0.7735, test_loss: 0.9859, test_f1: 0.5945
 epoch: 38, train_loss: 0.7676, test_loss: 1.0225, test_f1: 0.5613
 epoch: 39, train_loss: 0.7512, test_loss: 0.9303, test_f1: 0.5999
 epoch: 40, train_loss: 0.7637, test_loss: 0.9576, test_f1: 0.6017
 epoch: 41, train_loss: 0.7528, test_loss: 0.9123, test_f1: 0.6077
 epoch: 42, train_loss: 0.7321, test_loss: 0.9137, test_f1: 0.6304
 epoch: 43, train_loss: 0.7507, test_loss: 0.9580, test_f1: 0.6162
 epoch: 44, train_loss: 0.7340, test_loss: 0.9552, test_f1: 0.6103
 epoch: 45, train_loss: 0.7316, test_loss: 0.9055, test_f1: 0.6391
 epoch: 46, train_loss: 0.7181, test_loss: 1.0584, test_f1: 0.6471
 epoch: 47, train_loss: 0.7286, test_loss: 0.9799, test_f1: 0.6393
 epoch: 48, train_loss: 0.7458, test_loss: 0.9343, test_f1: 0.5839
 epoch: 49, train_loss: 0.7266, test_loss: 1.0152, test_f1: 0.6324
 epoch: 50, train_loss: 0.7355, test_loss: 0.9509, test_f1: 0.6143
 epoch: 51, train_loss: 0.7100, test_loss: 0.9419, test_f1: 0.6269
 epoch: 52, train_loss: 0.6753, test_loss: 0.9669, test_f1: 0.6472
 epoch: 53, train_loss: 0.6841, test_loss: 0.9449, test_f1: 0.6199
 epoch: 54, train_loss: 0.6757, test_loss: 1.0597, test_f1: 0.6103
 epoch: 55, train_loss: 0.6685, test_loss: 1.0716, test_f1: 0.6118
 epoch: 56, train_loss: 0.6710, test_loss: 0.9334, test_f1: 0.6603
 epoch: 57, train_loss: 0.6729, test_loss: 0.9584, test_f1: 0.6087
 epoch: 58, train_loss: 0.6677, test_loss: 0.9944, test_f1: 0.6695
 epoch: 59, train_loss: 0.6609, test_loss: 1.0801, test_f1: 0.6575
 epoch: 60, train_loss: 0.6542, test_loss: 0.9863, test_f1: 0.6739
 epoch: 61, train_loss: 0.6586, test_loss: 0.9739, test_f1: 0.6625
 epoch: 62, train_loss: 0.6465, test_loss: 1.0180, test_f1: 0.6437
 epoch: 63, train_loss: 0.6473, test_loss: 1.0020, test_f1: 0.6756
 epoch: 64, train_loss: 0.6461, test_loss: 1.0540, test_f1: 0.6695
 epoch: 65, train_loss: 0.6506, test_loss: 1.0410, test_f1: 0.6159
 epoch: 66, train_loss: 0.6534, test_loss: 1.0637, test_f1: 0.6420
 epoch: 67, train_loss: 0.6383, test_loss: 1.0410, test_f1: 0.6600
 epoch: 68, train_loss: 0.6680, test_loss: 1.1042, test_f1: 0.6318
 epoch: 69, train_loss: 0.6561, test_loss: 1.0137, test_f1: 0.6619
 epoch: 70, train_loss: 0.6398, test_loss: 1.0128, test_f1: 0.6248
 epoch: 71, train_loss: 0.6253, test_loss: 1.0147, test_f1: 0.6451
 epoch: 72, train_loss: 0.6227, test_loss: 1.1021, test_f1: 0.6353
 epoch: 73, train_loss: 0.6339, test_loss: 1.1018, test_f1: 0.6120
 epoch: 74, train_loss: 0.6324, test_loss: 1.2798, test_f1: 0.6521
 epoch: 75, train_loss: 0.6322, test_loss: 1.0610, test_f1: 0.6547
 epoch: 76, train_loss: 0.6266, test_loss: 1.1640, test_f1: 0.6315
 epoch: 77, train_loss: 0.6281, test_loss: 1.2657, test_f1: 0.6253
 epoch: 78, train_loss: 0.6135, test_loss: 1.2790, test_f1: 0.6608
 epoch: 79, train_loss: 0.6273, test_loss: 1.1547, test_f1: 0.6670
 epoch: 80, train_loss: 0.6312, test_loss: 1.1785, test_f1: 0.6201
 epoch: 81, train_loss: 0.6156, test_loss: 1.0916, test_f1: 0.6572
 epoch: 82, train_loss: 0.6157, test_loss: 1.2283, test_f1: 0.6438
 epoch: 83, train_loss: 0.6152, test_loss: 1.2784, test_f1: 0.6348
 epoch: 84, train_loss: 0.6081, test_loss: 1.2013, test_f1: 0.6100
 epoch: 85, train_loss: 0.6028, test_loss: 1.1197, test_f1: 0.6566
 epoch: 86, train_loss: 0.6017, test_loss: 1.2223, test_f1: 0.6397
 epoch: 87, train_loss: 0.5936, test_loss: 1.1471, test_f1: 0.6523
 epoch: 88, train_loss: 0.6109, test_loss: 1.2452, test_f1: 0.6060
 epoch: 89, train_loss: 0.5845, test_loss: 1.2815, test_f1: 0.6122
 epoch: 90, train_loss: 0.5916, test_loss: 1.1444, test_f1: 0.6237
 epoch: 91, train_loss: 0.6142, test_loss: 1.2832, test_f1: 0.6265
 epoch: 92, train_loss: 0.6025, test_loss: 1.2873, test_f1: 0.6489
 epoch: 93, train_loss: 0.5973, test_loss: 1.4215, test_f1: 0.6572
 epoch: 94, train_loss: 0.5999, test_loss: 1.2058, test_f1: 0.6249
 epoch: 95, train_loss: 0.5901, test_loss: 1.4589, test_f1: 0.6191
 epoch: 96, train_loss: 0.6087, test_loss: 1.3986, test_f1: 0.6670
 epoch: 97, train_loss: 0.6078, test_loss: 1.2667, test_f1: 0.6330
 epoch: 98, train_loss: 0.5940, test_loss: 1.2043, test_f1: 0.6396
 epoch: 99, train_loss: 0.5803, test_loss: 1.3909, test_f1: 0.6538
##################ITERATION #7 ****************************************
 epoch: 0, train_loss: 1.0909, test_loss: 1.0883, test_f1: 0.4840
 epoch: 1, train_loss: 0.9823, test_loss: 1.0083, test_f1: 0.5072
 epoch: 2, train_loss: 0.9525, test_loss: 0.9925, test_f1: 0.4962
 epoch: 3, train_loss: 0.9301, test_loss: 0.8994, test_f1: 0.5290
 epoch: 4, train_loss: 0.9301, test_loss: 0.9387, test_f1: 0.5491
 epoch: 5, train_loss: 0.9214, test_loss: 0.9795, test_f1: 0.5159
 epoch: 6, train_loss: 0.8935, test_loss: 0.9585, test_f1: 0.5138
 epoch: 7, train_loss: 0.8685, test_loss: 1.0741, test_f1: 0.5243
 epoch: 8, train_loss: 0.8769, test_loss: 0.8917, test_f1: 0.5616
 epoch: 9, train_loss: 0.8518, test_loss: 0.8555, test_f1: 0.5520
 epoch: 10, train_loss: 0.8393, test_loss: 0.9788, test_f1: 0.5556
 epoch: 11, train_loss: 0.8374, test_loss: 0.9934, test_f1: 0.4784
 epoch: 12, train_loss: 0.8373, test_loss: 1.0231, test_f1: 0.5309
 epoch: 13, train_loss: 0.8309, test_loss: 0.8937, test_f1: 0.5687
 epoch: 14, train_loss: 0.8198, test_loss: 0.8383, test_f1: 0.5504
 epoch: 15, train_loss: 0.8262, test_loss: 0.9117, test_f1: 0.5911
 epoch: 16, train_loss: 0.7973, test_loss: 0.8304, test_f1: 0.5565
 epoch: 17, train_loss: 0.7995, test_loss: 0.9032, test_f1: 0.6008
 epoch: 18, train_loss: 0.7772, test_loss: 0.9009, test_f1: 0.6140
 epoch: 19, train_loss: 0.7930, test_loss: 0.8973, test_f1: 0.5775
 epoch: 20, train_loss: 0.7910, test_loss: 0.9012, test_f1: 0.5900
 epoch: 21, train_loss: 0.7717, test_loss: 0.9207, test_f1: 0.6178
 epoch: 22, train_loss: 0.7816, test_loss: 0.8443, test_f1: 0.5673
 epoch: 23, train_loss: 0.7886, test_loss: 0.9549, test_f1: 0.5604
 epoch: 24, train_loss: 0.7807, test_loss: 1.0701, test_f1: 0.4964
 epoch: 25, train_loss: 0.7694, test_loss: 0.8215, test_f1: 0.5920
 epoch: 26, train_loss: 0.7657, test_loss: 0.8017, test_f1: 0.6179
 epoch: 27, train_loss: 0.7414, test_loss: 0.9090, test_f1: 0.6094
 epoch: 28, train_loss: 0.7624, test_loss: 0.8387, test_f1: 0.5969
 epoch: 29, train_loss: 0.7502, test_loss: 0.8412, test_f1: 0.6244
 epoch: 30, train_loss: 0.7323, test_loss: 0.8705, test_f1: 0.5960
 epoch: 31, train_loss: 0.7479, test_loss: 0.9135, test_f1: 0.6009
 epoch: 32, train_loss: 0.7522, test_loss: 0.9155, test_f1: 0.6177
 epoch: 33, train_loss: 0.7356, test_loss: 0.8271, test_f1: 0.6224
 epoch: 34, train_loss: 0.7744, test_loss: 0.8961, test_f1: 0.5933
 epoch: 35, train_loss: 0.7333, test_loss: 0.7901, test_f1: 0.6265
 epoch: 36, train_loss: 0.7202, test_loss: 0.8435, test_f1: 0.6119
 epoch: 37, train_loss: 0.7346, test_loss: 0.8036, test_f1: 0.6163
 epoch: 38, train_loss: 0.7276, test_loss: 0.7992, test_f1: 0.6290
 epoch: 39, train_loss: 0.7198, test_loss: 0.8932, test_f1: 0.6269
 epoch: 40, train_loss: 0.7051, test_loss: 0.8479, test_f1: 0.6101
 epoch: 41, train_loss: 0.7046, test_loss: 0.8428, test_f1: 0.6409
 epoch: 42, train_loss: 0.7115, test_loss: 0.7885, test_f1: 0.6497
 epoch: 43, train_loss: 0.7016, test_loss: 0.9079, test_f1: 0.6554
 epoch: 44, train_loss: 0.6944, test_loss: 0.9949, test_f1: 0.5983
 epoch: 45, train_loss: 0.7081, test_loss: 0.9083, test_f1: 0.6332
 epoch: 46, train_loss: 0.6892, test_loss: 0.9001, test_f1: 0.6310
 epoch: 47, train_loss: 0.6830, test_loss: 0.9003, test_f1: 0.6603
 epoch: 48, train_loss: 0.7018, test_loss: 1.0518, test_f1: 0.6561
 epoch: 49, train_loss: 0.7066, test_loss: 0.8966, test_f1: 0.6183
 epoch: 50, train_loss: 0.6834, test_loss: 1.0777, test_f1: 0.6406
 epoch: 51, train_loss: 0.6571, test_loss: 0.9918, test_f1: 0.6375
 epoch: 52, train_loss: 0.6401, test_loss: 0.8633, test_f1: 0.6680
 epoch: 53, train_loss: 0.6378, test_loss: 0.8950, test_f1: 0.6572
 epoch: 54, train_loss: 0.6295, test_loss: 0.9732, test_f1: 0.6593
 epoch: 55, train_loss: 0.6279, test_loss: 0.8756, test_f1: 0.6744
 epoch: 56, train_loss: 0.6263, test_loss: 0.9788, test_f1: 0.6704
 epoch: 57, train_loss: 0.6188, test_loss: 0.9930, test_f1: 0.6727
 epoch: 58, train_loss: 0.6278, test_loss: 0.8105, test_f1: 0.6851
 epoch: 59, train_loss: 0.6243, test_loss: 0.8895, test_f1: 0.6507
 epoch: 60, train_loss: 0.6179, test_loss: 0.9321, test_f1: 0.6623
 epoch: 61, train_loss: 0.6123, test_loss: 0.8996, test_f1: 0.6488
 epoch: 62, train_loss: 0.6015, test_loss: 0.9380, test_f1: 0.6772
 epoch: 63, train_loss: 0.5997, test_loss: 1.0534, test_f1: 0.6118
 epoch: 64, train_loss: 0.5992, test_loss: 0.9487, test_f1: 0.6826
 epoch: 65, train_loss: 0.5999, test_loss: 0.9415, test_f1: 0.6613
 epoch: 66, train_loss: 0.6031, test_loss: 0.8880, test_f1: 0.6599
 epoch: 67, train_loss: 0.6018, test_loss: 1.0376, test_f1: 0.6264
 epoch: 68, train_loss: 0.5796, test_loss: 0.9897, test_f1: 0.6736
 epoch: 69, train_loss: 0.5880, test_loss: 1.1053, test_f1: 0.6551
 epoch: 70, train_loss: 0.6013, test_loss: 0.9692, test_f1: 0.6792
 epoch: 71, train_loss: 0.6104, test_loss: 0.9553, test_f1: 0.6615
 epoch: 72, train_loss: 0.5989, test_loss: 0.9292, test_f1: 0.6759
 epoch: 73, train_loss: 0.5962, test_loss: 1.0166, test_f1: 0.6621
 epoch: 74, train_loss: 0.5853, test_loss: 0.9714, test_f1: 0.6469
 epoch: 75, train_loss: 0.5999, test_loss: 1.0318, test_f1: 0.6589
 epoch: 76, train_loss: 0.5725, test_loss: 0.9111, test_f1: 0.6957
 epoch: 77, train_loss: 0.5796, test_loss: 1.0310, test_f1: 0.6294
 epoch: 78, train_loss: 0.5771, test_loss: 0.9691, test_f1: 0.6563
 epoch: 79, train_loss: 0.5848, test_loss: 1.0098, test_f1: 0.6691
 epoch: 80, train_loss: 0.5848, test_loss: 0.9214, test_f1: 0.6646
 epoch: 81, train_loss: 0.5784, test_loss: 1.0631, test_f1: 0.6880
 epoch: 82, train_loss: 0.5862, test_loss: 1.0759, test_f1: 0.6708
 epoch: 83, train_loss: 0.5760, test_loss: 1.1051, test_f1: 0.6883
 epoch: 84, train_loss: 0.5570, test_loss: 1.1667, test_f1: 0.6818
 epoch: 85, train_loss: 0.5822, test_loss: 1.0335, test_f1: 0.6454
 epoch: 86, train_loss: 0.5748, test_loss: 1.1684, test_f1: 0.6870
 epoch: 87, train_loss: 0.5684, test_loss: 1.1198, test_f1: 0.6419
 epoch: 88, train_loss: 0.5750, test_loss: 1.0356, test_f1: 0.6843
 epoch: 89, train_loss: 0.5531, test_loss: 1.2296, test_f1: 0.6584
 epoch: 90, train_loss: 0.5626, test_loss: 1.1535, test_f1: 0.6664
 epoch: 91, train_loss: 0.5607, test_loss: 1.0656, test_f1: 0.6838
 epoch: 92, train_loss: 0.5582, test_loss: 1.1290, test_f1: 0.6877
 epoch: 93, train_loss: 0.5554, test_loss: 1.1820, test_f1: 0.6692
 epoch: 94, train_loss: 0.5319, test_loss: 1.2174, test_f1: 0.6790
 epoch: 95, train_loss: 0.5304, test_loss: 1.2082, test_f1: 0.6647
 epoch: 96, train_loss: 0.5390, test_loss: 1.1762, test_f1: 0.6656
 epoch: 97, train_loss: 0.5817, test_loss: 1.1900, test_f1: 0.6410
 epoch: 98, train_loss: 0.5739, test_loss: 1.0913, test_f1: 0.6538
 epoch: 99, train_loss: 0.5265, test_loss: 1.1579, test_f1: 0.6509
##################ITERATION #8 ****************************************
 epoch: 0, train_loss: 1.1441, test_loss: 1.0766, test_f1: 0.4328
 epoch: 1, train_loss: 1.0287, test_loss: 1.0364, test_f1: 0.4632
 epoch: 2, train_loss: 0.9863, test_loss: 1.0432, test_f1: 0.4669
 epoch: 3, train_loss: 0.9561, test_loss: 0.9523, test_f1: 0.5035
 epoch: 4, train_loss: 0.9502, test_loss: 0.9927, test_f1: 0.5257
 epoch: 5, train_loss: 0.9318, test_loss: 0.8790, test_f1: 0.5602
 epoch: 6, train_loss: 0.9321, test_loss: 0.9628, test_f1: 0.5139
 epoch: 7, train_loss: 0.8984, test_loss: 1.0181, test_f1: 0.5050
 epoch: 8, train_loss: 0.8817, test_loss: 0.9973, test_f1: 0.5065
 epoch: 9, train_loss: 0.8806, test_loss: 0.9863, test_f1: 0.5130
 epoch: 10, train_loss: 0.8682, test_loss: 0.8568, test_f1: 0.5729
 epoch: 11, train_loss: 0.8557, test_loss: 0.8027, test_f1: 0.6049
 epoch: 12, train_loss: 0.8377, test_loss: 0.8676, test_f1: 0.5654
 epoch: 13, train_loss: 0.8449, test_loss: 0.9973, test_f1: 0.5102
 epoch: 14, train_loss: 0.8331, test_loss: 0.8505, test_f1: 0.5437
 epoch: 15, train_loss: 0.8067, test_loss: 0.8312, test_f1: 0.5518
 epoch: 16, train_loss: 0.8208, test_loss: 0.7787, test_f1: 0.6190
 epoch: 17, train_loss: 0.8081, test_loss: 0.8329, test_f1: 0.5616
 epoch: 18, train_loss: 0.8045, test_loss: 0.8656, test_f1: 0.5841
 epoch: 19, train_loss: 0.7908, test_loss: 0.9191, test_f1: 0.5120
 epoch: 20, train_loss: 0.7905, test_loss: 0.8220, test_f1: 0.6085
 epoch: 21, train_loss: 0.7662, test_loss: 0.8974, test_f1: 0.6013
 epoch: 22, train_loss: 0.7878, test_loss: 0.8466, test_f1: 0.5567
 epoch: 23, train_loss: 0.7645, test_loss: 0.8261, test_f1: 0.5735
 epoch: 24, train_loss: 0.7723, test_loss: 0.7933, test_f1: 0.6185
 epoch: 25, train_loss: 0.7515, test_loss: 0.8741, test_f1: 0.6173
 epoch: 26, train_loss: 0.7567, test_loss: 0.7880, test_f1: 0.6010
 epoch: 27, train_loss: 0.7452, test_loss: 0.8328, test_f1: 0.6334
 epoch: 28, train_loss: 0.7399, test_loss: 0.9749, test_f1: 0.5610
 epoch: 29, train_loss: 0.7303, test_loss: 0.7774, test_f1: 0.6083
 epoch: 30, train_loss: 0.7514, test_loss: 0.8630, test_f1: 0.5815
 epoch: 31, train_loss: 0.7337, test_loss: 0.8426, test_f1: 0.6187
 epoch: 32, train_loss: 0.7321, test_loss: 0.8279, test_f1: 0.5923
 epoch: 33, train_loss: 0.7357, test_loss: 0.7567, test_f1: 0.6139
 epoch: 34, train_loss: 0.7650, test_loss: 0.8340, test_f1: 0.5768
 epoch: 35, train_loss: 0.7279, test_loss: 1.1028, test_f1: 0.5501
 epoch: 36, train_loss: 0.7219, test_loss: 0.7831, test_f1: 0.6321
 epoch: 37, train_loss: 0.7404, test_loss: 0.7811, test_f1: 0.5920
 epoch: 38, train_loss: 0.6953, test_loss: 0.8585, test_f1: 0.6278
 epoch: 39, train_loss: 0.7010, test_loss: 0.8243, test_f1: 0.5992
 epoch: 40, train_loss: 0.7142, test_loss: 0.8847, test_f1: 0.5913
 epoch: 41, train_loss: 0.7291, test_loss: 0.7446, test_f1: 0.6542
 epoch: 42, train_loss: 0.7096, test_loss: 0.7747, test_f1: 0.6353
 epoch: 43, train_loss: 0.6800, test_loss: 0.7843, test_f1: 0.6431
 epoch: 44, train_loss: 0.7004, test_loss: 1.2331, test_f1: 0.5182
 epoch: 45, train_loss: 0.7167, test_loss: 0.7623, test_f1: 0.6355
 epoch: 46, train_loss: 0.7088, test_loss: 0.8139, test_f1: 0.6582
 epoch: 47, train_loss: 0.7188, test_loss: 0.8327, test_f1: 0.6024
 epoch: 48, train_loss: 0.6846, test_loss: 0.9083, test_f1: 0.5908
 epoch: 49, train_loss: 0.6957, test_loss: 0.7377, test_f1: 0.6268
 epoch: 50, train_loss: 0.6850, test_loss: 0.7798, test_f1: 0.6281
 epoch: 51, train_loss: 0.6578, test_loss: 0.7656, test_f1: 0.6217
 epoch: 52, train_loss: 0.6369, test_loss: 0.7612, test_f1: 0.6213
 epoch: 53, train_loss: 0.6227, test_loss: 0.7654, test_f1: 0.6350
 epoch: 54, train_loss: 0.6271, test_loss: 0.7816, test_f1: 0.5961
 epoch: 55, train_loss: 0.6208, test_loss: 0.7380, test_f1: 0.6398
 epoch: 56, train_loss: 0.6216, test_loss: 0.7849, test_f1: 0.6587
 epoch: 57, train_loss: 0.6266, test_loss: 0.8119, test_f1: 0.6390
 epoch: 58, train_loss: 0.6413, test_loss: 0.7866, test_f1: 0.6177
 epoch: 59, train_loss: 0.6168, test_loss: 0.8226, test_f1: 0.6528
 epoch: 60, train_loss: 0.6025, test_loss: 0.7850, test_f1: 0.6244
 epoch: 61, train_loss: 0.6217, test_loss: 0.7578, test_f1: 0.6428
 epoch: 62, train_loss: 0.6151, test_loss: 0.7476, test_f1: 0.6524
 epoch: 63, train_loss: 0.5977, test_loss: 0.7661, test_f1: 0.6525
 epoch: 64, train_loss: 0.6160, test_loss: 0.8296, test_f1: 0.6399
 epoch: 65, train_loss: 0.6009, test_loss: 0.7534, test_f1: 0.6899
 epoch: 66, train_loss: 0.6043, test_loss: 0.8370, test_f1: 0.6604
 epoch: 67, train_loss: 0.5977, test_loss: 0.8251, test_f1: 0.6430
 epoch: 68, train_loss: 0.5968, test_loss: 0.7848, test_f1: 0.6707
 epoch: 69, train_loss: 0.5826, test_loss: 0.9846, test_f1: 0.6195
 epoch: 70, train_loss: 0.5996, test_loss: 0.8430, test_f1: 0.6571
 epoch: 71, train_loss: 0.5973, test_loss: 0.8809, test_f1: 0.6380
 epoch: 72, train_loss: 0.5833, test_loss: 0.8024, test_f1: 0.6478
 epoch: 73, train_loss: 0.5776, test_loss: 0.8180, test_f1: 0.6511
 epoch: 74, train_loss: 0.5818, test_loss: 0.8579, test_f1: 0.6448
 epoch: 75, train_loss: 0.5782, test_loss: 0.7944, test_f1: 0.6467
 epoch: 76, train_loss: 0.5820, test_loss: 0.9030, test_f1: 0.6523
 epoch: 77, train_loss: 0.5768, test_loss: 0.9278, test_f1: 0.6296
 epoch: 78, train_loss: 0.5883, test_loss: 0.7728, test_f1: 0.6687
 epoch: 79, train_loss: 0.5848, test_loss: 0.7844, test_f1: 0.6690
 epoch: 80, train_loss: 0.5705, test_loss: 0.7868, test_f1: 0.6471
 epoch: 81, train_loss: 0.5819, test_loss: 0.8241, test_f1: 0.6634
 epoch: 82, train_loss: 0.5632, test_loss: 0.8722, test_f1: 0.6494
 epoch: 83, train_loss: 0.5858, test_loss: 0.9808, test_f1: 0.6265
 epoch: 84, train_loss: 0.5790, test_loss: 0.8342, test_f1: 0.6751
 epoch: 85, train_loss: 0.5736, test_loss: 0.7864, test_f1: 0.6637
 epoch: 86, train_loss: 0.5582, test_loss: 0.9370, test_f1: 0.6536
 epoch: 87, train_loss: 0.5666, test_loss: 0.7735, test_f1: 0.6821
 epoch: 88, train_loss: 0.5589, test_loss: 0.9145, test_f1: 0.6340
 epoch: 89, train_loss: 0.5590, test_loss: 0.7795, test_f1: 0.6727
 epoch: 90, train_loss: 0.5412, test_loss: 0.7867, test_f1: 0.6634
 epoch: 91, train_loss: 0.5574, test_loss: 0.8817, test_f1: 0.6584
 epoch: 92, train_loss: 0.5757, test_loss: 0.7920, test_f1: 0.6547
 epoch: 93, train_loss: 0.5577, test_loss: 0.7916, test_f1: 0.6790
 epoch: 94, train_loss: 0.5533, test_loss: 0.7815, test_f1: 0.6379
 epoch: 95, train_loss: 0.5553, test_loss: 0.8391, test_f1: 0.6292
 epoch: 96, train_loss: 0.5348, test_loss: 0.8953, test_f1: 0.6266
 epoch: 97, train_loss: 0.5492, test_loss: 0.8872, test_f1: 0.6383
 epoch: 98, train_loss: 0.5383, test_loss: 0.8872, test_f1: 0.6501
 epoch: 99, train_loss: 0.5505, test_loss: 0.9281, test_f1: 0.6632
##################ITERATION #9 ****************************************
 epoch: 0, train_loss: 1.1305, test_loss: 1.0844, test_f1: 0.3985
 epoch: 1, train_loss: 1.0037, test_loss: 0.9499, test_f1: 0.5352
 epoch: 2, train_loss: 0.9695, test_loss: 0.9553, test_f1: 0.5195
 epoch: 3, train_loss: 0.9569, test_loss: 0.9152, test_f1: 0.4964
 epoch: 4, train_loss: 0.9340, test_loss: 0.9310, test_f1: 0.5630
 epoch: 5, train_loss: 0.9065, test_loss: 0.9600, test_f1: 0.5159
 epoch: 6, train_loss: 0.9103, test_loss: 0.9177, test_f1: 0.5365
 epoch: 7, train_loss: 0.8933, test_loss: 0.8952, test_f1: 0.5668
 epoch: 8, train_loss: 0.8745, test_loss: 0.8987, test_f1: 0.5325
 epoch: 9, train_loss: 0.8635, test_loss: 0.8427, test_f1: 0.5325
 epoch: 10, train_loss: 0.8416, test_loss: 0.9932, test_f1: 0.5149
 epoch: 11, train_loss: 0.8492, test_loss: 0.8621, test_f1: 0.5271
 epoch: 12, train_loss: 0.8260, test_loss: 0.8859, test_f1: 0.5658
 epoch: 13, train_loss: 0.8533, test_loss: 0.8726, test_f1: 0.6117
 epoch: 14, train_loss: 0.8175, test_loss: 0.8947, test_f1: 0.5603
 epoch: 15, train_loss: 0.8148, test_loss: 0.8960, test_f1: 0.5510
 epoch: 16, train_loss: 0.8111, test_loss: 0.8579, test_f1: 0.5808
 epoch: 17, train_loss: 0.8170, test_loss: 0.8832, test_f1: 0.5967
 epoch: 18, train_loss: 0.8003, test_loss: 0.8942, test_f1: 0.5860
 epoch: 19, train_loss: 0.8124, test_loss: 0.8069, test_f1: 0.6234
 epoch: 20, train_loss: 0.7929, test_loss: 0.8728, test_f1: 0.5668
 epoch: 21, train_loss: 0.8011, test_loss: 0.8810, test_f1: 0.5857
 epoch: 22, train_loss: 0.7840, test_loss: 0.9868, test_f1: 0.5439
 epoch: 23, train_loss: 0.7911, test_loss: 0.9089, test_f1: 0.6028
 epoch: 24, train_loss: 0.7744, test_loss: 0.8912, test_f1: 0.5983
 epoch: 25, train_loss: 0.7751, test_loss: 0.8884, test_f1: 0.5966
 epoch: 26, train_loss: 0.7862, test_loss: 0.8095, test_f1: 0.6014
 epoch: 27, train_loss: 0.7603, test_loss: 0.8469, test_f1: 0.6161
 epoch: 28, train_loss: 0.7643, test_loss: 0.8212, test_f1: 0.6131
 epoch: 29, train_loss: 0.7531, test_loss: 0.9708, test_f1: 0.5989
 epoch: 30, train_loss: 0.7416, test_loss: 0.9029, test_f1: 0.6317
 epoch: 31, train_loss: 0.7430, test_loss: 0.8346, test_f1: 0.6254
 epoch: 32, train_loss: 0.7601, test_loss: 0.8261, test_f1: 0.6191
 epoch: 33, train_loss: 0.7442, test_loss: 0.8796, test_f1: 0.5838
 epoch: 34, train_loss: 0.7456, test_loss: 1.1770, test_f1: 0.5033
 epoch: 35, train_loss: 0.7609, test_loss: 0.8726, test_f1: 0.6028
 epoch: 36, train_loss: 0.7585, test_loss: 0.8516, test_f1: 0.5887
 epoch: 37, train_loss: 0.7585, test_loss: 0.9007, test_f1: 0.5977
 epoch: 38, train_loss: 0.7372, test_loss: 0.9319, test_f1: 0.5941
 epoch: 39, train_loss: 0.7442, test_loss: 0.8697, test_f1: 0.6266
 epoch: 40, train_loss: 0.7573, test_loss: 0.9005, test_f1: 0.6279
 epoch: 41, train_loss: 0.7316, test_loss: 0.8888, test_f1: 0.6334
 epoch: 42, train_loss: 0.7195, test_loss: 0.9028, test_f1: 0.6191
 epoch: 43, train_loss: 0.7422, test_loss: 0.9866, test_f1: 0.5987
 epoch: 44, train_loss: 0.7315, test_loss: 0.8744, test_f1: 0.5950
 epoch: 45, train_loss: 0.7365, test_loss: 1.0128, test_f1: 0.6484
 epoch: 46, train_loss: 0.7251, test_loss: 0.9288, test_f1: 0.6218
 epoch: 47, train_loss: 0.7317, test_loss: 0.8873, test_f1: 0.6595
 epoch: 48, train_loss: 0.7149, test_loss: 0.9181, test_f1: 0.6503
 epoch: 49, train_loss: 0.7329, test_loss: 0.9774, test_f1: 0.5714
 epoch: 50, train_loss: 0.7164, test_loss: 0.9690, test_f1: 0.6308
 epoch: 51, train_loss: 0.6784, test_loss: 0.9542, test_f1: 0.6240
 epoch: 52, train_loss: 0.6665, test_loss: 0.9660, test_f1: 0.6492
 epoch: 53, train_loss: 0.6649, test_loss: 0.9218, test_f1: 0.6637
 epoch: 54, train_loss: 0.6556, test_loss: 0.9500, test_f1: 0.6339
 epoch: 55, train_loss: 0.6520, test_loss: 0.8849, test_f1: 0.6589
 epoch: 56, train_loss: 0.6435, test_loss: 0.9664, test_f1: 0.6386
 epoch: 57, train_loss: 0.6493, test_loss: 1.0040, test_f1: 0.6371
 epoch: 58, train_loss: 0.6470, test_loss: 0.9411, test_f1: 0.6445
 epoch: 59, train_loss: 0.6358, test_loss: 0.9737, test_f1: 0.6454
 epoch: 60, train_loss: 0.6517, test_loss: 0.9747, test_f1: 0.6299
 epoch: 61, train_loss: 0.6519, test_loss: 0.9304, test_f1: 0.6748
 epoch: 62, train_loss: 0.6313, test_loss: 0.9485, test_f1: 0.6697
 epoch: 63, train_loss: 0.6176, test_loss: 0.9842, test_f1: 0.6644
 epoch: 64, train_loss: 0.6479, test_loss: 0.9491, test_f1: 0.6608
 epoch: 65, train_loss: 0.6362, test_loss: 0.9690, test_f1: 0.6205
 epoch: 66, train_loss: 0.6362, test_loss: 0.9546, test_f1: 0.6397
 epoch: 67, train_loss: 0.6181, test_loss: 0.9988, test_f1: 0.6166
 epoch: 68, train_loss: 0.6331, test_loss: 0.9446, test_f1: 0.6624
 epoch: 69, train_loss: 0.6117, test_loss: 0.9540, test_f1: 0.6546
 epoch: 70, train_loss: 0.6350, test_loss: 0.8996, test_f1: 0.6734
 epoch: 71, train_loss: 0.6148, test_loss: 0.9514, test_f1: 0.6492
 epoch: 72, train_loss: 0.6305, test_loss: 0.8774, test_f1: 0.6596
 epoch: 73, train_loss: 0.6140, test_loss: 0.9319, test_f1: 0.6666
 epoch: 74, train_loss: 0.6089, test_loss: 0.9598, test_f1: 0.6650
 epoch: 75, train_loss: 0.6251, test_loss: 1.0142, test_f1: 0.6681
 epoch: 76, train_loss: 0.6123, test_loss: 1.0102, test_f1: 0.6534
 epoch: 77, train_loss: 0.5991, test_loss: 1.0107, test_f1: 0.6273
 epoch: 78, train_loss: 0.6087, test_loss: 0.9601, test_f1: 0.6613
 epoch: 79, train_loss: 0.6011, test_loss: 1.0087, test_f1: 0.6459
 epoch: 80, train_loss: 0.5976, test_loss: 0.8442, test_f1: 0.6726
 epoch: 81, train_loss: 0.5771, test_loss: 0.9611, test_f1: 0.6688
 epoch: 82, train_loss: 0.5977, test_loss: 1.0048, test_f1: 0.6684
 epoch: 83, train_loss: 0.5846, test_loss: 1.0172, test_f1: 0.6670
 epoch: 84, train_loss: 0.5836, test_loss: 0.9759, test_f1: 0.6576
 epoch: 85, train_loss: 0.5862, test_loss: 1.0111, test_f1: 0.6387
 epoch: 86, train_loss: 0.5933, test_loss: 0.9846, test_f1: 0.6478
 epoch: 87, train_loss: 0.5957, test_loss: 1.0398, test_f1: 0.6667
 epoch: 88, train_loss: 0.5911, test_loss: 1.0013, test_f1: 0.6665
 epoch: 89, train_loss: 0.5723, test_loss: 1.0205, test_f1: 0.6582
 epoch: 90, train_loss: 0.6084, test_loss: 1.1219, test_f1: 0.6520
 epoch: 91, train_loss: 0.5902, test_loss: 0.9173, test_f1: 0.6472
 epoch: 92, train_loss: 0.5842, test_loss: 1.0428, test_f1: 0.6796
 epoch: 93, train_loss: 0.5898, test_loss: 0.8962, test_f1: 0.6628
 epoch: 94, train_loss: 0.5841, test_loss: 0.9756, test_f1: 0.6626
 epoch: 95, train_loss: 0.5773, test_loss: 1.0132, test_f1: 0.6934
 epoch: 96, train_loss: 0.5717, test_loss: 0.9104, test_f1: 0.6897
 epoch: 97, train_loss: 0.5792, test_loss: 0.9029, test_f1: 0.6605
 epoch: 98, train_loss: 0.5677, test_loss: 0.9588, test_f1: 0.6578
 epoch: 99, train_loss: 0.5796, test_loss: 1.0194, test_f1: 0.6625

Training completed in 642.55 seconds
Best F1: 0.7147 at epoch 94
Mean F1 across iterations: 0.6946  0.0109
========================FINAL RESULTS================================
FEGIN weighted F1: 0.7147  0.0109
python main.py --data ltspice_examples --representation component_pin_net --model FEGIN --layers 3 --hiddens 32 --batch_size 64 --lr 0.01 --emb_size 512 --epochs 100 --save_appendix component_pin_net_L3_H32_BS64_LR0.01_E512 --no_val
-----



STDERR:
  File "main.py", line 370, in <module>
    main()
  File "main.py", line 254, in main
    dataset = dataset_class(
  File "/home/philip/projects/ltspice_examples_code_repo/Circuit-Completion-Using-GNNs/component_classification_with_link_prediction_head/evaluation/FEGIN/kernel/circuit_datasets.py", line 15, in __init__
    self.data, self.slices = torch.load(self.processed_paths[0])
  File "/home/philip/.local/lib/python3.8/site-packages/torch/serialization.py", line 1040, in load
    warnings.warn(
  File "/usr/lib/python3.8/warnings.py", line 109, in _showwarnmsg
    sw(msg.message, msg.category, msg.filename, msg.lineno,
  File "main.py", line 47, in warn_with_traceback
    traceback.print_stack(file=log)
/home/philip/projects/ltspice_examples_code_repo/Circuit-Completion-Using-GNNs/component_classification_with_link_prediction_head/evaluation/FEGIN/kernel/circuit_datasets.py:15: FutureWarning: You are using `torch.load` with `weights_only=False` (the current default value), which uses the default pickle module implicitly. It is possible to construct malicious pickle data which will execute arbitrary code during unpickling (See https://github.com/pytorch/pytorch/blob/main/SECURITY.md#untrusted-models for more details). In a future release, the default value for `weights_only` will be flipped to `True`. This limits the functions that could be executed during unpickling. Arbitrary objects will no longer be allowed to be loaded via this mode unless they are explicitly allowlisted by the user via `torch.serialization.add_safe_globals`. We recommend you start setting `weights_only=True` for any use case where you don't have full control of the loaded file. Please open an issue on GitHub for any issues related to this experimental feature.
  self.data, self.slices = torch.load(self.processed_paths[0])
