STDOUT:
Results will be saved in /home/philip/projects/ltspice_examples_code_repo/Circuit-Completion-Using-GNNs/component_classification_with_link_prediction_head/evaluation/FEGIN/results/model_FEGIN_dataset_ltspice_examples
Command line input: python main.py --data ltspice_examples --representation component_net --model FEGIN --layers 4 --hiddens 16 --batch_size 64 --lr 0.01 --emb_size 250 --epochs 100 --save_appendix component_net_L4_H16_BS64_LR0.01_E250 --no_val
 is saved.
-----
ltspice_examples - FEGIN
Using 4 layers, 16 hidden units, h = 2
Loading component_net representation dataset
ENTERED
Training FEGIN on component_net representation
Train: 3558, Test: 846
##################ITERATION #0 ****************************************
 epoch: 0, train_loss: 1.2791, test_loss: 1.1439, test_f1: 0.3645
 epoch: 1, train_loss: 1.0970, test_loss: 1.1794, test_f1: 0.3291
 epoch: 2, train_loss: 1.0611, test_loss: 1.1775, test_f1: 0.3687
 epoch: 3, train_loss: 1.0629, test_loss: 1.1945, test_f1: 0.3834
 epoch: 4, train_loss: 1.0452, test_loss: 1.0931, test_f1: 0.3548
 epoch: 5, train_loss: 1.0379, test_loss: 1.1476, test_f1: 0.4296
 epoch: 6, train_loss: 1.0094, test_loss: 1.1159, test_f1: 0.4519
 epoch: 7, train_loss: 0.9901, test_loss: 1.0014, test_f1: 0.5072
 epoch: 8, train_loss: 0.9870, test_loss: 1.0071, test_f1: 0.4377
 epoch: 9, train_loss: 0.9772, test_loss: 1.0653, test_f1: 0.4974
 epoch: 10, train_loss: 0.9667, test_loss: 1.0497, test_f1: 0.4727
 epoch: 11, train_loss: 0.9537, test_loss: 1.0873, test_f1: 0.4916
 epoch: 12, train_loss: 0.9576, test_loss: 1.0650, test_f1: 0.5241
 epoch: 13, train_loss: 0.9327, test_loss: 1.1177, test_f1: 0.4894
 epoch: 14, train_loss: 0.9529, test_loss: 1.0567, test_f1: 0.5249
 epoch: 15, train_loss: 0.9240, test_loss: 1.0060, test_f1: 0.5394
 epoch: 16, train_loss: 0.9231, test_loss: 1.0469, test_f1: 0.5378
 epoch: 17, train_loss: 0.9284, test_loss: 1.0109, test_f1: 0.5188
 epoch: 18, train_loss: 0.9134, test_loss: 1.0325, test_f1: 0.4945
 epoch: 19, train_loss: 0.9249, test_loss: 1.0120, test_f1: 0.5127
 epoch: 20, train_loss: 0.9209, test_loss: 1.0441, test_f1: 0.5057
 epoch: 21, train_loss: 0.9215, test_loss: 1.1093, test_f1: 0.4897
 epoch: 22, train_loss: 0.9051, test_loss: 1.0462, test_f1: 0.4946
 epoch: 23, train_loss: 0.9142, test_loss: 1.0525, test_f1: 0.4961
 epoch: 24, train_loss: 0.9085, test_loss: 1.0837, test_f1: 0.4960
 epoch: 25, train_loss: 0.8998, test_loss: 1.1094, test_f1: 0.5100
 epoch: 26, train_loss: 0.8941, test_loss: 1.0638, test_f1: 0.4870
 epoch: 27, train_loss: 0.8963, test_loss: 1.0094, test_f1: 0.4844
 epoch: 28, train_loss: 0.9065, test_loss: 1.0189, test_f1: 0.5476
 epoch: 29, train_loss: 0.8839, test_loss: 1.0501, test_f1: 0.5023
 epoch: 30, train_loss: 0.8837, test_loss: 1.0774, test_f1: 0.5117
 epoch: 31, train_loss: 0.8814, test_loss: 1.0451, test_f1: 0.4740
 epoch: 32, train_loss: 0.9013, test_loss: 1.0211, test_f1: 0.4873
 epoch: 33, train_loss: 0.8976, test_loss: 1.0656, test_f1: 0.5489
 epoch: 34, train_loss: 0.8936, test_loss: 1.0220, test_f1: 0.5175
 epoch: 35, train_loss: 0.8719, test_loss: 1.1077, test_f1: 0.5240
 epoch: 36, train_loss: 0.8786, test_loss: 1.0560, test_f1: 0.5338
 epoch: 37, train_loss: 0.8860, test_loss: 1.0772, test_f1: 0.5013
 epoch: 38, train_loss: 0.8818, test_loss: 1.0952, test_f1: 0.4859
 epoch: 39, train_loss: 0.8686, test_loss: 1.0991, test_f1: 0.5010
 epoch: 40, train_loss: 0.8819, test_loss: 1.0596, test_f1: 0.5079
 epoch: 41, train_loss: 0.8650, test_loss: 1.1094, test_f1: 0.5203
 epoch: 42, train_loss: 0.8759, test_loss: 1.0484, test_f1: 0.5387
 epoch: 43, train_loss: 0.8747, test_loss: 1.0293, test_f1: 0.5071
 epoch: 44, train_loss: 0.8733, test_loss: 1.0926, test_f1: 0.4865
 epoch: 45, train_loss: 0.8625, test_loss: 1.0555, test_f1: 0.5591
 epoch: 46, train_loss: 0.8709, test_loss: 1.0752, test_f1: 0.5353
 epoch: 47, train_loss: 0.8663, test_loss: 1.0219, test_f1: 0.5475
 epoch: 48, train_loss: 0.8560, test_loss: 1.0894, test_f1: 0.5448
 epoch: 49, train_loss: 0.8594, test_loss: 1.0564, test_f1: 0.4928
 epoch: 50, train_loss: 0.8606, test_loss: 1.0835, test_f1: 0.4910
 epoch: 51, train_loss: 0.8373, test_loss: 1.0801, test_f1: 0.4922
 epoch: 52, train_loss: 0.8204, test_loss: 1.1615, test_f1: 0.5540
 epoch: 53, train_loss: 0.8236, test_loss: 1.0727, test_f1: 0.5377
 epoch: 54, train_loss: 0.8370, test_loss: 1.1193, test_f1: 0.5557
 epoch: 55, train_loss: 0.8224, test_loss: 1.1579, test_f1: 0.5485
 epoch: 56, train_loss: 0.8258, test_loss: 1.0828, test_f1: 0.4999
 epoch: 57, train_loss: 0.8246, test_loss: 1.1259, test_f1: 0.5359
 epoch: 58, train_loss: 0.8254, test_loss: 1.1020, test_f1: 0.5481
 epoch: 59, train_loss: 0.8167, test_loss: 1.0869, test_f1: 0.5825
 epoch: 60, train_loss: 0.8113, test_loss: 1.1207, test_f1: 0.5363
 epoch: 61, train_loss: 0.8071, test_loss: 1.1140, test_f1: 0.5443
 epoch: 62, train_loss: 0.8082, test_loss: 1.1414, test_f1: 0.5339
 epoch: 63, train_loss: 0.8049, test_loss: 1.1364, test_f1: 0.5979
 epoch: 64, train_loss: 0.8112, test_loss: 1.0706, test_f1: 0.5278
 epoch: 65, train_loss: 0.8105, test_loss: 1.0699, test_f1: 0.5384
 epoch: 66, train_loss: 0.8175, test_loss: 1.0639, test_f1: 0.5675
 epoch: 67, train_loss: 0.8264, test_loss: 1.0928, test_f1: 0.5307
 epoch: 68, train_loss: 0.8171, test_loss: 1.1077, test_f1: 0.5195
 epoch: 69, train_loss: 0.8067, test_loss: 1.1416, test_f1: 0.5371
 epoch: 70, train_loss: 0.8027, test_loss: 1.1039, test_f1: 0.5360
 epoch: 71, train_loss: 0.8031, test_loss: 1.0870, test_f1: 0.5261
 epoch: 72, train_loss: 0.8096, test_loss: 1.0244, test_f1: 0.5725
 epoch: 73, train_loss: 0.8021, test_loss: 1.1266, test_f1: 0.5414
 epoch: 74, train_loss: 0.7968, test_loss: 1.0751, test_f1: 0.5660
 epoch: 75, train_loss: 0.7984, test_loss: 1.1236, test_f1: 0.5469
 epoch: 76, train_loss: 0.8011, test_loss: 1.1112, test_f1: 0.5440
 epoch: 77, train_loss: 0.8225, test_loss: 1.1358, test_f1: 0.5251
 epoch: 78, train_loss: 0.8151, test_loss: 1.0785, test_f1: 0.5123
 epoch: 79, train_loss: 0.7908, test_loss: 1.0956, test_f1: 0.5516
 epoch: 80, train_loss: 0.7957, test_loss: 1.1480, test_f1: 0.5318
 epoch: 81, train_loss: 0.8057, test_loss: 1.1329, test_f1: 0.5419
 epoch: 82, train_loss: 0.8208, test_loss: 1.0813, test_f1: 0.5519
 epoch: 83, train_loss: 0.7890, test_loss: 1.0884, test_f1: 0.5891
 epoch: 84, train_loss: 0.7891, test_loss: 1.1383, test_f1: 0.5435
 epoch: 85, train_loss: 0.7915, test_loss: 1.1795, test_f1: 0.5579
 epoch: 86, train_loss: 0.7811, test_loss: 1.1253, test_f1: 0.5928
 epoch: 87, train_loss: 0.7852, test_loss: 1.1128, test_f1: 0.5909
 epoch: 88, train_loss: 0.7714, test_loss: 1.1282, test_f1: 0.5169
 epoch: 89, train_loss: 0.7927, test_loss: 1.1534, test_f1: 0.5815
 epoch: 90, train_loss: 0.7881, test_loss: 1.1449, test_f1: 0.5452
 epoch: 91, train_loss: 0.7882, test_loss: 1.1306, test_f1: 0.5713
 epoch: 92, train_loss: 0.7801, test_loss: 1.0697, test_f1: 0.5845
 epoch: 93, train_loss: 0.7706, test_loss: 1.1114, test_f1: 0.5949
 epoch: 94, train_loss: 0.7918, test_loss: 1.2505, test_f1: 0.5249
 epoch: 95, train_loss: 0.7840, test_loss: 1.1322, test_f1: 0.5254
 epoch: 96, train_loss: 0.7655, test_loss: 1.1645, test_f1: 0.5495
 epoch: 97, train_loss: 0.7674, test_loss: 1.1103, test_f1: 0.5415
 epoch: 98, train_loss: 0.7676, test_loss: 1.1742, test_f1: 0.5595
 epoch: 99, train_loss: 0.7718, test_loss: 1.1566, test_f1: 0.5837
##################ITERATION #1 ****************************************
 epoch: 0, train_loss: 1.1771, test_loss: 1.1320, test_f1: 0.4368
 epoch: 1, train_loss: 1.0432, test_loss: 1.0084, test_f1: 0.4644
 epoch: 2, train_loss: 1.0250, test_loss: 1.0412, test_f1: 0.4947
 epoch: 3, train_loss: 1.0083, test_loss: 1.0170, test_f1: 0.5091
 epoch: 4, train_loss: 1.0034, test_loss: 1.0506, test_f1: 0.4591
 epoch: 5, train_loss: 0.9919, test_loss: 0.9336, test_f1: 0.4692
 epoch: 6, train_loss: 0.9728, test_loss: 0.9718, test_f1: 0.4749
 epoch: 7, train_loss: 0.9614, test_loss: 1.0192, test_f1: 0.4778
 epoch: 8, train_loss: 0.9685, test_loss: 0.9304, test_f1: 0.5000
 epoch: 9, train_loss: 0.9555, test_loss: 0.9536, test_f1: 0.4692
 epoch: 10, train_loss: 0.9505, test_loss: 1.0110, test_f1: 0.4590
 epoch: 11, train_loss: 0.9399, test_loss: 0.9643, test_f1: 0.4885
 epoch: 12, train_loss: 0.9417, test_loss: 0.9488, test_f1: 0.5110
 epoch: 13, train_loss: 0.9356, test_loss: 0.9233, test_f1: 0.5137
 epoch: 14, train_loss: 0.9364, test_loss: 0.9650, test_f1: 0.4965
 epoch: 15, train_loss: 0.9235, test_loss: 0.9447, test_f1: 0.4998
 epoch: 16, train_loss: 0.9330, test_loss: 0.9251, test_f1: 0.4789
 epoch: 17, train_loss: 0.9189, test_loss: 0.9689, test_f1: 0.5222
 epoch: 18, train_loss: 0.9302, test_loss: 0.9441, test_f1: 0.5469
 epoch: 19, train_loss: 0.9132, test_loss: 0.9435, test_f1: 0.5060
 epoch: 20, train_loss: 0.9522, test_loss: 0.9569, test_f1: 0.5089
 epoch: 21, train_loss: 0.9201, test_loss: 0.9332, test_f1: 0.5325
 epoch: 22, train_loss: 0.9130, test_loss: 0.9527, test_f1: 0.5089
 epoch: 23, train_loss: 0.9075, test_loss: 0.9275, test_f1: 0.5350
 epoch: 24, train_loss: 0.9046, test_loss: 0.9665, test_f1: 0.5151
 epoch: 25, train_loss: 0.9000, test_loss: 0.9246, test_f1: 0.5091
 epoch: 26, train_loss: 0.8914, test_loss: 0.9914, test_f1: 0.5049
 epoch: 27, train_loss: 0.8940, test_loss: 0.9106, test_f1: 0.5192
 epoch: 28, train_loss: 0.8808, test_loss: 0.9747, test_f1: 0.5348
 epoch: 29, train_loss: 0.8831, test_loss: 0.9058, test_f1: 0.5321
 epoch: 30, train_loss: 0.8813, test_loss: 0.9180, test_f1: 0.5646
 epoch: 31, train_loss: 0.8696, test_loss: 0.9569, test_f1: 0.5011
 epoch: 32, train_loss: 0.8857, test_loss: 0.9462, test_f1: 0.5163
 epoch: 33, train_loss: 0.8724, test_loss: 0.9344, test_f1: 0.5680
 epoch: 34, train_loss: 0.8645, test_loss: 0.9250, test_f1: 0.5002
 epoch: 35, train_loss: 0.8764, test_loss: 0.9354, test_f1: 0.5273
 epoch: 36, train_loss: 0.8726, test_loss: 0.9273, test_f1: 0.5447
 epoch: 37, train_loss: 0.8585, test_loss: 0.9256, test_f1: 0.5203
 epoch: 38, train_loss: 0.8648, test_loss: 0.9300, test_f1: 0.5289
 epoch: 39, train_loss: 0.8614, test_loss: 0.9230, test_f1: 0.5344
 epoch: 40, train_loss: 0.8535, test_loss: 0.9762, test_f1: 0.5140
 epoch: 41, train_loss: 0.8554, test_loss: 0.9230, test_f1: 0.5807
 epoch: 42, train_loss: 0.8651, test_loss: 0.9200, test_f1: 0.5181
 epoch: 43, train_loss: 0.8490, test_loss: 0.9441, test_f1: 0.5472
 epoch: 44, train_loss: 0.8535, test_loss: 0.9047, test_f1: 0.5857
 epoch: 45, train_loss: 0.8699, test_loss: 0.8923, test_f1: 0.5327
 epoch: 46, train_loss: 0.8490, test_loss: 0.8968, test_f1: 0.5234
 epoch: 47, train_loss: 0.8516, test_loss: 0.9208, test_f1: 0.5150
 epoch: 48, train_loss: 0.8483, test_loss: 0.8915, test_f1: 0.5610
 epoch: 49, train_loss: 0.8342, test_loss: 0.9325, test_f1: 0.5360
 epoch: 50, train_loss: 0.8505, test_loss: 0.8842, test_f1: 0.5717
 epoch: 51, train_loss: 0.8285, test_loss: 0.9261, test_f1: 0.5374
 epoch: 52, train_loss: 0.8119, test_loss: 0.9214, test_f1: 0.5593
 epoch: 53, train_loss: 0.8131, test_loss: 0.8987, test_f1: 0.5755
 epoch: 54, train_loss: 0.8204, test_loss: 0.8931, test_f1: 0.5746
 epoch: 55, train_loss: 0.8159, test_loss: 0.9090, test_f1: 0.5438
 epoch: 56, train_loss: 0.8008, test_loss: 0.9567, test_f1: 0.5627
 epoch: 57, train_loss: 0.8077, test_loss: 0.9194, test_f1: 0.5697
 epoch: 58, train_loss: 0.7936, test_loss: 0.9421, test_f1: 0.5589
 epoch: 59, train_loss: 0.7989, test_loss: 0.9060, test_f1: 0.5812
 epoch: 60, train_loss: 0.7957, test_loss: 0.9536, test_f1: 0.5893
 epoch: 61, train_loss: 0.7893, test_loss: 0.9380, test_f1: 0.5982
 epoch: 62, train_loss: 0.7929, test_loss: 0.9057, test_f1: 0.5741
 epoch: 63, train_loss: 0.8010, test_loss: 0.8958, test_f1: 0.5886
 epoch: 64, train_loss: 0.7834, test_loss: 0.9268, test_f1: 0.5687
 epoch: 65, train_loss: 0.7865, test_loss: 0.9233, test_f1: 0.5883
 epoch: 66, train_loss: 0.7894, test_loss: 0.9612, test_f1: 0.6115
 epoch: 67, train_loss: 0.7788, test_loss: 0.9558, test_f1: 0.5482
 epoch: 68, train_loss: 0.7821, test_loss: 0.9384, test_f1: 0.5461
 epoch: 69, train_loss: 0.7872, test_loss: 0.9599, test_f1: 0.5811
 epoch: 70, train_loss: 0.7903, test_loss: 0.9378, test_f1: 0.5786
 epoch: 71, train_loss: 0.7753, test_loss: 0.9955, test_f1: 0.5574
 epoch: 72, train_loss: 0.7692, test_loss: 0.9340, test_f1: 0.5883
 epoch: 73, train_loss: 0.7840, test_loss: 0.9334, test_f1: 0.5644
 epoch: 74, train_loss: 0.7733, test_loss: 0.9026, test_f1: 0.6046
 epoch: 75, train_loss: 0.7754, test_loss: 0.9453, test_f1: 0.5760
 epoch: 76, train_loss: 0.7738, test_loss: 0.9206, test_f1: 0.5592
 epoch: 77, train_loss: 0.7767, test_loss: 0.9234, test_f1: 0.5919
 epoch: 78, train_loss: 0.7717, test_loss: 0.9435, test_f1: 0.5977
 epoch: 79, train_loss: 0.7641, test_loss: 0.9229, test_f1: 0.5717
 epoch: 80, train_loss: 0.7738, test_loss: 0.9400, test_f1: 0.6056
 epoch: 81, train_loss: 0.7602, test_loss: 0.9134, test_f1: 0.5769
 epoch: 82, train_loss: 0.7604, test_loss: 0.9741, test_f1: 0.5784
 epoch: 83, train_loss: 0.7576, test_loss: 0.9183, test_f1: 0.5732
 epoch: 84, train_loss: 0.7762, test_loss: 0.9178, test_f1: 0.5610
 epoch: 85, train_loss: 0.7671, test_loss: 0.9422, test_f1: 0.5989
 epoch: 86, train_loss: 0.7612, test_loss: 0.9007, test_f1: 0.5902
 epoch: 87, train_loss: 0.7685, test_loss: 0.9044, test_f1: 0.6125
 epoch: 88, train_loss: 0.7679, test_loss: 0.9216, test_f1: 0.5764
 epoch: 89, train_loss: 0.7522, test_loss: 0.8935, test_f1: 0.5769
 epoch: 90, train_loss: 0.7588, test_loss: 0.9112, test_f1: 0.5902
 epoch: 91, train_loss: 0.7457, test_loss: 0.9242, test_f1: 0.5956
 epoch: 92, train_loss: 0.7588, test_loss: 0.8945, test_f1: 0.5580
 epoch: 93, train_loss: 0.7640, test_loss: 0.9426, test_f1: 0.5426
 epoch: 94, train_loss: 0.7482, test_loss: 0.9232, test_f1: 0.5717
 epoch: 95, train_loss: 0.7460, test_loss: 0.9506, test_f1: 0.5793
 epoch: 96, train_loss: 0.7367, test_loss: 0.9770, test_f1: 0.5641
 epoch: 97, train_loss: 0.7633, test_loss: 0.9481, test_f1: 0.5666
 epoch: 98, train_loss: 0.7420, test_loss: 1.0370, test_f1: 0.5941
 epoch: 99, train_loss: 0.7493, test_loss: 0.9353, test_f1: 0.6153
##################ITERATION #2 ****************************************
 epoch: 0, train_loss: 1.2324, test_loss: 1.1179, test_f1: 0.4250
 epoch: 1, train_loss: 1.0795, test_loss: 1.0915, test_f1: 0.4287
 epoch: 2, train_loss: 1.0268, test_loss: 1.0209, test_f1: 0.4609
 epoch: 3, train_loss: 0.9947, test_loss: 0.9959, test_f1: 0.4868
 epoch: 4, train_loss: 1.0013, test_loss: 1.0969, test_f1: 0.4442
 epoch: 5, train_loss: 0.9785, test_loss: 1.0731, test_f1: 0.4589
 epoch: 6, train_loss: 0.9768, test_loss: 1.0193, test_f1: 0.4720
 epoch: 7, train_loss: 0.9577, test_loss: 1.0131, test_f1: 0.4775
 epoch: 8, train_loss: 0.9554, test_loss: 1.0196, test_f1: 0.4955
 epoch: 9, train_loss: 0.9522, test_loss: 1.0005, test_f1: 0.5102
 epoch: 10, train_loss: 0.9404, test_loss: 0.9607, test_f1: 0.4985
 epoch: 11, train_loss: 0.9378, test_loss: 0.9532, test_f1: 0.4939
 epoch: 12, train_loss: 0.9370, test_loss: 1.0166, test_f1: 0.4613
 epoch: 13, train_loss: 0.9278, test_loss: 1.1556, test_f1: 0.4175
 epoch: 14, train_loss: 0.9237, test_loss: 0.9894, test_f1: 0.4746
 epoch: 15, train_loss: 0.9263, test_loss: 1.0207, test_f1: 0.4513
 epoch: 16, train_loss: 0.9307, test_loss: 0.9316, test_f1: 0.5122
 epoch: 17, train_loss: 0.9097, test_loss: 0.9422, test_f1: 0.5321
 epoch: 18, train_loss: 0.9267, test_loss: 0.9008, test_f1: 0.5412
 epoch: 19, train_loss: 0.9175, test_loss: 0.9941, test_f1: 0.4800
 epoch: 20, train_loss: 0.9150, test_loss: 0.9655, test_f1: 0.5092
 epoch: 21, train_loss: 0.9101, test_loss: 1.0009, test_f1: 0.4998
 epoch: 22, train_loss: 0.9123, test_loss: 0.9318, test_f1: 0.5125
 epoch: 23, train_loss: 0.9012, test_loss: 0.9868, test_f1: 0.5019
 epoch: 24, train_loss: 0.8957, test_loss: 0.9492, test_f1: 0.4945
 epoch: 25, train_loss: 0.8844, test_loss: 0.9715, test_f1: 0.5254
 epoch: 26, train_loss: 0.8924, test_loss: 0.9482, test_f1: 0.5522
 epoch: 27, train_loss: 0.8923, test_loss: 0.9445, test_f1: 0.5472
 epoch: 28, train_loss: 0.8887, test_loss: 0.9200, test_f1: 0.5302
 epoch: 29, train_loss: 0.8800, test_loss: 0.9411, test_f1: 0.5168
 epoch: 30, train_loss: 0.8846, test_loss: 0.9421, test_f1: 0.5035
 epoch: 31, train_loss: 0.8845, test_loss: 0.9463, test_f1: 0.5140
 epoch: 32, train_loss: 0.8840, test_loss: 0.9468, test_f1: 0.5097
 epoch: 33, train_loss: 0.8821, test_loss: 0.9737, test_f1: 0.5546
 epoch: 34, train_loss: 0.8805, test_loss: 1.2018, test_f1: 0.4699
 epoch: 35, train_loss: 0.9005, test_loss: 0.9751, test_f1: 0.5190
 epoch: 36, train_loss: 0.8692, test_loss: 0.9969, test_f1: 0.5002
 epoch: 37, train_loss: 0.8636, test_loss: 0.9680, test_f1: 0.5612
 epoch: 38, train_loss: 0.8603, test_loss: 0.9996, test_f1: 0.5258
 epoch: 39, train_loss: 0.8727, test_loss: 0.9573, test_f1: 0.5104
 epoch: 40, train_loss: 0.8759, test_loss: 0.9823, test_f1: 0.4998
 epoch: 41, train_loss: 0.8721, test_loss: 0.9473, test_f1: 0.5215
 epoch: 42, train_loss: 0.8606, test_loss: 0.9625, test_f1: 0.5161
 epoch: 43, train_loss: 0.8573, test_loss: 0.9547, test_f1: 0.4985
 epoch: 44, train_loss: 0.8570, test_loss: 0.9733, test_f1: 0.5171
 epoch: 45, train_loss: 0.8667, test_loss: 0.9754, test_f1: 0.4973
 epoch: 46, train_loss: 0.8470, test_loss: 0.9311, test_f1: 0.5173
 epoch: 47, train_loss: 0.8612, test_loss: 0.9918, test_f1: 0.4948
 epoch: 48, train_loss: 0.8602, test_loss: 0.8981, test_f1: 0.5808
 epoch: 49, train_loss: 0.8703, test_loss: 0.9872, test_f1: 0.5135
 epoch: 50, train_loss: 0.8544, test_loss: 0.9649, test_f1: 0.5102
 epoch: 51, train_loss: 0.8427, test_loss: 1.0011, test_f1: 0.5666
 epoch: 52, train_loss: 0.8207, test_loss: 0.9872, test_f1: 0.5374
 epoch: 53, train_loss: 0.8241, test_loss: 1.0004, test_f1: 0.5555
 epoch: 54, train_loss: 0.8200, test_loss: 0.9640, test_f1: 0.5075
 epoch: 55, train_loss: 0.8217, test_loss: 0.9554, test_f1: 0.5215
 epoch: 56, train_loss: 0.8049, test_loss: 0.9835, test_f1: 0.5325
 epoch: 57, train_loss: 0.8173, test_loss: 1.0238, test_f1: 0.5362
 epoch: 58, train_loss: 0.8184, test_loss: 1.0045, test_f1: 0.5362
 epoch: 59, train_loss: 0.8109, test_loss: 0.9697, test_f1: 0.5131
 epoch: 60, train_loss: 0.8143, test_loss: 1.0041, test_f1: 0.5080
 epoch: 61, train_loss: 0.8084, test_loss: 0.9755, test_f1: 0.5531
 epoch: 62, train_loss: 0.8142, test_loss: 0.9928, test_f1: 0.5379
 epoch: 63, train_loss: 0.8113, test_loss: 0.9593, test_f1: 0.5261
 epoch: 64, train_loss: 0.8043, test_loss: 0.9674, test_f1: 0.5190
 epoch: 65, train_loss: 0.8104, test_loss: 0.9474, test_f1: 0.5190
 epoch: 66, train_loss: 0.8082, test_loss: 0.9211, test_f1: 0.5381
 epoch: 67, train_loss: 0.8050, test_loss: 0.9534, test_f1: 0.5173
 epoch: 68, train_loss: 0.8106, test_loss: 1.0055, test_f1: 0.5330
 epoch: 69, train_loss: 0.8086, test_loss: 0.9590, test_f1: 0.5273
 epoch: 70, train_loss: 0.8023, test_loss: 0.9652, test_f1: 0.5778
 epoch: 71, train_loss: 0.7962, test_loss: 0.9462, test_f1: 0.5493
 epoch: 72, train_loss: 0.7976, test_loss: 0.9808, test_f1: 0.5702
 epoch: 73, train_loss: 0.8154, test_loss: 0.9487, test_f1: 0.5574
 epoch: 74, train_loss: 0.7966, test_loss: 0.9556, test_f1: 0.5354
 epoch: 75, train_loss: 0.7974, test_loss: 0.9715, test_f1: 0.5153
 epoch: 76, train_loss: 0.8105, test_loss: 0.9449, test_f1: 0.5681
 epoch: 77, train_loss: 0.7917, test_loss: 0.9653, test_f1: 0.5919
 epoch: 78, train_loss: 0.7837, test_loss: 0.9303, test_f1: 0.5508
 epoch: 79, train_loss: 0.8013, test_loss: 0.9484, test_f1: 0.5625
 epoch: 80, train_loss: 0.7887, test_loss: 0.9180, test_f1: 0.5911
 epoch: 81, train_loss: 0.7840, test_loss: 0.9641, test_f1: 0.5642
 epoch: 82, train_loss: 0.7888, test_loss: 0.9515, test_f1: 0.5396
 epoch: 83, train_loss: 0.7872, test_loss: 0.9919, test_f1: 0.5461
 epoch: 84, train_loss: 0.7944, test_loss: 0.9798, test_f1: 0.5818
 epoch: 85, train_loss: 0.7771, test_loss: 1.0070, test_f1: 0.5585
 epoch: 86, train_loss: 0.7936, test_loss: 0.9475, test_f1: 0.5711
 epoch: 87, train_loss: 0.7880, test_loss: 0.9717, test_f1: 0.5769
 epoch: 88, train_loss: 0.7908, test_loss: 0.9494, test_f1: 0.5869
 epoch: 89, train_loss: 0.7789, test_loss: 0.9542, test_f1: 0.5376
 epoch: 90, train_loss: 0.7798, test_loss: 1.0006, test_f1: 0.5761
 epoch: 91, train_loss: 0.7830, test_loss: 0.9402, test_f1: 0.6042
 epoch: 92, train_loss: 0.7773, test_loss: 0.9604, test_f1: 0.5175
 epoch: 93, train_loss: 0.7832, test_loss: 0.9787, test_f1: 0.5578
 epoch: 94, train_loss: 0.7753, test_loss: 0.9409, test_f1: 0.5804
 epoch: 95, train_loss: 0.7921, test_loss: 0.9353, test_f1: 0.5871
 epoch: 96, train_loss: 0.7783, test_loss: 0.9766, test_f1: 0.5457
 epoch: 97, train_loss: 0.7614, test_loss: 0.9706, test_f1: 0.5764
 epoch: 98, train_loss: 0.7701, test_loss: 0.9642, test_f1: 0.5602
 epoch: 99, train_loss: 0.7736, test_loss: 0.9881, test_f1: 0.5595
##################ITERATION #3 ****************************************
 epoch: 0, train_loss: 1.1886, test_loss: 1.1313, test_f1: 0.3422
 epoch: 1, train_loss: 1.0461, test_loss: 1.0145, test_f1: 0.4515
 epoch: 2, train_loss: 1.0087, test_loss: 1.0464, test_f1: 0.4387
 epoch: 3, train_loss: 0.9920, test_loss: 1.0413, test_f1: 0.4751
 epoch: 4, train_loss: 0.9696, test_loss: 1.0373, test_f1: 0.4827
 epoch: 5, train_loss: 0.9735, test_loss: 1.0416, test_f1: 0.4801
 epoch: 6, train_loss: 0.9706, test_loss: 0.9818, test_f1: 0.5084
 epoch: 7, train_loss: 0.9737, test_loss: 1.0492, test_f1: 0.4881
 epoch: 8, train_loss: 0.9546, test_loss: 1.0591, test_f1: 0.4869
 epoch: 9, train_loss: 0.9456, test_loss: 1.0049, test_f1: 0.4999
 epoch: 10, train_loss: 0.9514, test_loss: 0.9901, test_f1: 0.4762
 epoch: 11, train_loss: 0.9443, test_loss: 1.1550, test_f1: 0.3923
 epoch: 12, train_loss: 0.9529, test_loss: 1.0318, test_f1: 0.5183
 epoch: 13, train_loss: 0.9332, test_loss: 0.9824, test_f1: 0.5073
 epoch: 14, train_loss: 0.9362, test_loss: 1.0390, test_f1: 0.4552
 epoch: 15, train_loss: 0.9284, test_loss: 1.0121, test_f1: 0.5013
 epoch: 16, train_loss: 0.9225, test_loss: 0.9913, test_f1: 0.4898
 epoch: 17, train_loss: 0.9105, test_loss: 1.0124, test_f1: 0.5386
 epoch: 18, train_loss: 0.9168, test_loss: 1.0132, test_f1: 0.4904
 epoch: 19, train_loss: 0.9070, test_loss: 0.9302, test_f1: 0.5029
 epoch: 20, train_loss: 0.9072, test_loss: 0.9634, test_f1: 0.5170
 epoch: 21, train_loss: 0.8992, test_loss: 0.9926, test_f1: 0.4992
 epoch: 22, train_loss: 0.8813, test_loss: 1.0038, test_f1: 0.4896
 epoch: 23, train_loss: 0.8865, test_loss: 0.9728, test_f1: 0.5036
 epoch: 24, train_loss: 0.9078, test_loss: 0.9652, test_f1: 0.5009
 epoch: 25, train_loss: 0.8872, test_loss: 0.9645, test_f1: 0.5068
 epoch: 26, train_loss: 0.8816, test_loss: 0.9921, test_f1: 0.4872
 epoch: 27, train_loss: 0.8873, test_loss: 1.0509, test_f1: 0.4785
 epoch: 28, train_loss: 0.8791, test_loss: 1.0192, test_f1: 0.4961
 epoch: 29, train_loss: 0.8949, test_loss: 0.9832, test_f1: 0.5007
 epoch: 30, train_loss: 0.8820, test_loss: 0.9893, test_f1: 0.5444
 epoch: 31, train_loss: 0.8830, test_loss: 0.9960, test_f1: 0.5137
 epoch: 32, train_loss: 0.8677, test_loss: 1.0457, test_f1: 0.4978
 epoch: 33, train_loss: 0.8767, test_loss: 0.9826, test_f1: 0.5053
 epoch: 34, train_loss: 0.8644, test_loss: 0.9868, test_f1: 0.5604
 epoch: 35, train_loss: 0.8644, test_loss: 0.9641, test_f1: 0.5101
 epoch: 36, train_loss: 0.8648, test_loss: 1.0679, test_f1: 0.4897
 epoch: 37, train_loss: 0.8788, test_loss: 1.0450, test_f1: 0.4975
 epoch: 38, train_loss: 0.8821, test_loss: 0.9832, test_f1: 0.5056
 epoch: 39, train_loss: 0.8669, test_loss: 0.9575, test_f1: 0.5040
 epoch: 40, train_loss: 0.8681, test_loss: 0.9651, test_f1: 0.5641
 epoch: 41, train_loss: 0.8594, test_loss: 0.9908, test_f1: 0.5146
 epoch: 42, train_loss: 0.8448, test_loss: 0.9489, test_f1: 0.5267
 epoch: 43, train_loss: 0.8569, test_loss: 0.9744, test_f1: 0.5138
 epoch: 44, train_loss: 0.8496, test_loss: 0.9860, test_f1: 0.5511
 epoch: 45, train_loss: 0.8561, test_loss: 0.9666, test_f1: 0.5247
 epoch: 46, train_loss: 0.8461, test_loss: 0.9617, test_f1: 0.5227
 epoch: 47, train_loss: 0.8530, test_loss: 0.9542, test_f1: 0.5544
 epoch: 48, train_loss: 0.8408, test_loss: 0.9704, test_f1: 0.5501
 epoch: 49, train_loss: 0.8232, test_loss: 0.9805, test_f1: 0.5385
 epoch: 50, train_loss: 0.8271, test_loss: 0.9586, test_f1: 0.5666
 epoch: 51, train_loss: 0.8179, test_loss: 1.0148, test_f1: 0.5479
 epoch: 52, train_loss: 0.8101, test_loss: 1.0194, test_f1: 0.5300
 epoch: 53, train_loss: 0.8013, test_loss: 0.9606, test_f1: 0.5339
 epoch: 54, train_loss: 0.7801, test_loss: 1.0500, test_f1: 0.5319
 epoch: 55, train_loss: 0.8071, test_loss: 0.9404, test_f1: 0.5561
 epoch: 56, train_loss: 0.7881, test_loss: 0.9846, test_f1: 0.5411
 epoch: 57, train_loss: 0.8031, test_loss: 0.9395, test_f1: 0.5577
 epoch: 58, train_loss: 0.7993, test_loss: 0.9618, test_f1: 0.5650
 epoch: 59, train_loss: 0.8003, test_loss: 0.9499, test_f1: 0.5746
 epoch: 60, train_loss: 0.7959, test_loss: 0.9753, test_f1: 0.5934
 epoch: 61, train_loss: 0.7758, test_loss: 0.9461, test_f1: 0.6080
 epoch: 62, train_loss: 0.7862, test_loss: 1.0018, test_f1: 0.5705
 epoch: 63, train_loss: 0.7901, test_loss: 0.9397, test_f1: 0.5762
 epoch: 64, train_loss: 0.7723, test_loss: 0.9734, test_f1: 0.5907
 epoch: 65, train_loss: 0.7685, test_loss: 0.9750, test_f1: 0.5795
 epoch: 66, train_loss: 0.7862, test_loss: 0.9728, test_f1: 0.5611
 epoch: 67, train_loss: 0.7853, test_loss: 0.9505, test_f1: 0.6039
 epoch: 68, train_loss: 0.7901, test_loss: 0.9546, test_f1: 0.6019
 epoch: 69, train_loss: 0.7792, test_loss: 0.9463, test_f1: 0.5603
 epoch: 70, train_loss: 0.7904, test_loss: 0.9436, test_f1: 0.5939
 epoch: 71, train_loss: 0.7844, test_loss: 0.9191, test_f1: 0.5798
 epoch: 72, train_loss: 0.7851, test_loss: 0.9466, test_f1: 0.6027
 epoch: 73, train_loss: 0.7837, test_loss: 0.9587, test_f1: 0.5827
 epoch: 74, train_loss: 0.7754, test_loss: 0.9093, test_f1: 0.5965
 epoch: 75, train_loss: 0.7806, test_loss: 0.9629, test_f1: 0.5955
 epoch: 76, train_loss: 0.7765, test_loss: 0.9735, test_f1: 0.5383
 epoch: 77, train_loss: 0.7602, test_loss: 1.0014, test_f1: 0.5583
 epoch: 78, train_loss: 0.7723, test_loss: 0.9598, test_f1: 0.5889
 epoch: 79, train_loss: 0.7658, test_loss: 0.9574, test_f1: 0.5663
 epoch: 80, train_loss: 0.7944, test_loss: 0.9528, test_f1: 0.5951
 epoch: 81, train_loss: 0.7710, test_loss: 0.9869, test_f1: 0.5245
 epoch: 82, train_loss: 0.7791, test_loss: 0.9435, test_f1: 0.5931
 epoch: 83, train_loss: 0.7728, test_loss: 0.9929, test_f1: 0.5459
 epoch: 84, train_loss: 0.7582, test_loss: 0.9571, test_f1: 0.5738
 epoch: 85, train_loss: 0.7640, test_loss: 0.9629, test_f1: 0.5605
 epoch: 86, train_loss: 0.7698, test_loss: 0.9914, test_f1: 0.5970
 epoch: 87, train_loss: 0.7545, test_loss: 0.9399, test_f1: 0.5686
 epoch: 88, train_loss: 0.7589, test_loss: 0.9557, test_f1: 0.5892
 epoch: 89, train_loss: 0.7472, test_loss: 0.9210, test_f1: 0.5845
 epoch: 90, train_loss: 0.7559, test_loss: 0.9431, test_f1: 0.5941
 epoch: 91, train_loss: 0.7439, test_loss: 0.9417, test_f1: 0.6178
 epoch: 92, train_loss: 0.7727, test_loss: 0.9783, test_f1: 0.5375
 epoch: 93, train_loss: 0.7501, test_loss: 0.9429, test_f1: 0.5923
 epoch: 94, train_loss: 0.7593, test_loss: 0.9873, test_f1: 0.5777
 epoch: 95, train_loss: 0.7378, test_loss: 0.9564, test_f1: 0.6134
 epoch: 96, train_loss: 0.7533, test_loss: 0.9961, test_f1: 0.6093
 epoch: 97, train_loss: 0.7344, test_loss: 0.9511, test_f1: 0.5593
 epoch: 98, train_loss: 0.7396, test_loss: 0.9757, test_f1: 0.5921
 epoch: 99, train_loss: 0.7415, test_loss: 0.9721, test_f1: 0.5962
##################ITERATION #4 ****************************************
 epoch: 0, train_loss: 1.1863, test_loss: 1.0329, test_f1: 0.4399
 epoch: 1, train_loss: 1.0449, test_loss: 1.0956, test_f1: 0.4375
 epoch: 2, train_loss: 1.0161, test_loss: 1.0253, test_f1: 0.4657
 epoch: 3, train_loss: 1.0061, test_loss: 1.0302, test_f1: 0.4921
 epoch: 4, train_loss: 0.9927, test_loss: 1.0445, test_f1: 0.4852
 epoch: 5, train_loss: 0.9784, test_loss: 1.0208, test_f1: 0.4651
 epoch: 6, train_loss: 0.9690, test_loss: 0.9777, test_f1: 0.4567
 epoch: 7, train_loss: 0.9716, test_loss: 0.9938, test_f1: 0.4733
 epoch: 8, train_loss: 0.9729, test_loss: 1.0553, test_f1: 0.4542
 epoch: 9, train_loss: 0.9620, test_loss: 1.0349, test_f1: 0.5014
 epoch: 10, train_loss: 0.9566, test_loss: 0.9970, test_f1: 0.4774
 epoch: 11, train_loss: 0.9429, test_loss: 1.0757, test_f1: 0.4625
 epoch: 12, train_loss: 0.9435, test_loss: 0.9841, test_f1: 0.4837
 epoch: 13, train_loss: 0.9273, test_loss: 0.9847, test_f1: 0.5043
 epoch: 14, train_loss: 0.9330, test_loss: 1.0377, test_f1: 0.4623
 epoch: 15, train_loss: 0.9333, test_loss: 1.0355, test_f1: 0.4432
 epoch: 16, train_loss: 0.9331, test_loss: 1.0270, test_f1: 0.4727
 epoch: 17, train_loss: 0.9289, test_loss: 0.9844, test_f1: 0.4701
 epoch: 18, train_loss: 0.9336, test_loss: 0.9893, test_f1: 0.4683
 epoch: 19, train_loss: 0.9277, test_loss: 1.0255, test_f1: 0.4635
 epoch: 20, train_loss: 0.9207, test_loss: 0.9957, test_f1: 0.5137
 epoch: 21, train_loss: 0.9085, test_loss: 1.0724, test_f1: 0.4686
 epoch: 22, train_loss: 0.9113, test_loss: 0.9529, test_f1: 0.5233
 epoch: 23, train_loss: 0.9116, test_loss: 1.0506, test_f1: 0.5421
 epoch: 24, train_loss: 0.9254, test_loss: 1.0136, test_f1: 0.5254
 epoch: 25, train_loss: 0.9283, test_loss: 1.0019, test_f1: 0.4702
 epoch: 26, train_loss: 0.9107, test_loss: 1.0465, test_f1: 0.4714
 epoch: 27, train_loss: 0.9053, test_loss: 0.9834, test_f1: 0.4909
 epoch: 28, train_loss: 0.9014, test_loss: 0.9803, test_f1: 0.5032
 epoch: 29, train_loss: 0.8995, test_loss: 0.9567, test_f1: 0.5285
 epoch: 30, train_loss: 0.9014, test_loss: 0.9332, test_f1: 0.5022
 epoch: 31, train_loss: 0.8949, test_loss: 0.9871, test_f1: 0.4820
 epoch: 32, train_loss: 0.8864, test_loss: 0.9603, test_f1: 0.5317
 epoch: 33, train_loss: 0.9040, test_loss: 0.9493, test_f1: 0.5196
 epoch: 34, train_loss: 0.8871, test_loss: 1.0222, test_f1: 0.4783
 epoch: 35, train_loss: 0.8969, test_loss: 1.0248, test_f1: 0.5041
 epoch: 36, train_loss: 0.8858, test_loss: 0.9193, test_f1: 0.5325
 epoch: 37, train_loss: 0.9006, test_loss: 0.9959, test_f1: 0.4959
 epoch: 38, train_loss: 0.8787, test_loss: 1.0056, test_f1: 0.5508
 epoch: 39, train_loss: 0.8867, test_loss: 1.0150, test_f1: 0.4950
 epoch: 40, train_loss: 0.8896, test_loss: 0.9727, test_f1: 0.5369
 epoch: 41, train_loss: 0.8689, test_loss: 0.9632, test_f1: 0.5624
 epoch: 42, train_loss: 0.8684, test_loss: 0.9743, test_f1: 0.4937
 epoch: 43, train_loss: 0.8783, test_loss: 1.0415, test_f1: 0.4918
 epoch: 44, train_loss: 0.8878, test_loss: 1.0799, test_f1: 0.5001
 epoch: 45, train_loss: 0.8809, test_loss: 0.9674, test_f1: 0.5317
 epoch: 46, train_loss: 0.8685, test_loss: 0.9813, test_f1: 0.5147
 epoch: 47, train_loss: 0.8589, test_loss: 0.9626, test_f1: 0.5663
 epoch: 48, train_loss: 0.8576, test_loss: 0.8902, test_f1: 0.5596
 epoch: 49, train_loss: 0.8680, test_loss: 0.9687, test_f1: 0.5137
 epoch: 50, train_loss: 0.8713, test_loss: 0.9467, test_f1: 0.5007
 epoch: 51, train_loss: 0.8524, test_loss: 0.9310, test_f1: 0.5052
 epoch: 52, train_loss: 0.8457, test_loss: 0.9968, test_f1: 0.5153
 epoch: 53, train_loss: 0.8482, test_loss: 0.9883, test_f1: 0.5129
 epoch: 54, train_loss: 0.8431, test_loss: 0.9899, test_f1: 0.5448
 epoch: 55, train_loss: 0.8485, test_loss: 0.9168, test_f1: 0.5422
 epoch: 56, train_loss: 0.8405, test_loss: 0.9537, test_f1: 0.5292
 epoch: 57, train_loss: 0.8363, test_loss: 0.9865, test_f1: 0.5239
 epoch: 58, train_loss: 0.8304, test_loss: 0.9337, test_f1: 0.5827
 epoch: 59, train_loss: 0.8936, test_loss: 1.0006, test_f1: 0.5358
 epoch: 60, train_loss: 0.8826, test_loss: 1.0001, test_f1: 0.5363
 epoch: 61, train_loss: 0.8671, test_loss: 0.9896, test_f1: 0.5174
 epoch: 62, train_loss: 0.8579, test_loss: 0.9693, test_f1: 0.5299
 epoch: 63, train_loss: 0.8539, test_loss: 0.9611, test_f1: 0.5117
 epoch: 64, train_loss: 0.8542, test_loss: 0.9606, test_f1: 0.5139
 epoch: 65, train_loss: 0.8447, test_loss: 0.9481, test_f1: 0.5562
 epoch: 66, train_loss: 0.8378, test_loss: 0.9619, test_f1: 0.5250
 epoch: 67, train_loss: 0.8324, test_loss: 0.9523, test_f1: 0.5440
 epoch: 68, train_loss: 0.8302, test_loss: 0.9483, test_f1: 0.5440
 epoch: 69, train_loss: 0.8363, test_loss: 0.9635, test_f1: 0.5160
 epoch: 70, train_loss: 0.8321, test_loss: 0.9470, test_f1: 0.5863
 epoch: 71, train_loss: 0.8199, test_loss: 0.9390, test_f1: 0.5209
 epoch: 72, train_loss: 0.8204, test_loss: 0.9428, test_f1: 0.5307
 epoch: 73, train_loss: 0.8317, test_loss: 0.9256, test_f1: 0.5282
 epoch: 74, train_loss: 0.8320, test_loss: 0.9431, test_f1: 0.5804
 epoch: 75, train_loss: 0.8167, test_loss: 0.9454, test_f1: 0.5541
 epoch: 76, train_loss: 0.8198, test_loss: 0.9335, test_f1: 0.5311
 epoch: 77, train_loss: 0.8209, test_loss: 0.9506, test_f1: 0.5504
 epoch: 78, train_loss: 0.8106, test_loss: 0.9782, test_f1: 0.5889
 epoch: 79, train_loss: 0.8196, test_loss: 0.9424, test_f1: 0.5489
 epoch: 80, train_loss: 0.8218, test_loss: 0.9176, test_f1: 0.5453
 epoch: 81, train_loss: 0.8192, test_loss: 0.9482, test_f1: 0.5912
 epoch: 82, train_loss: 0.8122, test_loss: 0.9293, test_f1: 0.5774
 epoch: 83, train_loss: 0.8066, test_loss: 0.9294, test_f1: 0.5918
 epoch: 84, train_loss: 0.8224, test_loss: 0.9117, test_f1: 0.5815
 epoch: 85, train_loss: 0.8174, test_loss: 0.8843, test_f1: 0.5829
 epoch: 86, train_loss: 0.8001, test_loss: 0.9374, test_f1: 0.5825
 epoch: 87, train_loss: 0.8091, test_loss: 0.9490, test_f1: 0.5452
 epoch: 88, train_loss: 0.8069, test_loss: 0.8993, test_f1: 0.6222
 epoch: 89, train_loss: 0.8000, test_loss: 0.9204, test_f1: 0.5574
 epoch: 90, train_loss: 0.7960, test_loss: 0.9792, test_f1: 0.5941
 epoch: 91, train_loss: 0.7998, test_loss: 0.9110, test_f1: 0.5719
 epoch: 92, train_loss: 0.8037, test_loss: 0.9127, test_f1: 0.6076
 epoch: 93, train_loss: 0.7996, test_loss: 0.8917, test_f1: 0.6088
 epoch: 94, train_loss: 0.7899, test_loss: 0.9200, test_f1: 0.5900
 epoch: 95, train_loss: 0.7988, test_loss: 0.9475, test_f1: 0.5243
 epoch: 96, train_loss: 0.7984, test_loss: 0.9226, test_f1: 0.5479
 epoch: 97, train_loss: 0.7940, test_loss: 0.9185, test_f1: 0.5809
 epoch: 98, train_loss: 0.8016, test_loss: 0.9077, test_f1: 0.5815
 epoch: 99, train_loss: 0.7919, test_loss: 0.9316, test_f1: 0.6050
##################ITERATION #5 ****************************************
 epoch: 0, train_loss: 1.2052, test_loss: 1.0316, test_f1: 0.4780
 epoch: 1, train_loss: 1.0561, test_loss: 0.9768, test_f1: 0.4509
 epoch: 2, train_loss: 1.0389, test_loss: 1.0410, test_f1: 0.4631
 epoch: 3, train_loss: 1.0017, test_loss: 1.0342, test_f1: 0.4375
 epoch: 4, train_loss: 1.0104, test_loss: 0.9913, test_f1: 0.4892
 epoch: 5, train_loss: 0.9783, test_loss: 0.9526, test_f1: 0.4877
 epoch: 6, train_loss: 0.9645, test_loss: 0.9937, test_f1: 0.4900
 epoch: 7, train_loss: 0.9570, test_loss: 0.9555, test_f1: 0.4736
 epoch: 8, train_loss: 0.9553, test_loss: 0.9691, test_f1: 0.4806
 epoch: 9, train_loss: 0.9565, test_loss: 0.9787, test_f1: 0.4706
 epoch: 10, train_loss: 0.9583, test_loss: 0.9808, test_f1: 0.4536
 epoch: 11, train_loss: 0.9409, test_loss: 0.9941, test_f1: 0.4868
 epoch: 12, train_loss: 0.9301, test_loss: 1.0013, test_f1: 0.5024
 epoch: 13, train_loss: 0.9260, test_loss: 0.9517, test_f1: 0.4675
 epoch: 14, train_loss: 0.9174, test_loss: 1.0215, test_f1: 0.4968
 epoch: 15, train_loss: 0.9139, test_loss: 0.9518, test_f1: 0.5076
 epoch: 16, train_loss: 0.9240, test_loss: 0.9883, test_f1: 0.4975
 epoch: 17, train_loss: 0.9097, test_loss: 0.9995, test_f1: 0.5072
 epoch: 18, train_loss: 0.9009, test_loss: 0.9319, test_f1: 0.5131
 epoch: 19, train_loss: 0.9109, test_loss: 0.9687, test_f1: 0.5130
 epoch: 20, train_loss: 0.9079, test_loss: 0.9600, test_f1: 0.5298
 epoch: 21, train_loss: 0.8819, test_loss: 1.0340, test_f1: 0.4917
 epoch: 22, train_loss: 0.8831, test_loss: 1.0019, test_f1: 0.5822
 epoch: 23, train_loss: 0.8854, test_loss: 0.9824, test_f1: 0.5217
 epoch: 24, train_loss: 0.8590, test_loss: 0.9707, test_f1: 0.5675
 epoch: 25, train_loss: 0.8827, test_loss: 0.9596, test_f1: 0.5209
 epoch: 26, train_loss: 0.8633, test_loss: 0.9619, test_f1: 0.5782
 epoch: 27, train_loss: 0.8653, test_loss: 0.9462, test_f1: 0.5775
 epoch: 28, train_loss: 0.8805, test_loss: 0.9378, test_f1: 0.5245
 epoch: 29, train_loss: 0.8806, test_loss: 0.9538, test_f1: 0.5005
 epoch: 30, train_loss: 0.8664, test_loss: 0.9223, test_f1: 0.5036
 epoch: 31, train_loss: 0.8521, test_loss: 0.9467, test_f1: 0.5746
 epoch: 32, train_loss: 0.8628, test_loss: 0.9028, test_f1: 0.5492
 epoch: 33, train_loss: 0.8580, test_loss: 0.9343, test_f1: 0.5115
 epoch: 34, train_loss: 0.8489, test_loss: 0.8966, test_f1: 0.5601
 epoch: 35, train_loss: 0.8426, test_loss: 0.9288, test_f1: 0.5001
 epoch: 36, train_loss: 0.8570, test_loss: 0.9207, test_f1: 0.5255
 epoch: 37, train_loss: 0.8481, test_loss: 0.8914, test_f1: 0.5311
 epoch: 38, train_loss: 0.8343, test_loss: 0.9111, test_f1: 0.5805
 epoch: 39, train_loss: 0.8242, test_loss: 0.8925, test_f1: 0.5757
 epoch: 40, train_loss: 0.8255, test_loss: 0.9010, test_f1: 0.5424
 epoch: 41, train_loss: 0.8522, test_loss: 0.9080, test_f1: 0.5265
 epoch: 42, train_loss: 0.8279, test_loss: 0.9237, test_f1: 0.5670
 epoch: 43, train_loss: 0.8534, test_loss: 0.9653, test_f1: 0.5012
 epoch: 44, train_loss: 0.8271, test_loss: 0.9402, test_f1: 0.5255
 epoch: 45, train_loss: 0.8468, test_loss: 0.8948, test_f1: 0.5590
 epoch: 46, train_loss: 0.8509, test_loss: 0.8986, test_f1: 0.5797
 epoch: 47, train_loss: 0.8278, test_loss: 0.8889, test_f1: 0.5843
 epoch: 48, train_loss: 0.8271, test_loss: 0.8683, test_f1: 0.5487
 epoch: 49, train_loss: 0.8378, test_loss: 0.9062, test_f1: 0.5240
 epoch: 50, train_loss: 0.8370, test_loss: 0.9149, test_f1: 0.5391
 epoch: 51, train_loss: 0.8309, test_loss: 0.8925, test_f1: 0.5727
 epoch: 52, train_loss: 0.8104, test_loss: 0.8958, test_f1: 0.5731
 epoch: 53, train_loss: 0.7946, test_loss: 0.9231, test_f1: 0.5608
 epoch: 54, train_loss: 0.7873, test_loss: 0.8994, test_f1: 0.5781
 epoch: 55, train_loss: 0.8033, test_loss: 0.8798, test_f1: 0.5725
 epoch: 56, train_loss: 0.8000, test_loss: 0.8792, test_f1: 0.5746
 epoch: 57, train_loss: 0.7884, test_loss: 0.9067, test_f1: 0.5714
 epoch: 58, train_loss: 0.7995, test_loss: 0.8925, test_f1: 0.5550
 epoch: 59, train_loss: 0.7907, test_loss: 0.8919, test_f1: 0.5763
 epoch: 60, train_loss: 0.7800, test_loss: 0.8689, test_f1: 0.5904
 epoch: 61, train_loss: 0.7740, test_loss: 0.8803, test_f1: 0.5809
 epoch: 62, train_loss: 0.7776, test_loss: 0.8871, test_f1: 0.5752
 epoch: 63, train_loss: 0.7689, test_loss: 0.8880, test_f1: 0.5745
 epoch: 64, train_loss: 0.7754, test_loss: 0.9148, test_f1: 0.5751
 epoch: 65, train_loss: 0.7748, test_loss: 0.8956, test_f1: 0.5673
 epoch: 66, train_loss: 0.7791, test_loss: 0.9002, test_f1: 0.6037
 epoch: 67, train_loss: 0.7800, test_loss: 0.8990, test_f1: 0.5833
 epoch: 68, train_loss: 0.7906, test_loss: 0.8832, test_f1: 0.5853
 epoch: 69, train_loss: 0.7682, test_loss: 0.9239, test_f1: 0.5444
 epoch: 70, train_loss: 0.7685, test_loss: 0.8861, test_f1: 0.6179
 epoch: 71, train_loss: 0.7717, test_loss: 0.8891, test_f1: 0.6007
 epoch: 72, train_loss: 0.7797, test_loss: 0.9199, test_f1: 0.5742
 epoch: 73, train_loss: 0.7696, test_loss: 0.9262, test_f1: 0.5614
 epoch: 74, train_loss: 0.7650, test_loss: 0.9277, test_f1: 0.5602
 epoch: 75, train_loss: 0.7708, test_loss: 0.8756, test_f1: 0.5758
 epoch: 76, train_loss: 0.7837, test_loss: 0.8926, test_f1: 0.5748
 epoch: 77, train_loss: 0.7753, test_loss: 0.8831, test_f1: 0.6020
 epoch: 78, train_loss: 0.7693, test_loss: 0.8731, test_f1: 0.5885
 epoch: 79, train_loss: 0.7492, test_loss: 0.9094, test_f1: 0.6043
 epoch: 80, train_loss: 0.7775, test_loss: 0.9218, test_f1: 0.6014
 epoch: 81, train_loss: 0.7684, test_loss: 0.8801, test_f1: 0.5589
 epoch: 82, train_loss: 0.7695, test_loss: 0.9283, test_f1: 0.6228
 epoch: 83, train_loss: 0.7570, test_loss: 0.9141, test_f1: 0.6041
 epoch: 84, train_loss: 0.7801, test_loss: 0.9030, test_f1: 0.5816
 epoch: 85, train_loss: 0.7615, test_loss: 0.9195, test_f1: 0.5420
 epoch: 86, train_loss: 0.7584, test_loss: 0.9077, test_f1: 0.6035
 epoch: 87, train_loss: 0.7635, test_loss: 0.9889, test_f1: 0.5854
 epoch: 88, train_loss: 0.7643, test_loss: 0.9437, test_f1: 0.6040
 epoch: 89, train_loss: 0.7610, test_loss: 0.9003, test_f1: 0.6231
 epoch: 90, train_loss: 0.7593, test_loss: 0.9121, test_f1: 0.5895
 epoch: 91, train_loss: 0.7661, test_loss: 0.8824, test_f1: 0.6098
 epoch: 92, train_loss: 0.7504, test_loss: 0.9115, test_f1: 0.6112
 epoch: 93, train_loss: 0.7590, test_loss: 0.9110, test_f1: 0.5943
 epoch: 94, train_loss: 0.7504, test_loss: 0.9394, test_f1: 0.5669
 epoch: 95, train_loss: 0.7651, test_loss: 0.8929, test_f1: 0.5799
 epoch: 96, train_loss: 0.7561, test_loss: 0.8812, test_f1: 0.5966
 epoch: 97, train_loss: 0.7602, test_loss: 0.9543, test_f1: 0.5712
 epoch: 98, train_loss: 0.7573, test_loss: 0.9035, test_f1: 0.5870
 epoch: 99, train_loss: 0.7580, test_loss: 0.9439, test_f1: 0.5756
##################ITERATION #6 ****************************************
 epoch: 0, train_loss: 1.1581, test_loss: 1.0332, test_f1: 0.3875
 epoch: 1, train_loss: 1.0203, test_loss: 1.0539, test_f1: 0.3977
 epoch: 2, train_loss: 1.0037, test_loss: 1.0164, test_f1: 0.4605
 epoch: 3, train_loss: 0.9777, test_loss: 1.0040, test_f1: 0.5137
 epoch: 4, train_loss: 0.9757, test_loss: 1.0252, test_f1: 0.4642
 epoch: 5, train_loss: 0.9702, test_loss: 1.0082, test_f1: 0.4520
 epoch: 6, train_loss: 0.9656, test_loss: 0.9789, test_f1: 0.4828
 epoch: 7, train_loss: 0.9482, test_loss: 1.0115, test_f1: 0.5099
 epoch: 8, train_loss: 0.9493, test_loss: 1.0138, test_f1: 0.4848
 epoch: 9, train_loss: 0.9374, test_loss: 1.0059, test_f1: 0.5379
 epoch: 10, train_loss: 0.9352, test_loss: 1.0439, test_f1: 0.5352
 epoch: 11, train_loss: 0.9335, test_loss: 1.0520, test_f1: 0.4933
 epoch: 12, train_loss: 0.9254, test_loss: 1.0208, test_f1: 0.4883
 epoch: 13, train_loss: 0.9298, test_loss: 1.1899, test_f1: 0.4454
 epoch: 14, train_loss: 0.9415, test_loss: 1.0054, test_f1: 0.4957
 epoch: 15, train_loss: 0.9229, test_loss: 1.0054, test_f1: 0.4962
 epoch: 16, train_loss: 0.9227, test_loss: 1.0310, test_f1: 0.4902
 epoch: 17, train_loss: 0.9300, test_loss: 1.0085, test_f1: 0.4892
 epoch: 18, train_loss: 0.9272, test_loss: 0.9969, test_f1: 0.5077
 epoch: 19, train_loss: 0.9243, test_loss: 1.1370, test_f1: 0.4743
 epoch: 20, train_loss: 0.9262, test_loss: 1.0312, test_f1: 0.4966
 epoch: 21, train_loss: 0.9153, test_loss: 0.9361, test_f1: 0.5565
 epoch: 22, train_loss: 0.9108, test_loss: 0.9565, test_f1: 0.4830
 epoch: 23, train_loss: 0.9077, test_loss: 0.9910, test_f1: 0.5101
 epoch: 24, train_loss: 0.9222, test_loss: 1.0405, test_f1: 0.4866
 epoch: 25, train_loss: 0.9076, test_loss: 1.0015, test_f1: 0.4991
 epoch: 26, train_loss: 0.8945, test_loss: 0.9503, test_f1: 0.5057
 epoch: 27, train_loss: 0.8987, test_loss: 1.0013, test_f1: 0.5328
 epoch: 28, train_loss: 0.9102, test_loss: 1.0208, test_f1: 0.5084
 epoch: 29, train_loss: 0.8815, test_loss: 1.0321, test_f1: 0.5059
 epoch: 30, train_loss: 0.8883, test_loss: 0.9918, test_f1: 0.5153
 epoch: 31, train_loss: 0.8830, test_loss: 0.9934, test_f1: 0.5164
 epoch: 32, train_loss: 0.8831, test_loss: 0.9693, test_f1: 0.5398
 epoch: 33, train_loss: 0.8829, test_loss: 0.9676, test_f1: 0.5183
 epoch: 34, train_loss: 0.8809, test_loss: 0.9662, test_f1: 0.5184
 epoch: 35, train_loss: 0.8793, test_loss: 0.9634, test_f1: 0.5465
 epoch: 36, train_loss: 0.8760, test_loss: 0.8973, test_f1: 0.5620
 epoch: 37, train_loss: 0.8755, test_loss: 1.0012, test_f1: 0.5339
 epoch: 38, train_loss: 0.8677, test_loss: 0.9769, test_f1: 0.5637
 epoch: 39, train_loss: 0.8836, test_loss: 0.9583, test_f1: 0.5889
 epoch: 40, train_loss: 0.8688, test_loss: 0.9710, test_f1: 0.5087
 epoch: 41, train_loss: 0.8605, test_loss: 0.9758, test_f1: 0.5473
 epoch: 42, train_loss: 0.8505, test_loss: 0.9819, test_f1: 0.5387
 epoch: 43, train_loss: 0.8657, test_loss: 0.9649, test_f1: 0.5214
 epoch: 44, train_loss: 0.8604, test_loss: 0.9406, test_f1: 0.5583
 epoch: 45, train_loss: 0.8667, test_loss: 0.9604, test_f1: 0.5403
 epoch: 46, train_loss: 0.8610, test_loss: 0.9614, test_f1: 0.5174
 epoch: 47, train_loss: 0.8533, test_loss: 0.9483, test_f1: 0.5570
 epoch: 48, train_loss: 0.8765, test_loss: 0.9830, test_f1: 0.5222
 epoch: 49, train_loss: 0.8771, test_loss: 1.0131, test_f1: 0.4720
 epoch: 50, train_loss: 0.8578, test_loss: 0.9534, test_f1: 0.5278
 epoch: 51, train_loss: 0.8411, test_loss: 0.9284, test_f1: 0.5389
 epoch: 52, train_loss: 0.8380, test_loss: 0.9203, test_f1: 0.5884
 epoch: 53, train_loss: 0.8334, test_loss: 0.9142, test_f1: 0.5744
 epoch: 54, train_loss: 0.8233, test_loss: 0.9209, test_f1: 0.5595
 epoch: 55, train_loss: 0.8320, test_loss: 0.9437, test_f1: 0.5369
 epoch: 56, train_loss: 0.8241, test_loss: 0.9239, test_f1: 0.5349
 epoch: 57, train_loss: 0.8064, test_loss: 0.8997, test_f1: 0.5527
 epoch: 58, train_loss: 0.8158, test_loss: 0.9401, test_f1: 0.5982
 epoch: 59, train_loss: 0.8312, test_loss: 0.9316, test_f1: 0.5711
 epoch: 60, train_loss: 0.8146, test_loss: 0.9365, test_f1: 0.5954
 epoch: 61, train_loss: 0.8099, test_loss: 0.9339, test_f1: 0.5783
 epoch: 62, train_loss: 0.8012, test_loss: 0.9340, test_f1: 0.5953
 epoch: 63, train_loss: 0.8009, test_loss: 0.9335, test_f1: 0.5874
 epoch: 64, train_loss: 0.8035, test_loss: 0.9112, test_f1: 0.6015
 epoch: 65, train_loss: 0.7938, test_loss: 0.9413, test_f1: 0.5846
 epoch: 66, train_loss: 0.8085, test_loss: 0.9322, test_f1: 0.6039
 epoch: 67, train_loss: 0.8076, test_loss: 0.9235, test_f1: 0.6102
 epoch: 68, train_loss: 0.7996, test_loss: 0.9871, test_f1: 0.5824
 epoch: 69, train_loss: 0.8026, test_loss: 0.9262, test_f1: 0.5788
 epoch: 70, train_loss: 0.8040, test_loss: 0.9106, test_f1: 0.5865
 epoch: 71, train_loss: 0.7928, test_loss: 0.9245, test_f1: 0.5900
 epoch: 72, train_loss: 0.8001, test_loss: 0.9349, test_f1: 0.5648
 epoch: 73, train_loss: 0.7942, test_loss: 0.9401, test_f1: 0.5799
 epoch: 74, train_loss: 0.7933, test_loss: 0.9105, test_f1: 0.6073
 epoch: 75, train_loss: 0.7936, test_loss: 0.9363, test_f1: 0.5661
 epoch: 76, train_loss: 0.7973, test_loss: 0.9133, test_f1: 0.5483
 epoch: 77, train_loss: 0.7947, test_loss: 0.9208, test_f1: 0.5854
 epoch: 78, train_loss: 0.7917, test_loss: 0.8820, test_f1: 0.5903
 epoch: 79, train_loss: 0.7778, test_loss: 0.9384, test_f1: 0.5746
 epoch: 80, train_loss: 0.7809, test_loss: 0.8921, test_f1: 0.5894
 epoch: 81, train_loss: 0.7854, test_loss: 0.9141, test_f1: 0.5765
 epoch: 82, train_loss: 0.7806, test_loss: 0.9184, test_f1: 0.5927
 epoch: 83, train_loss: 0.7859, test_loss: 0.9284, test_f1: 0.5966
 epoch: 84, train_loss: 0.7939, test_loss: 0.8868, test_f1: 0.5997
 epoch: 85, train_loss: 0.7849, test_loss: 0.9193, test_f1: 0.5921
 epoch: 86, train_loss: 0.7792, test_loss: 0.9333, test_f1: 0.5604
 epoch: 87, train_loss: 0.7863, test_loss: 0.8978, test_f1: 0.6000
 epoch: 88, train_loss: 0.7811, test_loss: 0.9341, test_f1: 0.5775
 epoch: 89, train_loss: 0.7821, test_loss: 0.9272, test_f1: 0.5949
 epoch: 90, train_loss: 0.7899, test_loss: 0.9467, test_f1: 0.5873
 epoch: 91, train_loss: 0.7848, test_loss: 0.9469, test_f1: 0.5966
 epoch: 92, train_loss: 0.7725, test_loss: 0.9321, test_f1: 0.5901
 epoch: 93, train_loss: 0.7737, test_loss: 0.8890, test_f1: 0.6117
 epoch: 94, train_loss: 0.7881, test_loss: 0.9137, test_f1: 0.5635
 epoch: 95, train_loss: 0.7708, test_loss: 0.9181, test_f1: 0.5708
 epoch: 96, train_loss: 0.7815, test_loss: 0.9218, test_f1: 0.5891
 epoch: 97, train_loss: 0.7642, test_loss: 0.9270, test_f1: 0.5950
 epoch: 98, train_loss: 0.7812, test_loss: 0.9094, test_f1: 0.5962
 epoch: 99, train_loss: 0.7533, test_loss: 0.9308, test_f1: 0.5763
##################ITERATION #7 ****************************************
 epoch: 0, train_loss: 1.2196, test_loss: 1.0323, test_f1: 0.4189
 epoch: 1, train_loss: 1.0625, test_loss: 1.0576, test_f1: 0.4578
 epoch: 2, train_loss: 1.0083, test_loss: 1.0743, test_f1: 0.4658
 epoch: 3, train_loss: 0.9960, test_loss: 0.9997, test_f1: 0.4784
 epoch: 4, train_loss: 0.9831, test_loss: 1.0214, test_f1: 0.4348
 epoch: 5, train_loss: 0.9837, test_loss: 0.9940, test_f1: 0.4634
 epoch: 6, train_loss: 0.9653, test_loss: 1.1962, test_f1: 0.4392
 epoch: 7, train_loss: 0.9709, test_loss: 1.0838, test_f1: 0.4711
 epoch: 8, train_loss: 0.9607, test_loss: 1.0176, test_f1: 0.4826
 epoch: 9, train_loss: 0.9406, test_loss: 1.0282, test_f1: 0.5090
 epoch: 10, train_loss: 0.9226, test_loss: 1.0314, test_f1: 0.4820
 epoch: 11, train_loss: 0.9230, test_loss: 1.0178, test_f1: 0.4915
 epoch: 12, train_loss: 0.9200, test_loss: 0.9941, test_f1: 0.5119
 epoch: 13, train_loss: 0.9253, test_loss: 1.0120, test_f1: 0.5172
 epoch: 14, train_loss: 0.9090, test_loss: 0.9903, test_f1: 0.5255
 epoch: 15, train_loss: 0.9094, test_loss: 0.9843, test_f1: 0.5141
 epoch: 16, train_loss: 0.9039, test_loss: 0.9752, test_f1: 0.5260
 epoch: 17, train_loss: 0.8908, test_loss: 0.9853, test_f1: 0.5129
 epoch: 18, train_loss: 0.8920, test_loss: 0.9916, test_f1: 0.5362
 epoch: 19, train_loss: 0.8837, test_loss: 1.0015, test_f1: 0.5239
 epoch: 20, train_loss: 0.8817, test_loss: 0.9623, test_f1: 0.5460
 epoch: 21, train_loss: 0.8893, test_loss: 0.9851, test_f1: 0.4976
 epoch: 22, train_loss: 0.8684, test_loss: 0.9605, test_f1: 0.5174
 epoch: 23, train_loss: 0.8803, test_loss: 0.9698, test_f1: 0.5113
 epoch: 24, train_loss: 0.8827, test_loss: 0.9776, test_f1: 0.5481
 epoch: 25, train_loss: 0.8713, test_loss: 0.9327, test_f1: 0.5253
 epoch: 26, train_loss: 0.8514, test_loss: 0.9457, test_f1: 0.5170
 epoch: 27, train_loss: 0.8764, test_loss: 0.8875, test_f1: 0.5148
 epoch: 28, train_loss: 0.8690, test_loss: 0.9475, test_f1: 0.5246
 epoch: 29, train_loss: 0.8543, test_loss: 0.9366, test_f1: 0.5398
 epoch: 30, train_loss: 0.8562, test_loss: 0.9222, test_f1: 0.5279
 epoch: 31, train_loss: 0.8518, test_loss: 0.8652, test_f1: 0.5512
 epoch: 32, train_loss: 0.8276, test_loss: 0.8741, test_f1: 0.5624
 epoch: 33, train_loss: 0.8279, test_loss: 0.9084, test_f1: 0.5204
 epoch: 34, train_loss: 0.8359, test_loss: 0.9343, test_f1: 0.5342
 epoch: 35, train_loss: 0.8323, test_loss: 0.9140, test_f1: 0.5298
 epoch: 36, train_loss: 0.8362, test_loss: 0.9706, test_f1: 0.5276
 epoch: 37, train_loss: 0.8434, test_loss: 0.9252, test_f1: 0.5249
 epoch: 38, train_loss: 0.8293, test_loss: 0.9580, test_f1: 0.5312
 epoch: 39, train_loss: 0.8221, test_loss: 0.9544, test_f1: 0.5364
 epoch: 40, train_loss: 0.8243, test_loss: 0.9219, test_f1: 0.5473
 epoch: 41, train_loss: 0.8173, test_loss: 0.9526, test_f1: 0.5134
 epoch: 42, train_loss: 0.8245, test_loss: 0.9425, test_f1: 0.5323
 epoch: 43, train_loss: 0.8316, test_loss: 0.9080, test_f1: 0.5298
 epoch: 44, train_loss: 0.8328, test_loss: 0.9071, test_f1: 0.5341
 epoch: 45, train_loss: 0.8042, test_loss: 0.8853, test_f1: 0.5503
 epoch: 46, train_loss: 0.8138, test_loss: 0.8974, test_f1: 0.5480
 epoch: 47, train_loss: 0.8276, test_loss: 0.8897, test_f1: 0.5640
 epoch: 48, train_loss: 0.8158, test_loss: 0.8894, test_f1: 0.5671
 epoch: 49, train_loss: 0.8164, test_loss: 0.8961, test_f1: 0.5309
 epoch: 50, train_loss: 0.8114, test_loss: 0.9518, test_f1: 0.5187
 epoch: 51, train_loss: 0.7867, test_loss: 0.9056, test_f1: 0.5546
 epoch: 52, train_loss: 0.7935, test_loss: 0.8928, test_f1: 0.5443
 epoch: 53, train_loss: 0.7774, test_loss: 0.9101, test_f1: 0.5514
 epoch: 54, train_loss: 0.7792, test_loss: 0.8575, test_f1: 0.5638
 epoch: 55, train_loss: 0.7705, test_loss: 0.8647, test_f1: 0.5727
 epoch: 56, train_loss: 0.7843, test_loss: 0.9012, test_f1: 0.5890
 epoch: 57, train_loss: 0.7641, test_loss: 0.8968, test_f1: 0.5611
 epoch: 58, train_loss: 0.7628, test_loss: 0.8948, test_f1: 0.5797
 epoch: 59, train_loss: 0.7722, test_loss: 0.9169, test_f1: 0.5398
 epoch: 60, train_loss: 0.7642, test_loss: 0.9127, test_f1: 0.5790
 epoch: 61, train_loss: 0.7671, test_loss: 0.9021, test_f1: 0.5687
 epoch: 62, train_loss: 0.7652, test_loss: 0.8776, test_f1: 0.5765
 epoch: 63, train_loss: 0.7549, test_loss: 0.9262, test_f1: 0.5568
 epoch: 64, train_loss: 0.7687, test_loss: 0.9103, test_f1: 0.5587
 epoch: 65, train_loss: 0.7527, test_loss: 0.8505, test_f1: 0.5933
 epoch: 66, train_loss: 0.7558, test_loss: 0.8501, test_f1: 0.5727
 epoch: 67, train_loss: 0.7430, test_loss: 0.8806, test_f1: 0.5553
 epoch: 68, train_loss: 0.7543, test_loss: 0.9087, test_f1: 0.5903
 epoch: 69, train_loss: 0.7563, test_loss: 0.8692, test_f1: 0.5994
 epoch: 70, train_loss: 0.7508, test_loss: 0.8782, test_f1: 0.5867
 epoch: 71, train_loss: 0.7550, test_loss: 0.8855, test_f1: 0.5835
 epoch: 72, train_loss: 0.7514, test_loss: 0.8427, test_f1: 0.5804
 epoch: 73, train_loss: 0.7595, test_loss: 0.8756, test_f1: 0.5688
 epoch: 74, train_loss: 0.7657, test_loss: 0.8544, test_f1: 0.5884
 epoch: 75, train_loss: 0.7508, test_loss: 0.8506, test_f1: 0.5920
 epoch: 76, train_loss: 0.7496, test_loss: 0.8681, test_f1: 0.5699
 epoch: 77, train_loss: 0.7545, test_loss: 0.8597, test_f1: 0.5974
 epoch: 78, train_loss: 0.7475, test_loss: 0.8503, test_f1: 0.5793
 epoch: 79, train_loss: 0.7537, test_loss: 0.8642, test_f1: 0.5903
 epoch: 80, train_loss: 0.7308, test_loss: 0.8728, test_f1: 0.5950
 epoch: 81, train_loss: 0.7450, test_loss: 0.8736, test_f1: 0.5854
 epoch: 82, train_loss: 0.7446, test_loss: 0.8788, test_f1: 0.5904
 epoch: 83, train_loss: 0.7399, test_loss: 0.9086, test_f1: 0.5922
 epoch: 84, train_loss: 0.7573, test_loss: 0.8597, test_f1: 0.6015
 epoch: 85, train_loss: 0.7404, test_loss: 0.8984, test_f1: 0.5710
 epoch: 86, train_loss: 0.7442, test_loss: 0.8312, test_f1: 0.6196
 epoch: 87, train_loss: 0.7387, test_loss: 0.8291, test_f1: 0.5877
 epoch: 88, train_loss: 0.7384, test_loss: 0.9030, test_f1: 0.5867
 epoch: 89, train_loss: 0.7387, test_loss: 0.8267, test_f1: 0.5690
 epoch: 90, train_loss: 0.7385, test_loss: 0.9147, test_f1: 0.5782
 epoch: 91, train_loss: 0.7400, test_loss: 0.8931, test_f1: 0.5843
 epoch: 92, train_loss: 0.7498, test_loss: 0.8897, test_f1: 0.5957
 epoch: 93, train_loss: 0.7342, test_loss: 0.8457, test_f1: 0.5855
 epoch: 94, train_loss: 0.7416, test_loss: 0.7844, test_f1: 0.5928
 epoch: 95, train_loss: 0.7395, test_loss: 0.8946, test_f1: 0.5648
 epoch: 96, train_loss: 0.7431, test_loss: 0.9516, test_f1: 0.5426
 epoch: 97, train_loss: 0.7304, test_loss: 0.9032, test_f1: 0.5950
 epoch: 98, train_loss: 0.7415, test_loss: 0.9299, test_f1: 0.5911
 epoch: 99, train_loss: 0.7343, test_loss: 0.9197, test_f1: 0.5635
##################ITERATION #8 ****************************************
 epoch: 0, train_loss: 1.2261, test_loss: 1.0598, test_f1: 0.3953
 epoch: 1, train_loss: 1.0671, test_loss: 1.0775, test_f1: 0.4336
 epoch: 2, train_loss: 1.0402, test_loss: 1.0641, test_f1: 0.4667
 epoch: 3, train_loss: 1.0187, test_loss: 1.0036, test_f1: 0.4711
 epoch: 4, train_loss: 0.9936, test_loss: 1.1821, test_f1: 0.3728
 epoch: 5, train_loss: 0.9885, test_loss: 1.0192, test_f1: 0.4370
 epoch: 6, train_loss: 0.9703, test_loss: 1.0158, test_f1: 0.4912
 epoch: 7, train_loss: 0.9669, test_loss: 1.0353, test_f1: 0.4727
 epoch: 8, train_loss: 0.9528, test_loss: 0.9222, test_f1: 0.4962
 epoch: 9, train_loss: 0.9487, test_loss: 0.9175, test_f1: 0.4764
 epoch: 10, train_loss: 0.9478, test_loss: 0.9308, test_f1: 0.5050
 epoch: 11, train_loss: 0.9399, test_loss: 0.9106, test_f1: 0.5340
 epoch: 12, train_loss: 0.9497, test_loss: 1.0322, test_f1: 0.4263
 epoch: 13, train_loss: 0.9428, test_loss: 1.2111, test_f1: 0.4442
 epoch: 14, train_loss: 0.9382, test_loss: 0.9096, test_f1: 0.4865
 epoch: 15, train_loss: 0.9310, test_loss: 1.0084, test_f1: 0.4840
 epoch: 16, train_loss: 0.9203, test_loss: 1.0146, test_f1: 0.5219
 epoch: 17, train_loss: 0.9528, test_loss: 0.9434, test_f1: 0.4885
 epoch: 18, train_loss: 0.9322, test_loss: 0.9695, test_f1: 0.4802
 epoch: 19, train_loss: 0.9320, test_loss: 0.9801, test_f1: 0.5206
 epoch: 20, train_loss: 0.9139, test_loss: 1.0256, test_f1: 0.4569
 epoch: 21, train_loss: 0.9201, test_loss: 1.0244, test_f1: 0.4542
 epoch: 22, train_loss: 0.9070, test_loss: 0.9868, test_f1: 0.5138
 epoch: 23, train_loss: 0.8990, test_loss: 0.9858, test_f1: 0.5088
 epoch: 24, train_loss: 0.9006, test_loss: 1.0768, test_f1: 0.4640
 epoch: 25, train_loss: 0.8961, test_loss: 0.9083, test_f1: 0.5660
 epoch: 26, train_loss: 0.8824, test_loss: 0.9827, test_f1: 0.5280
 epoch: 27, train_loss: 0.8769, test_loss: 0.9896, test_f1: 0.4850
 epoch: 28, train_loss: 0.8834, test_loss: 1.0825, test_f1: 0.4658
 epoch: 29, train_loss: 0.8952, test_loss: 1.0017, test_f1: 0.4941
 epoch: 30, train_loss: 0.8911, test_loss: 0.9609, test_f1: 0.4551
 epoch: 31, train_loss: 0.8858, test_loss: 0.9890, test_f1: 0.5300
 epoch: 32, train_loss: 0.8861, test_loss: 0.9888, test_f1: 0.5036
 epoch: 33, train_loss: 0.8695, test_loss: 0.9569, test_f1: 0.5141
 epoch: 34, train_loss: 0.8597, test_loss: 0.9441, test_f1: 0.5059
 epoch: 35, train_loss: 0.8738, test_loss: 0.9986, test_f1: 0.4934
 epoch: 36, train_loss: 0.8728, test_loss: 0.9763, test_f1: 0.5198
 epoch: 37, train_loss: 0.8579, test_loss: 0.9610, test_f1: 0.5322
 epoch: 38, train_loss: 0.8554, test_loss: 0.9727, test_f1: 0.5783
 epoch: 39, train_loss: 0.8444, test_loss: 0.9454, test_f1: 0.4977
 epoch: 40, train_loss: 0.8667, test_loss: 0.9385, test_f1: 0.5229
 epoch: 41, train_loss: 0.8532, test_loss: 0.8547, test_f1: 0.4997
 epoch: 42, train_loss: 0.8449, test_loss: 0.9190, test_f1: 0.5384
 epoch: 43, train_loss: 0.8424, test_loss: 0.9018, test_f1: 0.5180
 epoch: 44, train_loss: 0.8504, test_loss: 0.9979, test_f1: 0.4865
 epoch: 45, train_loss: 0.8485, test_loss: 0.9112, test_f1: 0.5578
 epoch: 46, train_loss: 0.8567, test_loss: 0.9662, test_f1: 0.4964
 epoch: 47, train_loss: 0.8555, test_loss: 0.9486, test_f1: 0.5508
 epoch: 48, train_loss: 0.8590, test_loss: 0.9337, test_f1: 0.5135
 epoch: 49, train_loss: 0.8274, test_loss: 0.9241, test_f1: 0.5222
 epoch: 50, train_loss: 0.8404, test_loss: 0.9609, test_f1: 0.5932
 epoch: 51, train_loss: 0.8130, test_loss: 0.9366, test_f1: 0.5524
 epoch: 52, train_loss: 0.8113, test_loss: 0.9246, test_f1: 0.5739
 epoch: 53, train_loss: 0.7979, test_loss: 0.9295, test_f1: 0.5480
 epoch: 54, train_loss: 0.8014, test_loss: 0.9184, test_f1: 0.5921
 epoch: 55, train_loss: 0.8071, test_loss: 0.9104, test_f1: 0.5838
 epoch: 56, train_loss: 0.7993, test_loss: 0.9273, test_f1: 0.6042
 epoch: 57, train_loss: 0.7903, test_loss: 0.9239, test_f1: 0.5943
 epoch: 58, train_loss: 0.7831, test_loss: 0.9172, test_f1: 0.5836
 epoch: 59, train_loss: 0.7812, test_loss: 0.9021, test_f1: 0.5917
 epoch: 60, train_loss: 0.8035, test_loss: 0.8947, test_f1: 0.5969
 epoch: 61, train_loss: 0.7932, test_loss: 0.9098, test_f1: 0.5993
 epoch: 62, train_loss: 0.7808, test_loss: 0.9168, test_f1: 0.5973
 epoch: 63, train_loss: 0.7895, test_loss: 0.8997, test_f1: 0.5927
 epoch: 64, train_loss: 0.7874, test_loss: 0.8479, test_f1: 0.5973
 epoch: 65, train_loss: 0.7840, test_loss: 0.9235, test_f1: 0.5703
 epoch: 66, train_loss: 0.7934, test_loss: 0.9267, test_f1: 0.5720
 epoch: 67, train_loss: 0.7683, test_loss: 0.8766, test_f1: 0.6005
 epoch: 68, train_loss: 0.7832, test_loss: 0.9074, test_f1: 0.5941
 epoch: 69, train_loss: 0.7711, test_loss: 0.9078, test_f1: 0.5896
 epoch: 70, train_loss: 0.7741, test_loss: 0.8869, test_f1: 0.5939
 epoch: 71, train_loss: 0.7586, test_loss: 0.8920, test_f1: 0.5966
 epoch: 72, train_loss: 0.7815, test_loss: 0.8910, test_f1: 0.5877
 epoch: 73, train_loss: 0.7652, test_loss: 0.9236, test_f1: 0.6037
 epoch: 74, train_loss: 0.7760, test_loss: 0.9194, test_f1: 0.5845
 epoch: 75, train_loss: 0.7622, test_loss: 0.8779, test_f1: 0.6139
 epoch: 76, train_loss: 0.7598, test_loss: 0.8508, test_f1: 0.6492
 epoch: 77, train_loss: 0.7561, test_loss: 0.8950, test_f1: 0.5804
 epoch: 78, train_loss: 0.7580, test_loss: 0.9172, test_f1: 0.5616
 epoch: 79, train_loss: 0.7705, test_loss: 1.0538, test_f1: 0.5413
 epoch: 80, train_loss: 0.7785, test_loss: 0.8844, test_f1: 0.6044
 epoch: 81, train_loss: 0.7664, test_loss: 0.9072, test_f1: 0.5894
 epoch: 82, train_loss: 0.7805, test_loss: 0.8828, test_f1: 0.6191
 epoch: 83, train_loss: 0.7684, test_loss: 0.8822, test_f1: 0.5985
 epoch: 84, train_loss: 0.7529, test_loss: 0.8901, test_f1: 0.6174
 epoch: 85, train_loss: 0.7571, test_loss: 0.8816, test_f1: 0.6123
 epoch: 86, train_loss: 0.7685, test_loss: 0.8877, test_f1: 0.6296
 epoch: 87, train_loss: 0.7607, test_loss: 0.8752, test_f1: 0.5817
 epoch: 88, train_loss: 0.7461, test_loss: 0.9304, test_f1: 0.6276
 epoch: 89, train_loss: 0.7555, test_loss: 0.9410, test_f1: 0.6010
 epoch: 90, train_loss: 0.7557, test_loss: 0.8549, test_f1: 0.6455
 epoch: 91, train_loss: 0.7437, test_loss: 0.8648, test_f1: 0.6216
 epoch: 92, train_loss: 0.7530, test_loss: 0.9163, test_f1: 0.6061
 epoch: 93, train_loss: 0.7553, test_loss: 0.9802, test_f1: 0.5657
 epoch: 94, train_loss: 0.7615, test_loss: 0.8952, test_f1: 0.5761
 epoch: 95, train_loss: 0.7431, test_loss: 0.8826, test_f1: 0.6063
 epoch: 96, train_loss: 0.7492, test_loss: 0.8838, test_f1: 0.5862
 epoch: 97, train_loss: 0.7622, test_loss: 0.8884, test_f1: 0.5768
 epoch: 98, train_loss: 0.7407, test_loss: 0.8839, test_f1: 0.5943
 epoch: 99, train_loss: 0.7413, test_loss: 0.8799, test_f1: 0.6063
##################ITERATION #9 ****************************************
 epoch: 0, train_loss: 1.2538, test_loss: 1.1383, test_f1: 0.3551
 epoch: 1, train_loss: 1.0979, test_loss: 1.0172, test_f1: 0.4318
 epoch: 2, train_loss: 1.0372, test_loss: 1.1033, test_f1: 0.4424
 epoch: 3, train_loss: 0.9974, test_loss: 0.9960, test_f1: 0.5030
 epoch: 4, train_loss: 0.9955, test_loss: 0.9420, test_f1: 0.5138
 epoch: 5, train_loss: 0.9872, test_loss: 1.0422, test_f1: 0.4539
 epoch: 6, train_loss: 0.9963, test_loss: 0.9983, test_f1: 0.5055
 epoch: 7, train_loss: 0.9824, test_loss: 0.9634, test_f1: 0.5346
 epoch: 8, train_loss: 0.9618, test_loss: 0.9768, test_f1: 0.4810
 epoch: 9, train_loss: 0.9664, test_loss: 0.9952, test_f1: 0.4832
 epoch: 10, train_loss: 0.9609, test_loss: 0.9911, test_f1: 0.5019
 epoch: 11, train_loss: 0.9558, test_loss: 1.0261, test_f1: 0.4582
 epoch: 12, train_loss: 0.9410, test_loss: 0.9664, test_f1: 0.5250
 epoch: 13, train_loss: 0.9404, test_loss: 0.9799, test_f1: 0.4883
 epoch: 14, train_loss: 0.9322, test_loss: 1.0074, test_f1: 0.4682
 epoch: 15, train_loss: 0.9303, test_loss: 0.9931, test_f1: 0.4946
 epoch: 16, train_loss: 0.9454, test_loss: 0.9990, test_f1: 0.4914
 epoch: 17, train_loss: 0.9408, test_loss: 0.9541, test_f1: 0.5071
 epoch: 18, train_loss: 0.9200, test_loss: 1.0134, test_f1: 0.4515
 epoch: 19, train_loss: 0.9120, test_loss: 0.9893, test_f1: 0.5120
 epoch: 20, train_loss: 0.9250, test_loss: 0.9763, test_f1: 0.5450
 epoch: 21, train_loss: 0.9201, test_loss: 0.9882, test_f1: 0.5382
 epoch: 22, train_loss: 0.9206, test_loss: 0.9951, test_f1: 0.4893
 epoch: 23, train_loss: 0.9011, test_loss: 0.9218, test_f1: 0.4900
 epoch: 24, train_loss: 0.9239, test_loss: 0.9497, test_f1: 0.5255
 epoch: 25, train_loss: 0.9099, test_loss: 1.0038, test_f1: 0.4981
 epoch: 26, train_loss: 0.9056, test_loss: 1.0046, test_f1: 0.4982
 epoch: 27, train_loss: 0.8937, test_loss: 0.9778, test_f1: 0.5132
 epoch: 28, train_loss: 0.8950, test_loss: 0.9578, test_f1: 0.5741
 epoch: 29, train_loss: 0.8896, test_loss: 0.9735, test_f1: 0.5013
 epoch: 30, train_loss: 0.8832, test_loss: 0.9779, test_f1: 0.5374
 epoch: 31, train_loss: 0.8981, test_loss: 0.9469, test_f1: 0.4833
 epoch: 32, train_loss: 0.8880, test_loss: 0.9523, test_f1: 0.5702
 epoch: 33, train_loss: 0.8867, test_loss: 0.9734, test_f1: 0.5484
 epoch: 34, train_loss: 0.8935, test_loss: 0.9604, test_f1: 0.4979
 epoch: 35, train_loss: 0.9097, test_loss: 0.9828, test_f1: 0.4919
 epoch: 36, train_loss: 0.8825, test_loss: 0.9825, test_f1: 0.5015
 epoch: 37, train_loss: 0.8886, test_loss: 0.9949, test_f1: 0.4928
 epoch: 38, train_loss: 0.8901, test_loss: 0.9490, test_f1: 0.5307
 epoch: 39, train_loss: 0.8816, test_loss: 0.9928, test_f1: 0.5179
 epoch: 40, train_loss: 0.8797, test_loss: 0.9485, test_f1: 0.5451
 epoch: 41, train_loss: 0.8798, test_loss: 0.9271, test_f1: 0.5275
 epoch: 42, train_loss: 0.8746, test_loss: 0.9322, test_f1: 0.4988
 epoch: 43, train_loss: 0.8785, test_loss: 0.9592, test_f1: 0.5425
 epoch: 44, train_loss: 0.8617, test_loss: 0.9960, test_f1: 0.5429
 epoch: 45, train_loss: 0.8846, test_loss: 0.9498, test_f1: 0.5322
 epoch: 46, train_loss: 0.8685, test_loss: 0.9758, test_f1: 0.5393
 epoch: 47, train_loss: 0.8729, test_loss: 0.9644, test_f1: 0.5503
 epoch: 48, train_loss: 0.8695, test_loss: 1.0250, test_f1: 0.4890
 epoch: 49, train_loss: 0.8584, test_loss: 0.9388, test_f1: 0.5180
 epoch: 50, train_loss: 0.8723, test_loss: 0.9584, test_f1: 0.5508
 epoch: 51, train_loss: 0.8391, test_loss: 0.9306, test_f1: 0.5736
 epoch: 52, train_loss: 0.8412, test_loss: 0.9144, test_f1: 0.5621
 epoch: 53, train_loss: 0.8388, test_loss: 0.9504, test_f1: 0.5507
 epoch: 54, train_loss: 0.8286, test_loss: 0.9733, test_f1: 0.5718
 epoch: 55, train_loss: 0.8330, test_loss: 0.9664, test_f1: 0.5699
 epoch: 56, train_loss: 0.8322, test_loss: 0.9450, test_f1: 0.5556
 epoch: 57, train_loss: 0.8281, test_loss: 0.9512, test_f1: 0.5321
 epoch: 58, train_loss: 0.8263, test_loss: 0.9415, test_f1: 0.5599
 epoch: 59, train_loss: 0.8322, test_loss: 0.9428, test_f1: 0.5578
 epoch: 60, train_loss: 0.8277, test_loss: 0.9382, test_f1: 0.5719
 epoch: 61, train_loss: 0.8190, test_loss: 0.9272, test_f1: 0.5793
 epoch: 62, train_loss: 0.8232, test_loss: 0.9347, test_f1: 0.5771
 epoch: 63, train_loss: 0.8377, test_loss: 0.9357, test_f1: 0.5421
 epoch: 64, train_loss: 0.8386, test_loss: 0.9281, test_f1: 0.6008
 epoch: 65, train_loss: 0.8169, test_loss: 0.9437, test_f1: 0.5615
 epoch: 66, train_loss: 0.8301, test_loss: 0.9351, test_f1: 0.5965
 epoch: 67, train_loss: 0.8157, test_loss: 0.9380, test_f1: 0.6173
 epoch: 68, train_loss: 0.8055, test_loss: 0.9114, test_f1: 0.5785
 epoch: 69, train_loss: 0.8078, test_loss: 0.9252, test_f1: 0.6010
 epoch: 70, train_loss: 0.8116, test_loss: 0.9242, test_f1: 0.5963
 epoch: 71, train_loss: 0.7976, test_loss: 0.9117, test_f1: 0.6003
 epoch: 72, train_loss: 0.8014, test_loss: 0.9243, test_f1: 0.5834
 epoch: 73, train_loss: 0.8127, test_loss: 0.9114, test_f1: 0.5781
 epoch: 74, train_loss: 0.8029, test_loss: 0.9355, test_f1: 0.5774
 epoch: 75, train_loss: 0.8010, test_loss: 0.9384, test_f1: 0.5760
 epoch: 76, train_loss: 0.8051, test_loss: 0.9190, test_f1: 0.5950
 epoch: 77, train_loss: 0.8116, test_loss: 0.9353, test_f1: 0.5805
 epoch: 78, train_loss: 0.8059, test_loss: 0.9596, test_f1: 0.5449
 epoch: 79, train_loss: 0.7899, test_loss: 0.9215, test_f1: 0.5883
 epoch: 80, train_loss: 0.7838, test_loss: 0.9330, test_f1: 0.5870
 epoch: 81, train_loss: 0.7977, test_loss: 0.9403, test_f1: 0.5590
 epoch: 82, train_loss: 0.7871, test_loss: 0.9600, test_f1: 0.6104
 epoch: 83, train_loss: 0.7958, test_loss: 0.9109, test_f1: 0.6118
 epoch: 84, train_loss: 0.7924, test_loss: 0.9012, test_f1: 0.5735
 epoch: 85, train_loss: 0.7921, test_loss: 0.9111, test_f1: 0.5647
 epoch: 86, train_loss: 0.7979, test_loss: 0.9226, test_f1: 0.5903
 epoch: 87, train_loss: 0.7939, test_loss: 0.9055, test_f1: 0.6310
 epoch: 88, train_loss: 0.7757, test_loss: 0.9156, test_f1: 0.6398
 epoch: 89, train_loss: 0.7869, test_loss: 0.8912, test_f1: 0.6146
 epoch: 90, train_loss: 0.7803, test_loss: 0.8879, test_f1: 0.6240
 epoch: 91, train_loss: 0.7827, test_loss: 0.9388, test_f1: 0.6021
 epoch: 92, train_loss: 0.7812, test_loss: 0.9085, test_f1: 0.6109
 epoch: 93, train_loss: 0.7856, test_loss: 0.9232, test_f1: 0.6033
 epoch: 94, train_loss: 0.7878, test_loss: 0.9406, test_f1: 0.5725
 epoch: 95, train_loss: 0.7744, test_loss: 0.9187, test_f1: 0.6062
 epoch: 96, train_loss: 0.7774, test_loss: 0.9164, test_f1: 0.6019
 epoch: 97, train_loss: 0.7807, test_loss: 0.9283, test_f1: 0.6050
 epoch: 98, train_loss: 0.7738, test_loss: 0.9130, test_f1: 0.6196
 epoch: 99, train_loss: 0.7740, test_loss: 0.8956, test_f1: 0.6212

Training completed in 672.07 seconds
Best F1: 0.6492 at epoch 76
Mean F1 across iterations: 0.6201  0.0145
========================FINAL RESULTS================================
FEGIN weighted F1: 0.6492  0.0145
python main.py --data ltspice_examples --representation component_net --model FEGIN --layers 4 --hiddens 16 --batch_size 64 --lr 0.01 --emb_size 250 --epochs 100 --save_appendix component_net_L4_H16_BS64_LR0.01_E250 --no_val
-----



STDERR:
  File "main.py", line 370, in <module>
    main()
  File "main.py", line 254, in main
    dataset = dataset_class(
  File "/home/philip/projects/ltspice_examples_code_repo/Circuit-Completion-Using-GNNs/component_classification_with_link_prediction_head/evaluation/FEGIN/kernel/circuit_datasets.py", line 15, in __init__
    self.data, self.slices = torch.load(self.processed_paths[0])
  File "/home/philip/.local/lib/python3.8/site-packages/torch/serialization.py", line 1040, in load
    warnings.warn(
  File "/usr/lib/python3.8/warnings.py", line 109, in _showwarnmsg
    sw(msg.message, msg.category, msg.filename, msg.lineno,
  File "main.py", line 47, in warn_with_traceback
    traceback.print_stack(file=log)
/home/philip/projects/ltspice_examples_code_repo/Circuit-Completion-Using-GNNs/component_classification_with_link_prediction_head/evaluation/FEGIN/kernel/circuit_datasets.py:15: FutureWarning: You are using `torch.load` with `weights_only=False` (the current default value), which uses the default pickle module implicitly. It is possible to construct malicious pickle data which will execute arbitrary code during unpickling (See https://github.com/pytorch/pytorch/blob/main/SECURITY.md#untrusted-models for more details). In a future release, the default value for `weights_only` will be flipped to `True`. This limits the functions that could be executed during unpickling. Arbitrary objects will no longer be allowed to be loaded via this mode unless they are explicitly allowlisted by the user via `torch.serialization.add_safe_globals`. We recommend you start setting `weights_only=True` for any use case where you don't have full control of the loaded file. Please open an issue on GitHub for any issues related to this experimental feature.
  self.data, self.slices = torch.load(self.processed_paths[0])
