STDOUT:
Results will be saved in /home/philip/projects/ltspice_examples_code_repo/Circuit-Completion-Using-GNNs/component_classification_with_link_prediction_head/evaluation/FEGIN/results/model_FEGIN_dataset_ltspice_examples
Command line input: python main.py --data ltspice_examples --representation component_pin --model FEGIN --layers 3 --hiddens 128 --batch_size 128 --lr 0.001 --emb_size 250 --epochs 100 --save_appendix component_pin_L3_H128_BS128_LR0.001_E250 --no_val
 is saved.
-----
ltspice_examples - FEGIN
Using 3 layers, 128 hidden units, h = 2
Loading component_pin representation dataset
ENTERED
Training FEGIN on component_pin representation
Train: 3560, Test: 848
##################ITERATION #0 ****************************************
 epoch: 0, train_loss: 1.2417, test_loss: 1.2266, test_f1: 0.2260
 epoch: 1, train_loss: 1.0244, test_loss: 0.9984, test_f1: 0.4194
 epoch: 2, train_loss: 0.9318, test_loss: 0.9828, test_f1: 0.4653
 epoch: 3, train_loss: 0.8884, test_loss: 0.9022, test_f1: 0.5449
 epoch: 4, train_loss: 0.8413, test_loss: 0.9517, test_f1: 0.5129
 epoch: 5, train_loss: 0.8138, test_loss: 0.9125, test_f1: 0.5138
 epoch: 6, train_loss: 0.7972, test_loss: 1.0982, test_f1: 0.4797
 epoch: 7, train_loss: 0.7794, test_loss: 0.9227, test_f1: 0.5181
 epoch: 8, train_loss: 0.7502, test_loss: 0.8261, test_f1: 0.5464
 epoch: 9, train_loss: 0.7350, test_loss: 0.8951, test_f1: 0.5473
 epoch: 10, train_loss: 0.7274, test_loss: 0.9832, test_f1: 0.5047
 epoch: 11, train_loss: 0.6996, test_loss: 0.8267, test_f1: 0.5836
 epoch: 12, train_loss: 0.6845, test_loss: 0.8744, test_f1: 0.5497
 epoch: 13, train_loss: 0.6750, test_loss: 0.8442, test_f1: 0.5604
 epoch: 14, train_loss: 0.6743, test_loss: 0.8666, test_f1: 0.5730
 epoch: 15, train_loss: 0.6428, test_loss: 0.8753, test_f1: 0.5963
 epoch: 16, train_loss: 0.6429, test_loss: 0.8677, test_f1: 0.5974
 epoch: 17, train_loss: 0.6261, test_loss: 0.9855, test_f1: 0.5717
 epoch: 18, train_loss: 0.6150, test_loss: 0.9212, test_f1: 0.5804
 epoch: 19, train_loss: 0.6001, test_loss: 0.9766, test_f1: 0.5790
 epoch: 20, train_loss: 0.5730, test_loss: 0.8922, test_f1: 0.6308
 epoch: 21, train_loss: 0.5853, test_loss: 0.9495, test_f1: 0.5938
 epoch: 22, train_loss: 0.5792, test_loss: 0.9155, test_f1: 0.5895
 epoch: 23, train_loss: 0.5445, test_loss: 0.8783, test_f1: 0.6215
 epoch: 24, train_loss: 0.5407, test_loss: 1.0701, test_f1: 0.5625
 epoch: 25, train_loss: 0.5585, test_loss: 0.8447, test_f1: 0.6454
 epoch: 26, train_loss: 0.5313, test_loss: 0.8852, test_f1: 0.6397
 epoch: 27, train_loss: 0.5058, test_loss: 0.9666, test_f1: 0.6525
 epoch: 28, train_loss: 0.5047, test_loss: 1.0794, test_f1: 0.6290
 epoch: 29, train_loss: 0.5020, test_loss: 0.9465, test_f1: 0.6428
 epoch: 30, train_loss: 0.4710, test_loss: 0.9086, test_f1: 0.6382
 epoch: 31, train_loss: 0.4703, test_loss: 0.9894, test_f1: 0.6440
 epoch: 32, train_loss: 0.4627, test_loss: 0.8796, test_f1: 0.6448
 epoch: 33, train_loss: 0.4490, test_loss: 0.9463, test_f1: 0.6396
 epoch: 34, train_loss: 0.4398, test_loss: 1.1846, test_f1: 0.6109
 epoch: 35, train_loss: 0.4296, test_loss: 1.0529, test_f1: 0.6101
 epoch: 36, train_loss: 0.4220, test_loss: 1.0011, test_f1: 0.6158
 epoch: 37, train_loss: 0.4081, test_loss: 0.9530, test_f1: 0.6754
 epoch: 38, train_loss: 0.4033, test_loss: 0.9783, test_f1: 0.6098
 epoch: 39, train_loss: 0.4173, test_loss: 1.0164, test_f1: 0.6364
 epoch: 40, train_loss: 0.3920, test_loss: 1.0156, test_f1: 0.6339
 epoch: 41, train_loss: 0.4074, test_loss: 1.1603, test_f1: 0.6267
 epoch: 42, train_loss: 0.3839, test_loss: 0.9945, test_f1: 0.6050
 epoch: 43, train_loss: 0.3629, test_loss: 1.0294, test_f1: 0.6495
 epoch: 44, train_loss: 0.3603, test_loss: 1.1575, test_f1: 0.6270
 epoch: 45, train_loss: 0.3571, test_loss: 1.2600, test_f1: 0.6405
 epoch: 46, train_loss: 0.3362, test_loss: 1.1986, test_f1: 0.6289
 epoch: 47, train_loss: 0.3261, test_loss: 1.1224, test_f1: 0.6271
 epoch: 48, train_loss: 0.3289, test_loss: 1.0617, test_f1: 0.6540
 epoch: 49, train_loss: 0.3105, test_loss: 1.1544, test_f1: 0.6522
 epoch: 50, train_loss: 0.3437, test_loss: 1.0236, test_f1: 0.6577
 epoch: 51, train_loss: 0.2823, test_loss: 1.0889, test_f1: 0.6513
 epoch: 52, train_loss: 0.2494, test_loss: 1.1303, test_f1: 0.6632
 epoch: 53, train_loss: 0.2398, test_loss: 1.1520, test_f1: 0.6390
 epoch: 54, train_loss: 0.2312, test_loss: 1.1450, test_f1: 0.6822
 epoch: 55, train_loss: 0.2231, test_loss: 1.3259, test_f1: 0.6511
 epoch: 56, train_loss: 0.2238, test_loss: 1.3148, test_f1: 0.6518
 epoch: 57, train_loss: 0.1973, test_loss: 1.2193, test_f1: 0.6665
 epoch: 58, train_loss: 0.1901, test_loss: 1.3257, test_f1: 0.6713
 epoch: 59, train_loss: 0.2153, test_loss: 1.2859, test_f1: 0.6747
 epoch: 60, train_loss: 0.1968, test_loss: 1.4548, test_f1: 0.6498
 epoch: 61, train_loss: 0.1787, test_loss: 1.3449, test_f1: 0.6484
 epoch: 62, train_loss: 0.1875, test_loss: 1.3321, test_f1: 0.6378
 epoch: 63, train_loss: 0.1729, test_loss: 1.3679, test_f1: 0.6586
 epoch: 64, train_loss: 0.1731, test_loss: 1.4374, test_f1: 0.6472
 epoch: 65, train_loss: 0.1740, test_loss: 1.4879, test_f1: 0.6660
 epoch: 66, train_loss: 0.1686, test_loss: 1.5304, test_f1: 0.6505
 epoch: 67, train_loss: 0.1750, test_loss: 1.5380, test_f1: 0.6666
 epoch: 68, train_loss: 0.1740, test_loss: 1.5917, test_f1: 0.6247
 epoch: 69, train_loss: 0.1855, test_loss: 1.5883, test_f1: 0.6425
 epoch: 70, train_loss: 0.1792, test_loss: 1.5393, test_f1: 0.6353
 epoch: 71, train_loss: 0.1650, test_loss: 1.6956, test_f1: 0.6658
 epoch: 72, train_loss: 0.1622, test_loss: 1.5885, test_f1: 0.6387
 epoch: 73, train_loss: 0.1605, test_loss: 1.6439, test_f1: 0.6683
 epoch: 74, train_loss: 0.1346, test_loss: 1.5950, test_f1: 0.6688
 epoch: 75, train_loss: 0.1404, test_loss: 1.6257, test_f1: 0.6517
 epoch: 76, train_loss: 0.1329, test_loss: 1.7411, test_f1: 0.6517
 epoch: 77, train_loss: 0.1445, test_loss: 1.6923, test_f1: 0.6608
 epoch: 78, train_loss: 0.1413, test_loss: 1.7325, test_f1: 0.6728
 epoch: 79, train_loss: 0.1376, test_loss: 1.7387, test_f1: 0.6329
 epoch: 80, train_loss: 0.1448, test_loss: 1.9403, test_f1: 0.6420
 epoch: 81, train_loss: 0.1446, test_loss: 1.6847, test_f1: 0.6568
 epoch: 82, train_loss: 0.1311, test_loss: 1.8988, test_f1: 0.6502
 epoch: 83, train_loss: 0.1213, test_loss: 1.9175, test_f1: 0.6500
 epoch: 84, train_loss: 0.1402, test_loss: 1.8453, test_f1: 0.6669
 epoch: 85, train_loss: 0.1234, test_loss: 1.9598, test_f1: 0.6379
 epoch: 86, train_loss: 0.1263, test_loss: 2.0708, test_f1: 0.6287
 epoch: 87, train_loss: 0.1226, test_loss: 1.9174, test_f1: 0.6541
 epoch: 88, train_loss: 0.1256, test_loss: 1.8699, test_f1: 0.6244
 epoch: 89, train_loss: 0.1195, test_loss: 1.9024, test_f1: 0.6258
 epoch: 90, train_loss: 0.1094, test_loss: 1.9786, test_f1: 0.6342
 epoch: 91, train_loss: 0.1064, test_loss: 1.8209, test_f1: 0.6371
 epoch: 92, train_loss: 0.1156, test_loss: 2.1637, test_f1: 0.6375
 epoch: 93, train_loss: 0.1057, test_loss: 1.9969, test_f1: 0.6417
 epoch: 94, train_loss: 0.1204, test_loss: 2.4644, test_f1: 0.6426
 epoch: 95, train_loss: 0.1147, test_loss: 1.9810, test_f1: 0.6530
 epoch: 96, train_loss: 0.1044, test_loss: 1.9415, test_f1: 0.6494
 epoch: 97, train_loss: 0.0950, test_loss: 2.2208, test_f1: 0.6559
 epoch: 98, train_loss: 0.0885, test_loss: 2.1070, test_f1: 0.6337
 epoch: 99, train_loss: 0.0962, test_loss: 2.0773, test_f1: 0.6134
##################ITERATION #1 ****************************************
 epoch: 0, train_loss: 1.1083, test_loss: 1.1997, test_f1: 0.2383
 epoch: 1, train_loss: 0.9658, test_loss: 1.0539, test_f1: 0.4125
 epoch: 2, train_loss: 0.8900, test_loss: 0.9612, test_f1: 0.4651
 epoch: 3, train_loss: 0.8472, test_loss: 0.8139, test_f1: 0.5846
 epoch: 4, train_loss: 0.8236, test_loss: 0.9081, test_f1: 0.4664
 epoch: 5, train_loss: 0.7959, test_loss: 1.0191, test_f1: 0.5199
 epoch: 6, train_loss: 0.7578, test_loss: 0.8824, test_f1: 0.6002
 epoch: 7, train_loss: 0.7298, test_loss: 0.9286, test_f1: 0.5767
 epoch: 8, train_loss: 0.7147, test_loss: 1.0687, test_f1: 0.5646
 epoch: 9, train_loss: 0.7209, test_loss: 0.9041, test_f1: 0.5794
 epoch: 10, train_loss: 0.7009, test_loss: 0.8415, test_f1: 0.6361
 epoch: 11, train_loss: 0.6623, test_loss: 0.8506, test_f1: 0.6303
 epoch: 12, train_loss: 0.6367, test_loss: 1.0280, test_f1: 0.6119
 epoch: 13, train_loss: 0.6401, test_loss: 0.8622, test_f1: 0.6228
 epoch: 14, train_loss: 0.6330, test_loss: 1.0117, test_f1: 0.5443
 epoch: 15, train_loss: 0.6261, test_loss: 0.8201, test_f1: 0.6146
 epoch: 16, train_loss: 0.6062, test_loss: 0.9096, test_f1: 0.6288
 epoch: 17, train_loss: 0.5773, test_loss: 0.8695, test_f1: 0.6249
 epoch: 18, train_loss: 0.5658, test_loss: 0.7951, test_f1: 0.6475
 epoch: 19, train_loss: 0.5629, test_loss: 0.9167, test_f1: 0.6540
 epoch: 20, train_loss: 0.5308, test_loss: 0.9679, test_f1: 0.6327
 epoch: 21, train_loss: 0.5276, test_loss: 0.9221, test_f1: 0.6355
 epoch: 22, train_loss: 0.5203, test_loss: 0.9690, test_f1: 0.5952
 epoch: 23, train_loss: 0.5055, test_loss: 1.1142, test_f1: 0.5884
 epoch: 24, train_loss: 0.5013, test_loss: 0.9410, test_f1: 0.6672
 epoch: 25, train_loss: 0.4975, test_loss: 0.9702, test_f1: 0.6174
 epoch: 26, train_loss: 0.4823, test_loss: 1.1867, test_f1: 0.6356
 epoch: 27, train_loss: 0.4806, test_loss: 1.0151, test_f1: 0.6368
 epoch: 28, train_loss: 0.4543, test_loss: 1.0890, test_f1: 0.6125
 epoch: 29, train_loss: 0.4451, test_loss: 0.9088, test_f1: 0.6445
 epoch: 30, train_loss: 0.4482, test_loss: 1.1103, test_f1: 0.6129
 epoch: 31, train_loss: 0.4228, test_loss: 1.1334, test_f1: 0.6575
 epoch: 32, train_loss: 0.4163, test_loss: 1.0081, test_f1: 0.6682
 epoch: 33, train_loss: 0.4011, test_loss: 1.0916, test_f1: 0.6444
 epoch: 34, train_loss: 0.3970, test_loss: 1.2249, test_f1: 0.6043
 epoch: 35, train_loss: 0.3950, test_loss: 1.1924, test_f1: 0.6133
 epoch: 36, train_loss: 0.3523, test_loss: 1.2352, test_f1: 0.6248
 epoch: 37, train_loss: 0.3894, test_loss: 1.2945, test_f1: 0.6061
 epoch: 38, train_loss: 0.3750, test_loss: 1.1032, test_f1: 0.6336
 epoch: 39, train_loss: 0.3586, test_loss: 1.2615, test_f1: 0.6146
 epoch: 40, train_loss: 0.3415, test_loss: 1.3330, test_f1: 0.6424
 epoch: 41, train_loss: 0.3168, test_loss: 1.2061, test_f1: 0.6341
 epoch: 42, train_loss: 0.3347, test_loss: 1.1092, test_f1: 0.6777
 epoch: 43, train_loss: 0.3162, test_loss: 1.1486, test_f1: 0.6526
 epoch: 44, train_loss: 0.3216, test_loss: 1.4161, test_f1: 0.6419
 epoch: 45, train_loss: 0.3018, test_loss: 1.2695, test_f1: 0.6447
 epoch: 46, train_loss: 0.2883, test_loss: 1.2477, test_f1: 0.6304
 epoch: 47, train_loss: 0.3042, test_loss: 1.1972, test_f1: 0.6733
 epoch: 48, train_loss: 0.3194, test_loss: 1.4089, test_f1: 0.6135
 epoch: 49, train_loss: 0.2896, test_loss: 1.5091, test_f1: 0.6120
 epoch: 50, train_loss: 0.2746, test_loss: 1.4031, test_f1: 0.6266
 epoch: 51, train_loss: 0.2709, test_loss: 1.3675, test_f1: 0.6460
 epoch: 52, train_loss: 0.2121, test_loss: 1.4006, test_f1: 0.6640
 epoch: 53, train_loss: 0.2108, test_loss: 1.4366, test_f1: 0.6457
 epoch: 54, train_loss: 0.2018, test_loss: 1.4610, test_f1: 0.6319
 epoch: 55, train_loss: 0.1802, test_loss: 1.4868, test_f1: 0.6565
 epoch: 56, train_loss: 0.1959, test_loss: 1.6143, test_f1: 0.6545
 epoch: 57, train_loss: 0.1783, test_loss: 1.4894, test_f1: 0.6632
 epoch: 58, train_loss: 0.1725, test_loss: 1.5686, test_f1: 0.6633
 epoch: 59, train_loss: 0.1750, test_loss: 1.5587, test_f1: 0.6613
 epoch: 60, train_loss: 0.1821, test_loss: 1.6539, test_f1: 0.6320
 epoch: 61, train_loss: 0.1742, test_loss: 1.7019, test_f1: 0.6620
 epoch: 62, train_loss: 0.1571, test_loss: 1.7354, test_f1: 0.6455
 epoch: 63, train_loss: 0.1576, test_loss: 1.7458, test_f1: 0.6650
 epoch: 64, train_loss: 0.1704, test_loss: 1.6851, test_f1: 0.6702
 epoch: 65, train_loss: 0.1641, test_loss: 1.9561, test_f1: 0.6586
 epoch: 66, train_loss: 0.1632, test_loss: 1.7338, test_f1: 0.6723
 epoch: 67, train_loss: 0.1650, test_loss: 1.8265, test_f1: 0.6473
 epoch: 68, train_loss: 0.1432, test_loss: 1.8732, test_f1: 0.6436
 epoch: 69, train_loss: 0.1357, test_loss: 1.8990, test_f1: 0.6472
 epoch: 70, train_loss: 0.1407, test_loss: 1.6831, test_f1: 0.6456
 epoch: 71, train_loss: 0.1526, test_loss: 1.9596, test_f1: 0.6383
 epoch: 72, train_loss: 0.1409, test_loss: 1.7772, test_f1: 0.6556
 epoch: 73, train_loss: 0.1554, test_loss: 2.1436, test_f1: 0.6109
 epoch: 74, train_loss: 0.1479, test_loss: 1.9625, test_f1: 0.6608
 epoch: 75, train_loss: 0.1465, test_loss: 1.9096, test_f1: 0.6323
 epoch: 76, train_loss: 0.1579, test_loss: 1.9006, test_f1: 0.6388
 epoch: 77, train_loss: 0.1375, test_loss: 1.7433, test_f1: 0.6855
 epoch: 78, train_loss: 0.1311, test_loss: 1.9207, test_f1: 0.6436
 epoch: 79, train_loss: 0.1469, test_loss: 1.9564, test_f1: 0.6431
 epoch: 80, train_loss: 0.1308, test_loss: 1.9102, test_f1: 0.6310
 epoch: 81, train_loss: 0.1229, test_loss: 1.9371, test_f1: 0.6449
 epoch: 82, train_loss: 0.1278, test_loss: 1.9517, test_f1: 0.6537
 epoch: 83, train_loss: 0.1282, test_loss: 2.3839, test_f1: 0.6113
 epoch: 84, train_loss: 0.1304, test_loss: 2.0960, test_f1: 0.6633
 epoch: 85, train_loss: 0.1417, test_loss: 1.9121, test_f1: 0.6402
 epoch: 86, train_loss: 0.1336, test_loss: 1.9877, test_f1: 0.6543
 epoch: 87, train_loss: 0.1254, test_loss: 2.0710, test_f1: 0.6422
 epoch: 88, train_loss: 0.1319, test_loss: 2.0421, test_f1: 0.6650
 epoch: 89, train_loss: 0.1246, test_loss: 2.4103, test_f1: 0.6120
 epoch: 90, train_loss: 0.1175, test_loss: 2.4520, test_f1: 0.6159
 epoch: 91, train_loss: 0.1132, test_loss: 2.1835, test_f1: 0.6473
 epoch: 92, train_loss: 0.1035, test_loss: 2.0643, test_f1: 0.6481
 epoch: 93, train_loss: 0.1076, test_loss: 2.2190, test_f1: 0.6589
 epoch: 94, train_loss: 0.1015, test_loss: 2.3259, test_f1: 0.6389
 epoch: 95, train_loss: 0.0984, test_loss: 2.3788, test_f1: 0.6590
 epoch: 96, train_loss: 0.0934, test_loss: 2.3951, test_f1: 0.6477
 epoch: 97, train_loss: 0.1007, test_loss: 2.3565, test_f1: 0.6419
 epoch: 98, train_loss: 0.0962, test_loss: 2.5107, test_f1: 0.6290
 epoch: 99, train_loss: 0.0961, test_loss: 2.2622, test_f1: 0.6430
##################ITERATION #2 ****************************************
 epoch: 0, train_loss: 1.0935, test_loss: 1.3574, test_f1: 0.2260
 epoch: 1, train_loss: 0.9524, test_loss: 0.9900, test_f1: 0.4458
 epoch: 2, train_loss: 0.8934, test_loss: 0.9415, test_f1: 0.5542
 epoch: 3, train_loss: 0.8490, test_loss: 0.9112, test_f1: 0.5491
 epoch: 4, train_loss: 0.8238, test_loss: 0.9054, test_f1: 0.5877
 epoch: 5, train_loss: 0.7942, test_loss: 0.8733, test_f1: 0.5822
 epoch: 6, train_loss: 0.7697, test_loss: 0.8541, test_f1: 0.6037
 epoch: 7, train_loss: 0.7370, test_loss: 0.8793, test_f1: 0.5736
 epoch: 8, train_loss: 0.7346, test_loss: 0.9374, test_f1: 0.5863
 epoch: 9, train_loss: 0.7131, test_loss: 0.7756, test_f1: 0.5989
 epoch: 10, train_loss: 0.6986, test_loss: 0.8702, test_f1: 0.6004
 epoch: 11, train_loss: 0.6813, test_loss: 0.8515, test_f1: 0.6237
 epoch: 12, train_loss: 0.6630, test_loss: 0.8231, test_f1: 0.6550
 epoch: 13, train_loss: 0.6685, test_loss: 0.9026, test_f1: 0.6035
 epoch: 14, train_loss: 0.6582, test_loss: 0.8864, test_f1: 0.6356
 epoch: 15, train_loss: 0.6268, test_loss: 0.9079, test_f1: 0.6005
 epoch: 16, train_loss: 0.6281, test_loss: 0.8033, test_f1: 0.5924
 epoch: 17, train_loss: 0.6128, test_loss: 0.8900, test_f1: 0.5717
 epoch: 18, train_loss: 0.6046, test_loss: 0.8678, test_f1: 0.6110
 epoch: 19, train_loss: 0.5690, test_loss: 0.8567, test_f1: 0.6275
 epoch: 20, train_loss: 0.5584, test_loss: 0.7698, test_f1: 0.6215
 epoch: 21, train_loss: 0.5674, test_loss: 0.9025, test_f1: 0.5981
 epoch: 22, train_loss: 0.5610, test_loss: 0.8611, test_f1: 0.6291
 epoch: 23, train_loss: 0.5461, test_loss: 1.0266, test_f1: 0.5791
 epoch: 24, train_loss: 0.5168, test_loss: 0.9839, test_f1: 0.6081
 epoch: 25, train_loss: 0.5113, test_loss: 0.8508, test_f1: 0.6526
 epoch: 26, train_loss: 0.4872, test_loss: 0.7995, test_f1: 0.6735
 epoch: 27, train_loss: 0.4769, test_loss: 1.0706, test_f1: 0.6506
 epoch: 28, train_loss: 0.4706, test_loss: 0.8279, test_f1: 0.6924
 epoch: 29, train_loss: 0.4526, test_loss: 1.2653, test_f1: 0.5625
 epoch: 30, train_loss: 0.4535, test_loss: 0.9308, test_f1: 0.6444
 epoch: 31, train_loss: 0.4382, test_loss: 0.9385, test_f1: 0.6525
 epoch: 32, train_loss: 0.4298, test_loss: 0.8878, test_f1: 0.6630
 epoch: 33, train_loss: 0.4435, test_loss: 0.9720, test_f1: 0.6398
 epoch: 34, train_loss: 0.4083, test_loss: 0.9573, test_f1: 0.6606
 epoch: 35, train_loss: 0.4008, test_loss: 1.0861, test_f1: 0.6125
 epoch: 36, train_loss: 0.3861, test_loss: 0.9033, test_f1: 0.6739
 epoch: 37, train_loss: 0.3852, test_loss: 1.4101, test_f1: 0.5707
 epoch: 38, train_loss: 0.3855, test_loss: 0.9971, test_f1: 0.6165
 epoch: 39, train_loss: 0.3522, test_loss: 1.2985, test_f1: 0.6496
 epoch: 40, train_loss: 0.3463, test_loss: 1.2640, test_f1: 0.5912
 epoch: 41, train_loss: 0.3631, test_loss: 1.0715, test_f1: 0.6605
 epoch: 42, train_loss: 0.3835, test_loss: 1.1752, test_f1: 0.6481
 epoch: 43, train_loss: 0.3680, test_loss: 1.0092, test_f1: 0.6752
 epoch: 44, train_loss: 0.3245, test_loss: 1.1719, test_f1: 0.6348
 epoch: 45, train_loss: 0.3159, test_loss: 1.0526, test_f1: 0.6511
 epoch: 46, train_loss: 0.3224, test_loss: 1.1578, test_f1: 0.6839
 epoch: 47, train_loss: 0.3142, test_loss: 1.1868, test_f1: 0.6445
 epoch: 48, train_loss: 0.3109, test_loss: 1.1272, test_f1: 0.6415
 epoch: 49, train_loss: 0.2922, test_loss: 1.2554, test_f1: 0.6547
 epoch: 50, train_loss: 0.2880, test_loss: 1.2144, test_f1: 0.6599
 epoch: 51, train_loss: 0.2728, test_loss: 1.2490, test_f1: 0.6629
 epoch: 52, train_loss: 0.2238, test_loss: 1.2477, test_f1: 0.6601
 epoch: 53, train_loss: 0.2136, test_loss: 1.2262, test_f1: 0.6710
 epoch: 54, train_loss: 0.2102, test_loss: 1.3107, test_f1: 0.6723
 epoch: 55, train_loss: 0.1993, test_loss: 1.2509, test_f1: 0.6658
 epoch: 56, train_loss: 0.1924, test_loss: 1.4798, test_f1: 0.6253
 epoch: 57, train_loss: 0.1968, test_loss: 1.4140, test_f1: 0.6426
 epoch: 58, train_loss: 0.1828, test_loss: 1.5178, test_f1: 0.6397
 epoch: 59, train_loss: 0.1811, test_loss: 1.4437, test_f1: 0.6698
 epoch: 60, train_loss: 0.1905, test_loss: 1.5413, test_f1: 0.6543
 epoch: 61, train_loss: 0.1800, test_loss: 1.4846, test_f1: 0.6514
 epoch: 62, train_loss: 0.1744, test_loss: 1.4602, test_f1: 0.6666
 epoch: 63, train_loss: 0.1688, test_loss: 1.5763, test_f1: 0.6458
 epoch: 64, train_loss: 0.1847, test_loss: 1.5550, test_f1: 0.6544
 epoch: 65, train_loss: 0.1654, test_loss: 1.6044, test_f1: 0.6426
 epoch: 66, train_loss: 0.1654, test_loss: 1.5654, test_f1: 0.6743
 epoch: 67, train_loss: 0.1512, test_loss: 1.6036, test_f1: 0.6390
 epoch: 68, train_loss: 0.1559, test_loss: 1.6876, test_f1: 0.6108
 epoch: 69, train_loss: 0.1617, test_loss: 1.6916, test_f1: 0.6522
 epoch: 70, train_loss: 0.1606, test_loss: 1.7056, test_f1: 0.6409
 epoch: 71, train_loss: 0.1463, test_loss: 1.6106, test_f1: 0.6676
 epoch: 72, train_loss: 0.1580, test_loss: 1.5908, test_f1: 0.6338
 epoch: 73, train_loss: 0.1471, test_loss: 1.5881, test_f1: 0.6477
 epoch: 74, train_loss: 0.1443, test_loss: 1.5921, test_f1: 0.6487
 epoch: 75, train_loss: 0.1404, test_loss: 1.7089, test_f1: 0.6485
 epoch: 76, train_loss: 0.1299, test_loss: 1.8214, test_f1: 0.6413
 epoch: 77, train_loss: 0.1322, test_loss: 1.7843, test_f1: 0.6408
 epoch: 78, train_loss: 0.1279, test_loss: 1.8494, test_f1: 0.6335
 epoch: 79, train_loss: 0.1386, test_loss: 1.8430, test_f1: 0.6488
 epoch: 80, train_loss: 0.1332, test_loss: 2.0803, test_f1: 0.6319
 epoch: 81, train_loss: 0.1321, test_loss: 1.8842, test_f1: 0.6379
 epoch: 82, train_loss: 0.1329, test_loss: 1.8413, test_f1: 0.6523
 epoch: 83, train_loss: 0.1166, test_loss: 1.7939, test_f1: 0.6523
 epoch: 84, train_loss: 0.1192, test_loss: 1.8317, test_f1: 0.6529
 epoch: 85, train_loss: 0.1501, test_loss: 2.0901, test_f1: 0.6308
 epoch: 86, train_loss: 0.1310, test_loss: 1.9574, test_f1: 0.6464
 epoch: 87, train_loss: 0.1328, test_loss: 1.8344, test_f1: 0.6667
 epoch: 88, train_loss: 0.1154, test_loss: 1.8730, test_f1: 0.6535
 epoch: 89, train_loss: 0.1336, test_loss: 1.7827, test_f1: 0.6525
 epoch: 90, train_loss: 0.1277, test_loss: 1.8818, test_f1: 0.6280
 epoch: 91, train_loss: 0.1128, test_loss: 1.8122, test_f1: 0.6647
 epoch: 92, train_loss: 0.1144, test_loss: 1.9910, test_f1: 0.6401
 epoch: 93, train_loss: 0.1124, test_loss: 2.0848, test_f1: 0.6309
 epoch: 94, train_loss: 0.1069, test_loss: 1.9878, test_f1: 0.6455
 epoch: 95, train_loss: 0.1140, test_loss: 2.0284, test_f1: 0.6458
 epoch: 96, train_loss: 0.1138, test_loss: 1.9495, test_f1: 0.6445
 epoch: 97, train_loss: 0.1086, test_loss: 2.1418, test_f1: 0.6189
 epoch: 98, train_loss: 0.0982, test_loss: 2.0935, test_f1: 0.6406
 epoch: 99, train_loss: 0.1119, test_loss: 2.1592, test_f1: 0.6344
##################ITERATION #3 ****************************************
 epoch: 0, train_loss: 1.2398, test_loss: 1.2727, test_f1: 0.2776
 epoch: 1, train_loss: 1.0060, test_loss: 1.1032, test_f1: 0.3964
 epoch: 2, train_loss: 0.9116, test_loss: 0.8484, test_f1: 0.5521
 epoch: 3, train_loss: 0.8634, test_loss: 0.9982, test_f1: 0.5394
 epoch: 4, train_loss: 0.8542, test_loss: 0.9272, test_f1: 0.5403
 epoch: 5, train_loss: 0.8230, test_loss: 0.9384, test_f1: 0.5744
 epoch: 6, train_loss: 0.8046, test_loss: 0.7900, test_f1: 0.5992
 epoch: 7, train_loss: 0.7637, test_loss: 0.7930, test_f1: 0.5910
 epoch: 8, train_loss: 0.7459, test_loss: 0.8700, test_f1: 0.5755
 epoch: 9, train_loss: 0.7252, test_loss: 0.8365, test_f1: 0.6227
 epoch: 10, train_loss: 0.7247, test_loss: 0.8886, test_f1: 0.5858
 epoch: 11, train_loss: 0.7089, test_loss: 1.0057, test_f1: 0.6145
 epoch: 12, train_loss: 0.6818, test_loss: 0.8821, test_f1: 0.6263
 epoch: 13, train_loss: 0.6810, test_loss: 0.8327, test_f1: 0.6014
 epoch: 14, train_loss: 0.6938, test_loss: 0.7919, test_f1: 0.6290
 epoch: 15, train_loss: 0.6511, test_loss: 0.8346, test_f1: 0.6309
 epoch: 16, train_loss: 0.6513, test_loss: 0.7892, test_f1: 0.6381
 epoch: 17, train_loss: 0.6411, test_loss: 0.8988, test_f1: 0.6340
 epoch: 18, train_loss: 0.5895, test_loss: 0.9990, test_f1: 0.6103
 epoch: 19, train_loss: 0.5865, test_loss: 0.9527, test_f1: 0.5708
 epoch: 20, train_loss: 0.6000, test_loss: 0.8190, test_f1: 0.6632
 epoch: 21, train_loss: 0.5705, test_loss: 0.8078, test_f1: 0.6390
 epoch: 22, train_loss: 0.5691, test_loss: 0.8992, test_f1: 0.6471
 epoch: 23, train_loss: 0.5469, test_loss: 0.9045, test_f1: 0.6193
 epoch: 24, train_loss: 0.5493, test_loss: 0.8436, test_f1: 0.6532
 epoch: 25, train_loss: 0.5421, test_loss: 0.8768, test_f1: 0.6213
 epoch: 26, train_loss: 0.4984, test_loss: 0.9990, test_f1: 0.6018
 epoch: 27, train_loss: 0.4792, test_loss: 0.8728, test_f1: 0.6671
 epoch: 28, train_loss: 0.4913, test_loss: 0.9442, test_f1: 0.6188
 epoch: 29, train_loss: 0.4878, test_loss: 0.8875, test_f1: 0.6708
 epoch: 30, train_loss: 0.4584, test_loss: 0.9428, test_f1: 0.6294
 epoch: 31, train_loss: 0.4581, test_loss: 0.9289, test_f1: 0.6605
 epoch: 32, train_loss: 0.4467, test_loss: 0.8898, test_f1: 0.6420
 epoch: 33, train_loss: 0.4529, test_loss: 1.0442, test_f1: 0.6423
 epoch: 34, train_loss: 0.4457, test_loss: 1.0185, test_f1: 0.6221
 epoch: 35, train_loss: 0.4314, test_loss: 0.9273, test_f1: 0.6391
 epoch: 36, train_loss: 0.4049, test_loss: 1.0643, test_f1: 0.6544
 epoch: 37, train_loss: 0.3954, test_loss: 0.9243, test_f1: 0.6544
 epoch: 38, train_loss: 0.4023, test_loss: 1.1755, test_f1: 0.6366
 epoch: 39, train_loss: 0.3997, test_loss: 0.9814, test_f1: 0.6668
 epoch: 40, train_loss: 0.3711, test_loss: 1.0419, test_f1: 0.6376
 epoch: 41, train_loss: 0.3609, test_loss: 0.8701, test_f1: 0.6915
 epoch: 42, train_loss: 0.3784, test_loss: 1.0786, test_f1: 0.6481
 epoch: 43, train_loss: 0.3422, test_loss: 1.0687, test_f1: 0.6279
 epoch: 44, train_loss: 0.3723, test_loss: 0.8500, test_f1: 0.6648
 epoch: 45, train_loss: 0.3691, test_loss: 1.1091, test_f1: 0.6489
 epoch: 46, train_loss: 0.3513, test_loss: 0.8952, test_f1: 0.6860
 epoch: 47, train_loss: 0.3265, test_loss: 1.3725, test_f1: 0.6082
 epoch: 48, train_loss: 0.3121, test_loss: 1.1684, test_f1: 0.6520
 epoch: 49, train_loss: 0.3105, test_loss: 0.9468, test_f1: 0.6789
 epoch: 50, train_loss: 0.3105, test_loss: 1.1537, test_f1: 0.6233
 epoch: 51, train_loss: 0.2648, test_loss: 1.0848, test_f1: 0.6729
 epoch: 52, train_loss: 0.2384, test_loss: 1.1170, test_f1: 0.6595
 epoch: 53, train_loss: 0.2166, test_loss: 1.1606, test_f1: 0.6803
 epoch: 54, train_loss: 0.2297, test_loss: 1.1658, test_f1: 0.6722
 epoch: 55, train_loss: 0.2149, test_loss: 1.3047, test_f1: 0.6397
 epoch: 56, train_loss: 0.2067, test_loss: 1.2629, test_f1: 0.6583
 epoch: 57, train_loss: 0.2071, test_loss: 1.3002, test_f1: 0.6779
 epoch: 58, train_loss: 0.2069, test_loss: 1.2984, test_f1: 0.6818
 epoch: 59, train_loss: 0.2026, test_loss: 1.3649, test_f1: 0.6613
 epoch: 60, train_loss: 0.1934, test_loss: 1.3961, test_f1: 0.6542
 epoch: 61, train_loss: 0.1943, test_loss: 1.3010, test_f1: 0.6655
 epoch: 62, train_loss: 0.1980, test_loss: 1.4863, test_f1: 0.6605
 epoch: 63, train_loss: 0.1830, test_loss: 1.3114, test_f1: 0.6716
 epoch: 64, train_loss: 0.1867, test_loss: 1.4215, test_f1: 0.6877
 epoch: 65, train_loss: 0.1631, test_loss: 1.7224, test_f1: 0.6629
 epoch: 66, train_loss: 0.1786, test_loss: 1.4452, test_f1: 0.6470
 epoch: 67, train_loss: 0.1700, test_loss: 1.4834, test_f1: 0.6479
 epoch: 68, train_loss: 0.1752, test_loss: 1.5081, test_f1: 0.6710
 epoch: 69, train_loss: 0.1999, test_loss: 1.4199, test_f1: 0.6639
 epoch: 70, train_loss: 0.1890, test_loss: 1.5151, test_f1: 0.6668
 epoch: 71, train_loss: 0.1658, test_loss: 1.3674, test_f1: 0.6588
 epoch: 72, train_loss: 0.1696, test_loss: 1.5754, test_f1: 0.6451
 epoch: 73, train_loss: 0.1692, test_loss: 1.5921, test_f1: 0.6639
 epoch: 74, train_loss: 0.1615, test_loss: 1.4475, test_f1: 0.6816
 epoch: 75, train_loss: 0.1604, test_loss: 1.4263, test_f1: 0.6800
 epoch: 76, train_loss: 0.1526, test_loss: 1.5511, test_f1: 0.6381
 epoch: 77, train_loss: 0.1467, test_loss: 1.6847, test_f1: 0.6489
 epoch: 78, train_loss: 0.1719, test_loss: 1.6481, test_f1: 0.6554
 epoch: 79, train_loss: 0.1600, test_loss: 1.8240, test_f1: 0.6300
 epoch: 80, train_loss: 0.1624, test_loss: 1.6102, test_f1: 0.6712
 epoch: 81, train_loss: 0.1639, test_loss: 1.6555, test_f1: 0.6722
 epoch: 82, train_loss: 0.1250, test_loss: 1.5000, test_f1: 0.6506
 epoch: 83, train_loss: 0.1283, test_loss: 1.7508, test_f1: 0.6414
 epoch: 84, train_loss: 0.1517, test_loss: 1.5476, test_f1: 0.6756
 epoch: 85, train_loss: 0.1303, test_loss: 1.4768, test_f1: 0.7042
 epoch: 86, train_loss: 0.1475, test_loss: 1.7038, test_f1: 0.6484
 epoch: 87, train_loss: 0.1445, test_loss: 1.6132, test_f1: 0.6658
 epoch: 88, train_loss: 0.1314, test_loss: 1.7536, test_f1: 0.6568
 epoch: 89, train_loss: 0.1327, test_loss: 1.6839, test_f1: 0.6785
 epoch: 90, train_loss: 0.1335, test_loss: 1.5764, test_f1: 0.6871
 epoch: 91, train_loss: 0.1336, test_loss: 1.6331, test_f1: 0.6936
 epoch: 92, train_loss: 0.1263, test_loss: 1.6559, test_f1: 0.6715
 epoch: 93, train_loss: 0.1175, test_loss: 1.6118, test_f1: 0.6730
 epoch: 94, train_loss: 0.1201, test_loss: 1.7628, test_f1: 0.6801
 epoch: 95, train_loss: 0.1205, test_loss: 1.7694, test_f1: 0.6736
 epoch: 96, train_loss: 0.1355, test_loss: 1.6966, test_f1: 0.6667
 epoch: 97, train_loss: 0.1335, test_loss: 1.8403, test_f1: 0.6478
 epoch: 98, train_loss: 0.1105, test_loss: 1.8815, test_f1: 0.6475
 epoch: 99, train_loss: 0.1068, test_loss: 1.8689, test_f1: 0.6887
##################ITERATION #4 ****************************************
 epoch: 0, train_loss: 1.2731, test_loss: 1.2463, test_f1: 0.2936
 epoch: 1, train_loss: 1.0103, test_loss: 0.9703, test_f1: 0.4494
 epoch: 2, train_loss: 0.9281, test_loss: 0.9179, test_f1: 0.5867
 epoch: 3, train_loss: 0.8843, test_loss: 0.8748, test_f1: 0.5960
 epoch: 4, train_loss: 0.8518, test_loss: 0.8640, test_f1: 0.5833
 epoch: 5, train_loss: 0.8244, test_loss: 0.8009, test_f1: 0.6098
 epoch: 6, train_loss: 0.8154, test_loss: 0.9181, test_f1: 0.5908
 epoch: 7, train_loss: 0.7825, test_loss: 0.8989, test_f1: 0.5507
 epoch: 8, train_loss: 0.7634, test_loss: 0.7922, test_f1: 0.6213
 epoch: 9, train_loss: 0.7338, test_loss: 0.8172, test_f1: 0.6043
 epoch: 10, train_loss: 0.7169, test_loss: 0.8057, test_f1: 0.6161
 epoch: 11, train_loss: 0.7167, test_loss: 0.9330, test_f1: 0.5728
 epoch: 12, train_loss: 0.6766, test_loss: 0.7590, test_f1: 0.6513
 epoch: 13, train_loss: 0.6679, test_loss: 0.8424, test_f1: 0.6361
 epoch: 14, train_loss: 0.6495, test_loss: 0.8677, test_f1: 0.6318
 epoch: 15, train_loss: 0.6342, test_loss: 0.8294, test_f1: 0.6541
 epoch: 16, train_loss: 0.6222, test_loss: 0.8635, test_f1: 0.6204
 epoch: 17, train_loss: 0.6250, test_loss: 0.8199, test_f1: 0.6186
 epoch: 18, train_loss: 0.6162, test_loss: 0.9328, test_f1: 0.5937
 epoch: 19, train_loss: 0.6088, test_loss: 0.8570, test_f1: 0.6441
 epoch: 20, train_loss: 0.5747, test_loss: 0.8428, test_f1: 0.6269
 epoch: 21, train_loss: 0.5711, test_loss: 0.8971, test_f1: 0.5989
 epoch: 22, train_loss: 0.5526, test_loss: 0.7722, test_f1: 0.6633
 epoch: 23, train_loss: 0.5373, test_loss: 0.8060, test_f1: 0.6520
 epoch: 24, train_loss: 0.5427, test_loss: 0.7965, test_f1: 0.6463
 epoch: 25, train_loss: 0.5367, test_loss: 0.9696, test_f1: 0.6319
 epoch: 26, train_loss: 0.5089, test_loss: 0.9789, test_f1: 0.6376
 epoch: 27, train_loss: 0.4725, test_loss: 0.8524, test_f1: 0.6686
 epoch: 28, train_loss: 0.4766, test_loss: 0.9798, test_f1: 0.6176
 epoch: 29, train_loss: 0.4587, test_loss: 0.9831, test_f1: 0.6116
 epoch: 30, train_loss: 0.4696, test_loss: 0.8963, test_f1: 0.6817
 epoch: 31, train_loss: 0.4299, test_loss: 0.8932, test_f1: 0.6637
 epoch: 32, train_loss: 0.4164, test_loss: 0.9438, test_f1: 0.6502
 epoch: 33, train_loss: 0.4310, test_loss: 0.8703, test_f1: 0.6725
 epoch: 34, train_loss: 0.4250, test_loss: 0.9760, test_f1: 0.6483
 epoch: 35, train_loss: 0.4066, test_loss: 0.8999, test_f1: 0.6501
 epoch: 36, train_loss: 0.4112, test_loss: 0.9234, test_f1: 0.6407
 epoch: 37, train_loss: 0.4123, test_loss: 0.8266, test_f1: 0.6996
 epoch: 38, train_loss: 0.4013, test_loss: 1.1053, test_f1: 0.6508
 epoch: 39, train_loss: 0.3967, test_loss: 0.9643, test_f1: 0.6417
 epoch: 40, train_loss: 0.3753, test_loss: 1.1436, test_f1: 0.6375
 epoch: 41, train_loss: 0.3743, test_loss: 1.1226, test_f1: 0.6608
 epoch: 42, train_loss: 0.3624, test_loss: 1.0964, test_f1: 0.6328
 epoch: 43, train_loss: 0.3744, test_loss: 1.0047, test_f1: 0.6556
 epoch: 44, train_loss: 0.3443, test_loss: 0.9930, test_f1: 0.6801
 epoch: 45, train_loss: 0.3573, test_loss: 1.0895, test_f1: 0.6507
 epoch: 46, train_loss: 0.3490, test_loss: 0.9775, test_f1: 0.6503
 epoch: 47, train_loss: 0.3498, test_loss: 1.1195, test_f1: 0.6329
 epoch: 48, train_loss: 0.3309, test_loss: 1.1177, test_f1: 0.6413
 epoch: 49, train_loss: 0.3215, test_loss: 1.1943, test_f1: 0.6569
 epoch: 50, train_loss: 0.3158, test_loss: 1.1450, test_f1: 0.6768
 epoch: 51, train_loss: 0.2435, test_loss: 1.1382, test_f1: 0.6562
 epoch: 52, train_loss: 0.2477, test_loss: 1.0824, test_f1: 0.6974
 epoch: 53, train_loss: 0.2243, test_loss: 1.1600, test_f1: 0.6713
 epoch: 54, train_loss: 0.2193, test_loss: 1.1376, test_f1: 0.6810
 epoch: 55, train_loss: 0.2188, test_loss: 1.1986, test_f1: 0.6726
 epoch: 56, train_loss: 0.2266, test_loss: 1.2171, test_f1: 0.6764
 epoch: 57, train_loss: 0.2054, test_loss: 1.2132, test_f1: 0.6610
 epoch: 58, train_loss: 0.2069, test_loss: 1.1844, test_f1: 0.6974
 epoch: 59, train_loss: 0.1920, test_loss: 1.2779, test_f1: 0.6618
 epoch: 60, train_loss: 0.2035, test_loss: 1.2855, test_f1: 0.6789
 epoch: 61, train_loss: 0.2040, test_loss: 1.3991, test_f1: 0.6683
 epoch: 62, train_loss: 0.1867, test_loss: 1.3431, test_f1: 0.6606
 epoch: 63, train_loss: 0.1816, test_loss: 1.3396, test_f1: 0.6341
 epoch: 64, train_loss: 0.1866, test_loss: 1.3295, test_f1: 0.7000
 epoch: 65, train_loss: 0.1711, test_loss: 1.3809, test_f1: 0.6569
 epoch: 66, train_loss: 0.1747, test_loss: 1.3584, test_f1: 0.6948
 epoch: 67, train_loss: 0.1785, test_loss: 1.4955, test_f1: 0.6736
 epoch: 68, train_loss: 0.1883, test_loss: 1.5581, test_f1: 0.6558
 epoch: 69, train_loss: 0.1837, test_loss: 1.3351, test_f1: 0.6646
 epoch: 70, train_loss: 0.1638, test_loss: 1.4914, test_f1: 0.6684
 epoch: 71, train_loss: 0.1735, test_loss: 1.3501, test_f1: 0.6852
 epoch: 72, train_loss: 0.1820, test_loss: 1.6376, test_f1: 0.6266
 epoch: 73, train_loss: 0.1734, test_loss: 1.5486, test_f1: 0.6440
 epoch: 74, train_loss: 0.1722, test_loss: 1.4967, test_f1: 0.6636
 epoch: 75, train_loss: 0.1789, test_loss: 1.4440, test_f1: 0.6867
 epoch: 76, train_loss: 0.1502, test_loss: 1.4720, test_f1: 0.6548
 epoch: 77, train_loss: 0.1528, test_loss: 1.4673, test_f1: 0.6768
 epoch: 78, train_loss: 0.1411, test_loss: 1.6631, test_f1: 0.6431
 epoch: 79, train_loss: 0.1475, test_loss: 1.4851, test_f1: 0.6630
 epoch: 80, train_loss: 0.1636, test_loss: 1.6726, test_f1: 0.6394
 epoch: 81, train_loss: 0.1601, test_loss: 1.6027, test_f1: 0.6378
 epoch: 82, train_loss: 0.1485, test_loss: 1.5624, test_f1: 0.6798
 epoch: 83, train_loss: 0.1368, test_loss: 1.5371, test_f1: 0.6876
 epoch: 84, train_loss: 0.1369, test_loss: 1.5448, test_f1: 0.6854
 epoch: 85, train_loss: 0.1322, test_loss: 1.7681, test_f1: 0.6588
 epoch: 86, train_loss: 0.1344, test_loss: 1.8070, test_f1: 0.6485
 epoch: 87, train_loss: 0.1243, test_loss: 1.6875, test_f1: 0.6615
 epoch: 88, train_loss: 0.1416, test_loss: 1.5959, test_f1: 0.6717
 epoch: 89, train_loss: 0.1497, test_loss: 1.6460, test_f1: 0.6573
 epoch: 90, train_loss: 0.1416, test_loss: 1.6758, test_f1: 0.6774
 epoch: 91, train_loss: 0.1453, test_loss: 1.6564, test_f1: 0.6795
 epoch: 92, train_loss: 0.1398, test_loss: 1.6732, test_f1: 0.6491
 epoch: 93, train_loss: 0.1401, test_loss: 1.6522, test_f1: 0.6245
 epoch: 94, train_loss: 0.1569, test_loss: 1.6741, test_f1: 0.6537
 epoch: 95, train_loss: 0.1366, test_loss: 1.7724, test_f1: 0.6762
 epoch: 96, train_loss: 0.1270, test_loss: 1.6284, test_f1: 0.6605
 epoch: 97, train_loss: 0.1220, test_loss: 1.7702, test_f1: 0.6283
 epoch: 98, train_loss: 0.1242, test_loss: 1.6964, test_f1: 0.6523
 epoch: 99, train_loss: 0.1088, test_loss: 1.8961, test_f1: 0.6614
##################ITERATION #5 ****************************************
 epoch: 0, train_loss: 1.2926, test_loss: 1.4223, test_f1: 0.2586
 epoch: 1, train_loss: 0.9863, test_loss: 1.2009, test_f1: 0.3758
 epoch: 2, train_loss: 0.9245, test_loss: 0.9981, test_f1: 0.5255
 epoch: 3, train_loss: 0.8783, test_loss: 0.9192, test_f1: 0.5371
 epoch: 4, train_loss: 0.8406, test_loss: 0.8758, test_f1: 0.6136
 epoch: 5, train_loss: 0.8027, test_loss: 0.9220, test_f1: 0.5765
 epoch: 6, train_loss: 0.7825, test_loss: 0.8941, test_f1: 0.5607
 epoch: 7, train_loss: 0.7576, test_loss: 0.8360, test_f1: 0.6378
 epoch: 8, train_loss: 0.7291, test_loss: 0.8391, test_f1: 0.5871
 epoch: 9, train_loss: 0.7328, test_loss: 0.9014, test_f1: 0.5973
 epoch: 10, train_loss: 0.6963, test_loss: 0.9000, test_f1: 0.5912
 epoch: 11, train_loss: 0.7041, test_loss: 0.9406, test_f1: 0.5818
 epoch: 12, train_loss: 0.6804, test_loss: 0.8219, test_f1: 0.6349
 epoch: 13, train_loss: 0.6514, test_loss: 0.9006, test_f1: 0.5945
 epoch: 14, train_loss: 0.6485, test_loss: 0.8311, test_f1: 0.6461
 epoch: 15, train_loss: 0.6365, test_loss: 0.9184, test_f1: 0.6131
 epoch: 16, train_loss: 0.5847, test_loss: 0.8745, test_f1: 0.6400
 epoch: 17, train_loss: 0.5915, test_loss: 0.8050, test_f1: 0.6441
 epoch: 18, train_loss: 0.5829, test_loss: 0.8475, test_f1: 0.6106
 epoch: 19, train_loss: 0.5887, test_loss: 0.8347, test_f1: 0.6185
 epoch: 20, train_loss: 0.5682, test_loss: 0.9313, test_f1: 0.6071
 epoch: 21, train_loss: 0.5178, test_loss: 0.8045, test_f1: 0.6306
 epoch: 22, train_loss: 0.5317, test_loss: 0.8898, test_f1: 0.5918
 epoch: 23, train_loss: 0.5222, test_loss: 0.8547, test_f1: 0.6323
 epoch: 24, train_loss: 0.5049, test_loss: 1.0371, test_f1: 0.6109
 epoch: 25, train_loss: 0.4977, test_loss: 0.7855, test_f1: 0.6723
 epoch: 26, train_loss: 0.5074, test_loss: 0.8987, test_f1: 0.6323
 epoch: 27, train_loss: 0.4850, test_loss: 0.8516, test_f1: 0.6510
 epoch: 28, train_loss: 0.4550, test_loss: 0.7977, test_f1: 0.6656
 epoch: 29, train_loss: 0.4642, test_loss: 0.9407, test_f1: 0.5915
 epoch: 30, train_loss: 0.4393, test_loss: 1.0072, test_f1: 0.6366
 epoch: 31, train_loss: 0.4399, test_loss: 0.8612, test_f1: 0.6478
 epoch: 32, train_loss: 0.4475, test_loss: 0.8417, test_f1: 0.6701
 epoch: 33, train_loss: 0.4089, test_loss: 0.7823, test_f1: 0.6881
 epoch: 34, train_loss: 0.3929, test_loss: 0.8762, test_f1: 0.6626
 epoch: 35, train_loss: 0.3739, test_loss: 1.0837, test_f1: 0.6174
 epoch: 36, train_loss: 0.4062, test_loss: 1.0375, test_f1: 0.6429
 epoch: 37, train_loss: 0.3900, test_loss: 1.0402, test_f1: 0.6374
 epoch: 38, train_loss: 0.3948, test_loss: 1.0558, test_f1: 0.6453
 epoch: 39, train_loss: 0.3641, test_loss: 0.9258, test_f1: 0.6822
 epoch: 40, train_loss: 0.3750, test_loss: 1.0661, test_f1: 0.6342
 epoch: 41, train_loss: 0.3527, test_loss: 1.2213, test_f1: 0.5875
 epoch: 42, train_loss: 0.3391, test_loss: 0.9607, test_f1: 0.6831
 epoch: 43, train_loss: 0.3321, test_loss: 1.2058, test_f1: 0.6164
 epoch: 44, train_loss: 0.3288, test_loss: 1.1148, test_f1: 0.6501
 epoch: 45, train_loss: 0.3166, test_loss: 1.0446, test_f1: 0.6528
 epoch: 46, train_loss: 0.3190, test_loss: 1.1371, test_f1: 0.6531
 epoch: 47, train_loss: 0.3270, test_loss: 1.0815, test_f1: 0.6810
 epoch: 48, train_loss: 0.2972, test_loss: 1.0587, test_f1: 0.6656
 epoch: 49, train_loss: 0.3079, test_loss: 1.0820, test_f1: 0.6492
 epoch: 50, train_loss: 0.2710, test_loss: 1.1695, test_f1: 0.6663
 epoch: 51, train_loss: 0.2415, test_loss: 1.1763, test_f1: 0.6680
 epoch: 52, train_loss: 0.2256, test_loss: 1.1659, test_f1: 0.6783
 epoch: 53, train_loss: 0.2017, test_loss: 1.2805, test_f1: 0.6538
 epoch: 54, train_loss: 0.2104, test_loss: 1.1874, test_f1: 0.6991
 epoch: 55, train_loss: 0.2039, test_loss: 1.2489, test_f1: 0.6687
 epoch: 56, train_loss: 0.2005, test_loss: 1.3406, test_f1: 0.6501
 epoch: 57, train_loss: 0.1989, test_loss: 1.2514, test_f1: 0.6863
 epoch: 58, train_loss: 0.1926, test_loss: 1.2927, test_f1: 0.6505
 epoch: 59, train_loss: 0.1835, test_loss: 1.3024, test_f1: 0.6472
 epoch: 60, train_loss: 0.1673, test_loss: 1.3865, test_f1: 0.6571
 epoch: 61, train_loss: 0.1816, test_loss: 1.4266, test_f1: 0.6303
 epoch: 62, train_loss: 0.1761, test_loss: 1.4989, test_f1: 0.6358
 epoch: 63, train_loss: 0.1750, test_loss: 1.4124, test_f1: 0.6720
 epoch: 64, train_loss: 0.1782, test_loss: 1.3973, test_f1: 0.6551
 epoch: 65, train_loss: 0.1863, test_loss: 1.5348, test_f1: 0.6375
 epoch: 66, train_loss: 0.1715, test_loss: 1.5118, test_f1: 0.6660
 epoch: 67, train_loss: 0.1664, test_loss: 1.5672, test_f1: 0.6497
 epoch: 68, train_loss: 0.1729, test_loss: 1.4992, test_f1: 0.6722
 epoch: 69, train_loss: 0.1483, test_loss: 1.4748, test_f1: 0.6482
 epoch: 70, train_loss: 0.1590, test_loss: 1.6511, test_f1: 0.6248
 epoch: 71, train_loss: 0.1649, test_loss: 1.6082, test_f1: 0.6525
 epoch: 72, train_loss: 0.1755, test_loss: 1.4641, test_f1: 0.6348
 epoch: 73, train_loss: 0.1483, test_loss: 1.5618, test_f1: 0.6470
 epoch: 74, train_loss: 0.1464, test_loss: 1.5273, test_f1: 0.6724
 epoch: 75, train_loss: 0.1482, test_loss: 1.6070, test_f1: 0.6225
 epoch: 76, train_loss: 0.1603, test_loss: 1.5885, test_f1: 0.6614
 epoch: 77, train_loss: 0.1618, test_loss: 1.5741, test_f1: 0.6569
 epoch: 78, train_loss: 0.1609, test_loss: 1.5344, test_f1: 0.6563
 epoch: 79, train_loss: 0.1353, test_loss: 1.6815, test_f1: 0.6558
 epoch: 80, train_loss: 0.1561, test_loss: 1.7472, test_f1: 0.6708
 epoch: 81, train_loss: 0.1459, test_loss: 1.7298, test_f1: 0.6367
 epoch: 82, train_loss: 0.1379, test_loss: 1.4925, test_f1: 0.6846
 epoch: 83, train_loss: 0.1434, test_loss: 1.7134, test_f1: 0.6573
 epoch: 84, train_loss: 0.1209, test_loss: 1.7520, test_f1: 0.6505
 epoch: 85, train_loss: 0.1243, test_loss: 1.7837, test_f1: 0.6351
 epoch: 86, train_loss: 0.1437, test_loss: 1.8847, test_f1: 0.6199
 epoch: 87, train_loss: 0.1340, test_loss: 1.6888, test_f1: 0.6710
 epoch: 88, train_loss: 0.1254, test_loss: 1.6916, test_f1: 0.6556
 epoch: 89, train_loss: 0.1298, test_loss: 2.0091, test_f1: 0.5827
 epoch: 90, train_loss: 0.1247, test_loss: 1.7509, test_f1: 0.6573
 epoch: 91, train_loss: 0.1252, test_loss: 1.7357, test_f1: 0.6629
 epoch: 92, train_loss: 0.1376, test_loss: 1.7691, test_f1: 0.6587
 epoch: 93, train_loss: 0.1169, test_loss: 1.7854, test_f1: 0.6796
 epoch: 94, train_loss: 0.1175, test_loss: 1.8465, test_f1: 0.6681
 epoch: 95, train_loss: 0.1225, test_loss: 1.9735, test_f1: 0.6414
 epoch: 96, train_loss: 0.1194, test_loss: 1.9346, test_f1: 0.6451
 epoch: 97, train_loss: 0.1126, test_loss: 1.8672, test_f1: 0.6433
 epoch: 98, train_loss: 0.1085, test_loss: 1.9054, test_f1: 0.6330
 epoch: 99, train_loss: 0.0962, test_loss: 1.8631, test_f1: 0.6419
##################ITERATION #6 ****************************************
 epoch: 0, train_loss: 1.3824, test_loss: 1.2272, test_f1: 0.2570
 epoch: 1, train_loss: 1.0177, test_loss: 0.9796, test_f1: 0.4605
 epoch: 2, train_loss: 0.9545, test_loss: 0.9530, test_f1: 0.5071
 epoch: 3, train_loss: 0.9013, test_loss: 0.9238, test_f1: 0.5587
 epoch: 4, train_loss: 0.8648, test_loss: 0.9114, test_f1: 0.5646
 epoch: 5, train_loss: 0.8375, test_loss: 0.9525, test_f1: 0.5898
 epoch: 6, train_loss: 0.7979, test_loss: 0.8628, test_f1: 0.6021
 epoch: 7, train_loss: 0.7877, test_loss: 0.9657, test_f1: 0.5719
 epoch: 8, train_loss: 0.7731, test_loss: 0.8806, test_f1: 0.5713
 epoch: 9, train_loss: 0.7462, test_loss: 0.8746, test_f1: 0.5652
 epoch: 10, train_loss: 0.7466, test_loss: 0.7922, test_f1: 0.6157
 epoch: 11, train_loss: 0.7258, test_loss: 0.8620, test_f1: 0.5905
 epoch: 12, train_loss: 0.6824, test_loss: 0.8925, test_f1: 0.5859
 epoch: 13, train_loss: 0.6644, test_loss: 0.8303, test_f1: 0.6200
 epoch: 14, train_loss: 0.6633, test_loss: 0.8081, test_f1: 0.6118
 epoch: 15, train_loss: 0.6444, test_loss: 0.8536, test_f1: 0.6210
 epoch: 16, train_loss: 0.6326, test_loss: 0.8430, test_f1: 0.6260
 epoch: 17, train_loss: 0.6257, test_loss: 0.8942, test_f1: 0.6124
 epoch: 18, train_loss: 0.5884, test_loss: 1.0654, test_f1: 0.5701
 epoch: 19, train_loss: 0.5844, test_loss: 0.7874, test_f1: 0.6227
 epoch: 20, train_loss: 0.5863, test_loss: 0.8299, test_f1: 0.6178
 epoch: 21, train_loss: 0.5664, test_loss: 0.9325, test_f1: 0.6210
 epoch: 22, train_loss: 0.5617, test_loss: 0.9149, test_f1: 0.6129
 epoch: 23, train_loss: 0.5420, test_loss: 0.9041, test_f1: 0.6104
 epoch: 24, train_loss: 0.5244, test_loss: 0.8913, test_f1: 0.6539
 epoch: 25, train_loss: 0.5167, test_loss: 0.9375, test_f1: 0.6420
 epoch: 26, train_loss: 0.5083, test_loss: 0.8868, test_f1: 0.6293
 epoch: 27, train_loss: 0.4908, test_loss: 0.8989, test_f1: 0.6470
 epoch: 28, train_loss: 0.4780, test_loss: 1.0344, test_f1: 0.6207
 epoch: 29, train_loss: 0.4755, test_loss: 0.8207, test_f1: 0.6494
 epoch: 30, train_loss: 0.4890, test_loss: 0.9996, test_f1: 0.6110
 epoch: 31, train_loss: 0.4461, test_loss: 1.0223, test_f1: 0.6376
 epoch: 32, train_loss: 0.4345, test_loss: 1.0579, test_f1: 0.6234
 epoch: 33, train_loss: 0.4391, test_loss: 1.0058, test_f1: 0.6363
 epoch: 34, train_loss: 0.4175, test_loss: 0.9729, test_f1: 0.6452
 epoch: 35, train_loss: 0.4057, test_loss: 1.0698, test_f1: 0.5999
 epoch: 36, train_loss: 0.4062, test_loss: 1.1115, test_f1: 0.6008
 epoch: 37, train_loss: 0.3945, test_loss: 0.9644, test_f1: 0.6285
 epoch: 38, train_loss: 0.3727, test_loss: 1.0014, test_f1: 0.6497
 epoch: 39, train_loss: 0.3695, test_loss: 1.0151, test_f1: 0.6468
 epoch: 40, train_loss: 0.3718, test_loss: 0.9884, test_f1: 0.6507
 epoch: 41, train_loss: 0.3460, test_loss: 1.0619, test_f1: 0.6496
 epoch: 42, train_loss: 0.3363, test_loss: 1.1011, test_f1: 0.6535
 epoch: 43, train_loss: 0.3405, test_loss: 1.1970, test_f1: 0.6324
 epoch: 44, train_loss: 0.3562, test_loss: 1.2845, test_f1: 0.6195
 epoch: 45, train_loss: 0.3334, test_loss: 1.0943, test_f1: 0.6379
 epoch: 46, train_loss: 0.3280, test_loss: 1.0724, test_f1: 0.6503
 epoch: 47, train_loss: 0.3403, test_loss: 1.2168, test_f1: 0.6501
 epoch: 48, train_loss: 0.3244, test_loss: 1.2118, test_f1: 0.6271
 epoch: 49, train_loss: 0.3155, test_loss: 1.2287, test_f1: 0.6478
 epoch: 50, train_loss: 0.2845, test_loss: 1.1609, test_f1: 0.6386
 epoch: 51, train_loss: 0.2615, test_loss: 1.2105, test_f1: 0.6586
 epoch: 52, train_loss: 0.2369, test_loss: 1.2048, test_f1: 0.6629
 epoch: 53, train_loss: 0.2234, test_loss: 1.2850, test_f1: 0.6545
 epoch: 54, train_loss: 0.2241, test_loss: 1.2386, test_f1: 0.6662
 epoch: 55, train_loss: 0.2251, test_loss: 1.2756, test_f1: 0.6615
 epoch: 56, train_loss: 0.2119, test_loss: 1.1857, test_f1: 0.6687
 epoch: 57, train_loss: 0.2098, test_loss: 1.3295, test_f1: 0.6517
 epoch: 58, train_loss: 0.1989, test_loss: 1.3237, test_f1: 0.6656
 epoch: 59, train_loss: 0.1953, test_loss: 1.3386, test_f1: 0.6648
 epoch: 60, train_loss: 0.1856, test_loss: 1.4544, test_f1: 0.6585
 epoch: 61, train_loss: 0.2069, test_loss: 1.2754, test_f1: 0.6535
 epoch: 62, train_loss: 0.1852, test_loss: 1.4766, test_f1: 0.6582
 epoch: 63, train_loss: 0.1824, test_loss: 1.4043, test_f1: 0.6887
 epoch: 64, train_loss: 0.1696, test_loss: 1.4168, test_f1: 0.7098
 epoch: 65, train_loss: 0.1710, test_loss: 1.3829, test_f1: 0.6888
 epoch: 66, train_loss: 0.1727, test_loss: 1.4424, test_f1: 0.6522
 epoch: 67, train_loss: 0.1835, test_loss: 1.5733, test_f1: 0.6409
 epoch: 68, train_loss: 0.1662, test_loss: 1.4792, test_f1: 0.6823
 epoch: 69, train_loss: 0.1791, test_loss: 1.4172, test_f1: 0.6746
 epoch: 70, train_loss: 0.1862, test_loss: 1.5083, test_f1: 0.6568
 epoch: 71, train_loss: 0.1693, test_loss: 1.4920, test_f1: 0.6792
 epoch: 72, train_loss: 0.1520, test_loss: 1.4544, test_f1: 0.6670
 epoch: 73, train_loss: 0.1467, test_loss: 1.5224, test_f1: 0.6535
 epoch: 74, train_loss: 0.1492, test_loss: 1.4995, test_f1: 0.6876
 epoch: 75, train_loss: 0.1398, test_loss: 1.5568, test_f1: 0.6621
 epoch: 76, train_loss: 0.1523, test_loss: 1.5535, test_f1: 0.6617
 epoch: 77, train_loss: 0.1669, test_loss: 1.5177, test_f1: 0.6612
 epoch: 78, train_loss: 0.1419, test_loss: 1.6624, test_f1: 0.6679
 epoch: 79, train_loss: 0.1536, test_loss: 1.5905, test_f1: 0.6468
 epoch: 80, train_loss: 0.1341, test_loss: 1.5982, test_f1: 0.6587
 epoch: 81, train_loss: 0.1471, test_loss: 1.7561, test_f1: 0.6154
 epoch: 82, train_loss: 0.1355, test_loss: 1.6281, test_f1: 0.6645
 epoch: 83, train_loss: 0.1354, test_loss: 1.8133, test_f1: 0.6566
 epoch: 84, train_loss: 0.1486, test_loss: 1.8168, test_f1: 0.6213
 epoch: 85, train_loss: 0.1272, test_loss: 1.5792, test_f1: 0.6803
 epoch: 86, train_loss: 0.1267, test_loss: 1.6625, test_f1: 0.6654
 epoch: 87, train_loss: 0.1240, test_loss: 1.7777, test_f1: 0.6572
 epoch: 88, train_loss: 0.1274, test_loss: 1.6893, test_f1: 0.6633
 epoch: 89, train_loss: 0.1244, test_loss: 1.7400, test_f1: 0.6802
 epoch: 90, train_loss: 0.1133, test_loss: 1.7868, test_f1: 0.6775
 epoch: 91, train_loss: 0.1237, test_loss: 1.8179, test_f1: 0.6645
 epoch: 92, train_loss: 0.1277, test_loss: 1.6911, test_f1: 0.6731
 epoch: 93, train_loss: 0.1109, test_loss: 1.8037, test_f1: 0.6632
 epoch: 94, train_loss: 0.1311, test_loss: 2.1163, test_f1: 0.6629
 epoch: 95, train_loss: 0.1494, test_loss: 1.7377, test_f1: 0.6685
 epoch: 96, train_loss: 0.1292, test_loss: 1.8338, test_f1: 0.6368
 epoch: 97, train_loss: 0.1198, test_loss: 1.8455, test_f1: 0.6477
 epoch: 98, train_loss: 0.1265, test_loss: 1.8618, test_f1: 0.6635
 epoch: 99, train_loss: 0.1285, test_loss: 1.8481, test_f1: 0.6573
##################ITERATION #7 ****************************************
 epoch: 0, train_loss: 1.4069, test_loss: 1.4307, test_f1: 0.2454
 epoch: 1, train_loss: 0.9848, test_loss: 1.0232, test_f1: 0.4346
 epoch: 2, train_loss: 0.9286, test_loss: 1.0259, test_f1: 0.4983
 epoch: 3, train_loss: 0.8832, test_loss: 0.9033, test_f1: 0.5724
 epoch: 4, train_loss: 0.8635, test_loss: 1.0672, test_f1: 0.4829
 epoch: 5, train_loss: 0.8237, test_loss: 0.8931, test_f1: 0.5503
 epoch: 6, train_loss: 0.8219, test_loss: 0.8510, test_f1: 0.5957
 epoch: 7, train_loss: 0.7856, test_loss: 0.9248, test_f1: 0.6032
 epoch: 8, train_loss: 0.7676, test_loss: 0.9606, test_f1: 0.6030
 epoch: 9, train_loss: 0.7465, test_loss: 1.0705, test_f1: 0.5732
 epoch: 10, train_loss: 0.7255, test_loss: 0.8500, test_f1: 0.6261
 epoch: 11, train_loss: 0.7186, test_loss: 1.0287, test_f1: 0.5740
 epoch: 12, train_loss: 0.7193, test_loss: 0.8708, test_f1: 0.5808
 epoch: 13, train_loss: 0.6853, test_loss: 0.9921, test_f1: 0.5792
 epoch: 14, train_loss: 0.6907, test_loss: 0.8325, test_f1: 0.6379
 epoch: 15, train_loss: 0.6567, test_loss: 0.9746, test_f1: 0.5704
 epoch: 16, train_loss: 0.6311, test_loss: 0.9754, test_f1: 0.6193
 epoch: 17, train_loss: 0.6235, test_loss: 0.7972, test_f1: 0.5857
 epoch: 18, train_loss: 0.6234, test_loss: 0.9894, test_f1: 0.5514
 epoch: 19, train_loss: 0.5973, test_loss: 0.8933, test_f1: 0.6118
 epoch: 20, train_loss: 0.5900, test_loss: 0.9613, test_f1: 0.6314
 epoch: 21, train_loss: 0.6087, test_loss: 0.8065, test_f1: 0.6266
 epoch: 22, train_loss: 0.5759, test_loss: 0.9725, test_f1: 0.6124
 epoch: 23, train_loss: 0.5846, test_loss: 0.8984, test_f1: 0.6443
 epoch: 24, train_loss: 0.5420, test_loss: 1.0489, test_f1: 0.6293
 epoch: 25, train_loss: 0.5370, test_loss: 0.9079, test_f1: 0.6059
 epoch: 26, train_loss: 0.5507, test_loss: 1.0181, test_f1: 0.5972
 epoch: 27, train_loss: 0.5191, test_loss: 0.9231, test_f1: 0.6322
 epoch: 28, train_loss: 0.5190, test_loss: 0.9549, test_f1: 0.6125
 epoch: 29, train_loss: 0.5086, test_loss: 0.9056, test_f1: 0.6305
 epoch: 30, train_loss: 0.4908, test_loss: 0.9994, test_f1: 0.5837
 epoch: 31, train_loss: 0.5034, test_loss: 0.9379, test_f1: 0.6143
 epoch: 32, train_loss: 0.4756, test_loss: 0.9664, test_f1: 0.6254
 epoch: 33, train_loss: 0.4762, test_loss: 0.9309, test_f1: 0.6312
 epoch: 34, train_loss: 0.4570, test_loss: 0.9538, test_f1: 0.6408
 epoch: 35, train_loss: 0.4431, test_loss: 0.9503, test_f1: 0.6188
 epoch: 36, train_loss: 0.4414, test_loss: 1.1022, test_f1: 0.6115
 epoch: 37, train_loss: 0.4208, test_loss: 1.1053, test_f1: 0.6226
 epoch: 38, train_loss: 0.4195, test_loss: 0.9231, test_f1: 0.6455
 epoch: 39, train_loss: 0.4214, test_loss: 1.0833, test_f1: 0.6227
 epoch: 40, train_loss: 0.4081, test_loss: 1.1248, test_f1: 0.6657
 epoch: 41, train_loss: 0.3885, test_loss: 1.0565, test_f1: 0.6729
 epoch: 42, train_loss: 0.3981, test_loss: 1.0608, test_f1: 0.6340
 epoch: 43, train_loss: 0.3647, test_loss: 1.2108, test_f1: 0.6264
 epoch: 44, train_loss: 0.3965, test_loss: 1.2278, test_f1: 0.5931
 epoch: 45, train_loss: 0.3860, test_loss: 1.2402, test_f1: 0.6074
 epoch: 46, train_loss: 0.3944, test_loss: 1.2057, test_f1: 0.6284
 epoch: 47, train_loss: 0.3574, test_loss: 1.2134, test_f1: 0.6398
 epoch: 48, train_loss: 0.3394, test_loss: 1.2459, test_f1: 0.6539
 epoch: 49, train_loss: 0.3433, test_loss: 1.0994, test_f1: 0.6545
 epoch: 50, train_loss: 0.3281, test_loss: 1.2748, test_f1: 0.6448
 epoch: 51, train_loss: 0.3072, test_loss: 1.2633, test_f1: 0.6468
 epoch: 52, train_loss: 0.2841, test_loss: 1.3107, test_f1: 0.6432
 epoch: 53, train_loss: 0.2529, test_loss: 1.2604, test_f1: 0.6625
 epoch: 54, train_loss: 0.2562, test_loss: 1.2884, test_f1: 0.6527
 epoch: 55, train_loss: 0.2595, test_loss: 1.3596, test_f1: 0.6194
 epoch: 56, train_loss: 0.2527, test_loss: 1.3345, test_f1: 0.6547
 epoch: 57, train_loss: 0.2333, test_loss: 1.3900, test_f1: 0.6340
 epoch: 58, train_loss: 0.2312, test_loss: 1.4214, test_f1: 0.6583
 epoch: 59, train_loss: 0.2209, test_loss: 1.5470, test_f1: 0.6380
 epoch: 60, train_loss: 0.2398, test_loss: 1.3769, test_f1: 0.6484
 epoch: 61, train_loss: 0.2272, test_loss: 1.4792, test_f1: 0.6338
 epoch: 62, train_loss: 0.2343, test_loss: 1.4227, test_f1: 0.6427
 epoch: 63, train_loss: 0.2306, test_loss: 1.3749, test_f1: 0.6331
 epoch: 64, train_loss: 0.2247, test_loss: 1.4964, test_f1: 0.6430
 epoch: 65, train_loss: 0.2074, test_loss: 1.4117, test_f1: 0.6524
 epoch: 66, train_loss: 0.2026, test_loss: 1.5383, test_f1: 0.6321
 epoch: 67, train_loss: 0.1968, test_loss: 1.5368, test_f1: 0.6483
 epoch: 68, train_loss: 0.1963, test_loss: 1.5669, test_f1: 0.6352
 epoch: 69, train_loss: 0.1890, test_loss: 1.6279, test_f1: 0.6579
 epoch: 70, train_loss: 0.1964, test_loss: 1.6138, test_f1: 0.6412
 epoch: 71, train_loss: 0.2009, test_loss: 1.6057, test_f1: 0.6464
 epoch: 72, train_loss: 0.1885, test_loss: 1.7791, test_f1: 0.6206
 epoch: 73, train_loss: 0.1912, test_loss: 1.5190, test_f1: 0.6437
 epoch: 74, train_loss: 0.1812, test_loss: 1.6161, test_f1: 0.6352
 epoch: 75, train_loss: 0.2025, test_loss: 1.4704, test_f1: 0.6395
 epoch: 76, train_loss: 0.1924, test_loss: 1.5405, test_f1: 0.6310
 epoch: 77, train_loss: 0.1741, test_loss: 1.6099, test_f1: 0.6555
 epoch: 78, train_loss: 0.1765, test_loss: 1.6644, test_f1: 0.6566
 epoch: 79, train_loss: 0.1879, test_loss: 1.7402, test_f1: 0.6392
 epoch: 80, train_loss: 0.1638, test_loss: 1.7437, test_f1: 0.6328
 epoch: 81, train_loss: 0.1735, test_loss: 1.7709, test_f1: 0.6205
 epoch: 82, train_loss: 0.1748, test_loss: 1.7523, test_f1: 0.6435
 epoch: 83, train_loss: 0.1710, test_loss: 1.8978, test_f1: 0.6289
 epoch: 84, train_loss: 0.1555, test_loss: 1.7141, test_f1: 0.6138
 epoch: 85, train_loss: 0.1694, test_loss: 1.7623, test_f1: 0.6352
 epoch: 86, train_loss: 0.1756, test_loss: 1.7122, test_f1: 0.6364
 epoch: 87, train_loss: 0.1556, test_loss: 1.8438, test_f1: 0.6352
 epoch: 88, train_loss: 0.1514, test_loss: 1.6829, test_f1: 0.6455
 epoch: 89, train_loss: 0.1622, test_loss: 1.7960, test_f1: 0.6316
 epoch: 90, train_loss: 0.1642, test_loss: 1.7087, test_f1: 0.6815
 epoch: 91, train_loss: 0.1737, test_loss: 1.6954, test_f1: 0.6407
 epoch: 92, train_loss: 0.1513, test_loss: 1.7186, test_f1: 0.6400
 epoch: 93, train_loss: 0.1545, test_loss: 1.7342, test_f1: 0.6637
 epoch: 94, train_loss: 0.1415, test_loss: 1.8775, test_f1: 0.6558
 epoch: 95, train_loss: 0.1675, test_loss: 1.7183, test_f1: 0.6578
 epoch: 96, train_loss: 0.1455, test_loss: 1.7804, test_f1: 0.6503
 epoch: 97, train_loss: 0.1366, test_loss: 1.7606, test_f1: 0.6340
 epoch: 98, train_loss: 0.1404, test_loss: 1.7930, test_f1: 0.6215
 epoch: 99, train_loss: 0.1371, test_loss: 1.7869, test_f1: 0.6579
##################ITERATION #8 ****************************************
 epoch: 0, train_loss: 1.3358, test_loss: 1.2314, test_f1: 0.2286
 epoch: 1, train_loss: 0.9854, test_loss: 0.9968, test_f1: 0.4670
 epoch: 2, train_loss: 0.9223, test_loss: 0.9302, test_f1: 0.5576
 epoch: 3, train_loss: 0.8955, test_loss: 0.9036, test_f1: 0.5768
 epoch: 4, train_loss: 0.8665, test_loss: 0.8554, test_f1: 0.6132
 epoch: 5, train_loss: 0.8242, test_loss: 0.8892, test_f1: 0.6134
 epoch: 6, train_loss: 0.8074, test_loss: 0.8686, test_f1: 0.6077
 epoch: 7, train_loss: 0.7927, test_loss: 0.8400, test_f1: 0.6045
 epoch: 8, train_loss: 0.7611, test_loss: 0.8533, test_f1: 0.5943
 epoch: 9, train_loss: 0.7553, test_loss: 0.8933, test_f1: 0.5968
 epoch: 10, train_loss: 0.7129, test_loss: 0.8495, test_f1: 0.6099
 epoch: 11, train_loss: 0.6995, test_loss: 0.7710, test_f1: 0.6419
 epoch: 12, train_loss: 0.6868, test_loss: 0.8149, test_f1: 0.6068
 epoch: 13, train_loss: 0.6546, test_loss: 0.7961, test_f1: 0.6137
 epoch: 14, train_loss: 0.6592, test_loss: 0.9252, test_f1: 0.5911
 epoch: 15, train_loss: 0.6328, test_loss: 0.7902, test_f1: 0.6624
 epoch: 16, train_loss: 0.6270, test_loss: 0.7942, test_f1: 0.6355
 epoch: 17, train_loss: 0.6023, test_loss: 0.8856, test_f1: 0.6276
 epoch: 18, train_loss: 0.6127, test_loss: 0.8246, test_f1: 0.6479
 epoch: 19, train_loss: 0.5868, test_loss: 0.8200, test_f1: 0.6489
 epoch: 20, train_loss: 0.5689, test_loss: 0.8570, test_f1: 0.6469
 epoch: 21, train_loss: 0.5803, test_loss: 0.8288, test_f1: 0.6258
 epoch: 22, train_loss: 0.5698, test_loss: 0.8073, test_f1: 0.6641
 epoch: 23, train_loss: 0.5420, test_loss: 0.8147, test_f1: 0.6253
 epoch: 24, train_loss: 0.5175, test_loss: 0.8026, test_f1: 0.6545
 epoch: 25, train_loss: 0.5074, test_loss: 1.0547, test_f1: 0.5955
 epoch: 26, train_loss: 0.5035, test_loss: 0.8170, test_f1: 0.6465
 epoch: 27, train_loss: 0.4993, test_loss: 1.0073, test_f1: 0.6284
 epoch: 28, train_loss: 0.4983, test_loss: 0.8685, test_f1: 0.6480
 epoch: 29, train_loss: 0.4682, test_loss: 0.8079, test_f1: 0.6707
 epoch: 30, train_loss: 0.4476, test_loss: 0.9459, test_f1: 0.6608
 epoch: 31, train_loss: 0.4446, test_loss: 1.1845, test_f1: 0.6264
 epoch: 32, train_loss: 0.4384, test_loss: 0.8760, test_f1: 0.6743
 epoch: 33, train_loss: 0.4464, test_loss: 0.9194, test_f1: 0.6469
 epoch: 34, train_loss: 0.4326, test_loss: 0.8822, test_f1: 0.6559
 epoch: 35, train_loss: 0.4145, test_loss: 0.8406, test_f1: 0.6531
 epoch: 36, train_loss: 0.4204, test_loss: 0.9132, test_f1: 0.6413
 epoch: 37, train_loss: 0.4308, test_loss: 1.0499, test_f1: 0.6188
 epoch: 38, train_loss: 0.3901, test_loss: 1.0657, test_f1: 0.6582
 epoch: 39, train_loss: 0.3776, test_loss: 0.9435, test_f1: 0.6201
 epoch: 40, train_loss: 0.3754, test_loss: 1.0883, test_f1: 0.6590
 epoch: 41, train_loss: 0.4074, test_loss: 1.2241, test_f1: 0.6073
 epoch: 42, train_loss: 0.3888, test_loss: 1.1189, test_f1: 0.6253
 epoch: 43, train_loss: 0.3986, test_loss: 0.9740, test_f1: 0.6598
 epoch: 44, train_loss: 0.3717, test_loss: 0.9893, test_f1: 0.6616
 epoch: 45, train_loss: 0.3593, test_loss: 1.0210, test_f1: 0.6469
 epoch: 46, train_loss: 0.3458, test_loss: 1.0007, test_f1: 0.6391
 epoch: 47, train_loss: 0.3296, test_loss: 1.0493, test_f1: 0.6647
 epoch: 48, train_loss: 0.3093, test_loss: 1.2089, test_f1: 0.6414
 epoch: 49, train_loss: 0.3197, test_loss: 1.1394, test_f1: 0.6573
 epoch: 50, train_loss: 0.3303, test_loss: 1.1180, test_f1: 0.6322
 epoch: 51, train_loss: 0.2937, test_loss: 1.0298, test_f1: 0.6658
 epoch: 52, train_loss: 0.2593, test_loss: 1.1098, test_f1: 0.6694
 epoch: 53, train_loss: 0.2550, test_loss: 1.1708, test_f1: 0.6840
 epoch: 54, train_loss: 0.2397, test_loss: 1.1216, test_f1: 0.6744
 epoch: 55, train_loss: 0.2290, test_loss: 1.2429, test_f1: 0.6644
 epoch: 56, train_loss: 0.2236, test_loss: 1.1996, test_f1: 0.6686
 epoch: 57, train_loss: 0.2414, test_loss: 1.2206, test_f1: 0.6664
 epoch: 58, train_loss: 0.2273, test_loss: 1.2445, test_f1: 0.6605
 epoch: 59, train_loss: 0.2147, test_loss: 1.1944, test_f1: 0.6632
 epoch: 60, train_loss: 0.2084, test_loss: 1.3733, test_f1: 0.6650
 epoch: 61, train_loss: 0.2229, test_loss: 1.1988, test_f1: 0.6810
 epoch: 62, train_loss: 0.2178, test_loss: 1.4015, test_f1: 0.6566
 epoch: 63, train_loss: 0.2058, test_loss: 1.3424, test_f1: 0.6621
 epoch: 64, train_loss: 0.2089, test_loss: 1.2316, test_f1: 0.6575
 epoch: 65, train_loss: 0.2154, test_loss: 1.2539, test_f1: 0.6700
 epoch: 66, train_loss: 0.1951, test_loss: 1.4144, test_f1: 0.6717
 epoch: 67, train_loss: 0.2069, test_loss: 1.3272, test_f1: 0.6560
 epoch: 68, train_loss: 0.2017, test_loss: 1.3814, test_f1: 0.6685
 epoch: 69, train_loss: 0.2066, test_loss: 1.3403, test_f1: 0.6646
 epoch: 70, train_loss: 0.1824, test_loss: 1.3493, test_f1: 0.6537
 epoch: 71, train_loss: 0.1976, test_loss: 1.5568, test_f1: 0.6487
 epoch: 72, train_loss: 0.1748, test_loss: 1.4148, test_f1: 0.6703
 epoch: 73, train_loss: 0.1728, test_loss: 1.3378, test_f1: 0.6785
 epoch: 74, train_loss: 0.1713, test_loss: 1.3867, test_f1: 0.6531
 epoch: 75, train_loss: 0.1755, test_loss: 1.4111, test_f1: 0.6404
 epoch: 76, train_loss: 0.1817, test_loss: 1.5042, test_f1: 0.6536
 epoch: 77, train_loss: 0.1527, test_loss: 1.3614, test_f1: 0.6684
 epoch: 78, train_loss: 0.1728, test_loss: 1.3542, test_f1: 0.6767
 epoch: 79, train_loss: 0.1701, test_loss: 1.3770, test_f1: 0.6661
 epoch: 80, train_loss: 0.1629, test_loss: 1.3878, test_f1: 0.6742
 epoch: 81, train_loss: 0.1868, test_loss: 1.3720, test_f1: 0.6828
 epoch: 82, train_loss: 0.1830, test_loss: 1.4639, test_f1: 0.6624
 epoch: 83, train_loss: 0.1723, test_loss: 1.3570, test_f1: 0.6754
 epoch: 84, train_loss: 0.1535, test_loss: 1.4840, test_f1: 0.6645
 epoch: 85, train_loss: 0.1749, test_loss: 1.4665, test_f1: 0.6673
 epoch: 86, train_loss: 0.1724, test_loss: 1.5626, test_f1: 0.6519
 epoch: 87, train_loss: 0.1594, test_loss: 1.5114, test_f1: 0.6878
 epoch: 88, train_loss: 0.1654, test_loss: 1.4414, test_f1: 0.6644
 epoch: 89, train_loss: 0.1486, test_loss: 1.5833, test_f1: 0.6598
 epoch: 90, train_loss: 0.1581, test_loss: 1.5328, test_f1: 0.6368
 epoch: 91, train_loss: 0.1567, test_loss: 1.5119, test_f1: 0.6546
 epoch: 92, train_loss: 0.1431, test_loss: 1.5866, test_f1: 0.6504
 epoch: 93, train_loss: 0.1387, test_loss: 1.5261, test_f1: 0.6704
 epoch: 94, train_loss: 0.1538, test_loss: 1.6225, test_f1: 0.6744
 epoch: 95, train_loss: 0.1388, test_loss: 1.7140, test_f1: 0.6500
 epoch: 96, train_loss: 0.1383, test_loss: 1.6675, test_f1: 0.6489
 epoch: 97, train_loss: 0.1510, test_loss: 1.6362, test_f1: 0.6539
 epoch: 98, train_loss: 0.1451, test_loss: 1.7161, test_f1: 0.6611
 epoch: 99, train_loss: 0.1368, test_loss: 1.6867, test_f1: 0.6714
##################ITERATION #9 ****************************************
 epoch: 0, train_loss: 1.6568, test_loss: 1.4937, test_f1: 0.2260
 epoch: 1, train_loss: 1.0134, test_loss: 1.1232, test_f1: 0.3616
 epoch: 2, train_loss: 0.9275, test_loss: 0.9754, test_f1: 0.5456
 epoch: 3, train_loss: 0.8931, test_loss: 1.0153, test_f1: 0.5170
 epoch: 4, train_loss: 0.8650, test_loss: 0.9372, test_f1: 0.4998
 epoch: 5, train_loss: 0.8320, test_loss: 0.9876, test_f1: 0.4729
 epoch: 6, train_loss: 0.8050, test_loss: 0.9349, test_f1: 0.5294
 epoch: 7, train_loss: 0.7820, test_loss: 0.8715, test_f1: 0.5246
 epoch: 8, train_loss: 0.7859, test_loss: 0.9246, test_f1: 0.5476
 epoch: 9, train_loss: 0.7621, test_loss: 0.8840, test_f1: 0.5532
 epoch: 10, train_loss: 0.7410, test_loss: 0.9176, test_f1: 0.5753
 epoch: 11, train_loss: 0.7388, test_loss: 0.9306, test_f1: 0.5734
 epoch: 12, train_loss: 0.7160, test_loss: 0.9668, test_f1: 0.5635
 epoch: 13, train_loss: 0.6858, test_loss: 0.8466, test_f1: 0.6270
 epoch: 14, train_loss: 0.6765, test_loss: 0.8453, test_f1: 0.5799
 epoch: 15, train_loss: 0.6627, test_loss: 0.9759, test_f1: 0.5554
 epoch: 16, train_loss: 0.6338, test_loss: 0.8656, test_f1: 0.6026
 epoch: 17, train_loss: 0.6177, test_loss: 0.8691, test_f1: 0.6286
 epoch: 18, train_loss: 0.6116, test_loss: 0.8704, test_f1: 0.5757
 epoch: 19, train_loss: 0.5911, test_loss: 0.8212, test_f1: 0.6126
 epoch: 20, train_loss: 0.6007, test_loss: 0.8365, test_f1: 0.6635
 epoch: 21, train_loss: 0.5797, test_loss: 0.7686, test_f1: 0.6385
 epoch: 22, train_loss: 0.5859, test_loss: 0.8692, test_f1: 0.6256
 epoch: 23, train_loss: 0.5688, test_loss: 0.7633, test_f1: 0.6599
 epoch: 24, train_loss: 0.5517, test_loss: 0.8034, test_f1: 0.6519
 epoch: 25, train_loss: 0.5335, test_loss: 0.8452, test_f1: 0.6486
 epoch: 26, train_loss: 0.5164, test_loss: 0.8538, test_f1: 0.6516
 epoch: 27, train_loss: 0.5096, test_loss: 0.9413, test_f1: 0.6216
 epoch: 28, train_loss: 0.5179, test_loss: 0.7567, test_f1: 0.6569
 epoch: 29, train_loss: 0.4937, test_loss: 0.9111, test_f1: 0.6414
 epoch: 30, train_loss: 0.5058, test_loss: 0.9141, test_f1: 0.6261
 epoch: 31, train_loss: 0.4807, test_loss: 0.8417, test_f1: 0.6538
 epoch: 32, train_loss: 0.4977, test_loss: 0.8127, test_f1: 0.6777
 epoch: 33, train_loss: 0.4626, test_loss: 0.9791, test_f1: 0.6401
 epoch: 34, train_loss: 0.4580, test_loss: 0.8853, test_f1: 0.6667
 epoch: 35, train_loss: 0.4445, test_loss: 0.9102, test_f1: 0.6498
 epoch: 36, train_loss: 0.4255, test_loss: 1.0942, test_f1: 0.6288
 epoch: 37, train_loss: 0.4286, test_loss: 0.9408, test_f1: 0.6370
 epoch: 38, train_loss: 0.4157, test_loss: 0.9718, test_f1: 0.6557
 epoch: 39, train_loss: 0.4111, test_loss: 0.9088, test_f1: 0.6501
 epoch: 40, train_loss: 0.4108, test_loss: 1.0337, test_f1: 0.6311
 epoch: 41, train_loss: 0.3944, test_loss: 0.9996, test_f1: 0.6328
 epoch: 42, train_loss: 0.4154, test_loss: 0.8822, test_f1: 0.6852
 epoch: 43, train_loss: 0.3759, test_loss: 1.0905, test_f1: 0.6726
 epoch: 44, train_loss: 0.3841, test_loss: 0.8776, test_f1: 0.6876
 epoch: 45, train_loss: 0.3622, test_loss: 1.2252, test_f1: 0.6319
 epoch: 46, train_loss: 0.3490, test_loss: 0.9989, test_f1: 0.6595
 epoch: 47, train_loss: 0.3593, test_loss: 1.0169, test_f1: 0.6581
 epoch: 48, train_loss: 0.3621, test_loss: 0.9502, test_f1: 0.6733
 epoch: 49, train_loss: 0.3503, test_loss: 1.0935, test_f1: 0.6507
 epoch: 50, train_loss: 0.3538, test_loss: 1.0161, test_f1: 0.6387
 epoch: 51, train_loss: 0.3202, test_loss: 1.0866, test_f1: 0.6826
 epoch: 52, train_loss: 0.2779, test_loss: 1.0400, test_f1: 0.6709
 epoch: 53, train_loss: 0.2624, test_loss: 0.9953, test_f1: 0.6865
 epoch: 54, train_loss: 0.2467, test_loss: 1.1035, test_f1: 0.6659
 epoch: 55, train_loss: 0.2421, test_loss: 1.1511, test_f1: 0.6904
 epoch: 56, train_loss: 0.2448, test_loss: 1.1026, test_f1: 0.6785
 epoch: 57, train_loss: 0.2526, test_loss: 1.1277, test_f1: 0.6853
 epoch: 58, train_loss: 0.2444, test_loss: 1.1970, test_f1: 0.6796
 epoch: 59, train_loss: 0.2423, test_loss: 1.1480, test_f1: 0.6809
 epoch: 60, train_loss: 0.2459, test_loss: 1.0754, test_f1: 0.6702
 epoch: 61, train_loss: 0.2200, test_loss: 1.1185, test_f1: 0.6796
 epoch: 62, train_loss: 0.2258, test_loss: 1.1550, test_f1: 0.7089
 epoch: 63, train_loss: 0.2096, test_loss: 1.2497, test_f1: 0.6847
 epoch: 64, train_loss: 0.2141, test_loss: 1.1146, test_f1: 0.7032
 epoch: 65, train_loss: 0.2075, test_loss: 1.2287, test_f1: 0.6741
 epoch: 66, train_loss: 0.2103, test_loss: 1.1705, test_f1: 0.6945
 epoch: 67, train_loss: 0.2279, test_loss: 1.2367, test_f1: 0.6617
 epoch: 68, train_loss: 0.2161, test_loss: 1.2076, test_f1: 0.6867
 epoch: 69, train_loss: 0.1900, test_loss: 1.3768, test_f1: 0.6883
 epoch: 70, train_loss: 0.2124, test_loss: 1.2120, test_f1: 0.7070
 epoch: 71, train_loss: 0.2278, test_loss: 1.2622, test_f1: 0.6713
 epoch: 72, train_loss: 0.2089, test_loss: 1.3232, test_f1: 0.7110
 epoch: 73, train_loss: 0.2101, test_loss: 1.4058, test_f1: 0.6691
 epoch: 74, train_loss: 0.1675, test_loss: 1.3082, test_f1: 0.7016
 epoch: 75, train_loss: 0.2070, test_loss: 1.5065, test_f1: 0.6751
 epoch: 76, train_loss: 0.2085, test_loss: 1.2041, test_f1: 0.6660
 epoch: 77, train_loss: 0.1796, test_loss: 1.5963, test_f1: 0.6642
 epoch: 78, train_loss: 0.1794, test_loss: 1.4278, test_f1: 0.6667
 epoch: 79, train_loss: 0.1809, test_loss: 1.5012, test_f1: 0.6651
 epoch: 80, train_loss: 0.1909, test_loss: 1.3195, test_f1: 0.6986
 epoch: 81, train_loss: 0.2264, test_loss: 1.3869, test_f1: 0.6892
 epoch: 82, train_loss: 0.1908, test_loss: 1.4425, test_f1: 0.6972
 epoch: 83, train_loss: 0.1905, test_loss: 1.2782, test_f1: 0.7069
 epoch: 84, train_loss: 0.1953, test_loss: 1.3086, test_f1: 0.6906
 epoch: 85, train_loss: 0.1818, test_loss: 1.4430, test_f1: 0.6608
 epoch: 86, train_loss: 0.1736, test_loss: 1.6563, test_f1: 0.6701
 epoch: 87, train_loss: 0.1803, test_loss: 1.4211, test_f1: 0.6995
 epoch: 88, train_loss: 0.1703, test_loss: 1.5986, test_f1: 0.6720
 epoch: 89, train_loss: 0.1676, test_loss: 1.5059, test_f1: 0.6682
 epoch: 90, train_loss: 0.1678, test_loss: 1.6667, test_f1: 0.6615
 epoch: 91, train_loss: 0.1764, test_loss: 1.6715, test_f1: 0.6712
 epoch: 92, train_loss: 0.1484, test_loss: 1.4721, test_f1: 0.7025
 epoch: 93, train_loss: 0.1536, test_loss: 1.7245, test_f1: 0.6605
 epoch: 94, train_loss: 0.1437, test_loss: 1.6069, test_f1: 0.6928
 epoch: 95, train_loss: 0.1534, test_loss: 1.6678, test_f1: 0.6895
 epoch: 96, train_loss: 0.1526, test_loss: 1.6907, test_f1: 0.6735
 epoch: 97, train_loss: 0.1610, test_loss: 1.6561, test_f1: 0.6764
 epoch: 98, train_loss: 0.1528, test_loss: 1.5893, test_f1: 0.6978
 epoch: 99, train_loss: 0.1498, test_loss: 1.7606, test_f1: 0.6790

Training completed in 511.56 seconds
Best F1: 0.7110 at epoch 72
Mean F1 across iterations: 0.6954  0.0105
========================FINAL RESULTS================================
FEGIN weighted F1: 0.7110  0.0105
python main.py --data ltspice_examples --representation component_pin --model FEGIN --layers 3 --hiddens 128 --batch_size 128 --lr 0.001 --emb_size 250 --epochs 100 --save_appendix component_pin_L3_H128_BS128_LR0.001_E250 --no_val
-----



STDERR:
  File "main.py", line 370, in <module>
    main()
  File "main.py", line 254, in main
    dataset = dataset_class(
  File "/home/philip/projects/ltspice_examples_code_repo/Circuit-Completion-Using-GNNs/component_classification_with_link_prediction_head/evaluation/FEGIN/kernel/circuit_datasets.py", line 15, in __init__
    self.data, self.slices = torch.load(self.processed_paths[0])
  File "/home/philip/.local/lib/python3.8/site-packages/torch/serialization.py", line 1040, in load
    warnings.warn(
  File "/usr/lib/python3.8/warnings.py", line 109, in _showwarnmsg
    sw(msg.message, msg.category, msg.filename, msg.lineno,
  File "main.py", line 47, in warn_with_traceback
    traceback.print_stack(file=log)
/home/philip/projects/ltspice_examples_code_repo/Circuit-Completion-Using-GNNs/component_classification_with_link_prediction_head/evaluation/FEGIN/kernel/circuit_datasets.py:15: FutureWarning: You are using `torch.load` with `weights_only=False` (the current default value), which uses the default pickle module implicitly. It is possible to construct malicious pickle data which will execute arbitrary code during unpickling (See https://github.com/pytorch/pytorch/blob/main/SECURITY.md#untrusted-models for more details). In a future release, the default value for `weights_only` will be flipped to `True`. This limits the functions that could be executed during unpickling. Arbitrary objects will no longer be allowed to be loaded via this mode unless they are explicitly allowlisted by the user via `torch.serialization.add_safe_globals`. We recommend you start setting `weights_only=True` for any use case where you don't have full control of the loaded file. Please open an issue on GitHub for any issues related to this experimental feature.
  self.data, self.slices = torch.load(self.processed_paths[0])
