STDOUT:
Results will be saved in /home/philip/projects/ltspice_examples_code_repo/Circuit-Completion-Using-GNNs/component_classification_with_link_prediction_head/evaluation/FEGIN/results/model_FEGIN_dataset_ltspice_examples
Command line input: python main.py --data ltspice_examples --representation component_component --model FEGIN --layers 5 --hiddens 32 --batch_size 128 --lr 0.0001 --emb_size 512 --epochs 100 --save_appendix component_component_L5_H32_BS128_LR0.0001_E512 --no_val
 is saved.
-----
ltspice_examples - FEGIN
Using 5 layers, 32 hidden units, h = 2
Loading component_component representation dataset
ENTERED
Training FEGIN on component_component representation
Train: 3556, Test: 845
##################ITERATION #0 ****************************************
 epoch: 0, train_loss: 1.3589, test_loss: 1.3622, test_f1: 0.2274
 epoch: 1, train_loss: 1.3520, test_loss: 1.3573, test_f1: 0.2274
 epoch: 2, train_loss: 1.3468, test_loss: 1.3511, test_f1: 0.2274
 epoch: 3, train_loss: 1.3425, test_loss: 1.3464, test_f1: 0.2274
 epoch: 4, train_loss: 1.3387, test_loss: 1.3420, test_f1: 0.2274
 epoch: 5, train_loss: 1.3325, test_loss: 1.3372, test_f1: 0.2274
 epoch: 6, train_loss: 1.3275, test_loss: 1.3322, test_f1: 0.2274
 epoch: 7, train_loss: 1.3217, test_loss: 1.3271, test_f1: 0.2274
 epoch: 8, train_loss: 1.3160, test_loss: 1.3200, test_f1: 0.2274
 epoch: 9, train_loss: 1.3089, test_loss: 1.3159, test_f1: 0.2274
 epoch: 10, train_loss: 1.3041, test_loss: 1.3105, test_f1: 0.2274
 epoch: 11, train_loss: 1.2967, test_loss: 1.3041, test_f1: 0.2274
 epoch: 12, train_loss: 1.2914, test_loss: 1.2980, test_f1: 0.2274
 epoch: 13, train_loss: 1.2869, test_loss: 1.2917, test_f1: 0.2274
 epoch: 14, train_loss: 1.2789, test_loss: 1.2853, test_f1: 0.2274
 epoch: 15, train_loss: 1.2743, test_loss: 1.2789, test_f1: 0.2274
 epoch: 16, train_loss: 1.2686, test_loss: 1.2728, test_f1: 0.2274
 epoch: 17, train_loss: 1.2635, test_loss: 1.2663, test_f1: 0.2274
 epoch: 18, train_loss: 1.2632, test_loss: 1.2605, test_f1: 0.2274
 epoch: 19, train_loss: 1.2548, test_loss: 1.2536, test_f1: 0.2274
 epoch: 20, train_loss: 1.2514, test_loss: 1.2485, test_f1: 0.2274
 epoch: 21, train_loss: 1.2470, test_loss: 1.2437, test_f1: 0.2274
 epoch: 22, train_loss: 1.2406, test_loss: 1.2379, test_f1: 0.2274
 epoch: 23, train_loss: 1.2339, test_loss: 1.2322, test_f1: 0.2274
 epoch: 24, train_loss: 1.2341, test_loss: 1.2279, test_f1: 0.2274
 epoch: 25, train_loss: 1.2299, test_loss: 1.2228, test_f1: 0.2274
 epoch: 26, train_loss: 1.2231, test_loss: 1.2163, test_f1: 0.2323
 epoch: 27, train_loss: 1.2232, test_loss: 1.2127, test_f1: 0.2642
 epoch: 28, train_loss: 1.2183, test_loss: 1.2055, test_f1: 0.2815
 epoch: 29, train_loss: 1.2124, test_loss: 1.2046, test_f1: 0.3164
 epoch: 30, train_loss: 1.2089, test_loss: 1.1989, test_f1: 0.3154
 epoch: 31, train_loss: 1.2079, test_loss: 1.1939, test_f1: 0.3180
 epoch: 32, train_loss: 1.2040, test_loss: 1.1919, test_f1: 0.3188
 epoch: 33, train_loss: 1.2042, test_loss: 1.1885, test_f1: 0.3250
 epoch: 34, train_loss: 1.2025, test_loss: 1.1844, test_f1: 0.3261
 epoch: 35, train_loss: 1.1949, test_loss: 1.1812, test_f1: 0.3276
 epoch: 36, train_loss: 1.1881, test_loss: 1.1766, test_f1: 0.3328
 epoch: 37, train_loss: 1.1872, test_loss: 1.1760, test_f1: 0.3349
 epoch: 38, train_loss: 1.1844, test_loss: 1.1745, test_f1: 0.3378
 epoch: 39, train_loss: 1.1809, test_loss: 1.1712, test_f1: 0.3387
 epoch: 40, train_loss: 1.1749, test_loss: 1.1682, test_f1: 0.3386
 epoch: 41, train_loss: 1.1763, test_loss: 1.1676, test_f1: 0.3398
 epoch: 42, train_loss: 1.1683, test_loss: 1.1639, test_f1: 0.3383
 epoch: 43, train_loss: 1.1688, test_loss: 1.1596, test_f1: 0.3411
 epoch: 44, train_loss: 1.1608, test_loss: 1.1550, test_f1: 0.3395
 epoch: 45, train_loss: 1.1596, test_loss: 1.1565, test_f1: 0.3415
 epoch: 46, train_loss: 1.1584, test_loss: 1.1517, test_f1: 0.3438
 epoch: 47, train_loss: 1.1557, test_loss: 1.1501, test_f1: 0.3454
 epoch: 48, train_loss: 1.1435, test_loss: 1.1482, test_f1: 0.3467
 epoch: 49, train_loss: 1.1456, test_loss: 1.1409, test_f1: 0.3543
 epoch: 50, train_loss: 1.1332, test_loss: 1.1393, test_f1: 0.3545
 epoch: 51, train_loss: 1.1329, test_loss: 1.1385, test_f1: 0.3494
 epoch: 52, train_loss: 1.1322, test_loss: 1.1380, test_f1: 0.3516
 epoch: 53, train_loss: 1.1290, test_loss: 1.1372, test_f1: 0.3536
 epoch: 54, train_loss: 1.1286, test_loss: 1.1328, test_f1: 0.3555
 epoch: 55, train_loss: 1.1263, test_loss: 1.1316, test_f1: 0.3526
 epoch: 56, train_loss: 1.1229, test_loss: 1.1268, test_f1: 0.3556
 epoch: 57, train_loss: 1.1238, test_loss: 1.1275, test_f1: 0.3680
 epoch: 58, train_loss: 1.1182, test_loss: 1.1274, test_f1: 0.3754
 epoch: 59, train_loss: 1.1178, test_loss: 1.1240, test_f1: 0.3851
 epoch: 60, train_loss: 1.1149, test_loss: 1.1228, test_f1: 0.3968
 epoch: 61, train_loss: 1.1185, test_loss: 1.1209, test_f1: 0.3970
 epoch: 62, train_loss: 1.1125, test_loss: 1.1206, test_f1: 0.4004
 epoch: 63, train_loss: 1.1124, test_loss: 1.1176, test_f1: 0.4041
 epoch: 64, train_loss: 1.1059, test_loss: 1.1180, test_f1: 0.4099
 epoch: 65, train_loss: 1.1092, test_loss: 1.1190, test_f1: 0.4088
 epoch: 66, train_loss: 1.1031, test_loss: 1.1167, test_f1: 0.4134
 epoch: 67, train_loss: 1.1012, test_loss: 1.1133, test_f1: 0.4103
 epoch: 68, train_loss: 1.0929, test_loss: 1.1140, test_f1: 0.4157
 epoch: 69, train_loss: 1.0981, test_loss: 1.1146, test_f1: 0.4167
 epoch: 70, train_loss: 1.0980, test_loss: 1.1157, test_f1: 0.4181
 epoch: 71, train_loss: 1.0933, test_loss: 1.1096, test_f1: 0.4148
 epoch: 72, train_loss: 1.0930, test_loss: 1.1091, test_f1: 0.4244
 epoch: 73, train_loss: 1.0863, test_loss: 1.1112, test_f1: 0.4204
 epoch: 74, train_loss: 1.0924, test_loss: 1.1080, test_f1: 0.4316
 epoch: 75, train_loss: 1.0834, test_loss: 1.1071, test_f1: 0.4275
 epoch: 76, train_loss: 1.0923, test_loss: 1.1059, test_f1: 0.4366
 epoch: 77, train_loss: 1.0831, test_loss: 1.1070, test_f1: 0.4377
 epoch: 78, train_loss: 1.0864, test_loss: 1.1022, test_f1: 0.4340
 epoch: 79, train_loss: 1.0780, test_loss: 1.1064, test_f1: 0.4365
 epoch: 80, train_loss: 1.0827, test_loss: 1.1043, test_f1: 0.4367
 epoch: 81, train_loss: 1.0773, test_loss: 1.1013, test_f1: 0.4354
 epoch: 82, train_loss: 1.0685, test_loss: 1.1040, test_f1: 0.4526
 epoch: 83, train_loss: 1.0753, test_loss: 1.1068, test_f1: 0.4405
 epoch: 84, train_loss: 1.0690, test_loss: 1.1024, test_f1: 0.4400
 epoch: 85, train_loss: 1.0653, test_loss: 1.1018, test_f1: 0.4462
 epoch: 86, train_loss: 1.0724, test_loss: 1.0998, test_f1: 0.4451
 epoch: 87, train_loss: 1.0684, test_loss: 1.0953, test_f1: 0.4489
 epoch: 88, train_loss: 1.0703, test_loss: 1.0999, test_f1: 0.4363
 epoch: 89, train_loss: 1.0655, test_loss: 1.0996, test_f1: 0.4462
 epoch: 90, train_loss: 1.0709, test_loss: 1.0990, test_f1: 0.4486
 epoch: 91, train_loss: 1.0692, test_loss: 1.0973, test_f1: 0.4444
 epoch: 92, train_loss: 1.0669, test_loss: 1.0981, test_f1: 0.4428
 epoch: 93, train_loss: 1.0636, test_loss: 1.0978, test_f1: 0.4419
 epoch: 94, train_loss: 1.0603, test_loss: 1.0980, test_f1: 0.4422
 epoch: 95, train_loss: 1.0665, test_loss: 1.0984, test_f1: 0.4438
 epoch: 96, train_loss: 1.0591, test_loss: 1.0979, test_f1: 0.4399
 epoch: 97, train_loss: 1.0592, test_loss: 1.1015, test_f1: 0.4365
 epoch: 98, train_loss: 1.0584, test_loss: 1.0986, test_f1: 0.4435
 epoch: 99, train_loss: 1.0507, test_loss: 1.0979, test_f1: 0.4439
##################ITERATION #1 ****************************************
 epoch: 0, train_loss: 1.3347, test_loss: 1.3411, test_f1: 0.2274
 epoch: 1, train_loss: 1.3260, test_loss: 1.3320, test_f1: 0.2274
 epoch: 2, train_loss: 1.3201, test_loss: 1.3207, test_f1: 0.2274
 epoch: 3, train_loss: 1.3119, test_loss: 1.3119, test_f1: 0.2274
 epoch: 4, train_loss: 1.3069, test_loss: 1.3032, test_f1: 0.2274
 epoch: 5, train_loss: 1.2999, test_loss: 1.2982, test_f1: 0.2274
 epoch: 6, train_loss: 1.2925, test_loss: 1.2922, test_f1: 0.2274
 epoch: 7, train_loss: 1.2872, test_loss: 1.2860, test_f1: 0.2274
 epoch: 8, train_loss: 1.2830, test_loss: 1.2807, test_f1: 0.2274
 epoch: 9, train_loss: 1.2772, test_loss: 1.2757, test_f1: 0.2274
 epoch: 10, train_loss: 1.2729, test_loss: 1.2715, test_f1: 0.2274
 epoch: 11, train_loss: 1.2697, test_loss: 1.2650, test_f1: 0.2274
 epoch: 12, train_loss: 1.2636, test_loss: 1.2593, test_f1: 0.2274
 epoch: 13, train_loss: 1.2585, test_loss: 1.2552, test_f1: 0.2274
 epoch: 14, train_loss: 1.2549, test_loss: 1.2521, test_f1: 0.2274
 epoch: 15, train_loss: 1.2492, test_loss: 1.2469, test_f1: 0.2274
 epoch: 16, train_loss: 1.2472, test_loss: 1.2406, test_f1: 0.2300
 epoch: 17, train_loss: 1.2424, test_loss: 1.2350, test_f1: 0.2375
 epoch: 18, train_loss: 1.2395, test_loss: 1.2314, test_f1: 0.2520
 epoch: 19, train_loss: 1.2334, test_loss: 1.2224, test_f1: 0.2549
 epoch: 20, train_loss: 1.2335, test_loss: 1.2174, test_f1: 0.2683
 epoch: 21, train_loss: 1.2225, test_loss: 1.2126, test_f1: 0.2898
 epoch: 22, train_loss: 1.2146, test_loss: 1.2056, test_f1: 0.3093
 epoch: 23, train_loss: 1.2126, test_loss: 1.2013, test_f1: 0.3211
 epoch: 24, train_loss: 1.2131, test_loss: 1.1972, test_f1: 0.3210
 epoch: 25, train_loss: 1.2092, test_loss: 1.1914, test_f1: 0.3335
 epoch: 26, train_loss: 1.2024, test_loss: 1.1849, test_f1: 0.3410
 epoch: 27, train_loss: 1.1903, test_loss: 1.1791, test_f1: 0.3416
 epoch: 28, train_loss: 1.1906, test_loss: 1.1741, test_f1: 0.3528
 epoch: 29, train_loss: 1.1881, test_loss: 1.1706, test_f1: 0.3588
 epoch: 30, train_loss: 1.1817, test_loss: 1.1651, test_f1: 0.3759
 epoch: 31, train_loss: 1.1796, test_loss: 1.1613, test_f1: 0.3751
 epoch: 32, train_loss: 1.1692, test_loss: 1.1567, test_f1: 0.3905
 epoch: 33, train_loss: 1.1673, test_loss: 1.1550, test_f1: 0.3921
 epoch: 34, train_loss: 1.1661, test_loss: 1.1519, test_f1: 0.3956
 epoch: 35, train_loss: 1.1616, test_loss: 1.1471, test_f1: 0.4027
 epoch: 36, train_loss: 1.1556, test_loss: 1.1450, test_f1: 0.4127
 epoch: 37, train_loss: 1.1568, test_loss: 1.1410, test_f1: 0.4131
 epoch: 38, train_loss: 1.1539, test_loss: 1.1367, test_f1: 0.4147
 epoch: 39, train_loss: 1.1422, test_loss: 1.1310, test_f1: 0.4170
 epoch: 40, train_loss: 1.1465, test_loss: 1.1318, test_f1: 0.4169
 epoch: 41, train_loss: 1.1368, test_loss: 1.1294, test_f1: 0.4109
 epoch: 42, train_loss: 1.1355, test_loss: 1.1263, test_f1: 0.4197
 epoch: 43, train_loss: 1.1329, test_loss: 1.1221, test_f1: 0.4235
 epoch: 44, train_loss: 1.1316, test_loss: 1.1194, test_f1: 0.4340
 epoch: 45, train_loss: 1.1265, test_loss: 1.1184, test_f1: 0.4182
 epoch: 46, train_loss: 1.1225, test_loss: 1.1164, test_f1: 0.4208
 epoch: 47, train_loss: 1.1162, test_loss: 1.1148, test_f1: 0.4211
 epoch: 48, train_loss: 1.1186, test_loss: 1.1122, test_f1: 0.4212
 epoch: 49, train_loss: 1.1205, test_loss: 1.1047, test_f1: 0.4289
 epoch: 50, train_loss: 1.1106, test_loss: 1.1060, test_f1: 0.4296
 epoch: 51, train_loss: 1.1048, test_loss: 1.1031, test_f1: 0.4329
 epoch: 52, train_loss: 1.1062, test_loss: 1.1024, test_f1: 0.4340
 epoch: 53, train_loss: 1.1096, test_loss: 1.0993, test_f1: 0.4367
 epoch: 54, train_loss: 1.1097, test_loss: 1.0990, test_f1: 0.4450
 epoch: 55, train_loss: 1.1020, test_loss: 1.0985, test_f1: 0.4458
 epoch: 56, train_loss: 1.1061, test_loss: 1.0972, test_f1: 0.4417
 epoch: 57, train_loss: 1.1048, test_loss: 1.0969, test_f1: 0.4359
 epoch: 58, train_loss: 1.0976, test_loss: 1.0909, test_f1: 0.4557
 epoch: 59, train_loss: 1.1015, test_loss: 1.0923, test_f1: 0.4450
 epoch: 60, train_loss: 1.1020, test_loss: 1.0920, test_f1: 0.4442
 epoch: 61, train_loss: 1.0950, test_loss: 1.0922, test_f1: 0.4445
 epoch: 62, train_loss: 1.0918, test_loss: 1.0917, test_f1: 0.4471
 epoch: 63, train_loss: 1.0885, test_loss: 1.0901, test_f1: 0.4432
 epoch: 64, train_loss: 1.0864, test_loss: 1.0895, test_f1: 0.4408
 epoch: 65, train_loss: 1.0844, test_loss: 1.0834, test_f1: 0.4533
 epoch: 66, train_loss: 1.0839, test_loss: 1.0840, test_f1: 0.4544
 epoch: 67, train_loss: 1.0851, test_loss: 1.0834, test_f1: 0.4530
 epoch: 68, train_loss: 1.0807, test_loss: 1.0835, test_f1: 0.4515
 epoch: 69, train_loss: 1.0745, test_loss: 1.0847, test_f1: 0.4566
 epoch: 70, train_loss: 1.0800, test_loss: 1.0831, test_f1: 0.4463
 epoch: 71, train_loss: 1.0857, test_loss: 1.0822, test_f1: 0.4512
 epoch: 72, train_loss: 1.0789, test_loss: 1.0798, test_f1: 0.4550
 epoch: 73, train_loss: 1.0776, test_loss: 1.0790, test_f1: 0.4525
 epoch: 74, train_loss: 1.0750, test_loss: 1.0784, test_f1: 0.4469
 epoch: 75, train_loss: 1.0748, test_loss: 1.0769, test_f1: 0.4552
 epoch: 76, train_loss: 1.0691, test_loss: 1.0765, test_f1: 0.4527
 epoch: 77, train_loss: 1.0673, test_loss: 1.0743, test_f1: 0.4433
 epoch: 78, train_loss: 1.0699, test_loss: 1.0710, test_f1: 0.4583
 epoch: 79, train_loss: 1.0769, test_loss: 1.0708, test_f1: 0.4579
 epoch: 80, train_loss: 1.0703, test_loss: 1.0715, test_f1: 0.4615
 epoch: 81, train_loss: 1.0741, test_loss: 1.0713, test_f1: 0.4593
 epoch: 82, train_loss: 1.0652, test_loss: 1.0718, test_f1: 0.4557
 epoch: 83, train_loss: 1.0645, test_loss: 1.0717, test_f1: 0.4534
 epoch: 84, train_loss: 1.0591, test_loss: 1.0681, test_f1: 0.4589
 epoch: 85, train_loss: 1.0697, test_loss: 1.0707, test_f1: 0.4563
 epoch: 86, train_loss: 1.0609, test_loss: 1.0678, test_f1: 0.4521
 epoch: 87, train_loss: 1.0556, test_loss: 1.0687, test_f1: 0.4567
 epoch: 88, train_loss: 1.0524, test_loss: 1.0677, test_f1: 0.4631
 epoch: 89, train_loss: 1.0575, test_loss: 1.0642, test_f1: 0.4617
 epoch: 90, train_loss: 1.0555, test_loss: 1.0620, test_f1: 0.4633
 epoch: 91, train_loss: 1.0497, test_loss: 1.0618, test_f1: 0.4631
 epoch: 92, train_loss: 1.0507, test_loss: 1.0588, test_f1: 0.4624
 epoch: 93, train_loss: 1.0566, test_loss: 1.0606, test_f1: 0.4700
 epoch: 94, train_loss: 1.0439, test_loss: 1.0600, test_f1: 0.4663
 epoch: 95, train_loss: 1.0560, test_loss: 1.0601, test_f1: 0.4652
 epoch: 96, train_loss: 1.0470, test_loss: 1.0567, test_f1: 0.4636
 epoch: 97, train_loss: 1.0440, test_loss: 1.0569, test_f1: 0.4616
 epoch: 98, train_loss: 1.0478, test_loss: 1.0568, test_f1: 0.4578
 epoch: 99, train_loss: 1.0463, test_loss: 1.0574, test_f1: 0.4632
##################ITERATION #2 ****************************************
 epoch: 0, train_loss: 1.3213, test_loss: 1.3228, test_f1: 0.2274
 epoch: 1, train_loss: 1.3066, test_loss: 1.3124, test_f1: 0.2274
 epoch: 2, train_loss: 1.2943, test_loss: 1.2931, test_f1: 0.2274
 epoch: 3, train_loss: 1.2844, test_loss: 1.2782, test_f1: 0.2274
 epoch: 4, train_loss: 1.2752, test_loss: 1.2685, test_f1: 0.2274
 epoch: 5, train_loss: 1.2725, test_loss: 1.2594, test_f1: 0.2295
 epoch: 6, train_loss: 1.2672, test_loss: 1.2540, test_f1: 0.2677
 epoch: 7, train_loss: 1.2595, test_loss: 1.2466, test_f1: 0.2749
 epoch: 8, train_loss: 1.2539, test_loss: 1.2403, test_f1: 0.3022
 epoch: 9, train_loss: 1.2492, test_loss: 1.2335, test_f1: 0.2931
 epoch: 10, train_loss: 1.2467, test_loss: 1.2278, test_f1: 0.3196
 epoch: 11, train_loss: 1.2406, test_loss: 1.2243, test_f1: 0.3281
 epoch: 12, train_loss: 1.2333, test_loss: 1.2224, test_f1: 0.3306
 epoch: 13, train_loss: 1.2296, test_loss: 1.2150, test_f1: 0.3392
 epoch: 14, train_loss: 1.2221, test_loss: 1.2111, test_f1: 0.3512
 epoch: 15, train_loss: 1.2153, test_loss: 1.2070, test_f1: 0.3598
 epoch: 16, train_loss: 1.2168, test_loss: 1.2027, test_f1: 0.3631
 epoch: 17, train_loss: 1.2085, test_loss: 1.1978, test_f1: 0.3762
 epoch: 18, train_loss: 1.2106, test_loss: 1.1935, test_f1: 0.3828
 epoch: 19, train_loss: 1.2097, test_loss: 1.1916, test_f1: 0.3890
 epoch: 20, train_loss: 1.1994, test_loss: 1.1847, test_f1: 0.3900
 epoch: 21, train_loss: 1.2000, test_loss: 1.1797, test_f1: 0.3941
 epoch: 22, train_loss: 1.1927, test_loss: 1.1744, test_f1: 0.3971
 epoch: 23, train_loss: 1.1915, test_loss: 1.1694, test_f1: 0.3951
 epoch: 24, train_loss: 1.1871, test_loss: 1.1675, test_f1: 0.4010
 epoch: 25, train_loss: 1.1798, test_loss: 1.1626, test_f1: 0.4070
 epoch: 26, train_loss: 1.1789, test_loss: 1.1601, test_f1: 0.3997
 epoch: 27, train_loss: 1.1737, test_loss: 1.1575, test_f1: 0.4132
 epoch: 28, train_loss: 1.1672, test_loss: 1.1494, test_f1: 0.4096
 epoch: 29, train_loss: 1.1675, test_loss: 1.1506, test_f1: 0.4184
 epoch: 30, train_loss: 1.1614, test_loss: 1.1454, test_f1: 0.4101
 epoch: 31, train_loss: 1.1577, test_loss: 1.1434, test_f1: 0.4123
 epoch: 32, train_loss: 1.1563, test_loss: 1.1379, test_f1: 0.4131
 epoch: 33, train_loss: 1.1539, test_loss: 1.1321, test_f1: 0.4236
 epoch: 34, train_loss: 1.1465, test_loss: 1.1369, test_f1: 0.4140
 epoch: 35, train_loss: 1.1500, test_loss: 1.1308, test_f1: 0.4191
 epoch: 36, train_loss: 1.1411, test_loss: 1.1212, test_f1: 0.4347
 epoch: 37, train_loss: 1.1403, test_loss: 1.1189, test_f1: 0.4303
 epoch: 38, train_loss: 1.1287, test_loss: 1.1215, test_f1: 0.4313
 epoch: 39, train_loss: 1.1363, test_loss: 1.1092, test_f1: 0.4372
 epoch: 40, train_loss: 1.1221, test_loss: 1.1181, test_f1: 0.4356
 epoch: 41, train_loss: 1.1276, test_loss: 1.1104, test_f1: 0.4341
 epoch: 42, train_loss: 1.1261, test_loss: 1.1099, test_f1: 0.4349
 epoch: 43, train_loss: 1.1208, test_loss: 1.1068, test_f1: 0.4384
 epoch: 44, train_loss: 1.1231, test_loss: 1.1074, test_f1: 0.4415
 epoch: 45, train_loss: 1.1131, test_loss: 1.1082, test_f1: 0.4426
 epoch: 46, train_loss: 1.1119, test_loss: 1.1009, test_f1: 0.4411
 epoch: 47, train_loss: 1.1104, test_loss: 1.0907, test_f1: 0.4416
 epoch: 48, train_loss: 1.1117, test_loss: 1.0961, test_f1: 0.4440
 epoch: 49, train_loss: 1.1157, test_loss: 1.0976, test_f1: 0.4409
 epoch: 50, train_loss: 1.1133, test_loss: 1.0867, test_f1: 0.4447
 epoch: 51, train_loss: 1.0946, test_loss: 1.0856, test_f1: 0.4510
 epoch: 52, train_loss: 1.1003, test_loss: 1.0862, test_f1: 0.4418
 epoch: 53, train_loss: 1.1003, test_loss: 1.0864, test_f1: 0.4368
 epoch: 54, train_loss: 1.0928, test_loss: 1.0880, test_f1: 0.4351
 epoch: 55, train_loss: 1.0943, test_loss: 1.0919, test_f1: 0.4421
 epoch: 56, train_loss: 1.0876, test_loss: 1.0861, test_f1: 0.4340
 epoch: 57, train_loss: 1.0913, test_loss: 1.0791, test_f1: 0.4373
 epoch: 58, train_loss: 1.0972, test_loss: 1.0793, test_f1: 0.4431
 epoch: 59, train_loss: 1.0837, test_loss: 1.0790, test_f1: 0.4515
 epoch: 60, train_loss: 1.0925, test_loss: 1.0768, test_f1: 0.4485
 epoch: 61, train_loss: 1.0874, test_loss: 1.0779, test_f1: 0.4487
 epoch: 62, train_loss: 1.0800, test_loss: 1.0770, test_f1: 0.4421
 epoch: 63, train_loss: 1.0810, test_loss: 1.0758, test_f1: 0.4443
 epoch: 64, train_loss: 1.0775, test_loss: 1.0762, test_f1: 0.4489
 epoch: 65, train_loss: 1.0768, test_loss: 1.0771, test_f1: 0.4487
 epoch: 66, train_loss: 1.0835, test_loss: 1.0744, test_f1: 0.4430
 epoch: 67, train_loss: 1.0837, test_loss: 1.0744, test_f1: 0.4393
 epoch: 68, train_loss: 1.0743, test_loss: 1.0738, test_f1: 0.4520
 epoch: 69, train_loss: 1.0769, test_loss: 1.0703, test_f1: 0.4488
 epoch: 70, train_loss: 1.0740, test_loss: 1.0735, test_f1: 0.4539
 epoch: 71, train_loss: 1.0754, test_loss: 1.0704, test_f1: 0.4478
 epoch: 72, train_loss: 1.0692, test_loss: 1.0671, test_f1: 0.4445
 epoch: 73, train_loss: 1.0774, test_loss: 1.0722, test_f1: 0.4475
 epoch: 74, train_loss: 1.0778, test_loss: 1.0724, test_f1: 0.4463
 epoch: 75, train_loss: 1.0687, test_loss: 1.0695, test_f1: 0.4421
 epoch: 76, train_loss: 1.0684, test_loss: 1.0711, test_f1: 0.4520
 epoch: 77, train_loss: 1.0728, test_loss: 1.0741, test_f1: 0.4469
 epoch: 78, train_loss: 1.0711, test_loss: 1.0675, test_f1: 0.4466
 epoch: 79, train_loss: 1.0683, test_loss: 1.0696, test_f1: 0.4556
 epoch: 80, train_loss: 1.0675, test_loss: 1.0672, test_f1: 0.4552
 epoch: 81, train_loss: 1.0657, test_loss: 1.0712, test_f1: 0.4567
 epoch: 82, train_loss: 1.0676, test_loss: 1.0735, test_f1: 0.4530
 epoch: 83, train_loss: 1.0695, test_loss: 1.0695, test_f1: 0.4574
 epoch: 84, train_loss: 1.0595, test_loss: 1.0671, test_f1: 0.4565
 epoch: 85, train_loss: 1.0680, test_loss: 1.0660, test_f1: 0.4621
 epoch: 86, train_loss: 1.0671, test_loss: 1.0699, test_f1: 0.4563
 epoch: 87, train_loss: 1.0711, test_loss: 1.0647, test_f1: 0.4625
 epoch: 88, train_loss: 1.0573, test_loss: 1.0687, test_f1: 0.4657
 epoch: 89, train_loss: 1.0592, test_loss: 1.0689, test_f1: 0.4647
 epoch: 90, train_loss: 1.0559, test_loss: 1.0654, test_f1: 0.4657
 epoch: 91, train_loss: 1.0524, test_loss: 1.0658, test_f1: 0.4541
 epoch: 92, train_loss: 1.0553, test_loss: 1.0651, test_f1: 0.4632
 epoch: 93, train_loss: 1.0528, test_loss: 1.0636, test_f1: 0.4667
 epoch: 94, train_loss: 1.0462, test_loss: 1.0651, test_f1: 0.4566
 epoch: 95, train_loss: 1.0529, test_loss: 1.0667, test_f1: 0.4573
 epoch: 96, train_loss: 1.0570, test_loss: 1.0629, test_f1: 0.4670
 epoch: 97, train_loss: 1.0463, test_loss: 1.0608, test_f1: 0.4641
 epoch: 98, train_loss: 1.0502, test_loss: 1.0610, test_f1: 0.4621
 epoch: 99, train_loss: 1.0597, test_loss: 1.0590, test_f1: 0.4684
##################ITERATION #3 ****************************************
 epoch: 0, train_loss: 1.3025, test_loss: 1.3048, test_f1: 0.2274
 epoch: 1, train_loss: 1.2823, test_loss: 1.2831, test_f1: 0.2274
 epoch: 2, train_loss: 1.2782, test_loss: 1.2718, test_f1: 0.2274
 epoch: 3, train_loss: 1.2667, test_loss: 1.2624, test_f1: 0.2325
 epoch: 4, train_loss: 1.2611, test_loss: 1.2560, test_f1: 0.2370
 epoch: 5, train_loss: 1.2573, test_loss: 1.2483, test_f1: 0.2467
 epoch: 6, train_loss: 1.2469, test_loss: 1.2411, test_f1: 0.2592
 epoch: 7, train_loss: 1.2451, test_loss: 1.2369, test_f1: 0.2743
 epoch: 8, train_loss: 1.2394, test_loss: 1.2319, test_f1: 0.3076
 epoch: 9, train_loss: 1.2342, test_loss: 1.2241, test_f1: 0.3054
 epoch: 10, train_loss: 1.2339, test_loss: 1.2217, test_f1: 0.3216
 epoch: 11, train_loss: 1.2265, test_loss: 1.2166, test_f1: 0.3093
 epoch: 12, train_loss: 1.2193, test_loss: 1.2138, test_f1: 0.3086
 epoch: 13, train_loss: 1.2200, test_loss: 1.2089, test_f1: 0.3254
 epoch: 14, train_loss: 1.2147, test_loss: 1.2039, test_f1: 0.3220
 epoch: 15, train_loss: 1.2149, test_loss: 1.2024, test_f1: 0.3237
 epoch: 16, train_loss: 1.2132, test_loss: 1.1998, test_f1: 0.3240
 epoch: 17, train_loss: 1.2026, test_loss: 1.1953, test_f1: 0.3203
 epoch: 18, train_loss: 1.2018, test_loss: 1.1931, test_f1: 0.3355
 epoch: 19, train_loss: 1.2010, test_loss: 1.1876, test_f1: 0.3475
 epoch: 20, train_loss: 1.1996, test_loss: 1.1839, test_f1: 0.3662
 epoch: 21, train_loss: 1.1938, test_loss: 1.1805, test_f1: 0.3614
 epoch: 22, train_loss: 1.1870, test_loss: 1.1780, test_f1: 0.3808
 epoch: 23, train_loss: 1.1898, test_loss: 1.1765, test_f1: 0.3903
 epoch: 24, train_loss: 1.1819, test_loss: 1.1700, test_f1: 0.3866
 epoch: 25, train_loss: 1.1819, test_loss: 1.1678, test_f1: 0.3997
 epoch: 26, train_loss: 1.1804, test_loss: 1.1661, test_f1: 0.3933
 epoch: 27, train_loss: 1.1733, test_loss: 1.1656, test_f1: 0.3913
 epoch: 28, train_loss: 1.1790, test_loss: 1.1634, test_f1: 0.3979
 epoch: 29, train_loss: 1.1710, test_loss: 1.1617, test_f1: 0.3902
 epoch: 30, train_loss: 1.1709, test_loss: 1.1594, test_f1: 0.3947
 epoch: 31, train_loss: 1.1675, test_loss: 1.1571, test_f1: 0.4026
 epoch: 32, train_loss: 1.1654, test_loss: 1.1562, test_f1: 0.3918
 epoch: 33, train_loss: 1.1570, test_loss: 1.1522, test_f1: 0.4002
 epoch: 34, train_loss: 1.1622, test_loss: 1.1510, test_f1: 0.4024
 epoch: 35, train_loss: 1.1551, test_loss: 1.1506, test_f1: 0.3949
 epoch: 36, train_loss: 1.1529, test_loss: 1.1461, test_f1: 0.3987
 epoch: 37, train_loss: 1.1532, test_loss: 1.1485, test_f1: 0.4006
 epoch: 38, train_loss: 1.1543, test_loss: 1.1469, test_f1: 0.4072
 epoch: 39, train_loss: 1.1412, test_loss: 1.1411, test_f1: 0.4039
 epoch: 40, train_loss: 1.1400, test_loss: 1.1392, test_f1: 0.4142
 epoch: 41, train_loss: 1.1403, test_loss: 1.1411, test_f1: 0.4091
 epoch: 42, train_loss: 1.1422, test_loss: 1.1361, test_f1: 0.4235
 epoch: 43, train_loss: 1.1428, test_loss: 1.1341, test_f1: 0.4209
 epoch: 44, train_loss: 1.1326, test_loss: 1.1388, test_f1: 0.4213
 epoch: 45, train_loss: 1.1376, test_loss: 1.1328, test_f1: 0.4263
 epoch: 46, train_loss: 1.1289, test_loss: 1.1310, test_f1: 0.4254
 epoch: 47, train_loss: 1.1336, test_loss: 1.1343, test_f1: 0.4274
 epoch: 48, train_loss: 1.1253, test_loss: 1.1258, test_f1: 0.4240
 epoch: 49, train_loss: 1.1285, test_loss: 1.1239, test_f1: 0.4242
 epoch: 50, train_loss: 1.1227, test_loss: 1.1205, test_f1: 0.4190
 epoch: 51, train_loss: 1.1246, test_loss: 1.1183, test_f1: 0.4282
 epoch: 52, train_loss: 1.1121, test_loss: 1.1210, test_f1: 0.4249
 epoch: 53, train_loss: 1.1154, test_loss: 1.1245, test_f1: 0.4331
 epoch: 54, train_loss: 1.1191, test_loss: 1.1214, test_f1: 0.4215
 epoch: 55, train_loss: 1.1132, test_loss: 1.1196, test_f1: 0.4207
 epoch: 56, train_loss: 1.1129, test_loss: 1.1196, test_f1: 0.4152
 epoch: 57, train_loss: 1.1112, test_loss: 1.1180, test_f1: 0.4350
 epoch: 58, train_loss: 1.1146, test_loss: 1.1175, test_f1: 0.4365
 epoch: 59, train_loss: 1.1017, test_loss: 1.1162, test_f1: 0.4314
 epoch: 60, train_loss: 1.1110, test_loss: 1.1144, test_f1: 0.4414
 epoch: 61, train_loss: 1.1079, test_loss: 1.1138, test_f1: 0.4299
 epoch: 62, train_loss: 1.1169, test_loss: 1.1165, test_f1: 0.4326
 epoch: 63, train_loss: 1.1030, test_loss: 1.1105, test_f1: 0.4314
 epoch: 64, train_loss: 1.1022, test_loss: 1.1107, test_f1: 0.4234
 epoch: 65, train_loss: 1.0993, test_loss: 1.1142, test_f1: 0.4418
 epoch: 66, train_loss: 1.1018, test_loss: 1.1136, test_f1: 0.4385
 epoch: 67, train_loss: 1.1040, test_loss: 1.1083, test_f1: 0.4408
 epoch: 68, train_loss: 1.0967, test_loss: 1.1074, test_f1: 0.4307
 epoch: 69, train_loss: 1.0951, test_loss: 1.1115, test_f1: 0.4383
 epoch: 70, train_loss: 1.0920, test_loss: 1.1087, test_f1: 0.4389
 epoch: 71, train_loss: 1.0990, test_loss: 1.1060, test_f1: 0.4307
 epoch: 72, train_loss: 1.0995, test_loss: 1.1105, test_f1: 0.4270
 epoch: 73, train_loss: 1.0953, test_loss: 1.1023, test_f1: 0.4219
 epoch: 74, train_loss: 1.0962, test_loss: 1.1064, test_f1: 0.4222
 epoch: 75, train_loss: 1.0944, test_loss: 1.1064, test_f1: 0.4343
 epoch: 76, train_loss: 1.0951, test_loss: 1.1055, test_f1: 0.4386
 epoch: 77, train_loss: 1.0906, test_loss: 1.1026, test_f1: 0.4249
 epoch: 78, train_loss: 1.1015, test_loss: 1.1027, test_f1: 0.4225
 epoch: 79, train_loss: 1.0952, test_loss: 1.1051, test_f1: 0.4294
 epoch: 80, train_loss: 1.0909, test_loss: 1.0998, test_f1: 0.4355
 epoch: 81, train_loss: 1.0829, test_loss: 1.0983, test_f1: 0.4296
 epoch: 82, train_loss: 1.0870, test_loss: 1.0975, test_f1: 0.4267
 epoch: 83, train_loss: 1.0841, test_loss: 1.0978, test_f1: 0.4322
 epoch: 84, train_loss: 1.0774, test_loss: 1.0944, test_f1: 0.4269
 epoch: 85, train_loss: 1.0818, test_loss: 1.0945, test_f1: 0.4286
 epoch: 86, train_loss: 1.0935, test_loss: 1.0939, test_f1: 0.4389
 epoch: 87, train_loss: 1.0820, test_loss: 1.0905, test_f1: 0.4225
 epoch: 88, train_loss: 1.0781, test_loss: 1.0922, test_f1: 0.4268
 epoch: 89, train_loss: 1.0724, test_loss: 1.1017, test_f1: 0.4375
 epoch: 90, train_loss: 1.0757, test_loss: 1.0931, test_f1: 0.4258
 epoch: 91, train_loss: 1.0766, test_loss: 1.0903, test_f1: 0.4192
 epoch: 92, train_loss: 1.0750, test_loss: 1.0930, test_f1: 0.4140
 epoch: 93, train_loss: 1.0790, test_loss: 1.0931, test_f1: 0.4335
 epoch: 94, train_loss: 1.0751, test_loss: 1.0917, test_f1: 0.4281
 epoch: 95, train_loss: 1.0737, test_loss: 1.0892, test_f1: 0.4274
 epoch: 96, train_loss: 1.0701, test_loss: 1.0920, test_f1: 0.4313
 epoch: 97, train_loss: 1.0665, test_loss: 1.0874, test_f1: 0.4216
 epoch: 98, train_loss: 1.0790, test_loss: 1.0921, test_f1: 0.4210
 epoch: 99, train_loss: 1.0721, test_loss: 1.0899, test_f1: 0.4285
##################ITERATION #4 ****************************************
 epoch: 0, train_loss: 1.3113, test_loss: 1.3196, test_f1: 0.2258
 epoch: 1, train_loss: 1.2887, test_loss: 1.2955, test_f1: 0.2538
 epoch: 2, train_loss: 1.2802, test_loss: 1.2720, test_f1: 0.2633
 epoch: 3, train_loss: 1.2650, test_loss: 1.2578, test_f1: 0.2754
 epoch: 4, train_loss: 1.2576, test_loss: 1.2486, test_f1: 0.2759
 epoch: 5, train_loss: 1.2539, test_loss: 1.2408, test_f1: 0.2856
 epoch: 6, train_loss: 1.2464, test_loss: 1.2360, test_f1: 0.2987
 epoch: 7, train_loss: 1.2436, test_loss: 1.2269, test_f1: 0.3296
 epoch: 8, train_loss: 1.2341, test_loss: 1.2231, test_f1: 0.3430
 epoch: 9, train_loss: 1.2319, test_loss: 1.2176, test_f1: 0.3507
 epoch: 10, train_loss: 1.2244, test_loss: 1.2105, test_f1: 0.3553
 epoch: 11, train_loss: 1.2219, test_loss: 1.2059, test_f1: 0.3611
 epoch: 12, train_loss: 1.2132, test_loss: 1.2014, test_f1: 0.3648
 epoch: 13, train_loss: 1.2104, test_loss: 1.1949, test_f1: 0.3720
 epoch: 14, train_loss: 1.2100, test_loss: 1.1899, test_f1: 0.3826
 epoch: 15, train_loss: 1.2055, test_loss: 1.1876, test_f1: 0.3904
 epoch: 16, train_loss: 1.1999, test_loss: 1.1812, test_f1: 0.3890
 epoch: 17, train_loss: 1.1947, test_loss: 1.1774, test_f1: 0.3965
 epoch: 18, train_loss: 1.1870, test_loss: 1.1703, test_f1: 0.3961
 epoch: 19, train_loss: 1.1831, test_loss: 1.1692, test_f1: 0.3885
 epoch: 20, train_loss: 1.1853, test_loss: 1.1613, test_f1: 0.4080
 epoch: 21, train_loss: 1.1806, test_loss: 1.1598, test_f1: 0.4140
 epoch: 22, train_loss: 1.1768, test_loss: 1.1526, test_f1: 0.4170
 epoch: 23, train_loss: 1.1738, test_loss: 1.1472, test_f1: 0.4234
 epoch: 24, train_loss: 1.1646, test_loss: 1.1425, test_f1: 0.4210
 epoch: 25, train_loss: 1.1639, test_loss: 1.1366, test_f1: 0.4355
 epoch: 26, train_loss: 1.1568, test_loss: 1.1309, test_f1: 0.4505
 epoch: 27, train_loss: 1.1539, test_loss: 1.1285, test_f1: 0.4414
 epoch: 28, train_loss: 1.1557, test_loss: 1.1264, test_f1: 0.4468
 epoch: 29, train_loss: 1.1409, test_loss: 1.1209, test_f1: 0.4568
 epoch: 30, train_loss: 1.1438, test_loss: 1.1157, test_f1: 0.4566
 epoch: 31, train_loss: 1.1491, test_loss: 1.1155, test_f1: 0.4482
 epoch: 32, train_loss: 1.1265, test_loss: 1.1155, test_f1: 0.4439
 epoch: 33, train_loss: 1.1348, test_loss: 1.1097, test_f1: 0.4332
 epoch: 34, train_loss: 1.1286, test_loss: 1.1081, test_f1: 0.4561
 epoch: 35, train_loss: 1.1215, test_loss: 1.1021, test_f1: 0.4387
 epoch: 36, train_loss: 1.1211, test_loss: 1.1024, test_f1: 0.4586
 epoch: 37, train_loss: 1.1184, test_loss: 1.0987, test_f1: 0.4526
 epoch: 38, train_loss: 1.1141, test_loss: 1.0920, test_f1: 0.4546
 epoch: 39, train_loss: 1.1115, test_loss: 1.0929, test_f1: 0.4572
 epoch: 40, train_loss: 1.1113, test_loss: 1.0878, test_f1: 0.4552
 epoch: 41, train_loss: 1.1006, test_loss: 1.0866, test_f1: 0.4609
 epoch: 42, train_loss: 1.1073, test_loss: 1.0849, test_f1: 0.4517
 epoch: 43, train_loss: 1.1011, test_loss: 1.0817, test_f1: 0.4602
 epoch: 44, train_loss: 1.0977, test_loss: 1.0814, test_f1: 0.4674
 epoch: 45, train_loss: 1.0929, test_loss: 1.0785, test_f1: 0.4640
 epoch: 46, train_loss: 1.0979, test_loss: 1.0751, test_f1: 0.4662
 epoch: 47, train_loss: 1.0865, test_loss: 1.0744, test_f1: 0.4621
 epoch: 48, train_loss: 1.0773, test_loss: 1.0751, test_f1: 0.4660
 epoch: 49, train_loss: 1.0815, test_loss: 1.0707, test_f1: 0.4736
 epoch: 50, train_loss: 1.0719, test_loss: 1.0703, test_f1: 0.4767
 epoch: 51, train_loss: 1.0732, test_loss: 1.0682, test_f1: 0.4770
 epoch: 52, train_loss: 1.0756, test_loss: 1.0672, test_f1: 0.4737
 epoch: 53, train_loss: 1.0705, test_loss: 1.0685, test_f1: 0.4772
 epoch: 54, train_loss: 1.0670, test_loss: 1.0649, test_f1: 0.4793
 epoch: 55, train_loss: 1.0661, test_loss: 1.0653, test_f1: 0.4787
 epoch: 56, train_loss: 1.0640, test_loss: 1.0661, test_f1: 0.4813
 epoch: 57, train_loss: 1.0825, test_loss: 1.0660, test_f1: 0.4791
 epoch: 58, train_loss: 1.0588, test_loss: 1.0652, test_f1: 0.4805
 epoch: 59, train_loss: 1.0670, test_loss: 1.0626, test_f1: 0.4812
 epoch: 60, train_loss: 1.0605, test_loss: 1.0615, test_f1: 0.4737
 epoch: 61, train_loss: 1.0663, test_loss: 1.0645, test_f1: 0.4787
 epoch: 62, train_loss: 1.0788, test_loss: 1.0618, test_f1: 0.4684
 epoch: 63, train_loss: 1.0548, test_loss: 1.0614, test_f1: 0.4685
 epoch: 64, train_loss: 1.0618, test_loss: 1.0642, test_f1: 0.4675
 epoch: 65, train_loss: 1.0614, test_loss: 1.0632, test_f1: 0.4686
 epoch: 66, train_loss: 1.0581, test_loss: 1.0648, test_f1: 0.4605
 epoch: 67, train_loss: 1.0477, test_loss: 1.0593, test_f1: 0.4753
 epoch: 68, train_loss: 1.0523, test_loss: 1.0646, test_f1: 0.4731
 epoch: 69, train_loss: 1.0627, test_loss: 1.0616, test_f1: 0.4729
 epoch: 70, train_loss: 1.0497, test_loss: 1.0650, test_f1: 0.4652
 epoch: 71, train_loss: 1.0406, test_loss: 1.0615, test_f1: 0.4789
 epoch: 72, train_loss: 1.0417, test_loss: 1.0567, test_f1: 0.4779
 epoch: 73, train_loss: 1.0466, test_loss: 1.0559, test_f1: 0.4728
 epoch: 74, train_loss: 1.0442, test_loss: 1.0561, test_f1: 0.4743
 epoch: 75, train_loss: 1.0519, test_loss: 1.0575, test_f1: 0.4726
 epoch: 76, train_loss: 1.0509, test_loss: 1.0534, test_f1: 0.4761
 epoch: 77, train_loss: 1.0427, test_loss: 1.0532, test_f1: 0.4714
 epoch: 78, train_loss: 1.0352, test_loss: 1.0560, test_f1: 0.4801
 epoch: 79, train_loss: 1.0403, test_loss: 1.0580, test_f1: 0.4721
 epoch: 80, train_loss: 1.0327, test_loss: 1.0585, test_f1: 0.4688
 epoch: 81, train_loss: 1.0347, test_loss: 1.0549, test_f1: 0.4806
 epoch: 82, train_loss: 1.0424, test_loss: 1.0596, test_f1: 0.4714
 epoch: 83, train_loss: 1.0348, test_loss: 1.0541, test_f1: 0.4759
 epoch: 84, train_loss: 1.0282, test_loss: 1.0548, test_f1: 0.4771
 epoch: 85, train_loss: 1.0402, test_loss: 1.0547, test_f1: 0.4769
 epoch: 86, train_loss: 1.0349, test_loss: 1.0582, test_f1: 0.4709
 epoch: 87, train_loss: 1.0351, test_loss: 1.0554, test_f1: 0.4714
 epoch: 88, train_loss: 1.0294, test_loss: 1.0555, test_f1: 0.4707
 epoch: 89, train_loss: 1.0352, test_loss: 1.0540, test_f1: 0.4750
 epoch: 90, train_loss: 1.0344, test_loss: 1.0480, test_f1: 0.4769
 epoch: 91, train_loss: 1.0273, test_loss: 1.0559, test_f1: 0.4752
 epoch: 92, train_loss: 1.0169, test_loss: 1.0538, test_f1: 0.4740
 epoch: 93, train_loss: 1.0184, test_loss: 1.0539, test_f1: 0.4747
 epoch: 94, train_loss: 1.0220, test_loss: 1.0570, test_f1: 0.4717
 epoch: 95, train_loss: 1.0280, test_loss: 1.0565, test_f1: 0.4729
 epoch: 96, train_loss: 1.0132, test_loss: 1.0538, test_f1: 0.4823
 epoch: 97, train_loss: 1.0269, test_loss: 1.0590, test_f1: 0.4666
 epoch: 98, train_loss: 1.0227, test_loss: 1.0545, test_f1: 0.4684
 epoch: 99, train_loss: 1.0095, test_loss: 1.0549, test_f1: 0.4737
##################ITERATION #5 ****************************************
 epoch: 0, train_loss: 1.3102, test_loss: 1.3085, test_f1: 0.2274
 epoch: 1, train_loss: 1.2881, test_loss: 1.2871, test_f1: 0.2274
 epoch: 2, train_loss: 1.2813, test_loss: 1.2781, test_f1: 0.2399
 epoch: 3, train_loss: 1.2726, test_loss: 1.2567, test_f1: 0.2274
 epoch: 4, train_loss: 1.2646, test_loss: 1.2463, test_f1: 0.2374
 epoch: 5, train_loss: 1.2599, test_loss: 1.2413, test_f1: 0.2620
 epoch: 6, train_loss: 1.2587, test_loss: 1.2350, test_f1: 0.2856
 epoch: 7, train_loss: 1.2434, test_loss: 1.2280, test_f1: 0.2851
 epoch: 8, train_loss: 1.2394, test_loss: 1.2230, test_f1: 0.3079
 epoch: 9, train_loss: 1.2316, test_loss: 1.2176, test_f1: 0.3276
 epoch: 10, train_loss: 1.2311, test_loss: 1.2102, test_f1: 0.3255
 epoch: 11, train_loss: 1.2246, test_loss: 1.2049, test_f1: 0.3295
 epoch: 12, train_loss: 1.2244, test_loss: 1.2039, test_f1: 0.3277
 epoch: 13, train_loss: 1.2191, test_loss: 1.1971, test_f1: 0.3325
 epoch: 14, train_loss: 1.2193, test_loss: 1.1911, test_f1: 0.3426
 epoch: 15, train_loss: 1.2060, test_loss: 1.1872, test_f1: 0.3431
 epoch: 16, train_loss: 1.2027, test_loss: 1.1821, test_f1: 0.3602
 epoch: 17, train_loss: 1.1983, test_loss: 1.1783, test_f1: 0.3828
 epoch: 18, train_loss: 1.1950, test_loss: 1.1750, test_f1: 0.3766
 epoch: 19, train_loss: 1.1885, test_loss: 1.1704, test_f1: 0.3946
 epoch: 20, train_loss: 1.1875, test_loss: 1.1695, test_f1: 0.3974
 epoch: 21, train_loss: 1.1874, test_loss: 1.1662, test_f1: 0.4031
 epoch: 22, train_loss: 1.1788, test_loss: 1.1627, test_f1: 0.4012
 epoch: 23, train_loss: 1.1757, test_loss: 1.1589, test_f1: 0.3999
 epoch: 24, train_loss: 1.1689, test_loss: 1.1569, test_f1: 0.4110
 epoch: 25, train_loss: 1.1648, test_loss: 1.1567, test_f1: 0.3980
 epoch: 26, train_loss: 1.1586, test_loss: 1.1520, test_f1: 0.4133
 epoch: 27, train_loss: 1.1626, test_loss: 1.1497, test_f1: 0.3901
 epoch: 28, train_loss: 1.1553, test_loss: 1.1428, test_f1: 0.4196
 epoch: 29, train_loss: 1.1566, test_loss: 1.1441, test_f1: 0.4115
 epoch: 30, train_loss: 1.1502, test_loss: 1.1371, test_f1: 0.3946
 epoch: 31, train_loss: 1.1464, test_loss: 1.1333, test_f1: 0.3979
 epoch: 32, train_loss: 1.1416, test_loss: 1.1340, test_f1: 0.3941
 epoch: 33, train_loss: 1.1400, test_loss: 1.1280, test_f1: 0.4088
 epoch: 34, train_loss: 1.1322, test_loss: 1.1228, test_f1: 0.4079
 epoch: 35, train_loss: 1.1350, test_loss: 1.1271, test_f1: 0.4008
 epoch: 36, train_loss: 1.1306, test_loss: 1.1210, test_f1: 0.3989
 epoch: 37, train_loss: 1.1260, test_loss: 1.1224, test_f1: 0.3962
 epoch: 38, train_loss: 1.1148, test_loss: 1.1188, test_f1: 0.4010
 epoch: 39, train_loss: 1.1202, test_loss: 1.1203, test_f1: 0.4002
 epoch: 40, train_loss: 1.1227, test_loss: 1.1197, test_f1: 0.4119
 epoch: 41, train_loss: 1.1234, test_loss: 1.1188, test_f1: 0.4107
 epoch: 42, train_loss: 1.1044, test_loss: 1.1163, test_f1: 0.4129
 epoch: 43, train_loss: 1.1060, test_loss: 1.1131, test_f1: 0.4141
 epoch: 44, train_loss: 1.1070, test_loss: 1.1129, test_f1: 0.4065
 epoch: 45, train_loss: 1.0992, test_loss: 1.1043, test_f1: 0.4138
 epoch: 46, train_loss: 1.0971, test_loss: 1.1105, test_f1: 0.4023
 epoch: 47, train_loss: 1.0926, test_loss: 1.1079, test_f1: 0.4058
 epoch: 48, train_loss: 1.0947, test_loss: 1.1042, test_f1: 0.4125
 epoch: 49, train_loss: 1.0811, test_loss: 1.1060, test_f1: 0.4140
 epoch: 50, train_loss: 1.0887, test_loss: 1.1075, test_f1: 0.4270
 epoch: 51, train_loss: 1.0874, test_loss: 1.0976, test_f1: 0.4188
 epoch: 52, train_loss: 1.0894, test_loss: 1.1034, test_f1: 0.4169
 epoch: 53, train_loss: 1.0903, test_loss: 1.1029, test_f1: 0.4102
 epoch: 54, train_loss: 1.0853, test_loss: 1.1023, test_f1: 0.4032
 epoch: 55, train_loss: 1.0727, test_loss: 1.1018, test_f1: 0.4036
 epoch: 56, train_loss: 1.0712, test_loss: 1.1067, test_f1: 0.4037
 epoch: 57, train_loss: 1.0856, test_loss: 1.0997, test_f1: 0.4156
 epoch: 58, train_loss: 1.0748, test_loss: 1.0952, test_f1: 0.4151
 epoch: 59, train_loss: 1.0753, test_loss: 1.1000, test_f1: 0.4172
 epoch: 60, train_loss: 1.0768, test_loss: 1.0994, test_f1: 0.4118
 epoch: 61, train_loss: 1.0722, test_loss: 1.0959, test_f1: 0.4141
 epoch: 62, train_loss: 1.0744, test_loss: 1.0968, test_f1: 0.4165
 epoch: 63, train_loss: 1.0628, test_loss: 1.0959, test_f1: 0.4139
 epoch: 64, train_loss: 1.0657, test_loss: 1.0938, test_f1: 0.4160
 epoch: 65, train_loss: 1.0666, test_loss: 1.0961, test_f1: 0.4151
 epoch: 66, train_loss: 1.0713, test_loss: 1.0924, test_f1: 0.4230
 epoch: 67, train_loss: 1.0666, test_loss: 1.0901, test_f1: 0.4221
 epoch: 68, train_loss: 1.0654, test_loss: 1.0991, test_f1: 0.4209
 epoch: 69, train_loss: 1.0649, test_loss: 1.0938, test_f1: 0.4187
 epoch: 70, train_loss: 1.0565, test_loss: 1.0949, test_f1: 0.4164
 epoch: 71, train_loss: 1.0611, test_loss: 1.0984, test_f1: 0.4172
 epoch: 72, train_loss: 1.0599, test_loss: 1.0934, test_f1: 0.4177
 epoch: 73, train_loss: 1.0595, test_loss: 1.0912, test_f1: 0.4184
 epoch: 74, train_loss: 1.0607, test_loss: 1.0944, test_f1: 0.4173
 epoch: 75, train_loss: 1.0519, test_loss: 1.0943, test_f1: 0.4180
 epoch: 76, train_loss: 1.0513, test_loss: 1.0925, test_f1: 0.4157
 epoch: 77, train_loss: 1.0457, test_loss: 1.0897, test_f1: 0.4194
 epoch: 78, train_loss: 1.0535, test_loss: 1.0944, test_f1: 0.4117
 epoch: 79, train_loss: 1.0578, test_loss: 1.0947, test_f1: 0.4206
 epoch: 80, train_loss: 1.0540, test_loss: 1.0894, test_f1: 0.4209
 epoch: 81, train_loss: 1.0498, test_loss: 1.0860, test_f1: 0.4207
 epoch: 82, train_loss: 1.0447, test_loss: 1.0895, test_f1: 0.4193
 epoch: 83, train_loss: 1.0450, test_loss: 1.0972, test_f1: 0.4203
 epoch: 84, train_loss: 1.0465, test_loss: 1.0945, test_f1: 0.4125
 epoch: 85, train_loss: 1.0486, test_loss: 1.0920, test_f1: 0.4164
 epoch: 86, train_loss: 1.0442, test_loss: 1.0964, test_f1: 0.4139
 epoch: 87, train_loss: 1.0423, test_loss: 1.0900, test_f1: 0.4138
 epoch: 88, train_loss: 1.0324, test_loss: 1.0972, test_f1: 0.4165
 epoch: 89, train_loss: 1.0362, test_loss: 1.0884, test_f1: 0.4186
 epoch: 90, train_loss: 1.0459, test_loss: 1.0888, test_f1: 0.4226
 epoch: 91, train_loss: 1.0463, test_loss: 1.0816, test_f1: 0.4198
 epoch: 92, train_loss: 1.0426, test_loss: 1.0832, test_f1: 0.4257
 epoch: 93, train_loss: 1.0367, test_loss: 1.0917, test_f1: 0.4238
 epoch: 94, train_loss: 1.0412, test_loss: 1.0871, test_f1: 0.4284
 epoch: 95, train_loss: 1.0364, test_loss: 1.0783, test_f1: 0.4256
 epoch: 96, train_loss: 1.0320, test_loss: 1.0827, test_f1: 0.4217
 epoch: 97, train_loss: 1.0387, test_loss: 1.0842, test_f1: 0.4229
 epoch: 98, train_loss: 1.0404, test_loss: 1.0781, test_f1: 0.4270
 epoch: 99, train_loss: 1.0312, test_loss: 1.0820, test_f1: 0.4248
##################ITERATION #6 ****************************************
 epoch: 0, train_loss: 1.3114, test_loss: 1.3194, test_f1: 0.2274
 epoch: 1, train_loss: 1.2962, test_loss: 1.2989, test_f1: 0.2555
 epoch: 2, train_loss: 1.2825, test_loss: 1.2846, test_f1: 0.2553
 epoch: 3, train_loss: 1.2810, test_loss: 1.2659, test_f1: 0.2742
 epoch: 4, train_loss: 1.2659, test_loss: 1.2560, test_f1: 0.2753
 epoch: 5, train_loss: 1.2601, test_loss: 1.2506, test_f1: 0.2717
 epoch: 6, train_loss: 1.2605, test_loss: 1.2430, test_f1: 0.2955
 epoch: 7, train_loss: 1.2533, test_loss: 1.2347, test_f1: 0.3021
 epoch: 8, train_loss: 1.2455, test_loss: 1.2289, test_f1: 0.3124
 epoch: 9, train_loss: 1.2358, test_loss: 1.2212, test_f1: 0.3132
 epoch: 10, train_loss: 1.2399, test_loss: 1.2169, test_f1: 0.3117
 epoch: 11, train_loss: 1.2300, test_loss: 1.2135, test_f1: 0.3220
 epoch: 12, train_loss: 1.2284, test_loss: 1.2081, test_f1: 0.3392
 epoch: 13, train_loss: 1.2207, test_loss: 1.2020, test_f1: 0.3374
 epoch: 14, train_loss: 1.2178, test_loss: 1.2005, test_f1: 0.3479
 epoch: 15, train_loss: 1.2188, test_loss: 1.1969, test_f1: 0.3632
 epoch: 16, train_loss: 1.2156, test_loss: 1.1940, test_f1: 0.3706
 epoch: 17, train_loss: 1.2142, test_loss: 1.1922, test_f1: 0.3813
 epoch: 18, train_loss: 1.2151, test_loss: 1.1909, test_f1: 0.3850
 epoch: 19, train_loss: 1.2035, test_loss: 1.1859, test_f1: 0.3875
 epoch: 20, train_loss: 1.1977, test_loss: 1.1845, test_f1: 0.3841
 epoch: 21, train_loss: 1.2059, test_loss: 1.1823, test_f1: 0.3925
 epoch: 22, train_loss: 1.1991, test_loss: 1.1793, test_f1: 0.3877
 epoch: 23, train_loss: 1.1973, test_loss: 1.1737, test_f1: 0.3918
 epoch: 24, train_loss: 1.1889, test_loss: 1.1713, test_f1: 0.3972
 epoch: 25, train_loss: 1.1869, test_loss: 1.1697, test_f1: 0.4011
 epoch: 26, train_loss: 1.1903, test_loss: 1.1686, test_f1: 0.4007
 epoch: 27, train_loss: 1.1826, test_loss: 1.1663, test_f1: 0.4059
 epoch: 28, train_loss: 1.1819, test_loss: 1.1617, test_f1: 0.4090
 epoch: 29, train_loss: 1.1799, test_loss: 1.1596, test_f1: 0.4096
 epoch: 30, train_loss: 1.1776, test_loss: 1.1575, test_f1: 0.4119
 epoch: 31, train_loss: 1.1741, test_loss: 1.1562, test_f1: 0.4136
 epoch: 32, train_loss: 1.1808, test_loss: 1.1576, test_f1: 0.4187
 epoch: 33, train_loss: 1.1636, test_loss: 1.1534, test_f1: 0.4153
 epoch: 34, train_loss: 1.1651, test_loss: 1.1498, test_f1: 0.4198
 epoch: 35, train_loss: 1.1557, test_loss: 1.1464, test_f1: 0.4181
 epoch: 36, train_loss: 1.1588, test_loss: 1.1461, test_f1: 0.4195
 epoch: 37, train_loss: 1.1578, test_loss: 1.1439, test_f1: 0.4175
 epoch: 38, train_loss: 1.1601, test_loss: 1.1447, test_f1: 0.4177
 epoch: 39, train_loss: 1.1445, test_loss: 1.1414, test_f1: 0.4268
 epoch: 40, train_loss: 1.1535, test_loss: 1.1393, test_f1: 0.4215
 epoch: 41, train_loss: 1.1487, test_loss: 1.1402, test_f1: 0.4176
 epoch: 42, train_loss: 1.1478, test_loss: 1.1393, test_f1: 0.4256
 epoch: 43, train_loss: 1.1409, test_loss: 1.1428, test_f1: 0.4195
 epoch: 44, train_loss: 1.1380, test_loss: 1.1403, test_f1: 0.4207
 epoch: 45, train_loss: 1.1375, test_loss: 1.1367, test_f1: 0.4192
 epoch: 46, train_loss: 1.1317, test_loss: 1.1326, test_f1: 0.4267
 epoch: 47, train_loss: 1.1251, test_loss: 1.1318, test_f1: 0.4228
 epoch: 48, train_loss: 1.1397, test_loss: 1.1328, test_f1: 0.4248
 epoch: 49, train_loss: 1.1273, test_loss: 1.1356, test_f1: 0.4344
 epoch: 50, train_loss: 1.1297, test_loss: 1.1283, test_f1: 0.4231
 epoch: 51, train_loss: 1.1218, test_loss: 1.1354, test_f1: 0.4180
 epoch: 52, train_loss: 1.1231, test_loss: 1.1342, test_f1: 0.4219
 epoch: 53, train_loss: 1.1216, test_loss: 1.1325, test_f1: 0.4187
 epoch: 54, train_loss: 1.1233, test_loss: 1.1305, test_f1: 0.4259
 epoch: 55, train_loss: 1.1214, test_loss: 1.1336, test_f1: 0.4197
 epoch: 56, train_loss: 1.1150, test_loss: 1.1264, test_f1: 0.4318
 epoch: 57, train_loss: 1.1201, test_loss: 1.1274, test_f1: 0.4328
 epoch: 58, train_loss: 1.1172, test_loss: 1.1252, test_f1: 0.4295
 epoch: 59, train_loss: 1.1117, test_loss: 1.1198, test_f1: 0.4195
 epoch: 60, train_loss: 1.1182, test_loss: 1.1284, test_f1: 0.4178
 epoch: 61, train_loss: 1.1109, test_loss: 1.1226, test_f1: 0.4193
 epoch: 62, train_loss: 1.1111, test_loss: 1.1204, test_f1: 0.4254
 epoch: 63, train_loss: 1.1043, test_loss: 1.1217, test_f1: 0.4149
 epoch: 64, train_loss: 1.1167, test_loss: 1.1235, test_f1: 0.4332
 epoch: 65, train_loss: 1.1092, test_loss: 1.1178, test_f1: 0.4206
 epoch: 66, train_loss: 1.1092, test_loss: 1.1220, test_f1: 0.4361
 epoch: 67, train_loss: 1.1084, test_loss: 1.1218, test_f1: 0.4108
 epoch: 68, train_loss: 1.1034, test_loss: 1.1227, test_f1: 0.4155
 epoch: 69, train_loss: 1.1082, test_loss: 1.1188, test_f1: 0.4193
 epoch: 70, train_loss: 1.0988, test_loss: 1.1223, test_f1: 0.4142
 epoch: 71, train_loss: 1.1050, test_loss: 1.1155, test_f1: 0.4199
 epoch: 72, train_loss: 1.0973, test_loss: 1.1131, test_f1: 0.4166
 epoch: 73, train_loss: 1.0981, test_loss: 1.1156, test_f1: 0.4140
 epoch: 74, train_loss: 1.0834, test_loss: 1.1152, test_f1: 0.4342
 epoch: 75, train_loss: 1.0991, test_loss: 1.1130, test_f1: 0.4243
 epoch: 76, train_loss: 1.0961, test_loss: 1.1101, test_f1: 0.4222
 epoch: 77, train_loss: 1.0923, test_loss: 1.1130, test_f1: 0.4257
 epoch: 78, train_loss: 1.0982, test_loss: 1.1171, test_f1: 0.4213
 epoch: 79, train_loss: 1.0948, test_loss: 1.1080, test_f1: 0.4137
 epoch: 80, train_loss: 1.0968, test_loss: 1.1096, test_f1: 0.4179
 epoch: 81, train_loss: 1.0907, test_loss: 1.1049, test_f1: 0.4242
 epoch: 82, train_loss: 1.0853, test_loss: 1.1056, test_f1: 0.4232
 epoch: 83, train_loss: 1.0953, test_loss: 1.1027, test_f1: 0.4248
 epoch: 84, train_loss: 1.0915, test_loss: 1.1044, test_f1: 0.4232
 epoch: 85, train_loss: 1.0866, test_loss: 1.1048, test_f1: 0.4233
 epoch: 86, train_loss: 1.0919, test_loss: 1.1091, test_f1: 0.4290
 epoch: 87, train_loss: 1.0848, test_loss: 1.1025, test_f1: 0.4135
 epoch: 88, train_loss: 1.0811, test_loss: 1.1008, test_f1: 0.4161
 epoch: 89, train_loss: 1.0869, test_loss: 1.1086, test_f1: 0.4158
 epoch: 90, train_loss: 1.0767, test_loss: 1.0970, test_f1: 0.4278
 epoch: 91, train_loss: 1.0821, test_loss: 1.0985, test_f1: 0.4267
 epoch: 92, train_loss: 1.0767, test_loss: 1.0990, test_f1: 0.4161
 epoch: 93, train_loss: 1.0838, test_loss: 1.0998, test_f1: 0.4218
 epoch: 94, train_loss: 1.0726, test_loss: 1.1012, test_f1: 0.4223
 epoch: 95, train_loss: 1.0671, test_loss: 1.1023, test_f1: 0.4198
 epoch: 96, train_loss: 1.0738, test_loss: 1.0969, test_f1: 0.4203
 epoch: 97, train_loss: 1.0760, test_loss: 1.0963, test_f1: 0.4247
 epoch: 98, train_loss: 1.0723, test_loss: 1.0945, test_f1: 0.4292
 epoch: 99, train_loss: 1.0806, test_loss: 1.0958, test_f1: 0.4295
##################ITERATION #7 ****************************************
 epoch: 0, train_loss: 1.3213, test_loss: 1.3054, test_f1: 0.2274
 epoch: 1, train_loss: 1.2859, test_loss: 1.2734, test_f1: 0.2555
 epoch: 2, train_loss: 1.2719, test_loss: 1.2535, test_f1: 0.2580
 epoch: 3, train_loss: 1.2614, test_loss: 1.2439, test_f1: 0.2606
 epoch: 4, train_loss: 1.2517, test_loss: 1.2321, test_f1: 0.2743
 epoch: 5, train_loss: 1.2445, test_loss: 1.2204, test_f1: 0.3086
 epoch: 6, train_loss: 1.2418, test_loss: 1.2167, test_f1: 0.3211
 epoch: 7, train_loss: 1.2349, test_loss: 1.2123, test_f1: 0.3382
 epoch: 8, train_loss: 1.2321, test_loss: 1.2050, test_f1: 0.3412
 epoch: 9, train_loss: 1.2226, test_loss: 1.1989, test_f1: 0.3568
 epoch: 10, train_loss: 1.2194, test_loss: 1.1928, test_f1: 0.3661
 epoch: 11, train_loss: 1.2162, test_loss: 1.1892, test_f1: 0.3707
 epoch: 12, train_loss: 1.2113, test_loss: 1.1844, test_f1: 0.3718
 epoch: 13, train_loss: 1.2059, test_loss: 1.1786, test_f1: 0.3867
 epoch: 14, train_loss: 1.2064, test_loss: 1.1738, test_f1: 0.3742
 epoch: 15, train_loss: 1.2009, test_loss: 1.1698, test_f1: 0.3860
 epoch: 16, train_loss: 1.1966, test_loss: 1.1662, test_f1: 0.3964
 epoch: 17, train_loss: 1.1983, test_loss: 1.1617, test_f1: 0.3891
 epoch: 18, train_loss: 1.1865, test_loss: 1.1573, test_f1: 0.4034
 epoch: 19, train_loss: 1.1881, test_loss: 1.1522, test_f1: 0.4094
 epoch: 20, train_loss: 1.1825, test_loss: 1.1489, test_f1: 0.4152
 epoch: 21, train_loss: 1.1722, test_loss: 1.1459, test_f1: 0.4013
 epoch: 22, train_loss: 1.1747, test_loss: 1.1401, test_f1: 0.4224
 epoch: 23, train_loss: 1.1726, test_loss: 1.1369, test_f1: 0.4241
 epoch: 24, train_loss: 1.1719, test_loss: 1.1326, test_f1: 0.4240
 epoch: 25, train_loss: 1.1666, test_loss: 1.1277, test_f1: 0.4083
 epoch: 26, train_loss: 1.1638, test_loss: 1.1238, test_f1: 0.4166
 epoch: 27, train_loss: 1.1521, test_loss: 1.1193, test_f1: 0.4246
 epoch: 28, train_loss: 1.1481, test_loss: 1.1124, test_f1: 0.4294
 epoch: 29, train_loss: 1.1525, test_loss: 1.1079, test_f1: 0.4251
 epoch: 30, train_loss: 1.1527, test_loss: 1.1040, test_f1: 0.4092
 epoch: 31, train_loss: 1.1429, test_loss: 1.0997, test_f1: 0.4163
 epoch: 32, train_loss: 1.1457, test_loss: 1.0982, test_f1: 0.4121
 epoch: 33, train_loss: 1.1403, test_loss: 1.0966, test_f1: 0.4003
 epoch: 34, train_loss: 1.1285, test_loss: 1.0914, test_f1: 0.4158
 epoch: 35, train_loss: 1.1324, test_loss: 1.0892, test_f1: 0.4095
 epoch: 36, train_loss: 1.1252, test_loss: 1.0818, test_f1: 0.4161
 epoch: 37, train_loss: 1.1218, test_loss: 1.0815, test_f1: 0.4272
 epoch: 38, train_loss: 1.1196, test_loss: 1.0770, test_f1: 0.4212
 epoch: 39, train_loss: 1.1206, test_loss: 1.0728, test_f1: 0.4212
 epoch: 40, train_loss: 1.1134, test_loss: 1.0733, test_f1: 0.4431
 epoch: 41, train_loss: 1.1176, test_loss: 1.0667, test_f1: 0.4291
 epoch: 42, train_loss: 1.1040, test_loss: 1.0668, test_f1: 0.4165
 epoch: 43, train_loss: 1.1142, test_loss: 1.0654, test_f1: 0.4263
 epoch: 44, train_loss: 1.1046, test_loss: 1.0604, test_f1: 0.4256
 epoch: 45, train_loss: 1.1056, test_loss: 1.0614, test_f1: 0.4493
 epoch: 46, train_loss: 1.0993, test_loss: 1.0592, test_f1: 0.4473
 epoch: 47, train_loss: 1.0931, test_loss: 1.0544, test_f1: 0.4523
 epoch: 48, train_loss: 1.0990, test_loss: 1.0547, test_f1: 0.4400
 epoch: 49, train_loss: 1.0896, test_loss: 1.0500, test_f1: 0.4531
 epoch: 50, train_loss: 1.0879, test_loss: 1.0540, test_f1: 0.4430
 epoch: 51, train_loss: 1.0784, test_loss: 1.0547, test_f1: 0.4496
 epoch: 52, train_loss: 1.0798, test_loss: 1.0526, test_f1: 0.4451
 epoch: 53, train_loss: 1.0820, test_loss: 1.0504, test_f1: 0.4399
 epoch: 54, train_loss: 1.0771, test_loss: 1.0489, test_f1: 0.4439
 epoch: 55, train_loss: 1.0733, test_loss: 1.0487, test_f1: 0.4326
 epoch: 56, train_loss: 1.0666, test_loss: 1.0471, test_f1: 0.4404
 epoch: 57, train_loss: 1.0689, test_loss: 1.0460, test_f1: 0.4491
 epoch: 58, train_loss: 1.0762, test_loss: 1.0441, test_f1: 0.4428
 epoch: 59, train_loss: 1.0707, test_loss: 1.0436, test_f1: 0.4365
 epoch: 60, train_loss: 1.0701, test_loss: 1.0401, test_f1: 0.4415
 epoch: 61, train_loss: 1.0676, test_loss: 1.0411, test_f1: 0.4293
 epoch: 62, train_loss: 1.0639, test_loss: 1.0415, test_f1: 0.4454
 epoch: 63, train_loss: 1.0661, test_loss: 1.0409, test_f1: 0.4421
 epoch: 64, train_loss: 1.0666, test_loss: 1.0362, test_f1: 0.4538
 epoch: 65, train_loss: 1.0662, test_loss: 1.0385, test_f1: 0.4529
 epoch: 66, train_loss: 1.0726, test_loss: 1.0322, test_f1: 0.4430
 epoch: 67, train_loss: 1.0531, test_loss: 1.0353, test_f1: 0.4628
 epoch: 68, train_loss: 1.0680, test_loss: 1.0323, test_f1: 0.4500
 epoch: 69, train_loss: 1.0588, test_loss: 1.0359, test_f1: 0.4536
 epoch: 70, train_loss: 1.0521, test_loss: 1.0296, test_f1: 0.4347
 epoch: 71, train_loss: 1.0528, test_loss: 1.0294, test_f1: 0.4667
 epoch: 72, train_loss: 1.0535, test_loss: 1.0313, test_f1: 0.4519
 epoch: 73, train_loss: 1.0532, test_loss: 1.0274, test_f1: 0.4558
 epoch: 74, train_loss: 1.0530, test_loss: 1.0284, test_f1: 0.4569
 epoch: 75, train_loss: 1.0541, test_loss: 1.0256, test_f1: 0.4478
 epoch: 76, train_loss: 1.0462, test_loss: 1.0276, test_f1: 0.4424
 epoch: 77, train_loss: 1.0463, test_loss: 1.0232, test_f1: 0.4601
 epoch: 78, train_loss: 1.0479, test_loss: 1.0286, test_f1: 0.4549
 epoch: 79, train_loss: 1.0382, test_loss: 1.0248, test_f1: 0.4611
 epoch: 80, train_loss: 1.0448, test_loss: 1.0212, test_f1: 0.4692
 epoch: 81, train_loss: 1.0497, test_loss: 1.0236, test_f1: 0.4596
 epoch: 82, train_loss: 1.0453, test_loss: 1.0224, test_f1: 0.4448
 epoch: 83, train_loss: 1.0487, test_loss: 1.0184, test_f1: 0.4525
 epoch: 84, train_loss: 1.0436, test_loss: 1.0165, test_f1: 0.4565
 epoch: 85, train_loss: 1.0348, test_loss: 1.0189, test_f1: 0.4672
 epoch: 86, train_loss: 1.0308, test_loss: 1.0192, test_f1: 0.4725
 epoch: 87, train_loss: 1.0415, test_loss: 1.0221, test_f1: 0.4746
 epoch: 88, train_loss: 1.0356, test_loss: 1.0217, test_f1: 0.4621
 epoch: 89, train_loss: 1.0343, test_loss: 1.0180, test_f1: 0.4731
 epoch: 90, train_loss: 1.0350, test_loss: 1.0159, test_f1: 0.4570
 epoch: 91, train_loss: 1.0300, test_loss: 1.0202, test_f1: 0.4671
 epoch: 92, train_loss: 1.0351, test_loss: 1.0155, test_f1: 0.4729
 epoch: 93, train_loss: 1.0300, test_loss: 1.0180, test_f1: 0.4648
 epoch: 94, train_loss: 1.0280, test_loss: 1.0186, test_f1: 0.4739
 epoch: 95, train_loss: 1.0346, test_loss: 1.0166, test_f1: 0.4785
 epoch: 96, train_loss: 1.0409, test_loss: 1.0206, test_f1: 0.4832
 epoch: 97, train_loss: 1.0275, test_loss: 1.0142, test_f1: 0.4766
 epoch: 98, train_loss: 1.0118, test_loss: 1.0085, test_f1: 0.4802
 epoch: 99, train_loss: 1.0167, test_loss: 1.0128, test_f1: 0.4654
##################ITERATION #8 ****************************************
 epoch: 0, train_loss: 1.3423, test_loss: 1.3461, test_f1: 0.2274
 epoch: 1, train_loss: 1.3060, test_loss: 1.3408, test_f1: 0.2274
 epoch: 2, train_loss: 1.2801, test_loss: 1.2982, test_f1: 0.2274
 epoch: 3, train_loss: 1.2718, test_loss: 1.2758, test_f1: 0.2327
 epoch: 4, train_loss: 1.2662, test_loss: 1.2626, test_f1: 0.2553
 epoch: 5, train_loss: 1.2581, test_loss: 1.2545, test_f1: 0.2736
 epoch: 6, train_loss: 1.2547, test_loss: 1.2454, test_f1: 0.2888
 epoch: 7, train_loss: 1.2426, test_loss: 1.2369, test_f1: 0.3002
 epoch: 8, train_loss: 1.2409, test_loss: 1.2288, test_f1: 0.3154
 epoch: 9, train_loss: 1.2363, test_loss: 1.2242, test_f1: 0.3374
 epoch: 10, train_loss: 1.2306, test_loss: 1.2149, test_f1: 0.3538
 epoch: 11, train_loss: 1.2264, test_loss: 1.2046, test_f1: 0.3658
 epoch: 12, train_loss: 1.2189, test_loss: 1.2010, test_f1: 0.3653
 epoch: 13, train_loss: 1.2125, test_loss: 1.1963, test_f1: 0.3711
 epoch: 14, train_loss: 1.2066, test_loss: 1.1920, test_f1: 0.3843
 epoch: 15, train_loss: 1.2072, test_loss: 1.1886, test_f1: 0.3898
 epoch: 16, train_loss: 1.2006, test_loss: 1.1849, test_f1: 0.3917
 epoch: 17, train_loss: 1.2019, test_loss: 1.1808, test_f1: 0.4007
 epoch: 18, train_loss: 1.2019, test_loss: 1.1751, test_f1: 0.4067
 epoch: 19, train_loss: 1.1957, test_loss: 1.1687, test_f1: 0.4139
 epoch: 20, train_loss: 1.1885, test_loss: 1.1628, test_f1: 0.4085
 epoch: 21, train_loss: 1.1811, test_loss: 1.1615, test_f1: 0.4109
 epoch: 22, train_loss: 1.1889, test_loss: 1.1596, test_f1: 0.4114
 epoch: 23, train_loss: 1.1798, test_loss: 1.1609, test_f1: 0.3960
 epoch: 24, train_loss: 1.1773, test_loss: 1.1548, test_f1: 0.4135
 epoch: 25, train_loss: 1.1838, test_loss: 1.1519, test_f1: 0.4109
 epoch: 26, train_loss: 1.1747, test_loss: 1.1504, test_f1: 0.4181
 epoch: 27, train_loss: 1.1750, test_loss: 1.1458, test_f1: 0.4154
 epoch: 28, train_loss: 1.1769, test_loss: 1.1467, test_f1: 0.4154
 epoch: 29, train_loss: 1.1693, test_loss: 1.1440, test_f1: 0.4059
 epoch: 30, train_loss: 1.1644, test_loss: 1.1430, test_f1: 0.4147
 epoch: 31, train_loss: 1.1743, test_loss: 1.1353, test_f1: 0.4242
 epoch: 32, train_loss: 1.1599, test_loss: 1.1343, test_f1: 0.4226
 epoch: 33, train_loss: 1.1580, test_loss: 1.1285, test_f1: 0.4195
 epoch: 34, train_loss: 1.1513, test_loss: 1.1272, test_f1: 0.4156
 epoch: 35, train_loss: 1.1570, test_loss: 1.1233, test_f1: 0.4265
 epoch: 36, train_loss: 1.1577, test_loss: 1.1215, test_f1: 0.4235
 epoch: 37, train_loss: 1.1494, test_loss: 1.1219, test_f1: 0.4180
 epoch: 38, train_loss: 1.1486, test_loss: 1.1168, test_f1: 0.4233
 epoch: 39, train_loss: 1.1473, test_loss: 1.1147, test_f1: 0.4192
 epoch: 40, train_loss: 1.1366, test_loss: 1.1155, test_f1: 0.4254
 epoch: 41, train_loss: 1.1461, test_loss: 1.1127, test_f1: 0.4296
 epoch: 42, train_loss: 1.1345, test_loss: 1.1166, test_f1: 0.4207
 epoch: 43, train_loss: 1.1319, test_loss: 1.1118, test_f1: 0.4161
 epoch: 44, train_loss: 1.1332, test_loss: 1.1037, test_f1: 0.4292
 epoch: 45, train_loss: 1.1335, test_loss: 1.1067, test_f1: 0.4292
 epoch: 46, train_loss: 1.1364, test_loss: 1.1060, test_f1: 0.4243
 epoch: 47, train_loss: 1.1271, test_loss: 1.1040, test_f1: 0.4272
 epoch: 48, train_loss: 1.1277, test_loss: 1.1024, test_f1: 0.4248
 epoch: 49, train_loss: 1.1249, test_loss: 1.1093, test_f1: 0.4216
 epoch: 50, train_loss: 1.1239, test_loss: 1.1036, test_f1: 0.4310
 epoch: 51, train_loss: 1.1239, test_loss: 1.1032, test_f1: 0.4208
 epoch: 52, train_loss: 1.1168, test_loss: 1.1012, test_f1: 0.4240
 epoch: 53, train_loss: 1.1344, test_loss: 1.1047, test_f1: 0.4179
 epoch: 54, train_loss: 1.1274, test_loss: 1.1006, test_f1: 0.4304
 epoch: 55, train_loss: 1.1193, test_loss: 1.1031, test_f1: 0.4235
 epoch: 56, train_loss: 1.1120, test_loss: 1.1034, test_f1: 0.4267
 epoch: 57, train_loss: 1.1232, test_loss: 1.1019, test_f1: 0.4238
 epoch: 58, train_loss: 1.1147, test_loss: 1.1013, test_f1: 0.4236
 epoch: 59, train_loss: 1.1206, test_loss: 1.0991, test_f1: 0.4253
 epoch: 60, train_loss: 1.1135, test_loss: 1.0986, test_f1: 0.4291
 epoch: 61, train_loss: 1.1110, test_loss: 1.1026, test_f1: 0.4278
 epoch: 62, train_loss: 1.1182, test_loss: 1.1014, test_f1: 0.4249
 epoch: 63, train_loss: 1.1209, test_loss: 1.0933, test_f1: 0.4231
 epoch: 64, train_loss: 1.1151, test_loss: 1.0926, test_f1: 0.4232
 epoch: 65, train_loss: 1.1000, test_loss: 1.0872, test_f1: 0.4303
 epoch: 66, train_loss: 1.1159, test_loss: 1.0869, test_f1: 0.4325
 epoch: 67, train_loss: 1.1186, test_loss: 1.0885, test_f1: 0.4325
 epoch: 68, train_loss: 1.1134, test_loss: 1.0918, test_f1: 0.4296
 epoch: 69, train_loss: 1.0951, test_loss: 1.0877, test_f1: 0.4288
 epoch: 70, train_loss: 1.1026, test_loss: 1.0890, test_f1: 0.4271
 epoch: 71, train_loss: 1.1042, test_loss: 1.0912, test_f1: 0.4206
 epoch: 72, train_loss: 1.1139, test_loss: 1.0887, test_f1: 0.4240
 epoch: 73, train_loss: 1.1073, test_loss: 1.0854, test_f1: 0.4282
 epoch: 74, train_loss: 1.1053, test_loss: 1.0864, test_f1: 0.4290
 epoch: 75, train_loss: 1.1058, test_loss: 1.0808, test_f1: 0.4280
 epoch: 76, train_loss: 1.1044, test_loss: 1.0851, test_f1: 0.4213
 epoch: 77, train_loss: 1.0976, test_loss: 1.0814, test_f1: 0.4273
 epoch: 78, train_loss: 1.0891, test_loss: 1.0872, test_f1: 0.4208
 epoch: 79, train_loss: 1.0880, test_loss: 1.0894, test_f1: 0.4195
 epoch: 80, train_loss: 1.1026, test_loss: 1.0873, test_f1: 0.4183
 epoch: 81, train_loss: 1.0948, test_loss: 1.0828, test_f1: 0.4223
 epoch: 82, train_loss: 1.0957, test_loss: 1.0846, test_f1: 0.4324
 epoch: 83, train_loss: 1.0999, test_loss: 1.0816, test_f1: 0.4268
 epoch: 84, train_loss: 1.0924, test_loss: 1.0808, test_f1: 0.4210
 epoch: 85, train_loss: 1.0885, test_loss: 1.0785, test_f1: 0.4222
 epoch: 86, train_loss: 1.0928, test_loss: 1.0800, test_f1: 0.4296
 epoch: 87, train_loss: 1.0955, test_loss: 1.0842, test_f1: 0.4260
 epoch: 88, train_loss: 1.0987, test_loss: 1.0838, test_f1: 0.4229
 epoch: 89, train_loss: 1.0945, test_loss: 1.0793, test_f1: 0.4308
 epoch: 90, train_loss: 1.0966, test_loss: 1.0818, test_f1: 0.4247
 epoch: 91, train_loss: 1.0906, test_loss: 1.0805, test_f1: 0.4322
 epoch: 92, train_loss: 1.0892, test_loss: 1.0773, test_f1: 0.4246
 epoch: 93, train_loss: 1.0890, test_loss: 1.0752, test_f1: 0.4250
 epoch: 94, train_loss: 1.0959, test_loss: 1.0753, test_f1: 0.4240
 epoch: 95, train_loss: 1.0852, test_loss: 1.0789, test_f1: 0.4207
 epoch: 96, train_loss: 1.0923, test_loss: 1.0766, test_f1: 0.4250
 epoch: 97, train_loss: 1.0782, test_loss: 1.0748, test_f1: 0.4268
 epoch: 98, train_loss: 1.0912, test_loss: 1.0715, test_f1: 0.4267
 epoch: 99, train_loss: 1.0921, test_loss: 1.0763, test_f1: 0.4283
##################ITERATION #9 ****************************************
 epoch: 0, train_loss: 1.3279, test_loss: 1.3103, test_f1: 0.2274
 epoch: 1, train_loss: 1.2936, test_loss: 1.2925, test_f1: 0.2300
 epoch: 2, train_loss: 1.2863, test_loss: 1.2751, test_f1: 0.2375
 epoch: 3, train_loss: 1.2755, test_loss: 1.2634, test_f1: 0.2499
 epoch: 4, train_loss: 1.2610, test_loss: 1.2523, test_f1: 0.2551
 epoch: 5, train_loss: 1.2597, test_loss: 1.2440, test_f1: 0.2566
 epoch: 6, train_loss: 1.2569, test_loss: 1.2370, test_f1: 0.2642
 epoch: 7, train_loss: 1.2441, test_loss: 1.2290, test_f1: 0.3212
 epoch: 8, train_loss: 1.2431, test_loss: 1.2214, test_f1: 0.3341
 epoch: 9, train_loss: 1.2346, test_loss: 1.2142, test_f1: 0.3533
 epoch: 10, train_loss: 1.2334, test_loss: 1.2088, test_f1: 0.3621
 epoch: 11, train_loss: 1.2308, test_loss: 1.2060, test_f1: 0.3684
 epoch: 12, train_loss: 1.2175, test_loss: 1.2004, test_f1: 0.3691
 epoch: 13, train_loss: 1.2150, test_loss: 1.1950, test_f1: 0.3765
 epoch: 14, train_loss: 1.2120, test_loss: 1.1898, test_f1: 0.3792
 epoch: 15, train_loss: 1.2134, test_loss: 1.1828, test_f1: 0.3797
 epoch: 16, train_loss: 1.2070, test_loss: 1.1787, test_f1: 0.3808
 epoch: 17, train_loss: 1.1960, test_loss: 1.1752, test_f1: 0.3842
 epoch: 18, train_loss: 1.1984, test_loss: 1.1721, test_f1: 0.3910
 epoch: 19, train_loss: 1.2032, test_loss: 1.1703, test_f1: 0.4023
 epoch: 20, train_loss: 1.1870, test_loss: 1.1630, test_f1: 0.3943
 epoch: 21, train_loss: 1.1825, test_loss: 1.1584, test_f1: 0.3969
 epoch: 22, train_loss: 1.1868, test_loss: 1.1542, test_f1: 0.4001
 epoch: 23, train_loss: 1.1813, test_loss: 1.1531, test_f1: 0.4131
 epoch: 24, train_loss: 1.1693, test_loss: 1.1450, test_f1: 0.4084
 epoch: 25, train_loss: 1.1646, test_loss: 1.1441, test_f1: 0.4114
 epoch: 26, train_loss: 1.1643, test_loss: 1.1430, test_f1: 0.4019
 epoch: 27, train_loss: 1.1637, test_loss: 1.1362, test_f1: 0.4185
 epoch: 28, train_loss: 1.1593, test_loss: 1.1353, test_f1: 0.4145
 epoch: 29, train_loss: 1.1675, test_loss: 1.1315, test_f1: 0.4155
 epoch: 30, train_loss: 1.1559, test_loss: 1.1313, test_f1: 0.4152
 epoch: 31, train_loss: 1.1584, test_loss: 1.1243, test_f1: 0.4163
 epoch: 32, train_loss: 1.1542, test_loss: 1.1247, test_f1: 0.4173
 epoch: 33, train_loss: 1.1463, test_loss: 1.1246, test_f1: 0.4124
 epoch: 34, train_loss: 1.1392, test_loss: 1.1199, test_f1: 0.4116
 epoch: 35, train_loss: 1.1435, test_loss: 1.1154, test_f1: 0.4031
 epoch: 36, train_loss: 1.1354, test_loss: 1.1131, test_f1: 0.4106
 epoch: 37, train_loss: 1.1276, test_loss: 1.1086, test_f1: 0.4260
 epoch: 38, train_loss: 1.1330, test_loss: 1.1080, test_f1: 0.4154
 epoch: 39, train_loss: 1.1268, test_loss: 1.1007, test_f1: 0.4318
 epoch: 40, train_loss: 1.1161, test_loss: 1.0974, test_f1: 0.4291
 epoch: 41, train_loss: 1.1199, test_loss: 1.0963, test_f1: 0.4190
 epoch: 42, train_loss: 1.1178, test_loss: 1.0995, test_f1: 0.4275
 epoch: 43, train_loss: 1.1201, test_loss: 1.0974, test_f1: 0.4299
 epoch: 44, train_loss: 1.1145, test_loss: 1.0921, test_f1: 0.4303
 epoch: 45, train_loss: 1.1083, test_loss: 1.0961, test_f1: 0.4234
 epoch: 46, train_loss: 1.1005, test_loss: 1.0876, test_f1: 0.4267
 epoch: 47, train_loss: 1.0977, test_loss: 1.0819, test_f1: 0.4328
 epoch: 48, train_loss: 1.0945, test_loss: 1.0838, test_f1: 0.4412
 epoch: 49, train_loss: 1.0991, test_loss: 1.0801, test_f1: 0.4437
 epoch: 50, train_loss: 1.0976, test_loss: 1.0849, test_f1: 0.4369
 epoch: 51, train_loss: 1.0874, test_loss: 1.0841, test_f1: 0.4373
 epoch: 52, train_loss: 1.0889, test_loss: 1.0815, test_f1: 0.4358
 epoch: 53, train_loss: 1.0888, test_loss: 1.0817, test_f1: 0.4394
 epoch: 54, train_loss: 1.0874, test_loss: 1.0764, test_f1: 0.4420
 epoch: 55, train_loss: 1.0750, test_loss: 1.0745, test_f1: 0.4500
 epoch: 56, train_loss: 1.0783, test_loss: 1.0713, test_f1: 0.4502
 epoch: 57, train_loss: 1.0712, test_loss: 1.0754, test_f1: 0.4323
 epoch: 58, train_loss: 1.0816, test_loss: 1.0709, test_f1: 0.4393
 epoch: 59, train_loss: 1.0884, test_loss: 1.0735, test_f1: 0.4408
 epoch: 60, train_loss: 1.0800, test_loss: 1.0731, test_f1: 0.4434
 epoch: 61, train_loss: 1.0819, test_loss: 1.0728, test_f1: 0.4501
 epoch: 62, train_loss: 1.0821, test_loss: 1.0755, test_f1: 0.4436
 epoch: 63, train_loss: 1.0781, test_loss: 1.0728, test_f1: 0.4566
 epoch: 64, train_loss: 1.0785, test_loss: 1.0693, test_f1: 0.4562
 epoch: 65, train_loss: 1.0696, test_loss: 1.0667, test_f1: 0.4463
 epoch: 66, train_loss: 1.0693, test_loss: 1.0703, test_f1: 0.4546
 epoch: 67, train_loss: 1.0661, test_loss: 1.0720, test_f1: 0.4542
 epoch: 68, train_loss: 1.0621, test_loss: 1.0677, test_f1: 0.4548
 epoch: 69, train_loss: 1.0663, test_loss: 1.0646, test_f1: 0.4454
 epoch: 70, train_loss: 1.0673, test_loss: 1.0630, test_f1: 0.4482
 epoch: 71, train_loss: 1.0641, test_loss: 1.0632, test_f1: 0.4566
 epoch: 72, train_loss: 1.0606, test_loss: 1.0580, test_f1: 0.4601
 epoch: 73, train_loss: 1.0603, test_loss: 1.0593, test_f1: 0.4449
 epoch: 74, train_loss: 1.0591, test_loss: 1.0636, test_f1: 0.4512
 epoch: 75, train_loss: 1.0601, test_loss: 1.0624, test_f1: 0.4591
 epoch: 76, train_loss: 1.0571, test_loss: 1.0589, test_f1: 0.4489
 epoch: 77, train_loss: 1.0579, test_loss: 1.0551, test_f1: 0.4530
 epoch: 78, train_loss: 1.0520, test_loss: 1.0561, test_f1: 0.4552
 epoch: 79, train_loss: 1.0536, test_loss: 1.0614, test_f1: 0.4522
 epoch: 80, train_loss: 1.0390, test_loss: 1.0598, test_f1: 0.4531
 epoch: 81, train_loss: 1.0554, test_loss: 1.0587, test_f1: 0.4591
 epoch: 82, train_loss: 1.0483, test_loss: 1.0627, test_f1: 0.4503
 epoch: 83, train_loss: 1.0550, test_loss: 1.0608, test_f1: 0.4579
 epoch: 84, train_loss: 1.0428, test_loss: 1.0623, test_f1: 0.4533
 epoch: 85, train_loss: 1.0433, test_loss: 1.0565, test_f1: 0.4533
 epoch: 86, train_loss: 1.0503, test_loss: 1.0562, test_f1: 0.4583
 epoch: 87, train_loss: 1.0490, test_loss: 1.0581, test_f1: 0.4546
 epoch: 88, train_loss: 1.0374, test_loss: 1.0565, test_f1: 0.4524
 epoch: 89, train_loss: 1.0377, test_loss: 1.0545, test_f1: 0.4512
 epoch: 90, train_loss: 1.0465, test_loss: 1.0572, test_f1: 0.4479
 epoch: 91, train_loss: 1.0306, test_loss: 1.0486, test_f1: 0.4594
 epoch: 92, train_loss: 1.0348, test_loss: 1.0459, test_f1: 0.4680
 epoch: 93, train_loss: 1.0473, test_loss: 1.0478, test_f1: 0.4582
 epoch: 94, train_loss: 1.0347, test_loss: 1.0520, test_f1: 0.4552
 epoch: 95, train_loss: 1.0310, test_loss: 1.0523, test_f1: 0.4502
 epoch: 96, train_loss: 1.0393, test_loss: 1.0534, test_f1: 0.4553
 epoch: 97, train_loss: 1.0318, test_loss: 1.0519, test_f1: 0.4599
 epoch: 98, train_loss: 1.0301, test_loss: 1.0487, test_f1: 0.4599
 epoch: 99, train_loss: 1.0329, test_loss: 1.0484, test_f1: 0.4654

Training completed in 510.13 seconds
Best F1: 0.4832 at epoch 96
Mean F1 across iterations: 0.4563  0.0196
========================FINAL RESULTS================================
FEGIN weighted F1: 0.4832  0.0196
python main.py --data ltspice_examples --representation component_component --model FEGIN --layers 5 --hiddens 32 --batch_size 128 --lr 0.0001 --emb_size 512 --epochs 100 --save_appendix component_component_L5_H32_BS128_LR0.0001_E512 --no_val
-----



STDERR:
  File "main.py", line 370, in <module>
    main()
  File "main.py", line 254, in main
    dataset = dataset_class(
  File "/home/philip/projects/ltspice_examples_code_repo/Circuit-Completion-Using-GNNs/component_classification_with_link_prediction_head/evaluation/FEGIN/kernel/circuit_datasets.py", line 15, in __init__
    self.data, self.slices = torch.load(self.processed_paths[0])
  File "/home/philip/.local/lib/python3.8/site-packages/torch/serialization.py", line 1040, in load
    warnings.warn(
  File "/usr/lib/python3.8/warnings.py", line 109, in _showwarnmsg
    sw(msg.message, msg.category, msg.filename, msg.lineno,
  File "main.py", line 47, in warn_with_traceback
    traceback.print_stack(file=log)
/home/philip/projects/ltspice_examples_code_repo/Circuit-Completion-Using-GNNs/component_classification_with_link_prediction_head/evaluation/FEGIN/kernel/circuit_datasets.py:15: FutureWarning: You are using `torch.load` with `weights_only=False` (the current default value), which uses the default pickle module implicitly. It is possible to construct malicious pickle data which will execute arbitrary code during unpickling (See https://github.com/pytorch/pytorch/blob/main/SECURITY.md#untrusted-models for more details). In a future release, the default value for `weights_only` will be flipped to `True`. This limits the functions that could be executed during unpickling. Arbitrary objects will no longer be allowed to be loaded via this mode unless they are explicitly allowlisted by the user via `torch.serialization.add_safe_globals`. We recommend you start setting `weights_only=True` for any use case where you don't have full control of the loaded file. Please open an issue on GitHub for any issues related to this experimental feature.
  self.data, self.slices = torch.load(self.processed_paths[0])
