STDOUT:
Results will be saved in /home/philip/projects/ltspice_examples_code_repo/Circuit-Completion-Using-GNNs/component_classification_with_link_prediction_head/evaluation/FEGIN/results/model_FEGIN_dataset_ltspice_examples
Command line input: python main.py --data ltspice_examples --representation component_pin_net --model FEGIN --layers 4 --hiddens 64 --batch_size 64 --lr 0.001 --emb_size 128 --epochs 100 --save_appendix component_pin_net_L4_H64_BS64_LR0.001_E128 --no_val
 is saved.
-----
ltspice_examples - FEGIN
Using 4 layers, 64 hidden units, h = 2
Loading component_pin_net representation dataset
ENTERED
Training FEGIN on component_pin_net representation
Train: 3558, Test: 846
##################ITERATION #0 ****************************************
 epoch: 0, train_loss: 1.1861, test_loss: 1.0732, test_f1: 0.3612
 epoch: 1, train_loss: 1.0040, test_loss: 1.0590, test_f1: 0.4684
 epoch: 2, train_loss: 0.9733, test_loss: 0.9584, test_f1: 0.4767
 epoch: 3, train_loss: 0.9617, test_loss: 1.0140, test_f1: 0.4959
 epoch: 4, train_loss: 0.9284, test_loss: 0.9043, test_f1: 0.5085
 epoch: 5, train_loss: 0.9115, test_loss: 0.8935, test_f1: 0.5311
 epoch: 6, train_loss: 0.8788, test_loss: 0.8457, test_f1: 0.5726
 epoch: 7, train_loss: 0.8753, test_loss: 0.8870, test_f1: 0.5326
 epoch: 8, train_loss: 0.8524, test_loss: 0.8622, test_f1: 0.5169
 epoch: 9, train_loss: 0.8482, test_loss: 0.8284, test_f1: 0.5407
 epoch: 10, train_loss: 0.8272, test_loss: 0.8310, test_f1: 0.5974
 epoch: 11, train_loss: 0.8175, test_loss: 0.8925, test_f1: 0.5226
 epoch: 12, train_loss: 0.7935, test_loss: 0.8640, test_f1: 0.5579
 epoch: 13, train_loss: 0.7744, test_loss: 0.9169, test_f1: 0.5570
 epoch: 14, train_loss: 0.7527, test_loss: 0.8094, test_f1: 0.5604
 epoch: 15, train_loss: 0.7551, test_loss: 0.7996, test_f1: 0.6040
 epoch: 16, train_loss: 0.7368, test_loss: 0.8951, test_f1: 0.5569
 epoch: 17, train_loss: 0.7229, test_loss: 0.8300, test_f1: 0.6290
 epoch: 18, train_loss: 0.7013, test_loss: 0.8401, test_f1: 0.5632
 epoch: 19, train_loss: 0.6939, test_loss: 0.8970, test_f1: 0.6077
 epoch: 20, train_loss: 0.6741, test_loss: 0.8946, test_f1: 0.5786
 epoch: 21, train_loss: 0.6817, test_loss: 0.7306, test_f1: 0.6258
 epoch: 22, train_loss: 0.6511, test_loss: 0.7299, test_f1: 0.6195
 epoch: 23, train_loss: 0.6438, test_loss: 0.8117, test_f1: 0.6177
 epoch: 24, train_loss: 0.6326, test_loss: 0.7724, test_f1: 0.6272
 epoch: 25, train_loss: 0.6230, test_loss: 0.7432, test_f1: 0.6304
 epoch: 26, train_loss: 0.6132, test_loss: 0.8914, test_f1: 0.6069
 epoch: 27, train_loss: 0.6049, test_loss: 0.7000, test_f1: 0.6515
 epoch: 28, train_loss: 0.5868, test_loss: 0.7895, test_f1: 0.6365
 epoch: 29, train_loss: 0.6203, test_loss: 0.7120, test_f1: 0.6554
 epoch: 30, train_loss: 0.5890, test_loss: 0.7643, test_f1: 0.6548
 epoch: 31, train_loss: 0.5685, test_loss: 0.8692, test_f1: 0.6684
 epoch: 32, train_loss: 0.5622, test_loss: 0.7965, test_f1: 0.6573
 epoch: 33, train_loss: 0.5656, test_loss: 0.8126, test_f1: 0.6319
 epoch: 34, train_loss: 0.5339, test_loss: 0.8263, test_f1: 0.6316
 epoch: 35, train_loss: 0.5700, test_loss: 0.8967, test_f1: 0.6317
 epoch: 36, train_loss: 0.5593, test_loss: 0.8335, test_f1: 0.6499
 epoch: 37, train_loss: 0.5526, test_loss: 0.9583, test_f1: 0.6396
 epoch: 38, train_loss: 0.5185, test_loss: 0.8583, test_f1: 0.6444
 epoch: 39, train_loss: 0.5024, test_loss: 0.9796, test_f1: 0.6373
 epoch: 40, train_loss: 0.5116, test_loss: 0.8162, test_f1: 0.6606
 epoch: 41, train_loss: 0.5130, test_loss: 0.8913, test_f1: 0.6475
 epoch: 42, train_loss: 0.4923, test_loss: 0.8581, test_f1: 0.6882
 epoch: 43, train_loss: 0.4832, test_loss: 0.8882, test_f1: 0.6416
 epoch: 44, train_loss: 0.4756, test_loss: 0.8310, test_f1: 0.6647
 epoch: 45, train_loss: 0.4715, test_loss: 0.9052, test_f1: 0.6414
 epoch: 46, train_loss: 0.4699, test_loss: 0.9829, test_f1: 0.6733
 epoch: 47, train_loss: 0.4770, test_loss: 0.7754, test_f1: 0.6812
 epoch: 48, train_loss: 0.4518, test_loss: 0.8322, test_f1: 0.6656
 epoch: 49, train_loss: 0.4454, test_loss: 0.9016, test_f1: 0.6599
 epoch: 50, train_loss: 0.4489, test_loss: 0.7574, test_f1: 0.7116
 epoch: 51, train_loss: 0.4183, test_loss: 0.8951, test_f1: 0.6607
 epoch: 52, train_loss: 0.3841, test_loss: 0.8417, test_f1: 0.6778
 epoch: 53, train_loss: 0.3911, test_loss: 0.8759, test_f1: 0.6747
 epoch: 54, train_loss: 0.3797, test_loss: 0.9062, test_f1: 0.6691
 epoch: 55, train_loss: 0.3683, test_loss: 1.0206, test_f1: 0.6633
 epoch: 56, train_loss: 0.3532, test_loss: 1.0232, test_f1: 0.6868
 epoch: 57, train_loss: 0.3496, test_loss: 1.1349, test_f1: 0.6603
 epoch: 58, train_loss: 0.3579, test_loss: 0.9836, test_f1: 0.6570
 epoch: 59, train_loss: 0.3553, test_loss: 1.0474, test_f1: 0.6686
 epoch: 60, train_loss: 0.3452, test_loss: 1.2332, test_f1: 0.6646
 epoch: 61, train_loss: 0.3549, test_loss: 1.1158, test_f1: 0.6766
 epoch: 62, train_loss: 0.3360, test_loss: 1.0986, test_f1: 0.6701
 epoch: 63, train_loss: 0.3270, test_loss: 1.1186, test_f1: 0.6661
 epoch: 64, train_loss: 0.3247, test_loss: 1.0987, test_f1: 0.6895
 epoch: 65, train_loss: 0.3367, test_loss: 1.1234, test_f1: 0.6768
 epoch: 66, train_loss: 0.3216, test_loss: 1.1626, test_f1: 0.6903
 epoch: 67, train_loss: 0.3187, test_loss: 1.3179, test_f1: 0.6723
 epoch: 68, train_loss: 0.3224, test_loss: 1.1168, test_f1: 0.6744
 epoch: 69, train_loss: 0.3135, test_loss: 1.2101, test_f1: 0.6658
 epoch: 70, train_loss: 0.3065, test_loss: 1.0972, test_f1: 0.6841
 epoch: 71, train_loss: 0.2916, test_loss: 1.2250, test_f1: 0.6785
 epoch: 72, train_loss: 0.2993, test_loss: 1.2774, test_f1: 0.6668
 epoch: 73, train_loss: 0.2973, test_loss: 1.1481, test_f1: 0.6933
 epoch: 74, train_loss: 0.2881, test_loss: 1.1908, test_f1: 0.6939
 epoch: 75, train_loss: 0.2994, test_loss: 1.3691, test_f1: 0.6642
 epoch: 76, train_loss: 0.2959, test_loss: 1.2127, test_f1: 0.7084
 epoch: 77, train_loss: 0.2780, test_loss: 1.2177, test_f1: 0.6773
 epoch: 78, train_loss: 0.2902, test_loss: 1.3372, test_f1: 0.6846
 epoch: 79, train_loss: 0.2590, test_loss: 1.2414, test_f1: 0.6855
 epoch: 80, train_loss: 0.2938, test_loss: 1.2282, test_f1: 0.6838
 epoch: 81, train_loss: 0.2784, test_loss: 1.3021, test_f1: 0.6633
 epoch: 82, train_loss: 0.2729, test_loss: 1.3220, test_f1: 0.6816
 epoch: 83, train_loss: 0.2612, test_loss: 1.3410, test_f1: 0.6813
 epoch: 84, train_loss: 0.2589, test_loss: 1.4362, test_f1: 0.6908
 epoch: 85, train_loss: 0.2779, test_loss: 1.3459, test_f1: 0.6882
 epoch: 86, train_loss: 0.2611, test_loss: 1.3734, test_f1: 0.6763
 epoch: 87, train_loss: 0.2493, test_loss: 1.5662, test_f1: 0.6631
 epoch: 88, train_loss: 0.2563, test_loss: 1.3790, test_f1: 0.6951
 epoch: 89, train_loss: 0.2617, test_loss: 1.5282, test_f1: 0.6818
 epoch: 90, train_loss: 0.2582, test_loss: 1.6551, test_f1: 0.6605
 epoch: 91, train_loss: 0.2583, test_loss: 1.5531, test_f1: 0.6698
 epoch: 92, train_loss: 0.2393, test_loss: 1.5508, test_f1: 0.6752
 epoch: 93, train_loss: 0.2417, test_loss: 1.6381, test_f1: 0.6690
 epoch: 94, train_loss: 0.2399, test_loss: 1.4644, test_f1: 0.6879
 epoch: 95, train_loss: 0.2385, test_loss: 1.3876, test_f1: 0.6658
 epoch: 96, train_loss: 0.2335, test_loss: 1.6539, test_f1: 0.6679
 epoch: 97, train_loss: 0.2466, test_loss: 1.5240, test_f1: 0.6589
 epoch: 98, train_loss: 0.2376, test_loss: 1.6124, test_f1: 0.6642
 epoch: 99, train_loss: 0.2278, test_loss: 1.4857, test_f1: 0.6778
##################ITERATION #1 ****************************************
 epoch: 0, train_loss: 1.0716, test_loss: 1.2121, test_f1: 0.3360
 epoch: 1, train_loss: 0.9537, test_loss: 0.9353, test_f1: 0.5303
 epoch: 2, train_loss: 0.9179, test_loss: 0.8859, test_f1: 0.5504
 epoch: 3, train_loss: 0.9015, test_loss: 0.8374, test_f1: 0.5681
 epoch: 4, train_loss: 0.8703, test_loss: 0.8608, test_f1: 0.5815
 epoch: 5, train_loss: 0.8498, test_loss: 0.8438, test_f1: 0.5878
 epoch: 6, train_loss: 0.8346, test_loss: 0.7930, test_f1: 0.6212
 epoch: 7, train_loss: 0.8263, test_loss: 0.8095, test_f1: 0.6203
 epoch: 8, train_loss: 0.8118, test_loss: 0.8580, test_f1: 0.5775
 epoch: 9, train_loss: 0.7965, test_loss: 0.7714, test_f1: 0.6215
 epoch: 10, train_loss: 0.7753, test_loss: 0.7938, test_f1: 0.5928
 epoch: 11, train_loss: 0.7628, test_loss: 0.8505, test_f1: 0.5982
 epoch: 12, train_loss: 0.7412, test_loss: 0.7553, test_f1: 0.6399
 epoch: 13, train_loss: 0.7273, test_loss: 0.7764, test_f1: 0.6425
 epoch: 14, train_loss: 0.7225, test_loss: 0.7676, test_f1: 0.6334
 epoch: 15, train_loss: 0.7236, test_loss: 0.7664, test_f1: 0.6337
 epoch: 16, train_loss: 0.7035, test_loss: 0.7355, test_f1: 0.6473
 epoch: 17, train_loss: 0.6806, test_loss: 0.8068, test_f1: 0.6567
 epoch: 18, train_loss: 0.6680, test_loss: 0.7349, test_f1: 0.6679
 epoch: 19, train_loss: 0.6625, test_loss: 0.7705, test_f1: 0.6452
 epoch: 20, train_loss: 0.6600, test_loss: 0.7087, test_f1: 0.6909
 epoch: 21, train_loss: 0.6539, test_loss: 0.7706, test_f1: 0.6659
 epoch: 22, train_loss: 0.6339, test_loss: 0.7766, test_f1: 0.6400
 epoch: 23, train_loss: 0.6232, test_loss: 0.8241, test_f1: 0.6317
 epoch: 24, train_loss: 0.6306, test_loss: 0.8028, test_f1: 0.6548
 epoch: 25, train_loss: 0.6078, test_loss: 0.7293, test_f1: 0.6580
 epoch: 26, train_loss: 0.6090, test_loss: 0.8432, test_f1: 0.6526
 epoch: 27, train_loss: 0.5825, test_loss: 0.7253, test_f1: 0.6542
 epoch: 28, train_loss: 0.5817, test_loss: 0.8548, test_f1: 0.6672
 epoch: 29, train_loss: 0.5925, test_loss: 0.7593, test_f1: 0.6472
 epoch: 30, train_loss: 0.5654, test_loss: 0.7880, test_f1: 0.6754
 epoch: 31, train_loss: 0.5510, test_loss: 0.7793, test_f1: 0.6606
 epoch: 32, train_loss: 0.5456, test_loss: 0.8964, test_f1: 0.6706
 epoch: 33, train_loss: 0.5542, test_loss: 0.8715, test_f1: 0.6584
 epoch: 34, train_loss: 0.5354, test_loss: 0.8744, test_f1: 0.6435
 epoch: 35, train_loss: 0.5318, test_loss: 0.8345, test_f1: 0.6731
 epoch: 36, train_loss: 0.5309, test_loss: 0.7936, test_f1: 0.6489
 epoch: 37, train_loss: 0.5482, test_loss: 0.8898, test_f1: 0.6621
 epoch: 38, train_loss: 0.5197, test_loss: 0.9557, test_f1: 0.6416
 epoch: 39, train_loss: 0.5121, test_loss: 0.8689, test_f1: 0.6750
 epoch: 40, train_loss: 0.5030, test_loss: 0.8887, test_f1: 0.6734
 epoch: 41, train_loss: 0.4792, test_loss: 0.9321, test_f1: 0.6709
 epoch: 42, train_loss: 0.4843, test_loss: 0.8876, test_f1: 0.6694
 epoch: 43, train_loss: 0.4882, test_loss: 1.1315, test_f1: 0.6545
 epoch: 44, train_loss: 0.4878, test_loss: 0.9243, test_f1: 0.6691
 epoch: 45, train_loss: 0.4793, test_loss: 0.9433, test_f1: 0.6657
 epoch: 46, train_loss: 0.4687, test_loss: 1.0034, test_f1: 0.6313
 epoch: 47, train_loss: 0.4554, test_loss: 0.9232, test_f1: 0.6786
 epoch: 48, train_loss: 0.4415, test_loss: 1.0600, test_f1: 0.6510
 epoch: 49, train_loss: 0.4385, test_loss: 1.0425, test_f1: 0.6512
 epoch: 50, train_loss: 0.4396, test_loss: 1.0186, test_f1: 0.6793
 epoch: 51, train_loss: 0.4040, test_loss: 1.0313, test_f1: 0.6708
 epoch: 52, train_loss: 0.3759, test_loss: 1.1067, test_f1: 0.6638
 epoch: 53, train_loss: 0.3767, test_loss: 1.1493, test_f1: 0.6618
 epoch: 54, train_loss: 0.3749, test_loss: 1.1205, test_f1: 0.6756
 epoch: 55, train_loss: 0.3660, test_loss: 1.1801, test_f1: 0.6523
 epoch: 56, train_loss: 0.3505, test_loss: 1.1882, test_f1: 0.6617
 epoch: 57, train_loss: 0.3504, test_loss: 1.2404, test_f1: 0.6811
 epoch: 58, train_loss: 0.3553, test_loss: 1.3226, test_f1: 0.6533
 epoch: 59, train_loss: 0.3472, test_loss: 1.1451, test_f1: 0.6780
 epoch: 60, train_loss: 0.3446, test_loss: 1.2097, test_f1: 0.6697
 epoch: 61, train_loss: 0.3583, test_loss: 1.3560, test_f1: 0.6555
 epoch: 62, train_loss: 0.3545, test_loss: 1.2624, test_f1: 0.6685
 epoch: 63, train_loss: 0.3228, test_loss: 1.3594, test_f1: 0.6774
 epoch: 64, train_loss: 0.3316, test_loss: 1.2957, test_f1: 0.6656
 epoch: 65, train_loss: 0.3143, test_loss: 1.3519, test_f1: 0.6611
 epoch: 66, train_loss: 0.3238, test_loss: 1.3018, test_f1: 0.6726
 epoch: 67, train_loss: 0.3201, test_loss: 1.3770, test_f1: 0.6746
 epoch: 68, train_loss: 0.3275, test_loss: 1.3633, test_f1: 0.6757
 epoch: 69, train_loss: 0.3264, test_loss: 1.3308, test_f1: 0.6712
 epoch: 70, train_loss: 0.3028, test_loss: 1.4234, test_f1: 0.6693
 epoch: 71, train_loss: 0.3167, test_loss: 1.3385, test_f1: 0.6790
 epoch: 72, train_loss: 0.3157, test_loss: 1.3560, test_f1: 0.6688
 epoch: 73, train_loss: 0.3062, test_loss: 1.3504, test_f1: 0.6806
 epoch: 74, train_loss: 0.3140, test_loss: 1.3069, test_f1: 0.6763
 epoch: 75, train_loss: 0.2882, test_loss: 1.4421, test_f1: 0.6701
 epoch: 76, train_loss: 0.3059, test_loss: 1.4325, test_f1: 0.6700
 epoch: 77, train_loss: 0.3022, test_loss: 1.5053, test_f1: 0.6813
 epoch: 78, train_loss: 0.2930, test_loss: 1.5153, test_f1: 0.6455
 epoch: 79, train_loss: 0.2870, test_loss: 1.6002, test_f1: 0.6651
 epoch: 80, train_loss: 0.2742, test_loss: 1.4462, test_f1: 0.6711
 epoch: 81, train_loss: 0.2823, test_loss: 1.5992, test_f1: 0.6580
 epoch: 82, train_loss: 0.2917, test_loss: 1.4160, test_f1: 0.6884
 epoch: 83, train_loss: 0.2859, test_loss: 1.4589, test_f1: 0.6751
 epoch: 84, train_loss: 0.2716, test_loss: 1.4962, test_f1: 0.6564
 epoch: 85, train_loss: 0.2774, test_loss: 1.5014, test_f1: 0.6844
 epoch: 86, train_loss: 0.2730, test_loss: 1.5917, test_f1: 0.6717
 epoch: 87, train_loss: 0.2740, test_loss: 1.5768, test_f1: 0.6820
 epoch: 88, train_loss: 0.2689, test_loss: 1.6077, test_f1: 0.6563
 epoch: 89, train_loss: 0.2570, test_loss: 1.5340, test_f1: 0.6792
 epoch: 90, train_loss: 0.2444, test_loss: 1.6313, test_f1: 0.6784
 epoch: 91, train_loss: 0.2674, test_loss: 1.5756, test_f1: 0.6812
 epoch: 92, train_loss: 0.2645, test_loss: 1.6821, test_f1: 0.6652
 epoch: 93, train_loss: 0.2465, test_loss: 1.5131, test_f1: 0.6694
 epoch: 94, train_loss: 0.2404, test_loss: 1.6045, test_f1: 0.6734
 epoch: 95, train_loss: 0.2494, test_loss: 1.5716, test_f1: 0.6855
 epoch: 96, train_loss: 0.2517, test_loss: 1.6945, test_f1: 0.6626
 epoch: 97, train_loss: 0.2514, test_loss: 1.6609, test_f1: 0.6729
 epoch: 98, train_loss: 0.2366, test_loss: 1.7330, test_f1: 0.6762
 epoch: 99, train_loss: 0.2302, test_loss: 1.8436, test_f1: 0.6705
##################ITERATION #2 ****************************************
 epoch: 0, train_loss: 1.1258, test_loss: 1.1254, test_f1: 0.3744
 epoch: 1, train_loss: 0.9766, test_loss: 0.9357, test_f1: 0.5073
 epoch: 2, train_loss: 0.9294, test_loss: 0.8872, test_f1: 0.5152
 epoch: 3, train_loss: 0.9019, test_loss: 0.9098, test_f1: 0.5681
 epoch: 4, train_loss: 0.8918, test_loss: 0.8799, test_f1: 0.5877
 epoch: 5, train_loss: 0.8694, test_loss: 0.8642, test_f1: 0.5825
 epoch: 6, train_loss: 0.8506, test_loss: 0.8931, test_f1: 0.6035
 epoch: 7, train_loss: 0.8196, test_loss: 0.8815, test_f1: 0.5948
 epoch: 8, train_loss: 0.8184, test_loss: 0.8260, test_f1: 0.6375
 epoch: 9, train_loss: 0.8052, test_loss: 0.8237, test_f1: 0.6255
 epoch: 10, train_loss: 0.7881, test_loss: 0.7904, test_f1: 0.6033
 epoch: 11, train_loss: 0.7632, test_loss: 0.8004, test_f1: 0.6177
 epoch: 12, train_loss: 0.7623, test_loss: 0.7460, test_f1: 0.6328
 epoch: 13, train_loss: 0.7402, test_loss: 0.7734, test_f1: 0.6254
 epoch: 14, train_loss: 0.7323, test_loss: 0.7761, test_f1: 0.6503
 epoch: 15, train_loss: 0.7223, test_loss: 0.7223, test_f1: 0.6535
 epoch: 16, train_loss: 0.7116, test_loss: 0.7478, test_f1: 0.6394
 epoch: 17, train_loss: 0.6751, test_loss: 0.7749, test_f1: 0.6526
 epoch: 18, train_loss: 0.6667, test_loss: 0.7812, test_f1: 0.6324
 epoch: 19, train_loss: 0.6551, test_loss: 0.8015, test_f1: 0.6393
 epoch: 20, train_loss: 0.6530, test_loss: 0.8082, test_f1: 0.6649
 epoch: 21, train_loss: 0.6496, test_loss: 0.7332, test_f1: 0.6901
 epoch: 22, train_loss: 0.6301, test_loss: 0.7346, test_f1: 0.6554
 epoch: 23, train_loss: 0.6191, test_loss: 0.7448, test_f1: 0.6865
 epoch: 24, train_loss: 0.6409, test_loss: 0.8155, test_f1: 0.6796
 epoch: 25, train_loss: 0.6095, test_loss: 0.7571, test_f1: 0.6396
 epoch: 26, train_loss: 0.5892, test_loss: 0.7898, test_f1: 0.6570
 epoch: 27, train_loss: 0.5769, test_loss: 0.7784, test_f1: 0.6644
 epoch: 28, train_loss: 0.5776, test_loss: 0.7848, test_f1: 0.6830
 epoch: 29, train_loss: 0.5786, test_loss: 0.7289, test_f1: 0.6883
 epoch: 30, train_loss: 0.5689, test_loss: 0.8245, test_f1: 0.6725
 epoch: 31, train_loss: 0.5756, test_loss: 0.7467, test_f1: 0.6652
 epoch: 32, train_loss: 0.5484, test_loss: 0.7498, test_f1: 0.6561
 epoch: 33, train_loss: 0.5360, test_loss: 0.9528, test_f1: 0.6734
 epoch: 34, train_loss: 0.5252, test_loss: 1.0114, test_f1: 0.6547
 epoch: 35, train_loss: 0.5188, test_loss: 0.8301, test_f1: 0.6581
 epoch: 36, train_loss: 0.5114, test_loss: 1.0556, test_f1: 0.6501
 epoch: 37, train_loss: 0.5098, test_loss: 0.9961, test_f1: 0.6746
 epoch: 38, train_loss: 0.4839, test_loss: 0.9816, test_f1: 0.6677
 epoch: 39, train_loss: 0.4936, test_loss: 0.7823, test_f1: 0.6737
 epoch: 40, train_loss: 0.4668, test_loss: 0.9912, test_f1: 0.6716
 epoch: 41, train_loss: 0.4869, test_loss: 0.9354, test_f1: 0.6639
 epoch: 42, train_loss: 0.4780, test_loss: 0.9744, test_f1: 0.6456
 epoch: 43, train_loss: 0.4858, test_loss: 1.0166, test_f1: 0.6790
 epoch: 44, train_loss: 0.4929, test_loss: 1.0528, test_f1: 0.6487
 epoch: 45, train_loss: 0.4700, test_loss: 0.9131, test_f1: 0.6610
 epoch: 46, train_loss: 0.4567, test_loss: 1.0398, test_f1: 0.6659
 epoch: 47, train_loss: 0.4482, test_loss: 1.0189, test_f1: 0.6701
 epoch: 48, train_loss: 0.4279, test_loss: 1.1392, test_f1: 0.6722
 epoch: 49, train_loss: 0.4215, test_loss: 1.0993, test_f1: 0.6752
 epoch: 50, train_loss: 0.4483, test_loss: 1.2549, test_f1: 0.6689
 epoch: 51, train_loss: 0.4073, test_loss: 1.2261, test_f1: 0.7063
 epoch: 52, train_loss: 0.3717, test_loss: 1.2163, test_f1: 0.6914
 epoch: 53, train_loss: 0.3685, test_loss: 1.3288, test_f1: 0.6663
 epoch: 54, train_loss: 0.3692, test_loss: 1.2246, test_f1: 0.6700
 epoch: 55, train_loss: 0.3555, test_loss: 1.1894, test_f1: 0.6637
 epoch: 56, train_loss: 0.3412, test_loss: 1.2052, test_f1: 0.6825
 epoch: 57, train_loss: 0.3324, test_loss: 1.3325, test_f1: 0.6810
 epoch: 58, train_loss: 0.3323, test_loss: 1.2109, test_f1: 0.6971
 epoch: 59, train_loss: 0.3402, test_loss: 1.2879, test_f1: 0.6828
 epoch: 60, train_loss: 0.3382, test_loss: 1.2798, test_f1: 0.6814
 epoch: 61, train_loss: 0.3330, test_loss: 1.3589, test_f1: 0.6786
 epoch: 62, train_loss: 0.3270, test_loss: 1.4759, test_f1: 0.6836
 epoch: 63, train_loss: 0.3346, test_loss: 1.2995, test_f1: 0.6925
 epoch: 64, train_loss: 0.3107, test_loss: 1.2734, test_f1: 0.6642
 epoch: 65, train_loss: 0.3052, test_loss: 1.3132, test_f1: 0.6918
 epoch: 66, train_loss: 0.3163, test_loss: 1.2661, test_f1: 0.6821
 epoch: 67, train_loss: 0.3159, test_loss: 1.3637, test_f1: 0.6778
 epoch: 68, train_loss: 0.3092, test_loss: 1.3896, test_f1: 0.6694
 epoch: 69, train_loss: 0.3159, test_loss: 1.4749, test_f1: 0.6710
 epoch: 70, train_loss: 0.3211, test_loss: 1.2607, test_f1: 0.6712
 epoch: 71, train_loss: 0.3026, test_loss: 1.2997, test_f1: 0.6740
 epoch: 72, train_loss: 0.2839, test_loss: 1.4029, test_f1: 0.6680
 epoch: 73, train_loss: 0.2932, test_loss: 1.3803, test_f1: 0.6991
 epoch: 74, train_loss: 0.2983, test_loss: 1.4165, test_f1: 0.6855
 epoch: 75, train_loss: 0.2711, test_loss: 1.5100, test_f1: 0.6785
 epoch: 76, train_loss: 0.2736, test_loss: 1.4094, test_f1: 0.6690
 epoch: 77, train_loss: 0.2890, test_loss: 1.5244, test_f1: 0.6782
 epoch: 78, train_loss: 0.2767, test_loss: 1.5563, test_f1: 0.6877
 epoch: 79, train_loss: 0.2865, test_loss: 1.4833, test_f1: 0.6726
 epoch: 80, train_loss: 0.2739, test_loss: 1.5523, test_f1: 0.6533
 epoch: 81, train_loss: 0.2698, test_loss: 1.5768, test_f1: 0.6522
 epoch: 82, train_loss: 0.2631, test_loss: 1.4521, test_f1: 0.6774
 epoch: 83, train_loss: 0.2780, test_loss: 1.5106, test_f1: 0.6719
 epoch: 84, train_loss: 0.2714, test_loss: 1.6072, test_f1: 0.6724
 epoch: 85, train_loss: 0.2659, test_loss: 1.6108, test_f1: 0.6763
 epoch: 86, train_loss: 0.2501, test_loss: 1.6859, test_f1: 0.6640
 epoch: 87, train_loss: 0.2608, test_loss: 1.5767, test_f1: 0.6700
 epoch: 88, train_loss: 0.2487, test_loss: 1.5439, test_f1: 0.6989
 epoch: 89, train_loss: 0.2550, test_loss: 1.7218, test_f1: 0.6784
 epoch: 90, train_loss: 0.2244, test_loss: 1.6682, test_f1: 0.6775
 epoch: 91, train_loss: 0.2480, test_loss: 1.7683, test_f1: 0.6730
 epoch: 92, train_loss: 0.2342, test_loss: 1.8243, test_f1: 0.6701
 epoch: 93, train_loss: 0.2326, test_loss: 1.8773, test_f1: 0.6660
 epoch: 94, train_loss: 0.2405, test_loss: 1.8931, test_f1: 0.6668
 epoch: 95, train_loss: 0.2385, test_loss: 1.8362, test_f1: 0.6700
 epoch: 96, train_loss: 0.2251, test_loss: 1.6729, test_f1: 0.6734
 epoch: 97, train_loss: 0.2312, test_loss: 1.7698, test_f1: 0.6657
 epoch: 98, train_loss: 0.2269, test_loss: 1.9253, test_f1: 0.6663
 epoch: 99, train_loss: 0.2293, test_loss: 1.7724, test_f1: 0.6840
##################ITERATION #3 ****************************************
 epoch: 0, train_loss: 1.1446, test_loss: 1.1128, test_f1: 0.4076
 epoch: 1, train_loss: 0.9642, test_loss: 0.8933, test_f1: 0.5180
 epoch: 2, train_loss: 0.9237, test_loss: 0.8509, test_f1: 0.5604
 epoch: 3, train_loss: 0.9143, test_loss: 0.8355, test_f1: 0.5618
 epoch: 4, train_loss: 0.8831, test_loss: 0.8591, test_f1: 0.5718
 epoch: 5, train_loss: 0.8609, test_loss: 0.8300, test_f1: 0.5945
 epoch: 6, train_loss: 0.8367, test_loss: 0.8059, test_f1: 0.5749
 epoch: 7, train_loss: 0.8303, test_loss: 0.7931, test_f1: 0.6183
 epoch: 8, train_loss: 0.8224, test_loss: 0.8230, test_f1: 0.5958
 epoch: 9, train_loss: 0.7821, test_loss: 0.9296, test_f1: 0.6337
 epoch: 10, train_loss: 0.7786, test_loss: 0.8484, test_f1: 0.6164
 epoch: 11, train_loss: 0.7785, test_loss: 0.7767, test_f1: 0.6581
 epoch: 12, train_loss: 0.7463, test_loss: 0.7468, test_f1: 0.6564
 epoch: 13, train_loss: 0.7322, test_loss: 0.7344, test_f1: 0.6780
 epoch: 14, train_loss: 0.7018, test_loss: 0.7191, test_f1: 0.6594
 epoch: 15, train_loss: 0.7281, test_loss: 0.7438, test_f1: 0.6285
 epoch: 16, train_loss: 0.7050, test_loss: 0.7495, test_f1: 0.6690
 epoch: 17, train_loss: 0.6914, test_loss: 0.7614, test_f1: 0.6173
 epoch: 18, train_loss: 0.6695, test_loss: 0.8870, test_f1: 0.6405
 epoch: 19, train_loss: 0.6677, test_loss: 0.7476, test_f1: 0.6726
 epoch: 20, train_loss: 0.6441, test_loss: 0.7682, test_f1: 0.6604
 epoch: 21, train_loss: 0.6430, test_loss: 0.7688, test_f1: 0.6518
 epoch: 22, train_loss: 0.6589, test_loss: 0.8720, test_f1: 0.6593
 epoch: 23, train_loss: 0.6226, test_loss: 0.9112, test_f1: 0.6333
 epoch: 24, train_loss: 0.6268, test_loss: 0.8860, test_f1: 0.6725
 epoch: 25, train_loss: 0.5920, test_loss: 0.8167, test_f1: 0.6542
 epoch: 26, train_loss: 0.6038, test_loss: 0.8065, test_f1: 0.6604
 epoch: 27, train_loss: 0.6001, test_loss: 0.8398, test_f1: 0.6719
 epoch: 28, train_loss: 0.6021, test_loss: 0.8363, test_f1: 0.6067
 epoch: 29, train_loss: 0.5661, test_loss: 0.8929, test_f1: 0.6427
 epoch: 30, train_loss: 0.5540, test_loss: 0.8332, test_f1: 0.6350
 epoch: 31, train_loss: 0.5541, test_loss: 0.8076, test_f1: 0.6439
 epoch: 32, train_loss: 0.5488, test_loss: 0.8099, test_f1: 0.6628
 epoch: 33, train_loss: 0.5519, test_loss: 0.9152, test_f1: 0.6670
 epoch: 34, train_loss: 0.5445, test_loss: 0.9965, test_f1: 0.6588
 epoch: 35, train_loss: 0.5270, test_loss: 0.9346, test_f1: 0.6498
 epoch: 36, train_loss: 0.5238, test_loss: 0.9544, test_f1: 0.6608
 epoch: 37, train_loss: 0.5190, test_loss: 1.0107, test_f1: 0.6622
 epoch: 38, train_loss: 0.5047, test_loss: 0.7804, test_f1: 0.6758
 epoch: 39, train_loss: 0.5087, test_loss: 0.9420, test_f1: 0.6431
 epoch: 40, train_loss: 0.5289, test_loss: 0.9581, test_f1: 0.6718
 epoch: 41, train_loss: 0.4914, test_loss: 0.8785, test_f1: 0.6817
 epoch: 42, train_loss: 0.4626, test_loss: 0.8467, test_f1: 0.6760
 epoch: 43, train_loss: 0.4755, test_loss: 1.0121, test_f1: 0.6318
 epoch: 44, train_loss: 0.4761, test_loss: 1.0085, test_f1: 0.6774
 epoch: 45, train_loss: 0.4714, test_loss: 0.9860, test_f1: 0.6607
 epoch: 46, train_loss: 0.4492, test_loss: 0.9201, test_f1: 0.6721
 epoch: 47, train_loss: 0.4432, test_loss: 1.0500, test_f1: 0.6517
 epoch: 48, train_loss: 0.4644, test_loss: 1.0899, test_f1: 0.6725
 epoch: 49, train_loss: 0.4299, test_loss: 0.9268, test_f1: 0.6721
 epoch: 50, train_loss: 0.4192, test_loss: 1.0722, test_f1: 0.6768
 epoch: 51, train_loss: 0.4072, test_loss: 0.9953, test_f1: 0.6702
 epoch: 52, train_loss: 0.3734, test_loss: 1.1047, test_f1: 0.6616
 epoch: 53, train_loss: 0.3593, test_loss: 1.1112, test_f1: 0.6661
 epoch: 54, train_loss: 0.3383, test_loss: 1.2478, test_f1: 0.6597
 epoch: 55, train_loss: 0.3684, test_loss: 1.1634, test_f1: 0.6713
 epoch: 56, train_loss: 0.3442, test_loss: 1.1410, test_f1: 0.6729
 epoch: 57, train_loss: 0.3431, test_loss: 1.2134, test_f1: 0.6734
 epoch: 58, train_loss: 0.3575, test_loss: 1.2254, test_f1: 0.6661
 epoch: 59, train_loss: 0.3313, test_loss: 1.3687, test_f1: 0.6500
 epoch: 60, train_loss: 0.3142, test_loss: 1.3006, test_f1: 0.6677
 epoch: 61, train_loss: 0.3290, test_loss: 1.3380, test_f1: 0.6574
 epoch: 62, train_loss: 0.3299, test_loss: 1.2634, test_f1: 0.6725
 epoch: 63, train_loss: 0.3150, test_loss: 1.3521, test_f1: 0.6633
 epoch: 64, train_loss: 0.2940, test_loss: 1.2951, test_f1: 0.6498
 epoch: 65, train_loss: 0.2982, test_loss: 1.3565, test_f1: 0.6779
 epoch: 66, train_loss: 0.3093, test_loss: 1.3036, test_f1: 0.6654
 epoch: 67, train_loss: 0.3125, test_loss: 1.3264, test_f1: 0.6590
 epoch: 68, train_loss: 0.3020, test_loss: 1.3233, test_f1: 0.6735
 epoch: 69, train_loss: 0.3219, test_loss: 1.4715, test_f1: 0.6692
 epoch: 70, train_loss: 0.3103, test_loss: 1.2938, test_f1: 0.6700
 epoch: 71, train_loss: 0.3132, test_loss: 1.2276, test_f1: 0.6849
 epoch: 72, train_loss: 0.2793, test_loss: 1.4883, test_f1: 0.6516
 epoch: 73, train_loss: 0.2772, test_loss: 1.3762, test_f1: 0.6532
 epoch: 74, train_loss: 0.2639, test_loss: 1.4719, test_f1: 0.6616
 epoch: 75, train_loss: 0.2766, test_loss: 1.4606, test_f1: 0.6496
 epoch: 76, train_loss: 0.2941, test_loss: 1.6051, test_f1: 0.6523
 epoch: 77, train_loss: 0.3025, test_loss: 1.4446, test_f1: 0.6486
 epoch: 78, train_loss: 0.2739, test_loss: 1.5521, test_f1: 0.6698
 epoch: 79, train_loss: 0.2874, test_loss: 1.5053, test_f1: 0.6428
 epoch: 80, train_loss: 0.2644, test_loss: 1.4904, test_f1: 0.6610
 epoch: 81, train_loss: 0.2527, test_loss: 1.5657, test_f1: 0.6555
 epoch: 82, train_loss: 0.2643, test_loss: 1.4929, test_f1: 0.6774
 epoch: 83, train_loss: 0.2665, test_loss: 1.6783, test_f1: 0.6578
 epoch: 84, train_loss: 0.2570, test_loss: 1.7019, test_f1: 0.6717
 epoch: 85, train_loss: 0.2648, test_loss: 1.6097, test_f1: 0.6606
 epoch: 86, train_loss: 0.2574, test_loss: 1.6384, test_f1: 0.6598
 epoch: 87, train_loss: 0.2407, test_loss: 1.5711, test_f1: 0.6683
 epoch: 88, train_loss: 0.2577, test_loss: 1.6409, test_f1: 0.6804
 epoch: 89, train_loss: 0.2721, test_loss: 1.5776, test_f1: 0.6653
 epoch: 90, train_loss: 0.2438, test_loss: 1.6046, test_f1: 0.6529
 epoch: 91, train_loss: 0.2494, test_loss: 1.5524, test_f1: 0.6668
 epoch: 92, train_loss: 0.2525, test_loss: 1.5676, test_f1: 0.6633
 epoch: 93, train_loss: 0.2367, test_loss: 1.6228, test_f1: 0.6712
 epoch: 94, train_loss: 0.2477, test_loss: 1.6423, test_f1: 0.6591
 epoch: 95, train_loss: 0.2334, test_loss: 1.5988, test_f1: 0.6583
 epoch: 96, train_loss: 0.2413, test_loss: 1.6671, test_f1: 0.6807
 epoch: 97, train_loss: 0.2354, test_loss: 1.7092, test_f1: 0.6783
 epoch: 98, train_loss: 0.2200, test_loss: 1.8294, test_f1: 0.6539
 epoch: 99, train_loss: 0.2301, test_loss: 1.7712, test_f1: 0.6662
##################ITERATION #4 ****************************************
 epoch: 0, train_loss: 1.2632, test_loss: 1.0668, test_f1: 0.4756
 epoch: 1, train_loss: 1.0061, test_loss: 0.9522, test_f1: 0.5209
 epoch: 2, train_loss: 0.9614, test_loss: 0.9441, test_f1: 0.5341
 epoch: 3, train_loss: 0.9266, test_loss: 0.9154, test_f1: 0.5452
 epoch: 4, train_loss: 0.8898, test_loss: 0.9328, test_f1: 0.5295
 epoch: 5, train_loss: 0.8629, test_loss: 0.8357, test_f1: 0.6033
 epoch: 6, train_loss: 0.8588, test_loss: 0.8637, test_f1: 0.5679
 epoch: 7, train_loss: 0.8462, test_loss: 0.8673, test_f1: 0.5380
 epoch: 8, train_loss: 0.8336, test_loss: 0.8422, test_f1: 0.5776
 epoch: 9, train_loss: 0.8071, test_loss: 0.8197, test_f1: 0.5860
 epoch: 10, train_loss: 0.7924, test_loss: 0.8521, test_f1: 0.5937
 epoch: 11, train_loss: 0.7775, test_loss: 0.8634, test_f1: 0.5963
 epoch: 12, train_loss: 0.7589, test_loss: 0.8433, test_f1: 0.5874
 epoch: 13, train_loss: 0.7442, test_loss: 0.8523, test_f1: 0.5592
 epoch: 14, train_loss: 0.7587, test_loss: 0.8327, test_f1: 0.5982
 epoch: 15, train_loss: 0.7240, test_loss: 0.7780, test_f1: 0.6397
 epoch: 16, train_loss: 0.7153, test_loss: 0.8171, test_f1: 0.6265
 epoch: 17, train_loss: 0.7026, test_loss: 0.7542, test_f1: 0.6589
 epoch: 18, train_loss: 0.6862, test_loss: 0.8403, test_f1: 0.6318
 epoch: 19, train_loss: 0.6773, test_loss: 0.8634, test_f1: 0.6179
 epoch: 20, train_loss: 0.6863, test_loss: 0.8030, test_f1: 0.6298
 epoch: 21, train_loss: 0.6703, test_loss: 0.8503, test_f1: 0.6457
 epoch: 22, train_loss: 0.6570, test_loss: 0.7655, test_f1: 0.6465
 epoch: 23, train_loss: 0.6458, test_loss: 0.8931, test_f1: 0.6253
 epoch: 24, train_loss: 0.6328, test_loss: 0.8320, test_f1: 0.6656
 epoch: 25, train_loss: 0.6247, test_loss: 0.8481, test_f1: 0.6444
 epoch: 26, train_loss: 0.6262, test_loss: 0.7834, test_f1: 0.6505
 epoch: 27, train_loss: 0.6137, test_loss: 0.8028, test_f1: 0.6430
 epoch: 28, train_loss: 0.5878, test_loss: 0.8952, test_f1: 0.6340
 epoch: 29, train_loss: 0.5882, test_loss: 0.7570, test_f1: 0.6483
 epoch: 30, train_loss: 0.5822, test_loss: 0.8152, test_f1: 0.6560
 epoch: 31, train_loss: 0.5745, test_loss: 0.7707, test_f1: 0.6368
 epoch: 32, train_loss: 0.5869, test_loss: 0.8456, test_f1: 0.6294
 epoch: 33, train_loss: 0.5769, test_loss: 0.8874, test_f1: 0.6490
 epoch: 34, train_loss: 0.5605, test_loss: 0.8340, test_f1: 0.6428
 epoch: 35, train_loss: 0.5495, test_loss: 0.8883, test_f1: 0.6298
 epoch: 36, train_loss: 0.5379, test_loss: 0.8381, test_f1: 0.6621
 epoch: 37, train_loss: 0.5359, test_loss: 0.8363, test_f1: 0.6533
 epoch: 38, train_loss: 0.5526, test_loss: 0.9436, test_f1: 0.6744
 epoch: 39, train_loss: 0.5417, test_loss: 0.8202, test_f1: 0.6332
 epoch: 40, train_loss: 0.5213, test_loss: 0.8841, test_f1: 0.6495
 epoch: 41, train_loss: 0.5223, test_loss: 0.9073, test_f1: 0.6094
 epoch: 42, train_loss: 0.5008, test_loss: 0.8864, test_f1: 0.6562
 epoch: 43, train_loss: 0.4979, test_loss: 0.7972, test_f1: 0.6581
 epoch: 44, train_loss: 0.4912, test_loss: 0.7906, test_f1: 0.6886
 epoch: 45, train_loss: 0.4678, test_loss: 0.8938, test_f1: 0.6783
 epoch: 46, train_loss: 0.4822, test_loss: 1.3311, test_f1: 0.5857
 epoch: 47, train_loss: 0.4958, test_loss: 0.8746, test_f1: 0.6567
 epoch: 48, train_loss: 0.4797, test_loss: 0.8945, test_f1: 0.6404
 epoch: 49, train_loss: 0.4611, test_loss: 0.8000, test_f1: 0.6954
 epoch: 50, train_loss: 0.4446, test_loss: 0.8655, test_f1: 0.6804
 epoch: 51, train_loss: 0.4345, test_loss: 1.0066, test_f1: 0.6604
 epoch: 52, train_loss: 0.4178, test_loss: 0.9088, test_f1: 0.6441
 epoch: 53, train_loss: 0.3854, test_loss: 0.9923, test_f1: 0.6632
 epoch: 54, train_loss: 0.3974, test_loss: 0.9705, test_f1: 0.6756
 epoch: 55, train_loss: 0.3861, test_loss: 0.8930, test_f1: 0.6892
 epoch: 56, train_loss: 0.3753, test_loss: 1.0040, test_f1: 0.6949
 epoch: 57, train_loss: 0.3604, test_loss: 1.0428, test_f1: 0.6649
 epoch: 58, train_loss: 0.3693, test_loss: 0.9668, test_f1: 0.6909
 epoch: 59, train_loss: 0.3583, test_loss: 1.0563, test_f1: 0.6669
 epoch: 60, train_loss: 0.3775, test_loss: 1.0368, test_f1: 0.6609
 epoch: 61, train_loss: 0.3537, test_loss: 1.1094, test_f1: 0.6769
 epoch: 62, train_loss: 0.3648, test_loss: 1.1012, test_f1: 0.6641
 epoch: 63, train_loss: 0.3538, test_loss: 0.9646, test_f1: 0.6558
 epoch: 64, train_loss: 0.3528, test_loss: 1.1592, test_f1: 0.6648
 epoch: 65, train_loss: 0.3449, test_loss: 1.0690, test_f1: 0.6715
 epoch: 66, train_loss: 0.3310, test_loss: 1.1363, test_f1: 0.6585
 epoch: 67, train_loss: 0.3337, test_loss: 1.1208, test_f1: 0.6713
 epoch: 68, train_loss: 0.3310, test_loss: 1.1199, test_f1: 0.6844
 epoch: 69, train_loss: 0.3485, test_loss: 1.0184, test_f1: 0.6752
 epoch: 70, train_loss: 0.3286, test_loss: 1.2038, test_f1: 0.6669
 epoch: 71, train_loss: 0.3364, test_loss: 1.1039, test_f1: 0.6838
 epoch: 72, train_loss: 0.3318, test_loss: 1.1110, test_f1: 0.6798
 epoch: 73, train_loss: 0.3211, test_loss: 1.1493, test_f1: 0.6768
 epoch: 74, train_loss: 0.3113, test_loss: 1.1276, test_f1: 0.6859
 epoch: 75, train_loss: 0.2984, test_loss: 1.1061, test_f1: 0.6815
 epoch: 76, train_loss: 0.3090, test_loss: 1.2020, test_f1: 0.6501
 epoch: 77, train_loss: 0.3101, test_loss: 1.1122, test_f1: 0.6678
 epoch: 78, train_loss: 0.3044, test_loss: 1.0759, test_f1: 0.6790
 epoch: 79, train_loss: 0.3055, test_loss: 1.1857, test_f1: 0.6631
 epoch: 80, train_loss: 0.3216, test_loss: 1.2131, test_f1: 0.6463
 epoch: 81, train_loss: 0.3154, test_loss: 1.1465, test_f1: 0.6607
 epoch: 82, train_loss: 0.3077, test_loss: 1.1717, test_f1: 0.6597
 epoch: 83, train_loss: 0.3201, test_loss: 1.1496, test_f1: 0.6699
 epoch: 84, train_loss: 0.3028, test_loss: 1.1418, test_f1: 0.6637
 epoch: 85, train_loss: 0.3065, test_loss: 1.1387, test_f1: 0.6777
 epoch: 86, train_loss: 0.2873, test_loss: 1.2415, test_f1: 0.6584
 epoch: 87, train_loss: 0.3028, test_loss: 1.2520, test_f1: 0.6589
 epoch: 88, train_loss: 0.2864, test_loss: 1.2365, test_f1: 0.6580
 epoch: 89, train_loss: 0.2740, test_loss: 1.2437, test_f1: 0.6466
 epoch: 90, train_loss: 0.2914, test_loss: 1.2632, test_f1: 0.6684
 epoch: 91, train_loss: 0.2835, test_loss: 1.2801, test_f1: 0.6651
 epoch: 92, train_loss: 0.2793, test_loss: 1.3165, test_f1: 0.6374
 epoch: 93, train_loss: 0.2698, test_loss: 1.2142, test_f1: 0.6813
 epoch: 94, train_loss: 0.2623, test_loss: 1.3300, test_f1: 0.6767
 epoch: 95, train_loss: 0.2673, test_loss: 1.3572, test_f1: 0.6729
 epoch: 96, train_loss: 0.2715, test_loss: 1.2637, test_f1: 0.6790
 epoch: 97, train_loss: 0.2726, test_loss: 1.2615, test_f1: 0.6802
 epoch: 98, train_loss: 0.2602, test_loss: 1.2409, test_f1: 0.6740
 epoch: 99, train_loss: 0.2814, test_loss: 1.3652, test_f1: 0.6557
##################ITERATION #5 ****************************************
 epoch: 0, train_loss: 1.2468, test_loss: 1.1580, test_f1: 0.4149
 epoch: 1, train_loss: 1.0064, test_loss: 0.9621, test_f1: 0.4998
 epoch: 2, train_loss: 0.9588, test_loss: 0.9650, test_f1: 0.4908
 epoch: 3, train_loss: 0.9259, test_loss: 0.9104, test_f1: 0.5391
 epoch: 4, train_loss: 0.8968, test_loss: 0.9038, test_f1: 0.5215
 epoch: 5, train_loss: 0.8794, test_loss: 0.9097, test_f1: 0.5680
 epoch: 6, train_loss: 0.8630, test_loss: 0.9630, test_f1: 0.5750
 epoch: 7, train_loss: 0.8398, test_loss: 0.8984, test_f1: 0.5418
 epoch: 8, train_loss: 0.8127, test_loss: 0.8483, test_f1: 0.5668
 epoch: 9, train_loss: 0.7904, test_loss: 0.8258, test_f1: 0.5905
 epoch: 10, train_loss: 0.7818, test_loss: 0.8026, test_f1: 0.6030
 epoch: 11, train_loss: 0.7754, test_loss: 0.8693, test_f1: 0.5987
 epoch: 12, train_loss: 0.7729, test_loss: 0.8188, test_f1: 0.5831
 epoch: 13, train_loss: 0.7434, test_loss: 0.8519, test_f1: 0.6153
 epoch: 14, train_loss: 0.7323, test_loss: 0.7690, test_f1: 0.6261
 epoch: 15, train_loss: 0.7380, test_loss: 0.7525, test_f1: 0.6347
 epoch: 16, train_loss: 0.7143, test_loss: 0.8903, test_f1: 0.6147
 epoch: 17, train_loss: 0.7101, test_loss: 0.7386, test_f1: 0.6456
 epoch: 18, train_loss: 0.6951, test_loss: 0.7315, test_f1: 0.6215
 epoch: 19, train_loss: 0.6850, test_loss: 0.7831, test_f1: 0.6141
 epoch: 20, train_loss: 0.6773, test_loss: 0.7836, test_f1: 0.5983
 epoch: 21, train_loss: 0.6743, test_loss: 0.7385, test_f1: 0.6322
 epoch: 22, train_loss: 0.6487, test_loss: 0.8324, test_f1: 0.6204
 epoch: 23, train_loss: 0.6416, test_loss: 0.7667, test_f1: 0.6299
 epoch: 24, train_loss: 0.6452, test_loss: 0.8323, test_f1: 0.6035
 epoch: 25, train_loss: 0.6155, test_loss: 0.7857, test_f1: 0.6471
 epoch: 26, train_loss: 0.6100, test_loss: 0.7738, test_f1: 0.6555
 epoch: 27, train_loss: 0.6251, test_loss: 0.7447, test_f1: 0.6523
 epoch: 28, train_loss: 0.5905, test_loss: 0.8183, test_f1: 0.6367
 epoch: 29, train_loss: 0.6064, test_loss: 0.7529, test_f1: 0.6583
 epoch: 30, train_loss: 0.5923, test_loss: 0.6923, test_f1: 0.6901
 epoch: 31, train_loss: 0.5778, test_loss: 0.7356, test_f1: 0.6662
 epoch: 32, train_loss: 0.5751, test_loss: 0.7934, test_f1: 0.6447
 epoch: 33, train_loss: 0.5834, test_loss: 0.7560, test_f1: 0.6424
 epoch: 34, train_loss: 0.5666, test_loss: 0.7384, test_f1: 0.6625
 epoch: 35, train_loss: 0.5693, test_loss: 0.8169, test_f1: 0.6496
 epoch: 36, train_loss: 0.5365, test_loss: 0.7781, test_f1: 0.6668
 epoch: 37, train_loss: 0.5400, test_loss: 0.8410, test_f1: 0.6617
 epoch: 38, train_loss: 0.5292, test_loss: 0.8129, test_f1: 0.6723
 epoch: 39, train_loss: 0.5139, test_loss: 0.8387, test_f1: 0.6484
 epoch: 40, train_loss: 0.5095, test_loss: 0.7871, test_f1: 0.6953
 epoch: 41, train_loss: 0.5154, test_loss: 0.7909, test_f1: 0.6652
 epoch: 42, train_loss: 0.5166, test_loss: 0.8660, test_f1: 0.6600
 epoch: 43, train_loss: 0.4952, test_loss: 0.9333, test_f1: 0.6556
 epoch: 44, train_loss: 0.4940, test_loss: 0.8781, test_f1: 0.6363
 epoch: 45, train_loss: 0.4824, test_loss: 0.9438, test_f1: 0.6539
 epoch: 46, train_loss: 0.5081, test_loss: 0.8744, test_f1: 0.6463
 epoch: 47, train_loss: 0.4666, test_loss: 0.8718, test_f1: 0.6643
 epoch: 48, train_loss: 0.4872, test_loss: 0.7913, test_f1: 0.7003
 epoch: 49, train_loss: 0.4605, test_loss: 0.9485, test_f1: 0.6613
 epoch: 50, train_loss: 0.4607, test_loss: 0.9008, test_f1: 0.6406
 epoch: 51, train_loss: 0.4383, test_loss: 0.7954, test_f1: 0.6855
 epoch: 52, train_loss: 0.4017, test_loss: 0.9468, test_f1: 0.6724
 epoch: 53, train_loss: 0.3817, test_loss: 0.9309, test_f1: 0.6780
 epoch: 54, train_loss: 0.3913, test_loss: 1.0041, test_f1: 0.6742
 epoch: 55, train_loss: 0.3876, test_loss: 0.9950, test_f1: 0.6660
 epoch: 56, train_loss: 0.3698, test_loss: 0.9333, test_f1: 0.6826
 epoch: 57, train_loss: 0.3939, test_loss: 0.9890, test_f1: 0.6649
 epoch: 58, train_loss: 0.3838, test_loss: 1.0632, test_f1: 0.6556
 epoch: 59, train_loss: 0.3862, test_loss: 1.0390, test_f1: 0.6806
 epoch: 60, train_loss: 0.3687, test_loss: 1.0299, test_f1: 0.6772
 epoch: 61, train_loss: 0.3616, test_loss: 1.0465, test_f1: 0.6819
 epoch: 62, train_loss: 0.3468, test_loss: 1.0194, test_f1: 0.6566
 epoch: 63, train_loss: 0.3540, test_loss: 1.1144, test_f1: 0.6624
 epoch: 64, train_loss: 0.3574, test_loss: 1.1435, test_f1: 0.6542
 epoch: 65, train_loss: 0.3452, test_loss: 1.0688, test_f1: 0.6651
 epoch: 66, train_loss: 0.3519, test_loss: 1.1290, test_f1: 0.6559
 epoch: 67, train_loss: 0.3664, test_loss: 1.0915, test_f1: 0.6613
 epoch: 68, train_loss: 0.3384, test_loss: 1.0737, test_f1: 0.6700
 epoch: 69, train_loss: 0.3286, test_loss: 1.0840, test_f1: 0.6736
 epoch: 70, train_loss: 0.3235, test_loss: 1.1506, test_f1: 0.6646
 epoch: 71, train_loss: 0.3277, test_loss: 1.1740, test_f1: 0.6786
 epoch: 72, train_loss: 0.3434, test_loss: 1.0896, test_f1: 0.6516
 epoch: 73, train_loss: 0.3165, test_loss: 1.1966, test_f1: 0.6655
 epoch: 74, train_loss: 0.3103, test_loss: 1.1872, test_f1: 0.6527
 epoch: 75, train_loss: 0.3088, test_loss: 1.1992, test_f1: 0.6518
 epoch: 76, train_loss: 0.3028, test_loss: 1.2846, test_f1: 0.6565
 epoch: 77, train_loss: 0.2968, test_loss: 1.3046, test_f1: 0.6590
 epoch: 78, train_loss: 0.3013, test_loss: 1.3868, test_f1: 0.6490
 epoch: 79, train_loss: 0.3012, test_loss: 1.3045, test_f1: 0.6540
 epoch: 80, train_loss: 0.3001, test_loss: 1.2162, test_f1: 0.6736
 epoch: 81, train_loss: 0.2970, test_loss: 1.2716, test_f1: 0.6726
 epoch: 82, train_loss: 0.2862, test_loss: 1.1912, test_f1: 0.6636
 epoch: 83, train_loss: 0.2915, test_loss: 1.3097, test_f1: 0.6552
 epoch: 84, train_loss: 0.2782, test_loss: 1.2451, test_f1: 0.6509
 epoch: 85, train_loss: 0.2880, test_loss: 1.3106, test_f1: 0.6619
 epoch: 86, train_loss: 0.2608, test_loss: 1.3107, test_f1: 0.6530
 epoch: 87, train_loss: 0.2745, test_loss: 1.2478, test_f1: 0.6713
 epoch: 88, train_loss: 0.2737, test_loss: 1.2634, test_f1: 0.6649
 epoch: 89, train_loss: 0.2892, test_loss: 1.3659, test_f1: 0.6478
 epoch: 90, train_loss: 0.2893, test_loss: 1.3524, test_f1: 0.6540
 epoch: 91, train_loss: 0.2854, test_loss: 1.4212, test_f1: 0.6416
 epoch: 92, train_loss: 0.2781, test_loss: 1.2573, test_f1: 0.6695
 epoch: 93, train_loss: 0.2646, test_loss: 1.3982, test_f1: 0.6584
 epoch: 94, train_loss: 0.2698, test_loss: 1.3899, test_f1: 0.6599
 epoch: 95, train_loss: 0.2683, test_loss: 1.3659, test_f1: 0.6564
 epoch: 96, train_loss: 0.2599, test_loss: 1.5609, test_f1: 0.6579
 epoch: 97, train_loss: 0.2537, test_loss: 1.4111, test_f1: 0.6589
 epoch: 98, train_loss: 0.2755, test_loss: 1.3914, test_f1: 0.6740
 epoch: 99, train_loss: 0.2462, test_loss: 1.4060, test_f1: 0.6774
##################ITERATION #6 ****************************************
 epoch: 0, train_loss: 1.3121, test_loss: 1.0249, test_f1: 0.4599
 epoch: 1, train_loss: 1.0048, test_loss: 0.9490, test_f1: 0.5179
 epoch: 2, train_loss: 0.9653, test_loss: 0.9354, test_f1: 0.5179
 epoch: 3, train_loss: 0.9256, test_loss: 0.9567, test_f1: 0.5300
 epoch: 4, train_loss: 0.9013, test_loss: 0.9188, test_f1: 0.5400
 epoch: 5, train_loss: 0.8754, test_loss: 0.8876, test_f1: 0.5411
 epoch: 6, train_loss: 0.8649, test_loss: 0.9182, test_f1: 0.5774
 epoch: 7, train_loss: 0.8565, test_loss: 0.8005, test_f1: 0.5799
 epoch: 8, train_loss: 0.8311, test_loss: 0.8617, test_f1: 0.5743
 epoch: 9, train_loss: 0.8127, test_loss: 0.8924, test_f1: 0.6045
 epoch: 10, train_loss: 0.7978, test_loss: 0.8225, test_f1: 0.6015
 epoch: 11, train_loss: 0.7835, test_loss: 0.8632, test_f1: 0.5724
 epoch: 12, train_loss: 0.7758, test_loss: 0.7822, test_f1: 0.5793
 epoch: 13, train_loss: 0.7453, test_loss: 0.7665, test_f1: 0.5946
 epoch: 14, train_loss: 0.7554, test_loss: 0.8247, test_f1: 0.5971
 epoch: 15, train_loss: 0.7322, test_loss: 0.8277, test_f1: 0.5777
 epoch: 16, train_loss: 0.7205, test_loss: 0.8184, test_f1: 0.5923
 epoch: 17, train_loss: 0.7149, test_loss: 0.7657, test_f1: 0.6262
 epoch: 18, train_loss: 0.7063, test_loss: 0.7600, test_f1: 0.6151
 epoch: 19, train_loss: 0.6906, test_loss: 0.8029, test_f1: 0.6208
 epoch: 20, train_loss: 0.6931, test_loss: 0.7985, test_f1: 0.6339
 epoch: 21, train_loss: 0.6678, test_loss: 0.8597, test_f1: 0.6002
 epoch: 22, train_loss: 0.6616, test_loss: 0.8073, test_f1: 0.6251
 epoch: 23, train_loss: 0.6536, test_loss: 0.7272, test_f1: 0.6679
 epoch: 24, train_loss: 0.6370, test_loss: 0.7667, test_f1: 0.6490
 epoch: 25, train_loss: 0.6283, test_loss: 0.8033, test_f1: 0.6520
 epoch: 26, train_loss: 0.6043, test_loss: 0.8808, test_f1: 0.6157
 epoch: 27, train_loss: 0.5973, test_loss: 0.8418, test_f1: 0.6495
 epoch: 28, train_loss: 0.5970, test_loss: 0.8381, test_f1: 0.6220
 epoch: 29, train_loss: 0.6160, test_loss: 0.7467, test_f1: 0.6587
 epoch: 30, train_loss: 0.6014, test_loss: 0.7623, test_f1: 0.6583
 epoch: 31, train_loss: 0.5894, test_loss: 0.8058, test_f1: 0.6466
 epoch: 32, train_loss: 0.5656, test_loss: 0.7943, test_f1: 0.6870
 epoch: 33, train_loss: 0.5618, test_loss: 0.7771, test_f1: 0.6935
 epoch: 34, train_loss: 0.5735, test_loss: 0.8139, test_f1: 0.6338
 epoch: 35, train_loss: 0.5529, test_loss: 0.8606, test_f1: 0.6431
 epoch: 36, train_loss: 0.5762, test_loss: 0.9363, test_f1: 0.6599
 epoch: 37, train_loss: 0.5090, test_loss: 0.8826, test_f1: 0.6756
 epoch: 38, train_loss: 0.5323, test_loss: 0.8707, test_f1: 0.6594
 epoch: 39, train_loss: 0.5194, test_loss: 0.8189, test_f1: 0.6812
 epoch: 40, train_loss: 0.5103, test_loss: 0.9180, test_f1: 0.6747
 epoch: 41, train_loss: 0.5175, test_loss: 0.8881, test_f1: 0.6617
 epoch: 42, train_loss: 0.5123, test_loss: 0.8850, test_f1: 0.6427
 epoch: 43, train_loss: 0.4901, test_loss: 0.8263, test_f1: 0.6723
 epoch: 44, train_loss: 0.4940, test_loss: 0.9314, test_f1: 0.6579
 epoch: 45, train_loss: 0.4901, test_loss: 0.9526, test_f1: 0.6607
 epoch: 46, train_loss: 0.4885, test_loss: 0.9311, test_f1: 0.6544
 epoch: 47, train_loss: 0.4821, test_loss: 0.9404, test_f1: 0.6474
 epoch: 48, train_loss: 0.4750, test_loss: 0.8638, test_f1: 0.6713
 epoch: 49, train_loss: 0.4614, test_loss: 0.9941, test_f1: 0.6680
 epoch: 50, train_loss: 0.4703, test_loss: 1.0228, test_f1: 0.6889
 epoch: 51, train_loss: 0.4380, test_loss: 0.9761, test_f1: 0.6668
 epoch: 52, train_loss: 0.3977, test_loss: 0.9978, test_f1: 0.6813
 epoch: 53, train_loss: 0.3876, test_loss: 1.0476, test_f1: 0.6595
 epoch: 54, train_loss: 0.3725, test_loss: 1.0490, test_f1: 0.6764
 epoch: 55, train_loss: 0.3656, test_loss: 1.0427, test_f1: 0.6854
 epoch: 56, train_loss: 0.3678, test_loss: 1.1236, test_f1: 0.6764
 epoch: 57, train_loss: 0.3693, test_loss: 1.1119, test_f1: 0.6799
 epoch: 58, train_loss: 0.3639, test_loss: 1.1485, test_f1: 0.6673
 epoch: 59, train_loss: 0.3672, test_loss: 1.1790, test_f1: 0.6725
 epoch: 60, train_loss: 0.3467, test_loss: 1.1207, test_f1: 0.6881
 epoch: 61, train_loss: 0.3394, test_loss: 1.1961, test_f1: 0.6673
 epoch: 62, train_loss: 0.3520, test_loss: 1.2402, test_f1: 0.6875
 epoch: 63, train_loss: 0.3436, test_loss: 1.2180, test_f1: 0.6752
 epoch: 64, train_loss: 0.3451, test_loss: 1.2559, test_f1: 0.6782
 epoch: 65, train_loss: 0.3499, test_loss: 1.2853, test_f1: 0.6757
 epoch: 66, train_loss: 0.3397, test_loss: 1.3437, test_f1: 0.6547
 epoch: 67, train_loss: 0.3276, test_loss: 1.2955, test_f1: 0.6774
 epoch: 68, train_loss: 0.3364, test_loss: 1.2130, test_f1: 0.6719
 epoch: 69, train_loss: 0.3407, test_loss: 1.2559, test_f1: 0.6530
 epoch: 70, train_loss: 0.3327, test_loss: 1.2888, test_f1: 0.6730
 epoch: 71, train_loss: 0.3149, test_loss: 1.3514, test_f1: 0.6620
 epoch: 72, train_loss: 0.2989, test_loss: 1.2950, test_f1: 0.6820
 epoch: 73, train_loss: 0.3351, test_loss: 1.4135, test_f1: 0.6600
 epoch: 74, train_loss: 0.3054, test_loss: 1.3740, test_f1: 0.6524
 epoch: 75, train_loss: 0.3198, test_loss: 1.3476, test_f1: 0.6633
 epoch: 76, train_loss: 0.3074, test_loss: 1.4367, test_f1: 0.6634
 epoch: 77, train_loss: 0.3088, test_loss: 1.4266, test_f1: 0.6743
 epoch: 78, train_loss: 0.2971, test_loss: 1.4858, test_f1: 0.6649
 epoch: 79, train_loss: 0.2990, test_loss: 1.5448, test_f1: 0.6707
 epoch: 80, train_loss: 0.2914, test_loss: 1.4189, test_f1: 0.6800
 epoch: 81, train_loss: 0.2802, test_loss: 1.4414, test_f1: 0.6696
 epoch: 82, train_loss: 0.2840, test_loss: 1.4758, test_f1: 0.6801
 epoch: 83, train_loss: 0.3057, test_loss: 1.4246, test_f1: 0.6867
 epoch: 84, train_loss: 0.2938, test_loss: 1.4834, test_f1: 0.6715
 epoch: 85, train_loss: 0.2788, test_loss: 1.4624, test_f1: 0.6704
 epoch: 86, train_loss: 0.2904, test_loss: 1.5995, test_f1: 0.6748
 epoch: 87, train_loss: 0.2950, test_loss: 1.4607, test_f1: 0.6801
 epoch: 88, train_loss: 0.2750, test_loss: 1.5656, test_f1: 0.6778
 epoch: 89, train_loss: 0.2751, test_loss: 1.5774, test_f1: 0.6789
 epoch: 90, train_loss: 0.2853, test_loss: 1.5417, test_f1: 0.6690
 epoch: 91, train_loss: 0.2593, test_loss: 1.5717, test_f1: 0.6634
 epoch: 92, train_loss: 0.2967, test_loss: 1.6217, test_f1: 0.6750
 epoch: 93, train_loss: 0.2559, test_loss: 1.6608, test_f1: 0.6658
 epoch: 94, train_loss: 0.2724, test_loss: 1.6630, test_f1: 0.6772
 epoch: 95, train_loss: 0.2668, test_loss: 1.6244, test_f1: 0.6607
 epoch: 96, train_loss: 0.2542, test_loss: 1.5178, test_f1: 0.6730
 epoch: 97, train_loss: 0.2921, test_loss: 1.5002, test_f1: 0.6578
 epoch: 98, train_loss: 0.2748, test_loss: 1.5830, test_f1: 0.6624
 epoch: 99, train_loss: 0.2348, test_loss: 1.6341, test_f1: 0.6703
##################ITERATION #7 ****************************************
 epoch: 0, train_loss: 1.3611, test_loss: 1.0783, test_f1: 0.4661
 epoch: 1, train_loss: 1.0354, test_loss: 1.0300, test_f1: 0.5112
 epoch: 2, train_loss: 0.9715, test_loss: 0.9814, test_f1: 0.5251
 epoch: 3, train_loss: 0.9398, test_loss: 0.9718, test_f1: 0.5422
 epoch: 4, train_loss: 0.9202, test_loss: 0.9529, test_f1: 0.5252
 epoch: 5, train_loss: 0.8841, test_loss: 0.9632, test_f1: 0.5468
 epoch: 6, train_loss: 0.8829, test_loss: 0.9394, test_f1: 0.5853
 epoch: 7, train_loss: 0.8625, test_loss: 0.8678, test_f1: 0.5761
 epoch: 8, train_loss: 0.8428, test_loss: 0.8392, test_f1: 0.5787
 epoch: 9, train_loss: 0.8223, test_loss: 0.8378, test_f1: 0.5759
 epoch: 10, train_loss: 0.8026, test_loss: 0.8497, test_f1: 0.6059
 epoch: 11, train_loss: 0.8043, test_loss: 0.8473, test_f1: 0.5601
 epoch: 12, train_loss: 0.7865, test_loss: 0.9382, test_f1: 0.5429
 epoch: 13, train_loss: 0.7729, test_loss: 0.8666, test_f1: 0.6099
 epoch: 14, train_loss: 0.7548, test_loss: 0.8187, test_f1: 0.6138
 epoch: 15, train_loss: 0.7419, test_loss: 0.7844, test_f1: 0.6196
 epoch: 16, train_loss: 0.7315, test_loss: 0.7894, test_f1: 0.5961
 epoch: 17, train_loss: 0.7099, test_loss: 0.8054, test_f1: 0.6180
 epoch: 18, train_loss: 0.7207, test_loss: 0.8141, test_f1: 0.6150
 epoch: 19, train_loss: 0.7020, test_loss: 0.7655, test_f1: 0.6312
 epoch: 20, train_loss: 0.6822, test_loss: 0.7072, test_f1: 0.6457
 epoch: 21, train_loss: 0.6876, test_loss: 0.7658, test_f1: 0.6243
 epoch: 22, train_loss: 0.6819, test_loss: 0.7587, test_f1: 0.6488
 epoch: 23, train_loss: 0.6565, test_loss: 0.7825, test_f1: 0.6468
 epoch: 24, train_loss: 0.6466, test_loss: 0.7335, test_f1: 0.6317
 epoch: 25, train_loss: 0.6362, test_loss: 0.7540, test_f1: 0.6510
 epoch: 26, train_loss: 0.6507, test_loss: 0.7338, test_f1: 0.6849
 epoch: 27, train_loss: 0.6346, test_loss: 0.7366, test_f1: 0.6373
 epoch: 28, train_loss: 0.6197, test_loss: 0.8071, test_f1: 0.6304
 epoch: 29, train_loss: 0.6088, test_loss: 0.8162, test_f1: 0.6426
 epoch: 30, train_loss: 0.6166, test_loss: 0.7543, test_f1: 0.6397
 epoch: 31, train_loss: 0.5956, test_loss: 0.8338, test_f1: 0.6514
 epoch: 32, train_loss: 0.5913, test_loss: 0.7263, test_f1: 0.6521
 epoch: 33, train_loss: 0.5895, test_loss: 0.8381, test_f1: 0.6567
 epoch: 34, train_loss: 0.5899, test_loss: 0.7622, test_f1: 0.6399
 epoch: 35, train_loss: 0.5706, test_loss: 0.8035, test_f1: 0.6835
 epoch: 36, train_loss: 0.5682, test_loss: 0.7636, test_f1: 0.6500
 epoch: 37, train_loss: 0.5549, test_loss: 0.7642, test_f1: 0.6449
 epoch: 38, train_loss: 0.5466, test_loss: 0.8167, test_f1: 0.6462
 epoch: 39, train_loss: 0.5314, test_loss: 0.8075, test_f1: 0.6569
 epoch: 40, train_loss: 0.5470, test_loss: 0.8761, test_f1: 0.6423
 epoch: 41, train_loss: 0.5440, test_loss: 1.0036, test_f1: 0.6282
 epoch: 42, train_loss: 0.5208, test_loss: 0.8228, test_f1: 0.6729
 epoch: 43, train_loss: 0.5318, test_loss: 0.8833, test_f1: 0.6682
 epoch: 44, train_loss: 0.5170, test_loss: 0.8472, test_f1: 0.6644
 epoch: 45, train_loss: 0.4852, test_loss: 0.8120, test_f1: 0.6656
 epoch: 46, train_loss: 0.4892, test_loss: 0.8159, test_f1: 0.6486
 epoch: 47, train_loss: 0.4854, test_loss: 0.9613, test_f1: 0.6432
 epoch: 48, train_loss: 0.5022, test_loss: 0.9100, test_f1: 0.6868
 epoch: 49, train_loss: 0.5047, test_loss: 0.7281, test_f1: 0.6991
 epoch: 50, train_loss: 0.4861, test_loss: 0.9244, test_f1: 0.6542
 epoch: 51, train_loss: 0.4418, test_loss: 0.8525, test_f1: 0.6705
 epoch: 52, train_loss: 0.4232, test_loss: 0.9492, test_f1: 0.6693
 epoch: 53, train_loss: 0.4188, test_loss: 0.9583, test_f1: 0.6680
 epoch: 54, train_loss: 0.4202, test_loss: 0.8817, test_f1: 0.6769
 epoch: 55, train_loss: 0.3971, test_loss: 0.9180, test_f1: 0.6747
 epoch: 56, train_loss: 0.3848, test_loss: 0.9101, test_f1: 0.6688
 epoch: 57, train_loss: 0.3882, test_loss: 1.0079, test_f1: 0.6599
 epoch: 58, train_loss: 0.3932, test_loss: 0.9747, test_f1: 0.6591
 epoch: 59, train_loss: 0.4048, test_loss: 0.9736, test_f1: 0.6678
 epoch: 60, train_loss: 0.3837, test_loss: 0.8519, test_f1: 0.6819
 epoch: 61, train_loss: 0.3889, test_loss: 0.9480, test_f1: 0.6636
 epoch: 62, train_loss: 0.3692, test_loss: 1.0308, test_f1: 0.6571
 epoch: 63, train_loss: 0.3684, test_loss: 0.9819, test_f1: 0.6781
 epoch: 64, train_loss: 0.3655, test_loss: 1.0394, test_f1: 0.6677
 epoch: 65, train_loss: 0.3660, test_loss: 1.0076, test_f1: 0.6987
 epoch: 66, train_loss: 0.3576, test_loss: 1.0802, test_f1: 0.6561
 epoch: 67, train_loss: 0.3715, test_loss: 1.1804, test_f1: 0.6565
 epoch: 68, train_loss: 0.3516, test_loss: 1.1246, test_f1: 0.6637
 epoch: 69, train_loss: 0.3571, test_loss: 1.1280, test_f1: 0.6757
 epoch: 70, train_loss: 0.3554, test_loss: 1.1317, test_f1: 0.6661
 epoch: 71, train_loss: 0.3691, test_loss: 1.0973, test_f1: 0.6618
 epoch: 72, train_loss: 0.3369, test_loss: 1.1363, test_f1: 0.6393
 epoch: 73, train_loss: 0.3354, test_loss: 1.1863, test_f1: 0.6563
 epoch: 74, train_loss: 0.3475, test_loss: 1.1826, test_f1: 0.6705
 epoch: 75, train_loss: 0.3360, test_loss: 1.1479, test_f1: 0.6730
 epoch: 76, train_loss: 0.3151, test_loss: 1.2578, test_f1: 0.6646
 epoch: 77, train_loss: 0.3325, test_loss: 1.2715, test_f1: 0.6468
 epoch: 78, train_loss: 0.3192, test_loss: 1.1735, test_f1: 0.6734
 epoch: 79, train_loss: 0.3196, test_loss: 1.2086, test_f1: 0.6668
 epoch: 80, train_loss: 0.3092, test_loss: 1.1792, test_f1: 0.6654
 epoch: 81, train_loss: 0.3280, test_loss: 1.2054, test_f1: 0.6528
 epoch: 82, train_loss: 0.3042, test_loss: 1.1353, test_f1: 0.6498
 epoch: 83, train_loss: 0.3063, test_loss: 1.1323, test_f1: 0.6643
 epoch: 84, train_loss: 0.3246, test_loss: 1.2525, test_f1: 0.6591
 epoch: 85, train_loss: 0.2933, test_loss: 1.2463, test_f1: 0.6722
 epoch: 86, train_loss: 0.3104, test_loss: 1.2945, test_f1: 0.6500
 epoch: 87, train_loss: 0.3163, test_loss: 1.2432, test_f1: 0.6665
 epoch: 88, train_loss: 0.3052, test_loss: 1.3083, test_f1: 0.6762
 epoch: 89, train_loss: 0.3072, test_loss: 1.2684, test_f1: 0.6776
 epoch: 90, train_loss: 0.2910, test_loss: 1.2826, test_f1: 0.6671
 epoch: 91, train_loss: 0.2836, test_loss: 1.3645, test_f1: 0.6560
 epoch: 92, train_loss: 0.2834, test_loss: 1.3040, test_f1: 0.6636
 epoch: 93, train_loss: 0.3054, test_loss: 1.2811, test_f1: 0.6606
 epoch: 94, train_loss: 0.3060, test_loss: 1.3188, test_f1: 0.6668
 epoch: 95, train_loss: 0.2625, test_loss: 1.3553, test_f1: 0.6598
 epoch: 96, train_loss: 0.2881, test_loss: 1.3817, test_f1: 0.6609
 epoch: 97, train_loss: 0.2747, test_loss: 1.2879, test_f1: 0.6862
 epoch: 98, train_loss: 0.2729, test_loss: 1.2707, test_f1: 0.6779
 epoch: 99, train_loss: 0.2724, test_loss: 1.5140, test_f1: 0.6494
##################ITERATION #8 ****************************************
 epoch: 0, train_loss: 1.3556, test_loss: 1.3264, test_f1: 0.3206
 epoch: 1, train_loss: 1.0008, test_loss: 0.9615, test_f1: 0.5072
 epoch: 2, train_loss: 0.9657, test_loss: 0.9833, test_f1: 0.5170
 epoch: 3, train_loss: 0.9287, test_loss: 0.9480, test_f1: 0.5397
 epoch: 4, train_loss: 0.9200, test_loss: 0.9323, test_f1: 0.5088
 epoch: 5, train_loss: 0.8946, test_loss: 0.9219, test_f1: 0.5516
 epoch: 6, train_loss: 0.8858, test_loss: 0.8979, test_f1: 0.5368
 epoch: 7, train_loss: 0.8451, test_loss: 0.8485, test_f1: 0.5927
 epoch: 8, train_loss: 0.8346, test_loss: 0.8639, test_f1: 0.5768
 epoch: 9, train_loss: 0.8302, test_loss: 0.8975, test_f1: 0.5513
 epoch: 10, train_loss: 0.8023, test_loss: 0.8219, test_f1: 0.5942
 epoch: 11, train_loss: 0.7860, test_loss: 0.8522, test_f1: 0.5996
 epoch: 12, train_loss: 0.7746, test_loss: 0.8518, test_f1: 0.5917
 epoch: 13, train_loss: 0.7738, test_loss: 0.8536, test_f1: 0.5939
 epoch: 14, train_loss: 0.7450, test_loss: 0.7982, test_f1: 0.5987
 epoch: 15, train_loss: 0.7332, test_loss: 0.8476, test_f1: 0.5830
 epoch: 16, train_loss: 0.7449, test_loss: 0.8127, test_f1: 0.6256
 epoch: 17, train_loss: 0.6996, test_loss: 0.7553, test_f1: 0.6204
 epoch: 18, train_loss: 0.7105, test_loss: 0.8260, test_f1: 0.5939
 epoch: 19, train_loss: 0.6853, test_loss: 0.7462, test_f1: 0.6363
 epoch: 20, train_loss: 0.6868, test_loss: 0.8773, test_f1: 0.6300
 epoch: 21, train_loss: 0.6808, test_loss: 0.7434, test_f1: 0.6422
 epoch: 22, train_loss: 0.6646, test_loss: 0.7864, test_f1: 0.6169
 epoch: 23, train_loss: 0.6545, test_loss: 0.7724, test_f1: 0.6427
 epoch: 24, train_loss: 0.6548, test_loss: 0.7880, test_f1: 0.6054
 epoch: 25, train_loss: 0.6310, test_loss: 0.7305, test_f1: 0.6540
 epoch: 26, train_loss: 0.6103, test_loss: 0.7702, test_f1: 0.6531
 epoch: 27, train_loss: 0.6258, test_loss: 0.7474, test_f1: 0.6519
 epoch: 28, train_loss: 0.5924, test_loss: 0.7947, test_f1: 0.6512
 epoch: 29, train_loss: 0.6089, test_loss: 0.7831, test_f1: 0.6655
 epoch: 30, train_loss: 0.5898, test_loss: 0.7683, test_f1: 0.6554
 epoch: 31, train_loss: 0.5951, test_loss: 0.8413, test_f1: 0.6294
 epoch: 32, train_loss: 0.5886, test_loss: 0.8310, test_f1: 0.6202
 epoch: 33, train_loss: 0.5946, test_loss: 0.8113, test_f1: 0.6379
 epoch: 34, train_loss: 0.5928, test_loss: 0.7734, test_f1: 0.6626
 epoch: 35, train_loss: 0.5681, test_loss: 0.8870, test_f1: 0.6242
 epoch: 36, train_loss: 0.5626, test_loss: 0.7639, test_f1: 0.6666
 epoch: 37, train_loss: 0.5812, test_loss: 0.7333, test_f1: 0.6656
 epoch: 38, train_loss: 0.5588, test_loss: 0.7823, test_f1: 0.6625
 epoch: 39, train_loss: 0.5399, test_loss: 0.8377, test_f1: 0.6452
 epoch: 40, train_loss: 0.5535, test_loss: 0.8475, test_f1: 0.6591
 epoch: 41, train_loss: 0.5314, test_loss: 0.8507, test_f1: 0.6593
 epoch: 42, train_loss: 0.5452, test_loss: 0.8350, test_f1: 0.6871
 epoch: 43, train_loss: 0.5391, test_loss: 0.8573, test_f1: 0.6592
 epoch: 44, train_loss: 0.5438, test_loss: 0.8065, test_f1: 0.6684
 epoch: 45, train_loss: 0.5224, test_loss: 0.8937, test_f1: 0.6332
 epoch: 46, train_loss: 0.4885, test_loss: 0.8571, test_f1: 0.6510
 epoch: 47, train_loss: 0.5087, test_loss: 0.8172, test_f1: 0.6599
 epoch: 48, train_loss: 0.4942, test_loss: 0.8430, test_f1: 0.6589
 epoch: 49, train_loss: 0.5225, test_loss: 0.8590, test_f1: 0.6418
 epoch: 50, train_loss: 0.5111, test_loss: 0.8212, test_f1: 0.6765
 epoch: 51, train_loss: 0.4591, test_loss: 0.8597, test_f1: 0.6890
 epoch: 52, train_loss: 0.4592, test_loss: 0.8464, test_f1: 0.6739
 epoch: 53, train_loss: 0.4345, test_loss: 0.8549, test_f1: 0.6663
 epoch: 54, train_loss: 0.4178, test_loss: 0.8574, test_f1: 0.6697
 epoch: 55, train_loss: 0.4013, test_loss: 0.9550, test_f1: 0.6637
 epoch: 56, train_loss: 0.4232, test_loss: 0.9404, test_f1: 0.6766
 epoch: 57, train_loss: 0.4073, test_loss: 1.0423, test_f1: 0.6733
 epoch: 58, train_loss: 0.4179, test_loss: 0.8918, test_f1: 0.6670
 epoch: 59, train_loss: 0.4231, test_loss: 1.0012, test_f1: 0.6668
 epoch: 60, train_loss: 0.4108, test_loss: 0.9836, test_f1: 0.6924
 epoch: 61, train_loss: 0.4052, test_loss: 0.9875, test_f1: 0.6860
 epoch: 62, train_loss: 0.3852, test_loss: 1.0484, test_f1: 0.6793
 epoch: 63, train_loss: 0.4047, test_loss: 0.9814, test_f1: 0.6734
 epoch: 64, train_loss: 0.3800, test_loss: 1.0114, test_f1: 0.6537
 epoch: 65, train_loss: 0.3909, test_loss: 1.0857, test_f1: 0.6769
 epoch: 66, train_loss: 0.4088, test_loss: 1.0616, test_f1: 0.6691
 epoch: 67, train_loss: 0.3859, test_loss: 0.9642, test_f1: 0.6607
 epoch: 68, train_loss: 0.3866, test_loss: 0.9851, test_f1: 0.6857
 epoch: 69, train_loss: 0.3715, test_loss: 1.0606, test_f1: 0.6620
 epoch: 70, train_loss: 0.3717, test_loss: 1.1032, test_f1: 0.6553
 epoch: 71, train_loss: 0.3749, test_loss: 1.0444, test_f1: 0.6788
 epoch: 72, train_loss: 0.3600, test_loss: 1.1234, test_f1: 0.6538
 epoch: 73, train_loss: 0.3698, test_loss: 1.0582, test_f1: 0.6652
 epoch: 74, train_loss: 0.3677, test_loss: 1.0577, test_f1: 0.6785
 epoch: 75, train_loss: 0.3510, test_loss: 1.1526, test_f1: 0.6566
 epoch: 76, train_loss: 0.3525, test_loss: 1.0471, test_f1: 0.6715
 epoch: 77, train_loss: 0.3558, test_loss: 1.0419, test_f1: 0.6729
 epoch: 78, train_loss: 0.3650, test_loss: 1.0434, test_f1: 0.6804
 epoch: 79, train_loss: 0.3577, test_loss: 1.0091, test_f1: 0.6792
 epoch: 80, train_loss: 0.3445, test_loss: 1.1531, test_f1: 0.6686
 epoch: 81, train_loss: 0.3301, test_loss: 1.1774, test_f1: 0.6461
 epoch: 82, train_loss: 0.3398, test_loss: 1.1553, test_f1: 0.6503
 epoch: 83, train_loss: 0.3508, test_loss: 1.1251, test_f1: 0.6623
 epoch: 84, train_loss: 0.3255, test_loss: 1.1662, test_f1: 0.6741
 epoch: 85, train_loss: 0.3343, test_loss: 1.0540, test_f1: 0.6740
 epoch: 86, train_loss: 0.3477, test_loss: 1.1200, test_f1: 0.6743
 epoch: 87, train_loss: 0.3239, test_loss: 1.1787, test_f1: 0.6749
 epoch: 88, train_loss: 0.3377, test_loss: 1.2230, test_f1: 0.6732
 epoch: 89, train_loss: 0.3325, test_loss: 1.2442, test_f1: 0.6617
 epoch: 90, train_loss: 0.3075, test_loss: 1.2751, test_f1: 0.6561
 epoch: 91, train_loss: 0.3155, test_loss: 1.1827, test_f1: 0.6556
 epoch: 92, train_loss: 0.3279, test_loss: 1.2277, test_f1: 0.6665
 epoch: 93, train_loss: 0.3362, test_loss: 1.2583, test_f1: 0.6443
 epoch: 94, train_loss: 0.3133, test_loss: 1.2368, test_f1: 0.6724
 epoch: 95, train_loss: 0.3126, test_loss: 1.2784, test_f1: 0.6553
 epoch: 96, train_loss: 0.3256, test_loss: 1.1880, test_f1: 0.6688
 epoch: 97, train_loss: 0.2972, test_loss: 1.2398, test_f1: 0.6580
 epoch: 98, train_loss: 0.3222, test_loss: 1.2502, test_f1: 0.6484
 epoch: 99, train_loss: 0.3022, test_loss: 1.2868, test_f1: 0.6582
##################ITERATION #9 ****************************************
 epoch: 0, train_loss: 1.2888, test_loss: 1.0924, test_f1: 0.3602
 epoch: 1, train_loss: 0.9937, test_loss: 0.9387, test_f1: 0.4944
 epoch: 2, train_loss: 0.9537, test_loss: 0.9401, test_f1: 0.5276
 epoch: 3, train_loss: 0.9269, test_loss: 0.9030, test_f1: 0.5377
 epoch: 4, train_loss: 0.9006, test_loss: 0.9305, test_f1: 0.5380
 epoch: 5, train_loss: 0.8848, test_loss: 0.8720, test_f1: 0.5468
 epoch: 6, train_loss: 0.8853, test_loss: 0.9282, test_f1: 0.5455
 epoch: 7, train_loss: 0.8666, test_loss: 0.8754, test_f1: 0.5658
 epoch: 8, train_loss: 0.8300, test_loss: 0.9039, test_f1: 0.5997
 epoch: 9, train_loss: 0.8170, test_loss: 0.8197, test_f1: 0.5963
 epoch: 10, train_loss: 0.7983, test_loss: 0.8104, test_f1: 0.6221
 epoch: 11, train_loss: 0.7785, test_loss: 0.7985, test_f1: 0.5924
 epoch: 12, train_loss: 0.7698, test_loss: 0.8115, test_f1: 0.6070
 epoch: 13, train_loss: 0.7578, test_loss: 0.8130, test_f1: 0.6047
 epoch: 14, train_loss: 0.7572, test_loss: 0.7963, test_f1: 0.5824
 epoch: 15, train_loss: 0.7370, test_loss: 0.7326, test_f1: 0.6135
 epoch: 16, train_loss: 0.7210, test_loss: 0.8091, test_f1: 0.6267
 epoch: 17, train_loss: 0.7163, test_loss: 0.8081, test_f1: 0.5690
 epoch: 18, train_loss: 0.6882, test_loss: 0.7531, test_f1: 0.6326
 epoch: 19, train_loss: 0.6863, test_loss: 0.7879, test_f1: 0.6131
 epoch: 20, train_loss: 0.6991, test_loss: 0.7667, test_f1: 0.6423
 epoch: 21, train_loss: 0.6717, test_loss: 0.7258, test_f1: 0.6310
 epoch: 22, train_loss: 0.6641, test_loss: 0.7740, test_f1: 0.6216
 epoch: 23, train_loss: 0.6504, test_loss: 0.7514, test_f1: 0.6337
 epoch: 24, train_loss: 0.6336, test_loss: 0.7035, test_f1: 0.6527
 epoch: 25, train_loss: 0.6511, test_loss: 0.8136, test_f1: 0.6077
 epoch: 26, train_loss: 0.6377, test_loss: 0.8066, test_f1: 0.6128
 epoch: 27, train_loss: 0.6218, test_loss: 0.7740, test_f1: 0.6147
 epoch: 28, train_loss: 0.6063, test_loss: 0.7507, test_f1: 0.6297
 epoch: 29, train_loss: 0.5941, test_loss: 0.7557, test_f1: 0.6654
 epoch: 30, train_loss: 0.5904, test_loss: 0.7827, test_f1: 0.6183
 epoch: 31, train_loss: 0.6076, test_loss: 0.7927, test_f1: 0.6331
 epoch: 32, train_loss: 0.5949, test_loss: 0.8504, test_f1: 0.6346
 epoch: 33, train_loss: 0.5690, test_loss: 0.7495, test_f1: 0.6392
 epoch: 34, train_loss: 0.5732, test_loss: 0.7363, test_f1: 0.6368
 epoch: 35, train_loss: 0.5745, test_loss: 0.7479, test_f1: 0.6554
 epoch: 36, train_loss: 0.5580, test_loss: 0.7365, test_f1: 0.6758
 epoch: 37, train_loss: 0.5486, test_loss: 0.7339, test_f1: 0.6633
 epoch: 38, train_loss: 0.5530, test_loss: 0.7335, test_f1: 0.6616
 epoch: 39, train_loss: 0.5367, test_loss: 0.6932, test_f1: 0.6761
 epoch: 40, train_loss: 0.5390, test_loss: 0.7543, test_f1: 0.6438
 epoch: 41, train_loss: 0.5387, test_loss: 0.7028, test_f1: 0.6848
 epoch: 42, train_loss: 0.5290, test_loss: 0.7435, test_f1: 0.6764
 epoch: 43, train_loss: 0.5393, test_loss: 0.7704, test_f1: 0.6565
 epoch: 44, train_loss: 0.5221, test_loss: 0.8624, test_f1: 0.6778
 epoch: 45, train_loss: 0.5147, test_loss: 0.7214, test_f1: 0.6476
 epoch: 46, train_loss: 0.5089, test_loss: 0.7900, test_f1: 0.6530
 epoch: 47, train_loss: 0.4919, test_loss: 0.8630, test_f1: 0.6692
 epoch: 48, train_loss: 0.4921, test_loss: 0.8032, test_f1: 0.6779
 epoch: 49, train_loss: 0.4722, test_loss: 0.8881, test_f1: 0.6584
 epoch: 50, train_loss: 0.4931, test_loss: 0.8174, test_f1: 0.6754
 epoch: 51, train_loss: 0.4431, test_loss: 0.8502, test_f1: 0.6691
 epoch: 52, train_loss: 0.4345, test_loss: 0.8970, test_f1: 0.6600
 epoch: 53, train_loss: 0.4175, test_loss: 0.8169, test_f1: 0.6944
 epoch: 54, train_loss: 0.4098, test_loss: 0.9056, test_f1: 0.6899
 epoch: 55, train_loss: 0.4140, test_loss: 0.8673, test_f1: 0.6788
 epoch: 56, train_loss: 0.4037, test_loss: 0.9468, test_f1: 0.6798
 epoch: 57, train_loss: 0.3897, test_loss: 1.0566, test_f1: 0.6724
 epoch: 58, train_loss: 0.3936, test_loss: 0.8803, test_f1: 0.6924
 epoch: 59, train_loss: 0.3864, test_loss: 0.9524, test_f1: 0.6820
 epoch: 60, train_loss: 0.3875, test_loss: 0.9743, test_f1: 0.6733
 epoch: 61, train_loss: 0.3731, test_loss: 1.0329, test_f1: 0.6715
 epoch: 62, train_loss: 0.3830, test_loss: 1.0335, test_f1: 0.6857
 epoch: 63, train_loss: 0.3810, test_loss: 1.1131, test_f1: 0.6616
 epoch: 64, train_loss: 0.3826, test_loss: 0.9290, test_f1: 0.6866
 epoch: 65, train_loss: 0.3813, test_loss: 1.0758, test_f1: 0.6635
 epoch: 66, train_loss: 0.3807, test_loss: 1.0510, test_f1: 0.6963
 epoch: 67, train_loss: 0.3641, test_loss: 0.9168, test_f1: 0.7050
 epoch: 68, train_loss: 0.3510, test_loss: 1.0101, test_f1: 0.6981
 epoch: 69, train_loss: 0.3493, test_loss: 1.0828, test_f1: 0.6793
 epoch: 70, train_loss: 0.3739, test_loss: 0.9517, test_f1: 0.6907
 epoch: 71, train_loss: 0.3421, test_loss: 1.0272, test_f1: 0.6945
 epoch: 72, train_loss: 0.3368, test_loss: 1.0618, test_f1: 0.6667
 epoch: 73, train_loss: 0.3593, test_loss: 1.0707, test_f1: 0.6877
 epoch: 74, train_loss: 0.3399, test_loss: 1.1248, test_f1: 0.6668
 epoch: 75, train_loss: 0.3355, test_loss: 1.1202, test_f1: 0.6819
 epoch: 76, train_loss: 0.3367, test_loss: 1.0132, test_f1: 0.6919
 epoch: 77, train_loss: 0.3480, test_loss: 1.1754, test_f1: 0.6756
 epoch: 78, train_loss: 0.3448, test_loss: 1.1636, test_f1: 0.6763
 epoch: 79, train_loss: 0.3283, test_loss: 1.1874, test_f1: 0.6806
 epoch: 80, train_loss: 0.3303, test_loss: 1.0507, test_f1: 0.6615
 epoch: 81, train_loss: 0.3314, test_loss: 1.1020, test_f1: 0.6714
 epoch: 82, train_loss: 0.3072, test_loss: 1.2270, test_f1: 0.6653
 epoch: 83, train_loss: 0.3357, test_loss: 1.1269, test_f1: 0.7059
 epoch: 84, train_loss: 0.3089, test_loss: 1.1369, test_f1: 0.6399
 epoch: 85, train_loss: 0.3099, test_loss: 1.2672, test_f1: 0.6882
 epoch: 86, train_loss: 0.3282, test_loss: 1.3054, test_f1: 0.6544
 epoch: 87, train_loss: 0.3121, test_loss: 1.2134, test_f1: 0.6681
 epoch: 88, train_loss: 0.3045, test_loss: 1.2686, test_f1: 0.6762
 epoch: 89, train_loss: 0.3041, test_loss: 1.2670, test_f1: 0.6801
 epoch: 90, train_loss: 0.3076, test_loss: 1.2635, test_f1: 0.6993
 epoch: 91, train_loss: 0.2943, test_loss: 1.2846, test_f1: 0.6757
 epoch: 92, train_loss: 0.3014, test_loss: 1.3322, test_f1: 0.6728
 epoch: 93, train_loss: 0.2824, test_loss: 1.3102, test_f1: 0.6640
 epoch: 94, train_loss: 0.2809, test_loss: 1.3446, test_f1: 0.6745
 epoch: 95, train_loss: 0.3041, test_loss: 1.3169, test_f1: 0.6979
 epoch: 96, train_loss: 0.2902, test_loss: 1.1384, test_f1: 0.7043
 epoch: 97, train_loss: 0.2700, test_loss: 1.3214, test_f1: 0.6710
 epoch: 98, train_loss: 0.2651, test_loss: 1.4417, test_f1: 0.6588
 epoch: 99, train_loss: 0.2886, test_loss: 1.1992, test_f1: 0.6924

Training completed in 706.06 seconds
Best F1: 0.7116 at epoch 50
Mean F1 across iterations: 0.6980  0.0078
========================FINAL RESULTS================================
FEGIN weighted F1: 0.7116  0.0078
python main.py --data ltspice_examples --representation component_pin_net --model FEGIN --layers 4 --hiddens 64 --batch_size 64 --lr 0.001 --emb_size 128 --epochs 100 --save_appendix component_pin_net_L4_H64_BS64_LR0.001_E128 --no_val
-----



STDERR:
  File "main.py", line 370, in <module>
    main()
  File "main.py", line 254, in main
    dataset = dataset_class(
  File "/home/philip/projects/ltspice_examples_code_repo/Circuit-Completion-Using-GNNs/component_classification_with_link_prediction_head/evaluation/FEGIN/kernel/circuit_datasets.py", line 15, in __init__
    self.data, self.slices = torch.load(self.processed_paths[0])
  File "/home/philip/.local/lib/python3.8/site-packages/torch/serialization.py", line 1040, in load
    warnings.warn(
  File "/usr/lib/python3.8/warnings.py", line 109, in _showwarnmsg
    sw(msg.message, msg.category, msg.filename, msg.lineno,
  File "main.py", line 47, in warn_with_traceback
    traceback.print_stack(file=log)
/home/philip/projects/ltspice_examples_code_repo/Circuit-Completion-Using-GNNs/component_classification_with_link_prediction_head/evaluation/FEGIN/kernel/circuit_datasets.py:15: FutureWarning: You are using `torch.load` with `weights_only=False` (the current default value), which uses the default pickle module implicitly. It is possible to construct malicious pickle data which will execute arbitrary code during unpickling (See https://github.com/pytorch/pytorch/blob/main/SECURITY.md#untrusted-models for more details). In a future release, the default value for `weights_only` will be flipped to `True`. This limits the functions that could be executed during unpickling. Arbitrary objects will no longer be allowed to be loaded via this mode unless they are explicitly allowlisted by the user via `torch.serialization.add_safe_globals`. We recommend you start setting `weights_only=True` for any use case where you don't have full control of the loaded file. Please open an issue on GitHub for any issues related to this experimental feature.
  self.data, self.slices = torch.load(self.processed_paths[0])
