STDOUT:
Results will be saved in /home/philip/projects/ltspice_examples_code_repo/Circuit-Completion-Using-GNNs/component_classification_with_link_prediction_head/evaluation/FEGIN/results/model_FEGIN_dataset_ltspice_examples
Command line input: python main.py --data ltspice_examples --representation component_net --model FEGIN --layers 5 --hiddens 32 --batch_size 128 --lr 0.0001 --emb_size 250 --epochs 100 --save_appendix component_net_L5_H32_BS128_LR0.0001_E250 --no_val
 is saved.
-----
ltspice_examples - FEGIN
Using 5 layers, 32 hidden units, h = 2
Loading component_net representation dataset
ENTERED
Training FEGIN on component_net representation
Train: 3558, Test: 846
##################ITERATION #0 ****************************************
 epoch: 0, train_loss: 1.4192, test_loss: 1.4163, test_f1: 0.1004
 epoch: 1, train_loss: 1.4100, test_loss: 1.4045, test_f1: 0.1004
 epoch: 2, train_loss: 1.4040, test_loss: 1.3995, test_f1: 0.1003
 epoch: 3, train_loss: 1.3975, test_loss: 1.3919, test_f1: 0.1144
 epoch: 4, train_loss: 1.3913, test_loss: 1.3847, test_f1: 0.1195
 epoch: 5, train_loss: 1.3836, test_loss: 1.3765, test_f1: 0.1453
 epoch: 6, train_loss: 1.3755, test_loss: 1.3680, test_f1: 0.2163
 epoch: 7, train_loss: 1.3659, test_loss: 1.3586, test_f1: 0.3024
 epoch: 8, train_loss: 1.3561, test_loss: 1.3479, test_f1: 0.3378
 epoch: 9, train_loss: 1.3452, test_loss: 1.3366, test_f1: 0.3338
 epoch: 10, train_loss: 1.3321, test_loss: 1.3244, test_f1: 0.3363
 epoch: 11, train_loss: 1.3216, test_loss: 1.3116, test_f1: 0.3348
 epoch: 12, train_loss: 1.3064, test_loss: 1.2980, test_f1: 0.3314
 epoch: 13, train_loss: 1.2965, test_loss: 1.2844, test_f1: 0.3259
 epoch: 14, train_loss: 1.2814, test_loss: 1.2714, test_f1: 0.3271
 epoch: 15, train_loss: 1.2709, test_loss: 1.2587, test_f1: 0.3263
 epoch: 16, train_loss: 1.2538, test_loss: 1.2464, test_f1: 0.3330
 epoch: 17, train_loss: 1.2419, test_loss: 1.2349, test_f1: 0.3312
 epoch: 18, train_loss: 1.2319, test_loss: 1.2224, test_f1: 0.3457
 epoch: 19, train_loss: 1.2205, test_loss: 1.2148, test_f1: 0.3441
 epoch: 20, train_loss: 1.2100, test_loss: 1.2037, test_f1: 0.3433
 epoch: 21, train_loss: 1.1954, test_loss: 1.1898, test_f1: 0.3488
 epoch: 22, train_loss: 1.1929, test_loss: 1.1827, test_f1: 0.3610
 epoch: 23, train_loss: 1.1798, test_loss: 1.1752, test_f1: 0.3618
 epoch: 24, train_loss: 1.1715, test_loss: 1.1680, test_f1: 0.3631
 epoch: 25, train_loss: 1.1664, test_loss: 1.1574, test_f1: 0.3923
 epoch: 26, train_loss: 1.1606, test_loss: 1.1477, test_f1: 0.3982
 epoch: 27, train_loss: 1.1531, test_loss: 1.1445, test_f1: 0.4044
 epoch: 28, train_loss: 1.1435, test_loss: 1.1378, test_f1: 0.4205
 epoch: 29, train_loss: 1.1382, test_loss: 1.1322, test_f1: 0.4187
 epoch: 30, train_loss: 1.1259, test_loss: 1.1227, test_f1: 0.4301
 epoch: 31, train_loss: 1.1251, test_loss: 1.1171, test_f1: 0.4417
 epoch: 32, train_loss: 1.1191, test_loss: 1.1095, test_f1: 0.4475
 epoch: 33, train_loss: 1.1088, test_loss: 1.1016, test_f1: 0.4519
 epoch: 34, train_loss: 1.1079, test_loss: 1.0932, test_f1: 0.4530
 epoch: 35, train_loss: 1.0981, test_loss: 1.0892, test_f1: 0.4717
 epoch: 36, train_loss: 1.0913, test_loss: 1.0829, test_f1: 0.4677
 epoch: 37, train_loss: 1.0922, test_loss: 1.0737, test_f1: 0.4894
 epoch: 38, train_loss: 1.0810, test_loss: 1.0666, test_f1: 0.4911
 epoch: 39, train_loss: 1.0736, test_loss: 1.0646, test_f1: 0.4926
 epoch: 40, train_loss: 1.0649, test_loss: 1.0560, test_f1: 0.5053
 epoch: 41, train_loss: 1.0610, test_loss: 1.0484, test_f1: 0.5318
 epoch: 42, train_loss: 1.0537, test_loss: 1.0408, test_f1: 0.5177
 epoch: 43, train_loss: 1.0447, test_loss: 1.0401, test_f1: 0.5069
 epoch: 44, train_loss: 1.0428, test_loss: 1.0281, test_f1: 0.5343
 epoch: 45, train_loss: 1.0301, test_loss: 1.0236, test_f1: 0.5359
 epoch: 46, train_loss: 1.0222, test_loss: 1.0174, test_f1: 0.5312
 epoch: 47, train_loss: 1.0174, test_loss: 1.0051, test_f1: 0.5341
 epoch: 48, train_loss: 1.0176, test_loss: 1.0007, test_f1: 0.5406
 epoch: 49, train_loss: 1.0002, test_loss: 0.9983, test_f1: 0.5298
 epoch: 50, train_loss: 1.0019, test_loss: 0.9889, test_f1: 0.5347
 epoch: 51, train_loss: 0.9925, test_loss: 0.9886, test_f1: 0.5293
 epoch: 52, train_loss: 0.9895, test_loss: 0.9849, test_f1: 0.5311
 epoch: 53, train_loss: 0.9889, test_loss: 0.9810, test_f1: 0.5310
 epoch: 54, train_loss: 0.9775, test_loss: 0.9807, test_f1: 0.5322
 epoch: 55, train_loss: 0.9796, test_loss: 0.9749, test_f1: 0.5342
 epoch: 56, train_loss: 0.9766, test_loss: 0.9717, test_f1: 0.5344
 epoch: 57, train_loss: 0.9708, test_loss: 0.9723, test_f1: 0.5323
 epoch: 58, train_loss: 0.9786, test_loss: 0.9718, test_f1: 0.5289
 epoch: 59, train_loss: 0.9682, test_loss: 0.9682, test_f1: 0.5460
 epoch: 60, train_loss: 0.9633, test_loss: 0.9628, test_f1: 0.5479
 epoch: 61, train_loss: 0.9636, test_loss: 0.9610, test_f1: 0.5401
 epoch: 62, train_loss: 0.9615, test_loss: 0.9644, test_f1: 0.5317
 epoch: 63, train_loss: 0.9646, test_loss: 0.9597, test_f1: 0.5437
 epoch: 64, train_loss: 0.9660, test_loss: 0.9567, test_f1: 0.5401
 epoch: 65, train_loss: 0.9538, test_loss: 0.9532, test_f1: 0.5310
 epoch: 66, train_loss: 0.9535, test_loss: 0.9526, test_f1: 0.5418
 epoch: 67, train_loss: 0.9513, test_loss: 0.9562, test_f1: 0.5357
 epoch: 68, train_loss: 0.9417, test_loss: 0.9527, test_f1: 0.5474
 epoch: 69, train_loss: 0.9517, test_loss: 0.9474, test_f1: 0.5446
 epoch: 70, train_loss: 0.9462, test_loss: 0.9437, test_f1: 0.5459
 epoch: 71, train_loss: 0.9447, test_loss: 0.9455, test_f1: 0.5434
 epoch: 72, train_loss: 0.9381, test_loss: 0.9464, test_f1: 0.5456
 epoch: 73, train_loss: 0.9332, test_loss: 0.9441, test_f1: 0.5405
 epoch: 74, train_loss: 0.9392, test_loss: 0.9441, test_f1: 0.5379
 epoch: 75, train_loss: 0.9386, test_loss: 0.9407, test_f1: 0.5466
 epoch: 76, train_loss: 0.9283, test_loss: 0.9428, test_f1: 0.5274
 epoch: 77, train_loss: 0.9250, test_loss: 0.9386, test_f1: 0.5392
 epoch: 78, train_loss: 0.9247, test_loss: 0.9386, test_f1: 0.5454
 epoch: 79, train_loss: 0.9222, test_loss: 0.9425, test_f1: 0.5300
 epoch: 80, train_loss: 0.9186, test_loss: 0.9393, test_f1: 0.5475
 epoch: 81, train_loss: 0.9124, test_loss: 0.9358, test_f1: 0.5453
 epoch: 82, train_loss: 0.9227, test_loss: 0.9433, test_f1: 0.5367
 epoch: 83, train_loss: 0.9174, test_loss: 0.9392, test_f1: 0.5413
 epoch: 84, train_loss: 0.9169, test_loss: 0.9356, test_f1: 0.5442
 epoch: 85, train_loss: 0.9100, test_loss: 0.9379, test_f1: 0.5456
 epoch: 86, train_loss: 0.9141, test_loss: 0.9345, test_f1: 0.5419
 epoch: 87, train_loss: 0.9081, test_loss: 0.9329, test_f1: 0.5519
 epoch: 88, train_loss: 0.9093, test_loss: 0.9356, test_f1: 0.5476
 epoch: 89, train_loss: 0.9073, test_loss: 0.9333, test_f1: 0.5480
 epoch: 90, train_loss: 0.9044, test_loss: 0.9324, test_f1: 0.5499
 epoch: 91, train_loss: 0.9117, test_loss: 0.9396, test_f1: 0.5554
 epoch: 92, train_loss: 0.8957, test_loss: 0.9389, test_f1: 0.5555
 epoch: 93, train_loss: 0.9018, test_loss: 0.9361, test_f1: 0.5497
 epoch: 94, train_loss: 0.8954, test_loss: 0.9395, test_f1: 0.5457
 epoch: 95, train_loss: 0.9024, test_loss: 0.9293, test_f1: 0.5488
 epoch: 96, train_loss: 0.9032, test_loss: 0.9283, test_f1: 0.5376
 epoch: 97, train_loss: 0.9012, test_loss: 0.9264, test_f1: 0.5512
 epoch: 98, train_loss: 0.8918, test_loss: 0.9246, test_f1: 0.5458
 epoch: 99, train_loss: 0.8920, test_loss: 0.9326, test_f1: 0.5627
##################ITERATION #1 ****************************************
 epoch: 0, train_loss: 1.3830, test_loss: 1.3906, test_f1: 0.1004
 epoch: 1, train_loss: 1.3586, test_loss: 1.3648, test_f1: 0.1001
 epoch: 2, train_loss: 1.3429, test_loss: 1.3402, test_f1: 0.2862
 epoch: 3, train_loss: 1.3247, test_loss: 1.3202, test_f1: 0.3243
 epoch: 4, train_loss: 1.3088, test_loss: 1.3018, test_f1: 0.3425
 epoch: 5, train_loss: 1.2922, test_loss: 1.2857, test_f1: 0.3360
 epoch: 6, train_loss: 1.2819, test_loss: 1.2702, test_f1: 0.3573
 epoch: 7, train_loss: 1.2671, test_loss: 1.2535, test_f1: 0.3573
 epoch: 8, train_loss: 1.2553, test_loss: 1.2366, test_f1: 0.3477
 epoch: 9, train_loss: 1.2415, test_loss: 1.2217, test_f1: 0.3485
 epoch: 10, train_loss: 1.2330, test_loss: 1.2089, test_f1: 0.3526
 epoch: 11, train_loss: 1.2221, test_loss: 1.1944, test_f1: 0.3654
 epoch: 12, train_loss: 1.2133, test_loss: 1.1804, test_f1: 0.3839
 epoch: 13, train_loss: 1.1990, test_loss: 1.1678, test_f1: 0.3849
 epoch: 14, train_loss: 1.1943, test_loss: 1.1585, test_f1: 0.4110
 epoch: 15, train_loss: 1.1805, test_loss: 1.1455, test_f1: 0.4257
 epoch: 16, train_loss: 1.1736, test_loss: 1.1341, test_f1: 0.4340
 epoch: 17, train_loss: 1.1676, test_loss: 1.1252, test_f1: 0.4450
 epoch: 18, train_loss: 1.1578, test_loss: 1.1152, test_f1: 0.4637
 epoch: 19, train_loss: 1.1448, test_loss: 1.1037, test_f1: 0.4633
 epoch: 20, train_loss: 1.1403, test_loss: 1.0913, test_f1: 0.4599
 epoch: 21, train_loss: 1.1287, test_loss: 1.0817, test_f1: 0.4732
 epoch: 22, train_loss: 1.1238, test_loss: 1.0746, test_f1: 0.4712
 epoch: 23, train_loss: 1.1165, test_loss: 1.0617, test_f1: 0.4731
 epoch: 24, train_loss: 1.1033, test_loss: 1.0530, test_f1: 0.4743
 epoch: 25, train_loss: 1.0951, test_loss: 1.0403, test_f1: 0.4794
 epoch: 26, train_loss: 1.0836, test_loss: 1.0280, test_f1: 0.4747
 epoch: 27, train_loss: 1.0814, test_loss: 1.0248, test_f1: 0.4766
 epoch: 28, train_loss: 1.0740, test_loss: 1.0159, test_f1: 0.4855
 epoch: 29, train_loss: 1.0603, test_loss: 1.0077, test_f1: 0.4870
 epoch: 30, train_loss: 1.0571, test_loss: 0.9962, test_f1: 0.4991
 epoch: 31, train_loss: 1.0533, test_loss: 0.9938, test_f1: 0.4992
 epoch: 32, train_loss: 1.0448, test_loss: 0.9895, test_f1: 0.4895
 epoch: 33, train_loss: 1.0483, test_loss: 0.9830, test_f1: 0.4934
 epoch: 34, train_loss: 1.0321, test_loss: 0.9777, test_f1: 0.4982
 epoch: 35, train_loss: 1.0288, test_loss: 0.9761, test_f1: 0.4926
 epoch: 36, train_loss: 1.0217, test_loss: 0.9700, test_f1: 0.5092
 epoch: 37, train_loss: 1.0220, test_loss: 0.9615, test_f1: 0.5047
 epoch: 38, train_loss: 1.0144, test_loss: 0.9567, test_f1: 0.5038
 epoch: 39, train_loss: 1.0141, test_loss: 0.9595, test_f1: 0.5129
 epoch: 40, train_loss: 1.0032, test_loss: 0.9416, test_f1: 0.5113
 epoch: 41, train_loss: 0.9937, test_loss: 0.9431, test_f1: 0.5067
 epoch: 42, train_loss: 0.9924, test_loss: 0.9408, test_f1: 0.5204
 epoch: 43, train_loss: 0.9946, test_loss: 0.9462, test_f1: 0.5190
 epoch: 44, train_loss: 0.9844, test_loss: 0.9447, test_f1: 0.5249
 epoch: 45, train_loss: 0.9840, test_loss: 0.9414, test_f1: 0.5171
 epoch: 46, train_loss: 0.9764, test_loss: 0.9349, test_f1: 0.5150
 epoch: 47, train_loss: 0.9760, test_loss: 0.9225, test_f1: 0.5193
 epoch: 48, train_loss: 0.9702, test_loss: 0.9184, test_f1: 0.5124
 epoch: 49, train_loss: 0.9655, test_loss: 0.9281, test_f1: 0.5185
 epoch: 50, train_loss: 0.9668, test_loss: 0.9309, test_f1: 0.5240
 epoch: 51, train_loss: 0.9537, test_loss: 0.9270, test_f1: 0.5134
 epoch: 52, train_loss: 0.9657, test_loss: 0.9246, test_f1: 0.5291
 epoch: 53, train_loss: 0.9577, test_loss: 0.9218, test_f1: 0.5282
 epoch: 54, train_loss: 0.9547, test_loss: 0.9221, test_f1: 0.5278
 epoch: 55, train_loss: 0.9575, test_loss: 0.9191, test_f1: 0.5099
 epoch: 56, train_loss: 0.9508, test_loss: 0.9207, test_f1: 0.5271
 epoch: 57, train_loss: 0.9454, test_loss: 0.9176, test_f1: 0.5282
 epoch: 58, train_loss: 0.9463, test_loss: 0.9201, test_f1: 0.5253
 epoch: 59, train_loss: 0.9447, test_loss: 0.9220, test_f1: 0.5196
 epoch: 60, train_loss: 0.9396, test_loss: 0.9177, test_f1: 0.5225
 epoch: 61, train_loss: 0.9471, test_loss: 0.9179, test_f1: 0.5229
 epoch: 62, train_loss: 0.9419, test_loss: 0.9162, test_f1: 0.5209
 epoch: 63, train_loss: 0.9390, test_loss: 0.9131, test_f1: 0.5214
 epoch: 64, train_loss: 0.9451, test_loss: 0.9246, test_f1: 0.5201
 epoch: 65, train_loss: 0.9336, test_loss: 0.9171, test_f1: 0.5218
 epoch: 66, train_loss: 0.9373, test_loss: 0.9211, test_f1: 0.5252
 epoch: 67, train_loss: 0.9394, test_loss: 0.9211, test_f1: 0.5225
 epoch: 68, train_loss: 0.9400, test_loss: 0.9134, test_f1: 0.5213
 epoch: 69, train_loss: 0.9300, test_loss: 0.9199, test_f1: 0.5218
 epoch: 70, train_loss: 0.9313, test_loss: 0.9166, test_f1: 0.5246
 epoch: 71, train_loss: 0.9343, test_loss: 0.9113, test_f1: 0.5257
 epoch: 72, train_loss: 0.9340, test_loss: 0.9168, test_f1: 0.5283
 epoch: 73, train_loss: 0.9336, test_loss: 0.9214, test_f1: 0.5255
 epoch: 74, train_loss: 0.9395, test_loss: 0.9153, test_f1: 0.5243
 epoch: 75, train_loss: 0.9340, test_loss: 0.9185, test_f1: 0.5280
 epoch: 76, train_loss: 0.9276, test_loss: 0.9144, test_f1: 0.5326
 epoch: 77, train_loss: 0.9367, test_loss: 0.9194, test_f1: 0.5234
 epoch: 78, train_loss: 0.9274, test_loss: 0.9148, test_f1: 0.5219
 epoch: 79, train_loss: 0.9234, test_loss: 0.9170, test_f1: 0.5175
 epoch: 80, train_loss: 0.9201, test_loss: 0.9171, test_f1: 0.5188
 epoch: 81, train_loss: 0.9222, test_loss: 0.9136, test_f1: 0.5239
 epoch: 82, train_loss: 0.9234, test_loss: 0.9123, test_f1: 0.5148
 epoch: 83, train_loss: 0.9145, test_loss: 0.9130, test_f1: 0.5261
 epoch: 84, train_loss: 0.9102, test_loss: 0.9175, test_f1: 0.5170
 epoch: 85, train_loss: 0.9260, test_loss: 0.9104, test_f1: 0.5196
 epoch: 86, train_loss: 0.9171, test_loss: 0.9116, test_f1: 0.5268
 epoch: 87, train_loss: 0.9154, test_loss: 0.9117, test_f1: 0.5264
 epoch: 88, train_loss: 0.9136, test_loss: 0.9113, test_f1: 0.5307
 epoch: 89, train_loss: 0.9152, test_loss: 0.9093, test_f1: 0.5132
 epoch: 90, train_loss: 0.9153, test_loss: 0.9061, test_f1: 0.5233
 epoch: 91, train_loss: 0.9081, test_loss: 0.9146, test_f1: 0.5294
 epoch: 92, train_loss: 0.9245, test_loss: 0.9172, test_f1: 0.5256
 epoch: 93, train_loss: 0.9062, test_loss: 0.9138, test_f1: 0.5314
 epoch: 94, train_loss: 0.9162, test_loss: 0.9129, test_f1: 0.5254
 epoch: 95, train_loss: 0.9028, test_loss: 0.9214, test_f1: 0.5313
 epoch: 96, train_loss: 0.9045, test_loss: 0.9152, test_f1: 0.5361
 epoch: 97, train_loss: 0.9028, test_loss: 0.9114, test_f1: 0.5278
 epoch: 98, train_loss: 0.9154, test_loss: 0.9183, test_f1: 0.5264
 epoch: 99, train_loss: 0.8999, test_loss: 0.9151, test_f1: 0.5355
##################ITERATION #2 ****************************************
 epoch: 0, train_loss: 1.3350, test_loss: 1.3500, test_f1: 0.2270
 epoch: 1, train_loss: 1.3024, test_loss: 1.3256, test_f1: 0.2270
 epoch: 2, train_loss: 1.2853, test_loss: 1.2988, test_f1: 0.2270
 epoch: 3, train_loss: 1.2755, test_loss: 1.2673, test_f1: 0.2506
 epoch: 4, train_loss: 1.2622, test_loss: 1.2505, test_f1: 0.2682
 epoch: 5, train_loss: 1.2464, test_loss: 1.2394, test_f1: 0.2829
 epoch: 6, train_loss: 1.2416, test_loss: 1.2274, test_f1: 0.2907
 epoch: 7, train_loss: 1.2272, test_loss: 1.2176, test_f1: 0.3129
 epoch: 8, train_loss: 1.2174, test_loss: 1.2050, test_f1: 0.3233
 epoch: 9, train_loss: 1.2103, test_loss: 1.1910, test_f1: 0.3454
 epoch: 10, train_loss: 1.2005, test_loss: 1.1806, test_f1: 0.3728
 epoch: 11, train_loss: 1.1869, test_loss: 1.1702, test_f1: 0.3728
 epoch: 12, train_loss: 1.1786, test_loss: 1.1535, test_f1: 0.3781
 epoch: 13, train_loss: 1.1701, test_loss: 1.1402, test_f1: 0.3808
 epoch: 14, train_loss: 1.1573, test_loss: 1.1291, test_f1: 0.3935
 epoch: 15, train_loss: 1.1479, test_loss: 1.1151, test_f1: 0.4004
 epoch: 16, train_loss: 1.1373, test_loss: 1.1074, test_f1: 0.4145
 epoch: 17, train_loss: 1.1314, test_loss: 1.0954, test_f1: 0.4300
 epoch: 18, train_loss: 1.1162, test_loss: 1.0847, test_f1: 0.4437
 epoch: 19, train_loss: 1.1112, test_loss: 1.0732, test_f1: 0.4613
 epoch: 20, train_loss: 1.1038, test_loss: 1.0642, test_f1: 0.4638
 epoch: 21, train_loss: 1.0866, test_loss: 1.0539, test_f1: 0.4707
 epoch: 22, train_loss: 1.0899, test_loss: 1.0489, test_f1: 0.4743
 epoch: 23, train_loss: 1.0789, test_loss: 1.0355, test_f1: 0.4754
 epoch: 24, train_loss: 1.0720, test_loss: 1.0202, test_f1: 0.4782
 epoch: 25, train_loss: 1.0580, test_loss: 1.0179, test_f1: 0.4701
 epoch: 26, train_loss: 1.0578, test_loss: 1.0070, test_f1: 0.4797
 epoch: 27, train_loss: 1.0462, test_loss: 1.0040, test_f1: 0.4797
 epoch: 28, train_loss: 1.0420, test_loss: 1.0012, test_f1: 0.4776
 epoch: 29, train_loss: 1.0416, test_loss: 0.9922, test_f1: 0.4832
 epoch: 30, train_loss: 1.0323, test_loss: 0.9877, test_f1: 0.4893
 epoch: 31, train_loss: 1.0291, test_loss: 0.9855, test_f1: 0.4741
 epoch: 32, train_loss: 1.0217, test_loss: 0.9810, test_f1: 0.4895
 epoch: 33, train_loss: 1.0065, test_loss: 0.9703, test_f1: 0.4914
 epoch: 34, train_loss: 1.0066, test_loss: 0.9711, test_f1: 0.4875
 epoch: 35, train_loss: 1.0043, test_loss: 0.9704, test_f1: 0.5004
 epoch: 36, train_loss: 0.9969, test_loss: 0.9661, test_f1: 0.4965
 epoch: 37, train_loss: 0.9991, test_loss: 0.9647, test_f1: 0.4909
 epoch: 38, train_loss: 0.9893, test_loss: 0.9625, test_f1: 0.4811
 epoch: 39, train_loss: 0.9848, test_loss: 0.9597, test_f1: 0.4978
 epoch: 40, train_loss: 0.9824, test_loss: 0.9485, test_f1: 0.4918
 epoch: 41, train_loss: 0.9732, test_loss: 0.9507, test_f1: 0.4936
 epoch: 42, train_loss: 0.9674, test_loss: 0.9431, test_f1: 0.4951
 epoch: 43, train_loss: 0.9708, test_loss: 0.9524, test_f1: 0.4826
 epoch: 44, train_loss: 0.9659, test_loss: 0.9388, test_f1: 0.4935
 epoch: 45, train_loss: 0.9689, test_loss: 0.9439, test_f1: 0.4898
 epoch: 46, train_loss: 0.9595, test_loss: 0.9466, test_f1: 0.4868
 epoch: 47, train_loss: 0.9529, test_loss: 0.9331, test_f1: 0.4997
 epoch: 48, train_loss: 0.9546, test_loss: 0.9341, test_f1: 0.4867
 epoch: 49, train_loss: 0.9544, test_loss: 0.9319, test_f1: 0.4860
 epoch: 50, train_loss: 0.9351, test_loss: 0.9315, test_f1: 0.4930
 epoch: 51, train_loss: 0.9360, test_loss: 0.9286, test_f1: 0.4941
 epoch: 52, train_loss: 0.9447, test_loss: 0.9337, test_f1: 0.4867
 epoch: 53, train_loss: 0.9358, test_loss: 0.9361, test_f1: 0.4886
 epoch: 54, train_loss: 0.9424, test_loss: 0.9335, test_f1: 0.4885
 epoch: 55, train_loss: 0.9331, test_loss: 0.9288, test_f1: 0.4953
 epoch: 56, train_loss: 0.9401, test_loss: 0.9319, test_f1: 0.4874
 epoch: 57, train_loss: 0.9325, test_loss: 0.9412, test_f1: 0.4839
 epoch: 58, train_loss: 0.9349, test_loss: 0.9398, test_f1: 0.4895
 epoch: 59, train_loss: 0.9272, test_loss: 0.9432, test_f1: 0.4949
 epoch: 60, train_loss: 0.9365, test_loss: 0.9391, test_f1: 0.5024
 epoch: 61, train_loss: 0.9269, test_loss: 0.9284, test_f1: 0.5036
 epoch: 62, train_loss: 0.9213, test_loss: 0.9381, test_f1: 0.4995
 epoch: 63, train_loss: 0.9269, test_loss: 0.9266, test_f1: 0.5050
 epoch: 64, train_loss: 0.9299, test_loss: 0.9294, test_f1: 0.5017
 epoch: 65, train_loss: 0.9225, test_loss: 0.9360, test_f1: 0.4981
 epoch: 66, train_loss: 0.9155, test_loss: 0.9279, test_f1: 0.5070
 epoch: 67, train_loss: 0.9175, test_loss: 0.9244, test_f1: 0.4903
 epoch: 68, train_loss: 0.9206, test_loss: 0.9305, test_f1: 0.5049
 epoch: 69, train_loss: 0.9140, test_loss: 0.9235, test_f1: 0.4893
 epoch: 70, train_loss: 0.9178, test_loss: 0.9311, test_f1: 0.4881
 epoch: 71, train_loss: 0.9171, test_loss: 0.9234, test_f1: 0.5021
 epoch: 72, train_loss: 0.9172, test_loss: 0.9222, test_f1: 0.5064
 epoch: 73, train_loss: 0.9208, test_loss: 0.9333, test_f1: 0.4993
 epoch: 74, train_loss: 0.9124, test_loss: 0.9251, test_f1: 0.5049
 epoch: 75, train_loss: 0.9058, test_loss: 0.9233, test_f1: 0.5121
 epoch: 76, train_loss: 0.9102, test_loss: 0.9268, test_f1: 0.5117
 epoch: 77, train_loss: 0.9114, test_loss: 0.9308, test_f1: 0.5074
 epoch: 78, train_loss: 0.9056, test_loss: 0.9241, test_f1: 0.5014
 epoch: 79, train_loss: 0.9164, test_loss: 0.9259, test_f1: 0.4864
 epoch: 80, train_loss: 0.9041, test_loss: 0.9252, test_f1: 0.5055
 epoch: 81, train_loss: 0.9078, test_loss: 0.9157, test_f1: 0.5010
 epoch: 82, train_loss: 0.9141, test_loss: 0.9160, test_f1: 0.5059
 epoch: 83, train_loss: 0.9055, test_loss: 0.9177, test_f1: 0.4991
 epoch: 84, train_loss: 0.8980, test_loss: 0.9261, test_f1: 0.5120
 epoch: 85, train_loss: 0.9116, test_loss: 0.9260, test_f1: 0.5038
 epoch: 86, train_loss: 0.9097, test_loss: 0.9153, test_f1: 0.5268
 epoch: 87, train_loss: 0.9005, test_loss: 0.9243, test_f1: 0.5190
 epoch: 88, train_loss: 0.8983, test_loss: 0.9297, test_f1: 0.5161
 epoch: 89, train_loss: 0.8999, test_loss: 0.9186, test_f1: 0.5048
 epoch: 90, train_loss: 0.8980, test_loss: 0.9194, test_f1: 0.5044
 epoch: 91, train_loss: 0.8925, test_loss: 0.9298, test_f1: 0.5138
 epoch: 92, train_loss: 0.8874, test_loss: 0.9228, test_f1: 0.5113
 epoch: 93, train_loss: 0.8878, test_loss: 0.9160, test_f1: 0.5119
 epoch: 94, train_loss: 0.8987, test_loss: 0.9209, test_f1: 0.4981
 epoch: 95, train_loss: 0.9079, test_loss: 0.9225, test_f1: 0.5106
 epoch: 96, train_loss: 0.8954, test_loss: 0.9100, test_f1: 0.5294
 epoch: 97, train_loss: 0.8935, test_loss: 0.9222, test_f1: 0.5109
 epoch: 98, train_loss: 0.8912, test_loss: 0.9292, test_f1: 0.5050
 epoch: 99, train_loss: 0.8956, test_loss: 0.9187, test_f1: 0.5046
##################ITERATION #3 ****************************************
 epoch: 0, train_loss: 1.3143, test_loss: 1.3466, test_f1: 0.2270
 epoch: 1, train_loss: 1.2822, test_loss: 1.3110, test_f1: 0.2245
 epoch: 2, train_loss: 1.2643, test_loss: 1.2681, test_f1: 0.2340
 epoch: 3, train_loss: 1.2499, test_loss: 1.2405, test_f1: 0.2344
 epoch: 4, train_loss: 1.2367, test_loss: 1.2231, test_f1: 0.2484
 epoch: 5, train_loss: 1.2265, test_loss: 1.2089, test_f1: 0.2637
 epoch: 6, train_loss: 1.2182, test_loss: 1.1985, test_f1: 0.3049
 epoch: 7, train_loss: 1.2052, test_loss: 1.1839, test_f1: 0.3055
 epoch: 8, train_loss: 1.1996, test_loss: 1.1709, test_f1: 0.3428
 epoch: 9, train_loss: 1.1819, test_loss: 1.1581, test_f1: 0.3559
 epoch: 10, train_loss: 1.1778, test_loss: 1.1469, test_f1: 0.3653
 epoch: 11, train_loss: 1.1655, test_loss: 1.1337, test_f1: 0.3973
 epoch: 12, train_loss: 1.1591, test_loss: 1.1221, test_f1: 0.4136
 epoch: 13, train_loss: 1.1505, test_loss: 1.1109, test_f1: 0.4252
 epoch: 14, train_loss: 1.1442, test_loss: 1.1008, test_f1: 0.4346
 epoch: 15, train_loss: 1.1300, test_loss: 1.0916, test_f1: 0.4351
 epoch: 16, train_loss: 1.1227, test_loss: 1.0803, test_f1: 0.4308
 epoch: 17, train_loss: 1.1189, test_loss: 1.0734, test_f1: 0.4332
 epoch: 18, train_loss: 1.0997, test_loss: 1.0601, test_f1: 0.4391
 epoch: 19, train_loss: 1.0995, test_loss: 1.0582, test_f1: 0.4452
 epoch: 20, train_loss: 1.0928, test_loss: 1.0490, test_f1: 0.4433
 epoch: 21, train_loss: 1.0835, test_loss: 1.0397, test_f1: 0.4484
 epoch: 22, train_loss: 1.0749, test_loss: 1.0362, test_f1: 0.4470
 epoch: 23, train_loss: 1.0644, test_loss: 1.0274, test_f1: 0.4479
 epoch: 24, train_loss: 1.0558, test_loss: 1.0248, test_f1: 0.4566
 epoch: 25, train_loss: 1.0466, test_loss: 1.0187, test_f1: 0.4489
 epoch: 26, train_loss: 1.0529, test_loss: 1.0106, test_f1: 0.4551
 epoch: 27, train_loss: 1.0382, test_loss: 1.0016, test_f1: 0.4534
 epoch: 28, train_loss: 1.0314, test_loss: 1.0000, test_f1: 0.4693
 epoch: 29, train_loss: 1.0322, test_loss: 1.0089, test_f1: 0.4596
 epoch: 30, train_loss: 1.0192, test_loss: 0.9890, test_f1: 0.4650
 epoch: 31, train_loss: 1.0105, test_loss: 0.9860, test_f1: 0.4723
 epoch: 32, train_loss: 1.0002, test_loss: 0.9787, test_f1: 0.4710
 epoch: 33, train_loss: 1.0008, test_loss: 0.9853, test_f1: 0.4706
 epoch: 34, train_loss: 1.0050, test_loss: 0.9838, test_f1: 0.4832
 epoch: 35, train_loss: 0.9968, test_loss: 0.9764, test_f1: 0.4798
 epoch: 36, train_loss: 0.9857, test_loss: 0.9736, test_f1: 0.4860
 epoch: 37, train_loss: 0.9826, test_loss: 0.9776, test_f1: 0.4824
 epoch: 38, train_loss: 0.9815, test_loss: 0.9768, test_f1: 0.4750
 epoch: 39, train_loss: 0.9739, test_loss: 0.9704, test_f1: 0.4884
 epoch: 40, train_loss: 0.9655, test_loss: 0.9678, test_f1: 0.4895
 epoch: 41, train_loss: 0.9597, test_loss: 0.9614, test_f1: 0.4957
 epoch: 42, train_loss: 0.9551, test_loss: 0.9629, test_f1: 0.4872
 epoch: 43, train_loss: 0.9564, test_loss: 0.9693, test_f1: 0.4824
 epoch: 44, train_loss: 0.9583, test_loss: 0.9651, test_f1: 0.4886
 epoch: 45, train_loss: 0.9488, test_loss: 0.9652, test_f1: 0.4910
 epoch: 46, train_loss: 0.9483, test_loss: 0.9634, test_f1: 0.5025
 epoch: 47, train_loss: 0.9419, test_loss: 0.9588, test_f1: 0.5006
 epoch: 48, train_loss: 0.9373, test_loss: 0.9554, test_f1: 0.4969
 epoch: 49, train_loss: 0.9460, test_loss: 0.9589, test_f1: 0.5069
 epoch: 50, train_loss: 0.9386, test_loss: 0.9600, test_f1: 0.4917
 epoch: 51, train_loss: 0.9356, test_loss: 0.9578, test_f1: 0.4921
 epoch: 52, train_loss: 0.9271, test_loss: 0.9494, test_f1: 0.5055
 epoch: 53, train_loss: 0.9338, test_loss: 0.9515, test_f1: 0.5071
 epoch: 54, train_loss: 0.9266, test_loss: 0.9498, test_f1: 0.5138
 epoch: 55, train_loss: 0.9330, test_loss: 0.9541, test_f1: 0.5088
 epoch: 56, train_loss: 0.9135, test_loss: 0.9451, test_f1: 0.5140
 epoch: 57, train_loss: 0.9219, test_loss: 0.9532, test_f1: 0.5096
 epoch: 58, train_loss: 0.9208, test_loss: 0.9483, test_f1: 0.5112
 epoch: 59, train_loss: 0.9166, test_loss: 0.9537, test_f1: 0.5010
 epoch: 60, train_loss: 0.9213, test_loss: 0.9469, test_f1: 0.5138
 epoch: 61, train_loss: 0.9181, test_loss: 0.9522, test_f1: 0.5041
 epoch: 62, train_loss: 0.9119, test_loss: 0.9543, test_f1: 0.5030
 epoch: 63, train_loss: 0.9218, test_loss: 0.9515, test_f1: 0.5077
 epoch: 64, train_loss: 0.9100, test_loss: 0.9507, test_f1: 0.5064
 epoch: 65, train_loss: 0.9189, test_loss: 0.9538, test_f1: 0.4991
 epoch: 66, train_loss: 0.9134, test_loss: 0.9549, test_f1: 0.5148
 epoch: 67, train_loss: 0.9141, test_loss: 0.9623, test_f1: 0.5057
 epoch: 68, train_loss: 0.9076, test_loss: 0.9595, test_f1: 0.5115
 epoch: 69, train_loss: 0.9014, test_loss: 0.9574, test_f1: 0.5086
 epoch: 70, train_loss: 0.9068, test_loss: 0.9515, test_f1: 0.5003
 epoch: 71, train_loss: 0.9028, test_loss: 0.9604, test_f1: 0.4973
 epoch: 72, train_loss: 0.9064, test_loss: 0.9557, test_f1: 0.5026
 epoch: 73, train_loss: 0.9089, test_loss: 0.9536, test_f1: 0.5052
 epoch: 74, train_loss: 0.9052, test_loss: 0.9531, test_f1: 0.5028
 epoch: 75, train_loss: 0.9009, test_loss: 0.9405, test_f1: 0.5194
 epoch: 76, train_loss: 0.8961, test_loss: 0.9598, test_f1: 0.4961
 epoch: 77, train_loss: 0.9024, test_loss: 0.9548, test_f1: 0.4946
 epoch: 78, train_loss: 0.8924, test_loss: 0.9524, test_f1: 0.5056
 epoch: 79, train_loss: 0.8940, test_loss: 0.9575, test_f1: 0.5039
 epoch: 80, train_loss: 0.8992, test_loss: 0.9558, test_f1: 0.5063
 epoch: 81, train_loss: 0.8956, test_loss: 0.9491, test_f1: 0.5119
 epoch: 82, train_loss: 0.8994, test_loss: 0.9568, test_f1: 0.4985
 epoch: 83, train_loss: 0.8907, test_loss: 0.9474, test_f1: 0.5057
 epoch: 84, train_loss: 0.8969, test_loss: 0.9523, test_f1: 0.5075
 epoch: 85, train_loss: 0.8983, test_loss: 0.9483, test_f1: 0.5108
 epoch: 86, train_loss: 0.8795, test_loss: 0.9515, test_f1: 0.5044
 epoch: 87, train_loss: 0.8776, test_loss: 0.9541, test_f1: 0.5037
 epoch: 88, train_loss: 0.8837, test_loss: 0.9531, test_f1: 0.5004
 epoch: 89, train_loss: 0.8869, test_loss: 0.9575, test_f1: 0.5003
 epoch: 90, train_loss: 0.8856, test_loss: 0.9544, test_f1: 0.5084
 epoch: 91, train_loss: 0.8722, test_loss: 0.9545, test_f1: 0.5014
 epoch: 92, train_loss: 0.8779, test_loss: 0.9584, test_f1: 0.4956
 epoch: 93, train_loss: 0.8860, test_loss: 0.9551, test_f1: 0.4989
 epoch: 94, train_loss: 0.8787, test_loss: 0.9544, test_f1: 0.5054
 epoch: 95, train_loss: 0.8811, test_loss: 0.9648, test_f1: 0.4996
 epoch: 96, train_loss: 0.8768, test_loss: 0.9561, test_f1: 0.5193
 epoch: 97, train_loss: 0.8802, test_loss: 0.9641, test_f1: 0.5053
 epoch: 98, train_loss: 0.8858, test_loss: 0.9713, test_f1: 0.5125
 epoch: 99, train_loss: 0.8729, test_loss: 0.9652, test_f1: 0.5054
##################ITERATION #4 ****************************************
 epoch: 0, train_loss: 1.2936, test_loss: 1.3443, test_f1: 0.2270
 epoch: 1, train_loss: 1.2510, test_loss: 1.2699, test_f1: 0.3510
 epoch: 2, train_loss: 1.2417, test_loss: 1.2092, test_f1: 0.3624
 epoch: 3, train_loss: 1.2227, test_loss: 1.1822, test_f1: 0.3719
 epoch: 4, train_loss: 1.2076, test_loss: 1.1635, test_f1: 0.3790
 epoch: 5, train_loss: 1.1993, test_loss: 1.1490, test_f1: 0.3815
 epoch: 6, train_loss: 1.1793, test_loss: 1.1301, test_f1: 0.3915
 epoch: 7, train_loss: 1.1662, test_loss: 1.1142, test_f1: 0.3939
 epoch: 8, train_loss: 1.1529, test_loss: 1.0988, test_f1: 0.4072
 epoch: 9, train_loss: 1.1520, test_loss: 1.0871, test_f1: 0.4179
 epoch: 10, train_loss: 1.1336, test_loss: 1.0739, test_f1: 0.4335
 epoch: 11, train_loss: 1.1274, test_loss: 1.0626, test_f1: 0.4339
 epoch: 12, train_loss: 1.1088, test_loss: 1.0489, test_f1: 0.4490
 epoch: 13, train_loss: 1.1060, test_loss: 1.0372, test_f1: 0.4529
 epoch: 14, train_loss: 1.0918, test_loss: 1.0225, test_f1: 0.4626
 epoch: 15, train_loss: 1.0819, test_loss: 1.0139, test_f1: 0.4600
 epoch: 16, train_loss: 1.0754, test_loss: 1.0025, test_f1: 0.4683
 epoch: 17, train_loss: 1.0693, test_loss: 0.9931, test_f1: 0.4652
 epoch: 18, train_loss: 1.0581, test_loss: 0.9872, test_f1: 0.4654
 epoch: 19, train_loss: 1.0510, test_loss: 0.9782, test_f1: 0.4911
 epoch: 20, train_loss: 1.0422, test_loss: 0.9672, test_f1: 0.4823
 epoch: 21, train_loss: 1.0371, test_loss: 0.9578, test_f1: 0.4962
 epoch: 22, train_loss: 1.0238, test_loss: 0.9521, test_f1: 0.4989
 epoch: 23, train_loss: 1.0192, test_loss: 0.9532, test_f1: 0.4950
 epoch: 24, train_loss: 1.0055, test_loss: 0.9438, test_f1: 0.5056
 epoch: 25, train_loss: 1.0083, test_loss: 0.9382, test_f1: 0.5073
 epoch: 26, train_loss: 0.9947, test_loss: 0.9369, test_f1: 0.5077
 epoch: 27, train_loss: 0.9918, test_loss: 0.9373, test_f1: 0.5114
 epoch: 28, train_loss: 0.9951, test_loss: 0.9250, test_f1: 0.5105
 epoch: 29, train_loss: 0.9839, test_loss: 0.9255, test_f1: 0.5115
 epoch: 30, train_loss: 0.9727, test_loss: 0.9227, test_f1: 0.5138
 epoch: 31, train_loss: 0.9791, test_loss: 0.9202, test_f1: 0.5133
 epoch: 32, train_loss: 0.9712, test_loss: 0.9193, test_f1: 0.5029
 epoch: 33, train_loss: 0.9590, test_loss: 0.9136, test_f1: 0.5181
 epoch: 34, train_loss: 0.9694, test_loss: 0.9135, test_f1: 0.5307
 epoch: 35, train_loss: 0.9551, test_loss: 0.9101, test_f1: 0.5282
 epoch: 36, train_loss: 0.9558, test_loss: 0.9135, test_f1: 0.5182
 epoch: 37, train_loss: 0.9440, test_loss: 0.9112, test_f1: 0.5228
 epoch: 38, train_loss: 0.9530, test_loss: 0.9086, test_f1: 0.5326
 epoch: 39, train_loss: 0.9349, test_loss: 0.9045, test_f1: 0.5153
 epoch: 40, train_loss: 0.9378, test_loss: 0.9075, test_f1: 0.5236
 epoch: 41, train_loss: 0.9244, test_loss: 0.9082, test_f1: 0.5253
 epoch: 42, train_loss: 0.9350, test_loss: 0.9046, test_f1: 0.5240
 epoch: 43, train_loss: 0.9283, test_loss: 0.9075, test_f1: 0.5253
 epoch: 44, train_loss: 0.9157, test_loss: 0.9052, test_f1: 0.5240
 epoch: 45, train_loss: 0.9221, test_loss: 0.9035, test_f1: 0.5297
 epoch: 46, train_loss: 0.9203, test_loss: 0.9013, test_f1: 0.5292
 epoch: 47, train_loss: 0.9216, test_loss: 0.9111, test_f1: 0.5271
 epoch: 48, train_loss: 0.9102, test_loss: 0.9058, test_f1: 0.5185
 epoch: 49, train_loss: 0.9147, test_loss: 0.8987, test_f1: 0.5218
 epoch: 50, train_loss: 0.9100, test_loss: 0.9036, test_f1: 0.5235
 epoch: 51, train_loss: 0.9137, test_loss: 0.9084, test_f1: 0.5188
 epoch: 52, train_loss: 0.8997, test_loss: 0.9027, test_f1: 0.5203
 epoch: 53, train_loss: 0.8904, test_loss: 0.9024, test_f1: 0.5233
 epoch: 54, train_loss: 0.9036, test_loss: 0.9057, test_f1: 0.5227
 epoch: 55, train_loss: 0.8956, test_loss: 0.9072, test_f1: 0.5227
 epoch: 56, train_loss: 0.8839, test_loss: 0.9051, test_f1: 0.5227
 epoch: 57, train_loss: 0.8978, test_loss: 0.9018, test_f1: 0.5266
 epoch: 58, train_loss: 0.9000, test_loss: 0.9081, test_f1: 0.5273
 epoch: 59, train_loss: 0.8968, test_loss: 0.9037, test_f1: 0.5245
 epoch: 60, train_loss: 0.8913, test_loss: 0.9116, test_f1: 0.5223
 epoch: 61, train_loss: 0.8891, test_loss: 0.9041, test_f1: 0.5229
 epoch: 62, train_loss: 0.8946, test_loss: 0.9003, test_f1: 0.5219
 epoch: 63, train_loss: 0.8869, test_loss: 0.9074, test_f1: 0.5164
 epoch: 64, train_loss: 0.8850, test_loss: 0.9020, test_f1: 0.5226
 epoch: 65, train_loss: 0.8814, test_loss: 0.9090, test_f1: 0.5233
 epoch: 66, train_loss: 0.8895, test_loss: 0.9013, test_f1: 0.5234
 epoch: 67, train_loss: 0.8805, test_loss: 0.9022, test_f1: 0.5204
 epoch: 68, train_loss: 0.8843, test_loss: 0.9093, test_f1: 0.5226
 epoch: 69, train_loss: 0.8802, test_loss: 0.9148, test_f1: 0.5176
 epoch: 70, train_loss: 0.8714, test_loss: 0.9103, test_f1: 0.5254
 epoch: 71, train_loss: 0.8733, test_loss: 0.9122, test_f1: 0.5196
 epoch: 72, train_loss: 0.8750, test_loss: 0.9132, test_f1: 0.5205
 epoch: 73, train_loss: 0.8748, test_loss: 0.9144, test_f1: 0.5111
 epoch: 74, train_loss: 0.8786, test_loss: 0.9156, test_f1: 0.5218
 epoch: 75, train_loss: 0.8719, test_loss: 0.9151, test_f1: 0.5157
 epoch: 76, train_loss: 0.8788, test_loss: 0.9132, test_f1: 0.5182
 epoch: 77, train_loss: 0.8768, test_loss: 0.9116, test_f1: 0.5208
 epoch: 78, train_loss: 0.8697, test_loss: 0.9106, test_f1: 0.5173
 epoch: 79, train_loss: 0.8804, test_loss: 0.9138, test_f1: 0.5239
 epoch: 80, train_loss: 0.8802, test_loss: 0.9168, test_f1: 0.5193
 epoch: 81, train_loss: 0.8674, test_loss: 0.9137, test_f1: 0.5257
 epoch: 82, train_loss: 0.8619, test_loss: 0.9157, test_f1: 0.5227
 epoch: 83, train_loss: 0.8689, test_loss: 0.9126, test_f1: 0.5228
 epoch: 84, train_loss: 0.8748, test_loss: 0.9144, test_f1: 0.5221
 epoch: 85, train_loss: 0.8678, test_loss: 0.9198, test_f1: 0.5152
 epoch: 86, train_loss: 0.8563, test_loss: 0.9128, test_f1: 0.5235
 epoch: 87, train_loss: 0.8569, test_loss: 0.9217, test_f1: 0.5121
 epoch: 88, train_loss: 0.8694, test_loss: 0.9099, test_f1: 0.5228
 epoch: 89, train_loss: 0.8661, test_loss: 0.9140, test_f1: 0.5152
 epoch: 90, train_loss: 0.8642, test_loss: 0.9118, test_f1: 0.5209
 epoch: 91, train_loss: 0.8689, test_loss: 0.9162, test_f1: 0.5203
 epoch: 92, train_loss: 0.8619, test_loss: 0.9114, test_f1: 0.5247
 epoch: 93, train_loss: 0.8478, test_loss: 0.9249, test_f1: 0.5152
 epoch: 94, train_loss: 0.8588, test_loss: 0.9154, test_f1: 0.5216
 epoch: 95, train_loss: 0.8609, test_loss: 0.9201, test_f1: 0.5178
 epoch: 96, train_loss: 0.8515, test_loss: 0.9163, test_f1: 0.5245
 epoch: 97, train_loss: 0.8538, test_loss: 0.9213, test_f1: 0.5239
 epoch: 98, train_loss: 0.8577, test_loss: 0.9320, test_f1: 0.5087
 epoch: 99, train_loss: 0.8535, test_loss: 0.9184, test_f1: 0.5227
##################ITERATION #5 ****************************************
 epoch: 0, train_loss: 1.3003, test_loss: 1.3782, test_f1: 0.2257
 epoch: 1, train_loss: 1.2625, test_loss: 1.2887, test_f1: 0.2650
 epoch: 2, train_loss: 1.2445, test_loss: 1.2451, test_f1: 0.2834
 epoch: 3, train_loss: 1.2327, test_loss: 1.2108, test_f1: 0.2894
 epoch: 4, train_loss: 1.2248, test_loss: 1.1917, test_f1: 0.3247
 epoch: 5, train_loss: 1.2081, test_loss: 1.1780, test_f1: 0.3471
 epoch: 6, train_loss: 1.1972, test_loss: 1.1669, test_f1: 0.3925
 epoch: 7, train_loss: 1.1822, test_loss: 1.1520, test_f1: 0.4018
 epoch: 8, train_loss: 1.1751, test_loss: 1.1407, test_f1: 0.4156
 epoch: 9, train_loss: 1.1719, test_loss: 1.1286, test_f1: 0.4336
 epoch: 10, train_loss: 1.1574, test_loss: 1.1145, test_f1: 0.4337
 epoch: 11, train_loss: 1.1494, test_loss: 1.1108, test_f1: 0.4390
 epoch: 12, train_loss: 1.1384, test_loss: 1.0971, test_f1: 0.4587
 epoch: 13, train_loss: 1.1360, test_loss: 1.0860, test_f1: 0.4630
 epoch: 14, train_loss: 1.1151, test_loss: 1.0780, test_f1: 0.4590
 epoch: 15, train_loss: 1.1121, test_loss: 1.0712, test_f1: 0.4591
 epoch: 16, train_loss: 1.1072, test_loss: 1.0509, test_f1: 0.4721
 epoch: 17, train_loss: 1.0970, test_loss: 1.0524, test_f1: 0.4774
 epoch: 18, train_loss: 1.0887, test_loss: 1.0432, test_f1: 0.4772
 epoch: 19, train_loss: 1.0744, test_loss: 1.0362, test_f1: 0.4801
 epoch: 20, train_loss: 1.0659, test_loss: 1.0269, test_f1: 0.4878
 epoch: 21, train_loss: 1.0627, test_loss: 1.0189, test_f1: 0.4897
 epoch: 22, train_loss: 1.0618, test_loss: 1.0165, test_f1: 0.4717
 epoch: 23, train_loss: 1.0533, test_loss: 1.0111, test_f1: 0.4774
 epoch: 24, train_loss: 1.0369, test_loss: 1.0043, test_f1: 0.4765
 epoch: 25, train_loss: 1.0449, test_loss: 0.9953, test_f1: 0.4756
 epoch: 26, train_loss: 1.0421, test_loss: 0.9882, test_f1: 0.4852
 epoch: 27, train_loss: 1.0321, test_loss: 0.9946, test_f1: 0.4774
 epoch: 28, train_loss: 1.0203, test_loss: 0.9904, test_f1: 0.4750
 epoch: 29, train_loss: 1.0211, test_loss: 0.9778, test_f1: 0.4765
 epoch: 30, train_loss: 1.0112, test_loss: 0.9835, test_f1: 0.4724
 epoch: 31, train_loss: 0.9995, test_loss: 0.9833, test_f1: 0.4734
 epoch: 32, train_loss: 1.0088, test_loss: 0.9827, test_f1: 0.4719
 epoch: 33, train_loss: 1.0036, test_loss: 0.9789, test_f1: 0.4777
 epoch: 34, train_loss: 1.0005, test_loss: 0.9721, test_f1: 0.4732
 epoch: 35, train_loss: 0.9919, test_loss: 0.9612, test_f1: 0.4994
 epoch: 36, train_loss: 0.9921, test_loss: 0.9567, test_f1: 0.4847
 epoch: 37, train_loss: 0.9786, test_loss: 0.9590, test_f1: 0.4962
 epoch: 38, train_loss: 0.9772, test_loss: 0.9698, test_f1: 0.4803
 epoch: 39, train_loss: 0.9767, test_loss: 0.9664, test_f1: 0.4866
 epoch: 40, train_loss: 0.9751, test_loss: 0.9730, test_f1: 0.4845
 epoch: 41, train_loss: 0.9703, test_loss: 0.9641, test_f1: 0.4854
 epoch: 42, train_loss: 0.9667, test_loss: 0.9616, test_f1: 0.5000
 epoch: 43, train_loss: 0.9647, test_loss: 0.9439, test_f1: 0.4989
 epoch: 44, train_loss: 0.9561, test_loss: 0.9531, test_f1: 0.4808
 epoch: 45, train_loss: 0.9468, test_loss: 0.9476, test_f1: 0.4956
 epoch: 46, train_loss: 0.9501, test_loss: 0.9432, test_f1: 0.5019
 epoch: 47, train_loss: 0.9489, test_loss: 0.9488, test_f1: 0.5063
 epoch: 48, train_loss: 0.9550, test_loss: 0.9554, test_f1: 0.4931
 epoch: 49, train_loss: 0.9430, test_loss: 0.9634, test_f1: 0.4891
 epoch: 50, train_loss: 0.9466, test_loss: 0.9644, test_f1: 0.4922
 epoch: 51, train_loss: 0.9422, test_loss: 0.9506, test_f1: 0.5079
 epoch: 52, train_loss: 0.9330, test_loss: 0.9498, test_f1: 0.4959
 epoch: 53, train_loss: 0.9294, test_loss: 0.9554, test_f1: 0.4941
 epoch: 54, train_loss: 0.9319, test_loss: 0.9559, test_f1: 0.5002
 epoch: 55, train_loss: 0.9339, test_loss: 0.9504, test_f1: 0.5036
 epoch: 56, train_loss: 0.9361, test_loss: 0.9548, test_f1: 0.4984
 epoch: 57, train_loss: 0.9315, test_loss: 0.9619, test_f1: 0.4997
 epoch: 58, train_loss: 0.9304, test_loss: 0.9517, test_f1: 0.5106
 epoch: 59, train_loss: 0.9385, test_loss: 0.9455, test_f1: 0.5223
 epoch: 60, train_loss: 0.9219, test_loss: 0.9620, test_f1: 0.5211
 epoch: 61, train_loss: 0.9260, test_loss: 0.9635, test_f1: 0.4946
 epoch: 62, train_loss: 0.9243, test_loss: 0.9544, test_f1: 0.5079
 epoch: 63, train_loss: 0.9240, test_loss: 0.9523, test_f1: 0.5053
 epoch: 64, train_loss: 0.9288, test_loss: 0.9558, test_f1: 0.5056
 epoch: 65, train_loss: 0.9191, test_loss: 0.9551, test_f1: 0.5049
 epoch: 66, train_loss: 0.9144, test_loss: 0.9573, test_f1: 0.5056
 epoch: 67, train_loss: 0.9148, test_loss: 0.9550, test_f1: 0.5115
 epoch: 68, train_loss: 0.9138, test_loss: 0.9585, test_f1: 0.5018
 epoch: 69, train_loss: 0.9098, test_loss: 0.9452, test_f1: 0.5229
 epoch: 70, train_loss: 0.9046, test_loss: 0.9646, test_f1: 0.4976
 epoch: 71, train_loss: 0.9154, test_loss: 0.9432, test_f1: 0.5205
 epoch: 72, train_loss: 0.9096, test_loss: 0.9530, test_f1: 0.5227
 epoch: 73, train_loss: 0.9056, test_loss: 0.9478, test_f1: 0.5283
 epoch: 74, train_loss: 0.9101, test_loss: 0.9602, test_f1: 0.5109
 epoch: 75, train_loss: 0.9131, test_loss: 0.9585, test_f1: 0.5029
 epoch: 76, train_loss: 0.9051, test_loss: 0.9500, test_f1: 0.5207
 epoch: 77, train_loss: 0.9056, test_loss: 0.9620, test_f1: 0.5159
 epoch: 78, train_loss: 0.9151, test_loss: 0.9529, test_f1: 0.5163
 epoch: 79, train_loss: 0.9155, test_loss: 0.9574, test_f1: 0.5211
 epoch: 80, train_loss: 0.9004, test_loss: 0.9459, test_f1: 0.5254
 epoch: 81, train_loss: 0.8998, test_loss: 0.9426, test_f1: 0.5243
 epoch: 82, train_loss: 0.9007, test_loss: 0.9481, test_f1: 0.5245
 epoch: 83, train_loss: 0.9007, test_loss: 0.9543, test_f1: 0.5178
 epoch: 84, train_loss: 0.8993, test_loss: 0.9631, test_f1: 0.5171
 epoch: 85, train_loss: 0.8959, test_loss: 0.9553, test_f1: 0.5197
 epoch: 86, train_loss: 0.9012, test_loss: 0.9567, test_f1: 0.5239
 epoch: 87, train_loss: 0.8897, test_loss: 0.9612, test_f1: 0.5162
 epoch: 88, train_loss: 0.8922, test_loss: 0.9595, test_f1: 0.5215
 epoch: 89, train_loss: 0.8982, test_loss: 0.9554, test_f1: 0.5180
 epoch: 90, train_loss: 0.8857, test_loss: 0.9600, test_f1: 0.5112
 epoch: 91, train_loss: 0.9008, test_loss: 0.9514, test_f1: 0.5178
 epoch: 92, train_loss: 0.8891, test_loss: 0.9609, test_f1: 0.5189
 epoch: 93, train_loss: 0.8998, test_loss: 0.9573, test_f1: 0.5222
 epoch: 94, train_loss: 0.8932, test_loss: 0.9670, test_f1: 0.4920
 epoch: 95, train_loss: 0.8878, test_loss: 0.9649, test_f1: 0.5092
 epoch: 96, train_loss: 0.8989, test_loss: 0.9593, test_f1: 0.5213
 epoch: 97, train_loss: 0.8763, test_loss: 0.9576, test_f1: 0.5137
 epoch: 98, train_loss: 0.8863, test_loss: 0.9559, test_f1: 0.5329
 epoch: 99, train_loss: 0.8830, test_loss: 0.9609, test_f1: 0.5314
##################ITERATION #6 ****************************************
 epoch: 0, train_loss: 1.3314, test_loss: 1.3066, test_f1: 0.2270
 epoch: 1, train_loss: 1.2692, test_loss: 1.2492, test_f1: 0.2760
 epoch: 2, train_loss: 1.2557, test_loss: 1.2193, test_f1: 0.2953
 epoch: 3, train_loss: 1.2299, test_loss: 1.2035, test_f1: 0.2965
 epoch: 4, train_loss: 1.2097, test_loss: 1.1875, test_f1: 0.3094
 epoch: 5, train_loss: 1.2005, test_loss: 1.1745, test_f1: 0.3416
 epoch: 6, train_loss: 1.1915, test_loss: 1.1577, test_f1: 0.3685
 epoch: 7, train_loss: 1.1728, test_loss: 1.1449, test_f1: 0.3830
 epoch: 8, train_loss: 1.1655, test_loss: 1.1311, test_f1: 0.3974
 epoch: 9, train_loss: 1.1601, test_loss: 1.1156, test_f1: 0.3932
 epoch: 10, train_loss: 1.1411, test_loss: 1.1046, test_f1: 0.3945
 epoch: 11, train_loss: 1.1308, test_loss: 1.0911, test_f1: 0.4147
 epoch: 12, train_loss: 1.1245, test_loss: 1.0759, test_f1: 0.4223
 epoch: 13, train_loss: 1.1016, test_loss: 1.0651, test_f1: 0.4378
 epoch: 14, train_loss: 1.1030, test_loss: 1.0537, test_f1: 0.4366
 epoch: 15, train_loss: 1.0974, test_loss: 1.0445, test_f1: 0.4459
 epoch: 16, train_loss: 1.0875, test_loss: 1.0345, test_f1: 0.4481
 epoch: 17, train_loss: 1.0780, test_loss: 1.0258, test_f1: 0.4653
 epoch: 18, train_loss: 1.0676, test_loss: 1.0141, test_f1: 0.4688
 epoch: 19, train_loss: 1.0598, test_loss: 1.0088, test_f1: 0.4457
 epoch: 20, train_loss: 1.0497, test_loss: 1.0070, test_f1: 0.4558
 epoch: 21, train_loss: 1.0497, test_loss: 0.9973, test_f1: 0.4747
 epoch: 22, train_loss: 1.0435, test_loss: 0.9963, test_f1: 0.4607
 epoch: 23, train_loss: 1.0444, test_loss: 0.9974, test_f1: 0.4523
 epoch: 24, train_loss: 1.0317, test_loss: 0.9872, test_f1: 0.4751
 epoch: 25, train_loss: 1.0283, test_loss: 0.9870, test_f1: 0.4756
 epoch: 26, train_loss: 1.0204, test_loss: 0.9859, test_f1: 0.4796
 epoch: 27, train_loss: 1.0152, test_loss: 0.9833, test_f1: 0.4759
 epoch: 28, train_loss: 1.0184, test_loss: 0.9776, test_f1: 0.4878
 epoch: 29, train_loss: 1.0098, test_loss: 0.9804, test_f1: 0.4592
 epoch: 30, train_loss: 1.0122, test_loss: 0.9712, test_f1: 0.4663
 epoch: 31, train_loss: 0.9999, test_loss: 0.9774, test_f1: 0.4901
 epoch: 32, train_loss: 1.0009, test_loss: 0.9717, test_f1: 0.4687
 epoch: 33, train_loss: 0.9951, test_loss: 0.9693, test_f1: 0.4688
 epoch: 34, train_loss: 0.9910, test_loss: 0.9673, test_f1: 0.4933
 epoch: 35, train_loss: 0.9906, test_loss: 0.9672, test_f1: 0.4780
 epoch: 36, train_loss: 0.9782, test_loss: 0.9705, test_f1: 0.4797
 epoch: 37, train_loss: 0.9752, test_loss: 0.9684, test_f1: 0.4700
 epoch: 38, train_loss: 0.9777, test_loss: 0.9689, test_f1: 0.4823
 epoch: 39, train_loss: 0.9682, test_loss: 0.9736, test_f1: 0.4703
 epoch: 40, train_loss: 0.9691, test_loss: 0.9565, test_f1: 0.4839
 epoch: 41, train_loss: 0.9655, test_loss: 0.9787, test_f1: 0.4755
 epoch: 42, train_loss: 0.9713, test_loss: 0.9567, test_f1: 0.4842
 epoch: 43, train_loss: 0.9612, test_loss: 0.9618, test_f1: 0.4788
 epoch: 44, train_loss: 0.9632, test_loss: 0.9517, test_f1: 0.4970
 epoch: 45, train_loss: 0.9566, test_loss: 0.9558, test_f1: 0.4890
 epoch: 46, train_loss: 0.9503, test_loss: 0.9623, test_f1: 0.4861
 epoch: 47, train_loss: 0.9539, test_loss: 0.9597, test_f1: 0.4955
 epoch: 48, train_loss: 0.9569, test_loss: 0.9641, test_f1: 0.4955
 epoch: 49, train_loss: 0.9450, test_loss: 0.9653, test_f1: 0.4924
 epoch: 50, train_loss: 0.9452, test_loss: 0.9563, test_f1: 0.4939
 epoch: 51, train_loss: 0.9478, test_loss: 0.9607, test_f1: 0.4971
 epoch: 52, train_loss: 0.9424, test_loss: 0.9622, test_f1: 0.4951
 epoch: 53, train_loss: 0.9445, test_loss: 0.9575, test_f1: 0.4978
 epoch: 54, train_loss: 0.9358, test_loss: 0.9619, test_f1: 0.4971
 epoch: 55, train_loss: 0.9410, test_loss: 0.9584, test_f1: 0.5036
 epoch: 56, train_loss: 0.9293, test_loss: 0.9590, test_f1: 0.5043
 epoch: 57, train_loss: 0.9391, test_loss: 0.9650, test_f1: 0.4946
 epoch: 58, train_loss: 0.9319, test_loss: 0.9559, test_f1: 0.5030
 epoch: 59, train_loss: 0.9402, test_loss: 0.9653, test_f1: 0.4989
 epoch: 60, train_loss: 0.9335, test_loss: 0.9629, test_f1: 0.5035
 epoch: 61, train_loss: 0.9381, test_loss: 0.9664, test_f1: 0.5011
 epoch: 62, train_loss: 0.9395, test_loss: 0.9548, test_f1: 0.4978
 epoch: 63, train_loss: 0.9409, test_loss: 0.9558, test_f1: 0.5001
 epoch: 64, train_loss: 0.9406, test_loss: 0.9595, test_f1: 0.5031
 epoch: 65, train_loss: 0.9317, test_loss: 0.9622, test_f1: 0.5011
 epoch: 66, train_loss: 0.9314, test_loss: 0.9605, test_f1: 0.4982
 epoch: 67, train_loss: 0.9345, test_loss: 0.9657, test_f1: 0.4994
 epoch: 68, train_loss: 0.9242, test_loss: 0.9610, test_f1: 0.4949
 epoch: 69, train_loss: 0.9258, test_loss: 0.9570, test_f1: 0.5039
 epoch: 70, train_loss: 0.9315, test_loss: 0.9533, test_f1: 0.5028
 epoch: 71, train_loss: 0.9266, test_loss: 0.9621, test_f1: 0.4978
 epoch: 72, train_loss: 0.9261, test_loss: 0.9576, test_f1: 0.5006
 epoch: 73, train_loss: 0.9245, test_loss: 0.9613, test_f1: 0.4960
 epoch: 74, train_loss: 0.9308, test_loss: 0.9607, test_f1: 0.5009
 epoch: 75, train_loss: 0.9153, test_loss: 0.9687, test_f1: 0.5024
 epoch: 76, train_loss: 0.9202, test_loss: 0.9626, test_f1: 0.5109
 epoch: 77, train_loss: 0.9208, test_loss: 0.9596, test_f1: 0.5073
 epoch: 78, train_loss: 0.9187, test_loss: 0.9632, test_f1: 0.5010
 epoch: 79, train_loss: 0.9210, test_loss: 0.9665, test_f1: 0.5016
 epoch: 80, train_loss: 0.9186, test_loss: 0.9701, test_f1: 0.5039
 epoch: 81, train_loss: 0.9158, test_loss: 0.9591, test_f1: 0.5063
 epoch: 82, train_loss: 0.9169, test_loss: 0.9524, test_f1: 0.5112
 epoch: 83, train_loss: 0.9224, test_loss: 0.9537, test_f1: 0.5034
 epoch: 84, train_loss: 0.9107, test_loss: 0.9606, test_f1: 0.5100
 epoch: 85, train_loss: 0.9190, test_loss: 0.9648, test_f1: 0.5104
 epoch: 86, train_loss: 0.9057, test_loss: 0.9608, test_f1: 0.5066
 epoch: 87, train_loss: 0.9131, test_loss: 0.9546, test_f1: 0.5174
 epoch: 88, train_loss: 0.9081, test_loss: 0.9572, test_f1: 0.5117
 epoch: 89, train_loss: 0.9181, test_loss: 0.9565, test_f1: 0.5194
 epoch: 90, train_loss: 0.9043, test_loss: 0.9588, test_f1: 0.5202
 epoch: 91, train_loss: 0.9166, test_loss: 0.9667, test_f1: 0.5218
 epoch: 92, train_loss: 0.9059, test_loss: 0.9555, test_f1: 0.5160
 epoch: 93, train_loss: 0.9176, test_loss: 0.9639, test_f1: 0.5188
 epoch: 94, train_loss: 0.8973, test_loss: 0.9591, test_f1: 0.5229
 epoch: 95, train_loss: 0.9070, test_loss: 0.9504, test_f1: 0.5238
 epoch: 96, train_loss: 0.9104, test_loss: 0.9581, test_f1: 0.5229
 epoch: 97, train_loss: 0.9087, test_loss: 0.9622, test_f1: 0.5193
 epoch: 98, train_loss: 0.9073, test_loss: 0.9593, test_f1: 0.5114
 epoch: 99, train_loss: 0.9051, test_loss: 0.9626, test_f1: 0.5226
##################ITERATION #7 ****************************************
 epoch: 0, train_loss: 1.3307, test_loss: 1.3006, test_f1: 0.2270
 epoch: 1, train_loss: 1.2818, test_loss: 1.2470, test_f1: 0.2570
 epoch: 2, train_loss: 1.2518, test_loss: 1.2268, test_f1: 0.3045
 epoch: 3, train_loss: 1.2277, test_loss: 1.2074, test_f1: 0.3175
 epoch: 4, train_loss: 1.2231, test_loss: 1.1853, test_f1: 0.3226
 epoch: 5, train_loss: 1.2049, test_loss: 1.1710, test_f1: 0.3283
 epoch: 6, train_loss: 1.1982, test_loss: 1.1554, test_f1: 0.3378
 epoch: 7, train_loss: 1.1852, test_loss: 1.1417, test_f1: 0.3492
 epoch: 8, train_loss: 1.1719, test_loss: 1.1356, test_f1: 0.3569
 epoch: 9, train_loss: 1.1628, test_loss: 1.1211, test_f1: 0.3737
 epoch: 10, train_loss: 1.1540, test_loss: 1.1077, test_f1: 0.3963
 epoch: 11, train_loss: 1.1401, test_loss: 1.0997, test_f1: 0.4132
 epoch: 12, train_loss: 1.1336, test_loss: 1.0878, test_f1: 0.4232
 epoch: 13, train_loss: 1.1280, test_loss: 1.0727, test_f1: 0.4369
 epoch: 14, train_loss: 1.1113, test_loss: 1.0669, test_f1: 0.4352
 epoch: 15, train_loss: 1.1034, test_loss: 1.0503, test_f1: 0.4457
 epoch: 16, train_loss: 1.0896, test_loss: 1.0398, test_f1: 0.4485
 epoch: 17, train_loss: 1.0893, test_loss: 1.0344, test_f1: 0.4527
 epoch: 18, train_loss: 1.0833, test_loss: 1.0279, test_f1: 0.4445
 epoch: 19, train_loss: 1.0723, test_loss: 1.0205, test_f1: 0.4402
 epoch: 20, train_loss: 1.0516, test_loss: 1.0138, test_f1: 0.4432
 epoch: 21, train_loss: 1.0450, test_loss: 1.0057, test_f1: 0.4323
 epoch: 22, train_loss: 1.0430, test_loss: 0.9945, test_f1: 0.4532
 epoch: 23, train_loss: 1.0418, test_loss: 0.9883, test_f1: 0.4590
 epoch: 24, train_loss: 1.0258, test_loss: 0.9813, test_f1: 0.4605
 epoch: 25, train_loss: 1.0227, test_loss: 0.9769, test_f1: 0.4603
 epoch: 26, train_loss: 1.0177, test_loss: 0.9738, test_f1: 0.4521
 epoch: 27, train_loss: 1.0180, test_loss: 0.9633, test_f1: 0.4641
 epoch: 28, train_loss: 1.0129, test_loss: 0.9597, test_f1: 0.4600
 epoch: 29, train_loss: 1.0013, test_loss: 0.9549, test_f1: 0.4580
 epoch: 30, train_loss: 0.9990, test_loss: 0.9494, test_f1: 0.4661
 epoch: 31, train_loss: 0.9902, test_loss: 0.9462, test_f1: 0.4790
 epoch: 32, train_loss: 0.9961, test_loss: 0.9408, test_f1: 0.4847
 epoch: 33, train_loss: 0.9859, test_loss: 0.9398, test_f1: 0.4851
 epoch: 34, train_loss: 0.9792, test_loss: 0.9389, test_f1: 0.4984
 epoch: 35, train_loss: 0.9791, test_loss: 0.9341, test_f1: 0.4987
 epoch: 36, train_loss: 0.9648, test_loss: 0.9274, test_f1: 0.5109
 epoch: 37, train_loss: 0.9711, test_loss: 0.9269, test_f1: 0.5048
 epoch: 38, train_loss: 0.9592, test_loss: 0.9284, test_f1: 0.5048
 epoch: 39, train_loss: 0.9588, test_loss: 0.9165, test_f1: 0.5016
 epoch: 40, train_loss: 0.9541, test_loss: 0.9176, test_f1: 0.4868
 epoch: 41, train_loss: 0.9550, test_loss: 0.9170, test_f1: 0.4958
 epoch: 42, train_loss: 0.9478, test_loss: 0.9210, test_f1: 0.5013
 epoch: 43, train_loss: 0.9494, test_loss: 0.9111, test_f1: 0.5007
 epoch: 44, train_loss: 0.9435, test_loss: 0.9016, test_f1: 0.5020
 epoch: 45, train_loss: 0.9417, test_loss: 0.8964, test_f1: 0.5091
 epoch: 46, train_loss: 0.9458, test_loss: 0.9001, test_f1: 0.5253
 epoch: 47, train_loss: 0.9305, test_loss: 0.8966, test_f1: 0.5066
 epoch: 48, train_loss: 0.9330, test_loss: 0.8952, test_f1: 0.4994
 epoch: 49, train_loss: 0.9296, test_loss: 0.8942, test_f1: 0.5106
 epoch: 50, train_loss: 0.9195, test_loss: 0.8975, test_f1: 0.5176
 epoch: 51, train_loss: 0.9271, test_loss: 0.8915, test_f1: 0.5222
 epoch: 52, train_loss: 0.9138, test_loss: 0.8919, test_f1: 0.4934
 epoch: 53, train_loss: 0.9175, test_loss: 0.8888, test_f1: 0.5417
 epoch: 54, train_loss: 0.9128, test_loss: 0.8919, test_f1: 0.5035
 epoch: 55, train_loss: 0.9070, test_loss: 0.8874, test_f1: 0.5281
 epoch: 56, train_loss: 0.9068, test_loss: 0.8916, test_f1: 0.5356
 epoch: 57, train_loss: 0.9150, test_loss: 0.8883, test_f1: 0.5155
 epoch: 58, train_loss: 0.9110, test_loss: 0.8913, test_f1: 0.5183
 epoch: 59, train_loss: 0.9140, test_loss: 0.8918, test_f1: 0.5344
 epoch: 60, train_loss: 0.9131, test_loss: 0.8847, test_f1: 0.5314
 epoch: 61, train_loss: 0.9038, test_loss: 0.8832, test_f1: 0.5368
 epoch: 62, train_loss: 0.9075, test_loss: 0.8826, test_f1: 0.5319
 epoch: 63, train_loss: 0.9063, test_loss: 0.8856, test_f1: 0.5377
 epoch: 64, train_loss: 0.9057, test_loss: 0.8856, test_f1: 0.5365
 epoch: 65, train_loss: 0.9024, test_loss: 0.8854, test_f1: 0.5340
 epoch: 66, train_loss: 0.9042, test_loss: 0.8837, test_f1: 0.5308
 epoch: 67, train_loss: 0.9004, test_loss: 0.8820, test_f1: 0.5380
 epoch: 68, train_loss: 0.9016, test_loss: 0.8839, test_f1: 0.5435
 epoch: 69, train_loss: 0.8917, test_loss: 0.8844, test_f1: 0.5423
 epoch: 70, train_loss: 0.8894, test_loss: 0.8854, test_f1: 0.5371
 epoch: 71, train_loss: 0.8970, test_loss: 0.8821, test_f1: 0.5412
 epoch: 72, train_loss: 0.8887, test_loss: 0.8832, test_f1: 0.5387
 epoch: 73, train_loss: 0.8877, test_loss: 0.8869, test_f1: 0.5485
 epoch: 74, train_loss: 0.8977, test_loss: 0.8776, test_f1: 0.5447
 epoch: 75, train_loss: 0.9060, test_loss: 0.8842, test_f1: 0.5546
 epoch: 76, train_loss: 0.8931, test_loss: 0.8810, test_f1: 0.5479
 epoch: 77, train_loss: 0.8904, test_loss: 0.8820, test_f1: 0.5523
 epoch: 78, train_loss: 0.8934, test_loss: 0.8817, test_f1: 0.5365
 epoch: 79, train_loss: 0.8970, test_loss: 0.8855, test_f1: 0.5373
 epoch: 80, train_loss: 0.8910, test_loss: 0.8797, test_f1: 0.5362
 epoch: 81, train_loss: 0.8835, test_loss: 0.8824, test_f1: 0.5387
 epoch: 82, train_loss: 0.8784, test_loss: 0.8811, test_f1: 0.5480
 epoch: 83, train_loss: 0.8783, test_loss: 0.8872, test_f1: 0.5390
 epoch: 84, train_loss: 0.8918, test_loss: 0.8784, test_f1: 0.5411
 epoch: 85, train_loss: 0.8840, test_loss: 0.8817, test_f1: 0.5461
 epoch: 86, train_loss: 0.8791, test_loss: 0.8804, test_f1: 0.5483
 epoch: 87, train_loss: 0.8852, test_loss: 0.8865, test_f1: 0.5392
 epoch: 88, train_loss: 0.8805, test_loss: 0.8839, test_f1: 0.5469
 epoch: 89, train_loss: 0.8760, test_loss: 0.8799, test_f1: 0.5543
 epoch: 90, train_loss: 0.8730, test_loss: 0.8811, test_f1: 0.5516
 epoch: 91, train_loss: 0.8796, test_loss: 0.8785, test_f1: 0.5465
 epoch: 92, train_loss: 0.8774, test_loss: 0.8753, test_f1: 0.5523
 epoch: 93, train_loss: 0.8722, test_loss: 0.8768, test_f1: 0.5500
 epoch: 94, train_loss: 0.8788, test_loss: 0.8756, test_f1: 0.5497
 epoch: 95, train_loss: 0.8827, test_loss: 0.8824, test_f1: 0.5378
 epoch: 96, train_loss: 0.8791, test_loss: 0.8797, test_f1: 0.5526
 epoch: 97, train_loss: 0.8673, test_loss: 0.8822, test_f1: 0.5501
 epoch: 98, train_loss: 0.8723, test_loss: 0.8834, test_f1: 0.5466
 epoch: 99, train_loss: 0.8739, test_loss: 0.8759, test_f1: 0.5412
##################ITERATION #8 ****************************************
 epoch: 0, train_loss: 1.2968, test_loss: 1.3796, test_f1: 0.2745
 epoch: 1, train_loss: 1.2505, test_loss: 1.2420, test_f1: 0.2844
 epoch: 2, train_loss: 1.2288, test_loss: 1.2086, test_f1: 0.3158
 epoch: 3, train_loss: 1.2064, test_loss: 1.1839, test_f1: 0.3684
 epoch: 4, train_loss: 1.1961, test_loss: 1.1758, test_f1: 0.3835
 epoch: 5, train_loss: 1.1879, test_loss: 1.1643, test_f1: 0.3756
 epoch: 6, train_loss: 1.1653, test_loss: 1.1484, test_f1: 0.3922
 epoch: 7, train_loss: 1.1577, test_loss: 1.1374, test_f1: 0.3865
 epoch: 8, train_loss: 1.1494, test_loss: 1.1260, test_f1: 0.3878
 epoch: 9, train_loss: 1.1392, test_loss: 1.1052, test_f1: 0.3940
 epoch: 10, train_loss: 1.1276, test_loss: 1.0997, test_f1: 0.4020
 epoch: 11, train_loss: 1.1150, test_loss: 1.0873, test_f1: 0.4083
 epoch: 12, train_loss: 1.1140, test_loss: 1.0842, test_f1: 0.4007
 epoch: 13, train_loss: 1.1037, test_loss: 1.0900, test_f1: 0.4148
 epoch: 14, train_loss: 1.1034, test_loss: 1.0892, test_f1: 0.4079
 epoch: 15, train_loss: 1.0926, test_loss: 1.0799, test_f1: 0.4188
 epoch: 16, train_loss: 1.0882, test_loss: 1.0468, test_f1: 0.4396
 epoch: 17, train_loss: 1.0849, test_loss: 1.0761, test_f1: 0.4206
 epoch: 18, train_loss: 1.0654, test_loss: 1.0488, test_f1: 0.4434
 epoch: 19, train_loss: 1.0614, test_loss: 1.0572, test_f1: 0.4504
 epoch: 20, train_loss: 1.0642, test_loss: 1.0350, test_f1: 0.4658
 epoch: 21, train_loss: 1.0502, test_loss: 1.0419, test_f1: 0.4650
 epoch: 22, train_loss: 1.0392, test_loss: 1.0431, test_f1: 0.4685
 epoch: 23, train_loss: 1.0416, test_loss: 1.0263, test_f1: 0.4683
 epoch: 24, train_loss: 1.0410, test_loss: 1.0575, test_f1: 0.4525
 epoch: 25, train_loss: 1.0321, test_loss: 1.0354, test_f1: 0.4632
 epoch: 26, train_loss: 1.0255, test_loss: 1.0174, test_f1: 0.4717
 epoch: 27, train_loss: 1.0233, test_loss: 1.0218, test_f1: 0.4707
 epoch: 28, train_loss: 1.0212, test_loss: 1.0494, test_f1: 0.4573
 epoch: 29, train_loss: 1.0115, test_loss: 1.0197, test_f1: 0.4698
 epoch: 30, train_loss: 1.0024, test_loss: 1.0149, test_f1: 0.4688
 epoch: 31, train_loss: 1.0024, test_loss: 1.0120, test_f1: 0.4833
 epoch: 32, train_loss: 0.9989, test_loss: 1.0044, test_f1: 0.4747
 epoch: 33, train_loss: 1.0019, test_loss: 1.0258, test_f1: 0.4787
 epoch: 34, train_loss: 0.9937, test_loss: 0.9993, test_f1: 0.4906
 epoch: 35, train_loss: 0.9895, test_loss: 1.0037, test_f1: 0.4865
 epoch: 36, train_loss: 0.9855, test_loss: 1.0042, test_f1: 0.4849
 epoch: 37, train_loss: 0.9779, test_loss: 0.9933, test_f1: 0.5107
 epoch: 38, train_loss: 0.9905, test_loss: 1.0057, test_f1: 0.5005
 epoch: 39, train_loss: 0.9800, test_loss: 0.9905, test_f1: 0.4991
 epoch: 40, train_loss: 0.9746, test_loss: 0.9907, test_f1: 0.5162
 epoch: 41, train_loss: 0.9645, test_loss: 1.0046, test_f1: 0.4981
 epoch: 42, train_loss: 0.9747, test_loss: 1.0217, test_f1: 0.4871
 epoch: 43, train_loss: 0.9729, test_loss: 0.9926, test_f1: 0.5076
 epoch: 44, train_loss: 0.9628, test_loss: 0.9797, test_f1: 0.5157
 epoch: 45, train_loss: 0.9605, test_loss: 0.9889, test_f1: 0.5092
 epoch: 46, train_loss: 0.9675, test_loss: 0.9996, test_f1: 0.5149
 epoch: 47, train_loss: 0.9563, test_loss: 0.9999, test_f1: 0.5013
 epoch: 48, train_loss: 0.9589, test_loss: 0.9692, test_f1: 0.5174
 epoch: 49, train_loss: 0.9465, test_loss: 0.9814, test_f1: 0.5165
 epoch: 50, train_loss: 0.9529, test_loss: 0.9883, test_f1: 0.5154
 epoch: 51, train_loss: 0.9479, test_loss: 0.9806, test_f1: 0.5146
 epoch: 52, train_loss: 0.9395, test_loss: 0.9773, test_f1: 0.5283
 epoch: 53, train_loss: 0.9357, test_loss: 0.9752, test_f1: 0.5204
 epoch: 54, train_loss: 0.9398, test_loss: 0.9811, test_f1: 0.5217
 epoch: 55, train_loss: 0.9408, test_loss: 0.9844, test_f1: 0.5141
 epoch: 56, train_loss: 0.9273, test_loss: 0.9748, test_f1: 0.5264
 epoch: 57, train_loss: 0.9411, test_loss: 0.9693, test_f1: 0.5306
 epoch: 58, train_loss: 0.9285, test_loss: 0.9757, test_f1: 0.5184
 epoch: 59, train_loss: 0.9327, test_loss: 0.9729, test_f1: 0.5280
 epoch: 60, train_loss: 0.9254, test_loss: 0.9711, test_f1: 0.5246
 epoch: 61, train_loss: 0.9297, test_loss: 0.9850, test_f1: 0.5171
 epoch: 62, train_loss: 0.9350, test_loss: 0.9855, test_f1: 0.5163
 epoch: 63, train_loss: 0.9150, test_loss: 0.9808, test_f1: 0.5194
 epoch: 64, train_loss: 0.9328, test_loss: 0.9587, test_f1: 0.5212
 epoch: 65, train_loss: 0.9262, test_loss: 0.9942, test_f1: 0.5139
 epoch: 66, train_loss: 0.9217, test_loss: 0.9909, test_f1: 0.5124
 epoch: 67, train_loss: 0.9317, test_loss: 0.9725, test_f1: 0.5194
 epoch: 68, train_loss: 0.9256, test_loss: 0.9791, test_f1: 0.5183
 epoch: 69, train_loss: 0.9170, test_loss: 0.9633, test_f1: 0.5279
 epoch: 70, train_loss: 0.9226, test_loss: 0.9842, test_f1: 0.5217
 epoch: 71, train_loss: 0.9210, test_loss: 0.9675, test_f1: 0.5221
 epoch: 72, train_loss: 0.9204, test_loss: 0.9720, test_f1: 0.5232
 epoch: 73, train_loss: 0.9135, test_loss: 0.9778, test_f1: 0.5212
 epoch: 74, train_loss: 0.9206, test_loss: 0.9672, test_f1: 0.5230
 epoch: 75, train_loss: 0.9072, test_loss: 0.9610, test_f1: 0.5280
 epoch: 76, train_loss: 0.9170, test_loss: 0.9766, test_f1: 0.5160
 epoch: 77, train_loss: 0.9093, test_loss: 0.9670, test_f1: 0.5273
 epoch: 78, train_loss: 0.9136, test_loss: 0.9680, test_f1: 0.5230
 epoch: 79, train_loss: 0.9027, test_loss: 0.9748, test_f1: 0.5227
 epoch: 80, train_loss: 0.9002, test_loss: 0.9725, test_f1: 0.5188
 epoch: 81, train_loss: 0.9012, test_loss: 0.9695, test_f1: 0.5271
 epoch: 82, train_loss: 0.9092, test_loss: 0.9681, test_f1: 0.5277
 epoch: 83, train_loss: 0.9011, test_loss: 0.9644, test_f1: 0.5268
 epoch: 84, train_loss: 0.9031, test_loss: 0.9822, test_f1: 0.5126
 epoch: 85, train_loss: 0.9024, test_loss: 0.9719, test_f1: 0.5181
 epoch: 86, train_loss: 0.8990, test_loss: 0.9691, test_f1: 0.5235
 epoch: 87, train_loss: 0.8993, test_loss: 0.9592, test_f1: 0.5335
 epoch: 88, train_loss: 0.9021, test_loss: 0.9744, test_f1: 0.5237
 epoch: 89, train_loss: 0.9060, test_loss: 0.9732, test_f1: 0.5293
 epoch: 90, train_loss: 0.8972, test_loss: 0.9650, test_f1: 0.5348
 epoch: 91, train_loss: 0.8928, test_loss: 0.9627, test_f1: 0.5288
 epoch: 92, train_loss: 0.8961, test_loss: 0.9826, test_f1: 0.5284
 epoch: 93, train_loss: 0.8975, test_loss: 0.9669, test_f1: 0.5155
 epoch: 94, train_loss: 0.8933, test_loss: 0.9618, test_f1: 0.5345
 epoch: 95, train_loss: 0.8911, test_loss: 0.9582, test_f1: 0.5296
 epoch: 96, train_loss: 0.9034, test_loss: 0.9658, test_f1: 0.5311
 epoch: 97, train_loss: 0.9002, test_loss: 0.9752, test_f1: 0.5350
 epoch: 98, train_loss: 0.8929, test_loss: 0.9574, test_f1: 0.5297
 epoch: 99, train_loss: 0.8999, test_loss: 0.9782, test_f1: 0.5325
##################ITERATION #9 ****************************************
 epoch: 0, train_loss: 1.3692, test_loss: 1.3476, test_f1: 0.2255
 epoch: 1, train_loss: 1.2883, test_loss: 1.3224, test_f1: 0.3163
 epoch: 2, train_loss: 1.2630, test_loss: 1.2456, test_f1: 0.3422
 epoch: 3, train_loss: 1.2454, test_loss: 1.2049, test_f1: 0.3818
 epoch: 4, train_loss: 1.2319, test_loss: 1.1920, test_f1: 0.3867
 epoch: 5, train_loss: 1.2113, test_loss: 1.1729, test_f1: 0.3999
 epoch: 6, train_loss: 1.2006, test_loss: 1.1596, test_f1: 0.4237
 epoch: 7, train_loss: 1.1941, test_loss: 1.1433, test_f1: 0.4089
 epoch: 8, train_loss: 1.1797, test_loss: 1.1265, test_f1: 0.4070
 epoch: 9, train_loss: 1.1691, test_loss: 1.1140, test_f1: 0.4273
 epoch: 10, train_loss: 1.1527, test_loss: 1.1044, test_f1: 0.4273
 epoch: 11, train_loss: 1.1448, test_loss: 1.0927, test_f1: 0.4347
 epoch: 12, train_loss: 1.1502, test_loss: 1.0833, test_f1: 0.4432
 epoch: 13, train_loss: 1.1425, test_loss: 1.0693, test_f1: 0.4583
 epoch: 14, train_loss: 1.1342, test_loss: 1.0606, test_f1: 0.4568
 epoch: 15, train_loss: 1.1169, test_loss: 1.0558, test_f1: 0.4603
 epoch: 16, train_loss: 1.1115, test_loss: 1.0466, test_f1: 0.4552
 epoch: 17, train_loss: 1.1064, test_loss: 1.0466, test_f1: 0.4452
 epoch: 18, train_loss: 1.1009, test_loss: 1.0387, test_f1: 0.4712
 epoch: 19, train_loss: 1.0908, test_loss: 1.0386, test_f1: 0.4719
 epoch: 20, train_loss: 1.0863, test_loss: 1.0228, test_f1: 0.4686
 epoch: 21, train_loss: 1.0893, test_loss: 1.0187, test_f1: 0.4867
 epoch: 22, train_loss: 1.0744, test_loss: 1.0156, test_f1: 0.4742
 epoch: 23, train_loss: 1.0686, test_loss: 1.0040, test_f1: 0.4899
 epoch: 24, train_loss: 1.0710, test_loss: 0.9958, test_f1: 0.4866
 epoch: 25, train_loss: 1.0605, test_loss: 0.9980, test_f1: 0.4896
 epoch: 26, train_loss: 1.0618, test_loss: 0.9974, test_f1: 0.4814
 epoch: 27, train_loss: 1.0543, test_loss: 0.9951, test_f1: 0.4770
 epoch: 28, train_loss: 1.0402, test_loss: 0.9847, test_f1: 0.4975
 epoch: 29, train_loss: 1.0418, test_loss: 0.9880, test_f1: 0.4779
 epoch: 30, train_loss: 1.0390, test_loss: 0.9852, test_f1: 0.4761
 epoch: 31, train_loss: 1.0313, test_loss: 0.9837, test_f1: 0.4873
 epoch: 32, train_loss: 1.0288, test_loss: 0.9758, test_f1: 0.4935
 epoch: 33, train_loss: 1.0293, test_loss: 0.9700, test_f1: 0.4888
 epoch: 34, train_loss: 1.0225, test_loss: 0.9741, test_f1: 0.4726
 epoch: 35, train_loss: 1.0262, test_loss: 0.9650, test_f1: 0.4919
 epoch: 36, train_loss: 1.0149, test_loss: 0.9691, test_f1: 0.4843
 epoch: 37, train_loss: 1.0037, test_loss: 0.9655, test_f1: 0.4770
 epoch: 38, train_loss: 1.0079, test_loss: 0.9634, test_f1: 0.4775
 epoch: 39, train_loss: 1.0061, test_loss: 0.9624, test_f1: 0.4809
 epoch: 40, train_loss: 0.9940, test_loss: 0.9634, test_f1: 0.4730
 epoch: 41, train_loss: 1.0030, test_loss: 0.9558, test_f1: 0.4867
 epoch: 42, train_loss: 0.9995, test_loss: 0.9721, test_f1: 0.4832
 epoch: 43, train_loss: 0.9944, test_loss: 0.9705, test_f1: 0.4810
 epoch: 44, train_loss: 0.9993, test_loss: 0.9706, test_f1: 0.4776
 epoch: 45, train_loss: 0.9845, test_loss: 0.9570, test_f1: 0.4795
 epoch: 46, train_loss: 0.9774, test_loss: 0.9619, test_f1: 0.4776
 epoch: 47, train_loss: 0.9831, test_loss: 0.9575, test_f1: 0.4757
 epoch: 48, train_loss: 0.9751, test_loss: 0.9661, test_f1: 0.4836
 epoch: 49, train_loss: 0.9727, test_loss: 0.9641, test_f1: 0.4812
 epoch: 50, train_loss: 0.9803, test_loss: 0.9780, test_f1: 0.4753
 epoch: 51, train_loss: 0.9707, test_loss: 0.9554, test_f1: 0.4756
 epoch: 52, train_loss: 0.9704, test_loss: 0.9524, test_f1: 0.4837
 epoch: 53, train_loss: 0.9699, test_loss: 0.9546, test_f1: 0.4893
 epoch: 54, train_loss: 0.9665, test_loss: 0.9515, test_f1: 0.4850
 epoch: 55, train_loss: 0.9696, test_loss: 0.9587, test_f1: 0.4880
 epoch: 56, train_loss: 0.9667, test_loss: 0.9500, test_f1: 0.4897
 epoch: 57, train_loss: 0.9546, test_loss: 0.9574, test_f1: 0.4908
 epoch: 58, train_loss: 0.9521, test_loss: 0.9435, test_f1: 0.4891
 epoch: 59, train_loss: 0.9546, test_loss: 0.9491, test_f1: 0.4942
 epoch: 60, train_loss: 0.9562, test_loss: 0.9462, test_f1: 0.4846
 epoch: 61, train_loss: 0.9503, test_loss: 0.9420, test_f1: 0.4927
 epoch: 62, train_loss: 0.9423, test_loss: 0.9423, test_f1: 0.4901
 epoch: 63, train_loss: 0.9520, test_loss: 0.9478, test_f1: 0.4935
 epoch: 64, train_loss: 0.9476, test_loss: 0.9450, test_f1: 0.4901
 epoch: 65, train_loss: 0.9488, test_loss: 0.9543, test_f1: 0.4904
 epoch: 66, train_loss: 0.9495, test_loss: 0.9528, test_f1: 0.4889
 epoch: 67, train_loss: 0.9507, test_loss: 0.9566, test_f1: 0.4856
 epoch: 68, train_loss: 0.9369, test_loss: 0.9508, test_f1: 0.4858
 epoch: 69, train_loss: 0.9459, test_loss: 0.9522, test_f1: 0.4902
 epoch: 70, train_loss: 0.9511, test_loss: 0.9604, test_f1: 0.4851
 epoch: 71, train_loss: 0.9418, test_loss: 0.9600, test_f1: 0.4840
 epoch: 72, train_loss: 0.9472, test_loss: 0.9611, test_f1: 0.4866
 epoch: 73, train_loss: 0.9327, test_loss: 0.9560, test_f1: 0.4872
 epoch: 74, train_loss: 0.9341, test_loss: 0.9460, test_f1: 0.4912
 epoch: 75, train_loss: 0.9408, test_loss: 0.9345, test_f1: 0.5021
 epoch: 76, train_loss: 0.9321, test_loss: 0.9489, test_f1: 0.4897
 epoch: 77, train_loss: 0.9314, test_loss: 0.9529, test_f1: 0.4980
 epoch: 78, train_loss: 0.9394, test_loss: 0.9463, test_f1: 0.4955
 epoch: 79, train_loss: 0.9391, test_loss: 0.9610, test_f1: 0.4897
 epoch: 80, train_loss: 0.9246, test_loss: 0.9531, test_f1: 0.4939
 epoch: 81, train_loss: 0.9344, test_loss: 0.9631, test_f1: 0.4971
 epoch: 82, train_loss: 0.9361, test_loss: 0.9361, test_f1: 0.5081
 epoch: 83, train_loss: 0.9379, test_loss: 0.9531, test_f1: 0.4826
 epoch: 84, train_loss: 0.9271, test_loss: 0.9477, test_f1: 0.4936
 epoch: 85, train_loss: 0.9365, test_loss: 0.9615, test_f1: 0.4975
 epoch: 86, train_loss: 0.9376, test_loss: 0.9613, test_f1: 0.4947
 epoch: 87, train_loss: 0.9272, test_loss: 0.9405, test_f1: 0.4991
 epoch: 88, train_loss: 0.9189, test_loss: 0.9336, test_f1: 0.5083
 epoch: 89, train_loss: 0.9228, test_loss: 0.9430, test_f1: 0.5053
 epoch: 90, train_loss: 0.9267, test_loss: 0.9544, test_f1: 0.5012
 epoch: 91, train_loss: 0.9259, test_loss: 0.9557, test_f1: 0.4930
 epoch: 92, train_loss: 0.9235, test_loss: 0.9476, test_f1: 0.4921
 epoch: 93, train_loss: 0.9295, test_loss: 0.9469, test_f1: 0.4962
 epoch: 94, train_loss: 0.9221, test_loss: 0.9501, test_f1: 0.5062
 epoch: 95, train_loss: 0.9250, test_loss: 0.9491, test_f1: 0.4993
 epoch: 96, train_loss: 0.9197, test_loss: 0.9526, test_f1: 0.4967
 epoch: 97, train_loss: 0.9162, test_loss: 0.9427, test_f1: 0.4990
 epoch: 98, train_loss: 0.9218, test_loss: 0.9545, test_f1: 0.4947
 epoch: 99, train_loss: 0.9267, test_loss: 0.9645, test_f1: 0.5028

Training completed in 515.80 seconds
Best F1: 0.5627 at epoch 99
Mean F1 across iterations: 0.5335  0.0150
========================FINAL RESULTS================================
FEGIN weighted F1: 0.5627  0.0150
python main.py --data ltspice_examples --representation component_net --model FEGIN --layers 5 --hiddens 32 --batch_size 128 --lr 0.0001 --emb_size 250 --epochs 100 --save_appendix component_net_L5_H32_BS128_LR0.0001_E250 --no_val
-----



STDERR:
  File "main.py", line 370, in <module>
    main()
  File "main.py", line 254, in main
    dataset = dataset_class(
  File "/home/philip/projects/ltspice_examples_code_repo/Circuit-Completion-Using-GNNs/component_classification_with_link_prediction_head/evaluation/FEGIN/kernel/circuit_datasets.py", line 15, in __init__
    self.data, self.slices = torch.load(self.processed_paths[0])
  File "/home/philip/.local/lib/python3.8/site-packages/torch/serialization.py", line 1040, in load
    warnings.warn(
  File "/usr/lib/python3.8/warnings.py", line 109, in _showwarnmsg
    sw(msg.message, msg.category, msg.filename, msg.lineno,
  File "main.py", line 47, in warn_with_traceback
    traceback.print_stack(file=log)
/home/philip/projects/ltspice_examples_code_repo/Circuit-Completion-Using-GNNs/component_classification_with_link_prediction_head/evaluation/FEGIN/kernel/circuit_datasets.py:15: FutureWarning: You are using `torch.load` with `weights_only=False` (the current default value), which uses the default pickle module implicitly. It is possible to construct malicious pickle data which will execute arbitrary code during unpickling (See https://github.com/pytorch/pytorch/blob/main/SECURITY.md#untrusted-models for more details). In a future release, the default value for `weights_only` will be flipped to `True`. This limits the functions that could be executed during unpickling. Arbitrary objects will no longer be allowed to be loaded via this mode unless they are explicitly allowlisted by the user via `torch.serialization.add_safe_globals`. We recommend you start setting `weights_only=True` for any use case where you don't have full control of the loaded file. Please open an issue on GitHub for any issues related to this experimental feature.
  self.data, self.slices = torch.load(self.processed_paths[0])
