STDOUT:
Results will be saved in /home/philip/projects/ltspice_examples_code_repo/Circuit-Completion-Using-GNNs/component_classification_with_link_prediction_head/evaluation/FEGIN/results/model_FEGIN_dataset_ltspice_demos
Command line input: python main.py --data ltspice_demos --representation component_component --model FEGIN --layers 3 --hiddens 16 --batch_size 256 --lr 0.001 --emb_size 128 --epochs 100 --save_appendix component_component_L3_H16_BS256_LR0.001_E128 --no_val
 is saved.
-----
ltspice_demos - FEGIN
Using 3 layers, 16 hidden units, h = 2
Loading component_component representation dataset
ENTERED
Training FEGIN on component_component representation
Train: 1565, Test: 383
##################ITERATION #0 ****************************************
 epoch: 0, train_loss: 1.3337, test_loss: 1.3419, test_f1: 0.1836
 epoch: 1, train_loss: 1.3196, test_loss: 1.3360, test_f1: 0.3195
 epoch: 2, train_loss: 1.3084, test_loss: 1.3301, test_f1: 0.2586
 epoch: 3, train_loss: 1.2987, test_loss: 1.3231, test_f1: 0.2289
 epoch: 4, train_loss: 1.2896, test_loss: 1.3153, test_f1: 0.2289
 epoch: 5, train_loss: 1.2808, test_loss: 1.3083, test_f1: 0.2289
 epoch: 6, train_loss: 1.2703, test_loss: 1.3025, test_f1: 0.2289
 epoch: 7, train_loss: 1.2625, test_loss: 1.2987, test_f1: 0.2285
 epoch: 8, train_loss: 1.2572, test_loss: 1.2955, test_f1: 0.2285
 epoch: 9, train_loss: 1.2454, test_loss: 1.2909, test_f1: 0.2285
 epoch: 10, train_loss: 1.2447, test_loss: 1.2877, test_f1: 0.2289
 epoch: 11, train_loss: 1.2384, test_loss: 1.2871, test_f1: 0.2293
 epoch: 12, train_loss: 1.2283, test_loss: 1.2863, test_f1: 0.2293
 epoch: 13, train_loss: 1.2246, test_loss: 1.2843, test_f1: 0.2686
 epoch: 14, train_loss: 1.2188, test_loss: 1.2858, test_f1: 0.2713
 epoch: 15, train_loss: 1.2151, test_loss: 1.2802, test_f1: 0.2643
 epoch: 16, train_loss: 1.2034, test_loss: 1.2758, test_f1: 0.2682
 epoch: 17, train_loss: 1.2007, test_loss: 1.2782, test_f1: 0.2809
 epoch: 18, train_loss: 1.1998, test_loss: 1.2843, test_f1: 0.2811
 epoch: 19, train_loss: 1.1980, test_loss: 1.2919, test_f1: 0.2666
 epoch: 20, train_loss: 1.1901, test_loss: 1.2903, test_f1: 0.2719
 epoch: 21, train_loss: 1.1827, test_loss: 1.2752, test_f1: 0.2879
 epoch: 22, train_loss: 1.1843, test_loss: 1.2719, test_f1: 0.2823
 epoch: 23, train_loss: 1.1703, test_loss: 1.2783, test_f1: 0.2746
 epoch: 24, train_loss: 1.1727, test_loss: 1.2816, test_f1: 0.2698
 epoch: 25, train_loss: 1.1732, test_loss: 1.2818, test_f1: 0.2689
 epoch: 26, train_loss: 1.1659, test_loss: 1.2773, test_f1: 0.2673
 epoch: 27, train_loss: 1.1646, test_loss: 1.2749, test_f1: 0.2698
 epoch: 28, train_loss: 1.1495, test_loss: 1.2776, test_f1: 0.2780
 epoch: 29, train_loss: 1.1518, test_loss: 1.2784, test_f1: 0.2831
 epoch: 30, train_loss: 1.1405, test_loss: 1.2770, test_f1: 0.2837
 epoch: 31, train_loss: 1.1350, test_loss: 1.2902, test_f1: 0.2920
 epoch: 32, train_loss: 1.1316, test_loss: 1.2884, test_f1: 0.3152
 epoch: 33, train_loss: 1.1322, test_loss: 1.2899, test_f1: 0.3679
 epoch: 34, train_loss: 1.1293, test_loss: 1.2860, test_f1: 0.3908
 epoch: 35, train_loss: 1.1257, test_loss: 1.2964, test_f1: 0.3818
 epoch: 36, train_loss: 1.1180, test_loss: 1.3242, test_f1: 0.3657
 epoch: 37, train_loss: 1.1199, test_loss: 1.3138, test_f1: 0.3450
 epoch: 38, train_loss: 1.1129, test_loss: 1.3013, test_f1: 0.3951
 epoch: 39, train_loss: 1.1018, test_loss: 1.3088, test_f1: 0.4016
 epoch: 40, train_loss: 1.1002, test_loss: 1.2976, test_f1: 0.4143
 epoch: 41, train_loss: 1.0959, test_loss: 1.2954, test_f1: 0.4043
 epoch: 42, train_loss: 1.0954, test_loss: 1.2843, test_f1: 0.4119
 epoch: 43, train_loss: 1.0822, test_loss: 1.2816, test_f1: 0.4073
 epoch: 44, train_loss: 1.0828, test_loss: 1.2821, test_f1: 0.4186
 epoch: 45, train_loss: 1.0715, test_loss: 1.2905, test_f1: 0.4190
 epoch: 46, train_loss: 1.0805, test_loss: 1.3275, test_f1: 0.3867
 epoch: 47, train_loss: 1.0584, test_loss: 1.3893, test_f1: 0.3473
 epoch: 48, train_loss: 1.0733, test_loss: 1.4065, test_f1: 0.3459
 epoch: 49, train_loss: 1.0612, test_loss: 1.3678, test_f1: 0.3822
 epoch: 50, train_loss: 1.0586, test_loss: 1.3507, test_f1: 0.3311
 epoch: 51, train_loss: 1.0456, test_loss: 1.3447, test_f1: 0.3458
 epoch: 52, train_loss: 1.0450, test_loss: 1.3707, test_f1: 0.4008
 epoch: 53, train_loss: 1.0542, test_loss: 1.3263, test_f1: 0.4021
 epoch: 54, train_loss: 1.0507, test_loss: 1.3124, test_f1: 0.3981
 epoch: 55, train_loss: 1.0340, test_loss: 1.3116, test_f1: 0.4003
 epoch: 56, train_loss: 1.0423, test_loss: 1.3311, test_f1: 0.3923
 epoch: 57, train_loss: 1.0357, test_loss: 1.3636, test_f1: 0.4012
 epoch: 58, train_loss: 1.0389, test_loss: 1.3947, test_f1: 0.3858
 epoch: 59, train_loss: 1.0375, test_loss: 1.3585, test_f1: 0.4005
 epoch: 60, train_loss: 1.0327, test_loss: 1.3486, test_f1: 0.4198
 epoch: 61, train_loss: 1.0246, test_loss: 1.3332, test_f1: 0.4026
 epoch: 62, train_loss: 1.0272, test_loss: 1.3423, test_f1: 0.3932
 epoch: 63, train_loss: 1.0276, test_loss: 1.3788, test_f1: 0.3870
 epoch: 64, train_loss: 1.0258, test_loss: 1.3742, test_f1: 0.4009
 epoch: 65, train_loss: 1.0282, test_loss: 1.3436, test_f1: 0.4032
 epoch: 66, train_loss: 1.0259, test_loss: 1.3520, test_f1: 0.4055
 epoch: 67, train_loss: 1.0260, test_loss: 1.3629, test_f1: 0.4098
 epoch: 68, train_loss: 1.0252, test_loss: 1.3527, test_f1: 0.4049
 epoch: 69, train_loss: 1.0165, test_loss: 1.3525, test_f1: 0.4056
 epoch: 70, train_loss: 1.0161, test_loss: 1.3535, test_f1: 0.4120
 epoch: 71, train_loss: 1.0068, test_loss: 1.3472, test_f1: 0.4072
 epoch: 72, train_loss: 1.0165, test_loss: 1.3255, test_f1: 0.4063
 epoch: 73, train_loss: 1.0103, test_loss: 1.3139, test_f1: 0.4135
 epoch: 74, train_loss: 1.0057, test_loss: 1.3289, test_f1: 0.4173
 epoch: 75, train_loss: 1.0083, test_loss: 1.3307, test_f1: 0.4012
 epoch: 76, train_loss: 0.9997, test_loss: 1.3271, test_f1: 0.3934
 epoch: 77, train_loss: 1.0148, test_loss: 1.3273, test_f1: 0.4205
 epoch: 78, train_loss: 1.0173, test_loss: 1.3426, test_f1: 0.4085
 epoch: 79, train_loss: 0.9976, test_loss: 1.3655, test_f1: 0.4257
 epoch: 80, train_loss: 1.0108, test_loss: 1.3988, test_f1: 0.4171
 epoch: 81, train_loss: 1.0070, test_loss: 1.4187, test_f1: 0.4063
 epoch: 82, train_loss: 0.9923, test_loss: 1.3725, test_f1: 0.4070
 epoch: 83, train_loss: 1.0089, test_loss: 1.3483, test_f1: 0.4105
 epoch: 84, train_loss: 1.0050, test_loss: 1.3691, test_f1: 0.4096
 epoch: 85, train_loss: 0.9964, test_loss: 1.3917, test_f1: 0.4114
 epoch: 86, train_loss: 0.9900, test_loss: 1.4059, test_f1: 0.4042
 epoch: 87, train_loss: 1.0000, test_loss: 1.3831, test_f1: 0.4231
 epoch: 88, train_loss: 0.9888, test_loss: 1.3830, test_f1: 0.4175
 epoch: 89, train_loss: 0.9918, test_loss: 1.3716, test_f1: 0.4294
 epoch: 90, train_loss: 0.9949, test_loss: 1.3661, test_f1: 0.4346
 epoch: 91, train_loss: 0.9917, test_loss: 1.3590, test_f1: 0.4233
 epoch: 92, train_loss: 0.9794, test_loss: 1.3390, test_f1: 0.4244
 epoch: 93, train_loss: 0.9909, test_loss: 1.3334, test_f1: 0.4238
 epoch: 94, train_loss: 0.9883, test_loss: 1.3290, test_f1: 0.4282
 epoch: 95, train_loss: 0.9818, test_loss: 1.3441, test_f1: 0.4281
 epoch: 96, train_loss: 0.9869, test_loss: 1.3613, test_f1: 0.4310
 epoch: 97, train_loss: 0.9817, test_loss: 1.3676, test_f1: 0.4121
 epoch: 98, train_loss: 0.9742, test_loss: 1.3646, test_f1: 0.4075
 epoch: 99, train_loss: 0.9849, test_loss: 1.3733, test_f1: 0.4090
##################ITERATION #1 ****************************************
 epoch: 0, train_loss: 1.3106, test_loss: 1.3264, test_f1: 0.2281
 epoch: 1, train_loss: 1.2757, test_loss: 1.3188, test_f1: 0.2281
 epoch: 2, train_loss: 1.2642, test_loss: 1.3101, test_f1: 0.2281
 epoch: 3, train_loss: 1.2491, test_loss: 1.3019, test_f1: 0.2281
 epoch: 4, train_loss: 1.2418, test_loss: 1.2908, test_f1: 0.2281
 epoch: 5, train_loss: 1.2297, test_loss: 1.2818, test_f1: 0.2285
 epoch: 6, train_loss: 1.2183, test_loss: 1.2778, test_f1: 0.2285
 epoch: 7, train_loss: 1.2137, test_loss: 1.2716, test_f1: 0.2289
 epoch: 8, train_loss: 1.2040, test_loss: 1.2666, test_f1: 0.2285
 epoch: 9, train_loss: 1.2017, test_loss: 1.2624, test_f1: 0.2285
 epoch: 10, train_loss: 1.1894, test_loss: 1.2600, test_f1: 0.2285
 epoch: 11, train_loss: 1.1835, test_loss: 1.2534, test_f1: 0.2428
 epoch: 12, train_loss: 1.1735, test_loss: 1.2477, test_f1: 0.3551
 epoch: 13, train_loss: 1.1625, test_loss: 1.2465, test_f1: 0.3671
 epoch: 14, train_loss: 1.1550, test_loss: 1.2428, test_f1: 0.3896
 epoch: 15, train_loss: 1.1465, test_loss: 1.2321, test_f1: 0.4104
 epoch: 16, train_loss: 1.1392, test_loss: 1.2315, test_f1: 0.4145
 epoch: 17, train_loss: 1.1391, test_loss: 1.2302, test_f1: 0.4137
 epoch: 18, train_loss: 1.1199, test_loss: 1.2282, test_f1: 0.4201
 epoch: 19, train_loss: 1.1145, test_loss: 1.2222, test_f1: 0.4330
 epoch: 20, train_loss: 1.1139, test_loss: 1.2276, test_f1: 0.4302
 epoch: 21, train_loss: 1.1125, test_loss: 1.2327, test_f1: 0.4071
 epoch: 22, train_loss: 1.0985, test_loss: 1.2256, test_f1: 0.4174
 epoch: 23, train_loss: 1.0847, test_loss: 1.2125, test_f1: 0.3934
 epoch: 24, train_loss: 1.0881, test_loss: 1.1887, test_f1: 0.4147
 epoch: 25, train_loss: 1.0835, test_loss: 1.1919, test_f1: 0.4221
 epoch: 26, train_loss: 1.0739, test_loss: 1.2017, test_f1: 0.4535
 epoch: 27, train_loss: 1.0744, test_loss: 1.2174, test_f1: 0.4189
 epoch: 28, train_loss: 1.0584, test_loss: 1.2252, test_f1: 0.4181
 epoch: 29, train_loss: 1.0584, test_loss: 1.1964, test_f1: 0.4347
 epoch: 30, train_loss: 1.0610, test_loss: 1.1982, test_f1: 0.4455
 epoch: 31, train_loss: 1.0438, test_loss: 1.2224, test_f1: 0.4381
 epoch: 32, train_loss: 1.0536, test_loss: 1.2032, test_f1: 0.4519
 epoch: 33, train_loss: 1.0400, test_loss: 1.2118, test_f1: 0.4559
 epoch: 34, train_loss: 1.0417, test_loss: 1.2171, test_f1: 0.4220
 epoch: 35, train_loss: 1.0430, test_loss: 1.2007, test_f1: 0.4277
 epoch: 36, train_loss: 1.0477, test_loss: 1.2123, test_f1: 0.4336
 epoch: 37, train_loss: 1.0360, test_loss: 1.2339, test_f1: 0.4150
 epoch: 38, train_loss: 1.0266, test_loss: 1.2451, test_f1: 0.3996
 epoch: 39, train_loss: 1.0273, test_loss: 1.2373, test_f1: 0.4340
 epoch: 40, train_loss: 1.0201, test_loss: 1.2149, test_f1: 0.4392
 epoch: 41, train_loss: 1.0207, test_loss: 1.2231, test_f1: 0.4230
 epoch: 42, train_loss: 1.0046, test_loss: 1.2419, test_f1: 0.4339
 epoch: 43, train_loss: 1.0014, test_loss: 1.2567, test_f1: 0.4425
 epoch: 44, train_loss: 1.0143, test_loss: 1.2565, test_f1: 0.4475
 epoch: 45, train_loss: 0.9976, test_loss: 1.2718, test_f1: 0.4299
 epoch: 46, train_loss: 0.9954, test_loss: 1.2724, test_f1: 0.4195
 epoch: 47, train_loss: 0.9830, test_loss: 1.2811, test_f1: 0.4224
 epoch: 48, train_loss: 1.0045, test_loss: 1.2950, test_f1: 0.4296
 epoch: 49, train_loss: 0.9925, test_loss: 1.3038, test_f1: 0.4458
 epoch: 50, train_loss: 0.9912, test_loss: 1.3096, test_f1: 0.4359
 epoch: 51, train_loss: 0.9714, test_loss: 1.3198, test_f1: 0.4410
 epoch: 52, train_loss: 0.9844, test_loss: 1.3191, test_f1: 0.4384
 epoch: 53, train_loss: 0.9841, test_loss: 1.3222, test_f1: 0.4435
 epoch: 54, train_loss: 0.9884, test_loss: 1.3153, test_f1: 0.4468
 epoch: 55, train_loss: 0.9851, test_loss: 1.3127, test_f1: 0.4394
 epoch: 56, train_loss: 0.9785, test_loss: 1.3240, test_f1: 0.4301
 epoch: 57, train_loss: 0.9760, test_loss: 1.3410, test_f1: 0.4201
 epoch: 58, train_loss: 0.9731, test_loss: 1.3396, test_f1: 0.4070
 epoch: 59, train_loss: 0.9759, test_loss: 1.3283, test_f1: 0.4249
 epoch: 60, train_loss: 0.9682, test_loss: 1.3277, test_f1: 0.4323
 epoch: 61, train_loss: 0.9668, test_loss: 1.3339, test_f1: 0.4374
 epoch: 62, train_loss: 0.9686, test_loss: 1.3408, test_f1: 0.4323
 epoch: 63, train_loss: 0.9615, test_loss: 1.3494, test_f1: 0.4349
 epoch: 64, train_loss: 0.9601, test_loss: 1.3520, test_f1: 0.4445
 epoch: 65, train_loss: 0.9540, test_loss: 1.3522, test_f1: 0.4540
 epoch: 66, train_loss: 0.9576, test_loss: 1.3566, test_f1: 0.4589
 epoch: 67, train_loss: 0.9543, test_loss: 1.3647, test_f1: 0.4177
 epoch: 68, train_loss: 0.9560, test_loss: 1.3614, test_f1: 0.4222
 epoch: 69, train_loss: 0.9662, test_loss: 1.3434, test_f1: 0.4393
 epoch: 70, train_loss: 0.9646, test_loss: 1.3515, test_f1: 0.4444
 epoch: 71, train_loss: 0.9585, test_loss: 1.3545, test_f1: 0.4446
 epoch: 72, train_loss: 0.9584, test_loss: 1.3572, test_f1: 0.4323
 epoch: 73, train_loss: 0.9530, test_loss: 1.3851, test_f1: 0.4298
 epoch: 74, train_loss: 0.9580, test_loss: 1.3900, test_f1: 0.4250
 epoch: 75, train_loss: 0.9569, test_loss: 1.3793, test_f1: 0.4251
 epoch: 76, train_loss: 0.9488, test_loss: 1.3666, test_f1: 0.4344
 epoch: 77, train_loss: 0.9372, test_loss: 1.3774, test_f1: 0.4368
 epoch: 78, train_loss: 0.9540, test_loss: 1.3797, test_f1: 0.4302
 epoch: 79, train_loss: 0.9485, test_loss: 1.3870, test_f1: 0.4353
 epoch: 80, train_loss: 0.9490, test_loss: 1.3900, test_f1: 0.4275
 epoch: 81, train_loss: 0.9342, test_loss: 1.3975, test_f1: 0.4280
 epoch: 82, train_loss: 0.9375, test_loss: 1.3978, test_f1: 0.4282
 epoch: 83, train_loss: 0.9534, test_loss: 1.4042, test_f1: 0.4304
 epoch: 84, train_loss: 0.9540, test_loss: 1.4096, test_f1: 0.4061
 epoch: 85, train_loss: 0.9510, test_loss: 1.4097, test_f1: 0.4120
 epoch: 86, train_loss: 0.9409, test_loss: 1.4046, test_f1: 0.4224
 epoch: 87, train_loss: 0.9384, test_loss: 1.4056, test_f1: 0.4441
 epoch: 88, train_loss: 0.9502, test_loss: 1.4025, test_f1: 0.4437
 epoch: 89, train_loss: 0.9385, test_loss: 1.4147, test_f1: 0.4514
 epoch: 90, train_loss: 0.9321, test_loss: 1.4109, test_f1: 0.4411
 epoch: 91, train_loss: 0.9453, test_loss: 1.4142, test_f1: 0.4364
 epoch: 92, train_loss: 0.9323, test_loss: 1.4195, test_f1: 0.4231
 epoch: 93, train_loss: 0.9425, test_loss: 1.4090, test_f1: 0.4422
 epoch: 94, train_loss: 0.9396, test_loss: 1.4104, test_f1: 0.4301
 epoch: 95, train_loss: 0.9313, test_loss: 1.4146, test_f1: 0.4350
 epoch: 96, train_loss: 0.9193, test_loss: 1.4315, test_f1: 0.4353
 epoch: 97, train_loss: 0.9241, test_loss: 1.4404, test_f1: 0.4329
 epoch: 98, train_loss: 0.9357, test_loss: 1.4418, test_f1: 0.4375
 epoch: 99, train_loss: 0.9215, test_loss: 1.4281, test_f1: 0.4367
##################ITERATION #2 ****************************************
 epoch: 0, train_loss: 1.2848, test_loss: 1.3166, test_f1: 0.2285
 epoch: 1, train_loss: 1.2564, test_loss: 1.3082, test_f1: 0.2248
 epoch: 2, train_loss: 1.2413, test_loss: 1.2991, test_f1: 0.2601
 epoch: 3, train_loss: 1.2282, test_loss: 1.2864, test_f1: 0.2618
 epoch: 4, train_loss: 1.2240, test_loss: 1.2753, test_f1: 0.2701
 epoch: 5, train_loss: 1.2208, test_loss: 1.2652, test_f1: 0.3326
 epoch: 6, train_loss: 1.2062, test_loss: 1.2592, test_f1: 0.3535
 epoch: 7, train_loss: 1.1998, test_loss: 1.2585, test_f1: 0.3682
 epoch: 8, train_loss: 1.1908, test_loss: 1.2500, test_f1: 0.3735
 epoch: 9, train_loss: 1.1869, test_loss: 1.2422, test_f1: 0.3602
 epoch: 10, train_loss: 1.1799, test_loss: 1.2325, test_f1: 0.3863
 epoch: 11, train_loss: 1.1714, test_loss: 1.2212, test_f1: 0.4185
 epoch: 12, train_loss: 1.1608, test_loss: 1.2077, test_f1: 0.4335
 epoch: 13, train_loss: 1.1537, test_loss: 1.2145, test_f1: 0.4269
 epoch: 14, train_loss: 1.1488, test_loss: 1.2154, test_f1: 0.4247
 epoch: 15, train_loss: 1.1385, test_loss: 1.2077, test_f1: 0.4488
 epoch: 16, train_loss: 1.1422, test_loss: 1.2006, test_f1: 0.4564
 epoch: 17, train_loss: 1.1354, test_loss: 1.2101, test_f1: 0.4408
 epoch: 18, train_loss: 1.1313, test_loss: 1.2161, test_f1: 0.4464
 epoch: 19, train_loss: 1.1379, test_loss: 1.2144, test_f1: 0.4399
 epoch: 20, train_loss: 1.1249, test_loss: 1.2057, test_f1: 0.4536
 epoch: 21, train_loss: 1.1142, test_loss: 1.1942, test_f1: 0.4568
 epoch: 22, train_loss: 1.1214, test_loss: 1.1888, test_f1: 0.4600
 epoch: 23, train_loss: 1.1109, test_loss: 1.1931, test_f1: 0.4516
 epoch: 24, train_loss: 1.1178, test_loss: 1.1960, test_f1: 0.4500
 epoch: 25, train_loss: 1.0988, test_loss: 1.1959, test_f1: 0.4196
 epoch: 26, train_loss: 1.1047, test_loss: 1.1874, test_f1: 0.4137
 epoch: 27, train_loss: 1.1179, test_loss: 1.1699, test_f1: 0.4421
 epoch: 28, train_loss: 1.1033, test_loss: 1.1657, test_f1: 0.4475
 epoch: 29, train_loss: 1.0888, test_loss: 1.1762, test_f1: 0.4039
 epoch: 30, train_loss: 1.0984, test_loss: 1.1799, test_f1: 0.3779
 epoch: 31, train_loss: 1.0885, test_loss: 1.1868, test_f1: 0.3667
 epoch: 32, train_loss: 1.0858, test_loss: 1.1887, test_f1: 0.3738
 epoch: 33, train_loss: 1.0758, test_loss: 1.1875, test_f1: 0.4228
 epoch: 34, train_loss: 1.0726, test_loss: 1.1978, test_f1: 0.4532
 epoch: 35, train_loss: 1.0607, test_loss: 1.1970, test_f1: 0.4606
 epoch: 36, train_loss: 1.0658, test_loss: 1.1985, test_f1: 0.4621
 epoch: 37, train_loss: 1.0704, test_loss: 1.1899, test_f1: 0.4491
 epoch: 38, train_loss: 1.0671, test_loss: 1.1780, test_f1: 0.4696
 epoch: 39, train_loss: 1.0572, test_loss: 1.1869, test_f1: 0.4691
 epoch: 40, train_loss: 1.0619, test_loss: 1.2450, test_f1: 0.4141
 epoch: 41, train_loss: 1.0453, test_loss: 1.2689, test_f1: 0.3997
 epoch: 42, train_loss: 1.0431, test_loss: 1.3103, test_f1: 0.4298
 epoch: 43, train_loss: 1.0529, test_loss: 1.2534, test_f1: 0.4243
 epoch: 44, train_loss: 1.0508, test_loss: 1.1949, test_f1: 0.4195
 epoch: 45, train_loss: 1.0586, test_loss: 1.1946, test_f1: 0.3878
 epoch: 46, train_loss: 1.0540, test_loss: 1.2175, test_f1: 0.3646
 epoch: 47, train_loss: 1.0453, test_loss: 1.2106, test_f1: 0.3507
 epoch: 48, train_loss: 1.0468, test_loss: 1.2648, test_f1: 0.3734
 epoch: 49, train_loss: 1.0471, test_loss: 1.2787, test_f1: 0.4440
 epoch: 50, train_loss: 1.0406, test_loss: 1.2628, test_f1: 0.4228
 epoch: 51, train_loss: 1.0338, test_loss: 1.2286, test_f1: 0.4207
 epoch: 52, train_loss: 1.0358, test_loss: 1.2133, test_f1: 0.3784
 epoch: 53, train_loss: 1.0386, test_loss: 1.2120, test_f1: 0.3665
 epoch: 54, train_loss: 1.0376, test_loss: 1.2136, test_f1: 0.3744
 epoch: 55, train_loss: 1.0275, test_loss: 1.2243, test_f1: 0.3869
 epoch: 56, train_loss: 1.0342, test_loss: 1.2077, test_f1: 0.3876
 epoch: 57, train_loss: 1.0255, test_loss: 1.2058, test_f1: 0.3748
 epoch: 58, train_loss: 1.0222, test_loss: 1.2299, test_f1: 0.3817
 epoch: 59, train_loss: 1.0301, test_loss: 1.2485, test_f1: 0.3771
 epoch: 60, train_loss: 1.0186, test_loss: 1.2620, test_f1: 0.3970
 epoch: 61, train_loss: 1.0257, test_loss: 1.2757, test_f1: 0.3993
 epoch: 62, train_loss: 1.0263, test_loss: 1.2732, test_f1: 0.4173
 epoch: 63, train_loss: 1.0234, test_loss: 1.2878, test_f1: 0.4639
 epoch: 64, train_loss: 1.0315, test_loss: 1.2424, test_f1: 0.4689
 epoch: 65, train_loss: 1.0221, test_loss: 1.2542, test_f1: 0.4692
 epoch: 66, train_loss: 1.0321, test_loss: 1.2315, test_f1: 0.4135
 epoch: 67, train_loss: 1.0239, test_loss: 1.2860, test_f1: 0.4071
 epoch: 68, train_loss: 1.0189, test_loss: 1.2288, test_f1: 0.3994
 epoch: 69, train_loss: 1.0238, test_loss: 1.2418, test_f1: 0.3730
 epoch: 70, train_loss: 1.0176, test_loss: 1.2438, test_f1: 0.4164
 epoch: 71, train_loss: 1.0181, test_loss: 1.2287, test_f1: 0.4292
 epoch: 72, train_loss: 1.0156, test_loss: 1.2345, test_f1: 0.4295
 epoch: 73, train_loss: 1.0149, test_loss: 1.1988, test_f1: 0.4524
 epoch: 74, train_loss: 1.0203, test_loss: 1.1866, test_f1: 0.4483
 epoch: 75, train_loss: 1.0165, test_loss: 1.2319, test_f1: 0.4460
 epoch: 76, train_loss: 1.0197, test_loss: 1.2381, test_f1: 0.4388
 epoch: 77, train_loss: 1.0263, test_loss: 1.2317, test_f1: 0.4529
 epoch: 78, train_loss: 1.0176, test_loss: 1.2476, test_f1: 0.4311
 epoch: 79, train_loss: 1.0196, test_loss: 1.2768, test_f1: 0.4533
 epoch: 80, train_loss: 1.0015, test_loss: 1.2613, test_f1: 0.4380
 epoch: 81, train_loss: 1.0151, test_loss: 1.2998, test_f1: 0.4166
 epoch: 82, train_loss: 1.0112, test_loss: 1.2813, test_f1: 0.4560
 epoch: 83, train_loss: 1.0090, test_loss: 1.2456, test_f1: 0.4503
 epoch: 84, train_loss: 1.0064, test_loss: 1.2655, test_f1: 0.4185
 epoch: 85, train_loss: 1.0164, test_loss: 1.2531, test_f1: 0.4201
 epoch: 86, train_loss: 1.0018, test_loss: 1.2558, test_f1: 0.4223
 epoch: 87, train_loss: 1.0140, test_loss: 1.2458, test_f1: 0.4060
 epoch: 88, train_loss: 1.0270, test_loss: 1.2899, test_f1: 0.4208
 epoch: 89, train_loss: 1.0124, test_loss: 1.2998, test_f1: 0.3929
 epoch: 90, train_loss: 0.9979, test_loss: 1.3252, test_f1: 0.4014
 epoch: 91, train_loss: 1.0101, test_loss: 1.3654, test_f1: 0.3941
 epoch: 92, train_loss: 1.0020, test_loss: 1.3436, test_f1: 0.4135
 epoch: 93, train_loss: 1.0154, test_loss: 1.3229, test_f1: 0.4018
 epoch: 94, train_loss: 1.0040, test_loss: 1.3416, test_f1: 0.3964
 epoch: 95, train_loss: 1.0109, test_loss: 1.4080, test_f1: 0.4008
 epoch: 96, train_loss: 1.0077, test_loss: 1.3395, test_f1: 0.4073
 epoch: 97, train_loss: 1.0072, test_loss: 1.4978, test_f1: 0.4082
 epoch: 98, train_loss: 1.0008, test_loss: 1.6467, test_f1: 0.4243
 epoch: 99, train_loss: 1.0128, test_loss: 1.5798, test_f1: 0.4384
##################ITERATION #3 ****************************************
 epoch: 0, train_loss: 1.2655, test_loss: 1.3350, test_f1: 0.2281
 epoch: 1, train_loss: 1.2225, test_loss: 1.3254, test_f1: 0.2281
 epoch: 2, train_loss: 1.1966, test_loss: 1.3071, test_f1: 0.2281
 epoch: 3, train_loss: 1.1997, test_loss: 1.2882, test_f1: 0.2281
 epoch: 4, train_loss: 1.1795, test_loss: 1.2683, test_f1: 0.2281
 epoch: 5, train_loss: 1.1708, test_loss: 1.2519, test_f1: 0.2650
 epoch: 6, train_loss: 1.1666, test_loss: 1.2298, test_f1: 0.3143
 epoch: 7, train_loss: 1.1552, test_loss: 1.2198, test_f1: 0.4289
 epoch: 8, train_loss: 1.1395, test_loss: 1.2133, test_f1: 0.4478
 epoch: 9, train_loss: 1.1460, test_loss: 1.2083, test_f1: 0.4283
 epoch: 10, train_loss: 1.1450, test_loss: 1.1983, test_f1: 0.4340
 epoch: 11, train_loss: 1.1219, test_loss: 1.2005, test_f1: 0.4355
 epoch: 12, train_loss: 1.1258, test_loss: 1.1939, test_f1: 0.4273
 epoch: 13, train_loss: 1.1214, test_loss: 1.1823, test_f1: 0.4200
 epoch: 14, train_loss: 1.1049, test_loss: 1.1789, test_f1: 0.4203
 epoch: 15, train_loss: 1.1136, test_loss: 1.1698, test_f1: 0.4298
 epoch: 16, train_loss: 1.1090, test_loss: 1.1629, test_f1: 0.4383
 epoch: 17, train_loss: 1.1020, test_loss: 1.1667, test_f1: 0.4413
 epoch: 18, train_loss: 1.0999, test_loss: 1.1626, test_f1: 0.4411
 epoch: 19, train_loss: 1.0957, test_loss: 1.1541, test_f1: 0.4305
 epoch: 20, train_loss: 1.0925, test_loss: 1.1439, test_f1: 0.4613
 epoch: 21, train_loss: 1.0936, test_loss: 1.1443, test_f1: 0.4677
 epoch: 22, train_loss: 1.0881, test_loss: 1.1477, test_f1: 0.4628
 epoch: 23, train_loss: 1.0769, test_loss: 1.1505, test_f1: 0.4684
 epoch: 24, train_loss: 1.0779, test_loss: 1.1462, test_f1: 0.4762
 epoch: 25, train_loss: 1.0643, test_loss: 1.1452, test_f1: 0.4562
 epoch: 26, train_loss: 1.0652, test_loss: 1.1479, test_f1: 0.4529
 epoch: 27, train_loss: 1.0555, test_loss: 1.1373, test_f1: 0.4874
 epoch: 28, train_loss: 1.0549, test_loss: 1.1354, test_f1: 0.4835
 epoch: 29, train_loss: 1.0503, test_loss: 1.1360, test_f1: 0.4523
 epoch: 30, train_loss: 1.0380, test_loss: 1.1427, test_f1: 0.4435
 epoch: 31, train_loss: 1.0557, test_loss: 1.1429, test_f1: 0.4435
 epoch: 32, train_loss: 1.0402, test_loss: 1.1411, test_f1: 0.4560
 epoch: 33, train_loss: 1.0366, test_loss: 1.1386, test_f1: 0.4741
 epoch: 34, train_loss: 1.0422, test_loss: 1.1349, test_f1: 0.4794
 epoch: 35, train_loss: 1.0487, test_loss: 1.1428, test_f1: 0.4744
 epoch: 36, train_loss: 1.0420, test_loss: 1.1470, test_f1: 0.4667
 epoch: 37, train_loss: 1.0315, test_loss: 1.1476, test_f1: 0.4964
 epoch: 38, train_loss: 1.0442, test_loss: 1.1363, test_f1: 0.4979
 epoch: 39, train_loss: 1.0244, test_loss: 1.1424, test_f1: 0.4666
 epoch: 40, train_loss: 1.0152, test_loss: 1.1383, test_f1: 0.4852
 epoch: 41, train_loss: 1.0235, test_loss: 1.1406, test_f1: 0.4854
 epoch: 42, train_loss: 1.0181, test_loss: 1.1479, test_f1: 0.4781
 epoch: 43, train_loss: 1.0199, test_loss: 1.1472, test_f1: 0.4804
 epoch: 44, train_loss: 1.0173, test_loss: 1.1453, test_f1: 0.4838
 epoch: 45, train_loss: 1.0117, test_loss: 1.1402, test_f1: 0.4945
 epoch: 46, train_loss: 1.0126, test_loss: 1.1371, test_f1: 0.4839
 epoch: 47, train_loss: 0.9963, test_loss: 1.1372, test_f1: 0.4804
 epoch: 48, train_loss: 1.0022, test_loss: 1.1330, test_f1: 0.4698
 epoch: 49, train_loss: 1.0051, test_loss: 1.1305, test_f1: 0.4921
 epoch: 50, train_loss: 0.9918, test_loss: 1.1310, test_f1: 0.4821
 epoch: 51, train_loss: 0.9949, test_loss: 1.1336, test_f1: 0.4794
 epoch: 52, train_loss: 0.9756, test_loss: 1.1379, test_f1: 0.4923
 epoch: 53, train_loss: 0.9859, test_loss: 1.1318, test_f1: 0.4854
 epoch: 54, train_loss: 0.9927, test_loss: 1.1353, test_f1: 0.4891
 epoch: 55, train_loss: 0.9717, test_loss: 1.1394, test_f1: 0.4861
 epoch: 56, train_loss: 0.9984, test_loss: 1.1392, test_f1: 0.4889
 epoch: 57, train_loss: 0.9810, test_loss: 1.1451, test_f1: 0.4843
 epoch: 58, train_loss: 0.9819, test_loss: 1.1489, test_f1: 0.4871
 epoch: 59, train_loss: 0.9667, test_loss: 1.1438, test_f1: 0.5017
 epoch: 60, train_loss: 0.9840, test_loss: 1.1529, test_f1: 0.4863
 epoch: 61, train_loss: 0.9838, test_loss: 1.1596, test_f1: 0.4861
 epoch: 62, train_loss: 0.9757, test_loss: 1.1646, test_f1: 0.4860
 epoch: 63, train_loss: 0.9790, test_loss: 1.1541, test_f1: 0.4886
 epoch: 64, train_loss: 0.9722, test_loss: 1.1475, test_f1: 0.4837
 epoch: 65, train_loss: 0.9706, test_loss: 1.1509, test_f1: 0.4884
 epoch: 66, train_loss: 0.9753, test_loss: 1.1493, test_f1: 0.4758
 epoch: 67, train_loss: 0.9710, test_loss: 1.1481, test_f1: 0.4860
 epoch: 68, train_loss: 0.9741, test_loss: 1.1526, test_f1: 0.4811
 epoch: 69, train_loss: 0.9718, test_loss: 1.1584, test_f1: 0.4885
 epoch: 70, train_loss: 0.9634, test_loss: 1.1658, test_f1: 0.4909
 epoch: 71, train_loss: 0.9772, test_loss: 1.1659, test_f1: 0.4805
 epoch: 72, train_loss: 0.9739, test_loss: 1.1661, test_f1: 0.4756
 epoch: 73, train_loss: 0.9628, test_loss: 1.1764, test_f1: 0.4735
 epoch: 74, train_loss: 0.9680, test_loss: 1.1786, test_f1: 0.4786
 epoch: 75, train_loss: 0.9615, test_loss: 1.1766, test_f1: 0.4831
 epoch: 76, train_loss: 0.9566, test_loss: 1.1760, test_f1: 0.4807
 epoch: 77, train_loss: 0.9654, test_loss: 1.1704, test_f1: 0.4782
 epoch: 78, train_loss: 0.9595, test_loss: 1.1644, test_f1: 0.4654
 epoch: 79, train_loss: 0.9459, test_loss: 1.1635, test_f1: 0.4735
 epoch: 80, train_loss: 0.9538, test_loss: 1.1714, test_f1: 0.4809
 epoch: 81, train_loss: 0.9480, test_loss: 1.1782, test_f1: 0.4736
 epoch: 82, train_loss: 0.9532, test_loss: 1.1847, test_f1: 0.4908
 epoch: 83, train_loss: 0.9573, test_loss: 1.1840, test_f1: 0.4937
 epoch: 84, train_loss: 0.9565, test_loss: 1.1792, test_f1: 0.4861
 epoch: 85, train_loss: 0.9478, test_loss: 1.1742, test_f1: 0.4783
 epoch: 86, train_loss: 0.9428, test_loss: 1.1626, test_f1: 0.4787
 epoch: 87, train_loss: 0.9543, test_loss: 1.1852, test_f1: 0.4731
 epoch: 88, train_loss: 0.9562, test_loss: 1.2018, test_f1: 0.4757
 epoch: 89, train_loss: 0.9447, test_loss: 1.1841, test_f1: 0.4736
 epoch: 90, train_loss: 0.9468, test_loss: 1.1764, test_f1: 0.4841
 epoch: 91, train_loss: 0.9354, test_loss: 1.1837, test_f1: 0.4843
 epoch: 92, train_loss: 0.9439, test_loss: 1.1785, test_f1: 0.4834
 epoch: 93, train_loss: 0.9396, test_loss: 1.1699, test_f1: 0.4961
 epoch: 94, train_loss: 0.9404, test_loss: 1.1852, test_f1: 0.4937
 epoch: 95, train_loss: 0.9339, test_loss: 1.1988, test_f1: 0.4942
 epoch: 96, train_loss: 0.9390, test_loss: 1.2046, test_f1: 0.4784
 epoch: 97, train_loss: 0.9558, test_loss: 1.2011, test_f1: 0.4680
 epoch: 98, train_loss: 0.9326, test_loss: 1.1948, test_f1: 0.4782
 epoch: 99, train_loss: 0.9353, test_loss: 1.1942, test_f1: 0.4759
##################ITERATION #4 ****************************************
 epoch: 0, train_loss: 1.3484, test_loss: 1.3347, test_f1: 0.2281
 epoch: 1, train_loss: 1.2803, test_loss: 1.3266, test_f1: 0.2281
 epoch: 2, train_loss: 1.2559, test_loss: 1.3143, test_f1: 0.2587
 epoch: 3, train_loss: 1.2498, test_loss: 1.3027, test_f1: 0.2587
 epoch: 4, train_loss: 1.2381, test_loss: 1.2928, test_f1: 0.2624
 epoch: 5, train_loss: 1.2327, test_loss: 1.2765, test_f1: 0.2816
 epoch: 6, train_loss: 1.2148, test_loss: 1.2701, test_f1: 0.2924
 epoch: 7, train_loss: 1.1979, test_loss: 1.2607, test_f1: 0.2991
 epoch: 8, train_loss: 1.2092, test_loss: 1.2562, test_f1: 0.3182
 epoch: 9, train_loss: 1.1977, test_loss: 1.2577, test_f1: 0.3119
 epoch: 10, train_loss: 1.1812, test_loss: 1.2573, test_f1: 0.3240
 epoch: 11, train_loss: 1.1849, test_loss: 1.2598, test_f1: 0.3540
 epoch: 12, train_loss: 1.1748, test_loss: 1.2586, test_f1: 0.3711
 epoch: 13, train_loss: 1.1656, test_loss: 1.2616, test_f1: 0.3677
 epoch: 14, train_loss: 1.1620, test_loss: 1.2588, test_f1: 0.3716
 epoch: 15, train_loss: 1.1624, test_loss: 1.2523, test_f1: 0.3821
 epoch: 16, train_loss: 1.1468, test_loss: 1.2425, test_f1: 0.3829
 epoch: 17, train_loss: 1.1428, test_loss: 1.2408, test_f1: 0.3859
 epoch: 18, train_loss: 1.1463, test_loss: 1.2447, test_f1: 0.3786
 epoch: 19, train_loss: 1.1369, test_loss: 1.2456, test_f1: 0.3711
 epoch: 20, train_loss: 1.1311, test_loss: 1.2512, test_f1: 0.3759
 epoch: 21, train_loss: 1.1231, test_loss: 1.2342, test_f1: 0.3829
 epoch: 22, train_loss: 1.1281, test_loss: 1.2297, test_f1: 0.3843
 epoch: 23, train_loss: 1.1063, test_loss: 1.2171, test_f1: 0.4112
 epoch: 24, train_loss: 1.0999, test_loss: 1.2000, test_f1: 0.4441
 epoch: 25, train_loss: 1.1023, test_loss: 1.1973, test_f1: 0.4391
 epoch: 26, train_loss: 1.1038, test_loss: 1.2003, test_f1: 0.4366
 epoch: 27, train_loss: 1.1081, test_loss: 1.2118, test_f1: 0.4347
 epoch: 28, train_loss: 1.1064, test_loss: 1.2263, test_f1: 0.3952
 epoch: 29, train_loss: 1.0933, test_loss: 1.2439, test_f1: 0.3903
 epoch: 30, train_loss: 1.0909, test_loss: 1.2397, test_f1: 0.3813
 epoch: 31, train_loss: 1.0896, test_loss: 1.2187, test_f1: 0.3605
 epoch: 32, train_loss: 1.0778, test_loss: 1.2062, test_f1: 0.3699
 epoch: 33, train_loss: 1.0712, test_loss: 1.2067, test_f1: 0.3705
 epoch: 34, train_loss: 1.0759, test_loss: 1.1944, test_f1: 0.3728
 epoch: 35, train_loss: 1.0705, test_loss: 1.1959, test_f1: 0.3856
 epoch: 36, train_loss: 1.0583, test_loss: 1.2101, test_f1: 0.3771
 epoch: 37, train_loss: 1.0633, test_loss: 1.2033, test_f1: 0.3770
 epoch: 38, train_loss: 1.0634, test_loss: 1.1979, test_f1: 0.4134
 epoch: 39, train_loss: 1.0567, test_loss: 1.1994, test_f1: 0.4092
 epoch: 40, train_loss: 1.0541, test_loss: 1.1982, test_f1: 0.3985
 epoch: 41, train_loss: 1.0461, test_loss: 1.2061, test_f1: 0.3823
 epoch: 42, train_loss: 1.0509, test_loss: 1.2151, test_f1: 0.3907
 epoch: 43, train_loss: 1.0397, test_loss: 1.2245, test_f1: 0.3894
 epoch: 44, train_loss: 1.0411, test_loss: 1.2229, test_f1: 0.3953
 epoch: 45, train_loss: 1.0405, test_loss: 1.2103, test_f1: 0.4089
 epoch: 46, train_loss: 1.0264, test_loss: 1.2096, test_f1: 0.4154
 epoch: 47, train_loss: 1.0340, test_loss: 1.2186, test_f1: 0.4052
 epoch: 48, train_loss: 1.0217, test_loss: 1.2280, test_f1: 0.3911
 epoch: 49, train_loss: 1.0292, test_loss: 1.2291, test_f1: 0.4136
 epoch: 50, train_loss: 1.0196, test_loss: 1.2274, test_f1: 0.4415
 epoch: 51, train_loss: 1.0115, test_loss: 1.2207, test_f1: 0.4321
 epoch: 52, train_loss: 1.0169, test_loss: 1.2241, test_f1: 0.4489
 epoch: 53, train_loss: 1.0068, test_loss: 1.2232, test_f1: 0.4367
 epoch: 54, train_loss: 1.0179, test_loss: 1.2275, test_f1: 0.4277
 epoch: 55, train_loss: 1.0160, test_loss: 1.2315, test_f1: 0.4260
 epoch: 56, train_loss: 0.9985, test_loss: 1.2347, test_f1: 0.4376
 epoch: 57, train_loss: 1.0191, test_loss: 1.2358, test_f1: 0.4418
 epoch: 58, train_loss: 1.0131, test_loss: 1.2344, test_f1: 0.4410
 epoch: 59, train_loss: 1.0033, test_loss: 1.2323, test_f1: 0.4310
 epoch: 60, train_loss: 1.0104, test_loss: 1.2384, test_f1: 0.4430
 epoch: 61, train_loss: 1.0024, test_loss: 1.2464, test_f1: 0.4442
 epoch: 62, train_loss: 1.0146, test_loss: 1.2492, test_f1: 0.4521
 epoch: 63, train_loss: 1.0067, test_loss: 1.2319, test_f1: 0.4517
 epoch: 64, train_loss: 1.0012, test_loss: 1.2331, test_f1: 0.4407
 epoch: 65, train_loss: 0.9931, test_loss: 1.2583, test_f1: 0.4476
 epoch: 66, train_loss: 1.0034, test_loss: 1.2687, test_f1: 0.4449
 epoch: 67, train_loss: 1.0000, test_loss: 1.2540, test_f1: 0.4508
 epoch: 68, train_loss: 1.0068, test_loss: 1.2527, test_f1: 0.4505
 epoch: 69, train_loss: 0.9973, test_loss: 1.2656, test_f1: 0.4445
 epoch: 70, train_loss: 0.9892, test_loss: 1.2692, test_f1: 0.4500
 epoch: 71, train_loss: 0.9913, test_loss: 1.2634, test_f1: 0.4575
 epoch: 72, train_loss: 0.9768, test_loss: 1.2608, test_f1: 0.4536
 epoch: 73, train_loss: 0.9922, test_loss: 1.2560, test_f1: 0.4503
 epoch: 74, train_loss: 0.9821, test_loss: 1.2587, test_f1: 0.4527
 epoch: 75, train_loss: 0.9844, test_loss: 1.2628, test_f1: 0.4544
 epoch: 76, train_loss: 0.9966, test_loss: 1.2852, test_f1: 0.4639
 epoch: 77, train_loss: 0.9817, test_loss: 1.2973, test_f1: 0.4586
 epoch: 78, train_loss: 0.9837, test_loss: 1.3025, test_f1: 0.4445
 epoch: 79, train_loss: 0.9855, test_loss: 1.2822, test_f1: 0.4351
 epoch: 80, train_loss: 0.9853, test_loss: 1.2748, test_f1: 0.4586
 epoch: 81, train_loss: 0.9784, test_loss: 1.2802, test_f1: 0.4621
 epoch: 82, train_loss: 0.9735, test_loss: 1.2860, test_f1: 0.4683
 epoch: 83, train_loss: 0.9711, test_loss: 1.2963, test_f1: 0.4434
 epoch: 84, train_loss: 0.9756, test_loss: 1.3075, test_f1: 0.4481
 epoch: 85, train_loss: 0.9780, test_loss: 1.3032, test_f1: 0.4663
 epoch: 86, train_loss: 0.9785, test_loss: 1.2912, test_f1: 0.4757
 epoch: 87, train_loss: 0.9708, test_loss: 1.2896, test_f1: 0.4549
 epoch: 88, train_loss: 0.9716, test_loss: 1.3149, test_f1: 0.4727
 epoch: 89, train_loss: 0.9851, test_loss: 1.3357, test_f1: 0.4445
 epoch: 90, train_loss: 0.9774, test_loss: 1.3396, test_f1: 0.4567
 epoch: 91, train_loss: 0.9770, test_loss: 1.3290, test_f1: 0.4611
 epoch: 92, train_loss: 0.9623, test_loss: 1.3351, test_f1: 0.4676
 epoch: 93, train_loss: 0.9773, test_loss: 1.3562, test_f1: 0.4624
 epoch: 94, train_loss: 0.9537, test_loss: 1.3626, test_f1: 0.4578
 epoch: 95, train_loss: 0.9620, test_loss: 1.3695, test_f1: 0.4601
 epoch: 96, train_loss: 0.9641, test_loss: 1.3699, test_f1: 0.4588
 epoch: 97, train_loss: 0.9571, test_loss: 1.3810, test_f1: 0.4560
 epoch: 98, train_loss: 0.9565, test_loss: 1.4073, test_f1: 0.4408
 epoch: 99, train_loss: 0.9587, test_loss: 1.3974, test_f1: 0.4542
##################ITERATION #5 ****************************************
 epoch: 0, train_loss: 1.3496, test_loss: 1.3055, test_f1: 0.2281
 epoch: 1, train_loss: 1.2637, test_loss: 1.3008, test_f1: 0.2281
 epoch: 2, train_loss: 1.2484, test_loss: 1.2958, test_f1: 0.2281
 epoch: 3, train_loss: 1.2280, test_loss: 1.2896, test_f1: 0.2281
 epoch: 4, train_loss: 1.2227, test_loss: 1.2745, test_f1: 0.2281
 epoch: 5, train_loss: 1.2160, test_loss: 1.2575, test_f1: 0.2281
 epoch: 6, train_loss: 1.1977, test_loss: 1.2455, test_f1: 0.2393
 epoch: 7, train_loss: 1.1980, test_loss: 1.2360, test_f1: 0.2445
 epoch: 8, train_loss: 1.1889, test_loss: 1.2254, test_f1: 0.2594
 epoch: 9, train_loss: 1.1811, test_loss: 1.2155, test_f1: 0.2774
 epoch: 10, train_loss: 1.1704, test_loss: 1.2118, test_f1: 0.3320
 epoch: 11, train_loss: 1.1724, test_loss: 1.2099, test_f1: 0.3945
 epoch: 12, train_loss: 1.1517, test_loss: 1.2101, test_f1: 0.4078
 epoch: 13, train_loss: 1.1530, test_loss: 1.2203, test_f1: 0.4154
 epoch: 14, train_loss: 1.1476, test_loss: 1.2216, test_f1: 0.4254
 epoch: 15, train_loss: 1.1378, test_loss: 1.2145, test_f1: 0.4197
 epoch: 16, train_loss: 1.1357, test_loss: 1.2075, test_f1: 0.4276
 epoch: 17, train_loss: 1.1383, test_loss: 1.2037, test_f1: 0.4284
 epoch: 18, train_loss: 1.1311, test_loss: 1.1991, test_f1: 0.4326
 epoch: 19, train_loss: 1.1247, test_loss: 1.1946, test_f1: 0.4289
 epoch: 20, train_loss: 1.1166, test_loss: 1.1913, test_f1: 0.4292
 epoch: 21, train_loss: 1.1162, test_loss: 1.1861, test_f1: 0.4320
 epoch: 22, train_loss: 1.0935, test_loss: 1.1821, test_f1: 0.4316
 epoch: 23, train_loss: 1.0977, test_loss: 1.1844, test_f1: 0.4334
 epoch: 24, train_loss: 1.0847, test_loss: 1.1836, test_f1: 0.4373
 epoch: 25, train_loss: 1.0742, test_loss: 1.1753, test_f1: 0.4552
 epoch: 26, train_loss: 1.0784, test_loss: 1.1825, test_f1: 0.4334
 epoch: 27, train_loss: 1.0827, test_loss: 1.1787, test_f1: 0.4282
 epoch: 28, train_loss: 1.0667, test_loss: 1.1751, test_f1: 0.4245
 epoch: 29, train_loss: 1.0652, test_loss: 1.1704, test_f1: 0.4125
 epoch: 30, train_loss: 1.0654, test_loss: 1.1665, test_f1: 0.4188
 epoch: 31, train_loss: 1.0515, test_loss: 1.1674, test_f1: 0.3866
 epoch: 32, train_loss: 1.0500, test_loss: 1.1580, test_f1: 0.4141
 epoch: 33, train_loss: 1.0380, test_loss: 1.1622, test_f1: 0.4215
 epoch: 34, train_loss: 1.0377, test_loss: 1.1602, test_f1: 0.4098
 epoch: 35, train_loss: 1.0329, test_loss: 1.1522, test_f1: 0.4462
 epoch: 36, train_loss: 1.0303, test_loss: 1.1618, test_f1: 0.4536
 epoch: 37, train_loss: 1.0306, test_loss: 1.1650, test_f1: 0.4702
 epoch: 38, train_loss: 1.0273, test_loss: 1.1622, test_f1: 0.4699
 epoch: 39, train_loss: 1.0182, test_loss: 1.1629, test_f1: 0.4671
 epoch: 40, train_loss: 1.0089, test_loss: 1.1653, test_f1: 0.4255
 epoch: 41, train_loss: 1.0213, test_loss: 1.1684, test_f1: 0.4224
 epoch: 42, train_loss: 1.0060, test_loss: 1.1636, test_f1: 0.4394
 epoch: 43, train_loss: 1.0019, test_loss: 1.1455, test_f1: 0.4438
 epoch: 44, train_loss: 1.0132, test_loss: 1.1507, test_f1: 0.4565
 epoch: 45, train_loss: 1.0001, test_loss: 1.1596, test_f1: 0.4484
 epoch: 46, train_loss: 0.9956, test_loss: 1.1637, test_f1: 0.4305
 epoch: 47, train_loss: 0.9963, test_loss: 1.1773, test_f1: 0.4439
 epoch: 48, train_loss: 0.9853, test_loss: 1.2079, test_f1: 0.4410
 epoch: 49, train_loss: 0.9857, test_loss: 1.1755, test_f1: 0.4425
 epoch: 50, train_loss: 0.9902, test_loss: 1.1755, test_f1: 0.4571
 epoch: 51, train_loss: 0.9752, test_loss: 1.1765, test_f1: 0.4568
 epoch: 52, train_loss: 0.9857, test_loss: 1.1693, test_f1: 0.4502
 epoch: 53, train_loss: 0.9775, test_loss: 1.1597, test_f1: 0.4606
 epoch: 54, train_loss: 0.9806, test_loss: 1.1549, test_f1: 0.4702
 epoch: 55, train_loss: 0.9591, test_loss: 1.1570, test_f1: 0.4557
 epoch: 56, train_loss: 0.9772, test_loss: 1.1622, test_f1: 0.4652
 epoch: 57, train_loss: 0.9668, test_loss: 1.1571, test_f1: 0.4783
 epoch: 58, train_loss: 0.9765, test_loss: 1.1530, test_f1: 0.4590
 epoch: 59, train_loss: 0.9692, test_loss: 1.1673, test_f1: 0.4711
 epoch: 60, train_loss: 0.9482, test_loss: 1.1764, test_f1: 0.4852
 epoch: 61, train_loss: 0.9562, test_loss: 1.1839, test_f1: 0.4763
 epoch: 62, train_loss: 0.9590, test_loss: 1.1760, test_f1: 0.4667
 epoch: 63, train_loss: 0.9628, test_loss: 1.1683, test_f1: 0.4868
 epoch: 64, train_loss: 0.9502, test_loss: 1.1711, test_f1: 0.4906
 epoch: 65, train_loss: 0.9555, test_loss: 1.1707, test_f1: 0.4751
 epoch: 66, train_loss: 0.9573, test_loss: 1.1700, test_f1: 0.4749
 epoch: 67, train_loss: 0.9558, test_loss: 1.1718, test_f1: 0.4752
 epoch: 68, train_loss: 0.9548, test_loss: 1.1704, test_f1: 0.4704
 epoch: 69, train_loss: 0.9464, test_loss: 1.1728, test_f1: 0.4701
 epoch: 70, train_loss: 0.9516, test_loss: 1.1770, test_f1: 0.4679
 epoch: 71, train_loss: 0.9382, test_loss: 1.1748, test_f1: 0.4811
 epoch: 72, train_loss: 0.9515, test_loss: 1.1889, test_f1: 0.4826
 epoch: 73, train_loss: 0.9299, test_loss: 1.1836, test_f1: 0.4858
 epoch: 74, train_loss: 0.9284, test_loss: 1.1789, test_f1: 0.4789
 epoch: 75, train_loss: 0.9318, test_loss: 1.1716, test_f1: 0.4763
 epoch: 76, train_loss: 0.9213, test_loss: 1.1660, test_f1: 0.5071
 epoch: 77, train_loss: 0.9321, test_loss: 1.1766, test_f1: 0.4875
 epoch: 78, train_loss: 0.9219, test_loss: 1.1805, test_f1: 0.4950
 epoch: 79, train_loss: 0.9303, test_loss: 1.1797, test_f1: 0.4962
 epoch: 80, train_loss: 0.9253, test_loss: 1.1750, test_f1: 0.5049
 epoch: 81, train_loss: 0.9430, test_loss: 1.1633, test_f1: 0.5065
 epoch: 82, train_loss: 0.9222, test_loss: 1.1717, test_f1: 0.5023
 epoch: 83, train_loss: 0.9163, test_loss: 1.1701, test_f1: 0.4985
 epoch: 84, train_loss: 0.9266, test_loss: 1.1705, test_f1: 0.4922
 epoch: 85, train_loss: 0.9255, test_loss: 1.1733, test_f1: 0.5182
 epoch: 86, train_loss: 0.9086, test_loss: 1.1696, test_f1: 0.5120
 epoch: 87, train_loss: 0.9153, test_loss: 1.1733, test_f1: 0.5196
 epoch: 88, train_loss: 0.9245, test_loss: 1.1640, test_f1: 0.5245
 epoch: 89, train_loss: 0.9174, test_loss: 1.1612, test_f1: 0.5270
 epoch: 90, train_loss: 0.9166, test_loss: 1.1715, test_f1: 0.5188
 epoch: 91, train_loss: 0.9172, test_loss: 1.1805, test_f1: 0.5283
 epoch: 92, train_loss: 0.9138, test_loss: 1.1813, test_f1: 0.5046
 epoch: 93, train_loss: 0.9064, test_loss: 1.1647, test_f1: 0.5036
 epoch: 94, train_loss: 0.9076, test_loss: 1.1463, test_f1: 0.5107
 epoch: 95, train_loss: 0.9023, test_loss: 1.1551, test_f1: 0.4849
 epoch: 96, train_loss: 0.9040, test_loss: 1.1608, test_f1: 0.4942
 epoch: 97, train_loss: 0.9065, test_loss: 1.1597, test_f1: 0.5209
 epoch: 98, train_loss: 0.8945, test_loss: 1.1743, test_f1: 0.5323
 epoch: 99, train_loss: 0.9182, test_loss: 1.1857, test_f1: 0.5216
##################ITERATION #6 ****************************************
 epoch: 0, train_loss: 1.3134, test_loss: 1.3265, test_f1: 0.2281
 epoch: 1, train_loss: 1.2569, test_loss: 1.3224, test_f1: 0.2281
 epoch: 2, train_loss: 1.2412, test_loss: 1.3025, test_f1: 0.2329
 epoch: 3, train_loss: 1.2281, test_loss: 1.2856, test_f1: 0.2319
 epoch: 4, train_loss: 1.2120, test_loss: 1.2829, test_f1: 0.2689
 epoch: 5, train_loss: 1.1834, test_loss: 1.2735, test_f1: 0.3170
 epoch: 6, train_loss: 1.1834, test_loss: 1.2709, test_f1: 0.3672
 epoch: 7, train_loss: 1.1652, test_loss: 1.2532, test_f1: 0.3731
 epoch: 8, train_loss: 1.1623, test_loss: 1.2459, test_f1: 0.3559
 epoch: 9, train_loss: 1.1417, test_loss: 1.2407, test_f1: 0.3580
 epoch: 10, train_loss: 1.1348, test_loss: 1.2266, test_f1: 0.3670
 epoch: 11, train_loss: 1.1329, test_loss: 1.2225, test_f1: 0.3621
 epoch: 12, train_loss: 1.1400, test_loss: 1.2158, test_f1: 0.3697
 epoch: 13, train_loss: 1.1227, test_loss: 1.2296, test_f1: 0.3697
 epoch: 14, train_loss: 1.1211, test_loss: 1.2136, test_f1: 0.3430
 epoch: 15, train_loss: 1.1193, test_loss: 1.2148, test_f1: 0.3410
 epoch: 16, train_loss: 1.1150, test_loss: 1.2339, test_f1: 0.3691
 epoch: 17, train_loss: 1.1071, test_loss: 1.2152, test_f1: 0.3769
 epoch: 18, train_loss: 1.0995, test_loss: 1.2178, test_f1: 0.3706
 epoch: 19, train_loss: 1.0969, test_loss: 1.1905, test_f1: 0.3826
 epoch: 20, train_loss: 1.0882, test_loss: 1.1992, test_f1: 0.3733
 epoch: 21, train_loss: 1.0911, test_loss: 1.1952, test_f1: 0.3750
 epoch: 22, train_loss: 1.0981, test_loss: 1.2048, test_f1: 0.3302
 epoch: 23, train_loss: 1.0732, test_loss: 1.1933, test_f1: 0.3288
 epoch: 24, train_loss: 1.0769, test_loss: 1.1962, test_f1: 0.3219
 epoch: 25, train_loss: 1.0591, test_loss: 1.1940, test_f1: 0.3719
 epoch: 26, train_loss: 1.0657, test_loss: 1.1742, test_f1: 0.3817
 epoch: 27, train_loss: 1.0512, test_loss: 1.1651, test_f1: 0.3643
 epoch: 28, train_loss: 1.0601, test_loss: 1.1638, test_f1: 0.3739
 epoch: 29, train_loss: 1.0560, test_loss: 1.1633, test_f1: 0.3490
 epoch: 30, train_loss: 1.0543, test_loss: 1.1724, test_f1: 0.3584
 epoch: 31, train_loss: 1.0565, test_loss: 1.1769, test_f1: 0.3527
 epoch: 32, train_loss: 1.0495, test_loss: 1.1816, test_f1: 0.3241
 epoch: 33, train_loss: 1.0371, test_loss: 1.1782, test_f1: 0.3501
 epoch: 34, train_loss: 1.0310, test_loss: 1.1705, test_f1: 0.3775
 epoch: 35, train_loss: 1.0368, test_loss: 1.1595, test_f1: 0.3974
 epoch: 36, train_loss: 1.0212, test_loss: 1.1600, test_f1: 0.3965
 epoch: 37, train_loss: 1.0341, test_loss: 1.1649, test_f1: 0.4073
 epoch: 38, train_loss: 1.0190, test_loss: 1.1632, test_f1: 0.4090
 epoch: 39, train_loss: 1.0175, test_loss: 1.1423, test_f1: 0.4044
 epoch: 40, train_loss: 1.0210, test_loss: 1.1466, test_f1: 0.4062
 epoch: 41, train_loss: 1.0132, test_loss: 1.1406, test_f1: 0.4443
 epoch: 42, train_loss: 1.0126, test_loss: 1.1389, test_f1: 0.4440
 epoch: 43, train_loss: 0.9972, test_loss: 1.1447, test_f1: 0.4312
 epoch: 44, train_loss: 1.0013, test_loss: 1.1448, test_f1: 0.4375
 epoch: 45, train_loss: 0.9994, test_loss: 1.1370, test_f1: 0.4403
 epoch: 46, train_loss: 0.9882, test_loss: 1.1327, test_f1: 0.4751
 epoch: 47, train_loss: 1.0032, test_loss: 1.1285, test_f1: 0.4897
 epoch: 48, train_loss: 0.9927, test_loss: 1.1158, test_f1: 0.5113
 epoch: 49, train_loss: 0.9951, test_loss: 1.0958, test_f1: 0.5031
 epoch: 50, train_loss: 0.9956, test_loss: 1.1311, test_f1: 0.4887
 epoch: 51, train_loss: 0.9733, test_loss: 1.1431, test_f1: 0.4945
 epoch: 52, train_loss: 0.9779, test_loss: 1.1320, test_f1: 0.4978
 epoch: 53, train_loss: 0.9685, test_loss: 1.1276, test_f1: 0.5158
 epoch: 54, train_loss: 0.9798, test_loss: 1.1221, test_f1: 0.5124
 epoch: 55, train_loss: 0.9656, test_loss: 1.1275, test_f1: 0.5123
 epoch: 56, train_loss: 0.9626, test_loss: 1.1252, test_f1: 0.5314
 epoch: 57, train_loss: 0.9564, test_loss: 1.1269, test_f1: 0.5507
 epoch: 58, train_loss: 0.9629, test_loss: 1.1216, test_f1: 0.5629
 epoch: 59, train_loss: 0.9622, test_loss: 1.1314, test_f1: 0.5520
 epoch: 60, train_loss: 0.9679, test_loss: 1.1687, test_f1: 0.5357
 epoch: 61, train_loss: 0.9822, test_loss: 1.1780, test_f1: 0.5324
 epoch: 62, train_loss: 0.9826, test_loss: 1.1342, test_f1: 0.5198
 epoch: 63, train_loss: 0.9664, test_loss: 1.1402, test_f1: 0.5182
 epoch: 64, train_loss: 0.9558, test_loss: 1.1356, test_f1: 0.5213
 epoch: 65, train_loss: 0.9598, test_loss: 1.1346, test_f1: 0.5272
 epoch: 66, train_loss: 0.9558, test_loss: 1.1283, test_f1: 0.5356
 epoch: 67, train_loss: 0.9628, test_loss: 1.1298, test_f1: 0.5402
 epoch: 68, train_loss: 0.9591, test_loss: 1.1306, test_f1: 0.5306
 epoch: 69, train_loss: 0.9608, test_loss: 1.1341, test_f1: 0.5551
 epoch: 70, train_loss: 0.9535, test_loss: 1.1375, test_f1: 0.5447
 epoch: 71, train_loss: 0.9465, test_loss: 1.1301, test_f1: 0.5425
 epoch: 72, train_loss: 0.9527, test_loss: 1.1448, test_f1: 0.5277
 epoch: 73, train_loss: 0.9556, test_loss: 1.1268, test_f1: 0.5373
 epoch: 74, train_loss: 0.9497, test_loss: 1.1187, test_f1: 0.5356
 epoch: 75, train_loss: 0.9396, test_loss: 1.1256, test_f1: 0.5470
 epoch: 76, train_loss: 0.9534, test_loss: 1.1037, test_f1: 0.5423
 epoch: 77, train_loss: 0.9320, test_loss: 1.1096, test_f1: 0.5253
 epoch: 78, train_loss: 0.9387, test_loss: 1.1170, test_f1: 0.4789
 epoch: 79, train_loss: 0.9279, test_loss: 1.1061, test_f1: 0.4967
 epoch: 80, train_loss: 0.9384, test_loss: 1.1110, test_f1: 0.5138
 epoch: 81, train_loss: 0.9382, test_loss: 1.1053, test_f1: 0.5225
 epoch: 82, train_loss: 0.9280, test_loss: 1.1136, test_f1: 0.5074
 epoch: 83, train_loss: 0.9361, test_loss: 1.1364, test_f1: 0.5109
 epoch: 84, train_loss: 0.9305, test_loss: 1.1491, test_f1: 0.5196
 epoch: 85, train_loss: 0.9276, test_loss: 1.0623, test_f1: 0.5149
 epoch: 86, train_loss: 0.9242, test_loss: 1.0675, test_f1: 0.5301
 epoch: 87, train_loss: 0.9334, test_loss: 1.0826, test_f1: 0.5107
 epoch: 88, train_loss: 0.9315, test_loss: 1.1062, test_f1: 0.4993
 epoch: 89, train_loss: 0.9275, test_loss: 1.1301, test_f1: 0.5017
 epoch: 90, train_loss: 0.9360, test_loss: 1.1529, test_f1: 0.5013
 epoch: 91, train_loss: 0.9279, test_loss: 1.2078, test_f1: 0.5018
 epoch: 92, train_loss: 0.9280, test_loss: 1.1976, test_f1: 0.4927
 epoch: 93, train_loss: 0.9273, test_loss: 1.2094, test_f1: 0.4970
 epoch: 94, train_loss: 0.9249, test_loss: 1.1494, test_f1: 0.5195
 epoch: 95, train_loss: 0.9212, test_loss: 1.1260, test_f1: 0.5204
 epoch: 96, train_loss: 0.9272, test_loss: 1.0865, test_f1: 0.5361
 epoch: 97, train_loss: 0.9080, test_loss: 1.1024, test_f1: 0.5086
 epoch: 98, train_loss: 0.9070, test_loss: 1.1294, test_f1: 0.5067
 epoch: 99, train_loss: 0.9118, test_loss: 1.1477, test_f1: 0.5067
##################ITERATION #7 ****************************************
 epoch: 0, train_loss: 1.3091, test_loss: 1.4250, test_f1: 0.2261
 epoch: 1, train_loss: 1.2286, test_loss: 1.3547, test_f1: 0.2276
 epoch: 2, train_loss: 1.2284, test_loss: 1.3166, test_f1: 0.3199
 epoch: 3, train_loss: 1.1996, test_loss: 1.2961, test_f1: 0.2765
 epoch: 4, train_loss: 1.2071, test_loss: 1.2893, test_f1: 0.3201
 epoch: 5, train_loss: 1.1919, test_loss: 1.2882, test_f1: 0.3329
 epoch: 6, train_loss: 1.1909, test_loss: 1.2868, test_f1: 0.3280
 epoch: 7, train_loss: 1.1861, test_loss: 1.2930, test_f1: 0.3181
 epoch: 8, train_loss: 1.1757, test_loss: 1.2887, test_f1: 0.3086
 epoch: 9, train_loss: 1.1665, test_loss: 1.2808, test_f1: 0.3217
 epoch: 10, train_loss: 1.1665, test_loss: 1.2767, test_f1: 0.3405
 epoch: 11, train_loss: 1.1616, test_loss: 1.2622, test_f1: 0.3491
 epoch: 12, train_loss: 1.1557, test_loss: 1.2519, test_f1: 0.3496
 epoch: 13, train_loss: 1.1505, test_loss: 1.2607, test_f1: 0.3372
 epoch: 14, train_loss: 1.1452, test_loss: 1.2685, test_f1: 0.3458
 epoch: 15, train_loss: 1.1366, test_loss: 1.2672, test_f1: 0.3481
 epoch: 16, train_loss: 1.1322, test_loss: 1.2551, test_f1: 0.3466
 epoch: 17, train_loss: 1.1226, test_loss: 1.2638, test_f1: 0.3455
 epoch: 18, train_loss: 1.1244, test_loss: 1.2707, test_f1: 0.3457
 epoch: 19, train_loss: 1.1327, test_loss: 1.2737, test_f1: 0.3647
 epoch: 20, train_loss: 1.1192, test_loss: 1.2692, test_f1: 0.3557
 epoch: 21, train_loss: 1.1056, test_loss: 1.2719, test_f1: 0.3646
 epoch: 22, train_loss: 1.1027, test_loss: 1.2770, test_f1: 0.3457
 epoch: 23, train_loss: 1.0998, test_loss: 1.2863, test_f1: 0.3752
 epoch: 24, train_loss: 1.0936, test_loss: 1.2869, test_f1: 0.3765
 epoch: 25, train_loss: 1.1003, test_loss: 1.2797, test_f1: 0.3593
 epoch: 26, train_loss: 1.0909, test_loss: 1.2739, test_f1: 0.3498
 epoch: 27, train_loss: 1.0853, test_loss: 1.2771, test_f1: 0.3591
 epoch: 28, train_loss: 1.0862, test_loss: 1.2608, test_f1: 0.3647
 epoch: 29, train_loss: 1.0799, test_loss: 1.2611, test_f1: 0.3612
 epoch: 30, train_loss: 1.0811, test_loss: 1.2636, test_f1: 0.3588
 epoch: 31, train_loss: 1.0806, test_loss: 1.2955, test_f1: 0.3529
 epoch: 32, train_loss: 1.0734, test_loss: 1.3161, test_f1: 0.3820
 epoch: 33, train_loss: 1.0701, test_loss: 1.3291, test_f1: 0.3859
 epoch: 34, train_loss: 1.0629, test_loss: 1.3178, test_f1: 0.3950
 epoch: 35, train_loss: 1.0702, test_loss: 1.3392, test_f1: 0.3910
 epoch: 36, train_loss: 1.0632, test_loss: 1.3933, test_f1: 0.3818
 epoch: 37, train_loss: 1.0615, test_loss: 1.4541, test_f1: 0.3918
 epoch: 38, train_loss: 1.0551, test_loss: 1.4554, test_f1: 0.4048
 epoch: 39, train_loss: 1.0581, test_loss: 1.4172, test_f1: 0.4105
 epoch: 40, train_loss: 1.0473, test_loss: 1.4043, test_f1: 0.4082
 epoch: 41, train_loss: 1.0457, test_loss: 1.3755, test_f1: 0.4085
 epoch: 42, train_loss: 1.0552, test_loss: 1.3447, test_f1: 0.3881
 epoch: 43, train_loss: 1.0580, test_loss: 1.3136, test_f1: 0.3894
 epoch: 44, train_loss: 1.0387, test_loss: 1.3423, test_f1: 0.3758
 epoch: 45, train_loss: 1.0350, test_loss: 1.3383, test_f1: 0.3661
 epoch: 46, train_loss: 1.0365, test_loss: 1.3437, test_f1: 0.3910
 epoch: 47, train_loss: 1.0212, test_loss: 1.3510, test_f1: 0.3786
 epoch: 48, train_loss: 1.0405, test_loss: 1.3774, test_f1: 0.3804
 epoch: 49, train_loss: 1.0244, test_loss: 1.3393, test_f1: 0.3950
 epoch: 50, train_loss: 1.0239, test_loss: 1.3274, test_f1: 0.3829
 epoch: 51, train_loss: 1.0201, test_loss: 1.3405, test_f1: 0.3824
 epoch: 52, train_loss: 1.0164, test_loss: 1.3600, test_f1: 0.3969
 epoch: 53, train_loss: 1.0105, test_loss: 1.3635, test_f1: 0.3903
 epoch: 54, train_loss: 1.0030, test_loss: 1.3572, test_f1: 0.3961
 epoch: 55, train_loss: 1.0048, test_loss: 1.3515, test_f1: 0.4026
 epoch: 56, train_loss: 1.0213, test_loss: 1.3714, test_f1: 0.4114
 epoch: 57, train_loss: 1.0036, test_loss: 1.3594, test_f1: 0.4053
 epoch: 58, train_loss: 0.9996, test_loss: 1.3511, test_f1: 0.4028
 epoch: 59, train_loss: 0.9972, test_loss: 1.3581, test_f1: 0.4045
 epoch: 60, train_loss: 1.0008, test_loss: 1.3522, test_f1: 0.4047
 epoch: 61, train_loss: 0.9841, test_loss: 1.3688, test_f1: 0.3981
 epoch: 62, train_loss: 0.9962, test_loss: 1.3926, test_f1: 0.4009
 epoch: 63, train_loss: 0.9837, test_loss: 1.3976, test_f1: 0.4191
 epoch: 64, train_loss: 0.9930, test_loss: 1.4112, test_f1: 0.4133
 epoch: 65, train_loss: 0.9914, test_loss: 1.4052, test_f1: 0.4084
 epoch: 66, train_loss: 0.9946, test_loss: 1.3927, test_f1: 0.4140
 epoch: 67, train_loss: 0.9921, test_loss: 1.3701, test_f1: 0.4107
 epoch: 68, train_loss: 0.9843, test_loss: 1.3850, test_f1: 0.4263
 epoch: 69, train_loss: 0.9916, test_loss: 1.3840, test_f1: 0.4415
 epoch: 70, train_loss: 0.9748, test_loss: 1.3827, test_f1: 0.4297
 epoch: 71, train_loss: 0.9855, test_loss: 1.3730, test_f1: 0.4308
 epoch: 72, train_loss: 0.9716, test_loss: 1.3390, test_f1: 0.4314
 epoch: 73, train_loss: 0.9717, test_loss: 1.3479, test_f1: 0.4511
 epoch: 74, train_loss: 0.9803, test_loss: 1.3678, test_f1: 0.4547
 epoch: 75, train_loss: 0.9737, test_loss: 1.3847, test_f1: 0.4460
 epoch: 76, train_loss: 0.9707, test_loss: 1.3986, test_f1: 0.4476
 epoch: 77, train_loss: 0.9741, test_loss: 1.3853, test_f1: 0.4461
 epoch: 78, train_loss: 0.9644, test_loss: 1.3904, test_f1: 0.4421
 epoch: 79, train_loss: 0.9683, test_loss: 1.3798, test_f1: 0.4349
 epoch: 80, train_loss: 0.9668, test_loss: 1.3681, test_f1: 0.4349
 epoch: 81, train_loss: 0.9591, test_loss: 1.3784, test_f1: 0.4368
 epoch: 82, train_loss: 0.9593, test_loss: 1.3795, test_f1: 0.4543
 epoch: 83, train_loss: 0.9624, test_loss: 1.3785, test_f1: 0.4553
 epoch: 84, train_loss: 0.9583, test_loss: 1.3783, test_f1: 0.4527
 epoch: 85, train_loss: 0.9574, test_loss: 1.4106, test_f1: 0.4577
 epoch: 86, train_loss: 0.9634, test_loss: 1.3994, test_f1: 0.4654
 epoch: 87, train_loss: 0.9533, test_loss: 1.3808, test_f1: 0.4720
 epoch: 88, train_loss: 0.9583, test_loss: 1.3797, test_f1: 0.4791
 epoch: 89, train_loss: 0.9510, test_loss: 1.4157, test_f1: 0.4781
 epoch: 90, train_loss: 0.9573, test_loss: 1.4189, test_f1: 0.4690
 epoch: 91, train_loss: 0.9469, test_loss: 1.3839, test_f1: 0.4718
 epoch: 92, train_loss: 0.9441, test_loss: 1.3591, test_f1: 0.4712
 epoch: 93, train_loss: 0.9512, test_loss: 1.3506, test_f1: 0.4864
 epoch: 94, train_loss: 0.9386, test_loss: 1.4160, test_f1: 0.4812
 epoch: 95, train_loss: 0.9350, test_loss: 1.4217, test_f1: 0.4821
 epoch: 96, train_loss: 0.9351, test_loss: 1.3978, test_f1: 0.4857
 epoch: 97, train_loss: 0.9359, test_loss: 1.3494, test_f1: 0.4945
 epoch: 98, train_loss: 0.9250, test_loss: 1.3311, test_f1: 0.4768
 epoch: 99, train_loss: 0.9356, test_loss: 1.3425, test_f1: 0.4806
##################ITERATION #8 ****************************************
 epoch: 0, train_loss: 1.3234, test_loss: 1.3614, test_f1: 0.2281
 epoch: 1, train_loss: 1.2872, test_loss: 1.3475, test_f1: 0.2404
 epoch: 2, train_loss: 1.2682, test_loss: 1.3503, test_f1: 0.2404
 epoch: 3, train_loss: 1.2512, test_loss: 1.3616, test_f1: 0.2404
 epoch: 4, train_loss: 1.2352, test_loss: 1.3757, test_f1: 0.2424
 epoch: 5, train_loss: 1.2372, test_loss: 1.3764, test_f1: 0.2395
 epoch: 6, train_loss: 1.2274, test_loss: 1.3587, test_f1: 0.2395
 epoch: 7, train_loss: 1.2187, test_loss: 1.3579, test_f1: 0.2306
 epoch: 8, train_loss: 1.2220, test_loss: 1.3512, test_f1: 0.2347
 epoch: 9, train_loss: 1.2223, test_loss: 1.3402, test_f1: 0.2353
 epoch: 10, train_loss: 1.2059, test_loss: 1.3448, test_f1: 0.2405
 epoch: 11, train_loss: 1.1928, test_loss: 1.3695, test_f1: 0.2425
 epoch: 12, train_loss: 1.1906, test_loss: 1.3710, test_f1: 0.2533
 epoch: 13, train_loss: 1.1830, test_loss: 1.3577, test_f1: 0.2547
 epoch: 14, train_loss: 1.1765, test_loss: 1.3452, test_f1: 0.2646
 epoch: 15, train_loss: 1.1801, test_loss: 1.3284, test_f1: 0.2797
 epoch: 16, train_loss: 1.1671, test_loss: 1.3137, test_f1: 0.2990
 epoch: 17, train_loss: 1.1551, test_loss: 1.3130, test_f1: 0.3001
 epoch: 18, train_loss: 1.1562, test_loss: 1.3059, test_f1: 0.3429
 epoch: 19, train_loss: 1.1333, test_loss: 1.3256, test_f1: 0.3241
 epoch: 20, train_loss: 1.1309, test_loss: 1.3580, test_f1: 0.3281
 epoch: 21, train_loss: 1.1456, test_loss: 1.3734, test_f1: 0.3238
 epoch: 22, train_loss: 1.1410, test_loss: 1.3645, test_f1: 0.3253
 epoch: 23, train_loss: 1.1325, test_loss: 1.3271, test_f1: 0.3437
 epoch: 24, train_loss: 1.1259, test_loss: 1.2995, test_f1: 0.3404
 epoch: 25, train_loss: 1.1060, test_loss: 1.3209, test_f1: 0.3633
 epoch: 26, train_loss: 1.1133, test_loss: 1.3350, test_f1: 0.3177
 epoch: 27, train_loss: 1.0991, test_loss: 1.3446, test_f1: 0.3738
 epoch: 28, train_loss: 1.0993, test_loss: 1.3506, test_f1: 0.3679
 epoch: 29, train_loss: 1.0939, test_loss: 1.3382, test_f1: 0.3744
 epoch: 30, train_loss: 1.0792, test_loss: 1.3315, test_f1: 0.3725
 epoch: 31, train_loss: 1.0651, test_loss: 1.3578, test_f1: 0.3951
 epoch: 32, train_loss: 1.0713, test_loss: 1.3425, test_f1: 0.3978
 epoch: 33, train_loss: 1.0653, test_loss: 1.3362, test_f1: 0.4038
 epoch: 34, train_loss: 1.0720, test_loss: 1.3538, test_f1: 0.4111
 epoch: 35, train_loss: 1.0709, test_loss: 1.3670, test_f1: 0.4097
 epoch: 36, train_loss: 1.0649, test_loss: 1.3743, test_f1: 0.4160
 epoch: 37, train_loss: 1.0508, test_loss: 1.3580, test_f1: 0.4217
 epoch: 38, train_loss: 1.0399, test_loss: 1.3369, test_f1: 0.4273
 epoch: 39, train_loss: 1.0362, test_loss: 1.3336, test_f1: 0.4319
 epoch: 40, train_loss: 1.0375, test_loss: 1.3803, test_f1: 0.4106
 epoch: 41, train_loss: 1.0301, test_loss: 1.4267, test_f1: 0.4070
 epoch: 42, train_loss: 1.0399, test_loss: 1.3767, test_f1: 0.4210
 epoch: 43, train_loss: 1.0311, test_loss: 1.3338, test_f1: 0.4354
 epoch: 44, train_loss: 1.0157, test_loss: 1.3403, test_f1: 0.4418
 epoch: 45, train_loss: 1.0186, test_loss: 1.3779, test_f1: 0.4613
 epoch: 46, train_loss: 1.0096, test_loss: 1.3963, test_f1: 0.4491
 epoch: 47, train_loss: 1.0102, test_loss: 1.4233, test_f1: 0.4477
 epoch: 48, train_loss: 1.0018, test_loss: 1.4210, test_f1: 0.4417
 epoch: 49, train_loss: 1.0028, test_loss: 1.4250, test_f1: 0.4566
 epoch: 50, train_loss: 0.9985, test_loss: 1.3929, test_f1: 0.4564
 epoch: 51, train_loss: 1.0010, test_loss: 1.3719, test_f1: 0.4510
 epoch: 52, train_loss: 0.9800, test_loss: 1.3782, test_f1: 0.4533
 epoch: 53, train_loss: 0.9938, test_loss: 1.3694, test_f1: 0.4463
 epoch: 54, train_loss: 0.9919, test_loss: 1.3965, test_f1: 0.4440
 epoch: 55, train_loss: 1.0006, test_loss: 1.4237, test_f1: 0.4615
 epoch: 56, train_loss: 0.9847, test_loss: 1.3909, test_f1: 0.4577
 epoch: 57, train_loss: 0.9876, test_loss: 1.4312, test_f1: 0.4584
 epoch: 58, train_loss: 0.9796, test_loss: 1.4158, test_f1: 0.4681
 epoch: 59, train_loss: 0.9878, test_loss: 1.4440, test_f1: 0.4618
 epoch: 60, train_loss: 0.9851, test_loss: 1.4235, test_f1: 0.4618
 epoch: 61, train_loss: 0.9825, test_loss: 1.4244, test_f1: 0.4585
 epoch: 62, train_loss: 0.9853, test_loss: 1.3876, test_f1: 0.4551
 epoch: 63, train_loss: 0.9581, test_loss: 1.4317, test_f1: 0.4788
 epoch: 64, train_loss: 0.9664, test_loss: 1.4564, test_f1: 0.4783
 epoch: 65, train_loss: 0.9726, test_loss: 1.4765, test_f1: 0.4680
 epoch: 66, train_loss: 0.9618, test_loss: 1.4936, test_f1: 0.4612
 epoch: 67, train_loss: 0.9791, test_loss: 1.5037, test_f1: 0.4578
 epoch: 68, train_loss: 0.9525, test_loss: 1.4866, test_f1: 0.4479
 epoch: 69, train_loss: 0.9662, test_loss: 1.4785, test_f1: 0.4501
 epoch: 70, train_loss: 0.9636, test_loss: 1.4378, test_f1: 0.4637
 epoch: 71, train_loss: 0.9573, test_loss: 1.4815, test_f1: 0.4786
 epoch: 72, train_loss: 0.9565, test_loss: 1.4466, test_f1: 0.4704
 epoch: 73, train_loss: 0.9475, test_loss: 1.4363, test_f1: 0.4776
 epoch: 74, train_loss: 0.9494, test_loss: 1.4457, test_f1: 0.4733
 epoch: 75, train_loss: 0.9562, test_loss: 1.3989, test_f1: 0.4842
 epoch: 76, train_loss: 0.9448, test_loss: 1.3984, test_f1: 0.4878
 epoch: 77, train_loss: 0.9519, test_loss: 1.4179, test_f1: 0.4832
 epoch: 78, train_loss: 0.9442, test_loss: 1.4321, test_f1: 0.4658
 epoch: 79, train_loss: 0.9491, test_loss: 1.4347, test_f1: 0.4585
 epoch: 80, train_loss: 0.9434, test_loss: 1.4179, test_f1: 0.4866
 epoch: 81, train_loss: 0.9306, test_loss: 1.4413, test_f1: 0.4985
 epoch: 82, train_loss: 0.9462, test_loss: 1.4528, test_f1: 0.5175
 epoch: 83, train_loss: 0.9489, test_loss: 1.4503, test_f1: 0.5094
 epoch: 84, train_loss: 0.9607, test_loss: 1.4420, test_f1: 0.5055
 epoch: 85, train_loss: 0.9425, test_loss: 1.4219, test_f1: 0.5043
 epoch: 86, train_loss: 0.9278, test_loss: 1.4404, test_f1: 0.4911
 epoch: 87, train_loss: 0.9433, test_loss: 1.4929, test_f1: 0.4709
 epoch: 88, train_loss: 0.9375, test_loss: 1.4625, test_f1: 0.4719
 epoch: 89, train_loss: 0.9396, test_loss: 1.5003, test_f1: 0.4848
 epoch: 90, train_loss: 0.9331, test_loss: 1.4567, test_f1: 0.4756
 epoch: 91, train_loss: 0.9401, test_loss: 1.4759, test_f1: 0.4776
 epoch: 92, train_loss: 0.9303, test_loss: 1.4661, test_f1: 0.4657
 epoch: 93, train_loss: 0.9227, test_loss: 1.5172, test_f1: 0.4727
 epoch: 94, train_loss: 0.9345, test_loss: 1.6139, test_f1: 0.4991
 epoch: 95, train_loss: 0.9164, test_loss: 1.6194, test_f1: 0.4774
 epoch: 96, train_loss: 0.9302, test_loss: 1.5536, test_f1: 0.4896
 epoch: 97, train_loss: 0.9245, test_loss: 1.4745, test_f1: 0.5151
 epoch: 98, train_loss: 0.9229, test_loss: 1.4764, test_f1: 0.5151
 epoch: 99, train_loss: 0.9210, test_loss: 1.4930, test_f1: 0.5091
##################ITERATION #9 ****************************************
 epoch: 0, train_loss: 1.4111, test_loss: 1.3909, test_f1: 0.2281
 epoch: 1, train_loss: 1.3235, test_loss: 1.4008, test_f1: 0.2658
 epoch: 2, train_loss: 1.2947, test_loss: 1.3890, test_f1: 0.3364
 epoch: 3, train_loss: 1.2808, test_loss: 1.3757, test_f1: 0.2908
 epoch: 4, train_loss: 1.2824, test_loss: 1.3604, test_f1: 0.2872
 epoch: 5, train_loss: 1.2510, test_loss: 1.3457, test_f1: 0.2976
 epoch: 6, train_loss: 1.2463, test_loss: 1.3307, test_f1: 0.3130
 epoch: 7, train_loss: 1.2332, test_loss: 1.3172, test_f1: 0.3235
 epoch: 8, train_loss: 1.2373, test_loss: 1.3026, test_f1: 0.3089
 epoch: 9, train_loss: 1.2180, test_loss: 1.2923, test_f1: 0.3271
 epoch: 10, train_loss: 1.2182, test_loss: 1.2799, test_f1: 0.3461
 epoch: 11, train_loss: 1.2086, test_loss: 1.2692, test_f1: 0.3552
 epoch: 12, train_loss: 1.2079, test_loss: 1.2658, test_f1: 0.3469
 epoch: 13, train_loss: 1.1846, test_loss: 1.2629, test_f1: 0.3640
 epoch: 14, train_loss: 1.1943, test_loss: 1.2670, test_f1: 0.3692
 epoch: 15, train_loss: 1.1777, test_loss: 1.2670, test_f1: 0.3672
 epoch: 16, train_loss: 1.1657, test_loss: 1.2569, test_f1: 0.3806
 epoch: 17, train_loss: 1.1513, test_loss: 1.2450, test_f1: 0.3993
 epoch: 18, train_loss: 1.1459, test_loss: 1.2601, test_f1: 0.3850
 epoch: 19, train_loss: 1.1268, test_loss: 1.2756, test_f1: 0.3808
 epoch: 20, train_loss: 1.1311, test_loss: 1.2464, test_f1: 0.4012
 epoch: 21, train_loss: 1.1279, test_loss: 1.2296, test_f1: 0.4278
 epoch: 22, train_loss: 1.1095, test_loss: 1.2185, test_f1: 0.4125
 epoch: 23, train_loss: 1.0934, test_loss: 1.2625, test_f1: 0.3683
 epoch: 24, train_loss: 1.1094, test_loss: 1.2683, test_f1: 0.3788
 epoch: 25, train_loss: 1.0954, test_loss: 1.2464, test_f1: 0.4196
 epoch: 26, train_loss: 1.0730, test_loss: 1.2350, test_f1: 0.4328
 epoch: 27, train_loss: 1.0882, test_loss: 1.2181, test_f1: 0.4386
 epoch: 28, train_loss: 1.0761, test_loss: 1.2144, test_f1: 0.4202
 epoch: 29, train_loss: 1.0783, test_loss: 1.2190, test_f1: 0.4294
 epoch: 30, train_loss: 1.0467, test_loss: 1.2339, test_f1: 0.4237
 epoch: 31, train_loss: 1.0602, test_loss: 1.2588, test_f1: 0.4227
 epoch: 32, train_loss: 1.0406, test_loss: 1.2458, test_f1: 0.4245
 epoch: 33, train_loss: 1.0488, test_loss: 1.2323, test_f1: 0.4244
 epoch: 34, train_loss: 1.0469, test_loss: 1.2128, test_f1: 0.4294
 epoch: 35, train_loss: 1.0620, test_loss: 1.2132, test_f1: 0.4352
 epoch: 36, train_loss: 1.0498, test_loss: 1.2115, test_f1: 0.4309
 epoch: 37, train_loss: 1.0377, test_loss: 1.2190, test_f1: 0.4448
 epoch: 38, train_loss: 1.0409, test_loss: 1.2177, test_f1: 0.4609
 epoch: 39, train_loss: 1.0330, test_loss: 1.2203, test_f1: 0.4512
 epoch: 40, train_loss: 1.0332, test_loss: 1.2394, test_f1: 0.4409
 epoch: 41, train_loss: 1.0192, test_loss: 1.2514, test_f1: 0.4284
 epoch: 42, train_loss: 1.0159, test_loss: 1.2740, test_f1: 0.4733
 epoch: 43, train_loss: 1.0315, test_loss: 1.2650, test_f1: 0.4631
 epoch: 44, train_loss: 1.0139, test_loss: 1.2435, test_f1: 0.4524
 epoch: 45, train_loss: 1.0224, test_loss: 1.2382, test_f1: 0.4647
 epoch: 46, train_loss: 1.0119, test_loss: 1.2532, test_f1: 0.4578
 epoch: 47, train_loss: 1.0242, test_loss: 1.2461, test_f1: 0.4623
 epoch: 48, train_loss: 1.0076, test_loss: 1.2579, test_f1: 0.4682
 epoch: 49, train_loss: 1.0105, test_loss: 1.2874, test_f1: 0.4469
 epoch: 50, train_loss: 1.0103, test_loss: 1.2392, test_f1: 0.4584
 epoch: 51, train_loss: 1.0023, test_loss: 1.2327, test_f1: 0.4584
 epoch: 52, train_loss: 0.9951, test_loss: 1.2448, test_f1: 0.4620
 epoch: 53, train_loss: 0.9968, test_loss: 1.2641, test_f1: 0.4784
 epoch: 54, train_loss: 1.0026, test_loss: 1.2651, test_f1: 0.4539
 epoch: 55, train_loss: 0.9949, test_loss: 1.2772, test_f1: 0.4554
 epoch: 56, train_loss: 0.9957, test_loss: 1.2607, test_f1: 0.4495
 epoch: 57, train_loss: 1.0029, test_loss: 1.2644, test_f1: 0.4503
 epoch: 58, train_loss: 0.9942, test_loss: 1.2921, test_f1: 0.4257
 epoch: 59, train_loss: 0.9992, test_loss: 1.2683, test_f1: 0.4434
 epoch: 60, train_loss: 0.9950, test_loss: 1.2599, test_f1: 0.4514
 epoch: 61, train_loss: 1.0022, test_loss: 1.2774, test_f1: 0.4399
 epoch: 62, train_loss: 0.9816, test_loss: 1.2840, test_f1: 0.4591
 epoch: 63, train_loss: 0.9844, test_loss: 1.2891, test_f1: 0.4636
 epoch: 64, train_loss: 0.9879, test_loss: 1.2753, test_f1: 0.4649
 epoch: 65, train_loss: 0.9904, test_loss: 1.2769, test_f1: 0.4546
 epoch: 66, train_loss: 0.9857, test_loss: 1.2906, test_f1: 0.4651
 epoch: 67, train_loss: 0.9889, test_loss: 1.3100, test_f1: 0.4461
 epoch: 68, train_loss: 0.9824, test_loss: 1.3709, test_f1: 0.4676
 epoch: 69, train_loss: 0.9799, test_loss: 1.3459, test_f1: 0.4671
 epoch: 70, train_loss: 0.9865, test_loss: 1.2818, test_f1: 0.4656
 epoch: 71, train_loss: 0.9871, test_loss: 1.2843, test_f1: 0.4397
 epoch: 72, train_loss: 0.9820, test_loss: 1.3112, test_f1: 0.4395
 epoch: 73, train_loss: 0.9967, test_loss: 1.3139, test_f1: 0.4602
 epoch: 74, train_loss: 0.9925, test_loss: 1.3411, test_f1: 0.4527
 epoch: 75, train_loss: 0.9851, test_loss: 1.3338, test_f1: 0.4519
 epoch: 76, train_loss: 0.9825, test_loss: 1.3063, test_f1: 0.4659
 epoch: 77, train_loss: 0.9921, test_loss: 1.2978, test_f1: 0.4928
 epoch: 78, train_loss: 0.9830, test_loss: 1.3163, test_f1: 0.4744
 epoch: 79, train_loss: 0.9798, test_loss: 1.3205, test_f1: 0.4579
 epoch: 80, train_loss: 0.9705, test_loss: 1.2823, test_f1: 0.4803
 epoch: 81, train_loss: 0.9753, test_loss: 1.2718, test_f1: 0.4804
 epoch: 82, train_loss: 0.9725, test_loss: 1.2801, test_f1: 0.4858
 epoch: 83, train_loss: 0.9767, test_loss: 1.2822, test_f1: 0.4697
 epoch: 84, train_loss: 0.9626, test_loss: 1.3066, test_f1: 0.4457
 epoch: 85, train_loss: 0.9754, test_loss: 1.2887, test_f1: 0.4576
 epoch: 86, train_loss: 0.9669, test_loss: 1.2859, test_f1: 0.4641
 epoch: 87, train_loss: 0.9715, test_loss: 1.2903, test_f1: 0.4638
 epoch: 88, train_loss: 0.9792, test_loss: 1.3235, test_f1: 0.4471
 epoch: 89, train_loss: 0.9775, test_loss: 1.3658, test_f1: 0.4475
 epoch: 90, train_loss: 0.9593, test_loss: 1.3589, test_f1: 0.4373
 epoch: 91, train_loss: 0.9589, test_loss: 1.2915, test_f1: 0.4419
 epoch: 92, train_loss: 0.9621, test_loss: 1.2974, test_f1: 0.4570
 epoch: 93, train_loss: 0.9607, test_loss: 1.2907, test_f1: 0.4662
 epoch: 94, train_loss: 0.9679, test_loss: 1.2859, test_f1: 0.4878
 epoch: 95, train_loss: 0.9612, test_loss: 1.2824, test_f1: 0.4814
 epoch: 96, train_loss: 0.9588, test_loss: 1.3017, test_f1: 0.4740
 epoch: 97, train_loss: 0.9522, test_loss: 1.3091, test_f1: 0.4814
 epoch: 98, train_loss: 0.9530, test_loss: 1.3147, test_f1: 0.4757
 epoch: 99, train_loss: 0.9635, test_loss: 1.3476, test_f1: 0.4737

Training completed in 346.02 seconds
Best F1: 0.5629 at epoch 58
Mean F1 across iterations: 0.4941  0.0354
========================FINAL RESULTS================================
FEGIN weighted F1: 0.5629  0.0354
python main.py --data ltspice_demos --representation component_component --model FEGIN --layers 3 --hiddens 16 --batch_size 256 --lr 0.001 --emb_size 128 --epochs 100 --save_appendix component_component_L3_H16_BS256_LR0.001_E128 --no_val
-----



STDERR:
  File "main.py", line 370, in <module>
    main()
  File "main.py", line 254, in main
    dataset = dataset_class(
  File "/home/philip/projects/ltspice_examples_code_repo/Circuit-Completion-Using-GNNs/component_classification_with_link_prediction_head/evaluation/FEGIN/kernel/circuit_datasets.py", line 15, in __init__
    self.data, self.slices = torch.load(self.processed_paths[0])
  File "/home/philip/.local/lib/python3.8/site-packages/torch/serialization.py", line 1040, in load
    warnings.warn(
  File "/usr/lib/python3.8/warnings.py", line 109, in _showwarnmsg
    sw(msg.message, msg.category, msg.filename, msg.lineno,
  File "main.py", line 47, in warn_with_traceback
    traceback.print_stack(file=log)
/home/philip/projects/ltspice_examples_code_repo/Circuit-Completion-Using-GNNs/component_classification_with_link_prediction_head/evaluation/FEGIN/kernel/circuit_datasets.py:15: FutureWarning: You are using `torch.load` with `weights_only=False` (the current default value), which uses the default pickle module implicitly. It is possible to construct malicious pickle data which will execute arbitrary code during unpickling (See https://github.com/pytorch/pytorch/blob/main/SECURITY.md#untrusted-models for more details). In a future release, the default value for `weights_only` will be flipped to `True`. This limits the functions that could be executed during unpickling. Arbitrary objects will no longer be allowed to be loaded via this mode unless they are explicitly allowlisted by the user via `torch.serialization.add_safe_globals`. We recommend you start setting `weights_only=True` for any use case where you don't have full control of the loaded file. Please open an issue on GitHub for any issues related to this experimental feature.
  self.data, self.slices = torch.load(self.processed_paths[0])
