STDOUT:
Results will be saved in /home/philip/projects/ltspice_examples_code_repo/Circuit-Completion-Using-GNNs/component_classification_with_link_prediction_head/evaluation/FEGIN/results/model_FEGIN_dataset_ltspice_examples
Command line input: python main.py --data ltspice_examples --representation component_net --model FEGIN --layers 4 --hiddens 32 --batch_size 128 --lr 0.01 --emb_size 250 --epochs 100 --save_appendix component_net_L4_H32_BS128_LR0.01_E250 --no_val
 is saved.
-----
ltspice_examples - FEGIN
Using 4 layers, 32 hidden units, h = 2
Loading component_net representation dataset
ENTERED
Training FEGIN on component_net representation
Train: 3558, Test: 846
##################ITERATION #0 ****************************************
 epoch: 0, train_loss: 1.2478, test_loss: 1.2187, test_f1: 0.2887
 epoch: 1, train_loss: 1.0653, test_loss: 1.0264, test_f1: 0.4592
 epoch: 2, train_loss: 0.9982, test_loss: 0.9752, test_f1: 0.4741
 epoch: 3, train_loss: 0.9756, test_loss: 1.0696, test_f1: 0.4488
 epoch: 4, train_loss: 0.9544, test_loss: 0.9820, test_f1: 0.4866
 epoch: 5, train_loss: 0.9254, test_loss: 0.9472, test_f1: 0.4664
 epoch: 6, train_loss: 0.9340, test_loss: 0.9889, test_f1: 0.5328
 epoch: 7, train_loss: 0.9250, test_loss: 1.0101, test_f1: 0.5063
 epoch: 8, train_loss: 0.9061, test_loss: 1.0030, test_f1: 0.5185
 epoch: 9, train_loss: 0.9120, test_loss: 1.0126, test_f1: 0.4921
 epoch: 10, train_loss: 0.9034, test_loss: 0.9975, test_f1: 0.5222
 epoch: 11, train_loss: 0.8899, test_loss: 0.9957, test_f1: 0.5127
 epoch: 12, train_loss: 0.8779, test_loss: 1.0367, test_f1: 0.5578
 epoch: 13, train_loss: 0.8820, test_loss: 1.0124, test_f1: 0.5053
 epoch: 14, train_loss: 0.8681, test_loss: 1.0078, test_f1: 0.5230
 epoch: 15, train_loss: 0.8516, test_loss: 0.9577, test_f1: 0.5460
 epoch: 16, train_loss: 0.8584, test_loss: 0.9991, test_f1: 0.5588
 epoch: 17, train_loss: 0.8429, test_loss: 1.0225, test_f1: 0.5589
 epoch: 18, train_loss: 0.8412, test_loss: 1.0247, test_f1: 0.5130
 epoch: 19, train_loss: 0.8474, test_loss: 1.0325, test_f1: 0.5061
 epoch: 20, train_loss: 0.8251, test_loss: 1.0343, test_f1: 0.5451
 epoch: 21, train_loss: 0.8142, test_loss: 0.9996, test_f1: 0.5187
 epoch: 22, train_loss: 0.8280, test_loss: 1.1603, test_f1: 0.4697
 epoch: 23, train_loss: 0.8208, test_loss: 0.9956, test_f1: 0.5632
 epoch: 24, train_loss: 0.7970, test_loss: 1.0057, test_f1: 0.5875
 epoch: 25, train_loss: 0.7958, test_loss: 1.0124, test_f1: 0.5333
 epoch: 26, train_loss: 0.8252, test_loss: 1.0611, test_f1: 0.5531
 epoch: 27, train_loss: 0.8222, test_loss: 1.0059, test_f1: 0.5528
 epoch: 28, train_loss: 0.8063, test_loss: 1.0000, test_f1: 0.5730
 epoch: 29, train_loss: 0.7873, test_loss: 0.9113, test_f1: 0.5857
 epoch: 30, train_loss: 0.7868, test_loss: 1.0356, test_f1: 0.5142
 epoch: 31, train_loss: 0.7859, test_loss: 1.0433, test_f1: 0.5419
 epoch: 32, train_loss: 0.7684, test_loss: 1.1033, test_f1: 0.5200
 epoch: 33, train_loss: 0.7871, test_loss: 0.9821, test_f1: 0.5116
 epoch: 34, train_loss: 0.7699, test_loss: 1.0439, test_f1: 0.5602
 epoch: 35, train_loss: 0.7631, test_loss: 1.0525, test_f1: 0.5824
 epoch: 36, train_loss: 0.7694, test_loss: 1.0590, test_f1: 0.5807
 epoch: 37, train_loss: 0.7509, test_loss: 1.1059, test_f1: 0.5876
 epoch: 38, train_loss: 0.7644, test_loss: 1.0738, test_f1: 0.6160
 epoch: 39, train_loss: 0.7531, test_loss: 1.0339, test_f1: 0.6106
 epoch: 40, train_loss: 0.7421, test_loss: 0.9848, test_f1: 0.5860
 epoch: 41, train_loss: 0.7325, test_loss: 1.0373, test_f1: 0.5697
 epoch: 42, train_loss: 0.7346, test_loss: 1.0666, test_f1: 0.6195
 epoch: 43, train_loss: 0.7260, test_loss: 1.0454, test_f1: 0.6072
 epoch: 44, train_loss: 0.7247, test_loss: 1.1420, test_f1: 0.5963
 epoch: 45, train_loss: 0.7250, test_loss: 1.0405, test_f1: 0.6309
 epoch: 46, train_loss: 0.7175, test_loss: 1.1241, test_f1: 0.5943
 epoch: 47, train_loss: 0.7020, test_loss: 1.0759, test_f1: 0.6166
 epoch: 48, train_loss: 0.7086, test_loss: 1.0594, test_f1: 0.5958
 epoch: 49, train_loss: 0.7210, test_loss: 1.0478, test_f1: 0.6078
 epoch: 50, train_loss: 0.6897, test_loss: 1.0604, test_f1: 0.6226
 epoch: 51, train_loss: 0.6661, test_loss: 1.0896, test_f1: 0.6036
 epoch: 52, train_loss: 0.6466, test_loss: 0.9920, test_f1: 0.6370
 epoch: 53, train_loss: 0.6374, test_loss: 1.0350, test_f1: 0.6285
 epoch: 54, train_loss: 0.6370, test_loss: 1.1200, test_f1: 0.6335
 epoch: 55, train_loss: 0.6409, test_loss: 1.1189, test_f1: 0.6425
 epoch: 56, train_loss: 0.6097, test_loss: 1.2338, test_f1: 0.5892
 epoch: 57, train_loss: 0.6365, test_loss: 1.0859, test_f1: 0.6441
 epoch: 58, train_loss: 0.6212, test_loss: 1.1119, test_f1: 0.6307
 epoch: 59, train_loss: 0.6292, test_loss: 1.1450, test_f1: 0.6236
 epoch: 60, train_loss: 0.6107, test_loss: 1.2483, test_f1: 0.6089
 epoch: 61, train_loss: 0.6223, test_loss: 1.2028, test_f1: 0.6213
 epoch: 62, train_loss: 0.5981, test_loss: 1.1997, test_f1: 0.6515
 epoch: 63, train_loss: 0.6140, test_loss: 1.1681, test_f1: 0.6426
 epoch: 64, train_loss: 0.5960, test_loss: 1.1470, test_f1: 0.6379
 epoch: 65, train_loss: 0.5779, test_loss: 1.0951, test_f1: 0.6350
 epoch: 66, train_loss: 0.6074, test_loss: 1.2686, test_f1: 0.6075
 epoch: 67, train_loss: 0.6019, test_loss: 1.2256, test_f1: 0.6124
 epoch: 68, train_loss: 0.6084, test_loss: 1.1318, test_f1: 0.6445
 epoch: 69, train_loss: 0.6001, test_loss: 1.2235, test_f1: 0.6381
 epoch: 70, train_loss: 0.5879, test_loss: 1.1509, test_f1: 0.6678
 epoch: 71, train_loss: 0.5854, test_loss: 1.1898, test_f1: 0.6220
 epoch: 72, train_loss: 0.5565, test_loss: 1.1411, test_f1: 0.6578
 epoch: 73, train_loss: 0.5535, test_loss: 1.2421, test_f1: 0.6362
 epoch: 74, train_loss: 0.5595, test_loss: 1.3103, test_f1: 0.6077
 epoch: 75, train_loss: 0.5811, test_loss: 1.1177, test_f1: 0.6391
 epoch: 76, train_loss: 0.5593, test_loss: 1.1693, test_f1: 0.6201
 epoch: 77, train_loss: 0.5634, test_loss: 1.1898, test_f1: 0.6487
 epoch: 78, train_loss: 0.5723, test_loss: 1.1558, test_f1: 0.6373
 epoch: 79, train_loss: 0.5518, test_loss: 1.2970, test_f1: 0.6161
 epoch: 80, train_loss: 0.5733, test_loss: 1.2684, test_f1: 0.6212
 epoch: 81, train_loss: 0.5557, test_loss: 1.2967, test_f1: 0.6326
 epoch: 82, train_loss: 0.5623, test_loss: 1.2646, test_f1: 0.6300
 epoch: 83, train_loss: 0.5644, test_loss: 1.3056, test_f1: 0.6628
 epoch: 84, train_loss: 0.5439, test_loss: 1.3161, test_f1: 0.6261
 epoch: 85, train_loss: 0.5470, test_loss: 1.2801, test_f1: 0.6370
 epoch: 86, train_loss: 0.5427, test_loss: 1.2334, test_f1: 0.6506
 epoch: 87, train_loss: 0.5500, test_loss: 1.4214, test_f1: 0.6020
 epoch: 88, train_loss: 0.5355, test_loss: 1.3557, test_f1: 0.6173
 epoch: 89, train_loss: 0.5293, test_loss: 1.2826, test_f1: 0.6514
 epoch: 90, train_loss: 0.5466, test_loss: 1.2707, test_f1: 0.6348
 epoch: 91, train_loss: 0.5444, test_loss: 1.3961, test_f1: 0.6032
 epoch: 92, train_loss: 0.5219, test_loss: 1.3840, test_f1: 0.6217
 epoch: 93, train_loss: 0.5175, test_loss: 1.3477, test_f1: 0.6402
 epoch: 94, train_loss: 0.5095, test_loss: 1.4364, test_f1: 0.6206
 epoch: 95, train_loss: 0.5381, test_loss: 1.4394, test_f1: 0.6384
 epoch: 96, train_loss: 0.5311, test_loss: 1.3810, test_f1: 0.6455
 epoch: 97, train_loss: 0.5236, test_loss: 1.3545, test_f1: 0.6586
 epoch: 98, train_loss: 0.5171, test_loss: 1.3414, test_f1: 0.6053
 epoch: 99, train_loss: 0.5243, test_loss: 1.3286, test_f1: 0.6480
##################ITERATION #1 ****************************************
 epoch: 0, train_loss: 1.1998, test_loss: 1.1624, test_f1: 0.2936
 epoch: 1, train_loss: 1.0181, test_loss: 1.0223, test_f1: 0.4773
 epoch: 2, train_loss: 0.9865, test_loss: 0.9622, test_f1: 0.4895
 epoch: 3, train_loss: 0.9562, test_loss: 0.9849, test_f1: 0.4616
 epoch: 4, train_loss: 0.9458, test_loss: 1.0146, test_f1: 0.5127
 epoch: 5, train_loss: 0.9312, test_loss: 0.9735, test_f1: 0.4910
 epoch: 6, train_loss: 0.9103, test_loss: 0.9527, test_f1: 0.4724
 epoch: 7, train_loss: 0.9038, test_loss: 1.0132, test_f1: 0.5094
 epoch: 8, train_loss: 0.9173, test_loss: 0.9594, test_f1: 0.4871
 epoch: 9, train_loss: 0.8966, test_loss: 0.9372, test_f1: 0.5349
 epoch: 10, train_loss: 0.8976, test_loss: 1.0258, test_f1: 0.4749
 epoch: 11, train_loss: 0.8961, test_loss: 0.9351, test_f1: 0.5020
 epoch: 12, train_loss: 0.8809, test_loss: 0.9483, test_f1: 0.5314
 epoch: 13, train_loss: 0.8717, test_loss: 0.9194, test_f1: 0.5650
 epoch: 14, train_loss: 0.8692, test_loss: 0.9209, test_f1: 0.5661
 epoch: 15, train_loss: 0.8517, test_loss: 0.9334, test_f1: 0.5163
 epoch: 16, train_loss: 0.8474, test_loss: 0.9276, test_f1: 0.5250
 epoch: 17, train_loss: 0.8472, test_loss: 0.9336, test_f1: 0.5949
 epoch: 18, train_loss: 0.8472, test_loss: 0.9556, test_f1: 0.5155
 epoch: 19, train_loss: 0.8412, test_loss: 0.9021, test_f1: 0.5578
 epoch: 20, train_loss: 0.8344, test_loss: 0.9455, test_f1: 0.5536
 epoch: 21, train_loss: 0.8259, test_loss: 0.9072, test_f1: 0.5685
 epoch: 22, train_loss: 0.8013, test_loss: 0.9534, test_f1: 0.5299
 epoch: 23, train_loss: 0.8110, test_loss: 0.9181, test_f1: 0.5925
 epoch: 24, train_loss: 0.7884, test_loss: 0.8988, test_f1: 0.5452
 epoch: 25, train_loss: 0.7914, test_loss: 0.9159, test_f1: 0.5621
 epoch: 26, train_loss: 0.7896, test_loss: 0.9341, test_f1: 0.5957
 epoch: 27, train_loss: 0.7963, test_loss: 0.9034, test_f1: 0.5304
 epoch: 28, train_loss: 0.7737, test_loss: 0.9467, test_f1: 0.5815
 epoch: 29, train_loss: 0.7930, test_loss: 0.9622, test_f1: 0.5953
 epoch: 30, train_loss: 0.7913, test_loss: 0.8744, test_f1: 0.6111
 epoch: 31, train_loss: 0.7752, test_loss: 0.8720, test_f1: 0.5842
 epoch: 32, train_loss: 0.7805, test_loss: 0.8839, test_f1: 0.5465
 epoch: 33, train_loss: 0.7872, test_loss: 1.0457, test_f1: 0.5490
 epoch: 34, train_loss: 0.7672, test_loss: 0.9231, test_f1: 0.5932
 epoch: 35, train_loss: 0.7650, test_loss: 0.9253, test_f1: 0.6128
 epoch: 36, train_loss: 0.7629, test_loss: 0.9000, test_f1: 0.6234
 epoch: 37, train_loss: 0.7506, test_loss: 0.8852, test_f1: 0.6023
 epoch: 38, train_loss: 0.7569, test_loss: 0.8410, test_f1: 0.6084
 epoch: 39, train_loss: 0.7443, test_loss: 0.8814, test_f1: 0.6186
 epoch: 40, train_loss: 0.7164, test_loss: 0.8690, test_f1: 0.6488
 epoch: 41, train_loss: 0.7215, test_loss: 1.1422, test_f1: 0.5740
 epoch: 42, train_loss: 0.7322, test_loss: 0.9295, test_f1: 0.6140
 epoch: 43, train_loss: 0.7074, test_loss: 0.9919, test_f1: 0.6221
 epoch: 44, train_loss: 0.7255, test_loss: 0.9639, test_f1: 0.6033
 epoch: 45, train_loss: 0.7334, test_loss: 0.9275, test_f1: 0.5741
 epoch: 46, train_loss: 0.7193, test_loss: 0.9567, test_f1: 0.6253
 epoch: 47, train_loss: 0.7283, test_loss: 0.8396, test_f1: 0.6492
 epoch: 48, train_loss: 0.7061, test_loss: 0.9417, test_f1: 0.6325
 epoch: 49, train_loss: 0.7213, test_loss: 0.9421, test_f1: 0.6105
 epoch: 50, train_loss: 0.7149, test_loss: 0.9387, test_f1: 0.6574
 epoch: 51, train_loss: 0.6823, test_loss: 0.9229, test_f1: 0.6400
 epoch: 52, train_loss: 0.6533, test_loss: 0.9984, test_f1: 0.6196
 epoch: 53, train_loss: 0.6607, test_loss: 0.9097, test_f1: 0.6786
 epoch: 54, train_loss: 0.6613, test_loss: 0.9202, test_f1: 0.6373
 epoch: 55, train_loss: 0.6398, test_loss: 0.9049, test_f1: 0.6512
 epoch: 56, train_loss: 0.6212, test_loss: 1.0796, test_f1: 0.6235
 epoch: 57, train_loss: 0.6428, test_loss: 1.0296, test_f1: 0.6399
 epoch: 58, train_loss: 0.6297, test_loss: 0.9532, test_f1: 0.6673
 epoch: 59, train_loss: 0.6346, test_loss: 0.9816, test_f1: 0.6286
 epoch: 60, train_loss: 0.6119, test_loss: 1.0515, test_f1: 0.6454
 epoch: 61, train_loss: 0.6135, test_loss: 0.9911, test_f1: 0.6844
 epoch: 62, train_loss: 0.6117, test_loss: 0.9771, test_f1: 0.6579
 epoch: 63, train_loss: 0.6184, test_loss: 1.0230, test_f1: 0.6671
 epoch: 64, train_loss: 0.6131, test_loss: 1.1125, test_f1: 0.6367
 epoch: 65, train_loss: 0.6106, test_loss: 0.9987, test_f1: 0.6441
 epoch: 66, train_loss: 0.6106, test_loss: 1.0473, test_f1: 0.6613
 epoch: 67, train_loss: 0.6157, test_loss: 0.9757, test_f1: 0.6225
 epoch: 68, train_loss: 0.6209, test_loss: 1.1123, test_f1: 0.6466
 epoch: 69, train_loss: 0.6077, test_loss: 1.0475, test_f1: 0.6571
 epoch: 70, train_loss: 0.6069, test_loss: 1.0657, test_f1: 0.6670
 epoch: 71, train_loss: 0.5987, test_loss: 1.1195, test_f1: 0.6363
 epoch: 72, train_loss: 0.5945, test_loss: 1.0573, test_f1: 0.6360
 epoch: 73, train_loss: 0.5901, test_loss: 1.1062, test_f1: 0.6557
 epoch: 74, train_loss: 0.5773, test_loss: 1.1211, test_f1: 0.6577
 epoch: 75, train_loss: 0.5706, test_loss: 1.1060, test_f1: 0.6583
 epoch: 76, train_loss: 0.5732, test_loss: 1.0580, test_f1: 0.6449
 epoch: 77, train_loss: 0.5684, test_loss: 1.1504, test_f1: 0.6251
 epoch: 78, train_loss: 0.5776, test_loss: 1.1647, test_f1: 0.6314
 epoch: 79, train_loss: 0.5716, test_loss: 1.1202, test_f1: 0.6390
 epoch: 80, train_loss: 0.5592, test_loss: 1.1891, test_f1: 0.6434
 epoch: 81, train_loss: 0.5755, test_loss: 1.1652, test_f1: 0.6556
 epoch: 82, train_loss: 0.5776, test_loss: 1.1589, test_f1: 0.6489
 epoch: 83, train_loss: 0.5513, test_loss: 1.1227, test_f1: 0.6345
 epoch: 84, train_loss: 0.5649, test_loss: 1.1847, test_f1: 0.6298
 epoch: 85, train_loss: 0.5663, test_loss: 1.0695, test_f1: 0.6365
 epoch: 86, train_loss: 0.5532, test_loss: 1.1507, test_f1: 0.6677
 epoch: 87, train_loss: 0.5571, test_loss: 1.0822, test_f1: 0.6472
 epoch: 88, train_loss: 0.5735, test_loss: 1.0939, test_f1: 0.6641
 epoch: 89, train_loss: 0.5567, test_loss: 0.9976, test_f1: 0.6761
 epoch: 90, train_loss: 0.5587, test_loss: 1.0735, test_f1: 0.6533
 epoch: 91, train_loss: 0.5192, test_loss: 1.1025, test_f1: 0.6464
 epoch: 92, train_loss: 0.5480, test_loss: 1.1295, test_f1: 0.6718
 epoch: 93, train_loss: 0.5473, test_loss: 1.0585, test_f1: 0.6565
 epoch: 94, train_loss: 0.5385, test_loss: 1.1908, test_f1: 0.6576
 epoch: 95, train_loss: 0.5320, test_loss: 1.1281, test_f1: 0.6617
 epoch: 96, train_loss: 0.5320, test_loss: 1.1443, test_f1: 0.6827
 epoch: 97, train_loss: 0.5230, test_loss: 1.0967, test_f1: 0.6713
 epoch: 98, train_loss: 0.5385, test_loss: 1.1201, test_f1: 0.6595
 epoch: 99, train_loss: 0.5305, test_loss: 1.0618, test_f1: 0.6432
##################ITERATION #2 ****************************************
 epoch: 0, train_loss: 1.2359, test_loss: 1.2676, test_f1: 0.2821
 epoch: 1, train_loss: 1.0310, test_loss: 0.9776, test_f1: 0.4414
 epoch: 2, train_loss: 0.9793, test_loss: 0.9541, test_f1: 0.4908
 epoch: 3, train_loss: 0.9614, test_loss: 1.0183, test_f1: 0.4548
 epoch: 4, train_loss: 0.9406, test_loss: 0.9615, test_f1: 0.4633
 epoch: 5, train_loss: 0.9291, test_loss: 0.9940, test_f1: 0.4840
 epoch: 6, train_loss: 0.9276, test_loss: 0.9412, test_f1: 0.4936
 epoch: 7, train_loss: 0.9054, test_loss: 0.9594, test_f1: 0.4739
 epoch: 8, train_loss: 0.9116, test_loss: 0.9136, test_f1: 0.5334
 epoch: 9, train_loss: 0.8985, test_loss: 0.9541, test_f1: 0.5111
 epoch: 10, train_loss: 0.8902, test_loss: 0.9791, test_f1: 0.4972
 epoch: 11, train_loss: 0.8802, test_loss: 0.9224, test_f1: 0.5048
 epoch: 12, train_loss: 0.8669, test_loss: 1.0069, test_f1: 0.5521
 epoch: 13, train_loss: 0.8619, test_loss: 0.9298, test_f1: 0.4944
 epoch: 14, train_loss: 0.8490, test_loss: 0.9732, test_f1: 0.5370
 epoch: 15, train_loss: 0.8510, test_loss: 0.9726, test_f1: 0.5125
 epoch: 16, train_loss: 0.8451, test_loss: 1.0479, test_f1: 0.4728
 epoch: 17, train_loss: 0.8383, test_loss: 1.0007, test_f1: 0.5029
 epoch: 18, train_loss: 0.8341, test_loss: 1.0086, test_f1: 0.5205
 epoch: 19, train_loss: 0.8227, test_loss: 0.8588, test_f1: 0.5280
 epoch: 20, train_loss: 0.8157, test_loss: 1.1123, test_f1: 0.5266
 epoch: 21, train_loss: 0.7934, test_loss: 0.9112, test_f1: 0.5625
 epoch: 22, train_loss: 0.8178, test_loss: 1.0383, test_f1: 0.5183
 epoch: 23, train_loss: 0.8091, test_loss: 0.9654, test_f1: 0.5457
 epoch: 24, train_loss: 0.7966, test_loss: 0.9511, test_f1: 0.5430
 epoch: 25, train_loss: 0.7845, test_loss: 0.9730, test_f1: 0.5666
 epoch: 26, train_loss: 0.7750, test_loss: 0.9806, test_f1: 0.6016
 epoch: 27, train_loss: 0.7731, test_loss: 1.1261, test_f1: 0.5796
 epoch: 28, train_loss: 0.7581, test_loss: 0.9630, test_f1: 0.5627
 epoch: 29, train_loss: 0.7696, test_loss: 1.0667, test_f1: 0.5499
 epoch: 30, train_loss: 0.7649, test_loss: 0.9171, test_f1: 0.5384
 epoch: 31, train_loss: 0.7662, test_loss: 1.0202, test_f1: 0.5527
 epoch: 32, train_loss: 0.7509, test_loss: 0.8534, test_f1: 0.6175
 epoch: 33, train_loss: 0.7512, test_loss: 1.0705, test_f1: 0.5696
 epoch: 34, train_loss: 0.7661, test_loss: 1.0130, test_f1: 0.5546
 epoch: 35, train_loss: 0.7601, test_loss: 0.9569, test_f1: 0.5732
 epoch: 36, train_loss: 0.7607, test_loss: 1.0035, test_f1: 0.5127
 epoch: 37, train_loss: 0.7502, test_loss: 1.0299, test_f1: 0.5676
 epoch: 38, train_loss: 0.7646, test_loss: 0.8580, test_f1: 0.5233
 epoch: 39, train_loss: 0.7688, test_loss: 0.9469, test_f1: 0.5522
 epoch: 40, train_loss: 0.7401, test_loss: 0.9833, test_f1: 0.5959
 epoch: 41, train_loss: 0.7219, test_loss: 0.8925, test_f1: 0.5991
 epoch: 42, train_loss: 0.7214, test_loss: 1.0010, test_f1: 0.6029
 epoch: 43, train_loss: 0.7125, test_loss: 0.9741, test_f1: 0.6123
 epoch: 44, train_loss: 0.7163, test_loss: 0.9558, test_f1: 0.5721
 epoch: 45, train_loss: 0.7135, test_loss: 1.0297, test_f1: 0.6068
 epoch: 46, train_loss: 0.7062, test_loss: 1.1241, test_f1: 0.5550
 epoch: 47, train_loss: 0.7125, test_loss: 0.9603, test_f1: 0.6459
 epoch: 48, train_loss: 0.7000, test_loss: 0.9768, test_f1: 0.6026
 epoch: 49, train_loss: 0.6842, test_loss: 0.9900, test_f1: 0.5891
 epoch: 50, train_loss: 0.7010, test_loss: 0.9813, test_f1: 0.5956
 epoch: 51, train_loss: 0.6677, test_loss: 1.0558, test_f1: 0.6294
 epoch: 52, train_loss: 0.6539, test_loss: 0.9677, test_f1: 0.6553
 epoch: 53, train_loss: 0.6433, test_loss: 1.0069, test_f1: 0.6346
 epoch: 54, train_loss: 0.6367, test_loss: 1.0082, test_f1: 0.6067
 epoch: 55, train_loss: 0.6402, test_loss: 0.9876, test_f1: 0.6129
 epoch: 56, train_loss: 0.6244, test_loss: 1.0879, test_f1: 0.6237
 epoch: 57, train_loss: 0.6242, test_loss: 0.9955, test_f1: 0.6159
 epoch: 58, train_loss: 0.6227, test_loss: 1.0711, test_f1: 0.6348
 epoch: 59, train_loss: 0.6240, test_loss: 1.0026, test_f1: 0.6101
 epoch: 60, train_loss: 0.6314, test_loss: 1.0268, test_f1: 0.6362
 epoch: 61, train_loss: 0.6244, test_loss: 0.9367, test_f1: 0.6182
 epoch: 62, train_loss: 0.6122, test_loss: 1.0094, test_f1: 0.6219
 epoch: 63, train_loss: 0.6121, test_loss: 1.0521, test_f1: 0.6410
 epoch: 64, train_loss: 0.6244, test_loss: 1.0757, test_f1: 0.6151
 epoch: 65, train_loss: 0.6157, test_loss: 1.1856, test_f1: 0.6105
 epoch: 66, train_loss: 0.6270, test_loss: 1.0641, test_f1: 0.6107
 epoch: 67, train_loss: 0.5983, test_loss: 1.0888, test_f1: 0.6278
 epoch: 68, train_loss: 0.5846, test_loss: 1.1223, test_f1: 0.6511
 epoch: 69, train_loss: 0.6045, test_loss: 0.9485, test_f1: 0.6476
 epoch: 70, train_loss: 0.6066, test_loss: 1.1675, test_f1: 0.6273
 epoch: 71, train_loss: 0.5912, test_loss: 1.1420, test_f1: 0.6408
 epoch: 72, train_loss: 0.6039, test_loss: 1.1246, test_f1: 0.6451
 epoch: 73, train_loss: 0.5828, test_loss: 1.2531, test_f1: 0.6379
 epoch: 74, train_loss: 0.5922, test_loss: 1.0837, test_f1: 0.6486
 epoch: 75, train_loss: 0.5850, test_loss: 1.1219, test_f1: 0.6115
 epoch: 76, train_loss: 0.5928, test_loss: 1.0923, test_f1: 0.6489
 epoch: 77, train_loss: 0.5857, test_loss: 1.1939, test_f1: 0.6452
 epoch: 78, train_loss: 0.5786, test_loss: 1.0763, test_f1: 0.6254
 epoch: 79, train_loss: 0.5913, test_loss: 1.1861, test_f1: 0.6573
 epoch: 80, train_loss: 0.5774, test_loss: 1.1316, test_f1: 0.6154
 epoch: 81, train_loss: 0.5891, test_loss: 1.1317, test_f1: 0.6403
 epoch: 82, train_loss: 0.5900, test_loss: 1.0349, test_f1: 0.6693
 epoch: 83, train_loss: 0.5671, test_loss: 1.0894, test_f1: 0.6225
 epoch: 84, train_loss: 0.5754, test_loss: 1.1943, test_f1: 0.6442
 epoch: 85, train_loss: 0.5676, test_loss: 1.0858, test_f1: 0.6525
 epoch: 86, train_loss: 0.5775, test_loss: 1.1628, test_f1: 0.6247
 epoch: 87, train_loss: 0.5679, test_loss: 1.2772, test_f1: 0.6632
 epoch: 88, train_loss: 0.5607, test_loss: 1.0658, test_f1: 0.6453
 epoch: 89, train_loss: 0.5547, test_loss: 1.1518, test_f1: 0.6514
 epoch: 90, train_loss: 0.5656, test_loss: 1.0883, test_f1: 0.6328
 epoch: 91, train_loss: 0.5836, test_loss: 1.0836, test_f1: 0.6440
 epoch: 92, train_loss: 0.5619, test_loss: 1.0770, test_f1: 0.6058
 epoch: 93, train_loss: 0.5525, test_loss: 1.1690, test_f1: 0.6549
 epoch: 94, train_loss: 0.5559, test_loss: 1.2355, test_f1: 0.6485
 epoch: 95, train_loss: 0.5515, test_loss: 1.3593, test_f1: 0.5952
 epoch: 96, train_loss: 0.5625, test_loss: 1.2755, test_f1: 0.6144
 epoch: 97, train_loss: 0.5579, test_loss: 1.0332, test_f1: 0.6417
 epoch: 98, train_loss: 0.5481, test_loss: 1.2526, test_f1: 0.6393
 epoch: 99, train_loss: 0.5375, test_loss: 1.0252, test_f1: 0.6114
##################ITERATION #3 ****************************************
 epoch: 0, train_loss: 1.2719, test_loss: 1.3142, test_f1: 0.2410
 epoch: 1, train_loss: 1.1027, test_loss: 1.1290, test_f1: 0.3801
 epoch: 2, train_loss: 1.0202, test_loss: 1.0077, test_f1: 0.4639
 epoch: 3, train_loss: 1.0062, test_loss: 0.9703, test_f1: 0.4735
 epoch: 4, train_loss: 0.9550, test_loss: 1.9475, test_f1: 0.4466
 epoch: 5, train_loss: 0.9398, test_loss: 0.9450, test_f1: 0.4734
 epoch: 6, train_loss: 0.9371, test_loss: 0.9164, test_f1: 0.4859
 epoch: 7, train_loss: 0.9218, test_loss: 0.9239, test_f1: 0.5385
 epoch: 8, train_loss: 0.9158, test_loss: 1.0529, test_f1: 0.4732
 epoch: 9, train_loss: 0.8917, test_loss: 0.9453, test_f1: 0.5501
 epoch: 10, train_loss: 0.8903, test_loss: 0.9513, test_f1: 0.4963
 epoch: 11, train_loss: 0.8874, test_loss: 0.8752, test_f1: 0.5192
 epoch: 12, train_loss: 0.8724, test_loss: 0.9628, test_f1: 0.5739
 epoch: 13, train_loss: 0.8678, test_loss: 1.0395, test_f1: 0.5196
 epoch: 14, train_loss: 0.8416, test_loss: 0.9456, test_f1: 0.5459
 epoch: 15, train_loss: 0.8578, test_loss: 0.9062, test_f1: 0.5121
 epoch: 16, train_loss: 0.8598, test_loss: 0.9764, test_f1: 0.4994
 epoch: 17, train_loss: 0.8600, test_loss: 0.9337, test_f1: 0.5512
 epoch: 18, train_loss: 0.8623, test_loss: 1.0035, test_f1: 0.5156
 epoch: 19, train_loss: 0.8327, test_loss: 0.9335, test_f1: 0.5065
 epoch: 20, train_loss: 0.8243, test_loss: 0.9735, test_f1: 0.5634
 epoch: 21, train_loss: 0.8182, test_loss: 1.0383, test_f1: 0.5178
 epoch: 22, train_loss: 0.8130, test_loss: 0.9214, test_f1: 0.5613
 epoch: 23, train_loss: 0.8151, test_loss: 1.0273, test_f1: 0.5192
 epoch: 24, train_loss: 0.8182, test_loss: 0.9964, test_f1: 0.4864
 epoch: 25, train_loss: 0.8111, test_loss: 0.9513, test_f1: 0.5767
 epoch: 26, train_loss: 0.8052, test_loss: 0.9610, test_f1: 0.5951
 epoch: 27, train_loss: 0.7915, test_loss: 0.9518, test_f1: 0.5713
 epoch: 28, train_loss: 0.7801, test_loss: 0.9815, test_f1: 0.5625
 epoch: 29, train_loss: 0.7780, test_loss: 1.0466, test_f1: 0.4985
 epoch: 30, train_loss: 0.7806, test_loss: 0.9715, test_f1: 0.5866
 epoch: 31, train_loss: 0.7791, test_loss: 0.9767, test_f1: 0.5751
 epoch: 32, train_loss: 0.7634, test_loss: 0.9530, test_f1: 0.5869
 epoch: 33, train_loss: 0.7581, test_loss: 0.9155, test_f1: 0.6197
 epoch: 34, train_loss: 0.7370, test_loss: 0.9672, test_f1: 0.5988
 epoch: 35, train_loss: 0.7453, test_loss: 1.0616, test_f1: 0.5333
 epoch: 36, train_loss: 0.7294, test_loss: 1.0196, test_f1: 0.5761
 epoch: 37, train_loss: 0.7308, test_loss: 0.9616, test_f1: 0.5823
 epoch: 38, train_loss: 0.7630, test_loss: 0.9215, test_f1: 0.6012
 epoch: 39, train_loss: 0.7596, test_loss: 1.0159, test_f1: 0.5855
 epoch: 40, train_loss: 0.7580, test_loss: 1.0172, test_f1: 0.5660
 epoch: 41, train_loss: 0.7504, test_loss: 0.9246, test_f1: 0.5915
 epoch: 42, train_loss: 0.7358, test_loss: 0.9334, test_f1: 0.6372
 epoch: 43, train_loss: 0.7174, test_loss: 1.1064, test_f1: 0.5528
 epoch: 44, train_loss: 0.7512, test_loss: 1.1198, test_f1: 0.5761
 epoch: 45, train_loss: 0.7432, test_loss: 1.0671, test_f1: 0.5681
 epoch: 46, train_loss: 0.7381, test_loss: 0.9952, test_f1: 0.5710
 epoch: 47, train_loss: 0.7414, test_loss: 1.2292, test_f1: 0.5700
 epoch: 48, train_loss: 0.7301, test_loss: 0.9970, test_f1: 0.6259
 epoch: 49, train_loss: 0.7149, test_loss: 1.0290, test_f1: 0.6310
 epoch: 50, train_loss: 0.6948, test_loss: 1.0565, test_f1: 0.6165
 epoch: 51, train_loss: 0.6799, test_loss: 0.9906, test_f1: 0.6165
 epoch: 52, train_loss: 0.6668, test_loss: 1.0270, test_f1: 0.6230
 epoch: 53, train_loss: 0.6568, test_loss: 1.0536, test_f1: 0.6626
 epoch: 54, train_loss: 0.6435, test_loss: 1.0641, test_f1: 0.6210
 epoch: 55, train_loss: 0.6535, test_loss: 1.1734, test_f1: 0.6022
 epoch: 56, train_loss: 0.6430, test_loss: 1.0044, test_f1: 0.6547
 epoch: 57, train_loss: 0.6525, test_loss: 1.1031, test_f1: 0.6298
 epoch: 58, train_loss: 0.6678, test_loss: 1.1798, test_f1: 0.6189
 epoch: 59, train_loss: 0.6397, test_loss: 1.0327, test_f1: 0.6315
 epoch: 60, train_loss: 0.6334, test_loss: 1.2043, test_f1: 0.6249
 epoch: 61, train_loss: 0.6353, test_loss: 1.1241, test_f1: 0.6254
 epoch: 62, train_loss: 0.6234, test_loss: 1.0792, test_f1: 0.6269
 epoch: 63, train_loss: 0.6447, test_loss: 1.0824, test_f1: 0.6589
 epoch: 64, train_loss: 0.6217, test_loss: 1.1305, test_f1: 0.6512
 epoch: 65, train_loss: 0.6310, test_loss: 1.1251, test_f1: 0.6526
 epoch: 66, train_loss: 0.6121, test_loss: 1.1615, test_f1: 0.6213
 epoch: 67, train_loss: 0.6117, test_loss: 1.1641, test_f1: 0.6490
 epoch: 68, train_loss: 0.6150, test_loss: 1.1418, test_f1: 0.6450
 epoch: 69, train_loss: 0.6242, test_loss: 0.9817, test_f1: 0.6433
 epoch: 70, train_loss: 0.6093, test_loss: 1.0989, test_f1: 0.6472
 epoch: 71, train_loss: 0.6044, test_loss: 1.2155, test_f1: 0.6293
 epoch: 72, train_loss: 0.6299, test_loss: 1.1562, test_f1: 0.6173
 epoch: 73, train_loss: 0.5944, test_loss: 1.0934, test_f1: 0.6388
 epoch: 74, train_loss: 0.5978, test_loss: 1.1148, test_f1: 0.6312
 epoch: 75, train_loss: 0.5986, test_loss: 1.2005, test_f1: 0.6323
 epoch: 76, train_loss: 0.5880, test_loss: 1.0703, test_f1: 0.6488
 epoch: 77, train_loss: 0.5980, test_loss: 1.1934, test_f1: 0.6691
 epoch: 78, train_loss: 0.5971, test_loss: 1.1658, test_f1: 0.6477
 epoch: 79, train_loss: 0.5970, test_loss: 1.2270, test_f1: 0.6355
 epoch: 80, train_loss: 0.5802, test_loss: 1.1945, test_f1: 0.6433
 epoch: 81, train_loss: 0.5743, test_loss: 1.1245, test_f1: 0.6500
 epoch: 82, train_loss: 0.5738, test_loss: 1.1176, test_f1: 0.6596
 epoch: 83, train_loss: 0.5813, test_loss: 1.1867, test_f1: 0.6382
 epoch: 84, train_loss: 0.5776, test_loss: 1.2026, test_f1: 0.6260
 epoch: 85, train_loss: 0.5683, test_loss: 1.1825, test_f1: 0.6412
 epoch: 86, train_loss: 0.5845, test_loss: 1.2335, test_f1: 0.6288
 epoch: 87, train_loss: 0.5709, test_loss: 1.1302, test_f1: 0.6524
 epoch: 88, train_loss: 0.5682, test_loss: 1.2622, test_f1: 0.6228
 epoch: 89, train_loss: 0.5675, test_loss: 1.1948, test_f1: 0.6405
 epoch: 90, train_loss: 0.5667, test_loss: 1.2588, test_f1: 0.6429
 epoch: 91, train_loss: 0.5565, test_loss: 1.2834, test_f1: 0.6336
 epoch: 92, train_loss: 0.5436, test_loss: 1.1927, test_f1: 0.6572
 epoch: 93, train_loss: 0.5428, test_loss: 1.1728, test_f1: 0.6287
 epoch: 94, train_loss: 0.5516, test_loss: 1.1964, test_f1: 0.6475
 epoch: 95, train_loss: 0.5413, test_loss: 1.1965, test_f1: 0.6600
 epoch: 96, train_loss: 0.5383, test_loss: 1.1055, test_f1: 0.6653
 epoch: 97, train_loss: 0.5525, test_loss: 1.2879, test_f1: 0.6079
 epoch: 98, train_loss: 0.5532, test_loss: 1.3597, test_f1: 0.6768
 epoch: 99, train_loss: 0.5417, test_loss: 1.2027, test_f1: 0.6732
##################ITERATION #4 ****************************************
 epoch: 0, train_loss: 1.2813, test_loss: 1.3169, test_f1: 0.2871
 epoch: 1, train_loss: 1.0504, test_loss: 1.0201, test_f1: 0.4937
 epoch: 2, train_loss: 1.0124, test_loss: 1.0173, test_f1: 0.4839
 epoch: 3, train_loss: 0.9804, test_loss: 1.0093, test_f1: 0.4994
 epoch: 4, train_loss: 0.9600, test_loss: 1.0453, test_f1: 0.4889
 epoch: 5, train_loss: 0.9505, test_loss: 1.0202, test_f1: 0.5043
 epoch: 6, train_loss: 0.9356, test_loss: 1.0502, test_f1: 0.4800
 epoch: 7, train_loss: 0.9447, test_loss: 0.9747, test_f1: 0.5300
 epoch: 8, train_loss: 0.9223, test_loss: 1.0000, test_f1: 0.4834
 epoch: 9, train_loss: 0.9085, test_loss: 1.0056, test_f1: 0.5094
 epoch: 10, train_loss: 0.9157, test_loss: 1.0431, test_f1: 0.5049
 epoch: 11, train_loss: 0.8959, test_loss: 1.0377, test_f1: 0.5051
 epoch: 12, train_loss: 0.8879, test_loss: 0.9448, test_f1: 0.5408
 epoch: 13, train_loss: 0.8979, test_loss: 0.9693, test_f1: 0.5060
 epoch: 14, train_loss: 0.8800, test_loss: 1.0005, test_f1: 0.5686
 epoch: 15, train_loss: 0.8799, test_loss: 0.9794, test_f1: 0.5519
 epoch: 16, train_loss: 0.8638, test_loss: 1.0068, test_f1: 0.5167
 epoch: 17, train_loss: 0.8751, test_loss: 0.9722, test_f1: 0.5721
 epoch: 18, train_loss: 0.8492, test_loss: 1.0179, test_f1: 0.5220
 epoch: 19, train_loss: 0.8409, test_loss: 1.0031, test_f1: 0.5552
 epoch: 20, train_loss: 0.8402, test_loss: 1.0075, test_f1: 0.5544
 epoch: 21, train_loss: 0.8352, test_loss: 0.9837, test_f1: 0.5642
 epoch: 22, train_loss: 0.8347, test_loss: 1.0565, test_f1: 0.5627
 epoch: 23, train_loss: 0.8193, test_loss: 0.9376, test_f1: 0.5851
 epoch: 24, train_loss: 0.8179, test_loss: 0.9873, test_f1: 0.5748
 epoch: 25, train_loss: 0.8339, test_loss: 1.0008, test_f1: 0.5737
 epoch: 26, train_loss: 0.8099, test_loss: 1.0751, test_f1: 0.5170
 epoch: 27, train_loss: 0.8133, test_loss: 0.9674, test_f1: 0.5407
 epoch: 28, train_loss: 0.8135, test_loss: 0.9989, test_f1: 0.5863
 epoch: 29, train_loss: 0.8045, test_loss: 0.9773, test_f1: 0.5529
 epoch: 30, train_loss: 0.7828, test_loss: 0.9983, test_f1: 0.6046
 epoch: 31, train_loss: 0.7882, test_loss: 0.9630, test_f1: 0.5706
 epoch: 32, train_loss: 0.7910, test_loss: 0.9812, test_f1: 0.5410
 epoch: 33, train_loss: 0.7999, test_loss: 0.9499, test_f1: 0.6017
 epoch: 34, train_loss: 0.7773, test_loss: 0.9478, test_f1: 0.5683
 epoch: 35, train_loss: 0.7778, test_loss: 1.0269, test_f1: 0.5622
 epoch: 36, train_loss: 0.7932, test_loss: 0.9473, test_f1: 0.6025
 epoch: 37, train_loss: 0.7641, test_loss: 1.0081, test_f1: 0.5793
 epoch: 38, train_loss: 0.7688, test_loss: 0.9826, test_f1: 0.5881
 epoch: 39, train_loss: 0.7609, test_loss: 0.9972, test_f1: 0.5807
 epoch: 40, train_loss: 0.7678, test_loss: 0.9616, test_f1: 0.6277
 epoch: 41, train_loss: 0.7677, test_loss: 1.0269, test_f1: 0.5353
 epoch: 42, train_loss: 0.7758, test_loss: 1.0186, test_f1: 0.5746
 epoch: 43, train_loss: 0.7692, test_loss: 0.9595, test_f1: 0.5868
 epoch: 44, train_loss: 0.7737, test_loss: 0.9541, test_f1: 0.6215
 epoch: 45, train_loss: 0.7572, test_loss: 0.9943, test_f1: 0.6250
 epoch: 46, train_loss: 0.7457, test_loss: 1.0140, test_f1: 0.6265
 epoch: 47, train_loss: 0.7437, test_loss: 0.9570, test_f1: 0.6059
 epoch: 48, train_loss: 0.7376, test_loss: 0.9645, test_f1: 0.5870
 epoch: 49, train_loss: 0.7307, test_loss: 1.0155, test_f1: 0.6050
 epoch: 50, train_loss: 0.7454, test_loss: 0.9913, test_f1: 0.6005
 epoch: 51, train_loss: 0.7212, test_loss: 0.9470, test_f1: 0.6615
 epoch: 52, train_loss: 0.7053, test_loss: 0.9543, test_f1: 0.6322
 epoch: 53, train_loss: 0.6902, test_loss: 0.9471, test_f1: 0.6474
 epoch: 54, train_loss: 0.6843, test_loss: 1.0092, test_f1: 0.6252
 epoch: 55, train_loss: 0.6664, test_loss: 1.0290, test_f1: 0.6349
 epoch: 56, train_loss: 0.7039, test_loss: 0.9979, test_f1: 0.6335
 epoch: 57, train_loss: 0.6882, test_loss: 0.9519, test_f1: 0.6531
 epoch: 58, train_loss: 0.6764, test_loss: 0.9908, test_f1: 0.6322
 epoch: 59, train_loss: 0.6769, test_loss: 1.0255, test_f1: 0.6306
 epoch: 60, train_loss: 0.6669, test_loss: 1.0547, test_f1: 0.6467
 epoch: 61, train_loss: 0.6655, test_loss: 0.9821, test_f1: 0.6302
 epoch: 62, train_loss: 0.6586, test_loss: 1.0359, test_f1: 0.6162
 epoch: 63, train_loss: 0.6656, test_loss: 1.0615, test_f1: 0.6585
 epoch: 64, train_loss: 0.6699, test_loss: 0.9647, test_f1: 0.6630
 epoch: 65, train_loss: 0.6499, test_loss: 1.0505, test_f1: 0.6222
 epoch: 66, train_loss: 0.6488, test_loss: 1.0400, test_f1: 0.6187
 epoch: 67, train_loss: 0.6460, test_loss: 1.0507, test_f1: 0.6219
 epoch: 68, train_loss: 0.6571, test_loss: 1.0452, test_f1: 0.6275
 epoch: 69, train_loss: 0.6655, test_loss: 1.0193, test_f1: 0.6347
 epoch: 70, train_loss: 0.6493, test_loss: 1.0505, test_f1: 0.6278
 epoch: 71, train_loss: 0.6470, test_loss: 1.0379, test_f1: 0.6663
 epoch: 72, train_loss: 0.6349, test_loss: 1.0106, test_f1: 0.6689
 epoch: 73, train_loss: 0.6519, test_loss: 1.0540, test_f1: 0.6525
 epoch: 74, train_loss: 0.6323, test_loss: 1.0662, test_f1: 0.6462
 epoch: 75, train_loss: 0.6127, test_loss: 1.1332, test_f1: 0.6114
 epoch: 76, train_loss: 0.6447, test_loss: 1.0360, test_f1: 0.6638
 epoch: 77, train_loss: 0.6080, test_loss: 1.0602, test_f1: 0.6372
 epoch: 78, train_loss: 0.6274, test_loss: 1.0402, test_f1: 0.6421
 epoch: 79, train_loss: 0.6276, test_loss: 1.1147, test_f1: 0.6659
 epoch: 80, train_loss: 0.6302, test_loss: 1.0610, test_f1: 0.6296
 epoch: 81, train_loss: 0.6315, test_loss: 1.0541, test_f1: 0.6466
 epoch: 82, train_loss: 0.6380, test_loss: 1.1188, test_f1: 0.6120
 epoch: 83, train_loss: 0.6221, test_loss: 1.0434, test_f1: 0.6483
 epoch: 84, train_loss: 0.6138, test_loss: 1.1027, test_f1: 0.6127
 epoch: 85, train_loss: 0.6114, test_loss: 1.1966, test_f1: 0.6485
 epoch: 86, train_loss: 0.6097, test_loss: 1.0454, test_f1: 0.6638
 epoch: 87, train_loss: 0.6155, test_loss: 1.1246, test_f1: 0.6240
 epoch: 88, train_loss: 0.6192, test_loss: 1.1529, test_f1: 0.6331
 epoch: 89, train_loss: 0.6068, test_loss: 1.1018, test_f1: 0.6506
 epoch: 90, train_loss: 0.6041, test_loss: 1.1711, test_f1: 0.6186
 epoch: 91, train_loss: 0.5988, test_loss: 1.0897, test_f1: 0.6285
 epoch: 92, train_loss: 0.6219, test_loss: 1.1290, test_f1: 0.6468
 epoch: 93, train_loss: 0.5972, test_loss: 1.1989, test_f1: 0.6264
 epoch: 94, train_loss: 0.5859, test_loss: 1.1368, test_f1: 0.6388
 epoch: 95, train_loss: 0.5759, test_loss: 1.1271, test_f1: 0.6364
 epoch: 96, train_loss: 0.6290, test_loss: 1.1154, test_f1: 0.6112
 epoch: 97, train_loss: 0.5962, test_loss: 1.1505, test_f1: 0.6211
 epoch: 98, train_loss: 0.5832, test_loss: 1.2051, test_f1: 0.6660
 epoch: 99, train_loss: 0.5847, test_loss: 1.1223, test_f1: 0.6095
##################ITERATION #5 ****************************************
 epoch: 0, train_loss: 1.2422, test_loss: 1.3281, test_f1: 0.2563
 epoch: 1, train_loss: 1.0596, test_loss: 1.0319, test_f1: 0.4722
 epoch: 2, train_loss: 1.0104, test_loss: 1.0247, test_f1: 0.4825
 epoch: 3, train_loss: 0.9823, test_loss: 1.0218, test_f1: 0.5098
 epoch: 4, train_loss: 0.9648, test_loss: 1.0035, test_f1: 0.5134
 epoch: 5, train_loss: 0.9451, test_loss: 0.9992, test_f1: 0.4756
 epoch: 6, train_loss: 0.9583, test_loss: 1.5450, test_f1: 0.2982
 epoch: 7, train_loss: 0.9397, test_loss: 1.0394, test_f1: 0.4396
 epoch: 8, train_loss: 0.9245, test_loss: 0.9818, test_f1: 0.5059
 epoch: 9, train_loss: 0.9121, test_loss: 0.9578, test_f1: 0.5155
 epoch: 10, train_loss: 0.9111, test_loss: 1.0040, test_f1: 0.4936
 epoch: 11, train_loss: 0.8947, test_loss: 0.9723, test_f1: 0.4958
 epoch: 12, train_loss: 0.8908, test_loss: 1.0208, test_f1: 0.5030
 epoch: 13, train_loss: 0.8897, test_loss: 0.9615, test_f1: 0.5676
 epoch: 14, train_loss: 0.8773, test_loss: 1.0636, test_f1: 0.4822
 epoch: 15, train_loss: 0.8837, test_loss: 1.0207, test_f1: 0.5118
 epoch: 16, train_loss: 0.8714, test_loss: 0.9404, test_f1: 0.5033
 epoch: 17, train_loss: 0.8597, test_loss: 0.9564, test_f1: 0.5034
 epoch: 18, train_loss: 0.8565, test_loss: 0.9716, test_f1: 0.5412
 epoch: 19, train_loss: 0.8433, test_loss: 1.0451, test_f1: 0.4694
 epoch: 20, train_loss: 0.8492, test_loss: 1.0077, test_f1: 0.5130
 epoch: 21, train_loss: 0.8781, test_loss: 1.1386, test_f1: 0.4413
 epoch: 22, train_loss: 0.9355, test_loss: 1.0298, test_f1: 0.5316
 epoch: 23, train_loss: 0.8815, test_loss: 0.9428, test_f1: 0.5562
 epoch: 24, train_loss: 0.8717, test_loss: 0.9319, test_f1: 0.5735
 epoch: 25, train_loss: 0.8526, test_loss: 0.9037, test_f1: 0.5408
 epoch: 26, train_loss: 0.8571, test_loss: 0.9479, test_f1: 0.5384
 epoch: 27, train_loss: 0.8459, test_loss: 0.9834, test_f1: 0.5438
 epoch: 28, train_loss: 0.8256, test_loss: 0.9556, test_f1: 0.5638
 epoch: 29, train_loss: 0.8316, test_loss: 0.9026, test_f1: 0.5587
 epoch: 30, train_loss: 0.7949, test_loss: 0.9144, test_f1: 0.5331
 epoch: 31, train_loss: 0.8140, test_loss: 0.9139, test_f1: 0.5472
 epoch: 32, train_loss: 0.7802, test_loss: 0.9819, test_f1: 0.5723
 epoch: 33, train_loss: 0.8007, test_loss: 0.9831, test_f1: 0.5361
 epoch: 34, train_loss: 0.7840, test_loss: 0.9093, test_f1: 0.5660
 epoch: 35, train_loss: 0.7925, test_loss: 1.1157, test_f1: 0.5158
 epoch: 36, train_loss: 0.8176, test_loss: 0.9152, test_f1: 0.5641
 epoch: 37, train_loss: 0.7781, test_loss: 0.9552, test_f1: 0.5267
 epoch: 38, train_loss: 0.7562, test_loss: 0.9247, test_f1: 0.5541
 epoch: 39, train_loss: 0.7582, test_loss: 0.9071, test_f1: 0.6234
 epoch: 40, train_loss: 0.7992, test_loss: 0.8976, test_f1: 0.5351
 epoch: 41, train_loss: 0.7596, test_loss: 0.9534, test_f1: 0.6336
 epoch: 42, train_loss: 0.7541, test_loss: 0.9153, test_f1: 0.5962
 epoch: 43, train_loss: 0.7466, test_loss: 0.9520, test_f1: 0.5438
 epoch: 44, train_loss: 0.7390, test_loss: 0.8363, test_f1: 0.5855
 epoch: 45, train_loss: 0.7331, test_loss: 0.8681, test_f1: 0.6042
 epoch: 46, train_loss: 0.7542, test_loss: 0.9442, test_f1: 0.5239
 epoch: 47, train_loss: 0.7514, test_loss: 0.8940, test_f1: 0.6317
 epoch: 48, train_loss: 0.7376, test_loss: 0.9714, test_f1: 0.5697
 epoch: 49, train_loss: 0.7250, test_loss: 0.9297, test_f1: 0.6196
 epoch: 50, train_loss: 0.7132, test_loss: 0.8983, test_f1: 0.5873
 epoch: 51, train_loss: 0.6951, test_loss: 0.8827, test_f1: 0.6193
 epoch: 52, train_loss: 0.6776, test_loss: 0.9093, test_f1: 0.6386
 epoch: 53, train_loss: 0.6647, test_loss: 0.9645, test_f1: 0.6077
 epoch: 54, train_loss: 0.6653, test_loss: 0.9170, test_f1: 0.6182
 epoch: 55, train_loss: 0.6357, test_loss: 0.9186, test_f1: 0.6201
 epoch: 56, train_loss: 0.6695, test_loss: 1.0871, test_f1: 0.6192
 epoch: 57, train_loss: 0.6766, test_loss: 0.9469, test_f1: 0.5754
 epoch: 58, train_loss: 0.6427, test_loss: 0.9416, test_f1: 0.6298
 epoch: 59, train_loss: 0.6404, test_loss: 0.9080, test_f1: 0.6279
 epoch: 60, train_loss: 0.6387, test_loss: 0.9084, test_f1: 0.6109
 epoch: 61, train_loss: 0.6493, test_loss: 0.8345, test_f1: 0.6302
 epoch: 62, train_loss: 0.6373, test_loss: 0.9124, test_f1: 0.6357
 epoch: 63, train_loss: 0.6333, test_loss: 0.9241, test_f1: 0.6133
 epoch: 64, train_loss: 0.6315, test_loss: 0.9267, test_f1: 0.6380
 epoch: 65, train_loss: 0.6350, test_loss: 0.8888, test_f1: 0.6227
 epoch: 66, train_loss: 0.6217, test_loss: 0.9040, test_f1: 0.6672
 epoch: 67, train_loss: 0.6152, test_loss: 0.8814, test_f1: 0.6239
 epoch: 68, train_loss: 0.6337, test_loss: 0.8968, test_f1: 0.6145
 epoch: 69, train_loss: 0.6188, test_loss: 0.9658, test_f1: 0.6293
 epoch: 70, train_loss: 0.6213, test_loss: 0.9975, test_f1: 0.6166
 epoch: 71, train_loss: 0.6489, test_loss: 0.9728, test_f1: 0.6215
 epoch: 72, train_loss: 0.6348, test_loss: 0.9061, test_f1: 0.6601
 epoch: 73, train_loss: 0.6091, test_loss: 0.9670, test_f1: 0.6162
 epoch: 74, train_loss: 0.6088, test_loss: 1.0118, test_f1: 0.6073
 epoch: 75, train_loss: 0.5979, test_loss: 0.9520, test_f1: 0.6497
 epoch: 76, train_loss: 0.6078, test_loss: 0.9423, test_f1: 0.6192
 epoch: 77, train_loss: 0.5943, test_loss: 1.0307, test_f1: 0.6187
 epoch: 78, train_loss: 0.6235, test_loss: 1.0726, test_f1: 0.5874
 epoch: 79, train_loss: 0.6090, test_loss: 0.9513, test_f1: 0.6091
 epoch: 80, train_loss: 0.5896, test_loss: 0.9548, test_f1: 0.6474
 epoch: 81, train_loss: 0.5937, test_loss: 1.0635, test_f1: 0.6246
 epoch: 82, train_loss: 0.5836, test_loss: 1.0335, test_f1: 0.6114
 epoch: 83, train_loss: 0.5875, test_loss: 0.9612, test_f1: 0.6525
 epoch: 84, train_loss: 0.6080, test_loss: 1.1451, test_f1: 0.5840
 epoch: 85, train_loss: 0.6098, test_loss: 0.9117, test_f1: 0.6316
 epoch: 86, train_loss: 0.5766, test_loss: 1.0137, test_f1: 0.6150
 epoch: 87, train_loss: 0.6096, test_loss: 0.9879, test_f1: 0.6274
 epoch: 88, train_loss: 0.6048, test_loss: 1.0029, test_f1: 0.6085
 epoch: 89, train_loss: 0.5767, test_loss: 0.9664, test_f1: 0.6333
 epoch: 90, train_loss: 0.5731, test_loss: 0.9432, test_f1: 0.6667
 epoch: 91, train_loss: 0.5529, test_loss: 1.0244, test_f1: 0.6305
 epoch: 92, train_loss: 0.5741, test_loss: 0.9638, test_f1: 0.6194
 epoch: 93, train_loss: 0.5929, test_loss: 0.9950, test_f1: 0.6310
 epoch: 94, train_loss: 0.5853, test_loss: 0.9218, test_f1: 0.6514
 epoch: 95, train_loss: 0.5651, test_loss: 0.9973, test_f1: 0.6332
 epoch: 96, train_loss: 0.5631, test_loss: 0.9335, test_f1: 0.6386
 epoch: 97, train_loss: 0.5640, test_loss: 0.8938, test_f1: 0.6373
 epoch: 98, train_loss: 0.5474, test_loss: 1.0339, test_f1: 0.6178
 epoch: 99, train_loss: 0.5588, test_loss: 1.0309, test_f1: 0.6223
##################ITERATION #6 ****************************************
 epoch: 0, train_loss: 1.2556, test_loss: 1.0526, test_f1: 0.4518
 epoch: 1, train_loss: 1.0424, test_loss: 0.9909, test_f1: 0.4714
 epoch: 2, train_loss: 0.9925, test_loss: 0.9920, test_f1: 0.4856
 epoch: 3, train_loss: 0.9825, test_loss: 0.9944, test_f1: 0.4981
 epoch: 4, train_loss: 0.9731, test_loss: 0.9919, test_f1: 0.5063
 epoch: 5, train_loss: 0.9470, test_loss: 0.9801, test_f1: 0.5201
 epoch: 6, train_loss: 0.9401, test_loss: 0.9727, test_f1: 0.5149
 epoch: 7, train_loss: 0.9478, test_loss: 0.9758, test_f1: 0.4893
 epoch: 8, train_loss: 0.9264, test_loss: 0.9743, test_f1: 0.5048
 epoch: 9, train_loss: 0.9216, test_loss: 0.9651, test_f1: 0.5423
 epoch: 10, train_loss: 0.9158, test_loss: 0.9731, test_f1: 0.5438
 epoch: 11, train_loss: 0.9080, test_loss: 0.9763, test_f1: 0.5036
 epoch: 12, train_loss: 0.8972, test_loss: 0.9477, test_f1: 0.5096
 epoch: 13, train_loss: 0.9089, test_loss: 0.9404, test_f1: 0.4919
 epoch: 14, train_loss: 0.8960, test_loss: 0.9865, test_f1: 0.5430
 epoch: 15, train_loss: 0.8860, test_loss: 0.9054, test_f1: 0.5164
 epoch: 16, train_loss: 0.8759, test_loss: 1.0143, test_f1: 0.5071
 epoch: 17, train_loss: 0.8887, test_loss: 0.9738, test_f1: 0.5032
 epoch: 18, train_loss: 0.8828, test_loss: 1.0067, test_f1: 0.5258
 epoch: 19, train_loss: 0.8618, test_loss: 0.9751, test_f1: 0.5041
 epoch: 20, train_loss: 0.8580, test_loss: 0.9704, test_f1: 0.5514
 epoch: 21, train_loss: 0.8768, test_loss: 0.9578, test_f1: 0.5547
 epoch: 22, train_loss: 0.8555, test_loss: 0.9242, test_f1: 0.5381
 epoch: 23, train_loss: 0.8504, test_loss: 0.9301, test_f1: 0.5315
 epoch: 24, train_loss: 0.8344, test_loss: 0.9897, test_f1: 0.5808
 epoch: 25, train_loss: 0.8431, test_loss: 0.9532, test_f1: 0.5871
 epoch: 26, train_loss: 0.8374, test_loss: 1.0160, test_f1: 0.5208
 epoch: 27, train_loss: 0.8237, test_loss: 0.9295, test_f1: 0.5282
 epoch: 28, train_loss: 0.8203, test_loss: 0.9053, test_f1: 0.5629
 epoch: 29, train_loss: 0.8331, test_loss: 0.9692, test_f1: 0.5474
 epoch: 30, train_loss: 0.8154, test_loss: 0.9762, test_f1: 0.5438
 epoch: 31, train_loss: 0.8126, test_loss: 0.9270, test_f1: 0.5738
 epoch: 32, train_loss: 0.7959, test_loss: 0.9588, test_f1: 0.5736
 epoch: 33, train_loss: 0.8009, test_loss: 0.9619, test_f1: 0.5720
 epoch: 34, train_loss: 0.7800, test_loss: 0.9542, test_f1: 0.5551
 epoch: 35, train_loss: 0.7860, test_loss: 0.9574, test_f1: 0.5523
 epoch: 36, train_loss: 0.7850, test_loss: 0.8898, test_f1: 0.5749
 epoch: 37, train_loss: 0.7726, test_loss: 0.9126, test_f1: 0.5778
 epoch: 38, train_loss: 0.7636, test_loss: 0.9230, test_f1: 0.5755
 epoch: 39, train_loss: 0.7698, test_loss: 1.0379, test_f1: 0.5466
 epoch: 40, train_loss: 0.7560, test_loss: 0.9444, test_f1: 0.5700
 epoch: 41, train_loss: 0.7412, test_loss: 0.8905, test_f1: 0.6195
 epoch: 42, train_loss: 0.7496, test_loss: 0.9011, test_f1: 0.5627
 epoch: 43, train_loss: 0.7570, test_loss: 0.9174, test_f1: 0.6007
 epoch: 44, train_loss: 0.7358, test_loss: 0.9670, test_f1: 0.6116
 epoch: 45, train_loss: 0.7366, test_loss: 0.8788, test_f1: 0.6248
 epoch: 46, train_loss: 0.7302, test_loss: 0.8878, test_f1: 0.5932
 epoch: 47, train_loss: 0.7306, test_loss: 0.8826, test_f1: 0.6113
 epoch: 48, train_loss: 0.7458, test_loss: 0.9628, test_f1: 0.5685
 epoch: 49, train_loss: 0.7551, test_loss: 0.9169, test_f1: 0.5600
 epoch: 50, train_loss: 0.7190, test_loss: 0.8755, test_f1: 0.6285
 epoch: 51, train_loss: 0.6855, test_loss: 0.8643, test_f1: 0.6209
 epoch: 52, train_loss: 0.6703, test_loss: 0.8906, test_f1: 0.6041
 epoch: 53, train_loss: 0.6776, test_loss: 0.9328, test_f1: 0.6161
 epoch: 54, train_loss: 0.6577, test_loss: 0.9241, test_f1: 0.6183
 epoch: 55, train_loss: 0.6560, test_loss: 0.8764, test_f1: 0.6385
 epoch: 56, train_loss: 0.6413, test_loss: 0.8963, test_f1: 0.6427
 epoch: 57, train_loss: 0.6403, test_loss: 0.9391, test_f1: 0.6219
 epoch: 58, train_loss: 0.6504, test_loss: 0.9173, test_f1: 0.6473
 epoch: 59, train_loss: 0.6404, test_loss: 0.9041, test_f1: 0.6443
 epoch: 60, train_loss: 0.6252, test_loss: 0.9159, test_f1: 0.6458
 epoch: 61, train_loss: 0.6251, test_loss: 0.8799, test_f1: 0.6449
 epoch: 62, train_loss: 0.6300, test_loss: 0.9022, test_f1: 0.6243
 epoch: 63, train_loss: 0.6200, test_loss: 0.9323, test_f1: 0.6562
 epoch: 64, train_loss: 0.6336, test_loss: 0.8728, test_f1: 0.6614
 epoch: 65, train_loss: 0.6194, test_loss: 0.9258, test_f1: 0.6386
 epoch: 66, train_loss: 0.6251, test_loss: 1.0010, test_f1: 0.6212
 epoch: 67, train_loss: 0.6294, test_loss: 0.9513, test_f1: 0.6370
 epoch: 68, train_loss: 0.6106, test_loss: 0.9889, test_f1: 0.6307
 epoch: 69, train_loss: 0.6196, test_loss: 0.9207, test_f1: 0.6374
 epoch: 70, train_loss: 0.6017, test_loss: 0.9974, test_f1: 0.6500
 epoch: 71, train_loss: 0.5950, test_loss: 0.8742, test_f1: 0.6463
 epoch: 72, train_loss: 0.5885, test_loss: 1.0029, test_f1: 0.6331
 epoch: 73, train_loss: 0.5887, test_loss: 0.9310, test_f1: 0.6762
 epoch: 74, train_loss: 0.5963, test_loss: 1.0200, test_f1: 0.6210
 epoch: 75, train_loss: 0.5752, test_loss: 0.9392, test_f1: 0.6678
 epoch: 76, train_loss: 0.5688, test_loss: 0.9901, test_f1: 0.6513
 epoch: 77, train_loss: 0.5879, test_loss: 0.9391, test_f1: 0.6689
 epoch: 78, train_loss: 0.5725, test_loss: 1.0972, test_f1: 0.6474
 epoch: 79, train_loss: 0.5740, test_loss: 1.0604, test_f1: 0.6657
 epoch: 80, train_loss: 0.5813, test_loss: 1.0729, test_f1: 0.6417
 epoch: 81, train_loss: 0.5909, test_loss: 1.0792, test_f1: 0.6521
 epoch: 82, train_loss: 0.5870, test_loss: 1.0403, test_f1: 0.6097
 epoch: 83, train_loss: 0.5767, test_loss: 1.0940, test_f1: 0.6246
 epoch: 84, train_loss: 0.5763, test_loss: 1.1312, test_f1: 0.6224
 epoch: 85, train_loss: 0.5779, test_loss: 1.0807, test_f1: 0.6101
 epoch: 86, train_loss: 0.5774, test_loss: 1.0548, test_f1: 0.6199
 epoch: 87, train_loss: 0.5574, test_loss: 1.0308, test_f1: 0.6575
 epoch: 88, train_loss: 0.5530, test_loss: 1.0744, test_f1: 0.6640
 epoch: 89, train_loss: 0.5589, test_loss: 1.1736, test_f1: 0.6245
 epoch: 90, train_loss: 0.5509, test_loss: 1.1949, test_f1: 0.6418
 epoch: 91, train_loss: 0.5731, test_loss: 1.1184, test_f1: 0.6550
 epoch: 92, train_loss: 0.5677, test_loss: 1.0590, test_f1: 0.6721
 epoch: 93, train_loss: 0.5435, test_loss: 1.1103, test_f1: 0.6542
 epoch: 94, train_loss: 0.5505, test_loss: 1.1226, test_f1: 0.6330
 epoch: 95, train_loss: 0.5414, test_loss: 1.0971, test_f1: 0.6657
 epoch: 96, train_loss: 0.5433, test_loss: 1.1045, test_f1: 0.6622
 epoch: 97, train_loss: 0.5379, test_loss: 1.0424, test_f1: 0.6832
 epoch: 98, train_loss: 0.5260, test_loss: 1.0508, test_f1: 0.6754
 epoch: 99, train_loss: 0.5038, test_loss: 1.2035, test_f1: 0.6484
##################ITERATION #7 ****************************************
 epoch: 0, train_loss: 1.2341, test_loss: 1.2915, test_f1: 0.2811
 epoch: 1, train_loss: 1.0434, test_loss: 1.0423, test_f1: 0.4438
 epoch: 2, train_loss: 1.0146, test_loss: 1.0197, test_f1: 0.4605
 epoch: 3, train_loss: 0.9886, test_loss: 1.0339, test_f1: 0.4848
 epoch: 4, train_loss: 0.9749, test_loss: 0.9913, test_f1: 0.4757
 epoch: 5, train_loss: 0.9579, test_loss: 1.0682, test_f1: 0.4331
 epoch: 6, train_loss: 0.9423, test_loss: 0.9859, test_f1: 0.4407
 epoch: 7, train_loss: 0.9191, test_loss: 0.9827, test_f1: 0.5103
 epoch: 8, train_loss: 0.8972, test_loss: 0.9597, test_f1: 0.4813
 epoch: 9, train_loss: 0.8963, test_loss: 1.0295, test_f1: 0.4843
 epoch: 10, train_loss: 0.8933, test_loss: 0.9505, test_f1: 0.4792
 epoch: 11, train_loss: 0.8887, test_loss: 0.9995, test_f1: 0.4758
 epoch: 12, train_loss: 0.8863, test_loss: 0.9736, test_f1: 0.5482
 epoch: 13, train_loss: 0.8775, test_loss: 0.9740, test_f1: 0.5437
 epoch: 14, train_loss: 0.8637, test_loss: 0.9796, test_f1: 0.4722
 epoch: 15, train_loss: 0.8647, test_loss: 1.0463, test_f1: 0.5201
 epoch: 16, train_loss: 0.8625, test_loss: 0.9579, test_f1: 0.5533
 epoch: 17, train_loss: 0.8542, test_loss: 0.9996, test_f1: 0.4982
 epoch: 18, train_loss: 0.8415, test_loss: 0.8737, test_f1: 0.5379
 epoch: 19, train_loss: 0.8363, test_loss: 0.8784, test_f1: 0.5415
 epoch: 20, train_loss: 0.8149, test_loss: 1.0369, test_f1: 0.5317
 epoch: 21, train_loss: 0.8333, test_loss: 1.0123, test_f1: 0.5339
 epoch: 22, train_loss: 0.8217, test_loss: 1.0057, test_f1: 0.4909
 epoch: 23, train_loss: 0.8198, test_loss: 0.8710, test_f1: 0.5637
 epoch: 24, train_loss: 0.8159, test_loss: 0.9637, test_f1: 0.5318
 epoch: 25, train_loss: 0.8042, test_loss: 1.0057, test_f1: 0.5313
 epoch: 26, train_loss: 0.7953, test_loss: 0.9369, test_f1: 0.5617
 epoch: 27, train_loss: 0.8001, test_loss: 0.9348, test_f1: 0.5480
 epoch: 28, train_loss: 0.7968, test_loss: 0.9617, test_f1: 0.5566
 epoch: 29, train_loss: 0.7826, test_loss: 0.8881, test_f1: 0.5665
 epoch: 30, train_loss: 0.7889, test_loss: 0.9682, test_f1: 0.5676
 epoch: 31, train_loss: 0.7753, test_loss: 0.9741, test_f1: 0.5488
 epoch: 32, train_loss: 0.7893, test_loss: 0.9533, test_f1: 0.5829
 epoch: 33, train_loss: 0.7722, test_loss: 0.9238, test_f1: 0.6068
 epoch: 34, train_loss: 0.7720, test_loss: 0.9055, test_f1: 0.5930
 epoch: 35, train_loss: 0.7653, test_loss: 0.9043, test_f1: 0.5606
 epoch: 36, train_loss: 0.7591, test_loss: 0.9538, test_f1: 0.5546
 epoch: 37, train_loss: 0.7695, test_loss: 0.9939, test_f1: 0.5540
 epoch: 38, train_loss: 0.7449, test_loss: 0.9338, test_f1: 0.5930
 epoch: 39, train_loss: 0.7940, test_loss: 1.0124, test_f1: 0.5848
 epoch: 40, train_loss: 0.8047, test_loss: 0.9605, test_f1: 0.5860
 epoch: 41, train_loss: 0.7568, test_loss: 0.9303, test_f1: 0.5827
 epoch: 42, train_loss: 0.7512, test_loss: 0.9416, test_f1: 0.6175
 epoch: 43, train_loss: 0.7490, test_loss: 0.9404, test_f1: 0.6225
 epoch: 44, train_loss: 0.7333, test_loss: 0.9691, test_f1: 0.6369
 epoch: 45, train_loss: 0.7197, test_loss: 0.9942, test_f1: 0.5889
 epoch: 46, train_loss: 0.7446, test_loss: 1.0085, test_f1: 0.5839
 epoch: 47, train_loss: 0.7334, test_loss: 1.0943, test_f1: 0.5510
 epoch: 48, train_loss: 0.7260, test_loss: 0.9193, test_f1: 0.6198
 epoch: 49, train_loss: 0.7218, test_loss: 1.1940, test_f1: 0.5300
 epoch: 50, train_loss: 0.7095, test_loss: 1.0478, test_f1: 0.5888
 epoch: 51, train_loss: 0.6810, test_loss: 0.9582, test_f1: 0.6366
 epoch: 52, train_loss: 0.6627, test_loss: 1.0517, test_f1: 0.6088
 epoch: 53, train_loss: 0.6709, test_loss: 1.0232, test_f1: 0.6152
 epoch: 54, train_loss: 0.6610, test_loss: 0.9891, test_f1: 0.6300
 epoch: 55, train_loss: 0.6659, test_loss: 1.0039, test_f1: 0.6240
 epoch: 56, train_loss: 0.6423, test_loss: 1.0077, test_f1: 0.6244
 epoch: 57, train_loss: 0.6521, test_loss: 1.0648, test_f1: 0.5948
 epoch: 58, train_loss: 0.6605, test_loss: 0.9799, test_f1: 0.6297
 epoch: 59, train_loss: 0.6588, test_loss: 1.0304, test_f1: 0.6168
 epoch: 60, train_loss: 0.6219, test_loss: 1.0352, test_f1: 0.6128
 epoch: 61, train_loss: 0.6474, test_loss: 1.0874, test_f1: 0.6039
 epoch: 62, train_loss: 0.6363, test_loss: 1.0292, test_f1: 0.6091
 epoch: 63, train_loss: 0.6474, test_loss: 1.0256, test_f1: 0.6107
 epoch: 64, train_loss: 0.6266, test_loss: 1.0728, test_f1: 0.6150
 epoch: 65, train_loss: 0.6159, test_loss: 1.1470, test_f1: 0.5932
 epoch: 66, train_loss: 0.6272, test_loss: 1.0692, test_f1: 0.6381
 epoch: 67, train_loss: 0.6158, test_loss: 1.0681, test_f1: 0.6255
 epoch: 68, train_loss: 0.6227, test_loss: 1.0685, test_f1: 0.6091
 epoch: 69, train_loss: 0.6052, test_loss: 0.9913, test_f1: 0.6013
 epoch: 70, train_loss: 0.6130, test_loss: 1.1489, test_f1: 0.6262
 epoch: 71, train_loss: 0.5953, test_loss: 1.1285, test_f1: 0.6277
 epoch: 72, train_loss: 0.6107, test_loss: 1.1030, test_f1: 0.6241
 epoch: 73, train_loss: 0.6105, test_loss: 1.0864, test_f1: 0.5928
 epoch: 74, train_loss: 0.6105, test_loss: 1.0822, test_f1: 0.6024
 epoch: 75, train_loss: 0.6229, test_loss: 1.1399, test_f1: 0.6400
 epoch: 76, train_loss: 0.6078, test_loss: 1.1137, test_f1: 0.6275
 epoch: 77, train_loss: 0.6028, test_loss: 1.0888, test_f1: 0.6425
 epoch: 78, train_loss: 0.5949, test_loss: 1.1724, test_f1: 0.6385
 epoch: 79, train_loss: 0.5749, test_loss: 1.1862, test_f1: 0.6164
 epoch: 80, train_loss: 0.5806, test_loss: 1.0449, test_f1: 0.6200
 epoch: 81, train_loss: 0.5853, test_loss: 1.1989, test_f1: 0.6158
 epoch: 82, train_loss: 0.6014, test_loss: 1.1351, test_f1: 0.6140
 epoch: 83, train_loss: 0.5780, test_loss: 1.1216, test_f1: 0.6446
 epoch: 84, train_loss: 0.5752, test_loss: 1.1599, test_f1: 0.5971
 epoch: 85, train_loss: 0.5713, test_loss: 1.1697, test_f1: 0.6264
 epoch: 86, train_loss: 0.5594, test_loss: 1.2277, test_f1: 0.6408
 epoch: 87, train_loss: 0.5692, test_loss: 1.1585, test_f1: 0.6432
 epoch: 88, train_loss: 0.5665, test_loss: 1.1888, test_f1: 0.6386
 epoch: 89, train_loss: 0.5685, test_loss: 1.3200, test_f1: 0.6332
 epoch: 90, train_loss: 0.5960, test_loss: 1.2071, test_f1: 0.6173
 epoch: 91, train_loss: 0.5648, test_loss: 1.2025, test_f1: 0.6140
 epoch: 92, train_loss: 0.5818, test_loss: 1.2126, test_f1: 0.6187
 epoch: 93, train_loss: 0.5666, test_loss: 1.1051, test_f1: 0.6354
 epoch: 94, train_loss: 0.5601, test_loss: 1.2513, test_f1: 0.6153
 epoch: 95, train_loss: 0.5634, test_loss: 1.2564, test_f1: 0.5726
 epoch: 96, train_loss: 0.5742, test_loss: 1.2429, test_f1: 0.5725
 epoch: 97, train_loss: 0.5760, test_loss: 1.2432, test_f1: 0.6255
 epoch: 98, train_loss: 0.5544, test_loss: 1.2572, test_f1: 0.6321
 epoch: 99, train_loss: 0.5591, test_loss: 1.2112, test_f1: 0.6247
##################ITERATION #8 ****************************************
 epoch: 0, train_loss: 1.2523, test_loss: 1.1889, test_f1: 0.3342
 epoch: 1, train_loss: 1.0426, test_loss: 1.0174, test_f1: 0.4319
 epoch: 2, train_loss: 0.9897, test_loss: 1.0300, test_f1: 0.4598
 epoch: 3, train_loss: 0.9695, test_loss: 0.9364, test_f1: 0.4773
 epoch: 4, train_loss: 0.9314, test_loss: 1.0194, test_f1: 0.4860
 epoch: 5, train_loss: 0.9259, test_loss: 0.9362, test_f1: 0.5473
 epoch: 6, train_loss: 0.9216, test_loss: 0.9894, test_f1: 0.4667
 epoch: 7, train_loss: 0.9117, test_loss: 0.9534, test_f1: 0.5009
 epoch: 8, train_loss: 0.9060, test_loss: 0.9966, test_f1: 0.4893
 epoch: 9, train_loss: 0.9067, test_loss: 0.9694, test_f1: 0.5141
 epoch: 10, train_loss: 0.8794, test_loss: 0.9374, test_f1: 0.4860
 epoch: 11, train_loss: 0.8550, test_loss: 0.9213, test_f1: 0.5659
 epoch: 12, train_loss: 0.8600, test_loss: 0.9797, test_f1: 0.5321
 epoch: 13, train_loss: 0.8648, test_loss: 0.9140, test_f1: 0.5570
 epoch: 14, train_loss: 0.8400, test_loss: 0.9317, test_f1: 0.5559
 epoch: 15, train_loss: 0.8433, test_loss: 0.9465, test_f1: 0.5315
 epoch: 16, train_loss: 0.8363, test_loss: 0.9364, test_f1: 0.5229
 epoch: 17, train_loss: 0.8129, test_loss: 0.9727, test_f1: 0.5596
 epoch: 18, train_loss: 0.8100, test_loss: 0.9916, test_f1: 0.5467
 epoch: 19, train_loss: 0.8187, test_loss: 0.9104, test_f1: 0.5711
 epoch: 20, train_loss: 0.8030, test_loss: 0.9278, test_f1: 0.5326
 epoch: 21, train_loss: 0.8049, test_loss: 0.9958, test_f1: 0.5464
 epoch: 22, train_loss: 0.8016, test_loss: 0.9542, test_f1: 0.5722
 epoch: 23, train_loss: 0.8049, test_loss: 1.0294, test_f1: 0.5229
 epoch: 24, train_loss: 0.7823, test_loss: 0.9400, test_f1: 0.6106
 epoch: 25, train_loss: 0.7976, test_loss: 0.9574, test_f1: 0.5758
 epoch: 26, train_loss: 0.7838, test_loss: 0.9931, test_f1: 0.5479
 epoch: 27, train_loss: 0.7784, test_loss: 0.9093, test_f1: 0.5877
 epoch: 28, train_loss: 0.7729, test_loss: 1.0074, test_f1: 0.5125
 epoch: 29, train_loss: 0.7727, test_loss: 0.9262, test_f1: 0.5855
 epoch: 30, train_loss: 0.7742, test_loss: 1.1420, test_f1: 0.5583
 epoch: 31, train_loss: 0.7856, test_loss: 0.9350, test_f1: 0.5843
 epoch: 32, train_loss: 0.7514, test_loss: 0.9799, test_f1: 0.5619
 epoch: 33, train_loss: 0.7776, test_loss: 1.0163, test_f1: 0.5318
 epoch: 34, train_loss: 0.7858, test_loss: 1.0720, test_f1: 0.5279
 epoch: 35, train_loss: 0.7490, test_loss: 0.9456, test_f1: 0.5245
 epoch: 36, train_loss: 0.7436, test_loss: 0.8662, test_f1: 0.5941
 epoch: 37, train_loss: 0.7423, test_loss: 0.9353, test_f1: 0.5987
 epoch: 38, train_loss: 0.7455, test_loss: 0.9186, test_f1: 0.6011
 epoch: 39, train_loss: 0.7196, test_loss: 0.9726, test_f1: 0.5897
 epoch: 40, train_loss: 0.7508, test_loss: 0.9393, test_f1: 0.5643
 epoch: 41, train_loss: 0.7490, test_loss: 0.9805, test_f1: 0.5662
 epoch: 42, train_loss: 0.7340, test_loss: 1.1483, test_f1: 0.5417
 epoch: 43, train_loss: 0.7425, test_loss: 0.9247, test_f1: 0.5855
 epoch: 44, train_loss: 0.7235, test_loss: 0.9776, test_f1: 0.5524
 epoch: 45, train_loss: 0.7238, test_loss: 1.0333, test_f1: 0.5243
 epoch: 46, train_loss: 0.7204, test_loss: 0.9650, test_f1: 0.5659
 epoch: 47, train_loss: 0.7214, test_loss: 1.1670, test_f1: 0.4937
 epoch: 48, train_loss: 0.7060, test_loss: 0.9123, test_f1: 0.5570
 epoch: 49, train_loss: 0.7088, test_loss: 0.9634, test_f1: 0.5303
 epoch: 50, train_loss: 0.7024, test_loss: 0.8747, test_f1: 0.5762
 epoch: 51, train_loss: 0.6832, test_loss: 0.8794, test_f1: 0.6017
 epoch: 52, train_loss: 0.6761, test_loss: 0.8924, test_f1: 0.5883
 epoch: 53, train_loss: 0.6454, test_loss: 0.8826, test_f1: 0.6203
 epoch: 54, train_loss: 0.6454, test_loss: 0.8581, test_f1: 0.6165
 epoch: 55, train_loss: 0.6545, test_loss: 0.8646, test_f1: 0.6156
 epoch: 56, train_loss: 0.6462, test_loss: 0.8408, test_f1: 0.6085
 epoch: 57, train_loss: 0.6556, test_loss: 0.8503, test_f1: 0.6305
 epoch: 58, train_loss: 0.6534, test_loss: 0.8959, test_f1: 0.6064
 epoch: 59, train_loss: 0.6426, test_loss: 0.9137, test_f1: 0.6074
 epoch: 60, train_loss: 0.6214, test_loss: 0.8612, test_f1: 0.6281
 epoch: 61, train_loss: 0.6138, test_loss: 0.9114, test_f1: 0.6050
 epoch: 62, train_loss: 0.6156, test_loss: 0.8639, test_f1: 0.6254
 epoch: 63, train_loss: 0.6383, test_loss: 0.8975, test_f1: 0.6114
 epoch: 64, train_loss: 0.6361, test_loss: 0.8721, test_f1: 0.6029
 epoch: 65, train_loss: 0.6155, test_loss: 0.9113, test_f1: 0.5992
 epoch: 66, train_loss: 0.6105, test_loss: 0.9053, test_f1: 0.6059
 epoch: 67, train_loss: 0.6328, test_loss: 0.8954, test_f1: 0.6346
 epoch: 68, train_loss: 0.6406, test_loss: 1.0127, test_f1: 0.5589
 epoch: 69, train_loss: 0.6141, test_loss: 0.8168, test_f1: 0.6478
 epoch: 70, train_loss: 0.6012, test_loss: 0.9271, test_f1: 0.5971
 epoch: 71, train_loss: 0.6213, test_loss: 0.8745, test_f1: 0.6116
 epoch: 72, train_loss: 0.6001, test_loss: 0.9076, test_f1: 0.6206
 epoch: 73, train_loss: 0.5967, test_loss: 0.8995, test_f1: 0.6101
 epoch: 74, train_loss: 0.6064, test_loss: 0.9876, test_f1: 0.6048
 epoch: 75, train_loss: 0.6049, test_loss: 0.9812, test_f1: 0.6124
 epoch: 76, train_loss: 0.6121, test_loss: 0.9012, test_f1: 0.6043
 epoch: 77, train_loss: 0.5962, test_loss: 0.9261, test_f1: 0.6031
 epoch: 78, train_loss: 0.5949, test_loss: 0.9119, test_f1: 0.6216
 epoch: 79, train_loss: 0.5861, test_loss: 0.9381, test_f1: 0.5938
 epoch: 80, train_loss: 0.5904, test_loss: 0.9083, test_f1: 0.6352
 epoch: 81, train_loss: 0.5881, test_loss: 1.0328, test_f1: 0.6225
 epoch: 82, train_loss: 0.5820, test_loss: 1.1202, test_f1: 0.5705
 epoch: 83, train_loss: 0.5929, test_loss: 0.8953, test_f1: 0.6021
 epoch: 84, train_loss: 0.5556, test_loss: 0.9798, test_f1: 0.5993
 epoch: 85, train_loss: 0.5803, test_loss: 0.9018, test_f1: 0.6394
 epoch: 86, train_loss: 0.5759, test_loss: 1.0232, test_f1: 0.6237
 epoch: 87, train_loss: 0.5809, test_loss: 0.9184, test_f1: 0.6098
 epoch: 88, train_loss: 0.5875, test_loss: 0.9321, test_f1: 0.6322
 epoch: 89, train_loss: 0.5676, test_loss: 0.9317, test_f1: 0.6451
 epoch: 90, train_loss: 0.5698, test_loss: 1.0182, test_f1: 0.6130
 epoch: 91, train_loss: 0.5721, test_loss: 0.9823, test_f1: 0.6155
 epoch: 92, train_loss: 0.5590, test_loss: 0.9496, test_f1: 0.6299
 epoch: 93, train_loss: 0.5667, test_loss: 0.9018, test_f1: 0.6360
 epoch: 94, train_loss: 0.5628, test_loss: 0.9719, test_f1: 0.6464
 epoch: 95, train_loss: 0.5431, test_loss: 0.9745, test_f1: 0.6050
 epoch: 96, train_loss: 0.5476, test_loss: 0.9465, test_f1: 0.6116
 epoch: 97, train_loss: 0.5824, test_loss: 0.9091, test_f1: 0.6314
 epoch: 98, train_loss: 0.5725, test_loss: 1.0074, test_f1: 0.6264
 epoch: 99, train_loss: 0.5408, test_loss: 1.0003, test_f1: 0.6112
##################ITERATION #9 ****************************************
 epoch: 0, train_loss: 1.2582, test_loss: 1.1916, test_f1: 0.3304
 epoch: 1, train_loss: 1.0286, test_loss: 0.9933, test_f1: 0.4745
 epoch: 2, train_loss: 0.9709, test_loss: 1.0564, test_f1: 0.4678
 epoch: 3, train_loss: 0.9559, test_loss: 1.0070, test_f1: 0.4950
 epoch: 4, train_loss: 0.9364, test_loss: 1.0124, test_f1: 0.5395
 epoch: 5, train_loss: 0.9299, test_loss: 0.9751, test_f1: 0.5428
 epoch: 6, train_loss: 0.9100, test_loss: 1.0082, test_f1: 0.4992
 epoch: 7, train_loss: 0.9057, test_loss: 1.0116, test_f1: 0.5029
 epoch: 8, train_loss: 0.8990, test_loss: 0.9606, test_f1: 0.5321
 epoch: 9, train_loss: 0.8811, test_loss: 0.9609, test_f1: 0.5336
 epoch: 10, train_loss: 0.8594, test_loss: 0.9425, test_f1: 0.5597
 epoch: 11, train_loss: 0.8615, test_loss: 0.9676, test_f1: 0.5688
 epoch: 12, train_loss: 0.8506, test_loss: 0.9363, test_f1: 0.5564
 epoch: 13, train_loss: 0.8583, test_loss: 0.9526, test_f1: 0.5655
 epoch: 14, train_loss: 0.8553, test_loss: 1.0281, test_f1: 0.5338
 epoch: 15, train_loss: 0.8348, test_loss: 1.0651, test_f1: 0.5447
 epoch: 16, train_loss: 0.8385, test_loss: 1.0293, test_f1: 0.5590
 epoch: 17, train_loss: 0.8304, test_loss: 0.8908, test_f1: 0.5869
 epoch: 18, train_loss: 0.8119, test_loss: 1.0115, test_f1: 0.5234
 epoch: 19, train_loss: 0.8124, test_loss: 0.9473, test_f1: 0.5714
 epoch: 20, train_loss: 0.8031, test_loss: 0.9769, test_f1: 0.5647
 epoch: 21, train_loss: 0.8038, test_loss: 0.9325, test_f1: 0.6093
 epoch: 22, train_loss: 0.7951, test_loss: 0.9107, test_f1: 0.5870
 epoch: 23, train_loss: 0.7982, test_loss: 0.9835, test_f1: 0.5879
 epoch: 24, train_loss: 0.8031, test_loss: 0.9979, test_f1: 0.5618
 epoch: 25, train_loss: 0.7848, test_loss: 1.0258, test_f1: 0.5808
 epoch: 26, train_loss: 0.7925, test_loss: 0.9592, test_f1: 0.6088
 epoch: 27, train_loss: 0.7766, test_loss: 0.9259, test_f1: 0.6083
 epoch: 28, train_loss: 0.7751, test_loss: 1.0177, test_f1: 0.5955
 epoch: 29, train_loss: 0.7719, test_loss: 3.0984, test_f1: 0.2407
 epoch: 30, train_loss: 0.7518, test_loss: 0.9636, test_f1: 0.5972
 epoch: 31, train_loss: 0.7382, test_loss: 0.9748, test_f1: 0.5885
 epoch: 32, train_loss: 0.7636, test_loss: 0.9432, test_f1: 0.6047
 epoch: 33, train_loss: 0.7547, test_loss: 0.9971, test_f1: 0.6199
 epoch: 34, train_loss: 0.7559, test_loss: 1.0328, test_f1: 0.6208
 epoch: 35, train_loss: 0.7575, test_loss: 1.0384, test_f1: 0.6067
 epoch: 36, train_loss: 0.7519, test_loss: 0.9584, test_f1: 0.5847
 epoch: 37, train_loss: 0.7420, test_loss: 1.1135, test_f1: 0.5769
 epoch: 38, train_loss: 0.7441, test_loss: 0.9350, test_f1: 0.6234
 epoch: 39, train_loss: 0.7185, test_loss: 0.9571, test_f1: 0.6179
 epoch: 40, train_loss: 0.7315, test_loss: 0.9721, test_f1: 0.6213
 epoch: 41, train_loss: 0.7146, test_loss: 1.0172, test_f1: 0.6223
 epoch: 42, train_loss: 0.7171, test_loss: 1.0793, test_f1: 0.5920
 epoch: 43, train_loss: 0.7112, test_loss: 0.9480, test_f1: 0.6498
 epoch: 44, train_loss: 0.7087, test_loss: 1.0276, test_f1: 0.6158
 epoch: 45, train_loss: 0.7151, test_loss: 0.9586, test_f1: 0.6282
 epoch: 46, train_loss: 0.7167, test_loss: 0.9670, test_f1: 0.6139
 epoch: 47, train_loss: 0.7154, test_loss: 1.0067, test_f1: 0.6182
 epoch: 48, train_loss: 0.7032, test_loss: 1.0010, test_f1: 0.5885
 epoch: 49, train_loss: 0.7039, test_loss: 0.9855, test_f1: 0.5815
 epoch: 50, train_loss: 0.6946, test_loss: 0.9609, test_f1: 0.6286
 epoch: 51, train_loss: 0.6943, test_loss: 0.9830, test_f1: 0.6356
 epoch: 52, train_loss: 0.6660, test_loss: 0.9231, test_f1: 0.6565
 epoch: 53, train_loss: 0.6493, test_loss: 0.9526, test_f1: 0.6451
 epoch: 54, train_loss: 0.6400, test_loss: 0.9563, test_f1: 0.6349
 epoch: 55, train_loss: 0.6313, test_loss: 0.9621, test_f1: 0.6457
 epoch: 56, train_loss: 0.6326, test_loss: 0.9869, test_f1: 0.6419
 epoch: 57, train_loss: 0.6402, test_loss: 1.0536, test_f1: 0.6122
 epoch: 58, train_loss: 0.6523, test_loss: 1.0791, test_f1: 0.6404
 epoch: 59, train_loss: 0.6281, test_loss: 1.0216, test_f1: 0.6506
 epoch: 60, train_loss: 0.6095, test_loss: 1.0663, test_f1: 0.6659
 epoch: 61, train_loss: 0.6175, test_loss: 1.0201, test_f1: 0.6595
 epoch: 62, train_loss: 0.6249, test_loss: 1.0924, test_f1: 0.6227
 epoch: 63, train_loss: 0.6241, test_loss: 0.9943, test_f1: 0.6490
 epoch: 64, train_loss: 0.6160, test_loss: 1.0716, test_f1: 0.6480
 epoch: 65, train_loss: 0.6189, test_loss: 0.9885, test_f1: 0.6272
 epoch: 66, train_loss: 0.6047, test_loss: 1.0334, test_f1: 0.6707
 epoch: 67, train_loss: 0.6099, test_loss: 1.0594, test_f1: 0.6653
 epoch: 68, train_loss: 0.6233, test_loss: 1.0020, test_f1: 0.6823
 epoch: 69, train_loss: 0.6125, test_loss: 0.9564, test_f1: 0.6579
 epoch: 70, train_loss: 0.6274, test_loss: 1.0260, test_f1: 0.6736
 epoch: 71, train_loss: 0.5953, test_loss: 1.0553, test_f1: 0.6511
 epoch: 72, train_loss: 0.6169, test_loss: 1.0452, test_f1: 0.6330
 epoch: 73, train_loss: 0.5933, test_loss: 1.0177, test_f1: 0.6362
 epoch: 74, train_loss: 0.5939, test_loss: 1.1714, test_f1: 0.6513
 epoch: 75, train_loss: 0.6150, test_loss: 1.0375, test_f1: 0.6350
 epoch: 76, train_loss: 0.5941, test_loss: 1.0097, test_f1: 0.6630
 epoch: 77, train_loss: 0.5944, test_loss: 1.0706, test_f1: 0.6496
 epoch: 78, train_loss: 0.5949, test_loss: 1.0109, test_f1: 0.6571
 epoch: 79, train_loss: 0.5778, test_loss: 1.0557, test_f1: 0.6073
 epoch: 80, train_loss: 0.5743, test_loss: 1.1094, test_f1: 0.6374
 epoch: 81, train_loss: 0.5937, test_loss: 1.2066, test_f1: 0.6659
 epoch: 82, train_loss: 0.5702, test_loss: 1.0673, test_f1: 0.6628
 epoch: 83, train_loss: 0.5663, test_loss: 1.0566, test_f1: 0.6314
 epoch: 84, train_loss: 0.5700, test_loss: 1.0828, test_f1: 0.6453
 epoch: 85, train_loss: 0.5728, test_loss: 1.1102, test_f1: 0.6551
 epoch: 86, train_loss: 0.5653, test_loss: 1.1861, test_f1: 0.6150
 epoch: 87, train_loss: 0.5716, test_loss: 1.1464, test_f1: 0.6400
 epoch: 88, train_loss: 0.5554, test_loss: 1.1642, test_f1: 0.6454
 epoch: 89, train_loss: 0.5461, test_loss: 1.1374, test_f1: 0.6344
 epoch: 90, train_loss: 0.5514, test_loss: 1.1400, test_f1: 0.6527
 epoch: 91, train_loss: 0.5594, test_loss: 1.0835, test_f1: 0.6389
 epoch: 92, train_loss: 0.5462, test_loss: 1.1327, test_f1: 0.6515
 epoch: 93, train_loss: 0.5400, test_loss: 1.2047, test_f1: 0.6690
 epoch: 94, train_loss: 0.5515, test_loss: 1.2191, test_f1: 0.6660
 epoch: 95, train_loss: 0.5647, test_loss: 1.2482, test_f1: 0.6389
 epoch: 96, train_loss: 0.5686, test_loss: 1.2275, test_f1: 0.6381
 epoch: 97, train_loss: 0.5666, test_loss: 1.1914, test_f1: 0.6276
 epoch: 98, train_loss: 0.5448, test_loss: 1.1760, test_f1: 0.6552
 epoch: 99, train_loss: 0.5391, test_loss: 1.1801, test_f1: 0.6571

Training completed in 487.70 seconds
Best F1: 0.6844 at epoch 61
Mean F1 across iterations: 0.6692  0.0131
========================FINAL RESULTS================================
FEGIN weighted F1: 0.6844  0.0131
python main.py --data ltspice_examples --representation component_net --model FEGIN --layers 4 --hiddens 32 --batch_size 128 --lr 0.01 --emb_size 250 --epochs 100 --save_appendix component_net_L4_H32_BS128_LR0.01_E250 --no_val
-----



STDERR:
  File "main.py", line 370, in <module>
    main()
  File "main.py", line 254, in main
    dataset = dataset_class(
  File "/home/philip/projects/ltspice_examples_code_repo/Circuit-Completion-Using-GNNs/component_classification_with_link_prediction_head/evaluation/FEGIN/kernel/circuit_datasets.py", line 15, in __init__
    self.data, self.slices = torch.load(self.processed_paths[0])
  File "/home/philip/.local/lib/python3.8/site-packages/torch/serialization.py", line 1040, in load
    warnings.warn(
  File "/usr/lib/python3.8/warnings.py", line 109, in _showwarnmsg
    sw(msg.message, msg.category, msg.filename, msg.lineno,
  File "main.py", line 47, in warn_with_traceback
    traceback.print_stack(file=log)
/home/philip/projects/ltspice_examples_code_repo/Circuit-Completion-Using-GNNs/component_classification_with_link_prediction_head/evaluation/FEGIN/kernel/circuit_datasets.py:15: FutureWarning: You are using `torch.load` with `weights_only=False` (the current default value), which uses the default pickle module implicitly. It is possible to construct malicious pickle data which will execute arbitrary code during unpickling (See https://github.com/pytorch/pytorch/blob/main/SECURITY.md#untrusted-models for more details). In a future release, the default value for `weights_only` will be flipped to `True`. This limits the functions that could be executed during unpickling. Arbitrary objects will no longer be allowed to be loaded via this mode unless they are explicitly allowlisted by the user via `torch.serialization.add_safe_globals`. We recommend you start setting `weights_only=True` for any use case where you don't have full control of the loaded file. Please open an issue on GitHub for any issues related to this experimental feature.
  self.data, self.slices = torch.load(self.processed_paths[0])
