STDOUT:
Results will be saved in /home/philip/projects/ltspice_examples_code_repo/Circuit-Completion-Using-GNNs/component_classification_with_link_prediction_head/evaluation/FEGIN/results/model_FEGIN_dataset_ltspice_examples
Command line input: python main.py --data ltspice_examples --representation component_pin_net --model FEGIN --layers 3 --hiddens 32 --batch_size 64 --lr 0.01 --emb_size 512 --epochs 100 --save_appendix component_pin_net_L3_H32_BS64_LR0.01_E512 --no_val
 is saved.
-----
ltspice_examples - FEGIN
Using 3 layers, 32 hidden units, h = 2
Loading component_pin_net representation dataset
ENTERED
Training FEGIN on component_pin_net representation
Train: 3558, Test: 846
##################ITERATION #0 ****************************************
 epoch: 0, train_loss: 1.1947, test_loss: 1.0344, test_f1: 0.4591
 epoch: 1, train_loss: 1.0328, test_loss: 1.0735, test_f1: 0.4430
 epoch: 2, train_loss: 1.0172, test_loss: 1.0087, test_f1: 0.4622
 epoch: 3, train_loss: 0.9854, test_loss: 0.9553, test_f1: 0.4600
 epoch: 4, train_loss: 0.9677, test_loss: 0.9966, test_f1: 0.4786
 epoch: 5, train_loss: 0.9509, test_loss: 1.0834, test_f1: 0.4483
 epoch: 6, train_loss: 0.9327, test_loss: 0.9245, test_f1: 0.5219
 epoch: 7, train_loss: 0.9293, test_loss: 0.8954, test_f1: 0.5451
 epoch: 8, train_loss: 0.9077, test_loss: 0.8712, test_f1: 0.5645
 epoch: 9, train_loss: 0.8881, test_loss: 0.9945, test_f1: 0.5222
 epoch: 10, train_loss: 0.8965, test_loss: 0.9086, test_f1: 0.5073
 epoch: 11, train_loss: 0.8803, test_loss: 0.9267, test_f1: 0.5332
 epoch: 12, train_loss: 0.8755, test_loss: 1.0533, test_f1: 0.4679
 epoch: 13, train_loss: 0.8781, test_loss: 1.0928, test_f1: 0.4265
 epoch: 14, train_loss: 0.8683, test_loss: 1.0198, test_f1: 0.5105
 epoch: 15, train_loss: 0.8426, test_loss: 0.9239, test_f1: 0.5316
 epoch: 16, train_loss: 0.8441, test_loss: 0.9310, test_f1: 0.5339
 epoch: 17, train_loss: 0.8294, test_loss: 0.9008, test_f1: 0.5489
 epoch: 18, train_loss: 0.8197, test_loss: 0.9325, test_f1: 0.5102
 epoch: 19, train_loss: 0.8324, test_loss: 0.8182, test_f1: 0.5655
 epoch: 20, train_loss: 0.8200, test_loss: 0.8916, test_f1: 0.5300
 epoch: 21, train_loss: 0.7987, test_loss: 0.8160, test_f1: 0.6070
 epoch: 22, train_loss: 0.7933, test_loss: 1.1284, test_f1: 0.5468
 epoch: 23, train_loss: 0.8078, test_loss: 0.9585, test_f1: 0.5122
 epoch: 24, train_loss: 0.7941, test_loss: 0.8872, test_f1: 0.5707
 epoch: 25, train_loss: 0.7797, test_loss: 0.9029, test_f1: 0.5072
 epoch: 26, train_loss: 0.7796, test_loss: 0.8847, test_f1: 0.5364
 epoch: 27, train_loss: 0.7701, test_loss: 0.8525, test_f1: 0.6108
 epoch: 28, train_loss: 0.7785, test_loss: 1.1456, test_f1: 0.5067
 epoch: 29, train_loss: 0.7533, test_loss: 0.8980, test_f1: 0.5232
 epoch: 30, train_loss: 0.7507, test_loss: 0.8909, test_f1: 0.6339
 epoch: 31, train_loss: 0.7363, test_loss: 0.8439, test_f1: 0.6386
 epoch: 32, train_loss: 0.7426, test_loss: 0.9184, test_f1: 0.5749
 epoch: 33, train_loss: 0.7508, test_loss: 0.9529, test_f1: 0.5978
 epoch: 34, train_loss: 0.7703, test_loss: 0.7760, test_f1: 0.6190
 epoch: 35, train_loss: 0.7423, test_loss: 1.0301, test_f1: 0.5972
 epoch: 36, train_loss: 0.7418, test_loss: 0.9774, test_f1: 0.5948
 epoch: 37, train_loss: 0.7394, test_loss: 0.8268, test_f1: 0.6251
 epoch: 38, train_loss: 0.7386, test_loss: 0.9794, test_f1: 0.5720
 epoch: 39, train_loss: 0.7251, test_loss: 0.8721, test_f1: 0.6282
 epoch: 40, train_loss: 0.7240, test_loss: 0.8374, test_f1: 0.6096
 epoch: 41, train_loss: 0.7392, test_loss: 0.8917, test_f1: 0.5893
 epoch: 42, train_loss: 0.7312, test_loss: 0.7565, test_f1: 0.6479
 epoch: 43, train_loss: 0.7269, test_loss: 0.8879, test_f1: 0.5777
 epoch: 44, train_loss: 0.7124, test_loss: 0.8608, test_f1: 0.6498
 epoch: 45, train_loss: 0.6983, test_loss: 0.8038, test_f1: 0.6289
 epoch: 46, train_loss: 0.6867, test_loss: 0.8356, test_f1: 0.6432
 epoch: 47, train_loss: 0.7147, test_loss: 0.9094, test_f1: 0.6351
 epoch: 48, train_loss: 0.6932, test_loss: 0.8746, test_f1: 0.6090
 epoch: 49, train_loss: 0.6900, test_loss: 0.9000, test_f1: 0.6461
 epoch: 50, train_loss: 0.7199, test_loss: 0.9351, test_f1: 0.6287
 epoch: 51, train_loss: 0.6736, test_loss: 0.8270, test_f1: 0.6685
 epoch: 52, train_loss: 0.6418, test_loss: 0.8246, test_f1: 0.6468
 epoch: 53, train_loss: 0.6453, test_loss: 0.8661, test_f1: 0.6426
 epoch: 54, train_loss: 0.6329, test_loss: 0.8999, test_f1: 0.6722
 epoch: 55, train_loss: 0.6173, test_loss: 0.9042, test_f1: 0.6675
 epoch: 56, train_loss: 0.6284, test_loss: 0.9522, test_f1: 0.6593
 epoch: 57, train_loss: 0.6283, test_loss: 0.8326, test_f1: 0.6677
 epoch: 58, train_loss: 0.6319, test_loss: 0.8015, test_f1: 0.6475
 epoch: 59, train_loss: 0.6377, test_loss: 0.7983, test_f1: 0.6860
 epoch: 60, train_loss: 0.6114, test_loss: 0.8784, test_f1: 0.6310
 epoch: 61, train_loss: 0.6086, test_loss: 0.8417, test_f1: 0.6196
 epoch: 62, train_loss: 0.6054, test_loss: 0.8481, test_f1: 0.6392
 epoch: 63, train_loss: 0.6156, test_loss: 0.9703, test_f1: 0.6295
 epoch: 64, train_loss: 0.6035, test_loss: 0.8346, test_f1: 0.6593
 epoch: 65, train_loss: 0.6197, test_loss: 0.8440, test_f1: 0.6453
 epoch: 66, train_loss: 0.5917, test_loss: 0.9190, test_f1: 0.6479
 epoch: 67, train_loss: 0.5855, test_loss: 0.9927, test_f1: 0.6606
 epoch: 68, train_loss: 0.5898, test_loss: 0.8842, test_f1: 0.6512
 epoch: 69, train_loss: 0.5966, test_loss: 0.8096, test_f1: 0.6598
 epoch: 70, train_loss: 0.6020, test_loss: 0.8844, test_f1: 0.6478
 epoch: 71, train_loss: 0.5859, test_loss: 0.8861, test_f1: 0.6393
 epoch: 72, train_loss: 0.5937, test_loss: 0.9391, test_f1: 0.6663
 epoch: 73, train_loss: 0.5832, test_loss: 0.9171, test_f1: 0.6358
 epoch: 74, train_loss: 0.5898, test_loss: 0.9028, test_f1: 0.6591
 epoch: 75, train_loss: 0.5925, test_loss: 0.9534, test_f1: 0.6484
 epoch: 76, train_loss: 0.5909, test_loss: 0.9505, test_f1: 0.6701
 epoch: 77, train_loss: 0.6036, test_loss: 0.8627, test_f1: 0.6639
 epoch: 78, train_loss: 0.5872, test_loss: 0.9413, test_f1: 0.6458
 epoch: 79, train_loss: 0.5794, test_loss: 0.8912, test_f1: 0.6631
 epoch: 80, train_loss: 0.5566, test_loss: 0.9339, test_f1: 0.6349
 epoch: 81, train_loss: 0.5952, test_loss: 0.9003, test_f1: 0.6754
 epoch: 82, train_loss: 0.5648, test_loss: 0.9318, test_f1: 0.6491
 epoch: 83, train_loss: 0.5879, test_loss: 0.8986, test_f1: 0.6559
 epoch: 84, train_loss: 0.5802, test_loss: 0.9327, test_f1: 0.6699
 epoch: 85, train_loss: 0.5463, test_loss: 0.9447, test_f1: 0.6791
 epoch: 86, train_loss: 0.5777, test_loss: 0.9244, test_f1: 0.6541
 epoch: 87, train_loss: 0.5802, test_loss: 0.8959, test_f1: 0.6343
 epoch: 88, train_loss: 0.5608, test_loss: 0.9453, test_f1: 0.6375
 epoch: 89, train_loss: 0.5621, test_loss: 0.8903, test_f1: 0.6808
 epoch: 90, train_loss: 0.5505, test_loss: 0.8926, test_f1: 0.6587
 epoch: 91, train_loss: 0.5461, test_loss: 1.0354, test_f1: 0.6608
 epoch: 92, train_loss: 0.5663, test_loss: 0.9720, test_f1: 0.6511
 epoch: 93, train_loss: 0.5638, test_loss: 1.0249, test_f1: 0.6275
 epoch: 94, train_loss: 0.5565, test_loss: 0.8592, test_f1: 0.6294
 epoch: 95, train_loss: 0.5588, test_loss: 1.0110, test_f1: 0.6701
 epoch: 96, train_loss: 0.5355, test_loss: 0.9287, test_f1: 0.6794
 epoch: 97, train_loss: 0.5416, test_loss: 0.9605, test_f1: 0.6653
 epoch: 98, train_loss: 0.5461, test_loss: 0.9516, test_f1: 0.6605
 epoch: 99, train_loss: 0.5550, test_loss: 0.9279, test_f1: 0.6390
##################ITERATION #1 ****************************************
 epoch: 0, train_loss: 1.0918, test_loss: 1.0346, test_f1: 0.4682
 epoch: 1, train_loss: 0.9879, test_loss: 1.1450, test_f1: 0.4447
 epoch: 2, train_loss: 0.9684, test_loss: 1.0050, test_f1: 0.4901
 epoch: 3, train_loss: 0.9453, test_loss: 0.9906, test_f1: 0.5066
 epoch: 4, train_loss: 0.9347, test_loss: 1.0178, test_f1: 0.4811
 epoch: 5, train_loss: 0.9084, test_loss: 0.9173, test_f1: 0.4987
 epoch: 6, train_loss: 0.8924, test_loss: 0.8959, test_f1: 0.5587
 epoch: 7, train_loss: 0.8997, test_loss: 1.0711, test_f1: 0.4793
 epoch: 8, train_loss: 0.8799, test_loss: 0.9110, test_f1: 0.5956
 epoch: 9, train_loss: 0.8664, test_loss: 0.9014, test_f1: 0.5720
 epoch: 10, train_loss: 0.8740, test_loss: 0.9457, test_f1: 0.5187
 epoch: 11, train_loss: 0.8206, test_loss: 0.9473, test_f1: 0.5686
 epoch: 12, train_loss: 0.8257, test_loss: 0.9123, test_f1: 0.5704
 epoch: 13, train_loss: 0.8144, test_loss: 0.9188, test_f1: 0.5077
 epoch: 14, train_loss: 0.8215, test_loss: 1.8326, test_f1: 0.3721
 epoch: 15, train_loss: 0.8089, test_loss: 0.8319, test_f1: 0.6000
 epoch: 16, train_loss: 0.7914, test_loss: 0.9169, test_f1: 0.5996
 epoch: 17, train_loss: 0.7825, test_loss: 0.8969, test_f1: 0.6013
 epoch: 18, train_loss: 0.7917, test_loss: 0.8509, test_f1: 0.5659
 epoch: 19, train_loss: 0.7540, test_loss: 1.0957, test_f1: 0.5254
 epoch: 20, train_loss: 0.7653, test_loss: 0.8102, test_f1: 0.6224
 epoch: 21, train_loss: 0.7635, test_loss: 0.7550, test_f1: 0.5845
 epoch: 22, train_loss: 0.7409, test_loss: 0.8601, test_f1: 0.6372
 epoch: 23, train_loss: 0.7662, test_loss: 0.7905, test_f1: 0.6429
 epoch: 24, train_loss: 0.7324, test_loss: 0.7964, test_f1: 0.6469
 epoch: 25, train_loss: 0.7220, test_loss: 0.7829, test_f1: 0.6318
 epoch: 26, train_loss: 0.7275, test_loss: 0.7533, test_f1: 0.6542
 epoch: 27, train_loss: 0.7331, test_loss: 0.8600, test_f1: 0.6277
 epoch: 28, train_loss: 0.7246, test_loss: 0.7838, test_f1: 0.6197
 epoch: 29, train_loss: 0.7201, test_loss: 0.8199, test_f1: 0.5971
 epoch: 30, train_loss: 0.7085, test_loss: 0.8976, test_f1: 0.6077
 epoch: 31, train_loss: 0.7099, test_loss: 0.8859, test_f1: 0.5902
 epoch: 32, train_loss: 0.7024, test_loss: 0.8381, test_f1: 0.6552
 epoch: 33, train_loss: 0.7127, test_loss: 0.8123, test_f1: 0.6380
 epoch: 34, train_loss: 0.6909, test_loss: 0.7827, test_f1: 0.6614
 epoch: 35, train_loss: 0.6839, test_loss: 0.8077, test_f1: 0.6144
 epoch: 36, train_loss: 0.6666, test_loss: 0.7966, test_f1: 0.6359
 epoch: 37, train_loss: 0.6753, test_loss: 0.8340, test_f1: 0.6108
 epoch: 38, train_loss: 0.7041, test_loss: 0.7445, test_f1: 0.6385
 epoch: 39, train_loss: 0.6951, test_loss: 0.8367, test_f1: 0.6191
 epoch: 40, train_loss: 0.6640, test_loss: 0.8575, test_f1: 0.6760
 epoch: 41, train_loss: 0.6463, test_loss: 0.8701, test_f1: 0.6339
 epoch: 42, train_loss: 0.6582, test_loss: 0.9337, test_f1: 0.6090
 epoch: 43, train_loss: 0.6846, test_loss: 0.8418, test_f1: 0.6310
 epoch: 44, train_loss: 0.6484, test_loss: 0.9076, test_f1: 0.5793
 epoch: 45, train_loss: 0.6838, test_loss: 0.7722, test_f1: 0.6193
 epoch: 46, train_loss: 0.6326, test_loss: 0.8131, test_f1: 0.6582
 epoch: 47, train_loss: 0.6421, test_loss: 0.8543, test_f1: 0.6541
 epoch: 48, train_loss: 0.6201, test_loss: 0.9256, test_f1: 0.6567
 epoch: 49, train_loss: 0.6377, test_loss: 0.8177, test_f1: 0.6423
 epoch: 50, train_loss: 0.6378, test_loss: 0.9172, test_f1: 0.6381
 epoch: 51, train_loss: 0.5932, test_loss: 0.8817, test_f1: 0.6631
 epoch: 52, train_loss: 0.6034, test_loss: 0.8284, test_f1: 0.6840
 epoch: 53, train_loss: 0.5803, test_loss: 0.7935, test_f1: 0.6521
 epoch: 54, train_loss: 0.5894, test_loss: 0.8999, test_f1: 0.6797
 epoch: 55, train_loss: 0.5738, test_loss: 0.8669, test_f1: 0.6787
 epoch: 56, train_loss: 0.5564, test_loss: 0.9412, test_f1: 0.6617
 epoch: 57, train_loss: 0.5644, test_loss: 0.9669, test_f1: 0.6253
 epoch: 58, train_loss: 0.5668, test_loss: 0.9721, test_f1: 0.6646
 epoch: 59, train_loss: 0.5694, test_loss: 0.9016, test_f1: 0.6915
 epoch: 60, train_loss: 0.5630, test_loss: 0.8975, test_f1: 0.6854
 epoch: 61, train_loss: 0.5454, test_loss: 0.9170, test_f1: 0.6890
 epoch: 62, train_loss: 0.5703, test_loss: 0.9464, test_f1: 0.6735
 epoch: 63, train_loss: 0.5449, test_loss: 0.9460, test_f1: 0.6606
 epoch: 64, train_loss: 0.5667, test_loss: 0.9358, test_f1: 0.6745
 epoch: 65, train_loss: 0.5330, test_loss: 0.9780, test_f1: 0.6705
 epoch: 66, train_loss: 0.5405, test_loss: 1.0339, test_f1: 0.6588
 epoch: 67, train_loss: 0.5583, test_loss: 1.0080, test_f1: 0.6741
 epoch: 68, train_loss: 0.5479, test_loss: 0.9301, test_f1: 0.6751
 epoch: 69, train_loss: 0.5599, test_loss: 0.8950, test_f1: 0.6948
 epoch: 70, train_loss: 0.5393, test_loss: 1.0400, test_f1: 0.6743
 epoch: 71, train_loss: 0.5313, test_loss: 0.8887, test_f1: 0.6648
 epoch: 72, train_loss: 0.5271, test_loss: 0.9692, test_f1: 0.6455
 epoch: 73, train_loss: 0.5114, test_loss: 0.9519, test_f1: 0.6801
 epoch: 74, train_loss: 0.5408, test_loss: 0.8950, test_f1: 0.6599
 epoch: 75, train_loss: 0.5405, test_loss: 1.0311, test_f1: 0.6541
 epoch: 76, train_loss: 0.5296, test_loss: 1.0435, test_f1: 0.6614
 epoch: 77, train_loss: 0.5258, test_loss: 0.9512, test_f1: 0.6729
 epoch: 78, train_loss: 0.5082, test_loss: 0.9301, test_f1: 0.6846
 epoch: 79, train_loss: 0.5294, test_loss: 1.0197, test_f1: 0.6736
 epoch: 80, train_loss: 0.5240, test_loss: 0.9153, test_f1: 0.6775
 epoch: 81, train_loss: 0.5254, test_loss: 0.9407, test_f1: 0.6612
 epoch: 82, train_loss: 0.5233, test_loss: 0.8864, test_f1: 0.6501
 epoch: 83, train_loss: 0.5011, test_loss: 0.9568, test_f1: 0.6570
 epoch: 84, train_loss: 0.5105, test_loss: 0.9581, test_f1: 0.6437
 epoch: 85, train_loss: 0.5014, test_loss: 0.9795, test_f1: 0.6598
 epoch: 86, train_loss: 0.4957, test_loss: 0.8443, test_f1: 0.6906
 epoch: 87, train_loss: 0.4934, test_loss: 0.9724, test_f1: 0.6731
 epoch: 88, train_loss: 0.5041, test_loss: 0.8337, test_f1: 0.6831
 epoch: 89, train_loss: 0.5026, test_loss: 0.9807, test_f1: 0.6436
 epoch: 90, train_loss: 0.5014, test_loss: 0.9422, test_f1: 0.6924
 epoch: 91, train_loss: 0.4988, test_loss: 0.9948, test_f1: 0.6561
 epoch: 92, train_loss: 0.4935, test_loss: 0.9428, test_f1: 0.6600
 epoch: 93, train_loss: 0.4876, test_loss: 0.8847, test_f1: 0.6955
 epoch: 94, train_loss: 0.4925, test_loss: 0.8745, test_f1: 0.6803
 epoch: 95, train_loss: 0.4795, test_loss: 0.8921, test_f1: 0.6928
 epoch: 96, train_loss: 0.4918, test_loss: 0.8530, test_f1: 0.6714
 epoch: 97, train_loss: 0.4939, test_loss: 0.9347, test_f1: 0.6747
 epoch: 98, train_loss: 0.4869, test_loss: 0.9848, test_f1: 0.6711
 epoch: 99, train_loss: 0.4687, test_loss: 0.8262, test_f1: 0.6834
##################ITERATION #2 ****************************************
 epoch: 0, train_loss: 1.1078, test_loss: 1.2142, test_f1: 0.3692
 epoch: 1, train_loss: 0.9884, test_loss: 0.9795, test_f1: 0.4861
 epoch: 2, train_loss: 0.9398, test_loss: 0.9884, test_f1: 0.4806
 epoch: 3, train_loss: 0.9369, test_loss: 0.9406, test_f1: 0.4649
 epoch: 4, train_loss: 0.9014, test_loss: 0.8873, test_f1: 0.5422
 epoch: 5, train_loss: 0.8844, test_loss: 0.8701, test_f1: 0.5469
 epoch: 6, train_loss: 0.8853, test_loss: 0.9067, test_f1: 0.5135
 epoch: 7, train_loss: 0.8674, test_loss: 0.8397, test_f1: 0.5366
 epoch: 8, train_loss: 0.8634, test_loss: 0.9184, test_f1: 0.4735
 epoch: 9, train_loss: 0.8490, test_loss: 0.8998, test_f1: 0.5414
 epoch: 10, train_loss: 0.8283, test_loss: 0.8227, test_f1: 0.5642
 epoch: 11, train_loss: 0.8322, test_loss: 0.8196, test_f1: 0.5512
 epoch: 12, train_loss: 0.8274, test_loss: 0.8384, test_f1: 0.5243
 epoch: 13, train_loss: 0.8133, test_loss: 0.8424, test_f1: 0.5689
 epoch: 14, train_loss: 0.8054, test_loss: 0.8665, test_f1: 0.5746
 epoch: 15, train_loss: 0.7927, test_loss: 0.7831, test_f1: 0.5831
 epoch: 16, train_loss: 0.7882, test_loss: 0.8225, test_f1: 0.5958
 epoch: 17, train_loss: 0.7865, test_loss: 0.7977, test_f1: 0.6223
 epoch: 18, train_loss: 0.7711, test_loss: 0.8818, test_f1: 0.5590
 epoch: 19, train_loss: 0.7657, test_loss: 0.8675, test_f1: 0.5748
 epoch: 20, train_loss: 0.7703, test_loss: 0.8136, test_f1: 0.6052
 epoch: 21, train_loss: 0.7701, test_loss: 0.8675, test_f1: 0.5623
 epoch: 22, train_loss: 0.7486, test_loss: 0.7736, test_f1: 0.6393
 epoch: 23, train_loss: 0.7484, test_loss: 0.7592, test_f1: 0.6495
 epoch: 24, train_loss: 0.7489, test_loss: 0.7688, test_f1: 0.6024
 epoch: 25, train_loss: 0.7451, test_loss: 0.7798, test_f1: 0.6022
 epoch: 26, train_loss: 0.7497, test_loss: 0.7235, test_f1: 0.6281
 epoch: 27, train_loss: 0.7539, test_loss: 0.8787, test_f1: 0.6146
 epoch: 28, train_loss: 0.7162, test_loss: 0.7625, test_f1: 0.6177
 epoch: 29, train_loss: 0.7354, test_loss: 0.7602, test_f1: 0.6311
 epoch: 30, train_loss: 0.7244, test_loss: 0.9250, test_f1: 0.5692
 epoch: 31, train_loss: 0.7171, test_loss: 0.7301, test_f1: 0.6358
 epoch: 32, train_loss: 0.7089, test_loss: 0.7915, test_f1: 0.6222
 epoch: 33, train_loss: 0.7186, test_loss: 0.7627, test_f1: 0.6164
 epoch: 34, train_loss: 0.7222, test_loss: 0.8503, test_f1: 0.6181
 epoch: 35, train_loss: 0.7133, test_loss: 0.9120, test_f1: 0.6091
 epoch: 36, train_loss: 0.6927, test_loss: 0.8575, test_f1: 0.6435
 epoch: 37, train_loss: 0.7106, test_loss: 0.8474, test_f1: 0.6389
 epoch: 38, train_loss: 0.6938, test_loss: 0.9322, test_f1: 0.6035
 epoch: 39, train_loss: 0.7078, test_loss: 1.0110, test_f1: 0.6225
 epoch: 40, train_loss: 0.6988, test_loss: 0.8980, test_f1: 0.6342
 epoch: 41, train_loss: 0.6989, test_loss: 0.7615, test_f1: 0.6361
 epoch: 42, train_loss: 0.6825, test_loss: 0.7363, test_f1: 0.6388
 epoch: 43, train_loss: 0.6901, test_loss: 1.0649, test_f1: 0.5895
 epoch: 44, train_loss: 0.6817, test_loss: 0.7953, test_f1: 0.6340
 epoch: 45, train_loss: 0.6788, test_loss: 0.8771, test_f1: 0.6272
 epoch: 46, train_loss: 0.6752, test_loss: 0.9377, test_f1: 0.5903
 epoch: 47, train_loss: 0.6739, test_loss: 0.8620, test_f1: 0.6479
 epoch: 48, train_loss: 0.6787, test_loss: 0.9505, test_f1: 0.6195
 epoch: 49, train_loss: 0.6622, test_loss: 0.8551, test_f1: 0.6548
 epoch: 50, train_loss: 0.6673, test_loss: 0.8298, test_f1: 0.6536
 epoch: 51, train_loss: 0.6408, test_loss: 0.8411, test_f1: 0.6543
 epoch: 52, train_loss: 0.6345, test_loss: 0.9397, test_f1: 0.6522
 epoch: 53, train_loss: 0.6182, test_loss: 0.8581, test_f1: 0.6387
 epoch: 54, train_loss: 0.6030, test_loss: 0.8204, test_f1: 0.6679
 epoch: 55, train_loss: 0.6128, test_loss: 0.8825, test_f1: 0.6642
 epoch: 56, train_loss: 0.5959, test_loss: 0.9206, test_f1: 0.6310
 epoch: 57, train_loss: 0.6007, test_loss: 0.8719, test_f1: 0.6552
 epoch: 58, train_loss: 0.5990, test_loss: 0.8802, test_f1: 0.6612
 epoch: 59, train_loss: 0.5998, test_loss: 0.9312, test_f1: 0.6694
 epoch: 60, train_loss: 0.6086, test_loss: 0.9017, test_f1: 0.6560
 epoch: 61, train_loss: 0.6113, test_loss: 0.9143, test_f1: 0.6536
 epoch: 62, train_loss: 0.6007, test_loss: 0.9121, test_f1: 0.6543
 epoch: 63, train_loss: 0.5860, test_loss: 0.9210, test_f1: 0.6486
 epoch: 64, train_loss: 0.5903, test_loss: 0.9292, test_f1: 0.6467
 epoch: 65, train_loss: 0.5874, test_loss: 0.9270, test_f1: 0.6441
 epoch: 66, train_loss: 0.5963, test_loss: 0.8708, test_f1: 0.6799
 epoch: 67, train_loss: 0.5897, test_loss: 0.9148, test_f1: 0.6181
 epoch: 68, train_loss: 0.5965, test_loss: 0.9554, test_f1: 0.6396
 epoch: 69, train_loss: 0.5767, test_loss: 1.0345, test_f1: 0.6502
 epoch: 70, train_loss: 0.5838, test_loss: 0.9188, test_f1: 0.6441
 epoch: 71, train_loss: 0.5625, test_loss: 0.9086, test_f1: 0.6665
 epoch: 72, train_loss: 0.5829, test_loss: 0.9519, test_f1: 0.6835
 epoch: 73, train_loss: 0.5873, test_loss: 1.0434, test_f1: 0.6600
 epoch: 74, train_loss: 0.5732, test_loss: 0.9676, test_f1: 0.6598
 epoch: 75, train_loss: 0.5639, test_loss: 0.8440, test_f1: 0.6668
 epoch: 76, train_loss: 0.5642, test_loss: 1.0292, test_f1: 0.6458
 epoch: 77, train_loss: 0.5741, test_loss: 1.0264, test_f1: 0.6461
 epoch: 78, train_loss: 0.5708, test_loss: 1.0664, test_f1: 0.6505
 epoch: 79, train_loss: 0.5733, test_loss: 1.0655, test_f1: 0.6560
 epoch: 80, train_loss: 0.5769, test_loss: 1.0006, test_f1: 0.6265
 epoch: 81, train_loss: 0.5576, test_loss: 0.9822, test_f1: 0.6507
 epoch: 82, train_loss: 0.5506, test_loss: 1.1031, test_f1: 0.6777
 epoch: 83, train_loss: 0.5521, test_loss: 0.9904, test_f1: 0.6498
 epoch: 84, train_loss: 0.5585, test_loss: 1.1367, test_f1: 0.6689
 epoch: 85, train_loss: 0.5754, test_loss: 1.0790, test_f1: 0.6357
 epoch: 86, train_loss: 0.5297, test_loss: 0.9929, test_f1: 0.6660
 epoch: 87, train_loss: 0.5433, test_loss: 1.0994, test_f1: 0.6642
 epoch: 88, train_loss: 0.5584, test_loss: 1.1120, test_f1: 0.6546
 epoch: 89, train_loss: 0.5443, test_loss: 1.1233, test_f1: 0.6837
 epoch: 90, train_loss: 0.5434, test_loss: 1.0766, test_f1: 0.6421
 epoch: 91, train_loss: 0.5530, test_loss: 1.1042, test_f1: 0.6740
 epoch: 92, train_loss: 0.5582, test_loss: 0.9683, test_f1: 0.6609
 epoch: 93, train_loss: 0.5380, test_loss: 1.0723, test_f1: 0.6584
 epoch: 94, train_loss: 0.5411, test_loss: 0.9570, test_f1: 0.6949
 epoch: 95, train_loss: 0.5161, test_loss: 1.0805, test_f1: 0.6681
 epoch: 96, train_loss: 0.5270, test_loss: 1.1832, test_f1: 0.6592
 epoch: 97, train_loss: 0.5266, test_loss: 1.2080, test_f1: 0.6448
 epoch: 98, train_loss: 0.5384, test_loss: 1.1166, test_f1: 0.6974
 epoch: 99, train_loss: 0.5108, test_loss: 1.2408, test_f1: 0.6602
##################ITERATION #3 ****************************************
 epoch: 0, train_loss: 1.1114, test_loss: 0.9560, test_f1: 0.4797
 epoch: 1, train_loss: 0.9735, test_loss: 0.9322, test_f1: 0.4858
 epoch: 2, train_loss: 0.9481, test_loss: 0.9732, test_f1: 0.5358
 epoch: 3, train_loss: 0.9386, test_loss: 1.0077, test_f1: 0.5161
 epoch: 4, train_loss: 0.9160, test_loss: 0.9179, test_f1: 0.5127
 epoch: 5, train_loss: 0.9036, test_loss: 0.9456, test_f1: 0.4820
 epoch: 6, train_loss: 0.8773, test_loss: 0.8796, test_f1: 0.5737
 epoch: 7, train_loss: 0.8838, test_loss: 0.8879, test_f1: 0.5406
 epoch: 8, train_loss: 0.8525, test_loss: 0.8221, test_f1: 0.5675
 epoch: 9, train_loss: 0.8708, test_loss: 0.8694, test_f1: 0.5055
 epoch: 10, train_loss: 0.8533, test_loss: 0.9731, test_f1: 0.5285
 epoch: 11, train_loss: 0.8514, test_loss: 0.8709, test_f1: 0.5287
 epoch: 12, train_loss: 0.8352, test_loss: 1.0314, test_f1: 0.5176
 epoch: 13, train_loss: 0.8401, test_loss: 0.8865, test_f1: 0.6052
 epoch: 14, train_loss: 0.8324, test_loss: 1.0025, test_f1: 0.5489
 epoch: 15, train_loss: 0.8318, test_loss: 0.8226, test_f1: 0.5996
 epoch: 16, train_loss: 0.8186, test_loss: 0.8297, test_f1: 0.5606
 epoch: 17, train_loss: 0.8020, test_loss: 1.0079, test_f1: 0.6143
 epoch: 18, train_loss: 0.8031, test_loss: 0.8484, test_f1: 0.6038
 epoch: 19, train_loss: 0.7999, test_loss: 0.9470, test_f1: 0.5288
 epoch: 20, train_loss: 0.8022, test_loss: 0.9021, test_f1: 0.6269
 epoch: 21, train_loss: 0.7900, test_loss: 0.8852, test_f1: 0.6180
 epoch: 22, train_loss: 0.7847, test_loss: 0.9125, test_f1: 0.5891
 epoch: 23, train_loss: 0.7711, test_loss: 0.9066, test_f1: 0.5753
 epoch: 24, train_loss: 0.7794, test_loss: 0.9072, test_f1: 0.5949
 epoch: 25, train_loss: 0.7701, test_loss: 0.8958, test_f1: 0.6141
 epoch: 26, train_loss: 0.7700, test_loss: 1.0225, test_f1: 0.5832
 epoch: 27, train_loss: 0.7725, test_loss: 0.9458, test_f1: 0.6034
 epoch: 28, train_loss: 0.7588, test_loss: 0.8751, test_f1: 0.5917
 epoch: 29, train_loss: 0.7522, test_loss: 0.9316, test_f1: 0.5901
 epoch: 30, train_loss: 0.7405, test_loss: 0.9628, test_f1: 0.6378
 epoch: 31, train_loss: 0.7357, test_loss: 0.9088, test_f1: 0.6368
 epoch: 32, train_loss: 0.7410, test_loss: 1.0238, test_f1: 0.5867
 epoch: 33, train_loss: 0.7351, test_loss: 0.9483, test_f1: 0.6457
 epoch: 34, train_loss: 0.7395, test_loss: 0.8580, test_f1: 0.6630
 epoch: 35, train_loss: 0.7188, test_loss: 0.9932, test_f1: 0.6058
 epoch: 36, train_loss: 0.7340, test_loss: 0.9060, test_f1: 0.6462
 epoch: 37, train_loss: 0.7118, test_loss: 0.9195, test_f1: 0.6137
 epoch: 38, train_loss: 0.7135, test_loss: 0.9065, test_f1: 0.6489
 epoch: 39, train_loss: 0.6931, test_loss: 0.8334, test_f1: 0.6550
 epoch: 40, train_loss: 0.6851, test_loss: 1.0584, test_f1: 0.6236
 epoch: 41, train_loss: 0.6854, test_loss: 0.9521, test_f1: 0.6454
 epoch: 42, train_loss: 0.6942, test_loss: 1.0035, test_f1: 0.6266
 epoch: 43, train_loss: 0.6810, test_loss: 0.9633, test_f1: 0.6617
 epoch: 44, train_loss: 0.7034, test_loss: 1.0574, test_f1: 0.6097
 epoch: 45, train_loss: 0.6782, test_loss: 1.0909, test_f1: 0.6372
 epoch: 46, train_loss: 0.6768, test_loss: 0.9715, test_f1: 0.6392
 epoch: 47, train_loss: 0.6700, test_loss: 1.0539, test_f1: 0.6280
 epoch: 48, train_loss: 0.6839, test_loss: 1.0565, test_f1: 0.6162
 epoch: 49, train_loss: 0.6681, test_loss: 0.9836, test_f1: 0.6325
 epoch: 50, train_loss: 0.6778, test_loss: 0.9843, test_f1: 0.6435
 epoch: 51, train_loss: 0.6286, test_loss: 1.0800, test_f1: 0.6165
 epoch: 52, train_loss: 0.6314, test_loss: 0.9918, test_f1: 0.6697
 epoch: 53, train_loss: 0.6300, test_loss: 1.0432, test_f1: 0.6570
 epoch: 54, train_loss: 0.6166, test_loss: 1.0147, test_f1: 0.6682
 epoch: 55, train_loss: 0.6258, test_loss: 1.0553, test_f1: 0.6559
 epoch: 56, train_loss: 0.6011, test_loss: 1.1319, test_f1: 0.6495
 epoch: 57, train_loss: 0.6151, test_loss: 1.2120, test_f1: 0.6647
 epoch: 58, train_loss: 0.5986, test_loss: 1.1432, test_f1: 0.6347
 epoch: 59, train_loss: 0.6054, test_loss: 1.2004, test_f1: 0.6114
 epoch: 60, train_loss: 0.6009, test_loss: 1.1312, test_f1: 0.6484
 epoch: 61, train_loss: 0.5991, test_loss: 1.0412, test_f1: 0.6363
 epoch: 62, train_loss: 0.5897, test_loss: 1.1447, test_f1: 0.6589
 epoch: 63, train_loss: 0.5951, test_loss: 1.0830, test_f1: 0.6401
 epoch: 64, train_loss: 0.5993, test_loss: 1.0850, test_f1: 0.6640
 epoch: 65, train_loss: 0.5893, test_loss: 1.0943, test_f1: 0.6546
 epoch: 66, train_loss: 0.5770, test_loss: 1.2340, test_f1: 0.6369
 epoch: 67, train_loss: 0.5874, test_loss: 0.8936, test_f1: 0.6645
 epoch: 68, train_loss: 0.5874, test_loss: 1.1178, test_f1: 0.6545
 epoch: 69, train_loss: 0.5584, test_loss: 1.2189, test_f1: 0.6630
 epoch: 70, train_loss: 0.5791, test_loss: 1.2391, test_f1: 0.6400
 epoch: 71, train_loss: 0.5858, test_loss: 1.1879, test_f1: 0.6634
 epoch: 72, train_loss: 0.5828, test_loss: 1.0583, test_f1: 0.6565
 epoch: 73, train_loss: 0.5766, test_loss: 1.2256, test_f1: 0.6642
 epoch: 74, train_loss: 0.5611, test_loss: 1.3329, test_f1: 0.6386
 epoch: 75, train_loss: 0.5783, test_loss: 1.3455, test_f1: 0.6314
 epoch: 76, train_loss: 0.5559, test_loss: 1.1421, test_f1: 0.6762
 epoch: 77, train_loss: 0.5756, test_loss: 1.2074, test_f1: 0.6744
 epoch: 78, train_loss: 0.5652, test_loss: 1.2028, test_f1: 0.6674
 epoch: 79, train_loss: 0.5735, test_loss: 1.2686, test_f1: 0.6585
 epoch: 80, train_loss: 0.5697, test_loss: 1.2576, test_f1: 0.6570
 epoch: 81, train_loss: 0.5458, test_loss: 1.2609, test_f1: 0.6549
 epoch: 82, train_loss: 0.5547, test_loss: 1.1802, test_f1: 0.6611
 epoch: 83, train_loss: 0.5374, test_loss: 1.2543, test_f1: 0.6844
 epoch: 84, train_loss: 0.5393, test_loss: 1.0841, test_f1: 0.6872
 epoch: 85, train_loss: 0.5580, test_loss: 1.2187, test_f1: 0.6731
 epoch: 86, train_loss: 0.5381, test_loss: 1.1389, test_f1: 0.6728
 epoch: 87, train_loss: 0.5257, test_loss: 1.2862, test_f1: 0.6567
 epoch: 88, train_loss: 0.5617, test_loss: 1.2497, test_f1: 0.6610
 epoch: 89, train_loss: 0.5601, test_loss: 1.0734, test_f1: 0.6736
 epoch: 90, train_loss: 0.5588, test_loss: 1.2037, test_f1: 0.6363
 epoch: 91, train_loss: 0.5388, test_loss: 1.2294, test_f1: 0.6749
 epoch: 92, train_loss: 0.5364, test_loss: 1.2230, test_f1: 0.6504
 epoch: 93, train_loss: 0.5398, test_loss: 1.2426, test_f1: 0.6448
 epoch: 94, train_loss: 0.5320, test_loss: 1.1471, test_f1: 0.6774
 epoch: 95, train_loss: 0.5361, test_loss: 1.1296, test_f1: 0.6585
 epoch: 96, train_loss: 0.5293, test_loss: 1.1857, test_f1: 0.6668
 epoch: 97, train_loss: 0.5235, test_loss: 1.2753, test_f1: 0.6512
 epoch: 98, train_loss: 0.5259, test_loss: 1.2203, test_f1: 0.6545
 epoch: 99, train_loss: 0.5361, test_loss: 1.1446, test_f1: 0.6518
##################ITERATION #4 ****************************************
 epoch: 0, train_loss: 1.1201, test_loss: 1.0414, test_f1: 0.4691
 epoch: 1, train_loss: 0.9975, test_loss: 1.0408, test_f1: 0.4694
 epoch: 2, train_loss: 0.9661, test_loss: 0.9636, test_f1: 0.4818
 epoch: 3, train_loss: 0.9496, test_loss: 0.9587, test_f1: 0.5087
 epoch: 4, train_loss: 0.9404, test_loss: 0.9919, test_f1: 0.4999
 epoch: 5, train_loss: 0.9145, test_loss: 1.1219, test_f1: 0.4718
 epoch: 6, train_loss: 0.9181, test_loss: 0.9591, test_f1: 0.5124
 epoch: 7, train_loss: 0.8915, test_loss: 0.8923, test_f1: 0.5605
 epoch: 8, train_loss: 0.8848, test_loss: 0.9103, test_f1: 0.5516
 epoch: 9, train_loss: 0.8645, test_loss: 0.9161, test_f1: 0.5055
 epoch: 10, train_loss: 0.8665, test_loss: 0.8983, test_f1: 0.5036
 epoch: 11, train_loss: 0.8864, test_loss: 0.9034, test_f1: 0.5396
 epoch: 12, train_loss: 0.8613, test_loss: 1.0070, test_f1: 0.5123
 epoch: 13, train_loss: 0.8395, test_loss: 0.9111, test_f1: 0.5395
 epoch: 14, train_loss: 0.8332, test_loss: 0.8910, test_f1: 0.5447
 epoch: 15, train_loss: 0.8265, test_loss: 0.8824, test_f1: 0.5600
 epoch: 16, train_loss: 0.8249, test_loss: 0.9329, test_f1: 0.5244
 epoch: 17, train_loss: 0.8182, test_loss: 0.9951, test_f1: 0.5564
 epoch: 18, train_loss: 0.8195, test_loss: 0.8749, test_f1: 0.5770
 epoch: 19, train_loss: 0.8200, test_loss: 0.8820, test_f1: 0.6210
 epoch: 20, train_loss: 0.8127, test_loss: 0.9124, test_f1: 0.5451
 epoch: 21, train_loss: 0.7970, test_loss: 0.9089, test_f1: 0.5637
 epoch: 22, train_loss: 0.7929, test_loss: 0.8681, test_f1: 0.5892
 epoch: 23, train_loss: 0.7855, test_loss: 0.9399, test_f1: 0.5682
 epoch: 24, train_loss: 0.8063, test_loss: 0.9206, test_f1: 0.5622
 epoch: 25, train_loss: 0.8010, test_loss: 0.8147, test_f1: 0.5764
 epoch: 26, train_loss: 0.8026, test_loss: 0.8915, test_f1: 0.5543
 epoch: 27, train_loss: 0.7820, test_loss: 0.8229, test_f1: 0.6067
 epoch: 28, train_loss: 0.7827, test_loss: 0.8675, test_f1: 0.5940
 epoch: 29, train_loss: 0.7802, test_loss: 0.8244, test_f1: 0.5808
 epoch: 30, train_loss: 0.7680, test_loss: 0.8134, test_f1: 0.6111
 epoch: 31, train_loss: 0.7516, test_loss: 0.8416, test_f1: 0.6108
 epoch: 32, train_loss: 0.7681, test_loss: 0.8393, test_f1: 0.5929
 epoch: 33, train_loss: 0.7435, test_loss: 0.9148, test_f1: 0.5823
 epoch: 34, train_loss: 0.7564, test_loss: 0.8429, test_f1: 0.5955
 epoch: 35, train_loss: 0.7432, test_loss: 0.8678, test_f1: 0.5986
 epoch: 36, train_loss: 0.7482, test_loss: 0.8161, test_f1: 0.6068
 epoch: 37, train_loss: 0.7600, test_loss: 0.8006, test_f1: 0.6126
 epoch: 38, train_loss: 0.7207, test_loss: 0.7718, test_f1: 0.6306
 epoch: 39, train_loss: 0.7438, test_loss: 0.8674, test_f1: 0.6098
 epoch: 40, train_loss: 0.7370, test_loss: 0.8289, test_f1: 0.6231
 epoch: 41, train_loss: 0.7258, test_loss: 0.8457, test_f1: 0.6182
 epoch: 42, train_loss: 0.7217, test_loss: 0.7405, test_f1: 0.6145
 epoch: 43, train_loss: 0.7356, test_loss: 0.9230, test_f1: 0.5541
 epoch: 44, train_loss: 0.7300, test_loss: 0.8197, test_f1: 0.6053
 epoch: 45, train_loss: 0.7267, test_loss: 0.8219, test_f1: 0.5949
 epoch: 46, train_loss: 0.7062, test_loss: 0.8339, test_f1: 0.6143
 epoch: 47, train_loss: 0.7220, test_loss: 0.9645, test_f1: 0.5813
 epoch: 48, train_loss: 0.7054, test_loss: 0.8558, test_f1: 0.6015
 epoch: 49, train_loss: 0.7039, test_loss: 0.8439, test_f1: 0.5984
 epoch: 50, train_loss: 0.7268, test_loss: 0.9026, test_f1: 0.5629
 epoch: 51, train_loss: 0.6806, test_loss: 0.8149, test_f1: 0.6275
 epoch: 52, train_loss: 0.6624, test_loss: 0.8347, test_f1: 0.6075
 epoch: 53, train_loss: 0.6635, test_loss: 0.8352, test_f1: 0.5839
 epoch: 54, train_loss: 0.6581, test_loss: 0.8181, test_f1: 0.5983
 epoch: 55, train_loss: 0.6536, test_loss: 0.8271, test_f1: 0.5999
 epoch: 56, train_loss: 0.6500, test_loss: 0.8077, test_f1: 0.5981
 epoch: 57, train_loss: 0.6603, test_loss: 0.8579, test_f1: 0.6227
 epoch: 58, train_loss: 0.6437, test_loss: 0.8929, test_f1: 0.6180
 epoch: 59, train_loss: 0.6692, test_loss: 0.8350, test_f1: 0.5870
 epoch: 60, train_loss: 0.6470, test_loss: 0.8275, test_f1: 0.6135
 epoch: 61, train_loss: 0.6376, test_loss: 0.8416, test_f1: 0.6129
 epoch: 62, train_loss: 0.6549, test_loss: 0.8115, test_f1: 0.6244
 epoch: 63, train_loss: 0.6407, test_loss: 0.8269, test_f1: 0.6109
 epoch: 64, train_loss: 0.6384, test_loss: 0.7904, test_f1: 0.6154
 epoch: 65, train_loss: 0.6376, test_loss: 0.8340, test_f1: 0.6151
 epoch: 66, train_loss: 0.6369, test_loss: 0.8557, test_f1: 0.5952
 epoch: 67, train_loss: 0.6341, test_loss: 0.8898, test_f1: 0.5858
 epoch: 68, train_loss: 0.6178, test_loss: 0.8608, test_f1: 0.6175
 epoch: 69, train_loss: 0.6323, test_loss: 0.8613, test_f1: 0.6176
 epoch: 70, train_loss: 0.6180, test_loss: 0.8332, test_f1: 0.5968
 epoch: 71, train_loss: 0.6257, test_loss: 0.8386, test_f1: 0.6251
 epoch: 72, train_loss: 0.6122, test_loss: 0.8892, test_f1: 0.6058
 epoch: 73, train_loss: 0.6252, test_loss: 0.8771, test_f1: 0.5983
 epoch: 74, train_loss: 0.5994, test_loss: 0.8572, test_f1: 0.6260
 epoch: 75, train_loss: 0.6210, test_loss: 0.8248, test_f1: 0.6414
 epoch: 76, train_loss: 0.6177, test_loss: 0.8034, test_f1: 0.6240
 epoch: 77, train_loss: 0.6160, test_loss: 0.8321, test_f1: 0.6295
 epoch: 78, train_loss: 0.6130, test_loss: 0.8241, test_f1: 0.6506
 epoch: 79, train_loss: 0.6163, test_loss: 0.8257, test_f1: 0.6668
 epoch: 80, train_loss: 0.6172, test_loss: 0.8389, test_f1: 0.6291
 epoch: 81, train_loss: 0.6104, test_loss: 0.8720, test_f1: 0.6258
 epoch: 82, train_loss: 0.6179, test_loss: 0.8794, test_f1: 0.6461
 epoch: 83, train_loss: 0.6001, test_loss: 0.8977, test_f1: 0.6244
 epoch: 84, train_loss: 0.5945, test_loss: 0.7836, test_f1: 0.6301
 epoch: 85, train_loss: 0.5993, test_loss: 0.8194, test_f1: 0.6369
 epoch: 86, train_loss: 0.5833, test_loss: 0.8311, test_f1: 0.6268
 epoch: 87, train_loss: 0.6058, test_loss: 0.8068, test_f1: 0.6408
 epoch: 88, train_loss: 0.5958, test_loss: 0.8874, test_f1: 0.6391
 epoch: 89, train_loss: 0.5995, test_loss: 0.8825, test_f1: 0.6435
 epoch: 90, train_loss: 0.5854, test_loss: 0.9749, test_f1: 0.6467
 epoch: 91, train_loss: 0.5847, test_loss: 0.8853, test_f1: 0.6327
 epoch: 92, train_loss: 0.5745, test_loss: 0.8087, test_f1: 0.6381
 epoch: 93, train_loss: 0.5808, test_loss: 0.8995, test_f1: 0.6267
 epoch: 94, train_loss: 0.5785, test_loss: 0.8552, test_f1: 0.6312
 epoch: 95, train_loss: 0.5716, test_loss: 0.8986, test_f1: 0.6384
 epoch: 96, train_loss: 0.5768, test_loss: 0.9009, test_f1: 0.6213
 epoch: 97, train_loss: 0.5737, test_loss: 0.8812, test_f1: 0.6291
 epoch: 98, train_loss: 0.5766, test_loss: 0.8476, test_f1: 0.6392
 epoch: 99, train_loss: 0.5834, test_loss: 0.8249, test_f1: 0.6501
##################ITERATION #5 ****************************************
 epoch: 0, train_loss: 1.1499, test_loss: 1.0792, test_f1: 0.3445
 epoch: 1, train_loss: 0.9871, test_loss: 0.9986, test_f1: 0.5005
 epoch: 2, train_loss: 0.9444, test_loss: 1.0610, test_f1: 0.4493
 epoch: 3, train_loss: 0.9309, test_loss: 1.0843, test_f1: 0.4081
 epoch: 4, train_loss: 0.9222, test_loss: 0.9192, test_f1: 0.4909
 epoch: 5, train_loss: 0.9076, test_loss: 0.9856, test_f1: 0.4751
 epoch: 6, train_loss: 0.8979, test_loss: 0.8628, test_f1: 0.5424
 epoch: 7, train_loss: 0.8986, test_loss: 0.9697, test_f1: 0.5387
 epoch: 8, train_loss: 0.8833, test_loss: 0.9076, test_f1: 0.4988
 epoch: 9, train_loss: 0.8689, test_loss: 0.9161, test_f1: 0.5598
 epoch: 10, train_loss: 0.8735, test_loss: 0.9945, test_f1: 0.5336
 epoch: 11, train_loss: 0.8514, test_loss: 0.8457, test_f1: 0.5620
 epoch: 12, train_loss: 0.8530, test_loss: 0.8636, test_f1: 0.5330
 epoch: 13, train_loss: 0.8393, test_loss: 0.8109, test_f1: 0.5719
 epoch: 14, train_loss: 0.8338, test_loss: 0.9324, test_f1: 0.5319
 epoch: 15, train_loss: 0.8339, test_loss: 0.8059, test_f1: 0.6185
 epoch: 16, train_loss: 0.8138, test_loss: 0.8576, test_f1: 0.5437
 epoch: 17, train_loss: 0.8147, test_loss: 0.8331, test_f1: 0.5787
 epoch: 18, train_loss: 0.8025, test_loss: 0.9693, test_f1: 0.5178
 epoch: 19, train_loss: 0.8102, test_loss: 0.8306, test_f1: 0.6032
 epoch: 20, train_loss: 0.8075, test_loss: 0.9389, test_f1: 0.5859
 epoch: 21, train_loss: 0.7884, test_loss: 0.8060, test_f1: 0.6042
 epoch: 22, train_loss: 0.7764, test_loss: 0.8038, test_f1: 0.6181
 epoch: 23, train_loss: 0.8011, test_loss: 0.9680, test_f1: 0.5486
 epoch: 24, train_loss: 0.7872, test_loss: 0.8373, test_f1: 0.5806
 epoch: 25, train_loss: 0.7741, test_loss: 0.8833, test_f1: 0.6034
 epoch: 26, train_loss: 0.7566, test_loss: 0.7786, test_f1: 0.6172
 epoch: 27, train_loss: 0.7496, test_loss: 0.8745, test_f1: 0.5649
 epoch: 28, train_loss: 0.7629, test_loss: 1.0361, test_f1: 0.5193
 epoch: 29, train_loss: 0.7517, test_loss: 0.9464, test_f1: 0.5913
 epoch: 30, train_loss: 0.7497, test_loss: 0.8168, test_f1: 0.6534
 epoch: 31, train_loss: 0.7540, test_loss: 0.8002, test_f1: 0.6366
 epoch: 32, train_loss: 0.7475, test_loss: 0.8127, test_f1: 0.6171
 epoch: 33, train_loss: 0.7324, test_loss: 0.7748, test_f1: 0.6021
 epoch: 34, train_loss: 0.7314, test_loss: 0.8242, test_f1: 0.6375
 epoch: 35, train_loss: 0.7635, test_loss: 0.8221, test_f1: 0.5950
 epoch: 36, train_loss: 0.7258, test_loss: 0.9121, test_f1: 0.5765
 epoch: 37, train_loss: 0.7390, test_loss: 0.8350, test_f1: 0.6017
 epoch: 38, train_loss: 0.7328, test_loss: 0.7551, test_f1: 0.6359
 epoch: 39, train_loss: 0.7097, test_loss: 0.8921, test_f1: 0.5990
 epoch: 40, train_loss: 0.7068, test_loss: 0.8291, test_f1: 0.6092
 epoch: 41, train_loss: 0.7110, test_loss: 0.8072, test_f1: 0.6389
 epoch: 42, train_loss: 0.7042, test_loss: 0.8366, test_f1: 0.6674
 epoch: 43, train_loss: 0.7101, test_loss: 0.8110, test_f1: 0.6245
 epoch: 44, train_loss: 0.6848, test_loss: 0.8926, test_f1: 0.6658
 epoch: 45, train_loss: 0.7065, test_loss: 0.8515, test_f1: 0.6450
 epoch: 46, train_loss: 0.6942, test_loss: 0.8706, test_f1: 0.6019
 epoch: 47, train_loss: 0.6835, test_loss: 0.9147, test_f1: 0.6346
 epoch: 48, train_loss: 0.7045, test_loss: 0.8501, test_f1: 0.6324
 epoch: 49, train_loss: 0.6991, test_loss: 0.7112, test_f1: 0.6162
 epoch: 50, train_loss: 0.7117, test_loss: 0.8493, test_f1: 0.6423
 epoch: 51, train_loss: 0.6659, test_loss: 0.8034, test_f1: 0.6644
 epoch: 52, train_loss: 0.6537, test_loss: 0.7715, test_f1: 0.6560
 epoch: 53, train_loss: 0.6414, test_loss: 0.8980, test_f1: 0.6331
 epoch: 54, train_loss: 0.6299, test_loss: 0.8427, test_f1: 0.6349
 epoch: 55, train_loss: 0.6435, test_loss: 0.8055, test_f1: 0.6539
 epoch: 56, train_loss: 0.6210, test_loss: 0.8778, test_f1: 0.6503
 epoch: 57, train_loss: 0.6347, test_loss: 0.9328, test_f1: 0.6281
 epoch: 58, train_loss: 0.6259, test_loss: 0.7990, test_f1: 0.6736
 epoch: 59, train_loss: 0.6214, test_loss: 0.8165, test_f1: 0.6438
 epoch: 60, train_loss: 0.6325, test_loss: 0.8929, test_f1: 0.6447
 epoch: 61, train_loss: 0.6310, test_loss: 0.7924, test_f1: 0.6732
 epoch: 62, train_loss: 0.6139, test_loss: 0.7664, test_f1: 0.6623
 epoch: 63, train_loss: 0.6214, test_loss: 0.7875, test_f1: 0.6638
 epoch: 64, train_loss: 0.6100, test_loss: 0.7365, test_f1: 0.6772
 epoch: 65, train_loss: 0.5967, test_loss: 0.8896, test_f1: 0.6722
 epoch: 66, train_loss: 0.6158, test_loss: 0.8014, test_f1: 0.6598
 epoch: 67, train_loss: 0.5933, test_loss: 0.8011, test_f1: 0.6523
 epoch: 68, train_loss: 0.5911, test_loss: 0.7836, test_f1: 0.6895
 epoch: 69, train_loss: 0.6000, test_loss: 0.9001, test_f1: 0.6666
 epoch: 70, train_loss: 0.5913, test_loss: 0.7614, test_f1: 0.6974
 epoch: 71, train_loss: 0.5952, test_loss: 0.8683, test_f1: 0.6796
 epoch: 72, train_loss: 0.5857, test_loss: 0.8115, test_f1: 0.6487
 epoch: 73, train_loss: 0.5775, test_loss: 0.7461, test_f1: 0.6869
 epoch: 74, train_loss: 0.6047, test_loss: 0.7933, test_f1: 0.6916
 epoch: 75, train_loss: 0.5897, test_loss: 0.8250, test_f1: 0.6825
 epoch: 76, train_loss: 0.5912, test_loss: 0.8268, test_f1: 0.6706
 epoch: 77, train_loss: 0.5672, test_loss: 0.9549, test_f1: 0.6521
 epoch: 78, train_loss: 0.5644, test_loss: 0.8367, test_f1: 0.6667
 epoch: 79, train_loss: 0.5735, test_loss: 0.8686, test_f1: 0.6778
 epoch: 80, train_loss: 0.5755, test_loss: 0.8917, test_f1: 0.6739
 epoch: 81, train_loss: 0.5917, test_loss: 0.8371, test_f1: 0.6441
 epoch: 82, train_loss: 0.5871, test_loss: 1.0743, test_f1: 0.6002
 epoch: 83, train_loss: 0.5680, test_loss: 0.8016, test_f1: 0.6951
 epoch: 84, train_loss: 0.5585, test_loss: 0.8197, test_f1: 0.6543
 epoch: 85, train_loss: 0.5532, test_loss: 0.7999, test_f1: 0.6791
 epoch: 86, train_loss: 0.5533, test_loss: 0.8233, test_f1: 0.6545
 epoch: 87, train_loss: 0.5661, test_loss: 0.8550, test_f1: 0.6785
 epoch: 88, train_loss: 0.5548, test_loss: 0.8553, test_f1: 0.6965
 epoch: 89, train_loss: 0.5491, test_loss: 0.9387, test_f1: 0.6558
 epoch: 90, train_loss: 0.5787, test_loss: 0.8450, test_f1: 0.6787
 epoch: 91, train_loss: 0.5606, test_loss: 0.9261, test_f1: 0.6641
 epoch: 92, train_loss: 0.5607, test_loss: 0.8248, test_f1: 0.6785
 epoch: 93, train_loss: 0.5622, test_loss: 0.8117, test_f1: 0.6873
 epoch: 94, train_loss: 0.5604, test_loss: 0.8818, test_f1: 0.7022
 epoch: 95, train_loss: 0.5560, test_loss: 0.9110, test_f1: 0.6633
 epoch: 96, train_loss: 0.5599, test_loss: 0.9339, test_f1: 0.6801
 epoch: 97, train_loss: 0.5475, test_loss: 0.9237, test_f1: 0.6581
 epoch: 98, train_loss: 0.5467, test_loss: 0.9061, test_f1: 0.6783
 epoch: 99, train_loss: 0.5469, test_loss: 0.9225, test_f1: 0.6589
##################ITERATION #6 ****************************************
 epoch: 0, train_loss: 1.1312, test_loss: 1.1105, test_f1: 0.4233
 epoch: 1, train_loss: 0.9794, test_loss: 1.0476, test_f1: 0.4885
 epoch: 2, train_loss: 0.9527, test_loss: 0.9775, test_f1: 0.5113
 epoch: 3, train_loss: 0.9324, test_loss: 1.1807, test_f1: 0.4644
 epoch: 4, train_loss: 0.9370, test_loss: 1.0432, test_f1: 0.5087
 epoch: 5, train_loss: 0.9134, test_loss: 0.9319, test_f1: 0.5053
 epoch: 6, train_loss: 0.9139, test_loss: 1.0406, test_f1: 0.5449
 epoch: 7, train_loss: 0.8872, test_loss: 0.9985, test_f1: 0.5299
 epoch: 8, train_loss: 0.8870, test_loss: 0.9009, test_f1: 0.5310
 epoch: 9, train_loss: 0.8738, test_loss: 0.9190, test_f1: 0.5674
 epoch: 10, train_loss: 0.8617, test_loss: 0.9263, test_f1: 0.5748
 epoch: 11, train_loss: 0.8556, test_loss: 0.9110, test_f1: 0.5678
 epoch: 12, train_loss: 0.8818, test_loss: 0.9861, test_f1: 0.4926
 epoch: 13, train_loss: 0.8685, test_loss: 1.0297, test_f1: 0.5295
 epoch: 14, train_loss: 0.8724, test_loss: 0.9412, test_f1: 0.5378
 epoch: 15, train_loss: 0.8589, test_loss: 0.9498, test_f1: 0.5722
 epoch: 16, train_loss: 0.8347, test_loss: 0.8818, test_f1: 0.5793
 epoch: 17, train_loss: 0.8315, test_loss: 0.9003, test_f1: 0.5691
 epoch: 18, train_loss: 0.8321, test_loss: 0.8993, test_f1: 0.5692
 epoch: 19, train_loss: 0.8067, test_loss: 0.8429, test_f1: 0.5656
 epoch: 20, train_loss: 0.8145, test_loss: 0.7759, test_f1: 0.6239
 epoch: 21, train_loss: 0.8161, test_loss: 0.8513, test_f1: 0.5702
 epoch: 22, train_loss: 0.8024, test_loss: 0.8650, test_f1: 0.5901
 epoch: 23, train_loss: 0.8061, test_loss: 0.7606, test_f1: 0.6275
 epoch: 24, train_loss: 0.8022, test_loss: 0.9167, test_f1: 0.5955
 epoch: 25, train_loss: 0.7832, test_loss: 0.7994, test_f1: 0.6209
 epoch: 26, train_loss: 0.7860, test_loss: 0.8448, test_f1: 0.5769
 epoch: 27, train_loss: 0.7847, test_loss: 0.8119, test_f1: 0.6076
 epoch: 28, train_loss: 0.7811, test_loss: 0.7228, test_f1: 0.6532
 epoch: 29, train_loss: 0.7565, test_loss: 0.8436, test_f1: 0.5838
 epoch: 30, train_loss: 0.7838, test_loss: 0.8287, test_f1: 0.6251
 epoch: 31, train_loss: 0.7636, test_loss: 0.7909, test_f1: 0.5781
 epoch: 32, train_loss: 0.7462, test_loss: 0.7205, test_f1: 0.6389
 epoch: 33, train_loss: 0.7478, test_loss: 0.8661, test_f1: 0.5877
 epoch: 34, train_loss: 0.7594, test_loss: 0.8663, test_f1: 0.6318
 epoch: 35, train_loss: 0.7422, test_loss: 0.8591, test_f1: 0.6296
 epoch: 36, train_loss: 0.7519, test_loss: 0.8019, test_f1: 0.6297
 epoch: 37, train_loss: 0.7346, test_loss: 0.7741, test_f1: 0.6183
 epoch: 38, train_loss: 0.7326, test_loss: 0.7738, test_f1: 0.6316
 epoch: 39, train_loss: 0.7400, test_loss: 0.8237, test_f1: 0.6209
 epoch: 40, train_loss: 0.7413, test_loss: 0.7828, test_f1: 0.6254
 epoch: 41, train_loss: 0.7236, test_loss: 0.8264, test_f1: 0.5830
 epoch: 42, train_loss: 0.7083, test_loss: 0.7585, test_f1: 0.6564
 epoch: 43, train_loss: 0.7370, test_loss: 0.7549, test_f1: 0.6486
 epoch: 44, train_loss: 0.7237, test_loss: 0.7943, test_f1: 0.6550
 epoch: 45, train_loss: 0.7149, test_loss: 0.7326, test_f1: 0.6409
 epoch: 46, train_loss: 0.7128, test_loss: 0.7807, test_f1: 0.6286
 epoch: 47, train_loss: 0.7214, test_loss: 0.8153, test_f1: 0.6456
 epoch: 48, train_loss: 0.6993, test_loss: 0.7481, test_f1: 0.6658
 epoch: 49, train_loss: 0.7147, test_loss: 0.7960, test_f1: 0.6436
 epoch: 50, train_loss: 0.7170, test_loss: 0.7945, test_f1: 0.6353
 epoch: 51, train_loss: 0.6867, test_loss: 0.7952, test_f1: 0.6427
 epoch: 52, train_loss: 0.6668, test_loss: 0.7459, test_f1: 0.6585
 epoch: 53, train_loss: 0.6601, test_loss: 0.7719, test_f1: 0.6487
 epoch: 54, train_loss: 0.6647, test_loss: 0.7916, test_f1: 0.6509
 epoch: 55, train_loss: 0.6542, test_loss: 0.7318, test_f1: 0.6604
 epoch: 56, train_loss: 0.6585, test_loss: 0.7660, test_f1: 0.6559
 epoch: 57, train_loss: 0.6531, test_loss: 0.7540, test_f1: 0.6489
 epoch: 58, train_loss: 0.6577, test_loss: 0.7625, test_f1: 0.6614
 epoch: 59, train_loss: 0.6326, test_loss: 0.7758, test_f1: 0.6362
 epoch: 60, train_loss: 0.6395, test_loss: 0.8016, test_f1: 0.6532
 epoch: 61, train_loss: 0.6514, test_loss: 0.8141, test_f1: 0.6296
 epoch: 62, train_loss: 0.6415, test_loss: 0.7539, test_f1: 0.6557
 epoch: 63, train_loss: 0.6367, test_loss: 0.8017, test_f1: 0.6422
 epoch: 64, train_loss: 0.6334, test_loss: 0.8130, test_f1: 0.6527
 epoch: 65, train_loss: 0.6201, test_loss: 0.9085, test_f1: 0.5961
 epoch: 66, train_loss: 0.6185, test_loss: 0.7968, test_f1: 0.6321
 epoch: 67, train_loss: 0.6436, test_loss: 0.7654, test_f1: 0.6425
 epoch: 68, train_loss: 0.6328, test_loss: 0.7665, test_f1: 0.6512
 epoch: 69, train_loss: 0.6006, test_loss: 0.8088, test_f1: 0.6396
 epoch: 70, train_loss: 0.6380, test_loss: 0.7803, test_f1: 0.6555
 epoch: 71, train_loss: 0.6409, test_loss: 0.7532, test_f1: 0.6440
 epoch: 72, train_loss: 0.6035, test_loss: 0.8454, test_f1: 0.6387
 epoch: 73, train_loss: 0.6117, test_loss: 0.8186, test_f1: 0.6232
 epoch: 74, train_loss: 0.6099, test_loss: 0.8129, test_f1: 0.6228
 epoch: 75, train_loss: 0.6548, test_loss: 0.8255, test_f1: 0.6136
 epoch: 76, train_loss: 0.6267, test_loss: 0.7831, test_f1: 0.6361
 epoch: 77, train_loss: 0.6408, test_loss: 0.8556, test_f1: 0.6038
 epoch: 78, train_loss: 0.6163, test_loss: 0.8933, test_f1: 0.6171
 epoch: 79, train_loss: 0.6131, test_loss: 0.9415, test_f1: 0.6291
 epoch: 80, train_loss: 0.6108, test_loss: 0.7755, test_f1: 0.6353
 epoch: 81, train_loss: 0.6179, test_loss: 0.8139, test_f1: 0.6189
 epoch: 82, train_loss: 0.6009, test_loss: 0.8510, test_f1: 0.6507
 epoch: 83, train_loss: 0.6050, test_loss: 0.8649, test_f1: 0.6367
 epoch: 84, train_loss: 0.6114, test_loss: 0.7964, test_f1: 0.6295
 epoch: 85, train_loss: 0.6157, test_loss: 0.7787, test_f1: 0.6439
 epoch: 86, train_loss: 0.5707, test_loss: 0.8644, test_f1: 0.6340
 epoch: 87, train_loss: 0.6090, test_loss: 0.7817, test_f1: 0.6288
 epoch: 88, train_loss: 0.6017, test_loss: 0.8490, test_f1: 0.6292
 epoch: 89, train_loss: 0.5987, test_loss: 0.8108, test_f1: 0.6645
 epoch: 90, train_loss: 0.6067, test_loss: 0.8290, test_f1: 0.6595
 epoch: 91, train_loss: 0.5916, test_loss: 0.8778, test_f1: 0.6446
 epoch: 92, train_loss: 0.5895, test_loss: 0.8304, test_f1: 0.6669
 epoch: 93, train_loss: 0.5865, test_loss: 0.8378, test_f1: 0.6640
 epoch: 94, train_loss: 0.5785, test_loss: 0.8129, test_f1: 0.6515
 epoch: 95, train_loss: 0.5891, test_loss: 0.8303, test_f1: 0.6644
 epoch: 96, train_loss: 0.5784, test_loss: 0.9024, test_f1: 0.6297
 epoch: 97, train_loss: 0.5833, test_loss: 0.8555, test_f1: 0.6370
 epoch: 98, train_loss: 0.5955, test_loss: 0.7725, test_f1: 0.6411
 epoch: 99, train_loss: 0.5692, test_loss: 0.8247, test_f1: 0.6339
##################ITERATION #7 ****************************************
 epoch: 0, train_loss: 1.1096, test_loss: 1.0348, test_f1: 0.4530
 epoch: 1, train_loss: 0.9861, test_loss: 0.9755, test_f1: 0.4751
 epoch: 2, train_loss: 0.9564, test_loss: 0.9916, test_f1: 0.4522
 epoch: 3, train_loss: 0.9335, test_loss: 0.9318, test_f1: 0.5082
 epoch: 4, train_loss: 0.9157, test_loss: 1.0971, test_f1: 0.4874
 epoch: 5, train_loss: 0.8871, test_loss: 1.0038, test_f1: 0.5143
 epoch: 6, train_loss: 0.8675, test_loss: 2.0108, test_f1: 0.3788
 epoch: 7, train_loss: 0.8604, test_loss: 0.8492, test_f1: 0.5076
 epoch: 8, train_loss: 0.8711, test_loss: 1.0106, test_f1: 0.4209
 epoch: 9, train_loss: 0.8592, test_loss: 1.0253, test_f1: 0.4871
 epoch: 10, train_loss: 0.8466, test_loss: 0.8887, test_f1: 0.5497
 epoch: 11, train_loss: 0.8327, test_loss: 0.9135, test_f1: 0.5527
 epoch: 12, train_loss: 0.8633, test_loss: 0.9549, test_f1: 0.5119
 epoch: 13, train_loss: 0.8254, test_loss: 0.8237, test_f1: 0.5512
 epoch: 14, train_loss: 0.8198, test_loss: 0.9735, test_f1: 0.4784
 epoch: 15, train_loss: 0.8142, test_loss: 0.8369, test_f1: 0.5867
 epoch: 16, train_loss: 0.8008, test_loss: 0.8385, test_f1: 0.5694
 epoch: 17, train_loss: 0.8029, test_loss: 0.9713, test_f1: 0.5612
 epoch: 18, train_loss: 0.7762, test_loss: 0.7944, test_f1: 0.6115
 epoch: 19, train_loss: 0.7876, test_loss: 0.9126, test_f1: 0.5587
 epoch: 20, train_loss: 0.7746, test_loss: 0.8185, test_f1: 0.6096
 epoch: 21, train_loss: 0.7641, test_loss: 0.8343, test_f1: 0.6198
 epoch: 22, train_loss: 0.7760, test_loss: 0.8316, test_f1: 0.6017
 epoch: 23, train_loss: 0.7700, test_loss: 0.8010, test_f1: 0.6288
 epoch: 24, train_loss: 0.7648, test_loss: 0.8369, test_f1: 0.6025
 epoch: 25, train_loss: 0.7637, test_loss: 0.7318, test_f1: 0.6182
 epoch: 26, train_loss: 0.7490, test_loss: 0.7713, test_f1: 0.6060
 epoch: 27, train_loss: 0.7519, test_loss: 0.8664, test_f1: 0.6386
 epoch: 28, train_loss: 0.7514, test_loss: 0.8273, test_f1: 0.5631
 epoch: 29, train_loss: 0.7508, test_loss: 0.7095, test_f1: 0.6417
 epoch: 30, train_loss: 0.7310, test_loss: 1.1999, test_f1: 0.4926
 epoch: 31, train_loss: 0.7369, test_loss: 0.8968, test_f1: 0.6218
 epoch: 32, train_loss: 0.7218, test_loss: 0.9263, test_f1: 0.5464
 epoch: 33, train_loss: 0.7434, test_loss: 0.8363, test_f1: 0.6353
 epoch: 34, train_loss: 0.7517, test_loss: 0.7560, test_f1: 0.6556
 epoch: 35, train_loss: 0.7218, test_loss: 0.8396, test_f1: 0.6505
 epoch: 36, train_loss: 0.7206, test_loss: 0.8594, test_f1: 0.6353
 epoch: 37, train_loss: 0.7035, test_loss: 0.8279, test_f1: 0.6494
 epoch: 38, train_loss: 0.7165, test_loss: 0.8295, test_f1: 0.5869
 epoch: 39, train_loss: 0.7326, test_loss: 1.0347, test_f1: 0.5941
 epoch: 40, train_loss: 0.7032, test_loss: 0.8991, test_f1: 0.6339
 epoch: 41, train_loss: 0.6911, test_loss: 1.0673, test_f1: 0.5874
 epoch: 42, train_loss: 0.6899, test_loss: 0.7731, test_f1: 0.6316
 epoch: 43, train_loss: 0.6845, test_loss: 0.7851, test_f1: 0.6632
 epoch: 44, train_loss: 0.6771, test_loss: 0.8405, test_f1: 0.5995
 epoch: 45, train_loss: 0.6961, test_loss: 0.7930, test_f1: 0.6638
 epoch: 46, train_loss: 0.6955, test_loss: 0.7688, test_f1: 0.6356
 epoch: 47, train_loss: 0.6679, test_loss: 0.8863, test_f1: 0.6127
 epoch: 48, train_loss: 0.6791, test_loss: 0.7694, test_f1: 0.6356
 epoch: 49, train_loss: 0.6835, test_loss: 0.7366, test_f1: 0.7042
 epoch: 50, train_loss: 0.6597, test_loss: 0.8017, test_f1: 0.6566
 epoch: 51, train_loss: 0.6425, test_loss: 0.7464, test_f1: 0.6609
 epoch: 52, train_loss: 0.6348, test_loss: 0.8168, test_f1: 0.6617
 epoch: 53, train_loss: 0.6222, test_loss: 0.8083, test_f1: 0.6790
 epoch: 54, train_loss: 0.6147, test_loss: 0.7014, test_f1: 0.6759
 epoch: 55, train_loss: 0.6061, test_loss: 0.8629, test_f1: 0.6574
 epoch: 56, train_loss: 0.6051, test_loss: 0.8672, test_f1: 0.6647
 epoch: 57, train_loss: 0.6146, test_loss: 0.7231, test_f1: 0.6526
 epoch: 58, train_loss: 0.6019, test_loss: 0.7676, test_f1: 0.6570
 epoch: 59, train_loss: 0.6013, test_loss: 0.7708, test_f1: 0.6797
 epoch: 60, train_loss: 0.5826, test_loss: 0.8137, test_f1: 0.6603
 epoch: 61, train_loss: 0.6097, test_loss: 0.7260, test_f1: 0.6261
 epoch: 62, train_loss: 0.5848, test_loss: 0.7705, test_f1: 0.6990
 epoch: 63, train_loss: 0.6181, test_loss: 0.8521, test_f1: 0.7001
 epoch: 64, train_loss: 0.5840, test_loss: 0.7626, test_f1: 0.6637
 epoch: 65, train_loss: 0.5988, test_loss: 0.7342, test_f1: 0.6910
 epoch: 66, train_loss: 0.5749, test_loss: 0.8248, test_f1: 0.6610
 epoch: 67, train_loss: 0.5890, test_loss: 0.7426, test_f1: 0.6786
 epoch: 68, train_loss: 0.5809, test_loss: 0.7672, test_f1: 0.6779
 epoch: 69, train_loss: 0.5800, test_loss: 0.7180, test_f1: 0.6784
 epoch: 70, train_loss: 0.5737, test_loss: 0.8117, test_f1: 0.6848
 epoch: 71, train_loss: 0.5791, test_loss: 0.8041, test_f1: 0.6723
 epoch: 72, train_loss: 0.5849, test_loss: 0.7600, test_f1: 0.6855
 epoch: 73, train_loss: 0.5716, test_loss: 0.7788, test_f1: 0.7013
 epoch: 74, train_loss: 0.5791, test_loss: 0.7842, test_f1: 0.6855
 epoch: 75, train_loss: 0.5775, test_loss: 0.8460, test_f1: 0.6853
 epoch: 76, train_loss: 0.5485, test_loss: 0.7136, test_f1: 0.6852
 epoch: 77, train_loss: 0.5764, test_loss: 0.7285, test_f1: 0.6773
 epoch: 78, train_loss: 0.5530, test_loss: 0.8908, test_f1: 0.6952
 epoch: 79, train_loss: 0.5661, test_loss: 0.8673, test_f1: 0.6819
 epoch: 80, train_loss: 0.5502, test_loss: 0.8165, test_f1: 0.6698
 epoch: 81, train_loss: 0.5429, test_loss: 0.9002, test_f1: 0.6683
 epoch: 82, train_loss: 0.5585, test_loss: 0.7825, test_f1: 0.6669
 epoch: 83, train_loss: 0.5365, test_loss: 0.7844, test_f1: 0.6823
 epoch: 84, train_loss: 0.5479, test_loss: 0.8164, test_f1: 0.6766
 epoch: 85, train_loss: 0.5567, test_loss: 0.7782, test_f1: 0.6809
 epoch: 86, train_loss: 0.5515, test_loss: 0.9201, test_f1: 0.6673
 epoch: 87, train_loss: 0.5580, test_loss: 0.8036, test_f1: 0.6626
 epoch: 88, train_loss: 0.5415, test_loss: 0.8104, test_f1: 0.6844
 epoch: 89, train_loss: 0.5132, test_loss: 0.9594, test_f1: 0.6712
 epoch: 90, train_loss: 0.5468, test_loss: 0.9243, test_f1: 0.6439
 epoch: 91, train_loss: 0.5387, test_loss: 0.7736, test_f1: 0.6904
 epoch: 92, train_loss: 0.5236, test_loss: 0.8624, test_f1: 0.6898
 epoch: 93, train_loss: 0.5450, test_loss: 0.7330, test_f1: 0.6676
 epoch: 94, train_loss: 0.5359, test_loss: 0.8847, test_f1: 0.6676
 epoch: 95, train_loss: 0.5415, test_loss: 0.8926, test_f1: 0.6844
 epoch: 96, train_loss: 0.5273, test_loss: 0.7824, test_f1: 0.6791
 epoch: 97, train_loss: 0.5329, test_loss: 0.8254, test_f1: 0.6605
 epoch: 98, train_loss: 0.5388, test_loss: 0.9979, test_f1: 0.6933
 epoch: 99, train_loss: 0.5182, test_loss: 0.9171, test_f1: 0.6642
##################ITERATION #8 ****************************************
 epoch: 0, train_loss: 1.1572, test_loss: 1.1844, test_f1: 0.3421
 epoch: 1, train_loss: 1.0061, test_loss: 1.0074, test_f1: 0.5137
 epoch: 2, train_loss: 0.9776, test_loss: 1.0329, test_f1: 0.5123
 epoch: 3, train_loss: 0.9574, test_loss: 1.0046, test_f1: 0.4607
 epoch: 4, train_loss: 0.9316, test_loss: 0.9787, test_f1: 0.5210
 epoch: 5, train_loss: 0.9281, test_loss: 1.1330, test_f1: 0.4829
 epoch: 6, train_loss: 0.9348, test_loss: 0.9918, test_f1: 0.5273
 epoch: 7, train_loss: 0.9020, test_loss: 0.9495, test_f1: 0.5610
 epoch: 8, train_loss: 0.8977, test_loss: 0.9327, test_f1: 0.5545
 epoch: 9, train_loss: 0.8877, test_loss: 0.9344, test_f1: 0.5405
 epoch: 10, train_loss: 0.8824, test_loss: 0.9161, test_f1: 0.5514
 epoch: 11, train_loss: 0.8627, test_loss: 1.0183, test_f1: 0.5576
 epoch: 12, train_loss: 0.8502, test_loss: 0.8941, test_f1: 0.5403
 epoch: 13, train_loss: 0.8551, test_loss: 0.9449, test_f1: 0.4829
 epoch: 14, train_loss: 0.8347, test_loss: 0.8708, test_f1: 0.5406
 epoch: 15, train_loss: 0.8366, test_loss: 0.8595, test_f1: 0.5527
 epoch: 16, train_loss: 0.8281, test_loss: 0.8320, test_f1: 0.5915
 epoch: 17, train_loss: 0.8269, test_loss: 0.9017, test_f1: 0.5512
 epoch: 18, train_loss: 0.8155, test_loss: 0.8930, test_f1: 0.5236
 epoch: 19, train_loss: 0.7990, test_loss: 0.8747, test_f1: 0.5921
 epoch: 20, train_loss: 0.8202, test_loss: 0.8694, test_f1: 0.5856
 epoch: 21, train_loss: 0.8125, test_loss: 0.8848, test_f1: 0.5937
 epoch: 22, train_loss: 0.7908, test_loss: 0.9668, test_f1: 0.5362
 epoch: 23, train_loss: 0.8101, test_loss: 0.8911, test_f1: 0.6059
 epoch: 24, train_loss: 0.7915, test_loss: 0.8000, test_f1: 0.6366
 epoch: 25, train_loss: 0.7926, test_loss: 0.8623, test_f1: 0.6025
 epoch: 26, train_loss: 0.7982, test_loss: 1.0557, test_f1: 0.5115
 epoch: 27, train_loss: 0.7716, test_loss: 0.9650, test_f1: 0.5688
 epoch: 28, train_loss: 0.7676, test_loss: 0.8455, test_f1: 0.5933
 epoch: 29, train_loss: 0.7759, test_loss: 0.8700, test_f1: 0.5969
 epoch: 30, train_loss: 0.7709, test_loss: 0.7918, test_f1: 0.5713
 epoch: 31, train_loss: 0.7453, test_loss: 0.8339, test_f1: 0.5922
 epoch: 32, train_loss: 0.7651, test_loss: 0.8457, test_f1: 0.6149
 epoch: 33, train_loss: 0.7575, test_loss: 0.8241, test_f1: 0.6526
 epoch: 34, train_loss: 0.7727, test_loss: 0.8578, test_f1: 0.5661
 epoch: 35, train_loss: 0.7405, test_loss: 0.8893, test_f1: 0.5539
 epoch: 36, train_loss: 0.7544, test_loss: 0.8652, test_f1: 0.5922
 epoch: 37, train_loss: 0.7442, test_loss: 0.8294, test_f1: 0.6168
 epoch: 38, train_loss: 0.7388, test_loss: 0.8980, test_f1: 0.6033
 epoch: 39, train_loss: 0.7392, test_loss: 0.8185, test_f1: 0.5870
 epoch: 40, train_loss: 0.7280, test_loss: 0.8773, test_f1: 0.6273
 epoch: 41, train_loss: 0.7469, test_loss: 0.8312, test_f1: 0.6199
 epoch: 42, train_loss: 0.7300, test_loss: 0.8083, test_f1: 0.6393
 epoch: 43, train_loss: 0.7201, test_loss: 0.8312, test_f1: 0.6481
 epoch: 44, train_loss: 0.7256, test_loss: 0.8704, test_f1: 0.6201
 epoch: 45, train_loss: 0.7191, test_loss: 0.8687, test_f1: 0.6298
 epoch: 46, train_loss: 0.7120, test_loss: 0.8081, test_f1: 0.6578
 epoch: 47, train_loss: 0.7062, test_loss: 0.8450, test_f1: 0.6312
 epoch: 48, train_loss: 0.6876, test_loss: 1.0702, test_f1: 0.5685
 epoch: 49, train_loss: 0.7250, test_loss: 0.8300, test_f1: 0.6166
 epoch: 50, train_loss: 0.7154, test_loss: 0.7969, test_f1: 0.6229
 epoch: 51, train_loss: 0.6783, test_loss: 0.7794, test_f1: 0.6460
 epoch: 52, train_loss: 0.6483, test_loss: 0.7761, test_f1: 0.6489
 epoch: 53, train_loss: 0.6747, test_loss: 0.8090, test_f1: 0.6471
 epoch: 54, train_loss: 0.6408, test_loss: 0.8404, test_f1: 0.6321
 epoch: 55, train_loss: 0.6504, test_loss: 0.8032, test_f1: 0.6570
 epoch: 56, train_loss: 0.6434, test_loss: 0.8192, test_f1: 0.6536
 epoch: 57, train_loss: 0.6474, test_loss: 0.8519, test_f1: 0.6582
 epoch: 58, train_loss: 0.6496, test_loss: 0.8126, test_f1: 0.6407
 epoch: 59, train_loss: 0.6633, test_loss: 0.8846, test_f1: 0.6258
 epoch: 60, train_loss: 0.6355, test_loss: 0.8357, test_f1: 0.6488
 epoch: 61, train_loss: 0.6301, test_loss: 0.8082, test_f1: 0.6982
 epoch: 62, train_loss: 0.6449, test_loss: 0.8612, test_f1: 0.6483
 epoch: 63, train_loss: 0.6089, test_loss: 0.8992, test_f1: 0.6627
 epoch: 64, train_loss: 0.6360, test_loss: 0.8244, test_f1: 0.6656
 epoch: 65, train_loss: 0.6293, test_loss: 0.8738, test_f1: 0.6579
 epoch: 66, train_loss: 0.6251, test_loss: 0.8476, test_f1: 0.6607
 epoch: 67, train_loss: 0.6126, test_loss: 0.8453, test_f1: 0.6536
 epoch: 68, train_loss: 0.6163, test_loss: 0.8634, test_f1: 0.6624
 epoch: 69, train_loss: 0.6161, test_loss: 0.7891, test_f1: 0.6533
 epoch: 70, train_loss: 0.6120, test_loss: 0.9157, test_f1: 0.6659
 epoch: 71, train_loss: 0.6084, test_loss: 0.9241, test_f1: 0.6506
 epoch: 72, train_loss: 0.6239, test_loss: 0.9151, test_f1: 0.6431
 epoch: 73, train_loss: 0.6017, test_loss: 1.0929, test_f1: 0.6481
 epoch: 74, train_loss: 0.6182, test_loss: 0.8772, test_f1: 0.6659
 epoch: 75, train_loss: 0.6082, test_loss: 0.8470, test_f1: 0.6483
 epoch: 76, train_loss: 0.6141, test_loss: 0.8649, test_f1: 0.6579
 epoch: 77, train_loss: 0.6094, test_loss: 0.8943, test_f1: 0.6494
 epoch: 78, train_loss: 0.5965, test_loss: 0.8977, test_f1: 0.6883
 epoch: 79, train_loss: 0.5938, test_loss: 0.9106, test_f1: 0.6754
 epoch: 80, train_loss: 0.5950, test_loss: 0.8602, test_f1: 0.6508
 epoch: 81, train_loss: 0.5925, test_loss: 0.9086, test_f1: 0.6649
 epoch: 82, train_loss: 0.5965, test_loss: 0.9151, test_f1: 0.6670
 epoch: 83, train_loss: 0.6019, test_loss: 0.9822, test_f1: 0.6439
 epoch: 84, train_loss: 0.6107, test_loss: 0.9588, test_f1: 0.6815
 epoch: 85, train_loss: 0.5894, test_loss: 0.8553, test_f1: 0.6758
 epoch: 86, train_loss: 0.5889, test_loss: 1.0193, test_f1: 0.6549
 epoch: 87, train_loss: 0.5837, test_loss: 0.8751, test_f1: 0.6895
 epoch: 88, train_loss: 0.5932, test_loss: 0.8625, test_f1: 0.6830
 epoch: 89, train_loss: 0.5726, test_loss: 0.9258, test_f1: 0.6491
 epoch: 90, train_loss: 0.5761, test_loss: 0.9465, test_f1: 0.6579
 epoch: 91, train_loss: 0.5828, test_loss: 0.8936, test_f1: 0.6619
 epoch: 92, train_loss: 0.5676, test_loss: 0.8952, test_f1: 0.6507
 epoch: 93, train_loss: 0.5697, test_loss: 0.9998, test_f1: 0.6727
 epoch: 94, train_loss: 0.5766, test_loss: 1.0148, test_f1: 0.6371
 epoch: 95, train_loss: 0.5844, test_loss: 0.9385, test_f1: 0.6604
 epoch: 96, train_loss: 0.5753, test_loss: 0.9106, test_f1: 0.6699
 epoch: 97, train_loss: 0.5688, test_loss: 0.8664, test_f1: 0.6616
 epoch: 98, train_loss: 0.5664, test_loss: 0.9620, test_f1: 0.6388
 epoch: 99, train_loss: 0.5621, test_loss: 0.9789, test_f1: 0.6781
##################ITERATION #9 ****************************************
 epoch: 0, train_loss: 1.0998, test_loss: 1.1414, test_f1: 0.4289
 epoch: 1, train_loss: 0.9893, test_loss: 0.9554, test_f1: 0.5325
 epoch: 2, train_loss: 0.9565, test_loss: 1.0032, test_f1: 0.5166
 epoch: 3, train_loss: 0.9324, test_loss: 0.9185, test_f1: 0.5175
 epoch: 4, train_loss: 0.9206, test_loss: 1.0699, test_f1: 0.4992
 epoch: 5, train_loss: 0.9186, test_loss: 0.9528, test_f1: 0.5362
 epoch: 6, train_loss: 0.9096, test_loss: 0.9297, test_f1: 0.5310
 epoch: 7, train_loss: 0.8993, test_loss: 0.9902, test_f1: 0.5090
 epoch: 8, train_loss: 0.8901, test_loss: 0.9449, test_f1: 0.5487
 epoch: 9, train_loss: 0.8703, test_loss: 0.8459, test_f1: 0.5474
 epoch: 10, train_loss: 0.8762, test_loss: 1.1473, test_f1: 0.4119
 epoch: 11, train_loss: 0.8699, test_loss: 0.8738, test_f1: 0.5425
 epoch: 12, train_loss: 0.8491, test_loss: 0.9006, test_f1: 0.5507
 epoch: 13, train_loss: 0.8483, test_loss: 0.9382, test_f1: 0.5906
 epoch: 14, train_loss: 0.8388, test_loss: 0.8769, test_f1: 0.5625
 epoch: 15, train_loss: 0.8247, test_loss: 0.9042, test_f1: 0.5594
 epoch: 16, train_loss: 0.8155, test_loss: 0.8188, test_f1: 0.6029
 epoch: 17, train_loss: 0.8178, test_loss: 0.9378, test_f1: 0.5844
 epoch: 18, train_loss: 0.8029, test_loss: 0.9375, test_f1: 0.5929
 epoch: 19, train_loss: 0.8145, test_loss: 0.8942, test_f1: 0.6061
 epoch: 20, train_loss: 0.7991, test_loss: 0.8272, test_f1: 0.5558
 epoch: 21, train_loss: 0.7957, test_loss: 0.8828, test_f1: 0.6159
 epoch: 22, train_loss: 0.7873, test_loss: 0.9659, test_f1: 0.5157
 epoch: 23, train_loss: 0.7746, test_loss: 0.9199, test_f1: 0.6228
 epoch: 24, train_loss: 0.7912, test_loss: 0.8335, test_f1: 0.6318
 epoch: 25, train_loss: 0.7578, test_loss: 0.9142, test_f1: 0.6141
 epoch: 26, train_loss: 0.7724, test_loss: 0.8339, test_f1: 0.6069
 epoch: 27, train_loss: 0.7699, test_loss: 0.8230, test_f1: 0.6195
 epoch: 28, train_loss: 0.7587, test_loss: 0.9422, test_f1: 0.5961
 epoch: 29, train_loss: 0.7441, test_loss: 0.7759, test_f1: 0.6401
 epoch: 30, train_loss: 0.7481, test_loss: 0.9505, test_f1: 0.6086
 epoch: 31, train_loss: 0.7353, test_loss: 0.8900, test_f1: 0.6327
 epoch: 32, train_loss: 0.7553, test_loss: 0.9130, test_f1: 0.6281
 epoch: 33, train_loss: 0.7369, test_loss: 0.8720, test_f1: 0.6066
 epoch: 34, train_loss: 0.7187, test_loss: 0.8451, test_f1: 0.6148
 epoch: 35, train_loss: 0.7252, test_loss: 0.8621, test_f1: 0.5959
 epoch: 36, train_loss: 0.7140, test_loss: 0.7549, test_f1: 0.6453
 epoch: 37, train_loss: 0.7275, test_loss: 1.0500, test_f1: 0.6284
 epoch: 38, train_loss: 0.7477, test_loss: 0.7501, test_f1: 0.6599
 epoch: 39, train_loss: 0.7153, test_loss: 0.9358, test_f1: 0.6359
 epoch: 40, train_loss: 0.7133, test_loss: 0.8956, test_f1: 0.6541
 epoch: 41, train_loss: 0.7168, test_loss: 0.8926, test_f1: 0.6561
 epoch: 42, train_loss: 0.7046, test_loss: 0.8770, test_f1: 0.6459
 epoch: 43, train_loss: 0.6972, test_loss: 0.9737, test_f1: 0.5729
 epoch: 44, train_loss: 0.6975, test_loss: 0.8890, test_f1: 0.6296
 epoch: 45, train_loss: 0.7006, test_loss: 0.8333, test_f1: 0.6342
 epoch: 46, train_loss: 0.6902, test_loss: 1.0653, test_f1: 0.5798
 epoch: 47, train_loss: 0.7105, test_loss: 0.8209, test_f1: 0.6498
 epoch: 48, train_loss: 0.7017, test_loss: 1.0308, test_f1: 0.6062
 epoch: 49, train_loss: 0.6722, test_loss: 0.8179, test_f1: 0.6332
 epoch: 50, train_loss: 0.7118, test_loss: 0.9508, test_f1: 0.5745
 epoch: 51, train_loss: 0.6749, test_loss: 0.8825, test_f1: 0.6481
 epoch: 52, train_loss: 0.6438, test_loss: 0.8199, test_f1: 0.6579
 epoch: 53, train_loss: 0.6335, test_loss: 0.8617, test_f1: 0.6571
 epoch: 54, train_loss: 0.6258, test_loss: 0.8131, test_f1: 0.6733
 epoch: 55, train_loss: 0.6164, test_loss: 0.8805, test_f1: 0.6676
 epoch: 56, train_loss: 0.6274, test_loss: 0.8891, test_f1: 0.6552
 epoch: 57, train_loss: 0.6188, test_loss: 0.8690, test_f1: 0.6440
 epoch: 58, train_loss: 0.6210, test_loss: 0.8844, test_f1: 0.6690
 epoch: 59, train_loss: 0.6037, test_loss: 0.9199, test_f1: 0.6415
 epoch: 60, train_loss: 0.6123, test_loss: 0.8944, test_f1: 0.6699
 epoch: 61, train_loss: 0.6147, test_loss: 0.8676, test_f1: 0.6520
 epoch: 62, train_loss: 0.6128, test_loss: 0.8348, test_f1: 0.6858
 epoch: 63, train_loss: 0.6105, test_loss: 0.9272, test_f1: 0.6510
 epoch: 64, train_loss: 0.6133, test_loss: 0.8977, test_f1: 0.6519
 epoch: 65, train_loss: 0.6091, test_loss: 0.8847, test_f1: 0.6711
 epoch: 66, train_loss: 0.6156, test_loss: 0.9156, test_f1: 0.6710
 epoch: 67, train_loss: 0.5851, test_loss: 0.9232, test_f1: 0.6656
 epoch: 68, train_loss: 0.6010, test_loss: 0.9124, test_f1: 0.6612
 epoch: 69, train_loss: 0.5929, test_loss: 0.9131, test_f1: 0.6480
 epoch: 70, train_loss: 0.5921, test_loss: 0.9224, test_f1: 0.6669
 epoch: 71, train_loss: 0.5918, test_loss: 0.9951, test_f1: 0.6668
 epoch: 72, train_loss: 0.6006, test_loss: 0.9084, test_f1: 0.6853
 epoch: 73, train_loss: 0.5839, test_loss: 0.9979, test_f1: 0.6698
 epoch: 74, train_loss: 0.5840, test_loss: 1.0105, test_f1: 0.6603
 epoch: 75, train_loss: 0.5747, test_loss: 0.9378, test_f1: 0.6946
 epoch: 76, train_loss: 0.5768, test_loss: 0.9990, test_f1: 0.6636
 epoch: 77, train_loss: 0.5827, test_loss: 0.9452, test_f1: 0.6638
 epoch: 78, train_loss: 0.5701, test_loss: 0.8910, test_f1: 0.6506
 epoch: 79, train_loss: 0.5660, test_loss: 1.0091, test_f1: 0.6629
 epoch: 80, train_loss: 0.5695, test_loss: 0.9572, test_f1: 0.6656
 epoch: 81, train_loss: 0.5569, test_loss: 0.9633, test_f1: 0.6791
 epoch: 82, train_loss: 0.5816, test_loss: 0.7991, test_f1: 0.6637
 epoch: 83, train_loss: 0.5787, test_loss: 0.9163, test_f1: 0.6672
 epoch: 84, train_loss: 0.5689, test_loss: 0.9616, test_f1: 0.6677
 epoch: 85, train_loss: 0.5584, test_loss: 0.9196, test_f1: 0.6633
 epoch: 86, train_loss: 0.5531, test_loss: 0.9380, test_f1: 0.6755
 epoch: 87, train_loss: 0.5622, test_loss: 0.8826, test_f1: 0.6695
 epoch: 88, train_loss: 0.5657, test_loss: 0.8149, test_f1: 0.6509
 epoch: 89, train_loss: 0.5589, test_loss: 0.9361, test_f1: 0.6679
 epoch: 90, train_loss: 0.5470, test_loss: 1.0203, test_f1: 0.6333
 epoch: 91, train_loss: 0.5736, test_loss: 0.8410, test_f1: 0.6761
 epoch: 92, train_loss: 0.5699, test_loss: 0.9583, test_f1: 0.6615
 epoch: 93, train_loss: 0.5416, test_loss: 0.7509, test_f1: 0.6935
 epoch: 94, train_loss: 0.5482, test_loss: 0.8976, test_f1: 0.6787
 epoch: 95, train_loss: 0.5545, test_loss: 0.8220, test_f1: 0.6584
 epoch: 96, train_loss: 0.5509, test_loss: 0.8029, test_f1: 0.6814
 epoch: 97, train_loss: 0.5372, test_loss: 0.9436, test_f1: 0.6797
 epoch: 98, train_loss: 0.5323, test_loss: 0.9895, test_f1: 0.6639
 epoch: 99, train_loss: 0.5489, test_loss: 0.9024, test_f1: 0.6781

Training completed in 638.15 seconds
Best F1: 0.7042 at epoch 49
Mean F1 across iterations: 0.6899  0.0127
========================FINAL RESULTS================================
FEGIN weighted F1: 0.7042  0.0127
python main.py --data ltspice_examples --representation component_pin_net --model FEGIN --layers 3 --hiddens 32 --batch_size 64 --lr 0.01 --emb_size 512 --epochs 100 --save_appendix component_pin_net_L3_H32_BS64_LR0.01_E512 --no_val
-----



STDERR:
  File "main.py", line 370, in <module>
    main()
  File "main.py", line 254, in main
    dataset = dataset_class(
  File "/home/philip/projects/ltspice_examples_code_repo/Circuit-Completion-Using-GNNs/component_classification_with_link_prediction_head/evaluation/FEGIN/kernel/circuit_datasets.py", line 15, in __init__
    self.data, self.slices = torch.load(self.processed_paths[0])
  File "/home/philip/.local/lib/python3.8/site-packages/torch/serialization.py", line 1040, in load
    warnings.warn(
  File "/usr/lib/python3.8/warnings.py", line 109, in _showwarnmsg
    sw(msg.message, msg.category, msg.filename, msg.lineno,
  File "main.py", line 47, in warn_with_traceback
    traceback.print_stack(file=log)
/home/philip/projects/ltspice_examples_code_repo/Circuit-Completion-Using-GNNs/component_classification_with_link_prediction_head/evaluation/FEGIN/kernel/circuit_datasets.py:15: FutureWarning: You are using `torch.load` with `weights_only=False` (the current default value), which uses the default pickle module implicitly. It is possible to construct malicious pickle data which will execute arbitrary code during unpickling (See https://github.com/pytorch/pytorch/blob/main/SECURITY.md#untrusted-models for more details). In a future release, the default value for `weights_only` will be flipped to `True`. This limits the functions that could be executed during unpickling. Arbitrary objects will no longer be allowed to be loaded via this mode unless they are explicitly allowlisted by the user via `torch.serialization.add_safe_globals`. We recommend you start setting `weights_only=True` for any use case where you don't have full control of the loaded file. Please open an issue on GitHub for any issues related to this experimental feature.
  self.data, self.slices = torch.load(self.processed_paths[0])
