STDOUT:
Results will be saved in /home/philip/projects/ltspice_examples_code_repo/Circuit-Completion-Using-GNNs/component_classification_with_link_prediction_head/evaluation/FEGIN/results/model_FEGIN_dataset_ltspice_demos
Command line input: python main.py --data ltspice_demos --representation component_net --model FEGIN --layers 4 --hiddens 128 --batch_size 64 --lr 0.001 --emb_size 128 --epochs 100 --save_appendix component_net_L4_H128_BS64_LR0.001_E128 --no_val
 is saved.
-----
ltspice_demos - FEGIN
Using 4 layers, 128 hidden units, h = 2
Loading component_net representation dataset
Loading component_net representation data...
Loaded 1948 examples (component_net)
saving path: data/processed/ltspice_demos_component_net_processed.pt
ENTERED
Training FEGIN on component_net representation
Train: 1565, Test: 383
##################ITERATION #0 ****************************************
 epoch: 0, train_loss: 1.2158, test_loss: 1.2787, test_f1: 0.2281
 epoch: 1, train_loss: 1.0939, test_loss: 1.1690, test_f1: 0.4690
 epoch: 2, train_loss: 1.0289, test_loss: 1.0925, test_f1: 0.4990
 epoch: 3, train_loss: 0.9756, test_loss: 1.0638, test_f1: 0.5159
 epoch: 4, train_loss: 0.9287, test_loss: 1.0657, test_f1: 0.5320
 epoch: 5, train_loss: 0.8978, test_loss: 1.0116, test_f1: 0.5431
 epoch: 6, train_loss: 0.9098, test_loss: 1.0848, test_f1: 0.4697
 epoch: 7, train_loss: 0.8629, test_loss: 1.0483, test_f1: 0.5678
 epoch: 8, train_loss: 0.8379, test_loss: 1.0807, test_f1: 0.5760
 epoch: 9, train_loss: 0.8109, test_loss: 1.0924, test_f1: 0.5687
 epoch: 10, train_loss: 0.8041, test_loss: 1.0682, test_f1: 0.6147
 epoch: 11, train_loss: 0.8038, test_loss: 1.1640, test_f1: 0.5781
 epoch: 12, train_loss: 0.7604, test_loss: 1.3638, test_f1: 0.5088
 epoch: 13, train_loss: 0.7376, test_loss: 1.2545, test_f1: 0.5993
 epoch: 14, train_loss: 0.7246, test_loss: 1.1470, test_f1: 0.6008
 epoch: 15, train_loss: 0.6666, test_loss: 1.2520, test_f1: 0.6084
 epoch: 16, train_loss: 0.6727, test_loss: 1.3356, test_f1: 0.6116
 epoch: 17, train_loss: 0.7066, test_loss: 1.3290, test_f1: 0.5597
 epoch: 18, train_loss: 0.6674, test_loss: 1.2920, test_f1: 0.5770
 epoch: 19, train_loss: 0.6462, test_loss: 1.4451, test_f1: 0.5714
 epoch: 20, train_loss: 0.6413, test_loss: 1.3258, test_f1: 0.5824
 epoch: 21, train_loss: 0.6456, test_loss: 1.2437, test_f1: 0.6290
 epoch: 22, train_loss: 0.5857, test_loss: 1.4495, test_f1: 0.5951
 epoch: 23, train_loss: 0.5691, test_loss: 1.6340, test_f1: 0.5625
 epoch: 24, train_loss: 0.5761, test_loss: 1.5747, test_f1: 0.5754
 epoch: 25, train_loss: 0.5672, test_loss: 1.5261, test_f1: 0.5477
 epoch: 26, train_loss: 0.5410, test_loss: 1.7929, test_f1: 0.5624
 epoch: 27, train_loss: 0.5296, test_loss: 1.8191, test_f1: 0.5584
 epoch: 28, train_loss: 0.5259, test_loss: 1.8905, test_f1: 0.5276
 epoch: 29, train_loss: 0.4897, test_loss: 1.7312, test_f1: 0.6046
 epoch: 30, train_loss: 0.4919, test_loss: 1.9111, test_f1: 0.5119
 epoch: 31, train_loss: 0.4791, test_loss: 2.0161, test_f1: 0.5536
 epoch: 32, train_loss: 0.4949, test_loss: 1.6821, test_f1: 0.5785
 epoch: 33, train_loss: 0.4603, test_loss: 1.7842, test_f1: 0.5443
 epoch: 34, train_loss: 0.4553, test_loss: 2.0615, test_f1: 0.5764
 epoch: 35, train_loss: 0.4438, test_loss: 2.0459, test_f1: 0.5999
 epoch: 36, train_loss: 0.3960, test_loss: 2.1661, test_f1: 0.5571
 epoch: 37, train_loss: 0.3978, test_loss: 2.2759, test_f1: 0.5599
 epoch: 38, train_loss: 0.4146, test_loss: 2.1724, test_f1: 0.5424
 epoch: 39, train_loss: 0.4269, test_loss: 1.9847, test_f1: 0.5936
 epoch: 40, train_loss: 0.4379, test_loss: 1.9783, test_f1: 0.5885
 epoch: 41, train_loss: 0.4074, test_loss: 1.9722, test_f1: 0.5742
 epoch: 42, train_loss: 0.3700, test_loss: 2.0657, test_f1: 0.6003
 epoch: 43, train_loss: 0.3659, test_loss: 2.3777, test_f1: 0.5938
 epoch: 44, train_loss: 0.3747, test_loss: 2.3165, test_f1: 0.6117
 epoch: 45, train_loss: 0.3703, test_loss: 2.3508, test_f1: 0.5777
 epoch: 46, train_loss: 0.3340, test_loss: 2.1042, test_f1: 0.6063
 epoch: 47, train_loss: 0.3583, test_loss: 2.2497, test_f1: 0.5726
 epoch: 48, train_loss: 0.3223, test_loss: 2.3122, test_f1: 0.5838
 epoch: 49, train_loss: 0.3409, test_loss: 2.5328, test_f1: 0.6039
 epoch: 50, train_loss: 0.3220, test_loss: 2.6256, test_f1: 0.5831
 epoch: 51, train_loss: 0.2713, test_loss: 2.3543, test_f1: 0.5811
 epoch: 52, train_loss: 0.2490, test_loss: 2.5188, test_f1: 0.6072
 epoch: 53, train_loss: 0.2293, test_loss: 2.6368, test_f1: 0.5984
 epoch: 54, train_loss: 0.2086, test_loss: 2.5714, test_f1: 0.6032
 epoch: 55, train_loss: 0.2173, test_loss: 2.7285, test_f1: 0.6145
 epoch: 56, train_loss: 0.2249, test_loss: 2.8755, test_f1: 0.6011
 epoch: 57, train_loss: 0.2159, test_loss: 2.8058, test_f1: 0.5899
 epoch: 58, train_loss: 0.2053, test_loss: 3.0943, test_f1: 0.6041
 epoch: 59, train_loss: 0.2018, test_loss: 3.2237, test_f1: 0.5717
 epoch: 60, train_loss: 0.1826, test_loss: 3.1759, test_f1: 0.5690
 epoch: 61, train_loss: 0.1828, test_loss: 3.2973, test_f1: 0.5723
 epoch: 62, train_loss: 0.1930, test_loss: 3.2537, test_f1: 0.5787
 epoch: 63, train_loss: 0.1835, test_loss: 3.6204, test_f1: 0.5710
 epoch: 64, train_loss: 0.1694, test_loss: 3.2093, test_f1: 0.6137
 epoch: 65, train_loss: 0.1679, test_loss: 3.3668, test_f1: 0.6071
 epoch: 66, train_loss: 0.1972, test_loss: 3.2542, test_f1: 0.5907
 epoch: 67, train_loss: 0.1944, test_loss: 3.3636, test_f1: 0.6074
 epoch: 68, train_loss: 0.1981, test_loss: 3.5345, test_f1: 0.5854
 epoch: 69, train_loss: 0.1876, test_loss: 3.3529, test_f1: 0.6116
 epoch: 70, train_loss: 0.1901, test_loss: 3.6738, test_f1: 0.5646
 epoch: 71, train_loss: 0.1961, test_loss: 3.4971, test_f1: 0.5749
 epoch: 72, train_loss: 0.1736, test_loss: 3.5161, test_f1: 0.5897
 epoch: 73, train_loss: 0.1870, test_loss: 3.4120, test_f1: 0.5843
 epoch: 74, train_loss: 0.1898, test_loss: 3.5807, test_f1: 0.5669
 epoch: 75, train_loss: 0.2083, test_loss: 3.5473, test_f1: 0.5900
 epoch: 76, train_loss: 0.1615, test_loss: 3.4212, test_f1: 0.5838
 epoch: 77, train_loss: 0.2041, test_loss: 3.4511, test_f1: 0.5831
 epoch: 78, train_loss: 0.1530, test_loss: 3.4856, test_f1: 0.6197
 epoch: 79, train_loss: 0.1440, test_loss: 3.7750, test_f1: 0.5804
 epoch: 80, train_loss: 0.1498, test_loss: 3.8664, test_f1: 0.5944
 epoch: 81, train_loss: 0.1712, test_loss: 4.1649, test_f1: 0.5891
 epoch: 82, train_loss: 0.1470, test_loss: 4.1879, test_f1: 0.5722
 epoch: 83, train_loss: 0.1567, test_loss: 3.8479, test_f1: 0.5764
 epoch: 84, train_loss: 0.1473, test_loss: 3.7049, test_f1: 0.6085
 epoch: 85, train_loss: 0.1317, test_loss: 3.7299, test_f1: 0.6003
 epoch: 86, train_loss: 0.1418, test_loss: 3.7195, test_f1: 0.6117
 epoch: 87, train_loss: 0.1315, test_loss: 3.8065, test_f1: 0.6104
 epoch: 88, train_loss: 0.1244, test_loss: 3.8594, test_f1: 0.6032
 epoch: 89, train_loss: 0.1226, test_loss: 3.9736, test_f1: 0.5794
 epoch: 90, train_loss: 0.1497, test_loss: 3.7883, test_f1: 0.6074
 epoch: 91, train_loss: 0.1389, test_loss: 3.8753, test_f1: 0.6152
 epoch: 92, train_loss: 0.1300, test_loss: 3.8504, test_f1: 0.5960
 epoch: 93, train_loss: 0.1474, test_loss: 4.0455, test_f1: 0.5747
 epoch: 94, train_loss: 0.1806, test_loss: 4.0679, test_f1: 0.5902
 epoch: 95, train_loss: 0.1847, test_loss: 3.9056, test_f1: 0.5999
 epoch: 96, train_loss: 0.1618, test_loss: 4.0669, test_f1: 0.5762
 epoch: 97, train_loss: 0.1198, test_loss: 3.9185, test_f1: 0.5933
 epoch: 98, train_loss: 0.1387, test_loss: 4.1609, test_f1: 0.5790
 epoch: 99, train_loss: 0.1259, test_loss: 4.1770, test_f1: 0.5699
##################ITERATION #1 ****************************************
 epoch: 0, train_loss: 1.1565, test_loss: 1.2489, test_f1: 0.2650
 epoch: 1, train_loss: 1.0012, test_loss: 1.1314, test_f1: 0.4205
 epoch: 2, train_loss: 0.9310, test_loss: 1.0548, test_f1: 0.5456
 epoch: 3, train_loss: 0.8922, test_loss: 1.0349, test_f1: 0.5679
 epoch: 4, train_loss: 0.8812, test_loss: 1.0301, test_f1: 0.5959
 epoch: 5, train_loss: 0.8509, test_loss: 1.0241, test_f1: 0.4767
 epoch: 6, train_loss: 0.8443, test_loss: 0.9715, test_f1: 0.5783
 epoch: 7, train_loss: 0.8263, test_loss: 1.1254, test_f1: 0.5274
 epoch: 8, train_loss: 0.8126, test_loss: 1.0551, test_f1: 0.5301
 epoch: 9, train_loss: 0.8078, test_loss: 1.0305, test_f1: 0.6003
 epoch: 10, train_loss: 0.8065, test_loss: 1.0382, test_f1: 0.5843
 epoch: 11, train_loss: 0.7547, test_loss: 1.2033, test_f1: 0.5519
 epoch: 12, train_loss: 0.7705, test_loss: 1.1584, test_f1: 0.5532
 epoch: 13, train_loss: 0.7461, test_loss: 1.0448, test_f1: 0.5857
 epoch: 14, train_loss: 0.7098, test_loss: 1.0178, test_f1: 0.5923
 epoch: 15, train_loss: 0.7029, test_loss: 1.3419, test_f1: 0.5881
 epoch: 16, train_loss: 0.6787, test_loss: 1.2615, test_f1: 0.6067
 epoch: 17, train_loss: 0.6497, test_loss: 1.2566, test_f1: 0.5651
 epoch: 18, train_loss: 0.6414, test_loss: 1.2537, test_f1: 0.6153
 epoch: 19, train_loss: 0.6360, test_loss: 1.3033, test_f1: 0.6109
 epoch: 20, train_loss: 0.6125, test_loss: 1.2493, test_f1: 0.6048
 epoch: 21, train_loss: 0.5967, test_loss: 1.5755, test_f1: 0.5275
 epoch: 22, train_loss: 0.6113, test_loss: 1.3678, test_f1: 0.5826
 epoch: 23, train_loss: 0.5989, test_loss: 1.4601, test_f1: 0.5777
 epoch: 24, train_loss: 0.5834, test_loss: 1.5345, test_f1: 0.6094
 epoch: 25, train_loss: 0.5114, test_loss: 1.4363, test_f1: 0.6021
 epoch: 26, train_loss: 0.5164, test_loss: 1.6612, test_f1: 0.5621
 epoch: 27, train_loss: 0.5413, test_loss: 1.5986, test_f1: 0.6198
 epoch: 28, train_loss: 0.5018, test_loss: 1.4722, test_f1: 0.5941
 epoch: 29, train_loss: 0.4886, test_loss: 1.6759, test_f1: 0.5851
 epoch: 30, train_loss: 0.4522, test_loss: 1.7401, test_f1: 0.5914
 epoch: 31, train_loss: 0.4689, test_loss: 1.7259, test_f1: 0.5917
 epoch: 32, train_loss: 0.5041, test_loss: 1.7471, test_f1: 0.6086
 epoch: 33, train_loss: 0.4778, test_loss: 1.5302, test_f1: 0.6287
 epoch: 34, train_loss: 0.4382, test_loss: 2.0150, test_f1: 0.5722
 epoch: 35, train_loss: 0.4159, test_loss: 1.8498, test_f1: 0.6157
 epoch: 36, train_loss: 0.4027, test_loss: 2.0081, test_f1: 0.5804
 epoch: 37, train_loss: 0.4182, test_loss: 1.8874, test_f1: 0.5881
 epoch: 38, train_loss: 0.4485, test_loss: 1.7056, test_f1: 0.6138
 epoch: 39, train_loss: 0.4228, test_loss: 1.8252, test_f1: 0.5784
 epoch: 40, train_loss: 0.4000, test_loss: 2.0707, test_f1: 0.5549
 epoch: 41, train_loss: 0.3832, test_loss: 2.1051, test_f1: 0.5956
 epoch: 42, train_loss: 0.3591, test_loss: 2.1631, test_f1: 0.5767
 epoch: 43, train_loss: 0.3471, test_loss: 2.3573, test_f1: 0.5794
 epoch: 44, train_loss: 0.3669, test_loss: 2.2402, test_f1: 0.5843
 epoch: 45, train_loss: 0.3524, test_loss: 2.4592, test_f1: 0.5793
 epoch: 46, train_loss: 0.3529, test_loss: 2.2846, test_f1: 0.5503
 epoch: 47, train_loss: 0.3806, test_loss: 2.5135, test_f1: 0.6134
 epoch: 48, train_loss: 0.3696, test_loss: 2.1436, test_f1: 0.6089
 epoch: 49, train_loss: 0.3411, test_loss: 2.3510, test_f1: 0.5504
 epoch: 50, train_loss: 0.3561, test_loss: 2.4495, test_f1: 0.5449
 epoch: 51, train_loss: 0.3379, test_loss: 2.0967, test_f1: 0.6177
 epoch: 52, train_loss: 0.2641, test_loss: 2.1962, test_f1: 0.5937
 epoch: 53, train_loss: 0.2606, test_loss: 2.2520, test_f1: 0.6140
 epoch: 54, train_loss: 0.2414, test_loss: 2.4700, test_f1: 0.5696
 epoch: 55, train_loss: 0.2444, test_loss: 2.5441, test_f1: 0.5700
 epoch: 56, train_loss: 0.2514, test_loss: 2.6296, test_f1: 0.5837
 epoch: 57, train_loss: 0.2221, test_loss: 2.6160, test_f1: 0.5907
 epoch: 58, train_loss: 0.2122, test_loss: 2.5962, test_f1: 0.5730
 epoch: 59, train_loss: 0.2335, test_loss: 2.5230, test_f1: 0.5830
 epoch: 60, train_loss: 0.2066, test_loss: 2.7318, test_f1: 0.5954
 epoch: 61, train_loss: 0.2000, test_loss: 2.8620, test_f1: 0.5723
 epoch: 62, train_loss: 0.2123, test_loss: 2.9382, test_f1: 0.5914
 epoch: 63, train_loss: 0.2360, test_loss: 2.8029, test_f1: 0.5922
 epoch: 64, train_loss: 0.1906, test_loss: 2.8969, test_f1: 0.5667
 epoch: 65, train_loss: 0.1947, test_loss: 2.7898, test_f1: 0.5910
 epoch: 66, train_loss: 0.1716, test_loss: 2.8472, test_f1: 0.5737
 epoch: 67, train_loss: 0.1782, test_loss: 3.2787, test_f1: 0.5721
 epoch: 68, train_loss: 0.1921, test_loss: 2.9980, test_f1: 0.5850
 epoch: 69, train_loss: 0.1813, test_loss: 3.0155, test_f1: 0.5912
 epoch: 70, train_loss: 0.1792, test_loss: 3.0777, test_f1: 0.6031
 epoch: 71, train_loss: 0.1791, test_loss: 2.9786, test_f1: 0.6070
 epoch: 72, train_loss: 0.1772, test_loss: 3.3008, test_f1: 0.6020
 epoch: 73, train_loss: 0.1873, test_loss: 3.0157, test_f1: 0.5773
 epoch: 74, train_loss: 0.2048, test_loss: 2.9568, test_f1: 0.5676
 epoch: 75, train_loss: 0.1919, test_loss: 3.3513, test_f1: 0.5772
 epoch: 76, train_loss: 0.1734, test_loss: 3.0562, test_f1: 0.5900
 epoch: 77, train_loss: 0.1670, test_loss: 3.3790, test_f1: 0.5555
 epoch: 78, train_loss: 0.1817, test_loss: 3.4461, test_f1: 0.5940
 epoch: 79, train_loss: 0.1693, test_loss: 3.3578, test_f1: 0.5634
 epoch: 80, train_loss: 0.1866, test_loss: 3.7235, test_f1: 0.5767
 epoch: 81, train_loss: 0.1688, test_loss: 3.1843, test_f1: 0.5729
 epoch: 82, train_loss: 0.1570, test_loss: 3.1094, test_f1: 0.5868
 epoch: 83, train_loss: 0.1708, test_loss: 3.3251, test_f1: 0.5614
 epoch: 84, train_loss: 0.1615, test_loss: 3.4858, test_f1: 0.5631
 epoch: 85, train_loss: 0.1206, test_loss: 3.4851, test_f1: 0.5580
 epoch: 86, train_loss: 0.1358, test_loss: 3.5680, test_f1: 0.5891
 epoch: 87, train_loss: 0.1497, test_loss: 3.4522, test_f1: 0.5821
 epoch: 88, train_loss: 0.1743, test_loss: 3.4948, test_f1: 0.5619
 epoch: 89, train_loss: 0.1514, test_loss: 3.6382, test_f1: 0.5739
 epoch: 90, train_loss: 0.1704, test_loss: 3.3989, test_f1: 0.5837
 epoch: 91, train_loss: 0.1385, test_loss: 3.3817, test_f1: 0.5673
 epoch: 92, train_loss: 0.1330, test_loss: 3.4133, test_f1: 0.5929
 epoch: 93, train_loss: 0.1345, test_loss: 3.4246, test_f1: 0.5862
 epoch: 94, train_loss: 0.1427, test_loss: 3.6746, test_f1: 0.5812
 epoch: 95, train_loss: 0.1281, test_loss: 3.8118, test_f1: 0.5806
 epoch: 96, train_loss: 0.1444, test_loss: 4.0216, test_f1: 0.5870
 epoch: 97, train_loss: 0.1311, test_loss: 3.9756, test_f1: 0.5462
 epoch: 98, train_loss: 0.1247, test_loss: 4.1907, test_f1: 0.5536
 epoch: 99, train_loss: 0.1519, test_loss: 4.5101, test_f1: 0.5576
##################ITERATION #2 ****************************************
 epoch: 0, train_loss: 1.1507, test_loss: 1.2474, test_f1: 0.1419
 epoch: 1, train_loss: 1.0082, test_loss: 1.1064, test_f1: 0.4103
 epoch: 2, train_loss: 0.9571, test_loss: 1.0466, test_f1: 0.5576
 epoch: 3, train_loss: 0.9175, test_loss: 1.0453, test_f1: 0.5219
 epoch: 4, train_loss: 0.8984, test_loss: 1.0052, test_f1: 0.5754
 epoch: 5, train_loss: 0.8626, test_loss: 1.0609, test_f1: 0.5681
 epoch: 6, train_loss: 0.8455, test_loss: 1.0635, test_f1: 0.5388
 epoch: 7, train_loss: 0.8393, test_loss: 1.0600, test_f1: 0.5851
 epoch: 8, train_loss: 0.8356, test_loss: 1.0522, test_f1: 0.5811
 epoch: 9, train_loss: 0.8329, test_loss: 1.0197, test_f1: 0.5955
 epoch: 10, train_loss: 0.8257, test_loss: 1.0611, test_f1: 0.5752
 epoch: 11, train_loss: 0.8053, test_loss: 1.0229, test_f1: 0.6064
 epoch: 12, train_loss: 0.7779, test_loss: 1.1585, test_f1: 0.5132
 epoch: 13, train_loss: 0.7441, test_loss: 1.0311, test_f1: 0.5842
 epoch: 14, train_loss: 0.7305, test_loss: 1.1533, test_f1: 0.5270
 epoch: 15, train_loss: 0.7231, test_loss: 1.1776, test_f1: 0.5425
 epoch: 16, train_loss: 0.7283, test_loss: 1.2954, test_f1: 0.5724
 epoch: 17, train_loss: 0.7240, test_loss: 1.1455, test_f1: 0.5546
 epoch: 18, train_loss: 0.6834, test_loss: 1.0357, test_f1: 0.6276
 epoch: 19, train_loss: 0.6947, test_loss: 1.3311, test_f1: 0.5530
 epoch: 20, train_loss: 0.6416, test_loss: 1.1432, test_f1: 0.6115
 epoch: 21, train_loss: 0.6340, test_loss: 1.2712, test_f1: 0.5838
 epoch: 22, train_loss: 0.6600, test_loss: 1.2514, test_f1: 0.5441
 epoch: 23, train_loss: 0.6267, test_loss: 1.3186, test_f1: 0.5683
 epoch: 24, train_loss: 0.5944, test_loss: 1.4803, test_f1: 0.5705
 epoch: 25, train_loss: 0.5616, test_loss: 1.2960, test_f1: 0.6263
 epoch: 26, train_loss: 0.5432, test_loss: 1.5209, test_f1: 0.5821
 epoch: 27, train_loss: 0.5836, test_loss: 1.3716, test_f1: 0.5948
 epoch: 28, train_loss: 0.5694, test_loss: 1.4155, test_f1: 0.6450
 epoch: 29, train_loss: 0.5416, test_loss: 1.5399, test_f1: 0.5753
 epoch: 30, train_loss: 0.5205, test_loss: 1.7114, test_f1: 0.5875
 epoch: 31, train_loss: 0.5235, test_loss: 1.6366, test_f1: 0.5280
 epoch: 32, train_loss: 0.4911, test_loss: 1.3944, test_f1: 0.5900
 epoch: 33, train_loss: 0.4664, test_loss: 1.5698, test_f1: 0.6092
 epoch: 34, train_loss: 0.4629, test_loss: 1.4584, test_f1: 0.5830
 epoch: 35, train_loss: 0.4677, test_loss: 1.7684, test_f1: 0.5578
 epoch: 36, train_loss: 0.4351, test_loss: 1.7952, test_f1: 0.5872
 epoch: 37, train_loss: 0.4480, test_loss: 1.9969, test_f1: 0.5572
 epoch: 38, train_loss: 0.4600, test_loss: 1.5544, test_f1: 0.5906
 epoch: 39, train_loss: 0.4553, test_loss: 1.9654, test_f1: 0.5481
 epoch: 40, train_loss: 0.4819, test_loss: 1.9351, test_f1: 0.5584
 epoch: 41, train_loss: 0.4107, test_loss: 1.6886, test_f1: 0.5822
 epoch: 42, train_loss: 0.3795, test_loss: 2.2907, test_f1: 0.5483
 epoch: 43, train_loss: 0.4226, test_loss: 1.9062, test_f1: 0.5581
 epoch: 44, train_loss: 0.3840, test_loss: 1.7987, test_f1: 0.5750
 epoch: 45, train_loss: 0.3878, test_loss: 2.0818, test_f1: 0.5655
 epoch: 46, train_loss: 0.3988, test_loss: 1.7977, test_f1: 0.6352
 epoch: 47, train_loss: 0.3989, test_loss: 1.8868, test_f1: 0.6056
 epoch: 48, train_loss: 0.4059, test_loss: 2.0277, test_f1: 0.5963
 epoch: 49, train_loss: 0.3418, test_loss: 2.0297, test_f1: 0.5754
 epoch: 50, train_loss: 0.3726, test_loss: 1.8669, test_f1: 0.6271
 epoch: 51, train_loss: 0.3494, test_loss: 2.1479, test_f1: 0.5939
 epoch: 52, train_loss: 0.2799, test_loss: 2.0945, test_f1: 0.6299
 epoch: 53, train_loss: 0.2544, test_loss: 2.2735, test_f1: 0.5919
 epoch: 54, train_loss: 0.2573, test_loss: 2.2693, test_f1: 0.5749
 epoch: 55, train_loss: 0.2426, test_loss: 2.2849, test_f1: 0.6054
 epoch: 56, train_loss: 0.2320, test_loss: 2.3986, test_f1: 0.5784
 epoch: 57, train_loss: 0.2203, test_loss: 2.4704, test_f1: 0.5928
 epoch: 58, train_loss: 0.2355, test_loss: 2.5629, test_f1: 0.5672
 epoch: 59, train_loss: 0.2253, test_loss: 2.8160, test_f1: 0.5743
 epoch: 60, train_loss: 0.2255, test_loss: 2.9392, test_f1: 0.5559
 epoch: 61, train_loss: 0.2243, test_loss: 2.9735, test_f1: 0.5578
 epoch: 62, train_loss: 0.2328, test_loss: 2.8064, test_f1: 0.5648
 epoch: 63, train_loss: 0.2101, test_loss: 2.7736, test_f1: 0.5788
 epoch: 64, train_loss: 0.1857, test_loss: 2.7691, test_f1: 0.5762
 epoch: 65, train_loss: 0.1826, test_loss: 2.7918, test_f1: 0.5831
 epoch: 66, train_loss: 0.2285, test_loss: 3.0685, test_f1: 0.5849
 epoch: 67, train_loss: 0.2147, test_loss: 2.7956, test_f1: 0.5359
 epoch: 68, train_loss: 0.2016, test_loss: 2.9128, test_f1: 0.5806
 epoch: 69, train_loss: 0.1755, test_loss: 2.8628, test_f1: 0.6000
 epoch: 70, train_loss: 0.1957, test_loss: 2.9350, test_f1: 0.5744
 epoch: 71, train_loss: 0.1747, test_loss: 3.1564, test_f1: 0.5535
 epoch: 72, train_loss: 0.1843, test_loss: 2.9239, test_f1: 0.5861
 epoch: 73, train_loss: 0.1961, test_loss: 3.1176, test_f1: 0.5593
 epoch: 74, train_loss: 0.1784, test_loss: 3.0503, test_f1: 0.5808
 epoch: 75, train_loss: 0.1658, test_loss: 3.0421, test_f1: 0.5983
 epoch: 76, train_loss: 0.1722, test_loss: 3.1386, test_f1: 0.5904
 epoch: 77, train_loss: 0.1920, test_loss: 3.2901, test_f1: 0.6085
 epoch: 78, train_loss: 0.1758, test_loss: 3.0091, test_f1: 0.6034
 epoch: 79, train_loss: 0.1625, test_loss: 3.2718, test_f1: 0.5654
 epoch: 80, train_loss: 0.1819, test_loss: 3.2539, test_f1: 0.5711
 epoch: 81, train_loss: 0.1671, test_loss: 3.1022, test_f1: 0.5858
 epoch: 82, train_loss: 0.2074, test_loss: 3.6637, test_f1: 0.5746
 epoch: 83, train_loss: 0.1755, test_loss: 3.3608, test_f1: 0.5906
 epoch: 84, train_loss: 0.1681, test_loss: 3.3115, test_f1: 0.5897
 epoch: 85, train_loss: 0.1600, test_loss: 3.2972, test_f1: 0.5726
 epoch: 86, train_loss: 0.1929, test_loss: 3.6121, test_f1: 0.5538
 epoch: 87, train_loss: 0.1698, test_loss: 3.3542, test_f1: 0.5820
 epoch: 88, train_loss: 0.1425, test_loss: 3.1262, test_f1: 0.5977
 epoch: 89, train_loss: 0.1577, test_loss: 3.1577, test_f1: 0.5840
 epoch: 90, train_loss: 0.1527, test_loss: 3.2930, test_f1: 0.5729
 epoch: 91, train_loss: 0.1674, test_loss: 3.3329, test_f1: 0.6136
 epoch: 92, train_loss: 0.1552, test_loss: 3.4129, test_f1: 0.6199
 epoch: 93, train_loss: 0.1363, test_loss: 3.3207, test_f1: 0.6014
 epoch: 94, train_loss: 0.1250, test_loss: 3.5182, test_f1: 0.6032
 epoch: 95, train_loss: 0.1381, test_loss: 3.5873, test_f1: 0.5939
 epoch: 96, train_loss: 0.1459, test_loss: 3.4702, test_f1: 0.6045
 epoch: 97, train_loss: 0.1503, test_loss: 3.3696, test_f1: 0.5941
 epoch: 98, train_loss: 0.1724, test_loss: 3.2374, test_f1: 0.6303
 epoch: 99, train_loss: 0.1444, test_loss: 3.3823, test_f1: 0.5779
##################ITERATION #3 ****************************************
 epoch: 0, train_loss: 1.2087, test_loss: 1.2299, test_f1: 0.2831
 epoch: 1, train_loss: 1.0398, test_loss: 1.1612, test_f1: 0.4407
 epoch: 2, train_loss: 0.9697, test_loss: 1.0172, test_f1: 0.5603
 epoch: 3, train_loss: 0.9202, test_loss: 1.0516, test_f1: 0.4916
 epoch: 4, train_loss: 0.9153, test_loss: 1.0336, test_f1: 0.5517
 epoch: 5, train_loss: 0.8759, test_loss: 0.9796, test_f1: 0.5626
 epoch: 6, train_loss: 0.8910, test_loss: 0.9820, test_f1: 0.5910
 epoch: 7, train_loss: 0.8449, test_loss: 1.0127, test_f1: 0.5943
 epoch: 8, train_loss: 0.8196, test_loss: 1.0291, test_f1: 0.5932
 epoch: 9, train_loss: 0.8092, test_loss: 1.0052, test_f1: 0.5613
 epoch: 10, train_loss: 0.8063, test_loss: 0.9964, test_f1: 0.5589
 epoch: 11, train_loss: 0.7865, test_loss: 1.1002, test_f1: 0.5224
 epoch: 12, train_loss: 0.7736, test_loss: 1.1367, test_f1: 0.5868
 epoch: 13, train_loss: 0.7518, test_loss: 1.0136, test_f1: 0.6107
 epoch: 14, train_loss: 0.7386, test_loss: 1.0917, test_f1: 0.5998
 epoch: 15, train_loss: 0.7139, test_loss: 1.0880, test_f1: 0.4862
 epoch: 16, train_loss: 0.7209, test_loss: 1.1821, test_f1: 0.5506
 epoch: 17, train_loss: 0.7131, test_loss: 1.0730, test_f1: 0.6203
 epoch: 18, train_loss: 0.6931, test_loss: 1.1814, test_f1: 0.6182
 epoch: 19, train_loss: 0.6555, test_loss: 1.1162, test_f1: 0.5965
 epoch: 20, train_loss: 0.6556, test_loss: 1.0931, test_f1: 0.5704
 epoch: 21, train_loss: 0.6347, test_loss: 1.2638, test_f1: 0.5802
 epoch: 22, train_loss: 0.5952, test_loss: 1.2633, test_f1: 0.5814
 epoch: 23, train_loss: 0.6060, test_loss: 1.1368, test_f1: 0.6253
 epoch: 24, train_loss: 0.5907, test_loss: 1.2356, test_f1: 0.5927
 epoch: 25, train_loss: 0.5974, test_loss: 1.2995, test_f1: 0.6154
 epoch: 26, train_loss: 0.5459, test_loss: 1.4748, test_f1: 0.5723
 epoch: 27, train_loss: 0.5572, test_loss: 1.3051, test_f1: 0.6191
 epoch: 28, train_loss: 0.5470, test_loss: 1.5285, test_f1: 0.5915
 epoch: 29, train_loss: 0.5180, test_loss: 1.2697, test_f1: 0.6350
 epoch: 30, train_loss: 0.5166, test_loss: 1.4714, test_f1: 0.5929
 epoch: 31, train_loss: 0.5269, test_loss: 1.6185, test_f1: 0.5979
 epoch: 32, train_loss: 0.5234, test_loss: 1.5859, test_f1: 0.5857
 epoch: 33, train_loss: 0.5018, test_loss: 1.5459, test_f1: 0.6174
 epoch: 34, train_loss: 0.4994, test_loss: 1.5009, test_f1: 0.6372
 epoch: 35, train_loss: 0.5082, test_loss: 1.6615, test_f1: 0.5484
 epoch: 36, train_loss: 0.4937, test_loss: 1.6415, test_f1: 0.6339
 epoch: 37, train_loss: 0.4440, test_loss: 1.4616, test_f1: 0.6272
 epoch: 38, train_loss: 0.4543, test_loss: 1.9065, test_f1: 0.5419
 epoch: 39, train_loss: 0.4587, test_loss: 1.7500, test_f1: 0.5942
 epoch: 40, train_loss: 0.4380, test_loss: 1.5087, test_f1: 0.6435
 epoch: 41, train_loss: 0.4165, test_loss: 1.8640, test_f1: 0.6177
 epoch: 42, train_loss: 0.4268, test_loss: 1.7302, test_f1: 0.6191
 epoch: 43, train_loss: 0.4410, test_loss: 1.7635, test_f1: 0.6057
 epoch: 44, train_loss: 0.4153, test_loss: 1.7809, test_f1: 0.5791
 epoch: 45, train_loss: 0.4045, test_loss: 1.8788, test_f1: 0.6136
 epoch: 46, train_loss: 0.3997, test_loss: 1.7318, test_f1: 0.6128
 epoch: 47, train_loss: 0.3913, test_loss: 1.6727, test_f1: 0.6354
 epoch: 48, train_loss: 0.3638, test_loss: 2.2168, test_f1: 0.5849
 epoch: 49, train_loss: 0.3584, test_loss: 2.6735, test_f1: 0.5250
 epoch: 50, train_loss: 0.4870, test_loss: 1.8935, test_f1: 0.6100
 epoch: 51, train_loss: 0.3971, test_loss: 1.7405, test_f1: 0.5845
 epoch: 52, train_loss: 0.3557, test_loss: 1.9126, test_f1: 0.5966
 epoch: 53, train_loss: 0.3103, test_loss: 1.9140, test_f1: 0.6174
 epoch: 54, train_loss: 0.2939, test_loss: 1.9153, test_f1: 0.6303
 epoch: 55, train_loss: 0.3036, test_loss: 2.1257, test_f1: 0.6063
 epoch: 56, train_loss: 0.2954, test_loss: 2.2120, test_f1: 0.5998
 epoch: 57, train_loss: 0.2868, test_loss: 2.1404, test_f1: 0.6225
 epoch: 58, train_loss: 0.2635, test_loss: 2.1484, test_f1: 0.6031
 epoch: 59, train_loss: 0.2430, test_loss: 2.2570, test_f1: 0.6251
 epoch: 60, train_loss: 0.2654, test_loss: 2.2463, test_f1: 0.6098
 epoch: 61, train_loss: 0.2688, test_loss: 2.0685, test_f1: 0.6523
 epoch: 62, train_loss: 0.2458, test_loss: 2.1298, test_f1: 0.6090
 epoch: 63, train_loss: 0.2252, test_loss: 2.5960, test_f1: 0.5914
 epoch: 64, train_loss: 0.2210, test_loss: 2.3036, test_f1: 0.6021
 epoch: 65, train_loss: 0.2525, test_loss: 2.3273, test_f1: 0.5962
 epoch: 66, train_loss: 0.2495, test_loss: 2.6976, test_f1: 0.6096
 epoch: 67, train_loss: 0.2426, test_loss: 2.5827, test_f1: 0.5988
 epoch: 68, train_loss: 0.2316, test_loss: 2.6251, test_f1: 0.6078
 epoch: 69, train_loss: 0.2332, test_loss: 2.3704, test_f1: 0.6261
 epoch: 70, train_loss: 0.2076, test_loss: 2.5187, test_f1: 0.6040
 epoch: 71, train_loss: 0.2274, test_loss: 2.4573, test_f1: 0.6235
 epoch: 72, train_loss: 0.2005, test_loss: 2.7859, test_f1: 0.6130
 epoch: 73, train_loss: 0.2042, test_loss: 2.6650, test_f1: 0.5986
 epoch: 74, train_loss: 0.2153, test_loss: 2.7943, test_f1: 0.6157
 epoch: 75, train_loss: 0.1921, test_loss: 2.8426, test_f1: 0.6017
 epoch: 76, train_loss: 0.1939, test_loss: 2.5825, test_f1: 0.6313
 epoch: 77, train_loss: 0.2126, test_loss: 3.0569, test_f1: 0.5990
 epoch: 78, train_loss: 0.1901, test_loss: 2.9140, test_f1: 0.5884
 epoch: 79, train_loss: 0.1941, test_loss: 2.7631, test_f1: 0.5939
 epoch: 80, train_loss: 0.1873, test_loss: 2.7592, test_f1: 0.6373
 epoch: 81, train_loss: 0.1591, test_loss: 2.7874, test_f1: 0.6113
 epoch: 82, train_loss: 0.1587, test_loss: 2.8767, test_f1: 0.5931
 epoch: 83, train_loss: 0.1443, test_loss: 2.7572, test_f1: 0.6364
 epoch: 84, train_loss: 0.1862, test_loss: 3.1389, test_f1: 0.6009
 epoch: 85, train_loss: 0.1641, test_loss: 2.9708, test_f1: 0.5845
 epoch: 86, train_loss: 0.1704, test_loss: 3.1536, test_f1: 0.5831
 epoch: 87, train_loss: 0.1335, test_loss: 2.8105, test_f1: 0.6334
 epoch: 88, train_loss: 0.1568, test_loss: 3.0062, test_f1: 0.6308
 epoch: 89, train_loss: 0.1760, test_loss: 3.3062, test_f1: 0.5957
 epoch: 90, train_loss: 0.1939, test_loss: 3.0711, test_f1: 0.6132
 epoch: 91, train_loss: 0.1763, test_loss: 2.7826, test_f1: 0.6224
 epoch: 92, train_loss: 0.1436, test_loss: 2.9241, test_f1: 0.6371
 epoch: 93, train_loss: 0.1573, test_loss: 3.0380, test_f1: 0.5951
 epoch: 94, train_loss: 0.1262, test_loss: 3.1080, test_f1: 0.6318
 epoch: 95, train_loss: 0.1185, test_loss: 3.2822, test_f1: 0.6140
 epoch: 96, train_loss: 0.1296, test_loss: 3.2212, test_f1: 0.6279
 epoch: 97, train_loss: 0.1547, test_loss: 3.3015, test_f1: 0.6311
 epoch: 98, train_loss: 0.1404, test_loss: 3.0420, test_f1: 0.6244
 epoch: 99, train_loss: 0.1571, test_loss: 3.2777, test_f1: 0.6292
##################ITERATION #4 ****************************************
 epoch: 0, train_loss: 1.2562, test_loss: 1.2364, test_f1: 0.4297
 epoch: 1, train_loss: 1.0450, test_loss: 1.1322, test_f1: 0.4457
 epoch: 2, train_loss: 0.9608, test_loss: 1.0718, test_f1: 0.5436
 epoch: 3, train_loss: 0.9308, test_loss: 1.1321, test_f1: 0.5336
 epoch: 4, train_loss: 0.9009, test_loss: 1.1079, test_f1: 0.4899
 epoch: 5, train_loss: 0.8889, test_loss: 1.0893, test_f1: 0.4992
 epoch: 6, train_loss: 0.8851, test_loss: 1.0926, test_f1: 0.5476
 epoch: 7, train_loss: 0.8459, test_loss: 1.1705, test_f1: 0.4255
 epoch: 8, train_loss: 0.8257, test_loss: 1.1179, test_f1: 0.5741
 epoch: 9, train_loss: 0.8013, test_loss: 1.1936, test_f1: 0.5510
 epoch: 10, train_loss: 0.7878, test_loss: 1.1749, test_f1: 0.5580
 epoch: 11, train_loss: 0.7826, test_loss: 1.1332, test_f1: 0.5685
 epoch: 12, train_loss: 0.7443, test_loss: 1.1238, test_f1: 0.5857
 epoch: 13, train_loss: 0.7434, test_loss: 1.1727, test_f1: 0.5445
 epoch: 14, train_loss: 0.7336, test_loss: 1.2170, test_f1: 0.5735
 epoch: 15, train_loss: 0.7260, test_loss: 1.3141, test_f1: 0.4728
 epoch: 16, train_loss: 0.6881, test_loss: 1.1929, test_f1: 0.6172
 epoch: 17, train_loss: 0.7174, test_loss: 1.3150, test_f1: 0.5910
 epoch: 18, train_loss: 0.7271, test_loss: 1.4062, test_f1: 0.5275
 epoch: 19, train_loss: 0.6512, test_loss: 1.3431, test_f1: 0.5540
 epoch: 20, train_loss: 0.6328, test_loss: 1.5498, test_f1: 0.5266
 epoch: 21, train_loss: 0.6028, test_loss: 1.5585, test_f1: 0.5736
 epoch: 22, train_loss: 0.6266, test_loss: 1.3156, test_f1: 0.5878
 epoch: 23, train_loss: 0.5933, test_loss: 1.3567, test_f1: 0.5971
 epoch: 24, train_loss: 0.5893, test_loss: 1.6388, test_f1: 0.6013
 epoch: 25, train_loss: 0.5952, test_loss: 1.6363, test_f1: 0.5502
 epoch: 26, train_loss: 0.5677, test_loss: 1.5493, test_f1: 0.5907
 epoch: 27, train_loss: 0.5623, test_loss: 1.5634, test_f1: 0.5598
 epoch: 28, train_loss: 0.5280, test_loss: 1.7230, test_f1: 0.5966
 epoch: 29, train_loss: 0.5099, test_loss: 1.8781, test_f1: 0.5365
 epoch: 30, train_loss: 0.5129, test_loss: 1.8636, test_f1: 0.5628
 epoch: 31, train_loss: 0.5408, test_loss: 1.7169, test_f1: 0.5518
 epoch: 32, train_loss: 0.5328, test_loss: 1.7747, test_f1: 0.5518
 epoch: 33, train_loss: 0.4974, test_loss: 1.7782, test_f1: 0.5859
 epoch: 34, train_loss: 0.5133, test_loss: 1.7440, test_f1: 0.5711
 epoch: 35, train_loss: 0.4851, test_loss: 2.1830, test_f1: 0.5790
 epoch: 36, train_loss: 0.4876, test_loss: 2.2046, test_f1: 0.5397
 epoch: 37, train_loss: 0.4864, test_loss: 1.8752, test_f1: 0.5310
 epoch: 38, train_loss: 0.4534, test_loss: 1.8500, test_f1: 0.5591
 epoch: 39, train_loss: 0.4884, test_loss: 1.9771, test_f1: 0.5672
 epoch: 40, train_loss: 0.4392, test_loss: 2.0316, test_f1: 0.5816
 epoch: 41, train_loss: 0.4308, test_loss: 2.1661, test_f1: 0.5297
 epoch: 42, train_loss: 0.4194, test_loss: 2.0249, test_f1: 0.5715
 epoch: 43, train_loss: 0.4328, test_loss: 2.2471, test_f1: 0.5630
 epoch: 44, train_loss: 0.4115, test_loss: 2.3798, test_f1: 0.5902
 epoch: 45, train_loss: 0.4218, test_loss: 2.0435, test_f1: 0.5786
 epoch: 46, train_loss: 0.3963, test_loss: 1.9116, test_f1: 0.6190
 epoch: 47, train_loss: 0.4163, test_loss: 2.1815, test_f1: 0.5770
 epoch: 48, train_loss: 0.3726, test_loss: 2.0707, test_f1: 0.5804
 epoch: 49, train_loss: 0.3880, test_loss: 2.1640, test_f1: 0.6064
 epoch: 50, train_loss: 0.3501, test_loss: 2.4229, test_f1: 0.5567
 epoch: 51, train_loss: 0.3307, test_loss: 2.4667, test_f1: 0.5616
 epoch: 52, train_loss: 0.3277, test_loss: 2.4874, test_f1: 0.5677
 epoch: 53, train_loss: 0.2954, test_loss: 2.6084, test_f1: 0.5984
 epoch: 54, train_loss: 0.2772, test_loss: 2.5324, test_f1: 0.5800
 epoch: 55, train_loss: 0.2575, test_loss: 2.5980, test_f1: 0.6262
 epoch: 56, train_loss: 0.2589, test_loss: 2.7936, test_f1: 0.6074
 epoch: 57, train_loss: 0.2718, test_loss: 2.6455, test_f1: 0.6195
 epoch: 58, train_loss: 0.2558, test_loss: 3.0780, test_f1: 0.5646
 epoch: 59, train_loss: 0.2476, test_loss: 2.5268, test_f1: 0.6121
 epoch: 60, train_loss: 0.2788, test_loss: 2.7215, test_f1: 0.6205
 epoch: 61, train_loss: 0.2585, test_loss: 3.2228, test_f1: 0.5871
 epoch: 62, train_loss: 0.2402, test_loss: 2.9888, test_f1: 0.5845
 epoch: 63, train_loss: 0.2122, test_loss: 3.0397, test_f1: 0.6182
 epoch: 64, train_loss: 0.2398, test_loss: 3.0506, test_f1: 0.5843
 epoch: 65, train_loss: 0.2142, test_loss: 3.2130, test_f1: 0.6222
 epoch: 66, train_loss: 0.2293, test_loss: 3.2091, test_f1: 0.5900
 epoch: 67, train_loss: 0.2225, test_loss: 3.3007, test_f1: 0.6001
 epoch: 68, train_loss: 0.2197, test_loss: 3.2322, test_f1: 0.5969
 epoch: 69, train_loss: 0.2358, test_loss: 3.1730, test_f1: 0.5901
 epoch: 70, train_loss: 0.2121, test_loss: 3.2661, test_f1: 0.6016
 epoch: 71, train_loss: 0.2057, test_loss: 3.3884, test_f1: 0.6074
 epoch: 72, train_loss: 0.2061, test_loss: 3.2539, test_f1: 0.6130
 epoch: 73, train_loss: 0.2008, test_loss: 3.6999, test_f1: 0.6078
 epoch: 74, train_loss: 0.1945, test_loss: 3.2699, test_f1: 0.6024
 epoch: 75, train_loss: 0.1886, test_loss: 3.5048, test_f1: 0.6157
 epoch: 76, train_loss: 0.1908, test_loss: 3.4976, test_f1: 0.6075
 epoch: 77, train_loss: 0.1915, test_loss: 3.4921, test_f1: 0.6151
 epoch: 78, train_loss: 0.1797, test_loss: 3.5506, test_f1: 0.6075
 epoch: 79, train_loss: 0.1895, test_loss: 3.4672, test_f1: 0.6223
 epoch: 80, train_loss: 0.2079, test_loss: 3.8014, test_f1: 0.5876
 epoch: 81, train_loss: 0.1876, test_loss: 3.6048, test_f1: 0.6241
 epoch: 82, train_loss: 0.2118, test_loss: 3.2677, test_f1: 0.6389
 epoch: 83, train_loss: 0.2051, test_loss: 3.7023, test_f1: 0.6085
 epoch: 84, train_loss: 0.1924, test_loss: 3.6776, test_f1: 0.5942
 epoch: 85, train_loss: 0.1990, test_loss: 3.4322, test_f1: 0.6070
 epoch: 86, train_loss: 0.1672, test_loss: 3.5514, test_f1: 0.6286
 epoch: 87, train_loss: 0.1750, test_loss: 3.7148, test_f1: 0.6129
 epoch: 88, train_loss: 0.1909, test_loss: 3.4381, test_f1: 0.6018
 epoch: 89, train_loss: 0.1765, test_loss: 3.5940, test_f1: 0.6177
 epoch: 90, train_loss: 0.1317, test_loss: 3.7647, test_f1: 0.5989
 epoch: 91, train_loss: 0.1554, test_loss: 3.8660, test_f1: 0.5952
 epoch: 92, train_loss: 0.1697, test_loss: 3.9507, test_f1: 0.5553
 epoch: 93, train_loss: 0.1841, test_loss: 3.8162, test_f1: 0.5662
 epoch: 94, train_loss: 0.1683, test_loss: 3.8039, test_f1: 0.6025
 epoch: 95, train_loss: 0.1543, test_loss: 3.9909, test_f1: 0.5971
 epoch: 96, train_loss: 0.1655, test_loss: 3.7146, test_f1: 0.6068
 epoch: 97, train_loss: 0.1584, test_loss: 3.8612, test_f1: 0.5884
 epoch: 98, train_loss: 0.1474, test_loss: 3.9061, test_f1: 0.6137
 epoch: 99, train_loss: 0.1543, test_loss: 4.1624, test_f1: 0.5855
##################ITERATION #5 ****************************************
 epoch: 0, train_loss: 1.2927, test_loss: 1.2356, test_f1: 0.3484
 epoch: 1, train_loss: 1.0561, test_loss: 1.1519, test_f1: 0.4053
 epoch: 2, train_loss: 0.9744, test_loss: 1.0915, test_f1: 0.4429
 epoch: 3, train_loss: 0.9463, test_loss: 1.0797, test_f1: 0.5009
 epoch: 4, train_loss: 0.8958, test_loss: 1.0547, test_f1: 0.5056
 epoch: 5, train_loss: 0.8639, test_loss: 1.0944, test_f1: 0.5159
 epoch: 6, train_loss: 0.8881, test_loss: 1.0498, test_f1: 0.5632
 epoch: 7, train_loss: 0.8545, test_loss: 1.0484, test_f1: 0.4685
 epoch: 8, train_loss: 0.8378, test_loss: 1.1502, test_f1: 0.5076
 epoch: 9, train_loss: 0.8157, test_loss: 1.0220, test_f1: 0.5672
 epoch: 10, train_loss: 0.7916, test_loss: 1.0741, test_f1: 0.5494
 epoch: 11, train_loss: 0.7769, test_loss: 1.0062, test_f1: 0.5563
 epoch: 12, train_loss: 0.7532, test_loss: 1.0656, test_f1: 0.5244
 epoch: 13, train_loss: 0.7552, test_loss: 1.0743, test_f1: 0.5873
 epoch: 14, train_loss: 0.7310, test_loss: 0.9667, test_f1: 0.5784
 epoch: 15, train_loss: 0.7200, test_loss: 1.1414, test_f1: 0.5706
 epoch: 16, train_loss: 0.7451, test_loss: 1.0554, test_f1: 0.5969
 epoch: 17, train_loss: 0.6794, test_loss: 1.2464, test_f1: 0.5542
 epoch: 18, train_loss: 0.6857, test_loss: 1.1437, test_f1: 0.5374
 epoch: 19, train_loss: 0.6779, test_loss: 0.9543, test_f1: 0.6066
 epoch: 20, train_loss: 0.6592, test_loss: 1.1161, test_f1: 0.6043
 epoch: 21, train_loss: 0.6437, test_loss: 1.2966, test_f1: 0.5282
 epoch: 22, train_loss: 0.6490, test_loss: 1.3054, test_f1: 0.5564
 epoch: 23, train_loss: 0.6134, test_loss: 1.2671, test_f1: 0.5727
 epoch: 24, train_loss: 0.6029, test_loss: 1.1790, test_f1: 0.6135
 epoch: 25, train_loss: 0.5868, test_loss: 1.1552, test_f1: 0.5939
 epoch: 26, train_loss: 0.5975, test_loss: 1.2783, test_f1: 0.5962
 epoch: 27, train_loss: 0.5428, test_loss: 1.3562, test_f1: 0.5682
 epoch: 28, train_loss: 0.5312, test_loss: 1.2959, test_f1: 0.6135
 epoch: 29, train_loss: 0.5457, test_loss: 1.3458, test_f1: 0.5801
 epoch: 30, train_loss: 0.5284, test_loss: 1.1414, test_f1: 0.5715
 epoch: 31, train_loss: 0.5048, test_loss: 1.4193, test_f1: 0.6221
 epoch: 32, train_loss: 0.5347, test_loss: 1.2500, test_f1: 0.6078
 epoch: 33, train_loss: 0.5105, test_loss: 1.3741, test_f1: 0.5733
 epoch: 34, train_loss: 0.4612, test_loss: 1.3602, test_f1: 0.5993
 epoch: 35, train_loss: 0.4664, test_loss: 1.5462, test_f1: 0.5560
 epoch: 36, train_loss: 0.4833, test_loss: 1.3930, test_f1: 0.6321
 epoch: 37, train_loss: 0.4893, test_loss: 1.3426, test_f1: 0.6054
 epoch: 38, train_loss: 0.4746, test_loss: 1.3092, test_f1: 0.6531
 epoch: 39, train_loss: 0.4555, test_loss: 1.5953, test_f1: 0.6141
 epoch: 40, train_loss: 0.4693, test_loss: 1.3556, test_f1: 0.6512
 epoch: 41, train_loss: 0.4458, test_loss: 1.5858, test_f1: 0.5944
 epoch: 42, train_loss: 0.4350, test_loss: 1.5896, test_f1: 0.5836
 epoch: 43, train_loss: 0.4284, test_loss: 1.4937, test_f1: 0.6083
 epoch: 44, train_loss: 0.3864, test_loss: 1.8118, test_f1: 0.6092
 epoch: 45, train_loss: 0.3835, test_loss: 1.6810, test_f1: 0.5658
 epoch: 46, train_loss: 0.3899, test_loss: 1.6333, test_f1: 0.6392
 epoch: 47, train_loss: 0.4327, test_loss: 1.5843, test_f1: 0.5641
 epoch: 48, train_loss: 0.4403, test_loss: 1.5254, test_f1: 0.6089
 epoch: 49, train_loss: 0.3750, test_loss: 1.7516, test_f1: 0.6316
 epoch: 50, train_loss: 0.3704, test_loss: 1.7684, test_f1: 0.6010
 epoch: 51, train_loss: 0.3420, test_loss: 1.6843, test_f1: 0.6035
 epoch: 52, train_loss: 0.2852, test_loss: 1.9397, test_f1: 0.5890
 epoch: 53, train_loss: 0.2722, test_loss: 1.8840, test_f1: 0.5877
 epoch: 54, train_loss: 0.2710, test_loss: 2.0232, test_f1: 0.6178
 epoch: 55, train_loss: 0.2782, test_loss: 2.0072, test_f1: 0.6006
 epoch: 56, train_loss: 0.2701, test_loss: 2.0352, test_f1: 0.6266
 epoch: 57, train_loss: 0.2621, test_loss: 2.0222, test_f1: 0.6172
 epoch: 58, train_loss: 0.2646, test_loss: 2.0457, test_f1: 0.5882
 epoch: 59, train_loss: 0.2518, test_loss: 2.1236, test_f1: 0.6013
 epoch: 60, train_loss: 0.2387, test_loss: 2.0464, test_f1: 0.6154
 epoch: 61, train_loss: 0.2486, test_loss: 2.0870, test_f1: 0.6043
 epoch: 62, train_loss: 0.2329, test_loss: 2.1593, test_f1: 0.6074
 epoch: 63, train_loss: 0.2159, test_loss: 2.1766, test_f1: 0.5997
 epoch: 64, train_loss: 0.2288, test_loss: 2.2737, test_f1: 0.6071
 epoch: 65, train_loss: 0.2138, test_loss: 2.3289, test_f1: 0.6133
 epoch: 66, train_loss: 0.2081, test_loss: 2.3260, test_f1: 0.6039
 epoch: 67, train_loss: 0.2112, test_loss: 2.4661, test_f1: 0.6121
 epoch: 68, train_loss: 0.2150, test_loss: 2.6517, test_f1: 0.5971
 epoch: 69, train_loss: 0.2030, test_loss: 2.3859, test_f1: 0.6207
 epoch: 70, train_loss: 0.1938, test_loss: 2.4966, test_f1: 0.6269
 epoch: 71, train_loss: 0.2066, test_loss: 2.5447, test_f1: 0.6106
 epoch: 72, train_loss: 0.1945, test_loss: 2.5106, test_f1: 0.6106
 epoch: 73, train_loss: 0.1750, test_loss: 2.7263, test_f1: 0.5932
 epoch: 74, train_loss: 0.1859, test_loss: 2.6811, test_f1: 0.5931
 epoch: 75, train_loss: 0.1792, test_loss: 2.7721, test_f1: 0.5942
 epoch: 76, train_loss: 0.1585, test_loss: 2.6607, test_f1: 0.5892
 epoch: 77, train_loss: 0.1887, test_loss: 2.8675, test_f1: 0.5768
 epoch: 78, train_loss: 0.2187, test_loss: 2.7876, test_f1: 0.6000
 epoch: 79, train_loss: 0.2016, test_loss: 2.7415, test_f1: 0.6060
 epoch: 80, train_loss: 0.2005, test_loss: 2.6708, test_f1: 0.6060
 epoch: 81, train_loss: 0.1732, test_loss: 2.6292, test_f1: 0.6030
 epoch: 82, train_loss: 0.1889, test_loss: 2.6159, test_f1: 0.6065
 epoch: 83, train_loss: 0.1760, test_loss: 8.0620, test_f1: 0.4446
 epoch: 84, train_loss: 0.1965, test_loss: 2.5936, test_f1: 0.6010
 epoch: 85, train_loss: 0.1676, test_loss: 2.5604, test_f1: 0.6156
 epoch: 86, train_loss: 0.1527, test_loss: 2.8809, test_f1: 0.5673
 epoch: 87, train_loss: 0.1837, test_loss: 2.4525, test_f1: 0.6062
 epoch: 88, train_loss: 0.1917, test_loss: 2.9066, test_f1: 0.5808
 epoch: 89, train_loss: 0.1755, test_loss: 2.7782, test_f1: 0.5987
 epoch: 90, train_loss: 0.1846, test_loss: 2.7408, test_f1: 0.6244
 epoch: 91, train_loss: 0.2136, test_loss: 2.7233, test_f1: 0.5978
 epoch: 92, train_loss: 0.1716, test_loss: 2.8277, test_f1: 0.5796
 epoch: 93, train_loss: 0.1512, test_loss: 3.1596, test_f1: 0.5859
 epoch: 94, train_loss: 0.1464, test_loss: 3.0029, test_f1: 0.6157
 epoch: 95, train_loss: 0.1449, test_loss: 3.0632, test_f1: 0.5801
 epoch: 96, train_loss: 0.1525, test_loss: 2.9713, test_f1: 0.6001
 epoch: 97, train_loss: 0.1854, test_loss: 2.9550, test_f1: 0.5797
 epoch: 98, train_loss: 0.2009, test_loss: 3.0570, test_f1: 0.5795
 epoch: 99, train_loss: 0.1835, test_loss: 2.7210, test_f1: 0.6252
##################ITERATION #6 ****************************************
 epoch: 0, train_loss: 1.3423, test_loss: 1.3464, test_f1: 0.1606
 epoch: 1, train_loss: 1.0834, test_loss: 1.1737, test_f1: 0.4067
 epoch: 2, train_loss: 0.9781, test_loss: 1.0961, test_f1: 0.4892
 epoch: 3, train_loss: 0.9275, test_loss: 1.0501, test_f1: 0.4953
 epoch: 4, train_loss: 0.8964, test_loss: 1.0065, test_f1: 0.5507
 epoch: 5, train_loss: 0.8625, test_loss: 1.0527, test_f1: 0.5523
 epoch: 6, train_loss: 0.8361, test_loss: 1.0259, test_f1: 0.5708
 epoch: 7, train_loss: 0.8123, test_loss: 1.0690, test_f1: 0.5582
 epoch: 8, train_loss: 0.8236, test_loss: 1.1143, test_f1: 0.5554
 epoch: 9, train_loss: 0.7935, test_loss: 1.0416, test_f1: 0.6133
 epoch: 10, train_loss: 0.7632, test_loss: 1.0784, test_f1: 0.5818
 epoch: 11, train_loss: 0.7723, test_loss: 1.1744, test_f1: 0.6040
 epoch: 12, train_loss: 0.7551, test_loss: 1.3055, test_f1: 0.4197
 epoch: 13, train_loss: 0.7177, test_loss: 1.0383, test_f1: 0.6142
 epoch: 14, train_loss: 0.7078, test_loss: 1.1155, test_f1: 0.5845
 epoch: 15, train_loss: 0.6887, test_loss: 1.2199, test_f1: 0.5768
 epoch: 16, train_loss: 0.6766, test_loss: 1.1758, test_f1: 0.5675
 epoch: 17, train_loss: 0.6526, test_loss: 1.3371, test_f1: 0.5622
 epoch: 18, train_loss: 0.6370, test_loss: 1.1630, test_f1: 0.5235
 epoch: 19, train_loss: 0.6477, test_loss: 1.0815, test_f1: 0.6228
 epoch: 20, train_loss: 0.6444, test_loss: 1.2026, test_f1: 0.5824
 epoch: 21, train_loss: 0.6232, test_loss: 1.2225, test_f1: 0.5937
 epoch: 22, train_loss: 0.6128, test_loss: 1.2154, test_f1: 0.6014
 epoch: 23, train_loss: 0.5970, test_loss: 1.6396, test_f1: 0.4415
 epoch: 24, train_loss: 0.5931, test_loss: 1.3772, test_f1: 0.6134
 epoch: 25, train_loss: 0.5440, test_loss: 1.3302, test_f1: 0.6153
 epoch: 26, train_loss: 0.5423, test_loss: 1.3154, test_f1: 0.5829
 epoch: 27, train_loss: 0.5368, test_loss: 1.5644, test_f1: 0.5284
 epoch: 28, train_loss: 0.5188, test_loss: 1.3336, test_f1: 0.5869
 epoch: 29, train_loss: 0.5257, test_loss: 1.5249, test_f1: 0.5876
 epoch: 30, train_loss: 0.5247, test_loss: 1.5135, test_f1: 0.5613
 epoch: 31, train_loss: 0.5228, test_loss: 1.5294, test_f1: 0.5833
 epoch: 32, train_loss: 0.4967, test_loss: 1.5697, test_f1: 0.6022
 epoch: 33, train_loss: 0.4709, test_loss: 1.4959, test_f1: 0.6169
 epoch: 34, train_loss: 0.4564, test_loss: 1.6236, test_f1: 0.6287
 epoch: 35, train_loss: 0.4247, test_loss: 1.7207, test_f1: 0.5932
 epoch: 36, train_loss: 0.4612, test_loss: 1.9105, test_f1: 0.5712
 epoch: 37, train_loss: 0.4342, test_loss: 1.7410, test_f1: 0.6051
 epoch: 38, train_loss: 0.4156, test_loss: 1.7693, test_f1: 0.5943
 epoch: 39, train_loss: 0.4528, test_loss: 1.6836, test_f1: 0.6289
 epoch: 40, train_loss: 0.4305, test_loss: 2.1635, test_f1: 0.5564
 epoch: 41, train_loss: 0.4161, test_loss: 1.4737, test_f1: 0.5907
 epoch: 42, train_loss: 0.3821, test_loss: 1.7908, test_f1: 0.5724
 epoch: 43, train_loss: 0.3981, test_loss: 1.7423, test_f1: 0.5880
 epoch: 44, train_loss: 0.4170, test_loss: 1.7924, test_f1: 0.5874
 epoch: 45, train_loss: 0.4366, test_loss: 1.7651, test_f1: 0.5757
 epoch: 46, train_loss: 0.3921, test_loss: 1.7177, test_f1: 0.6022
 epoch: 47, train_loss: 0.3609, test_loss: 1.9438, test_f1: 0.5731
 epoch: 48, train_loss: 0.3214, test_loss: 1.8819, test_f1: 0.5934
 epoch: 49, train_loss: 0.3655, test_loss: 2.0916, test_f1: 0.5919
 epoch: 50, train_loss: 0.3958, test_loss: 1.8012, test_f1: 0.5988
 epoch: 51, train_loss: 0.3253, test_loss: 1.9981, test_f1: 0.5801
 epoch: 52, train_loss: 0.2769, test_loss: 2.0258, test_f1: 0.5862
 epoch: 53, train_loss: 0.2602, test_loss: 2.4430, test_f1: 0.5674
 epoch: 54, train_loss: 0.2736, test_loss: 2.1402, test_f1: 0.5929
 epoch: 55, train_loss: 0.2724, test_loss: 2.2626, test_f1: 0.5937
 epoch: 56, train_loss: 0.2296, test_loss: 2.3001, test_f1: 0.5801
 epoch: 57, train_loss: 0.2316, test_loss: 2.3547, test_f1: 0.6045
 epoch: 58, train_loss: 0.2139, test_loss: 2.3004, test_f1: 0.6068
 epoch: 59, train_loss: 0.2173, test_loss: 2.5152, test_f1: 0.5962
 epoch: 60, train_loss: 0.2237, test_loss: 2.5051, test_f1: 0.6028
 epoch: 61, train_loss: 0.2097, test_loss: 2.5830, test_f1: 0.5988
 epoch: 62, train_loss: 0.2002, test_loss: 2.4750, test_f1: 0.6149
 epoch: 63, train_loss: 0.2093, test_loss: 2.9344, test_f1: 0.5873
 epoch: 64, train_loss: 0.1875, test_loss: 2.7975, test_f1: 0.5952
 epoch: 65, train_loss: 0.2183, test_loss: 2.7455, test_f1: 0.5886
 epoch: 66, train_loss: 0.2507, test_loss: 2.7101, test_f1: 0.5905
 epoch: 67, train_loss: 0.2027, test_loss: 2.7963, test_f1: 0.5882
 epoch: 68, train_loss: 0.2113, test_loss: 2.5374, test_f1: 0.6019
 epoch: 69, train_loss: 0.1770, test_loss: 2.9305, test_f1: 0.5824
 epoch: 70, train_loss: 0.1962, test_loss: 2.8635, test_f1: 0.5766
 epoch: 71, train_loss: 0.1749, test_loss: 3.0625, test_f1: 0.6055
 epoch: 72, train_loss: 0.1883, test_loss: 2.8075, test_f1: 0.5784
 epoch: 73, train_loss: 0.1434, test_loss: 3.0949, test_f1: 0.5922
 epoch: 74, train_loss: 0.1631, test_loss: 3.0654, test_f1: 0.5980
 epoch: 75, train_loss: 0.2022, test_loss: 3.0667, test_f1: 0.5878
 epoch: 76, train_loss: 0.1769, test_loss: 2.8851, test_f1: 0.5867
 epoch: 77, train_loss: 0.1732, test_loss: 2.9718, test_f1: 0.6002
 epoch: 78, train_loss: 0.1446, test_loss: 3.0491, test_f1: 0.5976
 epoch: 79, train_loss: 0.1640, test_loss: 3.4627, test_f1: 0.5719
 epoch: 80, train_loss: 0.1746, test_loss: 3.3206, test_f1: 0.5900
 epoch: 81, train_loss: 0.1630, test_loss: 3.1052, test_f1: 0.5875
 epoch: 82, train_loss: 0.1680, test_loss: 3.2126, test_f1: 0.5811
 epoch: 83, train_loss: 0.1748, test_loss: 3.0828, test_f1: 0.6084
 epoch: 84, train_loss: 0.2022, test_loss: 3.2372, test_f1: 0.5776
 epoch: 85, train_loss: 0.1600, test_loss: 3.2875, test_f1: 0.6025
 epoch: 86, train_loss: 0.1674, test_loss: 3.4806, test_f1: 0.5788
 epoch: 87, train_loss: 0.1604, test_loss: 3.5358, test_f1: 0.5798
 epoch: 88, train_loss: 0.1350, test_loss: 3.5000, test_f1: 0.5891
 epoch: 89, train_loss: 0.1526, test_loss: 3.7289, test_f1: 0.5827
 epoch: 90, train_loss: 0.1428, test_loss: 3.2236, test_f1: 0.5901
 epoch: 91, train_loss: 0.1704, test_loss: 3.2818, test_f1: 0.5974
 epoch: 92, train_loss: 0.1621, test_loss: 3.5343, test_f1: 0.5860
 epoch: 93, train_loss: 0.1279, test_loss: 3.3544, test_f1: 0.6009
 epoch: 94, train_loss: 0.1367, test_loss: 3.2993, test_f1: 0.6128
 epoch: 95, train_loss: 0.1426, test_loss: 3.4764, test_f1: 0.6127
 epoch: 96, train_loss: 0.1274, test_loss: 3.9057, test_f1: 0.5843
 epoch: 97, train_loss: 0.1252, test_loss: 3.9362, test_f1: 0.5979
 epoch: 98, train_loss: 0.1341, test_loss: 3.4965, test_f1: 0.6033
 epoch: 99, train_loss: 0.1152, test_loss: 3.9521, test_f1: 0.5771
##################ITERATION #7 ****************************************
 epoch: 0, train_loss: 1.3684, test_loss: 1.2252, test_f1: 0.4060
 epoch: 1, train_loss: 1.0325, test_loss: 1.0942, test_f1: 0.4856
 epoch: 2, train_loss: 0.9837, test_loss: 1.0939, test_f1: 0.4798
 epoch: 3, train_loss: 0.9547, test_loss: 1.0931, test_f1: 0.4678
 epoch: 4, train_loss: 0.9233, test_loss: 1.0595, test_f1: 0.5631
 epoch: 5, train_loss: 0.8851, test_loss: 1.1278, test_f1: 0.5654
 epoch: 6, train_loss: 0.8679, test_loss: 1.0393, test_f1: 0.5772
 epoch: 7, train_loss: 0.8794, test_loss: 1.1317, test_f1: 0.4863
 epoch: 8, train_loss: 0.8327, test_loss: 1.0711, test_f1: 0.5712
 epoch: 9, train_loss: 0.8036, test_loss: 1.0438, test_f1: 0.5405
 epoch: 10, train_loss: 0.8074, test_loss: 1.0869, test_f1: 0.5547
 epoch: 11, train_loss: 0.8111, test_loss: 1.2177, test_f1: 0.5619
 epoch: 12, train_loss: 0.7625, test_loss: 1.1931, test_f1: 0.5297
 epoch: 13, train_loss: 0.7749, test_loss: 1.1549, test_f1: 0.5970
 epoch: 14, train_loss: 0.7857, test_loss: 1.1392, test_f1: 0.6037
 epoch: 15, train_loss: 0.7546, test_loss: 1.2408, test_f1: 0.6025
 epoch: 16, train_loss: 0.7393, test_loss: 1.3834, test_f1: 0.5381
 epoch: 17, train_loss: 0.7406, test_loss: 1.2432, test_f1: 0.6031
 epoch: 18, train_loss: 0.7058, test_loss: 1.3050, test_f1: 0.5583
 epoch: 19, train_loss: 0.7516, test_loss: 1.2218, test_f1: 0.6305
 epoch: 20, train_loss: 0.6838, test_loss: 1.3206, test_f1: 0.5402
 epoch: 21, train_loss: 0.6618, test_loss: 1.3511, test_f1: 0.5681
 epoch: 22, train_loss: 0.6548, test_loss: 1.3726, test_f1: 0.5930
 epoch: 23, train_loss: 0.6211, test_loss: 1.4488, test_f1: 0.6217
 epoch: 24, train_loss: 0.6177, test_loss: 1.3509, test_f1: 0.5575
 epoch: 25, train_loss: 0.6044, test_loss: 1.3406, test_f1: 0.6232
 epoch: 26, train_loss: 0.5837, test_loss: 1.3027, test_f1: 0.5885
 epoch: 27, train_loss: 0.5937, test_loss: 1.5028, test_f1: 0.5776
 epoch: 28, train_loss: 0.6095, test_loss: 1.2102, test_f1: 0.6144
 epoch: 29, train_loss: 0.5862, test_loss: 1.3722, test_f1: 0.6084
 epoch: 30, train_loss: 0.5790, test_loss: 1.4733, test_f1: 0.5828
 epoch: 31, train_loss: 0.5627, test_loss: 1.2423, test_f1: 0.6025
 epoch: 32, train_loss: 0.5416, test_loss: 1.3092, test_f1: 0.5553
 epoch: 33, train_loss: 0.5211, test_loss: 1.2870, test_f1: 0.5829
 epoch: 34, train_loss: 0.5023, test_loss: 1.4987, test_f1: 0.5898
 epoch: 35, train_loss: 0.5061, test_loss: 1.5528, test_f1: 0.5868
 epoch: 36, train_loss: 0.5079, test_loss: 1.6154, test_f1: 0.5589
 epoch: 37, train_loss: 0.5089, test_loss: 1.5111, test_f1: 0.6086
 epoch: 38, train_loss: 0.4965, test_loss: 1.5722, test_f1: 0.6178
 epoch: 39, train_loss: 0.4953, test_loss: 1.7908, test_f1: 0.5676
 epoch: 40, train_loss: 0.5017, test_loss: 1.5603, test_f1: 0.5802
 epoch: 41, train_loss: 0.5213, test_loss: 1.4570, test_f1: 0.5860
 epoch: 42, train_loss: 0.4833, test_loss: 1.4997, test_f1: 0.5912
 epoch: 43, train_loss: 0.4761, test_loss: 1.5023, test_f1: 0.5973
 epoch: 44, train_loss: 0.4826, test_loss: 1.5069, test_f1: 0.5737
 epoch: 45, train_loss: 0.4601, test_loss: 1.4326, test_f1: 0.6155
 epoch: 46, train_loss: 0.4216, test_loss: 1.4734, test_f1: 0.6157
 epoch: 47, train_loss: 0.4274, test_loss: 1.4995, test_f1: 0.6177
 epoch: 48, train_loss: 0.4341, test_loss: 1.5952, test_f1: 0.6371
 epoch: 49, train_loss: 0.3941, test_loss: 1.6351, test_f1: 0.6259
 epoch: 50, train_loss: 0.4280, test_loss: 2.1243, test_f1: 0.5220
 epoch: 51, train_loss: 0.3756, test_loss: 1.7523, test_f1: 0.5892
 epoch: 52, train_loss: 0.3274, test_loss: 1.6937, test_f1: 0.6019
 epoch: 53, train_loss: 0.3221, test_loss: 1.8953, test_f1: 0.6127
 epoch: 54, train_loss: 0.3242, test_loss: 1.7358, test_f1: 0.6119
 epoch: 55, train_loss: 0.2972, test_loss: 1.8171, test_f1: 0.5970
 epoch: 56, train_loss: 0.2617, test_loss: 1.9195, test_f1: 0.5894
 epoch: 57, train_loss: 0.2892, test_loss: 2.1353, test_f1: 0.5771
 epoch: 58, train_loss: 0.2928, test_loss: 1.9571, test_f1: 0.6082
 epoch: 59, train_loss: 0.2660, test_loss: 2.0411, test_f1: 0.6114
 epoch: 60, train_loss: 0.2884, test_loss: 2.1077, test_f1: 0.5901
 epoch: 61, train_loss: 0.2662, test_loss: 2.0582, test_f1: 0.6036
 epoch: 62, train_loss: 0.2622, test_loss: 2.2999, test_f1: 0.6012
 epoch: 63, train_loss: 0.2694, test_loss: 2.1179, test_f1: 0.6004
 epoch: 64, train_loss: 0.2424, test_loss: 2.1695, test_f1: 0.6148
 epoch: 65, train_loss: 0.2481, test_loss: 2.0501, test_f1: 0.6328
 epoch: 66, train_loss: 0.2692, test_loss: 2.3231, test_f1: 0.5943
 epoch: 67, train_loss: 0.2501, test_loss: 2.3915, test_f1: 0.5825
 epoch: 68, train_loss: 0.2344, test_loss: 2.4226, test_f1: 0.5866
 epoch: 69, train_loss: 0.2782, test_loss: 2.2414, test_f1: 0.6235
 epoch: 70, train_loss: 0.2684, test_loss: 1.9569, test_f1: 0.6203
 epoch: 71, train_loss: 0.2284, test_loss: 2.0883, test_f1: 0.5972
 epoch: 72, train_loss: 0.2540, test_loss: 2.3235, test_f1: 0.6006
 epoch: 73, train_loss: 0.2396, test_loss: 2.3385, test_f1: 0.5830
 epoch: 74, train_loss: 0.2403, test_loss: 2.1473, test_f1: 0.6137
 epoch: 75, train_loss: 0.2355, test_loss: 2.3363, test_f1: 0.5864
 epoch: 76, train_loss: 0.2203, test_loss: 2.0524, test_f1: 0.5948
 epoch: 77, train_loss: 0.2015, test_loss: 2.3297, test_f1: 0.5942
 epoch: 78, train_loss: 0.2188, test_loss: 2.7858, test_f1: 0.5655
 epoch: 79, train_loss: 0.1993, test_loss: 2.3839, test_f1: 0.6089
 epoch: 80, train_loss: 0.2192, test_loss: 2.1590, test_f1: 0.6286
 epoch: 81, train_loss: 0.2112, test_loss: 2.4353, test_f1: 0.5860
 epoch: 82, train_loss: 0.1957, test_loss: 2.4157, test_f1: 0.5912
 epoch: 83, train_loss: 0.2051, test_loss: 2.7875, test_f1: 0.5772
 epoch: 84, train_loss: 0.2406, test_loss: 2.6716, test_f1: 0.5909
 epoch: 85, train_loss: 0.2232, test_loss: 2.7015, test_f1: 0.5813
 epoch: 86, train_loss: 0.1901, test_loss: 2.3943, test_f1: 0.6208
 epoch: 87, train_loss: 0.1688, test_loss: 2.3017, test_f1: 0.6488
 epoch: 88, train_loss: 0.1962, test_loss: 2.5598, test_f1: 0.6322
 epoch: 89, train_loss: 0.1991, test_loss: 2.4882, test_f1: 0.6217
 epoch: 90, train_loss: 0.2148, test_loss: 2.3301, test_f1: 0.6348
 epoch: 91, train_loss: 0.1889, test_loss: 2.6791, test_f1: 0.6338
 epoch: 92, train_loss: 0.2051, test_loss: 2.6993, test_f1: 0.5711
 epoch: 93, train_loss: 0.2065, test_loss: 2.5727, test_f1: 0.6059
 epoch: 94, train_loss: 0.1766, test_loss: 2.5157, test_f1: 0.6246
 epoch: 95, train_loss: 0.1658, test_loss: 2.8854, test_f1: 0.6309
 epoch: 96, train_loss: 0.1620, test_loss: 2.5868, test_f1: 0.6080
 epoch: 97, train_loss: 0.1601, test_loss: 2.5137, test_f1: 0.6184
 epoch: 98, train_loss: 0.1423, test_loss: 2.9180, test_f1: 0.6102
 epoch: 99, train_loss: 0.1586, test_loss: 2.9351, test_f1: 0.6288
##################ITERATION #8 ****************************************
 epoch: 0, train_loss: 1.4022, test_loss: 1.4793, test_f1: 0.2115
 epoch: 1, train_loss: 1.0785, test_loss: 1.2049, test_f1: 0.3668
 epoch: 2, train_loss: 0.9789, test_loss: 1.0686, test_f1: 0.4427
 epoch: 3, train_loss: 0.9539, test_loss: 1.0544, test_f1: 0.5625
 epoch: 4, train_loss: 0.9151, test_loss: 1.0302, test_f1: 0.5715
 epoch: 5, train_loss: 0.8864, test_loss: 1.0963, test_f1: 0.5306
 epoch: 6, train_loss: 0.8761, test_loss: 1.0188, test_f1: 0.5303
 epoch: 7, train_loss: 0.8607, test_loss: 1.0264, test_f1: 0.5584
 epoch: 8, train_loss: 0.8340, test_loss: 1.0454, test_f1: 0.5219
 epoch: 9, train_loss: 0.8194, test_loss: 1.0160, test_f1: 0.5684
 epoch: 10, train_loss: 0.8080, test_loss: 1.0169, test_f1: 0.5961
 epoch: 11, train_loss: 0.7781, test_loss: 1.0784, test_f1: 0.5571
 epoch: 12, train_loss: 0.7540, test_loss: 1.1481, test_f1: 0.5518
 epoch: 13, train_loss: 0.7440, test_loss: 1.0111, test_f1: 0.5636
 epoch: 14, train_loss: 0.7239, test_loss: 1.1969, test_f1: 0.5839
 epoch: 15, train_loss: 0.7396, test_loss: 1.1658, test_f1: 0.5449
 epoch: 16, train_loss: 0.7163, test_loss: 1.1673, test_f1: 0.5517
 epoch: 17, train_loss: 0.6780, test_loss: 1.1342, test_f1: 0.6049
 epoch: 18, train_loss: 0.6837, test_loss: 1.2094, test_f1: 0.5837
 epoch: 19, train_loss: 0.6778, test_loss: 1.2886, test_f1: 0.4934
 epoch: 20, train_loss: 0.6641, test_loss: 1.2059, test_f1: 0.6029
 epoch: 21, train_loss: 0.6517, test_loss: 1.2718, test_f1: 0.5512
 epoch: 22, train_loss: 0.6502, test_loss: 1.2121, test_f1: 0.5849
 epoch: 23, train_loss: 0.6168, test_loss: 1.3304, test_f1: 0.5402
 epoch: 24, train_loss: 0.6433, test_loss: 1.2802, test_f1: 0.5768
 epoch: 25, train_loss: 0.6194, test_loss: 1.5281, test_f1: 0.5375
 epoch: 26, train_loss: 0.6020, test_loss: 1.3019, test_f1: 0.6059
 epoch: 27, train_loss: 0.5970, test_loss: 1.5288, test_f1: 0.5276
 epoch: 28, train_loss: 0.5666, test_loss: 1.2327, test_f1: 0.6126
 epoch: 29, train_loss: 0.5560, test_loss: 1.5964, test_f1: 0.5026
 epoch: 30, train_loss: 0.5267, test_loss: 1.5362, test_f1: 0.5526
 epoch: 31, train_loss: 0.5194, test_loss: 1.3685, test_f1: 0.6045
 epoch: 32, train_loss: 0.5055, test_loss: 1.4621, test_f1: 0.5916
 epoch: 33, train_loss: 0.5434, test_loss: 1.4632, test_f1: 0.6093
 epoch: 34, train_loss: 0.5345, test_loss: 1.4040, test_f1: 0.5976
 epoch: 35, train_loss: 0.5139, test_loss: 1.3697, test_f1: 0.5926
 epoch: 36, train_loss: 0.4656, test_loss: 1.5724, test_f1: 0.5967
 epoch: 37, train_loss: 0.4972, test_loss: 1.5479, test_f1: 0.5788
 epoch: 38, train_loss: 0.4967, test_loss: 1.5903, test_f1: 0.5629
 epoch: 39, train_loss: 0.4569, test_loss: 1.5972, test_f1: 0.5596
 epoch: 40, train_loss: 0.4374, test_loss: 1.8464, test_f1: 0.6243
 epoch: 41, train_loss: 0.4537, test_loss: 1.4833, test_f1: 0.5859
 epoch: 42, train_loss: 0.4810, test_loss: 1.5822, test_f1: 0.6096
 epoch: 43, train_loss: 0.4506, test_loss: 1.5050, test_f1: 0.5809
 epoch: 44, train_loss: 0.4610, test_loss: 1.4835, test_f1: 0.5872
 epoch: 45, train_loss: 0.4344, test_loss: 1.5790, test_f1: 0.5871
 epoch: 46, train_loss: 0.4326, test_loss: 1.6224, test_f1: 0.5693
 epoch: 47, train_loss: 0.4153, test_loss: 1.7984, test_f1: 0.6131
 epoch: 48, train_loss: 0.4111, test_loss: 1.4592, test_f1: 0.6135
 epoch: 49, train_loss: 0.3932, test_loss: 1.9284, test_f1: 0.5504
 epoch: 50, train_loss: 0.4012, test_loss: 1.5673, test_f1: 0.6087
 epoch: 51, train_loss: 0.3677, test_loss: 1.8877, test_f1: 0.5817
 epoch: 52, train_loss: 0.3032, test_loss: 1.8665, test_f1: 0.5896
 epoch: 53, train_loss: 0.3050, test_loss: 1.8654, test_f1: 0.5828
 epoch: 54, train_loss: 0.2894, test_loss: 1.9352, test_f1: 0.5844
 epoch: 55, train_loss: 0.3145, test_loss: 1.8210, test_f1: 0.6133
 epoch: 56, train_loss: 0.2892, test_loss: 1.8505, test_f1: 0.6112
 epoch: 57, train_loss: 0.2644, test_loss: 1.9319, test_f1: 0.5865
 epoch: 58, train_loss: 0.2929, test_loss: 2.0019, test_f1: 0.6230
 epoch: 59, train_loss: 0.2795, test_loss: 1.9756, test_f1: 0.6224
 epoch: 60, train_loss: 0.2493, test_loss: 2.0533, test_f1: 0.6016
 epoch: 61, train_loss: 0.2611, test_loss: 2.0940, test_f1: 0.5905
 epoch: 62, train_loss: 0.2428, test_loss: 2.0847, test_f1: 0.5965
 epoch: 63, train_loss: 0.2363, test_loss: 2.3213, test_f1: 0.5889
 epoch: 64, train_loss: 0.2453, test_loss: 2.2126, test_f1: 0.6054
 epoch: 65, train_loss: 0.2401, test_loss: 2.2140, test_f1: 0.6231
 epoch: 66, train_loss: 0.2422, test_loss: 2.2380, test_f1: 0.6159
 epoch: 67, train_loss: 0.2362, test_loss: 2.2717, test_f1: 0.6098
 epoch: 68, train_loss: 0.2301, test_loss: 2.0846, test_f1: 0.5981
 epoch: 69, train_loss: 0.2271, test_loss: 2.4145, test_f1: 0.5927
 epoch: 70, train_loss: 0.2301, test_loss: 2.4139, test_f1: 0.5747
 epoch: 71, train_loss: 0.2592, test_loss: 2.2318, test_f1: 0.6381
 epoch: 72, train_loss: 0.2401, test_loss: 2.1610, test_f1: 0.6112
 epoch: 73, train_loss: 0.2647, test_loss: 1.9923, test_f1: 0.6128
 epoch: 74, train_loss: 0.2294, test_loss: 2.2362, test_f1: 0.6069
 epoch: 75, train_loss: 0.2119, test_loss: 2.3363, test_f1: 0.5907
 epoch: 76, train_loss: 0.1866, test_loss: 2.4279, test_f1: 0.6060
 epoch: 77, train_loss: 0.1832, test_loss: 2.7243, test_f1: 0.5734
 epoch: 78, train_loss: 0.1970, test_loss: 2.4519, test_f1: 0.5903
 epoch: 79, train_loss: 0.2042, test_loss: 2.6587, test_f1: 0.6298
 epoch: 80, train_loss: 0.1973, test_loss: 2.4305, test_f1: 0.6452
 epoch: 81, train_loss: 0.1904, test_loss: 2.3962, test_f1: 0.6142
 epoch: 82, train_loss: 0.1869, test_loss: 2.3865, test_f1: 0.6207
 epoch: 83, train_loss: 0.2024, test_loss: 2.6004, test_f1: 0.5850
 epoch: 84, train_loss: 0.1851, test_loss: 2.4819, test_f1: 0.6360
 epoch: 85, train_loss: 0.1859, test_loss: 2.3598, test_f1: 0.6129
 epoch: 86, train_loss: 0.2205, test_loss: 2.7122, test_f1: 0.5954
 epoch: 87, train_loss: 0.1839, test_loss: 2.6489, test_f1: 0.6156
 epoch: 88, train_loss: 0.1936, test_loss: 2.5015, test_f1: 0.5872
 epoch: 89, train_loss: 0.1835, test_loss: 2.5511, test_f1: 0.6065
 epoch: 90, train_loss: 0.1689, test_loss: 2.7862, test_f1: 0.5785
 epoch: 91, train_loss: 0.1729, test_loss: 2.5942, test_f1: 0.5911
 epoch: 92, train_loss: 0.2006, test_loss: 2.8256, test_f1: 0.5958
 epoch: 93, train_loss: 0.1860, test_loss: 2.3910, test_f1: 0.6234
 epoch: 94, train_loss: 0.1639, test_loss: 2.7219, test_f1: 0.5937
 epoch: 95, train_loss: 0.1600, test_loss: 2.6813, test_f1: 0.6188
 epoch: 96, train_loss: 0.1622, test_loss: 2.6551, test_f1: 0.5982
 epoch: 97, train_loss: 0.1423, test_loss: 2.6581, test_f1: 0.6138
 epoch: 98, train_loss: 0.1387, test_loss: 2.6849, test_f1: 0.6307
 epoch: 99, train_loss: 0.1627, test_loss: 2.6355, test_f1: 0.6113
##################ITERATION #9 ****************************************
 epoch: 0, train_loss: 1.4659, test_loss: 1.3920, test_f1: 0.1365
 epoch: 1, train_loss: 1.1391, test_loss: 1.1992, test_f1: 0.3383
 epoch: 2, train_loss: 1.0019, test_loss: 1.1083, test_f1: 0.5077
 epoch: 3, train_loss: 0.9504, test_loss: 1.0826, test_f1: 0.5303
 epoch: 4, train_loss: 0.9003, test_loss: 1.0553, test_f1: 0.5525
 epoch: 5, train_loss: 0.8984, test_loss: 1.0772, test_f1: 0.5333
 epoch: 6, train_loss: 0.8912, test_loss: 1.0748, test_f1: 0.5519
 epoch: 7, train_loss: 0.8250, test_loss: 1.1018, test_f1: 0.5896
 epoch: 8, train_loss: 0.8323, test_loss: 0.9949, test_f1: 0.6115
 epoch: 9, train_loss: 0.8141, test_loss: 1.0766, test_f1: 0.5387
 epoch: 10, train_loss: 0.8076, test_loss: 1.0231, test_f1: 0.5650
 epoch: 11, train_loss: 0.7606, test_loss: 1.0621, test_f1: 0.5614
 epoch: 12, train_loss: 0.7655, test_loss: 1.0690, test_f1: 0.5937
 epoch: 13, train_loss: 0.7316, test_loss: 1.0086, test_f1: 0.6080
 epoch: 14, train_loss: 0.7279, test_loss: 1.1326, test_f1: 0.5728
 epoch: 15, train_loss: 0.7089, test_loss: 1.1073, test_f1: 0.5805
 epoch: 16, train_loss: 0.6811, test_loss: 1.0873, test_f1: 0.6363
 epoch: 17, train_loss: 0.6672, test_loss: 1.3878, test_f1: 0.5700
 epoch: 18, train_loss: 0.6309, test_loss: 1.2777, test_f1: 0.5407
 epoch: 19, train_loss: 0.6223, test_loss: 1.3741, test_f1: 0.6131
 epoch: 20, train_loss: 0.6366, test_loss: 1.2966, test_f1: 0.5651
 epoch: 21, train_loss: 0.6024, test_loss: 1.2738, test_f1: 0.6018
 epoch: 22, train_loss: 0.6027, test_loss: 1.1923, test_f1: 0.5944
 epoch: 23, train_loss: 0.5874, test_loss: 1.2650, test_f1: 0.5670
 epoch: 24, train_loss: 0.5407, test_loss: 1.3134, test_f1: 0.6051
 epoch: 25, train_loss: 0.5741, test_loss: 1.5397, test_f1: 0.4606
 epoch: 26, train_loss: 0.5783, test_loss: 1.1773, test_f1: 0.5771
 epoch: 27, train_loss: 0.5923, test_loss: 1.1454, test_f1: 0.5738
 epoch: 28, train_loss: 0.5301, test_loss: 1.2806, test_f1: 0.5849
 epoch: 29, train_loss: 0.5330, test_loss: 1.2965, test_f1: 0.6087
 epoch: 30, train_loss: 0.5044, test_loss: 1.4258, test_f1: 0.5718
 epoch: 31, train_loss: 0.4969, test_loss: 1.4488, test_f1: 0.5982
 epoch: 32, train_loss: 0.4614, test_loss: 1.4527, test_f1: 0.5824
 epoch: 33, train_loss: 0.4866, test_loss: 1.3755, test_f1: 0.6252
 epoch: 34, train_loss: 0.4821, test_loss: 1.4359, test_f1: 0.6058
 epoch: 35, train_loss: 0.4886, test_loss: 1.5288, test_f1: 0.5863
 epoch: 36, train_loss: 0.4599, test_loss: 1.6388, test_f1: 0.5857
 epoch: 37, train_loss: 0.4552, test_loss: 1.5798, test_f1: 0.5374
 epoch: 38, train_loss: 0.4486, test_loss: 1.6384, test_f1: 0.5803
 epoch: 39, train_loss: 0.4624, test_loss: 1.5910, test_f1: 0.5524
 epoch: 40, train_loss: 0.4729, test_loss: 1.9128, test_f1: 0.5588
 epoch: 41, train_loss: 0.4223, test_loss: 1.5144, test_f1: 0.5865
 epoch: 42, train_loss: 0.4023, test_loss: 1.7381, test_f1: 0.6011
 epoch: 43, train_loss: 0.4116, test_loss: 1.5967, test_f1: 0.5798
 epoch: 44, train_loss: 0.4148, test_loss: 1.9446, test_f1: 0.5784
 epoch: 45, train_loss: 0.4666, test_loss: 1.6790, test_f1: 0.5668
 epoch: 46, train_loss: 0.3989, test_loss: 1.9220, test_f1: 0.5554
 epoch: 47, train_loss: 0.3613, test_loss: 1.7946, test_f1: 0.6037
 epoch: 48, train_loss: 0.3563, test_loss: 1.9048, test_f1: 0.5312
 epoch: 49, train_loss: 0.3728, test_loss: 1.9445, test_f1: 0.5341
 epoch: 50, train_loss: 0.3840, test_loss: 1.6594, test_f1: 0.5830
 epoch: 51, train_loss: 0.3188, test_loss: 1.8341, test_f1: 0.5857
 epoch: 52, train_loss: 0.3094, test_loss: 1.8785, test_f1: 0.5909
 epoch: 53, train_loss: 0.2767, test_loss: 2.0742, test_f1: 0.5814
 epoch: 54, train_loss: 0.2680, test_loss: 1.9642, test_f1: 0.5875
 epoch: 55, train_loss: 0.2539, test_loss: 2.0995, test_f1: 0.5917
 epoch: 56, train_loss: 0.2329, test_loss: 2.2196, test_f1: 0.5810
 epoch: 57, train_loss: 0.2561, test_loss: 2.3009, test_f1: 0.6017
 epoch: 58, train_loss: 0.2418, test_loss: 2.2178, test_f1: 0.6004
 epoch: 59, train_loss: 0.2807, test_loss: 2.1278, test_f1: 0.5860
 epoch: 60, train_loss: 0.2562, test_loss: 2.2401, test_f1: 0.5939
 epoch: 61, train_loss: 0.2349, test_loss: 2.2307, test_f1: 0.5664
 epoch: 62, train_loss: 0.2479, test_loss: 2.2127, test_f1: 0.6105
 epoch: 63, train_loss: 0.2343, test_loss: 2.3900, test_f1: 0.5664
 epoch: 64, train_loss: 0.2522, test_loss: 2.2016, test_f1: 0.5991
 epoch: 65, train_loss: 0.2390, test_loss: 2.3239, test_f1: 0.5956
 epoch: 66, train_loss: 0.2221, test_loss: 2.2702, test_f1: 0.6186
 epoch: 67, train_loss: 0.2147, test_loss: 2.3505, test_f1: 0.6287
 epoch: 68, train_loss: 0.1847, test_loss: 2.2441, test_f1: 0.6197
 epoch: 69, train_loss: 0.1823, test_loss: 2.5411, test_f1: 0.5906
 epoch: 70, train_loss: 0.1702, test_loss: 2.4476, test_f1: 0.6037
 epoch: 71, train_loss: 0.2169, test_loss: 2.5834, test_f1: 0.5851
 epoch: 72, train_loss: 0.2123, test_loss: 2.2745, test_f1: 0.6110
 epoch: 73, train_loss: 0.2090, test_loss: 2.6187, test_f1: 0.5723
 epoch: 74, train_loss: 0.2125, test_loss: 2.5181, test_f1: 0.5988
 epoch: 75, train_loss: 0.1656, test_loss: 2.6643, test_f1: 0.6083
 epoch: 76, train_loss: 0.1602, test_loss: 2.6861, test_f1: 0.6317
 epoch: 77, train_loss: 0.1968, test_loss: 2.8381, test_f1: 0.5603
 epoch: 78, train_loss: 0.1645, test_loss: 2.6078, test_f1: 0.6272
 epoch: 79, train_loss: 0.1782, test_loss: 2.6585, test_f1: 0.5803
 epoch: 80, train_loss: 0.1487, test_loss: 2.6677, test_f1: 0.6048
 epoch: 81, train_loss: 0.1848, test_loss: 2.6734, test_f1: 0.6131
 epoch: 82, train_loss: 0.1753, test_loss: 2.8555, test_f1: 0.5826
 epoch: 83, train_loss: 0.1865, test_loss: 2.6536, test_f1: 0.6057
 epoch: 84, train_loss: 0.2110, test_loss: 2.6107, test_f1: 0.5697
 epoch: 85, train_loss: 0.1901, test_loss: 2.7307, test_f1: 0.6031
 epoch: 86, train_loss: 0.1689, test_loss: 2.7703, test_f1: 0.5938
 epoch: 87, train_loss: 0.1798, test_loss: 2.7765, test_f1: 0.6041
 epoch: 88, train_loss: 0.1830, test_loss: 2.8617, test_f1: 0.6079
 epoch: 89, train_loss: 0.1642, test_loss: 2.8656, test_f1: 0.5829
 epoch: 90, train_loss: 0.1713, test_loss: 2.8817, test_f1: 0.5758
 epoch: 91, train_loss: 0.1649, test_loss: 2.8636, test_f1: 0.5580
 epoch: 92, train_loss: 0.1706, test_loss: 2.9831, test_f1: 0.5818
 epoch: 93, train_loss: 0.1808, test_loss: 2.7672, test_f1: 0.5762
 epoch: 94, train_loss: 0.1504, test_loss: 2.8569, test_f1: 0.5606
 epoch: 95, train_loss: 0.1504, test_loss: 2.9913, test_f1: 0.5519
 epoch: 96, train_loss: 0.1556, test_loss: 3.1932, test_f1: 0.6127
 epoch: 97, train_loss: 0.1317, test_loss: 2.9933, test_f1: 0.5785
 epoch: 98, train_loss: 0.1292, test_loss: 2.8392, test_f1: 0.5939
 epoch: 99, train_loss: 0.1567, test_loss: 2.8649, test_f1: 0.5954

Training completed in 638.37 seconds
Best F1: 0.6531 at epoch 38
Mean F1 across iterations: 0.6406  0.0091
========================FINAL RESULTS================================
FEGIN weighted F1: 0.6531  0.0091
python main.py --data ltspice_demos --representation component_net --model FEGIN --layers 4 --hiddens 128 --batch_size 64 --lr 0.001 --emb_size 128 --epochs 100 --save_appendix component_net_L4_H128_BS64_LR0.001_E128 --no_val
-----



STDERR:
Processing...
Done!
  File "main.py", line 370, in <module>
    main()
  File "main.py", line 254, in main
    dataset = dataset_class(
  File "/home/philip/projects/ltspice_examples_code_repo/Circuit-Completion-Using-GNNs/component_classification_with_link_prediction_head/evaluation/FEGIN/kernel/circuit_datasets.py", line 15, in __init__
    self.data, self.slices = torch.load(self.processed_paths[0])
  File "/home/philip/.local/lib/python3.8/site-packages/torch/serialization.py", line 1040, in load
    warnings.warn(
  File "/usr/lib/python3.8/warnings.py", line 109, in _showwarnmsg
    sw(msg.message, msg.category, msg.filename, msg.lineno,
  File "main.py", line 47, in warn_with_traceback
    traceback.print_stack(file=log)
/home/philip/projects/ltspice_examples_code_repo/Circuit-Completion-Using-GNNs/component_classification_with_link_prediction_head/evaluation/FEGIN/kernel/circuit_datasets.py:15: FutureWarning: You are using `torch.load` with `weights_only=False` (the current default value), which uses the default pickle module implicitly. It is possible to construct malicious pickle data which will execute arbitrary code during unpickling (See https://github.com/pytorch/pytorch/blob/main/SECURITY.md#untrusted-models for more details). In a future release, the default value for `weights_only` will be flipped to `True`. This limits the functions that could be executed during unpickling. Arbitrary objects will no longer be allowed to be loaded via this mode unless they are explicitly allowlisted by the user via `torch.serialization.add_safe_globals`. We recommend you start setting `weights_only=True` for any use case where you don't have full control of the loaded file. Please open an issue on GitHub for any issues related to this experimental feature.
  self.data, self.slices = torch.load(self.processed_paths[0])
