STDOUT:
Results will be saved in /home/philip/projects/ltspice_examples_code_repo/Circuit-Completion-Using-GNNs/component_classification_with_link_prediction_head/evaluation/FEGIN/results/model_FEGIN_dataset_ltspice_examples
Command line input: python main.py --data ltspice_examples --representation component_net --model FEGIN --layers 6 --hiddens 128 --batch_size 256 --lr 0.0001 --emb_size 512 --epochs 100 --save_appendix component_net_L6_H128_BS256_LR0.0001_E512 --no_val
 is saved.
-----
ltspice_examples - FEGIN
Using 6 layers, 128 hidden units, h = 2
Loading component_net representation dataset
ENTERED
Training FEGIN on component_net representation
Train: 3558, Test: 846
##################ITERATION #0 ****************************************
 epoch: 0, train_loss: 1.3540, test_loss: 1.3630, test_f1: 0.2270
 epoch: 1, train_loss: 1.3328, test_loss: 1.3572, test_f1: 0.2270
 epoch: 2, train_loss: 1.3174, test_loss: 1.3425, test_f1: 0.2270
 epoch: 3, train_loss: 1.2980, test_loss: 1.3191, test_f1: 0.2270
 epoch: 4, train_loss: 1.2746, test_loss: 1.2847, test_f1: 0.2734
 epoch: 5, train_loss: 1.2496, test_loss: 1.2446, test_f1: 0.3094
 epoch: 6, train_loss: 1.2216, test_loss: 1.2080, test_f1: 0.3250
 epoch: 7, train_loss: 1.1959, test_loss: 1.1773, test_f1: 0.3390
 epoch: 8, train_loss: 1.1630, test_loss: 1.1445, test_f1: 0.3734
 epoch: 9, train_loss: 1.1388, test_loss: 1.1161, test_f1: 0.4040
 epoch: 10, train_loss: 1.1152, test_loss: 1.0891, test_f1: 0.4187
 epoch: 11, train_loss: 1.0908, test_loss: 1.0650, test_f1: 0.4536
 epoch: 12, train_loss: 1.0675, test_loss: 1.0427, test_f1: 0.4781
 epoch: 13, train_loss: 1.0429, test_loss: 1.0263, test_f1: 0.5043
 epoch: 14, train_loss: 1.0196, test_loss: 0.9957, test_f1: 0.5192
 epoch: 15, train_loss: 0.9951, test_loss: 0.9596, test_f1: 0.5280
 epoch: 16, train_loss: 0.9663, test_loss: 0.9444, test_f1: 0.5100
 epoch: 17, train_loss: 0.9466, test_loss: 0.9266, test_f1: 0.5263
 epoch: 18, train_loss: 0.9229, test_loss: 0.9057, test_f1: 0.5357
 epoch: 19, train_loss: 0.9042, test_loss: 0.8977, test_f1: 0.5328
 epoch: 20, train_loss: 0.8811, test_loss: 0.8864, test_f1: 0.5440
 epoch: 21, train_loss: 0.8707, test_loss: 0.9023, test_f1: 0.5180
 epoch: 22, train_loss: 0.8390, test_loss: 0.8792, test_f1: 0.5260
 epoch: 23, train_loss: 0.8336, test_loss: 0.9211, test_f1: 0.5166
 epoch: 24, train_loss: 0.8197, test_loss: 0.8940, test_f1: 0.5175
 epoch: 25, train_loss: 0.8174, test_loss: 0.8851, test_f1: 0.5545
 epoch: 26, train_loss: 0.8119, test_loss: 0.8805, test_f1: 0.5401
 epoch: 27, train_loss: 0.8106, test_loss: 0.8885, test_f1: 0.5262
 epoch: 28, train_loss: 0.7973, test_loss: 0.8648, test_f1: 0.5381
 epoch: 29, train_loss: 0.7791, test_loss: 0.8762, test_f1: 0.5358
 epoch: 30, train_loss: 0.7691, test_loss: 0.9244, test_f1: 0.5362
 epoch: 31, train_loss: 0.7581, test_loss: 0.8850, test_f1: 0.5447
 epoch: 32, train_loss: 0.7487, test_loss: 0.8735, test_f1: 0.5569
 epoch: 33, train_loss: 0.7510, test_loss: 0.9018, test_f1: 0.5338
 epoch: 34, train_loss: 0.7433, test_loss: 0.9022, test_f1: 0.5187
 epoch: 35, train_loss: 0.7467, test_loss: 0.9573, test_f1: 0.5123
 epoch: 36, train_loss: 0.7312, test_loss: 0.8925, test_f1: 0.5474
 epoch: 37, train_loss: 0.7200, test_loss: 0.9135, test_f1: 0.5404
 epoch: 38, train_loss: 0.7081, test_loss: 0.8798, test_f1: 0.5425
 epoch: 39, train_loss: 0.7092, test_loss: 0.8986, test_f1: 0.5242
 epoch: 40, train_loss: 0.7141, test_loss: 0.9167, test_f1: 0.5223
 epoch: 41, train_loss: 0.6995, test_loss: 0.8990, test_f1: 0.5645
 epoch: 42, train_loss: 0.6888, test_loss: 0.8991, test_f1: 0.5580
 epoch: 43, train_loss: 0.6871, test_loss: 0.9061, test_f1: 0.5686
 epoch: 44, train_loss: 0.6833, test_loss: 0.9057, test_f1: 0.5384
 epoch: 45, train_loss: 0.6698, test_loss: 0.8934, test_f1: 0.5424
 epoch: 46, train_loss: 0.6750, test_loss: 0.8962, test_f1: 0.5564
 epoch: 47, train_loss: 0.6632, test_loss: 0.9100, test_f1: 0.5529
 epoch: 48, train_loss: 0.6684, test_loss: 0.9080, test_f1: 0.5692
 epoch: 49, train_loss: 0.6607, test_loss: 0.9013, test_f1: 0.5568
 epoch: 50, train_loss: 0.6543, test_loss: 0.9159, test_f1: 0.5793
 epoch: 51, train_loss: 0.6381, test_loss: 0.8870, test_f1: 0.5924
 epoch: 52, train_loss: 0.6295, test_loss: 0.8858, test_f1: 0.5815
 epoch: 53, train_loss: 0.6310, test_loss: 0.8994, test_f1: 0.5799
 epoch: 54, train_loss: 0.6177, test_loss: 0.9131, test_f1: 0.5892
 epoch: 55, train_loss: 0.6233, test_loss: 0.9237, test_f1: 0.5821
 epoch: 56, train_loss: 0.6204, test_loss: 0.9130, test_f1: 0.5749
 epoch: 57, train_loss: 0.6088, test_loss: 0.9132, test_f1: 0.5684
 epoch: 58, train_loss: 0.6102, test_loss: 0.9319, test_f1: 0.5879
 epoch: 59, train_loss: 0.6057, test_loss: 0.9285, test_f1: 0.5657
 epoch: 60, train_loss: 0.6008, test_loss: 0.9478, test_f1: 0.5719
 epoch: 61, train_loss: 0.6075, test_loss: 0.9266, test_f1: 0.5801
 epoch: 62, train_loss: 0.5996, test_loss: 0.9392, test_f1: 0.5780
 epoch: 63, train_loss: 0.5948, test_loss: 0.9396, test_f1: 0.5605
 epoch: 64, train_loss: 0.5959, test_loss: 0.9290, test_f1: 0.5840
 epoch: 65, train_loss: 0.5888, test_loss: 0.9161, test_f1: 0.5775
 epoch: 66, train_loss: 0.5963, test_loss: 0.9421, test_f1: 0.5715
 epoch: 67, train_loss: 0.5929, test_loss: 0.9565, test_f1: 0.5573
 epoch: 68, train_loss: 0.5793, test_loss: 0.9477, test_f1: 0.5768
 epoch: 69, train_loss: 0.5769, test_loss: 0.9454, test_f1: 0.5830
 epoch: 70, train_loss: 0.5747, test_loss: 0.9242, test_f1: 0.6001
 epoch: 71, train_loss: 0.5744, test_loss: 0.9429, test_f1: 0.6019
 epoch: 72, train_loss: 0.5702, test_loss: 0.9358, test_f1: 0.5900
 epoch: 73, train_loss: 0.5692, test_loss: 0.9846, test_f1: 0.5972
 epoch: 74, train_loss: 0.5710, test_loss: 0.9524, test_f1: 0.5949
 epoch: 75, train_loss: 0.5675, test_loss: 0.9522, test_f1: 0.6058
 epoch: 76, train_loss: 0.5620, test_loss: 0.9754, test_f1: 0.6024
 epoch: 77, train_loss: 0.5616, test_loss: 0.9649, test_f1: 0.5926
 epoch: 78, train_loss: 0.5442, test_loss: 0.9629, test_f1: 0.5909
 epoch: 79, train_loss: 0.5563, test_loss: 1.0060, test_f1: 0.5901
 epoch: 80, train_loss: 0.5594, test_loss: 0.9936, test_f1: 0.6010
 epoch: 81, train_loss: 0.5442, test_loss: 1.0044, test_f1: 0.5902
 epoch: 82, train_loss: 0.5408, test_loss: 0.9621, test_f1: 0.6009
 epoch: 83, train_loss: 0.5488, test_loss: 0.9877, test_f1: 0.6025
 epoch: 84, train_loss: 0.5398, test_loss: 0.9820, test_f1: 0.5984
 epoch: 85, train_loss: 0.5389, test_loss: 0.9824, test_f1: 0.6129
 epoch: 86, train_loss: 0.5368, test_loss: 0.9917, test_f1: 0.5927
 epoch: 87, train_loss: 0.5300, test_loss: 1.0265, test_f1: 0.6073
 epoch: 88, train_loss: 0.5384, test_loss: 0.9990, test_f1: 0.5936
 epoch: 89, train_loss: 0.5347, test_loss: 1.0110, test_f1: 0.5981
 epoch: 90, train_loss: 0.5281, test_loss: 1.0003, test_f1: 0.6124
 epoch: 91, train_loss: 0.5240, test_loss: 0.9729, test_f1: 0.6149
 epoch: 92, train_loss: 0.5339, test_loss: 0.9952, test_f1: 0.6233
 epoch: 93, train_loss: 0.5110, test_loss: 0.9820, test_f1: 0.6272
 epoch: 94, train_loss: 0.5421, test_loss: 1.0262, test_f1: 0.5957
 epoch: 95, train_loss: 0.5257, test_loss: 1.0134, test_f1: 0.5969
 epoch: 96, train_loss: 0.5074, test_loss: 1.0477, test_f1: 0.6142
 epoch: 97, train_loss: 0.5198, test_loss: 1.0615, test_f1: 0.6026
 epoch: 98, train_loss: 0.5018, test_loss: 1.0410, test_f1: 0.5933
 epoch: 99, train_loss: 0.5095, test_loss: 1.0779, test_f1: 0.5728
##################ITERATION #1 ****************************************
 epoch: 0, train_loss: 1.3107, test_loss: 1.3482, test_f1: 0.2270
 epoch: 1, train_loss: 1.2592, test_loss: 1.3241, test_f1: 0.2270
 epoch: 2, train_loss: 1.2293, test_loss: 1.2845, test_f1: 0.2270
 epoch: 3, train_loss: 1.1984, test_loss: 1.2418, test_f1: 0.2814
 epoch: 4, train_loss: 1.1702, test_loss: 1.1778, test_f1: 0.3794
 epoch: 5, train_loss: 1.1404, test_loss: 1.1227, test_f1: 0.4219
 epoch: 6, train_loss: 1.1111, test_loss: 1.0763, test_f1: 0.4674
 epoch: 7, train_loss: 1.0857, test_loss: 1.0402, test_f1: 0.4870
 epoch: 8, train_loss: 1.0594, test_loss: 1.0142, test_f1: 0.5086
 epoch: 9, train_loss: 1.0349, test_loss: 0.9904, test_f1: 0.5340
 epoch: 10, train_loss: 1.0129, test_loss: 0.9663, test_f1: 0.5471
 epoch: 11, train_loss: 0.9845, test_loss: 0.9424, test_f1: 0.5449
 epoch: 12, train_loss: 0.9552, test_loss: 0.9365, test_f1: 0.5536
 epoch: 13, train_loss: 0.9433, test_loss: 0.9140, test_f1: 0.5557
 epoch: 14, train_loss: 0.9159, test_loss: 0.9124, test_f1: 0.5276
 epoch: 15, train_loss: 0.9025, test_loss: 0.8980, test_f1: 0.5603
 epoch: 16, train_loss: 0.8836, test_loss: 0.9138, test_f1: 0.5205
 epoch: 17, train_loss: 0.8728, test_loss: 0.9093, test_f1: 0.5567
 epoch: 18, train_loss: 0.8580, test_loss: 0.8665, test_f1: 0.5595
 epoch: 19, train_loss: 0.8503, test_loss: 0.8967, test_f1: 0.5460
 epoch: 20, train_loss: 0.8353, test_loss: 0.9173, test_f1: 0.5525
 epoch: 21, train_loss: 0.8245, test_loss: 0.9008, test_f1: 0.5692
 epoch: 22, train_loss: 0.8184, test_loss: 0.9187, test_f1: 0.5584
 epoch: 23, train_loss: 0.8057, test_loss: 0.9025, test_f1: 0.5649
 epoch: 24, train_loss: 0.7897, test_loss: 0.9025, test_f1: 0.5575
 epoch: 25, train_loss: 0.7919, test_loss: 0.9136, test_f1: 0.5636
 epoch: 26, train_loss: 0.7879, test_loss: 0.9032, test_f1: 0.5778
 epoch: 27, train_loss: 0.7713, test_loss: 0.9238, test_f1: 0.5609
 epoch: 28, train_loss: 0.7540, test_loss: 0.9171, test_f1: 0.5621
 epoch: 29, train_loss: 0.7526, test_loss: 0.9200, test_f1: 0.5604
 epoch: 30, train_loss: 0.7597, test_loss: 0.9272, test_f1: 0.5699
 epoch: 31, train_loss: 0.7340, test_loss: 0.9090, test_f1: 0.5841
 epoch: 32, train_loss: 0.7367, test_loss: 0.9370, test_f1: 0.5576
 epoch: 33, train_loss: 0.7200, test_loss: 0.9255, test_f1: 0.5732
 epoch: 34, train_loss: 0.7117, test_loss: 0.9206, test_f1: 0.5788
 epoch: 35, train_loss: 0.7067, test_loss: 0.9178, test_f1: 0.5883
 epoch: 36, train_loss: 0.7088, test_loss: 0.9454, test_f1: 0.5808
 epoch: 37, train_loss: 0.6894, test_loss: 0.9272, test_f1: 0.5842
 epoch: 38, train_loss: 0.6969, test_loss: 0.9314, test_f1: 0.5828
 epoch: 39, train_loss: 0.6940, test_loss: 0.9448, test_f1: 0.5789
 epoch: 40, train_loss: 0.6767, test_loss: 0.9341, test_f1: 0.5959
 epoch: 41, train_loss: 0.6658, test_loss: 0.9684, test_f1: 0.5900
 epoch: 42, train_loss: 0.6605, test_loss: 0.9304, test_f1: 0.5838
 epoch: 43, train_loss: 0.6667, test_loss: 0.9515, test_f1: 0.5910
 epoch: 44, train_loss: 0.6703, test_loss: 0.9513, test_f1: 0.5968
 epoch: 45, train_loss: 0.6534, test_loss: 0.9603, test_f1: 0.5901
 epoch: 46, train_loss: 0.6441, test_loss: 0.9389, test_f1: 0.6194
 epoch: 47, train_loss: 0.6425, test_loss: 0.9635, test_f1: 0.6103
 epoch: 48, train_loss: 0.6389, test_loss: 0.9837, test_f1: 0.5975
 epoch: 49, train_loss: 0.6309, test_loss: 0.9198, test_f1: 0.6058
 epoch: 50, train_loss: 0.6320, test_loss: 1.0367, test_f1: 0.5903
 epoch: 51, train_loss: 0.6160, test_loss: 0.9960, test_f1: 0.5926
 epoch: 52, train_loss: 0.5955, test_loss: 0.9631, test_f1: 0.5912
 epoch: 53, train_loss: 0.6016, test_loss: 0.9742, test_f1: 0.5811
 epoch: 54, train_loss: 0.5990, test_loss: 0.9623, test_f1: 0.5912
 epoch: 55, train_loss: 0.5883, test_loss: 0.9779, test_f1: 0.5935
 epoch: 56, train_loss: 0.5862, test_loss: 0.9758, test_f1: 0.5965
 epoch: 57, train_loss: 0.5864, test_loss: 1.0017, test_f1: 0.5949
 epoch: 58, train_loss: 0.5833, test_loss: 0.9928, test_f1: 0.5907
 epoch: 59, train_loss: 0.5720, test_loss: 0.9925, test_f1: 0.5999
 epoch: 60, train_loss: 0.5793, test_loss: 0.9904, test_f1: 0.5990
 epoch: 61, train_loss: 0.5689, test_loss: 0.9942, test_f1: 0.6106
 epoch: 62, train_loss: 0.5727, test_loss: 1.0378, test_f1: 0.5937
 epoch: 63, train_loss: 0.5657, test_loss: 1.0356, test_f1: 0.6168
 epoch: 64, train_loss: 0.5545, test_loss: 1.0230, test_f1: 0.6085
 epoch: 65, train_loss: 0.5617, test_loss: 1.0337, test_f1: 0.6123
 epoch: 66, train_loss: 0.5484, test_loss: 1.0432, test_f1: 0.6056
 epoch: 67, train_loss: 0.5464, test_loss: 1.0419, test_f1: 0.6063
 epoch: 68, train_loss: 0.5441, test_loss: 1.0286, test_f1: 0.5986
 epoch: 69, train_loss: 0.5338, test_loss: 1.0320, test_f1: 0.6036
 epoch: 70, train_loss: 0.5385, test_loss: 1.0301, test_f1: 0.6055
 epoch: 71, train_loss: 0.5328, test_loss: 1.0469, test_f1: 0.6087
 epoch: 72, train_loss: 0.5465, test_loss: 1.0421, test_f1: 0.6164
 epoch: 73, train_loss: 0.5460, test_loss: 1.0622, test_f1: 0.6067
 epoch: 74, train_loss: 0.5357, test_loss: 1.0615, test_f1: 0.6152
 epoch: 75, train_loss: 0.5255, test_loss: 1.0414, test_f1: 0.6199
 epoch: 76, train_loss: 0.5319, test_loss: 1.0169, test_f1: 0.6242
 epoch: 77, train_loss: 0.5229, test_loss: 1.0469, test_f1: 0.6251
 epoch: 78, train_loss: 0.5266, test_loss: 1.0832, test_f1: 0.6208
 epoch: 79, train_loss: 0.5139, test_loss: 1.0471, test_f1: 0.6239
 epoch: 80, train_loss: 0.5233, test_loss: 1.0322, test_f1: 0.6282
 epoch: 81, train_loss: 0.5134, test_loss: 1.0603, test_f1: 0.6213
 epoch: 82, train_loss: 0.5114, test_loss: 1.0561, test_f1: 0.6136
 epoch: 83, train_loss: 0.5073, test_loss: 1.1030, test_f1: 0.6223
 epoch: 84, train_loss: 0.5107, test_loss: 1.0673, test_f1: 0.6282
 epoch: 85, train_loss: 0.5040, test_loss: 1.0589, test_f1: 0.6280
 epoch: 86, train_loss: 0.4942, test_loss: 1.0662, test_f1: 0.6221
 epoch: 87, train_loss: 0.4942, test_loss: 1.0815, test_f1: 0.6281
 epoch: 88, train_loss: 0.5027, test_loss: 1.0907, test_f1: 0.6223
 epoch: 89, train_loss: 0.4924, test_loss: 1.1106, test_f1: 0.6124
 epoch: 90, train_loss: 0.4886, test_loss: 1.0828, test_f1: 0.6173
 epoch: 91, train_loss: 0.5065, test_loss: 1.1011, test_f1: 0.6294
 epoch: 92, train_loss: 0.4826, test_loss: 1.0793, test_f1: 0.6345
 epoch: 93, train_loss: 0.4610, test_loss: 1.0889, test_f1: 0.6285
 epoch: 94, train_loss: 0.4692, test_loss: 1.0726, test_f1: 0.6289
 epoch: 95, train_loss: 0.4772, test_loss: 1.1123, test_f1: 0.6198
 epoch: 96, train_loss: 0.4628, test_loss: 1.1410, test_f1: 0.6367
 epoch: 97, train_loss: 0.4579, test_loss: 1.1281, test_f1: 0.6233
 epoch: 98, train_loss: 0.4671, test_loss: 1.1126, test_f1: 0.6261
 epoch: 99, train_loss: 0.4521, test_loss: 1.1082, test_f1: 0.6276
##################ITERATION #2 ****************************************
 epoch: 0, train_loss: 1.2568, test_loss: 1.3386, test_f1: 0.2270
 epoch: 1, train_loss: 1.1751, test_loss: 1.3230, test_f1: 0.2270
 epoch: 2, train_loss: 1.1420, test_loss: 1.2664, test_f1: 0.3398
 epoch: 3, train_loss: 1.1020, test_loss: 1.1711, test_f1: 0.4111
 epoch: 4, train_loss: 1.0736, test_loss: 1.0901, test_f1: 0.4426
 epoch: 5, train_loss: 1.0441, test_loss: 1.0444, test_f1: 0.4653
 epoch: 6, train_loss: 1.0217, test_loss: 0.9966, test_f1: 0.4809
 epoch: 7, train_loss: 0.9946, test_loss: 0.9649, test_f1: 0.4939
 epoch: 8, train_loss: 0.9706, test_loss: 0.9500, test_f1: 0.5075
 epoch: 9, train_loss: 0.9492, test_loss: 0.9440, test_f1: 0.4848
 epoch: 10, train_loss: 0.9254, test_loss: 0.9239, test_f1: 0.5054
 epoch: 11, train_loss: 0.9060, test_loss: 0.9199, test_f1: 0.5237
 epoch: 12, train_loss: 0.8927, test_loss: 0.9037, test_f1: 0.5105
 epoch: 13, train_loss: 0.8768, test_loss: 0.9106, test_f1: 0.5358
 epoch: 14, train_loss: 0.8504, test_loss: 0.9002, test_f1: 0.5402
 epoch: 15, train_loss: 0.8518, test_loss: 0.8940, test_f1: 0.5404
 epoch: 16, train_loss: 0.8317, test_loss: 0.8917, test_f1: 0.5672
 epoch: 17, train_loss: 0.8249, test_loss: 0.9248, test_f1: 0.5477
 epoch: 18, train_loss: 0.8160, test_loss: 0.9009, test_f1: 0.5459
 epoch: 19, train_loss: 0.8017, test_loss: 0.9153, test_f1: 0.5493
 epoch: 20, train_loss: 0.7980, test_loss: 0.8830, test_f1: 0.5655
 epoch: 21, train_loss: 0.7868, test_loss: 0.8913, test_f1: 0.5642
 epoch: 22, train_loss: 0.7766, test_loss: 0.9061, test_f1: 0.5720
 epoch: 23, train_loss: 0.7742, test_loss: 0.9424, test_f1: 0.5484
 epoch: 24, train_loss: 0.7605, test_loss: 0.9395, test_f1: 0.5558
 epoch: 25, train_loss: 0.7455, test_loss: 0.9296, test_f1: 0.5328
 epoch: 26, train_loss: 0.7374, test_loss: 0.9008, test_f1: 0.5685
 epoch: 27, train_loss: 0.7304, test_loss: 0.9112, test_f1: 0.5853
 epoch: 28, train_loss: 0.7170, test_loss: 0.9167, test_f1: 0.5770
 epoch: 29, train_loss: 0.7185, test_loss: 0.9368, test_f1: 0.5764
 epoch: 30, train_loss: 0.7055, test_loss: 0.9522, test_f1: 0.5688
 epoch: 31, train_loss: 0.6982, test_loss: 0.8723, test_f1: 0.5850
 epoch: 32, train_loss: 0.6842, test_loss: 0.8967, test_f1: 0.5923
 epoch: 33, train_loss: 0.6801, test_loss: 0.8988, test_f1: 0.5939
 epoch: 34, train_loss: 0.6834, test_loss: 0.9068, test_f1: 0.5683
 epoch: 35, train_loss: 0.6533, test_loss: 0.9339, test_f1: 0.5895
 epoch: 36, train_loss: 0.6697, test_loss: 0.9370, test_f1: 0.5953
 epoch: 37, train_loss: 0.6639, test_loss: 0.9321, test_f1: 0.5943
 epoch: 38, train_loss: 0.6558, test_loss: 0.9132, test_f1: 0.5934
 epoch: 39, train_loss: 0.6518, test_loss: 0.9053, test_f1: 0.5913
 epoch: 40, train_loss: 0.6389, test_loss: 0.9048, test_f1: 0.5941
 epoch: 41, train_loss: 0.6487, test_loss: 0.9814, test_f1: 0.5835
 epoch: 42, train_loss: 0.6398, test_loss: 1.0282, test_f1: 0.6055
 epoch: 43, train_loss: 0.6423, test_loss: 0.9117, test_f1: 0.6019
 epoch: 44, train_loss: 0.6546, test_loss: 1.0005, test_f1: 0.5875
 epoch: 45, train_loss: 0.6411, test_loss: 0.9376, test_f1: 0.5891
 epoch: 46, train_loss: 0.6245, test_loss: 0.9230, test_f1: 0.6090
 epoch: 47, train_loss: 0.6127, test_loss: 0.9267, test_f1: 0.5961
 epoch: 48, train_loss: 0.5887, test_loss: 0.9681, test_f1: 0.6007
 epoch: 49, train_loss: 0.5910, test_loss: 0.9028, test_f1: 0.5976
 epoch: 50, train_loss: 0.5891, test_loss: 0.9729, test_f1: 0.5920
 epoch: 51, train_loss: 0.5803, test_loss: 0.9853, test_f1: 0.5996
 epoch: 52, train_loss: 0.5709, test_loss: 0.9652, test_f1: 0.6038
 epoch: 53, train_loss: 0.5503, test_loss: 0.9793, test_f1: 0.6099
 epoch: 54, train_loss: 0.5584, test_loss: 0.9748, test_f1: 0.6003
 epoch: 55, train_loss: 0.5562, test_loss: 0.9877, test_f1: 0.6049
 epoch: 56, train_loss: 0.5508, test_loss: 0.9862, test_f1: 0.6129
 epoch: 57, train_loss: 0.5598, test_loss: 0.9951, test_f1: 0.6100
 epoch: 58, train_loss: 0.5495, test_loss: 1.0010, test_f1: 0.6098
 epoch: 59, train_loss: 0.5414, test_loss: 0.9869, test_f1: 0.6115
 epoch: 60, train_loss: 0.5433, test_loss: 0.9887, test_f1: 0.6121
 epoch: 61, train_loss: 0.5471, test_loss: 0.9752, test_f1: 0.6006
 epoch: 62, train_loss: 0.5330, test_loss: 1.0366, test_f1: 0.6054
 epoch: 63, train_loss: 0.5312, test_loss: 0.9862, test_f1: 0.6076
 epoch: 64, train_loss: 0.5294, test_loss: 1.0422, test_f1: 0.6143
 epoch: 65, train_loss: 0.5254, test_loss: 0.9811, test_f1: 0.6101
 epoch: 66, train_loss: 0.5236, test_loss: 0.9906, test_f1: 0.6114
 epoch: 67, train_loss: 0.5168, test_loss: 1.0546, test_f1: 0.6171
 epoch: 68, train_loss: 0.5127, test_loss: 0.9830, test_f1: 0.6274
 epoch: 69, train_loss: 0.5090, test_loss: 1.0028, test_f1: 0.6217
 epoch: 70, train_loss: 0.5234, test_loss: 1.0030, test_f1: 0.6116
 epoch: 71, train_loss: 0.5138, test_loss: 1.0203, test_f1: 0.6064
 epoch: 72, train_loss: 0.5010, test_loss: 1.0396, test_f1: 0.6102
 epoch: 73, train_loss: 0.5083, test_loss: 1.0375, test_f1: 0.6172
 epoch: 74, train_loss: 0.4900, test_loss: 1.0775, test_f1: 0.6025
 epoch: 75, train_loss: 0.4925, test_loss: 1.0257, test_f1: 0.6141
 epoch: 76, train_loss: 0.4950, test_loss: 1.0231, test_f1: 0.6197
 epoch: 77, train_loss: 0.4927, test_loss: 1.0408, test_f1: 0.6230
 epoch: 78, train_loss: 0.4931, test_loss: 1.0739, test_f1: 0.6032
 epoch: 79, train_loss: 0.4907, test_loss: 1.1575, test_f1: 0.5956
 epoch: 80, train_loss: 0.4832, test_loss: 1.0855, test_f1: 0.6120
 epoch: 81, train_loss: 0.4832, test_loss: 1.0439, test_f1: 0.6190
 epoch: 82, train_loss: 0.4718, test_loss: 1.0794, test_f1: 0.6262
 epoch: 83, train_loss: 0.4769, test_loss: 1.0427, test_f1: 0.6250
 epoch: 84, train_loss: 0.4544, test_loss: 1.1037, test_f1: 0.6123
 epoch: 85, train_loss: 0.4770, test_loss: 1.0275, test_f1: 0.6112
 epoch: 86, train_loss: 0.4685, test_loss: 1.0765, test_f1: 0.6221
 epoch: 87, train_loss: 0.4691, test_loss: 1.0722, test_f1: 0.6295
 epoch: 88, train_loss: 0.4789, test_loss: 1.0718, test_f1: 0.6286
 epoch: 89, train_loss: 0.4663, test_loss: 1.1151, test_f1: 0.6138
 epoch: 90, train_loss: 0.4505, test_loss: 1.1435, test_f1: 0.6312
 epoch: 91, train_loss: 0.4601, test_loss: 1.1265, test_f1: 0.6191
 epoch: 92, train_loss: 0.4537, test_loss: 1.1517, test_f1: 0.6111
 epoch: 93, train_loss: 0.4478, test_loss: 1.1459, test_f1: 0.6243
 epoch: 94, train_loss: 0.4461, test_loss: 1.1104, test_f1: 0.6106
 epoch: 95, train_loss: 0.4390, test_loss: 1.1077, test_f1: 0.6263
 epoch: 96, train_loss: 0.4393, test_loss: 1.1403, test_f1: 0.6141
 epoch: 97, train_loss: 0.4403, test_loss: 1.0922, test_f1: 0.6347
 epoch: 98, train_loss: 0.4280, test_loss: 1.0696, test_f1: 0.6273
 epoch: 99, train_loss: 0.4246, test_loss: 1.1264, test_f1: 0.6218
##################ITERATION #3 ****************************************
 epoch: 0, train_loss: 1.2521, test_loss: 1.3331, test_f1: 0.2270
 epoch: 1, train_loss: 1.1692, test_loss: 1.2891, test_f1: 0.2270
 epoch: 2, train_loss: 1.1253, test_loss: 1.2231, test_f1: 0.3966
 epoch: 3, train_loss: 1.0920, test_loss: 1.1488, test_f1: 0.4360
 epoch: 4, train_loss: 1.0670, test_loss: 1.0719, test_f1: 0.4719
 epoch: 5, train_loss: 1.0469, test_loss: 1.0228, test_f1: 0.5091
 epoch: 6, train_loss: 1.0251, test_loss: 0.9952, test_f1: 0.4907
 epoch: 7, train_loss: 1.0131, test_loss: 0.9803, test_f1: 0.5236
 epoch: 8, train_loss: 0.9850, test_loss: 0.9575, test_f1: 0.5147
 epoch: 9, train_loss: 0.9675, test_loss: 0.9375, test_f1: 0.5386
 epoch: 10, train_loss: 0.9530, test_loss: 0.9442, test_f1: 0.5216
 epoch: 11, train_loss: 0.9448, test_loss: 0.9422, test_f1: 0.5266
 epoch: 12, train_loss: 0.9295, test_loss: 0.9132, test_f1: 0.5394
 epoch: 13, train_loss: 0.9164, test_loss: 0.9318, test_f1: 0.5345
 epoch: 14, train_loss: 0.9037, test_loss: 0.9170, test_f1: 0.5378
 epoch: 15, train_loss: 0.8892, test_loss: 0.9056, test_f1: 0.5528
 epoch: 16, train_loss: 0.8741, test_loss: 0.9143, test_f1: 0.5464
 epoch: 17, train_loss: 0.8673, test_loss: 0.9046, test_f1: 0.5495
 epoch: 18, train_loss: 0.8551, test_loss: 0.9162, test_f1: 0.5461
 epoch: 19, train_loss: 0.8521, test_loss: 0.8999, test_f1: 0.5624
 epoch: 20, train_loss: 0.8356, test_loss: 0.9315, test_f1: 0.5455
 epoch: 21, train_loss: 0.8341, test_loss: 0.8893, test_f1: 0.5658
 epoch: 22, train_loss: 0.8192, test_loss: 0.8690, test_f1: 0.5744
 epoch: 23, train_loss: 0.8057, test_loss: 0.8921, test_f1: 0.5673
 epoch: 24, train_loss: 0.8049, test_loss: 0.8832, test_f1: 0.5800
 epoch: 25, train_loss: 0.7980, test_loss: 0.8928, test_f1: 0.5793
 epoch: 26, train_loss: 0.7921, test_loss: 0.8866, test_f1: 0.5710
 epoch: 27, train_loss: 0.7738, test_loss: 0.8691, test_f1: 0.5793
 epoch: 28, train_loss: 0.7795, test_loss: 0.8968, test_f1: 0.5728
 epoch: 29, train_loss: 0.7684, test_loss: 0.8852, test_f1: 0.5790
 epoch: 30, train_loss: 0.7574, test_loss: 0.8788, test_f1: 0.5824
 epoch: 31, train_loss: 0.7551, test_loss: 0.8810, test_f1: 0.5921
 epoch: 32, train_loss: 0.7471, test_loss: 0.8726, test_f1: 0.6079
 epoch: 33, train_loss: 0.7365, test_loss: 0.8810, test_f1: 0.6002
 epoch: 34, train_loss: 0.7317, test_loss: 0.8706, test_f1: 0.6094
 epoch: 35, train_loss: 0.7230, test_loss: 0.8859, test_f1: 0.6011
 epoch: 36, train_loss: 0.7283, test_loss: 0.8749, test_f1: 0.5991
 epoch: 37, train_loss: 0.7123, test_loss: 0.8945, test_f1: 0.5970
 epoch: 38, train_loss: 0.7105, test_loss: 0.8789, test_f1: 0.6009
 epoch: 39, train_loss: 0.6922, test_loss: 0.8580, test_f1: 0.6151
 epoch: 40, train_loss: 0.6969, test_loss: 0.8627, test_f1: 0.6015
 epoch: 41, train_loss: 0.6859, test_loss: 0.8861, test_f1: 0.6122
 epoch: 42, train_loss: 0.6863, test_loss: 0.8972, test_f1: 0.5953
 epoch: 43, train_loss: 0.6724, test_loss: 0.8889, test_f1: 0.6280
 epoch: 44, train_loss: 0.6761, test_loss: 0.8806, test_f1: 0.6260
 epoch: 45, train_loss: 0.6658, test_loss: 0.9013, test_f1: 0.5932
 epoch: 46, train_loss: 0.6662, test_loss: 0.9194, test_f1: 0.5967
 epoch: 47, train_loss: 0.6579, test_loss: 0.8880, test_f1: 0.6277
 epoch: 48, train_loss: 0.6559, test_loss: 0.8821, test_f1: 0.6244
 epoch: 49, train_loss: 0.6457, test_loss: 0.9110, test_f1: 0.5958
 epoch: 50, train_loss: 0.6359, test_loss: 0.8904, test_f1: 0.6211
 epoch: 51, train_loss: 0.6219, test_loss: 0.9192, test_f1: 0.6220
 epoch: 52, train_loss: 0.6302, test_loss: 0.9115, test_f1: 0.6224
 epoch: 53, train_loss: 0.6114, test_loss: 0.9066, test_f1: 0.6152
 epoch: 54, train_loss: 0.6079, test_loss: 0.9004, test_f1: 0.6097
 epoch: 55, train_loss: 0.6038, test_loss: 0.9132, test_f1: 0.6225
 epoch: 56, train_loss: 0.6093, test_loss: 0.9150, test_f1: 0.6161
 epoch: 57, train_loss: 0.5934, test_loss: 0.9136, test_f1: 0.6351
 epoch: 58, train_loss: 0.6009, test_loss: 0.9252, test_f1: 0.6108
 epoch: 59, train_loss: 0.5952, test_loss: 0.9314, test_f1: 0.6310
 epoch: 60, train_loss: 0.5947, test_loss: 0.9339, test_f1: 0.6313
 epoch: 61, train_loss: 0.5844, test_loss: 0.9348, test_f1: 0.6250
 epoch: 62, train_loss: 0.5806, test_loss: 0.9256, test_f1: 0.6309
 epoch: 63, train_loss: 0.5914, test_loss: 0.9350, test_f1: 0.6263
 epoch: 64, train_loss: 0.5741, test_loss: 0.9454, test_f1: 0.6340
 epoch: 65, train_loss: 0.5827, test_loss: 0.9470, test_f1: 0.6165
 epoch: 66, train_loss: 0.5700, test_loss: 0.9523, test_f1: 0.6062
 epoch: 67, train_loss: 0.5777, test_loss: 0.9274, test_f1: 0.6292
 epoch: 68, train_loss: 0.5563, test_loss: 0.9390, test_f1: 0.6269
 epoch: 69, train_loss: 0.5536, test_loss: 0.9363, test_f1: 0.6099
 epoch: 70, train_loss: 0.5725, test_loss: 0.9606, test_f1: 0.6459
 epoch: 71, train_loss: 0.5513, test_loss: 0.9594, test_f1: 0.6308
 epoch: 72, train_loss: 0.5609, test_loss: 0.9599, test_f1: 0.6251
 epoch: 73, train_loss: 0.5454, test_loss: 0.9834, test_f1: 0.6211
 epoch: 74, train_loss: 0.5471, test_loss: 0.9631, test_f1: 0.6235
 epoch: 75, train_loss: 0.5487, test_loss: 0.9615, test_f1: 0.6347
 epoch: 76, train_loss: 0.5462, test_loss: 0.9723, test_f1: 0.6245
 epoch: 77, train_loss: 0.5334, test_loss: 0.9868, test_f1: 0.6263
 epoch: 78, train_loss: 0.5382, test_loss: 0.9964, test_f1: 0.6274
 epoch: 79, train_loss: 0.5318, test_loss: 0.9816, test_f1: 0.6278
 epoch: 80, train_loss: 0.5221, test_loss: 0.9696, test_f1: 0.6384
 epoch: 81, train_loss: 0.5285, test_loss: 0.9852, test_f1: 0.6373
 epoch: 82, train_loss: 0.5278, test_loss: 0.9843, test_f1: 0.6347
 epoch: 83, train_loss: 0.5274, test_loss: 1.0081, test_f1: 0.6237
 epoch: 84, train_loss: 0.5166, test_loss: 1.0022, test_f1: 0.6216
 epoch: 85, train_loss: 0.5157, test_loss: 1.0162, test_f1: 0.6211
 epoch: 86, train_loss: 0.5132, test_loss: 1.0022, test_f1: 0.6245
 epoch: 87, train_loss: 0.5193, test_loss: 1.0021, test_f1: 0.6255
 epoch: 88, train_loss: 0.5120, test_loss: 1.0226, test_f1: 0.6218
 epoch: 89, train_loss: 0.5020, test_loss: 1.0287, test_f1: 0.6351
 epoch: 90, train_loss: 0.5116, test_loss: 1.0407, test_f1: 0.6172
 epoch: 91, train_loss: 0.5057, test_loss: 1.0076, test_f1: 0.6223
 epoch: 92, train_loss: 0.5159, test_loss: 1.0187, test_f1: 0.6360
 epoch: 93, train_loss: 0.5046, test_loss: 1.0364, test_f1: 0.6269
 epoch: 94, train_loss: 0.4972, test_loss: 1.0322, test_f1: 0.6381
 epoch: 95, train_loss: 0.5070, test_loss: 1.0390, test_f1: 0.6080
 epoch: 96, train_loss: 0.4930, test_loss: 1.0532, test_f1: 0.6151
 epoch: 97, train_loss: 0.4983, test_loss: 1.0570, test_f1: 0.6171
 epoch: 98, train_loss: 0.4907, test_loss: 1.0529, test_f1: 0.6307
 epoch: 99, train_loss: 0.4911, test_loss: 1.0413, test_f1: 0.6293
##################ITERATION #4 ****************************************
 epoch: 0, train_loss: 1.2340, test_loss: 1.3526, test_f1: 0.2270
 epoch: 1, train_loss: 1.1380, test_loss: 1.3643, test_f1: 0.2245
 epoch: 2, train_loss: 1.0866, test_loss: 1.2621, test_f1: 0.3469
 epoch: 3, train_loss: 1.0584, test_loss: 1.1590, test_f1: 0.4508
 epoch: 4, train_loss: 1.0337, test_loss: 1.1016, test_f1: 0.4638
 epoch: 5, train_loss: 1.0022, test_loss: 1.0332, test_f1: 0.5164
 epoch: 6, train_loss: 0.9860, test_loss: 0.9658, test_f1: 0.4915
 epoch: 7, train_loss: 0.9603, test_loss: 0.9508, test_f1: 0.4896
 epoch: 8, train_loss: 0.9493, test_loss: 0.9298, test_f1: 0.5034
 epoch: 9, train_loss: 0.9266, test_loss: 0.9339, test_f1: 0.5075
 epoch: 10, train_loss: 0.9133, test_loss: 0.9074, test_f1: 0.5046
 epoch: 11, train_loss: 0.8924, test_loss: 0.9022, test_f1: 0.5267
 epoch: 12, train_loss: 0.8963, test_loss: 0.9090, test_f1: 0.5148
 epoch: 13, train_loss: 0.8808, test_loss: 0.9057, test_f1: 0.5278
 epoch: 14, train_loss: 0.8658, test_loss: 0.9280, test_f1: 0.5370
 epoch: 15, train_loss: 0.8574, test_loss: 0.8853, test_f1: 0.5424
 epoch: 16, train_loss: 0.8551, test_loss: 0.8947, test_f1: 0.5498
 epoch: 17, train_loss: 0.8340, test_loss: 0.9086, test_f1: 0.5445
 epoch: 18, train_loss: 0.8190, test_loss: 0.9047, test_f1: 0.5507
 epoch: 19, train_loss: 0.8078, test_loss: 0.8903, test_f1: 0.5678
 epoch: 20, train_loss: 0.8037, test_loss: 0.8872, test_f1: 0.5559
 epoch: 21, train_loss: 0.7989, test_loss: 0.8993, test_f1: 0.5608
 epoch: 22, train_loss: 0.8009, test_loss: 0.9058, test_f1: 0.5514
 epoch: 23, train_loss: 0.7786, test_loss: 0.8991, test_f1: 0.5869
 epoch: 24, train_loss: 0.7779, test_loss: 0.8841, test_f1: 0.5766
 epoch: 25, train_loss: 0.7693, test_loss: 0.9153, test_f1: 0.5771
 epoch: 26, train_loss: 0.7640, test_loss: 0.9136, test_f1: 0.5629
 epoch: 27, train_loss: 0.7480, test_loss: 0.9020, test_f1: 0.5755
 epoch: 28, train_loss: 0.7531, test_loss: 0.9004, test_f1: 0.5678
 epoch: 29, train_loss: 0.7407, test_loss: 0.8973, test_f1: 0.5855
 epoch: 30, train_loss: 0.7248, test_loss: 0.8956, test_f1: 0.5842
 epoch: 31, train_loss: 0.7235, test_loss: 0.9129, test_f1: 0.5879
 epoch: 32, train_loss: 0.7210, test_loss: 0.8901, test_f1: 0.5874
 epoch: 33, train_loss: 0.7158, test_loss: 0.9130, test_f1: 0.5681
 epoch: 34, train_loss: 0.6990, test_loss: 0.9220, test_f1: 0.5941
 epoch: 35, train_loss: 0.6872, test_loss: 0.9021, test_f1: 0.6015
 epoch: 36, train_loss: 0.6876, test_loss: 0.9251, test_f1: 0.6052
 epoch: 37, train_loss: 0.6973, test_loss: 0.9123, test_f1: 0.5991
 epoch: 38, train_loss: 0.6823, test_loss: 0.9464, test_f1: 0.6036
 epoch: 39, train_loss: 0.6773, test_loss: 0.9178, test_f1: 0.6046
 epoch: 40, train_loss: 0.6706, test_loss: 0.9110, test_f1: 0.6139
 epoch: 41, train_loss: 0.6611, test_loss: 0.9226, test_f1: 0.5924
 epoch: 42, train_loss: 0.6573, test_loss: 0.9382, test_f1: 0.5972
 epoch: 43, train_loss: 0.6526, test_loss: 0.9656, test_f1: 0.6042
 epoch: 44, train_loss: 0.6441, test_loss: 0.9644, test_f1: 0.6032
 epoch: 45, train_loss: 0.6329, test_loss: 0.9185, test_f1: 0.6150
 epoch: 46, train_loss: 0.6395, test_loss: 0.8962, test_f1: 0.6150
 epoch: 47, train_loss: 0.6305, test_loss: 0.9336, test_f1: 0.6034
 epoch: 48, train_loss: 0.6225, test_loss: 0.9484, test_f1: 0.6338
 epoch: 49, train_loss: 0.6075, test_loss: 0.9342, test_f1: 0.6174
 epoch: 50, train_loss: 0.6115, test_loss: 0.9531, test_f1: 0.6350
 epoch: 51, train_loss: 0.5895, test_loss: 0.9216, test_f1: 0.6169
 epoch: 52, train_loss: 0.5915, test_loss: 0.9511, test_f1: 0.6286
 epoch: 53, train_loss: 0.5829, test_loss: 0.9537, test_f1: 0.6252
 epoch: 54, train_loss: 0.5797, test_loss: 0.9501, test_f1: 0.6263
 epoch: 55, train_loss: 0.5758, test_loss: 0.9453, test_f1: 0.6254
 epoch: 56, train_loss: 0.5638, test_loss: 0.9639, test_f1: 0.6268
 epoch: 57, train_loss: 0.5606, test_loss: 0.9573, test_f1: 0.6334
 epoch: 58, train_loss: 0.5735, test_loss: 0.9748, test_f1: 0.6234
 epoch: 59, train_loss: 0.5645, test_loss: 0.9782, test_f1: 0.6034
 epoch: 60, train_loss: 0.5429, test_loss: 0.9664, test_f1: 0.6217
 epoch: 61, train_loss: 0.5445, test_loss: 0.9524, test_f1: 0.6481
 epoch: 62, train_loss: 0.5526, test_loss: 0.9681, test_f1: 0.6216
 epoch: 63, train_loss: 0.5565, test_loss: 0.9673, test_f1: 0.6164
 epoch: 64, train_loss: 0.5497, test_loss: 0.9822, test_f1: 0.6203
 epoch: 65, train_loss: 0.5558, test_loss: 0.9596, test_f1: 0.6299
 epoch: 66, train_loss: 0.5404, test_loss: 0.9764, test_f1: 0.6249
 epoch: 67, train_loss: 0.5305, test_loss: 0.9538, test_f1: 0.6227
 epoch: 68, train_loss: 0.5380, test_loss: 1.0077, test_f1: 0.6383
 epoch: 69, train_loss: 0.5301, test_loss: 0.9932, test_f1: 0.6298
 epoch: 70, train_loss: 0.5423, test_loss: 0.9899, test_f1: 0.6167
 epoch: 71, train_loss: 0.5262, test_loss: 0.9863, test_f1: 0.6332
 epoch: 72, train_loss: 0.5076, test_loss: 0.9689, test_f1: 0.6392
 epoch: 73, train_loss: 0.5115, test_loss: 1.0022, test_f1: 0.6277
 epoch: 74, train_loss: 0.5106, test_loss: 1.0053, test_f1: 0.6288
 epoch: 75, train_loss: 0.5077, test_loss: 1.0072, test_f1: 0.6396
 epoch: 76, train_loss: 0.5106, test_loss: 0.9953, test_f1: 0.6300
 epoch: 77, train_loss: 0.5055, test_loss: 0.9893, test_f1: 0.6306
 epoch: 78, train_loss: 0.5045, test_loss: 0.9987, test_f1: 0.6437
 epoch: 79, train_loss: 0.4991, test_loss: 1.0185, test_f1: 0.6323
 epoch: 80, train_loss: 0.5052, test_loss: 1.0098, test_f1: 0.6494
 epoch: 81, train_loss: 0.4936, test_loss: 1.0039, test_f1: 0.6293
 epoch: 82, train_loss: 0.4908, test_loss: 1.0396, test_f1: 0.6472
 epoch: 83, train_loss: 0.4863, test_loss: 1.0184, test_f1: 0.6337
 epoch: 84, train_loss: 0.4948, test_loss: 1.0057, test_f1: 0.6236
 epoch: 85, train_loss: 0.4965, test_loss: 0.9958, test_f1: 0.6408
 epoch: 86, train_loss: 0.4808, test_loss: 0.9987, test_f1: 0.6212
 epoch: 87, train_loss: 0.4891, test_loss: 1.0039, test_f1: 0.6478
 epoch: 88, train_loss: 0.4787, test_loss: 1.0129, test_f1: 0.6406
 epoch: 89, train_loss: 0.4546, test_loss: 1.0530, test_f1: 0.6311
 epoch: 90, train_loss: 0.4748, test_loss: 1.0351, test_f1: 0.6365
 epoch: 91, train_loss: 0.4548, test_loss: 1.0140, test_f1: 0.6279
 epoch: 92, train_loss: 0.4728, test_loss: 1.0219, test_f1: 0.6274
 epoch: 93, train_loss: 0.4672, test_loss: 1.0101, test_f1: 0.6527
 epoch: 94, train_loss: 0.4651, test_loss: 1.0536, test_f1: 0.6413
 epoch: 95, train_loss: 0.4494, test_loss: 1.0385, test_f1: 0.6287
 epoch: 96, train_loss: 0.4456, test_loss: 1.0541, test_f1: 0.6303
 epoch: 97, train_loss: 0.4638, test_loss: 1.0602, test_f1: 0.6331
 epoch: 98, train_loss: 0.4659, test_loss: 1.0573, test_f1: 0.6400
 epoch: 99, train_loss: 0.4557, test_loss: 1.0642, test_f1: 0.6421
##################ITERATION #5 ****************************************
 epoch: 0, train_loss: 1.2495, test_loss: 1.3430, test_f1: 0.2270
 epoch: 1, train_loss: 1.1550, test_loss: 1.3158, test_f1: 0.2882
 epoch: 2, train_loss: 1.1108, test_loss: 1.2475, test_f1: 0.3324
 epoch: 3, train_loss: 1.0705, test_loss: 1.1804, test_f1: 0.3163
 epoch: 4, train_loss: 1.0582, test_loss: 1.0796, test_f1: 0.4225
 epoch: 5, train_loss: 1.0221, test_loss: 1.0021, test_f1: 0.4791
 epoch: 6, train_loss: 1.0026, test_loss: 0.9602, test_f1: 0.4960
 epoch: 7, train_loss: 0.9809, test_loss: 0.9414, test_f1: 0.4947
 epoch: 8, train_loss: 0.9572, test_loss: 0.9263, test_f1: 0.5110
 epoch: 9, train_loss: 0.9540, test_loss: 0.9050, test_f1: 0.5072
 epoch: 10, train_loss: 0.9333, test_loss: 0.9049, test_f1: 0.5291
 epoch: 11, train_loss: 0.9169, test_loss: 0.9045, test_f1: 0.5116
 epoch: 12, train_loss: 0.9057, test_loss: 0.8921, test_f1: 0.5286
 epoch: 13, train_loss: 0.8869, test_loss: 0.9005, test_f1: 0.5319
 epoch: 14, train_loss: 0.8795, test_loss: 0.9105, test_f1: 0.5255
 epoch: 15, train_loss: 0.8785, test_loss: 0.8831, test_f1: 0.5401
 epoch: 16, train_loss: 0.8632, test_loss: 0.8869, test_f1: 0.5648
 epoch: 17, train_loss: 0.8507, test_loss: 0.8829, test_f1: 0.5460
 epoch: 18, train_loss: 0.8259, test_loss: 0.8885, test_f1: 0.5455
 epoch: 19, train_loss: 0.8301, test_loss: 0.8947, test_f1: 0.5597
 epoch: 20, train_loss: 0.8186, test_loss: 0.8957, test_f1: 0.5664
 epoch: 21, train_loss: 0.8043, test_loss: 0.9168, test_f1: 0.5377
 epoch: 22, train_loss: 0.7869, test_loss: 0.9136, test_f1: 0.5400
 epoch: 23, train_loss: 0.7913, test_loss: 0.8953, test_f1: 0.5662
 epoch: 24, train_loss: 0.7769, test_loss: 0.8849, test_f1: 0.5703
 epoch: 25, train_loss: 0.7679, test_loss: 0.8960, test_f1: 0.5546
 epoch: 26, train_loss: 0.7573, test_loss: 0.9019, test_f1: 0.5764
 epoch: 27, train_loss: 0.7553, test_loss: 0.9357, test_f1: 0.5539
 epoch: 28, train_loss: 0.7487, test_loss: 0.9003, test_f1: 0.5726
 epoch: 29, train_loss: 0.7395, test_loss: 0.9603, test_f1: 0.5565
 epoch: 30, train_loss: 0.7342, test_loss: 0.9136, test_f1: 0.5485
 epoch: 31, train_loss: 0.7256, test_loss: 0.9073, test_f1: 0.5726
 epoch: 32, train_loss: 0.7170, test_loss: 0.9115, test_f1: 0.5663
 epoch: 33, train_loss: 0.7201, test_loss: 0.9309, test_f1: 0.5815
 epoch: 34, train_loss: 0.7087, test_loss: 0.9225, test_f1: 0.5701
 epoch: 35, train_loss: 0.7017, test_loss: 0.9490, test_f1: 0.5711
 epoch: 36, train_loss: 0.6891, test_loss: 0.9071, test_f1: 0.5913
 epoch: 37, train_loss: 0.6839, test_loss: 0.9477, test_f1: 0.5685
 epoch: 38, train_loss: 0.6961, test_loss: 0.9289, test_f1: 0.5920
 epoch: 39, train_loss: 0.6863, test_loss: 0.9149, test_f1: 0.5840
 epoch: 40, train_loss: 0.6630, test_loss: 0.9678, test_f1: 0.5936
 epoch: 41, train_loss: 0.6729, test_loss: 0.9671, test_f1: 0.6036
 epoch: 42, train_loss: 0.6535, test_loss: 0.9889, test_f1: 0.5712
 epoch: 43, train_loss: 0.6485, test_loss: 0.9834, test_f1: 0.5946
 epoch: 44, train_loss: 0.6470, test_loss: 0.9905, test_f1: 0.5707
 epoch: 45, train_loss: 0.6419, test_loss: 0.9601, test_f1: 0.6193
 epoch: 46, train_loss: 0.6401, test_loss: 0.9745, test_f1: 0.5749
 epoch: 47, train_loss: 0.6266, test_loss: 0.9594, test_f1: 0.5740
 epoch: 48, train_loss: 0.6277, test_loss: 0.9447, test_f1: 0.6204
 epoch: 49, train_loss: 0.6115, test_loss: 0.9794, test_f1: 0.5840
 epoch: 50, train_loss: 0.6161, test_loss: 0.9553, test_f1: 0.6018
 epoch: 51, train_loss: 0.6026, test_loss: 0.9582, test_f1: 0.6080
 epoch: 52, train_loss: 0.5880, test_loss: 0.9581, test_f1: 0.6014
 epoch: 53, train_loss: 0.5887, test_loss: 0.9734, test_f1: 0.5860
 epoch: 54, train_loss: 0.5727, test_loss: 0.9695, test_f1: 0.5799
 epoch: 55, train_loss: 0.5778, test_loss: 0.9588, test_f1: 0.6037
 epoch: 56, train_loss: 0.5762, test_loss: 0.9612, test_f1: 0.5933
 epoch: 57, train_loss: 0.5548, test_loss: 0.9685, test_f1: 0.5808
 epoch: 58, train_loss: 0.5619, test_loss: 0.9932, test_f1: 0.5989
 epoch: 59, train_loss: 0.5623, test_loss: 0.9768, test_f1: 0.6104
 epoch: 60, train_loss: 0.5627, test_loss: 0.9888, test_f1: 0.5942
 epoch: 61, train_loss: 0.5558, test_loss: 1.0070, test_f1: 0.5998
 epoch: 62, train_loss: 0.5649, test_loss: 0.9961, test_f1: 0.6023
 epoch: 63, train_loss: 0.5533, test_loss: 1.0505, test_f1: 0.6062
 epoch: 64, train_loss: 0.5542, test_loss: 1.0151, test_f1: 0.6092
 epoch: 65, train_loss: 0.5452, test_loss: 1.0166, test_f1: 0.5911
 epoch: 66, train_loss: 0.5452, test_loss: 1.0454, test_f1: 0.5985
 epoch: 67, train_loss: 0.5483, test_loss: 1.0206, test_f1: 0.6024
 epoch: 68, train_loss: 0.5373, test_loss: 1.0203, test_f1: 0.6173
 epoch: 69, train_loss: 0.5311, test_loss: 1.0366, test_f1: 0.6165
 epoch: 70, train_loss: 0.5346, test_loss: 1.0428, test_f1: 0.6070
 epoch: 71, train_loss: 0.5221, test_loss: 1.0845, test_f1: 0.6182
 epoch: 72, train_loss: 0.5188, test_loss: 1.0788, test_f1: 0.5913
 epoch: 73, train_loss: 0.5324, test_loss: 1.0821, test_f1: 0.6168
 epoch: 74, train_loss: 0.5234, test_loss: 1.0769, test_f1: 0.5993
 epoch: 75, train_loss: 0.5189, test_loss: 1.0612, test_f1: 0.6208
 epoch: 76, train_loss: 0.5273, test_loss: 1.0674, test_f1: 0.6093
 epoch: 77, train_loss: 0.5253, test_loss: 1.0786, test_f1: 0.6197
 epoch: 78, train_loss: 0.5209, test_loss: 1.0931, test_f1: 0.5982
 epoch: 79, train_loss: 0.5131, test_loss: 1.0629, test_f1: 0.6070
 epoch: 80, train_loss: 0.5085, test_loss: 1.0881, test_f1: 0.5996
 epoch: 81, train_loss: 0.5011, test_loss: 1.0615, test_f1: 0.6296
 epoch: 82, train_loss: 0.5092, test_loss: 1.0800, test_f1: 0.6120
 epoch: 83, train_loss: 0.4952, test_loss: 1.1070, test_f1: 0.6059
 epoch: 84, train_loss: 0.4977, test_loss: 1.0907, test_f1: 0.6017
 epoch: 85, train_loss: 0.4928, test_loss: 1.1432, test_f1: 0.6062
 epoch: 86, train_loss: 0.5013, test_loss: 1.1276, test_f1: 0.5981
 epoch: 87, train_loss: 0.4778, test_loss: 1.0847, test_f1: 0.6125
 epoch: 88, train_loss: 0.4957, test_loss: 1.0773, test_f1: 0.6100
 epoch: 89, train_loss: 0.4860, test_loss: 1.1243, test_f1: 0.5949
 epoch: 90, train_loss: 0.4805, test_loss: 1.1317, test_f1: 0.6060
 epoch: 91, train_loss: 0.4731, test_loss: 1.1295, test_f1: 0.6102
 epoch: 92, train_loss: 0.4842, test_loss: 1.1573, test_f1: 0.5959
 epoch: 93, train_loss: 0.4770, test_loss: 1.1144, test_f1: 0.6055
 epoch: 94, train_loss: 0.4712, test_loss: 1.1423, test_f1: 0.6061
 epoch: 95, train_loss: 0.4634, test_loss: 1.1342, test_f1: 0.5929
 epoch: 96, train_loss: 0.4846, test_loss: 1.1702, test_f1: 0.6019
 epoch: 97, train_loss: 0.4616, test_loss: 1.2355, test_f1: 0.5802
 epoch: 98, train_loss: 0.4644, test_loss: 1.1798, test_f1: 0.6028
 epoch: 99, train_loss: 0.4665, test_loss: 1.1721, test_f1: 0.5885
##################ITERATION #6 ****************************************
 epoch: 0, train_loss: 1.2601, test_loss: 1.3859, test_f1: 0.1453
 epoch: 1, train_loss: 1.1425, test_loss: 1.4651, test_f1: 0.0688
 epoch: 2, train_loss: 1.0939, test_loss: 1.4221, test_f1: 0.1762
 epoch: 3, train_loss: 1.0765, test_loss: 1.2205, test_f1: 0.3478
 epoch: 4, train_loss: 1.0454, test_loss: 1.0557, test_f1: 0.4712
 epoch: 5, train_loss: 1.0200, test_loss: 0.9986, test_f1: 0.4689
 epoch: 6, train_loss: 1.0070, test_loss: 0.9618, test_f1: 0.5188
 epoch: 7, train_loss: 0.9853, test_loss: 0.9252, test_f1: 0.5142
 epoch: 8, train_loss: 0.9602, test_loss: 0.9011, test_f1: 0.5247
 epoch: 9, train_loss: 0.9445, test_loss: 0.9171, test_f1: 0.5068
 epoch: 10, train_loss: 0.9453, test_loss: 0.9113, test_f1: 0.5511
 epoch: 11, train_loss: 0.9351, test_loss: 0.8971, test_f1: 0.5371
 epoch: 12, train_loss: 0.9109, test_loss: 0.9217, test_f1: 0.5563
 epoch: 13, train_loss: 0.8990, test_loss: 0.9028, test_f1: 0.5633
 epoch: 14, train_loss: 0.8916, test_loss: 0.9084, test_f1: 0.5733
 epoch: 15, train_loss: 0.8681, test_loss: 0.8890, test_f1: 0.5759
 epoch: 16, train_loss: 0.8554, test_loss: 0.9110, test_f1: 0.5787
 epoch: 17, train_loss: 0.8464, test_loss: 0.8762, test_f1: 0.5862
 epoch: 18, train_loss: 0.8378, test_loss: 0.8787, test_f1: 0.5731
 epoch: 19, train_loss: 0.8290, test_loss: 0.8968, test_f1: 0.6188
 epoch: 20, train_loss: 0.8285, test_loss: 0.8489, test_f1: 0.5989
 epoch: 21, train_loss: 0.8045, test_loss: 0.9041, test_f1: 0.5953
 epoch: 22, train_loss: 0.8040, test_loss: 0.8643, test_f1: 0.5911
 epoch: 23, train_loss: 0.7965, test_loss: 0.8806, test_f1: 0.5991
 epoch: 24, train_loss: 0.7772, test_loss: 0.8865, test_f1: 0.6007
 epoch: 25, train_loss: 0.7766, test_loss: 0.8846, test_f1: 0.6199
 epoch: 26, train_loss: 0.7734, test_loss: 0.8907, test_f1: 0.5984
 epoch: 27, train_loss: 0.7622, test_loss: 0.8761, test_f1: 0.5894
 epoch: 28, train_loss: 0.7539, test_loss: 0.8973, test_f1: 0.5976
 epoch: 29, train_loss: 0.7465, test_loss: 0.8673, test_f1: 0.6056
 epoch: 30, train_loss: 0.7326, test_loss: 0.9138, test_f1: 0.6084
 epoch: 31, train_loss: 0.7304, test_loss: 0.8980, test_f1: 0.6203
 epoch: 32, train_loss: 0.7199, test_loss: 0.8643, test_f1: 0.6225
 epoch: 33, train_loss: 0.7205, test_loss: 0.8832, test_f1: 0.6149
 epoch: 34, train_loss: 0.7177, test_loss: 0.9050, test_f1: 0.6454
 epoch: 35, train_loss: 0.7049, test_loss: 0.9019, test_f1: 0.6232
 epoch: 36, train_loss: 0.7035, test_loss: 0.9208, test_f1: 0.6080
 epoch: 37, train_loss: 0.6985, test_loss: 0.9040, test_f1: 0.6075
 epoch: 38, train_loss: 0.6806, test_loss: 0.9340, test_f1: 0.6136
 epoch: 39, train_loss: 0.6797, test_loss: 0.9102, test_f1: 0.6320
 epoch: 40, train_loss: 0.6701, test_loss: 0.9357, test_f1: 0.6178
 epoch: 41, train_loss: 0.6748, test_loss: 0.9259, test_f1: 0.6248
 epoch: 42, train_loss: 0.6708, test_loss: 0.8986, test_f1: 0.6318
 epoch: 43, train_loss: 0.6487, test_loss: 0.9207, test_f1: 0.6240
 epoch: 44, train_loss: 0.6447, test_loss: 0.8983, test_f1: 0.6432
 epoch: 45, train_loss: 0.6531, test_loss: 0.9247, test_f1: 0.6243
 epoch: 46, train_loss: 0.6542, test_loss: 0.9142, test_f1: 0.6315
 epoch: 47, train_loss: 0.6321, test_loss: 0.9383, test_f1: 0.6284
 epoch: 48, train_loss: 0.6368, test_loss: 0.9333, test_f1: 0.6342
 epoch: 49, train_loss: 0.6308, test_loss: 0.9800, test_f1: 0.6159
 epoch: 50, train_loss: 0.6265, test_loss: 0.9139, test_f1: 0.6528
 epoch: 51, train_loss: 0.6099, test_loss: 0.9315, test_f1: 0.6327
 epoch: 52, train_loss: 0.5978, test_loss: 0.9332, test_f1: 0.6296
 epoch: 53, train_loss: 0.5959, test_loss: 0.9413, test_f1: 0.6242
 epoch: 54, train_loss: 0.5995, test_loss: 0.9456, test_f1: 0.6243
 epoch: 55, train_loss: 0.5889, test_loss: 0.9181, test_f1: 0.6390
 epoch: 56, train_loss: 0.5941, test_loss: 0.9254, test_f1: 0.6497
 epoch: 57, train_loss: 0.5849, test_loss: 0.9500, test_f1: 0.6259
 epoch: 58, train_loss: 0.5837, test_loss: 0.9368, test_f1: 0.6385
 epoch: 59, train_loss: 0.5647, test_loss: 0.9428, test_f1: 0.6377
 epoch: 60, train_loss: 0.5790, test_loss: 0.9321, test_f1: 0.6384
 epoch: 61, train_loss: 0.5708, test_loss: 0.9453, test_f1: 0.6383
 epoch: 62, train_loss: 0.5658, test_loss: 0.9541, test_f1: 0.6269
 epoch: 63, train_loss: 0.5695, test_loss: 0.9634, test_f1: 0.6364
 epoch: 64, train_loss: 0.5627, test_loss: 0.9504, test_f1: 0.6419
 epoch: 65, train_loss: 0.5557, test_loss: 0.9897, test_f1: 0.6344
 epoch: 66, train_loss: 0.5601, test_loss: 0.9625, test_f1: 0.6331
 epoch: 67, train_loss: 0.5520, test_loss: 0.9627, test_f1: 0.6545
 epoch: 68, train_loss: 0.5568, test_loss: 0.9736, test_f1: 0.6289
 epoch: 69, train_loss: 0.5349, test_loss: 0.9645, test_f1: 0.6434
 epoch: 70, train_loss: 0.5387, test_loss: 1.0073, test_f1: 0.6271
 epoch: 71, train_loss: 0.5470, test_loss: 0.9778, test_f1: 0.6325
 epoch: 72, train_loss: 0.5335, test_loss: 0.9767, test_f1: 0.6327
 epoch: 73, train_loss: 0.5464, test_loss: 0.9924, test_f1: 0.6325
 epoch: 74, train_loss: 0.5436, test_loss: 0.9968, test_f1: 0.6291
 epoch: 75, train_loss: 0.5255, test_loss: 0.9924, test_f1: 0.6479
 epoch: 76, train_loss: 0.5306, test_loss: 0.9955, test_f1: 0.6445
 epoch: 77, train_loss: 0.5394, test_loss: 1.0100, test_f1: 0.6372
 epoch: 78, train_loss: 0.5148, test_loss: 1.0258, test_f1: 0.6309
 epoch: 79, train_loss: 0.5257, test_loss: 1.0016, test_f1: 0.6291
 epoch: 80, train_loss: 0.5276, test_loss: 0.9945, test_f1: 0.6460
 epoch: 81, train_loss: 0.5226, test_loss: 0.9884, test_f1: 0.6595
 epoch: 82, train_loss: 0.5204, test_loss: 1.0149, test_f1: 0.6348
 epoch: 83, train_loss: 0.5139, test_loss: 1.0166, test_f1: 0.6352
 epoch: 84, train_loss: 0.5191, test_loss: 1.0084, test_f1: 0.6413
 epoch: 85, train_loss: 0.4985, test_loss: 1.0254, test_f1: 0.6282
 epoch: 86, train_loss: 0.5144, test_loss: 0.9943, test_f1: 0.6297
 epoch: 87, train_loss: 0.5033, test_loss: 1.0176, test_f1: 0.6371
 epoch: 88, train_loss: 0.5101, test_loss: 1.0158, test_f1: 0.6417
 epoch: 89, train_loss: 0.5073, test_loss: 1.0011, test_f1: 0.6463
 epoch: 90, train_loss: 0.4923, test_loss: 1.0284, test_f1: 0.6297
 epoch: 91, train_loss: 0.4956, test_loss: 1.0380, test_f1: 0.6301
 epoch: 92, train_loss: 0.4897, test_loss: 1.0510, test_f1: 0.6317
 epoch: 93, train_loss: 0.4858, test_loss: 1.0559, test_f1: 0.6376
 epoch: 94, train_loss: 0.4761, test_loss: 1.0654, test_f1: 0.6305
 epoch: 95, train_loss: 0.4915, test_loss: 1.0555, test_f1: 0.6403
 epoch: 96, train_loss: 0.4792, test_loss: 1.0479, test_f1: 0.6445
 epoch: 97, train_loss: 0.4743, test_loss: 1.0681, test_f1: 0.6354
 epoch: 98, train_loss: 0.4760, test_loss: 1.0735, test_f1: 0.6389
 epoch: 99, train_loss: 0.4780, test_loss: 1.0518, test_f1: 0.6408
##################ITERATION #7 ****************************************
 epoch: 0, train_loss: 1.2753, test_loss: 1.3190, test_f1: 0.2270
 epoch: 1, train_loss: 1.1377, test_loss: 1.3285, test_f1: 0.3071
 epoch: 2, train_loss: 1.0953, test_loss: 1.3151, test_f1: 0.3142
 epoch: 3, train_loss: 1.0573, test_loss: 1.2586, test_f1: 0.3446
 epoch: 4, train_loss: 1.0339, test_loss: 1.1177, test_f1: 0.4129
 epoch: 5, train_loss: 1.0151, test_loss: 0.9910, test_f1: 0.5021
 epoch: 6, train_loss: 0.9934, test_loss: 0.9457, test_f1: 0.5063
 epoch: 7, train_loss: 0.9699, test_loss: 0.9271, test_f1: 0.5183
 epoch: 8, train_loss: 0.9555, test_loss: 0.9164, test_f1: 0.5271
 epoch: 9, train_loss: 0.9522, test_loss: 0.9124, test_f1: 0.5428
 epoch: 10, train_loss: 0.9485, test_loss: 0.9178, test_f1: 0.5224
 epoch: 11, train_loss: 0.9198, test_loss: 0.9205, test_f1: 0.5327
 epoch: 12, train_loss: 0.9082, test_loss: 0.9061, test_f1: 0.5350
 epoch: 13, train_loss: 0.8916, test_loss: 0.9050, test_f1: 0.5435
 epoch: 14, train_loss: 0.8805, test_loss: 0.9266, test_f1: 0.5268
 epoch: 15, train_loss: 0.8854, test_loss: 0.8997, test_f1: 0.5437
 epoch: 16, train_loss: 0.8686, test_loss: 0.9133, test_f1: 0.5340
 epoch: 17, train_loss: 0.8620, test_loss: 0.9041, test_f1: 0.5230
 epoch: 18, train_loss: 0.8558, test_loss: 0.8897, test_f1: 0.5480
 epoch: 19, train_loss: 0.8393, test_loss: 0.9029, test_f1: 0.5595
 epoch: 20, train_loss: 0.8401, test_loss: 0.9164, test_f1: 0.5600
 epoch: 21, train_loss: 0.8317, test_loss: 0.9215, test_f1: 0.5529
 epoch: 22, train_loss: 0.8217, test_loss: 0.9064, test_f1: 0.5777
 epoch: 23, train_loss: 0.8131, test_loss: 0.9096, test_f1: 0.5578
 epoch: 24, train_loss: 0.7941, test_loss: 0.9049, test_f1: 0.5641
 epoch: 25, train_loss: 0.8035, test_loss: 0.9000, test_f1: 0.5775
 epoch: 26, train_loss: 0.7989, test_loss: 0.9253, test_f1: 0.5622
 epoch: 27, train_loss: 0.7764, test_loss: 0.9123, test_f1: 0.5826
 epoch: 28, train_loss: 0.7700, test_loss: 0.9169, test_f1: 0.5868
 epoch: 29, train_loss: 0.7687, test_loss: 0.9293, test_f1: 0.5884
 epoch: 30, train_loss: 0.7555, test_loss: 0.9171, test_f1: 0.5659
 epoch: 31, train_loss: 0.7539, test_loss: 0.9254, test_f1: 0.6009
 epoch: 32, train_loss: 0.7493, test_loss: 0.9176, test_f1: 0.5733
 epoch: 33, train_loss: 0.7374, test_loss: 0.9233, test_f1: 0.5868
 epoch: 34, train_loss: 0.7270, test_loss: 0.9267, test_f1: 0.5881
 epoch: 35, train_loss: 0.7238, test_loss: 0.9131, test_f1: 0.5928
 epoch: 36, train_loss: 0.7440, test_loss: 0.9301, test_f1: 0.5951
 epoch: 37, train_loss: 0.7258, test_loss: 0.9196, test_f1: 0.6080
 epoch: 38, train_loss: 0.7154, test_loss: 0.9379, test_f1: 0.5920
 epoch: 39, train_loss: 0.7126, test_loss: 0.9319, test_f1: 0.5888
 epoch: 40, train_loss: 0.6976, test_loss: 0.9384, test_f1: 0.6078
 epoch: 41, train_loss: 0.6937, test_loss: 0.9196, test_f1: 0.6065
 epoch: 42, train_loss: 0.6794, test_loss: 0.9397, test_f1: 0.5934
 epoch: 43, train_loss: 0.6724, test_loss: 0.9473, test_f1: 0.5904
 epoch: 44, train_loss: 0.6821, test_loss: 0.9433, test_f1: 0.6006
 epoch: 45, train_loss: 0.6750, test_loss: 0.9614, test_f1: 0.6035
 epoch: 46, train_loss: 0.6606, test_loss: 0.9516, test_f1: 0.6062
 epoch: 47, train_loss: 0.6575, test_loss: 0.9509, test_f1: 0.6307
 epoch: 48, train_loss: 0.6661, test_loss: 0.9562, test_f1: 0.6006
 epoch: 49, train_loss: 0.6533, test_loss: 0.9822, test_f1: 0.5990
 epoch: 50, train_loss: 0.6397, test_loss: 0.9559, test_f1: 0.6219
 epoch: 51, train_loss: 0.6378, test_loss: 0.9524, test_f1: 0.6192
 epoch: 52, train_loss: 0.6368, test_loss: 0.9635, test_f1: 0.6193
 epoch: 53, train_loss: 0.6201, test_loss: 0.9663, test_f1: 0.6277
 epoch: 54, train_loss: 0.6066, test_loss: 0.9538, test_f1: 0.6122
 epoch: 55, train_loss: 0.6106, test_loss: 0.9591, test_f1: 0.6180
 epoch: 56, train_loss: 0.6076, test_loss: 0.9817, test_f1: 0.6163
 epoch: 57, train_loss: 0.6025, test_loss: 1.0028, test_f1: 0.6103
 epoch: 58, train_loss: 0.6077, test_loss: 0.9944, test_f1: 0.6181
 epoch: 59, train_loss: 0.5994, test_loss: 0.9932, test_f1: 0.6329
 epoch: 60, train_loss: 0.5971, test_loss: 1.0027, test_f1: 0.6204
 epoch: 61, train_loss: 0.5981, test_loss: 1.0016, test_f1: 0.6195
 epoch: 62, train_loss: 0.5932, test_loss: 0.9881, test_f1: 0.6402
 epoch: 63, train_loss: 0.5838, test_loss: 0.9959, test_f1: 0.6304
 epoch: 64, train_loss: 0.5926, test_loss: 0.9842, test_f1: 0.6124
 epoch: 65, train_loss: 0.5838, test_loss: 1.0047, test_f1: 0.6132
 epoch: 66, train_loss: 0.5832, test_loss: 1.0051, test_f1: 0.6395
 epoch: 67, train_loss: 0.5808, test_loss: 1.0030, test_f1: 0.6276
 epoch: 68, train_loss: 0.5771, test_loss: 1.0073, test_f1: 0.6394
 epoch: 69, train_loss: 0.5715, test_loss: 1.0149, test_f1: 0.6233
 epoch: 70, train_loss: 0.5742, test_loss: 1.0121, test_f1: 0.6340
 epoch: 71, train_loss: 0.5656, test_loss: 1.0235, test_f1: 0.6204
 epoch: 72, train_loss: 0.5487, test_loss: 1.0229, test_f1: 0.6379
 epoch: 73, train_loss: 0.5630, test_loss: 1.0405, test_f1: 0.6231
 epoch: 74, train_loss: 0.5590, test_loss: 1.0318, test_f1: 0.6474
 epoch: 75, train_loss: 0.5554, test_loss: 1.0509, test_f1: 0.6200
 epoch: 76, train_loss: 0.5489, test_loss: 1.0169, test_f1: 0.6313
 epoch: 77, train_loss: 0.5503, test_loss: 1.0379, test_f1: 0.6266
 epoch: 78, train_loss: 0.5470, test_loss: 1.0354, test_f1: 0.6303
 epoch: 79, train_loss: 0.5504, test_loss: 1.0511, test_f1: 0.6242
 epoch: 80, train_loss: 0.5402, test_loss: 1.0416, test_f1: 0.6382
 epoch: 81, train_loss: 0.5456, test_loss: 1.0618, test_f1: 0.6290
 epoch: 82, train_loss: 0.5366, test_loss: 1.0523, test_f1: 0.6276
 epoch: 83, train_loss: 0.5188, test_loss: 1.0315, test_f1: 0.6458
 epoch: 84, train_loss: 0.5431, test_loss: 1.0518, test_f1: 0.6168
 epoch: 85, train_loss: 0.5278, test_loss: 1.0684, test_f1: 0.6327
 epoch: 86, train_loss: 0.5112, test_loss: 1.0639, test_f1: 0.6278
 epoch: 87, train_loss: 0.5172, test_loss: 1.0718, test_f1: 0.6317
 epoch: 88, train_loss: 0.5295, test_loss: 1.0530, test_f1: 0.6328
 epoch: 89, train_loss: 0.5208, test_loss: 1.0729, test_f1: 0.6269
 epoch: 90, train_loss: 0.5290, test_loss: 1.0704, test_f1: 0.6361
 epoch: 91, train_loss: 0.5129, test_loss: 1.0995, test_f1: 0.6262
 epoch: 92, train_loss: 0.5213, test_loss: 1.0855, test_f1: 0.6405
 epoch: 93, train_loss: 0.5071, test_loss: 1.0715, test_f1: 0.6499
 epoch: 94, train_loss: 0.5063, test_loss: 1.0861, test_f1: 0.6184
 epoch: 95, train_loss: 0.5005, test_loss: 1.0919, test_f1: 0.6233
 epoch: 96, train_loss: 0.5028, test_loss: 1.1137, test_f1: 0.6163
 epoch: 97, train_loss: 0.5024, test_loss: 1.1077, test_f1: 0.6201
 epoch: 98, train_loss: 0.5075, test_loss: 1.0935, test_f1: 0.6386
 epoch: 99, train_loss: 0.4937, test_loss: 1.0919, test_f1: 0.6292
##################ITERATION #8 ****************************************
 epoch: 0, train_loss: 1.2904, test_loss: 1.3862, test_f1: 0.1996
 epoch: 1, train_loss: 1.1474, test_loss: 1.3970, test_f1: 0.1844
 epoch: 2, train_loss: 1.1021, test_loss: 1.3146, test_f1: 0.2679
 epoch: 3, train_loss: 1.0673, test_loss: 1.2112, test_f1: 0.3638
 epoch: 4, train_loss: 1.0516, test_loss: 1.1328, test_f1: 0.4382
 epoch: 5, train_loss: 1.0212, test_loss: 1.0493, test_f1: 0.4390
 epoch: 6, train_loss: 1.0144, test_loss: 0.9732, test_f1: 0.4995
 epoch: 7, train_loss: 0.9899, test_loss: 0.9497, test_f1: 0.5130
 epoch: 8, train_loss: 0.9707, test_loss: 0.9293, test_f1: 0.5260
 epoch: 9, train_loss: 0.9519, test_loss: 0.9270, test_f1: 0.5214
 epoch: 10, train_loss: 0.9345, test_loss: 0.9143, test_f1: 0.5314
 epoch: 11, train_loss: 0.9246, test_loss: 0.9087, test_f1: 0.5341
 epoch: 12, train_loss: 0.9204, test_loss: 0.9202, test_f1: 0.5302
 epoch: 13, train_loss: 0.9074, test_loss: 0.8945, test_f1: 0.5276
 epoch: 14, train_loss: 0.8879, test_loss: 0.9065, test_f1: 0.5308
 epoch: 15, train_loss: 0.8778, test_loss: 0.8923, test_f1: 0.5508
 epoch: 16, train_loss: 0.8702, test_loss: 0.8968, test_f1: 0.5455
 epoch: 17, train_loss: 0.8609, test_loss: 0.8822, test_f1: 0.5365
 epoch: 18, train_loss: 0.8576, test_loss: 0.9000, test_f1: 0.5486
 epoch: 19, train_loss: 0.8314, test_loss: 0.8676, test_f1: 0.5617
 epoch: 20, train_loss: 0.8381, test_loss: 0.8798, test_f1: 0.5670
 epoch: 21, train_loss: 0.8198, test_loss: 0.8967, test_f1: 0.5642
 epoch: 22, train_loss: 0.8059, test_loss: 0.8808, test_f1: 0.5676
 epoch: 23, train_loss: 0.7962, test_loss: 0.8722, test_f1: 0.5607
 epoch: 24, train_loss: 0.8001, test_loss: 0.8783, test_f1: 0.5668
 epoch: 25, train_loss: 0.7809, test_loss: 0.8791, test_f1: 0.5782
 epoch: 26, train_loss: 0.7759, test_loss: 0.8786, test_f1: 0.5710
 epoch: 27, train_loss: 0.7810, test_loss: 0.8953, test_f1: 0.5763
 epoch: 28, train_loss: 0.7676, test_loss: 0.8773, test_f1: 0.5870
 epoch: 29, train_loss: 0.7671, test_loss: 0.8893, test_f1: 0.5844
 epoch: 30, train_loss: 0.7540, test_loss: 0.8933, test_f1: 0.5753
 epoch: 31, train_loss: 0.7495, test_loss: 0.8968, test_f1: 0.5863
 epoch: 32, train_loss: 0.7392, test_loss: 0.8960, test_f1: 0.6034
 epoch: 33, train_loss: 0.7452, test_loss: 0.8958, test_f1: 0.5938
 epoch: 34, train_loss: 0.7300, test_loss: 0.8961, test_f1: 0.5991
 epoch: 35, train_loss: 0.7082, test_loss: 0.8909, test_f1: 0.5894
 epoch: 36, train_loss: 0.7032, test_loss: 0.8975, test_f1: 0.5963
 epoch: 37, train_loss: 0.7174, test_loss: 0.9005, test_f1: 0.5845
 epoch: 38, train_loss: 0.7167, test_loss: 0.8809, test_f1: 0.5914
 epoch: 39, train_loss: 0.7042, test_loss: 0.8974, test_f1: 0.6028
 epoch: 40, train_loss: 0.6988, test_loss: 0.9147, test_f1: 0.6105
 epoch: 41, train_loss: 0.6939, test_loss: 0.9073, test_f1: 0.6043
 epoch: 42, train_loss: 0.6860, test_loss: 0.9146, test_f1: 0.6162
 epoch: 43, train_loss: 0.6763, test_loss: 0.8921, test_f1: 0.6030
 epoch: 44, train_loss: 0.6819, test_loss: 0.8965, test_f1: 0.6136
 epoch: 45, train_loss: 0.6663, test_loss: 0.8932, test_f1: 0.6386
 epoch: 46, train_loss: 0.6734, test_loss: 0.9193, test_f1: 0.6102
 epoch: 47, train_loss: 0.6528, test_loss: 0.9046, test_f1: 0.6135
 epoch: 48, train_loss: 0.6606, test_loss: 0.9158, test_f1: 0.6181
 epoch: 49, train_loss: 0.6495, test_loss: 0.9055, test_f1: 0.6208
 epoch: 50, train_loss: 0.6451, test_loss: 0.9044, test_f1: 0.6096
 epoch: 51, train_loss: 0.6349, test_loss: 0.9226, test_f1: 0.6086
 epoch: 52, train_loss: 0.6149, test_loss: 0.9058, test_f1: 0.6114
 epoch: 53, train_loss: 0.6192, test_loss: 0.9002, test_f1: 0.6204
 epoch: 54, train_loss: 0.6103, test_loss: 0.9070, test_f1: 0.6217
 epoch: 55, train_loss: 0.6211, test_loss: 0.8959, test_f1: 0.6302
 epoch: 56, train_loss: 0.5967, test_loss: 0.9097, test_f1: 0.6223
 epoch: 57, train_loss: 0.6122, test_loss: 0.9007, test_f1: 0.6183
 epoch: 58, train_loss: 0.5973, test_loss: 0.9096, test_f1: 0.6370
 epoch: 59, train_loss: 0.5998, test_loss: 0.9227, test_f1: 0.6318
 epoch: 60, train_loss: 0.6034, test_loss: 0.9193, test_f1: 0.6158
 epoch: 61, train_loss: 0.6085, test_loss: 0.9282, test_f1: 0.6153
 epoch: 62, train_loss: 0.5874, test_loss: 0.9264, test_f1: 0.6266
 epoch: 63, train_loss: 0.5939, test_loss: 0.9251, test_f1: 0.6208
 epoch: 64, train_loss: 0.5949, test_loss: 0.9140, test_f1: 0.6266
 epoch: 65, train_loss: 0.5717, test_loss: 0.9293, test_f1: 0.6229
 epoch: 66, train_loss: 0.5689, test_loss: 0.9304, test_f1: 0.6266
 epoch: 67, train_loss: 0.5793, test_loss: 0.9401, test_f1: 0.6285
 epoch: 68, train_loss: 0.5818, test_loss: 0.9363, test_f1: 0.6098
 epoch: 69, train_loss: 0.5877, test_loss: 0.9506, test_f1: 0.6177
 epoch: 70, train_loss: 0.5683, test_loss: 0.9283, test_f1: 0.6316
 epoch: 71, train_loss: 0.5791, test_loss: 0.9335, test_f1: 0.6406
 epoch: 72, train_loss: 0.5687, test_loss: 0.9515, test_f1: 0.6252
 epoch: 73, train_loss: 0.5653, test_loss: 0.9549, test_f1: 0.6244
 epoch: 74, train_loss: 0.5445, test_loss: 0.9417, test_f1: 0.6146
 epoch: 75, train_loss: 0.5565, test_loss: 0.9644, test_f1: 0.6221
 epoch: 76, train_loss: 0.5587, test_loss: 0.9491, test_f1: 0.6271
 epoch: 77, train_loss: 0.5583, test_loss: 0.9469, test_f1: 0.6255
 epoch: 78, train_loss: 0.5531, test_loss: 0.9449, test_f1: 0.6425
 epoch: 79, train_loss: 0.5558, test_loss: 0.9856, test_f1: 0.6148
 epoch: 80, train_loss: 0.5521, test_loss: 0.9712, test_f1: 0.6310
 epoch: 81, train_loss: 0.5492, test_loss: 0.9846, test_f1: 0.6347
 epoch: 82, train_loss: 0.5473, test_loss: 0.9648, test_f1: 0.6202
 epoch: 83, train_loss: 0.5292, test_loss: 0.9671, test_f1: 0.6317
 epoch: 84, train_loss: 0.5267, test_loss: 0.9629, test_f1: 0.6501
 epoch: 85, train_loss: 0.5216, test_loss: 0.9982, test_f1: 0.6252
 epoch: 86, train_loss: 0.5330, test_loss: 0.9905, test_f1: 0.6253
 epoch: 87, train_loss: 0.5189, test_loss: 0.9838, test_f1: 0.6359
 epoch: 88, train_loss: 0.5278, test_loss: 0.9684, test_f1: 0.6357
 epoch: 89, train_loss: 0.5227, test_loss: 0.9956, test_f1: 0.6356
 epoch: 90, train_loss: 0.5054, test_loss: 0.9640, test_f1: 0.6462
 epoch: 91, train_loss: 0.5158, test_loss: 1.0046, test_f1: 0.6284
 epoch: 92, train_loss: 0.5101, test_loss: 0.9976, test_f1: 0.6332
 epoch: 93, train_loss: 0.5159, test_loss: 1.0064, test_f1: 0.6329
 epoch: 94, train_loss: 0.5090, test_loss: 1.0029, test_f1: 0.6264
 epoch: 95, train_loss: 0.5197, test_loss: 1.0016, test_f1: 0.6379
 epoch: 96, train_loss: 0.5150, test_loss: 0.9922, test_f1: 0.6474
 epoch: 97, train_loss: 0.5078, test_loss: 1.0106, test_f1: 0.6355
 epoch: 98, train_loss: 0.5157, test_loss: 0.9971, test_f1: 0.6248
 epoch: 99, train_loss: 0.4892, test_loss: 0.9941, test_f1: 0.6482
##################ITERATION #9 ****************************************
 epoch: 0, train_loss: 1.2958, test_loss: 1.3120, test_f1: 0.2270
 epoch: 1, train_loss: 1.1375, test_loss: 1.3663, test_f1: 0.2154
 epoch: 2, train_loss: 1.0976, test_loss: 1.2907, test_f1: 0.2860
 epoch: 3, train_loss: 1.0610, test_loss: 1.1407, test_f1: 0.4479
 epoch: 4, train_loss: 1.0266, test_loss: 1.1064, test_f1: 0.4296
 epoch: 5, train_loss: 1.0181, test_loss: 1.0624, test_f1: 0.4532
 epoch: 6, train_loss: 1.0043, test_loss: 0.9884, test_f1: 0.4667
 epoch: 7, train_loss: 0.9861, test_loss: 0.9520, test_f1: 0.5298
 epoch: 8, train_loss: 0.9624, test_loss: 0.9587, test_f1: 0.5177
 epoch: 9, train_loss: 0.9536, test_loss: 0.9470, test_f1: 0.5190
 epoch: 10, train_loss: 0.9378, test_loss: 0.9436, test_f1: 0.5283
 epoch: 11, train_loss: 0.9257, test_loss: 0.9362, test_f1: 0.5262
 epoch: 12, train_loss: 0.9034, test_loss: 0.9195, test_f1: 0.5209
 epoch: 13, train_loss: 0.9067, test_loss: 0.9298, test_f1: 0.5204
 epoch: 14, train_loss: 0.8854, test_loss: 0.9267, test_f1: 0.5477
 epoch: 15, train_loss: 0.8781, test_loss: 0.9476, test_f1: 0.5537
 epoch: 16, train_loss: 0.8709, test_loss: 0.9422, test_f1: 0.5533
 epoch: 17, train_loss: 0.8663, test_loss: 0.9422, test_f1: 0.5631
 epoch: 18, train_loss: 0.8409, test_loss: 0.9296, test_f1: 0.5644
 epoch: 19, train_loss: 0.8442, test_loss: 0.9252, test_f1: 0.5519
 epoch: 20, train_loss: 0.8336, test_loss: 0.9187, test_f1: 0.5712
 epoch: 21, train_loss: 0.8291, test_loss: 0.9217, test_f1: 0.5900
 epoch: 22, train_loss: 0.8145, test_loss: 0.9194, test_f1: 0.5872
 epoch: 23, train_loss: 0.8193, test_loss: 0.9400, test_f1: 0.5818
 epoch: 24, train_loss: 0.7928, test_loss: 0.9520, test_f1: 0.5818
 epoch: 25, train_loss: 0.7932, test_loss: 0.9584, test_f1: 0.5667
 epoch: 26, train_loss: 0.7884, test_loss: 0.9233, test_f1: 0.5830
 epoch: 27, train_loss: 0.7814, test_loss: 0.9502, test_f1: 0.5634
 epoch: 28, train_loss: 0.7785, test_loss: 0.9711, test_f1: 0.5631
 epoch: 29, train_loss: 0.7697, test_loss: 0.9249, test_f1: 0.5962
 epoch: 30, train_loss: 0.7572, test_loss: 0.9257, test_f1: 0.5919
 epoch: 31, train_loss: 0.7464, test_loss: 0.9403, test_f1: 0.5911
 epoch: 32, train_loss: 0.7459, test_loss: 0.9318, test_f1: 0.5873
 epoch: 33, train_loss: 0.7420, test_loss: 0.9310, test_f1: 0.5923
 epoch: 34, train_loss: 0.7282, test_loss: 0.9155, test_f1: 0.6013
 epoch: 35, train_loss: 0.7229, test_loss: 0.9473, test_f1: 0.5865
 epoch: 36, train_loss: 0.7246, test_loss: 0.9400, test_f1: 0.5873
 epoch: 37, train_loss: 0.7190, test_loss: 0.9317, test_f1: 0.6030
 epoch: 38, train_loss: 0.7034, test_loss: 0.9502, test_f1: 0.6054
 epoch: 39, train_loss: 0.7088, test_loss: 0.9412, test_f1: 0.5907
 epoch: 40, train_loss: 0.7031, test_loss: 0.9122, test_f1: 0.6133
 epoch: 41, train_loss: 0.6825, test_loss: 0.9447, test_f1: 0.6077
 epoch: 42, train_loss: 0.6929, test_loss: 0.9515, test_f1: 0.6029
 epoch: 43, train_loss: 0.6832, test_loss: 0.9571, test_f1: 0.5969
 epoch: 44, train_loss: 0.6878, test_loss: 0.9701, test_f1: 0.5899
 epoch: 45, train_loss: 0.6797, test_loss: 0.9459, test_f1: 0.5971
 epoch: 46, train_loss: 0.6667, test_loss: 0.9552, test_f1: 0.6128
 epoch: 47, train_loss: 0.6610, test_loss: 0.9619, test_f1: 0.6190
 epoch: 48, train_loss: 0.6402, test_loss: 0.9784, test_f1: 0.6146
 epoch: 49, train_loss: 0.6622, test_loss: 0.9287, test_f1: 0.6054
 epoch: 50, train_loss: 0.6532, test_loss: 0.9548, test_f1: 0.6181
 epoch: 51, train_loss: 0.6345, test_loss: 0.9573, test_f1: 0.6137
 epoch: 52, train_loss: 0.6365, test_loss: 0.9709, test_f1: 0.5984
 epoch: 53, train_loss: 0.6155, test_loss: 0.9612, test_f1: 0.6286
 epoch: 54, train_loss: 0.6104, test_loss: 0.9731, test_f1: 0.6058
 epoch: 55, train_loss: 0.6210, test_loss: 0.9692, test_f1: 0.6109
 epoch: 56, train_loss: 0.6169, test_loss: 0.9687, test_f1: 0.6010
 epoch: 57, train_loss: 0.6110, test_loss: 0.9734, test_f1: 0.6104
 epoch: 58, train_loss: 0.6089, test_loss: 0.9738, test_f1: 0.6145
 epoch: 59, train_loss: 0.5915, test_loss: 0.9557, test_f1: 0.6246
 epoch: 60, train_loss: 0.5906, test_loss: 0.9601, test_f1: 0.6189
 epoch: 61, train_loss: 0.5949, test_loss: 0.9689, test_f1: 0.6164
 epoch: 62, train_loss: 0.6069, test_loss: 0.9771, test_f1: 0.6141
 epoch: 63, train_loss: 0.5903, test_loss: 0.9599, test_f1: 0.6288
 epoch: 64, train_loss: 0.5786, test_loss: 0.9802, test_f1: 0.6228
 epoch: 65, train_loss: 0.5776, test_loss: 0.9738, test_f1: 0.6290
 epoch: 66, train_loss: 0.5759, test_loss: 0.9852, test_f1: 0.6117
 epoch: 67, train_loss: 0.5757, test_loss: 0.9617, test_f1: 0.6396
 epoch: 68, train_loss: 0.5771, test_loss: 0.9626, test_f1: 0.6279
 epoch: 69, train_loss: 0.5699, test_loss: 0.9748, test_f1: 0.6414
 epoch: 70, train_loss: 0.5838, test_loss: 0.9996, test_f1: 0.6235
 epoch: 71, train_loss: 0.5798, test_loss: 0.9947, test_f1: 0.6128
 epoch: 72, train_loss: 0.5651, test_loss: 0.9919, test_f1: 0.6356
 epoch: 73, train_loss: 0.5741, test_loss: 0.9893, test_f1: 0.6229
 epoch: 74, train_loss: 0.5733, test_loss: 0.9964, test_f1: 0.6213
 epoch: 75, train_loss: 0.5626, test_loss: 0.9937, test_f1: 0.6315
 epoch: 76, train_loss: 0.5572, test_loss: 0.9835, test_f1: 0.6235
 epoch: 77, train_loss: 0.5511, test_loss: 0.9761, test_f1: 0.6336
 epoch: 78, train_loss: 0.5558, test_loss: 1.0007, test_f1: 0.6397
 epoch: 79, train_loss: 0.5480, test_loss: 0.9871, test_f1: 0.6351
 epoch: 80, train_loss: 0.5426, test_loss: 1.0214, test_f1: 0.6195
 epoch: 81, train_loss: 0.5404, test_loss: 1.0269, test_f1: 0.6204
 epoch: 82, train_loss: 0.5384, test_loss: 1.0118, test_f1: 0.6374
 epoch: 83, train_loss: 0.5362, test_loss: 1.0203, test_f1: 0.6314
 epoch: 84, train_loss: 0.5378, test_loss: 1.0224, test_f1: 0.6429
 epoch: 85, train_loss: 0.5339, test_loss: 1.0328, test_f1: 0.6345
 epoch: 86, train_loss: 0.5357, test_loss: 1.0292, test_f1: 0.6513
 epoch: 87, train_loss: 0.5324, test_loss: 1.0386, test_f1: 0.6450
 epoch: 88, train_loss: 0.5270, test_loss: 1.0316, test_f1: 0.6355
 epoch: 89, train_loss: 0.5330, test_loss: 1.0279, test_f1: 0.6498
 epoch: 90, train_loss: 0.5207, test_loss: 1.0596, test_f1: 0.6287
 epoch: 91, train_loss: 0.5243, test_loss: 1.0567, test_f1: 0.6377
 epoch: 92, train_loss: 0.5164, test_loss: 1.0306, test_f1: 0.6370
 epoch: 93, train_loss: 0.5250, test_loss: 1.0332, test_f1: 0.6386
 epoch: 94, train_loss: 0.5322, test_loss: 1.0154, test_f1: 0.6545
 epoch: 95, train_loss: 0.5140, test_loss: 1.0336, test_f1: 0.6469
 epoch: 96, train_loss: 0.5111, test_loss: 1.0337, test_f1: 0.6439
 epoch: 97, train_loss: 0.5105, test_loss: 1.0631, test_f1: 0.6376
 epoch: 98, train_loss: 0.5023, test_loss: 1.0392, test_f1: 0.6478
 epoch: 99, train_loss: 0.5021, test_loss: 1.0644, test_f1: 0.6474

Training completed in 454.83 seconds
Best F1: 0.6595 at epoch 81
Mean F1 across iterations: 0.6441  0.0106
========================FINAL RESULTS================================
FEGIN weighted F1: 0.6595  0.0106
python main.py --data ltspice_examples --representation component_net --model FEGIN --layers 6 --hiddens 128 --batch_size 256 --lr 0.0001 --emb_size 512 --epochs 100 --save_appendix component_net_L6_H128_BS256_LR0.0001_E512 --no_val
-----



STDERR:
  File "main.py", line 370, in <module>
    main()
  File "main.py", line 254, in main
    dataset = dataset_class(
  File "/home/philip/projects/ltspice_examples_code_repo/Circuit-Completion-Using-GNNs/component_classification_with_link_prediction_head/evaluation/FEGIN/kernel/circuit_datasets.py", line 15, in __init__
    self.data, self.slices = torch.load(self.processed_paths[0])
  File "/home/philip/.local/lib/python3.8/site-packages/torch/serialization.py", line 1040, in load
    warnings.warn(
  File "/usr/lib/python3.8/warnings.py", line 109, in _showwarnmsg
    sw(msg.message, msg.category, msg.filename, msg.lineno,
  File "main.py", line 47, in warn_with_traceback
    traceback.print_stack(file=log)
/home/philip/projects/ltspice_examples_code_repo/Circuit-Completion-Using-GNNs/component_classification_with_link_prediction_head/evaluation/FEGIN/kernel/circuit_datasets.py:15: FutureWarning: You are using `torch.load` with `weights_only=False` (the current default value), which uses the default pickle module implicitly. It is possible to construct malicious pickle data which will execute arbitrary code during unpickling (See https://github.com/pytorch/pytorch/blob/main/SECURITY.md#untrusted-models for more details). In a future release, the default value for `weights_only` will be flipped to `True`. This limits the functions that could be executed during unpickling. Arbitrary objects will no longer be allowed to be loaded via this mode unless they are explicitly allowlisted by the user via `torch.serialization.add_safe_globals`. We recommend you start setting `weights_only=True` for any use case where you don't have full control of the loaded file. Please open an issue on GitHub for any issues related to this experimental feature.
  self.data, self.slices = torch.load(self.processed_paths[0])
