STDOUT:
Results will be saved in /home/philip/projects/ltspice_examples_code_repo/Circuit-Completion-Using-GNNs/component_classification_with_link_prediction_head/evaluation/FEGIN/results/model_FEGIN_dataset_ltspice_examples
Command line input: python main.py --data ltspice_examples --representation component_pin --model FEGIN --layers 3 --hiddens 32 --batch_size 128 --lr 0.01 --emb_size 128 --epochs 100 --save_appendix component_pin_L3_H32_BS128_LR0.01_E128 --no_val
 is saved.
-----
ltspice_examples - FEGIN
Using 3 layers, 32 hidden units, h = 2
Loading component_pin representation dataset
ENTERED
Training FEGIN on component_pin representation
Train: 3560, Test: 848
##################ITERATION #0 ****************************************
 epoch: 0, train_loss: 1.2494, test_loss: 1.3378, test_f1: 0.2286
 epoch: 1, train_loss: 1.1004, test_loss: 1.0158, test_f1: 0.3640
 epoch: 2, train_loss: 1.0299, test_loss: 1.0279, test_f1: 0.5031
 epoch: 3, train_loss: 0.9557, test_loss: 0.9662, test_f1: 0.4664
 epoch: 4, train_loss: 0.9191, test_loss: 0.9865, test_f1: 0.5144
 epoch: 5, train_loss: 0.8975, test_loss: 0.9739, test_f1: 0.5416
 epoch: 6, train_loss: 0.9038, test_loss: 0.9507, test_f1: 0.5381
 epoch: 7, train_loss: 0.8831, test_loss: 0.9571, test_f1: 0.5077
 epoch: 8, train_loss: 0.8501, test_loss: 0.8771, test_f1: 0.5145
 epoch: 9, train_loss: 0.8348, test_loss: 0.8817, test_f1: 0.5798
 epoch: 10, train_loss: 0.8297, test_loss: 0.8692, test_f1: 0.5354
 epoch: 11, train_loss: 0.8086, test_loss: 0.8726, test_f1: 0.5661
 epoch: 12, train_loss: 0.7986, test_loss: 0.9414, test_f1: 0.5276
 epoch: 13, train_loss: 0.8061, test_loss: 0.9842, test_f1: 0.5333
 epoch: 14, train_loss: 0.8142, test_loss: 1.0252, test_f1: 0.5146
 epoch: 15, train_loss: 0.7890, test_loss: 0.8818, test_f1: 0.5535
 epoch: 16, train_loss: 0.7769, test_loss: 0.9633, test_f1: 0.5252
 epoch: 17, train_loss: 0.7642, test_loss: 0.8933, test_f1: 0.5837
 epoch: 18, train_loss: 0.7793, test_loss: 0.8679, test_f1: 0.5375
 epoch: 19, train_loss: 0.7608, test_loss: 1.0035, test_f1: 0.5379
 epoch: 20, train_loss: 0.7806, test_loss: 0.9720, test_f1: 0.4801
 epoch: 21, train_loss: 0.7655, test_loss: 0.8873, test_f1: 0.5342
 epoch: 22, train_loss: 0.7364, test_loss: 0.9048, test_f1: 0.5614
 epoch: 23, train_loss: 0.7348, test_loss: 0.9438, test_f1: 0.5394
 epoch: 24, train_loss: 0.7216, test_loss: 0.9565, test_f1: 0.5704
 epoch: 25, train_loss: 0.7430, test_loss: 1.0552, test_f1: 0.5209
 epoch: 26, train_loss: 0.7525, test_loss: 0.9146, test_f1: 0.5500
 epoch: 27, train_loss: 0.7457, test_loss: 0.8349, test_f1: 0.6086
 epoch: 28, train_loss: 0.7437, test_loss: 0.9155, test_f1: 0.5439
 epoch: 29, train_loss: 0.7236, test_loss: 0.9002, test_f1: 0.5982
 epoch: 30, train_loss: 0.7122, test_loss: 0.9088, test_f1: 0.5937
 epoch: 31, train_loss: 0.7146, test_loss: 0.8923, test_f1: 0.6145
 epoch: 32, train_loss: 0.7007, test_loss: 0.8425, test_f1: 0.6340
 epoch: 33, train_loss: 0.6981, test_loss: 0.8914, test_f1: 0.6202
 epoch: 34, train_loss: 0.6909, test_loss: 0.8223, test_f1: 0.5983
 epoch: 35, train_loss: 0.6893, test_loss: 0.9979, test_f1: 0.5216
 epoch: 36, train_loss: 0.6702, test_loss: 0.8518, test_f1: 0.5730
 epoch: 37, train_loss: 0.6721, test_loss: 0.9560, test_f1: 0.6129
 epoch: 38, train_loss: 0.6855, test_loss: 1.1067, test_f1: 0.4864
 epoch: 39, train_loss: 0.6572, test_loss: 0.8800, test_f1: 0.6135
 epoch: 40, train_loss: 0.6700, test_loss: 0.8255, test_f1: 0.5701
 epoch: 41, train_loss: 0.6466, test_loss: 0.8876, test_f1: 0.6119
 epoch: 42, train_loss: 0.6654, test_loss: 0.8682, test_f1: 0.6757
 epoch: 43, train_loss: 0.6570, test_loss: 0.9695, test_f1: 0.5688
 epoch: 44, train_loss: 0.6480, test_loss: 0.8632, test_f1: 0.5658
 epoch: 45, train_loss: 0.6378, test_loss: 0.8799, test_f1: 0.6264
 epoch: 46, train_loss: 0.6511, test_loss: 0.9127, test_f1: 0.6165
 epoch: 47, train_loss: 0.6892, test_loss: 0.8841, test_f1: 0.6137
 epoch: 48, train_loss: 0.7134, test_loss: 0.8313, test_f1: 0.6412
 epoch: 49, train_loss: 0.6757, test_loss: 0.9165, test_f1: 0.5822
 epoch: 50, train_loss: 0.6563, test_loss: 0.8699, test_f1: 0.5859
 epoch: 51, train_loss: 0.6261, test_loss: 0.8990, test_f1: 0.6643
 epoch: 52, train_loss: 0.6072, test_loss: 0.8377, test_f1: 0.6439
 epoch: 53, train_loss: 0.5946, test_loss: 0.8565, test_f1: 0.6268
 epoch: 54, train_loss: 0.5836, test_loss: 0.8668, test_f1: 0.6586
 epoch: 55, train_loss: 0.5793, test_loss: 0.8448, test_f1: 0.6812
 epoch: 56, train_loss: 0.5616, test_loss: 0.8259, test_f1: 0.6456
 epoch: 57, train_loss: 0.5754, test_loss: 0.8452, test_f1: 0.6691
 epoch: 58, train_loss: 0.5754, test_loss: 0.8072, test_f1: 0.6680
 epoch: 59, train_loss: 0.5670, test_loss: 0.9149, test_f1: 0.6125
 epoch: 60, train_loss: 0.5824, test_loss: 0.8530, test_f1: 0.6529
 epoch: 61, train_loss: 0.5618, test_loss: 0.8669, test_f1: 0.6440
 epoch: 62, train_loss: 0.5644, test_loss: 0.8372, test_f1: 0.6378
 epoch: 63, train_loss: 0.5630, test_loss: 0.8297, test_f1: 0.6277
 epoch: 64, train_loss: 0.5539, test_loss: 0.9036, test_f1: 0.6416
 epoch: 65, train_loss: 0.5591, test_loss: 0.8332, test_f1: 0.6668
 epoch: 66, train_loss: 0.5527, test_loss: 0.8387, test_f1: 0.6760
 epoch: 67, train_loss: 0.5507, test_loss: 0.8459, test_f1: 0.6662
 epoch: 68, train_loss: 0.5408, test_loss: 0.8787, test_f1: 0.6505
 epoch: 69, train_loss: 0.5482, test_loss: 0.8389, test_f1: 0.6634
 epoch: 70, train_loss: 0.5728, test_loss: 0.8809, test_f1: 0.6116
 epoch: 71, train_loss: 0.5863, test_loss: 0.9052, test_f1: 0.6324
 epoch: 72, train_loss: 0.5464, test_loss: 0.7587, test_f1: 0.6849
 epoch: 73, train_loss: 0.5362, test_loss: 0.8221, test_f1: 0.6607
 epoch: 74, train_loss: 0.5298, test_loss: 0.8022, test_f1: 0.6532
 epoch: 75, train_loss: 0.5266, test_loss: 0.8747, test_f1: 0.6520
 epoch: 76, train_loss: 0.5178, test_loss: 0.8337, test_f1: 0.6787
 epoch: 77, train_loss: 0.5415, test_loss: 0.8596, test_f1: 0.6460
 epoch: 78, train_loss: 0.5161, test_loss: 0.8574, test_f1: 0.6610
 epoch: 79, train_loss: 0.5009, test_loss: 0.8456, test_f1: 0.6757
 epoch: 80, train_loss: 0.5356, test_loss: 0.9353, test_f1: 0.6191
 epoch: 81, train_loss: 0.5333, test_loss: 0.8633, test_f1: 0.6424
 epoch: 82, train_loss: 0.5299, test_loss: 0.9423, test_f1: 0.5963
 epoch: 83, train_loss: 0.5041, test_loss: 0.8808, test_f1: 0.6590
 epoch: 84, train_loss: 0.5161, test_loss: 0.9304, test_f1: 0.6532
 epoch: 85, train_loss: 0.5057, test_loss: 0.9743, test_f1: 0.6815
 epoch: 86, train_loss: 0.5229, test_loss: 0.7663, test_f1: 0.6630
 epoch: 87, train_loss: 0.5151, test_loss: 0.8470, test_f1: 0.6595
 epoch: 88, train_loss: 0.5169, test_loss: 0.8282, test_f1: 0.6449
 epoch: 89, train_loss: 0.4968, test_loss: 0.8180, test_f1: 0.6678
 epoch: 90, train_loss: 0.5242, test_loss: 0.7851, test_f1: 0.6671
 epoch: 91, train_loss: 0.5172, test_loss: 0.7816, test_f1: 0.6479
 epoch: 92, train_loss: 0.5192, test_loss: 0.9802, test_f1: 0.6307
 epoch: 93, train_loss: 0.4755, test_loss: 0.8415, test_f1: 0.6870
 epoch: 94, train_loss: 0.5065, test_loss: 0.8929, test_f1: 0.6582
 epoch: 95, train_loss: 0.4904, test_loss: 0.8284, test_f1: 0.6834
 epoch: 96, train_loss: 0.4976, test_loss: 0.8483, test_f1: 0.6610
 epoch: 97, train_loss: 0.5020, test_loss: 0.8945, test_f1: 0.6627
 epoch: 98, train_loss: 0.5031, test_loss: 0.8020, test_f1: 0.6631
 epoch: 99, train_loss: 0.4908, test_loss: 0.8684, test_f1: 0.6654
##################ITERATION #1 ****************************************
 epoch: 0, train_loss: 1.2544, test_loss: 1.1562, test_f1: 0.3253
 epoch: 1, train_loss: 1.0684, test_loss: 1.0398, test_f1: 0.3882
 epoch: 2, train_loss: 1.0096, test_loss: 1.0200, test_f1: 0.4244
 epoch: 3, train_loss: 1.0006, test_loss: 1.1509, test_f1: 0.4039
 epoch: 4, train_loss: 0.9688, test_loss: 0.9977, test_f1: 0.5139
 epoch: 5, train_loss: 0.9384, test_loss: 1.0498, test_f1: 0.4161
 epoch: 6, train_loss: 0.9252, test_loss: 1.0610, test_f1: 0.4698
 epoch: 7, train_loss: 0.9195, test_loss: 1.0374, test_f1: 0.4915
 epoch: 8, train_loss: 0.8911, test_loss: 0.9503, test_f1: 0.4983
 epoch: 9, train_loss: 0.8568, test_loss: 0.9629, test_f1: 0.5165
 epoch: 10, train_loss: 0.8497, test_loss: 1.0118, test_f1: 0.5314
 epoch: 11, train_loss: 0.8714, test_loss: 0.9668, test_f1: 0.4876
 epoch: 12, train_loss: 0.8464, test_loss: 0.8946, test_f1: 0.5152
 epoch: 13, train_loss: 0.8371, test_loss: 0.9258, test_f1: 0.5455
 epoch: 14, train_loss: 0.8384, test_loss: 0.8955, test_f1: 0.5605
 epoch: 15, train_loss: 0.7963, test_loss: 1.1424, test_f1: 0.4229
 epoch: 16, train_loss: 0.8033, test_loss: 0.9547, test_f1: 0.5537
 epoch: 17, train_loss: 0.8199, test_loss: 1.1505, test_f1: 0.5102
 epoch: 18, train_loss: 0.7922, test_loss: 0.7754, test_f1: 0.6092
 epoch: 19, train_loss: 0.7841, test_loss: 0.8391, test_f1: 0.5928
 epoch: 20, train_loss: 0.7749, test_loss: 0.9249, test_f1: 0.5584
 epoch: 21, train_loss: 0.7739, test_loss: 0.7400, test_f1: 0.6482
 epoch: 22, train_loss: 0.8037, test_loss: 1.0184, test_f1: 0.5203
 epoch: 23, train_loss: 0.8299, test_loss: 1.2965, test_f1: 0.4272
 epoch: 24, train_loss: 0.8329, test_loss: 0.9143, test_f1: 0.5143
 epoch: 25, train_loss: 0.7964, test_loss: 1.0715, test_f1: 0.4536
 epoch: 26, train_loss: 0.7793, test_loss: 1.1185, test_f1: 0.5174
 epoch: 27, train_loss: 0.7742, test_loss: 0.8419, test_f1: 0.5386
 epoch: 28, train_loss: 0.7609, test_loss: 0.8897, test_f1: 0.5477
 epoch: 29, train_loss: 0.7764, test_loss: 1.0802, test_f1: 0.4998
 epoch: 30, train_loss: 0.7647, test_loss: 0.8835, test_f1: 0.5565
 epoch: 31, train_loss: 0.7576, test_loss: 0.9820, test_f1: 0.5109
 epoch: 32, train_loss: 0.7757, test_loss: 0.9219, test_f1: 0.5261
 epoch: 33, train_loss: 0.7759, test_loss: 0.9441, test_f1: 0.5175
 epoch: 34, train_loss: 0.7610, test_loss: 0.8734, test_f1: 0.5500
 epoch: 35, train_loss: 0.7493, test_loss: 0.8508, test_f1: 0.5588
 epoch: 36, train_loss: 0.7269, test_loss: 0.8687, test_f1: 0.6146
 epoch: 37, train_loss: 0.7339, test_loss: 0.9015, test_f1: 0.5984
 epoch: 38, train_loss: 0.7526, test_loss: 0.8349, test_f1: 0.5424
 epoch: 39, train_loss: 0.7229, test_loss: 0.8666, test_f1: 0.5945
 epoch: 40, train_loss: 0.7410, test_loss: 0.7596, test_f1: 0.6214
 epoch: 41, train_loss: 0.7155, test_loss: 0.8673, test_f1: 0.5331
 epoch: 42, train_loss: 0.6959, test_loss: 0.9404, test_f1: 0.5863
 epoch: 43, train_loss: 0.6862, test_loss: 0.9093, test_f1: 0.5521
 epoch: 44, train_loss: 0.7012, test_loss: 0.8739, test_f1: 0.5951
 epoch: 45, train_loss: 0.6881, test_loss: 0.9041, test_f1: 0.6183
 epoch: 46, train_loss: 0.7056, test_loss: 1.0908, test_f1: 0.4745
 epoch: 47, train_loss: 0.7099, test_loss: 0.8537, test_f1: 0.6287
 epoch: 48, train_loss: 0.6959, test_loss: 1.1530, test_f1: 0.4705
 epoch: 49, train_loss: 0.6813, test_loss: 0.9964, test_f1: 0.5336
 epoch: 50, train_loss: 0.6743, test_loss: 0.7362, test_f1: 0.5918
 epoch: 51, train_loss: 0.6499, test_loss: 0.8876, test_f1: 0.5978
 epoch: 52, train_loss: 0.6329, test_loss: 0.9060, test_f1: 0.6233
 epoch: 53, train_loss: 0.6209, test_loss: 0.7909, test_f1: 0.6203
 epoch: 54, train_loss: 0.6048, test_loss: 0.9071, test_f1: 0.6337
 epoch: 55, train_loss: 0.6211, test_loss: 0.9070, test_f1: 0.6212
 epoch: 56, train_loss: 0.6135, test_loss: 0.9015, test_f1: 0.6239
 epoch: 57, train_loss: 0.6070, test_loss: 0.8876, test_f1: 0.6142
 epoch: 58, train_loss: 0.6009, test_loss: 0.9296, test_f1: 0.6116
 epoch: 59, train_loss: 0.6028, test_loss: 0.9315, test_f1: 0.6496
 epoch: 60, train_loss: 0.6069, test_loss: 0.9421, test_f1: 0.6097
 epoch: 61, train_loss: 0.6084, test_loss: 0.9471, test_f1: 0.6071
 epoch: 62, train_loss: 0.5901, test_loss: 0.9718, test_f1: 0.6101
 epoch: 63, train_loss: 0.5888, test_loss: 0.8414, test_f1: 0.6031
 epoch: 64, train_loss: 0.6072, test_loss: 0.9089, test_f1: 0.6243
 epoch: 65, train_loss: 0.5857, test_loss: 0.8333, test_f1: 0.6331
 epoch: 66, train_loss: 0.6033, test_loss: 0.7466, test_f1: 0.6520
 epoch: 67, train_loss: 0.5988, test_loss: 0.9809, test_f1: 0.6123
 epoch: 68, train_loss: 0.5632, test_loss: 0.7659, test_f1: 0.6523
 epoch: 69, train_loss: 0.5685, test_loss: 0.9333, test_f1: 0.6297
 epoch: 70, train_loss: 0.5772, test_loss: 0.9891, test_f1: 0.6064
 epoch: 71, train_loss: 0.5708, test_loss: 0.9251, test_f1: 0.6339
 epoch: 72, train_loss: 0.5827, test_loss: 0.8550, test_f1: 0.6242
 epoch: 73, train_loss: 0.5676, test_loss: 0.8400, test_f1: 0.6471
 epoch: 74, train_loss: 0.5750, test_loss: 0.9331, test_f1: 0.5828
 epoch: 75, train_loss: 0.5899, test_loss: 0.8900, test_f1: 0.6135
 epoch: 76, train_loss: 0.5739, test_loss: 0.8576, test_f1: 0.6360
 epoch: 77, train_loss: 0.5659, test_loss: 0.9131, test_f1: 0.6527
 epoch: 78, train_loss: 0.5455, test_loss: 0.8122, test_f1: 0.6342
 epoch: 79, train_loss: 0.5607, test_loss: 0.8405, test_f1: 0.6243
 epoch: 80, train_loss: 0.5570, test_loss: 0.7421, test_f1: 0.6595
 epoch: 81, train_loss: 0.5427, test_loss: 1.0150, test_f1: 0.6032
 epoch: 82, train_loss: 0.5718, test_loss: 0.8694, test_f1: 0.6469
 epoch: 83, train_loss: 0.5488, test_loss: 0.8703, test_f1: 0.6055
 epoch: 84, train_loss: 0.5546, test_loss: 0.8263, test_f1: 0.6307
 epoch: 85, train_loss: 0.5668, test_loss: 0.8717, test_f1: 0.6258
 epoch: 86, train_loss: 0.5424, test_loss: 0.9012, test_f1: 0.6330
 epoch: 87, train_loss: 0.5376, test_loss: 1.2581, test_f1: 0.5944
 epoch: 88, train_loss: 0.5473, test_loss: 0.8521, test_f1: 0.6377
 epoch: 89, train_loss: 0.5514, test_loss: 1.0045, test_f1: 0.6108
 epoch: 90, train_loss: 0.5504, test_loss: 0.8441, test_f1: 0.6358
 epoch: 91, train_loss: 0.5369, test_loss: 0.9304, test_f1: 0.6372
 epoch: 92, train_loss: 0.5230, test_loss: 0.9310, test_f1: 0.6494
 epoch: 93, train_loss: 0.5083, test_loss: 0.8606, test_f1: 0.6397
 epoch: 94, train_loss: 0.5345, test_loss: 0.8738, test_f1: 0.6135
 epoch: 95, train_loss: 0.5484, test_loss: 0.7644, test_f1: 0.6686
 epoch: 96, train_loss: 0.5390, test_loss: 0.8098, test_f1: 0.6190
 epoch: 97, train_loss: 0.5195, test_loss: 0.7807, test_f1: 0.6108
 epoch: 98, train_loss: 0.5207, test_loss: 0.7992, test_f1: 0.6437
 epoch: 99, train_loss: 0.5084, test_loss: 0.8940, test_f1: 0.6359
##################ITERATION #2 ****************************************
 epoch: 0, train_loss: 1.1347, test_loss: 1.0725, test_f1: 0.4698
 epoch: 1, train_loss: 0.9974, test_loss: 0.9798, test_f1: 0.4529
 epoch: 2, train_loss: 0.9469, test_loss: 1.0327, test_f1: 0.4840
 epoch: 3, train_loss: 0.9071, test_loss: 0.9613, test_f1: 0.5100
 epoch: 4, train_loss: 0.9049, test_loss: 0.9595, test_f1: 0.5006
 epoch: 5, train_loss: 0.9042, test_loss: 0.9849, test_f1: 0.5120
 epoch: 6, train_loss: 0.8553, test_loss: 0.9210, test_f1: 0.5619
 epoch: 7, train_loss: 0.8608, test_loss: 0.9926, test_f1: 0.5034
 epoch: 8, train_loss: 0.8360, test_loss: 1.0412, test_f1: 0.5242
 epoch: 9, train_loss: 0.8480, test_loss: 0.9114, test_f1: 0.4992
 epoch: 10, train_loss: 0.8265, test_loss: 0.8904, test_f1: 0.5247
 epoch: 11, train_loss: 0.8096, test_loss: 0.8907, test_f1: 0.5274
 epoch: 12, train_loss: 0.8062, test_loss: 0.8558, test_f1: 0.5806
 epoch: 13, train_loss: 0.8086, test_loss: 0.8679, test_f1: 0.5383
 epoch: 14, train_loss: 0.7938, test_loss: 0.8446, test_f1: 0.6292
 epoch: 15, train_loss: 0.7898, test_loss: 0.8615, test_f1: 0.6073
 epoch: 16, train_loss: 0.7850, test_loss: 0.8921, test_f1: 0.5385
 epoch: 17, train_loss: 0.7755, test_loss: 0.8557, test_f1: 0.6129
 epoch: 18, train_loss: 0.7852, test_loss: 0.8190, test_f1: 0.5482
 epoch: 19, train_loss: 0.7893, test_loss: 0.9005, test_f1: 0.5658
 epoch: 20, train_loss: 0.7853, test_loss: 0.9252, test_f1: 0.4965
 epoch: 21, train_loss: 0.7670, test_loss: 0.8248, test_f1: 0.5746
 epoch: 22, train_loss: 0.7394, test_loss: 0.8977, test_f1: 0.5865
 epoch: 23, train_loss: 0.7623, test_loss: 0.8651, test_f1: 0.5567
 epoch: 24, train_loss: 0.7322, test_loss: 0.8281, test_f1: 0.6063
 epoch: 25, train_loss: 0.7339, test_loss: 0.9259, test_f1: 0.5797
 epoch: 26, train_loss: 0.7344, test_loss: 1.3217, test_f1: 0.4511
 epoch: 27, train_loss: 0.7471, test_loss: 0.8672, test_f1: 0.5173
 epoch: 28, train_loss: 0.7440, test_loss: 0.9365, test_f1: 0.5809
 epoch: 29, train_loss: 0.7274, test_loss: 0.8835, test_f1: 0.6041
 epoch: 30, train_loss: 0.7263, test_loss: 0.8537, test_f1: 0.6277
 epoch: 31, train_loss: 0.7417, test_loss: 0.8406, test_f1: 0.6144
 epoch: 32, train_loss: 0.7229, test_loss: 0.8623, test_f1: 0.6096
 epoch: 33, train_loss: 0.7216, test_loss: 0.8780, test_f1: 0.5900
 epoch: 34, train_loss: 0.7186, test_loss: 0.9885, test_f1: 0.5440
 epoch: 35, train_loss: 0.7053, test_loss: 0.8017, test_f1: 0.6472
 epoch: 36, train_loss: 0.7151, test_loss: 0.8139, test_f1: 0.6223
 epoch: 37, train_loss: 0.6827, test_loss: 0.8421, test_f1: 0.6417
 epoch: 38, train_loss: 0.7098, test_loss: 0.8759, test_f1: 0.6108
 epoch: 39, train_loss: 0.7068, test_loss: 1.0270, test_f1: 0.5867
 epoch: 40, train_loss: 0.7018, test_loss: 0.8488, test_f1: 0.6047
 epoch: 41, train_loss: 0.6959, test_loss: 0.8188, test_f1: 0.5721
 epoch: 42, train_loss: 0.6844, test_loss: 0.9022, test_f1: 0.5121
 epoch: 43, train_loss: 0.7142, test_loss: 0.8833, test_f1: 0.6010
 epoch: 44, train_loss: 0.6813, test_loss: 0.8434, test_f1: 0.6213
 epoch: 45, train_loss: 0.6713, test_loss: 0.8280, test_f1: 0.6668
 epoch: 46, train_loss: 0.6723, test_loss: 0.9141, test_f1: 0.5497
 epoch: 47, train_loss: 0.6664, test_loss: 0.8737, test_f1: 0.6283
 epoch: 48, train_loss: 0.6644, test_loss: 0.7874, test_f1: 0.5734
 epoch: 49, train_loss: 0.6777, test_loss: 1.0459, test_f1: 0.5877
 epoch: 50, train_loss: 0.6617, test_loss: 0.7725, test_f1: 0.6417
 epoch: 51, train_loss: 0.6638, test_loss: 0.7884, test_f1: 0.6547
 epoch: 52, train_loss: 0.6156, test_loss: 0.8101, test_f1: 0.6570
 epoch: 53, train_loss: 0.6075, test_loss: 0.7967, test_f1: 0.6512
 epoch: 54, train_loss: 0.6141, test_loss: 0.7957, test_f1: 0.6501
 epoch: 55, train_loss: 0.5973, test_loss: 0.7975, test_f1: 0.6443
 epoch: 56, train_loss: 0.5985, test_loss: 0.8047, test_f1: 0.6512
 epoch: 57, train_loss: 0.6058, test_loss: 0.7479, test_f1: 0.6572
 epoch: 58, train_loss: 0.5796, test_loss: 0.9317, test_f1: 0.6121
 epoch: 59, train_loss: 0.5759, test_loss: 0.7758, test_f1: 0.6637
 epoch: 60, train_loss: 0.5851, test_loss: 0.8946, test_f1: 0.6380
 epoch: 61, train_loss: 0.5833, test_loss: 0.8056, test_f1: 0.6988
 epoch: 62, train_loss: 0.5775, test_loss: 0.7994, test_f1: 0.6530
 epoch: 63, train_loss: 0.5736, test_loss: 0.8226, test_f1: 0.6491
 epoch: 64, train_loss: 0.5558, test_loss: 0.9195, test_f1: 0.6330
 epoch: 65, train_loss: 0.5615, test_loss: 0.7897, test_f1: 0.6485
 epoch: 66, train_loss: 0.5690, test_loss: 0.7894, test_f1: 0.6547
 epoch: 67, train_loss: 0.5666, test_loss: 0.8590, test_f1: 0.6181
 epoch: 68, train_loss: 0.5725, test_loss: 0.7917, test_f1: 0.6866
 epoch: 69, train_loss: 0.5605, test_loss: 0.8418, test_f1: 0.6619
 epoch: 70, train_loss: 0.5856, test_loss: 0.8003, test_f1: 0.6500
 epoch: 71, train_loss: 0.5642, test_loss: 0.8507, test_f1: 0.6369
 epoch: 72, train_loss: 0.5578, test_loss: 0.8514, test_f1: 0.6558
 epoch: 73, train_loss: 0.5461, test_loss: 0.9265, test_f1: 0.6246
 epoch: 74, train_loss: 0.5277, test_loss: 0.8645, test_f1: 0.6542
 epoch: 75, train_loss: 0.5586, test_loss: 0.8161, test_f1: 0.6640
 epoch: 76, train_loss: 0.5558, test_loss: 0.8133, test_f1: 0.6411
 epoch: 77, train_loss: 0.5339, test_loss: 0.7501, test_f1: 0.6582
 epoch: 78, train_loss: 0.5187, test_loss: 0.9250, test_f1: 0.6258
 epoch: 79, train_loss: 0.5349, test_loss: 0.8937, test_f1: 0.6312
 epoch: 80, train_loss: 0.5313, test_loss: 0.8154, test_f1: 0.6679
 epoch: 81, train_loss: 0.5166, test_loss: 0.7729, test_f1: 0.6930
 epoch: 82, train_loss: 0.5329, test_loss: 0.8013, test_f1: 0.6481
 epoch: 83, train_loss: 0.5383, test_loss: 0.7697, test_f1: 0.6669
 epoch: 84, train_loss: 0.5536, test_loss: 0.8814, test_f1: 0.6367
 epoch: 85, train_loss: 0.5426, test_loss: 0.8208, test_f1: 0.6685
 epoch: 86, train_loss: 0.5302, test_loss: 0.8271, test_f1: 0.6534
 epoch: 87, train_loss: 0.5215, test_loss: 0.8647, test_f1: 0.6548
 epoch: 88, train_loss: 0.5067, test_loss: 0.8537, test_f1: 0.6491
 epoch: 89, train_loss: 0.5145, test_loss: 0.7767, test_f1: 0.6666
 epoch: 90, train_loss: 0.5268, test_loss: 0.8347, test_f1: 0.6749
 epoch: 91, train_loss: 0.5328, test_loss: 0.8047, test_f1: 0.6754
 epoch: 92, train_loss: 0.5232, test_loss: 0.8632, test_f1: 0.6765
 epoch: 93, train_loss: 0.5050, test_loss: 0.8237, test_f1: 0.7153
 epoch: 94, train_loss: 0.5011, test_loss: 0.8569, test_f1: 0.6475
 epoch: 95, train_loss: 0.5288, test_loss: 0.9339, test_f1: 0.6391
 epoch: 96, train_loss: 0.5128, test_loss: 0.7968, test_f1: 0.6657
 epoch: 97, train_loss: 0.5151, test_loss: 1.0494, test_f1: 0.6065
 epoch: 98, train_loss: 0.5069, test_loss: 0.8441, test_f1: 0.6756
 epoch: 99, train_loss: 0.5255, test_loss: 0.8686, test_f1: 0.6300
##################ITERATION #3 ****************************************
 epoch: 0, train_loss: 1.1954, test_loss: 1.1679, test_f1: 0.3016
 epoch: 1, train_loss: 1.0160, test_loss: 1.1205, test_f1: 0.4112
 epoch: 2, train_loss: 0.9875, test_loss: 1.0650, test_f1: 0.4420
 epoch: 3, train_loss: 0.9399, test_loss: 1.6236, test_f1: 0.3705
 epoch: 4, train_loss: 0.9322, test_loss: 1.0818, test_f1: 0.4841
 epoch: 5, train_loss: 0.9010, test_loss: 0.9463, test_f1: 0.5316
 epoch: 6, train_loss: 0.9033, test_loss: 0.9300, test_f1: 0.5189
 epoch: 7, train_loss: 0.8903, test_loss: 0.9462, test_f1: 0.5447
 epoch: 8, train_loss: 0.8680, test_loss: 1.0499, test_f1: 0.5050
 epoch: 9, train_loss: 0.8498, test_loss: 0.9705, test_f1: 0.5013
 epoch: 10, train_loss: 0.8253, test_loss: 0.9796, test_f1: 0.5247
 epoch: 11, train_loss: 0.8379, test_loss: 0.9376, test_f1: 0.5495
 epoch: 12, train_loss: 0.8280, test_loss: 0.9761, test_f1: 0.5667
 epoch: 13, train_loss: 0.8276, test_loss: 0.9629, test_f1: 0.5362
 epoch: 14, train_loss: 0.8024, test_loss: 0.8819, test_f1: 0.5629
 epoch: 15, train_loss: 0.7948, test_loss: 0.8906, test_f1: 0.5586
 epoch: 16, train_loss: 0.8167, test_loss: 0.9698, test_f1: 0.5435
 epoch: 17, train_loss: 0.7842, test_loss: 0.9206, test_f1: 0.5889
 epoch: 18, train_loss: 0.7813, test_loss: 1.0258, test_f1: 0.5222
 epoch: 19, train_loss: 0.7573, test_loss: 0.9248, test_f1: 0.5536
 epoch: 20, train_loss: 0.7630, test_loss: 0.8855, test_f1: 0.5808
 epoch: 21, train_loss: 0.7643, test_loss: 0.8724, test_f1: 0.5772
 epoch: 22, train_loss: 0.7468, test_loss: 0.8509, test_f1: 0.6065
 epoch: 23, train_loss: 0.7679, test_loss: 0.8292, test_f1: 0.5624
 epoch: 24, train_loss: 0.7703, test_loss: 0.9106, test_f1: 0.5746
 epoch: 25, train_loss: 0.7408, test_loss: 0.8142, test_f1: 0.6055
 epoch: 26, train_loss: 0.7233, test_loss: 0.8892, test_f1: 0.6160
 epoch: 27, train_loss: 0.7283, test_loss: 0.7814, test_f1: 0.5948
 epoch: 28, train_loss: 0.7314, test_loss: 0.7752, test_f1: 0.6103
 epoch: 29, train_loss: 0.7079, test_loss: 0.8965, test_f1: 0.5584
 epoch: 30, train_loss: 0.7057, test_loss: 0.7682, test_f1: 0.6141
 epoch: 31, train_loss: 0.7276, test_loss: 0.8978, test_f1: 0.6154
 epoch: 32, train_loss: 0.7047, test_loss: 0.8772, test_f1: 0.6211
 epoch: 33, train_loss: 0.7063, test_loss: 0.7849, test_f1: 0.6218
 epoch: 34, train_loss: 0.7063, test_loss: 0.8082, test_f1: 0.6210
 epoch: 35, train_loss: 0.6944, test_loss: 0.8576, test_f1: 0.6392
 epoch: 36, train_loss: 0.6874, test_loss: 0.8468, test_f1: 0.6311
 epoch: 37, train_loss: 0.6778, test_loss: 0.8476, test_f1: 0.6157
 epoch: 38, train_loss: 0.6822, test_loss: 0.9285, test_f1: 0.5550
 epoch: 39, train_loss: 0.6712, test_loss: 0.8652, test_f1: 0.6120
 epoch: 40, train_loss: 0.6947, test_loss: 0.8542, test_f1: 0.6288
 epoch: 41, train_loss: 0.6851, test_loss: 0.9109, test_f1: 0.6148
 epoch: 42, train_loss: 0.6702, test_loss: 0.8577, test_f1: 0.6136
 epoch: 43, train_loss: 0.6785, test_loss: 0.9013, test_f1: 0.5930
 epoch: 44, train_loss: 0.6887, test_loss: 0.9060, test_f1: 0.6073
 epoch: 45, train_loss: 0.6717, test_loss: 0.8910, test_f1: 0.6250
 epoch: 46, train_loss: 0.6537, test_loss: 0.8892, test_f1: 0.6362
 epoch: 47, train_loss: 0.6552, test_loss: 1.2236, test_f1: 0.5711
 epoch: 48, train_loss: 0.6581, test_loss: 0.8712, test_f1: 0.6383
 epoch: 49, train_loss: 0.6428, test_loss: 0.9987, test_f1: 0.5911
 epoch: 50, train_loss: 0.6665, test_loss: 1.0038, test_f1: 0.5791
 epoch: 51, train_loss: 0.6331, test_loss: 0.8312, test_f1: 0.6562
 epoch: 52, train_loss: 0.5948, test_loss: 0.8568, test_f1: 0.6502
 epoch: 53, train_loss: 0.6023, test_loss: 0.8657, test_f1: 0.6149
 epoch: 54, train_loss: 0.5906, test_loss: 0.8594, test_f1: 0.6375
 epoch: 55, train_loss: 0.5897, test_loss: 0.8389, test_f1: 0.6045
 epoch: 56, train_loss: 0.5735, test_loss: 0.8785, test_f1: 0.6283
 epoch: 57, train_loss: 0.5743, test_loss: 0.8661, test_f1: 0.6400
 epoch: 58, train_loss: 0.5669, test_loss: 0.8629, test_f1: 0.6470
 epoch: 59, train_loss: 0.5800, test_loss: 0.8410, test_f1: 0.6372
 epoch: 60, train_loss: 0.5790, test_loss: 0.8613, test_f1: 0.6716
 epoch: 61, train_loss: 0.5788, test_loss: 0.8893, test_f1: 0.6237
 epoch: 62, train_loss: 0.5700, test_loss: 0.8156, test_f1: 0.6498
 epoch: 63, train_loss: 0.5645, test_loss: 0.8625, test_f1: 0.6294
 epoch: 64, train_loss: 0.5905, test_loss: 0.9077, test_f1: 0.6254
 epoch: 65, train_loss: 0.5756, test_loss: 0.8811, test_f1: 0.6398
 epoch: 66, train_loss: 0.5522, test_loss: 0.9724, test_f1: 0.6186
 epoch: 67, train_loss: 0.5458, test_loss: 0.8849, test_f1: 0.6144
 epoch: 68, train_loss: 0.5635, test_loss: 0.9804, test_f1: 0.6334
 epoch: 69, train_loss: 0.5579, test_loss: 0.8400, test_f1: 0.6494
 epoch: 70, train_loss: 0.5590, test_loss: 0.9274, test_f1: 0.6277
 epoch: 71, train_loss: 0.5668, test_loss: 1.0153, test_f1: 0.5823
 epoch: 72, train_loss: 0.5399, test_loss: 0.8018, test_f1: 0.6420
 epoch: 73, train_loss: 0.5649, test_loss: 0.9160, test_f1: 0.6300
 epoch: 74, train_loss: 0.5518, test_loss: 0.8349, test_f1: 0.6741
 epoch: 75, train_loss: 0.5530, test_loss: 0.8484, test_f1: 0.6366
 epoch: 76, train_loss: 0.5369, test_loss: 0.8598, test_f1: 0.6383
 epoch: 77, train_loss: 0.5308, test_loss: 0.8846, test_f1: 0.6294
 epoch: 78, train_loss: 0.5440, test_loss: 0.9256, test_f1: 0.6275
 epoch: 79, train_loss: 0.5375, test_loss: 0.9026, test_f1: 0.6264
 epoch: 80, train_loss: 0.5381, test_loss: 0.9686, test_f1: 0.6204
 epoch: 81, train_loss: 0.5211, test_loss: 0.9201, test_f1: 0.6348
 epoch: 82, train_loss: 0.5253, test_loss: 0.9895, test_f1: 0.5981
 epoch: 83, train_loss: 0.5392, test_loss: 0.8788, test_f1: 0.6483
 epoch: 84, train_loss: 0.5224, test_loss: 0.8917, test_f1: 0.6271
 epoch: 85, train_loss: 0.5182, test_loss: 0.9321, test_f1: 0.6229
 epoch: 86, train_loss: 0.5256, test_loss: 0.9099, test_f1: 0.6643
 epoch: 87, train_loss: 0.5400, test_loss: 0.8851, test_f1: 0.6414
 epoch: 88, train_loss: 0.5338, test_loss: 1.0028, test_f1: 0.6066
 epoch: 89, train_loss: 0.5140, test_loss: 0.9320, test_f1: 0.6467
 epoch: 90, train_loss: 0.5241, test_loss: 1.0170, test_f1: 0.6102
 epoch: 91, train_loss: 0.5190, test_loss: 0.9172, test_f1: 0.5980
 epoch: 92, train_loss: 0.5347, test_loss: 0.9098, test_f1: 0.6218
 epoch: 93, train_loss: 0.5221, test_loss: 0.8116, test_f1: 0.6394
 epoch: 94, train_loss: 0.4958, test_loss: 0.9121, test_f1: 0.6380
 epoch: 95, train_loss: 0.5067, test_loss: 0.9961, test_f1: 0.6196
 epoch: 96, train_loss: 0.4842, test_loss: 0.9319, test_f1: 0.6524
 epoch: 97, train_loss: 0.5079, test_loss: 0.9767, test_f1: 0.6277
 epoch: 98, train_loss: 0.5058, test_loss: 0.9938, test_f1: 0.5881
 epoch: 99, train_loss: 0.5026, test_loss: 0.9721, test_f1: 0.6172
##################ITERATION #4 ****************************************
 epoch: 0, train_loss: 1.2246, test_loss: 1.1575, test_f1: 0.4241
 epoch: 1, train_loss: 1.0458, test_loss: 1.1025, test_f1: 0.4259
 epoch: 2, train_loss: 0.9987, test_loss: 0.9950, test_f1: 0.4706
 epoch: 3, train_loss: 0.9928, test_loss: 1.1019, test_f1: 0.4374
 epoch: 4, train_loss: 0.9556, test_loss: 1.0150, test_f1: 0.5093
 epoch: 5, train_loss: 0.9474, test_loss: 1.0141, test_f1: 0.4592
 epoch: 6, train_loss: 0.9228, test_loss: 0.9807, test_f1: 0.5055
 epoch: 7, train_loss: 0.9087, test_loss: 1.0352, test_f1: 0.4994
 epoch: 8, train_loss: 0.8926, test_loss: 0.9444, test_f1: 0.5423
 epoch: 9, train_loss: 0.8720, test_loss: 0.9417, test_f1: 0.5721
 epoch: 10, train_loss: 0.8633, test_loss: 0.9788, test_f1: 0.5253
 epoch: 11, train_loss: 0.8614, test_loss: 0.9401, test_f1: 0.5518
 epoch: 12, train_loss: 0.8557, test_loss: 0.9268, test_f1: 0.5757
 epoch: 13, train_loss: 0.8377, test_loss: 0.8845, test_f1: 0.5489
 epoch: 14, train_loss: 0.8348, test_loss: 0.8858, test_f1: 0.5972
 epoch: 15, train_loss: 0.8297, test_loss: 0.9375, test_f1: 0.5224
 epoch: 16, train_loss: 0.8391, test_loss: 0.8077, test_f1: 0.5850
 epoch: 17, train_loss: 0.7976, test_loss: 0.8909, test_f1: 0.5697
 epoch: 18, train_loss: 0.7914, test_loss: 0.8947, test_f1: 0.6038
 epoch: 19, train_loss: 0.8289, test_loss: 1.0083, test_f1: 0.4748
 epoch: 20, train_loss: 0.8077, test_loss: 0.8636, test_f1: 0.5727
 epoch: 21, train_loss: 0.8039, test_loss: 0.8682, test_f1: 0.6044
 epoch: 22, train_loss: 0.7811, test_loss: 0.9900, test_f1: 0.5356
 epoch: 23, train_loss: 0.7762, test_loss: 0.8049, test_f1: 0.5937
 epoch: 24, train_loss: 0.7696, test_loss: 0.9170, test_f1: 0.5269
 epoch: 25, train_loss: 0.7713, test_loss: 0.8168, test_f1: 0.6134
 epoch: 26, train_loss: 0.7540, test_loss: 0.8477, test_f1: 0.6163
 epoch: 27, train_loss: 0.7365, test_loss: 0.8559, test_f1: 0.6015
 epoch: 28, train_loss: 0.7515, test_loss: 0.8482, test_f1: 0.6165
 epoch: 29, train_loss: 0.7439, test_loss: 0.8804, test_f1: 0.5861
 epoch: 30, train_loss: 0.7320, test_loss: 0.9217, test_f1: 0.5703
 epoch: 31, train_loss: 0.7226, test_loss: 0.8705, test_f1: 0.5499
 epoch: 32, train_loss: 0.7174, test_loss: 0.9130, test_f1: 0.5533
 epoch: 33, train_loss: 0.7113, test_loss: 1.0116, test_f1: 0.5237
 epoch: 34, train_loss: 0.7304, test_loss: 0.8408, test_f1: 0.5890
 epoch: 35, train_loss: 0.7025, test_loss: 0.8977, test_f1: 0.5567
 epoch: 36, train_loss: 0.7210, test_loss: 0.8442, test_f1: 0.6049
 epoch: 37, train_loss: 0.6994, test_loss: 1.1351, test_f1: 0.5266
 epoch: 38, train_loss: 0.7067, test_loss: 0.8282, test_f1: 0.5782
 epoch: 39, train_loss: 0.6966, test_loss: 0.9309, test_f1: 0.5407
 epoch: 40, train_loss: 0.6886, test_loss: 0.8239, test_f1: 0.5915
 epoch: 41, train_loss: 0.6618, test_loss: 0.9658, test_f1: 0.5507
 epoch: 42, train_loss: 0.6877, test_loss: 0.8781, test_f1: 0.5802
 epoch: 43, train_loss: 0.6804, test_loss: 0.9421, test_f1: 0.5861
 epoch: 44, train_loss: 0.7004, test_loss: 0.9221, test_f1: 0.5666
 epoch: 45, train_loss: 0.6710, test_loss: 0.8956, test_f1: 0.6237
 epoch: 46, train_loss: 0.6634, test_loss: 0.9186, test_f1: 0.5478
 epoch: 47, train_loss: 0.6821, test_loss: 0.9325, test_f1: 0.5753
 epoch: 48, train_loss: 0.6758, test_loss: 0.8923, test_f1: 0.5797
 epoch: 49, train_loss: 0.6641, test_loss: 0.9313, test_f1: 0.5548
 epoch: 50, train_loss: 0.6870, test_loss: 0.8820, test_f1: 0.6029
 epoch: 51, train_loss: 0.6401, test_loss: 0.9049, test_f1: 0.5916
 epoch: 52, train_loss: 0.6174, test_loss: 0.8834, test_f1: 0.6232
 epoch: 53, train_loss: 0.6010, test_loss: 0.9195, test_f1: 0.5927
 epoch: 54, train_loss: 0.6078, test_loss: 0.8864, test_f1: 0.6256
 epoch: 55, train_loss: 0.5882, test_loss: 0.8671, test_f1: 0.6123
 epoch: 56, train_loss: 0.5870, test_loss: 0.8965, test_f1: 0.6299
 epoch: 57, train_loss: 0.5988, test_loss: 0.9074, test_f1: 0.6194
 epoch: 58, train_loss: 0.5873, test_loss: 0.8779, test_f1: 0.6137
 epoch: 59, train_loss: 0.5921, test_loss: 0.9447, test_f1: 0.6164
 epoch: 60, train_loss: 0.5764, test_loss: 0.9666, test_f1: 0.5987
 epoch: 61, train_loss: 0.5732, test_loss: 0.9152, test_f1: 0.6168
 epoch: 62, train_loss: 0.5644, test_loss: 0.9442, test_f1: 0.6023
 epoch: 63, train_loss: 0.5624, test_loss: 1.0039, test_f1: 0.5944
 epoch: 64, train_loss: 0.5692, test_loss: 0.8623, test_f1: 0.6461
 epoch: 65, train_loss: 0.5761, test_loss: 0.9401, test_f1: 0.5713
 epoch: 66, train_loss: 0.5851, test_loss: 0.9246, test_f1: 0.6364
 epoch: 67, train_loss: 0.5615, test_loss: 0.9347, test_f1: 0.6248
 epoch: 68, train_loss: 0.5661, test_loss: 0.8572, test_f1: 0.6239
 epoch: 69, train_loss: 0.5642, test_loss: 0.9010, test_f1: 0.6180
 epoch: 70, train_loss: 0.5533, test_loss: 0.9232, test_f1: 0.6186
 epoch: 71, train_loss: 0.5605, test_loss: 0.9343, test_f1: 0.6112
 epoch: 72, train_loss: 0.5664, test_loss: 0.9404, test_f1: 0.5816
 epoch: 73, train_loss: 0.5476, test_loss: 0.9748, test_f1: 0.6122
 epoch: 74, train_loss: 0.5612, test_loss: 0.9358, test_f1: 0.6468
 epoch: 75, train_loss: 0.5457, test_loss: 0.9738, test_f1: 0.6113
 epoch: 76, train_loss: 0.5483, test_loss: 0.9412, test_f1: 0.6230
 epoch: 77, train_loss: 0.5538, test_loss: 0.9514, test_f1: 0.6140
 epoch: 78, train_loss: 0.5509, test_loss: 0.9052, test_f1: 0.6338
 epoch: 79, train_loss: 0.5499, test_loss: 0.8997, test_f1: 0.6261
 epoch: 80, train_loss: 0.5356, test_loss: 1.0403, test_f1: 0.5806
 epoch: 81, train_loss: 0.5407, test_loss: 0.9219, test_f1: 0.6170
 epoch: 82, train_loss: 0.5316, test_loss: 0.8888, test_f1: 0.6601
 epoch: 83, train_loss: 0.5443, test_loss: 0.9309, test_f1: 0.6055
 epoch: 84, train_loss: 0.5314, test_loss: 0.8966, test_f1: 0.6337
 epoch: 85, train_loss: 0.5126, test_loss: 0.9044, test_f1: 0.6488
 epoch: 86, train_loss: 0.5384, test_loss: 0.8599, test_f1: 0.6584
 epoch: 87, train_loss: 0.5409, test_loss: 0.8773, test_f1: 0.6257
 epoch: 88, train_loss: 0.5141, test_loss: 0.8712, test_f1: 0.6376
 epoch: 89, train_loss: 0.5092, test_loss: 0.9041, test_f1: 0.6400
 epoch: 90, train_loss: 0.5233, test_loss: 0.9043, test_f1: 0.6474
 epoch: 91, train_loss: 0.5267, test_loss: 0.9240, test_f1: 0.6105
 epoch: 92, train_loss: 0.5129, test_loss: 0.9509, test_f1: 0.6148
 epoch: 93, train_loss: 0.5258, test_loss: 0.9343, test_f1: 0.6387
 epoch: 94, train_loss: 0.5147, test_loss: 0.9322, test_f1: 0.6325
 epoch: 95, train_loss: 0.5193, test_loss: 0.9488, test_f1: 0.6484
 epoch: 96, train_loss: 0.5198, test_loss: 0.9326, test_f1: 0.6670
 epoch: 97, train_loss: 0.5246, test_loss: 0.8761, test_f1: 0.6714
 epoch: 98, train_loss: 0.5146, test_loss: 0.9177, test_f1: 0.6585
 epoch: 99, train_loss: 0.4973, test_loss: 0.9800, test_f1: 0.6449
##################ITERATION #5 ****************************************
 epoch: 0, train_loss: 1.1654, test_loss: 1.1545, test_f1: 0.4059
 epoch: 1, train_loss: 1.0180, test_loss: 1.0950, test_f1: 0.4476
 epoch: 2, train_loss: 0.9696, test_loss: 1.0269, test_f1: 0.4512
 epoch: 3, train_loss: 0.9453, test_loss: 1.1616, test_f1: 0.4325
 epoch: 4, train_loss: 0.9325, test_loss: 0.9461, test_f1: 0.4886
 epoch: 5, train_loss: 0.8969, test_loss: 0.9787, test_f1: 0.5118
 epoch: 6, train_loss: 0.8708, test_loss: 0.9583, test_f1: 0.5185
 epoch: 7, train_loss: 0.8736, test_loss: 0.9064, test_f1: 0.5386
 epoch: 8, train_loss: 0.8727, test_loss: 0.9063, test_f1: 0.5332
 epoch: 9, train_loss: 0.8312, test_loss: 0.9173, test_f1: 0.5536
 epoch: 10, train_loss: 0.8362, test_loss: 1.3829, test_f1: 0.3637
 epoch: 11, train_loss: 0.8488, test_loss: 0.9302, test_f1: 0.5356
 epoch: 12, train_loss: 0.8333, test_loss: 0.8967, test_f1: 0.5794
 epoch: 13, train_loss: 0.8236, test_loss: 0.9317, test_f1: 0.5285
 epoch: 14, train_loss: 0.8085, test_loss: 1.1509, test_f1: 0.4983
 epoch: 15, train_loss: 0.7953, test_loss: 0.9103, test_f1: 0.5629
 epoch: 16, train_loss: 0.8043, test_loss: 1.0389, test_f1: 0.5245
 epoch: 17, train_loss: 0.7912, test_loss: 0.9076, test_f1: 0.5655
 epoch: 18, train_loss: 0.7843, test_loss: 0.9504, test_f1: 0.5264
 epoch: 19, train_loss: 0.7661, test_loss: 0.9767, test_f1: 0.5090
 epoch: 20, train_loss: 0.7544, test_loss: 0.9016, test_f1: 0.5574
 epoch: 21, train_loss: 0.7499, test_loss: 0.9063, test_f1: 0.6150
 epoch: 22, train_loss: 0.7657, test_loss: 0.9699, test_f1: 0.5281
 epoch: 23, train_loss: 0.7891, test_loss: 0.8702, test_f1: 0.5564
 epoch: 24, train_loss: 0.7506, test_loss: 0.9707, test_f1: 0.5083
 epoch: 25, train_loss: 0.7420, test_loss: 0.9041, test_f1: 0.5443
 epoch: 26, train_loss: 0.7298, test_loss: 0.9074, test_f1: 0.5560
 epoch: 27, train_loss: 0.7315, test_loss: 1.0136, test_f1: 0.5450
 epoch: 28, train_loss: 0.7226, test_loss: 0.9001, test_f1: 0.5716
 epoch: 29, train_loss: 0.7002, test_loss: 0.8734, test_f1: 0.5965
 epoch: 30, train_loss: 0.7532, test_loss: 2.1518, test_f1: 0.3714
 epoch: 31, train_loss: 0.7526, test_loss: 0.9000, test_f1: 0.6217
 epoch: 32, train_loss: 0.7175, test_loss: 0.8885, test_f1: 0.6001
 epoch: 33, train_loss: 0.6973, test_loss: 0.9686, test_f1: 0.5798
 epoch: 34, train_loss: 0.7024, test_loss: 0.9376, test_f1: 0.5664
 epoch: 35, train_loss: 0.7038, test_loss: 1.4034, test_f1: 0.5236
 epoch: 36, train_loss: 0.7201, test_loss: 0.9921, test_f1: 0.6193
 epoch: 37, train_loss: 0.7011, test_loss: 1.1441, test_f1: 0.5336
 epoch: 38, train_loss: 0.6994, test_loss: 1.1254, test_f1: 0.5207
 epoch: 39, train_loss: 0.6864, test_loss: 0.9367, test_f1: 0.5945
 epoch: 40, train_loss: 0.6850, test_loss: 0.9247, test_f1: 0.6289
 epoch: 41, train_loss: 0.6960, test_loss: 0.9489, test_f1: 0.5954
 epoch: 42, train_loss: 0.6865, test_loss: 0.8689, test_f1: 0.6365
 epoch: 43, train_loss: 0.6882, test_loss: 0.9384, test_f1: 0.6164
 epoch: 44, train_loss: 0.6812, test_loss: 0.9193, test_f1: 0.5686
 epoch: 45, train_loss: 0.7149, test_loss: 0.8704, test_f1: 0.6369
 epoch: 46, train_loss: 0.6859, test_loss: 0.9235, test_f1: 0.6132
 epoch: 47, train_loss: 0.6932, test_loss: 0.9628, test_f1: 0.5655
 epoch: 48, train_loss: 0.6710, test_loss: 0.9576, test_f1: 0.6109
 epoch: 49, train_loss: 0.6538, test_loss: 1.0105, test_f1: 0.6135
 epoch: 50, train_loss: 0.6510, test_loss: 1.0274, test_f1: 0.5601
 epoch: 51, train_loss: 0.6226, test_loss: 0.8699, test_f1: 0.6642
 epoch: 52, train_loss: 0.6161, test_loss: 1.1063, test_f1: 0.5833
 epoch: 53, train_loss: 0.6015, test_loss: 1.0903, test_f1: 0.6437
 epoch: 54, train_loss: 0.6083, test_loss: 0.9004, test_f1: 0.6620
 epoch: 55, train_loss: 0.5994, test_loss: 0.9590, test_f1: 0.6290
 epoch: 56, train_loss: 0.5981, test_loss: 1.0574, test_f1: 0.5586
 epoch: 57, train_loss: 0.6016, test_loss: 0.8403, test_f1: 0.6437
 epoch: 58, train_loss: 0.5881, test_loss: 0.9238, test_f1: 0.6601
 epoch: 59, train_loss: 0.5761, test_loss: 0.9677, test_f1: 0.6143
 epoch: 60, train_loss: 0.5853, test_loss: 0.9257, test_f1: 0.6685
 epoch: 61, train_loss: 0.5869, test_loss: 0.9704, test_f1: 0.6585
 epoch: 62, train_loss: 0.5687, test_loss: 0.9695, test_f1: 0.6363
 epoch: 63, train_loss: 0.5930, test_loss: 0.9642, test_f1: 0.6669
 epoch: 64, train_loss: 0.5862, test_loss: 0.9846, test_f1: 0.6356
 epoch: 65, train_loss: 0.5822, test_loss: 0.9675, test_f1: 0.6348
 epoch: 66, train_loss: 0.5799, test_loss: 0.9518, test_f1: 0.6273
 epoch: 67, train_loss: 0.5850, test_loss: 0.8974, test_f1: 0.6319
 epoch: 68, train_loss: 0.5686, test_loss: 0.9329, test_f1: 0.6553
 epoch: 69, train_loss: 0.5834, test_loss: 0.9380, test_f1: 0.6110
 epoch: 70, train_loss: 0.5707, test_loss: 0.9178, test_f1: 0.6476
 epoch: 71, train_loss: 0.5797, test_loss: 1.0088, test_f1: 0.6297
 epoch: 72, train_loss: 0.5692, test_loss: 0.9247, test_f1: 0.6548
 epoch: 73, train_loss: 0.5547, test_loss: 0.9507, test_f1: 0.6003
 epoch: 74, train_loss: 0.5726, test_loss: 0.9161, test_f1: 0.6155
 epoch: 75, train_loss: 0.5587, test_loss: 0.9924, test_f1: 0.6394
 epoch: 76, train_loss: 0.5589, test_loss: 0.8874, test_f1: 0.6505
 epoch: 77, train_loss: 0.5588, test_loss: 0.9111, test_f1: 0.6422
 epoch: 78, train_loss: 0.5363, test_loss: 0.9793, test_f1: 0.6249
 epoch: 79, train_loss: 0.5466, test_loss: 0.9113, test_f1: 0.6126
 epoch: 80, train_loss: 0.5371, test_loss: 0.8823, test_f1: 0.6470
 epoch: 81, train_loss: 0.5489, test_loss: 1.0516, test_f1: 0.6211
 epoch: 82, train_loss: 0.5279, test_loss: 0.9932, test_f1: 0.6559
 epoch: 83, train_loss: 0.5500, test_loss: 0.9062, test_f1: 0.6453
 epoch: 84, train_loss: 0.5412, test_loss: 0.8816, test_f1: 0.6567
 epoch: 85, train_loss: 0.5351, test_loss: 0.9968, test_f1: 0.6340
 epoch: 86, train_loss: 0.5400, test_loss: 0.9972, test_f1: 0.6364
 epoch: 87, train_loss: 0.5299, test_loss: 1.0338, test_f1: 0.6242
 epoch: 88, train_loss: 0.5343, test_loss: 0.9356, test_f1: 0.6217
 epoch: 89, train_loss: 0.5126, test_loss: 0.9524, test_f1: 0.6454
 epoch: 90, train_loss: 0.5301, test_loss: 0.9964, test_f1: 0.6314
 epoch: 91, train_loss: 0.5258, test_loss: 0.9119, test_f1: 0.6476
 epoch: 92, train_loss: 0.5253, test_loss: 1.0187, test_f1: 0.6287
 epoch: 93, train_loss: 0.5185, test_loss: 1.0576, test_f1: 0.6323
 epoch: 94, train_loss: 0.5223, test_loss: 0.9376, test_f1: 0.6624
 epoch: 95, train_loss: 0.5450, test_loss: 0.8994, test_f1: 0.6089
 epoch: 96, train_loss: 0.5176, test_loss: 1.0440, test_f1: 0.6109
 epoch: 97, train_loss: 0.5211, test_loss: 0.9971, test_f1: 0.6562
 epoch: 98, train_loss: 0.5429, test_loss: 0.9085, test_f1: 0.6524
 epoch: 99, train_loss: 0.5229, test_loss: 1.0744, test_f1: 0.6105
##################ITERATION #6 ****************************************
 epoch: 0, train_loss: 1.1981, test_loss: 1.3043, test_f1: 0.2574
 epoch: 1, train_loss: 1.0332, test_loss: 0.9921, test_f1: 0.4826
 epoch: 2, train_loss: 0.9683, test_loss: 1.0155, test_f1: 0.4360
 epoch: 3, train_loss: 0.9296, test_loss: 1.0359, test_f1: 0.5011
 epoch: 4, train_loss: 0.9143, test_loss: 1.0001, test_f1: 0.4963
 epoch: 5, train_loss: 0.9012, test_loss: 1.0636, test_f1: 0.4925
 epoch: 6, train_loss: 0.9156, test_loss: 0.9634, test_f1: 0.5243
 epoch: 7, train_loss: 0.8714, test_loss: 0.9954, test_f1: 0.5432
 epoch: 8, train_loss: 0.8802, test_loss: 0.9126, test_f1: 0.5144
 epoch: 9, train_loss: 0.8545, test_loss: 0.9746, test_f1: 0.5161
 epoch: 10, train_loss: 0.8371, test_loss: 1.0370, test_f1: 0.5050
 epoch: 11, train_loss: 0.8370, test_loss: 0.9939, test_f1: 0.5190
 epoch: 12, train_loss: 0.8323, test_loss: 0.9559, test_f1: 0.4987
 epoch: 13, train_loss: 0.8281, test_loss: 0.9398, test_f1: 0.5371
 epoch: 14, train_loss: 0.8231, test_loss: 1.0680, test_f1: 0.5348
 epoch: 15, train_loss: 0.8125, test_loss: 0.8585, test_f1: 0.5876
 epoch: 16, train_loss: 0.7858, test_loss: 0.9782, test_f1: 0.4940
 epoch: 17, train_loss: 0.7887, test_loss: 0.8904, test_f1: 0.6065
 epoch: 18, train_loss: 0.7767, test_loss: 0.9237, test_f1: 0.6109
 epoch: 19, train_loss: 0.7664, test_loss: 1.1447, test_f1: 0.5299
 epoch: 20, train_loss: 0.7665, test_loss: 1.2914, test_f1: 0.4819
 epoch: 21, train_loss: 0.7670, test_loss: 0.8949, test_f1: 0.5514
 epoch: 22, train_loss: 0.7628, test_loss: 0.9263, test_f1: 0.6047
 epoch: 23, train_loss: 0.7456, test_loss: 0.8987, test_f1: 0.6214
 epoch: 24, train_loss: 0.7632, test_loss: 0.9104, test_f1: 0.5807
 epoch: 25, train_loss: 0.7867, test_loss: 0.8863, test_f1: 0.6177
 epoch: 26, train_loss: 0.7408, test_loss: 0.9075, test_f1: 0.5709
 epoch: 27, train_loss: 0.7362, test_loss: 0.9090, test_f1: 0.5294
 epoch: 28, train_loss: 0.7275, test_loss: 0.8950, test_f1: 0.6245
 epoch: 29, train_loss: 0.7372, test_loss: 0.8950, test_f1: 0.6076
 epoch: 30, train_loss: 0.7472, test_loss: 0.9595, test_f1: 0.5550
 epoch: 31, train_loss: 0.7157, test_loss: 0.8179, test_f1: 0.6142
 epoch: 32, train_loss: 0.6979, test_loss: 0.8710, test_f1: 0.6200
 epoch: 33, train_loss: 0.6944, test_loss: 1.0146, test_f1: 0.5332
 epoch: 34, train_loss: 0.6988, test_loss: 0.7693, test_f1: 0.6548
 epoch: 35, train_loss: 0.6846, test_loss: 0.8994, test_f1: 0.6110
 epoch: 36, train_loss: 0.6835, test_loss: 0.8123, test_f1: 0.6655
 epoch: 37, train_loss: 0.7199, test_loss: 0.8924, test_f1: 0.6014
 epoch: 38, train_loss: 0.7077, test_loss: 0.9512, test_f1: 0.5848
 epoch: 39, train_loss: 0.7064, test_loss: 0.9186, test_f1: 0.5759
 epoch: 40, train_loss: 0.6962, test_loss: 0.9696, test_f1: 0.6298
 epoch: 41, train_loss: 0.6916, test_loss: 1.2371, test_f1: 0.5795
 epoch: 42, train_loss: 0.6754, test_loss: 0.7751, test_f1: 0.6074
 epoch: 43, train_loss: 0.6835, test_loss: 0.9870, test_f1: 0.6107
 epoch: 44, train_loss: 0.6939, test_loss: 0.8646, test_f1: 0.6333
 epoch: 45, train_loss: 0.6975, test_loss: 1.2895, test_f1: 0.5279
 epoch: 46, train_loss: 0.6565, test_loss: 0.7710, test_f1: 0.6189
 epoch: 47, train_loss: 0.6402, test_loss: 1.0523, test_f1: 0.5819
 epoch: 48, train_loss: 0.6649, test_loss: 0.8127, test_f1: 0.6633
 epoch: 49, train_loss: 0.6613, test_loss: 1.0455, test_f1: 0.5983
 epoch: 50, train_loss: 0.6615, test_loss: 0.7668, test_f1: 0.5928
 epoch: 51, train_loss: 0.6283, test_loss: 0.7650, test_f1: 0.6399
 epoch: 52, train_loss: 0.5993, test_loss: 0.9657, test_f1: 0.6055
 epoch: 53, train_loss: 0.5929, test_loss: 0.9350, test_f1: 0.6333
 epoch: 54, train_loss: 0.5828, test_loss: 1.0050, test_f1: 0.6420
 epoch: 55, train_loss: 0.5912, test_loss: 0.9287, test_f1: 0.6187
 epoch: 56, train_loss: 0.5897, test_loss: 0.8242, test_f1: 0.6426
 epoch: 57, train_loss: 0.5858, test_loss: 0.7972, test_f1: 0.6354
 epoch: 58, train_loss: 0.5627, test_loss: 0.8572, test_f1: 0.6367
 epoch: 59, train_loss: 0.5820, test_loss: 0.8451, test_f1: 0.6466
 epoch: 60, train_loss: 0.5922, test_loss: 0.8889, test_f1: 0.6351
 epoch: 61, train_loss: 0.5713, test_loss: 0.8673, test_f1: 0.6619
 epoch: 62, train_loss: 0.5608, test_loss: 0.9180, test_f1: 0.6306
 epoch: 63, train_loss: 0.5712, test_loss: 0.8368, test_f1: 0.6311
 epoch: 64, train_loss: 0.5780, test_loss: 0.8724, test_f1: 0.6428
 epoch: 65, train_loss: 0.5685, test_loss: 0.8645, test_f1: 0.6358
 epoch: 66, train_loss: 0.5562, test_loss: 0.8714, test_f1: 0.6434
 epoch: 67, train_loss: 0.5522, test_loss: 0.9402, test_f1: 0.6268
 epoch: 68, train_loss: 0.5664, test_loss: 0.8885, test_f1: 0.6448
 epoch: 69, train_loss: 0.5599, test_loss: 0.8991, test_f1: 0.6529
 epoch: 70, train_loss: 0.5513, test_loss: 0.8875, test_f1: 0.6255
 epoch: 71, train_loss: 0.5468, test_loss: 0.9605, test_f1: 0.6444
 epoch: 72, train_loss: 0.5304, test_loss: 0.9559, test_f1: 0.6129
 epoch: 73, train_loss: 0.5480, test_loss: 0.9523, test_f1: 0.6378
 epoch: 74, train_loss: 0.5435, test_loss: 0.9079, test_f1: 0.6485
 epoch: 75, train_loss: 0.5364, test_loss: 1.0565, test_f1: 0.5862
 epoch: 76, train_loss: 0.5563, test_loss: 0.9081, test_f1: 0.6640
 epoch: 77, train_loss: 0.5422, test_loss: 0.9424, test_f1: 0.6372
 epoch: 78, train_loss: 0.5290, test_loss: 0.9757, test_f1: 0.6380
 epoch: 79, train_loss: 0.5441, test_loss: 0.9738, test_f1: 0.6098
 epoch: 80, train_loss: 0.5319, test_loss: 0.9259, test_f1: 0.6584
 epoch: 81, train_loss: 0.5278, test_loss: 1.0090, test_f1: 0.6103
 epoch: 82, train_loss: 0.5149, test_loss: 1.0802, test_f1: 0.6189
 epoch: 83, train_loss: 0.5354, test_loss: 0.9122, test_f1: 0.6433
 epoch: 84, train_loss: 0.5239, test_loss: 1.0006, test_f1: 0.6354
 epoch: 85, train_loss: 0.5301, test_loss: 0.9933, test_f1: 0.6018
 epoch: 86, train_loss: 0.5287, test_loss: 0.9643, test_f1: 0.6266
 epoch: 87, train_loss: 0.5165, test_loss: 0.9632, test_f1: 0.6391
 epoch: 88, train_loss: 0.5365, test_loss: 0.9508, test_f1: 0.6599
 epoch: 89, train_loss: 0.5344, test_loss: 1.1149, test_f1: 0.6179
 epoch: 90, train_loss: 0.5059, test_loss: 0.9897, test_f1: 0.6603
 epoch: 91, train_loss: 0.5134, test_loss: 1.2209, test_f1: 0.5657
 epoch: 92, train_loss: 0.5105, test_loss: 0.8869, test_f1: 0.6473
 epoch: 93, train_loss: 0.4988, test_loss: 0.9975, test_f1: 0.6438
 epoch: 94, train_loss: 0.5116, test_loss: 1.1493, test_f1: 0.6179
 epoch: 95, train_loss: 0.5119, test_loss: 0.9530, test_f1: 0.6382
 epoch: 96, train_loss: 0.4954, test_loss: 1.1111, test_f1: 0.6316
 epoch: 97, train_loss: 0.5167, test_loss: 1.0941, test_f1: 0.6393
 epoch: 98, train_loss: 0.5106, test_loss: 1.0248, test_f1: 0.6248
 epoch: 99, train_loss: 0.4952, test_loss: 1.1242, test_f1: 0.5971
##################ITERATION #7 ****************************************
 epoch: 0, train_loss: 1.1424, test_loss: 1.1820, test_f1: 0.3390
 epoch: 1, train_loss: 1.0118, test_loss: 1.1464, test_f1: 0.4327
 epoch: 2, train_loss: 0.9782, test_loss: 1.0450, test_f1: 0.5168
 epoch: 3, train_loss: 0.9368, test_loss: 1.0507, test_f1: 0.4822
 epoch: 4, train_loss: 0.9059, test_loss: 0.9524, test_f1: 0.5644
 epoch: 5, train_loss: 0.8784, test_loss: 0.9974, test_f1: 0.4877
 epoch: 6, train_loss: 0.8728, test_loss: 0.9140, test_f1: 0.4879
 epoch: 7, train_loss: 0.8470, test_loss: 0.9854, test_f1: 0.5321
 epoch: 8, train_loss: 0.8569, test_loss: 0.9702, test_f1: 0.5099
 epoch: 9, train_loss: 0.8246, test_loss: 0.8771, test_f1: 0.5685
 epoch: 10, train_loss: 0.8070, test_loss: 0.9260, test_f1: 0.6024
 epoch: 11, train_loss: 0.8292, test_loss: 0.9604, test_f1: 0.5188
 epoch: 12, train_loss: 0.8045, test_loss: 0.9942, test_f1: 0.5419
 epoch: 13, train_loss: 0.7833, test_loss: 0.8928, test_f1: 0.5719
 epoch: 14, train_loss: 0.7968, test_loss: 0.8569, test_f1: 0.5789
 epoch: 15, train_loss: 0.7819, test_loss: 0.8696, test_f1: 0.6130
 epoch: 16, train_loss: 0.7705, test_loss: 0.8428, test_f1: 0.5833
 epoch: 17, train_loss: 0.7716, test_loss: 0.8323, test_f1: 0.6107
 epoch: 18, train_loss: 0.7684, test_loss: 0.9166, test_f1: 0.5411
 epoch: 19, train_loss: 0.7505, test_loss: 0.8272, test_f1: 0.6395
 epoch: 20, train_loss: 0.7513, test_loss: 0.8550, test_f1: 0.5621
 epoch: 21, train_loss: 0.7393, test_loss: 0.9189, test_f1: 0.6051
 epoch: 22, train_loss: 0.7136, test_loss: 0.9093, test_f1: 0.5843
 epoch: 23, train_loss: 0.7227, test_loss: 0.9511, test_f1: 0.5562
 epoch: 24, train_loss: 0.7427, test_loss: 0.8551, test_f1: 0.5967
 epoch: 25, train_loss: 0.7226, test_loss: 0.9227, test_f1: 0.6097
 epoch: 26, train_loss: 0.7242, test_loss: 1.0783, test_f1: 0.5541
 epoch: 27, train_loss: 0.7005, test_loss: 0.8759, test_f1: 0.6378
 epoch: 28, train_loss: 0.7113, test_loss: 0.8440, test_f1: 0.6079
 epoch: 29, train_loss: 0.7155, test_loss: 0.9257, test_f1: 0.5782
 epoch: 30, train_loss: 0.6903, test_loss: 0.9078, test_f1: 0.6534
 epoch: 31, train_loss: 0.6950, test_loss: 0.9784, test_f1: 0.5304
 epoch: 32, train_loss: 0.6860, test_loss: 0.8610, test_f1: 0.5975
 epoch: 33, train_loss: 0.6851, test_loss: 0.9406, test_f1: 0.6187
 epoch: 34, train_loss: 0.6853, test_loss: 0.9326, test_f1: 0.6114
 epoch: 35, train_loss: 0.6805, test_loss: 0.8901, test_f1: 0.6039
 epoch: 36, train_loss: 0.6598, test_loss: 0.9403, test_f1: 0.6633
 epoch: 37, train_loss: 0.6775, test_loss: 0.9232, test_f1: 0.6477
 epoch: 38, train_loss: 0.6639, test_loss: 1.0148, test_f1: 0.6266
 epoch: 39, train_loss: 0.6779, test_loss: 0.8840, test_f1: 0.6742
 epoch: 40, train_loss: 0.6518, test_loss: 0.8553, test_f1: 0.6140
 epoch: 41, train_loss: 0.6300, test_loss: 0.8506, test_f1: 0.6088
 epoch: 42, train_loss: 0.6364, test_loss: 0.8360, test_f1: 0.6116
 epoch: 43, train_loss: 0.6615, test_loss: 0.9195, test_f1: 0.5620
 epoch: 44, train_loss: 0.6575, test_loss: 0.8628, test_f1: 0.6307
 epoch: 45, train_loss: 0.6418, test_loss: 0.8548, test_f1: 0.6435
 epoch: 46, train_loss: 0.6295, test_loss: 0.9334, test_f1: 0.6329
 epoch: 47, train_loss: 0.6337, test_loss: 0.9673, test_f1: 0.6247
 epoch: 48, train_loss: 0.6443, test_loss: 0.9472, test_f1: 0.5978
 epoch: 49, train_loss: 0.6502, test_loss: 0.9636, test_f1: 0.5736
 epoch: 50, train_loss: 0.6196, test_loss: 1.0439, test_f1: 0.6136
 epoch: 51, train_loss: 0.5961, test_loss: 0.8461, test_f1: 0.6342
 epoch: 52, train_loss: 0.5739, test_loss: 0.8191, test_f1: 0.6234
 epoch: 53, train_loss: 0.5673, test_loss: 0.8989, test_f1: 0.6585
 epoch: 54, train_loss: 0.5763, test_loss: 0.9025, test_f1: 0.6349
 epoch: 55, train_loss: 0.5658, test_loss: 0.8377, test_f1: 0.6444
 epoch: 56, train_loss: 0.5623, test_loss: 0.9643, test_f1: 0.6182
 epoch: 57, train_loss: 0.5365, test_loss: 0.8655, test_f1: 0.6405
 epoch: 58, train_loss: 0.5459, test_loss: 0.9749, test_f1: 0.6175
 epoch: 59, train_loss: 0.5475, test_loss: 0.9314, test_f1: 0.6307
 epoch: 60, train_loss: 0.5404, test_loss: 0.8284, test_f1: 0.6537
 epoch: 61, train_loss: 0.5556, test_loss: 0.9723, test_f1: 0.6095
 epoch: 62, train_loss: 0.5306, test_loss: 1.0174, test_f1: 0.6274
 epoch: 63, train_loss: 0.5461, test_loss: 0.9853, test_f1: 0.6253
 epoch: 64, train_loss: 0.5355, test_loss: 1.0189, test_f1: 0.6313
 epoch: 65, train_loss: 0.5317, test_loss: 0.9716, test_f1: 0.6501
 epoch: 66, train_loss: 0.5323, test_loss: 0.9670, test_f1: 0.6047
 epoch: 67, train_loss: 0.5157, test_loss: 0.9122, test_f1: 0.6291
 epoch: 68, train_loss: 0.5145, test_loss: 0.9301, test_f1: 0.6458
 epoch: 69, train_loss: 0.5000, test_loss: 0.9116, test_f1: 0.6338
 epoch: 70, train_loss: 0.5187, test_loss: 0.9364, test_f1: 0.6387
 epoch: 71, train_loss: 0.5121, test_loss: 1.0584, test_f1: 0.6411
 epoch: 72, train_loss: 0.5143, test_loss: 0.9380, test_f1: 0.6451
 epoch: 73, train_loss: 0.4950, test_loss: 0.9522, test_f1: 0.6331
 epoch: 74, train_loss: 0.5030, test_loss: 1.0450, test_f1: 0.6441
 epoch: 75, train_loss: 0.4978, test_loss: 0.9534, test_f1: 0.6430
 epoch: 76, train_loss: 0.5453, test_loss: 1.0628, test_f1: 0.6324
 epoch: 77, train_loss: 0.5106, test_loss: 0.9861, test_f1: 0.6436
 epoch: 78, train_loss: 0.5003, test_loss: 1.0319, test_f1: 0.6561
 epoch: 79, train_loss: 0.5121, test_loss: 0.9783, test_f1: 0.6521
 epoch: 80, train_loss: 0.4938, test_loss: 0.9532, test_f1: 0.6262
 epoch: 81, train_loss: 0.4918, test_loss: 0.9846, test_f1: 0.6431
 epoch: 82, train_loss: 0.4978, test_loss: 0.9927, test_f1: 0.6367
 epoch: 83, train_loss: 0.4767, test_loss: 1.0658, test_f1: 0.6263
 epoch: 84, train_loss: 0.4766, test_loss: 0.9666, test_f1: 0.6516
 epoch: 85, train_loss: 0.4798, test_loss: 0.9823, test_f1: 0.6592
 epoch: 86, train_loss: 0.4740, test_loss: 1.0788, test_f1: 0.6477
 epoch: 87, train_loss: 0.4627, test_loss: 1.1256, test_f1: 0.6250
 epoch: 88, train_loss: 0.4874, test_loss: 0.9947, test_f1: 0.6581
 epoch: 89, train_loss: 0.4653, test_loss: 1.0590, test_f1: 0.6414
 epoch: 90, train_loss: 0.4617, test_loss: 1.0213, test_f1: 0.6387
 epoch: 91, train_loss: 0.4680, test_loss: 1.1587, test_f1: 0.6262
 epoch: 92, train_loss: 0.4643, test_loss: 1.0679, test_f1: 0.6263
 epoch: 93, train_loss: 0.4794, test_loss: 1.1078, test_f1: 0.6533
 epoch: 94, train_loss: 0.4773, test_loss: 1.0625, test_f1: 0.6560
 epoch: 95, train_loss: 0.4827, test_loss: 0.9624, test_f1: 0.6599
 epoch: 96, train_loss: 0.4635, test_loss: 1.0684, test_f1: 0.6524
 epoch: 97, train_loss: 0.4594, test_loss: 1.0773, test_f1: 0.6628
 epoch: 98, train_loss: 0.4436, test_loss: 1.2388, test_f1: 0.6347
 epoch: 99, train_loss: 0.4607, test_loss: 1.1277, test_f1: 0.6181
##################ITERATION #8 ****************************************
 epoch: 0, train_loss: 1.2446, test_loss: 1.0835, test_f1: 0.4421
 epoch: 1, train_loss: 0.9936, test_loss: 0.9614, test_f1: 0.5343
 epoch: 2, train_loss: 0.9316, test_loss: 1.0846, test_f1: 0.4795
 epoch: 3, train_loss: 0.9244, test_loss: 0.9680, test_f1: 0.5198
 epoch: 4, train_loss: 0.9075, test_loss: 0.9369, test_f1: 0.5333
 epoch: 5, train_loss: 0.8628, test_loss: 1.1691, test_f1: 0.5088
 epoch: 6, train_loss: 0.8848, test_loss: 0.9916, test_f1: 0.5486
 epoch: 7, train_loss: 0.8510, test_loss: 0.9938, test_f1: 0.5555
 epoch: 8, train_loss: 0.8331, test_loss: 0.9417, test_f1: 0.5203
 epoch: 9, train_loss: 0.8318, test_loss: 0.9257, test_f1: 0.5761
 epoch: 10, train_loss: 0.8203, test_loss: 1.0100, test_f1: 0.4870
 epoch: 11, train_loss: 0.8157, test_loss: 0.9661, test_f1: 0.5796
 epoch: 12, train_loss: 0.7992, test_loss: 0.9359, test_f1: 0.5345
 epoch: 13, train_loss: 0.7976, test_loss: 0.9514, test_f1: 0.5422
 epoch: 14, train_loss: 0.7883, test_loss: 0.8265, test_f1: 0.5621
 epoch: 15, train_loss: 0.7849, test_loss: 0.9060, test_f1: 0.5665
 epoch: 16, train_loss: 0.7895, test_loss: 1.0580, test_f1: 0.4732
 epoch: 17, train_loss: 0.7601, test_loss: 0.9588, test_f1: 0.5747
 epoch: 18, train_loss: 0.7725, test_loss: 0.8192, test_f1: 0.6198
 epoch: 19, train_loss: 0.7633, test_loss: 0.8993, test_f1: 0.5517
 epoch: 20, train_loss: 0.7504, test_loss: 0.8687, test_f1: 0.5920
 epoch: 21, train_loss: 0.7546, test_loss: 0.8690, test_f1: 0.5839
 epoch: 22, train_loss: 0.7388, test_loss: 1.0170, test_f1: 0.5357
 epoch: 23, train_loss: 0.7372, test_loss: 0.9079, test_f1: 0.5615
 epoch: 24, train_loss: 0.7197, test_loss: 0.8667, test_f1: 0.6252
 epoch: 25, train_loss: 0.7016, test_loss: 0.8768, test_f1: 0.6046
 epoch: 26, train_loss: 0.7221, test_loss: 0.8666, test_f1: 0.5703
 epoch: 27, train_loss: 0.7152, test_loss: 0.8681, test_f1: 0.6179
 epoch: 28, train_loss: 0.7014, test_loss: 0.8783, test_f1: 0.6173
 epoch: 29, train_loss: 0.7126, test_loss: 0.8970, test_f1: 0.5864
 epoch: 30, train_loss: 0.7172, test_loss: 0.8124, test_f1: 0.6295
 epoch: 31, train_loss: 0.7233, test_loss: 0.8400, test_f1: 0.6311
 epoch: 32, train_loss: 0.7235, test_loss: 0.9073, test_f1: 0.5373
 epoch: 33, train_loss: 0.7039, test_loss: 0.8956, test_f1: 0.5813
 epoch: 34, train_loss: 0.6868, test_loss: 0.8956, test_f1: 0.6127
 epoch: 35, train_loss: 0.6947, test_loss: 0.8384, test_f1: 0.6202
 epoch: 36, train_loss: 0.6739, test_loss: 0.8575, test_f1: 0.5891
 epoch: 37, train_loss: 0.6824, test_loss: 0.9732, test_f1: 0.5874
 epoch: 38, train_loss: 0.6782, test_loss: 0.9157, test_f1: 0.5779
 epoch: 39, train_loss: 0.6636, test_loss: 0.8124, test_f1: 0.6033
 epoch: 40, train_loss: 0.6786, test_loss: 0.8352, test_f1: 0.6061
 epoch: 41, train_loss: 0.6634, test_loss: 0.8577, test_f1: 0.5958
 epoch: 42, train_loss: 0.6625, test_loss: 0.8555, test_f1: 0.6169
 epoch: 43, train_loss: 0.6458, test_loss: 1.0818, test_f1: 0.5700
 epoch: 44, train_loss: 0.6516, test_loss: 0.8514, test_f1: 0.6104
 epoch: 45, train_loss: 0.6641, test_loss: 0.9115, test_f1: 0.6051
 epoch: 46, train_loss: 0.6582, test_loss: 0.9398, test_f1: 0.5552
 epoch: 47, train_loss: 0.6520, test_loss: 0.9469, test_f1: 0.6021
 epoch: 48, train_loss: 0.6452, test_loss: 0.8811, test_f1: 0.5941
 epoch: 49, train_loss: 0.6564, test_loss: 0.9150, test_f1: 0.5732
 epoch: 50, train_loss: 0.6562, test_loss: 0.8833, test_f1: 0.5944
 epoch: 51, train_loss: 0.6104, test_loss: 0.9239, test_f1: 0.5842
 epoch: 52, train_loss: 0.5830, test_loss: 0.8504, test_f1: 0.6062
 epoch: 53, train_loss: 0.5675, test_loss: 0.8593, test_f1: 0.6218
 epoch: 54, train_loss: 0.5686, test_loss: 0.8616, test_f1: 0.6280
 epoch: 55, train_loss: 0.5509, test_loss: 0.9835, test_f1: 0.5820
 epoch: 56, train_loss: 0.5851, test_loss: 0.8687, test_f1: 0.6161
 epoch: 57, train_loss: 0.5616, test_loss: 0.8488, test_f1: 0.6477
 epoch: 58, train_loss: 0.5644, test_loss: 1.0353, test_f1: 0.6044
 epoch: 59, train_loss: 0.5523, test_loss: 0.8884, test_f1: 0.6181
 epoch: 60, train_loss: 0.5491, test_loss: 0.8655, test_f1: 0.6348
 epoch: 61, train_loss: 0.5465, test_loss: 0.8797, test_f1: 0.6256
 epoch: 62, train_loss: 0.5675, test_loss: 0.9567, test_f1: 0.5937
 epoch: 63, train_loss: 0.5236, test_loss: 0.9738, test_f1: 0.6048
 epoch: 64, train_loss: 0.5295, test_loss: 0.8978, test_f1: 0.6437
 epoch: 65, train_loss: 0.5721, test_loss: 0.8597, test_f1: 0.6416
 epoch: 66, train_loss: 0.5514, test_loss: 0.9213, test_f1: 0.6151
 epoch: 67, train_loss: 0.5557, test_loss: 0.8387, test_f1: 0.6483
 epoch: 68, train_loss: 0.5527, test_loss: 0.9002, test_f1: 0.6182
 epoch: 69, train_loss: 0.5526, test_loss: 0.8557, test_f1: 0.6259
 epoch: 70, train_loss: 0.5354, test_loss: 0.8489, test_f1: 0.6365
 epoch: 71, train_loss: 0.5350, test_loss: 0.9501, test_f1: 0.6220
 epoch: 72, train_loss: 0.5400, test_loss: 0.9679, test_f1: 0.6093
 epoch: 73, train_loss: 0.5160, test_loss: 0.8748, test_f1: 0.6327
 epoch: 74, train_loss: 0.5253, test_loss: 0.8875, test_f1: 0.6152
 epoch: 75, train_loss: 0.5229, test_loss: 0.8786, test_f1: 0.6384
 epoch: 76, train_loss: 0.5211, test_loss: 0.8480, test_f1: 0.6168
 epoch: 77, train_loss: 0.5192, test_loss: 0.9219, test_f1: 0.6194
 epoch: 78, train_loss: 0.5298, test_loss: 0.9038, test_f1: 0.6107
 epoch: 79, train_loss: 0.5247, test_loss: 0.8910, test_f1: 0.6522
 epoch: 80, train_loss: 0.5089, test_loss: 1.0553, test_f1: 0.5974
 epoch: 81, train_loss: 0.5199, test_loss: 0.9167, test_f1: 0.6213
 epoch: 82, train_loss: 0.5043, test_loss: 0.9124, test_f1: 0.6164
 epoch: 83, train_loss: 0.5192, test_loss: 1.0298, test_f1: 0.5658
 epoch: 84, train_loss: 0.4986, test_loss: 0.9081, test_f1: 0.6241
 epoch: 85, train_loss: 0.5143, test_loss: 0.8428, test_f1: 0.6569
 epoch: 86, train_loss: 0.5223, test_loss: 0.8743, test_f1: 0.6286
 epoch: 87, train_loss: 0.4978, test_loss: 0.9783, test_f1: 0.6014
 epoch: 88, train_loss: 0.5151, test_loss: 0.9058, test_f1: 0.6409
 epoch: 89, train_loss: 0.5038, test_loss: 1.0116, test_f1: 0.5774
 epoch: 90, train_loss: 0.5007, test_loss: 0.9560, test_f1: 0.6090
 epoch: 91, train_loss: 0.5021, test_loss: 0.9050, test_f1: 0.6445
 epoch: 92, train_loss: 0.4915, test_loss: 1.0063, test_f1: 0.5868
 epoch: 93, train_loss: 0.4962, test_loss: 0.8514, test_f1: 0.6511
 epoch: 94, train_loss: 0.5043, test_loss: 0.9732, test_f1: 0.6219
 epoch: 95, train_loss: 0.5137, test_loss: 0.9665, test_f1: 0.6142
 epoch: 96, train_loss: 0.5024, test_loss: 0.8981, test_f1: 0.6479
 epoch: 97, train_loss: 0.4766, test_loss: 0.9227, test_f1: 0.6263
 epoch: 98, train_loss: 0.4897, test_loss: 0.8328, test_f1: 0.6648
 epoch: 99, train_loss: 0.4702, test_loss: 0.8905, test_f1: 0.6743
##################ITERATION #9 ****************************************
 epoch: 0, train_loss: 1.2410, test_loss: 1.1960, test_f1: 0.3168
 epoch: 1, train_loss: 1.0259, test_loss: 1.0162, test_f1: 0.4907
 epoch: 2, train_loss: 0.9890, test_loss: 1.2382, test_f1: 0.4302
 epoch: 3, train_loss: 0.9563, test_loss: 1.1414, test_f1: 0.4178
 epoch: 4, train_loss: 0.9326, test_loss: 1.0023, test_f1: 0.5098
 epoch: 5, train_loss: 0.9368, test_loss: 0.9864, test_f1: 0.5102
 epoch: 6, train_loss: 0.9048, test_loss: 1.0456, test_f1: 0.4815
 epoch: 7, train_loss: 0.8987, test_loss: 0.9929, test_f1: 0.5105
 epoch: 8, train_loss: 0.8769, test_loss: 1.0735, test_f1: 0.5025
 epoch: 9, train_loss: 0.8752, test_loss: 0.8945, test_f1: 0.5491
 epoch: 10, train_loss: 0.8636, test_loss: 0.9973, test_f1: 0.4934
 epoch: 11, train_loss: 0.8634, test_loss: 1.1811, test_f1: 0.5133
 epoch: 12, train_loss: 0.8723, test_loss: 0.9793, test_f1: 0.5294
 epoch: 13, train_loss: 0.8399, test_loss: 0.9441, test_f1: 0.5714
 epoch: 14, train_loss: 0.8181, test_loss: 1.5820, test_f1: 0.4349
 epoch: 15, train_loss: 0.8215, test_loss: 1.0668, test_f1: 0.5157
 epoch: 16, train_loss: 0.8201, test_loss: 1.1486, test_f1: 0.4728
 epoch: 17, train_loss: 0.8075, test_loss: 0.9394, test_f1: 0.5730
 epoch: 18, train_loss: 0.7946, test_loss: 0.9584, test_f1: 0.5419
 epoch: 19, train_loss: 0.7901, test_loss: 0.9574, test_f1: 0.5474
 epoch: 20, train_loss: 0.7976, test_loss: 0.9199, test_f1: 0.5530
 epoch: 21, train_loss: 0.7688, test_loss: 1.0109, test_f1: 0.5311
 epoch: 22, train_loss: 0.7578, test_loss: 0.8650, test_f1: 0.6126
 epoch: 23, train_loss: 0.7663, test_loss: 0.9528, test_f1: 0.5948
 epoch: 24, train_loss: 0.7708, test_loss: 1.1433, test_f1: 0.5658
 epoch: 25, train_loss: 0.7572, test_loss: 1.0008, test_f1: 0.5914
 epoch: 26, train_loss: 0.7493, test_loss: 0.9210, test_f1: 0.5448
 epoch: 27, train_loss: 0.7508, test_loss: 0.9125, test_f1: 0.6052
 epoch: 28, train_loss: 0.7642, test_loss: 0.9754, test_f1: 0.5384
 epoch: 29, train_loss: 0.7487, test_loss: 1.0083, test_f1: 0.5554
 epoch: 30, train_loss: 0.7434, test_loss: 0.8971, test_f1: 0.5767
 epoch: 31, train_loss: 0.7137, test_loss: 0.9156, test_f1: 0.6355
 epoch: 32, train_loss: 0.7065, test_loss: 0.9069, test_f1: 0.5706
 epoch: 33, train_loss: 0.7295, test_loss: 0.8351, test_f1: 0.6009
 epoch: 34, train_loss: 0.7180, test_loss: 1.0245, test_f1: 0.5582
 epoch: 35, train_loss: 0.7268, test_loss: 0.9702, test_f1: 0.5806
 epoch: 36, train_loss: 0.7010, test_loss: 1.0333, test_f1: 0.5857
 epoch: 37, train_loss: 0.7223, test_loss: 0.9698, test_f1: 0.5942
 epoch: 38, train_loss: 0.7202, test_loss: 0.8842, test_f1: 0.6148
 epoch: 39, train_loss: 0.7209, test_loss: 0.9524, test_f1: 0.5821
 epoch: 40, train_loss: 0.6932, test_loss: 0.9116, test_f1: 0.6080
 epoch: 41, train_loss: 0.6965, test_loss: 0.9015, test_f1: 0.5874
 epoch: 42, train_loss: 0.6878, test_loss: 1.0364, test_f1: 0.5808
 epoch: 43, train_loss: 0.6882, test_loss: 1.1290, test_f1: 0.5409
 epoch: 44, train_loss: 0.6843, test_loss: 0.8713, test_f1: 0.5962
 epoch: 45, train_loss: 0.6673, test_loss: 0.9689, test_f1: 0.5609
 epoch: 46, train_loss: 0.6924, test_loss: 0.9538, test_f1: 0.5930
 epoch: 47, train_loss: 0.6887, test_loss: 0.9028, test_f1: 0.6001
 epoch: 48, train_loss: 0.6897, test_loss: 1.0612, test_f1: 0.5821
 epoch: 49, train_loss: 0.6689, test_loss: 1.0567, test_f1: 0.6032
 epoch: 50, train_loss: 0.6768, test_loss: 0.9438, test_f1: 0.6135
 epoch: 51, train_loss: 0.6366, test_loss: 0.9016, test_f1: 0.6375
 epoch: 52, train_loss: 0.6367, test_loss: 0.9230, test_f1: 0.5979
 epoch: 53, train_loss: 0.6151, test_loss: 0.9402, test_f1: 0.6221
 epoch: 54, train_loss: 0.6049, test_loss: 1.0175, test_f1: 0.5638
 epoch: 55, train_loss: 0.6049, test_loss: 1.0167, test_f1: 0.5917
 epoch: 56, train_loss: 0.6043, test_loss: 1.0322, test_f1: 0.5816
 epoch: 57, train_loss: 0.6118, test_loss: 0.9902, test_f1: 0.6601
 epoch: 58, train_loss: 0.6239, test_loss: 0.9895, test_f1: 0.6276
 epoch: 59, train_loss: 0.6062, test_loss: 0.9209, test_f1: 0.6372
 epoch: 60, train_loss: 0.6013, test_loss: 0.9499, test_f1: 0.6080
 epoch: 61, train_loss: 0.5997, test_loss: 0.9498, test_f1: 0.6667
 epoch: 62, train_loss: 0.5963, test_loss: 1.1016, test_f1: 0.5870
 epoch: 63, train_loss: 0.6008, test_loss: 0.9735, test_f1: 0.6136
 epoch: 64, train_loss: 0.5787, test_loss: 0.9585, test_f1: 0.6088
 epoch: 65, train_loss: 0.5828, test_loss: 1.0151, test_f1: 0.6082
 epoch: 66, train_loss: 0.5904, test_loss: 1.0313, test_f1: 0.6062
 epoch: 67, train_loss: 0.5767, test_loss: 0.9453, test_f1: 0.6100
 epoch: 68, train_loss: 0.5810, test_loss: 0.9946, test_f1: 0.6370
 epoch: 69, train_loss: 0.5806, test_loss: 0.9987, test_f1: 0.6022
 epoch: 70, train_loss: 0.5652, test_loss: 0.9984, test_f1: 0.6354
 epoch: 71, train_loss: 0.5648, test_loss: 1.0164, test_f1: 0.5684
 epoch: 72, train_loss: 0.5599, test_loss: 0.9632, test_f1: 0.6468
 epoch: 73, train_loss: 0.5735, test_loss: 1.1814, test_f1: 0.6047
 epoch: 74, train_loss: 0.5833, test_loss: 0.9976, test_f1: 0.6015
 epoch: 75, train_loss: 0.5610, test_loss: 1.0181, test_f1: 0.6132
 epoch: 76, train_loss: 0.5609, test_loss: 1.1105, test_f1: 0.6196
 epoch: 77, train_loss: 0.5833, test_loss: 1.0094, test_f1: 0.6216
 epoch: 78, train_loss: 0.5628, test_loss: 0.9263, test_f1: 0.6406
 epoch: 79, train_loss: 0.5468, test_loss: 0.9890, test_f1: 0.6250
 epoch: 80, train_loss: 0.5746, test_loss: 0.8928, test_f1: 0.6310
 epoch: 81, train_loss: 0.5477, test_loss: 1.0603, test_f1: 0.5856
 epoch: 82, train_loss: 0.5478, test_loss: 1.0698, test_f1: 0.6054
 epoch: 83, train_loss: 0.5370, test_loss: 1.1083, test_f1: 0.5947
 epoch: 84, train_loss: 0.5677, test_loss: 1.0974, test_f1: 0.6121
 epoch: 85, train_loss: 0.5414, test_loss: 1.0004, test_f1: 0.6092
 epoch: 86, train_loss: 0.5570, test_loss: 1.2984, test_f1: 0.5559
 epoch: 87, train_loss: 0.5314, test_loss: 0.9995, test_f1: 0.6379
 epoch: 88, train_loss: 0.5476, test_loss: 1.0101, test_f1: 0.6228
 epoch: 89, train_loss: 0.5394, test_loss: 1.0686, test_f1: 0.5725
 epoch: 90, train_loss: 0.5170, test_loss: 1.1077, test_f1: 0.6022
 epoch: 91, train_loss: 0.5157, test_loss: 1.1298, test_f1: 0.6209
 epoch: 92, train_loss: 0.5125, test_loss: 1.1235, test_f1: 0.6306
 epoch: 93, train_loss: 0.5047, test_loss: 1.0301, test_f1: 0.6146
 epoch: 94, train_loss: 0.5260, test_loss: 1.1002, test_f1: 0.6322
 epoch: 95, train_loss: 0.5207, test_loss: 1.1285, test_f1: 0.6133
 epoch: 96, train_loss: 0.5198, test_loss: 1.0887, test_f1: 0.6270
 epoch: 97, train_loss: 0.5181, test_loss: 1.1001, test_f1: 0.6111
 epoch: 98, train_loss: 0.5077, test_loss: 1.2028, test_f1: 0.5950
 epoch: 99, train_loss: 0.5259, test_loss: 1.0646, test_f1: 0.6085

Training completed in 478.98 seconds
Best F1: 0.7153 at epoch 93
Mean F1 across iterations: 0.6766  0.0142
========================FINAL RESULTS================================
FEGIN weighted F1: 0.7153  0.0142
python main.py --data ltspice_examples --representation component_pin --model FEGIN --layers 3 --hiddens 32 --batch_size 128 --lr 0.01 --emb_size 128 --epochs 100 --save_appendix component_pin_L3_H32_BS128_LR0.01_E128 --no_val
-----



STDERR:
  File "main.py", line 370, in <module>
    main()
  File "main.py", line 254, in main
    dataset = dataset_class(
  File "/home/philip/projects/ltspice_examples_code_repo/Circuit-Completion-Using-GNNs/component_classification_with_link_prediction_head/evaluation/FEGIN/kernel/circuit_datasets.py", line 15, in __init__
    self.data, self.slices = torch.load(self.processed_paths[0])
  File "/home/philip/.local/lib/python3.8/site-packages/torch/serialization.py", line 1040, in load
    warnings.warn(
  File "/usr/lib/python3.8/warnings.py", line 109, in _showwarnmsg
    sw(msg.message, msg.category, msg.filename, msg.lineno,
  File "main.py", line 47, in warn_with_traceback
    traceback.print_stack(file=log)
/home/philip/projects/ltspice_examples_code_repo/Circuit-Completion-Using-GNNs/component_classification_with_link_prediction_head/evaluation/FEGIN/kernel/circuit_datasets.py:15: FutureWarning: You are using `torch.load` with `weights_only=False` (the current default value), which uses the default pickle module implicitly. It is possible to construct malicious pickle data which will execute arbitrary code during unpickling (See https://github.com/pytorch/pytorch/blob/main/SECURITY.md#untrusted-models for more details). In a future release, the default value for `weights_only` will be flipped to `True`. This limits the functions that could be executed during unpickling. Arbitrary objects will no longer be allowed to be loaded via this mode unless they are explicitly allowlisted by the user via `torch.serialization.add_safe_globals`. We recommend you start setting `weights_only=True` for any use case where you don't have full control of the loaded file. Please open an issue on GitHub for any issues related to this experimental feature.
  self.data, self.slices = torch.load(self.processed_paths[0])
