STDOUT:
Results will be saved in /home/philip/projects/ltspice_examples_code_repo/Circuit-Completion-Using-GNNs/component_classification_with_link_prediction_head/evaluation/FEGIN/results/model_FEGIN_dataset_ltspice_demos
Command line input: python main.py --data ltspice_demos --representation component_net --model FEGIN --layers 4 --hiddens 32 --batch_size 32 --lr 0.01 --emb_size 128 --epochs 100 --save_appendix component_net_L4_H32_BS32_LR0.01_E128 --no_val
 is saved.
-----
ltspice_demos - FEGIN
Using 4 layers, 32 hidden units, h = 2
Loading component_net representation dataset
ENTERED
Training FEGIN on component_net representation
Train: 1565, Test: 383
##################ITERATION #0 ****************************************
 epoch: 0, train_loss: 1.1980, test_loss: 1.3493, test_f1: 0.2539
 epoch: 1, train_loss: 1.0410, test_loss: 1.0826, test_f1: 0.5079
 epoch: 2, train_loss: 0.9903, test_loss: 1.0396, test_f1: 0.5035
 epoch: 3, train_loss: 0.9809, test_loss: 1.0793, test_f1: 0.5015
 epoch: 4, train_loss: 0.9482, test_loss: 1.0286, test_f1: 0.5368
 epoch: 5, train_loss: 0.9439, test_loss: 1.1325, test_f1: 0.5155
 epoch: 6, train_loss: 0.9299, test_loss: 1.0684, test_f1: 0.5166
 epoch: 7, train_loss: 0.9115, test_loss: 1.0387, test_f1: 0.5385
 epoch: 8, train_loss: 0.9123, test_loss: 1.1180, test_f1: 0.4975
 epoch: 9, train_loss: 0.9136, test_loss: 1.1469, test_f1: 0.5473
 epoch: 10, train_loss: 0.9295, test_loss: 1.0840, test_f1: 0.5214
 epoch: 11, train_loss: 0.9032, test_loss: 1.0700, test_f1: 0.5544
 epoch: 12, train_loss: 0.8770, test_loss: 1.0393, test_f1: 0.5413
 epoch: 13, train_loss: 0.8824, test_loss: 1.0294, test_f1: 0.5617
 epoch: 14, train_loss: 0.8810, test_loss: 0.9978, test_f1: 0.5831
 epoch: 15, train_loss: 0.8513, test_loss: 0.9932, test_f1: 0.5844
 epoch: 16, train_loss: 0.8214, test_loss: 1.0779, test_f1: 0.5422
 epoch: 17, train_loss: 0.8382, test_loss: 1.0214, test_f1: 0.5811
 epoch: 18, train_loss: 0.8158, test_loss: 1.0536, test_f1: 0.5697
 epoch: 19, train_loss: 0.8173, test_loss: 1.0073, test_f1: 0.5367
 epoch: 20, train_loss: 0.8345, test_loss: 0.9906, test_f1: 0.5762
 epoch: 21, train_loss: 0.8051, test_loss: 1.1541, test_f1: 0.5239
 epoch: 22, train_loss: 0.7960, test_loss: 1.0188, test_f1: 0.5632
 epoch: 23, train_loss: 0.7734, test_loss: 1.0102, test_f1: 0.5916
 epoch: 24, train_loss: 0.8096, test_loss: 1.1017, test_f1: 0.5529
 epoch: 25, train_loss: 0.7746, test_loss: 1.1088, test_f1: 0.5707
 epoch: 26, train_loss: 0.7997, test_loss: 1.3032, test_f1: 0.4747
 epoch: 27, train_loss: 0.7780, test_loss: 1.0752, test_f1: 0.5622
 epoch: 28, train_loss: 0.7684, test_loss: 1.0600, test_f1: 0.5415
 epoch: 29, train_loss: 0.7642, test_loss: 1.1823, test_f1: 0.4537
 epoch: 30, train_loss: 0.7411, test_loss: 1.1944, test_f1: 0.5466
 epoch: 31, train_loss: 0.7565, test_loss: 1.1673, test_f1: 0.5136
 epoch: 32, train_loss: 0.7667, test_loss: 1.1174, test_f1: 0.5224
 epoch: 33, train_loss: 0.7247, test_loss: 1.0912, test_f1: 0.5484
 epoch: 34, train_loss: 0.7100, test_loss: 1.1761, test_f1: 0.5513
 epoch: 35, train_loss: 0.7331, test_loss: 1.0652, test_f1: 0.5607
 epoch: 36, train_loss: 0.7051, test_loss: 1.2428, test_f1: 0.5688
 epoch: 37, train_loss: 0.7138, test_loss: 1.0667, test_f1: 0.5447
 epoch: 38, train_loss: 0.7047, test_loss: 1.2524, test_f1: 0.5415
 epoch: 39, train_loss: 0.7069, test_loss: 1.1295, test_f1: 0.5398
 epoch: 40, train_loss: 0.7007, test_loss: 1.3305, test_f1: 0.5228
 epoch: 41, train_loss: 0.7156, test_loss: 1.2057, test_f1: 0.5750
 epoch: 42, train_loss: 0.7042, test_loss: 1.1628, test_f1: 0.5528
 epoch: 43, train_loss: 0.7043, test_loss: 1.1498, test_f1: 0.5297
 epoch: 44, train_loss: 0.6975, test_loss: 1.0706, test_f1: 0.5836
 epoch: 45, train_loss: 0.6726, test_loss: 1.1585, test_f1: 0.5726
 epoch: 46, train_loss: 0.6594, test_loss: 1.1727, test_f1: 0.5311
 epoch: 47, train_loss: 0.6823, test_loss: 1.1281, test_f1: 0.5637
 epoch: 48, train_loss: 0.6812, test_loss: 1.3021, test_f1: 0.5129
 epoch: 49, train_loss: 0.7158, test_loss: 1.3264, test_f1: 0.5366
 epoch: 50, train_loss: 0.7147, test_loss: 1.1210, test_f1: 0.5029
 epoch: 51, train_loss: 0.6788, test_loss: 1.2388, test_f1: 0.5585
 epoch: 52, train_loss: 0.6263, test_loss: 1.2722, test_f1: 0.5475
 epoch: 53, train_loss: 0.6079, test_loss: 1.3496, test_f1: 0.5557
 epoch: 54, train_loss: 0.6174, test_loss: 1.2711, test_f1: 0.5746
 epoch: 55, train_loss: 0.6274, test_loss: 1.2103, test_f1: 0.5766
 epoch: 56, train_loss: 0.6073, test_loss: 1.3017, test_f1: 0.5303
 epoch: 57, train_loss: 0.6330, test_loss: 1.3025, test_f1: 0.5619
 epoch: 58, train_loss: 0.5863, test_loss: 1.3602, test_f1: 0.5513
 epoch: 59, train_loss: 0.6032, test_loss: 1.3098, test_f1: 0.5414
 epoch: 60, train_loss: 0.5910, test_loss: 1.3063, test_f1: 0.5823
 epoch: 61, train_loss: 0.6016, test_loss: 1.3425, test_f1: 0.5628
 epoch: 62, train_loss: 0.5807, test_loss: 1.3357, test_f1: 0.5483
 epoch: 63, train_loss: 0.5709, test_loss: 1.3291, test_f1: 0.5602
 epoch: 64, train_loss: 0.5799, test_loss: 1.4317, test_f1: 0.5813
 epoch: 65, train_loss: 0.5953, test_loss: 1.3794, test_f1: 0.5592
 epoch: 66, train_loss: 0.5803, test_loss: 1.3389, test_f1: 0.5642
 epoch: 67, train_loss: 0.5523, test_loss: 1.5186, test_f1: 0.5362
 epoch: 68, train_loss: 0.5495, test_loss: 1.5116, test_f1: 0.5400
 epoch: 69, train_loss: 0.5835, test_loss: 1.4894, test_f1: 0.5421
 epoch: 70, train_loss: 0.5517, test_loss: 1.3915, test_f1: 0.5814
 epoch: 71, train_loss: 0.5642, test_loss: 1.4428, test_f1: 0.5426
 epoch: 72, train_loss: 0.5542, test_loss: 1.3598, test_f1: 0.5699
 epoch: 73, train_loss: 0.5787, test_loss: 1.3692, test_f1: 0.5812
 epoch: 74, train_loss: 0.5736, test_loss: 1.4039, test_f1: 0.5458
 epoch: 75, train_loss: 0.5509, test_loss: 1.4608, test_f1: 0.5492
 epoch: 76, train_loss: 0.5926, test_loss: 1.2694, test_f1: 0.6032
 epoch: 77, train_loss: 0.5550, test_loss: 1.6308, test_f1: 0.5233
 epoch: 78, train_loss: 0.5009, test_loss: 1.6466, test_f1: 0.5491
 epoch: 79, train_loss: 0.5702, test_loss: 1.4791, test_f1: 0.5366
 epoch: 80, train_loss: 0.5512, test_loss: 1.4785, test_f1: 0.5458
 epoch: 81, train_loss: 0.5346, test_loss: 1.5358, test_f1: 0.5432
 epoch: 82, train_loss: 0.5274, test_loss: 1.5251, test_f1: 0.5706
 epoch: 83, train_loss: 0.5207, test_loss: 1.7096, test_f1: 0.5469
 epoch: 84, train_loss: 0.5410, test_loss: 1.4985, test_f1: 0.5415
 epoch: 85, train_loss: 0.5125, test_loss: 1.5508, test_f1: 0.5537
 epoch: 86, train_loss: 0.5505, test_loss: 1.4259, test_f1: 0.5723
 epoch: 87, train_loss: 0.5186, test_loss: 1.4667, test_f1: 0.5714
 epoch: 88, train_loss: 0.5436, test_loss: 1.5488, test_f1: 0.5651
 epoch: 89, train_loss: 0.5214, test_loss: 1.7034, test_f1: 0.5536
 epoch: 90, train_loss: 0.5154, test_loss: 1.5931, test_f1: 0.5776
 epoch: 91, train_loss: 0.5431, test_loss: 1.5991, test_f1: 0.5639
 epoch: 92, train_loss: 0.5164, test_loss: 1.7330, test_f1: 0.5248
 epoch: 93, train_loss: 0.5075, test_loss: 1.6957, test_f1: 0.5563
 epoch: 94, train_loss: 0.5209, test_loss: 1.6396, test_f1: 0.5757
 epoch: 95, train_loss: 0.5212, test_loss: 1.7458, test_f1: 0.5508
 epoch: 96, train_loss: 0.4925, test_loss: 1.8824, test_f1: 0.5357
 epoch: 97, train_loss: 0.5002, test_loss: 1.6925, test_f1: 0.5472
 epoch: 98, train_loss: 0.5116, test_loss: 1.9133, test_f1: 0.5678
 epoch: 99, train_loss: 0.4885, test_loss: 1.5993, test_f1: 0.5854
##################ITERATION #1 ****************************************
 epoch: 0, train_loss: 1.1807, test_loss: 1.1422, test_f1: 0.4934
 epoch: 1, train_loss: 1.0403, test_loss: 1.1653, test_f1: 0.3701
 epoch: 2, train_loss: 1.0428, test_loss: 1.2646, test_f1: 0.3426
 epoch: 3, train_loss: 0.9932, test_loss: 1.0672, test_f1: 0.4261
 epoch: 4, train_loss: 0.9824, test_loss: 1.0533, test_f1: 0.4735
 epoch: 5, train_loss: 0.9573, test_loss: 1.1308, test_f1: 0.4347
 epoch: 6, train_loss: 0.9455, test_loss: 1.1709, test_f1: 0.5121
 epoch: 7, train_loss: 0.9204, test_loss: 1.1226, test_f1: 0.5559
 epoch: 8, train_loss: 0.9257, test_loss: 1.0428, test_f1: 0.5124
 epoch: 9, train_loss: 0.9044, test_loss: 1.2831, test_f1: 0.5521
 epoch: 10, train_loss: 0.9187, test_loss: 1.0279, test_f1: 0.5047
 epoch: 11, train_loss: 0.9181, test_loss: 1.0863, test_f1: 0.5456
 epoch: 12, train_loss: 0.8911, test_loss: 1.0262, test_f1: 0.5788
 epoch: 13, train_loss: 0.8796, test_loss: 1.0281, test_f1: 0.5415
 epoch: 14, train_loss: 0.8817, test_loss: 1.1506, test_f1: 0.4801
 epoch: 15, train_loss: 0.8582, test_loss: 1.1048, test_f1: 0.6017
 epoch: 16, train_loss: 0.8504, test_loss: 1.1754, test_f1: 0.5251
 epoch: 17, train_loss: 0.8415, test_loss: 1.1268, test_f1: 0.5706
 epoch: 18, train_loss: 0.8467, test_loss: 1.0521, test_f1: 0.5840
 epoch: 19, train_loss: 0.8639, test_loss: 1.0961, test_f1: 0.5204
 epoch: 20, train_loss: 0.8358, test_loss: 1.1983, test_f1: 0.5663
 epoch: 21, train_loss: 0.8359, test_loss: 1.1150, test_f1: 0.6098
 epoch: 22, train_loss: 0.8277, test_loss: 1.0715, test_f1: 0.5341
 epoch: 23, train_loss: 0.8013, test_loss: 1.1995, test_f1: 0.4599
 epoch: 24, train_loss: 0.7954, test_loss: 1.0064, test_f1: 0.5593
 epoch: 25, train_loss: 0.8042, test_loss: 1.1487, test_f1: 0.5355
 epoch: 26, train_loss: 0.8141, test_loss: 1.0161, test_f1: 0.6189
 epoch: 27, train_loss: 0.7659, test_loss: 1.1830, test_f1: 0.5563
 epoch: 28, train_loss: 0.7876, test_loss: 1.0519, test_f1: 0.6096
 epoch: 29, train_loss: 0.7477, test_loss: 1.0149, test_f1: 0.5945
 epoch: 30, train_loss: 0.7592, test_loss: 1.1162, test_f1: 0.5059
 epoch: 31, train_loss: 0.7497, test_loss: 1.1628, test_f1: 0.5528
 epoch: 32, train_loss: 0.7360, test_loss: 0.9721, test_f1: 0.6143
 epoch: 33, train_loss: 0.7289, test_loss: 1.0720, test_f1: 0.5794
 epoch: 34, train_loss: 0.7490, test_loss: 1.1097, test_f1: 0.5454
 epoch: 35, train_loss: 0.7136, test_loss: 1.3482, test_f1: 0.4879
 epoch: 36, train_loss: 0.7314, test_loss: 1.4206, test_f1: 0.4468
 epoch: 37, train_loss: 0.7138, test_loss: 1.1215, test_f1: 0.5536
 epoch: 38, train_loss: 0.7290, test_loss: 1.1445, test_f1: 0.5699
 epoch: 39, train_loss: 0.7279, test_loss: 1.1161, test_f1: 0.6062
 epoch: 40, train_loss: 0.7018, test_loss: 1.2935, test_f1: 0.5691
 epoch: 41, train_loss: 0.6721, test_loss: 1.4086, test_f1: 0.5106
 epoch: 42, train_loss: 0.6968, test_loss: 1.3560, test_f1: 0.5662
 epoch: 43, train_loss: 0.6993, test_loss: 1.1466, test_f1: 0.5761
 epoch: 44, train_loss: 0.6918, test_loss: 1.0968, test_f1: 0.6169
 epoch: 45, train_loss: 0.6820, test_loss: 1.6014, test_f1: 0.5435
 epoch: 46, train_loss: 0.6718, test_loss: 1.2134, test_f1: 0.5922
 epoch: 47, train_loss: 0.6366, test_loss: 1.2552, test_f1: 0.5295
 epoch: 48, train_loss: 0.6986, test_loss: 1.1471, test_f1: 0.5802
 epoch: 49, train_loss: 0.6732, test_loss: 1.2248, test_f1: 0.5933
 epoch: 50, train_loss: 0.6373, test_loss: 1.1733, test_f1: 0.5902
 epoch: 51, train_loss: 0.6313, test_loss: 1.1438, test_f1: 0.6421
 epoch: 52, train_loss: 0.5916, test_loss: 1.2110, test_f1: 0.6009
 epoch: 53, train_loss: 0.5812, test_loss: 1.3524, test_f1: 0.5313
 epoch: 54, train_loss: 0.5763, test_loss: 1.3360, test_f1: 0.6147
 epoch: 55, train_loss: 0.5855, test_loss: 1.2184, test_f1: 0.6000
 epoch: 56, train_loss: 0.6081, test_loss: 1.3355, test_f1: 0.5804
 epoch: 57, train_loss: 0.5672, test_loss: 1.1954, test_f1: 0.6393
 epoch: 58, train_loss: 0.5744, test_loss: 1.2371, test_f1: 0.6127
 epoch: 59, train_loss: 0.6095, test_loss: 1.5324, test_f1: 0.5472
 epoch: 60, train_loss: 0.5498, test_loss: 1.5557, test_f1: 0.5964
 epoch: 61, train_loss: 0.5915, test_loss: 1.3486, test_f1: 0.6027
 epoch: 62, train_loss: 0.5752, test_loss: 1.4518, test_f1: 0.6012
 epoch: 63, train_loss: 0.5778, test_loss: 1.4189, test_f1: 0.6053
 epoch: 64, train_loss: 0.5455, test_loss: 1.3853, test_f1: 0.5817
 epoch: 65, train_loss: 0.5482, test_loss: 1.3081, test_f1: 0.6059
 epoch: 66, train_loss: 0.5588, test_loss: 1.3913, test_f1: 0.5896
 epoch: 67, train_loss: 0.5534, test_loss: 1.5777, test_f1: 0.5804
 epoch: 68, train_loss: 0.5359, test_loss: 1.2577, test_f1: 0.6263
 epoch: 69, train_loss: 0.5562, test_loss: 1.7199, test_f1: 0.6140
 epoch: 70, train_loss: 0.5442, test_loss: 1.4917, test_f1: 0.5642
 epoch: 71, train_loss: 0.5468, test_loss: 1.4028, test_f1: 0.5452
 epoch: 72, train_loss: 0.5124, test_loss: 1.3988, test_f1: 0.6067
 epoch: 73, train_loss: 0.5220, test_loss: 1.4694, test_f1: 0.6342
 epoch: 74, train_loss: 0.5161, test_loss: 1.3514, test_f1: 0.5910
 epoch: 75, train_loss: 0.5201, test_loss: 1.5423, test_f1: 0.6015
 epoch: 76, train_loss: 0.5136, test_loss: 1.4974, test_f1: 0.6005
 epoch: 77, train_loss: 0.5310, test_loss: 1.5822, test_f1: 0.6035
 epoch: 78, train_loss: 0.5576, test_loss: 1.4595, test_f1: 0.6303
 epoch: 79, train_loss: 0.5282, test_loss: 1.5836, test_f1: 0.5761
 epoch: 80, train_loss: 0.5229, test_loss: 1.5464, test_f1: 0.5932
 epoch: 81, train_loss: 0.4886, test_loss: 1.4674, test_f1: 0.6457
 epoch: 82, train_loss: 0.5205, test_loss: 1.2910, test_f1: 0.6506
 epoch: 83, train_loss: 0.5091, test_loss: 1.7361, test_f1: 0.5626
 epoch: 84, train_loss: 0.5457, test_loss: 1.5009, test_f1: 0.6508
 epoch: 85, train_loss: 0.5144, test_loss: 1.4852, test_f1: 0.6005
 epoch: 86, train_loss: 0.5025, test_loss: 1.5363, test_f1: 0.6234
 epoch: 87, train_loss: 0.5089, test_loss: 1.6361, test_f1: 0.6180
 epoch: 88, train_loss: 0.4834, test_loss: 1.6989, test_f1: 0.6007
 epoch: 89, train_loss: 0.5038, test_loss: 1.6441, test_f1: 0.6026
 epoch: 90, train_loss: 0.5017, test_loss: 1.5338, test_f1: 0.6099
 epoch: 91, train_loss: 0.5032, test_loss: 1.7214, test_f1: 0.6062
 epoch: 92, train_loss: 0.5092, test_loss: 1.5271, test_f1: 0.6403
 epoch: 93, train_loss: 0.4920, test_loss: 1.5168, test_f1: 0.6524
 epoch: 94, train_loss: 0.5007, test_loss: 1.5140, test_f1: 0.6438
 epoch: 95, train_loss: 0.4808, test_loss: 1.5150, test_f1: 0.6578
 epoch: 96, train_loss: 0.5053, test_loss: 1.5783, test_f1: 0.6431
 epoch: 97, train_loss: 0.5019, test_loss: 1.5052, test_f1: 0.6011
 epoch: 98, train_loss: 0.4903, test_loss: 1.6709, test_f1: 0.6433
 epoch: 99, train_loss: 0.4783, test_loss: 1.8641, test_f1: 0.5683
##################ITERATION #2 ****************************************
 epoch: 0, train_loss: 1.1959, test_loss: 1.1523, test_f1: 0.3623
 epoch: 1, train_loss: 1.0371, test_loss: 1.0738, test_f1: 0.4393
 epoch: 2, train_loss: 0.9969, test_loss: 1.0431, test_f1: 0.5282
 epoch: 3, train_loss: 0.9833, test_loss: 1.0909, test_f1: 0.3833
 epoch: 4, train_loss: 0.9759, test_loss: 1.0764, test_f1: 0.4834
 epoch: 5, train_loss: 0.9491, test_loss: 1.0508, test_f1: 0.5342
 epoch: 6, train_loss: 0.9751, test_loss: 1.0476, test_f1: 0.4982
 epoch: 7, train_loss: 0.9580, test_loss: 1.0539, test_f1: 0.5072
 epoch: 8, train_loss: 0.9371, test_loss: 1.0293, test_f1: 0.4949
 epoch: 9, train_loss: 0.9351, test_loss: 1.0137, test_f1: 0.5459
 epoch: 10, train_loss: 0.9392, test_loss: 1.1113, test_f1: 0.5076
 epoch: 11, train_loss: 0.9027, test_loss: 1.0592, test_f1: 0.5769
 epoch: 12, train_loss: 0.9063, test_loss: 1.0380, test_f1: 0.5374
 epoch: 13, train_loss: 0.9196, test_loss: 1.0283, test_f1: 0.5503
 epoch: 14, train_loss: 0.8939, test_loss: 0.9784, test_f1: 0.5521
 epoch: 15, train_loss: 0.8830, test_loss: 0.9985, test_f1: 0.5574
 epoch: 16, train_loss: 0.8597, test_loss: 1.0671, test_f1: 0.5469
 epoch: 17, train_loss: 0.8827, test_loss: 1.3970, test_f1: 0.3871
 epoch: 18, train_loss: 0.8893, test_loss: 1.0982, test_f1: 0.5530
 epoch: 19, train_loss: 0.8908, test_loss: 1.0712, test_f1: 0.5337
 epoch: 20, train_loss: 0.8983, test_loss: 1.0591, test_f1: 0.4927
 epoch: 21, train_loss: 0.8556, test_loss: 1.0471, test_f1: 0.5294
 epoch: 22, train_loss: 0.8491, test_loss: 1.1692, test_f1: 0.4414
 epoch: 23, train_loss: 0.8076, test_loss: 1.0551, test_f1: 0.4618
 epoch: 24, train_loss: 0.8307, test_loss: 1.5063, test_f1: 0.4385
 epoch: 25, train_loss: 0.8305, test_loss: 1.0745, test_f1: 0.5224
 epoch: 26, train_loss: 0.7994, test_loss: 1.0522, test_f1: 0.5318
 epoch: 27, train_loss: 0.8167, test_loss: 1.1350, test_f1: 0.5673
 epoch: 28, train_loss: 0.7803, test_loss: 1.1249, test_f1: 0.5568
 epoch: 29, train_loss: 0.7899, test_loss: 1.0017, test_f1: 0.5555
 epoch: 30, train_loss: 0.7764, test_loss: 1.3047, test_f1: 0.5279
 epoch: 31, train_loss: 0.7487, test_loss: 1.1738, test_f1: 0.5762
 epoch: 32, train_loss: 0.7781, test_loss: 1.0271, test_f1: 0.5856
 epoch: 33, train_loss: 0.7746, test_loss: 1.1153, test_f1: 0.5713
 epoch: 34, train_loss: 0.7511, test_loss: 1.1932, test_f1: 0.5574
 epoch: 35, train_loss: 0.7248, test_loss: 1.1731, test_f1: 0.6127
 epoch: 36, train_loss: 0.7934, test_loss: 1.0837, test_f1: 0.5388
 epoch: 37, train_loss: 0.7421, test_loss: 1.1027, test_f1: 0.5803
 epoch: 38, train_loss: 0.7431, test_loss: 1.4145, test_f1: 0.5171
 epoch: 39, train_loss: 0.7133, test_loss: 1.1156, test_f1: 0.5522
 epoch: 40, train_loss: 0.7217, test_loss: 1.1531, test_f1: 0.5901
 epoch: 41, train_loss: 0.7123, test_loss: 1.2080, test_f1: 0.5725
 epoch: 42, train_loss: 0.7373, test_loss: 1.1767, test_f1: 0.5025
 epoch: 43, train_loss: 0.7515, test_loss: 1.2871, test_f1: 0.5328
 epoch: 44, train_loss: 0.7363, test_loss: 1.0305, test_f1: 0.6055
 epoch: 45, train_loss: 0.6984, test_loss: 1.3120, test_f1: 0.5259
 epoch: 46, train_loss: 0.7026, test_loss: 1.2298, test_f1: 0.6011
 epoch: 47, train_loss: 0.7010, test_loss: 1.0928, test_f1: 0.6130
 epoch: 48, train_loss: 0.6909, test_loss: 1.2780, test_f1: 0.5848
 epoch: 49, train_loss: 0.7209, test_loss: 1.2799, test_f1: 0.6141
 epoch: 50, train_loss: 0.6930, test_loss: 1.4606, test_f1: 0.5450
 epoch: 51, train_loss: 0.6596, test_loss: 1.1818, test_f1: 0.6066
 epoch: 52, train_loss: 0.6409, test_loss: 1.1317, test_f1: 0.6492
 epoch: 53, train_loss: 0.6233, test_loss: 1.2042, test_f1: 0.6320
 epoch: 54, train_loss: 0.6085, test_loss: 1.4194, test_f1: 0.6030
 epoch: 55, train_loss: 0.5993, test_loss: 1.5653, test_f1: 0.6039
 epoch: 56, train_loss: 0.6152, test_loss: 1.2751, test_f1: 0.6066
 epoch: 57, train_loss: 0.6116, test_loss: 1.2542, test_f1: 0.6124
 epoch: 58, train_loss: 0.6063, test_loss: 1.3877, test_f1: 0.5934
 epoch: 59, train_loss: 0.5914, test_loss: 1.3253, test_f1: 0.6076
 epoch: 60, train_loss: 0.6054, test_loss: 1.4776, test_f1: 0.6018
 epoch: 61, train_loss: 0.5988, test_loss: 1.2721, test_f1: 0.5634
 epoch: 62, train_loss: 0.5798, test_loss: 1.2797, test_f1: 0.6427
 epoch: 63, train_loss: 0.6003, test_loss: 1.3010, test_f1: 0.5900
 epoch: 64, train_loss: 0.5792, test_loss: 1.2960, test_f1: 0.6440
 epoch: 65, train_loss: 0.5719, test_loss: 1.2576, test_f1: 0.6117
 epoch: 66, train_loss: 0.5941, test_loss: 1.2098, test_f1: 0.6296
 epoch: 67, train_loss: 0.6212, test_loss: 1.6585, test_f1: 0.5501
 epoch: 68, train_loss: 0.6034, test_loss: 1.2339, test_f1: 0.6197
 epoch: 69, train_loss: 0.5709, test_loss: 1.2142, test_f1: 0.5885
 epoch: 70, train_loss: 0.5664, test_loss: 1.6058, test_f1: 0.6150
 epoch: 71, train_loss: 0.5634, test_loss: 1.4250, test_f1: 0.6117
 epoch: 72, train_loss: 0.5848, test_loss: 1.4327, test_f1: 0.6117
 epoch: 73, train_loss: 0.5452, test_loss: 1.5024, test_f1: 0.6311
 epoch: 74, train_loss: 0.5854, test_loss: 1.4204, test_f1: 0.6118
 epoch: 75, train_loss: 0.5505, test_loss: 1.3964, test_f1: 0.6229
 epoch: 76, train_loss: 0.5471, test_loss: 1.7318, test_f1: 0.5734
 epoch: 77, train_loss: 0.5582, test_loss: 1.6903, test_f1: 0.5955
 epoch: 78, train_loss: 0.5534, test_loss: 1.4955, test_f1: 0.5652
 epoch: 79, train_loss: 0.5464, test_loss: 1.5447, test_f1: 0.6156
 epoch: 80, train_loss: 0.5679, test_loss: 1.4100, test_f1: 0.6329
 epoch: 81, train_loss: 0.5526, test_loss: 1.4388, test_f1: 0.6271
 epoch: 82, train_loss: 0.5625, test_loss: 1.2981, test_f1: 0.6073
 epoch: 83, train_loss: 0.5434, test_loss: 1.4873, test_f1: 0.5893
 epoch: 84, train_loss: 0.5469, test_loss: 1.3402, test_f1: 0.6335
 epoch: 85, train_loss: 0.5235, test_loss: 1.5187, test_f1: 0.6131
 epoch: 86, train_loss: 0.5350, test_loss: 1.4740, test_f1: 0.6161
 epoch: 87, train_loss: 0.5245, test_loss: 1.4349, test_f1: 0.6225
 epoch: 88, train_loss: 0.5385, test_loss: 1.4458, test_f1: 0.5753
 epoch: 89, train_loss: 0.5236, test_loss: 1.3674, test_f1: 0.6295
 epoch: 90, train_loss: 0.5536, test_loss: 1.3148, test_f1: 0.6295
 epoch: 91, train_loss: 0.5274, test_loss: 1.3573, test_f1: 0.6266
 epoch: 92, train_loss: 0.5024, test_loss: 1.3990, test_f1: 0.6212
 epoch: 93, train_loss: 0.5150, test_loss: 1.4036, test_f1: 0.6528
 epoch: 94, train_loss: 0.5369, test_loss: 1.6487, test_f1: 0.5665
 epoch: 95, train_loss: 0.5391, test_loss: 1.3827, test_f1: 0.5924
 epoch: 96, train_loss: 0.5132, test_loss: 1.3633, test_f1: 0.6494
 epoch: 97, train_loss: 0.4949, test_loss: 1.4249, test_f1: 0.6302
 epoch: 98, train_loss: 0.5134, test_loss: 1.4136, test_f1: 0.6352
 epoch: 99, train_loss: 0.4799, test_loss: 1.4878, test_f1: 0.5820
##################ITERATION #3 ****************************************
 epoch: 0, train_loss: 1.2150, test_loss: 1.2612, test_f1: 0.3451
 epoch: 1, train_loss: 1.0865, test_loss: 1.1043, test_f1: 0.4159
 epoch: 2, train_loss: 1.0329, test_loss: 1.2436, test_f1: 0.4346
 epoch: 3, train_loss: 1.0408, test_loss: 1.1240, test_f1: 0.4899
 epoch: 4, train_loss: 1.0045, test_loss: 1.1164, test_f1: 0.4853
 epoch: 5, train_loss: 0.9968, test_loss: 1.1772, test_f1: 0.4551
 epoch: 6, train_loss: 0.9809, test_loss: 1.1041, test_f1: 0.4394
 epoch: 7, train_loss: 0.9807, test_loss: 1.0787, test_f1: 0.4868
 epoch: 8, train_loss: 0.9502, test_loss: 1.1577, test_f1: 0.4718
 epoch: 9, train_loss: 0.9565, test_loss: 1.0154, test_f1: 0.5171
 epoch: 10, train_loss: 0.9417, test_loss: 1.0582, test_f1: 0.5291
 epoch: 11, train_loss: 0.9261, test_loss: 1.1922, test_f1: 0.5193
 epoch: 12, train_loss: 0.9228, test_loss: 1.0804, test_f1: 0.5604
 epoch: 13, train_loss: 0.9278, test_loss: 1.2358, test_f1: 0.4796
 epoch: 14, train_loss: 0.9146, test_loss: 1.0974, test_f1: 0.4807
 epoch: 15, train_loss: 0.9238, test_loss: 1.0420, test_f1: 0.5547
 epoch: 16, train_loss: 0.9412, test_loss: 1.0812, test_f1: 0.5489
 epoch: 17, train_loss: 0.9387, test_loss: 1.0214, test_f1: 0.5308
 epoch: 18, train_loss: 0.9196, test_loss: 1.0734, test_f1: 0.5508
 epoch: 19, train_loss: 0.8627, test_loss: 1.0560, test_f1: 0.5360
 epoch: 20, train_loss: 0.8743, test_loss: 1.0706, test_f1: 0.5524
 epoch: 21, train_loss: 0.8843, test_loss: 1.1212, test_f1: 0.5333
 epoch: 22, train_loss: 0.8557, test_loss: 1.0724, test_f1: 0.5704
 epoch: 23, train_loss: 0.8325, test_loss: 0.9743, test_f1: 0.5491
 epoch: 24, train_loss: 0.8195, test_loss: 1.0171, test_f1: 0.5556
 epoch: 25, train_loss: 0.8136, test_loss: 1.1095, test_f1: 0.5404
 epoch: 26, train_loss: 0.8217, test_loss: 1.0514, test_f1: 0.4944
 epoch: 27, train_loss: 0.8079, test_loss: 0.9882, test_f1: 0.5731
 epoch: 28, train_loss: 0.7825, test_loss: 1.1362, test_f1: 0.5397
 epoch: 29, train_loss: 0.7815, test_loss: 0.9757, test_f1: 0.5618
 epoch: 30, train_loss: 0.8039, test_loss: 1.0986, test_f1: 0.5573
 epoch: 31, train_loss: 0.7915, test_loss: 1.1712, test_f1: 0.5262
 epoch: 32, train_loss: 0.7541, test_loss: 2.0800, test_f1: 0.4175
 epoch: 33, train_loss: 0.7547, test_loss: 1.0986, test_f1: 0.5285
 epoch: 34, train_loss: 0.7390, test_loss: 1.0207, test_f1: 0.5811
 epoch: 35, train_loss: 0.7462, test_loss: 1.1072, test_f1: 0.5744
 epoch: 36, train_loss: 0.7902, test_loss: 1.0027, test_f1: 0.5497
 epoch: 37, train_loss: 0.7332, test_loss: 1.1152, test_f1: 0.5616
 epoch: 38, train_loss: 0.7190, test_loss: 1.1484, test_f1: 0.5411
 epoch: 39, train_loss: 0.7295, test_loss: 1.0858, test_f1: 0.5284
 epoch: 40, train_loss: 0.7626, test_loss: 0.9909, test_f1: 0.5826
 epoch: 41, train_loss: 0.7238, test_loss: 1.1122, test_f1: 0.5746
 epoch: 42, train_loss: 0.7454, test_loss: 1.3081, test_f1: 0.4586
 epoch: 43, train_loss: 0.7059, test_loss: 1.0894, test_f1: 0.5709
 epoch: 44, train_loss: 0.7441, test_loss: 1.2161, test_f1: 0.5483
 epoch: 45, train_loss: 0.7357, test_loss: 1.1546, test_f1: 0.5588
 epoch: 46, train_loss: 0.7149, test_loss: 1.1442, test_f1: 0.5641
 epoch: 47, train_loss: 0.6963, test_loss: 1.7910, test_f1: 0.4603
 epoch: 48, train_loss: 0.7210, test_loss: 1.0652, test_f1: 0.5596
 epoch: 49, train_loss: 0.6929, test_loss: 1.2424, test_f1: 0.5373
 epoch: 50, train_loss: 0.7145, test_loss: 1.2130, test_f1: 0.4747
 epoch: 51, train_loss: 0.6795, test_loss: 1.1637, test_f1: 0.5691
 epoch: 52, train_loss: 0.6256, test_loss: 1.2429, test_f1: 0.5800
 epoch: 53, train_loss: 0.6453, test_loss: 1.2429, test_f1: 0.5627
 epoch: 54, train_loss: 0.6235, test_loss: 1.4124, test_f1: 0.5792
 epoch: 55, train_loss: 0.6217, test_loss: 1.2747, test_f1: 0.5904
 epoch: 56, train_loss: 0.6166, test_loss: 1.3827, test_f1: 0.5774
 epoch: 57, train_loss: 0.5986, test_loss: 1.2540, test_f1: 0.6111
 epoch: 58, train_loss: 0.6183, test_loss: 1.3597, test_f1: 0.6301
 epoch: 59, train_loss: 0.6095, test_loss: 1.4204, test_f1: 0.5553
 epoch: 60, train_loss: 0.6151, test_loss: 1.3651, test_f1: 0.5924
 epoch: 61, train_loss: 0.6169, test_loss: 1.3882, test_f1: 0.5823
 epoch: 62, train_loss: 0.6046, test_loss: 1.2357, test_f1: 0.6132
 epoch: 63, train_loss: 0.5783, test_loss: 1.3309, test_f1: 0.5726
 epoch: 64, train_loss: 0.5816, test_loss: 1.4530, test_f1: 0.5672
 epoch: 65, train_loss: 0.5673, test_loss: 1.3690, test_f1: 0.5917
 epoch: 66, train_loss: 0.5905, test_loss: 1.5012, test_f1: 0.5865
 epoch: 67, train_loss: 0.5376, test_loss: 1.3595, test_f1: 0.5788
 epoch: 68, train_loss: 0.5651, test_loss: 1.3662, test_f1: 0.6046
 epoch: 69, train_loss: 0.5654, test_loss: 1.4926, test_f1: 0.5575
 epoch: 70, train_loss: 0.5696, test_loss: 1.5497, test_f1: 0.5656
 epoch: 71, train_loss: 0.5614, test_loss: 1.4047, test_f1: 0.6199
 epoch: 72, train_loss: 0.5629, test_loss: 1.3424, test_f1: 0.5894
 epoch: 73, train_loss: 0.5684, test_loss: 1.4204, test_f1: 0.5543
 epoch: 74, train_loss: 0.5527, test_loss: 1.2962, test_f1: 0.6018
 epoch: 75, train_loss: 0.5618, test_loss: 1.3603, test_f1: 0.5852
 epoch: 76, train_loss: 0.5470, test_loss: 1.5385, test_f1: 0.5712
 epoch: 77, train_loss: 0.5707, test_loss: 1.4617, test_f1: 0.5603
 epoch: 78, train_loss: 0.5568, test_loss: 1.4579, test_f1: 0.5909
 epoch: 79, train_loss: 0.5560, test_loss: 1.4850, test_f1: 0.5760
 epoch: 80, train_loss: 0.5396, test_loss: 1.5011, test_f1: 0.5965
 epoch: 81, train_loss: 0.5653, test_loss: 1.4799, test_f1: 0.5709
 epoch: 82, train_loss: 0.5621, test_loss: 1.4337, test_f1: 0.5829
 epoch: 83, train_loss: 0.5132, test_loss: 1.6121, test_f1: 0.5759
 epoch: 84, train_loss: 0.5628, test_loss: 1.5452, test_f1: 0.5738
 epoch: 85, train_loss: 0.5345, test_loss: 1.4945, test_f1: 0.5824
 epoch: 86, train_loss: 0.5351, test_loss: 1.5602, test_f1: 0.5821
 epoch: 87, train_loss: 0.5247, test_loss: 1.7144, test_f1: 0.5788
 epoch: 88, train_loss: 0.5087, test_loss: 1.7305, test_f1: 0.5930
 epoch: 89, train_loss: 0.5219, test_loss: 1.8288, test_f1: 0.5778
 epoch: 90, train_loss: 0.5448, test_loss: 1.5598, test_f1: 0.5890
 epoch: 91, train_loss: 0.5237, test_loss: 1.6033, test_f1: 0.6011
 epoch: 92, train_loss: 0.5455, test_loss: 1.5747, test_f1: 0.5464
 epoch: 93, train_loss: 0.5395, test_loss: 1.7280, test_f1: 0.5638
 epoch: 94, train_loss: 0.5038, test_loss: 1.4297, test_f1: 0.6165
 epoch: 95, train_loss: 0.5301, test_loss: 1.7326, test_f1: 0.5304
 epoch: 96, train_loss: 0.5336, test_loss: 1.5421, test_f1: 0.5358
 epoch: 97, train_loss: 0.5345, test_loss: 1.4538, test_f1: 0.5925
 epoch: 98, train_loss: 0.5320, test_loss: 1.4665, test_f1: 0.5592
 epoch: 99, train_loss: 0.4985, test_loss: 1.5368, test_f1: 0.6001
##################ITERATION #4 ****************************************
 epoch: 0, train_loss: 1.2093, test_loss: 1.2593, test_f1: 0.3625
 epoch: 1, train_loss: 1.0636, test_loss: 1.1129, test_f1: 0.3758
 epoch: 2, train_loss: 1.0174, test_loss: 1.0817, test_f1: 0.4129
 epoch: 3, train_loss: 0.9763, test_loss: 1.0715, test_f1: 0.5379
 epoch: 4, train_loss: 0.9772, test_loss: 1.0895, test_f1: 0.4865
 epoch: 5, train_loss: 0.9723, test_loss: 1.0854, test_f1: 0.4632
 epoch: 6, train_loss: 0.9650, test_loss: 1.0378, test_f1: 0.5328
 epoch: 7, train_loss: 0.9353, test_loss: 1.0749, test_f1: 0.5187
 epoch: 8, train_loss: 0.9272, test_loss: 1.0800, test_f1: 0.4899
 epoch: 9, train_loss: 0.9215, test_loss: 1.1273, test_f1: 0.4987
 epoch: 10, train_loss: 0.9143, test_loss: 1.0963, test_f1: 0.4571
 epoch: 11, train_loss: 0.9197, test_loss: 1.1304, test_f1: 0.5341
 epoch: 12, train_loss: 1.0051, test_loss: 1.0539, test_f1: 0.5080
 epoch: 13, train_loss: 0.9159, test_loss: 1.0817, test_f1: 0.5295
 epoch: 14, train_loss: 0.8844, test_loss: 1.0177, test_f1: 0.5324
 epoch: 15, train_loss: 0.9125, test_loss: 1.0119, test_f1: 0.5887
 epoch: 16, train_loss: 0.8699, test_loss: 1.0330, test_f1: 0.5542
 epoch: 17, train_loss: 0.8597, test_loss: 1.1092, test_f1: 0.5551
 epoch: 18, train_loss: 0.8608, test_loss: 0.9914, test_f1: 0.5600
 epoch: 19, train_loss: 0.8676, test_loss: 1.0279, test_f1: 0.4766
 epoch: 20, train_loss: 0.8549, test_loss: 1.0135, test_f1: 0.5592
 epoch: 21, train_loss: 0.8355, test_loss: 1.0117, test_f1: 0.5265
 epoch: 22, train_loss: 0.8381, test_loss: 1.1388, test_f1: 0.4948
 epoch: 23, train_loss: 0.8171, test_loss: 1.1904, test_f1: 0.3863
 epoch: 24, train_loss: 0.8215, test_loss: 1.1232, test_f1: 0.5128
 epoch: 25, train_loss: 0.8222, test_loss: 1.0486, test_f1: 0.5707
 epoch: 26, train_loss: 0.8242, test_loss: 1.0107, test_f1: 0.5694
 epoch: 27, train_loss: 0.8097, test_loss: 1.0617, test_f1: 0.5507
 epoch: 28, train_loss: 0.7860, test_loss: 1.0252, test_f1: 0.5910
 epoch: 29, train_loss: 0.7822, test_loss: 1.0176, test_f1: 0.5792
 epoch: 30, train_loss: 0.7925, test_loss: 1.0546, test_f1: 0.4959
 epoch: 31, train_loss: 0.7755, test_loss: 1.0098, test_f1: 0.5693
 epoch: 32, train_loss: 0.7866, test_loss: 1.0995, test_f1: 0.5939
 epoch: 33, train_loss: 0.7885, test_loss: 1.1259, test_f1: 0.5271
 epoch: 34, train_loss: 0.7979, test_loss: 0.9845, test_f1: 0.6096
 epoch: 35, train_loss: 0.7868, test_loss: 1.0125, test_f1: 0.5564
 epoch: 36, train_loss: 0.7685, test_loss: 0.9678, test_f1: 0.5978
 epoch: 37, train_loss: 0.7280, test_loss: 1.0118, test_f1: 0.5766
 epoch: 38, train_loss: 0.7624, test_loss: 1.1648, test_f1: 0.4255
 epoch: 39, train_loss: 0.7765, test_loss: 1.1022, test_f1: 0.5315
 epoch: 40, train_loss: 0.7224, test_loss: 1.0322, test_f1: 0.5529
 epoch: 41, train_loss: 0.7260, test_loss: 1.0414, test_f1: 0.5973
 epoch: 42, train_loss: 0.7177, test_loss: 0.9345, test_f1: 0.5981
 epoch: 43, train_loss: 0.7358, test_loss: 1.1728, test_f1: 0.5293
 epoch: 44, train_loss: 0.7246, test_loss: 1.1142, test_f1: 0.5516
 epoch: 45, train_loss: 0.7129, test_loss: 1.2097, test_f1: 0.5713
 epoch: 46, train_loss: 0.7235, test_loss: 1.1421, test_f1: 0.5625
 epoch: 47, train_loss: 0.7046, test_loss: 1.0630, test_f1: 0.5602
 epoch: 48, train_loss: 0.7003, test_loss: 1.0522, test_f1: 0.5726
 epoch: 49, train_loss: 0.6956, test_loss: 1.0878, test_f1: 0.5995
 epoch: 50, train_loss: 0.6861, test_loss: 1.0727, test_f1: 0.5828
 epoch: 51, train_loss: 0.6421, test_loss: 1.0937, test_f1: 0.5915
 epoch: 52, train_loss: 0.6500, test_loss: 1.2615, test_f1: 0.5467
 epoch: 53, train_loss: 0.6378, test_loss: 1.1208, test_f1: 0.6022
 epoch: 54, train_loss: 0.6505, test_loss: 1.0346, test_f1: 0.6066
 epoch: 55, train_loss: 0.6193, test_loss: 1.1044, test_f1: 0.6047
 epoch: 56, train_loss: 0.6061, test_loss: 1.1904, test_f1: 0.5765
 epoch: 57, train_loss: 0.6139, test_loss: 1.0997, test_f1: 0.5748
 epoch: 58, train_loss: 0.6147, test_loss: 1.1713, test_f1: 0.6048
 epoch: 59, train_loss: 0.6074, test_loss: 1.1077, test_f1: 0.5966
 epoch: 60, train_loss: 0.6148, test_loss: 1.1312, test_f1: 0.6107
 epoch: 61, train_loss: 0.5942, test_loss: 1.1611, test_f1: 0.6240
 epoch: 62, train_loss: 0.6071, test_loss: 1.1152, test_f1: 0.5922
 epoch: 63, train_loss: 0.6079, test_loss: 1.2494, test_f1: 0.5655
 epoch: 64, train_loss: 0.6130, test_loss: 1.1010, test_f1: 0.6315
 epoch: 65, train_loss: 0.5776, test_loss: 1.1665, test_f1: 0.5850
 epoch: 66, train_loss: 0.6027, test_loss: 1.2381, test_f1: 0.6115
 epoch: 67, train_loss: 0.6061, test_loss: 1.2304, test_f1: 0.5446
 epoch: 68, train_loss: 0.5695, test_loss: 1.1926, test_f1: 0.5963
 epoch: 69, train_loss: 0.5992, test_loss: 1.2304, test_f1: 0.6086
 epoch: 70, train_loss: 0.6109, test_loss: 1.3046, test_f1: 0.6152
 epoch: 71, train_loss: 0.5923, test_loss: 1.1323, test_f1: 0.6289
 epoch: 72, train_loss: 0.5759, test_loss: 1.1392, test_f1: 0.6487
 epoch: 73, train_loss: 0.5739, test_loss: 1.2067, test_f1: 0.6358
 epoch: 74, train_loss: 0.5678, test_loss: 1.1397, test_f1: 0.6437
 epoch: 75, train_loss: 0.5613, test_loss: 1.1883, test_f1: 0.6033
 epoch: 76, train_loss: 0.5592, test_loss: 1.3132, test_f1: 0.5624
 epoch: 77, train_loss: 0.5813, test_loss: 1.1654, test_f1: 0.6461
 epoch: 78, train_loss: 0.5540, test_loss: 1.1875, test_f1: 0.6432
 epoch: 79, train_loss: 0.5625, test_loss: 1.1432, test_f1: 0.6178
 epoch: 80, train_loss: 0.5722, test_loss: 1.3409, test_f1: 0.6049
 epoch: 81, train_loss: 0.5581, test_loss: 1.2260, test_f1: 0.6349
 epoch: 82, train_loss: 0.5293, test_loss: 1.4368, test_f1: 0.6022
 epoch: 83, train_loss: 0.5426, test_loss: 1.2910, test_f1: 0.5647
 epoch: 84, train_loss: 0.5521, test_loss: 1.2639, test_f1: 0.6130
 epoch: 85, train_loss: 0.5440, test_loss: 1.4473, test_f1: 0.6297
 epoch: 86, train_loss: 0.5254, test_loss: 1.2649, test_f1: 0.6334
 epoch: 87, train_loss: 0.5600, test_loss: 1.2416, test_f1: 0.6147
 epoch: 88, train_loss: 0.5333, test_loss: 1.3465, test_f1: 0.6024
 epoch: 89, train_loss: 0.5580, test_loss: 1.2075, test_f1: 0.6194
 epoch: 90, train_loss: 0.5343, test_loss: 1.3577, test_f1: 0.6126
 epoch: 91, train_loss: 0.5220, test_loss: 1.1901, test_f1: 0.6124
 epoch: 92, train_loss: 0.5305, test_loss: 1.2777, test_f1: 0.6081
 epoch: 93, train_loss: 0.5034, test_loss: 1.3983, test_f1: 0.5616
 epoch: 94, train_loss: 0.5280, test_loss: 1.2138, test_f1: 0.6221
 epoch: 95, train_loss: 0.5545, test_loss: 1.3647, test_f1: 0.6135
 epoch: 96, train_loss: 0.5474, test_loss: 1.2345, test_f1: 0.6211
 epoch: 97, train_loss: 0.5100, test_loss: 1.3276, test_f1: 0.5500
 epoch: 98, train_loss: 0.4903, test_loss: 1.3557, test_f1: 0.6367
 epoch: 99, train_loss: 0.5289, test_loss: 1.3504, test_f1: 0.6175
##################ITERATION #5 ****************************************
 epoch: 0, train_loss: 1.2108, test_loss: 1.2813, test_f1: 0.4506
 epoch: 1, train_loss: 1.0499, test_loss: 1.1443, test_f1: 0.4602
 epoch: 2, train_loss: 1.0127, test_loss: 1.0731, test_f1: 0.4913
 epoch: 3, train_loss: 0.9749, test_loss: 1.0351, test_f1: 0.4913
 epoch: 4, train_loss: 0.9610, test_loss: 1.0945, test_f1: 0.4949
 epoch: 5, train_loss: 0.9687, test_loss: 1.0560, test_f1: 0.5129
 epoch: 6, train_loss: 0.9493, test_loss: 1.0686, test_f1: 0.4894
 epoch: 7, train_loss: 0.9308, test_loss: 1.0471, test_f1: 0.5520
 epoch: 8, train_loss: 0.9223, test_loss: 1.0082, test_f1: 0.5080
 epoch: 9, train_loss: 0.9326, test_loss: 1.0565, test_f1: 0.5481
 epoch: 10, train_loss: 0.9138, test_loss: 1.0236, test_f1: 0.5685
 epoch: 11, train_loss: 0.9152, test_loss: 1.0268, test_f1: 0.5315
 epoch: 12, train_loss: 0.9222, test_loss: 1.0893, test_f1: 0.5228
 epoch: 13, train_loss: 0.9118, test_loss: 1.0357, test_f1: 0.5545
 epoch: 14, train_loss: 0.9099, test_loss: 1.0790, test_f1: 0.5088
 epoch: 15, train_loss: 0.8914, test_loss: 1.0604, test_f1: 0.5480
 epoch: 16, train_loss: 0.8824, test_loss: 1.9865, test_f1: 0.3500
 epoch: 17, train_loss: 0.9076, test_loss: 1.0760, test_f1: 0.5309
 epoch: 18, train_loss: 0.8759, test_loss: 1.0344, test_f1: 0.5732
 epoch: 19, train_loss: 0.8792, test_loss: 1.0797, test_f1: 0.5406
 epoch: 20, train_loss: 0.8863, test_loss: 1.1129, test_f1: 0.5049
 epoch: 21, train_loss: 0.8804, test_loss: 1.0523, test_f1: 0.5484
 epoch: 22, train_loss: 0.8513, test_loss: 1.1676, test_f1: 0.5013
 epoch: 23, train_loss: 0.8644, test_loss: 1.0599, test_f1: 0.5615
 epoch: 24, train_loss: 0.8392, test_loss: 1.0859, test_f1: 0.5785
 epoch: 25, train_loss: 0.8205, test_loss: 1.1048, test_f1: 0.5877
 epoch: 26, train_loss: 0.8237, test_loss: 1.1603, test_f1: 0.4696
 epoch: 27, train_loss: 0.8433, test_loss: 0.9924, test_f1: 0.5624
 epoch: 28, train_loss: 0.8042, test_loss: 1.0614, test_f1: 0.5967
 epoch: 29, train_loss: 0.8190, test_loss: 1.0477, test_f1: 0.5845
 epoch: 30, train_loss: 0.8028, test_loss: 1.1237, test_f1: 0.5398
 epoch: 31, train_loss: 0.7856, test_loss: 1.0880, test_f1: 0.5530
 epoch: 32, train_loss: 0.7820, test_loss: 1.2740, test_f1: 0.5479
 epoch: 33, train_loss: 0.7812, test_loss: 1.2273, test_f1: 0.4893
 epoch: 34, train_loss: 0.7689, test_loss: 1.2349, test_f1: 0.5740
 epoch: 35, train_loss: 0.8252, test_loss: 1.1455, test_f1: 0.5556
 epoch: 36, train_loss: 0.7801, test_loss: 1.2515, test_f1: 0.5079
 epoch: 37, train_loss: 0.7733, test_loss: 1.1014, test_f1: 0.5834
 epoch: 38, train_loss: 0.7627, test_loss: 1.0172, test_f1: 0.6076
 epoch: 39, train_loss: 0.7791, test_loss: 1.1298, test_f1: 0.5621
 epoch: 40, train_loss: 0.7502, test_loss: 1.0901, test_f1: 0.5499
 epoch: 41, train_loss: 0.7712, test_loss: 1.1074, test_f1: 0.5551
 epoch: 42, train_loss: 0.7461, test_loss: 1.0951, test_f1: 0.5623
 epoch: 43, train_loss: 0.7515, test_loss: 1.1544, test_f1: 0.5204
 epoch: 44, train_loss: 0.7296, test_loss: 1.2242, test_f1: 0.5447
 epoch: 45, train_loss: 0.7310, test_loss: 1.1152, test_f1: 0.5634
 epoch: 46, train_loss: 0.7257, test_loss: 1.0247, test_f1: 0.6001
 epoch: 47, train_loss: 0.7218, test_loss: 1.2115, test_f1: 0.5317
 epoch: 48, train_loss: 0.7026, test_loss: 1.0865, test_f1: 0.6061
 epoch: 49, train_loss: 0.7027, test_loss: 1.1508, test_f1: 0.6025
 epoch: 50, train_loss: 0.6838, test_loss: 1.1668, test_f1: 0.5886
 epoch: 51, train_loss: 0.7043, test_loss: 1.1254, test_f1: 0.5933
 epoch: 52, train_loss: 0.6454, test_loss: 1.0861, test_f1: 0.6222
 epoch: 53, train_loss: 0.6539, test_loss: 1.1401, test_f1: 0.6025
 epoch: 54, train_loss: 0.6675, test_loss: 1.1507, test_f1: 0.6092
 epoch: 55, train_loss: 0.6504, test_loss: 1.2696, test_f1: 0.5713
 epoch: 56, train_loss: 0.6351, test_loss: 1.0867, test_f1: 0.6158
 epoch: 57, train_loss: 0.6396, test_loss: 1.2270, test_f1: 0.6079
 epoch: 58, train_loss: 0.6279, test_loss: 1.1908, test_f1: 0.5909
 epoch: 59, train_loss: 0.6077, test_loss: 1.2715, test_f1: 0.5747
 epoch: 60, train_loss: 0.6189, test_loss: 1.3945, test_f1: 0.5706
 epoch: 61, train_loss: 0.6345, test_loss: 1.1168, test_f1: 0.5904
 epoch: 62, train_loss: 0.6160, test_loss: 1.1908, test_f1: 0.5788
 epoch: 63, train_loss: 0.6147, test_loss: 1.2341, test_f1: 0.6041
 epoch: 64, train_loss: 0.6237, test_loss: 1.3033, test_f1: 0.6128
 epoch: 65, train_loss: 0.6221, test_loss: 1.2412, test_f1: 0.6109
 epoch: 66, train_loss: 0.6228, test_loss: 1.2097, test_f1: 0.5997
 epoch: 67, train_loss: 0.6120, test_loss: 1.7198, test_f1: 0.5312
 epoch: 68, train_loss: 0.6254, test_loss: 1.2142, test_f1: 0.6004
 epoch: 69, train_loss: 0.6100, test_loss: 1.2618, test_f1: 0.6158
 epoch: 70, train_loss: 0.5886, test_loss: 1.5278, test_f1: 0.5285
 epoch: 71, train_loss: 0.6163, test_loss: 1.1481, test_f1: 0.6135
 epoch: 72, train_loss: 0.5853, test_loss: 1.2640, test_f1: 0.5863
 epoch: 73, train_loss: 0.6097, test_loss: 1.3579, test_f1: 0.5880
 epoch: 74, train_loss: 0.5911, test_loss: 1.2954, test_f1: 0.5688
 epoch: 75, train_loss: 0.6001, test_loss: 1.3036, test_f1: 0.6088
 epoch: 76, train_loss: 0.5712, test_loss: 1.2689, test_f1: 0.5959
 epoch: 77, train_loss: 0.5916, test_loss: 1.3444, test_f1: 0.5648
 epoch: 78, train_loss: 0.5758, test_loss: 1.4250, test_f1: 0.5703
 epoch: 79, train_loss: 0.5541, test_loss: 1.3825, test_f1: 0.5879
 epoch: 80, train_loss: 0.5753, test_loss: 1.3173, test_f1: 0.6030
 epoch: 81, train_loss: 0.6157, test_loss: 1.5072, test_f1: 0.5406
 epoch: 82, train_loss: 0.5901, test_loss: 1.3722, test_f1: 0.5980
 epoch: 83, train_loss: 0.5426, test_loss: 1.4018, test_f1: 0.6010
 epoch: 84, train_loss: 0.5455, test_loss: 1.4492, test_f1: 0.6180
 epoch: 85, train_loss: 0.5760, test_loss: 1.3065, test_f1: 0.6193
 epoch: 86, train_loss: 0.5583, test_loss: 1.3486, test_f1: 0.6182
 epoch: 87, train_loss: 0.5781, test_loss: 1.2610, test_f1: 0.5847
 epoch: 88, train_loss: 0.5355, test_loss: 1.3210, test_f1: 0.6170
 epoch: 89, train_loss: 0.5702, test_loss: 1.3273, test_f1: 0.5926
 epoch: 90, train_loss: 0.5515, test_loss: 1.3566, test_f1: 0.6083
 epoch: 91, train_loss: 0.5652, test_loss: 1.3707, test_f1: 0.6033
 epoch: 92, train_loss: 0.5507, test_loss: 1.4131, test_f1: 0.5707
 epoch: 93, train_loss: 0.5372, test_loss: 1.2716, test_f1: 0.6370
 epoch: 94, train_loss: 0.5581, test_loss: 1.3347, test_f1: 0.6155
 epoch: 95, train_loss: 0.5592, test_loss: 1.4021, test_f1: 0.6061
 epoch: 96, train_loss: 0.5562, test_loss: 1.2737, test_f1: 0.5950
 epoch: 97, train_loss: 0.5234, test_loss: 1.4170, test_f1: 0.5699
 epoch: 98, train_loss: 0.5349, test_loss: 1.4105, test_f1: 0.5908
 epoch: 99, train_loss: 0.5309, test_loss: 1.4280, test_f1: 0.5736
##################ITERATION #6 ****************************************
 epoch: 0, train_loss: 1.2238, test_loss: 1.2689, test_f1: 0.3630
 epoch: 1, train_loss: 1.0784, test_loss: 1.1220, test_f1: 0.4760
 epoch: 2, train_loss: 1.0139, test_loss: 1.1758, test_f1: 0.4380
 epoch: 3, train_loss: 0.9953, test_loss: 1.0625, test_f1: 0.5161
 epoch: 4, train_loss: 0.9874, test_loss: 1.0538, test_f1: 0.5079
 epoch: 5, train_loss: 0.9618, test_loss: 1.0967, test_f1: 0.4809
 epoch: 6, train_loss: 0.9760, test_loss: 1.0621, test_f1: 0.4942
 epoch: 7, train_loss: 0.9434, test_loss: 1.0565, test_f1: 0.4437
 epoch: 8, train_loss: 0.9383, test_loss: 1.0418, test_f1: 0.5019
 epoch: 9, train_loss: 0.9281, test_loss: 1.0614, test_f1: 0.4901
 epoch: 10, train_loss: 0.9336, test_loss: 1.0277, test_f1: 0.4969
 epoch: 11, train_loss: 0.9127, test_loss: 1.0837, test_f1: 0.5407
 epoch: 12, train_loss: 0.9300, test_loss: 1.0701, test_f1: 0.4996
 epoch: 13, train_loss: 0.9065, test_loss: 1.0962, test_f1: 0.4823
 epoch: 14, train_loss: 0.9057, test_loss: 1.0253, test_f1: 0.5542
 epoch: 15, train_loss: 0.9056, test_loss: 1.1014, test_f1: 0.4623
 epoch: 16, train_loss: 0.8754, test_loss: 1.0178, test_f1: 0.5123
 epoch: 17, train_loss: 0.8674, test_loss: 1.1960, test_f1: 0.4435
 epoch: 18, train_loss: 0.8773, test_loss: 1.0028, test_f1: 0.5596
 epoch: 19, train_loss: 0.8718, test_loss: 1.0281, test_f1: 0.5744
 epoch: 20, train_loss: 0.8583, test_loss: 1.0128, test_f1: 0.5715
 epoch: 21, train_loss: 0.8271, test_loss: 1.1055, test_f1: 0.5024
 epoch: 22, train_loss: 0.8447, test_loss: 0.9661, test_f1: 0.5732
 epoch: 23, train_loss: 0.8258, test_loss: 1.0006, test_f1: 0.5918
 epoch: 24, train_loss: 0.8253, test_loss: 1.0582, test_f1: 0.5562
 epoch: 25, train_loss: 0.8192, test_loss: 1.1255, test_f1: 0.5208
 epoch: 26, train_loss: 0.7942, test_loss: 1.0464, test_f1: 0.5880
 epoch: 27, train_loss: 0.8133, test_loss: 1.4241, test_f1: 0.4683
 epoch: 28, train_loss: 0.7739, test_loss: 1.1295, test_f1: 0.5704
 epoch: 29, train_loss: 0.7811, test_loss: 1.0658, test_f1: 0.5608
 epoch: 30, train_loss: 0.7899, test_loss: 1.0794, test_f1: 0.4752
 epoch: 31, train_loss: 0.7944, test_loss: 1.0438, test_f1: 0.5862
 epoch: 32, train_loss: 0.7670, test_loss: 1.1109, test_f1: 0.5841
 epoch: 33, train_loss: 0.7608, test_loss: 1.1210, test_f1: 0.5651
 epoch: 34, train_loss: 0.7798, test_loss: 1.0761, test_f1: 0.5916
 epoch: 35, train_loss: 0.7540, test_loss: 1.1642, test_f1: 0.5513
 epoch: 36, train_loss: 0.7511, test_loss: 1.0320, test_f1: 0.5759
 epoch: 37, train_loss: 0.7444, test_loss: 1.0934, test_f1: 0.5782
 epoch: 38, train_loss: 0.7347, test_loss: 1.1659, test_f1: 0.5551
 epoch: 39, train_loss: 0.7458, test_loss: 1.0842, test_f1: 0.5565
 epoch: 40, train_loss: 0.7491, test_loss: 1.1831, test_f1: 0.5711
 epoch: 41, train_loss: 0.7142, test_loss: 1.3010, test_f1: 0.5408
 epoch: 42, train_loss: 0.7345, test_loss: 1.1735, test_f1: 0.5489
 epoch: 43, train_loss: 0.7193, test_loss: 1.2214, test_f1: 0.5210
 epoch: 44, train_loss: 0.7094, test_loss: 1.0997, test_f1: 0.6045
 epoch: 45, train_loss: 0.6894, test_loss: 1.2519, test_f1: 0.5957
 epoch: 46, train_loss: 0.7033, test_loss: 1.2843, test_f1: 0.5541
 epoch: 47, train_loss: 0.7206, test_loss: 1.0518, test_f1: 0.5648
 epoch: 48, train_loss: 0.7116, test_loss: 1.1945, test_f1: 0.5047
 epoch: 49, train_loss: 0.7223, test_loss: 1.1330, test_f1: 0.5575
 epoch: 50, train_loss: 0.6972, test_loss: 1.1828, test_f1: 0.5684
 epoch: 51, train_loss: 0.6749, test_loss: 1.0642, test_f1: 0.5529
 epoch: 52, train_loss: 0.6346, test_loss: 1.3135, test_f1: 0.6002
 epoch: 53, train_loss: 0.6451, test_loss: 1.1705, test_f1: 0.5927
 epoch: 54, train_loss: 0.6545, test_loss: 1.1327, test_f1: 0.6116
 epoch: 55, train_loss: 0.6174, test_loss: 1.2537, test_f1: 0.6123
 epoch: 56, train_loss: 0.6356, test_loss: 1.2787, test_f1: 0.5594
 epoch: 57, train_loss: 0.6516, test_loss: 1.1659, test_f1: 0.5897
 epoch: 58, train_loss: 0.6264, test_loss: 1.2469, test_f1: 0.6089
 epoch: 59, train_loss: 0.6175, test_loss: 1.2072, test_f1: 0.5926
 epoch: 60, train_loss: 0.6493, test_loss: 1.2222, test_f1: 0.5885
 epoch: 61, train_loss: 0.6145, test_loss: 1.1633, test_f1: 0.6217
 epoch: 62, train_loss: 0.6392, test_loss: 1.2055, test_f1: 0.5533
 epoch: 63, train_loss: 0.6274, test_loss: 1.2784, test_f1: 0.5779
 epoch: 64, train_loss: 0.6341, test_loss: 1.2947, test_f1: 0.5929
 epoch: 65, train_loss: 0.5910, test_loss: 1.2077, test_f1: 0.6167
 epoch: 66, train_loss: 0.5907, test_loss: 1.1636, test_f1: 0.6529
 epoch: 67, train_loss: 0.5837, test_loss: 1.2658, test_f1: 0.5777
 epoch: 68, train_loss: 0.6022, test_loss: 1.4512, test_f1: 0.6023
 epoch: 69, train_loss: 0.5918, test_loss: 1.4248, test_f1: 0.5937
 epoch: 70, train_loss: 0.6122, test_loss: 1.1910, test_f1: 0.5889
 epoch: 71, train_loss: 0.6037, test_loss: 1.3266, test_f1: 0.6047
 epoch: 72, train_loss: 0.5992, test_loss: 1.4240, test_f1: 0.5758
 epoch: 73, train_loss: 0.5713, test_loss: 1.3814, test_f1: 0.6024
 epoch: 74, train_loss: 0.5919, test_loss: 1.3756, test_f1: 0.5655
 epoch: 75, train_loss: 0.5737, test_loss: 1.3602, test_f1: 0.5613
 epoch: 76, train_loss: 0.5890, test_loss: 1.3910, test_f1: 0.5923
 epoch: 77, train_loss: 0.5813, test_loss: 1.2634, test_f1: 0.5937
 epoch: 78, train_loss: 0.5738, test_loss: 1.2767, test_f1: 0.5988
 epoch: 79, train_loss: 0.5450, test_loss: 1.3595, test_f1: 0.6274
 epoch: 80, train_loss: 0.5977, test_loss: 1.2237, test_f1: 0.5803
 epoch: 81, train_loss: 0.5569, test_loss: 1.3860, test_f1: 0.6017
 epoch: 82, train_loss: 0.5595, test_loss: 1.3130, test_f1: 0.5838
 epoch: 83, train_loss: 0.5319, test_loss: 1.5197, test_f1: 0.5551
 epoch: 84, train_loss: 0.5569, test_loss: 1.4315, test_f1: 0.5843
 epoch: 85, train_loss: 0.5468, test_loss: 1.2698, test_f1: 0.5765
 epoch: 86, train_loss: 0.5575, test_loss: 1.5143, test_f1: 0.5925
 epoch: 87, train_loss: 0.5608, test_loss: 1.3139, test_f1: 0.5688
 epoch: 88, train_loss: 0.5601, test_loss: 1.4371, test_f1: 0.6015
 epoch: 89, train_loss: 0.5518, test_loss: 1.3946, test_f1: 0.5885
 epoch: 90, train_loss: 0.5520, test_loss: 1.4271, test_f1: 0.5902
 epoch: 91, train_loss: 0.5623, test_loss: 1.5047, test_f1: 0.6068
 epoch: 92, train_loss: 0.5416, test_loss: 1.6814, test_f1: 0.5689
 epoch: 93, train_loss: 0.5510, test_loss: 1.3094, test_f1: 0.6364
 epoch: 94, train_loss: 0.5215, test_loss: 1.4135, test_f1: 0.5955
 epoch: 95, train_loss: 0.5351, test_loss: 1.4740, test_f1: 0.5774
 epoch: 96, train_loss: 0.5428, test_loss: 1.2211, test_f1: 0.6138
 epoch: 97, train_loss: 0.5536, test_loss: 1.4318, test_f1: 0.6413
 epoch: 98, train_loss: 0.5214, test_loss: 1.2960, test_f1: 0.6471
 epoch: 99, train_loss: 0.5412, test_loss: 1.6319, test_f1: 0.5949
##################ITERATION #7 ****************************************
 epoch: 0, train_loss: 1.1913, test_loss: 1.1564, test_f1: 0.3500
 epoch: 1, train_loss: 1.0346, test_loss: 1.0597, test_f1: 0.4880
 epoch: 2, train_loss: 0.9997, test_loss: 1.0612, test_f1: 0.4779
 epoch: 3, train_loss: 0.9566, test_loss: 1.0215, test_f1: 0.5168
 epoch: 4, train_loss: 0.9655, test_loss: 1.1516, test_f1: 0.4350
 epoch: 5, train_loss: 0.9542, test_loss: 1.0023, test_f1: 0.5538
 epoch: 6, train_loss: 0.9224, test_loss: 1.1093, test_f1: 0.5610
 epoch: 7, train_loss: 0.9364, test_loss: 1.0956, test_f1: 0.4889
 epoch: 8, train_loss: 0.9459, test_loss: 0.9902, test_f1: 0.5341
 epoch: 9, train_loss: 0.9311, test_loss: 1.0746, test_f1: 0.5164
 epoch: 10, train_loss: 0.9082, test_loss: 0.9989, test_f1: 0.5719
 epoch: 11, train_loss: 0.9040, test_loss: 1.0297, test_f1: 0.5053
 epoch: 12, train_loss: 0.8826, test_loss: 1.0218, test_f1: 0.5463
 epoch: 13, train_loss: 0.9036, test_loss: 1.0148, test_f1: 0.5309
 epoch: 14, train_loss: 0.8374, test_loss: 0.9909, test_f1: 0.5685
 epoch: 15, train_loss: 0.8377, test_loss: 0.9955, test_f1: 0.5735
 epoch: 16, train_loss: 0.8697, test_loss: 1.0160, test_f1: 0.5574
 epoch: 17, train_loss: 0.8346, test_loss: 1.0306, test_f1: 0.5420
 epoch: 18, train_loss: 0.8101, test_loss: 1.0353, test_f1: 0.5100
 epoch: 19, train_loss: 0.8187, test_loss: 1.0075, test_f1: 0.5375
 epoch: 20, train_loss: 0.8024, test_loss: 1.0114, test_f1: 0.5793
 epoch: 21, train_loss: 0.8063, test_loss: 1.1273, test_f1: 0.5360
 epoch: 22, train_loss: 0.7693, test_loss: 1.1436, test_f1: 0.4868
 epoch: 23, train_loss: 0.7697, test_loss: 1.1706, test_f1: 0.4484
 epoch: 24, train_loss: 0.7669, test_loss: 1.0690, test_f1: 0.5469
 epoch: 25, train_loss: 0.7426, test_loss: 1.0576, test_f1: 0.5532
 epoch: 26, train_loss: 0.7472, test_loss: 1.0229, test_f1: 0.5567
 epoch: 27, train_loss: 0.7289, test_loss: 1.1413, test_f1: 0.5766
 epoch: 28, train_loss: 0.7542, test_loss: 1.1273, test_f1: 0.5816
 epoch: 29, train_loss: 0.7313, test_loss: 1.0141, test_f1: 0.5925
 epoch: 30, train_loss: 0.7336, test_loss: 1.0371, test_f1: 0.5600
 epoch: 31, train_loss: 0.7195, test_loss: 1.1761, test_f1: 0.4804
 epoch: 32, train_loss: 0.7133, test_loss: 1.1016, test_f1: 0.5593
 epoch: 33, train_loss: 0.7509, test_loss: 1.0333, test_f1: 0.5495
 epoch: 34, train_loss: 0.7787, test_loss: 1.0539, test_f1: 0.5774
 epoch: 35, train_loss: 0.7242, test_loss: 1.0965, test_f1: 0.5990
 epoch: 36, train_loss: 0.7233, test_loss: 1.1350, test_f1: 0.5150
 epoch: 37, train_loss: 0.7145, test_loss: 1.0954, test_f1: 0.4895
 epoch: 38, train_loss: 0.7040, test_loss: 1.1236, test_f1: 0.5547
 epoch: 39, train_loss: 0.7109, test_loss: 1.1369, test_f1: 0.5437
 epoch: 40, train_loss: 0.6908, test_loss: 1.1112, test_f1: 0.5789
 epoch: 41, train_loss: 0.6685, test_loss: 1.0540, test_f1: 0.5865
 epoch: 42, train_loss: 0.6835, test_loss: 1.1539, test_f1: 0.5663
 epoch: 43, train_loss: 0.6951, test_loss: 1.3039, test_f1: 0.5358
 epoch: 44, train_loss: 0.7263, test_loss: 1.1997, test_f1: 0.5415
 epoch: 45, train_loss: 0.7033, test_loss: 1.1708, test_f1: 0.5849
 epoch: 46, train_loss: 0.6949, test_loss: 1.1469, test_f1: 0.5275
 epoch: 47, train_loss: 0.6620, test_loss: 1.2097, test_f1: 0.5436
 epoch: 48, train_loss: 0.6464, test_loss: 1.1729, test_f1: 0.5603
 epoch: 49, train_loss: 0.6399, test_loss: 1.3338, test_f1: 0.5269
 epoch: 50, train_loss: 0.6573, test_loss: 1.4342, test_f1: 0.5221
 epoch: 51, train_loss: 0.6763, test_loss: 1.2671, test_f1: 0.5543
 epoch: 52, train_loss: 0.6474, test_loss: 1.2698, test_f1: 0.5178
 epoch: 53, train_loss: 0.6443, test_loss: 1.2214, test_f1: 0.6071
 epoch: 54, train_loss: 0.6249, test_loss: 1.3679, test_f1: 0.5491
 epoch: 55, train_loss: 0.6084, test_loss: 1.2030, test_f1: 0.5586
 epoch: 56, train_loss: 0.6243, test_loss: 1.2807, test_f1: 0.5475
 epoch: 57, train_loss: 0.6281, test_loss: 1.2958, test_f1: 0.5533
 epoch: 58, train_loss: 0.5937, test_loss: 1.3666, test_f1: 0.5238
 epoch: 59, train_loss: 0.6011, test_loss: 1.3011, test_f1: 0.5404
 epoch: 60, train_loss: 0.5853, test_loss: 1.2838, test_f1: 0.5515
 epoch: 61, train_loss: 0.5571, test_loss: 1.3662, test_f1: 0.5528
 epoch: 62, train_loss: 0.5806, test_loss: 1.2311, test_f1: 0.5768
 epoch: 63, train_loss: 0.5697, test_loss: 1.3480, test_f1: 0.5896
 epoch: 64, train_loss: 0.5641, test_loss: 1.3943, test_f1: 0.5706
 epoch: 65, train_loss: 0.5537, test_loss: 1.3945, test_f1: 0.6029
 epoch: 66, train_loss: 0.5279, test_loss: 1.3961, test_f1: 0.5873
 epoch: 67, train_loss: 0.5563, test_loss: 1.3846, test_f1: 0.6080
 epoch: 68, train_loss: 0.5251, test_loss: 1.4110, test_f1: 0.5631
 epoch: 69, train_loss: 0.5491, test_loss: 1.4116, test_f1: 0.5701
 epoch: 70, train_loss: 0.5664, test_loss: 1.4250, test_f1: 0.5679
 epoch: 71, train_loss: 0.5424, test_loss: 1.3304, test_f1: 0.5891
 epoch: 72, train_loss: 0.5195, test_loss: 1.4254, test_f1: 0.5751
 epoch: 73, train_loss: 0.5149, test_loss: 1.3821, test_f1: 0.5798
 epoch: 74, train_loss: 0.5207, test_loss: 1.4492, test_f1: 0.5806
 epoch: 75, train_loss: 0.5448, test_loss: 1.2854, test_f1: 0.5751
 epoch: 76, train_loss: 0.5533, test_loss: 1.2875, test_f1: 0.5947
 epoch: 77, train_loss: 0.5255, test_loss: 1.3888, test_f1: 0.5879
 epoch: 78, train_loss: 0.5090, test_loss: 1.4015, test_f1: 0.5977
 epoch: 79, train_loss: 0.4998, test_loss: 1.5204, test_f1: 0.5772
 epoch: 80, train_loss: 0.5028, test_loss: 1.6044, test_f1: 0.5851
 epoch: 81, train_loss: 0.5203, test_loss: 1.6286, test_f1: 0.5917
 epoch: 82, train_loss: 0.5192, test_loss: 1.4054, test_f1: 0.5984
 epoch: 83, train_loss: 0.4854, test_loss: 1.5733, test_f1: 0.5797
 epoch: 84, train_loss: 0.4993, test_loss: 1.5131, test_f1: 0.5765
 epoch: 85, train_loss: 0.4934, test_loss: 1.4454, test_f1: 0.5918
 epoch: 86, train_loss: 0.5107, test_loss: 1.3703, test_f1: 0.5994
 epoch: 87, train_loss: 0.5093, test_loss: 1.6392, test_f1: 0.5665
 epoch: 88, train_loss: 0.5195, test_loss: 1.4935, test_f1: 0.5728
 epoch: 89, train_loss: 0.5188, test_loss: 1.5643, test_f1: 0.5928
 epoch: 90, train_loss: 0.4896, test_loss: 1.5919, test_f1: 0.5745
 epoch: 91, train_loss: 0.4966, test_loss: 1.6370, test_f1: 0.5749
 epoch: 92, train_loss: 0.4767, test_loss: 1.5988, test_f1: 0.5958
 epoch: 93, train_loss: 0.4628, test_loss: 1.9682, test_f1: 0.5664
 epoch: 94, train_loss: 0.4958, test_loss: 1.5998, test_f1: 0.5904
 epoch: 95, train_loss: 0.4660, test_loss: 1.5880, test_f1: 0.5741
 epoch: 96, train_loss: 0.4807, test_loss: 1.8282, test_f1: 0.5729
 epoch: 97, train_loss: 0.4838, test_loss: 1.4812, test_f1: 0.5978
 epoch: 98, train_loss: 0.4794, test_loss: 1.4788, test_f1: 0.5975
 epoch: 99, train_loss: 0.4470, test_loss: 1.3948, test_f1: 0.6153
##################ITERATION #8 ****************************************
 epoch: 0, train_loss: 1.2790, test_loss: 1.1470, test_f1: 0.4161
 epoch: 1, train_loss: 1.0395, test_loss: 1.1216, test_f1: 0.4492
 epoch: 2, train_loss: 0.9872, test_loss: 1.0695, test_f1: 0.4137
 epoch: 3, train_loss: 0.9952, test_loss: 1.0394, test_f1: 0.5038
 epoch: 4, train_loss: 0.9721, test_loss: 1.0727, test_f1: 0.4777
 epoch: 5, train_loss: 0.9748, test_loss: 1.1476, test_f1: 0.4594
 epoch: 6, train_loss: 0.9585, test_loss: 1.1117, test_f1: 0.4952
 epoch: 7, train_loss: 0.9347, test_loss: 1.0507, test_f1: 0.5253
 epoch: 8, train_loss: 0.9193, test_loss: 1.0088, test_f1: 0.5836
 epoch: 9, train_loss: 0.8873, test_loss: 0.9922, test_f1: 0.5292
 epoch: 10, train_loss: 0.9239, test_loss: 1.4044, test_f1: 0.3672
 epoch: 11, train_loss: 0.9270, test_loss: 1.0289, test_f1: 0.5336
 epoch: 12, train_loss: 0.8980, test_loss: 1.0823, test_f1: 0.5359
 epoch: 13, train_loss: 0.8764, test_loss: 0.9923, test_f1: 0.5410
 epoch: 14, train_loss: 0.8666, test_loss: 0.9870, test_f1: 0.5320
 epoch: 15, train_loss: 0.8649, test_loss: 1.0099, test_f1: 0.5151
 epoch: 16, train_loss: 0.8478, test_loss: 1.1677, test_f1: 0.4344
 epoch: 17, train_loss: 0.8314, test_loss: 1.0058, test_f1: 0.5598
 epoch: 18, train_loss: 0.8284, test_loss: 1.0370, test_f1: 0.5332
 epoch: 19, train_loss: 0.8241, test_loss: 0.9811, test_f1: 0.5487
 epoch: 20, train_loss: 0.7905, test_loss: 1.1061, test_f1: 0.5335
 epoch: 21, train_loss: 0.8074, test_loss: 1.0047, test_f1: 0.6063
 epoch: 22, train_loss: 0.7927, test_loss: 0.9784, test_f1: 0.5793
 epoch: 23, train_loss: 0.7826, test_loss: 0.9580, test_f1: 0.5646
 epoch: 24, train_loss: 0.7802, test_loss: 0.9941, test_f1: 0.5991
 epoch: 25, train_loss: 0.7827, test_loss: 0.9574, test_f1: 0.5971
 epoch: 26, train_loss: 0.7569, test_loss: 1.0573, test_f1: 0.5453
 epoch: 27, train_loss: 0.7624, test_loss: 1.1112, test_f1: 0.5467
 epoch: 28, train_loss: 0.7606, test_loss: 1.0840, test_f1: 0.5940
 epoch: 29, train_loss: 0.7622, test_loss: 1.0329, test_f1: 0.5620
 epoch: 30, train_loss: 0.7618, test_loss: 1.1381, test_f1: 0.5552
 epoch: 31, train_loss: 0.7536, test_loss: 1.1815, test_f1: 0.5418
 epoch: 32, train_loss: 0.7378, test_loss: 1.0061, test_f1: 0.5678
 epoch: 33, train_loss: 0.7229, test_loss: 0.9912, test_f1: 0.5797
 epoch: 34, train_loss: 0.7355, test_loss: 0.9975, test_f1: 0.5909
 epoch: 35, train_loss: 0.7205, test_loss: 1.0099, test_f1: 0.5956
 epoch: 36, train_loss: 0.7257, test_loss: 1.0904, test_f1: 0.5783
 epoch: 37, train_loss: 0.7215, test_loss: 1.0124, test_f1: 0.5833
 epoch: 38, train_loss: 0.7208, test_loss: 1.0193, test_f1: 0.6157
 epoch: 39, train_loss: 0.7153, test_loss: 1.4850, test_f1: 0.4886
 epoch: 40, train_loss: 0.7191, test_loss: 1.0656, test_f1: 0.5491
 epoch: 41, train_loss: 0.7012, test_loss: 1.3044, test_f1: 0.5134
 epoch: 42, train_loss: 0.7150, test_loss: 1.0261, test_f1: 0.5700
 epoch: 43, train_loss: 0.7028, test_loss: 1.0298, test_f1: 0.6029
 epoch: 44, train_loss: 0.7098, test_loss: 1.1844, test_f1: 0.5994
 epoch: 45, train_loss: 0.7122, test_loss: 1.1017, test_f1: 0.5844
 epoch: 46, train_loss: 0.7055, test_loss: 1.0034, test_f1: 0.5845
 epoch: 47, train_loss: 0.6930, test_loss: 0.9880, test_f1: 0.5637
 epoch: 48, train_loss: 0.6520, test_loss: 1.0427, test_f1: 0.5786
 epoch: 49, train_loss: 0.6676, test_loss: 1.1605, test_f1: 0.5718
 epoch: 50, train_loss: 0.6946, test_loss: 1.1402, test_f1: 0.6015
 epoch: 51, train_loss: 0.7072, test_loss: 1.2157, test_f1: 0.5509
 epoch: 52, train_loss: 0.6455, test_loss: 1.1154, test_f1: 0.6279
 epoch: 53, train_loss: 0.6081, test_loss: 1.1967, test_f1: 0.6199
 epoch: 54, train_loss: 0.6213, test_loss: 1.1571, test_f1: 0.6137
 epoch: 55, train_loss: 0.5969, test_loss: 1.1181, test_f1: 0.6206
 epoch: 56, train_loss: 0.6338, test_loss: 1.0867, test_f1: 0.6070
 epoch: 57, train_loss: 0.6067, test_loss: 1.1410, test_f1: 0.5788
 epoch: 58, train_loss: 0.6090, test_loss: 1.1953, test_f1: 0.5738
 epoch: 59, train_loss: 0.5984, test_loss: 1.1929, test_f1: 0.6200
 epoch: 60, train_loss: 0.5979, test_loss: 1.1788, test_f1: 0.6059
 epoch: 61, train_loss: 0.5707, test_loss: 1.1604, test_f1: 0.5682
 epoch: 62, train_loss: 0.5889, test_loss: 1.1639, test_f1: 0.5886
 epoch: 63, train_loss: 0.5646, test_loss: 1.1798, test_f1: 0.5749
 epoch: 64, train_loss: 0.6139, test_loss: 1.2874, test_f1: 0.5860
 epoch: 65, train_loss: 0.5914, test_loss: 1.1649, test_f1: 0.5819
 epoch: 66, train_loss: 0.5840, test_loss: 1.2106, test_f1: 0.5799
 epoch: 67, train_loss: 0.5902, test_loss: 1.2851, test_f1: 0.5633
 epoch: 68, train_loss: 0.5806, test_loss: 1.2425, test_f1: 0.5796
 epoch: 69, train_loss: 0.5664, test_loss: 1.4119, test_f1: 0.6003
 epoch: 70, train_loss: 0.5708, test_loss: 1.1931, test_f1: 0.5896
 epoch: 71, train_loss: 0.5603, test_loss: 1.1818, test_f1: 0.5676
 epoch: 72, train_loss: 0.5518, test_loss: 1.2764, test_f1: 0.5865
 epoch: 73, train_loss: 0.5563, test_loss: 1.3061, test_f1: 0.5784
 epoch: 74, train_loss: 0.5502, test_loss: 1.2598, test_f1: 0.5831
 epoch: 75, train_loss: 0.5463, test_loss: 1.2428, test_f1: 0.5962
 epoch: 76, train_loss: 0.5555, test_loss: 1.2691, test_f1: 0.6005
 epoch: 77, train_loss: 0.5567, test_loss: 1.3805, test_f1: 0.5722
 epoch: 78, train_loss: 0.5696, test_loss: 1.3575, test_f1: 0.5814
 epoch: 79, train_loss: 0.5635, test_loss: 1.1949, test_f1: 0.5682
 epoch: 80, train_loss: 0.5824, test_loss: 1.2406, test_f1: 0.5777
 epoch: 81, train_loss: 0.5306, test_loss: 1.3358, test_f1: 0.5804
 epoch: 82, train_loss: 0.5552, test_loss: 1.2618, test_f1: 0.5767
 epoch: 83, train_loss: 0.5527, test_loss: 1.1835, test_f1: 0.6050
 epoch: 84, train_loss: 0.5333, test_loss: 1.2587, test_f1: 0.6030
 epoch: 85, train_loss: 0.5247, test_loss: 1.2762, test_f1: 0.5946
 epoch: 86, train_loss: 0.5222, test_loss: 1.4310, test_f1: 0.5653
 epoch: 87, train_loss: 0.5395, test_loss: 1.3014, test_f1: 0.5933
 epoch: 88, train_loss: 0.5302, test_loss: 1.2623, test_f1: 0.5862
 epoch: 89, train_loss: 0.5180, test_loss: 1.5031, test_f1: 0.5665
 epoch: 90, train_loss: 0.5255, test_loss: 1.4865, test_f1: 0.5974
 epoch: 91, train_loss: 0.5412, test_loss: 1.4745, test_f1: 0.5923
 epoch: 92, train_loss: 0.5327, test_loss: 1.4202, test_f1: 0.5773
 epoch: 93, train_loss: 0.5418, test_loss: 1.3412, test_f1: 0.5891
 epoch: 94, train_loss: 0.5220, test_loss: 1.4053, test_f1: 0.6062
 epoch: 95, train_loss: 0.5223, test_loss: 1.5425, test_f1: 0.5617
 epoch: 96, train_loss: 0.5174, test_loss: 1.5332, test_f1: 0.5589
 epoch: 97, train_loss: 0.5243, test_loss: 1.3000, test_f1: 0.5920
 epoch: 98, train_loss: 0.4971, test_loss: 1.4665, test_f1: 0.6109
 epoch: 99, train_loss: 0.5026, test_loss: 1.3608, test_f1: 0.6070
##################ITERATION #9 ****************************************
 epoch: 0, train_loss: 1.2379, test_loss: 1.3048, test_f1: 0.3130
 epoch: 1, train_loss: 1.0970, test_loss: 1.1411, test_f1: 0.4523
 epoch: 2, train_loss: 1.0570, test_loss: 1.0908, test_f1: 0.4997
 epoch: 3, train_loss: 1.0121, test_loss: 1.1528, test_f1: 0.4625
 epoch: 4, train_loss: 1.0124, test_loss: 1.1243, test_f1: 0.5000
 epoch: 5, train_loss: 1.0301, test_loss: 1.1815, test_f1: 0.4185
 epoch: 6, train_loss: 0.9938, test_loss: 1.0714, test_f1: 0.4578
 epoch: 7, train_loss: 0.9845, test_loss: 1.0801, test_f1: 0.5337
 epoch: 8, train_loss: 0.9706, test_loss: 1.1472, test_f1: 0.4967
 epoch: 9, train_loss: 0.9550, test_loss: 1.0118, test_f1: 0.5238
 epoch: 10, train_loss: 0.9391, test_loss: 1.1326, test_f1: 0.4688
 epoch: 11, train_loss: 0.9290, test_loss: 1.0844, test_f1: 0.4891
 epoch: 12, train_loss: 0.9339, test_loss: 1.0119, test_f1: 0.5181
 epoch: 13, train_loss: 0.9437, test_loss: 1.1205, test_f1: 0.5426
 epoch: 14, train_loss: 0.9300, test_loss: 1.0614, test_f1: 0.5178
 epoch: 15, train_loss: 0.9339, test_loss: 1.0139, test_f1: 0.4864
 epoch: 16, train_loss: 0.9251, test_loss: 1.0459, test_f1: 0.4215
 epoch: 17, train_loss: 0.8970, test_loss: 1.1692, test_f1: 0.5013
 epoch: 18, train_loss: 0.9076, test_loss: 1.4382, test_f1: 0.2978
 epoch: 19, train_loss: 0.9256, test_loss: 1.1055, test_f1: 0.5114
 epoch: 20, train_loss: 0.9190, test_loss: 1.0854, test_f1: 0.5123
 epoch: 21, train_loss: 0.9062, test_loss: 1.1124, test_f1: 0.5593
 epoch: 22, train_loss: 0.9035, test_loss: 1.0184, test_f1: 0.5458
 epoch: 23, train_loss: 0.8794, test_loss: 1.0717, test_f1: 0.5296
 epoch: 24, train_loss: 0.8979, test_loss: 1.0668, test_f1: 0.5441
 epoch: 25, train_loss: 0.8992, test_loss: 1.0198, test_f1: 0.5413
 epoch: 26, train_loss: 0.8897, test_loss: 2.0908, test_f1: 0.3599
 epoch: 27, train_loss: 0.8839, test_loss: 1.0506, test_f1: 0.5773
 epoch: 28, train_loss: 0.8956, test_loss: 1.0858, test_f1: 0.4935
 epoch: 29, train_loss: 0.8985, test_loss: 1.0395, test_f1: 0.5404
 epoch: 30, train_loss: 0.8694, test_loss: 1.0322, test_f1: 0.5714
 epoch: 31, train_loss: 0.8658, test_loss: 1.0504, test_f1: 0.5387
 epoch: 32, train_loss: 0.8649, test_loss: 1.1628, test_f1: 0.5395
 epoch: 33, train_loss: 0.8360, test_loss: 1.0105, test_f1: 0.5737
 epoch: 34, train_loss: 0.8248, test_loss: 1.0267, test_f1: 0.5483
 epoch: 35, train_loss: 0.8185, test_loss: 0.9974, test_f1: 0.5609
 epoch: 36, train_loss: 0.8244, test_loss: 1.0402, test_f1: 0.5476
 epoch: 37, train_loss: 0.8181, test_loss: 1.1005, test_f1: 0.5429
 epoch: 38, train_loss: 0.8286, test_loss: 1.1029, test_f1: 0.5371
 epoch: 39, train_loss: 0.8168, test_loss: 1.0299, test_f1: 0.5282
 epoch: 40, train_loss: 0.8236, test_loss: 1.0072, test_f1: 0.5864
 epoch: 41, train_loss: 0.7840, test_loss: 0.9943, test_f1: 0.5895
 epoch: 42, train_loss: 0.8048, test_loss: 0.9958, test_f1: 0.5742
 epoch: 43, train_loss: 0.7903, test_loss: 1.1228, test_f1: 0.5462
 epoch: 44, train_loss: 0.7844, test_loss: 1.0757, test_f1: 0.5510
 epoch: 45, train_loss: 0.7611, test_loss: 1.0792, test_f1: 0.5527
 epoch: 46, train_loss: 0.7437, test_loss: 1.0798, test_f1: 0.5614
 epoch: 47, train_loss: 0.7568, test_loss: 1.1417, test_f1: 0.4828
 epoch: 48, train_loss: 0.7441, test_loss: 1.1231, test_f1: 0.5475
 epoch: 49, train_loss: 0.7511, test_loss: 1.2285, test_f1: 0.4957
 epoch: 50, train_loss: 0.7635, test_loss: 1.0827, test_f1: 0.5367
 epoch: 51, train_loss: 0.7278, test_loss: 1.0600, test_f1: 0.5891
 epoch: 52, train_loss: 0.6979, test_loss: 1.0556, test_f1: 0.5689
 epoch: 53, train_loss: 0.7033, test_loss: 1.0904, test_f1: 0.5182
 epoch: 54, train_loss: 0.6761, test_loss: 1.0949, test_f1: 0.5529
 epoch: 55, train_loss: 0.6960, test_loss: 1.2128, test_f1: 0.5287
 epoch: 56, train_loss: 0.6733, test_loss: 1.1781, test_f1: 0.5523
 epoch: 57, train_loss: 0.6658, test_loss: 1.1921, test_f1: 0.5980
 epoch: 58, train_loss: 0.6894, test_loss: 1.2163, test_f1: 0.5690
 epoch: 59, train_loss: 0.6558, test_loss: 1.2017, test_f1: 0.5635
 epoch: 60, train_loss: 0.6533, test_loss: 1.2400, test_f1: 0.5441
 epoch: 61, train_loss: 0.6446, test_loss: 1.3447, test_f1: 0.5447
 epoch: 62, train_loss: 0.6611, test_loss: 1.0873, test_f1: 0.6009
 epoch: 63, train_loss: 0.6440, test_loss: 1.2376, test_f1: 0.5534
 epoch: 64, train_loss: 0.6505, test_loss: 1.2929, test_f1: 0.5044
 epoch: 65, train_loss: 0.6290, test_loss: 1.4347, test_f1: 0.5189
 epoch: 66, train_loss: 0.6350, test_loss: 1.3090, test_f1: 0.4849
 epoch: 67, train_loss: 0.6456, test_loss: 1.2556, test_f1: 0.5271
 epoch: 68, train_loss: 0.6237, test_loss: 1.2080, test_f1: 0.5859
 epoch: 69, train_loss: 0.6100, test_loss: 1.1390, test_f1: 0.6107
 epoch: 70, train_loss: 0.6063, test_loss: 1.3625, test_f1: 0.5202
 epoch: 71, train_loss: 0.6015, test_loss: 1.4269, test_f1: 0.5363
 epoch: 72, train_loss: 0.5946, test_loss: 1.2571, test_f1: 0.5698
 epoch: 73, train_loss: 0.5954, test_loss: 1.3661, test_f1: 0.5461
 epoch: 74, train_loss: 0.6116, test_loss: 1.2658, test_f1: 0.5133
 epoch: 75, train_loss: 0.6147, test_loss: 1.3611, test_f1: 0.5284
 epoch: 76, train_loss: 0.6036, test_loss: 1.2310, test_f1: 0.5946
 epoch: 77, train_loss: 0.6261, test_loss: 1.2389, test_f1: 0.5937
 epoch: 78, train_loss: 0.6224, test_loss: 1.2301, test_f1: 0.5915
 epoch: 79, train_loss: 0.5968, test_loss: 1.2216, test_f1: 0.5453
 epoch: 80, train_loss: 0.5883, test_loss: 1.3119, test_f1: 0.5315
 epoch: 81, train_loss: 0.5852, test_loss: 1.4340, test_f1: 0.5594
 epoch: 82, train_loss: 0.5881, test_loss: 1.3436, test_f1: 0.5711
 epoch: 83, train_loss: 0.5664, test_loss: 1.2901, test_f1: 0.5917
 epoch: 84, train_loss: 0.5572, test_loss: 1.4010, test_f1: 0.5960
 epoch: 85, train_loss: 0.6094, test_loss: 1.3483, test_f1: 0.5517
 epoch: 86, train_loss: 0.5773, test_loss: 1.5071, test_f1: 0.5711
 epoch: 87, train_loss: 0.5749, test_loss: 1.3171, test_f1: 0.6114
 epoch: 88, train_loss: 0.5281, test_loss: 1.3893, test_f1: 0.5844
 epoch: 89, train_loss: 0.5813, test_loss: 1.2536, test_f1: 0.6023
 epoch: 90, train_loss: 0.5774, test_loss: 1.7042, test_f1: 0.5594
 epoch: 91, train_loss: 0.5797, test_loss: 1.4894, test_f1: 0.5292
 epoch: 92, train_loss: 0.5679, test_loss: 1.3486, test_f1: 0.5813
 epoch: 93, train_loss: 0.5470, test_loss: 1.3728, test_f1: 0.5647
 epoch: 94, train_loss: 0.5484, test_loss: 1.3991, test_f1: 0.5757
 epoch: 95, train_loss: 0.5617, test_loss: 1.5157, test_f1: 0.5756
 epoch: 96, train_loss: 0.5416, test_loss: 1.4208, test_f1: 0.5693
 epoch: 97, train_loss: 0.5488, test_loss: 1.3204, test_f1: 0.5637
 epoch: 98, train_loss: 0.5404, test_loss: 1.5106, test_f1: 0.5653
 epoch: 99, train_loss: 0.5396, test_loss: 1.4348, test_f1: 0.5814

Training completed in 666.06 seconds
Best F1: 0.6578 at epoch 95
Mean F1 across iterations: 0.6337  0.0183
========================FINAL RESULTS================================
FEGIN weighted F1: 0.6578  0.0183
python main.py --data ltspice_demos --representation component_net --model FEGIN --layers 4 --hiddens 32 --batch_size 32 --lr 0.01 --emb_size 128 --epochs 100 --save_appendix component_net_L4_H32_BS32_LR0.01_E128 --no_val
-----



STDERR:
  File "main.py", line 370, in <module>
    main()
  File "main.py", line 254, in main
    dataset = dataset_class(
  File "/home/philip/projects/ltspice_examples_code_repo/Circuit-Completion-Using-GNNs/component_classification_with_link_prediction_head/evaluation/FEGIN/kernel/circuit_datasets.py", line 15, in __init__
    self.data, self.slices = torch.load(self.processed_paths[0])
  File "/home/philip/.local/lib/python3.8/site-packages/torch/serialization.py", line 1040, in load
    warnings.warn(
  File "/usr/lib/python3.8/warnings.py", line 109, in _showwarnmsg
    sw(msg.message, msg.category, msg.filename, msg.lineno,
  File "main.py", line 47, in warn_with_traceback
    traceback.print_stack(file=log)
/home/philip/projects/ltspice_examples_code_repo/Circuit-Completion-Using-GNNs/component_classification_with_link_prediction_head/evaluation/FEGIN/kernel/circuit_datasets.py:15: FutureWarning: You are using `torch.load` with `weights_only=False` (the current default value), which uses the default pickle module implicitly. It is possible to construct malicious pickle data which will execute arbitrary code during unpickling (See https://github.com/pytorch/pytorch/blob/main/SECURITY.md#untrusted-models for more details). In a future release, the default value for `weights_only` will be flipped to `True`. This limits the functions that could be executed during unpickling. Arbitrary objects will no longer be allowed to be loaded via this mode unless they are explicitly allowlisted by the user via `torch.serialization.add_safe_globals`. We recommend you start setting `weights_only=True` for any use case where you don't have full control of the loaded file. Please open an issue on GitHub for any issues related to this experimental feature.
  self.data, self.slices = torch.load(self.processed_paths[0])
