STDOUT:
Results will be saved in /home/philip/projects/ltspice_examples_code_repo/Circuit-Completion-Using-GNNs/component_classification_with_link_prediction_head/evaluation/FEGIN/results/model_FEGIN_dataset_ltspice_demos
Command line input: python main.py --data ltspice_demos --representation component_pin --model FEGIN --layers 6 --hiddens 32 --batch_size 32 --lr 0.01 --emb_size 512 --epochs 100 --save_appendix component_pin_L6_H32_BS32_LR0.01_E512 --no_val
 is saved.
-----
ltspice_demos - FEGIN
Using 6 layers, 32 hidden units, h = 2
Loading component_pin representation dataset
ENTERED
Training FEGIN on component_pin representation
Train: 1565, Test: 383
##################ITERATION #0 ****************************************
 epoch: 0, train_loss: 1.2408, test_loss: 1.2382, test_f1: 0.4175
 epoch: 1, train_loss: 1.0975, test_loss: 1.0456, test_f1: 0.4368
 epoch: 2, train_loss: 0.9680, test_loss: 1.0646, test_f1: 0.4724
 epoch: 3, train_loss: 0.9343, test_loss: 1.0421, test_f1: 0.5117
 epoch: 4, train_loss: 0.8912, test_loss: 0.9734, test_f1: 0.4540
 epoch: 5, train_loss: 0.8745, test_loss: 0.9513, test_f1: 0.4990
 epoch: 6, train_loss: 0.8591, test_loss: 0.9976, test_f1: 0.4651
 epoch: 7, train_loss: 0.8636, test_loss: 1.0738, test_f1: 0.4522
 epoch: 8, train_loss: 0.8196, test_loss: 1.0495, test_f1: 0.5829
 epoch: 9, train_loss: 0.8088, test_loss: 1.0688, test_f1: 0.5729
 epoch: 10, train_loss: 0.8008, test_loss: 1.0393, test_f1: 0.5256
 epoch: 11, train_loss: 0.7989, test_loss: 1.2132, test_f1: 0.5416
 epoch: 12, train_loss: 0.8079, test_loss: 2.6831, test_f1: 0.3841
 epoch: 13, train_loss: 0.7760, test_loss: 1.0582, test_f1: 0.5841
 epoch: 14, train_loss: 0.7597, test_loss: 1.0917, test_f1: 0.5889
 epoch: 15, train_loss: 0.7573, test_loss: 1.0890, test_f1: 0.5633
 epoch: 16, train_loss: 0.7882, test_loss: 1.1054, test_f1: 0.5705
 epoch: 17, train_loss: 0.7603, test_loss: 1.3523, test_f1: 0.5391
 epoch: 18, train_loss: 0.7839, test_loss: 1.1032, test_f1: 0.4629
 epoch: 19, train_loss: 0.7554, test_loss: 1.1138, test_f1: 0.5400
 epoch: 20, train_loss: 0.7746, test_loss: 1.0063, test_f1: 0.5683
 epoch: 21, train_loss: 0.7892, test_loss: 1.0633, test_f1: 0.5746
 epoch: 22, train_loss: 0.7659, test_loss: 1.1645, test_f1: 0.5435
 epoch: 23, train_loss: 0.7371, test_loss: 1.1742, test_f1: 0.5774
 epoch: 24, train_loss: 0.7539, test_loss: 1.3890, test_f1: 0.5570
 epoch: 25, train_loss: 0.7483, test_loss: 1.2411, test_f1: 0.6034
 epoch: 26, train_loss: 0.7207, test_loss: 1.1735, test_f1: 0.5686
 epoch: 27, train_loss: 0.7367, test_loss: 1.2778, test_f1: 0.5415
 epoch: 28, train_loss: 0.7126, test_loss: 1.0285, test_f1: 0.6064
 epoch: 29, train_loss: 0.7158, test_loss: 1.0397, test_f1: 0.5893
 epoch: 30, train_loss: 0.7086, test_loss: 0.9537, test_f1: 0.6394
 epoch: 31, train_loss: 0.6782, test_loss: 1.1798, test_f1: 0.6320
 epoch: 32, train_loss: 0.6963, test_loss: 1.1323, test_f1: 0.6014
 epoch: 33, train_loss: 0.6921, test_loss: 1.1792, test_f1: 0.6344
 epoch: 34, train_loss: 0.6974, test_loss: 1.1354, test_f1: 0.6148
 epoch: 35, train_loss: 0.7156, test_loss: 1.0433, test_f1: 0.6097
 epoch: 36, train_loss: 0.7265, test_loss: 1.1434, test_f1: 0.5898
 epoch: 37, train_loss: 0.6991, test_loss: 1.1112, test_f1: 0.5941
 epoch: 38, train_loss: 0.6835, test_loss: 1.0903, test_f1: 0.5816
 epoch: 39, train_loss: 0.6668, test_loss: 1.4420, test_f1: 0.5463
 epoch: 40, train_loss: 0.6735, test_loss: 1.2122, test_f1: 0.5474
 epoch: 41, train_loss: 0.6524, test_loss: 1.2030, test_f1: 0.5944
 epoch: 42, train_loss: 0.6834, test_loss: 1.1901, test_f1: 0.5748
 epoch: 43, train_loss: 0.7058, test_loss: 1.0922, test_f1: 0.5676
 epoch: 44, train_loss: 0.6564, test_loss: 1.2312, test_f1: 0.6209
 epoch: 45, train_loss: 0.6703, test_loss: 1.8837, test_f1: 0.5130
 epoch: 46, train_loss: 0.6689, test_loss: 1.3377, test_f1: 0.5603
 epoch: 47, train_loss: 0.6471, test_loss: 1.3616, test_f1: 0.5988
 epoch: 48, train_loss: 0.6429, test_loss: 1.3821, test_f1: 0.5828
 epoch: 49, train_loss: 0.6631, test_loss: 1.3511, test_f1: 0.6020
 epoch: 50, train_loss: 0.6573, test_loss: 1.3368, test_f1: 0.5615
 epoch: 51, train_loss: 0.6049, test_loss: 1.3132, test_f1: 0.6050
 epoch: 52, train_loss: 0.5841, test_loss: 1.4237, test_f1: 0.6182
 epoch: 53, train_loss: 0.5768, test_loss: 1.3662, test_f1: 0.5977
 epoch: 54, train_loss: 0.5693, test_loss: 1.4335, test_f1: 0.5869
 epoch: 55, train_loss: 0.5523, test_loss: 1.5147, test_f1: 0.6002
 epoch: 56, train_loss: 0.5522, test_loss: 1.5340, test_f1: 0.6215
 epoch: 57, train_loss: 0.5290, test_loss: 1.4392, test_f1: 0.6285
 epoch: 58, train_loss: 0.5454, test_loss: 1.8459, test_f1: 0.5848
 epoch: 59, train_loss: 0.5586, test_loss: 1.7987, test_f1: 0.5869
 epoch: 60, train_loss: 0.5701, test_loss: 1.4371, test_f1: 0.6389
 epoch: 61, train_loss: 0.5571, test_loss: 1.4851, test_f1: 0.6062
 epoch: 62, train_loss: 0.5219, test_loss: 1.6754, test_f1: 0.6203
 epoch: 63, train_loss: 0.5815, test_loss: 1.2478, test_f1: 0.6139
 epoch: 64, train_loss: 0.5675, test_loss: 1.3206, test_f1: 0.6272
 epoch: 65, train_loss: 0.5186, test_loss: 1.4905, test_f1: 0.6058
 epoch: 66, train_loss: 0.5459, test_loss: 1.2625, test_f1: 0.5828
 epoch: 67, train_loss: 0.5339, test_loss: 1.5144, test_f1: 0.6018
 epoch: 68, train_loss: 0.5145, test_loss: 1.3375, test_f1: 0.6015
 epoch: 69, train_loss: 0.4867, test_loss: 1.3243, test_f1: 0.6190
 epoch: 70, train_loss: 0.4983, test_loss: 1.5635, test_f1: 0.5923
 epoch: 71, train_loss: 0.4892, test_loss: 1.6468, test_f1: 0.5853
 epoch: 72, train_loss: 0.5202, test_loss: 1.2320, test_f1: 0.6037
 epoch: 73, train_loss: 0.5306, test_loss: 1.4270, test_f1: 0.5926
 epoch: 74, train_loss: 0.5045, test_loss: 1.4619, test_f1: 0.5999
 epoch: 75, train_loss: 0.4926, test_loss: 1.6184, test_f1: 0.6215
 epoch: 76, train_loss: 0.4843, test_loss: 1.5092, test_f1: 0.5996
 epoch: 77, train_loss: 0.4883, test_loss: 1.5586, test_f1: 0.5813
 epoch: 78, train_loss: 0.4857, test_loss: 2.2112, test_f1: 0.5899
 epoch: 79, train_loss: 0.4944, test_loss: 1.7622, test_f1: 0.6095
 epoch: 80, train_loss: 0.5074, test_loss: 1.4459, test_f1: 0.6222
 epoch: 81, train_loss: 0.4702, test_loss: 1.5668, test_f1: 0.6214
 epoch: 82, train_loss: 0.4533, test_loss: 1.6582, test_f1: 0.6423
 epoch: 83, train_loss: 0.4515, test_loss: 1.6627, test_f1: 0.6393
 epoch: 84, train_loss: 0.4633, test_loss: 1.5232, test_f1: 0.6077
 epoch: 85, train_loss: 0.4448, test_loss: 1.4994, test_f1: 0.6385
 epoch: 86, train_loss: 0.4545, test_loss: 1.5457, test_f1: 0.6027
 epoch: 87, train_loss: 0.4646, test_loss: 1.9598, test_f1: 0.6363
 epoch: 88, train_loss: 0.4531, test_loss: 1.7838, test_f1: 0.5982
 epoch: 89, train_loss: 0.4373, test_loss: 1.7616, test_f1: 0.6117
 epoch: 90, train_loss: 0.4769, test_loss: 1.7486, test_f1: 0.6258
 epoch: 91, train_loss: 0.4386, test_loss: 2.1402, test_f1: 0.6320
 epoch: 92, train_loss: 0.4720, test_loss: 1.8632, test_f1: 0.6075
 epoch: 93, train_loss: 0.4489, test_loss: 1.5085, test_f1: 0.6309
 epoch: 94, train_loss: 0.3952, test_loss: 1.9038, test_f1: 0.5907
 epoch: 95, train_loss: 0.4234, test_loss: 2.1011, test_f1: 0.6351
 epoch: 96, train_loss: 0.3972, test_loss: 1.8997, test_f1: 0.6375
 epoch: 97, train_loss: 0.4447, test_loss: 2.2622, test_f1: 0.6037
 epoch: 98, train_loss: 0.4338, test_loss: 1.8575, test_f1: 0.6051
 epoch: 99, train_loss: 0.4667, test_loss: 1.6598, test_f1: 0.6254
##################ITERATION #1 ****************************************
 epoch: 0, train_loss: 1.1502, test_loss: 1.2205, test_f1: 0.4241
 epoch: 1, train_loss: 0.9993, test_loss: 1.1691, test_f1: 0.4560
 epoch: 2, train_loss: 0.9776, test_loss: 1.0397, test_f1: 0.4583
 epoch: 3, train_loss: 0.9227, test_loss: 1.0429, test_f1: 0.5613
 epoch: 4, train_loss: 0.8964, test_loss: 1.0095, test_f1: 0.5843
 epoch: 5, train_loss: 0.8931, test_loss: 0.9822, test_f1: 0.5764
 epoch: 6, train_loss: 0.8824, test_loss: 1.0353, test_f1: 0.5203
 epoch: 7, train_loss: 0.8559, test_loss: 1.1905, test_f1: 0.5169
 epoch: 8, train_loss: 0.8822, test_loss: 1.0211, test_f1: 0.4634
 epoch: 9, train_loss: 0.8454, test_loss: 0.9768, test_f1: 0.5380
 epoch: 10, train_loss: 0.8371, test_loss: 1.1138, test_f1: 0.5667
 epoch: 11, train_loss: 0.8306, test_loss: 1.4364, test_f1: 0.4821
 epoch: 12, train_loss: 0.8262, test_loss: 0.9400, test_f1: 0.6092
 epoch: 13, train_loss: 0.8047, test_loss: 0.9937, test_f1: 0.5755
 epoch: 14, train_loss: 0.7898, test_loss: 1.0890, test_f1: 0.5989
 epoch: 15, train_loss: 0.7835, test_loss: 1.1606, test_f1: 0.4451
 epoch: 16, train_loss: 0.7869, test_loss: 1.0731, test_f1: 0.4938
 epoch: 17, train_loss: 0.7854, test_loss: 1.0042, test_f1: 0.5971
 epoch: 18, train_loss: 0.7853, test_loss: 0.9644, test_f1: 0.5640
 epoch: 19, train_loss: 0.7612, test_loss: 1.1597, test_f1: 0.4135
 epoch: 20, train_loss: 0.7580, test_loss: 1.1290, test_f1: 0.6037
 epoch: 21, train_loss: 0.7489, test_loss: 1.4200, test_f1: 0.5388
 epoch: 22, train_loss: 0.7691, test_loss: 1.0903, test_f1: 0.5212
 epoch: 23, train_loss: 0.7548, test_loss: 0.9799, test_f1: 0.5838
 epoch: 24, train_loss: 0.7656, test_loss: 1.0656, test_f1: 0.5965
 epoch: 25, train_loss: 0.7410, test_loss: 2.0845, test_f1: 0.5371
 epoch: 26, train_loss: 0.7451, test_loss: 0.9550, test_f1: 0.6139
 epoch: 27, train_loss: 0.7436, test_loss: 1.0075, test_f1: 0.6237
 epoch: 28, train_loss: 0.7484, test_loss: 1.1008, test_f1: 0.5821
 epoch: 29, train_loss: 0.7231, test_loss: 1.2601, test_f1: 0.5642
 epoch: 30, train_loss: 0.7518, test_loss: 1.0203, test_f1: 0.5822
 epoch: 31, train_loss: 0.7143, test_loss: 1.1794, test_f1: 0.4045
 epoch: 32, train_loss: 0.7239, test_loss: 1.0621, test_f1: 0.5806
 epoch: 33, train_loss: 0.7392, test_loss: 1.0125, test_f1: 0.5513
 epoch: 34, train_loss: 0.7138, test_loss: 1.0210, test_f1: 0.5640
 epoch: 35, train_loss: 0.7078, test_loss: 1.0079, test_f1: 0.5938
 epoch: 36, train_loss: 0.7108, test_loss: 0.9611, test_f1: 0.5856
 epoch: 37, train_loss: 0.7143, test_loss: 1.3076, test_f1: 0.5345
 epoch: 38, train_loss: 0.7178, test_loss: 1.0870, test_f1: 0.5597
 epoch: 39, train_loss: 0.6877, test_loss: 1.0297, test_f1: 0.6112
 epoch: 40, train_loss: 0.6817, test_loss: 0.9791, test_f1: 0.5790
 epoch: 41, train_loss: 0.6869, test_loss: 1.0165, test_f1: 0.6026
 epoch: 42, train_loss: 0.6894, test_loss: 1.0971, test_f1: 0.5891
 epoch: 43, train_loss: 0.7157, test_loss: 1.2741, test_f1: 0.5450
 epoch: 44, train_loss: 0.6961, test_loss: 1.1513, test_f1: 0.5466
 epoch: 45, train_loss: 0.6834, test_loss: 1.0945, test_f1: 0.5836
 epoch: 46, train_loss: 0.6992, test_loss: 1.2550, test_f1: 0.5363
 epoch: 47, train_loss: 0.7162, test_loss: 1.0387, test_f1: 0.5442
 epoch: 48, train_loss: 0.6767, test_loss: 1.0807, test_f1: 0.5001
 epoch: 49, train_loss: 0.6863, test_loss: 1.1508, test_f1: 0.5482
 epoch: 50, train_loss: 0.6917, test_loss: 1.2471, test_f1: 0.4888
 epoch: 51, train_loss: 0.6719, test_loss: 1.0595, test_f1: 0.5736
 epoch: 52, train_loss: 0.6495, test_loss: 1.0825, test_f1: 0.5768
 epoch: 53, train_loss: 0.6427, test_loss: 1.1382, test_f1: 0.5906
 epoch: 54, train_loss: 0.6329, test_loss: 1.2512, test_f1: 0.6016
 epoch: 55, train_loss: 0.6461, test_loss: 1.1026, test_f1: 0.5898
 epoch: 56, train_loss: 0.6430, test_loss: 1.2205, test_f1: 0.6116
 epoch: 57, train_loss: 0.6290, test_loss: 1.1013, test_f1: 0.6037
 epoch: 58, train_loss: 0.6196, test_loss: 1.1971, test_f1: 0.5853
 epoch: 59, train_loss: 0.6229, test_loss: 1.2914, test_f1: 0.5880
 epoch: 60, train_loss: 0.6321, test_loss: 1.2421, test_f1: 0.5786
 epoch: 61, train_loss: 0.6191, test_loss: 1.2375, test_f1: 0.5851
 epoch: 62, train_loss: 0.6031, test_loss: 1.2139, test_f1: 0.5771
 epoch: 63, train_loss: 0.6035, test_loss: 1.1653, test_f1: 0.6308
 epoch: 64, train_loss: 0.6177, test_loss: 1.2080, test_f1: 0.5576
 epoch: 65, train_loss: 0.6277, test_loss: 1.3100, test_f1: 0.5216
 epoch: 66, train_loss: 0.6121, test_loss: 1.1258, test_f1: 0.6293
 epoch: 67, train_loss: 0.6042, test_loss: 1.4495, test_f1: 0.5168
 epoch: 68, train_loss: 0.6217, test_loss: 1.2789, test_f1: 0.6341
 epoch: 69, train_loss: 0.6019, test_loss: 1.2544, test_f1: 0.5948
 epoch: 70, train_loss: 0.6059, test_loss: 1.2586, test_f1: 0.6380
 epoch: 71, train_loss: 0.6015, test_loss: 1.0799, test_f1: 0.6555
 epoch: 72, train_loss: 0.6350, test_loss: 1.2209, test_f1: 0.5638
 epoch: 73, train_loss: 0.6286, test_loss: 1.2794, test_f1: 0.5375
 epoch: 74, train_loss: 0.6129, test_loss: 1.2313, test_f1: 0.6037
 epoch: 75, train_loss: 0.6110, test_loss: 1.2844, test_f1: 0.6068
 epoch: 76, train_loss: 0.5999, test_loss: 1.1521, test_f1: 0.5938
 epoch: 77, train_loss: 0.5965, test_loss: 1.0708, test_f1: 0.6026
 epoch: 78, train_loss: 0.6077, test_loss: 1.1869, test_f1: 0.6273
 epoch: 79, train_loss: 0.5952, test_loss: 1.2475, test_f1: 0.6260
 epoch: 80, train_loss: 0.5920, test_loss: 1.2350, test_f1: 0.5426
 epoch: 81, train_loss: 0.5834, test_loss: 1.3505, test_f1: 0.5807
 epoch: 82, train_loss: 0.6286, test_loss: 1.1717, test_f1: 0.6330
 epoch: 83, train_loss: 0.6081, test_loss: 1.1269, test_f1: 0.6314
 epoch: 84, train_loss: 0.5825, test_loss: 1.1567, test_f1: 0.5919
 epoch: 85, train_loss: 0.5911, test_loss: 1.1671, test_f1: 0.6410
 epoch: 86, train_loss: 0.5637, test_loss: 1.2881, test_f1: 0.5692
 epoch: 87, train_loss: 0.5709, test_loss: 1.4137, test_f1: 0.6130
 epoch: 88, train_loss: 0.5869, test_loss: 1.1729, test_f1: 0.6109
 epoch: 89, train_loss: 0.5792, test_loss: 1.1635, test_f1: 0.5967
 epoch: 90, train_loss: 0.5752, test_loss: 1.2859, test_f1: 0.5997
 epoch: 91, train_loss: 0.5627, test_loss: 1.3003, test_f1: 0.6379
 epoch: 92, train_loss: 0.5635, test_loss: 1.1980, test_f1: 0.6034
 epoch: 93, train_loss: 0.5583, test_loss: 1.1950, test_f1: 0.6107
 epoch: 94, train_loss: 0.5560, test_loss: 1.5081, test_f1: 0.5380
 epoch: 95, train_loss: 0.5688, test_loss: 1.1639, test_f1: 0.5953
 epoch: 96, train_loss: 0.5537, test_loss: 1.2719, test_f1: 0.6318
 epoch: 97, train_loss: 0.5553, test_loss: 1.3062, test_f1: 0.6044
 epoch: 98, train_loss: 0.5463, test_loss: 1.1863, test_f1: 0.6270
 epoch: 99, train_loss: 0.5507, test_loss: 1.3107, test_f1: 0.5607
##################ITERATION #2 ****************************************
 epoch: 0, train_loss: 1.1715, test_loss: 1.3203, test_f1: 0.3698
 epoch: 1, train_loss: 1.0218, test_loss: 1.1526, test_f1: 0.4035
 epoch: 2, train_loss: 0.9924, test_loss: 1.0829, test_f1: 0.5286
 epoch: 3, train_loss: 0.9717, test_loss: 1.0614, test_f1: 0.4791
 epoch: 4, train_loss: 0.9360, test_loss: 1.0637, test_f1: 0.5142
 epoch: 5, train_loss: 0.9240, test_loss: 0.9974, test_f1: 0.5491
 epoch: 6, train_loss: 0.8912, test_loss: 1.0863, test_f1: 0.4687
 epoch: 7, train_loss: 0.8808, test_loss: 1.1510, test_f1: 0.4127
 epoch: 8, train_loss: 0.8734, test_loss: 0.9637, test_f1: 0.5765
 epoch: 9, train_loss: 0.8590, test_loss: 0.9904, test_f1: 0.5524
 epoch: 10, train_loss: 0.8396, test_loss: 0.9995, test_f1: 0.5738
 epoch: 11, train_loss: 0.8264, test_loss: 1.0886, test_f1: 0.4858
 epoch: 12, train_loss: 0.7980, test_loss: 1.6463, test_f1: 0.4683
 epoch: 13, train_loss: 0.8267, test_loss: 0.9904, test_f1: 0.5799
 epoch: 14, train_loss: 0.8026, test_loss: 1.8134, test_f1: 0.4025
 epoch: 15, train_loss: 0.8155, test_loss: 1.0842, test_f1: 0.5580
 epoch: 16, train_loss: 0.8011, test_loss: 1.2184, test_f1: 0.5340
 epoch: 17, train_loss: 0.8124, test_loss: 1.0730, test_f1: 0.5229
 epoch: 18, train_loss: 0.7744, test_loss: 1.0541, test_f1: 0.5618
 epoch: 19, train_loss: 0.7794, test_loss: 1.1328, test_f1: 0.5491
 epoch: 20, train_loss: 0.7652, test_loss: 1.0016, test_f1: 0.5616
 epoch: 21, train_loss: 0.7714, test_loss: 0.9559, test_f1: 0.5083
 epoch: 22, train_loss: 0.7668, test_loss: 0.9534, test_f1: 0.5970
 epoch: 23, train_loss: 0.7625, test_loss: 1.0207, test_f1: 0.5447
 epoch: 24, train_loss: 0.7898, test_loss: 1.1202, test_f1: 0.5210
 epoch: 25, train_loss: 0.7372, test_loss: 1.0373, test_f1: 0.5566
 epoch: 26, train_loss: 0.7582, test_loss: 0.9935, test_f1: 0.5544
 epoch: 27, train_loss: 0.7520, test_loss: 1.3389, test_f1: 0.5116
 epoch: 28, train_loss: 0.7382, test_loss: 1.0608, test_f1: 0.5775
 epoch: 29, train_loss: 0.7177, test_loss: 0.9443, test_f1: 0.6103
 epoch: 30, train_loss: 0.7108, test_loss: 1.0314, test_f1: 0.5509
 epoch: 31, train_loss: 0.7208, test_loss: 1.0829, test_f1: 0.5768
 epoch: 32, train_loss: 0.7112, test_loss: 1.1826, test_f1: 0.4814
 epoch: 33, train_loss: 0.7246, test_loss: 1.0283, test_f1: 0.6227
 epoch: 34, train_loss: 0.7636, test_loss: 1.0784, test_f1: 0.5996
 epoch: 35, train_loss: 0.6878, test_loss: 1.0300, test_f1: 0.6278
 epoch: 36, train_loss: 0.6936, test_loss: 1.0289, test_f1: 0.6070
 epoch: 37, train_loss: 0.7149, test_loss: 1.0196, test_f1: 0.5445
 epoch: 38, train_loss: 0.7142, test_loss: 0.9433, test_f1: 0.5962
 epoch: 39, train_loss: 0.6830, test_loss: 1.0621, test_f1: 0.5765
 epoch: 40, train_loss: 0.6955, test_loss: 1.0974, test_f1: 0.5811
 epoch: 41, train_loss: 0.6801, test_loss: 1.0060, test_f1: 0.6065
 epoch: 42, train_loss: 0.6862, test_loss: 1.1916, test_f1: 0.5131
 epoch: 43, train_loss: 0.6793, test_loss: 1.1519, test_f1: 0.5917
 epoch: 44, train_loss: 0.6961, test_loss: 1.0294, test_f1: 0.5825
 epoch: 45, train_loss: 0.6712, test_loss: 1.0394, test_f1: 0.5907
 epoch: 46, train_loss: 0.6714, test_loss: 1.1513, test_f1: 0.5521
 epoch: 47, train_loss: 0.6914, test_loss: 1.0396, test_f1: 0.5584
 epoch: 48, train_loss: 0.6955, test_loss: 1.0647, test_f1: 0.6099
 epoch: 49, train_loss: 0.6347, test_loss: 1.1419, test_f1: 0.5772
 epoch: 50, train_loss: 0.6653, test_loss: 1.1224, test_f1: 0.5872
 epoch: 51, train_loss: 0.6323, test_loss: 1.1960, test_f1: 0.5797
 epoch: 52, train_loss: 0.6117, test_loss: 1.1540, test_f1: 0.5825
 epoch: 53, train_loss: 0.6105, test_loss: 1.1861, test_f1: 0.5649
 epoch: 54, train_loss: 0.6005, test_loss: 1.0829, test_f1: 0.6035
 epoch: 55, train_loss: 0.5976, test_loss: 1.1221, test_f1: 0.6316
 epoch: 56, train_loss: 0.6006, test_loss: 1.1196, test_f1: 0.6098
 epoch: 57, train_loss: 0.5827, test_loss: 1.3281, test_f1: 0.6310
 epoch: 58, train_loss: 0.5589, test_loss: 1.3897, test_f1: 0.6039
 epoch: 59, train_loss: 0.5562, test_loss: 1.3793, test_f1: 0.5890
 epoch: 60, train_loss: 0.5645, test_loss: 1.1757, test_f1: 0.6086
 epoch: 61, train_loss: 0.5700, test_loss: 1.2896, test_f1: 0.6296
 epoch: 62, train_loss: 0.5431, test_loss: 1.3502, test_f1: 0.5704
 epoch: 63, train_loss: 0.5500, test_loss: 1.4994, test_f1: 0.5887
 epoch: 64, train_loss: 0.5588, test_loss: 1.3801, test_f1: 0.5601
 epoch: 65, train_loss: 0.5827, test_loss: 1.2513, test_f1: 0.5909
 epoch: 66, train_loss: 0.5573, test_loss: 1.3669, test_f1: 0.6214
 epoch: 67, train_loss: 0.5583, test_loss: 1.2953, test_f1: 0.6025
 epoch: 68, train_loss: 0.5521, test_loss: 1.3532, test_f1: 0.5624
 epoch: 69, train_loss: 0.5681, test_loss: 1.1245, test_f1: 0.6140
 epoch: 70, train_loss: 0.5447, test_loss: 1.2192, test_f1: 0.6220
 epoch: 71, train_loss: 0.5316, test_loss: 1.4869, test_f1: 0.5697
 epoch: 72, train_loss: 0.5282, test_loss: 1.4217, test_f1: 0.5990
 epoch: 73, train_loss: 0.5722, test_loss: 1.3150, test_f1: 0.6219
 epoch: 74, train_loss: 0.5438, test_loss: 1.4036, test_f1: 0.6175
 epoch: 75, train_loss: 0.5129, test_loss: 1.4916, test_f1: 0.6230
 epoch: 76, train_loss: 0.5241, test_loss: 1.5759, test_f1: 0.6076
 epoch: 77, train_loss: 0.5320, test_loss: 1.3376, test_f1: 0.6328
 epoch: 78, train_loss: 0.5195, test_loss: 1.2608, test_f1: 0.6322
 epoch: 79, train_loss: 0.5159, test_loss: 1.3843, test_f1: 0.6284
 epoch: 80, train_loss: 0.5288, test_loss: 1.3358, test_f1: 0.6239
 epoch: 81, train_loss: 0.5354, test_loss: 1.2991, test_f1: 0.6055
 epoch: 82, train_loss: 0.5118, test_loss: 1.2684, test_f1: 0.6173
 epoch: 83, train_loss: 0.5289, test_loss: 1.1949, test_f1: 0.6505
 epoch: 84, train_loss: 0.5377, test_loss: 1.4021, test_f1: 0.6242
 epoch: 85, train_loss: 0.5263, test_loss: 1.3232, test_f1: 0.6226
 epoch: 86, train_loss: 0.5001, test_loss: 1.2563, test_f1: 0.6122
 epoch: 87, train_loss: 0.4738, test_loss: 1.3052, test_f1: 0.6397
 epoch: 88, train_loss: 0.4748, test_loss: 1.5130, test_f1: 0.6168
 epoch: 89, train_loss: 0.5051, test_loss: 1.5462, test_f1: 0.6270
 epoch: 90, train_loss: 0.4912, test_loss: 1.5095, test_f1: 0.6069
 epoch: 91, train_loss: 0.5201, test_loss: 1.4221, test_f1: 0.6050
 epoch: 92, train_loss: 0.5099, test_loss: 1.3465, test_f1: 0.6221
 epoch: 93, train_loss: 0.5015, test_loss: 1.2775, test_f1: 0.6046
 epoch: 94, train_loss: 0.4831, test_loss: 1.2772, test_f1: 0.5872
 epoch: 95, train_loss: 0.4829, test_loss: 1.3348, test_f1: 0.6417
 epoch: 96, train_loss: 0.4703, test_loss: 1.5325, test_f1: 0.5877
 epoch: 97, train_loss: 0.4892, test_loss: 1.4022, test_f1: 0.5738
 epoch: 98, train_loss: 0.4949, test_loss: 1.3689, test_f1: 0.6070
 epoch: 99, train_loss: 0.5084, test_loss: 1.3407, test_f1: 0.6190
##################ITERATION #3 ****************************************
 epoch: 0, train_loss: 1.1875, test_loss: 1.1464, test_f1: 0.4338
 epoch: 1, train_loss: 1.0158, test_loss: 1.0628, test_f1: 0.4935
 epoch: 2, train_loss: 0.9616, test_loss: 1.1631, test_f1: 0.4454
 epoch: 3, train_loss: 0.9482, test_loss: 1.1184, test_f1: 0.4454
 epoch: 4, train_loss: 0.9176, test_loss: 0.9737, test_f1: 0.5720
 epoch: 5, train_loss: 0.8976, test_loss: 0.9680, test_f1: 0.4932
 epoch: 6, train_loss: 0.8799, test_loss: 0.9939, test_f1: 0.5822
 epoch: 7, train_loss: 0.8636, test_loss: 1.0737, test_f1: 0.5051
 epoch: 8, train_loss: 0.8613, test_loss: 1.0738, test_f1: 0.5695
 epoch: 9, train_loss: 0.8285, test_loss: 0.9310, test_f1: 0.5455
 epoch: 10, train_loss: 0.8497, test_loss: 0.9487, test_f1: 0.5058
 epoch: 11, train_loss: 0.8605, test_loss: 1.0044, test_f1: 0.4954
 epoch: 12, train_loss: 0.8324, test_loss: 0.9275, test_f1: 0.5124
 epoch: 13, train_loss: 0.7819, test_loss: 0.8815, test_f1: 0.5812
 epoch: 14, train_loss: 0.7981, test_loss: 0.9560, test_f1: 0.5784
 epoch: 15, train_loss: 0.7733, test_loss: 1.1103, test_f1: 0.5742
 epoch: 16, train_loss: 0.7495, test_loss: 1.0561, test_f1: 0.5572
 epoch: 17, train_loss: 0.7952, test_loss: 0.9826, test_f1: 0.5984
 epoch: 18, train_loss: 0.7424, test_loss: 0.9818, test_f1: 0.6195
 epoch: 19, train_loss: 0.7699, test_loss: 1.2353, test_f1: 0.5091
 epoch: 20, train_loss: 0.7731, test_loss: 1.0737, test_f1: 0.5999
 epoch: 21, train_loss: 0.7470, test_loss: 1.0616, test_f1: 0.6179
 epoch: 22, train_loss: 0.7274, test_loss: 1.1195, test_f1: 0.5840
 epoch: 23, train_loss: 0.7427, test_loss: 1.0526, test_f1: 0.5622
 epoch: 24, train_loss: 0.7213, test_loss: 1.1627, test_f1: 0.5331
 epoch: 25, train_loss: 0.7675, test_loss: 0.9751, test_f1: 0.6376
 epoch: 26, train_loss: 0.7283, test_loss: 1.0808, test_f1: 0.5890
 epoch: 27, train_loss: 0.7327, test_loss: 1.2210, test_f1: 0.5947
 epoch: 28, train_loss: 0.7934, test_loss: 0.9647, test_f1: 0.5731
 epoch: 29, train_loss: 0.7266, test_loss: 0.9528, test_f1: 0.6223
 epoch: 30, train_loss: 0.7040, test_loss: 1.0491, test_f1: 0.5565
 epoch: 31, train_loss: 0.6991, test_loss: 0.9676, test_f1: 0.6272
 epoch: 32, train_loss: 0.6977, test_loss: 1.1813, test_f1: 0.5845
 epoch: 33, train_loss: 0.6829, test_loss: 1.2509, test_f1: 0.4892
 epoch: 34, train_loss: 0.7103, test_loss: 1.7592, test_f1: 0.5456
 epoch: 35, train_loss: 0.6940, test_loss: 1.0086, test_f1: 0.6240
 epoch: 36, train_loss: 0.6781, test_loss: 1.0364, test_f1: 0.5937
 epoch: 37, train_loss: 0.6756, test_loss: 1.0152, test_f1: 0.6032
 epoch: 38, train_loss: 0.6962, test_loss: 1.0342, test_f1: 0.6469
 epoch: 39, train_loss: 0.6678, test_loss: 0.9545, test_f1: 0.6405
 epoch: 40, train_loss: 0.6437, test_loss: 1.0109, test_f1: 0.6285
 epoch: 41, train_loss: 0.6747, test_loss: 1.0341, test_f1: 0.6235
 epoch: 42, train_loss: 0.6697, test_loss: 0.9527, test_f1: 0.6040
 epoch: 43, train_loss: 0.6510, test_loss: 1.0675, test_f1: 0.6368
 epoch: 44, train_loss: 0.6518, test_loss: 0.9572, test_f1: 0.6166
 epoch: 45, train_loss: 0.6600, test_loss: 0.9472, test_f1: 0.6469
 epoch: 46, train_loss: 0.6671, test_loss: 0.9561, test_f1: 0.5990
 epoch: 47, train_loss: 0.6644, test_loss: 1.0538, test_f1: 0.6584
 epoch: 48, train_loss: 0.6620, test_loss: 1.1434, test_f1: 0.5394
 epoch: 49, train_loss: 0.6795, test_loss: 1.3105, test_f1: 0.6526
 epoch: 50, train_loss: 0.6396, test_loss: 1.6518, test_f1: 0.5422
 epoch: 51, train_loss: 0.6265, test_loss: 1.0327, test_f1: 0.6463
 epoch: 52, train_loss: 0.5939, test_loss: 1.1649, test_f1: 0.6080
 epoch: 53, train_loss: 0.5869, test_loss: 1.0876, test_f1: 0.6609
 epoch: 54, train_loss: 0.5815, test_loss: 1.0885, test_f1: 0.6362
 epoch: 55, train_loss: 0.5688, test_loss: 1.0974, test_f1: 0.6564
 epoch: 56, train_loss: 0.5618, test_loss: 1.2966, test_f1: 0.6217
 epoch: 57, train_loss: 0.5787, test_loss: 1.2509, test_f1: 0.6491
 epoch: 58, train_loss: 0.5606, test_loss: 1.3350, test_f1: 0.6317
 epoch: 59, train_loss: 0.5567, test_loss: 1.6531, test_f1: 0.6257
 epoch: 60, train_loss: 0.5581, test_loss: 1.1276, test_f1: 0.6847
 epoch: 61, train_loss: 0.5480, test_loss: 1.4242, test_f1: 0.6135
 epoch: 62, train_loss: 0.5830, test_loss: 1.1068, test_f1: 0.6383
 epoch: 63, train_loss: 0.5637, test_loss: 1.1828, test_f1: 0.6590
 epoch: 64, train_loss: 0.5405, test_loss: 1.2899, test_f1: 0.6545
 epoch: 65, train_loss: 0.5480, test_loss: 1.2366, test_f1: 0.5979
 epoch: 66, train_loss: 0.5467, test_loss: 1.3694, test_f1: 0.5772
 epoch: 67, train_loss: 0.5304, test_loss: 1.4299, test_f1: 0.6377
 epoch: 68, train_loss: 0.5488, test_loss: 1.3209, test_f1: 0.6714
 epoch: 69, train_loss: 0.5296, test_loss: 1.1237, test_f1: 0.6423
 epoch: 70, train_loss: 0.5271, test_loss: 1.2348, test_f1: 0.6532
 epoch: 71, train_loss: 0.5371, test_loss: 1.1663, test_f1: 0.6342
 epoch: 72, train_loss: 0.5260, test_loss: 1.2522, test_f1: 0.6238
 epoch: 73, train_loss: 0.5444, test_loss: 1.5151, test_f1: 0.6105
 epoch: 74, train_loss: 0.5659, test_loss: 1.1158, test_f1: 0.6140
 epoch: 75, train_loss: 0.5359, test_loss: 1.4238, test_f1: 0.6196
 epoch: 76, train_loss: 0.5167, test_loss: 1.2030, test_f1: 0.6179
 epoch: 77, train_loss: 0.4933, test_loss: 0.9847, test_f1: 0.6948
 epoch: 78, train_loss: 0.5201, test_loss: 1.1809, test_f1: 0.6828
 epoch: 79, train_loss: 0.4835, test_loss: 1.3254, test_f1: 0.5898
 epoch: 80, train_loss: 0.5011, test_loss: 1.1846, test_f1: 0.5827
 epoch: 81, train_loss: 0.4949, test_loss: 1.1463, test_f1: 0.6516
 epoch: 82, train_loss: 0.4927, test_loss: 1.1003, test_f1: 0.6958
 epoch: 83, train_loss: 0.4976, test_loss: 1.3367, test_f1: 0.6491
 epoch: 84, train_loss: 0.4867, test_loss: 1.3400, test_f1: 0.6268
 epoch: 85, train_loss: 0.4811, test_loss: 1.3189, test_f1: 0.6620
 epoch: 86, train_loss: 0.4790, test_loss: 1.3360, test_f1: 0.6227
 epoch: 87, train_loss: 0.4967, test_loss: 1.2570, test_f1: 0.6219
 epoch: 88, train_loss: 0.4889, test_loss: 1.3751, test_f1: 0.6128
 epoch: 89, train_loss: 0.4717, test_loss: 1.3152, test_f1: 0.6246
 epoch: 90, train_loss: 0.4772, test_loss: 1.7110, test_f1: 0.5978
 epoch: 91, train_loss: 0.5157, test_loss: 1.2345, test_f1: 0.6184
 epoch: 92, train_loss: 0.4656, test_loss: 1.6733, test_f1: 0.5560
 epoch: 93, train_loss: 0.5165, test_loss: 1.2116, test_f1: 0.6348
 epoch: 94, train_loss: 0.4724, test_loss: 1.2916, test_f1: 0.6680
 epoch: 95, train_loss: 0.4803, test_loss: 1.0743, test_f1: 0.6778
 epoch: 96, train_loss: 0.4664, test_loss: 1.3968, test_f1: 0.6342
 epoch: 97, train_loss: 0.4694, test_loss: 1.2399, test_f1: 0.6557
 epoch: 98, train_loss: 0.4604, test_loss: 1.4023, test_f1: 0.6462
 epoch: 99, train_loss: 0.4401, test_loss: 1.6957, test_f1: 0.5948
##################ITERATION #4 ****************************************
 epoch: 0, train_loss: 1.1240, test_loss: 1.2297, test_f1: 0.4512
 epoch: 1, train_loss: 0.9382, test_loss: 1.0157, test_f1: 0.5630
 epoch: 2, train_loss: 0.9092, test_loss: 1.1102, test_f1: 0.4869
 epoch: 3, train_loss: 0.8449, test_loss: 1.0527, test_f1: 0.5128
 epoch: 4, train_loss: 0.8658, test_loss: 1.0359, test_f1: 0.5138
 epoch: 5, train_loss: 0.8233, test_loss: 1.0649, test_f1: 0.5626
 epoch: 6, train_loss: 0.8420, test_loss: 1.0657, test_f1: 0.5066
 epoch: 7, train_loss: 0.8350, test_loss: 1.0461, test_f1: 0.4827
 epoch: 8, train_loss: 0.8239, test_loss: 1.0777, test_f1: 0.5477
 epoch: 9, train_loss: 0.8287, test_loss: 1.1083, test_f1: 0.5142
 epoch: 10, train_loss: 0.8098, test_loss: 0.9902, test_f1: 0.5511
 epoch: 11, train_loss: 0.8084, test_loss: 1.1745, test_f1: 0.4711
 epoch: 12, train_loss: 0.8181, test_loss: 1.2176, test_f1: 0.5112
 epoch: 13, train_loss: 0.8050, test_loss: 0.9953, test_f1: 0.5835
 epoch: 14, train_loss: 0.8100, test_loss: 0.9879, test_f1: 0.5825
 epoch: 15, train_loss: 0.7823, test_loss: 0.9109, test_f1: 0.6074
 epoch: 16, train_loss: 0.7899, test_loss: 1.2372, test_f1: 0.4880
 epoch: 17, train_loss: 0.7915, test_loss: 1.2333, test_f1: 0.5459
 epoch: 18, train_loss: 0.7750, test_loss: 1.4491, test_f1: 0.5039
 epoch: 19, train_loss: 0.7693, test_loss: 1.1838, test_f1: 0.5023
 epoch: 20, train_loss: 0.7497, test_loss: 1.0491, test_f1: 0.5965
 epoch: 21, train_loss: 0.7528, test_loss: 0.9900, test_f1: 0.5505
 epoch: 22, train_loss: 0.7735, test_loss: 1.0529, test_f1: 0.5398
 epoch: 23, train_loss: 0.8190, test_loss: 1.1015, test_f1: 0.5450
 epoch: 24, train_loss: 0.7814, test_loss: 1.1536, test_f1: 0.5302
 epoch: 25, train_loss: 0.8003, test_loss: 1.0934, test_f1: 0.5881
 epoch: 26, train_loss: 0.7550, test_loss: 1.0069, test_f1: 0.5937
 epoch: 27, train_loss: 0.7680, test_loss: 1.0126, test_f1: 0.5577
 epoch: 28, train_loss: 0.7407, test_loss: 1.4055, test_f1: 0.5028
 epoch: 29, train_loss: 0.7499, test_loss: 1.0392, test_f1: 0.5986
 epoch: 30, train_loss: 0.7382, test_loss: 1.0042, test_f1: 0.5804
 epoch: 31, train_loss: 0.7582, test_loss: 0.9293, test_f1: 0.6262
 epoch: 32, train_loss: 0.7505, test_loss: 1.4122, test_f1: 0.4890
 epoch: 33, train_loss: 0.7657, test_loss: 1.1053, test_f1: 0.5185
 epoch: 34, train_loss: 0.7537, test_loss: 1.4548, test_f1: 0.4797
 epoch: 35, train_loss: 0.7297, test_loss: 1.1811, test_f1: 0.5304
 epoch: 36, train_loss: 0.7244, test_loss: 1.1768, test_f1: 0.5667
 epoch: 37, train_loss: 0.7312, test_loss: 1.0259, test_f1: 0.5956
 epoch: 38, train_loss: 0.7422, test_loss: 1.0198, test_f1: 0.5927
 epoch: 39, train_loss: 0.7337, test_loss: 1.1258, test_f1: 0.5491
 epoch: 40, train_loss: 0.7002, test_loss: 1.1568, test_f1: 0.5544
 epoch: 41, train_loss: 0.7332, test_loss: 1.1547, test_f1: 0.5511
 epoch: 42, train_loss: 0.7252, test_loss: 0.9762, test_f1: 0.6056
 epoch: 43, train_loss: 0.7303, test_loss: 1.1915, test_f1: 0.6001
 epoch: 44, train_loss: 0.7161, test_loss: 1.0818, test_f1: 0.6142
 epoch: 45, train_loss: 0.7046, test_loss: 1.1239, test_f1: 0.5857
 epoch: 46, train_loss: 0.7305, test_loss: 1.0802, test_f1: 0.5608
 epoch: 47, train_loss: 0.7160, test_loss: 1.2656, test_f1: 0.5508
 epoch: 48, train_loss: 0.6980, test_loss: 1.0652, test_f1: 0.5875
 epoch: 49, train_loss: 0.6956, test_loss: 1.3574, test_f1: 0.5373
 epoch: 50, train_loss: 0.7221, test_loss: 0.9991, test_f1: 0.6112
 epoch: 51, train_loss: 0.7104, test_loss: 1.2816, test_f1: 0.5157
 epoch: 52, train_loss: 0.6601, test_loss: 1.1407, test_f1: 0.5912
 epoch: 53, train_loss: 0.6577, test_loss: 1.2956, test_f1: 0.5894
 epoch: 54, train_loss: 0.6800, test_loss: 0.9967, test_f1: 0.5854
 epoch: 55, train_loss: 0.6612, test_loss: 1.0839, test_f1: 0.6159
 epoch: 56, train_loss: 0.6520, test_loss: 1.2729, test_f1: 0.5549
 epoch: 57, train_loss: 0.6467, test_loss: 1.1013, test_f1: 0.5786
 epoch: 58, train_loss: 0.6466, test_loss: 1.1658, test_f1: 0.5913
 epoch: 59, train_loss: 0.6588, test_loss: 1.2227, test_f1: 0.6031
 epoch: 60, train_loss: 0.6349, test_loss: 1.2911, test_f1: 0.5919
 epoch: 61, train_loss: 0.6461, test_loss: 1.2083, test_f1: 0.5905
 epoch: 62, train_loss: 0.6388, test_loss: 1.0683, test_f1: 0.6293
 epoch: 63, train_loss: 0.6352, test_loss: 1.2386, test_f1: 0.6124
 epoch: 64, train_loss: 0.6398, test_loss: 1.2715, test_f1: 0.5941
 epoch: 65, train_loss: 0.6098, test_loss: 1.3064, test_f1: 0.6349
 epoch: 66, train_loss: 0.6188, test_loss: 1.5761, test_f1: 0.5851
 epoch: 67, train_loss: 0.6160, test_loss: 1.5245, test_f1: 0.6221
 epoch: 68, train_loss: 0.6113, test_loss: 1.0676, test_f1: 0.6516
 epoch: 69, train_loss: 0.6447, test_loss: 1.3933, test_f1: 0.5748
 epoch: 70, train_loss: 0.6463, test_loss: 1.1720, test_f1: 0.6266
 epoch: 71, train_loss: 0.6271, test_loss: 1.2308, test_f1: 0.6027
 epoch: 72, train_loss: 0.6097, test_loss: 1.2480, test_f1: 0.5969
 epoch: 73, train_loss: 0.6464, test_loss: 1.3441, test_f1: 0.5978
 epoch: 74, train_loss: 0.6050, test_loss: 1.4200, test_f1: 0.5814
 epoch: 75, train_loss: 0.6170, test_loss: 1.2891, test_f1: 0.5878
 epoch: 76, train_loss: 0.6207, test_loss: 1.3104, test_f1: 0.5830
 epoch: 77, train_loss: 0.6127, test_loss: 1.1050, test_f1: 0.6241
 epoch: 78, train_loss: 0.6055, test_loss: 1.5015, test_f1: 0.5393
 epoch: 79, train_loss: 0.6211, test_loss: 3.6387, test_f1: 0.3520
 epoch: 80, train_loss: 0.5816, test_loss: 1.1699, test_f1: 0.6257
 epoch: 81, train_loss: 0.5858, test_loss: 1.1937, test_f1: 0.6212
 epoch: 82, train_loss: 0.6015, test_loss: 1.6013, test_f1: 0.5854
 epoch: 83, train_loss: 0.5912, test_loss: 1.4528, test_f1: 0.5866
 epoch: 84, train_loss: 0.5935, test_loss: 1.3660, test_f1: 0.6419
 epoch: 85, train_loss: 0.5944, test_loss: 1.4706, test_f1: 0.6386
 epoch: 86, train_loss: 0.5793, test_loss: 1.4246, test_f1: 0.5704
 epoch: 87, train_loss: 0.5975, test_loss: 1.3845, test_f1: 0.6354
 epoch: 88, train_loss: 0.5950, test_loss: 1.4172, test_f1: 0.5653
 epoch: 89, train_loss: 0.5987, test_loss: 1.3183, test_f1: 0.6313
 epoch: 90, train_loss: 0.5697, test_loss: 1.2973, test_f1: 0.6252
 epoch: 91, train_loss: 0.5649, test_loss: 1.2388, test_f1: 0.6238
 epoch: 92, train_loss: 0.5641, test_loss: 1.4179, test_f1: 0.6070
 epoch: 93, train_loss: 0.5697, test_loss: 1.3892, test_f1: 0.5839
 epoch: 94, train_loss: 0.5977, test_loss: 1.3697, test_f1: 0.6263
 epoch: 95, train_loss: 0.5976, test_loss: 1.1631, test_f1: 0.6025
 epoch: 96, train_loss: 0.5643, test_loss: 1.5328, test_f1: 0.6183
 epoch: 97, train_loss: 0.5472, test_loss: 1.2549, test_f1: 0.6129
 epoch: 98, train_loss: 0.5595, test_loss: 1.3443, test_f1: 0.5832
 epoch: 99, train_loss: 0.5698, test_loss: 1.2660, test_f1: 0.6316
##################ITERATION #5 ****************************************
 epoch: 0, train_loss: 1.2036, test_loss: 1.5978, test_f1: 0.2601
 epoch: 1, train_loss: 1.0493, test_loss: 1.3261, test_f1: 0.3372
 epoch: 2, train_loss: 0.9675, test_loss: 1.0514, test_f1: 0.4926
 epoch: 3, train_loss: 0.9289, test_loss: 1.1097, test_f1: 0.4739
 epoch: 4, train_loss: 0.8999, test_loss: 1.0560, test_f1: 0.4742
 epoch: 5, train_loss: 0.8870, test_loss: 0.9941, test_f1: 0.5694
 epoch: 6, train_loss: 0.8503, test_loss: 0.9779, test_f1: 0.5821
 epoch: 7, train_loss: 0.8294, test_loss: 1.0357, test_f1: 0.4774
 epoch: 8, train_loss: 0.8415, test_loss: 1.0538, test_f1: 0.5298
 epoch: 9, train_loss: 0.8128, test_loss: 0.9486, test_f1: 0.5997
 epoch: 10, train_loss: 0.8317, test_loss: 1.0602, test_f1: 0.5304
 epoch: 11, train_loss: 0.8506, test_loss: 1.0273, test_f1: 0.5157
 epoch: 12, train_loss: 0.8027, test_loss: 1.1284, test_f1: 0.5155
 epoch: 13, train_loss: 0.8180, test_loss: 1.0069, test_f1: 0.5593
 epoch: 14, train_loss: 0.8052, test_loss: 0.9806, test_f1: 0.5499
 epoch: 15, train_loss: 0.7892, test_loss: 0.9464, test_f1: 0.6042
 epoch: 16, train_loss: 0.7779, test_loss: 1.0065, test_f1: 0.5414
 epoch: 17, train_loss: 0.7814, test_loss: 1.0778, test_f1: 0.5828
 epoch: 18, train_loss: 0.7766, test_loss: 0.9413, test_f1: 0.5828
 epoch: 19, train_loss: 0.7712, test_loss: 1.0003, test_f1: 0.5685
 epoch: 20, train_loss: 0.7410, test_loss: 1.0792, test_f1: 0.5583
 epoch: 21, train_loss: 0.7860, test_loss: 0.9862, test_f1: 0.5697
 epoch: 22, train_loss: 0.7781, test_loss: 0.9812, test_f1: 0.5452
 epoch: 23, train_loss: 0.7595, test_loss: 1.2968, test_f1: 0.4921
 epoch: 24, train_loss: 0.7706, test_loss: 1.1738, test_f1: 0.4717
 epoch: 25, train_loss: 0.7776, test_loss: 1.0381, test_f1: 0.6323
 epoch: 26, train_loss: 0.7675, test_loss: 1.0270, test_f1: 0.5840
 epoch: 27, train_loss: 0.7246, test_loss: 1.1395, test_f1: 0.4849
 epoch: 28, train_loss: 0.8129, test_loss: 0.9802, test_f1: 0.5845
 epoch: 29, train_loss: 0.7999, test_loss: 0.9807, test_f1: 0.5802
 epoch: 30, train_loss: 0.7713, test_loss: 1.0396, test_f1: 0.5241
 epoch: 31, train_loss: 0.7700, test_loss: 1.0183, test_f1: 0.5173
 epoch: 32, train_loss: 0.7653, test_loss: 1.0423, test_f1: 0.5388
 epoch: 33, train_loss: 0.7610, test_loss: 1.1145, test_f1: 0.5915
 epoch: 34, train_loss: 0.7392, test_loss: 0.9700, test_f1: 0.5858
 epoch: 35, train_loss: 0.7371, test_loss: 0.9815, test_f1: 0.5859
 epoch: 36, train_loss: 0.7438, test_loss: 0.9863, test_f1: 0.5775
 epoch: 37, train_loss: 0.7405, test_loss: 0.9880, test_f1: 0.5621
 epoch: 38, train_loss: 0.7120, test_loss: 1.1210, test_f1: 0.5857
 epoch: 39, train_loss: 0.7194, test_loss: 1.0437, test_f1: 0.6090
 epoch: 40, train_loss: 0.7701, test_loss: 1.1027, test_f1: 0.4938
 epoch: 41, train_loss: 0.7264, test_loss: 1.1064, test_f1: 0.6098
 epoch: 42, train_loss: 0.7311, test_loss: 1.0386, test_f1: 0.6034
 epoch: 43, train_loss: 0.7261, test_loss: 1.0358, test_f1: 0.6151
 epoch: 44, train_loss: 0.7266, test_loss: 1.0221, test_f1: 0.5877
 epoch: 45, train_loss: 0.7122, test_loss: 1.0186, test_f1: 0.5643
 epoch: 46, train_loss: 0.7281, test_loss: 1.0315, test_f1: 0.6143
 epoch: 47, train_loss: 0.7161, test_loss: 1.1266, test_f1: 0.5757
 epoch: 48, train_loss: 0.6973, test_loss: 1.1181, test_f1: 0.5679
 epoch: 49, train_loss: 0.6959, test_loss: 0.9679, test_f1: 0.5695
 epoch: 50, train_loss: 0.7139, test_loss: 1.0349, test_f1: 0.6231
 epoch: 51, train_loss: 0.6822, test_loss: 0.9886, test_f1: 0.6326
 epoch: 52, train_loss: 0.6810, test_loss: 0.9666, test_f1: 0.6290
 epoch: 53, train_loss: 0.6847, test_loss: 1.0399, test_f1: 0.6457
 epoch: 54, train_loss: 0.6661, test_loss: 1.0057, test_f1: 0.6140
 epoch: 55, train_loss: 0.6597, test_loss: 1.1193, test_f1: 0.6323
 epoch: 56, train_loss: 0.6517, test_loss: 0.9742, test_f1: 0.6464
 epoch: 57, train_loss: 0.6514, test_loss: 1.1072, test_f1: 0.5801
 epoch: 58, train_loss: 0.6572, test_loss: 1.0177, test_f1: 0.6387
 epoch: 59, train_loss: 0.6692, test_loss: 1.0066, test_f1: 0.6126
 epoch: 60, train_loss: 0.6428, test_loss: 0.9790, test_f1: 0.6465
 epoch: 61, train_loss: 0.6604, test_loss: 1.1431, test_f1: 0.5916
 epoch: 62, train_loss: 0.6506, test_loss: 1.1672, test_f1: 0.6086
 epoch: 63, train_loss: 0.6466, test_loss: 1.1530, test_f1: 0.5959
 epoch: 64, train_loss: 0.6438, test_loss: 1.0338, test_f1: 0.6146
 epoch: 65, train_loss: 0.6578, test_loss: 1.0829, test_f1: 0.6338
 epoch: 66, train_loss: 0.6275, test_loss: 1.0265, test_f1: 0.6707
 epoch: 67, train_loss: 0.6529, test_loss: 0.9927, test_f1: 0.6328
 epoch: 68, train_loss: 0.6486, test_loss: 1.2405, test_f1: 0.6091
 epoch: 69, train_loss: 0.6243, test_loss: 1.0828, test_f1: 0.6316
 epoch: 70, train_loss: 0.6213, test_loss: 1.0493, test_f1: 0.6700
 epoch: 71, train_loss: 0.6001, test_loss: 1.0634, test_f1: 0.6340
 epoch: 72, train_loss: 0.6204, test_loss: 1.1478, test_f1: 0.6365
 epoch: 73, train_loss: 0.6151, test_loss: 1.1371, test_f1: 0.6332
 epoch: 74, train_loss: 0.6203, test_loss: 0.9698, test_f1: 0.6341
 epoch: 75, train_loss: 0.6265, test_loss: 1.1423, test_f1: 0.6094
 epoch: 76, train_loss: 0.6280, test_loss: 1.0373, test_f1: 0.6641
 epoch: 77, train_loss: 0.6054, test_loss: 1.2250, test_f1: 0.6141
 epoch: 78, train_loss: 0.6360, test_loss: 1.0758, test_f1: 0.6054
 epoch: 79, train_loss: 0.6126, test_loss: 1.1017, test_f1: 0.6709
 epoch: 80, train_loss: 0.6024, test_loss: 1.4045, test_f1: 0.6192
 epoch: 81, train_loss: 0.6005, test_loss: 1.0436, test_f1: 0.6623
 epoch: 82, train_loss: 0.5899, test_loss: 1.1537, test_f1: 0.6811
 epoch: 83, train_loss: 0.6048, test_loss: 1.3091, test_f1: 0.6357
 epoch: 84, train_loss: 0.5815, test_loss: 1.1641, test_f1: 0.6583
 epoch: 85, train_loss: 0.5783, test_loss: 1.2424, test_f1: 0.5786
 epoch: 86, train_loss: 0.5795, test_loss: 1.1272, test_f1: 0.6204
 epoch: 87, train_loss: 0.5803, test_loss: 0.9920, test_f1: 0.6437
 epoch: 88, train_loss: 0.5922, test_loss: 1.1564, test_f1: 0.6503
 epoch: 89, train_loss: 0.5836, test_loss: 1.3278, test_f1: 0.5817
 epoch: 90, train_loss: 0.5695, test_loss: 1.1941, test_f1: 0.6154
 epoch: 91, train_loss: 0.5787, test_loss: 1.1181, test_f1: 0.6189
 epoch: 92, train_loss: 0.5742, test_loss: 1.0249, test_f1: 0.6498
 epoch: 93, train_loss: 0.5564, test_loss: 1.1466, test_f1: 0.6337
 epoch: 94, train_loss: 0.5630, test_loss: 1.2875, test_f1: 0.6165
 epoch: 95, train_loss: 0.5635, test_loss: 1.1859, test_f1: 0.6303
 epoch: 96, train_loss: 0.5498, test_loss: 1.2308, test_f1: 0.5430
 epoch: 97, train_loss: 0.5628, test_loss: 1.1054, test_f1: 0.6661
 epoch: 98, train_loss: 0.5590, test_loss: 1.2895, test_f1: 0.5993
 epoch: 99, train_loss: 0.5415, test_loss: 1.3079, test_f1: 0.6571
##################ITERATION #6 ****************************************
 epoch: 0, train_loss: 1.1665, test_loss: 1.1458, test_f1: 0.4086
 epoch: 1, train_loss: 1.0011, test_loss: 1.0224, test_f1: 0.5328
 epoch: 2, train_loss: 0.9630, test_loss: 1.0007, test_f1: 0.5547
 epoch: 3, train_loss: 0.9269, test_loss: 1.0189, test_f1: 0.5562
 epoch: 4, train_loss: 0.9159, test_loss: 1.0143, test_f1: 0.5067
 epoch: 5, train_loss: 0.8732, test_loss: 1.0293, test_f1: 0.4631
 epoch: 6, train_loss: 0.8427, test_loss: 1.0392, test_f1: 0.5591
 epoch: 7, train_loss: 0.8648, test_loss: 1.0079, test_f1: 0.5937
 epoch: 8, train_loss: 0.8424, test_loss: 1.0481, test_f1: 0.5264
 epoch: 9, train_loss: 0.8611, test_loss: 1.0364, test_f1: 0.5743
 epoch: 10, train_loss: 0.8219, test_loss: 0.9702, test_f1: 0.5518
 epoch: 11, train_loss: 0.8369, test_loss: 1.0524, test_f1: 0.5733
 epoch: 12, train_loss: 0.8419, test_loss: 1.0832, test_f1: 0.5909
 epoch: 13, train_loss: 0.8162, test_loss: 1.0654, test_f1: 0.5423
 epoch: 14, train_loss: 0.8174, test_loss: 1.0944, test_f1: 0.5600
 epoch: 15, train_loss: 0.7939, test_loss: 0.9826, test_f1: 0.5604
 epoch: 16, train_loss: 0.7740, test_loss: 0.9481, test_f1: 0.5727
 epoch: 17, train_loss: 0.8125, test_loss: 0.9523, test_f1: 0.5941
 epoch: 18, train_loss: 0.7789, test_loss: 0.9770, test_f1: 0.5835
 epoch: 19, train_loss: 0.7875, test_loss: 1.1010, test_f1: 0.5862
 epoch: 20, train_loss: 0.7850, test_loss: 0.9613, test_f1: 0.5437
 epoch: 21, train_loss: 0.7873, test_loss: 0.9881, test_f1: 0.5535
 epoch: 22, train_loss: 0.7648, test_loss: 1.0484, test_f1: 0.5817
 epoch: 23, train_loss: 0.7789, test_loss: 1.0472, test_f1: 0.5419
 epoch: 24, train_loss: 0.7722, test_loss: 1.0241, test_f1: 0.6248
 epoch: 25, train_loss: 0.7583, test_loss: 0.9430, test_f1: 0.6265
 epoch: 26, train_loss: 0.7673, test_loss: 0.9691, test_f1: 0.4877
 epoch: 27, train_loss: 0.7537, test_loss: 0.9935, test_f1: 0.6076
 epoch: 28, train_loss: 0.7497, test_loss: 1.0422, test_f1: 0.5953
 epoch: 29, train_loss: 0.7412, test_loss: 0.9958, test_f1: 0.6152
 epoch: 30, train_loss: 0.7327, test_loss: 1.2897, test_f1: 0.5743
 epoch: 31, train_loss: 0.7304, test_loss: 1.2201, test_f1: 0.5819
 epoch: 32, train_loss: 0.7596, test_loss: 0.9852, test_f1: 0.5778
 epoch: 33, train_loss: 0.7445, test_loss: 1.0550, test_f1: 0.6289
 epoch: 34, train_loss: 0.7185, test_loss: 1.0922, test_f1: 0.6016
 epoch: 35, train_loss: 0.7380, test_loss: 1.0246, test_f1: 0.6006
 epoch: 36, train_loss: 0.7932, test_loss: 1.1657, test_f1: 0.4899
 epoch: 37, train_loss: 0.7656, test_loss: 1.0305, test_f1: 0.5618
 epoch: 38, train_loss: 0.7398, test_loss: 1.0353, test_f1: 0.6174
 epoch: 39, train_loss: 0.7789, test_loss: 0.9274, test_f1: 0.6567
 epoch: 40, train_loss: 0.7237, test_loss: 1.0081, test_f1: 0.6397
 epoch: 41, train_loss: 0.7293, test_loss: 0.9741, test_f1: 0.6109
 epoch: 42, train_loss: 0.7144, test_loss: 0.9469, test_f1: 0.6596
 epoch: 43, train_loss: 0.7016, test_loss: 1.0908, test_f1: 0.6361
 epoch: 44, train_loss: 0.7184, test_loss: 0.9674, test_f1: 0.6273
 epoch: 45, train_loss: 0.7046, test_loss: 1.0002, test_f1: 0.6657
 epoch: 46, train_loss: 0.6815, test_loss: 0.9882, test_f1: 0.5980
 epoch: 47, train_loss: 0.7029, test_loss: 1.0220, test_f1: 0.5894
 epoch: 48, train_loss: 0.6863, test_loss: 1.0122, test_f1: 0.6608
 epoch: 49, train_loss: 0.6950, test_loss: 0.9492, test_f1: 0.6413
 epoch: 50, train_loss: 0.6919, test_loss: 1.0738, test_f1: 0.5452
 epoch: 51, train_loss: 0.6537, test_loss: 1.0594, test_f1: 0.5911
 epoch: 52, train_loss: 0.6313, test_loss: 1.0146, test_f1: 0.6357
 epoch: 53, train_loss: 0.6271, test_loss: 0.9739, test_f1: 0.6049
 epoch: 54, train_loss: 0.6320, test_loss: 0.9892, test_f1: 0.6500
 epoch: 55, train_loss: 0.6056, test_loss: 0.9453, test_f1: 0.6582
 epoch: 56, train_loss: 0.6048, test_loss: 1.0565, test_f1: 0.6062
 epoch: 57, train_loss: 0.6217, test_loss: 0.9964, test_f1: 0.6401
 epoch: 58, train_loss: 0.6148, test_loss: 1.0144, test_f1: 0.6474
 epoch: 59, train_loss: 0.5960, test_loss: 1.1149, test_f1: 0.6092
 epoch: 60, train_loss: 0.6073, test_loss: 1.0374, test_f1: 0.6537
 epoch: 61, train_loss: 0.6149, test_loss: 1.0560, test_f1: 0.6075
 epoch: 62, train_loss: 0.5830, test_loss: 0.9992, test_f1: 0.6277
 epoch: 63, train_loss: 0.5857, test_loss: 0.9744, test_f1: 0.6598
 epoch: 64, train_loss: 0.5819, test_loss: 1.0002, test_f1: 0.6524
 epoch: 65, train_loss: 0.5883, test_loss: 0.9797, test_f1: 0.6238
 epoch: 66, train_loss: 0.5989, test_loss: 1.0049, test_f1: 0.6378
 epoch: 67, train_loss: 0.5813, test_loss: 0.9924, test_f1: 0.6420
 epoch: 68, train_loss: 0.5758, test_loss: 1.0760, test_f1: 0.6311
 epoch: 69, train_loss: 0.5992, test_loss: 1.0071, test_f1: 0.6521
 epoch: 70, train_loss: 0.5695, test_loss: 1.0592, test_f1: 0.6532
 epoch: 71, train_loss: 0.5843, test_loss: 1.0577, test_f1: 0.6308
 epoch: 72, train_loss: 0.5589, test_loss: 1.0477, test_f1: 0.6331
 epoch: 73, train_loss: 0.5643, test_loss: 1.0531, test_f1: 0.6453
 epoch: 74, train_loss: 0.5432, test_loss: 1.1448, test_f1: 0.6247
 epoch: 75, train_loss: 0.5380, test_loss: 1.1292, test_f1: 0.6123
 epoch: 76, train_loss: 0.5336, test_loss: 1.0149, test_f1: 0.6549
 epoch: 77, train_loss: 0.5610, test_loss: 1.1317, test_f1: 0.6141
 epoch: 78, train_loss: 0.5584, test_loss: 1.0752, test_f1: 0.6175
 epoch: 79, train_loss: 0.5073, test_loss: 1.1423, test_f1: 0.6404
 epoch: 80, train_loss: 0.5307, test_loss: 1.1519, test_f1: 0.6423
 epoch: 81, train_loss: 0.5293, test_loss: 1.0912, test_f1: 0.6502
 epoch: 82, train_loss: 0.5392, test_loss: 1.1368, test_f1: 0.6329
 epoch: 83, train_loss: 0.5157, test_loss: 1.2316, test_f1: 0.6317
 epoch: 84, train_loss: 0.5102, test_loss: 1.1370, test_f1: 0.6276
 epoch: 85, train_loss: 0.5080, test_loss: 1.1656, test_f1: 0.6208
 epoch: 86, train_loss: 0.4877, test_loss: 1.2532, test_f1: 0.6396
 epoch: 87, train_loss: 0.5011, test_loss: 1.1500, test_f1: 0.6274
 epoch: 88, train_loss: 0.5152, test_loss: 1.1487, test_f1: 0.6489
 epoch: 89, train_loss: 0.5086, test_loss: 1.1741, test_f1: 0.6370
 epoch: 90, train_loss: 0.4941, test_loss: 1.3499, test_f1: 0.5666
 epoch: 91, train_loss: 0.5108, test_loss: 1.1874, test_f1: 0.6438
 epoch: 92, train_loss: 0.4879, test_loss: 1.1477, test_f1: 0.6283
 epoch: 93, train_loss: 0.4793, test_loss: 1.1999, test_f1: 0.6238
 epoch: 94, train_loss: 0.4912, test_loss: 1.2251, test_f1: 0.6384
 epoch: 95, train_loss: 0.4779, test_loss: 1.1245, test_f1: 0.6659
 epoch: 96, train_loss: 0.4872, test_loss: 1.2212, test_f1: 0.6176
 epoch: 97, train_loss: 0.4816, test_loss: 1.3514, test_f1: 0.6291
 epoch: 98, train_loss: 0.4654, test_loss: 1.4558, test_f1: 0.6079
 epoch: 99, train_loss: 0.4694, test_loss: 1.2564, test_f1: 0.6327
##################ITERATION #7 ****************************************
 epoch: 0, train_loss: 1.2146, test_loss: 1.2888, test_f1: 0.1925
 epoch: 1, train_loss: 1.0190, test_loss: 1.0977, test_f1: 0.5142
 epoch: 2, train_loss: 0.9741, test_loss: 1.0170, test_f1: 0.5117
 epoch: 3, train_loss: 0.9276, test_loss: 1.2000, test_f1: 0.4662
 epoch: 4, train_loss: 0.9069, test_loss: 0.9813, test_f1: 0.5221
 epoch: 5, train_loss: 0.8776, test_loss: 0.9985, test_f1: 0.5466
 epoch: 6, train_loss: 0.8650, test_loss: 0.9744, test_f1: 0.5810
 epoch: 7, train_loss: 0.8720, test_loss: 1.0552, test_f1: 0.5088
 epoch: 8, train_loss: 0.8597, test_loss: 1.0122, test_f1: 0.5143
 epoch: 9, train_loss: 0.8487, test_loss: 0.9692, test_f1: 0.5607
 epoch: 10, train_loss: 0.8344, test_loss: 0.9512, test_f1: 0.5667
 epoch: 11, train_loss: 0.8226, test_loss: 1.5573, test_f1: 0.5080
 epoch: 12, train_loss: 0.8396, test_loss: 1.0277, test_f1: 0.5439
 epoch: 13, train_loss: 0.8046, test_loss: 0.9378, test_f1: 0.6159
 epoch: 14, train_loss: 0.8058, test_loss: 1.0183, test_f1: 0.5677
 epoch: 15, train_loss: 0.7727, test_loss: 1.0929, test_f1: 0.5244
 epoch: 16, train_loss: 0.8092, test_loss: 1.0338, test_f1: 0.5476
 epoch: 17, train_loss: 0.7949, test_loss: 1.5311, test_f1: 0.5477
 epoch: 18, train_loss: 0.7879, test_loss: 0.9673, test_f1: 0.5615
 epoch: 19, train_loss: 0.7880, test_loss: 1.0481, test_f1: 0.5417
 epoch: 20, train_loss: 0.7772, test_loss: 0.9808, test_f1: 0.5323
 epoch: 21, train_loss: 0.7656, test_loss: 1.1193, test_f1: 0.5613
 epoch: 22, train_loss: 0.7665, test_loss: 0.9991, test_f1: 0.5186
 epoch: 23, train_loss: 0.7769, test_loss: 0.9801, test_f1: 0.6050
 epoch: 24, train_loss: 0.7600, test_loss: 1.0026, test_f1: 0.5600
 epoch: 25, train_loss: 0.7464, test_loss: 1.3454, test_f1: 0.5330
 epoch: 26, train_loss: 0.7547, test_loss: 1.0007, test_f1: 0.5702
 epoch: 27, train_loss: 0.7268, test_loss: 1.0085, test_f1: 0.5745
 epoch: 28, train_loss: 0.7356, test_loss: 1.3436, test_f1: 0.5689
 epoch: 29, train_loss: 0.7770, test_loss: 0.9824, test_f1: 0.5974
 epoch: 30, train_loss: 0.7638, test_loss: 0.9448, test_f1: 0.6028
 epoch: 31, train_loss: 0.7185, test_loss: 1.0541, test_f1: 0.5572
 epoch: 32, train_loss: 0.7248, test_loss: 0.9719, test_f1: 0.6021
 epoch: 33, train_loss: 0.7231, test_loss: 1.1672, test_f1: 0.5409
 epoch: 34, train_loss: 0.7341, test_loss: 1.0688, test_f1: 0.5755
 epoch: 35, train_loss: 0.7494, test_loss: 1.4862, test_f1: 0.5412
 epoch: 36, train_loss: 0.7433, test_loss: 1.1800, test_f1: 0.5487
 epoch: 37, train_loss: 0.7384, test_loss: 1.0714, test_f1: 0.5881
 epoch: 38, train_loss: 0.7359, test_loss: 1.0912, test_f1: 0.6043
 epoch: 39, train_loss: 0.7095, test_loss: 1.0496, test_f1: 0.5926
 epoch: 40, train_loss: 0.7120, test_loss: 1.0401, test_f1: 0.6060
 epoch: 41, train_loss: 0.7605, test_loss: 1.0607, test_f1: 0.5757
 epoch: 42, train_loss: 0.7731, test_loss: 0.9822, test_f1: 0.6096
 epoch: 43, train_loss: 0.7030, test_loss: 1.0090, test_f1: 0.6046
 epoch: 44, train_loss: 0.7132, test_loss: 1.1211, test_f1: 0.6008
 epoch: 45, train_loss: 0.6962, test_loss: 1.2123, test_f1: 0.5650
 epoch: 46, train_loss: 0.7014, test_loss: 1.0024, test_f1: 0.5997
 epoch: 47, train_loss: 0.6941, test_loss: 1.1026, test_f1: 0.5990
 epoch: 48, train_loss: 0.7118, test_loss: 1.1977, test_f1: 0.6122
 epoch: 49, train_loss: 0.7210, test_loss: 1.2337, test_f1: 0.5439
 epoch: 50, train_loss: 0.6940, test_loss: 1.0570, test_f1: 0.6109
 epoch: 51, train_loss: 0.6673, test_loss: 1.1090, test_f1: 0.5651
 epoch: 52, train_loss: 0.6693, test_loss: 1.2192, test_f1: 0.5903
 epoch: 53, train_loss: 0.6542, test_loss: 1.2213, test_f1: 0.5799
 epoch: 54, train_loss: 0.6509, test_loss: 1.1730, test_f1: 0.6014
 epoch: 55, train_loss: 0.6560, test_loss: 1.1280, test_f1: 0.5761
 epoch: 56, train_loss: 0.6580, test_loss: 1.2278, test_f1: 0.5963
 epoch: 57, train_loss: 0.6501, test_loss: 1.2737, test_f1: 0.6085
 epoch: 58, train_loss: 0.6372, test_loss: 1.3400, test_f1: 0.5916
 epoch: 59, train_loss: 0.6460, test_loss: 1.1479, test_f1: 0.6056
 epoch: 60, train_loss: 0.6576, test_loss: 1.0421, test_f1: 0.6125
 epoch: 61, train_loss: 0.6381, test_loss: 1.2898, test_f1: 0.5445
 epoch: 62, train_loss: 0.6339, test_loss: 1.0822, test_f1: 0.6184
 epoch: 63, train_loss: 0.6228, test_loss: 1.2373, test_f1: 0.5889
 epoch: 64, train_loss: 0.6235, test_loss: 1.1807, test_f1: 0.6342
 epoch: 65, train_loss: 0.6283, test_loss: 1.1273, test_f1: 0.6456
 epoch: 66, train_loss: 0.6291, test_loss: 1.4109, test_f1: 0.5544
 epoch: 67, train_loss: 0.6465, test_loss: 1.3512, test_f1: 0.6050
 epoch: 68, train_loss: 0.6516, test_loss: 1.2799, test_f1: 0.5716
 epoch: 69, train_loss: 0.6372, test_loss: 1.1474, test_f1: 0.5843
 epoch: 70, train_loss: 0.6189, test_loss: 1.1842, test_f1: 0.5666
 epoch: 71, train_loss: 0.6335, test_loss: 1.2095, test_f1: 0.6201
 epoch: 72, train_loss: 0.6239, test_loss: 1.2097, test_f1: 0.6223
 epoch: 73, train_loss: 0.6311, test_loss: 1.2961, test_f1: 0.5758
 epoch: 74, train_loss: 0.6059, test_loss: 1.2076, test_f1: 0.5980
 epoch: 75, train_loss: 0.6262, test_loss: 1.4029, test_f1: 0.6043
 epoch: 76, train_loss: 0.5971, test_loss: 1.2888, test_f1: 0.6231
 epoch: 77, train_loss: 0.6097, test_loss: 1.3118, test_f1: 0.6070
 epoch: 78, train_loss: 0.6116, test_loss: 1.3896, test_f1: 0.5755
 epoch: 79, train_loss: 0.6100, test_loss: 1.3590, test_f1: 0.6053
 epoch: 80, train_loss: 0.6012, test_loss: 1.5524, test_f1: 0.6253
 epoch: 81, train_loss: 0.6036, test_loss: 1.3369, test_f1: 0.5957
 epoch: 82, train_loss: 0.6060, test_loss: 1.5086, test_f1: 0.6079
 epoch: 83, train_loss: 0.6049, test_loss: 1.5199, test_f1: 0.5691
 epoch: 84, train_loss: 0.6074, test_loss: 1.3006, test_f1: 0.5947
 epoch: 85, train_loss: 0.5983, test_loss: 1.4139, test_f1: 0.6153
 epoch: 86, train_loss: 0.6125, test_loss: 1.2871, test_f1: 0.6002
 epoch: 87, train_loss: 0.6065, test_loss: 1.3758, test_f1: 0.6004
 epoch: 88, train_loss: 0.5852, test_loss: 1.2299, test_f1: 0.5815
 epoch: 89, train_loss: 0.5770, test_loss: 1.2594, test_f1: 0.6179
 epoch: 90, train_loss: 0.5809, test_loss: 1.1568, test_f1: 0.5999
 epoch: 91, train_loss: 0.5916, test_loss: 1.4488, test_f1: 0.6474
 epoch: 92, train_loss: 0.5768, test_loss: 1.2658, test_f1: 0.6132
 epoch: 93, train_loss: 0.5877, test_loss: 1.6073, test_f1: 0.6042
 epoch: 94, train_loss: 0.5827, test_loss: 1.1069, test_f1: 0.6518
 epoch: 95, train_loss: 0.5835, test_loss: 1.3608, test_f1: 0.5812
 epoch: 96, train_loss: 0.5830, test_loss: 1.2990, test_f1: 0.6298
 epoch: 97, train_loss: 0.5797, test_loss: 1.5945, test_f1: 0.5990
 epoch: 98, train_loss: 0.5561, test_loss: 1.2233, test_f1: 0.6456
 epoch: 99, train_loss: 0.5671, test_loss: 1.4038, test_f1: 0.5892
##################ITERATION #8 ****************************************
 epoch: 0, train_loss: 1.1622, test_loss: 1.2621, test_f1: 0.3953
 epoch: 1, train_loss: 0.9922, test_loss: 1.0781, test_f1: 0.4791
 epoch: 2, train_loss: 0.9368, test_loss: 1.4715, test_f1: 0.4490
 epoch: 3, train_loss: 0.9118, test_loss: 1.0126, test_f1: 0.4830
 epoch: 4, train_loss: 0.8899, test_loss: 0.9903, test_f1: 0.5080
 epoch: 5, train_loss: 0.8776, test_loss: 0.9757, test_f1: 0.5024
 epoch: 6, train_loss: 0.8540, test_loss: 1.0093, test_f1: 0.5271
 epoch: 7, train_loss: 0.8393, test_loss: 1.1316, test_f1: 0.5010
 epoch: 8, train_loss: 0.8406, test_loss: 0.9486, test_f1: 0.5793
 epoch: 9, train_loss: 0.8322, test_loss: 1.9344, test_f1: 0.3874
 epoch: 10, train_loss: 0.8135, test_loss: 0.9905, test_f1: 0.5283
 epoch: 11, train_loss: 0.8186, test_loss: 1.0888, test_f1: 0.5415
 epoch: 12, train_loss: 0.8049, test_loss: 1.2145, test_f1: 0.5069
 epoch: 13, train_loss: 0.8246, test_loss: 1.0176, test_f1: 0.5259
 epoch: 14, train_loss: 0.7978, test_loss: 1.9061, test_f1: 0.4948
 epoch: 15, train_loss: 0.8065, test_loss: 1.0224, test_f1: 0.5584
 epoch: 16, train_loss: 0.7970, test_loss: 1.0315, test_f1: 0.5235
 epoch: 17, train_loss: 0.7737, test_loss: 1.1416, test_f1: 0.5571
 epoch: 18, train_loss: 0.7710, test_loss: 0.9705, test_f1: 0.6130
 epoch: 19, train_loss: 0.7887, test_loss: 1.0198, test_f1: 0.5721
 epoch: 20, train_loss: 0.7719, test_loss: 1.1618, test_f1: 0.5648
 epoch: 21, train_loss: 0.7821, test_loss: 1.1335, test_f1: 0.5644
 epoch: 22, train_loss: 0.7663, test_loss: 1.1486, test_f1: 0.5086
 epoch: 23, train_loss: 0.7686, test_loss: 1.0083, test_f1: 0.5419
 epoch: 24, train_loss: 0.7677, test_loss: 1.0932, test_f1: 0.5580
 epoch: 25, train_loss: 0.7436, test_loss: 1.1162, test_f1: 0.5695
 epoch: 26, train_loss: 0.7499, test_loss: 1.0073, test_f1: 0.5480
 epoch: 27, train_loss: 0.7722, test_loss: 1.0043, test_f1: 0.6177
 epoch: 28, train_loss: 0.7341, test_loss: 1.2419, test_f1: 0.5363
 epoch: 29, train_loss: 0.7128, test_loss: 1.2349, test_f1: 0.5526
 epoch: 30, train_loss: 0.7349, test_loss: 1.0206, test_f1: 0.6000
 epoch: 31, train_loss: 0.7417, test_loss: 1.0084, test_f1: 0.4939
 epoch: 32, train_loss: 0.7282, test_loss: 1.0231, test_f1: 0.5613
 epoch: 33, train_loss: 0.7096, test_loss: 0.9736, test_f1: 0.6319
 epoch: 34, train_loss: 0.7031, test_loss: 1.4085, test_f1: 0.5674
 epoch: 35, train_loss: 0.7222, test_loss: 1.0691, test_f1: 0.5512
 epoch: 36, train_loss: 0.6864, test_loss: 1.2008, test_f1: 0.5680
 epoch: 37, train_loss: 0.7111, test_loss: 1.2403, test_f1: 0.6085
 epoch: 38, train_loss: 0.7286, test_loss: 1.6191, test_f1: 0.5668
 epoch: 39, train_loss: 0.6974, test_loss: 1.0794, test_f1: 0.5467
 epoch: 40, train_loss: 0.6968, test_loss: 1.4321, test_f1: 0.6159
 epoch: 41, train_loss: 0.7320, test_loss: 1.2042, test_f1: 0.6120
 epoch: 42, train_loss: 0.7138, test_loss: 1.1089, test_f1: 0.6336
 epoch: 43, train_loss: 0.6956, test_loss: 1.0707, test_f1: 0.6314
 epoch: 44, train_loss: 0.7022, test_loss: 1.0215, test_f1: 0.5757
 epoch: 45, train_loss: 0.6856, test_loss: 1.0079, test_f1: 0.6425
 epoch: 46, train_loss: 0.6876, test_loss: 1.1410, test_f1: 0.5905
 epoch: 47, train_loss: 0.6595, test_loss: 1.1302, test_f1: 0.5859
 epoch: 48, train_loss: 0.6583, test_loss: 1.2246, test_f1: 0.5970
 epoch: 49, train_loss: 0.7094, test_loss: 0.9570, test_f1: 0.6165
 epoch: 50, train_loss: 0.6568, test_loss: 1.0502, test_f1: 0.5390
 epoch: 51, train_loss: 0.6442, test_loss: 1.0055, test_f1: 0.6425
 epoch: 52, train_loss: 0.6326, test_loss: 0.9668, test_f1: 0.6456
 epoch: 53, train_loss: 0.6108, test_loss: 1.0308, test_f1: 0.6230
 epoch: 54, train_loss: 0.6117, test_loss: 1.1702, test_f1: 0.6575
 epoch: 55, train_loss: 0.6293, test_loss: 0.9930, test_f1: 0.6331
 epoch: 56, train_loss: 0.5956, test_loss: 1.1250, test_f1: 0.6133
 epoch: 57, train_loss: 0.5835, test_loss: 1.1392, test_f1: 0.6366
 epoch: 58, train_loss: 0.5987, test_loss: 1.2358, test_f1: 0.6580
 epoch: 59, train_loss: 0.5891, test_loss: 1.4083, test_f1: 0.6072
 epoch: 60, train_loss: 0.5821, test_loss: 1.4194, test_f1: 0.6273
 epoch: 61, train_loss: 0.5885, test_loss: 1.1144, test_f1: 0.6276
 epoch: 62, train_loss: 0.5770, test_loss: 1.2958, test_f1: 0.6111
 epoch: 63, train_loss: 0.5948, test_loss: 0.9983, test_f1: 0.6556
 epoch: 64, train_loss: 0.5903, test_loss: 1.2926, test_f1: 0.6470
 epoch: 65, train_loss: 0.5723, test_loss: 1.2073, test_f1: 0.6282
 epoch: 66, train_loss: 0.5921, test_loss: 1.2046, test_f1: 0.6386
 epoch: 67, train_loss: 0.5540, test_loss: 1.3403, test_f1: 0.6184
 epoch: 68, train_loss: 0.5707, test_loss: 1.0947, test_f1: 0.6290
 epoch: 69, train_loss: 0.5668, test_loss: 1.2285, test_f1: 0.5946
 epoch: 70, train_loss: 0.5578, test_loss: 1.1700, test_f1: 0.6714
 epoch: 71, train_loss: 0.5309, test_loss: 1.0806, test_f1: 0.6426
 epoch: 72, train_loss: 0.5464, test_loss: 1.1425, test_f1: 0.6250
 epoch: 73, train_loss: 0.5837, test_loss: 1.2093, test_f1: 0.5943
 epoch: 74, train_loss: 0.5706, test_loss: 1.1544, test_f1: 0.6254
 epoch: 75, train_loss: 0.5539, test_loss: 1.1427, test_f1: 0.6404
 epoch: 76, train_loss: 0.5499, test_loss: 1.2671, test_f1: 0.6653
 epoch: 77, train_loss: 0.5491, test_loss: 1.2215, test_f1: 0.6528
 epoch: 78, train_loss: 0.5474, test_loss: 1.1866, test_f1: 0.6272
 epoch: 79, train_loss: 0.5242, test_loss: 1.2162, test_f1: 0.6372
 epoch: 80, train_loss: 0.5220, test_loss: 1.3934, test_f1: 0.6382
 epoch: 81, train_loss: 0.5473, test_loss: 1.0615, test_f1: 0.6527
 epoch: 82, train_loss: 0.5492, test_loss: 1.1565, test_f1: 0.6211
 epoch: 83, train_loss: 0.5268, test_loss: 1.2339, test_f1: 0.5795
 epoch: 84, train_loss: 0.5305, test_loss: 1.1042, test_f1: 0.6418
 epoch: 85, train_loss: 0.5225, test_loss: 1.2327, test_f1: 0.6496
 epoch: 86, train_loss: 0.5203, test_loss: 1.1491, test_f1: 0.6420
 epoch: 87, train_loss: 0.5471, test_loss: 1.1677, test_f1: 0.6439
 epoch: 88, train_loss: 0.5127, test_loss: 1.4334, test_f1: 0.6091
 epoch: 89, train_loss: 0.5235, test_loss: 1.0685, test_f1: 0.6566
 epoch: 90, train_loss: 0.5361, test_loss: 1.2364, test_f1: 0.6216
 epoch: 91, train_loss: 0.4946, test_loss: 1.1756, test_f1: 0.6489
 epoch: 92, train_loss: 0.5116, test_loss: 1.1007, test_f1: 0.6456
 epoch: 93, train_loss: 0.4960, test_loss: 1.2499, test_f1: 0.6537
 epoch: 94, train_loss: 0.5311, test_loss: 1.5079, test_f1: 0.6238
 epoch: 95, train_loss: 0.4950, test_loss: 1.2145, test_f1: 0.6574
 epoch: 96, train_loss: 0.4634, test_loss: 1.4166, test_f1: 0.6413
 epoch: 97, train_loss: 0.4723, test_loss: 1.5089, test_f1: 0.6614
 epoch: 98, train_loss: 0.4847, test_loss: 1.7789, test_f1: 0.6288
 epoch: 99, train_loss: 0.6673, test_loss: 1.1081, test_f1: 0.5925
##################ITERATION #9 ****************************************
 epoch: 0, train_loss: 1.2432, test_loss: 1.1296, test_f1: 0.3748
 epoch: 1, train_loss: 1.0374, test_loss: 1.0850, test_f1: 0.4928
 epoch: 2, train_loss: 0.9829, test_loss: 1.0463, test_f1: 0.5257
 epoch: 3, train_loss: 0.9708, test_loss: 1.1090, test_f1: 0.5077
 epoch: 4, train_loss: 0.9887, test_loss: 1.0708, test_f1: 0.5379
 epoch: 5, train_loss: 0.9469, test_loss: 1.0376, test_f1: 0.4729
 epoch: 6, train_loss: 0.9027, test_loss: 0.9652, test_f1: 0.5446
 epoch: 7, train_loss: 0.9308, test_loss: 1.0482, test_f1: 0.4921
 epoch: 8, train_loss: 0.8654, test_loss: 1.0237, test_f1: 0.5653
 epoch: 9, train_loss: 0.8549, test_loss: 1.0657, test_f1: 0.4675
 epoch: 10, train_loss: 0.8559, test_loss: 1.0156, test_f1: 0.4908
 epoch: 11, train_loss: 0.8224, test_loss: 0.9779, test_f1: 0.6028
 epoch: 12, train_loss: 0.7881, test_loss: 1.0159, test_f1: 0.5416
 epoch: 13, train_loss: 0.8312, test_loss: 1.0525, test_f1: 0.5604
 epoch: 14, train_loss: 0.8103, test_loss: 1.1428, test_f1: 0.5356
 epoch: 15, train_loss: 0.8089, test_loss: 0.9393, test_f1: 0.6056
 epoch: 16, train_loss: 0.7802, test_loss: 0.8842, test_f1: 0.6576
 epoch: 17, train_loss: 0.8024, test_loss: 1.1954, test_f1: 0.5892
 epoch: 18, train_loss: 0.7935, test_loss: 0.9826, test_f1: 0.5645
 epoch: 19, train_loss: 0.8197, test_loss: 1.1860, test_f1: 0.4280
 epoch: 20, train_loss: 0.7906, test_loss: 0.9389, test_f1: 0.6052
 epoch: 21, train_loss: 0.8033, test_loss: 0.9772, test_f1: 0.5867
 epoch: 22, train_loss: 0.7740, test_loss: 1.0915, test_f1: 0.5528
 epoch: 23, train_loss: 0.8175, test_loss: 0.9943, test_f1: 0.5914
 epoch: 24, train_loss: 0.7739, test_loss: 1.1973, test_f1: 0.4809
 epoch: 25, train_loss: 0.7912, test_loss: 0.9814, test_f1: 0.6007
 epoch: 26, train_loss: 0.7361, test_loss: 1.2120, test_f1: 0.5400
 epoch: 27, train_loss: 0.7559, test_loss: 1.1079, test_f1: 0.5722
 epoch: 28, train_loss: 0.7319, test_loss: 0.9164, test_f1: 0.6127
 epoch: 29, train_loss: 0.7550, test_loss: 0.9723, test_f1: 0.6175
 epoch: 30, train_loss: 0.7457, test_loss: 1.0505, test_f1: 0.6077
 epoch: 31, train_loss: 0.7223, test_loss: 1.0198, test_f1: 0.6116
 epoch: 32, train_loss: 0.7702, test_loss: 1.0248, test_f1: 0.5712
 epoch: 33, train_loss: 0.7596, test_loss: 1.2460, test_f1: 0.5281
 epoch: 34, train_loss: 0.7452, test_loss: 0.9129, test_f1: 0.6172
 epoch: 35, train_loss: 0.7464, test_loss: 1.0104, test_f1: 0.6237
 epoch: 36, train_loss: 0.7165, test_loss: 0.9396, test_f1: 0.5812
 epoch: 37, train_loss: 0.7129, test_loss: 1.0768, test_f1: 0.5732
 epoch: 38, train_loss: 0.7082, test_loss: 1.0271, test_f1: 0.5757
 epoch: 39, train_loss: 0.7165, test_loss: 1.0340, test_f1: 0.6338
 epoch: 40, train_loss: 0.7194, test_loss: 1.4878, test_f1: 0.4922
 epoch: 41, train_loss: 0.7171, test_loss: 1.1627, test_f1: 0.5873
 epoch: 42, train_loss: 0.6987, test_loss: 0.9572, test_f1: 0.6384
 epoch: 43, train_loss: 0.6874, test_loss: 1.0365, test_f1: 0.5549
 epoch: 44, train_loss: 0.7014, test_loss: 1.0053, test_f1: 0.5880
 epoch: 45, train_loss: 0.7014, test_loss: 1.1461, test_f1: 0.5177
 epoch: 46, train_loss: 0.7007, test_loss: 1.1836, test_f1: 0.5986
 epoch: 47, train_loss: 0.6872, test_loss: 1.1453, test_f1: 0.5680
 epoch: 48, train_loss: 0.6897, test_loss: 1.1695, test_f1: 0.5535
 epoch: 49, train_loss: 0.6606, test_loss: 1.4799, test_f1: 0.4976
 epoch: 50, train_loss: 0.7174, test_loss: 1.0152, test_f1: 0.6079
 epoch: 51, train_loss: 0.6568, test_loss: 1.0455, test_f1: 0.6084
 epoch: 52, train_loss: 0.6357, test_loss: 1.0483, test_f1: 0.6174
 epoch: 53, train_loss: 0.6320, test_loss: 1.1545, test_f1: 0.5942
 epoch: 54, train_loss: 0.6213, test_loss: 1.2072, test_f1: 0.5679
 epoch: 55, train_loss: 0.6019, test_loss: 1.1541, test_f1: 0.5838
 epoch: 56, train_loss: 0.6157, test_loss: 1.2337, test_f1: 0.5562
 epoch: 57, train_loss: 0.6316, test_loss: 1.2813, test_f1: 0.5615
 epoch: 58, train_loss: 0.6215, test_loss: 1.0632, test_f1: 0.6181
 epoch: 59, train_loss: 0.6380, test_loss: 1.0293, test_f1: 0.6157
 epoch: 60, train_loss: 0.6061, test_loss: 1.0384, test_f1: 0.6226
 epoch: 61, train_loss: 0.6043, test_loss: 1.1004, test_f1: 0.5796
 epoch: 62, train_loss: 0.6076, test_loss: 0.9863, test_f1: 0.6360
 epoch: 63, train_loss: 0.5866, test_loss: 1.1545, test_f1: 0.6081
 epoch: 64, train_loss: 0.6023, test_loss: 1.6905, test_f1: 0.5469
 epoch: 65, train_loss: 0.6097, test_loss: 1.0272, test_f1: 0.6388
 epoch: 66, train_loss: 0.6012, test_loss: 1.0929, test_f1: 0.6028
 epoch: 67, train_loss: 0.5710, test_loss: 1.0274, test_f1: 0.5791
 epoch: 68, train_loss: 0.5937, test_loss: 1.1029, test_f1: 0.6328
 epoch: 69, train_loss: 0.6035, test_loss: 1.0974, test_f1: 0.6466
 epoch: 70, train_loss: 0.5999, test_loss: 1.1746, test_f1: 0.5847
 epoch: 71, train_loss: 0.5795, test_loss: 1.1631, test_f1: 0.5686
 epoch: 72, train_loss: 0.6008, test_loss: 1.3367, test_f1: 0.5263
 epoch: 73, train_loss: 0.5904, test_loss: 1.1636, test_f1: 0.5854
 epoch: 74, train_loss: 0.5435, test_loss: 1.1959, test_f1: 0.6115
 epoch: 75, train_loss: 0.5531, test_loss: 1.1327, test_f1: 0.6134
 epoch: 76, train_loss: 0.5642, test_loss: 1.2032, test_f1: 0.5791
 epoch: 77, train_loss: 0.5500, test_loss: 1.3660, test_f1: 0.5144
 epoch: 78, train_loss: 0.6144, test_loss: 1.2300, test_f1: 0.5731
 epoch: 79, train_loss: 0.5795, test_loss: 1.2448, test_f1: 0.6024
 epoch: 80, train_loss: 0.5882, test_loss: 1.2238, test_f1: 0.5827
 epoch: 81, train_loss: 0.5825, test_loss: 1.2911, test_f1: 0.5566
 epoch: 82, train_loss: 0.5597, test_loss: 1.1392, test_f1: 0.6199
 epoch: 83, train_loss: 0.5419, test_loss: 1.1747, test_f1: 0.5697
 epoch: 84, train_loss: 0.5844, test_loss: 1.2758, test_f1: 0.5916
 epoch: 85, train_loss: 0.5549, test_loss: 1.1129, test_f1: 0.6388
 epoch: 86, train_loss: 0.5738, test_loss: 1.1929, test_f1: 0.6182
 epoch: 87, train_loss: 0.5451, test_loss: 1.2170, test_f1: 0.6023
 epoch: 88, train_loss: 0.5510, test_loss: 1.1096, test_f1: 0.6010
 epoch: 89, train_loss: 0.5499, test_loss: 1.2367, test_f1: 0.6125
 epoch: 90, train_loss: 0.5262, test_loss: 1.2325, test_f1: 0.5247
 epoch: 91, train_loss: 0.5664, test_loss: 1.1596, test_f1: 0.5641
 epoch: 92, train_loss: 0.5261, test_loss: 1.3801, test_f1: 0.5782
 epoch: 93, train_loss: 0.5387, test_loss: 1.3895, test_f1: 0.5641
 epoch: 94, train_loss: 0.5384, test_loss: 1.3697, test_f1: 0.5838
 epoch: 95, train_loss: 0.5359, test_loss: 1.1836, test_f1: 0.6160
 epoch: 96, train_loss: 0.5460, test_loss: 1.2160, test_f1: 0.6285
 epoch: 97, train_loss: 0.5600, test_loss: 1.2937, test_f1: 0.5899
 epoch: 98, train_loss: 0.5583, test_loss: 1.2178, test_f1: 0.6209
 epoch: 99, train_loss: 0.5244, test_loss: 1.3229, test_f1: 0.6510

Training completed in 786.23 seconds
Best F1: 0.6958 at epoch 82
Mean F1 across iterations: 0.6624  0.0155
========================FINAL RESULTS================================
FEGIN weighted F1: 0.6958  0.0155
python main.py --data ltspice_demos --representation component_pin --model FEGIN --layers 6 --hiddens 32 --batch_size 32 --lr 0.01 --emb_size 512 --epochs 100 --save_appendix component_pin_L6_H32_BS32_LR0.01_E512 --no_val
-----



STDERR:
  File "main.py", line 370, in <module>
    main()
  File "main.py", line 254, in main
    dataset = dataset_class(
  File "/home/philip/projects/ltspice_examples_code_repo/Circuit-Completion-Using-GNNs/component_classification_with_link_prediction_head/evaluation/FEGIN/kernel/circuit_datasets.py", line 15, in __init__
    self.data, self.slices = torch.load(self.processed_paths[0])
  File "/home/philip/.local/lib/python3.8/site-packages/torch/serialization.py", line 1040, in load
    warnings.warn(
  File "/usr/lib/python3.8/warnings.py", line 109, in _showwarnmsg
    sw(msg.message, msg.category, msg.filename, msg.lineno,
  File "main.py", line 47, in warn_with_traceback
    traceback.print_stack(file=log)
/home/philip/projects/ltspice_examples_code_repo/Circuit-Completion-Using-GNNs/component_classification_with_link_prediction_head/evaluation/FEGIN/kernel/circuit_datasets.py:15: FutureWarning: You are using `torch.load` with `weights_only=False` (the current default value), which uses the default pickle module implicitly. It is possible to construct malicious pickle data which will execute arbitrary code during unpickling (See https://github.com/pytorch/pytorch/blob/main/SECURITY.md#untrusted-models for more details). In a future release, the default value for `weights_only` will be flipped to `True`. This limits the functions that could be executed during unpickling. Arbitrary objects will no longer be allowed to be loaded via this mode unless they are explicitly allowlisted by the user via `torch.serialization.add_safe_globals`. We recommend you start setting `weights_only=True` for any use case where you don't have full control of the loaded file. Please open an issue on GitHub for any issues related to this experimental feature.
  self.data, self.slices = torch.load(self.processed_paths[0])
