STDOUT:
Results will be saved in /home/philip/projects/ltspice_examples_code_repo/Circuit-Completion-Using-GNNs/component_classification_with_link_prediction_head/evaluation/FEGIN/results/model_FEGIN_dataset_ltspice_examples
Command line input: python main.py --data ltspice_examples --representation component_component --model FEGIN --layers 5 --hiddens 32 --batch_size 64 --lr 0.01 --emb_size 250 --epochs 100 --save_appendix component_component_L5_H32_BS64_LR0.01_E250 --no_val
 is saved.
-----
ltspice_examples - FEGIN
Using 5 layers, 32 hidden units, h = 2
Loading component_component representation dataset
ENTERED
Training FEGIN on component_component representation
Train: 3556, Test: 845
##################ITERATION #0 ****************************************
 epoch: 0, train_loss: 1.2639, test_loss: 1.1874, test_f1: 0.3533
 epoch: 1, train_loss: 1.1873, test_loss: 1.1111, test_f1: 0.4032
 epoch: 2, train_loss: 1.1218, test_loss: 1.0434, test_f1: 0.4155
 epoch: 3, train_loss: 1.0705, test_loss: 0.9859, test_f1: 0.4492
 epoch: 4, train_loss: 1.0473, test_loss: 1.0706, test_f1: 0.4245
 epoch: 5, train_loss: 1.0174, test_loss: 0.9301, test_f1: 0.4861
 epoch: 6, train_loss: 0.9912, test_loss: 0.9698, test_f1: 0.5298
 epoch: 7, train_loss: 0.9956, test_loss: 1.0321, test_f1: 0.4754
 epoch: 8, train_loss: 0.9677, test_loss: 1.0581, test_f1: 0.5199
 epoch: 9, train_loss: 0.9530, test_loss: 1.0133, test_f1: 0.5544
 epoch: 10, train_loss: 0.9545, test_loss: 1.0148, test_f1: 0.4946
 epoch: 11, train_loss: 0.9485, test_loss: 0.9870, test_f1: 0.4833
 epoch: 12, train_loss: 0.9295, test_loss: 0.9477, test_f1: 0.5600
 epoch: 13, train_loss: 0.9194, test_loss: 1.1744, test_f1: 0.4601
 epoch: 14, train_loss: 0.9172, test_loss: 1.1005, test_f1: 0.4595
 epoch: 15, train_loss: 0.9054, test_loss: 0.9985, test_f1: 0.5371
 epoch: 16, train_loss: 0.9054, test_loss: 0.9542, test_f1: 0.5356
 epoch: 17, train_loss: 0.9016, test_loss: 0.9373, test_f1: 0.5015
 epoch: 18, train_loss: 0.9220, test_loss: 1.1193, test_f1: 0.4632
 epoch: 19, train_loss: 0.8731, test_loss: 1.0541, test_f1: 0.5183
 epoch: 20, train_loss: 0.8948, test_loss: 1.0657, test_f1: 0.4931
 epoch: 21, train_loss: 0.8802, test_loss: 0.9878, test_f1: 0.4910
 epoch: 22, train_loss: 0.8468, test_loss: 1.0031, test_f1: 0.5137
 epoch: 23, train_loss: 0.8741, test_loss: 1.0620, test_f1: 0.4888
 epoch: 24, train_loss: 0.8949, test_loss: 1.0239, test_f1: 0.5191
 epoch: 25, train_loss: 0.8686, test_loss: 0.9586, test_f1: 0.5157
 epoch: 26, train_loss: 0.8455, test_loss: 1.0043, test_f1: 0.5503
 epoch: 27, train_loss: 0.8676, test_loss: 1.0877, test_f1: 0.5170
 epoch: 28, train_loss: 0.8566, test_loss: 1.0406, test_f1: 0.4885
 epoch: 29, train_loss: 0.8365, test_loss: 1.0271, test_f1: 0.5475
 epoch: 30, train_loss: 0.8305, test_loss: 0.9690, test_f1: 0.5123
 epoch: 31, train_loss: 0.8270, test_loss: 1.0188, test_f1: 0.5005
 epoch: 32, train_loss: 0.8321, test_loss: 1.0503, test_f1: 0.5078
 epoch: 33, train_loss: 0.8316, test_loss: 1.1208, test_f1: 0.5013
 epoch: 34, train_loss: 0.8619, test_loss: 0.9472, test_f1: 0.5063
 epoch: 35, train_loss: 0.8391, test_loss: 1.1813, test_f1: 0.4838
 epoch: 36, train_loss: 0.8185, test_loss: 1.0637, test_f1: 0.5160
 epoch: 37, train_loss: 0.8216, test_loss: 1.0158, test_f1: 0.5578
 epoch: 38, train_loss: 0.8302, test_loss: 1.0400, test_f1: 0.5188
 epoch: 39, train_loss: 0.8098, test_loss: 1.0643, test_f1: 0.4981
 epoch: 40, train_loss: 0.8233, test_loss: 1.0549, test_f1: 0.4942
 epoch: 41, train_loss: 0.7988, test_loss: 1.0511, test_f1: 0.5199
 epoch: 42, train_loss: 0.8108, test_loss: 1.0021, test_f1: 0.5519
 epoch: 43, train_loss: 0.7972, test_loss: 1.0885, test_f1: 0.5065
 epoch: 44, train_loss: 0.8056, test_loss: 1.0120, test_f1: 0.5058
 epoch: 45, train_loss: 0.8028, test_loss: 1.0741, test_f1: 0.5513
 epoch: 46, train_loss: 0.8041, test_loss: 1.2519, test_f1: 0.5205
 epoch: 47, train_loss: 0.7917, test_loss: 1.0834, test_f1: 0.4943
 epoch: 48, train_loss: 0.8038, test_loss: 0.9792, test_f1: 0.5574
 epoch: 49, train_loss: 0.7861, test_loss: 1.0528, test_f1: 0.5456
 epoch: 50, train_loss: 0.7792, test_loss: 1.0347, test_f1: 0.5136
 epoch: 51, train_loss: 0.7605, test_loss: 1.0885, test_f1: 0.5625
 epoch: 52, train_loss: 0.7606, test_loss: 1.1540, test_f1: 0.5422
 epoch: 53, train_loss: 0.7374, test_loss: 1.0687, test_f1: 0.5359
 epoch: 54, train_loss: 0.7426, test_loss: 1.0277, test_f1: 0.5773
 epoch: 55, train_loss: 0.7359, test_loss: 1.0231, test_f1: 0.5550
 epoch: 56, train_loss: 0.7187, test_loss: 1.1068, test_f1: 0.5546
 epoch: 57, train_loss: 0.7258, test_loss: 1.0897, test_f1: 0.5726
 epoch: 58, train_loss: 0.7246, test_loss: 1.1527, test_f1: 0.5194
 epoch: 59, train_loss: 0.7177, test_loss: 1.1335, test_f1: 0.5592
 epoch: 60, train_loss: 0.7362, test_loss: 1.0613, test_f1: 0.5227
 epoch: 61, train_loss: 0.7104, test_loss: 1.0826, test_f1: 0.5429
 epoch: 62, train_loss: 0.7176, test_loss: 1.0768, test_f1: 0.5553
 epoch: 63, train_loss: 0.7184, test_loss: 1.0794, test_f1: 0.5416
 epoch: 64, train_loss: 0.7035, test_loss: 1.1881, test_f1: 0.5033
 epoch: 65, train_loss: 0.7054, test_loss: 1.3492, test_f1: 0.5111
 epoch: 66, train_loss: 0.7115, test_loss: 1.0953, test_f1: 0.5723
 epoch: 67, train_loss: 0.7023, test_loss: 1.1782, test_f1: 0.5447
 epoch: 68, train_loss: 0.6986, test_loss: 1.3129, test_f1: 0.5101
 epoch: 69, train_loss: 0.6870, test_loss: 1.1519, test_f1: 0.5600
 epoch: 70, train_loss: 0.7075, test_loss: 1.1712, test_f1: 0.5378
 epoch: 71, train_loss: 0.6741, test_loss: 1.3004, test_f1: 0.5120
 epoch: 72, train_loss: 0.6993, test_loss: 1.1360, test_f1: 0.5314
 epoch: 73, train_loss: 0.7010, test_loss: 1.3165, test_f1: 0.5137
 epoch: 74, train_loss: 0.7035, test_loss: 1.1274, test_f1: 0.5276
 epoch: 75, train_loss: 0.6854, test_loss: 1.1320, test_f1: 0.5666
 epoch: 76, train_loss: 0.6838, test_loss: 1.1410, test_f1: 0.5516
 epoch: 77, train_loss: 0.6857, test_loss: 1.1525, test_f1: 0.5393
 epoch: 78, train_loss: 0.6905, test_loss: 1.1882, test_f1: 0.5481
 epoch: 79, train_loss: 0.6828, test_loss: 1.5323, test_f1: 0.5129
 epoch: 80, train_loss: 0.6847, test_loss: 1.1899, test_f1: 0.5258
 epoch: 81, train_loss: 0.6854, test_loss: 1.1647, test_f1: 0.5464
 epoch: 82, train_loss: 0.6782, test_loss: 1.3831, test_f1: 0.5197
 epoch: 83, train_loss: 0.6828, test_loss: 1.2232, test_f1: 0.5374
 epoch: 84, train_loss: 0.6835, test_loss: 1.1968, test_f1: 0.5347
 epoch: 85, train_loss: 0.6570, test_loss: 1.4589, test_f1: 0.5325
 epoch: 86, train_loss: 0.6796, test_loss: 1.2261, test_f1: 0.5425
 epoch: 87, train_loss: 0.6758, test_loss: 1.5629, test_f1: 0.5254
 epoch: 88, train_loss: 0.6522, test_loss: 1.2759, test_f1: 0.5310
 epoch: 89, train_loss: 0.6590, test_loss: 1.3196, test_f1: 0.5462
 epoch: 90, train_loss: 0.6533, test_loss: 1.2329, test_f1: 0.5464
 epoch: 91, train_loss: 0.6661, test_loss: 1.1249, test_f1: 0.5672
 epoch: 92, train_loss: 0.6721, test_loss: 1.1494, test_f1: 0.5786
 epoch: 93, train_loss: 0.6519, test_loss: 1.1077, test_f1: 0.5644
 epoch: 94, train_loss: 0.6571, test_loss: 1.1657, test_f1: 0.5425
 epoch: 95, train_loss: 0.6757, test_loss: 1.2873, test_f1: 0.5341
 epoch: 96, train_loss: 0.6509, test_loss: 1.1599, test_f1: 0.5658
 epoch: 97, train_loss: 0.6553, test_loss: 1.2548, test_f1: 0.5478
 epoch: 98, train_loss: 0.6490, test_loss: 1.5612, test_f1: 0.5062
 epoch: 99, train_loss: 0.6630, test_loss: 1.4212, test_f1: 0.5099
##################ITERATION #1 ****************************************
 epoch: 0, train_loss: 1.2624, test_loss: 1.2243, test_f1: 0.2850
 epoch: 1, train_loss: 1.2002, test_loss: 1.1137, test_f1: 0.4681
 epoch: 2, train_loss: 1.1382, test_loss: 1.0650, test_f1: 0.4563
 epoch: 3, train_loss: 1.0988, test_loss: 1.0392, test_f1: 0.4612
 epoch: 4, train_loss: 1.0675, test_loss: 1.0609, test_f1: 0.4390
 epoch: 5, train_loss: 1.0389, test_loss: 1.0447, test_f1: 0.4730
 epoch: 6, train_loss: 1.0156, test_loss: 0.9708, test_f1: 0.4945
 epoch: 7, train_loss: 0.9882, test_loss: 0.9853, test_f1: 0.5189
 epoch: 8, train_loss: 0.9763, test_loss: 0.9946, test_f1: 0.4923
 epoch: 9, train_loss: 0.9633, test_loss: 1.0452, test_f1: 0.5122
 epoch: 10, train_loss: 0.9542, test_loss: 0.9217, test_f1: 0.4979
 epoch: 11, train_loss: 0.9484, test_loss: 0.9555, test_f1: 0.4917
 epoch: 12, train_loss: 0.9350, test_loss: 0.9979, test_f1: 0.4899
 epoch: 13, train_loss: 0.9285, test_loss: 0.9652, test_f1: 0.4979
 epoch: 14, train_loss: 0.9144, test_loss: 0.9253, test_f1: 0.4814
 epoch: 15, train_loss: 0.8932, test_loss: 1.0809, test_f1: 0.4864
 epoch: 16, train_loss: 0.9175, test_loss: 0.9751, test_f1: 0.5099
 epoch: 17, train_loss: 0.8992, test_loss: 1.0380, test_f1: 0.5138
 epoch: 18, train_loss: 0.8978, test_loss: 1.0172, test_f1: 0.5074
 epoch: 19, train_loss: 0.8850, test_loss: 1.0429, test_f1: 0.5024
 epoch: 20, train_loss: 0.8965, test_loss: 0.9396, test_f1: 0.5116
 epoch: 21, train_loss: 0.8786, test_loss: 0.9053, test_f1: 0.5574
 epoch: 22, train_loss: 0.8575, test_loss: 0.9258, test_f1: 0.5209
 epoch: 23, train_loss: 0.8598, test_loss: 0.9982, test_f1: 0.5597
 epoch: 24, train_loss: 0.8405, test_loss: 0.9700, test_f1: 0.5471
 epoch: 25, train_loss: 0.8513, test_loss: 0.9591, test_f1: 0.5396
 epoch: 26, train_loss: 0.8489, test_loss: 0.9911, test_f1: 0.5266
 epoch: 27, train_loss: 0.8494, test_loss: 0.9144, test_f1: 0.5380
 epoch: 28, train_loss: 0.8519, test_loss: 0.9514, test_f1: 0.5563
 epoch: 29, train_loss: 0.8373, test_loss: 0.8980, test_f1: 0.5493
 epoch: 30, train_loss: 0.8234, test_loss: 1.0323, test_f1: 0.5570
 epoch: 31, train_loss: 0.8275, test_loss: 0.9188, test_f1: 0.5225
 epoch: 32, train_loss: 0.8254, test_loss: 1.0797, test_f1: 0.5327
 epoch: 33, train_loss: 0.8298, test_loss: 1.0380, test_f1: 0.5214
 epoch: 34, train_loss: 0.8115, test_loss: 0.9479, test_f1: 0.5554
 epoch: 35, train_loss: 0.8101, test_loss: 1.0272, test_f1: 0.5298
 epoch: 36, train_loss: 0.8194, test_loss: 1.2530, test_f1: 0.5028
 epoch: 37, train_loss: 0.8209, test_loss: 0.8851, test_f1: 0.5624
 epoch: 38, train_loss: 0.8179, test_loss: 1.0198, test_f1: 0.5676
 epoch: 39, train_loss: 0.7936, test_loss: 0.9771, test_f1: 0.5434
 epoch: 40, train_loss: 0.7740, test_loss: 1.0391, test_f1: 0.5066
 epoch: 41, train_loss: 0.8188, test_loss: 0.9359, test_f1: 0.5378
 epoch: 42, train_loss: 0.7923, test_loss: 0.9990, test_f1: 0.5528
 epoch: 43, train_loss: 0.7886, test_loss: 1.1028, test_f1: 0.5540
 epoch: 44, train_loss: 0.8000, test_loss: 1.0400, test_f1: 0.5408
 epoch: 45, train_loss: 0.7870, test_loss: 1.0237, test_f1: 0.4843
 epoch: 46, train_loss: 0.7858, test_loss: 1.0538, test_f1: 0.5382
 epoch: 47, train_loss: 0.7858, test_loss: 0.9809, test_f1: 0.5504
 epoch: 48, train_loss: 0.7775, test_loss: 0.9170, test_f1: 0.5347
 epoch: 49, train_loss: 0.7886, test_loss: 0.9527, test_f1: 0.5264
 epoch: 50, train_loss: 0.7805, test_loss: 0.9132, test_f1: 0.5201
 epoch: 51, train_loss: 0.7342, test_loss: 0.9123, test_f1: 0.5370
 epoch: 52, train_loss: 0.7280, test_loss: 0.9436, test_f1: 0.5327
 epoch: 53, train_loss: 0.7219, test_loss: 0.9332, test_f1: 0.5259
 epoch: 54, train_loss: 0.7163, test_loss: 0.9947, test_f1: 0.5375
 epoch: 55, train_loss: 0.7099, test_loss: 0.9215, test_f1: 0.5349
 epoch: 56, train_loss: 0.7137, test_loss: 0.9867, test_f1: 0.5528
 epoch: 57, train_loss: 0.7083, test_loss: 0.9692, test_f1: 0.5602
 epoch: 58, train_loss: 0.7108, test_loss: 0.9650, test_f1: 0.5128
 epoch: 59, train_loss: 0.7027, test_loss: 0.9340, test_f1: 0.5710
 epoch: 60, train_loss: 0.7157, test_loss: 1.0605, test_f1: 0.5479
 epoch: 61, train_loss: 0.7013, test_loss: 0.9828, test_f1: 0.5908
 epoch: 62, train_loss: 0.6988, test_loss: 1.0147, test_f1: 0.5689
 epoch: 63, train_loss: 0.7056, test_loss: 0.9700, test_f1: 0.5631
 epoch: 64, train_loss: 0.6860, test_loss: 0.9783, test_f1: 0.5864
 epoch: 65, train_loss: 0.6889, test_loss: 0.9616, test_f1: 0.5659
 epoch: 66, train_loss: 0.6794, test_loss: 1.0078, test_f1: 0.5683
 epoch: 67, train_loss: 0.6837, test_loss: 1.0283, test_f1: 0.5424
 epoch: 68, train_loss: 0.6772, test_loss: 1.0391, test_f1: 0.5678
 epoch: 69, train_loss: 0.6792, test_loss: 1.0016, test_f1: 0.5515
 epoch: 70, train_loss: 0.6799, test_loss: 1.0312, test_f1: 0.5615
 epoch: 71, train_loss: 0.6733, test_loss: 0.9636, test_f1: 0.5638
 epoch: 72, train_loss: 0.6791, test_loss: 1.0049, test_f1: 0.5591
 epoch: 73, train_loss: 0.6754, test_loss: 0.9754, test_f1: 0.5619
 epoch: 74, train_loss: 0.6675, test_loss: 1.0342, test_f1: 0.5703
 epoch: 75, train_loss: 0.6577, test_loss: 1.0034, test_f1: 0.5471
 epoch: 76, train_loss: 0.6713, test_loss: 0.9961, test_f1: 0.5767
 epoch: 77, train_loss: 0.6768, test_loss: 1.0419, test_f1: 0.5657
 epoch: 78, train_loss: 0.6801, test_loss: 1.0126, test_f1: 0.6104
 epoch: 79, train_loss: 0.6660, test_loss: 0.9532, test_f1: 0.5554
 epoch: 80, train_loss: 0.6777, test_loss: 0.9968, test_f1: 0.5453
 epoch: 81, train_loss: 0.6505, test_loss: 1.0064, test_f1: 0.5727
 epoch: 82, train_loss: 0.6538, test_loss: 1.0789, test_f1: 0.5522
 epoch: 83, train_loss: 0.6581, test_loss: 1.0558, test_f1: 0.5633
 epoch: 84, train_loss: 0.6553, test_loss: 1.0220, test_f1: 0.5740
 epoch: 85, train_loss: 0.6326, test_loss: 1.0643, test_f1: 0.5631
 epoch: 86, train_loss: 0.6381, test_loss: 1.0415, test_f1: 0.5510
 epoch: 87, train_loss: 0.6619, test_loss: 1.1632, test_f1: 0.5354
 epoch: 88, train_loss: 0.6342, test_loss: 1.0748, test_f1: 0.5178
 epoch: 89, train_loss: 0.6484, test_loss: 1.0476, test_f1: 0.5663
 epoch: 90, train_loss: 0.6530, test_loss: 1.0017, test_f1: 0.5817
 epoch: 91, train_loss: 0.6349, test_loss: 1.0151, test_f1: 0.5764
 epoch: 92, train_loss: 0.6307, test_loss: 0.9960, test_f1: 0.5796
 epoch: 93, train_loss: 0.6524, test_loss: 0.9980, test_f1: 0.5551
 epoch: 94, train_loss: 0.6612, test_loss: 0.9659, test_f1: 0.5702
 epoch: 95, train_loss: 0.6373, test_loss: 1.0145, test_f1: 0.5617
 epoch: 96, train_loss: 0.6182, test_loss: 1.0098, test_f1: 0.5783
 epoch: 97, train_loss: 0.6318, test_loss: 1.0067, test_f1: 0.5717
 epoch: 98, train_loss: 0.6092, test_loss: 1.1248, test_f1: 0.5430
 epoch: 99, train_loss: 0.6282, test_loss: 0.9685, test_f1: 0.6106
##################ITERATION #2 ****************************************
 epoch: 0, train_loss: 1.3096, test_loss: 1.2040, test_f1: 0.3369
 epoch: 1, train_loss: 1.1907, test_loss: 1.1119, test_f1: 0.4364
 epoch: 2, train_loss: 1.1343, test_loss: 1.0483, test_f1: 0.4406
 epoch: 3, train_loss: 1.0724, test_loss: 1.0005, test_f1: 0.4766
 epoch: 4, train_loss: 1.0395, test_loss: 0.9807, test_f1: 0.4691
 epoch: 5, train_loss: 1.0268, test_loss: 0.9545, test_f1: 0.4699
 epoch: 6, train_loss: 1.0062, test_loss: 0.9986, test_f1: 0.4883
 epoch: 7, train_loss: 0.9871, test_loss: 0.9186, test_f1: 0.4966
 epoch: 8, train_loss: 0.9681, test_loss: 1.0803, test_f1: 0.4675
 epoch: 9, train_loss: 0.9685, test_loss: 0.9701, test_f1: 0.5279
 epoch: 10, train_loss: 0.9453, test_loss: 0.9913, test_f1: 0.5164
 epoch: 11, train_loss: 0.9496, test_loss: 1.0009, test_f1: 0.5552
 epoch: 12, train_loss: 0.9485, test_loss: 0.9961, test_f1: 0.5256
 epoch: 13, train_loss: 0.9250, test_loss: 1.0515, test_f1: 0.5262
 epoch: 14, train_loss: 0.9245, test_loss: 1.0844, test_f1: 0.5374
 epoch: 15, train_loss: 0.9035, test_loss: 0.9989, test_f1: 0.5296
 epoch: 16, train_loss: 0.9124, test_loss: 0.9608, test_f1: 0.5552
 epoch: 17, train_loss: 0.9034, test_loss: 1.0150, test_f1: 0.5502
 epoch: 18, train_loss: 0.8871, test_loss: 1.0527, test_f1: 0.5224
 epoch: 19, train_loss: 0.8854, test_loss: 0.9863, test_f1: 0.5502
 epoch: 20, train_loss: 0.8748, test_loss: 0.9999, test_f1: 0.5592
 epoch: 21, train_loss: 0.8773, test_loss: 0.9967, test_f1: 0.5522
 epoch: 22, train_loss: 0.8765, test_loss: 1.0982, test_f1: 0.5228
 epoch: 23, train_loss: 0.8624, test_loss: 0.9370, test_f1: 0.5459
 epoch: 24, train_loss: 0.8585, test_loss: 0.9646, test_f1: 0.5447
 epoch: 25, train_loss: 0.8484, test_loss: 0.9933, test_f1: 0.5456
 epoch: 26, train_loss: 0.8305, test_loss: 1.1440, test_f1: 0.5364
 epoch: 27, train_loss: 0.8252, test_loss: 1.1002, test_f1: 0.5488
 epoch: 28, train_loss: 0.8193, test_loss: 1.2716, test_f1: 0.4951
 epoch: 29, train_loss: 0.8221, test_loss: 0.9865, test_f1: 0.5675
 epoch: 30, train_loss: 0.8444, test_loss: 1.0537, test_f1: 0.5704
 epoch: 31, train_loss: 0.8896, test_loss: 0.9209, test_f1: 0.5419
 epoch: 32, train_loss: 0.8469, test_loss: 1.0404, test_f1: 0.5630
 epoch: 33, train_loss: 0.8349, test_loss: 1.0607, test_f1: 0.5244
 epoch: 34, train_loss: 0.8232, test_loss: 1.1326, test_f1: 0.5301
 epoch: 35, train_loss: 0.8261, test_loss: 1.0185, test_f1: 0.5433
 epoch: 36, train_loss: 0.8201, test_loss: 1.2737, test_f1: 0.4944
 epoch: 37, train_loss: 0.8065, test_loss: 1.0769, test_f1: 0.5386
 epoch: 38, train_loss: 0.7957, test_loss: 1.1075, test_f1: 0.5460
 epoch: 39, train_loss: 0.7837, test_loss: 1.0661, test_f1: 0.5617
 epoch: 40, train_loss: 0.7954, test_loss: 1.0222, test_f1: 0.5398
 epoch: 41, train_loss: 0.7939, test_loss: 1.1372, test_f1: 0.5308
 epoch: 42, train_loss: 0.7914, test_loss: 1.0605, test_f1: 0.5603
 epoch: 43, train_loss: 0.7876, test_loss: 1.1080, test_f1: 0.5650
 epoch: 44, train_loss: 0.7589, test_loss: 1.1195, test_f1: 0.5463
 epoch: 45, train_loss: 0.7778, test_loss: 1.1858, test_f1: 0.5586
 epoch: 46, train_loss: 0.7728, test_loss: 1.0957, test_f1: 0.5754
 epoch: 47, train_loss: 0.7596, test_loss: 1.0390, test_f1: 0.5465
 epoch: 48, train_loss: 0.7667, test_loss: 1.0408, test_f1: 0.5758
 epoch: 49, train_loss: 0.7595, test_loss: 1.1473, test_f1: 0.5812
 epoch: 50, train_loss: 0.7523, test_loss: 1.4051, test_f1: 0.5466
 epoch: 51, train_loss: 0.7349, test_loss: 1.1933, test_f1: 0.5554
 epoch: 52, train_loss: 0.7386, test_loss: 1.1631, test_f1: 0.5824
 epoch: 53, train_loss: 0.7175, test_loss: 1.2213, test_f1: 0.5881
 epoch: 54, train_loss: 0.6936, test_loss: 1.2253, test_f1: 0.5505
 epoch: 55, train_loss: 0.6980, test_loss: 1.3425, test_f1: 0.5563
 epoch: 56, train_loss: 0.7002, test_loss: 1.2416, test_f1: 0.5639
 epoch: 57, train_loss: 0.7034, test_loss: 1.1573, test_f1: 0.5597
 epoch: 58, train_loss: 0.6888, test_loss: 1.3083, test_f1: 0.5627
 epoch: 59, train_loss: 0.6859, test_loss: 1.3904, test_f1: 0.5418
 epoch: 60, train_loss: 0.6894, test_loss: 1.2209, test_f1: 0.5594
 epoch: 61, train_loss: 0.6881, test_loss: 1.1467, test_f1: 0.5759
 epoch: 62, train_loss: 0.7020, test_loss: 1.2318, test_f1: 0.5781
 epoch: 63, train_loss: 0.6800, test_loss: 1.2673, test_f1: 0.5618
 epoch: 64, train_loss: 0.6823, test_loss: 1.2027, test_f1: 0.5742
 epoch: 65, train_loss: 0.6873, test_loss: 1.3215, test_f1: 0.5519
 epoch: 66, train_loss: 0.6755, test_loss: 1.2591, test_f1: 0.5912
 epoch: 67, train_loss: 0.6960, test_loss: 1.2501, test_f1: 0.5640
 epoch: 68, train_loss: 0.6731, test_loss: 1.2564, test_f1: 0.5829
 epoch: 69, train_loss: 0.6801, test_loss: 1.1595, test_f1: 0.5773
 epoch: 70, train_loss: 0.6753, test_loss: 1.2545, test_f1: 0.5538
 epoch: 71, train_loss: 0.6748, test_loss: 1.2228, test_f1: 0.5656
 epoch: 72, train_loss: 0.6618, test_loss: 1.2824, test_f1: 0.5769
 epoch: 73, train_loss: 0.6693, test_loss: 1.4256, test_f1: 0.5653
 epoch: 74, train_loss: 0.6582, test_loss: 1.3570, test_f1: 0.5518
 epoch: 75, train_loss: 0.6559, test_loss: 1.2746, test_f1: 0.5623
 epoch: 76, train_loss: 0.6504, test_loss: 1.2698, test_f1: 0.5850
 epoch: 77, train_loss: 0.6659, test_loss: 1.4201, test_f1: 0.5314
 epoch: 78, train_loss: 0.6616, test_loss: 1.4215, test_f1: 0.5374
 epoch: 79, train_loss: 0.6415, test_loss: 1.2471, test_f1: 0.5364
 epoch: 80, train_loss: 0.6692, test_loss: 1.2322, test_f1: 0.5486
 epoch: 81, train_loss: 0.6561, test_loss: 1.2086, test_f1: 0.5866
 epoch: 82, train_loss: 0.6481, test_loss: 1.1703, test_f1: 0.5704
 epoch: 83, train_loss: 0.6344, test_loss: 1.4207, test_f1: 0.5382
 epoch: 84, train_loss: 0.6901, test_loss: 1.2728, test_f1: 0.5683
 epoch: 85, train_loss: 0.6452, test_loss: 1.1775, test_f1: 0.5665
 epoch: 86, train_loss: 0.6413, test_loss: 1.2887, test_f1: 0.5636
 epoch: 87, train_loss: 0.6530, test_loss: 1.5051, test_f1: 0.5504
 epoch: 88, train_loss: 0.6464, test_loss: 1.3295, test_f1: 0.5448
 epoch: 89, train_loss: 0.6177, test_loss: 1.2284, test_f1: 0.5729
 epoch: 90, train_loss: 0.6234, test_loss: 1.2613, test_f1: 0.5560
 epoch: 91, train_loss: 0.6393, test_loss: 1.1976, test_f1: 0.5708
 epoch: 92, train_loss: 0.6289, test_loss: 1.2961, test_f1: 0.5597
 epoch: 93, train_loss: 0.6204, test_loss: 1.3962, test_f1: 0.5462
 epoch: 94, train_loss: 0.6266, test_loss: 1.2932, test_f1: 0.5782
 epoch: 95, train_loss: 0.6273, test_loss: 1.3591, test_f1: 0.5653
 epoch: 96, train_loss: 0.6237, test_loss: 1.3945, test_f1: 0.5668
 epoch: 97, train_loss: 0.6275, test_loss: 1.3301, test_f1: 0.5614
 epoch: 98, train_loss: 0.6340, test_loss: 1.4166, test_f1: 0.5445
 epoch: 99, train_loss: 0.6234, test_loss: 1.2835, test_f1: 0.5820
##################ITERATION #3 ****************************************
 epoch: 0, train_loss: 1.2539, test_loss: 1.1167, test_f1: 0.4667
 epoch: 1, train_loss: 1.1188, test_loss: 1.0248, test_f1: 0.4660
 epoch: 2, train_loss: 1.0861, test_loss: 0.9570, test_f1: 0.4619
 epoch: 3, train_loss: 1.0516, test_loss: 1.0341, test_f1: 0.4333
 epoch: 4, train_loss: 1.0159, test_loss: 0.9480, test_f1: 0.4762
 epoch: 5, train_loss: 0.9986, test_loss: 0.9375, test_f1: 0.4764
 epoch: 6, train_loss: 0.9896, test_loss: 0.9306, test_f1: 0.5321
 epoch: 7, train_loss: 0.9832, test_loss: 0.9783, test_f1: 0.5102
 epoch: 8, train_loss: 0.9508, test_loss: 1.0296, test_f1: 0.4953
 epoch: 9, train_loss: 0.9470, test_loss: 1.0731, test_f1: 0.5063
 epoch: 10, train_loss: 0.9571, test_loss: 1.0107, test_f1: 0.5085
 epoch: 11, train_loss: 0.9486, test_loss: 1.0107, test_f1: 0.4952
 epoch: 12, train_loss: 0.9465, test_loss: 0.9680, test_f1: 0.4917
 epoch: 13, train_loss: 0.9286, test_loss: 0.9775, test_f1: 0.4991
 epoch: 14, train_loss: 0.9264, test_loss: 0.9707, test_f1: 0.5143
 epoch: 15, train_loss: 0.9109, test_loss: 0.9551, test_f1: 0.5184
 epoch: 16, train_loss: 0.9058, test_loss: 0.9867, test_f1: 0.5530
 epoch: 17, train_loss: 0.9198, test_loss: 0.9733, test_f1: 0.5685
 epoch: 18, train_loss: 0.9033, test_loss: 0.9515, test_f1: 0.5104
 epoch: 19, train_loss: 0.8941, test_loss: 0.9219, test_f1: 0.5324
 epoch: 20, train_loss: 0.9257, test_loss: 0.9884, test_f1: 0.5139
 epoch: 21, train_loss: 0.8770, test_loss: 1.0925, test_f1: 0.5412
 epoch: 22, train_loss: 0.8785, test_loss: 0.9361, test_f1: 0.5105
 epoch: 23, train_loss: 0.8786, test_loss: 0.9495, test_f1: 0.5061
 epoch: 24, train_loss: 0.8753, test_loss: 0.9974, test_f1: 0.4969
 epoch: 25, train_loss: 0.8733, test_loss: 0.8865, test_f1: 0.5426
 epoch: 26, train_loss: 0.8619, test_loss: 0.9544, test_f1: 0.5263
 epoch: 27, train_loss: 0.8635, test_loss: 0.9609, test_f1: 0.5032
 epoch: 28, train_loss: 0.8541, test_loss: 1.0370, test_f1: 0.4681
 epoch: 29, train_loss: 0.8548, test_loss: 0.9742, test_f1: 0.5177
 epoch: 30, train_loss: 0.8738, test_loss: 1.0263, test_f1: 0.5466
 epoch: 31, train_loss: 0.8488, test_loss: 0.9079, test_f1: 0.5342
 epoch: 32, train_loss: 0.8438, test_loss: 0.9741, test_f1: 0.5195
 epoch: 33, train_loss: 0.8290, test_loss: 1.0767, test_f1: 0.5276
 epoch: 34, train_loss: 0.8231, test_loss: 0.9333, test_f1: 0.5234
 epoch: 35, train_loss: 0.8332, test_loss: 0.9215, test_f1: 0.5517
 epoch: 36, train_loss: 0.8209, test_loss: 0.9551, test_f1: 0.5387
 epoch: 37, train_loss: 0.8202, test_loss: 0.9447, test_f1: 0.5331
 epoch: 38, train_loss: 0.8283, test_loss: 0.9520, test_f1: 0.5123
 epoch: 39, train_loss: 0.8314, test_loss: 1.0095, test_f1: 0.5185
 epoch: 40, train_loss: 0.8145, test_loss: 0.8909, test_f1: 0.5648
 epoch: 41, train_loss: 0.7969, test_loss: 0.9736, test_f1: 0.5592
 epoch: 42, train_loss: 0.8043, test_loss: 1.0336, test_f1: 0.5453
 epoch: 43, train_loss: 0.7904, test_loss: 0.9936, test_f1: 0.5099
 epoch: 44, train_loss: 0.7958, test_loss: 1.1899, test_f1: 0.4641
 epoch: 45, train_loss: 0.7865, test_loss: 0.9861, test_f1: 0.5811
 epoch: 46, train_loss: 0.8170, test_loss: 0.9591, test_f1: 0.5477
 epoch: 47, train_loss: 0.8041, test_loss: 0.9561, test_f1: 0.5611
 epoch: 48, train_loss: 0.7888, test_loss: 1.0451, test_f1: 0.5153
 epoch: 49, train_loss: 0.7942, test_loss: 1.0311, test_f1: 0.5382
 epoch: 50, train_loss: 0.8100, test_loss: 0.9526, test_f1: 0.5661
 epoch: 51, train_loss: 0.7799, test_loss: 0.9158, test_f1: 0.5681
 epoch: 52, train_loss: 0.7521, test_loss: 1.0615, test_f1: 0.5501
 epoch: 53, train_loss: 0.7476, test_loss: 1.0126, test_f1: 0.5662
 epoch: 54, train_loss: 0.7380, test_loss: 1.0290, test_f1: 0.5610
 epoch: 55, train_loss: 0.7319, test_loss: 1.0433, test_f1: 0.5600
 epoch: 56, train_loss: 0.7420, test_loss: 0.9832, test_f1: 0.5705
 epoch: 57, train_loss: 0.7366, test_loss: 1.0124, test_f1: 0.5879
 epoch: 58, train_loss: 0.7110, test_loss: 1.0133, test_f1: 0.5666
 epoch: 59, train_loss: 0.7325, test_loss: 0.9632, test_f1: 0.5652
 epoch: 60, train_loss: 0.7285, test_loss: 0.9416, test_f1: 0.5545
 epoch: 61, train_loss: 0.7132, test_loss: 1.0568, test_f1: 0.5737
 epoch: 62, train_loss: 0.7244, test_loss: 0.9458, test_f1: 0.5691
 epoch: 63, train_loss: 0.7267, test_loss: 0.9806, test_f1: 0.5715
 epoch: 64, train_loss: 0.7219, test_loss: 1.0284, test_f1: 0.5716
 epoch: 65, train_loss: 0.7114, test_loss: 0.9545, test_f1: 0.5774
 epoch: 66, train_loss: 0.7034, test_loss: 0.9927, test_f1: 0.5866
 epoch: 67, train_loss: 0.7238, test_loss: 0.9978, test_f1: 0.5833
 epoch: 68, train_loss: 0.7128, test_loss: 1.0114, test_f1: 0.5639
 epoch: 69, train_loss: 0.7143, test_loss: 1.0261, test_f1: 0.5667
 epoch: 70, train_loss: 0.7075, test_loss: 1.1593, test_f1: 0.5415
 epoch: 71, train_loss: 0.6939, test_loss: 1.0529, test_f1: 0.5829
 epoch: 72, train_loss: 0.7068, test_loss: 1.0251, test_f1: 0.5804
 epoch: 73, train_loss: 0.7094, test_loss: 1.0323, test_f1: 0.5817
 epoch: 74, train_loss: 0.7182, test_loss: 1.0397, test_f1: 0.5656
 epoch: 75, train_loss: 0.7065, test_loss: 1.1458, test_f1: 0.5961
 epoch: 76, train_loss: 0.6947, test_loss: 1.1995, test_f1: 0.5611
 epoch: 77, train_loss: 0.7131, test_loss: 1.0394, test_f1: 0.5811
 epoch: 78, train_loss: 0.7051, test_loss: 1.0069, test_f1: 0.5745
 epoch: 79, train_loss: 0.6976, test_loss: 1.0597, test_f1: 0.5720
 epoch: 80, train_loss: 0.6955, test_loss: 1.0759, test_f1: 0.5311
 epoch: 81, train_loss: 0.7008, test_loss: 0.9942, test_f1: 0.5829
 epoch: 82, train_loss: 0.7042, test_loss: 1.0089, test_f1: 0.5717
 epoch: 83, train_loss: 0.6769, test_loss: 1.0940, test_f1: 0.5657
 epoch: 84, train_loss: 0.7083, test_loss: 1.0484, test_f1: 0.5793
 epoch: 85, train_loss: 0.6925, test_loss: 1.0666, test_f1: 0.5453
 epoch: 86, train_loss: 0.7003, test_loss: 1.0816, test_f1: 0.6129
 epoch: 87, train_loss: 0.6935, test_loss: 1.0459, test_f1: 0.5973
 epoch: 88, train_loss: 0.6876, test_loss: 1.1358, test_f1: 0.5562
 epoch: 89, train_loss: 0.6665, test_loss: 1.0529, test_f1: 0.5982
 epoch: 90, train_loss: 0.6837, test_loss: 1.0587, test_f1: 0.5638
 epoch: 91, train_loss: 0.6948, test_loss: 1.0831, test_f1: 0.5753
 epoch: 92, train_loss: 0.6678, test_loss: 1.0161, test_f1: 0.5836
 epoch: 93, train_loss: 0.7010, test_loss: 1.2403, test_f1: 0.5202
 epoch: 94, train_loss: 0.6773, test_loss: 1.0262, test_f1: 0.5972
 epoch: 95, train_loss: 0.6810, test_loss: 1.0942, test_f1: 0.5632
 epoch: 96, train_loss: 0.6686, test_loss: 1.1463, test_f1: 0.5610
 epoch: 97, train_loss: 0.6831, test_loss: 1.0075, test_f1: 0.6032
 epoch: 98, train_loss: 0.6799, test_loss: 1.1124, test_f1: 0.5520
 epoch: 99, train_loss: 0.6667, test_loss: 1.1405, test_f1: 0.5609
##################ITERATION #4 ****************************************
 epoch: 0, train_loss: 1.2978, test_loss: 1.2097, test_f1: 0.2965
 epoch: 1, train_loss: 1.1809, test_loss: 1.0760, test_f1: 0.4098
 epoch: 2, train_loss: 1.1165, test_loss: 0.9946, test_f1: 0.4537
 epoch: 3, train_loss: 1.0557, test_loss: 1.0741, test_f1: 0.4323
 epoch: 4, train_loss: 1.0437, test_loss: 0.9970, test_f1: 0.4357
 epoch: 5, train_loss: 1.0361, test_loss: 1.2005, test_f1: 0.4538
 epoch: 6, train_loss: 1.0111, test_loss: 1.0058, test_f1: 0.4661
 epoch: 7, train_loss: 0.9862, test_loss: 1.0483, test_f1: 0.4703
 epoch: 8, train_loss: 0.9614, test_loss: 1.0668, test_f1: 0.4897
 epoch: 9, train_loss: 0.9778, test_loss: 1.0182, test_f1: 0.4503
 epoch: 10, train_loss: 0.9440, test_loss: 1.0670, test_f1: 0.4771
 epoch: 11, train_loss: 0.9438, test_loss: 1.0684, test_f1: 0.4994
 epoch: 12, train_loss: 0.9177, test_loss: 1.0052, test_f1: 0.4947
 epoch: 13, train_loss: 0.9216, test_loss: 0.9738, test_f1: 0.5003
 epoch: 14, train_loss: 0.9178, test_loss: 0.9525, test_f1: 0.5040
 epoch: 15, train_loss: 0.9070, test_loss: 1.1729, test_f1: 0.4484
 epoch: 16, train_loss: 0.9056, test_loss: 0.9987, test_f1: 0.4878
 epoch: 17, train_loss: 0.9515, test_loss: 1.0441, test_f1: 0.4639
 epoch: 18, train_loss: 0.9035, test_loss: 0.9223, test_f1: 0.5113
 epoch: 19, train_loss: 0.8830, test_loss: 1.0225, test_f1: 0.4910
 epoch: 20, train_loss: 0.8780, test_loss: 0.9572, test_f1: 0.4937
 epoch: 21, train_loss: 0.8689, test_loss: 1.0044, test_f1: 0.5076
 epoch: 22, train_loss: 0.8575, test_loss: 1.0691, test_f1: 0.4991
 epoch: 23, train_loss: 0.8953, test_loss: 1.2114, test_f1: 0.5173
 epoch: 24, train_loss: 0.8613, test_loss: 1.1454, test_f1: 0.4941
 epoch: 25, train_loss: 0.8614, test_loss: 1.1855, test_f1: 0.4984
 epoch: 26, train_loss: 0.8628, test_loss: 1.1569, test_f1: 0.4858
 epoch: 27, train_loss: 0.8435, test_loss: 1.2566, test_f1: 0.5135
 epoch: 28, train_loss: 0.8784, test_loss: 1.1128, test_f1: 0.5386
 epoch: 29, train_loss: 0.8547, test_loss: 1.0270, test_f1: 0.5088
 epoch: 30, train_loss: 0.8378, test_loss: 1.1562, test_f1: 0.5252
 epoch: 31, train_loss: 0.8435, test_loss: 1.0951, test_f1: 0.5193
 epoch: 32, train_loss: 0.8291, test_loss: 0.9039, test_f1: 0.5419
 epoch: 33, train_loss: 0.8355, test_loss: 1.0657, test_f1: 0.5405
 epoch: 34, train_loss: 0.8423, test_loss: 1.0626, test_f1: 0.5527
 epoch: 35, train_loss: 0.8296, test_loss: 0.9577, test_f1: 0.4827
 epoch: 36, train_loss: 0.8207, test_loss: 1.1228, test_f1: 0.5066
 epoch: 37, train_loss: 0.8246, test_loss: 1.2444, test_f1: 0.5024
 epoch: 38, train_loss: 0.8115, test_loss: 1.1554, test_f1: 0.5336
 epoch: 39, train_loss: 0.8017, test_loss: 1.1520, test_f1: 0.5635
 epoch: 40, train_loss: 0.8041, test_loss: 1.1301, test_f1: 0.5788
 epoch: 41, train_loss: 0.8023, test_loss: 1.1378, test_f1: 0.5395
 epoch: 42, train_loss: 0.8092, test_loss: 1.0851, test_f1: 0.5503
 epoch: 43, train_loss: 0.8215, test_loss: 1.0191, test_f1: 0.5756
 epoch: 44, train_loss: 0.8137, test_loss: 1.1381, test_f1: 0.5066
 epoch: 45, train_loss: 0.7842, test_loss: 1.1856, test_f1: 0.5456
 epoch: 46, train_loss: 0.7936, test_loss: 1.2971, test_f1: 0.4978
 epoch: 47, train_loss: 0.8008, test_loss: 1.1722, test_f1: 0.5281
 epoch: 48, train_loss: 0.7898, test_loss: 1.1507, test_f1: 0.5417
 epoch: 49, train_loss: 0.7776, test_loss: 1.0863, test_f1: 0.5449
 epoch: 50, train_loss: 0.7865, test_loss: 1.1903, test_f1: 0.5798
 epoch: 51, train_loss: 0.7703, test_loss: 1.1884, test_f1: 0.5278
 epoch: 52, train_loss: 0.7357, test_loss: 1.1691, test_f1: 0.5347
 epoch: 53, train_loss: 0.7410, test_loss: 1.2234, test_f1: 0.5536
 epoch: 54, train_loss: 0.7378, test_loss: 1.1522, test_f1: 0.5504
 epoch: 55, train_loss: 0.7348, test_loss: 1.1634, test_f1: 0.5640
 epoch: 56, train_loss: 0.7197, test_loss: 1.1513, test_f1: 0.5623
 epoch: 57, train_loss: 0.7295, test_loss: 1.1662, test_f1: 0.5733
 epoch: 58, train_loss: 0.7190, test_loss: 1.2529, test_f1: 0.5677
 epoch: 59, train_loss: 0.7242, test_loss: 1.1595, test_f1: 0.5470
 epoch: 60, train_loss: 0.7053, test_loss: 1.2991, test_f1: 0.5616
 epoch: 61, train_loss: 0.7101, test_loss: 1.1664, test_f1: 0.5746
 epoch: 62, train_loss: 0.7114, test_loss: 1.1895, test_f1: 0.5669
 epoch: 63, train_loss: 0.7041, test_loss: 1.3377, test_f1: 0.5258
 epoch: 64, train_loss: 0.7135, test_loss: 1.1202, test_f1: 0.5903
 epoch: 65, train_loss: 0.6974, test_loss: 1.2101, test_f1: 0.5735
 epoch: 66, train_loss: 0.6996, test_loss: 1.1905, test_f1: 0.5738
 epoch: 67, train_loss: 0.7226, test_loss: 1.2238, test_f1: 0.5396
 epoch: 68, train_loss: 0.7006, test_loss: 1.3010, test_f1: 0.5322
 epoch: 69, train_loss: 0.7018, test_loss: 1.1902, test_f1: 0.5553
 epoch: 70, train_loss: 0.6910, test_loss: 1.2558, test_f1: 0.5868
 epoch: 71, train_loss: 0.6920, test_loss: 1.2090, test_f1: 0.5814
 epoch: 72, train_loss: 0.6832, test_loss: 1.2624, test_f1: 0.5730
 epoch: 73, train_loss: 0.6908, test_loss: 1.2651, test_f1: 0.5783
 epoch: 74, train_loss: 0.6780, test_loss: 1.2760, test_f1: 0.5725
 epoch: 75, train_loss: 0.6850, test_loss: 1.1917, test_f1: 0.5757
 epoch: 76, train_loss: 0.6920, test_loss: 1.4983, test_f1: 0.5305
 epoch: 77, train_loss: 0.6962, test_loss: 1.2008, test_f1: 0.5590
 epoch: 78, train_loss: 0.6771, test_loss: 1.2714, test_f1: 0.5585
 epoch: 79, train_loss: 0.6627, test_loss: 1.1976, test_f1: 0.5655
 epoch: 80, train_loss: 0.6787, test_loss: 1.5452, test_f1: 0.5521
 epoch: 81, train_loss: 0.6729, test_loss: 1.2852, test_f1: 0.5473
 epoch: 82, train_loss: 0.6609, test_loss: 1.3175, test_f1: 0.5632
 epoch: 83, train_loss: 0.6734, test_loss: 1.1171, test_f1: 0.5612
 epoch: 84, train_loss: 0.6578, test_loss: 1.3185, test_f1: 0.5484
 epoch: 85, train_loss: 0.6714, test_loss: 1.2574, test_f1: 0.5686
 epoch: 86, train_loss: 0.6661, test_loss: 1.3074, test_f1: 0.5565
 epoch: 87, train_loss: 0.6659, test_loss: 1.2951, test_f1: 0.5428
 epoch: 88, train_loss: 0.6437, test_loss: 1.2673, test_f1: 0.5786
 epoch: 89, train_loss: 0.6592, test_loss: 1.0791, test_f1: 0.5555
 epoch: 90, train_loss: 0.6512, test_loss: 1.3732, test_f1: 0.5312
 epoch: 91, train_loss: 0.6700, test_loss: 1.2744, test_f1: 0.5388
 epoch: 92, train_loss: 0.6405, test_loss: 1.2300, test_f1: 0.5534
 epoch: 93, train_loss: 0.6450, test_loss: 1.2846, test_f1: 0.5902
 epoch: 94, train_loss: 0.6475, test_loss: 1.4889, test_f1: 0.5240
 epoch: 95, train_loss: 0.6527, test_loss: 1.2394, test_f1: 0.5784
 epoch: 96, train_loss: 0.6278, test_loss: 1.2555, test_f1: 0.5745
 epoch: 97, train_loss: 0.6423, test_loss: 1.2855, test_f1: 0.5225
 epoch: 98, train_loss: 0.6281, test_loss: 1.3152, test_f1: 0.5601
 epoch: 99, train_loss: 0.6313, test_loss: 1.3166, test_f1: 0.5581
##################ITERATION #5 ****************************************
 epoch: 0, train_loss: 1.3362, test_loss: 1.2444, test_f1: 0.3690
 epoch: 1, train_loss: 1.2352, test_loss: 1.1853, test_f1: 0.4163
 epoch: 2, train_loss: 1.1937, test_loss: 1.1233, test_f1: 0.4367
 epoch: 3, train_loss: 1.1426, test_loss: 1.0413, test_f1: 0.4284
 epoch: 4, train_loss: 1.1042, test_loss: 0.9790, test_f1: 0.4673
 epoch: 5, train_loss: 1.0580, test_loss: 1.0463, test_f1: 0.4810
 epoch: 6, train_loss: 1.0310, test_loss: 0.9930, test_f1: 0.4504
 epoch: 7, train_loss: 1.0209, test_loss: 1.0400, test_f1: 0.5145
 epoch: 8, train_loss: 0.9987, test_loss: 1.0871, test_f1: 0.4172
 epoch: 9, train_loss: 0.9991, test_loss: 1.0266, test_f1: 0.4562
 epoch: 10, train_loss: 0.9844, test_loss: 0.9849, test_f1: 0.4651
 epoch: 11, train_loss: 0.9703, test_loss: 1.0061, test_f1: 0.4698
 epoch: 12, train_loss: 0.9608, test_loss: 1.0658, test_f1: 0.4806
 epoch: 13, train_loss: 0.9527, test_loss: 1.0448, test_f1: 0.4489
 epoch: 14, train_loss: 0.9418, test_loss: 1.0945, test_f1: 0.4707
 epoch: 15, train_loss: 0.9328, test_loss: 1.0242, test_f1: 0.4732
 epoch: 16, train_loss: 0.9173, test_loss: 1.0765, test_f1: 0.4595
 epoch: 17, train_loss: 0.9492, test_loss: 0.9921, test_f1: 0.4812
 epoch: 18, train_loss: 0.9249, test_loss: 1.0208, test_f1: 0.5184
 epoch: 19, train_loss: 0.9232, test_loss: 1.0000, test_f1: 0.4853
 epoch: 20, train_loss: 0.9044, test_loss: 0.9731, test_f1: 0.5143
 epoch: 21, train_loss: 0.9179, test_loss: 1.0254, test_f1: 0.5011
 epoch: 22, train_loss: 0.8929, test_loss: 1.0656, test_f1: 0.5024
 epoch: 23, train_loss: 0.8959, test_loss: 1.0763, test_f1: 0.5249
 epoch: 24, train_loss: 0.8870, test_loss: 1.0351, test_f1: 0.5098
 epoch: 25, train_loss: 0.8993, test_loss: 0.9797, test_f1: 0.5438
 epoch: 26, train_loss: 0.8997, test_loss: 0.9789, test_f1: 0.5193
 epoch: 27, train_loss: 0.8639, test_loss: 0.9918, test_f1: 0.5117
 epoch: 28, train_loss: 0.8671, test_loss: 0.9828, test_f1: 0.4926
 epoch: 29, train_loss: 0.8704, test_loss: 1.0310, test_f1: 0.5491
 epoch: 30, train_loss: 0.8612, test_loss: 1.0154, test_f1: 0.5257
 epoch: 31, train_loss: 0.8824, test_loss: 0.9748, test_f1: 0.5139
 epoch: 32, train_loss: 0.8576, test_loss: 0.9632, test_f1: 0.5552
 epoch: 33, train_loss: 0.8490, test_loss: 1.0246, test_f1: 0.5387
 epoch: 34, train_loss: 0.8719, test_loss: 1.0779, test_f1: 0.5040
 epoch: 35, train_loss: 0.9044, test_loss: 1.0277, test_f1: 0.5354
 epoch: 36, train_loss: 0.8757, test_loss: 1.0451, test_f1: 0.5205
 epoch: 37, train_loss: 0.8565, test_loss: 1.0563, test_f1: 0.5174
 epoch: 38, train_loss: 0.8478, test_loss: 1.1135, test_f1: 0.4734
 epoch: 39, train_loss: 0.8563, test_loss: 1.1144, test_f1: 0.5086
 epoch: 40, train_loss: 0.8410, test_loss: 1.0123, test_f1: 0.5407
 epoch: 41, train_loss: 0.8420, test_loss: 0.9784, test_f1: 0.5437
 epoch: 42, train_loss: 0.8377, test_loss: 1.1142, test_f1: 0.5406
 epoch: 43, train_loss: 0.8258, test_loss: 1.0542, test_f1: 0.5455
 epoch: 44, train_loss: 0.8199, test_loss: 0.9786, test_f1: 0.5423
 epoch: 45, train_loss: 0.8244, test_loss: 1.0377, test_f1: 0.5782
 epoch: 46, train_loss: 0.8199, test_loss: 1.0525, test_f1: 0.5430
 epoch: 47, train_loss: 0.8204, test_loss: 1.0130, test_f1: 0.5161
 epoch: 48, train_loss: 0.8149, test_loss: 1.0615, test_f1: 0.5075
 epoch: 49, train_loss: 0.8100, test_loss: 1.0196, test_f1: 0.5528
 epoch: 50, train_loss: 0.8148, test_loss: 1.0952, test_f1: 0.5516
 epoch: 51, train_loss: 0.7799, test_loss: 1.0626, test_f1: 0.5477
 epoch: 52, train_loss: 0.7670, test_loss: 1.0904, test_f1: 0.5191
 epoch: 53, train_loss: 0.7509, test_loss: 1.1078, test_f1: 0.5859
 epoch: 54, train_loss: 0.7612, test_loss: 1.0804, test_f1: 0.5578
 epoch: 55, train_loss: 0.7714, test_loss: 1.0905, test_f1: 0.5639
 epoch: 56, train_loss: 0.7456, test_loss: 1.1376, test_f1: 0.5656
 epoch: 57, train_loss: 0.7661, test_loss: 1.0803, test_f1: 0.5800
 epoch: 58, train_loss: 0.7539, test_loss: 1.0512, test_f1: 0.5719
 epoch: 59, train_loss: 0.7532, test_loss: 1.1041, test_f1: 0.5355
 epoch: 60, train_loss: 0.7362, test_loss: 1.1164, test_f1: 0.5701
 epoch: 61, train_loss: 0.7514, test_loss: 1.0863, test_f1: 0.5677
 epoch: 62, train_loss: 0.7321, test_loss: 1.2109, test_f1: 0.5461
 epoch: 63, train_loss: 0.7300, test_loss: 1.1901, test_f1: 0.5591
 epoch: 64, train_loss: 0.7375, test_loss: 1.1595, test_f1: 0.5543
 epoch: 65, train_loss: 0.7298, test_loss: 1.1892, test_f1: 0.5575
 epoch: 66, train_loss: 0.7208, test_loss: 1.6140, test_f1: 0.5354
 epoch: 67, train_loss: 0.7357, test_loss: 1.1413, test_f1: 0.5683
 epoch: 68, train_loss: 0.7249, test_loss: 1.1309, test_f1: 0.5900
 epoch: 69, train_loss: 0.7065, test_loss: 1.2143, test_f1: 0.5407
 epoch: 70, train_loss: 0.7154, test_loss: 1.1806, test_f1: 0.5692
 epoch: 71, train_loss: 0.7342, test_loss: 1.1133, test_f1: 0.5540
 epoch: 72, train_loss: 0.7100, test_loss: 1.1260, test_f1: 0.5573
 epoch: 73, train_loss: 0.7075, test_loss: 1.4332, test_f1: 0.5394
 epoch: 74, train_loss: 0.7078, test_loss: 1.3879, test_f1: 0.5237
 epoch: 75, train_loss: 0.7039, test_loss: 1.1131, test_f1: 0.5787
 epoch: 76, train_loss: 0.7191, test_loss: 1.1049, test_f1: 0.5629
 epoch: 77, train_loss: 0.6892, test_loss: 1.1749, test_f1: 0.5637
 epoch: 78, train_loss: 0.6955, test_loss: 1.2383, test_f1: 0.5540
 epoch: 79, train_loss: 0.6944, test_loss: 1.1709, test_f1: 0.5353
 epoch: 80, train_loss: 0.6919, test_loss: 1.1180, test_f1: 0.5604
 epoch: 81, train_loss: 0.6808, test_loss: 1.1886, test_f1: 0.5574
 epoch: 82, train_loss: 0.6984, test_loss: 1.1222, test_f1: 0.5930
 epoch: 83, train_loss: 0.6849, test_loss: 1.0777, test_f1: 0.5743
 epoch: 84, train_loss: 0.7145, test_loss: 1.1521, test_f1: 0.5602
 epoch: 85, train_loss: 0.6948, test_loss: 0.9914, test_f1: 0.5838
 epoch: 86, train_loss: 0.6782, test_loss: 1.0671, test_f1: 0.5871
 epoch: 87, train_loss: 0.6686, test_loss: 1.0628, test_f1: 0.5765
 epoch: 88, train_loss: 0.6831, test_loss: 1.0795, test_f1: 0.5744
 epoch: 89, train_loss: 0.6732, test_loss: 1.1091, test_f1: 0.6130
 epoch: 90, train_loss: 0.6747, test_loss: 1.0781, test_f1: 0.5897
 epoch: 91, train_loss: 0.6781, test_loss: 1.1252, test_f1: 0.5901
 epoch: 92, train_loss: 0.6677, test_loss: 1.1281, test_f1: 0.5779
 epoch: 93, train_loss: 0.6599, test_loss: 1.1046, test_f1: 0.5838
 epoch: 94, train_loss: 0.6531, test_loss: 1.1680, test_f1: 0.5726
 epoch: 95, train_loss: 0.6699, test_loss: 1.1230, test_f1: 0.5954
 epoch: 96, train_loss: 0.6573, test_loss: 1.1528, test_f1: 0.5955
 epoch: 97, train_loss: 0.6588, test_loss: 1.1486, test_f1: 0.5705
 epoch: 98, train_loss: 0.6820, test_loss: 1.1574, test_f1: 0.5591
 epoch: 99, train_loss: 0.6729, test_loss: 1.1363, test_f1: 0.5882
##################ITERATION #6 ****************************************
 epoch: 0, train_loss: 1.2950, test_loss: 1.2596, test_f1: 0.2576
 epoch: 1, train_loss: 1.2218, test_loss: 1.1652, test_f1: 0.3115
 epoch: 2, train_loss: 1.1909, test_loss: 1.1215, test_f1: 0.4056
 epoch: 3, train_loss: 1.1640, test_loss: 1.1281, test_f1: 0.3686
 epoch: 4, train_loss: 1.1435, test_loss: 1.0268, test_f1: 0.4789
 epoch: 5, train_loss: 1.0944, test_loss: 0.9942, test_f1: 0.4562
 epoch: 6, train_loss: 1.0747, test_loss: 1.0406, test_f1: 0.3952
 epoch: 7, train_loss: 1.0677, test_loss: 1.1149, test_f1: 0.4663
 epoch: 8, train_loss: 1.0502, test_loss: 1.0390, test_f1: 0.4679
 epoch: 9, train_loss: 1.0273, test_loss: 0.9985, test_f1: 0.4650
 epoch: 10, train_loss: 1.0139, test_loss: 1.0098, test_f1: 0.4803
 epoch: 11, train_loss: 1.0007, test_loss: 0.9790, test_f1: 0.4862
 epoch: 12, train_loss: 0.9876, test_loss: 1.0173, test_f1: 0.4796
 epoch: 13, train_loss: 0.9736, test_loss: 1.0122, test_f1: 0.5018
 epoch: 14, train_loss: 0.9805, test_loss: 1.0766, test_f1: 0.4975
 epoch: 15, train_loss: 0.9580, test_loss: 1.0101, test_f1: 0.5067
 epoch: 16, train_loss: 0.9465, test_loss: 1.0397, test_f1: 0.4978
 epoch: 17, train_loss: 0.9447, test_loss: 1.0376, test_f1: 0.4974
 epoch: 18, train_loss: 0.9491, test_loss: 0.9967, test_f1: 0.4957
 epoch: 19, train_loss: 0.9321, test_loss: 1.0797, test_f1: 0.4619
 epoch: 20, train_loss: 0.9255, test_loss: 1.0032, test_f1: 0.4931
 epoch: 21, train_loss: 0.9297, test_loss: 0.9509, test_f1: 0.4910
 epoch: 22, train_loss: 0.9300, test_loss: 1.0183, test_f1: 0.4603
 epoch: 23, train_loss: 0.9316, test_loss: 1.0831, test_f1: 0.4839
 epoch: 24, train_loss: 0.9088, test_loss: 0.9127, test_f1: 0.5052
 epoch: 25, train_loss: 0.9002, test_loss: 1.0372, test_f1: 0.4991
 epoch: 26, train_loss: 0.9096, test_loss: 1.0258, test_f1: 0.5100
 epoch: 27, train_loss: 0.9029, test_loss: 1.0205, test_f1: 0.4993
 epoch: 28, train_loss: 0.8895, test_loss: 0.9810, test_f1: 0.4993
 epoch: 29, train_loss: 0.8720, test_loss: 1.1065, test_f1: 0.4884
 epoch: 30, train_loss: 0.9057, test_loss: 1.0215, test_f1: 0.4963
 epoch: 31, train_loss: 0.8785, test_loss: 1.0904, test_f1: 0.5472
 epoch: 32, train_loss: 0.8856, test_loss: 1.2474, test_f1: 0.4823
 epoch: 33, train_loss: 0.8805, test_loss: 1.0269, test_f1: 0.5222
 epoch: 34, train_loss: 0.8603, test_loss: 0.9640, test_f1: 0.5610
 epoch: 35, train_loss: 0.8567, test_loss: 0.9950, test_f1: 0.5273
 epoch: 36, train_loss: 0.8639, test_loss: 1.0140, test_f1: 0.5521
 epoch: 37, train_loss: 0.8583, test_loss: 1.0558, test_f1: 0.5235
 epoch: 38, train_loss: 0.8561, test_loss: 1.0479, test_f1: 0.5115
 epoch: 39, train_loss: 0.8809, test_loss: 1.0248, test_f1: 0.5123
 epoch: 40, train_loss: 0.8584, test_loss: 1.1760, test_f1: 0.5017
 epoch: 41, train_loss: 0.8671, test_loss: 1.1596, test_f1: 0.4657
 epoch: 42, train_loss: 0.8662, test_loss: 1.0822, test_f1: 0.5320
 epoch: 43, train_loss: 0.8564, test_loss: 1.0180, test_f1: 0.5547
 epoch: 44, train_loss: 0.8356, test_loss: 1.2292, test_f1: 0.5247
 epoch: 45, train_loss: 0.8482, test_loss: 1.0626, test_f1: 0.5323
 epoch: 46, train_loss: 0.8571, test_loss: 1.3356, test_f1: 0.5144
 epoch: 47, train_loss: 0.8246, test_loss: 1.0885, test_f1: 0.5206
 epoch: 48, train_loss: 0.8245, test_loss: 1.0615, test_f1: 0.5199
 epoch: 49, train_loss: 0.8408, test_loss: 1.0358, test_f1: 0.5618
 epoch: 50, train_loss: 0.8307, test_loss: 1.1523, test_f1: 0.5305
 epoch: 51, train_loss: 0.7965, test_loss: 1.0809, test_f1: 0.5558
 epoch: 52, train_loss: 0.7853, test_loss: 1.0223, test_f1: 0.5863
 epoch: 53, train_loss: 0.7739, test_loss: 1.1082, test_f1: 0.5144
 epoch: 54, train_loss: 0.7632, test_loss: 1.1078, test_f1: 0.5748
 epoch: 55, train_loss: 0.7651, test_loss: 1.1009, test_f1: 0.5687
 epoch: 56, train_loss: 0.7676, test_loss: 1.1081, test_f1: 0.5250
 epoch: 57, train_loss: 0.7545, test_loss: 1.1303, test_f1: 0.5749
 epoch: 58, train_loss: 0.7732, test_loss: 1.1135, test_f1: 0.5696
 epoch: 59, train_loss: 0.7660, test_loss: 1.2176, test_f1: 0.5382
 epoch: 60, train_loss: 0.7577, test_loss: 1.0839, test_f1: 0.5752
 epoch: 61, train_loss: 0.7744, test_loss: 1.1622, test_f1: 0.5854
 epoch: 62, train_loss: 0.7806, test_loss: 1.0827, test_f1: 0.5888
 epoch: 63, train_loss: 0.7493, test_loss: 1.1861, test_f1: 0.5840
 epoch: 64, train_loss: 0.7490, test_loss: 1.1190, test_f1: 0.5720
 epoch: 65, train_loss: 0.7629, test_loss: 1.2078, test_f1: 0.5607
 epoch: 66, train_loss: 0.7521, test_loss: 1.2213, test_f1: 0.5603
 epoch: 67, train_loss: 0.7481, test_loss: 1.2245, test_f1: 0.5421
 epoch: 68, train_loss: 0.7408, test_loss: 1.1332, test_f1: 0.5616
 epoch: 69, train_loss: 0.7418, test_loss: 1.2263, test_f1: 0.5546
 epoch: 70, train_loss: 0.7288, test_loss: 1.1278, test_f1: 0.5489
 epoch: 71, train_loss: 0.7332, test_loss: 1.1022, test_f1: 0.5684
 epoch: 72, train_loss: 0.7423, test_loss: 1.2714, test_f1: 0.5648
 epoch: 73, train_loss: 0.7269, test_loss: 1.2012, test_f1: 0.5489
 epoch: 74, train_loss: 0.7095, test_loss: 1.2227, test_f1: 0.5642
 epoch: 75, train_loss: 0.7247, test_loss: 1.0355, test_f1: 0.5760
 epoch: 76, train_loss: 0.7138, test_loss: 1.1839, test_f1: 0.5467
 epoch: 77, train_loss: 0.7257, test_loss: 1.2996, test_f1: 0.5484
 epoch: 78, train_loss: 0.7142, test_loss: 1.2334, test_f1: 0.5523
 epoch: 79, train_loss: 0.7283, test_loss: 1.1673, test_f1: 0.5440
 epoch: 80, train_loss: 0.7267, test_loss: 1.1597, test_f1: 0.5756
 epoch: 81, train_loss: 0.7029, test_loss: 1.1454, test_f1: 0.5465
 epoch: 82, train_loss: 0.7247, test_loss: 1.2369, test_f1: 0.5386
 epoch: 83, train_loss: 0.7064, test_loss: 1.1919, test_f1: 0.5762
 epoch: 84, train_loss: 0.7104, test_loss: 1.1521, test_f1: 0.5766
 epoch: 85, train_loss: 0.6944, test_loss: 1.4081, test_f1: 0.5619
 epoch: 86, train_loss: 0.7130, test_loss: 1.1915, test_f1: 0.5638
 epoch: 87, train_loss: 0.7025, test_loss: 1.2926, test_f1: 0.5656
 epoch: 88, train_loss: 0.6961, test_loss: 1.2486, test_f1: 0.5789
 epoch: 89, train_loss: 0.7055, test_loss: 1.2687, test_f1: 0.5792
 epoch: 90, train_loss: 0.6959, test_loss: 1.2204, test_f1: 0.5816
 epoch: 91, train_loss: 0.6891, test_loss: 1.2553, test_f1: 0.5713
 epoch: 92, train_loss: 0.6808, test_loss: 1.2279, test_f1: 0.5729
 epoch: 93, train_loss: 0.6832, test_loss: 1.8228, test_f1: 0.5331
 epoch: 94, train_loss: 0.6966, test_loss: 1.6054, test_f1: 0.5532
 epoch: 95, train_loss: 0.6705, test_loss: 1.2147, test_f1: 0.5857
 epoch: 96, train_loss: 0.6908, test_loss: 1.3319, test_f1: 0.5668
 epoch: 97, train_loss: 0.6919, test_loss: 1.3133, test_f1: 0.5779
 epoch: 98, train_loss: 0.6716, test_loss: 1.2737, test_f1: 0.5893
 epoch: 99, train_loss: 0.6721, test_loss: 1.4893, test_f1: 0.5300
##################ITERATION #7 ****************************************
 epoch: 0, train_loss: 1.3062, test_loss: 1.2913, test_f1: 0.3149
 epoch: 1, train_loss: 1.2164, test_loss: 1.1424, test_f1: 0.4289
 epoch: 2, train_loss: 1.1460, test_loss: 1.0793, test_f1: 0.4304
 epoch: 3, train_loss: 1.1075, test_loss: 0.9998, test_f1: 0.4560
 epoch: 4, train_loss: 1.0769, test_loss: 1.0448, test_f1: 0.4750
 epoch: 5, train_loss: 1.0491, test_loss: 0.9442, test_f1: 0.4992
 epoch: 6, train_loss: 1.0129, test_loss: 0.9807, test_f1: 0.4860
 epoch: 7, train_loss: 1.0035, test_loss: 1.0433, test_f1: 0.4644
 epoch: 8, train_loss: 0.9982, test_loss: 0.9406, test_f1: 0.4952
 epoch: 9, train_loss: 0.9890, test_loss: 0.9435, test_f1: 0.4591
 epoch: 10, train_loss: 0.9572, test_loss: 0.9623, test_f1: 0.4848
 epoch: 11, train_loss: 0.9558, test_loss: 0.9221, test_f1: 0.4952
 epoch: 12, train_loss: 0.9672, test_loss: 1.0158, test_f1: 0.4737
 epoch: 13, train_loss: 0.9469, test_loss: 1.0187, test_f1: 0.5069
 epoch: 14, train_loss: 0.9621, test_loss: 1.0092, test_f1: 0.4831
 epoch: 15, train_loss: 0.9690, test_loss: 1.0957, test_f1: 0.4654
 epoch: 16, train_loss: 0.9451, test_loss: 0.9510, test_f1: 0.4875
 epoch: 17, train_loss: 0.9434, test_loss: 0.9925, test_f1: 0.4991
 epoch: 18, train_loss: 0.9199, test_loss: 1.0150, test_f1: 0.5019
 epoch: 19, train_loss: 0.9120, test_loss: 1.0249, test_f1: 0.4858
 epoch: 20, train_loss: 0.9226, test_loss: 0.9764, test_f1: 0.5011
 epoch: 21, train_loss: 0.9019, test_loss: 0.9452, test_f1: 0.5142
 epoch: 22, train_loss: 0.9139, test_loss: 1.0021, test_f1: 0.5053
 epoch: 23, train_loss: 0.9075, test_loss: 1.0476, test_f1: 0.4936
 epoch: 24, train_loss: 0.8873, test_loss: 0.9091, test_f1: 0.4984
 epoch: 25, train_loss: 0.8901, test_loss: 1.0283, test_f1: 0.4982
 epoch: 26, train_loss: 0.8704, test_loss: 0.9581, test_f1: 0.5019
 epoch: 27, train_loss: 0.8788, test_loss: 0.9475, test_f1: 0.5228
 epoch: 28, train_loss: 0.8797, test_loss: 1.0243, test_f1: 0.5159
 epoch: 29, train_loss: 0.8674, test_loss: 0.9551, test_f1: 0.5236
 epoch: 30, train_loss: 0.8650, test_loss: 0.9596, test_f1: 0.5469
 epoch: 31, train_loss: 0.8685, test_loss: 0.9767, test_f1: 0.5158
 epoch: 32, train_loss: 0.8662, test_loss: 0.9585, test_f1: 0.5180
 epoch: 33, train_loss: 0.8600, test_loss: 0.8859, test_f1: 0.5546
 epoch: 34, train_loss: 0.8768, test_loss: 0.9769, test_f1: 0.5280
 epoch: 35, train_loss: 0.8448, test_loss: 0.9813, test_f1: 0.5330
 epoch: 36, train_loss: 0.8549, test_loss: 0.9698, test_f1: 0.5032
 epoch: 37, train_loss: 0.8236, test_loss: 0.9793, test_f1: 0.5273
 epoch: 38, train_loss: 0.8474, test_loss: 0.9796, test_f1: 0.5178
 epoch: 39, train_loss: 0.8387, test_loss: 0.9738, test_f1: 0.5149
 epoch: 40, train_loss: 0.8533, test_loss: 1.0008, test_f1: 0.5193
 epoch: 41, train_loss: 0.8316, test_loss: 0.9413, test_f1: 0.5363
 epoch: 42, train_loss: 0.8226, test_loss: 0.9667, test_f1: 0.5382
 epoch: 43, train_loss: 0.8066, test_loss: 1.0456, test_f1: 0.4812
 epoch: 44, train_loss: 0.8245, test_loss: 0.9473, test_f1: 0.5566
 epoch: 45, train_loss: 0.8155, test_loss: 1.0468, test_f1: 0.5526
 epoch: 46, train_loss: 0.8258, test_loss: 1.1362, test_f1: 0.4892
 epoch: 47, train_loss: 0.8161, test_loss: 0.9809, test_f1: 0.5551
 epoch: 48, train_loss: 0.8081, test_loss: 0.9338, test_f1: 0.5354
 epoch: 49, train_loss: 0.8026, test_loss: 1.1793, test_f1: 0.5047
 epoch: 50, train_loss: 0.8189, test_loss: 1.0866, test_f1: 0.5558
 epoch: 51, train_loss: 0.7861, test_loss: 0.9739, test_f1: 0.5853
 epoch: 52, train_loss: 0.7703, test_loss: 0.9645, test_f1: 0.5605
 epoch: 53, train_loss: 0.7674, test_loss: 0.9869, test_f1: 0.5401
 epoch: 54, train_loss: 0.7533, test_loss: 0.9839, test_f1: 0.5588
 epoch: 55, train_loss: 0.7496, test_loss: 0.9324, test_f1: 0.5470
 epoch: 56, train_loss: 0.7458, test_loss: 1.0045, test_f1: 0.5520
 epoch: 57, train_loss: 0.7444, test_loss: 0.9977, test_f1: 0.5580
 epoch: 58, train_loss: 0.7355, test_loss: 0.9534, test_f1: 0.5511
 epoch: 59, train_loss: 0.7363, test_loss: 1.0570, test_f1: 0.5599
 epoch: 60, train_loss: 0.7346, test_loss: 0.9306, test_f1: 0.5747
 epoch: 61, train_loss: 0.7267, test_loss: 1.0125, test_f1: 0.5329
 epoch: 62, train_loss: 0.7309, test_loss: 1.0122, test_f1: 0.5604
 epoch: 63, train_loss: 0.7209, test_loss: 1.0547, test_f1: 0.5412
 epoch: 64, train_loss: 0.7165, test_loss: 1.1466, test_f1: 0.5323
 epoch: 65, train_loss: 0.7240, test_loss: 1.0122, test_f1: 0.5714
 epoch: 66, train_loss: 0.7128, test_loss: 0.9975, test_f1: 0.5697
 epoch: 67, train_loss: 0.7137, test_loss: 1.0143, test_f1: 0.5545
 epoch: 68, train_loss: 0.7260, test_loss: 0.9982, test_f1: 0.5621
 epoch: 69, train_loss: 0.7073, test_loss: 1.0004, test_f1: 0.5600
 epoch: 70, train_loss: 0.7177, test_loss: 1.0458, test_f1: 0.5626
 epoch: 71, train_loss: 0.7016, test_loss: 1.0214, test_f1: 0.5685
 epoch: 72, train_loss: 0.7044, test_loss: 1.0623, test_f1: 0.5767
 epoch: 73, train_loss: 0.7024, test_loss: 1.0682, test_f1: 0.5625
 epoch: 74, train_loss: 0.6965, test_loss: 1.0408, test_f1: 0.5606
 epoch: 75, train_loss: 0.6768, test_loss: 1.0415, test_f1: 0.5683
 epoch: 76, train_loss: 0.7018, test_loss: 1.0214, test_f1: 0.5823
 epoch: 77, train_loss: 0.6816, test_loss: 1.0521, test_f1: 0.5645
 epoch: 78, train_loss: 0.6853, test_loss: 1.2109, test_f1: 0.5463
 epoch: 79, train_loss: 0.6913, test_loss: 1.0090, test_f1: 0.5777
 epoch: 80, train_loss: 0.7030, test_loss: 1.0234, test_f1: 0.5921
 epoch: 81, train_loss: 0.6840, test_loss: 0.9765, test_f1: 0.5796
 epoch: 82, train_loss: 0.6814, test_loss: 1.1588, test_f1: 0.5388
 epoch: 83, train_loss: 0.6637, test_loss: 1.0640, test_f1: 0.5631
 epoch: 84, train_loss: 0.6786, test_loss: 1.1036, test_f1: 0.5697
 epoch: 85, train_loss: 0.6585, test_loss: 1.0525, test_f1: 0.5556
 epoch: 86, train_loss: 0.6907, test_loss: 1.0897, test_f1: 0.5937
 epoch: 87, train_loss: 0.6693, test_loss: 1.3457, test_f1: 0.5473
 epoch: 88, train_loss: 0.6762, test_loss: 1.0208, test_f1: 0.5752
 epoch: 89, train_loss: 0.6547, test_loss: 1.0431, test_f1: 0.5622
 epoch: 90, train_loss: 0.6480, test_loss: 1.1280, test_f1: 0.5492
 epoch: 91, train_loss: 0.6632, test_loss: 1.1013, test_f1: 0.5894
 epoch: 92, train_loss: 0.6601, test_loss: 1.0318, test_f1: 0.5923
 epoch: 93, train_loss: 0.6558, test_loss: 1.0708, test_f1: 0.5838
 epoch: 94, train_loss: 0.6472, test_loss: 1.2917, test_f1: 0.5287
 epoch: 95, train_loss: 0.6576, test_loss: 1.1659, test_f1: 0.5633
 epoch: 96, train_loss: 0.6480, test_loss: 1.1866, test_f1: 0.5672
 epoch: 97, train_loss: 0.6545, test_loss: 1.0697, test_f1: 0.5733
 epoch: 98, train_loss: 0.6353, test_loss: 1.0857, test_f1: 0.5681
 epoch: 99, train_loss: 0.6405, test_loss: 1.0661, test_f1: 0.5928
##################ITERATION #8 ****************************************
 epoch: 0, train_loss: 1.2942, test_loss: 1.2112, test_f1: 0.3507
 epoch: 1, train_loss: 1.1963, test_loss: 1.1206, test_f1: 0.4015
 epoch: 2, train_loss: 1.1307, test_loss: 1.0802, test_f1: 0.4403
 epoch: 3, train_loss: 1.0937, test_loss: 1.0668, test_f1: 0.4687
 epoch: 4, train_loss: 1.0453, test_loss: 0.9577, test_f1: 0.4783
 epoch: 5, train_loss: 1.0369, test_loss: 1.0213, test_f1: 0.4726
 epoch: 6, train_loss: 1.0239, test_loss: 1.0295, test_f1: 0.4651
 epoch: 7, train_loss: 1.0012, test_loss: 0.9204, test_f1: 0.4937
 epoch: 8, train_loss: 0.9886, test_loss: 1.0421, test_f1: 0.4567
 epoch: 9, train_loss: 0.9804, test_loss: 0.9883, test_f1: 0.4874
 epoch: 10, train_loss: 0.9540, test_loss: 0.9991, test_f1: 0.4859
 epoch: 11, train_loss: 0.9583, test_loss: 1.0319, test_f1: 0.4969
 epoch: 12, train_loss: 0.9507, test_loss: 0.9888, test_f1: 0.4706
 epoch: 13, train_loss: 0.9590, test_loss: 0.9753, test_f1: 0.4874
 epoch: 14, train_loss: 0.9439, test_loss: 1.0147, test_f1: 0.5005
 epoch: 15, train_loss: 0.9342, test_loss: 1.0409, test_f1: 0.4610
 epoch: 16, train_loss: 0.9324, test_loss: 1.0909, test_f1: 0.4414
 epoch: 17, train_loss: 0.9312, test_loss: 0.9917, test_f1: 0.4846
 epoch: 18, train_loss: 0.9113, test_loss: 0.9973, test_f1: 0.5045
 epoch: 19, train_loss: 0.9136, test_loss: 0.9690, test_f1: 0.5072
 epoch: 20, train_loss: 0.9107, test_loss: 0.9981, test_f1: 0.5153
 epoch: 21, train_loss: 0.9148, test_loss: 1.0041, test_f1: 0.5131
 epoch: 22, train_loss: 0.8950, test_loss: 0.9864, test_f1: 0.5265
 epoch: 23, train_loss: 0.9382, test_loss: 1.0373, test_f1: 0.5126
 epoch: 24, train_loss: 0.9129, test_loss: 0.9487, test_f1: 0.5018
 epoch: 25, train_loss: 0.9223, test_loss: 0.9753, test_f1: 0.4825
 epoch: 26, train_loss: 0.9009, test_loss: 0.9580, test_f1: 0.5137
 epoch: 27, train_loss: 0.8923, test_loss: 0.9865, test_f1: 0.5036
 epoch: 28, train_loss: 0.8760, test_loss: 0.9701, test_f1: 0.5247
 epoch: 29, train_loss: 0.8675, test_loss: 0.9560, test_f1: 0.5151
 epoch: 30, train_loss: 0.8737, test_loss: 0.9440, test_f1: 0.5235
 epoch: 31, train_loss: 0.8714, test_loss: 0.9623, test_f1: 0.5277
 epoch: 32, train_loss: 0.8552, test_loss: 0.9701, test_f1: 0.4960
 epoch: 33, train_loss: 0.8473, test_loss: 0.9860, test_f1: 0.5069
 epoch: 34, train_loss: 0.8669, test_loss: 0.9273, test_f1: 0.5290
 epoch: 35, train_loss: 0.8492, test_loss: 0.9329, test_f1: 0.5190
 epoch: 36, train_loss: 0.8490, test_loss: 1.0301, test_f1: 0.5275
 epoch: 37, train_loss: 0.8537, test_loss: 0.9725, test_f1: 0.5228
 epoch: 38, train_loss: 0.8362, test_loss: 1.0509, test_f1: 0.5273
 epoch: 39, train_loss: 0.8432, test_loss: 1.0189, test_f1: 0.5068
 epoch: 40, train_loss: 0.8345, test_loss: 0.9545, test_f1: 0.5181
 epoch: 41, train_loss: 0.8378, test_loss: 0.9549, test_f1: 0.5189
 epoch: 42, train_loss: 0.8484, test_loss: 0.9773, test_f1: 0.5244
 epoch: 43, train_loss: 0.8156, test_loss: 0.9630, test_f1: 0.5140
 epoch: 44, train_loss: 0.8315, test_loss: 0.9742, test_f1: 0.5288
 epoch: 45, train_loss: 0.8176, test_loss: 1.0513, test_f1: 0.5438
 epoch: 46, train_loss: 0.8324, test_loss: 0.9314, test_f1: 0.5491
 epoch: 47, train_loss: 0.8165, test_loss: 0.9019, test_f1: 0.5210
 epoch: 48, train_loss: 0.8254, test_loss: 1.0085, test_f1: 0.4912
 epoch: 49, train_loss: 0.8172, test_loss: 1.0047, test_f1: 0.5583
 epoch: 50, train_loss: 0.8105, test_loss: 1.0549, test_f1: 0.5171
 epoch: 51, train_loss: 0.7941, test_loss: 0.8949, test_f1: 0.5471
 epoch: 52, train_loss: 0.7800, test_loss: 0.9806, test_f1: 0.5763
 epoch: 53, train_loss: 0.7820, test_loss: 0.9304, test_f1: 0.5353
 epoch: 54, train_loss: 0.7614, test_loss: 1.1414, test_f1: 0.5451
 epoch: 55, train_loss: 0.7521, test_loss: 0.9390, test_f1: 0.5701
 epoch: 56, train_loss: 0.7662, test_loss: 1.0432, test_f1: 0.5574
 epoch: 57, train_loss: 0.7573, test_loss: 0.9156, test_f1: 0.5595
 epoch: 58, train_loss: 0.7626, test_loss: 1.0512, test_f1: 0.5569
 epoch: 59, train_loss: 0.7517, test_loss: 0.9489, test_f1: 0.5449
 epoch: 60, train_loss: 0.7486, test_loss: 1.0122, test_f1: 0.5297
 epoch: 61, train_loss: 0.7486, test_loss: 1.0793, test_f1: 0.5616
 epoch: 62, train_loss: 0.7537, test_loss: 0.9584, test_f1: 0.5448
 epoch: 63, train_loss: 0.7594, test_loss: 0.9268, test_f1: 0.5789
 epoch: 64, train_loss: 0.7367, test_loss: 0.9586, test_f1: 0.5835
 epoch: 65, train_loss: 0.7433, test_loss: 1.0087, test_f1: 0.5789
 epoch: 66, train_loss: 0.7325, test_loss: 0.9378, test_f1: 0.5818
 epoch: 67, train_loss: 0.7396, test_loss: 0.9132, test_f1: 0.5684
 epoch: 68, train_loss: 0.7418, test_loss: 0.9663, test_f1: 0.5652
 epoch: 69, train_loss: 0.7204, test_loss: 1.1174, test_f1: 0.5487
 epoch: 70, train_loss: 0.7334, test_loss: 0.9350, test_f1: 0.5766
 epoch: 71, train_loss: 0.7288, test_loss: 0.9913, test_f1: 0.5366
 epoch: 72, train_loss: 0.7279, test_loss: 0.9456, test_f1: 0.5823
 epoch: 73, train_loss: 0.7249, test_loss: 0.9373, test_f1: 0.5740
 epoch: 74, train_loss: 0.7368, test_loss: 0.9532, test_f1: 0.5791
 epoch: 75, train_loss: 0.7193, test_loss: 0.9615, test_f1: 0.5619
 epoch: 76, train_loss: 0.7109, test_loss: 1.0502, test_f1: 0.5591
 epoch: 77, train_loss: 0.7261, test_loss: 1.1424, test_f1: 0.5374
 epoch: 78, train_loss: 0.7108, test_loss: 1.0093, test_f1: 0.5301
 epoch: 79, train_loss: 0.7025, test_loss: 1.0096, test_f1: 0.5835
 epoch: 80, train_loss: 0.7079, test_loss: 1.0158, test_f1: 0.5649
 epoch: 81, train_loss: 0.7023, test_loss: 0.9633, test_f1: 0.5637
 epoch: 82, train_loss: 0.6894, test_loss: 0.9261, test_f1: 0.5812
 epoch: 83, train_loss: 0.7044, test_loss: 0.9369, test_f1: 0.5906
 epoch: 84, train_loss: 0.7054, test_loss: 0.9310, test_f1: 0.5456
 epoch: 85, train_loss: 0.6996, test_loss: 0.9350, test_f1: 0.5717
 epoch: 86, train_loss: 0.6846, test_loss: 0.9378, test_f1: 0.5943
 epoch: 87, train_loss: 0.6870, test_loss: 0.9867, test_f1: 0.5559
 epoch: 88, train_loss: 0.6858, test_loss: 0.9215, test_f1: 0.6073
 epoch: 89, train_loss: 0.7256, test_loss: 0.9933, test_f1: 0.5626
 epoch: 90, train_loss: 0.7064, test_loss: 0.9968, test_f1: 0.5768
 epoch: 91, train_loss: 0.6877, test_loss: 0.9695, test_f1: 0.5805
 epoch: 92, train_loss: 0.6790, test_loss: 1.0517, test_f1: 0.5677
 epoch: 93, train_loss: 0.6935, test_loss: 1.1212, test_f1: 0.5717
 epoch: 94, train_loss: 0.7012, test_loss: 0.9451, test_f1: 0.5850
 epoch: 95, train_loss: 0.6849, test_loss: 1.0006, test_f1: 0.5698
 epoch: 96, train_loss: 0.6830, test_loss: 1.0227, test_f1: 0.6041
 epoch: 97, train_loss: 0.6845, test_loss: 0.9893, test_f1: 0.5623
 epoch: 98, train_loss: 0.6821, test_loss: 0.9621, test_f1: 0.6044
 epoch: 99, train_loss: 0.6792, test_loss: 1.0224, test_f1: 0.5867
##################ITERATION #9 ****************************************
 epoch: 0, train_loss: 1.2878, test_loss: 1.2599, test_f1: 0.3566
 epoch: 1, train_loss: 1.2278, test_loss: 1.1372, test_f1: 0.4716
 epoch: 2, train_loss: 1.1694, test_loss: 1.1834, test_f1: 0.3900
 epoch: 3, train_loss: 1.1504, test_loss: 1.0361, test_f1: 0.5271
 epoch: 4, train_loss: 1.1088, test_loss: 1.0472, test_f1: 0.4289
 epoch: 5, train_loss: 1.0992, test_loss: 1.0230, test_f1: 0.4615
 epoch: 6, train_loss: 1.0645, test_loss: 0.9728, test_f1: 0.4570
 epoch: 7, train_loss: 1.0480, test_loss: 1.0366, test_f1: 0.4462
 epoch: 8, train_loss: 1.0361, test_loss: 0.9702, test_f1: 0.4673
 epoch: 9, train_loss: 1.0484, test_loss: 1.0720, test_f1: 0.4348
 epoch: 10, train_loss: 1.0403, test_loss: 0.9203, test_f1: 0.5207
 epoch: 11, train_loss: 1.0081, test_loss: 0.9463, test_f1: 0.4721
 epoch: 12, train_loss: 0.9885, test_loss: 0.9976, test_f1: 0.4604
 epoch: 13, train_loss: 0.9766, test_loss: 0.9761, test_f1: 0.5005
 epoch: 14, train_loss: 0.9722, test_loss: 0.9815, test_f1: 0.4600
 epoch: 15, train_loss: 0.9617, test_loss: 1.0202, test_f1: 0.5002
 epoch: 16, train_loss: 0.9643, test_loss: 0.9942, test_f1: 0.4782
 epoch: 17, train_loss: 0.9511, test_loss: 1.0038, test_f1: 0.4860
 epoch: 18, train_loss: 0.9432, test_loss: 1.0288, test_f1: 0.4551
 epoch: 19, train_loss: 0.9491, test_loss: 0.9899, test_f1: 0.4731
 epoch: 20, train_loss: 0.9354, test_loss: 0.9928, test_f1: 0.5419
 epoch: 21, train_loss: 0.9329, test_loss: 0.9887, test_f1: 0.5118
 epoch: 22, train_loss: 0.9128, test_loss: 0.9486, test_f1: 0.5150
 epoch: 23, train_loss: 0.9293, test_loss: 0.9875, test_f1: 0.5124
 epoch: 24, train_loss: 0.9347, test_loss: 0.9832, test_f1: 0.5210
 epoch: 25, train_loss: 0.9239, test_loss: 0.9833, test_f1: 0.4992
 epoch: 26, train_loss: 0.9174, test_loss: 1.0110, test_f1: 0.5187
 epoch: 27, train_loss: 0.9143, test_loss: 0.9541, test_f1: 0.5385
 epoch: 28, train_loss: 0.9020, test_loss: 1.1877, test_f1: 0.4903
 epoch: 29, train_loss: 0.9268, test_loss: 0.9613, test_f1: 0.5202
 epoch: 30, train_loss: 0.8988, test_loss: 0.9546, test_f1: 0.5378
 epoch: 31, train_loss: 0.8785, test_loss: 0.9713, test_f1: 0.5274
 epoch: 32, train_loss: 0.9045, test_loss: 0.9406, test_f1: 0.5327
 epoch: 33, train_loss: 0.9157, test_loss: 1.0181, test_f1: 0.5117
 epoch: 34, train_loss: 0.9191, test_loss: 0.9517, test_f1: 0.5404
 epoch: 35, train_loss: 0.8931, test_loss: 0.9464, test_f1: 0.5428
 epoch: 36, train_loss: 0.8806, test_loss: 0.9530, test_f1: 0.5273
 epoch: 37, train_loss: 0.8774, test_loss: 0.9715, test_f1: 0.5302
 epoch: 38, train_loss: 0.8703, test_loss: 0.9656, test_f1: 0.5414
 epoch: 39, train_loss: 0.8718, test_loss: 0.9663, test_f1: 0.5342
 epoch: 40, train_loss: 0.8572, test_loss: 0.9599, test_f1: 0.5310
 epoch: 41, train_loss: 0.8438, test_loss: 0.9400, test_f1: 0.5434
 epoch: 42, train_loss: 0.8575, test_loss: 0.9685, test_f1: 0.5430
 epoch: 43, train_loss: 0.8568, test_loss: 0.9705, test_f1: 0.5350
 epoch: 44, train_loss: 0.8599, test_loss: 0.9842, test_f1: 0.5253
 epoch: 45, train_loss: 0.8461, test_loss: 0.9520, test_f1: 0.5354
 epoch: 46, train_loss: 0.8591, test_loss: 1.0216, test_f1: 0.5260
 epoch: 47, train_loss: 0.8514, test_loss: 1.0097, test_f1: 0.5463
 epoch: 48, train_loss: 0.8422, test_loss: 0.9782, test_f1: 0.5420
 epoch: 49, train_loss: 0.8243, test_loss: 0.9406, test_f1: 0.5474
 epoch: 50, train_loss: 0.8258, test_loss: 0.9245, test_f1: 0.5370
 epoch: 51, train_loss: 0.7978, test_loss: 0.9385, test_f1: 0.5470
 epoch: 52, train_loss: 0.7976, test_loss: 0.9330, test_f1: 0.5470
 epoch: 53, train_loss: 0.7739, test_loss: 0.9695, test_f1: 0.5528
 epoch: 54, train_loss: 0.7753, test_loss: 0.9660, test_f1: 0.5530
 epoch: 55, train_loss: 0.7799, test_loss: 0.9260, test_f1: 0.5716
 epoch: 56, train_loss: 0.7709, test_loss: 0.9595, test_f1: 0.5599
 epoch: 57, train_loss: 0.7833, test_loss: 0.9629, test_f1: 0.5645
 epoch: 58, train_loss: 0.7787, test_loss: 0.9888, test_f1: 0.5553
 epoch: 59, train_loss: 0.7691, test_loss: 0.9222, test_f1: 0.5670
 epoch: 60, train_loss: 0.7770, test_loss: 0.9237, test_f1: 0.5588
 epoch: 61, train_loss: 0.7469, test_loss: 1.0134, test_f1: 0.5384
 epoch: 62, train_loss: 0.7639, test_loss: 0.9725, test_f1: 0.5512
 epoch: 63, train_loss: 0.7660, test_loss: 1.0220, test_f1: 0.5595
 epoch: 64, train_loss: 0.7611, test_loss: 0.9918, test_f1: 0.5294
 epoch: 65, train_loss: 0.7408, test_loss: 1.0031, test_f1: 0.5413
 epoch: 66, train_loss: 0.7587, test_loss: 0.9825, test_f1: 0.5564
 epoch: 67, train_loss: 0.7493, test_loss: 0.9954, test_f1: 0.5555
 epoch: 68, train_loss: 0.7611, test_loss: 0.9977, test_f1: 0.5679
 epoch: 69, train_loss: 0.7469, test_loss: 1.0276, test_f1: 0.5430
 epoch: 70, train_loss: 0.7396, test_loss: 0.9690, test_f1: 0.5514
 epoch: 71, train_loss: 0.7411, test_loss: 0.9960, test_f1: 0.5283
 epoch: 72, train_loss: 0.7443, test_loss: 0.9714, test_f1: 0.5827
 epoch: 73, train_loss: 0.7380, test_loss: 0.9637, test_f1: 0.5596
 epoch: 74, train_loss: 0.7296, test_loss: 0.9770, test_f1: 0.5509
 epoch: 75, train_loss: 0.7307, test_loss: 1.0303, test_f1: 0.5579
 epoch: 76, train_loss: 0.7558, test_loss: 0.9336, test_f1: 0.5709
 epoch: 77, train_loss: 0.7425, test_loss: 1.0320, test_f1: 0.5331
 epoch: 78, train_loss: 0.7163, test_loss: 1.0187, test_f1: 0.5558
 epoch: 79, train_loss: 0.7282, test_loss: 0.9842, test_f1: 0.5822
 epoch: 80, train_loss: 0.7483, test_loss: 1.0622, test_f1: 0.5704
 epoch: 81, train_loss: 0.7244, test_loss: 1.0379, test_f1: 0.5491
 epoch: 82, train_loss: 0.7129, test_loss: 1.0302, test_f1: 0.5609
 epoch: 83, train_loss: 0.7082, test_loss: 1.0099, test_f1: 0.5764
 epoch: 84, train_loss: 0.7175, test_loss: 1.0324, test_f1: 0.5527
 epoch: 85, train_loss: 0.7311, test_loss: 1.0070, test_f1: 0.5632
 epoch: 86, train_loss: 0.7067, test_loss: 1.1172, test_f1: 0.5463
 epoch: 87, train_loss: 0.7355, test_loss: 1.0610, test_f1: 0.5470
 epoch: 88, train_loss: 0.7072, test_loss: 0.9811, test_f1: 0.5552
 epoch: 89, train_loss: 0.7147, test_loss: 1.0410, test_f1: 0.5176
 epoch: 90, train_loss: 0.7216, test_loss: 1.0175, test_f1: 0.5369
 epoch: 91, train_loss: 0.7041, test_loss: 0.9928, test_f1: 0.5733
 epoch: 92, train_loss: 0.6875, test_loss: 1.0700, test_f1: 0.5541
 epoch: 93, train_loss: 0.7114, test_loss: 0.9649, test_f1: 0.5522
 epoch: 94, train_loss: 0.7074, test_loss: 1.0625, test_f1: 0.5741
 epoch: 95, train_loss: 0.7072, test_loss: 1.0130, test_f1: 0.5715
 epoch: 96, train_loss: 0.6959, test_loss: 1.0503, test_f1: 0.5517
 epoch: 97, train_loss: 0.6864, test_loss: 1.0700, test_f1: 0.5920
 epoch: 98, train_loss: 0.6940, test_loss: 1.0027, test_f1: 0.5669
 epoch: 99, train_loss: 0.6828, test_loss: 1.1116, test_f1: 0.5447

Training completed in 741.49 seconds
Best F1: 0.6130 at epoch 89
Mean F1 across iterations: 0.5979  0.0114
========================FINAL RESULTS================================
FEGIN weighted F1: 0.6130  0.0114
python main.py --data ltspice_examples --representation component_component --model FEGIN --layers 5 --hiddens 32 --batch_size 64 --lr 0.01 --emb_size 250 --epochs 100 --save_appendix component_component_L5_H32_BS64_LR0.01_E250 --no_val
-----



STDERR:
  File "main.py", line 370, in <module>
    main()
  File "main.py", line 254, in main
    dataset = dataset_class(
  File "/home/philip/projects/ltspice_examples_code_repo/Circuit-Completion-Using-GNNs/component_classification_with_link_prediction_head/evaluation/FEGIN/kernel/circuit_datasets.py", line 15, in __init__
    self.data, self.slices = torch.load(self.processed_paths[0])
  File "/home/philip/.local/lib/python3.8/site-packages/torch/serialization.py", line 1040, in load
    warnings.warn(
  File "/usr/lib/python3.8/warnings.py", line 109, in _showwarnmsg
    sw(msg.message, msg.category, msg.filename, msg.lineno,
  File "main.py", line 47, in warn_with_traceback
    traceback.print_stack(file=log)
/home/philip/projects/ltspice_examples_code_repo/Circuit-Completion-Using-GNNs/component_classification_with_link_prediction_head/evaluation/FEGIN/kernel/circuit_datasets.py:15: FutureWarning: You are using `torch.load` with `weights_only=False` (the current default value), which uses the default pickle module implicitly. It is possible to construct malicious pickle data which will execute arbitrary code during unpickling (See https://github.com/pytorch/pytorch/blob/main/SECURITY.md#untrusted-models for more details). In a future release, the default value for `weights_only` will be flipped to `True`. This limits the functions that could be executed during unpickling. Arbitrary objects will no longer be allowed to be loaded via this mode unless they are explicitly allowlisted by the user via `torch.serialization.add_safe_globals`. We recommend you start setting `weights_only=True` for any use case where you don't have full control of the loaded file. Please open an issue on GitHub for any issues related to this experimental feature.
  self.data, self.slices = torch.load(self.processed_paths[0])
