STDOUT:
Results will be saved in /home/philip/projects/ltspice_examples_code_repo/Circuit-Completion-Using-GNNs/component_classification_with_link_prediction_head/evaluation/FEGIN/results/model_FEGIN_dataset_ltspice_examples
Command line input: python main.py --data ltspice_examples --representation component_net --model FEGIN --layers 3 --hiddens 32 --batch_size 64 --lr 0.001 --emb_size 128 --epochs 100 --save_appendix component_net_L3_H32_BS64_LR0.001_E128 --no_val
 is saved.
-----
ltspice_examples - FEGIN
Using 3 layers, 32 hidden units, h = 2
Loading component_net representation dataset
ENTERED
Training FEGIN on component_net representation
Train: 3558, Test: 846
##################ITERATION #0 ****************************************
 epoch: 0, train_loss: 1.3121, test_loss: 1.2280, test_f1: 0.2360
 epoch: 1, train_loss: 1.1887, test_loss: 1.1318, test_f1: 0.3683
 epoch: 2, train_loss: 1.1156, test_loss: 1.0567, test_f1: 0.4489
 epoch: 3, train_loss: 1.0667, test_loss: 0.9956, test_f1: 0.4526
 epoch: 4, train_loss: 1.0063, test_loss: 0.9889, test_f1: 0.4590
 epoch: 5, train_loss: 0.9831, test_loss: 0.9543, test_f1: 0.5122
 epoch: 6, train_loss: 0.9624, test_loss: 1.0068, test_f1: 0.4659
 epoch: 7, train_loss: 0.9586, test_loss: 0.9494, test_f1: 0.4798
 epoch: 8, train_loss: 0.9353, test_loss: 0.9318, test_f1: 0.5067
 epoch: 9, train_loss: 0.9187, test_loss: 0.9226, test_f1: 0.5151
 epoch: 10, train_loss: 0.9210, test_loss: 0.9431, test_f1: 0.5118
 epoch: 11, train_loss: 0.9170, test_loss: 0.9243, test_f1: 0.5225
 epoch: 12, train_loss: 0.9007, test_loss: 0.9325, test_f1: 0.5121
 epoch: 13, train_loss: 0.8848, test_loss: 0.9347, test_f1: 0.5253
 epoch: 14, train_loss: 0.8898, test_loss: 0.9326, test_f1: 0.5414
 epoch: 15, train_loss: 0.8840, test_loss: 0.9484, test_f1: 0.5347
 epoch: 16, train_loss: 0.8624, test_loss: 0.9260, test_f1: 0.5357
 epoch: 17, train_loss: 0.8711, test_loss: 0.9415, test_f1: 0.5205
 epoch: 18, train_loss: 0.8624, test_loss: 0.9549, test_f1: 0.5118
 epoch: 19, train_loss: 0.8563, test_loss: 0.9176, test_f1: 0.5433
 epoch: 20, train_loss: 0.8502, test_loss: 0.9457, test_f1: 0.5227
 epoch: 21, train_loss: 0.8432, test_loss: 0.9416, test_f1: 0.5750
 epoch: 22, train_loss: 0.8276, test_loss: 0.9443, test_f1: 0.5750
 epoch: 23, train_loss: 0.8346, test_loss: 0.9491, test_f1: 0.5490
 epoch: 24, train_loss: 0.8203, test_loss: 0.9737, test_f1: 0.5409
 epoch: 25, train_loss: 0.8168, test_loss: 1.0052, test_f1: 0.5323
 epoch: 26, train_loss: 0.8106, test_loss: 0.9345, test_f1: 0.5682
 epoch: 27, train_loss: 0.7988, test_loss: 0.9585, test_f1: 0.5365
 epoch: 28, train_loss: 0.7972, test_loss: 0.9347, test_f1: 0.5783
 epoch: 29, train_loss: 0.8000, test_loss: 0.9621, test_f1: 0.5213
 epoch: 30, train_loss: 0.8011, test_loss: 0.9643, test_f1: 0.5673
 epoch: 31, train_loss: 0.8005, test_loss: 0.9966, test_f1: 0.5272
 epoch: 32, train_loss: 0.7808, test_loss: 0.9426, test_f1: 0.5970
 epoch: 33, train_loss: 0.7868, test_loss: 0.9971, test_f1: 0.5340
 epoch: 34, train_loss: 0.7782, test_loss: 0.9794, test_f1: 0.5220
 epoch: 35, train_loss: 0.7710, test_loss: 0.9611, test_f1: 0.5618
 epoch: 36, train_loss: 0.7738, test_loss: 0.9953, test_f1: 0.5562
 epoch: 37, train_loss: 0.7683, test_loss: 0.9585, test_f1: 0.5578
 epoch: 38, train_loss: 0.7657, test_loss: 0.9417, test_f1: 0.5871
 epoch: 39, train_loss: 0.7657, test_loss: 0.9519, test_f1: 0.5763
 epoch: 40, train_loss: 0.7586, test_loss: 0.9622, test_f1: 0.5797
 epoch: 41, train_loss: 0.7505, test_loss: 0.9642, test_f1: 0.5694
 epoch: 42, train_loss: 0.7458, test_loss: 0.9692, test_f1: 0.5229
 epoch: 43, train_loss: 0.7430, test_loss: 0.9552, test_f1: 0.6169
 epoch: 44, train_loss: 0.7437, test_loss: 0.9750, test_f1: 0.5537
 epoch: 45, train_loss: 0.7359, test_loss: 0.9260, test_f1: 0.5695
 epoch: 46, train_loss: 0.7332, test_loss: 0.9721, test_f1: 0.6105
 epoch: 47, train_loss: 0.7261, test_loss: 1.0187, test_f1: 0.5863
 epoch: 48, train_loss: 0.7141, test_loss: 1.0298, test_f1: 0.5566
 epoch: 49, train_loss: 0.7138, test_loss: 0.9008, test_f1: 0.6193
 epoch: 50, train_loss: 0.7146, test_loss: 0.9540, test_f1: 0.6014
 epoch: 51, train_loss: 0.6910, test_loss: 0.9676, test_f1: 0.6036
 epoch: 52, train_loss: 0.6818, test_loss: 0.9469, test_f1: 0.6329
 epoch: 53, train_loss: 0.6703, test_loss: 0.9864, test_f1: 0.6145
 epoch: 54, train_loss: 0.6667, test_loss: 0.9696, test_f1: 0.5964
 epoch: 55, train_loss: 0.6604, test_loss: 0.9767, test_f1: 0.6260
 epoch: 56, train_loss: 0.6725, test_loss: 0.9511, test_f1: 0.6089
 epoch: 57, train_loss: 0.6750, test_loss: 0.9829, test_f1: 0.5984
 epoch: 58, train_loss: 0.6737, test_loss: 0.9838, test_f1: 0.6352
 epoch: 59, train_loss: 0.6761, test_loss: 0.9900, test_f1: 0.6496
 epoch: 60, train_loss: 0.6579, test_loss: 0.9748, test_f1: 0.6022
 epoch: 61, train_loss: 0.6633, test_loss: 0.9786, test_f1: 0.6174
 epoch: 62, train_loss: 0.6463, test_loss: 0.9476, test_f1: 0.6153
 epoch: 63, train_loss: 0.6415, test_loss: 0.9642, test_f1: 0.6485
 epoch: 64, train_loss: 0.6663, test_loss: 0.9975, test_f1: 0.5987
 epoch: 65, train_loss: 0.6591, test_loss: 1.0156, test_f1: 0.5992
 epoch: 66, train_loss: 0.6593, test_loss: 1.0149, test_f1: 0.6139
 epoch: 67, train_loss: 0.6569, test_loss: 0.9770, test_f1: 0.5994
 epoch: 68, train_loss: 0.6392, test_loss: 0.9908, test_f1: 0.6099
 epoch: 69, train_loss: 0.6480, test_loss: 1.0416, test_f1: 0.6400
 epoch: 70, train_loss: 0.6283, test_loss: 0.9529, test_f1: 0.6292
 epoch: 71, train_loss: 0.6508, test_loss: 0.9490, test_f1: 0.6348
 epoch: 72, train_loss: 0.6267, test_loss: 1.0082, test_f1: 0.6444
 epoch: 73, train_loss: 0.6324, test_loss: 1.0036, test_f1: 0.6091
 epoch: 74, train_loss: 0.6492, test_loss: 0.9652, test_f1: 0.6301
 epoch: 75, train_loss: 0.6257, test_loss: 0.9785, test_f1: 0.6262
 epoch: 76, train_loss: 0.6260, test_loss: 0.9715, test_f1: 0.6271
 epoch: 77, train_loss: 0.6173, test_loss: 0.9838, test_f1: 0.6252
 epoch: 78, train_loss: 0.6201, test_loss: 0.9932, test_f1: 0.6036
 epoch: 79, train_loss: 0.6293, test_loss: 1.0036, test_f1: 0.6309
 epoch: 80, train_loss: 0.6057, test_loss: 1.0382, test_f1: 0.6276
 epoch: 81, train_loss: 0.6186, test_loss: 0.9897, test_f1: 0.6390
 epoch: 82, train_loss: 0.6246, test_loss: 0.9947, test_f1: 0.6311
 epoch: 83, train_loss: 0.6023, test_loss: 1.0373, test_f1: 0.6375
 epoch: 84, train_loss: 0.6224, test_loss: 0.9968, test_f1: 0.6157
 epoch: 85, train_loss: 0.5961, test_loss: 1.0189, test_f1: 0.6539
 epoch: 86, train_loss: 0.6176, test_loss: 0.9809, test_f1: 0.6250
 epoch: 87, train_loss: 0.6044, test_loss: 1.0472, test_f1: 0.6188
 epoch: 88, train_loss: 0.6135, test_loss: 0.9810, test_f1: 0.6370
 epoch: 89, train_loss: 0.6058, test_loss: 0.9889, test_f1: 0.6304
 epoch: 90, train_loss: 0.6146, test_loss: 0.9828, test_f1: 0.6127
 epoch: 91, train_loss: 0.5927, test_loss: 0.9950, test_f1: 0.6617
 epoch: 92, train_loss: 0.5858, test_loss: 1.0247, test_f1: 0.6473
 epoch: 93, train_loss: 0.5870, test_loss: 1.0047, test_f1: 0.6536
 epoch: 94, train_loss: 0.6021, test_loss: 1.0054, test_f1: 0.6450
 epoch: 95, train_loss: 0.5924, test_loss: 1.0310, test_f1: 0.6128
 epoch: 96, train_loss: 0.5896, test_loss: 0.9801, test_f1: 0.6188
 epoch: 97, train_loss: 0.6014, test_loss: 0.9865, test_f1: 0.6072
 epoch: 98, train_loss: 0.5785, test_loss: 1.0525, test_f1: 0.6199
 epoch: 99, train_loss: 0.5763, test_loss: 1.0457, test_f1: 0.6262
##################ITERATION #1 ****************************************
 epoch: 0, train_loss: 1.2088, test_loss: 1.1390, test_f1: 0.3733
 epoch: 1, train_loss: 1.0829, test_loss: 1.0047, test_f1: 0.4632
 epoch: 2, train_loss: 1.0191, test_loss: 0.9782, test_f1: 0.4696
 epoch: 3, train_loss: 0.9896, test_loss: 0.9814, test_f1: 0.4914
 epoch: 4, train_loss: 0.9673, test_loss: 0.9263, test_f1: 0.4881
 epoch: 5, train_loss: 0.9548, test_loss: 0.9656, test_f1: 0.4666
 epoch: 6, train_loss: 0.9378, test_loss: 0.9551, test_f1: 0.5047
 epoch: 7, train_loss: 0.9387, test_loss: 0.9195, test_f1: 0.5031
 epoch: 8, train_loss: 0.9222, test_loss: 0.9121, test_f1: 0.5115
 epoch: 9, train_loss: 0.9199, test_loss: 0.9073, test_f1: 0.5141
 epoch: 10, train_loss: 0.9070, test_loss: 0.9149, test_f1: 0.5075
 epoch: 11, train_loss: 0.9077, test_loss: 0.8881, test_f1: 0.5364
 epoch: 12, train_loss: 0.8922, test_loss: 0.8849, test_f1: 0.5232
 epoch: 13, train_loss: 0.8816, test_loss: 0.9418, test_f1: 0.5145
 epoch: 14, train_loss: 0.8796, test_loss: 0.9004, test_f1: 0.5209
 epoch: 15, train_loss: 0.8792, test_loss: 1.0286, test_f1: 0.4577
 epoch: 16, train_loss: 0.8736, test_loss: 0.9166, test_f1: 0.5382
 epoch: 17, train_loss: 0.8616, test_loss: 0.8897, test_f1: 0.5333
 epoch: 18, train_loss: 0.8528, test_loss: 0.9682, test_f1: 0.5150
 epoch: 19, train_loss: 0.8629, test_loss: 0.9899, test_f1: 0.5039
 epoch: 20, train_loss: 0.8445, test_loss: 0.9173, test_f1: 0.5616
 epoch: 21, train_loss: 0.8527, test_loss: 0.9300, test_f1: 0.5302
 epoch: 22, train_loss: 0.8416, test_loss: 0.9570, test_f1: 0.5863
 epoch: 23, train_loss: 0.8300, test_loss: 0.8754, test_f1: 0.5313
 epoch: 24, train_loss: 0.8310, test_loss: 0.9295, test_f1: 0.5880
 epoch: 25, train_loss: 0.8293, test_loss: 0.9468, test_f1: 0.5584
 epoch: 26, train_loss: 0.8229, test_loss: 0.9879, test_f1: 0.5327
 epoch: 27, train_loss: 0.8105, test_loss: 0.9300, test_f1: 0.5822
 epoch: 28, train_loss: 0.8159, test_loss: 0.9458, test_f1: 0.5541
 epoch: 29, train_loss: 0.8129, test_loss: 0.9747, test_f1: 0.5120
 epoch: 30, train_loss: 0.8188, test_loss: 0.9714, test_f1: 0.5548
 epoch: 31, train_loss: 0.8089, test_loss: 0.8896, test_f1: 0.5683
 epoch: 32, train_loss: 0.7906, test_loss: 1.0621, test_f1: 0.5174
 epoch: 33, train_loss: 0.7990, test_loss: 0.9914, test_f1: 0.5608
 epoch: 34, train_loss: 0.7917, test_loss: 0.9457, test_f1: 0.5930
 epoch: 35, train_loss: 0.7963, test_loss: 0.9694, test_f1: 0.5586
 epoch: 36, train_loss: 0.7892, test_loss: 0.9558, test_f1: 0.5651
 epoch: 37, train_loss: 0.7856, test_loss: 0.9735, test_f1: 0.5473
 epoch: 38, train_loss: 0.7805, test_loss: 0.9682, test_f1: 0.5736
 epoch: 39, train_loss: 0.7746, test_loss: 0.9851, test_f1: 0.5778
 epoch: 40, train_loss: 0.7602, test_loss: 0.9779, test_f1: 0.6019
 epoch: 41, train_loss: 0.7580, test_loss: 0.9554, test_f1: 0.5707
 epoch: 42, train_loss: 0.7660, test_loss: 0.9750, test_f1: 0.5778
 epoch: 43, train_loss: 0.7670, test_loss: 1.0069, test_f1: 0.5705
 epoch: 44, train_loss: 0.7676, test_loss: 0.9811, test_f1: 0.5702
 epoch: 45, train_loss: 0.7539, test_loss: 1.0058, test_f1: 0.5615
 epoch: 46, train_loss: 0.7607, test_loss: 0.9930, test_f1: 0.5672
 epoch: 47, train_loss: 0.7590, test_loss: 0.9839, test_f1: 0.6179
 epoch: 48, train_loss: 0.7375, test_loss: 0.9968, test_f1: 0.6232
 epoch: 49, train_loss: 0.7353, test_loss: 1.0261, test_f1: 0.5926
 epoch: 50, train_loss: 0.7397, test_loss: 0.9760, test_f1: 0.5628
 epoch: 51, train_loss: 0.7194, test_loss: 0.9547, test_f1: 0.6026
 epoch: 52, train_loss: 0.7075, test_loss: 0.9690, test_f1: 0.6580
 epoch: 53, train_loss: 0.7119, test_loss: 0.9605, test_f1: 0.5857
 epoch: 54, train_loss: 0.7111, test_loss: 0.9573, test_f1: 0.6430
 epoch: 55, train_loss: 0.7058, test_loss: 0.9634, test_f1: 0.5965
 epoch: 56, train_loss: 0.7040, test_loss: 0.9669, test_f1: 0.6210
 epoch: 57, train_loss: 0.7007, test_loss: 0.9498, test_f1: 0.6403
 epoch: 58, train_loss: 0.6835, test_loss: 0.9552, test_f1: 0.6467
 epoch: 59, train_loss: 0.6951, test_loss: 0.9393, test_f1: 0.6657
 epoch: 60, train_loss: 0.6911, test_loss: 0.9309, test_f1: 0.5962
 epoch: 61, train_loss: 0.6963, test_loss: 0.9653, test_f1: 0.6341
 epoch: 62, train_loss: 0.6937, test_loss: 1.0014, test_f1: 0.6236
 epoch: 63, train_loss: 0.6843, test_loss: 0.9707, test_f1: 0.6210
 epoch: 64, train_loss: 0.6892, test_loss: 0.9789, test_f1: 0.6773
 epoch: 65, train_loss: 0.6830, test_loss: 0.9911, test_f1: 0.6007
 epoch: 66, train_loss: 0.6818, test_loss: 1.0365, test_f1: 0.6207
 epoch: 67, train_loss: 0.6823, test_loss: 0.9920, test_f1: 0.6330
 epoch: 68, train_loss: 0.6744, test_loss: 1.0105, test_f1: 0.5850
 epoch: 69, train_loss: 0.6884, test_loss: 0.9578, test_f1: 0.6343
 epoch: 70, train_loss: 0.6807, test_loss: 0.9695, test_f1: 0.5949
 epoch: 71, train_loss: 0.6802, test_loss: 0.9769, test_f1: 0.5947
 epoch: 72, train_loss: 0.6607, test_loss: 0.9573, test_f1: 0.6262
 epoch: 73, train_loss: 0.6630, test_loss: 1.0067, test_f1: 0.6244
 epoch: 74, train_loss: 0.6664, test_loss: 0.9801, test_f1: 0.6267
 epoch: 75, train_loss: 0.6670, test_loss: 1.0026, test_f1: 0.6105
 epoch: 76, train_loss: 0.6591, test_loss: 1.0068, test_f1: 0.6155
 epoch: 77, train_loss: 0.6511, test_loss: 1.0104, test_f1: 0.6154
 epoch: 78, train_loss: 0.6556, test_loss: 0.9777, test_f1: 0.6263
 epoch: 79, train_loss: 0.6515, test_loss: 1.0034, test_f1: 0.5956
 epoch: 80, train_loss: 0.6598, test_loss: 1.0041, test_f1: 0.6381
 epoch: 81, train_loss: 0.6479, test_loss: 1.0261, test_f1: 0.6097
 epoch: 82, train_loss: 0.6653, test_loss: 1.0294, test_f1: 0.6027
 epoch: 83, train_loss: 0.6524, test_loss: 0.9838, test_f1: 0.6426
 epoch: 84, train_loss: 0.6687, test_loss: 0.9970, test_f1: 0.6452
 epoch: 85, train_loss: 0.6337, test_loss: 1.0242, test_f1: 0.6300
 epoch: 86, train_loss: 0.6556, test_loss: 1.0426, test_f1: 0.6121
 epoch: 87, train_loss: 0.6468, test_loss: 1.0261, test_f1: 0.6108
 epoch: 88, train_loss: 0.6524, test_loss: 1.0207, test_f1: 0.6457
 epoch: 89, train_loss: 0.6582, test_loss: 1.0158, test_f1: 0.6156
 epoch: 90, train_loss: 0.6365, test_loss: 1.0214, test_f1: 0.6361
 epoch: 91, train_loss: 0.6413, test_loss: 0.9957, test_f1: 0.6553
 epoch: 92, train_loss: 0.6465, test_loss: 0.9614, test_f1: 0.6285
 epoch: 93, train_loss: 0.6299, test_loss: 1.0321, test_f1: 0.6387
 epoch: 94, train_loss: 0.6416, test_loss: 0.9941, test_f1: 0.6613
 epoch: 95, train_loss: 0.6244, test_loss: 1.0424, test_f1: 0.6149
 epoch: 96, train_loss: 0.6404, test_loss: 1.0371, test_f1: 0.6063
 epoch: 97, train_loss: 0.6301, test_loss: 1.0636, test_f1: 0.6458
 epoch: 98, train_loss: 0.6279, test_loss: 1.0188, test_f1: 0.6379
 epoch: 99, train_loss: 0.6150, test_loss: 1.0922, test_f1: 0.6375
##################ITERATION #2 ****************************************
 epoch: 0, train_loss: 1.1818, test_loss: 1.0918, test_f1: 0.3836
 epoch: 1, train_loss: 1.0309, test_loss: 0.9794, test_f1: 0.4623
 epoch: 2, train_loss: 0.9949, test_loss: 0.9449, test_f1: 0.5039
 epoch: 3, train_loss: 0.9660, test_loss: 0.9865, test_f1: 0.4737
 epoch: 4, train_loss: 0.9386, test_loss: 0.9144, test_f1: 0.5438
 epoch: 5, train_loss: 0.9190, test_loss: 0.9915, test_f1: 0.4793
 epoch: 6, train_loss: 0.9140, test_loss: 0.9428, test_f1: 0.5124
 epoch: 7, train_loss: 0.8955, test_loss: 0.9795, test_f1: 0.5017
 epoch: 8, train_loss: 0.8921, test_loss: 0.9123, test_f1: 0.5152
 epoch: 9, train_loss: 0.8707, test_loss: 0.9408, test_f1: 0.5049
 epoch: 10, train_loss: 0.8681, test_loss: 0.9839, test_f1: 0.5027
 epoch: 11, train_loss: 0.8588, test_loss: 0.9258, test_f1: 0.5264
 epoch: 12, train_loss: 0.8534, test_loss: 0.9273, test_f1: 0.5173
 epoch: 13, train_loss: 0.8483, test_loss: 0.9799, test_f1: 0.4936
 epoch: 14, train_loss: 0.8362, test_loss: 0.9185, test_f1: 0.5406
 epoch: 15, train_loss: 0.8286, test_loss: 0.9388, test_f1: 0.5288
 epoch: 16, train_loss: 0.8275, test_loss: 0.9321, test_f1: 0.5257
 epoch: 17, train_loss: 0.8182, test_loss: 0.9301, test_f1: 0.5356
 epoch: 18, train_loss: 0.8098, test_loss: 0.9176, test_f1: 0.5465
 epoch: 19, train_loss: 0.8071, test_loss: 0.8959, test_f1: 0.5498
 epoch: 20, train_loss: 0.8091, test_loss: 0.9206, test_f1: 0.5777
 epoch: 21, train_loss: 0.8067, test_loss: 0.9003, test_f1: 0.5956
 epoch: 22, train_loss: 0.7856, test_loss: 0.9142, test_f1: 0.5698
 epoch: 23, train_loss: 0.7915, test_loss: 0.9464, test_f1: 0.5357
 epoch: 24, train_loss: 0.7985, test_loss: 0.9422, test_f1: 0.5595
 epoch: 25, train_loss: 0.7952, test_loss: 0.8708, test_f1: 0.5728
 epoch: 26, train_loss: 0.7747, test_loss: 0.8907, test_f1: 0.5787
 epoch: 27, train_loss: 0.7490, test_loss: 0.9663, test_f1: 0.5505
 epoch: 28, train_loss: 0.7602, test_loss: 0.8964, test_f1: 0.5820
 epoch: 29, train_loss: 0.7578, test_loss: 0.9296, test_f1: 0.5907
 epoch: 30, train_loss: 0.7515, test_loss: 0.9471, test_f1: 0.5538
 epoch: 31, train_loss: 0.7483, test_loss: 0.8786, test_f1: 0.6039
 epoch: 32, train_loss: 0.7470, test_loss: 0.8744, test_f1: 0.6124
 epoch: 33, train_loss: 0.7413, test_loss: 0.8724, test_f1: 0.6172
 epoch: 34, train_loss: 0.7302, test_loss: 0.9051, test_f1: 0.5884
 epoch: 35, train_loss: 0.7227, test_loss: 0.9489, test_f1: 0.5661
 epoch: 36, train_loss: 0.7320, test_loss: 1.0062, test_f1: 0.5573
 epoch: 37, train_loss: 0.7121, test_loss: 0.9001, test_f1: 0.5830
 epoch: 38, train_loss: 0.7223, test_loss: 0.9402, test_f1: 0.5736
 epoch: 39, train_loss: 0.7262, test_loss: 0.8987, test_f1: 0.6181
 epoch: 40, train_loss: 0.7165, test_loss: 0.9119, test_f1: 0.5957
 epoch: 41, train_loss: 0.7088, test_loss: 0.8831, test_f1: 0.6021
 epoch: 42, train_loss: 0.7038, test_loss: 0.9875, test_f1: 0.5626
 epoch: 43, train_loss: 0.7071, test_loss: 0.9141, test_f1: 0.5955
 epoch: 44, train_loss: 0.6989, test_loss: 0.9247, test_f1: 0.5741
 epoch: 45, train_loss: 0.7091, test_loss: 0.9069, test_f1: 0.6361
 epoch: 46, train_loss: 0.7008, test_loss: 0.8808, test_f1: 0.5959
 epoch: 47, train_loss: 0.6925, test_loss: 0.9186, test_f1: 0.6056
 epoch: 48, train_loss: 0.6917, test_loss: 0.9053, test_f1: 0.5903
 epoch: 49, train_loss: 0.6906, test_loss: 0.9168, test_f1: 0.5974
 epoch: 50, train_loss: 0.6682, test_loss: 0.9435, test_f1: 0.5725
 epoch: 51, train_loss: 0.6662, test_loss: 0.8729, test_f1: 0.6222
 epoch: 52, train_loss: 0.6537, test_loss: 0.8598, test_f1: 0.6222
 epoch: 53, train_loss: 0.6592, test_loss: 0.8766, test_f1: 0.6160
 epoch: 54, train_loss: 0.6512, test_loss: 0.8806, test_f1: 0.6289
 epoch: 55, train_loss: 0.6375, test_loss: 0.9385, test_f1: 0.5969
 epoch: 56, train_loss: 0.6384, test_loss: 0.8771, test_f1: 0.6363
 epoch: 57, train_loss: 0.6343, test_loss: 0.8714, test_f1: 0.6332
 epoch: 58, train_loss: 0.6231, test_loss: 0.9143, test_f1: 0.6230
 epoch: 59, train_loss: 0.6333, test_loss: 0.8822, test_f1: 0.6339
 epoch: 60, train_loss: 0.6128, test_loss: 0.9406, test_f1: 0.5885
 epoch: 61, train_loss: 0.6345, test_loss: 0.8959, test_f1: 0.6181
 epoch: 62, train_loss: 0.6320, test_loss: 0.8781, test_f1: 0.6333
 epoch: 63, train_loss: 0.6282, test_loss: 0.9656, test_f1: 0.5993
 epoch: 64, train_loss: 0.6165, test_loss: 0.9289, test_f1: 0.6120
 epoch: 65, train_loss: 0.6115, test_loss: 0.9198, test_f1: 0.6263
 epoch: 66, train_loss: 0.6054, test_loss: 0.9552, test_f1: 0.6391
 epoch: 67, train_loss: 0.6265, test_loss: 0.9792, test_f1: 0.6034
 epoch: 68, train_loss: 0.6237, test_loss: 0.9215, test_f1: 0.6322
 epoch: 69, train_loss: 0.6247, test_loss: 0.9451, test_f1: 0.6471
 epoch: 70, train_loss: 0.6166, test_loss: 0.9438, test_f1: 0.6393
 epoch: 71, train_loss: 0.6149, test_loss: 0.9497, test_f1: 0.6273
 epoch: 72, train_loss: 0.5895, test_loss: 0.9771, test_f1: 0.6191
 epoch: 73, train_loss: 0.5953, test_loss: 0.9192, test_f1: 0.6428
 epoch: 74, train_loss: 0.5963, test_loss: 0.9354, test_f1: 0.6393
 epoch: 75, train_loss: 0.5899, test_loss: 0.9463, test_f1: 0.5998
 epoch: 76, train_loss: 0.5992, test_loss: 0.9502, test_f1: 0.6199
 epoch: 77, train_loss: 0.5813, test_loss: 0.9304, test_f1: 0.6331
 epoch: 78, train_loss: 0.5871, test_loss: 0.9001, test_f1: 0.6379
 epoch: 79, train_loss: 0.5819, test_loss: 0.9442, test_f1: 0.6344
 epoch: 80, train_loss: 0.5893, test_loss: 0.9284, test_f1: 0.6338
 epoch: 81, train_loss: 0.5772, test_loss: 0.9811, test_f1: 0.6334
 epoch: 82, train_loss: 0.5716, test_loss: 0.9254, test_f1: 0.6288
 epoch: 83, train_loss: 0.5816, test_loss: 0.9733, test_f1: 0.6425
 epoch: 84, train_loss: 0.5897, test_loss: 0.9672, test_f1: 0.6419
 epoch: 85, train_loss: 0.5701, test_loss: 0.9633, test_f1: 0.6314
 epoch: 86, train_loss: 0.5843, test_loss: 0.9720, test_f1: 0.6326
 epoch: 87, train_loss: 0.5666, test_loss: 0.9865, test_f1: 0.6542
 epoch: 88, train_loss: 0.5794, test_loss: 0.9883, test_f1: 0.6339
 epoch: 89, train_loss: 0.5685, test_loss: 0.9983, test_f1: 0.6275
 epoch: 90, train_loss: 0.5767, test_loss: 0.9646, test_f1: 0.6524
 epoch: 91, train_loss: 0.5555, test_loss: 1.0196, test_f1: 0.6193
 epoch: 92, train_loss: 0.5596, test_loss: 0.9846, test_f1: 0.6449
 epoch: 93, train_loss: 0.5649, test_loss: 0.9618, test_f1: 0.6453
 epoch: 94, train_loss: 0.5568, test_loss: 0.9661, test_f1: 0.6182
 epoch: 95, train_loss: 0.5642, test_loss: 0.9622, test_f1: 0.6444
 epoch: 96, train_loss: 0.5516, test_loss: 0.9723, test_f1: 0.6587
 epoch: 97, train_loss: 0.5598, test_loss: 1.0031, test_f1: 0.6494
 epoch: 98, train_loss: 0.5460, test_loss: 0.9727, test_f1: 0.6456
 epoch: 99, train_loss: 0.5487, test_loss: 0.9539, test_f1: 0.6611
##################ITERATION #3 ****************************************
 epoch: 0, train_loss: 1.2274, test_loss: 1.1033, test_f1: 0.4497
 epoch: 1, train_loss: 1.1066, test_loss: 0.9906, test_f1: 0.4497
 epoch: 2, train_loss: 1.0592, test_loss: 0.9896, test_f1: 0.4742
 epoch: 3, train_loss: 1.0127, test_loss: 0.9641, test_f1: 0.4739
 epoch: 4, train_loss: 1.0035, test_loss: 0.9365, test_f1: 0.4724
 epoch: 5, train_loss: 0.9820, test_loss: 0.9411, test_f1: 0.4913
 epoch: 6, train_loss: 0.9671, test_loss: 0.9262, test_f1: 0.4747
 epoch: 7, train_loss: 0.9518, test_loss: 0.9713, test_f1: 0.4661
 epoch: 8, train_loss: 0.9507, test_loss: 0.9407, test_f1: 0.4894
 epoch: 9, train_loss: 0.9253, test_loss: 0.9227, test_f1: 0.4994
 epoch: 10, train_loss: 0.9159, test_loss: 0.9567, test_f1: 0.4915
 epoch: 11, train_loss: 0.9064, test_loss: 0.9018, test_f1: 0.5219
 epoch: 12, train_loss: 0.8963, test_loss: 0.8870, test_f1: 0.5390
 epoch: 13, train_loss: 0.9027, test_loss: 0.9016, test_f1: 0.5415
 epoch: 14, train_loss: 0.8973, test_loss: 0.9173, test_f1: 0.5005
 epoch: 15, train_loss: 0.8750, test_loss: 0.9069, test_f1: 0.5181
 epoch: 16, train_loss: 0.8750, test_loss: 0.9153, test_f1: 0.5354
 epoch: 17, train_loss: 0.8683, test_loss: 0.9060, test_f1: 0.5031
 epoch: 18, train_loss: 0.8656, test_loss: 0.8931, test_f1: 0.5252
 epoch: 19, train_loss: 0.8522, test_loss: 0.9484, test_f1: 0.5259
 epoch: 20, train_loss: 0.8486, test_loss: 0.9266, test_f1: 0.5318
 epoch: 21, train_loss: 0.8333, test_loss: 0.9294, test_f1: 0.5316
 epoch: 22, train_loss: 0.8314, test_loss: 0.9143, test_f1: 0.5538
 epoch: 23, train_loss: 0.8403, test_loss: 0.9526, test_f1: 0.5157
 epoch: 24, train_loss: 0.8414, test_loss: 0.9011, test_f1: 0.5368
 epoch: 25, train_loss: 0.8202, test_loss: 0.9413, test_f1: 0.5294
 epoch: 26, train_loss: 0.8163, test_loss: 0.9164, test_f1: 0.5492
 epoch: 27, train_loss: 0.8179, test_loss: 0.9161, test_f1: 0.5292
 epoch: 28, train_loss: 0.8058, test_loss: 0.9197, test_f1: 0.5491
 epoch: 29, train_loss: 0.8053, test_loss: 0.9549, test_f1: 0.5251
 epoch: 30, train_loss: 0.8174, test_loss: 0.8956, test_f1: 0.5536
 epoch: 31, train_loss: 0.8025, test_loss: 0.9177, test_f1: 0.5413
 epoch: 32, train_loss: 0.7883, test_loss: 0.9095, test_f1: 0.5916
 epoch: 33, train_loss: 0.7850, test_loss: 0.9253, test_f1: 0.5459
 epoch: 34, train_loss: 0.7800, test_loss: 0.9612, test_f1: 0.5342
 epoch: 35, train_loss: 0.7814, test_loss: 0.8995, test_f1: 0.5518
 epoch: 36, train_loss: 0.7749, test_loss: 0.9599, test_f1: 0.5481
 epoch: 37, train_loss: 0.7715, test_loss: 0.9313, test_f1: 0.5406
 epoch: 38, train_loss: 0.7718, test_loss: 0.9078, test_f1: 0.5609
 epoch: 39, train_loss: 0.7655, test_loss: 0.9122, test_f1: 0.6031
 epoch: 40, train_loss: 0.7573, test_loss: 0.9676, test_f1: 0.5443
 epoch: 41, train_loss: 0.7664, test_loss: 0.9469, test_f1: 0.5605
 epoch: 42, train_loss: 0.7620, test_loss: 0.9486, test_f1: 0.5457
 epoch: 43, train_loss: 0.7530, test_loss: 0.9276, test_f1: 0.5889
 epoch: 44, train_loss: 0.7568, test_loss: 0.9107, test_f1: 0.5711
 epoch: 45, train_loss: 0.7398, test_loss: 0.9474, test_f1: 0.5616
 epoch: 46, train_loss: 0.7360, test_loss: 0.9300, test_f1: 0.5906
 epoch: 47, train_loss: 0.7423, test_loss: 0.9721, test_f1: 0.5561
 epoch: 48, train_loss: 0.7356, test_loss: 0.9102, test_f1: 0.6028
 epoch: 49, train_loss: 0.7278, test_loss: 0.9074, test_f1: 0.5669
 epoch: 50, train_loss: 0.7293, test_loss: 0.9120, test_f1: 0.6303
 epoch: 51, train_loss: 0.7097, test_loss: 0.8957, test_f1: 0.6076
 epoch: 52, train_loss: 0.7080, test_loss: 0.8937, test_f1: 0.6096
 epoch: 53, train_loss: 0.7015, test_loss: 0.9249, test_f1: 0.5980
 epoch: 54, train_loss: 0.6908, test_loss: 0.8937, test_f1: 0.6312
 epoch: 55, train_loss: 0.6935, test_loss: 0.9010, test_f1: 0.6175
 epoch: 56, train_loss: 0.6749, test_loss: 0.9016, test_f1: 0.6237
 epoch: 57, train_loss: 0.6870, test_loss: 0.8933, test_f1: 0.6177
 epoch: 58, train_loss: 0.6844, test_loss: 0.9042, test_f1: 0.5886
 epoch: 59, train_loss: 0.6952, test_loss: 0.9079, test_f1: 0.6155
 epoch: 60, train_loss: 0.6731, test_loss: 0.8932, test_f1: 0.6383
 epoch: 61, train_loss: 0.6804, test_loss: 0.8937, test_f1: 0.6081
 epoch: 62, train_loss: 0.6770, test_loss: 0.8911, test_f1: 0.5901
 epoch: 63, train_loss: 0.6735, test_loss: 0.9085, test_f1: 0.6145
 epoch: 64, train_loss: 0.6714, test_loss: 0.8870, test_f1: 0.6210
 epoch: 65, train_loss: 0.6613, test_loss: 0.8979, test_f1: 0.6019
 epoch: 66, train_loss: 0.6533, test_loss: 0.9278, test_f1: 0.6259
 epoch: 67, train_loss: 0.6708, test_loss: 0.9332, test_f1: 0.6440
 epoch: 68, train_loss: 0.6696, test_loss: 0.9556, test_f1: 0.6141
 epoch: 69, train_loss: 0.6619, test_loss: 0.9105, test_f1: 0.6192
 epoch: 70, train_loss: 0.6617, test_loss: 0.9342, test_f1: 0.5877
 epoch: 71, train_loss: 0.6515, test_loss: 0.9084, test_f1: 0.6246
 epoch: 72, train_loss: 0.6681, test_loss: 0.9141, test_f1: 0.6360
 epoch: 73, train_loss: 0.6549, test_loss: 0.8958, test_f1: 0.6165
 epoch: 74, train_loss: 0.6438, test_loss: 0.9085, test_f1: 0.6453
 epoch: 75, train_loss: 0.6344, test_loss: 0.9560, test_f1: 0.6007
 epoch: 76, train_loss: 0.6470, test_loss: 0.9101, test_f1: 0.6074
 epoch: 77, train_loss: 0.6531, test_loss: 0.8869, test_f1: 0.6337
 epoch: 78, train_loss: 0.6437, test_loss: 0.9408, test_f1: 0.6414
 epoch: 79, train_loss: 0.6342, test_loss: 0.9208, test_f1: 0.6203
 epoch: 80, train_loss: 0.6354, test_loss: 0.9080, test_f1: 0.6175
 epoch: 81, train_loss: 0.6409, test_loss: 0.9346, test_f1: 0.6154
 epoch: 82, train_loss: 0.6336, test_loss: 0.9304, test_f1: 0.6267
 epoch: 83, train_loss: 0.6350, test_loss: 0.9590, test_f1: 0.6190
 epoch: 84, train_loss: 0.6260, test_loss: 0.9475, test_f1: 0.6222
 epoch: 85, train_loss: 0.6298, test_loss: 0.9887, test_f1: 0.6178
 epoch: 86, train_loss: 0.6216, test_loss: 0.9422, test_f1: 0.6104
 epoch: 87, train_loss: 0.6264, test_loss: 0.9020, test_f1: 0.6308
 epoch: 88, train_loss: 0.6207, test_loss: 0.9414, test_f1: 0.6354
 epoch: 89, train_loss: 0.6142, test_loss: 0.9355, test_f1: 0.6413
 epoch: 90, train_loss: 0.6107, test_loss: 0.9237, test_f1: 0.6411
 epoch: 91, train_loss: 0.6249, test_loss: 0.9288, test_f1: 0.6444
 epoch: 92, train_loss: 0.6195, test_loss: 0.9014, test_f1: 0.6299
 epoch: 93, train_loss: 0.6145, test_loss: 0.9266, test_f1: 0.6178
 epoch: 94, train_loss: 0.6091, test_loss: 0.8977, test_f1: 0.6165
 epoch: 95, train_loss: 0.6083, test_loss: 0.9178, test_f1: 0.6626
 epoch: 96, train_loss: 0.6123, test_loss: 0.9361, test_f1: 0.6619
 epoch: 97, train_loss: 0.6080, test_loss: 0.9390, test_f1: 0.6517
 epoch: 98, train_loss: 0.5961, test_loss: 0.9372, test_f1: 0.6252
 epoch: 99, train_loss: 0.6105, test_loss: 0.9030, test_f1: 0.6547
##################ITERATION #4 ****************************************
 epoch: 0, train_loss: 1.2742, test_loss: 1.1245, test_f1: 0.3885
 epoch: 1, train_loss: 1.1171, test_loss: 1.0608, test_f1: 0.4435
 epoch: 2, train_loss: 1.0656, test_loss: 1.0125, test_f1: 0.4866
 epoch: 3, train_loss: 1.0320, test_loss: 1.0053, test_f1: 0.4908
 epoch: 4, train_loss: 1.0037, test_loss: 0.9984, test_f1: 0.4943
 epoch: 5, train_loss: 0.9863, test_loss: 1.0427, test_f1: 0.5045
 epoch: 6, train_loss: 0.9760, test_loss: 0.9755, test_f1: 0.5087
 epoch: 7, train_loss: 0.9546, test_loss: 1.0057, test_f1: 0.5036
 epoch: 8, train_loss: 0.9440, test_loss: 0.9706, test_f1: 0.5214
 epoch: 9, train_loss: 0.9308, test_loss: 0.9600, test_f1: 0.4999
 epoch: 10, train_loss: 0.9131, test_loss: 0.9464, test_f1: 0.5252
 epoch: 11, train_loss: 0.9130, test_loss: 1.0037, test_f1: 0.5165
 epoch: 12, train_loss: 0.9072, test_loss: 0.9656, test_f1: 0.5128
 epoch: 13, train_loss: 0.8994, test_loss: 1.0096, test_f1: 0.5121
 epoch: 14, train_loss: 0.8856, test_loss: 0.8692, test_f1: 0.5189
 epoch: 15, train_loss: 0.8669, test_loss: 0.9791, test_f1: 0.5125
 epoch: 16, train_loss: 0.8751, test_loss: 0.9570, test_f1: 0.5100
 epoch: 17, train_loss: 0.8640, test_loss: 0.9674, test_f1: 0.5010
 epoch: 18, train_loss: 0.8629, test_loss: 0.9465, test_f1: 0.5498
 epoch: 19, train_loss: 0.8521, test_loss: 1.0009, test_f1: 0.5158
 epoch: 20, train_loss: 0.8544, test_loss: 0.9868, test_f1: 0.5068
 epoch: 21, train_loss: 0.8483, test_loss: 0.9582, test_f1: 0.5182
 epoch: 22, train_loss: 0.8383, test_loss: 0.9517, test_f1: 0.5357
 epoch: 23, train_loss: 0.8385, test_loss: 0.9465, test_f1: 0.5439
 epoch: 24, train_loss: 0.8231, test_loss: 0.9916, test_f1: 0.5353
 epoch: 25, train_loss: 0.8313, test_loss: 0.9476, test_f1: 0.5364
 epoch: 26, train_loss: 0.8140, test_loss: 0.9884, test_f1: 0.5252
 epoch: 27, train_loss: 0.8004, test_loss: 0.9650, test_f1: 0.5392
 epoch: 28, train_loss: 0.8170, test_loss: 0.9541, test_f1: 0.5530
 epoch: 29, train_loss: 0.8075, test_loss: 0.9783, test_f1: 0.5161
 epoch: 30, train_loss: 0.8057, test_loss: 0.9133, test_f1: 0.5569
 epoch: 31, train_loss: 0.7937, test_loss: 0.9230, test_f1: 0.6193
 epoch: 32, train_loss: 0.7826, test_loss: 0.9942, test_f1: 0.5395
 epoch: 33, train_loss: 0.7930, test_loss: 0.9782, test_f1: 0.5839
 epoch: 34, train_loss: 0.7790, test_loss: 0.9649, test_f1: 0.6123
 epoch: 35, train_loss: 0.7824, test_loss: 1.0620, test_f1: 0.5014
 epoch: 36, train_loss: 0.7685, test_loss: 0.9450, test_f1: 0.5627
 epoch: 37, train_loss: 0.7627, test_loss: 0.9056, test_f1: 0.5905
 epoch: 38, train_loss: 0.7672, test_loss: 0.9176, test_f1: 0.6076
 epoch: 39, train_loss: 0.7612, test_loss: 0.9699, test_f1: 0.5756
 epoch: 40, train_loss: 0.7538, test_loss: 0.9417, test_f1: 0.5538
 epoch: 41, train_loss: 0.7583, test_loss: 0.9191, test_f1: 0.6118
 epoch: 42, train_loss: 0.7458, test_loss: 0.9906, test_f1: 0.5998
 epoch: 43, train_loss: 0.7595, test_loss: 0.9830, test_f1: 0.5550
 epoch: 44, train_loss: 0.7484, test_loss: 1.0301, test_f1: 0.5360
 epoch: 45, train_loss: 0.7465, test_loss: 1.0083, test_f1: 0.5900
 epoch: 46, train_loss: 0.7500, test_loss: 0.9799, test_f1: 0.5812
 epoch: 47, train_loss: 0.7329, test_loss: 0.9953, test_f1: 0.5891
 epoch: 48, train_loss: 0.7303, test_loss: 0.9452, test_f1: 0.5956
 epoch: 49, train_loss: 0.7468, test_loss: 0.9828, test_f1: 0.6044
 epoch: 50, train_loss: 0.7431, test_loss: 0.9914, test_f1: 0.6063
 epoch: 51, train_loss: 0.7241, test_loss: 0.9520, test_f1: 0.6103
 epoch: 52, train_loss: 0.7038, test_loss: 0.9620, test_f1: 0.5953
 epoch: 53, train_loss: 0.7016, test_loss: 0.9136, test_f1: 0.6429
 epoch: 54, train_loss: 0.6878, test_loss: 0.9665, test_f1: 0.5852
 epoch: 55, train_loss: 0.6810, test_loss: 0.9125, test_f1: 0.6065
 epoch: 56, train_loss: 0.6846, test_loss: 0.9738, test_f1: 0.6103
 epoch: 57, train_loss: 0.6799, test_loss: 0.9395, test_f1: 0.6204
 epoch: 58, train_loss: 0.6862, test_loss: 0.9650, test_f1: 0.6453
 epoch: 59, train_loss: 0.6843, test_loss: 0.9355, test_f1: 0.6109
 epoch: 60, train_loss: 0.6789, test_loss: 0.9507, test_f1: 0.6035
 epoch: 61, train_loss: 0.6753, test_loss: 0.9654, test_f1: 0.6433
 epoch: 62, train_loss: 0.6652, test_loss: 0.9478, test_f1: 0.6098
 epoch: 63, train_loss: 0.6819, test_loss: 0.9323, test_f1: 0.6024
 epoch: 64, train_loss: 0.6747, test_loss: 0.9588, test_f1: 0.6127
 epoch: 65, train_loss: 0.6586, test_loss: 0.9557, test_f1: 0.6543
 epoch: 66, train_loss: 0.6574, test_loss: 0.9747, test_f1: 0.6050
 epoch: 67, train_loss: 0.6594, test_loss: 0.9738, test_f1: 0.6423
 epoch: 68, train_loss: 0.6629, test_loss: 0.9454, test_f1: 0.6715
 epoch: 69, train_loss: 0.6590, test_loss: 0.9701, test_f1: 0.6543
 epoch: 70, train_loss: 0.6595, test_loss: 0.9973, test_f1: 0.6488
 epoch: 71, train_loss: 0.6547, test_loss: 0.9647, test_f1: 0.6370
 epoch: 72, train_loss: 0.6596, test_loss: 0.9996, test_f1: 0.6364
 epoch: 73, train_loss: 0.6536, test_loss: 0.9824, test_f1: 0.5922
 epoch: 74, train_loss: 0.6566, test_loss: 0.9557, test_f1: 0.6375
 epoch: 75, train_loss: 0.6515, test_loss: 1.0116, test_f1: 0.6298
 epoch: 76, train_loss: 0.6546, test_loss: 0.9755, test_f1: 0.6196
 epoch: 77, train_loss: 0.6409, test_loss: 1.0202, test_f1: 0.6351
 epoch: 78, train_loss: 0.6348, test_loss: 0.9660, test_f1: 0.6509
 epoch: 79, train_loss: 0.6390, test_loss: 0.9811, test_f1: 0.6625
 epoch: 80, train_loss: 0.6254, test_loss: 1.0117, test_f1: 0.6463
 epoch: 81, train_loss: 0.6382, test_loss: 1.0346, test_f1: 0.6513
 epoch: 82, train_loss: 0.6337, test_loss: 1.0026, test_f1: 0.6626
 epoch: 83, train_loss: 0.6165, test_loss: 1.0257, test_f1: 0.6481
 epoch: 84, train_loss: 0.6249, test_loss: 0.9716, test_f1: 0.6594
 epoch: 85, train_loss: 0.6161, test_loss: 1.0270, test_f1: 0.6067
 epoch: 86, train_loss: 0.6118, test_loss: 1.0341, test_f1: 0.6685
 epoch: 87, train_loss: 0.6366, test_loss: 1.0206, test_f1: 0.6392
 epoch: 88, train_loss: 0.6199, test_loss: 0.9864, test_f1: 0.6789
 epoch: 89, train_loss: 0.6203, test_loss: 0.9854, test_f1: 0.6572
 epoch: 90, train_loss: 0.6251, test_loss: 0.9813, test_f1: 0.6693
 epoch: 91, train_loss: 0.6169, test_loss: 1.0293, test_f1: 0.6382
 epoch: 92, train_loss: 0.6161, test_loss: 1.0393, test_f1: 0.6788
 epoch: 93, train_loss: 0.6095, test_loss: 1.0070, test_f1: 0.6448
 epoch: 94, train_loss: 0.6143, test_loss: 1.0332, test_f1: 0.6575
 epoch: 95, train_loss: 0.6129, test_loss: 1.0340, test_f1: 0.6530
 epoch: 96, train_loss: 0.6268, test_loss: 0.9910, test_f1: 0.6666
 epoch: 97, train_loss: 0.6282, test_loss: 1.0461, test_f1: 0.6661
 epoch: 98, train_loss: 0.6151, test_loss: 1.0370, test_f1: 0.6628
 epoch: 99, train_loss: 0.6044, test_loss: 1.0199, test_f1: 0.6587
##################ITERATION #5 ****************************************
 epoch: 0, train_loss: 1.2360, test_loss: 1.0723, test_f1: 0.4563
 epoch: 1, train_loss: 1.0579, test_loss: 0.9452, test_f1: 0.4843
 epoch: 2, train_loss: 1.0068, test_loss: 0.9159, test_f1: 0.4872
 epoch: 3, train_loss: 0.9860, test_loss: 0.9153, test_f1: 0.4989
 epoch: 4, train_loss: 0.9734, test_loss: 0.9087, test_f1: 0.5140
 epoch: 5, train_loss: 0.9565, test_loss: 0.9056, test_f1: 0.5061
 epoch: 6, train_loss: 0.9517, test_loss: 0.9387, test_f1: 0.5219
 epoch: 7, train_loss: 0.9384, test_loss: 0.9263, test_f1: 0.5040
 epoch: 8, train_loss: 0.9385, test_loss: 0.9132, test_f1: 0.5070
 epoch: 9, train_loss: 0.9260, test_loss: 0.9081, test_f1: 0.5486
 epoch: 10, train_loss: 0.9145, test_loss: 0.9163, test_f1: 0.5027
 epoch: 11, train_loss: 0.8980, test_loss: 0.8927, test_f1: 0.5197
 epoch: 12, train_loss: 0.8847, test_loss: 0.8740, test_f1: 0.5406
 epoch: 13, train_loss: 0.8888, test_loss: 0.9046, test_f1: 0.5085
 epoch: 14, train_loss: 0.8750, test_loss: 0.9130, test_f1: 0.5472
 epoch: 15, train_loss: 0.8738, test_loss: 0.9633, test_f1: 0.5027
 epoch: 16, train_loss: 0.8677, test_loss: 0.8842, test_f1: 0.5326
 epoch: 17, train_loss: 0.8594, test_loss: 0.9248, test_f1: 0.5383
 epoch: 18, train_loss: 0.8551, test_loss: 0.8895, test_f1: 0.5307
 epoch: 19, train_loss: 0.8493, test_loss: 0.8570, test_f1: 0.5415
 epoch: 20, train_loss: 0.8412, test_loss: 1.0085, test_f1: 0.5176
 epoch: 21, train_loss: 0.8345, test_loss: 0.9336, test_f1: 0.5521
 epoch: 22, train_loss: 0.8307, test_loss: 0.9176, test_f1: 0.5457
 epoch: 23, train_loss: 0.8206, test_loss: 0.9919, test_f1: 0.5348
 epoch: 24, train_loss: 0.8209, test_loss: 0.9378, test_f1: 0.5480
 epoch: 25, train_loss: 0.8050, test_loss: 0.9619, test_f1: 0.5447
 epoch: 26, train_loss: 0.8144, test_loss: 1.0081, test_f1: 0.5532
 epoch: 27, train_loss: 0.8128, test_loss: 0.9793, test_f1: 0.5670
 epoch: 28, train_loss: 0.8019, test_loss: 0.9127, test_f1: 0.5652
 epoch: 29, train_loss: 0.8053, test_loss: 0.9875, test_f1: 0.5628
 epoch: 30, train_loss: 0.8009, test_loss: 1.0240, test_f1: 0.5814
 epoch: 31, train_loss: 0.7905, test_loss: 0.9926, test_f1: 0.5372
 epoch: 32, train_loss: 0.7772, test_loss: 0.9807, test_f1: 0.5616
 epoch: 33, train_loss: 0.7885, test_loss: 0.9183, test_f1: 0.5929
 epoch: 34, train_loss: 0.7774, test_loss: 0.9928, test_f1: 0.5397
 epoch: 35, train_loss: 0.7839, test_loss: 0.9569, test_f1: 0.5897
 epoch: 36, train_loss: 0.7669, test_loss: 1.0021, test_f1: 0.5653
 epoch: 37, train_loss: 0.7615, test_loss: 1.0518, test_f1: 0.5668
 epoch: 38, train_loss: 0.7581, test_loss: 0.9900, test_f1: 0.5648
 epoch: 39, train_loss: 0.7619, test_loss: 0.9682, test_f1: 0.6017
 epoch: 40, train_loss: 0.7563, test_loss: 0.9619, test_f1: 0.5796
 epoch: 41, train_loss: 0.7537, test_loss: 0.9656, test_f1: 0.5895
 epoch: 42, train_loss: 0.7484, test_loss: 1.0101, test_f1: 0.6086
 epoch: 43, train_loss: 0.7501, test_loss: 0.9496, test_f1: 0.5783
 epoch: 44, train_loss: 0.7472, test_loss: 0.9541, test_f1: 0.6280
 epoch: 45, train_loss: 0.7431, test_loss: 0.9771, test_f1: 0.6053
 epoch: 46, train_loss: 0.7371, test_loss: 0.9980, test_f1: 0.5812
 epoch: 47, train_loss: 0.7349, test_loss: 1.0208, test_f1: 0.5768
 epoch: 48, train_loss: 0.7272, test_loss: 0.9768, test_f1: 0.6258
 epoch: 49, train_loss: 0.7252, test_loss: 0.9871, test_f1: 0.5875
 epoch: 50, train_loss: 0.7338, test_loss: 0.9407, test_f1: 0.6095
 epoch: 51, train_loss: 0.7197, test_loss: 0.9604, test_f1: 0.5851
 epoch: 52, train_loss: 0.6943, test_loss: 0.9382, test_f1: 0.6051
 epoch: 53, train_loss: 0.6931, test_loss: 0.9664, test_f1: 0.6326
 epoch: 54, train_loss: 0.6920, test_loss: 0.9367, test_f1: 0.6118
 epoch: 55, train_loss: 0.6820, test_loss: 0.9822, test_f1: 0.6972
 epoch: 56, train_loss: 0.6805, test_loss: 0.9472, test_f1: 0.6377
 epoch: 57, train_loss: 0.6799, test_loss: 0.9367, test_f1: 0.6586
 epoch: 58, train_loss: 0.6710, test_loss: 0.9922, test_f1: 0.6323
 epoch: 59, train_loss: 0.6832, test_loss: 0.9437, test_f1: 0.6140
 epoch: 60, train_loss: 0.6790, test_loss: 0.9578, test_f1: 0.6400
 epoch: 61, train_loss: 0.6751, test_loss: 0.9517, test_f1: 0.6316
 epoch: 62, train_loss: 0.6818, test_loss: 0.9988, test_f1: 0.6308
 epoch: 63, train_loss: 0.6763, test_loss: 0.9714, test_f1: 0.6361
 epoch: 64, train_loss: 0.6615, test_loss: 0.9497, test_f1: 0.6478
 epoch: 65, train_loss: 0.6711, test_loss: 0.9912, test_f1: 0.6293
 epoch: 66, train_loss: 0.6609, test_loss: 0.9748, test_f1: 0.6576
 epoch: 67, train_loss: 0.6589, test_loss: 0.9394, test_f1: 0.6244
 epoch: 68, train_loss: 0.6584, test_loss: 0.9933, test_f1: 0.6304
 epoch: 69, train_loss: 0.6686, test_loss: 0.9486, test_f1: 0.6526
 epoch: 70, train_loss: 0.6651, test_loss: 0.9699, test_f1: 0.6313
 epoch: 71, train_loss: 0.6528, test_loss: 0.9522, test_f1: 0.6420
 epoch: 72, train_loss: 0.6560, test_loss: 0.9681, test_f1: 0.6513
 epoch: 73, train_loss: 0.6513, test_loss: 1.0088, test_f1: 0.6566
 epoch: 74, train_loss: 0.6482, test_loss: 0.9560, test_f1: 0.6316
 epoch: 75, train_loss: 0.6412, test_loss: 0.9764, test_f1: 0.6524
 epoch: 76, train_loss: 0.6527, test_loss: 0.9835, test_f1: 0.6838
 epoch: 77, train_loss: 0.6410, test_loss: 0.9928, test_f1: 0.6687
 epoch: 78, train_loss: 0.6399, test_loss: 1.0118, test_f1: 0.6439
 epoch: 79, train_loss: 0.6370, test_loss: 0.9554, test_f1: 0.6685
 epoch: 80, train_loss: 0.6276, test_loss: 0.9938, test_f1: 0.6530
 epoch: 81, train_loss: 0.6331, test_loss: 0.9898, test_f1: 0.6445
 epoch: 82, train_loss: 0.6378, test_loss: 1.0177, test_f1: 0.6525
 epoch: 83, train_loss: 0.6183, test_loss: 0.9936, test_f1: 0.6627
 epoch: 84, train_loss: 0.6343, test_loss: 0.9556, test_f1: 0.6485
 epoch: 85, train_loss: 0.6240, test_loss: 0.9812, test_f1: 0.6356
 epoch: 86, train_loss: 0.6269, test_loss: 0.9780, test_f1: 0.6493
 epoch: 87, train_loss: 0.6343, test_loss: 1.0115, test_f1: 0.6340
 epoch: 88, train_loss: 0.6171, test_loss: 0.9948, test_f1: 0.6174
 epoch: 89, train_loss: 0.6198, test_loss: 0.9945, test_f1: 0.6388
 epoch: 90, train_loss: 0.6198, test_loss: 0.9647, test_f1: 0.6339
 epoch: 91, train_loss: 0.6020, test_loss: 0.9934, test_f1: 0.6632
 epoch: 92, train_loss: 0.6265, test_loss: 0.9540, test_f1: 0.6531
 epoch: 93, train_loss: 0.6148, test_loss: 0.9809, test_f1: 0.6495
 epoch: 94, train_loss: 0.6251, test_loss: 1.0104, test_f1: 0.6249
 epoch: 95, train_loss: 0.6152, test_loss: 0.9481, test_f1: 0.6588
 epoch: 96, train_loss: 0.6052, test_loss: 0.9959, test_f1: 0.6500
 epoch: 97, train_loss: 0.6149, test_loss: 1.0048, test_f1: 0.6543
 epoch: 98, train_loss: 0.6073, test_loss: 1.0195, test_f1: 0.6418
 epoch: 99, train_loss: 0.5917, test_loss: 0.9826, test_f1: 0.6416
##################ITERATION #6 ****************************************
 epoch: 0, train_loss: 1.3375, test_loss: 1.1684, test_f1: 0.3940
 epoch: 1, train_loss: 1.1141, test_loss: 1.0658, test_f1: 0.4734
 epoch: 2, train_loss: 1.0639, test_loss: 1.0436, test_f1: 0.4712
 epoch: 3, train_loss: 1.0373, test_loss: 1.0560, test_f1: 0.4712
 epoch: 4, train_loss: 1.0084, test_loss: 1.0759, test_f1: 0.4709
 epoch: 5, train_loss: 0.9935, test_loss: 1.0546, test_f1: 0.4795
 epoch: 6, train_loss: 0.9869, test_loss: 1.0441, test_f1: 0.4591
 epoch: 7, train_loss: 0.9677, test_loss: 1.0590, test_f1: 0.4699
 epoch: 8, train_loss: 0.9559, test_loss: 1.0750, test_f1: 0.4780
 epoch: 9, train_loss: 0.9459, test_loss: 1.0155, test_f1: 0.4796
 epoch: 10, train_loss: 0.9214, test_loss: 1.0327, test_f1: 0.4757
 epoch: 11, train_loss: 0.9282, test_loss: 1.0479, test_f1: 0.4748
 epoch: 12, train_loss: 0.9173, test_loss: 0.9834, test_f1: 0.5257
 epoch: 13, train_loss: 0.9181, test_loss: 0.9851, test_f1: 0.5132
 epoch: 14, train_loss: 0.9093, test_loss: 0.9820, test_f1: 0.5087
 epoch: 15, train_loss: 0.9049, test_loss: 0.9858, test_f1: 0.5120
 epoch: 16, train_loss: 0.8965, test_loss: 0.9625, test_f1: 0.5177
 epoch: 17, train_loss: 0.8900, test_loss: 0.9755, test_f1: 0.5209
 epoch: 18, train_loss: 0.8883, test_loss: 0.9750, test_f1: 0.5455
 epoch: 19, train_loss: 0.8772, test_loss: 0.9778, test_f1: 0.5500
 epoch: 20, train_loss: 0.8602, test_loss: 0.9888, test_f1: 0.5247
 epoch: 21, train_loss: 0.8595, test_loss: 1.0118, test_f1: 0.5396
 epoch: 22, train_loss: 0.8578, test_loss: 0.9824, test_f1: 0.5486
 epoch: 23, train_loss: 0.8494, test_loss: 1.0069, test_f1: 0.5291
 epoch: 24, train_loss: 0.8409, test_loss: 1.0256, test_f1: 0.5498
 epoch: 25, train_loss: 0.8495, test_loss: 0.9918, test_f1: 0.5274
 epoch: 26, train_loss: 0.8420, test_loss: 1.0086, test_f1: 0.5288
 epoch: 27, train_loss: 0.8333, test_loss: 1.0039, test_f1: 0.5594
 epoch: 28, train_loss: 0.8275, test_loss: 0.9935, test_f1: 0.5568
 epoch: 29, train_loss: 0.8302, test_loss: 0.9651, test_f1: 0.5644
 epoch: 30, train_loss: 0.8276, test_loss: 0.9696, test_f1: 0.6010
 epoch: 31, train_loss: 0.8068, test_loss: 0.9524, test_f1: 0.5514
 epoch: 32, train_loss: 0.8074, test_loss: 0.9957, test_f1: 0.5634
 epoch: 33, train_loss: 0.8047, test_loss: 0.9953, test_f1: 0.5652
 epoch: 34, train_loss: 0.7934, test_loss: 0.9548, test_f1: 0.5822
 epoch: 35, train_loss: 0.7856, test_loss: 0.9911, test_f1: 0.5908
 epoch: 36, train_loss: 0.7930, test_loss: 0.9578, test_f1: 0.5972
 epoch: 37, train_loss: 0.7867, test_loss: 0.9913, test_f1: 0.5573
 epoch: 38, train_loss: 0.7765, test_loss: 1.0090, test_f1: 0.5458
 epoch: 39, train_loss: 0.7655, test_loss: 0.9876, test_f1: 0.6160
 epoch: 40, train_loss: 0.7806, test_loss: 0.9833, test_f1: 0.5829
 epoch: 41, train_loss: 0.7562, test_loss: 0.9316, test_f1: 0.5759
 epoch: 42, train_loss: 0.7565, test_loss: 0.9687, test_f1: 0.5952
 epoch: 43, train_loss: 0.7571, test_loss: 0.9621, test_f1: 0.5836
 epoch: 44, train_loss: 0.7382, test_loss: 0.9729, test_f1: 0.5854
 epoch: 45, train_loss: 0.7457, test_loss: 0.9791, test_f1: 0.5963
 epoch: 46, train_loss: 0.7382, test_loss: 1.0147, test_f1: 0.5741
 epoch: 47, train_loss: 0.7258, test_loss: 0.9541, test_f1: 0.6208
 epoch: 48, train_loss: 0.7342, test_loss: 0.9890, test_f1: 0.5885
 epoch: 49, train_loss: 0.7343, test_loss: 0.9488, test_f1: 0.5888
 epoch: 50, train_loss: 0.7304, test_loss: 0.9982, test_f1: 0.5922
 epoch: 51, train_loss: 0.7233, test_loss: 0.9564, test_f1: 0.5928
 epoch: 52, train_loss: 0.7023, test_loss: 0.9523, test_f1: 0.6062
 epoch: 53, train_loss: 0.7021, test_loss: 0.9717, test_f1: 0.6063
 epoch: 54, train_loss: 0.7033, test_loss: 0.9377, test_f1: 0.6039
 epoch: 55, train_loss: 0.6880, test_loss: 0.9809, test_f1: 0.6024
 epoch: 56, train_loss: 0.6895, test_loss: 1.0179, test_f1: 0.6071
 epoch: 57, train_loss: 0.6821, test_loss: 0.9753, test_f1: 0.6119
 epoch: 58, train_loss: 0.6841, test_loss: 0.9493, test_f1: 0.6259
 epoch: 59, train_loss: 0.6786, test_loss: 0.9931, test_f1: 0.6246
 epoch: 60, train_loss: 0.6582, test_loss: 0.9793, test_f1: 0.6229
 epoch: 61, train_loss: 0.6654, test_loss: 0.9804, test_f1: 0.6355
 epoch: 62, train_loss: 0.6681, test_loss: 1.0202, test_f1: 0.6129
 epoch: 63, train_loss: 0.6784, test_loss: 0.9683, test_f1: 0.6269
 epoch: 64, train_loss: 0.6547, test_loss: 0.9779, test_f1: 0.6189
 epoch: 65, train_loss: 0.6560, test_loss: 0.9883, test_f1: 0.6214
 epoch: 66, train_loss: 0.6563, test_loss: 0.9468, test_f1: 0.6248
 epoch: 67, train_loss: 0.6545, test_loss: 0.9957, test_f1: 0.6372
 epoch: 68, train_loss: 0.6584, test_loss: 0.9794, test_f1: 0.6375
 epoch: 69, train_loss: 0.6653, test_loss: 0.9817, test_f1: 0.6280
 epoch: 70, train_loss: 0.6522, test_loss: 0.9918, test_f1: 0.6362
 epoch: 71, train_loss: 0.6354, test_loss: 0.9638, test_f1: 0.6276
 epoch: 72, train_loss: 0.6473, test_loss: 0.9998, test_f1: 0.6129
 epoch: 73, train_loss: 0.6319, test_loss: 1.0036, test_f1: 0.6379
 epoch: 74, train_loss: 0.6454, test_loss: 1.0196, test_f1: 0.6309
 epoch: 75, train_loss: 0.6493, test_loss: 0.9773, test_f1: 0.6369
 epoch: 76, train_loss: 0.6465, test_loss: 1.0063, test_f1: 0.6378
 epoch: 77, train_loss: 0.6274, test_loss: 0.9834, test_f1: 0.6296
 epoch: 78, train_loss: 0.6430, test_loss: 0.9688, test_f1: 0.6374
 epoch: 79, train_loss: 0.6235, test_loss: 0.9678, test_f1: 0.6199
 epoch: 80, train_loss: 0.6237, test_loss: 0.9301, test_f1: 0.6290
 epoch: 81, train_loss: 0.6284, test_loss: 1.0094, test_f1: 0.6430
 epoch: 82, train_loss: 0.6242, test_loss: 0.9492, test_f1: 0.6470
 epoch: 83, train_loss: 0.6225, test_loss: 0.9462, test_f1: 0.6500
 epoch: 84, train_loss: 0.6429, test_loss: 1.0210, test_f1: 0.6363
 epoch: 85, train_loss: 0.6196, test_loss: 1.0015, test_f1: 0.6413
 epoch: 86, train_loss: 0.6202, test_loss: 0.9305, test_f1: 0.6545
 epoch: 87, train_loss: 0.6211, test_loss: 1.0244, test_f1: 0.6304
 epoch: 88, train_loss: 0.6110, test_loss: 1.0163, test_f1: 0.6190
 epoch: 89, train_loss: 0.6303, test_loss: 0.9611, test_f1: 0.6380
 epoch: 90, train_loss: 0.6125, test_loss: 1.0054, test_f1: 0.6309
 epoch: 91, train_loss: 0.6043, test_loss: 0.9627, test_f1: 0.6583
 epoch: 92, train_loss: 0.6220, test_loss: 0.9373, test_f1: 0.6594
 epoch: 93, train_loss: 0.6176, test_loss: 0.9446, test_f1: 0.6468
 epoch: 94, train_loss: 0.6217, test_loss: 0.9922, test_f1: 0.6456
 epoch: 95, train_loss: 0.5990, test_loss: 1.0351, test_f1: 0.6268
 epoch: 96, train_loss: 0.6093, test_loss: 0.9637, test_f1: 0.6310
 epoch: 97, train_loss: 0.5884, test_loss: 1.0405, test_f1: 0.6526
 epoch: 98, train_loss: 0.6004, test_loss: 0.9877, test_f1: 0.6671
 epoch: 99, train_loss: 0.5971, test_loss: 0.9859, test_f1: 0.6523
##################ITERATION #7 ****************************************
 epoch: 0, train_loss: 1.4260, test_loss: 1.1168, test_f1: 0.3886
 epoch: 1, train_loss: 1.1305, test_loss: 1.0162, test_f1: 0.4527
 epoch: 2, train_loss: 1.0614, test_loss: 0.9739, test_f1: 0.4758
 epoch: 3, train_loss: 1.0143, test_loss: 0.9566, test_f1: 0.4668
 epoch: 4, train_loss: 0.9878, test_loss: 0.9541, test_f1: 0.4567
 epoch: 5, train_loss: 0.9677, test_loss: 0.9446, test_f1: 0.4942
 epoch: 6, train_loss: 0.9676, test_loss: 0.9421, test_f1: 0.4969
 epoch: 7, train_loss: 0.9602, test_loss: 0.9330, test_f1: 0.4747
 epoch: 8, train_loss: 0.9384, test_loss: 0.9505, test_f1: 0.5035
 epoch: 9, train_loss: 0.9291, test_loss: 0.9586, test_f1: 0.5091
 epoch: 10, train_loss: 0.9188, test_loss: 0.9468, test_f1: 0.5311
 epoch: 11, train_loss: 0.9116, test_loss: 0.9247, test_f1: 0.5027
 epoch: 12, train_loss: 0.8941, test_loss: 0.9476, test_f1: 0.5290
 epoch: 13, train_loss: 0.8825, test_loss: 0.9391, test_f1: 0.5358
 epoch: 14, train_loss: 0.8774, test_loss: 0.9104, test_f1: 0.5577
 epoch: 15, train_loss: 0.8779, test_loss: 0.9296, test_f1: 0.5434
 epoch: 16, train_loss: 0.8691, test_loss: 0.9546, test_f1: 0.5414
 epoch: 17, train_loss: 0.8766, test_loss: 0.9458, test_f1: 0.5356
 epoch: 18, train_loss: 0.8471, test_loss: 0.9258, test_f1: 0.5485
 epoch: 19, train_loss: 0.8501, test_loss: 0.9100, test_f1: 0.5493
 epoch: 20, train_loss: 0.8470, test_loss: 0.9238, test_f1: 0.5424
 epoch: 21, train_loss: 0.8457, test_loss: 0.9130, test_f1: 0.5705
 epoch: 22, train_loss: 0.8247, test_loss: 0.8883, test_f1: 0.5377
 epoch: 23, train_loss: 0.8384, test_loss: 0.9287, test_f1: 0.5569
 epoch: 24, train_loss: 0.8342, test_loss: 0.9189, test_f1: 0.5555
 epoch: 25, train_loss: 0.8323, test_loss: 0.9403, test_f1: 0.5502
 epoch: 26, train_loss: 0.8214, test_loss: 0.9216, test_f1: 0.5727
 epoch: 27, train_loss: 0.8130, test_loss: 0.9015, test_f1: 0.5801
 epoch: 28, train_loss: 0.8133, test_loss: 0.9020, test_f1: 0.5665
 epoch: 29, train_loss: 0.8056, test_loss: 0.9357, test_f1: 0.5724
 epoch: 30, train_loss: 0.8101, test_loss: 0.9296, test_f1: 0.5393
 epoch: 31, train_loss: 0.8097, test_loss: 0.9128, test_f1: 0.5555
 epoch: 32, train_loss: 0.7903, test_loss: 0.9207, test_f1: 0.5890
 epoch: 33, train_loss: 0.8062, test_loss: 0.8998, test_f1: 0.5859
 epoch: 34, train_loss: 0.7848, test_loss: 0.8846, test_f1: 0.5789
 epoch: 35, train_loss: 0.7869, test_loss: 0.9358, test_f1: 0.5687
 epoch: 36, train_loss: 0.7873, test_loss: 0.9023, test_f1: 0.5901
 epoch: 37, train_loss: 0.7692, test_loss: 0.8964, test_f1: 0.5918
 epoch: 38, train_loss: 0.7662, test_loss: 0.9345, test_f1: 0.5645
 epoch: 39, train_loss: 0.7776, test_loss: 0.9513, test_f1: 0.5289
 epoch: 40, train_loss: 0.7623, test_loss: 0.8999, test_f1: 0.5807
 epoch: 41, train_loss: 0.7611, test_loss: 0.9696, test_f1: 0.5292
 epoch: 42, train_loss: 0.7654, test_loss: 0.8643, test_f1: 0.5923
 epoch: 43, train_loss: 0.7414, test_loss: 0.8743, test_f1: 0.5990
 epoch: 44, train_loss: 0.7521, test_loss: 0.8754, test_f1: 0.5875
 epoch: 45, train_loss: 0.7523, test_loss: 0.9002, test_f1: 0.6102
 epoch: 46, train_loss: 0.7455, test_loss: 0.8778, test_f1: 0.6033
 epoch: 47, train_loss: 0.7565, test_loss: 0.9033, test_f1: 0.5830
 epoch: 48, train_loss: 0.7488, test_loss: 0.9027, test_f1: 0.6057
 epoch: 49, train_loss: 0.7490, test_loss: 0.9109, test_f1: 0.6226
 epoch: 50, train_loss: 0.7341, test_loss: 0.8671, test_f1: 0.6118
 epoch: 51, train_loss: 0.7242, test_loss: 0.9119, test_f1: 0.5925
 epoch: 52, train_loss: 0.7062, test_loss: 0.9083, test_f1: 0.6099
 epoch: 53, train_loss: 0.7121, test_loss: 0.9079, test_f1: 0.6037
 epoch: 54, train_loss: 0.6880, test_loss: 0.9165, test_f1: 0.5939
 epoch: 55, train_loss: 0.6918, test_loss: 0.8974, test_f1: 0.6042
 epoch: 56, train_loss: 0.6971, test_loss: 0.9109, test_f1: 0.5956
 epoch: 57, train_loss: 0.6898, test_loss: 0.8969, test_f1: 0.6025
 epoch: 58, train_loss: 0.7123, test_loss: 0.9122, test_f1: 0.5858
 epoch: 59, train_loss: 0.6916, test_loss: 0.9106, test_f1: 0.6057
 epoch: 60, train_loss: 0.6863, test_loss: 0.8831, test_f1: 0.6020
 epoch: 61, train_loss: 0.6819, test_loss: 0.8966, test_f1: 0.6120
 epoch: 62, train_loss: 0.6693, test_loss: 0.8849, test_f1: 0.6192
 epoch: 63, train_loss: 0.6815, test_loss: 0.9108, test_f1: 0.6188
 epoch: 64, train_loss: 0.6718, test_loss: 0.9412, test_f1: 0.6132
 epoch: 65, train_loss: 0.6751, test_loss: 0.9020, test_f1: 0.6321
 epoch: 66, train_loss: 0.6768, test_loss: 0.9014, test_f1: 0.6099
 epoch: 67, train_loss: 0.6646, test_loss: 0.9186, test_f1: 0.6024
 epoch: 68, train_loss: 0.6652, test_loss: 0.9083, test_f1: 0.6274
 epoch: 69, train_loss: 0.6671, test_loss: 0.9576, test_f1: 0.6176
 epoch: 70, train_loss: 0.6583, test_loss: 0.9235, test_f1: 0.6164
 epoch: 71, train_loss: 0.6594, test_loss: 0.9699, test_f1: 0.6246
 epoch: 72, train_loss: 0.6623, test_loss: 0.9535, test_f1: 0.6311
 epoch: 73, train_loss: 0.6612, test_loss: 0.9022, test_f1: 0.6074
 epoch: 74, train_loss: 0.6635, test_loss: 0.8740, test_f1: 0.6306
 epoch: 75, train_loss: 0.6530, test_loss: 0.9628, test_f1: 0.6117
 epoch: 76, train_loss: 0.6561, test_loss: 0.9656, test_f1: 0.6186
 epoch: 77, train_loss: 0.6572, test_loss: 0.9178, test_f1: 0.6054
 epoch: 78, train_loss: 0.6446, test_loss: 0.9265, test_f1: 0.6153
 epoch: 79, train_loss: 0.6321, test_loss: 0.9029, test_f1: 0.6222
 epoch: 80, train_loss: 0.6329, test_loss: 0.9174, test_f1: 0.6247
 epoch: 81, train_loss: 0.6421, test_loss: 0.9307, test_f1: 0.6280
 epoch: 82, train_loss: 0.6479, test_loss: 0.9507, test_f1: 0.6157
 epoch: 83, train_loss: 0.6426, test_loss: 0.9572, test_f1: 0.6268
 epoch: 84, train_loss: 0.6494, test_loss: 0.9711, test_f1: 0.6329
 epoch: 85, train_loss: 0.6332, test_loss: 0.9658, test_f1: 0.6215
 epoch: 86, train_loss: 0.6360, test_loss: 0.9873, test_f1: 0.6000
 epoch: 87, train_loss: 0.6256, test_loss: 1.0445, test_f1: 0.6081
 epoch: 88, train_loss: 0.6279, test_loss: 0.9249, test_f1: 0.6165
 epoch: 89, train_loss: 0.6231, test_loss: 0.9800, test_f1: 0.6185
 epoch: 90, train_loss: 0.6183, test_loss: 0.9725, test_f1: 0.6343
 epoch: 91, train_loss: 0.6171, test_loss: 0.9573, test_f1: 0.6327
 epoch: 92, train_loss: 0.6192, test_loss: 0.9600, test_f1: 0.6359
 epoch: 93, train_loss: 0.6209, test_loss: 1.0375, test_f1: 0.6177
 epoch: 94, train_loss: 0.6147, test_loss: 0.9339, test_f1: 0.6506
 epoch: 95, train_loss: 0.6102, test_loss: 0.9810, test_f1: 0.6177
 epoch: 96, train_loss: 0.6257, test_loss: 0.9329, test_f1: 0.6262
 epoch: 97, train_loss: 0.6076, test_loss: 0.9876, test_f1: 0.6383
 epoch: 98, train_loss: 0.6097, test_loss: 0.9864, test_f1: 0.6278
 epoch: 99, train_loss: 0.5899, test_loss: 0.9386, test_f1: 0.6478
##################ITERATION #8 ****************************************
 epoch: 0, train_loss: 1.3941, test_loss: 1.1407, test_f1: 0.4051
 epoch: 1, train_loss: 1.0897, test_loss: 0.9793, test_f1: 0.4725
 epoch: 2, train_loss: 1.0294, test_loss: 0.9599, test_f1: 0.4616
 epoch: 3, train_loss: 0.9890, test_loss: 0.9420, test_f1: 0.4697
 epoch: 4, train_loss: 0.9663, test_loss: 0.9541, test_f1: 0.4735
 epoch: 5, train_loss: 0.9490, test_loss: 0.9349, test_f1: 0.4820
 epoch: 6, train_loss: 0.9364, test_loss: 0.9320, test_f1: 0.5074
 epoch: 7, train_loss: 0.9271, test_loss: 0.9374, test_f1: 0.5157
 epoch: 8, train_loss: 0.9068, test_loss: 0.9464, test_f1: 0.4922
 epoch: 9, train_loss: 0.8899, test_loss: 0.9601, test_f1: 0.4871
 epoch: 10, train_loss: 0.8960, test_loss: 0.9481, test_f1: 0.5133
 epoch: 11, train_loss: 0.9006, test_loss: 0.9324, test_f1: 0.5215
 epoch: 12, train_loss: 0.8752, test_loss: 0.9223, test_f1: 0.5329
 epoch: 13, train_loss: 0.8767, test_loss: 0.9250, test_f1: 0.5288
 epoch: 14, train_loss: 0.8503, test_loss: 0.9206, test_f1: 0.5274
 epoch: 15, train_loss: 0.8672, test_loss: 0.9159, test_f1: 0.5367
 epoch: 16, train_loss: 0.8469, test_loss: 0.9335, test_f1: 0.5444
 epoch: 17, train_loss: 0.8376, test_loss: 0.9017, test_f1: 0.5481
 epoch: 18, train_loss: 0.8419, test_loss: 0.9081, test_f1: 0.5526
 epoch: 19, train_loss: 0.8234, test_loss: 0.8950, test_f1: 0.5597
 epoch: 20, train_loss: 0.8190, test_loss: 0.9035, test_f1: 0.5531
 epoch: 21, train_loss: 0.8070, test_loss: 0.9227, test_f1: 0.5207
 epoch: 22, train_loss: 0.8110, test_loss: 0.8867, test_f1: 0.5332
 epoch: 23, train_loss: 0.8075, test_loss: 0.9006, test_f1: 0.5461
 epoch: 24, train_loss: 0.8008, test_loss: 0.8856, test_f1: 0.5551
 epoch: 25, train_loss: 0.7951, test_loss: 0.8823, test_f1: 0.5609
 epoch: 26, train_loss: 0.8068, test_loss: 0.9073, test_f1: 0.5642
 epoch: 27, train_loss: 0.7889, test_loss: 0.9119, test_f1: 0.5494
 epoch: 28, train_loss: 0.7656, test_loss: 0.9036, test_f1: 0.5543
 epoch: 29, train_loss: 0.7770, test_loss: 0.8871, test_f1: 0.5705
 epoch: 30, train_loss: 0.7708, test_loss: 0.9191, test_f1: 0.5579
 epoch: 31, train_loss: 0.7637, test_loss: 0.8978, test_f1: 0.5684
 epoch: 32, train_loss: 0.7644, test_loss: 0.8980, test_f1: 0.5784
 epoch: 33, train_loss: 0.7509, test_loss: 0.9111, test_f1: 0.5794
 epoch: 34, train_loss: 0.7621, test_loss: 0.8958, test_f1: 0.5734
 epoch: 35, train_loss: 0.7593, test_loss: 0.9151, test_f1: 0.5813
 epoch: 36, train_loss: 0.7446, test_loss: 0.9668, test_f1: 0.5548
 epoch: 37, train_loss: 0.7443, test_loss: 0.8960, test_f1: 0.5816
 epoch: 38, train_loss: 0.7351, test_loss: 0.9476, test_f1: 0.5588
 epoch: 39, train_loss: 0.7386, test_loss: 0.9184, test_f1: 0.5674
 epoch: 40, train_loss: 0.7347, test_loss: 0.9069, test_f1: 0.5948
 epoch: 41, train_loss: 0.7327, test_loss: 0.9245, test_f1: 0.5891
 epoch: 42, train_loss: 0.7184, test_loss: 0.9209, test_f1: 0.5708
 epoch: 43, train_loss: 0.7138, test_loss: 0.8918, test_f1: 0.5823
 epoch: 44, train_loss: 0.7016, test_loss: 0.8994, test_f1: 0.5731
 epoch: 45, train_loss: 0.7004, test_loss: 0.8955, test_f1: 0.5876
 epoch: 46, train_loss: 0.7086, test_loss: 0.9224, test_f1: 0.6054
 epoch: 47, train_loss: 0.6935, test_loss: 0.9240, test_f1: 0.5798
 epoch: 48, train_loss: 0.7062, test_loss: 0.9349, test_f1: 0.5764
 epoch: 49, train_loss: 0.6973, test_loss: 0.8999, test_f1: 0.6211
 epoch: 50, train_loss: 0.6996, test_loss: 0.9226, test_f1: 0.5697
 epoch: 51, train_loss: 0.6650, test_loss: 0.9291, test_f1: 0.5891
 epoch: 52, train_loss: 0.6624, test_loss: 0.9173, test_f1: 0.5991
 epoch: 53, train_loss: 0.6529, test_loss: 0.9033, test_f1: 0.6133
 epoch: 54, train_loss: 0.6524, test_loss: 0.9195, test_f1: 0.6157
 epoch: 55, train_loss: 0.6567, test_loss: 0.9257, test_f1: 0.6075
 epoch: 56, train_loss: 0.6405, test_loss: 0.9208, test_f1: 0.6194
 epoch: 57, train_loss: 0.6462, test_loss: 0.9182, test_f1: 0.6030
 epoch: 58, train_loss: 0.6483, test_loss: 0.9167, test_f1: 0.6046
 epoch: 59, train_loss: 0.6353, test_loss: 0.9430, test_f1: 0.6240
 epoch: 60, train_loss: 0.6427, test_loss: 0.9152, test_f1: 0.6249
 epoch: 61, train_loss: 0.6299, test_loss: 0.9379, test_f1: 0.6023
 epoch: 62, train_loss: 0.6415, test_loss: 0.9523, test_f1: 0.6017
 epoch: 63, train_loss: 0.6350, test_loss: 0.9432, test_f1: 0.5856
 epoch: 64, train_loss: 0.6331, test_loss: 0.9400, test_f1: 0.6030
 epoch: 65, train_loss: 0.6272, test_loss: 0.9464, test_f1: 0.5980
 epoch: 66, train_loss: 0.6284, test_loss: 0.9541, test_f1: 0.6005
 epoch: 67, train_loss: 0.6146, test_loss: 0.9411, test_f1: 0.6050
 epoch: 68, train_loss: 0.6161, test_loss: 0.9584, test_f1: 0.6148
 epoch: 69, train_loss: 0.6299, test_loss: 0.9317, test_f1: 0.6144
 epoch: 70, train_loss: 0.6186, test_loss: 0.9514, test_f1: 0.6019
 epoch: 71, train_loss: 0.6119, test_loss: 0.9551, test_f1: 0.5949
 epoch: 72, train_loss: 0.6093, test_loss: 0.9220, test_f1: 0.6239
 epoch: 73, train_loss: 0.6163, test_loss: 0.9328, test_f1: 0.6203
 epoch: 74, train_loss: 0.5960, test_loss: 0.9580, test_f1: 0.6223
 epoch: 75, train_loss: 0.6094, test_loss: 0.9470, test_f1: 0.5989
 epoch: 76, train_loss: 0.6233, test_loss: 0.9691, test_f1: 0.5964
 epoch: 77, train_loss: 0.6083, test_loss: 0.9444, test_f1: 0.6177
 epoch: 78, train_loss: 0.6109, test_loss: 0.9461, test_f1: 0.5937
 epoch: 79, train_loss: 0.6114, test_loss: 0.9692, test_f1: 0.5890
 epoch: 80, train_loss: 0.5761, test_loss: 0.9420, test_f1: 0.6253
 epoch: 81, train_loss: 0.6023, test_loss: 0.9489, test_f1: 0.6171
 epoch: 82, train_loss: 0.5999, test_loss: 0.9697, test_f1: 0.6071
 epoch: 83, train_loss: 0.5860, test_loss: 0.9595, test_f1: 0.6085
 epoch: 84, train_loss: 0.6124, test_loss: 0.9131, test_f1: 0.6028
 epoch: 85, train_loss: 0.5880, test_loss: 0.9671, test_f1: 0.6173
 epoch: 86, train_loss: 0.5931, test_loss: 0.9662, test_f1: 0.6071
 epoch: 87, train_loss: 0.5886, test_loss: 0.9655, test_f1: 0.6211
 epoch: 88, train_loss: 0.5798, test_loss: 0.9580, test_f1: 0.6188
 epoch: 89, train_loss: 0.5895, test_loss: 0.9612, test_f1: 0.6165
 epoch: 90, train_loss: 0.5772, test_loss: 0.9532, test_f1: 0.6133
 epoch: 91, train_loss: 0.5964, test_loss: 0.9669, test_f1: 0.6079
 epoch: 92, train_loss: 0.5870, test_loss: 0.9576, test_f1: 0.6264
 epoch: 93, train_loss: 0.5822, test_loss: 0.9449, test_f1: 0.6332
 epoch: 94, train_loss: 0.5811, test_loss: 0.9759, test_f1: 0.6194
 epoch: 95, train_loss: 0.5871, test_loss: 1.0283, test_f1: 0.6094
 epoch: 96, train_loss: 0.5758, test_loss: 0.9941, test_f1: 0.6167
 epoch: 97, train_loss: 0.5747, test_loss: 0.9842, test_f1: 0.6053
 epoch: 98, train_loss: 0.5628, test_loss: 1.0426, test_f1: 0.6084
 epoch: 99, train_loss: 0.5676, test_loss: 1.0187, test_f1: 0.6291
##################ITERATION #9 ****************************************
 epoch: 0, train_loss: 1.4145, test_loss: 1.1146, test_f1: 0.4321
 epoch: 1, train_loss: 1.1287, test_loss: 0.9894, test_f1: 0.4841
 epoch: 2, train_loss: 1.0645, test_loss: 0.9835, test_f1: 0.4973
 epoch: 3, train_loss: 1.0208, test_loss: 0.9635, test_f1: 0.4734
 epoch: 4, train_loss: 1.0027, test_loss: 0.9827, test_f1: 0.5001
 epoch: 5, train_loss: 0.9805, test_loss: 1.0133, test_f1: 0.4915
 epoch: 6, train_loss: 0.9560, test_loss: 0.9376, test_f1: 0.5014
 epoch: 7, train_loss: 0.9573, test_loss: 0.9562, test_f1: 0.5292
 epoch: 8, train_loss: 0.9314, test_loss: 0.9231, test_f1: 0.5349
 epoch: 9, train_loss: 0.9173, test_loss: 0.9501, test_f1: 0.5329
 epoch: 10, train_loss: 0.9037, test_loss: 0.9554, test_f1: 0.5145
 epoch: 11, train_loss: 0.9008, test_loss: 0.9184, test_f1: 0.5699
 epoch: 12, train_loss: 0.8897, test_loss: 0.9494, test_f1: 0.5247
 epoch: 13, train_loss: 0.8802, test_loss: 0.9341, test_f1: 0.5254
 epoch: 14, train_loss: 0.8693, test_loss: 0.9302, test_f1: 0.5122
 epoch: 15, train_loss: 0.8656, test_loss: 0.9414, test_f1: 0.5187
 epoch: 16, train_loss: 0.8566, test_loss: 0.9495, test_f1: 0.5673
 epoch: 17, train_loss: 0.8592, test_loss: 0.9298, test_f1: 0.5438
 epoch: 18, train_loss: 0.8455, test_loss: 0.9451, test_f1: 0.5103
 epoch: 19, train_loss: 0.8527, test_loss: 0.9292, test_f1: 0.5407
 epoch: 20, train_loss: 0.8349, test_loss: 0.9366, test_f1: 0.5355
 epoch: 21, train_loss: 0.8344, test_loss: 0.9110, test_f1: 0.5771
 epoch: 22, train_loss: 0.8269, test_loss: 0.9215, test_f1: 0.5589
 epoch: 23, train_loss: 0.8160, test_loss: 0.9149, test_f1: 0.5485
 epoch: 24, train_loss: 0.8127, test_loss: 0.9332, test_f1: 0.5502
 epoch: 25, train_loss: 0.8287, test_loss: 0.9520, test_f1: 0.5670
 epoch: 26, train_loss: 0.8164, test_loss: 0.9328, test_f1: 0.5565
 epoch: 27, train_loss: 0.8072, test_loss: 0.9139, test_f1: 0.5752
 epoch: 28, train_loss: 0.7944, test_loss: 0.9289, test_f1: 0.5730
 epoch: 29, train_loss: 0.7929, test_loss: 0.9157, test_f1: 0.5874
 epoch: 30, train_loss: 0.7893, test_loss: 0.9260, test_f1: 0.5682
 epoch: 31, train_loss: 0.7754, test_loss: 0.9137, test_f1: 0.5742
 epoch: 32, train_loss: 0.7731, test_loss: 0.9065, test_f1: 0.5679
 epoch: 33, train_loss: 0.7725, test_loss: 0.9182, test_f1: 0.5995
 epoch: 34, train_loss: 0.7777, test_loss: 0.9370, test_f1: 0.5926
 epoch: 35, train_loss: 0.7635, test_loss: 0.9674, test_f1: 0.5818
 epoch: 36, train_loss: 0.7646, test_loss: 0.8971, test_f1: 0.6191
 epoch: 37, train_loss: 0.7588, test_loss: 0.8993, test_f1: 0.6113
 epoch: 38, train_loss: 0.7387, test_loss: 0.8989, test_f1: 0.6163
 epoch: 39, train_loss: 0.7366, test_loss: 0.9042, test_f1: 0.6196
 epoch: 40, train_loss: 0.7458, test_loss: 0.9236, test_f1: 0.6072
 epoch: 41, train_loss: 0.7485, test_loss: 0.8722, test_f1: 0.5999
 epoch: 42, train_loss: 0.7323, test_loss: 0.9360, test_f1: 0.6312
 epoch: 43, train_loss: 0.7300, test_loss: 0.9091, test_f1: 0.6368
 epoch: 44, train_loss: 0.7230, test_loss: 0.8881, test_f1: 0.5821
 epoch: 45, train_loss: 0.7334, test_loss: 0.9097, test_f1: 0.6260
 epoch: 46, train_loss: 0.7330, test_loss: 0.9290, test_f1: 0.5918
 epoch: 47, train_loss: 0.7267, test_loss: 0.9349, test_f1: 0.6223
 epoch: 48, train_loss: 0.7054, test_loss: 0.9029, test_f1: 0.6306
 epoch: 49, train_loss: 0.7038, test_loss: 0.9429, test_f1: 0.5804
 epoch: 50, train_loss: 0.7015, test_loss: 0.9479, test_f1: 0.5942
 epoch: 51, train_loss: 0.7004, test_loss: 0.9370, test_f1: 0.6330
 epoch: 52, train_loss: 0.6689, test_loss: 0.9069, test_f1: 0.6376
 epoch: 53, train_loss: 0.6853, test_loss: 0.9354, test_f1: 0.6596
 epoch: 54, train_loss: 0.6710, test_loss: 0.9472, test_f1: 0.6582
 epoch: 55, train_loss: 0.6642, test_loss: 0.9490, test_f1: 0.6392
 epoch: 56, train_loss: 0.6702, test_loss: 0.9487, test_f1: 0.6125
 epoch: 57, train_loss: 0.6656, test_loss: 0.9076, test_f1: 0.6597
 epoch: 58, train_loss: 0.6611, test_loss: 0.9308, test_f1: 0.6406
 epoch: 59, train_loss: 0.6530, test_loss: 0.9281, test_f1: 0.6501
 epoch: 60, train_loss: 0.6573, test_loss: 0.9724, test_f1: 0.6474
 epoch: 61, train_loss: 0.6538, test_loss: 0.9398, test_f1: 0.6368
 epoch: 62, train_loss: 0.6504, test_loss: 0.9354, test_f1: 0.6464
 epoch: 63, train_loss: 0.6427, test_loss: 0.9250, test_f1: 0.6703
 epoch: 64, train_loss: 0.6330, test_loss: 0.9645, test_f1: 0.6558
 epoch: 65, train_loss: 0.6416, test_loss: 0.9247, test_f1: 0.6340
 epoch: 66, train_loss: 0.6416, test_loss: 0.9002, test_f1: 0.6659
 epoch: 67, train_loss: 0.6471, test_loss: 0.9284, test_f1: 0.6619
 epoch: 68, train_loss: 0.6319, test_loss: 0.9565, test_f1: 0.6427
 epoch: 69, train_loss: 0.6308, test_loss: 0.9707, test_f1: 0.6554
 epoch: 70, train_loss: 0.6309, test_loss: 0.9545, test_f1: 0.6562
 epoch: 71, train_loss: 0.6400, test_loss: 0.9527, test_f1: 0.6497
 epoch: 72, train_loss: 0.6343, test_loss: 0.9722, test_f1: 0.6609
 epoch: 73, train_loss: 0.6258, test_loss: 0.9222, test_f1: 0.6423
 epoch: 74, train_loss: 0.6311, test_loss: 0.9360, test_f1: 0.6366
 epoch: 75, train_loss: 0.6269, test_loss: 1.0196, test_f1: 0.6365
 epoch: 76, train_loss: 0.6250, test_loss: 0.9263, test_f1: 0.6732
 epoch: 77, train_loss: 0.6126, test_loss: 0.9811, test_f1: 0.6639
 epoch: 78, train_loss: 0.6272, test_loss: 0.9646, test_f1: 0.6331
 epoch: 79, train_loss: 0.6175, test_loss: 0.9622, test_f1: 0.6467
 epoch: 80, train_loss: 0.6146, test_loss: 0.9841, test_f1: 0.6376
 epoch: 81, train_loss: 0.6115, test_loss: 0.9694, test_f1: 0.6576
 epoch: 82, train_loss: 0.6076, test_loss: 0.9751, test_f1: 0.7024
 epoch: 83, train_loss: 0.6107, test_loss: 0.9529, test_f1: 0.6642
 epoch: 84, train_loss: 0.6008, test_loss: 0.9839, test_f1: 0.6413
 epoch: 85, train_loss: 0.6005, test_loss: 0.9611, test_f1: 0.6373
 epoch: 86, train_loss: 0.6046, test_loss: 0.9417, test_f1: 0.6751
 epoch: 87, train_loss: 0.6022, test_loss: 0.9454, test_f1: 0.6447
 epoch: 88, train_loss: 0.5977, test_loss: 1.0031, test_f1: 0.6515
 epoch: 89, train_loss: 0.5999, test_loss: 0.9515, test_f1: 0.6642
 epoch: 90, train_loss: 0.6035, test_loss: 0.9776, test_f1: 0.6665
 epoch: 91, train_loss: 0.5894, test_loss: 1.0052, test_f1: 0.6554
 epoch: 92, train_loss: 0.5872, test_loss: 0.9754, test_f1: 0.6592
 epoch: 93, train_loss: 0.5943, test_loss: 0.9333, test_f1: 0.6613
 epoch: 94, train_loss: 0.5783, test_loss: 0.9961, test_f1: 0.6350
 epoch: 95, train_loss: 0.5884, test_loss: 1.0325, test_f1: 0.6304
 epoch: 96, train_loss: 0.5806, test_loss: 0.9938, test_f1: 0.6645
 epoch: 97, train_loss: 0.5896, test_loss: 1.0064, test_f1: 0.6488
 epoch: 98, train_loss: 0.5683, test_loss: 0.9826, test_f1: 0.6821
 epoch: 99, train_loss: 0.5891, test_loss: 1.0453, test_f1: 0.6143

Training completed in 615.02 seconds
Best F1: 0.7024 at epoch 82
Mean F1 across iterations: 0.6692  0.0196
========================FINAL RESULTS================================
FEGIN weighted F1: 0.7024  0.0196
python main.py --data ltspice_examples --representation component_net --model FEGIN --layers 3 --hiddens 32 --batch_size 64 --lr 0.001 --emb_size 128 --epochs 100 --save_appendix component_net_L3_H32_BS64_LR0.001_E128 --no_val
-----



STDERR:
  File "main.py", line 370, in <module>
    main()
  File "main.py", line 254, in main
    dataset = dataset_class(
  File "/home/philip/projects/ltspice_examples_code_repo/Circuit-Completion-Using-GNNs/component_classification_with_link_prediction_head/evaluation/FEGIN/kernel/circuit_datasets.py", line 15, in __init__
    self.data, self.slices = torch.load(self.processed_paths[0])
  File "/home/philip/.local/lib/python3.8/site-packages/torch/serialization.py", line 1040, in load
    warnings.warn(
  File "/usr/lib/python3.8/warnings.py", line 109, in _showwarnmsg
    sw(msg.message, msg.category, msg.filename, msg.lineno,
  File "main.py", line 47, in warn_with_traceback
    traceback.print_stack(file=log)
/home/philip/projects/ltspice_examples_code_repo/Circuit-Completion-Using-GNNs/component_classification_with_link_prediction_head/evaluation/FEGIN/kernel/circuit_datasets.py:15: FutureWarning: You are using `torch.load` with `weights_only=False` (the current default value), which uses the default pickle module implicitly. It is possible to construct malicious pickle data which will execute arbitrary code during unpickling (See https://github.com/pytorch/pytorch/blob/main/SECURITY.md#untrusted-models for more details). In a future release, the default value for `weights_only` will be flipped to `True`. This limits the functions that could be executed during unpickling. Arbitrary objects will no longer be allowed to be loaded via this mode unless they are explicitly allowlisted by the user via `torch.serialization.add_safe_globals`. We recommend you start setting `weights_only=True` for any use case where you don't have full control of the loaded file. Please open an issue on GitHub for any issues related to this experimental feature.
  self.data, self.slices = torch.load(self.processed_paths[0])
