STDOUT:
Results will be saved in /home/philip/projects/ltspice_examples_code_repo/Circuit-Completion-Using-GNNs/component_classification_with_link_prediction_head/evaluation/FEGIN/results/model_FEGIN_dataset_ltspice_examples
Command line input: python main.py --data ltspice_examples --representation component_component --model FEGIN --layers 2 --hiddens 64 --batch_size 128 --lr 0.001 --emb_size 250 --epochs 100 --save_appendix component_component_L2_H64_BS128_LR0.001_E250 --no_val
 is saved.
-----
ltspice_examples - FEGIN
Using 2 layers, 64 hidden units, h = 2
Loading component_component representation dataset
ENTERED
Training FEGIN on component_component representation
Train: 3556, Test: 845
##################ITERATION #0 ****************************************
 epoch: 0, train_loss: 1.3136, test_loss: 1.2545, test_f1: 0.2274
 epoch: 1, train_loss: 1.1968, test_loss: 1.1580, test_f1: 0.3353
 epoch: 2, train_loss: 1.1534, test_loss: 1.1047, test_f1: 0.3616
 epoch: 3, train_loss: 1.1148, test_loss: 1.0614, test_f1: 0.4541
 epoch: 4, train_loss: 1.0838, test_loss: 1.0346, test_f1: 0.4633
 epoch: 5, train_loss: 1.0572, test_loss: 0.9874, test_f1: 0.4923
 epoch: 6, train_loss: 1.0256, test_loss: 1.0066, test_f1: 0.4537
 epoch: 7, train_loss: 1.0012, test_loss: 0.9495, test_f1: 0.5209
 epoch: 8, train_loss: 0.9773, test_loss: 0.9356, test_f1: 0.5037
 epoch: 9, train_loss: 0.9571, test_loss: 0.9225, test_f1: 0.5534
 epoch: 10, train_loss: 0.9376, test_loss: 0.9390, test_f1: 0.5136
 epoch: 11, train_loss: 0.9138, test_loss: 0.9359, test_f1: 0.5253
 epoch: 12, train_loss: 0.9106, test_loss: 0.9238, test_f1: 0.5388
 epoch: 13, train_loss: 0.8894, test_loss: 0.9444, test_f1: 0.5287
 epoch: 14, train_loss: 0.8912, test_loss: 0.9270, test_f1: 0.5297
 epoch: 15, train_loss: 0.8754, test_loss: 0.9295, test_f1: 0.5134
 epoch: 16, train_loss: 0.8648, test_loss: 0.9316, test_f1: 0.5326
 epoch: 17, train_loss: 0.8692, test_loss: 0.9725, test_f1: 0.5247
 epoch: 18, train_loss: 0.8533, test_loss: 0.9399, test_f1: 0.5281
 epoch: 19, train_loss: 0.8385, test_loss: 0.9768, test_f1: 0.5236
 epoch: 20, train_loss: 0.8280, test_loss: 0.9588, test_f1: 0.5438
 epoch: 21, train_loss: 0.8077, test_loss: 0.9875, test_f1: 0.4990
 epoch: 22, train_loss: 0.8155, test_loss: 0.9557, test_f1: 0.5371
 epoch: 23, train_loss: 0.8024, test_loss: 0.9691, test_f1: 0.5113
 epoch: 24, train_loss: 0.7892, test_loss: 1.0009, test_f1: 0.5128
 epoch: 25, train_loss: 0.7755, test_loss: 0.9732, test_f1: 0.5303
 epoch: 26, train_loss: 0.7677, test_loss: 0.9535, test_f1: 0.5295
 epoch: 27, train_loss: 0.7726, test_loss: 1.0391, test_f1: 0.5038
 epoch: 28, train_loss: 0.7579, test_loss: 1.0479, test_f1: 0.5103
 epoch: 29, train_loss: 0.7543, test_loss: 0.9766, test_f1: 0.5483
 epoch: 30, train_loss: 0.7556, test_loss: 1.0599, test_f1: 0.5007
 epoch: 31, train_loss: 0.7433, test_loss: 1.0489, test_f1: 0.5261
 epoch: 32, train_loss: 0.7315, test_loss: 1.1003, test_f1: 0.5137
 epoch: 33, train_loss: 0.7263, test_loss: 1.0564, test_f1: 0.5332
 epoch: 34, train_loss: 0.7321, test_loss: 1.0666, test_f1: 0.5179
 epoch: 35, train_loss: 0.7167, test_loss: 1.0776, test_f1: 0.5311
 epoch: 36, train_loss: 0.7076, test_loss: 1.0623, test_f1: 0.5284
 epoch: 37, train_loss: 0.7003, test_loss: 1.0655, test_f1: 0.5375
 epoch: 38, train_loss: 0.7027, test_loss: 1.1177, test_f1: 0.5010
 epoch: 39, train_loss: 0.6727, test_loss: 1.0832, test_f1: 0.5539
 epoch: 40, train_loss: 0.6762, test_loss: 1.1659, test_f1: 0.4972
 epoch: 41, train_loss: 0.6636, test_loss: 1.1580, test_f1: 0.5251
 epoch: 42, train_loss: 0.6810, test_loss: 1.1313, test_f1: 0.5323
 epoch: 43, train_loss: 0.6565, test_loss: 1.0933, test_f1: 0.5487
 epoch: 44, train_loss: 0.6472, test_loss: 1.1539, test_f1: 0.5187
 epoch: 45, train_loss: 0.6471, test_loss: 1.1284, test_f1: 0.5435
 epoch: 46, train_loss: 0.6359, test_loss: 1.1309, test_f1: 0.5448
 epoch: 47, train_loss: 0.6360, test_loss: 1.2180, test_f1: 0.5149
 epoch: 48, train_loss: 0.6238, test_loss: 1.2197, test_f1: 0.5450
 epoch: 49, train_loss: 0.6229, test_loss: 1.1718, test_f1: 0.5156
 epoch: 50, train_loss: 0.6127, test_loss: 1.2900, test_f1: 0.5322
 epoch: 51, train_loss: 0.6003, test_loss: 1.2343, test_f1: 0.5241
 epoch: 52, train_loss: 0.5731, test_loss: 1.1937, test_f1: 0.5262
 epoch: 53, train_loss: 0.5653, test_loss: 1.1467, test_f1: 0.5660
 epoch: 54, train_loss: 0.5504, test_loss: 1.2466, test_f1: 0.5321
 epoch: 55, train_loss: 0.5595, test_loss: 1.1306, test_f1: 0.5674
 epoch: 56, train_loss: 0.5579, test_loss: 1.1653, test_f1: 0.5474
 epoch: 57, train_loss: 0.5561, test_loss: 1.2170, test_f1: 0.5523
 epoch: 58, train_loss: 0.5488, test_loss: 1.3132, test_f1: 0.5548
 epoch: 59, train_loss: 0.5263, test_loss: 1.2750, test_f1: 0.5421
 epoch: 60, train_loss: 0.5265, test_loss: 1.3327, test_f1: 0.5325
 epoch: 61, train_loss: 0.5285, test_loss: 1.3234, test_f1: 0.5294
 epoch: 62, train_loss: 0.5500, test_loss: 1.3063, test_f1: 0.5119
 epoch: 63, train_loss: 0.5265, test_loss: 1.3742, test_f1: 0.5325
 epoch: 64, train_loss: 0.5267, test_loss: 1.2859, test_f1: 0.5374
 epoch: 65, train_loss: 0.5266, test_loss: 1.2620, test_f1: 0.5509
 epoch: 66, train_loss: 0.5286, test_loss: 1.3279, test_f1: 0.5535
 epoch: 67, train_loss: 0.5164, test_loss: 1.2974, test_f1: 0.5284
 epoch: 68, train_loss: 0.5084, test_loss: 1.4407, test_f1: 0.5253
 epoch: 69, train_loss: 0.5006, test_loss: 1.4681, test_f1: 0.5416
 epoch: 70, train_loss: 0.5118, test_loss: 1.3982, test_f1: 0.5293
 epoch: 71, train_loss: 0.4975, test_loss: 1.3728, test_f1: 0.5349
 epoch: 72, train_loss: 0.5006, test_loss: 1.3836, test_f1: 0.5445
 epoch: 73, train_loss: 0.5001, test_loss: 1.4414, test_f1: 0.5263
 epoch: 74, train_loss: 0.4920, test_loss: 1.4121, test_f1: 0.5274
 epoch: 75, train_loss: 0.4775, test_loss: 1.5301, test_f1: 0.5415
 epoch: 76, train_loss: 0.4864, test_loss: 1.4627, test_f1: 0.5374
 epoch: 77, train_loss: 0.4825, test_loss: 1.3961, test_f1: 0.5237
 epoch: 78, train_loss: 0.5010, test_loss: 1.3442, test_f1: 0.5270
 epoch: 79, train_loss: 0.4778, test_loss: 1.4119, test_f1: 0.5457
 epoch: 80, train_loss: 0.4702, test_loss: 1.3386, test_f1: 0.5237
 epoch: 81, train_loss: 0.4698, test_loss: 1.2837, test_f1: 0.5399
 epoch: 82, train_loss: 0.4635, test_loss: 1.4153, test_f1: 0.5296
 epoch: 83, train_loss: 0.4534, test_loss: 1.3364, test_f1: 0.5280
 epoch: 84, train_loss: 0.4690, test_loss: 1.4486, test_f1: 0.5404
 epoch: 85, train_loss: 0.4881, test_loss: 1.4885, test_f1: 0.5552
 epoch: 86, train_loss: 0.4562, test_loss: 1.3656, test_f1: 0.5555
 epoch: 87, train_loss: 0.4578, test_loss: 1.4628, test_f1: 0.5201
 epoch: 88, train_loss: 0.4539, test_loss: 1.4847, test_f1: 0.5480
 epoch: 89, train_loss: 0.4536, test_loss: 1.5993, test_f1: 0.5192
 epoch: 90, train_loss: 0.4386, test_loss: 1.5438, test_f1: 0.5488
 epoch: 91, train_loss: 0.4492, test_loss: 1.5114, test_f1: 0.5433
 epoch: 92, train_loss: 0.4539, test_loss: 1.3551, test_f1: 0.5659
 epoch: 93, train_loss: 0.4457, test_loss: 1.4319, test_f1: 0.5568
 epoch: 94, train_loss: 0.4425, test_loss: 1.4522, test_f1: 0.5256
 epoch: 95, train_loss: 0.4456, test_loss: 1.5110, test_f1: 0.5346
 epoch: 96, train_loss: 0.4297, test_loss: 1.4496, test_f1: 0.5463
 epoch: 97, train_loss: 0.4278, test_loss: 1.6210, test_f1: 0.5378
 epoch: 98, train_loss: 0.4349, test_loss: 1.6713, test_f1: 0.5537
 epoch: 99, train_loss: 0.4152, test_loss: 1.6946, test_f1: 0.5502
##################ITERATION #1 ****************************************
 epoch: 0, train_loss: 1.2461, test_loss: 1.2529, test_f1: 0.3487
 epoch: 1, train_loss: 1.1346, test_loss: 1.1045, test_f1: 0.4011
 epoch: 2, train_loss: 1.0854, test_loss: 1.0223, test_f1: 0.4419
 epoch: 3, train_loss: 1.0434, test_loss: 0.9909, test_f1: 0.4969
 epoch: 4, train_loss: 1.0056, test_loss: 0.9370, test_f1: 0.4920
 epoch: 5, train_loss: 0.9797, test_loss: 0.9336, test_f1: 0.4800
 epoch: 6, train_loss: 0.9545, test_loss: 0.9968, test_f1: 0.4849
 epoch: 7, train_loss: 0.9452, test_loss: 0.9949, test_f1: 0.4658
 epoch: 8, train_loss: 0.9201, test_loss: 0.9083, test_f1: 0.5341
 epoch: 9, train_loss: 0.9083, test_loss: 0.9643, test_f1: 0.4908
 epoch: 10, train_loss: 0.8775, test_loss: 0.9318, test_f1: 0.5035
 epoch: 11, train_loss: 0.8691, test_loss: 1.0122, test_f1: 0.5246
 epoch: 12, train_loss: 0.8650, test_loss: 0.9519, test_f1: 0.5032
 epoch: 13, train_loss: 0.8454, test_loss: 0.9788, test_f1: 0.5237
 epoch: 14, train_loss: 0.8357, test_loss: 0.9917, test_f1: 0.5466
 epoch: 15, train_loss: 0.8183, test_loss: 0.9513, test_f1: 0.5392
 epoch: 16, train_loss: 0.8006, test_loss: 0.9583, test_f1: 0.5143
 epoch: 17, train_loss: 0.7933, test_loss: 1.0162, test_f1: 0.5381
 epoch: 18, train_loss: 0.7890, test_loss: 0.9943, test_f1: 0.5469
 epoch: 19, train_loss: 0.7728, test_loss: 1.0061, test_f1: 0.5193
 epoch: 20, train_loss: 0.7629, test_loss: 1.0354, test_f1: 0.5224
 epoch: 21, train_loss: 0.7578, test_loss: 1.0576, test_f1: 0.5277
 epoch: 22, train_loss: 0.7411, test_loss: 1.0454, test_f1: 0.5472
 epoch: 23, train_loss: 0.7367, test_loss: 1.0323, test_f1: 0.5340
 epoch: 24, train_loss: 0.7308, test_loss: 1.0330, test_f1: 0.5653
 epoch: 25, train_loss: 0.7216, test_loss: 1.0884, test_f1: 0.5473
 epoch: 26, train_loss: 0.7136, test_loss: 1.0898, test_f1: 0.5495
 epoch: 27, train_loss: 0.7045, test_loss: 1.1221, test_f1: 0.5048
 epoch: 28, train_loss: 0.6995, test_loss: 1.0836, test_f1: 0.5613
 epoch: 29, train_loss: 0.6856, test_loss: 1.1697, test_f1: 0.5155
 epoch: 30, train_loss: 0.6742, test_loss: 1.0669, test_f1: 0.5709
 epoch: 31, train_loss: 0.6533, test_loss: 1.2429, test_f1: 0.5062
 epoch: 32, train_loss: 0.6474, test_loss: 1.1623, test_f1: 0.5553
 epoch: 33, train_loss: 0.6496, test_loss: 1.1993, test_f1: 0.5057
 epoch: 34, train_loss: 0.6449, test_loss: 1.1780, test_f1: 0.5266
 epoch: 35, train_loss: 0.6381, test_loss: 1.1766, test_f1: 0.5136
 epoch: 36, train_loss: 0.6406, test_loss: 1.1643, test_f1: 0.5493
 epoch: 37, train_loss: 0.6285, test_loss: 1.0746, test_f1: 0.5484
 epoch: 38, train_loss: 0.6111, test_loss: 1.1294, test_f1: 0.5658
 epoch: 39, train_loss: 0.5851, test_loss: 1.2175, test_f1: 0.5497
 epoch: 40, train_loss: 0.6085, test_loss: 1.1446, test_f1: 0.5690
 epoch: 41, train_loss: 0.5775, test_loss: 1.2318, test_f1: 0.5542
 epoch: 42, train_loss: 0.5884, test_loss: 1.2970, test_f1: 0.5205
 epoch: 43, train_loss: 0.5547, test_loss: 1.2954, test_f1: 0.5745
 epoch: 44, train_loss: 0.5763, test_loss: 1.3258, test_f1: 0.5025
 epoch: 45, train_loss: 0.5523, test_loss: 1.2696, test_f1: 0.5490
 epoch: 46, train_loss: 0.5480, test_loss: 1.2844, test_f1: 0.5353
 epoch: 47, train_loss: 0.5510, test_loss: 1.3429, test_f1: 0.5705
 epoch: 48, train_loss: 0.5436, test_loss: 1.2520, test_f1: 0.5550
 epoch: 49, train_loss: 0.5573, test_loss: 1.3211, test_f1: 0.5478
 epoch: 50, train_loss: 0.5393, test_loss: 1.3909, test_f1: 0.5224
 epoch: 51, train_loss: 0.5127, test_loss: 1.3680, test_f1: 0.5472
 epoch: 52, train_loss: 0.4790, test_loss: 1.3900, test_f1: 0.5118
 epoch: 53, train_loss: 0.4704, test_loss: 1.3904, test_f1: 0.5280
 epoch: 54, train_loss: 0.4734, test_loss: 1.4315, test_f1: 0.5236
 epoch: 55, train_loss: 0.4660, test_loss: 1.4427, test_f1: 0.5197
 epoch: 56, train_loss: 0.4427, test_loss: 1.5388, test_f1: 0.5224
 epoch: 57, train_loss: 0.4474, test_loss: 1.5266, test_f1: 0.5350
 epoch: 58, train_loss: 0.4682, test_loss: 1.5401, test_f1: 0.5436
 epoch: 59, train_loss: 0.4442, test_loss: 1.5285, test_f1: 0.5343
 epoch: 60, train_loss: 0.4307, test_loss: 1.4463, test_f1: 0.5349
 epoch: 61, train_loss: 0.4247, test_loss: 1.5499, test_f1: 0.5361
 epoch: 62, train_loss: 0.4358, test_loss: 1.5761, test_f1: 0.5139
 epoch: 63, train_loss: 0.4302, test_loss: 1.6557, test_f1: 0.5435
 epoch: 64, train_loss: 0.4259, test_loss: 1.5639, test_f1: 0.5489
 epoch: 65, train_loss: 0.4264, test_loss: 1.6683, test_f1: 0.5141
 epoch: 66, train_loss: 0.4143, test_loss: 1.6111, test_f1: 0.5673
 epoch: 67, train_loss: 0.4238, test_loss: 1.5947, test_f1: 0.5576
 epoch: 68, train_loss: 0.4112, test_loss: 1.5657, test_f1: 0.5537
 epoch: 69, train_loss: 0.4233, test_loss: 1.6154, test_f1: 0.5519
 epoch: 70, train_loss: 0.4242, test_loss: 1.8841, test_f1: 0.5039
 epoch: 71, train_loss: 0.4131, test_loss: 1.7164, test_f1: 0.5143
 epoch: 72, train_loss: 0.3905, test_loss: 1.6832, test_f1: 0.5555
 epoch: 73, train_loss: 0.4054, test_loss: 1.7385, test_f1: 0.5364
 epoch: 74, train_loss: 0.4118, test_loss: 1.8174, test_f1: 0.5021
 epoch: 75, train_loss: 0.3867, test_loss: 1.7120, test_f1: 0.5501
 epoch: 76, train_loss: 0.3993, test_loss: 1.7036, test_f1: 0.5174
 epoch: 77, train_loss: 0.3866, test_loss: 1.8451, test_f1: 0.5273
 epoch: 78, train_loss: 0.3911, test_loss: 1.6634, test_f1: 0.5543
 epoch: 79, train_loss: 0.3846, test_loss: 1.7870, test_f1: 0.5345
 epoch: 80, train_loss: 0.3755, test_loss: 1.7065, test_f1: 0.5356
 epoch: 81, train_loss: 0.3701, test_loss: 1.8843, test_f1: 0.5189
 epoch: 82, train_loss: 0.3793, test_loss: 1.7369, test_f1: 0.5461
 epoch: 83, train_loss: 0.3746, test_loss: 1.9300, test_f1: 0.5263
 epoch: 84, train_loss: 0.3762, test_loss: 1.8764, test_f1: 0.5245
 epoch: 85, train_loss: 0.3498, test_loss: 1.8228, test_f1: 0.5489
 epoch: 86, train_loss: 0.3407, test_loss: 1.9372, test_f1: 0.5495
 epoch: 87, train_loss: 0.3334, test_loss: 1.8738, test_f1: 0.5172
 epoch: 88, train_loss: 0.3541, test_loss: 1.8318, test_f1: 0.5523
 epoch: 89, train_loss: 0.3848, test_loss: 1.8775, test_f1: 0.5282
 epoch: 90, train_loss: 0.3631, test_loss: 1.9127, test_f1: 0.5263
 epoch: 91, train_loss: 0.3439, test_loss: 1.9121, test_f1: 0.5105
 epoch: 92, train_loss: 0.3268, test_loss: 2.0246, test_f1: 0.5293
 epoch: 93, train_loss: 0.3245, test_loss: 1.8745, test_f1: 0.5425
 epoch: 94, train_loss: 0.3186, test_loss: 1.9046, test_f1: 0.5345
 epoch: 95, train_loss: 0.3277, test_loss: 1.8901, test_f1: 0.5471
 epoch: 96, train_loss: 0.3273, test_loss: 1.9191, test_f1: 0.5467
 epoch: 97, train_loss: 0.3387, test_loss: 2.0758, test_f1: 0.5091
 epoch: 98, train_loss: 0.3247, test_loss: 1.9104, test_f1: 0.5118
 epoch: 99, train_loss: 0.3303, test_loss: 2.0139, test_f1: 0.5152
##################ITERATION #2 ****************************************
 epoch: 0, train_loss: 1.3156, test_loss: 1.2345, test_f1: 0.3570
 epoch: 1, train_loss: 1.1621, test_loss: 1.1343, test_f1: 0.4360
 epoch: 2, train_loss: 1.1393, test_loss: 1.0907, test_f1: 0.4349
 epoch: 3, train_loss: 1.1076, test_loss: 1.0537, test_f1: 0.4250
 epoch: 4, train_loss: 1.0834, test_loss: 1.0343, test_f1: 0.4370
 epoch: 5, train_loss: 1.0490, test_loss: 0.9861, test_f1: 0.4667
 epoch: 6, train_loss: 1.0372, test_loss: 0.9857, test_f1: 0.4757
 epoch: 7, train_loss: 1.0052, test_loss: 0.9601, test_f1: 0.5121
 epoch: 8, train_loss: 0.9895, test_loss: 0.9449, test_f1: 0.4794
 epoch: 9, train_loss: 0.9713, test_loss: 0.9373, test_f1: 0.4815
 epoch: 10, train_loss: 0.9405, test_loss: 0.9268, test_f1: 0.4904
 epoch: 11, train_loss: 0.9398, test_loss: 0.9305, test_f1: 0.5048
 epoch: 12, train_loss: 0.9278, test_loss: 1.0102, test_f1: 0.4844
 epoch: 13, train_loss: 0.9311, test_loss: 0.9297, test_f1: 0.5083
 epoch: 14, train_loss: 0.9050, test_loss: 0.9639, test_f1: 0.5170
 epoch: 15, train_loss: 0.8974, test_loss: 0.9715, test_f1: 0.5202
 epoch: 16, train_loss: 0.8890, test_loss: 0.9850, test_f1: 0.4933
 epoch: 17, train_loss: 0.8743, test_loss: 1.0197, test_f1: 0.4942
 epoch: 18, train_loss: 0.8683, test_loss: 0.9459, test_f1: 0.4995
 epoch: 19, train_loss: 0.8695, test_loss: 0.9763, test_f1: 0.5074
 epoch: 20, train_loss: 0.8568, test_loss: 1.0088, test_f1: 0.4934
 epoch: 21, train_loss: 0.8415, test_loss: 0.9919, test_f1: 0.5345
 epoch: 22, train_loss: 0.8392, test_loss: 0.9897, test_f1: 0.5187
 epoch: 23, train_loss: 0.8397, test_loss: 0.9897, test_f1: 0.5199
 epoch: 24, train_loss: 0.8300, test_loss: 0.9773, test_f1: 0.5396
 epoch: 25, train_loss: 0.8102, test_loss: 0.9585, test_f1: 0.5421
 epoch: 26, train_loss: 0.8059, test_loss: 1.0184, test_f1: 0.5036
 epoch: 27, train_loss: 0.7944, test_loss: 1.0135, test_f1: 0.5574
 epoch: 28, train_loss: 0.8003, test_loss: 1.0336, test_f1: 0.5468
 epoch: 29, train_loss: 0.7927, test_loss: 1.0689, test_f1: 0.5322
 epoch: 30, train_loss: 0.7711, test_loss: 1.1006, test_f1: 0.5158
 epoch: 31, train_loss: 0.7696, test_loss: 1.0201, test_f1: 0.5115
 epoch: 32, train_loss: 0.7542, test_loss: 1.0967, test_f1: 0.5308
 epoch: 33, train_loss: 0.7641, test_loss: 1.0288, test_f1: 0.5358
 epoch: 34, train_loss: 0.7409, test_loss: 1.0400, test_f1: 0.5407
 epoch: 35, train_loss: 0.7321, test_loss: 1.0273, test_f1: 0.5386
 epoch: 36, train_loss: 0.7353, test_loss: 1.0921, test_f1: 0.4903
 epoch: 37, train_loss: 0.7317, test_loss: 0.9716, test_f1: 0.5420
 epoch: 38, train_loss: 0.7102, test_loss: 1.0688, test_f1: 0.5257
 epoch: 39, train_loss: 0.6996, test_loss: 1.0875, test_f1: 0.5368
 epoch: 40, train_loss: 0.7001, test_loss: 1.1074, test_f1: 0.5270
 epoch: 41, train_loss: 0.6962, test_loss: 1.1255, test_f1: 0.5557
 epoch: 42, train_loss: 0.6980, test_loss: 1.0839, test_f1: 0.5517
 epoch: 43, train_loss: 0.6828, test_loss: 1.1066, test_f1: 0.5620
 epoch: 44, train_loss: 0.6848, test_loss: 1.1185, test_f1: 0.5175
 epoch: 45, train_loss: 0.6652, test_loss: 1.1175, test_f1: 0.5073
 epoch: 46, train_loss: 0.6579, test_loss: 1.1674, test_f1: 0.5371
 epoch: 47, train_loss: 0.6705, test_loss: 1.1476, test_f1: 0.5533
 epoch: 48, train_loss: 0.6655, test_loss: 1.1258, test_f1: 0.5735
 epoch: 49, train_loss: 0.6470, test_loss: 1.1586, test_f1: 0.4992
 epoch: 50, train_loss: 0.6372, test_loss: 1.1647, test_f1: 0.5213
 epoch: 51, train_loss: 0.6138, test_loss: 1.1717, test_f1: 0.5527
 epoch: 52, train_loss: 0.6059, test_loss: 1.2229, test_f1: 0.5445
 epoch: 53, train_loss: 0.5742, test_loss: 1.2097, test_f1: 0.5639
 epoch: 54, train_loss: 0.5821, test_loss: 1.2444, test_f1: 0.5410
 epoch: 55, train_loss: 0.5578, test_loss: 1.2701, test_f1: 0.5616
 epoch: 56, train_loss: 0.5717, test_loss: 1.2283, test_f1: 0.5596
 epoch: 57, train_loss: 0.5609, test_loss: 1.2265, test_f1: 0.5538
 epoch: 58, train_loss: 0.5658, test_loss: 1.2459, test_f1: 0.5727
 epoch: 59, train_loss: 0.5702, test_loss: 1.2562, test_f1: 0.5580
 epoch: 60, train_loss: 0.5455, test_loss: 1.2857, test_f1: 0.5452
 epoch: 61, train_loss: 0.5508, test_loss: 1.2600, test_f1: 0.5639
 epoch: 62, train_loss: 0.5536, test_loss: 1.3492, test_f1: 0.5655
 epoch: 63, train_loss: 0.5324, test_loss: 1.3047, test_f1: 0.5556
 epoch: 64, train_loss: 0.5310, test_loss: 1.3021, test_f1: 0.5503
 epoch: 65, train_loss: 0.5427, test_loss: 1.3223, test_f1: 0.5550
 epoch: 66, train_loss: 0.5297, test_loss: 1.3394, test_f1: 0.5553
 epoch: 67, train_loss: 0.5260, test_loss: 1.3785, test_f1: 0.5194
 epoch: 68, train_loss: 0.5139, test_loss: 1.4117, test_f1: 0.5368
 epoch: 69, train_loss: 0.5247, test_loss: 1.4620, test_f1: 0.5485
 epoch: 70, train_loss: 0.5186, test_loss: 1.3230, test_f1: 0.5417
 epoch: 71, train_loss: 0.5032, test_loss: 1.4140, test_f1: 0.5569
 epoch: 72, train_loss: 0.5208, test_loss: 1.4434, test_f1: 0.5356
 epoch: 73, train_loss: 0.5012, test_loss: 1.3691, test_f1: 0.5439
 epoch: 74, train_loss: 0.4992, test_loss: 1.4259, test_f1: 0.5578
 epoch: 75, train_loss: 0.5186, test_loss: 1.4080, test_f1: 0.5416
 epoch: 76, train_loss: 0.5033, test_loss: 1.3883, test_f1: 0.5439
 epoch: 77, train_loss: 0.5037, test_loss: 1.4732, test_f1: 0.5207
 epoch: 78, train_loss: 0.4785, test_loss: 1.4272, test_f1: 0.5734
 epoch: 79, train_loss: 0.4927, test_loss: 1.4104, test_f1: 0.5377
 epoch: 80, train_loss: 0.4685, test_loss: 1.5012, test_f1: 0.5495
 epoch: 81, train_loss: 0.4600, test_loss: 1.4441, test_f1: 0.5569
 epoch: 82, train_loss: 0.4775, test_loss: 1.4585, test_f1: 0.5318
 epoch: 83, train_loss: 0.4754, test_loss: 1.4735, test_f1: 0.5585
 epoch: 84, train_loss: 0.4751, test_loss: 1.4551, test_f1: 0.5428
 epoch: 85, train_loss: 0.4900, test_loss: 1.4497, test_f1: 0.5414
 epoch: 86, train_loss: 0.4793, test_loss: 1.4386, test_f1: 0.5583
 epoch: 87, train_loss: 0.4773, test_loss: 1.4427, test_f1: 0.5339
 epoch: 88, train_loss: 0.4448, test_loss: 1.4917, test_f1: 0.5257
 epoch: 89, train_loss: 0.4629, test_loss: 1.5099, test_f1: 0.5248
 epoch: 90, train_loss: 0.4500, test_loss: 1.4520, test_f1: 0.5620
 epoch: 91, train_loss: 0.4608, test_loss: 1.5238, test_f1: 0.5535
 epoch: 92, train_loss: 0.4528, test_loss: 1.5054, test_f1: 0.5660
 epoch: 93, train_loss: 0.4286, test_loss: 1.5782, test_f1: 0.5399
 epoch: 94, train_loss: 0.4504, test_loss: 1.4841, test_f1: 0.5617
 epoch: 95, train_loss: 0.4402, test_loss: 1.6563, test_f1: 0.5311
 epoch: 96, train_loss: 0.4421, test_loss: 1.5376, test_f1: 0.5302
 epoch: 97, train_loss: 0.4342, test_loss: 1.4496, test_f1: 0.5651
 epoch: 98, train_loss: 0.4273, test_loss: 1.6227, test_f1: 0.5396
 epoch: 99, train_loss: 0.4397, test_loss: 1.6526, test_f1: 0.5293
##################ITERATION #3 ****************************************
 epoch: 0, train_loss: 1.3496, test_loss: 1.2553, test_f1: 0.3434
 epoch: 1, train_loss: 1.1976, test_loss: 1.1130, test_f1: 0.4637
 epoch: 2, train_loss: 1.1379, test_loss: 1.0690, test_f1: 0.4739
 epoch: 3, train_loss: 1.0910, test_loss: 1.0570, test_f1: 0.4272
 epoch: 4, train_loss: 1.0695, test_loss: 1.0100, test_f1: 0.4732
 epoch: 5, train_loss: 1.0412, test_loss: 0.9819, test_f1: 0.5124
 epoch: 6, train_loss: 1.0286, test_loss: 0.9978, test_f1: 0.4555
 epoch: 7, train_loss: 1.0040, test_loss: 0.9550, test_f1: 0.4988
 epoch: 8, train_loss: 0.9809, test_loss: 0.9651, test_f1: 0.4758
 epoch: 9, train_loss: 0.9664, test_loss: 0.9563, test_f1: 0.5119
 epoch: 10, train_loss: 0.9490, test_loss: 0.9643, test_f1: 0.5091
 epoch: 11, train_loss: 0.9295, test_loss: 0.9459, test_f1: 0.5154
 epoch: 12, train_loss: 0.9272, test_loss: 0.9976, test_f1: 0.5183
 epoch: 13, train_loss: 0.9100, test_loss: 1.0095, test_f1: 0.4967
 epoch: 14, train_loss: 0.8927, test_loss: 0.9617, test_f1: 0.5371
 epoch: 15, train_loss: 0.8825, test_loss: 0.9321, test_f1: 0.5166
 epoch: 16, train_loss: 0.8804, test_loss: 0.9440, test_f1: 0.5498
 epoch: 17, train_loss: 0.8876, test_loss: 0.9399, test_f1: 0.5362
 epoch: 18, train_loss: 0.8513, test_loss: 0.9153, test_f1: 0.5646
 epoch: 19, train_loss: 0.8443, test_loss: 0.9895, test_f1: 0.5129
 epoch: 20, train_loss: 0.8287, test_loss: 0.9577, test_f1: 0.5308
 epoch: 21, train_loss: 0.8187, test_loss: 0.9858, test_f1: 0.5242
 epoch: 22, train_loss: 0.8185, test_loss: 0.9419, test_f1: 0.5509
 epoch: 23, train_loss: 0.8144, test_loss: 0.9819, test_f1: 0.5220
 epoch: 24, train_loss: 0.8095, test_loss: 0.9222, test_f1: 0.5546
 epoch: 25, train_loss: 0.8000, test_loss: 0.9682, test_f1: 0.5440
 epoch: 26, train_loss: 0.7887, test_loss: 0.9373, test_f1: 0.5573
 epoch: 27, train_loss: 0.7763, test_loss: 0.9713, test_f1: 0.5195
 epoch: 28, train_loss: 0.7783, test_loss: 0.9855, test_f1: 0.5568
 epoch: 29, train_loss: 0.7689, test_loss: 0.9414, test_f1: 0.5733
 epoch: 30, train_loss: 0.7633, test_loss: 0.8737, test_f1: 0.5890
 epoch: 31, train_loss: 0.7561, test_loss: 1.0351, test_f1: 0.5341
 epoch: 32, train_loss: 0.7598, test_loss: 1.0204, test_f1: 0.5549
 epoch: 33, train_loss: 0.7491, test_loss: 1.1105, test_f1: 0.5223
 epoch: 34, train_loss: 0.7452, test_loss: 0.9605, test_f1: 0.5421
 epoch: 35, train_loss: 0.7389, test_loss: 1.0299, test_f1: 0.5451
 epoch: 36, train_loss: 0.7181, test_loss: 0.9690, test_f1: 0.5587
 epoch: 37, train_loss: 0.7099, test_loss: 1.0399, test_f1: 0.5600
 epoch: 38, train_loss: 0.7057, test_loss: 0.9385, test_f1: 0.5490
 epoch: 39, train_loss: 0.6998, test_loss: 1.0276, test_f1: 0.5551
 epoch: 40, train_loss: 0.6943, test_loss: 1.0905, test_f1: 0.5450
 epoch: 41, train_loss: 0.6925, test_loss: 1.0307, test_f1: 0.5499
 epoch: 42, train_loss: 0.6916, test_loss: 1.0994, test_f1: 0.5331
 epoch: 43, train_loss: 0.6738, test_loss: 1.0970, test_f1: 0.5542
 epoch: 44, train_loss: 0.6722, test_loss: 1.0140, test_f1: 0.5790
 epoch: 45, train_loss: 0.6746, test_loss: 0.9934, test_f1: 0.5323
 epoch: 46, train_loss: 0.6423, test_loss: 0.9904, test_f1: 0.5706
 epoch: 47, train_loss: 0.6773, test_loss: 1.1717, test_f1: 0.5463
 epoch: 48, train_loss: 0.6464, test_loss: 0.9522, test_f1: 0.5652
 epoch: 49, train_loss: 0.6518, test_loss: 1.0031, test_f1: 0.5688
 epoch: 50, train_loss: 0.6242, test_loss: 1.0464, test_f1: 0.5631
 epoch: 51, train_loss: 0.6147, test_loss: 1.0119, test_f1: 0.5843
 epoch: 52, train_loss: 0.5891, test_loss: 1.0444, test_f1: 0.5604
 epoch: 53, train_loss: 0.5935, test_loss: 1.0350, test_f1: 0.5716
 epoch: 54, train_loss: 0.6006, test_loss: 1.1263, test_f1: 0.5591
 epoch: 55, train_loss: 0.5802, test_loss: 1.0369, test_f1: 0.5831
 epoch: 56, train_loss: 0.5831, test_loss: 1.1084, test_f1: 0.5698
 epoch: 57, train_loss: 0.5882, test_loss: 1.0180, test_f1: 0.5994
 epoch: 58, train_loss: 0.5620, test_loss: 1.0917, test_f1: 0.5738
 epoch: 59, train_loss: 0.5667, test_loss: 1.0951, test_f1: 0.5656
 epoch: 60, train_loss: 0.5661, test_loss: 1.0663, test_f1: 0.5718
 epoch: 61, train_loss: 0.5650, test_loss: 1.1039, test_f1: 0.5839
 epoch: 62, train_loss: 0.5551, test_loss: 1.1020, test_f1: 0.5758
 epoch: 63, train_loss: 0.5439, test_loss: 1.2254, test_f1: 0.5418
 epoch: 64, train_loss: 0.5490, test_loss: 1.0850, test_f1: 0.5797
 epoch: 65, train_loss: 0.5480, test_loss: 1.1228, test_f1: 0.5697
 epoch: 66, train_loss: 0.5287, test_loss: 1.2136, test_f1: 0.5426
 epoch: 67, train_loss: 0.5368, test_loss: 1.1769, test_f1: 0.5630
 epoch: 68, train_loss: 0.5424, test_loss: 1.1544, test_f1: 0.5674
 epoch: 69, train_loss: 0.5175, test_loss: 1.2018, test_f1: 0.5570
 epoch: 70, train_loss: 0.5189, test_loss: 1.1448, test_f1: 0.5679
 epoch: 71, train_loss: 0.5383, test_loss: 1.1852, test_f1: 0.5659
 epoch: 72, train_loss: 0.5164, test_loss: 1.2113, test_f1: 0.5794
 epoch: 73, train_loss: 0.5302, test_loss: 1.2333, test_f1: 0.5702
 epoch: 74, train_loss: 0.5249, test_loss: 1.2270, test_f1: 0.5826
 epoch: 75, train_loss: 0.4978, test_loss: 1.2316, test_f1: 0.5586
 epoch: 76, train_loss: 0.5199, test_loss: 1.2181, test_f1: 0.5486
 epoch: 77, train_loss: 0.5134, test_loss: 1.2422, test_f1: 0.5833
 epoch: 78, train_loss: 0.5085, test_loss: 1.3105, test_f1: 0.5471
 epoch: 79, train_loss: 0.5174, test_loss: 1.2213, test_f1: 0.5483
 epoch: 80, train_loss: 0.4933, test_loss: 1.2450, test_f1: 0.5731
 epoch: 81, train_loss: 0.4849, test_loss: 1.1943, test_f1: 0.5962
 epoch: 82, train_loss: 0.4958, test_loss: 1.2875, test_f1: 0.5588
 epoch: 83, train_loss: 0.5151, test_loss: 1.2393, test_f1: 0.5786
 epoch: 84, train_loss: 0.4896, test_loss: 1.2122, test_f1: 0.5881
 epoch: 85, train_loss: 0.5042, test_loss: 1.2789, test_f1: 0.5844
 epoch: 86, train_loss: 0.4816, test_loss: 1.2447, test_f1: 0.5774
 epoch: 87, train_loss: 0.4577, test_loss: 1.2306, test_f1: 0.5829
 epoch: 88, train_loss: 0.4595, test_loss: 1.2976, test_f1: 0.5614
 epoch: 89, train_loss: 0.4626, test_loss: 1.2476, test_f1: 0.5802
 epoch: 90, train_loss: 0.4738, test_loss: 1.3673, test_f1: 0.5775
 epoch: 91, train_loss: 0.4659, test_loss: 1.3774, test_f1: 0.5592
 epoch: 92, train_loss: 0.4628, test_loss: 1.2791, test_f1: 0.5777
 epoch: 93, train_loss: 0.4812, test_loss: 1.3043, test_f1: 0.5725
 epoch: 94, train_loss: 0.4570, test_loss: 1.2958, test_f1: 0.5935
 epoch: 95, train_loss: 0.4520, test_loss: 1.3955, test_f1: 0.5645
 epoch: 96, train_loss: 0.4660, test_loss: 1.3081, test_f1: 0.5843
 epoch: 97, train_loss: 0.4560, test_loss: 1.2913, test_f1: 0.5922
 epoch: 98, train_loss: 0.4516, test_loss: 1.3464, test_f1: 0.5752
 epoch: 99, train_loss: 0.4487, test_loss: 1.4344, test_f1: 0.5846
##################ITERATION #4 ****************************************
 epoch: 0, train_loss: 1.4037, test_loss: 1.1936, test_f1: 0.4223
 epoch: 1, train_loss: 1.1971, test_loss: 1.1378, test_f1: 0.4390
 epoch: 2, train_loss: 1.1237, test_loss: 1.0598, test_f1: 0.4565
 epoch: 3, train_loss: 1.0726, test_loss: 1.0438, test_f1: 0.4624
 epoch: 4, train_loss: 1.0447, test_loss: 1.0279, test_f1: 0.4760
 epoch: 5, train_loss: 1.0247, test_loss: 0.9725, test_f1: 0.4851
 epoch: 6, train_loss: 0.9925, test_loss: 0.9668, test_f1: 0.4904
 epoch: 7, train_loss: 0.9906, test_loss: 0.9794, test_f1: 0.4804
 epoch: 8, train_loss: 0.9684, test_loss: 0.9714, test_f1: 0.4954
 epoch: 9, train_loss: 0.9453, test_loss: 0.9315, test_f1: 0.5191
 epoch: 10, train_loss: 0.9437, test_loss: 0.9676, test_f1: 0.4931
 epoch: 11, train_loss: 0.9279, test_loss: 0.9711, test_f1: 0.5234
 epoch: 12, train_loss: 0.9238, test_loss: 1.0343, test_f1: 0.5081
 epoch: 13, train_loss: 0.9327, test_loss: 0.9698, test_f1: 0.5118
 epoch: 14, train_loss: 0.9145, test_loss: 0.9893, test_f1: 0.4977
 epoch: 15, train_loss: 0.8937, test_loss: 1.1594, test_f1: 0.4804
 epoch: 16, train_loss: 0.8973, test_loss: 0.9747, test_f1: 0.5264
 epoch: 17, train_loss: 0.8771, test_loss: 1.0214, test_f1: 0.5026
 epoch: 18, train_loss: 0.8642, test_loss: 1.1519, test_f1: 0.4969
 epoch: 19, train_loss: 0.8611, test_loss: 1.0088, test_f1: 0.4960
 epoch: 20, train_loss: 0.8581, test_loss: 1.0470, test_f1: 0.5332
 epoch: 21, train_loss: 0.8310, test_loss: 1.1009, test_f1: 0.4863
 epoch: 22, train_loss: 0.8361, test_loss: 1.0263, test_f1: 0.5303
 epoch: 23, train_loss: 0.8181, test_loss: 1.0850, test_f1: 0.5205
 epoch: 24, train_loss: 0.8068, test_loss: 0.9992, test_f1: 0.5668
 epoch: 25, train_loss: 0.7977, test_loss: 1.0735, test_f1: 0.5017
 epoch: 26, train_loss: 0.7912, test_loss: 1.0054, test_f1: 0.5502
 epoch: 27, train_loss: 0.7938, test_loss: 1.0833, test_f1: 0.5259
 epoch: 28, train_loss: 0.7711, test_loss: 1.0197, test_f1: 0.5471
 epoch: 29, train_loss: 0.7698, test_loss: 1.0740, test_f1: 0.5484
 epoch: 30, train_loss: 0.7777, test_loss: 1.1067, test_f1: 0.5044
 epoch: 31, train_loss: 0.7686, test_loss: 1.0000, test_f1: 0.5727
 epoch: 32, train_loss: 0.7514, test_loss: 1.0422, test_f1: 0.5487
 epoch: 33, train_loss: 0.7490, test_loss: 1.0550, test_f1: 0.5638
 epoch: 34, train_loss: 0.7296, test_loss: 1.0729, test_f1: 0.5638
 epoch: 35, train_loss: 0.7361, test_loss: 1.0939, test_f1: 0.5413
 epoch: 36, train_loss: 0.7317, test_loss: 1.0910, test_f1: 0.5654
 epoch: 37, train_loss: 0.7368, test_loss: 1.0745, test_f1: 0.5673
 epoch: 38, train_loss: 0.7009, test_loss: 1.0972, test_f1: 0.5532
 epoch: 39, train_loss: 0.7005, test_loss: 1.0514, test_f1: 0.5649
 epoch: 40, train_loss: 0.7015, test_loss: 1.1629, test_f1: 0.5168
 epoch: 41, train_loss: 0.7040, test_loss: 1.0790, test_f1: 0.5316
 epoch: 42, train_loss: 0.6889, test_loss: 1.0481, test_f1: 0.5727
 epoch: 43, train_loss: 0.6834, test_loss: 1.1504, test_f1: 0.5257
 epoch: 44, train_loss: 0.6961, test_loss: 1.0756, test_f1: 0.5489
 epoch: 45, train_loss: 0.6736, test_loss: 1.2114, test_f1: 0.5472
 epoch: 46, train_loss: 0.6742, test_loss: 1.1454, test_f1: 0.5347
 epoch: 47, train_loss: 0.6661, test_loss: 1.1203, test_f1: 0.5633
 epoch: 48, train_loss: 0.6532, test_loss: 1.1298, test_f1: 0.5551
 epoch: 49, train_loss: 0.6452, test_loss: 1.1619, test_f1: 0.5614
 epoch: 50, train_loss: 0.6474, test_loss: 1.0891, test_f1: 0.5472
 epoch: 51, train_loss: 0.6030, test_loss: 1.1564, test_f1: 0.5516
 epoch: 52, train_loss: 0.6033, test_loss: 1.1384, test_f1: 0.5501
 epoch: 53, train_loss: 0.5961, test_loss: 1.2124, test_f1: 0.5343
 epoch: 54, train_loss: 0.5941, test_loss: 1.1185, test_f1: 0.5768
 epoch: 55, train_loss: 0.5831, test_loss: 1.1717, test_f1: 0.5643
 epoch: 56, train_loss: 0.5878, test_loss: 1.1483, test_f1: 0.5524
 epoch: 57, train_loss: 0.5716, test_loss: 1.1652, test_f1: 0.5433
 epoch: 58, train_loss: 0.5796, test_loss: 1.1857, test_f1: 0.5354
 epoch: 59, train_loss: 0.5668, test_loss: 1.1809, test_f1: 0.5353
 epoch: 60, train_loss: 0.5709, test_loss: 1.2384, test_f1: 0.5320
 epoch: 61, train_loss: 0.5607, test_loss: 1.2085, test_f1: 0.5486
 epoch: 62, train_loss: 0.5647, test_loss: 1.2527, test_f1: 0.5547
 epoch: 63, train_loss: 0.5548, test_loss: 1.2456, test_f1: 0.5419
 epoch: 64, train_loss: 0.5615, test_loss: 1.1965, test_f1: 0.5417
 epoch: 65, train_loss: 0.5619, test_loss: 1.2220, test_f1: 0.5446
 epoch: 66, train_loss: 0.5446, test_loss: 1.2358, test_f1: 0.5602
 epoch: 67, train_loss: 0.5428, test_loss: 1.2104, test_f1: 0.5610
 epoch: 68, train_loss: 0.5419, test_loss: 1.2618, test_f1: 0.5462
 epoch: 69, train_loss: 0.5251, test_loss: 1.3300, test_f1: 0.5602
 epoch: 70, train_loss: 0.5239, test_loss: 1.1868, test_f1: 0.5804
 epoch: 71, train_loss: 0.5366, test_loss: 1.3040, test_f1: 0.5333
 epoch: 72, train_loss: 0.5290, test_loss: 1.2943, test_f1: 0.5459
 epoch: 73, train_loss: 0.5256, test_loss: 1.2252, test_f1: 0.5712
 epoch: 74, train_loss: 0.5346, test_loss: 1.2832, test_f1: 0.5638
 epoch: 75, train_loss: 0.5267, test_loss: 1.2563, test_f1: 0.5736
 epoch: 76, train_loss: 0.5040, test_loss: 1.2863, test_f1: 0.5325
 epoch: 77, train_loss: 0.5132, test_loss: 1.3956, test_f1: 0.5433
 epoch: 78, train_loss: 0.5094, test_loss: 1.3664, test_f1: 0.5726
 epoch: 79, train_loss: 0.4962, test_loss: 1.3345, test_f1: 0.5433
 epoch: 80, train_loss: 0.5093, test_loss: 1.2529, test_f1: 0.5550
 epoch: 81, train_loss: 0.4980, test_loss: 1.2705, test_f1: 0.5672
 epoch: 82, train_loss: 0.5028, test_loss: 1.3201, test_f1: 0.5655
 epoch: 83, train_loss: 0.5015, test_loss: 1.3811, test_f1: 0.5515
 epoch: 84, train_loss: 0.4870, test_loss: 1.3230, test_f1: 0.5598
 epoch: 85, train_loss: 0.4853, test_loss: 1.3361, test_f1: 0.5416
 epoch: 86, train_loss: 0.4793, test_loss: 1.3443, test_f1: 0.5639
 epoch: 87, train_loss: 0.4953, test_loss: 1.3034, test_f1: 0.5594
 epoch: 88, train_loss: 0.4775, test_loss: 1.2919, test_f1: 0.5820
 epoch: 89, train_loss: 0.4799, test_loss: 1.2890, test_f1: 0.5538
 epoch: 90, train_loss: 0.4751, test_loss: 1.3512, test_f1: 0.5524
 epoch: 91, train_loss: 0.4826, test_loss: 1.3203, test_f1: 0.5674
 epoch: 92, train_loss: 0.4822, test_loss: 1.3217, test_f1: 0.5654
 epoch: 93, train_loss: 0.4757, test_loss: 1.3638, test_f1: 0.5518
 epoch: 94, train_loss: 0.4759, test_loss: 1.3676, test_f1: 0.5759
 epoch: 95, train_loss: 0.4845, test_loss: 1.3645, test_f1: 0.5824
 epoch: 96, train_loss: 0.4530, test_loss: 1.3557, test_f1: 0.5639
 epoch: 97, train_loss: 0.4582, test_loss: 1.4171, test_f1: 0.6001
 epoch: 98, train_loss: 0.4518, test_loss: 1.4673, test_f1: 0.5474
 epoch: 99, train_loss: 0.4644, test_loss: 1.4196, test_f1: 0.5743
##################ITERATION #5 ****************************************
 epoch: 0, train_loss: 1.4667, test_loss: 1.1853, test_f1: 0.4714
 epoch: 1, train_loss: 1.2221, test_loss: 1.1099, test_f1: 0.3986
 epoch: 2, train_loss: 1.1447, test_loss: 1.0271, test_f1: 0.4706
 epoch: 3, train_loss: 1.1125, test_loss: 1.0374, test_f1: 0.4621
 epoch: 4, train_loss: 1.0766, test_loss: 1.0140, test_f1: 0.4263
 epoch: 5, train_loss: 1.0483, test_loss: 0.9639, test_f1: 0.4646
 epoch: 6, train_loss: 1.0128, test_loss: 0.9724, test_f1: 0.4518
 epoch: 7, train_loss: 0.9942, test_loss: 0.9589, test_f1: 0.4668
 epoch: 8, train_loss: 0.9869, test_loss: 1.0075, test_f1: 0.4600
 epoch: 9, train_loss: 0.9747, test_loss: 0.9769, test_f1: 0.4599
 epoch: 10, train_loss: 0.9528, test_loss: 0.9789, test_f1: 0.4547
 epoch: 11, train_loss: 0.9413, test_loss: 1.0716, test_f1: 0.4666
 epoch: 12, train_loss: 0.9338, test_loss: 0.9817, test_f1: 0.4876
 epoch: 13, train_loss: 0.9318, test_loss: 0.9516, test_f1: 0.4761
 epoch: 14, train_loss: 0.9018, test_loss: 0.9977, test_f1: 0.5221
 epoch: 15, train_loss: 0.8899, test_loss: 1.0114, test_f1: 0.4761
 epoch: 16, train_loss: 0.8925, test_loss: 1.0329, test_f1: 0.4832
 epoch: 17, train_loss: 0.8927, test_loss: 0.9904, test_f1: 0.4894
 epoch: 18, train_loss: 0.8863, test_loss: 1.0867, test_f1: 0.4617
 epoch: 19, train_loss: 0.8834, test_loss: 0.9417, test_f1: 0.5173
 epoch: 20, train_loss: 0.8664, test_loss: 0.9587, test_f1: 0.5234
 epoch: 21, train_loss: 0.8538, test_loss: 0.9810, test_f1: 0.5383
 epoch: 22, train_loss: 0.8411, test_loss: 0.9581, test_f1: 0.5112
 epoch: 23, train_loss: 0.8322, test_loss: 0.9837, test_f1: 0.4887
 epoch: 24, train_loss: 0.8404, test_loss: 1.0257, test_f1: 0.4969
 epoch: 25, train_loss: 0.8306, test_loss: 0.9950, test_f1: 0.4955
 epoch: 26, train_loss: 0.8123, test_loss: 0.9647, test_f1: 0.5193
 epoch: 27, train_loss: 0.8094, test_loss: 1.0224, test_f1: 0.5330
 epoch: 28, train_loss: 0.8216, test_loss: 1.0551, test_f1: 0.5040
 epoch: 29, train_loss: 0.8085, test_loss: 0.9934, test_f1: 0.5304
 epoch: 30, train_loss: 0.8160, test_loss: 1.0086, test_f1: 0.5303
 epoch: 31, train_loss: 0.7782, test_loss: 1.0034, test_f1: 0.5163
 epoch: 32, train_loss: 0.7752, test_loss: 0.9938, test_f1: 0.5674
 epoch: 33, train_loss: 0.7652, test_loss: 0.9905, test_f1: 0.5530
 epoch: 34, train_loss: 0.7628, test_loss: 1.0463, test_f1: 0.5360
 epoch: 35, train_loss: 0.7490, test_loss: 1.0647, test_f1: 0.5125
 epoch: 36, train_loss: 0.7380, test_loss: 1.0445, test_f1: 0.5539
 epoch: 37, train_loss: 0.7629, test_loss: 1.0808, test_f1: 0.5083
 epoch: 38, train_loss: 0.7425, test_loss: 0.9999, test_f1: 0.5262
 epoch: 39, train_loss: 0.7321, test_loss: 1.1214, test_f1: 0.5031
 epoch: 40, train_loss: 0.7335, test_loss: 1.0243, test_f1: 0.5441
 epoch: 41, train_loss: 0.7221, test_loss: 1.0694, test_f1: 0.5578
 epoch: 42, train_loss: 0.7172, test_loss: 0.9839, test_f1: 0.5588
 epoch: 43, train_loss: 0.7255, test_loss: 1.0190, test_f1: 0.5533
 epoch: 44, train_loss: 0.7040, test_loss: 1.1207, test_f1: 0.4991
 epoch: 45, train_loss: 0.7053, test_loss: 1.0651, test_f1: 0.5534
 epoch: 46, train_loss: 0.6958, test_loss: 1.0994, test_f1: 0.5537
 epoch: 47, train_loss: 0.6942, test_loss: 1.0997, test_f1: 0.5496
 epoch: 48, train_loss: 0.6775, test_loss: 1.1248, test_f1: 0.5202
 epoch: 49, train_loss: 0.6934, test_loss: 1.0354, test_f1: 0.5524
 epoch: 50, train_loss: 0.6570, test_loss: 1.3166, test_f1: 0.5178
 epoch: 51, train_loss: 0.6488, test_loss: 1.0506, test_f1: 0.5888
 epoch: 52, train_loss: 0.6173, test_loss: 1.1339, test_f1: 0.5471
 epoch: 53, train_loss: 0.6282, test_loss: 1.0738, test_f1: 0.5585
 epoch: 54, train_loss: 0.6128, test_loss: 1.0979, test_f1: 0.5753
 epoch: 55, train_loss: 0.6105, test_loss: 1.0437, test_f1: 0.6035
 epoch: 56, train_loss: 0.6046, test_loss: 1.1427, test_f1: 0.5598
 epoch: 57, train_loss: 0.6064, test_loss: 1.0840, test_f1: 0.5611
 epoch: 58, train_loss: 0.6132, test_loss: 1.1310, test_f1: 0.5680
 epoch: 59, train_loss: 0.5923, test_loss: 1.1734, test_f1: 0.5521
 epoch: 60, train_loss: 0.5971, test_loss: 1.2232, test_f1: 0.5522
 epoch: 61, train_loss: 0.5922, test_loss: 1.1480, test_f1: 0.5679
 epoch: 62, train_loss: 0.5782, test_loss: 1.2303, test_f1: 0.5375
 epoch: 63, train_loss: 0.5831, test_loss: 1.1831, test_f1: 0.5514
 epoch: 64, train_loss: 0.5690, test_loss: 1.1791, test_f1: 0.5517
 epoch: 65, train_loss: 0.5875, test_loss: 1.2333, test_f1: 0.5445
 epoch: 66, train_loss: 0.5575, test_loss: 1.1968, test_f1: 0.5584
 epoch: 67, train_loss: 0.5580, test_loss: 1.1846, test_f1: 0.5621
 epoch: 68, train_loss: 0.5730, test_loss: 1.2433, test_f1: 0.5596
 epoch: 69, train_loss: 0.5698, test_loss: 1.1344, test_f1: 0.5829
 epoch: 70, train_loss: 0.5688, test_loss: 1.2555, test_f1: 0.5697
 epoch: 71, train_loss: 0.5518, test_loss: 1.1681, test_f1: 0.5721
 epoch: 72, train_loss: 0.5632, test_loss: 1.2075, test_f1: 0.5384
 epoch: 73, train_loss: 0.5366, test_loss: 1.2780, test_f1: 0.5441
 epoch: 74, train_loss: 0.5411, test_loss: 1.1691, test_f1: 0.5613
 epoch: 75, train_loss: 0.5483, test_loss: 1.2447, test_f1: 0.5476
 epoch: 76, train_loss: 0.5347, test_loss: 1.2030, test_f1: 0.5537
 epoch: 77, train_loss: 0.5400, test_loss: 1.2074, test_f1: 0.5590
 epoch: 78, train_loss: 0.5196, test_loss: 1.2092, test_f1: 0.6005
 epoch: 79, train_loss: 0.5293, test_loss: 1.2427, test_f1: 0.5772
 epoch: 80, train_loss: 0.5240, test_loss: 1.2988, test_f1: 0.5664
 epoch: 81, train_loss: 0.5253, test_loss: 1.1991, test_f1: 0.5651
 epoch: 82, train_loss: 0.5157, test_loss: 1.2657, test_f1: 0.5688
 epoch: 83, train_loss: 0.5179, test_loss: 1.2771, test_f1: 0.5735
 epoch: 84, train_loss: 0.5121, test_loss: 1.2605, test_f1: 0.5383
 epoch: 85, train_loss: 0.5203, test_loss: 1.3769, test_f1: 0.5495
 epoch: 86, train_loss: 0.5170, test_loss: 1.3570, test_f1: 0.5481
 epoch: 87, train_loss: 0.5331, test_loss: 1.3902, test_f1: 0.5381
 epoch: 88, train_loss: 0.5091, test_loss: 1.2156, test_f1: 0.5880
 epoch: 89, train_loss: 0.4958, test_loss: 1.2187, test_f1: 0.5978
 epoch: 90, train_loss: 0.4926, test_loss: 1.2618, test_f1: 0.5730
 epoch: 91, train_loss: 0.4975, test_loss: 1.2322, test_f1: 0.5768
 epoch: 92, train_loss: 0.4778, test_loss: 1.2647, test_f1: 0.5843
 epoch: 93, train_loss: 0.5006, test_loss: 1.3026, test_f1: 0.6029
 epoch: 94, train_loss: 0.5122, test_loss: 1.2365, test_f1: 0.5659
 epoch: 95, train_loss: 0.5066, test_loss: 1.3556, test_f1: 0.5745
 epoch: 96, train_loss: 0.4913, test_loss: 1.2410, test_f1: 0.5803
 epoch: 97, train_loss: 0.4782, test_loss: 1.3010, test_f1: 0.5864
 epoch: 98, train_loss: 0.4961, test_loss: 1.2650, test_f1: 0.5760
 epoch: 99, train_loss: 0.4726, test_loss: 1.2630, test_f1: 0.5819
##################ITERATION #6 ****************************************
 epoch: 0, train_loss: 1.5897, test_loss: 1.2750, test_f1: 0.3096
 epoch: 1, train_loss: 1.2421, test_loss: 1.1317, test_f1: 0.4415
 epoch: 2, train_loss: 1.1770, test_loss: 1.0853, test_f1: 0.4492
 epoch: 3, train_loss: 1.1587, test_loss: 1.0668, test_f1: 0.4570
 epoch: 4, train_loss: 1.1075, test_loss: 1.0404, test_f1: 0.4404
 epoch: 5, train_loss: 1.0721, test_loss: 1.0297, test_f1: 0.4343
 epoch: 6, train_loss: 1.0587, test_loss: 1.0154, test_f1: 0.4450
 epoch: 7, train_loss: 1.0376, test_loss: 1.0152, test_f1: 0.4651
 epoch: 8, train_loss: 1.0095, test_loss: 1.0066, test_f1: 0.4668
 epoch: 9, train_loss: 1.0112, test_loss: 1.0019, test_f1: 0.4898
 epoch: 10, train_loss: 0.9858, test_loss: 0.9769, test_f1: 0.4834
 epoch: 11, train_loss: 0.9769, test_loss: 0.9851, test_f1: 0.4948
 epoch: 12, train_loss: 0.9556, test_loss: 0.9847, test_f1: 0.4926
 epoch: 13, train_loss: 0.9517, test_loss: 0.9868, test_f1: 0.5101
 epoch: 14, train_loss: 0.9360, test_loss: 0.9695, test_f1: 0.5195
 epoch: 15, train_loss: 0.9331, test_loss: 0.9284, test_f1: 0.5287
 epoch: 16, train_loss: 0.9134, test_loss: 0.9772, test_f1: 0.4841
 epoch: 17, train_loss: 0.8909, test_loss: 0.9549, test_f1: 0.5136
 epoch: 18, train_loss: 0.9021, test_loss: 0.9633, test_f1: 0.5295
 epoch: 19, train_loss: 0.8931, test_loss: 0.9769, test_f1: 0.5288
 epoch: 20, train_loss: 0.8688, test_loss: 0.9648, test_f1: 0.5362
 epoch: 21, train_loss: 0.8791, test_loss: 0.9720, test_f1: 0.5118
 epoch: 22, train_loss: 0.8679, test_loss: 1.0120, test_f1: 0.5118
 epoch: 23, train_loss: 0.8642, test_loss: 1.0059, test_f1: 0.5306
 epoch: 24, train_loss: 0.8392, test_loss: 1.0167, test_f1: 0.5605
 epoch: 25, train_loss: 0.8388, test_loss: 1.0112, test_f1: 0.5284
 epoch: 26, train_loss: 0.8389, test_loss: 0.9843, test_f1: 0.5614
 epoch: 27, train_loss: 0.8262, test_loss: 1.0133, test_f1: 0.5542
 epoch: 28, train_loss: 0.8141, test_loss: 0.9954, test_f1: 0.5481
 epoch: 29, train_loss: 0.7873, test_loss: 1.0289, test_f1: 0.5314
 epoch: 30, train_loss: 0.7908, test_loss: 1.0467, test_f1: 0.5511
 epoch: 31, train_loss: 0.7659, test_loss: 1.0816, test_f1: 0.5413
 epoch: 32, train_loss: 0.7694, test_loss: 1.0545, test_f1: 0.5590
 epoch: 33, train_loss: 0.7691, test_loss: 1.0710, test_f1: 0.5447
 epoch: 34, train_loss: 0.7663, test_loss: 1.0716, test_f1: 0.5457
 epoch: 35, train_loss: 0.7568, test_loss: 1.0797, test_f1: 0.5575
 epoch: 36, train_loss: 0.7445, test_loss: 1.1082, test_f1: 0.5201
 epoch: 37, train_loss: 0.7447, test_loss: 1.1443, test_f1: 0.5446
 epoch: 38, train_loss: 0.7474, test_loss: 1.0466, test_f1: 0.5539
 epoch: 39, train_loss: 0.7384, test_loss: 1.0371, test_f1: 0.5551
 epoch: 40, train_loss: 0.7288, test_loss: 1.0840, test_f1: 0.5494
 epoch: 41, train_loss: 0.7194, test_loss: 1.0772, test_f1: 0.5531
 epoch: 42, train_loss: 0.7007, test_loss: 1.0674, test_f1: 0.5564
 epoch: 43, train_loss: 0.7095, test_loss: 1.1284, test_f1: 0.5430
 epoch: 44, train_loss: 0.6920, test_loss: 1.0993, test_f1: 0.5564
 epoch: 45, train_loss: 0.6750, test_loss: 1.0859, test_f1: 0.5445
 epoch: 46, train_loss: 0.6800, test_loss: 1.1718, test_f1: 0.5558
 epoch: 47, train_loss: 0.6615, test_loss: 1.1218, test_f1: 0.5527
 epoch: 48, train_loss: 0.6906, test_loss: 1.0567, test_f1: 0.5587
 epoch: 49, train_loss: 0.6802, test_loss: 1.1442, test_f1: 0.5670
 epoch: 50, train_loss: 0.6612, test_loss: 1.1225, test_f1: 0.5603
 epoch: 51, train_loss: 0.6245, test_loss: 1.1331, test_f1: 0.5517
 epoch: 52, train_loss: 0.6171, test_loss: 1.2090, test_f1: 0.5331
 epoch: 53, train_loss: 0.6127, test_loss: 1.1432, test_f1: 0.5361
 epoch: 54, train_loss: 0.5992, test_loss: 1.1447, test_f1: 0.5161
 epoch: 55, train_loss: 0.5840, test_loss: 1.1912, test_f1: 0.5641
 epoch: 56, train_loss: 0.5923, test_loss: 1.2047, test_f1: 0.5415
 epoch: 57, train_loss: 0.5924, test_loss: 1.1937, test_f1: 0.5403
 epoch: 58, train_loss: 0.5909, test_loss: 1.1741, test_f1: 0.5464
 epoch: 59, train_loss: 0.5871, test_loss: 1.2365, test_f1: 0.5474
 epoch: 60, train_loss: 0.5750, test_loss: 1.1978, test_f1: 0.5336
 epoch: 61, train_loss: 0.5860, test_loss: 1.1654, test_f1: 0.5596
 epoch: 62, train_loss: 0.5731, test_loss: 1.2057, test_f1: 0.5444
 epoch: 63, train_loss: 0.5669, test_loss: 1.2328, test_f1: 0.5313
 epoch: 64, train_loss: 0.5715, test_loss: 1.1855, test_f1: 0.5389
 epoch: 65, train_loss: 0.5677, test_loss: 1.2129, test_f1: 0.5416
 epoch: 66, train_loss: 0.5614, test_loss: 1.2241, test_f1: 0.5557
 epoch: 67, train_loss: 0.5549, test_loss: 1.2369, test_f1: 0.5302
 epoch: 68, train_loss: 0.5677, test_loss: 1.2558, test_f1: 0.5462
 epoch: 69, train_loss: 0.5569, test_loss: 1.2480, test_f1: 0.5434
 epoch: 70, train_loss: 0.5456, test_loss: 1.2818, test_f1: 0.5508
 epoch: 71, train_loss: 0.5639, test_loss: 1.2631, test_f1: 0.5502
 epoch: 72, train_loss: 0.5394, test_loss: 1.2259, test_f1: 0.5396
 epoch: 73, train_loss: 0.5358, test_loss: 1.3277, test_f1: 0.5435
 epoch: 74, train_loss: 0.5320, test_loss: 1.2610, test_f1: 0.5592
 epoch: 75, train_loss: 0.5391, test_loss: 1.2256, test_f1: 0.5431
 epoch: 76, train_loss: 0.5316, test_loss: 1.3270, test_f1: 0.5342
 epoch: 77, train_loss: 0.5164, test_loss: 1.3212, test_f1: 0.5500
 epoch: 78, train_loss: 0.5300, test_loss: 1.3093, test_f1: 0.5091
 epoch: 79, train_loss: 0.5263, test_loss: 1.2557, test_f1: 0.5594
 epoch: 80, train_loss: 0.5217, test_loss: 1.4099, test_f1: 0.5274
 epoch: 81, train_loss: 0.5175, test_loss: 1.3036, test_f1: 0.5686
 epoch: 82, train_loss: 0.5071, test_loss: 1.3178, test_f1: 0.5434
 epoch: 83, train_loss: 0.5198, test_loss: 1.3051, test_f1: 0.5432
 epoch: 84, train_loss: 0.5049, test_loss: 1.4344, test_f1: 0.5231
 epoch: 85, train_loss: 0.5041, test_loss: 1.2945, test_f1: 0.5397
 epoch: 86, train_loss: 0.4955, test_loss: 1.2620, test_f1: 0.5718
 epoch: 87, train_loss: 0.4946, test_loss: 1.3863, test_f1: 0.5341
 epoch: 88, train_loss: 0.4932, test_loss: 1.3819, test_f1: 0.5330
 epoch: 89, train_loss: 0.4899, test_loss: 1.4604, test_f1: 0.5304
 epoch: 90, train_loss: 0.4902, test_loss: 1.5869, test_f1: 0.5124
 epoch: 91, train_loss: 0.4872, test_loss: 1.4702, test_f1: 0.5491
 epoch: 92, train_loss: 0.4898, test_loss: 1.3889, test_f1: 0.5267
 epoch: 93, train_loss: 0.4825, test_loss: 1.3584, test_f1: 0.5596
 epoch: 94, train_loss: 0.4727, test_loss: 1.3806, test_f1: 0.5375
 epoch: 95, train_loss: 0.4779, test_loss: 1.3554, test_f1: 0.5620
 epoch: 96, train_loss: 0.4682, test_loss: 1.2972, test_f1: 0.5538
 epoch: 97, train_loss: 0.4668, test_loss: 1.5400, test_f1: 0.5369
 epoch: 98, train_loss: 0.4693, test_loss: 1.3621, test_f1: 0.5757
 epoch: 99, train_loss: 0.4679, test_loss: 1.3688, test_f1: 0.5721
##################ITERATION #7 ****************************************
 epoch: 0, train_loss: 1.5536, test_loss: 1.2604, test_f1: 0.3866
 epoch: 1, train_loss: 1.2492, test_loss: 1.1163, test_f1: 0.4358
 epoch: 2, train_loss: 1.1733, test_loss: 1.0763, test_f1: 0.4662
 epoch: 3, train_loss: 1.1434, test_loss: 1.0334, test_f1: 0.4891
 epoch: 4, train_loss: 1.0962, test_loss: 1.0228, test_f1: 0.5148
 epoch: 5, train_loss: 1.0854, test_loss: 1.0040, test_f1: 0.5067
 epoch: 6, train_loss: 1.0517, test_loss: 0.9788, test_f1: 0.5198
 epoch: 7, train_loss: 1.0281, test_loss: 0.9671, test_f1: 0.5112
 epoch: 8, train_loss: 1.0108, test_loss: 0.9668, test_f1: 0.5337
 epoch: 9, train_loss: 0.9884, test_loss: 0.9364, test_f1: 0.5168
 epoch: 10, train_loss: 0.9784, test_loss: 0.9806, test_f1: 0.4606
 epoch: 11, train_loss: 0.9665, test_loss: 0.9371, test_f1: 0.4951
 epoch: 12, train_loss: 0.9464, test_loss: 0.9756, test_f1: 0.5035
 epoch: 13, train_loss: 0.9378, test_loss: 0.9748, test_f1: 0.5296
 epoch: 14, train_loss: 0.9213, test_loss: 0.9167, test_f1: 0.5316
 epoch: 15, train_loss: 0.9161, test_loss: 0.9486, test_f1: 0.5288
 epoch: 16, train_loss: 0.9048, test_loss: 0.9517, test_f1: 0.5369
 epoch: 17, train_loss: 0.8942, test_loss: 0.9506, test_f1: 0.5168
 epoch: 18, train_loss: 0.8757, test_loss: 1.0035, test_f1: 0.5269
 epoch: 19, train_loss: 0.8717, test_loss: 0.9797, test_f1: 0.5264
 epoch: 20, train_loss: 0.8603, test_loss: 0.9863, test_f1: 0.5488
 epoch: 21, train_loss: 0.8506, test_loss: 0.9382, test_f1: 0.5234
 epoch: 22, train_loss: 0.8463, test_loss: 1.0042, test_f1: 0.5445
 epoch: 23, train_loss: 0.8259, test_loss: 0.9776, test_f1: 0.5217
 epoch: 24, train_loss: 0.8249, test_loss: 1.0627, test_f1: 0.4907
 epoch: 25, train_loss: 0.8219, test_loss: 0.9907, test_f1: 0.5345
 epoch: 26, train_loss: 0.7999, test_loss: 1.0108, test_f1: 0.5298
 epoch: 27, train_loss: 0.7930, test_loss: 1.0431, test_f1: 0.5561
 epoch: 28, train_loss: 0.7840, test_loss: 1.0335, test_f1: 0.5545
 epoch: 29, train_loss: 0.7903, test_loss: 1.0253, test_f1: 0.5296
 epoch: 30, train_loss: 0.7785, test_loss: 1.0183, test_f1: 0.5750
 epoch: 31, train_loss: 0.7718, test_loss: 1.0158, test_f1: 0.5520
 epoch: 32, train_loss: 0.7635, test_loss: 0.9853, test_f1: 0.5484
 epoch: 33, train_loss: 0.7583, test_loss: 1.0289, test_f1: 0.5560
 epoch: 34, train_loss: 0.7597, test_loss: 1.0573, test_f1: 0.5561
 epoch: 35, train_loss: 0.7622, test_loss: 1.0274, test_f1: 0.5308
 epoch: 36, train_loss: 0.7434, test_loss: 1.0785, test_f1: 0.5318
 epoch: 37, train_loss: 0.7258, test_loss: 1.0598, test_f1: 0.5458
 epoch: 38, train_loss: 0.7167, test_loss: 1.0950, test_f1: 0.5396
 epoch: 39, train_loss: 0.7270, test_loss: 1.0656, test_f1: 0.5705
 epoch: 40, train_loss: 0.7123, test_loss: 1.0998, test_f1: 0.5403
 epoch: 41, train_loss: 0.7122, test_loss: 1.0935, test_f1: 0.5641
 epoch: 42, train_loss: 0.7207, test_loss: 1.2461, test_f1: 0.5229
 epoch: 43, train_loss: 0.7110, test_loss: 1.1484, test_f1: 0.5417
 epoch: 44, train_loss: 0.7022, test_loss: 1.1166, test_f1: 0.5512
 epoch: 45, train_loss: 0.6842, test_loss: 1.1393, test_f1: 0.5507
 epoch: 46, train_loss: 0.6905, test_loss: 1.1602, test_f1: 0.5915
 epoch: 47, train_loss: 0.6851, test_loss: 1.2005, test_f1: 0.5320
 epoch: 48, train_loss: 0.6797, test_loss: 1.0568, test_f1: 0.5590
 epoch: 49, train_loss: 0.6934, test_loss: 1.1436, test_f1: 0.5593
 epoch: 50, train_loss: 0.6783, test_loss: 1.1837, test_f1: 0.5474
 epoch: 51, train_loss: 0.6428, test_loss: 1.1150, test_f1: 0.5633
 epoch: 52, train_loss: 0.6385, test_loss: 1.1542, test_f1: 0.5586
 epoch: 53, train_loss: 0.6236, test_loss: 1.2227, test_f1: 0.5509
 epoch: 54, train_loss: 0.6221, test_loss: 1.1369, test_f1: 0.5444
 epoch: 55, train_loss: 0.6093, test_loss: 1.1948, test_f1: 0.5612
 epoch: 56, train_loss: 0.6120, test_loss: 1.2087, test_f1: 0.5607
 epoch: 57, train_loss: 0.6088, test_loss: 1.2239, test_f1: 0.5374
 epoch: 58, train_loss: 0.6008, test_loss: 1.1998, test_f1: 0.5199
 epoch: 59, train_loss: 0.6114, test_loss: 1.1963, test_f1: 0.5315
 epoch: 60, train_loss: 0.5904, test_loss: 1.1804, test_f1: 0.5290
 epoch: 61, train_loss: 0.5986, test_loss: 1.2527, test_f1: 0.5406
 epoch: 62, train_loss: 0.5960, test_loss: 1.1907, test_f1: 0.5713
 epoch: 63, train_loss: 0.6017, test_loss: 1.1132, test_f1: 0.5665
 epoch: 64, train_loss: 0.5801, test_loss: 1.2519, test_f1: 0.5468
 epoch: 65, train_loss: 0.5872, test_loss: 1.2183, test_f1: 0.5533
 epoch: 66, train_loss: 0.5640, test_loss: 1.2137, test_f1: 0.5477
 epoch: 67, train_loss: 0.5749, test_loss: 1.2584, test_f1: 0.5544
 epoch: 68, train_loss: 0.5790, test_loss: 1.1683, test_f1: 0.5718
 epoch: 69, train_loss: 0.5674, test_loss: 1.2386, test_f1: 0.5246
 epoch: 70, train_loss: 0.5570, test_loss: 1.2456, test_f1: 0.5572
 epoch: 71, train_loss: 0.5825, test_loss: 1.2217, test_f1: 0.5565
 epoch: 72, train_loss: 0.5650, test_loss: 1.2426, test_f1: 0.5335
 epoch: 73, train_loss: 0.5584, test_loss: 1.2821, test_f1: 0.5523
 epoch: 74, train_loss: 0.5533, test_loss: 1.3708, test_f1: 0.5267
 epoch: 75, train_loss: 0.5595, test_loss: 1.2822, test_f1: 0.5549
 epoch: 76, train_loss: 0.5528, test_loss: 1.3219, test_f1: 0.5179
 epoch: 77, train_loss: 0.5490, test_loss: 1.2861, test_f1: 0.5410
 epoch: 78, train_loss: 0.5501, test_loss: 1.2980, test_f1: 0.5589
 epoch: 79, train_loss: 0.5318, test_loss: 1.3680, test_f1: 0.5383
 epoch: 80, train_loss: 0.5486, test_loss: 1.2179, test_f1: 0.5416
 epoch: 81, train_loss: 0.5125, test_loss: 1.2679, test_f1: 0.5436
 epoch: 82, train_loss: 0.5346, test_loss: 1.3048, test_f1: 0.5480
 epoch: 83, train_loss: 0.5229, test_loss: 1.2414, test_f1: 0.5588
 epoch: 84, train_loss: 0.5034, test_loss: 1.3289, test_f1: 0.5627
 epoch: 85, train_loss: 0.5322, test_loss: 1.3645, test_f1: 0.5336
 epoch: 86, train_loss: 0.5296, test_loss: 1.3400, test_f1: 0.5671
 epoch: 87, train_loss: 0.5124, test_loss: 1.3314, test_f1: 0.5260
 epoch: 88, train_loss: 0.5280, test_loss: 1.4253, test_f1: 0.5440
 epoch: 89, train_loss: 0.5287, test_loss: 1.5614, test_f1: 0.5114
 epoch: 90, train_loss: 0.5229, test_loss: 1.5586, test_f1: 0.5503
 epoch: 91, train_loss: 0.5161, test_loss: 1.3858, test_f1: 0.5446
 epoch: 92, train_loss: 0.5211, test_loss: 1.4033, test_f1: 0.5310
 epoch: 93, train_loss: 0.5201, test_loss: 1.3687, test_f1: 0.5345
 epoch: 94, train_loss: 0.4979, test_loss: 1.4061, test_f1: 0.5663
 epoch: 95, train_loss: 0.4997, test_loss: 1.4603, test_f1: 0.5387
 epoch: 96, train_loss: 0.4945, test_loss: 1.3329, test_f1: 0.5282
 epoch: 97, train_loss: 0.5084, test_loss: 1.3299, test_f1: 0.5465
 epoch: 98, train_loss: 0.4929, test_loss: 1.3144, test_f1: 0.5626
 epoch: 99, train_loss: 0.5014, test_loss: 1.4118, test_f1: 0.5402
##################ITERATION #8 ****************************************
 epoch: 0, train_loss: 1.4917, test_loss: 1.3623, test_f1: 0.2804
 epoch: 1, train_loss: 1.2060, test_loss: 1.1235, test_f1: 0.4372
 epoch: 2, train_loss: 1.1536, test_loss: 1.0412, test_f1: 0.4433
 epoch: 3, train_loss: 1.1106, test_loss: 1.0427, test_f1: 0.4381
 epoch: 4, train_loss: 1.0956, test_loss: 1.0104, test_f1: 0.4390
 epoch: 5, train_loss: 1.0625, test_loss: 0.9895, test_f1: 0.4429
 epoch: 6, train_loss: 1.0445, test_loss: 0.9770, test_f1: 0.4821
 epoch: 7, train_loss: 1.0289, test_loss: 1.0278, test_f1: 0.4348
 epoch: 8, train_loss: 1.0159, test_loss: 0.9777, test_f1: 0.4544
 epoch: 9, train_loss: 0.9882, test_loss: 1.0086, test_f1: 0.4727
 epoch: 10, train_loss: 0.9884, test_loss: 0.9510, test_f1: 0.4378
 epoch: 11, train_loss: 0.9715, test_loss: 0.9346, test_f1: 0.4842
 epoch: 12, train_loss: 0.9552, test_loss: 0.9456, test_f1: 0.4679
 epoch: 13, train_loss: 0.9431, test_loss: 0.9493, test_f1: 0.4714
 epoch: 14, train_loss: 0.9534, test_loss: 0.9461, test_f1: 0.4663
 epoch: 15, train_loss: 0.9201, test_loss: 0.9282, test_f1: 0.5060
 epoch: 16, train_loss: 0.9068, test_loss: 0.9547, test_f1: 0.5147
 epoch: 17, train_loss: 0.8963, test_loss: 0.9543, test_f1: 0.4956
 epoch: 18, train_loss: 0.8975, test_loss: 0.9862, test_f1: 0.5031
 epoch: 19, train_loss: 0.8989, test_loss: 0.9952, test_f1: 0.5084
 epoch: 20, train_loss: 0.8888, test_loss: 0.9451, test_f1: 0.5348
 epoch: 21, train_loss: 0.8563, test_loss: 0.9984, test_f1: 0.5290
 epoch: 22, train_loss: 0.8743, test_loss: 1.0211, test_f1: 0.5026
 epoch: 23, train_loss: 0.8657, test_loss: 0.9638, test_f1: 0.5486
 epoch: 24, train_loss: 0.8537, test_loss: 0.9401, test_f1: 0.5621
 epoch: 25, train_loss: 0.8482, test_loss: 1.0019, test_f1: 0.5188
 epoch: 26, train_loss: 0.8504, test_loss: 1.0001, test_f1: 0.5135
 epoch: 27, train_loss: 0.8241, test_loss: 0.9347, test_f1: 0.5369
 epoch: 28, train_loss: 0.8310, test_loss: 1.0500, test_f1: 0.5285
 epoch: 29, train_loss: 0.8173, test_loss: 1.0704, test_f1: 0.5372
 epoch: 30, train_loss: 0.8181, test_loss: 1.0015, test_f1: 0.5177
 epoch: 31, train_loss: 0.8066, test_loss: 0.9950, test_f1: 0.5441
 epoch: 32, train_loss: 0.8197, test_loss: 1.0080, test_f1: 0.5512
 epoch: 33, train_loss: 0.7945, test_loss: 1.1855, test_f1: 0.5202
 epoch: 34, train_loss: 0.7807, test_loss: 1.0973, test_f1: 0.5363
 epoch: 35, train_loss: 0.7741, test_loss: 1.0593, test_f1: 0.5168
 epoch: 36, train_loss: 0.7809, test_loss: 1.0479, test_f1: 0.5331
 epoch: 37, train_loss: 0.7693, test_loss: 1.0611, test_f1: 0.5403
 epoch: 38, train_loss: 0.7737, test_loss: 1.1360, test_f1: 0.5223
 epoch: 39, train_loss: 0.7566, test_loss: 1.1252, test_f1: 0.5392
 epoch: 40, train_loss: 0.7584, test_loss: 1.0747, test_f1: 0.5314
 epoch: 41, train_loss: 0.7514, test_loss: 1.1092, test_f1: 0.5347
 epoch: 42, train_loss: 0.7386, test_loss: 1.1804, test_f1: 0.5269
 epoch: 43, train_loss: 0.7304, test_loss: 1.1308, test_f1: 0.5228
 epoch: 44, train_loss: 0.7331, test_loss: 1.1806, test_f1: 0.5017
 epoch: 45, train_loss: 0.7322, test_loss: 1.1599, test_f1: 0.5298
 epoch: 46, train_loss: 0.7269, test_loss: 1.1552, test_f1: 0.5369
 epoch: 47, train_loss: 0.7122, test_loss: 1.1420, test_f1: 0.5538
 epoch: 48, train_loss: 0.7217, test_loss: 1.1646, test_f1: 0.5446
 epoch: 49, train_loss: 0.7174, test_loss: 1.2003, test_f1: 0.5442
 epoch: 50, train_loss: 0.7164, test_loss: 1.1698, test_f1: 0.5237
 epoch: 51, train_loss: 0.6901, test_loss: 1.1183, test_f1: 0.5357
 epoch: 52, train_loss: 0.6722, test_loss: 1.1482, test_f1: 0.5520
 epoch: 53, train_loss: 0.6576, test_loss: 1.1699, test_f1: 0.5384
 epoch: 54, train_loss: 0.6549, test_loss: 1.1528, test_f1: 0.5629
 epoch: 55, train_loss: 0.6383, test_loss: 1.1887, test_f1: 0.5577
 epoch: 56, train_loss: 0.6393, test_loss: 1.2209, test_f1: 0.5525
 epoch: 57, train_loss: 0.6384, test_loss: 1.1908, test_f1: 0.5558
 epoch: 58, train_loss: 0.6431, test_loss: 1.2196, test_f1: 0.5597
 epoch: 59, train_loss: 0.6439, test_loss: 1.1955, test_f1: 0.5552
 epoch: 60, train_loss: 0.6199, test_loss: 1.3055, test_f1: 0.5196
 epoch: 61, train_loss: 0.6405, test_loss: 1.2086, test_f1: 0.5321
 epoch: 62, train_loss: 0.6370, test_loss: 1.1774, test_f1: 0.5357
 epoch: 63, train_loss: 0.6126, test_loss: 1.2288, test_f1: 0.5384
 epoch: 64, train_loss: 0.6286, test_loss: 1.3014, test_f1: 0.5398
 epoch: 65, train_loss: 0.6201, test_loss: 1.2009, test_f1: 0.5698
 epoch: 66, train_loss: 0.6274, test_loss: 1.2379, test_f1: 0.5618
 epoch: 67, train_loss: 0.6155, test_loss: 1.2463, test_f1: 0.5521
 epoch: 68, train_loss: 0.6111, test_loss: 1.2855, test_f1: 0.5492
 epoch: 69, train_loss: 0.6073, test_loss: 1.3339, test_f1: 0.5376
 epoch: 70, train_loss: 0.5965, test_loss: 1.2571, test_f1: 0.5372
 epoch: 71, train_loss: 0.6019, test_loss: 1.2682, test_f1: 0.5456
 epoch: 72, train_loss: 0.6065, test_loss: 1.2741, test_f1: 0.5495
 epoch: 73, train_loss: 0.5820, test_loss: 1.2698, test_f1: 0.5775
 epoch: 74, train_loss: 0.5964, test_loss: 1.2712, test_f1: 0.5507
 epoch: 75, train_loss: 0.5755, test_loss: 1.3060, test_f1: 0.5563
 epoch: 76, train_loss: 0.5828, test_loss: 1.2919, test_f1: 0.5463
 epoch: 77, train_loss: 0.5772, test_loss: 1.2629, test_f1: 0.5623
 epoch: 78, train_loss: 0.5874, test_loss: 1.3292, test_f1: 0.5586
 epoch: 79, train_loss: 0.5787, test_loss: 1.3177, test_f1: 0.5507
 epoch: 80, train_loss: 0.5855, test_loss: 1.3099, test_f1: 0.5458
 epoch: 81, train_loss: 0.5678, test_loss: 1.3203, test_f1: 0.5316
 epoch: 82, train_loss: 0.5696, test_loss: 1.3571, test_f1: 0.5567
 epoch: 83, train_loss: 0.5594, test_loss: 1.3428, test_f1: 0.5390
 epoch: 84, train_loss: 0.5518, test_loss: 1.3506, test_f1: 0.5475
 epoch: 85, train_loss: 0.5694, test_loss: 1.3673, test_f1: 0.5405
 epoch: 86, train_loss: 0.5490, test_loss: 1.3226, test_f1: 0.5639
 epoch: 87, train_loss: 0.5474, test_loss: 1.3735, test_f1: 0.5664
 epoch: 88, train_loss: 0.5386, test_loss: 1.3540, test_f1: 0.5609
 epoch: 89, train_loss: 0.5381, test_loss: 1.4333, test_f1: 0.5383
 epoch: 90, train_loss: 0.5402, test_loss: 1.3997, test_f1: 0.5479
 epoch: 91, train_loss: 0.5453, test_loss: 1.3828, test_f1: 0.5486
 epoch: 92, train_loss: 0.5424, test_loss: 1.3657, test_f1: 0.5416
 epoch: 93, train_loss: 0.5512, test_loss: 1.3731, test_f1: 0.5388
 epoch: 94, train_loss: 0.5460, test_loss: 1.3743, test_f1: 0.5391
 epoch: 95, train_loss: 0.5168, test_loss: 1.3674, test_f1: 0.5660
 epoch: 96, train_loss: 0.5266, test_loss: 1.4324, test_f1: 0.5344
 epoch: 97, train_loss: 0.5418, test_loss: 1.4235, test_f1: 0.5340
 epoch: 98, train_loss: 0.5051, test_loss: 1.4188, test_f1: 0.5493
 epoch: 99, train_loss: 0.5247, test_loss: 1.4212, test_f1: 0.5505
##################ITERATION #9 ****************************************
 epoch: 0, train_loss: 1.6905, test_loss: 1.1715, test_f1: 0.3511
 epoch: 1, train_loss: 1.1964, test_loss: 1.1259, test_f1: 0.4071
 epoch: 2, train_loss: 1.1486, test_loss: 1.0665, test_f1: 0.4230
 epoch: 3, train_loss: 1.1056, test_loss: 1.1035, test_f1: 0.4390
 epoch: 4, train_loss: 1.0961, test_loss: 1.0422, test_f1: 0.4578
 epoch: 5, train_loss: 1.0598, test_loss: 1.0313, test_f1: 0.4647
 epoch: 6, train_loss: 1.0295, test_loss: 1.0051, test_f1: 0.4535
 epoch: 7, train_loss: 1.0243, test_loss: 0.9849, test_f1: 0.4943
 epoch: 8, train_loss: 1.0023, test_loss: 0.9861, test_f1: 0.4687
 epoch: 9, train_loss: 0.9787, test_loss: 0.9749, test_f1: 0.4793
 epoch: 10, train_loss: 0.9757, test_loss: 1.0019, test_f1: 0.4883
 epoch: 11, train_loss: 0.9690, test_loss: 1.0034, test_f1: 0.4854
 epoch: 12, train_loss: 0.9594, test_loss: 1.0898, test_f1: 0.4643
 epoch: 13, train_loss: 0.9484, test_loss: 0.9926, test_f1: 0.4767
 epoch: 14, train_loss: 0.9224, test_loss: 0.9796, test_f1: 0.4864
 epoch: 15, train_loss: 0.9225, test_loss: 0.9807, test_f1: 0.5234
 epoch: 16, train_loss: 0.9216, test_loss: 1.0476, test_f1: 0.4885
 epoch: 17, train_loss: 0.8939, test_loss: 1.0138, test_f1: 0.4897
 epoch: 18, train_loss: 0.8721, test_loss: 1.0130, test_f1: 0.5086
 epoch: 19, train_loss: 0.8758, test_loss: 1.0086, test_f1: 0.5094
 epoch: 20, train_loss: 0.8685, test_loss: 1.0052, test_f1: 0.5162
 epoch: 21, train_loss: 0.8621, test_loss: 0.9774, test_f1: 0.5313
 epoch: 22, train_loss: 0.8388, test_loss: 0.9965, test_f1: 0.4888
 epoch: 23, train_loss: 0.8402, test_loss: 1.0213, test_f1: 0.5106
 epoch: 24, train_loss: 0.8466, test_loss: 1.0294, test_f1: 0.5213
 epoch: 25, train_loss: 0.8352, test_loss: 1.0157, test_f1: 0.4910
 epoch: 26, train_loss: 0.8313, test_loss: 0.9489, test_f1: 0.4995
 epoch: 27, train_loss: 0.8162, test_loss: 1.0249, test_f1: 0.5395
 epoch: 28, train_loss: 0.8053, test_loss: 0.9703, test_f1: 0.5725
 epoch: 29, train_loss: 0.7983, test_loss: 1.0377, test_f1: 0.5354
 epoch: 30, train_loss: 0.7913, test_loss: 1.0570, test_f1: 0.5214
 epoch: 31, train_loss: 0.7913, test_loss: 1.1179, test_f1: 0.4954
 epoch: 32, train_loss: 0.7820, test_loss: 0.9952, test_f1: 0.5532
 epoch: 33, train_loss: 0.7700, test_loss: 1.0565, test_f1: 0.5111
 epoch: 34, train_loss: 0.7802, test_loss: 1.0800, test_f1: 0.5293
 epoch: 35, train_loss: 0.7506, test_loss: 1.1179, test_f1: 0.5600
 epoch: 36, train_loss: 0.7611, test_loss: 1.0341, test_f1: 0.5424
 epoch: 37, train_loss: 0.7360, test_loss: 1.1472, test_f1: 0.5185
 epoch: 38, train_loss: 0.7315, test_loss: 1.2255, test_f1: 0.5181
 epoch: 39, train_loss: 0.7462, test_loss: 1.1135, test_f1: 0.5282
 epoch: 40, train_loss: 0.7371, test_loss: 1.1169, test_f1: 0.5272
 epoch: 41, train_loss: 0.7275, test_loss: 1.0864, test_f1: 0.5338
 epoch: 42, train_loss: 0.7305, test_loss: 1.0745, test_f1: 0.5147
 epoch: 43, train_loss: 0.7227, test_loss: 1.1309, test_f1: 0.5348
 epoch: 44, train_loss: 0.7095, test_loss: 1.0438, test_f1: 0.5642
 epoch: 45, train_loss: 0.7143, test_loss: 1.0935, test_f1: 0.5530
 epoch: 46, train_loss: 0.7024, test_loss: 1.1800, test_f1: 0.5349
 epoch: 47, train_loss: 0.6893, test_loss: 1.1207, test_f1: 0.5436
 epoch: 48, train_loss: 0.6783, test_loss: 1.1932, test_f1: 0.4909
 epoch: 49, train_loss: 0.6867, test_loss: 1.1773, test_f1: 0.5332
 epoch: 50, train_loss: 0.6903, test_loss: 1.1291, test_f1: 0.5423
 epoch: 51, train_loss: 0.6608, test_loss: 1.1963, test_f1: 0.5540
 epoch: 52, train_loss: 0.6330, test_loss: 1.1718, test_f1: 0.5594
 epoch: 53, train_loss: 0.6369, test_loss: 1.1771, test_f1: 0.5496
 epoch: 54, train_loss: 0.6372, test_loss: 1.1783, test_f1: 0.5575
 epoch: 55, train_loss: 0.6140, test_loss: 1.2338, test_f1: 0.5584
 epoch: 56, train_loss: 0.6337, test_loss: 1.3050, test_f1: 0.5317
 epoch: 57, train_loss: 0.6160, test_loss: 1.2173, test_f1: 0.5479
 epoch: 58, train_loss: 0.6157, test_loss: 1.2019, test_f1: 0.5468
 epoch: 59, train_loss: 0.6278, test_loss: 1.2538, test_f1: 0.5497
 epoch: 60, train_loss: 0.6156, test_loss: 1.2369, test_f1: 0.5669
 epoch: 61, train_loss: 0.6056, test_loss: 1.2761, test_f1: 0.5385
 epoch: 62, train_loss: 0.6128, test_loss: 1.2876, test_f1: 0.5589
 epoch: 63, train_loss: 0.5879, test_loss: 1.2404, test_f1: 0.5741
 epoch: 64, train_loss: 0.5858, test_loss: 1.2909, test_f1: 0.5588
 epoch: 65, train_loss: 0.5758, test_loss: 1.3102, test_f1: 0.5420
 epoch: 66, train_loss: 0.5961, test_loss: 1.2838, test_f1: 0.5460
 epoch: 67, train_loss: 0.5881, test_loss: 1.3091, test_f1: 0.5430
 epoch: 68, train_loss: 0.5728, test_loss: 1.2276, test_f1: 0.5465
 epoch: 69, train_loss: 0.5788, test_loss: 1.3270, test_f1: 0.5403
 epoch: 70, train_loss: 0.5822, test_loss: 1.2981, test_f1: 0.5406
 epoch: 71, train_loss: 0.5705, test_loss: 1.3195, test_f1: 0.5463
 epoch: 72, train_loss: 0.5502, test_loss: 1.3089, test_f1: 0.5424
 epoch: 73, train_loss: 0.5615, test_loss: 1.3848, test_f1: 0.5413
 epoch: 74, train_loss: 0.5790, test_loss: 1.3480, test_f1: 0.5382
 epoch: 75, train_loss: 0.5759, test_loss: 1.3295, test_f1: 0.5445
 epoch: 76, train_loss: 0.5655, test_loss: 1.3957, test_f1: 0.5427
 epoch: 77, train_loss: 0.5527, test_loss: 1.3530, test_f1: 0.5364
 epoch: 78, train_loss: 0.5473, test_loss: 1.3410, test_f1: 0.5184
 epoch: 79, train_loss: 0.5534, test_loss: 1.4007, test_f1: 0.5488
 epoch: 80, train_loss: 0.5461, test_loss: 1.4574, test_f1: 0.5417
 epoch: 81, train_loss: 0.5338, test_loss: 1.4254, test_f1: 0.5544
 epoch: 82, train_loss: 0.5431, test_loss: 1.2936, test_f1: 0.5502
 epoch: 83, train_loss: 0.5355, test_loss: 1.4456, test_f1: 0.5629
 epoch: 84, train_loss: 0.5373, test_loss: 1.4344, test_f1: 0.5401
 epoch: 85, train_loss: 0.5511, test_loss: 1.3585, test_f1: 0.5365
 epoch: 86, train_loss: 0.5464, test_loss: 1.4087, test_f1: 0.5658
 epoch: 87, train_loss: 0.5316, test_loss: 1.3389, test_f1: 0.5445
 epoch: 88, train_loss: 0.5348, test_loss: 1.4377, test_f1: 0.5317
 epoch: 89, train_loss: 0.5307, test_loss: 1.2257, test_f1: 0.5629
 epoch: 90, train_loss: 0.5142, test_loss: 1.4100, test_f1: 0.5382
 epoch: 91, train_loss: 0.5024, test_loss: 1.4617, test_f1: 0.5386
 epoch: 92, train_loss: 0.5062, test_loss: 1.3899, test_f1: 0.5572
 epoch: 93, train_loss: 0.5028, test_loss: 1.5204, test_f1: 0.5304
 epoch: 94, train_loss: 0.5084, test_loss: 1.4831, test_f1: 0.5303
 epoch: 95, train_loss: 0.5142, test_loss: 1.4207, test_f1: 0.5743
 epoch: 96, train_loss: 0.4924, test_loss: 1.3663, test_f1: 0.5526
 epoch: 97, train_loss: 0.4882, test_loss: 1.4649, test_f1: 0.5404
 epoch: 98, train_loss: 0.5082, test_loss: 1.5587, test_f1: 0.5300
 epoch: 99, train_loss: 0.4962, test_loss: 1.4589, test_f1: 0.5660

Training completed in 426.74 seconds
Best F1: 0.6035 at epoch 55
Mean F1 across iterations: 0.5837  0.0127
========================FINAL RESULTS================================
FEGIN weighted F1: 0.6035  0.0127
python main.py --data ltspice_examples --representation component_component --model FEGIN --layers 2 --hiddens 64 --batch_size 128 --lr 0.001 --emb_size 250 --epochs 100 --save_appendix component_component_L2_H64_BS128_LR0.001_E250 --no_val
-----



STDERR:
  File "main.py", line 370, in <module>
    main()
  File "main.py", line 254, in main
    dataset = dataset_class(
  File "/home/philip/projects/ltspice_examples_code_repo/Circuit-Completion-Using-GNNs/component_classification_with_link_prediction_head/evaluation/FEGIN/kernel/circuit_datasets.py", line 15, in __init__
    self.data, self.slices = torch.load(self.processed_paths[0])
  File "/home/philip/.local/lib/python3.8/site-packages/torch/serialization.py", line 1040, in load
    warnings.warn(
  File "/usr/lib/python3.8/warnings.py", line 109, in _showwarnmsg
    sw(msg.message, msg.category, msg.filename, msg.lineno,
  File "main.py", line 47, in warn_with_traceback
    traceback.print_stack(file=log)
/home/philip/projects/ltspice_examples_code_repo/Circuit-Completion-Using-GNNs/component_classification_with_link_prediction_head/evaluation/FEGIN/kernel/circuit_datasets.py:15: FutureWarning: You are using `torch.load` with `weights_only=False` (the current default value), which uses the default pickle module implicitly. It is possible to construct malicious pickle data which will execute arbitrary code during unpickling (See https://github.com/pytorch/pytorch/blob/main/SECURITY.md#untrusted-models for more details). In a future release, the default value for `weights_only` will be flipped to `True`. This limits the functions that could be executed during unpickling. Arbitrary objects will no longer be allowed to be loaded via this mode unless they are explicitly allowlisted by the user via `torch.serialization.add_safe_globals`. We recommend you start setting `weights_only=True` for any use case where you don't have full control of the loaded file. Please open an issue on GitHub for any issues related to this experimental feature.
  self.data, self.slices = torch.load(self.processed_paths[0])
