STDOUT:
Results will be saved in /home/philip/projects/ltspice_examples_code_repo/Circuit-Completion-Using-GNNs/component_classification_with_link_prediction_head/evaluation/FEGIN/results/model_FEGIN_dataset_ltspice_examples
Command line input: python main.py --data ltspice_examples --representation component_pin --model FEGIN --layers 2 --hiddens 128 --batch_size 64 --lr 0.01 --emb_size 512 --epochs 100 --save_appendix component_pin_L2_H128_BS64_LR0.01_E512 --no_val
 is saved.
-----
ltspice_examples - FEGIN
Using 2 layers, 128 hidden units, h = 2
Loading component_pin representation dataset
ENTERED
Training FEGIN on component_pin representation
Train: 3560, Test: 848
##################ITERATION #0 ****************************************
 epoch: 0, train_loss: 1.1636, test_loss: 1.0962, test_f1: 0.3482
 epoch: 1, train_loss: 0.9909, test_loss: 1.3006, test_f1: 0.4588
 epoch: 2, train_loss: 0.9305, test_loss: 0.9047, test_f1: 0.5085
 epoch: 3, train_loss: 0.9027, test_loss: 1.0034, test_f1: 0.4365
 epoch: 4, train_loss: 0.8882, test_loss: 0.8867, test_f1: 0.5292
 epoch: 5, train_loss: 0.8609, test_loss: 0.9522, test_f1: 0.4478
 epoch: 6, train_loss: 0.8412, test_loss: 0.8961, test_f1: 0.5755
 epoch: 7, train_loss: 0.8344, test_loss: 0.8851, test_f1: 0.5691
 epoch: 8, train_loss: 0.8135, test_loss: 0.7650, test_f1: 0.5842
 epoch: 9, train_loss: 0.7861, test_loss: 0.8189, test_f1: 0.6200
 epoch: 10, train_loss: 0.7943, test_loss: 1.1031, test_f1: 0.5311
 epoch: 11, train_loss: 0.7734, test_loss: 0.7756, test_f1: 0.5384
 epoch: 12, train_loss: 0.7632, test_loss: 0.9179, test_f1: 0.5328
 epoch: 13, train_loss: 0.7461, test_loss: 0.9898, test_f1: 0.4832
 epoch: 14, train_loss: 0.7416, test_loss: 0.7333, test_f1: 0.5791
 epoch: 15, train_loss: 0.7295, test_loss: 0.8320, test_f1: 0.5892
 epoch: 16, train_loss: 0.7219, test_loss: 0.8134, test_f1: 0.5658
 epoch: 17, train_loss: 0.7043, test_loss: 0.7547, test_f1: 0.5924
 epoch: 18, train_loss: 0.6969, test_loss: 0.8520, test_f1: 0.6033
 epoch: 19, train_loss: 0.6948, test_loss: 0.8977, test_f1: 0.5931
 epoch: 20, train_loss: 0.6876, test_loss: 0.7887, test_f1: 0.5876
 epoch: 21, train_loss: 0.6706, test_loss: 0.7088, test_f1: 0.5888
 epoch: 22, train_loss: 0.6864, test_loss: 0.8040, test_f1: 0.6370
 epoch: 23, train_loss: 0.6821, test_loss: 0.7477, test_f1: 0.6042
 epoch: 24, train_loss: 0.6387, test_loss: 0.7886, test_f1: 0.6188
 epoch: 25, train_loss: 0.6565, test_loss: 0.8250, test_f1: 0.5866
 epoch: 26, train_loss: 0.6331, test_loss: 0.8196, test_f1: 0.6468
 epoch: 27, train_loss: 0.6493, test_loss: 0.8293, test_f1: 0.6053
 epoch: 28, train_loss: 0.6151, test_loss: 0.7273, test_f1: 0.6776
 epoch: 29, train_loss: 0.6378, test_loss: 0.7796, test_f1: 0.6131
 epoch: 30, train_loss: 0.6529, test_loss: 0.7757, test_f1: 0.6061
 epoch: 31, train_loss: 0.6177, test_loss: 0.7995, test_f1: 0.6227
 epoch: 32, train_loss: 0.6037, test_loss: 0.8126, test_f1: 0.6409
 epoch: 33, train_loss: 0.5876, test_loss: 0.9612, test_f1: 0.6254
 epoch: 34, train_loss: 0.6123, test_loss: 0.9120, test_f1: 0.6139
 epoch: 35, train_loss: 0.5869, test_loss: 0.8986, test_f1: 0.6184
 epoch: 36, train_loss: 0.5748, test_loss: 0.8025, test_f1: 0.6522
 epoch: 37, train_loss: 0.5630, test_loss: 1.0892, test_f1: 0.6517
 epoch: 38, train_loss: 0.5675, test_loss: 0.7677, test_f1: 0.6207
 epoch: 39, train_loss: 0.5389, test_loss: 0.9682, test_f1: 0.5953
 epoch: 40, train_loss: 0.5425, test_loss: 0.7777, test_f1: 0.6769
 epoch: 41, train_loss: 0.5408, test_loss: 0.7419, test_f1: 0.6835
 epoch: 42, train_loss: 0.5425, test_loss: 0.7852, test_f1: 0.6182
 epoch: 43, train_loss: 0.5432, test_loss: 0.9894, test_f1: 0.6326
 epoch: 44, train_loss: 0.5181, test_loss: 0.9627, test_f1: 0.6331
 epoch: 45, train_loss: 0.5261, test_loss: 0.9074, test_f1: 0.6318
 epoch: 46, train_loss: 0.5092, test_loss: 0.8977, test_f1: 0.6373
 epoch: 47, train_loss: 0.5025, test_loss: 0.8141, test_f1: 0.6594
 epoch: 48, train_loss: 0.4990, test_loss: 0.8326, test_f1: 0.6652
 epoch: 49, train_loss: 0.5161, test_loss: 0.8041, test_f1: 0.6647
 epoch: 50, train_loss: 0.5001, test_loss: 0.7577, test_f1: 0.6640
 epoch: 51, train_loss: 0.4543, test_loss: 0.8272, test_f1: 0.6588
 epoch: 52, train_loss: 0.4141, test_loss: 1.0098, test_f1: 0.6805
 epoch: 53, train_loss: 0.4234, test_loss: 1.2637, test_f1: 0.6440
 epoch: 54, train_loss: 0.3939, test_loss: 1.0685, test_f1: 0.6987
 epoch: 55, train_loss: 0.4043, test_loss: 0.9244, test_f1: 0.6900
 epoch: 56, train_loss: 0.4062, test_loss: 0.8603, test_f1: 0.6752
 epoch: 57, train_loss: 0.4020, test_loss: 0.8556, test_f1: 0.6746
 epoch: 58, train_loss: 0.3704, test_loss: 0.7543, test_f1: 0.7033
 epoch: 59, train_loss: 0.3770, test_loss: 0.8582, test_f1: 0.6968
 epoch: 60, train_loss: 0.3675, test_loss: 0.8059, test_f1: 0.6967
 epoch: 61, train_loss: 0.3754, test_loss: 0.9117, test_f1: 0.6657
 epoch: 62, train_loss: 0.3748, test_loss: 1.5883, test_f1: 0.6584
 epoch: 63, train_loss: 0.3655, test_loss: 1.2824, test_f1: 0.6636
 epoch: 64, train_loss: 0.3682, test_loss: 0.9974, test_f1: 0.6779
 epoch: 65, train_loss: 0.3431, test_loss: 1.1774, test_f1: 0.6646
 epoch: 66, train_loss: 0.3692, test_loss: 1.3206, test_f1: 0.6789
 epoch: 67, train_loss: 0.3412, test_loss: 1.0885, test_f1: 0.6765
 epoch: 68, train_loss: 0.3552, test_loss: 1.2965, test_f1: 0.6770
 epoch: 69, train_loss: 0.3380, test_loss: 1.2117, test_f1: 0.6662
 epoch: 70, train_loss: 0.3622, test_loss: 0.9423, test_f1: 0.6458
 epoch: 71, train_loss: 0.3415, test_loss: 1.1504, test_f1: 0.6917
 epoch: 72, train_loss: 0.3376, test_loss: 1.1000, test_f1: 0.7096
 epoch: 73, train_loss: 0.3320, test_loss: 1.4385, test_f1: 0.6787
 epoch: 74, train_loss: 0.3470, test_loss: 1.1576, test_f1: 0.6638
 epoch: 75, train_loss: 0.3140, test_loss: 1.5529, test_f1: 0.6944
 epoch: 76, train_loss: 0.3204, test_loss: 1.2399, test_f1: 0.7010
 epoch: 77, train_loss: 0.3049, test_loss: 1.1203, test_f1: 0.6808
 epoch: 78, train_loss: 0.3206, test_loss: 1.5281, test_f1: 0.6666
 epoch: 79, train_loss: 0.3053, test_loss: 1.3719, test_f1: 0.6694
 epoch: 80, train_loss: 0.2927, test_loss: 1.3204, test_f1: 0.6921
 epoch: 81, train_loss: 0.3044, test_loss: 1.0630, test_f1: 0.6662
 epoch: 82, train_loss: 0.3136, test_loss: 0.8833, test_f1: 0.6840
 epoch: 83, train_loss: 0.3121, test_loss: 0.9870, test_f1: 0.6854
 epoch: 84, train_loss: 0.3042, test_loss: 1.0147, test_f1: 0.6962
 epoch: 85, train_loss: 0.2935, test_loss: 1.2684, test_f1: 0.6671
 epoch: 86, train_loss: 0.3188, test_loss: 1.3552, test_f1: 0.6852
 epoch: 87, train_loss: 0.2821, test_loss: 1.4311, test_f1: 0.6771
 epoch: 88, train_loss: 0.3040, test_loss: 1.9810, test_f1: 0.6542
 epoch: 89, train_loss: 0.3056, test_loss: 0.8852, test_f1: 0.6948
 epoch: 90, train_loss: 0.2756, test_loss: 1.4130, test_f1: 0.6668
 epoch: 91, train_loss: 0.2783, test_loss: 1.2867, test_f1: 0.6831
 epoch: 92, train_loss: 0.2943, test_loss: 0.9646, test_f1: 0.7131
 epoch: 93, train_loss: 0.2897, test_loss: 1.4587, test_f1: 0.6591
 epoch: 94, train_loss: 0.2922, test_loss: 1.1186, test_f1: 0.6874
 epoch: 95, train_loss: 0.2939, test_loss: 1.1502, test_f1: 0.6644
 epoch: 96, train_loss: 0.2649, test_loss: 1.0844, test_f1: 0.6910
 epoch: 97, train_loss: 0.2609, test_loss: 1.3025, test_f1: 0.6707
 epoch: 98, train_loss: 0.2843, test_loss: 1.2224, test_f1: 0.6966
 epoch: 99, train_loss: 0.2928, test_loss: 1.0863, test_f1: 0.6633
##################ITERATION #1 ****************************************
 epoch: 0, train_loss: 1.1713, test_loss: 1.0720, test_f1: 0.3647
 epoch: 1, train_loss: 1.0197, test_loss: 1.0224, test_f1: 0.4105
 epoch: 2, train_loss: 0.9704, test_loss: 1.0652, test_f1: 0.3775
 epoch: 3, train_loss: 0.9366, test_loss: 1.0602, test_f1: 0.5029
 epoch: 4, train_loss: 0.9152, test_loss: 1.1102, test_f1: 0.4400
 epoch: 5, train_loss: 0.9127, test_loss: 0.9577, test_f1: 0.5058
 epoch: 6, train_loss: 0.8719, test_loss: 1.0884, test_f1: 0.5220
 epoch: 7, train_loss: 0.8552, test_loss: 1.0184, test_f1: 0.4397
 epoch: 8, train_loss: 0.8488, test_loss: 1.0609, test_f1: 0.5088
 epoch: 9, train_loss: 0.8546, test_loss: 0.9438, test_f1: 0.4991
 epoch: 10, train_loss: 0.8191, test_loss: 0.9421, test_f1: 0.5722
 epoch: 11, train_loss: 0.8481, test_loss: 0.8008, test_f1: 0.5877
 epoch: 12, train_loss: 0.8085, test_loss: 0.8690, test_f1: 0.5100
 epoch: 13, train_loss: 0.8049, test_loss: 0.8605, test_f1: 0.5872
 epoch: 14, train_loss: 0.7884, test_loss: 0.9323, test_f1: 0.5951
 epoch: 15, train_loss: 0.7852, test_loss: 1.0060, test_f1: 0.5984
 epoch: 16, train_loss: 0.7792, test_loss: 0.8568, test_f1: 0.5826
 epoch: 17, train_loss: 0.7675, test_loss: 0.9103, test_f1: 0.5342
 epoch: 18, train_loss: 0.7452, test_loss: 0.9559, test_f1: 0.5960
 epoch: 19, train_loss: 0.7521, test_loss: 1.0047, test_f1: 0.6388
 epoch: 20, train_loss: 0.7163, test_loss: 0.9969, test_f1: 0.6124
 epoch: 21, train_loss: 0.7030, test_loss: 0.9371, test_f1: 0.6512
 epoch: 22, train_loss: 0.6996, test_loss: 1.0772, test_f1: 0.5843
 epoch: 23, train_loss: 0.6830, test_loss: 0.9089, test_f1: 0.5309
 epoch: 24, train_loss: 0.6776, test_loss: 0.8493, test_f1: 0.5983
 epoch: 25, train_loss: 0.6826, test_loss: 0.9899, test_f1: 0.6029
 epoch: 26, train_loss: 0.6627, test_loss: 1.2111, test_f1: 0.5613
 epoch: 27, train_loss: 0.6885, test_loss: 0.9324, test_f1: 0.6019
 epoch: 28, train_loss: 0.6595, test_loss: 0.9673, test_f1: 0.6436
 epoch: 29, train_loss: 0.6579, test_loss: 0.8926, test_f1: 0.5755
 epoch: 30, train_loss: 0.6529, test_loss: 0.8737, test_f1: 0.6583
 epoch: 31, train_loss: 0.6404, test_loss: 1.0321, test_f1: 0.6060
 epoch: 32, train_loss: 0.6228, test_loss: 0.8667, test_f1: 0.6364
 epoch: 33, train_loss: 0.5987, test_loss: 0.9204, test_f1: 0.6266
 epoch: 34, train_loss: 0.6200, test_loss: 0.8245, test_f1: 0.6231
 epoch: 35, train_loss: 0.6130, test_loss: 0.7525, test_f1: 0.6768
 epoch: 36, train_loss: 0.5935, test_loss: 0.8726, test_f1: 0.6246
 epoch: 37, train_loss: 0.6004, test_loss: 0.7505, test_f1: 0.6587
 epoch: 38, train_loss: 0.6191, test_loss: 0.8359, test_f1: 0.6320
 epoch: 39, train_loss: 0.6133, test_loss: 0.9715, test_f1: 0.6103
 epoch: 40, train_loss: 0.6030, test_loss: 0.9381, test_f1: 0.5882
 epoch: 41, train_loss: 0.5606, test_loss: 0.9938, test_f1: 0.6349
 epoch: 42, train_loss: 0.5729, test_loss: 0.9263, test_f1: 0.6381
 epoch: 43, train_loss: 0.5623, test_loss: 0.8698, test_f1: 0.6224
 epoch: 44, train_loss: 0.5747, test_loss: 0.9079, test_f1: 0.6354
 epoch: 45, train_loss: 0.5520, test_loss: 0.9902, test_f1: 0.6359
 epoch: 46, train_loss: 0.5500, test_loss: 0.8511, test_f1: 0.6360
 epoch: 47, train_loss: 0.5285, test_loss: 0.8213, test_f1: 0.6650
 epoch: 48, train_loss: 0.5285, test_loss: 0.8348, test_f1: 0.6350
 epoch: 49, train_loss: 0.5151, test_loss: 1.1039, test_f1: 0.5771
 epoch: 50, train_loss: 0.5295, test_loss: 0.9071, test_f1: 0.6518
 epoch: 51, train_loss: 0.4957, test_loss: 0.9632, test_f1: 0.6673
 epoch: 52, train_loss: 0.4518, test_loss: 0.9681, test_f1: 0.6722
 epoch: 53, train_loss: 0.4603, test_loss: 0.9038, test_f1: 0.6664
 epoch: 54, train_loss: 0.4406, test_loss: 1.0228, test_f1: 0.6603
 epoch: 55, train_loss: 0.4245, test_loss: 0.9345, test_f1: 0.6908
 epoch: 56, train_loss: 0.4092, test_loss: 1.2546, test_f1: 0.6663
 epoch: 57, train_loss: 0.4201, test_loss: 1.2354, test_f1: 0.6802
 epoch: 58, train_loss: 0.4458, test_loss: 0.9935, test_f1: 0.6961
 epoch: 59, train_loss: 0.4033, test_loss: 1.0059, test_f1: 0.6573
 epoch: 60, train_loss: 0.3825, test_loss: 1.2513, test_f1: 0.6700
 epoch: 61, train_loss: 0.4110, test_loss: 1.0715, test_f1: 0.7206
 epoch: 62, train_loss: 0.4034, test_loss: 1.1215, test_f1: 0.6699
 epoch: 63, train_loss: 0.3814, test_loss: 1.1641, test_f1: 0.6679
 epoch: 64, train_loss: 0.3677, test_loss: 1.0304, test_f1: 0.7040
 epoch: 65, train_loss: 0.3905, test_loss: 1.0840, test_f1: 0.6887
 epoch: 66, train_loss: 0.3613, test_loss: 1.1465, test_f1: 0.7234
 epoch: 67, train_loss: 0.3416, test_loss: 1.3712, test_f1: 0.6952
 epoch: 68, train_loss: 0.3668, test_loss: 1.1612, test_f1: 0.6886
 epoch: 69, train_loss: 0.3619, test_loss: 1.3545, test_f1: 0.6824
 epoch: 70, train_loss: 0.3816, test_loss: 1.2656, test_f1: 0.6768
 epoch: 71, train_loss: 0.3657, test_loss: 1.2516, test_f1: 0.6700
 epoch: 72, train_loss: 0.3592, test_loss: 1.2645, test_f1: 0.6883
 epoch: 73, train_loss: 0.3458, test_loss: 1.1658, test_f1: 0.6842
 epoch: 74, train_loss: 0.3548, test_loss: 1.1603, test_f1: 0.6717
 epoch: 75, train_loss: 0.3464, test_loss: 1.1511, test_f1: 0.6748
 epoch: 76, train_loss: 0.3283, test_loss: 1.2489, test_f1: 0.6634
 epoch: 77, train_loss: 0.3324, test_loss: 1.2188, test_f1: 0.6515
 epoch: 78, train_loss: 0.3454, test_loss: 1.1292, test_f1: 0.6793
 epoch: 79, train_loss: 0.3480, test_loss: 1.2863, test_f1: 0.6866
 epoch: 80, train_loss: 0.3344, test_loss: 1.2308, test_f1: 0.6792
 epoch: 81, train_loss: 0.3181, test_loss: 1.4441, test_f1: 0.6662
 epoch: 82, train_loss: 0.3371, test_loss: 1.3644, test_f1: 0.6703
 epoch: 83, train_loss: 0.3164, test_loss: 1.3362, test_f1: 0.6478
 epoch: 84, train_loss: 0.3290, test_loss: 1.2036, test_f1: 0.6785
 epoch: 85, train_loss: 0.3252, test_loss: 1.1399, test_f1: 0.6647
 epoch: 86, train_loss: 0.3226, test_loss: 1.4432, test_f1: 0.6617
 epoch: 87, train_loss: 0.3226, test_loss: 1.2331, test_f1: 0.6682
 epoch: 88, train_loss: 0.2962, test_loss: 1.3470, test_f1: 0.6612
 epoch: 89, train_loss: 0.3039, test_loss: 1.3929, test_f1: 0.6996
 epoch: 90, train_loss: 0.3014, test_loss: 1.4473, test_f1: 0.6751
 epoch: 91, train_loss: 0.3187, test_loss: 1.4109, test_f1: 0.6744
 epoch: 92, train_loss: 0.2881, test_loss: 1.3843, test_f1: 0.6827
 epoch: 93, train_loss: 0.2985, test_loss: 1.3246, test_f1: 0.6685
 epoch: 94, train_loss: 0.2846, test_loss: 1.3889, test_f1: 0.6984
 epoch: 95, train_loss: 0.3035, test_loss: 1.2793, test_f1: 0.7073
 epoch: 96, train_loss: 0.3032, test_loss: 1.3780, test_f1: 0.6939
 epoch: 97, train_loss: 0.2991, test_loss: 1.4324, test_f1: 0.6947
 epoch: 98, train_loss: 0.3027, test_loss: 1.4360, test_f1: 0.6945
 epoch: 99, train_loss: 0.2895, test_loss: 1.4376, test_f1: 0.6762
##################ITERATION #2 ****************************************
 epoch: 0, train_loss: 1.2428, test_loss: 1.1426, test_f1: 0.3419
 epoch: 1, train_loss: 1.0842, test_loss: 1.1091, test_f1: 0.3466
 epoch: 2, train_loss: 1.0551, test_loss: 1.1132, test_f1: 0.3571
 epoch: 3, train_loss: 1.0353, test_loss: 1.1839, test_f1: 0.3825
 epoch: 4, train_loss: 0.9975, test_loss: 1.5540, test_f1: 0.3531
 epoch: 5, train_loss: 0.9607, test_loss: 1.0206, test_f1: 0.4849
 epoch: 6, train_loss: 0.9458, test_loss: 0.9438, test_f1: 0.4963
 epoch: 7, train_loss: 0.8979, test_loss: 0.8885, test_f1: 0.4973
 epoch: 8, train_loss: 0.8890, test_loss: 1.1346, test_f1: 0.4613
 epoch: 9, train_loss: 0.8554, test_loss: 1.0303, test_f1: 0.4518
 epoch: 10, train_loss: 0.8542, test_loss: 0.9213, test_f1: 0.5083
 epoch: 11, train_loss: 0.8579, test_loss: 0.8466, test_f1: 0.5601
 epoch: 12, train_loss: 0.8542, test_loss: 1.0208, test_f1: 0.5415
 epoch: 13, train_loss: 0.8457, test_loss: 0.9520, test_f1: 0.5225
 epoch: 14, train_loss: 0.8223, test_loss: 0.9500, test_f1: 0.5485
 epoch: 15, train_loss: 0.8130, test_loss: 0.8536, test_f1: 0.5780
 epoch: 16, train_loss: 0.8038, test_loss: 0.8326, test_f1: 0.5342
 epoch: 17, train_loss: 0.7790, test_loss: 0.8720, test_f1: 0.5207
 epoch: 18, train_loss: 0.7700, test_loss: 0.7805, test_f1: 0.5737
 epoch: 19, train_loss: 0.7865, test_loss: 0.7927, test_f1: 0.6024
 epoch: 20, train_loss: 0.7792, test_loss: 0.9360, test_f1: 0.5694
 epoch: 21, train_loss: 0.7689, test_loss: 0.8943, test_f1: 0.5496
 epoch: 22, train_loss: 0.7333, test_loss: 1.0345, test_f1: 0.5018
 epoch: 23, train_loss: 0.7355, test_loss: 0.8567, test_f1: 0.5933
 epoch: 24, train_loss: 0.7463, test_loss: 0.7708, test_f1: 0.6026
 epoch: 25, train_loss: 0.7296, test_loss: 0.8066, test_f1: 0.6339
 epoch: 26, train_loss: 0.7288, test_loss: 0.8741, test_f1: 0.6086
 epoch: 27, train_loss: 0.7004, test_loss: 0.9854, test_f1: 0.5906
 epoch: 28, train_loss: 0.7163, test_loss: 0.8093, test_f1: 0.5915
 epoch: 29, train_loss: 0.7153, test_loss: 0.7368, test_f1: 0.5679
 epoch: 30, train_loss: 0.6888, test_loss: 0.8374, test_f1: 0.6252
 epoch: 31, train_loss: 0.6954, test_loss: 0.8022, test_f1: 0.6499
 epoch: 32, train_loss: 0.6810, test_loss: 0.7670, test_f1: 0.6067
 epoch: 33, train_loss: 0.6721, test_loss: 0.8190, test_f1: 0.5630
 epoch: 34, train_loss: 0.6455, test_loss: 0.8635, test_f1: 0.6193
 epoch: 35, train_loss: 0.6619, test_loss: 0.8840, test_f1: 0.5907
 epoch: 36, train_loss: 0.6445, test_loss: 0.7964, test_f1: 0.6359
 epoch: 37, train_loss: 0.6532, test_loss: 0.8403, test_f1: 0.6029
 epoch: 38, train_loss: 0.6385, test_loss: 0.8457, test_f1: 0.6229
 epoch: 39, train_loss: 0.6252, test_loss: 0.8987, test_f1: 0.5598
 epoch: 40, train_loss: 0.6444, test_loss: 0.7964, test_f1: 0.6155
 epoch: 41, train_loss: 0.6467, test_loss: 0.8409, test_f1: 0.5923
 epoch: 42, train_loss: 0.6376, test_loss: 0.8576, test_f1: 0.5996
 epoch: 43, train_loss: 0.5993, test_loss: 0.7309, test_f1: 0.6409
 epoch: 44, train_loss: 0.6162, test_loss: 0.7923, test_f1: 0.5827
 epoch: 45, train_loss: 0.6063, test_loss: 0.8324, test_f1: 0.5966
 epoch: 46, train_loss: 0.6105, test_loss: 0.7414, test_f1: 0.6482
 epoch: 47, train_loss: 0.5783, test_loss: 0.7234, test_f1: 0.6552
 epoch: 48, train_loss: 0.5704, test_loss: 0.8751, test_f1: 0.6344
 epoch: 49, train_loss: 0.5767, test_loss: 0.7975, test_f1: 0.6089
 epoch: 50, train_loss: 0.5656, test_loss: 0.7758, test_f1: 0.6324
 epoch: 51, train_loss: 0.5335, test_loss: 0.7719, test_f1: 0.6589
 epoch: 52, train_loss: 0.5097, test_loss: 0.7610, test_f1: 0.6682
 epoch: 53, train_loss: 0.4950, test_loss: 0.7540, test_f1: 0.6688
 epoch: 54, train_loss: 0.4826, test_loss: 0.8212, test_f1: 0.6257
 epoch: 55, train_loss: 0.4734, test_loss: 0.7623, test_f1: 0.6738
 epoch: 56, train_loss: 0.4914, test_loss: 0.8258, test_f1: 0.6854
 epoch: 57, train_loss: 0.4752, test_loss: 0.7102, test_f1: 0.6770
 epoch: 58, train_loss: 0.4558, test_loss: 0.7999, test_f1: 0.6822
 epoch: 59, train_loss: 0.4747, test_loss: 0.7497, test_f1: 0.6893
 epoch: 60, train_loss: 0.4573, test_loss: 0.8119, test_f1: 0.6643
 epoch: 61, train_loss: 0.4560, test_loss: 0.7216, test_f1: 0.6718
 epoch: 62, train_loss: 0.4535, test_loss: 0.7948, test_f1: 0.6845
 epoch: 63, train_loss: 0.4405, test_loss: 0.8691, test_f1: 0.6606
 epoch: 64, train_loss: 0.4551, test_loss: 0.8228, test_f1: 0.6802
 epoch: 65, train_loss: 0.4301, test_loss: 0.8098, test_f1: 0.6716
 epoch: 66, train_loss: 0.4117, test_loss: 0.9137, test_f1: 0.6570
 epoch: 67, train_loss: 0.4203, test_loss: 0.7533, test_f1: 0.6893
 epoch: 68, train_loss: 0.4082, test_loss: 0.8055, test_f1: 0.6778
 epoch: 69, train_loss: 0.4162, test_loss: 0.8655, test_f1: 0.6952
 epoch: 70, train_loss: 0.4190, test_loss: 0.8430, test_f1: 0.6773
 epoch: 71, train_loss: 0.3967, test_loss: 0.9845, test_f1: 0.6521
 epoch: 72, train_loss: 0.4141, test_loss: 0.9131, test_f1: 0.6720
 epoch: 73, train_loss: 0.3951, test_loss: 0.8808, test_f1: 0.6949
 epoch: 74, train_loss: 0.3931, test_loss: 0.9281, test_f1: 0.6918
 epoch: 75, train_loss: 0.3744, test_loss: 0.8438, test_f1: 0.6785
 epoch: 76, train_loss: 0.3829, test_loss: 0.8528, test_f1: 0.6881
 epoch: 77, train_loss: 0.3779, test_loss: 0.8563, test_f1: 0.6974
 epoch: 78, train_loss: 0.3885, test_loss: 0.8620, test_f1: 0.6854
 epoch: 79, train_loss: 0.3854, test_loss: 0.9151, test_f1: 0.6598
 epoch: 80, train_loss: 0.3778, test_loss: 1.0192, test_f1: 0.6630
 epoch: 81, train_loss: 0.3839, test_loss: 0.9504, test_f1: 0.6803
 epoch: 82, train_loss: 0.3634, test_loss: 0.8971, test_f1: 0.6686
 epoch: 83, train_loss: 0.3804, test_loss: 0.8655, test_f1: 0.6783
 epoch: 84, train_loss: 0.3583, test_loss: 0.9312, test_f1: 0.6622
 epoch: 85, train_loss: 0.3443, test_loss: 0.8076, test_f1: 0.6551
 epoch: 86, train_loss: 0.3438, test_loss: 0.8378, test_f1: 0.6665
 epoch: 87, train_loss: 0.3607, test_loss: 0.8280, test_f1: 0.6879
 epoch: 88, train_loss: 0.3767, test_loss: 0.8808, test_f1: 0.6774
 epoch: 89, train_loss: 0.3485, test_loss: 0.7528, test_f1: 0.6928
 epoch: 90, train_loss: 0.3516, test_loss: 0.9477, test_f1: 0.6781
 epoch: 91, train_loss: 0.3419, test_loss: 0.9371, test_f1: 0.6673
 epoch: 92, train_loss: 0.3489, test_loss: 1.0247, test_f1: 0.6505
 epoch: 93, train_loss: 0.3481, test_loss: 0.8231, test_f1: 0.6991
 epoch: 94, train_loss: 0.3391, test_loss: 0.9367, test_f1: 0.6632
 epoch: 95, train_loss: 0.3111, test_loss: 0.9840, test_f1: 0.6565
 epoch: 96, train_loss: 0.3529, test_loss: 0.8190, test_f1: 0.6914
 epoch: 97, train_loss: 0.3158, test_loss: 0.8846, test_f1: 0.6581
 epoch: 98, train_loss: 0.3167, test_loss: 1.0972, test_f1: 0.6395
 epoch: 99, train_loss: 0.3153, test_loss: 1.0709, test_f1: 0.6629
##################ITERATION #3 ****************************************
 epoch: 0, train_loss: 1.1960, test_loss: 1.0939, test_f1: 0.4539
 epoch: 1, train_loss: 1.0198, test_loss: 1.2329, test_f1: 0.4166
 epoch: 2, train_loss: 1.0124, test_loss: 1.0301, test_f1: 0.4280
 epoch: 3, train_loss: 0.9556, test_loss: 1.1282, test_f1: 0.3829
 epoch: 4, train_loss: 0.9461, test_loss: 1.0130, test_f1: 0.5000
 epoch: 5, train_loss: 0.9436, test_loss: 1.2918, test_f1: 0.2930
 epoch: 6, train_loss: 0.8923, test_loss: 0.9403, test_f1: 0.5171
 epoch: 7, train_loss: 0.8695, test_loss: 1.1040, test_f1: 0.4275
 epoch: 8, train_loss: 0.8733, test_loss: 0.9257, test_f1: 0.5086
 epoch: 9, train_loss: 0.8723, test_loss: 1.5558, test_f1: 0.4253
 epoch: 10, train_loss: 0.8740, test_loss: 1.0077, test_f1: 0.5102
 epoch: 11, train_loss: 0.8768, test_loss: 0.9188, test_f1: 0.5596
 epoch: 12, train_loss: 0.8465, test_loss: 0.9108, test_f1: 0.5198
 epoch: 13, train_loss: 0.8370, test_loss: 1.0609, test_f1: 0.5151
 epoch: 14, train_loss: 0.8429, test_loss: 1.0893, test_f1: 0.5423
 epoch: 15, train_loss: 0.8229, test_loss: 0.9242, test_f1: 0.5420
 epoch: 16, train_loss: 0.8532, test_loss: 1.0363, test_f1: 0.5012
 epoch: 17, train_loss: 0.8279, test_loss: 0.8887, test_f1: 0.5376
 epoch: 18, train_loss: 0.7906, test_loss: 1.0097, test_f1: 0.5638
 epoch: 19, train_loss: 0.7909, test_loss: 0.8151, test_f1: 0.5352
 epoch: 20, train_loss: 0.7734, test_loss: 1.0065, test_f1: 0.5433
 epoch: 21, train_loss: 0.7626, test_loss: 1.0956, test_f1: 0.5754
 epoch: 22, train_loss: 0.7601, test_loss: 0.9630, test_f1: 0.5912
 epoch: 23, train_loss: 0.7463, test_loss: 1.0416, test_f1: 0.5704
 epoch: 24, train_loss: 0.7214, test_loss: 1.2264, test_f1: 0.5441
 epoch: 25, train_loss: 0.7351, test_loss: 1.9222, test_f1: 0.4656
 epoch: 26, train_loss: 0.7415, test_loss: 1.2310, test_f1: 0.6336
 epoch: 27, train_loss: 0.7213, test_loss: 0.9591, test_f1: 0.6465
 epoch: 28, train_loss: 0.7021, test_loss: 1.0677, test_f1: 0.5849
 epoch: 29, train_loss: 0.6973, test_loss: 1.1710, test_f1: 0.5949
 epoch: 30, train_loss: 0.7152, test_loss: 1.0857, test_f1: 0.5988
 epoch: 31, train_loss: 0.6796, test_loss: 1.0104, test_f1: 0.6136
 epoch: 32, train_loss: 0.6744, test_loss: 1.1672, test_f1: 0.5920
 epoch: 33, train_loss: 0.6682, test_loss: 1.0103, test_f1: 0.6628
 epoch: 34, train_loss: 0.6418, test_loss: 0.8336, test_f1: 0.5728
 epoch: 35, train_loss: 0.6672, test_loss: 0.8878, test_f1: 0.6308
 epoch: 36, train_loss: 0.6433, test_loss: 1.0784, test_f1: 0.6088
 epoch: 37, train_loss: 0.6574, test_loss: 1.1195, test_f1: 0.6308
 epoch: 38, train_loss: 0.6245, test_loss: 1.1775, test_f1: 0.6125
 epoch: 39, train_loss: 0.6223, test_loss: 1.2111, test_f1: 0.6342
 epoch: 40, train_loss: 0.6338, test_loss: 1.1747, test_f1: 0.6445
 epoch: 41, train_loss: 0.6150, test_loss: 1.2929, test_f1: 0.6483
 epoch: 42, train_loss: 0.6219, test_loss: 1.0200, test_f1: 0.5981
 epoch: 43, train_loss: 0.5829, test_loss: 1.1306, test_f1: 0.6493
 epoch: 44, train_loss: 0.6148, test_loss: 1.1518, test_f1: 0.6256
 epoch: 45, train_loss: 0.6047, test_loss: 1.2415, test_f1: 0.6100
 epoch: 46, train_loss: 0.6029, test_loss: 1.0707, test_f1: 0.6343
 epoch: 47, train_loss: 0.5926, test_loss: 1.1226, test_f1: 0.6364
 epoch: 48, train_loss: 0.5805, test_loss: 1.1906, test_f1: 0.6560
 epoch: 49, train_loss: 0.5966, test_loss: 1.1678, test_f1: 0.6184
 epoch: 50, train_loss: 0.5924, test_loss: 1.3748, test_f1: 0.6606
 epoch: 51, train_loss: 0.5243, test_loss: 1.4792, test_f1: 0.6452
 epoch: 52, train_loss: 0.4957, test_loss: 1.2931, test_f1: 0.6843
 epoch: 53, train_loss: 0.4975, test_loss: 1.4788, test_f1: 0.6595
 epoch: 54, train_loss: 0.4842, test_loss: 1.5709, test_f1: 0.6338
 epoch: 55, train_loss: 0.4689, test_loss: 1.4399, test_f1: 0.6705
 epoch: 56, train_loss: 0.4627, test_loss: 1.5721, test_f1: 0.6395
 epoch: 57, train_loss: 0.4768, test_loss: 1.5560, test_f1: 0.6445
 epoch: 58, train_loss: 0.4875, test_loss: 1.5264, test_f1: 0.6549
 epoch: 59, train_loss: 0.4624, test_loss: 1.4181, test_f1: 0.6624
 epoch: 60, train_loss: 0.4474, test_loss: 1.6709, test_f1: 0.6313
 epoch: 61, train_loss: 0.4499, test_loss: 1.4226, test_f1: 0.6565
 epoch: 62, train_loss: 0.4433, test_loss: 1.5560, test_f1: 0.6464
 epoch: 63, train_loss: 0.4397, test_loss: 1.5379, test_f1: 0.6663
 epoch: 64, train_loss: 0.4298, test_loss: 1.7020, test_f1: 0.6669
 epoch: 65, train_loss: 0.4340, test_loss: 1.7121, test_f1: 0.6517
 epoch: 66, train_loss: 0.4134, test_loss: 1.3222, test_f1: 0.6590
 epoch: 67, train_loss: 0.4198, test_loss: 1.5857, test_f1: 0.6515
 epoch: 68, train_loss: 0.4077, test_loss: 1.7978, test_f1: 0.6211
 epoch: 69, train_loss: 0.4085, test_loss: 1.5844, test_f1: 0.6695
 epoch: 70, train_loss: 0.3960, test_loss: 1.6357, test_f1: 0.6567
 epoch: 71, train_loss: 0.3983, test_loss: 1.6182, test_f1: 0.6262
 epoch: 72, train_loss: 0.4062, test_loss: 1.4471, test_f1: 0.6576
 epoch: 73, train_loss: 0.4103, test_loss: 1.8431, test_f1: 0.6184
 epoch: 74, train_loss: 0.3951, test_loss: 1.6811, test_f1: 0.6432
 epoch: 75, train_loss: 0.3957, test_loss: 1.6811, test_f1: 0.6502
 epoch: 76, train_loss: 0.3826, test_loss: 1.7883, test_f1: 0.6283
 epoch: 77, train_loss: 0.3853, test_loss: 1.6498, test_f1: 0.6444
 epoch: 78, train_loss: 0.3893, test_loss: 1.8220, test_f1: 0.6211
 epoch: 79, train_loss: 0.3677, test_loss: 1.7484, test_f1: 0.6473
 epoch: 80, train_loss: 0.3790, test_loss: 1.8466, test_f1: 0.6617
 epoch: 81, train_loss: 0.3705, test_loss: 1.6735, test_f1: 0.6442
 epoch: 82, train_loss: 0.3691, test_loss: 1.8397, test_f1: 0.6632
 epoch: 83, train_loss: 0.3606, test_loss: 2.0270, test_f1: 0.6249
 epoch: 84, train_loss: 0.3810, test_loss: 1.7516, test_f1: 0.6577
 epoch: 85, train_loss: 0.3659, test_loss: 1.7664, test_f1: 0.6500
 epoch: 86, train_loss: 0.3634, test_loss: 1.8300, test_f1: 0.6396
 epoch: 87, train_loss: 0.3679, test_loss: 1.5883, test_f1: 0.6522
 epoch: 88, train_loss: 0.3708, test_loss: 1.6542, test_f1: 0.6406
 epoch: 89, train_loss: 0.3586, test_loss: 1.8602, test_f1: 0.6495
 epoch: 90, train_loss: 0.3543, test_loss: 1.8821, test_f1: 0.6452
 epoch: 91, train_loss: 0.3308, test_loss: 2.0478, test_f1: 0.6603
 epoch: 92, train_loss: 0.3344, test_loss: 1.7719, test_f1: 0.6582
 epoch: 93, train_loss: 0.3154, test_loss: 1.7562, test_f1: 0.6659
 epoch: 94, train_loss: 0.3334, test_loss: 2.0088, test_f1: 0.6449
 epoch: 95, train_loss: 0.3322, test_loss: 2.1553, test_f1: 0.6448
 epoch: 96, train_loss: 0.3597, test_loss: 1.8395, test_f1: 0.6691
 epoch: 97, train_loss: 0.3185, test_loss: 2.0615, test_f1: 0.6390
 epoch: 98, train_loss: 0.3202, test_loss: 1.7566, test_f1: 0.6701
 epoch: 99, train_loss: 0.3249, test_loss: 2.2684, test_f1: 0.6679
##################ITERATION #4 ****************************************
 epoch: 0, train_loss: 1.2502, test_loss: 1.2968, test_f1: 0.3419
 epoch: 1, train_loss: 1.1045, test_loss: 1.2623, test_f1: 0.3396
 epoch: 2, train_loss: 1.0855, test_loss: 1.2323, test_f1: 0.3139
 epoch: 3, train_loss: 1.0666, test_loss: 1.1119, test_f1: 0.3381
 epoch: 4, train_loss: 1.0631, test_loss: 1.0784, test_f1: 0.3383
 epoch: 5, train_loss: 1.0364, test_loss: 1.0841, test_f1: 0.3546
 epoch: 6, train_loss: 1.0425, test_loss: 1.1996, test_f1: 0.3217
 epoch: 7, train_loss: 1.0451, test_loss: 1.0929, test_f1: 0.3403
 epoch: 8, train_loss: 1.0414, test_loss: 1.1497, test_f1: 0.3429
 epoch: 9, train_loss: 1.0483, test_loss: 1.1066, test_f1: 0.3410
 epoch: 10, train_loss: 1.0300, test_loss: 1.1768, test_f1: 0.3426
 epoch: 11, train_loss: 1.0279, test_loss: 1.1813, test_f1: 0.3447
 epoch: 12, train_loss: 1.0128, test_loss: 1.1802, test_f1: 0.3528
 epoch: 13, train_loss: 1.0228, test_loss: 1.2373, test_f1: 0.3478
 epoch: 14, train_loss: 0.9964, test_loss: 1.1654, test_f1: 0.3708
 epoch: 15, train_loss: 0.9945, test_loss: 1.2112, test_f1: 0.3620
 epoch: 16, train_loss: 0.9720, test_loss: 1.1396, test_f1: 0.4483
 epoch: 17, train_loss: 0.9438, test_loss: 1.1471, test_f1: 0.5032
 epoch: 18, train_loss: 0.9486, test_loss: 1.0912, test_f1: 0.4986
 epoch: 19, train_loss: 0.8923, test_loss: 1.1224, test_f1: 0.4949
 epoch: 20, train_loss: 0.8857, test_loss: 1.1226, test_f1: 0.3930
 epoch: 21, train_loss: 0.8872, test_loss: 1.3019, test_f1: 0.4662
 epoch: 22, train_loss: 0.8698, test_loss: 1.0176, test_f1: 0.5350
 epoch: 23, train_loss: 0.8561, test_loss: 1.1227, test_f1: 0.5841
 epoch: 24, train_loss: 0.8377, test_loss: 0.9415, test_f1: 0.6273
 epoch: 25, train_loss: 0.8462, test_loss: 1.1501, test_f1: 0.5202
 epoch: 26, train_loss: 0.8365, test_loss: 0.9308, test_f1: 0.5270
 epoch: 27, train_loss: 0.8307, test_loss: 1.0158, test_f1: 0.5253
 epoch: 28, train_loss: 0.8175, test_loss: 1.0606, test_f1: 0.5093
 epoch: 29, train_loss: 0.8032, test_loss: 1.0548, test_f1: 0.6174
 epoch: 30, train_loss: 0.8060, test_loss: 1.0613, test_f1: 0.5285
 epoch: 31, train_loss: 0.7842, test_loss: 0.9374, test_f1: 0.5535
 epoch: 32, train_loss: 0.7932, test_loss: 0.8885, test_f1: 0.5009
 epoch: 33, train_loss: 0.8042, test_loss: 0.9793, test_f1: 0.5491
 epoch: 34, train_loss: 0.7738, test_loss: 0.9368, test_f1: 0.6168
 epoch: 35, train_loss: 0.7621, test_loss: 1.0986, test_f1: 0.5474
 epoch: 36, train_loss: 0.7466, test_loss: 1.0112, test_f1: 0.5216
 epoch: 37, train_loss: 0.7637, test_loss: 0.9444, test_f1: 0.6055
 epoch: 38, train_loss: 0.7565, test_loss: 0.9829, test_f1: 0.5567
 epoch: 39, train_loss: 0.7561, test_loss: 1.4112, test_f1: 0.5701
 epoch: 40, train_loss: 0.7343, test_loss: 0.9507, test_f1: 0.5943
 epoch: 41, train_loss: 0.7129, test_loss: 0.9462, test_f1: 0.5796
 epoch: 42, train_loss: 0.7165, test_loss: 1.0952, test_f1: 0.5495
 epoch: 43, train_loss: 0.7376, test_loss: 1.2090, test_f1: 0.5449
 epoch: 44, train_loss: 0.7022, test_loss: 0.9715, test_f1: 0.5772
 epoch: 45, train_loss: 0.7082, test_loss: 1.1479, test_f1: 0.5500
 epoch: 46, train_loss: 0.6903, test_loss: 1.0879, test_f1: 0.5720
 epoch: 47, train_loss: 0.6969, test_loss: 1.1311, test_f1: 0.5565
 epoch: 48, train_loss: 0.6818, test_loss: 1.1340, test_f1: 0.5565
 epoch: 49, train_loss: 0.6761, test_loss: 0.9973, test_f1: 0.6220
 epoch: 50, train_loss: 0.6879, test_loss: 0.9923, test_f1: 0.5656
 epoch: 51, train_loss: 0.6418, test_loss: 1.0642, test_f1: 0.6445
 epoch: 52, train_loss: 0.6049, test_loss: 0.9898, test_f1: 0.6396
 epoch: 53, train_loss: 0.5863, test_loss: 1.1292, test_f1: 0.6332
 epoch: 54, train_loss: 0.5812, test_loss: 1.2085, test_f1: 0.6352
 epoch: 55, train_loss: 0.5939, test_loss: 1.0785, test_f1: 0.6406
 epoch: 56, train_loss: 0.5911, test_loss: 1.0867, test_f1: 0.6466
 epoch: 57, train_loss: 0.5825, test_loss: 1.2163, test_f1: 0.6378
 epoch: 58, train_loss: 0.5511, test_loss: 1.1693, test_f1: 0.6138
 epoch: 59, train_loss: 0.5363, test_loss: 1.2184, test_f1: 0.6236
 epoch: 60, train_loss: 0.5499, test_loss: 1.2242, test_f1: 0.6549
 epoch: 61, train_loss: 0.5521, test_loss: 1.1290, test_f1: 0.6341
 epoch: 62, train_loss: 0.5387, test_loss: 1.2530, test_f1: 0.6319
 epoch: 63, train_loss: 0.5353, test_loss: 1.2008, test_f1: 0.6709
 epoch: 64, train_loss: 0.5515, test_loss: 1.2314, test_f1: 0.6541
 epoch: 65, train_loss: 0.5217, test_loss: 1.2260, test_f1: 0.6588
 epoch: 66, train_loss: 0.5281, test_loss: 1.3295, test_f1: 0.6182
 epoch: 67, train_loss: 0.4994, test_loss: 1.3611, test_f1: 0.6322
 epoch: 68, train_loss: 0.4879, test_loss: 1.2319, test_f1: 0.6636
 epoch: 69, train_loss: 0.4723, test_loss: 1.2776, test_f1: 0.6417
 epoch: 70, train_loss: 0.4955, test_loss: 1.3931, test_f1: 0.6451
 epoch: 71, train_loss: 0.4917, test_loss: 1.1433, test_f1: 0.6667
 epoch: 72, train_loss: 0.4890, test_loss: 1.5095, test_f1: 0.6656
 epoch: 73, train_loss: 0.4837, test_loss: 1.2852, test_f1: 0.6751
 epoch: 74, train_loss: 0.4816, test_loss: 1.5042, test_f1: 0.6401
 epoch: 75, train_loss: 0.4686, test_loss: 1.3735, test_f1: 0.6542
 epoch: 76, train_loss: 0.4547, test_loss: 1.2257, test_f1: 0.6948
 epoch: 77, train_loss: 0.4688, test_loss: 1.4697, test_f1: 0.6565
 epoch: 78, train_loss: 0.4599, test_loss: 1.2627, test_f1: 0.6771
 epoch: 79, train_loss: 0.4561, test_loss: 1.3171, test_f1: 0.6478
 epoch: 80, train_loss: 0.4469, test_loss: 1.4676, test_f1: 0.6384
 epoch: 81, train_loss: 0.4540, test_loss: 1.5348, test_f1: 0.6455
 epoch: 82, train_loss: 0.4388, test_loss: 1.2607, test_f1: 0.6597
 epoch: 83, train_loss: 0.4387, test_loss: 1.3677, test_f1: 0.6639
 epoch: 84, train_loss: 0.4077, test_loss: 1.3582, test_f1: 0.6736
 epoch: 85, train_loss: 0.4151, test_loss: 1.3628, test_f1: 0.6738
 epoch: 86, train_loss: 0.4338, test_loss: 1.7058, test_f1: 0.6446
 epoch: 87, train_loss: 0.4414, test_loss: 1.3997, test_f1: 0.6618
 epoch: 88, train_loss: 0.4269, test_loss: 1.4998, test_f1: 0.6580
 epoch: 89, train_loss: 0.4152, test_loss: 1.3657, test_f1: 0.6753
 epoch: 90, train_loss: 0.3937, test_loss: 1.4705, test_f1: 0.6749
 epoch: 91, train_loss: 0.4035, test_loss: 1.3365, test_f1: 0.6757
 epoch: 92, train_loss: 0.4203, test_loss: 1.4650, test_f1: 0.6726
 epoch: 93, train_loss: 0.3900, test_loss: 1.3977, test_f1: 0.6625
 epoch: 94, train_loss: 0.3856, test_loss: 1.4049, test_f1: 0.6661
 epoch: 95, train_loss: 0.4103, test_loss: 1.5949, test_f1: 0.6580
 epoch: 96, train_loss: 0.3792, test_loss: 1.6922, test_f1: 0.6480
 epoch: 97, train_loss: 0.3855, test_loss: 1.5028, test_f1: 0.6920
 epoch: 98, train_loss: 0.3999, test_loss: 1.5742, test_f1: 0.6818
 epoch: 99, train_loss: 0.3788, test_loss: 1.8204, test_f1: 0.6601
##################ITERATION #5 ****************************************
 epoch: 0, train_loss: 1.2749, test_loss: 1.2032, test_f1: 0.4063
 epoch: 1, train_loss: 1.0239, test_loss: 1.0962, test_f1: 0.4505
 epoch: 2, train_loss: 0.9827, test_loss: 1.0049, test_f1: 0.4797
 epoch: 3, train_loss: 0.9369, test_loss: 1.0052, test_f1: 0.4719
 epoch: 4, train_loss: 0.9270, test_loss: 0.9964, test_f1: 0.5081
 epoch: 5, train_loss: 0.9155, test_loss: 0.9210, test_f1: 0.5510
 epoch: 6, train_loss: 0.8931, test_loss: 1.0411, test_f1: 0.5460
 epoch: 7, train_loss: 0.8886, test_loss: 0.9284, test_f1: 0.4974
 epoch: 8, train_loss: 0.8721, test_loss: 0.9531, test_f1: 0.5457
 epoch: 9, train_loss: 0.8569, test_loss: 0.9717, test_f1: 0.5200
 epoch: 10, train_loss: 0.8644, test_loss: 0.8943, test_f1: 0.5194
 epoch: 11, train_loss: 0.8327, test_loss: 0.9591, test_f1: 0.5412
 epoch: 12, train_loss: 0.8356, test_loss: 0.9024, test_f1: 0.5639
 epoch: 13, train_loss: 0.8274, test_loss: 0.9919, test_f1: 0.5254
 epoch: 14, train_loss: 0.8128, test_loss: 0.9386, test_f1: 0.5392
 epoch: 15, train_loss: 0.8078, test_loss: 0.9958, test_f1: 0.5567
 epoch: 16, train_loss: 0.8041, test_loss: 0.9721, test_f1: 0.5333
 epoch: 17, train_loss: 0.7802, test_loss: 0.9299, test_f1: 0.5348
 epoch: 18, train_loss: 0.7687, test_loss: 1.0360, test_f1: 0.5368
 epoch: 19, train_loss: 0.7633, test_loss: 0.9213, test_f1: 0.6433
 epoch: 20, train_loss: 0.7622, test_loss: 0.9515, test_f1: 0.5752
 epoch: 21, train_loss: 0.7763, test_loss: 0.8355, test_f1: 0.5363
 epoch: 22, train_loss: 0.7570, test_loss: 0.8977, test_f1: 0.5800
 epoch: 23, train_loss: 0.7511, test_loss: 1.0418, test_f1: 0.5531
 epoch: 24, train_loss: 0.7285, test_loss: 0.9052, test_f1: 0.5799
 epoch: 25, train_loss: 0.7140, test_loss: 0.9774, test_f1: 0.6277
 epoch: 26, train_loss: 0.7108, test_loss: 0.9797, test_f1: 0.6167
 epoch: 27, train_loss: 0.7076, test_loss: 0.8407, test_f1: 0.6211
 epoch: 28, train_loss: 0.7001, test_loss: 0.8165, test_f1: 0.6298
 epoch: 29, train_loss: 0.6896, test_loss: 1.0095, test_f1: 0.5884
 epoch: 30, train_loss: 0.6710, test_loss: 0.9112, test_f1: 0.6179
 epoch: 31, train_loss: 0.6835, test_loss: 1.1328, test_f1: 0.6027
 epoch: 32, train_loss: 0.6774, test_loss: 1.0374, test_f1: 0.6491
 epoch: 33, train_loss: 0.6812, test_loss: 1.0495, test_f1: 0.6304
 epoch: 34, train_loss: 0.6534, test_loss: 1.1117, test_f1: 0.5623
 epoch: 35, train_loss: 0.6653, test_loss: 0.9331, test_f1: 0.6028
 epoch: 36, train_loss: 0.6476, test_loss: 0.9251, test_f1: 0.5990
 epoch: 37, train_loss: 0.6460, test_loss: 1.0719, test_f1: 0.6509
 epoch: 38, train_loss: 0.6219, test_loss: 1.0030, test_f1: 0.6147
 epoch: 39, train_loss: 0.6341, test_loss: 0.8730, test_f1: 0.5762
 epoch: 40, train_loss: 0.6225, test_loss: 1.1037, test_f1: 0.6294
 epoch: 41, train_loss: 0.6263, test_loss: 1.0399, test_f1: 0.6592
 epoch: 42, train_loss: 0.6064, test_loss: 0.9449, test_f1: 0.6035
 epoch: 43, train_loss: 0.6396, test_loss: 1.1572, test_f1: 0.6114
 epoch: 44, train_loss: 0.6011, test_loss: 1.0315, test_f1: 0.6253
 epoch: 45, train_loss: 0.6041, test_loss: 1.1439, test_f1: 0.6252
 epoch: 46, train_loss: 0.5906, test_loss: 1.1831, test_f1: 0.6453
 epoch: 47, train_loss: 0.5922, test_loss: 1.1382, test_f1: 0.6487
 epoch: 48, train_loss: 0.5824, test_loss: 1.0403, test_f1: 0.6483
 epoch: 49, train_loss: 0.6006, test_loss: 1.0643, test_f1: 0.6462
 epoch: 50, train_loss: 0.5649, test_loss: 1.9347, test_f1: 0.5337
 epoch: 51, train_loss: 0.5559, test_loss: 1.1819, test_f1: 0.6187
 epoch: 52, train_loss: 0.5146, test_loss: 1.0986, test_f1: 0.6400
 epoch: 53, train_loss: 0.4919, test_loss: 1.0390, test_f1: 0.6485
 epoch: 54, train_loss: 0.5061, test_loss: 1.2573, test_f1: 0.6505
 epoch: 55, train_loss: 0.4874, test_loss: 1.1565, test_f1: 0.6531
 epoch: 56, train_loss: 0.4743, test_loss: 1.3013, test_f1: 0.6599
 epoch: 57, train_loss: 0.4819, test_loss: 1.1144, test_f1: 0.6572
 epoch: 58, train_loss: 0.4566, test_loss: 1.2094, test_f1: 0.6311
 epoch: 59, train_loss: 0.4745, test_loss: 1.1108, test_f1: 0.6539
 epoch: 60, train_loss: 0.4572, test_loss: 1.2990, test_f1: 0.6305
 epoch: 61, train_loss: 0.4712, test_loss: 1.1390, test_f1: 0.6822
 epoch: 62, train_loss: 0.4354, test_loss: 1.1758, test_f1: 0.6635
 epoch: 63, train_loss: 0.4678, test_loss: 1.3577, test_f1: 0.6576
 epoch: 64, train_loss: 0.4332, test_loss: 1.1428, test_f1: 0.6590
 epoch: 65, train_loss: 0.4223, test_loss: 1.1177, test_f1: 0.6729
 epoch: 66, train_loss: 0.4495, test_loss: 1.1984, test_f1: 0.6813
 epoch: 67, train_loss: 0.4576, test_loss: 1.7149, test_f1: 0.6654
 epoch: 68, train_loss: 0.4572, test_loss: 1.2573, test_f1: 0.6862
 epoch: 69, train_loss: 0.4417, test_loss: 1.2615, test_f1: 0.6688
 epoch: 70, train_loss: 0.4430, test_loss: 1.4662, test_f1: 0.6467
 epoch: 71, train_loss: 0.4336, test_loss: 1.1769, test_f1: 0.6522
 epoch: 72, train_loss: 0.4534, test_loss: 1.0477, test_f1: 0.6566
 epoch: 73, train_loss: 0.4168, test_loss: 1.1544, test_f1: 0.6856
 epoch: 74, train_loss: 0.4157, test_loss: 1.2747, test_f1: 0.6641
 epoch: 75, train_loss: 0.3924, test_loss: 1.4192, test_f1: 0.6671
 epoch: 76, train_loss: 0.3994, test_loss: 1.1807, test_f1: 0.6585
 epoch: 77, train_loss: 0.4156, test_loss: 1.1376, test_f1: 0.6579
 epoch: 78, train_loss: 0.3963, test_loss: 1.3349, test_f1: 0.6600
 epoch: 79, train_loss: 0.3826, test_loss: 1.3501, test_f1: 0.6736
 epoch: 80, train_loss: 0.3924, test_loss: 1.2688, test_f1: 0.6707
 epoch: 81, train_loss: 0.3954, test_loss: 1.1283, test_f1: 0.6690
 epoch: 82, train_loss: 0.3933, test_loss: 1.3236, test_f1: 0.6613
 epoch: 83, train_loss: 0.3856, test_loss: 1.3681, test_f1: 0.6335
 epoch: 84, train_loss: 0.4207, test_loss: 1.0123, test_f1: 0.6394
 epoch: 85, train_loss: 0.4046, test_loss: 1.1439, test_f1: 0.6894
 epoch: 86, train_loss: 0.3848, test_loss: 1.1864, test_f1: 0.6721
 epoch: 87, train_loss: 0.3707, test_loss: 1.1641, test_f1: 0.6731
 epoch: 88, train_loss: 0.3716, test_loss: 1.2549, test_f1: 0.6405
 epoch: 89, train_loss: 0.3665, test_loss: 1.2576, test_f1: 0.6851
 epoch: 90, train_loss: 0.3896, test_loss: 1.0047, test_f1: 0.6980
 epoch: 91, train_loss: 0.3939, test_loss: 1.3637, test_f1: 0.6227
 epoch: 92, train_loss: 0.3733, test_loss: 1.3103, test_f1: 0.6571
 epoch: 93, train_loss: 0.3692, test_loss: 1.0163, test_f1: 0.6709
 epoch: 94, train_loss: 0.3493, test_loss: 1.2687, test_f1: 0.6501
 epoch: 95, train_loss: 0.3785, test_loss: 1.2084, test_f1: 0.6621
 epoch: 96, train_loss: 0.3564, test_loss: 0.9940, test_f1: 0.6550
 epoch: 97, train_loss: 0.3573, test_loss: 1.2431, test_f1: 0.6476
 epoch: 98, train_loss: 0.3433, test_loss: 1.1500, test_f1: 0.6353
 epoch: 99, train_loss: 0.3475, test_loss: 1.0840, test_f1: 0.6638
##################ITERATION #6 ****************************************
 epoch: 0, train_loss: 1.2339, test_loss: 1.1219, test_f1: 0.4834
 epoch: 1, train_loss: 1.0109, test_loss: 0.9957, test_f1: 0.4849
 epoch: 2, train_loss: 0.9637, test_loss: 0.9236, test_f1: 0.5083
 epoch: 3, train_loss: 0.9404, test_loss: 0.9522, test_f1: 0.5255
 epoch: 4, train_loss: 0.9338, test_loss: 1.0423, test_f1: 0.5430
 epoch: 5, train_loss: 0.9247, test_loss: 1.0463, test_f1: 0.5238
 epoch: 6, train_loss: 0.8934, test_loss: 1.2398, test_f1: 0.4753
 epoch: 7, train_loss: 0.8712, test_loss: 0.9614, test_f1: 0.5524
 epoch: 8, train_loss: 0.8635, test_loss: 1.0136, test_f1: 0.5327
 epoch: 9, train_loss: 0.8604, test_loss: 0.9199, test_f1: 0.5476
 epoch: 10, train_loss: 0.8459, test_loss: 1.0306, test_f1: 0.5256
 epoch: 11, train_loss: 0.8171, test_loss: 1.0606, test_f1: 0.5686
 epoch: 12, train_loss: 0.8240, test_loss: 1.1603, test_f1: 0.5131
 epoch: 13, train_loss: 0.8269, test_loss: 1.1030, test_f1: 0.5267
 epoch: 14, train_loss: 0.8325, test_loss: 0.9712, test_f1: 0.5697
 epoch: 15, train_loss: 0.8093, test_loss: 1.0404, test_f1: 0.5237
 epoch: 16, train_loss: 0.7987, test_loss: 0.8985, test_f1: 0.5619
 epoch: 17, train_loss: 0.7850, test_loss: 0.8963, test_f1: 0.5624
 epoch: 18, train_loss: 0.7709, test_loss: 1.0123, test_f1: 0.5676
 epoch: 19, train_loss: 0.7572, test_loss: 0.9881, test_f1: 0.5634
 epoch: 20, train_loss: 0.7764, test_loss: 0.9660, test_f1: 0.5973
 epoch: 21, train_loss: 0.7352, test_loss: 0.9555, test_f1: 0.6319
 epoch: 22, train_loss: 0.7352, test_loss: 0.9821, test_f1: 0.5774
 epoch: 23, train_loss: 0.7468, test_loss: 1.0451, test_f1: 0.5810
 epoch: 24, train_loss: 0.7427, test_loss: 1.1403, test_f1: 0.5522
 epoch: 25, train_loss: 0.7271, test_loss: 0.9912, test_f1: 0.5760
 epoch: 26, train_loss: 0.6968, test_loss: 1.1888, test_f1: 0.5549
 epoch: 27, train_loss: 0.6964, test_loss: 1.2379, test_f1: 0.6036
 epoch: 28, train_loss: 0.6915, test_loss: 1.2044, test_f1: 0.6027
 epoch: 29, train_loss: 0.6810, test_loss: 1.0376, test_f1: 0.6214
 epoch: 30, train_loss: 0.6962, test_loss: 1.2993, test_f1: 0.6185
 epoch: 31, train_loss: 0.6744, test_loss: 1.1721, test_f1: 0.6128
 epoch: 32, train_loss: 0.6742, test_loss: 1.2079, test_f1: 0.6097
 epoch: 33, train_loss: 0.6884, test_loss: 1.0810, test_f1: 0.6227
 epoch: 34, train_loss: 0.6465, test_loss: 1.0940, test_f1: 0.5950
 epoch: 35, train_loss: 0.6598, test_loss: 1.1651, test_f1: 0.5408
 epoch: 36, train_loss: 0.6417, test_loss: 0.9449, test_f1: 0.6162
 epoch: 37, train_loss: 0.6394, test_loss: 1.3177, test_f1: 0.6257
 epoch: 38, train_loss: 0.6598, test_loss: 1.1194, test_f1: 0.6323
 epoch: 39, train_loss: 0.6344, test_loss: 0.9975, test_f1: 0.6540
 epoch: 40, train_loss: 0.6274, test_loss: 1.1467, test_f1: 0.6432
 epoch: 41, train_loss: 0.6095, test_loss: 1.0947, test_f1: 0.6418
 epoch: 42, train_loss: 0.6124, test_loss: 1.1818, test_f1: 0.6331
 epoch: 43, train_loss: 0.5925, test_loss: 0.9598, test_f1: 0.6062
 epoch: 44, train_loss: 0.5984, test_loss: 1.0629, test_f1: 0.6711
 epoch: 45, train_loss: 0.5904, test_loss: 1.2327, test_f1: 0.6416
 epoch: 46, train_loss: 0.6089, test_loss: 1.0763, test_f1: 0.6184
 epoch: 47, train_loss: 0.5809, test_loss: 1.0779, test_f1: 0.6281
 epoch: 48, train_loss: 0.5716, test_loss: 1.1819, test_f1: 0.6478
 epoch: 49, train_loss: 0.5871, test_loss: 0.8552, test_f1: 0.6511
 epoch: 50, train_loss: 0.5730, test_loss: 1.2388, test_f1: 0.6813
 epoch: 51, train_loss: 0.5253, test_loss: 1.0609, test_f1: 0.6753
 epoch: 52, train_loss: 0.5160, test_loss: 1.1338, test_f1: 0.6689
 epoch: 53, train_loss: 0.4882, test_loss: 1.1430, test_f1: 0.6961
 epoch: 54, train_loss: 0.4739, test_loss: 1.1963, test_f1: 0.6849
 epoch: 55, train_loss: 0.5149, test_loss: 1.2618, test_f1: 0.6268
 epoch: 56, train_loss: 0.5095, test_loss: 1.0837, test_f1: 0.6776
 epoch: 57, train_loss: 0.4593, test_loss: 1.1763, test_f1: 0.6753
 epoch: 58, train_loss: 0.4430, test_loss: 1.1622, test_f1: 0.6841
 epoch: 59, train_loss: 0.4526, test_loss: 1.0844, test_f1: 0.6878
 epoch: 60, train_loss: 0.4522, test_loss: 1.2028, test_f1: 0.7016
 epoch: 61, train_loss: 0.4519, test_loss: 1.2255, test_f1: 0.6649
 epoch: 62, train_loss: 0.4424, test_loss: 0.9748, test_f1: 0.6686
 epoch: 63, train_loss: 0.4522, test_loss: 1.1539, test_f1: 0.6695
 epoch: 64, train_loss: 0.4291, test_loss: 1.1009, test_f1: 0.6852
 epoch: 65, train_loss: 0.4079, test_loss: 1.1573, test_f1: 0.7044
 epoch: 66, train_loss: 0.4189, test_loss: 1.1559, test_f1: 0.6804
 epoch: 67, train_loss: 0.4390, test_loss: 0.8511, test_f1: 0.6704
 epoch: 68, train_loss: 0.4507, test_loss: 0.9061, test_f1: 0.6781
 epoch: 69, train_loss: 0.4266, test_loss: 0.9313, test_f1: 0.7016
 epoch: 70, train_loss: 0.4169, test_loss: 1.1138, test_f1: 0.6680
 epoch: 71, train_loss: 0.4060, test_loss: 1.0053, test_f1: 0.6755
 epoch: 72, train_loss: 0.4105, test_loss: 1.0599, test_f1: 0.6938
 epoch: 73, train_loss: 0.3989, test_loss: 1.1414, test_f1: 0.6674
 epoch: 74, train_loss: 0.4045, test_loss: 0.9842, test_f1: 0.7102
 epoch: 75, train_loss: 0.4299, test_loss: 0.9345, test_f1: 0.6749
 epoch: 76, train_loss: 0.4038, test_loss: 1.1636, test_f1: 0.6814
 epoch: 77, train_loss: 0.4113, test_loss: 0.9764, test_f1: 0.6915
 epoch: 78, train_loss: 0.3911, test_loss: 1.0802, test_f1: 0.6813
 epoch: 79, train_loss: 0.3634, test_loss: 1.0376, test_f1: 0.6736
 epoch: 80, train_loss: 0.3801, test_loss: 1.1268, test_f1: 0.6522
 epoch: 81, train_loss: 0.4086, test_loss: 0.8489, test_f1: 0.6727
 epoch: 82, train_loss: 0.3910, test_loss: 0.9345, test_f1: 0.6709
 epoch: 83, train_loss: 0.3821, test_loss: 1.1299, test_f1: 0.7037
 epoch: 84, train_loss: 0.3677, test_loss: 1.1025, test_f1: 0.6916
 epoch: 85, train_loss: 0.4089, test_loss: 0.9627, test_f1: 0.7015
 epoch: 86, train_loss: 0.3710, test_loss: 1.1093, test_f1: 0.6866
 epoch: 87, train_loss: 0.3735, test_loss: 1.0811, test_f1: 0.6615
 epoch: 88, train_loss: 0.3592, test_loss: 1.3944, test_f1: 0.7029
 epoch: 89, train_loss: 0.3519, test_loss: 1.2739, test_f1: 0.6732
 epoch: 90, train_loss: 0.3576, test_loss: 1.4173, test_f1: 0.6772
 epoch: 91, train_loss: 0.3601, test_loss: 0.9558, test_f1: 0.6812
 epoch: 92, train_loss: 0.3570, test_loss: 1.2082, test_f1: 0.6914
 epoch: 93, train_loss: 0.3503, test_loss: 0.9751, test_f1: 0.7069
 epoch: 94, train_loss: 0.3465, test_loss: 1.2608, test_f1: 0.6924
 epoch: 95, train_loss: 0.3335, test_loss: 1.1006, test_f1: 0.7110
 epoch: 96, train_loss: 0.3296, test_loss: 1.4422, test_f1: 0.6714
 epoch: 97, train_loss: 0.3309, test_loss: 1.3307, test_f1: 0.6744
 epoch: 98, train_loss: 0.3266, test_loss: 1.2466, test_f1: 0.6663
 epoch: 99, train_loss: 0.3315, test_loss: 1.2340, test_f1: 0.6878
##################ITERATION #7 ****************************************
 epoch: 0, train_loss: 1.3138, test_loss: 1.1615, test_f1: 0.4276
 epoch: 1, train_loss: 1.0407, test_loss: 1.0559, test_f1: 0.5135
 epoch: 2, train_loss: 0.9943, test_loss: 1.0842, test_f1: 0.4312
 epoch: 3, train_loss: 0.9496, test_loss: 0.9986, test_f1: 0.5571
 epoch: 4, train_loss: 0.9306, test_loss: 0.9267, test_f1: 0.4918
 epoch: 5, train_loss: 0.9275, test_loss: 0.9960, test_f1: 0.5432
 epoch: 6, train_loss: 0.9104, test_loss: 0.9609, test_f1: 0.5653
 epoch: 7, train_loss: 0.8957, test_loss: 0.9519, test_f1: 0.5622
 epoch: 8, train_loss: 0.8657, test_loss: 0.9168, test_f1: 0.4877
 epoch: 9, train_loss: 0.8470, test_loss: 1.0601, test_f1: 0.5201
 epoch: 10, train_loss: 0.8391, test_loss: 0.9038, test_f1: 0.5725
 epoch: 11, train_loss: 0.8396, test_loss: 1.0835, test_f1: 0.4682
 epoch: 12, train_loss: 0.8334, test_loss: 0.9021, test_f1: 0.5354
 epoch: 13, train_loss: 0.8266, test_loss: 0.9987, test_f1: 0.5206
 epoch: 14, train_loss: 0.8028, test_loss: 0.8605, test_f1: 0.5385
 epoch: 15, train_loss: 0.7970, test_loss: 0.8925, test_f1: 0.5484
 epoch: 16, train_loss: 0.7794, test_loss: 0.9964, test_f1: 0.5245
 epoch: 17, train_loss: 0.7812, test_loss: 0.9330, test_f1: 0.5319
 epoch: 18, train_loss: 0.7614, test_loss: 0.8849, test_f1: 0.6115
 epoch: 19, train_loss: 0.7630, test_loss: 1.1162, test_f1: 0.5161
 epoch: 20, train_loss: 0.7711, test_loss: 0.9946, test_f1: 0.5551
 epoch: 21, train_loss: 0.7340, test_loss: 0.8136, test_f1: 0.6124
 epoch: 22, train_loss: 0.7550, test_loss: 1.1007, test_f1: 0.5730
 epoch: 23, train_loss: 0.7214, test_loss: 0.8127, test_f1: 0.6053
 epoch: 24, train_loss: 0.7172, test_loss: 1.0744, test_f1: 0.5934
 epoch: 25, train_loss: 0.6905, test_loss: 0.9998, test_f1: 0.5984
 epoch: 26, train_loss: 0.6765, test_loss: 1.0733, test_f1: 0.5728
 epoch: 27, train_loss: 0.6777, test_loss: 0.9804, test_f1: 0.6321
 epoch: 28, train_loss: 0.6668, test_loss: 0.9845, test_f1: 0.6404
 epoch: 29, train_loss: 0.6650, test_loss: 1.0655, test_f1: 0.5737
 epoch: 30, train_loss: 0.6604, test_loss: 1.0265, test_f1: 0.5980
 epoch: 31, train_loss: 0.6327, test_loss: 1.0587, test_f1: 0.6124
 epoch: 32, train_loss: 0.6373, test_loss: 1.1085, test_f1: 0.6325
 epoch: 33, train_loss: 0.6372, test_loss: 1.1050, test_f1: 0.6068
 epoch: 34, train_loss: 0.6333, test_loss: 0.9662, test_f1: 0.6380
 epoch: 35, train_loss: 0.6142, test_loss: 1.1586, test_f1: 0.5562
 epoch: 36, train_loss: 0.5996, test_loss: 1.1050, test_f1: 0.6043
 epoch: 37, train_loss: 0.6097, test_loss: 1.1647, test_f1: 0.6274
 epoch: 38, train_loss: 0.6136, test_loss: 1.0183, test_f1: 0.5776
 epoch: 39, train_loss: 0.6183, test_loss: 0.9958, test_f1: 0.6278
 epoch: 40, train_loss: 0.6099, test_loss: 1.1407, test_f1: 0.6301
 epoch: 41, train_loss: 0.5892, test_loss: 1.0243, test_f1: 0.6451
 epoch: 42, train_loss: 0.6407, test_loss: 1.0751, test_f1: 0.5727
 epoch: 43, train_loss: 0.6036, test_loss: 0.9060, test_f1: 0.6706
 epoch: 44, train_loss: 0.5763, test_loss: 1.0534, test_f1: 0.6523
 epoch: 45, train_loss: 0.5682, test_loss: 1.1834, test_f1: 0.6201
 epoch: 46, train_loss: 0.5581, test_loss: 1.2102, test_f1: 0.6364
 epoch: 47, train_loss: 0.5566, test_loss: 0.8882, test_f1: 0.6700
 epoch: 48, train_loss: 0.5686, test_loss: 0.9834, test_f1: 0.5882
 epoch: 49, train_loss: 0.5960, test_loss: 0.8778, test_f1: 0.6270
 epoch: 50, train_loss: 0.5350, test_loss: 0.8765, test_f1: 0.6328
 epoch: 51, train_loss: 0.5111, test_loss: 0.9523, test_f1: 0.6802
 epoch: 52, train_loss: 0.4848, test_loss: 0.9131, test_f1: 0.6880
 epoch: 53, train_loss: 0.4740, test_loss: 0.8822, test_f1: 0.6746
 epoch: 54, train_loss: 0.4613, test_loss: 0.9736, test_f1: 0.6787
 epoch: 55, train_loss: 0.4490, test_loss: 1.0975, test_f1: 0.6844
 epoch: 56, train_loss: 0.4504, test_loss: 1.0957, test_f1: 0.6937
 epoch: 57, train_loss: 0.4323, test_loss: 0.9965, test_f1: 0.6803
 epoch: 58, train_loss: 0.4391, test_loss: 1.1261, test_f1: 0.6483
 epoch: 59, train_loss: 0.4330, test_loss: 1.2108, test_f1: 0.6571
 epoch: 60, train_loss: 0.4292, test_loss: 0.9078, test_f1: 0.6753
 epoch: 61, train_loss: 0.4223, test_loss: 1.0697, test_f1: 0.6879
 epoch: 62, train_loss: 0.4001, test_loss: 1.0049, test_f1: 0.6764
 epoch: 63, train_loss: 0.4176, test_loss: 1.0368, test_f1: 0.6721
 epoch: 64, train_loss: 0.4021, test_loss: 1.1447, test_f1: 0.6799
 epoch: 65, train_loss: 0.3796, test_loss: 1.2087, test_f1: 0.6863
 epoch: 66, train_loss: 0.3888, test_loss: 1.0615, test_f1: 0.7016
 epoch: 67, train_loss: 0.3946, test_loss: 1.1134, test_f1: 0.7114
 epoch: 68, train_loss: 0.3905, test_loss: 1.0734, test_f1: 0.7072
 epoch: 69, train_loss: 0.3898, test_loss: 1.1523, test_f1: 0.6550
 epoch: 70, train_loss: 0.3752, test_loss: 1.0642, test_f1: 0.6739
 epoch: 71, train_loss: 0.3658, test_loss: 1.1528, test_f1: 0.6736
 epoch: 72, train_loss: 0.3853, test_loss: 1.0170, test_f1: 0.6628
 epoch: 73, train_loss: 0.3871, test_loss: 1.1198, test_f1: 0.6656
 epoch: 74, train_loss: 0.3760, test_loss: 0.9618, test_f1: 0.7016
 epoch: 75, train_loss: 0.3795, test_loss: 1.1778, test_f1: 0.6723
 epoch: 76, train_loss: 0.3641, test_loss: 1.1428, test_f1: 0.7049
 epoch: 77, train_loss: 0.3457, test_loss: 1.0407, test_f1: 0.6732
 epoch: 78, train_loss: 0.3547, test_loss: 1.2359, test_f1: 0.6626
 epoch: 79, train_loss: 0.3621, test_loss: 1.1141, test_f1: 0.6733
 epoch: 80, train_loss: 0.3706, test_loss: 0.9656, test_f1: 0.6878
 epoch: 81, train_loss: 0.3509, test_loss: 1.2087, test_f1: 0.6957
 epoch: 82, train_loss: 0.3380, test_loss: 1.0891, test_f1: 0.6841
 epoch: 83, train_loss: 0.3559, test_loss: 1.2221, test_f1: 0.6579
 epoch: 84, train_loss: 0.3661, test_loss: 1.1337, test_f1: 0.6802
 epoch: 85, train_loss: 0.3304, test_loss: 1.1152, test_f1: 0.7186
 epoch: 86, train_loss: 0.3318, test_loss: 1.1605, test_f1: 0.7119
 epoch: 87, train_loss: 0.3536, test_loss: 1.1265, test_f1: 0.7016
 epoch: 88, train_loss: 0.3379, test_loss: 1.2645, test_f1: 0.6703
 epoch: 89, train_loss: 0.3319, test_loss: 1.1519, test_f1: 0.6878
 epoch: 90, train_loss: 0.3028, test_loss: 1.2905, test_f1: 0.6586
 epoch: 91, train_loss: 0.3100, test_loss: 1.4904, test_f1: 0.6605
 epoch: 92, train_loss: 0.2982, test_loss: 1.2342, test_f1: 0.6772
 epoch: 93, train_loss: 0.3042, test_loss: 1.3016, test_f1: 0.6961
 epoch: 94, train_loss: 0.3192, test_loss: 1.1769, test_f1: 0.6801
 epoch: 95, train_loss: 0.2954, test_loss: 1.3254, test_f1: 0.6600
 epoch: 96, train_loss: 0.3108, test_loss: 1.2512, test_f1: 0.7066
 epoch: 97, train_loss: 0.2958, test_loss: 1.2034, test_f1: 0.6776
 epoch: 98, train_loss: 0.2902, test_loss: 1.1450, test_f1: 0.7061
 epoch: 99, train_loss: 0.2749, test_loss: 1.3168, test_f1: 0.6815
##################ITERATION #8 ****************************************
 epoch: 0, train_loss: 1.3138, test_loss: 1.2003, test_f1: 0.4632
 epoch: 1, train_loss: 1.0269, test_loss: 1.0251, test_f1: 0.5327
 epoch: 2, train_loss: 0.9595, test_loss: 1.0308, test_f1: 0.5148
 epoch: 3, train_loss: 0.9501, test_loss: 1.5671, test_f1: 0.3085
 epoch: 4, train_loss: 0.9526, test_loss: 0.9542, test_f1: 0.4682
 epoch: 5, train_loss: 0.9217, test_loss: 0.9139, test_f1: 0.5096
 epoch: 6, train_loss: 0.9026, test_loss: 0.9896, test_f1: 0.5078
 epoch: 7, train_loss: 0.8934, test_loss: 0.9247, test_f1: 0.5407
 epoch: 8, train_loss: 0.8821, test_loss: 0.8917, test_f1: 0.5962
 epoch: 9, train_loss: 0.8465, test_loss: 0.8444, test_f1: 0.5890
 epoch: 10, train_loss: 0.8439, test_loss: 0.9732, test_f1: 0.5424
 epoch: 11, train_loss: 0.8486, test_loss: 0.8861, test_f1: 0.5691
 epoch: 12, train_loss: 0.8539, test_loss: 1.0993, test_f1: 0.5094
 epoch: 13, train_loss: 0.8282, test_loss: 0.8476, test_f1: 0.5574
 epoch: 14, train_loss: 0.7984, test_loss: 0.8341, test_f1: 0.5561
 epoch: 15, train_loss: 0.7882, test_loss: 0.8361, test_f1: 0.5531
 epoch: 16, train_loss: 0.7883, test_loss: 0.9184, test_f1: 0.5378
 epoch: 17, train_loss: 0.7484, test_loss: 0.8523, test_f1: 0.5753
 epoch: 18, train_loss: 0.7624, test_loss: 0.9332, test_f1: 0.5186
 epoch: 19, train_loss: 0.7504, test_loss: 0.7913, test_f1: 0.5552
 epoch: 20, train_loss: 0.7447, test_loss: 0.8757, test_f1: 0.5187
 epoch: 21, train_loss: 0.7351, test_loss: 0.9311, test_f1: 0.5380
 epoch: 22, train_loss: 0.7325, test_loss: 1.0310, test_f1: 0.5399
 epoch: 23, train_loss: 0.7419, test_loss: 0.7702, test_f1: 0.6226
 epoch: 24, train_loss: 0.7348, test_loss: 0.8312, test_f1: 0.6142
 epoch: 25, train_loss: 0.7229, test_loss: 0.9185, test_f1: 0.5406
 epoch: 26, train_loss: 0.6867, test_loss: 0.8036, test_f1: 0.5618
 epoch: 27, train_loss: 0.6857, test_loss: 0.9371, test_f1: 0.5767
 epoch: 28, train_loss: 0.6920, test_loss: 1.4258, test_f1: 0.5129
 epoch: 29, train_loss: 0.6919, test_loss: 0.8963, test_f1: 0.5359
 epoch: 30, train_loss: 0.6744, test_loss: 0.9586, test_f1: 0.5983
 epoch: 31, train_loss: 0.6591, test_loss: 0.9897, test_f1: 0.6271
 epoch: 32, train_loss: 0.6818, test_loss: 0.8560, test_f1: 0.6288
 epoch: 33, train_loss: 0.6551, test_loss: 0.9828, test_f1: 0.6202
 epoch: 34, train_loss: 0.6497, test_loss: 0.8273, test_f1: 0.6077
 epoch: 35, train_loss: 0.6448, test_loss: 0.9472, test_f1: 0.5611
 epoch: 36, train_loss: 0.6609, test_loss: 0.9533, test_f1: 0.6158
 epoch: 37, train_loss: 0.6382, test_loss: 0.9231, test_f1: 0.6357
 epoch: 38, train_loss: 0.6212, test_loss: 1.0865, test_f1: 0.6127
 epoch: 39, train_loss: 0.6217, test_loss: 0.8314, test_f1: 0.6326
 epoch: 40, train_loss: 0.6131, test_loss: 0.9657, test_f1: 0.6115
 epoch: 41, train_loss: 0.5868, test_loss: 1.0808, test_f1: 0.5895
 epoch: 42, train_loss: 0.5828, test_loss: 1.0222, test_f1: 0.6406
 epoch: 43, train_loss: 0.5874, test_loss: 1.0640, test_f1: 0.5586
 epoch: 44, train_loss: 0.5943, test_loss: 1.0862, test_f1: 0.6443
 epoch: 45, train_loss: 0.5961, test_loss: 0.9518, test_f1: 0.6437
 epoch: 46, train_loss: 0.5520, test_loss: 0.9943, test_f1: 0.6292
 epoch: 47, train_loss: 0.5657, test_loss: 0.7938, test_f1: 0.6183
 epoch: 48, train_loss: 0.5704, test_loss: 0.9036, test_f1: 0.6477
 epoch: 49, train_loss: 0.5682, test_loss: 0.8782, test_f1: 0.6574
 epoch: 50, train_loss: 0.5682, test_loss: 1.0567, test_f1: 0.6372
 epoch: 51, train_loss: 0.5089, test_loss: 0.9379, test_f1: 0.6547
 epoch: 52, train_loss: 0.4831, test_loss: 1.0473, test_f1: 0.6717
 epoch: 53, train_loss: 0.4873, test_loss: 0.9833, test_f1: 0.6745
 epoch: 54, train_loss: 0.4680, test_loss: 0.9910, test_f1: 0.6673
 epoch: 55, train_loss: 0.4680, test_loss: 0.9952, test_f1: 0.6568
 epoch: 56, train_loss: 0.4436, test_loss: 1.0182, test_f1: 0.6484
 epoch: 57, train_loss: 0.4286, test_loss: 1.0474, test_f1: 0.6727
 epoch: 58, train_loss: 0.4470, test_loss: 1.1567, test_f1: 0.6337
 epoch: 59, train_loss: 0.4397, test_loss: 1.0240, test_f1: 0.6674
 epoch: 60, train_loss: 0.4226, test_loss: 1.2094, test_f1: 0.6435
 epoch: 61, train_loss: 0.4364, test_loss: 0.9893, test_f1: 0.6641
 epoch: 62, train_loss: 0.4535, test_loss: 1.0995, test_f1: 0.6580
 epoch: 63, train_loss: 0.4314, test_loss: 1.1477, test_f1: 0.6660
 epoch: 64, train_loss: 0.4233, test_loss: 1.0235, test_f1: 0.6707
 epoch: 65, train_loss: 0.4356, test_loss: 0.9269, test_f1: 0.6601
 epoch: 66, train_loss: 0.4017, test_loss: 1.0976, test_f1: 0.6526
 epoch: 67, train_loss: 0.3970, test_loss: 1.2803, test_f1: 0.6529
 epoch: 68, train_loss: 0.4101, test_loss: 0.8835, test_f1: 0.6865
 epoch: 69, train_loss: 0.4027, test_loss: 0.9621, test_f1: 0.6402
 epoch: 70, train_loss: 0.4023, test_loss: 1.0661, test_f1: 0.6677
 epoch: 71, train_loss: 0.3963, test_loss: 0.9824, test_f1: 0.6573
 epoch: 72, train_loss: 0.3765, test_loss: 1.1478, test_f1: 0.6350
 epoch: 73, train_loss: 0.3930, test_loss: 0.9157, test_f1: 0.6463
 epoch: 74, train_loss: 0.3816, test_loss: 1.0731, test_f1: 0.6580
 epoch: 75, train_loss: 0.4017, test_loss: 0.9091, test_f1: 0.6602
 epoch: 76, train_loss: 0.3909, test_loss: 1.2577, test_f1: 0.6540
 epoch: 77, train_loss: 0.3700, test_loss: 1.0087, test_f1: 0.6450
 epoch: 78, train_loss: 0.3847, test_loss: 1.0975, test_f1: 0.6480
 epoch: 79, train_loss: 0.3716, test_loss: 1.2859, test_f1: 0.6609
 epoch: 80, train_loss: 0.3600, test_loss: 1.3086, test_f1: 0.6647
 epoch: 81, train_loss: 0.3576, test_loss: 1.0664, test_f1: 0.6991
 epoch: 82, train_loss: 0.3539, test_loss: 1.1143, test_f1: 0.6777
 epoch: 83, train_loss: 0.3731, test_loss: 1.0697, test_f1: 0.6746
 epoch: 84, train_loss: 0.3449, test_loss: 1.0734, test_f1: 0.6736
 epoch: 85, train_loss: 0.3625, test_loss: 1.1783, test_f1: 0.6594
 epoch: 86, train_loss: 0.3691, test_loss: 1.1281, test_f1: 0.6741
 epoch: 87, train_loss: 0.3411, test_loss: 0.9934, test_f1: 0.6898
 epoch: 88, train_loss: 0.3410, test_loss: 1.1037, test_f1: 0.6683
 epoch: 89, train_loss: 0.3323, test_loss: 1.1409, test_f1: 0.6704
 epoch: 90, train_loss: 0.3124, test_loss: 1.0732, test_f1: 0.6772
 epoch: 91, train_loss: 0.3498, test_loss: 1.1167, test_f1: 0.6590
 epoch: 92, train_loss: 0.3313, test_loss: 1.1574, test_f1: 0.6553
 epoch: 93, train_loss: 0.3292, test_loss: 1.2767, test_f1: 0.6603
 epoch: 94, train_loss: 0.3479, test_loss: 1.3854, test_f1: 0.6220
 epoch: 95, train_loss: 0.3207, test_loss: 1.1263, test_f1: 0.6988
 epoch: 96, train_loss: 0.3299, test_loss: 1.3536, test_f1: 0.6573
 epoch: 97, train_loss: 0.3404, test_loss: 1.1392, test_f1: 0.6579
 epoch: 98, train_loss: 0.3340, test_loss: 1.1135, test_f1: 0.6673
 epoch: 99, train_loss: 0.3149, test_loss: 1.2726, test_f1: 0.6775
##################ITERATION #9 ****************************************
 epoch: 0, train_loss: 1.2856, test_loss: 1.1588, test_f1: 0.3545
 epoch: 1, train_loss: 1.0027, test_loss: 1.0131, test_f1: 0.5061
 epoch: 2, train_loss: 0.9772, test_loss: 1.0157, test_f1: 0.5175
 epoch: 3, train_loss: 0.9330, test_loss: 1.1138, test_f1: 0.5032
 epoch: 4, train_loss: 0.9166, test_loss: 1.0060, test_f1: 0.5011
 epoch: 5, train_loss: 0.9059, test_loss: 0.9023, test_f1: 0.5371
 epoch: 6, train_loss: 0.8624, test_loss: 1.5232, test_f1: 0.3362
 epoch: 7, train_loss: 0.8631, test_loss: 0.9162, test_f1: 0.5320
 epoch: 8, train_loss: 0.8504, test_loss: 1.0611, test_f1: 0.5357
 epoch: 9, train_loss: 0.8397, test_loss: 0.9394, test_f1: 0.5659
 epoch: 10, train_loss: 0.8222, test_loss: 1.0126, test_f1: 0.5483
 epoch: 11, train_loss: 0.8118, test_loss: 0.9799, test_f1: 0.5675
 epoch: 12, train_loss: 0.7962, test_loss: 0.8805, test_f1: 0.5757
 epoch: 13, train_loss: 0.7741, test_loss: 0.9534, test_f1: 0.5630
 epoch: 14, train_loss: 0.7716, test_loss: 1.0422, test_f1: 0.5669
 epoch: 15, train_loss: 0.7445, test_loss: 1.0268, test_f1: 0.5647
 epoch: 16, train_loss: 0.7612, test_loss: 0.8600, test_f1: 0.5582
 epoch: 17, train_loss: 0.7468, test_loss: 1.1156, test_f1: 0.5246
 epoch: 18, train_loss: 0.7356, test_loss: 0.7442, test_f1: 0.6496
 epoch: 19, train_loss: 0.7094, test_loss: 0.8168, test_f1: 0.6689
 epoch: 20, train_loss: 0.6952, test_loss: 0.9729, test_f1: 0.6013
 epoch: 21, train_loss: 0.7006, test_loss: 0.9592, test_f1: 0.6238
 epoch: 22, train_loss: 0.6567, test_loss: 0.8888, test_f1: 0.6317
 epoch: 23, train_loss: 0.6677, test_loss: 1.0192, test_f1: 0.5840
 epoch: 24, train_loss: 0.6743, test_loss: 0.9141, test_f1: 0.6274
 epoch: 25, train_loss: 0.6969, test_loss: 0.9785, test_f1: 0.5786
 epoch: 26, train_loss: 0.6713, test_loss: 1.0570, test_f1: 0.5112
 epoch: 27, train_loss: 0.6714, test_loss: 0.9538, test_f1: 0.6511
 epoch: 28, train_loss: 0.6510, test_loss: 1.0777, test_f1: 0.5655
 epoch: 29, train_loss: 0.6387, test_loss: 0.9980, test_f1: 0.5890
 epoch: 30, train_loss: 0.6096, test_loss: 0.7788, test_f1: 0.6303
 epoch: 31, train_loss: 0.6361, test_loss: 0.8698, test_f1: 0.6013
 epoch: 32, train_loss: 0.6060, test_loss: 0.8433, test_f1: 0.6543
 epoch: 33, train_loss: 0.5831, test_loss: 0.9977, test_f1: 0.6634
 epoch: 34, train_loss: 0.5927, test_loss: 0.8561, test_f1: 0.6894
 epoch: 35, train_loss: 0.6006, test_loss: 0.9156, test_f1: 0.6110
 epoch: 36, train_loss: 0.6411, test_loss: 0.9367, test_f1: 0.6360
 epoch: 37, train_loss: 0.6145, test_loss: 1.1352, test_f1: 0.5834
 epoch: 38, train_loss: 0.5904, test_loss: 0.8654, test_f1: 0.6233
 epoch: 39, train_loss: 0.5775, test_loss: 0.8115, test_f1: 0.6373
 epoch: 40, train_loss: 0.5617, test_loss: 1.0115, test_f1: 0.6275
 epoch: 41, train_loss: 0.5607, test_loss: 0.8340, test_f1: 0.6783
 epoch: 42, train_loss: 0.5901, test_loss: 0.9592, test_f1: 0.6005
 epoch: 43, train_loss: 0.5539, test_loss: 1.0300, test_f1: 0.6429
 epoch: 44, train_loss: 0.5402, test_loss: 1.0300, test_f1: 0.5828
 epoch: 45, train_loss: 0.5415, test_loss: 0.9788, test_f1: 0.6184
 epoch: 46, train_loss: 0.5463, test_loss: 1.1116, test_f1: 0.6307
 epoch: 47, train_loss: 0.5206, test_loss: 1.3538, test_f1: 0.5513
 epoch: 48, train_loss: 0.5205, test_loss: 1.1377, test_f1: 0.6160
 epoch: 49, train_loss: 0.5156, test_loss: 0.9092, test_f1: 0.6829
 epoch: 50, train_loss: 0.4967, test_loss: 0.9918, test_f1: 0.6773
 epoch: 51, train_loss: 0.4823, test_loss: 1.1752, test_f1: 0.6405
 epoch: 52, train_loss: 0.4350, test_loss: 0.9950, test_f1: 0.6614
 epoch: 53, train_loss: 0.4273, test_loss: 1.1093, test_f1: 0.6442
 epoch: 54, train_loss: 0.4144, test_loss: 0.9834, test_f1: 0.6739
 epoch: 55, train_loss: 0.4045, test_loss: 1.0097, test_f1: 0.6695
 epoch: 56, train_loss: 0.4015, test_loss: 0.9616, test_f1: 0.6687
 epoch: 57, train_loss: 0.4174, test_loss: 1.0846, test_f1: 0.6464
 epoch: 58, train_loss: 0.3994, test_loss: 1.3063, test_f1: 0.6572
 epoch: 59, train_loss: 0.4044, test_loss: 0.9963, test_f1: 0.6629
 epoch: 60, train_loss: 0.4116, test_loss: 0.9847, test_f1: 0.6800
 epoch: 61, train_loss: 0.3958, test_loss: 1.1506, test_f1: 0.6376
 epoch: 62, train_loss: 0.3821, test_loss: 0.9474, test_f1: 0.6758
 epoch: 63, train_loss: 0.3718, test_loss: 1.3329, test_f1: 0.6370
 epoch: 64, train_loss: 0.3683, test_loss: 1.2109, test_f1: 0.6613
 epoch: 65, train_loss: 0.3831, test_loss: 1.1102, test_f1: 0.6644
 epoch: 66, train_loss: 0.3846, test_loss: 1.1280, test_f1: 0.6568
 epoch: 67, train_loss: 0.3743, test_loss: 0.9890, test_f1: 0.6563
 epoch: 68, train_loss: 0.3722, test_loss: 1.1562, test_f1: 0.6696
 epoch: 69, train_loss: 0.3774, test_loss: 1.1089, test_f1: 0.6645
 epoch: 70, train_loss: 0.3508, test_loss: 1.0323, test_f1: 0.6543
 epoch: 71, train_loss: 0.3629, test_loss: 1.1779, test_f1: 0.6382
 epoch: 72, train_loss: 0.3430, test_loss: 1.2229, test_f1: 0.6518
 epoch: 73, train_loss: 0.3504, test_loss: 1.1140, test_f1: 0.6447
 epoch: 74, train_loss: 0.3781, test_loss: 1.1581, test_f1: 0.6558
 epoch: 75, train_loss: 0.3572, test_loss: 1.0591, test_f1: 0.6674
 epoch: 76, train_loss: 0.3537, test_loss: 1.2742, test_f1: 0.6415
 epoch: 77, train_loss: 0.3428, test_loss: 1.1236, test_f1: 0.6611
 epoch: 78, train_loss: 0.3447, test_loss: 1.1621, test_f1: 0.6506
 epoch: 79, train_loss: 0.3578, test_loss: 1.4465, test_f1: 0.6041
 epoch: 80, train_loss: 0.3529, test_loss: 1.1007, test_f1: 0.6459
 epoch: 81, train_loss: 0.3270, test_loss: 1.1531, test_f1: 0.6711
 epoch: 82, train_loss: 0.3207, test_loss: 1.1076, test_f1: 0.6467
 epoch: 83, train_loss: 0.3362, test_loss: 1.2910, test_f1: 0.6474
 epoch: 84, train_loss: 0.3335, test_loss: 1.5859, test_f1: 0.6018
 epoch: 85, train_loss: 0.3356, test_loss: 1.3072, test_f1: 0.6331
 epoch: 86, train_loss: 0.3143, test_loss: 1.4836, test_f1: 0.6366
 epoch: 87, train_loss: 0.3355, test_loss: 1.1720, test_f1: 0.6544
 epoch: 88, train_loss: 0.3262, test_loss: 1.7210, test_f1: 0.6352
 epoch: 89, train_loss: 0.3071, test_loss: 1.4610, test_f1: 0.6452
 epoch: 90, train_loss: 0.3086, test_loss: 1.2310, test_f1: 0.6691
 epoch: 91, train_loss: 0.3017, test_loss: 1.1873, test_f1: 0.6328
 epoch: 92, train_loss: 0.2969, test_loss: 1.1521, test_f1: 0.6821
 epoch: 93, train_loss: 0.2979, test_loss: 1.4563, test_f1: 0.6505
 epoch: 94, train_loss: 0.2780, test_loss: 1.2127, test_f1: 0.6810
 epoch: 95, train_loss: 0.3170, test_loss: 1.4025, test_f1: 0.6720
 epoch: 96, train_loss: 0.2909, test_loss: 1.3084, test_f1: 0.6554
 epoch: 97, train_loss: 0.2916, test_loss: 1.4785, test_f1: 0.6724
 epoch: 98, train_loss: 0.2976, test_loss: 1.5146, test_f1: 0.6365
 epoch: 99, train_loss: 0.2856, test_loss: 1.6564, test_f1: 0.6412

Training completed in 593.25 seconds
Best F1: 0.7234 at epoch 66
Mean F1 across iterations: 0.7031  0.0122
========================FINAL RESULTS================================
FEGIN weighted F1: 0.7234  0.0122
python main.py --data ltspice_examples --representation component_pin --model FEGIN --layers 2 --hiddens 128 --batch_size 64 --lr 0.01 --emb_size 512 --epochs 100 --save_appendix component_pin_L2_H128_BS64_LR0.01_E512 --no_val
-----



STDERR:
  File "main.py", line 370, in <module>
    main()
  File "main.py", line 254, in main
    dataset = dataset_class(
  File "/home/philip/projects/ltspice_examples_code_repo/Circuit-Completion-Using-GNNs/component_classification_with_link_prediction_head/evaluation/FEGIN/kernel/circuit_datasets.py", line 15, in __init__
    self.data, self.slices = torch.load(self.processed_paths[0])
  File "/home/philip/.local/lib/python3.8/site-packages/torch/serialization.py", line 1040, in load
    warnings.warn(
  File "/usr/lib/python3.8/warnings.py", line 109, in _showwarnmsg
    sw(msg.message, msg.category, msg.filename, msg.lineno,
  File "main.py", line 47, in warn_with_traceback
    traceback.print_stack(file=log)
/home/philip/projects/ltspice_examples_code_repo/Circuit-Completion-Using-GNNs/component_classification_with_link_prediction_head/evaluation/FEGIN/kernel/circuit_datasets.py:15: FutureWarning: You are using `torch.load` with `weights_only=False` (the current default value), which uses the default pickle module implicitly. It is possible to construct malicious pickle data which will execute arbitrary code during unpickling (See https://github.com/pytorch/pytorch/blob/main/SECURITY.md#untrusted-models for more details). In a future release, the default value for `weights_only` will be flipped to `True`. This limits the functions that could be executed during unpickling. Arbitrary objects will no longer be allowed to be loaded via this mode unless they are explicitly allowlisted by the user via `torch.serialization.add_safe_globals`. We recommend you start setting `weights_only=True` for any use case where you don't have full control of the loaded file. Please open an issue on GitHub for any issues related to this experimental feature.
  self.data, self.slices = torch.load(self.processed_paths[0])
