STDOUT:
Results will be saved in /home/philip/projects/ltspice_examples_code_repo/Circuit-Completion-Using-GNNs/component_classification_with_link_prediction_head/evaluation/FEGIN/results/model_FEGIN_dataset_ltspice_examples
Command line input: python main.py --data ltspice_examples --representation component_pin_net --model FEGIN --layers 4 --hiddens 32 --batch_size 64 --lr 0.001 --emb_size 512 --epochs 100 --save_appendix component_pin_net_L4_H32_BS64_LR0.001_E512 --no_val
 is saved.
-----
ltspice_examples - FEGIN
Using 4 layers, 32 hidden units, h = 2
Loading component_pin_net representation dataset
ENTERED
Training FEGIN on component_pin_net representation
Train: 3558, Test: 846
##################ITERATION #0 ****************************************
 epoch: 0, train_loss: 1.2579, test_loss: 1.0867, test_f1: 0.3685
 epoch: 1, train_loss: 1.0637, test_loss: 1.0609, test_f1: 0.3563
 epoch: 2, train_loss: 1.0310, test_loss: 1.0304, test_f1: 0.4167
 epoch: 3, train_loss: 1.0168, test_loss: 1.0273, test_f1: 0.4221
 epoch: 4, train_loss: 0.9883, test_loss: 0.9960, test_f1: 0.4124
 epoch: 5, train_loss: 0.9790, test_loss: 0.9919, test_f1: 0.4918
 epoch: 6, train_loss: 0.9680, test_loss: 0.9827, test_f1: 0.4843
 epoch: 7, train_loss: 0.9546, test_loss: 1.0123, test_f1: 0.4605
 epoch: 8, train_loss: 0.9416, test_loss: 0.9640, test_f1: 0.5112
 epoch: 9, train_loss: 0.9207, test_loss: 0.9213, test_f1: 0.5165
 epoch: 10, train_loss: 0.9095, test_loss: 0.9009, test_f1: 0.5133
 epoch: 11, train_loss: 0.8998, test_loss: 0.9628, test_f1: 0.5100
 epoch: 12, train_loss: 0.8975, test_loss: 0.9239, test_f1: 0.4927
 epoch: 13, train_loss: 0.8835, test_loss: 0.9453, test_f1: 0.5323
 epoch: 14, train_loss: 0.8682, test_loss: 0.8976, test_f1: 0.5436
 epoch: 15, train_loss: 0.8626, test_loss: 0.8642, test_f1: 0.5445
 epoch: 16, train_loss: 0.8459, test_loss: 0.8360, test_f1: 0.5875
 epoch: 17, train_loss: 0.8393, test_loss: 0.9123, test_f1: 0.5090
 epoch: 18, train_loss: 0.8343, test_loss: 0.8390, test_f1: 0.5569
 epoch: 19, train_loss: 0.8146, test_loss: 0.8327, test_f1: 0.5422
 epoch: 20, train_loss: 0.8065, test_loss: 0.8840, test_f1: 0.5750
 epoch: 21, train_loss: 0.8112, test_loss: 0.9327, test_f1: 0.4957
 epoch: 22, train_loss: 0.8096, test_loss: 0.9171, test_f1: 0.5069
 epoch: 23, train_loss: 0.7959, test_loss: 0.8401, test_f1: 0.5343
 epoch: 24, train_loss: 0.7994, test_loss: 0.8263, test_f1: 0.5669
 epoch: 25, train_loss: 0.7805, test_loss: 0.9496, test_f1: 0.5308
 epoch: 26, train_loss: 0.7910, test_loss: 0.8969, test_f1: 0.5388
 epoch: 27, train_loss: 0.7866, test_loss: 0.8188, test_f1: 0.5735
 epoch: 28, train_loss: 0.7660, test_loss: 0.8856, test_f1: 0.5340
 epoch: 29, train_loss: 0.7697, test_loss: 0.8574, test_f1: 0.5536
 epoch: 30, train_loss: 0.7511, test_loss: 0.8428, test_f1: 0.5595
 epoch: 31, train_loss: 0.7585, test_loss: 0.8456, test_f1: 0.5683
 epoch: 32, train_loss: 0.7396, test_loss: 0.8568, test_f1: 0.5809
 epoch: 33, train_loss: 0.7429, test_loss: 0.9319, test_f1: 0.5761
 epoch: 34, train_loss: 0.7362, test_loss: 0.8539, test_f1: 0.5804
 epoch: 35, train_loss: 0.7422, test_loss: 0.8425, test_f1: 0.5635
 epoch: 36, train_loss: 0.7427, test_loss: 0.8009, test_f1: 0.5892
 epoch: 37, train_loss: 0.7198, test_loss: 0.8148, test_f1: 0.6020
 epoch: 38, train_loss: 0.7079, test_loss: 0.8410, test_f1: 0.6069
 epoch: 39, train_loss: 0.7089, test_loss: 0.8231, test_f1: 0.5871
 epoch: 40, train_loss: 0.7105, test_loss: 0.8083, test_f1: 0.6189
 epoch: 41, train_loss: 0.7069, test_loss: 0.8089, test_f1: 0.5857
 epoch: 42, train_loss: 0.6983, test_loss: 0.8452, test_f1: 0.6271
 epoch: 43, train_loss: 0.7207, test_loss: 0.9688, test_f1: 0.5552
 epoch: 44, train_loss: 0.7215, test_loss: 0.8324, test_f1: 0.5750
 epoch: 45, train_loss: 0.6953, test_loss: 0.7711, test_f1: 0.6253
 epoch: 46, train_loss: 0.6851, test_loss: 0.7869, test_f1: 0.6079
 epoch: 47, train_loss: 0.6751, test_loss: 0.8302, test_f1: 0.6134
 epoch: 48, train_loss: 0.6792, test_loss: 0.9027, test_f1: 0.5702
 epoch: 49, train_loss: 0.6945, test_loss: 0.8615, test_f1: 0.6096
 epoch: 50, train_loss: 0.6727, test_loss: 0.7881, test_f1: 0.6181
 epoch: 51, train_loss: 0.6577, test_loss: 0.7784, test_f1: 0.6431
 epoch: 52, train_loss: 0.6317, test_loss: 0.7809, test_f1: 0.6337
 epoch: 53, train_loss: 0.6340, test_loss: 0.7589, test_f1: 0.6436
 epoch: 54, train_loss: 0.6255, test_loss: 0.7818, test_f1: 0.6228
 epoch: 55, train_loss: 0.6237, test_loss: 0.8924, test_f1: 0.6141
 epoch: 56, train_loss: 0.6227, test_loss: 0.7906, test_f1: 0.6331
 epoch: 57, train_loss: 0.6131, test_loss: 0.8506, test_f1: 0.6402
 epoch: 58, train_loss: 0.6147, test_loss: 0.8448, test_f1: 0.6242
 epoch: 59, train_loss: 0.6077, test_loss: 0.7950, test_f1: 0.6446
 epoch: 60, train_loss: 0.6181, test_loss: 0.7895, test_f1: 0.6380
 epoch: 61, train_loss: 0.6004, test_loss: 0.8303, test_f1: 0.6310
 epoch: 62, train_loss: 0.5884, test_loss: 0.7925, test_f1: 0.6452
 epoch: 63, train_loss: 0.5846, test_loss: 0.8799, test_f1: 0.6402
 epoch: 64, train_loss: 0.6140, test_loss: 0.8176, test_f1: 0.6221
 epoch: 65, train_loss: 0.6064, test_loss: 0.8348, test_f1: 0.6487
 epoch: 66, train_loss: 0.5846, test_loss: 0.8429, test_f1: 0.6298
 epoch: 67, train_loss: 0.5978, test_loss: 0.8143, test_f1: 0.6372
 epoch: 68, train_loss: 0.5836, test_loss: 0.8538, test_f1: 0.6144
 epoch: 69, train_loss: 0.5903, test_loss: 0.8503, test_f1: 0.6371
 epoch: 70, train_loss: 0.5767, test_loss: 0.8552, test_f1: 0.6280
 epoch: 71, train_loss: 0.5732, test_loss: 0.8433, test_f1: 0.6644
 epoch: 72, train_loss: 0.5871, test_loss: 0.8570, test_f1: 0.6365
 epoch: 73, train_loss: 0.5736, test_loss: 0.8464, test_f1: 0.6263
 epoch: 74, train_loss: 0.5720, test_loss: 0.8488, test_f1: 0.6393
 epoch: 75, train_loss: 0.5717, test_loss: 0.9110, test_f1: 0.6291
 epoch: 76, train_loss: 0.5678, test_loss: 0.8327, test_f1: 0.6542
 epoch: 77, train_loss: 0.5565, test_loss: 0.8531, test_f1: 0.6414
 epoch: 78, train_loss: 0.5669, test_loss: 0.8765, test_f1: 0.6575
 epoch: 79, train_loss: 0.5459, test_loss: 0.8727, test_f1: 0.6405
 epoch: 80, train_loss: 0.5471, test_loss: 0.8805, test_f1: 0.6370
 epoch: 81, train_loss: 0.5547, test_loss: 0.8716, test_f1: 0.6408
 epoch: 82, train_loss: 0.5514, test_loss: 0.8853, test_f1: 0.6365
 epoch: 83, train_loss: 0.5430, test_loss: 0.8641, test_f1: 0.6511
 epoch: 84, train_loss: 0.5451, test_loss: 0.8466, test_f1: 0.6480
 epoch: 85, train_loss: 0.5298, test_loss: 0.8489, test_f1: 0.6617
 epoch: 86, train_loss: 0.5343, test_loss: 0.9546, test_f1: 0.6303
 epoch: 87, train_loss: 0.5425, test_loss: 0.9396, test_f1: 0.6217
 epoch: 88, train_loss: 0.5380, test_loss: 0.8531, test_f1: 0.6392
 epoch: 89, train_loss: 0.5340, test_loss: 0.8499, test_f1: 0.6515
 epoch: 90, train_loss: 0.5292, test_loss: 0.8910, test_f1: 0.6405
 epoch: 91, train_loss: 0.5264, test_loss: 0.9037, test_f1: 0.6614
 epoch: 92, train_loss: 0.5414, test_loss: 0.9236, test_f1: 0.6335
 epoch: 93, train_loss: 0.5180, test_loss: 0.9470, test_f1: 0.6291
 epoch: 94, train_loss: 0.5273, test_loss: 1.0186, test_f1: 0.6273
 epoch: 95, train_loss: 0.5304, test_loss: 0.9475, test_f1: 0.6347
 epoch: 96, train_loss: 0.5128, test_loss: 0.9496, test_f1: 0.6504
 epoch: 97, train_loss: 0.5109, test_loss: 0.9997, test_f1: 0.6320
 epoch: 98, train_loss: 0.5116, test_loss: 0.9774, test_f1: 0.6484
 epoch: 99, train_loss: 0.5093, test_loss: 0.9386, test_f1: 0.6502
##################ITERATION #1 ****************************************
 epoch: 0, train_loss: 1.1189, test_loss: 1.0917, test_f1: 0.3947
 epoch: 1, train_loss: 0.9939, test_loss: 0.9900, test_f1: 0.4689
 epoch: 2, train_loss: 0.9682, test_loss: 0.9398, test_f1: 0.5133
 epoch: 3, train_loss: 0.9490, test_loss: 0.9317, test_f1: 0.4936
 epoch: 4, train_loss: 0.9265, test_loss: 0.9459, test_f1: 0.5150
 epoch: 5, train_loss: 0.9227, test_loss: 0.9239, test_f1: 0.5136
 epoch: 6, train_loss: 0.9039, test_loss: 0.8841, test_f1: 0.5379
 epoch: 7, train_loss: 0.8842, test_loss: 0.8758, test_f1: 0.5295
 epoch: 8, train_loss: 0.8830, test_loss: 0.8758, test_f1: 0.5468
 epoch: 9, train_loss: 0.8710, test_loss: 0.8642, test_f1: 0.5493
 epoch: 10, train_loss: 0.8573, test_loss: 0.8812, test_f1: 0.5534
 epoch: 11, train_loss: 0.8500, test_loss: 0.8589, test_f1: 0.5382
 epoch: 12, train_loss: 0.8272, test_loss: 0.8920, test_f1: 0.5668
 epoch: 13, train_loss: 0.8255, test_loss: 0.8554, test_f1: 0.5485
 epoch: 14, train_loss: 0.8139, test_loss: 0.8676, test_f1: 0.5594
 epoch: 15, train_loss: 0.8041, test_loss: 0.8413, test_f1: 0.5664
 epoch: 16, train_loss: 0.8014, test_loss: 0.8574, test_f1: 0.5748
 epoch: 17, train_loss: 0.7937, test_loss: 0.8486, test_f1: 0.5818
 epoch: 18, train_loss: 0.7806, test_loss: 0.8525, test_f1: 0.5806
 epoch: 19, train_loss: 0.7735, test_loss: 0.8592, test_f1: 0.5714
 epoch: 20, train_loss: 0.7721, test_loss: 0.8309, test_f1: 0.5653
 epoch: 21, train_loss: 0.7627, test_loss: 0.8188, test_f1: 0.6053
 epoch: 22, train_loss: 0.7566, test_loss: 0.7628, test_f1: 0.6167
 epoch: 23, train_loss: 0.7503, test_loss: 0.8198, test_f1: 0.6189
 epoch: 24, train_loss: 0.7580, test_loss: 0.8287, test_f1: 0.6215
 epoch: 25, train_loss: 0.7431, test_loss: 0.7843, test_f1: 0.5837
 epoch: 26, train_loss: 0.7295, test_loss: 0.8220, test_f1: 0.6155
 epoch: 27, train_loss: 0.7159, test_loss: 0.8017, test_f1: 0.5863
 epoch: 28, train_loss: 0.7250, test_loss: 0.7685, test_f1: 0.6287
 epoch: 29, train_loss: 0.7175, test_loss: 0.8563, test_f1: 0.6006
 epoch: 30, train_loss: 0.7085, test_loss: 0.8536, test_f1: 0.6136
 epoch: 31, train_loss: 0.6929, test_loss: 0.8385, test_f1: 0.6043
 epoch: 32, train_loss: 0.6946, test_loss: 0.7903, test_f1: 0.6125
 epoch: 33, train_loss: 0.6740, test_loss: 0.8096, test_f1: 0.6255
 epoch: 34, train_loss: 0.6810, test_loss: 0.8324, test_f1: 0.6272
 epoch: 35, train_loss: 0.6920, test_loss: 0.8253, test_f1: 0.6098
 epoch: 36, train_loss: 0.7006, test_loss: 0.8014, test_f1: 0.6526
 epoch: 37, train_loss: 0.6632, test_loss: 0.8112, test_f1: 0.6265
 epoch: 38, train_loss: 0.6715, test_loss: 0.8309, test_f1: 0.6229
 epoch: 39, train_loss: 0.6739, test_loss: 0.7602, test_f1: 0.6712
 epoch: 40, train_loss: 0.6516, test_loss: 0.8988, test_f1: 0.6322
 epoch: 41, train_loss: 0.6535, test_loss: 0.7998, test_f1: 0.6330
 epoch: 42, train_loss: 0.6514, test_loss: 0.8373, test_f1: 0.6380
 epoch: 43, train_loss: 0.6548, test_loss: 0.8788, test_f1: 0.6644
 epoch: 44, train_loss: 0.6403, test_loss: 0.8204, test_f1: 0.6251
 epoch: 45, train_loss: 0.6389, test_loss: 0.8749, test_f1: 0.6220
 epoch: 46, train_loss: 0.6332, test_loss: 0.8556, test_f1: 0.6358
 epoch: 47, train_loss: 0.6175, test_loss: 0.8456, test_f1: 0.6611
 epoch: 48, train_loss: 0.6360, test_loss: 0.9254, test_f1: 0.6275
 epoch: 49, train_loss: 0.6193, test_loss: 0.9034, test_f1: 0.6401
 epoch: 50, train_loss: 0.6055, test_loss: 0.8367, test_f1: 0.6199
 epoch: 51, train_loss: 0.6035, test_loss: 0.8606, test_f1: 0.6391
 epoch: 52, train_loss: 0.5825, test_loss: 0.9104, test_f1: 0.6353
 epoch: 53, train_loss: 0.5632, test_loss: 0.9213, test_f1: 0.6510
 epoch: 54, train_loss: 0.5710, test_loss: 1.0150, test_f1: 0.6170
 epoch: 55, train_loss: 0.5762, test_loss: 0.9678, test_f1: 0.6499
 epoch: 56, train_loss: 0.5804, test_loss: 0.9033, test_f1: 0.6324
 epoch: 57, train_loss: 0.5654, test_loss: 0.9152, test_f1: 0.6512
 epoch: 58, train_loss: 0.5580, test_loss: 0.9779, test_f1: 0.6375
 epoch: 59, train_loss: 0.5694, test_loss: 1.0066, test_f1: 0.6070
 epoch: 60, train_loss: 0.5627, test_loss: 0.9356, test_f1: 0.6495
 epoch: 61, train_loss: 0.5534, test_loss: 0.9621, test_f1: 0.6213
 epoch: 62, train_loss: 0.5503, test_loss: 0.9946, test_f1: 0.6177
 epoch: 63, train_loss: 0.5465, test_loss: 0.9960, test_f1: 0.6363
 epoch: 64, train_loss: 0.5415, test_loss: 1.0184, test_f1: 0.6091
 epoch: 65, train_loss: 0.5499, test_loss: 1.0413, test_f1: 0.6182
 epoch: 66, train_loss: 0.5318, test_loss: 0.9703, test_f1: 0.6548
 epoch: 67, train_loss: 0.5367, test_loss: 0.9013, test_f1: 0.6330
 epoch: 68, train_loss: 0.5337, test_loss: 1.0487, test_f1: 0.6031
 epoch: 69, train_loss: 0.5378, test_loss: 0.9486, test_f1: 0.6391
 epoch: 70, train_loss: 0.5294, test_loss: 1.0158, test_f1: 0.6159
 epoch: 71, train_loss: 0.5214, test_loss: 0.9911, test_f1: 0.6012
 epoch: 72, train_loss: 0.5256, test_loss: 1.0249, test_f1: 0.6021
 epoch: 73, train_loss: 0.5359, test_loss: 1.1071, test_f1: 0.6281
 epoch: 74, train_loss: 0.5276, test_loss: 0.9643, test_f1: 0.6182
 epoch: 75, train_loss: 0.4948, test_loss: 0.9965, test_f1: 0.6230
 epoch: 76, train_loss: 0.5175, test_loss: 1.1144, test_f1: 0.6168
 epoch: 77, train_loss: 0.5157, test_loss: 1.1331, test_f1: 0.5989
 epoch: 78, train_loss: 0.5121, test_loss: 1.0540, test_f1: 0.6085
 epoch: 79, train_loss: 0.5081, test_loss: 1.0939, test_f1: 0.6112
 epoch: 80, train_loss: 0.4941, test_loss: 1.1737, test_f1: 0.6018
 epoch: 81, train_loss: 0.5047, test_loss: 1.0987, test_f1: 0.6170
 epoch: 82, train_loss: 0.4979, test_loss: 1.2092, test_f1: 0.6200
 epoch: 83, train_loss: 0.5114, test_loss: 1.1593, test_f1: 0.6155
 epoch: 84, train_loss: 0.4832, test_loss: 1.1535, test_f1: 0.6253
 epoch: 85, train_loss: 0.4906, test_loss: 1.2555, test_f1: 0.6061
 epoch: 86, train_loss: 0.4926, test_loss: 1.1788, test_f1: 0.6104
 epoch: 87, train_loss: 0.5000, test_loss: 1.1240, test_f1: 0.6040
 epoch: 88, train_loss: 0.4916, test_loss: 1.1765, test_f1: 0.6082
 epoch: 89, train_loss: 0.5095, test_loss: 1.2535, test_f1: 0.6156
 epoch: 90, train_loss: 0.4958, test_loss: 1.2135, test_f1: 0.6233
 epoch: 91, train_loss: 0.4832, test_loss: 1.1969, test_f1: 0.6342
 epoch: 92, train_loss: 0.4894, test_loss: 1.1479, test_f1: 0.6138
 epoch: 93, train_loss: 0.4791, test_loss: 1.3073, test_f1: 0.5974
 epoch: 94, train_loss: 0.4768, test_loss: 1.3052, test_f1: 0.6123
 epoch: 95, train_loss: 0.4794, test_loss: 1.2097, test_f1: 0.6284
 epoch: 96, train_loss: 0.4866, test_loss: 1.2743, test_f1: 0.5946
 epoch: 97, train_loss: 0.4688, test_loss: 1.2820, test_f1: 0.6174
 epoch: 98, train_loss: 0.4710, test_loss: 1.2631, test_f1: 0.6125
 epoch: 99, train_loss: 0.4665, test_loss: 1.3658, test_f1: 0.6181
##################ITERATION #2 ****************************************
 epoch: 0, train_loss: 1.1209, test_loss: 1.0364, test_f1: 0.3910
 epoch: 1, train_loss: 0.9980, test_loss: 0.9848, test_f1: 0.4878
 epoch: 2, train_loss: 0.9720, test_loss: 0.9400, test_f1: 0.4929
 epoch: 3, train_loss: 0.9464, test_loss: 0.9342, test_f1: 0.5096
 epoch: 4, train_loss: 0.9278, test_loss: 0.9181, test_f1: 0.5231
 epoch: 5, train_loss: 0.9133, test_loss: 0.8966, test_f1: 0.5136
 epoch: 6, train_loss: 0.9050, test_loss: 0.8937, test_f1: 0.5158
 epoch: 7, train_loss: 0.8898, test_loss: 0.9301, test_f1: 0.5116
 epoch: 8, train_loss: 0.8785, test_loss: 0.9196, test_f1: 0.5270
 epoch: 9, train_loss: 0.8688, test_loss: 0.8957, test_f1: 0.5552
 epoch: 10, train_loss: 0.8657, test_loss: 0.8458, test_f1: 0.5835
 epoch: 11, train_loss: 0.8401, test_loss: 0.9033, test_f1: 0.5219
 epoch: 12, train_loss: 0.8554, test_loss: 0.8250, test_f1: 0.5541
 epoch: 13, train_loss: 0.8365, test_loss: 0.8723, test_f1: 0.5472
 epoch: 14, train_loss: 0.8224, test_loss: 0.8827, test_f1: 0.5810
 epoch: 15, train_loss: 0.8195, test_loss: 0.8422, test_f1: 0.5966
 epoch: 16, train_loss: 0.8047, test_loss: 0.8695, test_f1: 0.5966
 epoch: 17, train_loss: 0.7901, test_loss: 0.8704, test_f1: 0.5935
 epoch: 18, train_loss: 0.7893, test_loss: 0.9348, test_f1: 0.5861
 epoch: 19, train_loss: 0.7781, test_loss: 0.8566, test_f1: 0.5737
 epoch: 20, train_loss: 0.7716, test_loss: 0.7990, test_f1: 0.6079
 epoch: 21, train_loss: 0.7668, test_loss: 0.8384, test_f1: 0.6003
 epoch: 22, train_loss: 0.7645, test_loss: 0.9352, test_f1: 0.6337
 epoch: 23, train_loss: 0.7506, test_loss: 0.8583, test_f1: 0.6045
 epoch: 24, train_loss: 0.7420, test_loss: 0.8344, test_f1: 0.6365
 epoch: 25, train_loss: 0.7451, test_loss: 0.8589, test_f1: 0.6327
 epoch: 26, train_loss: 0.7375, test_loss: 0.8688, test_f1: 0.5937
 epoch: 27, train_loss: 0.7226, test_loss: 0.8130, test_f1: 0.6183
 epoch: 28, train_loss: 0.7100, test_loss: 0.7808, test_f1: 0.6204
 epoch: 29, train_loss: 0.7069, test_loss: 0.7948, test_f1: 0.6008
 epoch: 30, train_loss: 0.6908, test_loss: 0.7971, test_f1: 0.6490
 epoch: 31, train_loss: 0.7062, test_loss: 0.7741, test_f1: 0.6060
 epoch: 32, train_loss: 0.6999, test_loss: 0.8064, test_f1: 0.5948
 epoch: 33, train_loss: 0.6970, test_loss: 0.7369, test_f1: 0.6585
 epoch: 34, train_loss: 0.6771, test_loss: 0.8514, test_f1: 0.6320
 epoch: 35, train_loss: 0.6694, test_loss: 0.8503, test_f1: 0.6531
 epoch: 36, train_loss: 0.6732, test_loss: 0.8126, test_f1: 0.6168
 epoch: 37, train_loss: 0.6655, test_loss: 0.7491, test_f1: 0.6277
 epoch: 38, train_loss: 0.6496, test_loss: 0.8288, test_f1: 0.6402
 epoch: 39, train_loss: 0.6572, test_loss: 0.8195, test_f1: 0.6109
 epoch: 40, train_loss: 0.6281, test_loss: 0.8219, test_f1: 0.6544
 epoch: 41, train_loss: 0.6451, test_loss: 0.8087, test_f1: 0.6191
 epoch: 42, train_loss: 0.6507, test_loss: 0.7728, test_f1: 0.6512
 epoch: 43, train_loss: 0.6347, test_loss: 0.8418, test_f1: 0.6393
 epoch: 44, train_loss: 0.6361, test_loss: 0.8967, test_f1: 0.6342
 epoch: 45, train_loss: 0.6269, test_loss: 0.7899, test_f1: 0.6502
 epoch: 46, train_loss: 0.6236, test_loss: 0.8916, test_f1: 0.6618
 epoch: 47, train_loss: 0.6185, test_loss: 0.7358, test_f1: 0.6549
 epoch: 48, train_loss: 0.6188, test_loss: 0.8513, test_f1: 0.6372
 epoch: 49, train_loss: 0.6177, test_loss: 0.8399, test_f1: 0.6462
 epoch: 50, train_loss: 0.6155, test_loss: 0.7821, test_f1: 0.6462
 epoch: 51, train_loss: 0.5927, test_loss: 0.7881, test_f1: 0.6555
 epoch: 52, train_loss: 0.5658, test_loss: 0.7532, test_f1: 0.6767
 epoch: 53, train_loss: 0.5656, test_loss: 0.8720, test_f1: 0.6482
 epoch: 54, train_loss: 0.5778, test_loss: 0.8437, test_f1: 0.6464
 epoch: 55, train_loss: 0.5719, test_loss: 0.8069, test_f1: 0.6695
 epoch: 56, train_loss: 0.5621, test_loss: 0.7362, test_f1: 0.6803
 epoch: 57, train_loss: 0.5494, test_loss: 0.7934, test_f1: 0.6565
 epoch: 58, train_loss: 0.5434, test_loss: 0.8623, test_f1: 0.6573
 epoch: 59, train_loss: 0.5534, test_loss: 0.9236, test_f1: 0.6350
 epoch: 60, train_loss: 0.5410, test_loss: 0.8945, test_f1: 0.6411
 epoch: 61, train_loss: 0.5251, test_loss: 0.9038, test_f1: 0.6528
 epoch: 62, train_loss: 0.5338, test_loss: 0.9344, test_f1: 0.6509
 epoch: 63, train_loss: 0.5403, test_loss: 0.9084, test_f1: 0.6535
 epoch: 64, train_loss: 0.5324, test_loss: 0.9225, test_f1: 0.6510
 epoch: 65, train_loss: 0.5298, test_loss: 0.8889, test_f1: 0.6521
 epoch: 66, train_loss: 0.5255, test_loss: 0.9333, test_f1: 0.6478
 epoch: 67, train_loss: 0.5215, test_loss: 0.8724, test_f1: 0.6660
 epoch: 68, train_loss: 0.5178, test_loss: 0.9531, test_f1: 0.6456
 epoch: 69, train_loss: 0.5264, test_loss: 0.9102, test_f1: 0.6437
 epoch: 70, train_loss: 0.5390, test_loss: 0.8413, test_f1: 0.6629
 epoch: 71, train_loss: 0.5194, test_loss: 0.9191, test_f1: 0.6739
 epoch: 72, train_loss: 0.5166, test_loss: 0.8728, test_f1: 0.6798
 epoch: 73, train_loss: 0.5281, test_loss: 0.8721, test_f1: 0.6565
 epoch: 74, train_loss: 0.5046, test_loss: 0.9586, test_f1: 0.6575
 epoch: 75, train_loss: 0.5070, test_loss: 0.9282, test_f1: 0.6692
 epoch: 76, train_loss: 0.5178, test_loss: 1.0128, test_f1: 0.6455
 epoch: 77, train_loss: 0.5134, test_loss: 0.9099, test_f1: 0.6567
 epoch: 78, train_loss: 0.5003, test_loss: 0.9822, test_f1: 0.6481
 epoch: 79, train_loss: 0.4982, test_loss: 0.9377, test_f1: 0.6413
 epoch: 80, train_loss: 0.4929, test_loss: 0.9731, test_f1: 0.6440
 epoch: 81, train_loss: 0.4978, test_loss: 1.0075, test_f1: 0.6491
 epoch: 82, train_loss: 0.4772, test_loss: 1.0205, test_f1: 0.6367
 epoch: 83, train_loss: 0.4847, test_loss: 1.0230, test_f1: 0.6504
 epoch: 84, train_loss: 0.4764, test_loss: 0.9744, test_f1: 0.6681
 epoch: 85, train_loss: 0.5020, test_loss: 1.0873, test_f1: 0.6458
 epoch: 86, train_loss: 0.4911, test_loss: 0.9849, test_f1: 0.6612
 epoch: 87, train_loss: 0.4896, test_loss: 0.9458, test_f1: 0.6557
 epoch: 88, train_loss: 0.4864, test_loss: 0.9971, test_f1: 0.6480
 epoch: 89, train_loss: 0.4738, test_loss: 1.0647, test_f1: 0.6375
 epoch: 90, train_loss: 0.4875, test_loss: 0.9955, test_f1: 0.6705
 epoch: 91, train_loss: 0.4786, test_loss: 0.9847, test_f1: 0.6433
 epoch: 92, train_loss: 0.4729, test_loss: 1.0365, test_f1: 0.6719
 epoch: 93, train_loss: 0.4736, test_loss: 0.9874, test_f1: 0.6587
 epoch: 94, train_loss: 0.4689, test_loss: 0.9556, test_f1: 0.6625
 epoch: 95, train_loss: 0.4697, test_loss: 0.9994, test_f1: 0.6454
 epoch: 96, train_loss: 0.4525, test_loss: 1.0438, test_f1: 0.6506
 epoch: 97, train_loss: 0.4734, test_loss: 1.0459, test_f1: 0.6477
 epoch: 98, train_loss: 0.4599, test_loss: 1.0365, test_f1: 0.6585
 epoch: 99, train_loss: 0.4612, test_loss: 1.2421, test_f1: 0.6327
##################ITERATION #3 ****************************************
 epoch: 0, train_loss: 1.1570, test_loss: 1.2531, test_f1: 0.2302
 epoch: 1, train_loss: 1.0059, test_loss: 0.9820, test_f1: 0.5002
 epoch: 2, train_loss: 0.9763, test_loss: 0.9497, test_f1: 0.5032
 epoch: 3, train_loss: 0.9543, test_loss: 0.9753, test_f1: 0.4955
 epoch: 4, train_loss: 0.9369, test_loss: 0.9324, test_f1: 0.5070
 epoch: 5, train_loss: 0.9194, test_loss: 0.9370, test_f1: 0.5226
 epoch: 6, train_loss: 0.8965, test_loss: 0.9173, test_f1: 0.5365
 epoch: 7, train_loss: 0.8799, test_loss: 0.9121, test_f1: 0.5574
 epoch: 8, train_loss: 0.8660, test_loss: 0.8596, test_f1: 0.5715
 epoch: 9, train_loss: 0.8601, test_loss: 0.8770, test_f1: 0.5915
 epoch: 10, train_loss: 0.8469, test_loss: 0.8477, test_f1: 0.6018
 epoch: 11, train_loss: 0.8311, test_loss: 0.9073, test_f1: 0.5693
 epoch: 12, train_loss: 0.8071, test_loss: 0.8351, test_f1: 0.5721
 epoch: 13, train_loss: 0.8059, test_loss: 0.9218, test_f1: 0.5619
 epoch: 14, train_loss: 0.7832, test_loss: 0.9456, test_f1: 0.5939
 epoch: 15, train_loss: 0.7761, test_loss: 0.8951, test_f1: 0.6004
 epoch: 16, train_loss: 0.7653, test_loss: 0.8475, test_f1: 0.5781
 epoch: 17, train_loss: 0.7644, test_loss: 0.9177, test_f1: 0.5744
 epoch: 18, train_loss: 0.7497, test_loss: 0.8740, test_f1: 0.6024
 epoch: 19, train_loss: 0.7257, test_loss: 0.8102, test_f1: 0.5900
 epoch: 20, train_loss: 0.7296, test_loss: 0.8421, test_f1: 0.5885
 epoch: 21, train_loss: 0.7397, test_loss: 0.8134, test_f1: 0.6133
 epoch: 22, train_loss: 0.7300, test_loss: 0.8215, test_f1: 0.6473
 epoch: 23, train_loss: 0.7207, test_loss: 0.8895, test_f1: 0.6020
 epoch: 24, train_loss: 0.7089, test_loss: 0.8200, test_f1: 0.6082
 epoch: 25, train_loss: 0.6946, test_loss: 0.9749, test_f1: 0.5732
 epoch: 26, train_loss: 0.7176, test_loss: 0.8904, test_f1: 0.6342
 epoch: 27, train_loss: 0.6893, test_loss: 0.8586, test_f1: 0.5989
 epoch: 28, train_loss: 0.6826, test_loss: 0.7993, test_f1: 0.6414
 epoch: 29, train_loss: 0.6852, test_loss: 0.8315, test_f1: 0.6612
 epoch: 30, train_loss: 0.6730, test_loss: 0.8364, test_f1: 0.6312
 epoch: 31, train_loss: 0.6686, test_loss: 0.8657, test_f1: 0.6175
 epoch: 32, train_loss: 0.6696, test_loss: 0.8556, test_f1: 0.6336
 epoch: 33, train_loss: 0.6610, test_loss: 0.9318, test_f1: 0.6173
 epoch: 34, train_loss: 0.6391, test_loss: 0.9264, test_f1: 0.6182
 epoch: 35, train_loss: 0.6395, test_loss: 0.8492, test_f1: 0.6187
 epoch: 36, train_loss: 0.6461, test_loss: 0.8403, test_f1: 0.6232
 epoch: 37, train_loss: 0.6186, test_loss: 0.9066, test_f1: 0.6094
 epoch: 38, train_loss: 0.6234, test_loss: 0.8406, test_f1: 0.6409
 epoch: 39, train_loss: 0.6247, test_loss: 0.8301, test_f1: 0.6289
 epoch: 40, train_loss: 0.6165, test_loss: 0.8916, test_f1: 0.6357
 epoch: 41, train_loss: 0.5967, test_loss: 0.9364, test_f1: 0.6477
 epoch: 42, train_loss: 0.6002, test_loss: 0.8648, test_f1: 0.6243
 epoch: 43, train_loss: 0.6083, test_loss: 0.8266, test_f1: 0.6407
 epoch: 44, train_loss: 0.5894, test_loss: 0.9409, test_f1: 0.6178
 epoch: 45, train_loss: 0.6049, test_loss: 0.8561, test_f1: 0.6625
 epoch: 46, train_loss: 0.5857, test_loss: 0.9018, test_f1: 0.6390
 epoch: 47, train_loss: 0.5921, test_loss: 0.8377, test_f1: 0.6513
 epoch: 48, train_loss: 0.5938, test_loss: 0.9204, test_f1: 0.6324
 epoch: 49, train_loss: 0.5791, test_loss: 0.9038, test_f1: 0.6376
 epoch: 50, train_loss: 0.5607, test_loss: 0.9317, test_f1: 0.6489
 epoch: 51, train_loss: 0.5501, test_loss: 0.9221, test_f1: 0.6330
 epoch: 52, train_loss: 0.5387, test_loss: 0.9302, test_f1: 0.6390
 epoch: 53, train_loss: 0.5219, test_loss: 0.8923, test_f1: 0.6422
 epoch: 54, train_loss: 0.5187, test_loss: 0.9854, test_f1: 0.6231
 epoch: 55, train_loss: 0.5269, test_loss: 0.9063, test_f1: 0.6359
 epoch: 56, train_loss: 0.5298, test_loss: 0.9214, test_f1: 0.6501
 epoch: 57, train_loss: 0.5334, test_loss: 0.9961, test_f1: 0.6387
 epoch: 58, train_loss: 0.5147, test_loss: 0.9450, test_f1: 0.6316
 epoch: 59, train_loss: 0.5023, test_loss: 0.9542, test_f1: 0.6339
 epoch: 60, train_loss: 0.5068, test_loss: 0.9874, test_f1: 0.6374
 epoch: 61, train_loss: 0.5010, test_loss: 0.9945, test_f1: 0.6378
 epoch: 62, train_loss: 0.5109, test_loss: 0.9531, test_f1: 0.6294
 epoch: 63, train_loss: 0.4843, test_loss: 1.0177, test_f1: 0.6523
 epoch: 64, train_loss: 0.5050, test_loss: 0.9507, test_f1: 0.6407
 epoch: 65, train_loss: 0.4958, test_loss: 0.8976, test_f1: 0.6377
 epoch: 66, train_loss: 0.5006, test_loss: 0.9781, test_f1: 0.6425
 epoch: 67, train_loss: 0.4844, test_loss: 1.0498, test_f1: 0.6420
 epoch: 68, train_loss: 0.4766, test_loss: 1.0525, test_f1: 0.6332
 epoch: 69, train_loss: 0.4737, test_loss: 0.9354, test_f1: 0.6340
 epoch: 70, train_loss: 0.4887, test_loss: 1.0386, test_f1: 0.6328
 epoch: 71, train_loss: 0.4906, test_loss: 1.0596, test_f1: 0.6325
 epoch: 72, train_loss: 0.4787, test_loss: 1.0018, test_f1: 0.6314
 epoch: 73, train_loss: 0.4975, test_loss: 1.0021, test_f1: 0.6602
 epoch: 74, train_loss: 0.4863, test_loss: 1.0284, test_f1: 0.6304
 epoch: 75, train_loss: 0.4691, test_loss: 1.0562, test_f1: 0.6200
 epoch: 76, train_loss: 0.4650, test_loss: 1.0565, test_f1: 0.6272
 epoch: 77, train_loss: 0.4731, test_loss: 1.0931, test_f1: 0.6311
 epoch: 78, train_loss: 0.4563, test_loss: 1.0275, test_f1: 0.6283
 epoch: 79, train_loss: 0.4678, test_loss: 1.0746, test_f1: 0.6185
 epoch: 80, train_loss: 0.4761, test_loss: 1.1161, test_f1: 0.6276
 epoch: 81, train_loss: 0.4677, test_loss: 1.0802, test_f1: 0.6429
 epoch: 82, train_loss: 0.4598, test_loss: 1.0218, test_f1: 0.6454
 epoch: 83, train_loss: 0.4730, test_loss: 1.1122, test_f1: 0.6372
 epoch: 84, train_loss: 0.4689, test_loss: 1.1164, test_f1: 0.6325
 epoch: 85, train_loss: 0.4607, test_loss: 1.1152, test_f1: 0.6266
 epoch: 86, train_loss: 0.4573, test_loss: 1.0292, test_f1: 0.6479
 epoch: 87, train_loss: 0.4628, test_loss: 1.0867, test_f1: 0.6453
 epoch: 88, train_loss: 0.4532, test_loss: 1.0679, test_f1: 0.6471
 epoch: 89, train_loss: 0.4591, test_loss: 1.0344, test_f1: 0.6559
 epoch: 90, train_loss: 0.4371, test_loss: 1.1115, test_f1: 0.6503
 epoch: 91, train_loss: 0.4518, test_loss: 1.1768, test_f1: 0.6510
 epoch: 92, train_loss: 0.4467, test_loss: 1.1358, test_f1: 0.6404
 epoch: 93, train_loss: 0.4404, test_loss: 1.1406, test_f1: 0.6464
 epoch: 94, train_loss: 0.4292, test_loss: 1.2181, test_f1: 0.6389
 epoch: 95, train_loss: 0.4749, test_loss: 1.1257, test_f1: 0.6219
 epoch: 96, train_loss: 0.4437, test_loss: 1.1359, test_f1: 0.6258
 epoch: 97, train_loss: 0.4309, test_loss: 1.2197, test_f1: 0.6420
 epoch: 98, train_loss: 0.4125, test_loss: 1.1671, test_f1: 0.6448
 epoch: 99, train_loss: 0.4345, test_loss: 1.2043, test_f1: 0.6317
##################ITERATION #4 ****************************************
 epoch: 0, train_loss: 1.2193, test_loss: 1.0783, test_f1: 0.4102
 epoch: 1, train_loss: 1.0230, test_loss: 0.9430, test_f1: 0.5127
 epoch: 2, train_loss: 0.9970, test_loss: 0.9511, test_f1: 0.4939
 epoch: 3, train_loss: 0.9451, test_loss: 0.9307, test_f1: 0.5102
 epoch: 4, train_loss: 0.9480, test_loss: 0.9177, test_f1: 0.5145
 epoch: 5, train_loss: 0.9324, test_loss: 0.9157, test_f1: 0.5053
 epoch: 6, train_loss: 0.9144, test_loss: 0.9145, test_f1: 0.4783
 epoch: 7, train_loss: 0.9007, test_loss: 0.9062, test_f1: 0.5196
 epoch: 8, train_loss: 0.8870, test_loss: 0.8775, test_f1: 0.5591
 epoch: 9, train_loss: 0.8732, test_loss: 0.8868, test_f1: 0.5558
 epoch: 10, train_loss: 0.8649, test_loss: 0.8798, test_f1: 0.5723
 epoch: 11, train_loss: 0.8497, test_loss: 0.8634, test_f1: 0.6124
 epoch: 12, train_loss: 0.8340, test_loss: 0.8317, test_f1: 0.5489
 epoch: 13, train_loss: 0.8183, test_loss: 0.8956, test_f1: 0.5601
 epoch: 14, train_loss: 0.8165, test_loss: 0.8841, test_f1: 0.5663
 epoch: 15, train_loss: 0.8288, test_loss: 0.8627, test_f1: 0.5834
 epoch: 16, train_loss: 0.8070, test_loss: 0.8225, test_f1: 0.5888
 epoch: 17, train_loss: 0.7971, test_loss: 0.8508, test_f1: 0.5702
 epoch: 18, train_loss: 0.7907, test_loss: 0.8466, test_f1: 0.5831
 epoch: 19, train_loss: 0.7739, test_loss: 0.9143, test_f1: 0.5723
 epoch: 20, train_loss: 0.7762, test_loss: 0.7711, test_f1: 0.6114
 epoch: 21, train_loss: 0.7578, test_loss: 0.8681, test_f1: 0.5679
 epoch: 22, train_loss: 0.7548, test_loss: 0.8060, test_f1: 0.5928
 epoch: 23, train_loss: 0.7484, test_loss: 0.8065, test_f1: 0.5740
 epoch: 24, train_loss: 0.7363, test_loss: 0.8760, test_f1: 0.6265
 epoch: 25, train_loss: 0.7233, test_loss: 0.9524, test_f1: 0.5912
 epoch: 26, train_loss: 0.7222, test_loss: 0.8074, test_f1: 0.6134
 epoch: 27, train_loss: 0.7239, test_loss: 0.8200, test_f1: 0.5769
 epoch: 28, train_loss: 0.7113, test_loss: 0.8007, test_f1: 0.6465
 epoch: 29, train_loss: 0.6935, test_loss: 0.7403, test_f1: 0.6603
 epoch: 30, train_loss: 0.6988, test_loss: 0.8295, test_f1: 0.5613
 epoch: 31, train_loss: 0.7018, test_loss: 0.9258, test_f1: 0.5931
 epoch: 32, train_loss: 0.6998, test_loss: 0.8553, test_f1: 0.5817
 epoch: 33, train_loss: 0.6857, test_loss: 0.8008, test_f1: 0.6308
 epoch: 34, train_loss: 0.6706, test_loss: 0.7815, test_f1: 0.6475
 epoch: 35, train_loss: 0.6565, test_loss: 0.8282, test_f1: 0.6212
 epoch: 36, train_loss: 0.6993, test_loss: 0.7840, test_f1: 0.6015
 epoch: 37, train_loss: 0.6573, test_loss: 0.8180, test_f1: 0.6432
 epoch: 38, train_loss: 0.6459, test_loss: 0.8127, test_f1: 0.6050
 epoch: 39, train_loss: 0.6434, test_loss: 0.8365, test_f1: 0.6311
 epoch: 40, train_loss: 0.6524, test_loss: 0.7880, test_f1: 0.6206
 epoch: 41, train_loss: 0.6457, test_loss: 0.8200, test_f1: 0.6161
 epoch: 42, train_loss: 0.6262, test_loss: 0.8192, test_f1: 0.6452
 epoch: 43, train_loss: 0.6496, test_loss: 0.8140, test_f1: 0.6166
 epoch: 44, train_loss: 0.6229, test_loss: 0.8303, test_f1: 0.6478
 epoch: 45, train_loss: 0.6237, test_loss: 0.8691, test_f1: 0.6422
 epoch: 46, train_loss: 0.6333, test_loss: 0.8528, test_f1: 0.6159
 epoch: 47, train_loss: 0.6266, test_loss: 0.8064, test_f1: 0.6414
 epoch: 48, train_loss: 0.6014, test_loss: 0.7300, test_f1: 0.6683
 epoch: 49, train_loss: 0.6034, test_loss: 0.8148, test_f1: 0.6322
 epoch: 50, train_loss: 0.6032, test_loss: 0.8320, test_f1: 0.6423
 epoch: 51, train_loss: 0.5766, test_loss: 0.8184, test_f1: 0.6504
 epoch: 52, train_loss: 0.5669, test_loss: 0.7990, test_f1: 0.6329
 epoch: 53, train_loss: 0.5657, test_loss: 0.8263, test_f1: 0.6386
 epoch: 54, train_loss: 0.5581, test_loss: 0.8042, test_f1: 0.6415
 epoch: 55, train_loss: 0.5467, test_loss: 0.8592, test_f1: 0.6289
 epoch: 56, train_loss: 0.5465, test_loss: 0.8490, test_f1: 0.6351
 epoch: 57, train_loss: 0.5451, test_loss: 0.8285, test_f1: 0.6531
 epoch: 58, train_loss: 0.5436, test_loss: 0.8635, test_f1: 0.6349
 epoch: 59, train_loss: 0.5418, test_loss: 0.8486, test_f1: 0.6229
 epoch: 60, train_loss: 0.5400, test_loss: 0.8514, test_f1: 0.6318
 epoch: 61, train_loss: 0.5380, test_loss: 0.9314, test_f1: 0.6416
 epoch: 62, train_loss: 0.5438, test_loss: 0.8278, test_f1: 0.6463
 epoch: 63, train_loss: 0.5349, test_loss: 0.8175, test_f1: 0.6341
 epoch: 64, train_loss: 0.5505, test_loss: 0.8103, test_f1: 0.6366
 epoch: 65, train_loss: 0.5316, test_loss: 0.8899, test_f1: 0.6481
 epoch: 66, train_loss: 0.5312, test_loss: 0.9450, test_f1: 0.6073
 epoch: 67, train_loss: 0.5222, test_loss: 0.8999, test_f1: 0.6309
 epoch: 68, train_loss: 0.5304, test_loss: 0.9173, test_f1: 0.6288
 epoch: 69, train_loss: 0.5181, test_loss: 0.9031, test_f1: 0.6299
 epoch: 70, train_loss: 0.5009, test_loss: 0.9367, test_f1: 0.6397
 epoch: 71, train_loss: 0.5051, test_loss: 1.0228, test_f1: 0.6119
 epoch: 72, train_loss: 0.5024, test_loss: 0.8982, test_f1: 0.6427
 epoch: 73, train_loss: 0.5112, test_loss: 0.8509, test_f1: 0.6488
 epoch: 74, train_loss: 0.5093, test_loss: 0.9407, test_f1: 0.6412
 epoch: 75, train_loss: 0.4915, test_loss: 0.9385, test_f1: 0.6521
 epoch: 76, train_loss: 0.4974, test_loss: 1.0078, test_f1: 0.6270
 epoch: 77, train_loss: 0.5087, test_loss: 0.9721, test_f1: 0.6355
 epoch: 78, train_loss: 0.5084, test_loss: 0.9822, test_f1: 0.6164
 epoch: 79, train_loss: 0.5131, test_loss: 0.9360, test_f1: 0.6415
 epoch: 80, train_loss: 0.4873, test_loss: 0.9645, test_f1: 0.6430
 epoch: 81, train_loss: 0.4970, test_loss: 0.9595, test_f1: 0.6419
 epoch: 82, train_loss: 0.4843, test_loss: 0.9866, test_f1: 0.6485
 epoch: 83, train_loss: 0.4786, test_loss: 0.9927, test_f1: 0.6263
 epoch: 84, train_loss: 0.4804, test_loss: 1.0001, test_f1: 0.6243
 epoch: 85, train_loss: 0.4994, test_loss: 0.9738, test_f1: 0.6622
 epoch: 86, train_loss: 0.4771, test_loss: 0.9904, test_f1: 0.6477
 epoch: 87, train_loss: 0.4684, test_loss: 0.9998, test_f1: 0.6190
 epoch: 88, train_loss: 0.4684, test_loss: 1.0421, test_f1: 0.6617
 epoch: 89, train_loss: 0.4709, test_loss: 1.0955, test_f1: 0.6551
 epoch: 90, train_loss: 0.4709, test_loss: 1.0675, test_f1: 0.6481
 epoch: 91, train_loss: 0.4696, test_loss: 1.0278, test_f1: 0.6224
 epoch: 92, train_loss: 0.4767, test_loss: 1.0267, test_f1: 0.6568
 epoch: 93, train_loss: 0.4845, test_loss: 1.0723, test_f1: 0.6520
 epoch: 94, train_loss: 0.4777, test_loss: 1.1079, test_f1: 0.6290
 epoch: 95, train_loss: 0.4538, test_loss: 1.0764, test_f1: 0.6538
 epoch: 96, train_loss: 0.4520, test_loss: 0.9431, test_f1: 0.6588
 epoch: 97, train_loss: 0.4531, test_loss: 1.0914, test_f1: 0.6429
 epoch: 98, train_loss: 0.4643, test_loss: 1.0938, test_f1: 0.6563
 epoch: 99, train_loss: 0.4453, test_loss: 1.1282, test_f1: 0.6601
##################ITERATION #5 ****************************************
 epoch: 0, train_loss: 1.2936, test_loss: 1.0889, test_f1: 0.3420
 epoch: 1, train_loss: 1.0601, test_loss: 0.9815, test_f1: 0.4227
 epoch: 2, train_loss: 1.0238, test_loss: 0.9474, test_f1: 0.4796
 epoch: 3, train_loss: 0.9933, test_loss: 0.9577, test_f1: 0.4793
 epoch: 4, train_loss: 0.9836, test_loss: 0.9090, test_f1: 0.4750
 epoch: 5, train_loss: 0.9508, test_loss: 0.9044, test_f1: 0.4945
 epoch: 6, train_loss: 0.9308, test_loss: 0.9260, test_f1: 0.4905
 epoch: 7, train_loss: 0.9114, test_loss: 0.8890, test_f1: 0.5479
 epoch: 8, train_loss: 0.8862, test_loss: 0.8700, test_f1: 0.5482
 epoch: 9, train_loss: 0.8845, test_loss: 0.8573, test_f1: 0.5437
 epoch: 10, train_loss: 0.8663, test_loss: 0.8773, test_f1: 0.5366
 epoch: 11, train_loss: 0.8651, test_loss: 0.8374, test_f1: 0.5392
 epoch: 12, train_loss: 0.8465, test_loss: 0.8428, test_f1: 0.5560
 epoch: 13, train_loss: 0.8403, test_loss: 0.8546, test_f1: 0.5689
 epoch: 14, train_loss: 0.8120, test_loss: 0.8635, test_f1: 0.5499
 epoch: 15, train_loss: 0.8131, test_loss: 0.8219, test_f1: 0.5461
 epoch: 16, train_loss: 0.8107, test_loss: 0.8396, test_f1: 0.5701
 epoch: 17, train_loss: 0.7976, test_loss: 0.8296, test_f1: 0.5178
 epoch: 18, train_loss: 0.7935, test_loss: 0.7988, test_f1: 0.5898
 epoch: 19, train_loss: 0.7909, test_loss: 0.7978, test_f1: 0.5596
 epoch: 20, train_loss: 0.7699, test_loss: 0.7976, test_f1: 0.6090
 epoch: 21, train_loss: 0.7706, test_loss: 0.8125, test_f1: 0.6061
 epoch: 22, train_loss: 0.7675, test_loss: 0.8319, test_f1: 0.5702
 epoch: 23, train_loss: 0.7463, test_loss: 0.8053, test_f1: 0.6187
 epoch: 24, train_loss: 0.7323, test_loss: 0.7710, test_f1: 0.5875
 epoch: 25, train_loss: 0.7331, test_loss: 0.8386, test_f1: 0.5767
 epoch: 26, train_loss: 0.7394, test_loss: 0.7481, test_f1: 0.6236
 epoch: 27, train_loss: 0.7349, test_loss: 0.7427, test_f1: 0.6232
 epoch: 28, train_loss: 0.7162, test_loss: 0.8083, test_f1: 0.6003
 epoch: 29, train_loss: 0.6992, test_loss: 0.7569, test_f1: 0.6264
 epoch: 30, train_loss: 0.7037, test_loss: 0.7907, test_f1: 0.6278
 epoch: 31, train_loss: 0.7090, test_loss: 0.7551, test_f1: 0.6126
 epoch: 32, train_loss: 0.6881, test_loss: 0.7713, test_f1: 0.6475
 epoch: 33, train_loss: 0.6889, test_loss: 0.7349, test_f1: 0.6368
 epoch: 34, train_loss: 0.6806, test_loss: 0.7228, test_f1: 0.6456
 epoch: 35, train_loss: 0.6722, test_loss: 0.7076, test_f1: 0.6392
 epoch: 36, train_loss: 0.6744, test_loss: 0.7180, test_f1: 0.6581
 epoch: 37, train_loss: 0.6771, test_loss: 0.7654, test_f1: 0.6496
 epoch: 38, train_loss: 0.6752, test_loss: 0.7130, test_f1: 0.6508
 epoch: 39, train_loss: 0.6631, test_loss: 0.7268, test_f1: 0.6653
 epoch: 40, train_loss: 0.6527, test_loss: 0.7463, test_f1: 0.6287
 epoch: 41, train_loss: 0.6496, test_loss: 0.7148, test_f1: 0.6603
 epoch: 42, train_loss: 0.6339, test_loss: 0.8158, test_f1: 0.5937
 epoch: 43, train_loss: 0.6406, test_loss: 0.7344, test_f1: 0.6331
 epoch: 44, train_loss: 0.6265, test_loss: 0.7565, test_f1: 0.6555
 epoch: 45, train_loss: 0.6323, test_loss: 0.7411, test_f1: 0.6420
 epoch: 46, train_loss: 0.6370, test_loss: 0.6692, test_f1: 0.6808
 epoch: 47, train_loss: 0.6294, test_loss: 0.7373, test_f1: 0.6366
 epoch: 48, train_loss: 0.6198, test_loss: 0.7119, test_f1: 0.6667
 epoch: 49, train_loss: 0.6302, test_loss: 0.6831, test_f1: 0.6739
 epoch: 50, train_loss: 0.6133, test_loss: 0.8062, test_f1: 0.6264
 epoch: 51, train_loss: 0.5962, test_loss: 0.6908, test_f1: 0.6755
 epoch: 52, train_loss: 0.5893, test_loss: 0.6699, test_f1: 0.6847
 epoch: 53, train_loss: 0.5587, test_loss: 0.7470, test_f1: 0.6718
 epoch: 54, train_loss: 0.5561, test_loss: 0.7293, test_f1: 0.6651
 epoch: 55, train_loss: 0.5657, test_loss: 0.7274, test_f1: 0.6674
 epoch: 56, train_loss: 0.5524, test_loss: 0.7665, test_f1: 0.6586
 epoch: 57, train_loss: 0.5648, test_loss: 0.6935, test_f1: 0.6710
 epoch: 58, train_loss: 0.5520, test_loss: 0.7308, test_f1: 0.6586
 epoch: 59, train_loss: 0.5498, test_loss: 0.7442, test_f1: 0.6367
 epoch: 60, train_loss: 0.5571, test_loss: 0.7602, test_f1: 0.6599
 epoch: 61, train_loss: 0.5642, test_loss: 0.8027, test_f1: 0.6637
 epoch: 62, train_loss: 0.5533, test_loss: 0.7639, test_f1: 0.6802
 epoch: 63, train_loss: 0.5516, test_loss: 0.7956, test_f1: 0.6564
 epoch: 64, train_loss: 0.5409, test_loss: 0.7640, test_f1: 0.6663
 epoch: 65, train_loss: 0.5429, test_loss: 0.7854, test_f1: 0.6738
 epoch: 66, train_loss: 0.5281, test_loss: 0.7859, test_f1: 0.6699
 epoch: 67, train_loss: 0.5350, test_loss: 0.8030, test_f1: 0.6622
 epoch: 68, train_loss: 0.5404, test_loss: 0.7847, test_f1: 0.6651
 epoch: 69, train_loss: 0.5154, test_loss: 0.8031, test_f1: 0.6691
 epoch: 70, train_loss: 0.5188, test_loss: 0.8126, test_f1: 0.6647
 epoch: 71, train_loss: 0.5296, test_loss: 0.7842, test_f1: 0.6767
 epoch: 72, train_loss: 0.5166, test_loss: 0.8090, test_f1: 0.6677
 epoch: 73, train_loss: 0.5218, test_loss: 0.7630, test_f1: 0.6740
 epoch: 74, train_loss: 0.5188, test_loss: 0.7937, test_f1: 0.6651
 epoch: 75, train_loss: 0.5122, test_loss: 0.7954, test_f1: 0.6808
 epoch: 76, train_loss: 0.5073, test_loss: 0.8399, test_f1: 0.6620
 epoch: 77, train_loss: 0.5122, test_loss: 0.7694, test_f1: 0.6657
 epoch: 78, train_loss: 0.5065, test_loss: 0.8174, test_f1: 0.6720
 epoch: 79, train_loss: 0.5256, test_loss: 0.8115, test_f1: 0.6863
 epoch: 80, train_loss: 0.5052, test_loss: 0.7161, test_f1: 0.6893
 epoch: 81, train_loss: 0.5000, test_loss: 0.7791, test_f1: 0.6827
 epoch: 82, train_loss: 0.4840, test_loss: 0.8614, test_f1: 0.6668
 epoch: 83, train_loss: 0.4803, test_loss: 0.7868, test_f1: 0.6772
 epoch: 84, train_loss: 0.4969, test_loss: 0.8781, test_f1: 0.6612
 epoch: 85, train_loss: 0.4838, test_loss: 0.8263, test_f1: 0.6854
 epoch: 86, train_loss: 0.4935, test_loss: 0.8560, test_f1: 0.6800
 epoch: 87, train_loss: 0.4802, test_loss: 0.8486, test_f1: 0.6572
 epoch: 88, train_loss: 0.4836, test_loss: 0.8727, test_f1: 0.6636
 epoch: 89, train_loss: 0.4835, test_loss: 0.8962, test_f1: 0.6756
 epoch: 90, train_loss: 0.4844, test_loss: 0.8132, test_f1: 0.6828
 epoch: 91, train_loss: 0.4672, test_loss: 0.9196, test_f1: 0.6719
 epoch: 92, train_loss: 0.4722, test_loss: 0.8446, test_f1: 0.6629
 epoch: 93, train_loss: 0.4618, test_loss: 0.8250, test_f1: 0.6750
 epoch: 94, train_loss: 0.4676, test_loss: 0.8195, test_f1: 0.6877
 epoch: 95, train_loss: 0.4762, test_loss: 0.8530, test_f1: 0.6622
 epoch: 96, train_loss: 0.4772, test_loss: 0.8680, test_f1: 0.6732
 epoch: 97, train_loss: 0.4741, test_loss: 0.8684, test_f1: 0.6808
 epoch: 98, train_loss: 0.4594, test_loss: 0.8312, test_f1: 0.6703
 epoch: 99, train_loss: 0.4413, test_loss: 0.8265, test_f1: 0.6879
##################ITERATION #6 ****************************************
 epoch: 0, train_loss: 1.3497, test_loss: 1.1883, test_f1: 0.3606
 epoch: 1, train_loss: 1.0743, test_loss: 1.0089, test_f1: 0.4661
 epoch: 2, train_loss: 1.0215, test_loss: 0.9858, test_f1: 0.5006
 epoch: 3, train_loss: 0.9761, test_loss: 0.9731, test_f1: 0.5288
 epoch: 4, train_loss: 0.9528, test_loss: 0.9622, test_f1: 0.5055
 epoch: 5, train_loss: 0.9398, test_loss: 0.9613, test_f1: 0.4938
 epoch: 6, train_loss: 0.9264, test_loss: 0.9425, test_f1: 0.5346
 epoch: 7, train_loss: 0.9155, test_loss: 0.9050, test_f1: 0.5310
 epoch: 8, train_loss: 0.8984, test_loss: 0.9267, test_f1: 0.5579
 epoch: 9, train_loss: 0.8766, test_loss: 0.8976, test_f1: 0.5410
 epoch: 10, train_loss: 0.8645, test_loss: 0.8788, test_f1: 0.5818
 epoch: 11, train_loss: 0.8514, test_loss: 0.8826, test_f1: 0.5580
 epoch: 12, train_loss: 0.8410, test_loss: 0.8755, test_f1: 0.5533
 epoch: 13, train_loss: 0.8303, test_loss: 0.8453, test_f1: 0.5876
 epoch: 14, train_loss: 0.8364, test_loss: 0.9117, test_f1: 0.5396
 epoch: 15, train_loss: 0.7919, test_loss: 0.8701, test_f1: 0.5869
 epoch: 16, train_loss: 0.7852, test_loss: 0.9222, test_f1: 0.5586
 epoch: 17, train_loss: 0.7968, test_loss: 0.8318, test_f1: 0.6045
 epoch: 18, train_loss: 0.7809, test_loss: 0.8895, test_f1: 0.5761
 epoch: 19, train_loss: 0.7756, test_loss: 0.8744, test_f1: 0.6050
 epoch: 20, train_loss: 0.7886, test_loss: 0.8423, test_f1: 0.6150
 epoch: 21, train_loss: 0.7512, test_loss: 0.8266, test_f1: 0.6026
 epoch: 22, train_loss: 0.7463, test_loss: 0.8534, test_f1: 0.5771
 epoch: 23, train_loss: 0.7476, test_loss: 0.8597, test_f1: 0.5842
 epoch: 24, train_loss: 0.7296, test_loss: 0.8846, test_f1: 0.5973
 epoch: 25, train_loss: 0.7379, test_loss: 0.8172, test_f1: 0.6299
 epoch: 26, train_loss: 0.7323, test_loss: 0.8396, test_f1: 0.6076
 epoch: 27, train_loss: 0.7041, test_loss: 0.8278, test_f1: 0.6141
 epoch: 28, train_loss: 0.7171, test_loss: 0.7396, test_f1: 0.6228
 epoch: 29, train_loss: 0.7074, test_loss: 0.8739, test_f1: 0.6018
 epoch: 30, train_loss: 0.7145, test_loss: 0.7785, test_f1: 0.6101
 epoch: 31, train_loss: 0.6851, test_loss: 0.7813, test_f1: 0.6481
 epoch: 32, train_loss: 0.7036, test_loss: 0.7826, test_f1: 0.6154
 epoch: 33, train_loss: 0.6950, test_loss: 0.7958, test_f1: 0.6657
 epoch: 34, train_loss: 0.6658, test_loss: 0.8242, test_f1: 0.6317
 epoch: 35, train_loss: 0.6748, test_loss: 0.7779, test_f1: 0.6233
 epoch: 36, train_loss: 0.6738, test_loss: 0.8108, test_f1: 0.6498
 epoch: 37, train_loss: 0.6831, test_loss: 0.8320, test_f1: 0.6154
 epoch: 38, train_loss: 0.6604, test_loss: 0.7593, test_f1: 0.6445
 epoch: 39, train_loss: 0.6512, test_loss: 0.7451, test_f1: 0.6310
 epoch: 40, train_loss: 0.6545, test_loss: 0.7998, test_f1: 0.6437
 epoch: 41, train_loss: 0.6358, test_loss: 0.8118, test_f1: 0.6476
 epoch: 42, train_loss: 0.6273, test_loss: 0.7810, test_f1: 0.6324
 epoch: 43, train_loss: 0.6649, test_loss: 0.8888, test_f1: 0.6044
 epoch: 44, train_loss: 0.6295, test_loss: 0.7387, test_f1: 0.6024
 epoch: 45, train_loss: 0.6553, test_loss: 0.7690, test_f1: 0.6496
 epoch: 46, train_loss: 0.6292, test_loss: 0.8079, test_f1: 0.6443
 epoch: 47, train_loss: 0.6290, test_loss: 0.7524, test_f1: 0.6498
 epoch: 48, train_loss: 0.6225, test_loss: 0.8627, test_f1: 0.6378
 epoch: 49, train_loss: 0.6077, test_loss: 0.8320, test_f1: 0.6490
 epoch: 50, train_loss: 0.6136, test_loss: 0.8182, test_f1: 0.6407
 epoch: 51, train_loss: 0.5814, test_loss: 0.7671, test_f1: 0.6736
 epoch: 52, train_loss: 0.5695, test_loss: 0.7189, test_f1: 0.6455
 epoch: 53, train_loss: 0.5760, test_loss: 0.7687, test_f1: 0.6531
 epoch: 54, train_loss: 0.5696, test_loss: 0.7522, test_f1: 0.6809
 epoch: 55, train_loss: 0.5690, test_loss: 0.7499, test_f1: 0.6722
 epoch: 56, train_loss: 0.5568, test_loss: 0.7918, test_f1: 0.6587
 epoch: 57, train_loss: 0.5497, test_loss: 0.8282, test_f1: 0.6386
 epoch: 58, train_loss: 0.5545, test_loss: 0.7690, test_f1: 0.6485
 epoch: 59, train_loss: 0.5449, test_loss: 0.7586, test_f1: 0.6431
 epoch: 60, train_loss: 0.5484, test_loss: 0.8520, test_f1: 0.6480
 epoch: 61, train_loss: 0.5387, test_loss: 0.8389, test_f1: 0.6645
 epoch: 62, train_loss: 0.5496, test_loss: 0.7762, test_f1: 0.6472
 epoch: 63, train_loss: 0.5338, test_loss: 0.8588, test_f1: 0.6643
 epoch: 64, train_loss: 0.5330, test_loss: 0.7992, test_f1: 0.6446
 epoch: 65, train_loss: 0.5361, test_loss: 0.8268, test_f1: 0.6586
 epoch: 66, train_loss: 0.5269, test_loss: 0.8577, test_f1: 0.6592
 epoch: 67, train_loss: 0.5353, test_loss: 0.8714, test_f1: 0.6225
 epoch: 68, train_loss: 0.5273, test_loss: 0.8355, test_f1: 0.6491
 epoch: 69, train_loss: 0.5318, test_loss: 0.7541, test_f1: 0.6482
 epoch: 70, train_loss: 0.5135, test_loss: 0.7822, test_f1: 0.6644
 epoch: 71, train_loss: 0.5074, test_loss: 0.8495, test_f1: 0.6484
 epoch: 72, train_loss: 0.5130, test_loss: 0.8509, test_f1: 0.6595
 epoch: 73, train_loss: 0.5209, test_loss: 0.8652, test_f1: 0.6346
 epoch: 74, train_loss: 0.5192, test_loss: 0.8175, test_f1: 0.6508
 epoch: 75, train_loss: 0.5195, test_loss: 0.8134, test_f1: 0.6746
 epoch: 76, train_loss: 0.5001, test_loss: 0.8530, test_f1: 0.6481
 epoch: 77, train_loss: 0.5162, test_loss: 0.8241, test_f1: 0.6469
 epoch: 78, train_loss: 0.5080, test_loss: 0.8220, test_f1: 0.6279
 epoch: 79, train_loss: 0.5030, test_loss: 0.9117, test_f1: 0.6490
 epoch: 80, train_loss: 0.5060, test_loss: 0.8608, test_f1: 0.6448
 epoch: 81, train_loss: 0.5085, test_loss: 0.8336, test_f1: 0.6554
 epoch: 82, train_loss: 0.5034, test_loss: 0.8734, test_f1: 0.6606
 epoch: 83, train_loss: 0.4987, test_loss: 0.8089, test_f1: 0.6571
 epoch: 84, train_loss: 0.5052, test_loss: 0.8346, test_f1: 0.6582
 epoch: 85, train_loss: 0.4990, test_loss: 0.8591, test_f1: 0.6549
 epoch: 86, train_loss: 0.5015, test_loss: 0.8299, test_f1: 0.6515
 epoch: 87, train_loss: 0.4940, test_loss: 0.8657, test_f1: 0.6498
 epoch: 88, train_loss: 0.4945, test_loss: 0.8376, test_f1: 0.6566
 epoch: 89, train_loss: 0.4649, test_loss: 0.8727, test_f1: 0.6623
 epoch: 90, train_loss: 0.4761, test_loss: 0.8413, test_f1: 0.6527
 epoch: 91, train_loss: 0.4677, test_loss: 0.8733, test_f1: 0.6592
 epoch: 92, train_loss: 0.4776, test_loss: 0.9153, test_f1: 0.6444
 epoch: 93, train_loss: 0.4891, test_loss: 0.8742, test_f1: 0.6525
 epoch: 94, train_loss: 0.4826, test_loss: 0.8808, test_f1: 0.6611
 epoch: 95, train_loss: 0.4839, test_loss: 0.9436, test_f1: 0.6555
 epoch: 96, train_loss: 0.4732, test_loss: 0.8708, test_f1: 0.6499
 epoch: 97, train_loss: 0.4803, test_loss: 0.9601, test_f1: 0.6283
 epoch: 98, train_loss: 0.4691, test_loss: 0.9231, test_f1: 0.6600
 epoch: 99, train_loss: 0.4677, test_loss: 0.9342, test_f1: 0.6616
##################ITERATION #7 ****************************************
 epoch: 0, train_loss: 1.2783, test_loss: 1.1231, test_f1: 0.3789
 epoch: 1, train_loss: 1.0310, test_loss: 0.9834, test_f1: 0.4711
 epoch: 2, train_loss: 0.9654, test_loss: 0.9714, test_f1: 0.4708
 epoch: 3, train_loss: 0.9470, test_loss: 0.9698, test_f1: 0.5006
 epoch: 4, train_loss: 0.9292, test_loss: 0.9172, test_f1: 0.5106
 epoch: 5, train_loss: 0.9155, test_loss: 0.8881, test_f1: 0.5147
 epoch: 6, train_loss: 0.8882, test_loss: 0.8730, test_f1: 0.5379
 epoch: 7, train_loss: 0.8816, test_loss: 0.9011, test_f1: 0.5610
 epoch: 8, train_loss: 0.8754, test_loss: 0.9352, test_f1: 0.5018
 epoch: 9, train_loss: 0.8593, test_loss: 0.8814, test_f1: 0.5429
 epoch: 10, train_loss: 0.8387, test_loss: 0.8399, test_f1: 0.5378
 epoch: 11, train_loss: 0.8399, test_loss: 0.8489, test_f1: 0.5458
 epoch: 12, train_loss: 0.8288, test_loss: 0.9064, test_f1: 0.5590
 epoch: 13, train_loss: 0.8177, test_loss: 0.8543, test_f1: 0.5820
 epoch: 14, train_loss: 0.8137, test_loss: 0.8720, test_f1: 0.5329
 epoch: 15, train_loss: 0.8006, test_loss: 0.8547, test_f1: 0.5730
 epoch: 16, train_loss: 0.7925, test_loss: 0.8525, test_f1: 0.5737
 epoch: 17, train_loss: 0.7777, test_loss: 0.8392, test_f1: 0.6142
 epoch: 18, train_loss: 0.7745, test_loss: 0.8566, test_f1: 0.5654
 epoch: 19, train_loss: 0.7582, test_loss: 0.8599, test_f1: 0.5754
 epoch: 20, train_loss: 0.7573, test_loss: 0.8833, test_f1: 0.5880
 epoch: 21, train_loss: 0.7615, test_loss: 0.8844, test_f1: 0.5949
 epoch: 22, train_loss: 0.7561, test_loss: 0.8192, test_f1: 0.6045
 epoch: 23, train_loss: 0.7399, test_loss: 0.8367, test_f1: 0.5897
 epoch: 24, train_loss: 0.7403, test_loss: 0.8613, test_f1: 0.6189
 epoch: 25, train_loss: 0.7252, test_loss: 0.8772, test_f1: 0.6175
 epoch: 26, train_loss: 0.7113, test_loss: 0.8723, test_f1: 0.5627
 epoch: 27, train_loss: 0.7190, test_loss: 0.8410, test_f1: 0.6290
 epoch: 28, train_loss: 0.7082, test_loss: 0.8318, test_f1: 0.6382
 epoch: 29, train_loss: 0.7033, test_loss: 0.8182, test_f1: 0.6234
 epoch: 30, train_loss: 0.7046, test_loss: 0.8599, test_f1: 0.6194
 epoch: 31, train_loss: 0.7062, test_loss: 0.9035, test_f1: 0.6201
 epoch: 32, train_loss: 0.6857, test_loss: 0.8884, test_f1: 0.6322
 epoch: 33, train_loss: 0.6656, test_loss: 0.8832, test_f1: 0.6211
 epoch: 34, train_loss: 0.6983, test_loss: 0.8560, test_f1: 0.6119
 epoch: 35, train_loss: 0.6739, test_loss: 0.8553, test_f1: 0.6409
 epoch: 36, train_loss: 0.6559, test_loss: 0.8510, test_f1: 0.6425
 epoch: 37, train_loss: 0.6532, test_loss: 0.8569, test_f1: 0.6355
 epoch: 38, train_loss: 0.6548, test_loss: 0.8373, test_f1: 0.6658
 epoch: 39, train_loss: 0.6523, test_loss: 0.9361, test_f1: 0.6185
 epoch: 40, train_loss: 0.6564, test_loss: 0.9358, test_f1: 0.6223
 epoch: 41, train_loss: 0.6633, test_loss: 0.8314, test_f1: 0.6206
 epoch: 42, train_loss: 0.6496, test_loss: 0.8515, test_f1: 0.6277
 epoch: 43, train_loss: 0.6376, test_loss: 0.9562, test_f1: 0.6083
 epoch: 44, train_loss: 0.6341, test_loss: 0.8754, test_f1: 0.6450
 epoch: 45, train_loss: 0.6221, test_loss: 0.8693, test_f1: 0.6597
 epoch: 46, train_loss: 0.6280, test_loss: 0.9514, test_f1: 0.6319
 epoch: 47, train_loss: 0.6254, test_loss: 0.8833, test_f1: 0.6371
 epoch: 48, train_loss: 0.6161, test_loss: 0.8779, test_f1: 0.6476
 epoch: 49, train_loss: 0.6457, test_loss: 0.8883, test_f1: 0.6464
 epoch: 50, train_loss: 0.6274, test_loss: 0.9157, test_f1: 0.6236
 epoch: 51, train_loss: 0.5859, test_loss: 0.8564, test_f1: 0.6612
 epoch: 52, train_loss: 0.5664, test_loss: 0.9257, test_f1: 0.6335
 epoch: 53, train_loss: 0.5578, test_loss: 0.8847, test_f1: 0.6585
 epoch: 54, train_loss: 0.5550, test_loss: 0.8930, test_f1: 0.6446
 epoch: 55, train_loss: 0.5836, test_loss: 0.8509, test_f1: 0.6595
 epoch: 56, train_loss: 0.5676, test_loss: 0.9141, test_f1: 0.6510
 epoch: 57, train_loss: 0.5603, test_loss: 0.8963, test_f1: 0.6442
 epoch: 58, train_loss: 0.5430, test_loss: 0.9116, test_f1: 0.6447
 epoch: 59, train_loss: 0.5482, test_loss: 0.9286, test_f1: 0.6461
 epoch: 60, train_loss: 0.5456, test_loss: 0.9230, test_f1: 0.6456
 epoch: 61, train_loss: 0.5471, test_loss: 0.9633, test_f1: 0.6547
 epoch: 62, train_loss: 0.5454, test_loss: 1.0046, test_f1: 0.6182
 epoch: 63, train_loss: 0.5557, test_loss: 0.9244, test_f1: 0.6683
 epoch: 64, train_loss: 0.5459, test_loss: 0.9236, test_f1: 0.6517
 epoch: 65, train_loss: 0.5387, test_loss: 0.9772, test_f1: 0.6303
 epoch: 66, train_loss: 0.5298, test_loss: 0.9169, test_f1: 0.6552
 epoch: 67, train_loss: 0.5440, test_loss: 0.9531, test_f1: 0.6483
 epoch: 68, train_loss: 0.5392, test_loss: 0.9629, test_f1: 0.6458
 epoch: 69, train_loss: 0.5361, test_loss: 0.9770, test_f1: 0.6522
 epoch: 70, train_loss: 0.5233, test_loss: 0.9079, test_f1: 0.6722
 epoch: 71, train_loss: 0.5187, test_loss: 1.0343, test_f1: 0.6404
 epoch: 72, train_loss: 0.5109, test_loss: 0.9644, test_f1: 0.6578
 epoch: 73, train_loss: 0.5179, test_loss: 0.9049, test_f1: 0.6605
 epoch: 74, train_loss: 0.5206, test_loss: 1.0148, test_f1: 0.6486
 epoch: 75, train_loss: 0.5275, test_loss: 0.9214, test_f1: 0.6584
 epoch: 76, train_loss: 0.5190, test_loss: 1.0202, test_f1: 0.6549
 epoch: 77, train_loss: 0.5246, test_loss: 1.0362, test_f1: 0.6687
 epoch: 78, train_loss: 0.5141, test_loss: 1.0449, test_f1: 0.6447
 epoch: 79, train_loss: 0.5082, test_loss: 1.0579, test_f1: 0.6705
 epoch: 80, train_loss: 0.5043, test_loss: 1.0059, test_f1: 0.6664
 epoch: 81, train_loss: 0.4972, test_loss: 1.0234, test_f1: 0.6467
 epoch: 82, train_loss: 0.5087, test_loss: 1.0170, test_f1: 0.6430
 epoch: 83, train_loss: 0.4841, test_loss: 1.0840, test_f1: 0.6497
 epoch: 84, train_loss: 0.5082, test_loss: 1.0940, test_f1: 0.6592
 epoch: 85, train_loss: 0.4827, test_loss: 1.0103, test_f1: 0.6583
 epoch: 86, train_loss: 0.5008, test_loss: 0.9834, test_f1: 0.6594
 epoch: 87, train_loss: 0.4975, test_loss: 1.0550, test_f1: 0.6306
 epoch: 88, train_loss: 0.4858, test_loss: 1.0846, test_f1: 0.6643
 epoch: 89, train_loss: 0.4966, test_loss: 1.1336, test_f1: 0.6532
 epoch: 90, train_loss: 0.4726, test_loss: 1.0840, test_f1: 0.6553
 epoch: 91, train_loss: 0.4803, test_loss: 1.0803, test_f1: 0.6453
 epoch: 92, train_loss: 0.4944, test_loss: 1.1204, test_f1: 0.6504
 epoch: 93, train_loss: 0.5009, test_loss: 1.0963, test_f1: 0.6755
 epoch: 94, train_loss: 0.4843, test_loss: 1.0230, test_f1: 0.6466
 epoch: 95, train_loss: 0.4933, test_loss: 1.1097, test_f1: 0.6618
 epoch: 96, train_loss: 0.4765, test_loss: 1.1040, test_f1: 0.6774
 epoch: 97, train_loss: 0.4741, test_loss: 1.0493, test_f1: 0.6732
 epoch: 98, train_loss: 0.4737, test_loss: 1.1859, test_f1: 0.6574
 epoch: 99, train_loss: 0.4620, test_loss: 1.0978, test_f1: 0.6464
##################ITERATION #8 ****************************************
 epoch: 0, train_loss: 1.4070, test_loss: 1.1451, test_f1: 0.4204
 epoch: 1, train_loss: 1.0493, test_loss: 0.9781, test_f1: 0.4850
 epoch: 2, train_loss: 1.0151, test_loss: 0.9994, test_f1: 0.4683
 epoch: 3, train_loss: 0.9832, test_loss: 0.9948, test_f1: 0.4961
 epoch: 4, train_loss: 0.9489, test_loss: 0.9836, test_f1: 0.5184
 epoch: 5, train_loss: 0.9427, test_loss: 0.9847, test_f1: 0.5021
 epoch: 6, train_loss: 0.9125, test_loss: 0.9360, test_f1: 0.5321
 epoch: 7, train_loss: 0.9173, test_loss: 0.9325, test_f1: 0.5412
 epoch: 8, train_loss: 0.8941, test_loss: 0.9444, test_f1: 0.5200
 epoch: 9, train_loss: 0.8787, test_loss: 0.9282, test_f1: 0.5609
 epoch: 10, train_loss: 0.8738, test_loss: 0.9025, test_f1: 0.5463
 epoch: 11, train_loss: 0.8657, test_loss: 0.9397, test_f1: 0.5433
 epoch: 12, train_loss: 0.8483, test_loss: 0.8913, test_f1: 0.5518
 epoch: 13, train_loss: 0.8461, test_loss: 0.9069, test_f1: 0.5704
 epoch: 14, train_loss: 0.8243, test_loss: 0.8920, test_f1: 0.5709
 epoch: 15, train_loss: 0.8357, test_loss: 0.9243, test_f1: 0.5997
 epoch: 16, train_loss: 0.8341, test_loss: 0.9220, test_f1: 0.5469
 epoch: 17, train_loss: 0.8004, test_loss: 0.8137, test_f1: 0.5824
 epoch: 18, train_loss: 0.8153, test_loss: 0.8721, test_f1: 0.5787
 epoch: 19, train_loss: 0.7977, test_loss: 0.8891, test_f1: 0.5929
 epoch: 20, train_loss: 0.7971, test_loss: 0.8658, test_f1: 0.5984
 epoch: 21, train_loss: 0.7779, test_loss: 0.8652, test_f1: 0.5968
 epoch: 22, train_loss: 0.7960, test_loss: 0.8503, test_f1: 0.5836
 epoch: 23, train_loss: 0.7745, test_loss: 0.8383, test_f1: 0.5907
 epoch: 24, train_loss: 0.7734, test_loss: 0.8465, test_f1: 0.6225
 epoch: 25, train_loss: 0.7572, test_loss: 0.7894, test_f1: 0.6061
 epoch: 26, train_loss: 0.7595, test_loss: 0.8865, test_f1: 0.5805
 epoch: 27, train_loss: 0.7423, test_loss: 0.8315, test_f1: 0.6174
 epoch: 28, train_loss: 0.7427, test_loss: 0.8176, test_f1: 0.6399
 epoch: 29, train_loss: 0.7401, test_loss: 0.8736, test_f1: 0.6056
 epoch: 30, train_loss: 0.7180, test_loss: 0.8674, test_f1: 0.6020
 epoch: 31, train_loss: 0.7169, test_loss: 0.8383, test_f1: 0.6020
 epoch: 32, train_loss: 0.7210, test_loss: 0.7875, test_f1: 0.6528
 epoch: 33, train_loss: 0.7155, test_loss: 0.8614, test_f1: 0.6266
 epoch: 34, train_loss: 0.7062, test_loss: 0.8061, test_f1: 0.6295
 epoch: 35, train_loss: 0.7021, test_loss: 0.8548, test_f1: 0.5916
 epoch: 36, train_loss: 0.6983, test_loss: 0.8847, test_f1: 0.6462
 epoch: 37, train_loss: 0.6843, test_loss: 0.8298, test_f1: 0.6366
 epoch: 38, train_loss: 0.6901, test_loss: 0.8696, test_f1: 0.6396
 epoch: 39, train_loss: 0.6946, test_loss: 0.8195, test_f1: 0.6459
 epoch: 40, train_loss: 0.6876, test_loss: 0.8631, test_f1: 0.6268
 epoch: 41, train_loss: 0.6666, test_loss: 0.9209, test_f1: 0.6125
 epoch: 42, train_loss: 0.6765, test_loss: 0.9029, test_f1: 0.6161
 epoch: 43, train_loss: 0.6652, test_loss: 0.8869, test_f1: 0.6472
 epoch: 44, train_loss: 0.6532, test_loss: 0.9534, test_f1: 0.6256
 epoch: 45, train_loss: 0.6642, test_loss: 0.9724, test_f1: 0.6160
 epoch: 46, train_loss: 0.6594, test_loss: 0.9160, test_f1: 0.6104
 epoch: 47, train_loss: 0.6591, test_loss: 0.9204, test_f1: 0.6427
 epoch: 48, train_loss: 0.6516, test_loss: 0.8709, test_f1: 0.6491
 epoch: 49, train_loss: 0.6392, test_loss: 0.9693, test_f1: 0.6132
 epoch: 50, train_loss: 0.6426, test_loss: 0.9070, test_f1: 0.6398
 epoch: 51, train_loss: 0.6113, test_loss: 0.8482, test_f1: 0.6632
 epoch: 52, train_loss: 0.5886, test_loss: 0.8902, test_f1: 0.6722
 epoch: 53, train_loss: 0.5935, test_loss: 0.9614, test_f1: 0.6298
 epoch: 54, train_loss: 0.5991, test_loss: 0.9364, test_f1: 0.6447
 epoch: 55, train_loss: 0.5882, test_loss: 0.8744, test_f1: 0.6506
 epoch: 56, train_loss: 0.5835, test_loss: 0.9434, test_f1: 0.6415
 epoch: 57, train_loss: 0.5743, test_loss: 0.9031, test_f1: 0.6442
 epoch: 58, train_loss: 0.5707, test_loss: 0.8701, test_f1: 0.6560
 epoch: 59, train_loss: 0.5871, test_loss: 0.9481, test_f1: 0.6479
 epoch: 60, train_loss: 0.5743, test_loss: 0.9954, test_f1: 0.6388
 epoch: 61, train_loss: 0.5730, test_loss: 0.9296, test_f1: 0.6502
 epoch: 62, train_loss: 0.5746, test_loss: 0.9315, test_f1: 0.6537
 epoch: 63, train_loss: 0.5680, test_loss: 0.8571, test_f1: 0.6539
 epoch: 64, train_loss: 0.5606, test_loss: 0.9323, test_f1: 0.6529
 epoch: 65, train_loss: 0.5433, test_loss: 0.9591, test_f1: 0.6377
 epoch: 66, train_loss: 0.5550, test_loss: 1.0127, test_f1: 0.6114
 epoch: 67, train_loss: 0.5595, test_loss: 0.9859, test_f1: 0.6478
 epoch: 68, train_loss: 0.5517, test_loss: 0.9942, test_f1: 0.6293
 epoch: 69, train_loss: 0.5553, test_loss: 1.0174, test_f1: 0.6198
 epoch: 70, train_loss: 0.5480, test_loss: 0.9874, test_f1: 0.6304
 epoch: 71, train_loss: 0.5438, test_loss: 1.0017, test_f1: 0.6421
 epoch: 72, train_loss: 0.5459, test_loss: 1.0237, test_f1: 0.6290
 epoch: 73, train_loss: 0.5374, test_loss: 1.0578, test_f1: 0.6434
 epoch: 74, train_loss: 0.5458, test_loss: 1.0141, test_f1: 0.6299
 epoch: 75, train_loss: 0.5591, test_loss: 1.0183, test_f1: 0.6361
 epoch: 76, train_loss: 0.5262, test_loss: 1.0501, test_f1: 0.6682
 epoch: 77, train_loss: 0.5302, test_loss: 1.0022, test_f1: 0.6669
 epoch: 78, train_loss: 0.5319, test_loss: 1.0167, test_f1: 0.6506
 epoch: 79, train_loss: 0.5386, test_loss: 1.0006, test_f1: 0.6512
 epoch: 80, train_loss: 0.5370, test_loss: 1.0092, test_f1: 0.6323
 epoch: 81, train_loss: 0.5226, test_loss: 1.0363, test_f1: 0.6277
 epoch: 82, train_loss: 0.5122, test_loss: 1.0313, test_f1: 0.6542
 epoch: 83, train_loss: 0.5365, test_loss: 1.0200, test_f1: 0.6432
 epoch: 84, train_loss: 0.5209, test_loss: 1.0444, test_f1: 0.6540
 epoch: 85, train_loss: 0.5084, test_loss: 1.0470, test_f1: 0.6529
 epoch: 86, train_loss: 0.5272, test_loss: 1.0577, test_f1: 0.6461
 epoch: 87, train_loss: 0.5114, test_loss: 1.0611, test_f1: 0.6548
 epoch: 88, train_loss: 0.5067, test_loss: 1.0192, test_f1: 0.6492
 epoch: 89, train_loss: 0.4986, test_loss: 1.1252, test_f1: 0.6418
 epoch: 90, train_loss: 0.5180, test_loss: 1.0980, test_f1: 0.6590
 epoch: 91, train_loss: 0.5003, test_loss: 1.0529, test_f1: 0.6309
 epoch: 92, train_loss: 0.4911, test_loss: 1.1538, test_f1: 0.6305
 epoch: 93, train_loss: 0.4756, test_loss: 1.1280, test_f1: 0.6422
 epoch: 94, train_loss: 0.4843, test_loss: 1.1137, test_f1: 0.6374
 epoch: 95, train_loss: 0.4904, test_loss: 1.0453, test_f1: 0.6427
 epoch: 96, train_loss: 0.5012, test_loss: 1.1270, test_f1: 0.6378
 epoch: 97, train_loss: 0.4976, test_loss: 1.0928, test_f1: 0.6670
 epoch: 98, train_loss: 0.4821, test_loss: 1.0902, test_f1: 0.6503
 epoch: 99, train_loss: 0.4918, test_loss: 1.1080, test_f1: 0.6422
##################ITERATION #9 ****************************************
 epoch: 0, train_loss: 1.3793, test_loss: 1.2464, test_f1: 0.3349
 epoch: 1, train_loss: 1.0470, test_loss: 0.9600, test_f1: 0.4670
 epoch: 2, train_loss: 0.9971, test_loss: 0.9707, test_f1: 0.4964
 epoch: 3, train_loss: 0.9648, test_loss: 0.9674, test_f1: 0.4966
 epoch: 4, train_loss: 0.9488, test_loss: 0.9344, test_f1: 0.4931
 epoch: 5, train_loss: 0.9072, test_loss: 0.9191, test_f1: 0.4926
 epoch: 6, train_loss: 0.9009, test_loss: 0.9244, test_f1: 0.5083
 epoch: 7, train_loss: 0.8934, test_loss: 0.9179, test_f1: 0.5330
 epoch: 8, train_loss: 0.8725, test_loss: 0.8656, test_f1: 0.5298
 epoch: 9, train_loss: 0.8758, test_loss: 0.8761, test_f1: 0.5896
 epoch: 10, train_loss: 0.8510, test_loss: 0.8802, test_f1: 0.5373
 epoch: 11, train_loss: 0.8464, test_loss: 0.8731, test_f1: 0.5359
 epoch: 12, train_loss: 0.8373, test_loss: 0.9271, test_f1: 0.5589
 epoch: 13, train_loss: 0.8174, test_loss: 0.8617, test_f1: 0.5902
 epoch: 14, train_loss: 0.8052, test_loss: 0.8698, test_f1: 0.5494
 epoch: 15, train_loss: 0.8085, test_loss: 0.8501, test_f1: 0.5708
 epoch: 16, train_loss: 0.7906, test_loss: 0.8554, test_f1: 0.5808
 epoch: 17, train_loss: 0.7971, test_loss: 0.8874, test_f1: 0.5935
 epoch: 18, train_loss: 0.7793, test_loss: 0.8431, test_f1: 0.5907
 epoch: 19, train_loss: 0.7830, test_loss: 0.7916, test_f1: 0.5878
 epoch: 20, train_loss: 0.7615, test_loss: 0.8200, test_f1: 0.5681
 epoch: 21, train_loss: 0.7505, test_loss: 0.8598, test_f1: 0.5949
 epoch: 22, train_loss: 0.7446, test_loss: 0.7944, test_f1: 0.6160
 epoch: 23, train_loss: 0.7487, test_loss: 0.8287, test_f1: 0.6136
 epoch: 24, train_loss: 0.7201, test_loss: 0.8418, test_f1: 0.6052
 epoch: 25, train_loss: 0.7333, test_loss: 0.8043, test_f1: 0.6480
 epoch: 26, train_loss: 0.7136, test_loss: 0.8175, test_f1: 0.5804
 epoch: 27, train_loss: 0.7261, test_loss: 0.8033, test_f1: 0.6307
 epoch: 28, train_loss: 0.7194, test_loss: 0.8410, test_f1: 0.6364
 epoch: 29, train_loss: 0.7287, test_loss: 0.8309, test_f1: 0.6214
 epoch: 30, train_loss: 0.6952, test_loss: 0.8001, test_f1: 0.6205
 epoch: 31, train_loss: 0.6892, test_loss: 0.7926, test_f1: 0.6416
 epoch: 32, train_loss: 0.6992, test_loss: 0.7641, test_f1: 0.6353
 epoch: 33, train_loss: 0.6874, test_loss: 0.7623, test_f1: 0.6315
 epoch: 34, train_loss: 0.6796, test_loss: 0.8176, test_f1: 0.6063
 epoch: 35, train_loss: 0.6760, test_loss: 0.7837, test_f1: 0.6400
 epoch: 36, train_loss: 0.6691, test_loss: 0.7851, test_f1: 0.6186
 epoch: 37, train_loss: 0.6714, test_loss: 0.7559, test_f1: 0.6698
 epoch: 38, train_loss: 0.6614, test_loss: 0.7133, test_f1: 0.6454
 epoch: 39, train_loss: 0.6563, test_loss: 0.8070, test_f1: 0.6341
 epoch: 40, train_loss: 0.6516, test_loss: 0.7543, test_f1: 0.6440
 epoch: 41, train_loss: 0.6453, test_loss: 0.7864, test_f1: 0.6370
 epoch: 42, train_loss: 0.6616, test_loss: 0.7513, test_f1: 0.6496
 epoch: 43, train_loss: 0.6463, test_loss: 0.7754, test_f1: 0.6366
 epoch: 44, train_loss: 0.6437, test_loss: 0.8689, test_f1: 0.6083
 epoch: 45, train_loss: 0.6356, test_loss: 0.7587, test_f1: 0.6689
 epoch: 46, train_loss: 0.6250, test_loss: 0.7846, test_f1: 0.6547
 epoch: 47, train_loss: 0.6239, test_loss: 0.7952, test_f1: 0.6173
 epoch: 48, train_loss: 0.6215, test_loss: 0.7504, test_f1: 0.6471
 epoch: 49, train_loss: 0.6247, test_loss: 0.7350, test_f1: 0.6690
 epoch: 50, train_loss: 0.6196, test_loss: 0.7404, test_f1: 0.6620
 epoch: 51, train_loss: 0.5984, test_loss: 0.7050, test_f1: 0.6717
 epoch: 52, train_loss: 0.5793, test_loss: 0.7346, test_f1: 0.6694
 epoch: 53, train_loss: 0.5602, test_loss: 0.7139, test_f1: 0.6529
 epoch: 54, train_loss: 0.5782, test_loss: 0.6850, test_f1: 0.6690
 epoch: 55, train_loss: 0.5736, test_loss: 0.7164, test_f1: 0.6619
 epoch: 56, train_loss: 0.5760, test_loss: 0.7229, test_f1: 0.6539
 epoch: 57, train_loss: 0.5655, test_loss: 0.7225, test_f1: 0.6459
 epoch: 58, train_loss: 0.5684, test_loss: 0.7385, test_f1: 0.6772
 epoch: 59, train_loss: 0.5644, test_loss: 0.7853, test_f1: 0.6499
 epoch: 60, train_loss: 0.5596, test_loss: 0.7408, test_f1: 0.6716
 epoch: 61, train_loss: 0.5673, test_loss: 0.7133, test_f1: 0.6729
 epoch: 62, train_loss: 0.5516, test_loss: 0.7128, test_f1: 0.6895
 epoch: 63, train_loss: 0.5548, test_loss: 0.7825, test_f1: 0.6673
 epoch: 64, train_loss: 0.5438, test_loss: 0.7486, test_f1: 0.6691
 epoch: 65, train_loss: 0.5558, test_loss: 0.7946, test_f1: 0.6681
 epoch: 66, train_loss: 0.5587, test_loss: 0.7862, test_f1: 0.6646
 epoch: 67, train_loss: 0.5496, test_loss: 0.7692, test_f1: 0.6644
 epoch: 68, train_loss: 0.5450, test_loss: 0.8114, test_f1: 0.6657
 epoch: 69, train_loss: 0.5387, test_loss: 0.7497, test_f1: 0.6799
 epoch: 70, train_loss: 0.5342, test_loss: 0.8178, test_f1: 0.6402
 epoch: 71, train_loss: 0.5270, test_loss: 0.7963, test_f1: 0.6421
 epoch: 72, train_loss: 0.5278, test_loss: 0.8790, test_f1: 0.6475
 epoch: 73, train_loss: 0.5356, test_loss: 0.8323, test_f1: 0.6524
 epoch: 74, train_loss: 0.5208, test_loss: 0.8315, test_f1: 0.6473
 epoch: 75, train_loss: 0.5299, test_loss: 0.8491, test_f1: 0.6633
 epoch: 76, train_loss: 0.5281, test_loss: 0.8585, test_f1: 0.6465
 epoch: 77, train_loss: 0.5209, test_loss: 0.8271, test_f1: 0.6654
 epoch: 78, train_loss: 0.5169, test_loss: 0.8451, test_f1: 0.6515
 epoch: 79, train_loss: 0.5274, test_loss: 0.8247, test_f1: 0.6399
 epoch: 80, train_loss: 0.5189, test_loss: 0.8756, test_f1: 0.6437
 epoch: 81, train_loss: 0.5167, test_loss: 0.8291, test_f1: 0.6412
 epoch: 82, train_loss: 0.5230, test_loss: 0.8338, test_f1: 0.6413
 epoch: 83, train_loss: 0.5169, test_loss: 0.8901, test_f1: 0.6372
 epoch: 84, train_loss: 0.5060, test_loss: 0.8725, test_f1: 0.6606
 epoch: 85, train_loss: 0.5332, test_loss: 0.8534, test_f1: 0.6485
 epoch: 86, train_loss: 0.5099, test_loss: 0.8024, test_f1: 0.6541
 epoch: 87, train_loss: 0.5101, test_loss: 0.8851, test_f1: 0.6510
 epoch: 88, train_loss: 0.5108, test_loss: 0.8469, test_f1: 0.6499
 epoch: 89, train_loss: 0.4958, test_loss: 0.9399, test_f1: 0.6528
 epoch: 90, train_loss: 0.5062, test_loss: 0.8681, test_f1: 0.6515
 epoch: 91, train_loss: 0.4813, test_loss: 0.9257, test_f1: 0.6307
 epoch: 92, train_loss: 0.5105, test_loss: 0.9063, test_f1: 0.6394
 epoch: 93, train_loss: 0.5011, test_loss: 0.8722, test_f1: 0.6484
 epoch: 94, train_loss: 0.4879, test_loss: 0.9235, test_f1: 0.6487
 epoch: 95, train_loss: 0.4943, test_loss: 0.8278, test_f1: 0.6714
 epoch: 96, train_loss: 0.4888, test_loss: 0.9087, test_f1: 0.6539
 epoch: 97, train_loss: 0.5066, test_loss: 0.9549, test_f1: 0.6220
 epoch: 98, train_loss: 0.4892, test_loss: 0.8710, test_f1: 0.6593
 epoch: 99, train_loss: 0.4936, test_loss: 0.9745, test_f1: 0.6350

Training completed in 1293.16 seconds
Best F1: 0.6895 at epoch 62
Mean F1 across iterations: 0.6756  0.0090
========================FINAL RESULTS================================
FEGIN weighted F1: 0.6895  0.0090
python main.py --data ltspice_examples --representation component_pin_net --model FEGIN --layers 4 --hiddens 32 --batch_size 64 --lr 0.001 --emb_size 512 --epochs 100 --save_appendix component_pin_net_L4_H32_BS64_LR0.001_E512 --no_val
-----



STDERR:
  File "main.py", line 370, in <module>
    main()
  File "main.py", line 254, in main
    dataset = dataset_class(
  File "/home/philip/projects/ltspice_examples_code_repo/Circuit-Completion-Using-GNNs/component_classification_with_link_prediction_head/evaluation/FEGIN/kernel/circuit_datasets.py", line 15, in __init__
    self.data, self.slices = torch.load(self.processed_paths[0])
  File "/home/philip/.local/lib/python3.8/site-packages/torch/serialization.py", line 1040, in load
    warnings.warn(
  File "/usr/lib/python3.8/warnings.py", line 109, in _showwarnmsg
    sw(msg.message, msg.category, msg.filename, msg.lineno,
  File "main.py", line 47, in warn_with_traceback
    traceback.print_stack(file=log)
/home/philip/projects/ltspice_examples_code_repo/Circuit-Completion-Using-GNNs/component_classification_with_link_prediction_head/evaluation/FEGIN/kernel/circuit_datasets.py:15: FutureWarning: You are using `torch.load` with `weights_only=False` (the current default value), which uses the default pickle module implicitly. It is possible to construct malicious pickle data which will execute arbitrary code during unpickling (See https://github.com/pytorch/pytorch/blob/main/SECURITY.md#untrusted-models for more details). In a future release, the default value for `weights_only` will be flipped to `True`. This limits the functions that could be executed during unpickling. Arbitrary objects will no longer be allowed to be loaded via this mode unless they are explicitly allowlisted by the user via `torch.serialization.add_safe_globals`. We recommend you start setting `weights_only=True` for any use case where you don't have full control of the loaded file. Please open an issue on GitHub for any issues related to this experimental feature.
  self.data, self.slices = torch.load(self.processed_paths[0])
