STDOUT:
Results will be saved in /home/philip/projects/ltspice_examples_code_repo/Circuit-Completion-Using-GNNs/component_classification_with_link_prediction_head/evaluation/FEGIN/results/model_FEGIN_dataset_ltspice_demos
Command line input: python main.py --data ltspice_demos --representation component_net --model FEGIN --layers 5 --hiddens 128 --batch_size 64 --lr 0.001 --emb_size 250 --epochs 100 --save_appendix component_net_L5_H128_BS64_LR0.001_E250 --no_val
 is saved.
-----
ltspice_demos - FEGIN
Using 5 layers, 128 hidden units, h = 2
Loading component_net representation dataset
ENTERED
Training FEGIN on component_net representation
Train: 1565, Test: 383
##################ITERATION #0 ****************************************
 epoch: 0, train_loss: 1.2127, test_loss: 1.3039, test_f1: 0.2450
 epoch: 1, train_loss: 1.0981, test_loss: 1.1872, test_f1: 0.4209
 epoch: 2, train_loss: 1.0206, test_loss: 1.2142, test_f1: 0.4685
 epoch: 3, train_loss: 0.9629, test_loss: 1.1927, test_f1: 0.5099
 epoch: 4, train_loss: 0.9081, test_loss: 1.0684, test_f1: 0.5396
 epoch: 5, train_loss: 0.9077, test_loss: 1.0224, test_f1: 0.5877
 epoch: 6, train_loss: 0.8691, test_loss: 1.1264, test_f1: 0.5429
 epoch: 7, train_loss: 0.8656, test_loss: 1.0688, test_f1: 0.5625
 epoch: 8, train_loss: 0.8348, test_loss: 1.1821, test_f1: 0.5237
 epoch: 9, train_loss: 0.7984, test_loss: 1.1392, test_f1: 0.5687
 epoch: 10, train_loss: 0.7831, test_loss: 1.1573, test_f1: 0.5445
 epoch: 11, train_loss: 0.7949, test_loss: 1.1445, test_f1: 0.5583
 epoch: 12, train_loss: 0.7531, test_loss: 1.2096, test_f1: 0.5243
 epoch: 13, train_loss: 0.7452, test_loss: 1.2457, test_f1: 0.5562
 epoch: 14, train_loss: 0.7241, test_loss: 1.3769, test_f1: 0.5503
 epoch: 15, train_loss: 0.7407, test_loss: 1.3333, test_f1: 0.5135
 epoch: 16, train_loss: 0.7032, test_loss: 1.1833, test_f1: 0.6432
 epoch: 17, train_loss: 0.6691, test_loss: 1.3738, test_f1: 0.5616
 epoch: 18, train_loss: 0.6715, test_loss: 1.2624, test_f1: 0.6278
 epoch: 19, train_loss: 0.6437, test_loss: 1.5381, test_f1: 0.5713
 epoch: 20, train_loss: 0.6101, test_loss: 1.3123, test_f1: 0.6153
 epoch: 21, train_loss: 0.6500, test_loss: 1.5563, test_f1: 0.5687
 epoch: 22, train_loss: 0.6090, test_loss: 1.3600, test_f1: 0.6041
 epoch: 23, train_loss: 0.5812, test_loss: 1.3600, test_f1: 0.6305
 epoch: 24, train_loss: 0.5673, test_loss: 1.6500, test_f1: 0.5932
 epoch: 25, train_loss: 0.5379, test_loss: 1.8319, test_f1: 0.5551
 epoch: 26, train_loss: 0.5354, test_loss: 1.6373, test_f1: 0.5819
 epoch: 27, train_loss: 0.5515, test_loss: 1.7094, test_f1: 0.5736
 epoch: 28, train_loss: 0.5253, test_loss: 1.6444, test_f1: 0.5941
 epoch: 29, train_loss: 0.5193, test_loss: 1.6687, test_f1: 0.5828
 epoch: 30, train_loss: 0.5450, test_loss: 1.6543, test_f1: 0.5571
 epoch: 31, train_loss: 0.4868, test_loss: 1.7977, test_f1: 0.5847
 epoch: 32, train_loss: 0.4976, test_loss: 1.8909, test_f1: 0.5805
 epoch: 33, train_loss: 0.4425, test_loss: 1.7280, test_f1: 0.6221
 epoch: 34, train_loss: 0.4698, test_loss: 1.9164, test_f1: 0.6269
 epoch: 35, train_loss: 0.4587, test_loss: 1.7915, test_f1: 0.5798
 epoch: 36, train_loss: 0.4496, test_loss: 1.9613, test_f1: 0.5990
 epoch: 37, train_loss: 0.4271, test_loss: 2.0771, test_f1: 0.5788
 epoch: 38, train_loss: 0.4428, test_loss: 1.8584, test_f1: 0.6222
 epoch: 39, train_loss: 0.4100, test_loss: 2.0515, test_f1: 0.5928
 epoch: 40, train_loss: 0.3837, test_loss: 2.0809, test_f1: 0.6181
 epoch: 41, train_loss: 0.4118, test_loss: 2.3766, test_f1: 0.5841
 epoch: 42, train_loss: 0.3792, test_loss: 2.5255, test_f1: 0.5544
 epoch: 43, train_loss: 0.3680, test_loss: 2.2587, test_f1: 0.5800
 epoch: 44, train_loss: 0.3751, test_loss: 2.2345, test_f1: 0.5992
 epoch: 45, train_loss: 0.3750, test_loss: 2.3837, test_f1: 0.5975
 epoch: 46, train_loss: 0.3693, test_loss: 2.2112, test_f1: 0.5740
 epoch: 47, train_loss: 0.3731, test_loss: 2.6435, test_f1: 0.5824
 epoch: 48, train_loss: 0.3613, test_loss: 2.6235, test_f1: 0.6022
 epoch: 49, train_loss: 0.3509, test_loss: 2.6492, test_f1: 0.5807
 epoch: 50, train_loss: 0.2947, test_loss: 2.6474, test_f1: 0.5713
 epoch: 51, train_loss: 0.2683, test_loss: 2.7751, test_f1: 0.6121
 epoch: 52, train_loss: 0.2521, test_loss: 2.9675, test_f1: 0.6089
 epoch: 53, train_loss: 0.2199, test_loss: 3.2268, test_f1: 0.5767
 epoch: 54, train_loss: 0.2463, test_loss: 3.2436, test_f1: 0.5652
 epoch: 55, train_loss: 0.2293, test_loss: 3.1035, test_f1: 0.5942
 epoch: 56, train_loss: 0.2229, test_loss: 3.3454, test_f1: 0.5891
 epoch: 57, train_loss: 0.2394, test_loss: 3.2507, test_f1: 0.5860
 epoch: 58, train_loss: 0.2383, test_loss: 3.3878, test_f1: 0.6035
 epoch: 59, train_loss: 0.2383, test_loss: 3.3280, test_f1: 0.5914
 epoch: 60, train_loss: 0.2119, test_loss: 3.1592, test_f1: 0.6335
 epoch: 61, train_loss: 0.2230, test_loss: 3.2941, test_f1: 0.5982
 epoch: 62, train_loss: 0.2096, test_loss: 3.3318, test_f1: 0.6083
 epoch: 63, train_loss: 0.1960, test_loss: 3.3048, test_f1: 0.6136
 epoch: 64, train_loss: 0.1898, test_loss: 3.4403, test_f1: 0.5565
 epoch: 65, train_loss: 0.1930, test_loss: 3.3616, test_f1: 0.6252
 epoch: 66, train_loss: 0.2049, test_loss: 3.5142, test_f1: 0.6095
 epoch: 67, train_loss: 0.1911, test_loss: 3.4877, test_f1: 0.6020
 epoch: 68, train_loss: 0.1918, test_loss: 4.1850, test_f1: 0.5888
 epoch: 69, train_loss: 0.2634, test_loss: 3.3439, test_f1: 0.5904
 epoch: 70, train_loss: 0.2308, test_loss: 3.4463, test_f1: 0.5913
 epoch: 71, train_loss: 0.1824, test_loss: 3.3580, test_f1: 0.6003
 epoch: 72, train_loss: 0.1762, test_loss: 3.3993, test_f1: 0.5947
 epoch: 73, train_loss: 0.1661, test_loss: 3.3817, test_f1: 0.5980
 epoch: 74, train_loss: 0.1671, test_loss: 3.5964, test_f1: 0.6043
 epoch: 75, train_loss: 0.1746, test_loss: 3.3799, test_f1: 0.6010
 epoch: 76, train_loss: 0.1695, test_loss: 3.7934, test_f1: 0.5896
 epoch: 77, train_loss: 0.1726, test_loss: 3.5510, test_f1: 0.6193
 epoch: 78, train_loss: 0.1689, test_loss: 3.4778, test_f1: 0.6066
 epoch: 79, train_loss: 0.1505, test_loss: 3.7063, test_f1: 0.6057
 epoch: 80, train_loss: 0.1544, test_loss: 3.8437, test_f1: 0.5829
 epoch: 81, train_loss: 0.2194, test_loss: 3.6289, test_f1: 0.5873
 epoch: 82, train_loss: 0.1761, test_loss: 3.5686, test_f1: 0.6198
 epoch: 83, train_loss: 0.1648, test_loss: 3.6022, test_f1: 0.6124
 epoch: 84, train_loss: 0.1431, test_loss: 3.8980, test_f1: 0.6095
 epoch: 85, train_loss: 0.1546, test_loss: 3.8958, test_f1: 0.6058
 epoch: 86, train_loss: 0.1447, test_loss: 3.9918, test_f1: 0.6321
 epoch: 87, train_loss: 0.1247, test_loss: 4.1343, test_f1: 0.5993
 epoch: 88, train_loss: 0.1535, test_loss: 4.1502, test_f1: 0.5837
 epoch: 89, train_loss: 0.1505, test_loss: 4.0684, test_f1: 0.5766
 epoch: 90, train_loss: 0.1471, test_loss: 4.5200, test_f1: 0.5801
 epoch: 91, train_loss: 0.1299, test_loss: 4.4202, test_f1: 0.5965
 epoch: 92, train_loss: 0.1424, test_loss: 4.4789, test_f1: 0.5781
 epoch: 93, train_loss: 0.1515, test_loss: 4.2721, test_f1: 0.5920
 epoch: 94, train_loss: 0.1269, test_loss: 4.1849, test_f1: 0.5989
 epoch: 95, train_loss: 0.1230, test_loss: 4.3285, test_f1: 0.5792
 epoch: 96, train_loss: 0.1238, test_loss: 4.3440, test_f1: 0.5977
 epoch: 97, train_loss: 0.1059, test_loss: 4.3250, test_f1: 0.6098
 epoch: 98, train_loss: 0.1385, test_loss: 4.0132, test_f1: 0.6049
 epoch: 99, train_loss: 0.1311, test_loss: 4.0875, test_f1: 0.6175
##################ITERATION #1 ****************************************
 epoch: 0, train_loss: 1.1500, test_loss: 1.2699, test_f1: 0.3246
 epoch: 1, train_loss: 1.0291, test_loss: 1.1434, test_f1: 0.4522
 epoch: 2, train_loss: 0.9780, test_loss: 1.0398, test_f1: 0.5342
 epoch: 3, train_loss: 0.9201, test_loss: 1.0037, test_f1: 0.5577
 epoch: 4, train_loss: 0.9034, test_loss: 1.0421, test_f1: 0.5504
 epoch: 5, train_loss: 0.8744, test_loss: 1.0709, test_f1: 0.5583
 epoch: 6, train_loss: 0.8557, test_loss: 1.0494, test_f1: 0.5931
 epoch: 7, train_loss: 0.8279, test_loss: 1.1553, test_f1: 0.5736
 epoch: 8, train_loss: 0.8207, test_loss: 1.1022, test_f1: 0.5422
 epoch: 9, train_loss: 0.7900, test_loss: 1.3258, test_f1: 0.5574
 epoch: 10, train_loss: 0.7826, test_loss: 1.1728, test_f1: 0.5315
 epoch: 11, train_loss: 0.7539, test_loss: 1.1865, test_f1: 0.5344
 epoch: 12, train_loss: 0.7177, test_loss: 1.2099, test_f1: 0.5424
 epoch: 13, train_loss: 0.7416, test_loss: 1.3470, test_f1: 0.5432
 epoch: 14, train_loss: 0.7152, test_loss: 1.0631, test_f1: 0.5573
 epoch: 15, train_loss: 0.6705, test_loss: 1.3419, test_f1: 0.5919
 epoch: 16, train_loss: 0.6739, test_loss: 1.3588, test_f1: 0.6038
 epoch: 17, train_loss: 0.6595, test_loss: 1.1788, test_f1: 0.6114
 epoch: 18, train_loss: 0.6587, test_loss: 1.3145, test_f1: 0.5799
 epoch: 19, train_loss: 0.6415, test_loss: 1.2792, test_f1: 0.5915
 epoch: 20, train_loss: 0.6050, test_loss: 1.2456, test_f1: 0.6140
 epoch: 21, train_loss: 0.6010, test_loss: 1.2331, test_f1: 0.6240
 epoch: 22, train_loss: 0.5884, test_loss: 1.3279, test_f1: 0.6438
 epoch: 23, train_loss: 0.5951, test_loss: 1.4153, test_f1: 0.5902
 epoch: 24, train_loss: 0.5512, test_loss: 1.4963, test_f1: 0.5659
 epoch: 25, train_loss: 0.5701, test_loss: 1.7175, test_f1: 0.5852
 epoch: 26, train_loss: 0.5629, test_loss: 1.4786, test_f1: 0.5828
 epoch: 27, train_loss: 0.5382, test_loss: 1.7116, test_f1: 0.5675
 epoch: 28, train_loss: 0.5547, test_loss: 1.3862, test_f1: 0.6220
 epoch: 29, train_loss: 0.4954, test_loss: 1.4840, test_f1: 0.5612
 epoch: 30, train_loss: 0.4707, test_loss: 1.5206, test_f1: 0.5968
 epoch: 31, train_loss: 0.4891, test_loss: 1.8303, test_f1: 0.5544
 epoch: 32, train_loss: 0.4911, test_loss: 1.7355, test_f1: 0.5291
 epoch: 33, train_loss: 0.4822, test_loss: 2.0644, test_f1: 0.5372
 epoch: 34, train_loss: 0.4451, test_loss: 2.0150, test_f1: 0.5169
 epoch: 35, train_loss: 0.4421, test_loss: 2.0869, test_f1: 0.5716
 epoch: 36, train_loss: 0.4517, test_loss: 2.0137, test_f1: 0.5588
 epoch: 37, train_loss: 0.4524, test_loss: 2.4203, test_f1: 0.5590
 epoch: 38, train_loss: 0.4546, test_loss: 2.1455, test_f1: 0.5575
 epoch: 39, train_loss: 0.3954, test_loss: 1.7588, test_f1: 0.5988
 epoch: 40, train_loss: 0.4144, test_loss: 2.1642, test_f1: 0.5836
 epoch: 41, train_loss: 0.4650, test_loss: 2.1964, test_f1: 0.5900
 epoch: 42, train_loss: 0.4501, test_loss: 2.0302, test_f1: 0.5376
 epoch: 43, train_loss: 0.4083, test_loss: 2.2371, test_f1: 0.5503
 epoch: 44, train_loss: 0.4006, test_loss: 2.0105, test_f1: 0.5434
 epoch: 45, train_loss: 0.3458, test_loss: 2.0828, test_f1: 0.5772
 epoch: 46, train_loss: 0.3862, test_loss: 1.7913, test_f1: 0.6160
 epoch: 47, train_loss: 0.3748, test_loss: 1.9619, test_f1: 0.6208
 epoch: 48, train_loss: 0.3877, test_loss: 2.1584, test_f1: 0.5606
 epoch: 49, train_loss: 0.4097, test_loss: 1.8471, test_f1: 0.6081
 epoch: 50, train_loss: 0.3615, test_loss: 2.3408, test_f1: 0.5648
 epoch: 51, train_loss: 0.3325, test_loss: 1.9705, test_f1: 0.6312
 epoch: 52, train_loss: 0.2781, test_loss: 2.1871, test_f1: 0.6074
 epoch: 53, train_loss: 0.2447, test_loss: 2.2637, test_f1: 0.5786
 epoch: 54, train_loss: 0.2745, test_loss: 2.3506, test_f1: 0.5364
 epoch: 55, train_loss: 0.2475, test_loss: 2.5529, test_f1: 0.5695
 epoch: 56, train_loss: 0.2565, test_loss: 2.5499, test_f1: 0.5738
 epoch: 57, train_loss: 0.2530, test_loss: 2.5991, test_f1: 0.5665
 epoch: 58, train_loss: 0.2553, test_loss: 2.4613, test_f1: 0.5775
 epoch: 59, train_loss: 0.2405, test_loss: 2.4522, test_f1: 0.6160
 epoch: 60, train_loss: 0.2262, test_loss: 2.8277, test_f1: 0.5406
 epoch: 61, train_loss: 0.2222, test_loss: 2.9083, test_f1: 0.5952
 epoch: 62, train_loss: 0.2294, test_loss: 2.9110, test_f1: 0.5533
 epoch: 63, train_loss: 0.2199, test_loss: 2.7854, test_f1: 0.5504
 epoch: 64, train_loss: 0.2241, test_loss: 2.7039, test_f1: 0.5881
 epoch: 65, train_loss: 0.2116, test_loss: 2.8352, test_f1: 0.6064
 epoch: 66, train_loss: 0.1995, test_loss: 2.8401, test_f1: 0.5971
 epoch: 67, train_loss: 0.2148, test_loss: 2.6938, test_f1: 0.5992
 epoch: 68, train_loss: 0.1887, test_loss: 2.9035, test_f1: 0.5779
 epoch: 69, train_loss: 0.1831, test_loss: 3.0112, test_f1: 0.5960
 epoch: 70, train_loss: 0.1808, test_loss: 3.1306, test_f1: 0.5696
 epoch: 71, train_loss: 0.2187, test_loss: 3.0686, test_f1: 0.5801
 epoch: 72, train_loss: 0.1922, test_loss: 3.0374, test_f1: 0.5935
 epoch: 73, train_loss: 0.1684, test_loss: 3.1688, test_f1: 0.5714
 epoch: 74, train_loss: 0.1740, test_loss: 2.9637, test_f1: 0.5886
 epoch: 75, train_loss: 0.2133, test_loss: 3.3907, test_f1: 0.6093
 epoch: 76, train_loss: 0.2072, test_loss: 2.7575, test_f1: 0.6024
 epoch: 77, train_loss: 0.1716, test_loss: 2.7559, test_f1: 0.6046
 epoch: 78, train_loss: 0.1789, test_loss: 3.1666, test_f1: 0.5840
 epoch: 79, train_loss: 0.1713, test_loss: 3.4768, test_f1: 0.6185
 epoch: 80, train_loss: 0.1753, test_loss: 3.3885, test_f1: 0.5885
 epoch: 81, train_loss: 0.1618, test_loss: 3.5637, test_f1: 0.5872
 epoch: 82, train_loss: 0.1680, test_loss: 3.5420, test_f1: 0.5590
 epoch: 83, train_loss: 0.1974, test_loss: 3.0958, test_f1: 0.5951
 epoch: 84, train_loss: 0.2011, test_loss: 2.7974, test_f1: 0.6054
 epoch: 85, train_loss: 0.1636, test_loss: 3.2002, test_f1: 0.5936
 epoch: 86, train_loss: 0.1737, test_loss: 3.4247, test_f1: 0.6011
 epoch: 87, train_loss: 0.1484, test_loss: 3.2341, test_f1: 0.6243
 epoch: 88, train_loss: 0.1428, test_loss: 2.7831, test_f1: 0.6070
 epoch: 89, train_loss: 0.1344, test_loss: 3.4157, test_f1: 0.6006
 epoch: 90, train_loss: 0.1233, test_loss: 3.5363, test_f1: 0.5573
 epoch: 91, train_loss: 0.1303, test_loss: 3.7885, test_f1: 0.6055
 epoch: 92, train_loss: 0.1489, test_loss: 3.3219, test_f1: 0.6235
 epoch: 93, train_loss: 0.1398, test_loss: 3.7028, test_f1: 0.6102
 epoch: 94, train_loss: 0.1500, test_loss: 3.5500, test_f1: 0.5717
 epoch: 95, train_loss: 0.1600, test_loss: 3.6243, test_f1: 0.6190
 epoch: 96, train_loss: 0.1671, test_loss: 3.6688, test_f1: 0.5767
 epoch: 97, train_loss: 0.1600, test_loss: 3.4860, test_f1: 0.6037
 epoch: 98, train_loss: 0.1326, test_loss: 3.4335, test_f1: 0.6030
 epoch: 99, train_loss: 0.1281, test_loss: 3.8474, test_f1: 0.5829
##################ITERATION #2 ****************************************
 epoch: 0, train_loss: 1.1774, test_loss: 1.2459, test_f1: 0.2619
 epoch: 1, train_loss: 1.0161, test_loss: 1.0748, test_f1: 0.4595
 epoch: 2, train_loss: 0.9575, test_loss: 1.0516, test_f1: 0.5156
 epoch: 3, train_loss: 0.9379, test_loss: 1.0682, test_f1: 0.5409
 epoch: 4, train_loss: 0.9021, test_loss: 1.0778, test_f1: 0.5607
 epoch: 5, train_loss: 0.8611, test_loss: 1.1015, test_f1: 0.5535
 epoch: 6, train_loss: 0.8543, test_loss: 1.0853, test_f1: 0.5577
 epoch: 7, train_loss: 0.8472, test_loss: 1.0589, test_f1: 0.5761
 epoch: 8, train_loss: 0.8244, test_loss: 1.0461, test_f1: 0.5709
 epoch: 9, train_loss: 0.8022, test_loss: 1.1062, test_f1: 0.5877
 epoch: 10, train_loss: 0.7945, test_loss: 1.1625, test_f1: 0.5514
 epoch: 11, train_loss: 0.7778, test_loss: 1.2695, test_f1: 0.5760
 epoch: 12, train_loss: 0.7661, test_loss: 1.1469, test_f1: 0.5647
 epoch: 13, train_loss: 0.7797, test_loss: 1.2187, test_f1: 0.5707
 epoch: 14, train_loss: 0.7458, test_loss: 1.3053, test_f1: 0.5786
 epoch: 15, train_loss: 0.7328, test_loss: 1.4566, test_f1: 0.4854
 epoch: 16, train_loss: 0.7452, test_loss: 1.2012, test_f1: 0.5868
 epoch: 17, train_loss: 0.7015, test_loss: 1.2708, test_f1: 0.6012
 epoch: 18, train_loss: 0.6979, test_loss: 1.2485, test_f1: 0.6170
 epoch: 19, train_loss: 0.6835, test_loss: 1.3011, test_f1: 0.5742
 epoch: 20, train_loss: 0.6813, test_loss: 1.1922, test_f1: 0.5461
 epoch: 21, train_loss: 0.6603, test_loss: 1.2943, test_f1: 0.6206
 epoch: 22, train_loss: 0.6308, test_loss: 1.3340, test_f1: 0.6171
 epoch: 23, train_loss: 0.5937, test_loss: 1.3856, test_f1: 0.6159
 epoch: 24, train_loss: 0.6022, test_loss: 1.4001, test_f1: 0.6120
 epoch: 25, train_loss: 0.5779, test_loss: 1.4443, test_f1: 0.6052
 epoch: 26, train_loss: 0.5685, test_loss: 1.3656, test_f1: 0.6323
 epoch: 27, train_loss: 0.5742, test_loss: 1.6212, test_f1: 0.6042
 epoch: 28, train_loss: 0.5565, test_loss: 1.3549, test_f1: 0.6252
 epoch: 29, train_loss: 0.5747, test_loss: 1.5059, test_f1: 0.6040
 epoch: 30, train_loss: 0.5570, test_loss: 1.5155, test_f1: 0.5975
 epoch: 31, train_loss: 0.5151, test_loss: 1.6058, test_f1: 0.5739
 epoch: 32, train_loss: 0.5202, test_loss: 1.6751, test_f1: 0.5925
 epoch: 33, train_loss: 0.5152, test_loss: 1.2700, test_f1: 0.6235
 epoch: 34, train_loss: 0.5018, test_loss: 1.3620, test_f1: 0.6078
 epoch: 35, train_loss: 0.4765, test_loss: 1.8525, test_f1: 0.6350
 epoch: 36, train_loss: 0.4635, test_loss: 1.7769, test_f1: 0.6047
 epoch: 37, train_loss: 0.4454, test_loss: 1.8154, test_f1: 0.6021
 epoch: 38, train_loss: 0.4740, test_loss: 1.7662, test_f1: 0.6153
 epoch: 39, train_loss: 0.4677, test_loss: 1.6841, test_f1: 0.5989
 epoch: 40, train_loss: 0.4347, test_loss: 1.8911, test_f1: 0.6335
 epoch: 41, train_loss: 0.4496, test_loss: 1.9277, test_f1: 0.6117
 epoch: 42, train_loss: 0.4169, test_loss: 1.6365, test_f1: 0.6136
 epoch: 43, train_loss: 0.4050, test_loss: 1.7830, test_f1: 0.6312
 epoch: 44, train_loss: 0.3899, test_loss: 1.6416, test_f1: 0.6367
 epoch: 45, train_loss: 0.3765, test_loss: 2.0071, test_f1: 0.6245
 epoch: 46, train_loss: 0.4108, test_loss: 1.9686, test_f1: 0.6275
 epoch: 47, train_loss: 0.4441, test_loss: 2.0037, test_f1: 0.5957
 epoch: 48, train_loss: 0.4191, test_loss: 1.9411, test_f1: 0.6201
 epoch: 49, train_loss: 0.3907, test_loss: 1.8400, test_f1: 0.5835
 epoch: 50, train_loss: 0.3765, test_loss: 1.8360, test_f1: 0.6432
 epoch: 51, train_loss: 0.3381, test_loss: 1.9065, test_f1: 0.6073
 epoch: 52, train_loss: 0.2885, test_loss: 1.8971, test_f1: 0.6227
 epoch: 53, train_loss: 0.2760, test_loss: 2.1178, test_f1: 0.6212
 epoch: 54, train_loss: 0.2799, test_loss: 2.2966, test_f1: 0.6079
 epoch: 55, train_loss: 0.2883, test_loss: 2.2269, test_f1: 0.6396
 epoch: 56, train_loss: 0.2596, test_loss: 2.2250, test_f1: 0.6182
 epoch: 57, train_loss: 0.2602, test_loss: 2.3372, test_f1: 0.6374
 epoch: 58, train_loss: 0.2737, test_loss: 2.2738, test_f1: 0.6183
 epoch: 59, train_loss: 0.2278, test_loss: 2.4751, test_f1: 0.6116
 epoch: 60, train_loss: 0.2453, test_loss: 2.4200, test_f1: 0.6319
 epoch: 61, train_loss: 0.2513, test_loss: 2.6414, test_f1: 0.6193
 epoch: 62, train_loss: 0.2625, test_loss: 2.7385, test_f1: 0.6228
 epoch: 63, train_loss: 0.2334, test_loss: 2.6562, test_f1: 0.6308
 epoch: 64, train_loss: 0.2211, test_loss: 2.4402, test_f1: 0.6239
 epoch: 65, train_loss: 0.2002, test_loss: 2.7697, test_f1: 0.6063
 epoch: 66, train_loss: 0.2235, test_loss: 2.9376, test_f1: 0.6068
 epoch: 67, train_loss: 0.2127, test_loss: 2.8131, test_f1: 0.6168
 epoch: 68, train_loss: 0.2209, test_loss: 2.7991, test_f1: 0.6150
 epoch: 69, train_loss: 0.1975, test_loss: 2.8824, test_f1: 0.6169
 epoch: 70, train_loss: 0.1881, test_loss: 2.9231, test_f1: 0.5981
 epoch: 71, train_loss: 0.2135, test_loss: 2.7381, test_f1: 0.6148
 epoch: 72, train_loss: 0.2020, test_loss: 2.9558, test_f1: 0.6111
 epoch: 73, train_loss: 0.2486, test_loss: 2.9743, test_f1: 0.6210
 epoch: 74, train_loss: 0.2237, test_loss: 2.7697, test_f1: 0.6190
 epoch: 75, train_loss: 0.2111, test_loss: 2.8874, test_f1: 0.6231
 epoch: 76, train_loss: 0.1918, test_loss: 2.9748, test_f1: 0.6299
 epoch: 77, train_loss: 0.1991, test_loss: 3.1390, test_f1: 0.6210
 epoch: 78, train_loss: 0.1991, test_loss: 3.3476, test_f1: 0.6154
 epoch: 79, train_loss: 0.2157, test_loss: 3.0459, test_f1: 0.6165
 epoch: 80, train_loss: 0.1977, test_loss: 3.1446, test_f1: 0.6212
 epoch: 81, train_loss: 0.1872, test_loss: 3.0062, test_f1: 0.6205
 epoch: 82, train_loss: 0.1850, test_loss: 3.2896, test_f1: 0.6189
 epoch: 83, train_loss: 0.1890, test_loss: 3.2793, test_f1: 0.6377
 epoch: 84, train_loss: 0.1772, test_loss: 3.3546, test_f1: 0.6313
 epoch: 85, train_loss: 0.1791, test_loss: 3.4402, test_f1: 0.6261
 epoch: 86, train_loss: 0.1630, test_loss: 3.4703, test_f1: 0.6344
 epoch: 87, train_loss: 0.1771, test_loss: 3.6085, test_f1: 0.5814
 epoch: 88, train_loss: 0.1890, test_loss: 3.5804, test_f1: 0.6293
 epoch: 89, train_loss: 0.1770, test_loss: 3.5603, test_f1: 0.6226
 epoch: 90, train_loss: 0.2050, test_loss: 3.5819, test_f1: 0.6141
 epoch: 91, train_loss: 0.1719, test_loss: 3.1525, test_f1: 0.6467
 epoch: 92, train_loss: 0.2048, test_loss: 3.3543, test_f1: 0.6068
 epoch: 93, train_loss: 0.1660, test_loss: 3.8930, test_f1: 0.6052
 epoch: 94, train_loss: 0.1799, test_loss: 3.3466, test_f1: 0.6385
 epoch: 95, train_loss: 0.1837, test_loss: 2.9947, test_f1: 0.6423
 epoch: 96, train_loss: 0.1857, test_loss: 3.4036, test_f1: 0.6239
 epoch: 97, train_loss: 0.1864, test_loss: 3.1962, test_f1: 0.6491
 epoch: 98, train_loss: 0.1828, test_loss: 3.0954, test_f1: 0.6397
 epoch: 99, train_loss: 0.1615, test_loss: 3.4372, test_f1: 0.6084
##################ITERATION #3 ****************************************
 epoch: 0, train_loss: 1.2019, test_loss: 1.2222, test_f1: 0.2327
 epoch: 1, train_loss: 1.0498, test_loss: 1.1132, test_f1: 0.4307
 epoch: 2, train_loss: 0.9799, test_loss: 1.1114, test_f1: 0.4674
 epoch: 3, train_loss: 0.9246, test_loss: 1.1358, test_f1: 0.4645
 epoch: 4, train_loss: 0.9036, test_loss: 1.0284, test_f1: 0.5447
 epoch: 5, train_loss: 0.8882, test_loss: 1.0873, test_f1: 0.5446
 epoch: 6, train_loss: 0.8630, test_loss: 0.9832, test_f1: 0.5824
 epoch: 7, train_loss: 0.8232, test_loss: 1.1599, test_f1: 0.5602
 epoch: 8, train_loss: 0.8410, test_loss: 1.0385, test_f1: 0.5592
 epoch: 9, train_loss: 0.8502, test_loss: 1.0710, test_f1: 0.5529
 epoch: 10, train_loss: 0.8132, test_loss: 1.0822, test_f1: 0.6146
 epoch: 11, train_loss: 0.7932, test_loss: 1.0925, test_f1: 0.5107
 epoch: 12, train_loss: 0.8138, test_loss: 1.0522, test_f1: 0.6075
 epoch: 13, train_loss: 0.7719, test_loss: 1.1135, test_f1: 0.5823
 epoch: 14, train_loss: 0.7598, test_loss: 1.1611, test_f1: 0.5780
 epoch: 15, train_loss: 0.7442, test_loss: 1.2209, test_f1: 0.5852
 epoch: 16, train_loss: 0.7289, test_loss: 1.2018, test_f1: 0.5549
 epoch: 17, train_loss: 0.7217, test_loss: 1.1908, test_f1: 0.6068
 epoch: 18, train_loss: 0.6814, test_loss: 1.2392, test_f1: 0.5742
 epoch: 19, train_loss: 0.6623, test_loss: 1.2476, test_f1: 0.5887
 epoch: 20, train_loss: 0.6850, test_loss: 1.4181, test_f1: 0.5496
 epoch: 21, train_loss: 0.6624, test_loss: 1.6019, test_f1: 0.5440
 epoch: 22, train_loss: 0.6486, test_loss: 1.3604, test_f1: 0.5744
 epoch: 23, train_loss: 0.6358, test_loss: 1.4138, test_f1: 0.6002
 epoch: 24, train_loss: 0.6119, test_loss: 1.3334, test_f1: 0.5748
 epoch: 25, train_loss: 0.6052, test_loss: 1.5213, test_f1: 0.5529
 epoch: 26, train_loss: 0.6033, test_loss: 1.3538, test_f1: 0.5952
 epoch: 27, train_loss: 0.6101, test_loss: 1.4831, test_f1: 0.5486
 epoch: 28, train_loss: 0.5627, test_loss: 1.5719, test_f1: 0.5462
 epoch: 29, train_loss: 0.5704, test_loss: 1.4636, test_f1: 0.5588
 epoch: 30, train_loss: 0.5737, test_loss: 1.4363, test_f1: 0.6163
 epoch: 31, train_loss: 0.5291, test_loss: 1.7192, test_f1: 0.5417
 epoch: 32, train_loss: 0.5032, test_loss: 1.6988, test_f1: 0.5632
 epoch: 33, train_loss: 0.5233, test_loss: 1.4545, test_f1: 0.5948
 epoch: 34, train_loss: 0.5072, test_loss: 1.9376, test_f1: 0.5678
 epoch: 35, train_loss: 0.4835, test_loss: 1.7376, test_f1: 0.5311
 epoch: 36, train_loss: 0.4891, test_loss: 1.7738, test_f1: 0.5823
 epoch: 37, train_loss: 0.4768, test_loss: 1.7145, test_f1: 0.5805
 epoch: 38, train_loss: 0.4483, test_loss: 1.6821, test_f1: 0.5820
 epoch: 39, train_loss: 0.4629, test_loss: 2.7470, test_f1: 0.5302
 epoch: 40, train_loss: 0.4593, test_loss: 2.1934, test_f1: 0.5681
 epoch: 41, train_loss: 0.5085, test_loss: 1.5083, test_f1: 0.6107
 epoch: 42, train_loss: 0.4648, test_loss: 2.0048, test_f1: 0.5485
 epoch: 43, train_loss: 0.4584, test_loss: 1.8098, test_f1: 0.5423
 epoch: 44, train_loss: 0.4359, test_loss: 1.8403, test_f1: 0.5303
 epoch: 45, train_loss: 0.4057, test_loss: 1.7563, test_f1: 0.5505
 epoch: 46, train_loss: 0.4295, test_loss: 2.0784, test_f1: 0.5627
 epoch: 47, train_loss: 0.3951, test_loss: 1.8733, test_f1: 0.5765
 epoch: 48, train_loss: 0.4201, test_loss: 1.8037, test_f1: 0.5932
 epoch: 49, train_loss: 0.3594, test_loss: 1.8608, test_f1: 0.5606
 epoch: 50, train_loss: 0.3833, test_loss: 2.0358, test_f1: 0.5680
 epoch: 51, train_loss: 0.3240, test_loss: 2.2696, test_f1: 0.5634
 epoch: 52, train_loss: 0.2906, test_loss: 2.1852, test_f1: 0.5739
 epoch: 53, train_loss: 0.2861, test_loss: 2.1504, test_f1: 0.5912
 epoch: 54, train_loss: 0.2723, test_loss: 2.4408, test_f1: 0.5819
 epoch: 55, train_loss: 0.2408, test_loss: 2.4168, test_f1: 0.5955
 epoch: 56, train_loss: 0.2578, test_loss: 2.4739, test_f1: 0.5841
 epoch: 57, train_loss: 0.2628, test_loss: 2.7241, test_f1: 0.5926
 epoch: 58, train_loss: 0.2292, test_loss: 2.7525, test_f1: 0.5924
 epoch: 59, train_loss: 0.2393, test_loss: 2.6490, test_f1: 0.5707
 epoch: 60, train_loss: 0.2429, test_loss: 2.7698, test_f1: 0.5744
 epoch: 61, train_loss: 0.2590, test_loss: 2.7009, test_f1: 0.5655
 epoch: 62, train_loss: 0.2572, test_loss: 2.7391, test_f1: 0.5618
 epoch: 63, train_loss: 0.2462, test_loss: 2.9250, test_f1: 0.5612
 epoch: 64, train_loss: 0.2627, test_loss: 2.8148, test_f1: 0.5908
 epoch: 65, train_loss: 0.2484, test_loss: 2.7041, test_f1: 0.5642
 epoch: 66, train_loss: 0.2303, test_loss: 2.8710, test_f1: 0.5592
 epoch: 67, train_loss: 0.2355, test_loss: 2.7639, test_f1: 0.5747
 epoch: 68, train_loss: 0.2186, test_loss: 2.8584, test_f1: 0.5635
 epoch: 69, train_loss: 0.2300, test_loss: 2.8976, test_f1: 0.5526
 epoch: 70, train_loss: 0.2249, test_loss: 2.9355, test_f1: 0.5753
 epoch: 71, train_loss: 0.2174, test_loss: 2.9941, test_f1: 0.5748
 epoch: 72, train_loss: 0.2029, test_loss: 2.7673, test_f1: 0.5769
 epoch: 73, train_loss: 0.2051, test_loss: 3.0530, test_f1: 0.5744
 epoch: 74, train_loss: 0.1804, test_loss: 3.0485, test_f1: 0.5879
 epoch: 75, train_loss: 0.2203, test_loss: 2.9799, test_f1: 0.5821
 epoch: 76, train_loss: 0.1861, test_loss: 3.0044, test_f1: 0.6043
 epoch: 77, train_loss: 0.1980, test_loss: 3.0849, test_f1: 0.6282
 epoch: 78, train_loss: 0.1781, test_loss: 2.9471, test_f1: 0.5541
 epoch: 79, train_loss: 0.1744, test_loss: 3.2647, test_f1: 0.5614
 epoch: 80, train_loss: 0.2074, test_loss: 2.9954, test_f1: 0.5729
 epoch: 81, train_loss: 0.1728, test_loss: 3.0094, test_f1: 0.5864
 epoch: 82, train_loss: 0.2026, test_loss: 3.6774, test_f1: 0.5458
 epoch: 83, train_loss: 0.2169, test_loss: 3.1135, test_f1: 0.5686
 epoch: 84, train_loss: 0.1922, test_loss: 2.8716, test_f1: 0.5618
 epoch: 85, train_loss: 0.2042, test_loss: 3.3765, test_f1: 0.5867
 epoch: 86, train_loss: 0.1885, test_loss: 3.1775, test_f1: 0.6125
 epoch: 87, train_loss: 0.1606, test_loss: 3.2046, test_f1: 0.5442
 epoch: 88, train_loss: 0.1775, test_loss: 3.0464, test_f1: 0.5786
 epoch: 89, train_loss: 0.1637, test_loss: 3.7576, test_f1: 0.5859
 epoch: 90, train_loss: 0.1643, test_loss: 3.4780, test_f1: 0.5777
 epoch: 91, train_loss: 0.1604, test_loss: 3.3583, test_f1: 0.5768
 epoch: 92, train_loss: 0.1550, test_loss: 3.7047, test_f1: 0.5720
 epoch: 93, train_loss: 0.1318, test_loss: 3.6295, test_f1: 0.5707
 epoch: 94, train_loss: 0.1618, test_loss: 3.4569, test_f1: 0.5906
 epoch: 95, train_loss: 0.1912, test_loss: 3.6920, test_f1: 0.5738
 epoch: 96, train_loss: 0.1788, test_loss: 3.6211, test_f1: 0.5791
 epoch: 97, train_loss: 0.1662, test_loss: 3.5391, test_f1: 0.5709
 epoch: 98, train_loss: 0.1578, test_loss: 3.7219, test_f1: 0.5787
 epoch: 99, train_loss: 0.1620, test_loss: 3.4964, test_f1: 0.5585
##################ITERATION #4 ****************************************
 epoch: 0, train_loss: 1.2509, test_loss: 1.3251, test_f1: 0.1365
 epoch: 1, train_loss: 1.0670, test_loss: 1.1907, test_f1: 0.3405
 epoch: 2, train_loss: 0.9880, test_loss: 1.1306, test_f1: 0.5071
 epoch: 3, train_loss: 0.9453, test_loss: 1.0824, test_f1: 0.5264
 epoch: 4, train_loss: 0.9101, test_loss: 1.0676, test_f1: 0.5457
 epoch: 5, train_loss: 0.9123, test_loss: 1.0294, test_f1: 0.5524
 epoch: 6, train_loss: 0.8974, test_loss: 1.0524, test_f1: 0.5666
 epoch: 7, train_loss: 0.8584, test_loss: 1.0843, test_f1: 0.5756
 epoch: 8, train_loss: 0.8331, test_loss: 1.0507, test_f1: 0.5435
 epoch: 9, train_loss: 0.8230, test_loss: 1.1367, test_f1: 0.5086
 epoch: 10, train_loss: 0.8155, test_loss: 1.0481, test_f1: 0.5829
 epoch: 11, train_loss: 0.7754, test_loss: 1.2015, test_f1: 0.5773
 epoch: 12, train_loss: 0.7862, test_loss: 1.2083, test_f1: 0.5445
 epoch: 13, train_loss: 0.7566, test_loss: 1.1664, test_f1: 0.5833
 epoch: 14, train_loss: 0.7509, test_loss: 1.2139, test_f1: 0.6114
 epoch: 15, train_loss: 0.7188, test_loss: 1.2088, test_f1: 0.5845
 epoch: 16, train_loss: 0.7306, test_loss: 1.1894, test_f1: 0.5598
 epoch: 17, train_loss: 0.6795, test_loss: 1.2137, test_f1: 0.5941
 epoch: 18, train_loss: 0.6636, test_loss: 1.3044, test_f1: 0.5961
 epoch: 19, train_loss: 0.6830, test_loss: 1.1700, test_f1: 0.5655
 epoch: 20, train_loss: 0.6440, test_loss: 1.1656, test_f1: 0.6096
 epoch: 21, train_loss: 0.6343, test_loss: 1.3591, test_f1: 0.6156
 epoch: 22, train_loss: 0.6239, test_loss: 1.3585, test_f1: 0.6161
 epoch: 23, train_loss: 0.6605, test_loss: 1.1666, test_f1: 0.6293
 epoch: 24, train_loss: 0.5892, test_loss: 1.1897, test_f1: 0.6188
 epoch: 25, train_loss: 0.5714, test_loss: 1.5087, test_f1: 0.5929
 epoch: 26, train_loss: 0.5626, test_loss: 1.4067, test_f1: 0.5711
 epoch: 27, train_loss: 0.5998, test_loss: 1.3178, test_f1: 0.6221
 epoch: 28, train_loss: 0.5806, test_loss: 1.4250, test_f1: 0.5841
 epoch: 29, train_loss: 0.5296, test_loss: 1.3412, test_f1: 0.6117
 epoch: 30, train_loss: 0.5084, test_loss: 1.5422, test_f1: 0.6294
 epoch: 31, train_loss: 0.4965, test_loss: 1.5464, test_f1: 0.6181
 epoch: 32, train_loss: 0.5361, test_loss: 1.4789, test_f1: 0.6105
 epoch: 33, train_loss: 0.5207, test_loss: 1.3779, test_f1: 0.6009
 epoch: 34, train_loss: 0.4960, test_loss: 1.7681, test_f1: 0.5976
 epoch: 35, train_loss: 0.4928, test_loss: 1.4727, test_f1: 0.5881
 epoch: 36, train_loss: 0.5109, test_loss: 1.5617, test_f1: 0.5839
 epoch: 37, train_loss: 0.4922, test_loss: 1.6316, test_f1: 0.5915
 epoch: 38, train_loss: 0.4708, test_loss: 2.0034, test_f1: 0.6098
 epoch: 39, train_loss: 0.4658, test_loss: 1.5097, test_f1: 0.5933
 epoch: 40, train_loss: 0.4721, test_loss: 1.4779, test_f1: 0.5943
 epoch: 41, train_loss: 0.4322, test_loss: 1.4770, test_f1: 0.6369
 epoch: 42, train_loss: 0.4569, test_loss: 1.4103, test_f1: 0.6112
 epoch: 43, train_loss: 0.4641, test_loss: 1.5806, test_f1: 0.5772
 epoch: 44, train_loss: 0.4282, test_loss: 1.4683, test_f1: 0.5995
 epoch: 45, train_loss: 0.3973, test_loss: 1.8755, test_f1: 0.6132
 epoch: 46, train_loss: 0.4046, test_loss: 1.7310, test_f1: 0.6153
 epoch: 47, train_loss: 0.3753, test_loss: 1.6654, test_f1: 0.6421
 epoch: 48, train_loss: 0.4214, test_loss: 1.6602, test_f1: 0.6197
 epoch: 49, train_loss: 0.4264, test_loss: 1.6893, test_f1: 0.6339
 epoch: 50, train_loss: 0.3977, test_loss: 1.7893, test_f1: 0.5942
 epoch: 51, train_loss: 0.3674, test_loss: 1.6533, test_f1: 0.6026
 epoch: 52, train_loss: 0.3168, test_loss: 2.0419, test_f1: 0.6080
 epoch: 53, train_loss: 0.3047, test_loss: 2.0147, test_f1: 0.5923
 epoch: 54, train_loss: 0.3129, test_loss: 2.0618, test_f1: 0.6160
 epoch: 55, train_loss: 0.2702, test_loss: 2.0734, test_f1: 0.5837
 epoch: 56, train_loss: 0.2875, test_loss: 2.1106, test_f1: 0.5970
 epoch: 57, train_loss: 0.2814, test_loss: 1.9919, test_f1: 0.6086
 epoch: 58, train_loss: 0.2448, test_loss: 2.3363, test_f1: 0.5912
 epoch: 59, train_loss: 0.2496, test_loss: 2.2078, test_f1: 0.5900
 epoch: 60, train_loss: 0.2572, test_loss: 2.3582, test_f1: 0.5988
 epoch: 61, train_loss: 0.2687, test_loss: 2.7406, test_f1: 0.5817
 epoch: 62, train_loss: 0.2681, test_loss: 2.1233, test_f1: 0.6092
 epoch: 63, train_loss: 0.2651, test_loss: 2.1532, test_f1: 0.6266
 epoch: 64, train_loss: 0.2413, test_loss: 2.2766, test_f1: 0.5988
 epoch: 65, train_loss: 0.2399, test_loss: 2.4359, test_f1: 0.5894
 epoch: 66, train_loss: 0.2710, test_loss: 2.3568, test_f1: 0.6053
 epoch: 67, train_loss: 0.2497, test_loss: 2.3809, test_f1: 0.5390
 epoch: 68, train_loss: 0.2793, test_loss: 2.4222, test_f1: 0.6116
 epoch: 69, train_loss: 0.2643, test_loss: 2.4995, test_f1: 0.5898
 epoch: 70, train_loss: 0.2388, test_loss: 2.4993, test_f1: 0.5976
 epoch: 71, train_loss: 0.2347, test_loss: 2.4935, test_f1: 0.5751
 epoch: 72, train_loss: 0.2208, test_loss: 2.5812, test_f1: 0.6122
 epoch: 73, train_loss: 0.2320, test_loss: 2.5007, test_f1: 0.5888
 epoch: 74, train_loss: 0.2236, test_loss: 2.4243, test_f1: 0.6030
 epoch: 75, train_loss: 0.2162, test_loss: 2.3371, test_f1: 0.5820
 epoch: 76, train_loss: 0.2111, test_loss: 2.7455, test_f1: 0.6036
 epoch: 77, train_loss: 0.2161, test_loss: 2.7044, test_f1: 0.5859
 epoch: 78, train_loss: 0.2341, test_loss: 2.9386, test_f1: 0.6070
 epoch: 79, train_loss: 0.2226, test_loss: 2.6976, test_f1: 0.5725
 epoch: 80, train_loss: 0.2136, test_loss: 2.8603, test_f1: 0.5875
 epoch: 81, train_loss: 0.2107, test_loss: 2.9856, test_f1: 0.5712
 epoch: 82, train_loss: 0.2230, test_loss: 2.7687, test_f1: 0.6085
 epoch: 83, train_loss: 0.2248, test_loss: 2.6995, test_f1: 0.5902
 epoch: 84, train_loss: 0.2335, test_loss: 2.6486, test_f1: 0.6111
 epoch: 85, train_loss: 0.2085, test_loss: 2.5286, test_f1: 0.5973
 epoch: 86, train_loss: 0.1917, test_loss: 2.8014, test_f1: 0.5719
 epoch: 87, train_loss: 0.2036, test_loss: 2.8863, test_f1: 0.5903
 epoch: 88, train_loss: 0.1732, test_loss: 2.4162, test_f1: 0.6187
 epoch: 89, train_loss: 0.1701, test_loss: 2.8220, test_f1: 0.5946
 epoch: 90, train_loss: 0.1976, test_loss: 2.9924, test_f1: 0.5767
 epoch: 91, train_loss: 0.2080, test_loss: 2.7630, test_f1: 0.5850
 epoch: 92, train_loss: 0.1946, test_loss: 2.6501, test_f1: 0.5852
 epoch: 93, train_loss: 0.1899, test_loss: 3.1923, test_f1: 0.5772
 epoch: 94, train_loss: 0.1956, test_loss: 2.7982, test_f1: 0.5868
 epoch: 95, train_loss: 0.1613, test_loss: 2.8262, test_f1: 0.5917
 epoch: 96, train_loss: 0.1775, test_loss: 2.7878, test_f1: 0.6066
 epoch: 97, train_loss: 0.1767, test_loss: 2.9100, test_f1: 0.5946
 epoch: 98, train_loss: 0.1796, test_loss: 2.8313, test_f1: 0.6098
 epoch: 99, train_loss: 0.2129, test_loss: 3.1487, test_f1: 0.6175
##################ITERATION #5 ****************************************
 epoch: 0, train_loss: 1.3205, test_loss: 1.2893, test_f1: 0.2078
 epoch: 1, train_loss: 1.0356, test_loss: 1.1460, test_f1: 0.3476
 epoch: 2, train_loss: 0.9629, test_loss: 1.0905, test_f1: 0.4399
 epoch: 3, train_loss: 0.9216, test_loss: 1.0680, test_f1: 0.5134
 epoch: 4, train_loss: 0.8953, test_loss: 1.0830, test_f1: 0.5665
 epoch: 5, train_loss: 0.8861, test_loss: 1.1352, test_f1: 0.4959
 epoch: 6, train_loss: 0.8526, test_loss: 1.0514, test_f1: 0.5569
 epoch: 7, train_loss: 0.8826, test_loss: 1.0428, test_f1: 0.5743
 epoch: 8, train_loss: 0.8654, test_loss: 1.0616, test_f1: 0.5631
 epoch: 9, train_loss: 0.8517, test_loss: 1.1215, test_f1: 0.5253
 epoch: 10, train_loss: 0.8027, test_loss: 1.1203, test_f1: 0.5790
 epoch: 11, train_loss: 0.7968, test_loss: 1.0269, test_f1: 0.5978
 epoch: 12, train_loss: 0.7877, test_loss: 1.1273, test_f1: 0.5442
 epoch: 13, train_loss: 0.7806, test_loss: 1.1790, test_f1: 0.5716
 epoch: 14, train_loss: 0.7741, test_loss: 1.0112, test_f1: 0.5992
 epoch: 15, train_loss: 0.7879, test_loss: 1.1454, test_f1: 0.5774
 epoch: 16, train_loss: 0.7505, test_loss: 1.2253, test_f1: 0.5412
 epoch: 17, train_loss: 0.7349, test_loss: 1.0959, test_f1: 0.5811
 epoch: 18, train_loss: 0.7308, test_loss: 1.1975, test_f1: 0.5787
 epoch: 19, train_loss: 0.7178, test_loss: 1.1792, test_f1: 0.5701
 epoch: 20, train_loss: 0.7039, test_loss: 1.1545, test_f1: 0.5991
 epoch: 21, train_loss: 0.6689, test_loss: 1.2771, test_f1: 0.5943
 epoch: 22, train_loss: 0.6673, test_loss: 1.3707, test_f1: 0.5766
 epoch: 23, train_loss: 0.6605, test_loss: 1.3623, test_f1: 0.5407
 epoch: 24, train_loss: 0.6540, test_loss: 1.2858, test_f1: 0.5795
 epoch: 25, train_loss: 0.5976, test_loss: 1.2966, test_f1: 0.5965
 epoch: 26, train_loss: 0.6327, test_loss: 1.3865, test_f1: 0.5307
 epoch: 27, train_loss: 0.6202, test_loss: 1.5135, test_f1: 0.5251
 epoch: 28, train_loss: 0.6119, test_loss: 1.2202, test_f1: 0.6245
 epoch: 29, train_loss: 0.6219, test_loss: 1.4794, test_f1: 0.5671
 epoch: 30, train_loss: 0.6069, test_loss: 1.4381, test_f1: 0.6048
 epoch: 31, train_loss: 0.5589, test_loss: 1.4498, test_f1: 0.5793
 epoch: 32, train_loss: 0.5266, test_loss: 1.6366, test_f1: 0.5703
 epoch: 33, train_loss: 0.5630, test_loss: 1.4556, test_f1: 0.5560
 epoch: 34, train_loss: 0.5430, test_loss: 1.4613, test_f1: 0.5935
 epoch: 35, train_loss: 0.5379, test_loss: 1.5098, test_f1: 0.6177
 epoch: 36, train_loss: 0.5153, test_loss: 1.8179, test_f1: 0.5686
 epoch: 37, train_loss: 0.5118, test_loss: 1.5686, test_f1: 0.6093
 epoch: 38, train_loss: 0.4844, test_loss: 1.7149, test_f1: 0.6125
 epoch: 39, train_loss: 0.4511, test_loss: 1.9562, test_f1: 0.5899
 epoch: 40, train_loss: 0.4772, test_loss: 1.7577, test_f1: 0.5972
 epoch: 41, train_loss: 0.5016, test_loss: 1.6279, test_f1: 0.5673
 epoch: 42, train_loss: 0.4796, test_loss: 1.7069, test_f1: 0.5874
 epoch: 43, train_loss: 0.4869, test_loss: 1.9772, test_f1: 0.5778
 epoch: 44, train_loss: 0.4476, test_loss: 1.9600, test_f1: 0.5575
 epoch: 45, train_loss: 0.4444, test_loss: 1.9755, test_f1: 0.5826
 epoch: 46, train_loss: 0.4536, test_loss: 1.8980, test_f1: 0.6107
 epoch: 47, train_loss: 0.4142, test_loss: 1.7006, test_f1: 0.6268
 epoch: 48, train_loss: 0.3984, test_loss: 2.1097, test_f1: 0.5320
 epoch: 49, train_loss: 0.4506, test_loss: 1.7904, test_f1: 0.5965
 epoch: 50, train_loss: 0.3930, test_loss: 1.7153, test_f1: 0.6208
 epoch: 51, train_loss: 0.3379, test_loss: 1.9310, test_f1: 0.6243
 epoch: 52, train_loss: 0.3126, test_loss: 2.1620, test_f1: 0.6067
 epoch: 53, train_loss: 0.3104, test_loss: 2.1931, test_f1: 0.6122
 epoch: 54, train_loss: 0.3251, test_loss: 2.1490, test_f1: 0.5841
 epoch: 55, train_loss: 0.2801, test_loss: 2.2422, test_f1: 0.6108
 epoch: 56, train_loss: 0.3116, test_loss: 2.3875, test_f1: 0.6058
 epoch: 57, train_loss: 0.2985, test_loss: 2.4021, test_f1: 0.5982
 epoch: 58, train_loss: 0.2744, test_loss: 2.4600, test_f1: 0.6047
 epoch: 59, train_loss: 0.2561, test_loss: 2.3658, test_f1: 0.6022
 epoch: 60, train_loss: 0.2620, test_loss: 2.6148, test_f1: 0.5855
 epoch: 61, train_loss: 0.2862, test_loss: 2.4518, test_f1: 0.6092
 epoch: 62, train_loss: 0.2829, test_loss: 2.3939, test_f1: 0.5909
 epoch: 63, train_loss: 0.2936, test_loss: 2.4118, test_f1: 0.5916
 epoch: 64, train_loss: 0.2518, test_loss: 2.4291, test_f1: 0.5826
 epoch: 65, train_loss: 0.2451, test_loss: 2.6686, test_f1: 0.5753
 epoch: 66, train_loss: 0.2291, test_loss: 2.6692, test_f1: 0.5972
 epoch: 67, train_loss: 0.2399, test_loss: 2.8897, test_f1: 0.6024
 epoch: 68, train_loss: 0.2556, test_loss: 2.6317, test_f1: 0.5945
 epoch: 69, train_loss: 0.2561, test_loss: 2.7024, test_f1: 0.5886
 epoch: 70, train_loss: 0.2364, test_loss: 2.7841, test_f1: 0.5980
 epoch: 71, train_loss: 0.2384, test_loss: 2.7933, test_f1: 0.5785
 epoch: 72, train_loss: 0.2252, test_loss: 3.0151, test_f1: 0.5984
 epoch: 73, train_loss: 0.2106, test_loss: 2.9441, test_f1: 0.5962
 epoch: 74, train_loss: 0.2176, test_loss: 2.9208, test_f1: 0.5860
 epoch: 75, train_loss: 0.2136, test_loss: 3.1872, test_f1: 0.5867
 epoch: 76, train_loss: 0.2445, test_loss: 2.9291, test_f1: 0.5591
 epoch: 77, train_loss: 0.2516, test_loss: 3.0781, test_f1: 0.5894
 epoch: 78, train_loss: 0.2187, test_loss: 3.2761, test_f1: 0.5697
 epoch: 79, train_loss: 0.2138, test_loss: 2.8999, test_f1: 0.5890
 epoch: 80, train_loss: 0.2154, test_loss: 3.0675, test_f1: 0.5984
 epoch: 81, train_loss: 0.2179, test_loss: 2.8794, test_f1: 0.5923
 epoch: 82, train_loss: 0.1900, test_loss: 3.2558, test_f1: 0.5770
 epoch: 83, train_loss: 0.1785, test_loss: 2.9549, test_f1: 0.5933
 epoch: 84, train_loss: 0.1754, test_loss: 3.1555, test_f1: 0.5658
 epoch: 85, train_loss: 0.1957, test_loss: 3.3701, test_f1: 0.5920
 epoch: 86, train_loss: 0.2163, test_loss: 3.1489, test_f1: 0.6070
 epoch: 87, train_loss: 0.1745, test_loss: 3.2657, test_f1: 0.5897
 epoch: 88, train_loss: 0.1980, test_loss: 3.3403, test_f1: 0.5910
 epoch: 89, train_loss: 0.1942, test_loss: 3.3135, test_f1: 0.5906
 epoch: 90, train_loss: 0.1822, test_loss: 3.4547, test_f1: 0.5897
 epoch: 91, train_loss: 0.1796, test_loss: 3.8661, test_f1: 0.5774
 epoch: 92, train_loss: 0.1805, test_loss: 3.5648, test_f1: 0.5917
 epoch: 93, train_loss: 0.1753, test_loss: 3.6953, test_f1: 0.5719
 epoch: 94, train_loss: 0.1950, test_loss: 3.4638, test_f1: 0.5900
 epoch: 95, train_loss: 0.1793, test_loss: 3.9003, test_f1: 0.5897
 epoch: 96, train_loss: 0.2072, test_loss: 3.1913, test_f1: 0.6050
 epoch: 97, train_loss: 0.1765, test_loss: 3.3206, test_f1: 0.5877
 epoch: 98, train_loss: 0.1891, test_loss: 3.6448, test_f1: 0.5874
 epoch: 99, train_loss: 0.1747, test_loss: 3.3946, test_f1: 0.6062
##################ITERATION #6 ****************************************
 epoch: 0, train_loss: 1.3157, test_loss: 1.3257, test_f1: 0.1365
 epoch: 1, train_loss: 1.0443, test_loss: 1.1819, test_f1: 0.3670
 epoch: 2, train_loss: 0.9537, test_loss: 1.0540, test_f1: 0.5403
 epoch: 3, train_loss: 0.9105, test_loss: 1.1158, test_f1: 0.5082
 epoch: 4, train_loss: 0.9165, test_loss: 1.0255, test_f1: 0.5626
 epoch: 5, train_loss: 0.8951, test_loss: 1.0149, test_f1: 0.5892
 epoch: 6, train_loss: 0.8744, test_loss: 1.1264, test_f1: 0.5334
 epoch: 7, train_loss: 0.8694, test_loss: 1.1149, test_f1: 0.5504
 epoch: 8, train_loss: 0.8364, test_loss: 1.0179, test_f1: 0.5630
 epoch: 9, train_loss: 0.8077, test_loss: 1.1069, test_f1: 0.5620
 epoch: 10, train_loss: 0.8130, test_loss: 1.0438, test_f1: 0.5827
 epoch: 11, train_loss: 0.7919, test_loss: 1.0623, test_f1: 0.5741
 epoch: 12, train_loss: 0.7911, test_loss: 1.0995, test_f1: 0.6028
 epoch: 13, train_loss: 0.7575, test_loss: 1.0765, test_f1: 0.5562
 epoch: 14, train_loss: 0.7629, test_loss: 1.3801, test_f1: 0.4991
 epoch: 15, train_loss: 0.7679, test_loss: 1.2301, test_f1: 0.5328
 epoch: 16, train_loss: 0.7283, test_loss: 1.2331, test_f1: 0.5950
 epoch: 17, train_loss: 0.7293, test_loss: 1.2345, test_f1: 0.5786
 epoch: 18, train_loss: 0.7101, test_loss: 1.3223, test_f1: 0.6116
 epoch: 19, train_loss: 0.6623, test_loss: 1.1410, test_f1: 0.6233
 epoch: 20, train_loss: 0.6581, test_loss: 1.1526, test_f1: 0.5510
 epoch: 21, train_loss: 0.6529, test_loss: 1.3920, test_f1: 0.5282
 epoch: 22, train_loss: 0.6711, test_loss: 1.1124, test_f1: 0.6541
 epoch: 23, train_loss: 0.6276, test_loss: 1.3400, test_f1: 0.5999
 epoch: 24, train_loss: 0.6466, test_loss: 1.3917, test_f1: 0.5567
 epoch: 25, train_loss: 0.6513, test_loss: 1.5280, test_f1: 0.5242
 epoch: 26, train_loss: 0.6115, test_loss: 1.5189, test_f1: 0.6035
 epoch: 27, train_loss: 0.6104, test_loss: 1.4995, test_f1: 0.5805
 epoch: 28, train_loss: 0.5667, test_loss: 1.4598, test_f1: 0.6045
 epoch: 29, train_loss: 0.5359, test_loss: 1.4630, test_f1: 0.6126
 epoch: 30, train_loss: 0.5759, test_loss: 1.5556, test_f1: 0.5658
 epoch: 31, train_loss: 0.5553, test_loss: 1.5815, test_f1: 0.5932
 epoch: 32, train_loss: 0.5508, test_loss: 1.4819, test_f1: 0.6088
 epoch: 33, train_loss: 0.5409, test_loss: 1.7900, test_f1: 0.6205
 epoch: 34, train_loss: 0.4920, test_loss: 1.6709, test_f1: 0.5905
 epoch: 35, train_loss: 0.4986, test_loss: 1.7173, test_f1: 0.6036
 epoch: 36, train_loss: 0.4559, test_loss: 1.7853, test_f1: 0.5964
 epoch: 37, train_loss: 0.4417, test_loss: 1.7028, test_f1: 0.6109
 epoch: 38, train_loss: 0.4997, test_loss: 1.7684, test_f1: 0.5963
 epoch: 39, train_loss: 0.5007, test_loss: 1.6507, test_f1: 0.5786
 epoch: 40, train_loss: 0.4917, test_loss: 1.6615, test_f1: 0.6123
 epoch: 41, train_loss: 0.4466, test_loss: 1.7183, test_f1: 0.6144
 epoch: 42, train_loss: 0.4771, test_loss: 2.1548, test_f1: 0.5732
 epoch: 43, train_loss: 0.4524, test_loss: 1.5958, test_f1: 0.6154
 epoch: 44, train_loss: 0.4353, test_loss: 1.6821, test_f1: 0.6241
 epoch: 45, train_loss: 0.4440, test_loss: 1.7253, test_f1: 0.5806
 epoch: 46, train_loss: 0.4178, test_loss: 2.2264, test_f1: 0.5601
 epoch: 47, train_loss: 0.4038, test_loss: 1.9503, test_f1: 0.6112
 epoch: 48, train_loss: 0.4066, test_loss: 2.0633, test_f1: 0.5800
 epoch: 49, train_loss: 0.4047, test_loss: 1.5658, test_f1: 0.6420
 epoch: 50, train_loss: 0.3773, test_loss: 2.2495, test_f1: 0.5944
 epoch: 51, train_loss: 0.3537, test_loss: 1.7967, test_f1: 0.6241
 epoch: 52, train_loss: 0.3406, test_loss: 1.9705, test_f1: 0.6139
 epoch: 53, train_loss: 0.2974, test_loss: 2.0630, test_f1: 0.6414
 epoch: 54, train_loss: 0.2864, test_loss: 2.1862, test_f1: 0.6062
 epoch: 55, train_loss: 0.2709, test_loss: 2.0794, test_f1: 0.6452
 epoch: 56, train_loss: 0.2769, test_loss: 2.1880, test_f1: 0.6327
 epoch: 57, train_loss: 0.2706, test_loss: 2.2107, test_f1: 0.6004
 epoch: 58, train_loss: 0.2726, test_loss: 2.1175, test_f1: 0.6603
 epoch: 59, train_loss: 0.2313, test_loss: 2.3724, test_f1: 0.6277
 epoch: 60, train_loss: 0.2509, test_loss: 2.4511, test_f1: 0.6174
 epoch: 61, train_loss: 0.2724, test_loss: 2.4881, test_f1: 0.6455
 epoch: 62, train_loss: 0.2571, test_loss: 2.2361, test_f1: 0.6136
 epoch: 63, train_loss: 0.2405, test_loss: 2.4804, test_f1: 0.6277
 epoch: 64, train_loss: 0.2429, test_loss: 2.4373, test_f1: 0.6141
 epoch: 65, train_loss: 0.2382, test_loss: 2.4475, test_f1: 0.6293
 epoch: 66, train_loss: 0.2414, test_loss: 2.6185, test_f1: 0.6265
 epoch: 67, train_loss: 0.2145, test_loss: 2.5933, test_f1: 0.6252
 epoch: 68, train_loss: 0.2289, test_loss: 2.6205, test_f1: 0.6203
 epoch: 69, train_loss: 0.2278, test_loss: 2.7372, test_f1: 0.6279
 epoch: 70, train_loss: 0.2195, test_loss: 2.4006, test_f1: 0.6065
 epoch: 71, train_loss: 0.2095, test_loss: 2.8439, test_f1: 0.5902
 epoch: 72, train_loss: 0.2278, test_loss: 2.5720, test_f1: 0.6382
 epoch: 73, train_loss: 0.2083, test_loss: 2.8824, test_f1: 0.6159
 epoch: 74, train_loss: 0.1998, test_loss: 3.0903, test_f1: 0.5955
 epoch: 75, train_loss: 0.1917, test_loss: 2.8123, test_f1: 0.6190
 epoch: 76, train_loss: 0.2002, test_loss: 2.7842, test_f1: 0.6346
 epoch: 77, train_loss: 0.1819, test_loss: 2.6485, test_f1: 0.6299
 epoch: 78, train_loss: 0.1904, test_loss: 3.0056, test_f1: 0.6181
 epoch: 79, train_loss: 0.2024, test_loss: 3.0425, test_f1: 0.6097
 epoch: 80, train_loss: 0.2012, test_loss: 3.1008, test_f1: 0.6294
 epoch: 81, train_loss: 0.1883, test_loss: 2.9696, test_f1: 0.5991
 epoch: 82, train_loss: 0.2012, test_loss: 3.2324, test_f1: 0.6026
 epoch: 83, train_loss: 0.1744, test_loss: 2.7942, test_f1: 0.6196
 epoch: 84, train_loss: 0.1998, test_loss: 2.8549, test_f1: 0.5878
 epoch: 85, train_loss: 0.1791, test_loss: 2.6391, test_f1: 0.6407
 epoch: 86, train_loss: 0.1938, test_loss: 3.0027, test_f1: 0.5973
 epoch: 87, train_loss: 0.1742, test_loss: 2.9605, test_f1: 0.6098
 epoch: 88, train_loss: 0.1537, test_loss: 3.2600, test_f1: 0.5934
 epoch: 89, train_loss: 0.1767, test_loss: 2.6619, test_f1: 0.6322
 epoch: 90, train_loss: 0.1987, test_loss: 3.0608, test_f1: 0.6062
 epoch: 91, train_loss: 0.1694, test_loss: 2.9206, test_f1: 0.6138
 epoch: 92, train_loss: 0.1791, test_loss: 3.2352, test_f1: 0.6008
 epoch: 93, train_loss: 0.2044, test_loss: 3.3870, test_f1: 0.5875
 epoch: 94, train_loss: 0.2096, test_loss: 2.8834, test_f1: 0.6117
 epoch: 95, train_loss: 0.1955, test_loss: 2.9846, test_f1: 0.6279
 epoch: 96, train_loss: 0.1808, test_loss: 3.2085, test_f1: 0.6088
 epoch: 97, train_loss: 0.1659, test_loss: 3.3153, test_f1: 0.6146
 epoch: 98, train_loss: 0.1568, test_loss: 2.8828, test_f1: 0.6190
 epoch: 99, train_loss: 0.1390, test_loss: 3.2604, test_f1: 0.6080
##################ITERATION #7 ****************************************
 epoch: 0, train_loss: 1.3287, test_loss: 1.5211, test_f1: 0.1736
 epoch: 1, train_loss: 1.0059, test_loss: 1.1300, test_f1: 0.3981
 epoch: 2, train_loss: 0.9683, test_loss: 1.1799, test_f1: 0.4723
 epoch: 3, train_loss: 0.9389, test_loss: 1.0812, test_f1: 0.5237
 epoch: 4, train_loss: 0.9027, test_loss: 1.0610, test_f1: 0.5398
 epoch: 5, train_loss: 0.8931, test_loss: 1.1007, test_f1: 0.5295
 epoch: 6, train_loss: 0.9067, test_loss: 1.1117, test_f1: 0.5211
 epoch: 7, train_loss: 0.8861, test_loss: 1.0430, test_f1: 0.5562
 epoch: 8, train_loss: 0.8488, test_loss: 1.2259, test_f1: 0.4785
 epoch: 9, train_loss: 0.8579, test_loss: 1.1858, test_f1: 0.5028
 epoch: 10, train_loss: 0.8348, test_loss: 1.1410, test_f1: 0.5753
 epoch: 11, train_loss: 0.8398, test_loss: 1.1039, test_f1: 0.5594
 epoch: 12, train_loss: 0.7935, test_loss: 1.1451, test_f1: 0.5808
 epoch: 13, train_loss: 0.7692, test_loss: 1.1025, test_f1: 0.5383
 epoch: 14, train_loss: 0.7588, test_loss: 1.1624, test_f1: 0.5462
 epoch: 15, train_loss: 0.7664, test_loss: 1.0669, test_f1: 0.5980
 epoch: 16, train_loss: 0.7505, test_loss: 1.2942, test_f1: 0.5696
 epoch: 17, train_loss: 0.7638, test_loss: 1.1240, test_f1: 0.5835
 epoch: 18, train_loss: 0.7287, test_loss: 1.2620, test_f1: 0.5754
 epoch: 19, train_loss: 0.6831, test_loss: 1.3218, test_f1: 0.6029
 epoch: 20, train_loss: 0.6853, test_loss: 1.3134, test_f1: 0.5943
 epoch: 21, train_loss: 0.6940, test_loss: 1.1599, test_f1: 0.6382
 epoch: 22, train_loss: 0.6733, test_loss: 1.2746, test_f1: 0.5963
 epoch: 23, train_loss: 0.6909, test_loss: 1.2524, test_f1: 0.5611
 epoch: 24, train_loss: 0.6535, test_loss: 1.3460, test_f1: 0.6138
 epoch: 25, train_loss: 0.6715, test_loss: 1.2059, test_f1: 0.5640
 epoch: 26, train_loss: 0.6677, test_loss: 1.3153, test_f1: 0.6148
 epoch: 27, train_loss: 0.6665, test_loss: 1.2892, test_f1: 0.6070
 epoch: 28, train_loss: 0.6155, test_loss: 1.3678, test_f1: 0.5920
 epoch: 29, train_loss: 0.5945, test_loss: 1.4339, test_f1: 0.6348
 epoch: 30, train_loss: 0.6222, test_loss: 1.4331, test_f1: 0.5871
 epoch: 31, train_loss: 0.5964, test_loss: 1.2960, test_f1: 0.6286
 epoch: 32, train_loss: 0.5472, test_loss: 1.5436, test_f1: 0.6223
 epoch: 33, train_loss: 0.5609, test_loss: 1.4273, test_f1: 0.6459
 epoch: 34, train_loss: 0.5538, test_loss: 1.5729, test_f1: 0.6256
 epoch: 35, train_loss: 0.5199, test_loss: 1.7157, test_f1: 0.6343
 epoch: 36, train_loss: 0.5731, test_loss: 1.9150, test_f1: 0.5558
 epoch: 37, train_loss: 0.5285, test_loss: 1.6380, test_f1: 0.5808
 epoch: 38, train_loss: 0.5480, test_loss: 1.5410, test_f1: 0.6315
 epoch: 39, train_loss: 0.5291, test_loss: 1.5907, test_f1: 0.5887
 epoch: 40, train_loss: 0.4882, test_loss: 1.8599, test_f1: 0.5968
 epoch: 41, train_loss: 0.4654, test_loss: 2.1215, test_f1: 0.5787
 epoch: 42, train_loss: 0.4636, test_loss: 2.0273, test_f1: 0.5778
 epoch: 43, train_loss: 0.5314, test_loss: 1.6994, test_f1: 0.5806
 epoch: 44, train_loss: 0.4835, test_loss: 1.7679, test_f1: 0.6009
 epoch: 45, train_loss: 0.4527, test_loss: 1.9311, test_f1: 0.5877
 epoch: 46, train_loss: 0.4416, test_loss: 1.7357, test_f1: 0.5645
 epoch: 47, train_loss: 0.4427, test_loss: 1.6916, test_f1: 0.6253
 epoch: 48, train_loss: 0.4582, test_loss: 2.4294, test_f1: 0.5039
 epoch: 49, train_loss: 0.4743, test_loss: 1.8842, test_f1: 0.6302
 epoch: 50, train_loss: 0.4447, test_loss: 2.0282, test_f1: 0.6174
 epoch: 51, train_loss: 0.4148, test_loss: 1.7196, test_f1: 0.6274
 epoch: 52, train_loss: 0.3531, test_loss: 1.8516, test_f1: 0.5971
 epoch: 53, train_loss: 0.3544, test_loss: 1.8733, test_f1: 0.5977
 epoch: 54, train_loss: 0.3238, test_loss: 2.0968, test_f1: 0.6217
 epoch: 55, train_loss: 0.3431, test_loss: 2.1573, test_f1: 0.6153
 epoch: 56, train_loss: 0.3507, test_loss: 1.9545, test_f1: 0.6109
 epoch: 57, train_loss: 0.3306, test_loss: 2.0365, test_f1: 0.6190
 epoch: 58, train_loss: 0.3188, test_loss: 2.2611, test_f1: 0.6118
 epoch: 59, train_loss: 0.3080, test_loss: 2.0776, test_f1: 0.6121
 epoch: 60, train_loss: 0.3052, test_loss: 2.2052, test_f1: 0.6157
 epoch: 61, train_loss: 0.2854, test_loss: 2.4217, test_f1: 0.6139
 epoch: 62, train_loss: 0.2853, test_loss: 2.2186, test_f1: 0.5984
 epoch: 63, train_loss: 0.2859, test_loss: 2.4363, test_f1: 0.6182
 epoch: 64, train_loss: 0.2745, test_loss: 2.5232, test_f1: 0.6065
 epoch: 65, train_loss: 0.2854, test_loss: 2.2338, test_f1: 0.6065
 epoch: 66, train_loss: 0.2721, test_loss: 2.4125, test_f1: 0.6227
 epoch: 67, train_loss: 0.2531, test_loss: 2.9318, test_f1: 0.5958
 epoch: 68, train_loss: 0.2729, test_loss: 2.6900, test_f1: 0.5990
 epoch: 69, train_loss: 0.2792, test_loss: 2.8561, test_f1: 0.6090
 epoch: 70, train_loss: 0.2659, test_loss: 2.7256, test_f1: 0.6032
 epoch: 71, train_loss: 0.2811, test_loss: 2.5466, test_f1: 0.6041
 epoch: 72, train_loss: 0.2856, test_loss: 2.4711, test_f1: 0.5839
 epoch: 73, train_loss: 0.2765, test_loss: 2.3902, test_f1: 0.6184
 epoch: 74, train_loss: 0.2434, test_loss: 2.6335, test_f1: 0.6151
 epoch: 75, train_loss: 0.2350, test_loss: 2.5207, test_f1: 0.5986
 epoch: 76, train_loss: 0.2261, test_loss: 2.5492, test_f1: 0.6274
 epoch: 77, train_loss: 0.2329, test_loss: 2.7825, test_f1: 0.5933
 epoch: 78, train_loss: 0.2298, test_loss: 2.9309, test_f1: 0.5862
 epoch: 79, train_loss: 0.2442, test_loss: 2.7172, test_f1: 0.5781
 epoch: 80, train_loss: 0.2457, test_loss: 3.0092, test_f1: 0.5955
 epoch: 81, train_loss: 0.2377, test_loss: 2.9470, test_f1: 0.5858
 epoch: 82, train_loss: 0.2479, test_loss: 3.1364, test_f1: 0.5897
 epoch: 83, train_loss: 0.2708, test_loss: 2.7253, test_f1: 0.5757
 epoch: 84, train_loss: 0.2347, test_loss: 2.8517, test_f1: 0.5954
 epoch: 85, train_loss: 0.2145, test_loss: 2.9087, test_f1: 0.5794
 epoch: 86, train_loss: 0.2374, test_loss: 2.9649, test_f1: 0.5840
 epoch: 87, train_loss: 0.2190, test_loss: 2.9467, test_f1: 0.5675
 epoch: 88, train_loss: 0.1964, test_loss: 2.9163, test_f1: 0.5925
 epoch: 89, train_loss: 0.1919, test_loss: 3.0946, test_f1: 0.5945
 epoch: 90, train_loss: 0.2144, test_loss: 3.0067, test_f1: 0.6051
 epoch: 91, train_loss: 0.2306, test_loss: 3.2421, test_f1: 0.5815
 epoch: 92, train_loss: 0.2291, test_loss: 3.0918, test_f1: 0.5895
 epoch: 93, train_loss: 0.2358, test_loss: 3.3832, test_f1: 0.5984
 epoch: 94, train_loss: 0.2489, test_loss: 3.4690, test_f1: 0.5578
 epoch: 95, train_loss: 0.2101, test_loss: 2.8625, test_f1: 0.6079
 epoch: 96, train_loss: 0.2027, test_loss: 2.9481, test_f1: 0.5991
 epoch: 97, train_loss: 0.1975, test_loss: 3.0572, test_f1: 0.6251
 epoch: 98, train_loss: 0.2036, test_loss: 3.2003, test_f1: 0.5960
 epoch: 99, train_loss: 0.1891, test_loss: 3.1713, test_f1: 0.5853
##################ITERATION #8 ****************************************
 epoch: 0, train_loss: 1.3794, test_loss: 1.3275, test_f1: 0.2372
 epoch: 1, train_loss: 1.0620, test_loss: 1.1175, test_f1: 0.4983
 epoch: 2, train_loss: 0.9923, test_loss: 1.0972, test_f1: 0.3460
 epoch: 3, train_loss: 0.9640, test_loss: 1.0800, test_f1: 0.4760
 epoch: 4, train_loss: 0.9394, test_loss: 1.0244, test_f1: 0.5168
 epoch: 5, train_loss: 0.9066, test_loss: 1.0786, test_f1: 0.5166
 epoch: 6, train_loss: 0.8817, test_loss: 0.9988, test_f1: 0.5551
 epoch: 7, train_loss: 0.8794, test_loss: 1.0739, test_f1: 0.4761
 epoch: 8, train_loss: 0.8630, test_loss: 1.0578, test_f1: 0.5487
 epoch: 9, train_loss: 0.8349, test_loss: 1.0011, test_f1: 0.5808
 epoch: 10, train_loss: 0.7939, test_loss: 0.9559, test_f1: 0.5943
 epoch: 11, train_loss: 0.8158, test_loss: 0.9992, test_f1: 0.5575
 epoch: 12, train_loss: 0.7922, test_loss: 1.1240, test_f1: 0.5553
 epoch: 13, train_loss: 0.7953, test_loss: 1.1887, test_f1: 0.5301
 epoch: 14, train_loss: 0.7400, test_loss: 0.9798, test_f1: 0.6143
 epoch: 15, train_loss: 0.7253, test_loss: 1.1094, test_f1: 0.5411
 epoch: 16, train_loss: 0.7599, test_loss: 1.1420, test_f1: 0.6120
 epoch: 17, train_loss: 0.6991, test_loss: 1.2182, test_f1: 0.5575
 epoch: 18, train_loss: 0.6919, test_loss: 1.2290, test_f1: 0.5411
 epoch: 19, train_loss: 0.7182, test_loss: 1.1500, test_f1: 0.5873
 epoch: 20, train_loss: 0.6870, test_loss: 1.3029, test_f1: 0.5051
 epoch: 21, train_loss: 0.6431, test_loss: 1.2613, test_f1: 0.5400
 epoch: 22, train_loss: 0.6426, test_loss: 1.3197, test_f1: 0.5648
 epoch: 23, train_loss: 0.6299, test_loss: 1.1864, test_f1: 0.5570
 epoch: 24, train_loss: 0.6200, test_loss: 1.2373, test_f1: 0.5625
 epoch: 25, train_loss: 0.6625, test_loss: 1.3041, test_f1: 0.5611
 epoch: 26, train_loss: 0.6005, test_loss: 1.1579, test_f1: 0.6346
 epoch: 27, train_loss: 0.5872, test_loss: 1.4237, test_f1: 0.6314
 epoch: 28, train_loss: 0.5944, test_loss: 1.3606, test_f1: 0.5570
 epoch: 29, train_loss: 0.5669, test_loss: 1.4864, test_f1: 0.5818
 epoch: 30, train_loss: 0.5471, test_loss: 1.4526, test_f1: 0.6107
 epoch: 31, train_loss: 0.5310, test_loss: 1.2348, test_f1: 0.6072
 epoch: 32, train_loss: 0.5434, test_loss: 1.4119, test_f1: 0.5976
 epoch: 33, train_loss: 0.5331, test_loss: 1.3736, test_f1: 0.5424
 epoch: 34, train_loss: 0.5104, test_loss: 1.3751, test_f1: 0.5837
 epoch: 35, train_loss: 0.5272, test_loss: 1.2487, test_f1: 0.5867
 epoch: 36, train_loss: 0.5228, test_loss: 1.3439, test_f1: 0.6185
 epoch: 37, train_loss: 0.4788, test_loss: 1.5467, test_f1: 0.5677
 epoch: 38, train_loss: 0.4656, test_loss: 1.8013, test_f1: 0.5653
 epoch: 39, train_loss: 0.4687, test_loss: 1.6723, test_f1: 0.5610
 epoch: 40, train_loss: 0.4801, test_loss: 1.5608, test_f1: 0.5735
 epoch: 41, train_loss: 0.4521, test_loss: 1.7465, test_f1: 0.5923
 epoch: 42, train_loss: 0.4282, test_loss: 1.8285, test_f1: 0.6464
 epoch: 43, train_loss: 0.4502, test_loss: 2.0942, test_f1: 0.5790
 epoch: 44, train_loss: 0.4407, test_loss: 1.7738, test_f1: 0.5633
 epoch: 45, train_loss: 0.4472, test_loss: 1.6766, test_f1: 0.6161
 epoch: 46, train_loss: 0.4617, test_loss: 1.6908, test_f1: 0.5934
 epoch: 47, train_loss: 0.4347, test_loss: 1.9238, test_f1: 0.5868
 epoch: 48, train_loss: 0.3750, test_loss: 1.9780, test_f1: 0.5697
 epoch: 49, train_loss: 0.4020, test_loss: 1.6507, test_f1: 0.6196
 epoch: 50, train_loss: 0.4201, test_loss: 1.9712, test_f1: 0.5549
 epoch: 51, train_loss: 0.3647, test_loss: 1.5585, test_f1: 0.6208
 epoch: 52, train_loss: 0.3403, test_loss: 1.8363, test_f1: 0.5729
 epoch: 53, train_loss: 0.3071, test_loss: 1.8587, test_f1: 0.6033
 epoch: 54, train_loss: 0.2952, test_loss: 2.1122, test_f1: 0.5941
 epoch: 55, train_loss: 0.3036, test_loss: 2.0578, test_f1: 0.5902
 epoch: 56, train_loss: 0.2831, test_loss: 1.9963, test_f1: 0.6230
 epoch: 57, train_loss: 0.2690, test_loss: 2.2357, test_f1: 0.6095
 epoch: 58, train_loss: 0.2734, test_loss: 2.3522, test_f1: 0.5841
 epoch: 59, train_loss: 0.2923, test_loss: 2.0535, test_f1: 0.5520
 epoch: 60, train_loss: 0.2936, test_loss: 2.0551, test_f1: 0.5992
 epoch: 61, train_loss: 0.2875, test_loss: 2.1358, test_f1: 0.5999
 epoch: 62, train_loss: 0.2552, test_loss: 2.4765, test_f1: 0.6111
 epoch: 63, train_loss: 0.2504, test_loss: 2.2989, test_f1: 0.6325
 epoch: 64, train_loss: 0.2351, test_loss: 2.4358, test_f1: 0.6070
 epoch: 65, train_loss: 0.2430, test_loss: 2.6742, test_f1: 0.5930
 epoch: 66, train_loss: 0.2521, test_loss: 2.2507, test_f1: 0.5976
 epoch: 67, train_loss: 0.2400, test_loss: 2.5330, test_f1: 0.5810
 epoch: 68, train_loss: 0.2365, test_loss: 2.4663, test_f1: 0.5654
 epoch: 69, train_loss: 0.2412, test_loss: 2.4930, test_f1: 0.5779
 epoch: 70, train_loss: 0.2330, test_loss: 2.4788, test_f1: 0.5916
 epoch: 71, train_loss: 0.2445, test_loss: 2.5096, test_f1: 0.5907
 epoch: 72, train_loss: 0.2566, test_loss: 2.2885, test_f1: 0.6015
 epoch: 73, train_loss: 0.2476, test_loss: 2.5124, test_f1: 0.5688
 epoch: 74, train_loss: 0.2264, test_loss: 2.3552, test_f1: 0.5710
 epoch: 75, train_loss: 0.2014, test_loss: 2.3689, test_f1: 0.5902
 epoch: 76, train_loss: 0.2171, test_loss: 2.5625, test_f1: 0.6051
 epoch: 77, train_loss: 0.2544, test_loss: 2.5522, test_f1: 0.6021
 epoch: 78, train_loss: 0.2248, test_loss: 2.8152, test_f1: 0.5544
 epoch: 79, train_loss: 0.2275, test_loss: 2.5081, test_f1: 0.6159
 epoch: 80, train_loss: 0.2246, test_loss: 2.6424, test_f1: 0.6261
 epoch: 81, train_loss: 0.2489, test_loss: 2.6631, test_f1: 0.6055
 epoch: 82, train_loss: 0.2783, test_loss: 2.6260, test_f1: 0.5979
 epoch: 83, train_loss: 0.2377, test_loss: 2.5034, test_f1: 0.6351
 epoch: 84, train_loss: 0.2230, test_loss: 2.3845, test_f1: 0.6123
 epoch: 85, train_loss: 0.2089, test_loss: 2.4658, test_f1: 0.6261
 epoch: 86, train_loss: 0.1652, test_loss: 2.6510, test_f1: 0.5863
 epoch: 87, train_loss: 0.1801, test_loss: 2.8517, test_f1: 0.5662
 epoch: 88, train_loss: 0.1871, test_loss: 2.7009, test_f1: 0.5872
 epoch: 89, train_loss: 0.1789, test_loss: 2.7979, test_f1: 0.5892
 epoch: 90, train_loss: 0.1963, test_loss: 2.7977, test_f1: 0.5871
 epoch: 91, train_loss: 0.1741, test_loss: 2.8853, test_f1: 0.5805
 epoch: 92, train_loss: 0.1816, test_loss: 2.9200, test_f1: 0.5776
 epoch: 93, train_loss: 0.2061, test_loss: 2.8605, test_f1: 0.5900
 epoch: 94, train_loss: 0.1949, test_loss: 2.7755, test_f1: 0.6088
 epoch: 95, train_loss: 0.2023, test_loss: 3.0130, test_f1: 0.5691
 epoch: 96, train_loss: 0.1974, test_loss: 2.6487, test_f1: 0.6005
 epoch: 97, train_loss: 0.1910, test_loss: 2.7228, test_f1: 0.5920
 epoch: 98, train_loss: 0.1967, test_loss: 3.0561, test_f1: 0.6109
 epoch: 99, train_loss: 0.2084, test_loss: 3.1744, test_f1: 0.5755
##################ITERATION #9 ****************************************
 epoch: 0, train_loss: 1.4060, test_loss: 1.2938, test_f1: 0.2044
 epoch: 1, train_loss: 1.1294, test_loss: 1.1802, test_f1: 0.3582
 epoch: 2, train_loss: 1.0068, test_loss: 1.0973, test_f1: 0.4532
 epoch: 3, train_loss: 0.9618, test_loss: 1.0422, test_f1: 0.4939
 epoch: 4, train_loss: 0.9121, test_loss: 1.0582, test_f1: 0.5056
 epoch: 5, train_loss: 0.9016, test_loss: 1.0466, test_f1: 0.5401
 epoch: 6, train_loss: 0.8683, test_loss: 1.1479, test_f1: 0.4951
 epoch: 7, train_loss: 0.8575, test_loss: 1.0521, test_f1: 0.5581
 epoch: 8, train_loss: 0.8409, test_loss: 1.1388, test_f1: 0.5299
 epoch: 9, train_loss: 0.8499, test_loss: 1.1977, test_f1: 0.5642
 epoch: 10, train_loss: 0.8428, test_loss: 1.0463, test_f1: 0.5727
 epoch: 11, train_loss: 0.8206, test_loss: 1.1782, test_f1: 0.5497
 epoch: 12, train_loss: 0.7800, test_loss: 1.1213, test_f1: 0.5939
 epoch: 13, train_loss: 0.7645, test_loss: 1.2409, test_f1: 0.5536
 epoch: 14, train_loss: 0.7700, test_loss: 1.1079, test_f1: 0.5595
 epoch: 15, train_loss: 0.7639, test_loss: 1.2307, test_f1: 0.5705
 epoch: 16, train_loss: 0.7465, test_loss: 1.1368, test_f1: 0.5831
 epoch: 17, train_loss: 0.7260, test_loss: 1.2047, test_f1: 0.5818
 epoch: 18, train_loss: 0.6984, test_loss: 1.2688, test_f1: 0.5853
 epoch: 19, train_loss: 0.7142, test_loss: 1.3852, test_f1: 0.5701
 epoch: 20, train_loss: 0.6795, test_loss: 1.2655, test_f1: 0.5671
 epoch: 21, train_loss: 0.6845, test_loss: 1.2702, test_f1: 0.6188
 epoch: 22, train_loss: 0.6635, test_loss: 1.2432, test_f1: 0.6072
 epoch: 23, train_loss: 0.6280, test_loss: 1.3384, test_f1: 0.5842
 epoch: 24, train_loss: 0.6297, test_loss: 1.4346, test_f1: 0.5615
 epoch: 25, train_loss: 0.6467, test_loss: 1.2837, test_f1: 0.5510
 epoch: 26, train_loss: 0.6501, test_loss: 1.3115, test_f1: 0.5935
 epoch: 27, train_loss: 0.6019, test_loss: 1.4667, test_f1: 0.5491
 epoch: 28, train_loss: 0.5674, test_loss: 1.4204, test_f1: 0.5761
 epoch: 29, train_loss: 0.6212, test_loss: 1.4504, test_f1: 0.5737
 epoch: 30, train_loss: 0.5912, test_loss: 1.4707, test_f1: 0.5770
 epoch: 31, train_loss: 0.5699, test_loss: 1.8609, test_f1: 0.5058
 epoch: 32, train_loss: 0.5656, test_loss: 1.2306, test_f1: 0.6398
 epoch: 33, train_loss: 0.5360, test_loss: 1.6572, test_f1: 0.5850
 epoch: 34, train_loss: 0.5499, test_loss: 1.3617, test_f1: 0.5681
 epoch: 35, train_loss: 0.5141, test_loss: 1.4951, test_f1: 0.5879
 epoch: 36, train_loss: 0.4983, test_loss: 1.5495, test_f1: 0.5859
 epoch: 37, train_loss: 0.5091, test_loss: 1.5657, test_f1: 0.5932
 epoch: 38, train_loss: 0.4921, test_loss: 1.7340, test_f1: 0.5777
 epoch: 39, train_loss: 0.4885, test_loss: 1.5011, test_f1: 0.6166
 epoch: 40, train_loss: 0.4832, test_loss: 1.6850, test_f1: 0.5629
 epoch: 41, train_loss: 0.4810, test_loss: 1.7940, test_f1: 0.6092
 epoch: 42, train_loss: 0.5662, test_loss: 1.6292, test_f1: 0.6189
 epoch: 43, train_loss: 0.4691, test_loss: 1.6797, test_f1: 0.5877
 epoch: 44, train_loss: 0.4516, test_loss: 1.8730, test_f1: 0.5875
 epoch: 45, train_loss: 0.4497, test_loss: 1.5049, test_f1: 0.5967
 epoch: 46, train_loss: 0.4349, test_loss: 1.8660, test_f1: 0.5921
 epoch: 47, train_loss: 0.4464, test_loss: 1.6802, test_f1: 0.6242
 epoch: 48, train_loss: 0.4122, test_loss: 1.7573, test_f1: 0.5977
 epoch: 49, train_loss: 0.3919, test_loss: 2.1438, test_f1: 0.5524
 epoch: 50, train_loss: 0.4401, test_loss: 1.9513, test_f1: 0.5769
 epoch: 51, train_loss: 0.4008, test_loss: 1.7737, test_f1: 0.5728
 epoch: 52, train_loss: 0.3562, test_loss: 1.8843, test_f1: 0.6082
 epoch: 53, train_loss: 0.3251, test_loss: 1.9471, test_f1: 0.5996
 epoch: 54, train_loss: 0.3196, test_loss: 2.1379, test_f1: 0.5900
 epoch: 55, train_loss: 0.3075, test_loss: 2.0437, test_f1: 0.6166
 epoch: 56, train_loss: 0.3051, test_loss: 2.2035, test_f1: 0.6100
 epoch: 57, train_loss: 0.2961, test_loss: 2.3024, test_f1: 0.5809
 epoch: 58, train_loss: 0.2958, test_loss: 2.2571, test_f1: 0.6227
 epoch: 59, train_loss: 0.2806, test_loss: 2.2422, test_f1: 0.6304
 epoch: 60, train_loss: 0.2810, test_loss: 2.4027, test_f1: 0.5753
 epoch: 61, train_loss: 0.3090, test_loss: 2.2106, test_f1: 0.5798
 epoch: 62, train_loss: 0.2741, test_loss: 2.3848, test_f1: 0.6223
 epoch: 63, train_loss: 0.2638, test_loss: 2.2642, test_f1: 0.5998
 epoch: 64, train_loss: 0.2667, test_loss: 2.4332, test_f1: 0.5914
 epoch: 65, train_loss: 0.3258, test_loss: 2.4781, test_f1: 0.5597
 epoch: 66, train_loss: 0.2751, test_loss: 2.0237, test_f1: 0.5961
 epoch: 67, train_loss: 0.2798, test_loss: 2.2307, test_f1: 0.5894
 epoch: 68, train_loss: 0.2675, test_loss: 2.5404, test_f1: 0.5785
 epoch: 69, train_loss: 0.2470, test_loss: 2.6734, test_f1: 0.5850
 epoch: 70, train_loss: 0.2449, test_loss: 2.6794, test_f1: 0.5657
 epoch: 71, train_loss: 0.2600, test_loss: 2.4699, test_f1: 0.5811
 epoch: 72, train_loss: 0.2398, test_loss: 2.4793, test_f1: 0.6006
 epoch: 73, train_loss: 0.2430, test_loss: 2.6727, test_f1: 0.5779
 epoch: 74, train_loss: 0.2355, test_loss: 2.5824, test_f1: 0.5749
 epoch: 75, train_loss: 0.2108, test_loss: 3.0106, test_f1: 0.5759
 epoch: 76, train_loss: 0.2215, test_loss: 2.6804, test_f1: 0.5914
 epoch: 77, train_loss: 0.2171, test_loss: 2.8049, test_f1: 0.5861
 epoch: 78, train_loss: 0.2270, test_loss: 3.3254, test_f1: 0.5700
 epoch: 79, train_loss: 0.2280, test_loss: 3.0291, test_f1: 0.6033
 epoch: 80, train_loss: 0.2339, test_loss: 3.0637, test_f1: 0.5716
 epoch: 81, train_loss: 0.2557, test_loss: 2.8362, test_f1: 0.5970
 epoch: 82, train_loss: 0.2172, test_loss: 2.8385, test_f1: 0.5884
 epoch: 83, train_loss: 0.2130, test_loss: 2.7863, test_f1: 0.5593
 epoch: 84, train_loss: 0.2095, test_loss: 2.9135, test_f1: 0.5878
 epoch: 85, train_loss: 0.2122, test_loss: 2.6742, test_f1: 0.5919
 epoch: 86, train_loss: 0.2094, test_loss: 2.9153, test_f1: 0.5912
 epoch: 87, train_loss: 0.2172, test_loss: 2.7972, test_f1: 0.5802
 epoch: 88, train_loss: 0.2259, test_loss: 2.8333, test_f1: 0.5921
 epoch: 89, train_loss: 0.2183, test_loss: 3.1252, test_f1: 0.5743
 epoch: 90, train_loss: 0.2071, test_loss: 2.8071, test_f1: 0.5880
 epoch: 91, train_loss: 0.2096, test_loss: 2.7891, test_f1: 0.6006
 epoch: 92, train_loss: 0.1925, test_loss: 2.9860, test_f1: 0.5718
 epoch: 93, train_loss: 0.1862, test_loss: 3.1852, test_f1: 0.6006
 epoch: 94, train_loss: 0.2005, test_loss: 3.1440, test_f1: 0.5937
 epoch: 95, train_loss: 0.2076, test_loss: 3.1144, test_f1: 0.5760
 epoch: 96, train_loss: 0.1775, test_loss: 3.0835, test_f1: 0.5957
 epoch: 97, train_loss: 0.1892, test_loss: 2.9607, test_f1: 0.5790
 epoch: 98, train_loss: 0.1726, test_loss: 3.1960, test_f1: 0.6015
 epoch: 99, train_loss: 0.1574, test_loss: 3.2098, test_f1: 0.5731

Training completed in 683.13 seconds
Best F1: 0.6603 at epoch 58
Mean F1 across iterations: 0.6426  0.0092
========================FINAL RESULTS================================
FEGIN weighted F1: 0.6603  0.0092
python main.py --data ltspice_demos --representation component_net --model FEGIN --layers 5 --hiddens 128 --batch_size 64 --lr 0.001 --emb_size 250 --epochs 100 --save_appendix component_net_L5_H128_BS64_LR0.001_E250 --no_val
-----



STDERR:
  File "main.py", line 370, in <module>
    main()
  File "main.py", line 254, in main
    dataset = dataset_class(
  File "/home/philip/projects/ltspice_examples_code_repo/Circuit-Completion-Using-GNNs/component_classification_with_link_prediction_head/evaluation/FEGIN/kernel/circuit_datasets.py", line 15, in __init__
    self.data, self.slices = torch.load(self.processed_paths[0])
  File "/home/philip/.local/lib/python3.8/site-packages/torch/serialization.py", line 1040, in load
    warnings.warn(
  File "/usr/lib/python3.8/warnings.py", line 109, in _showwarnmsg
    sw(msg.message, msg.category, msg.filename, msg.lineno,
  File "main.py", line 47, in warn_with_traceback
    traceback.print_stack(file=log)
/home/philip/projects/ltspice_examples_code_repo/Circuit-Completion-Using-GNNs/component_classification_with_link_prediction_head/evaluation/FEGIN/kernel/circuit_datasets.py:15: FutureWarning: You are using `torch.load` with `weights_only=False` (the current default value), which uses the default pickle module implicitly. It is possible to construct malicious pickle data which will execute arbitrary code during unpickling (See https://github.com/pytorch/pytorch/blob/main/SECURITY.md#untrusted-models for more details). In a future release, the default value for `weights_only` will be flipped to `True`. This limits the functions that could be executed during unpickling. Arbitrary objects will no longer be allowed to be loaded via this mode unless they are explicitly allowlisted by the user via `torch.serialization.add_safe_globals`. We recommend you start setting `weights_only=True` for any use case where you don't have full control of the loaded file. Please open an issue on GitHub for any issues related to this experimental feature.
  self.data, self.slices = torch.load(self.processed_paths[0])
