STDOUT:
Results will be saved in /home/philip/projects/ltspice_examples_code_repo/Circuit-Completion-Using-GNNs/component_classification_with_link_prediction_head/evaluation/FEGIN/results/model_FEGIN_dataset_ltspice_demos
Command line input: python main.py --data ltspice_demos --representation component_net --model FEGIN --layers 2 --hiddens 16 --batch_size 32 --lr 0.001 --emb_size 250 --epochs 100 --save_appendix component_net_L2_H16_BS32_LR0.001_E250 --no_val
 is saved.
-----
ltspice_demos - FEGIN
Using 2 layers, 16 hidden units, h = 2
Loading component_net representation dataset
ENTERED
Training FEGIN on component_net representation
Train: 1565, Test: 383
##################ITERATION #0 ****************************************
 epoch: 0, train_loss: 1.3694, test_loss: 1.3483, test_f1: 0.1365
 epoch: 1, train_loss: 1.2772, test_loss: 1.2919, test_f1: 0.2280
 epoch: 2, train_loss: 1.2216, test_loss: 1.2612, test_f1: 0.3205
 epoch: 3, train_loss: 1.1858, test_loss: 1.2334, test_f1: 0.3227
 epoch: 4, train_loss: 1.1676, test_loss: 1.2115, test_f1: 0.3232
 epoch: 5, train_loss: 1.1361, test_loss: 1.1790, test_f1: 0.3614
 epoch: 6, train_loss: 1.1084, test_loss: 1.1608, test_f1: 0.4217
 epoch: 7, train_loss: 1.0851, test_loss: 1.1788, test_f1: 0.4252
 epoch: 8, train_loss: 1.0470, test_loss: 1.1606, test_f1: 0.4177
 epoch: 9, train_loss: 1.0511, test_loss: 1.1407, test_f1: 0.4054
 epoch: 10, train_loss: 1.0355, test_loss: 1.1626, test_f1: 0.4234
 epoch: 11, train_loss: 1.0294, test_loss: 1.1577, test_f1: 0.4062
 epoch: 12, train_loss: 1.0207, test_loss: 1.1375, test_f1: 0.4251
 epoch: 13, train_loss: 1.0110, test_loss: 1.1285, test_f1: 0.4142
 epoch: 14, train_loss: 1.0083, test_loss: 1.1414, test_f1: 0.4302
 epoch: 15, train_loss: 1.0042, test_loss: 1.1367, test_f1: 0.4352
 epoch: 16, train_loss: 0.9817, test_loss: 1.1056, test_f1: 0.4301
 epoch: 17, train_loss: 0.9950, test_loss: 1.1165, test_f1: 0.4559
 epoch: 18, train_loss: 0.9780, test_loss: 1.1095, test_f1: 0.4600
 epoch: 19, train_loss: 0.9863, test_loss: 1.1086, test_f1: 0.4683
 epoch: 20, train_loss: 0.9791, test_loss: 1.1017, test_f1: 0.4640
 epoch: 21, train_loss: 0.9666, test_loss: 1.1051, test_f1: 0.4541
 epoch: 22, train_loss: 0.9714, test_loss: 1.0758, test_f1: 0.4726
 epoch: 23, train_loss: 0.9582, test_loss: 1.0792, test_f1: 0.4429
 epoch: 24, train_loss: 0.9658, test_loss: 1.1035, test_f1: 0.4988
 epoch: 25, train_loss: 0.9697, test_loss: 1.0893, test_f1: 0.4405
 epoch: 26, train_loss: 0.9494, test_loss: 1.0803, test_f1: 0.4858
 epoch: 27, train_loss: 0.9429, test_loss: 1.0762, test_f1: 0.4944
 epoch: 28, train_loss: 0.9564, test_loss: 1.0903, test_f1: 0.4926
 epoch: 29, train_loss: 0.9445, test_loss: 1.1035, test_f1: 0.4922
 epoch: 30, train_loss: 0.9422, test_loss: 1.0687, test_f1: 0.5271
 epoch: 31, train_loss: 0.9315, test_loss: 1.0656, test_f1: 0.5194
 epoch: 32, train_loss: 0.9321, test_loss: 1.0495, test_f1: 0.5360
 epoch: 33, train_loss: 0.9303, test_loss: 1.0752, test_f1: 0.4970
 epoch: 34, train_loss: 0.9251, test_loss: 1.0856, test_f1: 0.5248
 epoch: 35, train_loss: 0.9178, test_loss: 1.0730, test_f1: 0.5309
 epoch: 36, train_loss: 0.9124, test_loss: 1.0633, test_f1: 0.5452
 epoch: 37, train_loss: 0.9124, test_loss: 1.0392, test_f1: 0.5458
 epoch: 38, train_loss: 0.9239, test_loss: 1.0728, test_f1: 0.5616
 epoch: 39, train_loss: 0.9205, test_loss: 1.0809, test_f1: 0.5273
 epoch: 40, train_loss: 0.9097, test_loss: 1.0728, test_f1: 0.5600
 epoch: 41, train_loss: 0.9007, test_loss: 1.0686, test_f1: 0.5404
 epoch: 42, train_loss: 0.9054, test_loss: 1.0883, test_f1: 0.5427
 epoch: 43, train_loss: 0.9033, test_loss: 1.0397, test_f1: 0.5568
 epoch: 44, train_loss: 0.9059, test_loss: 1.0659, test_f1: 0.5356
 epoch: 45, train_loss: 0.9175, test_loss: 1.0786, test_f1: 0.5602
 epoch: 46, train_loss: 0.9001, test_loss: 1.0895, test_f1: 0.5767
 epoch: 47, train_loss: 0.8977, test_loss: 1.0816, test_f1: 0.5654
 epoch: 48, train_loss: 0.8933, test_loss: 1.0420, test_f1: 0.5590
 epoch: 49, train_loss: 0.9039, test_loss: 1.1385, test_f1: 0.5379
 epoch: 50, train_loss: 0.8933, test_loss: 1.0667, test_f1: 0.5726
 epoch: 51, train_loss: 0.8884, test_loss: 1.0665, test_f1: 0.5733
 epoch: 52, train_loss: 0.8701, test_loss: 1.0476, test_f1: 0.5697
 epoch: 53, train_loss: 0.8858, test_loss: 1.0727, test_f1: 0.5635
 epoch: 54, train_loss: 0.8775, test_loss: 1.0881, test_f1: 0.5556
 epoch: 55, train_loss: 0.8665, test_loss: 1.0728, test_f1: 0.5617
 epoch: 56, train_loss: 0.8717, test_loss: 1.0846, test_f1: 0.5708
 epoch: 57, train_loss: 0.8691, test_loss: 1.0503, test_f1: 0.5762
 epoch: 58, train_loss: 0.8642, test_loss: 1.0720, test_f1: 0.5610
 epoch: 59, train_loss: 0.8662, test_loss: 1.0569, test_f1: 0.5712
 epoch: 60, train_loss: 0.8731, test_loss: 1.0434, test_f1: 0.5778
 epoch: 61, train_loss: 0.8582, test_loss: 1.0534, test_f1: 0.5803
 epoch: 62, train_loss: 0.8669, test_loss: 1.0808, test_f1: 0.5763
 epoch: 63, train_loss: 0.8673, test_loss: 1.0479, test_f1: 0.5719
 epoch: 64, train_loss: 0.8524, test_loss: 1.0804, test_f1: 0.5796
 epoch: 65, train_loss: 0.8655, test_loss: 1.0863, test_f1: 0.5666
 epoch: 66, train_loss: 0.8833, test_loss: 1.0554, test_f1: 0.5960
 epoch: 67, train_loss: 0.8554, test_loss: 1.0643, test_f1: 0.5877
 epoch: 68, train_loss: 0.8777, test_loss: 1.0433, test_f1: 0.5997
 epoch: 69, train_loss: 0.8562, test_loss: 1.0676, test_f1: 0.5830
 epoch: 70, train_loss: 0.8485, test_loss: 1.0666, test_f1: 0.5858
 epoch: 71, train_loss: 0.8610, test_loss: 1.0725, test_f1: 0.5949
 epoch: 72, train_loss: 0.8702, test_loss: 1.0954, test_f1: 0.5943
 epoch: 73, train_loss: 0.8768, test_loss: 1.0779, test_f1: 0.6030
 epoch: 74, train_loss: 0.8529, test_loss: 1.0787, test_f1: 0.5976
 epoch: 75, train_loss: 0.8395, test_loss: 1.0862, test_f1: 0.5842
 epoch: 76, train_loss: 0.8467, test_loss: 1.0737, test_f1: 0.5934
 epoch: 77, train_loss: 0.8570, test_loss: 1.0761, test_f1: 0.5812
 epoch: 78, train_loss: 0.8530, test_loss: 1.0728, test_f1: 0.5832
 epoch: 79, train_loss: 0.8328, test_loss: 1.0647, test_f1: 0.5777
 epoch: 80, train_loss: 0.8469, test_loss: 1.0922, test_f1: 0.5898
 epoch: 81, train_loss: 0.8420, test_loss: 1.1080, test_f1: 0.5797
 epoch: 82, train_loss: 0.8473, test_loss: 1.1030, test_f1: 0.5894
 epoch: 83, train_loss: 0.8550, test_loss: 1.0615, test_f1: 0.5893
 epoch: 84, train_loss: 0.8461, test_loss: 1.0831, test_f1: 0.5744
 epoch: 85, train_loss: 0.8379, test_loss: 1.1007, test_f1: 0.5981
 epoch: 86, train_loss: 0.8451, test_loss: 1.0720, test_f1: 0.5717
 epoch: 87, train_loss: 0.8349, test_loss: 1.0769, test_f1: 0.6094
 epoch: 88, train_loss: 0.8291, test_loss: 1.0729, test_f1: 0.6030
 epoch: 89, train_loss: 0.8235, test_loss: 1.0911, test_f1: 0.6037
 epoch: 90, train_loss: 0.8413, test_loss: 1.0737, test_f1: 0.6082
 epoch: 91, train_loss: 0.8486, test_loss: 1.0576, test_f1: 0.5992
 epoch: 92, train_loss: 0.8422, test_loss: 1.0406, test_f1: 0.5928
 epoch: 93, train_loss: 0.8395, test_loss: 1.0736, test_f1: 0.6270
 epoch: 94, train_loss: 0.8299, test_loss: 1.0649, test_f1: 0.5924
 epoch: 95, train_loss: 0.8230, test_loss: 1.0731, test_f1: 0.6008
 epoch: 96, train_loss: 0.8266, test_loss: 1.0552, test_f1: 0.6094
 epoch: 97, train_loss: 0.8204, test_loss: 1.0685, test_f1: 0.5912
 epoch: 98, train_loss: 0.8192, test_loss: 1.0787, test_f1: 0.6177
 epoch: 99, train_loss: 0.8333, test_loss: 1.0654, test_f1: 0.6069
##################ITERATION #1 ****************************************
 epoch: 0, train_loss: 1.3129, test_loss: 1.2789, test_f1: 0.2336
 epoch: 1, train_loss: 1.1584, test_loss: 1.2079, test_f1: 0.3981
 epoch: 2, train_loss: 1.1236, test_loss: 1.1870, test_f1: 0.4065
 epoch: 3, train_loss: 1.0847, test_loss: 1.1435, test_f1: 0.4413
 epoch: 4, train_loss: 1.0734, test_loss: 1.1196, test_f1: 0.4520
 epoch: 5, train_loss: 1.0408, test_loss: 1.1307, test_f1: 0.4492
 epoch: 6, train_loss: 1.0254, test_loss: 1.1159, test_f1: 0.4551
 epoch: 7, train_loss: 1.0215, test_loss: 1.0961, test_f1: 0.4609
 epoch: 8, train_loss: 1.0046, test_loss: 1.1017, test_f1: 0.4658
 epoch: 9, train_loss: 0.9896, test_loss: 1.0946, test_f1: 0.4632
 epoch: 10, train_loss: 1.0092, test_loss: 1.0952, test_f1: 0.4751
 epoch: 11, train_loss: 0.9861, test_loss: 1.0955, test_f1: 0.4792
 epoch: 12, train_loss: 0.9811, test_loss: 1.0658, test_f1: 0.4822
 epoch: 13, train_loss: 0.9720, test_loss: 1.0874, test_f1: 0.4921
 epoch: 14, train_loss: 0.9617, test_loss: 1.0650, test_f1: 0.5021
 epoch: 15, train_loss: 0.9534, test_loss: 1.0862, test_f1: 0.4763
 epoch: 16, train_loss: 0.9511, test_loss: 1.0564, test_f1: 0.4933
 epoch: 17, train_loss: 0.9496, test_loss: 1.0790, test_f1: 0.5235
 epoch: 18, train_loss: 0.9584, test_loss: 1.0696, test_f1: 0.5079
 epoch: 19, train_loss: 0.9520, test_loss: 1.0401, test_f1: 0.5154
 epoch: 20, train_loss: 0.9397, test_loss: 1.0385, test_f1: 0.5266
 epoch: 21, train_loss: 0.9347, test_loss: 1.0613, test_f1: 0.5161
 epoch: 22, train_loss: 0.9282, test_loss: 1.0415, test_f1: 0.5148
 epoch: 23, train_loss: 0.9263, test_loss: 1.0513, test_f1: 0.5096
 epoch: 24, train_loss: 0.9265, test_loss: 1.0244, test_f1: 0.5387
 epoch: 25, train_loss: 0.9242, test_loss: 1.0234, test_f1: 0.5454
 epoch: 26, train_loss: 0.9213, test_loss: 1.0126, test_f1: 0.5513
 epoch: 27, train_loss: 0.9190, test_loss: 1.0539, test_f1: 0.5226
 epoch: 28, train_loss: 0.9124, test_loss: 1.0229, test_f1: 0.5265
 epoch: 29, train_loss: 0.9185, test_loss: 1.0440, test_f1: 0.5391
 epoch: 30, train_loss: 0.9096, test_loss: 1.0610, test_f1: 0.5283
 epoch: 31, train_loss: 0.8922, test_loss: 1.0149, test_f1: 0.5570
 epoch: 32, train_loss: 0.9116, test_loss: 1.0135, test_f1: 0.5516
 epoch: 33, train_loss: 0.9089, test_loss: 1.0618, test_f1: 0.5270
 epoch: 34, train_loss: 0.8992, test_loss: 1.0114, test_f1: 0.5515
 epoch: 35, train_loss: 0.8980, test_loss: 1.0432, test_f1: 0.5538
 epoch: 36, train_loss: 0.9035, test_loss: 1.0250, test_f1: 0.5369
 epoch: 37, train_loss: 0.8869, test_loss: 1.0592, test_f1: 0.5344
 epoch: 38, train_loss: 0.8850, test_loss: 1.0103, test_f1: 0.5353
 epoch: 39, train_loss: 0.8875, test_loss: 1.0195, test_f1: 0.5518
 epoch: 40, train_loss: 0.8818, test_loss: 1.0046, test_f1: 0.5596
 epoch: 41, train_loss: 0.8785, test_loss: 1.0092, test_f1: 0.5556
 epoch: 42, train_loss: 0.8637, test_loss: 1.0170, test_f1: 0.5583
 epoch: 43, train_loss: 0.8684, test_loss: 1.0136, test_f1: 0.5797
 epoch: 44, train_loss: 0.8619, test_loss: 1.0170, test_f1: 0.5738
 epoch: 45, train_loss: 0.8737, test_loss: 1.0083, test_f1: 0.5676
 epoch: 46, train_loss: 0.8489, test_loss: 0.9712, test_f1: 0.5606
 epoch: 47, train_loss: 0.8617, test_loss: 0.9836, test_f1: 0.5732
 epoch: 48, train_loss: 0.8555, test_loss: 0.9574, test_f1: 0.5817
 epoch: 49, train_loss: 0.8500, test_loss: 0.9769, test_f1: 0.5500
 epoch: 50, train_loss: 0.8608, test_loss: 0.9674, test_f1: 0.5423
 epoch: 51, train_loss: 0.8436, test_loss: 0.9722, test_f1: 0.5661
 epoch: 52, train_loss: 0.8547, test_loss: 0.9849, test_f1: 0.5842
 epoch: 53, train_loss: 0.8133, test_loss: 0.9620, test_f1: 0.5681
 epoch: 54, train_loss: 0.8262, test_loss: 0.9806, test_f1: 0.5876
 epoch: 55, train_loss: 0.8099, test_loss: 0.9636, test_f1: 0.5971
 epoch: 56, train_loss: 0.8291, test_loss: 0.9742, test_f1: 0.5915
 epoch: 57, train_loss: 0.8211, test_loss: 0.9551, test_f1: 0.5848
 epoch: 58, train_loss: 0.8198, test_loss: 0.9744, test_f1: 0.5705
 epoch: 59, train_loss: 0.8162, test_loss: 0.9592, test_f1: 0.5870
 epoch: 60, train_loss: 0.8158, test_loss: 0.9661, test_f1: 0.6002
 epoch: 61, train_loss: 0.8049, test_loss: 0.9939, test_f1: 0.5976
 epoch: 62, train_loss: 0.8167, test_loss: 0.9689, test_f1: 0.5615
 epoch: 63, train_loss: 0.8185, test_loss: 0.9620, test_f1: 0.5862
 epoch: 64, train_loss: 0.8256, test_loss: 0.9561, test_f1: 0.5913
 epoch: 65, train_loss: 0.8022, test_loss: 0.9644, test_f1: 0.5889
 epoch: 66, train_loss: 0.7937, test_loss: 0.9511, test_f1: 0.5848
 epoch: 67, train_loss: 0.7951, test_loss: 0.9600, test_f1: 0.5616
 epoch: 68, train_loss: 0.7854, test_loss: 0.9768, test_f1: 0.5802
 epoch: 69, train_loss: 0.8111, test_loss: 0.9600, test_f1: 0.5861
 epoch: 70, train_loss: 0.8046, test_loss: 0.9579, test_f1: 0.5781
 epoch: 71, train_loss: 0.7973, test_loss: 0.9683, test_f1: 0.5867
 epoch: 72, train_loss: 0.7889, test_loss: 0.9548, test_f1: 0.5986
 epoch: 73, train_loss: 0.8000, test_loss: 0.9569, test_f1: 0.5815
 epoch: 74, train_loss: 0.7894, test_loss: 0.9532, test_f1: 0.5390
 epoch: 75, train_loss: 0.7958, test_loss: 0.9669, test_f1: 0.5650
 epoch: 76, train_loss: 0.7892, test_loss: 0.9530, test_f1: 0.5872
 epoch: 77, train_loss: 0.7813, test_loss: 0.9704, test_f1: 0.5623
 epoch: 78, train_loss: 0.7855, test_loss: 0.9766, test_f1: 0.5394
 epoch: 79, train_loss: 0.7937, test_loss: 0.9770, test_f1: 0.5639
 epoch: 80, train_loss: 0.7927, test_loss: 0.9867, test_f1: 0.5604
 epoch: 81, train_loss: 0.7878, test_loss: 0.9603, test_f1: 0.5781
 epoch: 82, train_loss: 0.7825, test_loss: 0.9589, test_f1: 0.5926
 epoch: 83, train_loss: 0.7878, test_loss: 0.9971, test_f1: 0.5699
 epoch: 84, train_loss: 0.7865, test_loss: 1.0142, test_f1: 0.5592
 epoch: 85, train_loss: 0.7735, test_loss: 1.0035, test_f1: 0.5682
 epoch: 86, train_loss: 0.7867, test_loss: 0.9669, test_f1: 0.5674
 epoch: 87, train_loss: 0.7586, test_loss: 0.9617, test_f1: 0.5915
 epoch: 88, train_loss: 0.7769, test_loss: 0.9809, test_f1: 0.5941
 epoch: 89, train_loss: 0.7696, test_loss: 0.9526, test_f1: 0.5775
 epoch: 90, train_loss: 0.7728, test_loss: 0.9832, test_f1: 0.5721
 epoch: 91, train_loss: 0.7635, test_loss: 0.9465, test_f1: 0.5808
 epoch: 92, train_loss: 0.7582, test_loss: 0.9923, test_f1: 0.5633
 epoch: 93, train_loss: 0.7655, test_loss: 0.9829, test_f1: 0.6204
 epoch: 94, train_loss: 0.7407, test_loss: 0.9586, test_f1: 0.6103
 epoch: 95, train_loss: 0.7578, test_loss: 1.0220, test_f1: 0.5393
 epoch: 96, train_loss: 0.7527, test_loss: 1.0149, test_f1: 0.5659
 epoch: 97, train_loss: 0.7634, test_loss: 1.0111, test_f1: 0.5987
 epoch: 98, train_loss: 0.7612, test_loss: 0.9891, test_f1: 0.5684
 epoch: 99, train_loss: 0.7500, test_loss: 1.0059, test_f1: 0.6010
##################ITERATION #2 ****************************************
 epoch: 0, train_loss: 1.2602, test_loss: 1.2116, test_f1: 0.3663
 epoch: 1, train_loss: 1.1306, test_loss: 1.1584, test_f1: 0.4198
 epoch: 2, train_loss: 1.0902, test_loss: 1.1217, test_f1: 0.4622
 epoch: 3, train_loss: 1.0555, test_loss: 1.0868, test_f1: 0.4827
 epoch: 4, train_loss: 1.0318, test_loss: 1.0869, test_f1: 0.4946
 epoch: 5, train_loss: 1.0118, test_loss: 1.1024, test_f1: 0.4848
 epoch: 6, train_loss: 0.9973, test_loss: 1.0662, test_f1: 0.5275
 epoch: 7, train_loss: 0.9758, test_loss: 1.0649, test_f1: 0.5362
 epoch: 8, train_loss: 0.9692, test_loss: 1.0875, test_f1: 0.4529
 epoch: 9, train_loss: 0.9734, test_loss: 1.0633, test_f1: 0.5288
 epoch: 10, train_loss: 0.9441, test_loss: 1.0532, test_f1: 0.4690
 epoch: 11, train_loss: 0.9451, test_loss: 1.0462, test_f1: 0.4740
 epoch: 12, train_loss: 0.9394, test_loss: 1.0307, test_f1: 0.5099
 epoch: 13, train_loss: 0.9256, test_loss: 1.0419, test_f1: 0.4755
 epoch: 14, train_loss: 0.9268, test_loss: 1.0532, test_f1: 0.4806
 epoch: 15, train_loss: 0.9282, test_loss: 1.0408, test_f1: 0.4796
 epoch: 16, train_loss: 0.9275, test_loss: 1.0265, test_f1: 0.4786
 epoch: 17, train_loss: 0.9054, test_loss: 1.0334, test_f1: 0.5517
 epoch: 18, train_loss: 0.9075, test_loss: 1.0176, test_f1: 0.4871
 epoch: 19, train_loss: 0.9009, test_loss: 1.0335, test_f1: 0.5482
 epoch: 20, train_loss: 0.8910, test_loss: 1.0251, test_f1: 0.4948
 epoch: 21, train_loss: 0.8751, test_loss: 1.0178, test_f1: 0.5015
 epoch: 22, train_loss: 0.8943, test_loss: 1.0031, test_f1: 0.5122
 epoch: 23, train_loss: 0.8828, test_loss: 1.0209, test_f1: 0.5528
 epoch: 24, train_loss: 0.8691, test_loss: 1.0049, test_f1: 0.5729
 epoch: 25, train_loss: 0.8692, test_loss: 1.0306, test_f1: 0.5427
 epoch: 26, train_loss: 0.8579, test_loss: 1.0239, test_f1: 0.5614
 epoch: 27, train_loss: 0.8604, test_loss: 1.0373, test_f1: 0.5468
 epoch: 28, train_loss: 0.8567, test_loss: 1.0364, test_f1: 0.5475
 epoch: 29, train_loss: 0.8489, test_loss: 1.0354, test_f1: 0.5728
 epoch: 30, train_loss: 0.8391, test_loss: 1.0597, test_f1: 0.5697
 epoch: 31, train_loss: 0.8448, test_loss: 1.0400, test_f1: 0.5185
 epoch: 32, train_loss: 0.8428, test_loss: 1.0339, test_f1: 0.5264
 epoch: 33, train_loss: 0.8478, test_loss: 1.0224, test_f1: 0.4986
 epoch: 34, train_loss: 0.8352, test_loss: 1.0465, test_f1: 0.5601
 epoch: 35, train_loss: 0.8307, test_loss: 1.0235, test_f1: 0.5283
 epoch: 36, train_loss: 0.8258, test_loss: 1.0335, test_f1: 0.5455
 epoch: 37, train_loss: 0.8203, test_loss: 1.0248, test_f1: 0.5269
 epoch: 38, train_loss: 0.8295, test_loss: 1.0662, test_f1: 0.5585
 epoch: 39, train_loss: 0.8021, test_loss: 1.0436, test_f1: 0.5492
 epoch: 40, train_loss: 0.8135, test_loss: 1.0585, test_f1: 0.5438
 epoch: 41, train_loss: 0.8009, test_loss: 1.0620, test_f1: 0.5250
 epoch: 42, train_loss: 0.8048, test_loss: 1.0413, test_f1: 0.5411
 epoch: 43, train_loss: 0.8024, test_loss: 1.0520, test_f1: 0.5367
 epoch: 44, train_loss: 0.8123, test_loss: 1.0474, test_f1: 0.5256
 epoch: 45, train_loss: 0.8173, test_loss: 1.0311, test_f1: 0.5331
 epoch: 46, train_loss: 0.8033, test_loss: 1.0634, test_f1: 0.5399
 epoch: 47, train_loss: 0.8046, test_loss: 1.0395, test_f1: 0.5289
 epoch: 48, train_loss: 0.7860, test_loss: 1.0481, test_f1: 0.5632
 epoch: 49, train_loss: 0.7967, test_loss: 1.0602, test_f1: 0.5473
 epoch: 50, train_loss: 0.7909, test_loss: 1.0735, test_f1: 0.5065
 epoch: 51, train_loss: 0.7882, test_loss: 1.0701, test_f1: 0.5407
 epoch: 52, train_loss: 0.7731, test_loss: 1.0492, test_f1: 0.5471
 epoch: 53, train_loss: 0.7942, test_loss: 1.0412, test_f1: 0.5600
 epoch: 54, train_loss: 0.7813, test_loss: 1.0645, test_f1: 0.5407
 epoch: 55, train_loss: 0.7804, test_loss: 1.0567, test_f1: 0.5491
 epoch: 56, train_loss: 0.7669, test_loss: 1.0504, test_f1: 0.5411
 epoch: 57, train_loss: 0.7842, test_loss: 1.0802, test_f1: 0.5263
 epoch: 58, train_loss: 0.7653, test_loss: 1.0531, test_f1: 0.5560
 epoch: 59, train_loss: 0.7674, test_loss: 1.0633, test_f1: 0.5486
 epoch: 60, train_loss: 0.7700, test_loss: 1.0562, test_f1: 0.5294
 epoch: 61, train_loss: 0.7605, test_loss: 1.0418, test_f1: 0.5458
 epoch: 62, train_loss: 0.7668, test_loss: 1.0125, test_f1: 0.5302
 epoch: 63, train_loss: 0.7790, test_loss: 1.0597, test_f1: 0.5384
 epoch: 64, train_loss: 0.7700, test_loss: 1.0377, test_f1: 0.5462
 epoch: 65, train_loss: 0.7581, test_loss: 1.0417, test_f1: 0.5517
 epoch: 66, train_loss: 0.7545, test_loss: 1.0588, test_f1: 0.5478
 epoch: 67, train_loss: 0.7543, test_loss: 1.0388, test_f1: 0.5428
 epoch: 68, train_loss: 0.7598, test_loss: 1.0619, test_f1: 0.5517
 epoch: 69, train_loss: 0.7530, test_loss: 1.0387, test_f1: 0.5431
 epoch: 70, train_loss: 0.7373, test_loss: 1.0527, test_f1: 0.5560
 epoch: 71, train_loss: 0.7532, test_loss: 1.0791, test_f1: 0.5267
 epoch: 72, train_loss: 0.7576, test_loss: 1.0733, test_f1: 0.5418
 epoch: 73, train_loss: 0.7501, test_loss: 1.0777, test_f1: 0.5312
 epoch: 74, train_loss: 0.7397, test_loss: 1.0772, test_f1: 0.5457
 epoch: 75, train_loss: 0.7333, test_loss: 1.0699, test_f1: 0.5357
 epoch: 76, train_loss: 0.7528, test_loss: 1.0829, test_f1: 0.5376
 epoch: 77, train_loss: 0.7376, test_loss: 1.0650, test_f1: 0.5490
 epoch: 78, train_loss: 0.7420, test_loss: 1.0881, test_f1: 0.5440
 epoch: 79, train_loss: 0.7506, test_loss: 1.0832, test_f1: 0.5292
 epoch: 80, train_loss: 0.7479, test_loss: 1.0747, test_f1: 0.5518
 epoch: 81, train_loss: 0.7405, test_loss: 1.1015, test_f1: 0.5335
 epoch: 82, train_loss: 0.7533, test_loss: 1.1111, test_f1: 0.5165
 epoch: 83, train_loss: 0.7460, test_loss: 1.0899, test_f1: 0.5367
 epoch: 84, train_loss: 0.7378, test_loss: 1.1103, test_f1: 0.5247
 epoch: 85, train_loss: 0.7389, test_loss: 1.0851, test_f1: 0.5238
 epoch: 86, train_loss: 0.7231, test_loss: 1.0846, test_f1: 0.5368
 epoch: 87, train_loss: 0.7477, test_loss: 1.1212, test_f1: 0.5309
 epoch: 88, train_loss: 0.7343, test_loss: 1.0867, test_f1: 0.5271
 epoch: 89, train_loss: 0.7357, test_loss: 1.0884, test_f1: 0.5271
 epoch: 90, train_loss: 0.7291, test_loss: 1.0791, test_f1: 0.5336
 epoch: 91, train_loss: 0.7286, test_loss: 1.0902, test_f1: 0.5217
 epoch: 92, train_loss: 0.7274, test_loss: 1.0982, test_f1: 0.5232
 epoch: 93, train_loss: 0.7321, test_loss: 1.0975, test_f1: 0.5540
 epoch: 94, train_loss: 0.7330, test_loss: 1.0785, test_f1: 0.5417
 epoch: 95, train_loss: 0.7222, test_loss: 1.1105, test_f1: 0.5493
 epoch: 96, train_loss: 0.7345, test_loss: 1.1091, test_f1: 0.5414
 epoch: 97, train_loss: 0.7404, test_loss: 1.1013, test_f1: 0.5175
 epoch: 98, train_loss: 0.7423, test_loss: 1.1087, test_f1: 0.5307
 epoch: 99, train_loss: 0.7238, test_loss: 1.1104, test_f1: 0.5335
##################ITERATION #3 ****************************************
 epoch: 0, train_loss: 1.4019, test_loss: 1.3388, test_f1: 0.2343
 epoch: 1, train_loss: 1.1857, test_loss: 1.2126, test_f1: 0.2966
 epoch: 2, train_loss: 1.1555, test_loss: 1.1673, test_f1: 0.3342
 epoch: 3, train_loss: 1.1158, test_loss: 1.1574, test_f1: 0.4062
 epoch: 4, train_loss: 1.1055, test_loss: 1.1443, test_f1: 0.4239
 epoch: 5, train_loss: 1.0838, test_loss: 1.1250, test_f1: 0.4722
 epoch: 6, train_loss: 1.0545, test_loss: 1.1168, test_f1: 0.4531
 epoch: 7, train_loss: 1.0546, test_loss: 1.1149, test_f1: 0.4686
 epoch: 8, train_loss: 1.0310, test_loss: 1.0941, test_f1: 0.4367
 epoch: 9, train_loss: 1.0328, test_loss: 1.0776, test_f1: 0.4143
 epoch: 10, train_loss: 1.0129, test_loss: 1.0824, test_f1: 0.4381
 epoch: 11, train_loss: 1.0033, test_loss: 1.0754, test_f1: 0.4871
 epoch: 12, train_loss: 0.9933, test_loss: 1.0788, test_f1: 0.4836
 epoch: 13, train_loss: 0.9943, test_loss: 1.0761, test_f1: 0.4547
 epoch: 14, train_loss: 0.9778, test_loss: 1.0778, test_f1: 0.4379
 epoch: 15, train_loss: 0.9741, test_loss: 1.1161, test_f1: 0.4031
 epoch: 16, train_loss: 0.9664, test_loss: 1.0852, test_f1: 0.4806
 epoch: 17, train_loss: 0.9723, test_loss: 1.0504, test_f1: 0.5076
 epoch: 18, train_loss: 0.9534, test_loss: 1.0585, test_f1: 0.5024
 epoch: 19, train_loss: 0.9470, test_loss: 1.0591, test_f1: 0.5222
 epoch: 20, train_loss: 0.9553, test_loss: 1.0987, test_f1: 0.4861
 epoch: 21, train_loss: 0.9361, test_loss: 1.0474, test_f1: 0.5355
 epoch: 22, train_loss: 0.9227, test_loss: 1.0769, test_f1: 0.5122
 epoch: 23, train_loss: 0.9449, test_loss: 1.0517, test_f1: 0.5170
 epoch: 24, train_loss: 0.9308, test_loss: 1.0861, test_f1: 0.4847
 epoch: 25, train_loss: 0.9293, test_loss: 1.0493, test_f1: 0.5477
 epoch: 26, train_loss: 0.9151, test_loss: 1.0579, test_f1: 0.5213
 epoch: 27, train_loss: 0.9191, test_loss: 1.0473, test_f1: 0.5349
 epoch: 28, train_loss: 0.9031, test_loss: 1.0311, test_f1: 0.5313
 epoch: 29, train_loss: 0.9147, test_loss: 1.0418, test_f1: 0.5309
 epoch: 30, train_loss: 0.9001, test_loss: 1.0625, test_f1: 0.5253
 epoch: 31, train_loss: 0.8947, test_loss: 1.0156, test_f1: 0.5381
 epoch: 32, train_loss: 0.9109, test_loss: 1.0603, test_f1: 0.5243
 epoch: 33, train_loss: 0.9007, test_loss: 1.0591, test_f1: 0.5380
 epoch: 34, train_loss: 0.8885, test_loss: 1.0281, test_f1: 0.5328
 epoch: 35, train_loss: 0.8972, test_loss: 1.0935, test_f1: 0.5268
 epoch: 36, train_loss: 0.8965, test_loss: 1.0634, test_f1: 0.5371
 epoch: 37, train_loss: 0.8945, test_loss: 1.0243, test_f1: 0.5614
 epoch: 38, train_loss: 0.8697, test_loss: 1.0552, test_f1: 0.5201
 epoch: 39, train_loss: 0.8823, test_loss: 1.0331, test_f1: 0.5538
 epoch: 40, train_loss: 0.8764, test_loss: 1.0226, test_f1: 0.5751
 epoch: 41, train_loss: 0.8727, test_loss: 1.0217, test_f1: 0.5688
 epoch: 42, train_loss: 0.8694, test_loss: 1.0840, test_f1: 0.5347
 epoch: 43, train_loss: 0.8709, test_loss: 1.0459, test_f1: 0.5288
 epoch: 44, train_loss: 0.8644, test_loss: 1.0794, test_f1: 0.5315
 epoch: 45, train_loss: 0.8633, test_loss: 1.0370, test_f1: 0.5368
 epoch: 46, train_loss: 0.8671, test_loss: 1.1705, test_f1: 0.5355
 epoch: 47, train_loss: 0.8498, test_loss: 1.1647, test_f1: 0.5327
 epoch: 48, train_loss: 0.8678, test_loss: 1.0932, test_f1: 0.5162
 epoch: 49, train_loss: 0.8557, test_loss: 1.0848, test_f1: 0.5316
 epoch: 50, train_loss: 0.8628, test_loss: 1.0411, test_f1: 0.5455
 epoch: 51, train_loss: 0.8441, test_loss: 1.0796, test_f1: 0.5565
 epoch: 52, train_loss: 0.8260, test_loss: 1.1019, test_f1: 0.5606
 epoch: 53, train_loss: 0.8400, test_loss: 1.0720, test_f1: 0.5535
 epoch: 54, train_loss: 0.8322, test_loss: 1.0769, test_f1: 0.5550
 epoch: 55, train_loss: 0.8316, test_loss: 1.0522, test_f1: 0.5572
 epoch: 56, train_loss: 0.8302, test_loss: 1.0160, test_f1: 0.5778
 epoch: 57, train_loss: 0.8249, test_loss: 1.0553, test_f1: 0.5671
 epoch: 58, train_loss: 0.8479, test_loss: 1.0469, test_f1: 0.5693
 epoch: 59, train_loss: 0.8231, test_loss: 1.0929, test_f1: 0.5515
 epoch: 60, train_loss: 0.8210, test_loss: 1.0573, test_f1: 0.5732
 epoch: 61, train_loss: 0.8258, test_loss: 1.0850, test_f1: 0.5591
 epoch: 62, train_loss: 0.8281, test_loss: 1.0933, test_f1: 0.5537
 epoch: 63, train_loss: 0.8199, test_loss: 1.1697, test_f1: 0.5447
 epoch: 64, train_loss: 0.8129, test_loss: 1.1307, test_f1: 0.5499
 epoch: 65, train_loss: 0.8038, test_loss: 1.1718, test_f1: 0.5545
 epoch: 66, train_loss: 0.8188, test_loss: 1.0788, test_f1: 0.5582
 epoch: 67, train_loss: 0.8290, test_loss: 1.1038, test_f1: 0.5540
 epoch: 68, train_loss: 0.8070, test_loss: 1.0400, test_f1: 0.5783
 epoch: 69, train_loss: 0.8248, test_loss: 1.0585, test_f1: 0.5651
 epoch: 70, train_loss: 0.8014, test_loss: 1.1472, test_f1: 0.5699
 epoch: 71, train_loss: 0.8271, test_loss: 1.1132, test_f1: 0.5693
 epoch: 72, train_loss: 0.8087, test_loss: 1.1212, test_f1: 0.5704
 epoch: 73, train_loss: 0.8146, test_loss: 1.0949, test_f1: 0.5733
 epoch: 74, train_loss: 0.7991, test_loss: 1.1642, test_f1: 0.5790
 epoch: 75, train_loss: 0.8082, test_loss: 1.0534, test_f1: 0.5739
 epoch: 76, train_loss: 0.8085, test_loss: 1.0851, test_f1: 0.5473
 epoch: 77, train_loss: 0.8103, test_loss: 1.1678, test_f1: 0.5621
 epoch: 78, train_loss: 0.8147, test_loss: 1.0605, test_f1: 0.5618
 epoch: 79, train_loss: 0.8073, test_loss: 1.1713, test_f1: 0.5669
 epoch: 80, train_loss: 0.7929, test_loss: 1.1353, test_f1: 0.5680
 epoch: 81, train_loss: 0.8071, test_loss: 1.0941, test_f1: 0.5728
 epoch: 82, train_loss: 0.8007, test_loss: 1.1670, test_f1: 0.5518
 epoch: 83, train_loss: 0.8096, test_loss: 1.1819, test_f1: 0.5645
 epoch: 84, train_loss: 0.7938, test_loss: 1.1150, test_f1: 0.5617
 epoch: 85, train_loss: 0.7942, test_loss: 1.0705, test_f1: 0.5703
 epoch: 86, train_loss: 0.7904, test_loss: 1.0578, test_f1: 0.5679
 epoch: 87, train_loss: 0.8049, test_loss: 1.0598, test_f1: 0.5893
 epoch: 88, train_loss: 0.8043, test_loss: 1.1848, test_f1: 0.5679
 epoch: 89, train_loss: 0.8133, test_loss: 1.0797, test_f1: 0.5783
 epoch: 90, train_loss: 0.7951, test_loss: 1.0550, test_f1: 0.5943
 epoch: 91, train_loss: 0.7956, test_loss: 1.1173, test_f1: 0.5788
 epoch: 92, train_loss: 0.7952, test_loss: 1.0946, test_f1: 0.5723
 epoch: 93, train_loss: 0.7931, test_loss: 1.1859, test_f1: 0.5499
 epoch: 94, train_loss: 0.7871, test_loss: 1.0881, test_f1: 0.5856
 epoch: 95, train_loss: 0.7981, test_loss: 1.0916, test_f1: 0.5600
 epoch: 96, train_loss: 0.7913, test_loss: 1.1270, test_f1: 0.5640
 epoch: 97, train_loss: 0.7764, test_loss: 1.0753, test_f1: 0.5632
 epoch: 98, train_loss: 0.7914, test_loss: 1.1416, test_f1: 0.5805
 epoch: 99, train_loss: 0.7874, test_loss: 1.1759, test_f1: 0.5694
##################ITERATION #4 ****************************************
 epoch: 0, train_loss: 1.3214, test_loss: 1.2782, test_f1: 0.2281
 epoch: 1, train_loss: 1.2035, test_loss: 1.2083, test_f1: 0.3243
 epoch: 2, train_loss: 1.1530, test_loss: 1.1729, test_f1: 0.3618
 epoch: 3, train_loss: 1.1367, test_loss: 1.1646, test_f1: 0.4016
 epoch: 4, train_loss: 1.1062, test_loss: 1.1228, test_f1: 0.4771
 epoch: 5, train_loss: 1.1004, test_loss: 1.1057, test_f1: 0.4865
 epoch: 6, train_loss: 1.0704, test_loss: 1.0983, test_f1: 0.4917
 epoch: 7, train_loss: 1.0436, test_loss: 1.0923, test_f1: 0.4887
 epoch: 8, train_loss: 1.0440, test_loss: 1.0846, test_f1: 0.4785
 epoch: 9, train_loss: 1.0224, test_loss: 1.0907, test_f1: 0.4979
 epoch: 10, train_loss: 1.0269, test_loss: 1.0885, test_f1: 0.4782
 epoch: 11, train_loss: 1.0183, test_loss: 1.0621, test_f1: 0.4849
 epoch: 12, train_loss: 0.9863, test_loss: 1.0617, test_f1: 0.5061
 epoch: 13, train_loss: 0.9895, test_loss: 1.0383, test_f1: 0.5009
 epoch: 14, train_loss: 0.9732, test_loss: 1.0344, test_f1: 0.5248
 epoch: 15, train_loss: 0.9610, test_loss: 1.0407, test_f1: 0.5149
 epoch: 16, train_loss: 0.9636, test_loss: 1.0313, test_f1: 0.4823
 epoch: 17, train_loss: 0.9554, test_loss: 1.0301, test_f1: 0.5167
 epoch: 18, train_loss: 0.9432, test_loss: 1.0284, test_f1: 0.5251
 epoch: 19, train_loss: 0.9608, test_loss: 1.0202, test_f1: 0.5165
 epoch: 20, train_loss: 0.9356, test_loss: 1.0320, test_f1: 0.5068
 epoch: 21, train_loss: 0.9348, test_loss: 1.0150, test_f1: 0.5382
 epoch: 22, train_loss: 0.9263, test_loss: 1.0229, test_f1: 0.5347
 epoch: 23, train_loss: 0.9134, test_loss: 1.0250, test_f1: 0.5294
 epoch: 24, train_loss: 0.9099, test_loss: 1.0165, test_f1: 0.5447
 epoch: 25, train_loss: 0.9191, test_loss: 1.0102, test_f1: 0.5199
 epoch: 26, train_loss: 0.9125, test_loss: 1.0293, test_f1: 0.5260
 epoch: 27, train_loss: 0.9083, test_loss: 1.0110, test_f1: 0.5225
 epoch: 28, train_loss: 0.9108, test_loss: 1.0089, test_f1: 0.5332
 epoch: 29, train_loss: 0.9088, test_loss: 1.0352, test_f1: 0.5079
 epoch: 30, train_loss: 0.9068, test_loss: 1.0359, test_f1: 0.5160
 epoch: 31, train_loss: 0.8962, test_loss: 1.0321, test_f1: 0.5015
 epoch: 32, train_loss: 0.9011, test_loss: 1.0336, test_f1: 0.5290
 epoch: 33, train_loss: 0.8853, test_loss: 1.0371, test_f1: 0.5192
 epoch: 34, train_loss: 0.8901, test_loss: 0.9862, test_f1: 0.5443
 epoch: 35, train_loss: 0.8902, test_loss: 1.0257, test_f1: 0.5179
 epoch: 36, train_loss: 0.8963, test_loss: 1.0257, test_f1: 0.5162
 epoch: 37, train_loss: 0.8952, test_loss: 1.0475, test_f1: 0.4811
 epoch: 38, train_loss: 0.8787, test_loss: 1.0576, test_f1: 0.5016
 epoch: 39, train_loss: 0.8811, test_loss: 1.0204, test_f1: 0.5277
 epoch: 40, train_loss: 0.8730, test_loss: 1.0306, test_f1: 0.5092
 epoch: 41, train_loss: 0.8731, test_loss: 1.0239, test_f1: 0.4990
 epoch: 42, train_loss: 0.8743, test_loss: 1.0252, test_f1: 0.5209
 epoch: 43, train_loss: 0.8676, test_loss: 1.0235, test_f1: 0.5096
 epoch: 44, train_loss: 0.8689, test_loss: 1.0616, test_f1: 0.4944
 epoch: 45, train_loss: 0.8525, test_loss: 1.0207, test_f1: 0.5046
 epoch: 46, train_loss: 0.8570, test_loss: 1.0322, test_f1: 0.5247
 epoch: 47, train_loss: 0.8420, test_loss: 1.0099, test_f1: 0.5407
 epoch: 48, train_loss: 0.8389, test_loss: 1.0089, test_f1: 0.5614
 epoch: 49, train_loss: 0.8618, test_loss: 0.9903, test_f1: 0.5521
 epoch: 50, train_loss: 0.8417, test_loss: 0.9944, test_f1: 0.5278
 epoch: 51, train_loss: 0.8301, test_loss: 1.0082, test_f1: 0.5143
 epoch: 52, train_loss: 0.8254, test_loss: 1.0066, test_f1: 0.5536
 epoch: 53, train_loss: 0.8379, test_loss: 0.9937, test_f1: 0.5613
 epoch: 54, train_loss: 0.8088, test_loss: 0.9988, test_f1: 0.5608
 epoch: 55, train_loss: 0.8261, test_loss: 0.9916, test_f1: 0.5443
 epoch: 56, train_loss: 0.8240, test_loss: 0.9837, test_f1: 0.5539
 epoch: 57, train_loss: 0.8133, test_loss: 1.0004, test_f1: 0.5577
 epoch: 58, train_loss: 0.8069, test_loss: 0.9893, test_f1: 0.5816
 epoch: 59, train_loss: 0.8240, test_loss: 0.9998, test_f1: 0.5626
 epoch: 60, train_loss: 0.8206, test_loss: 1.0016, test_f1: 0.5595
 epoch: 61, train_loss: 0.8171, test_loss: 0.9987, test_f1: 0.5442
 epoch: 62, train_loss: 0.8162, test_loss: 0.9961, test_f1: 0.5490
 epoch: 63, train_loss: 0.8086, test_loss: 0.9934, test_f1: 0.5677
 epoch: 64, train_loss: 0.8193, test_loss: 0.9886, test_f1: 0.5673
 epoch: 65, train_loss: 0.8076, test_loss: 0.9828, test_f1: 0.5919
 epoch: 66, train_loss: 0.8107, test_loss: 0.9842, test_f1: 0.5651
 epoch: 67, train_loss: 0.8071, test_loss: 0.9912, test_f1: 0.5888
 epoch: 68, train_loss: 0.7941, test_loss: 0.9830, test_f1: 0.5583
 epoch: 69, train_loss: 0.7924, test_loss: 0.9995, test_f1: 0.5539
 epoch: 70, train_loss: 0.8002, test_loss: 0.9921, test_f1: 0.5510
 epoch: 71, train_loss: 0.7952, test_loss: 0.9900, test_f1: 0.5736
 epoch: 72, train_loss: 0.8023, test_loss: 0.9760, test_f1: 0.5708
 epoch: 73, train_loss: 0.7938, test_loss: 0.9794, test_f1: 0.5840
 epoch: 74, train_loss: 0.7911, test_loss: 0.9711, test_f1: 0.5566
 epoch: 75, train_loss: 0.7866, test_loss: 0.9888, test_f1: 0.5531
 epoch: 76, train_loss: 0.8038, test_loss: 0.9899, test_f1: 0.5781
 epoch: 77, train_loss: 0.7874, test_loss: 0.9843, test_f1: 0.5757
 epoch: 78, train_loss: 0.7767, test_loss: 0.9980, test_f1: 0.5812
 epoch: 79, train_loss: 0.7913, test_loss: 0.9927, test_f1: 0.5765
 epoch: 80, train_loss: 0.7684, test_loss: 0.9937, test_f1: 0.5968
 epoch: 81, train_loss: 0.7822, test_loss: 0.9760, test_f1: 0.6002
 epoch: 82, train_loss: 0.7924, test_loss: 0.9840, test_f1: 0.5814
 epoch: 83, train_loss: 0.7921, test_loss: 0.9996, test_f1: 0.5725
 epoch: 84, train_loss: 0.7790, test_loss: 0.9789, test_f1: 0.5977
 epoch: 85, train_loss: 0.7682, test_loss: 0.9993, test_f1: 0.5881
 epoch: 86, train_loss: 0.7784, test_loss: 1.0026, test_f1: 0.5581
 epoch: 87, train_loss: 0.7784, test_loss: 0.9903, test_f1: 0.5603
 epoch: 88, train_loss: 0.7684, test_loss: 0.9717, test_f1: 0.5901
 epoch: 89, train_loss: 0.7650, test_loss: 0.9804, test_f1: 0.5979
 epoch: 90, train_loss: 0.7746, test_loss: 0.9962, test_f1: 0.5907
 epoch: 91, train_loss: 0.7533, test_loss: 0.9867, test_f1: 0.5635
 epoch: 92, train_loss: 0.7518, test_loss: 1.0016, test_f1: 0.5776
 epoch: 93, train_loss: 0.7546, test_loss: 0.9927, test_f1: 0.5881
 epoch: 94, train_loss: 0.7564, test_loss: 0.9814, test_f1: 0.5681
 epoch: 95, train_loss: 0.7496, test_loss: 0.9768, test_f1: 0.5823
 epoch: 96, train_loss: 0.7599, test_loss: 0.9876, test_f1: 0.5932
 epoch: 97, train_loss: 0.7562, test_loss: 1.0002, test_f1: 0.5878
 epoch: 98, train_loss: 0.7303, test_loss: 0.9902, test_f1: 0.5981
 epoch: 99, train_loss: 0.7382, test_loss: 1.0041, test_f1: 0.5762
##################ITERATION #5 ****************************************
 epoch: 0, train_loss: 1.3216, test_loss: 1.2924, test_f1: 0.2991
 epoch: 1, train_loss: 1.1660, test_loss: 1.1869, test_f1: 0.4279
 epoch: 2, train_loss: 1.1045, test_loss: 1.1663, test_f1: 0.4682
 epoch: 3, train_loss: 1.1016, test_loss: 1.0992, test_f1: 0.4996
 epoch: 4, train_loss: 1.0738, test_loss: 1.1244, test_f1: 0.4850
 epoch: 5, train_loss: 1.0428, test_loss: 1.0994, test_f1: 0.4767
 epoch: 6, train_loss: 1.0287, test_loss: 1.1146, test_f1: 0.4801
 epoch: 7, train_loss: 1.0151, test_loss: 1.0925, test_f1: 0.4744
 epoch: 8, train_loss: 1.0163, test_loss: 1.0996, test_f1: 0.4930
 epoch: 9, train_loss: 1.0241, test_loss: 1.0642, test_f1: 0.4873
 epoch: 10, train_loss: 1.0114, test_loss: 1.0832, test_f1: 0.4912
 epoch: 11, train_loss: 0.9957, test_loss: 1.0753, test_f1: 0.4820
 epoch: 12, train_loss: 0.9952, test_loss: 1.0894, test_f1: 0.4915
 epoch: 13, train_loss: 0.9734, test_loss: 1.0594, test_f1: 0.5135
 epoch: 14, train_loss: 0.9742, test_loss: 1.0830, test_f1: 0.4995
 epoch: 15, train_loss: 0.9845, test_loss: 1.0640, test_f1: 0.5082
 epoch: 16, train_loss: 0.9636, test_loss: 1.0682, test_f1: 0.5265
 epoch: 17, train_loss: 0.9617, test_loss: 1.0670, test_f1: 0.5115
 epoch: 18, train_loss: 0.9576, test_loss: 1.0680, test_f1: 0.5258
 epoch: 19, train_loss: 0.9589, test_loss: 1.0416, test_f1: 0.5543
 epoch: 20, train_loss: 0.9527, test_loss: 1.0412, test_f1: 0.5271
 epoch: 21, train_loss: 0.9472, test_loss: 1.0264, test_f1: 0.5041
 epoch: 22, train_loss: 0.9422, test_loss: 1.0292, test_f1: 0.5102
 epoch: 23, train_loss: 0.9332, test_loss: 1.0418, test_f1: 0.4900
 epoch: 24, train_loss: 0.9343, test_loss: 1.0251, test_f1: 0.5135
 epoch: 25, train_loss: 0.9297, test_loss: 1.0231, test_f1: 0.5033
 epoch: 26, train_loss: 0.9239, test_loss: 1.0325, test_f1: 0.4936
 epoch: 27, train_loss: 0.9247, test_loss: 1.0368, test_f1: 0.4856
 epoch: 28, train_loss: 0.9175, test_loss: 1.0184, test_f1: 0.5016
 epoch: 29, train_loss: 0.9058, test_loss: 1.0083, test_f1: 0.5271
 epoch: 30, train_loss: 0.8991, test_loss: 1.0018, test_f1: 0.5212
 epoch: 31, train_loss: 0.8991, test_loss: 1.0184, test_f1: 0.5340
 epoch: 32, train_loss: 0.8935, test_loss: 1.0014, test_f1: 0.5213
 epoch: 33, train_loss: 0.8984, test_loss: 0.9864, test_f1: 0.5333
 epoch: 34, train_loss: 0.8852, test_loss: 0.9985, test_f1: 0.5706
 epoch: 35, train_loss: 0.8707, test_loss: 0.9984, test_f1: 0.5370
 epoch: 36, train_loss: 0.8704, test_loss: 0.9722, test_f1: 0.5551
 epoch: 37, train_loss: 0.8646, test_loss: 0.9769, test_f1: 0.5852
 epoch: 38, train_loss: 0.8718, test_loss: 1.0014, test_f1: 0.5825
 epoch: 39, train_loss: 0.8681, test_loss: 0.9626, test_f1: 0.5546
 epoch: 40, train_loss: 0.8550, test_loss: 0.9591, test_f1: 0.5720
 epoch: 41, train_loss: 0.8731, test_loss: 1.0021, test_f1: 0.5479
 epoch: 42, train_loss: 0.8408, test_loss: 1.0020, test_f1: 0.5641
 epoch: 43, train_loss: 0.8631, test_loss: 0.9604, test_f1: 0.5767
 epoch: 44, train_loss: 0.8587, test_loss: 0.9776, test_f1: 0.5414
 epoch: 45, train_loss: 0.8503, test_loss: 0.9678, test_f1: 0.5750
 epoch: 46, train_loss: 0.8395, test_loss: 1.0089, test_f1: 0.5645
 epoch: 47, train_loss: 0.8415, test_loss: 0.9930, test_f1: 0.5793
 epoch: 48, train_loss: 0.8317, test_loss: 0.9479, test_f1: 0.5782
 epoch: 49, train_loss: 0.8398, test_loss: 0.9430, test_f1: 0.5949
 epoch: 50, train_loss: 0.8300, test_loss: 0.9711, test_f1: 0.5784
 epoch: 51, train_loss: 0.8339, test_loss: 0.9653, test_f1: 0.5837
 epoch: 52, train_loss: 0.8231, test_loss: 0.9708, test_f1: 0.5714
 epoch: 53, train_loss: 0.8237, test_loss: 0.9636, test_f1: 0.5545
 epoch: 54, train_loss: 0.8128, test_loss: 0.9511, test_f1: 0.5862
 epoch: 55, train_loss: 0.8267, test_loss: 0.9410, test_f1: 0.5820
 epoch: 56, train_loss: 0.8269, test_loss: 0.9512, test_f1: 0.5906
 epoch: 57, train_loss: 0.8031, test_loss: 0.9620, test_f1: 0.5655
 epoch: 58, train_loss: 0.8171, test_loss: 0.9522, test_f1: 0.5898
 epoch: 59, train_loss: 0.8087, test_loss: 0.9670, test_f1: 0.5631
 epoch: 60, train_loss: 0.8141, test_loss: 0.9682, test_f1: 0.5528
 epoch: 61, train_loss: 0.7957, test_loss: 0.9880, test_f1: 0.5492
 epoch: 62, train_loss: 0.8114, test_loss: 0.9581, test_f1: 0.5694
 epoch: 63, train_loss: 0.8057, test_loss: 0.9945, test_f1: 0.5495
 epoch: 64, train_loss: 0.8270, test_loss: 0.9782, test_f1: 0.5495
 epoch: 65, train_loss: 0.8042, test_loss: 0.9622, test_f1: 0.5610
 epoch: 66, train_loss: 0.7907, test_loss: 0.9654, test_f1: 0.5219
 epoch: 67, train_loss: 0.7932, test_loss: 0.9668, test_f1: 0.5343
 epoch: 68, train_loss: 0.8017, test_loss: 0.9828, test_f1: 0.5226
 epoch: 69, train_loss: 0.7883, test_loss: 0.9676, test_f1: 0.5316
 epoch: 70, train_loss: 0.7805, test_loss: 0.9742, test_f1: 0.5329
 epoch: 71, train_loss: 0.7927, test_loss: 0.9788, test_f1: 0.5549
 epoch: 72, train_loss: 0.8080, test_loss: 0.9700, test_f1: 0.5288
 epoch: 73, train_loss: 0.7977, test_loss: 0.9758, test_f1: 0.5451
 epoch: 74, train_loss: 0.7796, test_loss: 0.9692, test_f1: 0.5494
 epoch: 75, train_loss: 0.7952, test_loss: 0.9711, test_f1: 0.5635
 epoch: 76, train_loss: 0.7759, test_loss: 0.9517, test_f1: 0.5717
 epoch: 77, train_loss: 0.7786, test_loss: 0.9500, test_f1: 0.5796
 epoch: 78, train_loss: 0.7752, test_loss: 1.0439, test_f1: 0.5164
 epoch: 79, train_loss: 0.7815, test_loss: 0.9952, test_f1: 0.5378
 epoch: 80, train_loss: 0.7859, test_loss: 0.9615, test_f1: 0.5684
 epoch: 81, train_loss: 0.8066, test_loss: 0.9543, test_f1: 0.5874
 epoch: 82, train_loss: 0.7886, test_loss: 0.9783, test_f1: 0.5628
 epoch: 83, train_loss: 0.7940, test_loss: 0.9707, test_f1: 0.5327
 epoch: 84, train_loss: 0.7847, test_loss: 0.9716, test_f1: 0.5694
 epoch: 85, train_loss: 0.7868, test_loss: 0.9801, test_f1: 0.5494
 epoch: 86, train_loss: 0.7921, test_loss: 0.9838, test_f1: 0.5418
 epoch: 87, train_loss: 0.7819, test_loss: 0.9613, test_f1: 0.5442
 epoch: 88, train_loss: 0.7808, test_loss: 0.9630, test_f1: 0.5510
 epoch: 89, train_loss: 0.7942, test_loss: 0.9723, test_f1: 0.5626
 epoch: 90, train_loss: 0.7929, test_loss: 0.9556, test_f1: 0.5451
 epoch: 91, train_loss: 0.7886, test_loss: 0.9660, test_f1: 0.5278
 epoch: 92, train_loss: 0.7725, test_loss: 0.9798, test_f1: 0.5175
 epoch: 93, train_loss: 0.7765, test_loss: 0.9713, test_f1: 0.5467
 epoch: 94, train_loss: 0.7660, test_loss: 0.9715, test_f1: 0.5635
 epoch: 95, train_loss: 0.7737, test_loss: 0.9653, test_f1: 0.5859
 epoch: 96, train_loss: 0.7571, test_loss: 0.9690, test_f1: 0.5799
 epoch: 97, train_loss: 0.7625, test_loss: 0.9491, test_f1: 0.5986
 epoch: 98, train_loss: 0.7772, test_loss: 1.0185, test_f1: 0.5410
 epoch: 99, train_loss: 0.7729, test_loss: 0.9958, test_f1: 0.5400
##################ITERATION #6 ****************************************
 epoch: 0, train_loss: 1.2540, test_loss: 1.2184, test_f1: 0.3493
 epoch: 1, train_loss: 1.1090, test_loss: 1.1086, test_f1: 0.4237
 epoch: 2, train_loss: 1.0768, test_loss: 1.0970, test_f1: 0.4252
 epoch: 3, train_loss: 1.0383, test_loss: 1.1069, test_f1: 0.4526
 epoch: 4, train_loss: 1.0256, test_loss: 1.0656, test_f1: 0.4904
 epoch: 5, train_loss: 0.9959, test_loss: 1.0949, test_f1: 0.4477
 epoch: 6, train_loss: 0.9828, test_loss: 1.0754, test_f1: 0.4840
 epoch: 7, train_loss: 0.9947, test_loss: 1.0844, test_f1: 0.5033
 epoch: 8, train_loss: 0.9704, test_loss: 1.0743, test_f1: 0.5127
 epoch: 9, train_loss: 0.9679, test_loss: 1.0664, test_f1: 0.5130
 epoch: 10, train_loss: 0.9385, test_loss: 1.0542, test_f1: 0.5357
 epoch: 11, train_loss: 0.9415, test_loss: 1.1151, test_f1: 0.4553
 epoch: 12, train_loss: 0.9493, test_loss: 1.0411, test_f1: 0.5290
 epoch: 13, train_loss: 0.9486, test_loss: 1.0674, test_f1: 0.5240
 epoch: 14, train_loss: 0.9381, test_loss: 1.0552, test_f1: 0.5155
 epoch: 15, train_loss: 0.9206, test_loss: 1.0795, test_f1: 0.5309
 epoch: 16, train_loss: 0.9308, test_loss: 1.0647, test_f1: 0.5331
 epoch: 17, train_loss: 0.9130, test_loss: 1.0460, test_f1: 0.5509
 epoch: 18, train_loss: 0.9296, test_loss: 1.0623, test_f1: 0.5270
 epoch: 19, train_loss: 0.9087, test_loss: 1.0410, test_f1: 0.5428
 epoch: 20, train_loss: 0.9112, test_loss: 1.0118, test_f1: 0.5462
 epoch: 21, train_loss: 0.9093, test_loss: 1.0355, test_f1: 0.5421
 epoch: 22, train_loss: 0.9122, test_loss: 1.0335, test_f1: 0.5445
 epoch: 23, train_loss: 0.9041, test_loss: 1.0100, test_f1: 0.5312
 epoch: 24, train_loss: 0.8928, test_loss: 1.0240, test_f1: 0.5374
 epoch: 25, train_loss: 0.8882, test_loss: 1.0007, test_f1: 0.5772
 epoch: 26, train_loss: 0.8817, test_loss: 1.0593, test_f1: 0.5697
 epoch: 27, train_loss: 0.8776, test_loss: 1.0182, test_f1: 0.5570
 epoch: 28, train_loss: 0.8726, test_loss: 0.9852, test_f1: 0.5557
 epoch: 29, train_loss: 0.8802, test_loss: 1.0056, test_f1: 0.5577
 epoch: 30, train_loss: 0.8661, test_loss: 1.0403, test_f1: 0.5472
 epoch: 31, train_loss: 0.8411, test_loss: 1.0100, test_f1: 0.5729
 epoch: 32, train_loss: 0.8625, test_loss: 1.0648, test_f1: 0.5166
 epoch: 33, train_loss: 0.8516, test_loss: 1.0100, test_f1: 0.5595
 epoch: 34, train_loss: 0.8497, test_loss: 1.0384, test_f1: 0.5578
 epoch: 35, train_loss: 0.8429, test_loss: 1.0243, test_f1: 0.5639
 epoch: 36, train_loss: 0.8342, test_loss: 1.0119, test_f1: 0.5670
 epoch: 37, train_loss: 0.8268, test_loss: 0.9949, test_f1: 0.5659
 epoch: 38, train_loss: 0.8350, test_loss: 1.0029, test_f1: 0.5718
 epoch: 39, train_loss: 0.8444, test_loss: 1.0797, test_f1: 0.5309
 epoch: 40, train_loss: 0.8284, test_loss: 0.9890, test_f1: 0.5690
 epoch: 41, train_loss: 0.8331, test_loss: 1.0257, test_f1: 0.5642
 epoch: 42, train_loss: 0.8261, test_loss: 1.0001, test_f1: 0.5587
 epoch: 43, train_loss: 0.8348, test_loss: 0.9851, test_f1: 0.5622
 epoch: 44, train_loss: 0.8182, test_loss: 0.9853, test_f1: 0.5634
 epoch: 45, train_loss: 0.8108, test_loss: 1.0019, test_f1: 0.5676
 epoch: 46, train_loss: 0.8302, test_loss: 0.9954, test_f1: 0.5655
 epoch: 47, train_loss: 0.8219, test_loss: 1.0052, test_f1: 0.5761
 epoch: 48, train_loss: 0.8098, test_loss: 0.9803, test_f1: 0.5827
 epoch: 49, train_loss: 0.7998, test_loss: 1.0346, test_f1: 0.5714
 epoch: 50, train_loss: 0.8137, test_loss: 1.0295, test_f1: 0.5605
 epoch: 51, train_loss: 0.8161, test_loss: 0.9938, test_f1: 0.5808
 epoch: 52, train_loss: 0.8055, test_loss: 0.9783, test_f1: 0.5710
 epoch: 53, train_loss: 0.7908, test_loss: 0.9883, test_f1: 0.6035
 epoch: 54, train_loss: 0.7927, test_loss: 0.9896, test_f1: 0.5895
 epoch: 55, train_loss: 0.7913, test_loss: 0.9965, test_f1: 0.5891
 epoch: 56, train_loss: 0.7762, test_loss: 1.0340, test_f1: 0.5650
 epoch: 57, train_loss: 0.7883, test_loss: 1.0090, test_f1: 0.5913
 epoch: 58, train_loss: 0.7993, test_loss: 0.9946, test_f1: 0.5666
 epoch: 59, train_loss: 0.7800, test_loss: 0.9981, test_f1: 0.5673
 epoch: 60, train_loss: 0.7780, test_loss: 0.9956, test_f1: 0.5806
 epoch: 61, train_loss: 0.7714, test_loss: 0.9904, test_f1: 0.5758
 epoch: 62, train_loss: 0.7909, test_loss: 0.9955, test_f1: 0.5894
 epoch: 63, train_loss: 0.7893, test_loss: 0.9946, test_f1: 0.5735
 epoch: 64, train_loss: 0.7698, test_loss: 1.0563, test_f1: 0.5399
 epoch: 65, train_loss: 0.7855, test_loss: 1.0044, test_f1: 0.5909
 epoch: 66, train_loss: 0.7784, test_loss: 0.9950, test_f1: 0.5982
 epoch: 67, train_loss: 0.7802, test_loss: 1.0076, test_f1: 0.5895
 epoch: 68, train_loss: 0.7651, test_loss: 1.0174, test_f1: 0.5936
 epoch: 69, train_loss: 0.7521, test_loss: 0.9862, test_f1: 0.5873
 epoch: 70, train_loss: 0.7645, test_loss: 0.9920, test_f1: 0.5732
 epoch: 71, train_loss: 0.7720, test_loss: 1.0106, test_f1: 0.5859
 epoch: 72, train_loss: 0.7609, test_loss: 0.9890, test_f1: 0.5861
 epoch: 73, train_loss: 0.7606, test_loss: 0.9981, test_f1: 0.5834
 epoch: 74, train_loss: 0.7721, test_loss: 0.9934, test_f1: 0.5938
 epoch: 75, train_loss: 0.7629, test_loss: 0.9921, test_f1: 0.5782
 epoch: 76, train_loss: 0.7729, test_loss: 0.9937, test_f1: 0.5831
 epoch: 77, train_loss: 0.7696, test_loss: 0.9993, test_f1: 0.5987
 epoch: 78, train_loss: 0.7654, test_loss: 1.0023, test_f1: 0.5929
 epoch: 79, train_loss: 0.7690, test_loss: 1.0090, test_f1: 0.5854
 epoch: 80, train_loss: 0.7584, test_loss: 1.0069, test_f1: 0.6020
 epoch: 81, train_loss: 0.7529, test_loss: 0.9993, test_f1: 0.5933
 epoch: 82, train_loss: 0.7419, test_loss: 1.0236, test_f1: 0.5815
 epoch: 83, train_loss: 0.7694, test_loss: 0.9889, test_f1: 0.5689
 epoch: 84, train_loss: 0.7569, test_loss: 1.0139, test_f1: 0.5749
 epoch: 85, train_loss: 0.7423, test_loss: 1.0013, test_f1: 0.6050
 epoch: 86, train_loss: 0.7510, test_loss: 1.0001, test_f1: 0.5857
 epoch: 87, train_loss: 0.7495, test_loss: 0.9990, test_f1: 0.6012
 epoch: 88, train_loss: 0.7379, test_loss: 1.0327, test_f1: 0.5762
 epoch: 89, train_loss: 0.7611, test_loss: 1.0039, test_f1: 0.5560
 epoch: 90, train_loss: 0.7498, test_loss: 1.0143, test_f1: 0.5629
 epoch: 91, train_loss: 0.7591, test_loss: 1.0201, test_f1: 0.5679
 epoch: 92, train_loss: 0.7499, test_loss: 1.0039, test_f1: 0.5708
 epoch: 93, train_loss: 0.7753, test_loss: 1.0181, test_f1: 0.5897
 epoch: 94, train_loss: 0.7366, test_loss: 1.0119, test_f1: 0.5931
 epoch: 95, train_loss: 0.7412, test_loss: 1.0155, test_f1: 0.5968
 epoch: 96, train_loss: 0.7430, test_loss: 1.0150, test_f1: 0.6085
 epoch: 97, train_loss: 0.7523, test_loss: 1.0079, test_f1: 0.6027
 epoch: 98, train_loss: 0.7396, test_loss: 1.0234, test_f1: 0.5929
 epoch: 99, train_loss: 0.7438, test_loss: 1.0234, test_f1: 0.5873
##################ITERATION #7 ****************************************
 epoch: 0, train_loss: 1.4315, test_loss: 1.2691, test_f1: 0.3685
 epoch: 1, train_loss: 1.1972, test_loss: 1.1919, test_f1: 0.4357
 epoch: 2, train_loss: 1.1652, test_loss: 1.1848, test_f1: 0.4180
 epoch: 3, train_loss: 1.1247, test_loss: 1.1752, test_f1: 0.4167
 epoch: 4, train_loss: 1.1022, test_loss: 1.1446, test_f1: 0.4212
 epoch: 5, train_loss: 1.1199, test_loss: 1.1360, test_f1: 0.4311
 epoch: 6, train_loss: 1.0702, test_loss: 1.1025, test_f1: 0.4433
 epoch: 7, train_loss: 1.0775, test_loss: 1.0761, test_f1: 0.4713
 epoch: 8, train_loss: 1.0549, test_loss: 1.0690, test_f1: 0.4920
 epoch: 9, train_loss: 1.0495, test_loss: 1.0535, test_f1: 0.5007
 epoch: 10, train_loss: 1.0109, test_loss: 1.0475, test_f1: 0.4973
 epoch: 11, train_loss: 1.0171, test_loss: 1.0236, test_f1: 0.5174
 epoch: 12, train_loss: 1.0039, test_loss: 1.0004, test_f1: 0.5430
 epoch: 13, train_loss: 0.9917, test_loss: 0.9999, test_f1: 0.5414
 epoch: 14, train_loss: 0.9796, test_loss: 1.0114, test_f1: 0.5378
 epoch: 15, train_loss: 0.9886, test_loss: 0.9876, test_f1: 0.5564
 epoch: 16, train_loss: 0.9657, test_loss: 0.9779, test_f1: 0.5326
 epoch: 17, train_loss: 0.9528, test_loss: 1.0187, test_f1: 0.5405
 epoch: 18, train_loss: 0.9514, test_loss: 0.9683, test_f1: 0.5300
 epoch: 19, train_loss: 0.9545, test_loss: 0.9872, test_f1: 0.5270
 epoch: 20, train_loss: 0.9417, test_loss: 0.9757, test_f1: 0.5423
 epoch: 21, train_loss: 0.9479, test_loss: 1.0069, test_f1: 0.5636
 epoch: 22, train_loss: 0.9152, test_loss: 0.9932, test_f1: 0.5224
 epoch: 23, train_loss: 0.9142, test_loss: 0.9923, test_f1: 0.5298
 epoch: 24, train_loss: 0.9161, test_loss: 0.9697, test_f1: 0.5460
 epoch: 25, train_loss: 0.9135, test_loss: 0.9540, test_f1: 0.5435
 epoch: 26, train_loss: 0.9091, test_loss: 0.9841, test_f1: 0.5378
 epoch: 27, train_loss: 0.9011, test_loss: 0.9825, test_f1: 0.5132
 epoch: 28, train_loss: 0.8930, test_loss: 0.9534, test_f1: 0.5524
 epoch: 29, train_loss: 0.8870, test_loss: 0.9948, test_f1: 0.5639
 epoch: 30, train_loss: 0.8771, test_loss: 0.9717, test_f1: 0.5361
 epoch: 31, train_loss: 0.8808, test_loss: 0.9744, test_f1: 0.5008
 epoch: 32, train_loss: 0.8715, test_loss: 0.9640, test_f1: 0.5369
 epoch: 33, train_loss: 0.8765, test_loss: 0.9731, test_f1: 0.5320
 epoch: 34, train_loss: 0.8722, test_loss: 0.9721, test_f1: 0.5221
 epoch: 35, train_loss: 0.8490, test_loss: 0.9825, test_f1: 0.5356
 epoch: 36, train_loss: 0.8734, test_loss: 0.9765, test_f1: 0.5163
 epoch: 37, train_loss: 0.8511, test_loss: 0.9560, test_f1: 0.5462
 epoch: 38, train_loss: 0.8412, test_loss: 0.9858, test_f1: 0.5243
 epoch: 39, train_loss: 0.8567, test_loss: 0.9562, test_f1: 0.5606
 epoch: 40, train_loss: 0.8532, test_loss: 1.0225, test_f1: 0.5068
 epoch: 41, train_loss: 0.8614, test_loss: 0.9767, test_f1: 0.5606
 epoch: 42, train_loss: 0.8276, test_loss: 0.9963, test_f1: 0.5075
 epoch: 43, train_loss: 0.8530, test_loss: 0.9735, test_f1: 0.5365
 epoch: 44, train_loss: 0.8347, test_loss: 0.9775, test_f1: 0.5278
 epoch: 45, train_loss: 0.8299, test_loss: 1.0081, test_f1: 0.5051
 epoch: 46, train_loss: 0.8441, test_loss: 0.9879, test_f1: 0.5139
 epoch: 47, train_loss: 0.8149, test_loss: 1.0161, test_f1: 0.5314
 epoch: 48, train_loss: 0.8300, test_loss: 1.0003, test_f1: 0.5370
 epoch: 49, train_loss: 0.8271, test_loss: 0.9824, test_f1: 0.5332
 epoch: 50, train_loss: 0.8042, test_loss: 1.0196, test_f1: 0.5184
 epoch: 51, train_loss: 0.8119, test_loss: 1.0203, test_f1: 0.5073
 epoch: 52, train_loss: 0.7983, test_loss: 0.9808, test_f1: 0.5265
 epoch: 53, train_loss: 0.8141, test_loss: 0.9861, test_f1: 0.5180
 epoch: 54, train_loss: 0.8133, test_loss: 1.0035, test_f1: 0.5335
 epoch: 55, train_loss: 0.8073, test_loss: 1.0100, test_f1: 0.5231
 epoch: 56, train_loss: 0.8060, test_loss: 0.9954, test_f1: 0.5187
 epoch: 57, train_loss: 0.8099, test_loss: 1.0032, test_f1: 0.5179
 epoch: 58, train_loss: 0.8044, test_loss: 0.9915, test_f1: 0.5507
 epoch: 59, train_loss: 0.7935, test_loss: 1.0071, test_f1: 0.5326
 epoch: 60, train_loss: 0.7882, test_loss: 0.9984, test_f1: 0.5170
 epoch: 61, train_loss: 0.8066, test_loss: 0.9881, test_f1: 0.5503
 epoch: 62, train_loss: 0.7802, test_loss: 1.0052, test_f1: 0.5392
 epoch: 63, train_loss: 0.7812, test_loss: 1.0106, test_f1: 0.5130
 epoch: 64, train_loss: 0.7804, test_loss: 1.0364, test_f1: 0.5330
 epoch: 65, train_loss: 0.8065, test_loss: 1.0515, test_f1: 0.5064
 epoch: 66, train_loss: 0.7909, test_loss: 0.9934, test_f1: 0.5326
 epoch: 67, train_loss: 0.7835, test_loss: 1.0343, test_f1: 0.5325
 epoch: 68, train_loss: 0.7712, test_loss: 1.0219, test_f1: 0.5379
 epoch: 69, train_loss: 0.7758, test_loss: 1.0297, test_f1: 0.5286
 epoch: 70, train_loss: 0.7756, test_loss: 1.0340, test_f1: 0.5117
 epoch: 71, train_loss: 0.7936, test_loss: 1.0444, test_f1: 0.5110
 epoch: 72, train_loss: 0.7833, test_loss: 0.9857, test_f1: 0.5339
 epoch: 73, train_loss: 0.7805, test_loss: 1.0470, test_f1: 0.5303
 epoch: 74, train_loss: 0.7905, test_loss: 1.0282, test_f1: 0.5408
 epoch: 75, train_loss: 0.7732, test_loss: 1.0383, test_f1: 0.4966
 epoch: 76, train_loss: 0.7861, test_loss: 1.0474, test_f1: 0.5376
 epoch: 77, train_loss: 0.7770, test_loss: 1.0199, test_f1: 0.5372
 epoch: 78, train_loss: 0.7642, test_loss: 1.0301, test_f1: 0.5264
 epoch: 79, train_loss: 0.7750, test_loss: 1.0149, test_f1: 0.5514
 epoch: 80, train_loss: 0.7781, test_loss: 1.0297, test_f1: 0.5462
 epoch: 81, train_loss: 0.7750, test_loss: 1.0222, test_f1: 0.5284
 epoch: 82, train_loss: 0.7804, test_loss: 1.0360, test_f1: 0.5224
 epoch: 83, train_loss: 0.7691, test_loss: 0.9954, test_f1: 0.5361
 epoch: 84, train_loss: 0.7811, test_loss: 1.0153, test_f1: 0.5475
 epoch: 85, train_loss: 0.7691, test_loss: 1.0041, test_f1: 0.5581
 epoch: 86, train_loss: 0.7777, test_loss: 1.0315, test_f1: 0.5428
 epoch: 87, train_loss: 0.7667, test_loss: 1.0488, test_f1: 0.5430
 epoch: 88, train_loss: 0.7704, test_loss: 1.0091, test_f1: 0.5759
 epoch: 89, train_loss: 0.7672, test_loss: 1.0077, test_f1: 0.5515
 epoch: 90, train_loss: 0.7709, test_loss: 1.0195, test_f1: 0.5274
 epoch: 91, train_loss: 0.7660, test_loss: 1.0049, test_f1: 0.5662
 epoch: 92, train_loss: 0.7744, test_loss: 1.0102, test_f1: 0.5639
 epoch: 93, train_loss: 0.7541, test_loss: 1.0199, test_f1: 0.5726
 epoch: 94, train_loss: 0.7648, test_loss: 1.0237, test_f1: 0.5424
 epoch: 95, train_loss: 0.7686, test_loss: 1.0399, test_f1: 0.5423
 epoch: 96, train_loss: 0.7547, test_loss: 1.0164, test_f1: 0.5469
 epoch: 97, train_loss: 0.7570, test_loss: 1.0198, test_f1: 0.5416
 epoch: 98, train_loss: 0.7637, test_loss: 1.0338, test_f1: 0.5239
 epoch: 99, train_loss: 0.7577, test_loss: 1.0435, test_f1: 0.5291
##################ITERATION #8 ****************************************
 epoch: 0, train_loss: 1.4266, test_loss: 1.2869, test_f1: 0.3289
 epoch: 1, train_loss: 1.1715, test_loss: 1.2385, test_f1: 0.3494
 epoch: 2, train_loss: 1.1689, test_loss: 1.2321, test_f1: 0.3567
 epoch: 3, train_loss: 1.1120, test_loss: 1.1772, test_f1: 0.3953
 epoch: 4, train_loss: 1.0958, test_loss: 1.1620, test_f1: 0.3937
 epoch: 5, train_loss: 1.0687, test_loss: 1.1557, test_f1: 0.4561
 epoch: 6, train_loss: 1.0658, test_loss: 1.1445, test_f1: 0.4371
 epoch: 7, train_loss: 1.0419, test_loss: 1.1380, test_f1: 0.4267
 epoch: 8, train_loss: 1.0289, test_loss: 1.0993, test_f1: 0.4398
 epoch: 9, train_loss: 1.0124, test_loss: 1.1159, test_f1: 0.4324
 epoch: 10, train_loss: 1.0105, test_loss: 1.1297, test_f1: 0.4556
 epoch: 11, train_loss: 1.0056, test_loss: 1.0982, test_f1: 0.4488
 epoch: 12, train_loss: 0.9934, test_loss: 1.1061, test_f1: 0.4574
 epoch: 13, train_loss: 0.9585, test_loss: 1.0824, test_f1: 0.4600
 epoch: 14, train_loss: 0.9659, test_loss: 1.0677, test_f1: 0.4399
 epoch: 15, train_loss: 0.9782, test_loss: 1.0737, test_f1: 0.4781
 epoch: 16, train_loss: 0.9676, test_loss: 1.0455, test_f1: 0.4590
 epoch: 17, train_loss: 0.9607, test_loss: 1.0954, test_f1: 0.4764
 epoch: 18, train_loss: 0.9437, test_loss: 1.0937, test_f1: 0.4869
 epoch: 19, train_loss: 0.9395, test_loss: 1.0673, test_f1: 0.4561
 epoch: 20, train_loss: 0.9482, test_loss: 1.0865, test_f1: 0.4801
 epoch: 21, train_loss: 0.9274, test_loss: 1.0597, test_f1: 0.4879
 epoch: 22, train_loss: 0.9359, test_loss: 1.0762, test_f1: 0.4784
 epoch: 23, train_loss: 0.9229, test_loss: 1.0401, test_f1: 0.4830
 epoch: 24, train_loss: 0.9272, test_loss: 1.0728, test_f1: 0.4743
 epoch: 25, train_loss: 0.9069, test_loss: 1.0731, test_f1: 0.4904
 epoch: 26, train_loss: 0.9023, test_loss: 1.0558, test_f1: 0.4945
 epoch: 27, train_loss: 0.9162, test_loss: 0.9883, test_f1: 0.4875
 epoch: 28, train_loss: 0.9112, test_loss: 1.0620, test_f1: 0.4708
 epoch: 29, train_loss: 0.8997, test_loss: 1.0673, test_f1: 0.4934
 epoch: 30, train_loss: 0.9143, test_loss: 1.0906, test_f1: 0.4820
 epoch: 31, train_loss: 0.9043, test_loss: 1.0633, test_f1: 0.4975
 epoch: 32, train_loss: 0.8897, test_loss: 1.0259, test_f1: 0.4988
 epoch: 33, train_loss: 0.8937, test_loss: 1.0847, test_f1: 0.4795
 epoch: 34, train_loss: 0.8764, test_loss: 1.0608, test_f1: 0.4949
 epoch: 35, train_loss: 0.8837, test_loss: 1.0530, test_f1: 0.4744
 epoch: 36, train_loss: 0.8802, test_loss: 1.0369, test_f1: 0.4855
 epoch: 37, train_loss: 0.8841, test_loss: 1.0699, test_f1: 0.4786
 epoch: 38, train_loss: 0.8802, test_loss: 1.0609, test_f1: 0.5372
 epoch: 39, train_loss: 0.8623, test_loss: 1.0432, test_f1: 0.5256
 epoch: 40, train_loss: 0.8743, test_loss: 1.0714, test_f1: 0.4749
 epoch: 41, train_loss: 0.8665, test_loss: 1.0295, test_f1: 0.5526
 epoch: 42, train_loss: 0.8729, test_loss: 1.0282, test_f1: 0.5128
 epoch: 43, train_loss: 0.8530, test_loss: 1.0664, test_f1: 0.4727
 epoch: 44, train_loss: 0.8497, test_loss: 1.0966, test_f1: 0.4991
 epoch: 45, train_loss: 0.8523, test_loss: 1.0969, test_f1: 0.5093
 epoch: 46, train_loss: 0.8393, test_loss: 1.0487, test_f1: 0.5463
 epoch: 47, train_loss: 0.8381, test_loss: 1.0171, test_f1: 0.5289
 epoch: 48, train_loss: 0.8449, test_loss: 1.0149, test_f1: 0.5281
 epoch: 49, train_loss: 0.8263, test_loss: 1.0208, test_f1: 0.5344
 epoch: 50, train_loss: 0.8460, test_loss: 1.0365, test_f1: 0.5445
 epoch: 51, train_loss: 0.8305, test_loss: 1.0535, test_f1: 0.5186
 epoch: 52, train_loss: 0.8170, test_loss: 1.0279, test_f1: 0.5447
 epoch: 53, train_loss: 0.8148, test_loss: 1.0102, test_f1: 0.5457
 epoch: 54, train_loss: 0.8153, test_loss: 1.0232, test_f1: 0.4924
 epoch: 55, train_loss: 0.8046, test_loss: 1.0305, test_f1: 0.5425
 epoch: 56, train_loss: 0.8019, test_loss: 1.0274, test_f1: 0.5481
 epoch: 57, train_loss: 0.8183, test_loss: 1.0327, test_f1: 0.5576
 epoch: 58, train_loss: 0.8126, test_loss: 0.9940, test_f1: 0.5616
 epoch: 59, train_loss: 0.7959, test_loss: 1.0427, test_f1: 0.5292
 epoch: 60, train_loss: 0.7947, test_loss: 1.0220, test_f1: 0.5386
 epoch: 61, train_loss: 0.8073, test_loss: 1.0051, test_f1: 0.5496
 epoch: 62, train_loss: 0.7920, test_loss: 1.0399, test_f1: 0.5627
 epoch: 63, train_loss: 0.8126, test_loss: 1.0322, test_f1: 0.5383
 epoch: 64, train_loss: 0.8062, test_loss: 1.0325, test_f1: 0.5758
 epoch: 65, train_loss: 0.7980, test_loss: 1.0124, test_f1: 0.5231
 epoch: 66, train_loss: 0.7931, test_loss: 1.0485, test_f1: 0.5612
 epoch: 67, train_loss: 0.8008, test_loss: 1.0141, test_f1: 0.5465
 epoch: 68, train_loss: 0.8068, test_loss: 1.0151, test_f1: 0.5574
 epoch: 69, train_loss: 0.7792, test_loss: 1.0314, test_f1: 0.5847
 epoch: 70, train_loss: 0.7952, test_loss: 1.0539, test_f1: 0.5668
 epoch: 71, train_loss: 0.7909, test_loss: 1.0320, test_f1: 0.5439
 epoch: 72, train_loss: 0.7833, test_loss: 1.0383, test_f1: 0.5498
 epoch: 73, train_loss: 0.7828, test_loss: 1.0277, test_f1: 0.5581
 epoch: 74, train_loss: 0.7954, test_loss: 1.0190, test_f1: 0.5629
 epoch: 75, train_loss: 0.7762, test_loss: 1.0420, test_f1: 0.5266
 epoch: 76, train_loss: 0.7813, test_loss: 1.0407, test_f1: 0.5550
 epoch: 77, train_loss: 0.7705, test_loss: 1.0382, test_f1: 0.5634
 epoch: 78, train_loss: 0.7849, test_loss: 1.0499, test_f1: 0.5308
 epoch: 79, train_loss: 0.7750, test_loss: 1.0188, test_f1: 0.5661
 epoch: 80, train_loss: 0.7839, test_loss: 1.0199, test_f1: 0.5609
 epoch: 81, train_loss: 0.7724, test_loss: 1.0765, test_f1: 0.5510
 epoch: 82, train_loss: 0.7726, test_loss: 1.0243, test_f1: 0.5742
 epoch: 83, train_loss: 0.7728, test_loss: 1.0234, test_f1: 0.5488
 epoch: 84, train_loss: 0.7696, test_loss: 1.0216, test_f1: 0.5686
 epoch: 85, train_loss: 0.7673, test_loss: 1.0401, test_f1: 0.5576
 epoch: 86, train_loss: 0.7560, test_loss: 1.0012, test_f1: 0.5624
 epoch: 87, train_loss: 0.7593, test_loss: 1.0470, test_f1: 0.5731
 epoch: 88, train_loss: 0.7577, test_loss: 1.0343, test_f1: 0.5706
 epoch: 89, train_loss: 0.7505, test_loss: 1.0342, test_f1: 0.5879
 epoch: 90, train_loss: 0.7697, test_loss: 1.0618, test_f1: 0.5450
 epoch: 91, train_loss: 0.7613, test_loss: 1.0095, test_f1: 0.5828
 epoch: 92, train_loss: 0.7739, test_loss: 1.0455, test_f1: 0.5542
 epoch: 93, train_loss: 0.7594, test_loss: 1.0264, test_f1: 0.5733
 epoch: 94, train_loss: 0.7611, test_loss: 1.0424, test_f1: 0.5578
 epoch: 95, train_loss: 0.7568, test_loss: 1.0235, test_f1: 0.5670
 epoch: 96, train_loss: 0.7434, test_loss: 1.0369, test_f1: 0.5494
 epoch: 97, train_loss: 0.7618, test_loss: 1.0001, test_f1: 0.5604
 epoch: 98, train_loss: 0.7469, test_loss: 1.0734, test_f1: 0.5475
 epoch: 99, train_loss: 0.7526, test_loss: 1.0247, test_f1: 0.5536
##################ITERATION #9 ****************************************
 epoch: 0, train_loss: 1.5150, test_loss: 1.3131, test_f1: 0.3439
 epoch: 1, train_loss: 1.1854, test_loss: 1.2944, test_f1: 0.3680
 epoch: 2, train_loss: 1.1532, test_loss: 1.2305, test_f1: 0.4104
 epoch: 3, train_loss: 1.1152, test_loss: 1.1865, test_f1: 0.4571
 epoch: 4, train_loss: 1.1069, test_loss: 1.1574, test_f1: 0.4675
 epoch: 5, train_loss: 1.0738, test_loss: 1.1589, test_f1: 0.4783
 epoch: 6, train_loss: 1.0634, test_loss: 1.1477, test_f1: 0.4607
 epoch: 7, train_loss: 1.0418, test_loss: 1.1293, test_f1: 0.4886
 epoch: 8, train_loss: 1.0359, test_loss: 1.0991, test_f1: 0.4989
 epoch: 9, train_loss: 1.0246, test_loss: 1.1417, test_f1: 0.4595
 epoch: 10, train_loss: 0.9904, test_loss: 1.1332, test_f1: 0.4569
 epoch: 11, train_loss: 0.9916, test_loss: 1.0776, test_f1: 0.4993
 epoch: 12, train_loss: 0.9717, test_loss: 1.0777, test_f1: 0.5277
 epoch: 13, train_loss: 0.9677, test_loss: 1.0753, test_f1: 0.5130
 epoch: 14, train_loss: 0.9567, test_loss: 1.1068, test_f1: 0.4725
 epoch: 15, train_loss: 0.9537, test_loss: 1.0839, test_f1: 0.5151
 epoch: 16, train_loss: 0.9394, test_loss: 1.1138, test_f1: 0.5070
 epoch: 17, train_loss: 0.9368, test_loss: 1.0600, test_f1: 0.5325
 epoch: 18, train_loss: 0.9358, test_loss: 1.0580, test_f1: 0.5344
 epoch: 19, train_loss: 0.9325, test_loss: 1.0553, test_f1: 0.5351
 epoch: 20, train_loss: 0.9294, test_loss: 1.0507, test_f1: 0.4959
 epoch: 21, train_loss: 0.9277, test_loss: 1.0759, test_f1: 0.5242
 epoch: 22, train_loss: 0.9074, test_loss: 1.0843, test_f1: 0.5086
 epoch: 23, train_loss: 0.9192, test_loss: 1.0724, test_f1: 0.5331
 epoch: 24, train_loss: 0.8995, test_loss: 1.0652, test_f1: 0.5343
 epoch: 25, train_loss: 0.8827, test_loss: 1.0595, test_f1: 0.5278
 epoch: 26, train_loss: 0.8800, test_loss: 1.0479, test_f1: 0.5274
 epoch: 27, train_loss: 0.8738, test_loss: 1.0909, test_f1: 0.5178
 epoch: 28, train_loss: 0.8749, test_loss: 1.0350, test_f1: 0.5398
 epoch: 29, train_loss: 0.8612, test_loss: 1.0461, test_f1: 0.5208
 epoch: 30, train_loss: 0.8724, test_loss: 1.0447, test_f1: 0.5374
 epoch: 31, train_loss: 0.8609, test_loss: 1.0161, test_f1: 0.5389
 epoch: 32, train_loss: 0.8609, test_loss: 1.0594, test_f1: 0.5376
 epoch: 33, train_loss: 0.8727, test_loss: 1.0609, test_f1: 0.5204
 epoch: 34, train_loss: 0.8590, test_loss: 1.0273, test_f1: 0.5309
 epoch: 35, train_loss: 0.8336, test_loss: 1.0575, test_f1: 0.5284
 epoch: 36, train_loss: 0.8524, test_loss: 1.0358, test_f1: 0.5212
 epoch: 37, train_loss: 0.8352, test_loss: 1.0791, test_f1: 0.5058
 epoch: 38, train_loss: 0.8444, test_loss: 1.0937, test_f1: 0.5199
 epoch: 39, train_loss: 0.8487, test_loss: 1.0705, test_f1: 0.5055
 epoch: 40, train_loss: 0.8120, test_loss: 1.0643, test_f1: 0.5186
 epoch: 41, train_loss: 0.8216, test_loss: 1.0553, test_f1: 0.5402
 epoch: 42, train_loss: 0.8331, test_loss: 1.1164, test_f1: 0.5521
 epoch: 43, train_loss: 0.8125, test_loss: 1.0935, test_f1: 0.5192
 epoch: 44, train_loss: 0.7950, test_loss: 1.1084, test_f1: 0.5110
 epoch: 45, train_loss: 0.8089, test_loss: 1.0532, test_f1: 0.5372
 epoch: 46, train_loss: 0.8169, test_loss: 1.0298, test_f1: 0.5292
 epoch: 47, train_loss: 0.8161, test_loss: 1.1031, test_f1: 0.5057
 epoch: 48, train_loss: 0.8038, test_loss: 1.1007, test_f1: 0.5179
 epoch: 49, train_loss: 0.8053, test_loss: 1.0016, test_f1: 0.5321
 epoch: 50, train_loss: 0.8021, test_loss: 1.0391, test_f1: 0.5193
 epoch: 51, train_loss: 0.7650, test_loss: 1.0715, test_f1: 0.5165
 epoch: 52, train_loss: 0.7817, test_loss: 1.0488, test_f1: 0.5040
 epoch: 53, train_loss: 0.7702, test_loss: 1.0862, test_f1: 0.5382
 epoch: 54, train_loss: 0.7757, test_loss: 1.0848, test_f1: 0.5279
 epoch: 55, train_loss: 0.7702, test_loss: 1.0650, test_f1: 0.5287
 epoch: 56, train_loss: 0.7687, test_loss: 1.0622, test_f1: 0.5294
 epoch: 57, train_loss: 0.7675, test_loss: 1.0862, test_f1: 0.5040
 epoch: 58, train_loss: 0.7783, test_loss: 1.0849, test_f1: 0.5214
 epoch: 59, train_loss: 0.7477, test_loss: 1.0829, test_f1: 0.5288
 epoch: 60, train_loss: 0.7697, test_loss: 1.0805, test_f1: 0.5222
 epoch: 61, train_loss: 0.7815, test_loss: 1.1017, test_f1: 0.5167
 epoch: 62, train_loss: 0.7642, test_loss: 1.0404, test_f1: 0.5249
 epoch: 63, train_loss: 0.7545, test_loss: 1.1206, test_f1: 0.5354
 epoch: 64, train_loss: 0.7477, test_loss: 1.0604, test_f1: 0.5379
 epoch: 65, train_loss: 0.7512, test_loss: 1.1242, test_f1: 0.5341
 epoch: 66, train_loss: 0.7610, test_loss: 1.0912, test_f1: 0.5214
 epoch: 67, train_loss: 0.7695, test_loss: 1.0454, test_f1: 0.5631
 epoch: 68, train_loss: 0.7419, test_loss: 1.1453, test_f1: 0.5149
 epoch: 69, train_loss: 0.7448, test_loss: 1.0660, test_f1: 0.5247
 epoch: 70, train_loss: 0.7373, test_loss: 1.0903, test_f1: 0.5407
 epoch: 71, train_loss: 0.7453, test_loss: 1.0869, test_f1: 0.5669
 epoch: 72, train_loss: 0.7514, test_loss: 1.0777, test_f1: 0.5370
 epoch: 73, train_loss: 0.7406, test_loss: 1.0975, test_f1: 0.5408
 epoch: 74, train_loss: 0.7418, test_loss: 1.0808, test_f1: 0.5509
 epoch: 75, train_loss: 0.7444, test_loss: 1.1728, test_f1: 0.5366
 epoch: 76, train_loss: 0.7173, test_loss: 1.1135, test_f1: 0.5396
 epoch: 77, train_loss: 0.7485, test_loss: 1.0727, test_f1: 0.5395
 epoch: 78, train_loss: 0.7466, test_loss: 1.0759, test_f1: 0.5846
 epoch: 79, train_loss: 0.7289, test_loss: 1.0554, test_f1: 0.5682
 epoch: 80, train_loss: 0.7388, test_loss: 1.0966, test_f1: 0.5436
 epoch: 81, train_loss: 0.7301, test_loss: 1.0980, test_f1: 0.5744
 epoch: 82, train_loss: 0.7524, test_loss: 1.0855, test_f1: 0.5506
 epoch: 83, train_loss: 0.7339, test_loss: 1.0392, test_f1: 0.5645
 epoch: 84, train_loss: 0.7336, test_loss: 1.0443, test_f1: 0.5497
 epoch: 85, train_loss: 0.7413, test_loss: 1.0789, test_f1: 0.5576
 epoch: 86, train_loss: 0.7289, test_loss: 0.9958, test_f1: 0.5804
 epoch: 87, train_loss: 0.7165, test_loss: 1.1026, test_f1: 0.5328
 epoch: 88, train_loss: 0.7272, test_loss: 1.1016, test_f1: 0.5666
 epoch: 89, train_loss: 0.7046, test_loss: 1.0235, test_f1: 0.5689
 epoch: 90, train_loss: 0.7224, test_loss: 1.0512, test_f1: 0.5597
 epoch: 91, train_loss: 0.7207, test_loss: 1.1260, test_f1: 0.5640
 epoch: 92, train_loss: 0.7271, test_loss: 1.0666, test_f1: 0.5494
 epoch: 93, train_loss: 0.7166, test_loss: 1.1097, test_f1: 0.5746
 epoch: 94, train_loss: 0.7236, test_loss: 1.0745, test_f1: 0.5588
 epoch: 95, train_loss: 0.7268, test_loss: 1.0696, test_f1: 0.5438
 epoch: 96, train_loss: 0.7247, test_loss: 1.0700, test_f1: 0.5543
 epoch: 97, train_loss: 0.7336, test_loss: 1.0966, test_f1: 0.5580
 epoch: 98, train_loss: 0.7042, test_loss: 1.0836, test_f1: 0.5592
 epoch: 99, train_loss: 0.7210, test_loss: 1.0584, test_f1: 0.5545

Training completed in 498.31 seconds
Best F1: 0.6270 at epoch 93
Mean F1 across iterations: 0.5970  0.0169
========================FINAL RESULTS================================
FEGIN weighted F1: 0.6270  0.0169
python main.py --data ltspice_demos --representation component_net --model FEGIN --layers 2 --hiddens 16 --batch_size 32 --lr 0.001 --emb_size 250 --epochs 100 --save_appendix component_net_L2_H16_BS32_LR0.001_E250 --no_val
-----



STDERR:
  File "main.py", line 370, in <module>
    main()
  File "main.py", line 254, in main
    dataset = dataset_class(
  File "/home/philip/projects/ltspice_examples_code_repo/Circuit-Completion-Using-GNNs/component_classification_with_link_prediction_head/evaluation/FEGIN/kernel/circuit_datasets.py", line 15, in __init__
    self.data, self.slices = torch.load(self.processed_paths[0])
  File "/home/philip/.local/lib/python3.8/site-packages/torch/serialization.py", line 1040, in load
    warnings.warn(
  File "/usr/lib/python3.8/warnings.py", line 109, in _showwarnmsg
    sw(msg.message, msg.category, msg.filename, msg.lineno,
  File "main.py", line 47, in warn_with_traceback
    traceback.print_stack(file=log)
/home/philip/projects/ltspice_examples_code_repo/Circuit-Completion-Using-GNNs/component_classification_with_link_prediction_head/evaluation/FEGIN/kernel/circuit_datasets.py:15: FutureWarning: You are using `torch.load` with `weights_only=False` (the current default value), which uses the default pickle module implicitly. It is possible to construct malicious pickle data which will execute arbitrary code during unpickling (See https://github.com/pytorch/pytorch/blob/main/SECURITY.md#untrusted-models for more details). In a future release, the default value for `weights_only` will be flipped to `True`. This limits the functions that could be executed during unpickling. Arbitrary objects will no longer be allowed to be loaded via this mode unless they are explicitly allowlisted by the user via `torch.serialization.add_safe_globals`. We recommend you start setting `weights_only=True` for any use case where you don't have full control of the loaded file. Please open an issue on GitHub for any issues related to this experimental feature.
  self.data, self.slices = torch.load(self.processed_paths[0])
