STDOUT:
Results will be saved in /home/philip/projects/ltspice_examples_code_repo/Circuit-Completion-Using-GNNs/component_classification_with_link_prediction_head/evaluation/FEGIN/results/model_FEGIN_dataset_ltspice_demos
Command line input: python main.py --data ltspice_demos --representation component_net --model FEGIN --layers 4 --hiddens 128 --batch_size 256 --lr 0.001 --emb_size 128 --epochs 100 --save_appendix component_net_L4_H128_BS256_LR0.001_E128 --no_val
 is saved.
-----
ltspice_demos - FEGIN
Using 4 layers, 128 hidden units, h = 2
Loading component_net representation dataset
ENTERED
Training FEGIN on component_net representation
Train: 1565, Test: 383
##################ITERATION #0 ****************************************
 epoch: 0, train_loss: 1.3092, test_loss: 1.3491, test_f1: 0.2281
 epoch: 1, train_loss: 1.1640, test_loss: 1.3278, test_f1: 0.2281
 epoch: 2, train_loss: 1.1191, test_loss: 1.3164, test_f1: 0.2582
 epoch: 3, train_loss: 1.0925, test_loss: 1.2843, test_f1: 0.2281
 epoch: 4, train_loss: 1.0815, test_loss: 1.2684, test_f1: 0.3115
 epoch: 5, train_loss: 1.0564, test_loss: 1.2214, test_f1: 0.4260
 epoch: 6, train_loss: 1.0364, test_loss: 1.1865, test_f1: 0.4047
 epoch: 7, train_loss: 1.0105, test_loss: 1.1080, test_f1: 0.4492
 epoch: 8, train_loss: 0.9748, test_loss: 1.1051, test_f1: 0.4984
 epoch: 9, train_loss: 0.9506, test_loss: 1.1203, test_f1: 0.5065
 epoch: 10, train_loss: 0.9166, test_loss: 1.0641, test_f1: 0.5405
 epoch: 11, train_loss: 0.9010, test_loss: 1.0703, test_f1: 0.5677
 epoch: 12, train_loss: 0.8769, test_loss: 1.1055, test_f1: 0.5333
 epoch: 13, train_loss: 0.8631, test_loss: 1.0957, test_f1: 0.5123
 epoch: 14, train_loss: 0.8470, test_loss: 1.1211, test_f1: 0.5699
 epoch: 15, train_loss: 0.8530, test_loss: 1.2415, test_f1: 0.5431
 epoch: 16, train_loss: 0.8224, test_loss: 1.1005, test_f1: 0.5911
 epoch: 17, train_loss: 0.8080, test_loss: 1.1019, test_f1: 0.5582
 epoch: 18, train_loss: 0.8163, test_loss: 1.1192, test_f1: 0.4743
 epoch: 19, train_loss: 0.8070, test_loss: 1.0788, test_f1: 0.6324
 epoch: 20, train_loss: 0.7835, test_loss: 1.2397, test_f1: 0.5568
 epoch: 21, train_loss: 0.7867, test_loss: 1.0894, test_f1: 0.5692
 epoch: 22, train_loss: 0.7775, test_loss: 1.0655, test_f1: 0.6111
 epoch: 23, train_loss: 0.7418, test_loss: 1.1743, test_f1: 0.5934
 epoch: 24, train_loss: 0.7512, test_loss: 1.0976, test_f1: 0.5945
 epoch: 25, train_loss: 0.7552, test_loss: 1.1296, test_f1: 0.5965
 epoch: 26, train_loss: 0.7467, test_loss: 1.0900, test_f1: 0.5645
 epoch: 27, train_loss: 0.7259, test_loss: 1.1389, test_f1: 0.6098
 epoch: 28, train_loss: 0.7278, test_loss: 1.1706, test_f1: 0.5844
 epoch: 29, train_loss: 0.7078, test_loss: 1.1660, test_f1: 0.5697
 epoch: 30, train_loss: 0.7032, test_loss: 1.2255, test_f1: 0.5875
 epoch: 31, train_loss: 0.6948, test_loss: 1.1766, test_f1: 0.5655
 epoch: 32, train_loss: 0.6798, test_loss: 1.1616, test_f1: 0.5722
 epoch: 33, train_loss: 0.6855, test_loss: 1.2557, test_f1: 0.5658
 epoch: 34, train_loss: 0.6877, test_loss: 1.2102, test_f1: 0.6564
 epoch: 35, train_loss: 0.6368, test_loss: 1.2427, test_f1: 0.5970
 epoch: 36, train_loss: 0.6222, test_loss: 1.2181, test_f1: 0.6550
 epoch: 37, train_loss: 0.6183, test_loss: 1.3985, test_f1: 0.6070
 epoch: 38, train_loss: 0.5832, test_loss: 1.3403, test_f1: 0.5708
 epoch: 39, train_loss: 0.6224, test_loss: 1.3114, test_f1: 0.5790
 epoch: 40, train_loss: 0.6483, test_loss: 1.3122, test_f1: 0.6033
 epoch: 41, train_loss: 0.6052, test_loss: 1.6067, test_f1: 0.5440
 epoch: 42, train_loss: 0.6300, test_loss: 1.4082, test_f1: 0.6017
 epoch: 43, train_loss: 0.6114, test_loss: 1.3523, test_f1: 0.5976
 epoch: 44, train_loss: 0.5975, test_loss: 1.5130, test_f1: 0.5720
 epoch: 45, train_loss: 0.5680, test_loss: 1.5083, test_f1: 0.5988
 epoch: 46, train_loss: 0.5870, test_loss: 1.5482, test_f1: 0.5536
 epoch: 47, train_loss: 0.5637, test_loss: 1.7116, test_f1: 0.5470
 epoch: 48, train_loss: 0.5461, test_loss: 1.6435, test_f1: 0.5692
 epoch: 49, train_loss: 0.5354, test_loss: 1.7193, test_f1: 0.5732
 epoch: 50, train_loss: 0.5651, test_loss: 1.7607, test_f1: 0.5208
 epoch: 51, train_loss: 0.5180, test_loss: 1.6968, test_f1: 0.5530
 epoch: 52, train_loss: 0.4925, test_loss: 1.6955, test_f1: 0.5586
 epoch: 53, train_loss: 0.4578, test_loss: 1.7260, test_f1: 0.5733
 epoch: 54, train_loss: 0.4356, test_loss: 1.7743, test_f1: 0.5675
 epoch: 55, train_loss: 0.4190, test_loss: 1.8019, test_f1: 0.5492
 epoch: 56, train_loss: 0.4204, test_loss: 1.8107, test_f1: 0.5739
 epoch: 57, train_loss: 0.4044, test_loss: 1.8971, test_f1: 0.5710
 epoch: 58, train_loss: 0.3890, test_loss: 1.8241, test_f1: 0.5808
 epoch: 59, train_loss: 0.3813, test_loss: 2.0724, test_f1: 0.5684
 epoch: 60, train_loss: 0.3700, test_loss: 2.2641, test_f1: 0.5415
 epoch: 61, train_loss: 0.4176, test_loss: 2.2567, test_f1: 0.5718
 epoch: 62, train_loss: 0.3631, test_loss: 2.1443, test_f1: 0.5425
 epoch: 63, train_loss: 0.3918, test_loss: 2.1883, test_f1: 0.5552
 epoch: 64, train_loss: 0.3767, test_loss: 2.0579, test_f1: 0.5702
 epoch: 65, train_loss: 0.3601, test_loss: 2.1203, test_f1: 0.5696
 epoch: 66, train_loss: 0.3631, test_loss: 2.0678, test_f1: 0.5780
 epoch: 67, train_loss: 0.3688, test_loss: 2.1557, test_f1: 0.5730
 epoch: 68, train_loss: 0.3833, test_loss: 2.2359, test_f1: 0.5713
 epoch: 69, train_loss: 0.3550, test_loss: 1.9890, test_f1: 0.6062
 epoch: 70, train_loss: 0.3591, test_loss: 2.1317, test_f1: 0.5322
 epoch: 71, train_loss: 0.3687, test_loss: 2.2661, test_f1: 0.5401
 epoch: 72, train_loss: 0.3552, test_loss: 2.1360, test_f1: 0.5605
 epoch: 73, train_loss: 0.3403, test_loss: 2.1522, test_f1: 0.5605
 epoch: 74, train_loss: 0.3213, test_loss: 2.3773, test_f1: 0.5454
 epoch: 75, train_loss: 0.3176, test_loss: 2.2774, test_f1: 0.5633
 epoch: 76, train_loss: 0.3207, test_loss: 2.4162, test_f1: 0.5556
 epoch: 77, train_loss: 0.3070, test_loss: 2.3350, test_f1: 0.5617
 epoch: 78, train_loss: 0.2928, test_loss: 2.3181, test_f1: 0.5709
 epoch: 79, train_loss: 0.2894, test_loss: 2.1262, test_f1: 0.5805
 epoch: 80, train_loss: 0.2774, test_loss: 2.3993, test_f1: 0.5910
 epoch: 81, train_loss: 0.3043, test_loss: 2.3392, test_f1: 0.5849
 epoch: 82, train_loss: 0.3261, test_loss: 2.4557, test_f1: 0.5631
 epoch: 83, train_loss: 0.3437, test_loss: 2.4704, test_f1: 0.5912
 epoch: 84, train_loss: 0.3444, test_loss: 2.2752, test_f1: 0.5810
 epoch: 85, train_loss: 0.3390, test_loss: 2.4446, test_f1: 0.5699
 epoch: 86, train_loss: 0.3174, test_loss: 2.5186, test_f1: 0.5475
 epoch: 87, train_loss: 0.3436, test_loss: 2.3942, test_f1: 0.5404
 epoch: 88, train_loss: 0.3168, test_loss: 2.2942, test_f1: 0.5754
 epoch: 89, train_loss: 0.3021, test_loss: 2.2812, test_f1: 0.5660
 epoch: 90, train_loss: 0.2998, test_loss: 2.3934, test_f1: 0.5470
 epoch: 91, train_loss: 0.2724, test_loss: 2.4977, test_f1: 0.5329
 epoch: 92, train_loss: 0.2913, test_loss: 2.4539, test_f1: 0.5705
 epoch: 93, train_loss: 0.3046, test_loss: 2.5917, test_f1: 0.5844
 epoch: 94, train_loss: 0.2901, test_loss: 2.2727, test_f1: 0.5793
 epoch: 95, train_loss: 0.2893, test_loss: 2.4102, test_f1: 0.5728
 epoch: 96, train_loss: 0.2979, test_loss: 2.4081, test_f1: 0.5536
 epoch: 97, train_loss: 0.2747, test_loss: 2.3974, test_f1: 0.5996
 epoch: 98, train_loss: 0.2796, test_loss: 2.6299, test_f1: 0.5716
 epoch: 99, train_loss: 0.2821, test_loss: 2.6218, test_f1: 0.5714
##################ITERATION #1 ****************************************
 epoch: 0, train_loss: 1.2294, test_loss: 1.3091, test_f1: 0.2449
 epoch: 1, train_loss: 1.0799, test_loss: 1.3098, test_f1: 0.2974
 epoch: 2, train_loss: 1.0265, test_loss: 1.2921, test_f1: 0.4035
 epoch: 3, train_loss: 0.9923, test_loss: 1.2661, test_f1: 0.4336
 epoch: 4, train_loss: 0.9555, test_loss: 1.2430, test_f1: 0.3588
 epoch: 5, train_loss: 0.9268, test_loss: 1.2018, test_f1: 0.3525
 epoch: 6, train_loss: 0.9074, test_loss: 1.1744, test_f1: 0.3934
 epoch: 7, train_loss: 0.8706, test_loss: 1.1274, test_f1: 0.3927
 epoch: 8, train_loss: 0.8569, test_loss: 1.1503, test_f1: 0.4830
 epoch: 9, train_loss: 0.8599, test_loss: 1.1365, test_f1: 0.5187
 epoch: 10, train_loss: 0.8320, test_loss: 1.0791, test_f1: 0.5480
 epoch: 11, train_loss: 0.8172, test_loss: 1.0480, test_f1: 0.5595
 epoch: 12, train_loss: 0.8159, test_loss: 1.0333, test_f1: 0.5577
 epoch: 13, train_loss: 0.7941, test_loss: 1.0899, test_f1: 0.5415
 epoch: 14, train_loss: 0.7973, test_loss: 1.0827, test_f1: 0.5474
 epoch: 15, train_loss: 0.7561, test_loss: 1.0970, test_f1: 0.5852
 epoch: 16, train_loss: 0.7543, test_loss: 1.0307, test_f1: 0.5655
 epoch: 17, train_loss: 0.7431, test_loss: 1.0383, test_f1: 0.5772
 epoch: 18, train_loss: 0.7193, test_loss: 1.0633, test_f1: 0.5949
 epoch: 19, train_loss: 0.7038, test_loss: 1.2235, test_f1: 0.5958
 epoch: 20, train_loss: 0.6885, test_loss: 1.1729, test_f1: 0.5861
 epoch: 21, train_loss: 0.6829, test_loss: 1.0994, test_f1: 0.5766
 epoch: 22, train_loss: 0.6790, test_loss: 1.1621, test_f1: 0.6016
 epoch: 23, train_loss: 0.6688, test_loss: 1.2102, test_f1: 0.6175
 epoch: 24, train_loss: 0.6414, test_loss: 1.2803, test_f1: 0.6082
 epoch: 25, train_loss: 0.6288, test_loss: 1.3534, test_f1: 0.6218
 epoch: 26, train_loss: 0.6422, test_loss: 1.1933, test_f1: 0.5971
 epoch: 27, train_loss: 0.6341, test_loss: 1.3998, test_f1: 0.5887
 epoch: 28, train_loss: 0.6290, test_loss: 1.3644, test_f1: 0.5667
 epoch: 29, train_loss: 0.6102, test_loss: 1.1915, test_f1: 0.6094
 epoch: 30, train_loss: 0.5738, test_loss: 1.3206, test_f1: 0.5812
 epoch: 31, train_loss: 0.5779, test_loss: 1.4012, test_f1: 0.6026
 epoch: 32, train_loss: 0.5925, test_loss: 1.2737, test_f1: 0.5784
 epoch: 33, train_loss: 0.6107, test_loss: 1.3312, test_f1: 0.5585
 epoch: 34, train_loss: 0.6006, test_loss: 1.3424, test_f1: 0.5744
 epoch: 35, train_loss: 0.5600, test_loss: 1.5290, test_f1: 0.5356
 epoch: 36, train_loss: 0.5366, test_loss: 1.4281, test_f1: 0.6173
 epoch: 37, train_loss: 0.5361, test_loss: 1.6595, test_f1: 0.5424
 epoch: 38, train_loss: 0.5830, test_loss: 1.3639, test_f1: 0.5569
 epoch: 39, train_loss: 0.5394, test_loss: 1.5176, test_f1: 0.5701
 epoch: 40, train_loss: 0.5063, test_loss: 1.5501, test_f1: 0.5616
 epoch: 41, train_loss: 0.5546, test_loss: 1.6824, test_f1: 0.5919
 epoch: 42, train_loss: 0.5094, test_loss: 1.5879, test_f1: 0.5918
 epoch: 43, train_loss: 0.5048, test_loss: 1.5146, test_f1: 0.6178
 epoch: 44, train_loss: 0.5025, test_loss: 1.6491, test_f1: 0.5382
 epoch: 45, train_loss: 0.4580, test_loss: 1.6548, test_f1: 0.5945
 epoch: 46, train_loss: 0.4569, test_loss: 1.7210, test_f1: 0.5884
 epoch: 47, train_loss: 0.4442, test_loss: 1.6392, test_f1: 0.5854
 epoch: 48, train_loss: 0.4518, test_loss: 1.6955, test_f1: 0.5751
 epoch: 49, train_loss: 0.4499, test_loss: 1.9099, test_f1: 0.5872
 epoch: 50, train_loss: 0.4364, test_loss: 1.7131, test_f1: 0.6024
 epoch: 51, train_loss: 0.4309, test_loss: 1.6587, test_f1: 0.6083
 epoch: 52, train_loss: 0.3982, test_loss: 1.7417, test_f1: 0.5979
 epoch: 53, train_loss: 0.3820, test_loss: 1.7581, test_f1: 0.5699
 epoch: 54, train_loss: 0.3643, test_loss: 1.7010, test_f1: 0.5953
 epoch: 55, train_loss: 0.3883, test_loss: 1.8064, test_f1: 0.5665
 epoch: 56, train_loss: 0.3597, test_loss: 1.7283, test_f1: 0.5782
 epoch: 57, train_loss: 0.3562, test_loss: 1.8236, test_f1: 0.5616
 epoch: 58, train_loss: 0.3493, test_loss: 1.9294, test_f1: 0.5706
 epoch: 59, train_loss: 0.3661, test_loss: 1.8451, test_f1: 0.5791
 epoch: 60, train_loss: 0.3187, test_loss: 2.0368, test_f1: 0.5266
 epoch: 61, train_loss: 0.3385, test_loss: 1.9821, test_f1: 0.5749
 epoch: 62, train_loss: 0.3023, test_loss: 2.0120, test_f1: 0.5988
 epoch: 63, train_loss: 0.3261, test_loss: 1.9670, test_f1: 0.6029
 epoch: 64, train_loss: 0.3316, test_loss: 1.9580, test_f1: 0.5848
 epoch: 65, train_loss: 0.3141, test_loss: 1.9692, test_f1: 0.5862
 epoch: 66, train_loss: 0.3027, test_loss: 2.0354, test_f1: 0.5673
 epoch: 67, train_loss: 0.3036, test_loss: 1.9914, test_f1: 0.6087
 epoch: 68, train_loss: 0.2971, test_loss: 1.9778, test_f1: 0.5908
 epoch: 69, train_loss: 0.2931, test_loss: 2.1194, test_f1: 0.5743
 epoch: 70, train_loss: 0.2917, test_loss: 2.0780, test_f1: 0.5813
 epoch: 71, train_loss: 0.2907, test_loss: 2.0431, test_f1: 0.6030
 epoch: 72, train_loss: 0.2843, test_loss: 2.2152, test_f1: 0.5910
 epoch: 73, train_loss: 0.2778, test_loss: 2.2137, test_f1: 0.5793
 epoch: 74, train_loss: 0.2659, test_loss: 2.1390, test_f1: 0.6014
 epoch: 75, train_loss: 0.2550, test_loss: 2.2340, test_f1: 0.5927
 epoch: 76, train_loss: 0.2639, test_loss: 2.1281, test_f1: 0.6097
 epoch: 77, train_loss: 0.2454, test_loss: 2.1441, test_f1: 0.6133
 epoch: 78, train_loss: 0.2350, test_loss: 2.2394, test_f1: 0.6013
 epoch: 79, train_loss: 0.2262, test_loss: 2.2074, test_f1: 0.5895
 epoch: 80, train_loss: 0.2319, test_loss: 2.2225, test_f1: 0.6197
 epoch: 81, train_loss: 0.2373, test_loss: 2.2449, test_f1: 0.6161
 epoch: 82, train_loss: 0.2482, test_loss: 2.3134, test_f1: 0.6059
 epoch: 83, train_loss: 0.2618, test_loss: 2.4339, test_f1: 0.5616
 epoch: 84, train_loss: 0.2613, test_loss: 2.2662, test_f1: 0.5835
 epoch: 85, train_loss: 0.2539, test_loss: 2.2666, test_f1: 0.5911
 epoch: 86, train_loss: 0.2955, test_loss: 2.2430, test_f1: 0.6028
 epoch: 87, train_loss: 0.2766, test_loss: 2.2865, test_f1: 0.5830
 epoch: 88, train_loss: 0.2810, test_loss: 2.3772, test_f1: 0.6011
 epoch: 89, train_loss: 0.2616, test_loss: 2.5493, test_f1: 0.5636
 epoch: 90, train_loss: 0.2552, test_loss: 2.4740, test_f1: 0.5865
 epoch: 91, train_loss: 0.2447, test_loss: 2.6309, test_f1: 0.5856
 epoch: 92, train_loss: 0.2254, test_loss: 2.6902, test_f1: 0.6083
 epoch: 93, train_loss: 0.2580, test_loss: 2.7081, test_f1: 0.5901
 epoch: 94, train_loss: 0.2550, test_loss: 2.4550, test_f1: 0.5897
 epoch: 95, train_loss: 0.3110, test_loss: 2.4996, test_f1: 0.5633
 epoch: 96, train_loss: 0.2806, test_loss: 2.6731, test_f1: 0.5890
 epoch: 97, train_loss: 0.2338, test_loss: 2.4020, test_f1: 0.5979
 epoch: 98, train_loss: 0.2194, test_loss: 2.4536, test_f1: 0.5869
 epoch: 99, train_loss: 0.2681, test_loss: 2.6068, test_f1: 0.6014
##################ITERATION #2 ****************************************
 epoch: 0, train_loss: 1.2005, test_loss: 1.2859, test_f1: 0.2281
 epoch: 1, train_loss: 1.0481, test_loss: 1.2826, test_f1: 0.2281
 epoch: 2, train_loss: 0.9828, test_loss: 1.2763, test_f1: 0.2281
 epoch: 3, train_loss: 0.9507, test_loss: 1.2199, test_f1: 0.2289
 epoch: 4, train_loss: 0.9313, test_loss: 1.1468, test_f1: 0.4110
 epoch: 5, train_loss: 0.8978, test_loss: 1.1185, test_f1: 0.4683
 epoch: 6, train_loss: 0.8901, test_loss: 1.1151, test_f1: 0.5172
 epoch: 7, train_loss: 0.8700, test_loss: 1.1340, test_f1: 0.5267
 epoch: 8, train_loss: 0.8583, test_loss: 1.2199, test_f1: 0.4426
 epoch: 9, train_loss: 0.8383, test_loss: 1.2465, test_f1: 0.5017
 epoch: 10, train_loss: 0.8206, test_loss: 1.1844, test_f1: 0.5555
 epoch: 11, train_loss: 0.8374, test_loss: 1.2021, test_f1: 0.5781
 epoch: 12, train_loss: 0.8133, test_loss: 1.1913, test_f1: 0.5146
 epoch: 13, train_loss: 0.8101, test_loss: 1.1728, test_f1: 0.5551
 epoch: 14, train_loss: 0.8164, test_loss: 1.1130, test_f1: 0.5661
 epoch: 15, train_loss: 0.7821, test_loss: 1.0892, test_f1: 0.5942
 epoch: 16, train_loss: 0.7510, test_loss: 1.0958, test_f1: 0.5697
 epoch: 17, train_loss: 0.7360, test_loss: 1.1473, test_f1: 0.5814
 epoch: 18, train_loss: 0.7474, test_loss: 1.1516, test_f1: 0.5959
 epoch: 19, train_loss: 0.7614, test_loss: 1.0990, test_f1: 0.5961
 epoch: 20, train_loss: 0.7405, test_loss: 1.2361, test_f1: 0.5804
 epoch: 21, train_loss: 0.7345, test_loss: 1.3402, test_f1: 0.5259
 epoch: 22, train_loss: 0.7359, test_loss: 1.1987, test_f1: 0.5813
 epoch: 23, train_loss: 0.7164, test_loss: 1.1708, test_f1: 0.5979
 epoch: 24, train_loss: 0.7048, test_loss: 1.2920, test_f1: 0.5907
 epoch: 25, train_loss: 0.6882, test_loss: 1.2832, test_f1: 0.5862
 epoch: 26, train_loss: 0.6764, test_loss: 1.3193, test_f1: 0.5438
 epoch: 27, train_loss: 0.6743, test_loss: 1.2245, test_f1: 0.5932
 epoch: 28, train_loss: 0.6580, test_loss: 1.2094, test_f1: 0.5932
 epoch: 29, train_loss: 0.6511, test_loss: 1.2969, test_f1: 0.5996
 epoch: 30, train_loss: 0.6431, test_loss: 1.3618, test_f1: 0.5984
 epoch: 31, train_loss: 0.6440, test_loss: 1.2436, test_f1: 0.6143
 epoch: 32, train_loss: 0.6353, test_loss: 1.2427, test_f1: 0.5550
 epoch: 33, train_loss: 0.6235, test_loss: 1.2037, test_f1: 0.6292
 epoch: 34, train_loss: 0.6239, test_loss: 1.3459, test_f1: 0.6094
 epoch: 35, train_loss: 0.6075, test_loss: 1.2675, test_f1: 0.6019
 epoch: 36, train_loss: 0.5888, test_loss: 1.3842, test_f1: 0.5889
 epoch: 37, train_loss: 0.6240, test_loss: 1.4400, test_f1: 0.5941
 epoch: 38, train_loss: 0.6295, test_loss: 1.3386, test_f1: 0.5795
 epoch: 39, train_loss: 0.6166, test_loss: 1.4548, test_f1: 0.5895
 epoch: 40, train_loss: 0.5749, test_loss: 1.6626, test_f1: 0.5425
 epoch: 41, train_loss: 0.5511, test_loss: 1.5704, test_f1: 0.6207
 epoch: 42, train_loss: 0.5327, test_loss: 1.4647, test_f1: 0.5894
 epoch: 43, train_loss: 0.5340, test_loss: 1.4782, test_f1: 0.6443
 epoch: 44, train_loss: 0.5437, test_loss: 1.3772, test_f1: 0.6084
 epoch: 45, train_loss: 0.5237, test_loss: 1.5589, test_f1: 0.5856
 epoch: 46, train_loss: 0.5027, test_loss: 1.4896, test_f1: 0.6281
 epoch: 47, train_loss: 0.5511, test_loss: 1.7581, test_f1: 0.5835
 epoch: 48, train_loss: 0.4954, test_loss: 1.6852, test_f1: 0.5699
 epoch: 49, train_loss: 0.4865, test_loss: 1.8311, test_f1: 0.5558
 epoch: 50, train_loss: 0.5356, test_loss: 1.5142, test_f1: 0.5873
 epoch: 51, train_loss: 0.5327, test_loss: 1.4712, test_f1: 0.6180
 epoch: 52, train_loss: 0.4656, test_loss: 1.6203, test_f1: 0.6020
 epoch: 53, train_loss: 0.4538, test_loss: 1.6493, test_f1: 0.6120
 epoch: 54, train_loss: 0.4454, test_loss: 1.7091, test_f1: 0.6092
 epoch: 55, train_loss: 0.4470, test_loss: 1.5665, test_f1: 0.6145
 epoch: 56, train_loss: 0.4431, test_loss: 1.5542, test_f1: 0.6120
 epoch: 57, train_loss: 0.4081, test_loss: 1.6905, test_f1: 0.6181
 epoch: 58, train_loss: 0.3972, test_loss: 1.7976, test_f1: 0.6205
 epoch: 59, train_loss: 0.3878, test_loss: 1.8145, test_f1: 0.5982
 epoch: 60, train_loss: 0.3823, test_loss: 1.6856, test_f1: 0.6110
 epoch: 61, train_loss: 0.3908, test_loss: 1.8465, test_f1: 0.5793
 epoch: 62, train_loss: 0.3702, test_loss: 1.9833, test_f1: 0.5887
 epoch: 63, train_loss: 0.3571, test_loss: 1.9406, test_f1: 0.6103
 epoch: 64, train_loss: 0.3640, test_loss: 1.9299, test_f1: 0.6246
 epoch: 65, train_loss: 0.3414, test_loss: 2.0137, test_f1: 0.6109
 epoch: 66, train_loss: 0.3484, test_loss: 1.9296, test_f1: 0.6245
 epoch: 67, train_loss: 0.3503, test_loss: 1.9816, test_f1: 0.5954
 epoch: 68, train_loss: 0.3165, test_loss: 2.0712, test_f1: 0.5996
 epoch: 69, train_loss: 0.3347, test_loss: 2.2461, test_f1: 0.6036
 epoch: 70, train_loss: 0.3378, test_loss: 2.0760, test_f1: 0.6109
 epoch: 71, train_loss: 0.3332, test_loss: 2.0676, test_f1: 0.5820
 epoch: 72, train_loss: 0.3481, test_loss: 2.1940, test_f1: 0.5413
 epoch: 73, train_loss: 0.3129, test_loss: 2.0852, test_f1: 0.6052
 epoch: 74, train_loss: 0.3098, test_loss: 1.9935, test_f1: 0.6298
 epoch: 75, train_loss: 0.3023, test_loss: 2.2607, test_f1: 0.6001
 epoch: 76, train_loss: 0.3184, test_loss: 2.4787, test_f1: 0.5973
 epoch: 77, train_loss: 0.2884, test_loss: 2.3438, test_f1: 0.6068
 epoch: 78, train_loss: 0.3128, test_loss: 2.2276, test_f1: 0.6117
 epoch: 79, train_loss: 0.3165, test_loss: 2.1344, test_f1: 0.6096
 epoch: 80, train_loss: 0.3281, test_loss: 2.0592, test_f1: 0.6221
 epoch: 81, train_loss: 0.3419, test_loss: 2.2877, test_f1: 0.5812
 epoch: 82, train_loss: 0.3655, test_loss: 2.2293, test_f1: 0.5912
 epoch: 83, train_loss: 0.3475, test_loss: 2.3912, test_f1: 0.5659
 epoch: 84, train_loss: 0.3453, test_loss: 2.2393, test_f1: 0.5905
 epoch: 85, train_loss: 0.3121, test_loss: 2.1063, test_f1: 0.5993
 epoch: 86, train_loss: 0.3505, test_loss: 1.9748, test_f1: 0.5956
 epoch: 87, train_loss: 0.3081, test_loss: 2.0459, test_f1: 0.6195
 epoch: 88, train_loss: 0.3088, test_loss: 2.1341, test_f1: 0.5803
 epoch: 89, train_loss: 0.2893, test_loss: 2.2249, test_f1: 0.6032
 epoch: 90, train_loss: 0.2793, test_loss: 2.1279, test_f1: 0.5982
 epoch: 91, train_loss: 0.2605, test_loss: 2.2555, test_f1: 0.6166
 epoch: 92, train_loss: 0.2559, test_loss: 2.4095, test_f1: 0.6012
 epoch: 93, train_loss: 0.2595, test_loss: 2.4231, test_f1: 0.5929
 epoch: 94, train_loss: 0.2523, test_loss: 2.5058, test_f1: 0.6054
 epoch: 95, train_loss: 0.2485, test_loss: 2.4925, test_f1: 0.5989
 epoch: 96, train_loss: 0.2628, test_loss: 2.5102, test_f1: 0.5864
 epoch: 97, train_loss: 0.2819, test_loss: 2.4837, test_f1: 0.5802
 epoch: 98, train_loss: 0.2631, test_loss: 2.3921, test_f1: 0.5754
 epoch: 99, train_loss: 0.2781, test_loss: 2.4942, test_f1: 0.5994
##################ITERATION #3 ****************************************
 epoch: 0, train_loss: 1.1938, test_loss: 1.2910, test_f1: 0.1365
 epoch: 1, train_loss: 1.0445, test_loss: 1.2654, test_f1: 0.3067
 epoch: 2, train_loss: 0.9898, test_loss: 1.2508, test_f1: 0.2474
 epoch: 3, train_loss: 0.9716, test_loss: 1.2286, test_f1: 0.3427
 epoch: 4, train_loss: 0.9343, test_loss: 1.1787, test_f1: 0.4235
 epoch: 5, train_loss: 0.9076, test_loss: 1.1926, test_f1: 0.4238
 epoch: 6, train_loss: 0.8905, test_loss: 1.1531, test_f1: 0.5238
 epoch: 7, train_loss: 0.8704, test_loss: 1.1337, test_f1: 0.4487
 epoch: 8, train_loss: 0.8419, test_loss: 1.1827, test_f1: 0.5174
 epoch: 9, train_loss: 0.8305, test_loss: 1.2080, test_f1: 0.5683
 epoch: 10, train_loss: 0.8289, test_loss: 1.1631, test_f1: 0.5813
 epoch: 11, train_loss: 0.8169, test_loss: 1.2388, test_f1: 0.5332
 epoch: 12, train_loss: 0.8028, test_loss: 1.2135, test_f1: 0.5495
 epoch: 13, train_loss: 0.7830, test_loss: 1.2522, test_f1: 0.5446
 epoch: 14, train_loss: 0.8213, test_loss: 0.9994, test_f1: 0.5862
 epoch: 15, train_loss: 0.7984, test_loss: 1.0793, test_f1: 0.5642
 epoch: 16, train_loss: 0.7892, test_loss: 1.1015, test_f1: 0.5859
 epoch: 17, train_loss: 0.7699, test_loss: 1.2206, test_f1: 0.5050
 epoch: 18, train_loss: 0.7455, test_loss: 1.1705, test_f1: 0.5306
 epoch: 19, train_loss: 0.7288, test_loss: 1.2583, test_f1: 0.5267
 epoch: 20, train_loss: 0.7104, test_loss: 1.2623, test_f1: 0.5757
 epoch: 21, train_loss: 0.7080, test_loss: 1.2261, test_f1: 0.5926
 epoch: 22, train_loss: 0.6960, test_loss: 1.2134, test_f1: 0.5971
 epoch: 23, train_loss: 0.7002, test_loss: 1.1849, test_f1: 0.6040
 epoch: 24, train_loss: 0.6619, test_loss: 1.3410, test_f1: 0.5989
 epoch: 25, train_loss: 0.6699, test_loss: 1.3013, test_f1: 0.5847
 epoch: 26, train_loss: 0.6728, test_loss: 1.2261, test_f1: 0.6094
 epoch: 27, train_loss: 0.6498, test_loss: 1.3290, test_f1: 0.5892
 epoch: 28, train_loss: 0.6114, test_loss: 1.2788, test_f1: 0.5818
 epoch: 29, train_loss: 0.6233, test_loss: 1.4020, test_f1: 0.5884
 epoch: 30, train_loss: 0.6316, test_loss: 1.4123, test_f1: 0.5974
 epoch: 31, train_loss: 0.6746, test_loss: 1.4435, test_f1: 0.4863
 epoch: 32, train_loss: 0.6256, test_loss: 1.3678, test_f1: 0.5316
 epoch: 33, train_loss: 0.6276, test_loss: 1.2208, test_f1: 0.6004
 epoch: 34, train_loss: 0.6013, test_loss: 1.3294, test_f1: 0.6203
 epoch: 35, train_loss: 0.5870, test_loss: 1.3254, test_f1: 0.5631
 epoch: 36, train_loss: 0.5513, test_loss: 1.3800, test_f1: 0.6119
 epoch: 37, train_loss: 0.5365, test_loss: 1.5044, test_f1: 0.6042
 epoch: 38, train_loss: 0.5325, test_loss: 1.4761, test_f1: 0.6207
 epoch: 39, train_loss: 0.5166, test_loss: 1.5383, test_f1: 0.6151
 epoch: 40, train_loss: 0.5008, test_loss: 1.4959, test_f1: 0.6348
 epoch: 41, train_loss: 0.5065, test_loss: 1.6926, test_f1: 0.6036
 epoch: 42, train_loss: 0.4674, test_loss: 1.5681, test_f1: 0.5761
 epoch: 43, train_loss: 0.4862, test_loss: 1.6707, test_f1: 0.5825
 epoch: 44, train_loss: 0.4694, test_loss: 1.8634, test_f1: 0.6278
 epoch: 45, train_loss: 0.4951, test_loss: 1.9621, test_f1: 0.5838
 epoch: 46, train_loss: 0.5184, test_loss: 1.7353, test_f1: 0.5826
 epoch: 47, train_loss: 0.4843, test_loss: 1.7346, test_f1: 0.6027
 epoch: 48, train_loss: 0.4804, test_loss: 1.6416, test_f1: 0.6299
 epoch: 49, train_loss: 0.4861, test_loss: 1.8673, test_f1: 0.5734
 epoch: 50, train_loss: 0.4827, test_loss: 2.0709, test_f1: 0.5708
 epoch: 51, train_loss: 0.4630, test_loss: 1.8713, test_f1: 0.6136
 epoch: 52, train_loss: 0.4474, test_loss: 1.6817, test_f1: 0.6055
 epoch: 53, train_loss: 0.4303, test_loss: 1.8425, test_f1: 0.6318
 epoch: 54, train_loss: 0.4044, test_loss: 1.8049, test_f1: 0.6028
 epoch: 55, train_loss: 0.4005, test_loss: 1.8908, test_f1: 0.6044
 epoch: 56, train_loss: 0.3915, test_loss: 1.8810, test_f1: 0.6071
 epoch: 57, train_loss: 0.3758, test_loss: 1.7605, test_f1: 0.6115
 epoch: 58, train_loss: 0.3562, test_loss: 1.9663, test_f1: 0.5818
 epoch: 59, train_loss: 0.3788, test_loss: 1.9490, test_f1: 0.5748
 epoch: 60, train_loss: 0.3602, test_loss: 1.9341, test_f1: 0.5898
 epoch: 61, train_loss: 0.3532, test_loss: 1.7973, test_f1: 0.6270
 epoch: 62, train_loss: 0.3518, test_loss: 2.1290, test_f1: 0.5787
 epoch: 63, train_loss: 0.3441, test_loss: 2.2766, test_f1: 0.5508
 epoch: 64, train_loss: 0.3249, test_loss: 2.5195, test_f1: 0.5718
 epoch: 65, train_loss: 0.3255, test_loss: 2.4819, test_f1: 0.5527
 epoch: 66, train_loss: 0.3251, test_loss: 2.1107, test_f1: 0.5896
 epoch: 67, train_loss: 0.3171, test_loss: 2.1634, test_f1: 0.6105
 epoch: 68, train_loss: 0.3085, test_loss: 2.1623, test_f1: 0.6017
 epoch: 69, train_loss: 0.3192, test_loss: 2.2820, test_f1: 0.5691
 epoch: 70, train_loss: 0.3354, test_loss: 2.0940, test_f1: 0.5940
 epoch: 71, train_loss: 0.3144, test_loss: 2.0325, test_f1: 0.6062
 epoch: 72, train_loss: 0.2832, test_loss: 2.2162, test_f1: 0.5868
 epoch: 73, train_loss: 0.2985, test_loss: 2.5698, test_f1: 0.5640
 epoch: 74, train_loss: 0.2959, test_loss: 2.6893, test_f1: 0.5713
 epoch: 75, train_loss: 0.3011, test_loss: 2.4901, test_f1: 0.5997
 epoch: 76, train_loss: 0.2921, test_loss: 2.2822, test_f1: 0.6219
 epoch: 77, train_loss: 0.2890, test_loss: 2.3206, test_f1: 0.6130
 epoch: 78, train_loss: 0.2704, test_loss: 2.2168, test_f1: 0.6231
 epoch: 79, train_loss: 0.2760, test_loss: 2.3653, test_f1: 0.5850
 epoch: 80, train_loss: 0.2644, test_loss: 2.3820, test_f1: 0.5762
 epoch: 81, train_loss: 0.2597, test_loss: 2.5286, test_f1: 0.5800
 epoch: 82, train_loss: 0.2498, test_loss: 2.5694, test_f1: 0.5930
 epoch: 83, train_loss: 0.2399, test_loss: 2.4588, test_f1: 0.6248
 epoch: 84, train_loss: 0.2519, test_loss: 2.7217, test_f1: 0.5840
 epoch: 85, train_loss: 0.2461, test_loss: 2.7185, test_f1: 0.6009
 epoch: 86, train_loss: 0.2513, test_loss: 2.8222, test_f1: 0.5936
 epoch: 87, train_loss: 0.2414, test_loss: 2.6753, test_f1: 0.5815
 epoch: 88, train_loss: 0.2531, test_loss: 2.9748, test_f1: 0.5529
 epoch: 89, train_loss: 0.3094, test_loss: 2.4349, test_f1: 0.6038
 epoch: 90, train_loss: 0.3031, test_loss: 2.6613, test_f1: 0.5765
 epoch: 91, train_loss: 0.3194, test_loss: 2.6152, test_f1: 0.5666
 epoch: 92, train_loss: 0.3305, test_loss: 2.6132, test_f1: 0.6172
 epoch: 93, train_loss: 0.3112, test_loss: 2.5671, test_f1: 0.6019
 epoch: 94, train_loss: 0.2898, test_loss: 2.5533, test_f1: 0.5701
 epoch: 95, train_loss: 0.2864, test_loss: 2.6820, test_f1: 0.5693
 epoch: 96, train_loss: 0.2708, test_loss: 2.4358, test_f1: 0.5867
 epoch: 97, train_loss: 0.2266, test_loss: 2.4227, test_f1: 0.5964
 epoch: 98, train_loss: 0.2669, test_loss: 2.4920, test_f1: 0.6036
 epoch: 99, train_loss: 0.2880, test_loss: 2.5780, test_f1: 0.5871
##################ITERATION #4 ****************************************
 epoch: 0, train_loss: 1.2192, test_loss: 1.3117, test_f1: 0.1365
 epoch: 1, train_loss: 1.0624, test_loss: 1.2834, test_f1: 0.3225
 epoch: 2, train_loss: 1.0077, test_loss: 1.2336, test_f1: 0.3766
 epoch: 3, train_loss: 0.9571, test_loss: 1.1964, test_f1: 0.4872
 epoch: 4, train_loss: 0.9516, test_loss: 1.1512, test_f1: 0.4424
 epoch: 5, train_loss: 0.9160, test_loss: 1.1057, test_f1: 0.4811
 epoch: 6, train_loss: 0.8919, test_loss: 1.0592, test_f1: 0.4931
 epoch: 7, train_loss: 0.8813, test_loss: 1.0684, test_f1: 0.4977
 epoch: 8, train_loss: 0.8563, test_loss: 1.0915, test_f1: 0.4449
 epoch: 9, train_loss: 0.8512, test_loss: 1.1493, test_f1: 0.4591
 epoch: 10, train_loss: 0.8314, test_loss: 1.1057, test_f1: 0.5039
 epoch: 11, train_loss: 0.8251, test_loss: 1.0960, test_f1: 0.4869
 epoch: 12, train_loss: 0.8044, test_loss: 1.0294, test_f1: 0.6082
 epoch: 13, train_loss: 0.8016, test_loss: 1.0525, test_f1: 0.5633
 epoch: 14, train_loss: 0.7810, test_loss: 1.0235, test_f1: 0.5781
 epoch: 15, train_loss: 0.7756, test_loss: 1.0675, test_f1: 0.5435
 epoch: 16, train_loss: 0.7696, test_loss: 1.1923, test_f1: 0.5669
 epoch: 17, train_loss: 0.8036, test_loss: 1.0425, test_f1: 0.5614
 epoch: 18, train_loss: 0.7767, test_loss: 1.0270, test_f1: 0.5896
 epoch: 19, train_loss: 0.7407, test_loss: 1.0824, test_f1: 0.5858
 epoch: 20, train_loss: 0.7064, test_loss: 1.1062, test_f1: 0.6104
 epoch: 21, train_loss: 0.7006, test_loss: 1.1224, test_f1: 0.5691
 epoch: 22, train_loss: 0.6978, test_loss: 1.1797, test_f1: 0.6024
 epoch: 23, train_loss: 0.6767, test_loss: 1.1270, test_f1: 0.5769
 epoch: 24, train_loss: 0.6884, test_loss: 1.1103, test_f1: 0.5870
 epoch: 25, train_loss: 0.7016, test_loss: 1.2293, test_f1: 0.5870
 epoch: 26, train_loss: 0.6795, test_loss: 1.3562, test_f1: 0.5621
 epoch: 27, train_loss: 0.6688, test_loss: 1.3319, test_f1: 0.6066
 epoch: 28, train_loss: 0.6777, test_loss: 1.3631, test_f1: 0.6055
 epoch: 29, train_loss: 0.6422, test_loss: 1.2245, test_f1: 0.5913
 epoch: 30, train_loss: 0.6368, test_loss: 1.2442, test_f1: 0.5655
 epoch: 31, train_loss: 0.6540, test_loss: 1.3326, test_f1: 0.5872
 epoch: 32, train_loss: 0.6479, test_loss: 1.4227, test_f1: 0.5477
 epoch: 33, train_loss: 0.6430, test_loss: 1.2651, test_f1: 0.5346
 epoch: 34, train_loss: 0.6512, test_loss: 1.2475, test_f1: 0.5784
 epoch: 35, train_loss: 0.6159, test_loss: 1.3692, test_f1: 0.5825
 epoch: 36, train_loss: 0.5850, test_loss: 1.3171, test_f1: 0.5705
 epoch: 37, train_loss: 0.5442, test_loss: 1.3123, test_f1: 0.5801
 epoch: 38, train_loss: 0.5693, test_loss: 1.5687, test_f1: 0.5842
 epoch: 39, train_loss: 0.5946, test_loss: 1.7635, test_f1: 0.5392
 epoch: 40, train_loss: 0.5852, test_loss: 1.3792, test_f1: 0.5578
 epoch: 41, train_loss: 0.5843, test_loss: 1.3739, test_f1: 0.5606
 epoch: 42, train_loss: 0.5435, test_loss: 1.4997, test_f1: 0.5950
 epoch: 43, train_loss: 0.5431, test_loss: 1.3809, test_f1: 0.6049
 epoch: 44, train_loss: 0.5451, test_loss: 1.4651, test_f1: 0.5970
 epoch: 45, train_loss: 0.4893, test_loss: 1.4449, test_f1: 0.5914
 epoch: 46, train_loss: 0.4825, test_loss: 1.2350, test_f1: 0.6210
 epoch: 47, train_loss: 0.5057, test_loss: 1.4826, test_f1: 0.5658
 epoch: 48, train_loss: 0.4868, test_loss: 1.5980, test_f1: 0.5918
 epoch: 49, train_loss: 0.4737, test_loss: 1.4944, test_f1: 0.5885
 epoch: 50, train_loss: 0.4586, test_loss: 1.6042, test_f1: 0.6226
 epoch: 51, train_loss: 0.4377, test_loss: 1.6251, test_f1: 0.6077
 epoch: 52, train_loss: 0.4228, test_loss: 1.6456, test_f1: 0.5969
 epoch: 53, train_loss: 0.4092, test_loss: 1.6678, test_f1: 0.5834
 epoch: 54, train_loss: 0.4125, test_loss: 1.6739, test_f1: 0.5746
 epoch: 55, train_loss: 0.4139, test_loss: 1.7362, test_f1: 0.5626
 epoch: 56, train_loss: 0.4253, test_loss: 1.7913, test_f1: 0.5836
 epoch: 57, train_loss: 0.4245, test_loss: 2.0401, test_f1: 0.5632
 epoch: 58, train_loss: 0.4380, test_loss: 1.9049, test_f1: 0.5664
 epoch: 59, train_loss: 0.3779, test_loss: 1.6603, test_f1: 0.6005
 epoch: 60, train_loss: 0.3909, test_loss: 1.7981, test_f1: 0.6052
 epoch: 61, train_loss: 0.3987, test_loss: 1.7999, test_f1: 0.5851
 epoch: 62, train_loss: 0.3604, test_loss: 1.8581, test_f1: 0.5778
 epoch: 63, train_loss: 0.3492, test_loss: 1.8854, test_f1: 0.5773
 epoch: 64, train_loss: 0.3717, test_loss: 1.9484, test_f1: 0.5899
 epoch: 65, train_loss: 0.3495, test_loss: 1.8720, test_f1: 0.6034
 epoch: 66, train_loss: 0.3644, test_loss: 1.8677, test_f1: 0.6081
 epoch: 67, train_loss: 0.3565, test_loss: 1.9810, test_f1: 0.6068
 epoch: 68, train_loss: 0.3569, test_loss: 1.9023, test_f1: 0.6068
 epoch: 69, train_loss: 0.3363, test_loss: 1.9658, test_f1: 0.6163
 epoch: 70, train_loss: 0.3378, test_loss: 2.0121, test_f1: 0.6117
 epoch: 71, train_loss: 0.3376, test_loss: 2.0388, test_f1: 0.5848
 epoch: 72, train_loss: 0.3317, test_loss: 1.9648, test_f1: 0.5940
 epoch: 73, train_loss: 0.3093, test_loss: 2.0252, test_f1: 0.6101
 epoch: 74, train_loss: 0.3185, test_loss: 1.9697, test_f1: 0.5976
 epoch: 75, train_loss: 0.3060, test_loss: 1.9818, test_f1: 0.5864
 epoch: 76, train_loss: 0.2900, test_loss: 2.1424, test_f1: 0.5945
 epoch: 77, train_loss: 0.3133, test_loss: 2.1403, test_f1: 0.5838
 epoch: 78, train_loss: 0.3038, test_loss: 2.1774, test_f1: 0.5789
 epoch: 79, train_loss: 0.2904, test_loss: 2.0373, test_f1: 0.5833
 epoch: 80, train_loss: 0.3147, test_loss: 2.0862, test_f1: 0.5708
 epoch: 81, train_loss: 0.2859, test_loss: 2.0826, test_f1: 0.5703
 epoch: 82, train_loss: 0.3053, test_loss: 2.1490, test_f1: 0.6218
 epoch: 83, train_loss: 0.2967, test_loss: 2.3946, test_f1: 0.5973
 epoch: 84, train_loss: 0.2825, test_loss: 2.2017, test_f1: 0.5787
 epoch: 85, train_loss: 0.2975, test_loss: 2.2179, test_f1: 0.5813
 epoch: 86, train_loss: 0.2783, test_loss: 2.2131, test_f1: 0.5909
 epoch: 87, train_loss: 0.2629, test_loss: 2.2888, test_f1: 0.5740
 epoch: 88, train_loss: 0.2676, test_loss: 2.2635, test_f1: 0.5702
 epoch: 89, train_loss: 0.2591, test_loss: 2.2744, test_f1: 0.5736
 epoch: 90, train_loss: 0.3354, test_loss: 2.4683, test_f1: 0.5950
 epoch: 91, train_loss: 0.3470, test_loss: 2.2945, test_f1: 0.5747
 epoch: 92, train_loss: 0.3168, test_loss: 2.3586, test_f1: 0.5447
 epoch: 93, train_loss: 0.3178, test_loss: 2.2538, test_f1: 0.5583
 epoch: 94, train_loss: 0.2807, test_loss: 2.1181, test_f1: 0.6049
 epoch: 95, train_loss: 0.2581, test_loss: 2.2431, test_f1: 0.6185
 epoch: 96, train_loss: 0.2592, test_loss: 2.2415, test_f1: 0.5874
 epoch: 97, train_loss: 0.2679, test_loss: 2.2836, test_f1: 0.5957
 epoch: 98, train_loss: 0.2755, test_loss: 2.3002, test_f1: 0.6044
 epoch: 99, train_loss: 0.3610, test_loss: 2.2389, test_f1: 0.5791
##################ITERATION #5 ****************************************
 epoch: 0, train_loss: 1.2259, test_loss: 1.3005, test_f1: 0.1365
 epoch: 1, train_loss: 1.0701, test_loss: 1.3003, test_f1: 0.1365
 epoch: 2, train_loss: 1.0120, test_loss: 1.2636, test_f1: 0.1419
 epoch: 3, train_loss: 0.9709, test_loss: 1.2516, test_f1: 0.1570
 epoch: 4, train_loss: 0.9488, test_loss: 1.1569, test_f1: 0.3397
 epoch: 5, train_loss: 0.9163, test_loss: 1.0901, test_f1: 0.4692
 epoch: 6, train_loss: 0.9028, test_loss: 1.1012, test_f1: 0.4721
 epoch: 7, train_loss: 0.8823, test_loss: 1.1091, test_f1: 0.4898
 epoch: 8, train_loss: 0.8684, test_loss: 1.1351, test_f1: 0.5101
 epoch: 9, train_loss: 0.8223, test_loss: 1.0921, test_f1: 0.5195
 epoch: 10, train_loss: 0.8290, test_loss: 1.0204, test_f1: 0.5811
 epoch: 11, train_loss: 0.8163, test_loss: 1.0867, test_f1: 0.5806
 epoch: 12, train_loss: 0.8184, test_loss: 1.0340, test_f1: 0.5773
 epoch: 13, train_loss: 0.7917, test_loss: 1.1083, test_f1: 0.5253
 epoch: 14, train_loss: 0.7887, test_loss: 1.0201, test_f1: 0.5930
 epoch: 15, train_loss: 0.7637, test_loss: 1.0385, test_f1: 0.5888
 epoch: 16, train_loss: 0.7556, test_loss: 1.2080, test_f1: 0.5760
 epoch: 17, train_loss: 0.7425, test_loss: 1.1070, test_f1: 0.5891
 epoch: 18, train_loss: 0.7291, test_loss: 1.0324, test_f1: 0.5832
 epoch: 19, train_loss: 0.7102, test_loss: 1.0956, test_f1: 0.6122
 epoch: 20, train_loss: 0.6867, test_loss: 1.1704, test_f1: 0.5854
 epoch: 21, train_loss: 0.6843, test_loss: 1.3141, test_f1: 0.5354
 epoch: 22, train_loss: 0.7205, test_loss: 1.2160, test_f1: 0.5961
 epoch: 23, train_loss: 0.7015, test_loss: 1.1614, test_f1: 0.5995
 epoch: 24, train_loss: 0.6616, test_loss: 1.1124, test_f1: 0.5808
 epoch: 25, train_loss: 0.6499, test_loss: 1.1100, test_f1: 0.5928
 epoch: 26, train_loss: 0.6411, test_loss: 1.1526, test_f1: 0.5889
 epoch: 27, train_loss: 0.6305, test_loss: 1.2445, test_f1: 0.5332
 epoch: 28, train_loss: 0.6401, test_loss: 1.1861, test_f1: 0.5840
 epoch: 29, train_loss: 0.6083, test_loss: 1.1998, test_f1: 0.6122
 epoch: 30, train_loss: 0.6374, test_loss: 1.2281, test_f1: 0.6208
 epoch: 31, train_loss: 0.6474, test_loss: 1.3471, test_f1: 0.6069
 epoch: 32, train_loss: 0.6271, test_loss: 1.3596, test_f1: 0.5943
 epoch: 33, train_loss: 0.6274, test_loss: 1.3494, test_f1: 0.5780
 epoch: 34, train_loss: 0.6099, test_loss: 1.3643, test_f1: 0.5619
 epoch: 35, train_loss: 0.6090, test_loss: 1.3328, test_f1: 0.5835
 epoch: 36, train_loss: 0.5806, test_loss: 1.2916, test_f1: 0.6048
 epoch: 37, train_loss: 0.5611, test_loss: 1.3038, test_f1: 0.5877
 epoch: 38, train_loss: 0.5705, test_loss: 1.4672, test_f1: 0.5745
 epoch: 39, train_loss: 0.5775, test_loss: 1.3809, test_f1: 0.6154
 epoch: 40, train_loss: 0.5694, test_loss: 1.2807, test_f1: 0.5952
 epoch: 41, train_loss: 0.5515, test_loss: 1.5296, test_f1: 0.5639
 epoch: 42, train_loss: 0.5571, test_loss: 1.5105, test_f1: 0.5685
 epoch: 43, train_loss: 0.5283, test_loss: 1.4058, test_f1: 0.5689
 epoch: 44, train_loss: 0.5222, test_loss: 1.3953, test_f1: 0.5913
 epoch: 45, train_loss: 0.5501, test_loss: 1.4948, test_f1: 0.5838
 epoch: 46, train_loss: 0.5383, test_loss: 1.4898, test_f1: 0.5720
 epoch: 47, train_loss: 0.5123, test_loss: 1.5938, test_f1: 0.5638
 epoch: 48, train_loss: 0.5324, test_loss: 1.3209, test_f1: 0.6334
 epoch: 49, train_loss: 0.5042, test_loss: 1.3442, test_f1: 0.5989
 epoch: 50, train_loss: 0.4826, test_loss: 1.4139, test_f1: 0.5894
 epoch: 51, train_loss: 0.4442, test_loss: 1.4278, test_f1: 0.6065
 epoch: 52, train_loss: 0.4254, test_loss: 1.5220, test_f1: 0.5817
 epoch: 53, train_loss: 0.4098, test_loss: 1.5369, test_f1: 0.5809
 epoch: 54, train_loss: 0.3946, test_loss: 1.6595, test_f1: 0.5972
 epoch: 55, train_loss: 0.4099, test_loss: 1.5735, test_f1: 0.6210
 epoch: 56, train_loss: 0.3770, test_loss: 1.6467, test_f1: 0.6265
 epoch: 57, train_loss: 0.4016, test_loss: 1.7161, test_f1: 0.6085
 epoch: 58, train_loss: 0.3766, test_loss: 1.7910, test_f1: 0.5946
 epoch: 59, train_loss: 0.3601, test_loss: 1.6735, test_f1: 0.6021
 epoch: 60, train_loss: 0.4103, test_loss: 1.7012, test_f1: 0.5886
 epoch: 61, train_loss: 0.4049, test_loss: 1.6362, test_f1: 0.5927
 epoch: 62, train_loss: 0.3839, test_loss: 1.5127, test_f1: 0.6126
 epoch: 63, train_loss: 0.3629, test_loss: 1.6499, test_f1: 0.6136
 epoch: 64, train_loss: 0.3425, test_loss: 1.7128, test_f1: 0.6216
 epoch: 65, train_loss: 0.3391, test_loss: 1.8527, test_f1: 0.6044
 epoch: 66, train_loss: 0.3669, test_loss: 1.9321, test_f1: 0.5968
 epoch: 67, train_loss: 0.3397, test_loss: 1.8152, test_f1: 0.6236
 epoch: 68, train_loss: 0.3354, test_loss: 1.9246, test_f1: 0.5909
 epoch: 69, train_loss: 0.3290, test_loss: 2.1613, test_f1: 0.5638
 epoch: 70, train_loss: 0.3645, test_loss: 1.9571, test_f1: 0.5848
 epoch: 71, train_loss: 0.3390, test_loss: 1.8352, test_f1: 0.5974
 epoch: 72, train_loss: 0.3624, test_loss: 1.5952, test_f1: 0.6206
 epoch: 73, train_loss: 0.3491, test_loss: 1.6162, test_f1: 0.6076
 epoch: 74, train_loss: 0.3506, test_loss: 1.8193, test_f1: 0.5632
 epoch: 75, train_loss: 0.3565, test_loss: 1.6463, test_f1: 0.5875
 epoch: 76, train_loss: 0.3387, test_loss: 1.6230, test_f1: 0.5680
 epoch: 77, train_loss: 0.3319, test_loss: 1.6834, test_f1: 0.6066
 epoch: 78, train_loss: 0.3142, test_loss: 1.8567, test_f1: 0.5975
 epoch: 79, train_loss: 0.3044, test_loss: 2.0451, test_f1: 0.6145
 epoch: 80, train_loss: 0.2990, test_loss: 2.0984, test_f1: 0.5887
 epoch: 81, train_loss: 0.3047, test_loss: 2.2409, test_f1: 0.5893
 epoch: 82, train_loss: 0.3333, test_loss: 2.1922, test_f1: 0.5522
 epoch: 83, train_loss: 0.2846, test_loss: 1.9592, test_f1: 0.5807
 epoch: 84, train_loss: 0.3075, test_loss: 2.0988, test_f1: 0.6037
 epoch: 85, train_loss: 0.3442, test_loss: 2.3857, test_f1: 0.5873
 epoch: 86, train_loss: 0.3157, test_loss: 2.1229, test_f1: 0.5957
 epoch: 87, train_loss: 0.2785, test_loss: 2.0775, test_f1: 0.5950
 epoch: 88, train_loss: 0.2593, test_loss: 2.0578, test_f1: 0.6039
 epoch: 89, train_loss: 0.2849, test_loss: 2.1642, test_f1: 0.6098
 epoch: 90, train_loss: 0.2752, test_loss: 2.3411, test_f1: 0.5694
 epoch: 91, train_loss: 0.3004, test_loss: 1.8507, test_f1: 0.6191
 epoch: 92, train_loss: 0.2969, test_loss: 2.0043, test_f1: 0.5749
 epoch: 93, train_loss: 0.2803, test_loss: 1.9791, test_f1: 0.6020
 epoch: 94, train_loss: 0.2710, test_loss: 2.0924, test_f1: 0.6062
 epoch: 95, train_loss: 0.2549, test_loss: 2.0998, test_f1: 0.6016
 epoch: 96, train_loss: 0.2575, test_loss: 2.1755, test_f1: 0.6048
 epoch: 97, train_loss: 0.2928, test_loss: 2.4390, test_f1: 0.5525
 epoch: 98, train_loss: 0.3059, test_loss: 2.3961, test_f1: 0.5716
 epoch: 99, train_loss: 0.2889, test_loss: 2.2369, test_f1: 0.5795
##################ITERATION #6 ****************************************
 epoch: 0, train_loss: 1.2107, test_loss: 1.3071, test_f1: 0.1365
 epoch: 1, train_loss: 1.0487, test_loss: 1.2897, test_f1: 0.1365
 epoch: 2, train_loss: 1.0020, test_loss: 1.2861, test_f1: 0.2312
 epoch: 3, train_loss: 0.9740, test_loss: 1.2439, test_f1: 0.2378
 epoch: 4, train_loss: 0.9694, test_loss: 1.1835, test_f1: 0.2470
 epoch: 5, train_loss: 0.9158, test_loss: 1.1839, test_f1: 0.3282
 epoch: 6, train_loss: 0.9060, test_loss: 1.2090, test_f1: 0.3614
 epoch: 7, train_loss: 0.8768, test_loss: 1.2295, test_f1: 0.4100
 epoch: 8, train_loss: 0.8714, test_loss: 1.1281, test_f1: 0.5288
 epoch: 9, train_loss: 0.8404, test_loss: 1.1336, test_f1: 0.5130
 epoch: 10, train_loss: 0.8401, test_loss: 1.0910, test_f1: 0.5341
 epoch: 11, train_loss: 0.8225, test_loss: 1.0815, test_f1: 0.5541
 epoch: 12, train_loss: 0.8304, test_loss: 1.0377, test_f1: 0.5617
 epoch: 13, train_loss: 0.8144, test_loss: 1.0650, test_f1: 0.5522
 epoch: 14, train_loss: 0.8264, test_loss: 1.0706, test_f1: 0.5594
 epoch: 15, train_loss: 0.8218, test_loss: 1.0588, test_f1: 0.5652
 epoch: 16, train_loss: 0.8061, test_loss: 0.9705, test_f1: 0.5696
 epoch: 17, train_loss: 0.7921, test_loss: 1.0202, test_f1: 0.5558
 epoch: 18, train_loss: 0.7643, test_loss: 1.0251, test_f1: 0.5765
 epoch: 19, train_loss: 0.7499, test_loss: 1.1581, test_f1: 0.5590
 epoch: 20, train_loss: 0.7475, test_loss: 1.1257, test_f1: 0.5543
 epoch: 21, train_loss: 0.7504, test_loss: 1.1695, test_f1: 0.6052
 epoch: 22, train_loss: 0.7333, test_loss: 1.0422, test_f1: 0.6135
 epoch: 23, train_loss: 0.7145, test_loss: 1.0536, test_f1: 0.6232
 epoch: 24, train_loss: 0.6937, test_loss: 1.0528, test_f1: 0.6069
 epoch: 25, train_loss: 0.7027, test_loss: 1.1032, test_f1: 0.6052
 epoch: 26, train_loss: 0.6997, test_loss: 1.1259, test_f1: 0.5996
 epoch: 27, train_loss: 0.6823, test_loss: 1.1377, test_f1: 0.5955
 epoch: 28, train_loss: 0.6905, test_loss: 1.0936, test_f1: 0.5937
 epoch: 29, train_loss: 0.6765, test_loss: 1.1598, test_f1: 0.6310
 epoch: 30, train_loss: 0.6678, test_loss: 1.1962, test_f1: 0.5610
 epoch: 31, train_loss: 0.6712, test_loss: 1.0744, test_f1: 0.5819
 epoch: 32, train_loss: 0.6654, test_loss: 1.2180, test_f1: 0.5899
 epoch: 33, train_loss: 0.6765, test_loss: 1.1083, test_f1: 0.6431
 epoch: 34, train_loss: 0.6412, test_loss: 1.3663, test_f1: 0.5824
 epoch: 35, train_loss: 0.6226, test_loss: 1.3077, test_f1: 0.5887
 epoch: 36, train_loss: 0.6637, test_loss: 1.3321, test_f1: 0.5506
 epoch: 37, train_loss: 0.6585, test_loss: 1.3697, test_f1: 0.5597
 epoch: 38, train_loss: 0.6283, test_loss: 1.1550, test_f1: 0.5947
 epoch: 39, train_loss: 0.6197, test_loss: 1.4194, test_f1: 0.5635
 epoch: 40, train_loss: 0.6204, test_loss: 1.2502, test_f1: 0.6223
 epoch: 41, train_loss: 0.6436, test_loss: 1.2352, test_f1: 0.5812
 epoch: 42, train_loss: 0.6135, test_loss: 1.2963, test_f1: 0.5526
 epoch: 43, train_loss: 0.5767, test_loss: 1.3030, test_f1: 0.5954
 epoch: 44, train_loss: 0.5699, test_loss: 1.2905, test_f1: 0.5854
 epoch: 45, train_loss: 0.5629, test_loss: 1.3424, test_f1: 0.6139
 epoch: 46, train_loss: 0.5621, test_loss: 1.2868, test_f1: 0.6171
 epoch: 47, train_loss: 0.5379, test_loss: 1.3550, test_f1: 0.6061
 epoch: 48, train_loss: 0.5236, test_loss: 1.4241, test_f1: 0.6154
 epoch: 49, train_loss: 0.5106, test_loss: 1.5356, test_f1: 0.5956
 epoch: 50, train_loss: 0.5050, test_loss: 1.3430, test_f1: 0.6303
 epoch: 51, train_loss: 0.4877, test_loss: 1.3682, test_f1: 0.6272
 epoch: 52, train_loss: 0.4892, test_loss: 1.4088, test_f1: 0.6345
 epoch: 53, train_loss: 0.4663, test_loss: 1.4284, test_f1: 0.6238
 epoch: 54, train_loss: 0.4428, test_loss: 1.4344, test_f1: 0.6264
 epoch: 55, train_loss: 0.4720, test_loss: 1.4619, test_f1: 0.6234
 epoch: 56, train_loss: 0.4474, test_loss: 1.4688, test_f1: 0.6472
 epoch: 57, train_loss: 0.4407, test_loss: 1.5904, test_f1: 0.6174
 epoch: 58, train_loss: 0.4524, test_loss: 1.5188, test_f1: 0.6234
 epoch: 59, train_loss: 0.4263, test_loss: 1.5678, test_f1: 0.5942
 epoch: 60, train_loss: 0.4218, test_loss: 1.6318, test_f1: 0.6273
 epoch: 61, train_loss: 0.4128, test_loss: 1.7376, test_f1: 0.6052
 epoch: 62, train_loss: 0.4061, test_loss: 1.6993, test_f1: 0.5832
 epoch: 63, train_loss: 0.3899, test_loss: 1.6785, test_f1: 0.5956
 epoch: 64, train_loss: 0.4053, test_loss: 1.7474, test_f1: 0.6086
 epoch: 65, train_loss: 0.4453, test_loss: 1.8283, test_f1: 0.5916
 epoch: 66, train_loss: 0.4180, test_loss: 1.6798, test_f1: 0.5915
 epoch: 67, train_loss: 0.3992, test_loss: 1.6888, test_f1: 0.5998
 epoch: 68, train_loss: 0.3969, test_loss: 1.8101, test_f1: 0.5545
 epoch: 69, train_loss: 0.4065, test_loss: 1.8782, test_f1: 0.5806
 epoch: 70, train_loss: 0.3875, test_loss: 1.8414, test_f1: 0.5972
 epoch: 71, train_loss: 0.3997, test_loss: 1.8414, test_f1: 0.5813
 epoch: 72, train_loss: 0.3683, test_loss: 1.8559, test_f1: 0.6100
 epoch: 73, train_loss: 0.3693, test_loss: 1.8490, test_f1: 0.5884
 epoch: 74, train_loss: 0.3809, test_loss: 1.7750, test_f1: 0.5927
 epoch: 75, train_loss: 0.3905, test_loss: 1.7726, test_f1: 0.5775
 epoch: 76, train_loss: 0.3539, test_loss: 1.7670, test_f1: 0.5883
 epoch: 77, train_loss: 0.3473, test_loss: 1.6948, test_f1: 0.6246
 epoch: 78, train_loss: 0.3210, test_loss: 1.8579, test_f1: 0.5924
 epoch: 79, train_loss: 0.3345, test_loss: 1.8252, test_f1: 0.6062
 epoch: 80, train_loss: 0.3454, test_loss: 1.8969, test_f1: 0.5908
 epoch: 81, train_loss: 0.3545, test_loss: 1.9947, test_f1: 0.5864
 epoch: 82, train_loss: 0.3424, test_loss: 1.8990, test_f1: 0.6378
 epoch: 83, train_loss: 0.3084, test_loss: 2.0477, test_f1: 0.6012
 epoch: 84, train_loss: 0.3309, test_loss: 1.9680, test_f1: 0.6205
 epoch: 85, train_loss: 0.3337, test_loss: 2.0204, test_f1: 0.6011
 epoch: 86, train_loss: 0.3345, test_loss: 2.0788, test_f1: 0.6086
 epoch: 87, train_loss: 0.3207, test_loss: 2.1456, test_f1: 0.5920
 epoch: 88, train_loss: 0.3142, test_loss: 1.9720, test_f1: 0.6050
 epoch: 89, train_loss: 0.3161, test_loss: 1.8739, test_f1: 0.6168
 epoch: 90, train_loss: 0.3440, test_loss: 2.0737, test_f1: 0.5808
 epoch: 91, train_loss: 0.3054, test_loss: 2.1257, test_f1: 0.6286
 epoch: 92, train_loss: 0.3027, test_loss: 2.1436, test_f1: 0.6026
 epoch: 93, train_loss: 0.3259, test_loss: 2.0649, test_f1: 0.5919
 epoch: 94, train_loss: 0.2989, test_loss: 2.1433, test_f1: 0.5857
 epoch: 95, train_loss: 0.3192, test_loss: 2.2092, test_f1: 0.5902
 epoch: 96, train_loss: 0.2977, test_loss: 2.2480, test_f1: 0.5944
 epoch: 97, train_loss: 0.3020, test_loss: 2.0784, test_f1: 0.5839
 epoch: 98, train_loss: 0.2772, test_loss: 2.1937, test_f1: 0.5988
 epoch: 99, train_loss: 0.2670, test_loss: 2.3483, test_f1: 0.5897
##################ITERATION #7 ****************************************
 epoch: 0, train_loss: 1.2417, test_loss: 1.3089, test_f1: 0.1365
 epoch: 1, train_loss: 1.0837, test_loss: 1.2789, test_f1: 0.1365
 epoch: 2, train_loss: 1.0254, test_loss: 1.2355, test_f1: 0.1994
 epoch: 3, train_loss: 0.9724, test_loss: 1.1920, test_f1: 0.2475
 epoch: 4, train_loss: 0.9362, test_loss: 1.1781, test_f1: 0.2438
 epoch: 5, train_loss: 0.8991, test_loss: 1.1631, test_f1: 0.3973
 epoch: 6, train_loss: 0.8932, test_loss: 1.2125, test_f1: 0.3692
 epoch: 7, train_loss: 0.8822, test_loss: 1.1384, test_f1: 0.4584
 epoch: 8, train_loss: 0.8744, test_loss: 1.1371, test_f1: 0.5718
 epoch: 9, train_loss: 0.8626, test_loss: 1.0846, test_f1: 0.5764
 epoch: 10, train_loss: 0.8680, test_loss: 1.0499, test_f1: 0.5481
 epoch: 11, train_loss: 0.8364, test_loss: 1.0358, test_f1: 0.5761
 epoch: 12, train_loss: 0.8455, test_loss: 1.0125, test_f1: 0.5856
 epoch: 13, train_loss: 0.8262, test_loss: 1.1510, test_f1: 0.5374
 epoch: 14, train_loss: 0.8289, test_loss: 1.1788, test_f1: 0.5279
 epoch: 15, train_loss: 0.8374, test_loss: 1.0943, test_f1: 0.5946
 epoch: 16, train_loss: 0.8251, test_loss: 1.2495, test_f1: 0.4888
 epoch: 17, train_loss: 0.8064, test_loss: 1.1674, test_f1: 0.5428
 epoch: 18, train_loss: 0.7889, test_loss: 1.0837, test_f1: 0.5066
 epoch: 19, train_loss: 0.7800, test_loss: 1.0815, test_f1: 0.5464
 epoch: 20, train_loss: 0.7592, test_loss: 1.0343, test_f1: 0.5766
 epoch: 21, train_loss: 0.7434, test_loss: 1.1396, test_f1: 0.5622
 epoch: 22, train_loss: 0.7400, test_loss: 1.1777, test_f1: 0.5540
 epoch: 23, train_loss: 0.7449, test_loss: 1.0669, test_f1: 0.5726
 epoch: 24, train_loss: 0.7512, test_loss: 1.0815, test_f1: 0.5977
 epoch: 25, train_loss: 0.7423, test_loss: 1.1238, test_f1: 0.5739
 epoch: 26, train_loss: 0.7283, test_loss: 1.1005, test_f1: 0.5709
 epoch: 27, train_loss: 0.7121, test_loss: 1.1700, test_f1: 0.5501
 epoch: 28, train_loss: 0.7011, test_loss: 1.0943, test_f1: 0.6110
 epoch: 29, train_loss: 0.6919, test_loss: 1.1125, test_f1: 0.5834
 epoch: 30, train_loss: 0.6759, test_loss: 1.0909, test_f1: 0.6391
 epoch: 31, train_loss: 0.6520, test_loss: 1.1064, test_f1: 0.6230
 epoch: 32, train_loss: 0.6518, test_loss: 1.1789, test_f1: 0.5921
 epoch: 33, train_loss: 0.6562, test_loss: 1.2674, test_f1: 0.5029
 epoch: 34, train_loss: 0.6457, test_loss: 1.1885, test_f1: 0.6155
 epoch: 35, train_loss: 0.6438, test_loss: 1.2789, test_f1: 0.5975
 epoch: 36, train_loss: 0.6390, test_loss: 1.2149, test_f1: 0.6164
 epoch: 37, train_loss: 0.6906, test_loss: 1.2097, test_f1: 0.5477
 epoch: 38, train_loss: 0.6308, test_loss: 1.1929, test_f1: 0.5926
 epoch: 39, train_loss: 0.6139, test_loss: 1.2588, test_f1: 0.5481
 epoch: 40, train_loss: 0.6298, test_loss: 1.2645, test_f1: 0.5633
 epoch: 41, train_loss: 0.6343, test_loss: 1.4582, test_f1: 0.5409
 epoch: 42, train_loss: 0.6523, test_loss: 1.2393, test_f1: 0.6021
 epoch: 43, train_loss: 0.6200, test_loss: 1.1516, test_f1: 0.5992
 epoch: 44, train_loss: 0.5779, test_loss: 1.0946, test_f1: 0.6012
 epoch: 45, train_loss: 0.5813, test_loss: 1.3853, test_f1: 0.6014
 epoch: 46, train_loss: 0.5831, test_loss: 1.2265, test_f1: 0.6307
 epoch: 47, train_loss: 0.5914, test_loss: 1.3653, test_f1: 0.5577
 epoch: 48, train_loss: 0.5851, test_loss: 1.2933, test_f1: 0.6163
 epoch: 49, train_loss: 0.5706, test_loss: 1.3612, test_f1: 0.6181
 epoch: 50, train_loss: 0.5527, test_loss: 1.4732, test_f1: 0.6042
 epoch: 51, train_loss: 0.5285, test_loss: 1.4641, test_f1: 0.6114
 epoch: 52, train_loss: 0.5033, test_loss: 1.5283, test_f1: 0.5404
 epoch: 53, train_loss: 0.4989, test_loss: 1.4298, test_f1: 0.5860
 epoch: 54, train_loss: 0.4798, test_loss: 1.3699, test_f1: 0.6419
 epoch: 55, train_loss: 0.4747, test_loss: 1.3190, test_f1: 0.6244
 epoch: 56, train_loss: 0.4631, test_loss: 1.4263, test_f1: 0.6025
 epoch: 57, train_loss: 0.4590, test_loss: 1.3380, test_f1: 0.6069
 epoch: 58, train_loss: 0.4461, test_loss: 1.5891, test_f1: 0.5812
 epoch: 59, train_loss: 0.4657, test_loss: 1.5185, test_f1: 0.5897
 epoch: 60, train_loss: 0.4406, test_loss: 1.5632, test_f1: 0.6329
 epoch: 61, train_loss: 0.4358, test_loss: 1.6076, test_f1: 0.6319
 epoch: 62, train_loss: 0.4289, test_loss: 1.5352, test_f1: 0.6157
 epoch: 63, train_loss: 0.4408, test_loss: 1.5612, test_f1: 0.6122
 epoch: 64, train_loss: 0.4173, test_loss: 1.4750, test_f1: 0.6450
 epoch: 65, train_loss: 0.4010, test_loss: 1.4610, test_f1: 0.6346
 epoch: 66, train_loss: 0.4178, test_loss: 1.4275, test_f1: 0.6450
 epoch: 67, train_loss: 0.4108, test_loss: 1.5580, test_f1: 0.6358
 epoch: 68, train_loss: 0.4179, test_loss: 1.6534, test_f1: 0.6109
 epoch: 69, train_loss: 0.4169, test_loss: 1.7712, test_f1: 0.5676
 epoch: 70, train_loss: 0.3898, test_loss: 1.7122, test_f1: 0.6185
 epoch: 71, train_loss: 0.3728, test_loss: 1.5951, test_f1: 0.6415
 epoch: 72, train_loss: 0.3820, test_loss: 1.7360, test_f1: 0.6167
 epoch: 73, train_loss: 0.3574, test_loss: 1.7242, test_f1: 0.6030
 epoch: 74, train_loss: 0.3867, test_loss: 1.7026, test_f1: 0.6034
 epoch: 75, train_loss: 0.3434, test_loss: 1.7977, test_f1: 0.5713
 epoch: 76, train_loss: 0.3729, test_loss: 1.9013, test_f1: 0.6053
 epoch: 77, train_loss: 0.3637, test_loss: 1.8799, test_f1: 0.6085
 epoch: 78, train_loss: 0.3515, test_loss: 1.8901, test_f1: 0.5955
 epoch: 79, train_loss: 0.3473, test_loss: 1.8821, test_f1: 0.6222
 epoch: 80, train_loss: 0.3224, test_loss: 1.7729, test_f1: 0.6144
 epoch: 81, train_loss: 0.3307, test_loss: 1.9364, test_f1: 0.6245
 epoch: 82, train_loss: 0.3334, test_loss: 1.8814, test_f1: 0.6282
 epoch: 83, train_loss: 0.3426, test_loss: 2.0520, test_f1: 0.5975
 epoch: 84, train_loss: 0.3613, test_loss: 2.0649, test_f1: 0.5975
 epoch: 85, train_loss: 0.3377, test_loss: 1.9832, test_f1: 0.6106
 epoch: 86, train_loss: 0.3534, test_loss: 1.8523, test_f1: 0.6104
 epoch: 87, train_loss: 0.3284, test_loss: 1.9394, test_f1: 0.6188
 epoch: 88, train_loss: 0.3311, test_loss: 1.9811, test_f1: 0.6036
 epoch: 89, train_loss: 0.3176, test_loss: 1.9081, test_f1: 0.6331
 epoch: 90, train_loss: 0.3219, test_loss: 2.0983, test_f1: 0.6292
 epoch: 91, train_loss: 0.3488, test_loss: 2.1274, test_f1: 0.5965
 epoch: 92, train_loss: 0.3139, test_loss: 2.0478, test_f1: 0.5896
 epoch: 93, train_loss: 0.3200, test_loss: 2.2263, test_f1: 0.5762
 epoch: 94, train_loss: 0.3050, test_loss: 2.1020, test_f1: 0.5757
 epoch: 95, train_loss: 0.2862, test_loss: 2.0165, test_f1: 0.6047
 epoch: 96, train_loss: 0.3238, test_loss: 2.0110, test_f1: 0.6320
 epoch: 97, train_loss: 0.3468, test_loss: 2.0146, test_f1: 0.6153
 epoch: 98, train_loss: 0.3133, test_loss: 2.3341, test_f1: 0.5883
 epoch: 99, train_loss: 0.3494, test_loss: 2.1044, test_f1: 0.6003
##################ITERATION #8 ****************************************
 epoch: 0, train_loss: 1.2897, test_loss: 1.3058, test_f1: 0.1365
 epoch: 1, train_loss: 1.0834, test_loss: 1.2984, test_f1: 0.1617
 epoch: 2, train_loss: 1.0358, test_loss: 1.3853, test_f1: 0.3024
 epoch: 3, train_loss: 0.9669, test_loss: 1.4098, test_f1: 0.2829
 epoch: 4, train_loss: 0.9502, test_loss: 1.3627, test_f1: 0.3104
 epoch: 5, train_loss: 0.9374, test_loss: 1.3183, test_f1: 0.3097
 epoch: 6, train_loss: 0.9044, test_loss: 1.1910, test_f1: 0.3400
 epoch: 7, train_loss: 0.9008, test_loss: 1.1580, test_f1: 0.3677
 epoch: 8, train_loss: 0.8659, test_loss: 1.1095, test_f1: 0.4300
 epoch: 9, train_loss: 0.8519, test_loss: 1.1618, test_f1: 0.4439
 epoch: 10, train_loss: 0.8283, test_loss: 1.1732, test_f1: 0.4941
 epoch: 11, train_loss: 0.8579, test_loss: 1.1228, test_f1: 0.5205
 epoch: 12, train_loss: 0.8283, test_loss: 1.1027, test_f1: 0.5541
 epoch: 13, train_loss: 0.8225, test_loss: 1.0115, test_f1: 0.5958
 epoch: 14, train_loss: 0.8102, test_loss: 1.1835, test_f1: 0.5430
 epoch: 15, train_loss: 0.8189, test_loss: 1.1303, test_f1: 0.5671
 epoch: 16, train_loss: 0.7943, test_loss: 1.1037, test_f1: 0.5563
 epoch: 17, train_loss: 0.8025, test_loss: 1.1047, test_f1: 0.5909
 epoch: 18, train_loss: 0.7750, test_loss: 1.1022, test_f1: 0.5875
 epoch: 19, train_loss: 0.7560, test_loss: 1.0903, test_f1: 0.5796
 epoch: 20, train_loss: 0.7234, test_loss: 1.0897, test_f1: 0.5443
 epoch: 21, train_loss: 0.7314, test_loss: 1.1375, test_f1: 0.5820
 epoch: 22, train_loss: 0.7143, test_loss: 1.0730, test_f1: 0.5961
 epoch: 23, train_loss: 0.7134, test_loss: 1.1415, test_f1: 0.6084
 epoch: 24, train_loss: 0.7323, test_loss: 1.1154, test_f1: 0.5786
 epoch: 25, train_loss: 0.7132, test_loss: 1.1507, test_f1: 0.5566
 epoch: 26, train_loss: 0.6880, test_loss: 1.1601, test_f1: 0.6033
 epoch: 27, train_loss: 0.6987, test_loss: 1.0457, test_f1: 0.6057
 epoch: 28, train_loss: 0.7035, test_loss: 1.1473, test_f1: 0.5459
 epoch: 29, train_loss: 0.6905, test_loss: 1.1013, test_f1: 0.6082
 epoch: 30, train_loss: 0.6387, test_loss: 1.2816, test_f1: 0.5281
 epoch: 31, train_loss: 0.6502, test_loss: 1.2968, test_f1: 0.5446
 epoch: 32, train_loss: 0.6319, test_loss: 1.3843, test_f1: 0.5377
 epoch: 33, train_loss: 0.6596, test_loss: 1.4329, test_f1: 0.5566
 epoch: 34, train_loss: 0.6436, test_loss: 1.2870, test_f1: 0.6089
 epoch: 35, train_loss: 0.6491, test_loss: 1.5026, test_f1: 0.5400
 epoch: 36, train_loss: 0.6384, test_loss: 1.3396, test_f1: 0.5965
 epoch: 37, train_loss: 0.6290, test_loss: 1.3540, test_f1: 0.6255
 epoch: 38, train_loss: 0.6433, test_loss: 1.2250, test_f1: 0.6290
 epoch: 39, train_loss: 0.6002, test_loss: 1.2069, test_f1: 0.6330
 epoch: 40, train_loss: 0.5781, test_loss: 1.2488, test_f1: 0.6412
 epoch: 41, train_loss: 0.5776, test_loss: 1.3020, test_f1: 0.6140
 epoch: 42, train_loss: 0.5711, test_loss: 1.5789, test_f1: 0.5646
 epoch: 43, train_loss: 0.5832, test_loss: 1.4075, test_f1: 0.6035
 epoch: 44, train_loss: 0.5841, test_loss: 1.5946, test_f1: 0.5566
 epoch: 45, train_loss: 0.5909, test_loss: 1.5429, test_f1: 0.5783
 epoch: 46, train_loss: 0.5584, test_loss: 1.4076, test_f1: 0.5969
 epoch: 47, train_loss: 0.5359, test_loss: 1.4113, test_f1: 0.5899
 epoch: 48, train_loss: 0.5638, test_loss: 1.5034, test_f1: 0.6217
 epoch: 49, train_loss: 0.5674, test_loss: 1.4678, test_f1: 0.5953
 epoch: 50, train_loss: 0.5568, test_loss: 1.4820, test_f1: 0.5541
 epoch: 51, train_loss: 0.5371, test_loss: 1.3218, test_f1: 0.6146
 epoch: 52, train_loss: 0.5025, test_loss: 1.3148, test_f1: 0.6236
 epoch: 53, train_loss: 0.4730, test_loss: 1.3016, test_f1: 0.6167
 epoch: 54, train_loss: 0.4697, test_loss: 1.3458, test_f1: 0.6201
 epoch: 55, train_loss: 0.4593, test_loss: 1.4984, test_f1: 0.5910
 epoch: 56, train_loss: 0.4584, test_loss: 1.4346, test_f1: 0.5989
 epoch: 57, train_loss: 0.4430, test_loss: 1.4883, test_f1: 0.5956
 epoch: 58, train_loss: 0.4322, test_loss: 1.6285, test_f1: 0.6058
 epoch: 59, train_loss: 0.4525, test_loss: 1.7482, test_f1: 0.5839
 epoch: 60, train_loss: 0.4102, test_loss: 1.7575, test_f1: 0.5647
 epoch: 61, train_loss: 0.4177, test_loss: 1.5501, test_f1: 0.6014
 epoch: 62, train_loss: 0.4514, test_loss: 1.5364, test_f1: 0.6191
 epoch: 63, train_loss: 0.4414, test_loss: 1.5735, test_f1: 0.5916
 epoch: 64, train_loss: 0.4201, test_loss: 1.7044, test_f1: 0.6042
 epoch: 65, train_loss: 0.4119, test_loss: 1.7356, test_f1: 0.6129
 epoch: 66, train_loss: 0.3964, test_loss: 1.8247, test_f1: 0.5878
 epoch: 67, train_loss: 0.3917, test_loss: 1.9050, test_f1: 0.6005
 epoch: 68, train_loss: 0.3762, test_loss: 1.7830, test_f1: 0.6102
 epoch: 69, train_loss: 0.3853, test_loss: 1.7866, test_f1: 0.6198
 epoch: 70, train_loss: 0.3790, test_loss: 1.8602, test_f1: 0.5954
 epoch: 71, train_loss: 0.3598, test_loss: 1.8652, test_f1: 0.6153
 epoch: 72, train_loss: 0.3607, test_loss: 1.7639, test_f1: 0.6389
 epoch: 73, train_loss: 0.3725, test_loss: 1.8740, test_f1: 0.6184
 epoch: 74, train_loss: 0.3555, test_loss: 1.7588, test_f1: 0.6224
 epoch: 75, train_loss: 0.3655, test_loss: 1.7655, test_f1: 0.6125
 epoch: 76, train_loss: 0.3610, test_loss: 1.7949, test_f1: 0.5923
 epoch: 77, train_loss: 0.3531, test_loss: 1.6924, test_f1: 0.6241
 epoch: 78, train_loss: 0.3570, test_loss: 1.7983, test_f1: 0.5996
 epoch: 79, train_loss: 0.3292, test_loss: 2.0453, test_f1: 0.5814
 epoch: 80, train_loss: 0.3368, test_loss: 1.9075, test_f1: 0.6112
 epoch: 81, train_loss: 0.3244, test_loss: 2.0038, test_f1: 0.5991
 epoch: 82, train_loss: 0.3243, test_loss: 2.0475, test_f1: 0.5849
 epoch: 83, train_loss: 0.3168, test_loss: 2.0098, test_f1: 0.5954
 epoch: 84, train_loss: 0.3201, test_loss: 2.0520, test_f1: 0.5906
 epoch: 85, train_loss: 0.3075, test_loss: 2.0845, test_f1: 0.5956
 epoch: 86, train_loss: 0.3062, test_loss: 2.0428, test_f1: 0.5927
 epoch: 87, train_loss: 0.3105, test_loss: 1.9025, test_f1: 0.6095
 epoch: 88, train_loss: 0.2975, test_loss: 2.0427, test_f1: 0.5896
 epoch: 89, train_loss: 0.2923, test_loss: 2.1447, test_f1: 0.6147
 epoch: 90, train_loss: 0.3119, test_loss: 2.2237, test_f1: 0.5855
 epoch: 91, train_loss: 0.3336, test_loss: 2.3517, test_f1: 0.5847
 epoch: 92, train_loss: 0.2960, test_loss: 2.1255, test_f1: 0.5900
 epoch: 93, train_loss: 0.2999, test_loss: 2.1846, test_f1: 0.5851
 epoch: 94, train_loss: 0.2937, test_loss: 2.0922, test_f1: 0.5948
 epoch: 95, train_loss: 0.3037, test_loss: 1.9957, test_f1: 0.6001
 epoch: 96, train_loss: 0.3202, test_loss: 1.9495, test_f1: 0.6187
 epoch: 97, train_loss: 0.2839, test_loss: 1.9731, test_f1: 0.6077
 epoch: 98, train_loss: 0.2877, test_loss: 2.2005, test_f1: 0.6046
 epoch: 99, train_loss: 0.2753, test_loss: 2.2733, test_f1: 0.5789
##################ITERATION #9 ****************************************
 epoch: 0, train_loss: 1.3452, test_loss: 1.3653, test_f1: 0.1365
 epoch: 1, train_loss: 1.1849, test_loss: 1.3853, test_f1: 0.1365
 epoch: 2, train_loss: 1.0384, test_loss: 1.3464, test_f1: 0.1365
 epoch: 3, train_loss: 1.0030, test_loss: 1.2977, test_f1: 0.1607
 epoch: 4, train_loss: 0.9670, test_loss: 1.2351, test_f1: 0.3109
 epoch: 5, train_loss: 0.9196, test_loss: 1.1876, test_f1: 0.2936
 epoch: 6, train_loss: 0.8990, test_loss: 1.1148, test_f1: 0.4563
 epoch: 7, train_loss: 0.9104, test_loss: 1.0992, test_f1: 0.5187
 epoch: 8, train_loss: 0.8966, test_loss: 1.2033, test_f1: 0.4554
 epoch: 9, train_loss: 0.8713, test_loss: 1.1238, test_f1: 0.5391
 epoch: 10, train_loss: 0.8388, test_loss: 1.0786, test_f1: 0.5471
 epoch: 11, train_loss: 0.8262, test_loss: 1.0816, test_f1: 0.5471
 epoch: 12, train_loss: 0.8081, test_loss: 1.0632, test_f1: 0.5784
 epoch: 13, train_loss: 0.8113, test_loss: 1.0648, test_f1: 0.5590
 epoch: 14, train_loss: 0.7736, test_loss: 1.0941, test_f1: 0.5325
 epoch: 15, train_loss: 0.7757, test_loss: 1.0799, test_f1: 0.5253
 epoch: 16, train_loss: 0.7806, test_loss: 1.0799, test_f1: 0.5398
 epoch: 17, train_loss: 0.7683, test_loss: 1.0707, test_f1: 0.5638
 epoch: 18, train_loss: 0.7395, test_loss: 1.0642, test_f1: 0.5742
 epoch: 19, train_loss: 0.7441, test_loss: 1.1550, test_f1: 0.5573
 epoch: 20, train_loss: 0.7447, test_loss: 1.0802, test_f1: 0.5873
 epoch: 21, train_loss: 0.7141, test_loss: 1.1047, test_f1: 0.5598
 epoch: 22, train_loss: 0.7010, test_loss: 1.0930, test_f1: 0.5920
 epoch: 23, train_loss: 0.6797, test_loss: 1.1539, test_f1: 0.6202
 epoch: 24, train_loss: 0.6898, test_loss: 1.1885, test_f1: 0.5459
 epoch: 25, train_loss: 0.6826, test_loss: 1.2676, test_f1: 0.5390
 epoch: 26, train_loss: 0.6672, test_loss: 1.1780, test_f1: 0.5841
 epoch: 27, train_loss: 0.7518, test_loss: 1.1963, test_f1: 0.5249
 epoch: 28, train_loss: 0.7014, test_loss: 1.0031, test_f1: 0.6244
 epoch: 29, train_loss: 0.7241, test_loss: 1.1864, test_f1: 0.5884
 epoch: 30, train_loss: 0.6571, test_loss: 1.2665, test_f1: 0.5319
 epoch: 31, train_loss: 0.6627, test_loss: 1.3773, test_f1: 0.5179
 epoch: 32, train_loss: 0.6429, test_loss: 1.1918, test_f1: 0.5937
 epoch: 33, train_loss: 0.6561, test_loss: 1.2614, test_f1: 0.5324
 epoch: 34, train_loss: 0.6455, test_loss: 1.1353, test_f1: 0.5681
 epoch: 35, train_loss: 0.6277, test_loss: 1.1634, test_f1: 0.5524
 epoch: 36, train_loss: 0.5916, test_loss: 1.1445, test_f1: 0.6397
 epoch: 37, train_loss: 0.5764, test_loss: 1.3284, test_f1: 0.5934
 epoch: 38, train_loss: 0.5918, test_loss: 1.2018, test_f1: 0.6167
 epoch: 39, train_loss: 0.5940, test_loss: 1.3189, test_f1: 0.6208
 epoch: 40, train_loss: 0.5673, test_loss: 1.2975, test_f1: 0.5846
 epoch: 41, train_loss: 0.5617, test_loss: 1.2634, test_f1: 0.5823
 epoch: 42, train_loss: 0.5508, test_loss: 1.3331, test_f1: 0.5838
 epoch: 43, train_loss: 0.5863, test_loss: 1.6975, test_f1: 0.5743
 epoch: 44, train_loss: 0.6246, test_loss: 1.5705, test_f1: 0.6006
 epoch: 45, train_loss: 0.6365, test_loss: 1.3690, test_f1: 0.5987
 epoch: 46, train_loss: 0.6040, test_loss: 1.3071, test_f1: 0.6064
 epoch: 47, train_loss: 0.5962, test_loss: 1.5171, test_f1: 0.5417
 epoch: 48, train_loss: 0.5654, test_loss: 1.2094, test_f1: 0.5971
 epoch: 49, train_loss: 0.5397, test_loss: 1.2245, test_f1: 0.5440
 epoch: 50, train_loss: 0.5072, test_loss: 1.2712, test_f1: 0.5962
 epoch: 51, train_loss: 0.5045, test_loss: 1.2505, test_f1: 0.5975
 epoch: 52, train_loss: 0.4875, test_loss: 1.2564, test_f1: 0.6414
 epoch: 53, train_loss: 0.4845, test_loss: 1.3859, test_f1: 0.6011
 epoch: 54, train_loss: 0.4719, test_loss: 1.3992, test_f1: 0.6058
 epoch: 55, train_loss: 0.4445, test_loss: 1.4367, test_f1: 0.6204
 epoch: 56, train_loss: 0.4482, test_loss: 1.4098, test_f1: 0.6250
 epoch: 57, train_loss: 0.4459, test_loss: 1.4094, test_f1: 0.6089
 epoch: 58, train_loss: 0.4215, test_loss: 1.4109, test_f1: 0.6023
 epoch: 59, train_loss: 0.3935, test_loss: 1.4336, test_f1: 0.5858
 epoch: 60, train_loss: 0.4167, test_loss: 1.5290, test_f1: 0.6034
 epoch: 61, train_loss: 0.3928, test_loss: 1.6741, test_f1: 0.5870
 epoch: 62, train_loss: 0.3999, test_loss: 1.7511, test_f1: 0.6142
 epoch: 63, train_loss: 0.3989, test_loss: 1.5682, test_f1: 0.6050
 epoch: 64, train_loss: 0.3826, test_loss: 1.5549, test_f1: 0.6149
 epoch: 65, train_loss: 0.4037, test_loss: 1.7390, test_f1: 0.6053
 epoch: 66, train_loss: 0.3731, test_loss: 1.8024, test_f1: 0.5907
 epoch: 67, train_loss: 0.3569, test_loss: 1.8135, test_f1: 0.5857
 epoch: 68, train_loss: 0.3644, test_loss: 1.6488, test_f1: 0.5897
 epoch: 69, train_loss: 0.3593, test_loss: 1.6888, test_f1: 0.5895
 epoch: 70, train_loss: 0.3553, test_loss: 1.7984, test_f1: 0.6147
 epoch: 71, train_loss: 0.3274, test_loss: 1.7392, test_f1: 0.6129
 epoch: 72, train_loss: 0.3286, test_loss: 1.6960, test_f1: 0.5917
 epoch: 73, train_loss: 0.3458, test_loss: 1.7609, test_f1: 0.6021
 epoch: 74, train_loss: 0.3729, test_loss: 1.7093, test_f1: 0.6248
 epoch: 75, train_loss: 0.3309, test_loss: 1.7967, test_f1: 0.6263
 epoch: 76, train_loss: 0.3272, test_loss: 1.8818, test_f1: 0.6013
 epoch: 77, train_loss: 0.3178, test_loss: 1.9295, test_f1: 0.5907
 epoch: 78, train_loss: 0.3213, test_loss: 1.8954, test_f1: 0.5850
 epoch: 79, train_loss: 0.3361, test_loss: 1.9925, test_f1: 0.5939
 epoch: 80, train_loss: 0.3064, test_loss: 1.9838, test_f1: 0.6115
 epoch: 81, train_loss: 0.3147, test_loss: 1.9880, test_f1: 0.5966
 epoch: 82, train_loss: 0.3012, test_loss: 2.0969, test_f1: 0.5800
 epoch: 83, train_loss: 0.3288, test_loss: 1.9055, test_f1: 0.6127
 epoch: 84, train_loss: 0.3397, test_loss: 1.9009, test_f1: 0.5901
 epoch: 85, train_loss: 0.3002, test_loss: 1.9919, test_f1: 0.6045
 epoch: 86, train_loss: 0.3041, test_loss: 2.1678, test_f1: 0.6015
 epoch: 87, train_loss: 0.3266, test_loss: 2.0404, test_f1: 0.6051
 epoch: 88, train_loss: 0.3338, test_loss: 2.3294, test_f1: 0.5899
 epoch: 89, train_loss: 0.3345, test_loss: 2.1834, test_f1: 0.5997
 epoch: 90, train_loss: 0.3419, test_loss: 1.8990, test_f1: 0.6108
 epoch: 91, train_loss: 0.3090, test_loss: 1.7858, test_f1: 0.6127
 epoch: 92, train_loss: 0.3091, test_loss: 1.8563, test_f1: 0.6235
 epoch: 93, train_loss: 0.2976, test_loss: 1.9580, test_f1: 0.5982
 epoch: 94, train_loss: 0.3352, test_loss: 2.1363, test_f1: 0.5719
 epoch: 95, train_loss: 0.3148, test_loss: 2.0863, test_f1: 0.5579
 epoch: 96, train_loss: 0.3023, test_loss: 2.1547, test_f1: 0.5798
 epoch: 97, train_loss: 0.3056, test_loss: 1.9368, test_f1: 0.5918
 epoch: 98, train_loss: 0.3020, test_loss: 1.8587, test_f1: 0.5851
 epoch: 99, train_loss: 0.2867, test_loss: 1.9694, test_f1: 0.6253

Training completed in 304.90 seconds
Best F1: 0.6564 at epoch 34
Mean F1 across iterations: 0.6388  0.0103
========================FINAL RESULTS================================
FEGIN weighted F1: 0.6564  0.0103
python main.py --data ltspice_demos --representation component_net --model FEGIN --layers 4 --hiddens 128 --batch_size 256 --lr 0.001 --emb_size 128 --epochs 100 --save_appendix component_net_L4_H128_BS256_LR0.001_E128 --no_val
-----



STDERR:
  File "main.py", line 370, in <module>
    main()
  File "main.py", line 254, in main
    dataset = dataset_class(
  File "/home/philip/projects/ltspice_examples_code_repo/Circuit-Completion-Using-GNNs/component_classification_with_link_prediction_head/evaluation/FEGIN/kernel/circuit_datasets.py", line 15, in __init__
    self.data, self.slices = torch.load(self.processed_paths[0])
  File "/home/philip/.local/lib/python3.8/site-packages/torch/serialization.py", line 1040, in load
    warnings.warn(
  File "/usr/lib/python3.8/warnings.py", line 109, in _showwarnmsg
    sw(msg.message, msg.category, msg.filename, msg.lineno,
  File "main.py", line 47, in warn_with_traceback
    traceback.print_stack(file=log)
/home/philip/projects/ltspice_examples_code_repo/Circuit-Completion-Using-GNNs/component_classification_with_link_prediction_head/evaluation/FEGIN/kernel/circuit_datasets.py:15: FutureWarning: You are using `torch.load` with `weights_only=False` (the current default value), which uses the default pickle module implicitly. It is possible to construct malicious pickle data which will execute arbitrary code during unpickling (See https://github.com/pytorch/pytorch/blob/main/SECURITY.md#untrusted-models for more details). In a future release, the default value for `weights_only` will be flipped to `True`. This limits the functions that could be executed during unpickling. Arbitrary objects will no longer be allowed to be loaded via this mode unless they are explicitly allowlisted by the user via `torch.serialization.add_safe_globals`. We recommend you start setting `weights_only=True` for any use case where you don't have full control of the loaded file. Please open an issue on GitHub for any issues related to this experimental feature.
  self.data, self.slices = torch.load(self.processed_paths[0])
