STDOUT:
Results will be saved in /home/philip/projects/ltspice_examples_code_repo/Circuit-Completion-Using-GNNs/component_classification_with_link_prediction_head/evaluation/FEGIN/results/model_FEGIN_dataset_ltspice_demos
Command line input: python main.py --data ltspice_demos --representation component_net --model FEGIN --layers 4 --hiddens 128 --batch_size 256 --lr 0.001 --emb_size 128 --epochs 100 --save_appendix component_net_L4_H128_BS256_LR0.001_E128 --no_val
 is saved.
-----
ltspice_demos - FEGIN
Using 4 layers, 128 hidden units, h = 2
Loading component_net representation dataset
ENTERED
Training FEGIN on component_net representation
Train: 1565, Test: 383
##################ITERATION #0 ****************************************
 epoch: 0, train_loss: 1.3091, test_loss: 1.3491, test_f1: 0.2281
 epoch: 1, train_loss: 1.1645, test_loss: 1.3285, test_f1: 0.2281
 epoch: 2, train_loss: 1.1202, test_loss: 1.3178, test_f1: 0.2583
 epoch: 3, train_loss: 1.0917, test_loss: 1.2946, test_f1: 0.2281
 epoch: 4, train_loss: 1.0827, test_loss: 1.2774, test_f1: 0.3113
 epoch: 5, train_loss: 1.0538, test_loss: 1.2106, test_f1: 0.4348
 epoch: 6, train_loss: 1.0332, test_loss: 1.1835, test_f1: 0.4436
 epoch: 7, train_loss: 1.0097, test_loss: 1.1080, test_f1: 0.4719
 epoch: 8, train_loss: 0.9782, test_loss: 1.0806, test_f1: 0.5387
 epoch: 9, train_loss: 0.9567, test_loss: 1.1175, test_f1: 0.5610
 epoch: 10, train_loss: 0.9197, test_loss: 1.0702, test_f1: 0.5367
 epoch: 11, train_loss: 0.8984, test_loss: 1.1176, test_f1: 0.5459
 epoch: 12, train_loss: 0.8874, test_loss: 1.1646, test_f1: 0.5421
 epoch: 13, train_loss: 0.8688, test_loss: 1.1488, test_f1: 0.5751
 epoch: 14, train_loss: 0.8500, test_loss: 1.1446, test_f1: 0.5557
 epoch: 15, train_loss: 0.8646, test_loss: 1.0916, test_f1: 0.5491
 epoch: 16, train_loss: 0.8328, test_loss: 1.1122, test_f1: 0.5843
 epoch: 17, train_loss: 0.8208, test_loss: 1.1227, test_f1: 0.5642
 epoch: 18, train_loss: 0.8317, test_loss: 1.0609, test_f1: 0.5852
 epoch: 19, train_loss: 0.8096, test_loss: 1.1054, test_f1: 0.6038
 epoch: 20, train_loss: 0.7915, test_loss: 1.1712, test_f1: 0.5860
 epoch: 21, train_loss: 0.7888, test_loss: 1.0980, test_f1: 0.5856
 epoch: 22, train_loss: 0.8060, test_loss: 1.1052, test_f1: 0.5678
 epoch: 23, train_loss: 0.7671, test_loss: 1.1693, test_f1: 0.5611
 epoch: 24, train_loss: 0.7637, test_loss: 1.1953, test_f1: 0.5642
 epoch: 25, train_loss: 0.7783, test_loss: 1.1529, test_f1: 0.5665
 epoch: 26, train_loss: 0.7640, test_loss: 1.1717, test_f1: 0.5901
 epoch: 27, train_loss: 0.7376, test_loss: 1.2218, test_f1: 0.5600
 epoch: 28, train_loss: 0.7188, test_loss: 1.3038, test_f1: 0.5655
 epoch: 29, train_loss: 0.7251, test_loss: 1.3331, test_f1: 0.5507
 epoch: 30, train_loss: 0.7277, test_loss: 1.3443, test_f1: 0.5661
 epoch: 31, train_loss: 0.7319, test_loss: 1.3072, test_f1: 0.5745
 epoch: 32, train_loss: 0.7069, test_loss: 1.2088, test_f1: 0.6116
 epoch: 33, train_loss: 0.6914, test_loss: 1.2974, test_f1: 0.5725
 epoch: 34, train_loss: 0.6939, test_loss: 1.2729, test_f1: 0.5961
 epoch: 35, train_loss: 0.6582, test_loss: 1.2942, test_f1: 0.6051
 epoch: 36, train_loss: 0.6501, test_loss: 1.2553, test_f1: 0.6376
 epoch: 37, train_loss: 0.6484, test_loss: 1.3617, test_f1: 0.5784
 epoch: 38, train_loss: 0.6141, test_loss: 1.4709, test_f1: 0.5899
 epoch: 39, train_loss: 0.6414, test_loss: 1.3217, test_f1: 0.5560
 epoch: 40, train_loss: 0.6465, test_loss: 1.3340, test_f1: 0.6046
 epoch: 41, train_loss: 0.6312, test_loss: 1.2498, test_f1: 0.5834
 epoch: 42, train_loss: 0.6184, test_loss: 1.3026, test_f1: 0.5745
 epoch: 43, train_loss: 0.6037, test_loss: 1.3608, test_f1: 0.6042
 epoch: 44, train_loss: 0.5822, test_loss: 1.5096, test_f1: 0.6063
 epoch: 45, train_loss: 0.6056, test_loss: 1.4448, test_f1: 0.5847
 epoch: 46, train_loss: 0.6135, test_loss: 1.4889, test_f1: 0.5997
 epoch: 47, train_loss: 0.6081, test_loss: 1.4748, test_f1: 0.5901
 epoch: 48, train_loss: 0.5829, test_loss: 1.5434, test_f1: 0.5929
 epoch: 49, train_loss: 0.5916, test_loss: 1.6070, test_f1: 0.5664
 epoch: 50, train_loss: 0.6037, test_loss: 1.4409, test_f1: 0.5686
 epoch: 51, train_loss: 0.5408, test_loss: 1.4548, test_f1: 0.5946
 epoch: 52, train_loss: 0.5305, test_loss: 1.5171, test_f1: 0.6162
 epoch: 53, train_loss: 0.5105, test_loss: 1.4497, test_f1: 0.6053
 epoch: 54, train_loss: 0.5139, test_loss: 1.5337, test_f1: 0.6081
 epoch: 55, train_loss: 0.4912, test_loss: 1.4892, test_f1: 0.6098
 epoch: 56, train_loss: 0.4654, test_loss: 1.5219, test_f1: 0.6136
 epoch: 57, train_loss: 0.4536, test_loss: 1.5590, test_f1: 0.5931
 epoch: 58, train_loss: 0.4584, test_loss: 1.5914, test_f1: 0.5959
 epoch: 59, train_loss: 0.4701, test_loss: 1.6638, test_f1: 0.6000
 epoch: 60, train_loss: 0.4488, test_loss: 1.7422, test_f1: 0.6167
 epoch: 61, train_loss: 0.4498, test_loss: 1.6794, test_f1: 0.6006
 epoch: 62, train_loss: 0.4700, test_loss: 1.5683, test_f1: 0.5969
 epoch: 63, train_loss: 0.4749, test_loss: 1.5049, test_f1: 0.6089
 epoch: 64, train_loss: 0.4298, test_loss: 1.5437, test_f1: 0.6157
 epoch: 65, train_loss: 0.4214, test_loss: 1.6755, test_f1: 0.6038
 epoch: 66, train_loss: 0.4147, test_loss: 1.6147, test_f1: 0.6262
 epoch: 67, train_loss: 0.4196, test_loss: 1.7083, test_f1: 0.6071
 epoch: 68, train_loss: 0.4185, test_loss: 1.9075, test_f1: 0.5846
 epoch: 69, train_loss: 0.3956, test_loss: 1.8522, test_f1: 0.5829
 epoch: 70, train_loss: 0.3939, test_loss: 1.8526, test_f1: 0.5866
 epoch: 71, train_loss: 0.3746, test_loss: 1.9225, test_f1: 0.5702
 epoch: 72, train_loss: 0.3747, test_loss: 1.8254, test_f1: 0.5974
 epoch: 73, train_loss: 0.3648, test_loss: 1.8249, test_f1: 0.6003
 epoch: 74, train_loss: 0.3665, test_loss: 1.9478, test_f1: 0.6071
 epoch: 75, train_loss: 0.3764, test_loss: 1.9914, test_f1: 0.6069
 epoch: 76, train_loss: 0.3818, test_loss: 2.0644, test_f1: 0.5997
 epoch: 77, train_loss: 0.3635, test_loss: 2.0081, test_f1: 0.5908
 epoch: 78, train_loss: 0.3579, test_loss: 1.9378, test_f1: 0.5895
 epoch: 79, train_loss: 0.3511, test_loss: 2.0457, test_f1: 0.5856
 epoch: 80, train_loss: 0.3240, test_loss: 2.3783, test_f1: 0.5741
 epoch: 81, train_loss: 0.3873, test_loss: 2.2095, test_f1: 0.5650
 epoch: 82, train_loss: 0.3716, test_loss: 2.1738, test_f1: 0.5756
 epoch: 83, train_loss: 0.3477, test_loss: 2.1482, test_f1: 0.6084
 epoch: 84, train_loss: 0.3110, test_loss: 2.2402, test_f1: 0.6122
 epoch: 85, train_loss: 0.3160, test_loss: 2.4415, test_f1: 0.5635
 epoch: 86, train_loss: 0.3122, test_loss: 2.5886, test_f1: 0.5591
 epoch: 87, train_loss: 0.3614, test_loss: 2.6653, test_f1: 0.5710
 epoch: 88, train_loss: 0.3067, test_loss: 2.5064, test_f1: 0.5847
 epoch: 89, train_loss: 0.3005, test_loss: 2.3867, test_f1: 0.5878
 epoch: 90, train_loss: 0.2963, test_loss: 2.2228, test_f1: 0.5888
 epoch: 91, train_loss: 0.3230, test_loss: 2.3933, test_f1: 0.5970
 epoch: 92, train_loss: 0.2988, test_loss: 2.3002, test_f1: 0.6011
 epoch: 93, train_loss: 0.2847, test_loss: 2.4571, test_f1: 0.5973
 epoch: 94, train_loss: 0.2920, test_loss: 2.5032, test_f1: 0.5479
 epoch: 95, train_loss: 0.3047, test_loss: 2.3796, test_f1: 0.5863
 epoch: 96, train_loss: 0.3189, test_loss: 2.5444, test_f1: 0.5976
 epoch: 97, train_loss: 0.2911, test_loss: 2.7616, test_f1: 0.5870
 epoch: 98, train_loss: 0.3221, test_loss: 2.6685, test_f1: 0.5733
 epoch: 99, train_loss: 0.2780, test_loss: 2.5097, test_f1: 0.6018
##################ITERATION #1 ****************************************
 epoch: 0, train_loss: 1.2232, test_loss: 1.3053, test_f1: 0.2281
 epoch: 1, train_loss: 1.0762, test_loss: 1.3133, test_f1: 0.2720
 epoch: 2, train_loss: 1.0185, test_loss: 1.3056, test_f1: 0.3361
 epoch: 3, train_loss: 0.9809, test_loss: 1.2859, test_f1: 0.3340
 epoch: 4, train_loss: 0.9452, test_loss: 1.2417, test_f1: 0.3677
 epoch: 5, train_loss: 0.9087, test_loss: 1.1200, test_f1: 0.3535
 epoch: 6, train_loss: 0.8859, test_loss: 1.1243, test_f1: 0.3578
 epoch: 7, train_loss: 0.8491, test_loss: 1.1665, test_f1: 0.2967
 epoch: 8, train_loss: 0.8514, test_loss: 1.0712, test_f1: 0.4916
 epoch: 9, train_loss: 0.8646, test_loss: 1.2427, test_f1: 0.3928
 epoch: 10, train_loss: 0.8193, test_loss: 1.1467, test_f1: 0.4762
 epoch: 11, train_loss: 0.8109, test_loss: 1.1706, test_f1: 0.5218
 epoch: 12, train_loss: 0.8046, test_loss: 1.1043, test_f1: 0.5289
 epoch: 13, train_loss: 0.8022, test_loss: 1.1412, test_f1: 0.5543
 epoch: 14, train_loss: 0.7953, test_loss: 1.1108, test_f1: 0.5624
 epoch: 15, train_loss: 0.7613, test_loss: 1.1338, test_f1: 0.5840
 epoch: 16, train_loss: 0.7503, test_loss: 1.1189, test_f1: 0.5701
 epoch: 17, train_loss: 0.7354, test_loss: 1.1031, test_f1: 0.5615
 epoch: 18, train_loss: 0.7043, test_loss: 1.1332, test_f1: 0.5626
 epoch: 19, train_loss: 0.7044, test_loss: 1.1612, test_f1: 0.5616
 epoch: 20, train_loss: 0.6953, test_loss: 1.1829, test_f1: 0.6017
 epoch: 21, train_loss: 0.6719, test_loss: 1.3589, test_f1: 0.5620
 epoch: 22, train_loss: 0.7049, test_loss: 1.2910, test_f1: 0.5674
 epoch: 23, train_loss: 0.6764, test_loss: 1.1967, test_f1: 0.5907
 epoch: 24, train_loss: 0.6427, test_loss: 1.4026, test_f1: 0.5283
 epoch: 25, train_loss: 0.6358, test_loss: 1.3661, test_f1: 0.5932
 epoch: 26, train_loss: 0.6383, test_loss: 1.3583, test_f1: 0.5568
 epoch: 27, train_loss: 0.6357, test_loss: 1.4336, test_f1: 0.5212
 epoch: 28, train_loss: 0.6223, test_loss: 1.3303, test_f1: 0.6160
 epoch: 29, train_loss: 0.6208, test_loss: 1.3311, test_f1: 0.6296
 epoch: 30, train_loss: 0.5845, test_loss: 1.3717, test_f1: 0.5910
 epoch: 31, train_loss: 0.6001, test_loss: 1.4493, test_f1: 0.5554
 epoch: 32, train_loss: 0.5870, test_loss: 1.3695, test_f1: 0.6017
 epoch: 33, train_loss: 0.6044, test_loss: 1.3601, test_f1: 0.5995
 epoch: 34, train_loss: 0.5757, test_loss: 1.4001, test_f1: 0.5575
 epoch: 35, train_loss: 0.5472, test_loss: 1.4271, test_f1: 0.6025
 epoch: 36, train_loss: 0.5318, test_loss: 1.8015, test_f1: 0.5117
 epoch: 37, train_loss: 0.5274, test_loss: 1.9203, test_f1: 0.5771
 epoch: 38, train_loss: 0.5574, test_loss: 1.5657, test_f1: 0.6340
 epoch: 39, train_loss: 0.5245, test_loss: 1.7863, test_f1: 0.6211
 epoch: 40, train_loss: 0.5045, test_loss: 1.9610, test_f1: 0.5636
 epoch: 41, train_loss: 0.5796, test_loss: 1.7652, test_f1: 0.6074
 epoch: 42, train_loss: 0.5578, test_loss: 1.4734, test_f1: 0.5665
 epoch: 43, train_loss: 0.5247, test_loss: 1.5093, test_f1: 0.5795
 epoch: 44, train_loss: 0.5331, test_loss: 1.7320, test_f1: 0.5140
 epoch: 45, train_loss: 0.4768, test_loss: 1.6397, test_f1: 0.5871
 epoch: 46, train_loss: 0.4559, test_loss: 1.7550, test_f1: 0.6057
 epoch: 47, train_loss: 0.4596, test_loss: 1.6019, test_f1: 0.6174
 epoch: 48, train_loss: 0.4734, test_loss: 1.5376, test_f1: 0.5787
 epoch: 49, train_loss: 0.4629, test_loss: 1.7502, test_f1: 0.5589
 epoch: 50, train_loss: 0.4296, test_loss: 1.5605, test_f1: 0.6626
 epoch: 51, train_loss: 0.4591, test_loss: 1.5636, test_f1: 0.6253
 epoch: 52, train_loss: 0.4185, test_loss: 1.7214, test_f1: 0.6003
 epoch: 53, train_loss: 0.4099, test_loss: 1.8087, test_f1: 0.5821
 epoch: 54, train_loss: 0.3760, test_loss: 1.7576, test_f1: 0.5911
 epoch: 55, train_loss: 0.3869, test_loss: 1.8416, test_f1: 0.5899
 epoch: 56, train_loss: 0.3804, test_loss: 1.9754, test_f1: 0.5894
 epoch: 57, train_loss: 0.3601, test_loss: 1.7893, test_f1: 0.6104
 epoch: 58, train_loss: 0.3490, test_loss: 1.7928, test_f1: 0.5715
 epoch: 59, train_loss: 0.3713, test_loss: 1.9100, test_f1: 0.5925
 epoch: 60, train_loss: 0.3424, test_loss: 1.8827, test_f1: 0.5913
 epoch: 61, train_loss: 0.3246, test_loss: 1.7995, test_f1: 0.5984
 epoch: 62, train_loss: 0.2948, test_loss: 1.9205, test_f1: 0.5980
 epoch: 63, train_loss: 0.3112, test_loss: 1.9330, test_f1: 0.5859
 epoch: 64, train_loss: 0.3478, test_loss: 1.9764, test_f1: 0.5968
 epoch: 65, train_loss: 0.3170, test_loss: 1.9350, test_f1: 0.6232
 epoch: 66, train_loss: 0.3201, test_loss: 2.1204, test_f1: 0.6062
 epoch: 67, train_loss: 0.3015, test_loss: 1.9876, test_f1: 0.6141
 epoch: 68, train_loss: 0.2875, test_loss: 1.9936, test_f1: 0.6210
 epoch: 69, train_loss: 0.2869, test_loss: 2.0874, test_f1: 0.6108
 epoch: 70, train_loss: 0.3061, test_loss: 2.1286, test_f1: 0.6063
 epoch: 71, train_loss: 0.2910, test_loss: 2.2500, test_f1: 0.5686
 epoch: 72, train_loss: 0.2904, test_loss: 2.3620, test_f1: 0.6111
 epoch: 73, train_loss: 0.2834, test_loss: 2.3679, test_f1: 0.6230
 epoch: 74, train_loss: 0.3025, test_loss: 2.0585, test_f1: 0.6321
 epoch: 75, train_loss: 0.3001, test_loss: 2.2825, test_f1: 0.6067
 epoch: 76, train_loss: 0.2972, test_loss: 2.2456, test_f1: 0.5997
 epoch: 77, train_loss: 0.2923, test_loss: 2.2526, test_f1: 0.5795
 epoch: 78, train_loss: 0.2661, test_loss: 2.2481, test_f1: 0.6145
 epoch: 79, train_loss: 0.2599, test_loss: 2.2109, test_f1: 0.6345
 epoch: 80, train_loss: 0.2551, test_loss: 2.2566, test_f1: 0.5922
 epoch: 81, train_loss: 0.2695, test_loss: 2.3025, test_f1: 0.5932
 epoch: 82, train_loss: 0.2643, test_loss: 2.2122, test_f1: 0.6433
 epoch: 83, train_loss: 0.3210, test_loss: 2.2649, test_f1: 0.6201
 epoch: 84, train_loss: 0.2963, test_loss: 2.2873, test_f1: 0.6277
 epoch: 85, train_loss: 0.2872, test_loss: 2.4097, test_f1: 0.6038
 epoch: 86, train_loss: 0.2968, test_loss: 2.3293, test_f1: 0.5773
 epoch: 87, train_loss: 0.2896, test_loss: 2.2916, test_f1: 0.5812
 epoch: 88, train_loss: 0.2620, test_loss: 2.3827, test_f1: 0.6129
 epoch: 89, train_loss: 0.2898, test_loss: 2.3461, test_f1: 0.5882
 epoch: 90, train_loss: 0.2790, test_loss: 2.2976, test_f1: 0.6001
 epoch: 91, train_loss: 0.2661, test_loss: 2.3308, test_f1: 0.5996
 epoch: 92, train_loss: 0.2337, test_loss: 2.3557, test_f1: 0.6011
 epoch: 93, train_loss: 0.2469, test_loss: 2.3620, test_f1: 0.5945
 epoch: 94, train_loss: 0.2366, test_loss: 2.2904, test_f1: 0.6153
 epoch: 95, train_loss: 0.2940, test_loss: 2.3652, test_f1: 0.6276
 epoch: 96, train_loss: 0.2588, test_loss: 2.6600, test_f1: 0.5886
 epoch: 97, train_loss: 0.2676, test_loss: 2.5026, test_f1: 0.5966
 epoch: 98, train_loss: 0.2498, test_loss: 2.6865, test_f1: 0.5684
 epoch: 99, train_loss: 0.2851, test_loss: 2.4979, test_f1: 0.5638
##################ITERATION #2 ****************************************
 epoch: 0, train_loss: 1.1971, test_loss: 1.2817, test_f1: 0.2281
 epoch: 1, train_loss: 1.0426, test_loss: 1.2764, test_f1: 0.2281
 epoch: 2, train_loss: 0.9895, test_loss: 1.2598, test_f1: 0.2293
 epoch: 3, train_loss: 0.9549, test_loss: 1.2127, test_f1: 0.3482
 epoch: 4, train_loss: 0.9260, test_loss: 1.1580, test_f1: 0.3705
 epoch: 5, train_loss: 0.8962, test_loss: 1.1192, test_f1: 0.4634
 epoch: 6, train_loss: 0.8847, test_loss: 1.1267, test_f1: 0.5063
 epoch: 7, train_loss: 0.8645, test_loss: 1.1151, test_f1: 0.5148
 epoch: 8, train_loss: 0.8476, test_loss: 1.1430, test_f1: 0.4643
 epoch: 9, train_loss: 0.8261, test_loss: 1.2375, test_f1: 0.4792
 epoch: 10, train_loss: 0.8209, test_loss: 1.2402, test_f1: 0.5204
 epoch: 11, train_loss: 0.8230, test_loss: 1.2332, test_f1: 0.5656
 epoch: 12, train_loss: 0.8079, test_loss: 1.0783, test_f1: 0.5331
 epoch: 13, train_loss: 0.7965, test_loss: 1.1329, test_f1: 0.5593
 epoch: 14, train_loss: 0.7770, test_loss: 1.0621, test_f1: 0.5811
 epoch: 15, train_loss: 0.7533, test_loss: 1.1944, test_f1: 0.5655
 epoch: 16, train_loss: 0.7523, test_loss: 1.1406, test_f1: 0.5981
 epoch: 17, train_loss: 0.7518, test_loss: 1.2144, test_f1: 0.5884
 epoch: 18, train_loss: 0.7420, test_loss: 0.9901, test_f1: 0.5811
 epoch: 19, train_loss: 0.7673, test_loss: 1.0907, test_f1: 0.5853
 epoch: 20, train_loss: 0.7715, test_loss: 1.1561, test_f1: 0.5952
 epoch: 21, train_loss: 0.7921, test_loss: 1.1564, test_f1: 0.5719
 epoch: 22, train_loss: 0.7476, test_loss: 1.2498, test_f1: 0.5224
 epoch: 23, train_loss: 0.7276, test_loss: 1.1469, test_f1: 0.5948
 epoch: 24, train_loss: 0.6990, test_loss: 1.2166, test_f1: 0.6035
 epoch: 25, train_loss: 0.6773, test_loss: 1.2117, test_f1: 0.6162
 epoch: 26, train_loss: 0.6765, test_loss: 1.1892, test_f1: 0.5457
 epoch: 27, train_loss: 0.6648, test_loss: 1.1982, test_f1: 0.5576
 epoch: 28, train_loss: 0.6503, test_loss: 1.2438, test_f1: 0.5859
 epoch: 29, train_loss: 0.6441, test_loss: 1.4253, test_f1: 0.6063
 epoch: 30, train_loss: 0.6365, test_loss: 1.3799, test_f1: 0.5278
 epoch: 31, train_loss: 0.6340, test_loss: 1.7206, test_f1: 0.4933
 epoch: 32, train_loss: 0.6299, test_loss: 1.4911, test_f1: 0.5840
 epoch: 33, train_loss: 0.6170, test_loss: 1.3888, test_f1: 0.6252
 epoch: 34, train_loss: 0.6345, test_loss: 1.3674, test_f1: 0.6256
 epoch: 35, train_loss: 0.6171, test_loss: 1.4550, test_f1: 0.5712
 epoch: 36, train_loss: 0.5913, test_loss: 1.4376, test_f1: 0.5998
 epoch: 37, train_loss: 0.6247, test_loss: 1.5284, test_f1: 0.5668
 epoch: 38, train_loss: 0.6190, test_loss: 1.4038, test_f1: 0.6135
 epoch: 39, train_loss: 0.5746, test_loss: 1.4027, test_f1: 0.6103
 epoch: 40, train_loss: 0.5980, test_loss: 1.4762, test_f1: 0.5575
 epoch: 41, train_loss: 0.5555, test_loss: 1.5732, test_f1: 0.5586
 epoch: 42, train_loss: 0.5530, test_loss: 1.7172, test_f1: 0.6146
 epoch: 43, train_loss: 0.5820, test_loss: 1.7133, test_f1: 0.6177
 epoch: 44, train_loss: 0.5430, test_loss: 1.5658, test_f1: 0.6024
 epoch: 45, train_loss: 0.5648, test_loss: 1.9978, test_f1: 0.5290
 epoch: 46, train_loss: 0.5542, test_loss: 1.5648, test_f1: 0.6047
 epoch: 47, train_loss: 0.5638, test_loss: 1.6663, test_f1: 0.5776
 epoch: 48, train_loss: 0.5395, test_loss: 1.7155, test_f1: 0.5501
 epoch: 49, train_loss: 0.5474, test_loss: 1.7671, test_f1: 0.5906
 epoch: 50, train_loss: 0.5541, test_loss: 1.5883, test_f1: 0.6259
 epoch: 51, train_loss: 0.5444, test_loss: 1.5437, test_f1: 0.6234
 epoch: 52, train_loss: 0.4839, test_loss: 1.5835, test_f1: 0.6118
 epoch: 53, train_loss: 0.4614, test_loss: 1.6238, test_f1: 0.6022
 epoch: 54, train_loss: 0.4505, test_loss: 1.5941, test_f1: 0.6102
 epoch: 55, train_loss: 0.4730, test_loss: 1.6007, test_f1: 0.6227
 epoch: 56, train_loss: 0.4477, test_loss: 1.7472, test_f1: 0.6528
 epoch: 57, train_loss: 0.4252, test_loss: 1.8119, test_f1: 0.6005
 epoch: 58, train_loss: 0.4181, test_loss: 1.8166, test_f1: 0.6388
 epoch: 59, train_loss: 0.4286, test_loss: 1.8494, test_f1: 0.6197
 epoch: 60, train_loss: 0.3945, test_loss: 1.9021, test_f1: 0.5878
 epoch: 61, train_loss: 0.4136, test_loss: 1.9796, test_f1: 0.6068
 epoch: 62, train_loss: 0.3964, test_loss: 2.0284, test_f1: 0.6167
 epoch: 63, train_loss: 0.3744, test_loss: 1.9087, test_f1: 0.6491
 epoch: 64, train_loss: 0.3792, test_loss: 2.0545, test_f1: 0.6235
 epoch: 65, train_loss: 0.3554, test_loss: 2.0265, test_f1: 0.6402
 epoch: 66, train_loss: 0.3668, test_loss: 1.9270, test_f1: 0.6058
 epoch: 67, train_loss: 0.3734, test_loss: 2.1503, test_f1: 0.6040
 epoch: 68, train_loss: 0.3432, test_loss: 2.2288, test_f1: 0.5938
 epoch: 69, train_loss: 0.3708, test_loss: 2.0841, test_f1: 0.6181
 epoch: 70, train_loss: 0.3444, test_loss: 2.2162, test_f1: 0.5809
 epoch: 71, train_loss: 0.3527, test_loss: 2.1417, test_f1: 0.6228
 epoch: 72, train_loss: 0.3536, test_loss: 2.1278, test_f1: 0.6017
 epoch: 73, train_loss: 0.3427, test_loss: 2.1943, test_f1: 0.5832
 epoch: 74, train_loss: 0.3493, test_loss: 2.1767, test_f1: 0.5981
 epoch: 75, train_loss: 0.3447, test_loss: 2.3073, test_f1: 0.5940
 epoch: 76, train_loss: 0.3639, test_loss: 2.4039, test_f1: 0.6207
 epoch: 77, train_loss: 0.3742, test_loss: 2.2053, test_f1: 0.6366
 epoch: 78, train_loss: 0.3465, test_loss: 2.2364, test_f1: 0.5843
 epoch: 79, train_loss: 0.3608, test_loss: 2.1144, test_f1: 0.5775
 epoch: 80, train_loss: 0.3452, test_loss: 2.4089, test_f1: 0.5419
 epoch: 81, train_loss: 0.3362, test_loss: 2.6714, test_f1: 0.5732
 epoch: 82, train_loss: 0.3615, test_loss: 2.5098, test_f1: 0.6048
 epoch: 83, train_loss: 0.3796, test_loss: 2.4139, test_f1: 0.6259
 epoch: 84, train_loss: 0.3773, test_loss: 2.2109, test_f1: 0.6281
 epoch: 85, train_loss: 0.3406, test_loss: 2.1017, test_f1: 0.5985
 epoch: 86, train_loss: 0.3403, test_loss: 2.1310, test_f1: 0.6047
 epoch: 87, train_loss: 0.3455, test_loss: 2.1353, test_f1: 0.6103
 epoch: 88, train_loss: 0.3349, test_loss: 2.1691, test_f1: 0.5913
 epoch: 89, train_loss: 0.3086, test_loss: 2.1677, test_f1: 0.5857
 epoch: 90, train_loss: 0.2770, test_loss: 2.1993, test_f1: 0.5808
 epoch: 91, train_loss: 0.2721, test_loss: 2.2966, test_f1: 0.5831
 epoch: 92, train_loss: 0.2928, test_loss: 2.4102, test_f1: 0.5704
 epoch: 93, train_loss: 0.2827, test_loss: 2.4241, test_f1: 0.5624
 epoch: 94, train_loss: 0.2847, test_loss: 2.4730, test_f1: 0.5509
 epoch: 95, train_loss: 0.2920, test_loss: 2.5720, test_f1: 0.5807
 epoch: 96, train_loss: 0.2628, test_loss: 2.4338, test_f1: 0.5973
 epoch: 97, train_loss: 0.2672, test_loss: 2.5384, test_f1: 0.5781
 epoch: 98, train_loss: 0.2913, test_loss: 2.7743, test_f1: 0.5750
 epoch: 99, train_loss: 0.2540, test_loss: 2.7303, test_f1: 0.5680
##################ITERATION #3 ****************************************
 epoch: 0, train_loss: 1.1910, test_loss: 1.3015, test_f1: 0.1365
 epoch: 1, train_loss: 1.0285, test_loss: 1.2719, test_f1: 0.1419
 epoch: 2, train_loss: 0.9920, test_loss: 1.2408, test_f1: 0.2148
 epoch: 3, train_loss: 0.9537, test_loss: 1.2055, test_f1: 0.2612
 epoch: 4, train_loss: 0.9249, test_loss: 1.2327, test_f1: 0.2553
 epoch: 5, train_loss: 0.9087, test_loss: 1.1747, test_f1: 0.3303
 epoch: 6, train_loss: 0.8899, test_loss: 1.1952, test_f1: 0.3832
 epoch: 7, train_loss: 0.8652, test_loss: 1.1806, test_f1: 0.4227
 epoch: 8, train_loss: 0.8379, test_loss: 1.1745, test_f1: 0.5163
 epoch: 9, train_loss: 0.8121, test_loss: 1.2451, test_f1: 0.4423
 epoch: 10, train_loss: 0.8000, test_loss: 1.1364, test_f1: 0.5552
 epoch: 11, train_loss: 0.7937, test_loss: 1.1200, test_f1: 0.5568
 epoch: 12, train_loss: 0.7815, test_loss: 1.2042, test_f1: 0.5090
 epoch: 13, train_loss: 0.7667, test_loss: 1.1649, test_f1: 0.5447
 epoch: 14, train_loss: 0.7889, test_loss: 1.0626, test_f1: 0.5661
 epoch: 15, train_loss: 0.7455, test_loss: 1.1688, test_f1: 0.5692
 epoch: 16, train_loss: 0.7596, test_loss: 1.2182, test_f1: 0.5509
 epoch: 17, train_loss: 0.7835, test_loss: 1.2112, test_f1: 0.5269
 epoch: 18, train_loss: 0.7702, test_loss: 1.2122, test_f1: 0.5540
 epoch: 19, train_loss: 0.7273, test_loss: 1.0930, test_f1: 0.5822
 epoch: 20, train_loss: 0.7172, test_loss: 1.1341, test_f1: 0.5565
 epoch: 21, train_loss: 0.6855, test_loss: 1.2567, test_f1: 0.5927
 epoch: 22, train_loss: 0.6815, test_loss: 1.1818, test_f1: 0.5962
 epoch: 23, train_loss: 0.6482, test_loss: 1.1657, test_f1: 0.5944
 epoch: 24, train_loss: 0.6211, test_loss: 1.2512, test_f1: 0.6265
 epoch: 25, train_loss: 0.6412, test_loss: 1.3843, test_f1: 0.5386
 epoch: 26, train_loss: 0.6313, test_loss: 1.3802, test_f1: 0.5802
 epoch: 27, train_loss: 0.6357, test_loss: 1.2751, test_f1: 0.6040
 epoch: 28, train_loss: 0.6005, test_loss: 1.3337, test_f1: 0.5354
 epoch: 29, train_loss: 0.5933, test_loss: 1.5810, test_f1: 0.5756
 epoch: 30, train_loss: 0.6066, test_loss: 1.4206, test_f1: 0.5788
 epoch: 31, train_loss: 0.6535, test_loss: 1.4367, test_f1: 0.5691
 epoch: 32, train_loss: 0.6495, test_loss: 1.4668, test_f1: 0.5284
 epoch: 33, train_loss: 0.6603, test_loss: 1.3187, test_f1: 0.5747
 epoch: 34, train_loss: 0.6059, test_loss: 1.5472, test_f1: 0.5201
 epoch: 35, train_loss: 0.5930, test_loss: 1.4876, test_f1: 0.5423
 epoch: 36, train_loss: 0.5547, test_loss: 1.4762, test_f1: 0.5782
 epoch: 37, train_loss: 0.5350, test_loss: 1.3628, test_f1: 0.5809
 epoch: 38, train_loss: 0.5436, test_loss: 1.3419, test_f1: 0.6085
 epoch: 39, train_loss: 0.5164, test_loss: 1.4084, test_f1: 0.5588
 epoch: 40, train_loss: 0.5034, test_loss: 1.4783, test_f1: 0.6140
 epoch: 41, train_loss: 0.4726, test_loss: 1.6482, test_f1: 0.5861
 epoch: 42, train_loss: 0.5184, test_loss: 1.6630, test_f1: 0.5710
 epoch: 43, train_loss: 0.5484, test_loss: 1.6588, test_f1: 0.5865
 epoch: 44, train_loss: 0.5093, test_loss: 1.5804, test_f1: 0.6005
 epoch: 45, train_loss: 0.4997, test_loss: 1.7634, test_f1: 0.5524
 epoch: 46, train_loss: 0.5109, test_loss: 1.5919, test_f1: 0.5668
 epoch: 47, train_loss: 0.4853, test_loss: 1.5660, test_f1: 0.5645
 epoch: 48, train_loss: 0.4837, test_loss: 1.6573, test_f1: 0.5758
 epoch: 49, train_loss: 0.4904, test_loss: 1.6969, test_f1: 0.5741
 epoch: 50, train_loss: 0.4515, test_loss: 1.7614, test_f1: 0.5635
 epoch: 51, train_loss: 0.4632, test_loss: 1.7809, test_f1: 0.5608
 epoch: 52, train_loss: 0.4237, test_loss: 1.8200, test_f1: 0.5528
 epoch: 53, train_loss: 0.4137, test_loss: 1.8300, test_f1: 0.5872
 epoch: 54, train_loss: 0.4061, test_loss: 1.7755, test_f1: 0.5775
 epoch: 55, train_loss: 0.3973, test_loss: 1.7832, test_f1: 0.5760
 epoch: 56, train_loss: 0.3783, test_loss: 1.8672, test_f1: 0.5569
 epoch: 57, train_loss: 0.3761, test_loss: 1.7606, test_f1: 0.5769
 epoch: 58, train_loss: 0.3618, test_loss: 1.8747, test_f1: 0.5838
 epoch: 59, train_loss: 0.3643, test_loss: 1.8163, test_f1: 0.5953
 epoch: 60, train_loss: 0.3578, test_loss: 1.8444, test_f1: 0.5989
 epoch: 61, train_loss: 0.3460, test_loss: 1.9807, test_f1: 0.5748
 epoch: 62, train_loss: 0.3286, test_loss: 2.1472, test_f1: 0.5458
 epoch: 63, train_loss: 0.3259, test_loss: 2.1104, test_f1: 0.5551
 epoch: 64, train_loss: 0.3072, test_loss: 2.0262, test_f1: 0.5983
 epoch: 65, train_loss: 0.3255, test_loss: 2.1856, test_f1: 0.5695
 epoch: 66, train_loss: 0.3509, test_loss: 2.2649, test_f1: 0.5651
 epoch: 67, train_loss: 0.3464, test_loss: 2.2982, test_f1: 0.5769
 epoch: 68, train_loss: 0.3181, test_loss: 2.3147, test_f1: 0.5997
 epoch: 69, train_loss: 0.3527, test_loss: 2.2128, test_f1: 0.5900
 epoch: 70, train_loss: 0.3344, test_loss: 2.1451, test_f1: 0.5811
 epoch: 71, train_loss: 0.3400, test_loss: 2.1817, test_f1: 0.5843
 epoch: 72, train_loss: 0.3034, test_loss: 2.2173, test_f1: 0.6085
 epoch: 73, train_loss: 0.2970, test_loss: 2.3386, test_f1: 0.5700
 epoch: 74, train_loss: 0.3155, test_loss: 2.3596, test_f1: 0.6011
 epoch: 75, train_loss: 0.3387, test_loss: 2.3384, test_f1: 0.5978
 epoch: 76, train_loss: 0.3116, test_loss: 2.2466, test_f1: 0.6062
 epoch: 77, train_loss: 0.2967, test_loss: 2.2568, test_f1: 0.6016
 epoch: 78, train_loss: 0.2978, test_loss: 2.3285, test_f1: 0.5660
 epoch: 79, train_loss: 0.2868, test_loss: 2.4518, test_f1: 0.5703
 epoch: 80, train_loss: 0.2815, test_loss: 2.4496, test_f1: 0.5923
 epoch: 81, train_loss: 0.2693, test_loss: 2.5305, test_f1: 0.5766
 epoch: 82, train_loss: 0.2859, test_loss: 2.5599, test_f1: 0.5908
 epoch: 83, train_loss: 0.2479, test_loss: 2.5239, test_f1: 0.5780
 epoch: 84, train_loss: 0.2571, test_loss: 2.6589, test_f1: 0.5715
 epoch: 85, train_loss: 0.2500, test_loss: 2.4975, test_f1: 0.6062
 epoch: 86, train_loss: 0.2583, test_loss: 2.5440, test_f1: 0.5733
 epoch: 87, train_loss: 0.2672, test_loss: 2.4423, test_f1: 0.5851
 epoch: 88, train_loss: 0.2825, test_loss: 2.6454, test_f1: 0.5628
 epoch: 89, train_loss: 0.2732, test_loss: 2.6787, test_f1: 0.5727
 epoch: 90, train_loss: 0.2839, test_loss: 2.7274, test_f1: 0.5575
 epoch: 91, train_loss: 0.3102, test_loss: 2.3961, test_f1: 0.5909
 epoch: 92, train_loss: 0.2937, test_loss: 2.4445, test_f1: 0.5952
 epoch: 93, train_loss: 0.2791, test_loss: 2.6167, test_f1: 0.6078
 epoch: 94, train_loss: 0.2535, test_loss: 2.6013, test_f1: 0.5970
 epoch: 95, train_loss: 0.2656, test_loss: 2.6251, test_f1: 0.6161
 epoch: 96, train_loss: 0.2453, test_loss: 2.7389, test_f1: 0.6031
 epoch: 97, train_loss: 0.2418, test_loss: 2.4799, test_f1: 0.6052
 epoch: 98, train_loss: 0.2499, test_loss: 2.5048, test_f1: 0.6085
 epoch: 99, train_loss: 0.2562, test_loss: 2.4928, test_f1: 0.5871
##################ITERATION #4 ****************************************
 epoch: 0, train_loss: 1.2101, test_loss: 1.3120, test_f1: 0.1365
 epoch: 1, train_loss: 1.0649, test_loss: 1.2784, test_f1: 0.3358
 epoch: 2, train_loss: 1.0039, test_loss: 1.2412, test_f1: 0.3336
 epoch: 3, train_loss: 0.9793, test_loss: 1.2047, test_f1: 0.4303
 epoch: 4, train_loss: 0.9546, test_loss: 1.1659, test_f1: 0.5179
 epoch: 5, train_loss: 0.9216, test_loss: 1.1123, test_f1: 0.4922
 epoch: 6, train_loss: 0.8915, test_loss: 1.0952, test_f1: 0.4874
 epoch: 7, train_loss: 0.8751, test_loss: 1.0362, test_f1: 0.5047
 epoch: 8, train_loss: 0.8533, test_loss: 1.0172, test_f1: 0.5305
 epoch: 9, train_loss: 0.8567, test_loss: 1.0441, test_f1: 0.5571
 epoch: 10, train_loss: 0.8372, test_loss: 1.0138, test_f1: 0.5885
 epoch: 11, train_loss: 0.8297, test_loss: 1.0668, test_f1: 0.5329
 epoch: 12, train_loss: 0.8071, test_loss: 1.0852, test_f1: 0.5493
 epoch: 13, train_loss: 0.8015, test_loss: 1.1648, test_f1: 0.5599
 epoch: 14, train_loss: 0.7764, test_loss: 1.0255, test_f1: 0.5975
 epoch: 15, train_loss: 0.7777, test_loss: 1.1352, test_f1: 0.5782
 epoch: 16, train_loss: 0.7736, test_loss: 1.0552, test_f1: 0.5781
 epoch: 17, train_loss: 0.7927, test_loss: 1.0821, test_f1: 0.5213
 epoch: 18, train_loss: 0.7702, test_loss: 1.2107, test_f1: 0.5224
 epoch: 19, train_loss: 0.7580, test_loss: 1.2994, test_f1: 0.4985
 epoch: 20, train_loss: 0.7054, test_loss: 1.1325, test_f1: 0.6092
 epoch: 21, train_loss: 0.7094, test_loss: 1.2476, test_f1: 0.6217
 epoch: 22, train_loss: 0.7053, test_loss: 1.2982, test_f1: 0.5672
 epoch: 23, train_loss: 0.6863, test_loss: 1.2378, test_f1: 0.5661
 epoch: 24, train_loss: 0.6878, test_loss: 1.1922, test_f1: 0.5555
 epoch: 25, train_loss: 0.7019, test_loss: 1.1631, test_f1: 0.5835
 epoch: 26, train_loss: 0.6770, test_loss: 1.1749, test_f1: 0.5788
 epoch: 27, train_loss: 0.6771, test_loss: 1.3057, test_f1: 0.5785
 epoch: 28, train_loss: 0.6625, test_loss: 1.3634, test_f1: 0.5472
 epoch: 29, train_loss: 0.6496, test_loss: 1.3673, test_f1: 0.5283
 epoch: 30, train_loss: 0.6623, test_loss: 1.3268, test_f1: 0.5399
 epoch: 31, train_loss: 0.6418, test_loss: 1.1726, test_f1: 0.6110
 epoch: 32, train_loss: 0.6457, test_loss: 1.2578, test_f1: 0.5817
 epoch: 33, train_loss: 0.6282, test_loss: 1.2069, test_f1: 0.5952
 epoch: 34, train_loss: 0.6342, test_loss: 1.2487, test_f1: 0.5989
 epoch: 35, train_loss: 0.6133, test_loss: 1.2634, test_f1: 0.6111
 epoch: 36, train_loss: 0.6006, test_loss: 1.4592, test_f1: 0.5481
 epoch: 37, train_loss: 0.5585, test_loss: 1.4089, test_f1: 0.5844
 epoch: 38, train_loss: 0.5488, test_loss: 1.4843, test_f1: 0.6053
 epoch: 39, train_loss: 0.5709, test_loss: 1.5354, test_f1: 0.5903
 epoch: 40, train_loss: 0.5541, test_loss: 1.3898, test_f1: 0.5893
 epoch: 41, train_loss: 0.5511, test_loss: 1.4175, test_f1: 0.5777
 epoch: 42, train_loss: 0.5038, test_loss: 1.5049, test_f1: 0.5983
 epoch: 43, train_loss: 0.5232, test_loss: 1.5305, test_f1: 0.6106
 epoch: 44, train_loss: 0.4920, test_loss: 1.6931, test_f1: 0.6093
 epoch: 45, train_loss: 0.5142, test_loss: 1.8276, test_f1: 0.5727
 epoch: 46, train_loss: 0.5277, test_loss: 1.6197, test_f1: 0.5934
 epoch: 47, train_loss: 0.5356, test_loss: 1.5753, test_f1: 0.5687
 epoch: 48, train_loss: 0.4841, test_loss: 1.5412, test_f1: 0.6065
 epoch: 49, train_loss: 0.4769, test_loss: 1.7420, test_f1: 0.5644
 epoch: 50, train_loss: 0.4472, test_loss: 1.6011, test_f1: 0.6372
 epoch: 51, train_loss: 0.4325, test_loss: 1.7027, test_f1: 0.5921
 epoch: 52, train_loss: 0.4405, test_loss: 1.7813, test_f1: 0.5995
 epoch: 53, train_loss: 0.4177, test_loss: 2.0634, test_f1: 0.5518
 epoch: 54, train_loss: 0.4169, test_loss: 1.9056, test_f1: 0.5847
 epoch: 55, train_loss: 0.4271, test_loss: 1.8973, test_f1: 0.6034
 epoch: 56, train_loss: 0.4209, test_loss: 2.0017, test_f1: 0.5899
 epoch: 57, train_loss: 0.4002, test_loss: 2.0883, test_f1: 0.5596
 epoch: 58, train_loss: 0.4041, test_loss: 2.2687, test_f1: 0.5696
 epoch: 59, train_loss: 0.3676, test_loss: 2.1460, test_f1: 0.5785
 epoch: 60, train_loss: 0.3857, test_loss: 1.9624, test_f1: 0.6195
 epoch: 61, train_loss: 0.3779, test_loss: 1.8507, test_f1: 0.6017
 epoch: 62, train_loss: 0.3466, test_loss: 1.9954, test_f1: 0.5792
 epoch: 63, train_loss: 0.3498, test_loss: 1.8191, test_f1: 0.6171
 epoch: 64, train_loss: 0.3530, test_loss: 2.0705, test_f1: 0.5762
 epoch: 65, train_loss: 0.3260, test_loss: 2.0437, test_f1: 0.5738
 epoch: 66, train_loss: 0.3388, test_loss: 1.9730, test_f1: 0.6271
 epoch: 67, train_loss: 0.3338, test_loss: 2.3231, test_f1: 0.5767
 epoch: 68, train_loss: 0.3576, test_loss: 2.3502, test_f1: 0.5616
 epoch: 69, train_loss: 0.3427, test_loss: 2.3276, test_f1: 0.5627
 epoch: 70, train_loss: 0.3667, test_loss: 2.2848, test_f1: 0.5458
 epoch: 71, train_loss: 0.3854, test_loss: 2.3534, test_f1: 0.5581
 epoch: 72, train_loss: 0.3401, test_loss: 2.1531, test_f1: 0.6187
 epoch: 73, train_loss: 0.3154, test_loss: 2.1178, test_f1: 0.6168
 epoch: 74, train_loss: 0.3219, test_loss: 2.1891, test_f1: 0.6144
 epoch: 75, train_loss: 0.2910, test_loss: 2.1040, test_f1: 0.5692
 epoch: 76, train_loss: 0.2899, test_loss: 2.2631, test_f1: 0.5879
 epoch: 77, train_loss: 0.2939, test_loss: 2.5698, test_f1: 0.5505
 epoch: 78, train_loss: 0.2967, test_loss: 2.7574, test_f1: 0.5523
 epoch: 79, train_loss: 0.2917, test_loss: 2.6163, test_f1: 0.5585
 epoch: 80, train_loss: 0.3026, test_loss: 2.2577, test_f1: 0.6116
 epoch: 81, train_loss: 0.2997, test_loss: 2.4127, test_f1: 0.6065
 epoch: 82, train_loss: 0.3006, test_loss: 2.5621, test_f1: 0.5941
 epoch: 83, train_loss: 0.2933, test_loss: 2.5907, test_f1: 0.6107
 epoch: 84, train_loss: 0.2901, test_loss: 2.5649, test_f1: 0.5960
 epoch: 85, train_loss: 0.2951, test_loss: 2.5499, test_f1: 0.5602
 epoch: 86, train_loss: 0.2759, test_loss: 2.6211, test_f1: 0.5984
 epoch: 87, train_loss: 0.2608, test_loss: 2.7446, test_f1: 0.5965
 epoch: 88, train_loss: 0.2499, test_loss: 2.5379, test_f1: 0.5895
 epoch: 89, train_loss: 0.2565, test_loss: 2.4731, test_f1: 0.5890
 epoch: 90, train_loss: 0.2730, test_loss: 2.5941, test_f1: 0.6268
 epoch: 91, train_loss: 0.2897, test_loss: 2.6426, test_f1: 0.6020
 epoch: 92, train_loss: 0.2884, test_loss: 2.4280, test_f1: 0.6320
 epoch: 93, train_loss: 0.3192, test_loss: 2.2788, test_f1: 0.6351
 epoch: 94, train_loss: 0.2761, test_loss: 2.5530, test_f1: 0.5869
 epoch: 95, train_loss: 0.2521, test_loss: 2.8679, test_f1: 0.5712
 epoch: 96, train_loss: 0.2476, test_loss: 2.6636, test_f1: 0.5732
 epoch: 97, train_loss: 0.2426, test_loss: 2.9966, test_f1: 0.5666
 epoch: 98, train_loss: 0.2812, test_loss: 3.1310, test_f1: 0.5993
 epoch: 99, train_loss: 0.2767, test_loss: 2.9248, test_f1: 0.5700
##################ITERATION #5 ****************************************
 epoch: 0, train_loss: 1.1996, test_loss: 1.2830, test_f1: 0.1365
 epoch: 1, train_loss: 1.0795, test_loss: 1.2751, test_f1: 0.2106
 epoch: 2, train_loss: 1.0135, test_loss: 1.2372, test_f1: 0.3270
 epoch: 3, train_loss: 0.9520, test_loss: 1.1857, test_f1: 0.4238
 epoch: 4, train_loss: 0.9444, test_loss: 1.1539, test_f1: 0.4479
 epoch: 5, train_loss: 0.9129, test_loss: 1.1409, test_f1: 0.4668
 epoch: 6, train_loss: 0.9007, test_loss: 1.1192, test_f1: 0.4429
 epoch: 7, train_loss: 0.8706, test_loss: 1.1142, test_f1: 0.5221
 epoch: 8, train_loss: 0.8695, test_loss: 1.0465, test_f1: 0.5197
 epoch: 9, train_loss: 0.8360, test_loss: 1.0311, test_f1: 0.5512
 epoch: 10, train_loss: 0.8290, test_loss: 1.1151, test_f1: 0.5590
 epoch: 11, train_loss: 0.8183, test_loss: 1.1198, test_f1: 0.5355
 epoch: 12, train_loss: 0.8380, test_loss: 1.0765, test_f1: 0.5838
 epoch: 13, train_loss: 0.8290, test_loss: 1.0929, test_f1: 0.5601
 epoch: 14, train_loss: 0.7991, test_loss: 1.0489, test_f1: 0.5579
 epoch: 15, train_loss: 0.7963, test_loss: 1.0313, test_f1: 0.6011
 epoch: 16, train_loss: 0.8012, test_loss: 1.1194, test_f1: 0.6118
 epoch: 17, train_loss: 0.7687, test_loss: 1.0664, test_f1: 0.5888
 epoch: 18, train_loss: 0.7477, test_loss: 1.0973, test_f1: 0.5693
 epoch: 19, train_loss: 0.7331, test_loss: 1.0827, test_f1: 0.5875
 epoch: 20, train_loss: 0.7262, test_loss: 1.0564, test_f1: 0.6240
 epoch: 21, train_loss: 0.7125, test_loss: 1.0602, test_f1: 0.6138
 epoch: 22, train_loss: 0.6961, test_loss: 1.1737, test_f1: 0.5696
 epoch: 23, train_loss: 0.6955, test_loss: 1.1309, test_f1: 0.5781
 epoch: 24, train_loss: 0.6838, test_loss: 1.1438, test_f1: 0.5864
 epoch: 25, train_loss: 0.6906, test_loss: 1.1828, test_f1: 0.5692
 epoch: 26, train_loss: 0.6876, test_loss: 1.1440, test_f1: 0.5936
 epoch: 27, train_loss: 0.6972, test_loss: 1.1763, test_f1: 0.5914
 epoch: 28, train_loss: 0.6771, test_loss: 1.0640, test_f1: 0.6145
 epoch: 29, train_loss: 0.6495, test_loss: 1.1789, test_f1: 0.5982
 epoch: 30, train_loss: 0.6568, test_loss: 1.1857, test_f1: 0.5521
 epoch: 31, train_loss: 0.6344, test_loss: 1.1200, test_f1: 0.6173
 epoch: 32, train_loss: 0.6406, test_loss: 1.3861, test_f1: 0.5588
 epoch: 33, train_loss: 0.6364, test_loss: 1.1458, test_f1: 0.6285
 epoch: 34, train_loss: 0.6493, test_loss: 1.3357, test_f1: 0.5843
 epoch: 35, train_loss: 0.6287, test_loss: 1.2901, test_f1: 0.6055
 epoch: 36, train_loss: 0.6043, test_loss: 1.2933, test_f1: 0.6028
 epoch: 37, train_loss: 0.5956, test_loss: 1.3070, test_f1: 0.6020
 epoch: 38, train_loss: 0.5735, test_loss: 1.4330, test_f1: 0.5870
 epoch: 39, train_loss: 0.5837, test_loss: 1.5723, test_f1: 0.4922
 epoch: 40, train_loss: 0.5782, test_loss: 1.4144, test_f1: 0.5590
 epoch: 41, train_loss: 0.5855, test_loss: 1.3763, test_f1: 0.5720
 epoch: 42, train_loss: 0.5842, test_loss: 1.4280, test_f1: 0.5879
 epoch: 43, train_loss: 0.5584, test_loss: 1.4025, test_f1: 0.5852
 epoch: 44, train_loss: 0.5471, test_loss: 1.5141, test_f1: 0.5260
 epoch: 45, train_loss: 0.5573, test_loss: 1.6173, test_f1: 0.5071
 epoch: 46, train_loss: 0.5337, test_loss: 1.5938, test_f1: 0.5440
 epoch: 47, train_loss: 0.5090, test_loss: 1.3879, test_f1: 0.6349
 epoch: 48, train_loss: 0.5121, test_loss: 1.3879, test_f1: 0.6299
 epoch: 49, train_loss: 0.4968, test_loss: 1.5425, test_f1: 0.5976
 epoch: 50, train_loss: 0.5080, test_loss: 1.5903, test_f1: 0.5812
 epoch: 51, train_loss: 0.4558, test_loss: 1.5296, test_f1: 0.5981
 epoch: 52, train_loss: 0.4472, test_loss: 1.5528, test_f1: 0.6119
 epoch: 53, train_loss: 0.4166, test_loss: 1.5755, test_f1: 0.6111
 epoch: 54, train_loss: 0.4111, test_loss: 1.6484, test_f1: 0.5913
 epoch: 55, train_loss: 0.4287, test_loss: 1.5253, test_f1: 0.6099
 epoch: 56, train_loss: 0.3914, test_loss: 1.6061, test_f1: 0.6147
 epoch: 57, train_loss: 0.4047, test_loss: 1.6753, test_f1: 0.6094
 epoch: 58, train_loss: 0.3788, test_loss: 1.6609, test_f1: 0.6037
 epoch: 59, train_loss: 0.3752, test_loss: 1.6939, test_f1: 0.6136
 epoch: 60, train_loss: 0.3767, test_loss: 1.7392, test_f1: 0.6063
 epoch: 61, train_loss: 0.4262, test_loss: 1.6048, test_f1: 0.5994
 epoch: 62, train_loss: 0.3947, test_loss: 1.7159, test_f1: 0.5924
 epoch: 63, train_loss: 0.3778, test_loss: 1.7153, test_f1: 0.6108
 epoch: 64, train_loss: 0.3719, test_loss: 1.6774, test_f1: 0.6099
 epoch: 65, train_loss: 0.3787, test_loss: 1.9249, test_f1: 0.6012
 epoch: 66, train_loss: 0.4197, test_loss: 1.9391, test_f1: 0.5877
 epoch: 67, train_loss: 0.3924, test_loss: 1.7408, test_f1: 0.5813
 epoch: 68, train_loss: 0.3705, test_loss: 1.6169, test_f1: 0.6281
 epoch: 69, train_loss: 0.3511, test_loss: 1.8715, test_f1: 0.6041
 epoch: 70, train_loss: 0.3775, test_loss: 2.0197, test_f1: 0.5886
 epoch: 71, train_loss: 0.3553, test_loss: 1.9704, test_f1: 0.6255
 epoch: 72, train_loss: 0.3815, test_loss: 1.9387, test_f1: 0.6360
 epoch: 73, train_loss: 0.3840, test_loss: 1.8647, test_f1: 0.6061
 epoch: 74, train_loss: 0.3837, test_loss: 1.9441, test_f1: 0.5733
 epoch: 75, train_loss: 0.3747, test_loss: 1.7831, test_f1: 0.6022
 epoch: 76, train_loss: 0.3711, test_loss: 1.9118, test_f1: 0.5671
 epoch: 77, train_loss: 0.3444, test_loss: 1.8912, test_f1: 0.6091
 epoch: 78, train_loss: 0.3393, test_loss: 2.0850, test_f1: 0.6163
 epoch: 79, train_loss: 0.3491, test_loss: 2.1154, test_f1: 0.5947
 epoch: 80, train_loss: 0.3225, test_loss: 2.0775, test_f1: 0.5904
 epoch: 81, train_loss: 0.3111, test_loss: 2.0585, test_f1: 0.6114
 epoch: 82, train_loss: 0.3458, test_loss: 2.2216, test_f1: 0.5695
 epoch: 83, train_loss: 0.3188, test_loss: 1.9858, test_f1: 0.5805
 epoch: 84, train_loss: 0.2988, test_loss: 1.8908, test_f1: 0.5827
 epoch: 85, train_loss: 0.2912, test_loss: 2.0229, test_f1: 0.5712
 epoch: 86, train_loss: 0.3061, test_loss: 2.1110, test_f1: 0.5876
 epoch: 87, train_loss: 0.2747, test_loss: 2.2883, test_f1: 0.5715
 epoch: 88, train_loss: 0.3022, test_loss: 2.1693, test_f1: 0.5967
 epoch: 89, train_loss: 0.2990, test_loss: 2.1232, test_f1: 0.6151
 epoch: 90, train_loss: 0.3010, test_loss: 2.1213, test_f1: 0.6178
 epoch: 91, train_loss: 0.2826, test_loss: 2.2050, test_f1: 0.6249
 epoch: 92, train_loss: 0.2734, test_loss: 2.2259, test_f1: 0.5925
 epoch: 93, train_loss: 0.3038, test_loss: 2.2743, test_f1: 0.5925
 epoch: 94, train_loss: 0.2886, test_loss: 2.2487, test_f1: 0.5860
 epoch: 95, train_loss: 0.2831, test_loss: 2.1148, test_f1: 0.6082
 epoch: 96, train_loss: 0.2618, test_loss: 2.2070, test_f1: 0.6154
 epoch: 97, train_loss: 0.2736, test_loss: 2.3331, test_f1: 0.5991
 epoch: 98, train_loss: 0.3169, test_loss: 2.4586, test_f1: 0.5754
 epoch: 99, train_loss: 0.2959, test_loss: 2.2183, test_f1: 0.6115
##################ITERATION #6 ****************************************
 epoch: 0, train_loss: 1.2214, test_loss: 1.3046, test_f1: 0.1365
 epoch: 1, train_loss: 1.0609, test_loss: 1.2840, test_f1: 0.1368
 epoch: 2, train_loss: 1.0008, test_loss: 1.2573, test_f1: 0.2648
 epoch: 3, train_loss: 0.9747, test_loss: 1.2292, test_f1: 0.2832
 epoch: 4, train_loss: 0.9507, test_loss: 1.2479, test_f1: 0.2452
 epoch: 5, train_loss: 0.9267, test_loss: 1.2146, test_f1: 0.3107
 epoch: 6, train_loss: 0.8919, test_loss: 1.1753, test_f1: 0.3137
 epoch: 7, train_loss: 0.8769, test_loss: 1.1459, test_f1: 0.4322
 epoch: 8, train_loss: 0.8566, test_loss: 1.0821, test_f1: 0.5093
 epoch: 9, train_loss: 0.8491, test_loss: 1.1229, test_f1: 0.4757
 epoch: 10, train_loss: 0.8317, test_loss: 1.1017, test_f1: 0.5107
 epoch: 11, train_loss: 0.8195, test_loss: 1.1215, test_f1: 0.5489
 epoch: 12, train_loss: 0.7916, test_loss: 1.1319, test_f1: 0.5590
 epoch: 13, train_loss: 0.8072, test_loss: 1.1039, test_f1: 0.5717
 epoch: 14, train_loss: 0.7995, test_loss: 1.0870, test_f1: 0.5721
 epoch: 15, train_loss: 0.8191, test_loss: 1.1796, test_f1: 0.5419
 epoch: 16, train_loss: 0.8002, test_loss: 1.0627, test_f1: 0.5593
 epoch: 17, train_loss: 0.7961, test_loss: 1.1395, test_f1: 0.5363
 epoch: 18, train_loss: 0.7670, test_loss: 1.1234, test_f1: 0.5745
 epoch: 19, train_loss: 0.7582, test_loss: 1.1993, test_f1: 0.5693
 epoch: 20, train_loss: 0.7516, test_loss: 1.1297, test_f1: 0.5402
 epoch: 21, train_loss: 0.7543, test_loss: 1.0089, test_f1: 0.6057
 epoch: 22, train_loss: 0.7103, test_loss: 1.0925, test_f1: 0.5974
 epoch: 23, train_loss: 0.6985, test_loss: 1.0262, test_f1: 0.6091
 epoch: 24, train_loss: 0.7063, test_loss: 1.0521, test_f1: 0.5898
 epoch: 25, train_loss: 0.7076, test_loss: 1.0770, test_f1: 0.5963
 epoch: 26, train_loss: 0.7039, test_loss: 1.2548, test_f1: 0.5892
 epoch: 27, train_loss: 0.6827, test_loss: 1.1268, test_f1: 0.5987
 epoch: 28, train_loss: 0.6802, test_loss: 1.0938, test_f1: 0.5948
 epoch: 29, train_loss: 0.6576, test_loss: 1.2628, test_f1: 0.5712
 epoch: 30, train_loss: 0.6418, test_loss: 1.1433, test_f1: 0.6199
 epoch: 31, train_loss: 0.6386, test_loss: 1.2164, test_f1: 0.5765
 epoch: 32, train_loss: 0.6724, test_loss: 1.1328, test_f1: 0.6322
 epoch: 33, train_loss: 0.6391, test_loss: 1.1976, test_f1: 0.5680
 epoch: 34, train_loss: 0.6463, test_loss: 1.2093, test_f1: 0.5852
 epoch: 35, train_loss: 0.6189, test_loss: 1.2537, test_f1: 0.5659
 epoch: 36, train_loss: 0.5990, test_loss: 1.3369, test_f1: 0.5869
 epoch: 37, train_loss: 0.5997, test_loss: 1.2877, test_f1: 0.6089
 epoch: 38, train_loss: 0.5984, test_loss: 1.2476, test_f1: 0.5936
 epoch: 39, train_loss: 0.6206, test_loss: 1.4065, test_f1: 0.5725
 epoch: 40, train_loss: 0.6074, test_loss: 1.5119, test_f1: 0.5585
 epoch: 41, train_loss: 0.6219, test_loss: 1.3799, test_f1: 0.5635
 epoch: 42, train_loss: 0.5737, test_loss: 1.4321, test_f1: 0.5502
 epoch: 43, train_loss: 0.6009, test_loss: 1.4202, test_f1: 0.4826
 epoch: 44, train_loss: 0.5855, test_loss: 1.4336, test_f1: 0.5980
 epoch: 45, train_loss: 0.5742, test_loss: 1.3898, test_f1: 0.5752
 epoch: 46, train_loss: 0.5566, test_loss: 1.2986, test_f1: 0.6117
 epoch: 47, train_loss: 0.5272, test_loss: 1.3938, test_f1: 0.6190
 epoch: 48, train_loss: 0.5087, test_loss: 1.4118, test_f1: 0.5720
 epoch: 49, train_loss: 0.5122, test_loss: 1.3947, test_f1: 0.5720
 epoch: 50, train_loss: 0.5548, test_loss: 1.5365, test_f1: 0.5848
 epoch: 51, train_loss: 0.5046, test_loss: 1.5344, test_f1: 0.5938
 epoch: 52, train_loss: 0.4689, test_loss: 1.5331, test_f1: 0.5794
 epoch: 53, train_loss: 0.4565, test_loss: 1.5090, test_f1: 0.5860
 epoch: 54, train_loss: 0.4292, test_loss: 1.4932, test_f1: 0.6011
 epoch: 55, train_loss: 0.4529, test_loss: 1.5427, test_f1: 0.5667
 epoch: 56, train_loss: 0.4203, test_loss: 1.4987, test_f1: 0.5653
 epoch: 57, train_loss: 0.4257, test_loss: 1.5421, test_f1: 0.5656
 epoch: 58, train_loss: 0.4419, test_loss: 1.4731, test_f1: 0.5828
 epoch: 59, train_loss: 0.4110, test_loss: 1.5082, test_f1: 0.5871
 epoch: 60, train_loss: 0.4252, test_loss: 1.5462, test_f1: 0.5791
 epoch: 61, train_loss: 0.4036, test_loss: 1.5507, test_f1: 0.5790
 epoch: 62, train_loss: 0.3876, test_loss: 1.6707, test_f1: 0.5676
 epoch: 63, train_loss: 0.3822, test_loss: 1.6243, test_f1: 0.5919
 epoch: 64, train_loss: 0.3965, test_loss: 1.7227, test_f1: 0.5522
 epoch: 65, train_loss: 0.4103, test_loss: 1.7890, test_f1: 0.5630
 epoch: 66, train_loss: 0.4117, test_loss: 1.8887, test_f1: 0.5536
 epoch: 67, train_loss: 0.4161, test_loss: 1.6562, test_f1: 0.6021
 epoch: 68, train_loss: 0.3764, test_loss: 1.5936, test_f1: 0.6158
 epoch: 69, train_loss: 0.3867, test_loss: 1.7218, test_f1: 0.5904
 epoch: 70, train_loss: 0.3836, test_loss: 1.7537, test_f1: 0.5576
 epoch: 71, train_loss: 0.3878, test_loss: 1.8560, test_f1: 0.5915
 epoch: 72, train_loss: 0.3739, test_loss: 1.8447, test_f1: 0.5879
 epoch: 73, train_loss: 0.3618, test_loss: 1.8161, test_f1: 0.5943
 epoch: 74, train_loss: 0.3619, test_loss: 1.7903, test_f1: 0.5808
 epoch: 75, train_loss: 0.3700, test_loss: 1.8031, test_f1: 0.5352
 epoch: 76, train_loss: 0.3663, test_loss: 1.8872, test_f1: 0.5775
 epoch: 77, train_loss: 0.3497, test_loss: 1.9498, test_f1: 0.5729
 epoch: 78, train_loss: 0.3487, test_loss: 2.1184, test_f1: 0.5603
 epoch: 79, train_loss: 0.3437, test_loss: 1.9346, test_f1: 0.5845
 epoch: 80, train_loss: 0.3480, test_loss: 1.8073, test_f1: 0.6042
 epoch: 81, train_loss: 0.3341, test_loss: 1.8832, test_f1: 0.5663
 epoch: 82, train_loss: 0.3514, test_loss: 1.8008, test_f1: 0.5920
 epoch: 83, train_loss: 0.3516, test_loss: 2.1604, test_f1: 0.5304
 epoch: 84, train_loss: 0.3752, test_loss: 2.1572, test_f1: 0.5703
 epoch: 85, train_loss: 0.3388, test_loss: 1.9961, test_f1: 0.6038
 epoch: 86, train_loss: 0.3287, test_loss: 1.9456, test_f1: 0.6128
 epoch: 87, train_loss: 0.3311, test_loss: 2.1572, test_f1: 0.5749
 epoch: 88, train_loss: 0.3128, test_loss: 1.9769, test_f1: 0.5835
 epoch: 89, train_loss: 0.3002, test_loss: 2.0846, test_f1: 0.5660
 epoch: 90, train_loss: 0.3361, test_loss: 2.0040, test_f1: 0.5631
 epoch: 91, train_loss: 0.2969, test_loss: 2.0435, test_f1: 0.5720
 epoch: 92, train_loss: 0.3317, test_loss: 2.0011, test_f1: 0.5988
 epoch: 93, train_loss: 0.3087, test_loss: 1.9097, test_f1: 0.5757
 epoch: 94, train_loss: 0.3028, test_loss: 1.9688, test_f1: 0.6009
 epoch: 95, train_loss: 0.3208, test_loss: 2.0170, test_f1: 0.5961
 epoch: 96, train_loss: 0.2985, test_loss: 2.0486, test_f1: 0.5821
 epoch: 97, train_loss: 0.2949, test_loss: 2.0282, test_f1: 0.5921
 epoch: 98, train_loss: 0.2693, test_loss: 2.0962, test_f1: 0.5674
 epoch: 99, train_loss: 0.2664, test_loss: 2.1315, test_f1: 0.6019
##################ITERATION #7 ****************************************
 epoch: 0, train_loss: 1.2704, test_loss: 1.2873, test_f1: 0.1365
 epoch: 1, train_loss: 1.1007, test_loss: 1.2837, test_f1: 0.1365
 epoch: 2, train_loss: 1.0325, test_loss: 1.2483, test_f1: 0.1531
 epoch: 3, train_loss: 0.9699, test_loss: 1.2097, test_f1: 0.2754
 epoch: 4, train_loss: 0.9325, test_loss: 1.1775, test_f1: 0.2655
 epoch: 5, train_loss: 0.9210, test_loss: 1.1298, test_f1: 0.4424
 epoch: 6, train_loss: 0.9024, test_loss: 1.1249, test_f1: 0.4735
 epoch: 7, train_loss: 0.8805, test_loss: 1.0939, test_f1: 0.5019
 epoch: 8, train_loss: 0.8610, test_loss: 1.0895, test_f1: 0.4986
 epoch: 9, train_loss: 0.8444, test_loss: 1.0224, test_f1: 0.5525
 epoch: 10, train_loss: 0.8587, test_loss: 1.0626, test_f1: 0.5639
 epoch: 11, train_loss: 0.8662, test_loss: 1.0414, test_f1: 0.5635
 epoch: 12, train_loss: 0.8205, test_loss: 0.9897, test_f1: 0.5688
 epoch: 13, train_loss: 0.8268, test_loss: 1.0828, test_f1: 0.5653
 epoch: 14, train_loss: 0.8134, test_loss: 1.0874, test_f1: 0.5813
 epoch: 15, train_loss: 0.8059, test_loss: 1.0414, test_f1: 0.5839
 epoch: 16, train_loss: 0.8140, test_loss: 1.0574, test_f1: 0.6078
 epoch: 17, train_loss: 0.7859, test_loss: 1.1002, test_f1: 0.6109
 epoch: 18, train_loss: 0.7752, test_loss: 1.1056, test_f1: 0.5864
 epoch: 19, train_loss: 0.7607, test_loss: 1.0908, test_f1: 0.5842
 epoch: 20, train_loss: 0.7352, test_loss: 1.0819, test_f1: 0.6116
 epoch: 21, train_loss: 0.7412, test_loss: 1.1597, test_f1: 0.5731
 epoch: 22, train_loss: 0.7385, test_loss: 1.2373, test_f1: 0.5532
 epoch: 23, train_loss: 0.7205, test_loss: 1.1380, test_f1: 0.6172
 epoch: 24, train_loss: 0.7312, test_loss: 1.1291, test_f1: 0.5605
 epoch: 25, train_loss: 0.7197, test_loss: 1.1334, test_f1: 0.5409
 epoch: 26, train_loss: 0.7107, test_loss: 1.2169, test_f1: 0.5624
 epoch: 27, train_loss: 0.7201, test_loss: 1.1891, test_f1: 0.6040
 epoch: 28, train_loss: 0.6892, test_loss: 1.1372, test_f1: 0.5819
 epoch: 29, train_loss: 0.6694, test_loss: 1.1085, test_f1: 0.5776
 epoch: 30, train_loss: 0.6694, test_loss: 1.1677, test_f1: 0.6169
 epoch: 31, train_loss: 0.6312, test_loss: 1.1794, test_f1: 0.6186
 epoch: 32, train_loss: 0.6240, test_loss: 1.2261, test_f1: 0.6026
 epoch: 33, train_loss: 0.6221, test_loss: 1.2636, test_f1: 0.5914
 epoch: 34, train_loss: 0.6356, test_loss: 1.3685, test_f1: 0.5614
 epoch: 35, train_loss: 0.6448, test_loss: 1.1947, test_f1: 0.6346
 epoch: 36, train_loss: 0.6417, test_loss: 1.2795, test_f1: 0.5972
 epoch: 37, train_loss: 0.6497, test_loss: 1.3079, test_f1: 0.5881
 epoch: 38, train_loss: 0.6554, test_loss: 1.6000, test_f1: 0.5219
 epoch: 39, train_loss: 0.6522, test_loss: 1.3376, test_f1: 0.6030
 epoch: 40, train_loss: 0.6438, test_loss: 1.5259, test_f1: 0.5309
 epoch: 41, train_loss: 0.6594, test_loss: 1.3782, test_f1: 0.5327
 epoch: 42, train_loss: 0.6984, test_loss: 1.2147, test_f1: 0.5510
 epoch: 43, train_loss: 0.6911, test_loss: 1.2948, test_f1: 0.5519
 epoch: 44, train_loss: 0.6661, test_loss: 1.3816, test_f1: 0.5255
 epoch: 45, train_loss: 0.6599, test_loss: 1.4069, test_f1: 0.5783
 epoch: 46, train_loss: 0.6109, test_loss: 1.3479, test_f1: 0.6031
 epoch: 47, train_loss: 0.6034, test_loss: 1.3264, test_f1: 0.6096
 epoch: 48, train_loss: 0.5735, test_loss: 1.3343, test_f1: 0.6177
 epoch: 49, train_loss: 0.5853, test_loss: 1.2734, test_f1: 0.6430
 epoch: 50, train_loss: 0.5417, test_loss: 1.3697, test_f1: 0.6486
 epoch: 51, train_loss: 0.5289, test_loss: 1.4724, test_f1: 0.5980
 epoch: 52, train_loss: 0.5254, test_loss: 1.5037, test_f1: 0.6052
 epoch: 53, train_loss: 0.4946, test_loss: 1.4493, test_f1: 0.6392
 epoch: 54, train_loss: 0.5081, test_loss: 1.4261, test_f1: 0.6201
 epoch: 55, train_loss: 0.5063, test_loss: 1.4105, test_f1: 0.6460
 epoch: 56, train_loss: 0.4857, test_loss: 1.4584, test_f1: 0.6120
 epoch: 57, train_loss: 0.4808, test_loss: 1.4749, test_f1: 0.6260
 epoch: 58, train_loss: 0.4740, test_loss: 1.5780, test_f1: 0.6243
 epoch: 59, train_loss: 0.4734, test_loss: 1.5718, test_f1: 0.6063
 epoch: 60, train_loss: 0.4532, test_loss: 1.4544, test_f1: 0.6581
 epoch: 61, train_loss: 0.4478, test_loss: 1.4932, test_f1: 0.6403
 epoch: 62, train_loss: 0.4333, test_loss: 1.5949, test_f1: 0.6010
 epoch: 63, train_loss: 0.4285, test_loss: 1.6930, test_f1: 0.6029
 epoch: 64, train_loss: 0.4178, test_loss: 1.6689, test_f1: 0.6489
 epoch: 65, train_loss: 0.4164, test_loss: 1.6049, test_f1: 0.6767
 epoch: 66, train_loss: 0.4107, test_loss: 1.5497, test_f1: 0.6806
 epoch: 67, train_loss: 0.3947, test_loss: 1.6482, test_f1: 0.6443
 epoch: 68, train_loss: 0.4084, test_loss: 1.7035, test_f1: 0.6548
 epoch: 69, train_loss: 0.4010, test_loss: 1.7519, test_f1: 0.6188
 epoch: 70, train_loss: 0.3941, test_loss: 1.7417, test_f1: 0.6481
 epoch: 71, train_loss: 0.3720, test_loss: 1.7829, test_f1: 0.6432
 epoch: 72, train_loss: 0.3854, test_loss: 1.7561, test_f1: 0.5984
 epoch: 73, train_loss: 0.3741, test_loss: 1.9747, test_f1: 0.5705
 epoch: 74, train_loss: 0.3775, test_loss: 1.9847, test_f1: 0.5992
 epoch: 75, train_loss: 0.4154, test_loss: 1.9556, test_f1: 0.6482
 epoch: 76, train_loss: 0.4159, test_loss: 1.9142, test_f1: 0.6096
 epoch: 77, train_loss: 0.3990, test_loss: 1.8542, test_f1: 0.5910
 epoch: 78, train_loss: 0.3969, test_loss: 1.7576, test_f1: 0.6005
 epoch: 79, train_loss: 0.3720, test_loss: 1.7346, test_f1: 0.6141
 epoch: 80, train_loss: 0.3610, test_loss: 1.7402, test_f1: 0.6169
 epoch: 81, train_loss: 0.3480, test_loss: 1.8475, test_f1: 0.6272
 epoch: 82, train_loss: 0.3471, test_loss: 1.9959, test_f1: 0.6186
 epoch: 83, train_loss: 0.3727, test_loss: 2.1951, test_f1: 0.5709
 epoch: 84, train_loss: 0.3725, test_loss: 1.9224, test_f1: 0.6005
 epoch: 85, train_loss: 0.3562, test_loss: 1.8162, test_f1: 0.6399
 epoch: 86, train_loss: 0.3441, test_loss: 1.8355, test_f1: 0.6411
 epoch: 87, train_loss: 0.3328, test_loss: 2.0411, test_f1: 0.6422
 epoch: 88, train_loss: 0.3389, test_loss: 2.0161, test_f1: 0.6232
 epoch: 89, train_loss: 0.3751, test_loss: 2.3226, test_f1: 0.5855
 epoch: 90, train_loss: 0.3597, test_loss: 2.1411, test_f1: 0.6135
 epoch: 91, train_loss: 0.3211, test_loss: 1.9246, test_f1: 0.6606
 epoch: 92, train_loss: 0.3425, test_loss: 2.1524, test_f1: 0.6091
 epoch: 93, train_loss: 0.3336, test_loss: 2.2759, test_f1: 0.6174
 epoch: 94, train_loss: 0.3180, test_loss: 2.2883, test_f1: 0.5976
 epoch: 95, train_loss: 0.2975, test_loss: 2.3042, test_f1: 0.5911
 epoch: 96, train_loss: 0.3198, test_loss: 2.2253, test_f1: 0.5981
 epoch: 97, train_loss: 0.3092, test_loss: 2.2561, test_f1: 0.6157
 epoch: 98, train_loss: 0.2879, test_loss: 2.3604, test_f1: 0.5952
 epoch: 99, train_loss: 0.2922, test_loss: 2.2366, test_f1: 0.6138
##################ITERATION #8 ****************************************
 epoch: 0, train_loss: 1.2810, test_loss: 1.2983, test_f1: 0.1365
 epoch: 1, train_loss: 1.0711, test_loss: 1.3869, test_f1: 0.1783
 epoch: 2, train_loss: 1.0051, test_loss: 1.4861, test_f1: 0.1770
 epoch: 3, train_loss: 0.9764, test_loss: 1.4556, test_f1: 0.1199
 epoch: 4, train_loss: 0.9738, test_loss: 1.4072, test_f1: 0.2812
 epoch: 5, train_loss: 0.9215, test_loss: 1.2806, test_f1: 0.3481
 epoch: 6, train_loss: 0.9194, test_loss: 1.1714, test_f1: 0.3385
 epoch: 7, train_loss: 0.9081, test_loss: 1.1345, test_f1: 0.4054
 epoch: 8, train_loss: 0.8619, test_loss: 1.0708, test_f1: 0.4541
 epoch: 9, train_loss: 0.8524, test_loss: 1.0671, test_f1: 0.4953
 epoch: 10, train_loss: 0.8238, test_loss: 1.0864, test_f1: 0.4941
 epoch: 11, train_loss: 0.8322, test_loss: 1.0089, test_f1: 0.5454
 epoch: 12, train_loss: 0.8359, test_loss: 1.0618, test_f1: 0.5383
 epoch: 13, train_loss: 0.8224, test_loss: 1.0736, test_f1: 0.5506
 epoch: 14, train_loss: 0.8043, test_loss: 1.0627, test_f1: 0.5607
 epoch: 15, train_loss: 0.8018, test_loss: 1.0408, test_f1: 0.5601
 epoch: 16, train_loss: 0.7848, test_loss: 1.0913, test_f1: 0.5609
 epoch: 17, train_loss: 0.7778, test_loss: 1.0400, test_f1: 0.5878
 epoch: 18, train_loss: 0.7713, test_loss: 1.0591, test_f1: 0.5543
 epoch: 19, train_loss: 0.7717, test_loss: 1.0355, test_f1: 0.6043
 epoch: 20, train_loss: 0.7351, test_loss: 1.0965, test_f1: 0.6017
 epoch: 21, train_loss: 0.7247, test_loss: 1.1370, test_f1: 0.5611
 epoch: 22, train_loss: 0.7177, test_loss: 1.1513, test_f1: 0.5445
 epoch: 23, train_loss: 0.7231, test_loss: 1.1244, test_f1: 0.5519
 epoch: 24, train_loss: 0.6993, test_loss: 1.1084, test_f1: 0.5770
 epoch: 25, train_loss: 0.7097, test_loss: 1.1809, test_f1: 0.5528
 epoch: 26, train_loss: 0.7127, test_loss: 1.1161, test_f1: 0.6157
 epoch: 27, train_loss: 0.6992, test_loss: 1.0144, test_f1: 0.6282
 epoch: 28, train_loss: 0.7021, test_loss: 0.9498, test_f1: 0.6343
 epoch: 29, train_loss: 0.6877, test_loss: 1.1008, test_f1: 0.5584
 epoch: 30, train_loss: 0.6734, test_loss: 1.1434, test_f1: 0.5301
 epoch: 31, train_loss: 0.6809, test_loss: 1.1507, test_f1: 0.5864
 epoch: 32, train_loss: 0.6514, test_loss: 1.1656, test_f1: 0.6191
 epoch: 33, train_loss: 0.6707, test_loss: 1.2310, test_f1: 0.5887
 epoch: 34, train_loss: 0.6403, test_loss: 1.1234, test_f1: 0.6218
 epoch: 35, train_loss: 0.6304, test_loss: 1.1858, test_f1: 0.5824
 epoch: 36, train_loss: 0.5959, test_loss: 1.1491, test_f1: 0.5903
 epoch: 37, train_loss: 0.6217, test_loss: 1.1840, test_f1: 0.6052
 epoch: 38, train_loss: 0.5954, test_loss: 1.1974, test_f1: 0.6109
 epoch: 39, train_loss: 0.5894, test_loss: 1.4039, test_f1: 0.6369
 epoch: 40, train_loss: 0.5582, test_loss: 1.3718, test_f1: 0.5722
 epoch: 41, train_loss: 0.5361, test_loss: 1.2142, test_f1: 0.6308
 epoch: 42, train_loss: 0.5431, test_loss: 1.3589, test_f1: 0.5840
 epoch: 43, train_loss: 0.5547, test_loss: 1.3430, test_f1: 0.5902
 epoch: 44, train_loss: 0.5162, test_loss: 1.4157, test_f1: 0.5884
 epoch: 45, train_loss: 0.5243, test_loss: 1.3206, test_f1: 0.6126
 epoch: 46, train_loss: 0.5172, test_loss: 1.3475, test_f1: 0.5486
 epoch: 47, train_loss: 0.5286, test_loss: 1.3126, test_f1: 0.5632
 epoch: 48, train_loss: 0.4990, test_loss: 1.5220, test_f1: 0.5410
 epoch: 49, train_loss: 0.5052, test_loss: 1.4503, test_f1: 0.5556
 epoch: 50, train_loss: 0.5349, test_loss: 1.5347, test_f1: 0.5720
 epoch: 51, train_loss: 0.5422, test_loss: 1.5004, test_f1: 0.5563
 epoch: 52, train_loss: 0.4985, test_loss: 1.3557, test_f1: 0.5995
 epoch: 53, train_loss: 0.4869, test_loss: 1.3235, test_f1: 0.5943
 epoch: 54, train_loss: 0.4607, test_loss: 1.3620, test_f1: 0.6068
 epoch: 55, train_loss: 0.4454, test_loss: 1.4128, test_f1: 0.5937
 epoch: 56, train_loss: 0.4329, test_loss: 1.3571, test_f1: 0.6098
 epoch: 57, train_loss: 0.4154, test_loss: 1.4417, test_f1: 0.6125
 epoch: 58, train_loss: 0.4088, test_loss: 1.4947, test_f1: 0.6171
 epoch: 59, train_loss: 0.4245, test_loss: 1.6213, test_f1: 0.5848
 epoch: 60, train_loss: 0.3990, test_loss: 1.5657, test_f1: 0.5958
 epoch: 61, train_loss: 0.4115, test_loss: 1.5530, test_f1: 0.5965
 epoch: 62, train_loss: 0.3962, test_loss: 1.6732, test_f1: 0.5877
 epoch: 63, train_loss: 0.3964, test_loss: 1.6825, test_f1: 0.5614
 epoch: 64, train_loss: 0.3743, test_loss: 1.6606, test_f1: 0.6040
 epoch: 65, train_loss: 0.4175, test_loss: 1.6436, test_f1: 0.6272
 epoch: 66, train_loss: 0.3942, test_loss: 1.8926, test_f1: 0.6189
 epoch: 67, train_loss: 0.4115, test_loss: 1.6246, test_f1: 0.6276
 epoch: 68, train_loss: 0.3922, test_loss: 1.4854, test_f1: 0.6256
 epoch: 69, train_loss: 0.3657, test_loss: 1.4831, test_f1: 0.6257
 epoch: 70, train_loss: 0.3544, test_loss: 1.6366, test_f1: 0.5959
 epoch: 71, train_loss: 0.3718, test_loss: 1.5591, test_f1: 0.6229
 epoch: 72, train_loss: 0.3923, test_loss: 1.9113, test_f1: 0.5669
 epoch: 73, train_loss: 0.3803, test_loss: 1.7934, test_f1: 0.6109
 epoch: 74, train_loss: 0.3759, test_loss: 1.5910, test_f1: 0.5952
 epoch: 75, train_loss: 0.3703, test_loss: 1.5893, test_f1: 0.5951
 epoch: 76, train_loss: 0.3719, test_loss: 1.7375, test_f1: 0.5806
 epoch: 77, train_loss: 0.3350, test_loss: 1.8650, test_f1: 0.5837
 epoch: 78, train_loss: 0.3361, test_loss: 1.8748, test_f1: 0.5805
 epoch: 79, train_loss: 0.3554, test_loss: 1.8487, test_f1: 0.5881
 epoch: 80, train_loss: 0.3543, test_loss: 1.6532, test_f1: 0.5921
 epoch: 81, train_loss: 0.3609, test_loss: 1.7071, test_f1: 0.5996
 epoch: 82, train_loss: 0.3264, test_loss: 1.8134, test_f1: 0.5860
 epoch: 83, train_loss: 0.3067, test_loss: 1.7697, test_f1: 0.6003
 epoch: 84, train_loss: 0.3375, test_loss: 1.9141, test_f1: 0.5767
 epoch: 85, train_loss: 0.3330, test_loss: 2.0194, test_f1: 0.5708
 epoch: 86, train_loss: 0.3456, test_loss: 1.8176, test_f1: 0.6028
 epoch: 87, train_loss: 0.3300, test_loss: 1.7022, test_f1: 0.6121
 epoch: 88, train_loss: 0.3066, test_loss: 1.7540, test_f1: 0.6022
 epoch: 89, train_loss: 0.2788, test_loss: 1.8645, test_f1: 0.5911
 epoch: 90, train_loss: 0.3019, test_loss: 1.9435, test_f1: 0.5781
 epoch: 91, train_loss: 0.2862, test_loss: 2.2850, test_f1: 0.5678
 epoch: 92, train_loss: 0.2831, test_loss: 2.1599, test_f1: 0.5804
 epoch: 93, train_loss: 0.2897, test_loss: 2.0735, test_f1: 0.5897
 epoch: 94, train_loss: 0.2747, test_loss: 2.1248, test_f1: 0.5730
 epoch: 95, train_loss: 0.3126, test_loss: 2.0279, test_f1: 0.6131
 epoch: 96, train_loss: 0.3017, test_loss: 2.1907, test_f1: 0.6109
 epoch: 97, train_loss: 0.2813, test_loss: 2.2213, test_f1: 0.5917
 epoch: 98, train_loss: 0.2658, test_loss: 2.1579, test_f1: 0.5867
 epoch: 99, train_loss: 0.2609, test_loss: 2.0836, test_f1: 0.6195
##################ITERATION #9 ****************************************
 epoch: 0, train_loss: 1.3906, test_loss: 1.3560, test_f1: 0.1365
 epoch: 1, train_loss: 1.1536, test_loss: 1.3208, test_f1: 0.1365
 epoch: 2, train_loss: 1.0226, test_loss: 1.2450, test_f1: 0.1867
 epoch: 3, train_loss: 1.0121, test_loss: 1.1845, test_f1: 0.3624
 epoch: 4, train_loss: 0.9554, test_loss: 1.1594, test_f1: 0.3703
 epoch: 5, train_loss: 0.9302, test_loss: 1.1558, test_f1: 0.3443
 epoch: 6, train_loss: 0.9224, test_loss: 1.1264, test_f1: 0.3840
 epoch: 7, train_loss: 0.9131, test_loss: 1.0644, test_f1: 0.4902
 epoch: 8, train_loss: 0.8573, test_loss: 1.1278, test_f1: 0.4314
 epoch: 9, train_loss: 0.8579, test_loss: 1.0820, test_f1: 0.5181
 epoch: 10, train_loss: 0.8364, test_loss: 1.0307, test_f1: 0.5596
 epoch: 11, train_loss: 0.8491, test_loss: 1.1130, test_f1: 0.5384
 epoch: 12, train_loss: 0.8185, test_loss: 1.0986, test_f1: 0.5747
 epoch: 13, train_loss: 0.8069, test_loss: 1.0512, test_f1: 0.5709
 epoch: 14, train_loss: 0.7945, test_loss: 1.1017, test_f1: 0.5790
 epoch: 15, train_loss: 0.8012, test_loss: 1.1339, test_f1: 0.5429
 epoch: 16, train_loss: 0.8041, test_loss: 1.1503, test_f1: 0.5856
 epoch: 17, train_loss: 0.7829, test_loss: 1.1761, test_f1: 0.5574
 epoch: 18, train_loss: 0.7614, test_loss: 1.2269, test_f1: 0.5353
 epoch: 19, train_loss: 0.7487, test_loss: 1.1526, test_f1: 0.5396
 epoch: 20, train_loss: 0.7580, test_loss: 1.2279, test_f1: 0.5227
 epoch: 21, train_loss: 0.7191, test_loss: 1.2210, test_f1: 0.5351
 epoch: 22, train_loss: 0.7189, test_loss: 1.1847, test_f1: 0.5311
 epoch: 23, train_loss: 0.7135, test_loss: 1.1628, test_f1: 0.5600
 epoch: 24, train_loss: 0.6920, test_loss: 1.1649, test_f1: 0.5907
 epoch: 25, train_loss: 0.6982, test_loss: 1.1869, test_f1: 0.5921
 epoch: 26, train_loss: 0.6763, test_loss: 1.2448, test_f1: 0.5547
 epoch: 27, train_loss: 0.6928, test_loss: 1.2665, test_f1: 0.5457
 epoch: 28, train_loss: 0.6865, test_loss: 1.2279, test_f1: 0.5168
 epoch: 29, train_loss: 0.6918, test_loss: 1.1712, test_f1: 0.5825
 epoch: 30, train_loss: 0.6473, test_loss: 1.2054, test_f1: 0.5932
 epoch: 31, train_loss: 0.6503, test_loss: 1.2666, test_f1: 0.5338
 epoch: 32, train_loss: 0.6461, test_loss: 1.2691, test_f1: 0.5486
 epoch: 33, train_loss: 0.6607, test_loss: 1.3511, test_f1: 0.5547
 epoch: 34, train_loss: 0.6494, test_loss: 1.3118, test_f1: 0.5724
 epoch: 35, train_loss: 0.6427, test_loss: 1.1667, test_f1: 0.5867
 epoch: 36, train_loss: 0.6324, test_loss: 1.3237, test_f1: 0.5396
 epoch: 37, train_loss: 0.6247, test_loss: 1.2905, test_f1: 0.5525
 epoch: 38, train_loss: 0.6431, test_loss: 1.4258, test_f1: 0.5330
 epoch: 39, train_loss: 0.6252, test_loss: 1.3323, test_f1: 0.5262
 epoch: 40, train_loss: 0.6044, test_loss: 1.2356, test_f1: 0.5758
 epoch: 41, train_loss: 0.5919, test_loss: 1.2635, test_f1: 0.5585
 epoch: 42, train_loss: 0.5739, test_loss: 1.3656, test_f1: 0.5670
 epoch: 43, train_loss: 0.5528, test_loss: 1.4042, test_f1: 0.5746
 epoch: 44, train_loss: 0.5718, test_loss: 1.4733, test_f1: 0.5692
 epoch: 45, train_loss: 0.5588, test_loss: 1.5277, test_f1: 0.5542
 epoch: 46, train_loss: 0.5567, test_loss: 1.4683, test_f1: 0.5683
 epoch: 47, train_loss: 0.5751, test_loss: 1.4538, test_f1: 0.5801
 epoch: 48, train_loss: 0.5724, test_loss: 1.2676, test_f1: 0.5917
 epoch: 49, train_loss: 0.5837, test_loss: 1.5161, test_f1: 0.5846
 epoch: 50, train_loss: 0.5863, test_loss: 1.3897, test_f1: 0.5782
 epoch: 51, train_loss: 0.5142, test_loss: 1.4057, test_f1: 0.5864
 epoch: 52, train_loss: 0.4977, test_loss: 1.5309, test_f1: 0.5512
 epoch: 53, train_loss: 0.4878, test_loss: 1.5014, test_f1: 0.5731
 epoch: 54, train_loss: 0.4739, test_loss: 1.5341, test_f1: 0.5871
 epoch: 55, train_loss: 0.4613, test_loss: 1.4794, test_f1: 0.6086
 epoch: 56, train_loss: 0.4524, test_loss: 1.4321, test_f1: 0.6359
 epoch: 57, train_loss: 0.4724, test_loss: 1.4613, test_f1: 0.5943
 epoch: 58, train_loss: 0.4400, test_loss: 1.5594, test_f1: 0.5200
 epoch: 59, train_loss: 0.4373, test_loss: 1.6489, test_f1: 0.5325
 epoch: 60, train_loss: 0.4452, test_loss: 1.5338, test_f1: 0.5582
 epoch: 61, train_loss: 0.4298, test_loss: 1.6427, test_f1: 0.5623
 epoch: 62, train_loss: 0.4033, test_loss: 1.6377, test_f1: 0.5865
 epoch: 63, train_loss: 0.4040, test_loss: 1.6397, test_f1: 0.5686
 epoch: 64, train_loss: 0.3910, test_loss: 1.7997, test_f1: 0.5777
 epoch: 65, train_loss: 0.4051, test_loss: 1.8625, test_f1: 0.5558
 epoch: 66, train_loss: 0.3834, test_loss: 1.7729, test_f1: 0.5913
 epoch: 67, train_loss: 0.3833, test_loss: 1.6932, test_f1: 0.5424
 epoch: 68, train_loss: 0.3628, test_loss: 1.7831, test_f1: 0.5422
 epoch: 69, train_loss: 0.3509, test_loss: 1.9463, test_f1: 0.5481
 epoch: 70, train_loss: 0.3792, test_loss: 1.8464, test_f1: 0.5928
 epoch: 71, train_loss: 0.3566, test_loss: 1.8798, test_f1: 0.5585
 epoch: 72, train_loss: 0.3590, test_loss: 1.9151, test_f1: 0.5485
 epoch: 73, train_loss: 0.3742, test_loss: 2.0452, test_f1: 0.5792
 epoch: 74, train_loss: 0.3967, test_loss: 1.8638, test_f1: 0.5547
 epoch: 75, train_loss: 0.3732, test_loss: 2.1064, test_f1: 0.5566
 epoch: 76, train_loss: 0.3652, test_loss: 1.9533, test_f1: 0.5373
 epoch: 77, train_loss: 0.3609, test_loss: 1.8578, test_f1: 0.5342
 epoch: 78, train_loss: 0.3582, test_loss: 1.9316, test_f1: 0.5508
 epoch: 79, train_loss: 0.3311, test_loss: 1.9621, test_f1: 0.5764
 epoch: 80, train_loss: 0.3364, test_loss: 2.0210, test_f1: 0.5435
 epoch: 81, train_loss: 0.3381, test_loss: 2.0065, test_f1: 0.5682
 epoch: 82, train_loss: 0.3235, test_loss: 2.0128, test_f1: 0.5968
 epoch: 83, train_loss: 0.3130, test_loss: 1.9933, test_f1: 0.6116
 epoch: 84, train_loss: 0.3075, test_loss: 2.0571, test_f1: 0.5874
 epoch: 85, train_loss: 0.3212, test_loss: 2.0402, test_f1: 0.5873
 epoch: 86, train_loss: 0.3117, test_loss: 2.1755, test_f1: 0.5647
 epoch: 87, train_loss: 0.3153, test_loss: 2.0440, test_f1: 0.5996
 epoch: 88, train_loss: 0.3198, test_loss: 2.1701, test_f1: 0.5864
 epoch: 89, train_loss: 0.3006, test_loss: 2.3844, test_f1: 0.5501
 epoch: 90, train_loss: 0.3270, test_loss: 2.1851, test_f1: 0.5549
 epoch: 91, train_loss: 0.3506, test_loss: 2.1337, test_f1: 0.5629
 epoch: 92, train_loss: 0.3373, test_loss: 2.0358, test_f1: 0.5760
 epoch: 93, train_loss: 0.3338, test_loss: 2.2568, test_f1: 0.5809
 epoch: 94, train_loss: 0.3232, test_loss: 2.4000, test_f1: 0.5785
 epoch: 95, train_loss: 0.3118, test_loss: 2.3440, test_f1: 0.5598
 epoch: 96, train_loss: 0.2893, test_loss: 2.2506, test_f1: 0.5976
 epoch: 97, train_loss: 0.3207, test_loss: 2.2687, test_f1: 0.5867
 epoch: 98, train_loss: 0.3071, test_loss: 2.0521, test_f1: 0.5669
 epoch: 99, train_loss: 0.2821, test_loss: 2.1798, test_f1: 0.5522

Training completed in 371.28 seconds
Best F1: 0.6806 at epoch 66
Mean F1 across iterations: 0.6438  0.0157
========================FINAL RESULTS================================
FEGIN weighted F1: 0.6806  0.0157
python main.py --data ltspice_demos --representation component_net --model FEGIN --layers 4 --hiddens 128 --batch_size 256 --lr 0.001 --emb_size 128 --epochs 100 --save_appendix component_net_L4_H128_BS256_LR0.001_E128 --no_val
-----



STDERR:
  File "main.py", line 370, in <module>
    main()
  File "main.py", line 254, in main
    dataset = dataset_class(
  File "/home/philip/projects/ltspice_examples_code_repo/Circuit-Completion-Using-GNNs/component_classification_with_link_prediction_head/evaluation/FEGIN/kernel/circuit_datasets.py", line 15, in __init__
    self.data, self.slices = torch.load(self.processed_paths[0])
  File "/home/philip/.local/lib/python3.8/site-packages/torch/serialization.py", line 1040, in load
    warnings.warn(
  File "/usr/lib/python3.8/warnings.py", line 109, in _showwarnmsg
    sw(msg.message, msg.category, msg.filename, msg.lineno,
  File "main.py", line 47, in warn_with_traceback
    traceback.print_stack(file=log)
/home/philip/projects/ltspice_examples_code_repo/Circuit-Completion-Using-GNNs/component_classification_with_link_prediction_head/evaluation/FEGIN/kernel/circuit_datasets.py:15: FutureWarning: You are using `torch.load` with `weights_only=False` (the current default value), which uses the default pickle module implicitly. It is possible to construct malicious pickle data which will execute arbitrary code during unpickling (See https://github.com/pytorch/pytorch/blob/main/SECURITY.md#untrusted-models for more details). In a future release, the default value for `weights_only` will be flipped to `True`. This limits the functions that could be executed during unpickling. Arbitrary objects will no longer be allowed to be loaded via this mode unless they are explicitly allowlisted by the user via `torch.serialization.add_safe_globals`. We recommend you start setting `weights_only=True` for any use case where you don't have full control of the loaded file. Please open an issue on GitHub for any issues related to this experimental feature.
  self.data, self.slices = torch.load(self.processed_paths[0])
