STDOUT:
Results will be saved in /home/philip/projects/ltspice_examples_code_repo/Circuit-Completion-Using-GNNs/component_classification_with_link_prediction_head/evaluation/FEGIN/results/model_FEGIN_dataset_ltspice_examples
Command line input: python main.py --data ltspice_examples --representation component_net --model FEGIN --layers 5 --hiddens 32 --batch_size 64 --lr 0.01 --emb_size 512 --epochs 100 --save_appendix component_net_L5_H32_BS64_LR0.01_E512 --no_val
 is saved.
-----
ltspice_examples - FEGIN
Using 5 layers, 32 hidden units, h = 2
Loading component_net representation dataset
ENTERED
Training FEGIN on component_net representation
Train: 3558, Test: 846
##################ITERATION #0 ****************************************
 epoch: 0, train_loss: 1.2337, test_loss: 1.2023, test_f1: 0.2989
 epoch: 1, train_loss: 1.0707, test_loss: 1.0888, test_f1: 0.4909
 epoch: 2, train_loss: 1.0271, test_loss: 1.0802, test_f1: 0.4655
 epoch: 3, train_loss: 0.9999, test_loss: 0.9627, test_f1: 0.5353
 epoch: 4, train_loss: 0.9873, test_loss: 1.0574, test_f1: 0.4588
 epoch: 5, train_loss: 0.9738, test_loss: 1.0337, test_f1: 0.4823
 epoch: 6, train_loss: 0.9691, test_loss: 1.0318, test_f1: 0.4912
 epoch: 7, train_loss: 0.9628, test_loss: 1.0538, test_f1: 0.4552
 epoch: 8, train_loss: 0.9553, test_loss: 0.9649, test_f1: 0.4906
 epoch: 9, train_loss: 0.9298, test_loss: 0.9540, test_f1: 0.5226
 epoch: 10, train_loss: 0.9271, test_loss: 0.9940, test_f1: 0.5442
 epoch: 11, train_loss: 0.9340, test_loss: 0.9569, test_f1: 0.4879
 epoch: 12, train_loss: 0.9142, test_loss: 0.9882, test_f1: 0.5004
 epoch: 13, train_loss: 0.9094, test_loss: 1.0872, test_f1: 0.4916
 epoch: 14, train_loss: 0.9110, test_loss: 0.9369, test_f1: 0.5439
 epoch: 15, train_loss: 0.8966, test_loss: 1.0363, test_f1: 0.5029
 epoch: 16, train_loss: 0.8921, test_loss: 1.0767, test_f1: 0.4787
 epoch: 17, train_loss: 0.8847, test_loss: 1.0355, test_f1: 0.5089
 epoch: 18, train_loss: 0.8832, test_loss: 0.9626, test_f1: 0.5338
 epoch: 19, train_loss: 0.8782, test_loss: 0.9561, test_f1: 0.5127
 epoch: 20, train_loss: 0.8928, test_loss: 0.9382, test_f1: 0.5030
 epoch: 21, train_loss: 0.8800, test_loss: 0.9727, test_f1: 0.4908
 epoch: 22, train_loss: 0.8685, test_loss: 1.0369, test_f1: 0.5416
 epoch: 23, train_loss: 0.8632, test_loss: 0.9742, test_f1: 0.5376
 epoch: 24, train_loss: 0.8572, test_loss: 0.9589, test_f1: 0.5157
 epoch: 25, train_loss: 0.8765, test_loss: 0.9334, test_f1: 0.5443
 epoch: 26, train_loss: 0.8810, test_loss: 1.1160, test_f1: 0.5040
 epoch: 27, train_loss: 0.8503, test_loss: 1.0434, test_f1: 0.5787
 epoch: 28, train_loss: 0.8487, test_loss: 0.9988, test_f1: 0.4942
 epoch: 29, train_loss: 0.8478, test_loss: 1.0885, test_f1: 0.4848
 epoch: 30, train_loss: 0.8434, test_loss: 1.0131, test_f1: 0.4967
 epoch: 31, train_loss: 0.8482, test_loss: 0.9496, test_f1: 0.5583
 epoch: 32, train_loss: 0.8281, test_loss: 0.9279, test_f1: 0.5347
 epoch: 33, train_loss: 0.8283, test_loss: 0.9222, test_f1: 0.5899
 epoch: 34, train_loss: 0.8160, test_loss: 1.0427, test_f1: 0.5336
 epoch: 35, train_loss: 0.8306, test_loss: 0.9997, test_f1: 0.5171
 epoch: 36, train_loss: 0.8281, test_loss: 0.9704, test_f1: 0.5907
 epoch: 37, train_loss: 0.8254, test_loss: 0.9877, test_f1: 0.5336
 epoch: 38, train_loss: 0.8139, test_loss: 0.9994, test_f1: 0.5272
 epoch: 39, train_loss: 0.8283, test_loss: 1.0239, test_f1: 0.5604
 epoch: 40, train_loss: 0.7965, test_loss: 1.0095, test_f1: 0.5659
 epoch: 41, train_loss: 0.8106, test_loss: 0.9843, test_f1: 0.5702
 epoch: 42, train_loss: 0.8066, test_loss: 1.0547, test_f1: 0.5157
 epoch: 43, train_loss: 0.8065, test_loss: 1.0393, test_f1: 0.5711
 epoch: 44, train_loss: 0.7982, test_loss: 1.0170, test_f1: 0.5582
 epoch: 45, train_loss: 0.7883, test_loss: 1.0417, test_f1: 0.5424
 epoch: 46, train_loss: 0.8115, test_loss: 1.0066, test_f1: 0.5500
 epoch: 47, train_loss: 0.7979, test_loss: 0.9813, test_f1: 0.5755
 epoch: 48, train_loss: 0.7899, test_loss: 1.0046, test_f1: 0.5373
 epoch: 49, train_loss: 0.7889, test_loss: 1.0069, test_f1: 0.5536
 epoch: 50, train_loss: 0.8098, test_loss: 1.0042, test_f1: 0.5565
 epoch: 51, train_loss: 0.7708, test_loss: 1.0649, test_f1: 0.5929
 epoch: 52, train_loss: 0.7568, test_loss: 1.0299, test_f1: 0.5858
 epoch: 53, train_loss: 0.7476, test_loss: 0.9989, test_f1: 0.6077
 epoch: 54, train_loss: 0.7408, test_loss: 1.0321, test_f1: 0.5860
 epoch: 55, train_loss: 0.7290, test_loss: 0.9906, test_f1: 0.6009
 epoch: 56, train_loss: 0.7310, test_loss: 0.9882, test_f1: 0.6233
 epoch: 57, train_loss: 0.7177, test_loss: 1.0335, test_f1: 0.5668
 epoch: 58, train_loss: 0.7361, test_loss: 1.0214, test_f1: 0.5979
 epoch: 59, train_loss: 0.7131, test_loss: 1.0592, test_f1: 0.5630
 epoch: 60, train_loss: 0.7104, test_loss: 1.0888, test_f1: 0.5770
 epoch: 61, train_loss: 0.7208, test_loss: 1.0051, test_f1: 0.5843
 epoch: 62, train_loss: 0.7216, test_loss: 0.9722, test_f1: 0.6182
 epoch: 63, train_loss: 0.7121, test_loss: 0.9885, test_f1: 0.6454
 epoch: 64, train_loss: 0.7237, test_loss: 1.1274, test_f1: 0.5754
 epoch: 65, train_loss: 0.7062, test_loss: 1.0626, test_f1: 0.6001
 epoch: 66, train_loss: 0.7047, test_loss: 1.1441, test_f1: 0.5828
 epoch: 67, train_loss: 0.7032, test_loss: 1.1764, test_f1: 0.5998
 epoch: 68, train_loss: 0.7073, test_loss: 1.0979, test_f1: 0.6070
 epoch: 69, train_loss: 0.7060, test_loss: 1.0811, test_f1: 0.6030
 epoch: 70, train_loss: 0.6973, test_loss: 1.1322, test_f1: 0.6089
 epoch: 71, train_loss: 0.7051, test_loss: 1.1166, test_f1: 0.5622
 epoch: 72, train_loss: 0.7015, test_loss: 0.9961, test_f1: 0.6264
 epoch: 73, train_loss: 0.6917, test_loss: 1.0530, test_f1: 0.5915
 epoch: 74, train_loss: 0.6901, test_loss: 1.0840, test_f1: 0.5667
 epoch: 75, train_loss: 0.6921, test_loss: 1.1123, test_f1: 0.5726
 epoch: 76, train_loss: 0.6974, test_loss: 1.0398, test_f1: 0.6056
 epoch: 77, train_loss: 0.6824, test_loss: 1.0791, test_f1: 0.5901
 epoch: 78, train_loss: 0.6803, test_loss: 1.0869, test_f1: 0.6034
 epoch: 79, train_loss: 0.6987, test_loss: 1.1300, test_f1: 0.6075
 epoch: 80, train_loss: 0.6798, test_loss: 1.0727, test_f1: 0.6332
 epoch: 81, train_loss: 0.6923, test_loss: 1.2076, test_f1: 0.5842
 epoch: 82, train_loss: 0.6783, test_loss: 1.1166, test_f1: 0.6000
 epoch: 83, train_loss: 0.6853, test_loss: 1.0621, test_f1: 0.6054
 epoch: 84, train_loss: 0.6828, test_loss: 1.0797, test_f1: 0.6214
 epoch: 85, train_loss: 0.6864, test_loss: 1.0749, test_f1: 0.6105
 epoch: 86, train_loss: 0.6658, test_loss: 1.1313, test_f1: 0.5898
 epoch: 87, train_loss: 0.6761, test_loss: 1.0366, test_f1: 0.6158
 epoch: 88, train_loss: 0.6677, test_loss: 1.0781, test_f1: 0.6356
 epoch: 89, train_loss: 0.6786, test_loss: 1.0405, test_f1: 0.6257
 epoch: 90, train_loss: 0.6681, test_loss: 1.2165, test_f1: 0.5855
 epoch: 91, train_loss: 0.6630, test_loss: 1.0824, test_f1: 0.6440
 epoch: 92, train_loss: 0.6763, test_loss: 1.2127, test_f1: 0.6181
 epoch: 93, train_loss: 0.6712, test_loss: 1.0312, test_f1: 0.6244
 epoch: 94, train_loss: 0.6483, test_loss: 1.0399, test_f1: 0.6401
 epoch: 95, train_loss: 0.6509, test_loss: 1.0953, test_f1: 0.6189
 epoch: 96, train_loss: 0.6518, test_loss: 1.0089, test_f1: 0.6336
 epoch: 97, train_loss: 0.6528, test_loss: 1.1319, test_f1: 0.5832
 epoch: 98, train_loss: 0.6555, test_loss: 1.1440, test_f1: 0.6349
 epoch: 99, train_loss: 0.6454, test_loss: 1.1183, test_f1: 0.6057
##################ITERATION #1 ****************************************
 epoch: 0, train_loss: 1.1500, test_loss: 1.0890, test_f1: 0.4485
 epoch: 1, train_loss: 1.0173, test_loss: 1.0192, test_f1: 0.4608
 epoch: 2, train_loss: 0.9744, test_loss: 0.9918, test_f1: 0.5021
 epoch: 3, train_loss: 0.9812, test_loss: 0.9136, test_f1: 0.5303
 epoch: 4, train_loss: 0.9571, test_loss: 0.9281, test_f1: 0.4732
 epoch: 5, train_loss: 0.9548, test_loss: 1.0252, test_f1: 0.4919
 epoch: 6, train_loss: 0.9517, test_loss: 0.9464, test_f1: 0.5011
 epoch: 7, train_loss: 0.9354, test_loss: 1.0114, test_f1: 0.4943
 epoch: 8, train_loss: 0.9259, test_loss: 1.0151, test_f1: 0.4504
 epoch: 9, train_loss: 0.9311, test_loss: 1.0028, test_f1: 0.5455
 epoch: 10, train_loss: 0.9081, test_loss: 0.9698, test_f1: 0.5088
 epoch: 11, train_loss: 0.9124, test_loss: 0.9578, test_f1: 0.5089
 epoch: 12, train_loss: 0.9006, test_loss: 0.9838, test_f1: 0.5016
 epoch: 13, train_loss: 0.8933, test_loss: 1.0004, test_f1: 0.4933
 epoch: 14, train_loss: 0.8961, test_loss: 1.0257, test_f1: 0.5123
 epoch: 15, train_loss: 0.8821, test_loss: 1.0542, test_f1: 0.5079
 epoch: 16, train_loss: 0.8884, test_loss: 0.9651, test_f1: 0.5121
 epoch: 17, train_loss: 0.8649, test_loss: 0.9840, test_f1: 0.5251
 epoch: 18, train_loss: 0.8666, test_loss: 0.9606, test_f1: 0.5036
 epoch: 19, train_loss: 0.8666, test_loss: 0.9626, test_f1: 0.5123
 epoch: 20, train_loss: 0.8618, test_loss: 0.9778, test_f1: 0.5519
 epoch: 21, train_loss: 0.8554, test_loss: 1.0166, test_f1: 0.4800
 epoch: 22, train_loss: 0.8516, test_loss: 0.9438, test_f1: 0.5792
 epoch: 23, train_loss: 0.8431, test_loss: 1.0024, test_f1: 0.5912
 epoch: 24, train_loss: 0.8460, test_loss: 1.0128, test_f1: 0.4778
 epoch: 25, train_loss: 0.8298, test_loss: 0.9769, test_f1: 0.5632
 epoch: 26, train_loss: 0.8355, test_loss: 0.9929, test_f1: 0.5433
 epoch: 27, train_loss: 0.8385, test_loss: 0.9352, test_f1: 0.5183
 epoch: 28, train_loss: 0.8385, test_loss: 0.9444, test_f1: 0.5621
 epoch: 29, train_loss: 0.8058, test_loss: 0.9775, test_f1: 0.5627
 epoch: 30, train_loss: 0.8249, test_loss: 1.3351, test_f1: 0.4086
 epoch: 31, train_loss: 0.9242, test_loss: 0.9659, test_f1: 0.5473
 epoch: 32, train_loss: 0.8967, test_loss: 0.9351, test_f1: 0.4871
 epoch: 33, train_loss: 0.8599, test_loss: 1.0780, test_f1: 0.5636
 epoch: 34, train_loss: 0.8553, test_loss: 0.9773, test_f1: 0.5269
 epoch: 35, train_loss: 0.8370, test_loss: 0.9771, test_f1: 0.5295
 epoch: 36, train_loss: 0.8430, test_loss: 1.0028, test_f1: 0.5496
 epoch: 37, train_loss: 0.8481, test_loss: 0.9421, test_f1: 0.5444
 epoch: 38, train_loss: 0.8332, test_loss: 0.9808, test_f1: 0.5983
 epoch: 39, train_loss: 0.8277, test_loss: 0.9421, test_f1: 0.5540
 epoch: 40, train_loss: 0.8033, test_loss: 0.9452, test_f1: 0.5400
 epoch: 41, train_loss: 0.7959, test_loss: 1.0271, test_f1: 0.5823
 epoch: 42, train_loss: 0.7839, test_loss: 0.9257, test_f1: 0.5525
 epoch: 43, train_loss: 0.7912, test_loss: 0.9159, test_f1: 0.5879
 epoch: 44, train_loss: 0.7957, test_loss: 0.9473, test_f1: 0.5583
 epoch: 45, train_loss: 0.7867, test_loss: 0.9647, test_f1: 0.5573
 epoch: 46, train_loss: 0.7758, test_loss: 0.9604, test_f1: 0.5454
 epoch: 47, train_loss: 0.7896, test_loss: 0.9518, test_f1: 0.6027
 epoch: 48, train_loss: 0.7639, test_loss: 0.9029, test_f1: 0.5677
 epoch: 49, train_loss: 0.7732, test_loss: 0.9603, test_f1: 0.5972
 epoch: 50, train_loss: 0.7581, test_loss: 0.8985, test_f1: 0.5542
 epoch: 51, train_loss: 0.7325, test_loss: 0.9343, test_f1: 0.6209
 epoch: 52, train_loss: 0.7311, test_loss: 0.9564, test_f1: 0.6238
 epoch: 53, train_loss: 0.7234, test_loss: 0.9410, test_f1: 0.6102
 epoch: 54, train_loss: 0.7166, test_loss: 0.9961, test_f1: 0.6152
 epoch: 55, train_loss: 0.7249, test_loss: 0.9163, test_f1: 0.6234
 epoch: 56, train_loss: 0.7126, test_loss: 0.9873, test_f1: 0.6385
 epoch: 57, train_loss: 0.6972, test_loss: 0.9900, test_f1: 0.5848
 epoch: 58, train_loss: 0.7183, test_loss: 1.0186, test_f1: 0.6271
 epoch: 59, train_loss: 0.6946, test_loss: 1.0116, test_f1: 0.6354
 epoch: 60, train_loss: 0.6992, test_loss: 0.9729, test_f1: 0.6240
 epoch: 61, train_loss: 0.6863, test_loss: 0.9739, test_f1: 0.6225
 epoch: 62, train_loss: 0.6794, test_loss: 0.9343, test_f1: 0.6027
 epoch: 63, train_loss: 0.6973, test_loss: 0.9785, test_f1: 0.6037
 epoch: 64, train_loss: 0.6954, test_loss: 1.0160, test_f1: 0.6115
 epoch: 65, train_loss: 0.6755, test_loss: 0.9726, test_f1: 0.6075
 epoch: 66, train_loss: 0.6908, test_loss: 0.9978, test_f1: 0.5736
 epoch: 67, train_loss: 0.6699, test_loss: 0.9478, test_f1: 0.6170
 epoch: 68, train_loss: 0.6784, test_loss: 0.9932, test_f1: 0.6020
 epoch: 69, train_loss: 0.6832, test_loss: 1.0672, test_f1: 0.6083
 epoch: 70, train_loss: 0.6820, test_loss: 0.9456, test_f1: 0.6219
 epoch: 71, train_loss: 0.6868, test_loss: 0.9969, test_f1: 0.5946
 epoch: 72, train_loss: 0.6723, test_loss: 0.9816, test_f1: 0.6012
 epoch: 73, train_loss: 0.6719, test_loss: 0.9697, test_f1: 0.6012
 epoch: 74, train_loss: 0.6636, test_loss: 0.9912, test_f1: 0.6029
 epoch: 75, train_loss: 0.6698, test_loss: 0.9052, test_f1: 0.6091
 epoch: 76, train_loss: 0.6773, test_loss: 0.9412, test_f1: 0.6100
 epoch: 77, train_loss: 0.6765, test_loss: 0.9527, test_f1: 0.6492
 epoch: 78, train_loss: 0.6615, test_loss: 0.9855, test_f1: 0.6235
 epoch: 79, train_loss: 0.6471, test_loss: 0.9655, test_f1: 0.6320
 epoch: 80, train_loss: 0.6655, test_loss: 0.9986, test_f1: 0.6313
 epoch: 81, train_loss: 0.6585, test_loss: 0.9630, test_f1: 0.6152
 epoch: 82, train_loss: 0.6593, test_loss: 1.0248, test_f1: 0.6414
 epoch: 83, train_loss: 0.6551, test_loss: 1.0299, test_f1: 0.5894
 epoch: 84, train_loss: 0.6477, test_loss: 1.0229, test_f1: 0.6432
 epoch: 85, train_loss: 0.6652, test_loss: 0.9799, test_f1: 0.5950
 epoch: 86, train_loss: 0.6396, test_loss: 0.9649, test_f1: 0.6402
 epoch: 87, train_loss: 0.6429, test_loss: 1.0457, test_f1: 0.6327
 epoch: 88, train_loss: 0.6511, test_loss: 0.9517, test_f1: 0.6138
 epoch: 89, train_loss: 0.6552, test_loss: 1.0032, test_f1: 0.6378
 epoch: 90, train_loss: 0.6295, test_loss: 1.0479, test_f1: 0.6214
 epoch: 91, train_loss: 0.6393, test_loss: 1.0498, test_f1: 0.6124
 epoch: 92, train_loss: 0.6403, test_loss: 1.0474, test_f1: 0.6253
 epoch: 93, train_loss: 0.6386, test_loss: 1.0934, test_f1: 0.6122
 epoch: 94, train_loss: 0.6362, test_loss: 1.0045, test_f1: 0.6381
 epoch: 95, train_loss: 0.6360, test_loss: 1.0591, test_f1: 0.6135
 epoch: 96, train_loss: 0.6467, test_loss: 0.9479, test_f1: 0.6340
 epoch: 97, train_loss: 0.6186, test_loss: 1.1288, test_f1: 0.6306
 epoch: 98, train_loss: 0.6253, test_loss: 1.0134, test_f1: 0.6192
 epoch: 99, train_loss: 0.6259, test_loss: 1.0688, test_f1: 0.6268
##################ITERATION #2 ****************************************
 epoch: 0, train_loss: 1.1603, test_loss: 1.0900, test_f1: 0.3824
 epoch: 1, train_loss: 1.0416, test_loss: 1.0549, test_f1: 0.3931
 epoch: 2, train_loss: 1.0057, test_loss: 1.0954, test_f1: 0.3752
 epoch: 3, train_loss: 0.9928, test_loss: 1.0775, test_f1: 0.4410
 epoch: 4, train_loss: 0.9751, test_loss: 0.9946, test_f1: 0.4903
 epoch: 5, train_loss: 0.9472, test_loss: 1.0363, test_f1: 0.4747
 epoch: 6, train_loss: 0.9574, test_loss: 1.0124, test_f1: 0.4161
 epoch: 7, train_loss: 0.9415, test_loss: 0.9260, test_f1: 0.5145
 epoch: 8, train_loss: 0.9345, test_loss: 0.9156, test_f1: 0.5536
 epoch: 9, train_loss: 0.9256, test_loss: 0.9573, test_f1: 0.5236
 epoch: 10, train_loss: 0.9282, test_loss: 0.9831, test_f1: 0.4582
 epoch: 11, train_loss: 0.9207, test_loss: 0.9568, test_f1: 0.5194
 epoch: 12, train_loss: 0.9103, test_loss: 0.9463, test_f1: 0.4737
 epoch: 13, train_loss: 0.8971, test_loss: 0.9789, test_f1: 0.5145
 epoch: 14, train_loss: 0.8971, test_loss: 0.9513, test_f1: 0.5338
 epoch: 15, train_loss: 0.8905, test_loss: 0.9841, test_f1: 0.4786
 epoch: 16, train_loss: 0.8948, test_loss: 0.9077, test_f1: 0.5665
 epoch: 17, train_loss: 0.8864, test_loss: 0.8851, test_f1: 0.4997
 epoch: 18, train_loss: 0.8778, test_loss: 0.8752, test_f1: 0.5154
 epoch: 19, train_loss: 0.8727, test_loss: 0.9217, test_f1: 0.5352
 epoch: 20, train_loss: 0.8669, test_loss: 0.9122, test_f1: 0.5018
 epoch: 21, train_loss: 0.8694, test_loss: 0.9152, test_f1: 0.5414
 epoch: 22, train_loss: 0.8691, test_loss: 0.9228, test_f1: 0.4922
 epoch: 23, train_loss: 0.8787, test_loss: 0.9367, test_f1: 0.5802
 epoch: 24, train_loss: 0.8713, test_loss: 0.8935, test_f1: 0.5294
 epoch: 25, train_loss: 0.8585, test_loss: 0.8954, test_f1: 0.5421
 epoch: 26, train_loss: 0.8470, test_loss: 0.8892, test_f1: 0.5267
 epoch: 27, train_loss: 0.8457, test_loss: 0.8760, test_f1: 0.5225
 epoch: 28, train_loss: 0.8386, test_loss: 0.9455, test_f1: 0.5639
 epoch: 29, train_loss: 0.8440, test_loss: 0.9206, test_f1: 0.5270
 epoch: 30, train_loss: 0.8528, test_loss: 0.9130, test_f1: 0.5328
 epoch: 31, train_loss: 0.8469, test_loss: 0.9716, test_f1: 0.4928
 epoch: 32, train_loss: 0.8216, test_loss: 0.8256, test_f1: 0.5842
 epoch: 33, train_loss: 0.8348, test_loss: 0.7862, test_f1: 0.5656
 epoch: 34, train_loss: 0.8329, test_loss: 0.8831, test_f1: 0.5469
 epoch: 35, train_loss: 0.8127, test_loss: 0.9176, test_f1: 0.5758
 epoch: 36, train_loss: 0.8157, test_loss: 0.9516, test_f1: 0.5373
 epoch: 37, train_loss: 0.8133, test_loss: 0.8848, test_f1: 0.5507
 epoch: 38, train_loss: 0.8045, test_loss: 0.9075, test_f1: 0.5849
 epoch: 39, train_loss: 0.8031, test_loss: 0.9163, test_f1: 0.5414
 epoch: 40, train_loss: 0.8026, test_loss: 0.8702, test_f1: 0.5794
 epoch: 41, train_loss: 0.7999, test_loss: 0.9102, test_f1: 0.5866
 epoch: 42, train_loss: 0.7790, test_loss: 0.8489, test_f1: 0.5968
 epoch: 43, train_loss: 0.7790, test_loss: 0.8760, test_f1: 0.5509
 epoch: 44, train_loss: 0.7893, test_loss: 0.8857, test_f1: 0.5877
 epoch: 45, train_loss: 0.7894, test_loss: 0.8549, test_f1: 0.5919
 epoch: 46, train_loss: 0.7725, test_loss: 0.8654, test_f1: 0.5911
 epoch: 47, train_loss: 0.7822, test_loss: 0.9800, test_f1: 0.5601
 epoch: 48, train_loss: 0.7968, test_loss: 0.9380, test_f1: 0.5681
 epoch: 49, train_loss: 0.7936, test_loss: 0.8478, test_f1: 0.5996
 epoch: 50, train_loss: 0.7717, test_loss: 0.8618, test_f1: 0.6136
 epoch: 51, train_loss: 0.7285, test_loss: 0.8657, test_f1: 0.6105
 epoch: 52, train_loss: 0.7265, test_loss: 0.8799, test_f1: 0.6594
 epoch: 53, train_loss: 0.7147, test_loss: 0.9169, test_f1: 0.6118
 epoch: 54, train_loss: 0.7120, test_loss: 0.8491, test_f1: 0.6576
 epoch: 55, train_loss: 0.7048, test_loss: 0.8844, test_f1: 0.6344
 epoch: 56, train_loss: 0.7044, test_loss: 0.8944, test_f1: 0.6264
 epoch: 57, train_loss: 0.7008, test_loss: 0.9087, test_f1: 0.5955
 epoch: 58, train_loss: 0.7102, test_loss: 0.9517, test_f1: 0.6009
 epoch: 59, train_loss: 0.7069, test_loss: 0.8641, test_f1: 0.6472
 epoch: 60, train_loss: 0.6784, test_loss: 0.8698, test_f1: 0.6707
 epoch: 61, train_loss: 0.6913, test_loss: 0.8900, test_f1: 0.6484
 epoch: 62, train_loss: 0.6884, test_loss: 0.8989, test_f1: 0.6514
 epoch: 63, train_loss: 0.6971, test_loss: 0.9230, test_f1: 0.6371
 epoch: 64, train_loss: 0.6840, test_loss: 0.9070, test_f1: 0.6639
 epoch: 65, train_loss: 0.6808, test_loss: 0.9227, test_f1: 0.6440
 epoch: 66, train_loss: 0.6950, test_loss: 0.9179, test_f1: 0.6427
 epoch: 67, train_loss: 0.6795, test_loss: 0.9289, test_f1: 0.6366
 epoch: 68, train_loss: 0.6825, test_loss: 0.8856, test_f1: 0.6466
 epoch: 69, train_loss: 0.6808, test_loss: 0.8546, test_f1: 0.6426
 epoch: 70, train_loss: 0.6881, test_loss: 1.0259, test_f1: 0.6407
 epoch: 71, train_loss: 0.6953, test_loss: 0.9932, test_f1: 0.6277
 epoch: 72, train_loss: 0.6687, test_loss: 0.9281, test_f1: 0.6501
 epoch: 73, train_loss: 0.6750, test_loss: 0.9002, test_f1: 0.6538
 epoch: 74, train_loss: 0.6731, test_loss: 1.0895, test_f1: 0.6387
 epoch: 75, train_loss: 0.6630, test_loss: 0.9168, test_f1: 0.6487
 epoch: 76, train_loss: 0.6712, test_loss: 0.9830, test_f1: 0.6382
 epoch: 77, train_loss: 0.6621, test_loss: 0.9164, test_f1: 0.6450
 epoch: 78, train_loss: 0.6734, test_loss: 0.8666, test_f1: 0.6561
 epoch: 79, train_loss: 0.6462, test_loss: 0.9443, test_f1: 0.6608
 epoch: 80, train_loss: 0.6737, test_loss: 0.9320, test_f1: 0.6693
 epoch: 81, train_loss: 0.6457, test_loss: 1.0119, test_f1: 0.6394
 epoch: 82, train_loss: 0.6528, test_loss: 1.0380, test_f1: 0.6535
 epoch: 83, train_loss: 0.6479, test_loss: 0.9400, test_f1: 0.6455
 epoch: 84, train_loss: 0.6521, test_loss: 0.9513, test_f1: 0.6538
 epoch: 85, train_loss: 0.6330, test_loss: 0.9595, test_f1: 0.6777
 epoch: 86, train_loss: 0.6475, test_loss: 0.9288, test_f1: 0.6412
 epoch: 87, train_loss: 0.6354, test_loss: 0.9904, test_f1: 0.6233
 epoch: 88, train_loss: 0.6347, test_loss: 0.9769, test_f1: 0.6413
 epoch: 89, train_loss: 0.6198, test_loss: 0.9638, test_f1: 0.6271
 epoch: 90, train_loss: 0.6473, test_loss: 0.8987, test_f1: 0.6633
 epoch: 91, train_loss: 0.6426, test_loss: 1.0272, test_f1: 0.6413
 epoch: 92, train_loss: 0.6392, test_loss: 0.9722, test_f1: 0.6661
 epoch: 93, train_loss: 0.6266, test_loss: 0.9372, test_f1: 0.6761
 epoch: 94, train_loss: 0.6271, test_loss: 0.9858, test_f1: 0.6485
 epoch: 95, train_loss: 0.6471, test_loss: 0.9140, test_f1: 0.6601
 epoch: 96, train_loss: 0.6376, test_loss: 0.9084, test_f1: 0.6570
 epoch: 97, train_loss: 0.6489, test_loss: 0.9506, test_f1: 0.6310
 epoch: 98, train_loss: 0.6242, test_loss: 0.9432, test_f1: 0.6465
 epoch: 99, train_loss: 0.6209, test_loss: 0.8903, test_f1: 0.6628
##################ITERATION #3 ****************************************
 epoch: 0, train_loss: 1.2084, test_loss: 1.0588, test_f1: 0.4449
 epoch: 1, train_loss: 1.0204, test_loss: 1.0125, test_f1: 0.4233
 epoch: 2, train_loss: 0.9967, test_loss: 0.9755, test_f1: 0.4923
 epoch: 3, train_loss: 0.9680, test_loss: 1.0663, test_f1: 0.4520
 epoch: 4, train_loss: 0.9532, test_loss: 0.9998, test_f1: 0.4638
 epoch: 5, train_loss: 0.9651, test_loss: 0.9701, test_f1: 0.4823
 epoch: 6, train_loss: 0.9452, test_loss: 0.9809, test_f1: 0.5354
 epoch: 7, train_loss: 0.9222, test_loss: 0.9801, test_f1: 0.4814
 epoch: 8, train_loss: 0.9127, test_loss: 0.9290, test_f1: 0.5648
 epoch: 9, train_loss: 0.9071, test_loss: 0.9243, test_f1: 0.5260
 epoch: 10, train_loss: 0.9138, test_loss: 1.0797, test_f1: 0.4805
 epoch: 11, train_loss: 0.9107, test_loss: 0.9557, test_f1: 0.5092
 epoch: 12, train_loss: 0.8816, test_loss: 1.0011, test_f1: 0.4803
 epoch: 13, train_loss: 0.8864, test_loss: 0.9267, test_f1: 0.4755
 epoch: 14, train_loss: 0.8802, test_loss: 0.9313, test_f1: 0.5144
 epoch: 15, train_loss: 0.8572, test_loss: 0.9713, test_f1: 0.5167
 epoch: 16, train_loss: 0.8634, test_loss: 0.9293, test_f1: 0.5216
 epoch: 17, train_loss: 0.8586, test_loss: 0.9253, test_f1: 0.5532
 epoch: 18, train_loss: 0.8516, test_loss: 0.9445, test_f1: 0.5586
 epoch: 19, train_loss: 0.8378, test_loss: 0.8993, test_f1: 0.5506
 epoch: 20, train_loss: 0.8385, test_loss: 0.9319, test_f1: 0.5365
 epoch: 21, train_loss: 0.8460, test_loss: 1.1631, test_f1: 0.4151
 epoch: 22, train_loss: 0.9074, test_loss: 0.9805, test_f1: 0.5138
 epoch: 23, train_loss: 0.8666, test_loss: 0.9473, test_f1: 0.5570
 epoch: 24, train_loss: 0.8550, test_loss: 0.9399, test_f1: 0.5310
 epoch: 25, train_loss: 0.8351, test_loss: 0.9914, test_f1: 0.5390
 epoch: 26, train_loss: 0.8100, test_loss: 0.9885, test_f1: 0.5439
 epoch: 27, train_loss: 0.8178, test_loss: 1.0276, test_f1: 0.5471
 epoch: 28, train_loss: 0.8228, test_loss: 0.8909, test_f1: 0.6265
 epoch: 29, train_loss: 0.8443, test_loss: 0.9522, test_f1: 0.5267
 epoch: 30, train_loss: 0.8248, test_loss: 0.9354, test_f1: 0.5851
 epoch: 31, train_loss: 0.8243, test_loss: 0.8978, test_f1: 0.5612
 epoch: 32, train_loss: 0.8014, test_loss: 0.9809, test_f1: 0.6095
 epoch: 33, train_loss: 0.8084, test_loss: 0.9366, test_f1: 0.5677
 epoch: 34, train_loss: 0.7974, test_loss: 0.9558, test_f1: 0.5335
 epoch: 35, train_loss: 0.8084, test_loss: 0.9310, test_f1: 0.5994
 epoch: 36, train_loss: 0.7846, test_loss: 0.9536, test_f1: 0.6100
 epoch: 37, train_loss: 0.7958, test_loss: 0.9233, test_f1: 0.5674
 epoch: 38, train_loss: 0.7729, test_loss: 0.9157, test_f1: 0.5887
 epoch: 39, train_loss: 0.7833, test_loss: 0.7889, test_f1: 0.6330
 epoch: 40, train_loss: 0.7780, test_loss: 0.9977, test_f1: 0.5546
 epoch: 41, train_loss: 0.8055, test_loss: 0.9378, test_f1: 0.6122
 epoch: 42, train_loss: 0.7821, test_loss: 0.9233, test_f1: 0.5676
 epoch: 43, train_loss: 0.7951, test_loss: 0.8910, test_f1: 0.6047
 epoch: 44, train_loss: 0.7729, test_loss: 0.9393, test_f1: 0.5768
 epoch: 45, train_loss: 0.7642, test_loss: 0.9471, test_f1: 0.5852
 epoch: 46, train_loss: 0.7591, test_loss: 0.9654, test_f1: 0.6323
 epoch: 47, train_loss: 0.7713, test_loss: 1.0598, test_f1: 0.6015
 epoch: 48, train_loss: 0.7401, test_loss: 0.9472, test_f1: 0.5992
 epoch: 49, train_loss: 0.7346, test_loss: 0.9493, test_f1: 0.5869
 epoch: 50, train_loss: 0.7572, test_loss: 0.8700, test_f1: 0.5779
 epoch: 51, train_loss: 0.7363, test_loss: 0.9516, test_f1: 0.6034
 epoch: 52, train_loss: 0.7096, test_loss: 1.0009, test_f1: 0.6434
 epoch: 53, train_loss: 0.6899, test_loss: 0.9286, test_f1: 0.6279
 epoch: 54, train_loss: 0.7181, test_loss: 0.9092, test_f1: 0.6078
 epoch: 55, train_loss: 0.6968, test_loss: 0.9823, test_f1: 0.6206
 epoch: 56, train_loss: 0.7041, test_loss: 0.9444, test_f1: 0.6276
 epoch: 57, train_loss: 0.6989, test_loss: 0.9282, test_f1: 0.6219
 epoch: 58, train_loss: 0.6926, test_loss: 0.9632, test_f1: 0.6754
 epoch: 59, train_loss: 0.6783, test_loss: 0.9535, test_f1: 0.6259
 epoch: 60, train_loss: 0.6811, test_loss: 0.9700, test_f1: 0.6013
 epoch: 61, train_loss: 0.6914, test_loss: 0.9423, test_f1: 0.6328
 epoch: 62, train_loss: 0.6797, test_loss: 0.9184, test_f1: 0.6246
 epoch: 63, train_loss: 0.6807, test_loss: 0.9941, test_f1: 0.6258
 epoch: 64, train_loss: 0.6727, test_loss: 1.0003, test_f1: 0.6490
 epoch: 65, train_loss: 0.6716, test_loss: 0.9502, test_f1: 0.6311
 epoch: 66, train_loss: 0.6792, test_loss: 0.9366, test_f1: 0.6018
 epoch: 67, train_loss: 0.6787, test_loss: 0.9546, test_f1: 0.6110
 epoch: 68, train_loss: 0.6846, test_loss: 0.9294, test_f1: 0.6203
 epoch: 69, train_loss: 0.6602, test_loss: 0.9068, test_f1: 0.6431
 epoch: 70, train_loss: 0.6669, test_loss: 0.9081, test_f1: 0.6376
 epoch: 71, train_loss: 0.6782, test_loss: 0.8993, test_f1: 0.6395
 epoch: 72, train_loss: 0.6380, test_loss: 0.9588, test_f1: 0.6558
 epoch: 73, train_loss: 0.6778, test_loss: 0.9648, test_f1: 0.6276
 epoch: 74, train_loss: 0.6619, test_loss: 0.9668, test_f1: 0.6118
 epoch: 75, train_loss: 0.6758, test_loss: 0.9700, test_f1: 0.6000
 epoch: 76, train_loss: 0.6495, test_loss: 1.0076, test_f1: 0.6037
 epoch: 77, train_loss: 0.6521, test_loss: 0.9343, test_f1: 0.6167
 epoch: 78, train_loss: 0.6600, test_loss: 1.0534, test_f1: 0.6519
 epoch: 79, train_loss: 0.6458, test_loss: 0.9535, test_f1: 0.6219
 epoch: 80, train_loss: 0.6621, test_loss: 0.9552, test_f1: 0.6252
 epoch: 81, train_loss: 0.6396, test_loss: 0.9370, test_f1: 0.6586
 epoch: 82, train_loss: 0.6330, test_loss: 0.9714, test_f1: 0.6362
 epoch: 83, train_loss: 0.6723, test_loss: 1.0228, test_f1: 0.6286
 epoch: 84, train_loss: 0.6540, test_loss: 1.0353, test_f1: 0.6487
 epoch: 85, train_loss: 0.6479, test_loss: 0.9309, test_f1: 0.6550
 epoch: 86, train_loss: 0.6499, test_loss: 1.0587, test_f1: 0.6596
 epoch: 87, train_loss: 0.6396, test_loss: 0.9910, test_f1: 0.6596
 epoch: 88, train_loss: 0.6330, test_loss: 0.9762, test_f1: 0.6581
 epoch: 89, train_loss: 0.6531, test_loss: 0.9535, test_f1: 0.6323
 epoch: 90, train_loss: 0.6498, test_loss: 1.0527, test_f1: 0.6419
 epoch: 91, train_loss: 0.6399, test_loss: 0.9933, test_f1: 0.6117
 epoch: 92, train_loss: 0.6383, test_loss: 0.9751, test_f1: 0.6250
 epoch: 93, train_loss: 0.6328, test_loss: 0.9923, test_f1: 0.6530
 epoch: 94, train_loss: 0.6441, test_loss: 0.9627, test_f1: 0.6282
 epoch: 95, train_loss: 0.6242, test_loss: 0.9784, test_f1: 0.6488
 epoch: 96, train_loss: 0.6071, test_loss: 0.9849, test_f1: 0.6440
 epoch: 97, train_loss: 0.6257, test_loss: 0.8755, test_f1: 0.6386
 epoch: 98, train_loss: 0.6230, test_loss: 0.9773, test_f1: 0.6406
 epoch: 99, train_loss: 0.6305, test_loss: 0.9367, test_f1: 0.6345
##################ITERATION #4 ****************************************
 epoch: 0, train_loss: 1.1969, test_loss: 1.0483, test_f1: 0.4363
 epoch: 1, train_loss: 1.0286, test_loss: 1.0151, test_f1: 0.4729
 epoch: 2, train_loss: 0.9819, test_loss: 0.9781, test_f1: 0.4987
 epoch: 3, train_loss: 0.9843, test_loss: 1.0117, test_f1: 0.4849
 epoch: 4, train_loss: 0.9609, test_loss: 0.9823, test_f1: 0.4719
 epoch: 5, train_loss: 0.9519, test_loss: 0.9502, test_f1: 0.4941
 epoch: 6, train_loss: 0.9406, test_loss: 0.9530, test_f1: 0.4780
 epoch: 7, train_loss: 0.9365, test_loss: 0.9506, test_f1: 0.5576
 epoch: 8, train_loss: 0.9223, test_loss: 0.9195, test_f1: 0.5191
 epoch: 9, train_loss: 0.9275, test_loss: 0.9877, test_f1: 0.4938
 epoch: 10, train_loss: 0.9124, test_loss: 1.0222, test_f1: 0.4946
 epoch: 11, train_loss: 0.8999, test_loss: 0.9616, test_f1: 0.5478
 epoch: 12, train_loss: 0.9003, test_loss: 0.9353, test_f1: 0.5610
 epoch: 13, train_loss: 0.8870, test_loss: 0.9345, test_f1: 0.5524
 epoch: 14, train_loss: 0.8899, test_loss: 1.0135, test_f1: 0.5317
 epoch: 15, train_loss: 0.8936, test_loss: 0.9647, test_f1: 0.5596
 epoch: 16, train_loss: 0.9111, test_loss: 0.9773, test_f1: 0.5560
 epoch: 17, train_loss: 0.8902, test_loss: 0.9472, test_f1: 0.5252
 epoch: 18, train_loss: 0.8765, test_loss: 0.9279, test_f1: 0.5380
 epoch: 19, train_loss: 0.8781, test_loss: 0.9117, test_f1: 0.5655
 epoch: 20, train_loss: 0.8759, test_loss: 0.9324, test_f1: 0.5327
 epoch: 21, train_loss: 0.8723, test_loss: 0.9678, test_f1: 0.5084
 epoch: 22, train_loss: 0.8585, test_loss: 0.9592, test_f1: 0.5764
 epoch: 23, train_loss: 0.8618, test_loss: 0.9184, test_f1: 0.5356
 epoch: 24, train_loss: 0.8689, test_loss: 0.9620, test_f1: 0.5619
 epoch: 25, train_loss: 0.8603, test_loss: 0.9454, test_f1: 0.5481
 epoch: 26, train_loss: 0.8456, test_loss: 0.9112, test_f1: 0.5616
 epoch: 27, train_loss: 0.8434, test_loss: 0.9381, test_f1: 0.5700
 epoch: 28, train_loss: 0.8448, test_loss: 0.9850, test_f1: 0.5348
 epoch: 29, train_loss: 0.8277, test_loss: 0.9256, test_f1: 0.5769
 epoch: 30, train_loss: 0.8289, test_loss: 0.9315, test_f1: 0.5600
 epoch: 31, train_loss: 0.8304, test_loss: 0.9513, test_f1: 0.5514
 epoch: 32, train_loss: 0.8022, test_loss: 1.0467, test_f1: 0.5043
 epoch: 33, train_loss: 0.8238, test_loss: 0.9585, test_f1: 0.5305
 epoch: 34, train_loss: 0.8118, test_loss: 0.9541, test_f1: 0.5552
 epoch: 35, train_loss: 0.8090, test_loss: 0.9288, test_f1: 0.5847
 epoch: 36, train_loss: 0.7906, test_loss: 0.9263, test_f1: 0.5493
 epoch: 37, train_loss: 0.8088, test_loss: 0.9938, test_f1: 0.5725
 epoch: 38, train_loss: 0.7839, test_loss: 0.9498, test_f1: 0.6307
 epoch: 39, train_loss: 0.7895, test_loss: 0.9818, test_f1: 0.5765
 epoch: 40, train_loss: 0.7684, test_loss: 0.9426, test_f1: 0.5754
 epoch: 41, train_loss: 0.7921, test_loss: 0.9436, test_f1: 0.6074
 epoch: 42, train_loss: 0.7995, test_loss: 0.9058, test_f1: 0.6037
 epoch: 43, train_loss: 0.7783, test_loss: 0.9288, test_f1: 0.5637
 epoch: 44, train_loss: 0.7806, test_loss: 0.9764, test_f1: 0.5920
 epoch: 45, train_loss: 0.7890, test_loss: 0.9705, test_f1: 0.5988
 epoch: 46, train_loss: 0.7676, test_loss: 0.9147, test_f1: 0.6105
 epoch: 47, train_loss: 0.7580, test_loss: 0.9119, test_f1: 0.5694
 epoch: 48, train_loss: 0.7688, test_loss: 1.0108, test_f1: 0.5950
 epoch: 49, train_loss: 0.7614, test_loss: 0.9243, test_f1: 0.6183
 epoch: 50, train_loss: 0.7515, test_loss: 0.9233, test_f1: 0.5954
 epoch: 51, train_loss: 0.7278, test_loss: 0.9696, test_f1: 0.6100
 epoch: 52, train_loss: 0.7038, test_loss: 0.9754, test_f1: 0.5874
 epoch: 53, train_loss: 0.7077, test_loss: 0.9852, test_f1: 0.5813
 epoch: 54, train_loss: 0.7185, test_loss: 0.9885, test_f1: 0.6008
 epoch: 55, train_loss: 0.6962, test_loss: 0.9681, test_f1: 0.6171
 epoch: 56, train_loss: 0.7038, test_loss: 0.9936, test_f1: 0.6126
 epoch: 57, train_loss: 0.6945, test_loss: 0.9755, test_f1: 0.6191
 epoch: 58, train_loss: 0.6853, test_loss: 0.9835, test_f1: 0.6323
 epoch: 59, train_loss: 0.6959, test_loss: 0.9678, test_f1: 0.6362
 epoch: 60, train_loss: 0.7008, test_loss: 0.9569, test_f1: 0.6336
 epoch: 61, train_loss: 0.6834, test_loss: 0.9302, test_f1: 0.6515
 epoch: 62, train_loss: 0.6821, test_loss: 0.9785, test_f1: 0.6202
 epoch: 63, train_loss: 0.6680, test_loss: 0.9565, test_f1: 0.6259
 epoch: 64, train_loss: 0.6742, test_loss: 0.9316, test_f1: 0.6290
 epoch: 65, train_loss: 0.6630, test_loss: 0.9875, test_f1: 0.6012
 epoch: 66, train_loss: 0.6698, test_loss: 1.0131, test_f1: 0.6349
 epoch: 67, train_loss: 0.6779, test_loss: 1.0572, test_f1: 0.6308
 epoch: 68, train_loss: 0.6901, test_loss: 1.0146, test_f1: 0.6224
 epoch: 69, train_loss: 0.6679, test_loss: 0.9354, test_f1: 0.6372
 epoch: 70, train_loss: 0.6585, test_loss: 0.9453, test_f1: 0.6351
 epoch: 71, train_loss: 0.6793, test_loss: 1.0085, test_f1: 0.6247
 epoch: 72, train_loss: 0.6643, test_loss: 0.9377, test_f1: 0.6587
 epoch: 73, train_loss: 0.6533, test_loss: 0.9352, test_f1: 0.6521
 epoch: 74, train_loss: 0.6687, test_loss: 0.9739, test_f1: 0.5960
 epoch: 75, train_loss: 0.6652, test_loss: 0.9582, test_f1: 0.6256
 epoch: 76, train_loss: 0.6583, test_loss: 0.9897, test_f1: 0.6643
 epoch: 77, train_loss: 0.6449, test_loss: 1.0379, test_f1: 0.6493
 epoch: 78, train_loss: 0.6504, test_loss: 1.0756, test_f1: 0.6422
 epoch: 79, train_loss: 0.6451, test_loss: 1.0721, test_f1: 0.6154
 epoch: 80, train_loss: 0.6381, test_loss: 1.0430, test_f1: 0.6379
 epoch: 81, train_loss: 0.6417, test_loss: 1.1010, test_f1: 0.5912
 epoch: 82, train_loss: 0.6476, test_loss: 1.0139, test_f1: 0.6437
 epoch: 83, train_loss: 0.6618, test_loss: 1.0324, test_f1: 0.6122
 epoch: 84, train_loss: 0.6396, test_loss: 1.0647, test_f1: 0.6387
 epoch: 85, train_loss: 0.6477, test_loss: 1.0285, test_f1: 0.6324
 epoch: 86, train_loss: 0.6356, test_loss: 0.9931, test_f1: 0.6373
 epoch: 87, train_loss: 0.6259, test_loss: 0.9573, test_f1: 0.6331
 epoch: 88, train_loss: 0.6349, test_loss: 1.0283, test_f1: 0.6730
 epoch: 89, train_loss: 0.6313, test_loss: 1.0116, test_f1: 0.6528
 epoch: 90, train_loss: 0.6195, test_loss: 0.9768, test_f1: 0.6342
 epoch: 91, train_loss: 0.6423, test_loss: 1.0428, test_f1: 0.6486
 epoch: 92, train_loss: 0.6147, test_loss: 1.0470, test_f1: 0.6299
 epoch: 93, train_loss: 0.6098, test_loss: 1.0121, test_f1: 0.6182
 epoch: 94, train_loss: 0.6323, test_loss: 1.0165, test_f1: 0.6576
 epoch: 95, train_loss: 0.6289, test_loss: 1.0189, test_f1: 0.6634
 epoch: 96, train_loss: 0.6316, test_loss: 1.0514, test_f1: 0.6237
 epoch: 97, train_loss: 0.6309, test_loss: 1.0601, test_f1: 0.6714
 epoch: 98, train_loss: 0.6299, test_loss: 1.0197, test_f1: 0.6467
 epoch: 99, train_loss: 0.6280, test_loss: 1.0743, test_f1: 0.6674
##################ITERATION #5 ****************************************
 epoch: 0, train_loss: 1.1929, test_loss: 1.1182, test_f1: 0.4212
 epoch: 1, train_loss: 1.0383, test_loss: 1.0300, test_f1: 0.4480
 epoch: 2, train_loss: 1.0112, test_loss: 1.0072, test_f1: 0.4802
 epoch: 3, train_loss: 1.0019, test_loss: 1.0195, test_f1: 0.4930
 epoch: 4, train_loss: 0.9796, test_loss: 1.0132, test_f1: 0.4823
 epoch: 5, train_loss: 0.9722, test_loss: 1.0136, test_f1: 0.5130
 epoch: 6, train_loss: 0.9734, test_loss: 1.0710, test_f1: 0.4306
 epoch: 7, train_loss: 0.9912, test_loss: 0.9640, test_f1: 0.4847
 epoch: 8, train_loss: 0.9534, test_loss: 0.9550, test_f1: 0.5384
 epoch: 9, train_loss: 0.9522, test_loss: 1.0035, test_f1: 0.4640
 epoch: 10, train_loss: 0.9279, test_loss: 0.9610, test_f1: 0.5166
 epoch: 11, train_loss: 0.9278, test_loss: 0.9604, test_f1: 0.5256
 epoch: 12, train_loss: 0.9279, test_loss: 0.9659, test_f1: 0.4997
 epoch: 13, train_loss: 0.9443, test_loss: 1.0262, test_f1: 0.4902
 epoch: 14, train_loss: 0.9184, test_loss: 0.9038, test_f1: 0.4925
 epoch: 15, train_loss: 0.9062, test_loss: 0.9895, test_f1: 0.5005
 epoch: 16, train_loss: 0.9075, test_loss: 0.9316, test_f1: 0.5078
 epoch: 17, train_loss: 0.9005, test_loss: 0.9443, test_f1: 0.4942
 epoch: 18, train_loss: 0.8909, test_loss: 0.9803, test_f1: 0.5076
 epoch: 19, train_loss: 0.8881, test_loss: 0.8949, test_f1: 0.5337
 epoch: 20, train_loss: 0.8732, test_loss: 0.9160, test_f1: 0.5624
 epoch: 21, train_loss: 0.8734, test_loss: 0.8805, test_f1: 0.5200
 epoch: 22, train_loss: 0.8775, test_loss: 0.9158, test_f1: 0.5218
 epoch: 23, train_loss: 0.8628, test_loss: 0.9417, test_f1: 0.5432
 epoch: 24, train_loss: 0.8777, test_loss: 0.9493, test_f1: 0.5152
 epoch: 25, train_loss: 0.8678, test_loss: 0.9854, test_f1: 0.4817
 epoch: 26, train_loss: 0.8588, test_loss: 0.9127, test_f1: 0.5252
 epoch: 27, train_loss: 0.8605, test_loss: 0.9384, test_f1: 0.5076
 epoch: 28, train_loss: 0.8510, test_loss: 0.9340, test_f1: 0.5608
 epoch: 29, train_loss: 0.8485, test_loss: 0.8555, test_f1: 0.5673
 epoch: 30, train_loss: 0.8493, test_loss: 0.9365, test_f1: 0.5525
 epoch: 31, train_loss: 0.8335, test_loss: 1.0069, test_f1: 0.5049
 epoch: 32, train_loss: 0.8387, test_loss: 0.9183, test_f1: 0.5596
 epoch: 33, train_loss: 0.8323, test_loss: 0.9048, test_f1: 0.5454
 epoch: 34, train_loss: 0.8254, test_loss: 0.9105, test_f1: 0.5717
 epoch: 35, train_loss: 0.8280, test_loss: 0.8903, test_f1: 0.5429
 epoch: 36, train_loss: 0.8261, test_loss: 0.9327, test_f1: 0.5167
 epoch: 37, train_loss: 0.8322, test_loss: 0.9021, test_f1: 0.5519
 epoch: 38, train_loss: 0.8202, test_loss: 0.9579, test_f1: 0.5518
 epoch: 39, train_loss: 0.8181, test_loss: 0.9143, test_f1: 0.6008
 epoch: 40, train_loss: 0.8133, test_loss: 0.8994, test_f1: 0.5890
 epoch: 41, train_loss: 0.8263, test_loss: 0.8857, test_f1: 0.5479
 epoch: 42, train_loss: 0.8192, test_loss: 0.9301, test_f1: 0.5456
 epoch: 43, train_loss: 0.8153, test_loss: 0.8347, test_f1: 0.5689
 epoch: 44, train_loss: 0.8005, test_loss: 0.8347, test_f1: 0.5469
 epoch: 45, train_loss: 0.7885, test_loss: 0.9229, test_f1: 0.5285
 epoch: 46, train_loss: 0.7939, test_loss: 0.9245, test_f1: 0.5595
 epoch: 47, train_loss: 0.7793, test_loss: 0.9194, test_f1: 0.6054
 epoch: 48, train_loss: 0.7771, test_loss: 0.9514, test_f1: 0.5812
 epoch: 49, train_loss: 0.7854, test_loss: 0.9865, test_f1: 0.5774
 epoch: 50, train_loss: 0.7698, test_loss: 0.9740, test_f1: 0.5580
 epoch: 51, train_loss: 0.7609, test_loss: 0.9739, test_f1: 0.5769
 epoch: 52, train_loss: 0.7480, test_loss: 0.9112, test_f1: 0.5801
 epoch: 53, train_loss: 0.7318, test_loss: 0.9083, test_f1: 0.5821
 epoch: 54, train_loss: 0.7258, test_loss: 0.9512, test_f1: 0.6174
 epoch: 55, train_loss: 0.7259, test_loss: 0.9483, test_f1: 0.6029
 epoch: 56, train_loss: 0.7211, test_loss: 0.8976, test_f1: 0.6093
 epoch: 57, train_loss: 0.7280, test_loss: 0.9009, test_f1: 0.6206
 epoch: 58, train_loss: 0.7128, test_loss: 0.8721, test_f1: 0.5813
 epoch: 59, train_loss: 0.7139, test_loss: 0.9606, test_f1: 0.5668
 epoch: 60, train_loss: 0.7290, test_loss: 0.9126, test_f1: 0.6026
 epoch: 61, train_loss: 0.7259, test_loss: 0.9601, test_f1: 0.5957
 epoch: 62, train_loss: 0.6945, test_loss: 0.9209, test_f1: 0.6014
 epoch: 63, train_loss: 0.7138, test_loss: 0.9089, test_f1: 0.5809
 epoch: 64, train_loss: 0.7107, test_loss: 0.9352, test_f1: 0.5936
 epoch: 65, train_loss: 0.7007, test_loss: 0.9757, test_f1: 0.5832
 epoch: 66, train_loss: 0.6864, test_loss: 0.9098, test_f1: 0.5820
 epoch: 67, train_loss: 0.7044, test_loss: 0.9666, test_f1: 0.5916
 epoch: 68, train_loss: 0.6911, test_loss: 0.9134, test_f1: 0.5955
 epoch: 69, train_loss: 0.6885, test_loss: 0.9514, test_f1: 0.5934
 epoch: 70, train_loss: 0.6986, test_loss: 0.9143, test_f1: 0.5789
 epoch: 71, train_loss: 0.6917, test_loss: 0.9764, test_f1: 0.5631
 epoch: 72, train_loss: 0.6923, test_loss: 0.9577, test_f1: 0.5992
 epoch: 73, train_loss: 0.6919, test_loss: 0.9517, test_f1: 0.5993
 epoch: 74, train_loss: 0.6875, test_loss: 0.9361, test_f1: 0.6189
 epoch: 75, train_loss: 0.6948, test_loss: 0.9183, test_f1: 0.6308
 epoch: 76, train_loss: 0.6906, test_loss: 0.8777, test_f1: 0.6274
 epoch: 77, train_loss: 0.6850, test_loss: 0.9561, test_f1: 0.6108
 epoch: 78, train_loss: 0.6829, test_loss: 0.9688, test_f1: 0.5910
 epoch: 79, train_loss: 0.6779, test_loss: 0.9115, test_f1: 0.6420
 epoch: 80, train_loss: 0.6770, test_loss: 0.9113, test_f1: 0.5953
 epoch: 81, train_loss: 0.6668, test_loss: 0.9251, test_f1: 0.6036
 epoch: 82, train_loss: 0.6756, test_loss: 1.0227, test_f1: 0.5952
 epoch: 83, train_loss: 0.6913, test_loss: 0.9948, test_f1: 0.6017
 epoch: 84, train_loss: 0.6832, test_loss: 1.0111, test_f1: 0.5741
 epoch: 85, train_loss: 0.6596, test_loss: 0.8404, test_f1: 0.5897
 epoch: 86, train_loss: 0.6535, test_loss: 0.9467, test_f1: 0.6332
 epoch: 87, train_loss: 0.6709, test_loss: 0.9805, test_f1: 0.6395
 epoch: 88, train_loss: 0.6730, test_loss: 0.9433, test_f1: 0.6228
 epoch: 89, train_loss: 0.6636, test_loss: 0.8980, test_f1: 0.6328
 epoch: 90, train_loss: 0.6858, test_loss: 1.0005, test_f1: 0.5854
 epoch: 91, train_loss: 0.6508, test_loss: 0.9492, test_f1: 0.6402
 epoch: 92, train_loss: 0.6676, test_loss: 0.9411, test_f1: 0.6064
 epoch: 93, train_loss: 0.6736, test_loss: 0.8919, test_f1: 0.6423
 epoch: 94, train_loss: 0.6637, test_loss: 0.9104, test_f1: 0.6514
 epoch: 95, train_loss: 0.6546, test_loss: 0.9093, test_f1: 0.6245
 epoch: 96, train_loss: 0.6526, test_loss: 0.9190, test_f1: 0.6288
 epoch: 97, train_loss: 0.6340, test_loss: 0.9124, test_f1: 0.6532
 epoch: 98, train_loss: 0.6444, test_loss: 0.9813, test_f1: 0.6058
 epoch: 99, train_loss: 0.6349, test_loss: 0.9238, test_f1: 0.6253
##################ITERATION #6 ****************************************
 epoch: 0, train_loss: 1.2421, test_loss: 1.1277, test_f1: 0.3542
 epoch: 1, train_loss: 1.0954, test_loss: 1.0528, test_f1: 0.4361
 epoch: 2, train_loss: 1.0350, test_loss: 1.0029, test_f1: 0.4886
 epoch: 3, train_loss: 1.0069, test_loss: 0.9778, test_f1: 0.4849
 epoch: 4, train_loss: 0.9799, test_loss: 0.9872, test_f1: 0.5185
 epoch: 5, train_loss: 1.0008, test_loss: 0.9956, test_f1: 0.4858
 epoch: 6, train_loss: 0.9809, test_loss: 1.0477, test_f1: 0.4513
 epoch: 7, train_loss: 0.9678, test_loss: 0.9573, test_f1: 0.4790
 epoch: 8, train_loss: 0.9598, test_loss: 0.9716, test_f1: 0.4949
 epoch: 9, train_loss: 0.9464, test_loss: 0.9620, test_f1: 0.5001
 epoch: 10, train_loss: 0.9436, test_loss: 0.9522, test_f1: 0.5531
 epoch: 11, train_loss: 0.9330, test_loss: 0.9427, test_f1: 0.5243
 epoch: 12, train_loss: 0.9210, test_loss: 0.9514, test_f1: 0.5396
 epoch: 13, train_loss: 0.9143, test_loss: 0.9115, test_f1: 0.5260
 epoch: 14, train_loss: 0.9001, test_loss: 0.9230, test_f1: 0.5267
 epoch: 15, train_loss: 0.8972, test_loss: 0.9779, test_f1: 0.5284
 epoch: 16, train_loss: 0.8869, test_loss: 0.9037, test_f1: 0.5075
 epoch: 17, train_loss: 0.8710, test_loss: 0.8974, test_f1: 0.5428
 epoch: 18, train_loss: 0.8632, test_loss: 0.9362, test_f1: 0.5544
 epoch: 19, train_loss: 0.8860, test_loss: 0.9138, test_f1: 0.5515
 epoch: 20, train_loss: 0.8711, test_loss: 0.9916, test_f1: 0.4983
 epoch: 21, train_loss: 0.8702, test_loss: 0.9797, test_f1: 0.5444
 epoch: 22, train_loss: 0.8583, test_loss: 0.9446, test_f1: 0.5736
 epoch: 23, train_loss: 0.8538, test_loss: 0.9721, test_f1: 0.6013
 epoch: 24, train_loss: 0.8635, test_loss: 0.9496, test_f1: 0.5091
 epoch: 25, train_loss: 0.8469, test_loss: 0.9198, test_f1: 0.5689
 epoch: 26, train_loss: 0.8318, test_loss: 0.9478, test_f1: 0.5170
 epoch: 27, train_loss: 0.8398, test_loss: 0.9154, test_f1: 0.5672
 epoch: 28, train_loss: 0.8307, test_loss: 0.9759, test_f1: 0.5188
 epoch: 29, train_loss: 0.8212, test_loss: 0.9038, test_f1: 0.5845
 epoch: 30, train_loss: 0.8151, test_loss: 0.9050, test_f1: 0.6124
 epoch: 31, train_loss: 0.8131, test_loss: 0.9126, test_f1: 0.5766
 epoch: 32, train_loss: 0.8087, test_loss: 0.9041, test_f1: 0.5873
 epoch: 33, train_loss: 0.8203, test_loss: 0.9020, test_f1: 0.5698
 epoch: 34, train_loss: 0.8285, test_loss: 1.0524, test_f1: 0.5580
 epoch: 35, train_loss: 0.8098, test_loss: 0.9681, test_f1: 0.5584
 epoch: 36, train_loss: 0.8183, test_loss: 0.9194, test_f1: 0.5814
 epoch: 37, train_loss: 0.7928, test_loss: 0.9032, test_f1: 0.5863
 epoch: 38, train_loss: 0.7925, test_loss: 0.9521, test_f1: 0.5789
 epoch: 39, train_loss: 0.8104, test_loss: 0.9383, test_f1: 0.5864
 epoch: 40, train_loss: 0.8098, test_loss: 0.8871, test_f1: 0.6008
 epoch: 41, train_loss: 0.7998, test_loss: 0.8698, test_f1: 0.5910
 epoch: 42, train_loss: 0.8084, test_loss: 0.9074, test_f1: 0.5524
 epoch: 43, train_loss: 0.8044, test_loss: 0.8631, test_f1: 0.5927
 epoch: 44, train_loss: 0.7920, test_loss: 0.9603, test_f1: 0.5731
 epoch: 45, train_loss: 0.7997, test_loss: 0.8947, test_f1: 0.5940
 epoch: 46, train_loss: 0.7682, test_loss: 0.9805, test_f1: 0.5995
 epoch: 47, train_loss: 0.7736, test_loss: 0.9158, test_f1: 0.5688
 epoch: 48, train_loss: 0.7824, test_loss: 0.8730, test_f1: 0.5872
 epoch: 49, train_loss: 0.7789, test_loss: 0.9380, test_f1: 0.5958
 epoch: 50, train_loss: 0.7566, test_loss: 0.9972, test_f1: 0.5565
 epoch: 51, train_loss: 0.7598, test_loss: 0.8862, test_f1: 0.6122
 epoch: 52, train_loss: 0.7288, test_loss: 0.9309, test_f1: 0.5884
 epoch: 53, train_loss: 0.7352, test_loss: 0.9025, test_f1: 0.6056
 epoch: 54, train_loss: 0.7301, test_loss: 0.9351, test_f1: 0.5813
 epoch: 55, train_loss: 0.7231, test_loss: 0.9689, test_f1: 0.5921
 epoch: 56, train_loss: 0.7140, test_loss: 0.9534, test_f1: 0.6807
 epoch: 57, train_loss: 0.7155, test_loss: 0.9301, test_f1: 0.6099
 epoch: 58, train_loss: 0.7195, test_loss: 0.9841, test_f1: 0.6246
 epoch: 59, train_loss: 0.7025, test_loss: 0.9436, test_f1: 0.5992
 epoch: 60, train_loss: 0.7115, test_loss: 0.9854, test_f1: 0.6189
 epoch: 61, train_loss: 0.7141, test_loss: 0.9674, test_f1: 0.6398
 epoch: 62, train_loss: 0.7156, test_loss: 0.9633, test_f1: 0.6438
 epoch: 63, train_loss: 0.7099, test_loss: 1.0228, test_f1: 0.6412
 epoch: 64, train_loss: 0.7214, test_loss: 0.9645, test_f1: 0.6445
 epoch: 65, train_loss: 0.7023, test_loss: 0.9665, test_f1: 0.6482
 epoch: 66, train_loss: 0.7004, test_loss: 0.9475, test_f1: 0.6471
 epoch: 67, train_loss: 0.6963, test_loss: 0.9271, test_f1: 0.6458
 epoch: 68, train_loss: 0.7053, test_loss: 0.9876, test_f1: 0.5954
 epoch: 69, train_loss: 0.7021, test_loss: 0.9370, test_f1: 0.6526
 epoch: 70, train_loss: 0.7020, test_loss: 0.9834, test_f1: 0.6399
 epoch: 71, train_loss: 0.6842, test_loss: 0.9879, test_f1: 0.6140
 epoch: 72, train_loss: 0.7028, test_loss: 0.9848, test_f1: 0.6089
 epoch: 73, train_loss: 0.7121, test_loss: 0.9909, test_f1: 0.6613
 epoch: 74, train_loss: 0.6900, test_loss: 0.9796, test_f1: 0.6281
 epoch: 75, train_loss: 0.6828, test_loss: 1.0552, test_f1: 0.5946
 epoch: 76, train_loss: 0.6956, test_loss: 0.9988, test_f1: 0.6564
 epoch: 77, train_loss: 0.6866, test_loss: 1.0329, test_f1: 0.6310
 epoch: 78, train_loss: 0.6964, test_loss: 1.0754, test_f1: 0.6200
 epoch: 79, train_loss: 0.6943, test_loss: 1.0773, test_f1: 0.6350
 epoch: 80, train_loss: 0.6779, test_loss: 1.0775, test_f1: 0.6381
 epoch: 81, train_loss: 0.6802, test_loss: 1.0397, test_f1: 0.6237
 epoch: 82, train_loss: 0.6734, test_loss: 1.1330, test_f1: 0.5766
 epoch: 83, train_loss: 0.6752, test_loss: 1.1068, test_f1: 0.6556
 epoch: 84, train_loss: 0.6866, test_loss: 1.0397, test_f1: 0.6386
 epoch: 85, train_loss: 0.6770, test_loss: 1.0497, test_f1: 0.6162
 epoch: 86, train_loss: 0.6804, test_loss: 1.0490, test_f1: 0.6550
 epoch: 87, train_loss: 0.6837, test_loss: 1.0647, test_f1: 0.6477
 epoch: 88, train_loss: 0.6763, test_loss: 1.0341, test_f1: 0.6378
 epoch: 89, train_loss: 0.6740, test_loss: 1.0159, test_f1: 0.6539
 epoch: 90, train_loss: 0.6632, test_loss: 1.0620, test_f1: 0.6435
 epoch: 91, train_loss: 0.6627, test_loss: 1.0752, test_f1: 0.6306
 epoch: 92, train_loss: 0.6568, test_loss: 1.0713, test_f1: 0.6453
 epoch: 93, train_loss: 0.6755, test_loss: 1.0230, test_f1: 0.6293
 epoch: 94, train_loss: 0.6784, test_loss: 1.0413, test_f1: 0.6253
 epoch: 95, train_loss: 0.6664, test_loss: 1.0002, test_f1: 0.6378
 epoch: 96, train_loss: 0.6520, test_loss: 1.1220, test_f1: 0.6389
 epoch: 97, train_loss: 0.6580, test_loss: 1.0718, test_f1: 0.6244
 epoch: 98, train_loss: 0.6619, test_loss: 0.9839, test_f1: 0.6533
 epoch: 99, train_loss: 0.6638, test_loss: 0.9930, test_f1: 0.6558
##################ITERATION #7 ****************************************
 epoch: 0, train_loss: 1.2233, test_loss: 1.1030, test_f1: 0.4596
 epoch: 1, train_loss: 1.0520, test_loss: 1.0515, test_f1: 0.4525
 epoch: 2, train_loss: 0.9972, test_loss: 1.0478, test_f1: 0.4439
 epoch: 3, train_loss: 0.9831, test_loss: 1.0296, test_f1: 0.4776
 epoch: 4, train_loss: 0.9778, test_loss: 0.9892, test_f1: 0.4883
 epoch: 5, train_loss: 0.9610, test_loss: 1.0445, test_f1: 0.4690
 epoch: 6, train_loss: 0.9489, test_loss: 1.0578, test_f1: 0.4800
 epoch: 7, train_loss: 0.9549, test_loss: 0.9913, test_f1: 0.5067
 epoch: 8, train_loss: 0.9490, test_loss: 0.9806, test_f1: 0.4931
 epoch: 9, train_loss: 0.9346, test_loss: 1.0983, test_f1: 0.4804
 epoch: 10, train_loss: 0.9230, test_loss: 1.0183, test_f1: 0.5018
 epoch: 11, train_loss: 0.9299, test_loss: 1.0562, test_f1: 0.4903
 epoch: 12, train_loss: 0.9098, test_loss: 0.9996, test_f1: 0.4928
 epoch: 13, train_loss: 0.9032, test_loss: 0.9957, test_f1: 0.5116
 epoch: 14, train_loss: 0.8967, test_loss: 1.0388, test_f1: 0.5047
 epoch: 15, train_loss: 0.9054, test_loss: 0.9759, test_f1: 0.5177
 epoch: 16, train_loss: 0.8859, test_loss: 1.1420, test_f1: 0.4763
 epoch: 17, train_loss: 0.8834, test_loss: 1.0063, test_f1: 0.5197
 epoch: 18, train_loss: 0.8864, test_loss: 1.0534, test_f1: 0.5143
 epoch: 19, train_loss: 0.8995, test_loss: 1.0127, test_f1: 0.5001
 epoch: 20, train_loss: 0.8800, test_loss: 1.0273, test_f1: 0.5243
 epoch: 21, train_loss: 0.8734, test_loss: 1.0023, test_f1: 0.4969
 epoch: 22, train_loss: 0.8653, test_loss: 1.0651, test_f1: 0.5010
 epoch: 23, train_loss: 0.8459, test_loss: 1.0230, test_f1: 0.5495
 epoch: 24, train_loss: 0.8415, test_loss: 1.0277, test_f1: 0.5131
 epoch: 25, train_loss: 0.8223, test_loss: 1.0425, test_f1: 0.5514
 epoch: 26, train_loss: 0.8305, test_loss: 1.0086, test_f1: 0.5294
 epoch: 27, train_loss: 0.8149, test_loss: 0.9967, test_f1: 0.5167
 epoch: 28, train_loss: 0.8162, test_loss: 1.0474, test_f1: 0.5288
 epoch: 29, train_loss: 0.8239, test_loss: 1.1103, test_f1: 0.5170
 epoch: 30, train_loss: 0.8030, test_loss: 1.0176, test_f1: 0.5746
 epoch: 31, train_loss: 0.7823, test_loss: 1.0456, test_f1: 0.5569
 epoch: 32, train_loss: 0.8078, test_loss: 1.0056, test_f1: 0.5782
 epoch: 33, train_loss: 0.8067, test_loss: 0.9565, test_f1: 0.5377
 epoch: 34, train_loss: 0.8004, test_loss: 0.9569, test_f1: 0.5329
 epoch: 35, train_loss: 0.7859, test_loss: 0.9979, test_f1: 0.5632
 epoch: 36, train_loss: 0.7819, test_loss: 0.9846, test_f1: 0.5846
 epoch: 37, train_loss: 0.7876, test_loss: 0.9990, test_f1: 0.5592
 epoch: 38, train_loss: 0.7677, test_loss: 1.0565, test_f1: 0.5628
 epoch: 39, train_loss: 0.7778, test_loss: 0.9979, test_f1: 0.6226
 epoch: 40, train_loss: 0.7504, test_loss: 1.1047, test_f1: 0.5884
 epoch: 41, train_loss: 0.7693, test_loss: 1.0903, test_f1: 0.5250
 epoch: 42, train_loss: 0.7662, test_loss: 0.9517, test_f1: 0.5918
 epoch: 43, train_loss: 0.7877, test_loss: 1.0511, test_f1: 0.5566
 epoch: 44, train_loss: 0.7644, test_loss: 1.0674, test_f1: 0.6076
 epoch: 45, train_loss: 0.7728, test_loss: 1.0515, test_f1: 0.6262
 epoch: 46, train_loss: 0.7519, test_loss: 0.9530, test_f1: 0.6314
 epoch: 47, train_loss: 0.7642, test_loss: 0.9968, test_f1: 0.6026
 epoch: 48, train_loss: 0.7567, test_loss: 1.0011, test_f1: 0.5696
 epoch: 49, train_loss: 0.7680, test_loss: 1.0670, test_f1: 0.5907
 epoch: 50, train_loss: 0.7435, test_loss: 1.0042, test_f1: 0.6318
 epoch: 51, train_loss: 0.7285, test_loss: 1.0301, test_f1: 0.6054
 epoch: 52, train_loss: 0.7017, test_loss: 0.9948, test_f1: 0.6195
 epoch: 53, train_loss: 0.6877, test_loss: 1.0392, test_f1: 0.5965
 epoch: 54, train_loss: 0.6913, test_loss: 1.0062, test_f1: 0.6113
 epoch: 55, train_loss: 0.6688, test_loss: 1.0607, test_f1: 0.6064
 epoch: 56, train_loss: 0.6845, test_loss: 1.0662, test_f1: 0.5992
 epoch: 57, train_loss: 0.6830, test_loss: 1.0970, test_f1: 0.6153
 epoch: 58, train_loss: 0.6725, test_loss: 1.0352, test_f1: 0.6512
 epoch: 59, train_loss: 0.6666, test_loss: 1.0526, test_f1: 0.6349
 epoch: 60, train_loss: 0.6841, test_loss: 1.1568, test_f1: 0.6652
 epoch: 61, train_loss: 0.6818, test_loss: 1.0528, test_f1: 0.6136
 epoch: 62, train_loss: 0.6709, test_loss: 1.0389, test_f1: 0.6114
 epoch: 63, train_loss: 0.6643, test_loss: 1.0852, test_f1: 0.6045
 epoch: 64, train_loss: 0.6597, test_loss: 0.9837, test_f1: 0.6185
 epoch: 65, train_loss: 0.6577, test_loss: 1.1134, test_f1: 0.5864
 epoch: 66, train_loss: 0.6682, test_loss: 1.1044, test_f1: 0.6535
 epoch: 67, train_loss: 0.6620, test_loss: 0.9864, test_f1: 0.6085
 epoch: 68, train_loss: 0.6601, test_loss: 1.0395, test_f1: 0.5772
 epoch: 69, train_loss: 0.6544, test_loss: 1.0337, test_f1: 0.6297
 epoch: 70, train_loss: 0.6594, test_loss: 1.0849, test_f1: 0.6182
 epoch: 71, train_loss: 0.6484, test_loss: 1.1218, test_f1: 0.6354
 epoch: 72, train_loss: 0.6405, test_loss: 0.9731, test_f1: 0.6067
 epoch: 73, train_loss: 0.6674, test_loss: 1.0744, test_f1: 0.6287
 epoch: 74, train_loss: 0.6624, test_loss: 1.1336, test_f1: 0.5924
 epoch: 75, train_loss: 0.6518, test_loss: 1.0643, test_f1: 0.6100
 epoch: 76, train_loss: 0.6528, test_loss: 1.0666, test_f1: 0.6080
 epoch: 77, train_loss: 0.6607, test_loss: 1.0582, test_f1: 0.6575
 epoch: 78, train_loss: 0.6459, test_loss: 1.0155, test_f1: 0.6673
 epoch: 79, train_loss: 0.6410, test_loss: 1.1379, test_f1: 0.6548
 epoch: 80, train_loss: 0.6502, test_loss: 1.0860, test_f1: 0.6484
 epoch: 81, train_loss: 0.6371, test_loss: 1.0860, test_f1: 0.6453
 epoch: 82, train_loss: 0.6343, test_loss: 1.0658, test_f1: 0.6368
 epoch: 83, train_loss: 0.6332, test_loss: 1.1227, test_f1: 0.6235
 epoch: 84, train_loss: 0.6539, test_loss: 1.1575, test_f1: 0.6180
 epoch: 85, train_loss: 0.6340, test_loss: 1.1486, test_f1: 0.6632
 epoch: 86, train_loss: 0.6440, test_loss: 1.1717, test_f1: 0.6453
 epoch: 87, train_loss: 0.6216, test_loss: 1.2785, test_f1: 0.6261
 epoch: 88, train_loss: 0.6261, test_loss: 1.2318, test_f1: 0.6454
 epoch: 89, train_loss: 0.6322, test_loss: 1.2007, test_f1: 0.6063
 epoch: 90, train_loss: 0.6299, test_loss: 1.1244, test_f1: 0.6523
 epoch: 91, train_loss: 0.6038, test_loss: 1.1882, test_f1: 0.6495
 epoch: 92, train_loss: 0.6110, test_loss: 1.2268, test_f1: 0.6438
 epoch: 93, train_loss: 0.6127, test_loss: 1.2338, test_f1: 0.6799
 epoch: 94, train_loss: 0.6105, test_loss: 1.2160, test_f1: 0.6296
 epoch: 95, train_loss: 0.6346, test_loss: 1.1497, test_f1: 0.6423
 epoch: 96, train_loss: 0.6115, test_loss: 1.0920, test_f1: 0.6518
 epoch: 97, train_loss: 0.6221, test_loss: 1.1957, test_f1: 0.6435
 epoch: 98, train_loss: 0.6060, test_loss: 1.1865, test_f1: 0.6314
 epoch: 99, train_loss: 0.6142, test_loss: 1.2240, test_f1: 0.6476
##################ITERATION #8 ****************************************
 epoch: 0, train_loss: 1.2155, test_loss: 1.0694, test_f1: 0.4787
 epoch: 1, train_loss: 1.0315, test_loss: 1.0580, test_f1: 0.4973
 epoch: 2, train_loss: 0.9971, test_loss: 0.9306, test_f1: 0.5146
 epoch: 3, train_loss: 0.9792, test_loss: 0.9961, test_f1: 0.5078
 epoch: 4, train_loss: 0.9510, test_loss: 0.9449, test_f1: 0.4843
 epoch: 5, train_loss: 0.9431, test_loss: 0.9583, test_f1: 0.4920
 epoch: 6, train_loss: 0.9371, test_loss: 0.9775, test_f1: 0.4937
 epoch: 7, train_loss: 0.9380, test_loss: 0.9741, test_f1: 0.5066
 epoch: 8, train_loss: 0.9236, test_loss: 0.9715, test_f1: 0.4855
 epoch: 9, train_loss: 0.9131, test_loss: 0.9493, test_f1: 0.4828
 epoch: 10, train_loss: 0.9126, test_loss: 1.2169, test_f1: 0.4323
 epoch: 11, train_loss: 0.9221, test_loss: 0.9519, test_f1: 0.4999
 epoch: 12, train_loss: 0.9085, test_loss: 0.9427, test_f1: 0.5384
 epoch: 13, train_loss: 0.9010, test_loss: 0.9538, test_f1: 0.5137
 epoch: 14, train_loss: 0.8888, test_loss: 0.9601, test_f1: 0.5612
 epoch: 15, train_loss: 0.8791, test_loss: 0.9520, test_f1: 0.5632
 epoch: 16, train_loss: 0.8918, test_loss: 0.9306, test_f1: 0.4873
 epoch: 17, train_loss: 0.8785, test_loss: 0.9111, test_f1: 0.4951
 epoch: 18, train_loss: 0.8760, test_loss: 0.9452, test_f1: 0.5193
 epoch: 19, train_loss: 0.8614, test_loss: 0.9303, test_f1: 0.5329
 epoch: 20, train_loss: 0.8395, test_loss: 0.9558, test_f1: 0.5167
 epoch: 21, train_loss: 0.8475, test_loss: 0.8394, test_f1: 0.5537
 epoch: 22, train_loss: 0.8464, test_loss: 0.9531, test_f1: 0.5707
 epoch: 23, train_loss: 0.8440, test_loss: 0.9624, test_f1: 0.5240
 epoch: 24, train_loss: 0.8396, test_loss: 0.9326, test_f1: 0.6004
 epoch: 25, train_loss: 0.8418, test_loss: 0.9248, test_f1: 0.5852
 epoch: 26, train_loss: 0.8309, test_loss: 0.9111, test_f1: 0.5759
 epoch: 27, train_loss: 0.8192, test_loss: 0.9375, test_f1: 0.5632
 epoch: 28, train_loss: 0.8349, test_loss: 0.9999, test_f1: 0.5575
 epoch: 29, train_loss: 0.8146, test_loss: 0.9056, test_f1: 0.5889
 epoch: 30, train_loss: 0.7980, test_loss: 0.9190, test_f1: 0.6024
 epoch: 31, train_loss: 0.8279, test_loss: 1.0433, test_f1: 0.5547
 epoch: 32, train_loss: 0.8179, test_loss: 1.0058, test_f1: 0.5188
 epoch: 33, train_loss: 0.7991, test_loss: 0.9315, test_f1: 0.5310
 epoch: 34, train_loss: 0.8138, test_loss: 1.0313, test_f1: 0.5506
 epoch: 35, train_loss: 0.8089, test_loss: 0.8846, test_f1: 0.5868
 epoch: 36, train_loss: 0.7954, test_loss: 1.0165, test_f1: 0.5760
 epoch: 37, train_loss: 0.7942, test_loss: 0.9535, test_f1: 0.5760
 epoch: 38, train_loss: 0.7942, test_loss: 0.9209, test_f1: 0.5779
 epoch: 39, train_loss: 0.8027, test_loss: 0.8372, test_f1: 0.6308
 epoch: 40, train_loss: 0.7773, test_loss: 0.9319, test_f1: 0.5562
 epoch: 41, train_loss: 0.7907, test_loss: 0.8280, test_f1: 0.5802
 epoch: 42, train_loss: 0.7741, test_loss: 0.8952, test_f1: 0.5542
 epoch: 43, train_loss: 0.7759, test_loss: 0.9921, test_f1: 0.5858
 epoch: 44, train_loss: 0.8080, test_loss: 0.8826, test_f1: 0.6181
 epoch: 45, train_loss: 0.7826, test_loss: 0.9246, test_f1: 0.5912
 epoch: 46, train_loss: 0.7693, test_loss: 0.9700, test_f1: 0.6158
 epoch: 47, train_loss: 0.7888, test_loss: 0.9672, test_f1: 0.6261
 epoch: 48, train_loss: 0.7833, test_loss: 0.8688, test_f1: 0.6026
 epoch: 49, train_loss: 0.7841, test_loss: 0.9037, test_f1: 0.5859
 epoch: 50, train_loss: 0.7829, test_loss: 0.8795, test_f1: 0.6227
 epoch: 51, train_loss: 0.7490, test_loss: 0.8853, test_f1: 0.6387
 epoch: 52, train_loss: 0.7247, test_loss: 0.8968, test_f1: 0.6335
 epoch: 53, train_loss: 0.7190, test_loss: 0.9036, test_f1: 0.6302
 epoch: 54, train_loss: 0.7184, test_loss: 0.9024, test_f1: 0.6271
 epoch: 55, train_loss: 0.7150, test_loss: 0.9212, test_f1: 0.6538
 epoch: 56, train_loss: 0.7068, test_loss: 0.9135, test_f1: 0.5846
 epoch: 57, train_loss: 0.7058, test_loss: 0.9650, test_f1: 0.6104
 epoch: 58, train_loss: 0.6977, test_loss: 0.9438, test_f1: 0.6184
 epoch: 59, train_loss: 0.7204, test_loss: 0.9118, test_f1: 0.6144
 epoch: 60, train_loss: 0.7114, test_loss: 0.9639, test_f1: 0.6278
 epoch: 61, train_loss: 0.7101, test_loss: 0.8639, test_f1: 0.6273
 epoch: 62, train_loss: 0.7048, test_loss: 0.9019, test_f1: 0.6110
 epoch: 63, train_loss: 0.6941, test_loss: 0.8917, test_f1: 0.6235
 epoch: 64, train_loss: 0.6988, test_loss: 0.9013, test_f1: 0.6176
 epoch: 65, train_loss: 0.6838, test_loss: 0.9250, test_f1: 0.6475
 epoch: 66, train_loss: 0.6859, test_loss: 0.9228, test_f1: 0.5935
 epoch: 67, train_loss: 0.6888, test_loss: 0.9533, test_f1: 0.6212
 epoch: 68, train_loss: 0.6753, test_loss: 0.9050, test_f1: 0.6430
 epoch: 69, train_loss: 0.6902, test_loss: 0.9429, test_f1: 0.6379
 epoch: 70, train_loss: 0.6758, test_loss: 0.9028, test_f1: 0.6481
 epoch: 71, train_loss: 0.6828, test_loss: 0.9116, test_f1: 0.6448
 epoch: 72, train_loss: 0.6711, test_loss: 0.9419, test_f1: 0.6586
 epoch: 73, train_loss: 0.6734, test_loss: 0.8646, test_f1: 0.6320
 epoch: 74, train_loss: 0.6738, test_loss: 0.9332, test_f1: 0.6623
 epoch: 75, train_loss: 0.6519, test_loss: 0.9416, test_f1: 0.6151
 epoch: 76, train_loss: 0.6741, test_loss: 0.9620, test_f1: 0.6224
 epoch: 77, train_loss: 0.6710, test_loss: 0.9019, test_f1: 0.6542
 epoch: 78, train_loss: 0.6619, test_loss: 0.8934, test_f1: 0.6574
 epoch: 79, train_loss: 0.6659, test_loss: 0.8468, test_f1: 0.6739
 epoch: 80, train_loss: 0.6765, test_loss: 0.9250, test_f1: 0.6522
 epoch: 81, train_loss: 0.6542, test_loss: 0.8852, test_f1: 0.6154
 epoch: 82, train_loss: 0.6394, test_loss: 0.9262, test_f1: 0.6597
 epoch: 83, train_loss: 0.6508, test_loss: 0.9544, test_f1: 0.6459
 epoch: 84, train_loss: 0.6437, test_loss: 0.8949, test_f1: 0.6503
 epoch: 85, train_loss: 0.6482, test_loss: 0.9715, test_f1: 0.6468
 epoch: 86, train_loss: 0.6331, test_loss: 1.0138, test_f1: 0.6576
 epoch: 87, train_loss: 0.6493, test_loss: 0.9857, test_f1: 0.6595
 epoch: 88, train_loss: 0.6357, test_loss: 0.9859, test_f1: 0.6015
 epoch: 89, train_loss: 0.6193, test_loss: 0.9362, test_f1: 0.6684
 epoch: 90, train_loss: 0.6383, test_loss: 0.9171, test_f1: 0.6229
 epoch: 91, train_loss: 0.6276, test_loss: 0.9371, test_f1: 0.6610
 epoch: 92, train_loss: 0.6433, test_loss: 0.8877, test_f1: 0.6518
 epoch: 93, train_loss: 0.6238, test_loss: 0.9224, test_f1: 0.6406
 epoch: 94, train_loss: 0.6337, test_loss: 0.9091, test_f1: 0.6545
 epoch: 95, train_loss: 0.6251, test_loss: 0.9114, test_f1: 0.6399
 epoch: 96, train_loss: 0.6469, test_loss: 0.9066, test_f1: 0.6508
 epoch: 97, train_loss: 0.6204, test_loss: 0.9085, test_f1: 0.6552
 epoch: 98, train_loss: 0.6048, test_loss: 0.8548, test_f1: 0.6571
 epoch: 99, train_loss: 0.6218, test_loss: 0.8643, test_f1: 0.6638
##################ITERATION #9 ****************************************
 epoch: 0, train_loss: 1.1840, test_loss: 1.0763, test_f1: 0.4253
 epoch: 1, train_loss: 1.0193, test_loss: 1.0343, test_f1: 0.4781
 epoch: 2, train_loss: 0.9824, test_loss: 0.9794, test_f1: 0.4994
 epoch: 3, train_loss: 0.9817, test_loss: 1.0797, test_f1: 0.4488
 epoch: 4, train_loss: 0.9678, test_loss: 0.9594, test_f1: 0.4876
 epoch: 5, train_loss: 0.9600, test_loss: 1.0219, test_f1: 0.5014
 epoch: 6, train_loss: 0.9543, test_loss: 0.9788, test_f1: 0.4866
 epoch: 7, train_loss: 0.9373, test_loss: 0.9805, test_f1: 0.4947
 epoch: 8, train_loss: 0.9305, test_loss: 0.9903, test_f1: 0.4787
 epoch: 9, train_loss: 0.9187, test_loss: 0.9683, test_f1: 0.5350
 epoch: 10, train_loss: 0.9246, test_loss: 0.9751, test_f1: 0.4818
 epoch: 11, train_loss: 0.9124, test_loss: 1.0428, test_f1: 0.4288
 epoch: 12, train_loss: 0.9224, test_loss: 0.9772, test_f1: 0.5080
 epoch: 13, train_loss: 0.9068, test_loss: 1.0330, test_f1: 0.4876
 epoch: 14, train_loss: 0.8947, test_loss: 0.8968, test_f1: 0.5236
 epoch: 15, train_loss: 0.9196, test_loss: 1.0432, test_f1: 0.4376
 epoch: 16, train_loss: 0.9150, test_loss: 0.9765, test_f1: 0.5033
 epoch: 17, train_loss: 0.8851, test_loss: 0.9868, test_f1: 0.5424
 epoch: 18, train_loss: 0.8794, test_loss: 0.9840, test_f1: 0.5059
 epoch: 19, train_loss: 0.8775, test_loss: 0.9797, test_f1: 0.5532
 epoch: 20, train_loss: 0.8709, test_loss: 0.9384, test_f1: 0.5647
 epoch: 21, train_loss: 0.8631, test_loss: 0.9684, test_f1: 0.5308
 epoch: 22, train_loss: 0.8654, test_loss: 0.9571, test_f1: 0.5928
 epoch: 23, train_loss: 0.8601, test_loss: 0.9122, test_f1: 0.5770
 epoch: 24, train_loss: 0.8614, test_loss: 0.9873, test_f1: 0.5907
 epoch: 25, train_loss: 0.8471, test_loss: 0.9794, test_f1: 0.5666
 epoch: 26, train_loss: 0.8300, test_loss: 1.1495, test_f1: 0.4896
 epoch: 27, train_loss: 0.8509, test_loss: 0.9482, test_f1: 0.5758
 epoch: 28, train_loss: 0.8469, test_loss: 0.9329, test_f1: 0.5931
 epoch: 29, train_loss: 0.8315, test_loss: 0.9451, test_f1: 0.5702
 epoch: 30, train_loss: 0.8374, test_loss: 0.9845, test_f1: 0.5634
 epoch: 31, train_loss: 0.8162, test_loss: 0.9329, test_f1: 0.5846
 epoch: 32, train_loss: 0.8266, test_loss: 0.9567, test_f1: 0.5597
 epoch: 33, train_loss: 0.8154, test_loss: 0.9575, test_f1: 0.6039
 epoch: 34, train_loss: 0.7909, test_loss: 0.9221, test_f1: 0.5955
 epoch: 35, train_loss: 0.8038, test_loss: 1.0000, test_f1: 0.5431
 epoch: 36, train_loss: 0.8093, test_loss: 0.9427, test_f1: 0.5683
 epoch: 37, train_loss: 0.7846, test_loss: 0.9414, test_f1: 0.6089
 epoch: 38, train_loss: 0.8101, test_loss: 0.8770, test_f1: 0.5976
 epoch: 39, train_loss: 0.7911, test_loss: 0.9408, test_f1: 0.5834
 epoch: 40, train_loss: 0.7898, test_loss: 0.9463, test_f1: 0.6062
 epoch: 41, train_loss: 0.7935, test_loss: 0.9284, test_f1: 0.5877
 epoch: 42, train_loss: 0.7950, test_loss: 0.8920, test_f1: 0.6254
 epoch: 43, train_loss: 0.7841, test_loss: 0.9148, test_f1: 0.6084
 epoch: 44, train_loss: 0.7696, test_loss: 0.9543, test_f1: 0.6015
 epoch: 45, train_loss: 0.7966, test_loss: 0.9652, test_f1: 0.5897
 epoch: 46, train_loss: 0.7758, test_loss: 0.9408, test_f1: 0.6063
 epoch: 47, train_loss: 0.7803, test_loss: 0.8902, test_f1: 0.5784
 epoch: 48, train_loss: 0.7684, test_loss: 0.9262, test_f1: 0.5577
 epoch: 49, train_loss: 0.7743, test_loss: 0.9331, test_f1: 0.5888
 epoch: 50, train_loss: 0.7916, test_loss: 0.9369, test_f1: 0.5834
 epoch: 51, train_loss: 0.7299, test_loss: 0.8775, test_f1: 0.6115
 epoch: 52, train_loss: 0.7344, test_loss: 0.9048, test_f1: 0.6122
 epoch: 53, train_loss: 0.7230, test_loss: 0.9147, test_f1: 0.6052
 epoch: 54, train_loss: 0.7224, test_loss: 0.9167, test_f1: 0.6055
 epoch: 55, train_loss: 0.7363, test_loss: 0.8616, test_f1: 0.6121
 epoch: 56, train_loss: 0.7157, test_loss: 0.8942, test_f1: 0.6376
 epoch: 57, train_loss: 0.6966, test_loss: 0.9178, test_f1: 0.6326
 epoch: 58, train_loss: 0.7061, test_loss: 0.9070, test_f1: 0.5914
 epoch: 59, train_loss: 0.7039, test_loss: 0.8979, test_f1: 0.6271
 epoch: 60, train_loss: 0.7176, test_loss: 0.9060, test_f1: 0.6377
 epoch: 61, train_loss: 0.7145, test_loss: 0.9021, test_f1: 0.6151
 epoch: 62, train_loss: 0.6918, test_loss: 0.9398, test_f1: 0.6308
 epoch: 63, train_loss: 0.7045, test_loss: 0.9436, test_f1: 0.6104
 epoch: 64, train_loss: 0.6949, test_loss: 0.9761, test_f1: 0.6167
 epoch: 65, train_loss: 0.6907, test_loss: 0.8924, test_f1: 0.6413
 epoch: 66, train_loss: 0.6888, test_loss: 0.9343, test_f1: 0.5795
 epoch: 67, train_loss: 0.7196, test_loss: 0.8794, test_f1: 0.6090
 epoch: 68, train_loss: 0.7026, test_loss: 0.9469, test_f1: 0.6287
 epoch: 69, train_loss: 0.7004, test_loss: 0.8953, test_f1: 0.6525
 epoch: 70, train_loss: 0.6847, test_loss: 0.9601, test_f1: 0.6099
 epoch: 71, train_loss: 0.6949, test_loss: 1.0098, test_f1: 0.5862
 epoch: 72, train_loss: 0.6780, test_loss: 0.9170, test_f1: 0.6353
 epoch: 73, train_loss: 0.7043, test_loss: 0.9487, test_f1: 0.6242
 epoch: 74, train_loss: 0.6884, test_loss: 0.9213, test_f1: 0.6517
 epoch: 75, train_loss: 0.6779, test_loss: 1.0506, test_f1: 0.5764
 epoch: 76, train_loss: 0.6813, test_loss: 0.9515, test_f1: 0.6102
 epoch: 77, train_loss: 0.6715, test_loss: 0.9463, test_f1: 0.6230
 epoch: 78, train_loss: 0.6772, test_loss: 0.9104, test_f1: 0.5954
 epoch: 79, train_loss: 0.6788, test_loss: 0.9150, test_f1: 0.6153
 epoch: 80, train_loss: 0.6718, test_loss: 0.9671, test_f1: 0.6110
 epoch: 81, train_loss: 0.6781, test_loss: 0.9279, test_f1: 0.6459
 epoch: 82, train_loss: 0.6479, test_loss: 0.9357, test_f1: 0.6129
 epoch: 83, train_loss: 0.6632, test_loss: 0.9423, test_f1: 0.6192
 epoch: 84, train_loss: 0.6651, test_loss: 0.9412, test_f1: 0.6156
 epoch: 85, train_loss: 0.6540, test_loss: 0.9709, test_f1: 0.5827
 epoch: 86, train_loss: 0.6752, test_loss: 0.9392, test_f1: 0.6060
 epoch: 87, train_loss: 0.6734, test_loss: 0.9730, test_f1: 0.6002
 epoch: 88, train_loss: 0.6578, test_loss: 0.9422, test_f1: 0.6442
 epoch: 89, train_loss: 0.6538, test_loss: 0.9783, test_f1: 0.5930
 epoch: 90, train_loss: 0.6565, test_loss: 1.0010, test_f1: 0.6115
 epoch: 91, train_loss: 0.6578, test_loss: 0.8962, test_f1: 0.6493
 epoch: 92, train_loss: 0.6486, test_loss: 0.9353, test_f1: 0.6243
 epoch: 93, train_loss: 0.6462, test_loss: 0.9846, test_f1: 0.5916
 epoch: 94, train_loss: 0.6454, test_loss: 0.9328, test_f1: 0.5959
 epoch: 95, train_loss: 0.6398, test_loss: 0.9700, test_f1: 0.6388
 epoch: 96, train_loss: 0.6498, test_loss: 0.9974, test_f1: 0.6100
 epoch: 97, train_loss: 0.6526, test_loss: 0.9730, test_f1: 0.5921
 epoch: 98, train_loss: 0.6442, test_loss: 0.9303, test_f1: 0.6347
 epoch: 99, train_loss: 0.6374, test_loss: 0.9334, test_f1: 0.6178

Training completed in 740.09 seconds
Best F1: 0.6807 at epoch 56
Mean F1 across iterations: 0.6661  0.0134
========================FINAL RESULTS================================
FEGIN weighted F1: 0.6807  0.0134
python main.py --data ltspice_examples --representation component_net --model FEGIN --layers 5 --hiddens 32 --batch_size 64 --lr 0.01 --emb_size 512 --epochs 100 --save_appendix component_net_L5_H32_BS64_LR0.01_E512 --no_val
-----



STDERR:
  File "main.py", line 370, in <module>
    main()
  File "main.py", line 254, in main
    dataset = dataset_class(
  File "/home/philip/projects/ltspice_examples_code_repo/Circuit-Completion-Using-GNNs/component_classification_with_link_prediction_head/evaluation/FEGIN/kernel/circuit_datasets.py", line 15, in __init__
    self.data, self.slices = torch.load(self.processed_paths[0])
  File "/home/philip/.local/lib/python3.8/site-packages/torch/serialization.py", line 1040, in load
    warnings.warn(
  File "/usr/lib/python3.8/warnings.py", line 109, in _showwarnmsg
    sw(msg.message, msg.category, msg.filename, msg.lineno,
  File "main.py", line 47, in warn_with_traceback
    traceback.print_stack(file=log)
/home/philip/projects/ltspice_examples_code_repo/Circuit-Completion-Using-GNNs/component_classification_with_link_prediction_head/evaluation/FEGIN/kernel/circuit_datasets.py:15: FutureWarning: You are using `torch.load` with `weights_only=False` (the current default value), which uses the default pickle module implicitly. It is possible to construct malicious pickle data which will execute arbitrary code during unpickling (See https://github.com/pytorch/pytorch/blob/main/SECURITY.md#untrusted-models for more details). In a future release, the default value for `weights_only` will be flipped to `True`. This limits the functions that could be executed during unpickling. Arbitrary objects will no longer be allowed to be loaded via this mode unless they are explicitly allowlisted by the user via `torch.serialization.add_safe_globals`. We recommend you start setting `weights_only=True` for any use case where you don't have full control of the loaded file. Please open an issue on GitHub for any issues related to this experimental feature.
  self.data, self.slices = torch.load(self.processed_paths[0])
