STDOUT:
Results will be saved in /home/philip/projects/ltspice_examples_code_repo/Circuit-Completion-Using-GNNs/component_classification_with_link_prediction_head/evaluation/FEGIN/results/model_FEGIN_dataset_ltspice_examples
Command line input: python main.py --data ltspice_examples --representation component_component --model FEGIN --layers 3 --hiddens 16 --batch_size 64 --lr 0.0001 --emb_size 512 --epochs 100 --save_appendix component_component_L3_H16_BS64_LR0.0001_E512 --no_val
 is saved.
-----
ltspice_examples - FEGIN
Using 3 layers, 16 hidden units, h = 2
Loading component_component representation dataset
ENTERED
Training FEGIN on component_component representation
Train: 3556, Test: 845
##################ITERATION #0 ****************************************
 epoch: 0, train_loss: 1.3631, test_loss: 1.3546, test_f1: 0.2629
 epoch: 1, train_loss: 1.3561, test_loss: 1.3489, test_f1: 0.2356
 epoch: 2, train_loss: 1.3506, test_loss: 1.3433, test_f1: 0.2276
 epoch: 3, train_loss: 1.3459, test_loss: 1.3382, test_f1: 0.2274
 epoch: 4, train_loss: 1.3403, test_loss: 1.3331, test_f1: 0.2274
 epoch: 5, train_loss: 1.3341, test_loss: 1.3292, test_f1: 0.2274
 epoch: 6, train_loss: 1.3291, test_loss: 1.3228, test_f1: 0.2274
 epoch: 7, train_loss: 1.3247, test_loss: 1.3169, test_f1: 0.2274
 epoch: 8, train_loss: 1.3190, test_loss: 1.3135, test_f1: 0.2274
 epoch: 9, train_loss: 1.3145, test_loss: 1.3084, test_f1: 0.2274
 epoch: 10, train_loss: 1.3071, test_loss: 1.3034, test_f1: 0.2274
 epoch: 11, train_loss: 1.3053, test_loss: 1.2995, test_f1: 0.2274
 epoch: 12, train_loss: 1.2980, test_loss: 1.2960, test_f1: 0.2274
 epoch: 13, train_loss: 1.2967, test_loss: 1.2924, test_f1: 0.2274
 epoch: 14, train_loss: 1.2918, test_loss: 1.2901, test_f1: 0.2274
 epoch: 15, train_loss: 1.2919, test_loss: 1.2862, test_f1: 0.2274
 epoch: 16, train_loss: 1.2880, test_loss: 1.2845, test_f1: 0.2274
 epoch: 17, train_loss: 1.2853, test_loss: 1.2816, test_f1: 0.2274
 epoch: 18, train_loss: 1.2825, test_loss: 1.2806, test_f1: 0.2274
 epoch: 19, train_loss: 1.2773, test_loss: 1.2784, test_f1: 0.2274
 epoch: 20, train_loss: 1.2777, test_loss: 1.2768, test_f1: 0.2274
 epoch: 21, train_loss: 1.2691, test_loss: 1.2744, test_f1: 0.2274
 epoch: 22, train_loss: 1.2781, test_loss: 1.2716, test_f1: 0.2274
 epoch: 23, train_loss: 1.2731, test_loss: 1.2704, test_f1: 0.2274
 epoch: 24, train_loss: 1.2696, test_loss: 1.2692, test_f1: 0.2274
 epoch: 25, train_loss: 1.2661, test_loss: 1.2658, test_f1: 0.2274
 epoch: 26, train_loss: 1.2653, test_loss: 1.2640, test_f1: 0.2274
 epoch: 27, train_loss: 1.2595, test_loss: 1.2622, test_f1: 0.2274
 epoch: 28, train_loss: 1.2600, test_loss: 1.2600, test_f1: 0.2274
 epoch: 29, train_loss: 1.2570, test_loss: 1.2560, test_f1: 0.2274
 epoch: 30, train_loss: 1.2522, test_loss: 1.2541, test_f1: 0.2274
 epoch: 31, train_loss: 1.2477, test_loss: 1.2521, test_f1: 0.2274
 epoch: 32, train_loss: 1.2500, test_loss: 1.2500, test_f1: 0.2274
 epoch: 33, train_loss: 1.2462, test_loss: 1.2462, test_f1: 0.2477
 epoch: 34, train_loss: 1.2463, test_loss: 1.2462, test_f1: 0.2685
 epoch: 35, train_loss: 1.2440, test_loss: 1.2412, test_f1: 0.3063
 epoch: 36, train_loss: 1.2406, test_loss: 1.2395, test_f1: 0.3261
 epoch: 37, train_loss: 1.2380, test_loss: 1.2368, test_f1: 0.3360
 epoch: 38, train_loss: 1.2381, test_loss: 1.2335, test_f1: 0.3327
 epoch: 39, train_loss: 1.2330, test_loss: 1.2306, test_f1: 0.3409
 epoch: 40, train_loss: 1.2320, test_loss: 1.2277, test_f1: 0.3468
 epoch: 41, train_loss: 1.2295, test_loss: 1.2276, test_f1: 0.3629
 epoch: 42, train_loss: 1.2320, test_loss: 1.2236, test_f1: 0.3539
 epoch: 43, train_loss: 1.2205, test_loss: 1.2225, test_f1: 0.3543
 epoch: 44, train_loss: 1.2263, test_loss: 1.2208, test_f1: 0.3500
 epoch: 45, train_loss: 1.2183, test_loss: 1.2180, test_f1: 0.3491
 epoch: 46, train_loss: 1.2189, test_loss: 1.2162, test_f1: 0.3431
 epoch: 47, train_loss: 1.2246, test_loss: 1.2121, test_f1: 0.3478
 epoch: 48, train_loss: 1.2179, test_loss: 1.2122, test_f1: 0.3427
 epoch: 49, train_loss: 1.2154, test_loss: 1.2111, test_f1: 0.3501
 epoch: 50, train_loss: 1.2126, test_loss: 1.2082, test_f1: 0.3404
 epoch: 51, train_loss: 1.2082, test_loss: 1.2062, test_f1: 0.3471
 epoch: 52, train_loss: 1.2095, test_loss: 1.2069, test_f1: 0.3440
 epoch: 53, train_loss: 1.2112, test_loss: 1.2062, test_f1: 0.3466
 epoch: 54, train_loss: 1.2173, test_loss: 1.2038, test_f1: 0.3411
 epoch: 55, train_loss: 1.2090, test_loss: 1.2031, test_f1: 0.3440
 epoch: 56, train_loss: 1.2054, test_loss: 1.2036, test_f1: 0.3443
 epoch: 57, train_loss: 1.2087, test_loss: 1.2028, test_f1: 0.3406
 epoch: 58, train_loss: 1.2103, test_loss: 1.2010, test_f1: 0.3425
 epoch: 59, train_loss: 1.2080, test_loss: 1.2018, test_f1: 0.3421
 epoch: 60, train_loss: 1.2070, test_loss: 1.2013, test_f1: 0.3427
 epoch: 61, train_loss: 1.2063, test_loss: 1.1995, test_f1: 0.3413
 epoch: 62, train_loss: 1.2049, test_loss: 1.1991, test_f1: 0.3423
 epoch: 63, train_loss: 1.2027, test_loss: 1.1998, test_f1: 0.3407
 epoch: 64, train_loss: 1.2062, test_loss: 1.1975, test_f1: 0.3431
 epoch: 65, train_loss: 1.2042, test_loss: 1.1984, test_f1: 0.3405
 epoch: 66, train_loss: 1.2023, test_loss: 1.1958, test_f1: 0.3442
 epoch: 67, train_loss: 1.1975, test_loss: 1.1943, test_f1: 0.3433
 epoch: 68, train_loss: 1.1973, test_loss: 1.1944, test_f1: 0.3404
 epoch: 69, train_loss: 1.2020, test_loss: 1.1936, test_f1: 0.3450
 epoch: 70, train_loss: 1.2036, test_loss: 1.1933, test_f1: 0.3478
 epoch: 71, train_loss: 1.1992, test_loss: 1.1934, test_f1: 0.3424
 epoch: 72, train_loss: 1.1962, test_loss: 1.1921, test_f1: 0.3476
 epoch: 73, train_loss: 1.1973, test_loss: 1.1921, test_f1: 0.3519
 epoch: 74, train_loss: 1.1951, test_loss: 1.1918, test_f1: 0.3448
 epoch: 75, train_loss: 1.1951, test_loss: 1.1906, test_f1: 0.3431
 epoch: 76, train_loss: 1.1991, test_loss: 1.1906, test_f1: 0.3460
 epoch: 77, train_loss: 1.1902, test_loss: 1.1907, test_f1: 0.3455
 epoch: 78, train_loss: 1.1948, test_loss: 1.1884, test_f1: 0.3445
 epoch: 79, train_loss: 1.1964, test_loss: 1.1905, test_f1: 0.3439
 epoch: 80, train_loss: 1.1953, test_loss: 1.1897, test_f1: 0.3467
 epoch: 81, train_loss: 1.1920, test_loss: 1.1869, test_f1: 0.3470
 epoch: 82, train_loss: 1.1901, test_loss: 1.1883, test_f1: 0.3436
 epoch: 83, train_loss: 1.1865, test_loss: 1.1870, test_f1: 0.3491
 epoch: 84, train_loss: 1.1913, test_loss: 1.1869, test_f1: 0.3472
 epoch: 85, train_loss: 1.1862, test_loss: 1.1860, test_f1: 0.3487
 epoch: 86, train_loss: 1.1942, test_loss: 1.1850, test_f1: 0.3437
 epoch: 87, train_loss: 1.1878, test_loss: 1.1850, test_f1: 0.3461
 epoch: 88, train_loss: 1.1856, test_loss: 1.1857, test_f1: 0.3445
 epoch: 89, train_loss: 1.1870, test_loss: 1.1849, test_f1: 0.3433
 epoch: 90, train_loss: 1.1868, test_loss: 1.1848, test_f1: 0.3421
 epoch: 91, train_loss: 1.1840, test_loss: 1.1814, test_f1: 0.3473
 epoch: 92, train_loss: 1.1785, test_loss: 1.1837, test_f1: 0.3471
 epoch: 93, train_loss: 1.1867, test_loss: 1.1827, test_f1: 0.3441
 epoch: 94, train_loss: 1.1855, test_loss: 1.1829, test_f1: 0.3452
 epoch: 95, train_loss: 1.1843, test_loss: 1.1809, test_f1: 0.3474
 epoch: 96, train_loss: 1.1841, test_loss: 1.1788, test_f1: 0.3438
 epoch: 97, train_loss: 1.1832, test_loss: 1.1792, test_f1: 0.3449
 epoch: 98, train_loss: 1.1788, test_loss: 1.1802, test_f1: 0.3444
 epoch: 99, train_loss: 1.1794, test_loss: 1.1789, test_f1: 0.3471
##################ITERATION #1 ****************************************
 epoch: 0, train_loss: 1.3206, test_loss: 1.3225, test_f1: 0.2274
 epoch: 1, train_loss: 1.3144, test_loss: 1.3167, test_f1: 0.2274
 epoch: 2, train_loss: 1.3088, test_loss: 1.3123, test_f1: 0.2274
 epoch: 3, train_loss: 1.3051, test_loss: 1.3073, test_f1: 0.2274
 epoch: 4, train_loss: 1.3019, test_loss: 1.3034, test_f1: 0.2274
 epoch: 5, train_loss: 1.2993, test_loss: 1.3007, test_f1: 0.2274
 epoch: 6, train_loss: 1.2971, test_loss: 1.2971, test_f1: 0.2274
 epoch: 7, train_loss: 1.2932, test_loss: 1.2943, test_f1: 0.2274
 epoch: 8, train_loss: 1.2922, test_loss: 1.2908, test_f1: 0.2274
 epoch: 9, train_loss: 1.2872, test_loss: 1.2868, test_f1: 0.2274
 epoch: 10, train_loss: 1.2868, test_loss: 1.2837, test_f1: 0.2274
 epoch: 11, train_loss: 1.2830, test_loss: 1.2815, test_f1: 0.2274
 epoch: 12, train_loss: 1.2808, test_loss: 1.2792, test_f1: 0.2274
 epoch: 13, train_loss: 1.2791, test_loss: 1.2773, test_f1: 0.2274
 epoch: 14, train_loss: 1.2777, test_loss: 1.2734, test_f1: 0.2274
 epoch: 15, train_loss: 1.2756, test_loss: 1.2686, test_f1: 0.2274
 epoch: 16, train_loss: 1.2734, test_loss: 1.2677, test_f1: 0.2274
 epoch: 17, train_loss: 1.2731, test_loss: 1.2647, test_f1: 0.2266
 epoch: 18, train_loss: 1.2712, test_loss: 1.2628, test_f1: 0.2274
 epoch: 19, train_loss: 1.2680, test_loss: 1.2594, test_f1: 0.2555
 epoch: 20, train_loss: 1.2684, test_loss: 1.2564, test_f1: 0.2390
 epoch: 21, train_loss: 1.2662, test_loss: 1.2531, test_f1: 0.2555
 epoch: 22, train_loss: 1.2610, test_loss: 1.2497, test_f1: 0.2555
 epoch: 23, train_loss: 1.2632, test_loss: 1.2462, test_f1: 0.2555
 epoch: 24, train_loss: 1.2604, test_loss: 1.2431, test_f1: 0.2555
 epoch: 25, train_loss: 1.2575, test_loss: 1.2416, test_f1: 0.2555
 epoch: 26, train_loss: 1.2504, test_loss: 1.2366, test_f1: 0.2690
 epoch: 27, train_loss: 1.2519, test_loss: 1.2339, test_f1: 0.2579
 epoch: 28, train_loss: 1.2473, test_loss: 1.2329, test_f1: 0.2601
 epoch: 29, train_loss: 1.2490, test_loss: 1.2285, test_f1: 0.2712
 epoch: 30, train_loss: 1.2487, test_loss: 1.2268, test_f1: 0.2603
 epoch: 31, train_loss: 1.2423, test_loss: 1.2252, test_f1: 0.2619
 epoch: 32, train_loss: 1.2437, test_loss: 1.2219, test_f1: 0.2756
 epoch: 33, train_loss: 1.2428, test_loss: 1.2215, test_f1: 0.2657
 epoch: 34, train_loss: 1.2398, test_loss: 1.2176, test_f1: 0.2756
 epoch: 35, train_loss: 1.2380, test_loss: 1.2166, test_f1: 0.2947
 epoch: 36, train_loss: 1.2383, test_loss: 1.2147, test_f1: 0.2945
 epoch: 37, train_loss: 1.2345, test_loss: 1.2126, test_f1: 0.2924
 epoch: 38, train_loss: 1.2354, test_loss: 1.2101, test_f1: 0.3032
 epoch: 39, train_loss: 1.2343, test_loss: 1.2058, test_f1: 0.3143
 epoch: 40, train_loss: 1.2312, test_loss: 1.2059, test_f1: 0.3151
 epoch: 41, train_loss: 1.2320, test_loss: 1.2052, test_f1: 0.3183
 epoch: 42, train_loss: 1.2342, test_loss: 1.2018, test_f1: 0.3175
 epoch: 43, train_loss: 1.2279, test_loss: 1.2011, test_f1: 0.3255
 epoch: 44, train_loss: 1.2272, test_loss: 1.2019, test_f1: 0.3183
 epoch: 45, train_loss: 1.2273, test_loss: 1.1982, test_f1: 0.3272
 epoch: 46, train_loss: 1.2242, test_loss: 1.1985, test_f1: 0.3279
 epoch: 47, train_loss: 1.2232, test_loss: 1.1953, test_f1: 0.3294
 epoch: 48, train_loss: 1.2194, test_loss: 1.1949, test_f1: 0.3296
 epoch: 49, train_loss: 1.2210, test_loss: 1.1934, test_f1: 0.3400
 epoch: 50, train_loss: 1.2188, test_loss: 1.1920, test_f1: 0.3382
 epoch: 51, train_loss: 1.2233, test_loss: 1.1913, test_f1: 0.3352
 epoch: 52, train_loss: 1.2175, test_loss: 1.1902, test_f1: 0.3407
 epoch: 53, train_loss: 1.2194, test_loss: 1.1894, test_f1: 0.3337
 epoch: 54, train_loss: 1.2119, test_loss: 1.1885, test_f1: 0.3358
 epoch: 55, train_loss: 1.2157, test_loss: 1.1896, test_f1: 0.3217
 epoch: 56, train_loss: 1.2152, test_loss: 1.1879, test_f1: 0.3399
 epoch: 57, train_loss: 1.2136, test_loss: 1.1880, test_f1: 0.3358
 epoch: 58, train_loss: 1.2161, test_loss: 1.1884, test_f1: 0.3343
 epoch: 59, train_loss: 1.2156, test_loss: 1.1871, test_f1: 0.3401
 epoch: 60, train_loss: 1.2133, test_loss: 1.1869, test_f1: 0.3440
 epoch: 61, train_loss: 1.2102, test_loss: 1.1847, test_f1: 0.3449
 epoch: 62, train_loss: 1.2129, test_loss: 1.1845, test_f1: 0.3449
 epoch: 63, train_loss: 1.2104, test_loss: 1.1832, test_f1: 0.3426
 epoch: 64, train_loss: 1.2089, test_loss: 1.1843, test_f1: 0.3394
 epoch: 65, train_loss: 1.2098, test_loss: 1.1844, test_f1: 0.3427
 epoch: 66, train_loss: 1.2095, test_loss: 1.1827, test_f1: 0.3400
 epoch: 67, train_loss: 1.2061, test_loss: 1.1824, test_f1: 0.3354
 epoch: 68, train_loss: 1.2111, test_loss: 1.1827, test_f1: 0.3490
 epoch: 69, train_loss: 1.2106, test_loss: 1.1834, test_f1: 0.3361
 epoch: 70, train_loss: 1.2071, test_loss: 1.1806, test_f1: 0.3475
 epoch: 71, train_loss: 1.2074, test_loss: 1.1808, test_f1: 0.3455
 epoch: 72, train_loss: 1.2048, test_loss: 1.1802, test_f1: 0.3346
 epoch: 73, train_loss: 1.2104, test_loss: 1.1792, test_f1: 0.3502
 epoch: 74, train_loss: 1.2064, test_loss: 1.1788, test_f1: 0.3488
 epoch: 75, train_loss: 1.2078, test_loss: 1.1788, test_f1: 0.3476
 epoch: 76, train_loss: 1.2079, test_loss: 1.1773, test_f1: 0.3507
 epoch: 77, train_loss: 1.2001, test_loss: 1.1786, test_f1: 0.3488
 epoch: 78, train_loss: 1.2041, test_loss: 1.1767, test_f1: 0.3480
 epoch: 79, train_loss: 1.2018, test_loss: 1.1763, test_f1: 0.3495
 epoch: 80, train_loss: 1.1975, test_loss: 1.1748, test_f1: 0.3514
 epoch: 81, train_loss: 1.1971, test_loss: 1.1747, test_f1: 0.3505
 epoch: 82, train_loss: 1.2029, test_loss: 1.1743, test_f1: 0.3534
 epoch: 83, train_loss: 1.1969, test_loss: 1.1735, test_f1: 0.3364
 epoch: 84, train_loss: 1.1994, test_loss: 1.1728, test_f1: 0.3492
 epoch: 85, train_loss: 1.1947, test_loss: 1.1732, test_f1: 0.3441
 epoch: 86, train_loss: 1.1980, test_loss: 1.1731, test_f1: 0.3430
 epoch: 87, train_loss: 1.1978, test_loss: 1.1720, test_f1: 0.3490
 epoch: 88, train_loss: 1.1955, test_loss: 1.1711, test_f1: 0.3484
 epoch: 89, train_loss: 1.1974, test_loss: 1.1741, test_f1: 0.3702
 epoch: 90, train_loss: 1.1975, test_loss: 1.1709, test_f1: 0.3458
 epoch: 91, train_loss: 1.1917, test_loss: 1.1698, test_f1: 0.3547
 epoch: 92, train_loss: 1.1909, test_loss: 1.1700, test_f1: 0.3537
 epoch: 93, train_loss: 1.1970, test_loss: 1.1676, test_f1: 0.3437
 epoch: 94, train_loss: 1.1881, test_loss: 1.1676, test_f1: 0.3490
 epoch: 95, train_loss: 1.1880, test_loss: 1.1665, test_f1: 0.3570
 epoch: 96, train_loss: 1.1868, test_loss: 1.1656, test_f1: 0.3511
 epoch: 97, train_loss: 1.1868, test_loss: 1.1666, test_f1: 0.3545
 epoch: 98, train_loss: 1.1877, test_loss: 1.1641, test_f1: 0.3564
 epoch: 99, train_loss: 1.1905, test_loss: 1.1642, test_f1: 0.3602
##################ITERATION #2 ****************************************
 epoch: 0, train_loss: 1.3086, test_loss: 1.3141, test_f1: 0.2274
 epoch: 1, train_loss: 1.3023, test_loss: 1.3072, test_f1: 0.2274
 epoch: 2, train_loss: 1.2990, test_loss: 1.3019, test_f1: 0.2274
 epoch: 3, train_loss: 1.2918, test_loss: 1.2980, test_f1: 0.2274
 epoch: 4, train_loss: 1.2886, test_loss: 1.2925, test_f1: 0.2274
 epoch: 5, train_loss: 1.2851, test_loss: 1.2875, test_f1: 0.2274
 epoch: 6, train_loss: 1.2803, test_loss: 1.2829, test_f1: 0.2274
 epoch: 7, train_loss: 1.2738, test_loss: 1.2784, test_f1: 0.2274
 epoch: 8, train_loss: 1.2747, test_loss: 1.2727, test_f1: 0.2274
 epoch: 9, train_loss: 1.2681, test_loss: 1.2681, test_f1: 0.2274
 epoch: 10, train_loss: 1.2638, test_loss: 1.2629, test_f1: 0.2325
 epoch: 11, train_loss: 1.2635, test_loss: 1.2593, test_f1: 0.2445
 epoch: 12, train_loss: 1.2574, test_loss: 1.2554, test_f1: 0.2513
 epoch: 13, train_loss: 1.2564, test_loss: 1.2505, test_f1: 0.2535
 epoch: 14, train_loss: 1.2525, test_loss: 1.2455, test_f1: 0.3018
 epoch: 15, train_loss: 1.2495, test_loss: 1.2405, test_f1: 0.2918
 epoch: 16, train_loss: 1.2489, test_loss: 1.2384, test_f1: 0.2988
 epoch: 17, train_loss: 1.2474, test_loss: 1.2337, test_f1: 0.3113
 epoch: 18, train_loss: 1.2434, test_loss: 1.2311, test_f1: 0.3104
 epoch: 19, train_loss: 1.2433, test_loss: 1.2284, test_f1: 0.3167
 epoch: 20, train_loss: 1.2329, test_loss: 1.2253, test_f1: 0.3167
 epoch: 21, train_loss: 1.2379, test_loss: 1.2218, test_f1: 0.3256
 epoch: 22, train_loss: 1.2337, test_loss: 1.2207, test_f1: 0.3265
 epoch: 23, train_loss: 1.2339, test_loss: 1.2176, test_f1: 0.3275
 epoch: 24, train_loss: 1.2325, test_loss: 1.2176, test_f1: 0.3300
 epoch: 25, train_loss: 1.2278, test_loss: 1.2138, test_f1: 0.3283
 epoch: 26, train_loss: 1.2244, test_loss: 1.2127, test_f1: 0.3309
 epoch: 27, train_loss: 1.2259, test_loss: 1.2102, test_f1: 0.3256
 epoch: 28, train_loss: 1.2236, test_loss: 1.2088, test_f1: 0.3266
 epoch: 29, train_loss: 1.2220, test_loss: 1.2075, test_f1: 0.3310
 epoch: 30, train_loss: 1.2207, test_loss: 1.2078, test_f1: 0.3289
 epoch: 31, train_loss: 1.2231, test_loss: 1.2063, test_f1: 0.3320
 epoch: 32, train_loss: 1.2167, test_loss: 1.2029, test_f1: 0.3322
 epoch: 33, train_loss: 1.2203, test_loss: 1.2004, test_f1: 0.3375
 epoch: 34, train_loss: 1.2217, test_loss: 1.2001, test_f1: 0.3318
 epoch: 35, train_loss: 1.2250, test_loss: 1.1999, test_f1: 0.3361
 epoch: 36, train_loss: 1.2152, test_loss: 1.1970, test_f1: 0.3381
 epoch: 37, train_loss: 1.2134, test_loss: 1.1972, test_f1: 0.3386
 epoch: 38, train_loss: 1.2116, test_loss: 1.1968, test_f1: 0.3389
 epoch: 39, train_loss: 1.2119, test_loss: 1.1955, test_f1: 0.3395
 epoch: 40, train_loss: 1.2112, test_loss: 1.1936, test_f1: 0.3399
 epoch: 41, train_loss: 1.2125, test_loss: 1.1931, test_f1: 0.3399
 epoch: 42, train_loss: 1.2076, test_loss: 1.1936, test_f1: 0.3409
 epoch: 43, train_loss: 1.2116, test_loss: 1.1943, test_f1: 0.3399
 epoch: 44, train_loss: 1.2084, test_loss: 1.1924, test_f1: 0.3400
 epoch: 45, train_loss: 1.2076, test_loss: 1.1913, test_f1: 0.3428
 epoch: 46, train_loss: 1.2093, test_loss: 1.1885, test_f1: 0.3406
 epoch: 47, train_loss: 1.2053, test_loss: 1.1915, test_f1: 0.3424
 epoch: 48, train_loss: 1.2054, test_loss: 1.1887, test_f1: 0.3404
 epoch: 49, train_loss: 1.2020, test_loss: 1.1902, test_f1: 0.3415
 epoch: 50, train_loss: 1.2035, test_loss: 1.1870, test_f1: 0.3409
 epoch: 51, train_loss: 1.2006, test_loss: 1.1864, test_f1: 0.3405
 epoch: 52, train_loss: 1.2040, test_loss: 1.1868, test_f1: 0.3462
 epoch: 53, train_loss: 1.2002, test_loss: 1.1867, test_f1: 0.3462
 epoch: 54, train_loss: 1.2038, test_loss: 1.1872, test_f1: 0.3420
 epoch: 55, train_loss: 1.1995, test_loss: 1.1866, test_f1: 0.3473
 epoch: 56, train_loss: 1.1971, test_loss: 1.1862, test_f1: 0.3474
 epoch: 57, train_loss: 1.1940, test_loss: 1.1857, test_f1: 0.3422
 epoch: 58, train_loss: 1.2009, test_loss: 1.1845, test_f1: 0.3462
 epoch: 59, train_loss: 1.1996, test_loss: 1.1855, test_f1: 0.3461
 epoch: 60, train_loss: 1.1900, test_loss: 1.1843, test_f1: 0.3455
 epoch: 61, train_loss: 1.1955, test_loss: 1.1843, test_f1: 0.3406
 epoch: 62, train_loss: 1.1977, test_loss: 1.1833, test_f1: 0.3464
 epoch: 63, train_loss: 1.1999, test_loss: 1.1835, test_f1: 0.3524
 epoch: 64, train_loss: 1.1951, test_loss: 1.1838, test_f1: 0.3472
 epoch: 65, train_loss: 1.1966, test_loss: 1.1833, test_f1: 0.3428
 epoch: 66, train_loss: 1.1913, test_loss: 1.1824, test_f1: 0.3451
 epoch: 67, train_loss: 1.1947, test_loss: 1.1817, test_f1: 0.3531
 epoch: 68, train_loss: 1.1957, test_loss: 1.1824, test_f1: 0.3503
 epoch: 69, train_loss: 1.1882, test_loss: 1.1813, test_f1: 0.3466
 epoch: 70, train_loss: 1.1941, test_loss: 1.1813, test_f1: 0.3447
 epoch: 71, train_loss: 1.1906, test_loss: 1.1818, test_f1: 0.3455
 epoch: 72, train_loss: 1.1868, test_loss: 1.1806, test_f1: 0.3516
 epoch: 73, train_loss: 1.1839, test_loss: 1.1821, test_f1: 0.3480
 epoch: 74, train_loss: 1.1924, test_loss: 1.1802, test_f1: 0.3451
 epoch: 75, train_loss: 1.1882, test_loss: 1.1808, test_f1: 0.3441
 epoch: 76, train_loss: 1.1925, test_loss: 1.1797, test_f1: 0.3445
 epoch: 77, train_loss: 1.1892, test_loss: 1.1789, test_f1: 0.3481
 epoch: 78, train_loss: 1.1879, test_loss: 1.1780, test_f1: 0.3406
 epoch: 79, train_loss: 1.1924, test_loss: 1.1783, test_f1: 0.3472
 epoch: 80, train_loss: 1.1856, test_loss: 1.1805, test_f1: 0.3422
 epoch: 81, train_loss: 1.1888, test_loss: 1.1797, test_f1: 0.3437
 epoch: 82, train_loss: 1.1849, test_loss: 1.1792, test_f1: 0.3444
 epoch: 83, train_loss: 1.1930, test_loss: 1.1786, test_f1: 0.3408
 epoch: 84, train_loss: 1.1858, test_loss: 1.1771, test_f1: 0.3469
 epoch: 85, train_loss: 1.1890, test_loss: 1.1761, test_f1: 0.3519
 epoch: 86, train_loss: 1.1829, test_loss: 1.1781, test_f1: 0.3472
 epoch: 87, train_loss: 1.1887, test_loss: 1.1773, test_f1: 0.3508
 epoch: 88, train_loss: 1.1854, test_loss: 1.1774, test_f1: 0.3437
 epoch: 89, train_loss: 1.1889, test_loss: 1.1794, test_f1: 0.3408
 epoch: 90, train_loss: 1.1801, test_loss: 1.1794, test_f1: 0.3482
 epoch: 91, train_loss: 1.1814, test_loss: 1.1785, test_f1: 0.3437
 epoch: 92, train_loss: 1.1841, test_loss: 1.1769, test_f1: 0.3471
 epoch: 93, train_loss: 1.1805, test_loss: 1.1776, test_f1: 0.3442
 epoch: 94, train_loss: 1.1779, test_loss: 1.1768, test_f1: 0.3445
 epoch: 95, train_loss: 1.1824, test_loss: 1.1751, test_f1: 0.3448
 epoch: 96, train_loss: 1.1788, test_loss: 1.1742, test_f1: 0.3515
 epoch: 97, train_loss: 1.1850, test_loss: 1.1763, test_f1: 0.3509
 epoch: 98, train_loss: 1.1789, test_loss: 1.1763, test_f1: 0.3531
 epoch: 99, train_loss: 1.1773, test_loss: 1.1750, test_f1: 0.3529
##################ITERATION #3 ****************************************
 epoch: 0, train_loss: 1.3109, test_loss: 1.3194, test_f1: 0.2274
 epoch: 1, train_loss: 1.3033, test_loss: 1.3116, test_f1: 0.2274
 epoch: 2, train_loss: 1.3007, test_loss: 1.3077, test_f1: 0.2274
 epoch: 3, train_loss: 1.2952, test_loss: 1.3032, test_f1: 0.2274
 epoch: 4, train_loss: 1.2943, test_loss: 1.3004, test_f1: 0.2274
 epoch: 5, train_loss: 1.2889, test_loss: 1.2958, test_f1: 0.2274
 epoch: 6, train_loss: 1.2877, test_loss: 1.2946, test_f1: 0.2274
 epoch: 7, train_loss: 1.2835, test_loss: 1.2904, test_f1: 0.2274
 epoch: 8, train_loss: 1.2788, test_loss: 1.2867, test_f1: 0.2274
 epoch: 9, train_loss: 1.2769, test_loss: 1.2829, test_f1: 0.2274
 epoch: 10, train_loss: 1.2719, test_loss: 1.2801, test_f1: 0.2274
 epoch: 11, train_loss: 1.2709, test_loss: 1.2745, test_f1: 0.2274
 epoch: 12, train_loss: 1.2624, test_loss: 1.2685, test_f1: 0.2274
 epoch: 13, train_loss: 1.2637, test_loss: 1.2672, test_f1: 0.2274
 epoch: 14, train_loss: 1.2647, test_loss: 1.2619, test_f1: 0.2274
 epoch: 15, train_loss: 1.2654, test_loss: 1.2600, test_f1: 0.2327
 epoch: 16, train_loss: 1.2556, test_loss: 1.2569, test_f1: 0.2327
 epoch: 17, train_loss: 1.2545, test_loss: 1.2537, test_f1: 0.2352
 epoch: 18, train_loss: 1.2530, test_loss: 1.2522, test_f1: 0.2355
 epoch: 19, train_loss: 1.2517, test_loss: 1.2461, test_f1: 0.2352
 epoch: 20, train_loss: 1.2499, test_loss: 1.2451, test_f1: 0.2355
 epoch: 21, train_loss: 1.2449, test_loss: 1.2389, test_f1: 0.2356
 epoch: 22, train_loss: 1.2452, test_loss: 1.2375, test_f1: 0.2355
 epoch: 23, train_loss: 1.2445, test_loss: 1.2328, test_f1: 0.2341
 epoch: 24, train_loss: 1.2412, test_loss: 1.2310, test_f1: 0.2341
 epoch: 25, train_loss: 1.2375, test_loss: 1.2325, test_f1: 0.2350
 epoch: 26, train_loss: 1.2291, test_loss: 1.2244, test_f1: 0.2398
 epoch: 27, train_loss: 1.2348, test_loss: 1.2221, test_f1: 0.2398
 epoch: 28, train_loss: 1.2297, test_loss: 1.2207, test_f1: 0.2441
 epoch: 29, train_loss: 1.2297, test_loss: 1.2167, test_f1: 0.2619
 epoch: 30, train_loss: 1.2262, test_loss: 1.2164, test_f1: 0.2459
 epoch: 31, train_loss: 1.2228, test_loss: 1.2124, test_f1: 0.2614
 epoch: 32, train_loss: 1.2170, test_loss: 1.2117, test_f1: 0.2655
 epoch: 33, train_loss: 1.2184, test_loss: 1.2089, test_f1: 0.2633
 epoch: 34, train_loss: 1.2167, test_loss: 1.2033, test_f1: 0.2680
 epoch: 35, train_loss: 1.2203, test_loss: 1.2025, test_f1: 0.2671
 epoch: 36, train_loss: 1.2122, test_loss: 1.1972, test_f1: 0.2792
 epoch: 37, train_loss: 1.2142, test_loss: 1.1972, test_f1: 0.2782
 epoch: 38, train_loss: 1.2077, test_loss: 1.1960, test_f1: 0.2955
 epoch: 39, train_loss: 1.2093, test_loss: 1.1926, test_f1: 0.2974
 epoch: 40, train_loss: 1.2076, test_loss: 1.1915, test_f1: 0.3210
 epoch: 41, train_loss: 1.2114, test_loss: 1.1864, test_f1: 0.3139
 epoch: 42, train_loss: 1.2058, test_loss: 1.1868, test_f1: 0.3224
 epoch: 43, train_loss: 1.1984, test_loss: 1.1814, test_f1: 0.3476
 epoch: 44, train_loss: 1.2026, test_loss: 1.1772, test_f1: 0.3441
 epoch: 45, train_loss: 1.1996, test_loss: 1.1814, test_f1: 0.3387
 epoch: 46, train_loss: 1.1958, test_loss: 1.1800, test_f1: 0.3408
 epoch: 47, train_loss: 1.1969, test_loss: 1.1777, test_f1: 0.3474
 epoch: 48, train_loss: 1.1888, test_loss: 1.1719, test_f1: 0.3516
 epoch: 49, train_loss: 1.1944, test_loss: 1.1725, test_f1: 0.3750
 epoch: 50, train_loss: 1.1856, test_loss: 1.1704, test_f1: 0.3710
 epoch: 51, train_loss: 1.1885, test_loss: 1.1683, test_f1: 0.3741
 epoch: 52, train_loss: 1.1845, test_loss: 1.1701, test_f1: 0.3660
 epoch: 53, train_loss: 1.1882, test_loss: 1.1648, test_f1: 0.3957
 epoch: 54, train_loss: 1.1899, test_loss: 1.1664, test_f1: 0.3809
 epoch: 55, train_loss: 1.1822, test_loss: 1.1650, test_f1: 0.3809
 epoch: 56, train_loss: 1.1834, test_loss: 1.1634, test_f1: 0.3928
 epoch: 57, train_loss: 1.1818, test_loss: 1.1635, test_f1: 0.3777
 epoch: 58, train_loss: 1.1807, test_loss: 1.1643, test_f1: 0.3864
 epoch: 59, train_loss: 1.1842, test_loss: 1.1615, test_f1: 0.3960
 epoch: 60, train_loss: 1.1804, test_loss: 1.1634, test_f1: 0.3822
 epoch: 61, train_loss: 1.1838, test_loss: 1.1625, test_f1: 0.3851
 epoch: 62, train_loss: 1.1832, test_loss: 1.1619, test_f1: 0.4060
 epoch: 63, train_loss: 1.1814, test_loss: 1.1623, test_f1: 0.3792
 epoch: 64, train_loss: 1.1749, test_loss: 1.1598, test_f1: 0.3924
 epoch: 65, train_loss: 1.1831, test_loss: 1.1591, test_f1: 0.3967
 epoch: 66, train_loss: 1.1754, test_loss: 1.1595, test_f1: 0.4021
 epoch: 67, train_loss: 1.1782, test_loss: 1.1584, test_f1: 0.4049
 epoch: 68, train_loss: 1.1676, test_loss: 1.1582, test_f1: 0.4193
 epoch: 69, train_loss: 1.1718, test_loss: 1.1578, test_f1: 0.4095
 epoch: 70, train_loss: 1.1726, test_loss: 1.1565, test_f1: 0.4120
 epoch: 71, train_loss: 1.1663, test_loss: 1.1554, test_f1: 0.4022
 epoch: 72, train_loss: 1.1711, test_loss: 1.1550, test_f1: 0.4146
 epoch: 73, train_loss: 1.1598, test_loss: 1.1501, test_f1: 0.4049
 epoch: 74, train_loss: 1.1733, test_loss: 1.1500, test_f1: 0.4084
 epoch: 75, train_loss: 1.1682, test_loss: 1.1534, test_f1: 0.4069
 epoch: 76, train_loss: 1.1738, test_loss: 1.1558, test_f1: 0.4166
 epoch: 77, train_loss: 1.1646, test_loss: 1.1500, test_f1: 0.4138
 epoch: 78, train_loss: 1.1737, test_loss: 1.1489, test_f1: 0.4179
 epoch: 79, train_loss: 1.1653, test_loss: 1.1499, test_f1: 0.4108
 epoch: 80, train_loss: 1.1642, test_loss: 1.1476, test_f1: 0.4147
 epoch: 81, train_loss: 1.1670, test_loss: 1.1471, test_f1: 0.4217
 epoch: 82, train_loss: 1.1719, test_loss: 1.1472, test_f1: 0.4229
 epoch: 83, train_loss: 1.1560, test_loss: 1.1471, test_f1: 0.4285
 epoch: 84, train_loss: 1.1670, test_loss: 1.1470, test_f1: 0.4208
 epoch: 85, train_loss: 1.1647, test_loss: 1.1485, test_f1: 0.4188
 epoch: 86, train_loss: 1.1646, test_loss: 1.1450, test_f1: 0.4152
 epoch: 87, train_loss: 1.1630, test_loss: 1.1475, test_f1: 0.4110
 epoch: 88, train_loss: 1.1613, test_loss: 1.1467, test_f1: 0.4251
 epoch: 89, train_loss: 1.1622, test_loss: 1.1440, test_f1: 0.4174
 epoch: 90, train_loss: 1.1645, test_loss: 1.1443, test_f1: 0.4230
 epoch: 91, train_loss: 1.1598, test_loss: 1.1404, test_f1: 0.4165
 epoch: 92, train_loss: 1.1589, test_loss: 1.1462, test_f1: 0.4131
 epoch: 93, train_loss: 1.1581, test_loss: 1.1417, test_f1: 0.4209
 epoch: 94, train_loss: 1.1634, test_loss: 1.1403, test_f1: 0.4209
 epoch: 95, train_loss: 1.1568, test_loss: 1.1389, test_f1: 0.4282
 epoch: 96, train_loss: 1.1535, test_loss: 1.1396, test_f1: 0.4189
 epoch: 97, train_loss: 1.1510, test_loss: 1.1405, test_f1: 0.4168
 epoch: 98, train_loss: 1.1551, test_loss: 1.1393, test_f1: 0.4165
 epoch: 99, train_loss: 1.1616, test_loss: 1.1386, test_f1: 0.4295
##################ITERATION #4 ****************************************
 epoch: 0, train_loss: 1.3069, test_loss: 1.3076, test_f1: 0.2274
 epoch: 1, train_loss: 1.3006, test_loss: 1.2981, test_f1: 0.2274
 epoch: 2, train_loss: 1.2889, test_loss: 1.2923, test_f1: 0.2274
 epoch: 3, train_loss: 1.2858, test_loss: 1.2863, test_f1: 0.2274
 epoch: 4, train_loss: 1.2849, test_loss: 1.2826, test_f1: 0.2274
 epoch: 5, train_loss: 1.2771, test_loss: 1.2798, test_f1: 0.2274
 epoch: 6, train_loss: 1.2765, test_loss: 1.2737, test_f1: 0.2274
 epoch: 7, train_loss: 1.2708, test_loss: 1.2677, test_f1: 0.2325
 epoch: 8, train_loss: 1.2696, test_loss: 1.2654, test_f1: 0.2325
 epoch: 9, train_loss: 1.2615, test_loss: 1.2618, test_f1: 0.2411
 epoch: 10, train_loss: 1.2601, test_loss: 1.2551, test_f1: 0.2583
 epoch: 11, train_loss: 1.2591, test_loss: 1.2533, test_f1: 0.2643
 epoch: 12, train_loss: 1.2505, test_loss: 1.2494, test_f1: 0.2822
 epoch: 13, train_loss: 1.2510, test_loss: 1.2448, test_f1: 0.2768
 epoch: 14, train_loss: 1.2459, test_loss: 1.2426, test_f1: 0.2970
 epoch: 15, train_loss: 1.2439, test_loss: 1.2388, test_f1: 0.3013
 epoch: 16, train_loss: 1.2435, test_loss: 1.2355, test_f1: 0.2943
 epoch: 17, train_loss: 1.2417, test_loss: 1.2333, test_f1: 0.3015
 epoch: 18, train_loss: 1.2307, test_loss: 1.2288, test_f1: 0.3110
 epoch: 19, train_loss: 1.2320, test_loss: 1.2255, test_f1: 0.3253
 epoch: 20, train_loss: 1.2326, test_loss: 1.2241, test_f1: 0.3342
 epoch: 21, train_loss: 1.2297, test_loss: 1.2169, test_f1: 0.3304
 epoch: 22, train_loss: 1.2228, test_loss: 1.2135, test_f1: 0.3370
 epoch: 23, train_loss: 1.2242, test_loss: 1.2117, test_f1: 0.3253
 epoch: 24, train_loss: 1.2180, test_loss: 1.2079, test_f1: 0.3330
 epoch: 25, train_loss: 1.2173, test_loss: 1.2054, test_f1: 0.3371
 epoch: 26, train_loss: 1.2147, test_loss: 1.2017, test_f1: 0.3391
 epoch: 27, train_loss: 1.2114, test_loss: 1.1966, test_f1: 0.3389
 epoch: 28, train_loss: 1.2086, test_loss: 1.1919, test_f1: 0.3441
 epoch: 29, train_loss: 1.2055, test_loss: 1.1905, test_f1: 0.3421
 epoch: 30, train_loss: 1.2090, test_loss: 1.1887, test_f1: 0.3440
 epoch: 31, train_loss: 1.1986, test_loss: 1.1833, test_f1: 0.3382
 epoch: 32, train_loss: 1.1972, test_loss: 1.1813, test_f1: 0.3467
 epoch: 33, train_loss: 1.1964, test_loss: 1.1760, test_f1: 0.3461
 epoch: 34, train_loss: 1.1938, test_loss: 1.1749, test_f1: 0.3448
 epoch: 35, train_loss: 1.1920, test_loss: 1.1701, test_f1: 0.3511
 epoch: 36, train_loss: 1.1936, test_loss: 1.1685, test_f1: 0.3631
 epoch: 37, train_loss: 1.1904, test_loss: 1.1647, test_f1: 0.3707
 epoch: 38, train_loss: 1.1842, test_loss: 1.1589, test_f1: 0.3750
 epoch: 39, train_loss: 1.1878, test_loss: 1.1578, test_f1: 0.3767
 epoch: 40, train_loss: 1.1793, test_loss: 1.1535, test_f1: 0.3805
 epoch: 41, train_loss: 1.1790, test_loss: 1.1498, test_f1: 0.3912
 epoch: 42, train_loss: 1.1851, test_loss: 1.1483, test_f1: 0.3973
 epoch: 43, train_loss: 1.1769, test_loss: 1.1442, test_f1: 0.3930
 epoch: 44, train_loss: 1.1746, test_loss: 1.1415, test_f1: 0.3878
 epoch: 45, train_loss: 1.1680, test_loss: 1.1386, test_f1: 0.3887
 epoch: 46, train_loss: 1.1788, test_loss: 1.1342, test_f1: 0.4129
 epoch: 47, train_loss: 1.1759, test_loss: 1.1353, test_f1: 0.4098
 epoch: 48, train_loss: 1.1694, test_loss: 1.1309, test_f1: 0.4094
 epoch: 49, train_loss: 1.1678, test_loss: 1.1314, test_f1: 0.4100
 epoch: 50, train_loss: 1.1676, test_loss: 1.1230, test_f1: 0.4127
 epoch: 51, train_loss: 1.1576, test_loss: 1.1219, test_f1: 0.4160
 epoch: 52, train_loss: 1.1581, test_loss: 1.1246, test_f1: 0.4115
 epoch: 53, train_loss: 1.1579, test_loss: 1.1238, test_f1: 0.4068
 epoch: 54, train_loss: 1.1562, test_loss: 1.1184, test_f1: 0.4187
 epoch: 55, train_loss: 1.1585, test_loss: 1.1195, test_f1: 0.4098
 epoch: 56, train_loss: 1.1611, test_loss: 1.1195, test_f1: 0.4236
 epoch: 57, train_loss: 1.1586, test_loss: 1.1168, test_f1: 0.4307
 epoch: 58, train_loss: 1.1628, test_loss: 1.1183, test_f1: 0.4215
 epoch: 59, train_loss: 1.1527, test_loss: 1.1197, test_f1: 0.4224
 epoch: 60, train_loss: 1.1541, test_loss: 1.1145, test_f1: 0.4245
 epoch: 61, train_loss: 1.1541, test_loss: 1.1117, test_f1: 0.4236
 epoch: 62, train_loss: 1.1554, test_loss: 1.1116, test_f1: 0.4280
 epoch: 63, train_loss: 1.1539, test_loss: 1.1110, test_f1: 0.4301
 epoch: 64, train_loss: 1.1522, test_loss: 1.1108, test_f1: 0.4304
 epoch: 65, train_loss: 1.1440, test_loss: 1.1090, test_f1: 0.4268
 epoch: 66, train_loss: 1.1472, test_loss: 1.1059, test_f1: 0.4347
 epoch: 67, train_loss: 1.1473, test_loss: 1.1067, test_f1: 0.4295
 epoch: 68, train_loss: 1.1513, test_loss: 1.1063, test_f1: 0.4289
 epoch: 69, train_loss: 1.1489, test_loss: 1.1060, test_f1: 0.4277
 epoch: 70, train_loss: 1.1528, test_loss: 1.1049, test_f1: 0.4298
 epoch: 71, train_loss: 1.1440, test_loss: 1.1020, test_f1: 0.4293
 epoch: 72, train_loss: 1.1491, test_loss: 1.1008, test_f1: 0.4291
 epoch: 73, train_loss: 1.1459, test_loss: 1.1045, test_f1: 0.4244
 epoch: 74, train_loss: 1.1415, test_loss: 1.1029, test_f1: 0.4323
 epoch: 75, train_loss: 1.1442, test_loss: 1.1008, test_f1: 0.4279
 epoch: 76, train_loss: 1.1379, test_loss: 1.1002, test_f1: 0.4307
 epoch: 77, train_loss: 1.1390, test_loss: 1.1020, test_f1: 0.4277
 epoch: 78, train_loss: 1.1411, test_loss: 1.0976, test_f1: 0.4256
 epoch: 79, train_loss: 1.1380, test_loss: 1.0999, test_f1: 0.4279
 epoch: 80, train_loss: 1.1444, test_loss: 1.0977, test_f1: 0.4294
 epoch: 81, train_loss: 1.1384, test_loss: 1.0958, test_f1: 0.4271
 epoch: 82, train_loss: 1.1398, test_loss: 1.0966, test_f1: 0.4319
 epoch: 83, train_loss: 1.1358, test_loss: 1.0933, test_f1: 0.4323
 epoch: 84, train_loss: 1.1366, test_loss: 1.0932, test_f1: 0.4306
 epoch: 85, train_loss: 1.1358, test_loss: 1.0923, test_f1: 0.4293
 epoch: 86, train_loss: 1.1346, test_loss: 1.0924, test_f1: 0.4330
 epoch: 87, train_loss: 1.1393, test_loss: 1.0907, test_f1: 0.4372
 epoch: 88, train_loss: 1.1335, test_loss: 1.0913, test_f1: 0.4419
 epoch: 89, train_loss: 1.1454, test_loss: 1.0888, test_f1: 0.4326
 epoch: 90, train_loss: 1.1299, test_loss: 1.0897, test_f1: 0.4321
 epoch: 91, train_loss: 1.1382, test_loss: 1.0914, test_f1: 0.4380
 epoch: 92, train_loss: 1.1300, test_loss: 1.0908, test_f1: 0.4339
 epoch: 93, train_loss: 1.1274, test_loss: 1.0860, test_f1: 0.4347
 epoch: 94, train_loss: 1.1292, test_loss: 1.0870, test_f1: 0.4401
 epoch: 95, train_loss: 1.1305, test_loss: 1.0824, test_f1: 0.4312
 epoch: 96, train_loss: 1.1342, test_loss: 1.0812, test_f1: 0.4362
 epoch: 97, train_loss: 1.1262, test_loss: 1.0836, test_f1: 0.4335
 epoch: 98, train_loss: 1.1300, test_loss: 1.0822, test_f1: 0.4401
 epoch: 99, train_loss: 1.1322, test_loss: 1.0844, test_f1: 0.4386
##################ITERATION #5 ****************************************
 epoch: 0, train_loss: 1.3038, test_loss: 1.3001, test_f1: 0.2274
 epoch: 1, train_loss: 1.2887, test_loss: 1.2866, test_f1: 0.2274
 epoch: 2, train_loss: 1.2851, test_loss: 1.2794, test_f1: 0.2274
 epoch: 3, train_loss: 1.2770, test_loss: 1.2712, test_f1: 0.2266
 epoch: 4, train_loss: 1.2698, test_loss: 1.2645, test_f1: 0.2262
 epoch: 5, train_loss: 1.2645, test_loss: 1.2581, test_f1: 0.2574
 epoch: 6, train_loss: 1.2645, test_loss: 1.2518, test_f1: 0.2550
 epoch: 7, train_loss: 1.2614, test_loss: 1.2452, test_f1: 0.2594
 epoch: 8, train_loss: 1.2550, test_loss: 1.2402, test_f1: 0.2685
 epoch: 9, train_loss: 1.2525, test_loss: 1.2388, test_f1: 0.2920
 epoch: 10, train_loss: 1.2447, test_loss: 1.2326, test_f1: 0.2973
 epoch: 11, train_loss: 1.2436, test_loss: 1.2298, test_f1: 0.3058
 epoch: 12, train_loss: 1.2438, test_loss: 1.2243, test_f1: 0.3055
 epoch: 13, train_loss: 1.2387, test_loss: 1.2224, test_f1: 0.3125
 epoch: 14, train_loss: 1.2384, test_loss: 1.2197, test_f1: 0.3165
 epoch: 15, train_loss: 1.2382, test_loss: 1.2180, test_f1: 0.3168
 epoch: 16, train_loss: 1.2328, test_loss: 1.2126, test_f1: 0.3233
 epoch: 17, train_loss: 1.2366, test_loss: 1.2128, test_f1: 0.3374
 epoch: 18, train_loss: 1.2333, test_loss: 1.2111, test_f1: 0.3313
 epoch: 19, train_loss: 1.2336, test_loss: 1.2083, test_f1: 0.3327
 epoch: 20, train_loss: 1.2275, test_loss: 1.2055, test_f1: 0.3551
 epoch: 21, train_loss: 1.2287, test_loss: 1.2059, test_f1: 0.3506
 epoch: 22, train_loss: 1.2216, test_loss: 1.2045, test_f1: 0.3573
 epoch: 23, train_loss: 1.2189, test_loss: 1.2029, test_f1: 0.3524
 epoch: 24, train_loss: 1.2231, test_loss: 1.2022, test_f1: 0.3691
 epoch: 25, train_loss: 1.2260, test_loss: 1.1990, test_f1: 0.3601
 epoch: 26, train_loss: 1.2184, test_loss: 1.2002, test_f1: 0.3550
 epoch: 27, train_loss: 1.2200, test_loss: 1.2003, test_f1: 0.3670
 epoch: 28, train_loss: 1.2115, test_loss: 1.2000, test_f1: 0.3681
 epoch: 29, train_loss: 1.2177, test_loss: 1.1976, test_f1: 0.3665
 epoch: 30, train_loss: 1.2149, test_loss: 1.1956, test_f1: 0.3655
 epoch: 31, train_loss: 1.2087, test_loss: 1.1955, test_f1: 0.3679
 epoch: 32, train_loss: 1.2103, test_loss: 1.1962, test_f1: 0.3766
 epoch: 33, train_loss: 1.2033, test_loss: 1.1941, test_f1: 0.3800
 epoch: 34, train_loss: 1.2028, test_loss: 1.1962, test_f1: 0.3803
 epoch: 35, train_loss: 1.2075, test_loss: 1.1947, test_f1: 0.3737
 epoch: 36, train_loss: 1.2064, test_loss: 1.1908, test_f1: 0.3715
 epoch: 37, train_loss: 1.2016, test_loss: 1.1920, test_f1: 0.3835
 epoch: 38, train_loss: 1.2013, test_loss: 1.1900, test_f1: 0.3800
 epoch: 39, train_loss: 1.2022, test_loss: 1.1900, test_f1: 0.3782
 epoch: 40, train_loss: 1.2045, test_loss: 1.1887, test_f1: 0.3792
 epoch: 41, train_loss: 1.2012, test_loss: 1.1875, test_f1: 0.3788
 epoch: 42, train_loss: 1.1990, test_loss: 1.1865, test_f1: 0.3827
 epoch: 43, train_loss: 1.1992, test_loss: 1.1880, test_f1: 0.3839
 epoch: 44, train_loss: 1.1994, test_loss: 1.1867, test_f1: 0.3832
 epoch: 45, train_loss: 1.1978, test_loss: 1.1846, test_f1: 0.3847
 epoch: 46, train_loss: 1.1969, test_loss: 1.1862, test_f1: 0.3836
 epoch: 47, train_loss: 1.1939, test_loss: 1.1817, test_f1: 0.3774
 epoch: 48, train_loss: 1.1937, test_loss: 1.1861, test_f1: 0.3875
 epoch: 49, train_loss: 1.1922, test_loss: 1.1838, test_f1: 0.3889
 epoch: 50, train_loss: 1.1956, test_loss: 1.1826, test_f1: 0.3879
 epoch: 51, train_loss: 1.1906, test_loss: 1.1812, test_f1: 0.3895
 epoch: 52, train_loss: 1.1977, test_loss: 1.1819, test_f1: 0.3883
 epoch: 53, train_loss: 1.1916, test_loss: 1.1797, test_f1: 0.3839
 epoch: 54, train_loss: 1.1924, test_loss: 1.1824, test_f1: 0.3890
 epoch: 55, train_loss: 1.1930, test_loss: 1.1803, test_f1: 0.3890
 epoch: 56, train_loss: 1.1873, test_loss: 1.1791, test_f1: 0.3904
 epoch: 57, train_loss: 1.1890, test_loss: 1.1792, test_f1: 0.3939
 epoch: 58, train_loss: 1.1852, test_loss: 1.1802, test_f1: 0.3943
 epoch: 59, train_loss: 1.1812, test_loss: 1.1808, test_f1: 0.3916
 epoch: 60, train_loss: 1.1822, test_loss: 1.1776, test_f1: 0.3870
 epoch: 61, train_loss: 1.1850, test_loss: 1.1765, test_f1: 0.3917
 epoch: 62, train_loss: 1.1818, test_loss: 1.1752, test_f1: 0.3883
 epoch: 63, train_loss: 1.1828, test_loss: 1.1771, test_f1: 0.3902
 epoch: 64, train_loss: 1.1858, test_loss: 1.1803, test_f1: 0.3871
 epoch: 65, train_loss: 1.1887, test_loss: 1.1762, test_f1: 0.3902
 epoch: 66, train_loss: 1.1807, test_loss: 1.1745, test_f1: 0.3872
 epoch: 67, train_loss: 1.1809, test_loss: 1.1723, test_f1: 0.3786
 epoch: 68, train_loss: 1.1785, test_loss: 1.1743, test_f1: 0.3909
 epoch: 69, train_loss: 1.1825, test_loss: 1.1718, test_f1: 0.3911
 epoch: 70, train_loss: 1.1824, test_loss: 1.1734, test_f1: 0.3934
 epoch: 71, train_loss: 1.1793, test_loss: 1.1722, test_f1: 0.3906
 epoch: 72, train_loss: 1.1805, test_loss: 1.1722, test_f1: 0.3872
 epoch: 73, train_loss: 1.1772, test_loss: 1.1723, test_f1: 0.3915
 epoch: 74, train_loss: 1.1781, test_loss: 1.1703, test_f1: 0.3963
 epoch: 75, train_loss: 1.1764, test_loss: 1.1706, test_f1: 0.3941
 epoch: 76, train_loss: 1.1755, test_loss: 1.1718, test_f1: 0.3839
 epoch: 77, train_loss: 1.1791, test_loss: 1.1724, test_f1: 0.3883
 epoch: 78, train_loss: 1.1733, test_loss: 1.1695, test_f1: 0.3953
 epoch: 79, train_loss: 1.1724, test_loss: 1.1683, test_f1: 0.3936
 epoch: 80, train_loss: 1.1756, test_loss: 1.1682, test_f1: 0.3922
 epoch: 81, train_loss: 1.1816, test_loss: 1.1662, test_f1: 0.3924
 epoch: 82, train_loss: 1.1776, test_loss: 1.1633, test_f1: 0.3859
 epoch: 83, train_loss: 1.1765, test_loss: 1.1682, test_f1: 0.3923
 epoch: 84, train_loss: 1.1783, test_loss: 1.1644, test_f1: 0.3944
 epoch: 85, train_loss: 1.1677, test_loss: 1.1639, test_f1: 0.3980
 epoch: 86, train_loss: 1.1726, test_loss: 1.1621, test_f1: 0.3939
 epoch: 87, train_loss: 1.1779, test_loss: 1.1630, test_f1: 0.3990
 epoch: 88, train_loss: 1.1733, test_loss: 1.1604, test_f1: 0.3895
 epoch: 89, train_loss: 1.1711, test_loss: 1.1628, test_f1: 0.3972
 epoch: 90, train_loss: 1.1670, test_loss: 1.1581, test_f1: 0.3954
 epoch: 91, train_loss: 1.1737, test_loss: 1.1561, test_f1: 0.3972
 epoch: 92, train_loss: 1.1659, test_loss: 1.1613, test_f1: 0.4017
 epoch: 93, train_loss: 1.1754, test_loss: 1.1573, test_f1: 0.4011
 epoch: 94, train_loss: 1.1736, test_loss: 1.1562, test_f1: 0.4045
 epoch: 95, train_loss: 1.1627, test_loss: 1.1585, test_f1: 0.4014
 epoch: 96, train_loss: 1.1645, test_loss: 1.1551, test_f1: 0.3969
 epoch: 97, train_loss: 1.1602, test_loss: 1.1558, test_f1: 0.4046
 epoch: 98, train_loss: 1.1694, test_loss: 1.1548, test_f1: 0.3997
 epoch: 99, train_loss: 1.1716, test_loss: 1.1581, test_f1: 0.3986
##################ITERATION #6 ****************************************
 epoch: 0, train_loss: 1.3059, test_loss: 1.2962, test_f1: 0.2555
 epoch: 1, train_loss: 1.2954, test_loss: 1.2872, test_f1: 0.2667
 epoch: 2, train_loss: 1.2833, test_loss: 1.2801, test_f1: 0.2726
 epoch: 3, train_loss: 1.2837, test_loss: 1.2736, test_f1: 0.2711
 epoch: 4, train_loss: 1.2774, test_loss: 1.2683, test_f1: 0.2726
 epoch: 5, train_loss: 1.2717, test_loss: 1.2651, test_f1: 0.2713
 epoch: 6, train_loss: 1.2673, test_loss: 1.2597, test_f1: 0.2713
 epoch: 7, train_loss: 1.2662, test_loss: 1.2559, test_f1: 0.2735
 epoch: 8, train_loss: 1.2648, test_loss: 1.2532, test_f1: 0.2735
 epoch: 9, train_loss: 1.2599, test_loss: 1.2483, test_f1: 0.2714
 epoch: 10, train_loss: 1.2606, test_loss: 1.2445, test_f1: 0.2776
 epoch: 11, train_loss: 1.2571, test_loss: 1.2420, test_f1: 0.2810
 epoch: 12, train_loss: 1.2542, test_loss: 1.2382, test_f1: 0.2810
 epoch: 13, train_loss: 1.2511, test_loss: 1.2360, test_f1: 0.2830
 epoch: 14, train_loss: 1.2513, test_loss: 1.2356, test_f1: 0.2830
 epoch: 15, train_loss: 1.2475, test_loss: 1.2321, test_f1: 0.2919
 epoch: 16, train_loss: 1.2477, test_loss: 1.2318, test_f1: 0.2908
 epoch: 17, train_loss: 1.2451, test_loss: 1.2311, test_f1: 0.2983
 epoch: 18, train_loss: 1.2454, test_loss: 1.2294, test_f1: 0.2974
 epoch: 19, train_loss: 1.2357, test_loss: 1.2257, test_f1: 0.3042
 epoch: 20, train_loss: 1.2438, test_loss: 1.2244, test_f1: 0.3068
 epoch: 21, train_loss: 1.2386, test_loss: 1.2206, test_f1: 0.3076
 epoch: 22, train_loss: 1.2383, test_loss: 1.2196, test_f1: 0.3093
 epoch: 23, train_loss: 1.2362, test_loss: 1.2188, test_f1: 0.3150
 epoch: 24, train_loss: 1.2337, test_loss: 1.2145, test_f1: 0.3287
 epoch: 25, train_loss: 1.2381, test_loss: 1.2144, test_f1: 0.3367
 epoch: 26, train_loss: 1.2317, test_loss: 1.2138, test_f1: 0.3282
 epoch: 27, train_loss: 1.2318, test_loss: 1.2118, test_f1: 0.3335
 epoch: 28, train_loss: 1.2263, test_loss: 1.2091, test_f1: 0.3364
 epoch: 29, train_loss: 1.2236, test_loss: 1.2094, test_f1: 0.3432
 epoch: 30, train_loss: 1.2266, test_loss: 1.2089, test_f1: 0.3452
 epoch: 31, train_loss: 1.2249, test_loss: 1.2061, test_f1: 0.3335
 epoch: 32, train_loss: 1.2246, test_loss: 1.2046, test_f1: 0.3393
 epoch: 33, train_loss: 1.2188, test_loss: 1.2014, test_f1: 0.3487
 epoch: 34, train_loss: 1.2136, test_loss: 1.1995, test_f1: 0.3519
 epoch: 35, train_loss: 1.2162, test_loss: 1.1959, test_f1: 0.3538
 epoch: 36, train_loss: 1.2187, test_loss: 1.1956, test_f1: 0.3532
 epoch: 37, train_loss: 1.2160, test_loss: 1.1947, test_f1: 0.3567
 epoch: 38, train_loss: 1.2136, test_loss: 1.1914, test_f1: 0.3472
 epoch: 39, train_loss: 1.2153, test_loss: 1.1911, test_f1: 0.3353
 epoch: 40, train_loss: 1.2088, test_loss: 1.1906, test_f1: 0.3574
 epoch: 41, train_loss: 1.2025, test_loss: 1.1856, test_f1: 0.3643
 epoch: 42, train_loss: 1.2059, test_loss: 1.1831, test_f1: 0.3602
 epoch: 43, train_loss: 1.2030, test_loss: 1.1847, test_f1: 0.3633
 epoch: 44, train_loss: 1.2023, test_loss: 1.1845, test_f1: 0.3648
 epoch: 45, train_loss: 1.1987, test_loss: 1.1813, test_f1: 0.3616
 epoch: 46, train_loss: 1.1998, test_loss: 1.1830, test_f1: 0.3628
 epoch: 47, train_loss: 1.2006, test_loss: 1.1778, test_f1: 0.3655
 epoch: 48, train_loss: 1.1916, test_loss: 1.1788, test_f1: 0.3838
 epoch: 49, train_loss: 1.1966, test_loss: 1.1769, test_f1: 0.3743
 epoch: 50, train_loss: 1.1966, test_loss: 1.1800, test_f1: 0.3702
 epoch: 51, train_loss: 1.1940, test_loss: 1.1751, test_f1: 0.3814
 epoch: 52, train_loss: 1.1925, test_loss: 1.1729, test_f1: 0.3891
 epoch: 53, train_loss: 1.1899, test_loss: 1.1750, test_f1: 0.3796
 epoch: 54, train_loss: 1.1894, test_loss: 1.1753, test_f1: 0.3817
 epoch: 55, train_loss: 1.1859, test_loss: 1.1724, test_f1: 0.3883
 epoch: 56, train_loss: 1.1913, test_loss: 1.1721, test_f1: 0.3795
 epoch: 57, train_loss: 1.1909, test_loss: 1.1742, test_f1: 0.3829
 epoch: 58, train_loss: 1.1891, test_loss: 1.1739, test_f1: 0.3827
 epoch: 59, train_loss: 1.1948, test_loss: 1.1719, test_f1: 0.3851
 epoch: 60, train_loss: 1.1838, test_loss: 1.1705, test_f1: 0.3821
 epoch: 61, train_loss: 1.1817, test_loss: 1.1708, test_f1: 0.3824
 epoch: 62, train_loss: 1.1929, test_loss: 1.1699, test_f1: 0.3890
 epoch: 63, train_loss: 1.1859, test_loss: 1.1729, test_f1: 0.3767
 epoch: 64, train_loss: 1.1854, test_loss: 1.1689, test_f1: 0.3825
 epoch: 65, train_loss: 1.1792, test_loss: 1.1682, test_f1: 0.3891
 epoch: 66, train_loss: 1.1850, test_loss: 1.1672, test_f1: 0.3951
 epoch: 67, train_loss: 1.1869, test_loss: 1.1673, test_f1: 0.3970
 epoch: 68, train_loss: 1.1819, test_loss: 1.1681, test_f1: 0.3929
 epoch: 69, train_loss: 1.1802, test_loss: 1.1686, test_f1: 0.3887
 epoch: 70, train_loss: 1.1827, test_loss: 1.1669, test_f1: 0.3868
 epoch: 71, train_loss: 1.1788, test_loss: 1.1674, test_f1: 0.3856
 epoch: 72, train_loss: 1.1806, test_loss: 1.1650, test_f1: 0.3871
 epoch: 73, train_loss: 1.1813, test_loss: 1.1645, test_f1: 0.3984
 epoch: 74, train_loss: 1.1750, test_loss: 1.1676, test_f1: 0.3872
 epoch: 75, train_loss: 1.1749, test_loss: 1.1658, test_f1: 0.3911
 epoch: 76, train_loss: 1.1786, test_loss: 1.1640, test_f1: 0.3975
 epoch: 77, train_loss: 1.1765, test_loss: 1.1646, test_f1: 0.4026
 epoch: 78, train_loss: 1.1726, test_loss: 1.1645, test_f1: 0.3995
 epoch: 79, train_loss: 1.1792, test_loss: 1.1653, test_f1: 0.3996
 epoch: 80, train_loss: 1.1849, test_loss: 1.1640, test_f1: 0.3973
 epoch: 81, train_loss: 1.1726, test_loss: 1.1658, test_f1: 0.3891
 epoch: 82, train_loss: 1.1684, test_loss: 1.1630, test_f1: 0.4008
 epoch: 83, train_loss: 1.1727, test_loss: 1.1634, test_f1: 0.3999
 epoch: 84, train_loss: 1.1779, test_loss: 1.1614, test_f1: 0.4060
 epoch: 85, train_loss: 1.1721, test_loss: 1.1616, test_f1: 0.4044
 epoch: 86, train_loss: 1.1716, test_loss: 1.1616, test_f1: 0.3983
 epoch: 87, train_loss: 1.1818, test_loss: 1.1626, test_f1: 0.3962
 epoch: 88, train_loss: 1.1725, test_loss: 1.1604, test_f1: 0.4019
 epoch: 89, train_loss: 1.1712, test_loss: 1.1572, test_f1: 0.3975
 epoch: 90, train_loss: 1.1665, test_loss: 1.1598, test_f1: 0.3980
 epoch: 91, train_loss: 1.1638, test_loss: 1.1606, test_f1: 0.4033
 epoch: 92, train_loss: 1.1666, test_loss: 1.1602, test_f1: 0.4023
 epoch: 93, train_loss: 1.1657, test_loss: 1.1577, test_f1: 0.4092
 epoch: 94, train_loss: 1.1643, test_loss: 1.1590, test_f1: 0.4021
 epoch: 95, train_loss: 1.1677, test_loss: 1.1596, test_f1: 0.3959
 epoch: 96, train_loss: 1.1650, test_loss: 1.1594, test_f1: 0.4008
 epoch: 97, train_loss: 1.1680, test_loss: 1.1553, test_f1: 0.4090
 epoch: 98, train_loss: 1.1691, test_loss: 1.1568, test_f1: 0.4027
 epoch: 99, train_loss: 1.1596, test_loss: 1.1551, test_f1: 0.4071
##################ITERATION #7 ****************************************
 epoch: 0, train_loss: 1.3205, test_loss: 1.3134, test_f1: 0.2274
 epoch: 1, train_loss: 1.3029, test_loss: 1.2969, test_f1: 0.2389
 epoch: 2, train_loss: 1.2821, test_loss: 1.2889, test_f1: 0.2327
 epoch: 3, train_loss: 1.2831, test_loss: 1.2822, test_f1: 0.2447
 epoch: 4, train_loss: 1.2815, test_loss: 1.2746, test_f1: 0.2562
 epoch: 5, train_loss: 1.2801, test_loss: 1.2683, test_f1: 0.2630
 epoch: 6, train_loss: 1.2717, test_loss: 1.2625, test_f1: 0.2817
 epoch: 7, train_loss: 1.2606, test_loss: 1.2570, test_f1: 0.2824
 epoch: 8, train_loss: 1.2705, test_loss: 1.2529, test_f1: 0.2980
 epoch: 9, train_loss: 1.2623, test_loss: 1.2519, test_f1: 0.2871
 epoch: 10, train_loss: 1.2592, test_loss: 1.2474, test_f1: 0.2967
 epoch: 11, train_loss: 1.2525, test_loss: 1.2423, test_f1: 0.3005
 epoch: 12, train_loss: 1.2523, test_loss: 1.2409, test_f1: 0.3002
 epoch: 13, train_loss: 1.2492, test_loss: 1.2356, test_f1: 0.3190
 epoch: 14, train_loss: 1.2391, test_loss: 1.2315, test_f1: 0.3191
 epoch: 15, train_loss: 1.2400, test_loss: 1.2270, test_f1: 0.3365
 epoch: 16, train_loss: 1.2386, test_loss: 1.2219, test_f1: 0.3434
 epoch: 17, train_loss: 1.2347, test_loss: 1.2219, test_f1: 0.3233
 epoch: 18, train_loss: 1.2333, test_loss: 1.2197, test_f1: 0.3269
 epoch: 19, train_loss: 1.2343, test_loss: 1.2125, test_f1: 0.3468
 epoch: 20, train_loss: 1.2251, test_loss: 1.2130, test_f1: 0.3304
 epoch: 21, train_loss: 1.2200, test_loss: 1.2088, test_f1: 0.3376
 epoch: 22, train_loss: 1.2292, test_loss: 1.2035, test_f1: 0.3462
 epoch: 23, train_loss: 1.2200, test_loss: 1.2031, test_f1: 0.3512
 epoch: 24, train_loss: 1.2160, test_loss: 1.1984, test_f1: 0.3476
 epoch: 25, train_loss: 1.2226, test_loss: 1.1965, test_f1: 0.3600
 epoch: 26, train_loss: 1.2149, test_loss: 1.1935, test_f1: 0.3574
 epoch: 27, train_loss: 1.2098, test_loss: 1.1912, test_f1: 0.3445
 epoch: 28, train_loss: 1.2077, test_loss: 1.1885, test_f1: 0.3534
 epoch: 29, train_loss: 1.2068, test_loss: 1.1852, test_f1: 0.3560
 epoch: 30, train_loss: 1.2018, test_loss: 1.1819, test_f1: 0.3499
 epoch: 31, train_loss: 1.2014, test_loss: 1.1798, test_f1: 0.3421
 epoch: 32, train_loss: 1.1989, test_loss: 1.1774, test_f1: 0.3723
 epoch: 33, train_loss: 1.2001, test_loss: 1.1741, test_f1: 0.3427
 epoch: 34, train_loss: 1.1915, test_loss: 1.1757, test_f1: 0.3415
 epoch: 35, train_loss: 1.1968, test_loss: 1.1675, test_f1: 0.3512
 epoch: 36, train_loss: 1.1839, test_loss: 1.1659, test_f1: 0.3717
 epoch: 37, train_loss: 1.1890, test_loss: 1.1617, test_f1: 0.3570
 epoch: 38, train_loss: 1.1855, test_loss: 1.1579, test_f1: 0.3518
 epoch: 39, train_loss: 1.1828, test_loss: 1.1582, test_f1: 0.3505
 epoch: 40, train_loss: 1.1770, test_loss: 1.1526, test_f1: 0.3641
 epoch: 41, train_loss: 1.1765, test_loss: 1.1497, test_f1: 0.3750
 epoch: 42, train_loss: 1.1720, test_loss: 1.1488, test_f1: 0.4050
 epoch: 43, train_loss: 1.1785, test_loss: 1.1455, test_f1: 0.3836
 epoch: 44, train_loss: 1.1675, test_loss: 1.1451, test_f1: 0.3873
 epoch: 45, train_loss: 1.1703, test_loss: 1.1412, test_f1: 0.4180
 epoch: 46, train_loss: 1.1730, test_loss: 1.1388, test_f1: 0.4243
 epoch: 47, train_loss: 1.1642, test_loss: 1.1366, test_f1: 0.4279
 epoch: 48, train_loss: 1.1608, test_loss: 1.1334, test_f1: 0.4138
 epoch: 49, train_loss: 1.1610, test_loss: 1.1331, test_f1: 0.4212
 epoch: 50, train_loss: 1.1593, test_loss: 1.1291, test_f1: 0.4144
 epoch: 51, train_loss: 1.1574, test_loss: 1.1294, test_f1: 0.4178
 epoch: 52, train_loss: 1.1675, test_loss: 1.1278, test_f1: 0.4526
 epoch: 53, train_loss: 1.1596, test_loss: 1.1252, test_f1: 0.4300
 epoch: 54, train_loss: 1.1591, test_loss: 1.1244, test_f1: 0.4338
 epoch: 55, train_loss: 1.1544, test_loss: 1.1249, test_f1: 0.4319
 epoch: 56, train_loss: 1.1581, test_loss: 1.1232, test_f1: 0.4499
 epoch: 57, train_loss: 1.1563, test_loss: 1.1241, test_f1: 0.4262
 epoch: 58, train_loss: 1.1532, test_loss: 1.1240, test_f1: 0.4221
 epoch: 59, train_loss: 1.1490, test_loss: 1.1237, test_f1: 0.4310
 epoch: 60, train_loss: 1.1528, test_loss: 1.1202, test_f1: 0.4429
 epoch: 61, train_loss: 1.1495, test_loss: 1.1178, test_f1: 0.4455
 epoch: 62, train_loss: 1.1453, test_loss: 1.1156, test_f1: 0.4424
 epoch: 63, train_loss: 1.1431, test_loss: 1.1151, test_f1: 0.4294
 epoch: 64, train_loss: 1.1500, test_loss: 1.1155, test_f1: 0.4361
 epoch: 65, train_loss: 1.1481, test_loss: 1.1164, test_f1: 0.4361
 epoch: 66, train_loss: 1.1434, test_loss: 1.1137, test_f1: 0.4554
 epoch: 67, train_loss: 1.1550, test_loss: 1.1107, test_f1: 0.4547
 epoch: 68, train_loss: 1.1444, test_loss: 1.1118, test_f1: 0.4289
 epoch: 69, train_loss: 1.1467, test_loss: 1.1071, test_f1: 0.4539
 epoch: 70, train_loss: 1.1446, test_loss: 1.1108, test_f1: 0.4339
 epoch: 71, train_loss: 1.1365, test_loss: 1.1070, test_f1: 0.4381
 epoch: 72, train_loss: 1.1441, test_loss: 1.1060, test_f1: 0.4639
 epoch: 73, train_loss: 1.1428, test_loss: 1.1057, test_f1: 0.4385
 epoch: 74, train_loss: 1.1370, test_loss: 1.1042, test_f1: 0.4423
 epoch: 75, train_loss: 1.1364, test_loss: 1.1054, test_f1: 0.4566
 epoch: 76, train_loss: 1.1436, test_loss: 1.1040, test_f1: 0.4415
 epoch: 77, train_loss: 1.1405, test_loss: 1.1034, test_f1: 0.4594
 epoch: 78, train_loss: 1.1425, test_loss: 1.1033, test_f1: 0.4718
 epoch: 79, train_loss: 1.1388, test_loss: 1.1014, test_f1: 0.4651
 epoch: 80, train_loss: 1.1425, test_loss: 1.1006, test_f1: 0.4696
 epoch: 81, train_loss: 1.1360, test_loss: 1.0991, test_f1: 0.4669
 epoch: 82, train_loss: 1.1357, test_loss: 1.0984, test_f1: 0.4485
 epoch: 83, train_loss: 1.1399, test_loss: 1.0989, test_f1: 0.4393
 epoch: 84, train_loss: 1.1363, test_loss: 1.0965, test_f1: 0.4580
 epoch: 85, train_loss: 1.1260, test_loss: 1.0968, test_f1: 0.4675
 epoch: 86, train_loss: 1.1309, test_loss: 1.0948, test_f1: 0.4503
 epoch: 87, train_loss: 1.1308, test_loss: 1.0939, test_f1: 0.4567
 epoch: 88, train_loss: 1.1359, test_loss: 1.0951, test_f1: 0.4543
 epoch: 89, train_loss: 1.1305, test_loss: 1.0935, test_f1: 0.4609
 epoch: 90, train_loss: 1.1332, test_loss: 1.0930, test_f1: 0.4756
 epoch: 91, train_loss: 1.1311, test_loss: 1.0924, test_f1: 0.4492
 epoch: 92, train_loss: 1.1276, test_loss: 1.0905, test_f1: 0.4657
 epoch: 93, train_loss: 1.1339, test_loss: 1.0938, test_f1: 0.4714
 epoch: 94, train_loss: 1.1389, test_loss: 1.0884, test_f1: 0.4644
 epoch: 95, train_loss: 1.1229, test_loss: 1.0875, test_f1: 0.4785
 epoch: 96, train_loss: 1.1394, test_loss: 1.0881, test_f1: 0.4732
 epoch: 97, train_loss: 1.1221, test_loss: 1.0913, test_f1: 0.4793
 epoch: 98, train_loss: 1.1317, test_loss: 1.0889, test_f1: 0.4660
 epoch: 99, train_loss: 1.1286, test_loss: 1.0871, test_f1: 0.4829
##################ITERATION #8 ****************************************
 epoch: 0, train_loss: 1.3419, test_loss: 1.3197, test_f1: 0.2582
 epoch: 1, train_loss: 1.3131, test_loss: 1.3007, test_f1: 0.2584
 epoch: 2, train_loss: 1.2984, test_loss: 1.2881, test_f1: 0.2580
 epoch: 3, train_loss: 1.2852, test_loss: 1.2759, test_f1: 0.2678
 epoch: 4, train_loss: 1.2805, test_loss: 1.2648, test_f1: 0.2569
 epoch: 5, train_loss: 1.2701, test_loss: 1.2560, test_f1: 0.2747
 epoch: 6, train_loss: 1.2687, test_loss: 1.2456, test_f1: 0.2802
 epoch: 7, train_loss: 1.2600, test_loss: 1.2396, test_f1: 0.2871
 epoch: 8, train_loss: 1.2578, test_loss: 1.2318, test_f1: 0.3021
 epoch: 9, train_loss: 1.2532, test_loss: 1.2269, test_f1: 0.3054
 epoch: 10, train_loss: 1.2448, test_loss: 1.2146, test_f1: 0.3137
 epoch: 11, train_loss: 1.2381, test_loss: 1.2102, test_f1: 0.3157
 epoch: 12, train_loss: 1.2334, test_loss: 1.2040, test_f1: 0.3245
 epoch: 13, train_loss: 1.2284, test_loss: 1.1989, test_f1: 0.3340
 epoch: 14, train_loss: 1.2265, test_loss: 1.1948, test_f1: 0.3360
 epoch: 15, train_loss: 1.2239, test_loss: 1.1839, test_f1: 0.3340
 epoch: 16, train_loss: 1.2178, test_loss: 1.1772, test_f1: 0.3205
 epoch: 17, train_loss: 1.2157, test_loss: 1.1732, test_f1: 0.3291
 epoch: 18, train_loss: 1.2123, test_loss: 1.1735, test_f1: 0.3256
 epoch: 19, train_loss: 1.2075, test_loss: 1.1685, test_f1: 0.3317
 epoch: 20, train_loss: 1.2055, test_loss: 1.1631, test_f1: 0.3427
 epoch: 21, train_loss: 1.2002, test_loss: 1.1567, test_f1: 0.3497
 epoch: 22, train_loss: 1.1976, test_loss: 1.1511, test_f1: 0.3649
 epoch: 23, train_loss: 1.1911, test_loss: 1.1458, test_f1: 0.3740
 epoch: 24, train_loss: 1.1932, test_loss: 1.1413, test_f1: 0.3732
 epoch: 25, train_loss: 1.1916, test_loss: 1.1375, test_f1: 0.3835
 epoch: 26, train_loss: 1.1845, test_loss: 1.1324, test_f1: 0.3855
 epoch: 27, train_loss: 1.1844, test_loss: 1.1277, test_f1: 0.3880
 epoch: 28, train_loss: 1.1834, test_loss: 1.1245, test_f1: 0.3946
 epoch: 29, train_loss: 1.1778, test_loss: 1.1226, test_f1: 0.4019
 epoch: 30, train_loss: 1.1739, test_loss: 1.1179, test_f1: 0.3916
 epoch: 31, train_loss: 1.1634, test_loss: 1.1138, test_f1: 0.4017
 epoch: 32, train_loss: 1.1593, test_loss: 1.1109, test_f1: 0.4048
 epoch: 33, train_loss: 1.1680, test_loss: 1.1063, test_f1: 0.4202
 epoch: 34, train_loss: 1.1637, test_loss: 1.0996, test_f1: 0.4409
 epoch: 35, train_loss: 1.1597, test_loss: 1.0991, test_f1: 0.4362
 epoch: 36, train_loss: 1.1608, test_loss: 1.0932, test_f1: 0.4387
 epoch: 37, train_loss: 1.1534, test_loss: 1.0903, test_f1: 0.4401
 epoch: 38, train_loss: 1.1527, test_loss: 1.0861, test_f1: 0.4521
 epoch: 39, train_loss: 1.1521, test_loss: 1.0846, test_f1: 0.4501
 epoch: 40, train_loss: 1.1472, test_loss: 1.0822, test_f1: 0.4565
 epoch: 41, train_loss: 1.1498, test_loss: 1.0825, test_f1: 0.4521
 epoch: 42, train_loss: 1.1543, test_loss: 1.0772, test_f1: 0.4588
 epoch: 43, train_loss: 1.1414, test_loss: 1.0721, test_f1: 0.4585
 epoch: 44, train_loss: 1.1455, test_loss: 1.0686, test_f1: 0.4634
 epoch: 45, train_loss: 1.1404, test_loss: 1.0665, test_f1: 0.4687
 epoch: 46, train_loss: 1.1349, test_loss: 1.0627, test_f1: 0.4758
 epoch: 47, train_loss: 1.1305, test_loss: 1.0601, test_f1: 0.4939
 epoch: 48, train_loss: 1.1323, test_loss: 1.0605, test_f1: 0.4688
 epoch: 49, train_loss: 1.1417, test_loss: 1.0581, test_f1: 0.4901
 epoch: 50, train_loss: 1.1433, test_loss: 1.0581, test_f1: 0.4596
 epoch: 51, train_loss: 1.1319, test_loss: 1.0546, test_f1: 0.4631
 epoch: 52, train_loss: 1.1339, test_loss: 1.0540, test_f1: 0.4801
 epoch: 53, train_loss: 1.1275, test_loss: 1.0565, test_f1: 0.4770
 epoch: 54, train_loss: 1.1299, test_loss: 1.0509, test_f1: 0.4716
 epoch: 55, train_loss: 1.1302, test_loss: 1.0518, test_f1: 0.4834
 epoch: 56, train_loss: 1.1233, test_loss: 1.0497, test_f1: 0.4901
 epoch: 57, train_loss: 1.1199, test_loss: 1.0463, test_f1: 0.4871
 epoch: 58, train_loss: 1.1194, test_loss: 1.0467, test_f1: 0.4891
 epoch: 59, train_loss: 1.1153, test_loss: 1.0447, test_f1: 0.4910
 epoch: 60, train_loss: 1.1194, test_loss: 1.0421, test_f1: 0.4872
 epoch: 61, train_loss: 1.1192, test_loss: 1.0418, test_f1: 0.4914
 epoch: 62, train_loss: 1.1102, test_loss: 1.0417, test_f1: 0.4906
 epoch: 63, train_loss: 1.1165, test_loss: 1.0390, test_f1: 0.4744
 epoch: 64, train_loss: 1.1193, test_loss: 1.0403, test_f1: 0.4883
 epoch: 65, train_loss: 1.1194, test_loss: 1.0370, test_f1: 0.4843
 epoch: 66, train_loss: 1.1181, test_loss: 1.0374, test_f1: 0.4889
 epoch: 67, train_loss: 1.1135, test_loss: 1.0326, test_f1: 0.4879
 epoch: 68, train_loss: 1.1076, test_loss: 1.0296, test_f1: 0.4895
 epoch: 69, train_loss: 1.1147, test_loss: 1.0330, test_f1: 0.4917
 epoch: 70, train_loss: 1.1058, test_loss: 1.0305, test_f1: 0.4942
 epoch: 71, train_loss: 1.1059, test_loss: 1.0339, test_f1: 0.4977
 epoch: 72, train_loss: 1.1052, test_loss: 1.0300, test_f1: 0.4960
 epoch: 73, train_loss: 1.1066, test_loss: 1.0275, test_f1: 0.4920
 epoch: 74, train_loss: 1.1134, test_loss: 1.0263, test_f1: 0.4939
 epoch: 75, train_loss: 1.1166, test_loss: 1.0248, test_f1: 0.4905
 epoch: 76, train_loss: 1.1028, test_loss: 1.0245, test_f1: 0.4980
 epoch: 77, train_loss: 1.1077, test_loss: 1.0257, test_f1: 0.4999
 epoch: 78, train_loss: 1.1036, test_loss: 1.0238, test_f1: 0.4922
 epoch: 79, train_loss: 1.1033, test_loss: 1.0189, test_f1: 0.4975
 epoch: 80, train_loss: 1.1066, test_loss: 1.0217, test_f1: 0.5011
 epoch: 81, train_loss: 1.1051, test_loss: 1.0145, test_f1: 0.4954
 epoch: 82, train_loss: 1.1017, test_loss: 1.0185, test_f1: 0.4980
 epoch: 83, train_loss: 1.0986, test_loss: 1.0151, test_f1: 0.4942
 epoch: 84, train_loss: 1.1065, test_loss: 1.0171, test_f1: 0.4933
 epoch: 85, train_loss: 1.1018, test_loss: 1.0159, test_f1: 0.4960
 epoch: 86, train_loss: 1.0933, test_loss: 1.0116, test_f1: 0.4975
 epoch: 87, train_loss: 1.1004, test_loss: 1.0159, test_f1: 0.4992
 epoch: 88, train_loss: 1.0973, test_loss: 1.0170, test_f1: 0.4960
 epoch: 89, train_loss: 1.1031, test_loss: 1.0164, test_f1: 0.4957
 epoch: 90, train_loss: 1.0920, test_loss: 1.0126, test_f1: 0.4928
 epoch: 91, train_loss: 1.0917, test_loss: 1.0098, test_f1: 0.4958
 epoch: 92, train_loss: 1.0944, test_loss: 1.0107, test_f1: 0.4994
 epoch: 93, train_loss: 1.0925, test_loss: 1.0111, test_f1: 0.4927
 epoch: 94, train_loss: 1.0951, test_loss: 1.0103, test_f1: 0.4935
 epoch: 95, train_loss: 1.1020, test_loss: 1.0065, test_f1: 0.4945
 epoch: 96, train_loss: 1.0967, test_loss: 0.9999, test_f1: 0.5042
 epoch: 97, train_loss: 1.0909, test_loss: 1.0078, test_f1: 0.4987
 epoch: 98, train_loss: 1.0980, test_loss: 1.0068, test_f1: 0.4995
 epoch: 99, train_loss: 1.0908, test_loss: 1.0018, test_f1: 0.5003
##################ITERATION #9 ****************************************
 epoch: 0, train_loss: 1.3381, test_loss: 1.3314, test_f1: 0.2589
 epoch: 1, train_loss: 1.3158, test_loss: 1.3231, test_f1: 0.2589
 epoch: 2, train_loss: 1.3071, test_loss: 1.3125, test_f1: 0.2589
 epoch: 3, train_loss: 1.2991, test_loss: 1.3037, test_f1: 0.2589
 epoch: 4, train_loss: 1.2887, test_loss: 1.2972, test_f1: 0.2589
 epoch: 5, train_loss: 1.2804, test_loss: 1.2900, test_f1: 0.2589
 epoch: 6, train_loss: 1.2766, test_loss: 1.2853, test_f1: 0.2589
 epoch: 7, train_loss: 1.2726, test_loss: 1.2809, test_f1: 0.2589
 epoch: 8, train_loss: 1.2680, test_loss: 1.2764, test_f1: 0.2589
 epoch: 9, train_loss: 1.2691, test_loss: 1.2698, test_f1: 0.2505
 epoch: 10, train_loss: 1.2623, test_loss: 1.2669, test_f1: 0.2689
 epoch: 11, train_loss: 1.2624, test_loss: 1.2662, test_f1: 0.2647
 epoch: 12, train_loss: 1.2602, test_loss: 1.2618, test_f1: 0.2671
 epoch: 13, train_loss: 1.2555, test_loss: 1.2586, test_f1: 0.2681
 epoch: 14, train_loss: 1.2536, test_loss: 1.2567, test_f1: 0.2837
 epoch: 15, train_loss: 1.2545, test_loss: 1.2572, test_f1: 0.2831
 epoch: 16, train_loss: 1.2541, test_loss: 1.2542, test_f1: 0.2914
 epoch: 17, train_loss: 1.2498, test_loss: 1.2521, test_f1: 0.2933
 epoch: 18, train_loss: 1.2512, test_loss: 1.2472, test_f1: 0.2811
 epoch: 19, train_loss: 1.2481, test_loss: 1.2422, test_f1: 0.2950
 epoch: 20, train_loss: 1.2465, test_loss: 1.2411, test_f1: 0.2973
 epoch: 21, train_loss: 1.2467, test_loss: 1.2416, test_f1: 0.2916
 epoch: 22, train_loss: 1.2434, test_loss: 1.2430, test_f1: 0.2870
 epoch: 23, train_loss: 1.2441, test_loss: 1.2354, test_f1: 0.2961
 epoch: 24, train_loss: 1.2404, test_loss: 1.2335, test_f1: 0.3011
 epoch: 25, train_loss: 1.2411, test_loss: 1.2310, test_f1: 0.2923
 epoch: 26, train_loss: 1.2405, test_loss: 1.2309, test_f1: 0.3200
 epoch: 27, train_loss: 1.2403, test_loss: 1.2266, test_f1: 0.3035
 epoch: 28, train_loss: 1.2331, test_loss: 1.2251, test_f1: 0.2979
 epoch: 29, train_loss: 1.2294, test_loss: 1.2218, test_f1: 0.3095
 epoch: 30, train_loss: 1.2356, test_loss: 1.2208, test_f1: 0.2979
 epoch: 31, train_loss: 1.2271, test_loss: 1.2163, test_f1: 0.3019
 epoch: 32, train_loss: 1.2313, test_loss: 1.2169, test_f1: 0.2974
 epoch: 33, train_loss: 1.2298, test_loss: 1.2138, test_f1: 0.3012
 epoch: 34, train_loss: 1.2244, test_loss: 1.2103, test_f1: 0.3069
 epoch: 35, train_loss: 1.2303, test_loss: 1.2087, test_f1: 0.3069
 epoch: 36, train_loss: 1.2257, test_loss: 1.2061, test_f1: 0.3121
 epoch: 37, train_loss: 1.2263, test_loss: 1.2077, test_f1: 0.3104
 epoch: 38, train_loss: 1.2239, test_loss: 1.2031, test_f1: 0.3096
 epoch: 39, train_loss: 1.2224, test_loss: 1.2006, test_f1: 0.3170
 epoch: 40, train_loss: 1.2213, test_loss: 1.1997, test_f1: 0.3086
 epoch: 41, train_loss: 1.2205, test_loss: 1.1975, test_f1: 0.3170
 epoch: 42, train_loss: 1.2165, test_loss: 1.1941, test_f1: 0.3259
 epoch: 43, train_loss: 1.2131, test_loss: 1.1928, test_f1: 0.3274
 epoch: 44, train_loss: 1.2149, test_loss: 1.1909, test_f1: 0.3282
 epoch: 45, train_loss: 1.2135, test_loss: 1.1884, test_f1: 0.3273
 epoch: 46, train_loss: 1.2122, test_loss: 1.1875, test_f1: 0.3289
 epoch: 47, train_loss: 1.2022, test_loss: 1.1856, test_f1: 0.3290
 epoch: 48, train_loss: 1.2072, test_loss: 1.1826, test_f1: 0.3344
 epoch: 49, train_loss: 1.2104, test_loss: 1.1832, test_f1: 0.3308
 epoch: 50, train_loss: 1.2099, test_loss: 1.1774, test_f1: 0.3314
 epoch: 51, train_loss: 1.2059, test_loss: 1.1744, test_f1: 0.3303
 epoch: 52, train_loss: 1.2097, test_loss: 1.1759, test_f1: 0.3244
 epoch: 53, train_loss: 1.2006, test_loss: 1.1733, test_f1: 0.3326
 epoch: 54, train_loss: 1.1959, test_loss: 1.1733, test_f1: 0.3322
 epoch: 55, train_loss: 1.2075, test_loss: 1.1702, test_f1: 0.3292
 epoch: 56, train_loss: 1.1991, test_loss: 1.1705, test_f1: 0.3281
 epoch: 57, train_loss: 1.2001, test_loss: 1.1700, test_f1: 0.3334
 epoch: 58, train_loss: 1.2049, test_loss: 1.1708, test_f1: 0.3331
 epoch: 59, train_loss: 1.1970, test_loss: 1.1695, test_f1: 0.3317
 epoch: 60, train_loss: 1.2061, test_loss: 1.1700, test_f1: 0.3295
 epoch: 61, train_loss: 1.1998, test_loss: 1.1677, test_f1: 0.3279
 epoch: 62, train_loss: 1.1985, test_loss: 1.1662, test_f1: 0.3317
 epoch: 63, train_loss: 1.1976, test_loss: 1.1662, test_f1: 0.3363
 epoch: 64, train_loss: 1.1929, test_loss: 1.1642, test_f1: 0.3332
 epoch: 65, train_loss: 1.1952, test_loss: 1.1662, test_f1: 0.3279
 epoch: 66, train_loss: 1.1909, test_loss: 1.1640, test_f1: 0.3374
 epoch: 67, train_loss: 1.1959, test_loss: 1.1656, test_f1: 0.3401
 epoch: 68, train_loss: 1.1993, test_loss: 1.1652, test_f1: 0.3396
 epoch: 69, train_loss: 1.1935, test_loss: 1.1613, test_f1: 0.3353
 epoch: 70, train_loss: 1.1954, test_loss: 1.1617, test_f1: 0.3388
 epoch: 71, train_loss: 1.1961, test_loss: 1.1607, test_f1: 0.3255
 epoch: 72, train_loss: 1.1979, test_loss: 1.1619, test_f1: 0.3247
 epoch: 73, train_loss: 1.1926, test_loss: 1.1626, test_f1: 0.3278
 epoch: 74, train_loss: 1.1853, test_loss: 1.1598, test_f1: 0.3278
 epoch: 75, train_loss: 1.1864, test_loss: 1.1581, test_f1: 0.3322
 epoch: 76, train_loss: 1.1867, test_loss: 1.1566, test_f1: 0.3324
 epoch: 77, train_loss: 1.1866, test_loss: 1.1526, test_f1: 0.3364
 epoch: 78, train_loss: 1.1870, test_loss: 1.1527, test_f1: 0.3376
 epoch: 79, train_loss: 1.1900, test_loss: 1.1514, test_f1: 0.3374
 epoch: 80, train_loss: 1.1828, test_loss: 1.1507, test_f1: 0.3349
 epoch: 81, train_loss: 1.1878, test_loss: 1.1522, test_f1: 0.3378
 epoch: 82, train_loss: 1.1801, test_loss: 1.1516, test_f1: 0.3371
 epoch: 83, train_loss: 1.1867, test_loss: 1.1497, test_f1: 0.3344
 epoch: 84, train_loss: 1.1842, test_loss: 1.1479, test_f1: 0.3372
 epoch: 85, train_loss: 1.1922, test_loss: 1.1478, test_f1: 0.3416
 epoch: 86, train_loss: 1.1825, test_loss: 1.1489, test_f1: 0.3359
 epoch: 87, train_loss: 1.1835, test_loss: 1.1499, test_f1: 0.3409
 epoch: 88, train_loss: 1.1890, test_loss: 1.1449, test_f1: 0.3372
 epoch: 89, train_loss: 1.1846, test_loss: 1.1453, test_f1: 0.3337
 epoch: 90, train_loss: 1.1850, test_loss: 1.1445, test_f1: 0.3379
 epoch: 91, train_loss: 1.1826, test_loss: 1.1449, test_f1: 0.3394
 epoch: 92, train_loss: 1.1835, test_loss: 1.1465, test_f1: 0.3409
 epoch: 93, train_loss: 1.1761, test_loss: 1.1419, test_f1: 0.3399
 epoch: 94, train_loss: 1.1805, test_loss: 1.1416, test_f1: 0.3460
 epoch: 95, train_loss: 1.1791, test_loss: 1.1404, test_f1: 0.3440
 epoch: 96, train_loss: 1.1805, test_loss: 1.1393, test_f1: 0.3389
 epoch: 97, train_loss: 1.1768, test_loss: 1.1420, test_f1: 0.3519
 epoch: 98, train_loss: 1.1760, test_loss: 1.1391, test_f1: 0.3524
 epoch: 99, train_loss: 1.1789, test_loss: 1.1394, test_f1: 0.3504

Training completed in 605.51 seconds
Best F1: 0.5042 at epoch 96
Mean F1 across iterations: 0.4111  0.0509
========================FINAL RESULTS================================
FEGIN weighted F1: 0.5042  0.0509
python main.py --data ltspice_examples --representation component_component --model FEGIN --layers 3 --hiddens 16 --batch_size 64 --lr 0.0001 --emb_size 512 --epochs 100 --save_appendix component_component_L3_H16_BS64_LR0.0001_E512 --no_val
-----



STDERR:
  File "main.py", line 370, in <module>
    main()
  File "main.py", line 254, in main
    dataset = dataset_class(
  File "/home/philip/projects/ltspice_examples_code_repo/Circuit-Completion-Using-GNNs/component_classification_with_link_prediction_head/evaluation/FEGIN/kernel/circuit_datasets.py", line 15, in __init__
    self.data, self.slices = torch.load(self.processed_paths[0])
  File "/home/philip/.local/lib/python3.8/site-packages/torch/serialization.py", line 1040, in load
    warnings.warn(
  File "/usr/lib/python3.8/warnings.py", line 109, in _showwarnmsg
    sw(msg.message, msg.category, msg.filename, msg.lineno,
  File "main.py", line 47, in warn_with_traceback
    traceback.print_stack(file=log)
/home/philip/projects/ltspice_examples_code_repo/Circuit-Completion-Using-GNNs/component_classification_with_link_prediction_head/evaluation/FEGIN/kernel/circuit_datasets.py:15: FutureWarning: You are using `torch.load` with `weights_only=False` (the current default value), which uses the default pickle module implicitly. It is possible to construct malicious pickle data which will execute arbitrary code during unpickling (See https://github.com/pytorch/pytorch/blob/main/SECURITY.md#untrusted-models for more details). In a future release, the default value for `weights_only` will be flipped to `True`. This limits the functions that could be executed during unpickling. Arbitrary objects will no longer be allowed to be loaded via this mode unless they are explicitly allowlisted by the user via `torch.serialization.add_safe_globals`. We recommend you start setting `weights_only=True` for any use case where you don't have full control of the loaded file. Please open an issue on GitHub for any issues related to this experimental feature.
  self.data, self.slices = torch.load(self.processed_paths[0])
