STDOUT:
Results will be saved in /home/philip/projects/ltspice_examples_code_repo/Circuit-Completion-Using-GNNs/component_classification_with_link_prediction_head/evaluation/FEGIN/results/model_FEGIN_dataset_ltspice_demos
Command line input: python main.py --data ltspice_demos --representation component_component --model FEGIN --layers 5 --hiddens 16 --batch_size 128 --lr 0.001 --emb_size 128 --epochs 100 --save_appendix component_component_L5_H16_BS128_LR0.001_E128 --no_val
 is saved.
-----
ltspice_demos - FEGIN
Using 5 layers, 16 hidden units, h = 2
Loading component_component representation dataset
Loading component_component representation data...
Loaded 1948 examples (component_component)
saving path: data/processed/ltspice_demos_component_component_processed.pt
ENTERED
Training FEGIN on component_component representation
Train: 1565, Test: 383
##################ITERATION #0 ****************************************
 epoch: 0, train_loss: 1.4038, test_loss: 1.3953, test_f1: 0.0301
 epoch: 1, train_loss: 1.3766, test_loss: 1.3776, test_f1: 0.1945
 epoch: 2, train_loss: 1.3569, test_loss: 1.3589, test_f1: 0.2314
 epoch: 3, train_loss: 1.3360, test_loss: 1.3405, test_f1: 0.2336
 epoch: 4, train_loss: 1.3128, test_loss: 1.3201, test_f1: 0.2281
 epoch: 5, train_loss: 1.2868, test_loss: 1.3029, test_f1: 0.2281
 epoch: 6, train_loss: 1.2687, test_loss: 1.2923, test_f1: 0.2281
 epoch: 7, train_loss: 1.2516, test_loss: 1.2787, test_f1: 0.2281
 epoch: 8, train_loss: 1.2363, test_loss: 1.2847, test_f1: 0.2680
 epoch: 9, train_loss: 1.2229, test_loss: 1.2791, test_f1: 0.2983
 epoch: 10, train_loss: 1.2147, test_loss: 1.3051, test_f1: 0.2841
 epoch: 11, train_loss: 1.1995, test_loss: 1.2613, test_f1: 0.2981
 epoch: 12, train_loss: 1.1997, test_loss: 1.2754, test_f1: 0.3044
 epoch: 13, train_loss: 1.1883, test_loss: 1.3039, test_f1: 0.3330
 epoch: 14, train_loss: 1.1812, test_loss: 1.2858, test_f1: 0.3196
 epoch: 15, train_loss: 1.1713, test_loss: 1.2619, test_f1: 0.3092
 epoch: 16, train_loss: 1.1736, test_loss: 1.2572, test_f1: 0.3119
 epoch: 17, train_loss: 1.1591, test_loss: 1.2637, test_f1: 0.3330
 epoch: 18, train_loss: 1.1545, test_loss: 1.2474, test_f1: 0.3354
 epoch: 19, train_loss: 1.1514, test_loss: 1.2919, test_f1: 0.3310
 epoch: 20, train_loss: 1.1329, test_loss: 1.2420, test_f1: 0.3532
 epoch: 21, train_loss: 1.1381, test_loss: 1.2583, test_f1: 0.3732
 epoch: 22, train_loss: 1.1342, test_loss: 1.3274, test_f1: 0.3767
 epoch: 23, train_loss: 1.1275, test_loss: 1.2905, test_f1: 0.4176
 epoch: 24, train_loss: 1.1149, test_loss: 1.3070, test_f1: 0.4254
 epoch: 25, train_loss: 1.0991, test_loss: 1.3934, test_f1: 0.4041
 epoch: 26, train_loss: 1.1058, test_loss: 1.2811, test_f1: 0.4330
 epoch: 27, train_loss: 1.0855, test_loss: 1.2799, test_f1: 0.4511
 epoch: 28, train_loss: 1.0809, test_loss: 1.4068, test_f1: 0.4208
 epoch: 29, train_loss: 1.0888, test_loss: 1.5262, test_f1: 0.4526
 epoch: 30, train_loss: 1.0603, test_loss: 1.4934, test_f1: 0.4869
 epoch: 31, train_loss: 1.0588, test_loss: 1.2979, test_f1: 0.4784
 epoch: 32, train_loss: 1.0498, test_loss: 1.2584, test_f1: 0.4655
 epoch: 33, train_loss: 1.0444, test_loss: 1.3996, test_f1: 0.4652
 epoch: 34, train_loss: 1.0409, test_loss: 1.4012, test_f1: 0.4677
 epoch: 35, train_loss: 1.0620, test_loss: 1.4725, test_f1: 0.4728
 epoch: 36, train_loss: 1.0457, test_loss: 1.7247, test_f1: 0.4927
 epoch: 37, train_loss: 1.0377, test_loss: 1.3895, test_f1: 0.4849
 epoch: 38, train_loss: 1.0218, test_loss: 1.4030, test_f1: 0.4684
 epoch: 39, train_loss: 1.0201, test_loss: 2.0361, test_f1: 0.4439
 epoch: 40, train_loss: 1.0149, test_loss: 1.7925, test_f1: 0.4807
 epoch: 41, train_loss: 1.0064, test_loss: 1.5668, test_f1: 0.4825
 epoch: 42, train_loss: 1.0015, test_loss: 1.6082, test_f1: 0.4834
 epoch: 43, train_loss: 0.9936, test_loss: 1.7241, test_f1: 0.5125
 epoch: 44, train_loss: 0.9710, test_loss: 1.9508, test_f1: 0.4833
 epoch: 45, train_loss: 0.9682, test_loss: 1.8586, test_f1: 0.5039
 epoch: 46, train_loss: 0.9884, test_loss: 2.0457, test_f1: 0.5038
 epoch: 47, train_loss: 0.9610, test_loss: 2.3497, test_f1: 0.5018
 epoch: 48, train_loss: 0.9705, test_loss: 2.0606, test_f1: 0.5099
 epoch: 49, train_loss: 0.9539, test_loss: 1.8256, test_f1: 0.5295
 epoch: 50, train_loss: 0.9373, test_loss: 1.7685, test_f1: 0.5311
 epoch: 51, train_loss: 0.9575, test_loss: 2.1683, test_f1: 0.5286
 epoch: 52, train_loss: 0.9402, test_loss: 2.3156, test_f1: 0.5213
 epoch: 53, train_loss: 0.9319, test_loss: 2.3198, test_f1: 0.5178
 epoch: 54, train_loss: 0.9303, test_loss: 2.3318, test_f1: 0.5255
 epoch: 55, train_loss: 0.9291, test_loss: 2.3185, test_f1: 0.5309
 epoch: 56, train_loss: 0.9114, test_loss: 2.3243, test_f1: 0.5307
 epoch: 57, train_loss: 0.9241, test_loss: 2.8281, test_f1: 0.5363
 epoch: 58, train_loss: 0.9330, test_loss: 2.7274, test_f1: 0.4941
 epoch: 59, train_loss: 0.8943, test_loss: 2.3668, test_f1: 0.5299
 epoch: 60, train_loss: 0.9092, test_loss: 2.5894, test_f1: 0.5351
 epoch: 61, train_loss: 0.9154, test_loss: 2.8487, test_f1: 0.5095
 epoch: 62, train_loss: 0.9024, test_loss: 3.0710, test_f1: 0.5073
 epoch: 63, train_loss: 0.9050, test_loss: 2.8227, test_f1: 0.5030
 epoch: 64, train_loss: 0.9016, test_loss: 2.5999, test_f1: 0.5192
 epoch: 65, train_loss: 0.9057, test_loss: 2.5816, test_f1: 0.5261
 epoch: 66, train_loss: 0.9193, test_loss: 2.6704, test_f1: 0.5136
 epoch: 67, train_loss: 0.8896, test_loss: 2.7297, test_f1: 0.5171
 epoch: 68, train_loss: 0.8958, test_loss: 2.5973, test_f1: 0.5381
 epoch: 69, train_loss: 0.8919, test_loss: 2.4491, test_f1: 0.5346
 epoch: 70, train_loss: 0.8983, test_loss: 2.4379, test_f1: 0.5187
 epoch: 71, train_loss: 0.9013, test_loss: 2.3577, test_f1: 0.5090
 epoch: 72, train_loss: 0.8890, test_loss: 2.3143, test_f1: 0.5251
 epoch: 73, train_loss: 0.8811, test_loss: 2.1987, test_f1: 0.5284
 epoch: 74, train_loss: 0.8773, test_loss: 2.7790, test_f1: 0.5328
 epoch: 75, train_loss: 0.8691, test_loss: 2.8234, test_f1: 0.5430
 epoch: 76, train_loss: 0.8836, test_loss: 2.6989, test_f1: 0.5142
 epoch: 77, train_loss: 0.8876, test_loss: 2.5173, test_f1: 0.5258
 epoch: 78, train_loss: 0.8724, test_loss: 2.4669, test_f1: 0.5100
 epoch: 79, train_loss: 0.8912, test_loss: 2.6029, test_f1: 0.5155
 epoch: 80, train_loss: 0.8822, test_loss: 2.5482, test_f1: 0.5177
 epoch: 81, train_loss: 0.8655, test_loss: 2.8093, test_f1: 0.5216
 epoch: 82, train_loss: 0.8789, test_loss: 2.7954, test_f1: 0.5208
 epoch: 83, train_loss: 0.8676, test_loss: 2.5628, test_f1: 0.5279
 epoch: 84, train_loss: 0.8748, test_loss: 2.4917, test_f1: 0.5176
 epoch: 85, train_loss: 0.8634, test_loss: 2.6781, test_f1: 0.5473
 epoch: 86, train_loss: 0.8430, test_loss: 2.6622, test_f1: 0.5296
 epoch: 87, train_loss: 0.8509, test_loss: 2.8164, test_f1: 0.5174
 epoch: 88, train_loss: 0.8573, test_loss: 2.6207, test_f1: 0.5250
 epoch: 89, train_loss: 0.8707, test_loss: 2.8348, test_f1: 0.5153
 epoch: 90, train_loss: 0.8566, test_loss: 2.5537, test_f1: 0.5211
 epoch: 91, train_loss: 0.8699, test_loss: 2.1288, test_f1: 0.5122
 epoch: 92, train_loss: 0.8617, test_loss: 2.1953, test_f1: 0.5164
 epoch: 93, train_loss: 0.8630, test_loss: 2.3648, test_f1: 0.5148
 epoch: 94, train_loss: 0.8600, test_loss: 2.4296, test_f1: 0.5231
 epoch: 95, train_loss: 0.8580, test_loss: 2.0860, test_f1: 0.5130
 epoch: 96, train_loss: 0.8500, test_loss: 2.1649, test_f1: 0.5286
 epoch: 97, train_loss: 0.8394, test_loss: 2.3915, test_f1: 0.5319
 epoch: 98, train_loss: 0.8550, test_loss: 2.3908, test_f1: 0.5326
 epoch: 99, train_loss: 0.8415, test_loss: 2.9778, test_f1: 0.5181
##################ITERATION #1 ****************************************
 epoch: 0, train_loss: 1.2830, test_loss: 1.3099, test_f1: 0.2514
 epoch: 1, train_loss: 1.2369, test_loss: 1.3095, test_f1: 0.3137
 epoch: 2, train_loss: 1.2156, test_loss: 1.3040, test_f1: 0.3187
 epoch: 3, train_loss: 1.2044, test_loss: 1.2976, test_f1: 0.3474
 epoch: 4, train_loss: 1.1924, test_loss: 1.3089, test_f1: 0.3467
 epoch: 5, train_loss: 1.1791, test_loss: 1.2999, test_f1: 0.3752
 epoch: 6, train_loss: 1.1682, test_loss: 1.2875, test_f1: 0.4316
 epoch: 7, train_loss: 1.1629, test_loss: 1.3010, test_f1: 0.4234
 epoch: 8, train_loss: 1.1512, test_loss: 1.3004, test_f1: 0.4302
 epoch: 9, train_loss: 1.1336, test_loss: 1.2736, test_f1: 0.4354
 epoch: 10, train_loss: 1.1270, test_loss: 1.2815, test_f1: 0.4485
 epoch: 11, train_loss: 1.1201, test_loss: 1.2612, test_f1: 0.4486
 epoch: 12, train_loss: 1.1184, test_loss: 1.2525, test_f1: 0.4420
 epoch: 13, train_loss: 1.0994, test_loss: 1.2365, test_f1: 0.4512
 epoch: 14, train_loss: 1.0857, test_loss: 1.2557, test_f1: 0.4539
 epoch: 15, train_loss: 1.0898, test_loss: 1.2614, test_f1: 0.4471
 epoch: 16, train_loss: 1.0688, test_loss: 1.2360, test_f1: 0.4706
 epoch: 17, train_loss: 1.0669, test_loss: 1.2189, test_f1: 0.4776
 epoch: 18, train_loss: 1.0607, test_loss: 1.2021, test_f1: 0.4799
 epoch: 19, train_loss: 1.0514, test_loss: 1.2097, test_f1: 0.4696
 epoch: 20, train_loss: 1.0384, test_loss: 1.2121, test_f1: 0.4736
 epoch: 21, train_loss: 1.0286, test_loss: 1.2051, test_f1: 0.4735
 epoch: 22, train_loss: 1.0117, test_loss: 1.2349, test_f1: 0.4508
 epoch: 23, train_loss: 1.0198, test_loss: 1.2481, test_f1: 0.4452
 epoch: 24, train_loss: 1.0048, test_loss: 1.2463, test_f1: 0.4637
 epoch: 25, train_loss: 0.9933, test_loss: 1.1655, test_f1: 0.5019
 epoch: 26, train_loss: 1.0037, test_loss: 1.2033, test_f1: 0.4742
 epoch: 27, train_loss: 1.0041, test_loss: 1.2384, test_f1: 0.4530
 epoch: 28, train_loss: 0.9901, test_loss: 1.2174, test_f1: 0.4879
 epoch: 29, train_loss: 0.9848, test_loss: 1.2232, test_f1: 0.4748
 epoch: 30, train_loss: 0.9796, test_loss: 1.2104, test_f1: 0.4987
 epoch: 31, train_loss: 0.9683, test_loss: 1.1774, test_f1: 0.5373
 epoch: 32, train_loss: 0.9510, test_loss: 1.1859, test_f1: 0.5033
 epoch: 33, train_loss: 0.9513, test_loss: 1.2056, test_f1: 0.4876
 epoch: 34, train_loss: 0.9544, test_loss: 1.1428, test_f1: 0.5319
 epoch: 35, train_loss: 0.9629, test_loss: 1.1508, test_f1: 0.5272
 epoch: 36, train_loss: 0.9491, test_loss: 1.1860, test_f1: 0.5106
 epoch: 37, train_loss: 0.9248, test_loss: 1.2242, test_f1: 0.4926
 epoch: 38, train_loss: 0.9451, test_loss: 1.2041, test_f1: 0.4914
 epoch: 39, train_loss: 0.9327, test_loss: 1.1875, test_f1: 0.5290
 epoch: 40, train_loss: 0.9281, test_loss: 1.2108, test_f1: 0.5161
 epoch: 41, train_loss: 0.9109, test_loss: 1.2180, test_f1: 0.5004
 epoch: 42, train_loss: 0.9200, test_loss: 1.2100, test_f1: 0.5328
 epoch: 43, train_loss: 0.9044, test_loss: 1.2306, test_f1: 0.5314
 epoch: 44, train_loss: 0.9123, test_loss: 1.2665, test_f1: 0.5008
 epoch: 45, train_loss: 0.9074, test_loss: 1.2375, test_f1: 0.4709
 epoch: 46, train_loss: 0.9030, test_loss: 1.2626, test_f1: 0.5038
 epoch: 47, train_loss: 0.9030, test_loss: 1.2575, test_f1: 0.4949
 epoch: 48, train_loss: 0.8957, test_loss: 1.3027, test_f1: 0.5214
 epoch: 49, train_loss: 0.8869, test_loss: 1.2708, test_f1: 0.5134
 epoch: 50, train_loss: 0.8831, test_loss: 1.2613, test_f1: 0.4843
 epoch: 51, train_loss: 0.8659, test_loss: 1.2353, test_f1: 0.5009
 epoch: 52, train_loss: 0.8802, test_loss: 1.2363, test_f1: 0.5182
 epoch: 53, train_loss: 0.8582, test_loss: 1.2468, test_f1: 0.5285
 epoch: 54, train_loss: 0.8587, test_loss: 1.2318, test_f1: 0.5215
 epoch: 55, train_loss: 0.8709, test_loss: 1.2363, test_f1: 0.5211
 epoch: 56, train_loss: 0.8674, test_loss: 1.2301, test_f1: 0.5180
 epoch: 57, train_loss: 0.8620, test_loss: 1.2797, test_f1: 0.4924
 epoch: 58, train_loss: 0.8437, test_loss: 1.2796, test_f1: 0.5116
 epoch: 59, train_loss: 0.8212, test_loss: 1.2358, test_f1: 0.5363
 epoch: 60, train_loss: 0.8505, test_loss: 1.2615, test_f1: 0.5115
 epoch: 61, train_loss: 0.8505, test_loss: 1.2360, test_f1: 0.5023
 epoch: 62, train_loss: 0.8357, test_loss: 1.2897, test_f1: 0.5190
 epoch: 63, train_loss: 0.8423, test_loss: 1.3302, test_f1: 0.5186
 epoch: 64, train_loss: 0.8395, test_loss: 1.3127, test_f1: 0.5249
 epoch: 65, train_loss: 0.8350, test_loss: 1.2859, test_f1: 0.5270
 epoch: 66, train_loss: 0.8234, test_loss: 1.2661, test_f1: 0.5166
 epoch: 67, train_loss: 0.8366, test_loss: 1.3113, test_f1: 0.5193
 epoch: 68, train_loss: 0.8323, test_loss: 1.2833, test_f1: 0.5368
 epoch: 69, train_loss: 0.8291, test_loss: 1.2823, test_f1: 0.5236
 epoch: 70, train_loss: 0.8214, test_loss: 1.3076, test_f1: 0.5315
 epoch: 71, train_loss: 0.8375, test_loss: 1.3102, test_f1: 0.5184
 epoch: 72, train_loss: 0.8327, test_loss: 1.2808, test_f1: 0.5016
 epoch: 73, train_loss: 0.8192, test_loss: 1.2704, test_f1: 0.5349
 epoch: 74, train_loss: 0.8224, test_loss: 1.3025, test_f1: 0.5169
 epoch: 75, train_loss: 0.8121, test_loss: 1.3060, test_f1: 0.5094
 epoch: 76, train_loss: 0.8185, test_loss: 1.3289, test_f1: 0.5043
 epoch: 77, train_loss: 0.8261, test_loss: 1.3332, test_f1: 0.5000
 epoch: 78, train_loss: 0.8174, test_loss: 1.3191, test_f1: 0.5384
 epoch: 79, train_loss: 0.8212, test_loss: 1.3201, test_f1: 0.5329
 epoch: 80, train_loss: 0.8104, test_loss: 1.3428, test_f1: 0.5164
 epoch: 81, train_loss: 0.8028, test_loss: 1.3446, test_f1: 0.5505
 epoch: 82, train_loss: 0.8098, test_loss: 1.3815, test_f1: 0.5228
 epoch: 83, train_loss: 0.8060, test_loss: 1.3956, test_f1: 0.5097
 epoch: 84, train_loss: 0.8064, test_loss: 1.3475, test_f1: 0.4874
 epoch: 85, train_loss: 0.8117, test_loss: 1.3587, test_f1: 0.5380
 epoch: 86, train_loss: 0.8148, test_loss: 1.3315, test_f1: 0.5777
 epoch: 87, train_loss: 0.7975, test_loss: 1.3707, test_f1: 0.5472
 epoch: 88, train_loss: 0.8224, test_loss: 1.3754, test_f1: 0.5331
 epoch: 89, train_loss: 0.7984, test_loss: 1.3261, test_f1: 0.5490
 epoch: 90, train_loss: 0.7886, test_loss: 1.3477, test_f1: 0.5430
 epoch: 91, train_loss: 0.7835, test_loss: 1.4013, test_f1: 0.5300
 epoch: 92, train_loss: 0.7968, test_loss: 1.3727, test_f1: 0.5252
 epoch: 93, train_loss: 0.7876, test_loss: 1.3688, test_f1: 0.5269
 epoch: 94, train_loss: 0.7903, test_loss: 1.3662, test_f1: 0.5547
 epoch: 95, train_loss: 0.7787, test_loss: 1.3923, test_f1: 0.5201
 epoch: 96, train_loss: 0.7858, test_loss: 1.4106, test_f1: 0.5383
 epoch: 97, train_loss: 0.7725, test_loss: 1.3391, test_f1: 0.5636
 epoch: 98, train_loss: 0.7943, test_loss: 1.3992, test_f1: 0.5486
 epoch: 99, train_loss: 0.7682, test_loss: 1.3635, test_f1: 0.5468
##################ITERATION #2 ****************************************
 epoch: 0, train_loss: 1.3733, test_loss: 1.3609, test_f1: 0.1836
 epoch: 1, train_loss: 1.2636, test_loss: 1.3206, test_f1: 0.1739
 epoch: 2, train_loss: 1.2392, test_loss: 1.3042, test_f1: 0.3121
 epoch: 3, train_loss: 1.2232, test_loss: 1.3049, test_f1: 0.3554
 epoch: 4, train_loss: 1.2058, test_loss: 1.3116, test_f1: 0.3823
 epoch: 5, train_loss: 1.2052, test_loss: 1.3087, test_f1: 0.4071
 epoch: 6, train_loss: 1.1834, test_loss: 1.2923, test_f1: 0.4097
 epoch: 7, train_loss: 1.1754, test_loss: 1.2808, test_f1: 0.3862
 epoch: 8, train_loss: 1.1700, test_loss: 1.2589, test_f1: 0.4019
 epoch: 9, train_loss: 1.1569, test_loss: 1.2431, test_f1: 0.3868
 epoch: 10, train_loss: 1.1546, test_loss: 1.2298, test_f1: 0.4127
 epoch: 11, train_loss: 1.1338, test_loss: 1.2071, test_f1: 0.4178
 epoch: 12, train_loss: 1.1215, test_loss: 1.2049, test_f1: 0.4438
 epoch: 13, train_loss: 1.1141, test_loss: 1.1790, test_f1: 0.4528
 epoch: 14, train_loss: 1.0958, test_loss: 1.1653, test_f1: 0.4857
 epoch: 15, train_loss: 1.0894, test_loss: 1.1611, test_f1: 0.4820
 epoch: 16, train_loss: 1.0763, test_loss: 1.1503, test_f1: 0.5180
 epoch: 17, train_loss: 1.0542, test_loss: 1.1353, test_f1: 0.5204
 epoch: 18, train_loss: 1.0649, test_loss: 1.1363, test_f1: 0.5417
 epoch: 19, train_loss: 1.0474, test_loss: 1.1288, test_f1: 0.5305
 epoch: 20, train_loss: 1.0479, test_loss: 1.1117, test_f1: 0.5118
 epoch: 21, train_loss: 1.0326, test_loss: 1.1265, test_f1: 0.5219
 epoch: 22, train_loss: 1.0330, test_loss: 1.1399, test_f1: 0.5624
 epoch: 23, train_loss: 1.0188, test_loss: 1.1185, test_f1: 0.5511
 epoch: 24, train_loss: 1.0108, test_loss: 1.1012, test_f1: 0.5132
 epoch: 25, train_loss: 1.0078, test_loss: 1.1385, test_f1: 0.5303
 epoch: 26, train_loss: 0.9957, test_loss: 1.1085, test_f1: 0.5219
 epoch: 27, train_loss: 0.9886, test_loss: 1.1001, test_f1: 0.5395
 epoch: 28, train_loss: 0.9572, test_loss: 1.0947, test_f1: 0.5555
 epoch: 29, train_loss: 0.9704, test_loss: 1.0766, test_f1: 0.5308
 epoch: 30, train_loss: 0.9498, test_loss: 1.0965, test_f1: 0.5241
 epoch: 31, train_loss: 0.9486, test_loss: 1.0870, test_f1: 0.5547
 epoch: 32, train_loss: 0.9506, test_loss: 1.0735, test_f1: 0.5452
 epoch: 33, train_loss: 0.9467, test_loss: 1.1002, test_f1: 0.5219
 epoch: 34, train_loss: 0.9300, test_loss: 1.1090, test_f1: 0.5176
 epoch: 35, train_loss: 0.9353, test_loss: 1.0698, test_f1: 0.5574
 epoch: 36, train_loss: 0.9296, test_loss: 1.0592, test_f1: 0.5131
 epoch: 37, train_loss: 0.9143, test_loss: 1.0477, test_f1: 0.5390
 epoch: 38, train_loss: 0.9094, test_loss: 1.0447, test_f1: 0.5246
 epoch: 39, train_loss: 0.8975, test_loss: 1.0581, test_f1: 0.5240
 epoch: 40, train_loss: 0.8896, test_loss: 1.0534, test_f1: 0.5303
 epoch: 41, train_loss: 0.8876, test_loss: 1.0550, test_f1: 0.5492
 epoch: 42, train_loss: 0.8943, test_loss: 1.0677, test_f1: 0.5201
 epoch: 43, train_loss: 0.8915, test_loss: 1.0945, test_f1: 0.5235
 epoch: 44, train_loss: 0.8702, test_loss: 1.0973, test_f1: 0.4988
 epoch: 45, train_loss: 0.8824, test_loss: 1.0893, test_f1: 0.5276
 epoch: 46, train_loss: 0.8932, test_loss: 1.0994, test_f1: 0.5168
 epoch: 47, train_loss: 0.8762, test_loss: 1.0743, test_f1: 0.4708
 epoch: 48, train_loss: 0.8588, test_loss: 1.1646, test_f1: 0.4758
 epoch: 49, train_loss: 0.8798, test_loss: 1.0865, test_f1: 0.5108
 epoch: 50, train_loss: 0.8605, test_loss: 1.0807, test_f1: 0.5335
 epoch: 51, train_loss: 0.8309, test_loss: 1.0887, test_f1: 0.5025
 epoch: 52, train_loss: 0.8430, test_loss: 1.0735, test_f1: 0.5186
 epoch: 53, train_loss: 0.8358, test_loss: 1.0657, test_f1: 0.5115
 epoch: 54, train_loss: 0.8679, test_loss: 1.0737, test_f1: 0.5225
 epoch: 55, train_loss: 0.8457, test_loss: 1.0645, test_f1: 0.5085
 epoch: 56, train_loss: 0.8505, test_loss: 1.0872, test_f1: 0.5184
 epoch: 57, train_loss: 0.8287, test_loss: 1.0796, test_f1: 0.5201
 epoch: 58, train_loss: 0.8438, test_loss: 1.0801, test_f1: 0.5269
 epoch: 59, train_loss: 0.8344, test_loss: 1.0896, test_f1: 0.5266
 epoch: 60, train_loss: 0.8083, test_loss: 1.0791, test_f1: 0.5233
 epoch: 61, train_loss: 0.8192, test_loss: 1.0926, test_f1: 0.4944
 epoch: 62, train_loss: 0.8109, test_loss: 1.0984, test_f1: 0.4935
 epoch: 63, train_loss: 0.8286, test_loss: 1.1406, test_f1: 0.4933
 epoch: 64, train_loss: 0.8169, test_loss: 1.0967, test_f1: 0.4646
 epoch: 65, train_loss: 0.8071, test_loss: 1.1101, test_f1: 0.4950
 epoch: 66, train_loss: 0.7909, test_loss: 1.1284, test_f1: 0.4970
 epoch: 67, train_loss: 0.7984, test_loss: 1.1251, test_f1: 0.4926
 epoch: 68, train_loss: 0.8180, test_loss: 1.0978, test_f1: 0.4894
 epoch: 69, train_loss: 0.8064, test_loss: 1.1068, test_f1: 0.4953
 epoch: 70, train_loss: 0.8080, test_loss: 1.0998, test_f1: 0.5079
 epoch: 71, train_loss: 0.7966, test_loss: 1.1000, test_f1: 0.4868
 epoch: 72, train_loss: 0.8060, test_loss: 1.1145, test_f1: 0.4760
 epoch: 73, train_loss: 0.7933, test_loss: 1.1291, test_f1: 0.4903
 epoch: 74, train_loss: 0.7928, test_loss: 1.1359, test_f1: 0.4765
 epoch: 75, train_loss: 0.7942, test_loss: 1.1368, test_f1: 0.4903
 epoch: 76, train_loss: 0.7860, test_loss: 1.1210, test_f1: 0.4987
 epoch: 77, train_loss: 0.7949, test_loss: 1.1505, test_f1: 0.4825
 epoch: 78, train_loss: 0.7828, test_loss: 1.1038, test_f1: 0.4907
 epoch: 79, train_loss: 0.7829, test_loss: 1.1255, test_f1: 0.4822
 epoch: 80, train_loss: 0.7862, test_loss: 1.1426, test_f1: 0.4853
 epoch: 81, train_loss: 0.7935, test_loss: 1.1451, test_f1: 0.4676
 epoch: 82, train_loss: 0.7818, test_loss: 1.1267, test_f1: 0.4786
 epoch: 83, train_loss: 0.7829, test_loss: 1.1358, test_f1: 0.4617
 epoch: 84, train_loss: 0.8029, test_loss: 1.1722, test_f1: 0.4488
 epoch: 85, train_loss: 0.7973, test_loss: 1.1394, test_f1: 0.4658
 epoch: 86, train_loss: 0.7752, test_loss: 1.1617, test_f1: 0.4792
 epoch: 87, train_loss: 0.7654, test_loss: 1.1509, test_f1: 0.4636
 epoch: 88, train_loss: 0.7726, test_loss: 1.1351, test_f1: 0.4894
 epoch: 89, train_loss: 0.7934, test_loss: 1.1475, test_f1: 0.4865
 epoch: 90, train_loss: 0.7662, test_loss: 1.1466, test_f1: 0.5010
 epoch: 91, train_loss: 0.7927, test_loss: 1.1620, test_f1: 0.4805
 epoch: 92, train_loss: 0.7682, test_loss: 1.1489, test_f1: 0.4920
 epoch: 93, train_loss: 0.7771, test_loss: 1.1655, test_f1: 0.5024
 epoch: 94, train_loss: 0.7772, test_loss: 1.1459, test_f1: 0.4770
 epoch: 95, train_loss: 0.7797, test_loss: 1.1362, test_f1: 0.4830
 epoch: 96, train_loss: 0.7713, test_loss: 1.1396, test_f1: 0.5072
 epoch: 97, train_loss: 0.7643, test_loss: 1.1274, test_f1: 0.4869
 epoch: 98, train_loss: 0.7730, test_loss: 1.1558, test_f1: 0.4818
 epoch: 99, train_loss: 0.7717, test_loss: 1.1185, test_f1: 0.4979
##################ITERATION #3 ****************************************
 epoch: 0, train_loss: 1.2785, test_loss: 1.3271, test_f1: 0.3205
 epoch: 1, train_loss: 1.2412, test_loss: 1.3210, test_f1: 0.3371
 epoch: 2, train_loss: 1.2174, test_loss: 1.2977, test_f1: 0.3569
 epoch: 3, train_loss: 1.1926, test_loss: 1.2777, test_f1: 0.3526
 epoch: 4, train_loss: 1.1851, test_loss: 1.2597, test_f1: 0.3508
 epoch: 5, train_loss: 1.1659, test_loss: 1.2352, test_f1: 0.3684
 epoch: 6, train_loss: 1.1482, test_loss: 1.2430, test_f1: 0.3987
 epoch: 7, train_loss: 1.1543, test_loss: 1.2436, test_f1: 0.4184
 epoch: 8, train_loss: 1.1309, test_loss: 1.2306, test_f1: 0.3930
 epoch: 9, train_loss: 1.1145, test_loss: 1.1961, test_f1: 0.4412
 epoch: 10, train_loss: 1.1093, test_loss: 1.1874, test_f1: 0.4449
 epoch: 11, train_loss: 1.0991, test_loss: 1.2082, test_f1: 0.4641
 epoch: 12, train_loss: 1.0945, test_loss: 1.2157, test_f1: 0.4587
 epoch: 13, train_loss: 1.0798, test_loss: 1.2140, test_f1: 0.4408
 epoch: 14, train_loss: 1.0862, test_loss: 1.2072, test_f1: 0.4338
 epoch: 15, train_loss: 1.0656, test_loss: 1.1942, test_f1: 0.4286
 epoch: 16, train_loss: 1.0663, test_loss: 1.1815, test_f1: 0.3967
 epoch: 17, train_loss: 1.0645, test_loss: 1.1913, test_f1: 0.4209
 epoch: 18, train_loss: 1.0558, test_loss: 1.2003, test_f1: 0.4452
 epoch: 19, train_loss: 1.0545, test_loss: 1.1788, test_f1: 0.4212
 epoch: 20, train_loss: 1.0446, test_loss: 1.1699, test_f1: 0.4594
 epoch: 21, train_loss: 1.0335, test_loss: 1.1746, test_f1: 0.4731
 epoch: 22, train_loss: 1.0390, test_loss: 1.1598, test_f1: 0.4532
 epoch: 23, train_loss: 1.0185, test_loss: 1.1572, test_f1: 0.4168
 epoch: 24, train_loss: 1.0206, test_loss: 1.1605, test_f1: 0.4016
 epoch: 25, train_loss: 1.0150, test_loss: 1.1566, test_f1: 0.4265
 epoch: 26, train_loss: 1.0061, test_loss: 1.1803, test_f1: 0.4215
 epoch: 27, train_loss: 0.9967, test_loss: 1.1739, test_f1: 0.4207
 epoch: 28, train_loss: 0.9891, test_loss: 1.1511, test_f1: 0.4294
 epoch: 29, train_loss: 0.9755, test_loss: 1.1599, test_f1: 0.4184
 epoch: 30, train_loss: 0.9751, test_loss: 1.1566, test_f1: 0.4204
 epoch: 31, train_loss: 0.9626, test_loss: 1.1796, test_f1: 0.4307
 epoch: 32, train_loss: 0.9597, test_loss: 1.1719, test_f1: 0.4664
 epoch: 33, train_loss: 0.9410, test_loss: 1.1529, test_f1: 0.4721
 epoch: 34, train_loss: 0.9457, test_loss: 1.1483, test_f1: 0.4607
 epoch: 35, train_loss: 0.9496, test_loss: 1.1829, test_f1: 0.4593
 epoch: 36, train_loss: 0.9503, test_loss: 1.1293, test_f1: 0.4748
 epoch: 37, train_loss: 0.9416, test_loss: 1.1289, test_f1: 0.4512
 epoch: 38, train_loss: 0.9275, test_loss: 1.1676, test_f1: 0.4218
 epoch: 39, train_loss: 0.9085, test_loss: 1.1323, test_f1: 0.4561
 epoch: 40, train_loss: 0.9363, test_loss: 1.1667, test_f1: 0.5044
 epoch: 41, train_loss: 0.9139, test_loss: 1.1700, test_f1: 0.4884
 epoch: 42, train_loss: 0.9271, test_loss: 1.1802, test_f1: 0.4804
 epoch: 43, train_loss: 0.9012, test_loss: 1.1673, test_f1: 0.5071
 epoch: 44, train_loss: 0.8998, test_loss: 1.1627, test_f1: 0.4930
 epoch: 45, train_loss: 0.8961, test_loss: 1.1450, test_f1: 0.5247
 epoch: 46, train_loss: 0.8840, test_loss: 1.2052, test_f1: 0.5034
 epoch: 47, train_loss: 0.8942, test_loss: 1.1550, test_f1: 0.4838
 epoch: 48, train_loss: 0.8797, test_loss: 1.2725, test_f1: 0.5105
 epoch: 49, train_loss: 0.8767, test_loss: 1.1978, test_f1: 0.5047
 epoch: 50, train_loss: 0.8752, test_loss: 1.3249, test_f1: 0.4934
 epoch: 51, train_loss: 0.8968, test_loss: 1.3248, test_f1: 0.4570
 epoch: 52, train_loss: 0.8934, test_loss: 1.2052, test_f1: 0.4793
 epoch: 53, train_loss: 0.8827, test_loss: 1.1881, test_f1: 0.5049
 epoch: 54, train_loss: 0.8776, test_loss: 1.2685, test_f1: 0.4843
 epoch: 55, train_loss: 0.8659, test_loss: 1.2410, test_f1: 0.4965
 epoch: 56, train_loss: 0.8674, test_loss: 1.2478, test_f1: 0.4684
 epoch: 57, train_loss: 0.8574, test_loss: 1.2891, test_f1: 0.4867
 epoch: 58, train_loss: 0.8611, test_loss: 1.3709, test_f1: 0.4870
 epoch: 59, train_loss: 0.8485, test_loss: 1.3449, test_f1: 0.5052
 epoch: 60, train_loss: 0.8449, test_loss: 1.3153, test_f1: 0.5209
 epoch: 61, train_loss: 0.8587, test_loss: 1.2913, test_f1: 0.4974
 epoch: 62, train_loss: 0.8564, test_loss: 1.2360, test_f1: 0.4910
 epoch: 63, train_loss: 0.8497, test_loss: 1.2106, test_f1: 0.4944
 epoch: 64, train_loss: 0.8500, test_loss: 1.3037, test_f1: 0.5215
 epoch: 65, train_loss: 0.8496, test_loss: 1.2623, test_f1: 0.4696
 epoch: 66, train_loss: 0.8621, test_loss: 1.3039, test_f1: 0.4846
 epoch: 67, train_loss: 0.8494, test_loss: 1.3759, test_f1: 0.4924
 epoch: 68, train_loss: 0.8392, test_loss: 1.3421, test_f1: 0.5020
 epoch: 69, train_loss: 0.8442, test_loss: 1.3981, test_f1: 0.4918
 epoch: 70, train_loss: 0.8308, test_loss: 1.3854, test_f1: 0.4886
 epoch: 71, train_loss: 0.8218, test_loss: 1.3479, test_f1: 0.5101
 epoch: 72, train_loss: 0.8241, test_loss: 1.3959, test_f1: 0.4963
 epoch: 73, train_loss: 0.8425, test_loss: 1.4650, test_f1: 0.4957
 epoch: 74, train_loss: 0.8275, test_loss: 1.3746, test_f1: 0.4784
 epoch: 75, train_loss: 0.8325, test_loss: 1.4164, test_f1: 0.4871
 epoch: 76, train_loss: 0.8290, test_loss: 1.3831, test_f1: 0.4506
 epoch: 77, train_loss: 0.8177, test_loss: 1.4143, test_f1: 0.5056
 epoch: 78, train_loss: 0.8312, test_loss: 1.4712, test_f1: 0.4870
 epoch: 79, train_loss: 0.8377, test_loss: 1.4299, test_f1: 0.4891
 epoch: 80, train_loss: 0.8208, test_loss: 1.3985, test_f1: 0.4913
 epoch: 81, train_loss: 0.8152, test_loss: 1.4467, test_f1: 0.4911
 epoch: 82, train_loss: 0.8272, test_loss: 1.4597, test_f1: 0.4775
 epoch: 83, train_loss: 0.8117, test_loss: 1.3901, test_f1: 0.4856
 epoch: 84, train_loss: 0.8299, test_loss: 1.3810, test_f1: 0.5103
 epoch: 85, train_loss: 0.8414, test_loss: 1.4447, test_f1: 0.4934
 epoch: 86, train_loss: 0.8139, test_loss: 1.4074, test_f1: 0.4834
 epoch: 87, train_loss: 0.8189, test_loss: 1.2458, test_f1: 0.4973
 epoch: 88, train_loss: 0.8128, test_loss: 1.2848, test_f1: 0.4961
 epoch: 89, train_loss: 0.8142, test_loss: 1.3692, test_f1: 0.4803
 epoch: 90, train_loss: 0.8342, test_loss: 1.4916, test_f1: 0.4694
 epoch: 91, train_loss: 0.8066, test_loss: 1.5409, test_f1: 0.4915
 epoch: 92, train_loss: 0.8306, test_loss: 1.4724, test_f1: 0.4835
 epoch: 93, train_loss: 0.7922, test_loss: 1.3680, test_f1: 0.4906
 epoch: 94, train_loss: 0.7973, test_loss: 1.3652, test_f1: 0.5118
 epoch: 95, train_loss: 0.7859, test_loss: 1.3913, test_f1: 0.5132
 epoch: 96, train_loss: 0.8035, test_loss: 1.4146, test_f1: 0.4893
 epoch: 97, train_loss: 0.8001, test_loss: 1.4235, test_f1: 0.4859
 epoch: 98, train_loss: 0.7927, test_loss: 1.4623, test_f1: 0.4861
 epoch: 99, train_loss: 0.7996, test_loss: 1.3928, test_f1: 0.4835
##################ITERATION #4 ****************************************
 epoch: 0, train_loss: 1.2987, test_loss: 1.3208, test_f1: 0.2189
 epoch: 1, train_loss: 1.2062, test_loss: 1.2809, test_f1: 0.2354
 epoch: 2, train_loss: 1.1961, test_loss: 1.2546, test_f1: 0.2628
 epoch: 3, train_loss: 1.1770, test_loss: 1.2498, test_f1: 0.2859
 epoch: 4, train_loss: 1.1702, test_loss: 1.2293, test_f1: 0.3360
 epoch: 5, train_loss: 1.1643, test_loss: 1.2251, test_f1: 0.3803
 epoch: 6, train_loss: 1.1496, test_loss: 1.2450, test_f1: 0.3920
 epoch: 7, train_loss: 1.1392, test_loss: 1.2358, test_f1: 0.4178
 epoch: 8, train_loss: 1.1295, test_loss: 1.2310, test_f1: 0.4218
 epoch: 9, train_loss: 1.1299, test_loss: 1.2138, test_f1: 0.4208
 epoch: 10, train_loss: 1.1264, test_loss: 1.2094, test_f1: 0.4353
 epoch: 11, train_loss: 1.1223, test_loss: 1.1973, test_f1: 0.4250
 epoch: 12, train_loss: 1.0994, test_loss: 1.1942, test_f1: 0.4430
 epoch: 13, train_loss: 1.1008, test_loss: 1.1848, test_f1: 0.4538
 epoch: 14, train_loss: 1.0822, test_loss: 1.2092, test_f1: 0.4772
 epoch: 15, train_loss: 1.0789, test_loss: 1.2034, test_f1: 0.4495
 epoch: 16, train_loss: 1.0901, test_loss: 1.1915, test_f1: 0.4516
 epoch: 17, train_loss: 1.0765, test_loss: 1.2103, test_f1: 0.4515
 epoch: 18, train_loss: 1.0817, test_loss: 1.2139, test_f1: 0.4536
 epoch: 19, train_loss: 1.0817, test_loss: 1.2278, test_f1: 0.4667
 epoch: 20, train_loss: 1.0663, test_loss: 1.2051, test_f1: 0.4654
 epoch: 21, train_loss: 1.0715, test_loss: 1.2207, test_f1: 0.4389
 epoch: 22, train_loss: 1.0523, test_loss: 1.1953, test_f1: 0.4495
 epoch: 23, train_loss: 1.0621, test_loss: 1.2022, test_f1: 0.4571
 epoch: 24, train_loss: 1.0461, test_loss: 1.2070, test_f1: 0.4524
 epoch: 25, train_loss: 1.0317, test_loss: 1.1933, test_f1: 0.4351
 epoch: 26, train_loss: 1.0444, test_loss: 1.1911, test_f1: 0.4665
 epoch: 27, train_loss: 1.0250, test_loss: 1.1739, test_f1: 0.4772
 epoch: 28, train_loss: 1.0382, test_loss: 1.1852, test_f1: 0.4837
 epoch: 29, train_loss: 1.0157, test_loss: 1.1923, test_f1: 0.4786
 epoch: 30, train_loss: 1.0068, test_loss: 1.1994, test_f1: 0.4884
 epoch: 31, train_loss: 1.0013, test_loss: 1.2059, test_f1: 0.4905
 epoch: 32, train_loss: 1.0059, test_loss: 1.2240, test_f1: 0.4903
 epoch: 33, train_loss: 0.9979, test_loss: 1.2411, test_f1: 0.4955
 epoch: 34, train_loss: 0.9868, test_loss: 1.2339, test_f1: 0.5222
 epoch: 35, train_loss: 0.9847, test_loss: 1.2271, test_f1: 0.5041
 epoch: 36, train_loss: 0.9678, test_loss: 1.2220, test_f1: 0.4907
 epoch: 37, train_loss: 0.9719, test_loss: 1.2161, test_f1: 0.5131
 epoch: 38, train_loss: 0.9605, test_loss: 1.2237, test_f1: 0.5218
 epoch: 39, train_loss: 0.9635, test_loss: 1.2491, test_f1: 0.5145
 epoch: 40, train_loss: 0.9577, test_loss: 1.2324, test_f1: 0.5443
 epoch: 41, train_loss: 0.9513, test_loss: 1.2379, test_f1: 0.5364
 epoch: 42, train_loss: 0.9345, test_loss: 1.2661, test_f1: 0.5371
 epoch: 43, train_loss: 0.9278, test_loss: 1.2673, test_f1: 0.5287
 epoch: 44, train_loss: 0.9369, test_loss: 1.2483, test_f1: 0.5347
 epoch: 45, train_loss: 0.9288, test_loss: 1.2916, test_f1: 0.5187
 epoch: 46, train_loss: 0.9334, test_loss: 1.2481, test_f1: 0.5116
 epoch: 47, train_loss: 0.9149, test_loss: 1.2619, test_f1: 0.4985
 epoch: 48, train_loss: 0.9233, test_loss: 1.2188, test_f1: 0.5335
 epoch: 49, train_loss: 0.8975, test_loss: 1.2463, test_f1: 0.5385
 epoch: 50, train_loss: 0.9205, test_loss: 1.3057, test_f1: 0.5535
 epoch: 51, train_loss: 0.8946, test_loss: 1.2699, test_f1: 0.5374
 epoch: 52, train_loss: 0.9021, test_loss: 1.2481, test_f1: 0.5301
 epoch: 53, train_loss: 0.9085, test_loss: 1.2916, test_f1: 0.5320
 epoch: 54, train_loss: 0.8907, test_loss: 1.2620, test_f1: 0.5307
 epoch: 55, train_loss: 0.8887, test_loss: 1.2292, test_f1: 0.5181
 epoch: 56, train_loss: 0.8880, test_loss: 1.2437, test_f1: 0.5309
 epoch: 57, train_loss: 0.8703, test_loss: 1.2408, test_f1: 0.5200
 epoch: 58, train_loss: 0.8819, test_loss: 1.2476, test_f1: 0.5152
 epoch: 59, train_loss: 0.8862, test_loss: 1.2501, test_f1: 0.5210
 epoch: 60, train_loss: 0.8833, test_loss: 1.2527, test_f1: 0.5511
 epoch: 61, train_loss: 0.8811, test_loss: 1.2515, test_f1: 0.5377
 epoch: 62, train_loss: 0.8797, test_loss: 1.2425, test_f1: 0.5507
 epoch: 63, train_loss: 0.8751, test_loss: 1.2518, test_f1: 0.5343
 epoch: 64, train_loss: 0.8717, test_loss: 1.2632, test_f1: 0.5237
 epoch: 65, train_loss: 0.8596, test_loss: 1.2581, test_f1: 0.5167
 epoch: 66, train_loss: 0.8649, test_loss: 1.2873, test_f1: 0.5023
 epoch: 67, train_loss: 0.8670, test_loss: 1.2630, test_f1: 0.5377
 epoch: 68, train_loss: 0.8479, test_loss: 1.2563, test_f1: 0.5302
 epoch: 69, train_loss: 0.8722, test_loss: 1.2535, test_f1: 0.5388
 epoch: 70, train_loss: 0.8527, test_loss: 1.2835, test_f1: 0.5381
 epoch: 71, train_loss: 0.8505, test_loss: 1.2825, test_f1: 0.5107
 epoch: 72, train_loss: 0.8532, test_loss: 1.2967, test_f1: 0.5088
 epoch: 73, train_loss: 0.8272, test_loss: 1.2809, test_f1: 0.5136
 epoch: 74, train_loss: 0.8418, test_loss: 1.3023, test_f1: 0.5058
 epoch: 75, train_loss: 0.8534, test_loss: 1.2984, test_f1: 0.5174
 epoch: 76, train_loss: 0.8482, test_loss: 1.2889, test_f1: 0.5354
 epoch: 77, train_loss: 0.8467, test_loss: 1.2722, test_f1: 0.5087
 epoch: 78, train_loss: 0.8397, test_loss: 1.3174, test_f1: 0.4922
 epoch: 79, train_loss: 0.8350, test_loss: 1.2953, test_f1: 0.4950
 epoch: 80, train_loss: 0.8318, test_loss: 1.3186, test_f1: 0.5016
 epoch: 81, train_loss: 0.8318, test_loss: 1.3285, test_f1: 0.5014
 epoch: 82, train_loss: 0.8354, test_loss: 1.3072, test_f1: 0.5367
 epoch: 83, train_loss: 0.8526, test_loss: 1.3167, test_f1: 0.5304
 epoch: 84, train_loss: 0.8285, test_loss: 1.2739, test_f1: 0.5387
 epoch: 85, train_loss: 0.8182, test_loss: 1.2700, test_f1: 0.5235
 epoch: 86, train_loss: 0.8283, test_loss: 1.2995, test_f1: 0.5292
 epoch: 87, train_loss: 0.8477, test_loss: 1.3511, test_f1: 0.5037
 epoch: 88, train_loss: 0.8239, test_loss: 1.2842, test_f1: 0.5362
 epoch: 89, train_loss: 0.8234, test_loss: 1.3057, test_f1: 0.5108
 epoch: 90, train_loss: 0.8172, test_loss: 1.3872, test_f1: 0.4872
 epoch: 91, train_loss: 0.8305, test_loss: 1.3066, test_f1: 0.5367
 epoch: 92, train_loss: 0.8226, test_loss: 1.3365, test_f1: 0.5057
 epoch: 93, train_loss: 0.8146, test_loss: 1.3616, test_f1: 0.5124
 epoch: 94, train_loss: 0.8143, test_loss: 1.3272, test_f1: 0.5272
 epoch: 95, train_loss: 0.8143, test_loss: 1.3430, test_f1: 0.4873
 epoch: 96, train_loss: 0.8337, test_loss: 1.3547, test_f1: 0.4860
 epoch: 97, train_loss: 0.8219, test_loss: 1.3622, test_f1: 0.4690
 epoch: 98, train_loss: 0.8228, test_loss: 1.3337, test_f1: 0.5252
 epoch: 99, train_loss: 0.8036, test_loss: 1.4061, test_f1: 0.5146
##################ITERATION #5 ****************************************
 epoch: 0, train_loss: 1.3619, test_loss: 1.3745, test_f1: 0.2404
 epoch: 1, train_loss: 1.2650, test_loss: 1.3326, test_f1: 0.2270
 epoch: 2, train_loss: 1.2586, test_loss: 1.4055, test_f1: 0.2290
 epoch: 3, train_loss: 1.2358, test_loss: 1.4347, test_f1: 0.2674
 epoch: 4, train_loss: 1.2243, test_loss: 1.3625, test_f1: 0.2955
 epoch: 5, train_loss: 1.2050, test_loss: 1.3989, test_f1: 0.2911
 epoch: 6, train_loss: 1.2049, test_loss: 1.3725, test_f1: 0.3288
 epoch: 7, train_loss: 1.2012, test_loss: 1.3161, test_f1: 0.3182
 epoch: 8, train_loss: 1.1832, test_loss: 1.3126, test_f1: 0.3668
 epoch: 9, train_loss: 1.1834, test_loss: 1.2953, test_f1: 0.3741
 epoch: 10, train_loss: 1.1813, test_loss: 1.2964, test_f1: 0.3791
 epoch: 11, train_loss: 1.1741, test_loss: 1.2802, test_f1: 0.3939
 epoch: 12, train_loss: 1.1645, test_loss: 1.2733, test_f1: 0.4146
 epoch: 13, train_loss: 1.1633, test_loss: 1.2751, test_f1: 0.4189
 epoch: 14, train_loss: 1.1390, test_loss: 1.2640, test_f1: 0.4157
 epoch: 15, train_loss: 1.1438, test_loss: 1.2624, test_f1: 0.4374
 epoch: 16, train_loss: 1.1405, test_loss: 1.2693, test_f1: 0.4478
 epoch: 17, train_loss: 1.1232, test_loss: 1.2624, test_f1: 0.4462
 epoch: 18, train_loss: 1.1098, test_loss: 1.2392, test_f1: 0.4327
 epoch: 19, train_loss: 1.1088, test_loss: 1.2145, test_f1: 0.4612
 epoch: 20, train_loss: 1.1033, test_loss: 1.1981, test_f1: 0.4567
 epoch: 21, train_loss: 1.1066, test_loss: 1.1885, test_f1: 0.4476
 epoch: 22, train_loss: 1.0777, test_loss: 1.1768, test_f1: 0.4707
 epoch: 23, train_loss: 1.0871, test_loss: 1.2008, test_f1: 0.4602
 epoch: 24, train_loss: 1.0746, test_loss: 1.2418, test_f1: 0.4755
 epoch: 25, train_loss: 1.0584, test_loss: 1.2296, test_f1: 0.5101
 epoch: 26, train_loss: 1.0589, test_loss: 1.2478, test_f1: 0.5068
 epoch: 27, train_loss: 1.0515, test_loss: 1.2882, test_f1: 0.5062
 epoch: 28, train_loss: 1.0654, test_loss: 1.2541, test_f1: 0.5110
 epoch: 29, train_loss: 1.0333, test_loss: 1.2167, test_f1: 0.5154
 epoch: 30, train_loss: 1.0407, test_loss: 1.3533, test_f1: 0.4998
 epoch: 31, train_loss: 1.0127, test_loss: 1.2511, test_f1: 0.5139
 epoch: 32, train_loss: 1.0188, test_loss: 1.2408, test_f1: 0.5145
 epoch: 33, train_loss: 1.0150, test_loss: 1.2203, test_f1: 0.5011
 epoch: 34, train_loss: 1.0128, test_loss: 1.2471, test_f1: 0.5060
 epoch: 35, train_loss: 1.0032, test_loss: 1.1698, test_f1: 0.5197
 epoch: 36, train_loss: 0.9895, test_loss: 1.2308, test_f1: 0.5145
 epoch: 37, train_loss: 1.0005, test_loss: 1.3333, test_f1: 0.5383
 epoch: 38, train_loss: 0.9786, test_loss: 1.2301, test_f1: 0.5311
 epoch: 39, train_loss: 0.9734, test_loss: 1.1639, test_f1: 0.5349
 epoch: 40, train_loss: 0.9765, test_loss: 1.1730, test_f1: 0.5364
 epoch: 41, train_loss: 0.9597, test_loss: 1.2527, test_f1: 0.5344
 epoch: 42, train_loss: 0.9765, test_loss: 1.2001, test_f1: 0.5310
 epoch: 43, train_loss: 0.9742, test_loss: 1.2584, test_f1: 0.5353
 epoch: 44, train_loss: 0.9583, test_loss: 1.2454, test_f1: 0.5291
 epoch: 45, train_loss: 0.9337, test_loss: 1.2356, test_f1: 0.5285
 epoch: 46, train_loss: 0.9496, test_loss: 1.2816, test_f1: 0.5059
 epoch: 47, train_loss: 0.9513, test_loss: 1.3375, test_f1: 0.5088
 epoch: 48, train_loss: 0.9291, test_loss: 1.2662, test_f1: 0.4971
 epoch: 49, train_loss: 0.9480, test_loss: 1.1983, test_f1: 0.5448
 epoch: 50, train_loss: 0.9329, test_loss: 1.2902, test_f1: 0.5126
 epoch: 51, train_loss: 0.9285, test_loss: 1.2375, test_f1: 0.5188
 epoch: 52, train_loss: 0.9190, test_loss: 1.2318, test_f1: 0.5308
 epoch: 53, train_loss: 0.9068, test_loss: 1.2741, test_f1: 0.5456
 epoch: 54, train_loss: 0.9239, test_loss: 1.2745, test_f1: 0.5360
 epoch: 55, train_loss: 0.9218, test_loss: 1.2555, test_f1: 0.5504
 epoch: 56, train_loss: 0.9068, test_loss: 1.2878, test_f1: 0.5343
 epoch: 57, train_loss: 0.9055, test_loss: 1.2652, test_f1: 0.5336
 epoch: 58, train_loss: 0.9110, test_loss: 1.2089, test_f1: 0.5244
 epoch: 59, train_loss: 0.9051, test_loss: 1.2607, test_f1: 0.5245
 epoch: 60, train_loss: 0.8945, test_loss: 1.3141, test_f1: 0.5246
 epoch: 61, train_loss: 0.8863, test_loss: 1.2753, test_f1: 0.5517
 epoch: 62, train_loss: 0.9046, test_loss: 1.3047, test_f1: 0.5420
 epoch: 63, train_loss: 0.8949, test_loss: 1.2751, test_f1: 0.5164
 epoch: 64, train_loss: 0.8897, test_loss: 1.2475, test_f1: 0.5358
 epoch: 65, train_loss: 0.8884, test_loss: 1.2879, test_f1: 0.5186
 epoch: 66, train_loss: 0.8973, test_loss: 1.2804, test_f1: 0.5301
 epoch: 67, train_loss: 0.8953, test_loss: 1.3341, test_f1: 0.5286
 epoch: 68, train_loss: 0.8882, test_loss: 1.3162, test_f1: 0.5437
 epoch: 69, train_loss: 0.8798, test_loss: 1.3194, test_f1: 0.5462
 epoch: 70, train_loss: 0.8754, test_loss: 1.3322, test_f1: 0.5111
 epoch: 71, train_loss: 0.8825, test_loss: 1.3791, test_f1: 0.4991
 epoch: 72, train_loss: 0.8889, test_loss: 1.3233, test_f1: 0.5525
 epoch: 73, train_loss: 0.8776, test_loss: 1.3370, test_f1: 0.5199
 epoch: 74, train_loss: 0.8670, test_loss: 1.3225, test_f1: 0.5047
 epoch: 75, train_loss: 0.8673, test_loss: 1.3214, test_f1: 0.5257
 epoch: 76, train_loss: 0.8863, test_loss: 1.3034, test_f1: 0.5173
 epoch: 77, train_loss: 0.8502, test_loss: 1.3151, test_f1: 0.5249
 epoch: 78, train_loss: 0.8652, test_loss: 1.3252, test_f1: 0.5210
 epoch: 79, train_loss: 0.8695, test_loss: 1.3582, test_f1: 0.5335
 epoch: 80, train_loss: 0.8656, test_loss: 1.3550, test_f1: 0.5221
 epoch: 81, train_loss: 0.8657, test_loss: 1.3747, test_f1: 0.5071
 epoch: 82, train_loss: 0.8678, test_loss: 1.4042, test_f1: 0.5044
 epoch: 83, train_loss: 0.8595, test_loss: 1.3297, test_f1: 0.5274
 epoch: 84, train_loss: 0.8666, test_loss: 1.2986, test_f1: 0.5265
 epoch: 85, train_loss: 0.8512, test_loss: 1.3353, test_f1: 0.5337
 epoch: 86, train_loss: 0.8597, test_loss: 1.3666, test_f1: 0.5205
 epoch: 87, train_loss: 0.8594, test_loss: 1.3749, test_f1: 0.5152
 epoch: 88, train_loss: 0.8615, test_loss: 1.3666, test_f1: 0.5242
 epoch: 89, train_loss: 0.8479, test_loss: 1.3972, test_f1: 0.5160
 epoch: 90, train_loss: 0.8390, test_loss: 1.3824, test_f1: 0.5309
 epoch: 91, train_loss: 0.8501, test_loss: 1.4102, test_f1: 0.5399
 epoch: 92, train_loss: 0.8392, test_loss: 1.4279, test_f1: 0.5237
 epoch: 93, train_loss: 0.8418, test_loss: 1.3780, test_f1: 0.5217
 epoch: 94, train_loss: 0.8336, test_loss: 1.3729, test_f1: 0.5429
 epoch: 95, train_loss: 0.8549, test_loss: 1.3915, test_f1: 0.5429
 epoch: 96, train_loss: 0.8449, test_loss: 1.4359, test_f1: 0.5555
 epoch: 97, train_loss: 0.8353, test_loss: 1.4383, test_f1: 0.5419
 epoch: 98, train_loss: 0.8387, test_loss: 1.4771, test_f1: 0.5083
 epoch: 99, train_loss: 0.8356, test_loss: 1.5469, test_f1: 0.5079
##################ITERATION #6 ****************************************
 epoch: 0, train_loss: 1.4348, test_loss: 1.3183, test_f1: 0.2211
 epoch: 1, train_loss: 1.2658, test_loss: 1.3351, test_f1: 0.2270
 epoch: 2, train_loss: 1.2456, test_loss: 1.3544, test_f1: 0.2613
 epoch: 3, train_loss: 1.2569, test_loss: 1.3718, test_f1: 0.2609
 epoch: 4, train_loss: 1.2337, test_loss: 1.3312, test_f1: 0.2513
 epoch: 5, train_loss: 1.2305, test_loss: 1.3098, test_f1: 0.2621
 epoch: 6, train_loss: 1.2105, test_loss: 1.3120, test_f1: 0.2447
 epoch: 7, train_loss: 1.2096, test_loss: 1.2954, test_f1: 0.2435
 epoch: 8, train_loss: 1.1873, test_loss: 1.2902, test_f1: 0.2555
 epoch: 9, train_loss: 1.2009, test_loss: 1.2874, test_f1: 0.2829
 epoch: 10, train_loss: 1.1911, test_loss: 1.2866, test_f1: 0.3177
 epoch: 11, train_loss: 1.1913, test_loss: 1.2935, test_f1: 0.2828
 epoch: 12, train_loss: 1.1781, test_loss: 1.2837, test_f1: 0.3038
 epoch: 13, train_loss: 1.1793, test_loss: 1.2768, test_f1: 0.3104
 epoch: 14, train_loss: 1.1745, test_loss: 1.2945, test_f1: 0.3074
 epoch: 15, train_loss: 1.1759, test_loss: 1.3077, test_f1: 0.2941
 epoch: 16, train_loss: 1.1508, test_loss: 1.3113, test_f1: 0.3085
 epoch: 17, train_loss: 1.1526, test_loss: 1.3204, test_f1: 0.3075
 epoch: 18, train_loss: 1.1503, test_loss: 1.3109, test_f1: 0.3031
 epoch: 19, train_loss: 1.1424, test_loss: 1.3082, test_f1: 0.3378
 epoch: 20, train_loss: 1.1543, test_loss: 1.3119, test_f1: 0.3114
 epoch: 21, train_loss: 1.1468, test_loss: 1.2884, test_f1: 0.3084
 epoch: 22, train_loss: 1.1332, test_loss: 1.2995, test_f1: 0.3669
 epoch: 23, train_loss: 1.1332, test_loss: 1.2776, test_f1: 0.3750
 epoch: 24, train_loss: 1.1277, test_loss: 1.2711, test_f1: 0.3631
 epoch: 25, train_loss: 1.1280, test_loss: 1.3063, test_f1: 0.3613
 epoch: 26, train_loss: 1.1120, test_loss: 1.2841, test_f1: 0.3984
 epoch: 27, train_loss: 1.0979, test_loss: 1.2398, test_f1: 0.3889
 epoch: 28, train_loss: 1.1167, test_loss: 1.2434, test_f1: 0.3602
 epoch: 29, train_loss: 1.0971, test_loss: 1.2202, test_f1: 0.4209
 epoch: 30, train_loss: 1.0877, test_loss: 1.1984, test_f1: 0.4110
 epoch: 31, train_loss: 1.0807, test_loss: 1.2085, test_f1: 0.4143
 epoch: 32, train_loss: 1.0672, test_loss: 1.1976, test_f1: 0.3969
 epoch: 33, train_loss: 1.0653, test_loss: 1.1998, test_f1: 0.4114
 epoch: 34, train_loss: 1.0635, test_loss: 1.2472, test_f1: 0.4190
 epoch: 35, train_loss: 1.0537, test_loss: 1.2739, test_f1: 0.3888
 epoch: 36, train_loss: 1.0443, test_loss: 1.2557, test_f1: 0.4092
 epoch: 37, train_loss: 1.0421, test_loss: 1.3335, test_f1: 0.3716
 epoch: 38, train_loss: 1.0176, test_loss: 1.3030, test_f1: 0.4122
 epoch: 39, train_loss: 1.0112, test_loss: 1.2911, test_f1: 0.4146
 epoch: 40, train_loss: 1.0104, test_loss: 1.3470, test_f1: 0.4000
 epoch: 41, train_loss: 1.0120, test_loss: 1.2626, test_f1: 0.3886
 epoch: 42, train_loss: 1.0064, test_loss: 1.2945, test_f1: 0.4074
 epoch: 43, train_loss: 0.9890, test_loss: 1.2568, test_f1: 0.4195
 epoch: 44, train_loss: 0.9868, test_loss: 1.2694, test_f1: 0.4121
 epoch: 45, train_loss: 0.9734, test_loss: 1.3527, test_f1: 0.3685
 epoch: 46, train_loss: 0.9756, test_loss: 1.2637, test_f1: 0.3982
 epoch: 47, train_loss: 0.9668, test_loss: 1.2657, test_f1: 0.4224
 epoch: 48, train_loss: 0.9453, test_loss: 1.2386, test_f1: 0.4358
 epoch: 49, train_loss: 0.9665, test_loss: 1.3382, test_f1: 0.4071
 epoch: 50, train_loss: 0.9432, test_loss: 1.3274, test_f1: 0.3870
 epoch: 51, train_loss: 0.9402, test_loss: 1.3393, test_f1: 0.4304
 epoch: 52, train_loss: 0.9330, test_loss: 1.3762, test_f1: 0.4315
 epoch: 53, train_loss: 0.9325, test_loss: 1.3240, test_f1: 0.4209
 epoch: 54, train_loss: 0.9274, test_loss: 1.3144, test_f1: 0.4185
 epoch: 55, train_loss: 0.9259, test_loss: 1.3336, test_f1: 0.4370
 epoch: 56, train_loss: 0.9200, test_loss: 1.3461, test_f1: 0.4315
 epoch: 57, train_loss: 0.9192, test_loss: 1.3104, test_f1: 0.4300
 epoch: 58, train_loss: 0.9183, test_loss: 1.3220, test_f1: 0.4093
 epoch: 59, train_loss: 0.9166, test_loss: 1.3284, test_f1: 0.4351
 epoch: 60, train_loss: 0.9014, test_loss: 1.3607, test_f1: 0.4337
 epoch: 61, train_loss: 0.9105, test_loss: 1.3932, test_f1: 0.4263
 epoch: 62, train_loss: 0.9056, test_loss: 1.3625, test_f1: 0.4207
 epoch: 63, train_loss: 0.9049, test_loss: 1.4238, test_f1: 0.4163
 epoch: 64, train_loss: 0.9073, test_loss: 1.3974, test_f1: 0.4327
 epoch: 65, train_loss: 0.9058, test_loss: 1.4172, test_f1: 0.4375
 epoch: 66, train_loss: 0.9031, test_loss: 1.3514, test_f1: 0.4411
 epoch: 67, train_loss: 0.9051, test_loss: 1.3687, test_f1: 0.4401
 epoch: 68, train_loss: 0.8949, test_loss: 1.3869, test_f1: 0.4338
 epoch: 69, train_loss: 0.8882, test_loss: 1.3740, test_f1: 0.4415
 epoch: 70, train_loss: 0.8988, test_loss: 1.3792, test_f1: 0.4448
 epoch: 71, train_loss: 0.9050, test_loss: 1.4489, test_f1: 0.4491
 epoch: 72, train_loss: 0.8776, test_loss: 1.3716, test_f1: 0.4496
 epoch: 73, train_loss: 0.8708, test_loss: 1.4004, test_f1: 0.4563
 epoch: 74, train_loss: 0.8914, test_loss: 1.3757, test_f1: 0.4292
 epoch: 75, train_loss: 0.8885, test_loss: 1.3494, test_f1: 0.4223
 epoch: 76, train_loss: 0.8947, test_loss: 1.4572, test_f1: 0.4349
 epoch: 77, train_loss: 0.8817, test_loss: 1.3915, test_f1: 0.4522
 epoch: 78, train_loss: 0.8738, test_loss: 1.3928, test_f1: 0.4630
 epoch: 79, train_loss: 0.8762, test_loss: 1.3578, test_f1: 0.4371
 epoch: 80, train_loss: 0.8735, test_loss: 1.3538, test_f1: 0.4524
 epoch: 81, train_loss: 0.8669, test_loss: 1.3354, test_f1: 0.4600
 epoch: 82, train_loss: 0.8825, test_loss: 1.3707, test_f1: 0.4574
 epoch: 83, train_loss: 0.8610, test_loss: 1.3592, test_f1: 0.4853
 epoch: 84, train_loss: 0.8581, test_loss: 1.3879, test_f1: 0.4537
 epoch: 85, train_loss: 0.8585, test_loss: 1.3918, test_f1: 0.4549
 epoch: 86, train_loss: 0.8555, test_loss: 1.3340, test_f1: 0.4491
 epoch: 87, train_loss: 0.8425, test_loss: 1.3550, test_f1: 0.4485
 epoch: 88, train_loss: 0.8688, test_loss: 1.3977, test_f1: 0.4575
 epoch: 89, train_loss: 0.8445, test_loss: 1.3454, test_f1: 0.4928
 epoch: 90, train_loss: 0.8387, test_loss: 1.3784, test_f1: 0.4900
 epoch: 91, train_loss: 0.8479, test_loss: 1.4113, test_f1: 0.4765
 epoch: 92, train_loss: 0.8573, test_loss: 1.4094, test_f1: 0.4965
 epoch: 93, train_loss: 0.8397, test_loss: 1.4434, test_f1: 0.4432
 epoch: 94, train_loss: 0.8532, test_loss: 1.3879, test_f1: 0.4555
 epoch: 95, train_loss: 0.8380, test_loss: 1.4368, test_f1: 0.4455
 epoch: 96, train_loss: 0.8379, test_loss: 1.4176, test_f1: 0.4764
 epoch: 97, train_loss: 0.8286, test_loss: 1.3476, test_f1: 0.4743
 epoch: 98, train_loss: 0.8394, test_loss: 1.4034, test_f1: 0.4841
 epoch: 99, train_loss: 0.8347, test_loss: 1.4689, test_f1: 0.4681
##################ITERATION #7 ****************************************
 epoch: 0, train_loss: 1.2852, test_loss: 1.3201, test_f1: 0.2524
 epoch: 1, train_loss: 1.2430, test_loss: 1.3114, test_f1: 0.2281
 epoch: 2, train_loss: 1.2388, test_loss: 1.2906, test_f1: 0.2281
 epoch: 3, train_loss: 1.2265, test_loss: 1.3095, test_f1: 0.2337
 epoch: 4, train_loss: 1.2248, test_loss: 1.3178, test_f1: 0.2987
 epoch: 5, train_loss: 1.2092, test_loss: 1.3016, test_f1: 0.2941
 epoch: 6, train_loss: 1.2128, test_loss: 1.2718, test_f1: 0.2731
 epoch: 7, train_loss: 1.2052, test_loss: 1.2677, test_f1: 0.3343
 epoch: 8, train_loss: 1.1952, test_loss: 1.2522, test_f1: 0.3070
 epoch: 9, train_loss: 1.1898, test_loss: 1.2484, test_f1: 0.2798
 epoch: 10, train_loss: 1.1865, test_loss: 1.2507, test_f1: 0.2601
 epoch: 11, train_loss: 1.1852, test_loss: 1.2489, test_f1: 0.2983
 epoch: 12, train_loss: 1.1707, test_loss: 1.2357, test_f1: 0.3187
 epoch: 13, train_loss: 1.1718, test_loss: 1.2298, test_f1: 0.3447
 epoch: 14, train_loss: 1.1671, test_loss: 1.2287, test_f1: 0.3576
 epoch: 15, train_loss: 1.1638, test_loss: 1.2358, test_f1: 0.3555
 epoch: 16, train_loss: 1.1730, test_loss: 1.2199, test_f1: 0.3541
 epoch: 17, train_loss: 1.1526, test_loss: 1.2192, test_f1: 0.3643
 epoch: 18, train_loss: 1.1537, test_loss: 1.2136, test_f1: 0.3729
 epoch: 19, train_loss: 1.1490, test_loss: 1.2192, test_f1: 0.3384
 epoch: 20, train_loss: 1.1414, test_loss: 1.2116, test_f1: 0.3159
 epoch: 21, train_loss: 1.1385, test_loss: 1.2087, test_f1: 0.3716
 epoch: 22, train_loss: 1.1262, test_loss: 1.2174, test_f1: 0.4011
 epoch: 23, train_loss: 1.1315, test_loss: 1.2102, test_f1: 0.4292
 epoch: 24, train_loss: 1.1381, test_loss: 1.2176, test_f1: 0.3791
 epoch: 25, train_loss: 1.1213, test_loss: 1.2139, test_f1: 0.3809
 epoch: 26, train_loss: 1.1265, test_loss: 1.2182, test_f1: 0.3919
 epoch: 27, train_loss: 1.1097, test_loss: 1.2006, test_f1: 0.4215
 epoch: 28, train_loss: 1.1164, test_loss: 1.2064, test_f1: 0.4350
 epoch: 29, train_loss: 1.0953, test_loss: 1.1970, test_f1: 0.4363
 epoch: 30, train_loss: 1.0952, test_loss: 1.1946, test_f1: 0.4510
 epoch: 31, train_loss: 1.0824, test_loss: 1.1955, test_f1: 0.4555
 epoch: 32, train_loss: 1.0968, test_loss: 1.2001, test_f1: 0.4339
 epoch: 33, train_loss: 1.0871, test_loss: 1.1732, test_f1: 0.4318
 epoch: 34, train_loss: 1.0765, test_loss: 1.1699, test_f1: 0.4519
 epoch: 35, train_loss: 1.0780, test_loss: 1.1997, test_f1: 0.4504
 epoch: 36, train_loss: 1.0583, test_loss: 1.2031, test_f1: 0.4383
 epoch: 37, train_loss: 1.0564, test_loss: 1.1658, test_f1: 0.4453
 epoch: 38, train_loss: 1.0628, test_loss: 1.1635, test_f1: 0.4448
 epoch: 39, train_loss: 1.0561, test_loss: 1.1850, test_f1: 0.4520
 epoch: 40, train_loss: 1.0462, test_loss: 1.2009, test_f1: 0.4375
 epoch: 41, train_loss: 1.0251, test_loss: 1.1739, test_f1: 0.4538
 epoch: 42, train_loss: 1.0156, test_loss: 1.1663, test_f1: 0.4727
 epoch: 43, train_loss: 1.0057, test_loss: 1.1646, test_f1: 0.4663
 epoch: 44, train_loss: 1.0069, test_loss: 1.2037, test_f1: 0.4422
 epoch: 45, train_loss: 1.0222, test_loss: 1.1119, test_f1: 0.4748
 epoch: 46, train_loss: 1.0078, test_loss: 1.1689, test_f1: 0.4584
 epoch: 47, train_loss: 0.9965, test_loss: 1.1251, test_f1: 0.4948
 epoch: 48, train_loss: 0.9978, test_loss: 1.1581, test_f1: 0.4670
 epoch: 49, train_loss: 0.9788, test_loss: 1.1296, test_f1: 0.5026
 epoch: 50, train_loss: 0.9724, test_loss: 1.1229, test_f1: 0.5108
 epoch: 51, train_loss: 0.9600, test_loss: 1.1285, test_f1: 0.4992
 epoch: 52, train_loss: 0.9726, test_loss: 1.1098, test_f1: 0.4984
 epoch: 53, train_loss: 0.9492, test_loss: 1.1223, test_f1: 0.4756
 epoch: 54, train_loss: 0.9508, test_loss: 1.0890, test_f1: 0.5217
 epoch: 55, train_loss: 0.9397, test_loss: 1.1168, test_f1: 0.4908
 epoch: 56, train_loss: 0.9584, test_loss: 1.1449, test_f1: 0.4707
 epoch: 57, train_loss: 0.9450, test_loss: 1.0976, test_f1: 0.5118
 epoch: 58, train_loss: 0.9308, test_loss: 1.1119, test_f1: 0.5107
 epoch: 59, train_loss: 0.9331, test_loss: 1.0900, test_f1: 0.5334
 epoch: 60, train_loss: 0.9500, test_loss: 1.1094, test_f1: 0.4801
 epoch: 61, train_loss: 0.9234, test_loss: 1.1495, test_f1: 0.4731
 epoch: 62, train_loss: 0.9204, test_loss: 1.0995, test_f1: 0.5064
 epoch: 63, train_loss: 0.9173, test_loss: 1.1016, test_f1: 0.5044
 epoch: 64, train_loss: 0.9428, test_loss: 1.1115, test_f1: 0.4928
 epoch: 65, train_loss: 0.9345, test_loss: 1.1385, test_f1: 0.4745
 epoch: 66, train_loss: 0.9140, test_loss: 1.1191, test_f1: 0.4883
 epoch: 67, train_loss: 0.9344, test_loss: 1.1398, test_f1: 0.4835
 epoch: 68, train_loss: 0.9145, test_loss: 1.1640, test_f1: 0.4732
 epoch: 69, train_loss: 0.9280, test_loss: 1.1003, test_f1: 0.4976
 epoch: 70, train_loss: 0.9171, test_loss: 1.0949, test_f1: 0.5051
 epoch: 71, train_loss: 0.9064, test_loss: 1.1182, test_f1: 0.4797
 epoch: 72, train_loss: 0.9200, test_loss: 1.1387, test_f1: 0.4690
 epoch: 73, train_loss: 0.9220, test_loss: 1.1698, test_f1: 0.4541
 epoch: 74, train_loss: 0.9193, test_loss: 1.1323, test_f1: 0.4947
 epoch: 75, train_loss: 0.8915, test_loss: 1.1730, test_f1: 0.4758
 epoch: 76, train_loss: 0.8979, test_loss: 1.1488, test_f1: 0.5007
 epoch: 77, train_loss: 0.8927, test_loss: 1.1224, test_f1: 0.5097
 epoch: 78, train_loss: 0.9101, test_loss: 1.1318, test_f1: 0.5021
 epoch: 79, train_loss: 0.9089, test_loss: 1.1314, test_f1: 0.4917
 epoch: 80, train_loss: 0.8998, test_loss: 1.1608, test_f1: 0.4735
 epoch: 81, train_loss: 0.8934, test_loss: 1.1877, test_f1: 0.5028
 epoch: 82, train_loss: 0.8888, test_loss: 1.1758, test_f1: 0.4898
 epoch: 83, train_loss: 0.8947, test_loss: 1.1546, test_f1: 0.4736
 epoch: 84, train_loss: 0.8908, test_loss: 1.1636, test_f1: 0.4917
 epoch: 85, train_loss: 0.8657, test_loss: 1.1373, test_f1: 0.5374
 epoch: 86, train_loss: 0.8724, test_loss: 1.1861, test_f1: 0.5077
 epoch: 87, train_loss: 0.8923, test_loss: 1.1754, test_f1: 0.4749
 epoch: 88, train_loss: 0.8835, test_loss: 1.2319, test_f1: 0.4667
 epoch: 89, train_loss: 0.8792, test_loss: 1.2541, test_f1: 0.5138
 epoch: 90, train_loss: 0.8816, test_loss: 1.2262, test_f1: 0.5178
 epoch: 91, train_loss: 0.8727, test_loss: 1.1654, test_f1: 0.5244
 epoch: 92, train_loss: 0.8740, test_loss: 1.2284, test_f1: 0.4850
 epoch: 93, train_loss: 0.8755, test_loss: 1.2506, test_f1: 0.4895
 epoch: 94, train_loss: 0.8858, test_loss: 1.2913, test_f1: 0.4592
 epoch: 95, train_loss: 0.8714, test_loss: 1.1789, test_f1: 0.5208
 epoch: 96, train_loss: 0.8801, test_loss: 1.2416, test_f1: 0.5121
 epoch: 97, train_loss: 0.8728, test_loss: 1.2604, test_f1: 0.4942
 epoch: 98, train_loss: 0.8749, test_loss: 1.2043, test_f1: 0.5176
 epoch: 99, train_loss: 0.8507, test_loss: 1.2310, test_f1: 0.4901
##################ITERATION #8 ****************************************
 epoch: 0, train_loss: 1.4110, test_loss: 1.3785, test_f1: 0.2630
 epoch: 1, train_loss: 1.2363, test_loss: 1.3764, test_f1: 0.2379
 epoch: 2, train_loss: 1.2185, test_loss: 1.3994, test_f1: 0.2329
 epoch: 3, train_loss: 1.2099, test_loss: 1.3492, test_f1: 0.3195
 epoch: 4, train_loss: 1.1772, test_loss: 1.3090, test_f1: 0.3948
 epoch: 5, train_loss: 1.1828, test_loss: 1.2807, test_f1: 0.4088
 epoch: 6, train_loss: 1.1577, test_loss: 1.2699, test_f1: 0.3845
 epoch: 7, train_loss: 1.1491, test_loss: 1.2578, test_f1: 0.4015
 epoch: 8, train_loss: 1.1318, test_loss: 1.2727, test_f1: 0.3862
 epoch: 9, train_loss: 1.1234, test_loss: 1.2554, test_f1: 0.4057
 epoch: 10, train_loss: 1.1184, test_loss: 1.2457, test_f1: 0.4296
 epoch: 11, train_loss: 1.0961, test_loss: 1.2429, test_f1: 0.4161
 epoch: 12, train_loss: 1.0775, test_loss: 1.2407, test_f1: 0.4274
 epoch: 13, train_loss: 1.0546, test_loss: 1.2223, test_f1: 0.4500
 epoch: 14, train_loss: 1.0621, test_loss: 1.2311, test_f1: 0.4450
 epoch: 15, train_loss: 1.0540, test_loss: 1.2226, test_f1: 0.4693
 epoch: 16, train_loss: 1.0336, test_loss: 1.2095, test_f1: 0.4596
 epoch: 17, train_loss: 1.0134, test_loss: 1.2222, test_f1: 0.4573
 epoch: 18, train_loss: 1.0086, test_loss: 1.2176, test_f1: 0.4364
 epoch: 19, train_loss: 1.0041, test_loss: 1.2148, test_f1: 0.4232
 epoch: 20, train_loss: 0.9841, test_loss: 1.2374, test_f1: 0.4304
 epoch: 21, train_loss: 0.9949, test_loss: 1.2246, test_f1: 0.4407
 epoch: 22, train_loss: 0.9993, test_loss: 1.2106, test_f1: 0.4380
 epoch: 23, train_loss: 0.9792, test_loss: 1.2119, test_f1: 0.4597
 epoch: 24, train_loss: 0.9806, test_loss: 1.2104, test_f1: 0.4848
 epoch: 25, train_loss: 0.9770, test_loss: 1.1893, test_f1: 0.4794
 epoch: 26, train_loss: 0.9695, test_loss: 1.2053, test_f1: 0.4564
 epoch: 27, train_loss: 0.9569, test_loss: 1.2018, test_f1: 0.4638
 epoch: 28, train_loss: 0.9633, test_loss: 1.2192, test_f1: 0.4160
 epoch: 29, train_loss: 0.9515, test_loss: 1.1999, test_f1: 0.4514
 epoch: 30, train_loss: 0.9684, test_loss: 1.1924, test_f1: 0.4714
 epoch: 31, train_loss: 0.9565, test_loss: 1.2022, test_f1: 0.4574
 epoch: 32, train_loss: 0.9641, test_loss: 1.2075, test_f1: 0.4375
 epoch: 33, train_loss: 0.9436, test_loss: 1.1797, test_f1: 0.4702
 epoch: 34, train_loss: 0.9415, test_loss: 1.1737, test_f1: 0.4648
 epoch: 35, train_loss: 0.9346, test_loss: 1.1823, test_f1: 0.4964
 epoch: 36, train_loss: 0.9503, test_loss: 1.1487, test_f1: 0.5056
 epoch: 37, train_loss: 0.9290, test_loss: 1.1670, test_f1: 0.4965
 epoch: 38, train_loss: 0.9165, test_loss: 1.1533, test_f1: 0.4960
 epoch: 39, train_loss: 0.9165, test_loss: 1.1561, test_f1: 0.4813
 epoch: 40, train_loss: 0.9120, test_loss: 1.1472, test_f1: 0.5069
 epoch: 41, train_loss: 0.9133, test_loss: 1.1558, test_f1: 0.4962
 epoch: 42, train_loss: 0.8938, test_loss: 1.1686, test_f1: 0.4671
 epoch: 43, train_loss: 0.8926, test_loss: 1.1529, test_f1: 0.5082
 epoch: 44, train_loss: 0.9059, test_loss: 1.1588, test_f1: 0.4857
 epoch: 45, train_loss: 0.9046, test_loss: 1.1520, test_f1: 0.5118
 epoch: 46, train_loss: 0.8953, test_loss: 1.1412, test_f1: 0.5097
 epoch: 47, train_loss: 0.9008, test_loss: 1.1701, test_f1: 0.4872
 epoch: 48, train_loss: 0.8978, test_loss: 1.1805, test_f1: 0.4841
 epoch: 49, train_loss: 0.8873, test_loss: 1.1436, test_f1: 0.5018
 epoch: 50, train_loss: 0.8760, test_loss: 1.1625, test_f1: 0.4849
 epoch: 51, train_loss: 0.8740, test_loss: 1.1484, test_f1: 0.4817
 epoch: 52, train_loss: 0.8894, test_loss: 1.1519, test_f1: 0.4992
 epoch: 53, train_loss: 0.8893, test_loss: 1.1479, test_f1: 0.5005
 epoch: 54, train_loss: 0.8826, test_loss: 1.1619, test_f1: 0.4890
 epoch: 55, train_loss: 0.8631, test_loss: 1.1589, test_f1: 0.4928
 epoch: 56, train_loss: 0.8662, test_loss: 1.1508, test_f1: 0.5040
 epoch: 57, train_loss: 0.8590, test_loss: 1.1562, test_f1: 0.4837
 epoch: 58, train_loss: 0.8581, test_loss: 1.1365, test_f1: 0.5018
 epoch: 59, train_loss: 0.8747, test_loss: 1.1380, test_f1: 0.4912
 epoch: 60, train_loss: 0.8572, test_loss: 1.1589, test_f1: 0.4719
 epoch: 61, train_loss: 0.8570, test_loss: 1.1549, test_f1: 0.4900
 epoch: 62, train_loss: 0.8559, test_loss: 1.1548, test_f1: 0.4773
 epoch: 63, train_loss: 0.8484, test_loss: 1.1603, test_f1: 0.4745
 epoch: 64, train_loss: 0.8485, test_loss: 1.1710, test_f1: 0.4925
 epoch: 65, train_loss: 0.8501, test_loss: 1.1723, test_f1: 0.4972
 epoch: 66, train_loss: 0.8400, test_loss: 1.1666, test_f1: 0.4910
 epoch: 67, train_loss: 0.8512, test_loss: 1.1635, test_f1: 0.5001
 epoch: 68, train_loss: 0.8436, test_loss: 1.1606, test_f1: 0.4932
 epoch: 69, train_loss: 0.8448, test_loss: 1.1721, test_f1: 0.4889
 epoch: 70, train_loss: 0.8401, test_loss: 1.1743, test_f1: 0.5007
 epoch: 71, train_loss: 0.8454, test_loss: 1.1808, test_f1: 0.4738
 epoch: 72, train_loss: 0.8666, test_loss: 1.1640, test_f1: 0.4923
 epoch: 73, train_loss: 0.8445, test_loss: 1.1864, test_f1: 0.4713
 epoch: 74, train_loss: 0.8154, test_loss: 1.1745, test_f1: 0.4738
 epoch: 75, train_loss: 0.8262, test_loss: 1.1700, test_f1: 0.4839
 epoch: 76, train_loss: 0.8345, test_loss: 1.1890, test_f1: 0.4433
 epoch: 77, train_loss: 0.8198, test_loss: 1.1799, test_f1: 0.4767
 epoch: 78, train_loss: 0.8195, test_loss: 1.1819, test_f1: 0.4817
 epoch: 79, train_loss: 0.8331, test_loss: 1.1880, test_f1: 0.4636
 epoch: 80, train_loss: 0.8257, test_loss: 1.1964, test_f1: 0.4719
 epoch: 81, train_loss: 0.8197, test_loss: 1.1571, test_f1: 0.4911
 epoch: 82, train_loss: 0.8248, test_loss: 1.2006, test_f1: 0.4950
 epoch: 83, train_loss: 0.8238, test_loss: 1.2043, test_f1: 0.4727
 epoch: 84, train_loss: 0.8139, test_loss: 1.1829, test_f1: 0.5029
 epoch: 85, train_loss: 0.8161, test_loss: 1.1947, test_f1: 0.4903
 epoch: 86, train_loss: 0.8134, test_loss: 1.2267, test_f1: 0.4688
 epoch: 87, train_loss: 0.8253, test_loss: 1.2065, test_f1: 0.4852
 epoch: 88, train_loss: 0.8155, test_loss: 1.2298, test_f1: 0.4983
 epoch: 89, train_loss: 0.8225, test_loss: 1.2099, test_f1: 0.4980
 epoch: 90, train_loss: 0.8232, test_loss: 1.2025, test_f1: 0.4897
 epoch: 91, train_loss: 0.8231, test_loss: 1.1783, test_f1: 0.5080
 epoch: 92, train_loss: 0.8163, test_loss: 1.1662, test_f1: 0.4922
 epoch: 93, train_loss: 0.8051, test_loss: 1.1846, test_f1: 0.4768
 epoch: 94, train_loss: 0.8004, test_loss: 1.2377, test_f1: 0.4630
 epoch: 95, train_loss: 0.8133, test_loss: 1.2347, test_f1: 0.4659
 epoch: 96, train_loss: 0.8075, test_loss: 1.2092, test_f1: 0.4840
 epoch: 97, train_loss: 0.8201, test_loss: 1.2008, test_f1: 0.4819
 epoch: 98, train_loss: 0.8028, test_loss: 1.2036, test_f1: 0.4950
 epoch: 99, train_loss: 0.7981, test_loss: 1.2116, test_f1: 0.4743
##################ITERATION #9 ****************************************
 epoch: 0, train_loss: 1.4639, test_loss: 1.3455, test_f1: 0.2281
 epoch: 1, train_loss: 1.2817, test_loss: 1.3157, test_f1: 0.2281
 epoch: 2, train_loss: 1.2680, test_loss: 1.3723, test_f1: 0.2432
 epoch: 3, train_loss: 1.2226, test_loss: 1.3346, test_f1: 0.2514
 epoch: 4, train_loss: 1.2295, test_loss: 1.3025, test_f1: 0.2569
 epoch: 5, train_loss: 1.2183, test_loss: 1.2667, test_f1: 0.3165
 epoch: 6, train_loss: 1.2027, test_loss: 1.2664, test_f1: 0.3392
 epoch: 7, train_loss: 1.1858, test_loss: 1.2593, test_f1: 0.3104
 epoch: 8, train_loss: 1.1743, test_loss: 1.2521, test_f1: 0.3038
 epoch: 9, train_loss: 1.1621, test_loss: 1.2584, test_f1: 0.3249
 epoch: 10, train_loss: 1.1607, test_loss: 1.2672, test_f1: 0.3789
 epoch: 11, train_loss: 1.1559, test_loss: 1.2326, test_f1: 0.3785
 epoch: 12, train_loss: 1.1584, test_loss: 1.2125, test_f1: 0.3846
 epoch: 13, train_loss: 1.1533, test_loss: 1.2139, test_f1: 0.4066
 epoch: 14, train_loss: 1.1317, test_loss: 1.2133, test_f1: 0.3917
 epoch: 15, train_loss: 1.1326, test_loss: 1.2044, test_f1: 0.3874
 epoch: 16, train_loss: 1.1045, test_loss: 1.1952, test_f1: 0.3916
 epoch: 17, train_loss: 1.1017, test_loss: 1.2042, test_f1: 0.4322
 epoch: 18, train_loss: 1.1164, test_loss: 1.2026, test_f1: 0.4424
 epoch: 19, train_loss: 1.1047, test_loss: 1.2232, test_f1: 0.4639
 epoch: 20, train_loss: 1.0905, test_loss: 1.2307, test_f1: 0.4462
 epoch: 21, train_loss: 1.0860, test_loss: 1.3141, test_f1: 0.4480
 epoch: 22, train_loss: 1.0810, test_loss: 1.2164, test_f1: 0.4481
 epoch: 23, train_loss: 1.0561, test_loss: 1.2170, test_f1: 0.4102
 epoch: 24, train_loss: 1.0665, test_loss: 1.2259, test_f1: 0.4270
 epoch: 25, train_loss: 1.0509, test_loss: 1.2258, test_f1: 0.4151
 epoch: 26, train_loss: 1.0696, test_loss: 1.2020, test_f1: 0.4418
 epoch: 27, train_loss: 1.0383, test_loss: 1.1846, test_f1: 0.4484
 epoch: 28, train_loss: 1.0501, test_loss: 1.2094, test_f1: 0.4548
 epoch: 29, train_loss: 1.0391, test_loss: 1.2111, test_f1: 0.4304
 epoch: 30, train_loss: 1.0287, test_loss: 1.1883, test_f1: 0.4443
 epoch: 31, train_loss: 1.0201, test_loss: 1.1539, test_f1: 0.4816
 epoch: 32, train_loss: 1.0322, test_loss: 1.2156, test_f1: 0.4778
 epoch: 33, train_loss: 0.9922, test_loss: 1.2193, test_f1: 0.4556
 epoch: 34, train_loss: 1.0096, test_loss: 1.1970, test_f1: 0.4620
 epoch: 35, train_loss: 1.0073, test_loss: 1.1765, test_f1: 0.4733
 epoch: 36, train_loss: 1.0163, test_loss: 1.1884, test_f1: 0.4842
 epoch: 37, train_loss: 1.0087, test_loss: 1.1608, test_f1: 0.4942
 epoch: 38, train_loss: 0.9797, test_loss: 1.2028, test_f1: 0.4541
 epoch: 39, train_loss: 0.9599, test_loss: 1.1877, test_f1: 0.4898
 epoch: 40, train_loss: 0.9773, test_loss: 1.2135, test_f1: 0.4861
 epoch: 41, train_loss: 0.9794, test_loss: 1.2108, test_f1: 0.4663
 epoch: 42, train_loss: 0.9695, test_loss: 1.1846, test_f1: 0.4866
 epoch: 43, train_loss: 0.9518, test_loss: 1.2161, test_f1: 0.4625
 epoch: 44, train_loss: 0.9460, test_loss: 1.1671, test_f1: 0.4669
 epoch: 45, train_loss: 0.9467, test_loss: 1.1664, test_f1: 0.4802
 epoch: 46, train_loss: 0.9448, test_loss: 1.2098, test_f1: 0.4657
 epoch: 47, train_loss: 0.9442, test_loss: 1.1994, test_f1: 0.4560
 epoch: 48, train_loss: 0.9334, test_loss: 1.2472, test_f1: 0.4299
 epoch: 49, train_loss: 0.9423, test_loss: 1.2129, test_f1: 0.4529
 epoch: 50, train_loss: 0.9057, test_loss: 1.2077, test_f1: 0.4619
 epoch: 51, train_loss: 0.9235, test_loss: 1.2035, test_f1: 0.4594
 epoch: 52, train_loss: 0.9173, test_loss: 1.2247, test_f1: 0.4777
 epoch: 53, train_loss: 0.9313, test_loss: 1.2265, test_f1: 0.4622
 epoch: 54, train_loss: 0.9120, test_loss: 1.2686, test_f1: 0.4666
 epoch: 55, train_loss: 0.9091, test_loss: 1.2361, test_f1: 0.4701
 epoch: 56, train_loss: 0.9103, test_loss: 1.2142, test_f1: 0.4826
 epoch: 57, train_loss: 0.8902, test_loss: 1.2190, test_f1: 0.5046
 epoch: 58, train_loss: 0.8915, test_loss: 1.2517, test_f1: 0.4963
 epoch: 59, train_loss: 0.8836, test_loss: 1.2461, test_f1: 0.4901
 epoch: 60, train_loss: 0.8805, test_loss: 1.2318, test_f1: 0.4921
 epoch: 61, train_loss: 0.8911, test_loss: 1.2378, test_f1: 0.4996
 epoch: 62, train_loss: 0.8878, test_loss: 1.2665, test_f1: 0.4912
 epoch: 63, train_loss: 0.8938, test_loss: 1.3191, test_f1: 0.4932
 epoch: 64, train_loss: 0.8841, test_loss: 1.3461, test_f1: 0.4296
 epoch: 65, train_loss: 0.8900, test_loss: 1.2990, test_f1: 0.4799
 epoch: 66, train_loss: 0.9028, test_loss: 1.2841, test_f1: 0.5094
 epoch: 67, train_loss: 0.8768, test_loss: 1.2355, test_f1: 0.4987
 epoch: 68, train_loss: 0.8718, test_loss: 1.2404, test_f1: 0.5192
 epoch: 69, train_loss: 0.8736, test_loss: 1.2600, test_f1: 0.5082
 epoch: 70, train_loss: 0.8656, test_loss: 1.2866, test_f1: 0.4993
 epoch: 71, train_loss: 0.8591, test_loss: 1.3377, test_f1: 0.4537
 epoch: 72, train_loss: 0.8927, test_loss: 1.2829, test_f1: 0.4806
 epoch: 73, train_loss: 0.8703, test_loss: 1.2815, test_f1: 0.4918
 epoch: 74, train_loss: 0.8638, test_loss: 1.3013, test_f1: 0.4819
 epoch: 75, train_loss: 0.8593, test_loss: 1.2690, test_f1: 0.4784
 epoch: 76, train_loss: 0.8807, test_loss: 1.2629, test_f1: 0.4880
 epoch: 77, train_loss: 0.8700, test_loss: 1.2702, test_f1: 0.5007
 epoch: 78, train_loss: 0.8653, test_loss: 1.2733, test_f1: 0.5192
 epoch: 79, train_loss: 0.8642, test_loss: 1.2762, test_f1: 0.4967
 epoch: 80, train_loss: 0.8490, test_loss: 1.3152, test_f1: 0.4897
 epoch: 81, train_loss: 0.8744, test_loss: 1.3098, test_f1: 0.5006
 epoch: 82, train_loss: 0.8534, test_loss: 1.2961, test_f1: 0.4961
 epoch: 83, train_loss: 0.8599, test_loss: 1.2685, test_f1: 0.5131
 epoch: 84, train_loss: 0.8428, test_loss: 1.2727, test_f1: 0.4893
 epoch: 85, train_loss: 0.8417, test_loss: 1.2851, test_f1: 0.4970
 epoch: 86, train_loss: 0.8661, test_loss: 1.2698, test_f1: 0.5295
 epoch: 87, train_loss: 0.8663, test_loss: 1.3059, test_f1: 0.5064
 epoch: 88, train_loss: 0.8318, test_loss: 1.3248, test_f1: 0.4899
 epoch: 89, train_loss: 0.8298, test_loss: 1.2436, test_f1: 0.5088
 epoch: 90, train_loss: 0.8492, test_loss: 1.2338, test_f1: 0.5249
 epoch: 91, train_loss: 0.8322, test_loss: 1.2341, test_f1: 0.5111
 epoch: 92, train_loss: 0.8506, test_loss: 1.2373, test_f1: 0.5038
 epoch: 93, train_loss: 0.8370, test_loss: 1.2877, test_f1: 0.5268
 epoch: 94, train_loss: 0.8238, test_loss: 1.2347, test_f1: 0.5379
 epoch: 95, train_loss: 0.8411, test_loss: 1.2585, test_f1: 0.5311
 epoch: 96, train_loss: 0.8364, test_loss: 1.2832, test_f1: 0.4959
 epoch: 97, train_loss: 0.8231, test_loss: 1.2968, test_f1: 0.4834
 epoch: 98, train_loss: 0.8350, test_loss: 1.3340, test_f1: 0.4754
 epoch: 99, train_loss: 0.8214, test_loss: 1.2327, test_f1: 0.4908

Training completed in 372.28 seconds
Best F1: 0.5777 at epoch 86
Mean F1 across iterations: 0.5405  0.0231
========================FINAL RESULTS================================
FEGIN weighted F1: 0.5777  0.0231
python main.py --data ltspice_demos --representation component_component --model FEGIN --layers 5 --hiddens 16 --batch_size 128 --lr 0.001 --emb_size 128 --epochs 100 --save_appendix component_component_L5_H16_BS128_LR0.001_E128 --no_val
-----



STDERR:
Processing...
Done!
  File "main.py", line 370, in <module>
    main()
  File "main.py", line 254, in main
    dataset = dataset_class(
  File "/home/philip/projects/ltspice_examples_code_repo/Circuit-Completion-Using-GNNs/component_classification_with_link_prediction_head/evaluation/FEGIN/kernel/circuit_datasets.py", line 15, in __init__
    self.data, self.slices = torch.load(self.processed_paths[0])
  File "/home/philip/.local/lib/python3.8/site-packages/torch/serialization.py", line 1040, in load
    warnings.warn(
  File "/usr/lib/python3.8/warnings.py", line 109, in _showwarnmsg
    sw(msg.message, msg.category, msg.filename, msg.lineno,
  File "main.py", line 47, in warn_with_traceback
    traceback.print_stack(file=log)
/home/philip/projects/ltspice_examples_code_repo/Circuit-Completion-Using-GNNs/component_classification_with_link_prediction_head/evaluation/FEGIN/kernel/circuit_datasets.py:15: FutureWarning: You are using `torch.load` with `weights_only=False` (the current default value), which uses the default pickle module implicitly. It is possible to construct malicious pickle data which will execute arbitrary code during unpickling (See https://github.com/pytorch/pytorch/blob/main/SECURITY.md#untrusted-models for more details). In a future release, the default value for `weights_only` will be flipped to `True`. This limits the functions that could be executed during unpickling. Arbitrary objects will no longer be allowed to be loaded via this mode unless they are explicitly allowlisted by the user via `torch.serialization.add_safe_globals`. We recommend you start setting `weights_only=True` for any use case where you don't have full control of the loaded file. Please open an issue on GitHub for any issues related to this experimental feature.
  self.data, self.slices = torch.load(self.processed_paths[0])
