STDOUT:
Results will be saved in /home/philip/projects/llm_inference_code_repo/Circuit-Completion-Using-GNNs/component_classification_with_link_prediction_head/evaluation/FEGIN/results/model_FEGIN_dataset_ltspice_examples
Command line input: python main.py --data ltspice_examples --representation component_pin_net --model FEGIN --layers 6 --hiddens 64 --batch_size 64 --lr 0.001 --emb_size 512 --epochs 100 --save_appendix component_pin_net_L6_H64_BS64_LR0.001_E512 --no_val
 is saved.
-----
ltspice_examples - FEGIN
Using 6 layers, 64 hidden units, h = 2
Loading component_pin_net representation dataset
ENTERED
Training FEGIN on component_pin_net representation
Train: 3558, Test: 846
##################ITERATION #0 ****************************************
 epoch: 0, train_loss: 1.2223, test_loss: 1.1041, test_f1: 0.4449
 epoch: 1, train_loss: 1.0163, test_loss: 1.0270, test_f1: 0.4649
 epoch: 2, train_loss: 0.9696, test_loss: 0.9980, test_f1: 0.5365
 epoch: 3, train_loss: 0.9472, test_loss: 0.9720, test_f1: 0.5031
 epoch: 4, train_loss: 0.9281, test_loss: 0.9295, test_f1: 0.5343
 epoch: 5, train_loss: 0.9007, test_loss: 0.8778, test_f1: 0.5630
 epoch: 6, train_loss: 0.8908, test_loss: 0.9881, test_f1: 0.4959
 epoch: 7, train_loss: 0.8611, test_loss: 0.9008, test_f1: 0.5508
 epoch: 8, train_loss: 0.8443, test_loss: 0.8143, test_f1: 0.5514
 epoch: 9, train_loss: 0.8229, test_loss: 0.8303, test_f1: 0.5596
 epoch: 10, train_loss: 0.8116, test_loss: 0.8782, test_f1: 0.5378
 epoch: 11, train_loss: 0.8119, test_loss: 0.8030, test_f1: 0.5724
 epoch: 12, train_loss: 0.7928, test_loss: 0.8191, test_f1: 0.5979
 epoch: 13, train_loss: 0.7701, test_loss: 0.7838, test_f1: 0.6374
 epoch: 14, train_loss: 0.7536, test_loss: 0.9377, test_f1: 0.5868
 epoch: 15, train_loss: 0.7448, test_loss: 0.7631, test_f1: 0.5964
 epoch: 16, train_loss: 0.7150, test_loss: 0.8931, test_f1: 0.5730
 epoch: 17, train_loss: 0.7361, test_loss: 0.9249, test_f1: 0.5513
 epoch: 18, train_loss: 0.7290, test_loss: 0.8883, test_f1: 0.6039
 epoch: 19, train_loss: 0.6987, test_loss: 0.8593, test_f1: 0.6159
 epoch: 20, train_loss: 0.6876, test_loss: 0.7562, test_f1: 0.6134
 epoch: 21, train_loss: 0.6919, test_loss: 0.7733, test_f1: 0.6094
 epoch: 22, train_loss: 0.6606, test_loss: 0.6993, test_f1: 0.6559
 epoch: 23, train_loss: 0.6564, test_loss: 0.9071, test_f1: 0.6255
 epoch: 24, train_loss: 0.6467, test_loss: 0.9104, test_f1: 0.6061
 epoch: 25, train_loss: 0.6358, test_loss: 0.8040, test_f1: 0.6099
 epoch: 26, train_loss: 0.6214, test_loss: 0.8421, test_f1: 0.6282
 epoch: 27, train_loss: 0.6015, test_loss: 0.8509, test_f1: 0.6244
 epoch: 28, train_loss: 0.6086, test_loss: 0.7175, test_f1: 0.6308
 epoch: 29, train_loss: 0.6012, test_loss: 0.8014, test_f1: 0.6445
 epoch: 30, train_loss: 0.5903, test_loss: 0.7922, test_f1: 0.6320
 epoch: 31, train_loss: 0.5755, test_loss: 0.6978, test_f1: 0.6646
 epoch: 32, train_loss: 0.5820, test_loss: 0.8106, test_f1: 0.6262
 epoch: 33, train_loss: 0.5775, test_loss: 0.7648, test_f1: 0.6240
 epoch: 34, train_loss: 0.5510, test_loss: 0.9752, test_f1: 0.6196
 epoch: 35, train_loss: 0.5663, test_loss: 0.8952, test_f1: 0.6029
 epoch: 36, train_loss: 0.5563, test_loss: 0.8839, test_f1: 0.6639
 epoch: 37, train_loss: 0.5337, test_loss: 0.7805, test_f1: 0.6640
 epoch: 38, train_loss: 0.5393, test_loss: 0.9281, test_f1: 0.6175
 epoch: 39, train_loss: 0.5362, test_loss: 0.8943, test_f1: 0.6417
 epoch: 40, train_loss: 0.5287, test_loss: 0.9029, test_f1: 0.6586
 epoch: 41, train_loss: 0.5133, test_loss: 0.8413, test_f1: 0.6525
 epoch: 42, train_loss: 0.4932, test_loss: 0.7841, test_f1: 0.6656
 epoch: 43, train_loss: 0.4978, test_loss: 0.9422, test_f1: 0.6338
 epoch: 44, train_loss: 0.5169, test_loss: 0.8939, test_f1: 0.6449
 epoch: 45, train_loss: 0.4967, test_loss: 0.9947, test_f1: 0.6342
 epoch: 46, train_loss: 0.5004, test_loss: 0.7514, test_f1: 0.6625
 epoch: 47, train_loss: 0.5022, test_loss: 0.9195, test_f1: 0.6442
 epoch: 48, train_loss: 0.4828, test_loss: 1.0240, test_f1: 0.6429
 epoch: 49, train_loss: 0.4705, test_loss: 0.8427, test_f1: 0.6715
 epoch: 50, train_loss: 0.4877, test_loss: 0.8323, test_f1: 0.6465
 epoch: 51, train_loss: 0.4275, test_loss: 1.0304, test_f1: 0.6391
 epoch: 52, train_loss: 0.4177, test_loss: 0.9981, test_f1: 0.6490
 epoch: 53, train_loss: 0.3968, test_loss: 0.9764, test_f1: 0.6372
 epoch: 54, train_loss: 0.3911, test_loss: 1.0452, test_f1: 0.6448
 epoch: 55, train_loss: 0.3899, test_loss: 1.0779, test_f1: 0.6477
 epoch: 56, train_loss: 0.3780, test_loss: 1.1664, test_f1: 0.6504
 epoch: 57, train_loss: 0.3753, test_loss: 1.1410, test_f1: 0.6415
 epoch: 58, train_loss: 0.3725, test_loss: 0.8949, test_f1: 0.6674
 epoch: 59, train_loss: 0.3752, test_loss: 1.2321, test_f1: 0.6291
 epoch: 60, train_loss: 0.3789, test_loss: 1.2410, test_f1: 0.6424
 epoch: 61, train_loss: 0.3499, test_loss: 1.2924, test_f1: 0.6387
 epoch: 62, train_loss: 0.3521, test_loss: 1.3009, test_f1: 0.6396
 epoch: 63, train_loss: 0.3413, test_loss: 1.3052, test_f1: 0.6366
 epoch: 64, train_loss: 0.3503, test_loss: 1.3377, test_f1: 0.6183
 epoch: 65, train_loss: 0.3627, test_loss: 1.3383, test_f1: 0.6315
 epoch: 66, train_loss: 0.3437, test_loss: 1.3906, test_f1: 0.6433
 epoch: 67, train_loss: 0.3391, test_loss: 1.3330, test_f1: 0.6473
 epoch: 68, train_loss: 0.3537, test_loss: 1.3514, test_f1: 0.6335
 epoch: 69, train_loss: 0.3407, test_loss: 1.3951, test_f1: 0.6468
 epoch: 70, train_loss: 0.3393, test_loss: 1.4498, test_f1: 0.6249
 epoch: 71, train_loss: 0.3228, test_loss: 1.2931, test_f1: 0.6700
 epoch: 72, train_loss: 0.3477, test_loss: 1.3606, test_f1: 0.6632
 epoch: 73, train_loss: 0.3479, test_loss: 1.3674, test_f1: 0.6310
 epoch: 74, train_loss: 0.3180, test_loss: 1.3904, test_f1: 0.6630
 epoch: 75, train_loss: 0.3037, test_loss: 1.3911, test_f1: 0.6567
 epoch: 76, train_loss: 0.3112, test_loss: 1.4565, test_f1: 0.6298
 epoch: 77, train_loss: 0.2921, test_loss: 1.3606, test_f1: 0.6557
 epoch: 78, train_loss: 0.3268, test_loss: 1.4104, test_f1: 0.6442
 epoch: 79, train_loss: 0.3282, test_loss: 1.5043, test_f1: 0.6502
 epoch: 80, train_loss: 0.3099, test_loss: 1.3544, test_f1: 0.6560
 epoch: 81, train_loss: 0.2887, test_loss: 1.3924, test_f1: 0.6690
 epoch: 82, train_loss: 0.2776, test_loss: 1.5131, test_f1: 0.6387
 epoch: 83, train_loss: 0.3066, test_loss: 1.4551, test_f1: 0.6387
 epoch: 84, train_loss: 0.3026, test_loss: 1.6018, test_f1: 0.6228
 epoch: 85, train_loss: 0.2858, test_loss: 1.5550, test_f1: 0.6303
 epoch: 86, train_loss: 0.2895, test_loss: 1.5477, test_f1: 0.6614
 epoch: 87, train_loss: 0.2831, test_loss: 1.5642, test_f1: 0.6539
 epoch: 88, train_loss: 0.2762, test_loss: 1.5760, test_f1: 0.6648
 epoch: 89, train_loss: 0.2679, test_loss: 1.5720, test_f1: 0.6682
 epoch: 90, train_loss: 0.2714, test_loss: 1.6604, test_f1: 0.6639
 epoch: 91, train_loss: 0.2590, test_loss: 1.6777, test_f1: 0.6425
 epoch: 92, train_loss: 0.2627, test_loss: 1.6808, test_f1: 0.6509
 epoch: 93, train_loss: 0.2491, test_loss: 1.5935, test_f1: 0.6620
 epoch: 94, train_loss: 0.2585, test_loss: 1.8120, test_f1: 0.6392
 epoch: 95, train_loss: 0.2493, test_loss: 1.7153, test_f1: 0.6493
 epoch: 96, train_loss: 0.2570, test_loss: 1.7181, test_f1: 0.6605
 epoch: 97, train_loss: 0.2511, test_loss: 1.5703, test_f1: 0.6619
 epoch: 98, train_loss: 0.2826, test_loss: 1.7669, test_f1: 0.6639
 epoch: 99, train_loss: 0.2850, test_loss: 1.7426, test_f1: 0.6410
##################ITERATION #1 ****************************************
 epoch: 0, train_loss: 1.1020, test_loss: 1.0565, test_f1: 0.4391
 epoch: 1, train_loss: 0.9726, test_loss: 0.9186, test_f1: 0.4996
 epoch: 2, train_loss: 0.9447, test_loss: 0.8997, test_f1: 0.4896
 epoch: 3, train_loss: 0.9294, test_loss: 0.8834, test_f1: 0.5612
 epoch: 4, train_loss: 0.9008, test_loss: 0.8952, test_f1: 0.5511
 epoch: 5, train_loss: 0.8909, test_loss: 0.8560, test_f1: 0.5532
 epoch: 6, train_loss: 0.8601, test_loss: 0.9471, test_f1: 0.5421
 epoch: 7, train_loss: 0.8424, test_loss: 0.8612, test_f1: 0.5488
 epoch: 8, train_loss: 0.8455, test_loss: 0.8469, test_f1: 0.6282
 epoch: 9, train_loss: 0.8247, test_loss: 0.8166, test_f1: 0.5774
 epoch: 10, train_loss: 0.8003, test_loss: 0.8276, test_f1: 0.5705
 epoch: 11, train_loss: 0.8032, test_loss: 0.8497, test_f1: 0.5601
 epoch: 12, train_loss: 0.7824, test_loss: 0.9332, test_f1: 0.5636
 epoch: 13, train_loss: 0.7686, test_loss: 0.8300, test_f1: 0.5810
 epoch: 14, train_loss: 0.7481, test_loss: 0.8055, test_f1: 0.6042
 epoch: 15, train_loss: 0.7353, test_loss: 0.9577, test_f1: 0.5527
 epoch: 16, train_loss: 0.7272, test_loss: 0.9321, test_f1: 0.5903
 epoch: 17, train_loss: 0.7053, test_loss: 0.7452, test_f1: 0.6453
 epoch: 18, train_loss: 0.7093, test_loss: 0.7075, test_f1: 0.6613
 epoch: 19, train_loss: 0.6922, test_loss: 0.7404, test_f1: 0.6545
 epoch: 20, train_loss: 0.6889, test_loss: 0.9058, test_f1: 0.6111
 epoch: 21, train_loss: 0.6681, test_loss: 0.7771, test_f1: 0.6214
 epoch: 22, train_loss: 0.6547, test_loss: 0.7619, test_f1: 0.6505
 epoch: 23, train_loss: 0.6499, test_loss: 0.7911, test_f1: 0.6465
 epoch: 24, train_loss: 0.6301, test_loss: 0.7564, test_f1: 0.6597
 epoch: 25, train_loss: 0.6305, test_loss: 0.8133, test_f1: 0.6371
 epoch: 26, train_loss: 0.6557, test_loss: 0.7647, test_f1: 0.6266
 epoch: 27, train_loss: 0.6017, test_loss: 0.7182, test_f1: 0.6560
 epoch: 28, train_loss: 0.5917, test_loss: 0.7503, test_f1: 0.6553
 epoch: 29, train_loss: 0.6078, test_loss: 0.7563, test_f1: 0.6627
 epoch: 30, train_loss: 0.5823, test_loss: 0.7596, test_f1: 0.6615
 epoch: 31, train_loss: 0.5694, test_loss: 0.8068, test_f1: 0.6303
 epoch: 32, train_loss: 0.5605, test_loss: 0.7926, test_f1: 0.6565
 epoch: 33, train_loss: 0.5677, test_loss: 0.7852, test_f1: 0.6487
 epoch: 34, train_loss: 0.5493, test_loss: 0.7685, test_f1: 0.6625
 epoch: 35, train_loss: 0.5436, test_loss: 0.7455, test_f1: 0.6606
 epoch: 36, train_loss: 0.5307, test_loss: 0.8024, test_f1: 0.6386
 epoch: 37, train_loss: 0.5125, test_loss: 0.8043, test_f1: 0.6550
 epoch: 38, train_loss: 0.5492, test_loss: 0.7564, test_f1: 0.6624
 epoch: 39, train_loss: 0.5130, test_loss: 0.8630, test_f1: 0.6402
 epoch: 40, train_loss: 0.5160, test_loss: 0.8203, test_f1: 0.6452
 epoch: 41, train_loss: 0.5028, test_loss: 0.8372, test_f1: 0.6512
 epoch: 42, train_loss: 0.4898, test_loss: 0.7971, test_f1: 0.6435
 epoch: 43, train_loss: 0.4733, test_loss: 0.8662, test_f1: 0.6556
 epoch: 44, train_loss: 0.4695, test_loss: 0.8524, test_f1: 0.6652
 epoch: 45, train_loss: 0.4654, test_loss: 0.9446, test_f1: 0.6473
 epoch: 46, train_loss: 0.4534, test_loss: 0.9154, test_f1: 0.6636
 epoch: 47, train_loss: 0.4486, test_loss: 0.9782, test_f1: 0.6666
 epoch: 48, train_loss: 0.4386, test_loss: 0.8945, test_f1: 0.6532
 epoch: 49, train_loss: 0.4370, test_loss: 0.9554, test_f1: 0.6418
 epoch: 50, train_loss: 0.4221, test_loss: 1.1438, test_f1: 0.6467
 epoch: 51, train_loss: 0.3995, test_loss: 0.9760, test_f1: 0.6629
 epoch: 52, train_loss: 0.3742, test_loss: 0.9797, test_f1: 0.6494
 epoch: 53, train_loss: 0.3621, test_loss: 0.9639, test_f1: 0.6703
 epoch: 54, train_loss: 0.3620, test_loss: 1.0774, test_f1: 0.6698
 epoch: 55, train_loss: 0.3534, test_loss: 1.0632, test_f1: 0.6610
 epoch: 56, train_loss: 0.3642, test_loss: 1.0964, test_f1: 0.6721
 epoch: 57, train_loss: 0.3501, test_loss: 1.0247, test_f1: 0.6540
 epoch: 58, train_loss: 0.3315, test_loss: 0.9912, test_f1: 0.6423
 epoch: 59, train_loss: 0.3464, test_loss: 1.1958, test_f1: 0.6725
 epoch: 60, train_loss: 0.3277, test_loss: 1.1710, test_f1: 0.6652
 epoch: 61, train_loss: 0.3331, test_loss: 1.1369, test_f1: 0.6596
 epoch: 62, train_loss: 0.3192, test_loss: 1.0759, test_f1: 0.6604
 epoch: 63, train_loss: 0.3247, test_loss: 1.2068, test_f1: 0.6645
 epoch: 64, train_loss: 0.3078, test_loss: 1.2479, test_f1: 0.6736
 epoch: 65, train_loss: 0.3194, test_loss: 1.2053, test_f1: 0.6503
 epoch: 66, train_loss: 0.3073, test_loss: 1.1098, test_f1: 0.6571
 epoch: 67, train_loss: 0.2983, test_loss: 1.2953, test_f1: 0.6298
 epoch: 68, train_loss: 0.3141, test_loss: 1.1389, test_f1: 0.6710
 epoch: 69, train_loss: 0.3073, test_loss: 1.1495, test_f1: 0.6531
 epoch: 70, train_loss: 0.3083, test_loss: 1.1761, test_f1: 0.6556
 epoch: 71, train_loss: 0.2891, test_loss: 1.2180, test_f1: 0.6474
 epoch: 72, train_loss: 0.2936, test_loss: 1.1947, test_f1: 0.6768
 epoch: 73, train_loss: 0.2798, test_loss: 1.3165, test_f1: 0.6633
 epoch: 74, train_loss: 0.2825, test_loss: 1.3612, test_f1: 0.6586
 epoch: 75, train_loss: 0.2768, test_loss: 1.3172, test_f1: 0.6861
 epoch: 76, train_loss: 0.2734, test_loss: 1.2719, test_f1: 0.6571
 epoch: 77, train_loss: 0.2689, test_loss: 1.3216, test_f1: 0.6642
 epoch: 78, train_loss: 0.2751, test_loss: 1.4662, test_f1: 0.6538
 epoch: 79, train_loss: 0.2565, test_loss: 1.2966, test_f1: 0.6617
 epoch: 80, train_loss: 0.2595, test_loss: 1.3824, test_f1: 0.6479
 epoch: 81, train_loss: 0.2698, test_loss: 1.3754, test_f1: 0.6554
 epoch: 82, train_loss: 0.2683, test_loss: 1.4368, test_f1: 0.6618
 epoch: 83, train_loss: 0.2660, test_loss: 1.4226, test_f1: 0.6727
 epoch: 84, train_loss: 0.2549, test_loss: 1.3824, test_f1: 0.6683
 epoch: 85, train_loss: 0.2492, test_loss: 1.5568, test_f1: 0.6588
 epoch: 86, train_loss: 0.2613, test_loss: 1.2581, test_f1: 0.6749
 epoch: 87, train_loss: 0.2399, test_loss: 1.5763, test_f1: 0.6481
 epoch: 88, train_loss: 0.2598, test_loss: 1.5706, test_f1: 0.6721
 epoch: 89, train_loss: 0.2442, test_loss: 1.4783, test_f1: 0.6856
 epoch: 90, train_loss: 0.2315, test_loss: 1.5711, test_f1: 0.6729
 epoch: 91, train_loss: 0.2284, test_loss: 1.5093, test_f1: 0.6733
 epoch: 92, train_loss: 0.2413, test_loss: 1.5171, test_f1: 0.6696
 epoch: 93, train_loss: 0.2377, test_loss: 1.4872, test_f1: 0.6719
 epoch: 94, train_loss: 0.2342, test_loss: 1.6022, test_f1: 0.6672
 epoch: 95, train_loss: 0.2148, test_loss: 1.7526, test_f1: 0.6348
 epoch: 96, train_loss: 0.2158, test_loss: 1.6035, test_f1: 0.6552
 epoch: 97, train_loss: 0.2284, test_loss: 1.5135, test_f1: 0.6690
 epoch: 98, train_loss: 0.2313, test_loss: 1.7087, test_f1: 0.6478
 epoch: 99, train_loss: 0.2245, test_loss: 1.7363, test_f1: 0.6478
##################ITERATION #2 ****************************************
 epoch: 0, train_loss: 1.1458, test_loss: 1.4238, test_f1: 0.2474
 epoch: 1, train_loss: 1.0085, test_loss: 0.9570, test_f1: 0.5068
 epoch: 2, train_loss: 0.9586, test_loss: 0.9207, test_f1: 0.5072
 epoch: 3, train_loss: 0.9392, test_loss: 0.8791, test_f1: 0.5369
 epoch: 4, train_loss: 0.9210, test_loss: 0.9173, test_f1: 0.5459
 epoch: 5, train_loss: 0.8976, test_loss: 0.8669, test_f1: 0.5456
 epoch: 6, train_loss: 0.8799, test_loss: 0.8766, test_f1: 0.5492
 epoch: 7, train_loss: 0.8615, test_loss: 0.9148, test_f1: 0.5441
 epoch: 8, train_loss: 0.8365, test_loss: 0.8369, test_f1: 0.5621
 epoch: 9, train_loss: 0.8322, test_loss: 0.9448, test_f1: 0.5881
 epoch: 10, train_loss: 0.8019, test_loss: 0.8078, test_f1: 0.5783
 epoch: 11, train_loss: 0.7944, test_loss: 0.8248, test_f1: 0.6337
 epoch: 12, train_loss: 0.7971, test_loss: 0.8225, test_f1: 0.6132
 epoch: 13, train_loss: 0.7877, test_loss: 0.7456, test_f1: 0.6280
 epoch: 14, train_loss: 0.7540, test_loss: 0.7642, test_f1: 0.6243
 epoch: 15, train_loss: 0.7495, test_loss: 0.7975, test_f1: 0.6264
 epoch: 16, train_loss: 0.7419, test_loss: 0.8112, test_f1: 0.6026
 epoch: 17, train_loss: 0.7209, test_loss: 0.8218, test_f1: 0.6193
 epoch: 18, train_loss: 0.7262, test_loss: 0.6751, test_f1: 0.6873
 epoch: 19, train_loss: 0.7084, test_loss: 0.8176, test_f1: 0.6380
 epoch: 20, train_loss: 0.6909, test_loss: 0.8663, test_f1: 0.6271
 epoch: 21, train_loss: 0.6918, test_loss: 0.8477, test_f1: 0.6215
 epoch: 22, train_loss: 0.6770, test_loss: 0.7717, test_f1: 0.6434
 epoch: 23, train_loss: 0.6501, test_loss: 0.8054, test_f1: 0.6218
 epoch: 24, train_loss: 0.6435, test_loss: 0.8575, test_f1: 0.6411
 epoch: 25, train_loss: 0.6569, test_loss: 0.8345, test_f1: 0.6001
 epoch: 26, train_loss: 0.6349, test_loss: 0.8237, test_f1: 0.6132
 epoch: 27, train_loss: 0.6389, test_loss: 0.9027, test_f1: 0.6458
 epoch: 28, train_loss: 0.6230, test_loss: 0.7956, test_f1: 0.6401
 epoch: 29, train_loss: 0.5962, test_loss: 0.8293, test_f1: 0.6624
 epoch: 30, train_loss: 0.6040, test_loss: 0.8521, test_f1: 0.6448
 epoch: 31, train_loss: 0.5894, test_loss: 0.7796, test_f1: 0.6455
 epoch: 32, train_loss: 0.5753, test_loss: 0.7480, test_f1: 0.6661
 epoch: 33, train_loss: 0.5540, test_loss: 0.9032, test_f1: 0.6354
 epoch: 34, train_loss: 0.5867, test_loss: 0.7758, test_f1: 0.6729
 epoch: 35, train_loss: 0.5806, test_loss: 0.7558, test_f1: 0.6409
 epoch: 36, train_loss: 0.5557, test_loss: 0.8908, test_f1: 0.6419
 epoch: 37, train_loss: 0.5402, test_loss: 0.9359, test_f1: 0.6541
 epoch: 38, train_loss: 0.5325, test_loss: 0.9160, test_f1: 0.6443
 epoch: 39, train_loss: 0.5291, test_loss: 0.8318, test_f1: 0.6845
 epoch: 40, train_loss: 0.5124, test_loss: 0.9379, test_f1: 0.6432
 epoch: 41, train_loss: 0.5087, test_loss: 0.9895, test_f1: 0.6931
 epoch: 42, train_loss: 0.5129, test_loss: 0.9541, test_f1: 0.6720
 epoch: 43, train_loss: 0.5107, test_loss: 0.8108, test_f1: 0.6641
 epoch: 44, train_loss: 0.5057, test_loss: 0.9551, test_f1: 0.6791
 epoch: 45, train_loss: 0.4854, test_loss: 0.9830, test_f1: 0.6689
 epoch: 46, train_loss: 0.4869, test_loss: 1.0115, test_f1: 0.6347
 epoch: 47, train_loss: 0.4896, test_loss: 0.9818, test_f1: 0.6727
 epoch: 48, train_loss: 0.4776, test_loss: 0.9427, test_f1: 0.6465
 epoch: 49, train_loss: 0.4814, test_loss: 0.9222, test_f1: 0.6815
 epoch: 50, train_loss: 0.5010, test_loss: 0.9550, test_f1: 0.6548
 epoch: 51, train_loss: 0.4400, test_loss: 1.0578, test_f1: 0.6527
 epoch: 52, train_loss: 0.4112, test_loss: 1.0252, test_f1: 0.6603
 epoch: 53, train_loss: 0.3954, test_loss: 1.0717, test_f1: 0.6765
 epoch: 54, train_loss: 0.3779, test_loss: 1.1141, test_f1: 0.6617
 epoch: 55, train_loss: 0.4012, test_loss: 1.1374, test_f1: 0.6854
 epoch: 56, train_loss: 0.3919, test_loss: 1.1979, test_f1: 0.6887
 epoch: 57, train_loss: 0.3670, test_loss: 1.2654, test_f1: 0.6448
 epoch: 58, train_loss: 0.3583, test_loss: 1.1675, test_f1: 0.6707
 epoch: 59, train_loss: 0.3417, test_loss: 1.1864, test_f1: 0.6661
 epoch: 60, train_loss: 0.3612, test_loss: 1.2450, test_f1: 0.6508
 epoch: 61, train_loss: 0.3653, test_loss: 1.2945, test_f1: 0.6426
 epoch: 62, train_loss: 0.3469, test_loss: 1.1415, test_f1: 0.6717
 epoch: 63, train_loss: 0.3490, test_loss: 1.1498, test_f1: 0.6698
 epoch: 64, train_loss: 0.3300, test_loss: 1.3442, test_f1: 0.6447
 epoch: 65, train_loss: 0.3547, test_loss: 1.2933, test_f1: 0.6616
 epoch: 66, train_loss: 0.3254, test_loss: 1.2931, test_f1: 0.6532
 epoch: 67, train_loss: 0.3507, test_loss: 1.5065, test_f1: 0.6326
 epoch: 68, train_loss: 0.3287, test_loss: 1.4452, test_f1: 0.6686
 epoch: 69, train_loss: 0.3211, test_loss: 1.3482, test_f1: 0.6670
 epoch: 70, train_loss: 0.3203, test_loss: 1.3647, test_f1: 0.6643
 epoch: 71, train_loss: 0.3125, test_loss: 1.4565, test_f1: 0.6536
 epoch: 72, train_loss: 0.3346, test_loss: 1.4019, test_f1: 0.6557
 epoch: 73, train_loss: 0.2969, test_loss: 1.3791, test_f1: 0.6681
 epoch: 74, train_loss: 0.3199, test_loss: 1.3456, test_f1: 0.6610
 epoch: 75, train_loss: 0.3114, test_loss: 1.4882, test_f1: 0.6413
 epoch: 76, train_loss: 0.2892, test_loss: 1.3413, test_f1: 0.6781
 epoch: 77, train_loss: 0.2917, test_loss: 1.5957, test_f1: 0.6504
 epoch: 78, train_loss: 0.3112, test_loss: 1.5153, test_f1: 0.6537
 epoch: 79, train_loss: 0.2885, test_loss: 1.5453, test_f1: 0.6630
 epoch: 80, train_loss: 0.2962, test_loss: 1.5588, test_f1: 0.6582
 epoch: 81, train_loss: 0.2918, test_loss: 1.4829, test_f1: 0.6653
 epoch: 82, train_loss: 0.2833, test_loss: 1.5235, test_f1: 0.6646
 epoch: 83, train_loss: 0.2928, test_loss: 1.3658, test_f1: 0.6664
 epoch: 84, train_loss: 0.2835, test_loss: 1.4945, test_f1: 0.6377
 epoch: 85, train_loss: 0.2700, test_loss: 1.5016, test_f1: 0.6592
 epoch: 86, train_loss: 0.2779, test_loss: 1.5743, test_f1: 0.6635
 epoch: 87, train_loss: 0.2837, test_loss: 1.5824, test_f1: 0.6582
 epoch: 88, train_loss: 0.2480, test_loss: 1.5712, test_f1: 0.6574
 epoch: 89, train_loss: 0.2753, test_loss: 1.5107, test_f1: 0.6726
 epoch: 90, train_loss: 0.2611, test_loss: 1.5043, test_f1: 0.6715
 epoch: 91, train_loss: 0.2479, test_loss: 1.5718, test_f1: 0.6741
 epoch: 92, train_loss: 0.2570, test_loss: 1.5617, test_f1: 0.6629
 epoch: 93, train_loss: 0.2478, test_loss: 1.5484, test_f1: 0.6762
 epoch: 94, train_loss: 0.2497, test_loss: 1.5762, test_f1: 0.6606
 epoch: 95, train_loss: 0.2464, test_loss: 1.6083, test_f1: 0.6774
 epoch: 96, train_loss: 0.2351, test_loss: 1.5824, test_f1: 0.6521
 epoch: 97, train_loss: 0.2525, test_loss: 1.7983, test_f1: 0.6541
 epoch: 98, train_loss: 0.2498, test_loss: 1.7043, test_f1: 0.6845
 epoch: 99, train_loss: 0.2368, test_loss: 1.5139, test_f1: 0.6712
##################ITERATION #3 ****************************************
 epoch: 0, train_loss: 1.1890, test_loss: 1.2139, test_f1: 0.3568
 epoch: 1, train_loss: 1.0106, test_loss: 0.9864, test_f1: 0.4923
 epoch: 2, train_loss: 0.9687, test_loss: 0.9659, test_f1: 0.5348
 epoch: 3, train_loss: 0.9472, test_loss: 0.9312, test_f1: 0.5265
 epoch: 4, train_loss: 0.9240, test_loss: 0.8844, test_f1: 0.5342
 epoch: 5, train_loss: 0.8919, test_loss: 0.8987, test_f1: 0.5640
 epoch: 6, train_loss: 0.8801, test_loss: 0.8460, test_f1: 0.5670
 epoch: 7, train_loss: 0.8663, test_loss: 0.8052, test_f1: 0.5989
 epoch: 8, train_loss: 0.8467, test_loss: 0.8008, test_f1: 0.6280
 epoch: 9, train_loss: 0.8238, test_loss: 0.7725, test_f1: 0.6517
 epoch: 10, train_loss: 0.8218, test_loss: 0.7618, test_f1: 0.5869
 epoch: 11, train_loss: 0.8150, test_loss: 0.7886, test_f1: 0.5839
 epoch: 12, train_loss: 0.7950, test_loss: 0.7685, test_f1: 0.6068
 epoch: 13, train_loss: 0.7863, test_loss: 0.7563, test_f1: 0.5941
 epoch: 14, train_loss: 0.7735, test_loss: 0.8165, test_f1: 0.5953
 epoch: 15, train_loss: 0.7669, test_loss: 0.7770, test_f1: 0.5694
 epoch: 16, train_loss: 0.7626, test_loss: 0.7578, test_f1: 0.6140
 epoch: 17, train_loss: 0.7309, test_loss: 0.7276, test_f1: 0.6368
 epoch: 18, train_loss: 0.7208, test_loss: 0.7593, test_f1: 0.6126
 epoch: 19, train_loss: 0.7200, test_loss: 0.7205, test_f1: 0.6147
 epoch: 20, train_loss: 0.7101, test_loss: 0.7404, test_f1: 0.6342
 epoch: 21, train_loss: 0.7000, test_loss: 0.7234, test_f1: 0.6568
 epoch: 22, train_loss: 0.6944, test_loss: 0.7473, test_f1: 0.6348
 epoch: 23, train_loss: 0.6861, test_loss: 0.7275, test_f1: 0.6514
 epoch: 24, train_loss: 0.6668, test_loss: 0.7140, test_f1: 0.6422
 epoch: 25, train_loss: 0.6385, test_loss: 0.7867, test_f1: 0.6473
 epoch: 26, train_loss: 0.6475, test_loss: 0.6939, test_f1: 0.6853
 epoch: 27, train_loss: 0.6550, test_loss: 0.8414, test_f1: 0.6372
 epoch: 28, train_loss: 0.6370, test_loss: 0.7691, test_f1: 0.6253
 epoch: 29, train_loss: 0.6219, test_loss: 0.7518, test_f1: 0.6532
 epoch: 30, train_loss: 0.6078, test_loss: 0.8761, test_f1: 0.6417
 epoch: 31, train_loss: 0.6157, test_loss: 0.7377, test_f1: 0.6466
 epoch: 32, train_loss: 0.5917, test_loss: 0.7379, test_f1: 0.6565
 epoch: 33, train_loss: 0.5916, test_loss: 0.7641, test_f1: 0.6515
 epoch: 34, train_loss: 0.5709, test_loss: 0.7778, test_f1: 0.6553
 epoch: 35, train_loss: 0.5680, test_loss: 0.7073, test_f1: 0.6704
 epoch: 36, train_loss: 0.5627, test_loss: 0.7781, test_f1: 0.6675
 epoch: 37, train_loss: 0.5617, test_loss: 0.7024, test_f1: 0.6646
 epoch: 38, train_loss: 0.5399, test_loss: 0.8121, test_f1: 0.6563
 epoch: 39, train_loss: 0.5546, test_loss: 0.7925, test_f1: 0.6498
 epoch: 40, train_loss: 0.5447, test_loss: 0.7105, test_f1: 0.6653
 epoch: 41, train_loss: 0.5242, test_loss: 0.7537, test_f1: 0.6654
 epoch: 42, train_loss: 0.5082, test_loss: 0.8028, test_f1: 0.6723
 epoch: 43, train_loss: 0.5076, test_loss: 0.7579, test_f1: 0.6998
 epoch: 44, train_loss: 0.5114, test_loss: 0.7713, test_f1: 0.6697
 epoch: 45, train_loss: 0.5010, test_loss: 0.8037, test_f1: 0.6730
 epoch: 46, train_loss: 0.4819, test_loss: 0.8066, test_f1: 0.6953
 epoch: 47, train_loss: 0.5147, test_loss: 0.8177, test_f1: 0.6608
 epoch: 48, train_loss: 0.4865, test_loss: 0.8427, test_f1: 0.6789
 epoch: 49, train_loss: 0.4825, test_loss: 0.8123, test_f1: 0.6588
 epoch: 50, train_loss: 0.4794, test_loss: 0.8218, test_f1: 0.6723
 epoch: 51, train_loss: 0.4300, test_loss: 0.8367, test_f1: 0.6531
 epoch: 52, train_loss: 0.3980, test_loss: 0.8366, test_f1: 0.6996
 epoch: 53, train_loss: 0.4058, test_loss: 0.8480, test_f1: 0.7101
 epoch: 54, train_loss: 0.3829, test_loss: 0.8520, test_f1: 0.7026
 epoch: 55, train_loss: 0.4053, test_loss: 0.9126, test_f1: 0.6750
 epoch: 56, train_loss: 0.3918, test_loss: 0.9421, test_f1: 0.6891
 epoch: 57, train_loss: 0.3764, test_loss: 0.9192, test_f1: 0.7134
 epoch: 58, train_loss: 0.3618, test_loss: 0.9433, test_f1: 0.6972
 epoch: 59, train_loss: 0.3628, test_loss: 1.0200, test_f1: 0.6852
 epoch: 60, train_loss: 0.3570, test_loss: 0.9586, test_f1: 0.6944
 epoch: 61, train_loss: 0.3430, test_loss: 1.0079, test_f1: 0.6853
 epoch: 62, train_loss: 0.3506, test_loss: 0.9683, test_f1: 0.7042
 epoch: 63, train_loss: 0.3546, test_loss: 0.9787, test_f1: 0.6959
 epoch: 64, train_loss: 0.3523, test_loss: 1.0078, test_f1: 0.6866
 epoch: 65, train_loss: 0.3486, test_loss: 1.0411, test_f1: 0.7006
 epoch: 66, train_loss: 0.3365, test_loss: 1.0271, test_f1: 0.6719
 epoch: 67, train_loss: 0.3279, test_loss: 1.0749, test_f1: 0.7008
 epoch: 68, train_loss: 0.3360, test_loss: 1.0585, test_f1: 0.6804
 epoch: 69, train_loss: 0.3302, test_loss: 1.0664, test_f1: 0.6909
 epoch: 70, train_loss: 0.3323, test_loss: 1.2242, test_f1: 0.6765
 epoch: 71, train_loss: 0.3271, test_loss: 1.0838, test_f1: 0.6951
 epoch: 72, train_loss: 0.3204, test_loss: 1.1482, test_f1: 0.6893
 epoch: 73, train_loss: 0.3002, test_loss: 1.1051, test_f1: 0.6997
 epoch: 74, train_loss: 0.3094, test_loss: 1.0975, test_f1: 0.6799
 epoch: 75, train_loss: 0.3325, test_loss: 1.1588, test_f1: 0.6759
 epoch: 76, train_loss: 0.3079, test_loss: 1.2658, test_f1: 0.6681
 epoch: 77, train_loss: 0.3042, test_loss: 1.0897, test_f1: 0.6875
 epoch: 78, train_loss: 0.3016, test_loss: 1.2561, test_f1: 0.6918
 epoch: 79, train_loss: 0.2891, test_loss: 1.0949, test_f1: 0.6931
 epoch: 80, train_loss: 0.2830, test_loss: 1.1794, test_f1: 0.6921
 epoch: 81, train_loss: 0.2897, test_loss: 1.1585, test_f1: 0.7068
 epoch: 82, train_loss: 0.2909, test_loss: 1.2380, test_f1: 0.6745
 epoch: 83, train_loss: 0.2917, test_loss: 1.1401, test_f1: 0.6825
 epoch: 84, train_loss: 0.2862, test_loss: 1.1775, test_f1: 0.6717
 epoch: 85, train_loss: 0.2904, test_loss: 1.1068, test_f1: 0.6848
 epoch: 86, train_loss: 0.2788, test_loss: 1.2300, test_f1: 0.6869
 epoch: 87, train_loss: 0.2606, test_loss: 1.3197, test_f1: 0.6779
 epoch: 88, train_loss: 0.2672, test_loss: 1.2600, test_f1: 0.6852
 epoch: 89, train_loss: 0.2724, test_loss: 1.2605, test_f1: 0.6945
 epoch: 90, train_loss: 0.2725, test_loss: 1.2537, test_f1: 0.6977
 epoch: 91, train_loss: 0.2600, test_loss: 1.2255, test_f1: 0.6882
 epoch: 92, train_loss: 0.2671, test_loss: 1.1879, test_f1: 0.6901
 epoch: 93, train_loss: 0.2620, test_loss: 1.3085, test_f1: 0.6811
 epoch: 94, train_loss: 0.2492, test_loss: 1.2806, test_f1: 0.6906
 epoch: 95, train_loss: 0.2566, test_loss: 1.2525, test_f1: 0.7102
 epoch: 96, train_loss: 0.2287, test_loss: 1.2440, test_f1: 0.7019
 epoch: 97, train_loss: 0.2621, test_loss: 1.3202, test_f1: 0.6887
 epoch: 98, train_loss: 0.2443, test_loss: 1.3645, test_f1: 0.6789
 epoch: 99, train_loss: 0.2258, test_loss: 1.3657, test_f1: 0.6857
##################ITERATION #4 ****************************************
 epoch: 0, train_loss: 1.2422, test_loss: 1.5539, test_f1: 0.2840
 epoch: 1, train_loss: 1.0252, test_loss: 0.9379, test_f1: 0.5409
 epoch: 2, train_loss: 0.9792, test_loss: 0.8925, test_f1: 0.5026
 epoch: 3, train_loss: 0.9407, test_loss: 0.9155, test_f1: 0.5031
 epoch: 4, train_loss: 0.9325, test_loss: 0.8419, test_f1: 0.5396
 epoch: 5, train_loss: 0.9006, test_loss: 0.9071, test_f1: 0.4942
 epoch: 6, train_loss: 0.9048, test_loss: 0.8583, test_f1: 0.5820
 epoch: 7, train_loss: 0.8551, test_loss: 0.8213, test_f1: 0.6044
 epoch: 8, train_loss: 0.8499, test_loss: 0.8469, test_f1: 0.5920
 epoch: 9, train_loss: 0.8173, test_loss: 0.8179, test_f1: 0.6004
 epoch: 10, train_loss: 0.8100, test_loss: 0.8305, test_f1: 0.5719
 epoch: 11, train_loss: 0.7944, test_loss: 0.8055, test_f1: 0.5731
 epoch: 12, train_loss: 0.7872, test_loss: 0.8654, test_f1: 0.5365
 epoch: 13, train_loss: 0.7749, test_loss: 0.7783, test_f1: 0.5975
 epoch: 14, train_loss: 0.7379, test_loss: 0.7724, test_f1: 0.6235
 epoch: 15, train_loss: 0.7340, test_loss: 0.7704, test_f1: 0.6236
 epoch: 16, train_loss: 0.7241, test_loss: 0.7868, test_f1: 0.6155
 epoch: 17, train_loss: 0.7088, test_loss: 0.7176, test_f1: 0.6855
 epoch: 18, train_loss: 0.7043, test_loss: 0.7823, test_f1: 0.6167
 epoch: 19, train_loss: 0.6867, test_loss: 0.8318, test_f1: 0.6082
 epoch: 20, train_loss: 0.6851, test_loss: 0.7974, test_f1: 0.6262
 epoch: 21, train_loss: 0.6770, test_loss: 0.8287, test_f1: 0.6296
 epoch: 22, train_loss: 0.6668, test_loss: 0.8625, test_f1: 0.6111
 epoch: 23, train_loss: 0.6564, test_loss: 0.9725, test_f1: 0.5849
 epoch: 24, train_loss: 0.6456, test_loss: 0.8482, test_f1: 0.6243
 epoch: 25, train_loss: 0.6447, test_loss: 0.8268, test_f1: 0.6162
 epoch: 26, train_loss: 0.6333, test_loss: 0.8812, test_f1: 0.6271
 epoch: 27, train_loss: 0.6167, test_loss: 0.8711, test_f1: 0.6105
 epoch: 28, train_loss: 0.6083, test_loss: 0.7678, test_f1: 0.6323
 epoch: 29, train_loss: 0.6163, test_loss: 0.7924, test_f1: 0.6347
 epoch: 30, train_loss: 0.5969, test_loss: 0.8057, test_f1: 0.6366
 epoch: 31, train_loss: 0.5927, test_loss: 0.8556, test_f1: 0.6297
 epoch: 32, train_loss: 0.5931, test_loss: 0.7763, test_f1: 0.6586
 epoch: 33, train_loss: 0.5665, test_loss: 0.8644, test_f1: 0.6492
 epoch: 34, train_loss: 0.5918, test_loss: 0.8410, test_f1: 0.6468
 epoch: 35, train_loss: 0.5762, test_loss: 0.8095, test_f1: 0.6616
 epoch: 36, train_loss: 0.5526, test_loss: 0.8361, test_f1: 0.6841
 epoch: 37, train_loss: 0.5319, test_loss: 0.7804, test_f1: 0.6586
 epoch: 38, train_loss: 0.5430, test_loss: 0.8881, test_f1: 0.6413
 epoch: 39, train_loss: 0.5388, test_loss: 0.9568, test_f1: 0.6196
 epoch: 40, train_loss: 0.5193, test_loss: 0.8939, test_f1: 0.6723
 epoch: 41, train_loss: 0.5270, test_loss: 0.8681, test_f1: 0.6361
 epoch: 42, train_loss: 0.5284, test_loss: 0.8361, test_f1: 0.6635
 epoch: 43, train_loss: 0.5063, test_loss: 0.9467, test_f1: 0.6620
 epoch: 44, train_loss: 0.5015, test_loss: 0.8700, test_f1: 0.7050
 epoch: 45, train_loss: 0.5118, test_loss: 0.8209, test_f1: 0.6521
 epoch: 46, train_loss: 0.4735, test_loss: 0.9085, test_f1: 0.6462
 epoch: 47, train_loss: 0.4790, test_loss: 0.9141, test_f1: 0.6766
 epoch: 48, train_loss: 0.4862, test_loss: 1.0216, test_f1: 0.6651
 epoch: 49, train_loss: 0.4671, test_loss: 0.9338, test_f1: 0.6442
 epoch: 50, train_loss: 0.4680, test_loss: 0.9270, test_f1: 0.6505
 epoch: 51, train_loss: 0.4130, test_loss: 0.9399, test_f1: 0.6559
 epoch: 52, train_loss: 0.3963, test_loss: 0.9203, test_f1: 0.6651
 epoch: 53, train_loss: 0.3975, test_loss: 0.8813, test_f1: 0.6845
 epoch: 54, train_loss: 0.3970, test_loss: 1.0193, test_f1: 0.6606
 epoch: 55, train_loss: 0.3730, test_loss: 1.0197, test_f1: 0.6796
 epoch: 56, train_loss: 0.3729, test_loss: 1.0598, test_f1: 0.6516
 epoch: 57, train_loss: 0.3726, test_loss: 1.0320, test_f1: 0.6650
 epoch: 58, train_loss: 0.3634, test_loss: 1.0392, test_f1: 0.6663
 epoch: 59, train_loss: 0.3702, test_loss: 1.1680, test_f1: 0.6589
 epoch: 60, train_loss: 0.3644, test_loss: 1.1443, test_f1: 0.6679
 epoch: 61, train_loss: 0.3599, test_loss: 1.0794, test_f1: 0.6604
 epoch: 62, train_loss: 0.3497, test_loss: 1.0915, test_f1: 0.6542
 epoch: 63, train_loss: 0.3475, test_loss: 1.1001, test_f1: 0.6786
 epoch: 64, train_loss: 0.3584, test_loss: 1.2318, test_f1: 0.6641
 epoch: 65, train_loss: 0.3524, test_loss: 1.1601, test_f1: 0.6405
 epoch: 66, train_loss: 0.3434, test_loss: 1.2556, test_f1: 0.6522
 epoch: 67, train_loss: 0.3558, test_loss: 1.2355, test_f1: 0.6748
 epoch: 68, train_loss: 0.3353, test_loss: 1.1926, test_f1: 0.6781
 epoch: 69, train_loss: 0.3197, test_loss: 1.1818, test_f1: 0.6723
 epoch: 70, train_loss: 0.3168, test_loss: 1.2110, test_f1: 0.6623
 epoch: 71, train_loss: 0.3312, test_loss: 1.2123, test_f1: 0.6628
 epoch: 72, train_loss: 0.3145, test_loss: 1.2347, test_f1: 0.6513
 epoch: 73, train_loss: 0.3276, test_loss: 1.1829, test_f1: 0.6599
 epoch: 74, train_loss: 0.3189, test_loss: 1.3080, test_f1: 0.6466
 epoch: 75, train_loss: 0.3120, test_loss: 1.2472, test_f1: 0.6632
 epoch: 76, train_loss: 0.3090, test_loss: 1.2620, test_f1: 0.6689
 epoch: 77, train_loss: 0.3050, test_loss: 1.3094, test_f1: 0.6384
 epoch: 78, train_loss: 0.2857, test_loss: 1.2686, test_f1: 0.6637
 epoch: 79, train_loss: 0.2846, test_loss: 1.2445, test_f1: 0.6487
 epoch: 80, train_loss: 0.3176, test_loss: 1.2624, test_f1: 0.6783
 epoch: 81, train_loss: 0.2895, test_loss: 1.3668, test_f1: 0.6633
 epoch: 82, train_loss: 0.3022, test_loss: 1.3643, test_f1: 0.6569
 epoch: 83, train_loss: 0.2829, test_loss: 1.2886, test_f1: 0.6712
 epoch: 84, train_loss: 0.2845, test_loss: 1.3706, test_f1: 0.6533
 epoch: 85, train_loss: 0.2789, test_loss: 1.4646, test_f1: 0.6411
 epoch: 86, train_loss: 0.2743, test_loss: 1.4396, test_f1: 0.6350
 epoch: 87, train_loss: 0.2787, test_loss: 1.3654, test_f1: 0.6622
 epoch: 88, train_loss: 0.2718, test_loss: 1.5005, test_f1: 0.6518
 epoch: 89, train_loss: 0.2789, test_loss: 1.2751, test_f1: 0.6614
 epoch: 90, train_loss: 0.2645, test_loss: 1.4457, test_f1: 0.6515
 epoch: 91, train_loss: 0.2572, test_loss: 1.5938, test_f1: 0.6701
 epoch: 92, train_loss: 0.2660, test_loss: 1.5464, test_f1: 0.6510
 epoch: 93, train_loss: 0.2566, test_loss: 1.4216, test_f1: 0.6720
 epoch: 94, train_loss: 0.2711, test_loss: 1.5464, test_f1: 0.6505
 epoch: 95, train_loss: 0.2718, test_loss: 1.5128, test_f1: 0.6781
 epoch: 96, train_loss: 0.2551, test_loss: 1.5897, test_f1: 0.6566
 epoch: 97, train_loss: 0.2469, test_loss: 1.3592, test_f1: 0.6708
 epoch: 98, train_loss: 0.2344, test_loss: 1.4576, test_f1: 0.6634
 epoch: 99, train_loss: 0.2577, test_loss: 1.5876, test_f1: 0.6258
##################ITERATION #5 ****************************************
 epoch: 0, train_loss: 1.2817, test_loss: 1.1517, test_f1: 0.3809
 epoch: 1, train_loss: 1.0313, test_loss: 0.9002, test_f1: 0.5213
 epoch: 2, train_loss: 0.9819, test_loss: 0.9009, test_f1: 0.5251
 epoch: 3, train_loss: 0.9409, test_loss: 0.8920, test_f1: 0.5364
 epoch: 4, train_loss: 0.9035, test_loss: 0.8919, test_f1: 0.5352
 epoch: 5, train_loss: 0.8933, test_loss: 0.8353, test_f1: 0.5769
 epoch: 6, train_loss: 0.8747, test_loss: 0.8757, test_f1: 0.5426
 epoch: 7, train_loss: 0.8437, test_loss: 0.9424, test_f1: 0.5768
 epoch: 8, train_loss: 0.8305, test_loss: 0.7901, test_f1: 0.6106
 epoch: 9, train_loss: 0.8148, test_loss: 0.8087, test_f1: 0.5989
 epoch: 10, train_loss: 0.8158, test_loss: 0.7644, test_f1: 0.6248
 epoch: 11, train_loss: 0.7919, test_loss: 0.7883, test_f1: 0.6065
 epoch: 12, train_loss: 0.7812, test_loss: 0.7663, test_f1: 0.6222
 epoch: 13, train_loss: 0.7734, test_loss: 0.7646, test_f1: 0.6616
 epoch: 14, train_loss: 0.7493, test_loss: 0.7588, test_f1: 0.6470
 epoch: 15, train_loss: 0.7383, test_loss: 0.7704, test_f1: 0.6566
 epoch: 16, train_loss: 0.7330, test_loss: 0.7688, test_f1: 0.6568
 epoch: 17, train_loss: 0.7224, test_loss: 0.7300, test_f1: 0.6933
 epoch: 18, train_loss: 0.7075, test_loss: 0.7140, test_f1: 0.6851
 epoch: 19, train_loss: 0.6912, test_loss: 0.7168, test_f1: 0.6466
 epoch: 20, train_loss: 0.6969, test_loss: 0.7180, test_f1: 0.6756
 epoch: 21, train_loss: 0.6937, test_loss: 0.7390, test_f1: 0.6608
 epoch: 22, train_loss: 0.6767, test_loss: 0.7362, test_f1: 0.6409
 epoch: 23, train_loss: 0.6584, test_loss: 0.7491, test_f1: 0.6752
 epoch: 24, train_loss: 0.6395, test_loss: 0.7030, test_f1: 0.6747
 epoch: 25, train_loss: 0.6447, test_loss: 0.8002, test_f1: 0.6392
 epoch: 26, train_loss: 0.6314, test_loss: 0.7304, test_f1: 0.6625
 epoch: 27, train_loss: 0.6396, test_loss: 0.8012, test_f1: 0.6277
 epoch: 28, train_loss: 0.6291, test_loss: 0.7987, test_f1: 0.6404
 epoch: 29, train_loss: 0.6121, test_loss: 0.8106, test_f1: 0.6277
 epoch: 30, train_loss: 0.5932, test_loss: 0.7649, test_f1: 0.6856
 epoch: 31, train_loss: 0.5946, test_loss: 0.7990, test_f1: 0.6690
 epoch: 32, train_loss: 0.5930, test_loss: 0.8401, test_f1: 0.6345
 epoch: 33, train_loss: 0.6006, test_loss: 0.9234, test_f1: 0.6517
 epoch: 34, train_loss: 0.5752, test_loss: 0.7430, test_f1: 0.6696
 epoch: 35, train_loss: 0.5789, test_loss: 0.7307, test_f1: 0.6560
 epoch: 36, train_loss: 0.5560, test_loss: 0.7949, test_f1: 0.6561
 epoch: 37, train_loss: 0.5585, test_loss: 0.7325, test_f1: 0.6843
 epoch: 38, train_loss: 0.5401, test_loss: 0.7247, test_f1: 0.6599
 epoch: 39, train_loss: 0.5411, test_loss: 0.7171, test_f1: 0.6986
 epoch: 40, train_loss: 0.5596, test_loss: 0.8365, test_f1: 0.6801
 epoch: 41, train_loss: 0.5237, test_loss: 0.8479, test_f1: 0.6760
 epoch: 42, train_loss: 0.5362, test_loss: 0.9621, test_f1: 0.6551
 epoch: 43, train_loss: 0.5276, test_loss: 0.8751, test_f1: 0.6595
 epoch: 44, train_loss: 0.5247, test_loss: 0.9430, test_f1: 0.6541
 epoch: 45, train_loss: 0.5121, test_loss: 0.8026, test_f1: 0.6547
 epoch: 46, train_loss: 0.4986, test_loss: 0.7802, test_f1: 0.6902
 epoch: 47, train_loss: 0.4914, test_loss: 0.8398, test_f1: 0.6755
 epoch: 48, train_loss: 0.4810, test_loss: 0.9396, test_f1: 0.6710
 epoch: 49, train_loss: 0.5226, test_loss: 0.9368, test_f1: 0.6772
 epoch: 50, train_loss: 0.4704, test_loss: 0.9266, test_f1: 0.6376
 epoch: 51, train_loss: 0.4537, test_loss: 0.8786, test_f1: 0.6801
 epoch: 52, train_loss: 0.4292, test_loss: 0.9005, test_f1: 0.6793
 epoch: 53, train_loss: 0.4185, test_loss: 0.9380, test_f1: 0.6666
 epoch: 54, train_loss: 0.4004, test_loss: 0.9375, test_f1: 0.6825
 epoch: 55, train_loss: 0.3953, test_loss: 0.9730, test_f1: 0.6752
 epoch: 56, train_loss: 0.4254, test_loss: 0.9696, test_f1: 0.6715
 epoch: 57, train_loss: 0.3778, test_loss: 1.0361, test_f1: 0.6669
 epoch: 58, train_loss: 0.3854, test_loss: 1.0648, test_f1: 0.6756
 epoch: 59, train_loss: 0.3930, test_loss: 1.0486, test_f1: 0.6659
 epoch: 60, train_loss: 0.3871, test_loss: 1.0500, test_f1: 0.6606
 epoch: 61, train_loss: 0.3743, test_loss: 1.0084, test_f1: 0.6790
 epoch: 62, train_loss: 0.3741, test_loss: 1.0902, test_f1: 0.6798
 epoch: 63, train_loss: 0.3643, test_loss: 1.1378, test_f1: 0.6744
 epoch: 64, train_loss: 0.3813, test_loss: 1.1265, test_f1: 0.6715
 epoch: 65, train_loss: 0.3660, test_loss: 1.1054, test_f1: 0.6712
 epoch: 66, train_loss: 0.3396, test_loss: 1.1479, test_f1: 0.6727
 epoch: 67, train_loss: 0.3485, test_loss: 1.2879, test_f1: 0.6460
 epoch: 68, train_loss: 0.3535, test_loss: 1.0998, test_f1: 0.6811
 epoch: 69, train_loss: 0.3549, test_loss: 1.1251, test_f1: 0.6638
 epoch: 70, train_loss: 0.3544, test_loss: 1.2535, test_f1: 0.6681
 epoch: 71, train_loss: 0.3543, test_loss: 1.2651, test_f1: 0.6890
 epoch: 72, train_loss: 0.3426, test_loss: 1.1308, test_f1: 0.6755
 epoch: 73, train_loss: 0.3306, test_loss: 1.2025, test_f1: 0.6755
 epoch: 74, train_loss: 0.3385, test_loss: 1.1894, test_f1: 0.6827
 epoch: 75, train_loss: 0.3397, test_loss: 1.2289, test_f1: 0.6754
 epoch: 76, train_loss: 0.3187, test_loss: 1.2306, test_f1: 0.6580
 epoch: 77, train_loss: 0.3211, test_loss: 1.2555, test_f1: 0.6787
 epoch: 78, train_loss: 0.3353, test_loss: 1.1687, test_f1: 0.7298
 epoch: 79, train_loss: 0.3318, test_loss: 1.3135, test_f1: 0.6720
 epoch: 80, train_loss: 0.3082, test_loss: 1.2425, test_f1: 0.6770
 epoch: 81, train_loss: 0.3151, test_loss: 1.3227, test_f1: 0.6593
 epoch: 82, train_loss: 0.3251, test_loss: 1.3330, test_f1: 0.6781
 epoch: 83, train_loss: 0.3239, test_loss: 1.3352, test_f1: 0.6610
 epoch: 84, train_loss: 0.2924, test_loss: 1.2901, test_f1: 0.6824
 epoch: 85, train_loss: 0.2909, test_loss: 1.3680, test_f1: 0.6653
 epoch: 86, train_loss: 0.2911, test_loss: 1.3551, test_f1: 0.6622
 epoch: 87, train_loss: 0.2969, test_loss: 1.3487, test_f1: 0.6699
 epoch: 88, train_loss: 0.3015, test_loss: 1.5309, test_f1: 0.6810
 epoch: 89, train_loss: 0.2961, test_loss: 1.4286, test_f1: 0.6668
 epoch: 90, train_loss: 0.2857, test_loss: 1.4627, test_f1: 0.6666
 epoch: 91, train_loss: 0.2940, test_loss: 1.5588, test_f1: 0.6734
 epoch: 92, train_loss: 0.2905, test_loss: 1.4924, test_f1: 0.6653
 epoch: 93, train_loss: 0.2904, test_loss: 1.5655, test_f1: 0.6792
 epoch: 94, train_loss: 0.2933, test_loss: 1.5976, test_f1: 0.6542
 epoch: 95, train_loss: 0.2917, test_loss: 1.4223, test_f1: 0.6737
 epoch: 96, train_loss: 0.2806, test_loss: 1.6435, test_f1: 0.6780
 epoch: 97, train_loss: 0.2623, test_loss: 1.6798, test_f1: 0.6680
 epoch: 98, train_loss: 0.2888, test_loss: 1.5540, test_f1: 0.6565
 epoch: 99, train_loss: 0.2788, test_loss: 1.5727, test_f1: 0.6676
##################ITERATION #6 ****************************************
 epoch: 0, train_loss: 1.2424, test_loss: 1.1109, test_f1: 0.3803
 epoch: 1, train_loss: 0.9980, test_loss: 0.9760, test_f1: 0.5156
 epoch: 2, train_loss: 0.9515, test_loss: 0.9705, test_f1: 0.5192
 epoch: 3, train_loss: 0.9483, test_loss: 0.9442, test_f1: 0.5400
 epoch: 4, train_loss: 0.9058, test_loss: 0.9450, test_f1: 0.5045
 epoch: 5, train_loss: 0.8888, test_loss: 0.9105, test_f1: 0.5694
 epoch: 6, train_loss: 0.8666, test_loss: 0.9169, test_f1: 0.5587
 epoch: 7, train_loss: 0.8593, test_loss: 0.8675, test_f1: 0.5634
 epoch: 8, train_loss: 0.8367, test_loss: 0.8453, test_f1: 0.5695
 epoch: 9, train_loss: 0.8267, test_loss: 0.8321, test_f1: 0.5876
 epoch: 10, train_loss: 0.8205, test_loss: 0.8206, test_f1: 0.6276
 epoch: 11, train_loss: 0.8009, test_loss: 0.7914, test_f1: 0.6142
 epoch: 12, train_loss: 0.7840, test_loss: 0.8054, test_f1: 0.6211
 epoch: 13, train_loss: 0.7772, test_loss: 0.8851, test_f1: 0.5688
 epoch: 14, train_loss: 0.7620, test_loss: 0.8523, test_f1: 0.5972
 epoch: 15, train_loss: 0.7587, test_loss: 0.8095, test_f1: 0.6076
 epoch: 16, train_loss: 0.7473, test_loss: 0.8040, test_f1: 0.5694
 epoch: 17, train_loss: 0.7207, test_loss: 0.7751, test_f1: 0.6047
 epoch: 18, train_loss: 0.7058, test_loss: 0.7540, test_f1: 0.6467
 epoch: 19, train_loss: 0.7035, test_loss: 0.7630, test_f1: 0.6438
 epoch: 20, train_loss: 0.7063, test_loss: 0.8144, test_f1: 0.6142
 epoch: 21, train_loss: 0.6790, test_loss: 0.8734, test_f1: 0.5770
 epoch: 22, train_loss: 0.6829, test_loss: 0.7474, test_f1: 0.6348
 epoch: 23, train_loss: 0.6658, test_loss: 0.7602, test_f1: 0.6605
 epoch: 24, train_loss: 0.6539, test_loss: 0.7253, test_f1: 0.6722
 epoch: 25, train_loss: 0.6533, test_loss: 0.7316, test_f1: 0.6454
 epoch: 26, train_loss: 0.6451, test_loss: 0.8236, test_f1: 0.6202
 epoch: 27, train_loss: 0.6267, test_loss: 0.7586, test_f1: 0.6418
 epoch: 28, train_loss: 0.6182, test_loss: 0.8087, test_f1: 0.6209
 epoch: 29, train_loss: 0.6240, test_loss: 0.7517, test_f1: 0.6485
 epoch: 30, train_loss: 0.5934, test_loss: 0.7031, test_f1: 0.6952
 epoch: 31, train_loss: 0.6001, test_loss: 0.7206, test_f1: 0.6779
 epoch: 32, train_loss: 0.5856, test_loss: 0.7562, test_f1: 0.6480
 epoch: 33, train_loss: 0.6245, test_loss: 0.8607, test_f1: 0.6443
 epoch: 34, train_loss: 0.5859, test_loss: 0.8771, test_f1: 0.6016
 epoch: 35, train_loss: 0.5707, test_loss: 0.6857, test_f1: 0.6839
 epoch: 36, train_loss: 0.5807, test_loss: 0.7126, test_f1: 0.6797
 epoch: 37, train_loss: 0.5536, test_loss: 0.7281, test_f1: 0.6597
 epoch: 38, train_loss: 0.5513, test_loss: 0.8144, test_f1: 0.6270
 epoch: 39, train_loss: 0.5584, test_loss: 0.7786, test_f1: 0.6530
 epoch: 40, train_loss: 0.5450, test_loss: 0.8614, test_f1: 0.6423
 epoch: 41, train_loss: 0.5304, test_loss: 0.7554, test_f1: 0.6499
 epoch: 42, train_loss: 0.5221, test_loss: 0.7384, test_f1: 0.6491
 epoch: 43, train_loss: 0.5162, test_loss: 0.7957, test_f1: 0.6692
 epoch: 44, train_loss: 0.5034, test_loss: 0.8919, test_f1: 0.6508
 epoch: 45, train_loss: 0.5209, test_loss: 0.8416, test_f1: 0.6622
 epoch: 46, train_loss: 0.4885, test_loss: 0.8008, test_f1: 0.6771
 epoch: 47, train_loss: 0.4902, test_loss: 0.8729, test_f1: 0.6646
 epoch: 48, train_loss: 0.4780, test_loss: 0.9472, test_f1: 0.6668
 epoch: 49, train_loss: 0.4803, test_loss: 0.9460, test_f1: 0.6638
 epoch: 50, train_loss: 0.5046, test_loss: 0.7890, test_f1: 0.6880
 epoch: 51, train_loss: 0.4580, test_loss: 0.8112, test_f1: 0.6674
 epoch: 52, train_loss: 0.4212, test_loss: 0.8141, test_f1: 0.6769
 epoch: 53, train_loss: 0.3991, test_loss: 0.8661, test_f1: 0.6765
 epoch: 54, train_loss: 0.4059, test_loss: 0.8509, test_f1: 0.6989
 epoch: 55, train_loss: 0.3931, test_loss: 0.8458, test_f1: 0.6864
 epoch: 56, train_loss: 0.3958, test_loss: 1.0172, test_f1: 0.6785
 epoch: 57, train_loss: 0.3964, test_loss: 1.0267, test_f1: 0.6726
 epoch: 58, train_loss: 0.3924, test_loss: 0.9239, test_f1: 0.6787
 epoch: 59, train_loss: 0.3836, test_loss: 0.9070, test_f1: 0.6672
 epoch: 60, train_loss: 0.3617, test_loss: 0.9356, test_f1: 0.6653
 epoch: 61, train_loss: 0.3721, test_loss: 1.0235, test_f1: 0.6720
 epoch: 62, train_loss: 0.3759, test_loss: 0.9717, test_f1: 0.6813
 epoch: 63, train_loss: 0.3530, test_loss: 1.0004, test_f1: 0.6657
 epoch: 64, train_loss: 0.3813, test_loss: 0.9939, test_f1: 0.6904
 epoch: 65, train_loss: 0.3671, test_loss: 0.9467, test_f1: 0.6810
 epoch: 66, train_loss: 0.3522, test_loss: 1.0164, test_f1: 0.6813
 epoch: 67, train_loss: 0.3576, test_loss: 1.0700, test_f1: 0.6823
 epoch: 68, train_loss: 0.3349, test_loss: 1.0849, test_f1: 0.6720
 epoch: 69, train_loss: 0.3471, test_loss: 1.1008, test_f1: 0.6675
 epoch: 70, train_loss: 0.3439, test_loss: 1.0943, test_f1: 0.6728
 epoch: 71, train_loss: 0.3426, test_loss: 0.9727, test_f1: 0.6869
 epoch: 72, train_loss: 0.3356, test_loss: 1.0329, test_f1: 0.6783
 epoch: 73, train_loss: 0.3245, test_loss: 1.0973, test_f1: 0.6863
 epoch: 74, train_loss: 0.3230, test_loss: 1.1712, test_f1: 0.6748
 epoch: 75, train_loss: 0.3370, test_loss: 1.1029, test_f1: 0.6767
 epoch: 76, train_loss: 0.3247, test_loss: 1.0871, test_f1: 0.6868
 epoch: 77, train_loss: 0.3283, test_loss: 1.1093, test_f1: 0.6823
 epoch: 78, train_loss: 0.3057, test_loss: 1.0844, test_f1: 0.6652
 epoch: 79, train_loss: 0.3045, test_loss: 1.1425, test_f1: 0.6911
 epoch: 80, train_loss: 0.3087, test_loss: 1.1262, test_f1: 0.6757
 epoch: 81, train_loss: 0.2976, test_loss: 1.1706, test_f1: 0.6622
 epoch: 82, train_loss: 0.3022, test_loss: 1.1784, test_f1: 0.6540
 epoch: 83, train_loss: 0.3035, test_loss: 1.2203, test_f1: 0.6836
 epoch: 84, train_loss: 0.2868, test_loss: 1.2204, test_f1: 0.6501
 epoch: 85, train_loss: 0.2958, test_loss: 1.3034, test_f1: 0.6651
 epoch: 86, train_loss: 0.2875, test_loss: 1.1714, test_f1: 0.6778
 epoch: 87, train_loss: 0.2850, test_loss: 1.2068, test_f1: 0.6757
 epoch: 88, train_loss: 0.2822, test_loss: 1.2430, test_f1: 0.6669
 epoch: 89, train_loss: 0.3034, test_loss: 1.3092, test_f1: 0.6441
 epoch: 90, train_loss: 0.2713, test_loss: 1.2800, test_f1: 0.6718
 epoch: 91, train_loss: 0.2867, test_loss: 1.1548, test_f1: 0.6697
 epoch: 92, train_loss: 0.2806, test_loss: 1.2636, test_f1: 0.6596
 epoch: 93, train_loss: 0.2825, test_loss: 1.1866, test_f1: 0.6662
 epoch: 94, train_loss: 0.2751, test_loss: 1.2793, test_f1: 0.6631
 epoch: 95, train_loss: 0.2879, test_loss: 1.2185, test_f1: 0.6843
 epoch: 96, train_loss: 0.2791, test_loss: 1.3217, test_f1: 0.6878
 epoch: 97, train_loss: 0.2663, test_loss: 1.3114, test_f1: 0.6846
 epoch: 98, train_loss: 0.2736, test_loss: 1.3092, test_f1: 0.6826
 epoch: 99, train_loss: 0.2696, test_loss: 1.2489, test_f1: 0.6694
##################ITERATION #7 ****************************************
 epoch: 0, train_loss: 1.3502, test_loss: 1.1414, test_f1: 0.4033
 epoch: 1, train_loss: 1.0299, test_loss: 0.9434, test_f1: 0.5055
 epoch: 2, train_loss: 0.9798, test_loss: 0.9074, test_f1: 0.5307
 epoch: 3, train_loss: 0.9433, test_loss: 0.8760, test_f1: 0.5220
 epoch: 4, train_loss: 0.9242, test_loss: 0.9066, test_f1: 0.5414
 epoch: 5, train_loss: 0.9081, test_loss: 0.8412, test_f1: 0.5610
 epoch: 6, train_loss: 0.8784, test_loss: 0.8578, test_f1: 0.5773
 epoch: 7, train_loss: 0.8704, test_loss: 0.8411, test_f1: 0.5794
 epoch: 8, train_loss: 0.8462, test_loss: 0.8057, test_f1: 0.5911
 epoch: 9, train_loss: 0.8462, test_loss: 0.7993, test_f1: 0.6401
 epoch: 10, train_loss: 0.8024, test_loss: 0.7750, test_f1: 0.6362
 epoch: 11, train_loss: 0.8044, test_loss: 0.8088, test_f1: 0.6003
 epoch: 12, train_loss: 0.8087, test_loss: 0.7997, test_f1: 0.6330
 epoch: 13, train_loss: 0.7898, test_loss: 0.7851, test_f1: 0.6163
 epoch: 14, train_loss: 0.7684, test_loss: 0.7807, test_f1: 0.6033
 epoch: 15, train_loss: 0.7682, test_loss: 0.7928, test_f1: 0.6107
 epoch: 16, train_loss: 0.7472, test_loss: 0.8207, test_f1: 0.6072
 epoch: 17, train_loss: 0.7489, test_loss: 0.7511, test_f1: 0.6142
 epoch: 18, train_loss: 0.7253, test_loss: 0.8095, test_f1: 0.5819
 epoch: 19, train_loss: 0.7177, test_loss: 0.7419, test_f1: 0.6420
 epoch: 20, train_loss: 0.6907, test_loss: 0.7626, test_f1: 0.6364
 epoch: 21, train_loss: 0.6963, test_loss: 0.7554, test_f1: 0.6504
 epoch: 22, train_loss: 0.6977, test_loss: 0.7344, test_f1: 0.6718
 epoch: 23, train_loss: 0.6830, test_loss: 0.7457, test_f1: 0.6830
 epoch: 24, train_loss: 0.6844, test_loss: 0.6880, test_f1: 0.6785
 epoch: 25, train_loss: 0.6492, test_loss: 0.8178, test_f1: 0.6665
 epoch: 26, train_loss: 0.6622, test_loss: 0.7115, test_f1: 0.6503
 epoch: 27, train_loss: 0.6643, test_loss: 0.8190, test_f1: 0.6563
 epoch: 28, train_loss: 0.6449, test_loss: 0.7124, test_f1: 0.6729
 epoch: 29, train_loss: 0.6036, test_loss: 0.7720, test_f1: 0.6538
 epoch: 30, train_loss: 0.6249, test_loss: 0.6902, test_f1: 0.6971
 epoch: 31, train_loss: 0.6271, test_loss: 0.7419, test_f1: 0.6603
 epoch: 32, train_loss: 0.5902, test_loss: 0.8291, test_f1: 0.6543
 epoch: 33, train_loss: 0.5797, test_loss: 0.7955, test_f1: 0.6602
 epoch: 34, train_loss: 0.5878, test_loss: 0.7461, test_f1: 0.6708
 epoch: 35, train_loss: 0.5860, test_loss: 0.8083, test_f1: 0.6478
 epoch: 36, train_loss: 0.5691, test_loss: 0.7195, test_f1: 0.6621
 epoch: 37, train_loss: 0.5597, test_loss: 0.8157, test_f1: 0.6389
 epoch: 38, train_loss: 0.5702, test_loss: 0.8286, test_f1: 0.6498
 epoch: 39, train_loss: 0.5687, test_loss: 0.7541, test_f1: 0.6684
 epoch: 40, train_loss: 0.5469, test_loss: 0.8150, test_f1: 0.6623
 epoch: 41, train_loss: 0.5400, test_loss: 0.7907, test_f1: 0.6660
 epoch: 42, train_loss: 0.5465, test_loss: 0.7816, test_f1: 0.6791
 epoch: 43, train_loss: 0.5097, test_loss: 0.7897, test_f1: 0.6744
 epoch: 44, train_loss: 0.5239, test_loss: 0.8363, test_f1: 0.6439
 epoch: 45, train_loss: 0.5264, test_loss: 0.8209, test_f1: 0.6738
 epoch: 46, train_loss: 0.5077, test_loss: 0.8426, test_f1: 0.6711
 epoch: 47, train_loss: 0.4917, test_loss: 0.8328, test_f1: 0.6629
 epoch: 48, train_loss: 0.4980, test_loss: 0.8664, test_f1: 0.6749
 epoch: 49, train_loss: 0.5010, test_loss: 0.8517, test_f1: 0.6672
 epoch: 50, train_loss: 0.5035, test_loss: 0.8601, test_f1: 0.6877
 epoch: 51, train_loss: 0.4555, test_loss: 0.8791, test_f1: 0.6802
 epoch: 52, train_loss: 0.4305, test_loss: 0.8716, test_f1: 0.6935
 epoch: 53, train_loss: 0.4267, test_loss: 0.8807, test_f1: 0.6904
 epoch: 54, train_loss: 0.4078, test_loss: 0.8497, test_f1: 0.6851
 epoch: 55, train_loss: 0.4023, test_loss: 0.9429, test_f1: 0.6876
 epoch: 56, train_loss: 0.4075, test_loss: 0.9472, test_f1: 0.6885
 epoch: 57, train_loss: 0.3988, test_loss: 0.9641, test_f1: 0.6878
 epoch: 58, train_loss: 0.3994, test_loss: 0.9213, test_f1: 0.6917
 epoch: 59, train_loss: 0.3925, test_loss: 0.9517, test_f1: 0.6898
 epoch: 60, train_loss: 0.3961, test_loss: 0.9362, test_f1: 0.6937
 epoch: 61, train_loss: 0.3969, test_loss: 0.9865, test_f1: 0.6829
 epoch: 62, train_loss: 0.3818, test_loss: 1.0059, test_f1: 0.6733
 epoch: 63, train_loss: 0.3790, test_loss: 0.9035, test_f1: 0.6879
 epoch: 64, train_loss: 0.3617, test_loss: 0.9348, test_f1: 0.6976
 epoch: 65, train_loss: 0.3640, test_loss: 1.0011, test_f1: 0.6981
 epoch: 66, train_loss: 0.3719, test_loss: 1.0190, test_f1: 0.6786
 epoch: 67, train_loss: 0.3714, test_loss: 0.9739, test_f1: 0.6858
 epoch: 68, train_loss: 0.3559, test_loss: 0.9894, test_f1: 0.6737
 epoch: 69, train_loss: 0.3535, test_loss: 1.0393, test_f1: 0.6899
 epoch: 70, train_loss: 0.3463, test_loss: 0.9966, test_f1: 0.6754
 epoch: 71, train_loss: 0.3528, test_loss: 0.9316, test_f1: 0.6840
 epoch: 72, train_loss: 0.3479, test_loss: 0.9732, test_f1: 0.7033
 epoch: 73, train_loss: 0.3362, test_loss: 1.0303, test_f1: 0.6813
 epoch: 74, train_loss: 0.3418, test_loss: 1.0206, test_f1: 0.6905
 epoch: 75, train_loss: 0.3489, test_loss: 1.0153, test_f1: 0.6795
 epoch: 76, train_loss: 0.3320, test_loss: 1.0554, test_f1: 0.6872
 epoch: 77, train_loss: 0.3514, test_loss: 1.0280, test_f1: 0.6853
 epoch: 78, train_loss: 0.3263, test_loss: 1.0066, test_f1: 0.6764
 epoch: 79, train_loss: 0.3178, test_loss: 1.0698, test_f1: 0.6861
 epoch: 80, train_loss: 0.3346, test_loss: 1.1023, test_f1: 0.6670
 epoch: 81, train_loss: 0.3153, test_loss: 1.0740, test_f1: 0.6667
 epoch: 82, train_loss: 0.3103, test_loss: 1.0557, test_f1: 0.6835
 epoch: 83, train_loss: 0.3146, test_loss: 1.1205, test_f1: 0.6830
 epoch: 84, train_loss: 0.3231, test_loss: 1.1436, test_f1: 0.6609
 epoch: 85, train_loss: 0.3164, test_loss: 1.1316, test_f1: 0.6761
 epoch: 86, train_loss: 0.2951, test_loss: 1.1145, test_f1: 0.6771
 epoch: 87, train_loss: 0.2957, test_loss: 1.0983, test_f1: 0.6762
 epoch: 88, train_loss: 0.2918, test_loss: 1.2570, test_f1: 0.6728
 epoch: 89, train_loss: 0.2979, test_loss: 1.2143, test_f1: 0.6707
 epoch: 90, train_loss: 0.2916, test_loss: 1.1673, test_f1: 0.6704
 epoch: 91, train_loss: 0.2812, test_loss: 1.2782, test_f1: 0.6708
 epoch: 92, train_loss: 0.2959, test_loss: 1.1835, test_f1: 0.6694
 epoch: 93, train_loss: 0.2725, test_loss: 1.2090, test_f1: 0.6738
 epoch: 94, train_loss: 0.2846, test_loss: 1.1214, test_f1: 0.6612
 epoch: 95, train_loss: 0.2983, test_loss: 1.1973, test_f1: 0.6698
 epoch: 96, train_loss: 0.2909, test_loss: 1.1003, test_f1: 0.7010
 epoch: 97, train_loss: 0.2703, test_loss: 1.2566, test_f1: 0.6569
 epoch: 98, train_loss: 0.2983, test_loss: 1.1395, test_f1: 0.6862
 epoch: 99, train_loss: 0.2905, test_loss: 1.1593, test_f1: 0.6803
##################ITERATION #8 ****************************************
 epoch: 0, train_loss: 1.2890, test_loss: 1.1833, test_f1: 0.4288
 epoch: 1, train_loss: 1.0033, test_loss: 0.9644, test_f1: 0.5360
 epoch: 2, train_loss: 0.9471, test_loss: 0.9437, test_f1: 0.5222
 epoch: 3, train_loss: 0.9314, test_loss: 0.9184, test_f1: 0.5531
 epoch: 4, train_loss: 0.9063, test_loss: 0.9024, test_f1: 0.5454
 epoch: 5, train_loss: 0.8685, test_loss: 0.8335, test_f1: 0.5840
 epoch: 6, train_loss: 0.8606, test_loss: 0.8797, test_f1: 0.5733
 epoch: 7, train_loss: 0.8367, test_loss: 0.8898, test_f1: 0.5864
 epoch: 8, train_loss: 0.8228, test_loss: 0.8594, test_f1: 0.5733
 epoch: 9, train_loss: 0.8152, test_loss: 0.8432, test_f1: 0.5662
 epoch: 10, train_loss: 0.7907, test_loss: 0.8190, test_f1: 0.6222
 epoch: 11, train_loss: 0.7862, test_loss: 0.7746, test_f1: 0.6383
 epoch: 12, train_loss: 0.7771, test_loss: 0.8169, test_f1: 0.6217
 epoch: 13, train_loss: 0.7423, test_loss: 0.8696, test_f1: 0.5995
 epoch: 14, train_loss: 0.7410, test_loss: 0.8294, test_f1: 0.6232
 epoch: 15, train_loss: 0.7272, test_loss: 0.7876, test_f1: 0.6430
 epoch: 16, train_loss: 0.7188, test_loss: 0.7949, test_f1: 0.6187
 epoch: 17, train_loss: 0.7182, test_loss: 0.7782, test_f1: 0.6436
 epoch: 18, train_loss: 0.6785, test_loss: 0.7707, test_f1: 0.6441
 epoch: 19, train_loss: 0.6950, test_loss: 0.7148, test_f1: 0.6419
 epoch: 20, train_loss: 0.6603, test_loss: 0.8449, test_f1: 0.6278
 epoch: 21, train_loss: 0.6698, test_loss: 0.8427, test_f1: 0.6402
 epoch: 22, train_loss: 0.6546, test_loss: 0.8205, test_f1: 0.6262
 epoch: 23, train_loss: 0.6451, test_loss: 0.8263, test_f1: 0.6077
 epoch: 24, train_loss: 0.6356, test_loss: 0.7792, test_f1: 0.6677
 epoch: 25, train_loss: 0.6283, test_loss: 0.7381, test_f1: 0.6542
 epoch: 26, train_loss: 0.6092, test_loss: 0.7956, test_f1: 0.6265
 epoch: 27, train_loss: 0.6042, test_loss: 0.8206, test_f1: 0.6240
 epoch: 28, train_loss: 0.5979, test_loss: 0.7629, test_f1: 0.6583
 epoch: 29, train_loss: 0.5748, test_loss: 0.7811, test_f1: 0.6542
 epoch: 30, train_loss: 0.5767, test_loss: 0.8084, test_f1: 0.6335
 epoch: 31, train_loss: 0.5761, test_loss: 0.7082, test_f1: 0.6508
 epoch: 32, train_loss: 0.5579, test_loss: 0.7311, test_f1: 0.6647
 epoch: 33, train_loss: 0.5492, test_loss: 0.8291, test_f1: 0.6296
 epoch: 34, train_loss: 0.5280, test_loss: 0.7705, test_f1: 0.6350
 epoch: 35, train_loss: 0.5525, test_loss: 0.9123, test_f1: 0.6132
 epoch: 36, train_loss: 0.5492, test_loss: 0.7892, test_f1: 0.6630
 epoch: 37, train_loss: 0.5403, test_loss: 0.9899, test_f1: 0.6034
 epoch: 38, train_loss: 0.5285, test_loss: 0.8325, test_f1: 0.6422
 epoch: 39, train_loss: 0.5132, test_loss: 0.8891, test_f1: 0.6274
 epoch: 40, train_loss: 0.4998, test_loss: 0.7975, test_f1: 0.6380
 epoch: 41, train_loss: 0.4958, test_loss: 0.8388, test_f1: 0.6584
 epoch: 42, train_loss: 0.5015, test_loss: 0.8865, test_f1: 0.6376
 epoch: 43, train_loss: 0.5073, test_loss: 0.8647, test_f1: 0.6373
 epoch: 44, train_loss: 0.4722, test_loss: 0.8207, test_f1: 0.6734
 epoch: 45, train_loss: 0.4752, test_loss: 0.9037, test_f1: 0.6478
 epoch: 46, train_loss: 0.4694, test_loss: 0.9104, test_f1: 0.6285
 epoch: 47, train_loss: 0.4826, test_loss: 0.8489, test_f1: 0.6781
 epoch: 48, train_loss: 0.4677, test_loss: 0.9126, test_f1: 0.6200
 epoch: 49, train_loss: 0.4515, test_loss: 0.9077, test_f1: 0.6434
 epoch: 50, train_loss: 0.4442, test_loss: 0.8983, test_f1: 0.6356
 epoch: 51, train_loss: 0.4142, test_loss: 0.9181, test_f1: 0.6364
 epoch: 52, train_loss: 0.3816, test_loss: 1.0402, test_f1: 0.6386
 epoch: 53, train_loss: 0.3739, test_loss: 1.0395, test_f1: 0.6485
 epoch: 54, train_loss: 0.3721, test_loss: 0.9744, test_f1: 0.6543
 epoch: 55, train_loss: 0.3563, test_loss: 0.9986, test_f1: 0.6495
 epoch: 56, train_loss: 0.3612, test_loss: 1.0308, test_f1: 0.6492
 epoch: 57, train_loss: 0.3426, test_loss: 1.1222, test_f1: 0.6495
 epoch: 58, train_loss: 0.3528, test_loss: 1.1403, test_f1: 0.6294
 epoch: 59, train_loss: 0.3459, test_loss: 1.0647, test_f1: 0.6539
 epoch: 60, train_loss: 0.3376, test_loss: 1.0695, test_f1: 0.6496
 epoch: 61, train_loss: 0.3270, test_loss: 1.1038, test_f1: 0.6622
 epoch: 62, train_loss: 0.3556, test_loss: 0.9895, test_f1: 0.6740
 epoch: 63, train_loss: 0.3430, test_loss: 1.0676, test_f1: 0.6489
 epoch: 64, train_loss: 0.3301, test_loss: 1.1048, test_f1: 0.6521
 epoch: 65, train_loss: 0.3396, test_loss: 1.0133, test_f1: 0.6525
 epoch: 66, train_loss: 0.3125, test_loss: 1.1796, test_f1: 0.6666
 epoch: 67, train_loss: 0.3101, test_loss: 1.1880, test_f1: 0.6424
 epoch: 68, train_loss: 0.3186, test_loss: 1.1303, test_f1: 0.6559
 epoch: 69, train_loss: 0.3265, test_loss: 1.1737, test_f1: 0.6409
 epoch: 70, train_loss: 0.3066, test_loss: 1.1610, test_f1: 0.6543
 epoch: 71, train_loss: 0.3143, test_loss: 1.1822, test_f1: 0.6323
 epoch: 72, train_loss: 0.3038, test_loss: 1.1664, test_f1: 0.6437
 epoch: 73, train_loss: 0.2914, test_loss: 1.2427, test_f1: 0.6408
 epoch: 74, train_loss: 0.2898, test_loss: 1.3249, test_f1: 0.6389
 epoch: 75, train_loss: 0.3037, test_loss: 1.2544, test_f1: 0.6694
 epoch: 76, train_loss: 0.2815, test_loss: 1.2638, test_f1: 0.6698
 epoch: 77, train_loss: 0.2980, test_loss: 1.2134, test_f1: 0.6534
 epoch: 78, train_loss: 0.3055, test_loss: 1.1599, test_f1: 0.6715
 epoch: 79, train_loss: 0.2817, test_loss: 1.2247, test_f1: 0.6461
 epoch: 80, train_loss: 0.2739, test_loss: 1.2960, test_f1: 0.6400
 epoch: 81, train_loss: 0.2803, test_loss: 1.3675, test_f1: 0.6450
 epoch: 82, train_loss: 0.2645, test_loss: 1.2503, test_f1: 0.6518
 epoch: 83, train_loss: 0.2763, test_loss: 1.2860, test_f1: 0.6563
 epoch: 84, train_loss: 0.2777, test_loss: 1.2928, test_f1: 0.6425
 epoch: 85, train_loss: 0.2734, test_loss: 1.2591, test_f1: 0.6524
 epoch: 86, train_loss: 0.2733, test_loss: 1.4218, test_f1: 0.6431
 epoch: 87, train_loss: 0.2565, test_loss: 1.4322, test_f1: 0.6613
 epoch: 88, train_loss: 0.2747, test_loss: 1.4019, test_f1: 0.6505
 epoch: 89, train_loss: 0.2540, test_loss: 1.4866, test_f1: 0.6445
 epoch: 90, train_loss: 0.2516, test_loss: 1.4299, test_f1: 0.6434
 epoch: 91, train_loss: 0.2586, test_loss: 1.4255, test_f1: 0.6394
 epoch: 92, train_loss: 0.2385, test_loss: 1.4983, test_f1: 0.6577
 epoch: 93, train_loss: 0.2422, test_loss: 1.5733, test_f1: 0.6469
 epoch: 94, train_loss: 0.2517, test_loss: 1.5853, test_f1: 0.6332
 epoch: 95, train_loss: 0.2423, test_loss: 1.5726, test_f1: 0.6404
 epoch: 96, train_loss: 0.2428, test_loss: 1.6235, test_f1: 0.6433
 epoch: 97, train_loss: 0.2542, test_loss: 1.5526, test_f1: 0.6295
 epoch: 98, train_loss: 0.2503, test_loss: 1.5197, test_f1: 0.6358
 epoch: 99, train_loss: 0.2494, test_loss: 1.5628, test_f1: 0.6360
##################ITERATION #9 ****************************************
 epoch: 0, train_loss: 1.2996, test_loss: 1.1423, test_f1: 0.4129
 epoch: 1, train_loss: 0.9933, test_loss: 0.9667, test_f1: 0.5226
 epoch: 2, train_loss: 0.9369, test_loss: 0.9468, test_f1: 0.5501
 epoch: 3, train_loss: 0.9190, test_loss: 0.9173, test_f1: 0.5256
 epoch: 4, train_loss: 0.8951, test_loss: 0.9080, test_f1: 0.5475
 epoch: 5, train_loss: 0.8823, test_loss: 0.8542, test_f1: 0.6134
 epoch: 6, train_loss: 0.8456, test_loss: 0.8710, test_f1: 0.5557
 epoch: 7, train_loss: 0.8298, test_loss: 0.7837, test_f1: 0.6401
 epoch: 8, train_loss: 0.8300, test_loss: 0.8175, test_f1: 0.6160
 epoch: 9, train_loss: 0.8295, test_loss: 0.8035, test_f1: 0.6039
 epoch: 10, train_loss: 0.8063, test_loss: 0.7767, test_f1: 0.6460
 epoch: 11, train_loss: 0.7910, test_loss: 0.7734, test_f1: 0.6038
 epoch: 12, train_loss: 0.7723, test_loss: 0.7560, test_f1: 0.6297
 epoch: 13, train_loss: 0.7537, test_loss: 0.8072, test_f1: 0.6137
 epoch: 14, train_loss: 0.7523, test_loss: 0.8202, test_f1: 0.6061
 epoch: 15, train_loss: 0.7288, test_loss: 0.7917, test_f1: 0.6243
 epoch: 16, train_loss: 0.7128, test_loss: 0.8303, test_f1: 0.6070
 epoch: 17, train_loss: 0.7156, test_loss: 0.7342, test_f1: 0.6422
 epoch: 18, train_loss: 0.7089, test_loss: 0.8140, test_f1: 0.6325
 epoch: 19, train_loss: 0.7027, test_loss: 0.7369, test_f1: 0.6612
 epoch: 20, train_loss: 0.6868, test_loss: 0.7944, test_f1: 0.6256
 epoch: 21, train_loss: 0.6727, test_loss: 0.7246, test_f1: 0.6640
 epoch: 22, train_loss: 0.6612, test_loss: 0.7548, test_f1: 0.6464
 epoch: 23, train_loss: 0.6392, test_loss: 0.7848, test_f1: 0.6289
 epoch: 24, train_loss: 0.6516, test_loss: 0.7436, test_f1: 0.6499
 epoch: 25, train_loss: 0.6288, test_loss: 0.7535, test_f1: 0.6652
 epoch: 26, train_loss: 0.6293, test_loss: 0.7193, test_f1: 0.6812
 epoch: 27, train_loss: 0.5915, test_loss: 0.7279, test_f1: 0.6740
 epoch: 28, train_loss: 0.6040, test_loss: 0.7735, test_f1: 0.6328
 epoch: 29, train_loss: 0.5943, test_loss: 0.8658, test_f1: 0.6273
 epoch: 30, train_loss: 0.6040, test_loss: 0.8350, test_f1: 0.6559
 epoch: 31, train_loss: 0.5892, test_loss: 0.8221, test_f1: 0.6249
 epoch: 32, train_loss: 0.5962, test_loss: 0.8124, test_f1: 0.6675
 epoch: 33, train_loss: 0.5974, test_loss: 0.7925, test_f1: 0.6391
 epoch: 34, train_loss: 0.5616, test_loss: 0.7149, test_f1: 0.7008
 epoch: 35, train_loss: 0.5655, test_loss: 0.7364, test_f1: 0.6806
 epoch: 36, train_loss: 0.5451, test_loss: 0.7976, test_f1: 0.6453
 epoch: 37, train_loss: 0.5360, test_loss: 0.8043, test_f1: 0.6427
 epoch: 38, train_loss: 0.5203, test_loss: 0.8275, test_f1: 0.6551
 epoch: 39, train_loss: 0.5342, test_loss: 0.8359, test_f1: 0.6505
 epoch: 40, train_loss: 0.5328, test_loss: 0.8786, test_f1: 0.6419
 epoch: 41, train_loss: 0.5336, test_loss: 0.7340, test_f1: 0.6461
 epoch: 42, train_loss: 0.5330, test_loss: 0.7699, test_f1: 0.6839
 epoch: 43, train_loss: 0.5053, test_loss: 0.7615, test_f1: 0.6795
 epoch: 44, train_loss: 0.4965, test_loss: 0.8641, test_f1: 0.6658
 epoch: 45, train_loss: 0.4946, test_loss: 0.7282, test_f1: 0.6955
 epoch: 46, train_loss: 0.4897, test_loss: 0.8400, test_f1: 0.6373
 epoch: 47, train_loss: 0.4763, test_loss: 0.8670, test_f1: 0.6684
 epoch: 48, train_loss: 0.4810, test_loss: 0.9133, test_f1: 0.6498
 epoch: 49, train_loss: 0.4760, test_loss: 0.8444, test_f1: 0.6576
 epoch: 50, train_loss: 0.4612, test_loss: 0.8413, test_f1: 0.6514
 epoch: 51, train_loss: 0.4344, test_loss: 0.8824, test_f1: 0.6691
 epoch: 52, train_loss: 0.4053, test_loss: 0.8958, test_f1: 0.6509
 epoch: 53, train_loss: 0.3832, test_loss: 0.9572, test_f1: 0.6696
 epoch: 54, train_loss: 0.3993, test_loss: 0.9543, test_f1: 0.6645
 epoch: 55, train_loss: 0.3829, test_loss: 0.9807, test_f1: 0.6725
 epoch: 56, train_loss: 0.3929, test_loss: 0.9157, test_f1: 0.6544
 epoch: 57, train_loss: 0.3537, test_loss: 0.9431, test_f1: 0.6576
 epoch: 58, train_loss: 0.3769, test_loss: 1.0235, test_f1: 0.6669
 epoch: 59, train_loss: 0.3549, test_loss: 0.9683, test_f1: 0.6588
 epoch: 60, train_loss: 0.3535, test_loss: 1.0697, test_f1: 0.6560
 epoch: 61, train_loss: 0.3616, test_loss: 1.0321, test_f1: 0.6755
 epoch: 62, train_loss: 0.3622, test_loss: 1.0661, test_f1: 0.6519
 epoch: 63, train_loss: 0.3719, test_loss: 0.9974, test_f1: 0.6469
 epoch: 64, train_loss: 0.3293, test_loss: 1.0923, test_f1: 0.6581
 epoch: 65, train_loss: 0.3488, test_loss: 1.1251, test_f1: 0.6460
 epoch: 66, train_loss: 0.3262, test_loss: 1.0087, test_f1: 0.6564
 epoch: 67, train_loss: 0.3450, test_loss: 1.0815, test_f1: 0.6521
 epoch: 68, train_loss: 0.3352, test_loss: 0.9785, test_f1: 0.6724
 epoch: 69, train_loss: 0.3312, test_loss: 1.1705, test_f1: 0.6480
 epoch: 70, train_loss: 0.3397, test_loss: 1.0640, test_f1: 0.6586
 epoch: 71, train_loss: 0.3190, test_loss: 1.0897, test_f1: 0.6636
 epoch: 72, train_loss: 0.3181, test_loss: 1.0945, test_f1: 0.6639
 epoch: 73, train_loss: 0.3119, test_loss: 1.0063, test_f1: 0.6578
 epoch: 74, train_loss: 0.3014, test_loss: 1.1836, test_f1: 0.6572
 epoch: 75, train_loss: 0.3197, test_loss: 0.9771, test_f1: 0.6567
 epoch: 76, train_loss: 0.3297, test_loss: 1.0844, test_f1: 0.6572
 epoch: 77, train_loss: 0.3038, test_loss: 1.1659, test_f1: 0.6682
 epoch: 78, train_loss: 0.2983, test_loss: 1.2645, test_f1: 0.6447
 epoch: 79, train_loss: 0.3128, test_loss: 1.2164, test_f1: 0.6593
 epoch: 80, train_loss: 0.3276, test_loss: 1.1850, test_f1: 0.6654
 epoch: 81, train_loss: 0.2900, test_loss: 1.1684, test_f1: 0.6581
 epoch: 82, train_loss: 0.3044, test_loss: 1.1597, test_f1: 0.6652
 epoch: 83, train_loss: 0.3048, test_loss: 1.2143, test_f1: 0.6646
 epoch: 84, train_loss: 0.2768, test_loss: 1.1406, test_f1: 0.6584
 epoch: 85, train_loss: 0.2723, test_loss: 1.2116, test_f1: 0.6600
 epoch: 86, train_loss: 0.2965, test_loss: 1.2259, test_f1: 0.6637
 epoch: 87, train_loss: 0.2657, test_loss: 1.2834, test_f1: 0.6473
 epoch: 88, train_loss: 0.2631, test_loss: 1.3891, test_f1: 0.6366
 epoch: 89, train_loss: 0.2885, test_loss: 1.2993, test_f1: 0.6628
 epoch: 90, train_loss: 0.2652, test_loss: 1.2561, test_f1: 0.6554
 epoch: 91, train_loss: 0.2776, test_loss: 1.3485, test_f1: 0.6580
 epoch: 92, train_loss: 0.2661, test_loss: 1.2760, test_f1: 0.6619
 epoch: 93, train_loss: 0.3055, test_loss: 1.3947, test_f1: 0.6509
 epoch: 94, train_loss: 0.2719, test_loss: 1.3268, test_f1: 0.6626
 epoch: 95, train_loss: 0.2630, test_loss: 1.4002, test_f1: 0.6698
 epoch: 96, train_loss: 0.2445, test_loss: 1.3793, test_f1: 0.6527
 epoch: 97, train_loss: 0.2711, test_loss: 1.4786, test_f1: 0.6670
 epoch: 98, train_loss: 0.2735, test_loss: 1.3399, test_f1: 0.6678
 epoch: 99, train_loss: 0.2668, test_loss: 1.3654, test_f1: 0.6663

Training completed in 1431.11 seconds
Best F1: 0.7298 at epoch 78
Mean F1 across iterations: 0.6980  0.0161
========================FINAL RESULTS================================
FEGIN weighted F1: 0.7298  0.0161
python main.py --data ltspice_examples --representation component_pin_net --model FEGIN --layers 6 --hiddens 64 --batch_size 64 --lr 0.001 --emb_size 512 --epochs 100 --save_appendix component_pin_net_L6_H64_BS64_LR0.001_E512 --no_val
-----



STDERR:
  File "main.py", line 370, in <module>
    main()
  File "main.py", line 254, in main
    dataset = dataset_class(
  File "/home/philip/projects/llm_inference_code_repo/Circuit-Completion-Using-GNNs/component_classification_with_link_prediction_head/evaluation/FEGIN/kernel/circuit_datasets.py", line 15, in __init__
    self.data, self.slices = torch.load(self.processed_paths[0])
  File "/home/philip/.local/lib/python3.8/site-packages/torch/serialization.py", line 1040, in load
    warnings.warn(
  File "/usr/lib/python3.8/warnings.py", line 109, in _showwarnmsg
    sw(msg.message, msg.category, msg.filename, msg.lineno,
  File "main.py", line 47, in warn_with_traceback
    traceback.print_stack(file=log)
/home/philip/projects/llm_inference_code_repo/Circuit-Completion-Using-GNNs/component_classification_with_link_prediction_head/evaluation/FEGIN/kernel/circuit_datasets.py:15: FutureWarning: You are using `torch.load` with `weights_only=False` (the current default value), which uses the default pickle module implicitly. It is possible to construct malicious pickle data which will execute arbitrary code during unpickling (See https://github.com/pytorch/pytorch/blob/main/SECURITY.md#untrusted-models for more details). In a future release, the default value for `weights_only` will be flipped to `True`. This limits the functions that could be executed during unpickling. Arbitrary objects will no longer be allowed to be loaded via this mode unless they are explicitly allowlisted by the user via `torch.serialization.add_safe_globals`. We recommend you start setting `weights_only=True` for any use case where you don't have full control of the loaded file. Please open an issue on GitHub for any issues related to this experimental feature.
  self.data, self.slices = torch.load(self.processed_paths[0])
