STDOUT:
Results will be saved in /home/philip/projects/ltspice_examples_code_repo/Circuit-Completion-Using-GNNs/component_classification_with_link_prediction_head/evaluation/FEGIN/results/model_FEGIN_dataset_ltspice_examples
Command line input: python main.py --data ltspice_examples --representation component_component --model FEGIN --layers 6 --hiddens 32 --batch_size 256 --lr 0.0001 --emb_size 250 --epochs 100 --save_appendix component_component_L6_H32_BS256_LR0.0001_E250 --no_val
 is saved.
-----
ltspice_examples - FEGIN
Using 6 layers, 32 hidden units, h = 2
Loading component_component representation dataset
ENTERED
Training FEGIN on component_component representation
Train: 3556, Test: 845
##################ITERATION #0 ****************************************
 epoch: 0, train_loss: 1.4328, test_loss: 1.4239, test_f1: 0.1015
 epoch: 1, train_loss: 1.4289, test_loss: 1.4222, test_f1: 0.1015
 epoch: 2, train_loss: 1.4263, test_loss: 1.4205, test_f1: 0.1015
 epoch: 3, train_loss: 1.4240, test_loss: 1.4182, test_f1: 0.1011
 epoch: 4, train_loss: 1.4221, test_loss: 1.4156, test_f1: 0.1135
 epoch: 5, train_loss: 1.4192, test_loss: 1.4123, test_f1: 0.1136
 epoch: 6, train_loss: 1.4172, test_loss: 1.4099, test_f1: 0.1135
 epoch: 7, train_loss: 1.4148, test_loss: 1.4074, test_f1: 0.1196
 epoch: 8, train_loss: 1.4118, test_loss: 1.4052, test_f1: 0.1446
 epoch: 9, train_loss: 1.4099, test_loss: 1.4027, test_f1: 0.1464
 epoch: 10, train_loss: 1.4074, test_loss: 1.4001, test_f1: 0.1463
 epoch: 11, train_loss: 1.4038, test_loss: 1.3964, test_f1: 0.1463
 epoch: 12, train_loss: 1.4013, test_loss: 1.3931, test_f1: 0.1564
 epoch: 13, train_loss: 1.3973, test_loss: 1.3901, test_f1: 0.1563
 epoch: 14, train_loss: 1.3935, test_loss: 1.3859, test_f1: 0.1563
 epoch: 15, train_loss: 1.3901, test_loss: 1.3814, test_f1: 0.1574
 epoch: 16, train_loss: 1.3854, test_loss: 1.3764, test_f1: 0.1568
 epoch: 17, train_loss: 1.3795, test_loss: 1.3714, test_f1: 0.1614
 epoch: 18, train_loss: 1.3751, test_loss: 1.3658, test_f1: 0.1658
 epoch: 19, train_loss: 1.3676, test_loss: 1.3593, test_f1: 0.1658
 epoch: 20, train_loss: 1.3592, test_loss: 1.3521, test_f1: 0.1650
 epoch: 21, train_loss: 1.3530, test_loss: 1.3441, test_f1: 0.1868
 epoch: 22, train_loss: 1.3461, test_loss: 1.3357, test_f1: 0.2744
 epoch: 23, train_loss: 1.3378, test_loss: 1.3277, test_f1: 0.3105
 epoch: 24, train_loss: 1.3291, test_loss: 1.3190, test_f1: 0.3399
 epoch: 25, train_loss: 1.3196, test_loss: 1.3097, test_f1: 0.3643
 epoch: 26, train_loss: 1.3115, test_loss: 1.3017, test_f1: 0.3638
 epoch: 27, train_loss: 1.3058, test_loss: 1.2927, test_f1: 0.3562
 epoch: 28, train_loss: 1.2977, test_loss: 1.2839, test_f1: 0.3534
 epoch: 29, train_loss: 1.2868, test_loss: 1.2767, test_f1: 0.3497
 epoch: 30, train_loss: 1.2839, test_loss: 1.2713, test_f1: 0.3312
 epoch: 31, train_loss: 1.2736, test_loss: 1.2648, test_f1: 0.3430
 epoch: 32, train_loss: 1.2709, test_loss: 1.2577, test_f1: 0.3204
 epoch: 33, train_loss: 1.2678, test_loss: 1.2514, test_f1: 0.3188
 epoch: 34, train_loss: 1.2586, test_loss: 1.2475, test_f1: 0.3203
 epoch: 35, train_loss: 1.2561, test_loss: 1.2430, test_f1: 0.3250
 epoch: 36, train_loss: 1.2472, test_loss: 1.2375, test_f1: 0.3250
 epoch: 37, train_loss: 1.2447, test_loss: 1.2330, test_f1: 0.3257
 epoch: 38, train_loss: 1.2416, test_loss: 1.2292, test_f1: 0.3279
 epoch: 39, train_loss: 1.2365, test_loss: 1.2247, test_f1: 0.3274
 epoch: 40, train_loss: 1.2344, test_loss: 1.2213, test_f1: 0.3279
 epoch: 41, train_loss: 1.2295, test_loss: 1.2189, test_f1: 0.3294
 epoch: 42, train_loss: 1.2278, test_loss: 1.2159, test_f1: 0.3337
 epoch: 43, train_loss: 1.2277, test_loss: 1.2126, test_f1: 0.3379
 epoch: 44, train_loss: 1.2194, test_loss: 1.2096, test_f1: 0.3361
 epoch: 45, train_loss: 1.2135, test_loss: 1.2059, test_f1: 0.3168
 epoch: 46, train_loss: 1.2153, test_loss: 1.2020, test_f1: 0.3157
 epoch: 47, train_loss: 1.2079, test_loss: 1.1996, test_f1: 0.3233
 epoch: 48, train_loss: 1.2097, test_loss: 1.1978, test_f1: 0.3191
 epoch: 49, train_loss: 1.2066, test_loss: 1.1963, test_f1: 0.3226
 epoch: 50, train_loss: 1.1975, test_loss: 1.1938, test_f1: 0.3204
 epoch: 51, train_loss: 1.2030, test_loss: 1.1929, test_f1: 0.3217
 epoch: 52, train_loss: 1.1990, test_loss: 1.1924, test_f1: 0.3222
 epoch: 53, train_loss: 1.1956, test_loss: 1.1910, test_f1: 0.3221
 epoch: 54, train_loss: 1.1891, test_loss: 1.1905, test_f1: 0.3260
 epoch: 55, train_loss: 1.1906, test_loss: 1.1889, test_f1: 0.3283
 epoch: 56, train_loss: 1.1911, test_loss: 1.1885, test_f1: 0.3286
 epoch: 57, train_loss: 1.1921, test_loss: 1.1860, test_f1: 0.3288
 epoch: 58, train_loss: 1.1879, test_loss: 1.1851, test_f1: 0.3278
 epoch: 59, train_loss: 1.1912, test_loss: 1.1843, test_f1: 0.3267
 epoch: 60, train_loss: 1.1819, test_loss: 1.1827, test_f1: 0.3265
 epoch: 61, train_loss: 1.1849, test_loss: 1.1821, test_f1: 0.3257
 epoch: 62, train_loss: 1.1872, test_loss: 1.1819, test_f1: 0.3270
 epoch: 63, train_loss: 1.1812, test_loss: 1.1816, test_f1: 0.3304
 epoch: 64, train_loss: 1.1813, test_loss: 1.1824, test_f1: 0.3319
 epoch: 65, train_loss: 1.1801, test_loss: 1.1819, test_f1: 0.3316
 epoch: 66, train_loss: 1.1778, test_loss: 1.1807, test_f1: 0.3332
 epoch: 67, train_loss: 1.1783, test_loss: 1.1787, test_f1: 0.3307
 epoch: 68, train_loss: 1.1757, test_loss: 1.1785, test_f1: 0.3307
 epoch: 69, train_loss: 1.1761, test_loss: 1.1778, test_f1: 0.3343
 epoch: 70, train_loss: 1.1759, test_loss: 1.1762, test_f1: 0.3348
 epoch: 71, train_loss: 1.1697, test_loss: 1.1759, test_f1: 0.3346
 epoch: 72, train_loss: 1.1693, test_loss: 1.1744, test_f1: 0.3350
 epoch: 73, train_loss: 1.1709, test_loss: 1.1740, test_f1: 0.3340
 epoch: 74, train_loss: 1.1653, test_loss: 1.1738, test_f1: 0.3345
 epoch: 75, train_loss: 1.1667, test_loss: 1.1738, test_f1: 0.3354
 epoch: 76, train_loss: 1.1612, test_loss: 1.1735, test_f1: 0.3334
 epoch: 77, train_loss: 1.1599, test_loss: 1.1746, test_f1: 0.3336
 epoch: 78, train_loss: 1.1637, test_loss: 1.1744, test_f1: 0.3327
 epoch: 79, train_loss: 1.1633, test_loss: 1.1733, test_f1: 0.3350
 epoch: 80, train_loss: 1.1606, test_loss: 1.1723, test_f1: 0.3374
 epoch: 81, train_loss: 1.1620, test_loss: 1.1727, test_f1: 0.3376
 epoch: 82, train_loss: 1.1573, test_loss: 1.1731, test_f1: 0.3371
 epoch: 83, train_loss: 1.1533, test_loss: 1.1715, test_f1: 0.3496
 epoch: 84, train_loss: 1.1541, test_loss: 1.1710, test_f1: 0.3522
 epoch: 85, train_loss: 1.1518, test_loss: 1.1698, test_f1: 0.3480
 epoch: 86, train_loss: 1.1493, test_loss: 1.1685, test_f1: 0.3521
 epoch: 87, train_loss: 1.1566, test_loss: 1.1684, test_f1: 0.3521
 epoch: 88, train_loss: 1.1473, test_loss: 1.1669, test_f1: 0.3484
 epoch: 89, train_loss: 1.1471, test_loss: 1.1682, test_f1: 0.3478
 epoch: 90, train_loss: 1.1445, test_loss: 1.1677, test_f1: 0.3566
 epoch: 91, train_loss: 1.1401, test_loss: 1.1675, test_f1: 0.3649
 epoch: 92, train_loss: 1.1445, test_loss: 1.1667, test_f1: 0.3557
 epoch: 93, train_loss: 1.1436, test_loss: 1.1665, test_f1: 0.3609
 epoch: 94, train_loss: 1.1465, test_loss: 1.1660, test_f1: 0.3694
 epoch: 95, train_loss: 1.1432, test_loss: 1.1652, test_f1: 0.3718
 epoch: 96, train_loss: 1.1445, test_loss: 1.1665, test_f1: 0.3751
 epoch: 97, train_loss: 1.1379, test_loss: 1.1655, test_f1: 0.3675
 epoch: 98, train_loss: 1.1338, test_loss: 1.1655, test_f1: 0.3744
 epoch: 99, train_loss: 1.1352, test_loss: 1.1638, test_f1: 0.3691
##################ITERATION #1 ****************************************
 epoch: 0, train_loss: 1.3880, test_loss: 1.3872, test_f1: 0.1585
 epoch: 1, train_loss: 1.3821, test_loss: 1.3860, test_f1: 0.1636
 epoch: 2, train_loss: 1.3767, test_loss: 1.3814, test_f1: 0.1612
 epoch: 3, train_loss: 1.3722, test_loss: 1.3723, test_f1: 0.2045
 epoch: 4, train_loss: 1.3668, test_loss: 1.3651, test_f1: 0.2223
 epoch: 5, train_loss: 1.3610, test_loss: 1.3579, test_f1: 0.2666
 epoch: 6, train_loss: 1.3548, test_loss: 1.3504, test_f1: 0.2865
 epoch: 7, train_loss: 1.3493, test_loss: 1.3414, test_f1: 0.2737
 epoch: 8, train_loss: 1.3423, test_loss: 1.3336, test_f1: 0.2723
 epoch: 9, train_loss: 1.3339, test_loss: 1.3254, test_f1: 0.2817
 epoch: 10, train_loss: 1.3255, test_loss: 1.3176, test_f1: 0.2916
 epoch: 11, train_loss: 1.3179, test_loss: 1.3102, test_f1: 0.3147
 epoch: 12, train_loss: 1.3095, test_loss: 1.3020, test_f1: 0.3043
 epoch: 13, train_loss: 1.3025, test_loss: 1.2943, test_f1: 0.3064
 epoch: 14, train_loss: 1.2944, test_loss: 1.2871, test_f1: 0.2813
 epoch: 15, train_loss: 1.2880, test_loss: 1.2802, test_f1: 0.2778
 epoch: 16, train_loss: 1.2817, test_loss: 1.2736, test_f1: 0.2694
 epoch: 17, train_loss: 1.2723, test_loss: 1.2681, test_f1: 0.2668
 epoch: 18, train_loss: 1.2675, test_loss: 1.2627, test_f1: 0.2695
 epoch: 19, train_loss: 1.2580, test_loss: 1.2581, test_f1: 0.2714
 epoch: 20, train_loss: 1.2575, test_loss: 1.2533, test_f1: 0.2734
 epoch: 21, train_loss: 1.2500, test_loss: 1.2503, test_f1: 0.2741
 epoch: 22, train_loss: 1.2478, test_loss: 1.2467, test_f1: 0.2741
 epoch: 23, train_loss: 1.2420, test_loss: 1.2445, test_f1: 0.2681
 epoch: 24, train_loss: 1.2405, test_loss: 1.2419, test_f1: 0.2720
 epoch: 25, train_loss: 1.2426, test_loss: 1.2384, test_f1: 0.2713
 epoch: 26, train_loss: 1.2398, test_loss: 1.2359, test_f1: 0.2700
 epoch: 27, train_loss: 1.2316, test_loss: 1.2339, test_f1: 0.2746
 epoch: 28, train_loss: 1.2250, test_loss: 1.2320, test_f1: 0.2791
 epoch: 29, train_loss: 1.2239, test_loss: 1.2292, test_f1: 0.2909
 epoch: 30, train_loss: 1.2233, test_loss: 1.2271, test_f1: 0.2975
 epoch: 31, train_loss: 1.2236, test_loss: 1.2260, test_f1: 0.3128
 epoch: 32, train_loss: 1.2163, test_loss: 1.2237, test_f1: 0.3134
 epoch: 33, train_loss: 1.2143, test_loss: 1.2210, test_f1: 0.3114
 epoch: 34, train_loss: 1.2105, test_loss: 1.2190, test_f1: 0.3133
 epoch: 35, train_loss: 1.2081, test_loss: 1.2170, test_f1: 0.3153
 epoch: 36, train_loss: 1.2091, test_loss: 1.2140, test_f1: 0.3249
 epoch: 37, train_loss: 1.2014, test_loss: 1.2123, test_f1: 0.3265
 epoch: 38, train_loss: 1.1993, test_loss: 1.2104, test_f1: 0.3262
 epoch: 39, train_loss: 1.1986, test_loss: 1.2083, test_f1: 0.3241
 epoch: 40, train_loss: 1.1975, test_loss: 1.2064, test_f1: 0.3299
 epoch: 41, train_loss: 1.1943, test_loss: 1.2043, test_f1: 0.3355
 epoch: 42, train_loss: 1.1893, test_loss: 1.2012, test_f1: 0.3420
 epoch: 43, train_loss: 1.1893, test_loss: 1.1981, test_f1: 0.3411
 epoch: 44, train_loss: 1.1854, test_loss: 1.1958, test_f1: 0.3433
 epoch: 45, train_loss: 1.1800, test_loss: 1.1938, test_f1: 0.3600
 epoch: 46, train_loss: 1.1764, test_loss: 1.1923, test_f1: 0.3639
 epoch: 47, train_loss: 1.1749, test_loss: 1.1896, test_f1: 0.3623
 epoch: 48, train_loss: 1.1710, test_loss: 1.1877, test_f1: 0.3818
 epoch: 49, train_loss: 1.1650, test_loss: 1.1866, test_f1: 0.3794
 epoch: 50, train_loss: 1.1656, test_loss: 1.1835, test_f1: 0.3827
 epoch: 51, train_loss: 1.1644, test_loss: 1.1817, test_f1: 0.3889
 epoch: 52, train_loss: 1.1653, test_loss: 1.1812, test_f1: 0.3840
 epoch: 53, train_loss: 1.1642, test_loss: 1.1802, test_f1: 0.3820
 epoch: 54, train_loss: 1.1584, test_loss: 1.1786, test_f1: 0.3878
 epoch: 55, train_loss: 1.1540, test_loss: 1.1777, test_f1: 0.3898
 epoch: 56, train_loss: 1.1519, test_loss: 1.1776, test_f1: 0.3898
 epoch: 57, train_loss: 1.1565, test_loss: 1.1768, test_f1: 0.3889
 epoch: 58, train_loss: 1.1549, test_loss: 1.1759, test_f1: 0.3852
 epoch: 59, train_loss: 1.1503, test_loss: 1.1752, test_f1: 0.3833
 epoch: 60, train_loss: 1.1490, test_loss: 1.1735, test_f1: 0.3908
 epoch: 61, train_loss: 1.1492, test_loss: 1.1721, test_f1: 0.3929
 epoch: 62, train_loss: 1.1563, test_loss: 1.1726, test_f1: 0.3907
 epoch: 63, train_loss: 1.1423, test_loss: 1.1712, test_f1: 0.3869
 epoch: 64, train_loss: 1.1488, test_loss: 1.1707, test_f1: 0.3948
 epoch: 65, train_loss: 1.1427, test_loss: 1.1699, test_f1: 0.3937
 epoch: 66, train_loss: 1.1393, test_loss: 1.1698, test_f1: 0.3869
 epoch: 67, train_loss: 1.1386, test_loss: 1.1690, test_f1: 0.3938
 epoch: 68, train_loss: 1.1428, test_loss: 1.1683, test_f1: 0.3940
 epoch: 69, train_loss: 1.1350, test_loss: 1.1685, test_f1: 0.3920
 epoch: 70, train_loss: 1.1379, test_loss: 1.1670, test_f1: 0.3938
 epoch: 71, train_loss: 1.1353, test_loss: 1.1661, test_f1: 0.3916
 epoch: 72, train_loss: 1.1357, test_loss: 1.1653, test_f1: 0.3858
 epoch: 73, train_loss: 1.1302, test_loss: 1.1648, test_f1: 0.3920
 epoch: 74, train_loss: 1.1299, test_loss: 1.1636, test_f1: 0.3898
 epoch: 75, train_loss: 1.1272, test_loss: 1.1634, test_f1: 0.3867
 epoch: 76, train_loss: 1.1253, test_loss: 1.1620, test_f1: 0.3886
 epoch: 77, train_loss: 1.1245, test_loss: 1.1613, test_f1: 0.3877
 epoch: 78, train_loss: 1.1196, test_loss: 1.1602, test_f1: 0.3865
 epoch: 79, train_loss: 1.1271, test_loss: 1.1595, test_f1: 0.3925
 epoch: 80, train_loss: 1.1226, test_loss: 1.1580, test_f1: 0.3878
 epoch: 81, train_loss: 1.1188, test_loss: 1.1580, test_f1: 0.3849
 epoch: 82, train_loss: 1.1180, test_loss: 1.1585, test_f1: 0.3833
 epoch: 83, train_loss: 1.1190, test_loss: 1.1597, test_f1: 0.3823
 epoch: 84, train_loss: 1.1168, test_loss: 1.1575, test_f1: 0.3815
 epoch: 85, train_loss: 1.1155, test_loss: 1.1555, test_f1: 0.3888
 epoch: 86, train_loss: 1.1093, test_loss: 1.1559, test_f1: 0.3890
 epoch: 87, train_loss: 1.1158, test_loss: 1.1547, test_f1: 0.3909
 epoch: 88, train_loss: 1.1128, test_loss: 1.1532, test_f1: 0.3929
 epoch: 89, train_loss: 1.1123, test_loss: 1.1538, test_f1: 0.3892
 epoch: 90, train_loss: 1.1082, test_loss: 1.1542, test_f1: 0.3911
 epoch: 91, train_loss: 1.1103, test_loss: 1.1520, test_f1: 0.3921
 epoch: 92, train_loss: 1.1083, test_loss: 1.1506, test_f1: 0.3911
 epoch: 93, train_loss: 1.1102, test_loss: 1.1516, test_f1: 0.3853
 epoch: 94, train_loss: 1.1034, test_loss: 1.1520, test_f1: 0.3933
 epoch: 95, train_loss: 1.1050, test_loss: 1.1531, test_f1: 0.3962
 epoch: 96, train_loss: 1.1037, test_loss: 1.1518, test_f1: 0.4000
 epoch: 97, train_loss: 1.0982, test_loss: 1.1511, test_f1: 0.4058
 epoch: 98, train_loss: 1.1021, test_loss: 1.1506, test_f1: 0.4040
 epoch: 99, train_loss: 1.0940, test_loss: 1.1520, test_f1: 0.4040
##################ITERATION #2 ****************************************
 epoch: 0, train_loss: 1.3436, test_loss: 1.3523, test_f1: 0.2274
 epoch: 1, train_loss: 1.3343, test_loss: 1.3431, test_f1: 0.2274
 epoch: 2, train_loss: 1.3270, test_loss: 1.3362, test_f1: 0.2274
 epoch: 3, train_loss: 1.3188, test_loss: 1.3290, test_f1: 0.2274
 epoch: 4, train_loss: 1.3132, test_loss: 1.3203, test_f1: 0.2654
 epoch: 5, train_loss: 1.3067, test_loss: 1.3088, test_f1: 0.2708
 epoch: 6, train_loss: 1.3024, test_loss: 1.2961, test_f1: 0.2755
 epoch: 7, train_loss: 1.2951, test_loss: 1.2888, test_f1: 0.2762
 epoch: 8, train_loss: 1.2892, test_loss: 1.2841, test_f1: 0.2517
 epoch: 9, train_loss: 1.2839, test_loss: 1.2775, test_f1: 0.2679
 epoch: 10, train_loss: 1.2786, test_loss: 1.2719, test_f1: 0.2707
 epoch: 11, train_loss: 1.2741, test_loss: 1.2673, test_f1: 0.2721
 epoch: 12, train_loss: 1.2673, test_loss: 1.2609, test_f1: 0.2913
 epoch: 13, train_loss: 1.2621, test_loss: 1.2545, test_f1: 0.3015
 epoch: 14, train_loss: 1.2580, test_loss: 1.2503, test_f1: 0.3103
 epoch: 15, train_loss: 1.2567, test_loss: 1.2448, test_f1: 0.3051
 epoch: 16, train_loss: 1.2506, test_loss: 1.2405, test_f1: 0.3228
 epoch: 17, train_loss: 1.2448, test_loss: 1.2353, test_f1: 0.3273
 epoch: 18, train_loss: 1.2441, test_loss: 1.2317, test_f1: 0.3272
 epoch: 19, train_loss: 1.2410, test_loss: 1.2277, test_f1: 0.3279
 epoch: 20, train_loss: 1.2381, test_loss: 1.2255, test_f1: 0.3342
 epoch: 21, train_loss: 1.2340, test_loss: 1.2219, test_f1: 0.3340
 epoch: 22, train_loss: 1.2288, test_loss: 1.2186, test_f1: 0.3390
 epoch: 23, train_loss: 1.2260, test_loss: 1.2159, test_f1: 0.3404
 epoch: 24, train_loss: 1.2232, test_loss: 1.2122, test_f1: 0.3384
 epoch: 25, train_loss: 1.2237, test_loss: 1.2090, test_f1: 0.3420
 epoch: 26, train_loss: 1.2156, test_loss: 1.2067, test_f1: 0.3419
 epoch: 27, train_loss: 1.2176, test_loss: 1.2034, test_f1: 0.3431
 epoch: 28, train_loss: 1.2135, test_loss: 1.2006, test_f1: 0.3469
 epoch: 29, train_loss: 1.2097, test_loss: 1.1997, test_f1: 0.3485
 epoch: 30, train_loss: 1.2052, test_loss: 1.1983, test_f1: 0.3497
 epoch: 31, train_loss: 1.2074, test_loss: 1.1954, test_f1: 0.3478
 epoch: 32, train_loss: 1.2003, test_loss: 1.1922, test_f1: 0.3489
 epoch: 33, train_loss: 1.2033, test_loss: 1.1903, test_f1: 0.3492
 epoch: 34, train_loss: 1.1958, test_loss: 1.1887, test_f1: 0.3477
 epoch: 35, train_loss: 1.1917, test_loss: 1.1852, test_f1: 0.3459
 epoch: 36, train_loss: 1.1918, test_loss: 1.1830, test_f1: 0.3445
 epoch: 37, train_loss: 1.1926, test_loss: 1.1819, test_f1: 0.3425
 epoch: 38, train_loss: 1.1900, test_loss: 1.1811, test_f1: 0.3485
 epoch: 39, train_loss: 1.1865, test_loss: 1.1786, test_f1: 0.3467
 epoch: 40, train_loss: 1.1859, test_loss: 1.1779, test_f1: 0.3432
 epoch: 41, train_loss: 1.1852, test_loss: 1.1765, test_f1: 0.3385
 epoch: 42, train_loss: 1.1858, test_loss: 1.1783, test_f1: 0.3435
 epoch: 43, train_loss: 1.1796, test_loss: 1.1777, test_f1: 0.3469
 epoch: 44, train_loss: 1.1777, test_loss: 1.1767, test_f1: 0.3431
 epoch: 45, train_loss: 1.1720, test_loss: 1.1768, test_f1: 0.3433
 epoch: 46, train_loss: 1.1799, test_loss: 1.1713, test_f1: 0.3439
 epoch: 47, train_loss: 1.1720, test_loss: 1.1669, test_f1: 0.3351
 epoch: 48, train_loss: 1.1681, test_loss: 1.1655, test_f1: 0.3365
 epoch: 49, train_loss: 1.1701, test_loss: 1.1684, test_f1: 0.3346
 epoch: 50, train_loss: 1.1709, test_loss: 1.1639, test_f1: 0.3411
 epoch: 51, train_loss: 1.1626, test_loss: 1.1622, test_f1: 0.3402
 epoch: 52, train_loss: 1.1612, test_loss: 1.1610, test_f1: 0.3447
 epoch: 53, train_loss: 1.1580, test_loss: 1.1598, test_f1: 0.3425
 epoch: 54, train_loss: 1.1630, test_loss: 1.1623, test_f1: 0.3447
 epoch: 55, train_loss: 1.1574, test_loss: 1.1607, test_f1: 0.3457
 epoch: 56, train_loss: 1.1592, test_loss: 1.1607, test_f1: 0.3437
 epoch: 57, train_loss: 1.1582, test_loss: 1.1603, test_f1: 0.3436
 epoch: 58, train_loss: 1.1581, test_loss: 1.1597, test_f1: 0.3435
 epoch: 59, train_loss: 1.1540, test_loss: 1.1576, test_f1: 0.3429
 epoch: 60, train_loss: 1.1564, test_loss: 1.1573, test_f1: 0.3524
 epoch: 61, train_loss: 1.1520, test_loss: 1.1565, test_f1: 0.3428
 epoch: 62, train_loss: 1.1503, test_loss: 1.1575, test_f1: 0.3417
 epoch: 63, train_loss: 1.1538, test_loss: 1.1568, test_f1: 0.3459
 epoch: 64, train_loss: 1.1476, test_loss: 1.1556, test_f1: 0.3476
 epoch: 65, train_loss: 1.1465, test_loss: 1.1539, test_f1: 0.3552
 epoch: 66, train_loss: 1.1468, test_loss: 1.1572, test_f1: 0.3523
 epoch: 67, train_loss: 1.1477, test_loss: 1.1549, test_f1: 0.3496
 epoch: 68, train_loss: 1.1473, test_loss: 1.1544, test_f1: 0.3482
 epoch: 69, train_loss: 1.1410, test_loss: 1.1517, test_f1: 0.3486
 epoch: 70, train_loss: 1.1426, test_loss: 1.1518, test_f1: 0.3507
 epoch: 71, train_loss: 1.1449, test_loss: 1.1511, test_f1: 0.3634
 epoch: 72, train_loss: 1.1403, test_loss: 1.1502, test_f1: 0.3680
 epoch: 73, train_loss: 1.1464, test_loss: 1.1503, test_f1: 0.3568
 epoch: 74, train_loss: 1.1402, test_loss: 1.1500, test_f1: 0.3602
 epoch: 75, train_loss: 1.1429, test_loss: 1.1497, test_f1: 0.3735
 epoch: 76, train_loss: 1.1424, test_loss: 1.1492, test_f1: 0.3693
 epoch: 77, train_loss: 1.1334, test_loss: 1.1490, test_f1: 0.3582
 epoch: 78, train_loss: 1.1400, test_loss: 1.1484, test_f1: 0.3514
 epoch: 79, train_loss: 1.1336, test_loss: 1.1512, test_f1: 0.3781
 epoch: 80, train_loss: 1.1370, test_loss: 1.1477, test_f1: 0.3666
 epoch: 81, train_loss: 1.1359, test_loss: 1.1479, test_f1: 0.3840
 epoch: 82, train_loss: 1.1335, test_loss: 1.1471, test_f1: 0.3861
 epoch: 83, train_loss: 1.1281, test_loss: 1.1449, test_f1: 0.3723
 epoch: 84, train_loss: 1.1296, test_loss: 1.1425, test_f1: 0.3706
 epoch: 85, train_loss: 1.1268, test_loss: 1.1433, test_f1: 0.3851
 epoch: 86, train_loss: 1.1269, test_loss: 1.1435, test_f1: 0.3879
 epoch: 87, train_loss: 1.1231, test_loss: 1.1445, test_f1: 0.3879
 epoch: 88, train_loss: 1.1271, test_loss: 1.1442, test_f1: 0.3878
 epoch: 89, train_loss: 1.1239, test_loss: 1.1442, test_f1: 0.3809
 epoch: 90, train_loss: 1.1274, test_loss: 1.1443, test_f1: 0.3818
 epoch: 91, train_loss: 1.1226, test_loss: 1.1433, test_f1: 0.3881
 epoch: 92, train_loss: 1.1214, test_loss: 1.1432, test_f1: 0.3862
 epoch: 93, train_loss: 1.1233, test_loss: 1.1391, test_f1: 0.3832
 epoch: 94, train_loss: 1.1205, test_loss: 1.1393, test_f1: 0.3832
 epoch: 95, train_loss: 1.1195, test_loss: 1.1411, test_f1: 0.3839
 epoch: 96, train_loss: 1.1197, test_loss: 1.1398, test_f1: 0.3895
 epoch: 97, train_loss: 1.1209, test_loss: 1.1421, test_f1: 0.3896
 epoch: 98, train_loss: 1.1185, test_loss: 1.1388, test_f1: 0.3897
 epoch: 99, train_loss: 1.1185, test_loss: 1.1383, test_f1: 0.3928
##################ITERATION #3 ****************************************
 epoch: 0, train_loss: 1.3422, test_loss: 1.3595, test_f1: 0.2274
 epoch: 1, train_loss: 1.3306, test_loss: 1.3528, test_f1: 0.2274
 epoch: 2, train_loss: 1.3253, test_loss: 1.3407, test_f1: 0.2269
 epoch: 3, train_loss: 1.3208, test_loss: 1.3305, test_f1: 0.2329
 epoch: 4, train_loss: 1.3121, test_loss: 1.3191, test_f1: 0.2337
 epoch: 5, train_loss: 1.3093, test_loss: 1.3091, test_f1: 0.2600
 epoch: 6, train_loss: 1.3014, test_loss: 1.2993, test_f1: 0.2630
 epoch: 7, train_loss: 1.2974, test_loss: 1.2904, test_f1: 0.2707
 epoch: 8, train_loss: 1.2908, test_loss: 1.2842, test_f1: 0.2769
 epoch: 9, train_loss: 1.2851, test_loss: 1.2781, test_f1: 0.2769
 epoch: 10, train_loss: 1.2819, test_loss: 1.2709, test_f1: 0.2973
 epoch: 11, train_loss: 1.2779, test_loss: 1.2658, test_f1: 0.2858
 epoch: 12, train_loss: 1.2724, test_loss: 1.2611, test_f1: 0.2951
 epoch: 13, train_loss: 1.2668, test_loss: 1.2566, test_f1: 0.2983
 epoch: 14, train_loss: 1.2646, test_loss: 1.2516, test_f1: 0.3001
 epoch: 15, train_loss: 1.2570, test_loss: 1.2492, test_f1: 0.3025
 epoch: 16, train_loss: 1.2535, test_loss: 1.2434, test_f1: 0.3125
 epoch: 17, train_loss: 1.2490, test_loss: 1.2361, test_f1: 0.3262
 epoch: 18, train_loss: 1.2404, test_loss: 1.2308, test_f1: 0.3264
 epoch: 19, train_loss: 1.2427, test_loss: 1.2261, test_f1: 0.3423
 epoch: 20, train_loss: 1.2375, test_loss: 1.2206, test_f1: 0.3417
 epoch: 21, train_loss: 1.2342, test_loss: 1.2182, test_f1: 0.3377
 epoch: 22, train_loss: 1.2323, test_loss: 1.2142, test_f1: 0.3358
 epoch: 23, train_loss: 1.2303, test_loss: 1.2124, test_f1: 0.3345
 epoch: 24, train_loss: 1.2266, test_loss: 1.2089, test_f1: 0.3365
 epoch: 25, train_loss: 1.2215, test_loss: 1.2045, test_f1: 0.3377
 epoch: 26, train_loss: 1.2179, test_loss: 1.2004, test_f1: 0.3404
 epoch: 27, train_loss: 1.2187, test_loss: 1.2009, test_f1: 0.3362
 epoch: 28, train_loss: 1.2137, test_loss: 1.1969, test_f1: 0.3453
 epoch: 29, train_loss: 1.2111, test_loss: 1.1959, test_f1: 0.3465
 epoch: 30, train_loss: 1.2064, test_loss: 1.1939, test_f1: 0.3449
 epoch: 31, train_loss: 1.2071, test_loss: 1.1892, test_f1: 0.3490
 epoch: 32, train_loss: 1.2005, test_loss: 1.1911, test_f1: 0.3453
 epoch: 33, train_loss: 1.1948, test_loss: 1.1885, test_f1: 0.3542
 epoch: 34, train_loss: 1.2040, test_loss: 1.1854, test_f1: 0.3579
 epoch: 35, train_loss: 1.1964, test_loss: 1.1828, test_f1: 0.3488
 epoch: 36, train_loss: 1.1967, test_loss: 1.1814, test_f1: 0.3545
 epoch: 37, train_loss: 1.1894, test_loss: 1.1798, test_f1: 0.3469
 epoch: 38, train_loss: 1.1903, test_loss: 1.1780, test_f1: 0.3581
 epoch: 39, train_loss: 1.1876, test_loss: 1.1766, test_f1: 0.3638
 epoch: 40, train_loss: 1.1827, test_loss: 1.1748, test_f1: 0.3553
 epoch: 41, train_loss: 1.1848, test_loss: 1.1730, test_f1: 0.3600
 epoch: 42, train_loss: 1.1804, test_loss: 1.1696, test_f1: 0.3597
 epoch: 43, train_loss: 1.1784, test_loss: 1.1676, test_f1: 0.3598
 epoch: 44, train_loss: 1.1746, test_loss: 1.1672, test_f1: 0.3709
 epoch: 45, train_loss: 1.1631, test_loss: 1.1649, test_f1: 0.3700
 epoch: 46, train_loss: 1.1678, test_loss: 1.1630, test_f1: 0.3704
 epoch: 47, train_loss: 1.1692, test_loss: 1.1653, test_f1: 0.3740
 epoch: 48, train_loss: 1.1707, test_loss: 1.1610, test_f1: 0.3767
 epoch: 49, train_loss: 1.1643, test_loss: 1.1589, test_f1: 0.3745
 epoch: 50, train_loss: 1.1592, test_loss: 1.1585, test_f1: 0.3686
 epoch: 51, train_loss: 1.1551, test_loss: 1.1571, test_f1: 0.3627
 epoch: 52, train_loss: 1.1601, test_loss: 1.1559, test_f1: 0.3672
 epoch: 53, train_loss: 1.1572, test_loss: 1.1557, test_f1: 0.3643
 epoch: 54, train_loss: 1.1537, test_loss: 1.1569, test_f1: 0.3656
 epoch: 55, train_loss: 1.1539, test_loss: 1.1561, test_f1: 0.3592
 epoch: 56, train_loss: 1.1527, test_loss: 1.1543, test_f1: 0.3669
 epoch: 57, train_loss: 1.1511, test_loss: 1.1517, test_f1: 0.3678
 epoch: 58, train_loss: 1.1459, test_loss: 1.1502, test_f1: 0.3701
 epoch: 59, train_loss: 1.1520, test_loss: 1.1533, test_f1: 0.3645
 epoch: 60, train_loss: 1.1522, test_loss: 1.1528, test_f1: 0.3644
 epoch: 61, train_loss: 1.1473, test_loss: 1.1518, test_f1: 0.3667
 epoch: 62, train_loss: 1.1434, test_loss: 1.1514, test_f1: 0.3665
 epoch: 63, train_loss: 1.1415, test_loss: 1.1492, test_f1: 0.3686
 epoch: 64, train_loss: 1.1479, test_loss: 1.1501, test_f1: 0.3688
 epoch: 65, train_loss: 1.1390, test_loss: 1.1465, test_f1: 0.3678
 epoch: 66, train_loss: 1.1433, test_loss: 1.1495, test_f1: 0.3688
 epoch: 67, train_loss: 1.1384, test_loss: 1.1462, test_f1: 0.3721
 epoch: 68, train_loss: 1.1383, test_loss: 1.1487, test_f1: 0.3743
 epoch: 69, train_loss: 1.1383, test_loss: 1.1493, test_f1: 0.3760
 epoch: 70, train_loss: 1.1333, test_loss: 1.1509, test_f1: 0.3649
 epoch: 71, train_loss: 1.1359, test_loss: 1.1479, test_f1: 0.3701
 epoch: 72, train_loss: 1.1300, test_loss: 1.1495, test_f1: 0.3689
 epoch: 73, train_loss: 1.1389, test_loss: 1.1514, test_f1: 0.3737
 epoch: 74, train_loss: 1.1323, test_loss: 1.1485, test_f1: 0.3677
 epoch: 75, train_loss: 1.1299, test_loss: 1.1485, test_f1: 0.3602
 epoch: 76, train_loss: 1.1291, test_loss: 1.1466, test_f1: 0.3638
 epoch: 77, train_loss: 1.1336, test_loss: 1.1465, test_f1: 0.3692
 epoch: 78, train_loss: 1.1277, test_loss: 1.1422, test_f1: 0.3724
 epoch: 79, train_loss: 1.1317, test_loss: 1.1446, test_f1: 0.3834
 epoch: 80, train_loss: 1.1296, test_loss: 1.1433, test_f1: 0.3735
 epoch: 81, train_loss: 1.1262, test_loss: 1.1461, test_f1: 0.3649
 epoch: 82, train_loss: 1.1319, test_loss: 1.1495, test_f1: 0.3661
 epoch: 83, train_loss: 1.1232, test_loss: 1.1477, test_f1: 0.3705
 epoch: 84, train_loss: 1.1306, test_loss: 1.1454, test_f1: 0.3815
 epoch: 85, train_loss: 1.1235, test_loss: 1.1459, test_f1: 0.3846
 epoch: 86, train_loss: 1.1222, test_loss: 1.1414, test_f1: 0.3861
 epoch: 87, train_loss: 1.1215, test_loss: 1.1433, test_f1: 0.3890
 epoch: 88, train_loss: 1.1126, test_loss: 1.1438, test_f1: 0.3855
 epoch: 89, train_loss: 1.1204, test_loss: 1.1447, test_f1: 0.3848
 epoch: 90, train_loss: 1.1185, test_loss: 1.1439, test_f1: 0.3861
 epoch: 91, train_loss: 1.1214, test_loss: 1.1447, test_f1: 0.3874
 epoch: 92, train_loss: 1.1149, test_loss: 1.1453, test_f1: 0.3952
 epoch: 93, train_loss: 1.1137, test_loss: 1.1411, test_f1: 0.3984
 epoch: 94, train_loss: 1.1090, test_loss: 1.1434, test_f1: 0.3926
 epoch: 95, train_loss: 1.1117, test_loss: 1.1420, test_f1: 0.3952
 epoch: 96, train_loss: 1.1148, test_loss: 1.1423, test_f1: 0.3920
 epoch: 97, train_loss: 1.1066, test_loss: 1.1399, test_f1: 0.3952
 epoch: 98, train_loss: 1.1191, test_loss: 1.1390, test_f1: 0.3975
 epoch: 99, train_loss: 1.1062, test_loss: 1.1397, test_f1: 0.4019
##################ITERATION #4 ****************************************
 epoch: 0, train_loss: 1.3134, test_loss: 1.3571, test_f1: 0.2274
 epoch: 1, train_loss: 1.3017, test_loss: 1.3390, test_f1: 0.2274
 epoch: 2, train_loss: 1.2947, test_loss: 1.3213, test_f1: 0.2274
 epoch: 3, train_loss: 1.2879, test_loss: 1.3004, test_f1: 0.2390
 epoch: 4, train_loss: 1.2799, test_loss: 1.2819, test_f1: 0.2328
 epoch: 5, train_loss: 1.2722, test_loss: 1.2669, test_f1: 0.2655
 epoch: 6, train_loss: 1.2696, test_loss: 1.2579, test_f1: 0.2778
 epoch: 7, train_loss: 1.2601, test_loss: 1.2536, test_f1: 0.2970
 epoch: 8, train_loss: 1.2573, test_loss: 1.2467, test_f1: 0.2865
 epoch: 9, train_loss: 1.2506, test_loss: 1.2408, test_f1: 0.3045
 epoch: 10, train_loss: 1.2480, test_loss: 1.2355, test_f1: 0.3173
 epoch: 11, train_loss: 1.2469, test_loss: 1.2338, test_f1: 0.3054
 epoch: 12, train_loss: 1.2382, test_loss: 1.2274, test_f1: 0.3204
 epoch: 13, train_loss: 1.2334, test_loss: 1.2226, test_f1: 0.3220
 epoch: 14, train_loss: 1.2259, test_loss: 1.2186, test_f1: 0.3235
 epoch: 15, train_loss: 1.2267, test_loss: 1.2144, test_f1: 0.3174
 epoch: 16, train_loss: 1.2267, test_loss: 1.2104, test_f1: 0.3210
 epoch: 17, train_loss: 1.2212, test_loss: 1.2073, test_f1: 0.3222
 epoch: 18, train_loss: 1.2162, test_loss: 1.2044, test_f1: 0.3215
 epoch: 19, train_loss: 1.2182, test_loss: 1.2020, test_f1: 0.3274
 epoch: 20, train_loss: 1.2110, test_loss: 1.1985, test_f1: 0.3419
 epoch: 21, train_loss: 1.2100, test_loss: 1.1963, test_f1: 0.3402
 epoch: 22, train_loss: 1.2019, test_loss: 1.1934, test_f1: 0.3342
 epoch: 23, train_loss: 1.2063, test_loss: 1.1911, test_f1: 0.3366
 epoch: 24, train_loss: 1.1976, test_loss: 1.1895, test_f1: 0.3347
 epoch: 25, train_loss: 1.2004, test_loss: 1.1878, test_f1: 0.3331
 epoch: 26, train_loss: 1.1920, test_loss: 1.1852, test_f1: 0.3355
 epoch: 27, train_loss: 1.1881, test_loss: 1.1822, test_f1: 0.3329
 epoch: 28, train_loss: 1.1876, test_loss: 1.1809, test_f1: 0.3334
 epoch: 29, train_loss: 1.1883, test_loss: 1.1799, test_f1: 0.3319
 epoch: 30, train_loss: 1.1832, test_loss: 1.1780, test_f1: 0.3368
 epoch: 31, train_loss: 1.1804, test_loss: 1.1759, test_f1: 0.3414
 epoch: 32, train_loss: 1.1720, test_loss: 1.1734, test_f1: 0.3401
 epoch: 33, train_loss: 1.1741, test_loss: 1.1715, test_f1: 0.3419
 epoch: 34, train_loss: 1.1738, test_loss: 1.1695, test_f1: 0.3430
 epoch: 35, train_loss: 1.1722, test_loss: 1.1704, test_f1: 0.3484
 epoch: 36, train_loss: 1.1622, test_loss: 1.1664, test_f1: 0.3602
 epoch: 37, train_loss: 1.1622, test_loss: 1.1662, test_f1: 0.3500
 epoch: 38, train_loss: 1.1601, test_loss: 1.1648, test_f1: 0.3573
 epoch: 39, train_loss: 1.1550, test_loss: 1.1648, test_f1: 0.3581
 epoch: 40, train_loss: 1.1555, test_loss: 1.1642, test_f1: 0.3629
 epoch: 41, train_loss: 1.1476, test_loss: 1.1614, test_f1: 0.3597
 epoch: 42, train_loss: 1.1501, test_loss: 1.1642, test_f1: 0.3654
 epoch: 43, train_loss: 1.1430, test_loss: 1.1621, test_f1: 0.3689
 epoch: 44, train_loss: 1.1394, test_loss: 1.1608, test_f1: 0.3817
 epoch: 45, train_loss: 1.1375, test_loss: 1.1569, test_f1: 0.3866
 epoch: 46, train_loss: 1.1345, test_loss: 1.1561, test_f1: 0.3957
 epoch: 47, train_loss: 1.1385, test_loss: 1.1550, test_f1: 0.4140
 epoch: 48, train_loss: 1.1345, test_loss: 1.1543, test_f1: 0.4275
 epoch: 49, train_loss: 1.1236, test_loss: 1.1545, test_f1: 0.4228
 epoch: 50, train_loss: 1.1284, test_loss: 1.1524, test_f1: 0.4313
 epoch: 51, train_loss: 1.1180, test_loss: 1.1532, test_f1: 0.4417
 epoch: 52, train_loss: 1.1169, test_loss: 1.1521, test_f1: 0.4425
 epoch: 53, train_loss: 1.1176, test_loss: 1.1496, test_f1: 0.4411
 epoch: 54, train_loss: 1.1194, test_loss: 1.1496, test_f1: 0.4383
 epoch: 55, train_loss: 1.1174, test_loss: 1.1526, test_f1: 0.4420
 epoch: 56, train_loss: 1.1259, test_loss: 1.1518, test_f1: 0.4390
 epoch: 57, train_loss: 1.1115, test_loss: 1.1499, test_f1: 0.4399
 epoch: 58, train_loss: 1.1166, test_loss: 1.1512, test_f1: 0.4370
 epoch: 59, train_loss: 1.1122, test_loss: 1.1481, test_f1: 0.4410
 epoch: 60, train_loss: 1.1169, test_loss: 1.1505, test_f1: 0.4473
 epoch: 61, train_loss: 1.1089, test_loss: 1.1499, test_f1: 0.4459
 epoch: 62, train_loss: 1.1070, test_loss: 1.1494, test_f1: 0.4447
 epoch: 63, train_loss: 1.1092, test_loss: 1.1502, test_f1: 0.4472
 epoch: 64, train_loss: 1.1187, test_loss: 1.1468, test_f1: 0.4487
 epoch: 65, train_loss: 1.1075, test_loss: 1.1460, test_f1: 0.4514
 epoch: 66, train_loss: 1.1091, test_loss: 1.1478, test_f1: 0.4514
 epoch: 67, train_loss: 1.1053, test_loss: 1.1496, test_f1: 0.4476
 epoch: 68, train_loss: 1.1048, test_loss: 1.1478, test_f1: 0.4492
 epoch: 69, train_loss: 1.1013, test_loss: 1.1496, test_f1: 0.4423
 epoch: 70, train_loss: 1.1034, test_loss: 1.1499, test_f1: 0.4470
 epoch: 71, train_loss: 1.0972, test_loss: 1.1461, test_f1: 0.4522
 epoch: 72, train_loss: 1.0946, test_loss: 1.1437, test_f1: 0.4521
 epoch: 73, train_loss: 1.0949, test_loss: 1.1437, test_f1: 0.4511
 epoch: 74, train_loss: 1.0913, test_loss: 1.1470, test_f1: 0.4569
 epoch: 75, train_loss: 1.0977, test_loss: 1.1472, test_f1: 0.4524
 epoch: 76, train_loss: 1.0926, test_loss: 1.1491, test_f1: 0.4495
 epoch: 77, train_loss: 1.0940, test_loss: 1.1489, test_f1: 0.4504
 epoch: 78, train_loss: 1.0902, test_loss: 1.1515, test_f1: 0.4422
 epoch: 79, train_loss: 1.0937, test_loss: 1.1508, test_f1: 0.4495
 epoch: 80, train_loss: 1.0988, test_loss: 1.1464, test_f1: 0.4465
 epoch: 81, train_loss: 1.0949, test_loss: 1.1496, test_f1: 0.4537
 epoch: 82, train_loss: 1.0907, test_loss: 1.1453, test_f1: 0.4587
 epoch: 83, train_loss: 1.0907, test_loss: 1.1449, test_f1: 0.4559
 epoch: 84, train_loss: 1.0874, test_loss: 1.1455, test_f1: 0.4488
 epoch: 85, train_loss: 1.0873, test_loss: 1.1499, test_f1: 0.4469
 epoch: 86, train_loss: 1.0770, test_loss: 1.1470, test_f1: 0.4581
 epoch: 87, train_loss: 1.0829, test_loss: 1.1466, test_f1: 0.4554
 epoch: 88, train_loss: 1.0801, test_loss: 1.1441, test_f1: 0.4503
 epoch: 89, train_loss: 1.0854, test_loss: 1.1457, test_f1: 0.4512
 epoch: 90, train_loss: 1.0803, test_loss: 1.1495, test_f1: 0.4415
 epoch: 91, train_loss: 1.0789, test_loss: 1.1453, test_f1: 0.4560
 epoch: 92, train_loss: 1.0810, test_loss: 1.1490, test_f1: 0.4524
 epoch: 93, train_loss: 1.0783, test_loss: 1.1482, test_f1: 0.4537
 epoch: 94, train_loss: 1.0741, test_loss: 1.1428, test_f1: 0.4490
 epoch: 95, train_loss: 1.0763, test_loss: 1.1430, test_f1: 0.4721
 epoch: 96, train_loss: 1.0787, test_loss: 1.1449, test_f1: 0.4652
 epoch: 97, train_loss: 1.0641, test_loss: 1.1437, test_f1: 0.4596
 epoch: 98, train_loss: 1.0742, test_loss: 1.1468, test_f1: 0.4527
 epoch: 99, train_loss: 1.0740, test_loss: 1.1493, test_f1: 0.4544
##################ITERATION #5 ****************************************
 epoch: 0, train_loss: 1.3086, test_loss: 1.3313, test_f1: 0.2274
 epoch: 1, train_loss: 1.2933, test_loss: 1.3225, test_f1: 0.2274
 epoch: 2, train_loss: 1.2856, test_loss: 1.3084, test_f1: 0.2274
 epoch: 3, train_loss: 1.2780, test_loss: 1.2893, test_f1: 0.2274
 epoch: 4, train_loss: 1.2734, test_loss: 1.2711, test_f1: 0.2481
 epoch: 5, train_loss: 1.2650, test_loss: 1.2571, test_f1: 0.2808
 epoch: 6, train_loss: 1.2577, test_loss: 1.2462, test_f1: 0.2937
 epoch: 7, train_loss: 1.2575, test_loss: 1.2377, test_f1: 0.3050
 epoch: 8, train_loss: 1.2521, test_loss: 1.2321, test_f1: 0.3082
 epoch: 9, train_loss: 1.2463, test_loss: 1.2286, test_f1: 0.3105
 epoch: 10, train_loss: 1.2406, test_loss: 1.2217, test_f1: 0.3228
 epoch: 11, train_loss: 1.2327, test_loss: 1.2168, test_f1: 0.3247
 epoch: 12, train_loss: 1.2297, test_loss: 1.2119, test_f1: 0.3201
 epoch: 13, train_loss: 1.2295, test_loss: 1.2056, test_f1: 0.3229
 epoch: 14, train_loss: 1.2252, test_loss: 1.2011, test_f1: 0.3290
 epoch: 15, train_loss: 1.2145, test_loss: 1.1981, test_f1: 0.3325
 epoch: 16, train_loss: 1.2128, test_loss: 1.1918, test_f1: 0.3375
 epoch: 17, train_loss: 1.2085, test_loss: 1.1885, test_f1: 0.3445
 epoch: 18, train_loss: 1.2041, test_loss: 1.1837, test_f1: 0.3465
 epoch: 19, train_loss: 1.2018, test_loss: 1.1792, test_f1: 0.3497
 epoch: 20, train_loss: 1.2033, test_loss: 1.1750, test_f1: 0.3533
 epoch: 21, train_loss: 1.2010, test_loss: 1.1727, test_f1: 0.3416
 epoch: 22, train_loss: 1.1930, test_loss: 1.1700, test_f1: 0.3477
 epoch: 23, train_loss: 1.1862, test_loss: 1.1674, test_f1: 0.3549
 epoch: 24, train_loss: 1.1832, test_loss: 1.1655, test_f1: 0.3486
 epoch: 25, train_loss: 1.1867, test_loss: 1.1608, test_f1: 0.3526
 epoch: 26, train_loss: 1.1801, test_loss: 1.1557, test_f1: 0.3596
 epoch: 27, train_loss: 1.1790, test_loss: 1.1536, test_f1: 0.3546
 epoch: 28, train_loss: 1.1727, test_loss: 1.1518, test_f1: 0.3581
 epoch: 29, train_loss: 1.1789, test_loss: 1.1508, test_f1: 0.3571
 epoch: 30, train_loss: 1.1709, test_loss: 1.1498, test_f1: 0.3544
 epoch: 31, train_loss: 1.1752, test_loss: 1.1465, test_f1: 0.3635
 epoch: 32, train_loss: 1.1661, test_loss: 1.1442, test_f1: 0.3522
 epoch: 33, train_loss: 1.1684, test_loss: 1.1416, test_f1: 0.3559
 epoch: 34, train_loss: 1.1627, test_loss: 1.1406, test_f1: 0.3531
 epoch: 35, train_loss: 1.1613, test_loss: 1.1396, test_f1: 0.3596
 epoch: 36, train_loss: 1.1555, test_loss: 1.1388, test_f1: 0.3501
 epoch: 37, train_loss: 1.1552, test_loss: 1.1358, test_f1: 0.3554
 epoch: 38, train_loss: 1.1638, test_loss: 1.1344, test_f1: 0.3465
 epoch: 39, train_loss: 1.1541, test_loss: 1.1321, test_f1: 0.3429
 epoch: 40, train_loss: 1.1451, test_loss: 1.1305, test_f1: 0.3536
 epoch: 41, train_loss: 1.1548, test_loss: 1.1282, test_f1: 0.3506
 epoch: 42, train_loss: 1.1451, test_loss: 1.1272, test_f1: 0.3548
 epoch: 43, train_loss: 1.1468, test_loss: 1.1238, test_f1: 0.3542
 epoch: 44, train_loss: 1.1456, test_loss: 1.1248, test_f1: 0.3695
 epoch: 45, train_loss: 1.1443, test_loss: 1.1218, test_f1: 0.3603
 epoch: 46, train_loss: 1.1343, test_loss: 1.1200, test_f1: 0.3631
 epoch: 47, train_loss: 1.1420, test_loss: 1.1191, test_f1: 0.3601
 epoch: 48, train_loss: 1.1324, test_loss: 1.1168, test_f1: 0.3660
 epoch: 49, train_loss: 1.1364, test_loss: 1.1149, test_f1: 0.3687
 epoch: 50, train_loss: 1.1357, test_loss: 1.1151, test_f1: 0.3831
 epoch: 51, train_loss: 1.1314, test_loss: 1.1141, test_f1: 0.3823
 epoch: 52, train_loss: 1.1253, test_loss: 1.1131, test_f1: 0.3839
 epoch: 53, train_loss: 1.1290, test_loss: 1.1123, test_f1: 0.3861
 epoch: 54, train_loss: 1.1305, test_loss: 1.1110, test_f1: 0.3950
 epoch: 55, train_loss: 1.1245, test_loss: 1.1112, test_f1: 0.3909
 epoch: 56, train_loss: 1.1176, test_loss: 1.1108, test_f1: 0.3935
 epoch: 57, train_loss: 1.1248, test_loss: 1.1110, test_f1: 0.3918
 epoch: 58, train_loss: 1.1221, test_loss: 1.1094, test_f1: 0.3969
 epoch: 59, train_loss: 1.1197, test_loss: 1.1099, test_f1: 0.3935
 epoch: 60, train_loss: 1.1198, test_loss: 1.1073, test_f1: 0.3957
 epoch: 61, train_loss: 1.1143, test_loss: 1.1077, test_f1: 0.4003
 epoch: 62, train_loss: 1.1191, test_loss: 1.1081, test_f1: 0.4008
 epoch: 63, train_loss: 1.1205, test_loss: 1.1074, test_f1: 0.4057
 epoch: 64, train_loss: 1.1166, test_loss: 1.1038, test_f1: 0.4077
 epoch: 65, train_loss: 1.1041, test_loss: 1.1035, test_f1: 0.4008
 epoch: 66, train_loss: 1.1143, test_loss: 1.1047, test_f1: 0.4063
 epoch: 67, train_loss: 1.1185, test_loss: 1.1050, test_f1: 0.4173
 epoch: 68, train_loss: 1.1108, test_loss: 1.1062, test_f1: 0.4068
 epoch: 69, train_loss: 1.1058, test_loss: 1.1057, test_f1: 0.4080
 epoch: 70, train_loss: 1.1066, test_loss: 1.1047, test_f1: 0.4287
 epoch: 71, train_loss: 1.1062, test_loss: 1.1031, test_f1: 0.4272
 epoch: 72, train_loss: 1.1077, test_loss: 1.1029, test_f1: 0.4037
 epoch: 73, train_loss: 1.1052, test_loss: 1.1042, test_f1: 0.4067
 epoch: 74, train_loss: 1.1134, test_loss: 1.1039, test_f1: 0.4123
 epoch: 75, train_loss: 1.1044, test_loss: 1.1025, test_f1: 0.4022
 epoch: 76, train_loss: 1.1074, test_loss: 1.1009, test_f1: 0.4137
 epoch: 77, train_loss: 1.1002, test_loss: 1.0995, test_f1: 0.4082
 epoch: 78, train_loss: 1.0983, test_loss: 1.1032, test_f1: 0.4102
 epoch: 79, train_loss: 1.1010, test_loss: 1.1004, test_f1: 0.4030
 epoch: 80, train_loss: 1.0960, test_loss: 1.1018, test_f1: 0.3994
 epoch: 81, train_loss: 1.0977, test_loss: 1.1011, test_f1: 0.4039
 epoch: 82, train_loss: 1.0951, test_loss: 1.1003, test_f1: 0.4085
 epoch: 83, train_loss: 1.1001, test_loss: 1.1000, test_f1: 0.4098
 epoch: 84, train_loss: 1.0938, test_loss: 1.0995, test_f1: 0.4130
 epoch: 85, train_loss: 1.0846, test_loss: 1.1000, test_f1: 0.4124
 epoch: 86, train_loss: 1.0946, test_loss: 1.0982, test_f1: 0.4089
 epoch: 87, train_loss: 1.0952, test_loss: 1.0976, test_f1: 0.4122
 epoch: 88, train_loss: 1.0949, test_loss: 1.0964, test_f1: 0.4136
 epoch: 89, train_loss: 1.0882, test_loss: 1.0978, test_f1: 0.4202
 epoch: 90, train_loss: 1.0856, test_loss: 1.1001, test_f1: 0.4139
 epoch: 91, train_loss: 1.0867, test_loss: 1.0979, test_f1: 0.4145
 epoch: 92, train_loss: 1.0876, test_loss: 1.0978, test_f1: 0.4173
 epoch: 93, train_loss: 1.0826, test_loss: 1.0983, test_f1: 0.4192
 epoch: 94, train_loss: 1.0786, test_loss: 1.0986, test_f1: 0.4217
 epoch: 95, train_loss: 1.0897, test_loss: 1.0982, test_f1: 0.4139
 epoch: 96, train_loss: 1.0919, test_loss: 1.0959, test_f1: 0.4063
 epoch: 97, train_loss: 1.0785, test_loss: 1.0937, test_f1: 0.4160
 epoch: 98, train_loss: 1.0889, test_loss: 1.0947, test_f1: 0.4247
 epoch: 99, train_loss: 1.0789, test_loss: 1.0977, test_f1: 0.4119
##################ITERATION #6 ****************************************
 epoch: 0, train_loss: 1.3431, test_loss: 1.3682, test_f1: 0.2274
 epoch: 1, train_loss: 1.3227, test_loss: 1.3520, test_f1: 0.2274
 epoch: 2, train_loss: 1.3149, test_loss: 1.3398, test_f1: 0.2274
 epoch: 3, train_loss: 1.3083, test_loss: 1.3380, test_f1: 0.2274
 epoch: 4, train_loss: 1.2965, test_loss: 1.3159, test_f1: 0.2274
 epoch: 5, train_loss: 1.2893, test_loss: 1.2990, test_f1: 0.2358
 epoch: 6, train_loss: 1.2802, test_loss: 1.2840, test_f1: 0.2714
 epoch: 7, train_loss: 1.2756, test_loss: 1.2751, test_f1: 0.2729
 epoch: 8, train_loss: 1.2678, test_loss: 1.2653, test_f1: 0.2820
 epoch: 9, train_loss: 1.2604, test_loss: 1.2560, test_f1: 0.2851
 epoch: 10, train_loss: 1.2591, test_loss: 1.2491, test_f1: 0.2971
 epoch: 11, train_loss: 1.2549, test_loss: 1.2438, test_f1: 0.3062
 epoch: 12, train_loss: 1.2492, test_loss: 1.2377, test_f1: 0.3100
 epoch: 13, train_loss: 1.2425, test_loss: 1.2340, test_f1: 0.3198
 epoch: 14, train_loss: 1.2416, test_loss: 1.2290, test_f1: 0.3147
 epoch: 15, train_loss: 1.2377, test_loss: 1.2278, test_f1: 0.3211
 epoch: 16, train_loss: 1.2286, test_loss: 1.2222, test_f1: 0.3434
 epoch: 17, train_loss: 1.2277, test_loss: 1.2182, test_f1: 0.3370
 epoch: 18, train_loss: 1.2159, test_loss: 1.2141, test_f1: 0.3348
 epoch: 19, train_loss: 1.2198, test_loss: 1.2096, test_f1: 0.3454
 epoch: 20, train_loss: 1.2193, test_loss: 1.2072, test_f1: 0.3448
 epoch: 21, train_loss: 1.2118, test_loss: 1.2046, test_f1: 0.3477
 epoch: 22, train_loss: 1.2038, test_loss: 1.2021, test_f1: 0.3455
 epoch: 23, train_loss: 1.2088, test_loss: 1.1978, test_f1: 0.3489
 epoch: 24, train_loss: 1.2006, test_loss: 1.1950, test_f1: 0.3494
 epoch: 25, train_loss: 1.1946, test_loss: 1.1925, test_f1: 0.3546
 epoch: 26, train_loss: 1.1995, test_loss: 1.1898, test_f1: 0.3493
 epoch: 27, train_loss: 1.1911, test_loss: 1.1887, test_f1: 0.3509
 epoch: 28, train_loss: 1.1919, test_loss: 1.1849, test_f1: 0.3595
 epoch: 29, train_loss: 1.1937, test_loss: 1.1822, test_f1: 0.3660
 epoch: 30, train_loss: 1.1859, test_loss: 1.1811, test_f1: 0.3660
 epoch: 31, train_loss: 1.1802, test_loss: 1.1792, test_f1: 0.3616
 epoch: 32, train_loss: 1.1839, test_loss: 1.1788, test_f1: 0.3575
 epoch: 33, train_loss: 1.1811, test_loss: 1.1796, test_f1: 0.3550
 epoch: 34, train_loss: 1.1763, test_loss: 1.1800, test_f1: 0.3577
 epoch: 35, train_loss: 1.1762, test_loss: 1.1783, test_f1: 0.3487
 epoch: 36, train_loss: 1.1660, test_loss: 1.1744, test_f1: 0.3633
 epoch: 37, train_loss: 1.1685, test_loss: 1.1727, test_f1: 0.3627
 epoch: 38, train_loss: 1.1720, test_loss: 1.1699, test_f1: 0.3641
 epoch: 39, train_loss: 1.1688, test_loss: 1.1700, test_f1: 0.3686
 epoch: 40, train_loss: 1.1661, test_loss: 1.1716, test_f1: 0.3660
 epoch: 41, train_loss: 1.1601, test_loss: 1.1701, test_f1: 0.3665
 epoch: 42, train_loss: 1.1573, test_loss: 1.1689, test_f1: 0.3684
 epoch: 43, train_loss: 1.1538, test_loss: 1.1658, test_f1: 0.3797
 epoch: 44, train_loss: 1.1522, test_loss: 1.1677, test_f1: 0.3952
 epoch: 45, train_loss: 1.1534, test_loss: 1.1611, test_f1: 0.3938
 epoch: 46, train_loss: 1.1554, test_loss: 1.1619, test_f1: 0.4032
 epoch: 47, train_loss: 1.1499, test_loss: 1.1624, test_f1: 0.4295
 epoch: 48, train_loss: 1.1374, test_loss: 1.1638, test_f1: 0.4253
 epoch: 49, train_loss: 1.1416, test_loss: 1.1580, test_f1: 0.4251
 epoch: 50, train_loss: 1.1365, test_loss: 1.1640, test_f1: 0.4314
 epoch: 51, train_loss: 1.1398, test_loss: 1.1626, test_f1: 0.4390
 epoch: 52, train_loss: 1.1338, test_loss: 1.1631, test_f1: 0.4447
 epoch: 53, train_loss: 1.1369, test_loss: 1.1645, test_f1: 0.4423
 epoch: 54, train_loss: 1.1408, test_loss: 1.1650, test_f1: 0.4475
 epoch: 55, train_loss: 1.1304, test_loss: 1.1660, test_f1: 0.4394
 epoch: 56, train_loss: 1.1253, test_loss: 1.1688, test_f1: 0.4416
 epoch: 57, train_loss: 1.1271, test_loss: 1.1680, test_f1: 0.4422
 epoch: 58, train_loss: 1.1313, test_loss: 1.1687, test_f1: 0.4476
 epoch: 59, train_loss: 1.1281, test_loss: 1.1688, test_f1: 0.4476
 epoch: 60, train_loss: 1.1240, test_loss: 1.1699, test_f1: 0.4472
 epoch: 61, train_loss: 1.1254, test_loss: 1.1672, test_f1: 0.4402
 epoch: 62, train_loss: 1.1290, test_loss: 1.1682, test_f1: 0.4327
 epoch: 63, train_loss: 1.1215, test_loss: 1.1681, test_f1: 0.4371
 epoch: 64, train_loss: 1.1215, test_loss: 1.1644, test_f1: 0.4497
 epoch: 65, train_loss: 1.1159, test_loss: 1.1681, test_f1: 0.4503
 epoch: 66, train_loss: 1.1257, test_loss: 1.1673, test_f1: 0.4547
 epoch: 67, train_loss: 1.1225, test_loss: 1.1650, test_f1: 0.4561
 epoch: 68, train_loss: 1.1217, test_loss: 1.1672, test_f1: 0.4537
 epoch: 69, train_loss: 1.1171, test_loss: 1.1661, test_f1: 0.4458
 epoch: 70, train_loss: 1.1237, test_loss: 1.1709, test_f1: 0.4521
 epoch: 71, train_loss: 1.1184, test_loss: 1.1702, test_f1: 0.4416
 epoch: 72, train_loss: 1.1167, test_loss: 1.1668, test_f1: 0.4407
 epoch: 73, train_loss: 1.1058, test_loss: 1.1681, test_f1: 0.4374
 epoch: 74, train_loss: 1.1043, test_loss: 1.1670, test_f1: 0.4442
 epoch: 75, train_loss: 1.1098, test_loss: 1.1665, test_f1: 0.4534
 epoch: 76, train_loss: 1.1022, test_loss: 1.1703, test_f1: 0.4571
 epoch: 77, train_loss: 1.1089, test_loss: 1.1712, test_f1: 0.4691
 epoch: 78, train_loss: 1.1087, test_loss: 1.1718, test_f1: 0.4620
 epoch: 79, train_loss: 1.1100, test_loss: 1.1721, test_f1: 0.4618
 epoch: 80, train_loss: 1.1021, test_loss: 1.1700, test_f1: 0.4527
 epoch: 81, train_loss: 1.0978, test_loss: 1.1700, test_f1: 0.4430
 epoch: 82, train_loss: 1.1044, test_loss: 1.1729, test_f1: 0.4469
 epoch: 83, train_loss: 1.1069, test_loss: 1.1713, test_f1: 0.4481
 epoch: 84, train_loss: 1.1021, test_loss: 1.1747, test_f1: 0.4472
 epoch: 85, train_loss: 1.1023, test_loss: 1.1763, test_f1: 0.4371
 epoch: 86, train_loss: 1.0986, test_loss: 1.1710, test_f1: 0.4427
 epoch: 87, train_loss: 1.0972, test_loss: 1.1736, test_f1: 0.4444
 epoch: 88, train_loss: 1.1010, test_loss: 1.1746, test_f1: 0.4444
 epoch: 89, train_loss: 1.1016, test_loss: 1.1740, test_f1: 0.4508
 epoch: 90, train_loss: 1.0952, test_loss: 1.1744, test_f1: 0.4441
 epoch: 91, train_loss: 1.1008, test_loss: 1.1735, test_f1: 0.4435
 epoch: 92, train_loss: 1.0911, test_loss: 1.1765, test_f1: 0.4440
 epoch: 93, train_loss: 1.0943, test_loss: 1.1751, test_f1: 0.4476
 epoch: 94, train_loss: 1.0877, test_loss: 1.1770, test_f1: 0.4444
 epoch: 95, train_loss: 1.0925, test_loss: 1.1715, test_f1: 0.4427
 epoch: 96, train_loss: 1.0989, test_loss: 1.1713, test_f1: 0.4300
 epoch: 97, train_loss: 1.0953, test_loss: 1.1769, test_f1: 0.4262
 epoch: 98, train_loss: 1.0896, test_loss: 1.1783, test_f1: 0.4278
 epoch: 99, train_loss: 1.0848, test_loss: 1.1731, test_f1: 0.4375
##################ITERATION #7 ****************************************
 epoch: 0, train_loss: 1.3261, test_loss: 1.3542, test_f1: 0.2274
 epoch: 1, train_loss: 1.3037, test_loss: 1.3409, test_f1: 0.2274
 epoch: 2, train_loss: 1.2997, test_loss: 1.3246, test_f1: 0.2274
 epoch: 3, train_loss: 1.2897, test_loss: 1.3005, test_f1: 0.2402
 epoch: 4, train_loss: 1.2792, test_loss: 1.2820, test_f1: 0.2556
 epoch: 5, train_loss: 1.2715, test_loss: 1.2712, test_f1: 0.2639
 epoch: 6, train_loss: 1.2631, test_loss: 1.2617, test_f1: 0.2510
 epoch: 7, train_loss: 1.2567, test_loss: 1.2527, test_f1: 0.2855
 epoch: 8, train_loss: 1.2538, test_loss: 1.2457, test_f1: 0.2759
 epoch: 9, train_loss: 1.2383, test_loss: 1.2389, test_f1: 0.2720
 epoch: 10, train_loss: 1.2470, test_loss: 1.2328, test_f1: 0.2819
 epoch: 11, train_loss: 1.2361, test_loss: 1.2252, test_f1: 0.2958
 epoch: 12, train_loss: 1.2372, test_loss: 1.2197, test_f1: 0.3044
 epoch: 13, train_loss: 1.2330, test_loss: 1.2139, test_f1: 0.3167
 epoch: 14, train_loss: 1.2233, test_loss: 1.2105, test_f1: 0.3272
 epoch: 15, train_loss: 1.2205, test_loss: 1.2057, test_f1: 0.3370
 epoch: 16, train_loss: 1.2138, test_loss: 1.2021, test_f1: 0.3423
 epoch: 17, train_loss: 1.2145, test_loss: 1.1986, test_f1: 0.3450
 epoch: 18, train_loss: 1.2094, test_loss: 1.1948, test_f1: 0.3471
 epoch: 19, train_loss: 1.2041, test_loss: 1.1886, test_f1: 0.3559
 epoch: 20, train_loss: 1.2059, test_loss: 1.1887, test_f1: 0.3486
 epoch: 21, train_loss: 1.1980, test_loss: 1.1863, test_f1: 0.3532
 epoch: 22, train_loss: 1.1925, test_loss: 1.1821, test_f1: 0.3638
 epoch: 23, train_loss: 1.1927, test_loss: 1.1784, test_f1: 0.3620
 epoch: 24, train_loss: 1.1904, test_loss: 1.1762, test_f1: 0.3568
 epoch: 25, train_loss: 1.1870, test_loss: 1.1738, test_f1: 0.3624
 epoch: 26, train_loss: 1.1905, test_loss: 1.1710, test_f1: 0.3642
 epoch: 27, train_loss: 1.1833, test_loss: 1.1697, test_f1: 0.3595
 epoch: 28, train_loss: 1.1819, test_loss: 1.1684, test_f1: 0.3710
 epoch: 29, train_loss: 1.1771, test_loss: 1.1650, test_f1: 0.3639
 epoch: 30, train_loss: 1.1719, test_loss: 1.1617, test_f1: 0.3720
 epoch: 31, train_loss: 1.1714, test_loss: 1.1590, test_f1: 0.3923
 epoch: 32, train_loss: 1.1716, test_loss: 1.1566, test_f1: 0.3906
 epoch: 33, train_loss: 1.1668, test_loss: 1.1557, test_f1: 0.3834
 epoch: 34, train_loss: 1.1664, test_loss: 1.1541, test_f1: 0.3817
 epoch: 35, train_loss: 1.1682, test_loss: 1.1515, test_f1: 0.3834
 epoch: 36, train_loss: 1.1610, test_loss: 1.1510, test_f1: 0.3888
 epoch: 37, train_loss: 1.1550, test_loss: 1.1501, test_f1: 0.3871
 epoch: 38, train_loss: 1.1655, test_loss: 1.1470, test_f1: 0.3877
 epoch: 39, train_loss: 1.1566, test_loss: 1.1452, test_f1: 0.3819
 epoch: 40, train_loss: 1.1467, test_loss: 1.1459, test_f1: 0.3873
 epoch: 41, train_loss: 1.1549, test_loss: 1.1418, test_f1: 0.3885
 epoch: 42, train_loss: 1.1481, test_loss: 1.1436, test_f1: 0.3839
 epoch: 43, train_loss: 1.1562, test_loss: 1.1406, test_f1: 0.3996
 epoch: 44, train_loss: 1.1557, test_loss: 1.1415, test_f1: 0.3896
 epoch: 45, train_loss: 1.1479, test_loss: 1.1390, test_f1: 0.3770
 epoch: 46, train_loss: 1.1386, test_loss: 1.1368, test_f1: 0.3814
 epoch: 47, train_loss: 1.1382, test_loss: 1.1350, test_f1: 0.3952
 epoch: 48, train_loss: 1.1401, test_loss: 1.1334, test_f1: 0.4012
 epoch: 49, train_loss: 1.1305, test_loss: 1.1331, test_f1: 0.4055
 epoch: 50, train_loss: 1.1280, test_loss: 1.1305, test_f1: 0.3932
 epoch: 51, train_loss: 1.1356, test_loss: 1.1299, test_f1: 0.3972
 epoch: 52, train_loss: 1.1288, test_loss: 1.1286, test_f1: 0.3991
 epoch: 53, train_loss: 1.1326, test_loss: 1.1270, test_f1: 0.4084
 epoch: 54, train_loss: 1.1294, test_loss: 1.1254, test_f1: 0.4151
 epoch: 55, train_loss: 1.1240, test_loss: 1.1258, test_f1: 0.4272
 epoch: 56, train_loss: 1.1286, test_loss: 1.1252, test_f1: 0.4155
 epoch: 57, train_loss: 1.1306, test_loss: 1.1252, test_f1: 0.4249
 epoch: 58, train_loss: 1.1230, test_loss: 1.1227, test_f1: 0.4248
 epoch: 59, train_loss: 1.1193, test_loss: 1.1247, test_f1: 0.4114
 epoch: 60, train_loss: 1.1231, test_loss: 1.1222, test_f1: 0.4313
 epoch: 61, train_loss: 1.1279, test_loss: 1.1219, test_f1: 0.4361
 epoch: 62, train_loss: 1.1248, test_loss: 1.1229, test_f1: 0.4541
 epoch: 63, train_loss: 1.1220, test_loss: 1.1236, test_f1: 0.4528
 epoch: 64, train_loss: 1.1221, test_loss: 1.1252, test_f1: 0.4620
 epoch: 65, train_loss: 1.1147, test_loss: 1.1240, test_f1: 0.4456
 epoch: 66, train_loss: 1.1179, test_loss: 1.1235, test_f1: 0.4557
 epoch: 67, train_loss: 1.1220, test_loss: 1.1207, test_f1: 0.4568
 epoch: 68, train_loss: 1.1233, test_loss: 1.1218, test_f1: 0.4630
 epoch: 69, train_loss: 1.1143, test_loss: 1.1198, test_f1: 0.4617
 epoch: 70, train_loss: 1.1104, test_loss: 1.1218, test_f1: 0.4511
 epoch: 71, train_loss: 1.1136, test_loss: 1.1194, test_f1: 0.4524
 epoch: 72, train_loss: 1.1077, test_loss: 1.1194, test_f1: 0.4523
 epoch: 73, train_loss: 1.1096, test_loss: 1.1185, test_f1: 0.4505
 epoch: 74, train_loss: 1.1052, test_loss: 1.1162, test_f1: 0.4475
 epoch: 75, train_loss: 1.1086, test_loss: 1.1160, test_f1: 0.4519
 epoch: 76, train_loss: 1.1067, test_loss: 1.1149, test_f1: 0.4601
 epoch: 77, train_loss: 1.1025, test_loss: 1.1151, test_f1: 0.4459
 epoch: 78, train_loss: 1.1045, test_loss: 1.1162, test_f1: 0.4571
 epoch: 79, train_loss: 1.1068, test_loss: 1.1171, test_f1: 0.4530
 epoch: 80, train_loss: 1.1019, test_loss: 1.1199, test_f1: 0.4655
 epoch: 81, train_loss: 1.0908, test_loss: 1.1224, test_f1: 0.4533
 epoch: 82, train_loss: 1.1044, test_loss: 1.1173, test_f1: 0.4522
 epoch: 83, train_loss: 1.1028, test_loss: 1.1171, test_f1: 0.4446
 epoch: 84, train_loss: 1.1003, test_loss: 1.1148, test_f1: 0.4562
 epoch: 85, train_loss: 1.0982, test_loss: 1.1140, test_f1: 0.4470
 epoch: 86, train_loss: 1.1021, test_loss: 1.1097, test_f1: 0.4450
 epoch: 87, train_loss: 1.0876, test_loss: 1.1110, test_f1: 0.4518
 epoch: 88, train_loss: 1.1065, test_loss: 1.1102, test_f1: 0.4553
 epoch: 89, train_loss: 1.0986, test_loss: 1.1100, test_f1: 0.4438
 epoch: 90, train_loss: 1.0997, test_loss: 1.1102, test_f1: 0.4439
 epoch: 91, train_loss: 1.0964, test_loss: 1.1127, test_f1: 0.4583
 epoch: 92, train_loss: 1.0960, test_loss: 1.1086, test_f1: 0.4625
 epoch: 93, train_loss: 1.0896, test_loss: 1.1070, test_f1: 0.4577
 epoch: 94, train_loss: 1.0910, test_loss: 1.1054, test_f1: 0.4539
 epoch: 95, train_loss: 1.0805, test_loss: 1.1044, test_f1: 0.4577
 epoch: 96, train_loss: 1.0942, test_loss: 1.1037, test_f1: 0.4510
 epoch: 97, train_loss: 1.0949, test_loss: 1.1035, test_f1: 0.4587
 epoch: 98, train_loss: 1.0949, test_loss: 1.1058, test_f1: 0.4699
 epoch: 99, train_loss: 1.0862, test_loss: 1.1070, test_f1: 0.4620
##################ITERATION #8 ****************************************
 epoch: 0, train_loss: 1.3068, test_loss: 1.3221, test_f1: 0.2274
 epoch: 1, train_loss: 1.2944, test_loss: 1.3079, test_f1: 0.2274
 epoch: 2, train_loss: 1.2868, test_loss: 1.3028, test_f1: 0.2555
 epoch: 3, train_loss: 1.2828, test_loss: 1.2915, test_f1: 0.2276
 epoch: 4, train_loss: 1.2688, test_loss: 1.2749, test_f1: 0.2274
 epoch: 5, train_loss: 1.2668, test_loss: 1.2716, test_f1: 0.2300
 epoch: 6, train_loss: 1.2633, test_loss: 1.2689, test_f1: 0.2300
 epoch: 7, train_loss: 1.2582, test_loss: 1.2641, test_f1: 0.2364
 epoch: 8, train_loss: 1.2497, test_loss: 1.2598, test_f1: 0.2383
 epoch: 9, train_loss: 1.2466, test_loss: 1.2553, test_f1: 0.2411
 epoch: 10, train_loss: 1.2450, test_loss: 1.2501, test_f1: 0.2423
 epoch: 11, train_loss: 1.2434, test_loss: 1.2410, test_f1: 0.2616
 epoch: 12, train_loss: 1.2358, test_loss: 1.2416, test_f1: 0.2737
 epoch: 13, train_loss: 1.2355, test_loss: 1.2355, test_f1: 0.2781
 epoch: 14, train_loss: 1.2302, test_loss: 1.2290, test_f1: 0.2805
 epoch: 15, train_loss: 1.2276, test_loss: 1.2252, test_f1: 0.2962
 epoch: 16, train_loss: 1.2247, test_loss: 1.2269, test_f1: 0.3009
 epoch: 17, train_loss: 1.2208, test_loss: 1.2219, test_f1: 0.3077
 epoch: 18, train_loss: 1.2200, test_loss: 1.2207, test_f1: 0.3091
 epoch: 19, train_loss: 1.2148, test_loss: 1.2190, test_f1: 0.3091
 epoch: 20, train_loss: 1.2131, test_loss: 1.2152, test_f1: 0.3175
 epoch: 21, train_loss: 1.2102, test_loss: 1.2148, test_f1: 0.3214
 epoch: 22, train_loss: 1.2121, test_loss: 1.2107, test_f1: 0.3357
 epoch: 23, train_loss: 1.2066, test_loss: 1.2092, test_f1: 0.3316
 epoch: 24, train_loss: 1.2033, test_loss: 1.2054, test_f1: 0.3202
 epoch: 25, train_loss: 1.2004, test_loss: 1.2066, test_f1: 0.3219
 epoch: 26, train_loss: 1.2016, test_loss: 1.2017, test_f1: 0.3284
 epoch: 27, train_loss: 1.1915, test_loss: 1.2034, test_f1: 0.3184
 epoch: 28, train_loss: 1.1939, test_loss: 1.2016, test_f1: 0.3237
 epoch: 29, train_loss: 1.1881, test_loss: 1.1981, test_f1: 0.3272
 epoch: 30, train_loss: 1.1937, test_loss: 1.1984, test_f1: 0.3336
 epoch: 31, train_loss: 1.1908, test_loss: 1.1914, test_f1: 0.3353
 epoch: 32, train_loss: 1.1800, test_loss: 1.1871, test_f1: 0.3293
 epoch: 33, train_loss: 1.1857, test_loss: 1.1798, test_f1: 0.3297
 epoch: 34, train_loss: 1.1783, test_loss: 1.1877, test_f1: 0.3315
 epoch: 35, train_loss: 1.1777, test_loss: 1.1802, test_f1: 0.3320
 epoch: 36, train_loss: 1.1727, test_loss: 1.1752, test_f1: 0.3280
 epoch: 37, train_loss: 1.1783, test_loss: 1.1827, test_f1: 0.3542
 epoch: 38, train_loss: 1.1735, test_loss: 1.1798, test_f1: 0.3673
 epoch: 39, train_loss: 1.1663, test_loss: 1.1773, test_f1: 0.3823
 epoch: 40, train_loss: 1.1694, test_loss: 1.1732, test_f1: 0.3865
 epoch: 41, train_loss: 1.1590, test_loss: 1.1804, test_f1: 0.3760
 epoch: 42, train_loss: 1.1583, test_loss: 1.1915, test_f1: 0.3746
 epoch: 43, train_loss: 1.1542, test_loss: 1.1776, test_f1: 0.3922
 epoch: 44, train_loss: 1.1591, test_loss: 1.1667, test_f1: 0.3862
 epoch: 45, train_loss: 1.1592, test_loss: 1.1456, test_f1: 0.3946
 epoch: 46, train_loss: 1.1494, test_loss: 1.1621, test_f1: 0.3869
 epoch: 47, train_loss: 1.1488, test_loss: 1.1762, test_f1: 0.3814
 epoch: 48, train_loss: 1.1506, test_loss: 1.1733, test_f1: 0.3889
 epoch: 49, train_loss: 1.1375, test_loss: 1.1820, test_f1: 0.3943
 epoch: 50, train_loss: 1.1373, test_loss: 1.2046, test_f1: 0.3835
 epoch: 51, train_loss: 1.1399, test_loss: 1.1824, test_f1: 0.3850
 epoch: 52, train_loss: 1.1375, test_loss: 1.1787, test_f1: 0.3879
 epoch: 53, train_loss: 1.1318, test_loss: 1.1602, test_f1: 0.3848
 epoch: 54, train_loss: 1.1322, test_loss: 1.1614, test_f1: 0.3944
 epoch: 55, train_loss: 1.1375, test_loss: 1.1737, test_f1: 0.3914
 epoch: 56, train_loss: 1.1310, test_loss: 1.1822, test_f1: 0.3874
 epoch: 57, train_loss: 1.1328, test_loss: 1.1849, test_f1: 0.3855
 epoch: 58, train_loss: 1.1242, test_loss: 1.1556, test_f1: 0.3825
 epoch: 59, train_loss: 1.1220, test_loss: 1.1826, test_f1: 0.3823
 epoch: 60, train_loss: 1.1300, test_loss: 1.1799, test_f1: 0.3879
 epoch: 61, train_loss: 1.1244, test_loss: 1.1764, test_f1: 0.3910
 epoch: 62, train_loss: 1.1275, test_loss: 1.1672, test_f1: 0.3851
 epoch: 63, train_loss: 1.1232, test_loss: 1.1883, test_f1: 0.3894
 epoch: 64, train_loss: 1.1252, test_loss: 1.1853, test_f1: 0.3878
 epoch: 65, train_loss: 1.1186, test_loss: 1.1786, test_f1: 0.3873
 epoch: 66, train_loss: 1.1178, test_loss: 1.1938, test_f1: 0.3856
 epoch: 67, train_loss: 1.1195, test_loss: 1.1841, test_f1: 0.3853
 epoch: 68, train_loss: 1.1187, test_loss: 1.1835, test_f1: 0.3872
 epoch: 69, train_loss: 1.1150, test_loss: 1.1731, test_f1: 0.3910
 epoch: 70, train_loss: 1.1203, test_loss: 1.1774, test_f1: 0.3985
 epoch: 71, train_loss: 1.1147, test_loss: 1.1814, test_f1: 0.3881
 epoch: 72, train_loss: 1.1121, test_loss: 1.1589, test_f1: 0.3808
 epoch: 73, train_loss: 1.1114, test_loss: 1.1650, test_f1: 0.3886
 epoch: 74, train_loss: 1.1101, test_loss: 1.1741, test_f1: 0.3882
 epoch: 75, train_loss: 1.1128, test_loss: 1.1676, test_f1: 0.3872
 epoch: 76, train_loss: 1.1082, test_loss: 1.1813, test_f1: 0.3918
 epoch: 77, train_loss: 1.0996, test_loss: 1.1878, test_f1: 0.3921
 epoch: 78, train_loss: 1.1063, test_loss: 1.1788, test_f1: 0.3925
 epoch: 79, train_loss: 1.0987, test_loss: 1.1687, test_f1: 0.3943
 epoch: 80, train_loss: 1.1098, test_loss: 1.1391, test_f1: 0.3977
 epoch: 81, train_loss: 1.1106, test_loss: 1.1782, test_f1: 0.4000
 epoch: 82, train_loss: 1.1039, test_loss: 1.1857, test_f1: 0.4018
 epoch: 83, train_loss: 1.0923, test_loss: 1.1885, test_f1: 0.3944
 epoch: 84, train_loss: 1.1008, test_loss: 1.1925, test_f1: 0.4052
 epoch: 85, train_loss: 1.0974, test_loss: 1.1872, test_f1: 0.4110
 epoch: 86, train_loss: 1.0955, test_loss: 1.1839, test_f1: 0.4020
 epoch: 87, train_loss: 1.0938, test_loss: 1.2039, test_f1: 0.4022
 epoch: 88, train_loss: 1.1007, test_loss: 1.1977, test_f1: 0.4000
 epoch: 89, train_loss: 1.0895, test_loss: 1.2083, test_f1: 0.3996
 epoch: 90, train_loss: 1.0968, test_loss: 1.1684, test_f1: 0.4046
 epoch: 91, train_loss: 1.0914, test_loss: 1.1559, test_f1: 0.4078
 epoch: 92, train_loss: 1.0896, test_loss: 1.1743, test_f1: 0.4045
 epoch: 93, train_loss: 1.0898, test_loss: 1.1639, test_f1: 0.4068
 epoch: 94, train_loss: 1.0871, test_loss: 1.1689, test_f1: 0.4004
 epoch: 95, train_loss: 1.0821, test_loss: 1.1897, test_f1: 0.4045
 epoch: 96, train_loss: 1.0862, test_loss: 1.1150, test_f1: 0.4115
 epoch: 97, train_loss: 1.0824, test_loss: 1.1302, test_f1: 0.4003
 epoch: 98, train_loss: 1.0806, test_loss: 1.1226, test_f1: 0.4079
 epoch: 99, train_loss: 1.0854, test_loss: 1.1490, test_f1: 0.4088
##################ITERATION #9 ****************************************
 epoch: 0, train_loss: 1.3287, test_loss: 1.3475, test_f1: 0.2274
 epoch: 1, train_loss: 1.3070, test_loss: 1.3322, test_f1: 0.2274
 epoch: 2, train_loss: 1.2963, test_loss: 1.2998, test_f1: 0.2274
 epoch: 3, train_loss: 1.2899, test_loss: 1.2833, test_f1: 0.2274
 epoch: 4, train_loss: 1.2821, test_loss: 1.2745, test_f1: 0.2290
 epoch: 5, train_loss: 1.2736, test_loss: 1.2679, test_f1: 0.2357
 epoch: 6, train_loss: 1.2663, test_loss: 1.2583, test_f1: 0.2607
 epoch: 7, train_loss: 1.2594, test_loss: 1.2480, test_f1: 0.2752
 epoch: 8, train_loss: 1.2513, test_loss: 1.2380, test_f1: 0.2954
 epoch: 9, train_loss: 1.2424, test_loss: 1.2305, test_f1: 0.2878
 epoch: 10, train_loss: 1.2452, test_loss: 1.2247, test_f1: 0.2846
 epoch: 11, train_loss: 1.2342, test_loss: 1.2215, test_f1: 0.2866
 epoch: 12, train_loss: 1.2268, test_loss: 1.2178, test_f1: 0.3030
 epoch: 13, train_loss: 1.2273, test_loss: 1.2111, test_f1: 0.3077
 epoch: 14, train_loss: 1.2228, test_loss: 1.2056, test_f1: 0.3023
 epoch: 15, train_loss: 1.2222, test_loss: 1.2004, test_f1: 0.3073
 epoch: 16, train_loss: 1.2158, test_loss: 1.1968, test_f1: 0.3100
 epoch: 17, train_loss: 1.2129, test_loss: 1.1939, test_f1: 0.3127
 epoch: 18, train_loss: 1.2076, test_loss: 1.1903, test_f1: 0.3174
 epoch: 19, train_loss: 1.2038, test_loss: 1.1853, test_f1: 0.3224
 epoch: 20, train_loss: 1.2005, test_loss: 1.1806, test_f1: 0.3229
 epoch: 21, train_loss: 1.2054, test_loss: 1.1760, test_f1: 0.3233
 epoch: 22, train_loss: 1.1968, test_loss: 1.1725, test_f1: 0.3246
 epoch: 23, train_loss: 1.1935, test_loss: 1.1702, test_f1: 0.3289
 epoch: 24, train_loss: 1.1845, test_loss: 1.1677, test_f1: 0.3410
 epoch: 25, train_loss: 1.1896, test_loss: 1.1630, test_f1: 0.3404
 epoch: 26, train_loss: 1.1862, test_loss: 1.1606, test_f1: 0.3422
 epoch: 27, train_loss: 1.1855, test_loss: 1.1578, test_f1: 0.3440
 epoch: 28, train_loss: 1.1812, test_loss: 1.1541, test_f1: 0.3420
 epoch: 29, train_loss: 1.1749, test_loss: 1.1545, test_f1: 0.3476
 epoch: 30, train_loss: 1.1700, test_loss: 1.1524, test_f1: 0.3470
 epoch: 31, train_loss: 1.1743, test_loss: 1.1503, test_f1: 0.3455
 epoch: 32, train_loss: 1.1716, test_loss: 1.1476, test_f1: 0.3447
 epoch: 33, train_loss: 1.1624, test_loss: 1.1461, test_f1: 0.3503
 epoch: 34, train_loss: 1.1643, test_loss: 1.1467, test_f1: 0.3456
 epoch: 35, train_loss: 1.1561, test_loss: 1.1418, test_f1: 0.3505
 epoch: 36, train_loss: 1.1550, test_loss: 1.1439, test_f1: 0.3469
 epoch: 37, train_loss: 1.1580, test_loss: 1.1417, test_f1: 0.3485
 epoch: 38, train_loss: 1.1586, test_loss: 1.1385, test_f1: 0.3468
 epoch: 39, train_loss: 1.1480, test_loss: 1.1370, test_f1: 0.3477
 epoch: 40, train_loss: 1.1494, test_loss: 1.1330, test_f1: 0.3496
 epoch: 41, train_loss: 1.1484, test_loss: 1.1326, test_f1: 0.3548
 epoch: 42, train_loss: 1.1487, test_loss: 1.1279, test_f1: 0.3605
 epoch: 43, train_loss: 1.1356, test_loss: 1.1282, test_f1: 0.3631
 epoch: 44, train_loss: 1.1454, test_loss: 1.1270, test_f1: 0.3662
 epoch: 45, train_loss: 1.1301, test_loss: 1.1253, test_f1: 0.3697
 epoch: 46, train_loss: 1.1360, test_loss: 1.1238, test_f1: 0.3699
 epoch: 47, train_loss: 1.1348, test_loss: 1.1230, test_f1: 0.3739
 epoch: 48, train_loss: 1.1321, test_loss: 1.1217, test_f1: 0.3689
 epoch: 49, train_loss: 1.1310, test_loss: 1.1230, test_f1: 0.3750
 epoch: 50, train_loss: 1.1244, test_loss: 1.1203, test_f1: 0.3911
 epoch: 51, train_loss: 1.1235, test_loss: 1.1220, test_f1: 0.3938
 epoch: 52, train_loss: 1.1259, test_loss: 1.1219, test_f1: 0.3865
 epoch: 53, train_loss: 1.1182, test_loss: 1.1202, test_f1: 0.3937
 epoch: 54, train_loss: 1.1209, test_loss: 1.1186, test_f1: 0.4027
 epoch: 55, train_loss: 1.1145, test_loss: 1.1213, test_f1: 0.4095
 epoch: 56, train_loss: 1.1119, test_loss: 1.1204, test_f1: 0.4057
 epoch: 57, train_loss: 1.1184, test_loss: 1.1180, test_f1: 0.4015
 epoch: 58, train_loss: 1.1131, test_loss: 1.1178, test_f1: 0.3981
 epoch: 59, train_loss: 1.1143, test_loss: 1.1203, test_f1: 0.3894
 epoch: 60, train_loss: 1.1219, test_loss: 1.1202, test_f1: 0.3926
 epoch: 61, train_loss: 1.1168, test_loss: 1.1224, test_f1: 0.3930
 epoch: 62, train_loss: 1.1093, test_loss: 1.1162, test_f1: 0.4010
 epoch: 63, train_loss: 1.1210, test_loss: 1.1188, test_f1: 0.3972
 epoch: 64, train_loss: 1.1154, test_loss: 1.1142, test_f1: 0.4003
 epoch: 65, train_loss: 1.1110, test_loss: 1.1184, test_f1: 0.3987
 epoch: 66, train_loss: 1.1038, test_loss: 1.1192, test_f1: 0.3960
 epoch: 67, train_loss: 1.1100, test_loss: 1.1155, test_f1: 0.4026
 epoch: 68, train_loss: 1.1025, test_loss: 1.1153, test_f1: 0.3928
 epoch: 69, train_loss: 1.1058, test_loss: 1.1151, test_f1: 0.4004
 epoch: 70, train_loss: 1.1073, test_loss: 1.1198, test_f1: 0.3895
 epoch: 71, train_loss: 1.0984, test_loss: 1.1157, test_f1: 0.3930
 epoch: 72, train_loss: 1.1027, test_loss: 1.1168, test_f1: 0.4000
 epoch: 73, train_loss: 1.0969, test_loss: 1.1099, test_f1: 0.4065
 epoch: 74, train_loss: 1.0907, test_loss: 1.1123, test_f1: 0.4000
 epoch: 75, train_loss: 1.0859, test_loss: 1.1119, test_f1: 0.4005
 epoch: 76, train_loss: 1.0919, test_loss: 1.1163, test_f1: 0.3985
 epoch: 77, train_loss: 1.0925, test_loss: 1.1167, test_f1: 0.4022
 epoch: 78, train_loss: 1.0889, test_loss: 1.1122, test_f1: 0.4012
 epoch: 79, train_loss: 1.0932, test_loss: 1.1116, test_f1: 0.4134
 epoch: 80, train_loss: 1.0877, test_loss: 1.1156, test_f1: 0.4028
 epoch: 81, train_loss: 1.0918, test_loss: 1.1128, test_f1: 0.4091
 epoch: 82, train_loss: 1.0939, test_loss: 1.1123, test_f1: 0.4088
 epoch: 83, train_loss: 1.0867, test_loss: 1.1127, test_f1: 0.4041
 epoch: 84, train_loss: 1.0843, test_loss: 1.1139, test_f1: 0.4087
 epoch: 85, train_loss: 1.0894, test_loss: 1.1143, test_f1: 0.4031
 epoch: 86, train_loss: 1.0839, test_loss: 1.1169, test_f1: 0.3985
 epoch: 87, train_loss: 1.0822, test_loss: 1.1217, test_f1: 0.3974
 epoch: 88, train_loss: 1.0867, test_loss: 1.1072, test_f1: 0.4050
 epoch: 89, train_loss: 1.0882, test_loss: 1.1081, test_f1: 0.4042
 epoch: 90, train_loss: 1.0833, test_loss: 1.1063, test_f1: 0.4096
 epoch: 91, train_loss: 1.0818, test_loss: 1.1132, test_f1: 0.4079
 epoch: 92, train_loss: 1.0777, test_loss: 1.1065, test_f1: 0.4047
 epoch: 93, train_loss: 1.0855, test_loss: 1.1117, test_f1: 0.4022
 epoch: 94, train_loss: 1.0732, test_loss: 1.1218, test_f1: 0.4024
 epoch: 95, train_loss: 1.0732, test_loss: 1.1172, test_f1: 0.4060
 epoch: 96, train_loss: 1.0765, test_loss: 1.1104, test_f1: 0.4142
 epoch: 97, train_loss: 1.0759, test_loss: 1.1152, test_f1: 0.4156
 epoch: 98, train_loss: 1.0742, test_loss: 1.1153, test_f1: 0.4103
 epoch: 99, train_loss: 1.0692, test_loss: 1.1229, test_f1: 0.4056

Training completed in 419.75 seconds
Best F1: 0.4721 at epoch 95
Mean F1 across iterations: 0.4243  0.0330
========================FINAL RESULTS================================
FEGIN weighted F1: 0.4721  0.0330
python main.py --data ltspice_examples --representation component_component --model FEGIN --layers 6 --hiddens 32 --batch_size 256 --lr 0.0001 --emb_size 250 --epochs 100 --save_appendix component_component_L6_H32_BS256_LR0.0001_E250 --no_val
-----



STDERR:
  File "main.py", line 370, in <module>
    main()
  File "main.py", line 254, in main
    dataset = dataset_class(
  File "/home/philip/projects/ltspice_examples_code_repo/Circuit-Completion-Using-GNNs/component_classification_with_link_prediction_head/evaluation/FEGIN/kernel/circuit_datasets.py", line 15, in __init__
    self.data, self.slices = torch.load(self.processed_paths[0])
  File "/home/philip/.local/lib/python3.8/site-packages/torch/serialization.py", line 1040, in load
    warnings.warn(
  File "/usr/lib/python3.8/warnings.py", line 109, in _showwarnmsg
    sw(msg.message, msg.category, msg.filename, msg.lineno,
  File "main.py", line 47, in warn_with_traceback
    traceback.print_stack(file=log)
/home/philip/projects/ltspice_examples_code_repo/Circuit-Completion-Using-GNNs/component_classification_with_link_prediction_head/evaluation/FEGIN/kernel/circuit_datasets.py:15: FutureWarning: You are using `torch.load` with `weights_only=False` (the current default value), which uses the default pickle module implicitly. It is possible to construct malicious pickle data which will execute arbitrary code during unpickling (See https://github.com/pytorch/pytorch/blob/main/SECURITY.md#untrusted-models for more details). In a future release, the default value for `weights_only` will be flipped to `True`. This limits the functions that could be executed during unpickling. Arbitrary objects will no longer be allowed to be loaded via this mode unless they are explicitly allowlisted by the user via `torch.serialization.add_safe_globals`. We recommend you start setting `weights_only=True` for any use case where you don't have full control of the loaded file. Please open an issue on GitHub for any issues related to this experimental feature.
  self.data, self.slices = torch.load(self.processed_paths[0])
