STDOUT:
Results will be saved in /home/philip/projects/ltspice_examples_code_repo/Circuit-Completion-Using-GNNs/component_classification_with_link_prediction_head/evaluation/FEGIN/results/model_FEGIN_dataset_ltspice_examples
Command line input: python main.py --data ltspice_examples --representation component_pin_net --model FEGIN --layers 2 --hiddens 64 --batch_size 32 --lr 0.01 --emb_size 128 --epochs 100 --save_appendix component_pin_net_L2_H64_BS32_LR0.01_E128 --no_val
 is saved.
-----
ltspice_examples - FEGIN
Using 2 layers, 64 hidden units, h = 2
Loading component_pin_net representation dataset
ENTERED
Training FEGIN on component_pin_net representation
Train: 3558, Test: 846
##################ITERATION #0 ****************************************
 epoch: 0, train_loss: 1.1220, test_loss: 1.1368, test_f1: 0.4282
 epoch: 1, train_loss: 1.0191, test_loss: 1.1393, test_f1: 0.4922
 epoch: 2, train_loss: 1.0161, test_loss: 1.0218, test_f1: 0.4643
 epoch: 3, train_loss: 0.9861, test_loss: 1.0047, test_f1: 0.4915
 epoch: 4, train_loss: 0.9670, test_loss: 1.0570, test_f1: 0.5158
 epoch: 5, train_loss: 0.9401, test_loss: 0.9443, test_f1: 0.4962
 epoch: 6, train_loss: 0.9356, test_loss: 1.0300, test_f1: 0.4911
 epoch: 7, train_loss: 0.9363, test_loss: 1.0389, test_f1: 0.5038
 epoch: 8, train_loss: 0.9072, test_loss: 0.9226, test_f1: 0.5225
 epoch: 9, train_loss: 0.8997, test_loss: 0.8624, test_f1: 0.5158
 epoch: 10, train_loss: 0.8700, test_loss: 0.9067, test_f1: 0.5302
 epoch: 11, train_loss: 0.8743, test_loss: 0.8620, test_f1: 0.5058
 epoch: 12, train_loss: 0.8649, test_loss: 0.8708, test_f1: 0.5344
 epoch: 13, train_loss: 0.8649, test_loss: 0.9667, test_f1: 0.5679
 epoch: 14, train_loss: 0.8584, test_loss: 0.8265, test_f1: 0.5411
 epoch: 15, train_loss: 0.8263, test_loss: 0.8990, test_f1: 0.5964
 epoch: 16, train_loss: 0.8218, test_loss: 1.0195, test_f1: 0.5172
 epoch: 17, train_loss: 0.8289, test_loss: 0.8847, test_f1: 0.6171
 epoch: 18, train_loss: 0.8199, test_loss: 0.8413, test_f1: 0.5868
 epoch: 19, train_loss: 0.8182, test_loss: 0.8915, test_f1: 0.5528
 epoch: 20, train_loss: 0.8053, test_loss: 0.8994, test_f1: 0.5370
 epoch: 21, train_loss: 0.8167, test_loss: 0.9131, test_f1: 0.5315
 epoch: 22, train_loss: 0.7991, test_loss: 0.8938, test_f1: 0.5825
 epoch: 23, train_loss: 0.7936, test_loss: 0.8866, test_f1: 0.5937
 epoch: 24, train_loss: 0.7915, test_loss: 0.8429, test_f1: 0.5496
 epoch: 25, train_loss: 0.7750, test_loss: 0.8995, test_f1: 0.6153
 epoch: 26, train_loss: 0.7985, test_loss: 0.8284, test_f1: 0.5714
 epoch: 27, train_loss: 0.7724, test_loss: 1.0077, test_f1: 0.5687
 epoch: 28, train_loss: 0.7669, test_loss: 0.8181, test_f1: 0.5979
 epoch: 29, train_loss: 0.7671, test_loss: 0.8747, test_f1: 0.5430
 epoch: 30, train_loss: 0.7811, test_loss: 0.8245, test_f1: 0.5747
 epoch: 31, train_loss: 0.7844, test_loss: 0.8718, test_f1: 0.6221
 epoch: 32, train_loss: 0.7747, test_loss: 0.8802, test_f1: 0.6370
 epoch: 33, train_loss: 0.7624, test_loss: 0.8937, test_f1: 0.6189
 epoch: 34, train_loss: 0.7477, test_loss: 0.9481, test_f1: 0.6464
 epoch: 35, train_loss: 0.7701, test_loss: 0.9354, test_f1: 0.6196
 epoch: 36, train_loss: 0.7562, test_loss: 0.8927, test_f1: 0.5963
 epoch: 37, train_loss: 0.7413, test_loss: 0.8508, test_f1: 0.6071
 epoch: 38, train_loss: 0.7562, test_loss: 0.8373, test_f1: 0.6223
 epoch: 39, train_loss: 0.7401, test_loss: 1.0496, test_f1: 0.5694
 epoch: 40, train_loss: 0.7415, test_loss: 0.8664, test_f1: 0.6374
 epoch: 41, train_loss: 0.7287, test_loss: 0.8053, test_f1: 0.5928
 epoch: 42, train_loss: 0.7193, test_loss: 0.9302, test_f1: 0.6431
 epoch: 43, train_loss: 0.7308, test_loss: 0.8914, test_f1: 0.6424
 epoch: 44, train_loss: 0.7334, test_loss: 0.9801, test_f1: 0.6164
 epoch: 45, train_loss: 0.7172, test_loss: 0.9040, test_f1: 0.6163
 epoch: 46, train_loss: 0.7396, test_loss: 0.9908, test_f1: 0.5951
 epoch: 47, train_loss: 0.7236, test_loss: 1.3992, test_f1: 0.6240
 epoch: 48, train_loss: 0.7186, test_loss: 1.0633, test_f1: 0.6050
 epoch: 49, train_loss: 0.7072, test_loss: 1.2798, test_f1: 0.6194
 epoch: 50, train_loss: 0.7236, test_loss: 1.0652, test_f1: 0.6119
 epoch: 51, train_loss: 0.6788, test_loss: 0.9877, test_f1: 0.6408
 epoch: 52, train_loss: 0.6577, test_loss: 1.0041, test_f1: 0.6392
 epoch: 53, train_loss: 0.6455, test_loss: 1.0648, test_f1: 0.6493
 epoch: 54, train_loss: 0.6396, test_loss: 1.0211, test_f1: 0.6447
 epoch: 55, train_loss: 0.6445, test_loss: 1.1453, test_f1: 0.6466
 epoch: 56, train_loss: 0.6491, test_loss: 1.1440, test_f1: 0.6077
 epoch: 57, train_loss: 0.6546, test_loss: 0.9497, test_f1: 0.6427
 epoch: 58, train_loss: 0.6416, test_loss: 1.1626, test_f1: 0.6675
 epoch: 59, train_loss: 0.6356, test_loss: 1.0667, test_f1: 0.6092
 epoch: 60, train_loss: 0.6441, test_loss: 0.9564, test_f1: 0.6840
 epoch: 61, train_loss: 0.6198, test_loss: 1.1767, test_f1: 0.6704
 epoch: 62, train_loss: 0.6198, test_loss: 1.4588, test_f1: 0.6305
 epoch: 63, train_loss: 0.6272, test_loss: 1.4295, test_f1: 0.6394
 epoch: 64, train_loss: 0.6090, test_loss: 1.1692, test_f1: 0.6496
 epoch: 65, train_loss: 0.6192, test_loss: 1.2037, test_f1: 0.6628
 epoch: 66, train_loss: 0.6143, test_loss: 1.1089, test_f1: 0.6521
 epoch: 67, train_loss: 0.6219, test_loss: 1.1578, test_f1: 0.6533
 epoch: 68, train_loss: 0.6135, test_loss: 1.0622, test_f1: 0.6498
 epoch: 69, train_loss: 0.6086, test_loss: 0.9620, test_f1: 0.6597
 epoch: 70, train_loss: 0.5988, test_loss: 1.1003, test_f1: 0.6573
 epoch: 71, train_loss: 0.6142, test_loss: 1.1414, test_f1: 0.6269
 epoch: 72, train_loss: 0.6056, test_loss: 1.0523, test_f1: 0.6762
 epoch: 73, train_loss: 0.6017, test_loss: 1.0732, test_f1: 0.6260
 epoch: 74, train_loss: 0.5991, test_loss: 1.0546, test_f1: 0.6827
 epoch: 75, train_loss: 0.5871, test_loss: 0.9887, test_f1: 0.6729
 epoch: 76, train_loss: 0.5972, test_loss: 1.0179, test_f1: 0.6738
 epoch: 77, train_loss: 0.5887, test_loss: 1.0496, test_f1: 0.6596
 epoch: 78, train_loss: 0.5998, test_loss: 1.3804, test_f1: 0.6509
 epoch: 79, train_loss: 0.5869, test_loss: 1.0377, test_f1: 0.6569
 epoch: 80, train_loss: 0.5616, test_loss: 1.0898, test_f1: 0.6613
 epoch: 81, train_loss: 0.5817, test_loss: 1.0319, test_f1: 0.6660
 epoch: 82, train_loss: 0.5875, test_loss: 1.1776, test_f1: 0.6645
 epoch: 83, train_loss: 0.5786, test_loss: 1.2117, test_f1: 0.6566
 epoch: 84, train_loss: 0.5760, test_loss: 1.2237, test_f1: 0.6389
 epoch: 85, train_loss: 0.5579, test_loss: 1.1292, test_f1: 0.6584
 epoch: 86, train_loss: 0.5708, test_loss: 1.1316, test_f1: 0.6289
 epoch: 87, train_loss: 0.5537, test_loss: 1.1087, test_f1: 0.6602
 epoch: 88, train_loss: 0.5828, test_loss: 1.4616, test_f1: 0.6541
 epoch: 89, train_loss: 0.5833, test_loss: 1.6022, test_f1: 0.6488
 epoch: 90, train_loss: 0.5672, test_loss: 1.0980, test_f1: 0.6938
 epoch: 91, train_loss: 0.5504, test_loss: 1.1327, test_f1: 0.6798
 epoch: 92, train_loss: 0.5746, test_loss: 1.2282, test_f1: 0.6442
 epoch: 93, train_loss: 0.5647, test_loss: 1.5044, test_f1: 0.6555
 epoch: 94, train_loss: 0.5538, test_loss: 1.6052, test_f1: 0.6444
 epoch: 95, train_loss: 0.5603, test_loss: 1.4231, test_f1: 0.6489
 epoch: 96, train_loss: 0.5573, test_loss: 1.5128, test_f1: 0.6620
 epoch: 97, train_loss: 0.5321, test_loss: 1.3655, test_f1: 0.6659
 epoch: 98, train_loss: 0.5581, test_loss: 1.3785, test_f1: 0.6500
 epoch: 99, train_loss: 0.5426, test_loss: 1.3102, test_f1: 0.6550
##################ITERATION #1 ****************************************
 epoch: 0, train_loss: 1.1062, test_loss: 1.0553, test_f1: 0.4522
 epoch: 1, train_loss: 1.0119, test_loss: 1.0691, test_f1: 0.4947
 epoch: 2, train_loss: 0.9828, test_loss: 1.0360, test_f1: 0.4774
 epoch: 3, train_loss: 0.9752, test_loss: 1.0687, test_f1: 0.4904
 epoch: 4, train_loss: 0.9578, test_loss: 1.0495, test_f1: 0.5380
 epoch: 5, train_loss: 0.9473, test_loss: 0.9581, test_f1: 0.4800
 epoch: 6, train_loss: 0.9345, test_loss: 1.0609, test_f1: 0.5150
 epoch: 7, train_loss: 0.9219, test_loss: 0.9408, test_f1: 0.4931
 epoch: 8, train_loss: 0.8987, test_loss: 0.9702, test_f1: 0.5083
 epoch: 9, train_loss: 0.8992, test_loss: 0.9169, test_f1: 0.5371
 epoch: 10, train_loss: 0.8793, test_loss: 1.0100, test_f1: 0.4949
 epoch: 11, train_loss: 0.8811, test_loss: 0.9026, test_f1: 0.5386
 epoch: 12, train_loss: 0.8593, test_loss: 0.8892, test_f1: 0.5577
 epoch: 13, train_loss: 0.8723, test_loss: 0.8841, test_f1: 0.5437
 epoch: 14, train_loss: 0.8650, test_loss: 1.0099, test_f1: 0.5780
 epoch: 15, train_loss: 0.8565, test_loss: 0.9007, test_f1: 0.5295
 epoch: 16, train_loss: 0.8314, test_loss: 0.8839, test_f1: 0.5383
 epoch: 17, train_loss: 0.8216, test_loss: 0.9318, test_f1: 0.5573
 epoch: 18, train_loss: 0.8355, test_loss: 0.8925, test_f1: 0.5415
 epoch: 19, train_loss: 0.8283, test_loss: 0.8208, test_f1: 0.6294
 epoch: 20, train_loss: 0.8112, test_loss: 0.8530, test_f1: 0.6021
 epoch: 21, train_loss: 0.8217, test_loss: 0.9030, test_f1: 0.5904
 epoch: 22, train_loss: 0.8001, test_loss: 0.8556, test_f1: 0.6031
 epoch: 23, train_loss: 0.8027, test_loss: 0.8371, test_f1: 0.6261
 epoch: 24, train_loss: 0.8049, test_loss: 0.8476, test_f1: 0.6280
 epoch: 25, train_loss: 0.8041, test_loss: 0.8374, test_f1: 0.6380
 epoch: 26, train_loss: 0.8043, test_loss: 0.8445, test_f1: 0.6325
 epoch: 27, train_loss: 0.7727, test_loss: 0.9425, test_f1: 0.5966
 epoch: 28, train_loss: 0.7713, test_loss: 0.9316, test_f1: 0.6331
 epoch: 29, train_loss: 0.7605, test_loss: 0.9400, test_f1: 0.6521
 epoch: 30, train_loss: 0.7728, test_loss: 1.0492, test_f1: 0.6033
 epoch: 31, train_loss: 0.7586, test_loss: 0.9642, test_f1: 0.6116
 epoch: 32, train_loss: 0.7534, test_loss: 1.0977, test_f1: 0.6415
 epoch: 33, train_loss: 0.7743, test_loss: 0.9667, test_f1: 0.6004
 epoch: 34, train_loss: 0.7444, test_loss: 0.9341, test_f1: 0.6218
 epoch: 35, train_loss: 0.7385, test_loss: 0.9999, test_f1: 0.6119
 epoch: 36, train_loss: 0.7338, test_loss: 0.9001, test_f1: 0.6699
 epoch: 37, train_loss: 0.7468, test_loss: 0.9680, test_f1: 0.6223
 epoch: 38, train_loss: 0.7545, test_loss: 1.1346, test_f1: 0.5456
 epoch: 39, train_loss: 0.7238, test_loss: 0.9902, test_f1: 0.6141
 epoch: 40, train_loss: 0.7253, test_loss: 0.9364, test_f1: 0.5896
 epoch: 41, train_loss: 0.7200, test_loss: 0.9931, test_f1: 0.6478
 epoch: 42, train_loss: 0.6962, test_loss: 0.9538, test_f1: 0.6548
 epoch: 43, train_loss: 0.7169, test_loss: 1.1697, test_f1: 0.5524
 epoch: 44, train_loss: 0.7209, test_loss: 1.1507, test_f1: 0.5818
 epoch: 45, train_loss: 0.9064, test_loss: 0.9377, test_f1: 0.5257
 epoch: 46, train_loss: 0.8548, test_loss: 0.9232, test_f1: 0.5776
 epoch: 47, train_loss: 0.8145, test_loss: 0.9941, test_f1: 0.5603
 epoch: 48, train_loss: 0.7717, test_loss: 0.8338, test_f1: 0.6160
 epoch: 49, train_loss: 0.7463, test_loss: 0.9499, test_f1: 0.6015
 epoch: 50, train_loss: 0.7341, test_loss: 0.8785, test_f1: 0.6114
 epoch: 51, train_loss: 0.7078, test_loss: 0.8911, test_f1: 0.6487
 epoch: 52, train_loss: 0.6780, test_loss: 0.8762, test_f1: 0.6742
 epoch: 53, train_loss: 0.6671, test_loss: 0.9657, test_f1: 0.6620
 epoch: 54, train_loss: 0.6689, test_loss: 0.9121, test_f1: 0.6523
 epoch: 55, train_loss: 0.6626, test_loss: 0.9263, test_f1: 0.6249
 epoch: 56, train_loss: 0.6458, test_loss: 0.9982, test_f1: 0.6835
 epoch: 57, train_loss: 0.6494, test_loss: 1.0494, test_f1: 0.6487
 epoch: 58, train_loss: 0.6463, test_loss: 1.0198, test_f1: 0.6572
 epoch: 59, train_loss: 0.6523, test_loss: 0.9634, test_f1: 0.6556
 epoch: 60, train_loss: 0.6372, test_loss: 0.9628, test_f1: 0.6672
 epoch: 61, train_loss: 0.6447, test_loss: 1.0664, test_f1: 0.6609
 epoch: 62, train_loss: 0.6422, test_loss: 1.0476, test_f1: 0.6516
 epoch: 63, train_loss: 0.6471, test_loss: 1.0495, test_f1: 0.6288
 epoch: 64, train_loss: 0.6327, test_loss: 1.2793, test_f1: 0.6858
 epoch: 65, train_loss: 0.6220, test_loss: 1.0262, test_f1: 0.6402
 epoch: 66, train_loss: 0.6381, test_loss: 1.2268, test_f1: 0.6378
 epoch: 67, train_loss: 0.6095, test_loss: 1.2437, test_f1: 0.6529
 epoch: 68, train_loss: 0.6270, test_loss: 1.1250, test_f1: 0.6514
 epoch: 69, train_loss: 0.6244, test_loss: 1.1620, test_f1: 0.6639
 epoch: 70, train_loss: 0.6064, test_loss: 1.0947, test_f1: 0.6525
 epoch: 71, train_loss: 0.5898, test_loss: 1.1270, test_f1: 0.6685
 epoch: 72, train_loss: 0.6077, test_loss: 1.1736, test_f1: 0.6686
 epoch: 73, train_loss: 0.6123, test_loss: 1.2112, test_f1: 0.6389
 epoch: 74, train_loss: 0.5929, test_loss: 1.3718, test_f1: 0.6500
 epoch: 75, train_loss: 0.6200, test_loss: 1.4323, test_f1: 0.6614
 epoch: 76, train_loss: 0.6018, test_loss: 1.3338, test_f1: 0.6602
 epoch: 77, train_loss: 0.5914, test_loss: 1.5422, test_f1: 0.6563
 epoch: 78, train_loss: 0.5847, test_loss: 1.5110, test_f1: 0.6441
 epoch: 79, train_loss: 0.5979, test_loss: 1.3678, test_f1: 0.6714
 epoch: 80, train_loss: 0.5881, test_loss: 1.4668, test_f1: 0.6565
 epoch: 81, train_loss: 0.5881, test_loss: 1.2661, test_f1: 0.6679
 epoch: 82, train_loss: 0.5848, test_loss: 1.4129, test_f1: 0.6527
 epoch: 83, train_loss: 0.5904, test_loss: 1.1737, test_f1: 0.6831
 epoch: 84, train_loss: 0.5875, test_loss: 1.5021, test_f1: 0.6482
 epoch: 85, train_loss: 0.5852, test_loss: 1.2346, test_f1: 0.6463
 epoch: 86, train_loss: 0.5892, test_loss: 1.1565, test_f1: 0.6821
 epoch: 87, train_loss: 0.5876, test_loss: 1.1340, test_f1: 0.6450
 epoch: 88, train_loss: 0.5737, test_loss: 1.1708, test_f1: 0.6635
 epoch: 89, train_loss: 0.5763, test_loss: 1.2885, test_f1: 0.6443
 epoch: 90, train_loss: 0.5706, test_loss: 1.2389, test_f1: 0.6381
 epoch: 91, train_loss: 0.5858, test_loss: 1.2053, test_f1: 0.6726
 epoch: 92, train_loss: 0.5544, test_loss: 1.2490, test_f1: 0.6564
 epoch: 93, train_loss: 0.5644, test_loss: 1.3952, test_f1: 0.6813
 epoch: 94, train_loss: 0.5553, test_loss: 1.5304, test_f1: 0.6373
 epoch: 95, train_loss: 0.5396, test_loss: 1.4332, test_f1: 0.6663
 epoch: 96, train_loss: 0.5404, test_loss: 1.5440, test_f1: 0.6637
 epoch: 97, train_loss: 0.5485, test_loss: 1.4291, test_f1: 0.6470
 epoch: 98, train_loss: 0.5743, test_loss: 1.3250, test_f1: 0.6597
 epoch: 99, train_loss: 0.5560, test_loss: 1.3646, test_f1: 0.6577
##################ITERATION #2 ****************************************
 epoch: 0, train_loss: 1.1092, test_loss: 1.0362, test_f1: 0.4237
 epoch: 1, train_loss: 1.0189, test_loss: 1.0033, test_f1: 0.4344
 epoch: 2, train_loss: 0.9803, test_loss: 0.9694, test_f1: 0.4449
 epoch: 3, train_loss: 0.9643, test_loss: 0.9449, test_f1: 0.5262
 epoch: 4, train_loss: 0.9452, test_loss: 0.9369, test_f1: 0.5072
 epoch: 5, train_loss: 0.9262, test_loss: 0.8846, test_f1: 0.5662
 epoch: 6, train_loss: 0.9164, test_loss: 0.9180, test_f1: 0.5264
 epoch: 7, train_loss: 0.9081, test_loss: 0.9740, test_f1: 0.5015
 epoch: 8, train_loss: 0.9024, test_loss: 0.8992, test_f1: 0.5296
 epoch: 9, train_loss: 0.8880, test_loss: 1.0071, test_f1: 0.5301
 epoch: 10, train_loss: 0.8714, test_loss: 0.9455, test_f1: 0.5033
 epoch: 11, train_loss: 0.8747, test_loss: 0.8622, test_f1: 0.5190
 epoch: 12, train_loss: 0.8438, test_loss: 0.8436, test_f1: 0.5548
 epoch: 13, train_loss: 0.8408, test_loss: 0.8399, test_f1: 0.5453
 epoch: 14, train_loss: 0.8444, test_loss: 0.9519, test_f1: 0.5437
 epoch: 15, train_loss: 0.8402, test_loss: 0.8680, test_f1: 0.5498
 epoch: 16, train_loss: 0.8130, test_loss: 0.9878, test_f1: 0.5223
 epoch: 17, train_loss: 0.8092, test_loss: 0.8607, test_f1: 0.6223
 epoch: 18, train_loss: 0.8341, test_loss: 0.7805, test_f1: 0.6336
 epoch: 19, train_loss: 0.8062, test_loss: 0.8765, test_f1: 0.5823
 epoch: 20, train_loss: 0.8026, test_loss: 0.9229, test_f1: 0.5599
 epoch: 21, train_loss: 0.7971, test_loss: 0.8197, test_f1: 0.6148
 epoch: 22, train_loss: 0.7747, test_loss: 0.9217, test_f1: 0.6223
 epoch: 23, train_loss: 0.7897, test_loss: 0.9158, test_f1: 0.5896
 epoch: 24, train_loss: 0.7921, test_loss: 0.8974, test_f1: 0.6288
 epoch: 25, train_loss: 0.7749, test_loss: 0.8027, test_f1: 0.6543
 epoch: 26, train_loss: 0.7783, test_loss: 0.7736, test_f1: 0.6158
 epoch: 27, train_loss: 0.7751, test_loss: 0.8876, test_f1: 0.6023
 epoch: 28, train_loss: 0.7743, test_loss: 0.7936, test_f1: 0.5762
 epoch: 29, train_loss: 0.7457, test_loss: 0.9193, test_f1: 0.5810
 epoch: 30, train_loss: 0.7756, test_loss: 0.7996, test_f1: 0.6295
 epoch: 31, train_loss: 0.7648, test_loss: 0.8863, test_f1: 0.6305
 epoch: 32, train_loss: 0.7920, test_loss: 0.7702, test_f1: 0.6527
 epoch: 33, train_loss: 0.7553, test_loss: 0.8157, test_f1: 0.6215
 epoch: 34, train_loss: 0.7587, test_loss: 0.8365, test_f1: 0.6281
 epoch: 35, train_loss: 0.7479, test_loss: 0.9148, test_f1: 0.6562
 epoch: 36, train_loss: 0.7940, test_loss: 0.8516, test_f1: 0.5875
 epoch: 37, train_loss: 0.7427, test_loss: 0.7985, test_f1: 0.6592
 epoch: 38, train_loss: 0.7242, test_loss: 0.8348, test_f1: 0.5982
 epoch: 39, train_loss: 0.7366, test_loss: 0.9548, test_f1: 0.6086
 epoch: 40, train_loss: 0.7250, test_loss: 0.8267, test_f1: 0.6306
 epoch: 41, train_loss: 0.7034, test_loss: 0.9176, test_f1: 0.6060
 epoch: 42, train_loss: 0.7189, test_loss: 0.8845, test_f1: 0.6228
 epoch: 43, train_loss: 0.7166, test_loss: 0.7674, test_f1: 0.6408
 epoch: 44, train_loss: 0.7148, test_loss: 0.8330, test_f1: 0.6377
 epoch: 45, train_loss: 0.7215, test_loss: 0.8823, test_f1: 0.6016
 epoch: 46, train_loss: 0.7054, test_loss: 0.8305, test_f1: 0.6361
 epoch: 47, train_loss: 0.7095, test_loss: 0.8413, test_f1: 0.6416
 epoch: 48, train_loss: 0.6977, test_loss: 0.7875, test_f1: 0.6672
 epoch: 49, train_loss: 0.6965, test_loss: 0.8766, test_f1: 0.6282
 epoch: 50, train_loss: 0.6726, test_loss: 0.9423, test_f1: 0.6235
 epoch: 51, train_loss: 0.6518, test_loss: 0.8033, test_f1: 0.6586
 epoch: 52, train_loss: 0.6341, test_loss: 0.9416, test_f1: 0.6466
 epoch: 53, train_loss: 0.6462, test_loss: 0.8152, test_f1: 0.6489
 epoch: 54, train_loss: 0.6245, test_loss: 0.7100, test_f1: 0.6771
 epoch: 55, train_loss: 0.6268, test_loss: 0.8371, test_f1: 0.6546
 epoch: 56, train_loss: 0.6213, test_loss: 0.8660, test_f1: 0.6723
 epoch: 57, train_loss: 0.6116, test_loss: 0.8006, test_f1: 0.6494
 epoch: 58, train_loss: 0.6207, test_loss: 0.8789, test_f1: 0.6785
 epoch: 59, train_loss: 0.6229, test_loss: 0.8126, test_f1: 0.6894
 epoch: 60, train_loss: 0.6173, test_loss: 0.8826, test_f1: 0.6775
 epoch: 61, train_loss: 0.6094, test_loss: 0.9571, test_f1: 0.6738
 epoch: 62, train_loss: 0.6042, test_loss: 0.8084, test_f1: 0.6757
 epoch: 63, train_loss: 0.5986, test_loss: 0.8319, test_f1: 0.6835
 epoch: 64, train_loss: 0.5792, test_loss: 0.9254, test_f1: 0.6726
 epoch: 65, train_loss: 0.5961, test_loss: 0.9301, test_f1: 0.6562
 epoch: 66, train_loss: 0.5737, test_loss: 0.8644, test_f1: 0.6549
 epoch: 67, train_loss: 0.5789, test_loss: 0.8131, test_f1: 0.6877
 epoch: 68, train_loss: 0.5852, test_loss: 0.8071, test_f1: 0.6680
 epoch: 69, train_loss: 0.5793, test_loss: 0.8521, test_f1: 0.6797
 epoch: 70, train_loss: 0.5875, test_loss: 0.9020, test_f1: 0.6618
 epoch: 71, train_loss: 0.5947, test_loss: 0.9511, test_f1: 0.6733
 epoch: 72, train_loss: 0.5923, test_loss: 1.0030, test_f1: 0.6604
 epoch: 73, train_loss: 0.5644, test_loss: 0.9046, test_f1: 0.6781
 epoch: 74, train_loss: 0.5588, test_loss: 1.0128, test_f1: 0.6771
 epoch: 75, train_loss: 0.5731, test_loss: 0.9084, test_f1: 0.6657
 epoch: 76, train_loss: 0.5591, test_loss: 0.9361, test_f1: 0.6446
 epoch: 77, train_loss: 0.5736, test_loss: 0.9713, test_f1: 0.6489
 epoch: 78, train_loss: 0.5814, test_loss: 0.8950, test_f1: 0.6695
 epoch: 79, train_loss: 0.5650, test_loss: 0.8602, test_f1: 0.6629
 epoch: 80, train_loss: 0.5674, test_loss: 0.9218, test_f1: 0.6757
 epoch: 81, train_loss: 0.5589, test_loss: 0.8578, test_f1: 0.6680
 epoch: 82, train_loss: 0.5517, test_loss: 0.9048, test_f1: 0.6606
 epoch: 83, train_loss: 0.5584, test_loss: 0.8388, test_f1: 0.6675
 epoch: 84, train_loss: 0.5499, test_loss: 0.9266, test_f1: 0.6500
 epoch: 85, train_loss: 0.5449, test_loss: 0.9035, test_f1: 0.6902
 epoch: 86, train_loss: 0.5481, test_loss: 0.8930, test_f1: 0.6766
 epoch: 87, train_loss: 0.5302, test_loss: 0.9349, test_f1: 0.6614
 epoch: 88, train_loss: 0.5407, test_loss: 0.9064, test_f1: 0.6774
 epoch: 89, train_loss: 0.5352, test_loss: 0.9115, test_f1: 0.6645
 epoch: 90, train_loss: 0.5377, test_loss: 0.8638, test_f1: 0.6731
 epoch: 91, train_loss: 0.5302, test_loss: 0.9296, test_f1: 0.6587
 epoch: 92, train_loss: 0.5154, test_loss: 0.9427, test_f1: 0.6809
 epoch: 93, train_loss: 0.5498, test_loss: 0.9320, test_f1: 0.6790
 epoch: 94, train_loss: 0.5443, test_loss: 0.9217, test_f1: 0.6672
 epoch: 95, train_loss: 0.5435, test_loss: 0.9226, test_f1: 0.6691
 epoch: 96, train_loss: 0.5300, test_loss: 0.8640, test_f1: 0.6854
 epoch: 97, train_loss: 0.5305, test_loss: 0.8973, test_f1: 0.6921
 epoch: 98, train_loss: 0.5286, test_loss: 0.8327, test_f1: 0.6715
 epoch: 99, train_loss: 0.5306, test_loss: 0.9295, test_f1: 0.6836
##################ITERATION #3 ****************************************
 epoch: 0, train_loss: 1.1321, test_loss: 1.0786, test_f1: 0.3801
 epoch: 1, train_loss: 1.0469, test_loss: 1.1441, test_f1: 0.4170
 epoch: 2, train_loss: 1.0164, test_loss: 1.0567, test_f1: 0.4488
 epoch: 3, train_loss: 0.9920, test_loss: 1.0242, test_f1: 0.4720
 epoch: 4, train_loss: 0.9655, test_loss: 1.0522, test_f1: 0.4930
 epoch: 5, train_loss: 0.9789, test_loss: 0.9515, test_f1: 0.4927
 epoch: 6, train_loss: 0.9554, test_loss: 1.0128, test_f1: 0.4861
 epoch: 7, train_loss: 0.9379, test_loss: 1.0192, test_f1: 0.4324
 epoch: 8, train_loss: 0.9467, test_loss: 0.9982, test_f1: 0.4941
 epoch: 9, train_loss: 0.9250, test_loss: 0.9735, test_f1: 0.4822
 epoch: 10, train_loss: 0.9221, test_loss: 0.9040, test_f1: 0.4881
 epoch: 11, train_loss: 0.9051, test_loss: 1.0119, test_f1: 0.5008
 epoch: 12, train_loss: 0.8927, test_loss: 1.0013, test_f1: 0.5118
 epoch: 13, train_loss: 0.9080, test_loss: 1.0404, test_f1: 0.5088
 epoch: 14, train_loss: 0.8943, test_loss: 0.8774, test_f1: 0.5123
 epoch: 15, train_loss: 0.8760, test_loss: 1.0135, test_f1: 0.5069
 epoch: 16, train_loss: 0.8725, test_loss: 0.8828, test_f1: 0.5175
 epoch: 17, train_loss: 0.8762, test_loss: 0.9912, test_f1: 0.5122
 epoch: 18, train_loss: 0.8779, test_loss: 1.0902, test_f1: 0.4857
 epoch: 19, train_loss: 0.8647, test_loss: 0.8685, test_f1: 0.5234
 epoch: 20, train_loss: 0.8629, test_loss: 0.8781, test_f1: 0.5175
 epoch: 21, train_loss: 0.8369, test_loss: 0.8972, test_f1: 0.5191
 epoch: 22, train_loss: 0.8479, test_loss: 1.0946, test_f1: 0.4867
 epoch: 23, train_loss: 0.8325, test_loss: 0.8088, test_f1: 0.5309
 epoch: 24, train_loss: 0.8350, test_loss: 0.9042, test_f1: 0.5450
 epoch: 25, train_loss: 0.8247, test_loss: 0.9392, test_f1: 0.5301
 epoch: 26, train_loss: 0.8102, test_loss: 0.8773, test_f1: 0.5101
 epoch: 27, train_loss: 0.8007, test_loss: 0.8956, test_f1: 0.5264
 epoch: 28, train_loss: 0.8188, test_loss: 0.8312, test_f1: 0.5479
 epoch: 29, train_loss: 0.8054, test_loss: 1.0572, test_f1: 0.5348
 epoch: 30, train_loss: 0.7904, test_loss: 0.8997, test_f1: 0.5482
 epoch: 31, train_loss: 0.7894, test_loss: 0.8924, test_f1: 0.5606
 epoch: 32, train_loss: 0.7852, test_loss: 0.8837, test_f1: 0.5555
 epoch: 33, train_loss: 0.7859, test_loss: 0.9010, test_f1: 0.6041
 epoch: 34, train_loss: 0.7751, test_loss: 1.0649, test_f1: 0.5424
 epoch: 35, train_loss: 0.7764, test_loss: 1.0214, test_f1: 0.5235
 epoch: 36, train_loss: 0.7561, test_loss: 1.0197, test_f1: 0.5607
 epoch: 37, train_loss: 0.7866, test_loss: 0.9127, test_f1: 0.5660
 epoch: 38, train_loss: 0.7643, test_loss: 0.9015, test_f1: 0.5707
 epoch: 39, train_loss: 0.7818, test_loss: 1.0063, test_f1: 0.5607
 epoch: 40, train_loss: 0.7602, test_loss: 0.9779, test_f1: 0.5747
 epoch: 41, train_loss: 0.7527, test_loss: 1.0405, test_f1: 0.5514
 epoch: 42, train_loss: 0.7521, test_loss: 1.2484, test_f1: 0.5108
 epoch: 43, train_loss: 0.7455, test_loss: 1.0300, test_f1: 0.6262
 epoch: 44, train_loss: 0.7433, test_loss: 1.0657, test_f1: 0.5685
 epoch: 45, train_loss: 0.7284, test_loss: 1.0576, test_f1: 0.5859
 epoch: 46, train_loss: 0.7238, test_loss: 1.0229, test_f1: 0.5677
 epoch: 47, train_loss: 0.7225, test_loss: 1.0982, test_f1: 0.5632
 epoch: 48, train_loss: 0.7334, test_loss: 1.1033, test_f1: 0.5615
 epoch: 49, train_loss: 0.7245, test_loss: 1.0684, test_f1: 0.6065
 epoch: 50, train_loss: 0.7052, test_loss: 0.9926, test_f1: 0.5872
 epoch: 51, train_loss: 0.6786, test_loss: 0.9599, test_f1: 0.6232
 epoch: 52, train_loss: 0.6588, test_loss: 1.0236, test_f1: 0.6202
 epoch: 53, train_loss: 0.6645, test_loss: 1.0154, test_f1: 0.6468
 epoch: 54, train_loss: 0.6562, test_loss: 1.0226, test_f1: 0.6247
 epoch: 55, train_loss: 0.6451, test_loss: 0.9524, test_f1: 0.6069
 epoch: 56, train_loss: 0.6522, test_loss: 0.9655, test_f1: 0.6202
 epoch: 57, train_loss: 0.6511, test_loss: 1.1052, test_f1: 0.6181
 epoch: 58, train_loss: 0.6523, test_loss: 0.9902, test_f1: 0.6658
 epoch: 59, train_loss: 0.6398, test_loss: 1.0107, test_f1: 0.6380
 epoch: 60, train_loss: 0.6288, test_loss: 0.9837, test_f1: 0.6555
 epoch: 61, train_loss: 0.6369, test_loss: 0.9797, test_f1: 0.6428
 epoch: 62, train_loss: 0.6325, test_loss: 0.9002, test_f1: 0.6319
 epoch: 63, train_loss: 0.6450, test_loss: 1.0658, test_f1: 0.6129
 epoch: 64, train_loss: 0.6244, test_loss: 0.9944, test_f1: 0.6349
 epoch: 65, train_loss: 0.6289, test_loss: 0.9737, test_f1: 0.6470
 epoch: 66, train_loss: 0.6272, test_loss: 0.9450, test_f1: 0.6420
 epoch: 67, train_loss: 0.6196, test_loss: 1.0203, test_f1: 0.6667
 epoch: 68, train_loss: 0.6272, test_loss: 0.8183, test_f1: 0.6340
 epoch: 69, train_loss: 0.6109, test_loss: 1.0178, test_f1: 0.6515
 epoch: 70, train_loss: 0.6270, test_loss: 1.3129, test_f1: 0.6274
 epoch: 71, train_loss: 0.6149, test_loss: 1.0030, test_f1: 0.6573
 epoch: 72, train_loss: 0.6096, test_loss: 0.9404, test_f1: 0.6453
 epoch: 73, train_loss: 0.6117, test_loss: 0.9888, test_f1: 0.6272
 epoch: 74, train_loss: 0.5919, test_loss: 0.9557, test_f1: 0.6246
 epoch: 75, train_loss: 0.5928, test_loss: 0.9838, test_f1: 0.6440
 epoch: 76, train_loss: 0.5954, test_loss: 1.0710, test_f1: 0.6499
 epoch: 77, train_loss: 0.5969, test_loss: 1.0055, test_f1: 0.6390
 epoch: 78, train_loss: 0.5816, test_loss: 1.1049, test_f1: 0.6405
 epoch: 79, train_loss: 0.5896, test_loss: 1.0006, test_f1: 0.6434
 epoch: 80, train_loss: 0.5949, test_loss: 1.0303, test_f1: 0.6583
 epoch: 81, train_loss: 0.5955, test_loss: 1.0394, test_f1: 0.6545
 epoch: 82, train_loss: 0.5736, test_loss: 1.1236, test_f1: 0.6385
 epoch: 83, train_loss: 0.6036, test_loss: 1.0773, test_f1: 0.6642
 epoch: 84, train_loss: 0.5829, test_loss: 0.9225, test_f1: 0.6654
 epoch: 85, train_loss: 0.5530, test_loss: 1.0449, test_f1: 0.6595
 epoch: 86, train_loss: 0.5841, test_loss: 0.9892, test_f1: 0.6658
 epoch: 87, train_loss: 0.5789, test_loss: 0.9944, test_f1: 0.6629
 epoch: 88, train_loss: 0.5778, test_loss: 1.0771, test_f1: 0.6536
 epoch: 89, train_loss: 0.5478, test_loss: 1.0667, test_f1: 0.6583
 epoch: 90, train_loss: 0.5593, test_loss: 1.1089, test_f1: 0.6385
 epoch: 91, train_loss: 0.5538, test_loss: 1.0360, test_f1: 0.6644
 epoch: 92, train_loss: 0.5567, test_loss: 0.9324, test_f1: 0.6510
 epoch: 93, train_loss: 0.5695, test_loss: 1.0092, test_f1: 0.6634
 epoch: 94, train_loss: 0.5626, test_loss: 0.9850, test_f1: 0.6855
 epoch: 95, train_loss: 0.5794, test_loss: 0.9379, test_f1: 0.6546
 epoch: 96, train_loss: 0.5626, test_loss: 0.9812, test_f1: 0.6663
 epoch: 97, train_loss: 0.5446, test_loss: 0.9951, test_f1: 0.6775
 epoch: 98, train_loss: 0.5603, test_loss: 0.9809, test_f1: 0.6588
 epoch: 99, train_loss: 0.5331, test_loss: 0.9529, test_f1: 0.6584
##################ITERATION #4 ****************************************
 epoch: 0, train_loss: 1.1210, test_loss: 1.1298, test_f1: 0.4442
 epoch: 1, train_loss: 1.0009, test_loss: 1.0097, test_f1: 0.5105
 epoch: 2, train_loss: 0.9685, test_loss: 1.0342, test_f1: 0.4567
 epoch: 3, train_loss: 0.9407, test_loss: 1.0156, test_f1: 0.5132
 epoch: 4, train_loss: 0.9267, test_loss: 0.9479, test_f1: 0.5394
 epoch: 5, train_loss: 0.9007, test_loss: 0.9242, test_f1: 0.4959
 epoch: 6, train_loss: 0.8854, test_loss: 1.0173, test_f1: 0.5166
 epoch: 7, train_loss: 0.8801, test_loss: 0.8900, test_f1: 0.5466
 epoch: 8, train_loss: 0.8744, test_loss: 0.9894, test_f1: 0.4826
 epoch: 9, train_loss: 0.8802, test_loss: 0.9248, test_f1: 0.5283
 epoch: 10, train_loss: 0.8512, test_loss: 0.8837, test_f1: 0.5561
 epoch: 11, train_loss: 0.8336, test_loss: 0.8620, test_f1: 0.5672
 epoch: 12, train_loss: 0.8399, test_loss: 0.8520, test_f1: 0.5677
 epoch: 13, train_loss: 0.8360, test_loss: 0.9631, test_f1: 0.5031
 epoch: 14, train_loss: 0.8335, test_loss: 0.9861, test_f1: 0.5622
 epoch: 15, train_loss: 0.8421, test_loss: 0.9452, test_f1: 0.5605
 epoch: 16, train_loss: 0.8379, test_loss: 0.8292, test_f1: 0.5500
 epoch: 17, train_loss: 0.8112, test_loss: 1.0112, test_f1: 0.5428
 epoch: 18, train_loss: 0.8121, test_loss: 1.0180, test_f1: 0.5706
 epoch: 19, train_loss: 0.8023, test_loss: 0.8672, test_f1: 0.6218
 epoch: 20, train_loss: 0.8023, test_loss: 0.8722, test_f1: 0.5991
 epoch: 21, train_loss: 0.7970, test_loss: 1.0102, test_f1: 0.5354
 epoch: 22, train_loss: 0.8063, test_loss: 0.9042, test_f1: 0.5526
 epoch: 23, train_loss: 0.7906, test_loss: 1.0682, test_f1: 0.5237
 epoch: 24, train_loss: 0.7881, test_loss: 0.8820, test_f1: 0.5660
 epoch: 25, train_loss: 0.7801, test_loss: 0.9061, test_f1: 0.5761
 epoch: 26, train_loss: 0.7731, test_loss: 0.8353, test_f1: 0.5580
 epoch: 27, train_loss: 0.7782, test_loss: 0.8959, test_f1: 0.6161
 epoch: 28, train_loss: 0.7711, test_loss: 0.8761, test_f1: 0.5703
 epoch: 29, train_loss: 0.7730, test_loss: 0.8755, test_f1: 0.5678
 epoch: 30, train_loss: 0.7640, test_loss: 1.1556, test_f1: 0.5302
 epoch: 31, train_loss: 0.7690, test_loss: 0.8119, test_f1: 0.5468
 epoch: 32, train_loss: 0.7414, test_loss: 0.7882, test_f1: 0.6302
 epoch: 33, train_loss: 0.7667, test_loss: 0.9416, test_f1: 0.6022
 epoch: 34, train_loss: 0.7621, test_loss: 0.9824, test_f1: 0.5752
 epoch: 35, train_loss: 0.7306, test_loss: 1.0203, test_f1: 0.5351
 epoch: 36, train_loss: 0.7557, test_loss: 1.0155, test_f1: 0.5865
 epoch: 37, train_loss: 0.7378, test_loss: 0.8062, test_f1: 0.6326
 epoch: 38, train_loss: 0.7297, test_loss: 0.9687, test_f1: 0.6174
 epoch: 39, train_loss: 0.7298, test_loss: 0.8145, test_f1: 0.6160
 epoch: 40, train_loss: 0.7157, test_loss: 0.8191, test_f1: 0.6451
 epoch: 41, train_loss: 0.7151, test_loss: 0.8006, test_f1: 0.6231
 epoch: 42, train_loss: 0.7234, test_loss: 0.7970, test_f1: 0.6046
 epoch: 43, train_loss: 0.7067, test_loss: 0.8550, test_f1: 0.6268
 epoch: 44, train_loss: 0.6908, test_loss: 0.8215, test_f1: 0.6400
 epoch: 45, train_loss: 0.7101, test_loss: 0.9498, test_f1: 0.6341
 epoch: 46, train_loss: 0.6987, test_loss: 0.9180, test_f1: 0.6500
 epoch: 47, train_loss: 0.7342, test_loss: 0.9605, test_f1: 0.5917
 epoch: 48, train_loss: 0.7010, test_loss: 0.8374, test_f1: 0.6536
 epoch: 49, train_loss: 0.7183, test_loss: 0.7869, test_f1: 0.6714
 epoch: 50, train_loss: 0.6776, test_loss: 0.9410, test_f1: 0.5990
 epoch: 51, train_loss: 0.6429, test_loss: 0.8894, test_f1: 0.6657
 epoch: 52, train_loss: 0.6400, test_loss: 0.7966, test_f1: 0.6460
 epoch: 53, train_loss: 0.6428, test_loss: 0.7705, test_f1: 0.6599
 epoch: 54, train_loss: 0.6273, test_loss: 0.7929, test_f1: 0.6390
 epoch: 55, train_loss: 0.6313, test_loss: 0.8716, test_f1: 0.6591
 epoch: 56, train_loss: 0.6110, test_loss: 0.8178, test_f1: 0.6644
 epoch: 57, train_loss: 0.6095, test_loss: 0.8418, test_f1: 0.6424
 epoch: 58, train_loss: 0.6071, test_loss: 0.8771, test_f1: 0.6404
 epoch: 59, train_loss: 0.6278, test_loss: 0.8469, test_f1: 0.6576
 epoch: 60, train_loss: 0.6052, test_loss: 0.8258, test_f1: 0.6775
 epoch: 61, train_loss: 0.6247, test_loss: 0.8419, test_f1: 0.6620
 epoch: 62, train_loss: 0.6191, test_loss: 0.8041, test_f1: 0.6535
 epoch: 63, train_loss: 0.5934, test_loss: 0.8482, test_f1: 0.6433
 epoch: 64, train_loss: 0.6047, test_loss: 0.8023, test_f1: 0.6590
 epoch: 65, train_loss: 0.5989, test_loss: 0.8225, test_f1: 0.6539
 epoch: 66, train_loss: 0.6255, test_loss: 0.8183, test_f1: 0.6608
 epoch: 67, train_loss: 0.5984, test_loss: 0.8331, test_f1: 0.6640
 epoch: 68, train_loss: 0.5864, test_loss: 0.9343, test_f1: 0.6474
 epoch: 69, train_loss: 0.5881, test_loss: 0.8608, test_f1: 0.6307
 epoch: 70, train_loss: 0.5759, test_loss: 0.7887, test_f1: 0.6642
 epoch: 71, train_loss: 0.5832, test_loss: 0.8993, test_f1: 0.6533
 epoch: 72, train_loss: 0.6002, test_loss: 0.9341, test_f1: 0.6528
 epoch: 73, train_loss: 0.5972, test_loss: 0.8354, test_f1: 0.6621
 epoch: 74, train_loss: 0.5764, test_loss: 0.8523, test_f1: 0.6997
 epoch: 75, train_loss: 0.5604, test_loss: 1.0353, test_f1: 0.6514
 epoch: 76, train_loss: 0.5570, test_loss: 0.7775, test_f1: 0.6654
 epoch: 77, train_loss: 0.5798, test_loss: 0.7762, test_f1: 0.6731
 epoch: 78, train_loss: 0.5655, test_loss: 0.8486, test_f1: 0.6716
 epoch: 79, train_loss: 0.5774, test_loss: 1.0712, test_f1: 0.6585
 epoch: 80, train_loss: 0.5753, test_loss: 0.9764, test_f1: 0.6423
 epoch: 81, train_loss: 0.5558, test_loss: 0.9229, test_f1: 0.6780
 epoch: 82, train_loss: 0.5690, test_loss: 0.8951, test_f1: 0.6579
 epoch: 83, train_loss: 0.5616, test_loss: 0.8918, test_f1: 0.6643
 epoch: 84, train_loss: 0.5568, test_loss: 0.8481, test_f1: 0.6759
 epoch: 85, train_loss: 0.5473, test_loss: 0.9309, test_f1: 0.6414
 epoch: 86, train_loss: 0.5541, test_loss: 0.9092, test_f1: 0.6828
 epoch: 87, train_loss: 0.5440, test_loss: 0.9534, test_f1: 0.6426
 epoch: 88, train_loss: 0.5486, test_loss: 0.9951, test_f1: 0.6588
 epoch: 89, train_loss: 0.5327, test_loss: 0.9486, test_f1: 0.6767
 epoch: 90, train_loss: 0.5242, test_loss: 0.9055, test_f1: 0.6626
 epoch: 91, train_loss: 0.5490, test_loss: 0.9759, test_f1: 0.6686
 epoch: 92, train_loss: 0.5330, test_loss: 1.0748, test_f1: 0.6495
 epoch: 93, train_loss: 0.5149, test_loss: 0.9697, test_f1: 0.6744
 epoch: 94, train_loss: 0.5219, test_loss: 0.9936, test_f1: 0.6495
 epoch: 95, train_loss: 0.5353, test_loss: 1.1111, test_f1: 0.6540
 epoch: 96, train_loss: 0.5080, test_loss: 1.0343, test_f1: 0.6662
 epoch: 97, train_loss: 0.5232, test_loss: 0.9028, test_f1: 0.6545
 epoch: 98, train_loss: 0.5210, test_loss: 0.9731, test_f1: 0.6561
 epoch: 99, train_loss: 0.5177, test_loss: 1.0002, test_f1: 0.6444
##################ITERATION #5 ****************************************
 epoch: 0, train_loss: 1.0939, test_loss: 1.0154, test_f1: 0.4643
 epoch: 1, train_loss: 0.9846, test_loss: 0.9904, test_f1: 0.4892
 epoch: 2, train_loss: 0.9508, test_loss: 0.9664, test_f1: 0.5129
 epoch: 3, train_loss: 0.9334, test_loss: 0.9111, test_f1: 0.5218
 epoch: 4, train_loss: 0.9204, test_loss: 1.0295, test_f1: 0.4755
 epoch: 5, train_loss: 0.8869, test_loss: 0.9214, test_f1: 0.5309
 epoch: 6, train_loss: 0.8861, test_loss: 0.9612, test_f1: 0.4926
 epoch: 7, train_loss: 0.8858, test_loss: 0.8845, test_f1: 0.5539
 epoch: 8, train_loss: 0.8681, test_loss: 0.9677, test_f1: 0.5041
 epoch: 9, train_loss: 0.8731, test_loss: 0.8757, test_f1: 0.5827
 epoch: 10, train_loss: 0.8687, test_loss: 0.9122, test_f1: 0.4993
 epoch: 11, train_loss: 0.8559, test_loss: 0.8460, test_f1: 0.5453
 epoch: 12, train_loss: 0.8464, test_loss: 1.0569, test_f1: 0.4861
 epoch: 13, train_loss: 0.8393, test_loss: 0.8512, test_f1: 0.6081
 epoch: 14, train_loss: 0.8391, test_loss: 0.8787, test_f1: 0.5368
 epoch: 15, train_loss: 0.8394, test_loss: 0.8852, test_f1: 0.5849
 epoch: 16, train_loss: 0.8339, test_loss: 0.8887, test_f1: 0.5719
 epoch: 17, train_loss: 0.8232, test_loss: 0.8765, test_f1: 0.5568
 epoch: 18, train_loss: 0.8357, test_loss: 0.9087, test_f1: 0.5309
 epoch: 19, train_loss: 0.8266, test_loss: 0.8713, test_f1: 0.5361
 epoch: 20, train_loss: 0.8146, test_loss: 0.8689, test_f1: 0.5541
 epoch: 21, train_loss: 0.7956, test_loss: 0.8327, test_f1: 0.6041
 epoch: 22, train_loss: 0.7962, test_loss: 0.8568, test_f1: 0.5907
 epoch: 23, train_loss: 0.7920, test_loss: 0.9376, test_f1: 0.6009
 epoch: 24, train_loss: 0.7817, test_loss: 0.8449, test_f1: 0.6003
 epoch: 25, train_loss: 0.7712, test_loss: 0.9364, test_f1: 0.5282
 epoch: 26, train_loss: 0.7841, test_loss: 0.8384, test_f1: 0.5899
 epoch: 27, train_loss: 0.7637, test_loss: 0.8610, test_f1: 0.6560
 epoch: 28, train_loss: 0.7869, test_loss: 0.9304, test_f1: 0.5280
 epoch: 29, train_loss: 0.7815, test_loss: 0.8557, test_f1: 0.5979
 epoch: 30, train_loss: 0.7775, test_loss: 1.1188, test_f1: 0.5318
 epoch: 31, train_loss: 0.7604, test_loss: 0.9816, test_f1: 0.5786
 epoch: 32, train_loss: 0.7380, test_loss: 0.9560, test_f1: 0.5819
 epoch: 33, train_loss: 0.7614, test_loss: 0.9427, test_f1: 0.6131
 epoch: 34, train_loss: 0.7385, test_loss: 0.9430, test_f1: 0.6180
 epoch: 35, train_loss: 0.7624, test_loss: 0.9718, test_f1: 0.5872
 epoch: 36, train_loss: 0.7228, test_loss: 0.9425, test_f1: 0.5935
 epoch: 37, train_loss: 0.7290, test_loss: 0.9878, test_f1: 0.6193
 epoch: 38, train_loss: 0.7277, test_loss: 1.0007, test_f1: 0.5718
 epoch: 39, train_loss: 0.7474, test_loss: 1.0123, test_f1: 0.5739
 epoch: 40, train_loss: 0.7334, test_loss: 1.0162, test_f1: 0.6042
 epoch: 41, train_loss: 0.7275, test_loss: 0.9743, test_f1: 0.5612
 epoch: 42, train_loss: 0.7395, test_loss: 1.0220, test_f1: 0.6085
 epoch: 43, train_loss: 0.7233, test_loss: 0.9176, test_f1: 0.5906
 epoch: 44, train_loss: 0.7073, test_loss: 0.9258, test_f1: 0.6296
 epoch: 45, train_loss: 0.7234, test_loss: 1.0152, test_f1: 0.5802
 epoch: 46, train_loss: 0.7132, test_loss: 0.9540, test_f1: 0.6127
 epoch: 47, train_loss: 0.7039, test_loss: 1.1063, test_f1: 0.6084
 epoch: 48, train_loss: 0.6908, test_loss: 1.0936, test_f1: 0.6102
 epoch: 49, train_loss: 0.6790, test_loss: 1.0697, test_f1: 0.6359
 epoch: 50, train_loss: 0.6705, test_loss: 1.0039, test_f1: 0.6345
 epoch: 51, train_loss: 0.6378, test_loss: 0.9218, test_f1: 0.6712
 epoch: 52, train_loss: 0.6291, test_loss: 0.9054, test_f1: 0.6390
 epoch: 53, train_loss: 0.6359, test_loss: 1.1039, test_f1: 0.6747
 epoch: 54, train_loss: 0.6228, test_loss: 1.0767, test_f1: 0.6396
 epoch: 55, train_loss: 0.6271, test_loss: 0.9878, test_f1: 0.6718
 epoch: 56, train_loss: 0.6092, test_loss: 1.0595, test_f1: 0.6445
 epoch: 57, train_loss: 0.5885, test_loss: 1.1542, test_f1: 0.6604
 epoch: 58, train_loss: 0.5898, test_loss: 1.0430, test_f1: 0.6515
 epoch: 59, train_loss: 0.5868, test_loss: 1.0898, test_f1: 0.6501
 epoch: 60, train_loss: 0.5864, test_loss: 1.2056, test_f1: 0.6657
 epoch: 61, train_loss: 0.5796, test_loss: 1.1139, test_f1: 0.6442
 epoch: 62, train_loss: 0.5916, test_loss: 1.0893, test_f1: 0.6894
 epoch: 63, train_loss: 0.5723, test_loss: 1.2354, test_f1: 0.6556
 epoch: 64, train_loss: 0.5889, test_loss: 1.1113, test_f1: 0.6737
 epoch: 65, train_loss: 0.5792, test_loss: 1.1505, test_f1: 0.6608
 epoch: 66, train_loss: 0.5736, test_loss: 1.2271, test_f1: 0.6786
 epoch: 67, train_loss: 0.5542, test_loss: 1.1822, test_f1: 0.6847
 epoch: 68, train_loss: 0.5800, test_loss: 0.9541, test_f1: 0.6678
 epoch: 69, train_loss: 0.5717, test_loss: 1.0809, test_f1: 0.6814
 epoch: 70, train_loss: 0.5481, test_loss: 1.0699, test_f1: 0.6912
 epoch: 71, train_loss: 0.5706, test_loss: 1.1329, test_f1: 0.6640
 epoch: 72, train_loss: 0.5617, test_loss: 1.1504, test_f1: 0.6735
 epoch: 73, train_loss: 0.5500, test_loss: 1.2020, test_f1: 0.6609
 epoch: 74, train_loss: 0.5541, test_loss: 1.2418, test_f1: 0.6705
 epoch: 75, train_loss: 0.5542, test_loss: 1.0898, test_f1: 0.6751
 epoch: 76, train_loss: 0.5545, test_loss: 1.2517, test_f1: 0.6516
 epoch: 77, train_loss: 0.5477, test_loss: 1.3141, test_f1: 0.7025
 epoch: 78, train_loss: 0.5446, test_loss: 1.1881, test_f1: 0.6775
 epoch: 79, train_loss: 0.5597, test_loss: 1.2074, test_f1: 0.6627
 epoch: 80, train_loss: 0.5399, test_loss: 1.3159, test_f1: 0.6740
 epoch: 81, train_loss: 0.5520, test_loss: 1.3331, test_f1: 0.6837
 epoch: 82, train_loss: 0.5384, test_loss: 1.3017, test_f1: 0.6882
 epoch: 83, train_loss: 0.5447, test_loss: 1.3641, test_f1: 0.6814
 epoch: 84, train_loss: 0.5371, test_loss: 1.2626, test_f1: 0.6566
 epoch: 85, train_loss: 0.5221, test_loss: 1.2729, test_f1: 0.6735
 epoch: 86, train_loss: 0.5154, test_loss: 1.2612, test_f1: 0.6670
 epoch: 87, train_loss: 0.5373, test_loss: 1.3248, test_f1: 0.6591
 epoch: 88, train_loss: 0.5343, test_loss: 1.1472, test_f1: 0.6461
 epoch: 89, train_loss: 0.5154, test_loss: 1.2451, test_f1: 0.6649
 epoch: 90, train_loss: 0.5225, test_loss: 1.0847, test_f1: 0.6718
 epoch: 91, train_loss: 0.5157, test_loss: 1.2762, test_f1: 0.6560
 epoch: 92, train_loss: 0.5116, test_loss: 1.2271, test_f1: 0.6561
 epoch: 93, train_loss: 0.5160, test_loss: 1.3053, test_f1: 0.6394
 epoch: 94, train_loss: 0.5062, test_loss: 1.1639, test_f1: 0.6681
 epoch: 95, train_loss: 0.5086, test_loss: 1.3818, test_f1: 0.6717
 epoch: 96, train_loss: 0.5200, test_loss: 1.3468, test_f1: 0.6793
 epoch: 97, train_loss: 0.5147, test_loss: 1.2952, test_f1: 0.6691
 epoch: 98, train_loss: 0.4857, test_loss: 1.1628, test_f1: 0.6831
 epoch: 99, train_loss: 0.5241, test_loss: 1.4508, test_f1: 0.6414
##################ITERATION #6 ****************************************
 epoch: 0, train_loss: 1.0912, test_loss: 1.1483, test_f1: 0.4483
 epoch: 1, train_loss: 0.9795, test_loss: 1.0711, test_f1: 0.4763
 epoch: 2, train_loss: 0.9578, test_loss: 0.9320, test_f1: 0.5200
 epoch: 3, train_loss: 0.9441, test_loss: 0.9515, test_f1: 0.5539
 epoch: 4, train_loss: 0.9261, test_loss: 0.9552, test_f1: 0.4959
 epoch: 5, train_loss: 0.9158, test_loss: 0.9966, test_f1: 0.4977
 epoch: 6, train_loss: 0.9123, test_loss: 0.9013, test_f1: 0.4968
 epoch: 7, train_loss: 0.9086, test_loss: 0.8778, test_f1: 0.5121
 epoch: 8, train_loss: 0.8993, test_loss: 0.9304, test_f1: 0.5054
 epoch: 9, train_loss: 0.8760, test_loss: 0.8471, test_f1: 0.5158
 epoch: 10, train_loss: 0.8905, test_loss: 0.8588, test_f1: 0.5199
 epoch: 11, train_loss: 0.8653, test_loss: 0.9369, test_f1: 0.5262
 epoch: 12, train_loss: 0.8668, test_loss: 0.8649, test_f1: 0.5455
 epoch: 13, train_loss: 0.8800, test_loss: 0.8297, test_f1: 0.5428
 epoch: 14, train_loss: 0.8648, test_loss: 0.8538, test_f1: 0.6029
 epoch: 15, train_loss: 0.8276, test_loss: 0.8930, test_f1: 0.5832
 epoch: 16, train_loss: 0.8404, test_loss: 0.8270, test_f1: 0.5805
 epoch: 17, train_loss: 0.8464, test_loss: 0.8805, test_f1: 0.5753
 epoch: 18, train_loss: 0.8225, test_loss: 0.8345, test_f1: 0.5718
 epoch: 19, train_loss: 0.8210, test_loss: 0.8004, test_f1: 0.5561
 epoch: 20, train_loss: 0.8128, test_loss: 0.8309, test_f1: 0.5643
 epoch: 21, train_loss: 0.8090, test_loss: 0.8707, test_f1: 0.5506
 epoch: 22, train_loss: 0.7910, test_loss: 0.8356, test_f1: 0.5785
 epoch: 23, train_loss: 0.8100, test_loss: 0.9107, test_f1: 0.5407
 epoch: 24, train_loss: 0.7951, test_loss: 0.8569, test_f1: 0.5988
 epoch: 25, train_loss: 0.7964, test_loss: 0.8474, test_f1: 0.6027
 epoch: 26, train_loss: 0.7929, test_loss: 0.8769, test_f1: 0.5377
 epoch: 27, train_loss: 0.7892, test_loss: 0.8872, test_f1: 0.5936
 epoch: 28, train_loss: 0.7897, test_loss: 0.8668, test_f1: 0.6040
 epoch: 29, train_loss: 0.7933, test_loss: 0.9480, test_f1: 0.5299
 epoch: 30, train_loss: 0.7857, test_loss: 0.8585, test_f1: 0.6004
 epoch: 31, train_loss: 0.7657, test_loss: 0.8896, test_f1: 0.6244
 epoch: 32, train_loss: 0.7786, test_loss: 0.8321, test_f1: 0.5929
 epoch: 33, train_loss: 0.7722, test_loss: 0.8102, test_f1: 0.6164
 epoch: 34, train_loss: 0.7602, test_loss: 0.9470, test_f1: 0.5887
 epoch: 35, train_loss: 0.7652, test_loss: 0.7748, test_f1: 0.6415
 epoch: 36, train_loss: 0.7513, test_loss: 0.8434, test_f1: 0.5595
 epoch: 37, train_loss: 0.7561, test_loss: 0.8107, test_f1: 0.5545
 epoch: 38, train_loss: 0.7520, test_loss: 0.8299, test_f1: 0.6062
 epoch: 39, train_loss: 0.7474, test_loss: 0.8321, test_f1: 0.6458
 epoch: 40, train_loss: 0.7391, test_loss: 0.8729, test_f1: 0.6665
 epoch: 41, train_loss: 0.7342, test_loss: 0.8643, test_f1: 0.5946
 epoch: 42, train_loss: 0.7638, test_loss: 0.8128, test_f1: 0.6126
 epoch: 43, train_loss: 0.7445, test_loss: 0.8741, test_f1: 0.5884
 epoch: 44, train_loss: 0.7448, test_loss: 0.7562, test_f1: 0.5749
 epoch: 45, train_loss: 0.7549, test_loss: 0.7577, test_f1: 0.6496
 epoch: 46, train_loss: 0.7179, test_loss: 0.8002, test_f1: 0.6324
 epoch: 47, train_loss: 0.7411, test_loss: 0.8028, test_f1: 0.6119
 epoch: 48, train_loss: 0.7153, test_loss: 0.7627, test_f1: 0.6501
 epoch: 49, train_loss: 0.7162, test_loss: 0.8939, test_f1: 0.6295
 epoch: 50, train_loss: 0.6996, test_loss: 0.8553, test_f1: 0.6272
 epoch: 51, train_loss: 0.6976, test_loss: 0.7192, test_f1: 0.6255
 epoch: 52, train_loss: 0.6720, test_loss: 0.8551, test_f1: 0.6485
 epoch: 53, train_loss: 0.6671, test_loss: 0.8075, test_f1: 0.6489
 epoch: 54, train_loss: 0.6513, test_loss: 0.8412, test_f1: 0.6394
 epoch: 55, train_loss: 0.6511, test_loss: 0.8329, test_f1: 0.6663
 epoch: 56, train_loss: 0.6466, test_loss: 0.8436, test_f1: 0.6649
 epoch: 57, train_loss: 0.6453, test_loss: 0.8026, test_f1: 0.6624
 epoch: 58, train_loss: 0.6481, test_loss: 0.8535, test_f1: 0.6524
 epoch: 59, train_loss: 0.6399, test_loss: 0.8930, test_f1: 0.6475
 epoch: 60, train_loss: 0.6360, test_loss: 0.8249, test_f1: 0.6402
 epoch: 61, train_loss: 0.6457, test_loss: 0.8382, test_f1: 0.6629
 epoch: 62, train_loss: 0.6358, test_loss: 0.8179, test_f1: 0.6368
 epoch: 63, train_loss: 0.6258, test_loss: 0.8931, test_f1: 0.6575
 epoch: 64, train_loss: 0.6194, test_loss: 0.8599, test_f1: 0.6471
 epoch: 65, train_loss: 0.6339, test_loss: 0.9620, test_f1: 0.6393
 epoch: 66, train_loss: 0.6223, test_loss: 0.8845, test_f1: 0.6602
 epoch: 67, train_loss: 0.6056, test_loss: 0.9600, test_f1: 0.6444
 epoch: 68, train_loss: 0.6196, test_loss: 0.8858, test_f1: 0.6663
 epoch: 69, train_loss: 0.6213, test_loss: 0.9474, test_f1: 0.6216
 epoch: 70, train_loss: 0.6014, test_loss: 0.9097, test_f1: 0.6378
 epoch: 71, train_loss: 0.6081, test_loss: 0.8969, test_f1: 0.6607
 epoch: 72, train_loss: 0.6146, test_loss: 0.8697, test_f1: 0.6426
 epoch: 73, train_loss: 0.6075, test_loss: 0.9847, test_f1: 0.6637
 epoch: 74, train_loss: 0.6020, test_loss: 0.9777, test_f1: 0.6396
 epoch: 75, train_loss: 0.6044, test_loss: 1.0100, test_f1: 0.6503
 epoch: 76, train_loss: 0.5896, test_loss: 0.9931, test_f1: 0.6405
 epoch: 77, train_loss: 0.5912, test_loss: 0.8933, test_f1: 0.6789
 epoch: 78, train_loss: 0.5936, test_loss: 0.7781, test_f1: 0.6787
 epoch: 79, train_loss: 0.5939, test_loss: 0.9646, test_f1: 0.6352
 epoch: 80, train_loss: 0.6148, test_loss: 0.9361, test_f1: 0.6612
 epoch: 81, train_loss: 0.5831, test_loss: 0.9177, test_f1: 0.6650
 epoch: 82, train_loss: 0.5984, test_loss: 0.9087, test_f1: 0.6696
 epoch: 83, train_loss: 0.5762, test_loss: 0.9434, test_f1: 0.6765
 epoch: 84, train_loss: 0.5806, test_loss: 0.9967, test_f1: 0.6474
 epoch: 85, train_loss: 0.5797, test_loss: 0.9423, test_f1: 0.6361
 epoch: 86, train_loss: 0.5766, test_loss: 0.9327, test_f1: 0.6518
 epoch: 87, train_loss: 0.5834, test_loss: 0.9445, test_f1: 0.6364
 epoch: 88, train_loss: 0.5842, test_loss: 0.9743, test_f1: 0.6756
 epoch: 89, train_loss: 0.5843, test_loss: 0.9203, test_f1: 0.6703
 epoch: 90, train_loss: 0.5609, test_loss: 0.9193, test_f1: 0.6671
 epoch: 91, train_loss: 0.5807, test_loss: 1.0227, test_f1: 0.6471
 epoch: 92, train_loss: 0.5576, test_loss: 0.9188, test_f1: 0.6831
 epoch: 93, train_loss: 0.5736, test_loss: 1.0749, test_f1: 0.6473
 epoch: 94, train_loss: 0.5438, test_loss: 1.1020, test_f1: 0.6564
 epoch: 95, train_loss: 0.5738, test_loss: 1.0396, test_f1: 0.6533
 epoch: 96, train_loss: 0.5643, test_loss: 1.0655, test_f1: 0.6547
 epoch: 97, train_loss: 0.5811, test_loss: 1.0392, test_f1: 0.6528
 epoch: 98, train_loss: 0.5850, test_loss: 1.0145, test_f1: 0.6773
 epoch: 99, train_loss: 0.5561, test_loss: 0.9306, test_f1: 0.6544
##################ITERATION #7 ****************************************
 epoch: 0, train_loss: 1.0975, test_loss: 1.1090, test_f1: 0.4895
 epoch: 1, train_loss: 1.0114, test_loss: 0.9714, test_f1: 0.4920
 epoch: 2, train_loss: 0.9840, test_loss: 0.9841, test_f1: 0.5133
 epoch: 3, train_loss: 0.9881, test_loss: 1.0370, test_f1: 0.4936
 epoch: 4, train_loss: 0.9524, test_loss: 0.9636, test_f1: 0.5483
 epoch: 5, train_loss: 0.9503, test_loss: 1.0159, test_f1: 0.4952
 epoch: 6, train_loss: 0.9555, test_loss: 0.9813, test_f1: 0.5047
 epoch: 7, train_loss: 0.9217, test_loss: 0.9729, test_f1: 0.4948
 epoch: 8, train_loss: 0.9135, test_loss: 0.9101, test_f1: 0.5265
 epoch: 9, train_loss: 0.9182, test_loss: 0.9382, test_f1: 0.5135
 epoch: 10, train_loss: 0.8969, test_loss: 0.9307, test_f1: 0.5206
 epoch: 11, train_loss: 0.8818, test_loss: 0.8735, test_f1: 0.5234
 epoch: 12, train_loss: 0.8817, test_loss: 0.9705, test_f1: 0.5222
 epoch: 13, train_loss: 0.8838, test_loss: 0.9273, test_f1: 0.5277
 epoch: 14, train_loss: 0.8796, test_loss: 0.8666, test_f1: 0.5495
 epoch: 15, train_loss: 0.8537, test_loss: 0.8771, test_f1: 0.5570
 epoch: 16, train_loss: 0.8388, test_loss: 0.9573, test_f1: 0.5358
 epoch: 17, train_loss: 0.8456, test_loss: 0.9129, test_f1: 0.5760
 epoch: 18, train_loss: 0.8216, test_loss: 0.8709, test_f1: 0.5510
 epoch: 19, train_loss: 0.8254, test_loss: 0.9632, test_f1: 0.5114
 epoch: 20, train_loss: 0.8695, test_loss: 0.9178, test_f1: 0.5474
 epoch: 21, train_loss: 0.8558, test_loss: 0.8776, test_f1: 0.5403
 epoch: 22, train_loss: 0.8931, test_loss: 0.8669, test_f1: 0.5423
 epoch: 23, train_loss: 0.8481, test_loss: 0.9544, test_f1: 0.6054
 epoch: 24, train_loss: 0.8337, test_loss: 0.9620, test_f1: 0.5398
 epoch: 25, train_loss: 0.8214, test_loss: 0.8986, test_f1: 0.5287
 epoch: 26, train_loss: 0.8374, test_loss: 0.9442, test_f1: 0.5575
 epoch: 27, train_loss: 0.8281, test_loss: 0.9292, test_f1: 0.5707
 epoch: 28, train_loss: 0.8068, test_loss: 0.9136, test_f1: 0.5845
 epoch: 29, train_loss: 0.8006, test_loss: 0.9541, test_f1: 0.6089
 epoch: 30, train_loss: 0.8235, test_loss: 0.9347, test_f1: 0.5780
 epoch: 31, train_loss: 0.8013, test_loss: 0.8993, test_f1: 0.5992
 epoch: 32, train_loss: 0.7869, test_loss: 0.8265, test_f1: 0.6291
 epoch: 33, train_loss: 0.7925, test_loss: 0.8557, test_f1: 0.6242
 epoch: 34, train_loss: 0.7807, test_loss: 0.9603, test_f1: 0.5471
 epoch: 35, train_loss: 0.7863, test_loss: 0.9048, test_f1: 0.5873
 epoch: 36, train_loss: 0.7756, test_loss: 0.9156, test_f1: 0.5998
 epoch: 37, train_loss: 0.7534, test_loss: 0.8717, test_f1: 0.5677
 epoch: 38, train_loss: 0.7546, test_loss: 0.8684, test_f1: 0.6208
 epoch: 39, train_loss: 0.7912, test_loss: 1.0590, test_f1: 0.5107
 epoch: 40, train_loss: 0.7727, test_loss: 0.8713, test_f1: 0.6288
 epoch: 41, train_loss: 0.7483, test_loss: 0.9586, test_f1: 0.6099
 epoch: 42, train_loss: 0.7369, test_loss: 0.9188, test_f1: 0.6493
 epoch: 43, train_loss: 0.7314, test_loss: 0.8645, test_f1: 0.5983
 epoch: 44, train_loss: 0.7639, test_loss: 0.8806, test_f1: 0.6118
 epoch: 45, train_loss: 0.7372, test_loss: 1.0108, test_f1: 0.5423
 epoch: 46, train_loss: 0.7467, test_loss: 1.0158, test_f1: 0.6095
 epoch: 47, train_loss: 0.7306, test_loss: 0.9196, test_f1: 0.6215
 epoch: 48, train_loss: 0.7446, test_loss: 0.9142, test_f1: 0.6280
 epoch: 49, train_loss: 0.7190, test_loss: 0.9565, test_f1: 0.5700
 epoch: 50, train_loss: 0.7275, test_loss: 1.0561, test_f1: 0.6393
 epoch: 51, train_loss: 0.6970, test_loss: 0.9123, test_f1: 0.6163
 epoch: 52, train_loss: 0.6956, test_loss: 0.9610, test_f1: 0.6326
 epoch: 53, train_loss: 0.6774, test_loss: 0.8879, test_f1: 0.6256
 epoch: 54, train_loss: 0.6690, test_loss: 0.9190, test_f1: 0.6054
 epoch: 55, train_loss: 0.6796, test_loss: 0.9021, test_f1: 0.6231
 epoch: 56, train_loss: 0.6666, test_loss: 0.9039, test_f1: 0.6401
 epoch: 57, train_loss: 0.6623, test_loss: 0.9281, test_f1: 0.6002
 epoch: 58, train_loss: 0.6694, test_loss: 0.9014, test_f1: 0.6531
 epoch: 59, train_loss: 0.6623, test_loss: 0.9426, test_f1: 0.6302
 epoch: 60, train_loss: 0.6544, test_loss: 0.8661, test_f1: 0.6552
 epoch: 61, train_loss: 0.6577, test_loss: 0.8790, test_f1: 0.6352
 epoch: 62, train_loss: 0.6655, test_loss: 0.8676, test_f1: 0.6691
 epoch: 63, train_loss: 0.6587, test_loss: 0.8538, test_f1: 0.6197
 epoch: 64, train_loss: 0.6581, test_loss: 0.9188, test_f1: 0.6309
 epoch: 65, train_loss: 0.6367, test_loss: 0.9212, test_f1: 0.6397
 epoch: 66, train_loss: 0.6501, test_loss: 0.8412, test_f1: 0.6522
 epoch: 67, train_loss: 0.6314, test_loss: 0.8587, test_f1: 0.6352
 epoch: 68, train_loss: 0.6263, test_loss: 0.9194, test_f1: 0.6341
 epoch: 69, train_loss: 0.6309, test_loss: 0.9538, test_f1: 0.5825
 epoch: 70, train_loss: 0.6409, test_loss: 0.8879, test_f1: 0.6144
 epoch: 71, train_loss: 0.6344, test_loss: 0.9366, test_f1: 0.6224
 epoch: 72, train_loss: 0.6196, test_loss: 0.9007, test_f1: 0.6205
 epoch: 73, train_loss: 0.6159, test_loss: 0.9402, test_f1: 0.6357
 epoch: 74, train_loss: 0.6244, test_loss: 0.8659, test_f1: 0.6556
 epoch: 75, train_loss: 0.5937, test_loss: 0.8851, test_f1: 0.6466
 epoch: 76, train_loss: 0.5984, test_loss: 0.9580, test_f1: 0.6230
 epoch: 77, train_loss: 0.6151, test_loss: 0.8426, test_f1: 0.6404
 epoch: 78, train_loss: 0.6073, test_loss: 0.8873, test_f1: 0.6620
 epoch: 79, train_loss: 0.6125, test_loss: 0.9277, test_f1: 0.6033
 epoch: 80, train_loss: 0.5956, test_loss: 0.8985, test_f1: 0.6218
 epoch: 81, train_loss: 0.6091, test_loss: 0.8606, test_f1: 0.6464
 epoch: 82, train_loss: 0.5790, test_loss: 0.8913, test_f1: 0.6355
 epoch: 83, train_loss: 0.5956, test_loss: 0.8982, test_f1: 0.6424
 epoch: 84, train_loss: 0.5905, test_loss: 0.9736, test_f1: 0.6441
 epoch: 85, train_loss: 0.5917, test_loss: 0.9026, test_f1: 0.6438
 epoch: 86, train_loss: 0.5935, test_loss: 0.9367, test_f1: 0.6637
 epoch: 87, train_loss: 0.5815, test_loss: 0.9562, test_f1: 0.6332
 epoch: 88, train_loss: 0.5811, test_loss: 0.9764, test_f1: 0.6438
 epoch: 89, train_loss: 0.5921, test_loss: 0.9083, test_f1: 0.6675
 epoch: 90, train_loss: 0.5756, test_loss: 0.9435, test_f1: 0.6478
 epoch: 91, train_loss: 0.5664, test_loss: 1.1102, test_f1: 0.6488
 epoch: 92, train_loss: 0.6148, test_loss: 0.9231, test_f1: 0.6659
 epoch: 93, train_loss: 0.5729, test_loss: 1.0013, test_f1: 0.6289
 epoch: 94, train_loss: 0.5559, test_loss: 1.0463, test_f1: 0.6403
 epoch: 95, train_loss: 0.5444, test_loss: 1.0400, test_f1: 0.5959
 epoch: 96, train_loss: 0.5706, test_loss: 0.9425, test_f1: 0.6199
 epoch: 97, train_loss: 0.5541, test_loss: 1.0673, test_f1: 0.6358
 epoch: 98, train_loss: 0.5653, test_loss: 1.0666, test_f1: 0.6116
 epoch: 99, train_loss: 0.5652, test_loss: 0.9865, test_f1: 0.6635
##################ITERATION #8 ****************************************
 epoch: 0, train_loss: 1.1521, test_loss: 1.1373, test_f1: 0.4222
 epoch: 1, train_loss: 1.0152, test_loss: 0.9665, test_f1: 0.4698
 epoch: 2, train_loss: 0.9586, test_loss: 1.0059, test_f1: 0.4674
 epoch: 3, train_loss: 0.9296, test_loss: 0.9678, test_f1: 0.5232
 epoch: 4, train_loss: 0.9228, test_loss: 0.8728, test_f1: 0.5317
 epoch: 5, train_loss: 0.9286, test_loss: 0.8880, test_f1: 0.5596
 epoch: 6, train_loss: 0.8927, test_loss: 0.9257, test_f1: 0.5457
 epoch: 7, train_loss: 0.8684, test_loss: 0.9198, test_f1: 0.5201
 epoch: 8, train_loss: 0.8767, test_loss: 0.9047, test_f1: 0.5318
 epoch: 9, train_loss: 0.8612, test_loss: 0.8979, test_f1: 0.5664
 epoch: 10, train_loss: 0.8486, test_loss: 0.8685, test_f1: 0.5384
 epoch: 11, train_loss: 0.8607, test_loss: 0.8487, test_f1: 0.5850
 epoch: 12, train_loss: 0.8531, test_loss: 0.8644, test_f1: 0.5836
 epoch: 13, train_loss: 0.8323, test_loss: 0.8943, test_f1: 0.5944
 epoch: 14, train_loss: 0.8358, test_loss: 0.9191, test_f1: 0.5870
 epoch: 15, train_loss: 0.8157, test_loss: 0.8590, test_f1: 0.6371
 epoch: 16, train_loss: 0.8368, test_loss: 0.9132, test_f1: 0.5399
 epoch: 17, train_loss: 0.8266, test_loss: 0.8998, test_f1: 0.5436
 epoch: 18, train_loss: 0.8115, test_loss: 0.8967, test_f1: 0.5916
 epoch: 19, train_loss: 0.8046, test_loss: 0.8827, test_f1: 0.6087
 epoch: 20, train_loss: 0.8060, test_loss: 0.9736, test_f1: 0.5791
 epoch: 21, train_loss: 0.8074, test_loss: 0.8673, test_f1: 0.5591
 epoch: 22, train_loss: 0.8173, test_loss: 0.9653, test_f1: 0.5858
 epoch: 23, train_loss: 0.7893, test_loss: 0.9688, test_f1: 0.6070
 epoch: 24, train_loss: 0.7634, test_loss: 1.0057, test_f1: 0.6042
 epoch: 25, train_loss: 0.7657, test_loss: 1.0130, test_f1: 0.6111
 epoch: 26, train_loss: 0.7790, test_loss: 1.0056, test_f1: 0.5716
 epoch: 27, train_loss: 0.7612, test_loss: 0.9174, test_f1: 0.6220
 epoch: 28, train_loss: 0.7730, test_loss: 0.9797, test_f1: 0.6301
 epoch: 29, train_loss: 0.7663, test_loss: 0.9081, test_f1: 0.6306
 epoch: 30, train_loss: 0.7495, test_loss: 0.9572, test_f1: 0.6181
 epoch: 31, train_loss: 0.7606, test_loss: 0.9274, test_f1: 0.5798
 epoch: 32, train_loss: 0.7519, test_loss: 0.8930, test_f1: 0.6282
 epoch: 33, train_loss: 0.7390, test_loss: 0.9338, test_f1: 0.6163
 epoch: 34, train_loss: 0.7390, test_loss: 1.0600, test_f1: 0.6441
 epoch: 35, train_loss: 0.7338, test_loss: 1.0325, test_f1: 0.6005
 epoch: 36, train_loss: 0.7201, test_loss: 0.9263, test_f1: 0.6658
 epoch: 37, train_loss: 0.7026, test_loss: 1.0564, test_f1: 0.6157
 epoch: 38, train_loss: 0.7179, test_loss: 0.8759, test_f1: 0.6483
 epoch: 39, train_loss: 0.7087, test_loss: 1.0974, test_f1: 0.5758
 epoch: 40, train_loss: 0.7083, test_loss: 0.9771, test_f1: 0.6277
 epoch: 41, train_loss: 0.7098, test_loss: 0.7994, test_f1: 0.6443
 epoch: 42, train_loss: 0.6984, test_loss: 0.7889, test_f1: 0.6559
 epoch: 43, train_loss: 0.7009, test_loss: 0.9286, test_f1: 0.6569
 epoch: 44, train_loss: 0.6800, test_loss: 0.9185, test_f1: 0.6615
 epoch: 45, train_loss: 0.6900, test_loss: 0.8867, test_f1: 0.6016
 epoch: 46, train_loss: 0.6955, test_loss: 0.9597, test_f1: 0.6972
 epoch: 47, train_loss: 0.6937, test_loss: 0.8489, test_f1: 0.5727
 epoch: 48, train_loss: 0.6953, test_loss: 0.9556, test_f1: 0.6413
 epoch: 49, train_loss: 0.6878, test_loss: 1.0260, test_f1: 0.6421
 epoch: 50, train_loss: 0.6911, test_loss: 0.9722, test_f1: 0.6640
 epoch: 51, train_loss: 0.6472, test_loss: 0.9558, test_f1: 0.6613
 epoch: 52, train_loss: 0.6326, test_loss: 0.9589, test_f1: 0.6563
 epoch: 53, train_loss: 0.6008, test_loss: 0.9920, test_f1: 0.6652
 epoch: 54, train_loss: 0.6140, test_loss: 0.9524, test_f1: 0.6587
 epoch: 55, train_loss: 0.6088, test_loss: 0.9663, test_f1: 0.6510
 epoch: 56, train_loss: 0.6018, test_loss: 0.9333, test_f1: 0.6540
 epoch: 57, train_loss: 0.5962, test_loss: 0.9151, test_f1: 0.6813
 epoch: 58, train_loss: 0.6132, test_loss: 0.8771, test_f1: 0.6939
 epoch: 59, train_loss: 0.5985, test_loss: 0.9798, test_f1: 0.6855
 epoch: 60, train_loss: 0.5833, test_loss: 1.0300, test_f1: 0.6878
 epoch: 61, train_loss: 0.5930, test_loss: 0.9118, test_f1: 0.6624
 epoch: 62, train_loss: 0.5716, test_loss: 1.0081, test_f1: 0.7244
 epoch: 63, train_loss: 0.5865, test_loss: 1.0932, test_f1: 0.6947
 epoch: 64, train_loss: 0.5734, test_loss: 0.9065, test_f1: 0.6720
 epoch: 65, train_loss: 0.5908, test_loss: 0.9207, test_f1: 0.6804
 epoch: 66, train_loss: 0.5810, test_loss: 0.9899, test_f1: 0.6621
 epoch: 67, train_loss: 0.5720, test_loss: 0.9147, test_f1: 0.6780
 epoch: 68, train_loss: 0.5760, test_loss: 1.0753, test_f1: 0.6817
 epoch: 69, train_loss: 0.5623, test_loss: 0.9105, test_f1: 0.6834
 epoch: 70, train_loss: 0.5698, test_loss: 1.0663, test_f1: 0.6814
 epoch: 71, train_loss: 0.5762, test_loss: 1.0110, test_f1: 0.6774
 epoch: 72, train_loss: 0.5611, test_loss: 1.0221, test_f1: 0.6786
 epoch: 73, train_loss: 0.5577, test_loss: 0.8064, test_f1: 0.6819
 epoch: 74, train_loss: 0.5526, test_loss: 0.9964, test_f1: 0.6896
 epoch: 75, train_loss: 0.5529, test_loss: 1.0496, test_f1: 0.6864
 epoch: 76, train_loss: 0.5757, test_loss: 1.0335, test_f1: 0.6872
 epoch: 77, train_loss: 0.5537, test_loss: 0.9254, test_f1: 0.6460
 epoch: 78, train_loss: 0.5616, test_loss: 1.0711, test_f1: 0.6876
 epoch: 79, train_loss: 0.5349, test_loss: 0.9711, test_f1: 0.6893
 epoch: 80, train_loss: 0.5496, test_loss: 0.9006, test_f1: 0.6562
 epoch: 81, train_loss: 0.5405, test_loss: 1.0741, test_f1: 0.6738
 epoch: 82, train_loss: 0.5243, test_loss: 1.1034, test_f1: 0.6780
 epoch: 83, train_loss: 0.5345, test_loss: 1.0380, test_f1: 0.6689
 epoch: 84, train_loss: 0.5376, test_loss: 1.0449, test_f1: 0.6763
 epoch: 85, train_loss: 0.5429, test_loss: 1.0074, test_f1: 0.6494
 epoch: 86, train_loss: 0.5254, test_loss: 0.9085, test_f1: 0.6788
 epoch: 87, train_loss: 0.5280, test_loss: 0.9668, test_f1: 0.6843
 epoch: 88, train_loss: 0.4938, test_loss: 1.1418, test_f1: 0.6973
 epoch: 89, train_loss: 0.5222, test_loss: 1.1189, test_f1: 0.6684
 epoch: 90, train_loss: 0.5351, test_loss: 1.0486, test_f1: 0.6775
 epoch: 91, train_loss: 0.5130, test_loss: 0.9592, test_f1: 0.6820
 epoch: 92, train_loss: 0.5054, test_loss: 1.0295, test_f1: 0.6822
 epoch: 93, train_loss: 0.5052, test_loss: 1.0559, test_f1: 0.6664
 epoch: 94, train_loss: 0.5083, test_loss: 1.0800, test_f1: 0.6868
 epoch: 95, train_loss: 0.5041, test_loss: 0.9648, test_f1: 0.6670
 epoch: 96, train_loss: 0.5177, test_loss: 1.0530, test_f1: 0.6713
 epoch: 97, train_loss: 0.5101, test_loss: 0.8316, test_f1: 0.6840
 epoch: 98, train_loss: 0.4911, test_loss: 1.0980, test_f1: 0.6807
 epoch: 99, train_loss: 0.5128, test_loss: 0.9050, test_f1: 0.6528
##################ITERATION #9 ****************************************
 epoch: 0, train_loss: 1.0951, test_loss: 1.1432, test_f1: 0.4173
 epoch: 1, train_loss: 1.0070, test_loss: 1.0476, test_f1: 0.4671
 epoch: 2, train_loss: 0.9706, test_loss: 0.9721, test_f1: 0.4923
 epoch: 3, train_loss: 0.9629, test_loss: 1.0356, test_f1: 0.4782
 epoch: 4, train_loss: 0.9457, test_loss: 0.9903, test_f1: 0.4719
 epoch: 5, train_loss: 0.9400, test_loss: 1.0377, test_f1: 0.4889
 epoch: 6, train_loss: 0.9371, test_loss: 1.0124, test_f1: 0.4753
 epoch: 7, train_loss: 0.9335, test_loss: 0.9176, test_f1: 0.5135
 epoch: 8, train_loss: 0.9028, test_loss: 0.9083, test_f1: 0.5155
 epoch: 9, train_loss: 0.8898, test_loss: 0.9345, test_f1: 0.5363
 epoch: 10, train_loss: 0.8772, test_loss: 1.0238, test_f1: 0.5333
 epoch: 11, train_loss: 0.8634, test_loss: 0.9994, test_f1: 0.5224
 epoch: 12, train_loss: 0.8878, test_loss: 1.0999, test_f1: 0.5188
 epoch: 13, train_loss: 0.8733, test_loss: 1.0071, test_f1: 0.5677
 epoch: 14, train_loss: 0.8444, test_loss: 0.8644, test_f1: 0.5671
 epoch: 15, train_loss: 0.8454, test_loss: 0.9934, test_f1: 0.5869
 epoch: 16, train_loss: 0.8465, test_loss: 0.8554, test_f1: 0.6041
 epoch: 17, train_loss: 0.8210, test_loss: 0.8121, test_f1: 0.5603
 epoch: 18, train_loss: 0.8291, test_loss: 0.8683, test_f1: 0.5946
 epoch: 19, train_loss: 0.8279, test_loss: 0.8639, test_f1: 0.5373
 epoch: 20, train_loss: 0.8184, test_loss: 0.8478, test_f1: 0.6010
 epoch: 21, train_loss: 0.7962, test_loss: 0.8414, test_f1: 0.6352
 epoch: 22, train_loss: 0.7966, test_loss: 0.8925, test_f1: 0.5794
 epoch: 23, train_loss: 0.7910, test_loss: 0.9097, test_f1: 0.6160
 epoch: 24, train_loss: 0.7976, test_loss: 0.9369, test_f1: 0.6042
 epoch: 25, train_loss: 0.7868, test_loss: 0.8754, test_f1: 0.5946
 epoch: 26, train_loss: 0.7904, test_loss: 0.9057, test_f1: 0.6201
 epoch: 27, train_loss: 0.7724, test_loss: 1.0000, test_f1: 0.6032
 epoch: 28, train_loss: 0.7779, test_loss: 1.0432, test_f1: 0.6040
 epoch: 29, train_loss: 0.7774, test_loss: 0.8636, test_f1: 0.6187
 epoch: 30, train_loss: 0.7900, test_loss: 0.8743, test_f1: 0.5791
 epoch: 31, train_loss: 0.7848, test_loss: 0.8951, test_f1: 0.5701
 epoch: 32, train_loss: 0.7506, test_loss: 0.9653, test_f1: 0.5412
 epoch: 33, train_loss: 0.7477, test_loss: 0.8743, test_f1: 0.6152
 epoch: 34, train_loss: 0.7349, test_loss: 0.8531, test_f1: 0.6430
 epoch: 35, train_loss: 0.7439, test_loss: 0.9086, test_f1: 0.6217
 epoch: 36, train_loss: 0.7609, test_loss: 0.8468, test_f1: 0.6209
 epoch: 37, train_loss: 0.7416, test_loss: 0.8761, test_f1: 0.5848
 epoch: 38, train_loss: 0.7462, test_loss: 0.9666, test_f1: 0.6156
 epoch: 39, train_loss: 0.7402, test_loss: 0.8610, test_f1: 0.6146
 epoch: 40, train_loss: 0.7450, test_loss: 0.9055, test_f1: 0.6189
 epoch: 41, train_loss: 0.7384, test_loss: 0.8521, test_f1: 0.6378
 epoch: 42, train_loss: 0.7182, test_loss: 0.9119, test_f1: 0.5900
 epoch: 43, train_loss: 0.7220, test_loss: 0.9110, test_f1: 0.6240
 epoch: 44, train_loss: 0.7148, test_loss: 0.8954, test_f1: 0.6327
 epoch: 45, train_loss: 0.7111, test_loss: 0.9271, test_f1: 0.5991
 epoch: 46, train_loss: 0.7101, test_loss: 0.9806, test_f1: 0.6220
 epoch: 47, train_loss: 0.7012, test_loss: 1.0071, test_f1: 0.6535
 epoch: 48, train_loss: 0.7592, test_loss: 0.9472, test_f1: 0.6057
 epoch: 49, train_loss: 0.7177, test_loss: 0.9777, test_f1: 0.6295
 epoch: 50, train_loss: 0.6927, test_loss: 1.0719, test_f1: 0.6350
 epoch: 51, train_loss: 0.6683, test_loss: 0.9160, test_f1: 0.6597
 epoch: 52, train_loss: 0.6540, test_loss: 0.8999, test_f1: 0.6257
 epoch: 53, train_loss: 0.6568, test_loss: 0.9527, test_f1: 0.6507
 epoch: 54, train_loss: 0.6601, test_loss: 1.0041, test_f1: 0.6231
 epoch: 55, train_loss: 0.6376, test_loss: 1.0046, test_f1: 0.6591
 epoch: 56, train_loss: 0.6308, test_loss: 0.8097, test_f1: 0.6363
 epoch: 57, train_loss: 0.6399, test_loss: 0.9426, test_f1: 0.6417
 epoch: 58, train_loss: 0.6339, test_loss: 0.9077, test_f1: 0.6659
 epoch: 59, train_loss: 0.6489, test_loss: 0.9798, test_f1: 0.6624
 epoch: 60, train_loss: 0.6259, test_loss: 0.9648, test_f1: 0.6883
 epoch: 61, train_loss: 0.6075, test_loss: 1.0754, test_f1: 0.6676
 epoch: 62, train_loss: 0.6174, test_loss: 0.9042, test_f1: 0.6653
 epoch: 63, train_loss: 0.6202, test_loss: 1.0143, test_f1: 0.6607
 epoch: 64, train_loss: 0.6193, test_loss: 1.0383, test_f1: 0.6495
 epoch: 65, train_loss: 0.6053, test_loss: 1.0435, test_f1: 0.6513
 epoch: 66, train_loss: 0.6144, test_loss: 1.0169, test_f1: 0.6811
 epoch: 67, train_loss: 0.6119, test_loss: 0.8368, test_f1: 0.6686
 epoch: 68, train_loss: 0.6070, test_loss: 1.0569, test_f1: 0.6800
 epoch: 69, train_loss: 0.5977, test_loss: 0.9207, test_f1: 0.6852
 epoch: 70, train_loss: 0.6123, test_loss: 1.1368, test_f1: 0.6819
 epoch: 71, train_loss: 0.6214, test_loss: 1.0818, test_f1: 0.6528
 epoch: 72, train_loss: 0.6018, test_loss: 1.0193, test_f1: 0.6745
 epoch: 73, train_loss: 0.6024, test_loss: 0.9530, test_f1: 0.6496
 epoch: 74, train_loss: 0.5986, test_loss: 0.9321, test_f1: 0.6653
 epoch: 75, train_loss: 0.5962, test_loss: 1.1238, test_f1: 0.6690
 epoch: 76, train_loss: 0.5839, test_loss: 1.0923, test_f1: 0.6499
 epoch: 77, train_loss: 0.6259, test_loss: 1.0015, test_f1: 0.6718
 epoch: 78, train_loss: 0.5915, test_loss: 1.0662, test_f1: 0.6690
 epoch: 79, train_loss: 0.6006, test_loss: 1.1622, test_f1: 0.6722
 epoch: 80, train_loss: 0.5745, test_loss: 1.0940, test_f1: 0.6540
 epoch: 81, train_loss: 0.5759, test_loss: 1.2146, test_f1: 0.6494
 epoch: 82, train_loss: 0.6091, test_loss: 1.1980, test_f1: 0.6561
 epoch: 83, train_loss: 0.5807, test_loss: 1.0290, test_f1: 0.6781
 epoch: 84, train_loss: 0.5742, test_loss: 1.2352, test_f1: 0.6452
 epoch: 85, train_loss: 0.5736, test_loss: 1.0807, test_f1: 0.6785
 epoch: 86, train_loss: 0.5771, test_loss: 1.2317, test_f1: 0.6397
 epoch: 87, train_loss: 0.5655, test_loss: 1.1395, test_f1: 0.6660
 epoch: 88, train_loss: 0.5736, test_loss: 1.1390, test_f1: 0.6773
 epoch: 89, train_loss: 0.5616, test_loss: 1.2311, test_f1: 0.6481
 epoch: 90, train_loss: 0.5783, test_loss: 1.1345, test_f1: 0.6904
 epoch: 91, train_loss: 0.5715, test_loss: 1.2654, test_f1: 0.6773
 epoch: 92, train_loss: 0.5673, test_loss: 1.1457, test_f1: 0.6770
 epoch: 93, train_loss: 0.5665, test_loss: 1.2731, test_f1: 0.6594
 epoch: 94, train_loss: 0.5551, test_loss: 1.3586, test_f1: 0.6745
 epoch: 95, train_loss: 0.5596, test_loss: 1.1838, test_f1: 0.6801
 epoch: 96, train_loss: 0.5664, test_loss: 1.2790, test_f1: 0.6538
 epoch: 97, train_loss: 0.5596, test_loss: 1.2497, test_f1: 0.6959
 epoch: 98, train_loss: 0.5815, test_loss: 1.4260, test_f1: 0.6548
 epoch: 99, train_loss: 0.5731, test_loss: 1.3233, test_f1: 0.6758

Training completed in 816.47 seconds
Best F1: 0.7244 at epoch 62
Mean F1 across iterations: 0.6932  0.0138
========================FINAL RESULTS================================
FEGIN weighted F1: 0.7244  0.0138
python main.py --data ltspice_examples --representation component_pin_net --model FEGIN --layers 2 --hiddens 64 --batch_size 32 --lr 0.01 --emb_size 128 --epochs 100 --save_appendix component_pin_net_L2_H64_BS32_LR0.01_E128 --no_val
-----



STDERR:
  File "main.py", line 370, in <module>
    main()
  File "main.py", line 254, in main
    dataset = dataset_class(
  File "/home/philip/projects/ltspice_examples_code_repo/Circuit-Completion-Using-GNNs/component_classification_with_link_prediction_head/evaluation/FEGIN/kernel/circuit_datasets.py", line 15, in __init__
    self.data, self.slices = torch.load(self.processed_paths[0])
  File "/home/philip/.local/lib/python3.8/site-packages/torch/serialization.py", line 1040, in load
    warnings.warn(
  File "/usr/lib/python3.8/warnings.py", line 109, in _showwarnmsg
    sw(msg.message, msg.category, msg.filename, msg.lineno,
  File "main.py", line 47, in warn_with_traceback
    traceback.print_stack(file=log)
/home/philip/projects/ltspice_examples_code_repo/Circuit-Completion-Using-GNNs/component_classification_with_link_prediction_head/evaluation/FEGIN/kernel/circuit_datasets.py:15: FutureWarning: You are using `torch.load` with `weights_only=False` (the current default value), which uses the default pickle module implicitly. It is possible to construct malicious pickle data which will execute arbitrary code during unpickling (See https://github.com/pytorch/pytorch/blob/main/SECURITY.md#untrusted-models for more details). In a future release, the default value for `weights_only` will be flipped to `True`. This limits the functions that could be executed during unpickling. Arbitrary objects will no longer be allowed to be loaded via this mode unless they are explicitly allowlisted by the user via `torch.serialization.add_safe_globals`. We recommend you start setting `weights_only=True` for any use case where you don't have full control of the loaded file. Please open an issue on GitHub for any issues related to this experimental feature.
  self.data, self.slices = torch.load(self.processed_paths[0])
