STDOUT:
Results will be saved in /home/philip/projects/ltspice_examples_code_repo/Circuit-Completion-Using-GNNs/component_classification_with_link_prediction_head/evaluation/FEGIN/results/model_FEGIN_dataset_ltspice_examples
Command line input: python main.py --data ltspice_examples --representation component_component --model FEGIN --layers 2 --hiddens 64 --batch_size 32 --lr 0.0001 --emb_size 128 --epochs 100 --save_appendix component_component_L2_H64_BS32_LR0.0001_E128 --no_val
 is saved.
-----
ltspice_examples - FEGIN
Using 2 layers, 64 hidden units, h = 2
Loading component_component representation dataset
ENTERED
Training FEGIN on component_component representation
Train: 3556, Test: 845
##################ITERATION #0 ****************************************
 epoch: 0, train_loss: 1.3779, test_loss: 1.3513, test_f1: 0.2659
 epoch: 1, train_loss: 1.3336, test_loss: 1.3074, test_f1: 0.2541
 epoch: 2, train_loss: 1.2919, test_loss: 1.2635, test_f1: 0.2585
 epoch: 3, train_loss: 1.2591, test_loss: 1.2280, test_f1: 0.3011
 epoch: 4, train_loss: 1.2350, test_loss: 1.2008, test_f1: 0.3301
 epoch: 5, train_loss: 1.2217, test_loss: 1.1817, test_f1: 0.3523
 epoch: 6, train_loss: 1.2043, test_loss: 1.1655, test_f1: 0.3512
 epoch: 7, train_loss: 1.1902, test_loss: 1.1559, test_f1: 0.3483
 epoch: 8, train_loss: 1.1755, test_loss: 1.1425, test_f1: 0.3564
 epoch: 9, train_loss: 1.1693, test_loss: 1.1284, test_f1: 0.3859
 epoch: 10, train_loss: 1.1544, test_loss: 1.1150, test_f1: 0.3980
 epoch: 11, train_loss: 1.1453, test_loss: 1.1049, test_f1: 0.4149
 epoch: 12, train_loss: 1.1372, test_loss: 1.0946, test_f1: 0.4337
 epoch: 13, train_loss: 1.1216, test_loss: 1.0848, test_f1: 0.4215
 epoch: 14, train_loss: 1.1133, test_loss: 1.0842, test_f1: 0.4376
 epoch: 15, train_loss: 1.1048, test_loss: 1.0715, test_f1: 0.4472
 epoch: 16, train_loss: 1.1029, test_loss: 1.0550, test_f1: 0.4584
 epoch: 17, train_loss: 1.0896, test_loss: 1.0522, test_f1: 0.4447
 epoch: 18, train_loss: 1.0809, test_loss: 1.0377, test_f1: 0.4575
 epoch: 19, train_loss: 1.0730, test_loss: 1.0297, test_f1: 0.4508
 epoch: 20, train_loss: 1.0700, test_loss: 1.0166, test_f1: 0.4611
 epoch: 21, train_loss: 1.0619, test_loss: 1.0220, test_f1: 0.4527
 epoch: 22, train_loss: 1.0499, test_loss: 1.0095, test_f1: 0.4664
 epoch: 23, train_loss: 1.0418, test_loss: 1.0038, test_f1: 0.4558
 epoch: 24, train_loss: 1.0364, test_loss: 1.0009, test_f1: 0.4755
 epoch: 25, train_loss: 1.0282, test_loss: 0.9883, test_f1: 0.4709
 epoch: 26, train_loss: 1.0286, test_loss: 0.9843, test_f1: 0.4704
 epoch: 27, train_loss: 1.0090, test_loss: 0.9727, test_f1: 0.4743
 epoch: 28, train_loss: 1.0143, test_loss: 0.9665, test_f1: 0.4903
 epoch: 29, train_loss: 1.0043, test_loss: 0.9645, test_f1: 0.4887
 epoch: 30, train_loss: 1.0044, test_loss: 0.9642, test_f1: 0.4769
 epoch: 31, train_loss: 1.0043, test_loss: 0.9569, test_f1: 0.4924
 epoch: 32, train_loss: 0.9880, test_loss: 0.9665, test_f1: 0.5052
 epoch: 33, train_loss: 0.9789, test_loss: 0.9531, test_f1: 0.4893
 epoch: 34, train_loss: 0.9981, test_loss: 0.9518, test_f1: 0.4969
 epoch: 35, train_loss: 0.9886, test_loss: 0.9488, test_f1: 0.5105
 epoch: 36, train_loss: 0.9818, test_loss: 0.9535, test_f1: 0.5045
 epoch: 37, train_loss: 0.9750, test_loss: 0.9509, test_f1: 0.4990
 epoch: 38, train_loss: 0.9662, test_loss: 0.9365, test_f1: 0.5264
 epoch: 39, train_loss: 0.9603, test_loss: 0.9460, test_f1: 0.5078
 epoch: 40, train_loss: 0.9661, test_loss: 0.9397, test_f1: 0.5241
 epoch: 41, train_loss: 0.9560, test_loss: 0.9395, test_f1: 0.5103
 epoch: 42, train_loss: 0.9580, test_loss: 0.9443, test_f1: 0.4949
 epoch: 43, train_loss: 0.9426, test_loss: 0.9330, test_f1: 0.5041
 epoch: 44, train_loss: 0.9397, test_loss: 0.9367, test_f1: 0.5139
 epoch: 45, train_loss: 0.9501, test_loss: 0.9289, test_f1: 0.5267
 epoch: 46, train_loss: 0.9398, test_loss: 0.9419, test_f1: 0.4995
 epoch: 47, train_loss: 0.9479, test_loss: 0.9227, test_f1: 0.5333
 epoch: 48, train_loss: 0.9365, test_loss: 0.9455, test_f1: 0.4918
 epoch: 49, train_loss: 0.9323, test_loss: 0.9457, test_f1: 0.4901
 epoch: 50, train_loss: 0.9291, test_loss: 0.9281, test_f1: 0.5088
 epoch: 51, train_loss: 0.9256, test_loss: 0.9294, test_f1: 0.5055
 epoch: 52, train_loss: 0.9157, test_loss: 0.9144, test_f1: 0.5203
 epoch: 53, train_loss: 0.9164, test_loss: 0.9104, test_f1: 0.5379
 epoch: 54, train_loss: 0.9131, test_loss: 0.9356, test_f1: 0.5232
 epoch: 55, train_loss: 0.9131, test_loss: 0.9251, test_f1: 0.5177
 epoch: 56, train_loss: 0.9113, test_loss: 0.9242, test_f1: 0.5201
 epoch: 57, train_loss: 0.9057, test_loss: 0.9248, test_f1: 0.5203
 epoch: 58, train_loss: 0.9104, test_loss: 0.9376, test_f1: 0.4969
 epoch: 59, train_loss: 0.8989, test_loss: 0.9304, test_f1: 0.5290
 epoch: 60, train_loss: 0.9041, test_loss: 0.9270, test_f1: 0.5171
 epoch: 61, train_loss: 0.9036, test_loss: 0.9329, test_f1: 0.5234
 epoch: 62, train_loss: 0.9051, test_loss: 0.9271, test_f1: 0.5239
 epoch: 63, train_loss: 0.9055, test_loss: 0.9321, test_f1: 0.5217
 epoch: 64, train_loss: 0.8968, test_loss: 0.9259, test_f1: 0.5253
 epoch: 65, train_loss: 0.9062, test_loss: 0.9397, test_f1: 0.5149
 epoch: 66, train_loss: 0.8870, test_loss: 0.9344, test_f1: 0.5286
 epoch: 67, train_loss: 0.8972, test_loss: 0.9278, test_f1: 0.5322
 epoch: 68, train_loss: 0.8945, test_loss: 0.9353, test_f1: 0.5195
 epoch: 69, train_loss: 0.8988, test_loss: 0.9519, test_f1: 0.4989
 epoch: 70, train_loss: 0.8902, test_loss: 0.9359, test_f1: 0.5256
 epoch: 71, train_loss: 0.8859, test_loss: 0.9146, test_f1: 0.5417
 epoch: 72, train_loss: 0.8883, test_loss: 0.9462, test_f1: 0.5091
 epoch: 73, train_loss: 0.8876, test_loss: 0.9447, test_f1: 0.5099
 epoch: 74, train_loss: 0.8839, test_loss: 0.9321, test_f1: 0.5219
 epoch: 75, train_loss: 0.8891, test_loss: 0.9435, test_f1: 0.5186
 epoch: 76, train_loss: 0.8802, test_loss: 0.9377, test_f1: 0.5324
 epoch: 77, train_loss: 0.8821, test_loss: 0.9358, test_f1: 0.5191
 epoch: 78, train_loss: 0.8807, test_loss: 0.9244, test_f1: 0.5311
 epoch: 79, train_loss: 0.8780, test_loss: 0.9354, test_f1: 0.5103
 epoch: 80, train_loss: 0.8838, test_loss: 0.9456, test_f1: 0.5191
 epoch: 81, train_loss: 0.8706, test_loss: 0.9584, test_f1: 0.5010
 epoch: 82, train_loss: 0.8666, test_loss: 0.9448, test_f1: 0.5374
 epoch: 83, train_loss: 0.8663, test_loss: 0.9639, test_f1: 0.4946
 epoch: 84, train_loss: 0.8638, test_loss: 0.9480, test_f1: 0.4988
 epoch: 85, train_loss: 0.8748, test_loss: 0.9455, test_f1: 0.5148
 epoch: 86, train_loss: 0.8651, test_loss: 0.9498, test_f1: 0.5254
 epoch: 87, train_loss: 0.8670, test_loss: 0.9375, test_f1: 0.5319
 epoch: 88, train_loss: 0.8669, test_loss: 0.9627, test_f1: 0.5171
 epoch: 89, train_loss: 0.8670, test_loss: 0.9822, test_f1: 0.4960
 epoch: 90, train_loss: 0.8553, test_loss: 0.9921, test_f1: 0.4983
 epoch: 91, train_loss: 0.8605, test_loss: 0.9663, test_f1: 0.5323
 epoch: 92, train_loss: 0.8650, test_loss: 0.9536, test_f1: 0.5089
 epoch: 93, train_loss: 0.8603, test_loss: 0.9633, test_f1: 0.5157
 epoch: 94, train_loss: 0.8598, test_loss: 0.9663, test_f1: 0.5157
 epoch: 95, train_loss: 0.8601, test_loss: 0.9762, test_f1: 0.5291
 epoch: 96, train_loss: 0.8576, test_loss: 0.9529, test_f1: 0.5175
 epoch: 97, train_loss: 0.8562, test_loss: 0.9745, test_f1: 0.5142
 epoch: 98, train_loss: 0.8631, test_loss: 0.9735, test_f1: 0.5092
 epoch: 99, train_loss: 0.8536, test_loss: 0.9769, test_f1: 0.5019
##################ITERATION #1 ****************************************
 epoch: 0, train_loss: 1.3096, test_loss: 1.2423, test_f1: 0.3600
 epoch: 1, train_loss: 1.2389, test_loss: 1.2047, test_f1: 0.3932
 epoch: 2, train_loss: 1.2097, test_loss: 1.1761, test_f1: 0.4075
 epoch: 3, train_loss: 1.1841, test_loss: 1.1431, test_f1: 0.4255
 epoch: 4, train_loss: 1.1630, test_loss: 1.1249, test_f1: 0.4179
 epoch: 5, train_loss: 1.1432, test_loss: 1.1021, test_f1: 0.4180
 epoch: 6, train_loss: 1.1215, test_loss: 1.0819, test_f1: 0.4292
 epoch: 7, train_loss: 1.1087, test_loss: 1.0724, test_f1: 0.4294
 epoch: 8, train_loss: 1.0973, test_loss: 1.0548, test_f1: 0.4483
 epoch: 9, train_loss: 1.0867, test_loss: 1.0385, test_f1: 0.4435
 epoch: 10, train_loss: 1.0730, test_loss: 1.0351, test_f1: 0.4519
 epoch: 11, train_loss: 1.0679, test_loss: 1.0287, test_f1: 0.4461
 epoch: 12, train_loss: 1.0551, test_loss: 1.0064, test_f1: 0.4646
 epoch: 13, train_loss: 1.0425, test_loss: 1.0139, test_f1: 0.4533
 epoch: 14, train_loss: 1.0310, test_loss: 0.9994, test_f1: 0.4722
 epoch: 15, train_loss: 1.0356, test_loss: 1.0012, test_f1: 0.4501
 epoch: 16, train_loss: 1.0263, test_loss: 1.0031, test_f1: 0.4471
 epoch: 17, train_loss: 1.0108, test_loss: 0.9684, test_f1: 0.4840
 epoch: 18, train_loss: 1.0105, test_loss: 0.9724, test_f1: 0.5010
 epoch: 19, train_loss: 0.9925, test_loss: 0.9689, test_f1: 0.4639
 epoch: 20, train_loss: 0.9951, test_loss: 0.9829, test_f1: 0.4847
 epoch: 21, train_loss: 0.9866, test_loss: 0.9722, test_f1: 0.4680
 epoch: 22, train_loss: 0.9864, test_loss: 0.9542, test_f1: 0.4914
 epoch: 23, train_loss: 0.9792, test_loss: 0.9544, test_f1: 0.4891
 epoch: 24, train_loss: 0.9684, test_loss: 0.9502, test_f1: 0.4634
 epoch: 25, train_loss: 0.9667, test_loss: 0.9557, test_f1: 0.4862
 epoch: 26, train_loss: 0.9534, test_loss: 0.9513, test_f1: 0.4577
 epoch: 27, train_loss: 0.9662, test_loss: 0.9460, test_f1: 0.4610
 epoch: 28, train_loss: 0.9640, test_loss: 0.9456, test_f1: 0.5095
 epoch: 29, train_loss: 0.9454, test_loss: 0.9427, test_f1: 0.4641
 epoch: 30, train_loss: 0.9443, test_loss: 0.9396, test_f1: 0.4932
 epoch: 31, train_loss: 0.9317, test_loss: 0.9506, test_f1: 0.4847
 epoch: 32, train_loss: 0.9357, test_loss: 0.9452, test_f1: 0.4995
 epoch: 33, train_loss: 0.9307, test_loss: 0.9522, test_f1: 0.4798
 epoch: 34, train_loss: 0.9273, test_loss: 0.9328, test_f1: 0.5003
 epoch: 35, train_loss: 0.9269, test_loss: 0.9434, test_f1: 0.5136
 epoch: 36, train_loss: 0.9226, test_loss: 0.9255, test_f1: 0.5036
 epoch: 37, train_loss: 0.9160, test_loss: 0.9361, test_f1: 0.5000
 epoch: 38, train_loss: 0.9018, test_loss: 0.9561, test_f1: 0.5108
 epoch: 39, train_loss: 0.9018, test_loss: 0.9523, test_f1: 0.5113
 epoch: 40, train_loss: 0.9076, test_loss: 0.9679, test_f1: 0.5068
 epoch: 41, train_loss: 0.9027, test_loss: 0.9583, test_f1: 0.5137
 epoch: 42, train_loss: 0.9021, test_loss: 0.9524, test_f1: 0.5162
 epoch: 43, train_loss: 0.8950, test_loss: 0.9602, test_f1: 0.5112
 epoch: 44, train_loss: 0.8850, test_loss: 0.9568, test_f1: 0.5101
 epoch: 45, train_loss: 0.8852, test_loss: 0.9622, test_f1: 0.5079
 epoch: 46, train_loss: 0.8958, test_loss: 0.9485, test_f1: 0.5195
 epoch: 47, train_loss: 0.8662, test_loss: 0.9621, test_f1: 0.5240
 epoch: 48, train_loss: 0.8758, test_loss: 0.9630, test_f1: 0.5193
 epoch: 49, train_loss: 0.8804, test_loss: 0.9584, test_f1: 0.5069
 epoch: 50, train_loss: 0.8842, test_loss: 0.9499, test_f1: 0.5193
 epoch: 51, train_loss: 0.8662, test_loss: 0.9590, test_f1: 0.5184
 epoch: 52, train_loss: 0.8637, test_loss: 0.9659, test_f1: 0.5241
 epoch: 53, train_loss: 0.8760, test_loss: 0.9556, test_f1: 0.5218
 epoch: 54, train_loss: 0.8643, test_loss: 0.9569, test_f1: 0.5183
 epoch: 55, train_loss: 0.8599, test_loss: 0.9536, test_f1: 0.5224
 epoch: 56, train_loss: 0.8589, test_loss: 0.9668, test_f1: 0.5091
 epoch: 57, train_loss: 0.8554, test_loss: 0.9677, test_f1: 0.5259
 epoch: 58, train_loss: 0.8558, test_loss: 0.9597, test_f1: 0.5229
 epoch: 59, train_loss: 0.8493, test_loss: 0.9698, test_f1: 0.5163
 epoch: 60, train_loss: 0.8418, test_loss: 0.9765, test_f1: 0.5246
 epoch: 61, train_loss: 0.8559, test_loss: 0.9722, test_f1: 0.5311
 epoch: 62, train_loss: 0.8461, test_loss: 0.9634, test_f1: 0.5361
 epoch: 63, train_loss: 0.8436, test_loss: 0.9675, test_f1: 0.5257
 epoch: 64, train_loss: 0.8358, test_loss: 0.9663, test_f1: 0.5330
 epoch: 65, train_loss: 0.8410, test_loss: 0.9666, test_f1: 0.5299
 epoch: 66, train_loss: 0.8454, test_loss: 0.9786, test_f1: 0.5130
 epoch: 67, train_loss: 0.8355, test_loss: 0.9614, test_f1: 0.5429
 epoch: 68, train_loss: 0.8272, test_loss: 0.9845, test_f1: 0.5265
 epoch: 69, train_loss: 0.8311, test_loss: 0.9764, test_f1: 0.5342
 epoch: 70, train_loss: 0.8339, test_loss: 0.9798, test_f1: 0.5372
 epoch: 71, train_loss: 0.8333, test_loss: 0.9934, test_f1: 0.5335
 epoch: 72, train_loss: 0.8267, test_loss: 0.9814, test_f1: 0.5329
 epoch: 73, train_loss: 0.8451, test_loss: 0.9783, test_f1: 0.5402
 epoch: 74, train_loss: 0.8312, test_loss: 1.0062, test_f1: 0.5373
 epoch: 75, train_loss: 0.8435, test_loss: 0.9843, test_f1: 0.5269
 epoch: 76, train_loss: 0.8291, test_loss: 0.9915, test_f1: 0.5300
 epoch: 77, train_loss: 0.8175, test_loss: 0.9728, test_f1: 0.5404
 epoch: 78, train_loss: 0.8261, test_loss: 0.9806, test_f1: 0.5429
 epoch: 79, train_loss: 0.8285, test_loss: 0.9827, test_f1: 0.5205
 epoch: 80, train_loss: 0.8077, test_loss: 0.9890, test_f1: 0.5268
 epoch: 81, train_loss: 0.8181, test_loss: 0.9961, test_f1: 0.5329
 epoch: 82, train_loss: 0.8368, test_loss: 0.9967, test_f1: 0.5332
 epoch: 83, train_loss: 0.8134, test_loss: 0.9875, test_f1: 0.5301
 epoch: 84, train_loss: 0.8181, test_loss: 0.9982, test_f1: 0.5381
 epoch: 85, train_loss: 0.8161, test_loss: 0.9835, test_f1: 0.5433
 epoch: 86, train_loss: 0.8135, test_loss: 0.9904, test_f1: 0.5345
 epoch: 87, train_loss: 0.8011, test_loss: 1.0090, test_f1: 0.5292
 epoch: 88, train_loss: 0.8063, test_loss: 1.0027, test_f1: 0.5246
 epoch: 89, train_loss: 0.8182, test_loss: 0.9905, test_f1: 0.5456
 epoch: 90, train_loss: 0.8076, test_loss: 0.9970, test_f1: 0.5452
 epoch: 91, train_loss: 0.8110, test_loss: 1.0015, test_f1: 0.5495
 epoch: 92, train_loss: 0.8075, test_loss: 1.0181, test_f1: 0.5430
 epoch: 93, train_loss: 0.8000, test_loss: 1.0138, test_f1: 0.5540
 epoch: 94, train_loss: 0.8029, test_loss: 0.9940, test_f1: 0.5587
 epoch: 95, train_loss: 0.8089, test_loss: 1.0160, test_f1: 0.5294
 epoch: 96, train_loss: 0.7947, test_loss: 1.0226, test_f1: 0.5308
 epoch: 97, train_loss: 0.7867, test_loss: 1.0059, test_f1: 0.5306
 epoch: 98, train_loss: 0.7959, test_loss: 1.0376, test_f1: 0.5188
 epoch: 99, train_loss: 0.8008, test_loss: 1.0050, test_f1: 0.5492
##################ITERATION #2 ****************************************
 epoch: 0, train_loss: 1.3045, test_loss: 1.2369, test_f1: 0.3332
 epoch: 1, train_loss: 1.2460, test_loss: 1.2092, test_f1: 0.3312
 epoch: 2, train_loss: 1.2161, test_loss: 1.1860, test_f1: 0.3948
 epoch: 3, train_loss: 1.1989, test_loss: 1.1551, test_f1: 0.4410
 epoch: 4, train_loss: 1.1787, test_loss: 1.1354, test_f1: 0.4436
 epoch: 5, train_loss: 1.1564, test_loss: 1.1130, test_f1: 0.4508
 epoch: 6, train_loss: 1.1483, test_loss: 1.0939, test_f1: 0.4438
 epoch: 7, train_loss: 1.1243, test_loss: 1.0706, test_f1: 0.4668
 epoch: 8, train_loss: 1.1151, test_loss: 1.0600, test_f1: 0.4624
 epoch: 9, train_loss: 1.0977, test_loss: 1.0446, test_f1: 0.4595
 epoch: 10, train_loss: 1.0891, test_loss: 1.0312, test_f1: 0.4664
 epoch: 11, train_loss: 1.0851, test_loss: 1.0222, test_f1: 0.4722
 epoch: 12, train_loss: 1.0663, test_loss: 1.0085, test_f1: 0.4652
 epoch: 13, train_loss: 1.0654, test_loss: 1.0008, test_f1: 0.4718
 epoch: 14, train_loss: 1.0448, test_loss: 0.9862, test_f1: 0.4869
 epoch: 15, train_loss: 1.0333, test_loss: 0.9765, test_f1: 0.4769
 epoch: 16, train_loss: 1.0368, test_loss: 0.9731, test_f1: 0.4728
 epoch: 17, train_loss: 1.0249, test_loss: 0.9608, test_f1: 0.4787
 epoch: 18, train_loss: 1.0174, test_loss: 0.9630, test_f1: 0.4912
 epoch: 19, train_loss: 1.0090, test_loss: 0.9508, test_f1: 0.4774
 epoch: 20, train_loss: 1.0037, test_loss: 0.9614, test_f1: 0.4855
 epoch: 21, train_loss: 0.9965, test_loss: 0.9544, test_f1: 0.4887
 epoch: 22, train_loss: 0.9908, test_loss: 0.9504, test_f1: 0.4826
 epoch: 23, train_loss: 0.9846, test_loss: 0.9450, test_f1: 0.4822
 epoch: 24, train_loss: 0.9845, test_loss: 0.9539, test_f1: 0.4899
 epoch: 25, train_loss: 0.9766, test_loss: 0.9399, test_f1: 0.4816
 epoch: 26, train_loss: 0.9812, test_loss: 0.9295, test_f1: 0.4909
 epoch: 27, train_loss: 0.9731, test_loss: 0.9239, test_f1: 0.4914
 epoch: 28, train_loss: 0.9742, test_loss: 0.9345, test_f1: 0.4938
 epoch: 29, train_loss: 0.9656, test_loss: 0.9280, test_f1: 0.4984
 epoch: 30, train_loss: 0.9529, test_loss: 0.9453, test_f1: 0.4822
 epoch: 31, train_loss: 0.9501, test_loss: 0.9307, test_f1: 0.4918
 epoch: 32, train_loss: 0.9426, test_loss: 0.9150, test_f1: 0.4981
 epoch: 33, train_loss: 0.9345, test_loss: 0.9440, test_f1: 0.5037
 epoch: 34, train_loss: 0.9362, test_loss: 0.9312, test_f1: 0.5045
 epoch: 35, train_loss: 0.9313, test_loss: 0.9263, test_f1: 0.5120
 epoch: 36, train_loss: 0.9390, test_loss: 0.9131, test_f1: 0.5218
 epoch: 37, train_loss: 0.9360, test_loss: 0.9553, test_f1: 0.5022
 epoch: 38, train_loss: 0.9263, test_loss: 0.9346, test_f1: 0.5228
 epoch: 39, train_loss: 0.9261, test_loss: 0.9400, test_f1: 0.5127
 epoch: 40, train_loss: 0.9128, test_loss: 0.9303, test_f1: 0.5114
 epoch: 41, train_loss: 0.9126, test_loss: 0.9451, test_f1: 0.5129
 epoch: 42, train_loss: 0.9049, test_loss: 0.9566, test_f1: 0.5044
 epoch: 43, train_loss: 0.9113, test_loss: 0.9494, test_f1: 0.5080
 epoch: 44, train_loss: 0.9028, test_loss: 0.9496, test_f1: 0.4990
 epoch: 45, train_loss: 0.8917, test_loss: 0.9657, test_f1: 0.5155
 epoch: 46, train_loss: 0.8901, test_loss: 0.9577, test_f1: 0.5268
 epoch: 47, train_loss: 0.8907, test_loss: 0.9475, test_f1: 0.5235
 epoch: 48, train_loss: 0.8910, test_loss: 0.9589, test_f1: 0.5143
 epoch: 49, train_loss: 0.8792, test_loss: 0.9711, test_f1: 0.5114
 epoch: 50, train_loss: 0.8907, test_loss: 0.9424, test_f1: 0.5351
 epoch: 51, train_loss: 0.8744, test_loss: 0.9418, test_f1: 0.5348
 epoch: 52, train_loss: 0.8823, test_loss: 0.9543, test_f1: 0.5249
 epoch: 53, train_loss: 0.8641, test_loss: 0.9499, test_f1: 0.5244
 epoch: 54, train_loss: 0.8725, test_loss: 0.9455, test_f1: 0.5259
 epoch: 55, train_loss: 0.8674, test_loss: 0.9535, test_f1: 0.5143
 epoch: 56, train_loss: 0.8708, test_loss: 0.9701, test_f1: 0.5238
 epoch: 57, train_loss: 0.8734, test_loss: 0.9733, test_f1: 0.5208
 epoch: 58, train_loss: 0.8734, test_loss: 0.9731, test_f1: 0.5169
 epoch: 59, train_loss: 0.8604, test_loss: 0.9678, test_f1: 0.5191
 epoch: 60, train_loss: 0.8649, test_loss: 0.9665, test_f1: 0.5118
 epoch: 61, train_loss: 0.8592, test_loss: 0.9633, test_f1: 0.5187
 epoch: 62, train_loss: 0.8640, test_loss: 0.9761, test_f1: 0.5178
 epoch: 63, train_loss: 0.8521, test_loss: 0.9851, test_f1: 0.5132
 epoch: 64, train_loss: 0.8607, test_loss: 0.9629, test_f1: 0.5259
 epoch: 65, train_loss: 0.8503, test_loss: 0.9603, test_f1: 0.5349
 epoch: 66, train_loss: 0.8538, test_loss: 0.9539, test_f1: 0.5285
 epoch: 67, train_loss: 0.8522, test_loss: 0.9730, test_f1: 0.5370
 epoch: 68, train_loss: 0.8523, test_loss: 0.9696, test_f1: 0.5223
 epoch: 69, train_loss: 0.8519, test_loss: 0.9512, test_f1: 0.5223
 epoch: 70, train_loss: 0.8464, test_loss: 0.9643, test_f1: 0.5329
 epoch: 71, train_loss: 0.8378, test_loss: 0.9677, test_f1: 0.5254
 epoch: 72, train_loss: 0.8404, test_loss: 0.9753, test_f1: 0.5185
 epoch: 73, train_loss: 0.8406, test_loss: 0.9848, test_f1: 0.5058
 epoch: 74, train_loss: 0.8437, test_loss: 0.9667, test_f1: 0.5228
 epoch: 75, train_loss: 0.8402, test_loss: 0.9703, test_f1: 0.5274
 epoch: 76, train_loss: 0.8461, test_loss: 0.9790, test_f1: 0.5165
 epoch: 77, train_loss: 0.8437, test_loss: 0.9895, test_f1: 0.5250
 epoch: 78, train_loss: 0.8377, test_loss: 0.9754, test_f1: 0.5238
 epoch: 79, train_loss: 0.8334, test_loss: 0.9601, test_f1: 0.5271
 epoch: 80, train_loss: 0.8346, test_loss: 0.9962, test_f1: 0.5075
 epoch: 81, train_loss: 0.8379, test_loss: 0.9813, test_f1: 0.5303
 epoch: 82, train_loss: 0.8316, test_loss: 0.9952, test_f1: 0.5146
 epoch: 83, train_loss: 0.8308, test_loss: 1.0024, test_f1: 0.5237
 epoch: 84, train_loss: 0.8276, test_loss: 0.9995, test_f1: 0.5180
 epoch: 85, train_loss: 0.8278, test_loss: 0.9955, test_f1: 0.5182
 epoch: 86, train_loss: 0.8278, test_loss: 0.9965, test_f1: 0.5344
 epoch: 87, train_loss: 0.8209, test_loss: 0.9763, test_f1: 0.5245
 epoch: 88, train_loss: 0.8266, test_loss: 1.0079, test_f1: 0.5243
 epoch: 89, train_loss: 0.8197, test_loss: 0.9817, test_f1: 0.5303
 epoch: 90, train_loss: 0.8144, test_loss: 1.0025, test_f1: 0.5140
 epoch: 91, train_loss: 0.8184, test_loss: 1.0083, test_f1: 0.5203
 epoch: 92, train_loss: 0.8207, test_loss: 0.9710, test_f1: 0.5266
 epoch: 93, train_loss: 0.8283, test_loss: 1.0023, test_f1: 0.5346
 epoch: 94, train_loss: 0.8255, test_loss: 1.0201, test_f1: 0.5136
 epoch: 95, train_loss: 0.8183, test_loss: 1.0068, test_f1: 0.5274
 epoch: 96, train_loss: 0.8244, test_loss: 0.9990, test_f1: 0.5179
 epoch: 97, train_loss: 0.8202, test_loss: 1.0036, test_f1: 0.5215
 epoch: 98, train_loss: 0.8238, test_loss: 1.0183, test_f1: 0.5042
 epoch: 99, train_loss: 0.8134, test_loss: 1.0348, test_f1: 0.5187
##################ITERATION #3 ****************************************
 epoch: 0, train_loss: 1.2994, test_loss: 1.2125, test_f1: 0.3584
 epoch: 1, train_loss: 1.2273, test_loss: 1.1746, test_f1: 0.4075
 epoch: 2, train_loss: 1.2088, test_loss: 1.1711, test_f1: 0.4384
 epoch: 3, train_loss: 1.1854, test_loss: 1.1452, test_f1: 0.4514
 epoch: 4, train_loss: 1.1801, test_loss: 1.1283, test_f1: 0.4550
 epoch: 5, train_loss: 1.1712, test_loss: 1.1244, test_f1: 0.4514
 epoch: 6, train_loss: 1.1484, test_loss: 1.1125, test_f1: 0.4605
 epoch: 7, train_loss: 1.1367, test_loss: 1.0923, test_f1: 0.4490
 epoch: 8, train_loss: 1.1182, test_loss: 1.0900, test_f1: 0.4568
 epoch: 9, train_loss: 1.1185, test_loss: 1.0741, test_f1: 0.4634
 epoch: 10, train_loss: 1.1061, test_loss: 1.0666, test_f1: 0.4572
 epoch: 11, train_loss: 1.1009, test_loss: 1.0639, test_f1: 0.4609
 epoch: 12, train_loss: 1.0947, test_loss: 1.0512, test_f1: 0.4727
 epoch: 13, train_loss: 1.0795, test_loss: 1.0576, test_f1: 0.4572
 epoch: 14, train_loss: 1.0769, test_loss: 1.0330, test_f1: 0.4744
 epoch: 15, train_loss: 1.0666, test_loss: 1.0242, test_f1: 0.4820
 epoch: 16, train_loss: 1.0686, test_loss: 1.0229, test_f1: 0.4634
 epoch: 17, train_loss: 1.0507, test_loss: 1.0283, test_f1: 0.4682
 epoch: 18, train_loss: 1.0409, test_loss: 1.0096, test_f1: 0.4695
 epoch: 19, train_loss: 1.0390, test_loss: 1.0161, test_f1: 0.4624
 epoch: 20, train_loss: 1.0355, test_loss: 1.0065, test_f1: 0.4526
 epoch: 21, train_loss: 1.0209, test_loss: 0.9962, test_f1: 0.4669
 epoch: 22, train_loss: 1.0161, test_loss: 1.0004, test_f1: 0.4809
 epoch: 23, train_loss: 1.0187, test_loss: 0.9965, test_f1: 0.4702
 epoch: 24, train_loss: 1.0177, test_loss: 0.9830, test_f1: 0.4714
 epoch: 25, train_loss: 1.0033, test_loss: 0.9728, test_f1: 0.4665
 epoch: 26, train_loss: 1.0050, test_loss: 0.9675, test_f1: 0.4834
 epoch: 27, train_loss: 1.0090, test_loss: 0.9661, test_f1: 0.4946
 epoch: 28, train_loss: 1.0036, test_loss: 0.9721, test_f1: 0.4981
 epoch: 29, train_loss: 0.9972, test_loss: 0.9706, test_f1: 0.4826
 epoch: 30, train_loss: 0.9829, test_loss: 0.9740, test_f1: 0.4817
 epoch: 31, train_loss: 0.9804, test_loss: 0.9807, test_f1: 0.4846
 epoch: 32, train_loss: 0.9715, test_loss: 0.9709, test_f1: 0.4825
 epoch: 33, train_loss: 0.9755, test_loss: 0.9830, test_f1: 0.4913
 epoch: 34, train_loss: 0.9637, test_loss: 0.9692, test_f1: 0.4995
 epoch: 35, train_loss: 0.9646, test_loss: 0.9622, test_f1: 0.5007
 epoch: 36, train_loss: 0.9673, test_loss: 0.9680, test_f1: 0.5042
 epoch: 37, train_loss: 0.9624, test_loss: 0.9795, test_f1: 0.4959
 epoch: 38, train_loss: 0.9581, test_loss: 0.9762, test_f1: 0.5091
 epoch: 39, train_loss: 0.9546, test_loss: 1.0036, test_f1: 0.4984
 epoch: 40, train_loss: 0.9468, test_loss: 0.9812, test_f1: 0.5130
 epoch: 41, train_loss: 0.9502, test_loss: 0.9984, test_f1: 0.5090
 epoch: 42, train_loss: 0.9412, test_loss: 0.9690, test_f1: 0.5134
 epoch: 43, train_loss: 0.9474, test_loss: 0.9910, test_f1: 0.5093
 epoch: 44, train_loss: 0.9352, test_loss: 0.9685, test_f1: 0.5243
 epoch: 45, train_loss: 0.9199, test_loss: 0.9714, test_f1: 0.5067
 epoch: 46, train_loss: 0.9158, test_loss: 0.9721, test_f1: 0.5137
 epoch: 47, train_loss: 0.9234, test_loss: 0.9963, test_f1: 0.5141
 epoch: 48, train_loss: 0.9133, test_loss: 0.9696, test_f1: 0.5240
 epoch: 49, train_loss: 0.9197, test_loss: 0.9742, test_f1: 0.5014
 epoch: 50, train_loss: 0.9010, test_loss: 0.9690, test_f1: 0.5360
 epoch: 51, train_loss: 0.9067, test_loss: 0.9655, test_f1: 0.5181
 epoch: 52, train_loss: 0.9047, test_loss: 0.9851, test_f1: 0.5094
 epoch: 53, train_loss: 0.8994, test_loss: 0.9878, test_f1: 0.5287
 epoch: 54, train_loss: 0.9013, test_loss: 0.9883, test_f1: 0.5136
 epoch: 55, train_loss: 0.9034, test_loss: 0.9862, test_f1: 0.5199
 epoch: 56, train_loss: 0.8825, test_loss: 0.9722, test_f1: 0.5299
 epoch: 57, train_loss: 0.9000, test_loss: 0.9920, test_f1: 0.5132
 epoch: 58, train_loss: 0.8983, test_loss: 0.9704, test_f1: 0.5226
 epoch: 59, train_loss: 0.8963, test_loss: 0.9900, test_f1: 0.5260
 epoch: 60, train_loss: 0.8957, test_loss: 0.9945, test_f1: 0.5314
 epoch: 61, train_loss: 0.8838, test_loss: 0.9747, test_f1: 0.5255
 epoch: 62, train_loss: 0.8927, test_loss: 1.0008, test_f1: 0.5280
 epoch: 63, train_loss: 0.8975, test_loss: 0.9795, test_f1: 0.5247
 epoch: 64, train_loss: 0.8899, test_loss: 0.9973, test_f1: 0.5232
 epoch: 65, train_loss: 0.8962, test_loss: 0.9978, test_f1: 0.5139
 epoch: 66, train_loss: 0.8859, test_loss: 0.9852, test_f1: 0.5350
 epoch: 67, train_loss: 0.8873, test_loss: 0.9737, test_f1: 0.5387
 epoch: 68, train_loss: 0.8806, test_loss: 0.9816, test_f1: 0.5366
 epoch: 69, train_loss: 0.8853, test_loss: 0.9751, test_f1: 0.5299
 epoch: 70, train_loss: 0.8811, test_loss: 0.9814, test_f1: 0.5301
 epoch: 71, train_loss: 0.8840, test_loss: 0.9835, test_f1: 0.5254
 epoch: 72, train_loss: 0.8690, test_loss: 0.9937, test_f1: 0.5380
 epoch: 73, train_loss: 0.8826, test_loss: 0.9924, test_f1: 0.5297
 epoch: 74, train_loss: 0.8605, test_loss: 0.9993, test_f1: 0.5300
 epoch: 75, train_loss: 0.8713, test_loss: 1.0130, test_f1: 0.5133
 epoch: 76, train_loss: 0.8663, test_loss: 1.0078, test_f1: 0.5266
 epoch: 77, train_loss: 0.8628, test_loss: 0.9911, test_f1: 0.5480
 epoch: 78, train_loss: 0.8667, test_loss: 0.9918, test_f1: 0.5194
 epoch: 79, train_loss: 0.8626, test_loss: 0.9850, test_f1: 0.5479
 epoch: 80, train_loss: 0.8748, test_loss: 1.0082, test_f1: 0.5363
 epoch: 81, train_loss: 0.8692, test_loss: 0.9944, test_f1: 0.5383
 epoch: 82, train_loss: 0.8668, test_loss: 0.9959, test_f1: 0.5392
 epoch: 83, train_loss: 0.8688, test_loss: 0.9946, test_f1: 0.5205
 epoch: 84, train_loss: 0.8521, test_loss: 0.9631, test_f1: 0.5525
 epoch: 85, train_loss: 0.8585, test_loss: 1.0053, test_f1: 0.5419
 epoch: 86, train_loss: 0.8466, test_loss: 0.9948, test_f1: 0.5430
 epoch: 87, train_loss: 0.8622, test_loss: 0.9921, test_f1: 0.5271
 epoch: 88, train_loss: 0.8603, test_loss: 1.0000, test_f1: 0.5353
 epoch: 89, train_loss: 0.8441, test_loss: 0.9883, test_f1: 0.5262
 epoch: 90, train_loss: 0.8517, test_loss: 1.0052, test_f1: 0.5321
 epoch: 91, train_loss: 0.8436, test_loss: 1.0021, test_f1: 0.5314
 epoch: 92, train_loss: 0.8448, test_loss: 0.9840, test_f1: 0.5516
 epoch: 93, train_loss: 0.8479, test_loss: 0.9699, test_f1: 0.5558
 epoch: 94, train_loss: 0.8429, test_loss: 0.9968, test_f1: 0.5480
 epoch: 95, train_loss: 0.8427, test_loss: 1.0001, test_f1: 0.5441
 epoch: 96, train_loss: 0.8373, test_loss: 1.0084, test_f1: 0.5277
 epoch: 97, train_loss: 0.8370, test_loss: 1.0019, test_f1: 0.5517
 epoch: 98, train_loss: 0.8435, test_loss: 1.0157, test_f1: 0.5284
 epoch: 99, train_loss: 0.8337, test_loss: 1.0017, test_f1: 0.5391
##################ITERATION #4 ****************************************
 epoch: 0, train_loss: 1.2801, test_loss: 1.1953, test_f1: 0.3733
 epoch: 1, train_loss: 1.2284, test_loss: 1.1764, test_f1: 0.4066
 epoch: 2, train_loss: 1.1987, test_loss: 1.1503, test_f1: 0.4117
 epoch: 3, train_loss: 1.1886, test_loss: 1.1293, test_f1: 0.4464
 epoch: 4, train_loss: 1.1776, test_loss: 1.1185, test_f1: 0.4363
 epoch: 5, train_loss: 1.1613, test_loss: 1.1010, test_f1: 0.4492
 epoch: 6, train_loss: 1.1533, test_loss: 1.0877, test_f1: 0.4516
 epoch: 7, train_loss: 1.1357, test_loss: 1.0811, test_f1: 0.4482
 epoch: 8, train_loss: 1.1199, test_loss: 1.0640, test_f1: 0.4610
 epoch: 9, train_loss: 1.1096, test_loss: 1.0505, test_f1: 0.4702
 epoch: 10, train_loss: 1.1077, test_loss: 1.0307, test_f1: 0.4752
 epoch: 11, train_loss: 1.0845, test_loss: 1.0355, test_f1: 0.4622
 epoch: 12, train_loss: 1.0778, test_loss: 1.0394, test_f1: 0.4544
 epoch: 13, train_loss: 1.0758, test_loss: 1.0197, test_f1: 0.4619
 epoch: 14, train_loss: 1.0651, test_loss: 1.0121, test_f1: 0.4643
 epoch: 15, train_loss: 1.0628, test_loss: 1.0035, test_f1: 0.4633
 epoch: 16, train_loss: 1.0471, test_loss: 1.0003, test_f1: 0.4825
 epoch: 17, train_loss: 1.0372, test_loss: 1.0014, test_f1: 0.4654
 epoch: 18, train_loss: 1.0403, test_loss: 0.9953, test_f1: 0.4987
 epoch: 19, train_loss: 1.0326, test_loss: 0.9863, test_f1: 0.4695
 epoch: 20, train_loss: 1.0268, test_loss: 0.9788, test_f1: 0.4716
 epoch: 21, train_loss: 1.0180, test_loss: 0.9883, test_f1: 0.4776
 epoch: 22, train_loss: 1.0136, test_loss: 0.9859, test_f1: 0.4742
 epoch: 23, train_loss: 0.9977, test_loss: 0.9685, test_f1: 0.4925
 epoch: 24, train_loss: 1.0024, test_loss: 0.9622, test_f1: 0.4988
 epoch: 25, train_loss: 1.0042, test_loss: 0.9591, test_f1: 0.4981
 epoch: 26, train_loss: 0.9860, test_loss: 0.9592, test_f1: 0.4952
 epoch: 27, train_loss: 0.9953, test_loss: 0.9663, test_f1: 0.4904
 epoch: 28, train_loss: 0.9851, test_loss: 0.9743, test_f1: 0.4944
 epoch: 29, train_loss: 0.9778, test_loss: 0.9810, test_f1: 0.4880
 epoch: 30, train_loss: 0.9748, test_loss: 0.9533, test_f1: 0.4905
 epoch: 31, train_loss: 0.9733, test_loss: 0.9477, test_f1: 0.4984
 epoch: 32, train_loss: 0.9767, test_loss: 0.9896, test_f1: 0.4931
 epoch: 33, train_loss: 0.9624, test_loss: 0.9608, test_f1: 0.5053
 epoch: 34, train_loss: 0.9604, test_loss: 0.9700, test_f1: 0.5027
 epoch: 35, train_loss: 0.9656, test_loss: 0.9593, test_f1: 0.5012
 epoch: 36, train_loss: 0.9588, test_loss: 0.9684, test_f1: 0.4981
 epoch: 37, train_loss: 0.9563, test_loss: 0.9875, test_f1: 0.4995
 epoch: 38, train_loss: 0.9556, test_loss: 1.0032, test_f1: 0.4964
 epoch: 39, train_loss: 0.9530, test_loss: 0.9708, test_f1: 0.5082
 epoch: 40, train_loss: 0.9486, test_loss: 0.9403, test_f1: 0.5059
 epoch: 41, train_loss: 0.9415, test_loss: 0.9519, test_f1: 0.5000
 epoch: 42, train_loss: 0.9422, test_loss: 0.9420, test_f1: 0.5125
 epoch: 43, train_loss: 0.9300, test_loss: 0.9755, test_f1: 0.4977
 epoch: 44, train_loss: 0.9446, test_loss: 0.9620, test_f1: 0.5084
 epoch: 45, train_loss: 0.9370, test_loss: 0.9622, test_f1: 0.5074
 epoch: 46, train_loss: 0.9296, test_loss: 0.9735, test_f1: 0.5010
 epoch: 47, train_loss: 0.9290, test_loss: 0.9548, test_f1: 0.4932
 epoch: 48, train_loss: 0.9348, test_loss: 0.9762, test_f1: 0.5124
 epoch: 49, train_loss: 0.9282, test_loss: 0.9415, test_f1: 0.5167
 epoch: 50, train_loss: 0.9200, test_loss: 0.9811, test_f1: 0.5004
 epoch: 51, train_loss: 0.9249, test_loss: 0.9666, test_f1: 0.5109
 epoch: 52, train_loss: 0.9332, test_loss: 0.9691, test_f1: 0.5093
 epoch: 53, train_loss: 0.9033, test_loss: 0.9816, test_f1: 0.5103
 epoch: 54, train_loss: 0.9152, test_loss: 0.9754, test_f1: 0.5079
 epoch: 55, train_loss: 0.9013, test_loss: 0.9469, test_f1: 0.5133
 epoch: 56, train_loss: 0.9014, test_loss: 0.9844, test_f1: 0.5070
 epoch: 57, train_loss: 0.8999, test_loss: 0.9600, test_f1: 0.5007
 epoch: 58, train_loss: 0.9071, test_loss: 0.9731, test_f1: 0.5130
 epoch: 59, train_loss: 0.9047, test_loss: 0.9791, test_f1: 0.5167
 epoch: 60, train_loss: 0.8970, test_loss: 0.9752, test_f1: 0.5055
 epoch: 61, train_loss: 0.8983, test_loss: 0.9676, test_f1: 0.5076
 epoch: 62, train_loss: 0.9023, test_loss: 0.9991, test_f1: 0.5263
 epoch: 63, train_loss: 0.9025, test_loss: 0.9875, test_f1: 0.5046
 epoch: 64, train_loss: 0.9024, test_loss: 0.9719, test_f1: 0.5131
 epoch: 65, train_loss: 0.8971, test_loss: 0.9771, test_f1: 0.5144
 epoch: 66, train_loss: 0.9023, test_loss: 0.9738, test_f1: 0.5068
 epoch: 67, train_loss: 0.9024, test_loss: 0.9576, test_f1: 0.5115
 epoch: 68, train_loss: 0.8957, test_loss: 0.9672, test_f1: 0.5240
 epoch: 69, train_loss: 0.8953, test_loss: 0.9957, test_f1: 0.4969
 epoch: 70, train_loss: 0.8882, test_loss: 0.9658, test_f1: 0.5136
 epoch: 71, train_loss: 0.8834, test_loss: 0.9814, test_f1: 0.5103
 epoch: 72, train_loss: 0.8924, test_loss: 0.9840, test_f1: 0.5117
 epoch: 73, train_loss: 0.8901, test_loss: 0.9959, test_f1: 0.5136
 epoch: 74, train_loss: 0.8862, test_loss: 0.9886, test_f1: 0.5095
 epoch: 75, train_loss: 0.8786, test_loss: 0.9975, test_f1: 0.5056
 epoch: 76, train_loss: 0.8779, test_loss: 0.9749, test_f1: 0.5119
 epoch: 77, train_loss: 0.8784, test_loss: 0.9783, test_f1: 0.5174
 epoch: 78, train_loss: 0.8766, test_loss: 1.0009, test_f1: 0.5155
 epoch: 79, train_loss: 0.8767, test_loss: 0.9977, test_f1: 0.5131
 epoch: 80, train_loss: 0.8775, test_loss: 0.9886, test_f1: 0.5106
 epoch: 81, train_loss: 0.8820, test_loss: 0.9667, test_f1: 0.5148
 epoch: 82, train_loss: 0.8834, test_loss: 1.0024, test_f1: 0.5071
 epoch: 83, train_loss: 0.8899, test_loss: 1.0058, test_f1: 0.5193
 epoch: 84, train_loss: 0.8820, test_loss: 0.9955, test_f1: 0.5233
 epoch: 85, train_loss: 0.8731, test_loss: 0.9846, test_f1: 0.5183
 epoch: 86, train_loss: 0.8856, test_loss: 0.9884, test_f1: 0.5338
 epoch: 87, train_loss: 0.8736, test_loss: 1.0319, test_f1: 0.5294
 epoch: 88, train_loss: 0.8746, test_loss: 1.0065, test_f1: 0.5240
 epoch: 89, train_loss: 0.8609, test_loss: 1.0144, test_f1: 0.5210
 epoch: 90, train_loss: 0.8716, test_loss: 1.0085, test_f1: 0.5136
 epoch: 91, train_loss: 0.8660, test_loss: 1.0224, test_f1: 0.5216
 epoch: 92, train_loss: 0.8718, test_loss: 1.0302, test_f1: 0.5256
 epoch: 93, train_loss: 0.8659, test_loss: 1.0441, test_f1: 0.5067
 epoch: 94, train_loss: 0.8673, test_loss: 0.9908, test_f1: 0.5256
 epoch: 95, train_loss: 0.8569, test_loss: 1.0018, test_f1: 0.5237
 epoch: 96, train_loss: 0.8539, test_loss: 1.0175, test_f1: 0.5160
 epoch: 97, train_loss: 0.8564, test_loss: 1.0442, test_f1: 0.5231
 epoch: 98, train_loss: 0.8512, test_loss: 0.9999, test_f1: 0.5215
 epoch: 99, train_loss: 0.8753, test_loss: 1.0070, test_f1: 0.5305
##################ITERATION #5 ****************************************
 epoch: 0, train_loss: 1.2989, test_loss: 1.1847, test_f1: 0.3761
 epoch: 1, train_loss: 1.2127, test_loss: 1.1482, test_f1: 0.4465
 epoch: 2, train_loss: 1.1908, test_loss: 1.1225, test_f1: 0.4521
 epoch: 3, train_loss: 1.1774, test_loss: 1.1140, test_f1: 0.4677
 epoch: 4, train_loss: 1.1513, test_loss: 1.1050, test_f1: 0.4432
 epoch: 5, train_loss: 1.1414, test_loss: 1.0843, test_f1: 0.4664
 epoch: 6, train_loss: 1.1272, test_loss: 1.0659, test_f1: 0.4668
 epoch: 7, train_loss: 1.1128, test_loss: 1.0549, test_f1: 0.4557
 epoch: 8, train_loss: 1.1033, test_loss: 1.0580, test_f1: 0.4827
 epoch: 9, train_loss: 1.1007, test_loss: 1.0374, test_f1: 0.4821
 epoch: 10, train_loss: 1.0959, test_loss: 1.0339, test_f1: 0.4785
 epoch: 11, train_loss: 1.0906, test_loss: 1.0222, test_f1: 0.4763
 epoch: 12, train_loss: 1.0775, test_loss: 1.0256, test_f1: 0.4595
 epoch: 13, train_loss: 1.0716, test_loss: 1.0106, test_f1: 0.4733
 epoch: 14, train_loss: 1.0517, test_loss: 1.0114, test_f1: 0.4729
 epoch: 15, train_loss: 1.0577, test_loss: 1.0137, test_f1: 0.4661
 epoch: 16, train_loss: 1.0479, test_loss: 1.0032, test_f1: 0.4652
 epoch: 17, train_loss: 1.0385, test_loss: 0.9913, test_f1: 0.4793
 epoch: 18, train_loss: 1.0308, test_loss: 0.9987, test_f1: 0.4781
 epoch: 19, train_loss: 1.0379, test_loss: 0.9814, test_f1: 0.4781
 epoch: 20, train_loss: 1.0302, test_loss: 0.9817, test_f1: 0.4803
 epoch: 21, train_loss: 1.0238, test_loss: 0.9868, test_f1: 0.4770
 epoch: 22, train_loss: 1.0202, test_loss: 0.9785, test_f1: 0.4764
 epoch: 23, train_loss: 1.0230, test_loss: 0.9760, test_f1: 0.4709
 epoch: 24, train_loss: 1.0201, test_loss: 0.9973, test_f1: 0.4695
 epoch: 25, train_loss: 1.0122, test_loss: 0.9701, test_f1: 0.4727
 epoch: 26, train_loss: 1.0069, test_loss: 0.9717, test_f1: 0.4775
 epoch: 27, train_loss: 0.9992, test_loss: 1.0119, test_f1: 0.4625
 epoch: 28, train_loss: 1.0109, test_loss: 1.0077, test_f1: 0.4480
 epoch: 29, train_loss: 0.9829, test_loss: 0.9668, test_f1: 0.4739
 epoch: 30, train_loss: 0.9930, test_loss: 0.9847, test_f1: 0.4489
 epoch: 31, train_loss: 0.9782, test_loss: 0.9815, test_f1: 0.4603
 epoch: 32, train_loss: 0.9879, test_loss: 0.9793, test_f1: 0.4664
 epoch: 33, train_loss: 0.9856, test_loss: 0.9778, test_f1: 0.4632
 epoch: 34, train_loss: 0.9803, test_loss: 0.9717, test_f1: 0.4576
 epoch: 35, train_loss: 0.9841, test_loss: 0.9690, test_f1: 0.4719
 epoch: 36, train_loss: 0.9683, test_loss: 0.9576, test_f1: 0.4910
 epoch: 37, train_loss: 0.9718, test_loss: 0.9527, test_f1: 0.4940
 epoch: 38, train_loss: 0.9577, test_loss: 0.9647, test_f1: 0.4745
 epoch: 39, train_loss: 0.9525, test_loss: 0.9534, test_f1: 0.4896
 epoch: 40, train_loss: 0.9635, test_loss: 0.9772, test_f1: 0.4695
 epoch: 41, train_loss: 0.9582, test_loss: 0.9598, test_f1: 0.4801
 epoch: 42, train_loss: 0.9428, test_loss: 0.9622, test_f1: 0.4791
 epoch: 43, train_loss: 0.9436, test_loss: 0.9620, test_f1: 0.4795
 epoch: 44, train_loss: 0.9453, test_loss: 0.9405, test_f1: 0.5017
 epoch: 45, train_loss: 0.9470, test_loss: 0.9774, test_f1: 0.4856
 epoch: 46, train_loss: 0.9364, test_loss: 0.9534, test_f1: 0.4830
 epoch: 47, train_loss: 0.9220, test_loss: 0.9467, test_f1: 0.4942
 epoch: 48, train_loss: 0.9374, test_loss: 0.9770, test_f1: 0.4554
 epoch: 49, train_loss: 0.9311, test_loss: 0.9527, test_f1: 0.4782
 epoch: 50, train_loss: 0.9231, test_loss: 0.9481, test_f1: 0.4687
 epoch: 51, train_loss: 0.9143, test_loss: 0.9465, test_f1: 0.4713
 epoch: 52, train_loss: 0.9064, test_loss: 0.9504, test_f1: 0.4741
 epoch: 53, train_loss: 0.9122, test_loss: 0.9543, test_f1: 0.4915
 epoch: 54, train_loss: 0.9056, test_loss: 0.9484, test_f1: 0.4934
 epoch: 55, train_loss: 0.9083, test_loss: 0.9524, test_f1: 0.4966
 epoch: 56, train_loss: 0.9108, test_loss: 0.9674, test_f1: 0.4859
 epoch: 57, train_loss: 0.9051, test_loss: 0.9679, test_f1: 0.4648
 epoch: 58, train_loss: 0.9084, test_loss: 0.9485, test_f1: 0.4801
 epoch: 59, train_loss: 0.9013, test_loss: 0.9529, test_f1: 0.4789
 epoch: 60, train_loss: 0.8967, test_loss: 0.9379, test_f1: 0.5029
 epoch: 61, train_loss: 0.9144, test_loss: 0.9554, test_f1: 0.4975
 epoch: 62, train_loss: 0.9047, test_loss: 0.9418, test_f1: 0.4938
 epoch: 63, train_loss: 0.8983, test_loss: 0.9503, test_f1: 0.4975
 epoch: 64, train_loss: 0.9021, test_loss: 0.9359, test_f1: 0.5040
 epoch: 65, train_loss: 0.9048, test_loss: 0.9469, test_f1: 0.4930
 epoch: 66, train_loss: 0.8905, test_loss: 0.9428, test_f1: 0.4926
 epoch: 67, train_loss: 0.9006, test_loss: 0.9675, test_f1: 0.4931
 epoch: 68, train_loss: 0.9019, test_loss: 0.9426, test_f1: 0.4968
 epoch: 69, train_loss: 0.8938, test_loss: 0.9280, test_f1: 0.5032
 epoch: 70, train_loss: 0.8982, test_loss: 0.9556, test_f1: 0.4837
 epoch: 71, train_loss: 0.8929, test_loss: 0.9523, test_f1: 0.4954
 epoch: 72, train_loss: 0.8979, test_loss: 0.9330, test_f1: 0.5020
 epoch: 73, train_loss: 0.8944, test_loss: 0.9481, test_f1: 0.4947
 epoch: 74, train_loss: 0.8889, test_loss: 0.9437, test_f1: 0.5133
 epoch: 75, train_loss: 0.8844, test_loss: 0.9432, test_f1: 0.5059
 epoch: 76, train_loss: 0.8826, test_loss: 0.9388, test_f1: 0.5003
 epoch: 77, train_loss: 0.8839, test_loss: 0.9702, test_f1: 0.4849
 epoch: 78, train_loss: 0.8888, test_loss: 0.9368, test_f1: 0.4921
 epoch: 79, train_loss: 0.8761, test_loss: 0.9375, test_f1: 0.5033
 epoch: 80, train_loss: 0.8738, test_loss: 0.9540, test_f1: 0.4966
 epoch: 81, train_loss: 0.8740, test_loss: 1.0096, test_f1: 0.4865
 epoch: 82, train_loss: 0.8706, test_loss: 0.9891, test_f1: 0.4933
 epoch: 83, train_loss: 0.8736, test_loss: 0.9924, test_f1: 0.4777
 epoch: 84, train_loss: 0.8752, test_loss: 0.9332, test_f1: 0.5036
 epoch: 85, train_loss: 0.8697, test_loss: 0.9632, test_f1: 0.5044
 epoch: 86, train_loss: 0.8761, test_loss: 0.9544, test_f1: 0.4996
 epoch: 87, train_loss: 0.8837, test_loss: 0.9468, test_f1: 0.4958
 epoch: 88, train_loss: 0.8745, test_loss: 0.9442, test_f1: 0.5087
 epoch: 89, train_loss: 0.8672, test_loss: 0.9798, test_f1: 0.5045
 epoch: 90, train_loss: 0.8742, test_loss: 0.9665, test_f1: 0.4944
 epoch: 91, train_loss: 0.8654, test_loss: 0.9751, test_f1: 0.4907
 epoch: 92, train_loss: 0.8590, test_loss: 0.9524, test_f1: 0.5014
 epoch: 93, train_loss: 0.8743, test_loss: 0.9778, test_f1: 0.5011
 epoch: 94, train_loss: 0.8615, test_loss: 0.9652, test_f1: 0.5057
 epoch: 95, train_loss: 0.8737, test_loss: 0.9503, test_f1: 0.5074
 epoch: 96, train_loss: 0.8680, test_loss: 0.9581, test_f1: 0.5192
 epoch: 97, train_loss: 0.8720, test_loss: 0.9730, test_f1: 0.5000
 epoch: 98, train_loss: 0.8646, test_loss: 0.9680, test_f1: 0.5167
 epoch: 99, train_loss: 0.8535, test_loss: 0.9647, test_f1: 0.5003
##################ITERATION #6 ****************************************
 epoch: 0, train_loss: 1.3315, test_loss: 1.1822, test_f1: 0.4022
 epoch: 1, train_loss: 1.2338, test_loss: 1.1603, test_f1: 0.4660
 epoch: 2, train_loss: 1.2083, test_loss: 1.1473, test_f1: 0.4542
 epoch: 3, train_loss: 1.1989, test_loss: 1.1282, test_f1: 0.4623
 epoch: 4, train_loss: 1.1863, test_loss: 1.1137, test_f1: 0.4513
 epoch: 5, train_loss: 1.1635, test_loss: 1.1054, test_f1: 0.4424
 epoch: 6, train_loss: 1.1457, test_loss: 1.0985, test_f1: 0.4439
 epoch: 7, train_loss: 1.1307, test_loss: 1.0873, test_f1: 0.4498
 epoch: 8, train_loss: 1.1317, test_loss: 1.0764, test_f1: 0.4508
 epoch: 9, train_loss: 1.1211, test_loss: 1.0787, test_f1: 0.4518
 epoch: 10, train_loss: 1.1182, test_loss: 1.0672, test_f1: 0.4432
 epoch: 11, train_loss: 1.1030, test_loss: 1.0631, test_f1: 0.4485
 epoch: 12, train_loss: 1.1047, test_loss: 1.0617, test_f1: 0.4764
 epoch: 13, train_loss: 1.0817, test_loss: 1.0515, test_f1: 0.4501
 epoch: 14, train_loss: 1.0859, test_loss: 1.0471, test_f1: 0.4595
 epoch: 15, train_loss: 1.0741, test_loss: 1.0334, test_f1: 0.4501
 epoch: 16, train_loss: 1.0685, test_loss: 1.0333, test_f1: 0.4447
 epoch: 17, train_loss: 1.0655, test_loss: 1.0151, test_f1: 0.4563
 epoch: 18, train_loss: 1.0628, test_loss: 1.0206, test_f1: 0.4500
 epoch: 19, train_loss: 1.0495, test_loss: 1.0168, test_f1: 0.4638
 epoch: 20, train_loss: 1.0520, test_loss: 1.0157, test_f1: 0.4508
 epoch: 21, train_loss: 1.0426, test_loss: 1.0003, test_f1: 0.4572
 epoch: 22, train_loss: 1.0320, test_loss: 1.0053, test_f1: 0.4589
 epoch: 23, train_loss: 1.0307, test_loss: 0.9966, test_f1: 0.4581
 epoch: 24, train_loss: 1.0330, test_loss: 0.9922, test_f1: 0.4507
 epoch: 25, train_loss: 1.0132, test_loss: 0.9931, test_f1: 0.4637
 epoch: 26, train_loss: 1.0214, test_loss: 0.9841, test_f1: 0.4678
 epoch: 27, train_loss: 1.0076, test_loss: 0.9976, test_f1: 0.4598
 epoch: 28, train_loss: 1.0072, test_loss: 0.9798, test_f1: 0.4550
 epoch: 29, train_loss: 1.0037, test_loss: 0.9813, test_f1: 0.4823
 epoch: 30, train_loss: 0.9985, test_loss: 0.9815, test_f1: 0.4803
 epoch: 31, train_loss: 0.9885, test_loss: 0.9828, test_f1: 0.4778
 epoch: 32, train_loss: 0.9864, test_loss: 0.9860, test_f1: 0.4527
 epoch: 33, train_loss: 0.9787, test_loss: 0.9793, test_f1: 0.4720
 epoch: 34, train_loss: 0.9857, test_loss: 0.9944, test_f1: 0.4543
 epoch: 35, train_loss: 0.9759, test_loss: 0.9982, test_f1: 0.4570
 epoch: 36, train_loss: 0.9820, test_loss: 0.9972, test_f1: 0.4656
 epoch: 37, train_loss: 0.9647, test_loss: 0.9952, test_f1: 0.4493
 epoch: 38, train_loss: 0.9647, test_loss: 0.9839, test_f1: 0.4680
 epoch: 39, train_loss: 0.9618, test_loss: 0.9948, test_f1: 0.4664
 epoch: 40, train_loss: 0.9570, test_loss: 0.9930, test_f1: 0.4668
 epoch: 41, train_loss: 0.9556, test_loss: 0.9962, test_f1: 0.4776
 epoch: 42, train_loss: 0.9511, test_loss: 0.9871, test_f1: 0.4661
 epoch: 43, train_loss: 0.9484, test_loss: 0.9831, test_f1: 0.4813
 epoch: 44, train_loss: 0.9372, test_loss: 0.9855, test_f1: 0.4733
 epoch: 45, train_loss: 0.9421, test_loss: 0.9958, test_f1: 0.4620
 epoch: 46, train_loss: 0.9246, test_loss: 1.0081, test_f1: 0.4732
 epoch: 47, train_loss: 0.9356, test_loss: 0.9958, test_f1: 0.4601
 epoch: 48, train_loss: 0.9242, test_loss: 0.9948, test_f1: 0.4788
 epoch: 49, train_loss: 0.9224, test_loss: 1.0031, test_f1: 0.4753
 epoch: 50, train_loss: 0.9183, test_loss: 1.0060, test_f1: 0.4854
 epoch: 51, train_loss: 0.9178, test_loss: 1.0000, test_f1: 0.4896
 epoch: 52, train_loss: 0.9083, test_loss: 1.0017, test_f1: 0.4740
 epoch: 53, train_loss: 0.9207, test_loss: 1.0072, test_f1: 0.4720
 epoch: 54, train_loss: 0.9038, test_loss: 1.0115, test_f1: 0.4577
 epoch: 55, train_loss: 0.9133, test_loss: 0.9985, test_f1: 0.4754
 epoch: 56, train_loss: 0.9018, test_loss: 0.9950, test_f1: 0.4701
 epoch: 57, train_loss: 0.8996, test_loss: 0.9985, test_f1: 0.4727
 epoch: 58, train_loss: 0.9086, test_loss: 0.9961, test_f1: 0.4713
 epoch: 59, train_loss: 0.8949, test_loss: 1.0082, test_f1: 0.4713
 epoch: 60, train_loss: 0.9035, test_loss: 1.0022, test_f1: 0.4759
 epoch: 61, train_loss: 0.8969, test_loss: 1.0093, test_f1: 0.4655
 epoch: 62, train_loss: 0.8951, test_loss: 1.0242, test_f1: 0.4720
 epoch: 63, train_loss: 0.8824, test_loss: 1.0472, test_f1: 0.4481
 epoch: 64, train_loss: 0.8958, test_loss: 1.0277, test_f1: 0.4531
 epoch: 65, train_loss: 0.8904, test_loss: 1.0099, test_f1: 0.4864
 epoch: 66, train_loss: 0.8865, test_loss: 1.0080, test_f1: 0.4903
 epoch: 67, train_loss: 0.9007, test_loss: 1.0303, test_f1: 0.4652
 epoch: 68, train_loss: 0.8944, test_loss: 1.0226, test_f1: 0.4663
 epoch: 69, train_loss: 0.8899, test_loss: 1.0042, test_f1: 0.4783
 epoch: 70, train_loss: 0.8946, test_loss: 1.0311, test_f1: 0.4621
 epoch: 71, train_loss: 0.8872, test_loss: 1.0111, test_f1: 0.4778
 epoch: 72, train_loss: 0.8872, test_loss: 1.0156, test_f1: 0.4801
 epoch: 73, train_loss: 0.8795, test_loss: 1.0344, test_f1: 0.4570
 epoch: 74, train_loss: 0.8793, test_loss: 1.0366, test_f1: 0.4561
 epoch: 75, train_loss: 0.8793, test_loss: 1.0135, test_f1: 0.5013
 epoch: 76, train_loss: 0.8729, test_loss: 1.0357, test_f1: 0.4648
 epoch: 77, train_loss: 0.8675, test_loss: 1.0119, test_f1: 0.4735
 epoch: 78, train_loss: 0.8801, test_loss: 1.0694, test_f1: 0.4578
 epoch: 79, train_loss: 0.8678, test_loss: 1.0247, test_f1: 0.4804
 epoch: 80, train_loss: 0.8636, test_loss: 1.0368, test_f1: 0.4705
 epoch: 81, train_loss: 0.8657, test_loss: 1.0324, test_f1: 0.4610
 epoch: 82, train_loss: 0.8666, test_loss: 1.0135, test_f1: 0.4819
 epoch: 83, train_loss: 0.8664, test_loss: 1.0445, test_f1: 0.4694
 epoch: 84, train_loss: 0.8793, test_loss: 1.0112, test_f1: 0.4959
 epoch: 85, train_loss: 0.8736, test_loss: 1.0314, test_f1: 0.4802
 epoch: 86, train_loss: 0.8526, test_loss: 1.0191, test_f1: 0.4771
 epoch: 87, train_loss: 0.8722, test_loss: 1.0449, test_f1: 0.4696
 epoch: 88, train_loss: 0.8695, test_loss: 1.0513, test_f1: 0.4517
 epoch: 89, train_loss: 0.8744, test_loss: 1.0296, test_f1: 0.4677
 epoch: 90, train_loss: 0.8571, test_loss: 1.0576, test_f1: 0.4614
 epoch: 91, train_loss: 0.8547, test_loss: 1.0538, test_f1: 0.4738
 epoch: 92, train_loss: 0.8601, test_loss: 1.0401, test_f1: 0.4769
 epoch: 93, train_loss: 0.8664, test_loss: 1.0315, test_f1: 0.4676
 epoch: 94, train_loss: 0.8564, test_loss: 1.0234, test_f1: 0.4726
 epoch: 95, train_loss: 0.8504, test_loss: 1.0750, test_f1: 0.4443
 epoch: 96, train_loss: 0.8487, test_loss: 1.0471, test_f1: 0.4874
 epoch: 97, train_loss: 0.8493, test_loss: 1.0960, test_f1: 0.4610
 epoch: 98, train_loss: 0.8588, test_loss: 1.0674, test_f1: 0.4621
 epoch: 99, train_loss: 0.8498, test_loss: 1.0256, test_f1: 0.4825
##################ITERATION #7 ****************************************
 epoch: 0, train_loss: 1.3294, test_loss: 1.2090, test_f1: 0.4024
 epoch: 1, train_loss: 1.2524, test_loss: 1.1862, test_f1: 0.4018
 epoch: 2, train_loss: 1.2311, test_loss: 1.1726, test_f1: 0.3753
 epoch: 3, train_loss: 1.2298, test_loss: 1.1617, test_f1: 0.4025
 epoch: 4, train_loss: 1.2068, test_loss: 1.1424, test_f1: 0.4326
 epoch: 5, train_loss: 1.1816, test_loss: 1.1345, test_f1: 0.4137
 epoch: 6, train_loss: 1.1788, test_loss: 1.1241, test_f1: 0.4256
 epoch: 7, train_loss: 1.1684, test_loss: 1.1119, test_f1: 0.4279
 epoch: 8, train_loss: 1.1492, test_loss: 1.0965, test_f1: 0.4417
 epoch: 9, train_loss: 1.1454, test_loss: 1.0854, test_f1: 0.4297
 epoch: 10, train_loss: 1.1341, test_loss: 1.0831, test_f1: 0.4220
 epoch: 11, train_loss: 1.1336, test_loss: 1.0715, test_f1: 0.4417
 epoch: 12, train_loss: 1.1242, test_loss: 1.0613, test_f1: 0.4272
 epoch: 13, train_loss: 1.1157, test_loss: 1.0568, test_f1: 0.4253
 epoch: 14, train_loss: 1.1045, test_loss: 1.0478, test_f1: 0.4234
 epoch: 15, train_loss: 1.1012, test_loss: 1.0404, test_f1: 0.4265
 epoch: 16, train_loss: 1.0863, test_loss: 1.0389, test_f1: 0.4160
 epoch: 17, train_loss: 1.0820, test_loss: 1.0235, test_f1: 0.4474
 epoch: 18, train_loss: 1.0724, test_loss: 1.0242, test_f1: 0.4278
 epoch: 19, train_loss: 1.0675, test_loss: 1.0177, test_f1: 0.4389
 epoch: 20, train_loss: 1.0670, test_loss: 1.0107, test_f1: 0.4379
 epoch: 21, train_loss: 1.0613, test_loss: 1.0064, test_f1: 0.4433
 epoch: 22, train_loss: 1.0506, test_loss: 1.0040, test_f1: 0.4385
 epoch: 23, train_loss: 1.0421, test_loss: 0.9922, test_f1: 0.4543
 epoch: 24, train_loss: 1.0338, test_loss: 1.0051, test_f1: 0.4437
 epoch: 25, train_loss: 1.0347, test_loss: 0.9928, test_f1: 0.4513
 epoch: 26, train_loss: 1.0330, test_loss: 0.9856, test_f1: 0.4554
 epoch: 27, train_loss: 1.0304, test_loss: 0.9944, test_f1: 0.4414
 epoch: 28, train_loss: 1.0317, test_loss: 0.9882, test_f1: 0.4596
 epoch: 29, train_loss: 1.0189, test_loss: 0.9784, test_f1: 0.4664
 epoch: 30, train_loss: 1.0085, test_loss: 0.9725, test_f1: 0.4563
 epoch: 31, train_loss: 1.0047, test_loss: 0.9785, test_f1: 0.4393
 epoch: 32, train_loss: 1.0067, test_loss: 0.9939, test_f1: 0.4373
 epoch: 33, train_loss: 0.9959, test_loss: 0.9730, test_f1: 0.4515
 epoch: 34, train_loss: 0.9972, test_loss: 0.9763, test_f1: 0.4621
 epoch: 35, train_loss: 0.9882, test_loss: 0.9764, test_f1: 0.4476
 epoch: 36, train_loss: 0.9921, test_loss: 0.9698, test_f1: 0.4540
 epoch: 37, train_loss: 0.9858, test_loss: 0.9781, test_f1: 0.4462
 epoch: 38, train_loss: 0.9812, test_loss: 0.9682, test_f1: 0.4468
 epoch: 39, train_loss: 0.9817, test_loss: 0.9707, test_f1: 0.4501
 epoch: 40, train_loss: 0.9647, test_loss: 0.9635, test_f1: 0.4496
 epoch: 41, train_loss: 0.9790, test_loss: 0.9634, test_f1: 0.4453
 epoch: 42, train_loss: 0.9695, test_loss: 0.9733, test_f1: 0.4365
 epoch: 43, train_loss: 0.9549, test_loss: 0.9622, test_f1: 0.4668
 epoch: 44, train_loss: 0.9565, test_loss: 0.9502, test_f1: 0.4445
 epoch: 45, train_loss: 0.9592, test_loss: 0.9666, test_f1: 0.4537
 epoch: 46, train_loss: 0.9537, test_loss: 0.9747, test_f1: 0.4493
 epoch: 47, train_loss: 0.9465, test_loss: 0.9658, test_f1: 0.4509
 epoch: 48, train_loss: 0.9472, test_loss: 0.9696, test_f1: 0.4566
 epoch: 49, train_loss: 0.9430, test_loss: 0.9800, test_f1: 0.4662
 epoch: 50, train_loss: 0.9515, test_loss: 0.9625, test_f1: 0.4621
 epoch: 51, train_loss: 0.9373, test_loss: 0.9842, test_f1: 0.4649
 epoch: 52, train_loss: 0.9485, test_loss: 0.9604, test_f1: 0.4897
 epoch: 53, train_loss: 0.9283, test_loss: 0.9660, test_f1: 0.4780
 epoch: 54, train_loss: 0.9409, test_loss: 0.9680, test_f1: 0.4719
 epoch: 55, train_loss: 0.9304, test_loss: 0.9645, test_f1: 0.4940
 epoch: 56, train_loss: 0.9303, test_loss: 0.9477, test_f1: 0.4946
 epoch: 57, train_loss: 0.9278, test_loss: 0.9647, test_f1: 0.4948
 epoch: 58, train_loss: 0.9339, test_loss: 0.9646, test_f1: 0.5046
 epoch: 59, train_loss: 0.9198, test_loss: 0.9658, test_f1: 0.4869
 epoch: 60, train_loss: 0.9271, test_loss: 0.9691, test_f1: 0.4762
 epoch: 61, train_loss: 0.9292, test_loss: 0.9621, test_f1: 0.4697
 epoch: 62, train_loss: 0.9198, test_loss: 0.9678, test_f1: 0.4963
 epoch: 63, train_loss: 0.9185, test_loss: 0.9563, test_f1: 0.4940
 epoch: 64, train_loss: 0.9185, test_loss: 0.9683, test_f1: 0.4974
 epoch: 65, train_loss: 0.9182, test_loss: 0.9590, test_f1: 0.4834
 epoch: 66, train_loss: 0.9247, test_loss: 0.9879, test_f1: 0.4631
 epoch: 67, train_loss: 0.9206, test_loss: 0.9713, test_f1: 0.4811
 epoch: 68, train_loss: 0.9158, test_loss: 0.9678, test_f1: 0.4859
 epoch: 69, train_loss: 0.9140, test_loss: 0.9666, test_f1: 0.4811
 epoch: 70, train_loss: 0.9199, test_loss: 0.9699, test_f1: 0.4923
 epoch: 71, train_loss: 0.9047, test_loss: 0.9726, test_f1: 0.4869
 epoch: 72, train_loss: 0.9176, test_loss: 0.9583, test_f1: 0.4819
 epoch: 73, train_loss: 0.9200, test_loss: 0.9785, test_f1: 0.4938
 epoch: 74, train_loss: 0.9161, test_loss: 0.9898, test_f1: 0.4821
 epoch: 75, train_loss: 0.9129, test_loss: 0.9650, test_f1: 0.4912
 epoch: 76, train_loss: 0.8972, test_loss: 0.9826, test_f1: 0.4715
 epoch: 77, train_loss: 0.9041, test_loss: 0.9757, test_f1: 0.4808
 epoch: 78, train_loss: 0.9069, test_loss: 0.9848, test_f1: 0.4760
 epoch: 79, train_loss: 0.9000, test_loss: 0.9799, test_f1: 0.4794
 epoch: 80, train_loss: 0.9130, test_loss: 0.9712, test_f1: 0.4956
 epoch: 81, train_loss: 0.8942, test_loss: 0.9747, test_f1: 0.4822
 epoch: 82, train_loss: 0.8922, test_loss: 0.9758, test_f1: 0.4944
 epoch: 83, train_loss: 0.8942, test_loss: 0.9942, test_f1: 0.4913
 epoch: 84, train_loss: 0.8985, test_loss: 0.9608, test_f1: 0.5009
 epoch: 85, train_loss: 0.8963, test_loss: 0.9534, test_f1: 0.5088
 epoch: 86, train_loss: 0.8848, test_loss: 0.9704, test_f1: 0.4897
 epoch: 87, train_loss: 0.8956, test_loss: 0.9915, test_f1: 0.5021
 epoch: 88, train_loss: 0.8940, test_loss: 0.9751, test_f1: 0.4985
 epoch: 89, train_loss: 0.8927, test_loss: 0.9759, test_f1: 0.4903
 epoch: 90, train_loss: 0.8913, test_loss: 0.9740, test_f1: 0.4767
 epoch: 91, train_loss: 0.8919, test_loss: 0.9908, test_f1: 0.4822
 epoch: 92, train_loss: 0.8916, test_loss: 0.9877, test_f1: 0.4914
 epoch: 93, train_loss: 0.8856, test_loss: 0.9677, test_f1: 0.5040
 epoch: 94, train_loss: 0.8845, test_loss: 0.9777, test_f1: 0.4912
 epoch: 95, train_loss: 0.8982, test_loss: 0.9737, test_f1: 0.5035
 epoch: 96, train_loss: 0.8788, test_loss: 0.9945, test_f1: 0.4821
 epoch: 97, train_loss: 0.8931, test_loss: 0.9807, test_f1: 0.4816
 epoch: 98, train_loss: 0.8790, test_loss: 0.9825, test_f1: 0.4941
 epoch: 99, train_loss: 0.8801, test_loss: 0.9816, test_f1: 0.4932
##################ITERATION #8 ****************************************
 epoch: 0, train_loss: 1.3582, test_loss: 1.2038, test_f1: 0.3526
 epoch: 1, train_loss: 1.2605, test_loss: 1.1770, test_f1: 0.4061
 epoch: 2, train_loss: 1.2310, test_loss: 1.1510, test_f1: 0.3980
 epoch: 3, train_loss: 1.2099, test_loss: 1.1615, test_f1: 0.4010
 epoch: 4, train_loss: 1.2004, test_loss: 1.1321, test_f1: 0.4188
 epoch: 5, train_loss: 1.1773, test_loss: 1.1095, test_f1: 0.4376
 epoch: 6, train_loss: 1.1713, test_loss: 1.1280, test_f1: 0.4070
 epoch: 7, train_loss: 1.1579, test_loss: 1.0996, test_f1: 0.4291
 epoch: 8, train_loss: 1.1514, test_loss: 1.0733, test_f1: 0.4396
 epoch: 9, train_loss: 1.1377, test_loss: 1.0844, test_f1: 0.4403
 epoch: 10, train_loss: 1.1196, test_loss: 1.0551, test_f1: 0.4694
 epoch: 11, train_loss: 1.1118, test_loss: 1.0498, test_f1: 0.4776
 epoch: 12, train_loss: 1.1017, test_loss: 1.0315, test_f1: 0.4701
 epoch: 13, train_loss: 1.0915, test_loss: 1.0190, test_f1: 0.4765
 epoch: 14, train_loss: 1.0789, test_loss: 1.0149, test_f1: 0.4823
 epoch: 15, train_loss: 1.0817, test_loss: 0.9940, test_f1: 0.4989
 epoch: 16, train_loss: 1.0654, test_loss: 1.0019, test_f1: 0.4914
 epoch: 17, train_loss: 1.0552, test_loss: 0.9863, test_f1: 0.5006
 epoch: 18, train_loss: 1.0481, test_loss: 0.9788, test_f1: 0.4995
 epoch: 19, train_loss: 1.0495, test_loss: 0.9743, test_f1: 0.5072
 epoch: 20, train_loss: 1.0389, test_loss: 0.9621, test_f1: 0.5025
 epoch: 21, train_loss: 1.0269, test_loss: 0.9557, test_f1: 0.5001
 epoch: 22, train_loss: 1.0195, test_loss: 0.9644, test_f1: 0.5013
 epoch: 23, train_loss: 1.0204, test_loss: 0.9441, test_f1: 0.5068
 epoch: 24, train_loss: 1.0185, test_loss: 0.9553, test_f1: 0.4891
 epoch: 25, train_loss: 1.0172, test_loss: 0.9456, test_f1: 0.4905
 epoch: 26, train_loss: 1.0017, test_loss: 0.9352, test_f1: 0.5031
 epoch: 27, train_loss: 0.9950, test_loss: 0.9320, test_f1: 0.5232
 epoch: 28, train_loss: 0.9797, test_loss: 0.9367, test_f1: 0.4988
 epoch: 29, train_loss: 0.9839, test_loss: 0.9270, test_f1: 0.5148
 epoch: 30, train_loss: 0.9787, test_loss: 0.9346, test_f1: 0.5189
 epoch: 31, train_loss: 0.9697, test_loss: 0.9290, test_f1: 0.5220
 epoch: 32, train_loss: 0.9736, test_loss: 0.9323, test_f1: 0.5128
 epoch: 33, train_loss: 0.9699, test_loss: 0.9470, test_f1: 0.5160
 epoch: 34, train_loss: 0.9700, test_loss: 0.9424, test_f1: 0.5023
 epoch: 35, train_loss: 0.9645, test_loss: 0.9588, test_f1: 0.4994
 epoch: 36, train_loss: 0.9496, test_loss: 0.9322, test_f1: 0.5029
 epoch: 37, train_loss: 0.9394, test_loss: 0.9465, test_f1: 0.4919
 epoch: 38, train_loss: 0.9354, test_loss: 0.9388, test_f1: 0.4970
 epoch: 39, train_loss: 0.9314, test_loss: 0.9210, test_f1: 0.5068
 epoch: 40, train_loss: 0.9367, test_loss: 0.9222, test_f1: 0.5092
 epoch: 41, train_loss: 0.9285, test_loss: 0.9280, test_f1: 0.5163
 epoch: 42, train_loss: 0.9189, test_loss: 0.9189, test_f1: 0.5233
 epoch: 43, train_loss: 0.9185, test_loss: 0.9267, test_f1: 0.5139
 epoch: 44, train_loss: 0.9146, test_loss: 0.9309, test_f1: 0.5113
 epoch: 45, train_loss: 0.9226, test_loss: 0.9210, test_f1: 0.5124
 epoch: 46, train_loss: 0.9157, test_loss: 0.9335, test_f1: 0.4796
 epoch: 47, train_loss: 0.9070, test_loss: 0.9175, test_f1: 0.5064
 epoch: 48, train_loss: 0.9065, test_loss: 0.9256, test_f1: 0.5064
 epoch: 49, train_loss: 0.9009, test_loss: 0.9430, test_f1: 0.4959
 epoch: 50, train_loss: 0.8947, test_loss: 0.9323, test_f1: 0.5130
 epoch: 51, train_loss: 0.8982, test_loss: 0.9468, test_f1: 0.4801
 epoch: 52, train_loss: 0.8937, test_loss: 0.9312, test_f1: 0.5200
 epoch: 53, train_loss: 0.8843, test_loss: 0.9270, test_f1: 0.5307
 epoch: 54, train_loss: 0.8858, test_loss: 0.9242, test_f1: 0.5262
 epoch: 55, train_loss: 0.8829, test_loss: 0.9581, test_f1: 0.5001
 epoch: 56, train_loss: 0.8822, test_loss: 0.9225, test_f1: 0.5128
 epoch: 57, train_loss: 0.8642, test_loss: 0.9390, test_f1: 0.5226
 epoch: 58, train_loss: 0.8859, test_loss: 0.9476, test_f1: 0.5099
 epoch: 59, train_loss: 0.8817, test_loss: 0.9311, test_f1: 0.5268
 epoch: 60, train_loss: 0.8684, test_loss: 0.9461, test_f1: 0.5136
 epoch: 61, train_loss: 0.8778, test_loss: 0.9436, test_f1: 0.5065
 epoch: 62, train_loss: 0.8800, test_loss: 0.9590, test_f1: 0.5148
 epoch: 63, train_loss: 0.8788, test_loss: 0.9417, test_f1: 0.5102
 epoch: 64, train_loss: 0.8718, test_loss: 0.9511, test_f1: 0.4943
 epoch: 65, train_loss: 0.8795, test_loss: 0.9429, test_f1: 0.5008
 epoch: 66, train_loss: 0.8662, test_loss: 0.9484, test_f1: 0.5091
 epoch: 67, train_loss: 0.8685, test_loss: 0.9727, test_f1: 0.5116
 epoch: 68, train_loss: 0.8711, test_loss: 0.9373, test_f1: 0.5115
 epoch: 69, train_loss: 0.8773, test_loss: 0.9360, test_f1: 0.5153
 epoch: 70, train_loss: 0.8591, test_loss: 0.9482, test_f1: 0.5125
 epoch: 71, train_loss: 0.8607, test_loss: 0.9500, test_f1: 0.5262
 epoch: 72, train_loss: 0.8712, test_loss: 0.9409, test_f1: 0.5171
 epoch: 73, train_loss: 0.8578, test_loss: 0.9469, test_f1: 0.4880
 epoch: 74, train_loss: 0.8513, test_loss: 0.9392, test_f1: 0.5220
 epoch: 75, train_loss: 0.8497, test_loss: 0.9395, test_f1: 0.4918
 epoch: 76, train_loss: 0.8581, test_loss: 0.9464, test_f1: 0.5022
 epoch: 77, train_loss: 0.8607, test_loss: 0.9530, test_f1: 0.5215
 epoch: 78, train_loss: 0.8440, test_loss: 0.9374, test_f1: 0.5049
 epoch: 79, train_loss: 0.8424, test_loss: 0.9428, test_f1: 0.5249
 epoch: 80, train_loss: 0.8523, test_loss: 0.9815, test_f1: 0.5066
 epoch: 81, train_loss: 0.8511, test_loss: 0.9456, test_f1: 0.5184
 epoch: 82, train_loss: 0.8603, test_loss: 0.9402, test_f1: 0.5214
 epoch: 83, train_loss: 0.8532, test_loss: 0.9289, test_f1: 0.5300
 epoch: 84, train_loss: 0.8459, test_loss: 0.9400, test_f1: 0.5095
 epoch: 85, train_loss: 0.8483, test_loss: 0.9936, test_f1: 0.4928
 epoch: 86, train_loss: 0.8514, test_loss: 0.9654, test_f1: 0.5087
 epoch: 87, train_loss: 0.8487, test_loss: 0.9829, test_f1: 0.4905
 epoch: 88, train_loss: 0.8472, test_loss: 0.9384, test_f1: 0.5223
 epoch: 89, train_loss: 0.8509, test_loss: 0.9805, test_f1: 0.5114
 epoch: 90, train_loss: 0.8406, test_loss: 0.9534, test_f1: 0.5153
 epoch: 91, train_loss: 0.8392, test_loss: 0.9574, test_f1: 0.5199
 epoch: 92, train_loss: 0.8337, test_loss: 0.9446, test_f1: 0.5140
 epoch: 93, train_loss: 0.8338, test_loss: 0.9532, test_f1: 0.5079
 epoch: 94, train_loss: 0.8415, test_loss: 0.9461, test_f1: 0.5222
 epoch: 95, train_loss: 0.8209, test_loss: 0.9636, test_f1: 0.5075
 epoch: 96, train_loss: 0.8244, test_loss: 0.9627, test_f1: 0.5095
 epoch: 97, train_loss: 0.8371, test_loss: 0.9801, test_f1: 0.4888
 epoch: 98, train_loss: 0.8233, test_loss: 0.9559, test_f1: 0.5136
 epoch: 99, train_loss: 0.8254, test_loss: 0.9868, test_f1: 0.5051
##################ITERATION #9 ****************************************
 epoch: 0, train_loss: 1.3604, test_loss: 1.2204, test_f1: 0.3194
 epoch: 1, train_loss: 1.2602, test_loss: 1.1772, test_f1: 0.3560
 epoch: 2, train_loss: 1.2407, test_loss: 1.1629, test_f1: 0.3917
 epoch: 3, train_loss: 1.2277, test_loss: 1.1841, test_f1: 0.3711
 epoch: 4, train_loss: 1.2073, test_loss: 1.1441, test_f1: 0.4112
 epoch: 5, train_loss: 1.1846, test_loss: 1.1199, test_f1: 0.4270
 epoch: 6, train_loss: 1.1649, test_loss: 1.0951, test_f1: 0.4340
 epoch: 7, train_loss: 1.1464, test_loss: 1.1179, test_f1: 0.4201
 epoch: 8, train_loss: 1.1442, test_loss: 1.0780, test_f1: 0.4573
 epoch: 9, train_loss: 1.1284, test_loss: 1.0508, test_f1: 0.4737
 epoch: 10, train_loss: 1.1075, test_loss: 1.0431, test_f1: 0.4692
 epoch: 11, train_loss: 1.1076, test_loss: 1.0432, test_f1: 0.4701
 epoch: 12, train_loss: 1.0995, test_loss: 1.0361, test_f1: 0.4469
 epoch: 13, train_loss: 1.0983, test_loss: 1.0208, test_f1: 0.4456
 epoch: 14, train_loss: 1.0851, test_loss: 1.0220, test_f1: 0.4682
 epoch: 15, train_loss: 1.0793, test_loss: 1.0086, test_f1: 0.4585
 epoch: 16, train_loss: 1.0628, test_loss: 1.0026, test_f1: 0.4810
 epoch: 17, train_loss: 1.0602, test_loss: 1.0010, test_f1: 0.4829
 epoch: 18, train_loss: 1.0489, test_loss: 1.0004, test_f1: 0.4690
 epoch: 19, train_loss: 1.0461, test_loss: 0.9901, test_f1: 0.4589
 epoch: 20, train_loss: 1.0384, test_loss: 0.9851, test_f1: 0.4978
 epoch: 21, train_loss: 1.0347, test_loss: 0.9714, test_f1: 0.4939
 epoch: 22, train_loss: 1.0265, test_loss: 0.9846, test_f1: 0.4841
 epoch: 23, train_loss: 1.0194, test_loss: 0.9699, test_f1: 0.4907
 epoch: 24, train_loss: 1.0212, test_loss: 0.9668, test_f1: 0.5056
 epoch: 25, train_loss: 1.0123, test_loss: 0.9736, test_f1: 0.4828
 epoch: 26, train_loss: 1.0148, test_loss: 0.9545, test_f1: 0.4965
 epoch: 27, train_loss: 1.0065, test_loss: 0.9476, test_f1: 0.4896
 epoch: 28, train_loss: 1.0161, test_loss: 0.9493, test_f1: 0.4861
 epoch: 29, train_loss: 0.9980, test_loss: 0.9492, test_f1: 0.4691
 epoch: 30, train_loss: 1.0035, test_loss: 0.9548, test_f1: 0.4896
 epoch: 31, train_loss: 0.9945, test_loss: 0.9467, test_f1: 0.4860
 epoch: 32, train_loss: 0.9917, test_loss: 0.9472, test_f1: 0.4980
 epoch: 33, train_loss: 0.9760, test_loss: 0.9512, test_f1: 0.4887
 epoch: 34, train_loss: 0.9836, test_loss: 0.9469, test_f1: 0.4690
 epoch: 35, train_loss: 0.9758, test_loss: 0.9618, test_f1: 0.4498
 epoch: 36, train_loss: 0.9702, test_loss: 0.9357, test_f1: 0.4849
 epoch: 37, train_loss: 0.9607, test_loss: 0.9345, test_f1: 0.4717
 epoch: 38, train_loss: 0.9660, test_loss: 0.9235, test_f1: 0.4706
 epoch: 39, train_loss: 0.9575, test_loss: 0.9146, test_f1: 0.5017
 epoch: 40, train_loss: 0.9486, test_loss: 0.9139, test_f1: 0.5000
 epoch: 41, train_loss: 0.9556, test_loss: 0.9240, test_f1: 0.4698
 epoch: 42, train_loss: 0.9440, test_loss: 0.9273, test_f1: 0.4807
 epoch: 43, train_loss: 0.9399, test_loss: 0.9231, test_f1: 0.4896
 epoch: 44, train_loss: 0.9512, test_loss: 0.9267, test_f1: 0.4876
 epoch: 45, train_loss: 0.9390, test_loss: 0.9106, test_f1: 0.4952
 epoch: 46, train_loss: 0.9293, test_loss: 0.9088, test_f1: 0.5064
 epoch: 47, train_loss: 0.9302, test_loss: 0.9067, test_f1: 0.5035
 epoch: 48, train_loss: 0.9244, test_loss: 0.9090, test_f1: 0.5102
 epoch: 49, train_loss: 0.9295, test_loss: 0.9074, test_f1: 0.5014
 epoch: 50, train_loss: 0.9176, test_loss: 0.9186, test_f1: 0.4974
 epoch: 51, train_loss: 0.9116, test_loss: 0.9083, test_f1: 0.4921
 epoch: 52, train_loss: 0.9159, test_loss: 0.9095, test_f1: 0.5038
 epoch: 53, train_loss: 0.9101, test_loss: 0.9104, test_f1: 0.5025
 epoch: 54, train_loss: 0.9078, test_loss: 0.9100, test_f1: 0.4912
 epoch: 55, train_loss: 0.9124, test_loss: 0.9070, test_f1: 0.4998
 epoch: 56, train_loss: 0.9072, test_loss: 0.9064, test_f1: 0.5104
 epoch: 57, train_loss: 0.9030, test_loss: 0.9135, test_f1: 0.5086
 epoch: 58, train_loss: 0.9047, test_loss: 0.9136, test_f1: 0.5076
 epoch: 59, train_loss: 0.9046, test_loss: 0.9166, test_f1: 0.4981
 epoch: 60, train_loss: 0.8986, test_loss: 0.9099, test_f1: 0.5157
 epoch: 61, train_loss: 0.9005, test_loss: 0.9062, test_f1: 0.5021
 epoch: 62, train_loss: 0.9085, test_loss: 0.9079, test_f1: 0.5062
 epoch: 63, train_loss: 0.8899, test_loss: 0.9058, test_f1: 0.5061
 epoch: 64, train_loss: 0.8990, test_loss: 0.9074, test_f1: 0.5054
 epoch: 65, train_loss: 0.8979, test_loss: 0.9047, test_f1: 0.5177
 epoch: 66, train_loss: 0.9009, test_loss: 0.9049, test_f1: 0.5151
 epoch: 67, train_loss: 0.8977, test_loss: 0.9207, test_f1: 0.5060
 epoch: 68, train_loss: 0.8903, test_loss: 0.9044, test_f1: 0.5111
 epoch: 69, train_loss: 0.8854, test_loss: 0.9024, test_f1: 0.5156
 epoch: 70, train_loss: 0.8739, test_loss: 0.9132, test_f1: 0.5087
 epoch: 71, train_loss: 0.8860, test_loss: 0.9119, test_f1: 0.4989
 epoch: 72, train_loss: 0.9089, test_loss: 0.9166, test_f1: 0.5075
 epoch: 73, train_loss: 0.8813, test_loss: 0.9138, test_f1: 0.5000
 epoch: 74, train_loss: 0.8886, test_loss: 0.9217, test_f1: 0.5183
 epoch: 75, train_loss: 0.8752, test_loss: 0.9398, test_f1: 0.5045
 epoch: 76, train_loss: 0.8826, test_loss: 0.9181, test_f1: 0.5131
 epoch: 77, train_loss: 0.8875, test_loss: 0.9042, test_f1: 0.5099
 epoch: 78, train_loss: 0.8781, test_loss: 0.9065, test_f1: 0.5104
 epoch: 79, train_loss: 0.8834, test_loss: 0.9143, test_f1: 0.5143
 epoch: 80, train_loss: 0.8709, test_loss: 0.9539, test_f1: 0.5159
 epoch: 81, train_loss: 0.8693, test_loss: 0.9220, test_f1: 0.5028
 epoch: 82, train_loss: 0.8775, test_loss: 0.9124, test_f1: 0.4960
 epoch: 83, train_loss: 0.8683, test_loss: 0.8975, test_f1: 0.5050
 epoch: 84, train_loss: 0.8781, test_loss: 0.9152, test_f1: 0.5232
 epoch: 85, train_loss: 0.8653, test_loss: 0.9158, test_f1: 0.5147
 epoch: 86, train_loss: 0.8731, test_loss: 0.9249, test_f1: 0.5078
 epoch: 87, train_loss: 0.8811, test_loss: 0.9537, test_f1: 0.5002
 epoch: 88, train_loss: 0.8687, test_loss: 0.9224, test_f1: 0.5141
 epoch: 89, train_loss: 0.8657, test_loss: 0.9314, test_f1: 0.5151
 epoch: 90, train_loss: 0.8695, test_loss: 0.9325, test_f1: 0.5100
 epoch: 91, train_loss: 0.8597, test_loss: 0.9182, test_f1: 0.5227
 epoch: 92, train_loss: 0.8632, test_loss: 0.9146, test_f1: 0.5138
 epoch: 93, train_loss: 0.8512, test_loss: 0.9207, test_f1: 0.5214
 epoch: 94, train_loss: 0.8548, test_loss: 0.9212, test_f1: 0.5125
 epoch: 95, train_loss: 0.8694, test_loss: 0.9189, test_f1: 0.5106
 epoch: 96, train_loss: 0.8678, test_loss: 0.9325, test_f1: 0.5129
 epoch: 97, train_loss: 0.8589, test_loss: 0.9228, test_f1: 0.5055
 epoch: 98, train_loss: 0.8507, test_loss: 0.9365, test_f1: 0.5021
 epoch: 99, train_loss: 0.8420, test_loss: 0.9324, test_f1: 0.5264

Training completed in 792.92 seconds
Best F1: 0.5587 at epoch 94
Mean F1 across iterations: 0.5313  0.0175
========================FINAL RESULTS================================
FEGIN weighted F1: 0.5587  0.0175
python main.py --data ltspice_examples --representation component_component --model FEGIN --layers 2 --hiddens 64 --batch_size 32 --lr 0.0001 --emb_size 128 --epochs 100 --save_appendix component_component_L2_H64_BS32_LR0.0001_E128 --no_val
-----



STDERR:
  File "main.py", line 370, in <module>
    main()
  File "main.py", line 254, in main
    dataset = dataset_class(
  File "/home/philip/projects/ltspice_examples_code_repo/Circuit-Completion-Using-GNNs/component_classification_with_link_prediction_head/evaluation/FEGIN/kernel/circuit_datasets.py", line 15, in __init__
    self.data, self.slices = torch.load(self.processed_paths[0])
  File "/home/philip/.local/lib/python3.8/site-packages/torch/serialization.py", line 1040, in load
    warnings.warn(
  File "/usr/lib/python3.8/warnings.py", line 109, in _showwarnmsg
    sw(msg.message, msg.category, msg.filename, msg.lineno,
  File "main.py", line 47, in warn_with_traceback
    traceback.print_stack(file=log)
/home/philip/projects/ltspice_examples_code_repo/Circuit-Completion-Using-GNNs/component_classification_with_link_prediction_head/evaluation/FEGIN/kernel/circuit_datasets.py:15: FutureWarning: You are using `torch.load` with `weights_only=False` (the current default value), which uses the default pickle module implicitly. It is possible to construct malicious pickle data which will execute arbitrary code during unpickling (See https://github.com/pytorch/pytorch/blob/main/SECURITY.md#untrusted-models for more details). In a future release, the default value for `weights_only` will be flipped to `True`. This limits the functions that could be executed during unpickling. Arbitrary objects will no longer be allowed to be loaded via this mode unless they are explicitly allowlisted by the user via `torch.serialization.add_safe_globals`. We recommend you start setting `weights_only=True` for any use case where you don't have full control of the loaded file. Please open an issue on GitHub for any issues related to this experimental feature.
  self.data, self.slices = torch.load(self.processed_paths[0])
