STDOUT:
Results will be saved in /home/philip/projects/ltspice_examples_code_repo/Circuit-Completion-Using-GNNs/component_classification_with_link_prediction_head/evaluation/FEGIN/results/model_FEGIN_dataset_ltspice_demos
Command line input: python main.py --data ltspice_demos --representation component_pin_net --model FEGIN --layers 3 --hiddens 16 --batch_size 128 --lr 0.1 --emb_size 128 --epochs 100 --save_appendix component_pin_net_L3_H16_BS128_LR0.1_E128 --no_val
 is saved.
-----
ltspice_demos - FEGIN
Using 3 layers, 16 hidden units, h = 2
Loading component_pin_net representation dataset
ENTERED
Training FEGIN on component_pin_net representation
Train: 1565, Test: 383
##################ITERATION #0 ****************************************
 epoch: 0, train_loss: 1.2741, test_loss: 4.1928, test_f1: 0.1365
 epoch: 1, train_loss: 1.1143, test_loss: 1.3803, test_f1: 0.2281
 epoch: 2, train_loss: 1.1315, test_loss: 1.1635, test_f1: 0.4340
 epoch: 3, train_loss: 1.0837, test_loss: 1.2809, test_f1: 0.2876
 epoch: 4, train_loss: 1.0710, test_loss: 1.1596, test_f1: 0.4286
 epoch: 5, train_loss: 1.0565, test_loss: 1.1249, test_f1: 0.3370
 epoch: 6, train_loss: 1.0534, test_loss: 1.1430, test_f1: 0.4401
 epoch: 7, train_loss: 1.0611, test_loss: 1.1247, test_f1: 0.3838
 epoch: 8, train_loss: 1.0388, test_loss: 1.1179, test_f1: 0.3395
 epoch: 9, train_loss: 1.0205, test_loss: 1.2313, test_f1: 0.4184
 epoch: 10, train_loss: 1.0310, test_loss: 1.1716, test_f1: 0.3248
 epoch: 11, train_loss: 1.0032, test_loss: 1.1569, test_f1: 0.3595
 epoch: 12, train_loss: 1.0055, test_loss: 1.1023, test_f1: 0.4599
 epoch: 13, train_loss: 1.0064, test_loss: 1.1162, test_f1: 0.3597
 epoch: 14, train_loss: 0.9903, test_loss: 1.1496, test_f1: 0.3723
 epoch: 15, train_loss: 1.0413, test_loss: 1.1688, test_f1: 0.4276
 epoch: 16, train_loss: 1.0237, test_loss: 1.2566, test_f1: 0.3399
 epoch: 17, train_loss: 1.0188, test_loss: 1.1032, test_f1: 0.4747
 epoch: 18, train_loss: 1.0006, test_loss: 1.1918, test_f1: 0.4480
 epoch: 19, train_loss: 1.0123, test_loss: 1.6422, test_f1: 0.1715
 epoch: 20, train_loss: 1.0143, test_loss: 1.5188, test_f1: 0.2555
 epoch: 21, train_loss: 1.0304, test_loss: 1.2984, test_f1: 0.1431
 epoch: 22, train_loss: 1.0078, test_loss: 1.1034, test_f1: 0.3919
 epoch: 23, train_loss: 1.0040, test_loss: 1.1264, test_f1: 0.3785
 epoch: 24, train_loss: 1.1145, test_loss: 1.2546, test_f1: 0.3279
 epoch: 25, train_loss: 1.0217, test_loss: 1.3157, test_f1: 0.4225
 epoch: 26, train_loss: 1.0438, test_loss: 1.1508, test_f1: 0.3290
 epoch: 27, train_loss: 1.0541, test_loss: 1.1400, test_f1: 0.3344
 epoch: 28, train_loss: 1.0407, test_loss: 1.1543, test_f1: 0.3722
 epoch: 29, train_loss: 1.0264, test_loss: 1.1232, test_f1: 0.4421
 epoch: 30, train_loss: 1.0164, test_loss: 1.1685, test_f1: 0.4313
 epoch: 31, train_loss: 0.9999, test_loss: 1.1168, test_f1: 0.4084
 epoch: 32, train_loss: 1.0057, test_loss: 1.1355, test_f1: 0.3700
 epoch: 33, train_loss: 0.9908, test_loss: 1.1654, test_f1: 0.3856
 epoch: 34, train_loss: 0.9892, test_loss: 1.0987, test_f1: 0.4410
 epoch: 35, train_loss: 1.0125, test_loss: 1.3355, test_f1: 0.2760
 epoch: 36, train_loss: 1.0160, test_loss: 1.2287, test_f1: 0.4687
 epoch: 37, train_loss: 1.0008, test_loss: 1.1712, test_f1: 0.4444
 epoch: 38, train_loss: 1.0089, test_loss: 1.2310, test_f1: 0.3961
 epoch: 39, train_loss: 0.9916, test_loss: 1.1413, test_f1: 0.3964
 epoch: 40, train_loss: 0.9843, test_loss: 1.0793, test_f1: 0.5155
 epoch: 41, train_loss: 1.0158, test_loss: 1.1432, test_f1: 0.3411
 epoch: 42, train_loss: 0.9937, test_loss: 1.1321, test_f1: 0.4378
 epoch: 43, train_loss: 0.9789, test_loss: 1.1254, test_f1: 0.3889
 epoch: 44, train_loss: 0.9901, test_loss: 1.1173, test_f1: 0.3670
 epoch: 45, train_loss: 1.0018, test_loss: 1.2094, test_f1: 0.4708
 epoch: 46, train_loss: 0.9919, test_loss: 1.0993, test_f1: 0.4014
 epoch: 47, train_loss: 1.0115, test_loss: 1.4132, test_f1: 0.2888
 epoch: 48, train_loss: 0.9984, test_loss: 1.0947, test_f1: 0.4126
 epoch: 49, train_loss: 0.9665, test_loss: 1.1348, test_f1: 0.5210
 epoch: 50, train_loss: 0.9817, test_loss: 1.1254, test_f1: 0.4832
 epoch: 51, train_loss: 0.9843, test_loss: 1.1327, test_f1: 0.5026
 epoch: 52, train_loss: 0.9755, test_loss: 1.1324, test_f1: 0.4555
 epoch: 53, train_loss: 0.9805, test_loss: 1.1162, test_f1: 0.4872
 epoch: 54, train_loss: 0.9643, test_loss: 1.2386, test_f1: 0.3883
 epoch: 55, train_loss: 0.9748, test_loss: 1.0781, test_f1: 0.4081
 epoch: 56, train_loss: 0.9587, test_loss: 1.0687, test_f1: 0.5160
 epoch: 57, train_loss: 0.9448, test_loss: 1.0966, test_f1: 0.5212
 epoch: 58, train_loss: 0.9486, test_loss: 1.1069, test_f1: 0.5369
 epoch: 59, train_loss: 0.9619, test_loss: 1.0729, test_f1: 0.4986
 epoch: 60, train_loss: 0.9531, test_loss: 1.0603, test_f1: 0.5296
 epoch: 61, train_loss: 0.9438, test_loss: 1.2089, test_f1: 0.4772
 epoch: 62, train_loss: 0.9509, test_loss: 1.1187, test_f1: 0.5149
 epoch: 63, train_loss: 0.9556, test_loss: 1.1028, test_f1: 0.5225
 epoch: 64, train_loss: 0.9492, test_loss: 1.1606, test_f1: 0.3594
 epoch: 65, train_loss: 0.9435, test_loss: 1.1325, test_f1: 0.5182
 epoch: 66, train_loss: 0.9470, test_loss: 1.1029, test_f1: 0.4541
 epoch: 67, train_loss: 0.9516, test_loss: 1.1762, test_f1: 0.4554
 epoch: 68, train_loss: 0.9351, test_loss: 1.0715, test_f1: 0.5409
 epoch: 69, train_loss: 0.9565, test_loss: 1.0595, test_f1: 0.4156
 epoch: 70, train_loss: 0.9594, test_loss: 1.0413, test_f1: 0.4851
 epoch: 71, train_loss: 0.9477, test_loss: 1.2048, test_f1: 0.5187
 epoch: 72, train_loss: 0.9451, test_loss: 1.4903, test_f1: 0.4816
 epoch: 73, train_loss: 0.9677, test_loss: 1.3621, test_f1: 0.3176
 epoch: 74, train_loss: 0.9701, test_loss: 1.0593, test_f1: 0.4067
 epoch: 75, train_loss: 0.9514, test_loss: 1.0656, test_f1: 0.5259
 epoch: 76, train_loss: 0.9444, test_loss: 1.0785, test_f1: 0.4272
 epoch: 77, train_loss: 0.9403, test_loss: 1.0486, test_f1: 0.5253
 epoch: 78, train_loss: 0.9348, test_loss: 1.1283, test_f1: 0.5515
 epoch: 79, train_loss: 0.9384, test_loss: 1.1037, test_f1: 0.5255
 epoch: 80, train_loss: 0.9396, test_loss: 1.0449, test_f1: 0.4760
 epoch: 81, train_loss: 0.9349, test_loss: 1.0829, test_f1: 0.4200
 epoch: 82, train_loss: 0.9564, test_loss: 1.1340, test_f1: 0.5392
 epoch: 83, train_loss: 0.9313, test_loss: 1.2138, test_f1: 0.4899
 epoch: 84, train_loss: 0.9509, test_loss: 1.0285, test_f1: 0.4673
 epoch: 85, train_loss: 0.9318, test_loss: 1.0883, test_f1: 0.5183
 epoch: 86, train_loss: 0.9442, test_loss: 1.0699, test_f1: 0.5362
 epoch: 87, train_loss: 0.9325, test_loss: 1.3078, test_f1: 0.4064
 epoch: 88, train_loss: 0.9382, test_loss: 1.1694, test_f1: 0.5145
 epoch: 89, train_loss: 0.9258, test_loss: 1.0608, test_f1: 0.4695
 epoch: 90, train_loss: 0.9324, test_loss: 1.2259, test_f1: 0.4620
 epoch: 91, train_loss: 0.9288, test_loss: 1.0963, test_f1: 0.5445
 epoch: 92, train_loss: 0.9321, test_loss: 1.0626, test_f1: 0.5498
 epoch: 93, train_loss: 0.9203, test_loss: 1.3608, test_f1: 0.3789
 epoch: 94, train_loss: 0.9231, test_loss: 1.1152, test_f1: 0.5426
 epoch: 95, train_loss: 0.9270, test_loss: 1.0363, test_f1: 0.5050
 epoch: 96, train_loss: 0.9200, test_loss: 1.0437, test_f1: 0.5337
 epoch: 97, train_loss: 0.9338, test_loss: 1.0427, test_f1: 0.4926
 epoch: 98, train_loss: 0.9365, test_loss: 1.0267, test_f1: 0.5331
 epoch: 99, train_loss: 0.9284, test_loss: 1.1090, test_f1: 0.5009
##################ITERATION #1 ****************************************
 epoch: 0, train_loss: 1.2913, test_loss: 1.3252, test_f1: 0.2281
 epoch: 1, train_loss: 1.1561, test_loss: 1.3224, test_f1: 0.2285
 epoch: 2, train_loss: 1.0966, test_loss: 1.1302, test_f1: 0.3304
 epoch: 3, train_loss: 1.0840, test_loss: 1.1348, test_f1: 0.3344
 epoch: 4, train_loss: 1.0884, test_loss: 1.1954, test_f1: 0.3176
 epoch: 5, train_loss: 1.0748, test_loss: 1.0970, test_f1: 0.3461
 epoch: 6, train_loss: 1.0642, test_loss: 1.1178, test_f1: 0.3395
 epoch: 7, train_loss: 1.0708, test_loss: 1.1339, test_f1: 0.3317
 epoch: 8, train_loss: 1.0491, test_loss: 1.1767, test_f1: 0.3262
 epoch: 9, train_loss: 1.0556, test_loss: 1.1656, test_f1: 0.3290
 epoch: 10, train_loss: 1.0582, test_loss: 1.2025, test_f1: 0.3146
 epoch: 11, train_loss: 1.0352, test_loss: 1.2216, test_f1: 0.3083
 epoch: 12, train_loss: 1.0506, test_loss: 1.1547, test_f1: 0.3317
 epoch: 13, train_loss: 1.0463, test_loss: 1.1611, test_f1: 0.3290
 epoch: 14, train_loss: 1.0789, test_loss: 1.1054, test_f1: 0.3395
 epoch: 15, train_loss: 1.0440, test_loss: 1.1382, test_f1: 0.3290
 epoch: 16, train_loss: 1.0569, test_loss: 1.1115, test_f1: 0.3395
 epoch: 17, train_loss: 1.0572, test_loss: 1.0970, test_f1: 0.3395
 epoch: 18, train_loss: 1.0312, test_loss: 1.1590, test_f1: 0.3290
 epoch: 19, train_loss: 1.0355, test_loss: 1.1719, test_f1: 0.3262
 epoch: 20, train_loss: 1.0318, test_loss: 1.1285, test_f1: 0.3391
 epoch: 21, train_loss: 1.0270, test_loss: 1.1324, test_f1: 0.3314
 epoch: 22, train_loss: 1.0243, test_loss: 1.1093, test_f1: 0.3395
 epoch: 23, train_loss: 1.0198, test_loss: 1.1178, test_f1: 0.3395
 epoch: 24, train_loss: 1.0212, test_loss: 1.1710, test_f1: 0.3290
 epoch: 25, train_loss: 1.0345, test_loss: 4.2031, test_f1: 0.2069
 epoch: 26, train_loss: 1.0344, test_loss: 1.1003, test_f1: 0.3444
 epoch: 27, train_loss: 1.0548, test_loss: 1.3282, test_f1: 0.2675
 epoch: 28, train_loss: 1.0659, test_loss: 1.1681, test_f1: 0.3234
 epoch: 29, train_loss: 1.0255, test_loss: 1.1083, test_f1: 0.3420
 epoch: 30, train_loss: 1.0263, test_loss: 1.1652, test_f1: 0.3317
 epoch: 31, train_loss: 1.0414, test_loss: 1.1306, test_f1: 0.3229
 epoch: 32, train_loss: 1.0583, test_loss: 1.1301, test_f1: 0.3344
 epoch: 33, train_loss: 1.0275, test_loss: 1.1400, test_f1: 0.3344
 epoch: 34, train_loss: 1.0396, test_loss: 6.4264, test_f1: 0.2498
 epoch: 35, train_loss: 1.0401, test_loss: 1.1316, test_f1: 0.3245
 epoch: 36, train_loss: 1.0207, test_loss: 1.0845, test_f1: 0.3492
 epoch: 37, train_loss: 1.0100, test_loss: 1.1239, test_f1: 0.3370
 epoch: 38, train_loss: 1.0180, test_loss: 1.0910, test_f1: 0.3492
 epoch: 39, train_loss: 1.0208, test_loss: 1.1434, test_f1: 0.3344
 epoch: 40, train_loss: 1.0156, test_loss: 1.1450, test_f1: 0.3344
 epoch: 41, train_loss: 1.0159, test_loss: 1.0907, test_f1: 0.3468
 epoch: 42, train_loss: 1.0017, test_loss: 1.0843, test_f1: 0.3468
 epoch: 43, train_loss: 1.0163, test_loss: 1.0849, test_f1: 0.3468
 epoch: 44, train_loss: 1.0103, test_loss: 1.2351, test_f1: 0.2893
 epoch: 45, train_loss: 1.0068, test_loss: 1.0956, test_f1: 0.3468
 epoch: 46, train_loss: 1.0078, test_loss: 1.1068, test_f1: 0.3444
 epoch: 47, train_loss: 1.0041, test_loss: 1.0887, test_f1: 0.3468
 epoch: 48, train_loss: 1.0110, test_loss: 1.2472, test_f1: 0.3045
 epoch: 49, train_loss: 0.9945, test_loss: 1.1083, test_f1: 0.3445
 epoch: 50, train_loss: 1.0095, test_loss: 1.0973, test_f1: 0.3492
 epoch: 51, train_loss: 1.0324, test_loss: 1.1048, test_f1: 0.3468
 epoch: 52, train_loss: 1.0068, test_loss: 1.1572, test_f1: 0.3360
 epoch: 53, train_loss: 0.9963, test_loss: 1.1047, test_f1: 0.3468
 epoch: 54, train_loss: 1.0083, test_loss: 1.1057, test_f1: 0.3563
 epoch: 55, train_loss: 1.0193, test_loss: 1.5288, test_f1: 0.3022
 epoch: 56, train_loss: 1.0076, test_loss: 1.0924, test_f1: 0.3473
 epoch: 57, train_loss: 0.9983, test_loss: 1.0989, test_f1: 0.3468
 epoch: 58, train_loss: 1.0023, test_loss: 1.0941, test_f1: 0.3391
 epoch: 59, train_loss: 1.0018, test_loss: 1.1370, test_f1: 0.3358
 epoch: 60, train_loss: 1.0106, test_loss: 1.1657, test_f1: 0.3317
 epoch: 61, train_loss: 1.0159, test_loss: 1.1536, test_f1: 0.3344
 epoch: 62, train_loss: 1.0111, test_loss: 1.2102, test_f1: 0.3162
 epoch: 63, train_loss: 1.0014, test_loss: 1.1223, test_f1: 0.3252
 epoch: 64, train_loss: 1.0127, test_loss: 1.0856, test_f1: 0.3507
 epoch: 65, train_loss: 1.0097, test_loss: 1.1102, test_f1: 0.3420
 epoch: 66, train_loss: 1.0089, test_loss: 1.0888, test_f1: 0.3468
 epoch: 67, train_loss: 1.0056, test_loss: 1.1006, test_f1: 0.3422
 epoch: 68, train_loss: 0.9945, test_loss: 1.1423, test_f1: 0.3186
 epoch: 69, train_loss: 1.0010, test_loss: 1.1720, test_f1: 0.3135
 epoch: 70, train_loss: 1.0027, test_loss: 1.1024, test_f1: 0.3508
 epoch: 71, train_loss: 1.0070, test_loss: 1.1090, test_f1: 0.3443
 epoch: 72, train_loss: 0.9961, test_loss: 1.0977, test_f1: 0.3468
 epoch: 73, train_loss: 0.9943, test_loss: 1.0896, test_f1: 0.3467
 epoch: 74, train_loss: 1.0101, test_loss: 1.0772, test_f1: 0.3606
 epoch: 75, train_loss: 1.0164, test_loss: 1.0919, test_f1: 0.3421
 epoch: 76, train_loss: 0.9953, test_loss: 1.1311, test_f1: 0.3310
 epoch: 77, train_loss: 1.0003, test_loss: 1.1419, test_f1: 0.3261
 epoch: 78, train_loss: 1.0125, test_loss: 1.1072, test_f1: 0.3444
 epoch: 79, train_loss: 1.0064, test_loss: 1.1805, test_f1: 0.3123
 epoch: 80, train_loss: 0.9994, test_loss: 1.1156, test_f1: 0.3399
 epoch: 81, train_loss: 1.0000, test_loss: 1.1069, test_f1: 0.3421
 epoch: 82, train_loss: 1.0032, test_loss: 1.1199, test_f1: 0.3421
 epoch: 83, train_loss: 1.0062, test_loss: 1.1225, test_f1: 0.3421
 epoch: 84, train_loss: 0.9969, test_loss: 1.1206, test_f1: 0.3310
 epoch: 85, train_loss: 0.9956, test_loss: 1.1121, test_f1: 0.3375
 epoch: 86, train_loss: 0.9962, test_loss: 1.1182, test_f1: 0.3375
 epoch: 87, train_loss: 1.0085, test_loss: 1.1216, test_f1: 0.3444
 epoch: 88, train_loss: 1.0084, test_loss: 1.1376, test_f1: 0.3370
 epoch: 89, train_loss: 1.0405, test_loss: 1.1320, test_f1: 0.3398
 epoch: 90, train_loss: 1.0280, test_loss: 1.1056, test_f1: 0.3444
 epoch: 91, train_loss: 1.0272, test_loss: 1.0940, test_f1: 0.3444
 epoch: 92, train_loss: 1.0325, test_loss: 1.0962, test_f1: 0.3467
 epoch: 93, train_loss: 1.0203, test_loss: 1.0920, test_f1: 0.3467
 epoch: 94, train_loss: 1.0167, test_loss: 1.1131, test_f1: 0.3299
 epoch: 95, train_loss: 1.0148, test_loss: 1.0908, test_f1: 0.3492
 epoch: 96, train_loss: 1.0169, test_loss: 1.1149, test_f1: 0.3461
 epoch: 97, train_loss: 1.0148, test_loss: 1.1950, test_f1: 0.3123
 epoch: 98, train_loss: 1.0145, test_loss: 1.1402, test_f1: 0.3170
 epoch: 99, train_loss: 1.0195, test_loss: 1.1279, test_f1: 0.3438
##################ITERATION #2 ****************************************
 epoch: 0, train_loss: 1.2414, test_loss: 1.4496, test_f1: 0.1365
 epoch: 1, train_loss: 1.2014, test_loss: 1.4024, test_f1: 0.2336
 epoch: 2, train_loss: 1.0863, test_loss: 1.1243, test_f1: 0.3395
 epoch: 3, train_loss: 1.0449, test_loss: 1.1382, test_f1: 0.3390
 epoch: 4, train_loss: 1.0467, test_loss: 1.1885, test_f1: 0.3205
 epoch: 5, train_loss: 1.0462, test_loss: 1.2477, test_f1: 0.2953
 epoch: 6, train_loss: 1.0613, test_loss: 1.1152, test_f1: 0.3395
 epoch: 7, train_loss: 1.0600, test_loss: 1.1171, test_f1: 0.3395
 epoch: 8, train_loss: 1.0407, test_loss: 1.1441, test_f1: 0.3317
 epoch: 9, train_loss: 1.0366, test_loss: 1.1745, test_f1: 0.3205
 epoch: 10, train_loss: 1.0429, test_loss: 1.1339, test_f1: 0.3344
 epoch: 11, train_loss: 1.0254, test_loss: 1.1687, test_f1: 0.3234
 epoch: 12, train_loss: 1.0202, test_loss: 1.1691, test_f1: 0.3234
 epoch: 13, train_loss: 1.0088, test_loss: 1.1422, test_f1: 0.3286
 epoch: 14, train_loss: 1.0166, test_loss: 1.1519, test_f1: 0.3157
 epoch: 15, train_loss: 1.0228, test_loss: 1.1803, test_f1: 0.3290
 epoch: 16, train_loss: 1.0417, test_loss: 1.1573, test_f1: 0.3317
 epoch: 17, train_loss: 1.0223, test_loss: 1.1228, test_f1: 0.3404
 epoch: 18, train_loss: 1.0144, test_loss: 1.1405, test_f1: 0.3388
 epoch: 19, train_loss: 1.0220, test_loss: 1.1383, test_f1: 0.3451
 epoch: 20, train_loss: 1.0197, test_loss: 1.1448, test_f1: 0.3336
 epoch: 21, train_loss: 1.0176, test_loss: 1.1525, test_f1: 0.3344
 epoch: 22, train_loss: 1.0238, test_loss: 1.1848, test_f1: 0.3317
 epoch: 23, train_loss: 1.0226, test_loss: 1.1603, test_f1: 0.3317
 epoch: 24, train_loss: 1.0308, test_loss: 1.1447, test_f1: 0.3267
 epoch: 25, train_loss: 1.0249, test_loss: 1.1266, test_f1: 0.3344
 epoch: 26, train_loss: 1.0110, test_loss: 1.1352, test_f1: 0.3395
 epoch: 27, train_loss: 1.0162, test_loss: 1.1810, test_f1: 0.3317
 epoch: 28, train_loss: 1.0167, test_loss: 1.2055, test_f1: 0.3205
 epoch: 29, train_loss: 1.0187, test_loss: 1.1859, test_f1: 0.3176
 epoch: 30, train_loss: 1.0420, test_loss: 1.1474, test_f1: 0.3344
 epoch: 31, train_loss: 1.0328, test_loss: 1.1437, test_f1: 0.3269
 epoch: 32, train_loss: 1.0302, test_loss: 1.1478, test_f1: 0.3317
 epoch: 33, train_loss: 1.0450, test_loss: 1.3984, test_f1: 0.2985
 epoch: 34, train_loss: 1.0441, test_loss: 1.1821, test_f1: 0.3176
 epoch: 35, train_loss: 1.0175, test_loss: 1.1677, test_f1: 0.3234
 epoch: 36, train_loss: 1.0155, test_loss: 1.2123, test_f1: 0.3181
 epoch: 37, train_loss: 1.0136, test_loss: 1.1630, test_f1: 0.3322
 epoch: 38, train_loss: 1.0143, test_loss: 1.1294, test_f1: 0.3464
 epoch: 39, train_loss: 1.0093, test_loss: 1.1582, test_f1: 0.3508
 epoch: 40, train_loss: 1.0109, test_loss: 1.1280, test_f1: 0.3539
 epoch: 41, train_loss: 1.0396, test_loss: 1.1783, test_f1: 0.3290
 epoch: 42, train_loss: 1.0164, test_loss: 1.1523, test_f1: 0.3198
 epoch: 43, train_loss: 1.0767, test_loss: 1.3269, test_f1: 0.2929
 epoch: 44, train_loss: 1.0671, test_loss: 1.1399, test_f1: 0.3344
 epoch: 45, train_loss: 1.0374, test_loss: 1.1268, test_f1: 0.3344
 epoch: 46, train_loss: 1.0227, test_loss: 1.2647, test_f1: 0.3051
 epoch: 47, train_loss: 1.0295, test_loss: 1.1603, test_f1: 0.3290
 epoch: 48, train_loss: 1.0228, test_loss: 1.1434, test_f1: 0.3710
 epoch: 49, train_loss: 1.0275, test_loss: 1.1646, test_f1: 0.3607
 epoch: 50, train_loss: 1.0394, test_loss: 1.1366, test_f1: 0.3565
 epoch: 51, train_loss: 1.0290, test_loss: 1.1434, test_f1: 0.3491
 epoch: 52, train_loss: 1.0164, test_loss: 1.1409, test_f1: 0.3611
 epoch: 53, train_loss: 1.0100, test_loss: 1.1773, test_f1: 0.3401
 epoch: 54, train_loss: 1.0092, test_loss: 1.1361, test_f1: 0.3830
 epoch: 55, train_loss: 1.0104, test_loss: 1.2707, test_f1: 0.3421
 epoch: 56, train_loss: 1.0046, test_loss: 1.6329, test_f1: 0.1992
 epoch: 57, train_loss: 1.0226, test_loss: 1.4580, test_f1: 0.2435
 epoch: 58, train_loss: 1.0710, test_loss: 1.1760, test_f1: 0.3290
 epoch: 59, train_loss: 1.0691, test_loss: 1.1610, test_f1: 0.3309
 epoch: 60, train_loss: 1.0340, test_loss: 1.1240, test_f1: 0.3395
 epoch: 61, train_loss: 1.0285, test_loss: 1.1308, test_f1: 0.3395
 epoch: 62, train_loss: 1.0292, test_loss: 1.1422, test_f1: 0.3290
 epoch: 63, train_loss: 1.0271, test_loss: 1.1260, test_f1: 0.3370
 epoch: 64, train_loss: 1.0190, test_loss: 1.1241, test_f1: 0.3545
 epoch: 65, train_loss: 1.0166, test_loss: 1.1293, test_f1: 0.3733
 epoch: 66, train_loss: 1.0128, test_loss: 1.1087, test_f1: 0.3798
 epoch: 67, train_loss: 1.0162, test_loss: 1.1861, test_f1: 0.3290
 epoch: 68, train_loss: 1.0248, test_loss: 1.1308, test_f1: 0.3613
 epoch: 69, train_loss: 1.0167, test_loss: 1.1295, test_f1: 0.3723
 epoch: 70, train_loss: 1.0075, test_loss: 1.1219, test_f1: 0.3718
 epoch: 71, train_loss: 1.0137, test_loss: 1.1263, test_f1: 0.3804
 epoch: 72, train_loss: 1.0152, test_loss: 1.1216, test_f1: 0.3732
 epoch: 73, train_loss: 1.0151, test_loss: 1.1639, test_f1: 0.3459
 epoch: 74, train_loss: 1.0148, test_loss: 1.1212, test_f1: 0.3820
 epoch: 75, train_loss: 1.0026, test_loss: 1.1277, test_f1: 0.3804
 epoch: 76, train_loss: 1.0010, test_loss: 1.1294, test_f1: 0.3772
 epoch: 77, train_loss: 1.0086, test_loss: 1.1373, test_f1: 0.3726
 epoch: 78, train_loss: 0.9952, test_loss: 1.1510, test_f1: 0.3542
 epoch: 79, train_loss: 1.0038, test_loss: 1.1120, test_f1: 0.3599
 epoch: 80, train_loss: 1.0202, test_loss: 1.1193, test_f1: 0.3590
 epoch: 81, train_loss: 1.0011, test_loss: 1.1293, test_f1: 0.3595
 epoch: 82, train_loss: 1.0173, test_loss: 1.2465, test_f1: 0.3384
 epoch: 83, train_loss: 1.0261, test_loss: 1.1356, test_f1: 0.3395
 epoch: 84, train_loss: 1.0204, test_loss: 1.1039, test_f1: 0.3468
 epoch: 85, train_loss: 1.0189, test_loss: 1.0917, test_f1: 0.3468
 epoch: 86, train_loss: 1.0181, test_loss: 1.1158, test_f1: 0.3395
 epoch: 87, train_loss: 1.0138, test_loss: 1.0836, test_f1: 0.3468
 epoch: 88, train_loss: 1.0142, test_loss: 1.0936, test_f1: 0.3468
 epoch: 89, train_loss: 1.0153, test_loss: 1.1183, test_f1: 0.3395
 epoch: 90, train_loss: 1.0148, test_loss: 1.0970, test_f1: 0.3415
 epoch: 91, train_loss: 1.0051, test_loss: 1.1158, test_f1: 0.3395
 epoch: 92, train_loss: 1.0067, test_loss: 1.1340, test_f1: 0.3395
 epoch: 93, train_loss: 1.0070, test_loss: 1.1475, test_f1: 0.3344
 epoch: 94, train_loss: 1.0210, test_loss: 1.1407, test_f1: 0.3445
 epoch: 95, train_loss: 1.0073, test_loss: 1.1148, test_f1: 0.3347
 epoch: 96, train_loss: 1.0051, test_loss: 1.1256, test_f1: 0.3602
 epoch: 97, train_loss: 1.0046, test_loss: 1.1450, test_f1: 0.3552
 epoch: 98, train_loss: 0.9989, test_loss: 1.1124, test_f1: 0.3717
 epoch: 99, train_loss: 1.0031, test_loss: 1.1524, test_f1: 0.3331
##################ITERATION #3 ****************************************
 epoch: 0, train_loss: 1.3937, test_loss: 1.3950, test_f1: 0.2281
 epoch: 1, train_loss: 1.3000, test_loss: 1.3355, test_f1: 0.2281
 epoch: 2, train_loss: 1.2651, test_loss: 1.3055, test_f1: 0.2281
 epoch: 3, train_loss: 1.2548, test_loss: 1.3038, test_f1: 0.2281
 epoch: 4, train_loss: 1.2529, test_loss: 1.3070, test_f1: 0.2281
 epoch: 5, train_loss: 1.2535, test_loss: 1.3049, test_f1: 0.2281
 epoch: 6, train_loss: 1.2529, test_loss: 1.3018, test_f1: 0.2281
 epoch: 7, train_loss: 1.2532, test_loss: 1.3041, test_f1: 0.2281
 epoch: 8, train_loss: 1.2524, test_loss: 1.3072, test_f1: 0.2281
 epoch: 9, train_loss: 1.2556, test_loss: 1.3101, test_f1: 0.2281
 epoch: 10, train_loss: 1.2549, test_loss: 1.3027, test_f1: 0.2281
 epoch: 11, train_loss: 1.2534, test_loss: 1.3075, test_f1: 0.2281
 epoch: 12, train_loss: 1.2529, test_loss: 1.3044, test_f1: 0.2281
 epoch: 13, train_loss: 1.2530, test_loss: 1.3054, test_f1: 0.2281
 epoch: 14, train_loss: 1.2537, test_loss: 1.3057, test_f1: 0.2281
 epoch: 15, train_loss: 1.2534, test_loss: 1.3033, test_f1: 0.2281
 epoch: 16, train_loss: 1.2534, test_loss: 1.3043, test_f1: 0.2281
 epoch: 17, train_loss: 1.2525, test_loss: 1.3064, test_f1: 0.2281
 epoch: 18, train_loss: 1.2534, test_loss: 1.3059, test_f1: 0.2281
 epoch: 19, train_loss: 1.2531, test_loss: 1.3035, test_f1: 0.2281
 epoch: 20, train_loss: 1.2531, test_loss: 1.3058, test_f1: 0.2281
 epoch: 21, train_loss: 1.2530, test_loss: 1.3040, test_f1: 0.2281
 epoch: 22, train_loss: 1.2529, test_loss: 1.3026, test_f1: 0.2281
 epoch: 23, train_loss: 1.2535, test_loss: 1.3059, test_f1: 0.2281
 epoch: 24, train_loss: 1.2528, test_loss: 1.3029, test_f1: 0.2281
 epoch: 25, train_loss: 1.2526, test_loss: 1.3041, test_f1: 0.2281
 epoch: 26, train_loss: 1.2530, test_loss: 1.3033, test_f1: 0.2281
 epoch: 27, train_loss: 1.2531, test_loss: 1.3082, test_f1: 0.2281
 epoch: 28, train_loss: 1.2525, test_loss: 1.3032, test_f1: 0.2281
 epoch: 29, train_loss: 1.2530, test_loss: 1.3049, test_f1: 0.2281
 epoch: 30, train_loss: 1.2535, test_loss: 1.3036, test_f1: 0.2281
 epoch: 31, train_loss: 1.2529, test_loss: 1.3081, test_f1: 0.2281
 epoch: 32, train_loss: 1.2543, test_loss: 1.3062, test_f1: 0.2281
 epoch: 33, train_loss: 1.2533, test_loss: 1.3056, test_f1: 0.2281
 epoch: 34, train_loss: 1.2529, test_loss: 1.3065, test_f1: 0.2281
 epoch: 35, train_loss: 1.2528, test_loss: 1.3040, test_f1: 0.2281
 epoch: 36, train_loss: 1.2525, test_loss: 1.3023, test_f1: 0.2281
 epoch: 37, train_loss: 1.2538, test_loss: 1.3076, test_f1: 0.2281
 epoch: 38, train_loss: 1.2560, test_loss: 1.3055, test_f1: 0.2281
 epoch: 39, train_loss: 1.2541, test_loss: 1.3055, test_f1: 0.2281
 epoch: 40, train_loss: 1.2558, test_loss: 1.3061, test_f1: 0.2281
 epoch: 41, train_loss: 1.2540, test_loss: 1.3083, test_f1: 0.2281
 epoch: 42, train_loss: 1.2546, test_loss: 1.3058, test_f1: 0.2281
 epoch: 43, train_loss: 1.2529, test_loss: 1.3050, test_f1: 0.2281
 epoch: 44, train_loss: 1.2531, test_loss: 1.3042, test_f1: 0.2281
 epoch: 45, train_loss: 1.2539, test_loss: 1.3049, test_f1: 0.2281
 epoch: 46, train_loss: 1.2546, test_loss: 1.3101, test_f1: 0.2281
 epoch: 47, train_loss: 1.2524, test_loss: 1.2997, test_f1: 0.2281
 epoch: 48, train_loss: 1.2536, test_loss: 1.3030, test_f1: 0.2281
 epoch: 49, train_loss: 1.2538, test_loss: 1.3093, test_f1: 0.2281
 epoch: 50, train_loss: 1.2556, test_loss: 1.3008, test_f1: 0.2281
 epoch: 51, train_loss: 1.2535, test_loss: 1.3062, test_f1: 0.2281
 epoch: 52, train_loss: 1.2524, test_loss: 1.3042, test_f1: 0.2281
 epoch: 53, train_loss: 1.2523, test_loss: 1.3049, test_f1: 0.2281
 epoch: 54, train_loss: 1.2521, test_loss: 1.3073, test_f1: 0.2281
 epoch: 55, train_loss: 1.2526, test_loss: 1.3067, test_f1: 0.2281
 epoch: 56, train_loss: 1.2527, test_loss: 1.3070, test_f1: 0.2281
 epoch: 57, train_loss: 1.2523, test_loss: 1.3028, test_f1: 0.2281
 epoch: 58, train_loss: 1.2529, test_loss: 1.3029, test_f1: 0.2281
 epoch: 59, train_loss: 1.2526, test_loss: 1.3048, test_f1: 0.2281
 epoch: 60, train_loss: 1.2525, test_loss: 1.3026, test_f1: 0.2281
 epoch: 61, train_loss: 1.2522, test_loss: 1.3049, test_f1: 0.2281
 epoch: 62, train_loss: 1.2526, test_loss: 1.3032, test_f1: 0.2281
 epoch: 63, train_loss: 1.2524, test_loss: 1.3051, test_f1: 0.2281
 epoch: 64, train_loss: 1.2525, test_loss: 1.3064, test_f1: 0.2281
 epoch: 65, train_loss: 1.2524, test_loss: 1.3058, test_f1: 0.2281
 epoch: 66, train_loss: 1.2527, test_loss: 1.3045, test_f1: 0.2281
 epoch: 67, train_loss: 1.2529, test_loss: 1.3067, test_f1: 0.2281
 epoch: 68, train_loss: 1.2527, test_loss: 1.3035, test_f1: 0.2281
 epoch: 69, train_loss: 1.2521, test_loss: 1.3064, test_f1: 0.2281
 epoch: 70, train_loss: 1.2536, test_loss: 1.3033, test_f1: 0.2281
 epoch: 71, train_loss: 1.2527, test_loss: 1.3065, test_f1: 0.2281
 epoch: 72, train_loss: 1.2524, test_loss: 1.3054, test_f1: 0.2281
 epoch: 73, train_loss: 1.2528, test_loss: 1.3025, test_f1: 0.2281
 epoch: 74, train_loss: 1.2529, test_loss: 1.3053, test_f1: 0.2281
 epoch: 75, train_loss: 1.2522, test_loss: 1.3050, test_f1: 0.2281
 epoch: 76, train_loss: 1.2531, test_loss: 1.3060, test_f1: 0.2281
 epoch: 77, train_loss: 1.2526, test_loss: 1.3065, test_f1: 0.2281
 epoch: 78, train_loss: 1.2530, test_loss: 1.3046, test_f1: 0.2281
 epoch: 79, train_loss: 1.2524, test_loss: 1.3039, test_f1: 0.2281
 epoch: 80, train_loss: 1.2530, test_loss: 1.3036, test_f1: 0.2281
 epoch: 81, train_loss: 1.2526, test_loss: 1.3075, test_f1: 0.2281
 epoch: 82, train_loss: 1.2525, test_loss: 1.3054, test_f1: 0.2281
 epoch: 83, train_loss: 1.2523, test_loss: 1.3052, test_f1: 0.2281
 epoch: 84, train_loss: 1.2526, test_loss: 1.3058, test_f1: 0.2281
 epoch: 85, train_loss: 1.2527, test_loss: 1.3069, test_f1: 0.2281
 epoch: 86, train_loss: 1.2531, test_loss: 1.3033, test_f1: 0.2281
 epoch: 87, train_loss: 1.2532, test_loss: 1.3040, test_f1: 0.2281
 epoch: 88, train_loss: 1.2526, test_loss: 1.3034, test_f1: 0.2281
 epoch: 89, train_loss: 1.2525, test_loss: 1.3072, test_f1: 0.2281
 epoch: 90, train_loss: 1.2528, test_loss: 1.3055, test_f1: 0.2281
 epoch: 91, train_loss: 1.2527, test_loss: 1.3076, test_f1: 0.2281
 epoch: 92, train_loss: 1.2529, test_loss: 1.3089, test_f1: 0.2281
 epoch: 93, train_loss: 1.2526, test_loss: 1.3039, test_f1: 0.2281
 epoch: 94, train_loss: 1.2521, test_loss: 1.3047, test_f1: 0.2281
 epoch: 95, train_loss: 1.2525, test_loss: 1.3060, test_f1: 0.2281
 epoch: 96, train_loss: 1.2524, test_loss: 1.3060, test_f1: 0.2281
 epoch: 97, train_loss: 1.2523, test_loss: 1.3022, test_f1: 0.2281
 epoch: 98, train_loss: 1.2534, test_loss: 1.3051, test_f1: 0.2281
 epoch: 99, train_loss: 1.2530, test_loss: 1.3064, test_f1: 0.2281
##################ITERATION #4 ****************************************
 epoch: 0, train_loss: 1.2871, test_loss: 1.3112, test_f1: 0.2281
 epoch: 1, train_loss: 1.2557, test_loss: 1.3074, test_f1: 0.2281
 epoch: 2, train_loss: 1.2528, test_loss: 1.3045, test_f1: 0.2281
 epoch: 3, train_loss: 1.2532, test_loss: 1.3067, test_f1: 0.2281
 epoch: 4, train_loss: 1.2526, test_loss: 1.3016, test_f1: 0.2281
 epoch: 5, train_loss: 1.2539, test_loss: 1.3024, test_f1: 0.2281
 epoch: 6, train_loss: 1.2525, test_loss: 1.3060, test_f1: 0.2281
 epoch: 7, train_loss: 1.2525, test_loss: 1.3041, test_f1: 0.2281
 epoch: 8, train_loss: 1.2530, test_loss: 1.3042, test_f1: 0.2281
 epoch: 9, train_loss: 1.2527, test_loss: 1.3045, test_f1: 0.2281
 epoch: 10, train_loss: 1.2536, test_loss: 1.3029, test_f1: 0.2281
 epoch: 11, train_loss: 1.2538, test_loss: 1.3041, test_f1: 0.2281
 epoch: 12, train_loss: 1.2569, test_loss: 1.3054, test_f1: 0.2281
 epoch: 13, train_loss: 1.2549, test_loss: 1.3062, test_f1: 0.2281
 epoch: 14, train_loss: 1.2539, test_loss: 1.3056, test_f1: 0.2281
 epoch: 15, train_loss: 1.2526, test_loss: 1.3017, test_f1: 0.2281
 epoch: 16, train_loss: 1.2548, test_loss: 1.3078, test_f1: 0.2281
 epoch: 17, train_loss: 1.2527, test_loss: 1.3029, test_f1: 0.2281
 epoch: 18, train_loss: 1.2529, test_loss: 1.3053, test_f1: 0.2281
 epoch: 19, train_loss: 1.2544, test_loss: 1.3076, test_f1: 0.2281
 epoch: 20, train_loss: 1.2549, test_loss: 1.2999, test_f1: 0.2281
 epoch: 21, train_loss: 1.2559, test_loss: 1.3069, test_f1: 0.2281
 epoch: 22, train_loss: 1.2548, test_loss: 1.3067, test_f1: 0.2281
 epoch: 23, train_loss: 1.2535, test_loss: 1.3043, test_f1: 0.2281
 epoch: 24, train_loss: 1.2542, test_loss: 1.3070, test_f1: 0.2281
 epoch: 25, train_loss: 1.2535, test_loss: 1.3021, test_f1: 0.2281
 epoch: 26, train_loss: 1.2533, test_loss: 1.3076, test_f1: 0.2281
 epoch: 27, train_loss: 1.2537, test_loss: 1.3048, test_f1: 0.2281
 epoch: 28, train_loss: 1.2526, test_loss: 1.3084, test_f1: 0.2281
 epoch: 29, train_loss: 1.2539, test_loss: 1.3060, test_f1: 0.2281
 epoch: 30, train_loss: 1.2532, test_loss: 1.3064, test_f1: 0.2281
 epoch: 31, train_loss: 1.2528, test_loss: 1.3044, test_f1: 0.2281
 epoch: 32, train_loss: 1.2525, test_loss: 1.3061, test_f1: 0.2281
 epoch: 33, train_loss: 1.2534, test_loss: 1.3034, test_f1: 0.2281
 epoch: 34, train_loss: 1.2552, test_loss: 1.3011, test_f1: 0.2281
 epoch: 35, train_loss: 1.2541, test_loss: 1.3082, test_f1: 0.2281
 epoch: 36, train_loss: 1.2539, test_loss: 1.3038, test_f1: 0.2281
 epoch: 37, train_loss: 1.2544, test_loss: 1.3039, test_f1: 0.2281
 epoch: 38, train_loss: 1.2542, test_loss: 1.3058, test_f1: 0.2281
 epoch: 39, train_loss: 1.2529, test_loss: 1.3018, test_f1: 0.2281
 epoch: 40, train_loss: 1.2541, test_loss: 1.3116, test_f1: 0.2281
 epoch: 41, train_loss: 1.2541, test_loss: 1.2999, test_f1: 0.2281
 epoch: 42, train_loss: 1.2529, test_loss: 1.3077, test_f1: 0.2281
 epoch: 43, train_loss: 1.2538, test_loss: 1.3033, test_f1: 0.2281
 epoch: 44, train_loss: 1.2529, test_loss: 1.3059, test_f1: 0.2281
 epoch: 45, train_loss: 1.2536, test_loss: 1.3058, test_f1: 0.2281
 epoch: 46, train_loss: 1.2528, test_loss: 1.3086, test_f1: 0.2281
 epoch: 47, train_loss: 1.2537, test_loss: 1.3043, test_f1: 0.2281
 epoch: 48, train_loss: 1.2532, test_loss: 1.3074, test_f1: 0.2281
 epoch: 49, train_loss: 1.2538, test_loss: 1.3040, test_f1: 0.2281
 epoch: 50, train_loss: 1.2539, test_loss: 1.3076, test_f1: 0.2281
 epoch: 51, train_loss: 1.2538, test_loss: 1.3057, test_f1: 0.2281
 epoch: 52, train_loss: 1.2528, test_loss: 1.3073, test_f1: 0.2281
 epoch: 53, train_loss: 1.2522, test_loss: 1.3036, test_f1: 0.2281
 epoch: 54, train_loss: 1.2522, test_loss: 1.3032, test_f1: 0.2281
 epoch: 55, train_loss: 1.2525, test_loss: 1.3048, test_f1: 0.2281
 epoch: 56, train_loss: 1.2524, test_loss: 1.3074, test_f1: 0.2281
 epoch: 57, train_loss: 1.2525, test_loss: 1.3074, test_f1: 0.2281
 epoch: 58, train_loss: 1.2523, test_loss: 1.3035, test_f1: 0.2281
 epoch: 59, train_loss: 1.2523, test_loss: 1.3041, test_f1: 0.2281
 epoch: 60, train_loss: 1.2523, test_loss: 1.3030, test_f1: 0.2281
 epoch: 61, train_loss: 1.2527, test_loss: 1.3019, test_f1: 0.2281
 epoch: 62, train_loss: 1.2523, test_loss: 1.3062, test_f1: 0.2281
 epoch: 63, train_loss: 1.2525, test_loss: 1.3039, test_f1: 0.2281
 epoch: 64, train_loss: 1.2523, test_loss: 1.3027, test_f1: 0.2281
 epoch: 65, train_loss: 1.2522, test_loss: 1.3041, test_f1: 0.2281
 epoch: 66, train_loss: 1.2521, test_loss: 1.3046, test_f1: 0.2281
 epoch: 67, train_loss: 1.2525, test_loss: 1.3027, test_f1: 0.2281
 epoch: 68, train_loss: 1.2526, test_loss: 1.3036, test_f1: 0.2281
 epoch: 69, train_loss: 1.2529, test_loss: 1.3076, test_f1: 0.2281
 epoch: 70, train_loss: 1.2527, test_loss: 1.3034, test_f1: 0.2281
 epoch: 71, train_loss: 1.2532, test_loss: 1.3008, test_f1: 0.2281
 epoch: 72, train_loss: 1.2535, test_loss: 1.3051, test_f1: 0.2281
 epoch: 73, train_loss: 1.2522, test_loss: 1.3078, test_f1: 0.2281
 epoch: 74, train_loss: 1.2528, test_loss: 1.3062, test_f1: 0.2281
 epoch: 75, train_loss: 1.2523, test_loss: 1.3047, test_f1: 0.2281
 epoch: 76, train_loss: 1.2530, test_loss: 1.3032, test_f1: 0.2281
 epoch: 77, train_loss: 1.2529, test_loss: 1.3060, test_f1: 0.2281
 epoch: 78, train_loss: 1.2523, test_loss: 1.3043, test_f1: 0.2281
 epoch: 79, train_loss: 1.2528, test_loss: 1.3032, test_f1: 0.2281
 epoch: 80, train_loss: 1.2523, test_loss: 1.3034, test_f1: 0.2281
 epoch: 81, train_loss: 1.2525, test_loss: 1.3033, test_f1: 0.2281
 epoch: 82, train_loss: 1.2533, test_loss: 1.3007, test_f1: 0.2281
 epoch: 83, train_loss: 1.2527, test_loss: 1.3038, test_f1: 0.2281
 epoch: 84, train_loss: 1.2522, test_loss: 1.3056, test_f1: 0.2281
 epoch: 85, train_loss: 1.2525, test_loss: 1.3053, test_f1: 0.2281
 epoch: 86, train_loss: 1.2526, test_loss: 1.3050, test_f1: 0.2281
 epoch: 87, train_loss: 1.2539, test_loss: 1.3013, test_f1: 0.2281
 epoch: 88, train_loss: 1.2527, test_loss: 1.3045, test_f1: 0.2281
 epoch: 89, train_loss: 1.2528, test_loss: 1.3058, test_f1: 0.2281
 epoch: 90, train_loss: 1.2530, test_loss: 1.3025, test_f1: 0.2281
 epoch: 91, train_loss: 1.2521, test_loss: 1.3055, test_f1: 0.2281
 epoch: 92, train_loss: 1.2528, test_loss: 1.3071, test_f1: 0.2281
 epoch: 93, train_loss: 1.2527, test_loss: 1.3045, test_f1: 0.2281
 epoch: 94, train_loss: 1.2522, test_loss: 1.3036, test_f1: 0.2281
 epoch: 95, train_loss: 1.2522, test_loss: 1.3042, test_f1: 0.2281
 epoch: 96, train_loss: 1.2522, test_loss: 1.3047, test_f1: 0.2281
 epoch: 97, train_loss: 1.2525, test_loss: 1.3052, test_f1: 0.2281
 epoch: 98, train_loss: 1.2527, test_loss: 1.3023, test_f1: 0.2281
 epoch: 99, train_loss: 1.2527, test_loss: 1.3059, test_f1: 0.2281
##################ITERATION #5 ****************************************
 epoch: 0, train_loss: 1.2669, test_loss: 1.3059, test_f1: 0.2281
 epoch: 1, train_loss: 1.2562, test_loss: 1.3014, test_f1: 0.2281
 epoch: 2, train_loss: 1.2536, test_loss: 1.3067, test_f1: 0.2281
 epoch: 3, train_loss: 1.2528, test_loss: 1.3060, test_f1: 0.2281
 epoch: 4, train_loss: 1.2534, test_loss: 1.3047, test_f1: 0.2281
 epoch: 5, train_loss: 1.2542, test_loss: 1.3059, test_f1: 0.2281
 epoch: 6, train_loss: 1.2534, test_loss: 1.3013, test_f1: 0.2281
 epoch: 7, train_loss: 1.2524, test_loss: 1.3046, test_f1: 0.2281
 epoch: 8, train_loss: 1.2534, test_loss: 1.3092, test_f1: 0.2281
 epoch: 9, train_loss: 1.2557, test_loss: 1.3033, test_f1: 0.2281
 epoch: 10, train_loss: 1.2572, test_loss: 1.3027, test_f1: 0.2281
 epoch: 11, train_loss: 1.2531, test_loss: 1.3047, test_f1: 0.2281
 epoch: 12, train_loss: 1.2533, test_loss: 1.3092, test_f1: 0.2281
 epoch: 13, train_loss: 1.2535, test_loss: 1.3005, test_f1: 0.2281
 epoch: 14, train_loss: 1.2528, test_loss: 1.3089, test_f1: 0.2281
 epoch: 15, train_loss: 1.2526, test_loss: 1.3067, test_f1: 0.2281
 epoch: 16, train_loss: 1.2560, test_loss: 1.3102, test_f1: 0.2281
 epoch: 17, train_loss: 1.2527, test_loss: 1.3064, test_f1: 0.2281
 epoch: 18, train_loss: 1.2535, test_loss: 1.3028, test_f1: 0.2281
 epoch: 19, train_loss: 1.2543, test_loss: 1.3026, test_f1: 0.2281
 epoch: 20, train_loss: 1.2524, test_loss: 1.3050, test_f1: 0.2281
 epoch: 21, train_loss: 1.2545, test_loss: 1.3076, test_f1: 0.2281
 epoch: 22, train_loss: 1.2533, test_loss: 1.3063, test_f1: 0.2281
 epoch: 23, train_loss: 1.2525, test_loss: 1.3060, test_f1: 0.2281
 epoch: 24, train_loss: 1.2529, test_loss: 1.3061, test_f1: 0.2281
 epoch: 25, train_loss: 1.2533, test_loss: 1.3068, test_f1: 0.2281
 epoch: 26, train_loss: 1.2535, test_loss: 1.3023, test_f1: 0.2281
 epoch: 27, train_loss: 1.2526, test_loss: 1.3057, test_f1: 0.2281
 epoch: 28, train_loss: 1.2538, test_loss: 1.3076, test_f1: 0.2281
 epoch: 29, train_loss: 1.2542, test_loss: 1.3034, test_f1: 0.2281
 epoch: 30, train_loss: 1.2534, test_loss: 1.3056, test_f1: 0.2281
 epoch: 31, train_loss: 1.2530, test_loss: 1.3061, test_f1: 0.2281
 epoch: 32, train_loss: 1.2525, test_loss: 1.3063, test_f1: 0.2281
 epoch: 33, train_loss: 1.2529, test_loss: 1.3025, test_f1: 0.2281
 epoch: 34, train_loss: 1.2535, test_loss: 1.3068, test_f1: 0.2281
 epoch: 35, train_loss: 1.2533, test_loss: 1.3047, test_f1: 0.2281
 epoch: 36, train_loss: 1.2530, test_loss: 1.3087, test_f1: 0.2281
 epoch: 37, train_loss: 1.2528, test_loss: 1.3038, test_f1: 0.2281
 epoch: 38, train_loss: 1.2540, test_loss: 1.3046, test_f1: 0.2281
 epoch: 39, train_loss: 1.2529, test_loss: 1.3029, test_f1: 0.2281
 epoch: 40, train_loss: 1.2533, test_loss: 1.3097, test_f1: 0.2281
 epoch: 41, train_loss: 1.2536, test_loss: 1.3017, test_f1: 0.2281
 epoch: 42, train_loss: 1.2530, test_loss: 1.3028, test_f1: 0.2281
 epoch: 43, train_loss: 1.2533, test_loss: 1.3062, test_f1: 0.2281
 epoch: 44, train_loss: 1.2530, test_loss: 1.3048, test_f1: 0.2281
 epoch: 45, train_loss: 1.2537, test_loss: 1.2994, test_f1: 0.2281
 epoch: 46, train_loss: 1.2530, test_loss: 1.3074, test_f1: 0.2281
 epoch: 47, train_loss: 1.2549, test_loss: 1.3102, test_f1: 0.2281
 epoch: 48, train_loss: 1.2527, test_loss: 1.3011, test_f1: 0.2281
 epoch: 49, train_loss: 1.2553, test_loss: 1.3047, test_f1: 0.2281
 epoch: 50, train_loss: 1.2533, test_loss: 1.3045, test_f1: 0.2281
 epoch: 51, train_loss: 1.2526, test_loss: 1.3062, test_f1: 0.2281
 epoch: 52, train_loss: 1.2530, test_loss: 1.3073, test_f1: 0.2281
 epoch: 53, train_loss: 1.2526, test_loss: 1.3054, test_f1: 0.2281
 epoch: 54, train_loss: 1.2525, test_loss: 1.3024, test_f1: 0.2281
 epoch: 55, train_loss: 1.2525, test_loss: 1.3057, test_f1: 0.2281
 epoch: 56, train_loss: 1.2524, test_loss: 1.3073, test_f1: 0.2281
 epoch: 57, train_loss: 1.2528, test_loss: 1.3058, test_f1: 0.2281
 epoch: 58, train_loss: 1.2524, test_loss: 1.3064, test_f1: 0.2281
 epoch: 59, train_loss: 1.2531, test_loss: 1.3033, test_f1: 0.2281
 epoch: 60, train_loss: 1.2524, test_loss: 1.3043, test_f1: 0.2281
 epoch: 61, train_loss: 1.2525, test_loss: 1.3066, test_f1: 0.2281
 epoch: 62, train_loss: 1.2526, test_loss: 1.3084, test_f1: 0.2281
 epoch: 63, train_loss: 1.2527, test_loss: 1.3062, test_f1: 0.2281
 epoch: 64, train_loss: 1.2526, test_loss: 1.3027, test_f1: 0.2281
 epoch: 65, train_loss: 1.2522, test_loss: 1.3047, test_f1: 0.2281
 epoch: 66, train_loss: 1.2525, test_loss: 1.3043, test_f1: 0.2281
 epoch: 67, train_loss: 1.2529, test_loss: 1.3050, test_f1: 0.2281
 epoch: 68, train_loss: 1.2523, test_loss: 1.3040, test_f1: 0.2281
 epoch: 69, train_loss: 1.2525, test_loss: 1.3039, test_f1: 0.2281
 epoch: 70, train_loss: 1.2534, test_loss: 1.3066, test_f1: 0.2281
 epoch: 71, train_loss: 1.2529, test_loss: 1.3054, test_f1: 0.2281
 epoch: 72, train_loss: 1.2529, test_loss: 1.3029, test_f1: 0.2281
 epoch: 73, train_loss: 1.2526, test_loss: 1.3047, test_f1: 0.2281
 epoch: 74, train_loss: 1.2526, test_loss: 1.3045, test_f1: 0.2281
 epoch: 75, train_loss: 1.2522, test_loss: 1.3056, test_f1: 0.2281
 epoch: 76, train_loss: 1.2532, test_loss: 1.3065, test_f1: 0.2281
 epoch: 77, train_loss: 1.2522, test_loss: 1.3056, test_f1: 0.2281
 epoch: 78, train_loss: 1.2527, test_loss: 1.3047, test_f1: 0.2281
 epoch: 79, train_loss: 1.2523, test_loss: 1.3040, test_f1: 0.2281
 epoch: 80, train_loss: 1.2523, test_loss: 1.3036, test_f1: 0.2281
 epoch: 81, train_loss: 1.2528, test_loss: 1.3041, test_f1: 0.2281
 epoch: 82, train_loss: 1.2525, test_loss: 1.3058, test_f1: 0.2281
 epoch: 83, train_loss: 1.2524, test_loss: 1.3056, test_f1: 0.2281
 epoch: 84, train_loss: 1.2524, test_loss: 1.3024, test_f1: 0.2281
 epoch: 85, train_loss: 1.2522, test_loss: 1.3036, test_f1: 0.2281
 epoch: 86, train_loss: 1.2535, test_loss: 1.3072, test_f1: 0.2281
 epoch: 87, train_loss: 1.2522, test_loss: 1.3070, test_f1: 0.2281
 epoch: 88, train_loss: 1.2536, test_loss: 1.3049, test_f1: 0.2281
 epoch: 89, train_loss: 1.2547, test_loss: 1.3036, test_f1: 0.2281
 epoch: 90, train_loss: 1.2529, test_loss: 1.3058, test_f1: 0.2281
 epoch: 91, train_loss: 1.2522, test_loss: 1.3060, test_f1: 0.2281
 epoch: 92, train_loss: 1.2525, test_loss: 1.3056, test_f1: 0.2281
 epoch: 93, train_loss: 1.2531, test_loss: 1.3042, test_f1: 0.2281
 epoch: 94, train_loss: 1.2526, test_loss: 1.3057, test_f1: 0.2281
 epoch: 95, train_loss: 1.2527, test_loss: 1.3035, test_f1: 0.2281
 epoch: 96, train_loss: 1.2523, test_loss: 1.3046, test_f1: 0.2281
 epoch: 97, train_loss: 1.2524, test_loss: 1.3031, test_f1: 0.2281
 epoch: 98, train_loss: 1.2528, test_loss: 1.3056, test_f1: 0.2281
 epoch: 99, train_loss: 1.2523, test_loss: 1.3040, test_f1: 0.2281
##################ITERATION #6 ****************************************
 epoch: 0, train_loss: 1.2552, test_loss: 1.3090, test_f1: 0.2281
 epoch: 1, train_loss: 1.2549, test_loss: 1.3043, test_f1: 0.2281
 epoch: 2, train_loss: 1.2528, test_loss: 1.3026, test_f1: 0.2281
 epoch: 3, train_loss: 1.2535, test_loss: 1.3068, test_f1: 0.2281
 epoch: 4, train_loss: 1.2531, test_loss: 1.3096, test_f1: 0.2281
 epoch: 5, train_loss: 1.2535, test_loss: 1.3046, test_f1: 0.2281
 epoch: 6, train_loss: 1.2535, test_loss: 1.3017, test_f1: 0.2281
 epoch: 7, train_loss: 1.2556, test_loss: 1.3066, test_f1: 0.2281
 epoch: 8, train_loss: 1.2530, test_loss: 1.3045, test_f1: 0.2281
 epoch: 9, train_loss: 1.2532, test_loss: 1.3063, test_f1: 0.2281
 epoch: 10, train_loss: 1.2522, test_loss: 1.3035, test_f1: 0.2281
 epoch: 11, train_loss: 1.2538, test_loss: 1.3048, test_f1: 0.2281
 epoch: 12, train_loss: 1.2531, test_loss: 1.3085, test_f1: 0.2281
 epoch: 13, train_loss: 1.2532, test_loss: 1.3029, test_f1: 0.2281
 epoch: 14, train_loss: 1.2533, test_loss: 1.3029, test_f1: 0.2281
 epoch: 15, train_loss: 1.2534, test_loss: 1.3034, test_f1: 0.2281
 epoch: 16, train_loss: 1.2531, test_loss: 1.3058, test_f1: 0.2281
 epoch: 17, train_loss: 1.2543, test_loss: 1.3079, test_f1: 0.2281
 epoch: 18, train_loss: 1.2548, test_loss: 1.3020, test_f1: 0.2281
 epoch: 19, train_loss: 1.2541, test_loss: 1.3086, test_f1: 0.2281
 epoch: 20, train_loss: 1.2533, test_loss: 1.3077, test_f1: 0.2281
 epoch: 21, train_loss: 1.2534, test_loss: 1.3016, test_f1: 0.2281
 epoch: 22, train_loss: 1.2528, test_loss: 1.3055, test_f1: 0.2281
 epoch: 23, train_loss: 1.2538, test_loss: 1.3095, test_f1: 0.2281
 epoch: 24, train_loss: 1.2547, test_loss: 1.3038, test_f1: 0.2281
 epoch: 25, train_loss: 1.2534, test_loss: 1.3080, test_f1: 0.2281
 epoch: 26, train_loss: 1.2539, test_loss: 1.3043, test_f1: 0.2281
 epoch: 27, train_loss: 1.2533, test_loss: 1.3064, test_f1: 0.2281
 epoch: 28, train_loss: 1.2529, test_loss: 1.3024, test_f1: 0.2281
 epoch: 29, train_loss: 1.2528, test_loss: 1.3039, test_f1: 0.2281
 epoch: 30, train_loss: 1.2529, test_loss: 1.3046, test_f1: 0.2281
 epoch: 31, train_loss: 1.2528, test_loss: 1.3053, test_f1: 0.2281
 epoch: 32, train_loss: 1.2530, test_loss: 1.3026, test_f1: 0.2281
 epoch: 33, train_loss: 1.2547, test_loss: 1.3030, test_f1: 0.2281
 epoch: 34, train_loss: 1.2527, test_loss: 1.3046, test_f1: 0.2281
 epoch: 35, train_loss: 1.2532, test_loss: 1.3046, test_f1: 0.2281
 epoch: 36, train_loss: 1.2551, test_loss: 1.3062, test_f1: 0.2281
 epoch: 37, train_loss: 1.2525, test_loss: 1.3022, test_f1: 0.2281
 epoch: 38, train_loss: 1.2528, test_loss: 1.3055, test_f1: 0.2281
 epoch: 39, train_loss: 1.2537, test_loss: 1.3069, test_f1: 0.2281
 epoch: 40, train_loss: 1.2529, test_loss: 1.3033, test_f1: 0.2281
 epoch: 41, train_loss: 1.2551, test_loss: 1.3011, test_f1: 0.2281
 epoch: 42, train_loss: 1.2529, test_loss: 1.3085, test_f1: 0.2281
 epoch: 43, train_loss: 1.2534, test_loss: 1.3049, test_f1: 0.2281
 epoch: 44, train_loss: 1.2531, test_loss: 1.3062, test_f1: 0.2281
 epoch: 45, train_loss: 1.2526, test_loss: 1.3050, test_f1: 0.2281
 epoch: 46, train_loss: 1.2531, test_loss: 1.3033, test_f1: 0.2281
 epoch: 47, train_loss: 1.2534, test_loss: 1.3049, test_f1: 0.2281
 epoch: 48, train_loss: 1.2529, test_loss: 1.3026, test_f1: 0.2281
 epoch: 49, train_loss: 1.2527, test_loss: 1.3020, test_f1: 0.2281
 epoch: 50, train_loss: 1.2528, test_loss: 1.3058, test_f1: 0.2281
 epoch: 51, train_loss: 1.2535, test_loss: 1.3054, test_f1: 0.2281
 epoch: 52, train_loss: 1.2528, test_loss: 1.3060, test_f1: 0.2281
 epoch: 53, train_loss: 1.2528, test_loss: 1.3020, test_f1: 0.2281
 epoch: 54, train_loss: 1.2525, test_loss: 1.3052, test_f1: 0.2281
 epoch: 55, train_loss: 1.2528, test_loss: 1.3053, test_f1: 0.2281
 epoch: 56, train_loss: 1.2531, test_loss: 1.3020, test_f1: 0.2281
 epoch: 57, train_loss: 1.2523, test_loss: 1.3035, test_f1: 0.2281
 epoch: 58, train_loss: 1.2526, test_loss: 1.3054, test_f1: 0.2281
 epoch: 59, train_loss: 1.2526, test_loss: 1.3044, test_f1: 0.2281
 epoch: 60, train_loss: 1.2533, test_loss: 1.3045, test_f1: 0.2281
 epoch: 61, train_loss: 1.2535, test_loss: 1.3057, test_f1: 0.2281
 epoch: 62, train_loss: 1.2521, test_loss: 1.3055, test_f1: 0.2281
 epoch: 63, train_loss: 1.2526, test_loss: 1.3042, test_f1: 0.2281
 epoch: 64, train_loss: 1.2525, test_loss: 1.3039, test_f1: 0.2281
 epoch: 65, train_loss: 1.2519, test_loss: 1.3021, test_f1: 0.2281
 epoch: 66, train_loss: 1.2524, test_loss: 1.3026, test_f1: 0.2281
 epoch: 67, train_loss: 1.2521, test_loss: 1.3063, test_f1: 0.2281
 epoch: 68, train_loss: 1.2522, test_loss: 1.3043, test_f1: 0.2281
 epoch: 69, train_loss: 1.2525, test_loss: 1.3029, test_f1: 0.2281
 epoch: 70, train_loss: 1.2524, test_loss: 1.3041, test_f1: 0.2281
 epoch: 71, train_loss: 1.2530, test_loss: 1.3049, test_f1: 0.2281
 epoch: 72, train_loss: 1.2525, test_loss: 1.3049, test_f1: 0.2281
 epoch: 73, train_loss: 1.2524, test_loss: 1.3048, test_f1: 0.2281
 epoch: 74, train_loss: 1.2525, test_loss: 1.3042, test_f1: 0.2281
 epoch: 75, train_loss: 1.2524, test_loss: 1.3040, test_f1: 0.2281
 epoch: 76, train_loss: 1.2522, test_loss: 1.3036, test_f1: 0.2281
 epoch: 77, train_loss: 1.2527, test_loss: 1.3061, test_f1: 0.2281
 epoch: 78, train_loss: 1.2526, test_loss: 1.3075, test_f1: 0.2281
 epoch: 79, train_loss: 1.2527, test_loss: 1.3037, test_f1: 0.2281
 epoch: 80, train_loss: 1.2533, test_loss: 1.3029, test_f1: 0.2281
 epoch: 81, train_loss: 1.2526, test_loss: 1.3045, test_f1: 0.2281
 epoch: 82, train_loss: 1.2525, test_loss: 1.3043, test_f1: 0.2281
 epoch: 83, train_loss: 1.2525, test_loss: 1.3071, test_f1: 0.2281
 epoch: 84, train_loss: 1.2522, test_loss: 1.3038, test_f1: 0.2281
 epoch: 85, train_loss: 1.2526, test_loss: 1.3026, test_f1: 0.2281
 epoch: 86, train_loss: 1.2531, test_loss: 1.3036, test_f1: 0.2281
 epoch: 87, train_loss: 1.2525, test_loss: 1.3068, test_f1: 0.2281
 epoch: 88, train_loss: 1.2526, test_loss: 1.3057, test_f1: 0.2281
 epoch: 89, train_loss: 1.2520, test_loss: 1.3020, test_f1: 0.2281
 epoch: 90, train_loss: 1.2535, test_loss: 1.3006, test_f1: 0.2281
 epoch: 91, train_loss: 1.2527, test_loss: 1.3072, test_f1: 0.2281
 epoch: 92, train_loss: 1.2532, test_loss: 1.3039, test_f1: 0.2281
 epoch: 93, train_loss: 1.2526, test_loss: 1.3067, test_f1: 0.2281
 epoch: 94, train_loss: 1.2526, test_loss: 1.3064, test_f1: 0.2281
 epoch: 95, train_loss: 1.2521, test_loss: 1.3027, test_f1: 0.2281
 epoch: 96, train_loss: 1.2530, test_loss: 1.3020, test_f1: 0.2281
 epoch: 97, train_loss: 1.2522, test_loss: 1.3059, test_f1: 0.2281
 epoch: 98, train_loss: 1.2528, test_loss: 1.3054, test_f1: 0.2281
 epoch: 99, train_loss: 1.2530, test_loss: 1.3056, test_f1: 0.2281
##################ITERATION #7 ****************************************
 epoch: 0, train_loss: 1.2584, test_loss: 1.3015, test_f1: 0.2281
 epoch: 1, train_loss: 1.2535, test_loss: 1.3211, test_f1: 0.2771
 epoch: 2, train_loss: 1.2529, test_loss: 1.3025, test_f1: 0.2281
 epoch: 3, train_loss: 1.2525, test_loss: 1.3063, test_f1: 0.2281
 epoch: 4, train_loss: 1.2525, test_loss: 1.3039, test_f1: 0.2281
 epoch: 5, train_loss: 1.2536, test_loss: 1.3003, test_f1: 0.2281
 epoch: 6, train_loss: 1.2537, test_loss: 1.3079, test_f1: 0.2281
 epoch: 7, train_loss: 1.2529, test_loss: 1.3040, test_f1: 0.2281
 epoch: 8, train_loss: 1.2539, test_loss: 1.3026, test_f1: 0.2281
 epoch: 9, train_loss: 1.2545, test_loss: 1.3047, test_f1: 0.2281
 epoch: 10, train_loss: 1.2560, test_loss: 1.3040, test_f1: 0.2281
 epoch: 11, train_loss: 1.2548, test_loss: 1.3100, test_f1: 0.2281
 epoch: 12, train_loss: 1.2556, test_loss: 1.3021, test_f1: 0.2281
 epoch: 13, train_loss: 1.2543, test_loss: 1.3059, test_f1: 0.2281
 epoch: 14, train_loss: 1.2539, test_loss: 1.3054, test_f1: 0.2281
 epoch: 15, train_loss: 1.2550, test_loss: 1.3023, test_f1: 0.2281
 epoch: 16, train_loss: 1.2534, test_loss: 1.3043, test_f1: 0.2281
 epoch: 17, train_loss: 1.2536, test_loss: 1.3073, test_f1: 0.2281
 epoch: 18, train_loss: 1.2560, test_loss: 1.3007, test_f1: 0.2281
 epoch: 19, train_loss: 1.2531, test_loss: 1.3097, test_f1: 0.2281
 epoch: 20, train_loss: 1.2527, test_loss: 1.3032, test_f1: 0.2281
 epoch: 21, train_loss: 1.2539, test_loss: 1.3049, test_f1: 0.2281
 epoch: 22, train_loss: 1.2543, test_loss: 1.3023, test_f1: 0.2281
 epoch: 23, train_loss: 1.2532, test_loss: 1.3076, test_f1: 0.2281
 epoch: 24, train_loss: 1.2548, test_loss: 1.3037, test_f1: 0.2281
 epoch: 25, train_loss: 1.2529, test_loss: 1.3087, test_f1: 0.2281
 epoch: 26, train_loss: 1.2548, test_loss: 1.3032, test_f1: 0.2281
 epoch: 27, train_loss: 1.2552, test_loss: 1.3061, test_f1: 0.2281
 epoch: 28, train_loss: 1.2531, test_loss: 1.3058, test_f1: 0.2281
 epoch: 29, train_loss: 1.2536, test_loss: 1.3042, test_f1: 0.2281
 epoch: 30, train_loss: 1.2530, test_loss: 1.3054, test_f1: 0.2281
 epoch: 31, train_loss: 1.2535, test_loss: 1.3053, test_f1: 0.2281
 epoch: 32, train_loss: 1.2535, test_loss: 1.3041, test_f1: 0.2281
 epoch: 33, train_loss: 1.2535, test_loss: 1.3037, test_f1: 0.2281
 epoch: 34, train_loss: 1.2537, test_loss: 1.3031, test_f1: 0.2281
 epoch: 35, train_loss: 1.2535, test_loss: 1.3037, test_f1: 0.2281
 epoch: 36, train_loss: 1.2536, test_loss: 1.3060, test_f1: 0.2281
 epoch: 37, train_loss: 1.2527, test_loss: 1.3043, test_f1: 0.2281
 epoch: 38, train_loss: 1.2530, test_loss: 1.3047, test_f1: 0.2281
 epoch: 39, train_loss: 1.2533, test_loss: 1.3038, test_f1: 0.2281
 epoch: 40, train_loss: 1.2523, test_loss: 1.3057, test_f1: 0.2281
 epoch: 41, train_loss: 1.2532, test_loss: 1.3066, test_f1: 0.2281
 epoch: 42, train_loss: 1.2526, test_loss: 1.3036, test_f1: 0.2281
 epoch: 43, train_loss: 1.2535, test_loss: 1.3031, test_f1: 0.2281
 epoch: 44, train_loss: 1.2529, test_loss: 1.3037, test_f1: 0.2281
 epoch: 45, train_loss: 1.2543, test_loss: 1.3032, test_f1: 0.2281
 epoch: 46, train_loss: 1.2558, test_loss: 1.3089, test_f1: 0.2281
 epoch: 47, train_loss: 1.2558, test_loss: 1.3069, test_f1: 0.2281
 epoch: 48, train_loss: 1.2556, test_loss: 1.3060, test_f1: 0.2281
 epoch: 49, train_loss: 1.2556, test_loss: 1.3055, test_f1: 0.2281
 epoch: 50, train_loss: 1.2532, test_loss: 1.3048, test_f1: 0.2281
 epoch: 51, train_loss: 1.2528, test_loss: 1.3046, test_f1: 0.2281
 epoch: 52, train_loss: 1.2522, test_loss: 1.3054, test_f1: 0.2281
 epoch: 53, train_loss: 1.2524, test_loss: 1.3048, test_f1: 0.2281
 epoch: 54, train_loss: 1.2525, test_loss: 1.3032, test_f1: 0.2281
 epoch: 55, train_loss: 1.2526, test_loss: 1.3030, test_f1: 0.2281
 epoch: 56, train_loss: 1.2522, test_loss: 1.3028, test_f1: 0.2281
 epoch: 57, train_loss: 1.2524, test_loss: 1.3061, test_f1: 0.2281
 epoch: 58, train_loss: 1.2523, test_loss: 1.3055, test_f1: 0.2281
 epoch: 59, train_loss: 1.2524, test_loss: 1.3047, test_f1: 0.2281
 epoch: 60, train_loss: 1.2531, test_loss: 1.3019, test_f1: 0.2281
 epoch: 61, train_loss: 1.2531, test_loss: 1.3044, test_f1: 0.2281
 epoch: 62, train_loss: 1.2523, test_loss: 1.3040, test_f1: 0.2281
 epoch: 63, train_loss: 1.2524, test_loss: 1.3062, test_f1: 0.2281
 epoch: 64, train_loss: 1.2527, test_loss: 1.3058, test_f1: 0.2281
 epoch: 65, train_loss: 1.2527, test_loss: 1.3048, test_f1: 0.2281
 epoch: 66, train_loss: 1.2527, test_loss: 1.3045, test_f1: 0.2281
 epoch: 67, train_loss: 1.2526, test_loss: 1.3042, test_f1: 0.2281
 epoch: 68, train_loss: 1.2527, test_loss: 1.3040, test_f1: 0.2281
 epoch: 69, train_loss: 1.2527, test_loss: 1.3071, test_f1: 0.2281
 epoch: 70, train_loss: 1.2526, test_loss: 1.3052, test_f1: 0.2281
 epoch: 71, train_loss: 1.2524, test_loss: 1.3036, test_f1: 0.2281
 epoch: 72, train_loss: 1.2526, test_loss: 1.3023, test_f1: 0.2281
 epoch: 73, train_loss: 1.2523, test_loss: 1.3033, test_f1: 0.2281
 epoch: 74, train_loss: 1.2526, test_loss: 1.3060, test_f1: 0.2281
 epoch: 75, train_loss: 1.2527, test_loss: 1.3036, test_f1: 0.2281
 epoch: 76, train_loss: 1.2525, test_loss: 1.3035, test_f1: 0.2281
 epoch: 77, train_loss: 1.2525, test_loss: 1.3057, test_f1: 0.2281
 epoch: 78, train_loss: 1.2529, test_loss: 1.3070, test_f1: 0.2281
 epoch: 79, train_loss: 1.2526, test_loss: 1.3039, test_f1: 0.2281
 epoch: 80, train_loss: 1.2528, test_loss: 1.3036, test_f1: 0.2281
 epoch: 81, train_loss: 1.2532, test_loss: 1.3087, test_f1: 0.2281
 epoch: 82, train_loss: 1.2525, test_loss: 1.3054, test_f1: 0.2281
 epoch: 83, train_loss: 1.2543, test_loss: 1.3027, test_f1: 0.2281
 epoch: 84, train_loss: 1.2528, test_loss: 1.3029, test_f1: 0.2281
 epoch: 85, train_loss: 1.2526, test_loss: 1.3040, test_f1: 0.2281
 epoch: 86, train_loss: 1.2522, test_loss: 1.3077, test_f1: 0.2281
 epoch: 87, train_loss: 1.2527, test_loss: 1.3070, test_f1: 0.2281
 epoch: 88, train_loss: 1.2527, test_loss: 1.3061, test_f1: 0.2281
 epoch: 89, train_loss: 1.2523, test_loss: 1.3048, test_f1: 0.2281
 epoch: 90, train_loss: 1.2525, test_loss: 1.3044, test_f1: 0.2281
 epoch: 91, train_loss: 1.2525, test_loss: 1.3047, test_f1: 0.2281
 epoch: 92, train_loss: 1.2537, test_loss: 1.3065, test_f1: 0.2281
 epoch: 93, train_loss: 1.2525, test_loss: 1.3038, test_f1: 0.2281
 epoch: 94, train_loss: 1.2529, test_loss: 1.3069, test_f1: 0.2281
 epoch: 95, train_loss: 1.2526, test_loss: 1.3070, test_f1: 0.2281
 epoch: 96, train_loss: 1.2523, test_loss: 1.3040, test_f1: 0.2281
 epoch: 97, train_loss: 1.2526, test_loss: 1.3030, test_f1: 0.2281
 epoch: 98, train_loss: 1.2529, test_loss: 1.3035, test_f1: 0.2281
 epoch: 99, train_loss: 1.2528, test_loss: 1.3045, test_f1: 0.2281
##################ITERATION #8 ****************************************
 epoch: 0, train_loss: 1.2575, test_loss: 1.3135, test_f1: 0.2281
 epoch: 1, train_loss: 1.2578, test_loss: 1.3117, test_f1: 0.2281
 epoch: 2, train_loss: 1.2533, test_loss: 1.2993, test_f1: 0.2281
 epoch: 3, train_loss: 1.2530, test_loss: 1.3048, test_f1: 0.2281
 epoch: 4, train_loss: 1.2525, test_loss: 1.3060, test_f1: 0.2281
 epoch: 5, train_loss: 1.2529, test_loss: 1.3063, test_f1: 0.2281
 epoch: 6, train_loss: 1.2541, test_loss: 1.3047, test_f1: 0.2281
 epoch: 7, train_loss: 1.2533, test_loss: 1.3056, test_f1: 0.2281
 epoch: 8, train_loss: 1.2530, test_loss: 1.3075, test_f1: 0.2281
 epoch: 9, train_loss: 1.2533, test_loss: 1.3035, test_f1: 0.2281
 epoch: 10, train_loss: 1.2532, test_loss: 1.3041, test_f1: 0.2281
 epoch: 11, train_loss: 1.2532, test_loss: 1.3064, test_f1: 0.2281
 epoch: 12, train_loss: 1.2529, test_loss: 1.3044, test_f1: 0.2281
 epoch: 13, train_loss: 1.2529, test_loss: 1.3057, test_f1: 0.2281
 epoch: 14, train_loss: 1.2527, test_loss: 1.3026, test_f1: 0.2281
 epoch: 15, train_loss: 1.2534, test_loss: 1.3067, test_f1: 0.2281
 epoch: 16, train_loss: 1.2537, test_loss: 1.3085, test_f1: 0.2281
 epoch: 17, train_loss: 1.2536, test_loss: 1.3067, test_f1: 0.2281
 epoch: 18, train_loss: 1.2530, test_loss: 1.3039, test_f1: 0.2281
 epoch: 19, train_loss: 1.2522, test_loss: 1.3014, test_f1: 0.2281
 epoch: 20, train_loss: 1.2538, test_loss: 1.3060, test_f1: 0.2281
 epoch: 21, train_loss: 1.2529, test_loss: 1.3040, test_f1: 0.2281
 epoch: 22, train_loss: 1.2526, test_loss: 1.3059, test_f1: 0.2281
 epoch: 23, train_loss: 1.2532, test_loss: 1.3030, test_f1: 0.2281
 epoch: 24, train_loss: 1.2531, test_loss: 1.3061, test_f1: 0.2281
 epoch: 25, train_loss: 1.2537, test_loss: 1.3042, test_f1: 0.2281
 epoch: 26, train_loss: 1.2553, test_loss: 1.3034, test_f1: 0.2281
 epoch: 27, train_loss: 1.2535, test_loss: 1.3042, test_f1: 0.2281
 epoch: 28, train_loss: 1.2530, test_loss: 1.3044, test_f1: 0.2281
 epoch: 29, train_loss: 1.2527, test_loss: 1.3045, test_f1: 0.2281
 epoch: 30, train_loss: 1.2542, test_loss: 1.3101, test_f1: 0.2281
 epoch: 31, train_loss: 1.2521, test_loss: 1.3018, test_f1: 0.2281
 epoch: 32, train_loss: 1.2530, test_loss: 1.3029, test_f1: 0.2281
 epoch: 33, train_loss: 1.2534, test_loss: 1.3131, test_f1: 0.2281
 epoch: 34, train_loss: 1.2526, test_loss: 1.3033, test_f1: 0.2281
 epoch: 35, train_loss: 1.2534, test_loss: 1.3023, test_f1: 0.2281
 epoch: 36, train_loss: 1.2527, test_loss: 1.3045, test_f1: 0.2281
 epoch: 37, train_loss: 1.2524, test_loss: 1.3072, test_f1: 0.2281
 epoch: 38, train_loss: 1.2526, test_loss: 1.3051, test_f1: 0.2281
 epoch: 39, train_loss: 1.2530, test_loss: 1.3027, test_f1: 0.2281
 epoch: 40, train_loss: 1.2528, test_loss: 1.3039, test_f1: 0.2281
 epoch: 41, train_loss: 1.2531, test_loss: 1.3062, test_f1: 0.2281
 epoch: 42, train_loss: 1.2532, test_loss: 1.3031, test_f1: 0.2281
 epoch: 43, train_loss: 1.2519, test_loss: 1.3083, test_f1: 0.2281
 epoch: 44, train_loss: 1.2531, test_loss: 1.3053, test_f1: 0.2281
 epoch: 45, train_loss: 1.2529, test_loss: 1.3068, test_f1: 0.2281
 epoch: 46, train_loss: 1.2545, test_loss: 1.3059, test_f1: 0.2281
 epoch: 47, train_loss: 1.2521, test_loss: 1.3046, test_f1: 0.2281
 epoch: 48, train_loss: 1.2531, test_loss: 1.3030, test_f1: 0.2281
 epoch: 49, train_loss: 1.2534, test_loss: 1.3019, test_f1: 0.2281
 epoch: 50, train_loss: 1.2532, test_loss: 1.3073, test_f1: 0.2281
 epoch: 51, train_loss: 1.2535, test_loss: 1.3050, test_f1: 0.2281
 epoch: 52, train_loss: 1.2518, test_loss: 1.3044, test_f1: 0.2281
 epoch: 53, train_loss: 1.2532, test_loss: 1.3049, test_f1: 0.2281
 epoch: 54, train_loss: 1.2525, test_loss: 1.3055, test_f1: 0.2281
 epoch: 55, train_loss: 1.2531, test_loss: 1.3030, test_f1: 0.2281
 epoch: 56, train_loss: 1.2527, test_loss: 1.3048, test_f1: 0.2281
 epoch: 57, train_loss: 1.2532, test_loss: 1.3079, test_f1: 0.2281
 epoch: 58, train_loss: 1.2533, test_loss: 1.3056, test_f1: 0.2281
 epoch: 59, train_loss: 1.2521, test_loss: 1.3058, test_f1: 0.2281
 epoch: 60, train_loss: 1.2522, test_loss: 1.3048, test_f1: 0.2281
 epoch: 61, train_loss: 1.2524, test_loss: 1.3042, test_f1: 0.2281
 epoch: 62, train_loss: 1.2529, test_loss: 1.3026, test_f1: 0.2281
 epoch: 63, train_loss: 1.2528, test_loss: 1.3036, test_f1: 0.2281
 epoch: 64, train_loss: 1.2530, test_loss: 1.3028, test_f1: 0.2281
 epoch: 65, train_loss: 1.2532, test_loss: 1.3039, test_f1: 0.2281
 epoch: 66, train_loss: 1.2527, test_loss: 1.3046, test_f1: 0.2281
 epoch: 67, train_loss: 1.2529, test_loss: 1.3063, test_f1: 0.2281
 epoch: 68, train_loss: 1.2522, test_loss: 1.3035, test_f1: 0.2281
 epoch: 69, train_loss: 1.2525, test_loss: 1.3046, test_f1: 0.2281
 epoch: 70, train_loss: 1.2524, test_loss: 1.3038, test_f1: 0.2281
 epoch: 71, train_loss: 1.2525, test_loss: 1.3048, test_f1: 0.2281
 epoch: 72, train_loss: 1.2524, test_loss: 1.3039, test_f1: 0.2281
 epoch: 73, train_loss: 1.2527, test_loss: 1.3071, test_f1: 0.2281
 epoch: 74, train_loss: 1.2539, test_loss: 1.3065, test_f1: 0.2281
 epoch: 75, train_loss: 1.2524, test_loss: 1.3033, test_f1: 0.2281
 epoch: 76, train_loss: 1.2528, test_loss: 1.3040, test_f1: 0.2281
 epoch: 77, train_loss: 1.2537, test_loss: 1.3031, test_f1: 0.2281
 epoch: 78, train_loss: 1.2532, test_loss: 1.3046, test_f1: 0.2281
 epoch: 79, train_loss: 1.2536, test_loss: 1.3065, test_f1: 0.2281
 epoch: 80, train_loss: 1.2518, test_loss: 1.3020, test_f1: 0.2281
 epoch: 81, train_loss: 1.2538, test_loss: 1.3029, test_f1: 0.2281
 epoch: 82, train_loss: 1.2538, test_loss: 1.3050, test_f1: 0.2281
 epoch: 83, train_loss: 1.2520, test_loss: 1.3057, test_f1: 0.2281
 epoch: 84, train_loss: 1.2531, test_loss: 1.3050, test_f1: 0.2281
 epoch: 85, train_loss: 1.2522, test_loss: 1.3035, test_f1: 0.2281
 epoch: 86, train_loss: 1.2523, test_loss: 1.3040, test_f1: 0.2281
 epoch: 87, train_loss: 1.2527, test_loss: 1.3030, test_f1: 0.2281
 epoch: 88, train_loss: 1.2526, test_loss: 1.3037, test_f1: 0.2281
 epoch: 89, train_loss: 1.2523, test_loss: 1.3075, test_f1: 0.2281
 epoch: 90, train_loss: 1.2526, test_loss: 1.3047, test_f1: 0.2281
 epoch: 91, train_loss: 1.2524, test_loss: 1.3035, test_f1: 0.2281
 epoch: 92, train_loss: 1.2528, test_loss: 1.3060, test_f1: 0.2281
 epoch: 93, train_loss: 1.2526, test_loss: 1.3054, test_f1: 0.2281
 epoch: 94, train_loss: 1.2522, test_loss: 1.3026, test_f1: 0.2281
 epoch: 95, train_loss: 1.2523, test_loss: 1.3043, test_f1: 0.2281
 epoch: 96, train_loss: 1.2522, test_loss: 1.3043, test_f1: 0.2281
 epoch: 97, train_loss: 1.2529, test_loss: 1.3022, test_f1: 0.2281
 epoch: 98, train_loss: 1.2527, test_loss: 1.3037, test_f1: 0.2281
 epoch: 99, train_loss: 1.2520, test_loss: 1.3044, test_f1: 0.2281
##################ITERATION #9 ****************************************
 epoch: 0, train_loss: 1.2584, test_loss: 1.3016, test_f1: 0.2281
 epoch: 1, train_loss: 1.2538, test_loss: 1.3023, test_f1: 0.2281
 epoch: 2, train_loss: 1.2535, test_loss: 1.3030, test_f1: 0.2281
 epoch: 3, train_loss: 1.2535, test_loss: 1.3040, test_f1: 0.2281
 epoch: 4, train_loss: 1.2532, test_loss: 1.3045, test_f1: 0.2281
 epoch: 5, train_loss: 1.2535, test_loss: 1.3064, test_f1: 0.2281
 epoch: 6, train_loss: 1.2527, test_loss: 1.3044, test_f1: 0.2281
 epoch: 7, train_loss: 1.2542, test_loss: 1.3018, test_f1: 0.2281
 epoch: 8, train_loss: 1.2541, test_loss: 1.3060, test_f1: 0.2281
 epoch: 9, train_loss: 1.2529, test_loss: 1.3029, test_f1: 0.2281
 epoch: 10, train_loss: 1.2527, test_loss: 1.3064, test_f1: 0.2281
 epoch: 11, train_loss: 1.2526, test_loss: 1.3036, test_f1: 0.2281
 epoch: 12, train_loss: 1.2547, test_loss: 1.3046, test_f1: 0.2281
 epoch: 13, train_loss: 1.2542, test_loss: 1.3080, test_f1: 0.2281
 epoch: 14, train_loss: 1.2532, test_loss: 1.3036, test_f1: 0.2281
 epoch: 15, train_loss: 1.2534, test_loss: 1.3044, test_f1: 0.2281
 epoch: 16, train_loss: 1.2540, test_loss: 1.3016, test_f1: 0.2281
 epoch: 17, train_loss: 1.2554, test_loss: 1.3038, test_f1: 0.2281
 epoch: 18, train_loss: 1.2549, test_loss: 1.3053, test_f1: 0.2281
 epoch: 19, train_loss: 1.2533, test_loss: 1.3016, test_f1: 0.2281
 epoch: 20, train_loss: 1.2534, test_loss: 1.3066, test_f1: 0.2281
 epoch: 21, train_loss: 1.2522, test_loss: 1.3022, test_f1: 0.2281
 epoch: 22, train_loss: 1.2527, test_loss: 1.3075, test_f1: 0.2281
 epoch: 23, train_loss: 1.2532, test_loss: 1.3057, test_f1: 0.2281
 epoch: 24, train_loss: 1.2532, test_loss: 1.3060, test_f1: 0.2281
 epoch: 25, train_loss: 1.2528, test_loss: 1.3013, test_f1: 0.2281
 epoch: 26, train_loss: 1.2528, test_loss: 1.3039, test_f1: 0.2281
 epoch: 27, train_loss: 1.2535, test_loss: 1.3083, test_f1: 0.2281
 epoch: 28, train_loss: 1.2537, test_loss: 1.3012, test_f1: 0.2281
 epoch: 29, train_loss: 1.2539, test_loss: 1.3075, test_f1: 0.2281
 epoch: 30, train_loss: 1.2544, test_loss: 1.3026, test_f1: 0.2281
 epoch: 31, train_loss: 1.2532, test_loss: 1.3073, test_f1: 0.2281
 epoch: 32, train_loss: 1.2529, test_loss: 1.3023, test_f1: 0.2281
 epoch: 33, train_loss: 1.2549, test_loss: 1.3041, test_f1: 0.2281
 epoch: 34, train_loss: 1.2525, test_loss: 1.3039, test_f1: 0.2281
 epoch: 35, train_loss: 1.2532, test_loss: 1.3039, test_f1: 0.2281
 epoch: 36, train_loss: 1.2540, test_loss: 1.3052, test_f1: 0.2281
 epoch: 37, train_loss: 1.2531, test_loss: 1.3042, test_f1: 0.2281
 epoch: 38, train_loss: 1.2535, test_loss: 1.3020, test_f1: 0.2281
 epoch: 39, train_loss: 1.2544, test_loss: 1.3042, test_f1: 0.2281
 epoch: 40, train_loss: 1.2541, test_loss: 1.3108, test_f1: 0.2281
 epoch: 41, train_loss: 1.2535, test_loss: 1.3021, test_f1: 0.2281
 epoch: 42, train_loss: 1.2531, test_loss: 1.3043, test_f1: 0.2281
 epoch: 43, train_loss: 1.2531, test_loss: 1.3034, test_f1: 0.2281
 epoch: 44, train_loss: 1.2532, test_loss: 1.3020, test_f1: 0.2281
 epoch: 45, train_loss: 1.2530, test_loss: 1.3060, test_f1: 0.2281
 epoch: 46, train_loss: 1.2531, test_loss: 1.3025, test_f1: 0.2281
 epoch: 47, train_loss: 1.2533, test_loss: 1.3067, test_f1: 0.2281
 epoch: 48, train_loss: 1.2543, test_loss: 1.3059, test_f1: 0.2281
 epoch: 49, train_loss: 1.2538, test_loss: 1.3036, test_f1: 0.2281
 epoch: 50, train_loss: 1.2529, test_loss: 1.3048, test_f1: 0.2281
 epoch: 51, train_loss: 1.2525, test_loss: 1.3057, test_f1: 0.2281
 epoch: 52, train_loss: 1.2522, test_loss: 1.3035, test_f1: 0.2281
 epoch: 53, train_loss: 1.2526, test_loss: 1.3023, test_f1: 0.2281
 epoch: 54, train_loss: 1.2523, test_loss: 1.3038, test_f1: 0.2281
 epoch: 55, train_loss: 1.2522, test_loss: 1.3068, test_f1: 0.2281
 epoch: 56, train_loss: 1.2529, test_loss: 1.3063, test_f1: 0.2281
 epoch: 57, train_loss: 1.2533, test_loss: 1.3055, test_f1: 0.2281
 epoch: 58, train_loss: 1.2522, test_loss: 1.3056, test_f1: 0.2281
 epoch: 59, train_loss: 1.2527, test_loss: 1.3054, test_f1: 0.2281
 epoch: 60, train_loss: 1.2526, test_loss: 1.3058, test_f1: 0.2281
 epoch: 61, train_loss: 1.2520, test_loss: 1.3035, test_f1: 0.2281
 epoch: 62, train_loss: 1.2528, test_loss: 1.3036, test_f1: 0.2281
 epoch: 63, train_loss: 1.2524, test_loss: 1.3038, test_f1: 0.2281
 epoch: 64, train_loss: 1.2521, test_loss: 1.3049, test_f1: 0.2281
 epoch: 65, train_loss: 1.2526, test_loss: 1.3043, test_f1: 0.2281
 epoch: 66, train_loss: 1.2526, test_loss: 1.3068, test_f1: 0.2281
 epoch: 67, train_loss: 1.2522, test_loss: 1.3018, test_f1: 0.2281
 epoch: 68, train_loss: 1.2527, test_loss: 1.3023, test_f1: 0.2281
 epoch: 69, train_loss: 1.2526, test_loss: 1.3035, test_f1: 0.2281
 epoch: 70, train_loss: 1.2523, test_loss: 1.3045, test_f1: 0.2281
 epoch: 71, train_loss: 1.2525, test_loss: 1.3069, test_f1: 0.2281
 epoch: 72, train_loss: 1.2529, test_loss: 1.3072, test_f1: 0.2281
 epoch: 73, train_loss: 1.2524, test_loss: 1.3065, test_f1: 0.2281
 epoch: 74, train_loss: 1.2523, test_loss: 1.3041, test_f1: 0.2281
 epoch: 75, train_loss: 1.2523, test_loss: 1.3042, test_f1: 0.2281
 epoch: 76, train_loss: 1.2528, test_loss: 1.3023, test_f1: 0.2281
 epoch: 77, train_loss: 1.2522, test_loss: 1.3050, test_f1: 0.2281
 epoch: 78, train_loss: 1.2522, test_loss: 1.3067, test_f1: 0.2281
 epoch: 79, train_loss: 1.2527, test_loss: 1.3072, test_f1: 0.2281
 epoch: 80, train_loss: 1.2525, test_loss: 1.3031, test_f1: 0.2281
 epoch: 81, train_loss: 1.2534, test_loss: 1.3040, test_f1: 0.2281
 epoch: 82, train_loss: 1.2534, test_loss: 1.3076, test_f1: 0.2281
 epoch: 83, train_loss: 1.2523, test_loss: 1.3055, test_f1: 0.2281
 epoch: 84, train_loss: 1.2523, test_loss: 1.3029, test_f1: 0.2281
 epoch: 85, train_loss: 1.2525, test_loss: 1.3040, test_f1: 0.2281
 epoch: 86, train_loss: 1.2527, test_loss: 1.3035, test_f1: 0.2281
 epoch: 87, train_loss: 1.2523, test_loss: 1.3059, test_f1: 0.2281
 epoch: 88, train_loss: 1.2526, test_loss: 1.3056, test_f1: 0.2281
 epoch: 89, train_loss: 1.2524, test_loss: 1.3034, test_f1: 0.2281
 epoch: 90, train_loss: 1.2534, test_loss: 1.3024, test_f1: 0.2281
 epoch: 91, train_loss: 1.2543, test_loss: 1.3090, test_f1: 0.2281
 epoch: 92, train_loss: 1.2528, test_loss: 1.3065, test_f1: 0.2281
 epoch: 93, train_loss: 1.2522, test_loss: 1.3050, test_f1: 0.2281
 epoch: 94, train_loss: 1.2527, test_loss: 1.3061, test_f1: 0.2281
 epoch: 95, train_loss: 1.2530, test_loss: 1.3000, test_f1: 0.2281
 epoch: 96, train_loss: 1.2526, test_loss: 1.3030, test_f1: 0.2281
 epoch: 97, train_loss: 1.2525, test_loss: 1.3039, test_f1: 0.2281
 epoch: 98, train_loss: 1.2527, test_loss: 1.3028, test_f1: 0.2281
 epoch: 99, train_loss: 1.2527, test_loss: 1.3045, test_f1: 0.2281

Training completed in 440.77 seconds
Best F1: 0.5515 at epoch 78
Mean F1 across iterations: 0.2941  0.1025
========================FINAL RESULTS================================
FEGIN weighted F1: 0.5515  0.1025
python main.py --data ltspice_demos --representation component_pin_net --model FEGIN --layers 3 --hiddens 16 --batch_size 128 --lr 0.1 --emb_size 128 --epochs 100 --save_appendix component_pin_net_L3_H16_BS128_LR0.1_E128 --no_val
-----



STDERR:
  File "main.py", line 370, in <module>
    main()
  File "main.py", line 254, in main
    dataset = dataset_class(
  File "/home/philip/projects/ltspice_examples_code_repo/Circuit-Completion-Using-GNNs/component_classification_with_link_prediction_head/evaluation/FEGIN/kernel/circuit_datasets.py", line 15, in __init__
    self.data, self.slices = torch.load(self.processed_paths[0])
  File "/home/philip/.local/lib/python3.8/site-packages/torch/serialization.py", line 1040, in load
    warnings.warn(
  File "/usr/lib/python3.8/warnings.py", line 109, in _showwarnmsg
    sw(msg.message, msg.category, msg.filename, msg.lineno,
  File "main.py", line 47, in warn_with_traceback
    traceback.print_stack(file=log)
/home/philip/projects/ltspice_examples_code_repo/Circuit-Completion-Using-GNNs/component_classification_with_link_prediction_head/evaluation/FEGIN/kernel/circuit_datasets.py:15: FutureWarning: You are using `torch.load` with `weights_only=False` (the current default value), which uses the default pickle module implicitly. It is possible to construct malicious pickle data which will execute arbitrary code during unpickling (See https://github.com/pytorch/pytorch/blob/main/SECURITY.md#untrusted-models for more details). In a future release, the default value for `weights_only` will be flipped to `True`. This limits the functions that could be executed during unpickling. Arbitrary objects will no longer be allowed to be loaded via this mode unless they are explicitly allowlisted by the user via `torch.serialization.add_safe_globals`. We recommend you start setting `weights_only=True` for any use case where you don't have full control of the loaded file. Please open an issue on GitHub for any issues related to this experimental feature.
  self.data, self.slices = torch.load(self.processed_paths[0])
