STDOUT:
Results will be saved in /home/philip/projects/llm_inference_code_repo/Circuit-Completion-Using-GNNs/component_classification_with_link_prediction_head/evaluation/FEGIN/results/model_FEGIN_dataset_ltspice_examples
Command line input: python main.py --data ltspice_examples --representation component_net --model FEGIN --layers 3 --hiddens 64 --batch_size 128 --lr 0.01 --emb_size 250 --epochs 100 --save_appendix component_net_L3_H64_BS128_LR0.01_E250 --no_val
 is saved.
-----
ltspice_examples - FEGIN
Using 3 layers, 64 hidden units, h = 2
Loading component_net representation dataset
ENTERED
Training FEGIN on component_net representation
Train: 3558, Test: 846
##################ITERATION #0 ****************************************
 epoch: 0, train_loss: 1.2224, test_loss: 1.2380, test_f1: 0.2872
 epoch: 1, train_loss: 1.0490, test_loss: 0.9871, test_f1: 0.4553
 epoch: 2, train_loss: 0.9719, test_loss: 1.0605, test_f1: 0.3963
 epoch: 3, train_loss: 0.9420, test_loss: 1.2272, test_f1: 0.3917
 epoch: 4, train_loss: 0.9394, test_loss: 0.9108, test_f1: 0.5299
 epoch: 5, train_loss: 0.9168, test_loss: 0.9091, test_f1: 0.5025
 epoch: 6, train_loss: 0.8902, test_loss: 0.9844, test_f1: 0.4981
 epoch: 7, train_loss: 0.8889, test_loss: 0.9379, test_f1: 0.5448
 epoch: 8, train_loss: 0.8629, test_loss: 1.0367, test_f1: 0.4652
 epoch: 9, train_loss: 0.8542, test_loss: 0.9486, test_f1: 0.5061
 epoch: 10, train_loss: 0.8401, test_loss: 0.9625, test_f1: 0.5097
 epoch: 11, train_loss: 0.8263, test_loss: 0.9407, test_f1: 0.5335
 epoch: 12, train_loss: 0.8299, test_loss: 0.8885, test_f1: 0.5150
 epoch: 13, train_loss: 0.8274, test_loss: 1.0439, test_f1: 0.5150
 epoch: 14, train_loss: 0.8113, test_loss: 0.9618, test_f1: 0.5522
 epoch: 15, train_loss: 0.7854, test_loss: 0.9272, test_f1: 0.6398
 epoch: 16, train_loss: 0.8090, test_loss: 0.8929, test_f1: 0.5525
 epoch: 17, train_loss: 0.7949, test_loss: 1.0066, test_f1: 0.5930
 epoch: 18, train_loss: 0.7844, test_loss: 0.8966, test_f1: 0.5644
 epoch: 19, train_loss: 0.7630, test_loss: 1.0020, test_f1: 0.5377
 epoch: 20, train_loss: 0.7820, test_loss: 1.0743, test_f1: 0.5926
 epoch: 21, train_loss: 0.7500, test_loss: 0.8861, test_f1: 0.5647
 epoch: 22, train_loss: 0.7552, test_loss: 1.0456, test_f1: 0.5827
 epoch: 23, train_loss: 0.7562, test_loss: 0.9520, test_f1: 0.6012
 epoch: 24, train_loss: 0.7451, test_loss: 0.9395, test_f1: 0.5861
 epoch: 25, train_loss: 0.7261, test_loss: 0.9975, test_f1: 0.5883
 epoch: 26, train_loss: 0.7236, test_loss: 0.9356, test_f1: 0.6281
 epoch: 27, train_loss: 0.7151, test_loss: 1.1460, test_f1: 0.5341
 epoch: 28, train_loss: 0.7126, test_loss: 1.0584, test_f1: 0.5959
 epoch: 29, train_loss: 0.7061, test_loss: 1.0971, test_f1: 0.5658
 epoch: 30, train_loss: 0.6945, test_loss: 1.0508, test_f1: 0.6259
 epoch: 31, train_loss: 0.6756, test_loss: 1.0141, test_f1: 0.6354
 epoch: 32, train_loss: 0.6743, test_loss: 1.0054, test_f1: 0.6410
 epoch: 33, train_loss: 0.6629, test_loss: 1.0206, test_f1: 0.6185
 epoch: 34, train_loss: 0.6832, test_loss: 1.0833, test_f1: 0.6348
 epoch: 35, train_loss: 0.6692, test_loss: 0.9117, test_f1: 0.6134
 epoch: 36, train_loss: 0.6644, test_loss: 1.1864, test_f1: 0.6066
 epoch: 37, train_loss: 0.6402, test_loss: 1.0339, test_f1: 0.6213
 epoch: 38, train_loss: 0.6587, test_loss: 1.0964, test_f1: 0.6042
 epoch: 39, train_loss: 0.6341, test_loss: 1.1041, test_f1: 0.6225
 epoch: 40, train_loss: 0.6191, test_loss: 1.1623, test_f1: 0.6403
 epoch: 41, train_loss: 0.6349, test_loss: 1.0333, test_f1: 0.6257
 epoch: 42, train_loss: 0.6230, test_loss: 0.8747, test_f1: 0.6317
 epoch: 43, train_loss: 0.6189, test_loss: 1.0734, test_f1: 0.6201
 epoch: 44, train_loss: 0.6152, test_loss: 1.1858, test_f1: 0.6284
 epoch: 45, train_loss: 0.6153, test_loss: 1.1455, test_f1: 0.5810
 epoch: 46, train_loss: 0.6364, test_loss: 1.1029, test_f1: 0.5714
 epoch: 47, train_loss: 0.6172, test_loss: 1.1069, test_f1: 0.6081
 epoch: 48, train_loss: 0.5872, test_loss: 1.0170, test_f1: 0.6224
 epoch: 49, train_loss: 0.5999, test_loss: 0.8593, test_f1: 0.6178
 epoch: 50, train_loss: 0.6020, test_loss: 1.0872, test_f1: 0.6058
 epoch: 51, train_loss: 0.5804, test_loss: 1.2650, test_f1: 0.6547
 epoch: 52, train_loss: 0.5468, test_loss: 1.1478, test_f1: 0.6590
 epoch: 53, train_loss: 0.5416, test_loss: 1.1578, test_f1: 0.6430
 epoch: 54, train_loss: 0.5005, test_loss: 1.1597, test_f1: 0.6600
 epoch: 55, train_loss: 0.5225, test_loss: 1.3207, test_f1: 0.6141
 epoch: 56, train_loss: 0.5089, test_loss: 1.1483, test_f1: 0.6699
 epoch: 57, train_loss: 0.5059, test_loss: 1.2985, test_f1: 0.6236
 epoch: 58, train_loss: 0.4886, test_loss: 1.3951, test_f1: 0.6586
 epoch: 59, train_loss: 0.4942, test_loss: 1.3615, test_f1: 0.6126
 epoch: 60, train_loss: 0.4859, test_loss: 1.2149, test_f1: 0.6646
 epoch: 61, train_loss: 0.4673, test_loss: 1.2525, test_f1: 0.6293
 epoch: 62, train_loss: 0.4825, test_loss: 1.2936, test_f1: 0.6487
 epoch: 63, train_loss: 0.4997, test_loss: 1.2652, test_f1: 0.6648
 epoch: 64, train_loss: 0.4731, test_loss: 1.2788, test_f1: 0.6344
 epoch: 65, train_loss: 0.4710, test_loss: 1.1802, test_f1: 0.6549
 epoch: 66, train_loss: 0.4883, test_loss: 1.2284, test_f1: 0.6576
 epoch: 67, train_loss: 0.4656, test_loss: 1.3587, test_f1: 0.6714
 epoch: 68, train_loss: 0.4713, test_loss: 1.0436, test_f1: 0.6439
 epoch: 69, train_loss: 0.4679, test_loss: 1.5540, test_f1: 0.6212
 epoch: 70, train_loss: 0.4527, test_loss: 1.2667, test_f1: 0.6682
 epoch: 71, train_loss: 0.4571, test_loss: 1.2012, test_f1: 0.6489
 epoch: 72, train_loss: 0.4420, test_loss: 1.2459, test_f1: 0.6791
 epoch: 73, train_loss: 0.4373, test_loss: 1.2837, test_f1: 0.6601
 epoch: 74, train_loss: 0.4390, test_loss: 1.2254, test_f1: 0.6536
 epoch: 75, train_loss: 0.4492, test_loss: 1.3480, test_f1: 0.6501
 epoch: 76, train_loss: 0.4581, test_loss: 1.3687, test_f1: 0.6672
 epoch: 77, train_loss: 0.4343, test_loss: 1.2251, test_f1: 0.6604
 epoch: 78, train_loss: 0.4340, test_loss: 1.2722, test_f1: 0.6465
 epoch: 79, train_loss: 0.4283, test_loss: 1.3286, test_f1: 0.6547
 epoch: 80, train_loss: 0.4318, test_loss: 1.3447, test_f1: 0.6004
 epoch: 81, train_loss: 0.4183, test_loss: 1.2662, test_f1: 0.6698
 epoch: 82, train_loss: 0.4150, test_loss: 1.2982, test_f1: 0.6462
 epoch: 83, train_loss: 0.4259, test_loss: 1.4604, test_f1: 0.6528
 epoch: 84, train_loss: 0.4045, test_loss: 1.3735, test_f1: 0.6354
 epoch: 85, train_loss: 0.4476, test_loss: 1.5167, test_f1: 0.6651
 epoch: 86, train_loss: 0.4099, test_loss: 1.2977, test_f1: 0.6590
 epoch: 87, train_loss: 0.4122, test_loss: 1.5319, test_f1: 0.5962
 epoch: 88, train_loss: 0.4035, test_loss: 1.5480, test_f1: 0.6499
 epoch: 89, train_loss: 0.4271, test_loss: 1.5296, test_f1: 0.6376
 epoch: 90, train_loss: 0.4263, test_loss: 1.4055, test_f1: 0.6433
 epoch: 91, train_loss: 0.4110, test_loss: 1.4196, test_f1: 0.6158
 epoch: 92, train_loss: 0.4155, test_loss: 1.4728, test_f1: 0.6739
 epoch: 93, train_loss: 0.3960, test_loss: 1.3595, test_f1: 0.6811
 epoch: 94, train_loss: 0.4053, test_loss: 1.4359, test_f1: 0.6478
 epoch: 95, train_loss: 0.3991, test_loss: 1.4648, test_f1: 0.6893
 epoch: 96, train_loss: 0.4028, test_loss: 1.4521, test_f1: 0.6263
 epoch: 97, train_loss: 0.3824, test_loss: 1.5758, test_f1: 0.6716
 epoch: 98, train_loss: 0.3770, test_loss: 1.5215, test_f1: 0.6574
 epoch: 99, train_loss: 0.3765, test_loss: 1.7160, test_f1: 0.6241
##################ITERATION #1 ****************************************
 epoch: 0, train_loss: 1.2270, test_loss: 1.1672, test_f1: 0.3014
 epoch: 1, train_loss: 1.0418, test_loss: 1.0796, test_f1: 0.3646
 epoch: 2, train_loss: 1.0092, test_loss: 1.0531, test_f1: 0.4565
 epoch: 3, train_loss: 0.9774, test_loss: 1.0276, test_f1: 0.4856
 epoch: 4, train_loss: 0.9640, test_loss: 1.0522, test_f1: 0.4366
 epoch: 5, train_loss: 0.9490, test_loss: 0.9811, test_f1: 0.4979
 epoch: 6, train_loss: 0.9218, test_loss: 1.0239, test_f1: 0.4617
 epoch: 7, train_loss: 0.9127, test_loss: 1.2109, test_f1: 0.4372
 epoch: 8, train_loss: 0.9135, test_loss: 1.1191, test_f1: 0.4807
 epoch: 9, train_loss: 0.8919, test_loss: 0.9549, test_f1: 0.5102
 epoch: 10, train_loss: 0.8708, test_loss: 0.9073, test_f1: 0.5303
 epoch: 11, train_loss: 0.8715, test_loss: 0.8884, test_f1: 0.5857
 epoch: 12, train_loss: 0.8504, test_loss: 0.9630, test_f1: 0.4849
 epoch: 13, train_loss: 0.8497, test_loss: 0.9136, test_f1: 0.5219
 epoch: 14, train_loss: 0.8406, test_loss: 1.0281, test_f1: 0.5539
 epoch: 15, train_loss: 0.8272, test_loss: 0.9251, test_f1: 0.5926
 epoch: 16, train_loss: 0.8081, test_loss: 0.9316, test_f1: 0.5948
 epoch: 17, train_loss: 0.8088, test_loss: 0.9994, test_f1: 0.5544
 epoch: 18, train_loss: 0.8425, test_loss: 0.8936, test_f1: 0.6066
 epoch: 19, train_loss: 0.8062, test_loss: 0.9812, test_f1: 0.5496
 epoch: 20, train_loss: 0.7873, test_loss: 0.9120, test_f1: 0.5413
 epoch: 21, train_loss: 0.7705, test_loss: 0.9088, test_f1: 0.5290
 epoch: 22, train_loss: 0.7520, test_loss: 0.8568, test_f1: 0.6159
 epoch: 23, train_loss: 0.7502, test_loss: 0.9129, test_f1: 0.5442
 epoch: 24, train_loss: 0.7572, test_loss: 0.9591, test_f1: 0.5835
 epoch: 25, train_loss: 0.7396, test_loss: 0.9171, test_f1: 0.5689
 epoch: 26, train_loss: 0.7501, test_loss: 0.8298, test_f1: 0.6120
 epoch: 27, train_loss: 0.7402, test_loss: 1.0873, test_f1: 0.5704
 epoch: 28, train_loss: 0.7232, test_loss: 1.0047, test_f1: 0.6002
 epoch: 29, train_loss: 0.7306, test_loss: 0.8708, test_f1: 0.5726
 epoch: 30, train_loss: 0.7174, test_loss: 0.9729, test_f1: 0.5840
 epoch: 31, train_loss: 0.7142, test_loss: 0.8916, test_f1: 0.5511
 epoch: 32, train_loss: 0.6977, test_loss: 0.8828, test_f1: 0.6180
 epoch: 33, train_loss: 0.6912, test_loss: 0.9679, test_f1: 0.6214
 epoch: 34, train_loss: 0.7021, test_loss: 0.9797, test_f1: 0.6011
 epoch: 35, train_loss: 0.6969, test_loss: 1.0399, test_f1: 0.5645
 epoch: 36, train_loss: 0.6672, test_loss: 0.8734, test_f1: 0.6322
 epoch: 37, train_loss: 0.6626, test_loss: 0.9979, test_f1: 0.5855
 epoch: 38, train_loss: 0.6833, test_loss: 0.9280, test_f1: 0.6266
 epoch: 39, train_loss: 0.6962, test_loss: 0.9418, test_f1: 0.6196
 epoch: 40, train_loss: 0.6801, test_loss: 0.9786, test_f1: 0.5949
 epoch: 41, train_loss: 0.6321, test_loss: 1.0232, test_f1: 0.5947
 epoch: 42, train_loss: 0.6352, test_loss: 0.9754, test_f1: 0.6208
 epoch: 43, train_loss: 0.6335, test_loss: 1.0308, test_f1: 0.6319
 epoch: 44, train_loss: 0.6464, test_loss: 0.9799, test_f1: 0.6084
 epoch: 45, train_loss: 0.6286, test_loss: 1.0527, test_f1: 0.6071
 epoch: 46, train_loss: 0.6161, test_loss: 0.9651, test_f1: 0.6099
 epoch: 47, train_loss: 0.6016, test_loss: 0.9549, test_f1: 0.6098
 epoch: 48, train_loss: 0.6276, test_loss: 1.0499, test_f1: 0.6083
 epoch: 49, train_loss: 0.6094, test_loss: 1.0563, test_f1: 0.6487
 epoch: 50, train_loss: 0.6107, test_loss: 0.9537, test_f1: 0.6322
 epoch: 51, train_loss: 0.5712, test_loss: 0.9910, test_f1: 0.6580
 epoch: 52, train_loss: 0.5606, test_loss: 1.1636, test_f1: 0.6209
 epoch: 53, train_loss: 0.5598, test_loss: 1.1366, test_f1: 0.6417
 epoch: 54, train_loss: 0.5417, test_loss: 1.0930, test_f1: 0.6559
 epoch: 55, train_loss: 0.5457, test_loss: 1.1125, test_f1: 0.6350
 epoch: 56, train_loss: 0.5421, test_loss: 1.1181, test_f1: 0.6644
 epoch: 57, train_loss: 0.5112, test_loss: 1.1210, test_f1: 0.6493
 epoch: 58, train_loss: 0.4981, test_loss: 1.2032, test_f1: 0.6585
 epoch: 59, train_loss: 0.4984, test_loss: 1.0899, test_f1: 0.6450
 epoch: 60, train_loss: 0.5055, test_loss: 1.3640, test_f1: 0.6435
 epoch: 61, train_loss: 0.4937, test_loss: 1.2436, test_f1: 0.6408
 epoch: 62, train_loss: 0.4819, test_loss: 1.1751, test_f1: 0.6774
 epoch: 63, train_loss: 0.4959, test_loss: 1.1671, test_f1: 0.6530
 epoch: 64, train_loss: 0.4895, test_loss: 1.1440, test_f1: 0.6225
 epoch: 65, train_loss: 0.4886, test_loss: 1.2714, test_f1: 0.6276
 epoch: 66, train_loss: 0.5015, test_loss: 1.2158, test_f1: 0.6294
 epoch: 67, train_loss: 0.4870, test_loss: 1.3089, test_f1: 0.6507
 epoch: 68, train_loss: 0.4889, test_loss: 1.2148, test_f1: 0.6455
 epoch: 69, train_loss: 0.4857, test_loss: 1.2612, test_f1: 0.6537
 epoch: 70, train_loss: 0.4754, test_loss: 1.2685, test_f1: 0.6742
 epoch: 71, train_loss: 0.4848, test_loss: 1.1709, test_f1: 0.6388
 epoch: 72, train_loss: 0.4585, test_loss: 1.1762, test_f1: 0.6482
 epoch: 73, train_loss: 0.4650, test_loss: 1.1873, test_f1: 0.6538
 epoch: 74, train_loss: 0.4636, test_loss: 1.3758, test_f1: 0.6137
 epoch: 75, train_loss: 0.4580, test_loss: 1.2238, test_f1: 0.6534
 epoch: 76, train_loss: 0.4465, test_loss: 1.2428, test_f1: 0.6629
 epoch: 77, train_loss: 0.4479, test_loss: 1.3119, test_f1: 0.6351
 epoch: 78, train_loss: 0.4403, test_loss: 1.1859, test_f1: 0.6640
 epoch: 79, train_loss: 0.4464, test_loss: 1.2546, test_f1: 0.6345
 epoch: 80, train_loss: 0.4527, test_loss: 1.2027, test_f1: 0.6600
 epoch: 81, train_loss: 0.4584, test_loss: 1.0913, test_f1: 0.6559
 epoch: 82, train_loss: 0.4566, test_loss: 1.2631, test_f1: 0.6633
 epoch: 83, train_loss: 0.4240, test_loss: 1.2442, test_f1: 0.6513
 epoch: 84, train_loss: 0.4255, test_loss: 1.3506, test_f1: 0.6339
 epoch: 85, train_loss: 0.4227, test_loss: 1.3398, test_f1: 0.6428
 epoch: 86, train_loss: 0.4170, test_loss: 1.2095, test_f1: 0.6300
 epoch: 87, train_loss: 0.4234, test_loss: 1.3323, test_f1: 0.6741
 epoch: 88, train_loss: 0.4126, test_loss: 1.2316, test_f1: 0.6596
 epoch: 89, train_loss: 0.4283, test_loss: 1.1624, test_f1: 0.6536
 epoch: 90, train_loss: 0.4204, test_loss: 1.4202, test_f1: 0.6517
 epoch: 91, train_loss: 0.4455, test_loss: 1.2766, test_f1: 0.6516
 epoch: 92, train_loss: 0.4459, test_loss: 1.2748, test_f1: 0.6445
 epoch: 93, train_loss: 0.4181, test_loss: 1.3076, test_f1: 0.6395
 epoch: 94, train_loss: 0.4074, test_loss: 1.2438, test_f1: 0.6732
 epoch: 95, train_loss: 0.4089, test_loss: 1.2246, test_f1: 0.6574
 epoch: 96, train_loss: 0.3975, test_loss: 1.2487, test_f1: 0.6560
 epoch: 97, train_loss: 0.4198, test_loss: 1.1797, test_f1: 0.6398
 epoch: 98, train_loss: 0.4243, test_loss: 1.1536, test_f1: 0.6423
 epoch: 99, train_loss: 0.3844, test_loss: 1.3359, test_f1: 0.6508
##################ITERATION #2 ****************************************
 epoch: 0, train_loss: 1.2667, test_loss: 1.1022, test_f1: 0.3842
 epoch: 1, train_loss: 1.0062, test_loss: 0.9522, test_f1: 0.4553
 epoch: 2, train_loss: 0.9535, test_loss: 0.9505, test_f1: 0.4984
 epoch: 3, train_loss: 0.9398, test_loss: 0.9782, test_f1: 0.4886
 epoch: 4, train_loss: 0.9123, test_loss: 0.9677, test_f1: 0.4752
 epoch: 5, train_loss: 0.9162, test_loss: 0.8670, test_f1: 0.5296
 epoch: 6, train_loss: 0.9012, test_loss: 1.0665, test_f1: 0.4897
 epoch: 7, train_loss: 0.8826, test_loss: 0.9488, test_f1: 0.5107
 epoch: 8, train_loss: 0.8669, test_loss: 0.9829, test_f1: 0.4833
 epoch: 9, train_loss: 0.8580, test_loss: 0.9151, test_f1: 0.4949
 epoch: 10, train_loss: 0.8485, test_loss: 0.9798, test_f1: 0.5221
 epoch: 11, train_loss: 0.8268, test_loss: 0.8905, test_f1: 0.5496
 epoch: 12, train_loss: 0.8097, test_loss: 0.9086, test_f1: 0.5738
 epoch: 13, train_loss: 0.8038, test_loss: 0.8476, test_f1: 0.5800
 epoch: 14, train_loss: 0.7930, test_loss: 0.9405, test_f1: 0.5498
 epoch: 15, train_loss: 0.8039, test_loss: 0.9087, test_f1: 0.5447
 epoch: 16, train_loss: 0.7729, test_loss: 0.8858, test_f1: 0.5974
 epoch: 17, train_loss: 0.7884, test_loss: 0.9081, test_f1: 0.5867
 epoch: 18, train_loss: 0.7505, test_loss: 0.9934, test_f1: 0.5851
 epoch: 19, train_loss: 0.7691, test_loss: 0.9492, test_f1: 0.5553
 epoch: 20, train_loss: 0.7448, test_loss: 0.9957, test_f1: 0.5754
 epoch: 21, train_loss: 0.7274, test_loss: 0.7721, test_f1: 0.6172
 epoch: 22, train_loss: 0.7269, test_loss: 0.9456, test_f1: 0.5871
 epoch: 23, train_loss: 0.7233, test_loss: 1.0553, test_f1: 0.5740
 epoch: 24, train_loss: 0.7239, test_loss: 0.9442, test_f1: 0.6158
 epoch: 25, train_loss: 0.7156, test_loss: 0.9852, test_f1: 0.6295
 epoch: 26, train_loss: 0.7081, test_loss: 0.9747, test_f1: 0.5695
 epoch: 27, train_loss: 0.6831, test_loss: 1.0058, test_f1: 0.6030
 epoch: 28, train_loss: 0.6882, test_loss: 0.9600, test_f1: 0.6122
 epoch: 29, train_loss: 0.6747, test_loss: 1.0472, test_f1: 0.6006
 epoch: 30, train_loss: 0.6806, test_loss: 1.1230, test_f1: 0.5451
 epoch: 31, train_loss: 0.6633, test_loss: 1.1420, test_f1: 0.5868
 epoch: 32, train_loss: 0.6565, test_loss: 1.0235, test_f1: 0.5984
 epoch: 33, train_loss: 0.6492, test_loss: 1.0029, test_f1: 0.6503
 epoch: 34, train_loss: 0.6505, test_loss: 1.0559, test_f1: 0.5816
 epoch: 35, train_loss: 0.6462, test_loss: 1.8619, test_f1: 0.4546
 epoch: 36, train_loss: 0.6638, test_loss: 1.1664, test_f1: 0.5773
 epoch: 37, train_loss: 0.6455, test_loss: 0.9303, test_f1: 0.6290
 epoch: 38, train_loss: 0.6554, test_loss: 0.9824, test_f1: 0.6296
 epoch: 39, train_loss: 0.6314, test_loss: 0.9828, test_f1: 0.6270
 epoch: 40, train_loss: 0.6150, test_loss: 1.0750, test_f1: 0.6169
 epoch: 41, train_loss: 0.6067, test_loss: 1.1505, test_f1: 0.6282
 epoch: 42, train_loss: 0.6066, test_loss: 1.1690, test_f1: 0.6036
 epoch: 43, train_loss: 0.5854, test_loss: 1.0425, test_f1: 0.6091
 epoch: 44, train_loss: 0.6218, test_loss: 1.1970, test_f1: 0.5944
 epoch: 45, train_loss: 0.6451, test_loss: 0.9073, test_f1: 0.6147
 epoch: 46, train_loss: 0.5987, test_loss: 1.0086, test_f1: 0.6764
 epoch: 47, train_loss: 0.5703, test_loss: 1.0320, test_f1: 0.6180
 epoch: 48, train_loss: 0.5719, test_loss: 1.1444, test_f1: 0.6371
 epoch: 49, train_loss: 0.5958, test_loss: 0.9762, test_f1: 0.6468
 epoch: 50, train_loss: 0.5805, test_loss: 0.9002, test_f1: 0.6354
 epoch: 51, train_loss: 0.5595, test_loss: 0.9977, test_f1: 0.6433
 epoch: 52, train_loss: 0.5194, test_loss: 0.9829, test_f1: 0.6494
 epoch: 53, train_loss: 0.5039, test_loss: 1.1469, test_f1: 0.6126
 epoch: 54, train_loss: 0.4947, test_loss: 1.1660, test_f1: 0.6761
 epoch: 55, train_loss: 0.5009, test_loss: 1.1249, test_f1: 0.6652
 epoch: 56, train_loss: 0.5064, test_loss: 1.1287, test_f1: 0.6286
 epoch: 57, train_loss: 0.4896, test_loss: 1.1517, test_f1: 0.6609
 epoch: 58, train_loss: 0.4779, test_loss: 1.1492, test_f1: 0.6672
 epoch: 59, train_loss: 0.4934, test_loss: 1.1399, test_f1: 0.6315
 epoch: 60, train_loss: 0.4688, test_loss: 1.3197, test_f1: 0.6276
 epoch: 61, train_loss: 0.4775, test_loss: 1.1845, test_f1: 0.6683
 epoch: 62, train_loss: 0.4678, test_loss: 1.1706, test_f1: 0.6553
 epoch: 63, train_loss: 0.4692, test_loss: 1.2465, test_f1: 0.6744
 epoch: 64, train_loss: 0.4449, test_loss: 1.3516, test_f1: 0.6696
 epoch: 65, train_loss: 0.4755, test_loss: 1.1838, test_f1: 0.6675
 epoch: 66, train_loss: 0.4695, test_loss: 1.1920, test_f1: 0.6576
 epoch: 67, train_loss: 0.4304, test_loss: 1.4512, test_f1: 0.6545
 epoch: 68, train_loss: 0.4609, test_loss: 1.3761, test_f1: 0.6847
 epoch: 69, train_loss: 0.4423, test_loss: 1.2855, test_f1: 0.6921
 epoch: 70, train_loss: 0.4446, test_loss: 1.3372, test_f1: 0.6630
 epoch: 71, train_loss: 0.4086, test_loss: 1.4488, test_f1: 0.6522
 epoch: 72, train_loss: 0.4242, test_loss: 1.4359, test_f1: 0.6378
 epoch: 73, train_loss: 0.4053, test_loss: 1.2622, test_f1: 0.6665
 epoch: 74, train_loss: 0.4213, test_loss: 1.5538, test_f1: 0.6584
 epoch: 75, train_loss: 0.4088, test_loss: 1.3912, test_f1: 0.6425
 epoch: 76, train_loss: 0.4125, test_loss: 1.4950, test_f1: 0.6367
 epoch: 77, train_loss: 0.4089, test_loss: 1.4553, test_f1: 0.6663
 epoch: 78, train_loss: 0.4121, test_loss: 1.3199, test_f1: 0.6358
 epoch: 79, train_loss: 0.4062, test_loss: 1.3965, test_f1: 0.6339
 epoch: 80, train_loss: 0.4188, test_loss: 1.5372, test_f1: 0.6476
 epoch: 81, train_loss: 0.4118, test_loss: 1.3296, test_f1: 0.6709
 epoch: 82, train_loss: 0.3956, test_loss: 1.4729, test_f1: 0.6694
 epoch: 83, train_loss: 0.4150, test_loss: 1.3557, test_f1: 0.6560
 epoch: 84, train_loss: 0.4205, test_loss: 1.3791, test_f1: 0.6697
 epoch: 85, train_loss: 0.3913, test_loss: 1.4571, test_f1: 0.6717
 epoch: 86, train_loss: 0.3942, test_loss: 1.2078, test_f1: 0.6507
 epoch: 87, train_loss: 0.4180, test_loss: 1.5715, test_f1: 0.6477
 epoch: 88, train_loss: 0.3909, test_loss: 1.4830, test_f1: 0.6598
 epoch: 89, train_loss: 0.3947, test_loss: 1.3049, test_f1: 0.6526
 epoch: 90, train_loss: 0.3838, test_loss: 1.3699, test_f1: 0.6761
 epoch: 91, train_loss: 0.3772, test_loss: 1.3907, test_f1: 0.6685
 epoch: 92, train_loss: 0.3614, test_loss: 1.5745, test_f1: 0.6524
 epoch: 93, train_loss: 0.4025, test_loss: 1.5581, test_f1: 0.6642
 epoch: 94, train_loss: 0.3827, test_loss: 1.4884, test_f1: 0.6538
 epoch: 95, train_loss: 0.3951, test_loss: 1.4926, test_f1: 0.6668
 epoch: 96, train_loss: 0.3701, test_loss: 1.4136, test_f1: 0.6983
 epoch: 97, train_loss: 0.3465, test_loss: 1.6118, test_f1: 0.6626
 epoch: 98, train_loss: 0.3424, test_loss: 1.5110, test_f1: 0.6758
 epoch: 99, train_loss: 0.3566, test_loss: 1.6989, test_f1: 0.6255
##################ITERATION #3 ****************************************
 epoch: 0, train_loss: 1.2218, test_loss: 1.1653, test_f1: 0.3457
 epoch: 1, train_loss: 1.0106, test_loss: 1.0120, test_f1: 0.4207
 epoch: 2, train_loss: 0.9825, test_loss: 1.0535, test_f1: 0.4810
 epoch: 3, train_loss: 0.9593, test_loss: 1.0939, test_f1: 0.4527
 epoch: 4, train_loss: 0.9362, test_loss: 0.9758, test_f1: 0.4688
 epoch: 5, train_loss: 0.9304, test_loss: 0.9849, test_f1: 0.4830
 epoch: 6, train_loss: 0.9090, test_loss: 1.0106, test_f1: 0.4993
 epoch: 7, train_loss: 0.9051, test_loss: 0.9299, test_f1: 0.5063
 epoch: 8, train_loss: 0.8927, test_loss: 0.9791, test_f1: 0.4901
 epoch: 9, train_loss: 0.8772, test_loss: 0.9520, test_f1: 0.5079
 epoch: 10, train_loss: 0.8810, test_loss: 1.0034, test_f1: 0.4952
 epoch: 11, train_loss: 0.8503, test_loss: 0.9748, test_f1: 0.5387
 epoch: 12, train_loss: 0.8498, test_loss: 0.9142, test_f1: 0.5356
 epoch: 13, train_loss: 0.8494, test_loss: 1.0486, test_f1: 0.4986
 epoch: 14, train_loss: 0.8356, test_loss: 1.0540, test_f1: 0.5183
 epoch: 15, train_loss: 0.8353, test_loss: 1.0103, test_f1: 0.5327
 epoch: 16, train_loss: 0.8366, test_loss: 1.0186, test_f1: 0.5293
 epoch: 17, train_loss: 0.8081, test_loss: 0.8966, test_f1: 0.5471
 epoch: 18, train_loss: 0.8507, test_loss: 0.9536, test_f1: 0.5186
 epoch: 19, train_loss: 0.8048, test_loss: 0.9836, test_f1: 0.5249
 epoch: 20, train_loss: 0.8081, test_loss: 1.1025, test_f1: 0.5160
 epoch: 21, train_loss: 0.7891, test_loss: 1.0069, test_f1: 0.5315
 epoch: 22, train_loss: 0.7850, test_loss: 1.0151, test_f1: 0.5147
 epoch: 23, train_loss: 0.7721, test_loss: 0.9215, test_f1: 0.5599
 epoch: 24, train_loss: 0.7684, test_loss: 0.9393, test_f1: 0.5790
 epoch: 25, train_loss: 0.7647, test_loss: 0.9552, test_f1: 0.5513
 epoch: 26, train_loss: 0.7580, test_loss: 0.8942, test_f1: 0.5646
 epoch: 27, train_loss: 0.7467, test_loss: 0.9721, test_f1: 0.5907
 epoch: 28, train_loss: 0.7564, test_loss: 1.1584, test_f1: 0.5013
 epoch: 29, train_loss: 0.7322, test_loss: 0.9336, test_f1: 0.5948
 epoch: 30, train_loss: 0.7436, test_loss: 0.9607, test_f1: 0.5290
 epoch: 31, train_loss: 0.7333, test_loss: 0.9840, test_f1: 0.5552
 epoch: 32, train_loss: 0.7134, test_loss: 0.9867, test_f1: 0.5374
 epoch: 33, train_loss: 0.7122, test_loss: 0.9436, test_f1: 0.5516
 epoch: 34, train_loss: 0.7203, test_loss: 0.9723, test_f1: 0.5713
 epoch: 35, train_loss: 0.6877, test_loss: 1.0101, test_f1: 0.5764
 epoch: 36, train_loss: 0.6956, test_loss: 1.3962, test_f1: 0.5201
 epoch: 37, train_loss: 0.7052, test_loss: 1.0957, test_f1: 0.5192
 epoch: 38, train_loss: 0.6979, test_loss: 0.9706, test_f1: 0.6385
 epoch: 39, train_loss: 0.6956, test_loss: 1.4372, test_f1: 0.4854
 epoch: 40, train_loss: 0.6886, test_loss: 0.9499, test_f1: 0.6225
 epoch: 41, train_loss: 0.6682, test_loss: 0.8802, test_f1: 0.6068
 epoch: 42, train_loss: 0.6848, test_loss: 0.9178, test_f1: 0.5752
 epoch: 43, train_loss: 0.6940, test_loss: 0.8517, test_f1: 0.5967
 epoch: 44, train_loss: 0.6641, test_loss: 1.0315, test_f1: 0.5744
 epoch: 45, train_loss: 0.6756, test_loss: 1.0833, test_f1: 0.5444
 epoch: 46, train_loss: 0.6757, test_loss: 0.9340, test_f1: 0.5965
 epoch: 47, train_loss: 0.6483, test_loss: 0.9977, test_f1: 0.5990
 epoch: 48, train_loss: 0.6536, test_loss: 0.9816, test_f1: 0.6072
 epoch: 49, train_loss: 0.6407, test_loss: 1.0489, test_f1: 0.6086
 epoch: 50, train_loss: 0.6476, test_loss: 0.8903, test_f1: 0.5943
 epoch: 51, train_loss: 0.6224, test_loss: 1.0974, test_f1: 0.6076
 epoch: 52, train_loss: 0.5744, test_loss: 1.0974, test_f1: 0.6020
 epoch: 53, train_loss: 0.5701, test_loss: 1.0978, test_f1: 0.6225
 epoch: 54, train_loss: 0.5587, test_loss: 1.1395, test_f1: 0.6025
 epoch: 55, train_loss: 0.5470, test_loss: 1.0799, test_f1: 0.6514
 epoch: 56, train_loss: 0.5458, test_loss: 1.1833, test_f1: 0.6178
 epoch: 57, train_loss: 0.5403, test_loss: 1.2130, test_f1: 0.6383
 epoch: 58, train_loss: 0.5500, test_loss: 1.2564, test_f1: 0.6238
 epoch: 59, train_loss: 0.5631, test_loss: 1.1192, test_f1: 0.6380
 epoch: 60, train_loss: 0.5283, test_loss: 1.2458, test_f1: 0.6532
 epoch: 61, train_loss: 0.5339, test_loss: 1.3569, test_f1: 0.6235
 epoch: 62, train_loss: 0.5206, test_loss: 1.2013, test_f1: 0.6528
 epoch: 63, train_loss: 0.5264, test_loss: 1.3253, test_f1: 0.6013
 epoch: 64, train_loss: 0.5333, test_loss: 1.1248, test_f1: 0.5908
 epoch: 65, train_loss: 0.5311, test_loss: 1.1879, test_f1: 0.6416
 epoch: 66, train_loss: 0.5118, test_loss: 1.1852, test_f1: 0.6398
 epoch: 67, train_loss: 0.5123, test_loss: 1.3358, test_f1: 0.6311
 epoch: 68, train_loss: 0.5029, test_loss: 1.3496, test_f1: 0.6165
 epoch: 69, train_loss: 0.4936, test_loss: 1.3994, test_f1: 0.6569
 epoch: 70, train_loss: 0.5029, test_loss: 1.3338, test_f1: 0.6214
 epoch: 71, train_loss: 0.4977, test_loss: 1.4181, test_f1: 0.6243
 epoch: 72, train_loss: 0.4958, test_loss: 1.5178, test_f1: 0.6373
 epoch: 73, train_loss: 0.5061, test_loss: 1.3717, test_f1: 0.6393
 epoch: 74, train_loss: 0.4948, test_loss: 1.4042, test_f1: 0.6447
 epoch: 75, train_loss: 0.4776, test_loss: 1.3971, test_f1: 0.6890
 epoch: 76, train_loss: 0.4777, test_loss: 1.3626, test_f1: 0.6282
 epoch: 77, train_loss: 0.4775, test_loss: 1.4468, test_f1: 0.6460
 epoch: 78, train_loss: 0.4851, test_loss: 1.3262, test_f1: 0.6444
 epoch: 79, train_loss: 0.4834, test_loss: 1.6432, test_f1: 0.5834
 epoch: 80, train_loss: 0.4748, test_loss: 1.7619, test_f1: 0.6223
 epoch: 81, train_loss: 0.4737, test_loss: 1.4140, test_f1: 0.6799
 epoch: 82, train_loss: 0.4644, test_loss: 1.4567, test_f1: 0.6467
 epoch: 83, train_loss: 0.4465, test_loss: 1.4166, test_f1: 0.6729
 epoch: 84, train_loss: 0.4580, test_loss: 1.4939, test_f1: 0.6705
 epoch: 85, train_loss: 0.4596, test_loss: 1.5398, test_f1: 0.6582
 epoch: 86, train_loss: 0.4664, test_loss: 1.5849, test_f1: 0.6528
 epoch: 87, train_loss: 0.4543, test_loss: 1.5095, test_f1: 0.6487
 epoch: 88, train_loss: 0.4315, test_loss: 1.6321, test_f1: 0.6545
 epoch: 89, train_loss: 0.4654, test_loss: 1.4072, test_f1: 0.6484
 epoch: 90, train_loss: 0.4613, test_loss: 1.4028, test_f1: 0.6560
 epoch: 91, train_loss: 0.4528, test_loss: 1.4653, test_f1: 0.6494
 epoch: 92, train_loss: 0.4552, test_loss: 1.5316, test_f1: 0.6379
 epoch: 93, train_loss: 0.4231, test_loss: 1.5018, test_f1: 0.6653
 epoch: 94, train_loss: 0.4264, test_loss: 1.4629, test_f1: 0.6377
 epoch: 95, train_loss: 0.4397, test_loss: 1.4481, test_f1: 0.6522
 epoch: 96, train_loss: 0.4339, test_loss: 1.4836, test_f1: 0.6620
 epoch: 97, train_loss: 0.4367, test_loss: 1.4167, test_f1: 0.6572
 epoch: 98, train_loss: 0.4499, test_loss: 1.5176, test_f1: 0.6217
 epoch: 99, train_loss: 0.4207, test_loss: 1.3127, test_f1: 0.6526
##################ITERATION #4 ****************************************
 epoch: 0, train_loss: 1.2892, test_loss: 1.3733, test_f1: 0.3520
 epoch: 1, train_loss: 1.0563, test_loss: 1.0771, test_f1: 0.4795
 epoch: 2, train_loss: 0.9908, test_loss: 1.0064, test_f1: 0.4454
 epoch: 3, train_loss: 1.0000, test_loss: 1.0262, test_f1: 0.4714
 epoch: 4, train_loss: 0.9637, test_loss: 1.0603, test_f1: 0.4728
 epoch: 5, train_loss: 0.9688, test_loss: 1.0073, test_f1: 0.4712
 epoch: 6, train_loss: 0.9330, test_loss: 0.9787, test_f1: 0.5085
 epoch: 7, train_loss: 0.9347, test_loss: 0.9545, test_f1: 0.4980
 epoch: 8, train_loss: 0.9281, test_loss: 0.9584, test_f1: 0.5206
 epoch: 9, train_loss: 0.9039, test_loss: 0.9509, test_f1: 0.5034
 epoch: 10, train_loss: 0.9198, test_loss: 0.9446, test_f1: 0.4875
 epoch: 11, train_loss: 0.8840, test_loss: 0.9024, test_f1: 0.5760
 epoch: 12, train_loss: 0.8803, test_loss: 0.9295, test_f1: 0.5633
 epoch: 13, train_loss: 0.8699, test_loss: 0.8975, test_f1: 0.5358
 epoch: 14, train_loss: 0.8569, test_loss: 0.8996, test_f1: 0.5592
 epoch: 15, train_loss: 0.8588, test_loss: 0.9330, test_f1: 0.5677
 epoch: 16, train_loss: 0.8487, test_loss: 0.9047, test_f1: 0.5593
 epoch: 17, train_loss: 0.8324, test_loss: 0.8655, test_f1: 0.5654
 epoch: 18, train_loss: 0.8330, test_loss: 0.8682, test_f1: 0.5895
 epoch: 19, train_loss: 0.8245, test_loss: 0.8735, test_f1: 0.5579
 epoch: 20, train_loss: 0.8110, test_loss: 0.8961, test_f1: 0.5810
 epoch: 21, train_loss: 0.8030, test_loss: 0.9172, test_f1: 0.5252
 epoch: 22, train_loss: 0.8073, test_loss: 0.8646, test_f1: 0.5977
 epoch: 23, train_loss: 0.8049, test_loss: 0.9440, test_f1: 0.5467
 epoch: 24, train_loss: 0.7777, test_loss: 0.9443, test_f1: 0.5545
 epoch: 25, train_loss: 0.7935, test_loss: 0.8892, test_f1: 0.5866
 epoch: 26, train_loss: 0.7966, test_loss: 0.8418, test_f1: 0.6062
 epoch: 27, train_loss: 0.7618, test_loss: 0.9327, test_f1: 0.5464
 epoch: 28, train_loss: 0.7657, test_loss: 0.8676, test_f1: 0.5869
 epoch: 29, train_loss: 0.7480, test_loss: 0.9033, test_f1: 0.5840
 epoch: 30, train_loss: 0.7420, test_loss: 0.7967, test_f1: 0.6414
 epoch: 31, train_loss: 0.7419, test_loss: 0.8974, test_f1: 0.5250
 epoch: 32, train_loss: 0.7498, test_loss: 0.9598, test_f1: 0.5563
 epoch: 33, train_loss: 0.7602, test_loss: 0.8729, test_f1: 0.5767
 epoch: 34, train_loss: 0.7316, test_loss: 1.3103, test_f1: 0.4992
 epoch: 35, train_loss: 0.7072, test_loss: 0.8540, test_f1: 0.6168
 epoch: 36, train_loss: 0.7123, test_loss: 0.9294, test_f1: 0.6138
 epoch: 37, train_loss: 0.7001, test_loss: 0.8939, test_f1: 0.6264
 epoch: 38, train_loss: 0.6956, test_loss: 0.8962, test_f1: 0.5859
 epoch: 39, train_loss: 0.7067, test_loss: 0.8889, test_f1: 0.5911
 epoch: 40, train_loss: 0.7106, test_loss: 0.8129, test_f1: 0.6041
 epoch: 41, train_loss: 0.6845, test_loss: 0.9231, test_f1: 0.6181
 epoch: 42, train_loss: 0.6719, test_loss: 1.0739, test_f1: 0.6018
 epoch: 43, train_loss: 0.6728, test_loss: 0.8156, test_f1: 0.6245
 epoch: 44, train_loss: 0.6723, test_loss: 0.8930, test_f1: 0.6443
 epoch: 45, train_loss: 0.6669, test_loss: 0.8259, test_f1: 0.6352
 epoch: 46, train_loss: 0.6658, test_loss: 0.8734, test_f1: 0.6304
 epoch: 47, train_loss: 0.6540, test_loss: 0.9023, test_f1: 0.6271
 epoch: 48, train_loss: 0.6466, test_loss: 0.9134, test_f1: 0.5800
 epoch: 49, train_loss: 0.6429, test_loss: 0.8070, test_f1: 0.6435
 epoch: 50, train_loss: 0.6490, test_loss: 0.8415, test_f1: 0.6222
 epoch: 51, train_loss: 0.6137, test_loss: 0.8635, test_f1: 0.6506
 epoch: 52, train_loss: 0.5896, test_loss: 0.8528, test_f1: 0.6596
 epoch: 53, train_loss: 0.5848, test_loss: 0.9544, test_f1: 0.6415
 epoch: 54, train_loss: 0.5753, test_loss: 0.9655, test_f1: 0.6520
 epoch: 55, train_loss: 0.5713, test_loss: 0.8445, test_f1: 0.6515
 epoch: 56, train_loss: 0.5427, test_loss: 0.8873, test_f1: 0.6629
 epoch: 57, train_loss: 0.5567, test_loss: 0.8825, test_f1: 0.6641
 epoch: 58, train_loss: 0.5786, test_loss: 0.8189, test_f1: 0.6757
 epoch: 59, train_loss: 0.5545, test_loss: 0.8619, test_f1: 0.6466
 epoch: 60, train_loss: 0.5461, test_loss: 0.9398, test_f1: 0.6657
 epoch: 61, train_loss: 0.5457, test_loss: 0.8986, test_f1: 0.6707
 epoch: 62, train_loss: 0.5396, test_loss: 0.9002, test_f1: 0.6517
 epoch: 63, train_loss: 0.5628, test_loss: 0.9351, test_f1: 0.6482
 epoch: 64, train_loss: 0.5585, test_loss: 0.8528, test_f1: 0.6518
 epoch: 65, train_loss: 0.5473, test_loss: 0.9739, test_f1: 0.6677
 epoch: 66, train_loss: 0.5230, test_loss: 0.9303, test_f1: 0.6244
 epoch: 67, train_loss: 0.5180, test_loss: 0.9563, test_f1: 0.6629
 epoch: 68, train_loss: 0.5111, test_loss: 0.9236, test_f1: 0.6650
 epoch: 69, train_loss: 0.5246, test_loss: 1.1303, test_f1: 0.6489
 epoch: 70, train_loss: 0.5344, test_loss: 1.0325, test_f1: 0.6309
 epoch: 71, train_loss: 0.5196, test_loss: 1.0852, test_f1: 0.6669
 epoch: 72, train_loss: 0.5258, test_loss: 0.9385, test_f1: 0.6593
 epoch: 73, train_loss: 0.5144, test_loss: 1.0040, test_f1: 0.6720
 epoch: 74, train_loss: 0.4965, test_loss: 1.0046, test_f1: 0.6772
 epoch: 75, train_loss: 0.5057, test_loss: 0.9682, test_f1: 0.6699
 epoch: 76, train_loss: 0.5025, test_loss: 0.9721, test_f1: 0.6868
 epoch: 77, train_loss: 0.4883, test_loss: 0.9280, test_f1: 0.6910
 epoch: 78, train_loss: 0.5052, test_loss: 1.0246, test_f1: 0.6463
 epoch: 79, train_loss: 0.4955, test_loss: 1.0293, test_f1: 0.6869
 epoch: 80, train_loss: 0.4816, test_loss: 1.0212, test_f1: 0.6663
 epoch: 81, train_loss: 0.5029, test_loss: 0.9926, test_f1: 0.6419
 epoch: 82, train_loss: 0.4813, test_loss: 1.0355, test_f1: 0.6582
 epoch: 83, train_loss: 0.4775, test_loss: 1.0127, test_f1: 0.6628
 epoch: 84, train_loss: 0.4806, test_loss: 0.9307, test_f1: 0.6678
 epoch: 85, train_loss: 0.4778, test_loss: 1.0527, test_f1: 0.6633
 epoch: 86, train_loss: 0.4809, test_loss: 0.9925, test_f1: 0.6931
 epoch: 87, train_loss: 0.4619, test_loss: 1.0699, test_f1: 0.6834
 epoch: 88, train_loss: 0.4722, test_loss: 1.0480, test_f1: 0.6696
 epoch: 89, train_loss: 0.4725, test_loss: 1.0366, test_f1: 0.6918
 epoch: 90, train_loss: 0.4801, test_loss: 1.0588, test_f1: 0.6532
 epoch: 91, train_loss: 0.4644, test_loss: 0.9475, test_f1: 0.6725
 epoch: 92, train_loss: 0.4761, test_loss: 0.9526, test_f1: 0.6631
 epoch: 93, train_loss: 0.4739, test_loss: 0.8732, test_f1: 0.6717
 epoch: 94, train_loss: 0.4633, test_loss: 0.8094, test_f1: 0.6954
 epoch: 95, train_loss: 0.4591, test_loss: 1.1362, test_f1: 0.6640
 epoch: 96, train_loss: 0.4697, test_loss: 1.0194, test_f1: 0.6661
 epoch: 97, train_loss: 0.4632, test_loss: 1.0652, test_f1: 0.6837
 epoch: 98, train_loss: 0.4455, test_loss: 0.9176, test_f1: 0.6852
 epoch: 99, train_loss: 0.4423, test_loss: 1.1631, test_f1: 0.6152
##################ITERATION #5 ****************************************
 epoch: 0, train_loss: 1.3212, test_loss: 1.1917, test_f1: 0.3128
 epoch: 1, train_loss: 1.0553, test_loss: 1.0511, test_f1: 0.4550
 epoch: 2, train_loss: 0.9884, test_loss: 0.9974, test_f1: 0.4683
 epoch: 3, train_loss: 0.9575, test_loss: 0.9930, test_f1: 0.4994
 epoch: 4, train_loss: 0.9393, test_loss: 0.9299, test_f1: 0.4995
 epoch: 5, train_loss: 0.9274, test_loss: 1.0500, test_f1: 0.5198
 epoch: 6, train_loss: 0.8991, test_loss: 0.9728, test_f1: 0.5245
 epoch: 7, train_loss: 0.8997, test_loss: 1.0066, test_f1: 0.5018
 epoch: 8, train_loss: 0.8770, test_loss: 0.9286, test_f1: 0.5453
 epoch: 9, train_loss: 0.8682, test_loss: 0.9083, test_f1: 0.5490
 epoch: 10, train_loss: 0.8513, test_loss: 0.9018, test_f1: 0.5426
 epoch: 11, train_loss: 0.8301, test_loss: 0.9337, test_f1: 0.5394
 epoch: 12, train_loss: 0.8415, test_loss: 0.9066, test_f1: 0.5649
 epoch: 13, train_loss: 0.8102, test_loss: 0.9524, test_f1: 0.5404
 epoch: 14, train_loss: 0.7945, test_loss: 0.9028, test_f1: 0.5568
 epoch: 15, train_loss: 0.8019, test_loss: 0.9423, test_f1: 0.5680
 epoch: 16, train_loss: 0.7853, test_loss: 1.0020, test_f1: 0.5707
 epoch: 17, train_loss: 0.8140, test_loss: 0.9448, test_f1: 0.5851
 epoch: 18, train_loss: 0.7777, test_loss: 0.9980, test_f1: 0.5245
 epoch: 19, train_loss: 0.7890, test_loss: 0.9904, test_f1: 0.5734
 epoch: 20, train_loss: 0.7631, test_loss: 1.0984, test_f1: 0.5538
 epoch: 21, train_loss: 0.7595, test_loss: 0.9800, test_f1: 0.6363
 epoch: 22, train_loss: 0.7303, test_loss: 0.9961, test_f1: 0.5672
 epoch: 23, train_loss: 0.7639, test_loss: 1.0770, test_f1: 0.5228
 epoch: 24, train_loss: 0.7422, test_loss: 0.9547, test_f1: 0.5805
 epoch: 25, train_loss: 0.7075, test_loss: 1.0118, test_f1: 0.6148
 epoch: 26, train_loss: 0.6753, test_loss: 1.0300, test_f1: 0.5156
 epoch: 27, train_loss: 0.7096, test_loss: 0.9095, test_f1: 0.5817
 epoch: 28, train_loss: 0.6943, test_loss: 1.0862, test_f1: 0.5671
 epoch: 29, train_loss: 0.7096, test_loss: 1.0054, test_f1: 0.5747
 epoch: 30, train_loss: 0.6896, test_loss: 0.9983, test_f1: 0.5615
 epoch: 31, train_loss: 0.6891, test_loss: 0.9817, test_f1: 0.6029
 epoch: 32, train_loss: 0.6716, test_loss: 1.1103, test_f1: 0.5522
 epoch: 33, train_loss: 0.6603, test_loss: 0.9869, test_f1: 0.6197
 epoch: 34, train_loss: 0.6473, test_loss: 1.0358, test_f1: 0.5962
 epoch: 35, train_loss: 0.6489, test_loss: 0.9700, test_f1: 0.6343
 epoch: 36, train_loss: 0.6355, test_loss: 0.9131, test_f1: 0.5798
 epoch: 37, train_loss: 0.6647, test_loss: 1.0834, test_f1: 0.5904
 epoch: 38, train_loss: 0.6598, test_loss: 1.0016, test_f1: 0.5977
 epoch: 39, train_loss: 0.6302, test_loss: 0.9851, test_f1: 0.6311
 epoch: 40, train_loss: 0.6130, test_loss: 1.0507, test_f1: 0.6306
 epoch: 41, train_loss: 0.5980, test_loss: 1.1462, test_f1: 0.6028
 epoch: 42, train_loss: 0.6083, test_loss: 1.1016, test_f1: 0.5744
 epoch: 43, train_loss: 0.6046, test_loss: 1.0336, test_f1: 0.6312
 epoch: 44, train_loss: 0.5852, test_loss: 1.1612, test_f1: 0.5828
 epoch: 45, train_loss: 0.6126, test_loss: 1.0783, test_f1: 0.6325
 epoch: 46, train_loss: 0.6105, test_loss: 1.0829, test_f1: 0.6258
 epoch: 47, train_loss: 0.5975, test_loss: 1.0995, test_f1: 0.6175
 epoch: 48, train_loss: 0.5648, test_loss: 1.0652, test_f1: 0.6292
 epoch: 49, train_loss: 0.5992, test_loss: 1.1362, test_f1: 0.6245
 epoch: 50, train_loss: 0.5859, test_loss: 1.1951, test_f1: 0.6368
 epoch: 51, train_loss: 0.5462, test_loss: 1.1033, test_f1: 0.6551
 epoch: 52, train_loss: 0.5230, test_loss: 1.1237, test_f1: 0.6213
 epoch: 53, train_loss: 0.5155, test_loss: 1.1511, test_f1: 0.6006
 epoch: 54, train_loss: 0.4958, test_loss: 1.2008, test_f1: 0.6336
 epoch: 55, train_loss: 0.5123, test_loss: 1.2019, test_f1: 0.6405
 epoch: 56, train_loss: 0.5031, test_loss: 1.1787, test_f1: 0.6374
 epoch: 57, train_loss: 0.5139, test_loss: 1.1835, test_f1: 0.6275
 epoch: 58, train_loss: 0.4861, test_loss: 1.2357, test_f1: 0.6229
 epoch: 59, train_loss: 0.4842, test_loss: 1.2449, test_f1: 0.6124
 epoch: 60, train_loss: 0.4883, test_loss: 1.2211, test_f1: 0.6511
 epoch: 61, train_loss: 0.4812, test_loss: 1.1417, test_f1: 0.6368
 epoch: 62, train_loss: 0.4776, test_loss: 1.2085, test_f1: 0.6581
 epoch: 63, train_loss: 0.4661, test_loss: 1.2001, test_f1: 0.6510
 epoch: 64, train_loss: 0.4831, test_loss: 1.2349, test_f1: 0.6490
 epoch: 65, train_loss: 0.4720, test_loss: 1.3391, test_f1: 0.6480
 epoch: 66, train_loss: 0.4601, test_loss: 1.2259, test_f1: 0.6300
 epoch: 67, train_loss: 0.4774, test_loss: 1.2009, test_f1: 0.6467
 epoch: 68, train_loss: 0.4756, test_loss: 1.2075, test_f1: 0.6362
 epoch: 69, train_loss: 0.4592, test_loss: 1.2080, test_f1: 0.6306
 epoch: 70, train_loss: 0.4466, test_loss: 1.2777, test_f1: 0.6523
 epoch: 71, train_loss: 0.4496, test_loss: 1.3830, test_f1: 0.6248
 epoch: 72, train_loss: 0.4340, test_loss: 1.2714, test_f1: 0.6274
 epoch: 73, train_loss: 0.4340, test_loss: 1.3087, test_f1: 0.6205
 epoch: 74, train_loss: 0.4306, test_loss: 1.2914, test_f1: 0.6386
 epoch: 75, train_loss: 0.4414, test_loss: 1.2466, test_f1: 0.6147
 epoch: 76, train_loss: 0.4526, test_loss: 1.2401, test_f1: 0.6249
 epoch: 77, train_loss: 0.4307, test_loss: 1.3578, test_f1: 0.6259
 epoch: 78, train_loss: 0.4231, test_loss: 1.2898, test_f1: 0.6345
 epoch: 79, train_loss: 0.4514, test_loss: 1.2966, test_f1: 0.6361
 epoch: 80, train_loss: 0.4191, test_loss: 1.2908, test_f1: 0.6453
 epoch: 81, train_loss: 0.4311, test_loss: 1.3023, test_f1: 0.6289
 epoch: 82, train_loss: 0.4330, test_loss: 1.3507, test_f1: 0.6391
 epoch: 83, train_loss: 0.4273, test_loss: 1.3082, test_f1: 0.6516
 epoch: 84, train_loss: 0.4517, test_loss: 1.3364, test_f1: 0.6593
 epoch: 85, train_loss: 0.4224, test_loss: 1.3448, test_f1: 0.6353
 epoch: 86, train_loss: 0.4278, test_loss: 1.2220, test_f1: 0.6489
 epoch: 87, train_loss: 0.4160, test_loss: 1.3465, test_f1: 0.6313
 epoch: 88, train_loss: 0.4204, test_loss: 1.3270, test_f1: 0.6280
 epoch: 89, train_loss: 0.3880, test_loss: 1.4028, test_f1: 0.6312
 epoch: 90, train_loss: 0.3802, test_loss: 1.4002, test_f1: 0.6397
 epoch: 91, train_loss: 0.4116, test_loss: 1.3727, test_f1: 0.6231
 epoch: 92, train_loss: 0.3630, test_loss: 1.4847, test_f1: 0.6365
 epoch: 93, train_loss: 0.4010, test_loss: 1.2682, test_f1: 0.6445
 epoch: 94, train_loss: 0.4109, test_loss: 1.3741, test_f1: 0.6542
 epoch: 95, train_loss: 0.4080, test_loss: 1.5028, test_f1: 0.6396
 epoch: 96, train_loss: 0.4187, test_loss: 1.3696, test_f1: 0.6458
 epoch: 97, train_loss: 0.4176, test_loss: 1.4427, test_f1: 0.6401
 epoch: 98, train_loss: 0.4108, test_loss: 1.4047, test_f1: 0.6451
 epoch: 99, train_loss: 0.3747, test_loss: 1.4186, test_f1: 0.6368
##################ITERATION #6 ****************************************
 epoch: 0, train_loss: 1.3136, test_loss: 1.2386, test_f1: 0.3327
 epoch: 1, train_loss: 1.0264, test_loss: 1.0205, test_f1: 0.4744
 epoch: 2, train_loss: 0.9759, test_loss: 1.0032, test_f1: 0.4205
 epoch: 3, train_loss: 0.9524, test_loss: 0.9981, test_f1: 0.4846
 epoch: 4, train_loss: 0.9473, test_loss: 0.9476, test_f1: 0.5315
 epoch: 5, train_loss: 0.9510, test_loss: 1.0511, test_f1: 0.4811
 epoch: 6, train_loss: 0.9216, test_loss: 0.9825, test_f1: 0.5089
 epoch: 7, train_loss: 0.9206, test_loss: 0.9356, test_f1: 0.5178
 epoch: 8, train_loss: 0.9145, test_loss: 0.9792, test_f1: 0.4892
 epoch: 9, train_loss: 0.8827, test_loss: 0.9610, test_f1: 0.5131
 epoch: 10, train_loss: 0.8735, test_loss: 0.9441, test_f1: 0.5344
 epoch: 11, train_loss: 0.8661, test_loss: 0.9345, test_f1: 0.5522
 epoch: 12, train_loss: 0.9059, test_loss: 0.9851, test_f1: 0.5126
 epoch: 13, train_loss: 0.8693, test_loss: 1.1003, test_f1: 0.5042
 epoch: 14, train_loss: 0.8559, test_loss: 0.8702, test_f1: 0.5495
 epoch: 15, train_loss: 0.8385, test_loss: 0.8691, test_f1: 0.5410
 epoch: 16, train_loss: 0.8398, test_loss: 0.9323, test_f1: 0.5689
 epoch: 17, train_loss: 0.8166, test_loss: 0.9238, test_f1: 0.5615
 epoch: 18, train_loss: 0.8158, test_loss: 0.9717, test_f1: 0.5373
 epoch: 19, train_loss: 0.8420, test_loss: 0.9411, test_f1: 0.5390
 epoch: 20, train_loss: 0.8429, test_loss: 0.9864, test_f1: 0.4969
 epoch: 21, train_loss: 0.8279, test_loss: 0.9121, test_f1: 0.5506
 epoch: 22, train_loss: 0.8503, test_loss: 0.9085, test_f1: 0.5334
 epoch: 23, train_loss: 0.8100, test_loss: 0.9810, test_f1: 0.5318
 epoch: 24, train_loss: 0.8315, test_loss: 0.9689, test_f1: 0.5301
 epoch: 25, train_loss: 0.8097, test_loss: 0.9655, test_f1: 0.5326
 epoch: 26, train_loss: 0.8147, test_loss: 0.9383, test_f1: 0.5521
 epoch: 27, train_loss: 0.8031, test_loss: 0.9444, test_f1: 0.5622
 epoch: 28, train_loss: 0.7787, test_loss: 0.9502, test_f1: 0.5587
 epoch: 29, train_loss: 0.7830, test_loss: 0.8783, test_f1: 0.5702
 epoch: 30, train_loss: 0.7772, test_loss: 0.9588, test_f1: 0.5239
 epoch: 31, train_loss: 0.7696, test_loss: 0.9280, test_f1: 0.5646
 epoch: 32, train_loss: 0.7800, test_loss: 1.0366, test_f1: 0.5125
 epoch: 33, train_loss: 0.7683, test_loss: 0.9350, test_f1: 0.5917
 epoch: 34, train_loss: 0.7558, test_loss: 0.9706, test_f1: 0.5417
 epoch: 35, train_loss: 0.7669, test_loss: 0.9457, test_f1: 0.5282
 epoch: 36, train_loss: 0.7450, test_loss: 0.9273, test_f1: 0.5569
 epoch: 37, train_loss: 0.7332, test_loss: 0.9134, test_f1: 0.5684
 epoch: 38, train_loss: 0.7433, test_loss: 0.9006, test_f1: 0.5423
 epoch: 39, train_loss: 0.7240, test_loss: 0.8969, test_f1: 0.5740
 epoch: 40, train_loss: 0.7147, test_loss: 0.9044, test_f1: 0.5426
 epoch: 41, train_loss: 0.7169, test_loss: 0.9947, test_f1: 0.5665
 epoch: 42, train_loss: 0.7140, test_loss: 0.9108, test_f1: 0.5393
 epoch: 43, train_loss: 0.7109, test_loss: 0.9086, test_f1: 0.5967
 epoch: 44, train_loss: 0.7029, test_loss: 0.9421, test_f1: 0.5713
 epoch: 45, train_loss: 0.7075, test_loss: 0.9160, test_f1: 0.6052
 epoch: 46, train_loss: 0.6898, test_loss: 0.8508, test_f1: 0.5808
 epoch: 47, train_loss: 0.6764, test_loss: 0.9125, test_f1: 0.6067
 epoch: 48, train_loss: 0.6748, test_loss: 0.8999, test_f1: 0.5853
 epoch: 49, train_loss: 0.6982, test_loss: 0.9981, test_f1: 0.5541
 epoch: 50, train_loss: 0.6806, test_loss: 0.9141, test_f1: 0.6004
 epoch: 51, train_loss: 0.6514, test_loss: 0.9378, test_f1: 0.5962
 epoch: 52, train_loss: 0.6080, test_loss: 0.9398, test_f1: 0.6037
 epoch: 53, train_loss: 0.6177, test_loss: 0.9409, test_f1: 0.6061
 epoch: 54, train_loss: 0.5903, test_loss: 0.9575, test_f1: 0.6191
 epoch: 55, train_loss: 0.6062, test_loss: 0.9135, test_f1: 0.6261
 epoch: 56, train_loss: 0.5933, test_loss: 0.9402, test_f1: 0.5900
 epoch: 57, train_loss: 0.5926, test_loss: 0.9446, test_f1: 0.6258
 epoch: 58, train_loss: 0.5908, test_loss: 0.9658, test_f1: 0.6206
 epoch: 59, train_loss: 0.5821, test_loss: 0.9926, test_f1: 0.6064
 epoch: 60, train_loss: 0.5600, test_loss: 0.9563, test_f1: 0.6253
 epoch: 61, train_loss: 0.5910, test_loss: 0.9506, test_f1: 0.5892
 epoch: 62, train_loss: 0.5741, test_loss: 0.9667, test_f1: 0.6115
 epoch: 63, train_loss: 0.5642, test_loss: 0.9843, test_f1: 0.6218
 epoch: 64, train_loss: 0.5509, test_loss: 0.9564, test_f1: 0.6237
 epoch: 65, train_loss: 0.5582, test_loss: 0.9630, test_f1: 0.6128
 epoch: 66, train_loss: 0.5698, test_loss: 0.9844, test_f1: 0.6226
 epoch: 67, train_loss: 0.5600, test_loss: 0.9618, test_f1: 0.6326
 epoch: 68, train_loss: 0.5534, test_loss: 1.0641, test_f1: 0.6028
 epoch: 69, train_loss: 0.5529, test_loss: 1.0341, test_f1: 0.6226
 epoch: 70, train_loss: 0.5395, test_loss: 0.9648, test_f1: 0.6194
 epoch: 71, train_loss: 0.5540, test_loss: 0.9746, test_f1: 0.6071
 epoch: 72, train_loss: 0.5321, test_loss: 1.0217, test_f1: 0.6340
 epoch: 73, train_loss: 0.5511, test_loss: 1.0067, test_f1: 0.6279
 epoch: 74, train_loss: 0.5220, test_loss: 1.0344, test_f1: 0.6290
 epoch: 75, train_loss: 0.5333, test_loss: 0.9821, test_f1: 0.6135
 epoch: 76, train_loss: 0.5463, test_loss: 1.1079, test_f1: 0.6091
 epoch: 77, train_loss: 0.5279, test_loss: 1.0335, test_f1: 0.6234
 epoch: 78, train_loss: 0.5240, test_loss: 1.0889, test_f1: 0.6315
 epoch: 79, train_loss: 0.5339, test_loss: 1.0997, test_f1: 0.5981
 epoch: 80, train_loss: 0.5241, test_loss: 1.0774, test_f1: 0.6217
 epoch: 81, train_loss: 0.5153, test_loss: 1.0312, test_f1: 0.6283
 epoch: 82, train_loss: 0.5087, test_loss: 1.0664, test_f1: 0.6270
 epoch: 83, train_loss: 0.5037, test_loss: 0.9667, test_f1: 0.6558
 epoch: 84, train_loss: 0.5041, test_loss: 1.0108, test_f1: 0.6188
 epoch: 85, train_loss: 0.4968, test_loss: 1.0091, test_f1: 0.6443
 epoch: 86, train_loss: 0.4751, test_loss: 1.0483, test_f1: 0.6487
 epoch: 87, train_loss: 0.4889, test_loss: 1.0573, test_f1: 0.6188
 epoch: 88, train_loss: 0.4854, test_loss: 0.9800, test_f1: 0.6473
 epoch: 89, train_loss: 0.5030, test_loss: 0.9798, test_f1: 0.6790
 epoch: 90, train_loss: 0.4925, test_loss: 1.1506, test_f1: 0.6071
 epoch: 91, train_loss: 0.4769, test_loss: 1.0656, test_f1: 0.6369
 epoch: 92, train_loss: 0.4931, test_loss: 1.0852, test_f1: 0.6118
 epoch: 93, train_loss: 0.4797, test_loss: 1.0933, test_f1: 0.6103
 epoch: 94, train_loss: 0.4646, test_loss: 1.2161, test_f1: 0.6148
 epoch: 95, train_loss: 0.4835, test_loss: 1.1552, test_f1: 0.6462
 epoch: 96, train_loss: 0.4739, test_loss: 1.1176, test_f1: 0.6547
 epoch: 97, train_loss: 0.4824, test_loss: 1.0596, test_f1: 0.6484
 epoch: 98, train_loss: 0.4801, test_loss: 1.2177, test_f1: 0.6147
 epoch: 99, train_loss: 0.4778, test_loss: 1.0922, test_f1: 0.6223
##################ITERATION #7 ****************************************
 epoch: 0, train_loss: 1.2973, test_loss: 1.1437, test_f1: 0.3665
 epoch: 1, train_loss: 1.0439, test_loss: 1.0273, test_f1: 0.4345
 epoch: 2, train_loss: 0.9660, test_loss: 0.9683, test_f1: 0.4735
 epoch: 3, train_loss: 0.9471, test_loss: 0.9210, test_f1: 0.5343
 epoch: 4, train_loss: 0.9424, test_loss: 0.9122, test_f1: 0.5342
 epoch: 5, train_loss: 0.9199, test_loss: 0.9539, test_f1: 0.5123
 epoch: 6, train_loss: 0.9246, test_loss: 0.9899, test_f1: 0.5129
 epoch: 7, train_loss: 0.9093, test_loss: 0.9210, test_f1: 0.5511
 epoch: 8, train_loss: 0.9125, test_loss: 0.9462, test_f1: 0.5261
 epoch: 9, train_loss: 0.8990, test_loss: 0.9350, test_f1: 0.5316
 epoch: 10, train_loss: 0.8933, test_loss: 0.8820, test_f1: 0.5840
 epoch: 11, train_loss: 0.8789, test_loss: 0.8627, test_f1: 0.5458
 epoch: 12, train_loss: 0.8702, test_loss: 0.9629, test_f1: 0.5208
 epoch: 13, train_loss: 0.8610, test_loss: 0.9896, test_f1: 0.5102
 epoch: 14, train_loss: 0.8664, test_loss: 0.9787, test_f1: 0.5483
 epoch: 15, train_loss: 0.8374, test_loss: 1.0144, test_f1: 0.5260
 epoch: 16, train_loss: 0.8114, test_loss: 0.9060, test_f1: 0.5643
 epoch: 17, train_loss: 0.8289, test_loss: 0.9339, test_f1: 0.5633
 epoch: 18, train_loss: 0.8247, test_loss: 0.9678, test_f1: 0.5257
 epoch: 19, train_loss: 0.8171, test_loss: 0.8950, test_f1: 0.5642
 epoch: 20, train_loss: 0.8074, test_loss: 0.9181, test_f1: 0.5568
 epoch: 21, train_loss: 0.7858, test_loss: 0.9252, test_f1: 0.5463
 epoch: 22, train_loss: 0.7805, test_loss: 0.9318, test_f1: 0.5505
 epoch: 23, train_loss: 0.7934, test_loss: 0.9378, test_f1: 0.5379
 epoch: 24, train_loss: 0.7751, test_loss: 0.8798, test_f1: 0.6029
 epoch: 25, train_loss: 0.7659, test_loss: 0.9282, test_f1: 0.5472
 epoch: 26, train_loss: 0.7804, test_loss: 0.9016, test_f1: 0.5922
 epoch: 27, train_loss: 0.7536, test_loss: 0.9200, test_f1: 0.5545
 epoch: 28, train_loss: 0.7576, test_loss: 0.9024, test_f1: 0.6098
 epoch: 29, train_loss: 0.7452, test_loss: 0.8472, test_f1: 0.6077
 epoch: 30, train_loss: 0.7302, test_loss: 0.9105, test_f1: 0.5833
 epoch: 31, train_loss: 0.7184, test_loss: 0.8539, test_f1: 0.5957
 epoch: 32, train_loss: 0.7229, test_loss: 0.9467, test_f1: 0.5542
 epoch: 33, train_loss: 0.7090, test_loss: 0.8741, test_f1: 0.6034
 epoch: 34, train_loss: 0.7198, test_loss: 0.8824, test_f1: 0.5903
 epoch: 35, train_loss: 0.7010, test_loss: 0.9004, test_f1: 0.5897
 epoch: 36, train_loss: 0.7102, test_loss: 0.8415, test_f1: 0.5783
 epoch: 37, train_loss: 0.7003, test_loss: 0.9398, test_f1: 0.5430
 epoch: 38, train_loss: 0.6833, test_loss: 0.9334, test_f1: 0.5944
 epoch: 39, train_loss: 0.6791, test_loss: 0.9325, test_f1: 0.5991
 epoch: 40, train_loss: 0.6610, test_loss: 0.8869, test_f1: 0.5928
 epoch: 41, train_loss: 0.6682, test_loss: 0.9144, test_f1: 0.5948
 epoch: 42, train_loss: 0.6564, test_loss: 0.9196, test_f1: 0.6046
 epoch: 43, train_loss: 0.6541, test_loss: 0.8756, test_f1: 0.6368
 epoch: 44, train_loss: 0.6748, test_loss: 0.8645, test_f1: 0.6105
 epoch: 45, train_loss: 0.6795, test_loss: 0.9019, test_f1: 0.6186
 epoch: 46, train_loss: 0.6590, test_loss: 0.8066, test_f1: 0.6552
 epoch: 47, train_loss: 0.6587, test_loss: 0.8822, test_f1: 0.6186
 epoch: 48, train_loss: 0.6285, test_loss: 0.8802, test_f1: 0.6043
 epoch: 49, train_loss: 0.6356, test_loss: 0.8483, test_f1: 0.6239
 epoch: 50, train_loss: 0.6239, test_loss: 0.8954, test_f1: 0.6158
 epoch: 51, train_loss: 0.6013, test_loss: 0.8722, test_f1: 0.6548
 epoch: 52, train_loss: 0.5720, test_loss: 0.8321, test_f1: 0.6321
 epoch: 53, train_loss: 0.5608, test_loss: 0.8845, test_f1: 0.6291
 epoch: 54, train_loss: 0.5566, test_loss: 0.8708, test_f1: 0.6375
 epoch: 55, train_loss: 0.5436, test_loss: 0.8718, test_f1: 0.6248
 epoch: 56, train_loss: 0.5570, test_loss: 0.8747, test_f1: 0.6539
 epoch: 57, train_loss: 0.5446, test_loss: 0.9017, test_f1: 0.6319
 epoch: 58, train_loss: 0.5244, test_loss: 0.9185, test_f1: 0.6155
 epoch: 59, train_loss: 0.5519, test_loss: 0.9655, test_f1: 0.6075
 epoch: 60, train_loss: 0.5322, test_loss: 0.9120, test_f1: 0.6399
 epoch: 61, train_loss: 0.5232, test_loss: 0.8909, test_f1: 0.6312
 epoch: 62, train_loss: 0.5162, test_loss: 0.9809, test_f1: 0.6289
 epoch: 63, train_loss: 0.5177, test_loss: 0.9945, test_f1: 0.6337
 epoch: 64, train_loss: 0.5128, test_loss: 0.9376, test_f1: 0.6444
 epoch: 65, train_loss: 0.5258, test_loss: 0.9463, test_f1: 0.6270
 epoch: 66, train_loss: 0.5054, test_loss: 0.9903, test_f1: 0.6460
 epoch: 67, train_loss: 0.5057, test_loss: 1.0023, test_f1: 0.6490
 epoch: 68, train_loss: 0.5042, test_loss: 1.0178, test_f1: 0.6389
 epoch: 69, train_loss: 0.5118, test_loss: 1.0407, test_f1: 0.6030
 epoch: 70, train_loss: 0.5023, test_loss: 0.9711, test_f1: 0.6587
 epoch: 71, train_loss: 0.5002, test_loss: 1.0724, test_f1: 0.6182
 epoch: 72, train_loss: 0.5046, test_loss: 0.9362, test_f1: 0.6559
 epoch: 73, train_loss: 0.5158, test_loss: 0.9550, test_f1: 0.6287
 epoch: 74, train_loss: 0.5016, test_loss: 0.9940, test_f1: 0.6575
 epoch: 75, train_loss: 0.4792, test_loss: 1.0368, test_f1: 0.6478
 epoch: 76, train_loss: 0.4886, test_loss: 0.9858, test_f1: 0.6576
 epoch: 77, train_loss: 0.4848, test_loss: 1.0787, test_f1: 0.6164
 epoch: 78, train_loss: 0.4706, test_loss: 1.0867, test_f1: 0.6369
 epoch: 79, train_loss: 0.4848, test_loss: 1.0607, test_f1: 0.6358
 epoch: 80, train_loss: 0.4763, test_loss: 0.9949, test_f1: 0.6474
 epoch: 81, train_loss: 0.4537, test_loss: 1.0576, test_f1: 0.6522
 epoch: 82, train_loss: 0.4760, test_loss: 1.0340, test_f1: 0.6612
 epoch: 83, train_loss: 0.4708, test_loss: 1.0428, test_f1: 0.6312
 epoch: 84, train_loss: 0.4658, test_loss: 1.0351, test_f1: 0.6169
 epoch: 85, train_loss: 0.4559, test_loss: 0.9850, test_f1: 0.6715
 epoch: 86, train_loss: 0.4735, test_loss: 1.1132, test_f1: 0.6216
 epoch: 87, train_loss: 0.4529, test_loss: 1.0789, test_f1: 0.6619
 epoch: 88, train_loss: 0.4579, test_loss: 1.0354, test_f1: 0.6654
 epoch: 89, train_loss: 0.4399, test_loss: 1.1047, test_f1: 0.6422
 epoch: 90, train_loss: 0.4575, test_loss: 1.1274, test_f1: 0.6243
 epoch: 91, train_loss: 0.4365, test_loss: 1.0000, test_f1: 0.6681
 epoch: 92, train_loss: 0.4526, test_loss: 1.0448, test_f1: 0.6458
 epoch: 93, train_loss: 0.4389, test_loss: 1.1262, test_f1: 0.6414
 epoch: 94, train_loss: 0.4612, test_loss: 1.1067, test_f1: 0.6476
 epoch: 95, train_loss: 0.4416, test_loss: 1.0587, test_f1: 0.6767
 epoch: 96, train_loss: 0.4432, test_loss: 1.1806, test_f1: 0.6124
 epoch: 97, train_loss: 0.4323, test_loss: 1.1191, test_f1: 0.6620
 epoch: 98, train_loss: 0.4427, test_loss: 1.1328, test_f1: 0.6228
 epoch: 99, train_loss: 0.4381, test_loss: 1.0919, test_f1: 0.6782
##################ITERATION #8 ****************************************
 epoch: 0, train_loss: 1.3108, test_loss: 1.1459, test_f1: 0.3295
 epoch: 1, train_loss: 1.0329, test_loss: 1.0541, test_f1: 0.4379
 epoch: 2, train_loss: 0.9733, test_loss: 1.1044, test_f1: 0.4319
 epoch: 3, train_loss: 0.9487, test_loss: 0.9709, test_f1: 0.4696
 epoch: 4, train_loss: 0.9370, test_loss: 0.9493, test_f1: 0.4755
 epoch: 5, train_loss: 0.9333, test_loss: 0.9588, test_f1: 0.5097
 epoch: 6, train_loss: 0.9158, test_loss: 0.9064, test_f1: 0.5371
 epoch: 7, train_loss: 0.8995, test_loss: 0.9251, test_f1: 0.5456
 epoch: 8, train_loss: 0.8922, test_loss: 0.9716, test_f1: 0.5235
 epoch: 9, train_loss: 0.8876, test_loss: 0.8862, test_f1: 0.5296
 epoch: 10, train_loss: 0.8857, test_loss: 0.8587, test_f1: 0.5365
 epoch: 11, train_loss: 0.8630, test_loss: 0.9313, test_f1: 0.5388
 epoch: 12, train_loss: 0.8713, test_loss: 0.8899, test_f1: 0.5478
 epoch: 13, train_loss: 0.8501, test_loss: 0.9582, test_f1: 0.5539
 epoch: 14, train_loss: 0.8697, test_loss: 0.9497, test_f1: 0.5173
 epoch: 15, train_loss: 0.8423, test_loss: 0.9143, test_f1: 0.5068
 epoch: 16, train_loss: 0.8266, test_loss: 0.9791, test_f1: 0.5657
 epoch: 17, train_loss: 0.8046, test_loss: 0.9296, test_f1: 0.5643
 epoch: 18, train_loss: 0.8187, test_loss: 0.9433, test_f1: 0.5532
 epoch: 19, train_loss: 0.7935, test_loss: 0.9960, test_f1: 0.5579
 epoch: 20, train_loss: 0.8029, test_loss: 0.9062, test_f1: 0.5775
 epoch: 21, train_loss: 0.7938, test_loss: 0.8979, test_f1: 0.5874
 epoch: 22, train_loss: 0.7868, test_loss: 0.9117, test_f1: 0.5743
 epoch: 23, train_loss: 0.7711, test_loss: 0.9788, test_f1: 0.5608
 epoch: 24, train_loss: 0.7940, test_loss: 0.9608, test_f1: 0.5441
 epoch: 25, train_loss: 0.7527, test_loss: 1.1698, test_f1: 0.4959
 epoch: 26, train_loss: 0.7617, test_loss: 0.9440, test_f1: 0.6077
 epoch: 27, train_loss: 0.7399, test_loss: 0.9736, test_f1: 0.5513
 epoch: 28, train_loss: 0.7371, test_loss: 0.9807, test_f1: 0.5554
 epoch: 29, train_loss: 0.7276, test_loss: 0.9144, test_f1: 0.4952
 epoch: 30, train_loss: 0.7156, test_loss: 1.0277, test_f1: 0.5648
 epoch: 31, train_loss: 0.7437, test_loss: 0.9478, test_f1: 0.5927
 epoch: 32, train_loss: 0.7207, test_loss: 0.9297, test_f1: 0.6117
 epoch: 33, train_loss: 0.7162, test_loss: 0.9328, test_f1: 0.5962
 epoch: 34, train_loss: 0.7158, test_loss: 0.8890, test_f1: 0.6004
 epoch: 35, train_loss: 0.7000, test_loss: 0.9181, test_f1: 0.6097
 epoch: 36, train_loss: 0.6999, test_loss: 0.9851, test_f1: 0.5706
 epoch: 37, train_loss: 0.6903, test_loss: 0.9507, test_f1: 0.5997
 epoch: 38, train_loss: 0.6644, test_loss: 0.9558, test_f1: 0.5528
 epoch: 39, train_loss: 0.7079, test_loss: 1.1517, test_f1: 0.5259
 epoch: 40, train_loss: 0.6887, test_loss: 0.8681, test_f1: 0.5680
 epoch: 41, train_loss: 0.6667, test_loss: 1.0075, test_f1: 0.5625
 epoch: 42, train_loss: 0.6508, test_loss: 0.9598, test_f1: 0.6022
 epoch: 43, train_loss: 0.6462, test_loss: 0.8069, test_f1: 0.6043
 epoch: 44, train_loss: 0.6889, test_loss: 0.8982, test_f1: 0.6295
 epoch: 45, train_loss: 0.6800, test_loss: 0.9859, test_f1: 0.6313
 epoch: 46, train_loss: 0.6515, test_loss: 1.1147, test_f1: 0.5628
 epoch: 47, train_loss: 0.6225, test_loss: 1.0298, test_f1: 0.6070
 epoch: 48, train_loss: 0.6422, test_loss: 0.9297, test_f1: 0.6064
 epoch: 49, train_loss: 0.6308, test_loss: 0.8999, test_f1: 0.6264
 epoch: 50, train_loss: 0.6304, test_loss: 1.0379, test_f1: 0.5762
 epoch: 51, train_loss: 0.5950, test_loss: 0.9431, test_f1: 0.6253
 epoch: 52, train_loss: 0.5669, test_loss: 0.9786, test_f1: 0.6315
 epoch: 53, train_loss: 0.5584, test_loss: 0.9491, test_f1: 0.6461
 epoch: 54, train_loss: 0.5406, test_loss: 0.9763, test_f1: 0.6644
 epoch: 55, train_loss: 0.5571, test_loss: 0.9943, test_f1: 0.6243
 epoch: 56, train_loss: 0.5400, test_loss: 0.9909, test_f1: 0.6276
 epoch: 57, train_loss: 0.5377, test_loss: 0.9444, test_f1: 0.6304
 epoch: 58, train_loss: 0.5109, test_loss: 0.9892, test_f1: 0.6409
 epoch: 59, train_loss: 0.5226, test_loss: 0.9786, test_f1: 0.6545
 epoch: 60, train_loss: 0.5502, test_loss: 0.9863, test_f1: 0.6557
 epoch: 61, train_loss: 0.5325, test_loss: 1.0293, test_f1: 0.6148
 epoch: 62, train_loss: 0.5207, test_loss: 0.9854, test_f1: 0.6609
 epoch: 63, train_loss: 0.4877, test_loss: 1.0539, test_f1: 0.6291
 epoch: 64, train_loss: 0.4940, test_loss: 1.0600, test_f1: 0.6488
 epoch: 65, train_loss: 0.4991, test_loss: 1.0965, test_f1: 0.6194
 epoch: 66, train_loss: 0.5000, test_loss: 1.1804, test_f1: 0.6291
 epoch: 67, train_loss: 0.5132, test_loss: 1.1562, test_f1: 0.6147
 epoch: 68, train_loss: 0.4941, test_loss: 1.0952, test_f1: 0.6431
 epoch: 69, train_loss: 0.4814, test_loss: 1.0931, test_f1: 0.6558
 epoch: 70, train_loss: 0.4682, test_loss: 1.1671, test_f1: 0.6461
 epoch: 71, train_loss: 0.4731, test_loss: 1.1448, test_f1: 0.6557
 epoch: 72, train_loss: 0.4860, test_loss: 1.1782, test_f1: 0.6529
 epoch: 73, train_loss: 0.4844, test_loss: 1.0944, test_f1: 0.6554
 epoch: 74, train_loss: 0.4694, test_loss: 1.1894, test_f1: 0.6397
 epoch: 75, train_loss: 0.4849, test_loss: 1.1113, test_f1: 0.6564
 epoch: 76, train_loss: 0.4569, test_loss: 1.1647, test_f1: 0.6406
 epoch: 77, train_loss: 0.4366, test_loss: 1.1607, test_f1: 0.6448
 epoch: 78, train_loss: 0.4611, test_loss: 1.0622, test_f1: 0.6715
 epoch: 79, train_loss: 0.4699, test_loss: 1.0937, test_f1: 0.6485
 epoch: 80, train_loss: 0.4416, test_loss: 1.1625, test_f1: 0.6397
 epoch: 81, train_loss: 0.4558, test_loss: 1.1436, test_f1: 0.6458
 epoch: 82, train_loss: 0.4342, test_loss: 1.1498, test_f1: 0.6475
 epoch: 83, train_loss: 0.4455, test_loss: 1.1404, test_f1: 0.6302
 epoch: 84, train_loss: 0.4614, test_loss: 1.1479, test_f1: 0.6570
 epoch: 85, train_loss: 0.4391, test_loss: 1.2054, test_f1: 0.6275
 epoch: 86, train_loss: 0.4328, test_loss: 1.1335, test_f1: 0.6532
 epoch: 87, train_loss: 0.4373, test_loss: 1.2186, test_f1: 0.6264
 epoch: 88, train_loss: 0.4374, test_loss: 1.1660, test_f1: 0.6246
 epoch: 89, train_loss: 0.4357, test_loss: 1.1811, test_f1: 0.6388
 epoch: 90, train_loss: 0.4200, test_loss: 1.2292, test_f1: 0.6603
 epoch: 91, train_loss: 0.4399, test_loss: 1.1696, test_f1: 0.6522
 epoch: 92, train_loss: 0.4289, test_loss: 1.1249, test_f1: 0.6373
 epoch: 93, train_loss: 0.4334, test_loss: 1.1741, test_f1: 0.6455
 epoch: 94, train_loss: 0.4318, test_loss: 1.3030, test_f1: 0.6582
 epoch: 95, train_loss: 0.4582, test_loss: 1.2018, test_f1: 0.6436
 epoch: 96, train_loss: 0.4155, test_loss: 1.2781, test_f1: 0.6537
 epoch: 97, train_loss: 0.4170, test_loss: 1.2350, test_f1: 0.6423
 epoch: 98, train_loss: 0.4192, test_loss: 1.1860, test_f1: 0.6577
 epoch: 99, train_loss: 0.4264, test_loss: 1.2074, test_f1: 0.6570
##################ITERATION #9 ****************************************
 epoch: 0, train_loss: 1.2951, test_loss: 1.3025, test_f1: 0.2611
 epoch: 1, train_loss: 1.0145, test_loss: 1.0184, test_f1: 0.3937
 epoch: 2, train_loss: 0.9754, test_loss: 0.9792, test_f1: 0.4238
 epoch: 3, train_loss: 0.9742, test_loss: 1.0661, test_f1: 0.4699
 epoch: 4, train_loss: 0.9462, test_loss: 0.9569, test_f1: 0.4776
 epoch: 5, train_loss: 0.9310, test_loss: 0.9754, test_f1: 0.5058
 epoch: 6, train_loss: 0.9200, test_loss: 0.9596, test_f1: 0.4851
 epoch: 7, train_loss: 0.9020, test_loss: 0.9970, test_f1: 0.5114
 epoch: 8, train_loss: 0.8856, test_loss: 0.9686, test_f1: 0.5066
 epoch: 9, train_loss: 0.8870, test_loss: 0.9598, test_f1: 0.5254
 epoch: 10, train_loss: 0.8735, test_loss: 0.9310, test_f1: 0.5241
 epoch: 11, train_loss: 0.8812, test_loss: 0.9725, test_f1: 0.5099
 epoch: 12, train_loss: 0.8532, test_loss: 0.9380, test_f1: 0.5143
 epoch: 13, train_loss: 0.8528, test_loss: 0.9509, test_f1: 0.5263
 epoch: 14, train_loss: 0.8441, test_loss: 0.9167, test_f1: 0.5248
 epoch: 15, train_loss: 0.8247, test_loss: 0.9973, test_f1: 0.5142
 epoch: 16, train_loss: 0.8371, test_loss: 0.9405, test_f1: 0.5256
 epoch: 17, train_loss: 0.8358, test_loss: 0.9172, test_f1: 0.5681
 epoch: 18, train_loss: 0.8322, test_loss: 0.8569, test_f1: 0.5449
 epoch: 19, train_loss: 0.7998, test_loss: 0.9809, test_f1: 0.5515
 epoch: 20, train_loss: 0.8041, test_loss: 0.9159, test_f1: 0.5549
 epoch: 21, train_loss: 0.7753, test_loss: 0.9065, test_f1: 0.5380
 epoch: 22, train_loss: 0.7732, test_loss: 0.8661, test_f1: 0.5783
 epoch: 23, train_loss: 0.7674, test_loss: 1.0208, test_f1: 0.5498
 epoch: 24, train_loss: 0.7736, test_loss: 0.9635, test_f1: 0.5852
 epoch: 25, train_loss: 0.7702, test_loss: 0.8910, test_f1: 0.5218
 epoch: 26, train_loss: 0.7558, test_loss: 0.9099, test_f1: 0.5613
 epoch: 27, train_loss: 0.7465, test_loss: 0.9386, test_f1: 0.5433
 epoch: 28, train_loss: 0.7381, test_loss: 0.9224, test_f1: 0.5408
 epoch: 29, train_loss: 0.7413, test_loss: 0.9146, test_f1: 0.6067
 epoch: 30, train_loss: 0.7244, test_loss: 0.9491, test_f1: 0.5839
 epoch: 31, train_loss: 0.7312, test_loss: 1.2858, test_f1: 0.5210
 epoch: 32, train_loss: 0.7223, test_loss: 0.9038, test_f1: 0.5551
 epoch: 33, train_loss: 0.7128, test_loss: 0.9459, test_f1: 0.5909
 epoch: 34, train_loss: 0.7028, test_loss: 0.8616, test_f1: 0.6279
 epoch: 35, train_loss: 0.6834, test_loss: 0.9005, test_f1: 0.6128
 epoch: 36, train_loss: 0.7038, test_loss: 0.9043, test_f1: 0.5785
 epoch: 37, train_loss: 0.7013, test_loss: 1.3326, test_f1: 0.4167
 epoch: 38, train_loss: 0.7098, test_loss: 0.9542, test_f1: 0.6213
 epoch: 39, train_loss: 0.6817, test_loss: 0.9605, test_f1: 0.5492
 epoch: 40, train_loss: 0.6674, test_loss: 0.8879, test_f1: 0.5941
 epoch: 41, train_loss: 0.6522, test_loss: 0.8893, test_f1: 0.6018
 epoch: 42, train_loss: 0.6571, test_loss: 0.9640, test_f1: 0.6265
 epoch: 43, train_loss: 0.6571, test_loss: 0.9063, test_f1: 0.6223
 epoch: 44, train_loss: 0.6562, test_loss: 0.9678, test_f1: 0.6085
 epoch: 45, train_loss: 0.6641, test_loss: 1.1686, test_f1: 0.5663
 epoch: 46, train_loss: 0.6262, test_loss: 0.8633, test_f1: 0.6280
 epoch: 47, train_loss: 0.6469, test_loss: 0.8655, test_f1: 0.6209
 epoch: 48, train_loss: 0.6486, test_loss: 0.9840, test_f1: 0.6377
 epoch: 49, train_loss: 0.6377, test_loss: 0.9328, test_f1: 0.5920
 epoch: 50, train_loss: 0.6276, test_loss: 0.9398, test_f1: 0.6039
 epoch: 51, train_loss: 0.6065, test_loss: 0.9041, test_f1: 0.6317
 epoch: 52, train_loss: 0.5731, test_loss: 0.8599, test_f1: 0.6614
 epoch: 53, train_loss: 0.5730, test_loss: 0.8533, test_f1: 0.6659
 epoch: 54, train_loss: 0.5482, test_loss: 0.9238, test_f1: 0.6256
 epoch: 55, train_loss: 0.5506, test_loss: 0.9151, test_f1: 0.6540
 epoch: 56, train_loss: 0.5757, test_loss: 0.9352, test_f1: 0.6175
 epoch: 57, train_loss: 0.5620, test_loss: 0.8842, test_f1: 0.6532
 epoch: 58, train_loss: 0.5429, test_loss: 0.9685, test_f1: 0.6207
 epoch: 59, train_loss: 0.5407, test_loss: 0.9264, test_f1: 0.6381
 epoch: 60, train_loss: 0.5281, test_loss: 0.9599, test_f1: 0.6497
 epoch: 61, train_loss: 0.5338, test_loss: 0.9467, test_f1: 0.6449
 epoch: 62, train_loss: 0.5502, test_loss: 0.9855, test_f1: 0.6352
 epoch: 63, train_loss: 0.5327, test_loss: 0.9814, test_f1: 0.6279
 epoch: 64, train_loss: 0.5238, test_loss: 0.9054, test_f1: 0.6350
 epoch: 65, train_loss: 0.5306, test_loss: 0.8694, test_f1: 0.6578
 epoch: 66, train_loss: 0.5236, test_loss: 0.9753, test_f1: 0.6512
 epoch: 67, train_loss: 0.5236, test_loss: 1.0435, test_f1: 0.6169
 epoch: 68, train_loss: 0.5129, test_loss: 0.9077, test_f1: 0.6490
 epoch: 69, train_loss: 0.5294, test_loss: 0.9321, test_f1: 0.6701
 epoch: 70, train_loss: 0.5061, test_loss: 0.9590, test_f1: 0.6544
 epoch: 71, train_loss: 0.5133, test_loss: 0.8759, test_f1: 0.6665
 epoch: 72, train_loss: 0.4907, test_loss: 0.9667, test_f1: 0.6446
 epoch: 73, train_loss: 0.5046, test_loss: 0.9785, test_f1: 0.6674
 epoch: 74, train_loss: 0.5005, test_loss: 0.9844, test_f1: 0.6574
 epoch: 75, train_loss: 0.4775, test_loss: 0.9677, test_f1: 0.6786
 epoch: 76, train_loss: 0.4867, test_loss: 0.9725, test_f1: 0.6711
 epoch: 77, train_loss: 0.4802, test_loss: 1.0077, test_f1: 0.6609
 epoch: 78, train_loss: 0.4997, test_loss: 1.0743, test_f1: 0.6747
 epoch: 79, train_loss: 0.4997, test_loss: 1.0192, test_f1: 0.6950
 epoch: 80, train_loss: 0.5047, test_loss: 1.0106, test_f1: 0.6646
 epoch: 81, train_loss: 0.4805, test_loss: 1.0024, test_f1: 0.6457
 epoch: 82, train_loss: 0.4791, test_loss: 1.0838, test_f1: 0.6315
 epoch: 83, train_loss: 0.4768, test_loss: 1.0045, test_f1: 0.6595
 epoch: 84, train_loss: 0.4702, test_loss: 1.0337, test_f1: 0.6689
 epoch: 85, train_loss: 0.4746, test_loss: 1.0062, test_f1: 0.6691
 epoch: 86, train_loss: 0.4741, test_loss: 1.0372, test_f1: 0.6629
 epoch: 87, train_loss: 0.4674, test_loss: 1.0211, test_f1: 0.6869
 epoch: 88, train_loss: 0.4685, test_loss: 1.0455, test_f1: 0.6655
 epoch: 89, train_loss: 0.4765, test_loss: 1.1310, test_f1: 0.6635
 epoch: 90, train_loss: 0.4478, test_loss: 1.0538, test_f1: 0.6816
 epoch: 91, train_loss: 0.4747, test_loss: 1.1110, test_f1: 0.6484
 epoch: 92, train_loss: 0.4947, test_loss: 1.0714, test_f1: 0.6383
 epoch: 93, train_loss: 0.4639, test_loss: 1.0146, test_f1: 0.6691
 epoch: 94, train_loss: 0.4576, test_loss: 1.2116, test_f1: 0.6258
 epoch: 95, train_loss: 0.4644, test_loss: 0.9949, test_f1: 0.6792
 epoch: 96, train_loss: 0.4721, test_loss: 1.0055, test_f1: 0.6971
 epoch: 97, train_loss: 0.4394, test_loss: 1.0692, test_f1: 0.6491
 epoch: 98, train_loss: 0.4517, test_loss: 1.0547, test_f1: 0.6877
 epoch: 99, train_loss: 0.4615, test_loss: 0.9987, test_f1: 0.6693

Training completed in 661.58 seconds
Best F1: 0.6983 at epoch 96
Mean F1 across iterations: 0.6834  0.0119
========================FINAL RESULTS================================
FEGIN weighted F1: 0.6983  0.0119
python main.py --data ltspice_examples --representation component_net --model FEGIN --layers 3 --hiddens 64 --batch_size 128 --lr 0.01 --emb_size 250 --epochs 100 --save_appendix component_net_L3_H64_BS128_LR0.01_E250 --no_val
-----



STDERR:
  File "main.py", line 370, in <module>
    main()
  File "main.py", line 254, in main
    dataset = dataset_class(
  File "/home/philip/projects/llm_inference_code_repo/Circuit-Completion-Using-GNNs/component_classification_with_link_prediction_head/evaluation/FEGIN/kernel/circuit_datasets.py", line 15, in __init__
    self.data, self.slices = torch.load(self.processed_paths[0])
  File "/home/philip/.local/lib/python3.8/site-packages/torch/serialization.py", line 1040, in load
    warnings.warn(
  File "/usr/lib/python3.8/warnings.py", line 109, in _showwarnmsg
    sw(msg.message, msg.category, msg.filename, msg.lineno,
  File "main.py", line 47, in warn_with_traceback
    traceback.print_stack(file=log)
/home/philip/projects/llm_inference_code_repo/Circuit-Completion-Using-GNNs/component_classification_with_link_prediction_head/evaluation/FEGIN/kernel/circuit_datasets.py:15: FutureWarning: You are using `torch.load` with `weights_only=False` (the current default value), which uses the default pickle module implicitly. It is possible to construct malicious pickle data which will execute arbitrary code during unpickling (See https://github.com/pytorch/pytorch/blob/main/SECURITY.md#untrusted-models for more details). In a future release, the default value for `weights_only` will be flipped to `True`. This limits the functions that could be executed during unpickling. Arbitrary objects will no longer be allowed to be loaded via this mode unless they are explicitly allowlisted by the user via `torch.serialization.add_safe_globals`. We recommend you start setting `weights_only=True` for any use case where you don't have full control of the loaded file. Please open an issue on GitHub for any issues related to this experimental feature.
  self.data, self.slices = torch.load(self.processed_paths[0])
