STDOUT:
Results will be saved in /home/philip/projects/ltspice_examples_code_repo/Circuit-Completion-Using-GNNs/component_classification_with_link_prediction_head/evaluation/FEGIN/results/model_FEGIN_dataset_ltspice_examples
Command line input: python main.py --data ltspice_examples --representation component_component --model FEGIN --layers 5 --hiddens 16 --batch_size 128 --lr 0.001 --emb_size 128 --epochs 100 --save_appendix component_component_L5_H16_BS128_LR0.001_E128 --no_val
 is saved.
-----
ltspice_examples - FEGIN
Using 5 layers, 16 hidden units, h = 2
Loading component_component representation dataset
ENTERED
Training FEGIN on component_component representation
Train: 3556, Test: 845
##################ITERATION #0 ****************************************
 epoch: 0, train_loss: 1.3935, test_loss: 1.3672, test_f1: 0.2220
 epoch: 1, train_loss: 1.3379, test_loss: 1.3256, test_f1: 0.2274
 epoch: 2, train_loss: 1.3097, test_loss: 1.3058, test_f1: 0.2274
 epoch: 3, train_loss: 1.2914, test_loss: 1.2857, test_f1: 0.2274
 epoch: 4, train_loss: 1.2747, test_loss: 1.2702, test_f1: 0.2274
 epoch: 5, train_loss: 1.2628, test_loss: 1.2569, test_f1: 0.2274
 epoch: 6, train_loss: 1.2524, test_loss: 1.2476, test_f1: 0.2274
 epoch: 7, train_loss: 1.2426, test_loss: 1.2288, test_f1: 0.2274
 epoch: 8, train_loss: 1.2337, test_loss: 1.2135, test_f1: 0.2274
 epoch: 9, train_loss: 1.2166, test_loss: 1.2020, test_f1: 0.2856
 epoch: 10, train_loss: 1.2107, test_loss: 1.1869, test_f1: 0.3811
 epoch: 11, train_loss: 1.1977, test_loss: 1.1717, test_f1: 0.4252
 epoch: 12, train_loss: 1.1871, test_loss: 1.1615, test_f1: 0.4315
 epoch: 13, train_loss: 1.1819, test_loss: 1.1443, test_f1: 0.4387
 epoch: 14, train_loss: 1.1823, test_loss: 1.1368, test_f1: 0.4503
 epoch: 15, train_loss: 1.1642, test_loss: 1.1291, test_f1: 0.4471
 epoch: 16, train_loss: 1.1594, test_loss: 1.1118, test_f1: 0.4611
 epoch: 17, train_loss: 1.1499, test_loss: 1.1036, test_f1: 0.4411
 epoch: 18, train_loss: 1.1390, test_loss: 1.0915, test_f1: 0.4604
 epoch: 19, train_loss: 1.1273, test_loss: 1.0778, test_f1: 0.4690
 epoch: 20, train_loss: 1.1283, test_loss: 1.0766, test_f1: 0.4660
 epoch: 21, train_loss: 1.1166, test_loss: 1.0753, test_f1: 0.4385
 epoch: 22, train_loss: 1.1082, test_loss: 1.0697, test_f1: 0.4760
 epoch: 23, train_loss: 1.0979, test_loss: 1.0650, test_f1: 0.4554
 epoch: 24, train_loss: 1.0819, test_loss: 1.0465, test_f1: 0.4646
 epoch: 25, train_loss: 1.0880, test_loss: 1.0535, test_f1: 0.4760
 epoch: 26, train_loss: 1.0721, test_loss: 1.0440, test_f1: 0.4726
 epoch: 27, train_loss: 1.0715, test_loss: 1.0317, test_f1: 0.4660
 epoch: 28, train_loss: 1.0697, test_loss: 1.0375, test_f1: 0.4726
 epoch: 29, train_loss: 1.0521, test_loss: 1.0259, test_f1: 0.4824
 epoch: 30, train_loss: 1.0502, test_loss: 1.0269, test_f1: 0.4826
 epoch: 31, train_loss: 1.0416, test_loss: 1.0219, test_f1: 0.4755
 epoch: 32, train_loss: 1.0264, test_loss: 1.0235, test_f1: 0.4786
 epoch: 33, train_loss: 1.0295, test_loss: 1.0050, test_f1: 0.4952
 epoch: 34, train_loss: 1.0318, test_loss: 1.0226, test_f1: 0.4867
 epoch: 35, train_loss: 1.0165, test_loss: 1.0073, test_f1: 0.5005
 epoch: 36, train_loss: 1.0023, test_loss: 0.9976, test_f1: 0.5029
 epoch: 37, train_loss: 1.0102, test_loss: 1.0052, test_f1: 0.4753
 epoch: 38, train_loss: 1.0005, test_loss: 1.0289, test_f1: 0.4843
 epoch: 39, train_loss: 1.0001, test_loss: 1.0147, test_f1: 0.4660
 epoch: 40, train_loss: 0.9908, test_loss: 1.0040, test_f1: 0.4860
 epoch: 41, train_loss: 0.9739, test_loss: 1.0264, test_f1: 0.4942
 epoch: 42, train_loss: 0.9873, test_loss: 1.0025, test_f1: 0.5039
 epoch: 43, train_loss: 0.9720, test_loss: 1.0383, test_f1: 0.4760
 epoch: 44, train_loss: 0.9778, test_loss: 0.9902, test_f1: 0.4772
 epoch: 45, train_loss: 0.9666, test_loss: 1.0196, test_f1: 0.5067
 epoch: 46, train_loss: 0.9552, test_loss: 0.9902, test_f1: 0.4841
 epoch: 47, train_loss: 0.9451, test_loss: 1.0134, test_f1: 0.4870
 epoch: 48, train_loss: 0.9656, test_loss: 0.9899, test_f1: 0.4896
 epoch: 49, train_loss: 0.9496, test_loss: 1.0065, test_f1: 0.5062
 epoch: 50, train_loss: 0.9377, test_loss: 1.0020, test_f1: 0.4831
 epoch: 51, train_loss: 0.9351, test_loss: 1.0030, test_f1: 0.4938
 epoch: 52, train_loss: 0.9280, test_loss: 0.9977, test_f1: 0.4974
 epoch: 53, train_loss: 0.9286, test_loss: 1.0150, test_f1: 0.4832
 epoch: 54, train_loss: 0.9248, test_loss: 1.0253, test_f1: 0.4793
 epoch: 55, train_loss: 0.9345, test_loss: 1.0259, test_f1: 0.4810
 epoch: 56, train_loss: 0.9113, test_loss: 1.0345, test_f1: 0.4936
 epoch: 57, train_loss: 0.9287, test_loss: 1.0161, test_f1: 0.4932
 epoch: 58, train_loss: 0.9145, test_loss: 0.9909, test_f1: 0.4973
 epoch: 59, train_loss: 0.9036, test_loss: 1.0036, test_f1: 0.5066
 epoch: 60, train_loss: 0.9149, test_loss: 1.0332, test_f1: 0.4769
 epoch: 61, train_loss: 0.9258, test_loss: 0.9953, test_f1: 0.5030
 epoch: 62, train_loss: 0.9008, test_loss: 1.0161, test_f1: 0.4821
 epoch: 63, train_loss: 0.9100, test_loss: 1.0119, test_f1: 0.5005
 epoch: 64, train_loss: 0.9133, test_loss: 1.0162, test_f1: 0.4926
 epoch: 65, train_loss: 0.9075, test_loss: 1.0204, test_f1: 0.4832
 epoch: 66, train_loss: 0.9049, test_loss: 1.0039, test_f1: 0.5022
 epoch: 67, train_loss: 0.8989, test_loss: 1.0414, test_f1: 0.4844
 epoch: 68, train_loss: 0.8990, test_loss: 1.0241, test_f1: 0.4832
 epoch: 69, train_loss: 0.9037, test_loss: 1.0178, test_f1: 0.5050
 epoch: 70, train_loss: 0.8953, test_loss: 1.0367, test_f1: 0.4962
 epoch: 71, train_loss: 0.8903, test_loss: 1.0317, test_f1: 0.4901
 epoch: 72, train_loss: 0.9029, test_loss: 1.0263, test_f1: 0.4934
 epoch: 73, train_loss: 0.8931, test_loss: 1.0586, test_f1: 0.4860
 epoch: 74, train_loss: 0.8873, test_loss: 1.0196, test_f1: 0.5132
 epoch: 75, train_loss: 0.8840, test_loss: 1.0538, test_f1: 0.4903
 epoch: 76, train_loss: 0.8985, test_loss: 1.0549, test_f1: 0.4991
 epoch: 77, train_loss: 0.8974, test_loss: 1.0411, test_f1: 0.4938
 epoch: 78, train_loss: 0.8991, test_loss: 1.0211, test_f1: 0.5067
 epoch: 79, train_loss: 0.8892, test_loss: 1.0387, test_f1: 0.4999
 epoch: 80, train_loss: 0.8864, test_loss: 1.0303, test_f1: 0.4998
 epoch: 81, train_loss: 0.8788, test_loss: 1.0574, test_f1: 0.4865
 epoch: 82, train_loss: 0.8871, test_loss: 1.0638, test_f1: 0.4962
 epoch: 83, train_loss: 0.8912, test_loss: 1.0358, test_f1: 0.4975
 epoch: 84, train_loss: 0.8741, test_loss: 1.0634, test_f1: 0.4949
 epoch: 85, train_loss: 0.8810, test_loss: 1.0567, test_f1: 0.4923
 epoch: 86, train_loss: 0.8828, test_loss: 1.0528, test_f1: 0.4874
 epoch: 87, train_loss: 0.8745, test_loss: 1.0584, test_f1: 0.4847
 epoch: 88, train_loss: 0.8806, test_loss: 1.0547, test_f1: 0.5052
 epoch: 89, train_loss: 0.8828, test_loss: 1.0325, test_f1: 0.4990
 epoch: 90, train_loss: 0.8756, test_loss: 1.0305, test_f1: 0.4985
 epoch: 91, train_loss: 0.8732, test_loss: 1.0361, test_f1: 0.5069
 epoch: 92, train_loss: 0.8647, test_loss: 1.0625, test_f1: 0.5048
 epoch: 93, train_loss: 0.8713, test_loss: 1.0498, test_f1: 0.5006
 epoch: 94, train_loss: 0.8669, test_loss: 1.0034, test_f1: 0.5158
 epoch: 95, train_loss: 0.8749, test_loss: 1.0452, test_f1: 0.5072
 epoch: 96, train_loss: 0.8778, test_loss: 1.0129, test_f1: 0.5040
 epoch: 97, train_loss: 0.8609, test_loss: 1.0893, test_f1: 0.4936
 epoch: 98, train_loss: 0.8672, test_loss: 1.0474, test_f1: 0.5068
 epoch: 99, train_loss: 0.8623, test_loss: 1.0128, test_f1: 0.5045
##################ITERATION #1 ****************************************
 epoch: 0, train_loss: 1.3299, test_loss: 1.3044, test_f1: 0.2274
 epoch: 1, train_loss: 1.2827, test_loss: 1.2941, test_f1: 0.2274
 epoch: 2, train_loss: 1.2713, test_loss: 1.2569, test_f1: 0.2527
 epoch: 3, train_loss: 1.2528, test_loss: 1.2462, test_f1: 0.2699
 epoch: 4, train_loss: 1.2515, test_loss: 1.2353, test_f1: 0.2718
 epoch: 5, train_loss: 1.2388, test_loss: 1.2262, test_f1: 0.2756
 epoch: 6, train_loss: 1.2261, test_loss: 1.2108, test_f1: 0.2815
 epoch: 7, train_loss: 1.2202, test_loss: 1.1992, test_f1: 0.2889
 epoch: 8, train_loss: 1.2139, test_loss: 1.1895, test_f1: 0.3212
 epoch: 9, train_loss: 1.2050, test_loss: 1.1738, test_f1: 0.3658
 epoch: 10, train_loss: 1.1963, test_loss: 1.1742, test_f1: 0.3891
 epoch: 11, train_loss: 1.1839, test_loss: 1.1619, test_f1: 0.4049
 epoch: 12, train_loss: 1.1718, test_loss: 1.1537, test_f1: 0.3909
 epoch: 13, train_loss: 1.1665, test_loss: 1.1769, test_f1: 0.4238
 epoch: 14, train_loss: 1.1635, test_loss: 1.1402, test_f1: 0.4387
 epoch: 15, train_loss: 1.1485, test_loss: 1.1280, test_f1: 0.4377
 epoch: 16, train_loss: 1.1424, test_loss: 1.1290, test_f1: 0.4176
 epoch: 17, train_loss: 1.1389, test_loss: 1.1291, test_f1: 0.4064
 epoch: 18, train_loss: 1.1243, test_loss: 1.1058, test_f1: 0.4252
 epoch: 19, train_loss: 1.1275, test_loss: 1.1263, test_f1: 0.4213
 epoch: 20, train_loss: 1.1205, test_loss: 1.1258, test_f1: 0.4378
 epoch: 21, train_loss: 1.1098, test_loss: 1.1099, test_f1: 0.4211
 epoch: 22, train_loss: 1.1108, test_loss: 1.1224, test_f1: 0.4282
 epoch: 23, train_loss: 1.1061, test_loss: 1.0859, test_f1: 0.4390
 epoch: 24, train_loss: 1.0962, test_loss: 1.0981, test_f1: 0.4349
 epoch: 25, train_loss: 1.0990, test_loss: 1.0827, test_f1: 0.4299
 epoch: 26, train_loss: 1.0886, test_loss: 1.0798, test_f1: 0.4376
 epoch: 27, train_loss: 1.0872, test_loss: 1.0790, test_f1: 0.4303
 epoch: 28, train_loss: 1.0886, test_loss: 1.1011, test_f1: 0.4128
 epoch: 29, train_loss: 1.0745, test_loss: 1.0597, test_f1: 0.4437
 epoch: 30, train_loss: 1.0823, test_loss: 1.1014, test_f1: 0.4308
 epoch: 31, train_loss: 1.0848, test_loss: 1.0753, test_f1: 0.4324
 epoch: 32, train_loss: 1.0786, test_loss: 1.0789, test_f1: 0.4212
 epoch: 33, train_loss: 1.0713, test_loss: 1.0830, test_f1: 0.4182
 epoch: 34, train_loss: 1.0661, test_loss: 1.0496, test_f1: 0.4461
 epoch: 35, train_loss: 1.0600, test_loss: 1.0649, test_f1: 0.4216
 epoch: 36, train_loss: 1.0603, test_loss: 1.0592, test_f1: 0.4423
 epoch: 37, train_loss: 1.0548, test_loss: 1.0428, test_f1: 0.4366
 epoch: 38, train_loss: 1.0553, test_loss: 1.0525, test_f1: 0.4484
 epoch: 39, train_loss: 1.0402, test_loss: 1.0584, test_f1: 0.4373
 epoch: 40, train_loss: 1.0545, test_loss: 1.0332, test_f1: 0.4322
 epoch: 41, train_loss: 1.0400, test_loss: 1.0482, test_f1: 0.4502
 epoch: 42, train_loss: 1.0430, test_loss: 1.0293, test_f1: 0.4577
 epoch: 43, train_loss: 1.0451, test_loss: 1.0603, test_f1: 0.4306
 epoch: 44, train_loss: 1.0267, test_loss: 1.0438, test_f1: 0.4541
 epoch: 45, train_loss: 1.0287, test_loss: 1.0679, test_f1: 0.4325
 epoch: 46, train_loss: 1.0279, test_loss: 1.0431, test_f1: 0.4670
 epoch: 47, train_loss: 1.0288, test_loss: 1.0320, test_f1: 0.4466
 epoch: 48, train_loss: 1.0242, test_loss: 1.0227, test_f1: 0.4493
 epoch: 49, train_loss: 1.0168, test_loss: 1.0327, test_f1: 0.4567
 epoch: 50, train_loss: 1.0174, test_loss: 1.0615, test_f1: 0.4498
 epoch: 51, train_loss: 1.0175, test_loss: 1.0260, test_f1: 0.4365
 epoch: 52, train_loss: 1.0041, test_loss: 1.0359, test_f1: 0.4342
 epoch: 53, train_loss: 0.9970, test_loss: 1.0610, test_f1: 0.4260
 epoch: 54, train_loss: 1.0058, test_loss: 1.0266, test_f1: 0.4395
 epoch: 55, train_loss: 0.9969, test_loss: 1.0452, test_f1: 0.4330
 epoch: 56, train_loss: 1.0012, test_loss: 1.0423, test_f1: 0.4326
 epoch: 57, train_loss: 1.0006, test_loss: 1.0248, test_f1: 0.4480
 epoch: 58, train_loss: 0.9902, test_loss: 1.0119, test_f1: 0.4532
 epoch: 59, train_loss: 0.9919, test_loss: 1.0282, test_f1: 0.4561
 epoch: 60, train_loss: 0.9943, test_loss: 1.0413, test_f1: 0.4434
 epoch: 61, train_loss: 0.9882, test_loss: 1.0351, test_f1: 0.4434
 epoch: 62, train_loss: 0.9867, test_loss: 1.0320, test_f1: 0.4476
 epoch: 63, train_loss: 0.9796, test_loss: 1.0178, test_f1: 0.4484
 epoch: 64, train_loss: 0.9911, test_loss: 1.0316, test_f1: 0.4674
 epoch: 65, train_loss: 0.9942, test_loss: 1.0447, test_f1: 0.4303
 epoch: 66, train_loss: 0.9824, test_loss: 1.0359, test_f1: 0.4388
 epoch: 67, train_loss: 0.9803, test_loss: 1.0230, test_f1: 0.4451
 epoch: 68, train_loss: 0.9789, test_loss: 1.0426, test_f1: 0.4411
 epoch: 69, train_loss: 0.9840, test_loss: 1.0269, test_f1: 0.4586
 epoch: 70, train_loss: 0.9769, test_loss: 1.0479, test_f1: 0.4477
 epoch: 71, train_loss: 0.9740, test_loss: 1.0110, test_f1: 0.4567
 epoch: 72, train_loss: 0.9753, test_loss: 1.0671, test_f1: 0.4447
 epoch: 73, train_loss: 0.9798, test_loss: 1.0220, test_f1: 0.4405
 epoch: 74, train_loss: 0.9643, test_loss: 1.0395, test_f1: 0.4511
 epoch: 75, train_loss: 0.9742, test_loss: 1.0296, test_f1: 0.4519
 epoch: 76, train_loss: 0.9646, test_loss: 1.0202, test_f1: 0.4609
 epoch: 77, train_loss: 0.9694, test_loss: 1.0220, test_f1: 0.4591
 epoch: 78, train_loss: 0.9725, test_loss: 1.0330, test_f1: 0.4616
 epoch: 79, train_loss: 0.9608, test_loss: 1.0268, test_f1: 0.4547
 epoch: 80, train_loss: 0.9672, test_loss: 1.0185, test_f1: 0.4536
 epoch: 81, train_loss: 0.9683, test_loss: 1.0429, test_f1: 0.4527
 epoch: 82, train_loss: 0.9747, test_loss: 1.0473, test_f1: 0.4561
 epoch: 83, train_loss: 0.9608, test_loss: 1.0235, test_f1: 0.4592
 epoch: 84, train_loss: 0.9605, test_loss: 1.0532, test_f1: 0.4563
 epoch: 85, train_loss: 0.9525, test_loss: 1.0497, test_f1: 0.4657
 epoch: 86, train_loss: 0.9643, test_loss: 1.0240, test_f1: 0.4602
 epoch: 87, train_loss: 0.9632, test_loss: 1.0257, test_f1: 0.4705
 epoch: 88, train_loss: 0.9584, test_loss: 1.0489, test_f1: 0.4602
 epoch: 89, train_loss: 0.9557, test_loss: 1.0626, test_f1: 0.4413
 epoch: 90, train_loss: 0.9555, test_loss: 1.0247, test_f1: 0.4682
 epoch: 91, train_loss: 0.9499, test_loss: 1.0409, test_f1: 0.4569
 epoch: 92, train_loss: 0.9565, test_loss: 1.0249, test_f1: 0.4616
 epoch: 93, train_loss: 0.9433, test_loss: 1.0508, test_f1: 0.4625
 epoch: 94, train_loss: 0.9464, test_loss: 1.0440, test_f1: 0.4600
 epoch: 95, train_loss: 0.9420, test_loss: 1.0280, test_f1: 0.4709
 epoch: 96, train_loss: 0.9450, test_loss: 1.0402, test_f1: 0.4630
 epoch: 97, train_loss: 0.9392, test_loss: 1.0300, test_f1: 0.4710
 epoch: 98, train_loss: 0.9347, test_loss: 1.0626, test_f1: 0.4550
 epoch: 99, train_loss: 0.9432, test_loss: 1.0359, test_f1: 0.4633
##################ITERATION #2 ****************************************
 epoch: 0, train_loss: 1.3604, test_loss: 1.2966, test_f1: 0.2274
 epoch: 1, train_loss: 1.2736, test_loss: 1.2624, test_f1: 0.2390
 epoch: 2, train_loss: 1.2509, test_loss: 1.2271, test_f1: 0.2555
 epoch: 3, train_loss: 1.2416, test_loss: 1.2153, test_f1: 0.2557
 epoch: 4, train_loss: 1.2380, test_loss: 1.2138, test_f1: 0.2558
 epoch: 5, train_loss: 1.2235, test_loss: 1.2104, test_f1: 0.2559
 epoch: 6, train_loss: 1.2166, test_loss: 1.2026, test_f1: 0.2617
 epoch: 7, train_loss: 1.2126, test_loss: 1.1964, test_f1: 0.2589
 epoch: 8, train_loss: 1.2055, test_loss: 1.2026, test_f1: 0.2730
 epoch: 9, train_loss: 1.2026, test_loss: 1.1865, test_f1: 0.2996
 epoch: 10, train_loss: 1.1922, test_loss: 1.1740, test_f1: 0.3426
 epoch: 11, train_loss: 1.1846, test_loss: 1.1721, test_f1: 0.3384
 epoch: 12, train_loss: 1.1806, test_loss: 1.1669, test_f1: 0.3573
 epoch: 13, train_loss: 1.1713, test_loss: 1.1722, test_f1: 0.3572
 epoch: 14, train_loss: 1.1669, test_loss: 1.1569, test_f1: 0.3927
 epoch: 15, train_loss: 1.1667, test_loss: 1.1504, test_f1: 0.3724
 epoch: 16, train_loss: 1.1629, test_loss: 1.1509, test_f1: 0.3767
 epoch: 17, train_loss: 1.1480, test_loss: 1.1341, test_f1: 0.4002
 epoch: 18, train_loss: 1.1515, test_loss: 1.1452, test_f1: 0.4023
 epoch: 19, train_loss: 1.1466, test_loss: 1.1220, test_f1: 0.3918
 epoch: 20, train_loss: 1.1465, test_loss: 1.1304, test_f1: 0.4102
 epoch: 21, train_loss: 1.1369, test_loss: 1.1251, test_f1: 0.4093
 epoch: 22, train_loss: 1.1224, test_loss: 1.1180, test_f1: 0.4095
 epoch: 23, train_loss: 1.1296, test_loss: 1.1043, test_f1: 0.4077
 epoch: 24, train_loss: 1.1250, test_loss: 1.1084, test_f1: 0.4303
 epoch: 25, train_loss: 1.1206, test_loss: 1.0991, test_f1: 0.4286
 epoch: 26, train_loss: 1.1123, test_loss: 1.0887, test_f1: 0.4212
 epoch: 27, train_loss: 1.1101, test_loss: 1.1021, test_f1: 0.4240
 epoch: 28, train_loss: 1.1047, test_loss: 1.0908, test_f1: 0.4320
 epoch: 29, train_loss: 1.1018, test_loss: 1.0884, test_f1: 0.4465
 epoch: 30, train_loss: 1.0895, test_loss: 1.0859, test_f1: 0.4449
 epoch: 31, train_loss: 1.0987, test_loss: 1.0893, test_f1: 0.4353
 epoch: 32, train_loss: 1.1005, test_loss: 1.0684, test_f1: 0.4473
 epoch: 33, train_loss: 1.0919, test_loss: 1.0884, test_f1: 0.4515
 epoch: 34, train_loss: 1.0793, test_loss: 1.0648, test_f1: 0.4475
 epoch: 35, train_loss: 1.0723, test_loss: 1.0775, test_f1: 0.4563
 epoch: 36, train_loss: 1.0702, test_loss: 1.0708, test_f1: 0.4394
 epoch: 37, train_loss: 1.0673, test_loss: 1.0640, test_f1: 0.4552
 epoch: 38, train_loss: 1.0572, test_loss: 1.0574, test_f1: 0.4533
 epoch: 39, train_loss: 1.0684, test_loss: 1.0557, test_f1: 0.4560
 epoch: 40, train_loss: 1.0689, test_loss: 1.0671, test_f1: 0.4637
 epoch: 41, train_loss: 1.0591, test_loss: 1.0510, test_f1: 0.4571
 epoch: 42, train_loss: 1.0483, test_loss: 1.0616, test_f1: 0.4449
 epoch: 43, train_loss: 1.0521, test_loss: 1.0449, test_f1: 0.4723
 epoch: 44, train_loss: 1.0344, test_loss: 1.0499, test_f1: 0.4545
 epoch: 45, train_loss: 1.0495, test_loss: 1.0462, test_f1: 0.4626
 epoch: 46, train_loss: 1.0380, test_loss: 1.0354, test_f1: 0.4596
 epoch: 47, train_loss: 1.0244, test_loss: 1.0655, test_f1: 0.4617
 epoch: 48, train_loss: 1.0446, test_loss: 1.0447, test_f1: 0.4807
 epoch: 49, train_loss: 1.0364, test_loss: 1.0564, test_f1: 0.4473
 epoch: 50, train_loss: 1.0236, test_loss: 1.0389, test_f1: 0.4692
 epoch: 51, train_loss: 1.0167, test_loss: 1.0335, test_f1: 0.4887
 epoch: 52, train_loss: 1.0122, test_loss: 1.0345, test_f1: 0.4679
 epoch: 53, train_loss: 1.0002, test_loss: 1.0370, test_f1: 0.4797
 epoch: 54, train_loss: 1.0075, test_loss: 1.0342, test_f1: 0.4815
 epoch: 55, train_loss: 1.0083, test_loss: 1.0405, test_f1: 0.4713
 epoch: 56, train_loss: 1.0048, test_loss: 1.0624, test_f1: 0.4739
 epoch: 57, train_loss: 1.0057, test_loss: 1.0381, test_f1: 0.4845
 epoch: 58, train_loss: 0.9984, test_loss: 1.0317, test_f1: 0.4944
 epoch: 59, train_loss: 0.9990, test_loss: 1.0297, test_f1: 0.4958
 epoch: 60, train_loss: 0.9934, test_loss: 1.0414, test_f1: 0.4641
 epoch: 61, train_loss: 0.9960, test_loss: 1.0497, test_f1: 0.4754
 epoch: 62, train_loss: 0.9836, test_loss: 1.0473, test_f1: 0.4713
 epoch: 63, train_loss: 1.0040, test_loss: 1.0618, test_f1: 0.4642
 epoch: 64, train_loss: 0.9820, test_loss: 1.0255, test_f1: 0.4715
 epoch: 65, train_loss: 0.9727, test_loss: 1.0566, test_f1: 0.4859
 epoch: 66, train_loss: 0.9663, test_loss: 1.0312, test_f1: 0.4762
 epoch: 67, train_loss: 0.9794, test_loss: 1.0934, test_f1: 0.4662
 epoch: 68, train_loss: 0.9865, test_loss: 1.0562, test_f1: 0.4655
 epoch: 69, train_loss: 0.9761, test_loss: 1.0702, test_f1: 0.4478
 epoch: 70, train_loss: 0.9931, test_loss: 1.0333, test_f1: 0.4733
 epoch: 71, train_loss: 0.9851, test_loss: 1.0386, test_f1: 0.4728
 epoch: 72, train_loss: 0.9642, test_loss: 1.0313, test_f1: 0.4681
 epoch: 73, train_loss: 0.9722, test_loss: 1.0661, test_f1: 0.4587
 epoch: 74, train_loss: 0.9794, test_loss: 1.0789, test_f1: 0.4688
 epoch: 75, train_loss: 0.9615, test_loss: 1.1527, test_f1: 0.4646
 epoch: 76, train_loss: 0.9586, test_loss: 1.0280, test_f1: 0.4714
 epoch: 77, train_loss: 0.9738, test_loss: 1.0152, test_f1: 0.4644
 epoch: 78, train_loss: 0.9665, test_loss: 1.0377, test_f1: 0.4702
 epoch: 79, train_loss: 0.9680, test_loss: 1.0749, test_f1: 0.4588
 epoch: 80, train_loss: 0.9602, test_loss: 1.1128, test_f1: 0.4645
 epoch: 81, train_loss: 0.9580, test_loss: 1.0298, test_f1: 0.4664
 epoch: 82, train_loss: 0.9487, test_loss: 1.1025, test_f1: 0.4734
 epoch: 83, train_loss: 0.9570, test_loss: 1.1231, test_f1: 0.4782
 epoch: 84, train_loss: 0.9444, test_loss: 1.1131, test_f1: 0.4730
 epoch: 85, train_loss: 0.9609, test_loss: 1.1043, test_f1: 0.4857
 epoch: 86, train_loss: 0.9517, test_loss: 1.0571, test_f1: 0.4501
 epoch: 87, train_loss: 0.9424, test_loss: 1.0703, test_f1: 0.4802
 epoch: 88, train_loss: 0.9603, test_loss: 1.1042, test_f1: 0.4828
 epoch: 89, train_loss: 0.9452, test_loss: 1.0782, test_f1: 0.4617
 epoch: 90, train_loss: 0.9261, test_loss: 1.0713, test_f1: 0.4702
 epoch: 91, train_loss: 0.9502, test_loss: 1.0446, test_f1: 0.4874
 epoch: 92, train_loss: 0.9518, test_loss: 1.0408, test_f1: 0.4766
 epoch: 93, train_loss: 0.9352, test_loss: 1.0568, test_f1: 0.4806
 epoch: 94, train_loss: 0.9263, test_loss: 1.0716, test_f1: 0.4710
 epoch: 95, train_loss: 0.9385, test_loss: 1.0595, test_f1: 0.4694
 epoch: 96, train_loss: 0.9240, test_loss: 1.0593, test_f1: 0.4919
 epoch: 97, train_loss: 0.9273, test_loss: 1.0924, test_f1: 0.4743
 epoch: 98, train_loss: 0.9232, test_loss: 1.0957, test_f1: 0.4626
 epoch: 99, train_loss: 0.9233, test_loss: 1.0966, test_f1: 0.4695
##################ITERATION #3 ****************************************
 epoch: 0, train_loss: 1.4987, test_loss: 1.2997, test_f1: 0.2555
 epoch: 1, train_loss: 1.3014, test_loss: 1.2687, test_f1: 0.2559
 epoch: 2, train_loss: 1.2742, test_loss: 1.2523, test_f1: 0.2392
 epoch: 3, train_loss: 1.2639, test_loss: 1.2419, test_f1: 0.2524
 epoch: 4, train_loss: 1.2607, test_loss: 1.2307, test_f1: 0.2822
 epoch: 5, train_loss: 1.2496, test_loss: 1.2244, test_f1: 0.2776
 epoch: 6, train_loss: 1.2455, test_loss: 1.2176, test_f1: 0.3023
 epoch: 7, train_loss: 1.2345, test_loss: 1.2187, test_f1: 0.2800
 epoch: 8, train_loss: 1.2269, test_loss: 1.2024, test_f1: 0.3167
 epoch: 9, train_loss: 1.2232, test_loss: 1.1926, test_f1: 0.3340
 epoch: 10, train_loss: 1.2150, test_loss: 1.1857, test_f1: 0.3465
 epoch: 11, train_loss: 1.2078, test_loss: 1.1775, test_f1: 0.3532
 epoch: 12, train_loss: 1.2086, test_loss: 1.1715, test_f1: 0.3582
 epoch: 13, train_loss: 1.1932, test_loss: 1.1642, test_f1: 0.3659
 epoch: 14, train_loss: 1.1902, test_loss: 1.1521, test_f1: 0.3909
 epoch: 15, train_loss: 1.1903, test_loss: 1.1521, test_f1: 0.4021
 epoch: 16, train_loss: 1.1790, test_loss: 1.1335, test_f1: 0.4057
 epoch: 17, train_loss: 1.1741, test_loss: 1.1258, test_f1: 0.4077
 epoch: 18, train_loss: 1.1516, test_loss: 1.1179, test_f1: 0.4174
 epoch: 19, train_loss: 1.1528, test_loss: 1.1263, test_f1: 0.4193
 epoch: 20, train_loss: 1.1369, test_loss: 1.1110, test_f1: 0.4168
 epoch: 21, train_loss: 1.1348, test_loss: 1.1027, test_f1: 0.4324
 epoch: 22, train_loss: 1.1173, test_loss: 1.0781, test_f1: 0.4271
 epoch: 23, train_loss: 1.1192, test_loss: 1.0695, test_f1: 0.4477
 epoch: 24, train_loss: 1.1112, test_loss: 1.0822, test_f1: 0.4321
 epoch: 25, train_loss: 1.0994, test_loss: 1.0653, test_f1: 0.4218
 epoch: 26, train_loss: 1.0979, test_loss: 1.0542, test_f1: 0.4263
 epoch: 27, train_loss: 1.0833, test_loss: 1.0428, test_f1: 0.4304
 epoch: 28, train_loss: 1.0856, test_loss: 1.0295, test_f1: 0.4361
 epoch: 29, train_loss: 1.0632, test_loss: 1.0406, test_f1: 0.4408
 epoch: 30, train_loss: 1.0609, test_loss: 1.0076, test_f1: 0.4564
 epoch: 31, train_loss: 1.0583, test_loss: 1.0127, test_f1: 0.4544
 epoch: 32, train_loss: 1.0373, test_loss: 1.0137, test_f1: 0.4419
 epoch: 33, train_loss: 1.0393, test_loss: 1.0017, test_f1: 0.4486
 epoch: 34, train_loss: 1.0335, test_loss: 0.9978, test_f1: 0.4551
 epoch: 35, train_loss: 1.0270, test_loss: 0.9997, test_f1: 0.4643
 epoch: 36, train_loss: 1.0269, test_loss: 0.9973, test_f1: 0.4690
 epoch: 37, train_loss: 1.0204, test_loss: 0.9987, test_f1: 0.4729
 epoch: 38, train_loss: 1.0264, test_loss: 1.0497, test_f1: 0.4364
 epoch: 39, train_loss: 1.0182, test_loss: 1.0109, test_f1: 0.4623
 epoch: 40, train_loss: 1.0081, test_loss: 1.0039, test_f1: 0.4599
 epoch: 41, train_loss: 1.0134, test_loss: 1.0353, test_f1: 0.4538
 epoch: 42, train_loss: 1.0014, test_loss: 1.0218, test_f1: 0.4478
 epoch: 43, train_loss: 0.9960, test_loss: 1.0343, test_f1: 0.4617
 epoch: 44, train_loss: 0.9965, test_loss: 1.0149, test_f1: 0.4662
 epoch: 45, train_loss: 0.9922, test_loss: 1.0237, test_f1: 0.4627
 epoch: 46, train_loss: 0.9905, test_loss: 1.1039, test_f1: 0.4500
 epoch: 47, train_loss: 0.9840, test_loss: 1.0210, test_f1: 0.4654
 epoch: 48, train_loss: 0.9905, test_loss: 1.0150, test_f1: 0.4807
 epoch: 49, train_loss: 0.9807, test_loss: 1.0131, test_f1: 0.4599
 epoch: 50, train_loss: 0.9698, test_loss: 1.0404, test_f1: 0.4665
 epoch: 51, train_loss: 0.9694, test_loss: 1.0308, test_f1: 0.4620
 epoch: 52, train_loss: 0.9569, test_loss: 1.0413, test_f1: 0.4627
 epoch: 53, train_loss: 0.9724, test_loss: 1.0329, test_f1: 0.4658
 epoch: 54, train_loss: 0.9592, test_loss: 1.0309, test_f1: 0.4769
 epoch: 55, train_loss: 0.9546, test_loss: 1.0359, test_f1: 0.4710
 epoch: 56, train_loss: 0.9554, test_loss: 1.0601, test_f1: 0.4741
 epoch: 57, train_loss: 0.9611, test_loss: 1.0498, test_f1: 0.4797
 epoch: 58, train_loss: 0.9472, test_loss: 1.0551, test_f1: 0.4662
 epoch: 59, train_loss: 0.9493, test_loss: 1.0577, test_f1: 0.4682
 epoch: 60, train_loss: 0.9417, test_loss: 1.0452, test_f1: 0.4697
 epoch: 61, train_loss: 0.9349, test_loss: 1.0482, test_f1: 0.4795
 epoch: 62, train_loss: 0.9435, test_loss: 1.0452, test_f1: 0.4806
 epoch: 63, train_loss: 0.9449, test_loss: 1.0515, test_f1: 0.4740
 epoch: 64, train_loss: 0.9402, test_loss: 1.0643, test_f1: 0.4677
 epoch: 65, train_loss: 0.9428, test_loss: 1.0771, test_f1: 0.4675
 epoch: 66, train_loss: 0.9396, test_loss: 1.0477, test_f1: 0.4783
 epoch: 67, train_loss: 0.9357, test_loss: 1.0449, test_f1: 0.4841
 epoch: 68, train_loss: 0.9323, test_loss: 1.0572, test_f1: 0.4809
 epoch: 69, train_loss: 0.9229, test_loss: 1.0727, test_f1: 0.4875
 epoch: 70, train_loss: 0.9360, test_loss: 1.0647, test_f1: 0.4793
 epoch: 71, train_loss: 0.9293, test_loss: 1.0544, test_f1: 0.4765
 epoch: 72, train_loss: 0.9292, test_loss: 1.0667, test_f1: 0.4840
 epoch: 73, train_loss: 0.9365, test_loss: 1.0791, test_f1: 0.4865
 epoch: 74, train_loss: 0.9313, test_loss: 1.0652, test_f1: 0.4709
 epoch: 75, train_loss: 0.9190, test_loss: 1.0783, test_f1: 0.4620
 epoch: 76, train_loss: 0.9286, test_loss: 1.1025, test_f1: 0.4846
 epoch: 77, train_loss: 0.9370, test_loss: 1.0967, test_f1: 0.4485
 epoch: 78, train_loss: 0.9113, test_loss: 1.0514, test_f1: 0.4840
 epoch: 79, train_loss: 0.9251, test_loss: 1.0998, test_f1: 0.4781
 epoch: 80, train_loss: 0.9201, test_loss: 1.0606, test_f1: 0.5060
 epoch: 81, train_loss: 0.9329, test_loss: 1.0522, test_f1: 0.4812
 epoch: 82, train_loss: 0.9139, test_loss: 1.0738, test_f1: 0.4652
 epoch: 83, train_loss: 0.9144, test_loss: 1.0551, test_f1: 0.4937
 epoch: 84, train_loss: 0.9095, test_loss: 1.0903, test_f1: 0.4693
 epoch: 85, train_loss: 0.9130, test_loss: 1.0987, test_f1: 0.4488
 epoch: 86, train_loss: 0.9058, test_loss: 1.0787, test_f1: 0.4999
 epoch: 87, train_loss: 0.9159, test_loss: 1.0814, test_f1: 0.4650
 epoch: 88, train_loss: 0.9106, test_loss: 1.0852, test_f1: 0.4813
 epoch: 89, train_loss: 0.9203, test_loss: 1.0549, test_f1: 0.4635
 epoch: 90, train_loss: 0.9058, test_loss: 1.0999, test_f1: 0.4699
 epoch: 91, train_loss: 0.9092, test_loss: 1.0828, test_f1: 0.4652
 epoch: 92, train_loss: 0.9127, test_loss: 1.0703, test_f1: 0.4728
 epoch: 93, train_loss: 0.9043, test_loss: 1.0986, test_f1: 0.4864
 epoch: 94, train_loss: 0.9093, test_loss: 1.1042, test_f1: 0.4470
 epoch: 95, train_loss: 0.9002, test_loss: 1.1154, test_f1: 0.4677
 epoch: 96, train_loss: 0.9047, test_loss: 1.1042, test_f1: 0.4828
 epoch: 97, train_loss: 0.9007, test_loss: 1.1047, test_f1: 0.4563
 epoch: 98, train_loss: 0.9053, test_loss: 1.1136, test_f1: 0.4592
 epoch: 99, train_loss: 0.8905, test_loss: 1.1120, test_f1: 0.4923
##################ITERATION #4 ****************************************
 epoch: 0, train_loss: 1.3418, test_loss: 1.2796, test_f1: 0.2276
 epoch: 1, train_loss: 1.2624, test_loss: 1.2238, test_f1: 0.3247
 epoch: 2, train_loss: 1.2451, test_loss: 1.1866, test_f1: 0.3560
 epoch: 3, train_loss: 1.2227, test_loss: 1.1693, test_f1: 0.3617
 epoch: 4, train_loss: 1.2020, test_loss: 1.1485, test_f1: 0.3631
 epoch: 5, train_loss: 1.1875, test_loss: 1.1273, test_f1: 0.3948
 epoch: 6, train_loss: 1.1862, test_loss: 1.1142, test_f1: 0.3919
 epoch: 7, train_loss: 1.1578, test_loss: 1.1026, test_f1: 0.4150
 epoch: 8, train_loss: 1.1529, test_loss: 1.0803, test_f1: 0.4166
 epoch: 9, train_loss: 1.1419, test_loss: 1.0653, test_f1: 0.4272
 epoch: 10, train_loss: 1.1303, test_loss: 1.0536, test_f1: 0.4388
 epoch: 11, train_loss: 1.1260, test_loss: 1.0434, test_f1: 0.4489
 epoch: 12, train_loss: 1.1106, test_loss: 1.0406, test_f1: 0.4445
 epoch: 13, train_loss: 1.0963, test_loss: 1.0244, test_f1: 0.4368
 epoch: 14, train_loss: 1.0996, test_loss: 1.0298, test_f1: 0.4521
 epoch: 15, train_loss: 1.0914, test_loss: 0.9951, test_f1: 0.4654
 epoch: 16, train_loss: 1.0806, test_loss: 1.0040, test_f1: 0.4414
 epoch: 17, train_loss: 1.0715, test_loss: 0.9754, test_f1: 0.4602
 epoch: 18, train_loss: 1.0473, test_loss: 0.9746, test_f1: 0.4726
 epoch: 19, train_loss: 1.0499, test_loss: 0.9676, test_f1: 0.4551
 epoch: 20, train_loss: 1.0376, test_loss: 0.9650, test_f1: 0.4732
 epoch: 21, train_loss: 1.0339, test_loss: 0.9601, test_f1: 0.4746
 epoch: 22, train_loss: 1.0156, test_loss: 0.9597, test_f1: 0.4673
 epoch: 23, train_loss: 1.0173, test_loss: 0.9609, test_f1: 0.4782
 epoch: 24, train_loss: 1.0221, test_loss: 0.9463, test_f1: 0.4826
 epoch: 25, train_loss: 1.0101, test_loss: 0.9506, test_f1: 0.4705
 epoch: 26, train_loss: 1.0166, test_loss: 0.9648, test_f1: 0.4726
 epoch: 27, train_loss: 0.9963, test_loss: 0.9598, test_f1: 0.4655
 epoch: 28, train_loss: 0.9994, test_loss: 0.9802, test_f1: 0.4549
 epoch: 29, train_loss: 0.9999, test_loss: 0.9301, test_f1: 0.5110
 epoch: 30, train_loss: 0.9799, test_loss: 0.9314, test_f1: 0.4794
 epoch: 31, train_loss: 0.9721, test_loss: 0.9269, test_f1: 0.5059
 epoch: 32, train_loss: 0.9735, test_loss: 0.9397, test_f1: 0.4851
 epoch: 33, train_loss: 0.9727, test_loss: 0.9231, test_f1: 0.4819
 epoch: 34, train_loss: 0.9586, test_loss: 0.9309, test_f1: 0.4794
 epoch: 35, train_loss: 0.9618, test_loss: 0.9212, test_f1: 0.4925
 epoch: 36, train_loss: 0.9504, test_loss: 0.9159, test_f1: 0.5125
 epoch: 37, train_loss: 0.9575, test_loss: 0.9267, test_f1: 0.4803
 epoch: 38, train_loss: 0.9509, test_loss: 0.9443, test_f1: 0.4724
 epoch: 39, train_loss: 0.9542, test_loss: 0.9331, test_f1: 0.4733
 epoch: 40, train_loss: 0.9411, test_loss: 0.9405, test_f1: 0.4628
 epoch: 41, train_loss: 0.9337, test_loss: 0.9528, test_f1: 0.4637
 epoch: 42, train_loss: 0.9302, test_loss: 0.9278, test_f1: 0.4822
 epoch: 43, train_loss: 0.9402, test_loss: 0.9155, test_f1: 0.4692
 epoch: 44, train_loss: 0.9312, test_loss: 0.9511, test_f1: 0.4585
 epoch: 45, train_loss: 0.9316, test_loss: 0.9366, test_f1: 0.5110
 epoch: 46, train_loss: 0.9354, test_loss: 0.9301, test_f1: 0.4758
 epoch: 47, train_loss: 0.9112, test_loss: 0.9133, test_f1: 0.4798
 epoch: 48, train_loss: 0.9273, test_loss: 0.9287, test_f1: 0.4939
 epoch: 49, train_loss: 0.9293, test_loss: 0.9364, test_f1: 0.4694
 epoch: 50, train_loss: 0.9314, test_loss: 0.9078, test_f1: 0.4852
 epoch: 51, train_loss: 0.9089, test_loss: 0.9261, test_f1: 0.4747
 epoch: 52, train_loss: 0.8996, test_loss: 0.9092, test_f1: 0.4785
 epoch: 53, train_loss: 0.9058, test_loss: 0.9098, test_f1: 0.4757
 epoch: 54, train_loss: 0.9054, test_loss: 0.9221, test_f1: 0.4884
 epoch: 55, train_loss: 0.9041, test_loss: 0.9037, test_f1: 0.4949
 epoch: 56, train_loss: 0.8998, test_loss: 0.9004, test_f1: 0.4893
 epoch: 57, train_loss: 0.8883, test_loss: 0.9145, test_f1: 0.4914
 epoch: 58, train_loss: 0.9011, test_loss: 0.9031, test_f1: 0.4804
 epoch: 59, train_loss: 0.8943, test_loss: 0.9195, test_f1: 0.4774
 epoch: 60, train_loss: 0.8879, test_loss: 0.9122, test_f1: 0.4797
 epoch: 61, train_loss: 0.8876, test_loss: 0.9291, test_f1: 0.4845
 epoch: 62, train_loss: 0.9039, test_loss: 0.9172, test_f1: 0.4867
 epoch: 63, train_loss: 0.8954, test_loss: 0.9133, test_f1: 0.4751
 epoch: 64, train_loss: 0.8758, test_loss: 0.9265, test_f1: 0.4744
 epoch: 65, train_loss: 0.8814, test_loss: 0.9189, test_f1: 0.4805
 epoch: 66, train_loss: 0.8788, test_loss: 0.9208, test_f1: 0.4823
 epoch: 67, train_loss: 0.8789, test_loss: 0.9208, test_f1: 0.4816
 epoch: 68, train_loss: 0.8806, test_loss: 0.9110, test_f1: 0.4855
 epoch: 69, train_loss: 0.8734, test_loss: 0.9254, test_f1: 0.4742
 epoch: 70, train_loss: 0.8740, test_loss: 0.9218, test_f1: 0.4892
 epoch: 71, train_loss: 0.8810, test_loss: 0.9586, test_f1: 0.4856
 epoch: 72, train_loss: 0.8804, test_loss: 0.9114, test_f1: 0.4915
 epoch: 73, train_loss: 0.8822, test_loss: 0.9350, test_f1: 0.4795
 epoch: 74, train_loss: 0.8728, test_loss: 0.9209, test_f1: 0.4800
 epoch: 75, train_loss: 0.8725, test_loss: 0.9086, test_f1: 0.4803
 epoch: 76, train_loss: 0.8676, test_loss: 0.9342, test_f1: 0.4794
 epoch: 77, train_loss: 0.8815, test_loss: 0.9332, test_f1: 0.4702
 epoch: 78, train_loss: 0.8668, test_loss: 0.9368, test_f1: 0.4903
 epoch: 79, train_loss: 0.8653, test_loss: 0.9170, test_f1: 0.4825
 epoch: 80, train_loss: 0.8711, test_loss: 0.9442, test_f1: 0.4749
 epoch: 81, train_loss: 0.8648, test_loss: 0.9537, test_f1: 0.4755
 epoch: 82, train_loss: 0.8709, test_loss: 0.9452, test_f1: 0.4878
 epoch: 83, train_loss: 0.8650, test_loss: 0.9390, test_f1: 0.4657
 epoch: 84, train_loss: 0.8670, test_loss: 0.9417, test_f1: 0.4951
 epoch: 85, train_loss: 0.8628, test_loss: 0.9259, test_f1: 0.4816
 epoch: 86, train_loss: 0.8590, test_loss: 0.9405, test_f1: 0.4891
 epoch: 87, train_loss: 0.8647, test_loss: 0.9227, test_f1: 0.4996
 epoch: 88, train_loss: 0.8447, test_loss: 0.9392, test_f1: 0.4755
 epoch: 89, train_loss: 0.8455, test_loss: 0.9557, test_f1: 0.4821
 epoch: 90, train_loss: 0.8695, test_loss: 0.9254, test_f1: 0.4936
 epoch: 91, train_loss: 0.8591, test_loss: 0.9355, test_f1: 0.4959
 epoch: 92, train_loss: 0.8670, test_loss: 0.9418, test_f1: 0.4882
 epoch: 93, train_loss: 0.8581, test_loss: 0.9262, test_f1: 0.4942
 epoch: 94, train_loss: 0.8581, test_loss: 0.9339, test_f1: 0.5007
 epoch: 95, train_loss: 0.8539, test_loss: 0.9355, test_f1: 0.4990
 epoch: 96, train_loss: 0.8521, test_loss: 0.9512, test_f1: 0.4933
 epoch: 97, train_loss: 0.8525, test_loss: 0.9400, test_f1: 0.4751
 epoch: 98, train_loss: 0.8428, test_loss: 0.9368, test_f1: 0.4982
 epoch: 99, train_loss: 0.8544, test_loss: 0.9406, test_f1: 0.4957
##################ITERATION #5 ****************************************
 epoch: 0, train_loss: 1.4154, test_loss: 1.2894, test_f1: 0.2364
 epoch: 1, train_loss: 1.2975, test_loss: 1.2426, test_f1: 0.3034
 epoch: 2, train_loss: 1.2594, test_loss: 1.2058, test_f1: 0.3131
 epoch: 3, train_loss: 1.2428, test_loss: 1.1966, test_f1: 0.3387
 epoch: 4, train_loss: 1.2190, test_loss: 1.1866, test_f1: 0.3426
 epoch: 5, train_loss: 1.2104, test_loss: 1.1711, test_f1: 0.3576
 epoch: 6, train_loss: 1.2082, test_loss: 1.1593, test_f1: 0.3526
 epoch: 7, train_loss: 1.2071, test_loss: 1.1643, test_f1: 0.3684
 epoch: 8, train_loss: 1.2010, test_loss: 1.1589, test_f1: 0.3895
 epoch: 9, train_loss: 1.1854, test_loss: 1.1499, test_f1: 0.3939
 epoch: 10, train_loss: 1.1860, test_loss: 1.1420, test_f1: 0.3952
 epoch: 11, train_loss: 1.1710, test_loss: 1.1374, test_f1: 0.4034
 epoch: 12, train_loss: 1.1700, test_loss: 1.1263, test_f1: 0.4022
 epoch: 13, train_loss: 1.1579, test_loss: 1.1167, test_f1: 0.4193
 epoch: 14, train_loss: 1.1600, test_loss: 1.1175, test_f1: 0.4127
 epoch: 15, train_loss: 1.1526, test_loss: 1.1039, test_f1: 0.4264
 epoch: 16, train_loss: 1.1440, test_loss: 1.0963, test_f1: 0.4443
 epoch: 17, train_loss: 1.1376, test_loss: 1.0985, test_f1: 0.4274
 epoch: 18, train_loss: 1.1353, test_loss: 1.0998, test_f1: 0.4400
 epoch: 19, train_loss: 1.1209, test_loss: 1.0638, test_f1: 0.4349
 epoch: 20, train_loss: 1.1231, test_loss: 1.0702, test_f1: 0.4251
 epoch: 21, train_loss: 1.1046, test_loss: 1.0510, test_f1: 0.4366
 epoch: 22, train_loss: 1.1030, test_loss: 1.0417, test_f1: 0.4323
 epoch: 23, train_loss: 1.1125, test_loss: 1.0475, test_f1: 0.4387
 epoch: 24, train_loss: 1.0955, test_loss: 1.0734, test_f1: 0.4288
 epoch: 25, train_loss: 1.0900, test_loss: 1.0153, test_f1: 0.4489
 epoch: 26, train_loss: 1.0800, test_loss: 1.0324, test_f1: 0.4481
 epoch: 27, train_loss: 1.0761, test_loss: 1.0098, test_f1: 0.4427
 epoch: 28, train_loss: 1.0681, test_loss: 1.0142, test_f1: 0.4438
 epoch: 29, train_loss: 1.0720, test_loss: 1.0330, test_f1: 0.4454
 epoch: 30, train_loss: 1.0634, test_loss: 0.9908, test_f1: 0.4525
 epoch: 31, train_loss: 1.0499, test_loss: 1.0135, test_f1: 0.4608
 epoch: 32, train_loss: 1.0475, test_loss: 0.9952, test_f1: 0.4621
 epoch: 33, train_loss: 1.0455, test_loss: 0.9974, test_f1: 0.4640
 epoch: 34, train_loss: 1.0422, test_loss: 0.9687, test_f1: 0.4667
 epoch: 35, train_loss: 1.0379, test_loss: 0.9778, test_f1: 0.4616
 epoch: 36, train_loss: 1.0287, test_loss: 0.9823, test_f1: 0.4513
 epoch: 37, train_loss: 1.0226, test_loss: 0.9634, test_f1: 0.4567
 epoch: 38, train_loss: 1.0157, test_loss: 0.9811, test_f1: 0.4632
 epoch: 39, train_loss: 1.0142, test_loss: 0.9735, test_f1: 0.4705
 epoch: 40, train_loss: 1.0276, test_loss: 0.9440, test_f1: 0.4932
 epoch: 41, train_loss: 1.0038, test_loss: 0.9502, test_f1: 0.4624
 epoch: 42, train_loss: 1.0139, test_loss: 0.9363, test_f1: 0.4887
 epoch: 43, train_loss: 0.9992, test_loss: 0.9432, test_f1: 0.4791
 epoch: 44, train_loss: 0.9903, test_loss: 0.9391, test_f1: 0.4808
 epoch: 45, train_loss: 0.9946, test_loss: 0.9444, test_f1: 0.4644
 epoch: 46, train_loss: 0.9897, test_loss: 0.9573, test_f1: 0.4832
 epoch: 47, train_loss: 0.9909, test_loss: 0.9383, test_f1: 0.4831
 epoch: 48, train_loss: 0.9847, test_loss: 0.9417, test_f1: 0.4655
 epoch: 49, train_loss: 0.9749, test_loss: 0.9470, test_f1: 0.4668
 epoch: 50, train_loss: 0.9802, test_loss: 0.9416, test_f1: 0.4711
 epoch: 51, train_loss: 0.9596, test_loss: 0.9361, test_f1: 0.4879
 epoch: 52, train_loss: 0.9627, test_loss: 0.9353, test_f1: 0.4798
 epoch: 53, train_loss: 0.9635, test_loss: 0.9479, test_f1: 0.4802
 epoch: 54, train_loss: 0.9553, test_loss: 0.9317, test_f1: 0.4704
 epoch: 55, train_loss: 0.9638, test_loss: 0.9448, test_f1: 0.4695
 epoch: 56, train_loss: 0.9608, test_loss: 0.9296, test_f1: 0.4815
 epoch: 57, train_loss: 0.9508, test_loss: 0.9384, test_f1: 0.4814
 epoch: 58, train_loss: 0.9560, test_loss: 0.9528, test_f1: 0.4839
 epoch: 59, train_loss: 0.9519, test_loss: 0.9217, test_f1: 0.4814
 epoch: 60, train_loss: 0.9434, test_loss: 0.9392, test_f1: 0.4776
 epoch: 61, train_loss: 0.9386, test_loss: 0.9358, test_f1: 0.4923
 epoch: 62, train_loss: 0.9387, test_loss: 0.9314, test_f1: 0.4964
 epoch: 63, train_loss: 0.9525, test_loss: 0.9320, test_f1: 0.4803
 epoch: 64, train_loss: 0.9350, test_loss: 0.9253, test_f1: 0.4922
 epoch: 65, train_loss: 0.9375, test_loss: 0.9309, test_f1: 0.4934
 epoch: 66, train_loss: 0.9397, test_loss: 0.9442, test_f1: 0.4915
 epoch: 67, train_loss: 0.9323, test_loss: 0.9471, test_f1: 0.4897
 epoch: 68, train_loss: 0.9379, test_loss: 0.9321, test_f1: 0.4921
 epoch: 69, train_loss: 0.9338, test_loss: 0.9411, test_f1: 0.4904
 epoch: 70, train_loss: 0.9339, test_loss: 0.9309, test_f1: 0.4868
 epoch: 71, train_loss: 0.9337, test_loss: 0.9419, test_f1: 0.4903
 epoch: 72, train_loss: 0.9262, test_loss: 0.9508, test_f1: 0.4839
 epoch: 73, train_loss: 0.9222, test_loss: 0.9402, test_f1: 0.4806
 epoch: 74, train_loss: 0.9231, test_loss: 0.9340, test_f1: 0.4851
 epoch: 75, train_loss: 0.9130, test_loss: 0.9602, test_f1: 0.4738
 epoch: 76, train_loss: 0.9265, test_loss: 0.9227, test_f1: 0.4922
 epoch: 77, train_loss: 0.9216, test_loss: 0.9365, test_f1: 0.5001
 epoch: 78, train_loss: 0.9275, test_loss: 0.9448, test_f1: 0.4923
 epoch: 79, train_loss: 0.9214, test_loss: 0.9421, test_f1: 0.5200
 epoch: 80, train_loss: 0.9267, test_loss: 0.9198, test_f1: 0.5243
 epoch: 81, train_loss: 0.9170, test_loss: 0.9325, test_f1: 0.4900
 epoch: 82, train_loss: 0.9203, test_loss: 0.9577, test_f1: 0.4695
 epoch: 83, train_loss: 0.9127, test_loss: 0.9436, test_f1: 0.4956
 epoch: 84, train_loss: 0.9158, test_loss: 0.9327, test_f1: 0.4871
 epoch: 85, train_loss: 0.9122, test_loss: 0.9333, test_f1: 0.4990
 epoch: 86, train_loss: 0.9234, test_loss: 0.9230, test_f1: 0.5277
 epoch: 87, train_loss: 0.9086, test_loss: 0.9406, test_f1: 0.5127
 epoch: 88, train_loss: 0.9125, test_loss: 0.9326, test_f1: 0.5112
 epoch: 89, train_loss: 0.8940, test_loss: 0.9299, test_f1: 0.5084
 epoch: 90, train_loss: 0.8959, test_loss: 0.9374, test_f1: 0.5046
 epoch: 91, train_loss: 0.9060, test_loss: 0.9288, test_f1: 0.5000
 epoch: 92, train_loss: 0.8969, test_loss: 0.9338, test_f1: 0.4905
 epoch: 93, train_loss: 0.9066, test_loss: 0.9302, test_f1: 0.4886
 epoch: 94, train_loss: 0.9012, test_loss: 0.9346, test_f1: 0.4926
 epoch: 95, train_loss: 0.8975, test_loss: 0.9368, test_f1: 0.5101
 epoch: 96, train_loss: 0.8980, test_loss: 0.9327, test_f1: 0.5142
 epoch: 97, train_loss: 0.9026, test_loss: 0.9280, test_f1: 0.5281
 epoch: 98, train_loss: 0.8909, test_loss: 0.9285, test_f1: 0.5117
 epoch: 99, train_loss: 0.8784, test_loss: 0.9441, test_f1: 0.5095
##################ITERATION #6 ****************************************
 epoch: 0, train_loss: 1.4229, test_loss: 1.3136, test_f1: 0.2274
 epoch: 1, train_loss: 1.2711, test_loss: 1.2482, test_f1: 0.2913
 epoch: 2, train_loss: 1.2520, test_loss: 1.2274, test_f1: 0.3383
 epoch: 3, train_loss: 1.2329, test_loss: 1.2112, test_f1: 0.3294
 epoch: 4, train_loss: 1.2264, test_loss: 1.2009, test_f1: 0.3875
 epoch: 5, train_loss: 1.2104, test_loss: 1.1949, test_f1: 0.4046
 epoch: 6, train_loss: 1.2063, test_loss: 1.1942, test_f1: 0.3936
 epoch: 7, train_loss: 1.1983, test_loss: 1.1783, test_f1: 0.3944
 epoch: 8, train_loss: 1.1966, test_loss: 1.1764, test_f1: 0.3977
 epoch: 9, train_loss: 1.1932, test_loss: 1.1601, test_f1: 0.4097
 epoch: 10, train_loss: 1.1711, test_loss: 1.1501, test_f1: 0.4122
 epoch: 11, train_loss: 1.1650, test_loss: 1.1473, test_f1: 0.4127
 epoch: 12, train_loss: 1.1593, test_loss: 1.1229, test_f1: 0.4279
 epoch: 13, train_loss: 1.1481, test_loss: 1.1176, test_f1: 0.4278
 epoch: 14, train_loss: 1.1470, test_loss: 1.0994, test_f1: 0.4375
 epoch: 15, train_loss: 1.1356, test_loss: 1.0973, test_f1: 0.4713
 epoch: 16, train_loss: 1.1318, test_loss: 1.1031, test_f1: 0.4290
 epoch: 17, train_loss: 1.1284, test_loss: 1.0871, test_f1: 0.4302
 epoch: 18, train_loss: 1.1186, test_loss: 1.0699, test_f1: 0.4403
 epoch: 19, train_loss: 1.1173, test_loss: 1.0619, test_f1: 0.4578
 epoch: 20, train_loss: 1.1037, test_loss: 1.0844, test_f1: 0.4405
 epoch: 21, train_loss: 1.1064, test_loss: 1.0582, test_f1: 0.4247
 epoch: 22, train_loss: 1.1069, test_loss: 1.0618, test_f1: 0.4467
 epoch: 23, train_loss: 1.0913, test_loss: 1.0451, test_f1: 0.4327
 epoch: 24, train_loss: 1.0832, test_loss: 1.0428, test_f1: 0.4459
 epoch: 25, train_loss: 1.0838, test_loss: 1.0370, test_f1: 0.4463
 epoch: 26, train_loss: 1.0709, test_loss: 1.0328, test_f1: 0.4453
 epoch: 27, train_loss: 1.0725, test_loss: 1.0256, test_f1: 0.4612
 epoch: 28, train_loss: 1.0624, test_loss: 1.0023, test_f1: 0.4781
 epoch: 29, train_loss: 1.0700, test_loss: 1.0293, test_f1: 0.4577
 epoch: 30, train_loss: 1.0584, test_loss: 0.9893, test_f1: 0.4537
 epoch: 31, train_loss: 1.0454, test_loss: 0.9971, test_f1: 0.4551
 epoch: 32, train_loss: 1.0466, test_loss: 0.9918, test_f1: 0.4801
 epoch: 33, train_loss: 1.0336, test_loss: 0.9774, test_f1: 0.4666
 epoch: 34, train_loss: 1.0305, test_loss: 0.9935, test_f1: 0.4547
 epoch: 35, train_loss: 1.0265, test_loss: 0.9954, test_f1: 0.4697
 epoch: 36, train_loss: 1.0344, test_loss: 0.9816, test_f1: 0.4538
 epoch: 37, train_loss: 1.0180, test_loss: 0.9830, test_f1: 0.4696
 epoch: 38, train_loss: 1.0289, test_loss: 0.9879, test_f1: 0.4852
 epoch: 39, train_loss: 1.0226, test_loss: 0.9988, test_f1: 0.4544
 epoch: 40, train_loss: 0.9982, test_loss: 0.9894, test_f1: 0.4648
 epoch: 41, train_loss: 1.0140, test_loss: 0.9735, test_f1: 0.4660
 epoch: 42, train_loss: 0.9978, test_loss: 0.9940, test_f1: 0.4683
 epoch: 43, train_loss: 1.0035, test_loss: 0.9610, test_f1: 0.4811
 epoch: 44, train_loss: 0.9977, test_loss: 0.9741, test_f1: 0.4730
 epoch: 45, train_loss: 0.9925, test_loss: 0.9713, test_f1: 0.4691
 epoch: 46, train_loss: 0.9988, test_loss: 0.9524, test_f1: 0.4882
 epoch: 47, train_loss: 0.9839, test_loss: 0.9675, test_f1: 0.4880
 epoch: 48, train_loss: 0.9885, test_loss: 0.9592, test_f1: 0.4731
 epoch: 49, train_loss: 0.9810, test_loss: 0.9530, test_f1: 0.4807
 epoch: 50, train_loss: 0.9811, test_loss: 0.9673, test_f1: 0.4788
 epoch: 51, train_loss: 0.9824, test_loss: 0.9619, test_f1: 0.4850
 epoch: 52, train_loss: 0.9667, test_loss: 0.9451, test_f1: 0.4764
 epoch: 53, train_loss: 0.9640, test_loss: 0.9522, test_f1: 0.4745
 epoch: 54, train_loss: 0.9631, test_loss: 0.9524, test_f1: 0.4759
 epoch: 55, train_loss: 0.9618, test_loss: 0.9585, test_f1: 0.4690
 epoch: 56, train_loss: 0.9550, test_loss: 0.9670, test_f1: 0.4769
 epoch: 57, train_loss: 0.9511, test_loss: 1.0044, test_f1: 0.4491
 epoch: 58, train_loss: 0.9615, test_loss: 0.9488, test_f1: 0.4594
 epoch: 59, train_loss: 0.9512, test_loss: 0.9659, test_f1: 0.4740
 epoch: 60, train_loss: 0.9487, test_loss: 0.9568, test_f1: 0.4823
 epoch: 61, train_loss: 0.9476, test_loss: 0.9563, test_f1: 0.4752
 epoch: 62, train_loss: 0.9546, test_loss: 0.9447, test_f1: 0.4781
 epoch: 63, train_loss: 0.9437, test_loss: 0.9542, test_f1: 0.4823
 epoch: 64, train_loss: 0.9455, test_loss: 0.9613, test_f1: 0.4794
 epoch: 65, train_loss: 0.9499, test_loss: 0.9528, test_f1: 0.4753
 epoch: 66, train_loss: 0.9411, test_loss: 0.9582, test_f1: 0.4597
 epoch: 67, train_loss: 0.9383, test_loss: 0.9570, test_f1: 0.4732
 epoch: 68, train_loss: 0.9405, test_loss: 0.9506, test_f1: 0.4884
 epoch: 69, train_loss: 0.9400, test_loss: 0.9607, test_f1: 0.4674
 epoch: 70, train_loss: 0.9408, test_loss: 0.9612, test_f1: 0.4753
 epoch: 71, train_loss: 0.9323, test_loss: 0.9867, test_f1: 0.4653
 epoch: 72, train_loss: 0.9373, test_loss: 0.9551, test_f1: 0.4833
 epoch: 73, train_loss: 0.9394, test_loss: 0.9631, test_f1: 0.4883
 epoch: 74, train_loss: 0.9246, test_loss: 0.9528, test_f1: 0.4695
 epoch: 75, train_loss: 0.9384, test_loss: 0.9675, test_f1: 0.4735
 epoch: 76, train_loss: 0.9353, test_loss: 0.9644, test_f1: 0.4754
 epoch: 77, train_loss: 0.9372, test_loss: 0.9902, test_f1: 0.4688
 epoch: 78, train_loss: 0.9283, test_loss: 1.0096, test_f1: 0.4659
 epoch: 79, train_loss: 0.9196, test_loss: 0.9867, test_f1: 0.4458
 epoch: 80, train_loss: 0.9229, test_loss: 0.9664, test_f1: 0.4747
 epoch: 81, train_loss: 0.9215, test_loss: 0.9659, test_f1: 0.4625
 epoch: 82, train_loss: 0.9297, test_loss: 0.9699, test_f1: 0.4743
 epoch: 83, train_loss: 0.9186, test_loss: 0.9823, test_f1: 0.4761
 epoch: 84, train_loss: 0.9328, test_loss: 0.9785, test_f1: 0.4791
 epoch: 85, train_loss: 0.9197, test_loss: 0.9754, test_f1: 0.4703
 epoch: 86, train_loss: 0.9259, test_loss: 0.9851, test_f1: 0.4636
 epoch: 87, train_loss: 0.9145, test_loss: 0.9748, test_f1: 0.4722
 epoch: 88, train_loss: 0.9181, test_loss: 0.9800, test_f1: 0.4673
 epoch: 89, train_loss: 0.9013, test_loss: 0.9623, test_f1: 0.4746
 epoch: 90, train_loss: 0.9170, test_loss: 0.9455, test_f1: 0.4810
 epoch: 91, train_loss: 0.9100, test_loss: 0.9770, test_f1: 0.4791
 epoch: 92, train_loss: 0.9127, test_loss: 1.0124, test_f1: 0.4612
 epoch: 93, train_loss: 0.9068, test_loss: 0.9990, test_f1: 0.4506
 epoch: 94, train_loss: 0.9217, test_loss: 0.9496, test_f1: 0.4720
 epoch: 95, train_loss: 0.9068, test_loss: 0.9697, test_f1: 0.4762
 epoch: 96, train_loss: 0.9091, test_loss: 0.9924, test_f1: 0.4747
 epoch: 97, train_loss: 0.9032, test_loss: 0.9739, test_f1: 0.4799
 epoch: 98, train_loss: 0.9080, test_loss: 0.9470, test_f1: 0.4672
 epoch: 99, train_loss: 0.9072, test_loss: 0.9736, test_f1: 0.4692
##################ITERATION #7 ****************************************
 epoch: 0, train_loss: 1.3893, test_loss: 1.2692, test_f1: 0.2274
 epoch: 1, train_loss: 1.2557, test_loss: 1.2040, test_f1: 0.2948
 epoch: 2, train_loss: 1.2270, test_loss: 1.1647, test_f1: 0.3517
 epoch: 3, train_loss: 1.2111, test_loss: 1.1512, test_f1: 0.4196
 epoch: 4, train_loss: 1.1875, test_loss: 1.1321, test_f1: 0.4228
 epoch: 5, train_loss: 1.1740, test_loss: 1.1107, test_f1: 0.4240
 epoch: 6, train_loss: 1.1635, test_loss: 1.1002, test_f1: 0.4431
 epoch: 7, train_loss: 1.1504, test_loss: 1.0828, test_f1: 0.4887
 epoch: 8, train_loss: 1.1441, test_loss: 1.0721, test_f1: 0.4644
 epoch: 9, train_loss: 1.1308, test_loss: 1.0582, test_f1: 0.4651
 epoch: 10, train_loss: 1.1292, test_loss: 1.0577, test_f1: 0.4646
 epoch: 11, train_loss: 1.1223, test_loss: 1.0641, test_f1: 0.4799
 epoch: 12, train_loss: 1.1130, test_loss: 1.0395, test_f1: 0.4649
 epoch: 13, train_loss: 1.1020, test_loss: 1.0273, test_f1: 0.4756
 epoch: 14, train_loss: 1.0990, test_loss: 1.0294, test_f1: 0.4665
 epoch: 15, train_loss: 1.0934, test_loss: 1.0358, test_f1: 0.4701
 epoch: 16, train_loss: 1.0907, test_loss: 1.0243, test_f1: 0.4763
 epoch: 17, train_loss: 1.0786, test_loss: 1.0184, test_f1: 0.4758
 epoch: 18, train_loss: 1.0756, test_loss: 1.0078, test_f1: 0.4725
 epoch: 19, train_loss: 1.0766, test_loss: 0.9996, test_f1: 0.4712
 epoch: 20, train_loss: 1.0577, test_loss: 0.9947, test_f1: 0.4779
 epoch: 21, train_loss: 1.0656, test_loss: 1.0060, test_f1: 0.4719
 epoch: 22, train_loss: 1.0619, test_loss: 0.9864, test_f1: 0.4711
 epoch: 23, train_loss: 1.0636, test_loss: 0.9885, test_f1: 0.4743
 epoch: 24, train_loss: 1.0404, test_loss: 0.9852, test_f1: 0.4756
 epoch: 25, train_loss: 1.0428, test_loss: 0.9887, test_f1: 0.4794
 epoch: 26, train_loss: 1.0351, test_loss: 0.9722, test_f1: 0.4741
 epoch: 27, train_loss: 1.0258, test_loss: 0.9738, test_f1: 0.4665
 epoch: 28, train_loss: 1.0252, test_loss: 0.9728, test_f1: 0.4736
 epoch: 29, train_loss: 1.0090, test_loss: 0.9615, test_f1: 0.4717
 epoch: 30, train_loss: 1.0161, test_loss: 0.9580, test_f1: 0.4782
 epoch: 31, train_loss: 1.0232, test_loss: 0.9680, test_f1: 0.4765
 epoch: 32, train_loss: 1.0030, test_loss: 0.9742, test_f1: 0.4599
 epoch: 33, train_loss: 1.0084, test_loss: 0.9547, test_f1: 0.4765
 epoch: 34, train_loss: 0.9954, test_loss: 0.9847, test_f1: 0.4449
 epoch: 35, train_loss: 0.9963, test_loss: 0.9615, test_f1: 0.4637
 epoch: 36, train_loss: 1.0014, test_loss: 0.9679, test_f1: 0.4629
 epoch: 37, train_loss: 0.9957, test_loss: 0.9463, test_f1: 0.4784
 epoch: 38, train_loss: 0.9869, test_loss: 0.9677, test_f1: 0.4670
 epoch: 39, train_loss: 0.9870, test_loss: 0.9806, test_f1: 0.4661
 epoch: 40, train_loss: 0.9984, test_loss: 0.9394, test_f1: 0.4776
 epoch: 41, train_loss: 0.9848, test_loss: 0.9725, test_f1: 0.4598
 epoch: 42, train_loss: 0.9636, test_loss: 0.9469, test_f1: 0.4565
 epoch: 43, train_loss: 0.9559, test_loss: 0.9471, test_f1: 0.4767
 epoch: 44, train_loss: 0.9738, test_loss: 0.9379, test_f1: 0.4778
 epoch: 45, train_loss: 0.9781, test_loss: 0.9704, test_f1: 0.4761
 epoch: 46, train_loss: 0.9724, test_loss: 0.9545, test_f1: 0.4727
 epoch: 47, train_loss: 0.9626, test_loss: 0.9953, test_f1: 0.4691
 epoch: 48, train_loss: 0.9507, test_loss: 0.9743, test_f1: 0.4687
 epoch: 49, train_loss: 0.9555, test_loss: 0.9745, test_f1: 0.4688
 epoch: 50, train_loss: 0.9603, test_loss: 0.9641, test_f1: 0.4623
 epoch: 51, train_loss: 0.9496, test_loss: 0.9675, test_f1: 0.4658
 epoch: 52, train_loss: 0.9338, test_loss: 1.0086, test_f1: 0.4740
 epoch: 53, train_loss: 0.9380, test_loss: 1.0695, test_f1: 0.4597
 epoch: 54, train_loss: 0.9403, test_loss: 1.0362, test_f1: 0.4776
 epoch: 55, train_loss: 0.9337, test_loss: 1.0001, test_f1: 0.4715
 epoch: 56, train_loss: 0.9474, test_loss: 1.0176, test_f1: 0.4729
 epoch: 57, train_loss: 0.9283, test_loss: 1.0159, test_f1: 0.4728
 epoch: 58, train_loss: 0.9289, test_loss: 0.9959, test_f1: 0.4748
 epoch: 59, train_loss: 0.9345, test_loss: 1.0085, test_f1: 0.4868
 epoch: 60, train_loss: 0.9331, test_loss: 1.0053, test_f1: 0.4763
 epoch: 61, train_loss: 0.9331, test_loss: 1.0159, test_f1: 0.4877
 epoch: 62, train_loss: 0.9248, test_loss: 1.0240, test_f1: 0.4839
 epoch: 63, train_loss: 0.9198, test_loss: 1.0465, test_f1: 0.4739
 epoch: 64, train_loss: 0.9178, test_loss: 1.0285, test_f1: 0.4743
 epoch: 65, train_loss: 0.9242, test_loss: 1.0156, test_f1: 0.4741
 epoch: 66, train_loss: 0.9113, test_loss: 1.0469, test_f1: 0.4911
 epoch: 67, train_loss: 0.9150, test_loss: 1.0423, test_f1: 0.4953
 epoch: 68, train_loss: 0.9220, test_loss: 0.9911, test_f1: 0.4766
 epoch: 69, train_loss: 0.9219, test_loss: 1.0353, test_f1: 0.4865
 epoch: 70, train_loss: 0.9122, test_loss: 1.0396, test_f1: 0.4876
 epoch: 71, train_loss: 0.9054, test_loss: 1.0455, test_f1: 0.4899
 epoch: 72, train_loss: 0.9162, test_loss: 1.0040, test_f1: 0.4917
 epoch: 73, train_loss: 0.9147, test_loss: 1.0320, test_f1: 0.4937
 epoch: 74, train_loss: 0.9128, test_loss: 1.0314, test_f1: 0.4978
 epoch: 75, train_loss: 0.9016, test_loss: 1.0088, test_f1: 0.4828
 epoch: 76, train_loss: 0.9176, test_loss: 1.0289, test_f1: 0.4806
 epoch: 77, train_loss: 0.9084, test_loss: 1.0690, test_f1: 0.4804
 epoch: 78, train_loss: 0.9143, test_loss: 1.0070, test_f1: 0.4875
 epoch: 79, train_loss: 0.9071, test_loss: 1.0263, test_f1: 0.4800
 epoch: 80, train_loss: 0.9030, test_loss: 1.0713, test_f1: 0.4972
 epoch: 81, train_loss: 0.9158, test_loss: 1.0401, test_f1: 0.4775
 epoch: 82, train_loss: 0.9053, test_loss: 1.2135, test_f1: 0.4754
 epoch: 83, train_loss: 0.9045, test_loss: 1.0707, test_f1: 0.4916
 epoch: 84, train_loss: 0.9046, test_loss: 1.0466, test_f1: 0.4883
 epoch: 85, train_loss: 0.8968, test_loss: 1.0663, test_f1: 0.4791
 epoch: 86, train_loss: 0.9129, test_loss: 1.0405, test_f1: 0.4951
 epoch: 87, train_loss: 0.8923, test_loss: 1.0421, test_f1: 0.4906
 epoch: 88, train_loss: 0.8879, test_loss: 1.0540, test_f1: 0.4872
 epoch: 89, train_loss: 0.8892, test_loss: 1.0539, test_f1: 0.4927
 epoch: 90, train_loss: 0.8832, test_loss: 1.0609, test_f1: 0.4780
 epoch: 91, train_loss: 0.8970, test_loss: 1.2355, test_f1: 0.4693
 epoch: 92, train_loss: 0.9002, test_loss: 1.3302, test_f1: 0.4767
 epoch: 93, train_loss: 0.8870, test_loss: 1.2053, test_f1: 0.4850
 epoch: 94, train_loss: 0.9032, test_loss: 1.0892, test_f1: 0.4831
 epoch: 95, train_loss: 0.8838, test_loss: 1.1452, test_f1: 0.4871
 epoch: 96, train_loss: 0.8886, test_loss: 1.1111, test_f1: 0.4931
 epoch: 97, train_loss: 0.8919, test_loss: 1.0893, test_f1: 0.4980
 epoch: 98, train_loss: 0.8788, test_loss: 1.0890, test_f1: 0.5011
 epoch: 99, train_loss: 0.8912, test_loss: 1.1148, test_f1: 0.4924
##################ITERATION #8 ****************************************
 epoch: 0, train_loss: 1.4765, test_loss: 1.3049, test_f1: 0.2280
 epoch: 1, train_loss: 1.2846, test_loss: 1.2512, test_f1: 0.3092
 epoch: 2, train_loss: 1.2717, test_loss: 1.2142, test_f1: 0.3406
 epoch: 3, train_loss: 1.2496, test_loss: 1.1979, test_f1: 0.3654
 epoch: 4, train_loss: 1.2397, test_loss: 1.1879, test_f1: 0.3765
 epoch: 5, train_loss: 1.2096, test_loss: 1.1715, test_f1: 0.3843
 epoch: 6, train_loss: 1.2143, test_loss: 1.1696, test_f1: 0.3772
 epoch: 7, train_loss: 1.2045, test_loss: 1.1546, test_f1: 0.3940
 epoch: 8, train_loss: 1.1933, test_loss: 1.1541, test_f1: 0.3979
 epoch: 9, train_loss: 1.1916, test_loss: 1.1403, test_f1: 0.4436
 epoch: 10, train_loss: 1.1788, test_loss: 1.1265, test_f1: 0.4202
 epoch: 11, train_loss: 1.1760, test_loss: 1.1139, test_f1: 0.4430
 epoch: 12, train_loss: 1.1669, test_loss: 1.1052, test_f1: 0.4443
 epoch: 13, train_loss: 1.1439, test_loss: 1.0863, test_f1: 0.4475
 epoch: 14, train_loss: 1.1479, test_loss: 1.0939, test_f1: 0.4165
 epoch: 15, train_loss: 1.1310, test_loss: 1.0639, test_f1: 0.4568
 epoch: 16, train_loss: 1.1328, test_loss: 1.0798, test_f1: 0.4712
 epoch: 17, train_loss: 1.1208, test_loss: 1.0584, test_f1: 0.4343
 epoch: 18, train_loss: 1.0999, test_loss: 1.0472, test_f1: 0.4441
 epoch: 19, train_loss: 1.1016, test_loss: 1.0351, test_f1: 0.4415
 epoch: 20, train_loss: 1.1020, test_loss: 1.0624, test_f1: 0.4514
 epoch: 21, train_loss: 1.0835, test_loss: 1.0505, test_f1: 0.4446
 epoch: 22, train_loss: 1.0725, test_loss: 1.0278, test_f1: 0.4719
 epoch: 23, train_loss: 1.0676, test_loss: 1.0178, test_f1: 0.4539
 epoch: 24, train_loss: 1.0641, test_loss: 1.0128, test_f1: 0.4505
 epoch: 25, train_loss: 1.0636, test_loss: 0.9942, test_f1: 0.4731
 epoch: 26, train_loss: 1.0505, test_loss: 0.9979, test_f1: 0.4744
 epoch: 27, train_loss: 1.0483, test_loss: 1.0045, test_f1: 0.4731
 epoch: 28, train_loss: 1.0484, test_loss: 0.9869, test_f1: 0.4757
 epoch: 29, train_loss: 1.0306, test_loss: 0.9870, test_f1: 0.4885
 epoch: 30, train_loss: 1.0294, test_loss: 0.9835, test_f1: 0.4805
 epoch: 31, train_loss: 1.0235, test_loss: 1.0010, test_f1: 0.4649
 epoch: 32, train_loss: 1.0094, test_loss: 0.9997, test_f1: 0.4795
 epoch: 33, train_loss: 1.0065, test_loss: 0.9787, test_f1: 0.4889
 epoch: 34, train_loss: 1.0004, test_loss: 1.0596, test_f1: 0.4500
 epoch: 35, train_loss: 0.9937, test_loss: 0.9729, test_f1: 0.4826
 epoch: 36, train_loss: 0.9906, test_loss: 1.0007, test_f1: 0.4621
 epoch: 37, train_loss: 0.9982, test_loss: 0.9616, test_f1: 0.4704
 epoch: 38, train_loss: 0.9827, test_loss: 1.0172, test_f1: 0.4678
 epoch: 39, train_loss: 0.9689, test_loss: 1.0060, test_f1: 0.4923
 epoch: 40, train_loss: 0.9822, test_loss: 0.9766, test_f1: 0.5111
 epoch: 41, train_loss: 0.9704, test_loss: 1.0084, test_f1: 0.4923
 epoch: 42, train_loss: 0.9692, test_loss: 1.0152, test_f1: 0.4700
 epoch: 43, train_loss: 0.9577, test_loss: 1.0300, test_f1: 0.4866
 epoch: 44, train_loss: 0.9608, test_loss: 1.0277, test_f1: 0.4809
 epoch: 45, train_loss: 0.9529, test_loss: 0.9506, test_f1: 0.4706
 epoch: 46, train_loss: 0.9600, test_loss: 1.0206, test_f1: 0.4793
 epoch: 47, train_loss: 0.9565, test_loss: 1.0356, test_f1: 0.4880
 epoch: 48, train_loss: 0.9310, test_loss: 1.0366, test_f1: 0.4795
 epoch: 49, train_loss: 0.9403, test_loss: 1.0276, test_f1: 0.5125
 epoch: 50, train_loss: 0.9399, test_loss: 1.0135, test_f1: 0.4929
 epoch: 51, train_loss: 0.9294, test_loss: 1.0527, test_f1: 0.4845
 epoch: 52, train_loss: 0.9175, test_loss: 1.0509, test_f1: 0.4772
 epoch: 53, train_loss: 0.9140, test_loss: 1.0534, test_f1: 0.4956
 epoch: 54, train_loss: 0.9181, test_loss: 1.0723, test_f1: 0.4817
 epoch: 55, train_loss: 0.9175, test_loss: 1.0574, test_f1: 0.4898
 epoch: 56, train_loss: 0.9190, test_loss: 1.0963, test_f1: 0.4661
 epoch: 57, train_loss: 0.9153, test_loss: 1.0662, test_f1: 0.4716
 epoch: 58, train_loss: 0.9144, test_loss: 1.0456, test_f1: 0.4874
 epoch: 59, train_loss: 0.9088, test_loss: 1.0675, test_f1: 0.4792
 epoch: 60, train_loss: 0.8998, test_loss: 1.0945, test_f1: 0.4923
 epoch: 61, train_loss: 0.9183, test_loss: 1.0612, test_f1: 0.4682
 epoch: 62, train_loss: 0.8986, test_loss: 1.0907, test_f1: 0.4880
 epoch: 63, train_loss: 0.9076, test_loss: 1.0933, test_f1: 0.4802
 epoch: 64, train_loss: 0.8974, test_loss: 1.0856, test_f1: 0.4838
 epoch: 65, train_loss: 0.9007, test_loss: 1.0570, test_f1: 0.4746
 epoch: 66, train_loss: 0.8993, test_loss: 1.0934, test_f1: 0.4727
 epoch: 67, train_loss: 0.9057, test_loss: 1.0831, test_f1: 0.4732
 epoch: 68, train_loss: 0.8899, test_loss: 1.0415, test_f1: 0.4956
 epoch: 69, train_loss: 0.8981, test_loss: 1.0895, test_f1: 0.4756
 epoch: 70, train_loss: 0.8940, test_loss: 1.1140, test_f1: 0.4644
 epoch: 71, train_loss: 0.8886, test_loss: 1.0889, test_f1: 0.4951
 epoch: 72, train_loss: 0.9021, test_loss: 1.0492, test_f1: 0.4895
 epoch: 73, train_loss: 0.8840, test_loss: 1.0694, test_f1: 0.4905
 epoch: 74, train_loss: 0.8769, test_loss: 1.0848, test_f1: 0.4892
 epoch: 75, train_loss: 0.8863, test_loss: 1.0870, test_f1: 0.4717
 epoch: 76, train_loss: 0.8873, test_loss: 1.0996, test_f1: 0.4833
 epoch: 77, train_loss: 0.8927, test_loss: 1.0838, test_f1: 0.4795
 epoch: 78, train_loss: 0.8892, test_loss: 1.0947, test_f1: 0.4881
 epoch: 79, train_loss: 0.8827, test_loss: 1.1019, test_f1: 0.4793
 epoch: 80, train_loss: 0.8817, test_loss: 1.1128, test_f1: 0.4740
 epoch: 81, train_loss: 0.8807, test_loss: 1.0863, test_f1: 0.4774
 epoch: 82, train_loss: 0.8764, test_loss: 1.1079, test_f1: 0.4940
 epoch: 83, train_loss: 0.8835, test_loss: 1.1158, test_f1: 0.4904
 epoch: 84, train_loss: 0.8894, test_loss: 1.0869, test_f1: 0.4987
 epoch: 85, train_loss: 0.8793, test_loss: 1.1012, test_f1: 0.4685
 epoch: 86, train_loss: 0.8793, test_loss: 1.1306, test_f1: 0.4784
 epoch: 87, train_loss: 0.8796, test_loss: 1.0979, test_f1: 0.4828
 epoch: 88, train_loss: 0.8684, test_loss: 1.1074, test_f1: 0.4645
 epoch: 89, train_loss: 0.8752, test_loss: 1.1170, test_f1: 0.4727
 epoch: 90, train_loss: 0.8692, test_loss: 1.0897, test_f1: 0.4891
 epoch: 91, train_loss: 0.8746, test_loss: 1.1397, test_f1: 0.4860
 epoch: 92, train_loss: 0.8686, test_loss: 1.1293, test_f1: 0.4769
 epoch: 93, train_loss: 0.8792, test_loss: 1.0950, test_f1: 0.4852
 epoch: 94, train_loss: 0.8674, test_loss: 1.1247, test_f1: 0.4751
 epoch: 95, train_loss: 0.8657, test_loss: 1.0941, test_f1: 0.4866
 epoch: 96, train_loss: 0.8720, test_loss: 1.1350, test_f1: 0.4683
 epoch: 97, train_loss: 0.8585, test_loss: 1.0992, test_f1: 0.4763
 epoch: 98, train_loss: 0.8606, test_loss: 1.0861, test_f1: 0.4677
 epoch: 99, train_loss: 0.8517, test_loss: 1.1381, test_f1: 0.4778
##################ITERATION #9 ****************************************
 epoch: 0, train_loss: 1.5509, test_loss: 1.3217, test_f1: 0.3402
 epoch: 1, train_loss: 1.3329, test_loss: 1.2602, test_f1: 0.3562
 epoch: 2, train_loss: 1.2852, test_loss: 1.2155, test_f1: 0.3576
 epoch: 3, train_loss: 1.2642, test_loss: 1.1982, test_f1: 0.4013
 epoch: 4, train_loss: 1.2428, test_loss: 1.1724, test_f1: 0.3890
 epoch: 5, train_loss: 1.2208, test_loss: 1.1426, test_f1: 0.4093
 epoch: 6, train_loss: 1.2016, test_loss: 1.1354, test_f1: 0.3649
 epoch: 7, train_loss: 1.1956, test_loss: 1.1311, test_f1: 0.3962
 epoch: 8, train_loss: 1.1856, test_loss: 1.1219, test_f1: 0.4035
 epoch: 9, train_loss: 1.1727, test_loss: 1.1071, test_f1: 0.4139
 epoch: 10, train_loss: 1.1611, test_loss: 1.1051, test_f1: 0.3943
 epoch: 11, train_loss: 1.1643, test_loss: 1.0913, test_f1: 0.4174
 epoch: 12, train_loss: 1.1466, test_loss: 1.0826, test_f1: 0.4330
 epoch: 13, train_loss: 1.1474, test_loss: 1.0827, test_f1: 0.4043
 epoch: 14, train_loss: 1.1380, test_loss: 1.0752, test_f1: 0.4156
 epoch: 15, train_loss: 1.1308, test_loss: 1.0639, test_f1: 0.4484
 epoch: 16, train_loss: 1.1369, test_loss: 1.0660, test_f1: 0.4348
 epoch: 17, train_loss: 1.1173, test_loss: 1.0557, test_f1: 0.4299
 epoch: 18, train_loss: 1.1064, test_loss: 1.0576, test_f1: 0.4377
 epoch: 19, train_loss: 1.1033, test_loss: 1.0522, test_f1: 0.4462
 epoch: 20, train_loss: 1.1031, test_loss: 1.0441, test_f1: 0.4508
 epoch: 21, train_loss: 1.0932, test_loss: 1.0512, test_f1: 0.4473
 epoch: 22, train_loss: 1.0959, test_loss: 1.0443, test_f1: 0.4410
 epoch: 23, train_loss: 1.0932, test_loss: 1.0388, test_f1: 0.4376
 epoch: 24, train_loss: 1.0861, test_loss: 1.0434, test_f1: 0.4527
 epoch: 25, train_loss: 1.0701, test_loss: 1.0403, test_f1: 0.4570
 epoch: 26, train_loss: 1.0813, test_loss: 1.0373, test_f1: 0.4610
 epoch: 27, train_loss: 1.0698, test_loss: 1.0500, test_f1: 0.4423
 epoch: 28, train_loss: 1.0663, test_loss: 1.0344, test_f1: 0.4588
 epoch: 29, train_loss: 1.0701, test_loss: 1.0431, test_f1: 0.4532
 epoch: 30, train_loss: 1.0625, test_loss: 1.0174, test_f1: 0.4519
 epoch: 31, train_loss: 1.0594, test_loss: 1.0271, test_f1: 0.4675
 epoch: 32, train_loss: 1.0648, test_loss: 1.0175, test_f1: 0.4548
 epoch: 33, train_loss: 1.0499, test_loss: 1.0140, test_f1: 0.4819
 epoch: 34, train_loss: 1.0389, test_loss: 1.0061, test_f1: 0.4802
 epoch: 35, train_loss: 1.0401, test_loss: 1.0048, test_f1: 0.4735
 epoch: 36, train_loss: 1.0364, test_loss: 1.0173, test_f1: 0.4653
 epoch: 37, train_loss: 1.0373, test_loss: 1.0098, test_f1: 0.4617
 epoch: 38, train_loss: 1.0408, test_loss: 1.0113, test_f1: 0.4588
 epoch: 39, train_loss: 1.0341, test_loss: 0.9919, test_f1: 0.4755
 epoch: 40, train_loss: 1.0322, test_loss: 1.0037, test_f1: 0.4764
 epoch: 41, train_loss: 1.0358, test_loss: 0.9907, test_f1: 0.4738
 epoch: 42, train_loss: 1.0258, test_loss: 1.0180, test_f1: 0.4698
 epoch: 43, train_loss: 1.0291, test_loss: 0.9937, test_f1: 0.4613
 epoch: 44, train_loss: 1.0273, test_loss: 0.9913, test_f1: 0.4787
 epoch: 45, train_loss: 1.0233, test_loss: 1.0219, test_f1: 0.4695
 epoch: 46, train_loss: 1.0166, test_loss: 0.9812, test_f1: 0.4633
 epoch: 47, train_loss: 1.0072, test_loss: 1.0114, test_f1: 0.4675
 epoch: 48, train_loss: 1.0079, test_loss: 1.0082, test_f1: 0.4796
 epoch: 49, train_loss: 1.0034, test_loss: 0.9830, test_f1: 0.4640
 epoch: 50, train_loss: 1.0065, test_loss: 1.0052, test_f1: 0.4748
 epoch: 51, train_loss: 0.9982, test_loss: 0.9932, test_f1: 0.4774
 epoch: 52, train_loss: 0.9984, test_loss: 0.9937, test_f1: 0.4697
 epoch: 53, train_loss: 1.0048, test_loss: 0.9919, test_f1: 0.4634
 epoch: 54, train_loss: 1.0009, test_loss: 0.9896, test_f1: 0.4765
 epoch: 55, train_loss: 0.9914, test_loss: 0.9970, test_f1: 0.4739
 epoch: 56, train_loss: 0.9878, test_loss: 0.9995, test_f1: 0.4700
 epoch: 57, train_loss: 0.9865, test_loss: 0.9910, test_f1: 0.4621
 epoch: 58, train_loss: 0.9891, test_loss: 0.9973, test_f1: 0.4752
 epoch: 59, train_loss: 0.9787, test_loss: 1.0082, test_f1: 0.4733
 epoch: 60, train_loss: 0.9785, test_loss: 0.9785, test_f1: 0.4755
 epoch: 61, train_loss: 0.9899, test_loss: 1.0101, test_f1: 0.4713
 epoch: 62, train_loss: 0.9876, test_loss: 0.9890, test_f1: 0.4805
 epoch: 63, train_loss: 0.9760, test_loss: 0.9727, test_f1: 0.4806
 epoch: 64, train_loss: 0.9792, test_loss: 0.9934, test_f1: 0.4834
 epoch: 65, train_loss: 0.9808, test_loss: 0.9853, test_f1: 0.4806
 epoch: 66, train_loss: 0.9796, test_loss: 0.9798, test_f1: 0.4907
 epoch: 67, train_loss: 0.9817, test_loss: 0.9945, test_f1: 0.4799
 epoch: 68, train_loss: 0.9713, test_loss: 0.9733, test_f1: 0.4865
 epoch: 69, train_loss: 0.9794, test_loss: 1.0048, test_f1: 0.4796
 epoch: 70, train_loss: 0.9709, test_loss: 0.9913, test_f1: 0.4740
 epoch: 71, train_loss: 0.9758, test_loss: 0.9855, test_f1: 0.4766
 epoch: 72, train_loss: 0.9751, test_loss: 0.9849, test_f1: 0.4819
 epoch: 73, train_loss: 0.9685, test_loss: 0.9828, test_f1: 0.4758
 epoch: 74, train_loss: 0.9816, test_loss: 1.0114, test_f1: 0.4708
 epoch: 75, train_loss: 0.9641, test_loss: 1.0030, test_f1: 0.4683
 epoch: 76, train_loss: 0.9707, test_loss: 0.9797, test_f1: 0.4731
 epoch: 77, train_loss: 0.9597, test_loss: 1.0168, test_f1: 0.4594
 epoch: 78, train_loss: 0.9634, test_loss: 0.9875, test_f1: 0.4668
 epoch: 79, train_loss: 0.9667, test_loss: 0.9850, test_f1: 0.4714
 epoch: 80, train_loss: 0.9680, test_loss: 0.9931, test_f1: 0.4630
 epoch: 81, train_loss: 0.9635, test_loss: 0.9882, test_f1: 0.4704
 epoch: 82, train_loss: 0.9568, test_loss: 0.9980, test_f1: 0.4670
 epoch: 83, train_loss: 0.9581, test_loss: 0.9984, test_f1: 0.4636
 epoch: 84, train_loss: 0.9567, test_loss: 0.9822, test_f1: 0.4752
 epoch: 85, train_loss: 0.9548, test_loss: 0.9860, test_f1: 0.4667
 epoch: 86, train_loss: 0.9539, test_loss: 1.0044, test_f1: 0.4676
 epoch: 87, train_loss: 0.9545, test_loss: 0.9668, test_f1: 0.4829
 epoch: 88, train_loss: 0.9622, test_loss: 0.9791, test_f1: 0.4682
 epoch: 89, train_loss: 0.9453, test_loss: 0.9970, test_f1: 0.4695
 epoch: 90, train_loss: 0.9476, test_loss: 0.9901, test_f1: 0.4628
 epoch: 91, train_loss: 0.9508, test_loss: 0.9908, test_f1: 0.4625
 epoch: 92, train_loss: 0.9542, test_loss: 0.9811, test_f1: 0.4671
 epoch: 93, train_loss: 0.9489, test_loss: 1.0065, test_f1: 0.4647
 epoch: 94, train_loss: 0.9535, test_loss: 0.9864, test_f1: 0.4624
 epoch: 95, train_loss: 0.9531, test_loss: 0.9927, test_f1: 0.4697
 epoch: 96, train_loss: 0.9543, test_loss: 0.9759, test_f1: 0.4694
 epoch: 97, train_loss: 0.9439, test_loss: 1.0017, test_f1: 0.4712
 epoch: 98, train_loss: 0.9460, test_loss: 0.9797, test_f1: 0.4684
 epoch: 99, train_loss: 0.9465, test_loss: 1.0233, test_f1: 0.4508

Training completed in 522.89 seconds
Best F1: 0.5281 at epoch 97
Mean F1 across iterations: 0.5022  0.0156
========================FINAL RESULTS================================
FEGIN weighted F1: 0.5281  0.0156
python main.py --data ltspice_examples --representation component_component --model FEGIN --layers 5 --hiddens 16 --batch_size 128 --lr 0.001 --emb_size 128 --epochs 100 --save_appendix component_component_L5_H16_BS128_LR0.001_E128 --no_val
-----



STDERR:
  File "main.py", line 370, in <module>
    main()
  File "main.py", line 254, in main
    dataset = dataset_class(
  File "/home/philip/projects/ltspice_examples_code_repo/Circuit-Completion-Using-GNNs/component_classification_with_link_prediction_head/evaluation/FEGIN/kernel/circuit_datasets.py", line 15, in __init__
    self.data, self.slices = torch.load(self.processed_paths[0])
  File "/home/philip/.local/lib/python3.8/site-packages/torch/serialization.py", line 1040, in load
    warnings.warn(
  File "/usr/lib/python3.8/warnings.py", line 109, in _showwarnmsg
    sw(msg.message, msg.category, msg.filename, msg.lineno,
  File "main.py", line 47, in warn_with_traceback
    traceback.print_stack(file=log)
/home/philip/projects/ltspice_examples_code_repo/Circuit-Completion-Using-GNNs/component_classification_with_link_prediction_head/evaluation/FEGIN/kernel/circuit_datasets.py:15: FutureWarning: You are using `torch.load` with `weights_only=False` (the current default value), which uses the default pickle module implicitly. It is possible to construct malicious pickle data which will execute arbitrary code during unpickling (See https://github.com/pytorch/pytorch/blob/main/SECURITY.md#untrusted-models for more details). In a future release, the default value for `weights_only` will be flipped to `True`. This limits the functions that could be executed during unpickling. Arbitrary objects will no longer be allowed to be loaded via this mode unless they are explicitly allowlisted by the user via `torch.serialization.add_safe_globals`. We recommend you start setting `weights_only=True` for any use case where you don't have full control of the loaded file. Please open an issue on GitHub for any issues related to this experimental feature.
  self.data, self.slices = torch.load(self.processed_paths[0])
