STDOUT:
Results will be saved in /home/philip/projects/llm_inference_code_repo/Circuit-Completion-Using-GNNs/component_classification_with_link_prediction_head/evaluation/FEGIN/results/model_FEGIN_dataset_ltspice_examples
Command line input: python main.py --data ltspice_examples --representation component_pin --model FEGIN --layers 6 --hiddens 64 --batch_size 256 --lr 0.001 --emb_size 128 --epochs 100 --save_appendix component_pin_L6_H64_BS256_LR0.001_E128 --no_val
 is saved.
-----
ltspice_examples - FEGIN
Using 6 layers, 64 hidden units, h = 2
Loading component_pin representation dataset
ENTERED
Training FEGIN on component_pin representation
Train: 3560, Test: 848
##################ITERATION #0 ****************************************
 epoch: 0, train_loss: 1.3357, test_loss: 1.3205, test_f1: 0.2260
 epoch: 1, train_loss: 1.2395, test_loss: 1.3029, test_f1: 0.2260
 epoch: 2, train_loss: 1.1860, test_loss: 1.3420, test_f1: 0.2260
 epoch: 3, train_loss: 1.1358, test_loss: 1.2669, test_f1: 0.2286
 epoch: 4, train_loss: 1.0680, test_loss: 1.0515, test_f1: 0.4497
 epoch: 5, train_loss: 1.0194, test_loss: 1.0462, test_f1: 0.4423
 epoch: 6, train_loss: 0.9760, test_loss: 0.9922, test_f1: 0.4618
 epoch: 7, train_loss: 0.9489, test_loss: 0.9547, test_f1: 0.4924
 epoch: 8, train_loss: 0.9353, test_loss: 0.9265, test_f1: 0.5292
 epoch: 9, train_loss: 0.9160, test_loss: 1.0171, test_f1: 0.4910
 epoch: 10, train_loss: 0.9026, test_loss: 0.9468, test_f1: 0.5106
 epoch: 11, train_loss: 0.8847, test_loss: 0.9687, test_f1: 0.5073
 epoch: 12, train_loss: 0.8694, test_loss: 0.9138, test_f1: 0.5158
 epoch: 13, train_loss: 0.8472, test_loss: 0.9398, test_f1: 0.5053
 epoch: 14, train_loss: 0.8238, test_loss: 0.9968, test_f1: 0.5250
 epoch: 15, train_loss: 0.8037, test_loss: 0.9042, test_f1: 0.5401
 epoch: 16, train_loss: 0.7938, test_loss: 0.8736, test_f1: 0.5522
 epoch: 17, train_loss: 0.7832, test_loss: 0.9216, test_f1: 0.5356
 epoch: 18, train_loss: 0.7711, test_loss: 0.8755, test_f1: 0.5618
 epoch: 19, train_loss: 0.7812, test_loss: 0.9135, test_f1: 0.5317
 epoch: 20, train_loss: 0.7688, test_loss: 1.0452, test_f1: 0.5074
 epoch: 21, train_loss: 0.7597, test_loss: 0.9329, test_f1: 0.5187
 epoch: 22, train_loss: 0.7391, test_loss: 0.9023, test_f1: 0.5614
 epoch: 23, train_loss: 0.7420, test_loss: 0.8507, test_f1: 0.5674
 epoch: 24, train_loss: 0.7204, test_loss: 0.9381, test_f1: 0.5442
 epoch: 25, train_loss: 0.6956, test_loss: 0.9304, test_f1: 0.5340
 epoch: 26, train_loss: 0.6891, test_loss: 0.9005, test_f1: 0.5643
 epoch: 27, train_loss: 0.6872, test_loss: 1.0538, test_f1: 0.5319
 epoch: 28, train_loss: 0.6852, test_loss: 0.9109, test_f1: 0.5713
 epoch: 29, train_loss: 0.6837, test_loss: 0.9052, test_f1: 0.5793
 epoch: 30, train_loss: 0.6513, test_loss: 0.9396, test_f1: 0.5793
 epoch: 31, train_loss: 0.6474, test_loss: 1.0137, test_f1: 0.5498
 epoch: 32, train_loss: 0.6493, test_loss: 0.9800, test_f1: 0.5565
 epoch: 33, train_loss: 0.6350, test_loss: 0.9398, test_f1: 0.5953
 epoch: 34, train_loss: 0.6250, test_loss: 0.9393, test_f1: 0.5784
 epoch: 35, train_loss: 0.6126, test_loss: 0.8868, test_f1: 0.5870
 epoch: 36, train_loss: 0.5956, test_loss: 1.0516, test_f1: 0.6098
 epoch: 37, train_loss: 0.6191, test_loss: 1.0543, test_f1: 0.5795
 epoch: 38, train_loss: 0.6175, test_loss: 0.9275, test_f1: 0.5800
 epoch: 39, train_loss: 0.5908, test_loss: 1.0063, test_f1: 0.6120
 epoch: 40, train_loss: 0.6070, test_loss: 0.9972, test_f1: 0.5870
 epoch: 41, train_loss: 0.5951, test_loss: 1.0391, test_f1: 0.5896
 epoch: 42, train_loss: 0.6017, test_loss: 1.0777, test_f1: 0.5853
 epoch: 43, train_loss: 0.5795, test_loss: 1.0773, test_f1: 0.5867
 epoch: 44, train_loss: 0.5534, test_loss: 0.9572, test_f1: 0.5969
 epoch: 45, train_loss: 0.5457, test_loss: 0.9621, test_f1: 0.6145
 epoch: 46, train_loss: 0.5434, test_loss: 1.0964, test_f1: 0.5853
 epoch: 47, train_loss: 0.5333, test_loss: 1.0346, test_f1: 0.5824
 epoch: 48, train_loss: 0.5255, test_loss: 1.0561, test_f1: 0.5968
 epoch: 49, train_loss: 0.5259, test_loss: 1.1456, test_f1: 0.5991
 epoch: 50, train_loss: 0.5216, test_loss: 1.0648, test_f1: 0.6062
 epoch: 51, train_loss: 0.4793, test_loss: 1.0133, test_f1: 0.6284
 epoch: 52, train_loss: 0.4691, test_loss: 1.0094, test_f1: 0.6443
 epoch: 53, train_loss: 0.4542, test_loss: 1.0422, test_f1: 0.6444
 epoch: 54, train_loss: 0.4399, test_loss: 1.0517, test_f1: 0.6248
 epoch: 55, train_loss: 0.4457, test_loss: 1.0511, test_f1: 0.6208
 epoch: 56, train_loss: 0.4375, test_loss: 1.0682, test_f1: 0.6263
 epoch: 57, train_loss: 0.4464, test_loss: 1.1204, test_f1: 0.6166
 epoch: 58, train_loss: 0.4435, test_loss: 1.1618, test_f1: 0.6426
 epoch: 59, train_loss: 0.4358, test_loss: 1.1038, test_f1: 0.6395
 epoch: 60, train_loss: 0.4310, test_loss: 1.1241, test_f1: 0.6353
 epoch: 61, train_loss: 0.4324, test_loss: 1.1150, test_f1: 0.6225
 epoch: 62, train_loss: 0.4217, test_loss: 1.1918, test_f1: 0.6228
 epoch: 63, train_loss: 0.4101, test_loss: 1.1882, test_f1: 0.6416
 epoch: 64, train_loss: 0.4017, test_loss: 1.2236, test_f1: 0.6521
 epoch: 65, train_loss: 0.4025, test_loss: 1.2703, test_f1: 0.6011
 epoch: 66, train_loss: 0.3907, test_loss: 1.1596, test_f1: 0.6326
 epoch: 67, train_loss: 0.3923, test_loss: 1.3000, test_f1: 0.5911
 epoch: 68, train_loss: 0.3867, test_loss: 1.2356, test_f1: 0.6327
 epoch: 69, train_loss: 0.3983, test_loss: 1.2030, test_f1: 0.6355
 epoch: 70, train_loss: 0.3877, test_loss: 1.3179, test_f1: 0.6228
 epoch: 71, train_loss: 0.3885, test_loss: 1.1927, test_f1: 0.6407
 epoch: 72, train_loss: 0.3683, test_loss: 1.2974, test_f1: 0.6235
 epoch: 73, train_loss: 0.3698, test_loss: 1.3190, test_f1: 0.6231
 epoch: 74, train_loss: 0.3680, test_loss: 1.2717, test_f1: 0.6219
 epoch: 75, train_loss: 0.3830, test_loss: 1.4297, test_f1: 0.6082
 epoch: 76, train_loss: 0.3631, test_loss: 1.2398, test_f1: 0.6321
 epoch: 77, train_loss: 0.3563, test_loss: 1.3915, test_f1: 0.6141
 epoch: 78, train_loss: 0.3770, test_loss: 1.3318, test_f1: 0.6236
 epoch: 79, train_loss: 0.3483, test_loss: 1.4176, test_f1: 0.6225
 epoch: 80, train_loss: 0.3472, test_loss: 1.3237, test_f1: 0.6328
 epoch: 81, train_loss: 0.3501, test_loss: 1.3446, test_f1: 0.6217
 epoch: 82, train_loss: 0.3381, test_loss: 1.3982, test_f1: 0.6426
 epoch: 83, train_loss: 0.3262, test_loss: 1.3872, test_f1: 0.6299
 epoch: 84, train_loss: 0.3304, test_loss: 1.3558, test_f1: 0.6274
 epoch: 85, train_loss: 0.3292, test_loss: 1.4108, test_f1: 0.6237
 epoch: 86, train_loss: 0.3193, test_loss: 1.4534, test_f1: 0.5944
 epoch: 87, train_loss: 0.3133, test_loss: 1.3880, test_f1: 0.6198
 epoch: 88, train_loss: 0.3162, test_loss: 1.5550, test_f1: 0.6215
 epoch: 89, train_loss: 0.3160, test_loss: 1.4690, test_f1: 0.6212
 epoch: 90, train_loss: 0.2971, test_loss: 1.6153, test_f1: 0.6256
 epoch: 91, train_loss: 0.3067, test_loss: 1.6116, test_f1: 0.6087
 epoch: 92, train_loss: 0.3134, test_loss: 1.5274, test_f1: 0.6027
 epoch: 93, train_loss: 0.3132, test_loss: 1.5254, test_f1: 0.6247
 epoch: 94, train_loss: 0.3216, test_loss: 1.6199, test_f1: 0.6230
 epoch: 95, train_loss: 0.3137, test_loss: 1.5349, test_f1: 0.6278
 epoch: 96, train_loss: 0.3028, test_loss: 1.4688, test_f1: 0.6218
 epoch: 97, train_loss: 0.2897, test_loss: 1.5847, test_f1: 0.6136
 epoch: 98, train_loss: 0.2864, test_loss: 1.6716, test_f1: 0.6298
 epoch: 99, train_loss: 0.2940, test_loss: 1.6522, test_f1: 0.6107
##################ITERATION #1 ****************************************
 epoch: 0, train_loss: 1.2252, test_loss: 1.3445, test_f1: 0.2260
 epoch: 1, train_loss: 1.0693, test_loss: 1.4414, test_f1: 0.2648
 epoch: 2, train_loss: 1.0030, test_loss: 1.4620, test_f1: 0.3382
 epoch: 3, train_loss: 0.9477, test_loss: 1.3654, test_f1: 0.3196
 epoch: 4, train_loss: 0.9156, test_loss: 0.9549, test_f1: 0.5083
 epoch: 5, train_loss: 0.8804, test_loss: 1.0081, test_f1: 0.4920
 epoch: 6, train_loss: 0.8703, test_loss: 0.9256, test_f1: 0.5186
 epoch: 7, train_loss: 0.8380, test_loss: 0.9276, test_f1: 0.5174
 epoch: 8, train_loss: 0.8200, test_loss: 0.9173, test_f1: 0.5704
 epoch: 9, train_loss: 0.7960, test_loss: 0.9567, test_f1: 0.5134
 epoch: 10, train_loss: 0.7776, test_loss: 0.8931, test_f1: 0.5703
 epoch: 11, train_loss: 0.7622, test_loss: 0.8679, test_f1: 0.5346
 epoch: 12, train_loss: 0.7403, test_loss: 0.8962, test_f1: 0.5845
 epoch: 13, train_loss: 0.7440, test_loss: 0.9942, test_f1: 0.5286
 epoch: 14, train_loss: 0.7442, test_loss: 1.3689, test_f1: 0.4570
 epoch: 15, train_loss: 0.7132, test_loss: 0.9083, test_f1: 0.5781
 epoch: 16, train_loss: 0.6876, test_loss: 0.9233, test_f1: 0.5969
 epoch: 17, train_loss: 0.6731, test_loss: 0.8918, test_f1: 0.5598
 epoch: 18, train_loss: 0.6498, test_loss: 0.9557, test_f1: 0.5883
 epoch: 19, train_loss: 0.6515, test_loss: 0.8576, test_f1: 0.6193
 epoch: 20, train_loss: 0.6315, test_loss: 0.9068, test_f1: 0.6020
 epoch: 21, train_loss: 0.6278, test_loss: 0.8409, test_f1: 0.6049
 epoch: 22, train_loss: 0.6285, test_loss: 0.9426, test_f1: 0.5776
 epoch: 23, train_loss: 0.6223, test_loss: 0.8882, test_f1: 0.6142
 epoch: 24, train_loss: 0.6202, test_loss: 1.2964, test_f1: 0.4809
 epoch: 25, train_loss: 0.6082, test_loss: 1.0011, test_f1: 0.5940
 epoch: 26, train_loss: 0.6028, test_loss: 0.9659, test_f1: 0.5701
 epoch: 27, train_loss: 0.6057, test_loss: 0.8767, test_f1: 0.6028
 epoch: 28, train_loss: 0.5949, test_loss: 0.9546, test_f1: 0.6080
 epoch: 29, train_loss: 0.5866, test_loss: 0.8842, test_f1: 0.6144
 epoch: 30, train_loss: 0.5783, test_loss: 1.0264, test_f1: 0.5965
 epoch: 31, train_loss: 0.5619, test_loss: 0.9197, test_f1: 0.6269
 epoch: 32, train_loss: 0.5538, test_loss: 0.9955, test_f1: 0.5776
 epoch: 33, train_loss: 0.5433, test_loss: 0.9054, test_f1: 0.6081
 epoch: 34, train_loss: 0.5273, test_loss: 0.8986, test_f1: 0.6272
 epoch: 35, train_loss: 0.5174, test_loss: 1.0928, test_f1: 0.6294
 epoch: 36, train_loss: 0.5332, test_loss: 1.0351, test_f1: 0.6235
 epoch: 37, train_loss: 0.5129, test_loss: 1.0304, test_f1: 0.5976
 epoch: 38, train_loss: 0.5101, test_loss: 1.0126, test_f1: 0.6202
 epoch: 39, train_loss: 0.4908, test_loss: 0.9855, test_f1: 0.6156
 epoch: 40, train_loss: 0.4990, test_loss: 1.0556, test_f1: 0.6182
 epoch: 41, train_loss: 0.4823, test_loss: 1.1305, test_f1: 0.6137
 epoch: 42, train_loss: 0.4723, test_loss: 1.1345, test_f1: 0.6137
 epoch: 43, train_loss: 0.4869, test_loss: 0.9874, test_f1: 0.6290
 epoch: 44, train_loss: 0.4779, test_loss: 1.0267, test_f1: 0.6233
 epoch: 45, train_loss: 0.4713, test_loss: 1.1796, test_f1: 0.6051
 epoch: 46, train_loss: 0.4535, test_loss: 1.0138, test_f1: 0.6204
 epoch: 47, train_loss: 0.4619, test_loss: 1.0906, test_f1: 0.6434
 epoch: 48, train_loss: 0.4467, test_loss: 1.0684, test_f1: 0.6006
 epoch: 49, train_loss: 0.4321, test_loss: 1.0011, test_f1: 0.6350
 epoch: 50, train_loss: 0.4236, test_loss: 1.1327, test_f1: 0.6440
 epoch: 51, train_loss: 0.3869, test_loss: 1.0494, test_f1: 0.6372
 epoch: 52, train_loss: 0.3775, test_loss: 1.0403, test_f1: 0.6464
 epoch: 53, train_loss: 0.3665, test_loss: 1.0866, test_f1: 0.6509
 epoch: 54, train_loss: 0.3433, test_loss: 1.0918, test_f1: 0.6226
 epoch: 55, train_loss: 0.3438, test_loss: 1.1150, test_f1: 0.6647
 epoch: 56, train_loss: 0.3496, test_loss: 1.0454, test_f1: 0.6271
 epoch: 57, train_loss: 0.3421, test_loss: 1.1550, test_f1: 0.6157
 epoch: 58, train_loss: 0.3342, test_loss: 1.2546, test_f1: 0.6260
 epoch: 59, train_loss: 0.3364, test_loss: 1.1987, test_f1: 0.6440
 epoch: 60, train_loss: 0.3457, test_loss: 1.1780, test_f1: 0.6417
 epoch: 61, train_loss: 0.3312, test_loss: 1.2271, test_f1: 0.6367
 epoch: 62, train_loss: 0.3303, test_loss: 1.2145, test_f1: 0.6655
 epoch: 63, train_loss: 0.3154, test_loss: 1.2066, test_f1: 0.6350
 epoch: 64, train_loss: 0.3228, test_loss: 1.2151, test_f1: 0.6299
 epoch: 65, train_loss: 0.3165, test_loss: 1.2901, test_f1: 0.6411
 epoch: 66, train_loss: 0.3102, test_loss: 1.1922, test_f1: 0.6354
 epoch: 67, train_loss: 0.2946, test_loss: 1.2207, test_f1: 0.6325
 epoch: 68, train_loss: 0.2882, test_loss: 1.2330, test_f1: 0.6472
 epoch: 69, train_loss: 0.2894, test_loss: 1.3585, test_f1: 0.6559
 epoch: 70, train_loss: 0.2876, test_loss: 1.3819, test_f1: 0.6268
 epoch: 71, train_loss: 0.2826, test_loss: 1.3870, test_f1: 0.6559
 epoch: 72, train_loss: 0.3203, test_loss: 1.4840, test_f1: 0.6236
 epoch: 73, train_loss: 0.2894, test_loss: 1.4152, test_f1: 0.6438
 epoch: 74, train_loss: 0.3035, test_loss: 1.4073, test_f1: 0.6186
 epoch: 75, train_loss: 0.2762, test_loss: 1.3921, test_f1: 0.6316
 epoch: 76, train_loss: 0.2804, test_loss: 1.4288, test_f1: 0.6210
 epoch: 77, train_loss: 0.2768, test_loss: 1.3548, test_f1: 0.6444
 epoch: 78, train_loss: 0.2743, test_loss: 1.4965, test_f1: 0.6381
 epoch: 79, train_loss: 0.2501, test_loss: 1.4941, test_f1: 0.6491
 epoch: 80, train_loss: 0.2619, test_loss: 1.3607, test_f1: 0.6464
 epoch: 81, train_loss: 0.2751, test_loss: 1.3992, test_f1: 0.6466
 epoch: 82, train_loss: 0.2566, test_loss: 1.5275, test_f1: 0.6150
 epoch: 83, train_loss: 0.2471, test_loss: 1.4348, test_f1: 0.6436
 epoch: 84, train_loss: 0.2577, test_loss: 1.4131, test_f1: 0.6681
 epoch: 85, train_loss: 0.2422, test_loss: 1.5839, test_f1: 0.6134
 epoch: 86, train_loss: 0.2403, test_loss: 1.4661, test_f1: 0.6544
 epoch: 87, train_loss: 0.2363, test_loss: 1.5185, test_f1: 0.6370
 epoch: 88, train_loss: 0.2311, test_loss: 1.5902, test_f1: 0.6381
 epoch: 89, train_loss: 0.2283, test_loss: 1.6453, test_f1: 0.6357
 epoch: 90, train_loss: 0.2362, test_loss: 1.5937, test_f1: 0.6293
 epoch: 91, train_loss: 0.2364, test_loss: 1.5983, test_f1: 0.6419
 epoch: 92, train_loss: 0.2197, test_loss: 1.6716, test_f1: 0.6375
 epoch: 93, train_loss: 0.2139, test_loss: 1.5588, test_f1: 0.6313
 epoch: 94, train_loss: 0.2054, test_loss: 1.6405, test_f1: 0.6255
 epoch: 95, train_loss: 0.2292, test_loss: 1.7551, test_f1: 0.6460
 epoch: 96, train_loss: 0.2316, test_loss: 1.5491, test_f1: 0.6511
 epoch: 97, train_loss: 0.2166, test_loss: 1.7531, test_f1: 0.6133
 epoch: 98, train_loss: 0.2121, test_loss: 1.6888, test_f1: 0.6345
 epoch: 99, train_loss: 0.1991, test_loss: 1.7229, test_f1: 0.6378
##################ITERATION #2 ****************************************
 epoch: 0, train_loss: 1.2015, test_loss: 1.2903, test_f1: 0.2260
 epoch: 1, train_loss: 1.0420, test_loss: 1.2943, test_f1: 0.2286
 epoch: 2, train_loss: 0.9857, test_loss: 1.1524, test_f1: 0.3202
 epoch: 3, train_loss: 0.9538, test_loss: 1.0224, test_f1: 0.4287
 epoch: 4, train_loss: 0.9251, test_loss: 0.9930, test_f1: 0.4862
 epoch: 5, train_loss: 0.8971, test_loss: 1.0095, test_f1: 0.4764
 epoch: 6, train_loss: 0.8754, test_loss: 0.9699, test_f1: 0.5123
 epoch: 7, train_loss: 0.8495, test_loss: 0.9638, test_f1: 0.5370
 epoch: 8, train_loss: 0.8454, test_loss: 1.1169, test_f1: 0.5196
 epoch: 9, train_loss: 0.8280, test_loss: 0.9017, test_f1: 0.5343
 epoch: 10, train_loss: 0.8032, test_loss: 0.8937, test_f1: 0.5710
 epoch: 11, train_loss: 0.7785, test_loss: 0.9018, test_f1: 0.5173
 epoch: 12, train_loss: 0.7773, test_loss: 0.9011, test_f1: 0.5629
 epoch: 13, train_loss: 0.7714, test_loss: 1.0724, test_f1: 0.5182
 epoch: 14, train_loss: 0.7410, test_loss: 0.8883, test_f1: 0.5671
 epoch: 15, train_loss: 0.7475, test_loss: 0.8913, test_f1: 0.5691
 epoch: 16, train_loss: 0.7322, test_loss: 1.3393, test_f1: 0.4941
 epoch: 17, train_loss: 0.7299, test_loss: 0.9365, test_f1: 0.5657
 epoch: 18, train_loss: 0.6947, test_loss: 0.8772, test_f1: 0.5910
 epoch: 19, train_loss: 0.7088, test_loss: 0.9917, test_f1: 0.5413
 epoch: 20, train_loss: 0.7003, test_loss: 0.8956, test_f1: 0.5830
 epoch: 21, train_loss: 0.6815, test_loss: 0.9019, test_f1: 0.5736
 epoch: 22, train_loss: 0.6681, test_loss: 0.9429, test_f1: 0.5833
 epoch: 23, train_loss: 0.6663, test_loss: 0.9567, test_f1: 0.5983
 epoch: 24, train_loss: 0.6519, test_loss: 0.9555, test_f1: 0.5781
 epoch: 25, train_loss: 0.6374, test_loss: 0.9839, test_f1: 0.5624
 epoch: 26, train_loss: 0.6339, test_loss: 0.9357, test_f1: 0.5911
 epoch: 27, train_loss: 0.6225, test_loss: 0.9224, test_f1: 0.6021
 epoch: 28, train_loss: 0.6132, test_loss: 0.9542, test_f1: 0.5790
 epoch: 29, train_loss: 0.6079, test_loss: 0.9954, test_f1: 0.6003
 epoch: 30, train_loss: 0.5941, test_loss: 0.9197, test_f1: 0.6075
 epoch: 31, train_loss: 0.5923, test_loss: 0.9105, test_f1: 0.5951
 epoch: 32, train_loss: 0.5905, test_loss: 1.0271, test_f1: 0.6046
 epoch: 33, train_loss: 0.5980, test_loss: 0.9088, test_f1: 0.6112
 epoch: 34, train_loss: 0.5699, test_loss: 0.9780, test_f1: 0.6187
 epoch: 35, train_loss: 0.5560, test_loss: 1.0353, test_f1: 0.5839
 epoch: 36, train_loss: 0.5489, test_loss: 1.0322, test_f1: 0.5890
 epoch: 37, train_loss: 0.5601, test_loss: 1.0540, test_f1: 0.5903
 epoch: 38, train_loss: 0.5805, test_loss: 0.9774, test_f1: 0.5795
 epoch: 39, train_loss: 0.5502, test_loss: 1.0124, test_f1: 0.5858
 epoch: 40, train_loss: 0.5363, test_loss: 1.2269, test_f1: 0.5173
 epoch: 41, train_loss: 0.5516, test_loss: 0.9648, test_f1: 0.5929
 epoch: 42, train_loss: 0.5268, test_loss: 1.0351, test_f1: 0.5882
 epoch: 43, train_loss: 0.5094, test_loss: 1.0138, test_f1: 0.6180
 epoch: 44, train_loss: 0.5235, test_loss: 1.1229, test_f1: 0.5994
 epoch: 45, train_loss: 0.5115, test_loss: 1.0278, test_f1: 0.6244
 epoch: 46, train_loss: 0.4921, test_loss: 1.0747, test_f1: 0.6219
 epoch: 47, train_loss: 0.4711, test_loss: 1.0815, test_f1: 0.6155
 epoch: 48, train_loss: 0.4678, test_loss: 1.1420, test_f1: 0.5913
 epoch: 49, train_loss: 0.4720, test_loss: 1.0742, test_f1: 0.5990
 epoch: 50, train_loss: 0.4611, test_loss: 1.0114, test_f1: 0.6198
 epoch: 51, train_loss: 0.4349, test_loss: 1.0770, test_f1: 0.6187
 epoch: 52, train_loss: 0.4004, test_loss: 1.1063, test_f1: 0.6331
 epoch: 53, train_loss: 0.3963, test_loss: 1.0910, test_f1: 0.6621
 epoch: 54, train_loss: 0.3935, test_loss: 1.1444, test_f1: 0.6298
 epoch: 55, train_loss: 0.3825, test_loss: 1.0901, test_f1: 0.6374
 epoch: 56, train_loss: 0.3758, test_loss: 1.1282, test_f1: 0.6298
 epoch: 57, train_loss: 0.3792, test_loss: 1.1154, test_f1: 0.6275
 epoch: 58, train_loss: 0.3796, test_loss: 1.0805, test_f1: 0.6435
 epoch: 59, train_loss: 0.3715, test_loss: 1.2003, test_f1: 0.6248
 epoch: 60, train_loss: 0.3792, test_loss: 1.2317, test_f1: 0.6137
 epoch: 61, train_loss: 0.3552, test_loss: 1.1748, test_f1: 0.6381
 epoch: 62, train_loss: 0.3563, test_loss: 1.3244, test_f1: 0.6077
 epoch: 63, train_loss: 0.3576, test_loss: 1.1884, test_f1: 0.6181
 epoch: 64, train_loss: 0.3287, test_loss: 1.2399, test_f1: 0.6246
 epoch: 65, train_loss: 0.3458, test_loss: 1.2789, test_f1: 0.6242
 epoch: 66, train_loss: 0.3317, test_loss: 1.2562, test_f1: 0.6355
 epoch: 67, train_loss: 0.3410, test_loss: 1.2477, test_f1: 0.6390
 epoch: 68, train_loss: 0.3334, test_loss: 1.2237, test_f1: 0.6536
 epoch: 69, train_loss: 0.3213, test_loss: 1.3780, test_f1: 0.6520
 epoch: 70, train_loss: 0.3270, test_loss: 1.3434, test_f1: 0.6130
 epoch: 71, train_loss: 0.3146, test_loss: 1.1797, test_f1: 0.6406
 epoch: 72, train_loss: 0.3278, test_loss: 1.2944, test_f1: 0.6586
 epoch: 73, train_loss: 0.3191, test_loss: 1.2522, test_f1: 0.6214
 epoch: 74, train_loss: 0.3132, test_loss: 1.3658, test_f1: 0.6315
 epoch: 75, train_loss: 0.3205, test_loss: 1.3052, test_f1: 0.6252
 epoch: 76, train_loss: 0.3135, test_loss: 1.4361, test_f1: 0.6277
 epoch: 77, train_loss: 0.2988, test_loss: 1.2624, test_f1: 0.6585
 epoch: 78, train_loss: 0.3058, test_loss: 1.3302, test_f1: 0.6425
 epoch: 79, train_loss: 0.3064, test_loss: 1.2612, test_f1: 0.6275
 epoch: 80, train_loss: 0.2711, test_loss: 1.4516, test_f1: 0.6411
 epoch: 81, train_loss: 0.2781, test_loss: 1.4051, test_f1: 0.6211
 epoch: 82, train_loss: 0.2899, test_loss: 1.3106, test_f1: 0.6424
 epoch: 83, train_loss: 0.2883, test_loss: 1.3453, test_f1: 0.6604
 epoch: 84, train_loss: 0.2790, test_loss: 1.4827, test_f1: 0.6301
 epoch: 85, train_loss: 0.2685, test_loss: 1.4581, test_f1: 0.6177
 epoch: 86, train_loss: 0.2628, test_loss: 1.3296, test_f1: 0.6435
 epoch: 87, train_loss: 0.2747, test_loss: 1.4243, test_f1: 0.6456
 epoch: 88, train_loss: 0.2695, test_loss: 1.3875, test_f1: 0.6601
 epoch: 89, train_loss: 0.2630, test_loss: 1.4916, test_f1: 0.6038
 epoch: 90, train_loss: 0.2650, test_loss: 1.3683, test_f1: 0.6555
 epoch: 91, train_loss: 0.2540, test_loss: 1.4241, test_f1: 0.6403
 epoch: 92, train_loss: 0.2499, test_loss: 1.4267, test_f1: 0.6145
 epoch: 93, train_loss: 0.2542, test_loss: 1.3924, test_f1: 0.6612
 epoch: 94, train_loss: 0.2455, test_loss: 1.5290, test_f1: 0.6264
 epoch: 95, train_loss: 0.2583, test_loss: 1.4861, test_f1: 0.6358
 epoch: 96, train_loss: 0.2445, test_loss: 1.4652, test_f1: 0.6402
 epoch: 97, train_loss: 0.2430, test_loss: 1.4517, test_f1: 0.6614
 epoch: 98, train_loss: 0.2390, test_loss: 1.6515, test_f1: 0.6110
 epoch: 99, train_loss: 0.2437, test_loss: 1.3880, test_f1: 0.6306
##################ITERATION #3 ****************************************
 epoch: 0, train_loss: 1.2242, test_loss: 1.3008, test_f1: 0.2260
 epoch: 1, train_loss: 1.0377, test_loss: 1.2552, test_f1: 0.2876
 epoch: 2, train_loss: 0.9816, test_loss: 1.1728, test_f1: 0.3737
 epoch: 3, train_loss: 0.9309, test_loss: 1.0915, test_f1: 0.4052
 epoch: 4, train_loss: 0.9142, test_loss: 1.0255, test_f1: 0.4445
 epoch: 5, train_loss: 0.8874, test_loss: 0.9672, test_f1: 0.5046
 epoch: 6, train_loss: 0.8655, test_loss: 1.0286, test_f1: 0.4746
 epoch: 7, train_loss: 0.8340, test_loss: 0.9795, test_f1: 0.4954
 epoch: 8, train_loss: 0.8244, test_loss: 0.9236, test_f1: 0.5572
 epoch: 9, train_loss: 0.8064, test_loss: 1.0849, test_f1: 0.5183
 epoch: 10, train_loss: 0.7819, test_loss: 0.8757, test_f1: 0.5414
 epoch: 11, train_loss: 0.7783, test_loss: 0.9012, test_f1: 0.5503
 epoch: 12, train_loss: 0.7578, test_loss: 0.9464, test_f1: 0.5202
 epoch: 13, train_loss: 0.7467, test_loss: 0.9201, test_f1: 0.5302
 epoch: 14, train_loss: 0.7207, test_loss: 0.9741, test_f1: 0.5292
 epoch: 15, train_loss: 0.7121, test_loss: 0.9936, test_f1: 0.5297
 epoch: 16, train_loss: 0.6917, test_loss: 0.9206, test_f1: 0.5769
 epoch: 17, train_loss: 0.6947, test_loss: 1.1452, test_f1: 0.5099
 epoch: 18, train_loss: 0.6989, test_loss: 0.9062, test_f1: 0.5876
 epoch: 19, train_loss: 0.6744, test_loss: 0.8573, test_f1: 0.5753
 epoch: 20, train_loss: 0.6640, test_loss: 1.0882, test_f1: 0.5507
 epoch: 21, train_loss: 0.6573, test_loss: 0.9437, test_f1: 0.5549
 epoch: 22, train_loss: 0.6495, test_loss: 0.9655, test_f1: 0.5687
 epoch: 23, train_loss: 0.6376, test_loss: 0.9422, test_f1: 0.5710
 epoch: 24, train_loss: 0.6286, test_loss: 0.9286, test_f1: 0.5823
 epoch: 25, train_loss: 0.6184, test_loss: 0.9197, test_f1: 0.6099
 epoch: 26, train_loss: 0.6078, test_loss: 0.9307, test_f1: 0.5823
 epoch: 27, train_loss: 0.6172, test_loss: 1.0392, test_f1: 0.5586
 epoch: 28, train_loss: 0.6102, test_loss: 0.9329, test_f1: 0.5796
 epoch: 29, train_loss: 0.5852, test_loss: 1.1148, test_f1: 0.5217
 epoch: 30, train_loss: 0.5917, test_loss: 0.9890, test_f1: 0.5642
 epoch: 31, train_loss: 0.5867, test_loss: 0.9406, test_f1: 0.6036
 epoch: 32, train_loss: 0.5806, test_loss: 1.0155, test_f1: 0.5784
 epoch: 33, train_loss: 0.5656, test_loss: 1.0361, test_f1: 0.5875
 epoch: 34, train_loss: 0.5502, test_loss: 0.9684, test_f1: 0.6060
 epoch: 35, train_loss: 0.5394, test_loss: 0.9319, test_f1: 0.6143
 epoch: 36, train_loss: 0.5344, test_loss: 0.9063, test_f1: 0.6148
 epoch: 37, train_loss: 0.5225, test_loss: 1.0288, test_f1: 0.5839
 epoch: 38, train_loss: 0.5228, test_loss: 0.9052, test_f1: 0.6095
 epoch: 39, train_loss: 0.5220, test_loss: 1.0212, test_f1: 0.5825
 epoch: 40, train_loss: 0.5169, test_loss: 0.9202, test_f1: 0.6353
 epoch: 41, train_loss: 0.5194, test_loss: 1.0981, test_f1: 0.5717
 epoch: 42, train_loss: 0.5032, test_loss: 1.0288, test_f1: 0.6036
 epoch: 43, train_loss: 0.4876, test_loss: 1.0745, test_f1: 0.6074
 epoch: 44, train_loss: 0.4762, test_loss: 1.0137, test_f1: 0.6228
 epoch: 45, train_loss: 0.4682, test_loss: 1.2295, test_f1: 0.5878
 epoch: 46, train_loss: 0.4578, test_loss: 0.9816, test_f1: 0.6116
 epoch: 47, train_loss: 0.4594, test_loss: 1.0200, test_f1: 0.6082
 epoch: 48, train_loss: 0.4576, test_loss: 0.9782, test_f1: 0.6173
 epoch: 49, train_loss: 0.4788, test_loss: 1.2429, test_f1: 0.5779
 epoch: 50, train_loss: 0.4771, test_loss: 0.9542, test_f1: 0.6582
 epoch: 51, train_loss: 0.4617, test_loss: 1.0428, test_f1: 0.5981
 epoch: 52, train_loss: 0.4259, test_loss: 0.9851, test_f1: 0.6259
 epoch: 53, train_loss: 0.3992, test_loss: 1.1295, test_f1: 0.5864
 epoch: 54, train_loss: 0.3994, test_loss: 1.0392, test_f1: 0.6168
 epoch: 55, train_loss: 0.3681, test_loss: 1.1300, test_f1: 0.6177
 epoch: 56, train_loss: 0.3640, test_loss: 1.0372, test_f1: 0.6377
 epoch: 57, train_loss: 0.3591, test_loss: 1.2132, test_f1: 0.5961
 epoch: 58, train_loss: 0.3543, test_loss: 1.1325, test_f1: 0.6144
 epoch: 59, train_loss: 0.3648, test_loss: 1.1267, test_f1: 0.6112
 epoch: 60, train_loss: 0.3531, test_loss: 1.1600, test_f1: 0.6099
 epoch: 61, train_loss: 0.3384, test_loss: 1.2379, test_f1: 0.6124
 epoch: 62, train_loss: 0.3383, test_loss: 1.2165, test_f1: 0.6133
 epoch: 63, train_loss: 0.3259, test_loss: 1.3497, test_f1: 0.6069
 epoch: 64, train_loss: 0.3294, test_loss: 1.1471, test_f1: 0.6152
 epoch: 65, train_loss: 0.3323, test_loss: 1.2488, test_f1: 0.6187
 epoch: 66, train_loss: 0.3166, test_loss: 1.1694, test_f1: 0.6197
 epoch: 67, train_loss: 0.3033, test_loss: 1.2988, test_f1: 0.6151
 epoch: 68, train_loss: 0.3049, test_loss: 1.2379, test_f1: 0.6287
 epoch: 69, train_loss: 0.2978, test_loss: 1.2132, test_f1: 0.6140
 epoch: 70, train_loss: 0.2938, test_loss: 1.2492, test_f1: 0.6152
 epoch: 71, train_loss: 0.3079, test_loss: 1.3472, test_f1: 0.6208
 epoch: 72, train_loss: 0.2948, test_loss: 1.3114, test_f1: 0.6052
 epoch: 73, train_loss: 0.2781, test_loss: 1.3107, test_f1: 0.6337
 epoch: 74, train_loss: 0.2820, test_loss: 1.4012, test_f1: 0.6148
 epoch: 75, train_loss: 0.2749, test_loss: 1.3987, test_f1: 0.6229
 epoch: 76, train_loss: 0.2722, test_loss: 1.3766, test_f1: 0.6208
 epoch: 77, train_loss: 0.2732, test_loss: 1.3037, test_f1: 0.6352
 epoch: 78, train_loss: 0.2856, test_loss: 1.4000, test_f1: 0.6121
 epoch: 79, train_loss: 0.2860, test_loss: 1.4613, test_f1: 0.6102
 epoch: 80, train_loss: 0.2710, test_loss: 1.5999, test_f1: 0.6052
 epoch: 81, train_loss: 0.2880, test_loss: 1.3797, test_f1: 0.6186
 epoch: 82, train_loss: 0.2626, test_loss: 1.3033, test_f1: 0.6377
 epoch: 83, train_loss: 0.2648, test_loss: 1.3562, test_f1: 0.6331
 epoch: 84, train_loss: 0.2901, test_loss: 1.3463, test_f1: 0.6283
 epoch: 85, train_loss: 0.2752, test_loss: 1.4121, test_f1: 0.6293
 epoch: 86, train_loss: 0.2547, test_loss: 1.2888, test_f1: 0.6322
 epoch: 87, train_loss: 0.2587, test_loss: 1.5067, test_f1: 0.6230
 epoch: 88, train_loss: 0.2464, test_loss: 1.5294, test_f1: 0.6482
 epoch: 89, train_loss: 0.2470, test_loss: 1.3745, test_f1: 0.6270
 epoch: 90, train_loss: 0.2478, test_loss: 1.4641, test_f1: 0.6418
 epoch: 91, train_loss: 0.2674, test_loss: 1.5260, test_f1: 0.6165
 epoch: 92, train_loss: 0.2590, test_loss: 1.5122, test_f1: 0.6250
 epoch: 93, train_loss: 0.2261, test_loss: 1.3882, test_f1: 0.6470
 epoch: 94, train_loss: 0.2312, test_loss: 1.4148, test_f1: 0.6227
 epoch: 95, train_loss: 0.2158, test_loss: 1.6386, test_f1: 0.6261
 epoch: 96, train_loss: 0.2212, test_loss: 1.6725, test_f1: 0.6184
 epoch: 97, train_loss: 0.2211, test_loss: 1.4210, test_f1: 0.6304
 epoch: 98, train_loss: 0.2091, test_loss: 1.5710, test_f1: 0.6332
 epoch: 99, train_loss: 0.2064, test_loss: 1.5488, test_f1: 0.6532
##################ITERATION #4 ****************************************
 epoch: 0, train_loss: 1.2489, test_loss: 1.2715, test_f1: 0.2633
 epoch: 1, train_loss: 1.0890, test_loss: 1.1951, test_f1: 0.2604
 epoch: 2, train_loss: 1.0263, test_loss: 1.1298, test_f1: 0.3969
 epoch: 3, train_loss: 0.9859, test_loss: 1.0556, test_f1: 0.4433
 epoch: 4, train_loss: 0.9652, test_loss: 1.0206, test_f1: 0.4792
 epoch: 5, train_loss: 0.9436, test_loss: 0.9783, test_f1: 0.5131
 epoch: 6, train_loss: 0.9198, test_loss: 0.9686, test_f1: 0.5246
 epoch: 7, train_loss: 0.8891, test_loss: 0.9630, test_f1: 0.5362
 epoch: 8, train_loss: 0.8800, test_loss: 0.9269, test_f1: 0.5490
 epoch: 9, train_loss: 0.8681, test_loss: 0.9471, test_f1: 0.5218
 epoch: 10, train_loss: 0.8501, test_loss: 0.9357, test_f1: 0.5590
 epoch: 11, train_loss: 0.8444, test_loss: 0.9034, test_f1: 0.5581
 epoch: 12, train_loss: 0.8284, test_loss: 0.9057, test_f1: 0.5798
 epoch: 13, train_loss: 0.8024, test_loss: 0.9098, test_f1: 0.5668
 epoch: 14, train_loss: 0.7857, test_loss: 0.9302, test_f1: 0.5595
 epoch: 15, train_loss: 0.7817, test_loss: 0.9164, test_f1: 0.5666
 epoch: 16, train_loss: 0.7629, test_loss: 0.9434, test_f1: 0.5795
 epoch: 17, train_loss: 0.7597, test_loss: 0.9332, test_f1: 0.5867
 epoch: 18, train_loss: 0.7374, test_loss: 0.9344, test_f1: 0.5879
 epoch: 19, train_loss: 0.7138, test_loss: 0.9452, test_f1: 0.5895
 epoch: 20, train_loss: 0.7243, test_loss: 0.9692, test_f1: 0.5588
 epoch: 21, train_loss: 0.7177, test_loss: 1.0475, test_f1: 0.5492
 epoch: 22, train_loss: 0.6881, test_loss: 0.9665, test_f1: 0.5702
 epoch: 23, train_loss: 0.6907, test_loss: 1.0192, test_f1: 0.5772
 epoch: 24, train_loss: 0.7096, test_loss: 0.8925, test_f1: 0.6049
 epoch: 25, train_loss: 0.6745, test_loss: 0.9325, test_f1: 0.5822
 epoch: 26, train_loss: 0.6565, test_loss: 1.0841, test_f1: 0.5283
 epoch: 27, train_loss: 0.6567, test_loss: 0.8652, test_f1: 0.6281
 epoch: 28, train_loss: 0.6537, test_loss: 0.8701, test_f1: 0.6437
 epoch: 29, train_loss: 0.6570, test_loss: 0.8573, test_f1: 0.6211
 epoch: 30, train_loss: 0.6139, test_loss: 0.8927, test_f1: 0.6208
 epoch: 31, train_loss: 0.6197, test_loss: 0.9250, test_f1: 0.6079
 epoch: 32, train_loss: 0.6098, test_loss: 0.8973, test_f1: 0.6236
 epoch: 33, train_loss: 0.6153, test_loss: 0.9454, test_f1: 0.6104
 epoch: 34, train_loss: 0.6111, test_loss: 0.9247, test_f1: 0.6021
 epoch: 35, train_loss: 0.5967, test_loss: 0.9462, test_f1: 0.6169
 epoch: 36, train_loss: 0.5866, test_loss: 0.9223, test_f1: 0.6106
 epoch: 37, train_loss: 0.5753, test_loss: 0.9924, test_f1: 0.6037
 epoch: 38, train_loss: 0.5684, test_loss: 0.8650, test_f1: 0.6398
 epoch: 39, train_loss: 0.5720, test_loss: 0.9632, test_f1: 0.6067
 epoch: 40, train_loss: 0.5595, test_loss: 0.9133, test_f1: 0.6546
 epoch: 41, train_loss: 0.5414, test_loss: 0.9484, test_f1: 0.6275
 epoch: 42, train_loss: 0.5339, test_loss: 0.8276, test_f1: 0.6524
 epoch: 43, train_loss: 0.5383, test_loss: 0.8388, test_f1: 0.6516
 epoch: 44, train_loss: 0.5272, test_loss: 0.9289, test_f1: 0.6554
 epoch: 45, train_loss: 0.5246, test_loss: 0.9523, test_f1: 0.6067
 epoch: 46, train_loss: 0.4982, test_loss: 0.8618, test_f1: 0.6586
 epoch: 47, train_loss: 0.4975, test_loss: 0.9475, test_f1: 0.6291
 epoch: 48, train_loss: 0.5007, test_loss: 0.9783, test_f1: 0.6514
 epoch: 49, train_loss: 0.4956, test_loss: 0.9221, test_f1: 0.6430
 epoch: 50, train_loss: 0.4965, test_loss: 0.8820, test_f1: 0.6331
 epoch: 51, train_loss: 0.4762, test_loss: 0.9275, test_f1: 0.6458
 epoch: 52, train_loss: 0.4521, test_loss: 0.9018, test_f1: 0.6512
 epoch: 53, train_loss: 0.4332, test_loss: 0.9333, test_f1: 0.6260
 epoch: 54, train_loss: 0.4244, test_loss: 1.0129, test_f1: 0.6345
 epoch: 55, train_loss: 0.4080, test_loss: 0.9082, test_f1: 0.6398
 epoch: 56, train_loss: 0.4097, test_loss: 0.9613, test_f1: 0.6498
 epoch: 57, train_loss: 0.3997, test_loss: 0.9971, test_f1: 0.6374
 epoch: 58, train_loss: 0.3996, test_loss: 0.9723, test_f1: 0.6372
 epoch: 59, train_loss: 0.3854, test_loss: 0.9290, test_f1: 0.6625
 epoch: 60, train_loss: 0.3877, test_loss: 0.9774, test_f1: 0.6567
 epoch: 61, train_loss: 0.3861, test_loss: 0.9858, test_f1: 0.6276
 epoch: 62, train_loss: 0.3811, test_loss: 1.0496, test_f1: 0.6248
 epoch: 63, train_loss: 0.3789, test_loss: 1.0108, test_f1: 0.6485
 epoch: 64, train_loss: 0.3681, test_loss: 1.1025, test_f1: 0.6369
 epoch: 65, train_loss: 0.3831, test_loss: 1.0186, test_f1: 0.6384
 epoch: 66, train_loss: 0.3695, test_loss: 1.0598, test_f1: 0.6633
 epoch: 67, train_loss: 0.3633, test_loss: 1.0160, test_f1: 0.6227
 epoch: 68, train_loss: 0.3550, test_loss: 1.1322, test_f1: 0.6169
 epoch: 69, train_loss: 0.3667, test_loss: 1.1028, test_f1: 0.6217
 epoch: 70, train_loss: 0.3789, test_loss: 1.0342, test_f1: 0.6407
 epoch: 71, train_loss: 0.3598, test_loss: 0.9696, test_f1: 0.6515
 epoch: 72, train_loss: 0.3472, test_loss: 0.9814, test_f1: 0.6229
 epoch: 73, train_loss: 0.3444, test_loss: 1.0593, test_f1: 0.6378
 epoch: 74, train_loss: 0.3621, test_loss: 0.9867, test_f1: 0.6633
 epoch: 75, train_loss: 0.3273, test_loss: 1.0923, test_f1: 0.6711
 epoch: 76, train_loss: 0.3293, test_loss: 1.1183, test_f1: 0.6405
 epoch: 77, train_loss: 0.3387, test_loss: 1.1229, test_f1: 0.6398
 epoch: 78, train_loss: 0.3296, test_loss: 1.0733, test_f1: 0.6601
 epoch: 79, train_loss: 0.3221, test_loss: 1.0747, test_f1: 0.6422
 epoch: 80, train_loss: 0.3336, test_loss: 1.1754, test_f1: 0.6151
 epoch: 81, train_loss: 0.3268, test_loss: 1.1704, test_f1: 0.6325
 epoch: 82, train_loss: 0.3182, test_loss: 1.1419, test_f1: 0.6509
 epoch: 83, train_loss: 0.3355, test_loss: 1.1809, test_f1: 0.6403
 epoch: 84, train_loss: 0.3226, test_loss: 1.1544, test_f1: 0.6211
 epoch: 85, train_loss: 0.3030, test_loss: 1.2415, test_f1: 0.6178
 epoch: 86, train_loss: 0.2870, test_loss: 1.1444, test_f1: 0.6268
 epoch: 87, train_loss: 0.2900, test_loss: 1.1844, test_f1: 0.6446
 epoch: 88, train_loss: 0.2985, test_loss: 1.2787, test_f1: 0.6202
 epoch: 89, train_loss: 0.2929, test_loss: 1.2422, test_f1: 0.6277
 epoch: 90, train_loss: 0.3060, test_loss: 1.0853, test_f1: 0.6336
 epoch: 91, train_loss: 0.2779, test_loss: 1.2068, test_f1: 0.6575
 epoch: 92, train_loss: 0.2996, test_loss: 1.2862, test_f1: 0.6069
 epoch: 93, train_loss: 0.2909, test_loss: 1.1961, test_f1: 0.6172
 epoch: 94, train_loss: 0.3020, test_loss: 1.2949, test_f1: 0.6442
 epoch: 95, train_loss: 0.2977, test_loss: 1.2007, test_f1: 0.6426
 epoch: 96, train_loss: 0.2877, test_loss: 1.3465, test_f1: 0.6283
 epoch: 97, train_loss: 0.2718, test_loss: 1.2184, test_f1: 0.6327
 epoch: 98, train_loss: 0.2766, test_loss: 1.2550, test_f1: 0.6148
 epoch: 99, train_loss: 0.2760, test_loss: 1.3504, test_f1: 0.6281
##################ITERATION #5 ****************************************
 epoch: 0, train_loss: 1.2692, test_loss: 1.3087, test_f1: 0.2262
 epoch: 1, train_loss: 1.0674, test_loss: 1.2685, test_f1: 0.2260
 epoch: 2, train_loss: 1.0183, test_loss: 1.2366, test_f1: 0.2774
 epoch: 3, train_loss: 0.9731, test_loss: 1.0522, test_f1: 0.4140
 epoch: 4, train_loss: 0.9454, test_loss: 0.9893, test_f1: 0.4683
 epoch: 5, train_loss: 0.9243, test_loss: 0.9463, test_f1: 0.5071
 epoch: 6, train_loss: 0.9017, test_loss: 0.9256, test_f1: 0.5184
 epoch: 7, train_loss: 0.8732, test_loss: 0.9514, test_f1: 0.5321
 epoch: 8, train_loss: 0.8518, test_loss: 0.8963, test_f1: 0.5828
 epoch: 9, train_loss: 0.8387, test_loss: 0.9289, test_f1: 0.5430
 epoch: 10, train_loss: 0.8350, test_loss: 0.9427, test_f1: 0.5475
 epoch: 11, train_loss: 0.8146, test_loss: 0.9051, test_f1: 0.5517
 epoch: 12, train_loss: 0.8106, test_loss: 0.9299, test_f1: 0.5649
 epoch: 13, train_loss: 0.8098, test_loss: 0.9131, test_f1: 0.5952
 epoch: 14, train_loss: 0.7743, test_loss: 0.8934, test_f1: 0.5798
 epoch: 15, train_loss: 0.7645, test_loss: 0.9017, test_f1: 0.5729
 epoch: 16, train_loss: 0.7558, test_loss: 0.9059, test_f1: 0.5512
 epoch: 17, train_loss: 0.7511, test_loss: 0.9231, test_f1: 0.5313
 epoch: 18, train_loss: 0.7261, test_loss: 0.8642, test_f1: 0.5623
 epoch: 19, train_loss: 0.7469, test_loss: 0.9324, test_f1: 0.5501
 epoch: 20, train_loss: 0.7216, test_loss: 0.8823, test_f1: 0.5795
 epoch: 21, train_loss: 0.7216, test_loss: 0.9245, test_f1: 0.5782
 epoch: 22, train_loss: 0.6993, test_loss: 0.8591, test_f1: 0.5876
 epoch: 23, train_loss: 0.6830, test_loss: 0.8181, test_f1: 0.6154
 epoch: 24, train_loss: 0.6688, test_loss: 0.8378, test_f1: 0.6258
 epoch: 25, train_loss: 0.6654, test_loss: 0.8518, test_f1: 0.5966
 epoch: 26, train_loss: 0.6776, test_loss: 0.8772, test_f1: 0.6020
 epoch: 27, train_loss: 0.6739, test_loss: 0.8161, test_f1: 0.6072
 epoch: 28, train_loss: 0.6543, test_loss: 0.8239, test_f1: 0.6404
 epoch: 29, train_loss: 0.6411, test_loss: 0.8827, test_f1: 0.5998
 epoch: 30, train_loss: 0.6263, test_loss: 0.9640, test_f1: 0.5891
 epoch: 31, train_loss: 0.6204, test_loss: 0.8576, test_f1: 0.6154
 epoch: 32, train_loss: 0.6295, test_loss: 0.8903, test_f1: 0.6072
 epoch: 33, train_loss: 0.6306, test_loss: 1.0774, test_f1: 0.5372
 epoch: 34, train_loss: 0.6201, test_loss: 0.8910, test_f1: 0.6037
 epoch: 35, train_loss: 0.6062, test_loss: 0.8559, test_f1: 0.6202
 epoch: 36, train_loss: 0.6029, test_loss: 0.8408, test_f1: 0.6306
 epoch: 37, train_loss: 0.5930, test_loss: 0.8378, test_f1: 0.6213
 epoch: 38, train_loss: 0.5872, test_loss: 1.0219, test_f1: 0.5682
 epoch: 39, train_loss: 0.5769, test_loss: 0.8146, test_f1: 0.6369
 epoch: 40, train_loss: 0.5707, test_loss: 0.8488, test_f1: 0.6464
 epoch: 41, train_loss: 0.5674, test_loss: 0.8422, test_f1: 0.6495
 epoch: 42, train_loss: 0.5383, test_loss: 0.9136, test_f1: 0.6346
 epoch: 43, train_loss: 0.5249, test_loss: 0.8526, test_f1: 0.6420
 epoch: 44, train_loss: 0.5302, test_loss: 0.8007, test_f1: 0.6582
 epoch: 45, train_loss: 0.5269, test_loss: 0.8650, test_f1: 0.6396
 epoch: 46, train_loss: 0.5056, test_loss: 0.8651, test_f1: 0.6490
 epoch: 47, train_loss: 0.5213, test_loss: 0.8689, test_f1: 0.6497
 epoch: 48, train_loss: 0.5068, test_loss: 0.8798, test_f1: 0.6515
 epoch: 49, train_loss: 0.5082, test_loss: 0.9588, test_f1: 0.6080
 epoch: 50, train_loss: 0.4891, test_loss: 1.0611, test_f1: 0.5889
 epoch: 51, train_loss: 0.4756, test_loss: 0.8489, test_f1: 0.6427
 epoch: 52, train_loss: 0.4403, test_loss: 0.9092, test_f1: 0.6453
 epoch: 53, train_loss: 0.4384, test_loss: 0.9185, test_f1: 0.6524
 epoch: 54, train_loss: 0.4219, test_loss: 0.9327, test_f1: 0.6593
 epoch: 55, train_loss: 0.4366, test_loss: 0.8930, test_f1: 0.6728
 epoch: 56, train_loss: 0.4140, test_loss: 0.8894, test_f1: 0.6554
 epoch: 57, train_loss: 0.4097, test_loss: 0.9604, test_f1: 0.6456
 epoch: 58, train_loss: 0.4124, test_loss: 0.9371, test_f1: 0.6583
 epoch: 59, train_loss: 0.4085, test_loss: 0.9488, test_f1: 0.6452
 epoch: 60, train_loss: 0.3994, test_loss: 0.9053, test_f1: 0.6490
 epoch: 61, train_loss: 0.4028, test_loss: 0.9103, test_f1: 0.6630
 epoch: 62, train_loss: 0.3993, test_loss: 0.9450, test_f1: 0.6626
 epoch: 63, train_loss: 0.3939, test_loss: 1.0475, test_f1: 0.6303
 epoch: 64, train_loss: 0.3839, test_loss: 1.1079, test_f1: 0.6307
 epoch: 65, train_loss: 0.4017, test_loss: 0.8946, test_f1: 0.6578
 epoch: 66, train_loss: 0.3886, test_loss: 0.9599, test_f1: 0.6506
 epoch: 67, train_loss: 0.3626, test_loss: 0.9686, test_f1: 0.6619
 epoch: 68, train_loss: 0.3687, test_loss: 1.1040, test_f1: 0.6161
 epoch: 69, train_loss: 0.3755, test_loss: 0.9785, test_f1: 0.6538
 epoch: 70, train_loss: 0.3719, test_loss: 1.0563, test_f1: 0.6438
 epoch: 71, train_loss: 0.3709, test_loss: 1.0014, test_f1: 0.6497
 epoch: 72, train_loss: 0.3671, test_loss: 0.9944, test_f1: 0.6489
 epoch: 73, train_loss: 0.3650, test_loss: 1.0433, test_f1: 0.6711
 epoch: 74, train_loss: 0.3481, test_loss: 1.0290, test_f1: 0.6664
 epoch: 75, train_loss: 0.3365, test_loss: 1.0557, test_f1: 0.6602
 epoch: 76, train_loss: 0.3475, test_loss: 1.0786, test_f1: 0.6467
 epoch: 77, train_loss: 0.3378, test_loss: 0.9709, test_f1: 0.6647
 epoch: 78, train_loss: 0.3721, test_loss: 1.0202, test_f1: 0.6514
 epoch: 79, train_loss: 0.3320, test_loss: 1.0868, test_f1: 0.6395
 epoch: 80, train_loss: 0.3234, test_loss: 1.1527, test_f1: 0.6414
 epoch: 81, train_loss: 0.3137, test_loss: 1.0614, test_f1: 0.6567
 epoch: 82, train_loss: 0.3196, test_loss: 1.1143, test_f1: 0.6672
 epoch: 83, train_loss: 0.3295, test_loss: 1.0727, test_f1: 0.6701
 epoch: 84, train_loss: 0.3259, test_loss: 1.2097, test_f1: 0.6361
 epoch: 85, train_loss: 0.3051, test_loss: 1.1116, test_f1: 0.6544
 epoch: 86, train_loss: 0.3293, test_loss: 1.1108, test_f1: 0.6289
 epoch: 87, train_loss: 0.3162, test_loss: 1.1159, test_f1: 0.6573
 epoch: 88, train_loss: 0.3090, test_loss: 1.1044, test_f1: 0.6402
 epoch: 89, train_loss: 0.3002, test_loss: 1.2001, test_f1: 0.6383
 epoch: 90, train_loss: 0.3121, test_loss: 1.0827, test_f1: 0.6762
 epoch: 91, train_loss: 0.3004, test_loss: 1.1289, test_f1: 0.6635
 epoch: 92, train_loss: 0.2928, test_loss: 1.2576, test_f1: 0.6383
 epoch: 93, train_loss: 0.3066, test_loss: 1.1307, test_f1: 0.6745
 epoch: 94, train_loss: 0.3048, test_loss: 1.3134, test_f1: 0.6298
 epoch: 95, train_loss: 0.3021, test_loss: 1.1531, test_f1: 0.6511
 epoch: 96, train_loss: 0.2798, test_loss: 1.3272, test_f1: 0.6438
 epoch: 97, train_loss: 0.2857, test_loss: 1.2999, test_f1: 0.6457
 epoch: 98, train_loss: 0.2938, test_loss: 1.2103, test_f1: 0.6657
 epoch: 99, train_loss: 0.2826, test_loss: 1.1916, test_f1: 0.6677
##################ITERATION #6 ****************************************
 epoch: 0, train_loss: 1.2887, test_loss: 1.4185, test_f1: 0.2260
 epoch: 1, train_loss: 1.0937, test_loss: 1.3773, test_f1: 0.2788
 epoch: 2, train_loss: 1.0199, test_loss: 1.1543, test_f1: 0.4302
 epoch: 3, train_loss: 0.9858, test_loss: 1.0222, test_f1: 0.4721
 epoch: 4, train_loss: 0.9628, test_loss: 1.0058, test_f1: 0.4863
 epoch: 5, train_loss: 0.9373, test_loss: 0.9565, test_f1: 0.5181
 epoch: 6, train_loss: 0.9010, test_loss: 0.9295, test_f1: 0.5382
 epoch: 7, train_loss: 0.8983, test_loss: 0.9276, test_f1: 0.5441
 epoch: 8, train_loss: 0.8659, test_loss: 0.9162, test_f1: 0.5624
 epoch: 9, train_loss: 0.8496, test_loss: 0.9774, test_f1: 0.5583
 epoch: 10, train_loss: 0.8382, test_loss: 0.9140, test_f1: 0.5637
 epoch: 11, train_loss: 0.8135, test_loss: 0.9351, test_f1: 0.5638
 epoch: 12, train_loss: 0.8098, test_loss: 0.8801, test_f1: 0.5948
 epoch: 13, train_loss: 0.7881, test_loss: 0.9209, test_f1: 0.5841
 epoch: 14, train_loss: 0.7769, test_loss: 0.9698, test_f1: 0.5257
 epoch: 15, train_loss: 0.7692, test_loss: 0.8956, test_f1: 0.5976
 epoch: 16, train_loss: 0.7696, test_loss: 0.8759, test_f1: 0.5764
 epoch: 17, train_loss: 0.7385, test_loss: 0.8448, test_f1: 0.6100
 epoch: 18, train_loss: 0.7296, test_loss: 0.8571, test_f1: 0.6130
 epoch: 19, train_loss: 0.7290, test_loss: 0.9929, test_f1: 0.5536
 epoch: 20, train_loss: 0.7105, test_loss: 0.8645, test_f1: 0.6122
 epoch: 21, train_loss: 0.7034, test_loss: 0.8732, test_f1: 0.5958
 epoch: 22, train_loss: 0.6932, test_loss: 0.8841, test_f1: 0.5809
 epoch: 23, train_loss: 0.6795, test_loss: 0.8891, test_f1: 0.5991
 epoch: 24, train_loss: 0.6594, test_loss: 0.9620, test_f1: 0.5810
 epoch: 25, train_loss: 0.6627, test_loss: 0.9105, test_f1: 0.5913
 epoch: 26, train_loss: 0.6710, test_loss: 0.9809, test_f1: 0.5479
 epoch: 27, train_loss: 0.6595, test_loss: 1.0230, test_f1: 0.5805
 epoch: 28, train_loss: 0.6311, test_loss: 0.8796, test_f1: 0.6101
 epoch: 29, train_loss: 0.6313, test_loss: 0.9288, test_f1: 0.5798
 epoch: 30, train_loss: 0.6275, test_loss: 0.8559, test_f1: 0.6155
 epoch: 31, train_loss: 0.6259, test_loss: 0.8728, test_f1: 0.5909
 epoch: 32, train_loss: 0.5991, test_loss: 0.8987, test_f1: 0.6176
 epoch: 33, train_loss: 0.5995, test_loss: 0.9989, test_f1: 0.5808
 epoch: 34, train_loss: 0.5956, test_loss: 0.9109, test_f1: 0.6089
 epoch: 35, train_loss: 0.5879, test_loss: 0.8899, test_f1: 0.6226
 epoch: 36, train_loss: 0.5773, test_loss: 0.9011, test_f1: 0.6182
 epoch: 37, train_loss: 0.5787, test_loss: 1.0698, test_f1: 0.5665
 epoch: 38, train_loss: 0.5724, test_loss: 0.8971, test_f1: 0.6240
 epoch: 39, train_loss: 0.5517, test_loss: 0.9318, test_f1: 0.6560
 epoch: 40, train_loss: 0.5310, test_loss: 0.9137, test_f1: 0.5960
 epoch: 41, train_loss: 0.5338, test_loss: 1.0939, test_f1: 0.5624
 epoch: 42, train_loss: 0.5336, test_loss: 0.9902, test_f1: 0.5881
 epoch: 43, train_loss: 0.5142, test_loss: 0.9521, test_f1: 0.6114
 epoch: 44, train_loss: 0.5230, test_loss: 1.0322, test_f1: 0.6098
 epoch: 45, train_loss: 0.5007, test_loss: 0.9343, test_f1: 0.6472
 epoch: 46, train_loss: 0.5288, test_loss: 0.9991, test_f1: 0.6129
 epoch: 47, train_loss: 0.5054, test_loss: 1.1029, test_f1: 0.5893
 epoch: 48, train_loss: 0.5055, test_loss: 0.9952, test_f1: 0.6300
 epoch: 49, train_loss: 0.4874, test_loss: 1.0676, test_f1: 0.5971
 epoch: 50, train_loss: 0.4949, test_loss: 0.9497, test_f1: 0.6436
 epoch: 51, train_loss: 0.4761, test_loss: 0.9631, test_f1: 0.6328
 epoch: 52, train_loss: 0.4351, test_loss: 0.9448, test_f1: 0.6458
 epoch: 53, train_loss: 0.4226, test_loss: 1.0001, test_f1: 0.6509
 epoch: 54, train_loss: 0.4232, test_loss: 1.0682, test_f1: 0.6156
 epoch: 55, train_loss: 0.4196, test_loss: 1.0358, test_f1: 0.6490
 epoch: 56, train_loss: 0.4146, test_loss: 0.9780, test_f1: 0.6704
 epoch: 57, train_loss: 0.3978, test_loss: 1.2430, test_f1: 0.5864
 epoch: 58, train_loss: 0.4050, test_loss: 1.1123, test_f1: 0.6170
 epoch: 59, train_loss: 0.3981, test_loss: 1.0442, test_f1: 0.6389
 epoch: 60, train_loss: 0.4056, test_loss: 0.9606, test_f1: 0.6474
 epoch: 61, train_loss: 0.3663, test_loss: 1.0640, test_f1: 0.6738
 epoch: 62, train_loss: 0.3636, test_loss: 1.0661, test_f1: 0.6520
 epoch: 63, train_loss: 0.3672, test_loss: 1.1181, test_f1: 0.6456
 epoch: 64, train_loss: 0.3459, test_loss: 1.1858, test_f1: 0.6559
 epoch: 65, train_loss: 0.3523, test_loss: 1.0854, test_f1: 0.6474
 epoch: 66, train_loss: 0.3854, test_loss: 1.0580, test_f1: 0.6484
 epoch: 67, train_loss: 0.3698, test_loss: 1.1331, test_f1: 0.6385
 epoch: 68, train_loss: 0.3633, test_loss: 1.1809, test_f1: 0.6473
 epoch: 69, train_loss: 0.3510, test_loss: 1.3356, test_f1: 0.6282
 epoch: 70, train_loss: 0.3709, test_loss: 1.1064, test_f1: 0.6496
 epoch: 71, train_loss: 0.3696, test_loss: 1.0638, test_f1: 0.6486
 epoch: 72, train_loss: 0.3384, test_loss: 1.1036, test_f1: 0.6622
 epoch: 73, train_loss: 0.3491, test_loss: 1.1017, test_f1: 0.6768
 epoch: 74, train_loss: 0.3355, test_loss: 1.0978, test_f1: 0.6644
 epoch: 75, train_loss: 0.3249, test_loss: 1.1419, test_f1: 0.6330
 epoch: 76, train_loss: 0.3197, test_loss: 1.1408, test_f1: 0.6335
 epoch: 77, train_loss: 0.3199, test_loss: 1.1829, test_f1: 0.6407
 epoch: 78, train_loss: 0.3139, test_loss: 1.2074, test_f1: 0.6507
 epoch: 79, train_loss: 0.3146, test_loss: 1.1808, test_f1: 0.6669
 epoch: 80, train_loss: 0.3264, test_loss: 1.1445, test_f1: 0.6519
 epoch: 81, train_loss: 0.3267, test_loss: 1.2891, test_f1: 0.6519
 epoch: 82, train_loss: 0.3132, test_loss: 1.2909, test_f1: 0.6382
 epoch: 83, train_loss: 0.3129, test_loss: 1.1604, test_f1: 0.6387
 epoch: 84, train_loss: 0.3034, test_loss: 1.2265, test_f1: 0.6545
 epoch: 85, train_loss: 0.2988, test_loss: 1.2450, test_f1: 0.6336
 epoch: 86, train_loss: 0.2917, test_loss: 1.2915, test_f1: 0.6549
 epoch: 87, train_loss: 0.2831, test_loss: 1.1662, test_f1: 0.6618
 epoch: 88, train_loss: 0.2788, test_loss: 1.3095, test_f1: 0.6418
 epoch: 89, train_loss: 0.2914, test_loss: 1.3081, test_f1: 0.6435
 epoch: 90, train_loss: 0.3005, test_loss: 1.2220, test_f1: 0.6573
 epoch: 91, train_loss: 0.2879, test_loss: 1.4017, test_f1: 0.6451
 epoch: 92, train_loss: 0.2827, test_loss: 1.2356, test_f1: 0.6510
 epoch: 93, train_loss: 0.2650, test_loss: 1.2642, test_f1: 0.6473
 epoch: 94, train_loss: 0.2663, test_loss: 1.2836, test_f1: 0.6402
 epoch: 95, train_loss: 0.2696, test_loss: 1.3104, test_f1: 0.6213
 epoch: 96, train_loss: 0.2738, test_loss: 1.4289, test_f1: 0.6340
 epoch: 97, train_loss: 0.2612, test_loss: 1.3262, test_f1: 0.6854
 epoch: 98, train_loss: 0.2534, test_loss: 1.4604, test_f1: 0.6424
 epoch: 99, train_loss: 0.2663, test_loss: 1.2827, test_f1: 0.6680
##################ITERATION #7 ****************************************
 epoch: 0, train_loss: 1.3082, test_loss: 1.3531, test_f1: 0.2574
 epoch: 1, train_loss: 1.0816, test_loss: 1.3171, test_f1: 0.2696
 epoch: 2, train_loss: 1.0264, test_loss: 1.0943, test_f1: 0.4051
 epoch: 3, train_loss: 0.9953, test_loss: 0.9845, test_f1: 0.4429
 epoch: 4, train_loss: 0.9508, test_loss: 0.9901, test_f1: 0.4900
 epoch: 5, train_loss: 0.9373, test_loss: 0.9629, test_f1: 0.5171
 epoch: 6, train_loss: 0.9179, test_loss: 0.9520, test_f1: 0.5016
 epoch: 7, train_loss: 0.9047, test_loss: 0.9539, test_f1: 0.5455
 epoch: 8, train_loss: 0.8663, test_loss: 0.9940, test_f1: 0.5285
 epoch: 9, train_loss: 0.8617, test_loss: 0.9467, test_f1: 0.5468
 epoch: 10, train_loss: 0.8280, test_loss: 0.9768, test_f1: 0.5375
 epoch: 11, train_loss: 0.8223, test_loss: 0.9553, test_f1: 0.5476
 epoch: 12, train_loss: 0.8169, test_loss: 0.9611, test_f1: 0.5459
 epoch: 13, train_loss: 0.8127, test_loss: 0.9594, test_f1: 0.5472
 epoch: 14, train_loss: 0.7883, test_loss: 0.9252, test_f1: 0.5612
 epoch: 15, train_loss: 0.7788, test_loss: 0.9393, test_f1: 0.5850
 epoch: 16, train_loss: 0.7600, test_loss: 0.9274, test_f1: 0.5568
 epoch: 17, train_loss: 0.7534, test_loss: 0.9565, test_f1: 0.5866
 epoch: 18, train_loss: 0.7284, test_loss: 1.0135, test_f1: 0.5482
 epoch: 19, train_loss: 0.7411, test_loss: 0.9485, test_f1: 0.5769
 epoch: 20, train_loss: 0.7163, test_loss: 0.9749, test_f1: 0.5759
 epoch: 21, train_loss: 0.6878, test_loss: 0.9636, test_f1: 0.5592
 epoch: 22, train_loss: 0.6834, test_loss: 0.9684, test_f1: 0.5604
 epoch: 23, train_loss: 0.6902, test_loss: 0.9412, test_f1: 0.5873
 epoch: 24, train_loss: 0.6697, test_loss: 0.9749, test_f1: 0.5834
 epoch: 25, train_loss: 0.6736, test_loss: 0.9545, test_f1: 0.5879
 epoch: 26, train_loss: 0.6675, test_loss: 0.9197, test_f1: 0.6157
 epoch: 27, train_loss: 0.6540, test_loss: 0.9978, test_f1: 0.5762
 epoch: 28, train_loss: 0.6423, test_loss: 0.9574, test_f1: 0.5913
 epoch: 29, train_loss: 0.6367, test_loss: 0.9849, test_f1: 0.5989
 epoch: 30, train_loss: 0.6157, test_loss: 0.9929, test_f1: 0.5993
 epoch: 31, train_loss: 0.6179, test_loss: 0.9827, test_f1: 0.5971
 epoch: 32, train_loss: 0.6183, test_loss: 0.9138, test_f1: 0.6041
 epoch: 33, train_loss: 0.5827, test_loss: 0.9676, test_f1: 0.6085
 epoch: 34, train_loss: 0.5779, test_loss: 0.9076, test_f1: 0.6290
 epoch: 35, train_loss: 0.5597, test_loss: 1.0492, test_f1: 0.5890
 epoch: 36, train_loss: 0.5577, test_loss: 0.9395, test_f1: 0.6340
 epoch: 37, train_loss: 0.5513, test_loss: 0.9935, test_f1: 0.5884
 epoch: 38, train_loss: 0.5525, test_loss: 1.0110, test_f1: 0.6026
 epoch: 39, train_loss: 0.5422, test_loss: 0.9757, test_f1: 0.6073
 epoch: 40, train_loss: 0.5486, test_loss: 1.0364, test_f1: 0.6124
 epoch: 41, train_loss: 0.5330, test_loss: 0.9686, test_f1: 0.6234
 epoch: 42, train_loss: 0.5324, test_loss: 0.9355, test_f1: 0.6310
 epoch: 43, train_loss: 0.5265, test_loss: 1.0786, test_f1: 0.5883
 epoch: 44, train_loss: 0.5299, test_loss: 0.9944, test_f1: 0.6309
 epoch: 45, train_loss: 0.5087, test_loss: 0.8996, test_f1: 0.6575
 epoch: 46, train_loss: 0.5032, test_loss: 0.8826, test_f1: 0.6469
 epoch: 47, train_loss: 0.4805, test_loss: 0.9411, test_f1: 0.6218
 epoch: 48, train_loss: 0.4745, test_loss: 0.9994, test_f1: 0.6274
 epoch: 49, train_loss: 0.4532, test_loss: 1.0474, test_f1: 0.6071
 epoch: 50, train_loss: 0.4700, test_loss: 1.0113, test_f1: 0.6337
 epoch: 51, train_loss: 0.4310, test_loss: 0.9452, test_f1: 0.6647
 epoch: 52, train_loss: 0.4113, test_loss: 1.0245, test_f1: 0.6362
 epoch: 53, train_loss: 0.4022, test_loss: 0.9492, test_f1: 0.6435
 epoch: 54, train_loss: 0.4031, test_loss: 0.9903, test_f1: 0.6465
 epoch: 55, train_loss: 0.3943, test_loss: 1.0822, test_f1: 0.6326
 epoch: 56, train_loss: 0.3748, test_loss: 0.9726, test_f1: 0.6591
 epoch: 57, train_loss: 0.3659, test_loss: 1.0073, test_f1: 0.6347
 epoch: 58, train_loss: 0.3697, test_loss: 1.0323, test_f1: 0.6413
 epoch: 59, train_loss: 0.3717, test_loss: 1.0066, test_f1: 0.6333
 epoch: 60, train_loss: 0.3768, test_loss: 1.0511, test_f1: 0.6505
 epoch: 61, train_loss: 0.3518, test_loss: 1.0683, test_f1: 0.6457
 epoch: 62, train_loss: 0.3714, test_loss: 1.0246, test_f1: 0.6514
 epoch: 63, train_loss: 0.3413, test_loss: 1.0565, test_f1: 0.6530
 epoch: 64, train_loss: 0.3465, test_loss: 1.0867, test_f1: 0.6603
 epoch: 65, train_loss: 0.3570, test_loss: 1.0658, test_f1: 0.6308
 epoch: 66, train_loss: 0.3629, test_loss: 1.0744, test_f1: 0.6439
 epoch: 67, train_loss: 0.3347, test_loss: 1.1309, test_f1: 0.6201
 epoch: 68, train_loss: 0.3385, test_loss: 1.0847, test_f1: 0.6420
 epoch: 69, train_loss: 0.3186, test_loss: 1.1381, test_f1: 0.6422
 epoch: 70, train_loss: 0.3147, test_loss: 1.1734, test_f1: 0.6355
 epoch: 71, train_loss: 0.3220, test_loss: 1.1272, test_f1: 0.6402
 epoch: 72, train_loss: 0.3112, test_loss: 1.1457, test_f1: 0.6245
 epoch: 73, train_loss: 0.3265, test_loss: 1.2431, test_f1: 0.6377
 epoch: 74, train_loss: 0.2951, test_loss: 1.1637, test_f1: 0.6322
 epoch: 75, train_loss: 0.2979, test_loss: 1.1795, test_f1: 0.6420
 epoch: 76, train_loss: 0.3035, test_loss: 1.1135, test_f1: 0.6338
 epoch: 77, train_loss: 0.3005, test_loss: 1.3256, test_f1: 0.6236
 epoch: 78, train_loss: 0.2962, test_loss: 1.1794, test_f1: 0.6461
 epoch: 79, train_loss: 0.3059, test_loss: 1.1655, test_f1: 0.6368
 epoch: 80, train_loss: 0.2804, test_loss: 1.2243, test_f1: 0.6307
 epoch: 81, train_loss: 0.2894, test_loss: 1.2862, test_f1: 0.6306
 epoch: 82, train_loss: 0.3158, test_loss: 1.2028, test_f1: 0.6388
 epoch: 83, train_loss: 0.2809, test_loss: 1.1843, test_f1: 0.6338
 epoch: 84, train_loss: 0.2794, test_loss: 1.2339, test_f1: 0.6387
 epoch: 85, train_loss: 0.2768, test_loss: 1.2388, test_f1: 0.6367
 epoch: 86, train_loss: 0.2717, test_loss: 1.3712, test_f1: 0.6198
 epoch: 87, train_loss: 0.2789, test_loss: 1.3425, test_f1: 0.6431
 epoch: 88, train_loss: 0.2822, test_loss: 1.3035, test_f1: 0.6254
 epoch: 89, train_loss: 0.2767, test_loss: 1.3617, test_f1: 0.6079
 epoch: 90, train_loss: 0.2862, test_loss: 1.3894, test_f1: 0.6469
 epoch: 91, train_loss: 0.2777, test_loss: 1.3767, test_f1: 0.6214
 epoch: 92, train_loss: 0.2759, test_loss: 1.2729, test_f1: 0.6460
 epoch: 93, train_loss: 0.2605, test_loss: 1.2182, test_f1: 0.6322
 epoch: 94, train_loss: 0.2631, test_loss: 1.4814, test_f1: 0.6130
 epoch: 95, train_loss: 0.2477, test_loss: 1.3488, test_f1: 0.6345
 epoch: 96, train_loss: 0.2634, test_loss: 1.3595, test_f1: 0.6151
 epoch: 97, train_loss: 0.2503, test_loss: 1.3661, test_f1: 0.6331
 epoch: 98, train_loss: 0.2519, test_loss: 1.4158, test_f1: 0.6293
 epoch: 99, train_loss: 0.2476, test_loss: 1.3960, test_f1: 0.6365
##################ITERATION #8 ****************************************
 epoch: 0, train_loss: 1.4236, test_loss: 1.2890, test_f1: 0.2260
 epoch: 1, train_loss: 1.1057, test_loss: 1.3290, test_f1: 0.2478
 epoch: 2, train_loss: 1.0263, test_loss: 1.3333, test_f1: 0.2396
 epoch: 3, train_loss: 0.9792, test_loss: 1.1204, test_f1: 0.4572
 epoch: 4, train_loss: 0.9371, test_loss: 0.9825, test_f1: 0.5181
 epoch: 5, train_loss: 0.9115, test_loss: 0.9554, test_f1: 0.5190
 epoch: 6, train_loss: 0.8814, test_loss: 0.9325, test_f1: 0.5444
 epoch: 7, train_loss: 0.8723, test_loss: 0.8912, test_f1: 0.5512
 epoch: 8, train_loss: 0.8529, test_loss: 0.9246, test_f1: 0.5466
 epoch: 9, train_loss: 0.8424, test_loss: 0.9138, test_f1: 0.5582
 epoch: 10, train_loss: 0.8145, test_loss: 0.8622, test_f1: 0.5900
 epoch: 11, train_loss: 0.8146, test_loss: 0.8860, test_f1: 0.5803
 epoch: 12, train_loss: 0.8012, test_loss: 0.9256, test_f1: 0.5204
 epoch: 13, train_loss: 0.7804, test_loss: 0.8504, test_f1: 0.5920
 epoch: 14, train_loss: 0.7714, test_loss: 0.8672, test_f1: 0.5804
 epoch: 15, train_loss: 0.7667, test_loss: 0.8492, test_f1: 0.5996
 epoch: 16, train_loss: 0.7518, test_loss: 0.8354, test_f1: 0.5912
 epoch: 17, train_loss: 0.7474, test_loss: 0.8314, test_f1: 0.5854
 epoch: 18, train_loss: 0.7345, test_loss: 0.9607, test_f1: 0.5731
 epoch: 19, train_loss: 0.7209, test_loss: 0.8365, test_f1: 0.6013
 epoch: 20, train_loss: 0.7213, test_loss: 0.8190, test_f1: 0.5721
 epoch: 21, train_loss: 0.7047, test_loss: 0.8850, test_f1: 0.6017
 epoch: 22, train_loss: 0.6999, test_loss: 0.8950, test_f1: 0.5876
 epoch: 23, train_loss: 0.6919, test_loss: 0.8432, test_f1: 0.6195
 epoch: 24, train_loss: 0.6968, test_loss: 0.8870, test_f1: 0.6021
 epoch: 25, train_loss: 0.6882, test_loss: 0.8768, test_f1: 0.6048
 epoch: 26, train_loss: 0.6612, test_loss: 0.8795, test_f1: 0.6014
 epoch: 27, train_loss: 0.6438, test_loss: 0.9698, test_f1: 0.5681
 epoch: 28, train_loss: 0.6562, test_loss: 0.9601, test_f1: 0.5949
 epoch: 29, train_loss: 0.6338, test_loss: 0.8878, test_f1: 0.6067
 epoch: 30, train_loss: 0.6247, test_loss: 0.8758, test_f1: 0.6198
 epoch: 31, train_loss: 0.6248, test_loss: 0.8997, test_f1: 0.5976
 epoch: 32, train_loss: 0.6110, test_loss: 0.8821, test_f1: 0.6105
 epoch: 33, train_loss: 0.6223, test_loss: 0.9486, test_f1: 0.5656
 epoch: 34, train_loss: 0.6197, test_loss: 0.8999, test_f1: 0.5958
 epoch: 35, train_loss: 0.6120, test_loss: 0.9082, test_f1: 0.6000
 epoch: 36, train_loss: 0.6226, test_loss: 0.9942, test_f1: 0.6004
 epoch: 37, train_loss: 0.5822, test_loss: 0.8717, test_f1: 0.5974
 epoch: 38, train_loss: 0.5737, test_loss: 1.0048, test_f1: 0.5871
 epoch: 39, train_loss: 0.5803, test_loss: 0.8866, test_f1: 0.6166
 epoch: 40, train_loss: 0.5688, test_loss: 0.9850, test_f1: 0.5750
 epoch: 41, train_loss: 0.5789, test_loss: 0.8893, test_f1: 0.6182
 epoch: 42, train_loss: 0.5740, test_loss: 0.8322, test_f1: 0.6231
 epoch: 43, train_loss: 0.5428, test_loss: 0.9947, test_f1: 0.5989
 epoch: 44, train_loss: 0.5497, test_loss: 1.1218, test_f1: 0.5932
 epoch: 45, train_loss: 0.5496, test_loss: 0.8718, test_f1: 0.6305
 epoch: 46, train_loss: 0.5490, test_loss: 0.9480, test_f1: 0.6135
 epoch: 47, train_loss: 0.5088, test_loss: 0.9542, test_f1: 0.6353
 epoch: 48, train_loss: 0.5135, test_loss: 0.9637, test_f1: 0.6370
 epoch: 49, train_loss: 0.5324, test_loss: 0.9806, test_f1: 0.6142
 epoch: 50, train_loss: 0.5178, test_loss: 0.8593, test_f1: 0.6429
 epoch: 51, train_loss: 0.4998, test_loss: 0.9802, test_f1: 0.6334
 epoch: 52, train_loss: 0.4761, test_loss: 0.9653, test_f1: 0.6306
 epoch: 53, train_loss: 0.4589, test_loss: 0.9342, test_f1: 0.6409
 epoch: 54, train_loss: 0.4523, test_loss: 0.9207, test_f1: 0.6357
 epoch: 55, train_loss: 0.4407, test_loss: 1.0285, test_f1: 0.6347
 epoch: 56, train_loss: 0.4445, test_loss: 0.9608, test_f1: 0.6306
 epoch: 57, train_loss: 0.4390, test_loss: 0.9496, test_f1: 0.6375
 epoch: 58, train_loss: 0.4291, test_loss: 0.9862, test_f1: 0.6444
 epoch: 59, train_loss: 0.4168, test_loss: 0.9652, test_f1: 0.6454
 epoch: 60, train_loss: 0.4246, test_loss: 0.9656, test_f1: 0.6492
 epoch: 61, train_loss: 0.4029, test_loss: 1.0823, test_f1: 0.6495
 epoch: 62, train_loss: 0.4014, test_loss: 1.0009, test_f1: 0.6376
 epoch: 63, train_loss: 0.3958, test_loss: 0.9245, test_f1: 0.6501
 epoch: 64, train_loss: 0.4169, test_loss: 0.9015, test_f1: 0.6551
 epoch: 65, train_loss: 0.4049, test_loss: 0.8968, test_f1: 0.6485
 epoch: 66, train_loss: 0.4058, test_loss: 0.9944, test_f1: 0.6636
 epoch: 67, train_loss: 0.4012, test_loss: 0.9751, test_f1: 0.6496
 epoch: 68, train_loss: 0.3804, test_loss: 1.0504, test_f1: 0.6475
 epoch: 69, train_loss: 0.3886, test_loss: 1.0495, test_f1: 0.6365
 epoch: 70, train_loss: 0.3745, test_loss: 1.1131, test_f1: 0.6244
 epoch: 71, train_loss: 0.3884, test_loss: 1.0402, test_f1: 0.6523
 epoch: 72, train_loss: 0.3843, test_loss: 1.0266, test_f1: 0.6532
 epoch: 73, train_loss: 0.3923, test_loss: 1.0157, test_f1: 0.6482
 epoch: 74, train_loss: 0.3705, test_loss: 0.9633, test_f1: 0.6641
 epoch: 75, train_loss: 0.3667, test_loss: 1.0723, test_f1: 0.6395
 epoch: 76, train_loss: 0.3691, test_loss: 1.0050, test_f1: 0.6757
 epoch: 77, train_loss: 0.3512, test_loss: 1.0896, test_f1: 0.6438
 epoch: 78, train_loss: 0.3342, test_loss: 1.0210, test_f1: 0.6692
 epoch: 79, train_loss: 0.3508, test_loss: 1.1329, test_f1: 0.6478
 epoch: 80, train_loss: 0.3597, test_loss: 1.0621, test_f1: 0.6603
 epoch: 81, train_loss: 0.3505, test_loss: 1.0711, test_f1: 0.6391
 epoch: 82, train_loss: 0.3391, test_loss: 1.0452, test_f1: 0.6682
 epoch: 83, train_loss: 0.3435, test_loss: 1.1086, test_f1: 0.6521
 epoch: 84, train_loss: 0.3373, test_loss: 1.0792, test_f1: 0.6635
 epoch: 85, train_loss: 0.3449, test_loss: 1.0662, test_f1: 0.6419
 epoch: 86, train_loss: 0.3484, test_loss: 1.1912, test_f1: 0.6385
 epoch: 87, train_loss: 0.3336, test_loss: 1.0849, test_f1: 0.6713
 epoch: 88, train_loss: 0.3302, test_loss: 1.2711, test_f1: 0.6366
 epoch: 89, train_loss: 0.3323, test_loss: 1.1324, test_f1: 0.6480
 epoch: 90, train_loss: 0.3247, test_loss: 1.1892, test_f1: 0.6472
 epoch: 91, train_loss: 0.3163, test_loss: 1.1662, test_f1: 0.6595
 epoch: 92, train_loss: 0.3286, test_loss: 1.2386, test_f1: 0.6393
 epoch: 93, train_loss: 0.3359, test_loss: 1.1324, test_f1: 0.6610
 epoch: 94, train_loss: 0.3458, test_loss: 1.1673, test_f1: 0.6404
 epoch: 95, train_loss: 0.3125, test_loss: 1.1953, test_f1: 0.6390
 epoch: 96, train_loss: 0.3056, test_loss: 1.2343, test_f1: 0.6372
 epoch: 97, train_loss: 0.3168, test_loss: 1.2497, test_f1: 0.6349
 epoch: 98, train_loss: 0.2986, test_loss: 1.3056, test_f1: 0.6432
 epoch: 99, train_loss: 0.3258, test_loss: 1.1133, test_f1: 0.6455
##################ITERATION #9 ****************************************
 epoch: 0, train_loss: 1.3957, test_loss: 1.3001, test_f1: 0.2260
 epoch: 1, train_loss: 1.1098, test_loss: 1.2385, test_f1: 0.2328
 epoch: 2, train_loss: 1.0496, test_loss: 1.1560, test_f1: 0.3261
 epoch: 3, train_loss: 0.9923, test_loss: 1.0745, test_f1: 0.4004
 epoch: 4, train_loss: 0.9579, test_loss: 0.9734, test_f1: 0.5208
 epoch: 5, train_loss: 0.9416, test_loss: 0.9508, test_f1: 0.5670
 epoch: 6, train_loss: 0.9018, test_loss: 0.9577, test_f1: 0.5136
 epoch: 7, train_loss: 0.8823, test_loss: 0.9237, test_f1: 0.5846
 epoch: 8, train_loss: 0.8689, test_loss: 0.9119, test_f1: 0.5541
 epoch: 9, train_loss: 0.8429, test_loss: 0.9095, test_f1: 0.5834
 epoch: 10, train_loss: 0.8305, test_loss: 0.9250, test_f1: 0.5796
 epoch: 11, train_loss: 0.8166, test_loss: 0.9407, test_f1: 0.5545
 epoch: 12, train_loss: 0.8120, test_loss: 0.9176, test_f1: 0.5898
 epoch: 13, train_loss: 0.7901, test_loss: 0.8977, test_f1: 0.5949
 epoch: 14, train_loss: 0.7798, test_loss: 0.9124, test_f1: 0.5852
 epoch: 15, train_loss: 0.7649, test_loss: 0.9615, test_f1: 0.5699
 epoch: 16, train_loss: 0.7386, test_loss: 0.9035, test_f1: 0.5882
 epoch: 17, train_loss: 0.7343, test_loss: 0.9536, test_f1: 0.5864
 epoch: 18, train_loss: 0.7169, test_loss: 0.9172, test_f1: 0.5817
 epoch: 19, train_loss: 0.7071, test_loss: 0.8927, test_f1: 0.5983
 epoch: 20, train_loss: 0.7094, test_loss: 0.9092, test_f1: 0.5937
 epoch: 21, train_loss: 0.6986, test_loss: 0.8736, test_f1: 0.6044
 epoch: 22, train_loss: 0.6898, test_loss: 0.8673, test_f1: 0.6344
 epoch: 23, train_loss: 0.6878, test_loss: 0.8852, test_f1: 0.6185
 epoch: 24, train_loss: 0.6662, test_loss: 0.8937, test_f1: 0.5952
 epoch: 25, train_loss: 0.6604, test_loss: 0.8928, test_f1: 0.6132
 epoch: 26, train_loss: 0.6487, test_loss: 0.9289, test_f1: 0.5991
 epoch: 27, train_loss: 0.6402, test_loss: 0.8577, test_f1: 0.6287
 epoch: 28, train_loss: 0.6346, test_loss: 0.8336, test_f1: 0.6386
 epoch: 29, train_loss: 0.6036, test_loss: 0.8593, test_f1: 0.6275
 epoch: 30, train_loss: 0.6097, test_loss: 0.8813, test_f1: 0.6177
 epoch: 31, train_loss: 0.6136, test_loss: 0.8756, test_f1: 0.6320
 epoch: 32, train_loss: 0.6039, test_loss: 0.9398, test_f1: 0.6086
 epoch: 33, train_loss: 0.6030, test_loss: 0.8499, test_f1: 0.6423
 epoch: 34, train_loss: 0.5890, test_loss: 0.8953, test_f1: 0.6188
 epoch: 35, train_loss: 0.5760, test_loss: 0.9152, test_f1: 0.6312
 epoch: 36, train_loss: 0.5650, test_loss: 0.9103, test_f1: 0.6181
 epoch: 37, train_loss: 0.5570, test_loss: 0.8998, test_f1: 0.6492
 epoch: 38, train_loss: 0.5543, test_loss: 0.9463, test_f1: 0.6112
 epoch: 39, train_loss: 0.5642, test_loss: 0.8687, test_f1: 0.6384
 epoch: 40, train_loss: 0.5537, test_loss: 0.8460, test_f1: 0.6521
 epoch: 41, train_loss: 0.5422, test_loss: 0.8727, test_f1: 0.6461
 epoch: 42, train_loss: 0.5230, test_loss: 0.8404, test_f1: 0.6422
 epoch: 43, train_loss: 0.5303, test_loss: 0.9291, test_f1: 0.6390
 epoch: 44, train_loss: 0.5026, test_loss: 0.8570, test_f1: 0.6303
 epoch: 45, train_loss: 0.4925, test_loss: 0.8747, test_f1: 0.6495
 epoch: 46, train_loss: 0.5052, test_loss: 0.9235, test_f1: 0.6358
 epoch: 47, train_loss: 0.4708, test_loss: 0.9391, test_f1: 0.6107
 epoch: 48, train_loss: 0.4735, test_loss: 0.9687, test_f1: 0.6321
 epoch: 49, train_loss: 0.4732, test_loss: 0.9517, test_f1: 0.6267
 epoch: 50, train_loss: 0.4689, test_loss: 1.0078, test_f1: 0.6225
 epoch: 51, train_loss: 0.4677, test_loss: 0.8960, test_f1: 0.6458
 epoch: 52, train_loss: 0.4228, test_loss: 0.8437, test_f1: 0.6935
 epoch: 53, train_loss: 0.4062, test_loss: 0.8932, test_f1: 0.6719
 epoch: 54, train_loss: 0.3978, test_loss: 0.8652, test_f1: 0.6776
 epoch: 55, train_loss: 0.3892, test_loss: 1.0148, test_f1: 0.6222
 epoch: 56, train_loss: 0.3909, test_loss: 0.9161, test_f1: 0.6516
 epoch: 57, train_loss: 0.3937, test_loss: 0.9589, test_f1: 0.6457
 epoch: 58, train_loss: 0.4006, test_loss: 0.9205, test_f1: 0.6465
 epoch: 59, train_loss: 0.3725, test_loss: 0.9791, test_f1: 0.6502
 epoch: 60, train_loss: 0.3717, test_loss: 0.9324, test_f1: 0.6966
 epoch: 61, train_loss: 0.3796, test_loss: 0.9262, test_f1: 0.6650
 epoch: 62, train_loss: 0.3662, test_loss: 1.0366, test_f1: 0.6298
 epoch: 63, train_loss: 0.3942, test_loss: 0.9308, test_f1: 0.6689
 epoch: 64, train_loss: 0.3706, test_loss: 1.0162, test_f1: 0.6669
 epoch: 65, train_loss: 0.3428, test_loss: 0.9194, test_f1: 0.6817
 epoch: 66, train_loss: 0.3552, test_loss: 0.9564, test_f1: 0.6763
 epoch: 67, train_loss: 0.3350, test_loss: 1.0547, test_f1: 0.6552
 epoch: 68, train_loss: 0.3416, test_loss: 1.0616, test_f1: 0.6426
 epoch: 69, train_loss: 0.3573, test_loss: 1.0232, test_f1: 0.6659
 epoch: 70, train_loss: 0.3541, test_loss: 1.0916, test_f1: 0.6393
 epoch: 71, train_loss: 0.3480, test_loss: 1.0636, test_f1: 0.6529
 epoch: 72, train_loss: 0.3456, test_loss: 0.9758, test_f1: 0.6735
 epoch: 73, train_loss: 0.3405, test_loss: 1.0022, test_f1: 0.6586
 epoch: 74, train_loss: 0.3305, test_loss: 0.9811, test_f1: 0.6861
 epoch: 75, train_loss: 0.3350, test_loss: 1.2910, test_f1: 0.6237
 epoch: 76, train_loss: 0.3474, test_loss: 1.0920, test_f1: 0.6396
 epoch: 77, train_loss: 0.3221, test_loss: 1.2510, test_f1: 0.6284
 epoch: 78, train_loss: 0.3152, test_loss: 1.1779, test_f1: 0.6645
 epoch: 79, train_loss: 0.3211, test_loss: 0.9935, test_f1: 0.6745
 epoch: 80, train_loss: 0.3052, test_loss: 1.0879, test_f1: 0.6748
 epoch: 81, train_loss: 0.2813, test_loss: 1.0581, test_f1: 0.6803
 epoch: 82, train_loss: 0.3058, test_loss: 1.1672, test_f1: 0.6784
 epoch: 83, train_loss: 0.3122, test_loss: 1.1149, test_f1: 0.6614
 epoch: 84, train_loss: 0.3035, test_loss: 1.0635, test_f1: 0.6783
 epoch: 85, train_loss: 0.2973, test_loss: 1.1732, test_f1: 0.6495
 epoch: 86, train_loss: 0.2776, test_loss: 1.2072, test_f1: 0.6783
 epoch: 87, train_loss: 0.2970, test_loss: 1.1740, test_f1: 0.6654
 epoch: 88, train_loss: 0.2860, test_loss: 1.1337, test_f1: 0.6546
 epoch: 89, train_loss: 0.2750, test_loss: 1.2643, test_f1: 0.6672
 epoch: 90, train_loss: 0.2667, test_loss: 1.0473, test_f1: 0.7024
 epoch: 91, train_loss: 0.2619, test_loss: 1.2025, test_f1: 0.6607
 epoch: 92, train_loss: 0.2688, test_loss: 1.2532, test_f1: 0.6644
 epoch: 93, train_loss: 0.2695, test_loss: 1.1212, test_f1: 0.6736
 epoch: 94, train_loss: 0.2723, test_loss: 1.2258, test_f1: 0.6699
 epoch: 95, train_loss: 0.2810, test_loss: 1.3853, test_f1: 0.6383
 epoch: 96, train_loss: 0.2773, test_loss: 1.1776, test_f1: 0.6531
 epoch: 97, train_loss: 0.2855, test_loss: 1.2849, test_f1: 0.6707
 epoch: 98, train_loss: 0.2826, test_loss: 1.1660, test_f1: 0.6868
 epoch: 99, train_loss: 0.2532, test_loss: 1.2961, test_f1: 0.6756

Training completed in 1028.91 seconds
Best F1: 0.7024 at epoch 90
Mean F1 across iterations: 0.6716  0.0137
========================FINAL RESULTS================================
FEGIN weighted F1: 0.7024  0.0137
python main.py --data ltspice_examples --representation component_pin --model FEGIN --layers 6 --hiddens 64 --batch_size 256 --lr 0.001 --emb_size 128 --epochs 100 --save_appendix component_pin_L6_H64_BS256_LR0.001_E128 --no_val
-----



STDERR:
  File "main.py", line 370, in <module>
    main()
  File "main.py", line 254, in main
    dataset = dataset_class(
  File "/home/philip/projects/llm_inference_code_repo/Circuit-Completion-Using-GNNs/component_classification_with_link_prediction_head/evaluation/FEGIN/kernel/circuit_datasets.py", line 15, in __init__
    self.data, self.slices = torch.load(self.processed_paths[0])
  File "/home/philip/.local/lib/python3.8/site-packages/torch/serialization.py", line 1040, in load
    warnings.warn(
  File "/usr/lib/python3.8/warnings.py", line 109, in _showwarnmsg
    sw(msg.message, msg.category, msg.filename, msg.lineno,
  File "main.py", line 47, in warn_with_traceback
    traceback.print_stack(file=log)
/home/philip/projects/llm_inference_code_repo/Circuit-Completion-Using-GNNs/component_classification_with_link_prediction_head/evaluation/FEGIN/kernel/circuit_datasets.py:15: FutureWarning: You are using `torch.load` with `weights_only=False` (the current default value), which uses the default pickle module implicitly. It is possible to construct malicious pickle data which will execute arbitrary code during unpickling (See https://github.com/pytorch/pytorch/blob/main/SECURITY.md#untrusted-models for more details). In a future release, the default value for `weights_only` will be flipped to `True`. This limits the functions that could be executed during unpickling. Arbitrary objects will no longer be allowed to be loaded via this mode unless they are explicitly allowlisted by the user via `torch.serialization.add_safe_globals`. We recommend you start setting `weights_only=True` for any use case where you don't have full control of the loaded file. Please open an issue on GitHub for any issues related to this experimental feature.
  self.data, self.slices = torch.load(self.processed_paths[0])
