STDOUT:
Results will be saved in /home/philip/projects/ltspice_examples_code_repo/Circuit-Completion-Using-GNNs/component_classification_with_link_prediction_head/evaluation/FEGIN/results/model_FEGIN_dataset_ltspice_examples
Command line input: python main.py --data ltspice_examples --representation component_pin --model FEGIN --layers 3 --hiddens 32 --batch_size 128 --lr 0.01 --emb_size 128 --epochs 100 --save_appendix component_pin_L3_H32_BS128_LR0.01_E128 --no_val
 is saved.
-----
ltspice_examples - FEGIN
Using 3 layers, 32 hidden units, h = 2
Loading component_pin representation dataset
ENTERED
Training FEGIN on component_pin representation
Train: 3560, Test: 848
##################ITERATION #0 ****************************************
 epoch: 0, train_loss: 1.2481, test_loss: 1.2114, test_f1: 0.2260
 epoch: 1, train_loss: 1.0962, test_loss: 1.0573, test_f1: 0.3597
 epoch: 2, train_loss: 1.0349, test_loss: 1.0378, test_f1: 0.4189
 epoch: 3, train_loss: 0.9763, test_loss: 1.2019, test_f1: 0.4135
 epoch: 4, train_loss: 0.9358, test_loss: 1.2147, test_f1: 0.4129
 epoch: 5, train_loss: 0.9127, test_loss: 0.9731, test_f1: 0.5221
 epoch: 6, train_loss: 0.9023, test_loss: 0.8701, test_f1: 0.5521
 epoch: 7, train_loss: 0.8849, test_loss: 0.8981, test_f1: 0.4995
 epoch: 8, train_loss: 0.8663, test_loss: 1.0288, test_f1: 0.4840
 epoch: 9, train_loss: 0.8454, test_loss: 0.8914, test_f1: 0.5380
 epoch: 10, train_loss: 0.8378, test_loss: 0.8649, test_f1: 0.5498
 epoch: 11, train_loss: 0.8183, test_loss: 0.8929, test_f1: 0.5348
 epoch: 12, train_loss: 0.8078, test_loss: 0.9820, test_f1: 0.4897
 epoch: 13, train_loss: 0.8122, test_loss: 1.0088, test_f1: 0.4757
 epoch: 14, train_loss: 0.8432, test_loss: 0.9664, test_f1: 0.5117
 epoch: 15, train_loss: 0.8689, test_loss: 0.8627, test_f1: 0.5210
 epoch: 16, train_loss: 0.8159, test_loss: 0.8611, test_f1: 0.5469
 epoch: 17, train_loss: 0.8057, test_loss: 0.8037, test_f1: 0.5951
 epoch: 18, train_loss: 0.7794, test_loss: 0.8371, test_f1: 0.5602
 epoch: 19, train_loss: 0.7899, test_loss: 0.8664, test_f1: 0.5595
 epoch: 20, train_loss: 0.7716, test_loss: 0.8291, test_f1: 0.5490
 epoch: 21, train_loss: 0.7590, test_loss: 0.8356, test_f1: 0.5569
 epoch: 22, train_loss: 0.7307, test_loss: 0.8711, test_f1: 0.5723
 epoch: 23, train_loss: 0.7507, test_loss: 0.8301, test_f1: 0.5429
 epoch: 24, train_loss: 0.7466, test_loss: 0.8534, test_f1: 0.5521
 epoch: 25, train_loss: 0.7321, test_loss: 0.9376, test_f1: 0.5909
 epoch: 26, train_loss: 0.7241, test_loss: 0.9350, test_f1: 0.5558
 epoch: 27, train_loss: 0.7187, test_loss: 0.8325, test_f1: 0.5818
 epoch: 28, train_loss: 0.7306, test_loss: 1.1478, test_f1: 0.4944
 epoch: 29, train_loss: 0.7317, test_loss: 0.7791, test_f1: 0.5862
 epoch: 30, train_loss: 0.7173, test_loss: 0.8145, test_f1: 0.6128
 epoch: 31, train_loss: 0.7041, test_loss: 0.7350, test_f1: 0.5947
 epoch: 32, train_loss: 0.6958, test_loss: 0.8072, test_f1: 0.6499
 epoch: 33, train_loss: 0.6995, test_loss: 0.8083, test_f1: 0.5817
 epoch: 34, train_loss: 0.6764, test_loss: 0.8113, test_f1: 0.5636
 epoch: 35, train_loss: 0.6968, test_loss: 0.9128, test_f1: 0.5766
 epoch: 36, train_loss: 0.6890, test_loss: 0.9464, test_f1: 0.5361
 epoch: 37, train_loss: 0.6690, test_loss: 0.7922, test_f1: 0.6316
 epoch: 38, train_loss: 0.6692, test_loss: 0.9414, test_f1: 0.5103
 epoch: 39, train_loss: 0.6757, test_loss: 0.8610, test_f1: 0.5856
 epoch: 40, train_loss: 0.7077, test_loss: 0.8790, test_f1: 0.5697
 epoch: 41, train_loss: 0.6734, test_loss: 0.9485, test_f1: 0.5889
 epoch: 42, train_loss: 0.6731, test_loss: 0.9608, test_f1: 0.5856
 epoch: 43, train_loss: 0.6672, test_loss: 0.9769, test_f1: 0.5756
 epoch: 44, train_loss: 0.6512, test_loss: 0.7842, test_f1: 0.5728
 epoch: 45, train_loss: 0.6506, test_loss: 0.7560, test_f1: 0.6105
 epoch: 46, train_loss: 0.6735, test_loss: 0.7960, test_f1: 0.5620
 epoch: 47, train_loss: 0.6482, test_loss: 1.0147, test_f1: 0.5663
 epoch: 48, train_loss: 0.6433, test_loss: 0.8155, test_f1: 0.6345
 epoch: 49, train_loss: 0.6366, test_loss: 0.8178, test_f1: 0.5475
 epoch: 50, train_loss: 0.6428, test_loss: 0.7915, test_f1: 0.5922
 epoch: 51, train_loss: 0.6076, test_loss: 0.8108, test_f1: 0.6038
 epoch: 52, train_loss: 0.5798, test_loss: 0.8468, test_f1: 0.6405
 epoch: 53, train_loss: 0.5898, test_loss: 0.8353, test_f1: 0.6302
 epoch: 54, train_loss: 0.5804, test_loss: 0.8267, test_f1: 0.6448
 epoch: 55, train_loss: 0.5711, test_loss: 0.9469, test_f1: 0.5950
 epoch: 56, train_loss: 0.5853, test_loss: 0.8842, test_f1: 0.6309
 epoch: 57, train_loss: 0.5766, test_loss: 0.8328, test_f1: 0.6321
 epoch: 58, train_loss: 0.5712, test_loss: 0.8654, test_f1: 0.6759
 epoch: 59, train_loss: 0.5591, test_loss: 0.9055, test_f1: 0.5926
 epoch: 60, train_loss: 0.5700, test_loss: 0.7811, test_f1: 0.6321
 epoch: 61, train_loss: 0.5644, test_loss: 0.8142, test_f1: 0.6740
 epoch: 62, train_loss: 0.5679, test_loss: 0.8002, test_f1: 0.6043
 epoch: 63, train_loss: 0.5869, test_loss: 0.7818, test_f1: 0.5927
 epoch: 64, train_loss: 0.5687, test_loss: 0.7957, test_f1: 0.6371
 epoch: 65, train_loss: 0.5447, test_loss: 0.8369, test_f1: 0.6680
 epoch: 66, train_loss: 0.5430, test_loss: 0.8889, test_f1: 0.6399
 epoch: 67, train_loss: 0.5526, test_loss: 0.8815, test_f1: 0.6425
 epoch: 68, train_loss: 0.5471, test_loss: 0.7878, test_f1: 0.6536
 epoch: 69, train_loss: 0.5531, test_loss: 0.7954, test_f1: 0.6406
 epoch: 70, train_loss: 0.5495, test_loss: 0.8779, test_f1: 0.6409
 epoch: 71, train_loss: 0.5295, test_loss: 0.9735, test_f1: 0.5984
 epoch: 72, train_loss: 0.5268, test_loss: 0.7104, test_f1: 0.7052
 epoch: 73, train_loss: 0.5520, test_loss: 0.6984, test_f1: 0.6625
 epoch: 74, train_loss: 0.5362, test_loss: 0.9302, test_f1: 0.6016
 epoch: 75, train_loss: 0.5319, test_loss: 0.7594, test_f1: 0.6911
 epoch: 76, train_loss: 0.5381, test_loss: 0.7509, test_f1: 0.6578
 epoch: 77, train_loss: 0.5301, test_loss: 0.9150, test_f1: 0.6095
 epoch: 78, train_loss: 0.5282, test_loss: 0.8770, test_f1: 0.6683
 epoch: 79, train_loss: 0.5220, test_loss: 0.9037, test_f1: 0.6195
 epoch: 80, train_loss: 0.5119, test_loss: 0.9340, test_f1: 0.6166
 epoch: 81, train_loss: 0.5168, test_loss: 0.7679, test_f1: 0.6721
 epoch: 82, train_loss: 0.5268, test_loss: 0.7765, test_f1: 0.6599
 epoch: 83, train_loss: 0.5015, test_loss: 0.9000, test_f1: 0.6630
 epoch: 84, train_loss: 0.5184, test_loss: 0.8394, test_f1: 0.6539
 epoch: 85, train_loss: 0.5135, test_loss: 0.7387, test_f1: 0.6746
 epoch: 86, train_loss: 0.5210, test_loss: 0.8218, test_f1: 0.6444
 epoch: 87, train_loss: 0.5441, test_loss: 0.8381, test_f1: 0.6339
 epoch: 88, train_loss: 0.5512, test_loss: 0.7957, test_f1: 0.6290
 epoch: 89, train_loss: 0.5288, test_loss: 0.7973, test_f1: 0.6619
 epoch: 90, train_loss: 0.5144, test_loss: 0.7825, test_f1: 0.6793
 epoch: 91, train_loss: 0.5038, test_loss: 0.8116, test_f1: 0.6656
 epoch: 92, train_loss: 0.5177, test_loss: 0.8860, test_f1: 0.6524
 epoch: 93, train_loss: 0.4999, test_loss: 0.7937, test_f1: 0.6808
 epoch: 94, train_loss: 0.5147, test_loss: 0.9552, test_f1: 0.6223
 epoch: 95, train_loss: 0.5194, test_loss: 0.8813, test_f1: 0.6750
 epoch: 96, train_loss: 0.5012, test_loss: 0.9261, test_f1: 0.6469
 epoch: 97, train_loss: 0.5022, test_loss: 0.7935, test_f1: 0.6565
 epoch: 98, train_loss: 0.4942, test_loss: 0.7693, test_f1: 0.6701
 epoch: 99, train_loss: 0.4946, test_loss: 0.9363, test_f1: 0.6694
##################ITERATION #1 ****************************************
 epoch: 0, train_loss: 1.1470, test_loss: 1.1345, test_f1: 0.3493
 epoch: 1, train_loss: 1.0215, test_loss: 1.1086, test_f1: 0.4272
 epoch: 2, train_loss: 0.9913, test_loss: 1.0740, test_f1: 0.4972
 epoch: 3, train_loss: 0.9649, test_loss: 1.1149, test_f1: 0.4642
 epoch: 4, train_loss: 0.9408, test_loss: 1.0130, test_f1: 0.5172
 epoch: 5, train_loss: 0.9261, test_loss: 0.9893, test_f1: 0.5239
 epoch: 6, train_loss: 0.9120, test_loss: 0.9404, test_f1: 0.5679
 epoch: 7, train_loss: 0.9035, test_loss: 0.9092, test_f1: 0.5188
 epoch: 8, train_loss: 0.8800, test_loss: 0.9246, test_f1: 0.5423
 epoch: 9, train_loss: 0.8689, test_loss: 0.9292, test_f1: 0.5219
 epoch: 10, train_loss: 0.8683, test_loss: 0.8996, test_f1: 0.5247
 epoch: 11, train_loss: 0.8467, test_loss: 0.9838, test_f1: 0.5056
 epoch: 12, train_loss: 0.8290, test_loss: 0.9005, test_f1: 0.5399
 epoch: 13, train_loss: 0.8224, test_loss: 0.8797, test_f1: 0.5182
 epoch: 14, train_loss: 0.8299, test_loss: 0.8791, test_f1: 0.5664
 epoch: 15, train_loss: 0.7998, test_loss: 0.8569, test_f1: 0.5500
 epoch: 16, train_loss: 0.8023, test_loss: 0.9107, test_f1: 0.5105
 epoch: 17, train_loss: 0.8041, test_loss: 1.0296, test_f1: 0.5874
 epoch: 18, train_loss: 0.7945, test_loss: 0.8927, test_f1: 0.5517
 epoch: 19, train_loss: 0.7673, test_loss: 0.8801, test_f1: 0.5911
 epoch: 20, train_loss: 0.7845, test_loss: 0.8407, test_f1: 0.6127
 epoch: 21, train_loss: 0.7811, test_loss: 1.0425, test_f1: 0.5050
 epoch: 22, train_loss: 0.7613, test_loss: 0.9071, test_f1: 0.5970
 epoch: 23, train_loss: 0.7462, test_loss: 1.1287, test_f1: 0.4975
 epoch: 24, train_loss: 0.7614, test_loss: 0.8909, test_f1: 0.5780
 epoch: 25, train_loss: 0.7475, test_loss: 0.8960, test_f1: 0.5757
 epoch: 26, train_loss: 0.7453, test_loss: 0.8848, test_f1: 0.6196
 epoch: 27, train_loss: 0.7347, test_loss: 0.8261, test_f1: 0.6353
 epoch: 28, train_loss: 0.7234, test_loss: 0.9181, test_f1: 0.6108
 epoch: 29, train_loss: 0.7537, test_loss: 0.8847, test_f1: 0.6164
 epoch: 30, train_loss: 0.7301, test_loss: 0.8149, test_f1: 0.6406
 epoch: 31, train_loss: 0.7045, test_loss: 0.8424, test_f1: 0.6111
 epoch: 32, train_loss: 0.7015, test_loss: 0.9521, test_f1: 0.5544
 epoch: 33, train_loss: 0.7226, test_loss: 0.8353, test_f1: 0.5817
 epoch: 34, train_loss: 0.6967, test_loss: 0.8866, test_f1: 0.6273
 epoch: 35, train_loss: 0.7083, test_loss: 0.9285, test_f1: 0.6116
 epoch: 36, train_loss: 0.6981, test_loss: 0.8566, test_f1: 0.6579
 epoch: 37, train_loss: 0.7004, test_loss: 0.8939, test_f1: 0.5892
 epoch: 38, train_loss: 0.7080, test_loss: 0.8570, test_f1: 0.6054
 epoch: 39, train_loss: 0.6855, test_loss: 0.8211, test_f1: 0.6491
 epoch: 40, train_loss: 0.7028, test_loss: 0.9551, test_f1: 0.5842
 epoch: 41, train_loss: 0.7025, test_loss: 0.7790, test_f1: 0.6620
 epoch: 42, train_loss: 0.6621, test_loss: 0.8300, test_f1: 0.6442
 epoch: 43, train_loss: 0.6597, test_loss: 0.8600, test_f1: 0.6594
 epoch: 44, train_loss: 0.6700, test_loss: 1.0400, test_f1: 0.5547
 epoch: 45, train_loss: 0.6649, test_loss: 0.9317, test_f1: 0.6777
 epoch: 46, train_loss: 0.6469, test_loss: 1.0579, test_f1: 0.6048
 epoch: 47, train_loss: 0.6656, test_loss: 0.8456, test_f1: 0.6444
 epoch: 48, train_loss: 0.6608, test_loss: 0.8874, test_f1: 0.5994
 epoch: 49, train_loss: 0.6539, test_loss: 0.8464, test_f1: 0.6517
 epoch: 50, train_loss: 0.6538, test_loss: 0.8863, test_f1: 0.6280
 epoch: 51, train_loss: 0.6239, test_loss: 0.8902, test_f1: 0.6673
 epoch: 52, train_loss: 0.6150, test_loss: 0.8929, test_f1: 0.6492
 epoch: 53, train_loss: 0.5943, test_loss: 0.8118, test_f1: 0.6835
 epoch: 54, train_loss: 0.5777, test_loss: 0.8163, test_f1: 0.6605
 epoch: 55, train_loss: 0.5727, test_loss: 0.8581, test_f1: 0.6764
 epoch: 56, train_loss: 0.5740, test_loss: 0.8090, test_f1: 0.6664
 epoch: 57, train_loss: 0.5512, test_loss: 0.8641, test_f1: 0.6711
 epoch: 58, train_loss: 0.5714, test_loss: 0.8410, test_f1: 0.6534
 epoch: 59, train_loss: 0.5642, test_loss: 0.9168, test_f1: 0.6720
 epoch: 60, train_loss: 0.5780, test_loss: 0.9635, test_f1: 0.6475
 epoch: 61, train_loss: 0.5631, test_loss: 1.0970, test_f1: 0.5851
 epoch: 62, train_loss: 0.5805, test_loss: 0.8984, test_f1: 0.6719
 epoch: 63, train_loss: 0.5674, test_loss: 1.0502, test_f1: 0.6375
 epoch: 64, train_loss: 0.5607, test_loss: 0.8688, test_f1: 0.6656
 epoch: 65, train_loss: 0.5557, test_loss: 0.9075, test_f1: 0.6367
 epoch: 66, train_loss: 0.5739, test_loss: 0.7726, test_f1: 0.6685
 epoch: 67, train_loss: 0.5839, test_loss: 0.8869, test_f1: 0.6620
 epoch: 68, train_loss: 0.5461, test_loss: 0.8769, test_f1: 0.6749
 epoch: 69, train_loss: 0.5553, test_loss: 0.9267, test_f1: 0.6513
 epoch: 70, train_loss: 0.5503, test_loss: 0.8803, test_f1: 0.6587
 epoch: 71, train_loss: 0.5633, test_loss: 0.9080, test_f1: 0.6336
 epoch: 72, train_loss: 0.5655, test_loss: 0.9828, test_f1: 0.6513
 epoch: 73, train_loss: 0.5440, test_loss: 0.8834, test_f1: 0.6749
 epoch: 74, train_loss: 0.5344, test_loss: 0.9592, test_f1: 0.6622
 epoch: 75, train_loss: 0.5265, test_loss: 0.9982, test_f1: 0.6651
 epoch: 76, train_loss: 0.5419, test_loss: 0.8764, test_f1: 0.6791
 epoch: 77, train_loss: 0.5512, test_loss: 0.8304, test_f1: 0.6781
 epoch: 78, train_loss: 0.5438, test_loss: 0.9271, test_f1: 0.6663
 epoch: 79, train_loss: 0.5334, test_loss: 0.8784, test_f1: 0.6479
 epoch: 80, train_loss: 0.5112, test_loss: 0.9117, test_f1: 0.6654
 epoch: 81, train_loss: 0.5263, test_loss: 0.9429, test_f1: 0.6652
 epoch: 82, train_loss: 0.5294, test_loss: 0.8731, test_f1: 0.6917
 epoch: 83, train_loss: 0.5224, test_loss: 0.9604, test_f1: 0.6605
 epoch: 84, train_loss: 0.4986, test_loss: 0.9459, test_f1: 0.6592
 epoch: 85, train_loss: 0.5205, test_loss: 0.9930, test_f1: 0.6622
 epoch: 86, train_loss: 0.5303, test_loss: 0.9867, test_f1: 0.6720
 epoch: 87, train_loss: 0.5348, test_loss: 1.1447, test_f1: 0.6317
 epoch: 88, train_loss: 0.5268, test_loss: 0.9623, test_f1: 0.6646
 epoch: 89, train_loss: 0.4932, test_loss: 0.9529, test_f1: 0.6575
 epoch: 90, train_loss: 0.5113, test_loss: 0.9706, test_f1: 0.6679
 epoch: 91, train_loss: 0.5051, test_loss: 1.0165, test_f1: 0.6439
 epoch: 92, train_loss: 0.4994, test_loss: 0.9745, test_f1: 0.6736
 epoch: 93, train_loss: 0.4932, test_loss: 1.0047, test_f1: 0.6705
 epoch: 94, train_loss: 0.4879, test_loss: 1.0521, test_f1: 0.6427
 epoch: 95, train_loss: 0.4947, test_loss: 0.9225, test_f1: 0.6616
 epoch: 96, train_loss: 0.4933, test_loss: 1.0009, test_f1: 0.6733
 epoch: 97, train_loss: 0.5034, test_loss: 0.9496, test_f1: 0.6672
 epoch: 98, train_loss: 0.5045, test_loss: 0.9037, test_f1: 0.6612
 epoch: 99, train_loss: 0.5098, test_loss: 0.9084, test_f1: 0.6867
##################ITERATION #2 ****************************************
 epoch: 0, train_loss: 1.1332, test_loss: 1.1219, test_f1: 0.3564
 epoch: 1, train_loss: 0.9981, test_loss: 1.0907, test_f1: 0.4869
 epoch: 2, train_loss: 0.9561, test_loss: 0.9940, test_f1: 0.5087
 epoch: 3, train_loss: 0.9464, test_loss: 0.9486, test_f1: 0.5157
 epoch: 4, train_loss: 0.9299, test_loss: 0.9543, test_f1: 0.5030
 epoch: 5, train_loss: 0.9205, test_loss: 1.0018, test_f1: 0.4935
 epoch: 6, train_loss: 0.8948, test_loss: 0.8874, test_f1: 0.5071
 epoch: 7, train_loss: 0.8714, test_loss: 1.0693, test_f1: 0.4738
 epoch: 8, train_loss: 0.8638, test_loss: 0.9690, test_f1: 0.5158
 epoch: 9, train_loss: 0.8520, test_loss: 0.9036, test_f1: 0.5401
 epoch: 10, train_loss: 0.8411, test_loss: 0.9461, test_f1: 0.5060
 epoch: 11, train_loss: 0.8403, test_loss: 1.0084, test_f1: 0.4996
 epoch: 12, train_loss: 0.8265, test_loss: 0.9111, test_f1: 0.5265
 epoch: 13, train_loss: 0.8048, test_loss: 0.9134, test_f1: 0.5418
 epoch: 14, train_loss: 0.7935, test_loss: 0.8853, test_f1: 0.5960
 epoch: 15, train_loss: 0.8017, test_loss: 0.8042, test_f1: 0.5604
 epoch: 16, train_loss: 0.7779, test_loss: 0.9400, test_f1: 0.5485
 epoch: 17, train_loss: 0.7856, test_loss: 1.0477, test_f1: 0.5678
 epoch: 18, train_loss: 0.7864, test_loss: 0.8893, test_f1: 0.5500
 epoch: 19, train_loss: 0.7933, test_loss: 1.0881, test_f1: 0.5023
 epoch: 20, train_loss: 0.7676, test_loss: 0.8904, test_f1: 0.5066
 epoch: 21, train_loss: 0.7628, test_loss: 0.8579, test_f1: 0.5475
 epoch: 22, train_loss: 0.7489, test_loss: 0.9461, test_f1: 0.5612
 epoch: 23, train_loss: 0.7708, test_loss: 0.9429, test_f1: 0.5408
 epoch: 24, train_loss: 0.7508, test_loss: 0.8443, test_f1: 0.5613
 epoch: 25, train_loss: 0.7312, test_loss: 0.9122, test_f1: 0.5695
 epoch: 26, train_loss: 0.7331, test_loss: 0.8778, test_f1: 0.6234
 epoch: 27, train_loss: 0.7412, test_loss: 1.0576, test_f1: 0.4873
 epoch: 28, train_loss: 0.7295, test_loss: 0.9027, test_f1: 0.5870
 epoch: 29, train_loss: 0.7066, test_loss: 0.8941, test_f1: 0.6304
 epoch: 30, train_loss: 0.7008, test_loss: 0.8450, test_f1: 0.6149
 epoch: 31, train_loss: 0.7208, test_loss: 0.8930, test_f1: 0.5634
 epoch: 32, train_loss: 0.7339, test_loss: 1.0084, test_f1: 0.5157
 epoch: 33, train_loss: 0.7100, test_loss: 0.8878, test_f1: 0.5854
 epoch: 34, train_loss: 0.6966, test_loss: 0.8498, test_f1: 0.5923
 epoch: 35, train_loss: 0.6876, test_loss: 0.9154, test_f1: 0.5790
 epoch: 36, train_loss: 0.7072, test_loss: 0.9069, test_f1: 0.6015
 epoch: 37, train_loss: 0.6845, test_loss: 0.8840, test_f1: 0.5977
 epoch: 38, train_loss: 0.6762, test_loss: 0.9577, test_f1: 0.5936
 epoch: 39, train_loss: 0.6857, test_loss: 0.9969, test_f1: 0.5713
 epoch: 40, train_loss: 0.6755, test_loss: 0.9888, test_f1: 0.5885
 epoch: 41, train_loss: 0.6938, test_loss: 0.9664, test_f1: 0.5493
 epoch: 42, train_loss: 0.6947, test_loss: 0.8954, test_f1: 0.6047
 epoch: 43, train_loss: 0.7160, test_loss: 0.9683, test_f1: 0.5765
 epoch: 44, train_loss: 0.6845, test_loss: 0.8660, test_f1: 0.6182
 epoch: 45, train_loss: 0.7045, test_loss: 0.8581, test_f1: 0.6054
 epoch: 46, train_loss: 0.6694, test_loss: 0.9601, test_f1: 0.5809
 epoch: 47, train_loss: 0.6544, test_loss: 0.9587, test_f1: 0.6017
 epoch: 48, train_loss: 0.6591, test_loss: 1.0337, test_f1: 0.5503
 epoch: 49, train_loss: 0.6553, test_loss: 0.9104, test_f1: 0.6210
 epoch: 50, train_loss: 0.6664, test_loss: 0.8484, test_f1: 0.6288
 epoch: 51, train_loss: 0.6670, test_loss: 0.8651, test_f1: 0.6187
 epoch: 52, train_loss: 0.6242, test_loss: 1.0490, test_f1: 0.5992
 epoch: 53, train_loss: 0.6162, test_loss: 0.8589, test_f1: 0.6449
 epoch: 54, train_loss: 0.6129, test_loss: 0.9183, test_f1: 0.6569
 epoch: 55, train_loss: 0.6210, test_loss: 0.8241, test_f1: 0.6273
 epoch: 56, train_loss: 0.6124, test_loss: 0.9575, test_f1: 0.6292
 epoch: 57, train_loss: 0.5970, test_loss: 0.9122, test_f1: 0.6270
 epoch: 58, train_loss: 0.6021, test_loss: 0.8435, test_f1: 0.6546
 epoch: 59, train_loss: 0.6034, test_loss: 0.7986, test_f1: 0.6428
 epoch: 60, train_loss: 0.5867, test_loss: 0.9564, test_f1: 0.6244
 epoch: 61, train_loss: 0.5901, test_loss: 0.9045, test_f1: 0.6116
 epoch: 62, train_loss: 0.6160, test_loss: 0.8372, test_f1: 0.6432
 epoch: 63, train_loss: 0.5814, test_loss: 1.0132, test_f1: 0.5970
 epoch: 64, train_loss: 0.5819, test_loss: 1.0076, test_f1: 0.6331
 epoch: 65, train_loss: 0.5684, test_loss: 0.8309, test_f1: 0.6237
 epoch: 66, train_loss: 0.5686, test_loss: 0.9044, test_f1: 0.6304
 epoch: 67, train_loss: 0.5750, test_loss: 0.9237, test_f1: 0.6290
 epoch: 68, train_loss: 0.5882, test_loss: 0.8475, test_f1: 0.6187
 epoch: 69, train_loss: 0.5683, test_loss: 0.8841, test_f1: 0.6033
 epoch: 70, train_loss: 0.5856, test_loss: 0.9804, test_f1: 0.6300
 epoch: 71, train_loss: 0.5717, test_loss: 1.0488, test_f1: 0.6067
 epoch: 72, train_loss: 0.5688, test_loss: 1.0237, test_f1: 0.6278
 epoch: 73, train_loss: 0.5449, test_loss: 0.9573, test_f1: 0.6527
 epoch: 74, train_loss: 0.5634, test_loss: 0.8420, test_f1: 0.6339
 epoch: 75, train_loss: 0.5819, test_loss: 0.8723, test_f1: 0.6394
 epoch: 76, train_loss: 0.5601, test_loss: 0.8619, test_f1: 0.6626
 epoch: 77, train_loss: 0.5506, test_loss: 0.8711, test_f1: 0.6402
 epoch: 78, train_loss: 0.5500, test_loss: 1.0699, test_f1: 0.6044
 epoch: 79, train_loss: 0.5425, test_loss: 0.9245, test_f1: 0.6676
 epoch: 80, train_loss: 0.5485, test_loss: 0.8851, test_f1: 0.6523
 epoch: 81, train_loss: 0.5449, test_loss: 0.8579, test_f1: 0.6637
 epoch: 82, train_loss: 0.5453, test_loss: 0.9255, test_f1: 0.6195
 epoch: 83, train_loss: 0.5476, test_loss: 0.9519, test_f1: 0.6166
 epoch: 84, train_loss: 0.5510, test_loss: 1.0668, test_f1: 0.6093
 epoch: 85, train_loss: 0.5455, test_loss: 1.0475, test_f1: 0.6155
 epoch: 86, train_loss: 0.5496, test_loss: 0.9810, test_f1: 0.6253
 epoch: 87, train_loss: 0.5247, test_loss: 0.8965, test_f1: 0.6572
 epoch: 88, train_loss: 0.5349, test_loss: 1.0092, test_f1: 0.6398
 epoch: 89, train_loss: 0.5333, test_loss: 1.0462, test_f1: 0.6309
 epoch: 90, train_loss: 0.5228, test_loss: 0.9321, test_f1: 0.6205
 epoch: 91, train_loss: 0.5306, test_loss: 0.9165, test_f1: 0.6712
 epoch: 92, train_loss: 0.5401, test_loss: 1.0006, test_f1: 0.6285
 epoch: 93, train_loss: 0.5337, test_loss: 1.0552, test_f1: 0.6055
 epoch: 94, train_loss: 0.5335, test_loss: 0.9403, test_f1: 0.6320
 epoch: 95, train_loss: 0.5416, test_loss: 0.9607, test_f1: 0.6296
 epoch: 96, train_loss: 0.5317, test_loss: 0.9275, test_f1: 0.6314
 epoch: 97, train_loss: 0.5336, test_loss: 0.8871, test_f1: 0.6449
 epoch: 98, train_loss: 0.5082, test_loss: 1.0717, test_f1: 0.6004
 epoch: 99, train_loss: 0.5034, test_loss: 0.9891, test_f1: 0.5977
##################ITERATION #3 ****************************************
 epoch: 0, train_loss: 1.1935, test_loss: 1.1385, test_f1: 0.3464
 epoch: 1, train_loss: 1.0443, test_loss: 1.2428, test_f1: 0.3841
 epoch: 2, train_loss: 1.0098, test_loss: 1.0584, test_f1: 0.4815
 epoch: 3, train_loss: 0.9642, test_loss: 0.9857, test_f1: 0.4727
 epoch: 4, train_loss: 0.9507, test_loss: 0.9496, test_f1: 0.4860
 epoch: 5, train_loss: 0.9122, test_loss: 1.0581, test_f1: 0.4393
 epoch: 6, train_loss: 0.9331, test_loss: 0.9055, test_f1: 0.5224
 epoch: 7, train_loss: 0.8918, test_loss: 1.0086, test_f1: 0.4487
 epoch: 8, train_loss: 0.8537, test_loss: 1.0076, test_f1: 0.4769
 epoch: 9, train_loss: 0.8377, test_loss: 0.9686, test_f1: 0.5076
 epoch: 10, train_loss: 0.8260, test_loss: 0.9652, test_f1: 0.5103
 epoch: 11, train_loss: 0.8194, test_loss: 1.0275, test_f1: 0.4801
 epoch: 12, train_loss: 0.8294, test_loss: 0.9195, test_f1: 0.5390
 epoch: 13, train_loss: 0.7977, test_loss: 0.8698, test_f1: 0.5611
 epoch: 14, train_loss: 0.8087, test_loss: 0.9662, test_f1: 0.5250
 epoch: 15, train_loss: 0.7885, test_loss: 0.9304, test_f1: 0.5199
 epoch: 16, train_loss: 0.8063, test_loss: 0.8216, test_f1: 0.5209
 epoch: 17, train_loss: 0.7613, test_loss: 0.7884, test_f1: 0.5753
 epoch: 18, train_loss: 0.7692, test_loss: 1.0106, test_f1: 0.4924
 epoch: 19, train_loss: 0.7698, test_loss: 0.8455, test_f1: 0.5507
 epoch: 20, train_loss: 0.7583, test_loss: 0.8470, test_f1: 0.5573
 epoch: 21, train_loss: 0.7493, test_loss: 0.7873, test_f1: 0.5458
 epoch: 22, train_loss: 0.7368, test_loss: 0.8946, test_f1: 0.5688
 epoch: 23, train_loss: 0.7679, test_loss: 0.7808, test_f1: 0.5493
 epoch: 24, train_loss: 0.7358, test_loss: 0.7826, test_f1: 0.6044
 epoch: 25, train_loss: 0.7427, test_loss: 1.2031, test_f1: 0.5009
 epoch: 26, train_loss: 0.7328, test_loss: 0.8844, test_f1: 0.5838
 epoch: 27, train_loss: 0.7321, test_loss: 0.8257, test_f1: 0.5982
 epoch: 28, train_loss: 0.7116, test_loss: 0.9225, test_f1: 0.5414
 epoch: 29, train_loss: 0.7202, test_loss: 0.9081, test_f1: 0.5664
 epoch: 30, train_loss: 0.7090, test_loss: 0.8239, test_f1: 0.5819
 epoch: 31, train_loss: 0.7021, test_loss: 1.8026, test_f1: 0.4195
 epoch: 32, train_loss: 0.7048, test_loss: 0.8419, test_f1: 0.6194
 epoch: 33, train_loss: 0.7064, test_loss: 0.8839, test_f1: 0.5595
 epoch: 34, train_loss: 0.6998, test_loss: 0.8232, test_f1: 0.6150
 epoch: 35, train_loss: 0.7050, test_loss: 0.9164, test_f1: 0.5748
 epoch: 36, train_loss: 0.6902, test_loss: 0.9116, test_f1: 0.5932
 epoch: 37, train_loss: 0.6916, test_loss: 0.8072, test_f1: 0.5795
 epoch: 38, train_loss: 0.6800, test_loss: 0.8927, test_f1: 0.5431
 epoch: 39, train_loss: 0.6911, test_loss: 0.8515, test_f1: 0.5886
 epoch: 40, train_loss: 0.6784, test_loss: 0.8999, test_f1: 0.6000
 epoch: 41, train_loss: 0.6636, test_loss: 0.8120, test_f1: 0.5714
 epoch: 42, train_loss: 0.6662, test_loss: 0.8447, test_f1: 0.6358
 epoch: 43, train_loss: 0.6696, test_loss: 0.9889, test_f1: 0.6426
 epoch: 44, train_loss: 0.6507, test_loss: 0.8161, test_f1: 0.6426
 epoch: 45, train_loss: 0.6492, test_loss: 0.8586, test_f1: 0.6315
 epoch: 46, train_loss: 0.6497, test_loss: 0.9795, test_f1: 0.6224
 epoch: 47, train_loss: 0.6602, test_loss: 0.8907, test_f1: 0.5604
 epoch: 48, train_loss: 0.6784, test_loss: 1.3244, test_f1: 0.5017
 epoch: 49, train_loss: 0.6624, test_loss: 0.9667, test_f1: 0.6028
 epoch: 50, train_loss: 0.6803, test_loss: 0.9694, test_f1: 0.6336
 epoch: 51, train_loss: 0.6382, test_loss: 0.8852, test_f1: 0.6158
 epoch: 52, train_loss: 0.6052, test_loss: 0.8830, test_f1: 0.6460
 epoch: 53, train_loss: 0.5975, test_loss: 0.8896, test_f1: 0.6048
 epoch: 54, train_loss: 0.5852, test_loss: 0.9003, test_f1: 0.6629
 epoch: 55, train_loss: 0.5984, test_loss: 0.8853, test_f1: 0.6120
 epoch: 56, train_loss: 0.5790, test_loss: 0.8665, test_f1: 0.6356
 epoch: 57, train_loss: 0.5781, test_loss: 0.9122, test_f1: 0.6512
 epoch: 58, train_loss: 0.5770, test_loss: 0.8290, test_f1: 0.6506
 epoch: 59, train_loss: 0.5863, test_loss: 0.9119, test_f1: 0.6529
 epoch: 60, train_loss: 0.5777, test_loss: 0.9108, test_f1: 0.6315
 epoch: 61, train_loss: 0.5766, test_loss: 0.8952, test_f1: 0.6540
 epoch: 62, train_loss: 0.5728, test_loss: 0.9049, test_f1: 0.6511
 epoch: 63, train_loss: 0.5690, test_loss: 0.8764, test_f1: 0.6494
 epoch: 64, train_loss: 0.5770, test_loss: 0.9590, test_f1: 0.6192
 epoch: 65, train_loss: 0.5712, test_loss: 0.9915, test_f1: 0.6212
 epoch: 66, train_loss: 0.5599, test_loss: 0.9420, test_f1: 0.6421
 epoch: 67, train_loss: 0.5611, test_loss: 0.9361, test_f1: 0.6496
 epoch: 68, train_loss: 0.5510, test_loss: 0.9214, test_f1: 0.6320
 epoch: 69, train_loss: 0.5569, test_loss: 0.9455, test_f1: 0.6264
 epoch: 70, train_loss: 0.5537, test_loss: 0.9003, test_f1: 0.6674
 epoch: 71, train_loss: 0.5682, test_loss: 0.9971, test_f1: 0.6405
 epoch: 72, train_loss: 0.5840, test_loss: 0.9736, test_f1: 0.6390
 epoch: 73, train_loss: 0.5706, test_loss: 0.9111, test_f1: 0.6569
 epoch: 74, train_loss: 0.5611, test_loss: 0.9389, test_f1: 0.6598
 epoch: 75, train_loss: 0.5508, test_loss: 0.8685, test_f1: 0.6577
 epoch: 76, train_loss: 0.5421, test_loss: 0.9192, test_f1: 0.6434
 epoch: 77, train_loss: 0.5536, test_loss: 0.9148, test_f1: 0.6668
 epoch: 78, train_loss: 0.5327, test_loss: 0.8976, test_f1: 0.6608
 epoch: 79, train_loss: 0.5349, test_loss: 0.9140, test_f1: 0.6210
 epoch: 80, train_loss: 0.5396, test_loss: 0.9904, test_f1: 0.6476
 epoch: 81, train_loss: 0.5301, test_loss: 0.9322, test_f1: 0.6683
 epoch: 82, train_loss: 0.5349, test_loss: 1.0038, test_f1: 0.6425
 epoch: 83, train_loss: 0.5331, test_loss: 0.9551, test_f1: 0.6452
 epoch: 84, train_loss: 0.5313, test_loss: 0.9167, test_f1: 0.6710
 epoch: 85, train_loss: 0.5166, test_loss: 0.9119, test_f1: 0.6562
 epoch: 86, train_loss: 0.5258, test_loss: 0.9698, test_f1: 0.6667
 epoch: 87, train_loss: 0.5186, test_loss: 0.9909, test_f1: 0.6519
 epoch: 88, train_loss: 0.5204, test_loss: 0.9262, test_f1: 0.6607
 epoch: 89, train_loss: 0.5325, test_loss: 0.9158, test_f1: 0.6415
 epoch: 90, train_loss: 0.5231, test_loss: 0.9171, test_f1: 0.6648
 epoch: 91, train_loss: 0.5338, test_loss: 0.8299, test_f1: 0.6595
 epoch: 92, train_loss: 0.5212, test_loss: 0.9739, test_f1: 0.6572
 epoch: 93, train_loss: 0.5104, test_loss: 0.9201, test_f1: 0.6439
 epoch: 94, train_loss: 0.5051, test_loss: 0.9642, test_f1: 0.6503
 epoch: 95, train_loss: 0.5136, test_loss: 0.8712, test_f1: 0.6558
 epoch: 96, train_loss: 0.5108, test_loss: 0.9049, test_f1: 0.6715
 epoch: 97, train_loss: 0.5160, test_loss: 0.9360, test_f1: 0.6393
 epoch: 98, train_loss: 0.5258, test_loss: 0.9306, test_f1: 0.6845
 epoch: 99, train_loss: 0.4985, test_loss: 0.9407, test_f1: 0.6567
##################ITERATION #4 ****************************************
 epoch: 0, train_loss: 1.1802, test_loss: 1.0994, test_f1: 0.3689
 epoch: 1, train_loss: 1.0117, test_loss: 1.1663, test_f1: 0.4225
 epoch: 2, train_loss: 0.9663, test_loss: 1.0875, test_f1: 0.5039
 epoch: 3, train_loss: 0.9471, test_loss: 1.0265, test_f1: 0.5047
 epoch: 4, train_loss: 0.9222, test_loss: 1.1462, test_f1: 0.4401
 epoch: 5, train_loss: 0.9107, test_loss: 1.0236, test_f1: 0.5449
 epoch: 6, train_loss: 0.8960, test_loss: 1.0914, test_f1: 0.4747
 epoch: 7, train_loss: 0.8925, test_loss: 1.2315, test_f1: 0.4402
 epoch: 8, train_loss: 0.8683, test_loss: 1.0933, test_f1: 0.4493
 epoch: 9, train_loss: 0.8591, test_loss: 1.0193, test_f1: 0.5251
 epoch: 10, train_loss: 0.8346, test_loss: 1.1313, test_f1: 0.4680
 epoch: 11, train_loss: 0.8289, test_loss: 0.9505, test_f1: 0.5449
 epoch: 12, train_loss: 0.8284, test_loss: 1.2038, test_f1: 0.4729
 epoch: 13, train_loss: 0.8150, test_loss: 0.9889, test_f1: 0.5226
 epoch: 14, train_loss: 0.8395, test_loss: 1.0562, test_f1: 0.4790
 epoch: 15, train_loss: 0.8139, test_loss: 0.8874, test_f1: 0.5359
 epoch: 16, train_loss: 0.8383, test_loss: 0.8872, test_f1: 0.5244
 epoch: 17, train_loss: 0.7998, test_loss: 0.8948, test_f1: 0.5433
 epoch: 18, train_loss: 0.7823, test_loss: 1.1368, test_f1: 0.4732
 epoch: 19, train_loss: 0.7900, test_loss: 0.9829, test_f1: 0.5128
 epoch: 20, train_loss: 0.7809, test_loss: 1.0035, test_f1: 0.5075
 epoch: 21, train_loss: 0.7726, test_loss: 0.9061, test_f1: 0.5319
 epoch: 22, train_loss: 0.7573, test_loss: 0.9111, test_f1: 0.5255
 epoch: 23, train_loss: 0.7438, test_loss: 0.9401, test_f1: 0.5174
 epoch: 24, train_loss: 0.7298, test_loss: 0.8785, test_f1: 0.5366
 epoch: 25, train_loss: 0.7396, test_loss: 0.8522, test_f1: 0.5713
 epoch: 26, train_loss: 0.7282, test_loss: 1.0193, test_f1: 0.5634
 epoch: 27, train_loss: 0.7482, test_loss: 0.9769, test_f1: 0.5631
 epoch: 28, train_loss: 0.7627, test_loss: 0.9451, test_f1: 0.5604
 epoch: 29, train_loss: 0.7307, test_loss: 0.8890, test_f1: 0.5477
 epoch: 30, train_loss: 0.7264, test_loss: 0.8701, test_f1: 0.6243
 epoch: 31, train_loss: 0.7118, test_loss: 0.9387, test_f1: 0.5289
 epoch: 32, train_loss: 0.6959, test_loss: 0.9554, test_f1: 0.5695
 epoch: 33, train_loss: 0.7133, test_loss: 0.9189, test_f1: 0.6104
 epoch: 34, train_loss: 0.7201, test_loss: 0.9455, test_f1: 0.5617
 epoch: 35, train_loss: 0.6995, test_loss: 0.9436, test_f1: 0.6026
 epoch: 36, train_loss: 0.6919, test_loss: 0.8608, test_f1: 0.6115
 epoch: 37, train_loss: 0.6897, test_loss: 1.1477, test_f1: 0.5083
 epoch: 38, train_loss: 0.6982, test_loss: 0.8043, test_f1: 0.5684
 epoch: 39, train_loss: 0.6734, test_loss: 0.9576, test_f1: 0.5655
 epoch: 40, train_loss: 0.6898, test_loss: 0.8652, test_f1: 0.6150
 epoch: 41, train_loss: 0.6797, test_loss: 0.9144, test_f1: 0.5844
 epoch: 42, train_loss: 0.6817, test_loss: 0.9304, test_f1: 0.5947
 epoch: 43, train_loss: 0.6786, test_loss: 0.8756, test_f1: 0.6167
 epoch: 44, train_loss: 0.6896, test_loss: 0.9422, test_f1: 0.5716
 epoch: 45, train_loss: 0.6614, test_loss: 0.9059, test_f1: 0.5694
 epoch: 46, train_loss: 0.6516, test_loss: 0.8200, test_f1: 0.5742
 epoch: 47, train_loss: 0.6496, test_loss: 0.9448, test_f1: 0.6269
 epoch: 48, train_loss: 0.6480, test_loss: 0.8532, test_f1: 0.6242
 epoch: 49, train_loss: 0.6313, test_loss: 0.9456, test_f1: 0.6007
 epoch: 50, train_loss: 0.6619, test_loss: 0.8836, test_f1: 0.6009
 epoch: 51, train_loss: 0.5997, test_loss: 0.8812, test_f1: 0.6035
 epoch: 52, train_loss: 0.5853, test_loss: 0.8389, test_f1: 0.6244
 epoch: 53, train_loss: 0.5878, test_loss: 0.8801, test_f1: 0.6393
 epoch: 54, train_loss: 0.5931, test_loss: 0.8295, test_f1: 0.6362
 epoch: 55, train_loss: 0.5801, test_loss: 0.9721, test_f1: 0.6108
 epoch: 56, train_loss: 0.5783, test_loss: 0.9203, test_f1: 0.6205
 epoch: 57, train_loss: 0.5810, test_loss: 0.9265, test_f1: 0.5981
 epoch: 58, train_loss: 0.5623, test_loss: 0.8816, test_f1: 0.6334
 epoch: 59, train_loss: 0.5814, test_loss: 0.9584, test_f1: 0.6119
 epoch: 60, train_loss: 0.5679, test_loss: 0.8730, test_f1: 0.6179
 epoch: 61, train_loss: 0.5613, test_loss: 0.9483, test_f1: 0.5792
 epoch: 62, train_loss: 0.5464, test_loss: 0.9067, test_f1: 0.6363
 epoch: 63, train_loss: 0.5531, test_loss: 0.9787, test_f1: 0.6133
 epoch: 64, train_loss: 0.5440, test_loss: 1.0747, test_f1: 0.6285
 epoch: 65, train_loss: 0.5654, test_loss: 0.7522, test_f1: 0.6553
 epoch: 66, train_loss: 0.5520, test_loss: 1.0252, test_f1: 0.5766
 epoch: 67, train_loss: 0.5538, test_loss: 0.9564, test_f1: 0.5906
 epoch: 68, train_loss: 0.5362, test_loss: 0.9446, test_f1: 0.6091
 epoch: 69, train_loss: 0.5245, test_loss: 0.8599, test_f1: 0.6263
 epoch: 70, train_loss: 0.5481, test_loss: 1.0436, test_f1: 0.6222
 epoch: 71, train_loss: 0.5455, test_loss: 0.9158, test_f1: 0.6241
 epoch: 72, train_loss: 0.5511, test_loss: 0.9752, test_f1: 0.6136
 epoch: 73, train_loss: 0.5377, test_loss: 0.8982, test_f1: 0.6280
 epoch: 74, train_loss: 0.5428, test_loss: 0.9180, test_f1: 0.6358
 epoch: 75, train_loss: 0.5238, test_loss: 0.9068, test_f1: 0.6093
 epoch: 76, train_loss: 0.5319, test_loss: 0.9694, test_f1: 0.6206
 epoch: 77, train_loss: 0.5303, test_loss: 0.9344, test_f1: 0.6259
 epoch: 78, train_loss: 0.5301, test_loss: 0.9355, test_f1: 0.6203
 epoch: 79, train_loss: 0.5374, test_loss: 0.9123, test_f1: 0.6419
 epoch: 80, train_loss: 0.5056, test_loss: 0.9190, test_f1: 0.6560
 epoch: 81, train_loss: 0.5220, test_loss: 1.3120, test_f1: 0.5576
 epoch: 82, train_loss: 0.5240, test_loss: 1.0981, test_f1: 0.6325
 epoch: 83, train_loss: 0.5234, test_loss: 1.0549, test_f1: 0.6341
 epoch: 84, train_loss: 0.5207, test_loss: 0.9665, test_f1: 0.6383
 epoch: 85, train_loss: 0.4858, test_loss: 0.9871, test_f1: 0.6245
 epoch: 86, train_loss: 0.5145, test_loss: 0.8205, test_f1: 0.6316
 epoch: 87, train_loss: 0.5132, test_loss: 1.0175, test_f1: 0.6216
 epoch: 88, train_loss: 0.5185, test_loss: 1.0245, test_f1: 0.6122
 epoch: 89, train_loss: 0.4957, test_loss: 1.0892, test_f1: 0.5946
 epoch: 90, train_loss: 0.4920, test_loss: 0.8740, test_f1: 0.6467
 epoch: 91, train_loss: 0.5115, test_loss: 0.9062, test_f1: 0.6406
 epoch: 92, train_loss: 0.4900, test_loss: 0.9915, test_f1: 0.6296
 epoch: 93, train_loss: 0.5089, test_loss: 0.9483, test_f1: 0.6328
 epoch: 94, train_loss: 0.4967, test_loss: 0.9756, test_f1: 0.6143
 epoch: 95, train_loss: 0.5131, test_loss: 0.9518, test_f1: 0.6108
 epoch: 96, train_loss: 0.5043, test_loss: 0.9768, test_f1: 0.6270
 epoch: 97, train_loss: 0.5045, test_loss: 0.9169, test_f1: 0.6229
 epoch: 98, train_loss: 0.4847, test_loss: 1.0510, test_f1: 0.6321
 epoch: 99, train_loss: 0.4691, test_loss: 0.9398, test_f1: 0.6364
##################ITERATION #5 ****************************************
 epoch: 0, train_loss: 1.1815, test_loss: 1.2605, test_f1: 0.3338
 epoch: 1, train_loss: 1.0157, test_loss: 1.2363, test_f1: 0.3886
 epoch: 2, train_loss: 0.9777, test_loss: 1.0742, test_f1: 0.4725
 epoch: 3, train_loss: 0.9496, test_loss: 1.0409, test_f1: 0.5065
 epoch: 4, train_loss: 0.9277, test_loss: 1.0153, test_f1: 0.5018
 epoch: 5, train_loss: 0.9091, test_loss: 1.0038, test_f1: 0.5282
 epoch: 6, train_loss: 0.8851, test_loss: 0.9639, test_f1: 0.5590
 epoch: 7, train_loss: 0.8951, test_loss: 1.6129, test_f1: 0.4176
 epoch: 8, train_loss: 0.8748, test_loss: 0.9491, test_f1: 0.5346
 epoch: 9, train_loss: 0.8532, test_loss: 1.1038, test_f1: 0.5189
 epoch: 10, train_loss: 0.8542, test_loss: 0.9286, test_f1: 0.5689
 epoch: 11, train_loss: 0.8289, test_loss: 1.0150, test_f1: 0.5143
 epoch: 12, train_loss: 0.8251, test_loss: 0.8911, test_f1: 0.5669
 epoch: 13, train_loss: 0.8240, test_loss: 0.9315, test_f1: 0.5231
 epoch: 14, train_loss: 0.8091, test_loss: 0.9506, test_f1: 0.6030
 epoch: 15, train_loss: 0.8181, test_loss: 0.9881, test_f1: 0.5458
 epoch: 16, train_loss: 0.7988, test_loss: 0.9444, test_f1: 0.6017
 epoch: 17, train_loss: 0.7797, test_loss: 0.9917, test_f1: 0.5659
 epoch: 18, train_loss: 0.7577, test_loss: 0.9407, test_f1: 0.5469
 epoch: 19, train_loss: 0.7506, test_loss: 0.9659, test_f1: 0.5600
 epoch: 20, train_loss: 0.7681, test_loss: 0.9366, test_f1: 0.5559
 epoch: 21, train_loss: 0.7536, test_loss: 1.0033, test_f1: 0.5640
 epoch: 22, train_loss: 0.7514, test_loss: 1.0054, test_f1: 0.5276
 epoch: 23, train_loss: 0.7471, test_loss: 1.1112, test_f1: 0.5461
 epoch: 24, train_loss: 0.7468, test_loss: 0.9585, test_f1: 0.5396
 epoch: 25, train_loss: 0.7231, test_loss: 1.0797, test_f1: 0.5782
 epoch: 26, train_loss: 0.7389, test_loss: 1.0946, test_f1: 0.5972
 epoch: 27, train_loss: 0.7110, test_loss: 0.9530, test_f1: 0.6008
 epoch: 28, train_loss: 0.7116, test_loss: 1.0837, test_f1: 0.5375
 epoch: 29, train_loss: 0.6986, test_loss: 1.0297, test_f1: 0.6091
 epoch: 30, train_loss: 0.7052, test_loss: 0.9102, test_f1: 0.5668
 epoch: 31, train_loss: 0.7061, test_loss: 0.9552, test_f1: 0.6065
 epoch: 32, train_loss: 0.6988, test_loss: 0.9972, test_f1: 0.5252
 epoch: 33, train_loss: 0.6965, test_loss: 1.0112, test_f1: 0.6083
 epoch: 34, train_loss: 0.7033, test_loss: 0.9493, test_f1: 0.5821
 epoch: 35, train_loss: 0.6819, test_loss: 0.9689, test_f1: 0.6625
 epoch: 36, train_loss: 0.6796, test_loss: 1.0838, test_f1: 0.6010
 epoch: 37, train_loss: 0.6653, test_loss: 1.0460, test_f1: 0.5899
 epoch: 38, train_loss: 0.6555, test_loss: 1.1869, test_f1: 0.5669
 epoch: 39, train_loss: 0.6847, test_loss: 0.9563, test_f1: 0.5976
 epoch: 40, train_loss: 0.6858, test_loss: 0.9403, test_f1: 0.6241
 epoch: 41, train_loss: 0.6660, test_loss: 1.1268, test_f1: 0.5724
 epoch: 42, train_loss: 0.6572, test_loss: 0.8944, test_f1: 0.6270
 epoch: 43, train_loss: 0.6716, test_loss: 1.0274, test_f1: 0.6030
 epoch: 44, train_loss: 0.6666, test_loss: 0.9234, test_f1: 0.6310
 epoch: 45, train_loss: 0.6689, test_loss: 0.8679, test_f1: 0.6415
 epoch: 46, train_loss: 0.6512, test_loss: 1.1885, test_f1: 0.5667
 epoch: 47, train_loss: 0.6402, test_loss: 0.9493, test_f1: 0.6324
 epoch: 48, train_loss: 0.6563, test_loss: 1.0527, test_f1: 0.5604
 epoch: 49, train_loss: 0.6509, test_loss: 0.9600, test_f1: 0.6458
 epoch: 50, train_loss: 0.6366, test_loss: 1.0243, test_f1: 0.5957
 epoch: 51, train_loss: 0.6117, test_loss: 0.9793, test_f1: 0.6513
 epoch: 52, train_loss: 0.5917, test_loss: 0.9860, test_f1: 0.6405
 epoch: 53, train_loss: 0.5807, test_loss: 0.9454, test_f1: 0.6421
 epoch: 54, train_loss: 0.5695, test_loss: 1.0135, test_f1: 0.6525
 epoch: 55, train_loss: 0.5746, test_loss: 0.9812, test_f1: 0.6461
 epoch: 56, train_loss: 0.5714, test_loss: 0.9809, test_f1: 0.6476
 epoch: 57, train_loss: 0.5589, test_loss: 0.9754, test_f1: 0.6655
 epoch: 58, train_loss: 0.5616, test_loss: 0.9845, test_f1: 0.6382
 epoch: 59, train_loss: 0.5647, test_loss: 1.0451, test_f1: 0.6518
 epoch: 60, train_loss: 0.5668, test_loss: 1.0053, test_f1: 0.6686
 epoch: 61, train_loss: 0.5518, test_loss: 0.9919, test_f1: 0.6369
 epoch: 62, train_loss: 0.5388, test_loss: 0.9579, test_f1: 0.6618
 epoch: 63, train_loss: 0.5619, test_loss: 0.9844, test_f1: 0.6606
 epoch: 64, train_loss: 0.5787, test_loss: 0.9750, test_f1: 0.6651
 epoch: 65, train_loss: 0.5682, test_loss: 0.9982, test_f1: 0.6633
 epoch: 66, train_loss: 0.5389, test_loss: 1.0285, test_f1: 0.6616
 epoch: 67, train_loss: 0.5502, test_loss: 0.9652, test_f1: 0.6599
 epoch: 68, train_loss: 0.5501, test_loss: 1.0374, test_f1: 0.6172
 epoch: 69, train_loss: 0.5613, test_loss: 1.0555, test_f1: 0.6592
 epoch: 70, train_loss: 0.5533, test_loss: 1.0433, test_f1: 0.6657
 epoch: 71, train_loss: 0.5493, test_loss: 0.9545, test_f1: 0.6496
 epoch: 72, train_loss: 0.5305, test_loss: 0.9884, test_f1: 0.6755
 epoch: 73, train_loss: 0.5431, test_loss: 0.9496, test_f1: 0.6742
 epoch: 74, train_loss: 0.5376, test_loss: 1.0520, test_f1: 0.6629
 epoch: 75, train_loss: 0.5443, test_loss: 0.9860, test_f1: 0.6608
 epoch: 76, train_loss: 0.5432, test_loss: 0.9666, test_f1: 0.6768
 epoch: 77, train_loss: 0.5344, test_loss: 0.9743, test_f1: 0.6477
 epoch: 78, train_loss: 0.5234, test_loss: 0.9370, test_f1: 0.6827
 epoch: 79, train_loss: 0.5373, test_loss: 1.1441, test_f1: 0.6421
 epoch: 80, train_loss: 0.5351, test_loss: 0.9765, test_f1: 0.6567
 epoch: 81, train_loss: 0.5258, test_loss: 0.9679, test_f1: 0.6555
 epoch: 82, train_loss: 0.5375, test_loss: 1.0290, test_f1: 0.6657
 epoch: 83, train_loss: 0.5458, test_loss: 0.9849, test_f1: 0.6516
 epoch: 84, train_loss: 0.5073, test_loss: 1.0444, test_f1: 0.6628
 epoch: 85, train_loss: 0.5300, test_loss: 1.0733, test_f1: 0.6692
 epoch: 86, train_loss: 0.5365, test_loss: 1.0709, test_f1: 0.6490
 epoch: 87, train_loss: 0.5285, test_loss: 0.9826, test_f1: 0.7068
 epoch: 88, train_loss: 0.5044, test_loss: 1.0065, test_f1: 0.6734
 epoch: 89, train_loss: 0.4985, test_loss: 0.9868, test_f1: 0.6969
 epoch: 90, train_loss: 0.4949, test_loss: 1.0074, test_f1: 0.6934
 epoch: 91, train_loss: 0.5088, test_loss: 1.0482, test_f1: 0.6732
 epoch: 92, train_loss: 0.5001, test_loss: 0.9747, test_f1: 0.6914
 epoch: 93, train_loss: 0.5045, test_loss: 1.0560, test_f1: 0.6679
 epoch: 94, train_loss: 0.5108, test_loss: 1.0308, test_f1: 0.6812
 epoch: 95, train_loss: 0.5045, test_loss: 0.9845, test_f1: 0.6978
 epoch: 96, train_loss: 0.5015, test_loss: 1.0067, test_f1: 0.6894
 epoch: 97, train_loss: 0.4872, test_loss: 0.9770, test_f1: 0.6801
 epoch: 98, train_loss: 0.5144, test_loss: 0.9720, test_f1: 0.6912
 epoch: 99, train_loss: 0.4999, test_loss: 1.0394, test_f1: 0.6845
##################ITERATION #6 ****************************************
 epoch: 0, train_loss: 1.2406, test_loss: 1.1398, test_f1: 0.3347
 epoch: 1, train_loss: 1.0246, test_loss: 1.0546, test_f1: 0.4016
 epoch: 2, train_loss: 0.9737, test_loss: 1.0586, test_f1: 0.4192
 epoch: 3, train_loss: 0.9672, test_loss: 1.0873, test_f1: 0.4410
 epoch: 4, train_loss: 0.9534, test_loss: 1.0713, test_f1: 0.4654
 epoch: 5, train_loss: 0.9279, test_loss: 0.9684, test_f1: 0.5469
 epoch: 6, train_loss: 0.9224, test_loss: 0.9796, test_f1: 0.4777
 epoch: 7, train_loss: 0.8896, test_loss: 1.1982, test_f1: 0.4562
 epoch: 8, train_loss: 0.9070, test_loss: 1.0837, test_f1: 0.4623
 epoch: 9, train_loss: 0.8632, test_loss: 1.0982, test_f1: 0.4551
 epoch: 10, train_loss: 0.8609, test_loss: 0.9473, test_f1: 0.5784
 epoch: 11, train_loss: 0.8461, test_loss: 1.0802, test_f1: 0.4777
 epoch: 12, train_loss: 0.8240, test_loss: 1.0579, test_f1: 0.4651
 epoch: 13, train_loss: 0.8444, test_loss: 0.9690, test_f1: 0.5516
 epoch: 14, train_loss: 0.8106, test_loss: 1.0244, test_f1: 0.5262
 epoch: 15, train_loss: 0.8171, test_loss: 1.0986, test_f1: 0.4955
 epoch: 16, train_loss: 0.7881, test_loss: 0.9896, test_f1: 0.5276
 epoch: 17, train_loss: 0.7934, test_loss: 0.9242, test_f1: 0.5696
 epoch: 18, train_loss: 0.7792, test_loss: 0.9991, test_f1: 0.5539
 epoch: 19, train_loss: 0.7919, test_loss: 1.0554, test_f1: 0.5257
 epoch: 20, train_loss: 0.7832, test_loss: 0.9670, test_f1: 0.5424
 epoch: 21, train_loss: 0.7848, test_loss: 0.9964, test_f1: 0.5611
 epoch: 22, train_loss: 0.7668, test_loss: 1.0225, test_f1: 0.5551
 epoch: 23, train_loss: 0.7492, test_loss: 1.0244, test_f1: 0.5911
 epoch: 24, train_loss: 0.7748, test_loss: 0.9384, test_f1: 0.5502
 epoch: 25, train_loss: 0.7657, test_loss: 1.0871, test_f1: 0.5293
 epoch: 26, train_loss: 0.7643, test_loss: 0.9904, test_f1: 0.5647
 epoch: 27, train_loss: 0.7353, test_loss: 1.0584, test_f1: 0.5622
 epoch: 28, train_loss: 0.7393, test_loss: 1.0559, test_f1: 0.5471
 epoch: 29, train_loss: 0.7444, test_loss: 1.2407, test_f1: 0.5493
 epoch: 30, train_loss: 0.7452, test_loss: 1.1060, test_f1: 0.5544
 epoch: 31, train_loss: 0.7341, test_loss: 0.9636, test_f1: 0.6156
 epoch: 32, train_loss: 0.7036, test_loss: 1.0806, test_f1: 0.5249
 epoch: 33, train_loss: 0.7342, test_loss: 1.0094, test_f1: 0.5951
 epoch: 34, train_loss: 0.7128, test_loss: 1.0423, test_f1: 0.5533
 epoch: 35, train_loss: 0.7083, test_loss: 1.0356, test_f1: 0.5439
 epoch: 36, train_loss: 0.7067, test_loss: 0.9767, test_f1: 0.6190
 epoch: 37, train_loss: 0.7059, test_loss: 1.0199, test_f1: 0.5856
 epoch: 38, train_loss: 0.7170, test_loss: 1.0011, test_f1: 0.5940
 epoch: 39, train_loss: 0.7163, test_loss: 1.0398, test_f1: 0.5982
 epoch: 40, train_loss: 0.6830, test_loss: 1.1058, test_f1: 0.5840
 epoch: 41, train_loss: 0.6949, test_loss: 1.0826, test_f1: 0.6050
 epoch: 42, train_loss: 0.6771, test_loss: 1.0858, test_f1: 0.5781
 epoch: 43, train_loss: 0.6978, test_loss: 0.9783, test_f1: 0.5525
 epoch: 44, train_loss: 0.6896, test_loss: 1.1210, test_f1: 0.6108
 epoch: 45, train_loss: 0.6713, test_loss: 1.0670, test_f1: 0.6337
 epoch: 46, train_loss: 0.6764, test_loss: 1.0933, test_f1: 0.5568
 epoch: 47, train_loss: 0.6618, test_loss: 1.1899, test_f1: 0.6034
 epoch: 48, train_loss: 0.6861, test_loss: 1.0299, test_f1: 0.6227
 epoch: 49, train_loss: 0.6613, test_loss: 1.2844, test_f1: 0.5753
 epoch: 50, train_loss: 0.6492, test_loss: 1.0033, test_f1: 0.6238
 epoch: 51, train_loss: 0.6397, test_loss: 1.1374, test_f1: 0.5835
 epoch: 52, train_loss: 0.6143, test_loss: 1.0523, test_f1: 0.6074
 epoch: 53, train_loss: 0.6028, test_loss: 1.0645, test_f1: 0.6081
 epoch: 54, train_loss: 0.6005, test_loss: 1.0566, test_f1: 0.6135
 epoch: 55, train_loss: 0.6106, test_loss: 0.9841, test_f1: 0.6284
 epoch: 56, train_loss: 0.6046, test_loss: 1.0559, test_f1: 0.6101
 epoch: 57, train_loss: 0.6093, test_loss: 1.0559, test_f1: 0.5922
 epoch: 58, train_loss: 0.6026, test_loss: 1.0482, test_f1: 0.6196
 epoch: 59, train_loss: 0.6046, test_loss: 1.1043, test_f1: 0.5993
 epoch: 60, train_loss: 0.5919, test_loss: 1.1556, test_f1: 0.6005
 epoch: 61, train_loss: 0.5870, test_loss: 1.0641, test_f1: 0.6360
 epoch: 62, train_loss: 0.5670, test_loss: 1.1067, test_f1: 0.5912
 epoch: 63, train_loss: 0.5667, test_loss: 1.1018, test_f1: 0.6062
 epoch: 64, train_loss: 0.5672, test_loss: 1.0408, test_f1: 0.6256
 epoch: 65, train_loss: 0.5963, test_loss: 1.1421, test_f1: 0.6053
 epoch: 66, train_loss: 0.5883, test_loss: 1.0203, test_f1: 0.6155
 epoch: 67, train_loss: 0.5592, test_loss: 1.1101, test_f1: 0.6023
 epoch: 68, train_loss: 0.5754, test_loss: 1.0838, test_f1: 0.5678
 epoch: 69, train_loss: 0.5605, test_loss: 1.1900, test_f1: 0.6137
 epoch: 70, train_loss: 0.5748, test_loss: 1.1010, test_f1: 0.6265
 epoch: 71, train_loss: 0.5572, test_loss: 1.1084, test_f1: 0.6273
 epoch: 72, train_loss: 0.5521, test_loss: 1.0664, test_f1: 0.6085
 epoch: 73, train_loss: 0.5878, test_loss: 1.0938, test_f1: 0.6381
 epoch: 74, train_loss: 0.5738, test_loss: 1.1940, test_f1: 0.5824
 epoch: 75, train_loss: 0.5396, test_loss: 1.1785, test_f1: 0.6248
 epoch: 76, train_loss: 0.5455, test_loss: 1.0742, test_f1: 0.6393
 epoch: 77, train_loss: 0.5462, test_loss: 1.1321, test_f1: 0.6356
 epoch: 78, train_loss: 0.5611, test_loss: 1.1417, test_f1: 0.6192
 epoch: 79, train_loss: 0.5633, test_loss: 1.0967, test_f1: 0.6023
 epoch: 80, train_loss: 0.5418, test_loss: 1.1462, test_f1: 0.6039
 epoch: 81, train_loss: 0.5581, test_loss: 1.1335, test_f1: 0.6453
 epoch: 82, train_loss: 0.5337, test_loss: 1.1084, test_f1: 0.6163
 epoch: 83, train_loss: 0.5433, test_loss: 1.1218, test_f1: 0.6123
 epoch: 84, train_loss: 0.5305, test_loss: 1.1999, test_f1: 0.5984
 epoch: 85, train_loss: 0.5285, test_loss: 1.1562, test_f1: 0.6073
 epoch: 86, train_loss: 0.5478, test_loss: 1.2336, test_f1: 0.5895
 epoch: 87, train_loss: 0.5266, test_loss: 1.1937, test_f1: 0.6088
 epoch: 88, train_loss: 0.5274, test_loss: 1.2090, test_f1: 0.6118
 epoch: 89, train_loss: 0.5274, test_loss: 1.1588, test_f1: 0.6081
 epoch: 90, train_loss: 0.5417, test_loss: 1.2003, test_f1: 0.5913
 epoch: 91, train_loss: 0.5264, test_loss: 1.2935, test_f1: 0.5858
 epoch: 92, train_loss: 0.5259, test_loss: 1.0818, test_f1: 0.6325
 epoch: 93, train_loss: 0.5163, test_loss: 1.1505, test_f1: 0.6402
 epoch: 94, train_loss: 0.5208, test_loss: 1.3132, test_f1: 0.5778
 epoch: 95, train_loss: 0.5199, test_loss: 1.2584, test_f1: 0.5817
 epoch: 96, train_loss: 0.5294, test_loss: 1.2229, test_f1: 0.5930
 epoch: 97, train_loss: 0.5129, test_loss: 1.2726, test_f1: 0.6123
 epoch: 98, train_loss: 0.5172, test_loss: 1.1221, test_f1: 0.5951
 epoch: 99, train_loss: 0.5066, test_loss: 1.2763, test_f1: 0.5767
##################ITERATION #7 ****************************************
 epoch: 0, train_loss: 1.1332, test_loss: 1.0658, test_f1: 0.3936
 epoch: 1, train_loss: 0.9762, test_loss: 1.0306, test_f1: 0.5360
 epoch: 2, train_loss: 0.9500, test_loss: 1.0876, test_f1: 0.4484
 epoch: 3, train_loss: 0.9216, test_loss: 0.9958, test_f1: 0.5211
 epoch: 4, train_loss: 0.8912, test_loss: 1.0211, test_f1: 0.4883
 epoch: 5, train_loss: 0.8838, test_loss: 0.9652, test_f1: 0.5216
 epoch: 6, train_loss: 0.8685, test_loss: 0.9577, test_f1: 0.5330
 epoch: 7, train_loss: 0.8542, test_loss: 1.2343, test_f1: 0.4884
 epoch: 8, train_loss: 0.8541, test_loss: 0.9594, test_f1: 0.5281
 epoch: 9, train_loss: 0.8349, test_loss: 0.9269, test_f1: 0.5560
 epoch: 10, train_loss: 0.8286, test_loss: 0.9599, test_f1: 0.5507
 epoch: 11, train_loss: 0.8219, test_loss: 0.9087, test_f1: 0.5598
 epoch: 12, train_loss: 0.8004, test_loss: 0.9874, test_f1: 0.4981
 epoch: 13, train_loss: 0.7994, test_loss: 0.9139, test_f1: 0.5835
 epoch: 14, train_loss: 0.8042, test_loss: 0.8939, test_f1: 0.5915
 epoch: 15, train_loss: 0.7779, test_loss: 0.8833, test_f1: 0.5948
 epoch: 16, train_loss: 0.7931, test_loss: 1.0034, test_f1: 0.5581
 epoch: 17, train_loss: 0.7623, test_loss: 0.8816, test_f1: 0.5703
 epoch: 18, train_loss: 0.7636, test_loss: 0.9188, test_f1: 0.5324
 epoch: 19, train_loss: 0.7792, test_loss: 0.8922, test_f1: 0.5576
 epoch: 20, train_loss: 0.7718, test_loss: 0.9634, test_f1: 0.5277
 epoch: 21, train_loss: 0.7571, test_loss: 0.8939, test_f1: 0.6034
 epoch: 22, train_loss: 0.7393, test_loss: 0.9102, test_f1: 0.5650
 epoch: 23, train_loss: 0.7274, test_loss: 0.8598, test_f1: 0.5432
 epoch: 24, train_loss: 0.7274, test_loss: 0.9102, test_f1: 0.5572
 epoch: 25, train_loss: 0.7270, test_loss: 0.8866, test_f1: 0.5353
 epoch: 26, train_loss: 0.7182, test_loss: 0.9902, test_f1: 0.5532
 epoch: 27, train_loss: 0.7306, test_loss: 0.9308, test_f1: 0.5630
 epoch: 28, train_loss: 0.7100, test_loss: 0.9122, test_f1: 0.5659
 epoch: 29, train_loss: 0.7014, test_loss: 0.8910, test_f1: 0.6183
 epoch: 30, train_loss: 0.6945, test_loss: 0.8794, test_f1: 0.6002
 epoch: 31, train_loss: 0.6821, test_loss: 0.9231, test_f1: 0.6077
 epoch: 32, train_loss: 0.7013, test_loss: 0.8782, test_f1: 0.5692
 epoch: 33, train_loss: 0.7034, test_loss: 0.8593, test_f1: 0.6154
 epoch: 34, train_loss: 0.6829, test_loss: 0.8962, test_f1: 0.5937
 epoch: 35, train_loss: 0.6912, test_loss: 0.8498, test_f1: 0.5936
 epoch: 36, train_loss: 0.6968, test_loss: 0.8507, test_f1: 0.5975
 epoch: 37, train_loss: 0.6911, test_loss: 0.7862, test_f1: 0.5977
 epoch: 38, train_loss: 0.6801, test_loss: 0.9183, test_f1: 0.5945
 epoch: 39, train_loss: 0.6777, test_loss: 0.9263, test_f1: 0.6019
 epoch: 40, train_loss: 0.6707, test_loss: 0.8419, test_f1: 0.6099
 epoch: 41, train_loss: 0.6704, test_loss: 0.8597, test_f1: 0.6013
 epoch: 42, train_loss: 0.6710, test_loss: 0.9942, test_f1: 0.5461
 epoch: 43, train_loss: 0.6536, test_loss: 0.8313, test_f1: 0.6184
 epoch: 44, train_loss: 0.6714, test_loss: 0.8516, test_f1: 0.6239
 epoch: 45, train_loss: 0.6470, test_loss: 0.8832, test_f1: 0.6171
 epoch: 46, train_loss: 0.6637, test_loss: 0.8719, test_f1: 0.6139
 epoch: 47, train_loss: 0.6419, test_loss: 0.8567, test_f1: 0.6253
 epoch: 48, train_loss: 0.6148, test_loss: 0.9594, test_f1: 0.5849
 epoch: 49, train_loss: 0.6432, test_loss: 0.8605, test_f1: 0.6319
 epoch: 50, train_loss: 0.6425, test_loss: 0.8913, test_f1: 0.6353
 epoch: 51, train_loss: 0.6152, test_loss: 0.8630, test_f1: 0.6459
 epoch: 52, train_loss: 0.5852, test_loss: 0.9191, test_f1: 0.6126
 epoch: 53, train_loss: 0.5770, test_loss: 0.9207, test_f1: 0.6382
 epoch: 54, train_loss: 0.5850, test_loss: 0.9229, test_f1: 0.6293
 epoch: 55, train_loss: 0.5812, test_loss: 0.8428, test_f1: 0.6445
 epoch: 56, train_loss: 0.5845, test_loss: 0.8590, test_f1: 0.6014
 epoch: 57, train_loss: 0.5726, test_loss: 0.9158, test_f1: 0.6517
 epoch: 58, train_loss: 0.5592, test_loss: 0.8890, test_f1: 0.6478
 epoch: 59, train_loss: 0.5628, test_loss: 0.9404, test_f1: 0.6426
 epoch: 60, train_loss: 0.5640, test_loss: 0.8444, test_f1: 0.6651
 epoch: 61, train_loss: 0.5434, test_loss: 0.9131, test_f1: 0.6506
 epoch: 62, train_loss: 0.5410, test_loss: 0.8575, test_f1: 0.6510
 epoch: 63, train_loss: 0.5447, test_loss: 0.8328, test_f1: 0.6708
 epoch: 64, train_loss: 0.5430, test_loss: 0.9049, test_f1: 0.6343
 epoch: 65, train_loss: 0.5374, test_loss: 0.9719, test_f1: 0.6148
 epoch: 66, train_loss: 0.5441, test_loss: 0.9382, test_f1: 0.6440
 epoch: 67, train_loss: 0.5410, test_loss: 0.9751, test_f1: 0.6196
 epoch: 68, train_loss: 0.5328, test_loss: 0.9970, test_f1: 0.6336
 epoch: 69, train_loss: 0.5349, test_loss: 0.9679, test_f1: 0.6298
 epoch: 70, train_loss: 0.5273, test_loss: 0.9606, test_f1: 0.6375
 epoch: 71, train_loss: 0.5155, test_loss: 0.8909, test_f1: 0.6621
 epoch: 72, train_loss: 0.5365, test_loss: 0.9247, test_f1: 0.6357
 epoch: 73, train_loss: 0.5230, test_loss: 0.9314, test_f1: 0.6535
 epoch: 74, train_loss: 0.5367, test_loss: 0.9478, test_f1: 0.6329
 epoch: 75, train_loss: 0.5182, test_loss: 0.9654, test_f1: 0.6330
 epoch: 76, train_loss: 0.5081, test_loss: 0.9500, test_f1: 0.6386
 epoch: 77, train_loss: 0.5173, test_loss: 0.9421, test_f1: 0.6420
 epoch: 78, train_loss: 0.4970, test_loss: 1.0245, test_f1: 0.5725
 epoch: 79, train_loss: 0.5230, test_loss: 1.1088, test_f1: 0.6170
 epoch: 80, train_loss: 0.5092, test_loss: 0.9209, test_f1: 0.6591
 epoch: 81, train_loss: 0.5162, test_loss: 0.9544, test_f1: 0.6319
 epoch: 82, train_loss: 0.5115, test_loss: 0.9154, test_f1: 0.6593
 epoch: 83, train_loss: 0.4977, test_loss: 0.9379, test_f1: 0.6256
 epoch: 84, train_loss: 0.5185, test_loss: 0.9588, test_f1: 0.6263
 epoch: 85, train_loss: 0.4879, test_loss: 0.8721, test_f1: 0.6226
 epoch: 86, train_loss: 0.5066, test_loss: 1.0642, test_f1: 0.5948
 epoch: 87, train_loss: 0.4857, test_loss: 0.8504, test_f1: 0.6587
 epoch: 88, train_loss: 0.4855, test_loss: 0.9634, test_f1: 0.6548
 epoch: 89, train_loss: 0.4997, test_loss: 0.8385, test_f1: 0.6597
 epoch: 90, train_loss: 0.4957, test_loss: 0.9086, test_f1: 0.6269
 epoch: 91, train_loss: 0.4973, test_loss: 0.9271, test_f1: 0.6309
 epoch: 92, train_loss: 0.4874, test_loss: 0.9124, test_f1: 0.6726
 epoch: 93, train_loss: 0.4941, test_loss: 0.8700, test_f1: 0.6381
 epoch: 94, train_loss: 0.4752, test_loss: 0.9217, test_f1: 0.6501
 epoch: 95, train_loss: 0.4649, test_loss: 0.9117, test_f1: 0.6106
 epoch: 96, train_loss: 0.4868, test_loss: 0.8555, test_f1: 0.6572
 epoch: 97, train_loss: 0.4773, test_loss: 0.8795, test_f1: 0.6639
 epoch: 98, train_loss: 0.4658, test_loss: 1.0525, test_f1: 0.6147
 epoch: 99, train_loss: 0.4755, test_loss: 0.9687, test_f1: 0.6143
##################ITERATION #8 ****************************************
 epoch: 0, train_loss: 1.2087, test_loss: 1.0954, test_f1: 0.3748
 epoch: 1, train_loss: 1.0319, test_loss: 1.0514, test_f1: 0.4557
 epoch: 2, train_loss: 0.9804, test_loss: 1.3493, test_f1: 0.3431
 epoch: 3, train_loss: 0.9623, test_loss: 1.0182, test_f1: 0.4603
 epoch: 4, train_loss: 0.9457, test_loss: 0.9921, test_f1: 0.5070
 epoch: 5, train_loss: 0.9164, test_loss: 1.0601, test_f1: 0.5214
 epoch: 6, train_loss: 0.8998, test_loss: 1.0805, test_f1: 0.4995
 epoch: 7, train_loss: 0.8759, test_loss: 0.8942, test_f1: 0.5278
 epoch: 8, train_loss: 0.8565, test_loss: 0.9309, test_f1: 0.5138
 epoch: 9, train_loss: 0.8521, test_loss: 1.2229, test_f1: 0.4618
 epoch: 10, train_loss: 0.8488, test_loss: 0.9716, test_f1: 0.5037
 epoch: 11, train_loss: 0.8344, test_loss: 0.9389, test_f1: 0.5264
 epoch: 12, train_loss: 0.8323, test_loss: 0.8637, test_f1: 0.5948
 epoch: 13, train_loss: 0.8264, test_loss: 1.1216, test_f1: 0.5065
 epoch: 14, train_loss: 0.8254, test_loss: 0.9164, test_f1: 0.5296
 epoch: 15, train_loss: 0.7986, test_loss: 0.9827, test_f1: 0.5452
 epoch: 16, train_loss: 0.7802, test_loss: 0.8813, test_f1: 0.5504
 epoch: 17, train_loss: 0.7768, test_loss: 0.9369, test_f1: 0.5555
 epoch: 18, train_loss: 0.7767, test_loss: 0.9263, test_f1: 0.5497
 epoch: 19, train_loss: 0.7759, test_loss: 0.9498, test_f1: 0.5248
 epoch: 20, train_loss: 0.7688, test_loss: 0.8584, test_f1: 0.6187
 epoch: 21, train_loss: 0.7707, test_loss: 0.9355, test_f1: 0.6088
 epoch: 22, train_loss: 0.7633, test_loss: 0.8872, test_f1: 0.5424
 epoch: 23, train_loss: 0.7536, test_loss: 0.9317, test_f1: 0.5015
 epoch: 24, train_loss: 0.7723, test_loss: 1.1542, test_f1: 0.4526
 epoch: 25, train_loss: 0.7676, test_loss: 0.9934, test_f1: 0.5107
 epoch: 26, train_loss: 0.7772, test_loss: 0.8710, test_f1: 0.5878
 epoch: 27, train_loss: 0.7495, test_loss: 0.8740, test_f1: 0.5353
 epoch: 28, train_loss: 0.7483, test_loss: 1.1982, test_f1: 0.4710
 epoch: 29, train_loss: 0.7408, test_loss: 0.9874, test_f1: 0.5330
 epoch: 30, train_loss: 0.7373, test_loss: 0.8181, test_f1: 0.6270
 epoch: 31, train_loss: 0.7324, test_loss: 0.9273, test_f1: 0.5644
 epoch: 32, train_loss: 0.6885, test_loss: 0.9521, test_f1: 0.5693
 epoch: 33, train_loss: 0.7339, test_loss: 0.8744, test_f1: 0.5868
 epoch: 34, train_loss: 0.6967, test_loss: 0.9095, test_f1: 0.6161
 epoch: 35, train_loss: 0.7293, test_loss: 0.8911, test_f1: 0.5793
 epoch: 36, train_loss: 0.7213, test_loss: 0.9011, test_f1: 0.5616
 epoch: 37, train_loss: 0.7387, test_loss: 0.9066, test_f1: 0.5685
 epoch: 38, train_loss: 0.6964, test_loss: 0.7805, test_f1: 0.6135
 epoch: 39, train_loss: 0.6770, test_loss: 0.8658, test_f1: 0.5733
 epoch: 40, train_loss: 0.6654, test_loss: 0.9053, test_f1: 0.6055
 epoch: 41, train_loss: 0.7029, test_loss: 0.8824, test_f1: 0.5850
 epoch: 42, train_loss: 0.6949, test_loss: 0.9989, test_f1: 0.5037
 epoch: 43, train_loss: 0.6676, test_loss: 0.8948, test_f1: 0.5795
 epoch: 44, train_loss: 0.6760, test_loss: 0.8491, test_f1: 0.5965
 epoch: 45, train_loss: 0.6743, test_loss: 0.8900, test_f1: 0.5993
 epoch: 46, train_loss: 0.6615, test_loss: 1.0763, test_f1: 0.5723
 epoch: 47, train_loss: 0.6603, test_loss: 0.8475, test_f1: 0.5844
 epoch: 48, train_loss: 0.6702, test_loss: 0.8491, test_f1: 0.6135
 epoch: 49, train_loss: 0.6781, test_loss: 0.8519, test_f1: 0.5844
 epoch: 50, train_loss: 0.6723, test_loss: 1.1086, test_f1: 0.5399
 epoch: 51, train_loss: 0.6304, test_loss: 0.8812, test_f1: 0.6126
 epoch: 52, train_loss: 0.6139, test_loss: 0.8806, test_f1: 0.6040
 epoch: 53, train_loss: 0.6108, test_loss: 0.9077, test_f1: 0.6229
 epoch: 54, train_loss: 0.6081, test_loss: 0.9118, test_f1: 0.6340
 epoch: 55, train_loss: 0.6045, test_loss: 0.9260, test_f1: 0.6102
 epoch: 56, train_loss: 0.6004, test_loss: 0.8820, test_f1: 0.6157
 epoch: 57, train_loss: 0.5865, test_loss: 0.9128, test_f1: 0.6156
 epoch: 58, train_loss: 0.6077, test_loss: 0.8784, test_f1: 0.6357
 epoch: 59, train_loss: 0.5966, test_loss: 0.9096, test_f1: 0.6175
 epoch: 60, train_loss: 0.5935, test_loss: 0.9046, test_f1: 0.5878
 epoch: 61, train_loss: 0.6025, test_loss: 0.8812, test_f1: 0.6250
 epoch: 62, train_loss: 0.6018, test_loss: 0.9224, test_f1: 0.6199
 epoch: 63, train_loss: 0.5862, test_loss: 0.9097, test_f1: 0.6112
 epoch: 64, train_loss: 0.5712, test_loss: 0.9555, test_f1: 0.5839
 epoch: 65, train_loss: 0.5768, test_loss: 0.9305, test_f1: 0.6001
 epoch: 66, train_loss: 0.5892, test_loss: 0.8795, test_f1: 0.6306
 epoch: 67, train_loss: 0.5876, test_loss: 0.9253, test_f1: 0.5868
 epoch: 68, train_loss: 0.5675, test_loss: 0.9289, test_f1: 0.6325
 epoch: 69, train_loss: 0.5851, test_loss: 0.9246, test_f1: 0.5873
 epoch: 70, train_loss: 0.5651, test_loss: 0.9270, test_f1: 0.6430
 epoch: 71, train_loss: 0.5536, test_loss: 0.9950, test_f1: 0.5838
 epoch: 72, train_loss: 0.5846, test_loss: 0.9720, test_f1: 0.6110
 epoch: 73, train_loss: 0.5653, test_loss: 0.9110, test_f1: 0.6053
 epoch: 74, train_loss: 0.5590, test_loss: 0.9668, test_f1: 0.6097
 epoch: 75, train_loss: 0.5610, test_loss: 0.9301, test_f1: 0.6298
 epoch: 76, train_loss: 0.5466, test_loss: 0.9558, test_f1: 0.6196
 epoch: 77, train_loss: 0.5519, test_loss: 1.0118, test_f1: 0.5956
 epoch: 78, train_loss: 0.5574, test_loss: 0.9483, test_f1: 0.6246
 epoch: 79, train_loss: 0.5625, test_loss: 0.9427, test_f1: 0.6310
 epoch: 80, train_loss: 0.5537, test_loss: 0.9743, test_f1: 0.6052
 epoch: 81, train_loss: 0.5484, test_loss: 0.9771, test_f1: 0.5941
 epoch: 82, train_loss: 0.5482, test_loss: 0.9570, test_f1: 0.6106
 epoch: 83, train_loss: 0.5555, test_loss: 1.0193, test_f1: 0.5958
 epoch: 84, train_loss: 0.5363, test_loss: 0.9254, test_f1: 0.6413
 epoch: 85, train_loss: 0.5483, test_loss: 0.9487, test_f1: 0.6383
 epoch: 86, train_loss: 0.5498, test_loss: 0.9522, test_f1: 0.6018
 epoch: 87, train_loss: 0.5429, test_loss: 0.9872, test_f1: 0.6240
 epoch: 88, train_loss: 0.5406, test_loss: 0.9320, test_f1: 0.6380
 epoch: 89, train_loss: 0.5436, test_loss: 0.9756, test_f1: 0.6122
 epoch: 90, train_loss: 0.5391, test_loss: 0.9747, test_f1: 0.5994
 epoch: 91, train_loss: 0.5238, test_loss: 0.9850, test_f1: 0.5873
 epoch: 92, train_loss: 0.5315, test_loss: 0.9987, test_f1: 0.6415
 epoch: 93, train_loss: 0.5081, test_loss: 0.9724, test_f1: 0.6203
 epoch: 94, train_loss: 0.5339, test_loss: 0.9468, test_f1: 0.6231
 epoch: 95, train_loss: 0.5364, test_loss: 1.1824, test_f1: 0.5526
 epoch: 96, train_loss: 0.5307, test_loss: 0.9540, test_f1: 0.6294
 epoch: 97, train_loss: 0.5381, test_loss: 1.0420, test_f1: 0.6000
 epoch: 98, train_loss: 0.5270, test_loss: 1.0104, test_f1: 0.5787
 epoch: 99, train_loss: 0.5080, test_loss: 1.0041, test_f1: 0.6106
##################ITERATION #9 ****************************************
 epoch: 0, train_loss: 1.2296, test_loss: 1.0797, test_f1: 0.3892
 epoch: 1, train_loss: 1.0180, test_loss: 1.0844, test_f1: 0.4608
 epoch: 2, train_loss: 0.9814, test_loss: 1.2465, test_f1: 0.4298
 epoch: 3, train_loss: 0.9719, test_loss: 1.1341, test_f1: 0.4161
 epoch: 4, train_loss: 0.9460, test_loss: 1.0761, test_f1: 0.4817
 epoch: 5, train_loss: 0.9499, test_loss: 1.0152, test_f1: 0.4731
 epoch: 6, train_loss: 0.9099, test_loss: 1.0025, test_f1: 0.4787
 epoch: 7, train_loss: 0.9096, test_loss: 0.9616, test_f1: 0.4974
 epoch: 8, train_loss: 0.8965, test_loss: 0.9842, test_f1: 0.4917
 epoch: 9, train_loss: 0.8979, test_loss: 0.9135, test_f1: 0.5229
 epoch: 10, train_loss: 0.8703, test_loss: 1.0109, test_f1: 0.5089
 epoch: 11, train_loss: 0.8647, test_loss: 0.9794, test_f1: 0.5352
 epoch: 12, train_loss: 0.8461, test_loss: 0.8596, test_f1: 0.5674
 epoch: 13, train_loss: 0.8353, test_loss: 1.0947, test_f1: 0.4984
 epoch: 14, train_loss: 0.8128, test_loss: 1.0199, test_f1: 0.5078
 epoch: 15, train_loss: 0.8083, test_loss: 0.8743, test_f1: 0.6222
 epoch: 16, train_loss: 0.8053, test_loss: 0.8550, test_f1: 0.5524
 epoch: 17, train_loss: 0.8086, test_loss: 0.9482, test_f1: 0.5756
 epoch: 18, train_loss: 0.7839, test_loss: 0.9048, test_f1: 0.5791
 epoch: 19, train_loss: 0.7705, test_loss: 0.9228, test_f1: 0.5314
 epoch: 20, train_loss: 0.7842, test_loss: 0.7665, test_f1: 0.5875
 epoch: 21, train_loss: 0.7743, test_loss: 0.8727, test_f1: 0.6208
 epoch: 22, train_loss: 0.7675, test_loss: 0.8640, test_f1: 0.6085
 epoch: 23, train_loss: 0.7534, test_loss: 0.8921, test_f1: 0.6002
 epoch: 24, train_loss: 0.7579, test_loss: 1.0171, test_f1: 0.5693
 epoch: 25, train_loss: 0.7768, test_loss: 1.0230, test_f1: 0.5490
 epoch: 26, train_loss: 0.7418, test_loss: 0.9150, test_f1: 0.5638
 epoch: 27, train_loss: 0.7476, test_loss: 0.8703, test_f1: 0.6174
 epoch: 28, train_loss: 0.7380, test_loss: 0.9911, test_f1: 0.5588
 epoch: 29, train_loss: 0.7436, test_loss: 0.8828, test_f1: 0.5880
 epoch: 30, train_loss: 0.7047, test_loss: 0.8742, test_f1: 0.5874
 epoch: 31, train_loss: 0.7118, test_loss: 0.9559, test_f1: 0.5903
 epoch: 32, train_loss: 0.7142, test_loss: 0.9641, test_f1: 0.5902
 epoch: 33, train_loss: 0.7169, test_loss: 1.0297, test_f1: 0.5185
 epoch: 34, train_loss: 0.6908, test_loss: 0.9048, test_f1: 0.6125
 epoch: 35, train_loss: 0.6989, test_loss: 0.8925, test_f1: 0.5955
 epoch: 36, train_loss: 0.7097, test_loss: 0.8845, test_f1: 0.6092
 epoch: 37, train_loss: 0.6953, test_loss: 0.9807, test_f1: 0.5772
 epoch: 38, train_loss: 0.7125, test_loss: 0.8941, test_f1: 0.6050
 epoch: 39, train_loss: 0.7047, test_loss: 1.0022, test_f1: 0.5930
 epoch: 40, train_loss: 0.6860, test_loss: 1.1395, test_f1: 0.5018
 epoch: 41, train_loss: 0.6884, test_loss: 1.1481, test_f1: 0.5397
 epoch: 42, train_loss: 0.6739, test_loss: 1.1189, test_f1: 0.5420
 epoch: 43, train_loss: 0.6819, test_loss: 0.9350, test_f1: 0.5922
 epoch: 44, train_loss: 0.6571, test_loss: 0.9215, test_f1: 0.5926
 epoch: 45, train_loss: 0.6662, test_loss: 0.9762, test_f1: 0.5755
 epoch: 46, train_loss: 0.6500, test_loss: 0.9073, test_f1: 0.6325
 epoch: 47, train_loss: 0.6440, test_loss: 0.8936, test_f1: 0.6086
 epoch: 48, train_loss: 0.6516, test_loss: 0.9215, test_f1: 0.6501
 epoch: 49, train_loss: 0.6367, test_loss: 0.9376, test_f1: 0.6279
 epoch: 50, train_loss: 0.6529, test_loss: 1.0497, test_f1: 0.5783
 epoch: 51, train_loss: 0.6135, test_loss: 0.9668, test_f1: 0.6243
 epoch: 52, train_loss: 0.6157, test_loss: 0.9475, test_f1: 0.6232
 epoch: 53, train_loss: 0.5973, test_loss: 1.1133, test_f1: 0.5753
 epoch: 54, train_loss: 0.5797, test_loss: 0.9860, test_f1: 0.6059
 epoch: 55, train_loss: 0.5818, test_loss: 1.0180, test_f1: 0.6020
 epoch: 56, train_loss: 0.5901, test_loss: 0.9497, test_f1: 0.6193
 epoch: 57, train_loss: 0.5815, test_loss: 1.0865, test_f1: 0.6048
 epoch: 58, train_loss: 0.5767, test_loss: 0.9875, test_f1: 0.6232
 epoch: 59, train_loss: 0.5855, test_loss: 0.9862, test_f1: 0.5933
 epoch: 60, train_loss: 0.5786, test_loss: 0.9985, test_f1: 0.6170
 epoch: 61, train_loss: 0.5925, test_loss: 1.1366, test_f1: 0.5761
 epoch: 62, train_loss: 0.5733, test_loss: 0.9983, test_f1: 0.5869
 epoch: 63, train_loss: 0.5706, test_loss: 0.9941, test_f1: 0.6278
 epoch: 64, train_loss: 0.5633, test_loss: 0.9190, test_f1: 0.6214
 epoch: 65, train_loss: 0.5623, test_loss: 1.0348, test_f1: 0.6142
 epoch: 66, train_loss: 0.5662, test_loss: 0.9753, test_f1: 0.6182
 epoch: 67, train_loss: 0.5767, test_loss: 0.9746, test_f1: 0.6458
 epoch: 68, train_loss: 0.5558, test_loss: 1.0590, test_f1: 0.6055
 epoch: 69, train_loss: 0.5451, test_loss: 1.1442, test_f1: 0.6051
 epoch: 70, train_loss: 0.5501, test_loss: 1.1156, test_f1: 0.6267
 epoch: 71, train_loss: 0.5407, test_loss: 1.0279, test_f1: 0.6232
 epoch: 72, train_loss: 0.5434, test_loss: 1.0834, test_f1: 0.6138
 epoch: 73, train_loss: 0.5621, test_loss: 1.1348, test_f1: 0.6287
 epoch: 74, train_loss: 0.5528, test_loss: 1.0241, test_f1: 0.6087
 epoch: 75, train_loss: 0.5575, test_loss: 1.1188, test_f1: 0.6238
 epoch: 76, train_loss: 0.5315, test_loss: 1.2589, test_f1: 0.5882
 epoch: 77, train_loss: 0.5559, test_loss: 1.0023, test_f1: 0.6266
 epoch: 78, train_loss: 0.5528, test_loss: 1.0613, test_f1: 0.6031
 epoch: 79, train_loss: 0.5430, test_loss: 1.2385, test_f1: 0.6001
 epoch: 80, train_loss: 0.5370, test_loss: 1.0766, test_f1: 0.6014
 epoch: 81, train_loss: 0.5245, test_loss: 1.1888, test_f1: 0.6167
 epoch: 82, train_loss: 0.5294, test_loss: 1.1346, test_f1: 0.5860
 epoch: 83, train_loss: 0.5272, test_loss: 1.0283, test_f1: 0.6212
 epoch: 84, train_loss: 0.5303, test_loss: 1.0247, test_f1: 0.6198
 epoch: 85, train_loss: 0.5261, test_loss: 1.1341, test_f1: 0.5989
 epoch: 86, train_loss: 0.5321, test_loss: 1.0453, test_f1: 0.6150
 epoch: 87, train_loss: 0.5222, test_loss: 1.0970, test_f1: 0.6003
 epoch: 88, train_loss: 0.5114, test_loss: 1.2387, test_f1: 0.5950
 epoch: 89, train_loss: 0.5626, test_loss: 1.1765, test_f1: 0.6149
 epoch: 90, train_loss: 0.5127, test_loss: 1.1738, test_f1: 0.6124
 epoch: 91, train_loss: 0.5133, test_loss: 1.0844, test_f1: 0.6384
 epoch: 92, train_loss: 0.4908, test_loss: 1.1657, test_f1: 0.6485
 epoch: 93, train_loss: 0.4931, test_loss: 1.1684, test_f1: 0.6222
 epoch: 94, train_loss: 0.5121, test_loss: 1.1027, test_f1: 0.6264
 epoch: 95, train_loss: 0.5027, test_loss: 0.9794, test_f1: 0.6121
 epoch: 96, train_loss: 0.5038, test_loss: 1.1024, test_f1: 0.5897
 epoch: 97, train_loss: 0.4808, test_loss: 1.1244, test_f1: 0.6115
 epoch: 98, train_loss: 0.5201, test_loss: 1.1846, test_f1: 0.6276
 epoch: 99, train_loss: 0.5040, test_loss: 1.1222, test_f1: 0.6299

Training completed in 483.65 seconds
Best F1: 0.7068 at epoch 87
Mean F1 across iterations: 0.6726  0.0227
========================FINAL RESULTS================================
FEGIN weighted F1: 0.7068  0.0227
python main.py --data ltspice_examples --representation component_pin --model FEGIN --layers 3 --hiddens 32 --batch_size 128 --lr 0.01 --emb_size 128 --epochs 100 --save_appendix component_pin_L3_H32_BS128_LR0.01_E128 --no_val
-----



STDERR:
  File "main.py", line 370, in <module>
    main()
  File "main.py", line 254, in main
    dataset = dataset_class(
  File "/home/philip/projects/ltspice_examples_code_repo/Circuit-Completion-Using-GNNs/component_classification_with_link_prediction_head/evaluation/FEGIN/kernel/circuit_datasets.py", line 15, in __init__
    self.data, self.slices = torch.load(self.processed_paths[0])
  File "/home/philip/.local/lib/python3.8/site-packages/torch/serialization.py", line 1040, in load
    warnings.warn(
  File "/usr/lib/python3.8/warnings.py", line 109, in _showwarnmsg
    sw(msg.message, msg.category, msg.filename, msg.lineno,
  File "main.py", line 47, in warn_with_traceback
    traceback.print_stack(file=log)
/home/philip/projects/ltspice_examples_code_repo/Circuit-Completion-Using-GNNs/component_classification_with_link_prediction_head/evaluation/FEGIN/kernel/circuit_datasets.py:15: FutureWarning: You are using `torch.load` with `weights_only=False` (the current default value), which uses the default pickle module implicitly. It is possible to construct malicious pickle data which will execute arbitrary code during unpickling (See https://github.com/pytorch/pytorch/blob/main/SECURITY.md#untrusted-models for more details). In a future release, the default value for `weights_only` will be flipped to `True`. This limits the functions that could be executed during unpickling. Arbitrary objects will no longer be allowed to be loaded via this mode unless they are explicitly allowlisted by the user via `torch.serialization.add_safe_globals`. We recommend you start setting `weights_only=True` for any use case where you don't have full control of the loaded file. Please open an issue on GitHub for any issues related to this experimental feature.
  self.data, self.slices = torch.load(self.processed_paths[0])
