STDOUT:
Results will be saved in /home/philip/projects/ltspice_examples_code_repo/Circuit-Completion-Using-GNNs/component_classification_with_link_prediction_head/evaluation/FEGIN/results/model_FEGIN_dataset_ltspice_examples
Command line input: python main.py --data ltspice_examples --representation component_net --model FEGIN --layers 5 --hiddens 16 --batch_size 256 --lr 0.001 --emb_size 512 --epochs 100 --save_appendix component_net_L5_H16_BS256_LR0.001_E512 --no_val
 is saved.
-----
ltspice_examples - FEGIN
Using 5 layers, 16 hidden units, h = 2
Loading component_net representation dataset
ENTERED
Training FEGIN on component_net representation
Train: 3558, Test: 846
##################ITERATION #0 ****************************************
 epoch: 0, train_loss: 1.4114, test_loss: 1.4057, test_f1: 0.1004
 epoch: 1, train_loss: 1.3881, test_loss: 1.3945, test_f1: 0.1004
 epoch: 2, train_loss: 1.3666, test_loss: 1.3768, test_f1: 0.2172
 epoch: 3, train_loss: 1.3436, test_loss: 1.3452, test_f1: 0.2920
 epoch: 4, train_loss: 1.3147, test_loss: 1.3136, test_f1: 0.3112
 epoch: 5, train_loss: 1.2876, test_loss: 1.2809, test_f1: 0.2836
 epoch: 6, train_loss: 1.2715, test_loss: 1.2585, test_f1: 0.2884
 epoch: 7, train_loss: 1.2554, test_loss: 1.2403, test_f1: 0.3225
 epoch: 8, train_loss: 1.2407, test_loss: 1.2298, test_f1: 0.3343
 epoch: 9, train_loss: 1.2277, test_loss: 1.2095, test_f1: 0.3470
 epoch: 10, train_loss: 1.2195, test_loss: 1.1983, test_f1: 0.3297
 epoch: 11, train_loss: 1.2059, test_loss: 1.1866, test_f1: 0.3430
 epoch: 12, train_loss: 1.2028, test_loss: 1.1739, test_f1: 0.3805
 epoch: 13, train_loss: 1.1865, test_loss: 1.1637, test_f1: 0.3717
 epoch: 14, train_loss: 1.1797, test_loss: 1.1517, test_f1: 0.3965
 epoch: 15, train_loss: 1.1642, test_loss: 1.1371, test_f1: 0.3785
 epoch: 16, train_loss: 1.1557, test_loss: 1.1298, test_f1: 0.3733
 epoch: 17, train_loss: 1.1450, test_loss: 1.1139, test_f1: 0.3696
 epoch: 18, train_loss: 1.1300, test_loss: 1.1016, test_f1: 0.4324
 epoch: 19, train_loss: 1.1245, test_loss: 1.0897, test_f1: 0.3794
 epoch: 20, train_loss: 1.1221, test_loss: 1.0788, test_f1: 0.3803
 epoch: 21, train_loss: 1.0964, test_loss: 1.0688, test_f1: 0.3768
 epoch: 22, train_loss: 1.0859, test_loss: 1.0531, test_f1: 0.4425
 epoch: 23, train_loss: 1.0802, test_loss: 1.0413, test_f1: 0.4663
 epoch: 24, train_loss: 1.0730, test_loss: 1.0343, test_f1: 0.4865
 epoch: 25, train_loss: 1.0596, test_loss: 1.0446, test_f1: 0.4414
 epoch: 26, train_loss: 1.0625, test_loss: 1.0074, test_f1: 0.5146
 epoch: 27, train_loss: 1.0405, test_loss: 0.9892, test_f1: 0.5033
 epoch: 28, train_loss: 1.0363, test_loss: 0.9908, test_f1: 0.5068
 epoch: 29, train_loss: 1.0216, test_loss: 0.9723, test_f1: 0.5312
 epoch: 30, train_loss: 0.9978, test_loss: 0.9587, test_f1: 0.5302
 epoch: 31, train_loss: 0.9952, test_loss: 0.9465, test_f1: 0.5181
 epoch: 32, train_loss: 0.9889, test_loss: 0.9271, test_f1: 0.5633
 epoch: 33, train_loss: 0.9745, test_loss: 0.9354, test_f1: 0.5053
 epoch: 34, train_loss: 0.9599, test_loss: 0.9263, test_f1: 0.5095
 epoch: 35, train_loss: 0.9609, test_loss: 0.9092, test_f1: 0.5139
 epoch: 36, train_loss: 0.9442, test_loss: 0.9447, test_f1: 0.5325
 epoch: 37, train_loss: 0.9433, test_loss: 0.9171, test_f1: 0.5523
 epoch: 38, train_loss: 0.9256, test_loss: 0.9057, test_f1: 0.5615
 epoch: 39, train_loss: 0.9301, test_loss: 0.9076, test_f1: 0.5632
 epoch: 40, train_loss: 0.9112, test_loss: 0.8958, test_f1: 0.5258
 epoch: 41, train_loss: 0.9217, test_loss: 0.9040, test_f1: 0.5337
 epoch: 42, train_loss: 0.9136, test_loss: 0.9056, test_f1: 0.5660
 epoch: 43, train_loss: 0.9121, test_loss: 0.8949, test_f1: 0.5592
 epoch: 44, train_loss: 0.9202, test_loss: 0.9459, test_f1: 0.5217
 epoch: 45, train_loss: 0.9162, test_loss: 0.9246, test_f1: 0.5168
 epoch: 46, train_loss: 0.9038, test_loss: 0.9299, test_f1: 0.5309
 epoch: 47, train_loss: 0.8941, test_loss: 0.8953, test_f1: 0.5810
 epoch: 48, train_loss: 0.8962, test_loss: 0.9150, test_f1: 0.5549
 epoch: 49, train_loss: 0.8897, test_loss: 0.9067, test_f1: 0.5804
 epoch: 50, train_loss: 0.8940, test_loss: 0.9050, test_f1: 0.5622
 epoch: 51, train_loss: 0.8742, test_loss: 0.9053, test_f1: 0.5622
 epoch: 52, train_loss: 0.8716, test_loss: 0.9186, test_f1: 0.5586
 epoch: 53, train_loss: 0.8616, test_loss: 0.9137, test_f1: 0.5560
 epoch: 54, train_loss: 0.8625, test_loss: 0.9092, test_f1: 0.5693
 epoch: 55, train_loss: 0.8667, test_loss: 0.9102, test_f1: 0.5812
 epoch: 56, train_loss: 0.8735, test_loss: 0.9011, test_f1: 0.5650
 epoch: 57, train_loss: 0.8699, test_loss: 0.9015, test_f1: 0.5909
 epoch: 58, train_loss: 0.8538, test_loss: 0.9042, test_f1: 0.5780
 epoch: 59, train_loss: 0.8592, test_loss: 0.9065, test_f1: 0.5841
 epoch: 60, train_loss: 0.8591, test_loss: 0.9047, test_f1: 0.5709
 epoch: 61, train_loss: 0.8457, test_loss: 0.9199, test_f1: 0.5723
 epoch: 62, train_loss: 0.8509, test_loss: 0.9085, test_f1: 0.5749
 epoch: 63, train_loss: 0.8493, test_loss: 0.9226, test_f1: 0.5666
 epoch: 64, train_loss: 0.8488, test_loss: 0.9151, test_f1: 0.5686
 epoch: 65, train_loss: 0.8375, test_loss: 0.9147, test_f1: 0.5849
 epoch: 66, train_loss: 0.8417, test_loss: 0.9182, test_f1: 0.5811
 epoch: 67, train_loss: 0.8534, test_loss: 0.9234, test_f1: 0.5753
 epoch: 68, train_loss: 0.8461, test_loss: 0.9181, test_f1: 0.5880
 epoch: 69, train_loss: 0.8478, test_loss: 0.9150, test_f1: 0.5763
 epoch: 70, train_loss: 0.8299, test_loss: 0.9169, test_f1: 0.5723
 epoch: 71, train_loss: 0.8467, test_loss: 0.9001, test_f1: 0.5807
 epoch: 72, train_loss: 0.8305, test_loss: 0.9093, test_f1: 0.5718
 epoch: 73, train_loss: 0.8223, test_loss: 0.9161, test_f1: 0.5813
 epoch: 74, train_loss: 0.8362, test_loss: 0.9208, test_f1: 0.5875
 epoch: 75, train_loss: 0.8241, test_loss: 0.9102, test_f1: 0.5768
 epoch: 76, train_loss: 0.8283, test_loss: 0.9123, test_f1: 0.5883
 epoch: 77, train_loss: 0.8258, test_loss: 0.9180, test_f1: 0.5882
 epoch: 78, train_loss: 0.8236, test_loss: 0.9202, test_f1: 0.5832
 epoch: 79, train_loss: 0.8196, test_loss: 0.9212, test_f1: 0.5731
 epoch: 80, train_loss: 0.8233, test_loss: 0.9208, test_f1: 0.5736
 epoch: 81, train_loss: 0.8250, test_loss: 0.9163, test_f1: 0.5857
 epoch: 82, train_loss: 0.8213, test_loss: 0.9018, test_f1: 0.5982
 epoch: 83, train_loss: 0.8256, test_loss: 0.9140, test_f1: 0.5833
 epoch: 84, train_loss: 0.8154, test_loss: 0.9257, test_f1: 0.5753
 epoch: 85, train_loss: 0.8157, test_loss: 0.9207, test_f1: 0.5853
 epoch: 86, train_loss: 0.8198, test_loss: 0.9175, test_f1: 0.5844
 epoch: 87, train_loss: 0.8130, test_loss: 0.9217, test_f1: 0.5875
 epoch: 88, train_loss: 0.8164, test_loss: 0.9239, test_f1: 0.5821
 epoch: 89, train_loss: 0.8149, test_loss: 0.9271, test_f1: 0.5913
 epoch: 90, train_loss: 0.8284, test_loss: 0.9110, test_f1: 0.5884
 epoch: 91, train_loss: 0.8179, test_loss: 0.9254, test_f1: 0.5833
 epoch: 92, train_loss: 0.8319, test_loss: 0.9276, test_f1: 0.5831
 epoch: 93, train_loss: 0.8092, test_loss: 0.9209, test_f1: 0.5881
 epoch: 94, train_loss: 0.8125, test_loss: 0.9194, test_f1: 0.5919
 epoch: 95, train_loss: 0.8155, test_loss: 0.9234, test_f1: 0.5806
 epoch: 96, train_loss: 0.8019, test_loss: 0.9345, test_f1: 0.5830
 epoch: 97, train_loss: 0.8045, test_loss: 0.9246, test_f1: 0.5808
 epoch: 98, train_loss: 0.8001, test_loss: 0.9195, test_f1: 0.5770
 epoch: 99, train_loss: 0.8029, test_loss: 0.9105, test_f1: 0.5696
##################ITERATION #1 ****************************************
 epoch: 0, train_loss: 1.3554, test_loss: 1.3574, test_f1: 0.2270
 epoch: 1, train_loss: 1.2698, test_loss: 1.3235, test_f1: 0.2270
 epoch: 2, train_loss: 1.2444, test_loss: 1.2940, test_f1: 0.2270
 epoch: 3, train_loss: 1.2114, test_loss: 1.2446, test_f1: 0.2650
 epoch: 4, train_loss: 1.1869, test_loss: 1.1908, test_f1: 0.3706
 epoch: 5, train_loss: 1.1622, test_loss: 1.1441, test_f1: 0.3948
 epoch: 6, train_loss: 1.1354, test_loss: 1.1032, test_f1: 0.4286
 epoch: 7, train_loss: 1.1027, test_loss: 1.0714, test_f1: 0.4438
 epoch: 8, train_loss: 1.0847, test_loss: 1.0498, test_f1: 0.4532
 epoch: 9, train_loss: 1.0565, test_loss: 1.0297, test_f1: 0.4598
 epoch: 10, train_loss: 1.0451, test_loss: 1.0431, test_f1: 0.4393
 epoch: 11, train_loss: 1.0322, test_loss: 1.0129, test_f1: 0.4537
 epoch: 12, train_loss: 1.0180, test_loss: 0.9998, test_f1: 0.4574
 epoch: 13, train_loss: 1.0071, test_loss: 1.0401, test_f1: 0.4301
 epoch: 14, train_loss: 1.0065, test_loss: 0.9841, test_f1: 0.4697
 epoch: 15, train_loss: 0.9889, test_loss: 0.9835, test_f1: 0.4696
 epoch: 16, train_loss: 0.9750, test_loss: 0.9765, test_f1: 0.4845
 epoch: 17, train_loss: 0.9746, test_loss: 0.9615, test_f1: 0.4850
 epoch: 18, train_loss: 0.9654, test_loss: 0.9589, test_f1: 0.4827
 epoch: 19, train_loss: 0.9570, test_loss: 0.9482, test_f1: 0.5050
 epoch: 20, train_loss: 0.9505, test_loss: 0.9743, test_f1: 0.4763
 epoch: 21, train_loss: 0.9511, test_loss: 0.9518, test_f1: 0.4944
 epoch: 22, train_loss: 0.9453, test_loss: 1.0055, test_f1: 0.4821
 epoch: 23, train_loss: 0.9342, test_loss: 0.9537, test_f1: 0.4978
 epoch: 24, train_loss: 0.9283, test_loss: 0.9640, test_f1: 0.4925
 epoch: 25, train_loss: 0.9142, test_loss: 0.9494, test_f1: 0.5038
 epoch: 26, train_loss: 0.8994, test_loss: 0.9579, test_f1: 0.5029
 epoch: 27, train_loss: 0.9133, test_loss: 0.9694, test_f1: 0.5030
 epoch: 28, train_loss: 0.9113, test_loss: 0.9460, test_f1: 0.5118
 epoch: 29, train_loss: 0.9178, test_loss: 1.0078, test_f1: 0.4780
 epoch: 30, train_loss: 0.9070, test_loss: 0.9531, test_f1: 0.5037
 epoch: 31, train_loss: 0.8892, test_loss: 0.9819, test_f1: 0.4926
 epoch: 32, train_loss: 0.9013, test_loss: 0.9531, test_f1: 0.5159
 epoch: 33, train_loss: 0.8923, test_loss: 0.9651, test_f1: 0.5442
 epoch: 34, train_loss: 0.8718, test_loss: 0.9540, test_f1: 0.5172
 epoch: 35, train_loss: 0.8864, test_loss: 0.9559, test_f1: 0.5260
 epoch: 36, train_loss: 0.8908, test_loss: 0.9499, test_f1: 0.5137
 epoch: 37, train_loss: 0.8705, test_loss: 0.9568, test_f1: 0.5294
 epoch: 38, train_loss: 0.8680, test_loss: 0.9510, test_f1: 0.5099
 epoch: 39, train_loss: 0.8790, test_loss: 0.9620, test_f1: 0.5335
 epoch: 40, train_loss: 0.8687, test_loss: 0.9615, test_f1: 0.5247
 epoch: 41, train_loss: 0.8632, test_loss: 0.9837, test_f1: 0.5383
 epoch: 42, train_loss: 0.8669, test_loss: 0.9620, test_f1: 0.5171
 epoch: 43, train_loss: 0.8564, test_loss: 0.9568, test_f1: 0.5334
 epoch: 44, train_loss: 0.8576, test_loss: 0.9759, test_f1: 0.5410
 epoch: 45, train_loss: 0.8472, test_loss: 0.9731, test_f1: 0.5419
 epoch: 46, train_loss: 0.8458, test_loss: 1.0112, test_f1: 0.5204
 epoch: 47, train_loss: 0.8406, test_loss: 0.9590, test_f1: 0.5244
 epoch: 48, train_loss: 0.8426, test_loss: 0.9823, test_f1: 0.5132
 epoch: 49, train_loss: 0.8593, test_loss: 0.9568, test_f1: 0.5210
 epoch: 50, train_loss: 0.8456, test_loss: 0.9685, test_f1: 0.5187
 epoch: 51, train_loss: 0.8509, test_loss: 0.9438, test_f1: 0.5412
 epoch: 52, train_loss: 0.8334, test_loss: 0.9390, test_f1: 0.5347
 epoch: 53, train_loss: 0.8248, test_loss: 0.9376, test_f1: 0.5330
 epoch: 54, train_loss: 0.8251, test_loss: 0.9807, test_f1: 0.5368
 epoch: 55, train_loss: 0.8395, test_loss: 0.9551, test_f1: 0.5351
 epoch: 56, train_loss: 0.8285, test_loss: 0.9422, test_f1: 0.5444
 epoch: 57, train_loss: 0.8223, test_loss: 0.9375, test_f1: 0.5471
 epoch: 58, train_loss: 0.8152, test_loss: 0.9416, test_f1: 0.5401
 epoch: 59, train_loss: 0.8234, test_loss: 0.9484, test_f1: 0.5498
 epoch: 60, train_loss: 0.8110, test_loss: 0.9481, test_f1: 0.5469
 epoch: 61, train_loss: 0.8133, test_loss: 0.9438, test_f1: 0.5574
 epoch: 62, train_loss: 0.8214, test_loss: 0.9462, test_f1: 0.5342
 epoch: 63, train_loss: 0.8242, test_loss: 0.9638, test_f1: 0.5339
 epoch: 64, train_loss: 0.8113, test_loss: 0.9403, test_f1: 0.5432
 epoch: 65, train_loss: 0.8114, test_loss: 0.9531, test_f1: 0.5475
 epoch: 66, train_loss: 0.8148, test_loss: 0.9428, test_f1: 0.5426
 epoch: 67, train_loss: 0.8116, test_loss: 0.9769, test_f1: 0.5397
 epoch: 68, train_loss: 0.8058, test_loss: 0.9472, test_f1: 0.5384
 epoch: 69, train_loss: 0.8099, test_loss: 0.9512, test_f1: 0.5425
 epoch: 70, train_loss: 0.7977, test_loss: 0.9410, test_f1: 0.5401
 epoch: 71, train_loss: 0.8060, test_loss: 0.9600, test_f1: 0.5535
 epoch: 72, train_loss: 0.8051, test_loss: 0.9542, test_f1: 0.5478
 epoch: 73, train_loss: 0.8083, test_loss: 0.9553, test_f1: 0.5450
 epoch: 74, train_loss: 0.8051, test_loss: 0.9437, test_f1: 0.5408
 epoch: 75, train_loss: 0.8083, test_loss: 0.9421, test_f1: 0.5526
 epoch: 76, train_loss: 0.8028, test_loss: 0.9580, test_f1: 0.5470
 epoch: 77, train_loss: 0.8020, test_loss: 0.9669, test_f1: 0.5594
 epoch: 78, train_loss: 0.8079, test_loss: 0.9683, test_f1: 0.5636
 epoch: 79, train_loss: 0.7941, test_loss: 0.9760, test_f1: 0.5607
 epoch: 80, train_loss: 0.7985, test_loss: 0.9505, test_f1: 0.5544
 epoch: 81, train_loss: 0.8040, test_loss: 0.9622, test_f1: 0.5638
 epoch: 82, train_loss: 0.7974, test_loss: 0.9616, test_f1: 0.5648
 epoch: 83, train_loss: 0.7968, test_loss: 0.9598, test_f1: 0.5601
 epoch: 84, train_loss: 0.7967, test_loss: 0.9506, test_f1: 0.5632
 epoch: 85, train_loss: 0.8019, test_loss: 0.9584, test_f1: 0.5558
 epoch: 86, train_loss: 0.7879, test_loss: 0.9672, test_f1: 0.5593
 epoch: 87, train_loss: 0.7976, test_loss: 0.9864, test_f1: 0.5565
 epoch: 88, train_loss: 0.7950, test_loss: 0.9749, test_f1: 0.5546
 epoch: 89, train_loss: 0.7860, test_loss: 0.9713, test_f1: 0.5702
 epoch: 90, train_loss: 0.7863, test_loss: 0.9430, test_f1: 0.5761
 epoch: 91, train_loss: 0.7865, test_loss: 0.9626, test_f1: 0.5633
 epoch: 92, train_loss: 0.7831, test_loss: 0.9410, test_f1: 0.5616
 epoch: 93, train_loss: 0.7925, test_loss: 0.9758, test_f1: 0.5645
 epoch: 94, train_loss: 0.7903, test_loss: 0.9701, test_f1: 0.5624
 epoch: 95, train_loss: 0.7827, test_loss: 0.9892, test_f1: 0.5691
 epoch: 96, train_loss: 0.7988, test_loss: 0.9974, test_f1: 0.5523
 epoch: 97, train_loss: 0.7760, test_loss: 0.9752, test_f1: 0.5563
 epoch: 98, train_loss: 0.7814, test_loss: 0.9743, test_f1: 0.5412
 epoch: 99, train_loss: 0.7846, test_loss: 0.9761, test_f1: 0.5594
##################ITERATION #2 ****************************************
 epoch: 0, train_loss: 1.3222, test_loss: 1.3602, test_f1: 0.2270
 epoch: 1, train_loss: 1.2679, test_loss: 1.3439, test_f1: 0.2270
 epoch: 2, train_loss: 1.2398, test_loss: 1.3155, test_f1: 0.2270
 epoch: 3, train_loss: 1.2178, test_loss: 1.2557, test_f1: 0.2702
 epoch: 4, train_loss: 1.2006, test_loss: 1.1893, test_f1: 0.3399
 epoch: 5, train_loss: 1.1754, test_loss: 1.1502, test_f1: 0.3864
 epoch: 6, train_loss: 1.1569, test_loss: 1.1020, test_f1: 0.4261
 epoch: 7, train_loss: 1.1298, test_loss: 1.0766, test_f1: 0.4454
 epoch: 8, train_loss: 1.1127, test_loss: 1.0598, test_f1: 0.4678
 epoch: 9, train_loss: 1.0963, test_loss: 1.0386, test_f1: 0.4692
 epoch: 10, train_loss: 1.0790, test_loss: 1.0096, test_f1: 0.4865
 epoch: 11, train_loss: 1.0546, test_loss: 0.9964, test_f1: 0.5186
 epoch: 12, train_loss: 1.0434, test_loss: 0.9750, test_f1: 0.5008
 epoch: 13, train_loss: 1.0209, test_loss: 0.9671, test_f1: 0.5067
 epoch: 14, train_loss: 1.0148, test_loss: 0.9540, test_f1: 0.5258
 epoch: 15, train_loss: 0.9972, test_loss: 0.9430, test_f1: 0.5104
 epoch: 16, train_loss: 0.9923, test_loss: 0.9473, test_f1: 0.5165
 epoch: 17, train_loss: 0.9839, test_loss: 0.9197, test_f1: 0.5340
 epoch: 18, train_loss: 0.9669, test_loss: 0.9147, test_f1: 0.5352
 epoch: 19, train_loss: 0.9643, test_loss: 0.9000, test_f1: 0.5535
 epoch: 20, train_loss: 0.9585, test_loss: 0.9264, test_f1: 0.5043
 epoch: 21, train_loss: 0.9547, test_loss: 0.8991, test_f1: 0.5259
 epoch: 22, train_loss: 0.9339, test_loss: 0.9044, test_f1: 0.5232
 epoch: 23, train_loss: 0.9422, test_loss: 0.8888, test_f1: 0.5219
 epoch: 24, train_loss: 0.9227, test_loss: 0.8907, test_f1: 0.5282
 epoch: 25, train_loss: 0.9234, test_loss: 0.8962, test_f1: 0.5240
 epoch: 26, train_loss: 0.9224, test_loss: 0.8810, test_f1: 0.5417
 epoch: 27, train_loss: 0.9204, test_loss: 0.9093, test_f1: 0.5141
 epoch: 28, train_loss: 0.9091, test_loss: 0.8940, test_f1: 0.5380
 epoch: 29, train_loss: 0.9042, test_loss: 0.8946, test_f1: 0.5456
 epoch: 30, train_loss: 0.9055, test_loss: 0.9090, test_f1: 0.5334
 epoch: 31, train_loss: 0.8967, test_loss: 0.8856, test_f1: 0.5371
 epoch: 32, train_loss: 0.8879, test_loss: 0.8949, test_f1: 0.5286
 epoch: 33, train_loss: 0.8830, test_loss: 0.8942, test_f1: 0.5355
 epoch: 34, train_loss: 0.8922, test_loss: 0.8708, test_f1: 0.5422
 epoch: 35, train_loss: 0.8913, test_loss: 0.9032, test_f1: 0.5362
 epoch: 36, train_loss: 0.8873, test_loss: 0.8926, test_f1: 0.5445
 epoch: 37, train_loss: 0.8902, test_loss: 0.8966, test_f1: 0.5346
 epoch: 38, train_loss: 0.8684, test_loss: 0.8959, test_f1: 0.5475
 epoch: 39, train_loss: 0.8736, test_loss: 0.9121, test_f1: 0.5325
 epoch: 40, train_loss: 0.8676, test_loss: 0.8721, test_f1: 0.5536
 epoch: 41, train_loss: 0.8651, test_loss: 0.8931, test_f1: 0.5458
 epoch: 42, train_loss: 0.8758, test_loss: 0.9055, test_f1: 0.5439
 epoch: 43, train_loss: 0.8657, test_loss: 0.8936, test_f1: 0.5415
 epoch: 44, train_loss: 0.8630, test_loss: 0.9142, test_f1: 0.5428
 epoch: 45, train_loss: 0.8631, test_loss: 0.9150, test_f1: 0.5451
 epoch: 46, train_loss: 0.8679, test_loss: 0.9267, test_f1: 0.5426
 epoch: 47, train_loss: 0.8537, test_loss: 0.9130, test_f1: 0.5313
 epoch: 48, train_loss: 0.8464, test_loss: 0.9144, test_f1: 0.5445
 epoch: 49, train_loss: 0.8564, test_loss: 0.9784, test_f1: 0.5217
 epoch: 50, train_loss: 0.8543, test_loss: 0.9246, test_f1: 0.5483
 epoch: 51, train_loss: 0.8405, test_loss: 0.9116, test_f1: 0.5391
 epoch: 52, train_loss: 0.8340, test_loss: 0.9131, test_f1: 0.5286
 epoch: 53, train_loss: 0.8389, test_loss: 0.9274, test_f1: 0.5366
 epoch: 54, train_loss: 0.8382, test_loss: 0.9314, test_f1: 0.5459
 epoch: 55, train_loss: 0.8332, test_loss: 0.9230, test_f1: 0.5412
 epoch: 56, train_loss: 0.8307, test_loss: 0.9187, test_f1: 0.5446
 epoch: 57, train_loss: 0.8308, test_loss: 0.9245, test_f1: 0.5321
 epoch: 58, train_loss: 0.8263, test_loss: 0.9339, test_f1: 0.5314
 epoch: 59, train_loss: 0.8297, test_loss: 0.9339, test_f1: 0.5292
 epoch: 60, train_loss: 0.8327, test_loss: 0.9053, test_f1: 0.5444
 epoch: 61, train_loss: 0.8205, test_loss: 0.9190, test_f1: 0.5361
 epoch: 62, train_loss: 0.8208, test_loss: 0.9088, test_f1: 0.5484
 epoch: 63, train_loss: 0.8176, test_loss: 0.9199, test_f1: 0.5304
 epoch: 64, train_loss: 0.8277, test_loss: 0.9272, test_f1: 0.5364
 epoch: 65, train_loss: 0.8137, test_loss: 0.9298, test_f1: 0.5428
 epoch: 66, train_loss: 0.8155, test_loss: 0.9526, test_f1: 0.5399
 epoch: 67, train_loss: 0.8083, test_loss: 0.9283, test_f1: 0.5370
 epoch: 68, train_loss: 0.8109, test_loss: 0.9328, test_f1: 0.5211
 epoch: 69, train_loss: 0.8298, test_loss: 0.9395, test_f1: 0.5201
 epoch: 70, train_loss: 0.8173, test_loss: 0.9200, test_f1: 0.5256
 epoch: 71, train_loss: 0.8060, test_loss: 0.9607, test_f1: 0.5218
 epoch: 72, train_loss: 0.8295, test_loss: 0.9798, test_f1: 0.5228
 epoch: 73, train_loss: 0.8200, test_loss: 0.9270, test_f1: 0.5228
 epoch: 74, train_loss: 0.8115, test_loss: 0.9247, test_f1: 0.5435
 epoch: 75, train_loss: 0.8115, test_loss: 0.9289, test_f1: 0.5330
 epoch: 76, train_loss: 0.8155, test_loss: 0.9556, test_f1: 0.5237
 epoch: 77, train_loss: 0.8037, test_loss: 0.9527, test_f1: 0.5266
 epoch: 78, train_loss: 0.8051, test_loss: 0.9414, test_f1: 0.5324
 epoch: 79, train_loss: 0.8097, test_loss: 0.9427, test_f1: 0.5389
 epoch: 80, train_loss: 0.8189, test_loss: 0.9156, test_f1: 0.5399
 epoch: 81, train_loss: 0.8020, test_loss: 0.9230, test_f1: 0.5501
 epoch: 82, train_loss: 0.8119, test_loss: 0.9255, test_f1: 0.5352
 epoch: 83, train_loss: 0.8073, test_loss: 0.9492, test_f1: 0.5195
 epoch: 84, train_loss: 0.8079, test_loss: 0.9454, test_f1: 0.5395
 epoch: 85, train_loss: 0.7986, test_loss: 0.9705, test_f1: 0.5293
 epoch: 86, train_loss: 0.7990, test_loss: 0.9566, test_f1: 0.5260
 epoch: 87, train_loss: 0.7945, test_loss: 0.9545, test_f1: 0.5211
 epoch: 88, train_loss: 0.8059, test_loss: 0.9627, test_f1: 0.5297
 epoch: 89, train_loss: 0.8099, test_loss: 0.9455, test_f1: 0.5362
 epoch: 90, train_loss: 0.8008, test_loss: 0.9413, test_f1: 0.5342
 epoch: 91, train_loss: 0.8027, test_loss: 0.9470, test_f1: 0.5262
 epoch: 92, train_loss: 0.8021, test_loss: 0.9561, test_f1: 0.5357
 epoch: 93, train_loss: 0.7970, test_loss: 0.9781, test_f1: 0.5278
 epoch: 94, train_loss: 0.7900, test_loss: 0.9706, test_f1: 0.5270
 epoch: 95, train_loss: 0.7929, test_loss: 0.9315, test_f1: 0.5306
 epoch: 96, train_loss: 0.7947, test_loss: 0.9440, test_f1: 0.5260
 epoch: 97, train_loss: 0.7831, test_loss: 0.9602, test_f1: 0.5295
 epoch: 98, train_loss: 0.7837, test_loss: 0.9640, test_f1: 0.5301
 epoch: 99, train_loss: 0.7892, test_loss: 0.9476, test_f1: 0.5420
##################ITERATION #3 ****************************************
 epoch: 0, train_loss: 1.3158, test_loss: 1.3000, test_f1: 0.2270
 epoch: 1, train_loss: 1.2301, test_loss: 1.2821, test_f1: 0.2270
 epoch: 2, train_loss: 1.2015, test_loss: 1.2403, test_f1: 0.2841
 epoch: 3, train_loss: 1.1802, test_loss: 1.1699, test_f1: 0.3099
 epoch: 4, train_loss: 1.1553, test_loss: 1.1086, test_f1: 0.3591
 epoch: 5, train_loss: 1.1270, test_loss: 1.0885, test_f1: 0.3804
 epoch: 6, train_loss: 1.1150, test_loss: 1.0566, test_f1: 0.4418
 epoch: 7, train_loss: 1.0918, test_loss: 1.0389, test_f1: 0.4616
 epoch: 8, train_loss: 1.0794, test_loss: 1.0233, test_f1: 0.4555
 epoch: 9, train_loss: 1.0514, test_loss: 1.0129, test_f1: 0.4768
 epoch: 10, train_loss: 1.0458, test_loss: 1.0164, test_f1: 0.4685
 epoch: 11, train_loss: 1.0413, test_loss: 1.0276, test_f1: 0.4751
 epoch: 12, train_loss: 1.0414, test_loss: 1.0138, test_f1: 0.4718
 epoch: 13, train_loss: 1.0260, test_loss: 1.0128, test_f1: 0.4916
 epoch: 14, train_loss: 1.0110, test_loss: 1.0056, test_f1: 0.4852
 epoch: 15, train_loss: 0.9980, test_loss: 1.0201, test_f1: 0.4774
 epoch: 16, train_loss: 0.9966, test_loss: 1.0170, test_f1: 0.4814
 epoch: 17, train_loss: 0.9843, test_loss: 1.0114, test_f1: 0.5041
 epoch: 18, train_loss: 0.9816, test_loss: 1.0129, test_f1: 0.5100
 epoch: 19, train_loss: 0.9755, test_loss: 1.0180, test_f1: 0.5030
 epoch: 20, train_loss: 0.9672, test_loss: 1.0254, test_f1: 0.5015
 epoch: 21, train_loss: 0.9669, test_loss: 1.0227, test_f1: 0.5284
 epoch: 22, train_loss: 0.9605, test_loss: 1.0143, test_f1: 0.5043
 epoch: 23, train_loss: 0.9555, test_loss: 1.0149, test_f1: 0.5041
 epoch: 24, train_loss: 0.9555, test_loss: 1.0107, test_f1: 0.5049
 epoch: 25, train_loss: 0.9339, test_loss: 0.9975, test_f1: 0.5154
 epoch: 26, train_loss: 0.9490, test_loss: 1.0151, test_f1: 0.5131
 epoch: 27, train_loss: 0.9367, test_loss: 0.9899, test_f1: 0.5066
 epoch: 28, train_loss: 0.9364, test_loss: 0.9953, test_f1: 0.5216
 epoch: 29, train_loss: 0.9323, test_loss: 1.0093, test_f1: 0.5158
 epoch: 30, train_loss: 0.9316, test_loss: 0.9759, test_f1: 0.5217
 epoch: 31, train_loss: 0.9309, test_loss: 1.0367, test_f1: 0.4801
 epoch: 32, train_loss: 0.9189, test_loss: 1.0048, test_f1: 0.5211
 epoch: 33, train_loss: 0.9168, test_loss: 0.9694, test_f1: 0.4965
 epoch: 34, train_loss: 0.9182, test_loss: 1.0180, test_f1: 0.5016
 epoch: 35, train_loss: 0.9054, test_loss: 1.0014, test_f1: 0.5233
 epoch: 36, train_loss: 0.9095, test_loss: 1.0052, test_f1: 0.5111
 epoch: 37, train_loss: 0.8935, test_loss: 1.0056, test_f1: 0.5400
 epoch: 38, train_loss: 0.9043, test_loss: 0.9901, test_f1: 0.5282
 epoch: 39, train_loss: 0.8919, test_loss: 1.0121, test_f1: 0.5370
 epoch: 40, train_loss: 0.8922, test_loss: 1.0239, test_f1: 0.5011
 epoch: 41, train_loss: 0.8814, test_loss: 0.9910, test_f1: 0.5394
 epoch: 42, train_loss: 0.8987, test_loss: 1.0019, test_f1: 0.5189
 epoch: 43, train_loss: 0.8887, test_loss: 1.0055, test_f1: 0.5199
 epoch: 44, train_loss: 0.8858, test_loss: 1.0166, test_f1: 0.4973
 epoch: 45, train_loss: 0.8870, test_loss: 0.9927, test_f1: 0.5353
 epoch: 46, train_loss: 0.8793, test_loss: 1.0058, test_f1: 0.5324
 epoch: 47, train_loss: 0.8841, test_loss: 1.0081, test_f1: 0.5490
 epoch: 48, train_loss: 0.8720, test_loss: 0.9859, test_f1: 0.5572
 epoch: 49, train_loss: 0.8704, test_loss: 1.0198, test_f1: 0.5245
 epoch: 50, train_loss: 0.8814, test_loss: 1.0074, test_f1: 0.5462
 epoch: 51, train_loss: 0.8671, test_loss: 1.0325, test_f1: 0.5203
 epoch: 52, train_loss: 0.8602, test_loss: 0.9935, test_f1: 0.5413
 epoch: 53, train_loss: 0.8634, test_loss: 0.9987, test_f1: 0.5381
 epoch: 54, train_loss: 0.8673, test_loss: 0.9950, test_f1: 0.5366
 epoch: 55, train_loss: 0.8555, test_loss: 1.0126, test_f1: 0.5468
 epoch: 56, train_loss: 0.8711, test_loss: 1.0031, test_f1: 0.5579
 epoch: 57, train_loss: 0.8506, test_loss: 0.9997, test_f1: 0.5459
 epoch: 58, train_loss: 0.8571, test_loss: 1.0007, test_f1: 0.5366
 epoch: 59, train_loss: 0.8490, test_loss: 1.0130, test_f1: 0.5449
 epoch: 60, train_loss: 0.8526, test_loss: 0.9980, test_f1: 0.5549
 epoch: 61, train_loss: 0.8555, test_loss: 1.0220, test_f1: 0.5298
 epoch: 62, train_loss: 0.8455, test_loss: 0.9982, test_f1: 0.5436
 epoch: 63, train_loss: 0.8498, test_loss: 1.0183, test_f1: 0.5487
 epoch: 64, train_loss: 0.8430, test_loss: 1.0094, test_f1: 0.5554
 epoch: 65, train_loss: 0.8505, test_loss: 0.9912, test_f1: 0.5590
 epoch: 66, train_loss: 0.8435, test_loss: 0.9968, test_f1: 0.5522
 epoch: 67, train_loss: 0.8470, test_loss: 0.9967, test_f1: 0.5576
 epoch: 68, train_loss: 0.8353, test_loss: 0.9965, test_f1: 0.5501
 epoch: 69, train_loss: 0.8425, test_loss: 1.0031, test_f1: 0.5573
 epoch: 70, train_loss: 0.8375, test_loss: 0.9960, test_f1: 0.5524
 epoch: 71, train_loss: 0.8362, test_loss: 0.9850, test_f1: 0.5583
 epoch: 72, train_loss: 0.8251, test_loss: 1.0035, test_f1: 0.5474
 epoch: 73, train_loss: 0.8257, test_loss: 0.9976, test_f1: 0.5446
 epoch: 74, train_loss: 0.8356, test_loss: 1.0084, test_f1: 0.5557
 epoch: 75, train_loss: 0.8266, test_loss: 0.9990, test_f1: 0.5619
 epoch: 76, train_loss: 0.8362, test_loss: 1.0239, test_f1: 0.5207
 epoch: 77, train_loss: 0.8356, test_loss: 1.0041, test_f1: 0.5598
 epoch: 78, train_loss: 0.8316, test_loss: 1.0200, test_f1: 0.5447
 epoch: 79, train_loss: 0.8194, test_loss: 1.0025, test_f1: 0.5626
 epoch: 80, train_loss: 0.8345, test_loss: 1.0043, test_f1: 0.5449
 epoch: 81, train_loss: 0.8200, test_loss: 0.9987, test_f1: 0.5573
 epoch: 82, train_loss: 0.8187, test_loss: 0.9972, test_f1: 0.5617
 epoch: 83, train_loss: 0.8231, test_loss: 0.9885, test_f1: 0.5478
 epoch: 84, train_loss: 0.8281, test_loss: 0.9871, test_f1: 0.5395
 epoch: 85, train_loss: 0.8295, test_loss: 1.0082, test_f1: 0.5539
 epoch: 86, train_loss: 0.8295, test_loss: 1.0123, test_f1: 0.5405
 epoch: 87, train_loss: 0.8172, test_loss: 0.9925, test_f1: 0.5653
 epoch: 88, train_loss: 0.8285, test_loss: 1.0007, test_f1: 0.5482
 epoch: 89, train_loss: 0.8208, test_loss: 0.9986, test_f1: 0.5585
 epoch: 90, train_loss: 0.8279, test_loss: 1.0038, test_f1: 0.5679
 epoch: 91, train_loss: 0.8244, test_loss: 1.0043, test_f1: 0.5626
 epoch: 92, train_loss: 0.8333, test_loss: 1.0129, test_f1: 0.5605
 epoch: 93, train_loss: 0.8219, test_loss: 1.0241, test_f1: 0.5589
 epoch: 94, train_loss: 0.8217, test_loss: 0.9908, test_f1: 0.5448
 epoch: 95, train_loss: 0.8111, test_loss: 0.9938, test_f1: 0.5703
 epoch: 96, train_loss: 0.8155, test_loss: 1.0101, test_f1: 0.5525
 epoch: 97, train_loss: 0.8222, test_loss: 1.0158, test_f1: 0.5598
 epoch: 98, train_loss: 0.8089, test_loss: 0.9946, test_f1: 0.5607
 epoch: 99, train_loss: 0.8103, test_loss: 0.9959, test_f1: 0.5557
##################ITERATION #4 ****************************************
 epoch: 0, train_loss: 1.2955, test_loss: 1.3594, test_f1: 0.2270
 epoch: 1, train_loss: 1.2188, test_loss: 1.3300, test_f1: 0.2270
 epoch: 2, train_loss: 1.2038, test_loss: 1.2746, test_f1: 0.2270
 epoch: 3, train_loss: 1.1860, test_loss: 1.2227, test_f1: 0.2270
 epoch: 4, train_loss: 1.1635, test_loss: 1.1769, test_f1: 0.2532
 epoch: 5, train_loss: 1.1418, test_loss: 1.1111, test_f1: 0.3854
 epoch: 6, train_loss: 1.1160, test_loss: 1.0639, test_f1: 0.4487
 epoch: 7, train_loss: 1.1147, test_loss: 1.0373, test_f1: 0.4891
 epoch: 8, train_loss: 1.0891, test_loss: 1.0358, test_f1: 0.5070
 epoch: 9, train_loss: 1.0705, test_loss: 1.0252, test_f1: 0.4950
 epoch: 10, train_loss: 1.0504, test_loss: 1.0001, test_f1: 0.4977
 epoch: 11, train_loss: 1.0348, test_loss: 1.0046, test_f1: 0.4828
 epoch: 12, train_loss: 1.0174, test_loss: 0.9769, test_f1: 0.4993
 epoch: 13, train_loss: 1.0221, test_loss: 0.9785, test_f1: 0.5015
 epoch: 14, train_loss: 1.0113, test_loss: 0.9781, test_f1: 0.5032
 epoch: 15, train_loss: 1.0021, test_loss: 0.9710, test_f1: 0.4937
 epoch: 16, train_loss: 0.9871, test_loss: 0.9656, test_f1: 0.4928
 epoch: 17, train_loss: 0.9762, test_loss: 0.9852, test_f1: 0.4829
 epoch: 18, train_loss: 0.9739, test_loss: 0.9585, test_f1: 0.5211
 epoch: 19, train_loss: 0.9631, test_loss: 0.9669, test_f1: 0.5062
 epoch: 20, train_loss: 0.9561, test_loss: 0.9632, test_f1: 0.5074
 epoch: 21, train_loss: 0.9391, test_loss: 0.9558, test_f1: 0.5097
 epoch: 22, train_loss: 0.9375, test_loss: 0.9458, test_f1: 0.4927
 epoch: 23, train_loss: 0.9361, test_loss: 0.9618, test_f1: 0.5169
 epoch: 24, train_loss: 0.9228, test_loss: 0.9469, test_f1: 0.5150
 epoch: 25, train_loss: 0.9241, test_loss: 0.9604, test_f1: 0.5103
 epoch: 26, train_loss: 0.9081, test_loss: 0.9620, test_f1: 0.5255
 epoch: 27, train_loss: 0.9165, test_loss: 0.9478, test_f1: 0.5225
 epoch: 28, train_loss: 0.9147, test_loss: 0.9468, test_f1: 0.5164
 epoch: 29, train_loss: 0.9124, test_loss: 0.9500, test_f1: 0.5188
 epoch: 30, train_loss: 0.9044, test_loss: 0.9412, test_f1: 0.5308
 epoch: 31, train_loss: 0.9047, test_loss: 0.9472, test_f1: 0.5232
 epoch: 32, train_loss: 0.8905, test_loss: 0.9578, test_f1: 0.5130
 epoch: 33, train_loss: 0.8903, test_loss: 0.9218, test_f1: 0.5344
 epoch: 34, train_loss: 0.8758, test_loss: 0.9494, test_f1: 0.5267
 epoch: 35, train_loss: 0.8868, test_loss: 0.9484, test_f1: 0.5301
 epoch: 36, train_loss: 0.8747, test_loss: 0.9421, test_f1: 0.5350
 epoch: 37, train_loss: 0.8707, test_loss: 0.9364, test_f1: 0.5447
 epoch: 38, train_loss: 0.8717, test_loss: 0.9476, test_f1: 0.5447
 epoch: 39, train_loss: 0.8819, test_loss: 0.9610, test_f1: 0.5089
 epoch: 40, train_loss: 0.8577, test_loss: 0.9602, test_f1: 0.5303
 epoch: 41, train_loss: 0.8760, test_loss: 0.9578, test_f1: 0.5264
 epoch: 42, train_loss: 0.8646, test_loss: 0.9830, test_f1: 0.5127
 epoch: 43, train_loss: 0.8739, test_loss: 0.9818, test_f1: 0.5168
 epoch: 44, train_loss: 0.8621, test_loss: 0.9544, test_f1: 0.5518
 epoch: 45, train_loss: 0.8523, test_loss: 0.9581, test_f1: 0.5393
 epoch: 46, train_loss: 0.8473, test_loss: 0.9395, test_f1: 0.5582
 epoch: 47, train_loss: 0.8467, test_loss: 0.9327, test_f1: 0.5597
 epoch: 48, train_loss: 0.8434, test_loss: 0.9385, test_f1: 0.5482
 epoch: 49, train_loss: 0.8483, test_loss: 0.9332, test_f1: 0.5457
 epoch: 50, train_loss: 0.8426, test_loss: 0.9475, test_f1: 0.5600
 epoch: 51, train_loss: 0.8231, test_loss: 0.9462, test_f1: 0.5436
 epoch: 52, train_loss: 0.8349, test_loss: 0.9517, test_f1: 0.5533
 epoch: 53, train_loss: 0.8235, test_loss: 0.9535, test_f1: 0.5620
 epoch: 54, train_loss: 0.8374, test_loss: 0.9432, test_f1: 0.5657
 epoch: 55, train_loss: 0.8347, test_loss: 0.9453, test_f1: 0.5432
 epoch: 56, train_loss: 0.8294, test_loss: 0.9509, test_f1: 0.5484
 epoch: 57, train_loss: 0.8240, test_loss: 0.9517, test_f1: 0.5411
 epoch: 58, train_loss: 0.8153, test_loss: 0.9478, test_f1: 0.5584
 epoch: 59, train_loss: 0.8182, test_loss: 0.9456, test_f1: 0.5557
 epoch: 60, train_loss: 0.8057, test_loss: 0.9346, test_f1: 0.5575
 epoch: 61, train_loss: 0.8180, test_loss: 0.9442, test_f1: 0.5477
 epoch: 62, train_loss: 0.8154, test_loss: 0.9435, test_f1: 0.5600
 epoch: 63, train_loss: 0.8048, test_loss: 0.9412, test_f1: 0.5679
 epoch: 64, train_loss: 0.8208, test_loss: 0.9499, test_f1: 0.5554
 epoch: 65, train_loss: 0.8153, test_loss: 0.9468, test_f1: 0.5547
 epoch: 66, train_loss: 0.8067, test_loss: 0.9534, test_f1: 0.5345
 epoch: 67, train_loss: 0.8023, test_loss: 0.9457, test_f1: 0.5625
 epoch: 68, train_loss: 0.8020, test_loss: 0.9414, test_f1: 0.5562
 epoch: 69, train_loss: 0.8182, test_loss: 0.9506, test_f1: 0.5614
 epoch: 70, train_loss: 0.8162, test_loss: 0.9507, test_f1: 0.5459
 epoch: 71, train_loss: 0.8084, test_loss: 0.9489, test_f1: 0.5663
 epoch: 72, train_loss: 0.8057, test_loss: 0.9415, test_f1: 0.5571
 epoch: 73, train_loss: 0.8025, test_loss: 0.9610, test_f1: 0.5478
 epoch: 74, train_loss: 0.8180, test_loss: 0.9559, test_f1: 0.5420
 epoch: 75, train_loss: 0.8063, test_loss: 0.9616, test_f1: 0.5503
 epoch: 76, train_loss: 0.8021, test_loss: 0.9522, test_f1: 0.5571
 epoch: 77, train_loss: 0.7954, test_loss: 0.9510, test_f1: 0.5468
 epoch: 78, train_loss: 0.7991, test_loss: 0.9801, test_f1: 0.5253
 epoch: 79, train_loss: 0.7982, test_loss: 0.9492, test_f1: 0.5600
 epoch: 80, train_loss: 0.7907, test_loss: 0.9650, test_f1: 0.5441
 epoch: 81, train_loss: 0.8026, test_loss: 0.9484, test_f1: 0.5492
 epoch: 82, train_loss: 0.7986, test_loss: 0.9564, test_f1: 0.5463
 epoch: 83, train_loss: 0.8037, test_loss: 0.9653, test_f1: 0.5486
 epoch: 84, train_loss: 0.7897, test_loss: 0.9589, test_f1: 0.5552
 epoch: 85, train_loss: 0.7977, test_loss: 0.9605, test_f1: 0.5489
 epoch: 86, train_loss: 0.7925, test_loss: 0.9514, test_f1: 0.5675
 epoch: 87, train_loss: 0.7897, test_loss: 0.9673, test_f1: 0.5479
 epoch: 88, train_loss: 0.7801, test_loss: 0.9609, test_f1: 0.5409
 epoch: 89, train_loss: 0.7909, test_loss: 0.9565, test_f1: 0.5457
 epoch: 90, train_loss: 0.7980, test_loss: 0.9617, test_f1: 0.5484
 epoch: 91, train_loss: 0.7967, test_loss: 0.9510, test_f1: 0.5461
 epoch: 92, train_loss: 0.7897, test_loss: 0.9629, test_f1: 0.5349
 epoch: 93, train_loss: 0.7902, test_loss: 0.9579, test_f1: 0.5589
 epoch: 94, train_loss: 0.7836, test_loss: 0.9706, test_f1: 0.5260
 epoch: 95, train_loss: 0.7725, test_loss: 0.9574, test_f1: 0.5476
 epoch: 96, train_loss: 0.7930, test_loss: 0.9797, test_f1: 0.5456
 epoch: 97, train_loss: 0.7809, test_loss: 0.9711, test_f1: 0.5508
 epoch: 98, train_loss: 0.7814, test_loss: 0.9713, test_f1: 0.5554
 epoch: 99, train_loss: 0.7871, test_loss: 0.9692, test_f1: 0.5421
##################ITERATION #5 ****************************************
 epoch: 0, train_loss: 1.3171, test_loss: 1.3470, test_f1: 0.2270
 epoch: 1, train_loss: 1.2048, test_loss: 1.2974, test_f1: 0.2270
 epoch: 2, train_loss: 1.1822, test_loss: 1.2279, test_f1: 0.2270
 epoch: 3, train_loss: 1.1431, test_loss: 1.1300, test_f1: 0.3940
 epoch: 4, train_loss: 1.1186, test_loss: 1.0794, test_f1: 0.4243
 epoch: 5, train_loss: 1.0932, test_loss: 1.0659, test_f1: 0.4664
 epoch: 6, train_loss: 1.0648, test_loss: 1.0030, test_f1: 0.4478
 epoch: 7, train_loss: 1.0576, test_loss: 0.9955, test_f1: 0.4583
 epoch: 8, train_loss: 1.0378, test_loss: 0.9944, test_f1: 0.4678
 epoch: 9, train_loss: 1.0307, test_loss: 0.9838, test_f1: 0.4572
 epoch: 10, train_loss: 1.0061, test_loss: 0.9750, test_f1: 0.4583
 epoch: 11, train_loss: 1.0071, test_loss: 0.9669, test_f1: 0.4581
 epoch: 12, train_loss: 1.0023, test_loss: 0.9694, test_f1: 0.4694
 epoch: 13, train_loss: 0.9867, test_loss: 0.9599, test_f1: 0.4674
 epoch: 14, train_loss: 0.9817, test_loss: 0.9809, test_f1: 0.4574
 epoch: 15, train_loss: 0.9741, test_loss: 0.9497, test_f1: 0.4746
 epoch: 16, train_loss: 0.9728, test_loss: 0.9990, test_f1: 0.4595
 epoch: 17, train_loss: 0.9736, test_loss: 0.9633, test_f1: 0.4788
 epoch: 18, train_loss: 0.9827, test_loss: 0.9832, test_f1: 0.4591
 epoch: 19, train_loss: 0.9762, test_loss: 0.9782, test_f1: 0.4718
 epoch: 20, train_loss: 0.9674, test_loss: 0.9620, test_f1: 0.4871
 epoch: 21, train_loss: 0.9460, test_loss: 0.9514, test_f1: 0.4972
 epoch: 22, train_loss: 0.9442, test_loss: 0.9652, test_f1: 0.4776
 epoch: 23, train_loss: 0.9284, test_loss: 0.9367, test_f1: 0.5052
 epoch: 24, train_loss: 0.9375, test_loss: 0.9348, test_f1: 0.5285
 epoch: 25, train_loss: 0.9382, test_loss: 0.9430, test_f1: 0.4976
 epoch: 26, train_loss: 0.9258, test_loss: 0.9571, test_f1: 0.4989
 epoch: 27, train_loss: 0.9282, test_loss: 0.9556, test_f1: 0.4938
 epoch: 28, train_loss: 0.9275, test_loss: 1.0227, test_f1: 0.4635
 epoch: 29, train_loss: 0.9273, test_loss: 0.9714, test_f1: 0.5062
 epoch: 30, train_loss: 0.9228, test_loss: 0.9843, test_f1: 0.4837
 epoch: 31, train_loss: 0.9225, test_loss: 0.9416, test_f1: 0.5319
 epoch: 32, train_loss: 0.9065, test_loss: 0.9512, test_f1: 0.5241
 epoch: 33, train_loss: 0.8995, test_loss: 0.9457, test_f1: 0.5209
 epoch: 34, train_loss: 0.9131, test_loss: 0.9588, test_f1: 0.5182
 epoch: 35, train_loss: 0.9022, test_loss: 0.9772, test_f1: 0.5051
 epoch: 36, train_loss: 0.9128, test_loss: 0.9595, test_f1: 0.5144
 epoch: 37, train_loss: 0.8991, test_loss: 0.9766, test_f1: 0.5043
 epoch: 38, train_loss: 0.9116, test_loss: 0.9616, test_f1: 0.5437
 epoch: 39, train_loss: 0.9052, test_loss: 0.9637, test_f1: 0.5057
 epoch: 40, train_loss: 0.8873, test_loss: 0.9855, test_f1: 0.5104
 epoch: 41, train_loss: 0.8901, test_loss: 0.9941, test_f1: 0.5241
 epoch: 42, train_loss: 0.8930, test_loss: 0.9768, test_f1: 0.5200
 epoch: 43, train_loss: 0.8873, test_loss: 0.9800, test_f1: 0.5209
 epoch: 44, train_loss: 0.8875, test_loss: 0.9738, test_f1: 0.5291
 epoch: 45, train_loss: 0.8774, test_loss: 0.9635, test_f1: 0.5320
 epoch: 46, train_loss: 0.8783, test_loss: 0.9647, test_f1: 0.5313
 epoch: 47, train_loss: 0.8734, test_loss: 0.9567, test_f1: 0.5293
 epoch: 48, train_loss: 0.8795, test_loss: 0.9762, test_f1: 0.5294
 epoch: 49, train_loss: 0.8692, test_loss: 0.9850, test_f1: 0.5237
 epoch: 50, train_loss: 0.8690, test_loss: 0.9922, test_f1: 0.5191
 epoch: 51, train_loss: 0.8652, test_loss: 0.9656, test_f1: 0.5282
 epoch: 52, train_loss: 0.8539, test_loss: 0.9666, test_f1: 0.5445
 epoch: 53, train_loss: 0.8544, test_loss: 0.9833, test_f1: 0.5401
 epoch: 54, train_loss: 0.8442, test_loss: 0.9753, test_f1: 0.5374
 epoch: 55, train_loss: 0.8607, test_loss: 0.9847, test_f1: 0.5245
 epoch: 56, train_loss: 0.8467, test_loss: 0.9965, test_f1: 0.5336
 epoch: 57, train_loss: 0.8427, test_loss: 0.9856, test_f1: 0.5450
 epoch: 58, train_loss: 0.8489, test_loss: 0.9914, test_f1: 0.5405
 epoch: 59, train_loss: 0.8531, test_loss: 0.9787, test_f1: 0.5437
 epoch: 60, train_loss: 0.8472, test_loss: 0.9742, test_f1: 0.5449
 epoch: 61, train_loss: 0.8533, test_loss: 0.9805, test_f1: 0.5447
 epoch: 62, train_loss: 0.8439, test_loss: 0.9795, test_f1: 0.5549
 epoch: 63, train_loss: 0.8446, test_loss: 0.9734, test_f1: 0.5528
 epoch: 64, train_loss: 0.8441, test_loss: 0.9819, test_f1: 0.5446
 epoch: 65, train_loss: 0.8410, test_loss: 0.9816, test_f1: 0.5394
 epoch: 66, train_loss: 0.8378, test_loss: 0.9924, test_f1: 0.5346
 epoch: 67, train_loss: 0.8398, test_loss: 0.9797, test_f1: 0.5383
 epoch: 68, train_loss: 0.8374, test_loss: 0.9842, test_f1: 0.5354
 epoch: 69, train_loss: 0.8359, test_loss: 0.9936, test_f1: 0.5288
 epoch: 70, train_loss: 0.8429, test_loss: 0.9836, test_f1: 0.5365
 epoch: 71, train_loss: 0.8354, test_loss: 0.9852, test_f1: 0.5344
 epoch: 72, train_loss: 0.8307, test_loss: 0.9859, test_f1: 0.5350
 epoch: 73, train_loss: 0.8230, test_loss: 0.9866, test_f1: 0.5399
 epoch: 74, train_loss: 0.8302, test_loss: 0.9752, test_f1: 0.5506
 epoch: 75, train_loss: 0.8216, test_loss: 0.9791, test_f1: 0.5421
 epoch: 76, train_loss: 0.8253, test_loss: 0.9723, test_f1: 0.5476
 epoch: 77, train_loss: 0.8246, test_loss: 0.9865, test_f1: 0.5453
 epoch: 78, train_loss: 0.8284, test_loss: 0.9904, test_f1: 0.5447
 epoch: 79, train_loss: 0.8333, test_loss: 0.9895, test_f1: 0.5475
 epoch: 80, train_loss: 0.8236, test_loss: 0.9775, test_f1: 0.5403
 epoch: 81, train_loss: 0.8359, test_loss: 0.9801, test_f1: 0.5407
 epoch: 82, train_loss: 0.8220, test_loss: 0.9861, test_f1: 0.5414
 epoch: 83, train_loss: 0.8199, test_loss: 0.9727, test_f1: 0.5448
 epoch: 84, train_loss: 0.8151, test_loss: 0.9762, test_f1: 0.5381
 epoch: 85, train_loss: 0.8223, test_loss: 0.9932, test_f1: 0.5413
 epoch: 86, train_loss: 0.8275, test_loss: 0.9855, test_f1: 0.5461
 epoch: 87, train_loss: 0.8186, test_loss: 0.9786, test_f1: 0.5494
 epoch: 88, train_loss: 0.8317, test_loss: 0.9891, test_f1: 0.5439
 epoch: 89, train_loss: 0.8135, test_loss: 0.9821, test_f1: 0.5568
 epoch: 90, train_loss: 0.8222, test_loss: 0.9832, test_f1: 0.5494
 epoch: 91, train_loss: 0.8185, test_loss: 0.9896, test_f1: 0.5489
 epoch: 92, train_loss: 0.8168, test_loss: 0.9955, test_f1: 0.5413
 epoch: 93, train_loss: 0.8210, test_loss: 0.9815, test_f1: 0.5459
 epoch: 94, train_loss: 0.8184, test_loss: 0.9872, test_f1: 0.5451
 epoch: 95, train_loss: 0.8111, test_loss: 0.9845, test_f1: 0.5451
 epoch: 96, train_loss: 0.8075, test_loss: 0.9825, test_f1: 0.5467
 epoch: 97, train_loss: 0.8178, test_loss: 1.0010, test_f1: 0.5389
 epoch: 98, train_loss: 0.8133, test_loss: 0.9761, test_f1: 0.5489
 epoch: 99, train_loss: 0.8000, test_loss: 0.9869, test_f1: 0.5474
##################ITERATION #6 ****************************************
 epoch: 0, train_loss: 1.4219, test_loss: 1.3222, test_f1: 0.2270
 epoch: 1, train_loss: 1.2579, test_loss: 1.2901, test_f1: 0.2270
 epoch: 2, train_loss: 1.2073, test_loss: 1.2373, test_f1: 0.2270
 epoch: 3, train_loss: 1.1623, test_loss: 1.1672, test_f1: 0.3028
 epoch: 4, train_loss: 1.1405, test_loss: 1.0997, test_f1: 0.3740
 epoch: 5, train_loss: 1.1244, test_loss: 1.0672, test_f1: 0.4092
 epoch: 6, train_loss: 1.1054, test_loss: 1.0472, test_f1: 0.4364
 epoch: 7, train_loss: 1.0936, test_loss: 1.0296, test_f1: 0.4380
 epoch: 8, train_loss: 1.0671, test_loss: 1.0196, test_f1: 0.4458
 epoch: 9, train_loss: 1.0531, test_loss: 1.0006, test_f1: 0.4487
 epoch: 10, train_loss: 1.0502, test_loss: 1.0026, test_f1: 0.4485
 epoch: 11, train_loss: 1.0378, test_loss: 0.9897, test_f1: 0.4710
 epoch: 12, train_loss: 1.0163, test_loss: 0.9825, test_f1: 0.4670
 epoch: 13, train_loss: 1.0189, test_loss: 0.9789, test_f1: 0.4659
 epoch: 14, train_loss: 1.0074, test_loss: 0.9624, test_f1: 0.4693
 epoch: 15, train_loss: 0.9966, test_loss: 0.9703, test_f1: 0.4745
 epoch: 16, train_loss: 0.9922, test_loss: 0.9791, test_f1: 0.4573
 epoch: 17, train_loss: 0.9850, test_loss: 0.9586, test_f1: 0.4760
 epoch: 18, train_loss: 0.9792, test_loss: 0.9435, test_f1: 0.4884
 epoch: 19, train_loss: 0.9817, test_loss: 0.9535, test_f1: 0.4934
 epoch: 20, train_loss: 0.9656, test_loss: 0.9520, test_f1: 0.4866
 epoch: 21, train_loss: 0.9703, test_loss: 0.9568, test_f1: 0.4792
 epoch: 22, train_loss: 0.9640, test_loss: 0.9667, test_f1: 0.4805
 epoch: 23, train_loss: 0.9482, test_loss: 0.9611, test_f1: 0.4979
 epoch: 24, train_loss: 0.9506, test_loss: 0.9608, test_f1: 0.4719
 epoch: 25, train_loss: 0.9474, test_loss: 0.9654, test_f1: 0.4831
 epoch: 26, train_loss: 0.9354, test_loss: 0.9518, test_f1: 0.4805
 epoch: 27, train_loss: 0.9376, test_loss: 0.9745, test_f1: 0.4830
 epoch: 28, train_loss: 0.9392, test_loss: 0.9673, test_f1: 0.4946
 epoch: 29, train_loss: 0.9329, test_loss: 0.9556, test_f1: 0.4932
 epoch: 30, train_loss: 0.9217, test_loss: 0.9727, test_f1: 0.4898
 epoch: 31, train_loss: 0.9329, test_loss: 0.9715, test_f1: 0.4899
 epoch: 32, train_loss: 0.9171, test_loss: 0.9697, test_f1: 0.4918
 epoch: 33, train_loss: 0.9160, test_loss: 0.9824, test_f1: 0.4740
 epoch: 34, train_loss: 0.9189, test_loss: 0.9672, test_f1: 0.4943
 epoch: 35, train_loss: 0.9125, test_loss: 0.9776, test_f1: 0.4880
 epoch: 36, train_loss: 0.9021, test_loss: 0.9711, test_f1: 0.4911
 epoch: 37, train_loss: 0.8943, test_loss: 0.9809, test_f1: 0.4807
 epoch: 38, train_loss: 0.8836, test_loss: 0.9960, test_f1: 0.4738
 epoch: 39, train_loss: 0.8911, test_loss: 0.9703, test_f1: 0.4892
 epoch: 40, train_loss: 0.8913, test_loss: 0.9404, test_f1: 0.4917
 epoch: 41, train_loss: 0.9003, test_loss: 0.9825, test_f1: 0.4905
 epoch: 42, train_loss: 0.8935, test_loss: 0.9502, test_f1: 0.4921
 epoch: 43, train_loss: 0.8958, test_loss: 0.9988, test_f1: 0.4753
 epoch: 44, train_loss: 0.8871, test_loss: 0.9767, test_f1: 0.4819
 epoch: 45, train_loss: 0.8871, test_loss: 0.9609, test_f1: 0.5063
 epoch: 46, train_loss: 0.8805, test_loss: 0.9702, test_f1: 0.4712
 epoch: 47, train_loss: 0.8736, test_loss: 0.9889, test_f1: 0.4870
 epoch: 48, train_loss: 0.8709, test_loss: 0.9983, test_f1: 0.4749
 epoch: 49, train_loss: 0.8738, test_loss: 1.0005, test_f1: 0.4667
 epoch: 50, train_loss: 0.8690, test_loss: 0.9829, test_f1: 0.4898
 epoch: 51, train_loss: 0.8737, test_loss: 0.9914, test_f1: 0.4839
 epoch: 52, train_loss: 0.8742, test_loss: 0.9698, test_f1: 0.4966
 epoch: 53, train_loss: 0.8556, test_loss: 0.9690, test_f1: 0.4913
 epoch: 54, train_loss: 0.8692, test_loss: 0.9816, test_f1: 0.4882
 epoch: 55, train_loss: 0.8622, test_loss: 0.9715, test_f1: 0.4858
 epoch: 56, train_loss: 0.8602, test_loss: 0.9901, test_f1: 0.4859
 epoch: 57, train_loss: 0.8531, test_loss: 0.9716, test_f1: 0.5009
 epoch: 58, train_loss: 0.8436, test_loss: 0.9674, test_f1: 0.4855
 epoch: 59, train_loss: 0.8499, test_loss: 0.9854, test_f1: 0.4859
 epoch: 60, train_loss: 0.8428, test_loss: 0.9921, test_f1: 0.4776
 epoch: 61, train_loss: 0.8493, test_loss: 0.9902, test_f1: 0.4733
 epoch: 62, train_loss: 0.8379, test_loss: 0.9868, test_f1: 0.4869
 epoch: 63, train_loss: 0.8396, test_loss: 0.9746, test_f1: 0.4932
 epoch: 64, train_loss: 0.8433, test_loss: 0.9850, test_f1: 0.4897
 epoch: 65, train_loss: 0.8475, test_loss: 0.9879, test_f1: 0.4927
 epoch: 66, train_loss: 0.8447, test_loss: 0.9897, test_f1: 0.4852
 epoch: 67, train_loss: 0.8320, test_loss: 0.9728, test_f1: 0.5041
 epoch: 68, train_loss: 0.8457, test_loss: 0.9854, test_f1: 0.4944
 epoch: 69, train_loss: 0.8428, test_loss: 1.0032, test_f1: 0.4890
 epoch: 70, train_loss: 0.8538, test_loss: 0.9721, test_f1: 0.4860
 epoch: 71, train_loss: 0.8396, test_loss: 0.9838, test_f1: 0.4994
 epoch: 72, train_loss: 0.8372, test_loss: 0.9929, test_f1: 0.4844
 epoch: 73, train_loss: 0.8478, test_loss: 1.0003, test_f1: 0.4825
 epoch: 74, train_loss: 0.8327, test_loss: 0.9831, test_f1: 0.4872
 epoch: 75, train_loss: 0.8401, test_loss: 0.9876, test_f1: 0.4908
 epoch: 76, train_loss: 0.8308, test_loss: 0.9989, test_f1: 0.4953
 epoch: 77, train_loss: 0.8266, test_loss: 1.0044, test_f1: 0.5000
 epoch: 78, train_loss: 0.8426, test_loss: 1.0121, test_f1: 0.4991
 epoch: 79, train_loss: 0.8239, test_loss: 1.0015, test_f1: 0.4879
 epoch: 80, train_loss: 0.8350, test_loss: 1.0290, test_f1: 0.4816
 epoch: 81, train_loss: 0.8240, test_loss: 0.9892, test_f1: 0.4935
 epoch: 82, train_loss: 0.8295, test_loss: 1.0254, test_f1: 0.4727
 epoch: 83, train_loss: 0.8259, test_loss: 1.0042, test_f1: 0.4911
 epoch: 84, train_loss: 0.8281, test_loss: 0.9966, test_f1: 0.4859
 epoch: 85, train_loss: 0.8312, test_loss: 1.0285, test_f1: 0.4843
 epoch: 86, train_loss: 0.8259, test_loss: 0.9776, test_f1: 0.4965
 epoch: 87, train_loss: 0.8184, test_loss: 0.9921, test_f1: 0.4814
 epoch: 88, train_loss: 0.8290, test_loss: 0.9971, test_f1: 0.4965
 epoch: 89, train_loss: 0.8182, test_loss: 0.9937, test_f1: 0.4952
 epoch: 90, train_loss: 0.8222, test_loss: 0.9893, test_f1: 0.4838
 epoch: 91, train_loss: 0.8141, test_loss: 0.9706, test_f1: 0.4973
 epoch: 92, train_loss: 0.8195, test_loss: 1.0103, test_f1: 0.4949
 epoch: 93, train_loss: 0.8144, test_loss: 1.0156, test_f1: 0.4764
 epoch: 94, train_loss: 0.8161, test_loss: 0.9881, test_f1: 0.4945
 epoch: 95, train_loss: 0.8210, test_loss: 0.9907, test_f1: 0.5151
 epoch: 96, train_loss: 0.8203, test_loss: 0.9835, test_f1: 0.4922
 epoch: 97, train_loss: 0.8181, test_loss: 1.0337, test_f1: 0.4991
 epoch: 98, train_loss: 0.8245, test_loss: 1.0027, test_f1: 0.4959
 epoch: 99, train_loss: 0.8173, test_loss: 1.0262, test_f1: 0.4956
##################ITERATION #7 ****************************************
 epoch: 0, train_loss: 1.3664, test_loss: 1.3424, test_f1: 0.2270
 epoch: 1, train_loss: 1.2417, test_loss: 1.3013, test_f1: 0.2270
 epoch: 2, train_loss: 1.1944, test_loss: 1.2020, test_f1: 0.3059
 epoch: 3, train_loss: 1.1626, test_loss: 1.1320, test_f1: 0.3360
 epoch: 4, train_loss: 1.1371, test_loss: 1.0776, test_f1: 0.3866
 epoch: 5, train_loss: 1.1220, test_loss: 1.0399, test_f1: 0.4220
 epoch: 6, train_loss: 1.0928, test_loss: 1.0252, test_f1: 0.4335
 epoch: 7, train_loss: 1.0937, test_loss: 1.0115, test_f1: 0.4272
 epoch: 8, train_loss: 1.0763, test_loss: 1.0011, test_f1: 0.4406
 epoch: 9, train_loss: 1.0576, test_loss: 0.9899, test_f1: 0.4362
 epoch: 10, train_loss: 1.0436, test_loss: 0.9897, test_f1: 0.4347
 epoch: 11, train_loss: 1.0356, test_loss: 0.9614, test_f1: 0.4635
 epoch: 12, train_loss: 1.0215, test_loss: 0.9596, test_f1: 0.4651
 epoch: 13, train_loss: 1.0107, test_loss: 0.9678, test_f1: 0.4507
 epoch: 14, train_loss: 0.9994, test_loss: 0.9772, test_f1: 0.4570
 epoch: 15, train_loss: 1.0100, test_loss: 0.9620, test_f1: 0.4601
 epoch: 16, train_loss: 0.9847, test_loss: 0.9606, test_f1: 0.4569
 epoch: 17, train_loss: 0.9931, test_loss: 0.9539, test_f1: 0.4638
 epoch: 18, train_loss: 0.9841, test_loss: 1.0164, test_f1: 0.4515
 epoch: 19, train_loss: 0.9750, test_loss: 0.9538, test_f1: 0.4654
 epoch: 20, train_loss: 0.9594, test_loss: 0.9748, test_f1: 0.4611
 epoch: 21, train_loss: 0.9683, test_loss: 0.9947, test_f1: 0.4568
 epoch: 22, train_loss: 0.9609, test_loss: 0.9394, test_f1: 0.4804
 epoch: 23, train_loss: 0.9560, test_loss: 0.9783, test_f1: 0.4650
 epoch: 24, train_loss: 0.9456, test_loss: 0.9861, test_f1: 0.4714
 epoch: 25, train_loss: 0.9428, test_loss: 0.9911, test_f1: 0.4614
 epoch: 26, train_loss: 0.9372, test_loss: 0.9760, test_f1: 0.4658
 epoch: 27, train_loss: 0.9324, test_loss: 0.9571, test_f1: 0.4657
 epoch: 28, train_loss: 0.9378, test_loss: 0.9987, test_f1: 0.4720
 epoch: 29, train_loss: 0.9269, test_loss: 0.9383, test_f1: 0.4861
 epoch: 30, train_loss: 0.9323, test_loss: 0.9659, test_f1: 0.4618
 epoch: 31, train_loss: 0.9180, test_loss: 0.9773, test_f1: 0.4957
 epoch: 32, train_loss: 0.9202, test_loss: 0.9740, test_f1: 0.4735
 epoch: 33, train_loss: 0.9028, test_loss: 1.0218, test_f1: 0.4805
 epoch: 34, train_loss: 0.9186, test_loss: 0.9746, test_f1: 0.4632
 epoch: 35, train_loss: 0.9119, test_loss: 0.9888, test_f1: 0.4828
 epoch: 36, train_loss: 0.9071, test_loss: 1.0193, test_f1: 0.4723
 epoch: 37, train_loss: 0.9030, test_loss: 1.0024, test_f1: 0.4752
 epoch: 38, train_loss: 0.8975, test_loss: 0.9945, test_f1: 0.4779
 epoch: 39, train_loss: 0.8973, test_loss: 0.9977, test_f1: 0.4962
 epoch: 40, train_loss: 0.8995, test_loss: 0.9909, test_f1: 0.4969
 epoch: 41, train_loss: 0.9043, test_loss: 1.0031, test_f1: 0.4848
 epoch: 42, train_loss: 0.8870, test_loss: 1.0070, test_f1: 0.4971
 epoch: 43, train_loss: 0.8847, test_loss: 1.0227, test_f1: 0.4788
 epoch: 44, train_loss: 0.8865, test_loss: 0.9876, test_f1: 0.4785
 epoch: 45, train_loss: 0.8838, test_loss: 1.0174, test_f1: 0.4832
 epoch: 46, train_loss: 0.8785, test_loss: 0.9849, test_f1: 0.5019
 epoch: 47, train_loss: 0.8849, test_loss: 1.0118, test_f1: 0.4897
 epoch: 48, train_loss: 0.8791, test_loss: 1.0235, test_f1: 0.5058
 epoch: 49, train_loss: 0.8678, test_loss: 1.0040, test_f1: 0.4780
 epoch: 50, train_loss: 0.8653, test_loss: 1.0123, test_f1: 0.4967
 epoch: 51, train_loss: 0.8546, test_loss: 0.9899, test_f1: 0.4865
 epoch: 52, train_loss: 0.8589, test_loss: 1.0056, test_f1: 0.4902
 epoch: 53, train_loss: 0.8564, test_loss: 0.9885, test_f1: 0.5015
 epoch: 54, train_loss: 0.8447, test_loss: 0.9982, test_f1: 0.5022
 epoch: 55, train_loss: 0.8655, test_loss: 1.0056, test_f1: 0.5010
 epoch: 56, train_loss: 0.8608, test_loss: 0.9962, test_f1: 0.5037
 epoch: 57, train_loss: 0.8558, test_loss: 0.9968, test_f1: 0.4977
 epoch: 58, train_loss: 0.8507, test_loss: 0.9962, test_f1: 0.5016
 epoch: 59, train_loss: 0.8495, test_loss: 0.9944, test_f1: 0.4990
 epoch: 60, train_loss: 0.8433, test_loss: 0.9919, test_f1: 0.5129
 epoch: 61, train_loss: 0.8369, test_loss: 0.9934, test_f1: 0.5105
 epoch: 62, train_loss: 0.8443, test_loss: 1.0048, test_f1: 0.5148
 epoch: 63, train_loss: 0.8456, test_loss: 0.9882, test_f1: 0.5130
 epoch: 64, train_loss: 0.8437, test_loss: 1.0121, test_f1: 0.4995
 epoch: 65, train_loss: 0.8403, test_loss: 0.9958, test_f1: 0.5025
 epoch: 66, train_loss: 0.8305, test_loss: 0.9849, test_f1: 0.5058
 epoch: 67, train_loss: 0.8300, test_loss: 0.9900, test_f1: 0.5118
 epoch: 68, train_loss: 0.8383, test_loss: 0.9852, test_f1: 0.5150
 epoch: 69, train_loss: 0.8412, test_loss: 0.9866, test_f1: 0.5126
 epoch: 70, train_loss: 0.8450, test_loss: 1.0028, test_f1: 0.5239
 epoch: 71, train_loss: 0.8376, test_loss: 0.9985, test_f1: 0.5213
 epoch: 72, train_loss: 0.8353, test_loss: 0.9866, test_f1: 0.5130
 epoch: 73, train_loss: 0.8319, test_loss: 0.9904, test_f1: 0.4967
 epoch: 74, train_loss: 0.8313, test_loss: 0.9838, test_f1: 0.5068
 epoch: 75, train_loss: 0.8293, test_loss: 0.9985, test_f1: 0.5161
 epoch: 76, train_loss: 0.8325, test_loss: 0.9826, test_f1: 0.5198
 epoch: 77, train_loss: 0.8310, test_loss: 0.9896, test_f1: 0.5175
 epoch: 78, train_loss: 0.8179, test_loss: 0.9768, test_f1: 0.5123
 epoch: 79, train_loss: 0.8359, test_loss: 0.9801, test_f1: 0.5161
 epoch: 80, train_loss: 0.8301, test_loss: 1.0050, test_f1: 0.5225
 epoch: 81, train_loss: 0.8315, test_loss: 1.0122, test_f1: 0.5204
 epoch: 82, train_loss: 0.8318, test_loss: 1.0083, test_f1: 0.5084
 epoch: 83, train_loss: 0.8321, test_loss: 0.9914, test_f1: 0.5106
 epoch: 84, train_loss: 0.8262, test_loss: 0.9900, test_f1: 0.5055
 epoch: 85, train_loss: 0.8064, test_loss: 1.0048, test_f1: 0.5132
 epoch: 86, train_loss: 0.8289, test_loss: 0.9989, test_f1: 0.5079
 epoch: 87, train_loss: 0.8295, test_loss: 0.9826, test_f1: 0.5251
 epoch: 88, train_loss: 0.8108, test_loss: 0.9817, test_f1: 0.5322
 epoch: 89, train_loss: 0.8206, test_loss: 0.9790, test_f1: 0.5299
 epoch: 90, train_loss: 0.8305, test_loss: 0.9821, test_f1: 0.5201
 epoch: 91, train_loss: 0.8258, test_loss: 0.9882, test_f1: 0.5259
 epoch: 92, train_loss: 0.8205, test_loss: 0.9844, test_f1: 0.5207
 epoch: 93, train_loss: 0.8095, test_loss: 0.9803, test_f1: 0.5231
 epoch: 94, train_loss: 0.8240, test_loss: 0.9833, test_f1: 0.5290
 epoch: 95, train_loss: 0.8119, test_loss: 0.9872, test_f1: 0.5183
 epoch: 96, train_loss: 0.8082, test_loss: 0.9815, test_f1: 0.5268
 epoch: 97, train_loss: 0.8037, test_loss: 0.9879, test_f1: 0.5291
 epoch: 98, train_loss: 0.8164, test_loss: 0.9819, test_f1: 0.5239
 epoch: 99, train_loss: 0.7991, test_loss: 0.9871, test_f1: 0.5225
##################ITERATION #8 ****************************************
 epoch: 0, train_loss: 1.5689, test_loss: 1.3942, test_f1: 0.2270
 epoch: 1, train_loss: 1.2946, test_loss: 1.3365, test_f1: 0.2270
 epoch: 2, train_loss: 1.2274, test_loss: 1.3014, test_f1: 0.2522
 epoch: 3, train_loss: 1.2011, test_loss: 1.2402, test_f1: 0.3015
 epoch: 4, train_loss: 1.1882, test_loss: 1.1686, test_f1: 0.3338
 epoch: 5, train_loss: 1.1570, test_loss: 1.1080, test_f1: 0.4062
 epoch: 6, train_loss: 1.1320, test_loss: 1.0650, test_f1: 0.4378
 epoch: 7, train_loss: 1.1239, test_loss: 1.0461, test_f1: 0.4415
 epoch: 8, train_loss: 1.1043, test_loss: 1.0358, test_f1: 0.4429
 epoch: 9, train_loss: 1.0982, test_loss: 1.0166, test_f1: 0.4513
 epoch: 10, train_loss: 1.0828, test_loss: 1.0120, test_f1: 0.4519
 epoch: 11, train_loss: 1.0689, test_loss: 0.9975, test_f1: 0.4557
 epoch: 12, train_loss: 1.0597, test_loss: 0.9876, test_f1: 0.4679
 epoch: 13, train_loss: 1.0482, test_loss: 0.9919, test_f1: 0.4491
 epoch: 14, train_loss: 1.0434, test_loss: 0.9942, test_f1: 0.4430
 epoch: 15, train_loss: 1.0275, test_loss: 1.0014, test_f1: 0.4534
 epoch: 16, train_loss: 1.0277, test_loss: 0.9890, test_f1: 0.4592
 epoch: 17, train_loss: 1.0278, test_loss: 0.9765, test_f1: 0.4614
 epoch: 18, train_loss: 1.0166, test_loss: 0.9713, test_f1: 0.4698
 epoch: 19, train_loss: 1.0123, test_loss: 0.9925, test_f1: 0.4563
 epoch: 20, train_loss: 1.0047, test_loss: 1.0170, test_f1: 0.4717
 epoch: 21, train_loss: 0.9953, test_loss: 1.0028, test_f1: 0.4640
 epoch: 22, train_loss: 0.9896, test_loss: 1.0007, test_f1: 0.4660
 epoch: 23, train_loss: 0.9821, test_loss: 0.9961, test_f1: 0.4727
 epoch: 24, train_loss: 0.9808, test_loss: 0.9921, test_f1: 0.4709
 epoch: 25, train_loss: 0.9813, test_loss: 0.9351, test_f1: 0.4919
 epoch: 26, train_loss: 0.9676, test_loss: 0.9742, test_f1: 0.4817
 epoch: 27, train_loss: 0.9601, test_loss: 0.9984, test_f1: 0.4718
 epoch: 28, train_loss: 0.9635, test_loss: 0.9911, test_f1: 0.4709
 epoch: 29, train_loss: 0.9607, test_loss: 0.9857, test_f1: 0.4804
 epoch: 30, train_loss: 0.9695, test_loss: 0.9675, test_f1: 0.4691
 epoch: 31, train_loss: 0.9533, test_loss: 1.0013, test_f1: 0.4695
 epoch: 32, train_loss: 0.9497, test_loss: 0.9915, test_f1: 0.4787
 epoch: 33, train_loss: 0.9436, test_loss: 0.9820, test_f1: 0.4882
 epoch: 34, train_loss: 0.9442, test_loss: 0.9901, test_f1: 0.4834
 epoch: 35, train_loss: 0.9522, test_loss: 0.9941, test_f1: 0.4798
 epoch: 36, train_loss: 0.9363, test_loss: 1.0064, test_f1: 0.4980
 epoch: 37, train_loss: 0.9322, test_loss: 0.9933, test_f1: 0.4847
 epoch: 38, train_loss: 0.9356, test_loss: 0.9941, test_f1: 0.4837
 epoch: 39, train_loss: 0.9380, test_loss: 0.9992, test_f1: 0.4942
 epoch: 40, train_loss: 0.9276, test_loss: 1.0072, test_f1: 0.4863
 epoch: 41, train_loss: 0.9373, test_loss: 1.0039, test_f1: 0.5007
 epoch: 42, train_loss: 0.9364, test_loss: 0.9483, test_f1: 0.5077
 epoch: 43, train_loss: 0.9230, test_loss: 0.9887, test_f1: 0.4974
 epoch: 44, train_loss: 0.9210, test_loss: 0.9787, test_f1: 0.4961
 epoch: 45, train_loss: 0.9197, test_loss: 0.9783, test_f1: 0.5067
 epoch: 46, train_loss: 0.9193, test_loss: 0.9979, test_f1: 0.5065
 epoch: 47, train_loss: 0.9163, test_loss: 0.9938, test_f1: 0.5039
 epoch: 48, train_loss: 0.9081, test_loss: 0.9976, test_f1: 0.4823
 epoch: 49, train_loss: 0.9174, test_loss: 0.9862, test_f1: 0.5007
 epoch: 50, train_loss: 0.9049, test_loss: 0.9995, test_f1: 0.5061
 epoch: 51, train_loss: 0.8877, test_loss: 0.9856, test_f1: 0.5007
 epoch: 52, train_loss: 0.8955, test_loss: 0.9801, test_f1: 0.5160
 epoch: 53, train_loss: 0.8891, test_loss: 0.9871, test_f1: 0.5183
 epoch: 54, train_loss: 0.8890, test_loss: 0.9897, test_f1: 0.5134
 epoch: 55, train_loss: 0.9052, test_loss: 0.9898, test_f1: 0.5116
 epoch: 56, train_loss: 0.8866, test_loss: 0.9850, test_f1: 0.5151
 epoch: 57, train_loss: 0.8989, test_loss: 0.9835, test_f1: 0.5225
 epoch: 58, train_loss: 0.8920, test_loss: 0.9766, test_f1: 0.5129
 epoch: 59, train_loss: 0.8968, test_loss: 0.9803, test_f1: 0.5184
 epoch: 60, train_loss: 0.8787, test_loss: 0.9854, test_f1: 0.5248
 epoch: 61, train_loss: 0.8918, test_loss: 0.9919, test_f1: 0.5213
 epoch: 62, train_loss: 0.8850, test_loss: 0.9902, test_f1: 0.5209
 epoch: 63, train_loss: 0.8843, test_loss: 0.9925, test_f1: 0.5241
 epoch: 64, train_loss: 0.8866, test_loss: 0.9797, test_f1: 0.5220
 epoch: 65, train_loss: 0.8840, test_loss: 0.9897, test_f1: 0.5216
 epoch: 66, train_loss: 0.8822, test_loss: 0.9913, test_f1: 0.5241
 epoch: 67, train_loss: 0.8710, test_loss: 0.9734, test_f1: 0.5258
 epoch: 68, train_loss: 0.8788, test_loss: 0.9816, test_f1: 0.5209
 epoch: 69, train_loss: 0.8836, test_loss: 0.9839, test_f1: 0.5205
 epoch: 70, train_loss: 0.8759, test_loss: 0.9814, test_f1: 0.5187
 epoch: 71, train_loss: 0.8851, test_loss: 0.9820, test_f1: 0.5259
 epoch: 72, train_loss: 0.8808, test_loss: 0.9850, test_f1: 0.5162
 epoch: 73, train_loss: 0.8736, test_loss: 0.9786, test_f1: 0.5218
 epoch: 74, train_loss: 0.8673, test_loss: 0.9835, test_f1: 0.5278
 epoch: 75, train_loss: 0.8706, test_loss: 0.9777, test_f1: 0.5244
 epoch: 76, train_loss: 0.8705, test_loss: 0.9771, test_f1: 0.5282
 epoch: 77, train_loss: 0.8678, test_loss: 0.9791, test_f1: 0.5157
 epoch: 78, train_loss: 0.8774, test_loss: 0.9895, test_f1: 0.5242
 epoch: 79, train_loss: 0.8721, test_loss: 0.9800, test_f1: 0.5306
 epoch: 80, train_loss: 0.8744, test_loss: 0.9798, test_f1: 0.5204
 epoch: 81, train_loss: 0.8741, test_loss: 0.9803, test_f1: 0.5250
 epoch: 82, train_loss: 0.8710, test_loss: 0.9824, test_f1: 0.5224
 epoch: 83, train_loss: 0.8658, test_loss: 0.9837, test_f1: 0.5194
 epoch: 84, train_loss: 0.8570, test_loss: 0.9921, test_f1: 0.5232
 epoch: 85, train_loss: 0.8673, test_loss: 1.0010, test_f1: 0.5255
 epoch: 86, train_loss: 0.8565, test_loss: 0.9830, test_f1: 0.5282
 epoch: 87, train_loss: 0.8726, test_loss: 0.9962, test_f1: 0.5232
 epoch: 88, train_loss: 0.8514, test_loss: 0.9945, test_f1: 0.5187
 epoch: 89, train_loss: 0.8688, test_loss: 0.9846, test_f1: 0.5197
 epoch: 90, train_loss: 0.8633, test_loss: 0.9876, test_f1: 0.5235
 epoch: 91, train_loss: 0.8622, test_loss: 0.9898, test_f1: 0.5237
 epoch: 92, train_loss: 0.8527, test_loss: 0.9922, test_f1: 0.5099
 epoch: 93, train_loss: 0.8589, test_loss: 0.9929, test_f1: 0.5211
 epoch: 94, train_loss: 0.8419, test_loss: 0.9860, test_f1: 0.5221
 epoch: 95, train_loss: 0.8549, test_loss: 0.9970, test_f1: 0.5204
 epoch: 96, train_loss: 0.8506, test_loss: 0.9927, test_f1: 0.5255
 epoch: 97, train_loss: 0.8480, test_loss: 0.9877, test_f1: 0.5234
 epoch: 98, train_loss: 0.8599, test_loss: 0.9817, test_f1: 0.5168
 epoch: 99, train_loss: 0.8566, test_loss: 0.9821, test_f1: 0.5253
##################ITERATION #9 ****************************************
 epoch: 0, train_loss: 1.4856, test_loss: 1.3444, test_f1: 0.2270
 epoch: 1, train_loss: 1.2811, test_loss: 1.4065, test_f1: 0.2271
 epoch: 2, train_loss: 1.2391, test_loss: 1.3786, test_f1: 0.2316
 epoch: 3, train_loss: 1.2089, test_loss: 1.2975, test_f1: 0.2694
 epoch: 4, train_loss: 1.1933, test_loss: 1.1826, test_f1: 0.3486
 epoch: 5, train_loss: 1.1625, test_loss: 1.1434, test_f1: 0.3894
 epoch: 6, train_loss: 1.1509, test_loss: 1.0747, test_f1: 0.4294
 epoch: 7, train_loss: 1.1310, test_loss: 1.0314, test_f1: 0.4594
 epoch: 8, train_loss: 1.1024, test_loss: 1.0054, test_f1: 0.4676
 epoch: 9, train_loss: 1.0889, test_loss: 0.9964, test_f1: 0.4652
 epoch: 10, train_loss: 1.0777, test_loss: 0.9927, test_f1: 0.4779
 epoch: 11, train_loss: 1.0734, test_loss: 0.9840, test_f1: 0.4969
 epoch: 12, train_loss: 1.0614, test_loss: 0.9726, test_f1: 0.4945
 epoch: 13, train_loss: 1.0476, test_loss: 0.9662, test_f1: 0.5013
 epoch: 14, train_loss: 1.0525, test_loss: 0.9766, test_f1: 0.4815
 epoch: 15, train_loss: 1.0316, test_loss: 0.9502, test_f1: 0.4929
 epoch: 16, train_loss: 1.0219, test_loss: 0.9504, test_f1: 0.4919
 epoch: 17, train_loss: 1.0074, test_loss: 0.9529, test_f1: 0.4945
 epoch: 18, train_loss: 1.0115, test_loss: 0.9709, test_f1: 0.5033
 epoch: 19, train_loss: 1.0125, test_loss: 0.9539, test_f1: 0.4978
 epoch: 20, train_loss: 0.9910, test_loss: 0.9711, test_f1: 0.4983
 epoch: 21, train_loss: 0.9856, test_loss: 0.9390, test_f1: 0.5043
 epoch: 22, train_loss: 0.9851, test_loss: 0.9321, test_f1: 0.5151
 epoch: 23, train_loss: 0.9703, test_loss: 0.9400, test_f1: 0.5146
 epoch: 24, train_loss: 0.9587, test_loss: 0.9269, test_f1: 0.5239
 epoch: 25, train_loss: 0.9605, test_loss: 0.9392, test_f1: 0.5019
 epoch: 26, train_loss: 0.9700, test_loss: 0.9524, test_f1: 0.5149
 epoch: 27, train_loss: 0.9483, test_loss: 0.9182, test_f1: 0.5061
 epoch: 28, train_loss: 0.9422, test_loss: 0.9194, test_f1: 0.5124
 epoch: 29, train_loss: 0.9445, test_loss: 0.8937, test_f1: 0.5316
 epoch: 30, train_loss: 0.9485, test_loss: 0.8982, test_f1: 0.5178
 epoch: 31, train_loss: 0.9299, test_loss: 0.9263, test_f1: 0.5191
 epoch: 32, train_loss: 0.9287, test_loss: 0.9214, test_f1: 0.5287
 epoch: 33, train_loss: 0.9325, test_loss: 0.9094, test_f1: 0.5286
 epoch: 34, train_loss: 0.9240, test_loss: 0.8949, test_f1: 0.5257
 epoch: 35, train_loss: 0.9234, test_loss: 0.8997, test_f1: 0.5283
 epoch: 36, train_loss: 0.9243, test_loss: 0.9270, test_f1: 0.5236
 epoch: 37, train_loss: 0.9104, test_loss: 0.9274, test_f1: 0.5260
 epoch: 38, train_loss: 0.9112, test_loss: 0.9189, test_f1: 0.5244
 epoch: 39, train_loss: 0.9003, test_loss: 0.8879, test_f1: 0.5212
 epoch: 40, train_loss: 0.8964, test_loss: 0.9010, test_f1: 0.5118
 epoch: 41, train_loss: 0.8972, test_loss: 0.9335, test_f1: 0.5234
 epoch: 42, train_loss: 0.8866, test_loss: 0.9323, test_f1: 0.5247
 epoch: 43, train_loss: 0.8997, test_loss: 0.9176, test_f1: 0.5229
 epoch: 44, train_loss: 0.8939, test_loss: 0.9265, test_f1: 0.5171
 epoch: 45, train_loss: 0.8839, test_loss: 0.9618, test_f1: 0.5336
 epoch: 46, train_loss: 0.8755, test_loss: 0.9315, test_f1: 0.5342
 epoch: 47, train_loss: 0.8792, test_loss: 0.9370, test_f1: 0.5416
 epoch: 48, train_loss: 0.8813, test_loss: 0.9485, test_f1: 0.5416
 epoch: 49, train_loss: 0.8770, test_loss: 0.9216, test_f1: 0.5285
 epoch: 50, train_loss: 0.8743, test_loss: 0.9157, test_f1: 0.5425
 epoch: 51, train_loss: 0.8755, test_loss: 0.9339, test_f1: 0.5582
 epoch: 52, train_loss: 0.8659, test_loss: 0.9404, test_f1: 0.5346
 epoch: 53, train_loss: 0.8477, test_loss: 0.9504, test_f1: 0.5341
 epoch: 54, train_loss: 0.8556, test_loss: 0.9352, test_f1: 0.5370
 epoch: 55, train_loss: 0.8531, test_loss: 0.9364, test_f1: 0.5507
 epoch: 56, train_loss: 0.8451, test_loss: 0.9350, test_f1: 0.5369
 epoch: 57, train_loss: 0.8526, test_loss: 0.9388, test_f1: 0.5498
 epoch: 58, train_loss: 0.8487, test_loss: 0.9330, test_f1: 0.5517
 epoch: 59, train_loss: 0.8486, test_loss: 0.9486, test_f1: 0.5376
 epoch: 60, train_loss: 0.8549, test_loss: 0.9428, test_f1: 0.5353
 epoch: 61, train_loss: 0.8361, test_loss: 0.9318, test_f1: 0.5381
 epoch: 62, train_loss: 0.8404, test_loss: 0.9596, test_f1: 0.5451
 epoch: 63, train_loss: 0.8343, test_loss: 0.9466, test_f1: 0.5370
 epoch: 64, train_loss: 0.8318, test_loss: 0.9492, test_f1: 0.5490
 epoch: 65, train_loss: 0.8255, test_loss: 0.9496, test_f1: 0.5391
 epoch: 66, train_loss: 0.8351, test_loss: 0.9403, test_f1: 0.5494
 epoch: 67, train_loss: 0.8386, test_loss: 0.9499, test_f1: 0.5563
 epoch: 68, train_loss: 0.8397, test_loss: 0.9588, test_f1: 0.5479
 epoch: 69, train_loss: 0.8351, test_loss: 0.9540, test_f1: 0.5519
 epoch: 70, train_loss: 0.8316, test_loss: 0.9462, test_f1: 0.5420
 epoch: 71, train_loss: 0.8296, test_loss: 0.9413, test_f1: 0.5463
 epoch: 72, train_loss: 0.8237, test_loss: 0.9404, test_f1: 0.5523
 epoch: 73, train_loss: 0.8282, test_loss: 0.9478, test_f1: 0.5246
 epoch: 74, train_loss: 0.8174, test_loss: 0.9530, test_f1: 0.5415
 epoch: 75, train_loss: 0.8364, test_loss: 0.9627, test_f1: 0.5322
 epoch: 76, train_loss: 0.8190, test_loss: 0.9510, test_f1: 0.5511
 epoch: 77, train_loss: 0.8243, test_loss: 0.9567, test_f1: 0.5393
 epoch: 78, train_loss: 0.8283, test_loss: 0.9671, test_f1: 0.5297
 epoch: 79, train_loss: 0.8193, test_loss: 0.9749, test_f1: 0.5256
 epoch: 80, train_loss: 0.8102, test_loss: 0.9690, test_f1: 0.5530
 epoch: 81, train_loss: 0.8170, test_loss: 0.9606, test_f1: 0.5506
 epoch: 82, train_loss: 0.8203, test_loss: 0.9580, test_f1: 0.5576
 epoch: 83, train_loss: 0.8160, test_loss: 0.9653, test_f1: 0.5320
 epoch: 84, train_loss: 0.8150, test_loss: 0.9609, test_f1: 0.5454
 epoch: 85, train_loss: 0.8256, test_loss: 0.9548, test_f1: 0.5542
 epoch: 86, train_loss: 0.8208, test_loss: 0.9523, test_f1: 0.5497
 epoch: 87, train_loss: 0.8136, test_loss: 0.9590, test_f1: 0.5397
 epoch: 88, train_loss: 0.8053, test_loss: 0.9540, test_f1: 0.5434
 epoch: 89, train_loss: 0.8121, test_loss: 0.9616, test_f1: 0.5368
 epoch: 90, train_loss: 0.8003, test_loss: 0.9634, test_f1: 0.5399
 epoch: 91, train_loss: 0.8071, test_loss: 0.9509, test_f1: 0.5471
 epoch: 92, train_loss: 0.8010, test_loss: 0.9501, test_f1: 0.5470
 epoch: 93, train_loss: 0.7952, test_loss: 0.9470, test_f1: 0.5475
 epoch: 94, train_loss: 0.8088, test_loss: 0.9550, test_f1: 0.5429
 epoch: 95, train_loss: 0.8120, test_loss: 0.9487, test_f1: 0.5604
 epoch: 96, train_loss: 0.8035, test_loss: 0.9641, test_f1: 0.5554
 epoch: 97, train_loss: 0.8044, test_loss: 0.9560, test_f1: 0.5510
 epoch: 98, train_loss: 0.8050, test_loss: 0.9609, test_f1: 0.5535
 epoch: 99, train_loss: 0.8086, test_loss: 0.9694, test_f1: 0.5377

Training completed in 424.58 seconds
Best F1: 0.5982 at epoch 82
Mean F1 across iterations: 0.5561  0.0233
========================FINAL RESULTS================================
FEGIN weighted F1: 0.5982  0.0233
python main.py --data ltspice_examples --representation component_net --model FEGIN --layers 5 --hiddens 16 --batch_size 256 --lr 0.001 --emb_size 512 --epochs 100 --save_appendix component_net_L5_H16_BS256_LR0.001_E512 --no_val
-----



STDERR:
  File "main.py", line 370, in <module>
    main()
  File "main.py", line 254, in main
    dataset = dataset_class(
  File "/home/philip/projects/ltspice_examples_code_repo/Circuit-Completion-Using-GNNs/component_classification_with_link_prediction_head/evaluation/FEGIN/kernel/circuit_datasets.py", line 15, in __init__
    self.data, self.slices = torch.load(self.processed_paths[0])
  File "/home/philip/.local/lib/python3.8/site-packages/torch/serialization.py", line 1040, in load
    warnings.warn(
  File "/usr/lib/python3.8/warnings.py", line 109, in _showwarnmsg
    sw(msg.message, msg.category, msg.filename, msg.lineno,
  File "main.py", line 47, in warn_with_traceback
    traceback.print_stack(file=log)
/home/philip/projects/ltspice_examples_code_repo/Circuit-Completion-Using-GNNs/component_classification_with_link_prediction_head/evaluation/FEGIN/kernel/circuit_datasets.py:15: FutureWarning: You are using `torch.load` with `weights_only=False` (the current default value), which uses the default pickle module implicitly. It is possible to construct malicious pickle data which will execute arbitrary code during unpickling (See https://github.com/pytorch/pytorch/blob/main/SECURITY.md#untrusted-models for more details). In a future release, the default value for `weights_only` will be flipped to `True`. This limits the functions that could be executed during unpickling. Arbitrary objects will no longer be allowed to be loaded via this mode unless they are explicitly allowlisted by the user via `torch.serialization.add_safe_globals`. We recommend you start setting `weights_only=True` for any use case where you don't have full control of the loaded file. Please open an issue on GitHub for any issues related to this experimental feature.
  self.data, self.slices = torch.load(self.processed_paths[0])
