STDOUT:
Results will be saved in /home/philip/projects/ltspice_examples_code_repo/Circuit-Completion-Using-GNNs/component_classification_with_link_prediction_head/evaluation/FEGIN/results/model_FEGIN_dataset_ltspice_examples
Command line input: python main.py --data ltspice_examples --representation component_pin --model FEGIN --layers 6 --hiddens 64 --batch_size 256 --lr 0.001 --emb_size 128 --epochs 100 --save_appendix component_pin_L6_H64_BS256_LR0.001_E128 --no_val
 is saved.
-----
ltspice_examples - FEGIN
Using 6 layers, 64 hidden units, h = 2
Loading component_pin representation dataset
ENTERED
Training FEGIN on component_pin representation
Train: 3560, Test: 848
##################ITERATION #0 ****************************************
 epoch: 0, train_loss: 1.3393, test_loss: 1.3305, test_f1: 0.2260
 epoch: 1, train_loss: 1.2288, test_loss: 1.3081, test_f1: 0.2726
 epoch: 2, train_loss: 1.1843, test_loss: 1.3033, test_f1: 0.2845
 epoch: 3, train_loss: 1.1369, test_loss: 1.3000, test_f1: 0.2174
 epoch: 4, train_loss: 1.0801, test_loss: 1.2772, test_f1: 0.2616
 epoch: 5, train_loss: 1.0207, test_loss: 1.0423, test_f1: 0.4505
 epoch: 6, train_loss: 0.9977, test_loss: 1.0220, test_f1: 0.4535
 epoch: 7, train_loss: 0.9630, test_loss: 1.0858, test_f1: 0.4424
 epoch: 8, train_loss: 0.9439, test_loss: 1.1125, test_f1: 0.4642
 epoch: 9, train_loss: 0.9237, test_loss: 1.0219, test_f1: 0.4851
 epoch: 10, train_loss: 0.8855, test_loss: 1.0338, test_f1: 0.4720
 epoch: 11, train_loss: 0.8510, test_loss: 0.9889, test_f1: 0.5250
 epoch: 12, train_loss: 0.8469, test_loss: 0.9854, test_f1: 0.5019
 epoch: 13, train_loss: 0.8206, test_loss: 1.0363, test_f1: 0.4890
 epoch: 14, train_loss: 0.7989, test_loss: 0.9867, test_f1: 0.5190
 epoch: 15, train_loss: 0.7785, test_loss: 1.0616, test_f1: 0.4752
 epoch: 16, train_loss: 0.7833, test_loss: 1.0917, test_f1: 0.5392
 epoch: 17, train_loss: 0.7654, test_loss: 1.1235, test_f1: 0.4675
 epoch: 18, train_loss: 0.7476, test_loss: 1.0882, test_f1: 0.5080
 epoch: 19, train_loss: 0.7197, test_loss: 0.9844, test_f1: 0.5244
 epoch: 20, train_loss: 0.7075, test_loss: 1.0007, test_f1: 0.5775
 epoch: 21, train_loss: 0.7170, test_loss: 1.0526, test_f1: 0.5153
 epoch: 22, train_loss: 0.6967, test_loss: 0.9907, test_f1: 0.5595
 epoch: 23, train_loss: 0.6864, test_loss: 1.0684, test_f1: 0.5700
 epoch: 24, train_loss: 0.6645, test_loss: 1.0271, test_f1: 0.5602
 epoch: 25, train_loss: 0.6657, test_loss: 1.0065, test_f1: 0.5859
 epoch: 26, train_loss: 0.6519, test_loss: 1.0441, test_f1: 0.5407
 epoch: 27, train_loss: 0.6579, test_loss: 1.1546, test_f1: 0.5216
 epoch: 28, train_loss: 0.6312, test_loss: 1.1431, test_f1: 0.5633
 epoch: 29, train_loss: 0.6332, test_loss: 1.0650, test_f1: 0.5609
 epoch: 30, train_loss: 0.6099, test_loss: 1.1744, test_f1: 0.5283
 epoch: 31, train_loss: 0.6139, test_loss: 1.0565, test_f1: 0.5618
 epoch: 32, train_loss: 0.6187, test_loss: 1.1571, test_f1: 0.5759
 epoch: 33, train_loss: 0.6239, test_loss: 1.0697, test_f1: 0.5608
 epoch: 34, train_loss: 0.5998, test_loss: 1.0541, test_f1: 0.5810
 epoch: 35, train_loss: 0.5799, test_loss: 1.0993, test_f1: 0.5434
 epoch: 36, train_loss: 0.5642, test_loss: 1.3040, test_f1: 0.5645
 epoch: 37, train_loss: 0.5671, test_loss: 1.0481, test_f1: 0.5743
 epoch: 38, train_loss: 0.5711, test_loss: 1.2108, test_f1: 0.5612
 epoch: 39, train_loss: 0.5731, test_loss: 1.0541, test_f1: 0.5829
 epoch: 40, train_loss: 0.5479, test_loss: 1.0778, test_f1: 0.5876
 epoch: 41, train_loss: 0.5361, test_loss: 1.1448, test_f1: 0.5882
 epoch: 42, train_loss: 0.5575, test_loss: 1.1418, test_f1: 0.5594
 epoch: 43, train_loss: 0.5341, test_loss: 1.1519, test_f1: 0.6041
 epoch: 44, train_loss: 0.5399, test_loss: 1.2286, test_f1: 0.5554
 epoch: 45, train_loss: 0.5252, test_loss: 1.1650, test_f1: 0.5973
 epoch: 46, train_loss: 0.5164, test_loss: 1.1404, test_f1: 0.5888
 epoch: 47, train_loss: 0.5292, test_loss: 1.1002, test_f1: 0.6134
 epoch: 48, train_loss: 0.5170, test_loss: 1.1348, test_f1: 0.6123
 epoch: 49, train_loss: 0.4995, test_loss: 1.1875, test_f1: 0.5840
 epoch: 50, train_loss: 0.4989, test_loss: 1.1407, test_f1: 0.5854
 epoch: 51, train_loss: 0.4753, test_loss: 1.1588, test_f1: 0.6023
 epoch: 52, train_loss: 0.4504, test_loss: 1.3159, test_f1: 0.5930
 epoch: 53, train_loss: 0.4380, test_loss: 1.2269, test_f1: 0.5999
 epoch: 54, train_loss: 0.4168, test_loss: 1.1630, test_f1: 0.5980
 epoch: 55, train_loss: 0.4165, test_loss: 1.1951, test_f1: 0.5910
 epoch: 56, train_loss: 0.4257, test_loss: 1.3003, test_f1: 0.6171
 epoch: 57, train_loss: 0.4088, test_loss: 1.2688, test_f1: 0.6270
 epoch: 58, train_loss: 0.3993, test_loss: 1.3695, test_f1: 0.6115
 epoch: 59, train_loss: 0.4017, test_loss: 1.3091, test_f1: 0.5948
 epoch: 60, train_loss: 0.4014, test_loss: 1.3327, test_f1: 0.6154
 epoch: 61, train_loss: 0.3948, test_loss: 1.3732, test_f1: 0.5779
 epoch: 62, train_loss: 0.3799, test_loss: 1.2741, test_f1: 0.6119
 epoch: 63, train_loss: 0.3817, test_loss: 1.4442, test_f1: 0.6087
 epoch: 64, train_loss: 0.4011, test_loss: 1.5148, test_f1: 0.6132
 epoch: 65, train_loss: 0.3961, test_loss: 1.4575, test_f1: 0.6081
 epoch: 66, train_loss: 0.3770, test_loss: 1.3608, test_f1: 0.5774
 epoch: 67, train_loss: 0.3647, test_loss: 1.5858, test_f1: 0.6030
 epoch: 68, train_loss: 0.3569, test_loss: 1.3921, test_f1: 0.6018
 epoch: 69, train_loss: 0.3629, test_loss: 1.4432, test_f1: 0.6020
 epoch: 70, train_loss: 0.3503, test_loss: 1.5093, test_f1: 0.5872
 epoch: 71, train_loss: 0.3482, test_loss: 1.4028, test_f1: 0.6033
 epoch: 72, train_loss: 0.3347, test_loss: 1.5473, test_f1: 0.5825
 epoch: 73, train_loss: 0.3501, test_loss: 1.6120, test_f1: 0.6362
 epoch: 74, train_loss: 0.3256, test_loss: 1.6607, test_f1: 0.6000
 epoch: 75, train_loss: 0.3373, test_loss: 1.6438, test_f1: 0.5968
 epoch: 76, train_loss: 0.3324, test_loss: 1.7215, test_f1: 0.5924
 epoch: 77, train_loss: 0.3348, test_loss: 1.6291, test_f1: 0.6047
 epoch: 78, train_loss: 0.3186, test_loss: 1.6040, test_f1: 0.5997
 epoch: 79, train_loss: 0.3348, test_loss: 1.5531, test_f1: 0.6089
 epoch: 80, train_loss: 0.3142, test_loss: 1.7828, test_f1: 0.6168
 epoch: 81, train_loss: 0.3019, test_loss: 1.8037, test_f1: 0.6137
 epoch: 82, train_loss: 0.3237, test_loss: 1.6455, test_f1: 0.6313
 epoch: 83, train_loss: 0.3191, test_loss: 1.7495, test_f1: 0.6050
 epoch: 84, train_loss: 0.3098, test_loss: 1.6420, test_f1: 0.6286
 epoch: 85, train_loss: 0.2963, test_loss: 1.8421, test_f1: 0.6250
 epoch: 86, train_loss: 0.3009, test_loss: 1.6676, test_f1: 0.5739
 epoch: 87, train_loss: 0.2865, test_loss: 1.7292, test_f1: 0.6257
 epoch: 88, train_loss: 0.2881, test_loss: 1.8114, test_f1: 0.6249
 epoch: 89, train_loss: 0.2799, test_loss: 1.6173, test_f1: 0.5869
 epoch: 90, train_loss: 0.2808, test_loss: 1.9565, test_f1: 0.6100
 epoch: 91, train_loss: 0.3040, test_loss: 1.9028, test_f1: 0.5949
 epoch: 92, train_loss: 0.3010, test_loss: 1.7440, test_f1: 0.6051
 epoch: 93, train_loss: 0.2848, test_loss: 1.9460, test_f1: 0.6068
 epoch: 94, train_loss: 0.3014, test_loss: 1.8391, test_f1: 0.5797
 epoch: 95, train_loss: 0.2823, test_loss: 1.8644, test_f1: 0.6090
 epoch: 96, train_loss: 0.2834, test_loss: 1.7468, test_f1: 0.5769
 epoch: 97, train_loss: 0.2719, test_loss: 1.7813, test_f1: 0.6301
 epoch: 98, train_loss: 0.2836, test_loss: 1.8438, test_f1: 0.6032
 epoch: 99, train_loss: 0.2663, test_loss: 1.9140, test_f1: 0.6066
##################ITERATION #1 ****************************************
 epoch: 0, train_loss: 1.2640, test_loss: 1.2875, test_f1: 0.2260
 epoch: 1, train_loss: 1.1142, test_loss: 1.2160, test_f1: 0.2574
 epoch: 2, train_loss: 1.0459, test_loss: 1.1078, test_f1: 0.3472
 epoch: 3, train_loss: 0.9883, test_loss: 1.1008, test_f1: 0.4164
 epoch: 4, train_loss: 0.9510, test_loss: 1.0885, test_f1: 0.4634
 epoch: 5, train_loss: 0.9237, test_loss: 0.9795, test_f1: 0.4958
 epoch: 6, train_loss: 0.9004, test_loss: 1.0110, test_f1: 0.5055
 epoch: 7, train_loss: 0.8794, test_loss: 0.9694, test_f1: 0.5232
 epoch: 8, train_loss: 0.8592, test_loss: 1.0304, test_f1: 0.4918
 epoch: 9, train_loss: 0.8460, test_loss: 0.9889, test_f1: 0.5208
 epoch: 10, train_loss: 0.8161, test_loss: 1.0165, test_f1: 0.5158
 epoch: 11, train_loss: 0.8086, test_loss: 0.9957, test_f1: 0.5110
 epoch: 12, train_loss: 0.7828, test_loss: 0.9181, test_f1: 0.5589
 epoch: 13, train_loss: 0.7611, test_loss: 0.9284, test_f1: 0.5545
 epoch: 14, train_loss: 0.7415, test_loss: 0.9442, test_f1: 0.5649
 epoch: 15, train_loss: 0.7218, test_loss: 0.9821, test_f1: 0.5342
 epoch: 16, train_loss: 0.7238, test_loss: 1.0306, test_f1: 0.5261
 epoch: 17, train_loss: 0.7011, test_loss: 0.9437, test_f1: 0.5709
 epoch: 18, train_loss: 0.6957, test_loss: 1.0358, test_f1: 0.5266
 epoch: 19, train_loss: 0.6895, test_loss: 0.9684, test_f1: 0.5556
 epoch: 20, train_loss: 0.6761, test_loss: 1.1644, test_f1: 0.5136
 epoch: 21, train_loss: 0.6702, test_loss: 0.9677, test_f1: 0.5628
 epoch: 22, train_loss: 0.6577, test_loss: 0.9261, test_f1: 0.5783
 epoch: 23, train_loss: 0.6351, test_loss: 0.9577, test_f1: 0.5571
 epoch: 24, train_loss: 0.6347, test_loss: 0.9831, test_f1: 0.5553
 epoch: 25, train_loss: 0.6243, test_loss: 1.0189, test_f1: 0.5748
 epoch: 26, train_loss: 0.6210, test_loss: 1.1461, test_f1: 0.5422
 epoch: 27, train_loss: 0.6085, test_loss: 0.8954, test_f1: 0.6079
 epoch: 28, train_loss: 0.5925, test_loss: 0.9703, test_f1: 0.5462
 epoch: 29, train_loss: 0.6025, test_loss: 1.0995, test_f1: 0.5357
 epoch: 30, train_loss: 0.6098, test_loss: 1.0282, test_f1: 0.5571
 epoch: 31, train_loss: 0.5918, test_loss: 1.0512, test_f1: 0.5826
 epoch: 32, train_loss: 0.5690, test_loss: 1.0234, test_f1: 0.5867
 epoch: 33, train_loss: 0.5529, test_loss: 1.0294, test_f1: 0.5840
 epoch: 34, train_loss: 0.5452, test_loss: 1.1931, test_f1: 0.5400
 epoch: 35, train_loss: 0.5401, test_loss: 1.0798, test_f1: 0.5661
 epoch: 36, train_loss: 0.5264, test_loss: 1.1322, test_f1: 0.5821
 epoch: 37, train_loss: 0.5305, test_loss: 1.0247, test_f1: 0.6145
 epoch: 38, train_loss: 0.5420, test_loss: 1.0298, test_f1: 0.6004
 epoch: 39, train_loss: 0.5118, test_loss: 1.0191, test_f1: 0.6118
 epoch: 40, train_loss: 0.5173, test_loss: 1.0296, test_f1: 0.5998
 epoch: 41, train_loss: 0.5098, test_loss: 0.8402, test_f1: 0.6405
 epoch: 42, train_loss: 0.4930, test_loss: 1.1086, test_f1: 0.6016
 epoch: 43, train_loss: 0.4937, test_loss: 1.1167, test_f1: 0.6214
 epoch: 44, train_loss: 0.4866, test_loss: 1.1318, test_f1: 0.5984
 epoch: 45, train_loss: 0.4555, test_loss: 1.0427, test_f1: 0.6401
 epoch: 46, train_loss: 0.4490, test_loss: 1.0165, test_f1: 0.6547
 epoch: 47, train_loss: 0.4495, test_loss: 1.1773, test_f1: 0.6032
 epoch: 48, train_loss: 0.4604, test_loss: 1.0925, test_f1: 0.6068
 epoch: 49, train_loss: 0.4528, test_loss: 1.1344, test_f1: 0.5957
 epoch: 50, train_loss: 0.4544, test_loss: 1.0566, test_f1: 0.6372
 epoch: 51, train_loss: 0.4126, test_loss: 1.1428, test_f1: 0.6105
 epoch: 52, train_loss: 0.3880, test_loss: 1.1712, test_f1: 0.6238
 epoch: 53, train_loss: 0.3769, test_loss: 1.1203, test_f1: 0.6431
 epoch: 54, train_loss: 0.3676, test_loss: 1.1409, test_f1: 0.6209
 epoch: 55, train_loss: 0.3624, test_loss: 1.1358, test_f1: 0.6307
 epoch: 56, train_loss: 0.3597, test_loss: 1.1884, test_f1: 0.6167
 epoch: 57, train_loss: 0.3608, test_loss: 1.1562, test_f1: 0.6396
 epoch: 58, train_loss: 0.3566, test_loss: 1.2335, test_f1: 0.6351
 epoch: 59, train_loss: 0.3571, test_loss: 1.2152, test_f1: 0.6282
 epoch: 60, train_loss: 0.3440, test_loss: 1.2497, test_f1: 0.6304
 epoch: 61, train_loss: 0.3449, test_loss: 1.2726, test_f1: 0.6280
 epoch: 62, train_loss: 0.3360, test_loss: 1.3070, test_f1: 0.6004
 epoch: 63, train_loss: 0.3252, test_loss: 1.2417, test_f1: 0.6139
 epoch: 64, train_loss: 0.3447, test_loss: 1.2609, test_f1: 0.6391
 epoch: 65, train_loss: 0.3410, test_loss: 1.3613, test_f1: 0.6135
 epoch: 66, train_loss: 0.3423, test_loss: 1.2191, test_f1: 0.6394
 epoch: 67, train_loss: 0.3063, test_loss: 1.2767, test_f1: 0.6207
 epoch: 68, train_loss: 0.3177, test_loss: 1.4398, test_f1: 0.6095
 epoch: 69, train_loss: 0.3144, test_loss: 1.3052, test_f1: 0.6347
 epoch: 70, train_loss: 0.3184, test_loss: 1.2377, test_f1: 0.6318
 epoch: 71, train_loss: 0.3080, test_loss: 1.5037, test_f1: 0.6018
 epoch: 72, train_loss: 0.3036, test_loss: 1.3509, test_f1: 0.6049
 epoch: 73, train_loss: 0.3147, test_loss: 1.3410, test_f1: 0.6388
 epoch: 74, train_loss: 0.2908, test_loss: 1.3078, test_f1: 0.6382
 epoch: 75, train_loss: 0.2951, test_loss: 1.3945, test_f1: 0.6079
 epoch: 76, train_loss: 0.3064, test_loss: 1.4026, test_f1: 0.6107
 epoch: 77, train_loss: 0.2687, test_loss: 1.5049, test_f1: 0.6138
 epoch: 78, train_loss: 0.2692, test_loss: 1.4472, test_f1: 0.6236
 epoch: 79, train_loss: 0.2703, test_loss: 1.5283, test_f1: 0.6139
 epoch: 80, train_loss: 0.2674, test_loss: 1.3675, test_f1: 0.6303
 epoch: 81, train_loss: 0.2770, test_loss: 1.3392, test_f1: 0.6252
 epoch: 82, train_loss: 0.2620, test_loss: 1.5237, test_f1: 0.6326
 epoch: 83, train_loss: 0.2779, test_loss: 1.5078, test_f1: 0.6030
 epoch: 84, train_loss: 0.2590, test_loss: 1.5175, test_f1: 0.6337
 epoch: 85, train_loss: 0.2649, test_loss: 1.5199, test_f1: 0.6308
 epoch: 86, train_loss: 0.2816, test_loss: 1.5832, test_f1: 0.6135
 epoch: 87, train_loss: 0.2537, test_loss: 1.4116, test_f1: 0.6457
 epoch: 88, train_loss: 0.2513, test_loss: 1.5714, test_f1: 0.6335
 epoch: 89, train_loss: 0.2464, test_loss: 1.6106, test_f1: 0.5940
 epoch: 90, train_loss: 0.2415, test_loss: 1.5581, test_f1: 0.6024
 epoch: 91, train_loss: 0.2366, test_loss: 1.5594, test_f1: 0.6174
 epoch: 92, train_loss: 0.2479, test_loss: 1.6502, test_f1: 0.6043
 epoch: 93, train_loss: 0.2344, test_loss: 1.4815, test_f1: 0.6380
 epoch: 94, train_loss: 0.2325, test_loss: 1.4769, test_f1: 0.6182
 epoch: 95, train_loss: 0.2289, test_loss: 1.7551, test_f1: 0.6161
 epoch: 96, train_loss: 0.2416, test_loss: 1.6470, test_f1: 0.6197
 epoch: 97, train_loss: 0.2428, test_loss: 1.7147, test_f1: 0.6073
 epoch: 98, train_loss: 0.2380, test_loss: 1.6169, test_f1: 0.6148
 epoch: 99, train_loss: 0.2324, test_loss: 1.6236, test_f1: 0.6072
##################ITERATION #2 ****************************************
 epoch: 0, train_loss: 1.2317, test_loss: 1.2852, test_f1: 0.2260
 epoch: 1, train_loss: 1.0549, test_loss: 1.2768, test_f1: 0.2286
 epoch: 2, train_loss: 1.0132, test_loss: 1.1717, test_f1: 0.2910
 epoch: 3, train_loss: 0.9702, test_loss: 1.0235, test_f1: 0.4816
 epoch: 4, train_loss: 0.9313, test_loss: 0.9402, test_f1: 0.5052
 epoch: 5, train_loss: 0.9070, test_loss: 0.9161, test_f1: 0.5147
 epoch: 6, train_loss: 0.8739, test_loss: 0.8920, test_f1: 0.5538
 epoch: 7, train_loss: 0.8628, test_loss: 0.9221, test_f1: 0.5267
 epoch: 8, train_loss: 0.8397, test_loss: 0.8749, test_f1: 0.5623
 epoch: 9, train_loss: 0.8259, test_loss: 0.9674, test_f1: 0.5563
 epoch: 10, train_loss: 0.8015, test_loss: 0.9061, test_f1: 0.5809
 epoch: 11, train_loss: 0.7904, test_loss: 0.8671, test_f1: 0.6073
 epoch: 12, train_loss: 0.7704, test_loss: 0.9077, test_f1: 0.5729
 epoch: 13, train_loss: 0.7540, test_loss: 0.9134, test_f1: 0.6007
 epoch: 14, train_loss: 0.7530, test_loss: 0.9433, test_f1: 0.5584
 epoch: 15, train_loss: 0.7300, test_loss: 0.9402, test_f1: 0.5740
 epoch: 16, train_loss: 0.7073, test_loss: 0.8576, test_f1: 0.6190
 epoch: 17, train_loss: 0.7018, test_loss: 0.9483, test_f1: 0.5893
 epoch: 18, train_loss: 0.7049, test_loss: 0.8885, test_f1: 0.6064
 epoch: 19, train_loss: 0.6992, test_loss: 0.9196, test_f1: 0.5939
 epoch: 20, train_loss: 0.6976, test_loss: 0.9013, test_f1: 0.6017
 epoch: 21, train_loss: 0.6603, test_loss: 0.9089, test_f1: 0.6105
 epoch: 22, train_loss: 0.6579, test_loss: 0.9308, test_f1: 0.5735
 epoch: 23, train_loss: 0.6546, test_loss: 0.9477, test_f1: 0.5879
 epoch: 24, train_loss: 0.6356, test_loss: 1.0007, test_f1: 0.5775
 epoch: 25, train_loss: 0.6436, test_loss: 0.9789, test_f1: 0.5841
 epoch: 26, train_loss: 0.6318, test_loss: 0.8870, test_f1: 0.6321
 epoch: 27, train_loss: 0.6096, test_loss: 0.9165, test_f1: 0.6275
 epoch: 28, train_loss: 0.6199, test_loss: 0.9431, test_f1: 0.6101
 epoch: 29, train_loss: 0.5872, test_loss: 0.8934, test_f1: 0.6258
 epoch: 30, train_loss: 0.5960, test_loss: 0.9649, test_f1: 0.6278
 epoch: 31, train_loss: 0.5868, test_loss: 0.9207, test_f1: 0.5957
 epoch: 32, train_loss: 0.5830, test_loss: 0.9123, test_f1: 0.6420
 epoch: 33, train_loss: 0.5571, test_loss: 0.9490, test_f1: 0.5992
 epoch: 34, train_loss: 0.5427, test_loss: 0.9034, test_f1: 0.6288
 epoch: 35, train_loss: 0.5469, test_loss: 0.9277, test_f1: 0.6498
 epoch: 36, train_loss: 0.5393, test_loss: 1.1557, test_f1: 0.5693
 epoch: 37, train_loss: 0.5225, test_loss: 0.9090, test_f1: 0.6444
 epoch: 38, train_loss: 0.5321, test_loss: 0.9536, test_f1: 0.6416
 epoch: 39, train_loss: 0.5356, test_loss: 1.0762, test_f1: 0.5794
 epoch: 40, train_loss: 0.5188, test_loss: 0.9649, test_f1: 0.6174
 epoch: 41, train_loss: 0.5251, test_loss: 0.9122, test_f1: 0.6446
 epoch: 42, train_loss: 0.4979, test_loss: 1.0398, test_f1: 0.6023
 epoch: 43, train_loss: 0.4956, test_loss: 0.9031, test_f1: 0.6465
 epoch: 44, train_loss: 0.5320, test_loss: 0.9132, test_f1: 0.6537
 epoch: 45, train_loss: 0.4945, test_loss: 1.0036, test_f1: 0.6430
 epoch: 46, train_loss: 0.4777, test_loss: 0.9913, test_f1: 0.6517
 epoch: 47, train_loss: 0.4793, test_loss: 1.0133, test_f1: 0.6128
 epoch: 48, train_loss: 0.4662, test_loss: 1.0046, test_f1: 0.6424
 epoch: 49, train_loss: 0.4596, test_loss: 1.0434, test_f1: 0.6376
 epoch: 50, train_loss: 0.4537, test_loss: 1.1062, test_f1: 0.6524
 epoch: 51, train_loss: 0.4242, test_loss: 1.0072, test_f1: 0.6734
 epoch: 52, train_loss: 0.4066, test_loss: 1.0155, test_f1: 0.6309
 epoch: 53, train_loss: 0.3996, test_loss: 1.0496, test_f1: 0.6592
 epoch: 54, train_loss: 0.3761, test_loss: 0.9954, test_f1: 0.6809
 epoch: 55, train_loss: 0.3748, test_loss: 1.0589, test_f1: 0.6619
 epoch: 56, train_loss: 0.3625, test_loss: 1.0537, test_f1: 0.6519
 epoch: 57, train_loss: 0.3722, test_loss: 1.0863, test_f1: 0.6490
 epoch: 58, train_loss: 0.3645, test_loss: 1.1211, test_f1: 0.6249
 epoch: 59, train_loss: 0.3675, test_loss: 1.0674, test_f1: 0.6554
 epoch: 60, train_loss: 0.3428, test_loss: 1.1381, test_f1: 0.6462
 epoch: 61, train_loss: 0.3482, test_loss: 1.0938, test_f1: 0.6529
 epoch: 62, train_loss: 0.3419, test_loss: 1.1351, test_f1: 0.6475
 epoch: 63, train_loss: 0.3559, test_loss: 1.1929, test_f1: 0.6357
 epoch: 64, train_loss: 0.3393, test_loss: 1.1345, test_f1: 0.6512
 epoch: 65, train_loss: 0.3369, test_loss: 1.1249, test_f1: 0.6755
 epoch: 66, train_loss: 0.3172, test_loss: 1.2315, test_f1: 0.6731
 epoch: 67, train_loss: 0.3297, test_loss: 1.1570, test_f1: 0.6548
 epoch: 68, train_loss: 0.3211, test_loss: 1.1644, test_f1: 0.6625
 epoch: 69, train_loss: 0.3203, test_loss: 1.2993, test_f1: 0.6591
 epoch: 70, train_loss: 0.3393, test_loss: 1.1416, test_f1: 0.6665
 epoch: 71, train_loss: 0.3123, test_loss: 1.2277, test_f1: 0.6507
 epoch: 72, train_loss: 0.3166, test_loss: 1.2628, test_f1: 0.6618
 epoch: 73, train_loss: 0.3110, test_loss: 1.2505, test_f1: 0.6391
 epoch: 74, train_loss: 0.3075, test_loss: 1.2278, test_f1: 0.6622
 epoch: 75, train_loss: 0.3119, test_loss: 1.1895, test_f1: 0.6718
 epoch: 76, train_loss: 0.2927, test_loss: 1.2441, test_f1: 0.6617
 epoch: 77, train_loss: 0.3084, test_loss: 1.2449, test_f1: 0.6469
 epoch: 78, train_loss: 0.2916, test_loss: 1.3758, test_f1: 0.5970
 epoch: 79, train_loss: 0.2904, test_loss: 1.4544, test_f1: 0.6537
 epoch: 80, train_loss: 0.2771, test_loss: 1.2661, test_f1: 0.6661
 epoch: 81, train_loss: 0.2857, test_loss: 1.3484, test_f1: 0.6491
 epoch: 82, train_loss: 0.2841, test_loss: 1.3901, test_f1: 0.6592
 epoch: 83, train_loss: 0.2872, test_loss: 1.2504, test_f1: 0.6686
 epoch: 84, train_loss: 0.2867, test_loss: 1.4348, test_f1: 0.6105
 epoch: 85, train_loss: 0.2792, test_loss: 1.2790, test_f1: 0.6583
 epoch: 86, train_loss: 0.2708, test_loss: 1.3948, test_f1: 0.6535
 epoch: 87, train_loss: 0.2436, test_loss: 1.3820, test_f1: 0.6657
 epoch: 88, train_loss: 0.2403, test_loss: 1.4545, test_f1: 0.6506
 epoch: 89, train_loss: 0.2640, test_loss: 1.3466, test_f1: 0.6761
 epoch: 90, train_loss: 0.2600, test_loss: 1.2954, test_f1: 0.6691
 epoch: 91, train_loss: 0.2666, test_loss: 1.5399, test_f1: 0.6203
 epoch: 92, train_loss: 0.2603, test_loss: 1.3316, test_f1: 0.6672
 epoch: 93, train_loss: 0.2363, test_loss: 1.4474, test_f1: 0.6492
 epoch: 94, train_loss: 0.2436, test_loss: 1.4361, test_f1: 0.6498
 epoch: 95, train_loss: 0.2468, test_loss: 1.4727, test_f1: 0.6714
 epoch: 96, train_loss: 0.2620, test_loss: 1.5454, test_f1: 0.6370
 epoch: 97, train_loss: 0.2440, test_loss: 1.4330, test_f1: 0.6625
 epoch: 98, train_loss: 0.2321, test_loss: 1.6802, test_f1: 0.6466
 epoch: 99, train_loss: 0.2349, test_loss: 1.5680, test_f1: 0.6548
##################ITERATION #3 ****************************************
 epoch: 0, train_loss: 1.2193, test_loss: 1.3840, test_f1: 0.2574
 epoch: 1, train_loss: 1.0518, test_loss: 1.4174, test_f1: 0.2260
 epoch: 2, train_loss: 0.9972, test_loss: 1.2887, test_f1: 0.2835
 epoch: 3, train_loss: 0.9537, test_loss: 1.0634, test_f1: 0.4300
 epoch: 4, train_loss: 0.9438, test_loss: 1.0083, test_f1: 0.4738
 epoch: 5, train_loss: 0.9169, test_loss: 0.9664, test_f1: 0.5140
 epoch: 6, train_loss: 0.8889, test_loss: 0.9558, test_f1: 0.5464
 epoch: 7, train_loss: 0.8581, test_loss: 0.9730, test_f1: 0.5440
 epoch: 8, train_loss: 0.8330, test_loss: 0.9264, test_f1: 0.5499
 epoch: 9, train_loss: 0.8270, test_loss: 0.9083, test_f1: 0.5549
 epoch: 10, train_loss: 0.8208, test_loss: 0.9312, test_f1: 0.5591
 epoch: 11, train_loss: 0.7817, test_loss: 0.9621, test_f1: 0.5559
 epoch: 12, train_loss: 0.7629, test_loss: 1.0585, test_f1: 0.5140
 epoch: 13, train_loss: 0.7455, test_loss: 0.9248, test_f1: 0.5589
 epoch: 14, train_loss: 0.7269, test_loss: 1.0035, test_f1: 0.5678
 epoch: 15, train_loss: 0.7232, test_loss: 1.0329, test_f1: 0.5544
 epoch: 16, train_loss: 0.7042, test_loss: 1.0686, test_f1: 0.5464
 epoch: 17, train_loss: 0.7013, test_loss: 1.1318, test_f1: 0.5460
 epoch: 18, train_loss: 0.6845, test_loss: 0.9971, test_f1: 0.5749
 epoch: 19, train_loss: 0.6779, test_loss: 0.9639, test_f1: 0.5805
 epoch: 20, train_loss: 0.6734, test_loss: 0.9640, test_f1: 0.5782
 epoch: 21, train_loss: 0.6514, test_loss: 0.8701, test_f1: 0.6026
 epoch: 22, train_loss: 0.6608, test_loss: 0.9705, test_f1: 0.5779
 epoch: 23, train_loss: 0.6457, test_loss: 0.9068, test_f1: 0.5928
 epoch: 24, train_loss: 0.6503, test_loss: 0.8753, test_f1: 0.6065
 epoch: 25, train_loss: 0.6447, test_loss: 1.0288, test_f1: 0.5639
 epoch: 26, train_loss: 0.6015, test_loss: 0.9351, test_f1: 0.5607
 epoch: 27, train_loss: 0.5969, test_loss: 1.0367, test_f1: 0.5867
 epoch: 28, train_loss: 0.5940, test_loss: 0.8983, test_f1: 0.6053
 epoch: 29, train_loss: 0.5911, test_loss: 0.9102, test_f1: 0.6016
 epoch: 30, train_loss: 0.5631, test_loss: 0.9996, test_f1: 0.5869
 epoch: 31, train_loss: 0.5647, test_loss: 0.9221, test_f1: 0.6335
 epoch: 32, train_loss: 0.5509, test_loss: 1.0094, test_f1: 0.5720
 epoch: 33, train_loss: 0.5378, test_loss: 0.9353, test_f1: 0.6057
 epoch: 34, train_loss: 0.5465, test_loss: 1.0900, test_f1: 0.5823
 epoch: 35, train_loss: 0.5372, test_loss: 0.9164, test_f1: 0.6229
 epoch: 36, train_loss: 0.5246, test_loss: 0.9203, test_f1: 0.6132
 epoch: 37, train_loss: 0.5281, test_loss: 1.0445, test_f1: 0.5775
 epoch: 38, train_loss: 0.5307, test_loss: 1.0943, test_f1: 0.5877
 epoch: 39, train_loss: 0.4994, test_loss: 0.9793, test_f1: 0.6073
 epoch: 40, train_loss: 0.5110, test_loss: 1.0096, test_f1: 0.6168
 epoch: 41, train_loss: 0.4846, test_loss: 0.9956, test_f1: 0.6021
 epoch: 42, train_loss: 0.4899, test_loss: 0.9768, test_f1: 0.6191
 epoch: 43, train_loss: 0.4931, test_loss: 0.9649, test_f1: 0.6207
 epoch: 44, train_loss: 0.4849, test_loss: 1.0138, test_f1: 0.6200
 epoch: 45, train_loss: 0.4464, test_loss: 1.0546, test_f1: 0.5786
 epoch: 46, train_loss: 0.4564, test_loss: 1.0911, test_f1: 0.5919
 epoch: 47, train_loss: 0.4446, test_loss: 0.9533, test_f1: 0.6369
 epoch: 48, train_loss: 0.4513, test_loss: 1.1618, test_f1: 0.5856
 epoch: 49, train_loss: 0.4528, test_loss: 1.1040, test_f1: 0.6057
 epoch: 50, train_loss: 0.4547, test_loss: 1.1135, test_f1: 0.6012
 epoch: 51, train_loss: 0.4022, test_loss: 0.9545, test_f1: 0.6453
 epoch: 52, train_loss: 0.3824, test_loss: 1.0554, test_f1: 0.6394
 epoch: 53, train_loss: 0.3818, test_loss: 1.0344, test_f1: 0.6493
 epoch: 54, train_loss: 0.3702, test_loss: 1.1444, test_f1: 0.6292
 epoch: 55, train_loss: 0.3741, test_loss: 1.0831, test_f1: 0.6340
 epoch: 56, train_loss: 0.3501, test_loss: 1.0742, test_f1: 0.6534
 epoch: 57, train_loss: 0.3576, test_loss: 1.0426, test_f1: 0.6527
 epoch: 58, train_loss: 0.3631, test_loss: 1.1081, test_f1: 0.6420
 epoch: 59, train_loss: 0.3564, test_loss: 1.1020, test_f1: 0.6349
 epoch: 60, train_loss: 0.3569, test_loss: 1.0866, test_f1: 0.6666
 epoch: 61, train_loss: 0.3432, test_loss: 1.0747, test_f1: 0.6514
 epoch: 62, train_loss: 0.3526, test_loss: 1.2305, test_f1: 0.6390
 epoch: 63, train_loss: 0.3165, test_loss: 1.2171, test_f1: 0.6263
 epoch: 64, train_loss: 0.3278, test_loss: 1.1000, test_f1: 0.6634
 epoch: 65, train_loss: 0.3156, test_loss: 1.4143, test_f1: 0.5985
 epoch: 66, train_loss: 0.3161, test_loss: 1.1682, test_f1: 0.6357
 epoch: 67, train_loss: 0.3237, test_loss: 1.2545, test_f1: 0.6328
 epoch: 68, train_loss: 0.3155, test_loss: 1.2908, test_f1: 0.6417
 epoch: 69, train_loss: 0.3032, test_loss: 1.2228, test_f1: 0.6401
 epoch: 70, train_loss: 0.3007, test_loss: 1.2734, test_f1: 0.6415
 epoch: 71, train_loss: 0.3176, test_loss: 1.2398, test_f1: 0.6239
 epoch: 72, train_loss: 0.2942, test_loss: 1.2921, test_f1: 0.6457
 epoch: 73, train_loss: 0.2939, test_loss: 1.2913, test_f1: 0.6281
 epoch: 74, train_loss: 0.2938, test_loss: 1.3468, test_f1: 0.6305
 epoch: 75, train_loss: 0.2837, test_loss: 1.3785, test_f1: 0.6262
 epoch: 76, train_loss: 0.2841, test_loss: 1.2907, test_f1: 0.6381
 epoch: 77, train_loss: 0.2853, test_loss: 1.3346, test_f1: 0.6353
 epoch: 78, train_loss: 0.2683, test_loss: 1.4451, test_f1: 0.6248
 epoch: 79, train_loss: 0.2716, test_loss: 1.3601, test_f1: 0.6394
 epoch: 80, train_loss: 0.2753, test_loss: 1.5119, test_f1: 0.6115
 epoch: 81, train_loss: 0.2679, test_loss: 1.5143, test_f1: 0.6219
 epoch: 82, train_loss: 0.2541, test_loss: 1.4013, test_f1: 0.6402
 epoch: 83, train_loss: 0.2631, test_loss: 1.4216, test_f1: 0.6449
 epoch: 84, train_loss: 0.2623, test_loss: 1.4357, test_f1: 0.6132
 epoch: 85, train_loss: 0.2568, test_loss: 1.5743, test_f1: 0.6203
 epoch: 86, train_loss: 0.2475, test_loss: 1.4526, test_f1: 0.6457
 epoch: 87, train_loss: 0.2556, test_loss: 1.4256, test_f1: 0.6329
 epoch: 88, train_loss: 0.2603, test_loss: 1.5924, test_f1: 0.6240
 epoch: 89, train_loss: 0.2481, test_loss: 1.8216, test_f1: 0.5898
 epoch: 90, train_loss: 0.2255, test_loss: 1.6237, test_f1: 0.6260
 epoch: 91, train_loss: 0.2442, test_loss: 1.5929, test_f1: 0.6237
 epoch: 92, train_loss: 0.2392, test_loss: 1.6872, test_f1: 0.6164
 epoch: 93, train_loss: 0.2498, test_loss: 1.6094, test_f1: 0.6355
 epoch: 94, train_loss: 0.2237, test_loss: 1.5729, test_f1: 0.6258
 epoch: 95, train_loss: 0.2316, test_loss: 1.6653, test_f1: 0.6273
 epoch: 96, train_loss: 0.2329, test_loss: 1.5582, test_f1: 0.6244
 epoch: 97, train_loss: 0.2326, test_loss: 1.6050, test_f1: 0.6292
 epoch: 98, train_loss: 0.2256, test_loss: 1.7148, test_f1: 0.6248
 epoch: 99, train_loss: 0.2314, test_loss: 1.6292, test_f1: 0.6346
##################ITERATION #4 ****************************************
 epoch: 0, train_loss: 1.2167, test_loss: 1.3767, test_f1: 0.2676
 epoch: 1, train_loss: 1.0480, test_loss: 1.4041, test_f1: 0.2667
 epoch: 2, train_loss: 0.9983, test_loss: 1.3766, test_f1: 0.2844
 epoch: 3, train_loss: 0.9567, test_loss: 1.1278, test_f1: 0.4196
 epoch: 4, train_loss: 0.9237, test_loss: 0.9517, test_f1: 0.5298
 epoch: 5, train_loss: 0.8916, test_loss: 0.9320, test_f1: 0.5424
 epoch: 6, train_loss: 0.8770, test_loss: 0.9485, test_f1: 0.5469
 epoch: 7, train_loss: 0.8639, test_loss: 0.8895, test_f1: 0.5278
 epoch: 8, train_loss: 0.8382, test_loss: 0.9319, test_f1: 0.5711
 epoch: 9, train_loss: 0.8396, test_loss: 0.8796, test_f1: 0.5846
 epoch: 10, train_loss: 0.8170, test_loss: 0.8925, test_f1: 0.5553
 epoch: 11, train_loss: 0.7970, test_loss: 0.9570, test_f1: 0.5602
 epoch: 12, train_loss: 0.7814, test_loss: 0.9998, test_f1: 0.5526
 epoch: 13, train_loss: 0.7691, test_loss: 0.8824, test_f1: 0.5727
 epoch: 14, train_loss: 0.7613, test_loss: 0.9447, test_f1: 0.5685
 epoch: 15, train_loss: 0.7452, test_loss: 0.9800, test_f1: 0.5608
 epoch: 16, train_loss: 0.7403, test_loss: 0.9242, test_f1: 0.5802
 epoch: 17, train_loss: 0.7101, test_loss: 0.9091, test_f1: 0.6189
 epoch: 18, train_loss: 0.7045, test_loss: 0.8866, test_f1: 0.6027
 epoch: 19, train_loss: 0.6962, test_loss: 0.9485, test_f1: 0.5690
 epoch: 20, train_loss: 0.6862, test_loss: 0.8836, test_f1: 0.5908
 epoch: 21, train_loss: 0.6610, test_loss: 0.9370, test_f1: 0.6099
 epoch: 22, train_loss: 0.6607, test_loss: 0.9743, test_f1: 0.5906
 epoch: 23, train_loss: 0.6527, test_loss: 0.8994, test_f1: 0.6153
 epoch: 24, train_loss: 0.6448, test_loss: 1.0164, test_f1: 0.5826
 epoch: 25, train_loss: 0.6552, test_loss: 0.9612, test_f1: 0.5964
 epoch: 26, train_loss: 0.6503, test_loss: 0.8782, test_f1: 0.6193
 epoch: 27, train_loss: 0.6363, test_loss: 0.9682, test_f1: 0.6098
 epoch: 28, train_loss: 0.6291, test_loss: 0.9282, test_f1: 0.6135
 epoch: 29, train_loss: 0.6161, test_loss: 0.9444, test_f1: 0.6044
 epoch: 30, train_loss: 0.5951, test_loss: 0.9034, test_f1: 0.6101
 epoch: 31, train_loss: 0.5886, test_loss: 0.9322, test_f1: 0.6049
 epoch: 32, train_loss: 0.6091, test_loss: 0.9376, test_f1: 0.6214
 epoch: 33, train_loss: 0.5756, test_loss: 0.8702, test_f1: 0.6511
 epoch: 34, train_loss: 0.5872, test_loss: 1.0257, test_f1: 0.6018
 epoch: 35, train_loss: 0.5821, test_loss: 0.9949, test_f1: 0.5793
 epoch: 36, train_loss: 0.5869, test_loss: 1.0403, test_f1: 0.6031
 epoch: 37, train_loss: 0.5510, test_loss: 1.0280, test_f1: 0.5880
 epoch: 38, train_loss: 0.5367, test_loss: 1.0800, test_f1: 0.6133
 epoch: 39, train_loss: 0.5336, test_loss: 0.8815, test_f1: 0.6523
 epoch: 40, train_loss: 0.5125, test_loss: 1.0229, test_f1: 0.6298
 epoch: 41, train_loss: 0.5289, test_loss: 0.9480, test_f1: 0.6291
 epoch: 42, train_loss: 0.5280, test_loss: 0.8596, test_f1: 0.6439
 epoch: 43, train_loss: 0.5052, test_loss: 1.3488, test_f1: 0.5615
 epoch: 44, train_loss: 0.5155, test_loss: 1.1187, test_f1: 0.5811
 epoch: 45, train_loss: 0.4891, test_loss: 0.9847, test_f1: 0.6055
 epoch: 46, train_loss: 0.4752, test_loss: 1.0427, test_f1: 0.6234
 epoch: 47, train_loss: 0.4757, test_loss: 0.9828, test_f1: 0.6268
 epoch: 48, train_loss: 0.4919, test_loss: 1.1296, test_f1: 0.5910
 epoch: 49, train_loss: 0.4728, test_loss: 1.1137, test_f1: 0.6209
 epoch: 50, train_loss: 0.4460, test_loss: 1.0345, test_f1: 0.6266
 epoch: 51, train_loss: 0.4412, test_loss: 0.9063, test_f1: 0.6753
 epoch: 52, train_loss: 0.4115, test_loss: 1.0116, test_f1: 0.6522
 epoch: 53, train_loss: 0.4058, test_loss: 0.9946, test_f1: 0.6442
 epoch: 54, train_loss: 0.3876, test_loss: 1.0211, test_f1: 0.6415
 epoch: 55, train_loss: 0.3987, test_loss: 1.0132, test_f1: 0.6608
 epoch: 56, train_loss: 0.3928, test_loss: 1.0098, test_f1: 0.6673
 epoch: 57, train_loss: 0.3810, test_loss: 1.0210, test_f1: 0.6646
 epoch: 58, train_loss: 0.3659, test_loss: 1.0448, test_f1: 0.6583
 epoch: 59, train_loss: 0.3854, test_loss: 1.0810, test_f1: 0.6310
 epoch: 60, train_loss: 0.3628, test_loss: 1.0909, test_f1: 0.6396
 epoch: 61, train_loss: 0.3560, test_loss: 1.0133, test_f1: 0.6811
 epoch: 62, train_loss: 0.3535, test_loss: 1.1059, test_f1: 0.6661
 epoch: 63, train_loss: 0.3727, test_loss: 1.1539, test_f1: 0.6540
 epoch: 64, train_loss: 0.3622, test_loss: 1.1046, test_f1: 0.6657
 epoch: 65, train_loss: 0.3636, test_loss: 1.1113, test_f1: 0.6579
 epoch: 66, train_loss: 0.3319, test_loss: 1.1304, test_f1: 0.6402
 epoch: 67, train_loss: 0.3434, test_loss: 1.1364, test_f1: 0.6387
 epoch: 68, train_loss: 0.3418, test_loss: 1.1090, test_f1: 0.6515
 epoch: 69, train_loss: 0.3387, test_loss: 1.1458, test_f1: 0.6432
 epoch: 70, train_loss: 0.3214, test_loss: 1.1684, test_f1: 0.6717
 epoch: 71, train_loss: 0.3098, test_loss: 1.1935, test_f1: 0.6587
 epoch: 72, train_loss: 0.3182, test_loss: 1.1026, test_f1: 0.6793
 epoch: 73, train_loss: 0.3192, test_loss: 1.1791, test_f1: 0.6706
 epoch: 74, train_loss: 0.3252, test_loss: 1.1851, test_f1: 0.6600
 epoch: 75, train_loss: 0.3270, test_loss: 1.2266, test_f1: 0.6456
 epoch: 76, train_loss: 0.3277, test_loss: 1.3385, test_f1: 0.6475
 epoch: 77, train_loss: 0.3160, test_loss: 1.2154, test_f1: 0.6676
 epoch: 78, train_loss: 0.2850, test_loss: 1.1539, test_f1: 0.6679
 epoch: 79, train_loss: 0.3079, test_loss: 1.2684, test_f1: 0.6584
 epoch: 80, train_loss: 0.2972, test_loss: 1.2865, test_f1: 0.6675
 epoch: 81, train_loss: 0.2996, test_loss: 1.1664, test_f1: 0.6587
 epoch: 82, train_loss: 0.2939, test_loss: 1.2531, test_f1: 0.6436
 epoch: 83, train_loss: 0.2791, test_loss: 1.1760, test_f1: 0.6814
 epoch: 84, train_loss: 0.2793, test_loss: 1.1870, test_f1: 0.6694
 epoch: 85, train_loss: 0.2834, test_loss: 1.3135, test_f1: 0.6446
 epoch: 86, train_loss: 0.2789, test_loss: 1.1837, test_f1: 0.6595
 epoch: 87, train_loss: 0.2791, test_loss: 1.2122, test_f1: 0.6466
 epoch: 88, train_loss: 0.2752, test_loss: 1.2045, test_f1: 0.6734
 epoch: 89, train_loss: 0.2637, test_loss: 1.3563, test_f1: 0.6520
 epoch: 90, train_loss: 0.2731, test_loss: 1.3177, test_f1: 0.6481
 epoch: 91, train_loss: 0.2842, test_loss: 1.2646, test_f1: 0.6636
 epoch: 92, train_loss: 0.2668, test_loss: 1.3388, test_f1: 0.6371
 epoch: 93, train_loss: 0.2549, test_loss: 1.3619, test_f1: 0.6527
 epoch: 94, train_loss: 0.2662, test_loss: 1.2929, test_f1: 0.6404
 epoch: 95, train_loss: 0.2591, test_loss: 1.2641, test_f1: 0.6516
 epoch: 96, train_loss: 0.2561, test_loss: 1.3630, test_f1: 0.6655
 epoch: 97, train_loss: 0.2400, test_loss: 1.3995, test_f1: 0.6727
 epoch: 98, train_loss: 0.2417, test_loss: 1.3883, test_f1: 0.6776
 epoch: 99, train_loss: 0.2419, test_loss: 1.4311, test_f1: 0.6669
##################ITERATION #5 ****************************************
 epoch: 0, train_loss: 1.2688, test_loss: 1.3859, test_f1: 0.2260
 epoch: 1, train_loss: 1.0760, test_loss: 1.2827, test_f1: 0.2311
 epoch: 2, train_loss: 1.0276, test_loss: 1.1114, test_f1: 0.3826
 epoch: 3, train_loss: 0.9823, test_loss: 1.1105, test_f1: 0.3931
 epoch: 4, train_loss: 0.9458, test_loss: 1.0278, test_f1: 0.4746
 epoch: 5, train_loss: 0.9237, test_loss: 1.0121, test_f1: 0.4981
 epoch: 6, train_loss: 0.8937, test_loss: 0.9334, test_f1: 0.5637
 epoch: 7, train_loss: 0.8866, test_loss: 0.9564, test_f1: 0.5151
 epoch: 8, train_loss: 0.8605, test_loss: 0.9348, test_f1: 0.5283
 epoch: 9, train_loss: 0.8350, test_loss: 0.9135, test_f1: 0.5586
 epoch: 10, train_loss: 0.8163, test_loss: 0.9443, test_f1: 0.5434
 epoch: 11, train_loss: 0.8170, test_loss: 0.8805, test_f1: 0.5625
 epoch: 12, train_loss: 0.7829, test_loss: 0.9285, test_f1: 0.5734
 epoch: 13, train_loss: 0.7861, test_loss: 0.9216, test_f1: 0.5583
 epoch: 14, train_loss: 0.7778, test_loss: 0.9616, test_f1: 0.5530
 epoch: 15, train_loss: 0.7738, test_loss: 0.8806, test_f1: 0.5892
 epoch: 16, train_loss: 0.7518, test_loss: 0.9240, test_f1: 0.5495
 epoch: 17, train_loss: 0.7549, test_loss: 0.8539, test_f1: 0.5967
 epoch: 18, train_loss: 0.7267, test_loss: 0.8652, test_f1: 0.6001
 epoch: 19, train_loss: 0.7052, test_loss: 0.8746, test_f1: 0.5863
 epoch: 20, train_loss: 0.7036, test_loss: 0.8494, test_f1: 0.6011
 epoch: 21, train_loss: 0.6987, test_loss: 0.8979, test_f1: 0.5832
 epoch: 22, train_loss: 0.6863, test_loss: 0.8528, test_f1: 0.5956
 epoch: 23, train_loss: 0.6846, test_loss: 0.9246, test_f1: 0.5720
 epoch: 24, train_loss: 0.6736, test_loss: 0.9037, test_f1: 0.6223
 epoch: 25, train_loss: 0.6714, test_loss: 0.8781, test_f1: 0.6044
 epoch: 26, train_loss: 0.6418, test_loss: 0.9057, test_f1: 0.6127
 epoch: 27, train_loss: 0.6371, test_loss: 1.0446, test_f1: 0.5761
 epoch: 28, train_loss: 0.6405, test_loss: 0.9344, test_f1: 0.6024
 epoch: 29, train_loss: 0.6505, test_loss: 0.8670, test_f1: 0.6314
 epoch: 30, train_loss: 0.6350, test_loss: 0.9642, test_f1: 0.6027
 epoch: 31, train_loss: 0.6218, test_loss: 0.9220, test_f1: 0.6050
 epoch: 32, train_loss: 0.6170, test_loss: 0.8922, test_f1: 0.5806
 epoch: 33, train_loss: 0.5995, test_loss: 0.8959, test_f1: 0.6087
 epoch: 34, train_loss: 0.5908, test_loss: 1.0304, test_f1: 0.5752
 epoch: 35, train_loss: 0.5928, test_loss: 0.9083, test_f1: 0.6198
 epoch: 36, train_loss: 0.5837, test_loss: 0.9037, test_f1: 0.6092
 epoch: 37, train_loss: 0.5911, test_loss: 0.8777, test_f1: 0.6301
 epoch: 38, train_loss: 0.5969, test_loss: 1.0018, test_f1: 0.6068
 epoch: 39, train_loss: 0.5840, test_loss: 0.9471, test_f1: 0.6117
 epoch: 40, train_loss: 0.5780, test_loss: 0.9146, test_f1: 0.6042
 epoch: 41, train_loss: 0.5529, test_loss: 0.9899, test_f1: 0.6167
 epoch: 42, train_loss: 0.5477, test_loss: 1.0141, test_f1: 0.6091
 epoch: 43, train_loss: 0.5345, test_loss: 0.9394, test_f1: 0.6111
 epoch: 44, train_loss: 0.5298, test_loss: 0.9520, test_f1: 0.6402
 epoch: 45, train_loss: 0.5185, test_loss: 0.9406, test_f1: 0.6182
 epoch: 46, train_loss: 0.5256, test_loss: 0.9335, test_f1: 0.6367
 epoch: 47, train_loss: 0.5177, test_loss: 0.9350, test_f1: 0.6392
 epoch: 48, train_loss: 0.5061, test_loss: 1.1696, test_f1: 0.5709
 epoch: 49, train_loss: 0.5016, test_loss: 1.0057, test_f1: 0.6210
 epoch: 50, train_loss: 0.4854, test_loss: 1.0044, test_f1: 0.6222
 epoch: 51, train_loss: 0.4702, test_loss: 1.0520, test_f1: 0.6086
 epoch: 52, train_loss: 0.4589, test_loss: 0.9923, test_f1: 0.6354
 epoch: 53, train_loss: 0.4401, test_loss: 0.9596, test_f1: 0.6345
 epoch: 54, train_loss: 0.4227, test_loss: 0.9830, test_f1: 0.6458
 epoch: 55, train_loss: 0.4156, test_loss: 1.0032, test_f1: 0.6303
 epoch: 56, train_loss: 0.4183, test_loss: 1.0316, test_f1: 0.6388
 epoch: 57, train_loss: 0.4052, test_loss: 1.0599, test_f1: 0.6351
 epoch: 58, train_loss: 0.4184, test_loss: 1.0030, test_f1: 0.6531
 epoch: 59, train_loss: 0.4075, test_loss: 1.0903, test_f1: 0.6164
 epoch: 60, train_loss: 0.4055, test_loss: 1.0190, test_f1: 0.6330
 epoch: 61, train_loss: 0.4072, test_loss: 1.0397, test_f1: 0.6382
 epoch: 62, train_loss: 0.4076, test_loss: 1.0686, test_f1: 0.6333
 epoch: 63, train_loss: 0.3946, test_loss: 1.0736, test_f1: 0.6415
 epoch: 64, train_loss: 0.3828, test_loss: 1.0604, test_f1: 0.6511
 epoch: 65, train_loss: 0.3784, test_loss: 1.0628, test_f1: 0.6419
 epoch: 66, train_loss: 0.3862, test_loss: 1.0445, test_f1: 0.6659
 epoch: 67, train_loss: 0.3621, test_loss: 1.1221, test_f1: 0.6394
 epoch: 68, train_loss: 0.3674, test_loss: 1.1103, test_f1: 0.6353
 epoch: 69, train_loss: 0.3612, test_loss: 1.0937, test_f1: 0.6416
 epoch: 70, train_loss: 0.3635, test_loss: 1.1573, test_f1: 0.6293
 epoch: 71, train_loss: 0.3917, test_loss: 1.0790, test_f1: 0.6232
 epoch: 72, train_loss: 0.3778, test_loss: 1.0993, test_f1: 0.6388
 epoch: 73, train_loss: 0.3611, test_loss: 1.1199, test_f1: 0.6409
 epoch: 74, train_loss: 0.3599, test_loss: 1.1940, test_f1: 0.6427
 epoch: 75, train_loss: 0.3430, test_loss: 1.0820, test_f1: 0.6661
 epoch: 76, train_loss: 0.3442, test_loss: 1.0278, test_f1: 0.6821
 epoch: 77, train_loss: 0.3486, test_loss: 1.3168, test_f1: 0.6249
 epoch: 78, train_loss: 0.3390, test_loss: 1.1557, test_f1: 0.6390
 epoch: 79, train_loss: 0.3571, test_loss: 1.1149, test_f1: 0.6511
 epoch: 80, train_loss: 0.3313, test_loss: 1.1523, test_f1: 0.6440
 epoch: 81, train_loss: 0.3237, test_loss: 1.2199, test_f1: 0.6286
 epoch: 82, train_loss: 0.3275, test_loss: 1.2372, test_f1: 0.6263
 epoch: 83, train_loss: 0.3229, test_loss: 1.1879, test_f1: 0.6284
 epoch: 84, train_loss: 0.3163, test_loss: 1.0841, test_f1: 0.6678
 epoch: 85, train_loss: 0.3273, test_loss: 1.2727, test_f1: 0.6405
 epoch: 86, train_loss: 0.3177, test_loss: 1.1232, test_f1: 0.6692
 epoch: 87, train_loss: 0.3176, test_loss: 1.1520, test_f1: 0.6425
 epoch: 88, train_loss: 0.3000, test_loss: 1.1581, test_f1: 0.6580
 epoch: 89, train_loss: 0.2975, test_loss: 1.1859, test_f1: 0.6515
 epoch: 90, train_loss: 0.2923, test_loss: 1.1810, test_f1: 0.6477
 epoch: 91, train_loss: 0.2891, test_loss: 1.2381, test_f1: 0.6426
 epoch: 92, train_loss: 0.3051, test_loss: 1.2474, test_f1: 0.6538
 epoch: 93, train_loss: 0.2842, test_loss: 1.2704, test_f1: 0.6346
 epoch: 94, train_loss: 0.3156, test_loss: 1.3014, test_f1: 0.6277
 epoch: 95, train_loss: 0.2757, test_loss: 1.3150, test_f1: 0.6470
 epoch: 96, train_loss: 0.2898, test_loss: 1.3172, test_f1: 0.6408
 epoch: 97, train_loss: 0.2789, test_loss: 1.1643, test_f1: 0.6473
 epoch: 98, train_loss: 0.2737, test_loss: 1.2430, test_f1: 0.6613
 epoch: 99, train_loss: 0.2889, test_loss: 1.3266, test_f1: 0.6531
##################ITERATION #6 ****************************************
 epoch: 0, train_loss: 1.3352, test_loss: 1.3369, test_f1: 0.2611
 epoch: 1, train_loss: 1.0934, test_loss: 1.2891, test_f1: 0.3301
 epoch: 2, train_loss: 1.0253, test_loss: 1.2562, test_f1: 0.3328
 epoch: 3, train_loss: 1.0032, test_loss: 1.2445, test_f1: 0.3529
 epoch: 4, train_loss: 0.9640, test_loss: 1.0800, test_f1: 0.4465
 epoch: 5, train_loss: 0.9421, test_loss: 0.9874, test_f1: 0.4816
 epoch: 6, train_loss: 0.9104, test_loss: 0.9538, test_f1: 0.5216
 epoch: 7, train_loss: 0.8840, test_loss: 0.9265, test_f1: 0.5424
 epoch: 8, train_loss: 0.8650, test_loss: 0.8897, test_f1: 0.5633
 epoch: 9, train_loss: 0.8433, test_loss: 0.9284, test_f1: 0.5593
 epoch: 10, train_loss: 0.8373, test_loss: 0.9190, test_f1: 0.5486
 epoch: 11, train_loss: 0.8106, test_loss: 0.9562, test_f1: 0.5383
 epoch: 12, train_loss: 0.8052, test_loss: 0.9116, test_f1: 0.5761
 epoch: 13, train_loss: 0.8004, test_loss: 0.9860, test_f1: 0.5349
 epoch: 14, train_loss: 0.7919, test_loss: 0.9536, test_f1: 0.5759
 epoch: 15, train_loss: 0.7583, test_loss: 0.9423, test_f1: 0.5635
 epoch: 16, train_loss: 0.7360, test_loss: 0.9185, test_f1: 0.5843
 epoch: 17, train_loss: 0.7346, test_loss: 0.8953, test_f1: 0.5952
 epoch: 18, train_loss: 0.7172, test_loss: 0.9163, test_f1: 0.5719
 epoch: 19, train_loss: 0.7029, test_loss: 0.9094, test_f1: 0.5755
 epoch: 20, train_loss: 0.7137, test_loss: 0.8686, test_f1: 0.5903
 epoch: 21, train_loss: 0.6782, test_loss: 0.9266, test_f1: 0.5912
 epoch: 22, train_loss: 0.6733, test_loss: 0.8976, test_f1: 0.5902
 epoch: 23, train_loss: 0.6596, test_loss: 0.8530, test_f1: 0.6000
 epoch: 24, train_loss: 0.6647, test_loss: 0.8699, test_f1: 0.5981
 epoch: 25, train_loss: 0.6296, test_loss: 0.9164, test_f1: 0.6077
 epoch: 26, train_loss: 0.6321, test_loss: 1.1622, test_f1: 0.5758
 epoch: 27, train_loss: 0.6408, test_loss: 0.8810, test_f1: 0.6251
 epoch: 28, train_loss: 0.6252, test_loss: 0.8751, test_f1: 0.6365
 epoch: 29, train_loss: 0.6068, test_loss: 0.9111, test_f1: 0.6203
 epoch: 30, train_loss: 0.5810, test_loss: 0.9773, test_f1: 0.5792
 epoch: 31, train_loss: 0.5969, test_loss: 0.9758, test_f1: 0.5516
 epoch: 32, train_loss: 0.5752, test_loss: 0.9062, test_f1: 0.6105
 epoch: 33, train_loss: 0.5729, test_loss: 0.9830, test_f1: 0.5742
 epoch: 34, train_loss: 0.5571, test_loss: 0.8597, test_f1: 0.6189
 epoch: 35, train_loss: 0.5397, test_loss: 0.9505, test_f1: 0.6287
 epoch: 36, train_loss: 0.5344, test_loss: 0.9748, test_f1: 0.5958
 epoch: 37, train_loss: 0.5326, test_loss: 0.9463, test_f1: 0.6027
 epoch: 38, train_loss: 0.5140, test_loss: 0.9029, test_f1: 0.6252
 epoch: 39, train_loss: 0.5109, test_loss: 0.9250, test_f1: 0.6597
 epoch: 40, train_loss: 0.5248, test_loss: 0.9357, test_f1: 0.6210
 epoch: 41, train_loss: 0.5192, test_loss: 0.9359, test_f1: 0.6364
 epoch: 42, train_loss: 0.4832, test_loss: 0.9641, test_f1: 0.6291
 epoch: 43, train_loss: 0.4776, test_loss: 0.9901, test_f1: 0.6277
 epoch: 44, train_loss: 0.4538, test_loss: 0.9467, test_f1: 0.6089
 epoch: 45, train_loss: 0.4613, test_loss: 1.0603, test_f1: 0.5924
 epoch: 46, train_loss: 0.4645, test_loss: 0.9522, test_f1: 0.6377
 epoch: 47, train_loss: 0.4852, test_loss: 0.9336, test_f1: 0.6462
 epoch: 48, train_loss: 0.4621, test_loss: 0.9377, test_f1: 0.6425
 epoch: 49, train_loss: 0.4459, test_loss: 0.9503, test_f1: 0.6581
 epoch: 50, train_loss: 0.4401, test_loss: 0.9716, test_f1: 0.6354
 epoch: 51, train_loss: 0.4035, test_loss: 0.9298, test_f1: 0.6422
 epoch: 52, train_loss: 0.3871, test_loss: 0.9915, test_f1: 0.6462
 epoch: 53, train_loss: 0.3832, test_loss: 0.9515, test_f1: 0.6441
 epoch: 54, train_loss: 0.3595, test_loss: 1.0314, test_f1: 0.6473
 epoch: 55, train_loss: 0.3591, test_loss: 1.0176, test_f1: 0.6479
 epoch: 56, train_loss: 0.3560, test_loss: 0.9528, test_f1: 0.6567
 epoch: 57, train_loss: 0.3485, test_loss: 1.0944, test_f1: 0.6217
 epoch: 58, train_loss: 0.3569, test_loss: 0.9670, test_f1: 0.6636
 epoch: 59, train_loss: 0.3572, test_loss: 1.1462, test_f1: 0.6090
 epoch: 60, train_loss: 0.3375, test_loss: 0.9619, test_f1: 0.6675
 epoch: 61, train_loss: 0.3337, test_loss: 1.0522, test_f1: 0.6358
 epoch: 62, train_loss: 0.3307, test_loss: 0.9865, test_f1: 0.6532
 epoch: 63, train_loss: 0.3170, test_loss: 1.1263, test_f1: 0.6450
 epoch: 64, train_loss: 0.3142, test_loss: 1.0741, test_f1: 0.6623
 epoch: 65, train_loss: 0.3083, test_loss: 1.1230, test_f1: 0.6377
 epoch: 66, train_loss: 0.3026, test_loss: 1.1023, test_f1: 0.6515
 epoch: 67, train_loss: 0.3014, test_loss: 1.1232, test_f1: 0.6466
 epoch: 68, train_loss: 0.3001, test_loss: 1.0538, test_f1: 0.6526
 epoch: 69, train_loss: 0.3072, test_loss: 1.2210, test_f1: 0.6341
 epoch: 70, train_loss: 0.2942, test_loss: 1.1795, test_f1: 0.6301
 epoch: 71, train_loss: 0.2769, test_loss: 1.1026, test_f1: 0.6612
 epoch: 72, train_loss: 0.2845, test_loss: 1.2259, test_f1: 0.6299
 epoch: 73, train_loss: 0.3065, test_loss: 1.2126, test_f1: 0.6272
 epoch: 74, train_loss: 0.2819, test_loss: 1.1324, test_f1: 0.6297
 epoch: 75, train_loss: 0.2618, test_loss: 1.1775, test_f1: 0.6540
 epoch: 76, train_loss: 0.2758, test_loss: 1.0854, test_f1: 0.6558
 epoch: 77, train_loss: 0.2806, test_loss: 1.2345, test_f1: 0.6177
 epoch: 78, train_loss: 0.2734, test_loss: 1.2536, test_f1: 0.6306
 epoch: 79, train_loss: 0.2575, test_loss: 1.1286, test_f1: 0.6333
 epoch: 80, train_loss: 0.2739, test_loss: 1.2362, test_f1: 0.6377
 epoch: 81, train_loss: 0.2895, test_loss: 1.0843, test_f1: 0.6586
 epoch: 82, train_loss: 0.2691, test_loss: 1.1674, test_f1: 0.6461
 epoch: 83, train_loss: 0.2673, test_loss: 1.2101, test_f1: 0.6438
 epoch: 84, train_loss: 0.2723, test_loss: 1.3017, test_f1: 0.6229
 epoch: 85, train_loss: 0.2709, test_loss: 1.2322, test_f1: 0.6566
 epoch: 86, train_loss: 0.2363, test_loss: 1.1546, test_f1: 0.6239
 epoch: 87, train_loss: 0.2481, test_loss: 1.2248, test_f1: 0.6510
 epoch: 88, train_loss: 0.2434, test_loss: 1.3847, test_f1: 0.6339
 epoch: 89, train_loss: 0.2577, test_loss: 1.2296, test_f1: 0.6485
 epoch: 90, train_loss: 0.2617, test_loss: 1.3426, test_f1: 0.6226
 epoch: 91, train_loss: 0.2394, test_loss: 1.3256, test_f1: 0.6360
 epoch: 92, train_loss: 0.2400, test_loss: 1.3653, test_f1: 0.6263
 epoch: 93, train_loss: 0.2690, test_loss: 1.2693, test_f1: 0.6139
 epoch: 94, train_loss: 0.2623, test_loss: 1.2971, test_f1: 0.6636
 epoch: 95, train_loss: 0.2622, test_loss: 1.2472, test_f1: 0.6527
 epoch: 96, train_loss: 0.2589, test_loss: 1.3614, test_f1: 0.6081
 epoch: 97, train_loss: 0.2650, test_loss: 1.3827, test_f1: 0.6309
 epoch: 98, train_loss: 0.2250, test_loss: 1.3737, test_f1: 0.6323
 epoch: 99, train_loss: 0.2415, test_loss: 1.2246, test_f1: 0.6220
##################ITERATION #7 ****************************************
 epoch: 0, train_loss: 1.3967, test_loss: 1.3662, test_f1: 0.2574
 epoch: 1, train_loss: 1.0796, test_loss: 1.3037, test_f1: 0.2467
 epoch: 2, train_loss: 1.0238, test_loss: 1.1539, test_f1: 0.3812
 epoch: 3, train_loss: 0.9840, test_loss: 1.0432, test_f1: 0.4420
 epoch: 4, train_loss: 0.9565, test_loss: 0.9666, test_f1: 0.5119
 epoch: 5, train_loss: 0.9131, test_loss: 0.9391, test_f1: 0.5402
 epoch: 6, train_loss: 0.8962, test_loss: 0.9426, test_f1: 0.5637
 epoch: 7, train_loss: 0.8712, test_loss: 1.0234, test_f1: 0.5335
 epoch: 8, train_loss: 0.8788, test_loss: 0.9481, test_f1: 0.5443
 epoch: 9, train_loss: 0.8552, test_loss: 0.9921, test_f1: 0.5669
 epoch: 10, train_loss: 0.8246, test_loss: 0.9948, test_f1: 0.5658
 epoch: 11, train_loss: 0.8025, test_loss: 0.9512, test_f1: 0.5895
 epoch: 12, train_loss: 0.7897, test_loss: 0.9495, test_f1: 0.5943
 epoch: 13, train_loss: 0.7968, test_loss: 0.9608, test_f1: 0.5736
 epoch: 14, train_loss: 0.7685, test_loss: 0.9522, test_f1: 0.5923
 epoch: 15, train_loss: 0.7476, test_loss: 0.9767, test_f1: 0.5909
 epoch: 16, train_loss: 0.7427, test_loss: 0.9460, test_f1: 0.5716
 epoch: 17, train_loss: 0.7380, test_loss: 0.9548, test_f1: 0.5900
 epoch: 18, train_loss: 0.7205, test_loss: 0.9902, test_f1: 0.5757
 epoch: 19, train_loss: 0.7168, test_loss: 0.9649, test_f1: 0.5909
 epoch: 20, train_loss: 0.6945, test_loss: 1.0462, test_f1: 0.5867
 epoch: 21, train_loss: 0.6839, test_loss: 1.0523, test_f1: 0.5602
 epoch: 22, train_loss: 0.6849, test_loss: 0.9946, test_f1: 0.5969
 epoch: 23, train_loss: 0.6808, test_loss: 0.9888, test_f1: 0.5971
 epoch: 24, train_loss: 0.6674, test_loss: 0.9636, test_f1: 0.5935
 epoch: 25, train_loss: 0.6754, test_loss: 0.9463, test_f1: 0.6149
 epoch: 26, train_loss: 0.6586, test_loss: 0.9258, test_f1: 0.6085
 epoch: 27, train_loss: 0.6323, test_loss: 0.9837, test_f1: 0.5906
 epoch: 28, train_loss: 0.6199, test_loss: 0.9546, test_f1: 0.5922
 epoch: 29, train_loss: 0.6330, test_loss: 1.0431, test_f1: 0.5848
 epoch: 30, train_loss: 0.6004, test_loss: 0.9965, test_f1: 0.6158
 epoch: 31, train_loss: 0.5799, test_loss: 0.9971, test_f1: 0.6078
 epoch: 32, train_loss: 0.5781, test_loss: 0.9452, test_f1: 0.6350
 epoch: 33, train_loss: 0.5907, test_loss: 0.9146, test_f1: 0.6358
 epoch: 34, train_loss: 0.5856, test_loss: 1.0241, test_f1: 0.5713
 epoch: 35, train_loss: 0.5623, test_loss: 0.9565, test_f1: 0.6309
 epoch: 36, train_loss: 0.5599, test_loss: 0.9812, test_f1: 0.6022
 epoch: 37, train_loss: 0.5621, test_loss: 1.1679, test_f1: 0.5722
 epoch: 38, train_loss: 0.5782, test_loss: 1.0948, test_f1: 0.5829
 epoch: 39, train_loss: 0.5708, test_loss: 0.8748, test_f1: 0.6316
 epoch: 40, train_loss: 0.5574, test_loss: 0.9842, test_f1: 0.6153
 epoch: 41, train_loss: 0.5377, test_loss: 1.0882, test_f1: 0.5711
 epoch: 42, train_loss: 0.5093, test_loss: 0.9316, test_f1: 0.6151
 epoch: 43, train_loss: 0.4998, test_loss: 1.1339, test_f1: 0.5989
 epoch: 44, train_loss: 0.5170, test_loss: 0.9657, test_f1: 0.6023
 epoch: 45, train_loss: 0.5214, test_loss: 1.0718, test_f1: 0.5923
 epoch: 46, train_loss: 0.4971, test_loss: 0.9322, test_f1: 0.6179
 epoch: 47, train_loss: 0.4784, test_loss: 1.0451, test_f1: 0.6039
 epoch: 48, train_loss: 0.4653, test_loss: 1.0604, test_f1: 0.5981
 epoch: 49, train_loss: 0.4657, test_loss: 1.0410, test_f1: 0.6378
 epoch: 50, train_loss: 0.4578, test_loss: 1.1028, test_f1: 0.6233
 epoch: 51, train_loss: 0.4412, test_loss: 1.0119, test_f1: 0.6384
 epoch: 52, train_loss: 0.4241, test_loss: 1.0181, test_f1: 0.6307
 epoch: 53, train_loss: 0.3975, test_loss: 1.0171, test_f1: 0.6322
 epoch: 54, train_loss: 0.3843, test_loss: 1.0561, test_f1: 0.6338
 epoch: 55, train_loss: 0.3732, test_loss: 1.0892, test_f1: 0.6358
 epoch: 56, train_loss: 0.3788, test_loss: 1.1102, test_f1: 0.6243
 epoch: 57, train_loss: 0.3767, test_loss: 1.1097, test_f1: 0.6324
 epoch: 58, train_loss: 0.3665, test_loss: 1.0505, test_f1: 0.6258
 epoch: 59, train_loss: 0.3691, test_loss: 1.1754, test_f1: 0.6375
 epoch: 60, train_loss: 0.3556, test_loss: 1.1643, test_f1: 0.6221
 epoch: 61, train_loss: 0.3533, test_loss: 1.1935, test_f1: 0.6134
 epoch: 62, train_loss: 0.3650, test_loss: 1.1744, test_f1: 0.6308
 epoch: 63, train_loss: 0.3487, test_loss: 1.1651, test_f1: 0.6256
 epoch: 64, train_loss: 0.3572, test_loss: 1.1684, test_f1: 0.6284
 epoch: 65, train_loss: 0.3664, test_loss: 1.1189, test_f1: 0.6410
 epoch: 66, train_loss: 0.3496, test_loss: 1.2410, test_f1: 0.6107
 epoch: 67, train_loss: 0.3465, test_loss: 1.2600, test_f1: 0.6007
 epoch: 68, train_loss: 0.3295, test_loss: 1.1326, test_f1: 0.6376
 epoch: 69, train_loss: 0.3209, test_loss: 1.2064, test_f1: 0.6225
 epoch: 70, train_loss: 0.3242, test_loss: 1.2953, test_f1: 0.6143
 epoch: 71, train_loss: 0.3277, test_loss: 1.1511, test_f1: 0.6533
 epoch: 72, train_loss: 0.3195, test_loss: 1.2496, test_f1: 0.6185
 epoch: 73, train_loss: 0.3138, test_loss: 1.2391, test_f1: 0.6167
 epoch: 74, train_loss: 0.3332, test_loss: 1.1934, test_f1: 0.6547
 epoch: 75, train_loss: 0.3321, test_loss: 1.1462, test_f1: 0.6435
 epoch: 76, train_loss: 0.3032, test_loss: 1.2609, test_f1: 0.6224
 epoch: 77, train_loss: 0.3027, test_loss: 1.2651, test_f1: 0.6215
 epoch: 78, train_loss: 0.3099, test_loss: 1.2794, test_f1: 0.6278
 epoch: 79, train_loss: 0.2979, test_loss: 1.2588, test_f1: 0.6396
 epoch: 80, train_loss: 0.2913, test_loss: 1.3162, test_f1: 0.6267
 epoch: 81, train_loss: 0.2913, test_loss: 1.2157, test_f1: 0.6408
 epoch: 82, train_loss: 0.2835, test_loss: 1.2168, test_f1: 0.6459
 epoch: 83, train_loss: 0.2817, test_loss: 1.2858, test_f1: 0.6411
 epoch: 84, train_loss: 0.2773, test_loss: 1.2607, test_f1: 0.6498
 epoch: 85, train_loss: 0.2803, test_loss: 1.3932, test_f1: 0.5980
 epoch: 86, train_loss: 0.2815, test_loss: 1.2881, test_f1: 0.6643
 epoch: 87, train_loss: 0.2918, test_loss: 1.2935, test_f1: 0.6357
 epoch: 88, train_loss: 0.2734, test_loss: 1.4077, test_f1: 0.6154
 epoch: 89, train_loss: 0.2617, test_loss: 1.4074, test_f1: 0.6311
 epoch: 90, train_loss: 0.2872, test_loss: 1.3283, test_f1: 0.6535
 epoch: 91, train_loss: 0.2721, test_loss: 1.4707, test_f1: 0.6379
 epoch: 92, train_loss: 0.2609, test_loss: 1.3849, test_f1: 0.6412
 epoch: 93, train_loss: 0.2584, test_loss: 1.3080, test_f1: 0.6616
 epoch: 94, train_loss: 0.2920, test_loss: 1.4095, test_f1: 0.6180
 epoch: 95, train_loss: 0.2676, test_loss: 1.4014, test_f1: 0.6490
 epoch: 96, train_loss: 0.2483, test_loss: 1.4064, test_f1: 0.6355
 epoch: 97, train_loss: 0.2440, test_loss: 1.4362, test_f1: 0.6463
 epoch: 98, train_loss: 0.2481, test_loss: 1.4552, test_f1: 0.6592
 epoch: 99, train_loss: 0.2362, test_loss: 1.5330, test_f1: 0.6064
##################ITERATION #8 ****************************************
 epoch: 0, train_loss: 1.3815, test_loss: 1.3295, test_f1: 0.2260
 epoch: 1, train_loss: 1.1142, test_loss: 1.3881, test_f1: 0.2658
 epoch: 2, train_loss: 1.0318, test_loss: 1.2621, test_f1: 0.2844
 epoch: 3, train_loss: 0.9735, test_loss: 1.0208, test_f1: 0.4845
 epoch: 4, train_loss: 0.9501, test_loss: 0.9812, test_f1: 0.5269
 epoch: 5, train_loss: 0.9255, test_loss: 0.9658, test_f1: 0.4980
 epoch: 6, train_loss: 0.8973, test_loss: 0.9449, test_f1: 0.5263
 epoch: 7, train_loss: 0.8809, test_loss: 0.9394, test_f1: 0.5391
 epoch: 8, train_loss: 0.8572, test_loss: 0.8977, test_f1: 0.5909
 epoch: 9, train_loss: 0.8432, test_loss: 0.9057, test_f1: 0.5623
 epoch: 10, train_loss: 0.8297, test_loss: 0.9112, test_f1: 0.5572
 epoch: 11, train_loss: 0.8100, test_loss: 0.8871, test_f1: 0.5710
 epoch: 12, train_loss: 0.8027, test_loss: 0.8769, test_f1: 0.5897
 epoch: 13, train_loss: 0.7849, test_loss: 0.9255, test_f1: 0.5360
 epoch: 14, train_loss: 0.7704, test_loss: 0.9608, test_f1: 0.5623
 epoch: 15, train_loss: 0.7697, test_loss: 0.8736, test_f1: 0.5858
 epoch: 16, train_loss: 0.7389, test_loss: 0.9053, test_f1: 0.5782
 epoch: 17, train_loss: 0.7317, test_loss: 0.9001, test_f1: 0.5841
 epoch: 18, train_loss: 0.7314, test_loss: 0.9257, test_f1: 0.5658
 epoch: 19, train_loss: 0.7325, test_loss: 0.9218, test_f1: 0.5928
 epoch: 20, train_loss: 0.7105, test_loss: 0.9300, test_f1: 0.5664
 epoch: 21, train_loss: 0.7093, test_loss: 0.8985, test_f1: 0.6182
 epoch: 22, train_loss: 0.6853, test_loss: 0.8762, test_f1: 0.6312
 epoch: 23, train_loss: 0.6650, test_loss: 0.8603, test_f1: 0.5804
 epoch: 24, train_loss: 0.6585, test_loss: 0.9996, test_f1: 0.5720
 epoch: 25, train_loss: 0.6516, test_loss: 0.8558, test_f1: 0.5977
 epoch: 26, train_loss: 0.6459, test_loss: 0.9208, test_f1: 0.5850
 epoch: 27, train_loss: 0.6229, test_loss: 0.8796, test_f1: 0.6162
 epoch: 28, train_loss: 0.6252, test_loss: 0.8866, test_f1: 0.6127
 epoch: 29, train_loss: 0.5983, test_loss: 0.8469, test_f1: 0.6283
 epoch: 30, train_loss: 0.6342, test_loss: 0.9001, test_f1: 0.6300
 epoch: 31, train_loss: 0.6109, test_loss: 0.8739, test_f1: 0.6149
 epoch: 32, train_loss: 0.6260, test_loss: 0.9091, test_f1: 0.5974
 epoch: 33, train_loss: 0.6126, test_loss: 0.8608, test_f1: 0.6372
 epoch: 34, train_loss: 0.5864, test_loss: 0.8944, test_f1: 0.6059
 epoch: 35, train_loss: 0.5788, test_loss: 1.0682, test_f1: 0.5595
 epoch: 36, train_loss: 0.5748, test_loss: 0.9382, test_f1: 0.6127
 epoch: 37, train_loss: 0.5671, test_loss: 0.8709, test_f1: 0.6119
 epoch: 38, train_loss: 0.5358, test_loss: 0.8684, test_f1: 0.6261
 epoch: 39, train_loss: 0.5409, test_loss: 0.9504, test_f1: 0.6271
 epoch: 40, train_loss: 0.5320, test_loss: 1.0684, test_f1: 0.5659
 epoch: 41, train_loss: 0.5345, test_loss: 0.8951, test_f1: 0.6177
 epoch: 42, train_loss: 0.5347, test_loss: 1.1825, test_f1: 0.5837
 epoch: 43, train_loss: 0.5204, test_loss: 1.0326, test_f1: 0.5531
 epoch: 44, train_loss: 0.5179, test_loss: 1.1022, test_f1: 0.5834
 epoch: 45, train_loss: 0.5039, test_loss: 0.9190, test_f1: 0.6019
 epoch: 46, train_loss: 0.4943, test_loss: 0.9321, test_f1: 0.6160
 epoch: 47, train_loss: 0.4824, test_loss: 0.9603, test_f1: 0.6314
 epoch: 48, train_loss: 0.5062, test_loss: 1.2030, test_f1: 0.5805
 epoch: 49, train_loss: 0.5036, test_loss: 0.9441, test_f1: 0.6331
 epoch: 50, train_loss: 0.5058, test_loss: 0.9543, test_f1: 0.5925
 epoch: 51, train_loss: 0.4600, test_loss: 0.9110, test_f1: 0.6156
 epoch: 52, train_loss: 0.4458, test_loss: 0.9389, test_f1: 0.6364
 epoch: 53, train_loss: 0.4203, test_loss: 1.0652, test_f1: 0.6190
 epoch: 54, train_loss: 0.4161, test_loss: 0.9919, test_f1: 0.6314
 epoch: 55, train_loss: 0.3967, test_loss: 1.0044, test_f1: 0.6330
 epoch: 56, train_loss: 0.3965, test_loss: 1.0539, test_f1: 0.6250
 epoch: 57, train_loss: 0.3859, test_loss: 0.9891, test_f1: 0.6422
 epoch: 58, train_loss: 0.3933, test_loss: 1.0116, test_f1: 0.6287
 epoch: 59, train_loss: 0.3813, test_loss: 0.9495, test_f1: 0.6736
 epoch: 60, train_loss: 0.3750, test_loss: 0.9934, test_f1: 0.6558
 epoch: 61, train_loss: 0.3803, test_loss: 1.0315, test_f1: 0.6368
 epoch: 62, train_loss: 0.3689, test_loss: 1.0988, test_f1: 0.6196
 epoch: 63, train_loss: 0.3583, test_loss: 1.0507, test_f1: 0.6559
 epoch: 64, train_loss: 0.3790, test_loss: 1.1098, test_f1: 0.6065
 epoch: 65, train_loss: 0.3599, test_loss: 1.0195, test_f1: 0.6262
 epoch: 66, train_loss: 0.3553, test_loss: 1.1688, test_f1: 0.6193
 epoch: 67, train_loss: 0.3548, test_loss: 1.1917, test_f1: 0.6018
 epoch: 68, train_loss: 0.3563, test_loss: 1.1274, test_f1: 0.6191
 epoch: 69, train_loss: 0.3475, test_loss: 1.1454, test_f1: 0.6108
 epoch: 70, train_loss: 0.3433, test_loss: 1.1417, test_f1: 0.6241
 epoch: 71, train_loss: 0.3645, test_loss: 1.2832, test_f1: 0.5896
 epoch: 72, train_loss: 0.3342, test_loss: 1.1079, test_f1: 0.6499
 epoch: 73, train_loss: 0.3272, test_loss: 1.0664, test_f1: 0.6454
 epoch: 74, train_loss: 0.3308, test_loss: 1.1586, test_f1: 0.6262
 epoch: 75, train_loss: 0.3325, test_loss: 1.0904, test_f1: 0.6315
 epoch: 76, train_loss: 0.3185, test_loss: 1.1715, test_f1: 0.6277
 epoch: 77, train_loss: 0.3237, test_loss: 1.2621, test_f1: 0.5972
 epoch: 78, train_loss: 0.3193, test_loss: 1.2567, test_f1: 0.6185
 epoch: 79, train_loss: 0.3116, test_loss: 1.1766, test_f1: 0.6471
 epoch: 80, train_loss: 0.3103, test_loss: 1.2934, test_f1: 0.6132
 epoch: 81, train_loss: 0.3106, test_loss: 1.1442, test_f1: 0.6050
 epoch: 82, train_loss: 0.2912, test_loss: 1.2674, test_f1: 0.6155
 epoch: 83, train_loss: 0.2886, test_loss: 1.2259, test_f1: 0.6380
 epoch: 84, train_loss: 0.3013, test_loss: 1.3370, test_f1: 0.6159
 epoch: 85, train_loss: 0.2992, test_loss: 1.3070, test_f1: 0.6226
 epoch: 86, train_loss: 0.3245, test_loss: 1.3219, test_f1: 0.5960
 epoch: 87, train_loss: 0.3116, test_loss: 1.2913, test_f1: 0.6216
 epoch: 88, train_loss: 0.2844, test_loss: 1.2299, test_f1: 0.6258
 epoch: 89, train_loss: 0.2842, test_loss: 1.1741, test_f1: 0.6517
 epoch: 90, train_loss: 0.2848, test_loss: 1.2634, test_f1: 0.6430
 epoch: 91, train_loss: 0.2730, test_loss: 1.4695, test_f1: 0.5975
 epoch: 92, train_loss: 0.2737, test_loss: 1.2234, test_f1: 0.6322
 epoch: 93, train_loss: 0.2814, test_loss: 1.2304, test_f1: 0.6358
 epoch: 94, train_loss: 0.2596, test_loss: 1.3038, test_f1: 0.6415
 epoch: 95, train_loss: 0.2805, test_loss: 1.2380, test_f1: 0.6510
 epoch: 96, train_loss: 0.2693, test_loss: 1.4671, test_f1: 0.6106
 epoch: 97, train_loss: 0.2615, test_loss: 1.2868, test_f1: 0.6374
 epoch: 98, train_loss: 0.2608, test_loss: 1.2770, test_f1: 0.6298
 epoch: 99, train_loss: 0.2550, test_loss: 1.4119, test_f1: 0.6126
##################ITERATION #9 ****************************************
 epoch: 0, train_loss: 1.4877, test_loss: 1.3614, test_f1: 0.2415
 epoch: 1, train_loss: 1.1454, test_loss: 1.2129, test_f1: 0.2637
 epoch: 2, train_loss: 1.0972, test_loss: 1.1603, test_f1: 0.3350
 epoch: 3, train_loss: 1.0478, test_loss: 1.1090, test_f1: 0.3726
 epoch: 4, train_loss: 0.9949, test_loss: 1.1077, test_f1: 0.4085
 epoch: 5, train_loss: 0.9779, test_loss: 0.9789, test_f1: 0.5165
 epoch: 6, train_loss: 0.9376, test_loss: 0.9452, test_f1: 0.5470
 epoch: 7, train_loss: 0.9101, test_loss: 0.9461, test_f1: 0.5234
 epoch: 8, train_loss: 0.9094, test_loss: 0.9438, test_f1: 0.5377
 epoch: 9, train_loss: 0.8986, test_loss: 0.9253, test_f1: 0.5588
 epoch: 10, train_loss: 0.8684, test_loss: 0.9419, test_f1: 0.5651
 epoch: 11, train_loss: 0.8478, test_loss: 0.9568, test_f1: 0.5391
 epoch: 12, train_loss: 0.8462, test_loss: 0.9401, test_f1: 0.5543
 epoch: 13, train_loss: 0.8368, test_loss: 0.9356, test_f1: 0.5544
 epoch: 14, train_loss: 0.8211, test_loss: 0.9101, test_f1: 0.5851
 epoch: 15, train_loss: 0.8000, test_loss: 0.9453, test_f1: 0.5572
 epoch: 16, train_loss: 0.7934, test_loss: 0.9657, test_f1: 0.5623
 epoch: 17, train_loss: 0.7768, test_loss: 0.9707, test_f1: 0.5426
 epoch: 18, train_loss: 0.7753, test_loss: 0.9010, test_f1: 0.5954
 epoch: 19, train_loss: 0.7500, test_loss: 0.8739, test_f1: 0.6077
 epoch: 20, train_loss: 0.7524, test_loss: 0.8749, test_f1: 0.6083
 epoch: 21, train_loss: 0.7236, test_loss: 0.9369, test_f1: 0.5760
 epoch: 22, train_loss: 0.7245, test_loss: 0.9043, test_f1: 0.5927
 epoch: 23, train_loss: 0.7312, test_loss: 0.9992, test_f1: 0.5554
 epoch: 24, train_loss: 0.7145, test_loss: 0.9527, test_f1: 0.5740
 epoch: 25, train_loss: 0.7163, test_loss: 0.9657, test_f1: 0.5628
 epoch: 26, train_loss: 0.7033, test_loss: 0.8979, test_f1: 0.6109
 epoch: 27, train_loss: 0.6845, test_loss: 0.9092, test_f1: 0.6069
 epoch: 28, train_loss: 0.6674, test_loss: 0.8910, test_f1: 0.6063
 epoch: 29, train_loss: 0.6616, test_loss: 0.9213, test_f1: 0.5919
 epoch: 30, train_loss: 0.6729, test_loss: 0.9480, test_f1: 0.6004
 epoch: 31, train_loss: 0.6597, test_loss: 0.9467, test_f1: 0.5815
 epoch: 32, train_loss: 0.6404, test_loss: 0.9327, test_f1: 0.5910
 epoch: 33, train_loss: 0.6403, test_loss: 0.9252, test_f1: 0.6070
 epoch: 34, train_loss: 0.6142, test_loss: 0.9255, test_f1: 0.6123
 epoch: 35, train_loss: 0.6169, test_loss: 0.8982, test_f1: 0.6255
 epoch: 36, train_loss: 0.5892, test_loss: 0.9538, test_f1: 0.5908
 epoch: 37, train_loss: 0.5758, test_loss: 0.8438, test_f1: 0.6383
 epoch: 38, train_loss: 0.5774, test_loss: 0.9429, test_f1: 0.5876
 epoch: 39, train_loss: 0.5766, test_loss: 0.9766, test_f1: 0.5844
 epoch: 40, train_loss: 0.5624, test_loss: 0.9263, test_f1: 0.6227
 epoch: 41, train_loss: 0.5626, test_loss: 0.9787, test_f1: 0.6183
 epoch: 42, train_loss: 0.5586, test_loss: 1.0200, test_f1: 0.6041
 epoch: 43, train_loss: 0.5409, test_loss: 0.9385, test_f1: 0.6281
 epoch: 44, train_loss: 0.5538, test_loss: 0.9489, test_f1: 0.6268
 epoch: 45, train_loss: 0.5441, test_loss: 1.1174, test_f1: 0.5945
 epoch: 46, train_loss: 0.5195, test_loss: 1.0198, test_f1: 0.6174
 epoch: 47, train_loss: 0.5071, test_loss: 1.0426, test_f1: 0.5977
 epoch: 48, train_loss: 0.5041, test_loss: 1.0439, test_f1: 0.5953
 epoch: 49, train_loss: 0.5091, test_loss: 0.9197, test_f1: 0.6430
 epoch: 50, train_loss: 0.5154, test_loss: 1.0364, test_f1: 0.6254
 epoch: 51, train_loss: 0.4999, test_loss: 0.9434, test_f1: 0.6324
 epoch: 52, train_loss: 0.4478, test_loss: 0.9260, test_f1: 0.6430
 epoch: 53, train_loss: 0.4380, test_loss: 0.9927, test_f1: 0.6314
 epoch: 54, train_loss: 0.4241, test_loss: 0.9857, test_f1: 0.6385
 epoch: 55, train_loss: 0.4230, test_loss: 0.9910, test_f1: 0.6350
 epoch: 56, train_loss: 0.4114, test_loss: 0.9767, test_f1: 0.6464
 epoch: 57, train_loss: 0.4212, test_loss: 1.0360, test_f1: 0.6045
 epoch: 58, train_loss: 0.4005, test_loss: 1.0404, test_f1: 0.6144
 epoch: 59, train_loss: 0.3971, test_loss: 1.0318, test_f1: 0.6572
 epoch: 60, train_loss: 0.4011, test_loss: 1.0196, test_f1: 0.6159
 epoch: 61, train_loss: 0.3936, test_loss: 1.0387, test_f1: 0.6303
 epoch: 62, train_loss: 0.3962, test_loss: 1.0973, test_f1: 0.6442
 epoch: 63, train_loss: 0.3864, test_loss: 0.9841, test_f1: 0.6600
 epoch: 64, train_loss: 0.3771, test_loss: 1.0567, test_f1: 0.6497
 epoch: 65, train_loss: 0.3827, test_loss: 1.1035, test_f1: 0.6190
 epoch: 66, train_loss: 0.3824, test_loss: 1.0992, test_f1: 0.6535
 epoch: 67, train_loss: 0.3788, test_loss: 1.0186, test_f1: 0.6519
 epoch: 68, train_loss: 0.3727, test_loss: 1.0842, test_f1: 0.6497
 epoch: 69, train_loss: 0.3659, test_loss: 1.0584, test_f1: 0.6319
 epoch: 70, train_loss: 0.3532, test_loss: 1.1050, test_f1: 0.6369
 epoch: 71, train_loss: 0.3581, test_loss: 1.0973, test_f1: 0.6372
 epoch: 72, train_loss: 0.3809, test_loss: 1.1269, test_f1: 0.6370
 epoch: 73, train_loss: 0.3582, test_loss: 1.0766, test_f1: 0.6411
 epoch: 74, train_loss: 0.3355, test_loss: 1.1197, test_f1: 0.6500
 epoch: 75, train_loss: 0.3387, test_loss: 1.1597, test_f1: 0.6146
 epoch: 76, train_loss: 0.3443, test_loss: 1.1247, test_f1: 0.6381
 epoch: 77, train_loss: 0.3532, test_loss: 1.2311, test_f1: 0.6195
 epoch: 78, train_loss: 0.3494, test_loss: 1.1288, test_f1: 0.6456
 epoch: 79, train_loss: 0.3484, test_loss: 1.1454, test_f1: 0.6322
 epoch: 80, train_loss: 0.3333, test_loss: 1.1423, test_f1: 0.6480
 epoch: 81, train_loss: 0.3430, test_loss: 1.1237, test_f1: 0.6177
 epoch: 82, train_loss: 0.3326, test_loss: 1.2233, test_f1: 0.6034
 epoch: 83, train_loss: 0.3155, test_loss: 1.1949, test_f1: 0.6381
 epoch: 84, train_loss: 0.3236, test_loss: 1.2010, test_f1: 0.6240
 epoch: 85, train_loss: 0.2980, test_loss: 1.3316, test_f1: 0.6001
 epoch: 86, train_loss: 0.3093, test_loss: 1.1833, test_f1: 0.6339
 epoch: 87, train_loss: 0.3157, test_loss: 1.2251, test_f1: 0.6211
 epoch: 88, train_loss: 0.3151, test_loss: 1.1569, test_f1: 0.6353
 epoch: 89, train_loss: 0.3224, test_loss: 1.3120, test_f1: 0.6066
 epoch: 90, train_loss: 0.2960, test_loss: 1.3196, test_f1: 0.6222
 epoch: 91, train_loss: 0.3039, test_loss: 1.2273, test_f1: 0.6357
 epoch: 92, train_loss: 0.2804, test_loss: 1.3580, test_f1: 0.6131
 epoch: 93, train_loss: 0.3013, test_loss: 1.2396, test_f1: 0.6400
 epoch: 94, train_loss: 0.2854, test_loss: 1.2486, test_f1: 0.6423
 epoch: 95, train_loss: 0.2997, test_loss: 1.2780, test_f1: 0.6455
 epoch: 96, train_loss: 0.2771, test_loss: 1.3004, test_f1: 0.6389
 epoch: 97, train_loss: 0.2825, test_loss: 1.3462, test_f1: 0.6309
 epoch: 98, train_loss: 0.3066, test_loss: 1.2989, test_f1: 0.6315
 epoch: 99, train_loss: 0.2748, test_loss: 1.2168, test_f1: 0.6372

Training completed in 481.82 seconds
Best F1: 0.6821 at epoch 76
Mean F1 across iterations: 0.6667  0.0135
========================FINAL RESULTS================================
FEGIN weighted F1: 0.6821  0.0135
python main.py --data ltspice_examples --representation component_pin --model FEGIN --layers 6 --hiddens 64 --batch_size 256 --lr 0.001 --emb_size 128 --epochs 100 --save_appendix component_pin_L6_H64_BS256_LR0.001_E128 --no_val
-----



STDERR:
  File "main.py", line 370, in <module>
    main()
  File "main.py", line 254, in main
    dataset = dataset_class(
  File "/home/philip/projects/ltspice_examples_code_repo/Circuit-Completion-Using-GNNs/component_classification_with_link_prediction_head/evaluation/FEGIN/kernel/circuit_datasets.py", line 15, in __init__
    self.data, self.slices = torch.load(self.processed_paths[0])
  File "/home/philip/.local/lib/python3.8/site-packages/torch/serialization.py", line 1040, in load
    warnings.warn(
  File "/usr/lib/python3.8/warnings.py", line 109, in _showwarnmsg
    sw(msg.message, msg.category, msg.filename, msg.lineno,
  File "main.py", line 47, in warn_with_traceback
    traceback.print_stack(file=log)
/home/philip/projects/ltspice_examples_code_repo/Circuit-Completion-Using-GNNs/component_classification_with_link_prediction_head/evaluation/FEGIN/kernel/circuit_datasets.py:15: FutureWarning: You are using `torch.load` with `weights_only=False` (the current default value), which uses the default pickle module implicitly. It is possible to construct malicious pickle data which will execute arbitrary code during unpickling (See https://github.com/pytorch/pytorch/blob/main/SECURITY.md#untrusted-models for more details). In a future release, the default value for `weights_only` will be flipped to `True`. This limits the functions that could be executed during unpickling. Arbitrary objects will no longer be allowed to be loaded via this mode unless they are explicitly allowlisted by the user via `torch.serialization.add_safe_globals`. We recommend you start setting `weights_only=True` for any use case where you don't have full control of the loaded file. Please open an issue on GitHub for any issues related to this experimental feature.
  self.data, self.slices = torch.load(self.processed_paths[0])
