STDOUT:
Results will be saved in /home/philip/projects/ltspice_examples_code_repo/Circuit-Completion-Using-GNNs/component_classification_with_link_prediction_head/evaluation/FEGIN/results/model_FEGIN_dataset_ltspice_demos
Command line input: python main.py --data ltspice_demos --representation component_net --model FEGIN --layers 4 --hiddens 16 --batch_size 256 --lr 0.1 --emb_size 512 --epochs 100 --save_appendix component_net_L4_H16_BS256_LR0.1_E512 --no_val
 is saved.
-----
ltspice_demos - FEGIN
Using 4 layers, 16 hidden units, h = 2
Loading component_net representation dataset
ENTERED
Training FEGIN on component_net representation
Train: 1565, Test: 383
##################ITERATION #0 ****************************************
 epoch: 0, train_loss: 1.3422, test_loss: 1.9554, test_f1: 0.2281
 epoch: 1, train_loss: 1.2161, test_loss: 1.9270, test_f1: 0.2285
 epoch: 2, train_loss: 1.1864, test_loss: 1.3592, test_f1: 0.2325
 epoch: 3, train_loss: 1.1857, test_loss: 1.2551, test_f1: 0.2281
 epoch: 4, train_loss: 1.2109, test_loss: 1.2394, test_f1: 0.2881
 epoch: 5, train_loss: 1.1840, test_loss: 1.2336, test_f1: 0.2281
 epoch: 6, train_loss: 1.1637, test_loss: 1.2300, test_f1: 0.2281
 epoch: 7, train_loss: 1.1406, test_loss: 1.2579, test_f1: 0.3256
 epoch: 8, train_loss: 1.2114, test_loss: 1.4754, test_f1: 0.2426
 epoch: 9, train_loss: 1.1925, test_loss: 1.4082, test_f1: 0.2345
 epoch: 10, train_loss: 1.1495, test_loss: 1.2792, test_f1: 0.2433
 epoch: 11, train_loss: 1.1454, test_loss: 1.2160, test_f1: 0.2281
 epoch: 12, train_loss: 1.1610, test_loss: 1.2506, test_f1: 0.3034
 epoch: 13, train_loss: 1.1422, test_loss: 1.2927, test_f1: 0.2735
 epoch: 14, train_loss: 1.1639, test_loss: 1.3088, test_f1: 0.2861
 epoch: 15, train_loss: 1.1417, test_loss: 1.2466, test_f1: 0.3084
 epoch: 16, train_loss: 1.1259, test_loss: 1.2508, test_f1: 0.3115
 epoch: 17, train_loss: 1.1318, test_loss: 1.2149, test_f1: 0.3176
 epoch: 18, train_loss: 1.1148, test_loss: 1.2167, test_f1: 0.2311
 epoch: 19, train_loss: 1.0997, test_loss: 1.1802, test_f1: 0.3370
 epoch: 20, train_loss: 1.0832, test_loss: 1.1941, test_f1: 0.3275
 epoch: 21, train_loss: 1.0723, test_loss: 1.1947, test_f1: 0.2775
 epoch: 22, train_loss: 1.0732, test_loss: 1.1846, test_f1: 0.3262
 epoch: 23, train_loss: 1.0561, test_loss: 1.1760, test_f1: 0.3262
 epoch: 24, train_loss: 1.0650, test_loss: 1.2933, test_f1: 0.2913
 epoch: 25, train_loss: 1.0837, test_loss: 1.1897, test_f1: 0.3310
 epoch: 26, train_loss: 1.0507, test_loss: 1.2101, test_f1: 0.3200
 epoch: 27, train_loss: 1.0420, test_loss: 1.3829, test_f1: 0.2748
 epoch: 28, train_loss: 1.0453, test_loss: 1.2338, test_f1: 0.3003
 epoch: 29, train_loss: 1.0457, test_loss: 1.1996, test_f1: 0.3283
 epoch: 30, train_loss: 1.0486, test_loss: 1.1614, test_f1: 0.3317
 epoch: 31, train_loss: 1.0354, test_loss: 1.1946, test_f1: 0.3310
 epoch: 32, train_loss: 1.0872, test_loss: 1.1217, test_f1: 0.3437
 epoch: 33, train_loss: 1.0695, test_loss: 1.1389, test_f1: 0.3447
 epoch: 34, train_loss: 1.0850, test_loss: 1.1343, test_f1: 0.3317
 epoch: 35, train_loss: 1.0609, test_loss: 1.2197, test_f1: 0.2406
 epoch: 36, train_loss: 1.0423, test_loss: 1.1438, test_f1: 0.3317
 epoch: 37, train_loss: 1.0386, test_loss: 1.2449, test_f1: 0.2251
 epoch: 38, train_loss: 1.0479, test_loss: 1.1944, test_f1: 0.3262
 epoch: 39, train_loss: 1.0470, test_loss: 1.2232, test_f1: 0.3176
 epoch: 40, train_loss: 1.0504, test_loss: 1.1757, test_f1: 0.3290
 epoch: 41, train_loss: 1.0548, test_loss: 1.1467, test_f1: 0.3310
 epoch: 42, train_loss: 1.0417, test_loss: 1.1261, test_f1: 0.3454
 epoch: 43, train_loss: 1.0362, test_loss: 1.1389, test_f1: 0.3215
 epoch: 44, train_loss: 1.0391, test_loss: 1.1197, test_f1: 0.3420
 epoch: 45, train_loss: 1.0208, test_loss: 1.1409, test_f1: 0.3444
 epoch: 46, train_loss: 1.0168, test_loss: 1.1389, test_f1: 0.3445
 epoch: 47, train_loss: 1.0210, test_loss: 1.1127, test_f1: 0.3444
 epoch: 48, train_loss: 1.0259, test_loss: 1.1833, test_f1: 0.3317
 epoch: 49, train_loss: 1.0473, test_loss: 1.2203, test_f1: 0.3317
 epoch: 50, train_loss: 1.0495, test_loss: 1.1584, test_f1: 0.3317
 epoch: 51, train_loss: 1.0326, test_loss: 1.1975, test_f1: 0.3290
 epoch: 52, train_loss: 1.0326, test_loss: 1.1587, test_f1: 0.3290
 epoch: 53, train_loss: 1.0345, test_loss: 1.1603, test_f1: 0.3268
 epoch: 54, train_loss: 1.0269, test_loss: 1.1933, test_f1: 0.2392
 epoch: 55, train_loss: 1.0201, test_loss: 1.1852, test_f1: 0.3290
 epoch: 56, train_loss: 1.0246, test_loss: 1.1829, test_f1: 0.3317
 epoch: 57, train_loss: 1.0170, test_loss: 1.1674, test_f1: 0.3362
 epoch: 58, train_loss: 1.0194, test_loss: 1.1860, test_f1: 0.3290
 epoch: 59, train_loss: 1.0264, test_loss: 1.1703, test_f1: 0.3317
 epoch: 60, train_loss: 1.0274, test_loss: 1.1693, test_f1: 0.2719
 epoch: 61, train_loss: 1.0210, test_loss: 1.1548, test_f1: 0.3431
 epoch: 62, train_loss: 1.0131, test_loss: 1.1368, test_f1: 0.3395
 epoch: 63, train_loss: 1.0160, test_loss: 1.1475, test_f1: 0.3370
 epoch: 64, train_loss: 1.0036, test_loss: 1.1605, test_f1: 0.3263
 epoch: 65, train_loss: 1.0124, test_loss: 1.1205, test_f1: 0.3395
 epoch: 66, train_loss: 0.9903, test_loss: 1.1034, test_f1: 0.3986
 epoch: 67, train_loss: 1.0016, test_loss: 1.1283, test_f1: 0.3968
 epoch: 68, train_loss: 0.9970, test_loss: 1.1219, test_f1: 0.4033
 epoch: 69, train_loss: 0.9902, test_loss: 1.1209, test_f1: 0.3395
 epoch: 70, train_loss: 1.0057, test_loss: 1.1201, test_f1: 0.4142
 epoch: 71, train_loss: 1.0141, test_loss: 1.1431, test_f1: 0.3398
 epoch: 72, train_loss: 1.0075, test_loss: 1.1317, test_f1: 0.3395
 epoch: 73, train_loss: 1.0007, test_loss: 1.1552, test_f1: 0.3370
 epoch: 74, train_loss: 1.0018, test_loss: 1.1092, test_f1: 0.3415
 epoch: 75, train_loss: 0.9958, test_loss: 1.1219, test_f1: 0.3422
 epoch: 76, train_loss: 1.0015, test_loss: 1.1141, test_f1: 0.3070
 epoch: 77, train_loss: 0.9795, test_loss: 1.1708, test_f1: 0.3205
 epoch: 78, train_loss: 0.9840, test_loss: 1.1331, test_f1: 0.3444
 epoch: 79, train_loss: 0.9850, test_loss: 1.1774, test_f1: 0.3327
 epoch: 80, train_loss: 0.9835, test_loss: 1.1044, test_f1: 0.3411
 epoch: 81, train_loss: 0.9822, test_loss: 1.4043, test_f1: 0.2983
 epoch: 82, train_loss: 0.9917, test_loss: 1.0829, test_f1: 0.3895
 epoch: 83, train_loss: 0.9829, test_loss: 1.1944, test_f1: 0.3331
 epoch: 84, train_loss: 0.9947, test_loss: 1.1450, test_f1: 0.3461
 epoch: 85, train_loss: 0.9957, test_loss: 1.1027, test_f1: 0.3569
 epoch: 86, train_loss: 1.0132, test_loss: 1.1958, test_f1: 0.3293
 epoch: 87, train_loss: 0.9847, test_loss: 1.0885, test_f1: 0.3788
 epoch: 88, train_loss: 0.9940, test_loss: 1.1987, test_f1: 0.3331
 epoch: 89, train_loss: 0.9945, test_loss: 1.1925, test_f1: 0.3511
 epoch: 90, train_loss: 0.9802, test_loss: 1.2113, test_f1: 0.3371
 epoch: 91, train_loss: 0.9837, test_loss: 1.1787, test_f1: 0.3386
 epoch: 92, train_loss: 0.9905, test_loss: 1.1217, test_f1: 0.3814
 epoch: 93, train_loss: 0.9840, test_loss: 1.0988, test_f1: 0.3971
 epoch: 94, train_loss: 0.9823, test_loss: 1.0942, test_f1: 0.3822
 epoch: 95, train_loss: 0.9992, test_loss: 1.1318, test_f1: 0.3937
 epoch: 96, train_loss: 0.9916, test_loss: 1.1488, test_f1: 0.3593
 epoch: 97, train_loss: 1.0197, test_loss: 1.1418, test_f1: 0.3625
 epoch: 98, train_loss: 1.0088, test_loss: 1.2304, test_f1: 0.3272
 epoch: 99, train_loss: 0.9947, test_loss: 1.1719, test_f1: 0.2408
##################ITERATION #1 ****************************************
 epoch: 0, train_loss: 1.6378, test_loss: 3.5480, test_f1: 0.1368
 epoch: 1, train_loss: 1.2998, test_loss: 1.6751, test_f1: 0.3488
 epoch: 2, train_loss: 1.2201, test_loss: 2.9414, test_f1: 0.3379
 epoch: 3, train_loss: 1.2290, test_loss: 1.8278, test_f1: 0.2281
 epoch: 4, train_loss: 1.2149, test_loss: 1.3951, test_f1: 0.2793
 epoch: 5, train_loss: 1.1744, test_loss: 1.2493, test_f1: 0.2724
 epoch: 6, train_loss: 1.1774, test_loss: 1.4141, test_f1: 0.3314
 epoch: 7, train_loss: 1.1453, test_loss: 1.3830, test_f1: 0.2281
 epoch: 8, train_loss: 1.1212, test_loss: 1.4543, test_f1: 0.4108
 epoch: 9, train_loss: 1.1272, test_loss: 1.1727, test_f1: 0.3304
 epoch: 10, train_loss: 1.1328, test_loss: 1.2191, test_f1: 0.2586
 epoch: 11, train_loss: 1.1282, test_loss: 1.2335, test_f1: 0.4098
 epoch: 12, train_loss: 1.0827, test_loss: 1.3160, test_f1: 0.3643
 epoch: 13, train_loss: 1.0593, test_loss: 1.3521, test_f1: 0.3146
 epoch: 14, train_loss: 1.0646, test_loss: 1.2346, test_f1: 0.4135
 epoch: 15, train_loss: 1.0542, test_loss: 1.2033, test_f1: 0.3232
 epoch: 16, train_loss: 1.0485, test_loss: 1.2124, test_f1: 0.3697
 epoch: 17, train_loss: 1.0237, test_loss: 1.3822, test_f1: 0.4289
 epoch: 18, train_loss: 1.0441, test_loss: 1.2669, test_f1: 0.3670
 epoch: 19, train_loss: 1.0270, test_loss: 1.1426, test_f1: 0.4415
 epoch: 20, train_loss: 1.0233, test_loss: 1.1653, test_f1: 0.4536
 epoch: 21, train_loss: 1.0289, test_loss: 1.1024, test_f1: 0.4213
 epoch: 22, train_loss: 1.0126, test_loss: 1.0796, test_f1: 0.3451
 epoch: 23, train_loss: 1.0479, test_loss: 1.1404, test_f1: 0.3645
 epoch: 24, train_loss: 1.0389, test_loss: 1.1292, test_f1: 0.3392
 epoch: 25, train_loss: 1.0126, test_loss: 1.1691, test_f1: 0.4445
 epoch: 26, train_loss: 1.0471, test_loss: 1.0835, test_f1: 0.4343
 epoch: 27, train_loss: 1.0422, test_loss: 1.1070, test_f1: 0.3502
 epoch: 28, train_loss: 1.0294, test_loss: 1.1327, test_f1: 0.3699
 epoch: 29, train_loss: 1.0235, test_loss: 1.3130, test_f1: 0.4469
 epoch: 30, train_loss: 0.9914, test_loss: 1.3292, test_f1: 0.4463
 epoch: 31, train_loss: 1.0165, test_loss: 1.1898, test_f1: 0.4201
 epoch: 32, train_loss: 1.0420, test_loss: 1.1128, test_f1: 0.3317
 epoch: 33, train_loss: 1.0451, test_loss: 1.2194, test_f1: 0.4373
 epoch: 34, train_loss: 1.0381, test_loss: 1.2374, test_f1: 0.4351
 epoch: 35, train_loss: 1.0134, test_loss: 1.4176, test_f1: 0.3872
 epoch: 36, train_loss: 1.0192, test_loss: 1.1347, test_f1: 0.4384
 epoch: 37, train_loss: 0.9920, test_loss: 1.1645, test_f1: 0.3689
 epoch: 38, train_loss: 1.0087, test_loss: 1.1240, test_f1: 0.3761
 epoch: 39, train_loss: 0.9877, test_loss: 1.1476, test_f1: 0.3589
 epoch: 40, train_loss: 0.9606, test_loss: 1.1626, test_f1: 0.4284
 epoch: 41, train_loss: 0.9819, test_loss: 1.1490, test_f1: 0.4246
 epoch: 42, train_loss: 1.1292, test_loss: 1.3193, test_f1: 0.3156
 epoch: 43, train_loss: 1.0953, test_loss: 1.3217, test_f1: 0.3554
 epoch: 44, train_loss: 1.0417, test_loss: 1.2100, test_f1: 0.4199
 epoch: 45, train_loss: 1.0553, test_loss: 1.1659, test_f1: 0.4236
 epoch: 46, train_loss: 1.0553, test_loss: 1.1815, test_f1: 0.4208
 epoch: 47, train_loss: 1.0328, test_loss: 1.1498, test_f1: 0.4256
 epoch: 48, train_loss: 1.0183, test_loss: 1.2589, test_f1: 0.4460
 epoch: 49, train_loss: 1.0271, test_loss: 1.1681, test_f1: 0.3328
 epoch: 50, train_loss: 1.0268, test_loss: 1.1699, test_f1: 0.4326
 epoch: 51, train_loss: 1.0224, test_loss: 1.1538, test_f1: 0.3714
 epoch: 52, train_loss: 1.0073, test_loss: 1.1877, test_f1: 0.4517
 epoch: 53, train_loss: 1.0091, test_loss: 1.1398, test_f1: 0.4349
 epoch: 54, train_loss: 1.0023, test_loss: 1.0973, test_f1: 0.4621
 epoch: 55, train_loss: 0.9910, test_loss: 1.0912, test_f1: 0.3395
 epoch: 56, train_loss: 0.9934, test_loss: 1.1024, test_f1: 0.4551
 epoch: 57, train_loss: 0.9896, test_loss: 1.0772, test_f1: 0.3957
 epoch: 58, train_loss: 0.9598, test_loss: 1.0729, test_f1: 0.4329
 epoch: 59, train_loss: 0.9697, test_loss: 1.1103, test_f1: 0.4557
 epoch: 60, train_loss: 0.9678, test_loss: 1.0983, test_f1: 0.4347
 epoch: 61, train_loss: 0.9629, test_loss: 1.0364, test_f1: 0.4367
 epoch: 62, train_loss: 0.9568, test_loss: 1.0567, test_f1: 0.4612
 epoch: 63, train_loss: 0.9674, test_loss: 1.0999, test_f1: 0.3428
 epoch: 64, train_loss: 0.9464, test_loss: 1.0373, test_f1: 0.4391
 epoch: 65, train_loss: 0.9557, test_loss: 1.0145, test_f1: 0.3496
 epoch: 66, train_loss: 0.9699, test_loss: 1.0341, test_f1: 0.4996
 epoch: 67, train_loss: 0.9540, test_loss: 1.0693, test_f1: 0.4480
 epoch: 68, train_loss: 0.9652, test_loss: 1.0744, test_f1: 0.4426
 epoch: 69, train_loss: 0.9661, test_loss: 1.0918, test_f1: 0.3344
 epoch: 70, train_loss: 0.9546, test_loss: 1.0496, test_f1: 0.4842
 epoch: 71, train_loss: 0.9507, test_loss: 1.0379, test_f1: 0.3444
 epoch: 72, train_loss: 0.9662, test_loss: 1.0364, test_f1: 0.4098
 epoch: 73, train_loss: 0.9688, test_loss: 1.0776, test_f1: 0.4542
 epoch: 74, train_loss: 0.9707, test_loss: 1.0593, test_f1: 0.3706
 epoch: 75, train_loss: 0.9688, test_loss: 1.0181, test_f1: 0.3454
 epoch: 76, train_loss: 0.9591, test_loss: 1.0308, test_f1: 0.4037
 epoch: 77, train_loss: 0.9624, test_loss: 1.0296, test_f1: 0.4796
 epoch: 78, train_loss: 0.9504, test_loss: 1.0462, test_f1: 0.3492
 epoch: 79, train_loss: 0.9633, test_loss: 1.0355, test_f1: 0.4426
 epoch: 80, train_loss: 0.9498, test_loss: 1.0041, test_f1: 0.3824
 epoch: 81, train_loss: 0.9470, test_loss: 1.0481, test_f1: 0.4395
 epoch: 82, train_loss: 0.9444, test_loss: 1.0932, test_f1: 0.3823
 epoch: 83, train_loss: 0.9546, test_loss: 1.1079, test_f1: 0.3684
 epoch: 84, train_loss: 0.9555, test_loss: 1.0730, test_f1: 0.4134
 epoch: 85, train_loss: 0.9357, test_loss: 1.0167, test_f1: 0.4754
 epoch: 86, train_loss: 0.9391, test_loss: 1.0356, test_f1: 0.5149
 epoch: 87, train_loss: 0.9326, test_loss: 1.0331, test_f1: 0.3808
 epoch: 88, train_loss: 0.9523, test_loss: 1.0895, test_f1: 0.3395
 epoch: 89, train_loss: 0.9652, test_loss: 1.1181, test_f1: 0.3872
 epoch: 90, train_loss: 0.9584, test_loss: 1.0545, test_f1: 0.3451
 epoch: 91, train_loss: 0.9544, test_loss: 1.0554, test_f1: 0.4382
 epoch: 92, train_loss: 0.9692, test_loss: 0.9949, test_f1: 0.5204
 epoch: 93, train_loss: 0.9529, test_loss: 0.9993, test_f1: 0.4625
 epoch: 94, train_loss: 0.9430, test_loss: 1.0348, test_f1: 0.5317
 epoch: 95, train_loss: 0.9322, test_loss: 1.0756, test_f1: 0.4550
 epoch: 96, train_loss: 0.9407, test_loss: 1.0961, test_f1: 0.5330
 epoch: 97, train_loss: 0.9444, test_loss: 1.0019, test_f1: 0.4748
 epoch: 98, train_loss: 0.9543, test_loss: 1.0235, test_f1: 0.3464
 epoch: 99, train_loss: 0.9742, test_loss: 1.1185, test_f1: 0.3775
##################ITERATION #2 ****************************************
 epoch: 0, train_loss: 1.3178, test_loss: 10.4406, test_f1: 0.2281
 epoch: 1, train_loss: 1.2212, test_loss: 2.6920, test_f1: 0.1368
 epoch: 2, train_loss: 1.1760, test_loss: 1.7440, test_f1: 0.3357
 epoch: 3, train_loss: 1.1523, test_loss: 1.5942, test_f1: 0.3086
 epoch: 4, train_loss: 1.1379, test_loss: 1.4207, test_f1: 0.2911
 epoch: 5, train_loss: 1.0966, test_loss: 1.3737, test_f1: 0.4162
 epoch: 6, train_loss: 1.0688, test_loss: 1.2410, test_f1: 0.4126
 epoch: 7, train_loss: 1.0512, test_loss: 1.2632, test_f1: 0.4092
 epoch: 8, train_loss: 1.0566, test_loss: 1.3253, test_f1: 0.3968
 epoch: 9, train_loss: 1.0573, test_loss: 1.2751, test_f1: 0.3205
 epoch: 10, train_loss: 1.0648, test_loss: 1.1895, test_f1: 0.4306
 epoch: 11, train_loss: 1.0568, test_loss: 1.2031, test_f1: 0.3480
 epoch: 12, train_loss: 1.0418, test_loss: 1.2016, test_f1: 0.3567
 epoch: 13, train_loss: 1.0393, test_loss: 1.2770, test_f1: 0.3337
 epoch: 14, train_loss: 1.0488, test_loss: 1.2188, test_f1: 0.3018
 epoch: 15, train_loss: 1.0624, test_loss: 1.2091, test_f1: 0.3549
 epoch: 16, train_loss: 1.0632, test_loss: 1.2533, test_f1: 0.3494
 epoch: 17, train_loss: 1.0838, test_loss: 1.2066, test_f1: 0.3031
 epoch: 18, train_loss: 1.0593, test_loss: 1.2481, test_f1: 0.3905
 epoch: 19, train_loss: 1.0997, test_loss: 1.8236, test_f1: 0.3979
 epoch: 20, train_loss: 1.0666, test_loss: 1.2739, test_f1: 0.4176
 epoch: 21, train_loss: 1.0634, test_loss: 1.1192, test_f1: 0.3395
 epoch: 22, train_loss: 1.0412, test_loss: 1.2520, test_f1: 0.3826
 epoch: 23, train_loss: 1.0109, test_loss: 1.2937, test_f1: 0.4154
 epoch: 24, train_loss: 0.9976, test_loss: 1.2786, test_f1: 0.3539
 epoch: 25, train_loss: 1.0089, test_loss: 1.3987, test_f1: 0.4055
 epoch: 26, train_loss: 1.0243, test_loss: 1.1459, test_f1: 0.3301
 epoch: 27, train_loss: 1.0247, test_loss: 1.1991, test_f1: 0.3732
 epoch: 28, train_loss: 1.0080, test_loss: 1.0852, test_f1: 0.3866
 epoch: 29, train_loss: 1.0164, test_loss: 1.3100, test_f1: 0.4246
 epoch: 30, train_loss: 1.0391, test_loss: 1.2011, test_f1: 0.2481
 epoch: 31, train_loss: 1.0598, test_loss: 1.1409, test_f1: 0.3395
 epoch: 32, train_loss: 1.0388, test_loss: 1.1783, test_f1: 0.4260
 epoch: 33, train_loss: 1.0476, test_loss: 1.1486, test_f1: 0.4299
 epoch: 34, train_loss: 1.0130, test_loss: 1.2426, test_f1: 0.4317
 epoch: 35, train_loss: 1.0058, test_loss: 1.2194, test_f1: 0.4163
 epoch: 36, train_loss: 1.0055, test_loss: 1.1793, test_f1: 0.4198
 epoch: 37, train_loss: 1.0003, test_loss: 1.2808, test_f1: 0.3385
 epoch: 38, train_loss: 1.0121, test_loss: 1.1426, test_f1: 0.3262
 epoch: 39, train_loss: 1.0227, test_loss: 1.3983, test_f1: 0.3507
 epoch: 40, train_loss: 1.0410, test_loss: 1.2481, test_f1: 0.4045
 epoch: 41, train_loss: 1.0416, test_loss: 1.1006, test_f1: 0.3398
 epoch: 42, train_loss: 1.0240, test_loss: 1.3818, test_f1: 0.2929
 epoch: 43, train_loss: 1.0221, test_loss: 1.2333, test_f1: 0.3505
 epoch: 44, train_loss: 1.0031, test_loss: 1.1022, test_f1: 0.4518
 epoch: 45, train_loss: 1.0026, test_loss: 1.0859, test_f1: 0.3420
 epoch: 46, train_loss: 1.0015, test_loss: 1.2320, test_f1: 0.4529
 epoch: 47, train_loss: 1.0080, test_loss: 1.3198, test_f1: 0.4142
 epoch: 48, train_loss: 1.0199, test_loss: 1.1410, test_f1: 0.3290
 epoch: 49, train_loss: 1.0033, test_loss: 1.3474, test_f1: 0.3414
 epoch: 50, train_loss: 1.0079, test_loss: 1.1825, test_f1: 0.3290
 epoch: 51, train_loss: 0.9895, test_loss: 1.2407, test_f1: 0.4540
 epoch: 52, train_loss: 0.9815, test_loss: 1.1443, test_f1: 0.4631
 epoch: 53, train_loss: 0.9724, test_loss: 1.1577, test_f1: 0.4597
 epoch: 54, train_loss: 0.9745, test_loss: 1.1047, test_f1: 0.4491
 epoch: 55, train_loss: 0.9735, test_loss: 1.0920, test_f1: 0.4558
 epoch: 56, train_loss: 0.9680, test_loss: 1.0768, test_f1: 0.4581
 epoch: 57, train_loss: 0.9683, test_loss: 1.0633, test_f1: 0.3696
 epoch: 58, train_loss: 0.9745, test_loss: 1.0637, test_f1: 0.5016
 epoch: 59, train_loss: 0.9573, test_loss: 1.0877, test_f1: 0.5010
 epoch: 60, train_loss: 0.9459, test_loss: 1.0245, test_f1: 0.4117
 epoch: 61, train_loss: 0.9545, test_loss: 1.1215, test_f1: 0.4934
 epoch: 62, train_loss: 0.9361, test_loss: 1.0831, test_f1: 0.4926
 epoch: 63, train_loss: 0.9553, test_loss: 1.1701, test_f1: 0.4474
 epoch: 64, train_loss: 0.9686, test_loss: 1.3047, test_f1: 0.3803
 epoch: 65, train_loss: 0.9397, test_loss: 1.1736, test_f1: 0.4953
 epoch: 66, train_loss: 0.9385, test_loss: 1.1518, test_f1: 0.4724
 epoch: 67, train_loss: 0.9587, test_loss: 1.1370, test_f1: 0.3851
 epoch: 68, train_loss: 0.9354, test_loss: 1.0839, test_f1: 0.4801
 epoch: 69, train_loss: 0.9892, test_loss: 1.3033, test_f1: 0.3957
 epoch: 70, train_loss: 0.9684, test_loss: 1.1926, test_f1: 0.4139
 epoch: 71, train_loss: 0.9548, test_loss: 1.1922, test_f1: 0.3978
 epoch: 72, train_loss: 0.9377, test_loss: 1.2376, test_f1: 0.3400
 epoch: 73, train_loss: 0.9456, test_loss: 1.1885, test_f1: 0.4401
 epoch: 74, train_loss: 0.9397, test_loss: 1.1249, test_f1: 0.3921
 epoch: 75, train_loss: 0.9577, test_loss: 1.2507, test_f1: 0.4944
 epoch: 76, train_loss: 0.9546, test_loss: 1.0368, test_f1: 0.4059
 epoch: 77, train_loss: 0.9438, test_loss: 1.0543, test_f1: 0.5085
 epoch: 78, train_loss: 0.9272, test_loss: 1.0678, test_f1: 0.5034
 epoch: 79, train_loss: 0.9351, test_loss: 1.0704, test_f1: 0.5115
 epoch: 80, train_loss: 0.9389, test_loss: 2.1246, test_f1: 0.3760
 epoch: 81, train_loss: 0.9452, test_loss: 1.2705, test_f1: 0.5001
 epoch: 82, train_loss: 0.9888, test_loss: 1.0931, test_f1: 0.4354
 epoch: 83, train_loss: 0.9868, test_loss: 1.0700, test_f1: 0.4308
 epoch: 84, train_loss: 0.9567, test_loss: 1.1623, test_f1: 0.4126
 epoch: 85, train_loss: 0.9445, test_loss: 1.0793, test_f1: 0.5553
 epoch: 86, train_loss: 0.9472, test_loss: 1.1626, test_f1: 0.3958
 epoch: 87, train_loss: 0.9425, test_loss: 1.2880, test_f1: 0.3943
 epoch: 88, train_loss: 0.9411, test_loss: 1.1887, test_f1: 0.5401
 epoch: 89, train_loss: 0.9612, test_loss: 1.0964, test_f1: 0.3709
 epoch: 90, train_loss: 0.9606, test_loss: 1.0957, test_f1: 0.5008
 epoch: 91, train_loss: 0.9583, test_loss: 1.0612, test_f1: 0.4937
 epoch: 92, train_loss: 0.9441, test_loss: 1.0381, test_f1: 0.4993
 epoch: 93, train_loss: 0.9512, test_loss: 1.0470, test_f1: 0.5393
 epoch: 94, train_loss: 0.9501, test_loss: 1.0967, test_f1: 0.3809
 epoch: 95, train_loss: 0.9403, test_loss: 1.0868, test_f1: 0.5555
 epoch: 96, train_loss: 0.9379, test_loss: 1.1924, test_f1: 0.3560
 epoch: 97, train_loss: 0.9571, test_loss: 1.1438, test_f1: 0.4824
 epoch: 98, train_loss: 0.9560, test_loss: 1.1587, test_f1: 0.4331
 epoch: 99, train_loss: 0.9431, test_loss: 1.1138, test_f1: 0.4635
##################ITERATION #3 ****************************************
 epoch: 0, train_loss: 1.4268, test_loss: 3.5112, test_f1: 0.1365
 epoch: 1, train_loss: 1.2074, test_loss: 1.4864, test_f1: 0.2692
 epoch: 2, train_loss: 1.1837, test_loss: 1.7405, test_f1: 0.2571
 epoch: 3, train_loss: 1.1354, test_loss: 1.4271, test_f1: 0.2935
 epoch: 4, train_loss: 1.1223, test_loss: 1.2117, test_f1: 0.3486
 epoch: 5, train_loss: 1.0966, test_loss: 1.1688, test_f1: 0.3313
 epoch: 6, train_loss: 1.0864, test_loss: 1.2048, test_f1: 0.4007
 epoch: 7, train_loss: 1.0505, test_loss: 1.4063, test_f1: 0.3044
 epoch: 8, train_loss: 1.0547, test_loss: 1.1730, test_f1: 0.4202
 epoch: 9, train_loss: 1.0379, test_loss: 1.1470, test_f1: 0.3197
 epoch: 10, train_loss: 1.0396, test_loss: 1.1096, test_f1: 0.4251
 epoch: 11, train_loss: 1.0246, test_loss: 1.1383, test_f1: 0.4274
 epoch: 12, train_loss: 1.0317, test_loss: 1.0954, test_f1: 0.3370
 epoch: 13, train_loss: 1.0267, test_loss: 1.1105, test_f1: 0.4200
 epoch: 14, train_loss: 1.0260, test_loss: 1.1514, test_f1: 0.3290
 epoch: 15, train_loss: 1.0814, test_loss: 1.3219, test_f1: 0.2368
 epoch: 16, train_loss: 1.0725, test_loss: 1.1390, test_f1: 0.3257
 epoch: 17, train_loss: 1.0435, test_loss: 1.1396, test_f1: 0.2547
 epoch: 18, train_loss: 1.0399, test_loss: 1.1124, test_f1: 0.3370
 epoch: 19, train_loss: 1.0300, test_loss: 1.0958, test_f1: 0.4125
 epoch: 20, train_loss: 1.0274, test_loss: 1.1184, test_f1: 0.4324
 epoch: 21, train_loss: 1.0547, test_loss: 1.1545, test_f1: 0.3336
 epoch: 22, train_loss: 1.0763, test_loss: 1.1493, test_f1: 0.3030
 epoch: 23, train_loss: 1.0607, test_loss: 1.1610, test_f1: 0.3336
 epoch: 24, train_loss: 1.0233, test_loss: 1.1431, test_f1: 0.4299
 epoch: 25, train_loss: 1.0013, test_loss: 1.2341, test_f1: 0.4281
 epoch: 26, train_loss: 1.0007, test_loss: 1.1294, test_f1: 0.4337
 epoch: 27, train_loss: 1.0310, test_loss: 1.0962, test_f1: 0.3336
 epoch: 28, train_loss: 1.0412, test_loss: 1.1721, test_f1: 0.3422
 epoch: 29, train_loss: 1.0136, test_loss: 1.1689, test_f1: 0.3453
 epoch: 30, train_loss: 1.0426, test_loss: 1.1819, test_f1: 0.4392
 epoch: 31, train_loss: 1.0297, test_loss: 1.1705, test_f1: 0.4064
 epoch: 32, train_loss: 1.0216, test_loss: 1.2270, test_f1: 0.3443
 epoch: 33, train_loss: 1.0499, test_loss: 1.1305, test_f1: 0.3523
 epoch: 34, train_loss: 1.0238, test_loss: 1.1264, test_f1: 0.3901
 epoch: 35, train_loss: 1.0020, test_loss: 1.1317, test_f1: 0.4726
 epoch: 36, train_loss: 1.0163, test_loss: 1.0962, test_f1: 0.4114
 epoch: 37, train_loss: 0.9918, test_loss: 1.1354, test_f1: 0.4438
 epoch: 38, train_loss: 1.0037, test_loss: 1.1485, test_f1: 0.4564
 epoch: 39, train_loss: 0.9729, test_loss: 1.2567, test_f1: 0.4447
 epoch: 40, train_loss: 0.9764, test_loss: 1.2120, test_f1: 0.3314
 epoch: 41, train_loss: 1.0229, test_loss: 1.5000, test_f1: 0.2695
 epoch: 42, train_loss: 0.9897, test_loss: 1.4539, test_f1: 0.4410
 epoch: 43, train_loss: 0.9830, test_loss: 1.2178, test_f1: 0.3776
 epoch: 44, train_loss: 0.9786, test_loss: 1.0815, test_f1: 0.3960
 epoch: 45, train_loss: 0.9641, test_loss: 1.1327, test_f1: 0.5143
 epoch: 46, train_loss: 0.9782, test_loss: 1.0642, test_f1: 0.3444
 epoch: 47, train_loss: 1.0703, test_loss: 1.4661, test_f1: 0.3674
 epoch: 48, train_loss: 1.0488, test_loss: 1.4851, test_f1: 0.3857
 epoch: 49, train_loss: 1.0428, test_loss: 1.2407, test_f1: 0.3205
 epoch: 50, train_loss: 1.0009, test_loss: 1.2539, test_f1: 0.3263
 epoch: 51, train_loss: 0.9828, test_loss: 1.2745, test_f1: 0.3370
 epoch: 52, train_loss: 0.9581, test_loss: 1.1784, test_f1: 0.4390
 epoch: 53, train_loss: 0.9713, test_loss: 1.1249, test_f1: 0.3648
 epoch: 54, train_loss: 0.9750, test_loss: 1.1903, test_f1: 0.4676
 epoch: 55, train_loss: 0.9608, test_loss: 1.1676, test_f1: 0.4562
 epoch: 56, train_loss: 0.9497, test_loss: 1.6460, test_f1: 0.3902
 epoch: 57, train_loss: 0.9558, test_loss: 1.5481, test_f1: 0.4532
 epoch: 58, train_loss: 0.9303, test_loss: 1.2853, test_f1: 0.4411
 epoch: 59, train_loss: 0.9408, test_loss: 1.1686, test_f1: 0.5067
 epoch: 60, train_loss: 0.9385, test_loss: 1.2015, test_f1: 0.4893
 epoch: 61, train_loss: 0.9445, test_loss: 1.1172, test_f1: 0.5230
 epoch: 62, train_loss: 0.9699, test_loss: 1.1383, test_f1: 0.3283
 epoch: 63, train_loss: 0.9999, test_loss: 1.1092, test_f1: 0.3283
 epoch: 64, train_loss: 0.9933, test_loss: 1.1534, test_f1: 0.4425
 epoch: 65, train_loss: 0.9824, test_loss: 1.1750, test_f1: 0.3290
 epoch: 66, train_loss: 0.9559, test_loss: 1.2402, test_f1: 0.4611
 epoch: 67, train_loss: 0.9607, test_loss: 1.2042, test_f1: 0.5593
 epoch: 68, train_loss: 0.9379, test_loss: 1.1388, test_f1: 0.4952
 epoch: 69, train_loss: 0.9539, test_loss: 1.0686, test_f1: 0.4827
 epoch: 70, train_loss: 0.9443, test_loss: 1.0875, test_f1: 0.4748
 epoch: 71, train_loss: 0.9365, test_loss: 1.2165, test_f1: 0.4533
 epoch: 72, train_loss: 0.9258, test_loss: 1.2084, test_f1: 0.4780
 epoch: 73, train_loss: 0.9243, test_loss: 1.1704, test_f1: 0.4677
 epoch: 74, train_loss: 0.9427, test_loss: 1.2279, test_f1: 0.5041
 epoch: 75, train_loss: 0.9506, test_loss: 1.1479, test_f1: 0.4420
 epoch: 76, train_loss: 0.9247, test_loss: 1.2303, test_f1: 0.4351
 epoch: 77, train_loss: 0.9322, test_loss: 1.1718, test_f1: 0.3395
 epoch: 78, train_loss: 0.9237, test_loss: 1.2409, test_f1: 0.4756
 epoch: 79, train_loss: 0.9343, test_loss: 1.3168, test_f1: 0.5435
 epoch: 80, train_loss: 0.9178, test_loss: 1.3220, test_f1: 0.5167
 epoch: 81, train_loss: 0.9083, test_loss: 1.1977, test_f1: 0.5258
 epoch: 82, train_loss: 0.9179, test_loss: 1.2138, test_f1: 0.4225
 epoch: 83, train_loss: 0.9126, test_loss: 1.1925, test_f1: 0.4770
 epoch: 84, train_loss: 0.9123, test_loss: 1.2170, test_f1: 0.5353
 epoch: 85, train_loss: 0.9177, test_loss: 1.2663, test_f1: 0.4824
 epoch: 86, train_loss: 0.9101, test_loss: 1.2154, test_f1: 0.4519
 epoch: 87, train_loss: 0.9101, test_loss: 1.1564, test_f1: 0.4755
 epoch: 88, train_loss: 0.9139, test_loss: 1.2894, test_f1: 0.4832
 epoch: 89, train_loss: 0.9191, test_loss: 1.1219, test_f1: 0.5077
 epoch: 90, train_loss: 0.9261, test_loss: 1.1322, test_f1: 0.4621
 epoch: 91, train_loss: 0.9229, test_loss: 1.1758, test_f1: 0.3667
 epoch: 92, train_loss: 0.9147, test_loss: 1.1809, test_f1: 0.4094
 epoch: 93, train_loss: 0.9212, test_loss: 1.2733, test_f1: 0.4319
 epoch: 94, train_loss: 0.9236, test_loss: 1.2820, test_f1: 0.3395
 epoch: 95, train_loss: 0.9123, test_loss: 1.3399, test_f1: 0.3219
 epoch: 96, train_loss: 0.9051, test_loss: 1.2035, test_f1: 0.3405
 epoch: 97, train_loss: 0.9127, test_loss: 1.1291, test_f1: 0.4268
 epoch: 98, train_loss: 0.9260, test_loss: 1.2306, test_f1: 0.4189
 epoch: 99, train_loss: 0.9444, test_loss: 1.1616, test_f1: 0.4658
##################ITERATION #4 ****************************************
 epoch: 0, train_loss: 1.5814, test_loss: 2.8565, test_f1: 0.2281
 epoch: 1, train_loss: 1.2530, test_loss: 1.6376, test_f1: 0.1365
 epoch: 2, train_loss: 1.2181, test_loss: 1.4220, test_f1: 0.2722
 epoch: 3, train_loss: 1.1797, test_loss: 1.3266, test_f1: 0.3286
 epoch: 4, train_loss: 1.1558, test_loss: 1.4685, test_f1: 0.3161
 epoch: 5, train_loss: 1.1346, test_loss: 1.4364, test_f1: 0.2642
 epoch: 6, train_loss: 1.1230, test_loss: 1.2744, test_f1: 0.3480
 epoch: 7, train_loss: 1.0806, test_loss: 1.2779, test_f1: 0.3201
 epoch: 8, train_loss: 1.0752, test_loss: 1.1558, test_f1: 0.3813
 epoch: 9, train_loss: 1.0937, test_loss: 1.2224, test_f1: 0.3491
 epoch: 10, train_loss: 1.0717, test_loss: 1.4026, test_f1: 0.4085
 epoch: 11, train_loss: 1.0567, test_loss: 1.2117, test_f1: 0.3815
 epoch: 12, train_loss: 1.0355, test_loss: 1.1947, test_f1: 0.3283
 epoch: 13, train_loss: 1.0189, test_loss: 1.1225, test_f1: 0.3370
 epoch: 14, train_loss: 1.0228, test_loss: 1.0982, test_f1: 0.3388
 epoch: 15, train_loss: 1.0439, test_loss: 1.1182, test_f1: 0.3344
 epoch: 16, train_loss: 1.0457, test_loss: 1.1131, test_f1: 0.3837
 epoch: 17, train_loss: 1.0437, test_loss: 1.2396, test_f1: 0.3942
 epoch: 18, train_loss: 1.0541, test_loss: 1.1352, test_f1: 0.3395
 epoch: 19, train_loss: 1.0570, test_loss: 1.1976, test_f1: 0.4218
 epoch: 20, train_loss: 1.0356, test_loss: 1.1247, test_f1: 0.3227
 epoch: 21, train_loss: 1.0527, test_loss: 1.3879, test_f1: 0.2718
 epoch: 22, train_loss: 1.0251, test_loss: 1.2092, test_f1: 0.4390
 epoch: 23, train_loss: 1.0225, test_loss: 1.1345, test_f1: 0.3333
 epoch: 24, train_loss: 1.0174, test_loss: 1.1954, test_f1: 0.4646
 epoch: 25, train_loss: 1.0150, test_loss: 1.1775, test_f1: 0.3256
 epoch: 26, train_loss: 1.0231, test_loss: 1.1458, test_f1: 0.3513
 epoch: 27, train_loss: 1.0295, test_loss: 1.1100, test_f1: 0.4313
 epoch: 28, train_loss: 1.0301, test_loss: 1.1297, test_f1: 0.3621
 epoch: 29, train_loss: 1.0236, test_loss: 1.0722, test_f1: 0.3982
 epoch: 30, train_loss: 1.0292, test_loss: 1.3375, test_f1: 0.3218
 epoch: 31, train_loss: 1.0700, test_loss: 1.2408, test_f1: 0.3262
 epoch: 32, train_loss: 1.0193, test_loss: 1.2076, test_f1: 0.3950
 epoch: 33, train_loss: 1.0009, test_loss: 1.3414, test_f1: 0.3333
 epoch: 34, train_loss: 1.0221, test_loss: 1.3827, test_f1: 0.4636
 epoch: 35, train_loss: 1.0565, test_loss: 1.4873, test_f1: 0.4015
 epoch: 36, train_loss: 1.0244, test_loss: 1.1464, test_f1: 0.3234
 epoch: 37, train_loss: 1.0443, test_loss: 1.1710, test_f1: 0.4352
 epoch: 38, train_loss: 1.0603, test_loss: 1.1277, test_f1: 0.3290
 epoch: 39, train_loss: 1.0385, test_loss: 1.1228, test_f1: 0.3344
 epoch: 40, train_loss: 1.0522, test_loss: 1.2052, test_f1: 0.3207
 epoch: 41, train_loss: 1.0807, test_loss: 1.1892, test_f1: 0.4062
 epoch: 42, train_loss: 1.0483, test_loss: 1.1754, test_f1: 0.2574
 epoch: 43, train_loss: 1.0616, test_loss: 1.4268, test_f1: 0.3844
 epoch: 44, train_loss: 1.0380, test_loss: 1.1962, test_f1: 0.4216
 epoch: 45, train_loss: 1.0884, test_loss: 1.5346, test_f1: 0.2168
 epoch: 46, train_loss: 1.0643, test_loss: 1.0928, test_f1: 0.3395
 epoch: 47, train_loss: 1.0418, test_loss: 1.1334, test_f1: 0.4026
 epoch: 48, train_loss: 1.0183, test_loss: 1.1423, test_f1: 0.4643
 epoch: 49, train_loss: 1.0240, test_loss: 1.1031, test_f1: 0.3290
 epoch: 50, train_loss: 1.0335, test_loss: 1.1348, test_f1: 0.3774
 epoch: 51, train_loss: 1.0191, test_loss: 1.1425, test_f1: 0.3852
 epoch: 52, train_loss: 1.0088, test_loss: 1.0914, test_f1: 0.4340
 epoch: 53, train_loss: 0.9898, test_loss: 1.0842, test_f1: 0.4467
 epoch: 54, train_loss: 0.9890, test_loss: 1.1968, test_f1: 0.3290
 epoch: 55, train_loss: 0.9844, test_loss: 1.2125, test_f1: 0.4668
 epoch: 56, train_loss: 0.9973, test_loss: 1.2022, test_f1: 0.4657
 epoch: 57, train_loss: 1.0062, test_loss: 1.2275, test_f1: 0.3176
 epoch: 58, train_loss: 1.0014, test_loss: 1.3705, test_f1: 0.3880
 epoch: 59, train_loss: 0.9826, test_loss: 1.1567, test_f1: 0.3262
 epoch: 60, train_loss: 1.0030, test_loss: 1.1281, test_f1: 0.3373
 epoch: 61, train_loss: 0.9895, test_loss: 1.0859, test_f1: 0.4404
 epoch: 62, train_loss: 0.9796, test_loss: 1.1444, test_f1: 0.3983
 epoch: 63, train_loss: 0.9897, test_loss: 1.0958, test_f1: 0.4646
 epoch: 64, train_loss: 0.9853, test_loss: 1.1115, test_f1: 0.4585
 epoch: 65, train_loss: 0.9850, test_loss: 1.2913, test_f1: 0.4533
 epoch: 66, train_loss: 0.9895, test_loss: 1.4954, test_f1: 0.3627
 epoch: 67, train_loss: 0.9872, test_loss: 1.2229, test_f1: 0.4548
 epoch: 68, train_loss: 0.9953, test_loss: 1.3342, test_f1: 0.3368
 epoch: 69, train_loss: 1.0133, test_loss: 1.2075, test_f1: 0.3262
 epoch: 70, train_loss: 0.9871, test_loss: 1.1872, test_f1: 0.4559
 epoch: 71, train_loss: 0.9815, test_loss: 1.3143, test_f1: 0.4764
 epoch: 72, train_loss: 0.9766, test_loss: 1.2452, test_f1: 0.3483
 epoch: 73, train_loss: 0.9779, test_loss: 1.1798, test_f1: 0.4365
 epoch: 74, train_loss: 0.9800, test_loss: 1.1189, test_f1: 0.3476
 epoch: 75, train_loss: 0.9616, test_loss: 1.1457, test_f1: 0.4542
 epoch: 76, train_loss: 0.9716, test_loss: 1.1104, test_f1: 0.3989
 epoch: 77, train_loss: 0.9733, test_loss: 1.1469, test_f1: 0.3759
 epoch: 78, train_loss: 0.9598, test_loss: 1.2788, test_f1: 0.4540
 epoch: 79, train_loss: 0.9728, test_loss: 1.2417, test_f1: 0.4163
 epoch: 80, train_loss: 0.9505, test_loss: 1.0816, test_f1: 0.4769
 epoch: 81, train_loss: 0.9689, test_loss: 1.0658, test_f1: 0.4706
 epoch: 82, train_loss: 0.9791, test_loss: 1.0744, test_f1: 0.4029
 epoch: 83, train_loss: 0.9683, test_loss: 1.0738, test_f1: 0.4204
 epoch: 84, train_loss: 0.9759, test_loss: 1.0817, test_f1: 0.4252
 epoch: 85, train_loss: 0.9674, test_loss: 1.0774, test_f1: 0.4749
 epoch: 86, train_loss: 0.9882, test_loss: 1.0733, test_f1: 0.4209
 epoch: 87, train_loss: 1.0074, test_loss: 1.0997, test_f1: 0.3958
 epoch: 88, train_loss: 0.9955, test_loss: 1.0863, test_f1: 0.5042
 epoch: 89, train_loss: 0.9818, test_loss: 1.1394, test_f1: 0.4443
 epoch: 90, train_loss: 0.9588, test_loss: 1.2611, test_f1: 0.3703
 epoch: 91, train_loss: 1.0019, test_loss: 1.2175, test_f1: 0.4119
 epoch: 92, train_loss: 0.9720, test_loss: 1.4406, test_f1: 0.4134
 epoch: 93, train_loss: 0.9654, test_loss: 1.4503, test_f1: 0.4690
 epoch: 94, train_loss: 0.9557, test_loss: 1.2901, test_f1: 0.4491
 epoch: 95, train_loss: 0.9750, test_loss: 1.2585, test_f1: 0.4730
 epoch: 96, train_loss: 0.9386, test_loss: 1.1370, test_f1: 0.4862
 epoch: 97, train_loss: 0.9431, test_loss: 1.1621, test_f1: 0.4598
 epoch: 98, train_loss: 0.9550, test_loss: 1.1446, test_f1: 0.3420
 epoch: 99, train_loss: 0.9443, test_loss: 1.2105, test_f1: 0.3851
##################ITERATION #5 ****************************************
 epoch: 0, train_loss: 1.4693, test_loss: 25.8465, test_f1: 0.1365
 epoch: 1, train_loss: 1.2034, test_loss: 4.0342, test_f1: 0.2402
 epoch: 2, train_loss: 1.2185, test_loss: 2.6588, test_f1: 0.1368
 epoch: 3, train_loss: 1.1745, test_loss: 1.6950, test_f1: 0.2821
 epoch: 4, train_loss: 1.1112, test_loss: 1.5222, test_f1: 0.3238
 epoch: 5, train_loss: 1.1217, test_loss: 1.4476, test_f1: 0.3256
 epoch: 6, train_loss: 1.0953, test_loss: 1.2723, test_f1: 0.4037
 epoch: 7, train_loss: 1.1332, test_loss: 1.2758, test_f1: 0.3588
 epoch: 8, train_loss: 1.1096, test_loss: 1.3038, test_f1: 0.4200
 epoch: 9, train_loss: 1.0772, test_loss: 1.1419, test_f1: 0.3530
 epoch: 10, train_loss: 1.0859, test_loss: 1.3571, test_f1: 0.2736
 epoch: 11, train_loss: 1.0710, test_loss: 1.2378, test_f1: 0.4114
 epoch: 12, train_loss: 1.0715, test_loss: 1.1741, test_f1: 0.3078
 epoch: 13, train_loss: 1.0598, test_loss: 1.4704, test_f1: 0.4440
 epoch: 14, train_loss: 1.0387, test_loss: 1.1053, test_f1: 0.4342
 epoch: 15, train_loss: 1.0199, test_loss: 1.0925, test_f1: 0.4009
 epoch: 16, train_loss: 1.0316, test_loss: 1.1194, test_f1: 0.4017
 epoch: 17, train_loss: 1.0287, test_loss: 1.1959, test_f1: 0.4529
 epoch: 18, train_loss: 1.0560, test_loss: 1.5165, test_f1: 0.2281
 epoch: 19, train_loss: 1.0375, test_loss: 1.3302, test_f1: 0.3316
 epoch: 20, train_loss: 1.0363, test_loss: 1.1404, test_f1: 0.4708
 epoch: 21, train_loss: 1.0110, test_loss: 1.4016, test_f1: 0.2838
 epoch: 22, train_loss: 1.0739, test_loss: 1.2599, test_f1: 0.4251
 epoch: 23, train_loss: 1.0778, test_loss: 1.1646, test_f1: 0.3250
 epoch: 24, train_loss: 1.0651, test_loss: 1.1211, test_f1: 0.4363
 epoch: 25, train_loss: 1.0996, test_loss: 1.2103, test_f1: 0.4638
 epoch: 26, train_loss: 1.0682, test_loss: 1.1755, test_f1: 0.4128
 epoch: 27, train_loss: 1.0497, test_loss: 1.1538, test_f1: 0.4704
 epoch: 28, train_loss: 1.0023, test_loss: 1.0746, test_f1: 0.3899
 epoch: 29, train_loss: 1.0316, test_loss: 1.0889, test_f1: 0.5190
 epoch: 30, train_loss: 1.0307, test_loss: 1.0471, test_f1: 0.4301
 epoch: 31, train_loss: 1.1075, test_loss: 1.1968, test_f1: 0.3014
 epoch: 32, train_loss: 1.0795, test_loss: 1.2187, test_f1: 0.4415
 epoch: 33, train_loss: 1.0475, test_loss: 1.2399, test_f1: 0.2835
 epoch: 34, train_loss: 1.0469, test_loss: 1.2114, test_f1: 0.4282
 epoch: 35, train_loss: 1.0518, test_loss: 1.1743, test_f1: 0.4447
 epoch: 36, train_loss: 1.0594, test_loss: 1.1719, test_f1: 0.4241
 epoch: 37, train_loss: 1.0437, test_loss: 1.2667, test_f1: 0.3696
 epoch: 38, train_loss: 1.0265, test_loss: 1.2618, test_f1: 0.3969
 epoch: 39, train_loss: 1.0076, test_loss: 1.4447, test_f1: 0.3444
 epoch: 40, train_loss: 1.0331, test_loss: 1.1779, test_f1: 0.4279
 epoch: 41, train_loss: 1.0428, test_loss: 1.2031, test_f1: 0.3244
 epoch: 42, train_loss: 1.0320, test_loss: 1.1236, test_f1: 0.4574
 epoch: 43, train_loss: 1.0173, test_loss: 1.0969, test_f1: 0.4657
 epoch: 44, train_loss: 0.9911, test_loss: 1.0851, test_f1: 0.5065
 epoch: 45, train_loss: 1.0113, test_loss: 1.0187, test_f1: 0.4719
 epoch: 46, train_loss: 0.9961, test_loss: 1.0929, test_f1: 0.4366
 epoch: 47, train_loss: 0.9976, test_loss: 1.0755, test_f1: 0.4615
 epoch: 48, train_loss: 0.9858, test_loss: 1.0955, test_f1: 0.4407
 epoch: 49, train_loss: 1.0898, test_loss: 1.1217, test_f1: 0.4090
 epoch: 50, train_loss: 1.1079, test_loss: 1.1344, test_f1: 0.4312
 epoch: 51, train_loss: 1.0679, test_loss: 1.1062, test_f1: 0.4358
 epoch: 52, train_loss: 1.0469, test_loss: 1.0954, test_f1: 0.4366
 epoch: 53, train_loss: 1.0236, test_loss: 1.1201, test_f1: 0.4323
 epoch: 54, train_loss: 1.0177, test_loss: 1.0921, test_f1: 0.4327
 epoch: 55, train_loss: 1.0165, test_loss: 1.0743, test_f1: 0.4401
 epoch: 56, train_loss: 1.0046, test_loss: 1.0815, test_f1: 0.4553
 epoch: 57, train_loss: 1.0152, test_loss: 1.0992, test_f1: 0.4246
 epoch: 58, train_loss: 1.0100, test_loss: 1.1706, test_f1: 0.4134
 epoch: 59, train_loss: 1.0295, test_loss: 1.2743, test_f1: 0.4178
 epoch: 60, train_loss: 1.0240, test_loss: 1.2376, test_f1: 0.3369
 epoch: 61, train_loss: 1.0201, test_loss: 1.1176, test_f1: 0.4318
 epoch: 62, train_loss: 0.9985, test_loss: 1.1696, test_f1: 0.4593
 epoch: 63, train_loss: 1.0096, test_loss: 1.0808, test_f1: 0.4388
 epoch: 64, train_loss: 1.0172, test_loss: 1.0738, test_f1: 0.4257
 epoch: 65, train_loss: 1.0118, test_loss: 1.0474, test_f1: 0.4270
 epoch: 66, train_loss: 0.9839, test_loss: 1.0672, test_f1: 0.4306
 epoch: 67, train_loss: 0.9996, test_loss: 1.0834, test_f1: 0.4353
 epoch: 68, train_loss: 0.9863, test_loss: 1.0826, test_f1: 0.4431
 epoch: 69, train_loss: 0.9804, test_loss: 1.0575, test_f1: 0.4352
 epoch: 70, train_loss: 0.9842, test_loss: 1.0600, test_f1: 0.4582
 epoch: 71, train_loss: 0.9876, test_loss: 1.0910, test_f1: 0.4637
 epoch: 72, train_loss: 0.9821, test_loss: 1.0961, test_f1: 0.4321
 epoch: 73, train_loss: 0.9880, test_loss: 1.0661, test_f1: 0.4701
 epoch: 74, train_loss: 0.9559, test_loss: 1.0945, test_f1: 0.4628
 epoch: 75, train_loss: 0.9698, test_loss: 1.1393, test_f1: 0.4190
 epoch: 76, train_loss: 0.9836, test_loss: 1.3440, test_f1: 0.3343
 epoch: 77, train_loss: 1.0129, test_loss: 1.2577, test_f1: 0.3136
 epoch: 78, train_loss: 1.0314, test_loss: 1.2526, test_f1: 0.3562
 epoch: 79, train_loss: 0.9964, test_loss: 1.2248, test_f1: 0.3587
 epoch: 80, train_loss: 0.9732, test_loss: 1.1576, test_f1: 0.4351
 epoch: 81, train_loss: 0.9846, test_loss: 1.1290, test_f1: 0.4640
 epoch: 82, train_loss: 0.9772, test_loss: 1.3764, test_f1: 0.4439
 epoch: 83, train_loss: 0.9776, test_loss: 1.1332, test_f1: 0.4746
 epoch: 84, train_loss: 0.9670, test_loss: 1.1137, test_f1: 0.4365
 epoch: 85, train_loss: 0.9791, test_loss: 1.0858, test_f1: 0.4426
 epoch: 86, train_loss: 0.9755, test_loss: 1.0410, test_f1: 0.4725
 epoch: 87, train_loss: 1.0014, test_loss: 1.0905, test_f1: 0.4621
 epoch: 88, train_loss: 0.9786, test_loss: 1.1062, test_f1: 0.3870
 epoch: 89, train_loss: 0.9757, test_loss: 1.0731, test_f1: 0.4603
 epoch: 90, train_loss: 0.9639, test_loss: 1.0582, test_f1: 0.4686
 epoch: 91, train_loss: 0.9706, test_loss: 1.0576, test_f1: 0.4371
 epoch: 92, train_loss: 0.9616, test_loss: 1.0914, test_f1: 0.4370
 epoch: 93, train_loss: 0.9565, test_loss: 1.1670, test_f1: 0.4755
 epoch: 94, train_loss: 0.9810, test_loss: 1.0575, test_f1: 0.4372
 epoch: 95, train_loss: 0.9594, test_loss: 1.0469, test_f1: 0.4764
 epoch: 96, train_loss: 0.9796, test_loss: 1.0413, test_f1: 0.4385
 epoch: 97, train_loss: 0.9479, test_loss: 1.1244, test_f1: 0.4757
 epoch: 98, train_loss: 0.9470, test_loss: 1.1153, test_f1: 0.4790
 epoch: 99, train_loss: 0.9424, test_loss: 1.0835, test_f1: 0.4728
##################ITERATION #6 ****************************************
 epoch: 0, train_loss: 1.3297, test_loss: 2.7314, test_f1: 0.3019
 epoch: 1, train_loss: 1.1979, test_loss: 2.4799, test_f1: 0.1365
 epoch: 2, train_loss: 1.1446, test_loss: 1.5866, test_f1: 0.3474
 epoch: 3, train_loss: 1.1585, test_loss: 1.4920, test_f1: 0.3363
 epoch: 4, train_loss: 1.1261, test_loss: 1.9140, test_f1: 0.1419
 epoch: 5, train_loss: 1.0857, test_loss: 2.0879, test_f1: 0.1603
 epoch: 6, train_loss: 1.0625, test_loss: 1.2916, test_f1: 0.2609
 epoch: 7, train_loss: 1.0737, test_loss: 1.6520, test_f1: 0.1975
 epoch: 8, train_loss: 1.0395, test_loss: 1.7878, test_f1: 0.1941
 epoch: 9, train_loss: 1.0615, test_loss: 1.1983, test_f1: 0.4332
 epoch: 10, train_loss: 1.0558, test_loss: 1.3617, test_f1: 0.3986
 epoch: 11, train_loss: 1.0505, test_loss: 1.2728, test_f1: 0.4082
 epoch: 12, train_loss: 1.0379, test_loss: 1.3109, test_f1: 0.3051
 epoch: 13, train_loss: 1.0371, test_loss: 1.3527, test_f1: 0.2980
 epoch: 14, train_loss: 1.0042, test_loss: 1.2048, test_f1: 0.3638
 epoch: 15, train_loss: 1.0035, test_loss: 1.2257, test_f1: 0.4337
 epoch: 16, train_loss: 1.0233, test_loss: 1.3397, test_f1: 0.4404
 epoch: 17, train_loss: 1.0334, test_loss: 1.1190, test_f1: 0.3290
 epoch: 18, train_loss: 1.0124, test_loss: 1.2437, test_f1: 0.3424
 epoch: 19, train_loss: 1.0176, test_loss: 1.1288, test_f1: 0.3290
 epoch: 20, train_loss: 1.0079, test_loss: 1.2212, test_f1: 0.4411
 epoch: 21, train_loss: 0.9979, test_loss: 1.1602, test_f1: 0.3234
 epoch: 22, train_loss: 1.0173, test_loss: 1.0741, test_f1: 0.4358
 epoch: 23, train_loss: 1.0046, test_loss: 1.1449, test_f1: 0.4430
 epoch: 24, train_loss: 1.0098, test_loss: 1.0671, test_f1: 0.4318
 epoch: 25, train_loss: 0.9942, test_loss: 1.5174, test_f1: 0.3483
 epoch: 26, train_loss: 0.9753, test_loss: 1.9177, test_f1: 0.3745
 epoch: 27, train_loss: 0.9804, test_loss: 1.1758, test_f1: 0.4333
 epoch: 28, train_loss: 0.9856, test_loss: 1.3654, test_f1: 0.4279
 epoch: 29, train_loss: 0.9727, test_loss: 1.9141, test_f1: 0.3314
 epoch: 30, train_loss: 0.9954, test_loss: 1.1564, test_f1: 0.4639
 epoch: 31, train_loss: 1.0064, test_loss: 1.1633, test_f1: 0.4061
 epoch: 32, train_loss: 1.0336, test_loss: 1.1205, test_f1: 0.3290
 epoch: 33, train_loss: 1.0129, test_loss: 1.1777, test_f1: 0.4400
 epoch: 34, train_loss: 1.0038, test_loss: 1.1153, test_f1: 0.4083
 epoch: 35, train_loss: 0.9841, test_loss: 1.0968, test_f1: 0.3964
 epoch: 36, train_loss: 0.9929, test_loss: 1.1424, test_f1: 0.4571
 epoch: 37, train_loss: 0.9782, test_loss: 1.1255, test_f1: 0.3362
 epoch: 38, train_loss: 0.9810, test_loss: 1.2948, test_f1: 0.4204
 epoch: 39, train_loss: 0.9991, test_loss: 1.6896, test_f1: 0.3688
 epoch: 40, train_loss: 0.9884, test_loss: 1.3390, test_f1: 0.4307
 epoch: 41, train_loss: 0.9929, test_loss: 1.2024, test_f1: 0.4073
 epoch: 42, train_loss: 0.9697, test_loss: 1.4426, test_f1: 0.4773
 epoch: 43, train_loss: 0.9767, test_loss: 1.2270, test_f1: 0.4355
 epoch: 44, train_loss: 1.0698, test_loss: 1.2875, test_f1: 0.2558
 epoch: 45, train_loss: 1.0247, test_loss: 1.4033, test_f1: 0.3059
 epoch: 46, train_loss: 1.0922, test_loss: 1.4571, test_f1: 0.2785
 epoch: 47, train_loss: 1.0505, test_loss: 1.3524, test_f1: 0.3290
 epoch: 48, train_loss: 1.0221, test_loss: 1.1347, test_f1: 0.3868
 epoch: 49, train_loss: 1.0114, test_loss: 1.0918, test_f1: 0.4610
 epoch: 50, train_loss: 1.0211, test_loss: 1.1149, test_f1: 0.3191
 epoch: 51, train_loss: 1.0147, test_loss: 1.2122, test_f1: 0.4260
 epoch: 52, train_loss: 0.9966, test_loss: 1.1310, test_f1: 0.4586
 epoch: 53, train_loss: 0.9789, test_loss: 1.1522, test_f1: 0.4649
 epoch: 54, train_loss: 0.9845, test_loss: 1.1526, test_f1: 0.4616
 epoch: 55, train_loss: 0.9692, test_loss: 1.1275, test_f1: 0.4767
 epoch: 56, train_loss: 0.9573, test_loss: 1.1320, test_f1: 0.4846
 epoch: 57, train_loss: 0.9693, test_loss: 1.1205, test_f1: 0.4738
 epoch: 58, train_loss: 0.9659, test_loss: 1.1506, test_f1: 0.4823
 epoch: 59, train_loss: 0.9727, test_loss: 1.1157, test_f1: 0.3352
 epoch: 60, train_loss: 0.9797, test_loss: 1.1726, test_f1: 0.4130
 epoch: 61, train_loss: 0.9775, test_loss: 1.1425, test_f1: 0.4224
 epoch: 62, train_loss: 0.9669, test_loss: 1.1151, test_f1: 0.4797
 epoch: 63, train_loss: 0.9618, test_loss: 1.1309, test_f1: 0.4413
 epoch: 64, train_loss: 0.9531, test_loss: 1.1595, test_f1: 0.5252
 epoch: 65, train_loss: 0.9464, test_loss: 1.0995, test_f1: 0.3895
 epoch: 66, train_loss: 0.9698, test_loss: 1.0454, test_f1: 0.4058
 epoch: 67, train_loss: 0.9510, test_loss: 1.0875, test_f1: 0.3770
 epoch: 68, train_loss: 0.9684, test_loss: 1.0511, test_f1: 0.4630
 epoch: 69, train_loss: 0.9476, test_loss: 1.0975, test_f1: 0.3939
 epoch: 70, train_loss: 0.9423, test_loss: 1.1281, test_f1: 0.3804
 epoch: 71, train_loss: 0.9383, test_loss: 1.1559, test_f1: 0.4890
 epoch: 72, train_loss: 0.9390, test_loss: 1.1847, test_f1: 0.4705
 epoch: 73, train_loss: 0.9588, test_loss: 1.3583, test_f1: 0.4527
 epoch: 74, train_loss: 0.9481, test_loss: 1.4067, test_f1: 0.4401
 epoch: 75, train_loss: 0.9434, test_loss: 1.3514, test_f1: 0.4827
 epoch: 76, train_loss: 0.9379, test_loss: 1.4752, test_f1: 0.4239
 epoch: 77, train_loss: 0.9220, test_loss: 1.1664, test_f1: 0.5011
 epoch: 78, train_loss: 0.9343, test_loss: 1.1193, test_f1: 0.4660
 epoch: 79, train_loss: 0.9485, test_loss: 1.2342, test_f1: 0.4853
 epoch: 80, train_loss: 0.9386, test_loss: 1.3344, test_f1: 0.4623
 epoch: 81, train_loss: 0.9399, test_loss: 1.2971, test_f1: 0.4181
 epoch: 82, train_loss: 0.9279, test_loss: 1.0972, test_f1: 0.3759
 epoch: 83, train_loss: 0.9539, test_loss: 1.1240, test_f1: 0.4024
 epoch: 84, train_loss: 0.9465, test_loss: 1.0635, test_f1: 0.4790
 epoch: 85, train_loss: 0.9372, test_loss: 1.1031, test_f1: 0.3395
 epoch: 86, train_loss: 0.9346, test_loss: 1.1112, test_f1: 0.4649
 epoch: 87, train_loss: 0.9280, test_loss: 1.0932, test_f1: 0.3989
 epoch: 88, train_loss: 0.9299, test_loss: 1.1291, test_f1: 0.4641
 epoch: 89, train_loss: 0.9279, test_loss: 1.1674, test_f1: 0.4947
 epoch: 90, train_loss: 0.9299, test_loss: 1.2263, test_f1: 0.4652
 epoch: 91, train_loss: 0.9406, test_loss: 1.2042, test_f1: 0.3157
 epoch: 92, train_loss: 0.9382, test_loss: 1.2658, test_f1: 0.3471
 epoch: 93, train_loss: 0.9277, test_loss: 1.1540, test_f1: 0.4085
 epoch: 94, train_loss: 0.9197, test_loss: 1.1953, test_f1: 0.4861
 epoch: 95, train_loss: 0.9250, test_loss: 1.2621, test_f1: 0.4929
 epoch: 96, train_loss: 0.9350, test_loss: 1.0949, test_f1: 0.4029
 epoch: 97, train_loss: 0.9436, test_loss: 1.0975, test_f1: 0.3385
 epoch: 98, train_loss: 0.9375, test_loss: 1.0439, test_f1: 0.3490
 epoch: 99, train_loss: 0.9345, test_loss: 1.0557, test_f1: 0.3790
##################ITERATION #7 ****************************************
 epoch: 0, train_loss: 1.3727, test_loss: 2.8030, test_f1: 0.2281
 epoch: 1, train_loss: 1.2419, test_loss: 1.9625, test_f1: 0.1365
 epoch: 2, train_loss: 1.1760, test_loss: 1.3667, test_f1: 0.1870
 epoch: 3, train_loss: 1.1185, test_loss: 1.3475, test_f1: 0.2281
 epoch: 4, train_loss: 1.1004, test_loss: 1.4731, test_f1: 0.1996
 epoch: 5, train_loss: 1.1092, test_loss: 1.1839, test_f1: 0.3155
 epoch: 6, train_loss: 1.1203, test_loss: 1.2519, test_f1: 0.3146
 epoch: 7, train_loss: 1.0768, test_loss: 1.3360, test_f1: 0.1681
 epoch: 8, train_loss: 1.0819, test_loss: 1.3971, test_f1: 0.2441
 epoch: 9, train_loss: 1.2049, test_loss: 1.1942, test_f1: 0.3008
 epoch: 10, train_loss: 1.1261, test_loss: 1.3668, test_f1: 0.3509
 epoch: 11, train_loss: 1.0735, test_loss: 1.4255, test_f1: 0.3387
 epoch: 12, train_loss: 1.0694, test_loss: 1.2029, test_f1: 0.4283
 epoch: 13, train_loss: 1.0506, test_loss: 1.2852, test_f1: 0.2944
 epoch: 14, train_loss: 1.0371, test_loss: 1.4558, test_f1: 0.2686
 epoch: 15, train_loss: 1.0582, test_loss: 1.3579, test_f1: 0.2978
 epoch: 16, train_loss: 1.0319, test_loss: 1.4369, test_f1: 0.4288
 epoch: 17, train_loss: 1.0189, test_loss: 1.1537, test_f1: 0.4283
 epoch: 18, train_loss: 1.0362, test_loss: 1.1113, test_f1: 0.4360
 epoch: 19, train_loss: 1.0385, test_loss: 1.2604, test_f1: 0.3410
 epoch: 20, train_loss: 1.0376, test_loss: 1.1827, test_f1: 0.3876
 epoch: 21, train_loss: 1.0255, test_loss: 1.2988, test_f1: 0.4351
 epoch: 22, train_loss: 1.0418, test_loss: 1.2849, test_f1: 0.3888
 epoch: 23, train_loss: 1.0274, test_loss: 1.1710, test_f1: 0.3267
 epoch: 24, train_loss: 1.0315, test_loss: 1.5020, test_f1: 0.2370
 epoch: 25, train_loss: 1.0348, test_loss: 1.9495, test_f1: 0.3446
 epoch: 26, train_loss: 1.0618, test_loss: 1.2679, test_f1: 0.3210
 epoch: 27, train_loss: 1.0311, test_loss: 1.2222, test_f1: 0.3888
 epoch: 28, train_loss: 1.0180, test_loss: 1.1019, test_f1: 0.3853
 epoch: 29, train_loss: 1.0064, test_loss: 1.1040, test_f1: 0.3290
 epoch: 30, train_loss: 1.0156, test_loss: 1.1493, test_f1: 0.3659
 epoch: 31, train_loss: 1.0158, test_loss: 1.1111, test_f1: 0.3290
 epoch: 32, train_loss: 1.0056, test_loss: 1.0864, test_f1: 0.3283
 epoch: 33, train_loss: 0.9975, test_loss: 1.0450, test_f1: 0.4391
 epoch: 34, train_loss: 0.9804, test_loss: 1.1851, test_f1: 0.4787
 epoch: 35, train_loss: 0.9855, test_loss: 1.0552, test_f1: 0.4474
 epoch: 36, train_loss: 0.9871, test_loss: 1.0494, test_f1: 0.3523
 epoch: 37, train_loss: 0.9756, test_loss: 1.0806, test_f1: 0.4174
 epoch: 38, train_loss: 0.9865, test_loss: 1.1309, test_f1: 0.3836
 epoch: 39, train_loss: 0.9673, test_loss: 1.3512, test_f1: 0.3099
 epoch: 40, train_loss: 0.9829, test_loss: 1.0719, test_f1: 0.3857
 epoch: 41, train_loss: 0.9884, test_loss: 1.0662, test_f1: 0.3688
 epoch: 42, train_loss: 0.9767, test_loss: 1.0839, test_f1: 0.4372
 epoch: 43, train_loss: 0.9874, test_loss: 1.2147, test_f1: 0.3920
 epoch: 44, train_loss: 0.9860, test_loss: 1.6013, test_f1: 0.2590
 epoch: 45, train_loss: 1.0097, test_loss: 1.1601, test_f1: 0.4625
 epoch: 46, train_loss: 1.0183, test_loss: 1.1950, test_f1: 0.4138
 epoch: 47, train_loss: 1.0305, test_loss: 1.2431, test_f1: 0.4238
 epoch: 48, train_loss: 1.0324, test_loss: 1.5538, test_f1: 0.2005
 epoch: 49, train_loss: 1.0604, test_loss: 2.2742, test_f1: 0.3312
 epoch: 50, train_loss: 1.0184, test_loss: 3.2281, test_f1: 0.1821
 epoch: 51, train_loss: 1.0115, test_loss: 1.2097, test_f1: 0.3922
 epoch: 52, train_loss: 1.0156, test_loss: 1.1174, test_f1: 0.4120
 epoch: 53, train_loss: 1.0200, test_loss: 1.1115, test_f1: 0.4351
 epoch: 54, train_loss: 1.0037, test_loss: 1.0883, test_f1: 0.3395
 epoch: 55, train_loss: 0.9959, test_loss: 1.1038, test_f1: 0.3827
 epoch: 56, train_loss: 0.9870, test_loss: 1.0958, test_f1: 0.3374
 epoch: 57, train_loss: 0.9781, test_loss: 1.1129, test_f1: 0.4183
 epoch: 58, train_loss: 1.0004, test_loss: 1.0837, test_f1: 0.4858
 epoch: 59, train_loss: 0.9780, test_loss: 1.0567, test_f1: 0.3435
 epoch: 60, train_loss: 0.9763, test_loss: 1.0605, test_f1: 0.4396
 epoch: 61, train_loss: 0.9672, test_loss: 1.0599, test_f1: 0.4379
 epoch: 62, train_loss: 0.9737, test_loss: 1.0207, test_f1: 0.4509
 epoch: 63, train_loss: 0.9652, test_loss: 1.0632, test_f1: 0.4616
 epoch: 64, train_loss: 0.9602, test_loss: 1.0468, test_f1: 0.3414
 epoch: 65, train_loss: 0.9731, test_loss: 1.0741, test_f1: 0.3573
 epoch: 66, train_loss: 0.9707, test_loss: 1.0804, test_f1: 0.4567
 epoch: 67, train_loss: 0.9690, test_loss: 1.0354, test_f1: 0.4549
 epoch: 68, train_loss: 0.9647, test_loss: 1.0292, test_f1: 0.4428
 epoch: 69, train_loss: 0.9681, test_loss: 1.1118, test_f1: 0.4706
 epoch: 70, train_loss: 0.9599, test_loss: 1.0257, test_f1: 0.4241
 epoch: 71, train_loss: 0.9737, test_loss: 1.3637, test_f1: 0.2813
 epoch: 72, train_loss: 0.9613, test_loss: 1.2400, test_f1: 0.4131
 epoch: 73, train_loss: 0.9589, test_loss: 1.0679, test_f1: 0.3773
 epoch: 74, train_loss: 0.9652, test_loss: 1.0516, test_f1: 0.4469
 epoch: 75, train_loss: 0.9614, test_loss: 1.0797, test_f1: 0.4619
 epoch: 76, train_loss: 0.9676, test_loss: 1.2065, test_f1: 0.4255
 epoch: 77, train_loss: 0.9699, test_loss: 1.0708, test_f1: 0.4129
 epoch: 78, train_loss: 0.9606, test_loss: 1.0287, test_f1: 0.4447
 epoch: 79, train_loss: 0.9503, test_loss: 1.0801, test_f1: 0.4087
 epoch: 80, train_loss: 0.9500, test_loss: 1.0579, test_f1: 0.4564
 epoch: 81, train_loss: 0.9400, test_loss: 1.0376, test_f1: 0.3492
 epoch: 82, train_loss: 0.9377, test_loss: 1.1571, test_f1: 0.4745
 epoch: 83, train_loss: 0.9485, test_loss: 1.2453, test_f1: 0.4147
 epoch: 84, train_loss: 0.9485, test_loss: 1.0690, test_f1: 0.4818
 epoch: 85, train_loss: 0.9607, test_loss: 1.0514, test_f1: 0.4216
 epoch: 86, train_loss: 0.9448, test_loss: 1.1139, test_f1: 0.4352
 epoch: 87, train_loss: 0.9421, test_loss: 1.1384, test_f1: 0.4003
 epoch: 88, train_loss: 0.9485, test_loss: 1.0314, test_f1: 0.5167
 epoch: 89, train_loss: 0.9326, test_loss: 1.0018, test_f1: 0.4489
 epoch: 90, train_loss: 0.9389, test_loss: 1.0759, test_f1: 0.4119
 epoch: 91, train_loss: 0.9324, test_loss: 1.0969, test_f1: 0.5303
 epoch: 92, train_loss: 0.9352, test_loss: 1.1230, test_f1: 0.3598
 epoch: 93, train_loss: 0.9622, test_loss: 1.1864, test_f1: 0.3586
 epoch: 94, train_loss: 0.9632, test_loss: 1.1659, test_f1: 0.4131
 epoch: 95, train_loss: 0.9575, test_loss: 1.0555, test_f1: 0.3784
 epoch: 96, train_loss: 0.9423, test_loss: 1.0364, test_f1: 0.4953
 epoch: 97, train_loss: 0.9340, test_loss: 1.2343, test_f1: 0.4501
 epoch: 98, train_loss: 0.9458, test_loss: 1.4093, test_f1: 0.4179
 epoch: 99, train_loss: 0.9511, test_loss: 1.0434, test_f1: 0.5428
##################ITERATION #8 ****************************************
 epoch: 0, train_loss: 1.5991, test_loss: 2.7028, test_f1: 0.1365
 epoch: 1, train_loss: 1.2091, test_loss: 1.5121, test_f1: 0.2281
 epoch: 2, train_loss: 1.2014, test_loss: 1.3407, test_f1: 0.2977
 epoch: 3, train_loss: 1.1793, test_loss: 1.6128, test_f1: 0.1582
 epoch: 4, train_loss: 1.1310, test_loss: 1.3060, test_f1: 0.2667
 epoch: 5, train_loss: 1.1403, test_loss: 1.2164, test_f1: 0.3489
 epoch: 6, train_loss: 1.1221, test_loss: 1.4827, test_f1: 0.3682
 epoch: 7, train_loss: 1.0793, test_loss: 2.6637, test_f1: 0.1577
 epoch: 8, train_loss: 1.0886, test_loss: 2.8151, test_f1: 0.1534
 epoch: 9, train_loss: 1.0865, test_loss: 1.7271, test_f1: 0.3213
 epoch: 10, train_loss: 1.0557, test_loss: 1.7550, test_f1: 0.2979
 epoch: 11, train_loss: 1.0703, test_loss: 1.2562, test_f1: 0.3904
 epoch: 12, train_loss: 1.0756, test_loss: 1.1677, test_f1: 0.4059
 epoch: 13, train_loss: 1.0717, test_loss: 1.1682, test_f1: 0.2953
 epoch: 14, train_loss: 1.0749, test_loss: 1.1322, test_f1: 0.4256
 epoch: 15, train_loss: 1.0634, test_loss: 1.1411, test_f1: 0.3024
 epoch: 16, train_loss: 1.0692, test_loss: 1.2129, test_f1: 0.3537
 epoch: 17, train_loss: 1.0635, test_loss: 1.1429, test_f1: 0.3510
 epoch: 18, train_loss: 1.0565, test_loss: 1.1459, test_f1: 0.4130
 epoch: 19, train_loss: 1.0542, test_loss: 1.1865, test_f1: 0.4178
 epoch: 20, train_loss: 1.0790, test_loss: 1.1588, test_f1: 0.3334
 epoch: 21, train_loss: 1.0561, test_loss: 1.1768, test_f1: 0.3641
 epoch: 22, train_loss: 1.0627, test_loss: 1.1356, test_f1: 0.3795
 epoch: 23, train_loss: 1.0739, test_loss: 1.0990, test_f1: 0.3688
 epoch: 24, train_loss: 1.0373, test_loss: 1.2016, test_f1: 0.4353
 epoch: 25, train_loss: 1.0191, test_loss: 1.1416, test_f1: 0.3782
 epoch: 26, train_loss: 1.1166, test_loss: 1.3040, test_f1: 0.3269
 epoch: 27, train_loss: 1.1141, test_loss: 1.1251, test_f1: 0.3370
 epoch: 28, train_loss: 1.0828, test_loss: 1.1889, test_f1: 0.3290
 epoch: 29, train_loss: 1.0976, test_loss: 1.1696, test_f1: 0.4052
 epoch: 30, train_loss: 1.0733, test_loss: 1.2465, test_f1: 0.3565
 epoch: 31, train_loss: 1.0654, test_loss: 1.4023, test_f1: 0.1783
 epoch: 32, train_loss: 1.0921, test_loss: 1.1587, test_f1: 0.3262
 epoch: 33, train_loss: 1.0584, test_loss: 1.1183, test_f1: 0.4393
 epoch: 34, train_loss: 1.0326, test_loss: 1.0982, test_f1: 0.3420
 epoch: 35, train_loss: 1.0499, test_loss: 1.0790, test_f1: 0.4448
 epoch: 36, train_loss: 1.0337, test_loss: 1.0842, test_f1: 0.3732
 epoch: 37, train_loss: 1.0178, test_loss: 1.1280, test_f1: 0.4305
 epoch: 38, train_loss: 1.0265, test_loss: 1.1132, test_f1: 0.4265
 epoch: 39, train_loss: 1.0542, test_loss: 1.0997, test_f1: 0.4341
 epoch: 40, train_loss: 1.0581, test_loss: 1.4046, test_f1: 0.3047
 epoch: 41, train_loss: 1.0365, test_loss: 1.3616, test_f1: 0.2698
 epoch: 42, train_loss: 1.0246, test_loss: 1.2584, test_f1: 0.3524
 epoch: 43, train_loss: 1.0084, test_loss: 1.2143, test_f1: 0.4158
 epoch: 44, train_loss: 1.0102, test_loss: 1.2007, test_f1: 0.4115
 epoch: 45, train_loss: 0.9965, test_loss: 1.1089, test_f1: 0.4605
 epoch: 46, train_loss: 0.9962, test_loss: 1.0957, test_f1: 0.3793
 epoch: 47, train_loss: 1.0154, test_loss: 1.1400, test_f1: 0.4455
 epoch: 48, train_loss: 1.0089, test_loss: 1.1126, test_f1: 0.4322
 epoch: 49, train_loss: 0.9975, test_loss: 1.0874, test_f1: 0.3707
 epoch: 50, train_loss: 0.9960, test_loss: 1.0904, test_f1: 0.3753
 epoch: 51, train_loss: 0.9774, test_loss: 1.1090, test_f1: 0.4369
 epoch: 52, train_loss: 0.9815, test_loss: 1.1030, test_f1: 0.3710
 epoch: 53, train_loss: 0.9757, test_loss: 1.1026, test_f1: 0.4325
 epoch: 54, train_loss: 0.9710, test_loss: 1.0802, test_f1: 0.3920
 epoch: 55, train_loss: 0.9689, test_loss: 1.0622, test_f1: 0.3482
 epoch: 56, train_loss: 0.9859, test_loss: 1.0380, test_f1: 0.3544
 epoch: 57, train_loss: 0.9762, test_loss: 1.1119, test_f1: 0.4554
 epoch: 58, train_loss: 0.9787, test_loss: 1.1514, test_f1: 0.3362
 epoch: 59, train_loss: 0.9839, test_loss: 1.1162, test_f1: 0.4407
 epoch: 60, train_loss: 0.9897, test_loss: 1.0857, test_f1: 0.4280
 epoch: 61, train_loss: 0.9675, test_loss: 1.1386, test_f1: 0.4497
 epoch: 62, train_loss: 0.9662, test_loss: 1.2503, test_f1: 0.4204
 epoch: 63, train_loss: 0.9778, test_loss: 1.1388, test_f1: 0.4601
 epoch: 64, train_loss: 0.9646, test_loss: 1.0691, test_f1: 0.3538
 epoch: 65, train_loss: 0.9844, test_loss: 1.3549, test_f1: 0.4029
 epoch: 66, train_loss: 0.9912, test_loss: 1.2808, test_f1: 0.3667
 epoch: 67, train_loss: 1.0167, test_loss: 1.2959, test_f1: 0.3213
 epoch: 68, train_loss: 0.9856, test_loss: 1.2870, test_f1: 0.3154
 epoch: 69, train_loss: 0.9805, test_loss: 1.1379, test_f1: 0.3598
 epoch: 70, train_loss: 0.9647, test_loss: 1.1783, test_f1: 0.4568
 epoch: 71, train_loss: 0.9591, test_loss: 1.1181, test_f1: 0.4534
 epoch: 72, train_loss: 0.9653, test_loss: 1.0580, test_f1: 0.3573
 epoch: 73, train_loss: 0.9581, test_loss: 1.1158, test_f1: 0.4695
 epoch: 74, train_loss: 0.9616, test_loss: 1.2660, test_f1: 0.4555
 epoch: 75, train_loss: 0.9843, test_loss: 1.1565, test_f1: 0.4521
 epoch: 76, train_loss: 0.9869, test_loss: 1.1352, test_f1: 0.4324
 epoch: 77, train_loss: 0.9943, test_loss: 1.1029, test_f1: 0.4265
 epoch: 78, train_loss: 0.9837, test_loss: 1.1326, test_f1: 0.4197
 epoch: 79, train_loss: 0.9929, test_loss: 1.1664, test_f1: 0.4547
 epoch: 80, train_loss: 0.9846, test_loss: 1.1433, test_f1: 0.4743
 epoch: 81, train_loss: 0.9796, test_loss: 1.0756, test_f1: 0.5281
 epoch: 82, train_loss: 0.9854, test_loss: 1.1150, test_f1: 0.4211
 epoch: 83, train_loss: 0.9749, test_loss: 1.1765, test_f1: 0.4595
 epoch: 84, train_loss: 0.9712, test_loss: 1.1327, test_f1: 0.4940
 epoch: 85, train_loss: 0.9677, test_loss: 1.0620, test_f1: 0.5240
 epoch: 86, train_loss: 0.9610, test_loss: 1.0393, test_f1: 0.5271
 epoch: 87, train_loss: 0.9649, test_loss: 1.0384, test_f1: 0.4946
 epoch: 88, train_loss: 0.9654, test_loss: 1.0745, test_f1: 0.4838
 epoch: 89, train_loss: 0.9734, test_loss: 1.1678, test_f1: 0.4855
 epoch: 90, train_loss: 0.9795, test_loss: 1.1989, test_f1: 0.3779
 epoch: 91, train_loss: 0.9775, test_loss: 1.2354, test_f1: 0.4709
 epoch: 92, train_loss: 0.9600, test_loss: 1.0709, test_f1: 0.5030
 epoch: 93, train_loss: 0.9614, test_loss: 1.0978, test_f1: 0.4533
 epoch: 94, train_loss: 0.9637, test_loss: 1.0847, test_f1: 0.4895
 epoch: 95, train_loss: 0.9863, test_loss: 1.1129, test_f1: 0.3900
 epoch: 96, train_loss: 1.0069, test_loss: 1.1509, test_f1: 0.4297
 epoch: 97, train_loss: 0.9971, test_loss: 1.1159, test_f1: 0.4387
 epoch: 98, train_loss: 0.9802, test_loss: 1.1069, test_f1: 0.4953
 epoch: 99, train_loss: 0.9561, test_loss: 1.0846, test_f1: 0.4389
##################ITERATION #9 ****************************************
 epoch: 0, train_loss: 1.5262, test_loss: 5.3486, test_f1: 0.1773
 epoch: 1, train_loss: 1.3090, test_loss: 1.5684, test_f1: 0.3068
 epoch: 2, train_loss: 1.2401, test_loss: 1.5623, test_f1: 0.1368
 epoch: 3, train_loss: 1.2011, test_loss: 1.3150, test_f1: 0.2462
 epoch: 4, train_loss: 1.1751, test_loss: 1.2535, test_f1: 0.3123
 epoch: 5, train_loss: 1.1891, test_loss: 1.2754, test_f1: 0.3440
 epoch: 6, train_loss: 1.1650, test_loss: 1.2967, test_f1: 0.2608
 epoch: 7, train_loss: 1.1646, test_loss: 1.1898, test_f1: 0.3935
 epoch: 8, train_loss: 1.1423, test_loss: 1.1982, test_f1: 0.2697
 epoch: 9, train_loss: 1.1428, test_loss: 1.1884, test_f1: 0.4058
 epoch: 10, train_loss: 1.1290, test_loss: 1.1769, test_f1: 0.3706
 epoch: 11, train_loss: 1.1367, test_loss: 1.1618, test_f1: 0.3739
 epoch: 12, train_loss: 1.1420, test_loss: 1.1836, test_f1: 0.3534
 epoch: 13, train_loss: 1.1433, test_loss: 1.1984, test_f1: 0.3725
 epoch: 14, train_loss: 1.1228, test_loss: 1.1787, test_f1: 0.4175
 epoch: 15, train_loss: 1.1207, test_loss: 1.1804, test_f1: 0.4012
 epoch: 16, train_loss: 1.0990, test_loss: 1.1482, test_f1: 0.3367
 epoch: 17, train_loss: 1.1074, test_loss: 1.3455, test_f1: 0.4031
 epoch: 18, train_loss: 1.0820, test_loss: 1.2751, test_f1: 0.4275
 epoch: 19, train_loss: 1.0751, test_loss: 1.1856, test_f1: 0.4362
 epoch: 20, train_loss: 1.0704, test_loss: 1.1685, test_f1: 0.3176
 epoch: 21, train_loss: 1.1086, test_loss: 1.1732, test_f1: 0.3018
 epoch: 22, train_loss: 1.1197, test_loss: 1.1442, test_f1: 0.2421
 epoch: 23, train_loss: 1.0968, test_loss: 1.1429, test_f1: 0.3290
 epoch: 24, train_loss: 1.0895, test_loss: 1.1431, test_f1: 0.4494
 epoch: 25, train_loss: 1.0961, test_loss: 1.0951, test_f1: 0.4279
 epoch: 26, train_loss: 1.0686, test_loss: 1.1100, test_f1: 0.4121
 epoch: 27, train_loss: 1.0684, test_loss: 1.1768, test_f1: 0.4093
 epoch: 28, train_loss: 1.0806, test_loss: 1.1678, test_f1: 0.4331
 epoch: 29, train_loss: 1.0668, test_loss: 1.3203, test_f1: 0.2863
 epoch: 30, train_loss: 1.1077, test_loss: 1.1093, test_f1: 0.3444
 epoch: 31, train_loss: 1.0631, test_loss: 1.1188, test_f1: 0.2424
 epoch: 32, train_loss: 1.0460, test_loss: 1.1011, test_f1: 0.3317
 epoch: 33, train_loss: 1.0567, test_loss: 1.0525, test_f1: 0.4814
 epoch: 34, train_loss: 1.0679, test_loss: 1.1909, test_f1: 0.3204
 epoch: 35, train_loss: 1.0911, test_loss: 1.1077, test_f1: 0.3344
 epoch: 36, train_loss: 1.0741, test_loss: 1.2690, test_f1: 0.3425
 epoch: 37, train_loss: 1.0788, test_loss: 1.1734, test_f1: 0.4564
 epoch: 38, train_loss: 1.0611, test_loss: 1.0804, test_f1: 0.4213
 epoch: 39, train_loss: 1.1162, test_loss: 1.1191, test_f1: 0.3277
 epoch: 40, train_loss: 1.1002, test_loss: 1.1657, test_f1: 0.4314
 epoch: 41, train_loss: 1.1012, test_loss: 1.0997, test_f1: 0.3344
 epoch: 42, train_loss: 1.0542, test_loss: 1.1061, test_f1: 0.4450
 epoch: 43, train_loss: 1.1404, test_loss: 1.3126, test_f1: 0.2281
 epoch: 44, train_loss: 1.2194, test_loss: 1.3076, test_f1: 0.2674
 epoch: 45, train_loss: 1.1309, test_loss: 1.1795, test_f1: 0.3234
 epoch: 46, train_loss: 1.0755, test_loss: 1.0995, test_f1: 0.3395
 epoch: 47, train_loss: 1.0492, test_loss: 1.0670, test_f1: 0.3418
 epoch: 48, train_loss: 1.0460, test_loss: 1.1393, test_f1: 0.3290
 epoch: 49, train_loss: 1.0412, test_loss: 1.2607, test_f1: 0.4280
 epoch: 50, train_loss: 1.0796, test_loss: 1.1161, test_f1: 0.3420
 epoch: 51, train_loss: 1.0859, test_loss: 1.1409, test_f1: 0.3367
 epoch: 52, train_loss: 1.0583, test_loss: 1.1235, test_f1: 0.3395
 epoch: 53, train_loss: 1.0444, test_loss: 1.1346, test_f1: 0.3395
 epoch: 54, train_loss: 1.0448, test_loss: 1.1372, test_f1: 0.3388
 epoch: 55, train_loss: 1.0509, test_loss: 1.1353, test_f1: 0.3395
 epoch: 56, train_loss: 1.0441, test_loss: 1.1244, test_f1: 0.3395
 epoch: 57, train_loss: 1.0342, test_loss: 1.0836, test_f1: 0.3500
 epoch: 58, train_loss: 1.0259, test_loss: 1.1643, test_f1: 0.3344
 epoch: 59, train_loss: 1.0493, test_loss: 1.1373, test_f1: 0.3395
 epoch: 60, train_loss: 1.0289, test_loss: 1.1731, test_f1: 0.3344
 epoch: 61, train_loss: 1.0761, test_loss: 1.1886, test_f1: 0.3205
 epoch: 62, train_loss: 1.0642, test_loss: 1.1393, test_f1: 0.3317
 epoch: 63, train_loss: 1.0461, test_loss: 1.1454, test_f1: 0.3317
 epoch: 64, train_loss: 1.0405, test_loss: 1.1524, test_f1: 0.3344
 epoch: 65, train_loss: 1.0305, test_loss: 1.1308, test_f1: 0.3344
 epoch: 66, train_loss: 1.0396, test_loss: 1.1264, test_f1: 0.3395
 epoch: 67, train_loss: 1.0368, test_loss: 1.1585, test_f1: 0.3344
 epoch: 68, train_loss: 1.0271, test_loss: 1.2788, test_f1: 0.2913
 epoch: 69, train_loss: 1.0719, test_loss: 1.1681, test_f1: 0.3234
 epoch: 70, train_loss: 1.0357, test_loss: 1.1382, test_f1: 0.3317
 epoch: 71, train_loss: 1.0624, test_loss: 1.1400, test_f1: 0.4286
 epoch: 72, train_loss: 1.0341, test_loss: 1.0907, test_f1: 0.3308
 epoch: 73, train_loss: 1.0411, test_loss: 1.0816, test_f1: 0.3484
 epoch: 74, train_loss: 1.0531, test_loss: 1.2351, test_f1: 0.4028
 epoch: 75, train_loss: 1.0537, test_loss: 1.1343, test_f1: 0.3640
 epoch: 76, train_loss: 1.0272, test_loss: 1.0997, test_f1: 0.3656
 epoch: 77, train_loss: 1.0151, test_loss: 1.1157, test_f1: 0.3292
 epoch: 78, train_loss: 1.0226, test_loss: 1.1005, test_f1: 0.3342
 epoch: 79, train_loss: 1.0079, test_loss: 1.1093, test_f1: 0.3510
 epoch: 80, train_loss: 1.0049, test_loss: 1.1927, test_f1: 0.3302
 epoch: 81, train_loss: 0.9976, test_loss: 1.3262, test_f1: 0.3469
 epoch: 82, train_loss: 0.9901, test_loss: 1.1527, test_f1: 0.4539
 epoch: 83, train_loss: 1.0140, test_loss: 1.1043, test_f1: 0.3375
 epoch: 84, train_loss: 0.9959, test_loss: 1.1170, test_f1: 0.4489
 epoch: 85, train_loss: 1.0063, test_loss: 1.1011, test_f1: 0.4331
 epoch: 86, train_loss: 1.0053, test_loss: 1.0761, test_f1: 0.3445
 epoch: 87, train_loss: 0.9869, test_loss: 1.0838, test_f1: 0.4537
 epoch: 88, train_loss: 0.9840, test_loss: 1.0664, test_f1: 0.3461
 epoch: 89, train_loss: 0.9864, test_loss: 1.1157, test_f1: 0.3444
 epoch: 90, train_loss: 0.9976, test_loss: 1.0822, test_f1: 0.4528
 epoch: 91, train_loss: 0.9825, test_loss: 1.1043, test_f1: 0.4059
 epoch: 92, train_loss: 0.9842, test_loss: 1.0845, test_f1: 0.3495
 epoch: 93, train_loss: 1.0016, test_loss: 1.0857, test_f1: 0.3762
 epoch: 94, train_loss: 0.9934, test_loss: 1.2533, test_f1: 0.3189
 epoch: 95, train_loss: 0.9894, test_loss: 1.2245, test_f1: 0.3909
 epoch: 96, train_loss: 0.9814, test_loss: 1.1041, test_f1: 0.4279
 epoch: 97, train_loss: 1.0145, test_loss: 1.1953, test_f1: 0.4198
 epoch: 98, train_loss: 0.9929, test_loss: 1.1062, test_f1: 0.4137
 epoch: 99, train_loss: 1.0001, test_loss: 1.1443, test_f1: 0.4225

Training completed in 300.73 seconds
Best F1: 0.5593 at epoch 67
Mean F1 across iterations: 0.5163  0.0405
========================FINAL RESULTS================================
FEGIN weighted F1: 0.5593  0.0405
python main.py --data ltspice_demos --representation component_net --model FEGIN --layers 4 --hiddens 16 --batch_size 256 --lr 0.1 --emb_size 512 --epochs 100 --save_appendix component_net_L4_H16_BS256_LR0.1_E512 --no_val
-----



STDERR:
  File "main.py", line 370, in <module>
    main()
  File "main.py", line 254, in main
    dataset = dataset_class(
  File "/home/philip/projects/ltspice_examples_code_repo/Circuit-Completion-Using-GNNs/component_classification_with_link_prediction_head/evaluation/FEGIN/kernel/circuit_datasets.py", line 15, in __init__
    self.data, self.slices = torch.load(self.processed_paths[0])
  File "/home/philip/.local/lib/python3.8/site-packages/torch/serialization.py", line 1040, in load
    warnings.warn(
  File "/usr/lib/python3.8/warnings.py", line 109, in _showwarnmsg
    sw(msg.message, msg.category, msg.filename, msg.lineno,
  File "main.py", line 47, in warn_with_traceback
    traceback.print_stack(file=log)
/home/philip/projects/ltspice_examples_code_repo/Circuit-Completion-Using-GNNs/component_classification_with_link_prediction_head/evaluation/FEGIN/kernel/circuit_datasets.py:15: FutureWarning: You are using `torch.load` with `weights_only=False` (the current default value), which uses the default pickle module implicitly. It is possible to construct malicious pickle data which will execute arbitrary code during unpickling (See https://github.com/pytorch/pytorch/blob/main/SECURITY.md#untrusted-models for more details). In a future release, the default value for `weights_only` will be flipped to `True`. This limits the functions that could be executed during unpickling. Arbitrary objects will no longer be allowed to be loaded via this mode unless they are explicitly allowlisted by the user via `torch.serialization.add_safe_globals`. We recommend you start setting `weights_only=True` for any use case where you don't have full control of the loaded file. Please open an issue on GitHub for any issues related to this experimental feature.
  self.data, self.slices = torch.load(self.processed_paths[0])
