STDOUT:
Results will be saved in /home/philip/projects/ltspice_examples_code_repo/Circuit-Completion-Using-GNNs/component_classification_with_link_prediction_head/evaluation/FEGIN/results/model_FEGIN_dataset_ltspice_examples
Command line input: python main.py --data ltspice_examples --representation component_pin --model FEGIN --layers 5 --hiddens 32 --batch_size 32 --lr 0.0001 --emb_size 250 --epochs 100 --save_appendix component_pin_L5_H32_BS32_LR0.0001_E250 --no_val
 is saved.
-----
ltspice_examples - FEGIN
Using 5 layers, 32 hidden units, h = 2
Loading component_pin representation dataset
ENTERED
Training FEGIN on component_pin representation
Train: 3560, Test: 848
##################ITERATION #0 ****************************************
 epoch: 0, train_loss: 1.3900, test_loss: 1.3750, test_f1: 0.1431
 epoch: 1, train_loss: 1.3616, test_loss: 1.3501, test_f1: 0.2352
 epoch: 2, train_loss: 1.3295, test_loss: 1.3181, test_f1: 0.2317
 epoch: 3, train_loss: 1.2958, test_loss: 1.2881, test_f1: 0.2260
 epoch: 4, train_loss: 1.2684, test_loss: 1.2614, test_f1: 0.2262
 epoch: 5, train_loss: 1.2512, test_loss: 1.2405, test_f1: 0.2270
 epoch: 6, train_loss: 1.2390, test_loss: 1.2251, test_f1: 0.2297
 epoch: 7, train_loss: 1.2263, test_loss: 1.2120, test_f1: 0.2344
 epoch: 8, train_loss: 1.2132, test_loss: 1.1953, test_f1: 0.2343
 epoch: 9, train_loss: 1.2029, test_loss: 1.1845, test_f1: 0.2321
 epoch: 10, train_loss: 1.1917, test_loss: 1.1747, test_f1: 0.3141
 epoch: 11, train_loss: 1.1784, test_loss: 1.1604, test_f1: 0.3330
 epoch: 12, train_loss: 1.1693, test_loss: 1.1464, test_f1: 0.3381
 epoch: 13, train_loss: 1.1550, test_loss: 1.1293, test_f1: 0.3410
 epoch: 14, train_loss: 1.1311, test_loss: 1.1122, test_f1: 0.3417
 epoch: 15, train_loss: 1.1109, test_loss: 1.0821, test_f1: 0.3428
 epoch: 16, train_loss: 1.0944, test_loss: 1.0680, test_f1: 0.3391
 epoch: 17, train_loss: 1.0720, test_loss: 1.0515, test_f1: 0.3423
 epoch: 18, train_loss: 1.0467, test_loss: 1.0343, test_f1: 0.3427
 epoch: 19, train_loss: 1.0385, test_loss: 1.0266, test_f1: 0.3727
 epoch: 20, train_loss: 1.0241, test_loss: 1.0232, test_f1: 0.3757
 epoch: 21, train_loss: 1.0141, test_loss: 1.0167, test_f1: 0.3867
 epoch: 22, train_loss: 1.0070, test_loss: 1.0103, test_f1: 0.3800
 epoch: 23, train_loss: 0.9992, test_loss: 1.0104, test_f1: 0.4130
 epoch: 24, train_loss: 0.9923, test_loss: 1.0045, test_f1: 0.4636
 epoch: 25, train_loss: 0.9782, test_loss: 1.0021, test_f1: 0.4807
 epoch: 26, train_loss: 0.9773, test_loss: 1.0025, test_f1: 0.4764
 epoch: 27, train_loss: 0.9806, test_loss: 0.9951, test_f1: 0.4676
 epoch: 28, train_loss: 0.9743, test_loss: 0.9988, test_f1: 0.4735
 epoch: 29, train_loss: 0.9612, test_loss: 1.0037, test_f1: 0.4692
 epoch: 30, train_loss: 0.9659, test_loss: 0.9991, test_f1: 0.4691
 epoch: 31, train_loss: 0.9522, test_loss: 0.9762, test_f1: 0.4840
 epoch: 32, train_loss: 0.9568, test_loss: 0.9721, test_f1: 0.5051
 epoch: 33, train_loss: 0.9479, test_loss: 0.9723, test_f1: 0.4899
 epoch: 34, train_loss: 0.9422, test_loss: 0.9627, test_f1: 0.4908
 epoch: 35, train_loss: 0.9443, test_loss: 0.9715, test_f1: 0.4894
 epoch: 36, train_loss: 0.9339, test_loss: 0.9721, test_f1: 0.4734
 epoch: 37, train_loss: 0.9336, test_loss: 0.9642, test_f1: 0.4937
 epoch: 38, train_loss: 0.9270, test_loss: 0.9649, test_f1: 0.4819
 epoch: 39, train_loss: 0.9314, test_loss: 0.9600, test_f1: 0.4790
 epoch: 40, train_loss: 0.9276, test_loss: 0.9677, test_f1: 0.5051
 epoch: 41, train_loss: 0.9306, test_loss: 0.9674, test_f1: 0.4953
 epoch: 42, train_loss: 0.9163, test_loss: 0.9792, test_f1: 0.4835
 epoch: 43, train_loss: 0.9123, test_loss: 0.9550, test_f1: 0.5018
 epoch: 44, train_loss: 0.9032, test_loss: 0.9606, test_f1: 0.5020
 epoch: 45, train_loss: 0.9190, test_loss: 0.9527, test_f1: 0.5056
 epoch: 46, train_loss: 0.9101, test_loss: 0.9689, test_f1: 0.4931
 epoch: 47, train_loss: 0.8978, test_loss: 0.9566, test_f1: 0.4863
 epoch: 48, train_loss: 0.8999, test_loss: 0.9506, test_f1: 0.5011
 epoch: 49, train_loss: 0.9014, test_loss: 0.9411, test_f1: 0.5015
 epoch: 50, train_loss: 0.9013, test_loss: 0.9437, test_f1: 0.5175
 epoch: 51, train_loss: 0.8934, test_loss: 0.9512, test_f1: 0.4914
 epoch: 52, train_loss: 0.8882, test_loss: 0.9455, test_f1: 0.4919
 epoch: 53, train_loss: 0.8858, test_loss: 0.9272, test_f1: 0.4952
 epoch: 54, train_loss: 0.8827, test_loss: 0.9249, test_f1: 0.5125
 epoch: 55, train_loss: 0.8801, test_loss: 0.9361, test_f1: 0.4952
 epoch: 56, train_loss: 0.8816, test_loss: 0.9370, test_f1: 0.4926
 epoch: 57, train_loss: 0.8771, test_loss: 0.9364, test_f1: 0.5044
 epoch: 58, train_loss: 0.8808, test_loss: 0.9396, test_f1: 0.4907
 epoch: 59, train_loss: 0.8770, test_loss: 0.9340, test_f1: 0.4927
 epoch: 60, train_loss: 0.8800, test_loss: 0.9457, test_f1: 0.4917
 epoch: 61, train_loss: 0.8730, test_loss: 0.9336, test_f1: 0.5008
 epoch: 62, train_loss: 0.8689, test_loss: 0.9313, test_f1: 0.4903
 epoch: 63, train_loss: 0.8737, test_loss: 0.9307, test_f1: 0.4973
 epoch: 64, train_loss: 0.8694, test_loss: 0.9414, test_f1: 0.5058
 epoch: 65, train_loss: 0.8818, test_loss: 0.9294, test_f1: 0.4948
 epoch: 66, train_loss: 0.8729, test_loss: 0.9351, test_f1: 0.5017
 epoch: 67, train_loss: 0.8586, test_loss: 0.9468, test_f1: 0.4891
 epoch: 68, train_loss: 0.8737, test_loss: 0.9227, test_f1: 0.5053
 epoch: 69, train_loss: 0.8584, test_loss: 0.9186, test_f1: 0.5062
 epoch: 70, train_loss: 0.8638, test_loss: 0.9280, test_f1: 0.5016
 epoch: 71, train_loss: 0.8607, test_loss: 0.9062, test_f1: 0.5051
 epoch: 72, train_loss: 0.8662, test_loss: 0.9178, test_f1: 0.4908
 epoch: 73, train_loss: 0.8639, test_loss: 0.9042, test_f1: 0.5026
 epoch: 74, train_loss: 0.8627, test_loss: 0.9289, test_f1: 0.4896
 epoch: 75, train_loss: 0.8597, test_loss: 0.9476, test_f1: 0.4966
 epoch: 76, train_loss: 0.8688, test_loss: 0.9250, test_f1: 0.5022
 epoch: 77, train_loss: 0.8539, test_loss: 0.9222, test_f1: 0.5119
 epoch: 78, train_loss: 0.8472, test_loss: 0.9273, test_f1: 0.4973
 epoch: 79, train_loss: 0.8605, test_loss: 0.9224, test_f1: 0.5088
 epoch: 80, train_loss: 0.8479, test_loss: 0.9144, test_f1: 0.5104
 epoch: 81, train_loss: 0.8468, test_loss: 0.9197, test_f1: 0.5087
 epoch: 82, train_loss: 0.8474, test_loss: 0.9157, test_f1: 0.4995
 epoch: 83, train_loss: 0.8512, test_loss: 0.9326, test_f1: 0.4941
 epoch: 84, train_loss: 0.8480, test_loss: 0.9195, test_f1: 0.5081
 epoch: 85, train_loss: 0.8455, test_loss: 0.9048, test_f1: 0.5189
 epoch: 86, train_loss: 0.8443, test_loss: 0.9211, test_f1: 0.5091
 epoch: 87, train_loss: 0.8597, test_loss: 0.9205, test_f1: 0.5063
 epoch: 88, train_loss: 0.8395, test_loss: 0.9106, test_f1: 0.5049
 epoch: 89, train_loss: 0.8422, test_loss: 0.9180, test_f1: 0.5039
 epoch: 90, train_loss: 0.8441, test_loss: 0.9219, test_f1: 0.4974
 epoch: 91, train_loss: 0.8430, test_loss: 0.9070, test_f1: 0.5053
 epoch: 92, train_loss: 0.8300, test_loss: 0.9318, test_f1: 0.5033
 epoch: 93, train_loss: 0.8308, test_loss: 0.9323, test_f1: 0.5101
 epoch: 94, train_loss: 0.8326, test_loss: 0.9191, test_f1: 0.5075
 epoch: 95, train_loss: 0.8272, test_loss: 0.9404, test_f1: 0.4870
 epoch: 96, train_loss: 0.8351, test_loss: 0.9306, test_f1: 0.4941
 epoch: 97, train_loss: 0.8307, test_loss: 0.9238, test_f1: 0.5107
 epoch: 98, train_loss: 0.8221, test_loss: 0.8980, test_f1: 0.5239
 epoch: 99, train_loss: 0.8334, test_loss: 0.9341, test_f1: 0.5065
##################ITERATION #1 ****************************************
 epoch: 0, train_loss: 1.3263, test_loss: 1.2847, test_f1: 0.2260
 epoch: 1, train_loss: 1.2681, test_loss: 1.2334, test_f1: 0.2406
 epoch: 2, train_loss: 1.2332, test_loss: 1.1922, test_f1: 0.3186
 epoch: 3, train_loss: 1.2001, test_loss: 1.1593, test_f1: 0.3352
 epoch: 4, train_loss: 1.1672, test_loss: 1.1242, test_f1: 0.3407
 epoch: 5, train_loss: 1.1380, test_loss: 1.0985, test_f1: 0.3384
 epoch: 6, train_loss: 1.1152, test_loss: 1.0759, test_f1: 0.3383
 epoch: 7, train_loss: 1.1028, test_loss: 1.0558, test_f1: 0.3400
 epoch: 8, train_loss: 1.0803, test_loss: 1.0531, test_f1: 0.3424
 epoch: 9, train_loss: 1.0681, test_loss: 1.0490, test_f1: 0.3363
 epoch: 10, train_loss: 1.0551, test_loss: 1.0356, test_f1: 0.3501
 epoch: 11, train_loss: 1.0490, test_loss: 1.0452, test_f1: 0.3579
 epoch: 12, train_loss: 1.0395, test_loss: 1.0266, test_f1: 0.3842
 epoch: 13, train_loss: 1.0267, test_loss: 1.0157, test_f1: 0.4129
 epoch: 14, train_loss: 1.0269, test_loss: 1.0294, test_f1: 0.3910
 epoch: 15, train_loss: 1.0171, test_loss: 1.0222, test_f1: 0.4103
 epoch: 16, train_loss: 0.9982, test_loss: 1.0369, test_f1: 0.4651
 epoch: 17, train_loss: 1.0000, test_loss: 1.0143, test_f1: 0.4690
 epoch: 18, train_loss: 0.9911, test_loss: 1.0097, test_f1: 0.4725
 epoch: 19, train_loss: 0.9824, test_loss: 1.0110, test_f1: 0.4682
 epoch: 20, train_loss: 0.9810, test_loss: 1.0058, test_f1: 0.4620
 epoch: 21, train_loss: 0.9750, test_loss: 1.0038, test_f1: 0.4843
 epoch: 22, train_loss: 0.9682, test_loss: 0.9956, test_f1: 0.4987
 epoch: 23, train_loss: 0.9697, test_loss: 0.9966, test_f1: 0.4897
 epoch: 24, train_loss: 0.9561, test_loss: 1.0009, test_f1: 0.5062
 epoch: 25, train_loss: 0.9491, test_loss: 0.9866, test_f1: 0.5012
 epoch: 26, train_loss: 0.9540, test_loss: 0.9871, test_f1: 0.5047
 epoch: 27, train_loss: 0.9388, test_loss: 0.9842, test_f1: 0.4999
 epoch: 28, train_loss: 0.9381, test_loss: 0.9791, test_f1: 0.4994
 epoch: 29, train_loss: 0.9311, test_loss: 0.9715, test_f1: 0.4997
 epoch: 30, train_loss: 0.9296, test_loss: 0.9704, test_f1: 0.5096
 epoch: 31, train_loss: 0.9165, test_loss: 0.9754, test_f1: 0.5115
 epoch: 32, train_loss: 0.9241, test_loss: 0.9655, test_f1: 0.5127
 epoch: 33, train_loss: 0.9182, test_loss: 0.9414, test_f1: 0.5030
 epoch: 34, train_loss: 0.9081, test_loss: 0.9471, test_f1: 0.5201
 epoch: 35, train_loss: 0.9090, test_loss: 0.9458, test_f1: 0.5151
 epoch: 36, train_loss: 0.9032, test_loss: 0.9553, test_f1: 0.5063
 epoch: 37, train_loss: 0.9004, test_loss: 0.9595, test_f1: 0.5381
 epoch: 38, train_loss: 0.9014, test_loss: 0.9449, test_f1: 0.5146
 epoch: 39, train_loss: 0.8956, test_loss: 0.9462, test_f1: 0.5093
 epoch: 40, train_loss: 0.9051, test_loss: 0.9523, test_f1: 0.5198
 epoch: 41, train_loss: 0.8836, test_loss: 0.9195, test_f1: 0.5205
 epoch: 42, train_loss: 0.8860, test_loss: 0.9342, test_f1: 0.5234
 epoch: 43, train_loss: 0.8859, test_loss: 0.9451, test_f1: 0.5232
 epoch: 44, train_loss: 0.8863, test_loss: 0.9296, test_f1: 0.5152
 epoch: 45, train_loss: 0.8841, test_loss: 0.9071, test_f1: 0.5155
 epoch: 46, train_loss: 0.8768, test_loss: 0.8888, test_f1: 0.5259
 epoch: 47, train_loss: 0.8797, test_loss: 0.9174, test_f1: 0.5212
 epoch: 48, train_loss: 0.8693, test_loss: 0.9149, test_f1: 0.5210
 epoch: 49, train_loss: 0.8673, test_loss: 0.9008, test_f1: 0.5241
 epoch: 50, train_loss: 0.8634, test_loss: 0.8865, test_f1: 0.5450
 epoch: 51, train_loss: 0.8519, test_loss: 0.9108, test_f1: 0.5450
 epoch: 52, train_loss: 0.8559, test_loss: 0.9051, test_f1: 0.5267
 epoch: 53, train_loss: 0.8592, test_loss: 0.8946, test_f1: 0.5467
 epoch: 54, train_loss: 0.8627, test_loss: 0.9156, test_f1: 0.5067
 epoch: 55, train_loss: 0.8588, test_loss: 0.8772, test_f1: 0.5411
 epoch: 56, train_loss: 0.8537, test_loss: 0.8818, test_f1: 0.5353
 epoch: 57, train_loss: 0.8438, test_loss: 0.8802, test_f1: 0.5459
 epoch: 58, train_loss: 0.8534, test_loss: 0.8912, test_f1: 0.5340
 epoch: 59, train_loss: 0.8523, test_loss: 0.9020, test_f1: 0.5292
 epoch: 60, train_loss: 0.8534, test_loss: 0.9193, test_f1: 0.5410
 epoch: 61, train_loss: 0.8551, test_loss: 0.8865, test_f1: 0.5287
 epoch: 62, train_loss: 0.8580, test_loss: 0.8551, test_f1: 0.5382
 epoch: 63, train_loss: 0.8593, test_loss: 0.8702, test_f1: 0.5244
 epoch: 64, train_loss: 0.8468, test_loss: 0.8955, test_f1: 0.5274
 epoch: 65, train_loss: 0.8373, test_loss: 0.8746, test_f1: 0.5577
 epoch: 66, train_loss: 0.8482, test_loss: 0.8742, test_f1: 0.5314
 epoch: 67, train_loss: 0.8469, test_loss: 0.8697, test_f1: 0.5424
 epoch: 68, train_loss: 0.8391, test_loss: 0.8922, test_f1: 0.5368
 epoch: 69, train_loss: 0.8418, test_loss: 0.8867, test_f1: 0.5432
 epoch: 70, train_loss: 0.8502, test_loss: 0.8805, test_f1: 0.5555
 epoch: 71, train_loss: 0.8447, test_loss: 0.8838, test_f1: 0.5348
 epoch: 72, train_loss: 0.8417, test_loss: 0.8599, test_f1: 0.5433
 epoch: 73, train_loss: 0.8376, test_loss: 0.8686, test_f1: 0.5538
 epoch: 74, train_loss: 0.8403, test_loss: 0.8576, test_f1: 0.5433
 epoch: 75, train_loss: 0.8329, test_loss: 0.8757, test_f1: 0.5359
 epoch: 76, train_loss: 0.8331, test_loss: 0.8747, test_f1: 0.5404
 epoch: 77, train_loss: 0.8306, test_loss: 0.8740, test_f1: 0.5323
 epoch: 78, train_loss: 0.8377, test_loss: 0.8878, test_f1: 0.5460
 epoch: 79, train_loss: 0.8390, test_loss: 0.8819, test_f1: 0.5322
 epoch: 80, train_loss: 0.8354, test_loss: 0.8653, test_f1: 0.5343
 epoch: 81, train_loss: 0.8309, test_loss: 0.8784, test_f1: 0.5342
 epoch: 82, train_loss: 0.8365, test_loss: 0.8732, test_f1: 0.5364
 epoch: 83, train_loss: 0.8392, test_loss: 0.8696, test_f1: 0.5361
 epoch: 84, train_loss: 0.8310, test_loss: 0.8818, test_f1: 0.5384
 epoch: 85, train_loss: 0.8301, test_loss: 0.8663, test_f1: 0.5417
 epoch: 86, train_loss: 0.8302, test_loss: 0.8774, test_f1: 0.5277
 epoch: 87, train_loss: 0.8276, test_loss: 0.8814, test_f1: 0.5430
 epoch: 88, train_loss: 0.8276, test_loss: 0.8810, test_f1: 0.5334
 epoch: 89, train_loss: 0.8302, test_loss: 0.8816, test_f1: 0.5334
 epoch: 90, train_loss: 0.8275, test_loss: 0.8860, test_f1: 0.5327
 epoch: 91, train_loss: 0.8153, test_loss: 0.8574, test_f1: 0.5548
 epoch: 92, train_loss: 0.8180, test_loss: 0.8746, test_f1: 0.5378
 epoch: 93, train_loss: 0.8278, test_loss: 0.8959, test_f1: 0.5160
 epoch: 94, train_loss: 0.8256, test_loss: 0.8564, test_f1: 0.5392
 epoch: 95, train_loss: 0.8244, test_loss: 0.9108, test_f1: 0.5371
 epoch: 96, train_loss: 0.8248, test_loss: 0.8760, test_f1: 0.5302
 epoch: 97, train_loss: 0.8198, test_loss: 0.8729, test_f1: 0.5356
 epoch: 98, train_loss: 0.8334, test_loss: 0.8929, test_f1: 0.5467
 epoch: 99, train_loss: 0.8090, test_loss: 0.9009, test_f1: 0.5453
##################ITERATION #2 ****************************************
 epoch: 0, train_loss: 1.2923, test_loss: 1.2506, test_f1: 0.2260
 epoch: 1, train_loss: 1.2457, test_loss: 1.2045, test_f1: 0.3186
 epoch: 2, train_loss: 1.2085, test_loss: 1.1654, test_f1: 0.3437
 epoch: 3, train_loss: 1.1744, test_loss: 1.1236, test_f1: 0.3364
 epoch: 4, train_loss: 1.1492, test_loss: 1.0972, test_f1: 0.3506
 epoch: 5, train_loss: 1.1188, test_loss: 1.0739, test_f1: 0.3840
 epoch: 6, train_loss: 1.1020, test_loss: 1.0601, test_f1: 0.3936
 epoch: 7, train_loss: 1.0839, test_loss: 1.0485, test_f1: 0.3967
 epoch: 8, train_loss: 1.0736, test_loss: 1.0478, test_f1: 0.4333
 epoch: 9, train_loss: 1.0608, test_loss: 1.0457, test_f1: 0.4338
 epoch: 10, train_loss: 1.0565, test_loss: 1.0405, test_f1: 0.4511
 epoch: 11, train_loss: 1.0351, test_loss: 1.0393, test_f1: 0.4493
 epoch: 12, train_loss: 1.0371, test_loss: 1.0391, test_f1: 0.4536
 epoch: 13, train_loss: 1.0351, test_loss: 1.0452, test_f1: 0.4552
 epoch: 14, train_loss: 1.0273, test_loss: 1.0380, test_f1: 0.4542
 epoch: 15, train_loss: 1.0182, test_loss: 1.0440, test_f1: 0.4658
 epoch: 16, train_loss: 1.0147, test_loss: 1.0326, test_f1: 0.4624
 epoch: 17, train_loss: 1.0119, test_loss: 1.0426, test_f1: 0.4707
 epoch: 18, train_loss: 1.0006, test_loss: 1.0345, test_f1: 0.4698
 epoch: 19, train_loss: 1.0124, test_loss: 1.0283, test_f1: 0.4662
 epoch: 20, train_loss: 1.0024, test_loss: 1.0455, test_f1: 0.4882
 epoch: 21, train_loss: 0.9962, test_loss: 1.0389, test_f1: 0.4750
 epoch: 22, train_loss: 0.9923, test_loss: 1.0325, test_f1: 0.4643
 epoch: 23, train_loss: 0.9797, test_loss: 1.0303, test_f1: 0.4928
 epoch: 24, train_loss: 0.9807, test_loss: 1.0312, test_f1: 0.4853
 epoch: 25, train_loss: 0.9780, test_loss: 1.0302, test_f1: 0.4910
 epoch: 26, train_loss: 0.9782, test_loss: 1.0281, test_f1: 0.4715
 epoch: 27, train_loss: 0.9724, test_loss: 1.0285, test_f1: 0.5022
 epoch: 28, train_loss: 0.9742, test_loss: 1.0296, test_f1: 0.4892
 epoch: 29, train_loss: 0.9581, test_loss: 1.0174, test_f1: 0.4874
 epoch: 30, train_loss: 0.9633, test_loss: 1.0247, test_f1: 0.4948
 epoch: 31, train_loss: 0.9591, test_loss: 1.0232, test_f1: 0.5017
 epoch: 32, train_loss: 0.9523, test_loss: 1.0310, test_f1: 0.4939
 epoch: 33, train_loss: 0.9661, test_loss: 1.0150, test_f1: 0.4882
 epoch: 34, train_loss: 0.9529, test_loss: 1.0042, test_f1: 0.4914
 epoch: 35, train_loss: 0.9552, test_loss: 1.0037, test_f1: 0.5021
 epoch: 36, train_loss: 0.9350, test_loss: 0.9939, test_f1: 0.5145
 epoch: 37, train_loss: 0.9403, test_loss: 1.0192, test_f1: 0.5004
 epoch: 38, train_loss: 0.9384, test_loss: 0.9945, test_f1: 0.5043
 epoch: 39, train_loss: 0.9348, test_loss: 0.9929, test_f1: 0.4948
 epoch: 40, train_loss: 0.9425, test_loss: 0.9988, test_f1: 0.5214
 epoch: 41, train_loss: 0.9321, test_loss: 0.9993, test_f1: 0.5034
 epoch: 42, train_loss: 0.9294, test_loss: 0.9972, test_f1: 0.5245
 epoch: 43, train_loss: 0.9153, test_loss: 0.9974, test_f1: 0.4854
 epoch: 44, train_loss: 0.9183, test_loss: 0.9925, test_f1: 0.5154
 epoch: 45, train_loss: 0.9182, test_loss: 0.9908, test_f1: 0.5085
 epoch: 46, train_loss: 0.9124, test_loss: 0.9931, test_f1: 0.5152
 epoch: 47, train_loss: 0.9147, test_loss: 0.9907, test_f1: 0.5090
 epoch: 48, train_loss: 0.9137, test_loss: 1.0065, test_f1: 0.4938
 epoch: 49, train_loss: 0.9046, test_loss: 0.9828, test_f1: 0.5124
 epoch: 50, train_loss: 0.9070, test_loss: 0.9813, test_f1: 0.4856
 epoch: 51, train_loss: 0.8917, test_loss: 0.9840, test_f1: 0.5266
 epoch: 52, train_loss: 0.8903, test_loss: 0.9634, test_f1: 0.5024
 epoch: 53, train_loss: 0.9035, test_loss: 0.9712, test_f1: 0.5255
 epoch: 54, train_loss: 0.9013, test_loss: 0.9745, test_f1: 0.5057
 epoch: 55, train_loss: 0.9015, test_loss: 0.9804, test_f1: 0.5069
 epoch: 56, train_loss: 0.8908, test_loss: 0.9937, test_f1: 0.5253
 epoch: 57, train_loss: 0.8904, test_loss: 0.9627, test_f1: 0.5248
 epoch: 58, train_loss: 0.8877, test_loss: 0.9726, test_f1: 0.5256
 epoch: 59, train_loss: 0.8973, test_loss: 0.9739, test_f1: 0.5167
 epoch: 60, train_loss: 0.8834, test_loss: 0.9725, test_f1: 0.5237
 epoch: 61, train_loss: 0.8931, test_loss: 0.9593, test_f1: 0.5196
 epoch: 62, train_loss: 0.8856, test_loss: 0.9615, test_f1: 0.5251
 epoch: 63, train_loss: 0.8807, test_loss: 0.9485, test_f1: 0.5223
 epoch: 64, train_loss: 0.8845, test_loss: 0.9662, test_f1: 0.5330
 epoch: 65, train_loss: 0.8833, test_loss: 0.9549, test_f1: 0.5404
 epoch: 66, train_loss: 0.8874, test_loss: 0.9665, test_f1: 0.5346
 epoch: 67, train_loss: 0.8986, test_loss: 0.9538, test_f1: 0.5155
 epoch: 68, train_loss: 0.8736, test_loss: 0.9526, test_f1: 0.5175
 epoch: 69, train_loss: 0.8775, test_loss: 0.9556, test_f1: 0.5261
 epoch: 70, train_loss: 0.8785, test_loss: 0.9537, test_f1: 0.5341
 epoch: 71, train_loss: 0.8753, test_loss: 0.9519, test_f1: 0.5387
 epoch: 72, train_loss: 0.8757, test_loss: 0.9527, test_f1: 0.5275
 epoch: 73, train_loss: 0.8771, test_loss: 0.9553, test_f1: 0.5395
 epoch: 74, train_loss: 0.8771, test_loss: 0.9566, test_f1: 0.5289
 epoch: 75, train_loss: 0.8698, test_loss: 0.9443, test_f1: 0.5279
 epoch: 76, train_loss: 0.8750, test_loss: 0.9764, test_f1: 0.5296
 epoch: 77, train_loss: 0.8751, test_loss: 0.9692, test_f1: 0.5337
 epoch: 78, train_loss: 0.8651, test_loss: 0.9533, test_f1: 0.5115
 epoch: 79, train_loss: 0.8642, test_loss: 0.9599, test_f1: 0.5328
 epoch: 80, train_loss: 0.8673, test_loss: 0.9712, test_f1: 0.5154
 epoch: 81, train_loss: 0.8618, test_loss: 0.9604, test_f1: 0.5337
 epoch: 82, train_loss: 0.8715, test_loss: 0.9534, test_f1: 0.5324
 epoch: 83, train_loss: 0.8657, test_loss: 0.9475, test_f1: 0.5405
 epoch: 84, train_loss: 0.8628, test_loss: 0.9499, test_f1: 0.5343
 epoch: 85, train_loss: 0.8663, test_loss: 0.9559, test_f1: 0.5301
 epoch: 86, train_loss: 0.8744, test_loss: 0.9693, test_f1: 0.5279
 epoch: 87, train_loss: 0.8670, test_loss: 0.9456, test_f1: 0.5115
 epoch: 88, train_loss: 0.8720, test_loss: 0.9592, test_f1: 0.5241
 epoch: 89, train_loss: 0.8587, test_loss: 0.9581, test_f1: 0.5307
 epoch: 90, train_loss: 0.8649, test_loss: 0.9482, test_f1: 0.5374
 epoch: 91, train_loss: 0.8562, test_loss: 0.9556, test_f1: 0.5473
 epoch: 92, train_loss: 0.8586, test_loss: 0.9574, test_f1: 0.5378
 epoch: 93, train_loss: 0.8521, test_loss: 0.9573, test_f1: 0.5468
 epoch: 94, train_loss: 0.8587, test_loss: 0.9437, test_f1: 0.5367
 epoch: 95, train_loss: 0.8580, test_loss: 0.9430, test_f1: 0.5360
 epoch: 96, train_loss: 0.8496, test_loss: 0.9355, test_f1: 0.5408
 epoch: 97, train_loss: 0.8603, test_loss: 0.9491, test_f1: 0.5571
 epoch: 98, train_loss: 0.8507, test_loss: 0.9477, test_f1: 0.5452
 epoch: 99, train_loss: 0.8473, test_loss: 0.9594, test_f1: 0.5520
##################ITERATION #3 ****************************************
 epoch: 0, train_loss: 1.2704, test_loss: 1.2100, test_f1: 0.2686
 epoch: 1, train_loss: 1.2197, test_loss: 1.1755, test_f1: 0.3329
 epoch: 2, train_loss: 1.1886, test_loss: 1.1380, test_f1: 0.3456
 epoch: 3, train_loss: 1.1575, test_loss: 1.1032, test_f1: 0.4044
 epoch: 4, train_loss: 1.1308, test_loss: 1.0856, test_f1: 0.4112
 epoch: 5, train_loss: 1.1121, test_loss: 1.0616, test_f1: 0.4287
 epoch: 6, train_loss: 1.0894, test_loss: 1.0499, test_f1: 0.4093
 epoch: 7, train_loss: 1.0740, test_loss: 1.0369, test_f1: 0.4647
 epoch: 8, train_loss: 1.0537, test_loss: 1.0278, test_f1: 0.4728
 epoch: 9, train_loss: 1.0467, test_loss: 1.0240, test_f1: 0.4545
 epoch: 10, train_loss: 1.0244, test_loss: 1.0223, test_f1: 0.4507
 epoch: 11, train_loss: 1.0262, test_loss: 1.0011, test_f1: 0.4777
 epoch: 12, train_loss: 1.0125, test_loss: 1.0129, test_f1: 0.4751
 epoch: 13, train_loss: 1.0031, test_loss: 0.9829, test_f1: 0.4736
 epoch: 14, train_loss: 0.9979, test_loss: 0.9832, test_f1: 0.4751
 epoch: 15, train_loss: 0.9929, test_loss: 0.9868, test_f1: 0.4747
 epoch: 16, train_loss: 0.9821, test_loss: 0.9877, test_f1: 0.4743
 epoch: 17, train_loss: 0.9795, test_loss: 0.9868, test_f1: 0.4809
 epoch: 18, train_loss: 0.9701, test_loss: 0.9977, test_f1: 0.4769
 epoch: 19, train_loss: 0.9723, test_loss: 0.9930, test_f1: 0.4937
 epoch: 20, train_loss: 0.9612, test_loss: 0.9891, test_f1: 0.4914
 epoch: 21, train_loss: 0.9613, test_loss: 0.9878, test_f1: 0.4976
 epoch: 22, train_loss: 0.9598, test_loss: 0.9697, test_f1: 0.4780
 epoch: 23, train_loss: 0.9568, test_loss: 0.9837, test_f1: 0.4892
 epoch: 24, train_loss: 0.9439, test_loss: 0.9793, test_f1: 0.4879
 epoch: 25, train_loss: 0.9415, test_loss: 1.0076, test_f1: 0.4850
 epoch: 26, train_loss: 0.9459, test_loss: 0.9844, test_f1: 0.4969
 epoch: 27, train_loss: 0.9337, test_loss: 0.9830, test_f1: 0.4937
 epoch: 28, train_loss: 0.9411, test_loss: 0.9597, test_f1: 0.4951
 epoch: 29, train_loss: 0.9335, test_loss: 1.0145, test_f1: 0.4808
 epoch: 30, train_loss: 0.9286, test_loss: 0.9765, test_f1: 0.5072
 epoch: 31, train_loss: 0.9291, test_loss: 0.9945, test_f1: 0.4946
 epoch: 32, train_loss: 0.9227, test_loss: 0.9553, test_f1: 0.5079
 epoch: 33, train_loss: 0.9203, test_loss: 1.0068, test_f1: 0.4845
 epoch: 34, train_loss: 0.9179, test_loss: 0.9772, test_f1: 0.5023
 epoch: 35, train_loss: 0.9089, test_loss: 0.9697, test_f1: 0.4958
 epoch: 36, train_loss: 0.9132, test_loss: 0.9641, test_f1: 0.5223
 epoch: 37, train_loss: 0.9067, test_loss: 0.9792, test_f1: 0.5093
 epoch: 38, train_loss: 0.9067, test_loss: 0.9644, test_f1: 0.5163
 epoch: 39, train_loss: 0.9084, test_loss: 0.9614, test_f1: 0.5095
 epoch: 40, train_loss: 0.8997, test_loss: 0.9631, test_f1: 0.5041
 epoch: 41, train_loss: 0.8953, test_loss: 1.0004, test_f1: 0.5197
 epoch: 42, train_loss: 0.8941, test_loss: 0.9718, test_f1: 0.5074
 epoch: 43, train_loss: 0.8961, test_loss: 0.9758, test_f1: 0.5002
 epoch: 44, train_loss: 0.8883, test_loss: 0.9974, test_f1: 0.4944
 epoch: 45, train_loss: 0.8948, test_loss: 0.9711, test_f1: 0.5113
 epoch: 46, train_loss: 0.8905, test_loss: 0.9705, test_f1: 0.5135
 epoch: 47, train_loss: 0.8938, test_loss: 0.9748, test_f1: 0.5208
 epoch: 48, train_loss: 0.8813, test_loss: 0.9639, test_f1: 0.5210
 epoch: 49, train_loss: 0.8743, test_loss: 1.0269, test_f1: 0.5156
 epoch: 50, train_loss: 0.8832, test_loss: 0.9895, test_f1: 0.5048
 epoch: 51, train_loss: 0.8634, test_loss: 1.0203, test_f1: 0.5324
 epoch: 52, train_loss: 0.8740, test_loss: 1.0178, test_f1: 0.5353
 epoch: 53, train_loss: 0.8680, test_loss: 0.9455, test_f1: 0.5238
 epoch: 54, train_loss: 0.8649, test_loss: 0.9941, test_f1: 0.5320
 epoch: 55, train_loss: 0.8710, test_loss: 1.0311, test_f1: 0.5251
 epoch: 56, train_loss: 0.8659, test_loss: 1.0131, test_f1: 0.5360
 epoch: 57, train_loss: 0.8614, test_loss: 0.9995, test_f1: 0.5257
 epoch: 58, train_loss: 0.8615, test_loss: 1.0198, test_f1: 0.5099
 epoch: 59, train_loss: 0.8712, test_loss: 1.0101, test_f1: 0.5255
 epoch: 60, train_loss: 0.8465, test_loss: 0.9596, test_f1: 0.5298
 epoch: 61, train_loss: 0.8631, test_loss: 0.9863, test_f1: 0.5130
 epoch: 62, train_loss: 0.8558, test_loss: 0.9650, test_f1: 0.5278
 epoch: 63, train_loss: 0.8680, test_loss: 1.0120, test_f1: 0.5325
 epoch: 64, train_loss: 0.8589, test_loss: 0.9645, test_f1: 0.5174
 epoch: 65, train_loss: 0.8527, test_loss: 0.9960, test_f1: 0.5362
 epoch: 66, train_loss: 0.8437, test_loss: 0.9852, test_f1: 0.5134
 epoch: 67, train_loss: 0.8581, test_loss: 0.9910, test_f1: 0.5250
 epoch: 68, train_loss: 0.8501, test_loss: 1.0059, test_f1: 0.5278
 epoch: 69, train_loss: 0.8477, test_loss: 0.9640, test_f1: 0.5142
 epoch: 70, train_loss: 0.8465, test_loss: 0.9946, test_f1: 0.5145
 epoch: 71, train_loss: 0.8514, test_loss: 1.0301, test_f1: 0.5289
 epoch: 72, train_loss: 0.8415, test_loss: 1.0001, test_f1: 0.5157
 epoch: 73, train_loss: 0.8373, test_loss: 1.0030, test_f1: 0.5179
 epoch: 74, train_loss: 0.8471, test_loss: 0.9999, test_f1: 0.5226
 epoch: 75, train_loss: 0.8463, test_loss: 1.0344, test_f1: 0.5360
 epoch: 76, train_loss: 0.8427, test_loss: 0.9720, test_f1: 0.5231
 epoch: 77, train_loss: 0.8398, test_loss: 1.0037, test_f1: 0.5172
 epoch: 78, train_loss: 0.8358, test_loss: 0.9918, test_f1: 0.5300
 epoch: 79, train_loss: 0.8422, test_loss: 0.9874, test_f1: 0.5198
 epoch: 80, train_loss: 0.8390, test_loss: 0.9313, test_f1: 0.5374
 epoch: 81, train_loss: 0.8399, test_loss: 0.9906, test_f1: 0.5239
 epoch: 82, train_loss: 0.8391, test_loss: 0.9654, test_f1: 0.5207
 epoch: 83, train_loss: 0.8342, test_loss: 1.0186, test_f1: 0.5373
 epoch: 84, train_loss: 0.8370, test_loss: 1.0003, test_f1: 0.5070
 epoch: 85, train_loss: 0.8268, test_loss: 1.0440, test_f1: 0.5249
 epoch: 86, train_loss: 0.8293, test_loss: 0.9954, test_f1: 0.5213
 epoch: 87, train_loss: 0.8289, test_loss: 1.0113, test_f1: 0.5328
 epoch: 88, train_loss: 0.8406, test_loss: 0.9876, test_f1: 0.5190
 epoch: 89, train_loss: 0.8253, test_loss: 1.0001, test_f1: 0.4991
 epoch: 90, train_loss: 0.8282, test_loss: 1.0829, test_f1: 0.5270
 epoch: 91, train_loss: 0.8228, test_loss: 1.0116, test_f1: 0.5178
 epoch: 92, train_loss: 0.8266, test_loss: 1.0091, test_f1: 0.5404
 epoch: 93, train_loss: 0.8222, test_loss: 1.0530, test_f1: 0.5131
 epoch: 94, train_loss: 0.8277, test_loss: 1.0380, test_f1: 0.5092
 epoch: 95, train_loss: 0.8192, test_loss: 1.0209, test_f1: 0.5143
 epoch: 96, train_loss: 0.8280, test_loss: 0.9887, test_f1: 0.5593
 epoch: 97, train_loss: 0.8248, test_loss: 1.0116, test_f1: 0.5225
 epoch: 98, train_loss: 0.8210, test_loss: 0.9638, test_f1: 0.5182
 epoch: 99, train_loss: 0.8249, test_loss: 1.0677, test_f1: 0.5139
##################ITERATION #4 ****************************************
 epoch: 0, train_loss: 1.2865, test_loss: 1.2549, test_f1: 0.2260
 epoch: 1, train_loss: 1.2512, test_loss: 1.2324, test_f1: 0.2260
 epoch: 2, train_loss: 1.2346, test_loss: 1.2254, test_f1: 0.2356
 epoch: 3, train_loss: 1.2197, test_loss: 1.1884, test_f1: 0.2830
 epoch: 4, train_loss: 1.1997, test_loss: 1.1528, test_f1: 0.3940
 epoch: 5, train_loss: 1.1789, test_loss: 1.1248, test_f1: 0.4110
 epoch: 6, train_loss: 1.1548, test_loss: 1.1073, test_f1: 0.4213
 epoch: 7, train_loss: 1.1346, test_loss: 1.0980, test_f1: 0.4071
 epoch: 8, train_loss: 1.1178, test_loss: 1.0829, test_f1: 0.4335
 epoch: 9, train_loss: 1.1014, test_loss: 1.0808, test_f1: 0.4331
 epoch: 10, train_loss: 1.0841, test_loss: 1.0677, test_f1: 0.4407
 epoch: 11, train_loss: 1.0738, test_loss: 1.0619, test_f1: 0.4221
 epoch: 12, train_loss: 1.0650, test_loss: 1.0537, test_f1: 0.4396
 epoch: 13, train_loss: 1.0650, test_loss: 1.0512, test_f1: 0.4388
 epoch: 14, train_loss: 1.0481, test_loss: 1.0454, test_f1: 0.4440
 epoch: 15, train_loss: 1.0432, test_loss: 1.0396, test_f1: 0.4330
 epoch: 16, train_loss: 1.0363, test_loss: 1.0252, test_f1: 0.4568
 epoch: 17, train_loss: 1.0305, test_loss: 1.0273, test_f1: 0.4678
 epoch: 18, train_loss: 1.0235, test_loss: 1.0386, test_f1: 0.4582
 epoch: 19, train_loss: 1.0217, test_loss: 1.0222, test_f1: 0.4559
 epoch: 20, train_loss: 1.0166, test_loss: 1.0228, test_f1: 0.4618
 epoch: 21, train_loss: 1.0061, test_loss: 1.0133, test_f1: 0.4750
 epoch: 22, train_loss: 1.0019, test_loss: 1.0140, test_f1: 0.4794
 epoch: 23, train_loss: 0.9880, test_loss: 1.0238, test_f1: 0.4701
 epoch: 24, train_loss: 0.9952, test_loss: 1.0189, test_f1: 0.4579
 epoch: 25, train_loss: 0.9862, test_loss: 1.0088, test_f1: 0.4603
 epoch: 26, train_loss: 0.9911, test_loss: 1.0107, test_f1: 0.4710
 epoch: 27, train_loss: 0.9760, test_loss: 1.0019, test_f1: 0.4704
 epoch: 28, train_loss: 0.9805, test_loss: 0.9953, test_f1: 0.4718
 epoch: 29, train_loss: 0.9760, test_loss: 0.9888, test_f1: 0.4827
 epoch: 30, train_loss: 0.9688, test_loss: 0.9953, test_f1: 0.4810
 epoch: 31, train_loss: 0.9689, test_loss: 0.9866, test_f1: 0.4830
 epoch: 32, train_loss: 0.9563, test_loss: 0.9908, test_f1: 0.4755
 epoch: 33, train_loss: 0.9608, test_loss: 0.9688, test_f1: 0.4996
 epoch: 34, train_loss: 0.9486, test_loss: 0.9773, test_f1: 0.4822
 epoch: 35, train_loss: 0.9551, test_loss: 0.9858, test_f1: 0.4867
 epoch: 36, train_loss: 0.9470, test_loss: 0.9867, test_f1: 0.4933
 epoch: 37, train_loss: 0.9468, test_loss: 0.9905, test_f1: 0.4997
 epoch: 38, train_loss: 0.9359, test_loss: 0.9832, test_f1: 0.5053
 epoch: 39, train_loss: 0.9317, test_loss: 0.9872, test_f1: 0.4916
 epoch: 40, train_loss: 0.9307, test_loss: 0.9804, test_f1: 0.5043
 epoch: 41, train_loss: 0.9328, test_loss: 0.9768, test_f1: 0.5068
 epoch: 42, train_loss: 0.9278, test_loss: 0.9756, test_f1: 0.5106
 epoch: 43, train_loss: 0.9202, test_loss: 0.9751, test_f1: 0.4941
 epoch: 44, train_loss: 0.9202, test_loss: 0.9730, test_f1: 0.5030
 epoch: 45, train_loss: 0.9086, test_loss: 0.9637, test_f1: 0.5054
 epoch: 46, train_loss: 0.9187, test_loss: 0.9561, test_f1: 0.4982
 epoch: 47, train_loss: 0.9151, test_loss: 0.9594, test_f1: 0.5090
 epoch: 48, train_loss: 0.9102, test_loss: 0.9570, test_f1: 0.4992
 epoch: 49, train_loss: 0.9011, test_loss: 0.9605, test_f1: 0.5179
 epoch: 50, train_loss: 0.9104, test_loss: 0.9540, test_f1: 0.5344
 epoch: 51, train_loss: 0.9053, test_loss: 0.9726, test_f1: 0.5094
 epoch: 52, train_loss: 0.8990, test_loss: 0.9578, test_f1: 0.5052
 epoch: 53, train_loss: 0.9010, test_loss: 0.9489, test_f1: 0.5079
 epoch: 54, train_loss: 0.8964, test_loss: 0.9452, test_f1: 0.5154
 epoch: 55, train_loss: 0.8974, test_loss: 0.9539, test_f1: 0.5066
 epoch: 56, train_loss: 0.8979, test_loss: 0.9612, test_f1: 0.5039
 epoch: 57, train_loss: 0.8956, test_loss: 0.9594, test_f1: 0.4944
 epoch: 58, train_loss: 0.8913, test_loss: 0.9628, test_f1: 0.5128
 epoch: 59, train_loss: 0.8911, test_loss: 0.9595, test_f1: 0.5043
 epoch: 60, train_loss: 0.8917, test_loss: 0.9670, test_f1: 0.5153
 epoch: 61, train_loss: 0.8902, test_loss: 0.9775, test_f1: 0.5257
 epoch: 62, train_loss: 0.8855, test_loss: 0.9793, test_f1: 0.5150
 epoch: 63, train_loss: 0.8948, test_loss: 0.9649, test_f1: 0.5083
 epoch: 64, train_loss: 0.8897, test_loss: 0.9612, test_f1: 0.5156
 epoch: 65, train_loss: 0.8899, test_loss: 0.9735, test_f1: 0.4968
 epoch: 66, train_loss: 0.8821, test_loss: 0.9826, test_f1: 0.5156
 epoch: 67, train_loss: 0.8814, test_loss: 0.9742, test_f1: 0.5231
 epoch: 68, train_loss: 0.8826, test_loss: 0.9756, test_f1: 0.5225
 epoch: 69, train_loss: 0.8823, test_loss: 0.9735, test_f1: 0.5213
 epoch: 70, train_loss: 0.8767, test_loss: 0.9725, test_f1: 0.5247
 epoch: 71, train_loss: 0.8752, test_loss: 0.9751, test_f1: 0.5069
 epoch: 72, train_loss: 0.8839, test_loss: 0.9822, test_f1: 0.5286
 epoch: 73, train_loss: 0.8747, test_loss: 0.9827, test_f1: 0.5096
 epoch: 74, train_loss: 0.8787, test_loss: 0.9746, test_f1: 0.5302
 epoch: 75, train_loss: 0.8761, test_loss: 0.9486, test_f1: 0.5062
 epoch: 76, train_loss: 0.8747, test_loss: 0.9793, test_f1: 0.5100
 epoch: 77, train_loss: 0.8777, test_loss: 0.9726, test_f1: 0.5055
 epoch: 78, train_loss: 0.8696, test_loss: 0.9839, test_f1: 0.5043
 epoch: 79, train_loss: 0.8674, test_loss: 0.9788, test_f1: 0.5044
 epoch: 80, train_loss: 0.8695, test_loss: 0.9923, test_f1: 0.5098
 epoch: 81, train_loss: 0.8659, test_loss: 0.9832, test_f1: 0.5132
 epoch: 82, train_loss: 0.8619, test_loss: 0.9810, test_f1: 0.4975
 epoch: 83, train_loss: 0.8601, test_loss: 0.9870, test_f1: 0.5139
 epoch: 84, train_loss: 0.8693, test_loss: 0.9828, test_f1: 0.5108
 epoch: 85, train_loss: 0.8698, test_loss: 0.9924, test_f1: 0.5203
 epoch: 86, train_loss: 0.8563, test_loss: 0.9859, test_f1: 0.5089
 epoch: 87, train_loss: 0.8623, test_loss: 0.9799, test_f1: 0.5125
 epoch: 88, train_loss: 0.8631, test_loss: 0.9994, test_f1: 0.5119
 epoch: 89, train_loss: 0.8542, test_loss: 1.0141, test_f1: 0.5254
 epoch: 90, train_loss: 0.8616, test_loss: 0.9868, test_f1: 0.4979
 epoch: 91, train_loss: 0.8627, test_loss: 0.9919, test_f1: 0.5264
 epoch: 92, train_loss: 0.8633, test_loss: 0.9896, test_f1: 0.5122
 epoch: 93, train_loss: 0.8437, test_loss: 0.9953, test_f1: 0.5138
 epoch: 94, train_loss: 0.8537, test_loss: 0.9825, test_f1: 0.5058
 epoch: 95, train_loss: 0.8538, test_loss: 0.9644, test_f1: 0.5336
 epoch: 96, train_loss: 0.8494, test_loss: 0.9645, test_f1: 0.5245
 epoch: 97, train_loss: 0.8446, test_loss: 1.0028, test_f1: 0.5097
 epoch: 98, train_loss: 0.8588, test_loss: 0.9825, test_f1: 0.5049
 epoch: 99, train_loss: 0.8526, test_loss: 0.9737, test_f1: 0.5066
##################ITERATION #5 ****************************************
 epoch: 0, train_loss: 1.2895, test_loss: 1.2133, test_f1: 0.2737
 epoch: 1, train_loss: 1.2106, test_loss: 1.1674, test_f1: 0.4075
 epoch: 2, train_loss: 1.1733, test_loss: 1.1264, test_f1: 0.4131
 epoch: 3, train_loss: 1.1470, test_loss: 1.1118, test_f1: 0.4023
 epoch: 4, train_loss: 1.1225, test_loss: 1.1006, test_f1: 0.4077
 epoch: 5, train_loss: 1.1036, test_loss: 1.0684, test_f1: 0.4414
 epoch: 6, train_loss: 1.0813, test_loss: 1.0604, test_f1: 0.4792
 epoch: 7, train_loss: 1.0752, test_loss: 1.0571, test_f1: 0.4561
 epoch: 8, train_loss: 1.0630, test_loss: 1.0542, test_f1: 0.4686
 epoch: 9, train_loss: 1.0480, test_loss: 1.0495, test_f1: 0.4874
 epoch: 10, train_loss: 1.0367, test_loss: 1.0327, test_f1: 0.4744
 epoch: 11, train_loss: 1.0298, test_loss: 1.0377, test_f1: 0.4644
 epoch: 12, train_loss: 1.0215, test_loss: 1.0265, test_f1: 0.4628
 epoch: 13, train_loss: 1.0080, test_loss: 1.0045, test_f1: 0.4739
 epoch: 14, train_loss: 0.9985, test_loss: 1.0075, test_f1: 0.4822
 epoch: 15, train_loss: 0.9996, test_loss: 1.0030, test_f1: 0.4847
 epoch: 16, train_loss: 0.9870, test_loss: 1.0063, test_f1: 0.5052
 epoch: 17, train_loss: 0.9879, test_loss: 0.9922, test_f1: 0.4892
 epoch: 18, train_loss: 0.9798, test_loss: 0.9896, test_f1: 0.4892
 epoch: 19, train_loss: 0.9729, test_loss: 0.9816, test_f1: 0.4914
 epoch: 20, train_loss: 0.9755, test_loss: 1.0011, test_f1: 0.4855
 epoch: 21, train_loss: 0.9597, test_loss: 0.9944, test_f1: 0.4905
 epoch: 22, train_loss: 0.9649, test_loss: 0.9659, test_f1: 0.5042
 epoch: 23, train_loss: 0.9515, test_loss: 0.9536, test_f1: 0.5079
 epoch: 24, train_loss: 0.9467, test_loss: 0.9683, test_f1: 0.4998
 epoch: 25, train_loss: 0.9447, test_loss: 0.9554, test_f1: 0.5179
 epoch: 26, train_loss: 0.9374, test_loss: 0.9710, test_f1: 0.5020
 epoch: 27, train_loss: 0.9334, test_loss: 0.9962, test_f1: 0.5033
 epoch: 28, train_loss: 0.9370, test_loss: 1.0027, test_f1: 0.5229
 epoch: 29, train_loss: 0.9277, test_loss: 0.9513, test_f1: 0.5295
 epoch: 30, train_loss: 0.9267, test_loss: 0.9334, test_f1: 0.5169
 epoch: 31, train_loss: 0.9336, test_loss: 0.9878, test_f1: 0.5076
 epoch: 32, train_loss: 0.9207, test_loss: 0.9352, test_f1: 0.5172
 epoch: 33, train_loss: 0.9125, test_loss: 0.9314, test_f1: 0.5139
 epoch: 34, train_loss: 0.9110, test_loss: 0.9571, test_f1: 0.5167
 epoch: 35, train_loss: 0.9174, test_loss: 0.9495, test_f1: 0.5047
 epoch: 36, train_loss: 0.9074, test_loss: 0.9713, test_f1: 0.5079
 epoch: 37, train_loss: 0.9060, test_loss: 0.9893, test_f1: 0.4910
 epoch: 38, train_loss: 0.9141, test_loss: 0.9518, test_f1: 0.5230
 epoch: 39, train_loss: 0.8994, test_loss: 1.0400, test_f1: 0.5185
 epoch: 40, train_loss: 0.9016, test_loss: 0.9395, test_f1: 0.5432
 epoch: 41, train_loss: 0.8966, test_loss: 1.0132, test_f1: 0.5239
 epoch: 42, train_loss: 0.8829, test_loss: 0.9605, test_f1: 0.5179
 epoch: 43, train_loss: 0.8822, test_loss: 0.9712, test_f1: 0.5074
 epoch: 44, train_loss: 0.8958, test_loss: 1.0486, test_f1: 0.5251
 epoch: 45, train_loss: 0.8867, test_loss: 0.9749, test_f1: 0.5174
 epoch: 46, train_loss: 0.8795, test_loss: 0.9518, test_f1: 0.5386
 epoch: 47, train_loss: 0.8758, test_loss: 1.0199, test_f1: 0.5231
 epoch: 48, train_loss: 0.8814, test_loss: 0.9338, test_f1: 0.5208
 epoch: 49, train_loss: 0.8787, test_loss: 0.9590, test_f1: 0.5307
 epoch: 50, train_loss: 0.8717, test_loss: 1.0153, test_f1: 0.5150
 epoch: 51, train_loss: 0.8601, test_loss: 0.9626, test_f1: 0.5360
 epoch: 52, train_loss: 0.8685, test_loss: 0.9717, test_f1: 0.5210
 epoch: 53, train_loss: 0.8528, test_loss: 0.9586, test_f1: 0.5331
 epoch: 54, train_loss: 0.8652, test_loss: 0.9713, test_f1: 0.5367
 epoch: 55, train_loss: 0.8552, test_loss: 0.9584, test_f1: 0.5354
 epoch: 56, train_loss: 0.8630, test_loss: 0.9357, test_f1: 0.5396
 epoch: 57, train_loss: 0.8529, test_loss: 0.9793, test_f1: 0.5356
 epoch: 58, train_loss: 0.8512, test_loss: 0.9550, test_f1: 0.5007
 epoch: 59, train_loss: 0.8587, test_loss: 0.9424, test_f1: 0.5436
 epoch: 60, train_loss: 0.8610, test_loss: 0.9716, test_f1: 0.5267
 epoch: 61, train_loss: 0.8599, test_loss: 0.9888, test_f1: 0.5246
 epoch: 62, train_loss: 0.8513, test_loss: 0.9432, test_f1: 0.5203
 epoch: 63, train_loss: 0.8485, test_loss: 0.9943, test_f1: 0.5264
 epoch: 64, train_loss: 0.8413, test_loss: 0.9463, test_f1: 0.5356
 epoch: 65, train_loss: 0.8441, test_loss: 0.9334, test_f1: 0.5375
 epoch: 66, train_loss: 0.8471, test_loss: 0.9752, test_f1: 0.5318
 epoch: 67, train_loss: 0.8629, test_loss: 0.9243, test_f1: 0.5388
 epoch: 68, train_loss: 0.8474, test_loss: 0.9566, test_f1: 0.5402
 epoch: 69, train_loss: 0.8473, test_loss: 0.9584, test_f1: 0.5384
 epoch: 70, train_loss: 0.8443, test_loss: 1.0223, test_f1: 0.5177
 epoch: 71, train_loss: 0.8504, test_loss: 0.9738, test_f1: 0.5152
 epoch: 72, train_loss: 0.8411, test_loss: 1.0138, test_f1: 0.5231
 epoch: 73, train_loss: 0.8549, test_loss: 0.9911, test_f1: 0.5358
 epoch: 74, train_loss: 0.8262, test_loss: 0.9533, test_f1: 0.5084
 epoch: 75, train_loss: 0.8275, test_loss: 1.0412, test_f1: 0.5092
 epoch: 76, train_loss: 0.8360, test_loss: 0.9211, test_f1: 0.5405
 epoch: 77, train_loss: 0.8377, test_loss: 0.9884, test_f1: 0.5315
 epoch: 78, train_loss: 0.8380, test_loss: 0.9230, test_f1: 0.5384
 epoch: 79, train_loss: 0.8503, test_loss: 0.9967, test_f1: 0.5192
 epoch: 80, train_loss: 0.8293, test_loss: 0.9665, test_f1: 0.5046
 epoch: 81, train_loss: 0.8360, test_loss: 0.9862, test_f1: 0.5116
 epoch: 82, train_loss: 0.8236, test_loss: 0.9363, test_f1: 0.5396
 epoch: 83, train_loss: 0.8282, test_loss: 0.9238, test_f1: 0.5453
 epoch: 84, train_loss: 0.8347, test_loss: 0.9730, test_f1: 0.5467
 epoch: 85, train_loss: 0.8269, test_loss: 0.9467, test_f1: 0.5393
 epoch: 86, train_loss: 0.8301, test_loss: 0.9353, test_f1: 0.5451
 epoch: 87, train_loss: 0.8321, test_loss: 0.9672, test_f1: 0.5338
 epoch: 88, train_loss: 0.8255, test_loss: 1.0247, test_f1: 0.5168
 epoch: 89, train_loss: 0.8231, test_loss: 0.9812, test_f1: 0.5280
 epoch: 90, train_loss: 0.8221, test_loss: 0.9695, test_f1: 0.5431
 epoch: 91, train_loss: 0.8343, test_loss: 1.0579, test_f1: 0.5043
 epoch: 92, train_loss: 0.8257, test_loss: 0.9191, test_f1: 0.5421
 epoch: 93, train_loss: 0.8269, test_loss: 0.9460, test_f1: 0.5381
 epoch: 94, train_loss: 0.8210, test_loss: 0.9686, test_f1: 0.5339
 epoch: 95, train_loss: 0.8198, test_loss: 0.9076, test_f1: 0.5517
 epoch: 96, train_loss: 0.8274, test_loss: 0.9104, test_f1: 0.5472
 epoch: 97, train_loss: 0.8218, test_loss: 1.0012, test_f1: 0.5270
 epoch: 98, train_loss: 0.8190, test_loss: 0.9916, test_f1: 0.5382
 epoch: 99, train_loss: 0.8229, test_loss: 0.9695, test_f1: 0.5343
##################ITERATION #6 ****************************************
 epoch: 0, train_loss: 1.3257, test_loss: 1.1965, test_f1: 0.3201
 epoch: 1, train_loss: 1.2141, test_loss: 1.1339, test_f1: 0.4089
 epoch: 2, train_loss: 1.1689, test_loss: 1.1035, test_f1: 0.4154
 epoch: 3, train_loss: 1.1462, test_loss: 1.0820, test_f1: 0.4082
 epoch: 4, train_loss: 1.1159, test_loss: 1.0545, test_f1: 0.4144
 epoch: 5, train_loss: 1.0983, test_loss: 1.0351, test_f1: 0.4199
 epoch: 6, train_loss: 1.0776, test_loss: 1.0088, test_f1: 0.4564
 epoch: 7, train_loss: 1.0662, test_loss: 1.0037, test_f1: 0.4690
 epoch: 8, train_loss: 1.0518, test_loss: 1.0014, test_f1: 0.4440
 epoch: 9, train_loss: 1.0447, test_loss: 0.9965, test_f1: 0.4550
 epoch: 10, train_loss: 1.0353, test_loss: 1.0183, test_f1: 0.4367
 epoch: 11, train_loss: 1.0282, test_loss: 0.9866, test_f1: 0.4525
 epoch: 12, train_loss: 1.0073, test_loss: 0.9952, test_f1: 0.4530
 epoch: 13, train_loss: 1.0039, test_loss: 0.9988, test_f1: 0.4722
 epoch: 14, train_loss: 0.9939, test_loss: 0.9800, test_f1: 0.4770
 epoch: 15, train_loss: 0.9919, test_loss: 0.9738, test_f1: 0.4698
 epoch: 16, train_loss: 0.9848, test_loss: 0.9902, test_f1: 0.4677
 epoch: 17, train_loss: 0.9798, test_loss: 0.9701, test_f1: 0.4835
 epoch: 18, train_loss: 0.9826, test_loss: 0.9517, test_f1: 0.4839
 epoch: 19, train_loss: 0.9678, test_loss: 0.9399, test_f1: 0.4809
 epoch: 20, train_loss: 0.9630, test_loss: 0.9352, test_f1: 0.4886
 epoch: 21, train_loss: 0.9620, test_loss: 0.9374, test_f1: 0.4923
 epoch: 22, train_loss: 0.9550, test_loss: 0.9257, test_f1: 0.4880
 epoch: 23, train_loss: 0.9480, test_loss: 0.9457, test_f1: 0.4989
 epoch: 24, train_loss: 0.9416, test_loss: 0.9427, test_f1: 0.4921
 epoch: 25, train_loss: 0.9392, test_loss: 0.9534, test_f1: 0.4995
 epoch: 26, train_loss: 0.9363, test_loss: 0.9449, test_f1: 0.4975
 epoch: 27, train_loss: 0.9361, test_loss: 0.9382, test_f1: 0.5055
 epoch: 28, train_loss: 0.9190, test_loss: 0.9501, test_f1: 0.5050
 epoch: 29, train_loss: 0.9180, test_loss: 0.9652, test_f1: 0.5075
 epoch: 30, train_loss: 0.9124, test_loss: 0.9661, test_f1: 0.5075
 epoch: 31, train_loss: 0.9105, test_loss: 0.9364, test_f1: 0.4992
 epoch: 32, train_loss: 0.9034, test_loss: 0.9262, test_f1: 0.5028
 epoch: 33, train_loss: 0.9004, test_loss: 0.9386, test_f1: 0.5087
 epoch: 34, train_loss: 0.8945, test_loss: 0.9409, test_f1: 0.5081
 epoch: 35, train_loss: 0.9037, test_loss: 0.9590, test_f1: 0.5096
 epoch: 36, train_loss: 0.8844, test_loss: 0.9216, test_f1: 0.5137
 epoch: 37, train_loss: 0.8967, test_loss: 0.8960, test_f1: 0.5211
 epoch: 38, train_loss: 0.8772, test_loss: 0.9338, test_f1: 0.5112
 epoch: 39, train_loss: 0.8759, test_loss: 0.9205, test_f1: 0.5139
 epoch: 40, train_loss: 0.8777, test_loss: 0.9513, test_f1: 0.5103
 epoch: 41, train_loss: 0.8729, test_loss: 0.9413, test_f1: 0.5224
 epoch: 42, train_loss: 0.8702, test_loss: 0.9311, test_f1: 0.5225
 epoch: 43, train_loss: 0.8800, test_loss: 0.9310, test_f1: 0.5247
 epoch: 44, train_loss: 0.8737, test_loss: 0.9151, test_f1: 0.5243
 epoch: 45, train_loss: 0.8556, test_loss: 0.9222, test_f1: 0.5190
 epoch: 46, train_loss: 0.8668, test_loss: 0.9086, test_f1: 0.5235
 epoch: 47, train_loss: 0.8620, test_loss: 0.9173, test_f1: 0.5210
 epoch: 48, train_loss: 0.8526, test_loss: 0.9069, test_f1: 0.5207
 epoch: 49, train_loss: 0.8478, test_loss: 0.9219, test_f1: 0.5196
 epoch: 50, train_loss: 0.8435, test_loss: 0.9060, test_f1: 0.5310
 epoch: 51, train_loss: 0.8422, test_loss: 0.9015, test_f1: 0.5311
 epoch: 52, train_loss: 0.8360, test_loss: 0.9087, test_f1: 0.5208
 epoch: 53, train_loss: 0.8365, test_loss: 0.8981, test_f1: 0.5218
 epoch: 54, train_loss: 0.8413, test_loss: 0.9031, test_f1: 0.5223
 epoch: 55, train_loss: 0.8409, test_loss: 0.8829, test_f1: 0.5318
 epoch: 56, train_loss: 0.8314, test_loss: 0.9177, test_f1: 0.5362
 epoch: 57, train_loss: 0.8245, test_loss: 0.8968, test_f1: 0.5356
 epoch: 58, train_loss: 0.8160, test_loss: 0.8922, test_f1: 0.5340
 epoch: 59, train_loss: 0.8192, test_loss: 0.9061, test_f1: 0.5381
 epoch: 60, train_loss: 0.8258, test_loss: 0.8881, test_f1: 0.5294
 epoch: 61, train_loss: 0.8232, test_loss: 0.9081, test_f1: 0.5304
 epoch: 62, train_loss: 0.8121, test_loss: 0.9137, test_f1: 0.5317
 epoch: 63, train_loss: 0.8227, test_loss: 0.9017, test_f1: 0.5356
 epoch: 64, train_loss: 0.8255, test_loss: 0.9123, test_f1: 0.5390
 epoch: 65, train_loss: 0.8148, test_loss: 0.9099, test_f1: 0.5334
 epoch: 66, train_loss: 0.8237, test_loss: 0.9233, test_f1: 0.5274
 epoch: 67, train_loss: 0.8117, test_loss: 0.8986, test_f1: 0.5345
 epoch: 68, train_loss: 0.8099, test_loss: 0.9069, test_f1: 0.5308
 epoch: 69, train_loss: 0.8100, test_loss: 0.9083, test_f1: 0.5218
 epoch: 70, train_loss: 0.8092, test_loss: 0.8872, test_f1: 0.5428
 epoch: 71, train_loss: 0.8070, test_loss: 0.8535, test_f1: 0.5500
 epoch: 72, train_loss: 0.8033, test_loss: 0.8699, test_f1: 0.5402
 epoch: 73, train_loss: 0.8128, test_loss: 0.8612, test_f1: 0.5417
 epoch: 74, train_loss: 0.8058, test_loss: 0.9057, test_f1: 0.5294
 epoch: 75, train_loss: 0.8155, test_loss: 0.8934, test_f1: 0.5410
 epoch: 76, train_loss: 0.7979, test_loss: 0.9190, test_f1: 0.5279
 epoch: 77, train_loss: 0.8092, test_loss: 0.9165, test_f1: 0.5323
 epoch: 78, train_loss: 0.8031, test_loss: 0.8993, test_f1: 0.5372
 epoch: 79, train_loss: 0.7982, test_loss: 0.8978, test_f1: 0.5385
 epoch: 80, train_loss: 0.7971, test_loss: 0.9151, test_f1: 0.5321
 epoch: 81, train_loss: 0.7965, test_loss: 0.9099, test_f1: 0.5351
 epoch: 82, train_loss: 0.7880, test_loss: 0.9230, test_f1: 0.5345
 epoch: 83, train_loss: 0.7881, test_loss: 0.8847, test_f1: 0.5474
 epoch: 84, train_loss: 0.7897, test_loss: 0.9249, test_f1: 0.5357
 epoch: 85, train_loss: 0.7853, test_loss: 0.9109, test_f1: 0.5459
 epoch: 86, train_loss: 0.7947, test_loss: 0.9252, test_f1: 0.5314
 epoch: 87, train_loss: 0.7773, test_loss: 0.9013, test_f1: 0.5376
 epoch: 88, train_loss: 0.7803, test_loss: 0.9002, test_f1: 0.5361
 epoch: 89, train_loss: 0.7919, test_loss: 0.8940, test_f1: 0.5285
 epoch: 90, train_loss: 0.7800, test_loss: 0.8814, test_f1: 0.5450
 epoch: 91, train_loss: 0.7804, test_loss: 0.9162, test_f1: 0.5398
 epoch: 92, train_loss: 0.7845, test_loss: 0.9009, test_f1: 0.5319
 epoch: 93, train_loss: 0.7793, test_loss: 0.9048, test_f1: 0.5356
 epoch: 94, train_loss: 0.7788, test_loss: 0.8973, test_f1: 0.5438
 epoch: 95, train_loss: 0.7795, test_loss: 0.9277, test_f1: 0.5345
 epoch: 96, train_loss: 0.7877, test_loss: 0.9109, test_f1: 0.5311
 epoch: 97, train_loss: 0.7820, test_loss: 0.9394, test_f1: 0.5326
 epoch: 98, train_loss: 0.7774, test_loss: 0.9395, test_f1: 0.5235
 epoch: 99, train_loss: 0.7818, test_loss: 0.9060, test_f1: 0.5413
##################ITERATION #7 ****************************************
 epoch: 0, train_loss: 1.2737, test_loss: 1.2047, test_f1: 0.3239
 epoch: 1, train_loss: 1.2080, test_loss: 1.1647, test_f1: 0.3941
 epoch: 2, train_loss: 1.1812, test_loss: 1.1390, test_f1: 0.4026
 epoch: 3, train_loss: 1.1649, test_loss: 1.1170, test_f1: 0.4371
 epoch: 4, train_loss: 1.1369, test_loss: 1.0929, test_f1: 0.4433
 epoch: 5, train_loss: 1.1113, test_loss: 1.0758, test_f1: 0.4375
 epoch: 6, train_loss: 1.0987, test_loss: 1.0701, test_f1: 0.4405
 epoch: 7, train_loss: 1.0833, test_loss: 1.0580, test_f1: 0.4516
 epoch: 8, train_loss: 1.0708, test_loss: 1.0404, test_f1: 0.4380
 epoch: 9, train_loss: 1.0685, test_loss: 1.0343, test_f1: 0.4432
 epoch: 10, train_loss: 1.0503, test_loss: 1.0241, test_f1: 0.4415
 epoch: 11, train_loss: 1.0383, test_loss: 1.0111, test_f1: 0.4596
 epoch: 12, train_loss: 1.0313, test_loss: 1.0143, test_f1: 0.4718
 epoch: 13, train_loss: 1.0302, test_loss: 0.9886, test_f1: 0.4890
 epoch: 14, train_loss: 1.0107, test_loss: 0.9927, test_f1: 0.4899
 epoch: 15, train_loss: 1.0041, test_loss: 0.9999, test_f1: 0.4726
 epoch: 16, train_loss: 1.0067, test_loss: 1.0061, test_f1: 0.4815
 epoch: 17, train_loss: 0.9965, test_loss: 0.9665, test_f1: 0.4821
 epoch: 18, train_loss: 0.9930, test_loss: 0.9567, test_f1: 0.5038
 epoch: 19, train_loss: 0.9889, test_loss: 0.9786, test_f1: 0.4960
 epoch: 20, train_loss: 0.9792, test_loss: 0.9765, test_f1: 0.5066
 epoch: 21, train_loss: 0.9791, test_loss: 0.9569, test_f1: 0.4992
 epoch: 22, train_loss: 0.9757, test_loss: 0.9658, test_f1: 0.4910
 epoch: 23, train_loss: 0.9662, test_loss: 0.9614, test_f1: 0.5090
 epoch: 24, train_loss: 0.9574, test_loss: 0.9361, test_f1: 0.5153
 epoch: 25, train_loss: 0.9493, test_loss: 0.9586, test_f1: 0.5123
 epoch: 26, train_loss: 0.9466, test_loss: 0.9726, test_f1: 0.5010
 epoch: 27, train_loss: 0.9519, test_loss: 0.9540, test_f1: 0.5029
 epoch: 28, train_loss: 0.9397, test_loss: 0.9466, test_f1: 0.5064
 epoch: 29, train_loss: 0.9376, test_loss: 0.9407, test_f1: 0.5185
 epoch: 30, train_loss: 0.9254, test_loss: 0.9442, test_f1: 0.5053
 epoch: 31, train_loss: 0.9273, test_loss: 0.9404, test_f1: 0.5055
 epoch: 32, train_loss: 0.9240, test_loss: 0.9243, test_f1: 0.5106
 epoch: 33, train_loss: 0.9164, test_loss: 0.9378, test_f1: 0.5097
 epoch: 34, train_loss: 0.9178, test_loss: 0.9199, test_f1: 0.5202
 epoch: 35, train_loss: 0.9159, test_loss: 0.9374, test_f1: 0.5188
 epoch: 36, train_loss: 0.9142, test_loss: 0.9299, test_f1: 0.5109
 epoch: 37, train_loss: 0.9049, test_loss: 0.8999, test_f1: 0.5153
 epoch: 38, train_loss: 0.9078, test_loss: 0.9357, test_f1: 0.5142
 epoch: 39, train_loss: 0.8977, test_loss: 0.9262, test_f1: 0.5173
 epoch: 40, train_loss: 0.9003, test_loss: 0.9213, test_f1: 0.5159
 epoch: 41, train_loss: 0.8962, test_loss: 0.9223, test_f1: 0.5119
 epoch: 42, train_loss: 0.8894, test_loss: 0.9236, test_f1: 0.5240
 epoch: 43, train_loss: 0.8923, test_loss: 0.9143, test_f1: 0.5246
 epoch: 44, train_loss: 0.8953, test_loss: 0.9031, test_f1: 0.5244
 epoch: 45, train_loss: 0.8958, test_loss: 0.9405, test_f1: 0.5015
 epoch: 46, train_loss: 0.8882, test_loss: 0.9166, test_f1: 0.5171
 epoch: 47, train_loss: 0.8754, test_loss: 0.9228, test_f1: 0.5238
 epoch: 48, train_loss: 0.8773, test_loss: 0.9077, test_f1: 0.5275
 epoch: 49, train_loss: 0.8739, test_loss: 0.9191, test_f1: 0.5135
 epoch: 50, train_loss: 0.8799, test_loss: 0.9024, test_f1: 0.5153
 epoch: 51, train_loss: 0.8754, test_loss: 0.9094, test_f1: 0.5253
 epoch: 52, train_loss: 0.8604, test_loss: 0.9189, test_f1: 0.5132
 epoch: 53, train_loss: 0.8595, test_loss: 0.8971, test_f1: 0.5212
 epoch: 54, train_loss: 0.8668, test_loss: 0.9082, test_f1: 0.5271
 epoch: 55, train_loss: 0.8573, test_loss: 0.9205, test_f1: 0.5169
 epoch: 56, train_loss: 0.8684, test_loss: 0.9169, test_f1: 0.5206
 epoch: 57, train_loss: 0.8739, test_loss: 0.9073, test_f1: 0.5139
 epoch: 58, train_loss: 0.8630, test_loss: 0.9219, test_f1: 0.5214
 epoch: 59, train_loss: 0.8808, test_loss: 0.9145, test_f1: 0.5239
 epoch: 60, train_loss: 0.8497, test_loss: 0.9155, test_f1: 0.5202
 epoch: 61, train_loss: 0.8461, test_loss: 0.9185, test_f1: 0.5272
 epoch: 62, train_loss: 0.8504, test_loss: 0.9094, test_f1: 0.5291
 epoch: 63, train_loss: 0.8533, test_loss: 0.9075, test_f1: 0.5236
 epoch: 64, train_loss: 0.8596, test_loss: 0.9134, test_f1: 0.5297
 epoch: 65, train_loss: 0.8483, test_loss: 0.9246, test_f1: 0.5205
 epoch: 66, train_loss: 0.8574, test_loss: 0.9071, test_f1: 0.5214
 epoch: 67, train_loss: 0.8597, test_loss: 0.9084, test_f1: 0.5186
 epoch: 68, train_loss: 0.8446, test_loss: 0.9107, test_f1: 0.5193
 epoch: 69, train_loss: 0.8483, test_loss: 0.9208, test_f1: 0.5163
 epoch: 70, train_loss: 0.8422, test_loss: 0.9114, test_f1: 0.5236
 epoch: 71, train_loss: 0.8591, test_loss: 0.9228, test_f1: 0.5348
 epoch: 72, train_loss: 0.8400, test_loss: 0.9168, test_f1: 0.5297
 epoch: 73, train_loss: 0.8451, test_loss: 0.9225, test_f1: 0.5220
 epoch: 74, train_loss: 0.8521, test_loss: 0.9162, test_f1: 0.5202
 epoch: 75, train_loss: 0.8405, test_loss: 0.8947, test_f1: 0.5368
 epoch: 76, train_loss: 0.8438, test_loss: 0.9144, test_f1: 0.5284
 epoch: 77, train_loss: 0.8367, test_loss: 0.9505, test_f1: 0.5260
 epoch: 78, train_loss: 0.8346, test_loss: 0.9286, test_f1: 0.5329
 epoch: 79, train_loss: 0.8417, test_loss: 0.9323, test_f1: 0.5181
 epoch: 80, train_loss: 0.8388, test_loss: 0.9308, test_f1: 0.5212
 epoch: 81, train_loss: 0.8284, test_loss: 0.9356, test_f1: 0.5173
 epoch: 82, train_loss: 0.8424, test_loss: 0.9207, test_f1: 0.5277
 epoch: 83, train_loss: 0.8411, test_loss: 0.9137, test_f1: 0.5258
 epoch: 84, train_loss: 0.8408, test_loss: 0.9160, test_f1: 0.5401
 epoch: 85, train_loss: 0.8327, test_loss: 0.8978, test_f1: 0.5318
 epoch: 86, train_loss: 0.8124, test_loss: 0.9207, test_f1: 0.5371
 epoch: 87, train_loss: 0.8310, test_loss: 0.9064, test_f1: 0.5378
 epoch: 88, train_loss: 0.8378, test_loss: 0.9049, test_f1: 0.5314
 epoch: 89, train_loss: 0.8207, test_loss: 0.9174, test_f1: 0.5416
 epoch: 90, train_loss: 0.8244, test_loss: 0.9252, test_f1: 0.5275
 epoch: 91, train_loss: 0.8227, test_loss: 0.9099, test_f1: 0.5411
 epoch: 92, train_loss: 0.8288, test_loss: 0.9165, test_f1: 0.5388
 epoch: 93, train_loss: 0.8298, test_loss: 0.9103, test_f1: 0.5397
 epoch: 94, train_loss: 0.8274, test_loss: 0.9395, test_f1: 0.5283
 epoch: 95, train_loss: 0.8117, test_loss: 0.9270, test_f1: 0.5243
 epoch: 96, train_loss: 0.8140, test_loss: 0.9189, test_f1: 0.5359
 epoch: 97, train_loss: 0.8201, test_loss: 0.9257, test_f1: 0.5245
 epoch: 98, train_loss: 0.8192, test_loss: 0.9263, test_f1: 0.5426
 epoch: 99, train_loss: 0.8135, test_loss: 0.9061, test_f1: 0.5348
##################ITERATION #8 ****************************************
 epoch: 0, train_loss: 1.3502, test_loss: 1.2126, test_f1: 0.2664
 epoch: 1, train_loss: 1.2346, test_loss: 1.1767, test_f1: 0.2960
 epoch: 2, train_loss: 1.2133, test_loss: 1.1453, test_f1: 0.3588
 epoch: 3, train_loss: 1.1686, test_loss: 1.1106, test_f1: 0.3828
 epoch: 4, train_loss: 1.1507, test_loss: 1.0991, test_f1: 0.4064
 epoch: 5, train_loss: 1.1324, test_loss: 1.0809, test_f1: 0.4335
 epoch: 6, train_loss: 1.1076, test_loss: 1.0602, test_f1: 0.4402
 epoch: 7, train_loss: 1.0963, test_loss: 1.0324, test_f1: 0.4345
 epoch: 8, train_loss: 1.0842, test_loss: 1.0415, test_f1: 0.4537
 epoch: 9, train_loss: 1.0789, test_loss: 1.0118, test_f1: 0.4734
 epoch: 10, train_loss: 1.0605, test_loss: 1.0268, test_f1: 0.4585
 epoch: 11, train_loss: 1.0609, test_loss: 1.0043, test_f1: 0.4612
 epoch: 12, train_loss: 1.0383, test_loss: 1.0387, test_f1: 0.4694
 epoch: 13, train_loss: 1.0229, test_loss: 0.9942, test_f1: 0.4628
 epoch: 14, train_loss: 1.0195, test_loss: 0.9956, test_f1: 0.4710
 epoch: 15, train_loss: 1.0082, test_loss: 0.9952, test_f1: 0.4784
 epoch: 16, train_loss: 0.9941, test_loss: 0.9871, test_f1: 0.4587
 epoch: 17, train_loss: 0.9805, test_loss: 0.9858, test_f1: 0.4813
 epoch: 18, train_loss: 0.9875, test_loss: 0.9772, test_f1: 0.4808
 epoch: 19, train_loss: 0.9816, test_loss: 0.9852, test_f1: 0.4765
 epoch: 20, train_loss: 0.9738, test_loss: 0.9906, test_f1: 0.4899
 epoch: 21, train_loss: 0.9658, test_loss: 0.9722, test_f1: 0.4923
 epoch: 22, train_loss: 0.9605, test_loss: 0.9888, test_f1: 0.4900
 epoch: 23, train_loss: 0.9604, test_loss: 0.9807, test_f1: 0.4830
 epoch: 24, train_loss: 0.9456, test_loss: 0.9650, test_f1: 0.4887
 epoch: 25, train_loss: 0.9502, test_loss: 0.9864, test_f1: 0.4803
 epoch: 26, train_loss: 0.9432, test_loss: 0.9831, test_f1: 0.4792
 epoch: 27, train_loss: 0.9429, test_loss: 0.9697, test_f1: 0.4834
 epoch: 28, train_loss: 0.9290, test_loss: 0.9535, test_f1: 0.4897
 epoch: 29, train_loss: 0.9305, test_loss: 0.9691, test_f1: 0.5046
 epoch: 30, train_loss: 0.9298, test_loss: 0.9588, test_f1: 0.4957
 epoch: 31, train_loss: 0.9250, test_loss: 0.9586, test_f1: 0.4839
 epoch: 32, train_loss: 0.9208, test_loss: 0.9451, test_f1: 0.4896
 epoch: 33, train_loss: 0.9099, test_loss: 0.9701, test_f1: 0.5008
 epoch: 34, train_loss: 0.9180, test_loss: 0.9888, test_f1: 0.4935
 epoch: 35, train_loss: 0.9041, test_loss: 0.9517, test_f1: 0.4978
 epoch: 36, train_loss: 0.9023, test_loss: 0.9328, test_f1: 0.5012
 epoch: 37, train_loss: 0.9117, test_loss: 0.9611, test_f1: 0.5009
 epoch: 38, train_loss: 0.9009, test_loss: 0.9531, test_f1: 0.4928
 epoch: 39, train_loss: 0.8986, test_loss: 0.9391, test_f1: 0.5115
 epoch: 40, train_loss: 0.8943, test_loss: 0.9462, test_f1: 0.4987
 epoch: 41, train_loss: 0.8918, test_loss: 0.9444, test_f1: 0.5133
 epoch: 42, train_loss: 0.8795, test_loss: 0.9491, test_f1: 0.5148
 epoch: 43, train_loss: 0.8967, test_loss: 0.9291, test_f1: 0.5238
 epoch: 44, train_loss: 0.8962, test_loss: 0.9546, test_f1: 0.5088
 epoch: 45, train_loss: 0.8804, test_loss: 0.9465, test_f1: 0.5205
 epoch: 46, train_loss: 0.8649, test_loss: 0.9207, test_f1: 0.5243
 epoch: 47, train_loss: 0.8679, test_loss: 0.9289, test_f1: 0.5177
 epoch: 48, train_loss: 0.8777, test_loss: 0.9394, test_f1: 0.5162
 epoch: 49, train_loss: 0.8658, test_loss: 0.9155, test_f1: 0.5292
 epoch: 50, train_loss: 0.8690, test_loss: 0.9380, test_f1: 0.5152
 epoch: 51, train_loss: 0.8547, test_loss: 0.9462, test_f1: 0.5262
 epoch: 52, train_loss: 0.8665, test_loss: 0.9196, test_f1: 0.5268
 epoch: 53, train_loss: 0.8556, test_loss: 0.9142, test_f1: 0.5258
 epoch: 54, train_loss: 0.8469, test_loss: 0.9028, test_f1: 0.5197
 epoch: 55, train_loss: 0.8616, test_loss: 0.9149, test_f1: 0.5283
 epoch: 56, train_loss: 0.8544, test_loss: 0.9279, test_f1: 0.5237
 epoch: 57, train_loss: 0.8519, test_loss: 0.9437, test_f1: 0.5399
 epoch: 58, train_loss: 0.8516, test_loss: 0.9253, test_f1: 0.5281
 epoch: 59, train_loss: 0.8444, test_loss: 0.9256, test_f1: 0.5228
 epoch: 60, train_loss: 0.8521, test_loss: 0.9035, test_f1: 0.5299
 epoch: 61, train_loss: 0.8436, test_loss: 0.9316, test_f1: 0.5195
 epoch: 62, train_loss: 0.8459, test_loss: 0.9244, test_f1: 0.5200
 epoch: 63, train_loss: 0.8491, test_loss: 0.9255, test_f1: 0.5294
 epoch: 64, train_loss: 0.8426, test_loss: 0.9166, test_f1: 0.5198
 epoch: 65, train_loss: 0.8442, test_loss: 0.9069, test_f1: 0.5239
 epoch: 66, train_loss: 0.8443, test_loss: 0.9354, test_f1: 0.5260
 epoch: 67, train_loss: 0.8520, test_loss: 0.9207, test_f1: 0.5312
 epoch: 68, train_loss: 0.8377, test_loss: 0.9056, test_f1: 0.5334
 epoch: 69, train_loss: 0.8337, test_loss: 0.9281, test_f1: 0.5303
 epoch: 70, train_loss: 0.8391, test_loss: 0.8995, test_f1: 0.5252
 epoch: 71, train_loss: 0.8355, test_loss: 0.8968, test_f1: 0.5443
 epoch: 72, train_loss: 0.8295, test_loss: 0.9342, test_f1: 0.5290
 epoch: 73, train_loss: 0.8344, test_loss: 0.8945, test_f1: 0.5369
 epoch: 74, train_loss: 0.8388, test_loss: 0.9107, test_f1: 0.5459
 epoch: 75, train_loss: 0.8278, test_loss: 0.8958, test_f1: 0.5374
 epoch: 76, train_loss: 0.8386, test_loss: 0.9064, test_f1: 0.5433
 epoch: 77, train_loss: 0.8298, test_loss: 0.9103, test_f1: 0.5467
 epoch: 78, train_loss: 0.8273, test_loss: 0.9232, test_f1: 0.5288
 epoch: 79, train_loss: 0.8100, test_loss: 0.8992, test_f1: 0.5440
 epoch: 80, train_loss: 0.8207, test_loss: 0.9042, test_f1: 0.5379
 epoch: 81, train_loss: 0.8286, test_loss: 0.9087, test_f1: 0.5408
 epoch: 82, train_loss: 0.8309, test_loss: 0.9015, test_f1: 0.5401
 epoch: 83, train_loss: 0.8204, test_loss: 0.8940, test_f1: 0.5299
 epoch: 84, train_loss: 0.8257, test_loss: 0.8937, test_f1: 0.5493
 epoch: 85, train_loss: 0.8309, test_loss: 0.9022, test_f1: 0.5267
 epoch: 86, train_loss: 0.8198, test_loss: 0.8983, test_f1: 0.5417
 epoch: 87, train_loss: 0.8144, test_loss: 0.8950, test_f1: 0.5335
 epoch: 88, train_loss: 0.8286, test_loss: 0.9056, test_f1: 0.5463
 epoch: 89, train_loss: 0.8163, test_loss: 0.8988, test_f1: 0.5357
 epoch: 90, train_loss: 0.8182, test_loss: 0.8850, test_f1: 0.5407
 epoch: 91, train_loss: 0.8125, test_loss: 0.8996, test_f1: 0.5444
 epoch: 92, train_loss: 0.8008, test_loss: 0.8993, test_f1: 0.5397
 epoch: 93, train_loss: 0.8039, test_loss: 0.8950, test_f1: 0.5430
 epoch: 94, train_loss: 0.8143, test_loss: 0.8951, test_f1: 0.5410
 epoch: 95, train_loss: 0.8181, test_loss: 0.8879, test_f1: 0.5344
 epoch: 96, train_loss: 0.8142, test_loss: 0.8940, test_f1: 0.5457
 epoch: 97, train_loss: 0.8144, test_loss: 0.8981, test_f1: 0.5563
 epoch: 98, train_loss: 0.8099, test_loss: 0.8857, test_f1: 0.5460
 epoch: 99, train_loss: 0.8118, test_loss: 0.8992, test_f1: 0.5471
##################ITERATION #9 ****************************************
 epoch: 0, train_loss: 1.2899, test_loss: 1.1743, test_f1: 0.3317
 epoch: 1, train_loss: 1.2138, test_loss: 1.1500, test_f1: 0.3679
 epoch: 2, train_loss: 1.1951, test_loss: 1.1259, test_f1: 0.3879
 epoch: 3, train_loss: 1.1595, test_loss: 1.0951, test_f1: 0.3938
 epoch: 4, train_loss: 1.1488, test_loss: 1.0837, test_f1: 0.4003
 epoch: 5, train_loss: 1.1350, test_loss: 1.0801, test_f1: 0.3989
 epoch: 6, train_loss: 1.1198, test_loss: 1.0501, test_f1: 0.4163
 epoch: 7, train_loss: 1.1059, test_loss: 1.0346, test_f1: 0.4181
 epoch: 8, train_loss: 1.0934, test_loss: 1.0356, test_f1: 0.3988
 epoch: 9, train_loss: 1.0794, test_loss: 1.0059, test_f1: 0.4699
 epoch: 10, train_loss: 1.0641, test_loss: 1.0139, test_f1: 0.4403
 epoch: 11, train_loss: 1.0611, test_loss: 0.9996, test_f1: 0.4370
 epoch: 12, train_loss: 1.0422, test_loss: 1.0010, test_f1: 0.4253
 epoch: 13, train_loss: 1.0486, test_loss: 0.9868, test_f1: 0.4381
 epoch: 14, train_loss: 1.0379, test_loss: 0.9828, test_f1: 0.4513
 epoch: 15, train_loss: 1.0269, test_loss: 0.9828, test_f1: 0.4472
 epoch: 16, train_loss: 1.0172, test_loss: 0.9903, test_f1: 0.4351
 epoch: 17, train_loss: 1.0159, test_loss: 0.9938, test_f1: 0.4429
 epoch: 18, train_loss: 1.0048, test_loss: 0.9819, test_f1: 0.4626
 epoch: 19, train_loss: 1.0035, test_loss: 0.9673, test_f1: 0.4491
 epoch: 20, train_loss: 0.9995, test_loss: 0.9692, test_f1: 0.4488
 epoch: 21, train_loss: 0.9876, test_loss: 0.9673, test_f1: 0.4687
 epoch: 22, train_loss: 0.9912, test_loss: 0.9649, test_f1: 0.4630
 epoch: 23, train_loss: 0.9767, test_loss: 0.9835, test_f1: 0.4370
 epoch: 24, train_loss: 0.9810, test_loss: 0.9811, test_f1: 0.4812
 epoch: 25, train_loss: 0.9655, test_loss: 1.0012, test_f1: 0.4616
 epoch: 26, train_loss: 0.9677, test_loss: 0.9843, test_f1: 0.4722
 epoch: 27, train_loss: 0.9606, test_loss: 0.9755, test_f1: 0.4597
 epoch: 28, train_loss: 0.9508, test_loss: 0.9801, test_f1: 0.4941
 epoch: 29, train_loss: 0.9445, test_loss: 0.9677, test_f1: 0.4916
 epoch: 30, train_loss: 0.9594, test_loss: 0.9771, test_f1: 0.4887
 epoch: 31, train_loss: 0.9335, test_loss: 0.9562, test_f1: 0.4991
 epoch: 32, train_loss: 0.9411, test_loss: 0.9731, test_f1: 0.4828
 epoch: 33, train_loss: 0.9272, test_loss: 0.9600, test_f1: 0.4831
 epoch: 34, train_loss: 0.9257, test_loss: 0.9741, test_f1: 0.4835
 epoch: 35, train_loss: 0.9333, test_loss: 0.9656, test_f1: 0.4969
 epoch: 36, train_loss: 0.9294, test_loss: 0.9634, test_f1: 0.5052
 epoch: 37, train_loss: 0.9236, test_loss: 0.9648, test_f1: 0.5067
 epoch: 38, train_loss: 0.9113, test_loss: 0.9631, test_f1: 0.4951
 epoch: 39, train_loss: 0.9214, test_loss: 0.9702, test_f1: 0.4919
 epoch: 40, train_loss: 0.9207, test_loss: 0.9729, test_f1: 0.5029
 epoch: 41, train_loss: 0.9115, test_loss: 0.9887, test_f1: 0.5038
 epoch: 42, train_loss: 0.8961, test_loss: 0.9624, test_f1: 0.4994
 epoch: 43, train_loss: 0.9182, test_loss: 0.9789, test_f1: 0.5119
 epoch: 44, train_loss: 0.9036, test_loss: 0.9650, test_f1: 0.4983
 epoch: 45, train_loss: 0.8958, test_loss: 0.9689, test_f1: 0.5012
 epoch: 46, train_loss: 0.8953, test_loss: 0.9946, test_f1: 0.4935
 epoch: 47, train_loss: 0.8919, test_loss: 0.9487, test_f1: 0.5065
 epoch: 48, train_loss: 0.8928, test_loss: 0.9778, test_f1: 0.5160
 epoch: 49, train_loss: 0.8900, test_loss: 0.9603, test_f1: 0.5138
 epoch: 50, train_loss: 0.8793, test_loss: 0.9518, test_f1: 0.5072
 epoch: 51, train_loss: 0.8891, test_loss: 0.9440, test_f1: 0.5161
 epoch: 52, train_loss: 0.8831, test_loss: 0.9822, test_f1: 0.5059
 epoch: 53, train_loss: 0.8743, test_loss: 0.9591, test_f1: 0.5234
 epoch: 54, train_loss: 0.8797, test_loss: 0.9425, test_f1: 0.5173
 epoch: 55, train_loss: 0.8753, test_loss: 0.9396, test_f1: 0.5100
 epoch: 56, train_loss: 0.8762, test_loss: 0.9657, test_f1: 0.5060
 epoch: 57, train_loss: 0.8766, test_loss: 0.9462, test_f1: 0.5131
 epoch: 58, train_loss: 0.8781, test_loss: 0.9547, test_f1: 0.5171
 epoch: 59, train_loss: 0.8738, test_loss: 0.9805, test_f1: 0.5063
 epoch: 60, train_loss: 0.8712, test_loss: 0.9473, test_f1: 0.5093
 epoch: 61, train_loss: 0.8658, test_loss: 0.9349, test_f1: 0.5167
 epoch: 62, train_loss: 0.8681, test_loss: 0.9496, test_f1: 0.5275
 epoch: 63, train_loss: 0.8733, test_loss: 0.9403, test_f1: 0.5139
 epoch: 64, train_loss: 0.8650, test_loss: 0.9566, test_f1: 0.5107
 epoch: 65, train_loss: 0.8642, test_loss: 0.9617, test_f1: 0.5146
 epoch: 66, train_loss: 0.8566, test_loss: 0.9464, test_f1: 0.5177
 epoch: 67, train_loss: 0.8661, test_loss: 0.9808, test_f1: 0.5164
 epoch: 68, train_loss: 0.8594, test_loss: 0.9729, test_f1: 0.5108
 epoch: 69, train_loss: 0.8601, test_loss: 0.9736, test_f1: 0.5188
 epoch: 70, train_loss: 0.8508, test_loss: 0.9475, test_f1: 0.5188
 epoch: 71, train_loss: 0.8528, test_loss: 0.9628, test_f1: 0.5104
 epoch: 72, train_loss: 0.8615, test_loss: 0.9660, test_f1: 0.5205
 epoch: 73, train_loss: 0.8600, test_loss: 0.9524, test_f1: 0.5369
 epoch: 74, train_loss: 0.8656, test_loss: 0.9432, test_f1: 0.5158
 epoch: 75, train_loss: 0.8552, test_loss: 0.9546, test_f1: 0.5159
 epoch: 76, train_loss: 0.8520, test_loss: 0.9780, test_f1: 0.4892
 epoch: 77, train_loss: 0.8507, test_loss: 0.9530, test_f1: 0.5183
 epoch: 78, train_loss: 0.8538, test_loss: 0.9548, test_f1: 0.5299
 epoch: 79, train_loss: 0.8545, test_loss: 0.9518, test_f1: 0.5138
 epoch: 80, train_loss: 0.8535, test_loss: 0.9525, test_f1: 0.5164
 epoch: 81, train_loss: 0.8442, test_loss: 0.9378, test_f1: 0.5143
 epoch: 82, train_loss: 0.8423, test_loss: 0.9495, test_f1: 0.5172
 epoch: 83, train_loss: 0.8518, test_loss: 0.9434, test_f1: 0.5085
 epoch: 84, train_loss: 0.8517, test_loss: 0.9558, test_f1: 0.5193
 epoch: 85, train_loss: 0.8361, test_loss: 0.9575, test_f1: 0.5198
 epoch: 86, train_loss: 0.8323, test_loss: 0.9618, test_f1: 0.5128
 epoch: 87, train_loss: 0.8383, test_loss: 0.9602, test_f1: 0.5330
 epoch: 88, train_loss: 0.8410, test_loss: 0.9562, test_f1: 0.5192
 epoch: 89, train_loss: 0.8368, test_loss: 0.9566, test_f1: 0.5240
 epoch: 90, train_loss: 0.8409, test_loss: 0.9473, test_f1: 0.5226
 epoch: 91, train_loss: 0.8384, test_loss: 0.9532, test_f1: 0.5235
 epoch: 92, train_loss: 0.8405, test_loss: 0.9557, test_f1: 0.5162
 epoch: 93, train_loss: 0.8394, test_loss: 0.9410, test_f1: 0.5192
 epoch: 94, train_loss: 0.8491, test_loss: 0.9654, test_f1: 0.5115
 epoch: 95, train_loss: 0.8285, test_loss: 0.9704, test_f1: 0.5083
 epoch: 96, train_loss: 0.8357, test_loss: 0.9801, test_f1: 0.4992
 epoch: 97, train_loss: 0.8225, test_loss: 0.9676, test_f1: 0.5043
 epoch: 98, train_loss: 0.8418, test_loss: 0.9667, test_f1: 0.5095
 epoch: 99, train_loss: 0.8389, test_loss: 0.9491, test_f1: 0.5181

Training completed in 1303.56 seconds
Best F1: 0.5593 at epoch 96
Mean F1 across iterations: 0.5470  0.0114
========================FINAL RESULTS================================
FEGIN weighted F1: 0.5593  0.0114
python main.py --data ltspice_examples --representation component_pin --model FEGIN --layers 5 --hiddens 32 --batch_size 32 --lr 0.0001 --emb_size 250 --epochs 100 --save_appendix component_pin_L5_H32_BS32_LR0.0001_E250 --no_val
-----



STDERR:
  File "main.py", line 370, in <module>
    main()
  File "main.py", line 254, in main
    dataset = dataset_class(
  File "/home/philip/projects/ltspice_examples_code_repo/Circuit-Completion-Using-GNNs/component_classification_with_link_prediction_head/evaluation/FEGIN/kernel/circuit_datasets.py", line 15, in __init__
    self.data, self.slices = torch.load(self.processed_paths[0])
  File "/home/philip/.local/lib/python3.8/site-packages/torch/serialization.py", line 1040, in load
    warnings.warn(
  File "/usr/lib/python3.8/warnings.py", line 109, in _showwarnmsg
    sw(msg.message, msg.category, msg.filename, msg.lineno,
  File "main.py", line 47, in warn_with_traceback
    traceback.print_stack(file=log)
/home/philip/projects/ltspice_examples_code_repo/Circuit-Completion-Using-GNNs/component_classification_with_link_prediction_head/evaluation/FEGIN/kernel/circuit_datasets.py:15: FutureWarning: You are using `torch.load` with `weights_only=False` (the current default value), which uses the default pickle module implicitly. It is possible to construct malicious pickle data which will execute arbitrary code during unpickling (See https://github.com/pytorch/pytorch/blob/main/SECURITY.md#untrusted-models for more details). In a future release, the default value for `weights_only` will be flipped to `True`. This limits the functions that could be executed during unpickling. Arbitrary objects will no longer be allowed to be loaded via this mode unless they are explicitly allowlisted by the user via `torch.serialization.add_safe_globals`. We recommend you start setting `weights_only=True` for any use case where you don't have full control of the loaded file. Please open an issue on GitHub for any issues related to this experimental feature.
  self.data, self.slices = torch.load(self.processed_paths[0])
