STDOUT:
Results will be saved in /home/philip/projects/ltspice_examples_code_repo/Circuit-Completion-Using-GNNs/component_classification_with_link_prediction_head/evaluation/FEGIN/results/model_FEGIN_dataset_ltspice_examples
Command line input: python main.py --data ltspice_examples --representation component_component --model FEGIN --layers 5 --hiddens 32 --batch_size 32 --lr 0.0001 --emb_size 512 --epochs 100 --save_appendix component_component_L5_H32_BS32_LR0.0001_E512 --no_val
 is saved.
-----
ltspice_examples - FEGIN
Using 5 layers, 32 hidden units, h = 2
Loading component_component representation dataset
ENTERED
Training FEGIN on component_component representation
Train: 3556, Test: 845
##################ITERATION #0 ****************************************
 epoch: 0, train_loss: 1.3514, test_loss: 1.3465, test_f1: 0.2274
 epoch: 1, train_loss: 1.3345, test_loss: 1.3329, test_f1: 0.2274
 epoch: 2, train_loss: 1.3209, test_loss: 1.3221, test_f1: 0.2274
 epoch: 3, train_loss: 1.3091, test_loss: 1.3058, test_f1: 0.2274
 epoch: 4, train_loss: 1.2962, test_loss: 1.2978, test_f1: 0.2274
 epoch: 5, train_loss: 1.2870, test_loss: 1.2825, test_f1: 0.2274
 epoch: 6, train_loss: 1.2820, test_loss: 1.2745, test_f1: 0.2274
 epoch: 7, train_loss: 1.2699, test_loss: 1.2654, test_f1: 0.2274
 epoch: 8, train_loss: 1.2664, test_loss: 1.2548, test_f1: 0.2274
 epoch: 9, train_loss: 1.2569, test_loss: 1.2482, test_f1: 0.2274
 epoch: 10, train_loss: 1.2502, test_loss: 1.2420, test_f1: 0.2274
 epoch: 11, train_loss: 1.2467, test_loss: 1.2250, test_f1: 0.2274
 epoch: 12, train_loss: 1.2382, test_loss: 1.2253, test_f1: 0.2274
 epoch: 13, train_loss: 1.2309, test_loss: 1.2182, test_f1: 0.2274
 epoch: 14, train_loss: 1.2236, test_loss: 1.2085, test_f1: 0.2833
 epoch: 15, train_loss: 1.2247, test_loss: 1.2029, test_f1: 0.2947
 epoch: 16, train_loss: 1.2168, test_loss: 1.2007, test_f1: 0.2926
 epoch: 17, train_loss: 1.2112, test_loss: 1.1904, test_f1: 0.3175
 epoch: 18, train_loss: 1.2140, test_loss: 1.1873, test_f1: 0.3204
 epoch: 19, train_loss: 1.2046, test_loss: 1.1835, test_f1: 0.3281
 epoch: 20, train_loss: 1.2081, test_loss: 1.1786, test_f1: 0.3314
 epoch: 21, train_loss: 1.1953, test_loss: 1.1701, test_f1: 0.3359
 epoch: 22, train_loss: 1.1886, test_loss: 1.1643, test_f1: 0.3376
 epoch: 23, train_loss: 1.1895, test_loss: 1.1585, test_f1: 0.3497
 epoch: 24, train_loss: 1.1834, test_loss: 1.1604, test_f1: 0.3563
 epoch: 25, train_loss: 1.1789, test_loss: 1.1525, test_f1: 0.3472
 epoch: 26, train_loss: 1.1699, test_loss: 1.1445, test_f1: 0.3523
 epoch: 27, train_loss: 1.1666, test_loss: 1.1395, test_f1: 0.3559
 epoch: 28, train_loss: 1.1639, test_loss: 1.1357, test_f1: 0.3451
 epoch: 29, train_loss: 1.1531, test_loss: 1.1255, test_f1: 0.3689
 epoch: 30, train_loss: 1.1477, test_loss: 1.1266, test_f1: 0.4037
 epoch: 31, train_loss: 1.1452, test_loss: 1.1134, test_f1: 0.4230
 epoch: 32, train_loss: 1.1359, test_loss: 1.1073, test_f1: 0.4271
 epoch: 33, train_loss: 1.1379, test_loss: 1.1034, test_f1: 0.4292
 epoch: 34, train_loss: 1.1294, test_loss: 1.0959, test_f1: 0.4452
 epoch: 35, train_loss: 1.1321, test_loss: 1.0943, test_f1: 0.4299
 epoch: 36, train_loss: 1.1170, test_loss: 1.0890, test_f1: 0.4433
 epoch: 37, train_loss: 1.1102, test_loss: 1.0806, test_f1: 0.4524
 epoch: 38, train_loss: 1.1089, test_loss: 1.1071, test_f1: 0.4421
 epoch: 39, train_loss: 1.0990, test_loss: 1.0835, test_f1: 0.4515
 epoch: 40, train_loss: 1.1036, test_loss: 1.0770, test_f1: 0.4470
 epoch: 41, train_loss: 1.1043, test_loss: 1.0703, test_f1: 0.4605
 epoch: 42, train_loss: 1.1005, test_loss: 1.0727, test_f1: 0.4525
 epoch: 43, train_loss: 1.0899, test_loss: 1.0494, test_f1: 0.4703
 epoch: 44, train_loss: 1.0896, test_loss: 1.0644, test_f1: 0.4399
 epoch: 45, train_loss: 1.0872, test_loss: 1.0570, test_f1: 0.4620
 epoch: 46, train_loss: 1.0836, test_loss: 1.0641, test_f1: 0.4520
 epoch: 47, train_loss: 1.0947, test_loss: 1.0663, test_f1: 0.4431
 epoch: 48, train_loss: 1.0801, test_loss: 1.0550, test_f1: 0.4500
 epoch: 49, train_loss: 1.0739, test_loss: 1.0574, test_f1: 0.4493
 epoch: 50, train_loss: 1.0756, test_loss: 1.0458, test_f1: 0.4749
 epoch: 51, train_loss: 1.0764, test_loss: 1.0433, test_f1: 0.4687
 epoch: 52, train_loss: 1.0689, test_loss: 1.0433, test_f1: 0.4737
 epoch: 53, train_loss: 1.0693, test_loss: 1.0507, test_f1: 0.4536
 epoch: 54, train_loss: 1.0636, test_loss: 1.0365, test_f1: 0.4864
 epoch: 55, train_loss: 1.0599, test_loss: 1.0484, test_f1: 0.4682
 epoch: 56, train_loss: 1.0748, test_loss: 1.0422, test_f1: 0.4661
 epoch: 57, train_loss: 1.0673, test_loss: 1.0417, test_f1: 0.4558
 epoch: 58, train_loss: 1.0597, test_loss: 1.0354, test_f1: 0.4703
 epoch: 59, train_loss: 1.0527, test_loss: 1.0470, test_f1: 0.4560
 epoch: 60, train_loss: 1.0703, test_loss: 1.0375, test_f1: 0.4880
 epoch: 61, train_loss: 1.0662, test_loss: 1.0409, test_f1: 0.4741
 epoch: 62, train_loss: 1.0538, test_loss: 1.0406, test_f1: 0.4564
 epoch: 63, train_loss: 1.0587, test_loss: 1.0407, test_f1: 0.4668
 epoch: 64, train_loss: 1.0569, test_loss: 1.0602, test_f1: 0.4504
 epoch: 65, train_loss: 1.0516, test_loss: 1.0351, test_f1: 0.4707
 epoch: 66, train_loss: 1.0481, test_loss: 1.0440, test_f1: 0.4869
 epoch: 67, train_loss: 1.0496, test_loss: 1.0422, test_f1: 0.4817
 epoch: 68, train_loss: 1.0441, test_loss: 1.0333, test_f1: 0.4692
 epoch: 69, train_loss: 1.0479, test_loss: 1.0363, test_f1: 0.4750
 epoch: 70, train_loss: 1.0425, test_loss: 1.0472, test_f1: 0.4461
 epoch: 71, train_loss: 1.0397, test_loss: 1.0300, test_f1: 0.4863
 epoch: 72, train_loss: 1.0423, test_loss: 1.0331, test_f1: 0.4760
 epoch: 73, train_loss: 1.0450, test_loss: 1.0307, test_f1: 0.4703
 epoch: 74, train_loss: 1.0470, test_loss: 1.0299, test_f1: 0.4925
 epoch: 75, train_loss: 1.0429, test_loss: 1.0080, test_f1: 0.5047
 epoch: 76, train_loss: 1.0410, test_loss: 1.0226, test_f1: 0.4925
 epoch: 77, train_loss: 1.0418, test_loss: 1.0232, test_f1: 0.4728
 epoch: 78, train_loss: 1.0388, test_loss: 1.0230, test_f1: 0.4926
 epoch: 79, train_loss: 1.0319, test_loss: 1.0651, test_f1: 0.4524
 epoch: 80, train_loss: 1.0344, test_loss: 1.0562, test_f1: 0.4567
 epoch: 81, train_loss: 1.0285, test_loss: 1.0207, test_f1: 0.4855
 epoch: 82, train_loss: 1.0404, test_loss: 1.0221, test_f1: 0.4876
 epoch: 83, train_loss: 1.0293, test_loss: 1.0100, test_f1: 0.4753
 epoch: 84, train_loss: 1.0392, test_loss: 1.0205, test_f1: 0.4745
 epoch: 85, train_loss: 1.0274, test_loss: 1.0142, test_f1: 0.4745
 epoch: 86, train_loss: 1.0269, test_loss: 1.0116, test_f1: 0.4784
 epoch: 87, train_loss: 1.0291, test_loss: 1.0173, test_f1: 0.4742
 epoch: 88, train_loss: 1.0342, test_loss: 1.0210, test_f1: 0.4676
 epoch: 89, train_loss: 1.0227, test_loss: 1.0268, test_f1: 0.4760
 epoch: 90, train_loss: 1.0247, test_loss: 1.0279, test_f1: 0.4812
 epoch: 91, train_loss: 1.0223, test_loss: 1.0167, test_f1: 0.4731
 epoch: 92, train_loss: 1.0301, test_loss: 1.0222, test_f1: 0.4953
 epoch: 93, train_loss: 1.0220, test_loss: 1.0050, test_f1: 0.4788
 epoch: 94, train_loss: 1.0114, test_loss: 1.0227, test_f1: 0.4786
 epoch: 95, train_loss: 1.0240, test_loss: 1.0221, test_f1: 0.4745
 epoch: 96, train_loss: 1.0159, test_loss: 1.0004, test_f1: 0.4886
 epoch: 97, train_loss: 1.0275, test_loss: 1.0052, test_f1: 0.4798
 epoch: 98, train_loss: 1.0106, test_loss: 1.0279, test_f1: 0.4546
 epoch: 99, train_loss: 1.0134, test_loss: 1.0131, test_f1: 0.4685
##################ITERATION #1 ****************************************
 epoch: 0, train_loss: 1.3239, test_loss: 1.3519, test_f1: 0.2274
 epoch: 1, train_loss: 1.2901, test_loss: 1.2841, test_f1: 0.2274
 epoch: 2, train_loss: 1.2722, test_loss: 1.2697, test_f1: 0.2274
 epoch: 3, train_loss: 1.2648, test_loss: 1.2595, test_f1: 0.2274
 epoch: 4, train_loss: 1.2522, test_loss: 1.2459, test_f1: 0.2274
 epoch: 5, train_loss: 1.2472, test_loss: 1.2386, test_f1: 0.2274
 epoch: 6, train_loss: 1.2413, test_loss: 1.2320, test_f1: 0.2359
 epoch: 7, train_loss: 1.2354, test_loss: 1.2287, test_f1: 0.2742
 epoch: 8, train_loss: 1.2307, test_loss: 1.2226, test_f1: 0.2932
 epoch: 9, train_loss: 1.2201, test_loss: 1.2083, test_f1: 0.2969
 epoch: 10, train_loss: 1.2180, test_loss: 1.1989, test_f1: 0.3382
 epoch: 11, train_loss: 1.2105, test_loss: 1.1956, test_f1: 0.3684
 epoch: 12, train_loss: 1.2068, test_loss: 1.1863, test_f1: 0.3839
 epoch: 13, train_loss: 1.2051, test_loss: 1.1851, test_f1: 0.3879
 epoch: 14, train_loss: 1.1972, test_loss: 1.1757, test_f1: 0.3865
 epoch: 15, train_loss: 1.1911, test_loss: 1.1737, test_f1: 0.3958
 epoch: 16, train_loss: 1.1865, test_loss: 1.1581, test_f1: 0.4048
 epoch: 17, train_loss: 1.1816, test_loss: 1.1559, test_f1: 0.4072
 epoch: 18, train_loss: 1.1742, test_loss: 1.1449, test_f1: 0.4252
 epoch: 19, train_loss: 1.1628, test_loss: 1.1449, test_f1: 0.4396
 epoch: 20, train_loss: 1.1625, test_loss: 1.1334, test_f1: 0.4473
 epoch: 21, train_loss: 1.1548, test_loss: 1.1223, test_f1: 0.4568
 epoch: 22, train_loss: 1.1528, test_loss: 1.1156, test_f1: 0.4435
 epoch: 23, train_loss: 1.1487, test_loss: 1.1157, test_f1: 0.4495
 epoch: 24, train_loss: 1.1525, test_loss: 1.1139, test_f1: 0.4458
 epoch: 25, train_loss: 1.1430, test_loss: 1.1117, test_f1: 0.4419
 epoch: 26, train_loss: 1.1371, test_loss: 1.1086, test_f1: 0.4472
 epoch: 27, train_loss: 1.1328, test_loss: 1.0941, test_f1: 0.4494
 epoch: 28, train_loss: 1.1297, test_loss: 1.0908, test_f1: 0.4665
 epoch: 29, train_loss: 1.1286, test_loss: 1.0937, test_f1: 0.4416
 epoch: 30, train_loss: 1.1296, test_loss: 1.0958, test_f1: 0.4437
 epoch: 31, train_loss: 1.1235, test_loss: 1.0910, test_f1: 0.4601
 epoch: 32, train_loss: 1.1073, test_loss: 1.0795, test_f1: 0.4555
 epoch: 33, train_loss: 1.1120, test_loss: 1.0829, test_f1: 0.4426
 epoch: 34, train_loss: 1.1156, test_loss: 1.0675, test_f1: 0.4522
 epoch: 35, train_loss: 1.1171, test_loss: 1.0741, test_f1: 0.4567
 epoch: 36, train_loss: 1.1145, test_loss: 1.0643, test_f1: 0.4447
 epoch: 37, train_loss: 1.1074, test_loss: 1.0680, test_f1: 0.4527
 epoch: 38, train_loss: 1.0987, test_loss: 1.0681, test_f1: 0.4450
 epoch: 39, train_loss: 1.1012, test_loss: 1.0630, test_f1: 0.4498
 epoch: 40, train_loss: 1.0882, test_loss: 1.0505, test_f1: 0.4586
 epoch: 41, train_loss: 1.0890, test_loss: 1.0518, test_f1: 0.4478
 epoch: 42, train_loss: 1.0894, test_loss: 1.0461, test_f1: 0.4601
 epoch: 43, train_loss: 1.0854, test_loss: 1.0459, test_f1: 0.4565
 epoch: 44, train_loss: 1.0898, test_loss: 1.0593, test_f1: 0.4561
 epoch: 45, train_loss: 1.0800, test_loss: 1.0676, test_f1: 0.4663
 epoch: 46, train_loss: 1.0726, test_loss: 1.0485, test_f1: 0.4583
 epoch: 47, train_loss: 1.0801, test_loss: 1.0432, test_f1: 0.4736
 epoch: 48, train_loss: 1.0679, test_loss: 1.0565, test_f1: 0.4801
 epoch: 49, train_loss: 1.0742, test_loss: 1.0360, test_f1: 0.4654
 epoch: 50, train_loss: 1.0657, test_loss: 1.0300, test_f1: 0.4815
 epoch: 51, train_loss: 1.0640, test_loss: 1.0421, test_f1: 0.4617
 epoch: 52, train_loss: 1.0622, test_loss: 1.0429, test_f1: 0.4648
 epoch: 53, train_loss: 1.0729, test_loss: 1.0398, test_f1: 0.4643
 epoch: 54, train_loss: 1.0604, test_loss: 1.0441, test_f1: 0.4841
 epoch: 55, train_loss: 1.0580, test_loss: 1.0405, test_f1: 0.4733
 epoch: 56, train_loss: 1.0619, test_loss: 1.0428, test_f1: 0.4446
 epoch: 57, train_loss: 1.0537, test_loss: 1.0608, test_f1: 0.4485
 epoch: 58, train_loss: 1.0552, test_loss: 1.0276, test_f1: 0.4715
 epoch: 59, train_loss: 1.0637, test_loss: 1.0325, test_f1: 0.4901
 epoch: 60, train_loss: 1.0624, test_loss: 1.0400, test_f1: 0.4579
 epoch: 61, train_loss: 1.0591, test_loss: 1.0252, test_f1: 0.4901
 epoch: 62, train_loss: 1.0527, test_loss: 1.0271, test_f1: 0.4775
 epoch: 63, train_loss: 1.0526, test_loss: 1.0369, test_f1: 0.4568
 epoch: 64, train_loss: 1.0473, test_loss: 1.0374, test_f1: 0.4484
 epoch: 65, train_loss: 1.0587, test_loss: 1.0256, test_f1: 0.4555
 epoch: 66, train_loss: 1.0424, test_loss: 1.0252, test_f1: 0.4698
 epoch: 67, train_loss: 1.0513, test_loss: 1.0223, test_f1: 0.4531
 epoch: 68, train_loss: 1.0524, test_loss: 1.0245, test_f1: 0.4771
 epoch: 69, train_loss: 1.0427, test_loss: 1.0406, test_f1: 0.4457
 epoch: 70, train_loss: 1.0394, test_loss: 1.0316, test_f1: 0.4541
 epoch: 71, train_loss: 1.0498, test_loss: 1.0414, test_f1: 0.4654
 epoch: 72, train_loss: 1.0418, test_loss: 1.0196, test_f1: 0.4857
 epoch: 73, train_loss: 1.0502, test_loss: 1.0354, test_f1: 0.4594
 epoch: 74, train_loss: 1.0287, test_loss: 1.0218, test_f1: 0.4741
 epoch: 75, train_loss: 1.0454, test_loss: 1.0299, test_f1: 0.4745
 epoch: 76, train_loss: 1.0410, test_loss: 1.0222, test_f1: 0.4657
 epoch: 77, train_loss: 1.0299, test_loss: 1.0165, test_f1: 0.4736
 epoch: 78, train_loss: 1.0319, test_loss: 1.0224, test_f1: 0.4735
 epoch: 79, train_loss: 1.0391, test_loss: 1.0242, test_f1: 0.4480
 epoch: 80, train_loss: 1.0437, test_loss: 1.0461, test_f1: 0.4626
 epoch: 81, train_loss: 1.0349, test_loss: 1.0184, test_f1: 0.4661
 epoch: 82, train_loss: 1.0309, test_loss: 1.0299, test_f1: 0.4768
 epoch: 83, train_loss: 1.0319, test_loss: 1.0329, test_f1: 0.4743
 epoch: 84, train_loss: 1.0287, test_loss: 1.0173, test_f1: 0.4800
 epoch: 85, train_loss: 1.0364, test_loss: 1.0170, test_f1: 0.4727
 epoch: 86, train_loss: 1.0337, test_loss: 1.0165, test_f1: 0.4648
 epoch: 87, train_loss: 1.0335, test_loss: 1.0382, test_f1: 0.4644
 epoch: 88, train_loss: 1.0448, test_loss: 1.0163, test_f1: 0.4670
 epoch: 89, train_loss: 1.0311, test_loss: 1.0247, test_f1: 0.4646
 epoch: 90, train_loss: 1.0286, test_loss: 1.0264, test_f1: 0.4782
 epoch: 91, train_loss: 1.0315, test_loss: 1.0153, test_f1: 0.4848
 epoch: 92, train_loss: 1.0239, test_loss: 1.0363, test_f1: 0.4815
 epoch: 93, train_loss: 1.0228, test_loss: 1.0214, test_f1: 0.4743
 epoch: 94, train_loss: 1.0342, test_loss: 1.0131, test_f1: 0.4746
 epoch: 95, train_loss: 1.0191, test_loss: 1.0195, test_f1: 0.4807
 epoch: 96, train_loss: 1.0303, test_loss: 1.0269, test_f1: 0.4736
 epoch: 97, train_loss: 1.0186, test_loss: 1.0144, test_f1: 0.4668
 epoch: 98, train_loss: 1.0234, test_loss: 1.0005, test_f1: 0.4844
 epoch: 99, train_loss: 1.0238, test_loss: 1.0038, test_f1: 0.4638
##################ITERATION #2 ****************************************
 epoch: 0, train_loss: 1.3129, test_loss: 1.2805, test_f1: 0.2274
 epoch: 1, train_loss: 1.2836, test_loss: 1.2707, test_f1: 0.2274
 epoch: 2, train_loss: 1.2738, test_loss: 1.2564, test_f1: 0.2274
 epoch: 3, train_loss: 1.2589, test_loss: 1.2509, test_f1: 0.2527
 epoch: 4, train_loss: 1.2557, test_loss: 1.2446, test_f1: 0.2689
 epoch: 5, train_loss: 1.2456, test_loss: 1.2388, test_f1: 0.2840
 epoch: 6, train_loss: 1.2406, test_loss: 1.2293, test_f1: 0.2892
 epoch: 7, train_loss: 1.2327, test_loss: 1.2219, test_f1: 0.2986
 epoch: 8, train_loss: 1.2254, test_loss: 1.2138, test_f1: 0.3217
 epoch: 9, train_loss: 1.2202, test_loss: 1.2031, test_f1: 0.3538
 epoch: 10, train_loss: 1.2187, test_loss: 1.1947, test_f1: 0.3639
 epoch: 11, train_loss: 1.2101, test_loss: 1.1888, test_f1: 0.3663
 epoch: 12, train_loss: 1.2072, test_loss: 1.1807, test_f1: 0.3724
 epoch: 13, train_loss: 1.1977, test_loss: 1.1729, test_f1: 0.3831
 epoch: 14, train_loss: 1.1893, test_loss: 1.1580, test_f1: 0.3784
 epoch: 15, train_loss: 1.1874, test_loss: 1.1503, test_f1: 0.3920
 epoch: 16, train_loss: 1.1812, test_loss: 1.1466, test_f1: 0.3926
 epoch: 17, train_loss: 1.1758, test_loss: 1.1346, test_f1: 0.3863
 epoch: 18, train_loss: 1.1674, test_loss: 1.1343, test_f1: 0.4104
 epoch: 19, train_loss: 1.1668, test_loss: 1.1236, test_f1: 0.4127
 epoch: 20, train_loss: 1.1596, test_loss: 1.1130, test_f1: 0.4063
 epoch: 21, train_loss: 1.1566, test_loss: 1.1126, test_f1: 0.4373
 epoch: 22, train_loss: 1.1455, test_loss: 1.1162, test_f1: 0.4310
 epoch: 23, train_loss: 1.1532, test_loss: 1.1115, test_f1: 0.4339
 epoch: 24, train_loss: 1.1425, test_loss: 1.1001, test_f1: 0.4325
 epoch: 25, train_loss: 1.1456, test_loss: 1.1036, test_f1: 0.4401
 epoch: 26, train_loss: 1.1315, test_loss: 1.0945, test_f1: 0.4436
 epoch: 27, train_loss: 1.1310, test_loss: 1.0965, test_f1: 0.4321
 epoch: 28, train_loss: 1.1274, test_loss: 1.1000, test_f1: 0.4377
 epoch: 29, train_loss: 1.1245, test_loss: 1.0923, test_f1: 0.4356
 epoch: 30, train_loss: 1.1206, test_loss: 1.0842, test_f1: 0.4505
 epoch: 31, train_loss: 1.1156, test_loss: 1.0747, test_f1: 0.4533
 epoch: 32, train_loss: 1.1115, test_loss: 1.0760, test_f1: 0.4498
 epoch: 33, train_loss: 1.1148, test_loss: 1.0716, test_f1: 0.4515
 epoch: 34, train_loss: 1.1085, test_loss: 1.0634, test_f1: 0.4701
 epoch: 35, train_loss: 1.1085, test_loss: 1.0717, test_f1: 0.4608
 epoch: 36, train_loss: 1.1071, test_loss: 1.0732, test_f1: 0.4508
 epoch: 37, train_loss: 1.0908, test_loss: 1.0659, test_f1: 0.4540
 epoch: 38, train_loss: 1.0877, test_loss: 1.0644, test_f1: 0.4566
 epoch: 39, train_loss: 1.0889, test_loss: 1.0589, test_f1: 0.4574
 epoch: 40, train_loss: 1.0903, test_loss: 1.0567, test_f1: 0.4596
 epoch: 41, train_loss: 1.0804, test_loss: 1.0514, test_f1: 0.4493
 epoch: 42, train_loss: 1.0781, test_loss: 1.0579, test_f1: 0.4547
 epoch: 43, train_loss: 1.0779, test_loss: 1.0506, test_f1: 0.4488
 epoch: 44, train_loss: 1.0815, test_loss: 1.0481, test_f1: 0.4598
 epoch: 45, train_loss: 1.0691, test_loss: 1.0413, test_f1: 0.4422
 epoch: 46, train_loss: 1.0741, test_loss: 1.0553, test_f1: 0.4424
 epoch: 47, train_loss: 1.0586, test_loss: 1.0549, test_f1: 0.4505
 epoch: 48, train_loss: 1.0644, test_loss: 1.0385, test_f1: 0.4501
 epoch: 49, train_loss: 1.0653, test_loss: 1.0385, test_f1: 0.4437
 epoch: 50, train_loss: 1.0568, test_loss: 1.0462, test_f1: 0.4512
 epoch: 51, train_loss: 1.0579, test_loss: 1.0373, test_f1: 0.4566
 epoch: 52, train_loss: 1.0575, test_loss: 1.0320, test_f1: 0.4714
 epoch: 53, train_loss: 1.0560, test_loss: 1.0337, test_f1: 0.4502
 epoch: 54, train_loss: 1.0461, test_loss: 1.0374, test_f1: 0.4480
 epoch: 55, train_loss: 1.0548, test_loss: 1.0308, test_f1: 0.4612
 epoch: 56, train_loss: 1.0520, test_loss: 1.0353, test_f1: 0.4559
 epoch: 57, train_loss: 1.0436, test_loss: 1.0259, test_f1: 0.4566
 epoch: 58, train_loss: 1.0438, test_loss: 1.0287, test_f1: 0.4588
 epoch: 59, train_loss: 1.0452, test_loss: 1.0342, test_f1: 0.4582
 epoch: 60, train_loss: 1.0439, test_loss: 1.0280, test_f1: 0.4594
 epoch: 61, train_loss: 1.0369, test_loss: 1.0221, test_f1: 0.4589
 epoch: 62, train_loss: 1.0396, test_loss: 1.0068, test_f1: 0.4674
 epoch: 63, train_loss: 1.0391, test_loss: 1.0274, test_f1: 0.4605
 epoch: 64, train_loss: 1.0396, test_loss: 1.0251, test_f1: 0.4574
 epoch: 65, train_loss: 1.0269, test_loss: 1.0284, test_f1: 0.4617
 epoch: 66, train_loss: 1.0259, test_loss: 1.0223, test_f1: 0.4652
 epoch: 67, train_loss: 1.0435, test_loss: 1.0138, test_f1: 0.4630
 epoch: 68, train_loss: 1.0319, test_loss: 1.0299, test_f1: 0.4597
 epoch: 69, train_loss: 1.0327, test_loss: 1.0251, test_f1: 0.4547
 epoch: 70, train_loss: 1.0341, test_loss: 1.0198, test_f1: 0.4605
 epoch: 71, train_loss: 1.0268, test_loss: 1.0128, test_f1: 0.4752
 epoch: 72, train_loss: 1.0269, test_loss: 1.0221, test_f1: 0.4654
 epoch: 73, train_loss: 1.0286, test_loss: 1.0331, test_f1: 0.4509
 epoch: 74, train_loss: 1.0281, test_loss: 1.0279, test_f1: 0.4619
 epoch: 75, train_loss: 1.0178, test_loss: 1.0191, test_f1: 0.4553
 epoch: 76, train_loss: 1.0212, test_loss: 1.0008, test_f1: 0.4846
 epoch: 77, train_loss: 1.0263, test_loss: 1.0320, test_f1: 0.4664
 epoch: 78, train_loss: 1.0214, test_loss: 1.0136, test_f1: 0.4712
 epoch: 79, train_loss: 1.0261, test_loss: 1.0213, test_f1: 0.4632
 epoch: 80, train_loss: 1.0185, test_loss: 1.0301, test_f1: 0.4647
 epoch: 81, train_loss: 1.0235, test_loss: 1.0142, test_f1: 0.4604
 epoch: 82, train_loss: 1.0134, test_loss: 1.0139, test_f1: 0.4698
 epoch: 83, train_loss: 1.0120, test_loss: 1.0135, test_f1: 0.4616
 epoch: 84, train_loss: 1.0162, test_loss: 1.0092, test_f1: 0.4655
 epoch: 85, train_loss: 1.0203, test_loss: 1.0057, test_f1: 0.4823
 epoch: 86, train_loss: 1.0082, test_loss: 1.0170, test_f1: 0.4657
 epoch: 87, train_loss: 1.0137, test_loss: 1.0192, test_f1: 0.4654
 epoch: 88, train_loss: 1.0120, test_loss: 1.0149, test_f1: 0.4736
 epoch: 89, train_loss: 1.0055, test_loss: 0.9959, test_f1: 0.4794
 epoch: 90, train_loss: 1.0005, test_loss: 1.0058, test_f1: 0.4662
 epoch: 91, train_loss: 1.0082, test_loss: 1.0133, test_f1: 0.4773
 epoch: 92, train_loss: 0.9985, test_loss: 1.0162, test_f1: 0.4747
 epoch: 93, train_loss: 0.9970, test_loss: 0.9942, test_f1: 0.4814
 epoch: 94, train_loss: 1.0060, test_loss: 0.9908, test_f1: 0.4958
 epoch: 95, train_loss: 1.0011, test_loss: 1.0303, test_f1: 0.4669
 epoch: 96, train_loss: 1.0142, test_loss: 1.0172, test_f1: 0.4618
 epoch: 97, train_loss: 1.0027, test_loss: 1.0015, test_f1: 0.4858
 epoch: 98, train_loss: 0.9919, test_loss: 1.0018, test_f1: 0.4827
 epoch: 99, train_loss: 1.0021, test_loss: 1.0038, test_f1: 0.4759
##################ITERATION #3 ****************************************
 epoch: 0, train_loss: 1.3090, test_loss: 1.2751, test_f1: 0.2274
 epoch: 1, train_loss: 1.2736, test_loss: 1.2575, test_f1: 0.2274
 epoch: 2, train_loss: 1.2624, test_loss: 1.2451, test_f1: 0.2327
 epoch: 3, train_loss: 1.2553, test_loss: 1.2270, test_f1: 0.2601
 epoch: 4, train_loss: 1.2461, test_loss: 1.2197, test_f1: 0.3050
 epoch: 5, train_loss: 1.2377, test_loss: 1.2075, test_f1: 0.3408
 epoch: 6, train_loss: 1.2254, test_loss: 1.1968, test_f1: 0.3560
 epoch: 7, train_loss: 1.2243, test_loss: 1.1890, test_f1: 0.3657
 epoch: 8, train_loss: 1.2228, test_loss: 1.1824, test_f1: 0.3773
 epoch: 9, train_loss: 1.2160, test_loss: 1.1800, test_f1: 0.3749
 epoch: 10, train_loss: 1.2064, test_loss: 1.1690, test_f1: 0.3927
 epoch: 11, train_loss: 1.2074, test_loss: 1.1684, test_f1: 0.3908
 epoch: 12, train_loss: 1.2053, test_loss: 1.1566, test_f1: 0.3846
 epoch: 13, train_loss: 1.1992, test_loss: 1.1589, test_f1: 0.4142
 epoch: 14, train_loss: 1.1941, test_loss: 1.1511, test_f1: 0.4148
 epoch: 15, train_loss: 1.1853, test_loss: 1.1432, test_f1: 0.4224
 epoch: 16, train_loss: 1.1829, test_loss: 1.1379, test_f1: 0.4224
 epoch: 17, train_loss: 1.1840, test_loss: 1.1400, test_f1: 0.4189
 epoch: 18, train_loss: 1.1760, test_loss: 1.1373, test_f1: 0.4376
 epoch: 19, train_loss: 1.1809, test_loss: 1.1343, test_f1: 0.4413
 epoch: 20, train_loss: 1.1741, test_loss: 1.1277, test_f1: 0.4133
 epoch: 21, train_loss: 1.1727, test_loss: 1.1222, test_f1: 0.4205
 epoch: 22, train_loss: 1.1621, test_loss: 1.1206, test_f1: 0.4312
 epoch: 23, train_loss: 1.1644, test_loss: 1.1102, test_f1: 0.4377
 epoch: 24, train_loss: 1.1638, test_loss: 1.1037, test_f1: 0.4296
 epoch: 25, train_loss: 1.1523, test_loss: 1.1163, test_f1: 0.4079
 epoch: 26, train_loss: 1.1418, test_loss: 1.0956, test_f1: 0.4472
 epoch: 27, train_loss: 1.1511, test_loss: 1.1146, test_f1: 0.4239
 epoch: 28, train_loss: 1.1460, test_loss: 1.0992, test_f1: 0.4277
 epoch: 29, train_loss: 1.1400, test_loss: 1.0925, test_f1: 0.4399
 epoch: 30, train_loss: 1.1333, test_loss: 1.0829, test_f1: 0.4410
 epoch: 31, train_loss: 1.1408, test_loss: 1.0831, test_f1: 0.4294
 epoch: 32, train_loss: 1.1334, test_loss: 1.0762, test_f1: 0.4576
 epoch: 33, train_loss: 1.1230, test_loss: 1.0779, test_f1: 0.4568
 epoch: 34, train_loss: 1.1249, test_loss: 1.0977, test_f1: 0.4303
 epoch: 35, train_loss: 1.1205, test_loss: 1.0644, test_f1: 0.4593
 epoch: 36, train_loss: 1.1182, test_loss: 1.0630, test_f1: 0.4502
 epoch: 37, train_loss: 1.1130, test_loss: 1.0763, test_f1: 0.4506
 epoch: 38, train_loss: 1.1089, test_loss: 1.1024, test_f1: 0.4150
 epoch: 39, train_loss: 1.1127, test_loss: 1.0705, test_f1: 0.4487
 epoch: 40, train_loss: 1.1184, test_loss: 1.0720, test_f1: 0.4377
 epoch: 41, train_loss: 1.1078, test_loss: 1.0674, test_f1: 0.4315
 epoch: 42, train_loss: 1.1058, test_loss: 1.0675, test_f1: 0.4476
 epoch: 43, train_loss: 1.0940, test_loss: 1.0526, test_f1: 0.4374
 epoch: 44, train_loss: 1.0939, test_loss: 1.0517, test_f1: 0.4362
 epoch: 45, train_loss: 1.0924, test_loss: 1.0552, test_f1: 0.4383
 epoch: 46, train_loss: 1.0907, test_loss: 1.0510, test_f1: 0.4494
 epoch: 47, train_loss: 1.0963, test_loss: 1.0407, test_f1: 0.4649
 epoch: 48, train_loss: 1.0967, test_loss: 1.0486, test_f1: 0.4461
 epoch: 49, train_loss: 1.0813, test_loss: 1.0510, test_f1: 0.4571
 epoch: 50, train_loss: 1.0842, test_loss: 1.0366, test_f1: 0.4569
 epoch: 51, train_loss: 1.0788, test_loss: 1.0384, test_f1: 0.4443
 epoch: 52, train_loss: 1.0720, test_loss: 1.0463, test_f1: 0.4400
 epoch: 53, train_loss: 1.0784, test_loss: 1.0382, test_f1: 0.4569
 epoch: 54, train_loss: 1.0784, test_loss: 1.0633, test_f1: 0.4359
 epoch: 55, train_loss: 1.0779, test_loss: 1.0696, test_f1: 0.4358
 epoch: 56, train_loss: 1.0817, test_loss: 1.0678, test_f1: 0.4422
 epoch: 57, train_loss: 1.0683, test_loss: 1.0628, test_f1: 0.4493
 epoch: 58, train_loss: 1.0799, test_loss: 1.0545, test_f1: 0.4477
 epoch: 59, train_loss: 1.0739, test_loss: 1.0293, test_f1: 0.4505
 epoch: 60, train_loss: 1.0774, test_loss: 1.0367, test_f1: 0.4563
 epoch: 61, train_loss: 1.0740, test_loss: 1.0324, test_f1: 0.4473
 epoch: 62, train_loss: 1.0620, test_loss: 1.0343, test_f1: 0.4601
 epoch: 63, train_loss: 1.0715, test_loss: 1.0339, test_f1: 0.4561
 epoch: 64, train_loss: 1.0581, test_loss: 1.0429, test_f1: 0.4586
 epoch: 65, train_loss: 1.0720, test_loss: 1.0360, test_f1: 0.4529
 epoch: 66, train_loss: 1.0656, test_loss: 1.0313, test_f1: 0.4558
 epoch: 67, train_loss: 1.0622, test_loss: 1.0571, test_f1: 0.4447
 epoch: 68, train_loss: 1.0648, test_loss: 1.0182, test_f1: 0.4637
 epoch: 69, train_loss: 1.0592, test_loss: 1.0243, test_f1: 0.4503
 epoch: 70, train_loss: 1.0659, test_loss: 1.0364, test_f1: 0.4393
 epoch: 71, train_loss: 1.0663, test_loss: 1.0329, test_f1: 0.4524
 epoch: 72, train_loss: 1.0564, test_loss: 1.0643, test_f1: 0.4438
 epoch: 73, train_loss: 1.0527, test_loss: 1.0460, test_f1: 0.4658
 epoch: 74, train_loss: 1.0602, test_loss: 1.0454, test_f1: 0.4554
 epoch: 75, train_loss: 1.0581, test_loss: 1.0274, test_f1: 0.4605
 epoch: 76, train_loss: 1.0528, test_loss: 1.0335, test_f1: 0.4561
 epoch: 77, train_loss: 1.0540, test_loss: 1.0384, test_f1: 0.4492
 epoch: 78, train_loss: 1.0479, test_loss: 1.0253, test_f1: 0.4633
 epoch: 79, train_loss: 1.0524, test_loss: 1.0285, test_f1: 0.4558
 epoch: 80, train_loss: 1.0470, test_loss: 1.0177, test_f1: 0.4568
 epoch: 81, train_loss: 1.0489, test_loss: 1.0623, test_f1: 0.4550
 epoch: 82, train_loss: 1.0529, test_loss: 1.0491, test_f1: 0.4452
 epoch: 83, train_loss: 1.0511, test_loss: 1.0837, test_f1: 0.4434
 epoch: 84, train_loss: 1.0462, test_loss: 1.0578, test_f1: 0.4565
 epoch: 85, train_loss: 1.0447, test_loss: 1.1550, test_f1: 0.4333
 epoch: 86, train_loss: 1.0473, test_loss: 1.0365, test_f1: 0.4502
 epoch: 87, train_loss: 1.0512, test_loss: 1.0208, test_f1: 0.4655
 epoch: 88, train_loss: 1.0419, test_loss: 1.0337, test_f1: 0.4494
 epoch: 89, train_loss: 1.0469, test_loss: 1.0115, test_f1: 0.4454
 epoch: 90, train_loss: 1.0388, test_loss: 1.0357, test_f1: 0.4476
 epoch: 91, train_loss: 1.0476, test_loss: 1.0803, test_f1: 0.4434
 epoch: 92, train_loss: 1.0448, test_loss: 1.0319, test_f1: 0.4609
 epoch: 93, train_loss: 1.0484, test_loss: 1.0365, test_f1: 0.4403
 epoch: 94, train_loss: 1.0379, test_loss: 1.0221, test_f1: 0.4420
 epoch: 95, train_loss: 1.0482, test_loss: 1.0616, test_f1: 0.4390
 epoch: 96, train_loss: 1.0272, test_loss: 1.0499, test_f1: 0.4502
 epoch: 97, train_loss: 1.0417, test_loss: 1.0606, test_f1: 0.4447
 epoch: 98, train_loss: 1.0357, test_loss: 1.2070, test_f1: 0.4322
 epoch: 99, train_loss: 1.0370, test_loss: 1.0341, test_f1: 0.4596
##################ITERATION #4 ****************************************
 epoch: 0, train_loss: 1.3320, test_loss: 1.2779, test_f1: 0.2370
 epoch: 1, train_loss: 1.2672, test_loss: 1.2559, test_f1: 0.2443
 epoch: 2, train_loss: 1.2570, test_loss: 1.2421, test_f1: 0.2370
 epoch: 3, train_loss: 1.2408, test_loss: 1.2282, test_f1: 0.2478
 epoch: 4, train_loss: 1.2350, test_loss: 1.2181, test_f1: 0.2917
 epoch: 5, train_loss: 1.2254, test_loss: 1.2065, test_f1: 0.2621
 epoch: 6, train_loss: 1.2224, test_loss: 1.1929, test_f1: 0.3911
 epoch: 7, train_loss: 1.2115, test_loss: 1.1792, test_f1: 0.3939
 epoch: 8, train_loss: 1.2047, test_loss: 1.1706, test_f1: 0.4024
 epoch: 9, train_loss: 1.1971, test_loss: 1.1591, test_f1: 0.4039
 epoch: 10, train_loss: 1.1867, test_loss: 1.1509, test_f1: 0.4228
 epoch: 11, train_loss: 1.1878, test_loss: 1.1375, test_f1: 0.4134
 epoch: 12, train_loss: 1.1740, test_loss: 1.1314, test_f1: 0.4173
 epoch: 13, train_loss: 1.1733, test_loss: 1.1251, test_f1: 0.4047
 epoch: 14, train_loss: 1.1625, test_loss: 1.1209, test_f1: 0.4105
 epoch: 15, train_loss: 1.1591, test_loss: 1.1122, test_f1: 0.4233
 epoch: 16, train_loss: 1.1401, test_loss: 1.1074, test_f1: 0.4108
 epoch: 17, train_loss: 1.1446, test_loss: 1.0991, test_f1: 0.4194
 epoch: 18, train_loss: 1.1377, test_loss: 1.0915, test_f1: 0.4313
 epoch: 19, train_loss: 1.1352, test_loss: 1.0784, test_f1: 0.4313
 epoch: 20, train_loss: 1.1252, test_loss: 1.0816, test_f1: 0.4275
 epoch: 21, train_loss: 1.1325, test_loss: 1.0750, test_f1: 0.4503
 epoch: 22, train_loss: 1.1126, test_loss: 1.0783, test_f1: 0.4136
 epoch: 23, train_loss: 1.1040, test_loss: 1.0693, test_f1: 0.4223
 epoch: 24, train_loss: 1.1029, test_loss: 1.0575, test_f1: 0.4338
 epoch: 25, train_loss: 1.1023, test_loss: 1.0549, test_f1: 0.4353
 epoch: 26, train_loss: 1.1038, test_loss: 1.0531, test_f1: 0.4325
 epoch: 27, train_loss: 1.1024, test_loss: 1.0496, test_f1: 0.4364
 epoch: 28, train_loss: 1.0979, test_loss: 1.0439, test_f1: 0.4345
 epoch: 29, train_loss: 1.0828, test_loss: 1.0519, test_f1: 0.4477
 epoch: 30, train_loss: 1.0761, test_loss: 1.0337, test_f1: 0.4440
 epoch: 31, train_loss: 1.0793, test_loss: 1.0409, test_f1: 0.4491
 epoch: 32, train_loss: 1.0857, test_loss: 1.0459, test_f1: 0.4301
 epoch: 33, train_loss: 1.0831, test_loss: 1.0405, test_f1: 0.4416
 epoch: 34, train_loss: 1.0724, test_loss: 1.0504, test_f1: 0.4392
 epoch: 35, train_loss: 1.0762, test_loss: 1.0476, test_f1: 0.4563
 epoch: 36, train_loss: 1.0767, test_loss: 1.0375, test_f1: 0.4684
 epoch: 37, train_loss: 1.0644, test_loss: 1.0354, test_f1: 0.4460
 epoch: 38, train_loss: 1.0618, test_loss: 1.0225, test_f1: 0.4598
 epoch: 39, train_loss: 1.0562, test_loss: 1.0271, test_f1: 0.4647
 epoch: 40, train_loss: 1.0561, test_loss: 1.0214, test_f1: 0.4779
 epoch: 41, train_loss: 1.0570, test_loss: 1.0207, test_f1: 0.4525
 epoch: 42, train_loss: 1.0552, test_loss: 1.0084, test_f1: 0.4378
 epoch: 43, train_loss: 1.0477, test_loss: 1.0162, test_f1: 0.4694
 epoch: 44, train_loss: 1.0337, test_loss: 1.0160, test_f1: 0.4680
 epoch: 45, train_loss: 1.0411, test_loss: 1.0186, test_f1: 0.4588
 epoch: 46, train_loss: 1.0487, test_loss: 1.0077, test_f1: 0.4725
 epoch: 47, train_loss: 1.0325, test_loss: 0.9993, test_f1: 0.4719
 epoch: 48, train_loss: 1.0325, test_loss: 0.9946, test_f1: 0.4863
 epoch: 49, train_loss: 1.0268, test_loss: 1.0202, test_f1: 0.4844
 epoch: 50, train_loss: 1.0312, test_loss: 0.9996, test_f1: 0.4843
 epoch: 51, train_loss: 1.0252, test_loss: 0.9678, test_f1: 0.4851
 epoch: 52, train_loss: 1.0279, test_loss: 1.0005, test_f1: 0.4775
 epoch: 53, train_loss: 1.0311, test_loss: 0.9850, test_f1: 0.4800
 epoch: 54, train_loss: 1.0312, test_loss: 0.9945, test_f1: 0.4811
 epoch: 55, train_loss: 1.0060, test_loss: 1.0089, test_f1: 0.4698
 epoch: 56, train_loss: 1.0128, test_loss: 1.0105, test_f1: 0.4766
 epoch: 57, train_loss: 1.0120, test_loss: 0.9891, test_f1: 0.4805
 epoch: 58, train_loss: 1.0123, test_loss: 0.9913, test_f1: 0.4860
 epoch: 59, train_loss: 1.0095, test_loss: 0.9896, test_f1: 0.4883
 epoch: 60, train_loss: 1.0103, test_loss: 0.9984, test_f1: 0.4572
 epoch: 61, train_loss: 1.0153, test_loss: 0.9997, test_f1: 0.4679
 epoch: 62, train_loss: 1.0156, test_loss: 0.9941, test_f1: 0.4721
 epoch: 63, train_loss: 1.0180, test_loss: 0.9805, test_f1: 0.4695
 epoch: 64, train_loss: 1.0071, test_loss: 1.0017, test_f1: 0.4932
 epoch: 65, train_loss: 0.9984, test_loss: 0.9943, test_f1: 0.4733
 epoch: 66, train_loss: 1.0025, test_loss: 0.9921, test_f1: 0.4813
 epoch: 67, train_loss: 1.0078, test_loss: 0.9941, test_f1: 0.4824
 epoch: 68, train_loss: 1.0024, test_loss: 0.9879, test_f1: 0.4764
 epoch: 69, train_loss: 1.0000, test_loss: 0.9710, test_f1: 0.4891
 epoch: 70, train_loss: 0.9963, test_loss: 0.9771, test_f1: 0.4834
 epoch: 71, train_loss: 1.0098, test_loss: 0.9735, test_f1: 0.4800
 epoch: 72, train_loss: 1.0014, test_loss: 1.0072, test_f1: 0.4830
 epoch: 73, train_loss: 1.0085, test_loss: 1.0098, test_f1: 0.4779
 epoch: 74, train_loss: 1.0027, test_loss: 0.9987, test_f1: 0.4826
 epoch: 75, train_loss: 1.0052, test_loss: 0.9903, test_f1: 0.4858
 epoch: 76, train_loss: 1.0052, test_loss: 0.9964, test_f1: 0.4786
 epoch: 77, train_loss: 1.0016, test_loss: 0.9931, test_f1: 0.4841
 epoch: 78, train_loss: 0.9961, test_loss: 0.9849, test_f1: 0.4871
 epoch: 79, train_loss: 0.9991, test_loss: 0.9956, test_f1: 0.4878
 epoch: 80, train_loss: 0.9929, test_loss: 1.0066, test_f1: 0.4851
 epoch: 81, train_loss: 0.9843, test_loss: 0.9891, test_f1: 0.4847
 epoch: 82, train_loss: 0.9983, test_loss: 0.9869, test_f1: 0.4889
 epoch: 83, train_loss: 0.9884, test_loss: 0.9876, test_f1: 0.4820
 epoch: 84, train_loss: 1.0016, test_loss: 0.9857, test_f1: 0.4891
 epoch: 85, train_loss: 0.9904, test_loss: 0.9865, test_f1: 0.4877
 epoch: 86, train_loss: 0.9912, test_loss: 0.9773, test_f1: 0.4917
 epoch: 87, train_loss: 0.9940, test_loss: 0.9698, test_f1: 0.4862
 epoch: 88, train_loss: 0.9887, test_loss: 0.9846, test_f1: 0.4949
 epoch: 89, train_loss: 0.9948, test_loss: 0.9702, test_f1: 0.4703
 epoch: 90, train_loss: 0.9807, test_loss: 0.9918, test_f1: 0.4820
 epoch: 91, train_loss: 0.9928, test_loss: 0.9889, test_f1: 0.4773
 epoch: 92, train_loss: 0.9769, test_loss: 0.9704, test_f1: 0.4818
 epoch: 93, train_loss: 0.9808, test_loss: 0.9820, test_f1: 0.4850
 epoch: 94, train_loss: 0.9765, test_loss: 0.9798, test_f1: 0.4875
 epoch: 95, train_loss: 0.9915, test_loss: 0.9717, test_f1: 0.4783
 epoch: 96, train_loss: 0.9782, test_loss: 0.9849, test_f1: 0.4855
 epoch: 97, train_loss: 0.9796, test_loss: 0.9775, test_f1: 0.4811
 epoch: 98, train_loss: 0.9745, test_loss: 0.9910, test_f1: 0.4916
 epoch: 99, train_loss: 0.9798, test_loss: 0.9908, test_f1: 0.4930
##################ITERATION #5 ****************************************
 epoch: 0, train_loss: 1.3048, test_loss: 1.2199, test_f1: 0.2452
 epoch: 1, train_loss: 1.2513, test_loss: 1.2053, test_f1: 0.3075
 epoch: 2, train_loss: 1.2275, test_loss: 1.1924, test_f1: 0.3605
 epoch: 3, train_loss: 1.2302, test_loss: 1.1820, test_f1: 0.3804
 epoch: 4, train_loss: 1.2251, test_loss: 1.1781, test_f1: 0.3709
 epoch: 5, train_loss: 1.2142, test_loss: 1.1711, test_f1: 0.3743
 epoch: 6, train_loss: 1.1936, test_loss: 1.1537, test_f1: 0.4242
 epoch: 7, train_loss: 1.1960, test_loss: 1.1443, test_f1: 0.4234
 epoch: 8, train_loss: 1.1875, test_loss: 1.1458, test_f1: 0.4236
 epoch: 9, train_loss: 1.1801, test_loss: 1.1407, test_f1: 0.4154
 epoch: 10, train_loss: 1.1692, test_loss: 1.1262, test_f1: 0.4147
 epoch: 11, train_loss: 1.1782, test_loss: 1.1189, test_f1: 0.3989
 epoch: 12, train_loss: 1.1631, test_loss: 1.1161, test_f1: 0.4295
 epoch: 13, train_loss: 1.1657, test_loss: 1.1121, test_f1: 0.4227
 epoch: 14, train_loss: 1.1578, test_loss: 1.1069, test_f1: 0.4387
 epoch: 15, train_loss: 1.1514, test_loss: 1.1016, test_f1: 0.4018
 epoch: 16, train_loss: 1.1416, test_loss: 1.0929, test_f1: 0.4458
 epoch: 17, train_loss: 1.1365, test_loss: 1.0865, test_f1: 0.4209
 epoch: 18, train_loss: 1.1355, test_loss: 1.0809, test_f1: 0.4400
 epoch: 19, train_loss: 1.1297, test_loss: 1.0761, test_f1: 0.4240
 epoch: 20, train_loss: 1.1234, test_loss: 1.0746, test_f1: 0.4296
 epoch: 21, train_loss: 1.1198, test_loss: 1.0709, test_f1: 0.4334
 epoch: 22, train_loss: 1.1135, test_loss: 1.0708, test_f1: 0.4402
 epoch: 23, train_loss: 1.1146, test_loss: 1.0627, test_f1: 0.4413
 epoch: 24, train_loss: 1.1143, test_loss: 1.0604, test_f1: 0.4281
 epoch: 25, train_loss: 1.1040, test_loss: 1.0521, test_f1: 0.4762
 epoch: 26, train_loss: 1.1128, test_loss: 1.0490, test_f1: 0.4690
 epoch: 27, train_loss: 1.0985, test_loss: 1.0382, test_f1: 0.4399
 epoch: 28, train_loss: 1.0925, test_loss: 1.0378, test_f1: 0.4697
 epoch: 29, train_loss: 1.0932, test_loss: 1.0373, test_f1: 0.4654
 epoch: 30, train_loss: 1.0859, test_loss: 1.0355, test_f1: 0.4387
 epoch: 31, train_loss: 1.0941, test_loss: 1.0374, test_f1: 0.4439
 epoch: 32, train_loss: 1.0938, test_loss: 1.0457, test_f1: 0.4342
 epoch: 33, train_loss: 1.0821, test_loss: 1.0557, test_f1: 0.4375
 epoch: 34, train_loss: 1.0770, test_loss: 1.0585, test_f1: 0.4316
 epoch: 35, train_loss: 1.0792, test_loss: 1.0091, test_f1: 0.4569
 epoch: 36, train_loss: 1.0756, test_loss: 1.0213, test_f1: 0.4712
 epoch: 37, train_loss: 1.0762, test_loss: 1.0087, test_f1: 0.4669
 epoch: 38, train_loss: 1.0808, test_loss: 1.0210, test_f1: 0.4636
 epoch: 39, train_loss: 1.0600, test_loss: 1.0085, test_f1: 0.4786
 epoch: 40, train_loss: 1.0474, test_loss: 0.9996, test_f1: 0.4592
 epoch: 41, train_loss: 1.0547, test_loss: 0.9984, test_f1: 0.4938
 epoch: 42, train_loss: 1.0555, test_loss: 0.9949, test_f1: 0.4549
 epoch: 43, train_loss: 1.0607, test_loss: 0.9983, test_f1: 0.4601
 epoch: 44, train_loss: 1.0519, test_loss: 0.9915, test_f1: 0.4618
 epoch: 45, train_loss: 1.0508, test_loss: 0.9947, test_f1: 0.4611
 epoch: 46, train_loss: 1.0437, test_loss: 1.0027, test_f1: 0.4533
 epoch: 47, train_loss: 1.0425, test_loss: 0.9960, test_f1: 0.4575
 epoch: 48, train_loss: 1.0339, test_loss: 0.9982, test_f1: 0.4912
 epoch: 49, train_loss: 1.0293, test_loss: 0.9754, test_f1: 0.4650
 epoch: 50, train_loss: 1.0497, test_loss: 0.9737, test_f1: 0.4785
 epoch: 51, train_loss: 1.0276, test_loss: 0.9764, test_f1: 0.4874
 epoch: 52, train_loss: 1.0379, test_loss: 0.9788, test_f1: 0.4973
 epoch: 53, train_loss: 1.0335, test_loss: 0.9752, test_f1: 0.4770
 epoch: 54, train_loss: 1.0271, test_loss: 0.9815, test_f1: 0.4625
 epoch: 55, train_loss: 1.0310, test_loss: 0.9764, test_f1: 0.4792
 epoch: 56, train_loss: 1.0312, test_loss: 0.9790, test_f1: 0.4777
 epoch: 57, train_loss: 1.0318, test_loss: 0.9702, test_f1: 0.5013
 epoch: 58, train_loss: 1.0158, test_loss: 0.9699, test_f1: 0.4940
 epoch: 59, train_loss: 1.0198, test_loss: 0.9789, test_f1: 0.4912
 epoch: 60, train_loss: 1.0243, test_loss: 0.9787, test_f1: 0.4883
 epoch: 61, train_loss: 1.0265, test_loss: 0.9651, test_f1: 0.4762
 epoch: 62, train_loss: 1.0197, test_loss: 0.9881, test_f1: 0.4799
 epoch: 63, train_loss: 1.0272, test_loss: 0.9702, test_f1: 0.4786
 epoch: 64, train_loss: 1.0070, test_loss: 0.9741, test_f1: 0.4805
 epoch: 65, train_loss: 1.0203, test_loss: 0.9885, test_f1: 0.4457
 epoch: 66, train_loss: 1.0087, test_loss: 0.9855, test_f1: 0.4608
 epoch: 67, train_loss: 1.0111, test_loss: 0.9777, test_f1: 0.4672
 epoch: 68, train_loss: 1.0099, test_loss: 0.9676, test_f1: 0.4888
 epoch: 69, train_loss: 1.0203, test_loss: 0.9633, test_f1: 0.4908
 epoch: 70, train_loss: 1.0133, test_loss: 0.9583, test_f1: 0.4768
 epoch: 71, train_loss: 1.0078, test_loss: 0.9510, test_f1: 0.4751
 epoch: 72, train_loss: 1.0047, test_loss: 0.9532, test_f1: 0.4719
 epoch: 73, train_loss: 1.0128, test_loss: 0.9480, test_f1: 0.4848
 epoch: 74, train_loss: 1.0121, test_loss: 0.9575, test_f1: 0.4890
 epoch: 75, train_loss: 1.0017, test_loss: 0.9628, test_f1: 0.4925
 epoch: 76, train_loss: 1.0103, test_loss: 0.9509, test_f1: 0.4852
 epoch: 77, train_loss: 1.0116, test_loss: 0.9505, test_f1: 0.4850
 epoch: 78, train_loss: 0.9978, test_loss: 0.9618, test_f1: 0.4916
 epoch: 79, train_loss: 1.0110, test_loss: 0.9548, test_f1: 0.4803
 epoch: 80, train_loss: 1.0096, test_loss: 0.9730, test_f1: 0.4621
 epoch: 81, train_loss: 0.9959, test_loss: 0.9640, test_f1: 0.4739
 epoch: 82, train_loss: 1.0027, test_loss: 0.9636, test_f1: 0.5008
 epoch: 83, train_loss: 0.9956, test_loss: 0.9494, test_f1: 0.4904
 epoch: 84, train_loss: 0.9997, test_loss: 0.9613, test_f1: 0.4814
 epoch: 85, train_loss: 1.0039, test_loss: 0.9448, test_f1: 0.4820
 epoch: 86, train_loss: 0.9912, test_loss: 0.9583, test_f1: 0.4716
 epoch: 87, train_loss: 1.0068, test_loss: 0.9481, test_f1: 0.4840
 epoch: 88, train_loss: 1.0008, test_loss: 0.9555, test_f1: 0.4971
 epoch: 89, train_loss: 0.9877, test_loss: 0.9490, test_f1: 0.4898
 epoch: 90, train_loss: 0.9906, test_loss: 0.9530, test_f1: 0.4910
 epoch: 91, train_loss: 0.9966, test_loss: 0.9429, test_f1: 0.4854
 epoch: 92, train_loss: 0.9919, test_loss: 0.9708, test_f1: 0.4826
 epoch: 93, train_loss: 0.9998, test_loss: 0.9529, test_f1: 0.4995
 epoch: 94, train_loss: 0.9785, test_loss: 0.9485, test_f1: 0.5121
 epoch: 95, train_loss: 0.9936, test_loss: 0.9412, test_f1: 0.5165
 epoch: 96, train_loss: 0.9947, test_loss: 0.9378, test_f1: 0.4906
 epoch: 97, train_loss: 0.9872, test_loss: 0.9451, test_f1: 0.4804
 epoch: 98, train_loss: 0.9946, test_loss: 0.9624, test_f1: 0.4797
 epoch: 99, train_loss: 0.9915, test_loss: 0.9461, test_f1: 0.4871
##################ITERATION #6 ****************************************
 epoch: 0, train_loss: 1.3275, test_loss: 1.2644, test_f1: 0.2375
 epoch: 1, train_loss: 1.2668, test_loss: 1.2341, test_f1: 0.2914
 epoch: 2, train_loss: 1.2628, test_loss: 1.2432, test_f1: 0.2733
 epoch: 3, train_loss: 1.2427, test_loss: 1.2081, test_f1: 0.3168
 epoch: 4, train_loss: 1.2330, test_loss: 1.1988, test_f1: 0.3349
 epoch: 5, train_loss: 1.2264, test_loss: 1.1935, test_f1: 0.3448
 epoch: 6, train_loss: 1.2258, test_loss: 1.1849, test_f1: 0.3469
 epoch: 7, train_loss: 1.2108, test_loss: 1.1798, test_f1: 0.3720
 epoch: 8, train_loss: 1.2110, test_loss: 1.1768, test_f1: 0.3766
 epoch: 9, train_loss: 1.1978, test_loss: 1.1621, test_f1: 0.3869
 epoch: 10, train_loss: 1.1914, test_loss: 1.1500, test_f1: 0.4016
 epoch: 11, train_loss: 1.1812, test_loss: 1.1469, test_f1: 0.3884
 epoch: 12, train_loss: 1.1861, test_loss: 1.1432, test_f1: 0.4027
 epoch: 13, train_loss: 1.1771, test_loss: 1.1374, test_f1: 0.4116
 epoch: 14, train_loss: 1.1783, test_loss: 1.1337, test_f1: 0.4180
 epoch: 15, train_loss: 1.1707, test_loss: 1.1312, test_f1: 0.4052
 epoch: 16, train_loss: 1.1645, test_loss: 1.1197, test_f1: 0.4073
 epoch: 17, train_loss: 1.1648, test_loss: 1.1218, test_f1: 0.4081
 epoch: 18, train_loss: 1.1625, test_loss: 1.1200, test_f1: 0.4028
 epoch: 19, train_loss: 1.1543, test_loss: 1.1121, test_f1: 0.4116
 epoch: 20, train_loss: 1.1438, test_loss: 1.1060, test_f1: 0.4201
 epoch: 21, train_loss: 1.1524, test_loss: 1.1005, test_f1: 0.4217
 epoch: 22, train_loss: 1.1448, test_loss: 1.0974, test_f1: 0.4336
 epoch: 23, train_loss: 1.1329, test_loss: 1.0974, test_f1: 0.4303
 epoch: 24, train_loss: 1.1184, test_loss: 1.0919, test_f1: 0.4252
 epoch: 25, train_loss: 1.1221, test_loss: 1.0922, test_f1: 0.4121
 epoch: 26, train_loss: 1.1167, test_loss: 1.0924, test_f1: 0.4025
 epoch: 27, train_loss: 1.1251, test_loss: 1.0859, test_f1: 0.4149
 epoch: 28, train_loss: 1.1086, test_loss: 1.0819, test_f1: 0.4101
 epoch: 29, train_loss: 1.1075, test_loss: 1.0793, test_f1: 0.4266
 epoch: 30, train_loss: 1.1092, test_loss: 1.0739, test_f1: 0.4348
 epoch: 31, train_loss: 1.1113, test_loss: 1.0807, test_f1: 0.4143
 epoch: 32, train_loss: 1.0984, test_loss: 1.0709, test_f1: 0.4237
 epoch: 33, train_loss: 1.1084, test_loss: 1.0675, test_f1: 0.4274
 epoch: 34, train_loss: 1.0975, test_loss: 1.0660, test_f1: 0.4322
 epoch: 35, train_loss: 1.0996, test_loss: 1.0670, test_f1: 0.4304
 epoch: 36, train_loss: 1.0918, test_loss: 1.0671, test_f1: 0.4340
 epoch: 37, train_loss: 1.0944, test_loss: 1.0720, test_f1: 0.4394
 epoch: 38, train_loss: 1.0829, test_loss: 1.0538, test_f1: 0.4356
 epoch: 39, train_loss: 1.0807, test_loss: 1.0470, test_f1: 0.4533
 epoch: 40, train_loss: 1.0847, test_loss: 1.0542, test_f1: 0.4499
 epoch: 41, train_loss: 1.0814, test_loss: 1.0497, test_f1: 0.4304
 epoch: 42, train_loss: 1.0768, test_loss: 1.0614, test_f1: 0.4406
 epoch: 43, train_loss: 1.0704, test_loss: 1.0565, test_f1: 0.4311
 epoch: 44, train_loss: 1.0653, test_loss: 1.0633, test_f1: 0.4200
 epoch: 45, train_loss: 1.0634, test_loss: 1.0549, test_f1: 0.4442
 epoch: 46, train_loss: 1.0576, test_loss: 1.0472, test_f1: 0.4398
 epoch: 47, train_loss: 1.0642, test_loss: 1.0688, test_f1: 0.4537
 epoch: 48, train_loss: 1.0487, test_loss: 1.0542, test_f1: 0.4541
 epoch: 49, train_loss: 1.0556, test_loss: 1.0507, test_f1: 0.4407
 epoch: 50, train_loss: 1.0471, test_loss: 1.0512, test_f1: 0.4351
 epoch: 51, train_loss: 1.0488, test_loss: 1.0453, test_f1: 0.4477
 epoch: 52, train_loss: 1.0389, test_loss: 1.0578, test_f1: 0.4395
 epoch: 53, train_loss: 1.0500, test_loss: 1.0502, test_f1: 0.4494
 epoch: 54, train_loss: 1.0564, test_loss: 1.0500, test_f1: 0.4567
 epoch: 55, train_loss: 1.0418, test_loss: 1.0469, test_f1: 0.4482
 epoch: 56, train_loss: 1.0491, test_loss: 1.0516, test_f1: 0.4440
 epoch: 57, train_loss: 1.0409, test_loss: 1.0471, test_f1: 0.4491
 epoch: 58, train_loss: 1.0477, test_loss: 1.0374, test_f1: 0.4602
 epoch: 59, train_loss: 1.0484, test_loss: 1.0485, test_f1: 0.4475
 epoch: 60, train_loss: 1.0304, test_loss: 1.0447, test_f1: 0.4569
 epoch: 61, train_loss: 1.0476, test_loss: 1.0486, test_f1: 0.4642
 epoch: 62, train_loss: 1.0344, test_loss: 1.0334, test_f1: 0.4598
 epoch: 63, train_loss: 1.0337, test_loss: 1.0430, test_f1: 0.4580
 epoch: 64, train_loss: 1.0402, test_loss: 1.0367, test_f1: 0.4589
 epoch: 65, train_loss: 1.0445, test_loss: 1.0497, test_f1: 0.4507
 epoch: 66, train_loss: 1.0378, test_loss: 1.0307, test_f1: 0.4629
 epoch: 67, train_loss: 1.0337, test_loss: 1.0336, test_f1: 0.4674
 epoch: 68, train_loss: 1.0236, test_loss: 1.0506, test_f1: 0.4552
 epoch: 69, train_loss: 1.0347, test_loss: 1.0340, test_f1: 0.4597
 epoch: 70, train_loss: 1.0438, test_loss: 1.0577, test_f1: 0.4423
 epoch: 71, train_loss: 1.0317, test_loss: 1.0537, test_f1: 0.4438
 epoch: 72, train_loss: 1.0213, test_loss: 1.0264, test_f1: 0.4704
 epoch: 73, train_loss: 1.0226, test_loss: 1.0409, test_f1: 0.4602
 epoch: 74, train_loss: 1.0244, test_loss: 1.0345, test_f1: 0.4744
 epoch: 75, train_loss: 1.0206, test_loss: 1.0377, test_f1: 0.4489
 epoch: 76, train_loss: 1.0235, test_loss: 1.0289, test_f1: 0.4726
 epoch: 77, train_loss: 1.0210, test_loss: 1.0272, test_f1: 0.4611
 epoch: 78, train_loss: 1.0327, test_loss: 1.0282, test_f1: 0.4676
 epoch: 79, train_loss: 1.0239, test_loss: 1.0367, test_f1: 0.4706
 epoch: 80, train_loss: 1.0112, test_loss: 1.0494, test_f1: 0.4613
 epoch: 81, train_loss: 1.0234, test_loss: 1.0365, test_f1: 0.4590
 epoch: 82, train_loss: 1.0121, test_loss: 1.0458, test_f1: 0.4563
 epoch: 83, train_loss: 1.0072, test_loss: 1.0333, test_f1: 0.4721
 epoch: 84, train_loss: 1.0142, test_loss: 1.0350, test_f1: 0.4580
 epoch: 85, train_loss: 1.0059, test_loss: 1.0466, test_f1: 0.4551
 epoch: 86, train_loss: 1.0166, test_loss: 1.0279, test_f1: 0.4695
 epoch: 87, train_loss: 1.0124, test_loss: 1.0348, test_f1: 0.4689
 epoch: 88, train_loss: 1.0072, test_loss: 1.0198, test_f1: 0.4735
 epoch: 89, train_loss: 1.0053, test_loss: 1.0331, test_f1: 0.4785
 epoch: 90, train_loss: 1.0027, test_loss: 1.0621, test_f1: 0.4776
 epoch: 91, train_loss: 1.0050, test_loss: 1.0382, test_f1: 0.4525
 epoch: 92, train_loss: 1.0043, test_loss: 1.0355, test_f1: 0.4808
 epoch: 93, train_loss: 1.0063, test_loss: 1.0334, test_f1: 0.4660
 epoch: 94, train_loss: 0.9981, test_loss: 1.0220, test_f1: 0.4658
 epoch: 95, train_loss: 1.0064, test_loss: 1.0193, test_f1: 0.4687
 epoch: 96, train_loss: 1.0075, test_loss: 1.0509, test_f1: 0.4662
 epoch: 97, train_loss: 0.9984, test_loss: 1.0400, test_f1: 0.4656
 epoch: 98, train_loss: 1.0020, test_loss: 1.0344, test_f1: 0.4800
 epoch: 99, train_loss: 1.0065, test_loss: 1.0342, test_f1: 0.4800
##################ITERATION #7 ****************************************
 epoch: 0, train_loss: 1.3302, test_loss: 1.2805, test_f1: 0.2555
 epoch: 1, train_loss: 1.2758, test_loss: 1.2540, test_f1: 0.2761
 epoch: 2, train_loss: 1.2657, test_loss: 1.2495, test_f1: 0.3136
 epoch: 3, train_loss: 1.2487, test_loss: 1.2276, test_f1: 0.3109
 epoch: 4, train_loss: 1.2458, test_loss: 1.2295, test_f1: 0.3371
 epoch: 5, train_loss: 1.2397, test_loss: 1.2634, test_f1: 0.3720
 epoch: 6, train_loss: 1.2321, test_loss: 1.2071, test_f1: 0.3918
 epoch: 7, train_loss: 1.2190, test_loss: 1.2123, test_f1: 0.3649
 epoch: 8, train_loss: 1.2249, test_loss: 1.2019, test_f1: 0.3839
 epoch: 9, train_loss: 1.2181, test_loss: 1.1945, test_f1: 0.4003
 epoch: 10, train_loss: 1.2082, test_loss: 1.1847, test_f1: 0.3978
 epoch: 11, train_loss: 1.2034, test_loss: 1.1938, test_f1: 0.4266
 epoch: 12, train_loss: 1.1986, test_loss: 1.2083, test_f1: 0.4083
 epoch: 13, train_loss: 1.1970, test_loss: 1.2179, test_f1: 0.4182
 epoch: 14, train_loss: 1.1974, test_loss: 1.1710, test_f1: 0.4397
 epoch: 15, train_loss: 1.1870, test_loss: 1.1728, test_f1: 0.4195
 epoch: 16, train_loss: 1.1773, test_loss: 1.2168, test_f1: 0.4454
 epoch: 17, train_loss: 1.1788, test_loss: 1.1465, test_f1: 0.4512
 epoch: 18, train_loss: 1.1786, test_loss: 1.1422, test_f1: 0.4453
 epoch: 19, train_loss: 1.1724, test_loss: 1.1641, test_f1: 0.4514
 epoch: 20, train_loss: 1.1644, test_loss: 1.2024, test_f1: 0.4528
 epoch: 21, train_loss: 1.1656, test_loss: 1.1521, test_f1: 0.4570
 epoch: 22, train_loss: 1.1606, test_loss: 1.1255, test_f1: 0.4514
 epoch: 23, train_loss: 1.1684, test_loss: 1.1657, test_f1: 0.4390
 epoch: 24, train_loss: 1.1544, test_loss: 1.1427, test_f1: 0.4511
 epoch: 25, train_loss: 1.1493, test_loss: 1.1284, test_f1: 0.4501
 epoch: 26, train_loss: 1.1519, test_loss: 1.1296, test_f1: 0.4466
 epoch: 27, train_loss: 1.1530, test_loss: 1.1141, test_f1: 0.4562
 epoch: 28, train_loss: 1.1531, test_loss: 1.1081, test_f1: 0.4691
 epoch: 29, train_loss: 1.1403, test_loss: 1.1040, test_f1: 0.4526
 epoch: 30, train_loss: 1.1421, test_loss: 1.1010, test_f1: 0.4523
 epoch: 31, train_loss: 1.1318, test_loss: 1.1000, test_f1: 0.4680
 epoch: 32, train_loss: 1.1339, test_loss: 1.0940, test_f1: 0.4566
 epoch: 33, train_loss: 1.1328, test_loss: 1.0991, test_f1: 0.4529
 epoch: 34, train_loss: 1.1300, test_loss: 1.0852, test_f1: 0.4611
 epoch: 35, train_loss: 1.1267, test_loss: 1.0885, test_f1: 0.4697
 epoch: 36, train_loss: 1.1155, test_loss: 1.0832, test_f1: 0.4633
 epoch: 37, train_loss: 1.1085, test_loss: 1.0892, test_f1: 0.4284
 epoch: 38, train_loss: 1.1051, test_loss: 1.0849, test_f1: 0.4751
 epoch: 39, train_loss: 1.1256, test_loss: 1.0768, test_f1: 0.4659
 epoch: 40, train_loss: 1.1046, test_loss: 1.0606, test_f1: 0.4747
 epoch: 41, train_loss: 1.1141, test_loss: 1.0602, test_f1: 0.4752
 epoch: 42, train_loss: 1.1078, test_loss: 1.0532, test_f1: 0.4703
 epoch: 43, train_loss: 1.1025, test_loss: 1.0532, test_f1: 0.4730
 epoch: 44, train_loss: 1.1037, test_loss: 1.0429, test_f1: 0.4779
 epoch: 45, train_loss: 1.0915, test_loss: 1.0525, test_f1: 0.4719
 epoch: 46, train_loss: 1.1013, test_loss: 1.0492, test_f1: 0.4652
 epoch: 47, train_loss: 1.1046, test_loss: 1.0493, test_f1: 0.4786
 epoch: 48, train_loss: 1.0825, test_loss: 1.0333, test_f1: 0.4917
 epoch: 49, train_loss: 1.0737, test_loss: 1.0394, test_f1: 0.4749
 epoch: 50, train_loss: 1.0865, test_loss: 1.0466, test_f1: 0.4721
 epoch: 51, train_loss: 1.0802, test_loss: 1.0379, test_f1: 0.4774
 epoch: 52, train_loss: 1.0901, test_loss: 1.0357, test_f1: 0.4850
 epoch: 53, train_loss: 1.0703, test_loss: 1.0232, test_f1: 0.4779
 epoch: 54, train_loss: 1.0810, test_loss: 1.0252, test_f1: 0.4794
 epoch: 55, train_loss: 1.0771, test_loss: 1.0257, test_f1: 0.4865
 epoch: 56, train_loss: 1.0709, test_loss: 1.0195, test_f1: 0.4941
 epoch: 57, train_loss: 1.0691, test_loss: 1.0189, test_f1: 0.5032
 epoch: 58, train_loss: 1.0754, test_loss: 1.0210, test_f1: 0.4688
 epoch: 59, train_loss: 1.0731, test_loss: 1.0185, test_f1: 0.4799
 epoch: 60, train_loss: 1.0646, test_loss: 1.0141, test_f1: 0.4593
 epoch: 61, train_loss: 1.0604, test_loss: 1.0127, test_f1: 0.4890
 epoch: 62, train_loss: 1.0713, test_loss: 1.0269, test_f1: 0.4872
 epoch: 63, train_loss: 1.0620, test_loss: 1.0196, test_f1: 0.4871
 epoch: 64, train_loss: 1.0640, test_loss: 1.0099, test_f1: 0.4900
 epoch: 65, train_loss: 1.0597, test_loss: 1.0147, test_f1: 0.4940
 epoch: 66, train_loss: 1.0582, test_loss: 1.0003, test_f1: 0.4969
 epoch: 67, train_loss: 1.0586, test_loss: 1.0009, test_f1: 0.4997
 epoch: 68, train_loss: 1.0573, test_loss: 1.0138, test_f1: 0.4688
 epoch: 69, train_loss: 1.0480, test_loss: 1.0085, test_f1: 0.4811
 epoch: 70, train_loss: 1.0543, test_loss: 0.9871, test_f1: 0.4996
 epoch: 71, train_loss: 1.0561, test_loss: 0.9895, test_f1: 0.4975
 epoch: 72, train_loss: 1.0483, test_loss: 1.0218, test_f1: 0.4827
 epoch: 73, train_loss: 1.0448, test_loss: 0.9916, test_f1: 0.4832
 epoch: 74, train_loss: 1.0427, test_loss: 0.9966, test_f1: 0.4976
 epoch: 75, train_loss: 1.0405, test_loss: 1.0036, test_f1: 0.4913
 epoch: 76, train_loss: 1.0404, test_loss: 1.0152, test_f1: 0.4852
 epoch: 77, train_loss: 1.0486, test_loss: 0.9859, test_f1: 0.4978
 epoch: 78, train_loss: 1.0452, test_loss: 1.0010, test_f1: 0.4831
 epoch: 79, train_loss: 1.0349, test_loss: 0.9925, test_f1: 0.4894
 epoch: 80, train_loss: 1.0430, test_loss: 0.9826, test_f1: 0.4881
 epoch: 81, train_loss: 1.0510, test_loss: 0.9898, test_f1: 0.5155
 epoch: 82, train_loss: 1.0414, test_loss: 0.9819, test_f1: 0.4994
 epoch: 83, train_loss: 1.0264, test_loss: 0.9809, test_f1: 0.4999
 epoch: 84, train_loss: 1.0303, test_loss: 0.9744, test_f1: 0.4726
 epoch: 85, train_loss: 1.0369, test_loss: 0.9847, test_f1: 0.4935
 epoch: 86, train_loss: 1.0343, test_loss: 0.9925, test_f1: 0.4768
 epoch: 87, train_loss: 1.0290, test_loss: 0.9856, test_f1: 0.4907
 epoch: 88, train_loss: 1.0351, test_loss: 0.9791, test_f1: 0.4886
 epoch: 89, train_loss: 1.0351, test_loss: 0.9718, test_f1: 0.4989
 epoch: 90, train_loss: 1.0254, test_loss: 0.9707, test_f1: 0.4945
 epoch: 91, train_loss: 1.0297, test_loss: 0.9768, test_f1: 0.5084
 epoch: 92, train_loss: 1.0308, test_loss: 0.9795, test_f1: 0.5060
 epoch: 93, train_loss: 1.0362, test_loss: 0.9756, test_f1: 0.4962
 epoch: 94, train_loss: 1.0298, test_loss: 0.9710, test_f1: 0.5067
 epoch: 95, train_loss: 1.0260, test_loss: 0.9778, test_f1: 0.4957
 epoch: 96, train_loss: 1.0270, test_loss: 0.9827, test_f1: 0.4932
 epoch: 97, train_loss: 1.0263, test_loss: 0.9646, test_f1: 0.4847
 epoch: 98, train_loss: 1.0226, test_loss: 0.9688, test_f1: 0.5004
 epoch: 99, train_loss: 1.0232, test_loss: 0.9772, test_f1: 0.4828
##################ITERATION #8 ****************************************
 epoch: 0, train_loss: 1.3152, test_loss: 1.2881, test_f1: 0.2894
 epoch: 1, train_loss: 1.2761, test_loss: 1.2644, test_f1: 0.2744
 epoch: 2, train_loss: 1.2633, test_loss: 1.2743, test_f1: 0.2693
 epoch: 3, train_loss: 1.2587, test_loss: 1.2389, test_f1: 0.2887
 epoch: 4, train_loss: 1.2450, test_loss: 1.2180, test_f1: 0.3184
 epoch: 5, train_loss: 1.2333, test_loss: 1.2119, test_f1: 0.3466
 epoch: 6, train_loss: 1.2323, test_loss: 1.2094, test_f1: 0.3388
 epoch: 7, train_loss: 1.2227, test_loss: 1.1852, test_f1: 0.3899
 epoch: 8, train_loss: 1.2079, test_loss: 1.1828, test_f1: 0.3796
 epoch: 9, train_loss: 1.2056, test_loss: 1.1819, test_f1: 0.3688
 epoch: 10, train_loss: 1.1975, test_loss: 1.1733, test_f1: 0.3738
 epoch: 11, train_loss: 1.1968, test_loss: 1.1572, test_f1: 0.4096
 epoch: 12, train_loss: 1.1889, test_loss: 1.1535, test_f1: 0.3967
 epoch: 13, train_loss: 1.1854, test_loss: 1.1422, test_f1: 0.3983
 epoch: 14, train_loss: 1.1712, test_loss: 1.1435, test_f1: 0.4135
 epoch: 15, train_loss: 1.1738, test_loss: 1.1400, test_f1: 0.4285
 epoch: 16, train_loss: 1.1659, test_loss: 1.1248, test_f1: 0.4018
 epoch: 17, train_loss: 1.1593, test_loss: 1.1229, test_f1: 0.4042
 epoch: 18, train_loss: 1.1605, test_loss: 1.1283, test_f1: 0.4144
 epoch: 19, train_loss: 1.1546, test_loss: 1.1127, test_f1: 0.3992
 epoch: 20, train_loss: 1.1560, test_loss: 1.1309, test_f1: 0.3923
 epoch: 21, train_loss: 1.1401, test_loss: 1.1087, test_f1: 0.4121
 epoch: 22, train_loss: 1.1390, test_loss: 1.1076, test_f1: 0.3943
 epoch: 23, train_loss: 1.1297, test_loss: 1.1000, test_f1: 0.3970
 epoch: 24, train_loss: 1.1255, test_loss: 1.1086, test_f1: 0.3944
 epoch: 25, train_loss: 1.1304, test_loss: 1.1110, test_f1: 0.4131
 epoch: 26, train_loss: 1.1262, test_loss: 1.0958, test_f1: 0.3955
 epoch: 27, train_loss: 1.1309, test_loss: 1.0936, test_f1: 0.4325
 epoch: 28, train_loss: 1.1141, test_loss: 1.0881, test_f1: 0.4101
 epoch: 29, train_loss: 1.1202, test_loss: 1.0981, test_f1: 0.3932
 epoch: 30, train_loss: 1.1183, test_loss: 1.0939, test_f1: 0.4251
 epoch: 31, train_loss: 1.1123, test_loss: 1.0864, test_f1: 0.4226
 epoch: 32, train_loss: 1.1118, test_loss: 1.0902, test_f1: 0.4101
 epoch: 33, train_loss: 1.1067, test_loss: 1.0851, test_f1: 0.4441
 epoch: 34, train_loss: 1.0982, test_loss: 1.0734, test_f1: 0.4329
 epoch: 35, train_loss: 1.1011, test_loss: 1.0749, test_f1: 0.4106
 epoch: 36, train_loss: 1.0946, test_loss: 1.0780, test_f1: 0.4194
 epoch: 37, train_loss: 1.0959, test_loss: 1.0811, test_f1: 0.4164
 epoch: 38, train_loss: 1.0873, test_loss: 1.0658, test_f1: 0.4308
 epoch: 39, train_loss: 1.0887, test_loss: 1.0666, test_f1: 0.4108
 epoch: 40, train_loss: 1.0782, test_loss: 1.0558, test_f1: 0.4224
 epoch: 41, train_loss: 1.0828, test_loss: 1.0600, test_f1: 0.4344
 epoch: 42, train_loss: 1.0735, test_loss: 1.0496, test_f1: 0.4360
 epoch: 43, train_loss: 1.0698, test_loss: 1.0659, test_f1: 0.4249
 epoch: 44, train_loss: 1.0746, test_loss: 1.0483, test_f1: 0.4380
 epoch: 45, train_loss: 1.0736, test_loss: 1.0490, test_f1: 0.4428
 epoch: 46, train_loss: 1.0730, test_loss: 1.0315, test_f1: 0.4541
 epoch: 47, train_loss: 1.0731, test_loss: 1.0397, test_f1: 0.4525
 epoch: 48, train_loss: 1.0656, test_loss: 1.0402, test_f1: 0.4426
 epoch: 49, train_loss: 1.0661, test_loss: 1.0437, test_f1: 0.4430
 epoch: 50, train_loss: 1.0621, test_loss: 1.0315, test_f1: 0.4589
 epoch: 51, train_loss: 1.0503, test_loss: 1.0358, test_f1: 0.4492
 epoch: 52, train_loss: 1.0529, test_loss: 1.0217, test_f1: 0.4553
 epoch: 53, train_loss: 1.0498, test_loss: 1.0295, test_f1: 0.4715
 epoch: 54, train_loss: 1.0472, test_loss: 1.0271, test_f1: 0.4474
 epoch: 55, train_loss: 1.0409, test_loss: 1.0380, test_f1: 0.4386
 epoch: 56, train_loss: 1.0544, test_loss: 1.0209, test_f1: 0.4554
 epoch: 57, train_loss: 1.0430, test_loss: 1.0244, test_f1: 0.4529
 epoch: 58, train_loss: 1.0476, test_loss: 1.0211, test_f1: 0.4457
 epoch: 59, train_loss: 1.0460, test_loss: 1.0214, test_f1: 0.4427
 epoch: 60, train_loss: 1.0380, test_loss: 1.0311, test_f1: 0.4540
 epoch: 61, train_loss: 1.0405, test_loss: 1.0224, test_f1: 0.4594
 epoch: 62, train_loss: 1.0384, test_loss: 1.0130, test_f1: 0.4595
 epoch: 63, train_loss: 1.0407, test_loss: 1.0316, test_f1: 0.4401
 epoch: 64, train_loss: 1.0416, test_loss: 1.0163, test_f1: 0.4569
 epoch: 65, train_loss: 1.0336, test_loss: 1.0201, test_f1: 0.4623
 epoch: 66, train_loss: 1.0352, test_loss: 1.0528, test_f1: 0.4557
 epoch: 67, train_loss: 1.0450, test_loss: 1.0112, test_f1: 0.4692
 epoch: 68, train_loss: 1.0327, test_loss: 1.0341, test_f1: 0.4525
 epoch: 69, train_loss: 1.0329, test_loss: 1.0296, test_f1: 0.4487
 epoch: 70, train_loss: 1.0348, test_loss: 1.0235, test_f1: 0.4665
 epoch: 71, train_loss: 1.0326, test_loss: 1.0196, test_f1: 0.4490
 epoch: 72, train_loss: 1.0294, test_loss: 1.0244, test_f1: 0.4558
 epoch: 73, train_loss: 1.0299, test_loss: 1.0109, test_f1: 0.4688
 epoch: 74, train_loss: 1.0334, test_loss: 1.0178, test_f1: 0.4539
 epoch: 75, train_loss: 1.0326, test_loss: 1.0169, test_f1: 0.4665
 epoch: 76, train_loss: 1.0197, test_loss: 1.0369, test_f1: 0.4549
 epoch: 77, train_loss: 1.0195, test_loss: 1.0291, test_f1: 0.4630
 epoch: 78, train_loss: 1.0306, test_loss: 1.0347, test_f1: 0.4607
 epoch: 79, train_loss: 1.0143, test_loss: 1.0194, test_f1: 0.4544
 epoch: 80, train_loss: 1.0185, test_loss: 1.0283, test_f1: 0.4559
 epoch: 81, train_loss: 1.0181, test_loss: 1.0135, test_f1: 0.4561
 epoch: 82, train_loss: 1.0150, test_loss: 1.0207, test_f1: 0.4525
 epoch: 83, train_loss: 1.0109, test_loss: 1.0217, test_f1: 0.4580
 epoch: 84, train_loss: 1.0118, test_loss: 1.0234, test_f1: 0.4608
 epoch: 85, train_loss: 1.0124, test_loss: 1.0200, test_f1: 0.4817
 epoch: 86, train_loss: 1.0156, test_loss: 1.0188, test_f1: 0.4663
 epoch: 87, train_loss: 1.0089, test_loss: 1.0282, test_f1: 0.4632
 epoch: 88, train_loss: 1.0099, test_loss: 1.0172, test_f1: 0.4724
 epoch: 89, train_loss: 1.0142, test_loss: 1.0073, test_f1: 0.4602
 epoch: 90, train_loss: 1.0088, test_loss: 1.0171, test_f1: 0.4569
 epoch: 91, train_loss: 1.0139, test_loss: 1.0103, test_f1: 0.4684
 epoch: 92, train_loss: 1.0066, test_loss: 1.0299, test_f1: 0.4690
 epoch: 93, train_loss: 1.0096, test_loss: 1.0156, test_f1: 0.4623
 epoch: 94, train_loss: 1.0088, test_loss: 1.0121, test_f1: 0.4683
 epoch: 95, train_loss: 1.0033, test_loss: 1.0267, test_f1: 0.4726
 epoch: 96, train_loss: 1.0039, test_loss: 1.0090, test_f1: 0.4663
 epoch: 97, train_loss: 1.0016, test_loss: 1.0098, test_f1: 0.4716
 epoch: 98, train_loss: 1.0010, test_loss: 1.0345, test_f1: 0.4623
 epoch: 99, train_loss: 1.0019, test_loss: 1.0182, test_f1: 0.4690
##################ITERATION #9 ****************************************
 epoch: 0, train_loss: 1.3666, test_loss: 1.2870, test_f1: 0.2276
 epoch: 1, train_loss: 1.2848, test_loss: 1.2602, test_f1: 0.2278
 epoch: 2, train_loss: 1.2699, test_loss: 1.2411, test_f1: 0.2465
 epoch: 3, train_loss: 1.2442, test_loss: 1.2250, test_f1: 0.2619
 epoch: 4, train_loss: 1.2409, test_loss: 1.2066, test_f1: 0.3034
 epoch: 5, train_loss: 1.2218, test_loss: 1.1887, test_f1: 0.3301
 epoch: 6, train_loss: 1.2220, test_loss: 1.1785, test_f1: 0.3397
 epoch: 7, train_loss: 1.2116, test_loss: 1.1624, test_f1: 0.3627
 epoch: 8, train_loss: 1.1990, test_loss: 1.1570, test_f1: 0.3553
 epoch: 9, train_loss: 1.1977, test_loss: 1.1425, test_f1: 0.3806
 epoch: 10, train_loss: 1.1983, test_loss: 1.1425, test_f1: 0.3723
 epoch: 11, train_loss: 1.1797, test_loss: 1.1469, test_f1: 0.3663
 epoch: 12, train_loss: 1.1775, test_loss: 1.1301, test_f1: 0.3868
 epoch: 13, train_loss: 1.1717, test_loss: 1.1250, test_f1: 0.3828
 epoch: 14, train_loss: 1.1652, test_loss: 1.1119, test_f1: 0.3976
 epoch: 15, train_loss: 1.1618, test_loss: 1.1102, test_f1: 0.3954
 epoch: 16, train_loss: 1.1532, test_loss: 1.1126, test_f1: 0.3926
 epoch: 17, train_loss: 1.1541, test_loss: 1.0971, test_f1: 0.4136
 epoch: 18, train_loss: 1.1431, test_loss: 1.0923, test_f1: 0.4030
 epoch: 19, train_loss: 1.1381, test_loss: 1.0915, test_f1: 0.4142
 epoch: 20, train_loss: 1.1397, test_loss: 1.0853, test_f1: 0.4273
 epoch: 21, train_loss: 1.1435, test_loss: 1.0846, test_f1: 0.4295
 epoch: 22, train_loss: 1.1238, test_loss: 1.0769, test_f1: 0.4162
 epoch: 23, train_loss: 1.1315, test_loss: 1.0673, test_f1: 0.4272
 epoch: 24, train_loss: 1.1175, test_loss: 1.0806, test_f1: 0.4280
 epoch: 25, train_loss: 1.1208, test_loss: 1.0697, test_f1: 0.4198
 epoch: 26, train_loss: 1.1164, test_loss: 1.0665, test_f1: 0.4346
 epoch: 27, train_loss: 1.1153, test_loss: 1.0716, test_f1: 0.4254
 epoch: 28, train_loss: 1.1031, test_loss: 1.0595, test_f1: 0.4229
 epoch: 29, train_loss: 1.1049, test_loss: 1.0646, test_f1: 0.4312
 epoch: 30, train_loss: 1.0961, test_loss: 1.0434, test_f1: 0.4320
 epoch: 31, train_loss: 1.0995, test_loss: 1.0462, test_f1: 0.4289
 epoch: 32, train_loss: 1.0879, test_loss: 1.0419, test_f1: 0.4339
 epoch: 33, train_loss: 1.0952, test_loss: 1.0284, test_f1: 0.4518
 epoch: 34, train_loss: 1.0956, test_loss: 1.0478, test_f1: 0.4429
 epoch: 35, train_loss: 1.0866, test_loss: 1.0550, test_f1: 0.4417
 epoch: 36, train_loss: 1.0861, test_loss: 1.0421, test_f1: 0.4468
 epoch: 37, train_loss: 1.0874, test_loss: 1.0345, test_f1: 0.4499
 epoch: 38, train_loss: 1.0830, test_loss: 1.0465, test_f1: 0.4245
 epoch: 39, train_loss: 1.0815, test_loss: 1.0299, test_f1: 0.4426
 epoch: 40, train_loss: 1.0750, test_loss: 1.0372, test_f1: 0.4320
 epoch: 41, train_loss: 1.0629, test_loss: 1.0377, test_f1: 0.4143
 epoch: 42, train_loss: 1.0669, test_loss: 1.0187, test_f1: 0.4322
 epoch: 43, train_loss: 1.0638, test_loss: 1.0319, test_f1: 0.4372
 epoch: 44, train_loss: 1.0600, test_loss: 1.0186, test_f1: 0.4453
 epoch: 45, train_loss: 1.0584, test_loss: 1.0090, test_f1: 0.4574
 epoch: 46, train_loss: 1.0591, test_loss: 1.0264, test_f1: 0.4481
 epoch: 47, train_loss: 1.0552, test_loss: 1.0213, test_f1: 0.4425
 epoch: 48, train_loss: 1.0549, test_loss: 1.0242, test_f1: 0.4493
 epoch: 49, train_loss: 1.0492, test_loss: 1.0201, test_f1: 0.4396
 epoch: 50, train_loss: 1.0367, test_loss: 1.0090, test_f1: 0.4646
 epoch: 51, train_loss: 1.0400, test_loss: 1.0065, test_f1: 0.4585
 epoch: 52, train_loss: 1.0509, test_loss: 1.0045, test_f1: 0.4493
 epoch: 53, train_loss: 1.0348, test_loss: 0.9983, test_f1: 0.4621
 epoch: 54, train_loss: 1.0477, test_loss: 0.9967, test_f1: 0.4566
 epoch: 55, train_loss: 1.0406, test_loss: 0.9983, test_f1: 0.4557
 epoch: 56, train_loss: 1.0393, test_loss: 0.9997, test_f1: 0.4533
 epoch: 57, train_loss: 1.0323, test_loss: 1.0102, test_f1: 0.4476
 epoch: 58, train_loss: 1.0308, test_loss: 1.0127, test_f1: 0.4496
 epoch: 59, train_loss: 1.0430, test_loss: 0.9879, test_f1: 0.4756
 epoch: 60, train_loss: 1.0302, test_loss: 1.0006, test_f1: 0.4497
 epoch: 61, train_loss: 1.0210, test_loss: 0.9910, test_f1: 0.4573
 epoch: 62, train_loss: 1.0322, test_loss: 1.0012, test_f1: 0.4430
 epoch: 63, train_loss: 1.0367, test_loss: 1.0133, test_f1: 0.4453
 epoch: 64, train_loss: 1.0302, test_loss: 0.9869, test_f1: 0.4556
 epoch: 65, train_loss: 1.0302, test_loss: 0.9978, test_f1: 0.4437
 epoch: 66, train_loss: 1.0267, test_loss: 0.9940, test_f1: 0.4630
 epoch: 67, train_loss: 1.0296, test_loss: 0.9975, test_f1: 0.4558
 epoch: 68, train_loss: 1.0290, test_loss: 0.9912, test_f1: 0.4637
 epoch: 69, train_loss: 1.0176, test_loss: 0.9973, test_f1: 0.4560
 epoch: 70, train_loss: 1.0314, test_loss: 1.0087, test_f1: 0.4538
 epoch: 71, train_loss: 1.0327, test_loss: 1.0298, test_f1: 0.4327
 epoch: 72, train_loss: 1.0224, test_loss: 1.0182, test_f1: 0.4450
 epoch: 73, train_loss: 1.0078, test_loss: 0.9980, test_f1: 0.4440
 epoch: 74, train_loss: 1.0128, test_loss: 1.0008, test_f1: 0.4510
 epoch: 75, train_loss: 1.0123, test_loss: 1.0056, test_f1: 0.4515
 epoch: 76, train_loss: 1.0180, test_loss: 1.0132, test_f1: 0.4372
 epoch: 77, train_loss: 1.0158, test_loss: 0.9930, test_f1: 0.4484
 epoch: 78, train_loss: 1.0187, test_loss: 1.0194, test_f1: 0.4291
 epoch: 79, train_loss: 1.0184, test_loss: 0.9963, test_f1: 0.4547
 epoch: 80, train_loss: 1.0280, test_loss: 0.9900, test_f1: 0.4542
 epoch: 81, train_loss: 1.0106, test_loss: 0.9971, test_f1: 0.4591
 epoch: 82, train_loss: 1.0030, test_loss: 1.0122, test_f1: 0.4490
 epoch: 83, train_loss: 1.0004, test_loss: 1.0177, test_f1: 0.4435
 epoch: 84, train_loss: 1.0049, test_loss: 0.9958, test_f1: 0.4434
 epoch: 85, train_loss: 1.0103, test_loss: 0.9928, test_f1: 0.4658
 epoch: 86, train_loss: 1.0061, test_loss: 0.9916, test_f1: 0.4592
 epoch: 87, train_loss: 1.0080, test_loss: 1.0148, test_f1: 0.4575
 epoch: 88, train_loss: 1.0037, test_loss: 1.0088, test_f1: 0.4488
 epoch: 89, train_loss: 1.0006, test_loss: 1.0271, test_f1: 0.4543
 epoch: 90, train_loss: 1.0158, test_loss: 0.9916, test_f1: 0.4626
 epoch: 91, train_loss: 0.9976, test_loss: 1.0092, test_f1: 0.4491
 epoch: 92, train_loss: 0.9957, test_loss: 0.9937, test_f1: 0.4555
 epoch: 93, train_loss: 1.0052, test_loss: 1.0321, test_f1: 0.4458
 epoch: 94, train_loss: 0.9966, test_loss: 1.0056, test_f1: 0.4534
 epoch: 95, train_loss: 0.9990, test_loss: 1.0445, test_f1: 0.4428
 epoch: 96, train_loss: 0.9891, test_loss: 1.0084, test_f1: 0.4353
 epoch: 97, train_loss: 0.9836, test_loss: 1.0218, test_f1: 0.4337
 epoch: 98, train_loss: 1.0034, test_loss: 1.0325, test_f1: 0.4472
 epoch: 99, train_loss: 0.9916, test_loss: 1.0418, test_f1: 0.4482

Training completed in 1284.73 seconds
Best F1: 0.5165 at epoch 95
Mean F1 across iterations: 0.4922  0.0159
========================FINAL RESULTS================================
FEGIN weighted F1: 0.5165  0.0159
python main.py --data ltspice_examples --representation component_component --model FEGIN --layers 5 --hiddens 32 --batch_size 32 --lr 0.0001 --emb_size 512 --epochs 100 --save_appendix component_component_L5_H32_BS32_LR0.0001_E512 --no_val
-----



STDERR:
  File "main.py", line 370, in <module>
    main()
  File "main.py", line 254, in main
    dataset = dataset_class(
  File "/home/philip/projects/ltspice_examples_code_repo/Circuit-Completion-Using-GNNs/component_classification_with_link_prediction_head/evaluation/FEGIN/kernel/circuit_datasets.py", line 15, in __init__
    self.data, self.slices = torch.load(self.processed_paths[0])
  File "/home/philip/.local/lib/python3.8/site-packages/torch/serialization.py", line 1040, in load
    warnings.warn(
  File "/usr/lib/python3.8/warnings.py", line 109, in _showwarnmsg
    sw(msg.message, msg.category, msg.filename, msg.lineno,
  File "main.py", line 47, in warn_with_traceback
    traceback.print_stack(file=log)
/home/philip/projects/ltspice_examples_code_repo/Circuit-Completion-Using-GNNs/component_classification_with_link_prediction_head/evaluation/FEGIN/kernel/circuit_datasets.py:15: FutureWarning: You are using `torch.load` with `weights_only=False` (the current default value), which uses the default pickle module implicitly. It is possible to construct malicious pickle data which will execute arbitrary code during unpickling (See https://github.com/pytorch/pytorch/blob/main/SECURITY.md#untrusted-models for more details). In a future release, the default value for `weights_only` will be flipped to `True`. This limits the functions that could be executed during unpickling. Arbitrary objects will no longer be allowed to be loaded via this mode unless they are explicitly allowlisted by the user via `torch.serialization.add_safe_globals`. We recommend you start setting `weights_only=True` for any use case where you don't have full control of the loaded file. Please open an issue on GitHub for any issues related to this experimental feature.
  self.data, self.slices = torch.load(self.processed_paths[0])
