STDOUT:
Results will be saved in /home/philip/projects/ltspice_examples_code_repo/Circuit-Completion-Using-GNNs/component_classification_with_link_prediction_head/evaluation/FEGIN/results/model_FEGIN_dataset_ltspice_demos
Command line input: python main.py --data ltspice_demos --representation component_pin --model FEGIN --layers 2 --hiddens 32 --batch_size 32 --lr 0.001 --emb_size 512 --epochs 100 --save_appendix component_pin_L2_H32_BS32_LR0.001_E512 --no_val
 is saved.
-----
ltspice_demos - FEGIN
Using 2 layers, 32 hidden units, h = 2
Loading component_pin representation dataset
ENTERED
Training FEGIN on component_pin representation
Train: 1565, Test: 383
##################ITERATION #0 ****************************************
 epoch: 0, train_loss: 1.3144, test_loss: 1.2972, test_f1: 0.3480
 epoch: 1, train_loss: 1.1939, test_loss: 1.2152, test_f1: 0.3907
 epoch: 2, train_loss: 1.0844, test_loss: 1.1262, test_f1: 0.3636
 epoch: 3, train_loss: 1.0142, test_loss: 1.0844, test_f1: 0.3792
 epoch: 4, train_loss: 0.9894, test_loss: 1.0782, test_f1: 0.4567
 epoch: 5, train_loss: 0.9555, test_loss: 1.0072, test_f1: 0.4442
 epoch: 6, train_loss: 0.9338, test_loss: 1.0035, test_f1: 0.5312
 epoch: 7, train_loss: 0.9208, test_loss: 0.9794, test_f1: 0.5140
 epoch: 8, train_loss: 0.9000, test_loss: 0.9546, test_f1: 0.5657
 epoch: 9, train_loss: 0.8762, test_loss: 1.0007, test_f1: 0.5505
 epoch: 10, train_loss: 0.8604, test_loss: 0.9367, test_f1: 0.5919
 epoch: 11, train_loss: 0.8505, test_loss: 0.9820, test_f1: 0.5140
 epoch: 12, train_loss: 0.8257, test_loss: 0.9420, test_f1: 0.5292
 epoch: 13, train_loss: 0.7971, test_loss: 0.9117, test_f1: 0.6087
 epoch: 14, train_loss: 0.8143, test_loss: 0.9045, test_f1: 0.5733
 epoch: 15, train_loss: 0.7769, test_loss: 0.9839, test_f1: 0.4734
 epoch: 16, train_loss: 0.7729, test_loss: 1.0085, test_f1: 0.5756
 epoch: 17, train_loss: 0.7601, test_loss: 0.9393, test_f1: 0.5604
 epoch: 18, train_loss: 0.7529, test_loss: 1.0570, test_f1: 0.5625
 epoch: 19, train_loss: 0.7597, test_loss: 0.9184, test_f1: 0.5459
 epoch: 20, train_loss: 0.7564, test_loss: 0.9322, test_f1: 0.5584
 epoch: 21, train_loss: 0.7461, test_loss: 0.9930, test_f1: 0.6000
 epoch: 22, train_loss: 0.7337, test_loss: 1.0145, test_f1: 0.5903
 epoch: 23, train_loss: 0.7213, test_loss: 1.0366, test_f1: 0.5849
 epoch: 24, train_loss: 0.7290, test_loss: 1.0391, test_f1: 0.5898
 epoch: 25, train_loss: 0.7025, test_loss: 0.9727, test_f1: 0.6013
 epoch: 26, train_loss: 0.7027, test_loss: 0.9852, test_f1: 0.5799
 epoch: 27, train_loss: 0.6857, test_loss: 1.0369, test_f1: 0.5666
 epoch: 28, train_loss: 0.6989, test_loss: 1.1806, test_f1: 0.5689
 epoch: 29, train_loss: 0.7026, test_loss: 1.2201, test_f1: 0.5864
 epoch: 30, train_loss: 0.6833, test_loss: 1.0786, test_f1: 0.5496
 epoch: 31, train_loss: 0.7026, test_loss: 1.4647, test_f1: 0.4585
 epoch: 32, train_loss: 0.6934, test_loss: 1.0709, test_f1: 0.6087
 epoch: 33, train_loss: 0.6637, test_loss: 1.0386, test_f1: 0.6072
 epoch: 34, train_loss: 0.6585, test_loss: 1.0622, test_f1: 0.5847
 epoch: 35, train_loss: 0.6889, test_loss: 1.0684, test_f1: 0.5890
 epoch: 36, train_loss: 0.6664, test_loss: 1.0467, test_f1: 0.6176
 epoch: 37, train_loss: 0.6445, test_loss: 1.0105, test_f1: 0.6387
 epoch: 38, train_loss: 0.6586, test_loss: 1.0333, test_f1: 0.5753
 epoch: 39, train_loss: 0.6715, test_loss: 1.1417, test_f1: 0.6148
 epoch: 40, train_loss: 0.6339, test_loss: 1.0910, test_f1: 0.6117
 epoch: 41, train_loss: 0.6329, test_loss: 1.1487, test_f1: 0.6354
 epoch: 42, train_loss: 0.6622, test_loss: 1.0555, test_f1: 0.6223
 epoch: 43, train_loss: 0.6439, test_loss: 1.0832, test_f1: 0.6249
 epoch: 44, train_loss: 0.6341, test_loss: 1.0309, test_f1: 0.6252
 epoch: 45, train_loss: 0.6380, test_loss: 1.0584, test_f1: 0.6688
 epoch: 46, train_loss: 0.6205, test_loss: 1.0603, test_f1: 0.6435
 epoch: 47, train_loss: 0.6127, test_loss: 1.1467, test_f1: 0.6177
 epoch: 48, train_loss: 0.6103, test_loss: 1.1404, test_f1: 0.6487
 epoch: 49, train_loss: 0.6214, test_loss: 1.1350, test_f1: 0.6318
 epoch: 50, train_loss: 0.6198, test_loss: 1.1598, test_f1: 0.6457
 epoch: 51, train_loss: 0.5868, test_loss: 1.0923, test_f1: 0.6246
 epoch: 52, train_loss: 0.5747, test_loss: 1.1242, test_f1: 0.6174
 epoch: 53, train_loss: 0.5833, test_loss: 1.1696, test_f1: 0.6384
 epoch: 54, train_loss: 0.5751, test_loss: 1.1602, test_f1: 0.6195
 epoch: 55, train_loss: 0.5600, test_loss: 1.1822, test_f1: 0.6405
 epoch: 56, train_loss: 0.5529, test_loss: 1.1334, test_f1: 0.6428
 epoch: 57, train_loss: 0.5659, test_loss: 1.1553, test_f1: 0.6282
 epoch: 58, train_loss: 0.5718, test_loss: 1.1635, test_f1: 0.6434
 epoch: 59, train_loss: 0.5552, test_loss: 1.1512, test_f1: 0.6410
 epoch: 60, train_loss: 0.5445, test_loss: 1.2149, test_f1: 0.6136
 epoch: 61, train_loss: 0.5418, test_loss: 1.2576, test_f1: 0.6153
 epoch: 62, train_loss: 0.5488, test_loss: 1.2697, test_f1: 0.6083
 epoch: 63, train_loss: 0.5507, test_loss: 1.1606, test_f1: 0.6493
 epoch: 64, train_loss: 0.5569, test_loss: 1.2406, test_f1: 0.6628
 epoch: 65, train_loss: 0.5562, test_loss: 1.3133, test_f1: 0.6441
 epoch: 66, train_loss: 0.5301, test_loss: 1.2595, test_f1: 0.6303
 epoch: 67, train_loss: 0.5336, test_loss: 1.3309, test_f1: 0.6329
 epoch: 68, train_loss: 0.5423, test_loss: 1.3357, test_f1: 0.6268
 epoch: 69, train_loss: 0.5215, test_loss: 1.3103, test_f1: 0.6532
 epoch: 70, train_loss: 0.5227, test_loss: 1.3175, test_f1: 0.6514
 epoch: 71, train_loss: 0.5414, test_loss: 1.4052, test_f1: 0.6267
 epoch: 72, train_loss: 0.5384, test_loss: 1.3372, test_f1: 0.6211
 epoch: 73, train_loss: 0.5240, test_loss: 1.3368, test_f1: 0.6515
 epoch: 74, train_loss: 0.5133, test_loss: 1.3137, test_f1: 0.6491
 epoch: 75, train_loss: 0.5304, test_loss: 1.2508, test_f1: 0.6421
 epoch: 76, train_loss: 0.5064, test_loss: 1.3133, test_f1: 0.6501
 epoch: 77, train_loss: 0.5104, test_loss: 1.3309, test_f1: 0.6441
 epoch: 78, train_loss: 0.4912, test_loss: 1.3091, test_f1: 0.6512
 epoch: 79, train_loss: 0.5028, test_loss: 1.5536, test_f1: 0.6517
 epoch: 80, train_loss: 0.5177, test_loss: 1.2509, test_f1: 0.6672
 epoch: 81, train_loss: 0.5156, test_loss: 1.2974, test_f1: 0.6492
 epoch: 82, train_loss: 0.4920, test_loss: 1.3394, test_f1: 0.6313
 epoch: 83, train_loss: 0.4990, test_loss: 1.3312, test_f1: 0.6622
 epoch: 84, train_loss: 0.4906, test_loss: 1.4100, test_f1: 0.6414
 epoch: 85, train_loss: 0.4911, test_loss: 1.3668, test_f1: 0.6200
 epoch: 86, train_loss: 0.4832, test_loss: 1.2654, test_f1: 0.6436
 epoch: 87, train_loss: 0.4743, test_loss: 1.3707, test_f1: 0.6522
 epoch: 88, train_loss: 0.5001, test_loss: 1.4151, test_f1: 0.6364
 epoch: 89, train_loss: 0.4789, test_loss: 1.3554, test_f1: 0.6471
 epoch: 90, train_loss: 0.4764, test_loss: 1.4220, test_f1: 0.6415
 epoch: 91, train_loss: 0.4749, test_loss: 1.4102, test_f1: 0.6416
 epoch: 92, train_loss: 0.4827, test_loss: 1.5233, test_f1: 0.6058
 epoch: 93, train_loss: 0.4534, test_loss: 1.5455, test_f1: 0.6398
 epoch: 94, train_loss: 0.4590, test_loss: 1.4004, test_f1: 0.6478
 epoch: 95, train_loss: 0.4514, test_loss: 1.5420, test_f1: 0.6146
 epoch: 96, train_loss: 0.4572, test_loss: 1.4307, test_f1: 0.6413
 epoch: 97, train_loss: 0.4502, test_loss: 1.4507, test_f1: 0.6419
 epoch: 98, train_loss: 0.4648, test_loss: 1.4188, test_f1: 0.6441
 epoch: 99, train_loss: 0.4591, test_loss: 1.5553, test_f1: 0.6121
##################ITERATION #1 ****************************************
 epoch: 0, train_loss: 1.2036, test_loss: 1.2472, test_f1: 0.3135
 epoch: 1, train_loss: 1.0512, test_loss: 1.0757, test_f1: 0.4755
 epoch: 2, train_loss: 0.9642, test_loss: 1.0520, test_f1: 0.4672
 epoch: 3, train_loss: 0.9183, test_loss: 1.0085, test_f1: 0.4814
 epoch: 4, train_loss: 0.8818, test_loss: 1.0469, test_f1: 0.5386
 epoch: 5, train_loss: 0.8324, test_loss: 0.9462, test_f1: 0.5245
 epoch: 6, train_loss: 0.8134, test_loss: 1.0682, test_f1: 0.5675
 epoch: 7, train_loss: 0.7827, test_loss: 1.0896, test_f1: 0.5249
 epoch: 8, train_loss: 0.7776, test_loss: 1.0751, test_f1: 0.5776
 epoch: 9, train_loss: 0.7643, test_loss: 1.0020, test_f1: 0.6158
 epoch: 10, train_loss: 0.7437, test_loss: 0.9817, test_f1: 0.6396
 epoch: 11, train_loss: 0.7367, test_loss: 1.1180, test_f1: 0.5819
 epoch: 12, train_loss: 0.7380, test_loss: 1.1238, test_f1: 0.6072
 epoch: 13, train_loss: 0.7276, test_loss: 1.1640, test_f1: 0.5175
 epoch: 14, train_loss: 0.7074, test_loss: 1.1081, test_f1: 0.6122
 epoch: 15, train_loss: 0.6994, test_loss: 1.0962, test_f1: 0.6328
 epoch: 16, train_loss: 0.6852, test_loss: 1.1262, test_f1: 0.5774
 epoch: 17, train_loss: 0.6921, test_loss: 1.0786, test_f1: 0.6050
 epoch: 18, train_loss: 0.6736, test_loss: 1.0868, test_f1: 0.6325
 epoch: 19, train_loss: 0.6838, test_loss: 1.2392, test_f1: 0.5350
 epoch: 20, train_loss: 0.6843, test_loss: 1.3728, test_f1: 0.5842
 epoch: 21, train_loss: 0.6771, test_loss: 1.2025, test_f1: 0.6054
 epoch: 22, train_loss: 0.6555, test_loss: 1.4313, test_f1: 0.5942
 epoch: 23, train_loss: 0.6870, test_loss: 1.2234, test_f1: 0.5797
 epoch: 24, train_loss: 0.6536, test_loss: 1.3631, test_f1: 0.5898
 epoch: 25, train_loss: 0.6442, test_loss: 1.1561, test_f1: 0.6075
 epoch: 26, train_loss: 0.6357, test_loss: 1.5163, test_f1: 0.5712
 epoch: 27, train_loss: 0.6562, test_loss: 1.3226, test_f1: 0.6059
 epoch: 28, train_loss: 0.6317, test_loss: 1.2141, test_f1: 0.6142
 epoch: 29, train_loss: 0.6169, test_loss: 1.2966, test_f1: 0.5889
 epoch: 30, train_loss: 0.6365, test_loss: 1.3541, test_f1: 0.5963
 epoch: 31, train_loss: 0.6195, test_loss: 1.3354, test_f1: 0.5928
 epoch: 32, train_loss: 0.6253, test_loss: 1.2954, test_f1: 0.5498
 epoch: 33, train_loss: 0.6008, test_loss: 1.2250, test_f1: 0.6076
 epoch: 34, train_loss: 0.6085, test_loss: 1.2057, test_f1: 0.6360
 epoch: 35, train_loss: 0.5997, test_loss: 1.3530, test_f1: 0.5557
 epoch: 36, train_loss: 0.6028, test_loss: 1.3826, test_f1: 0.5695
 epoch: 37, train_loss: 0.5935, test_loss: 1.3411, test_f1: 0.5832
 epoch: 38, train_loss: 0.5838, test_loss: 1.2977, test_f1: 0.5913
 epoch: 39, train_loss: 0.5855, test_loss: 1.2433, test_f1: 0.5977
 epoch: 40, train_loss: 0.5859, test_loss: 1.4869, test_f1: 0.5981
 epoch: 41, train_loss: 0.5682, test_loss: 1.4270, test_f1: 0.5916
 epoch: 42, train_loss: 0.5650, test_loss: 1.4817, test_f1: 0.5424
 epoch: 43, train_loss: 0.5934, test_loss: 1.3512, test_f1: 0.5580
 epoch: 44, train_loss: 0.5561, test_loss: 1.3918, test_f1: 0.6134
 epoch: 45, train_loss: 0.5604, test_loss: 1.4703, test_f1: 0.6510
 epoch: 46, train_loss: 0.5463, test_loss: 1.3181, test_f1: 0.6072
 epoch: 47, train_loss: 0.5454, test_loss: 1.4398, test_f1: 0.5916
 epoch: 48, train_loss: 0.5447, test_loss: 1.5812, test_f1: 0.5974
 epoch: 49, train_loss: 0.5365, test_loss: 1.3902, test_f1: 0.6091
 epoch: 50, train_loss: 0.5420, test_loss: 1.5273, test_f1: 0.6079
 epoch: 51, train_loss: 0.5321, test_loss: 1.3433, test_f1: 0.6362
 epoch: 52, train_loss: 0.5391, test_loss: 1.3939, test_f1: 0.6351
 epoch: 53, train_loss: 0.4980, test_loss: 1.4209, test_f1: 0.6347
 epoch: 54, train_loss: 0.5033, test_loss: 1.5035, test_f1: 0.6112
 epoch: 55, train_loss: 0.5085, test_loss: 1.3637, test_f1: 0.6492
 epoch: 56, train_loss: 0.4906, test_loss: 1.4420, test_f1: 0.6592
 epoch: 57, train_loss: 0.4860, test_loss: 1.3205, test_f1: 0.6417
 epoch: 58, train_loss: 0.4926, test_loss: 1.4708, test_f1: 0.6450
 epoch: 59, train_loss: 0.4799, test_loss: 1.5059, test_f1: 0.6432
 epoch: 60, train_loss: 0.4813, test_loss: 1.5914, test_f1: 0.6290
 epoch: 61, train_loss: 0.4874, test_loss: 1.4695, test_f1: 0.6246
 epoch: 62, train_loss: 0.4817, test_loss: 1.4527, test_f1: 0.6360
 epoch: 63, train_loss: 0.4824, test_loss: 1.5272, test_f1: 0.6402
 epoch: 64, train_loss: 0.4731, test_loss: 1.6393, test_f1: 0.6128
 epoch: 65, train_loss: 0.4848, test_loss: 1.6006, test_f1: 0.6357
 epoch: 66, train_loss: 0.4753, test_loss: 1.6042, test_f1: 0.6307
 epoch: 67, train_loss: 0.4897, test_loss: 1.5262, test_f1: 0.6449
 epoch: 68, train_loss: 0.4639, test_loss: 1.5323, test_f1: 0.6582
 epoch: 69, train_loss: 0.4643, test_loss: 1.6738, test_f1: 0.6313
 epoch: 70, train_loss: 0.4851, test_loss: 1.5118, test_f1: 0.6341
 epoch: 71, train_loss: 0.4528, test_loss: 1.6052, test_f1: 0.6467
 epoch: 72, train_loss: 0.4735, test_loss: 1.6716, test_f1: 0.6093
 epoch: 73, train_loss: 0.4696, test_loss: 1.5761, test_f1: 0.6336
 epoch: 74, train_loss: 0.4301, test_loss: 1.7326, test_f1: 0.6205
 epoch: 75, train_loss: 0.4564, test_loss: 1.5627, test_f1: 0.6498
 epoch: 76, train_loss: 0.4446, test_loss: 1.4980, test_f1: 0.6221
 epoch: 77, train_loss: 0.4270, test_loss: 1.6138, test_f1: 0.6326
 epoch: 78, train_loss: 0.4525, test_loss: 1.5686, test_f1: 0.6472
 epoch: 79, train_loss: 0.4364, test_loss: 1.6044, test_f1: 0.6589
 epoch: 80, train_loss: 0.4529, test_loss: 1.6076, test_f1: 0.6612
 epoch: 81, train_loss: 0.4395, test_loss: 1.6437, test_f1: 0.6448
 epoch: 82, train_loss: 0.4152, test_loss: 1.7770, test_f1: 0.6340
 epoch: 83, train_loss: 0.4391, test_loss: 1.6815, test_f1: 0.6322
 epoch: 84, train_loss: 0.4290, test_loss: 1.6124, test_f1: 0.6524
 epoch: 85, train_loss: 0.4258, test_loss: 1.6277, test_f1: 0.6428
 epoch: 86, train_loss: 0.4691, test_loss: 1.7543, test_f1: 0.6506
 epoch: 87, train_loss: 0.4241, test_loss: 1.6459, test_f1: 0.6626
 epoch: 88, train_loss: 0.4104, test_loss: 1.6689, test_f1: 0.6507
 epoch: 89, train_loss: 0.4193, test_loss: 1.7051, test_f1: 0.6361
 epoch: 90, train_loss: 0.4447, test_loss: 1.7015, test_f1: 0.6640
 epoch: 91, train_loss: 0.4346, test_loss: 1.7915, test_f1: 0.6193
 epoch: 92, train_loss: 0.4267, test_loss: 1.8593, test_f1: 0.5884
 epoch: 93, train_loss: 0.4211, test_loss: 1.6414, test_f1: 0.6594
 epoch: 94, train_loss: 0.4160, test_loss: 1.6031, test_f1: 0.6565
 epoch: 95, train_loss: 0.4076, test_loss: 1.6997, test_f1: 0.6514
 epoch: 96, train_loss: 0.4002, test_loss: 1.8416, test_f1: 0.6297
 epoch: 97, train_loss: 0.4241, test_loss: 1.6627, test_f1: 0.6525
 epoch: 98, train_loss: 0.4151, test_loss: 1.8319, test_f1: 0.6310
 epoch: 99, train_loss: 0.3727, test_loss: 1.7178, test_f1: 0.6220
##################ITERATION #2 ****************************************
 epoch: 0, train_loss: 1.1930, test_loss: 1.1939, test_f1: 0.3985
 epoch: 1, train_loss: 1.0390, test_loss: 1.0458, test_f1: 0.5424
 epoch: 2, train_loss: 0.9750, test_loss: 1.0370, test_f1: 0.5455
 epoch: 3, train_loss: 0.9199, test_loss: 1.0019, test_f1: 0.5594
 epoch: 4, train_loss: 0.8821, test_loss: 0.9845, test_f1: 0.5918
 epoch: 5, train_loss: 0.8534, test_loss: 0.9799, test_f1: 0.6469
 epoch: 6, train_loss: 0.8480, test_loss: 1.0237, test_f1: 0.5669
 epoch: 7, train_loss: 0.8306, test_loss: 0.9676, test_f1: 0.6269
 epoch: 8, train_loss: 0.8284, test_loss: 1.0272, test_f1: 0.5091
 epoch: 9, train_loss: 0.8017, test_loss: 0.9793, test_f1: 0.5961
 epoch: 10, train_loss: 0.7938, test_loss: 0.9596, test_f1: 0.6141
 epoch: 11, train_loss: 0.7840, test_loss: 1.1775, test_f1: 0.6134
 epoch: 12, train_loss: 0.7677, test_loss: 1.1731, test_f1: 0.5853
 epoch: 13, train_loss: 0.7595, test_loss: 0.9804, test_f1: 0.5756
 epoch: 14, train_loss: 0.7423, test_loss: 0.9179, test_f1: 0.6321
 epoch: 15, train_loss: 0.7275, test_loss: 1.0460, test_f1: 0.5737
 epoch: 16, train_loss: 0.7286, test_loss: 0.9766, test_f1: 0.5865
 epoch: 17, train_loss: 0.7199, test_loss: 1.0757, test_f1: 0.5489
 epoch: 18, train_loss: 0.7056, test_loss: 1.0090, test_f1: 0.6076
 epoch: 19, train_loss: 0.7114, test_loss: 1.0203, test_f1: 0.6005
 epoch: 20, train_loss: 0.7014, test_loss: 1.0028, test_f1: 0.5553
 epoch: 21, train_loss: 0.6879, test_loss: 0.9386, test_f1: 0.6584
 epoch: 22, train_loss: 0.6801, test_loss: 1.2395, test_f1: 0.5933
 epoch: 23, train_loss: 0.6723, test_loss: 0.9424, test_f1: 0.6324
 epoch: 24, train_loss: 0.6642, test_loss: 1.1613, test_f1: 0.6151
 epoch: 25, train_loss: 0.6562, test_loss: 1.2215, test_f1: 0.5497
 epoch: 26, train_loss: 0.6654, test_loss: 1.0575, test_f1: 0.6208
 epoch: 27, train_loss: 0.6675, test_loss: 1.2950, test_f1: 0.5909
 epoch: 28, train_loss: 0.6440, test_loss: 1.2566, test_f1: 0.5897
 epoch: 29, train_loss: 0.6423, test_loss: 1.1271, test_f1: 0.5943
 epoch: 30, train_loss: 0.6253, test_loss: 0.9453, test_f1: 0.6390
 epoch: 31, train_loss: 0.6404, test_loss: 1.0999, test_f1: 0.6208
 epoch: 32, train_loss: 0.6249, test_loss: 1.1134, test_f1: 0.6328
 epoch: 33, train_loss: 0.6169, test_loss: 1.0271, test_f1: 0.5630
 epoch: 34, train_loss: 0.6229, test_loss: 1.0177, test_f1: 0.6530
 epoch: 35, train_loss: 0.6099, test_loss: 1.1573, test_f1: 0.6129
 epoch: 36, train_loss: 0.6017, test_loss: 1.0627, test_f1: 0.6147
 epoch: 37, train_loss: 0.5929, test_loss: 1.0812, test_f1: 0.6626
 epoch: 38, train_loss: 0.5738, test_loss: 1.0963, test_f1: 0.6417
 epoch: 39, train_loss: 0.5962, test_loss: 1.5654, test_f1: 0.5816
 epoch: 40, train_loss: 0.5933, test_loss: 1.0976, test_f1: 0.6288
 epoch: 41, train_loss: 0.5511, test_loss: 1.4241, test_f1: 0.6228
 epoch: 42, train_loss: 0.5939, test_loss: 1.2100, test_f1: 0.6124
 epoch: 43, train_loss: 0.5630, test_loss: 1.2406, test_f1: 0.6345
 epoch: 44, train_loss: 0.5773, test_loss: 1.4078, test_f1: 0.6156
 epoch: 45, train_loss: 0.5610, test_loss: 1.0913, test_f1: 0.6151
 epoch: 46, train_loss: 0.5668, test_loss: 1.2962, test_f1: 0.5901
 epoch: 47, train_loss: 0.5445, test_loss: 1.2335, test_f1: 0.6095
 epoch: 48, train_loss: 0.5276, test_loss: 1.2739, test_f1: 0.5813
 epoch: 49, train_loss: 0.5412, test_loss: 1.1616, test_f1: 0.6371
 epoch: 50, train_loss: 0.5235, test_loss: 1.1502, test_f1: 0.6446
 epoch: 51, train_loss: 0.5297, test_loss: 1.1776, test_f1: 0.6257
 epoch: 52, train_loss: 0.4913, test_loss: 1.2387, test_f1: 0.6325
 epoch: 53, train_loss: 0.4869, test_loss: 1.3032, test_f1: 0.6603
 epoch: 54, train_loss: 0.4755, test_loss: 1.3239, test_f1: 0.6543
 epoch: 55, train_loss: 0.4739, test_loss: 1.3129, test_f1: 0.6361
 epoch: 56, train_loss: 0.4669, test_loss: 1.4311, test_f1: 0.6105
 epoch: 57, train_loss: 0.4787, test_loss: 1.4473, test_f1: 0.6026
 epoch: 58, train_loss: 0.4954, test_loss: 1.4523, test_f1: 0.6010
 epoch: 59, train_loss: 0.4691, test_loss: 1.4395, test_f1: 0.6505
 epoch: 60, train_loss: 0.4703, test_loss: 1.6688, test_f1: 0.5851
 epoch: 61, train_loss: 0.4671, test_loss: 1.3900, test_f1: 0.6378
 epoch: 62, train_loss: 0.4450, test_loss: 1.4455, test_f1: 0.6192
 epoch: 63, train_loss: 0.4502, test_loss: 1.3842, test_f1: 0.6554
 epoch: 64, train_loss: 0.4492, test_loss: 1.5498, test_f1: 0.6031
 epoch: 65, train_loss: 0.4535, test_loss: 1.5688, test_f1: 0.6715
 epoch: 66, train_loss: 0.4491, test_loss: 1.6453, test_f1: 0.5821
 epoch: 67, train_loss: 0.4638, test_loss: 1.5675, test_f1: 0.6170
 epoch: 68, train_loss: 0.4340, test_loss: 1.6123, test_f1: 0.6057
 epoch: 69, train_loss: 0.4342, test_loss: 1.5498, test_f1: 0.6519
 epoch: 70, train_loss: 0.4163, test_loss: 1.7729, test_f1: 0.6031
 epoch: 71, train_loss: 0.4326, test_loss: 1.4861, test_f1: 0.6157
 epoch: 72, train_loss: 0.4064, test_loss: 1.9089, test_f1: 0.5905
 epoch: 73, train_loss: 0.4336, test_loss: 1.8104, test_f1: 0.6445
 epoch: 74, train_loss: 0.4237, test_loss: 1.6477, test_f1: 0.6484
 epoch: 75, train_loss: 0.4219, test_loss: 1.6372, test_f1: 0.6445
 epoch: 76, train_loss: 0.4218, test_loss: 1.8870, test_f1: 0.6024
 epoch: 77, train_loss: 0.4034, test_loss: 1.7116, test_f1: 0.6252
 epoch: 78, train_loss: 0.3999, test_loss: 1.6677, test_f1: 0.6093
 epoch: 79, train_loss: 0.4175, test_loss: 1.8994, test_f1: 0.6154
 epoch: 80, train_loss: 0.4182, test_loss: 1.7266, test_f1: 0.6141
 epoch: 81, train_loss: 0.4098, test_loss: 1.6694, test_f1: 0.6159
 epoch: 82, train_loss: 0.4111, test_loss: 1.6298, test_f1: 0.6323
 epoch: 83, train_loss: 0.4011, test_loss: 2.0605, test_f1: 0.5950
 epoch: 84, train_loss: 0.3967, test_loss: 1.8204, test_f1: 0.6355
 epoch: 85, train_loss: 0.3690, test_loss: 1.7381, test_f1: 0.6143
 epoch: 86, train_loss: 0.3886, test_loss: 1.9074, test_f1: 0.6281
 epoch: 87, train_loss: 0.4065, test_loss: 1.8565, test_f1: 0.6053
 epoch: 88, train_loss: 0.3784, test_loss: 1.7276, test_f1: 0.6009
 epoch: 89, train_loss: 0.3819, test_loss: 1.6940, test_f1: 0.6479
 epoch: 90, train_loss: 0.3652, test_loss: 1.8056, test_f1: 0.6315
 epoch: 91, train_loss: 0.3701, test_loss: 1.7483, test_f1: 0.6289
 epoch: 92, train_loss: 0.3734, test_loss: 1.7462, test_f1: 0.6565
 epoch: 93, train_loss: 0.3679, test_loss: 1.9436, test_f1: 0.6003
 epoch: 94, train_loss: 0.3546, test_loss: 1.9214, test_f1: 0.6171
 epoch: 95, train_loss: 0.3714, test_loss: 2.0861, test_f1: 0.5992
 epoch: 96, train_loss: 0.3542, test_loss: 2.0737, test_f1: 0.5850
 epoch: 97, train_loss: 0.3780, test_loss: 2.2108, test_f1: 0.5914
 epoch: 98, train_loss: 0.3666, test_loss: 1.8994, test_f1: 0.6168
 epoch: 99, train_loss: 0.3544, test_loss: 1.9787, test_f1: 0.6226
##################ITERATION #3 ****************************************
 epoch: 0, train_loss: 1.2821, test_loss: 1.1936, test_f1: 0.3314
 epoch: 1, train_loss: 1.0421, test_loss: 1.0771, test_f1: 0.5348
 epoch: 2, train_loss: 0.9997, test_loss: 1.0289, test_f1: 0.5712
 epoch: 3, train_loss: 0.9222, test_loss: 0.9886, test_f1: 0.5787
 epoch: 4, train_loss: 0.8846, test_loss: 0.9840, test_f1: 0.5606
 epoch: 5, train_loss: 0.8666, test_loss: 0.9579, test_f1: 0.5920
 epoch: 6, train_loss: 0.8141, test_loss: 0.9669, test_f1: 0.5927
 epoch: 7, train_loss: 0.7971, test_loss: 1.0388, test_f1: 0.5335
 epoch: 8, train_loss: 0.8004, test_loss: 1.0255, test_f1: 0.5847
 epoch: 9, train_loss: 0.7739, test_loss: 0.9423, test_f1: 0.5735
 epoch: 10, train_loss: 0.7821, test_loss: 0.9159, test_f1: 0.5800
 epoch: 11, train_loss: 0.7536, test_loss: 0.9748, test_f1: 0.5753
 epoch: 12, train_loss: 0.7449, test_loss: 1.0733, test_f1: 0.5229
 epoch: 13, train_loss: 0.7354, test_loss: 0.9588, test_f1: 0.5973
 epoch: 14, train_loss: 0.7214, test_loss: 1.0250, test_f1: 0.5500
 epoch: 15, train_loss: 0.7136, test_loss: 0.9658, test_f1: 0.5533
 epoch: 16, train_loss: 0.7154, test_loss: 0.9603, test_f1: 0.5924
 epoch: 17, train_loss: 0.6970, test_loss: 1.0374, test_f1: 0.5524
 epoch: 18, train_loss: 0.6881, test_loss: 1.0459, test_f1: 0.5521
 epoch: 19, train_loss: 0.6808, test_loss: 1.0414, test_f1: 0.5413
 epoch: 20, train_loss: 0.6737, test_loss: 1.0190, test_f1: 0.5583
 epoch: 21, train_loss: 0.6514, test_loss: 1.0543, test_f1: 0.5790
 epoch: 22, train_loss: 0.6664, test_loss: 1.0392, test_f1: 0.5954
 epoch: 23, train_loss: 0.6486, test_loss: 1.0760, test_f1: 0.5696
 epoch: 24, train_loss: 0.6420, test_loss: 1.0679, test_f1: 0.5520
 epoch: 25, train_loss: 0.6276, test_loss: 1.1165, test_f1: 0.5479
 epoch: 26, train_loss: 0.6324, test_loss: 1.1239, test_f1: 0.5713
 epoch: 27, train_loss: 0.6099, test_loss: 1.1077, test_f1: 0.5543
 epoch: 28, train_loss: 0.6040, test_loss: 1.2552, test_f1: 0.5718
 epoch: 29, train_loss: 0.5906, test_loss: 1.1453, test_f1: 0.5895
 epoch: 30, train_loss: 0.5953, test_loss: 1.2273, test_f1: 0.5919
 epoch: 31, train_loss: 0.5886, test_loss: 1.2099, test_f1: 0.6280
 epoch: 32, train_loss: 0.5815, test_loss: 1.2552, test_f1: 0.5808
 epoch: 33, train_loss: 0.5748, test_loss: 1.2852, test_f1: 0.5862
 epoch: 34, train_loss: 0.5671, test_loss: 1.3197, test_f1: 0.5826
 epoch: 35, train_loss: 0.5729, test_loss: 1.1291, test_f1: 0.5914
 epoch: 36, train_loss: 0.5666, test_loss: 1.1092, test_f1: 0.5928
 epoch: 37, train_loss: 0.5621, test_loss: 1.1970, test_f1: 0.5777
 epoch: 38, train_loss: 0.5733, test_loss: 1.1883, test_f1: 0.6159
 epoch: 39, train_loss: 0.5410, test_loss: 1.2938, test_f1: 0.5800
 epoch: 40, train_loss: 0.5508, test_loss: 1.4327, test_f1: 0.5644
 epoch: 41, train_loss: 0.5417, test_loss: 1.2227, test_f1: 0.5926
 epoch: 42, train_loss: 0.5428, test_loss: 1.3603, test_f1: 0.5880
 epoch: 43, train_loss: 0.5379, test_loss: 1.3698, test_f1: 0.5996
 epoch: 44, train_loss: 0.5337, test_loss: 1.3070, test_f1: 0.6138
 epoch: 45, train_loss: 0.4996, test_loss: 1.4434, test_f1: 0.5753
 epoch: 46, train_loss: 0.5084, test_loss: 1.4079, test_f1: 0.6065
 epoch: 47, train_loss: 0.5176, test_loss: 1.4115, test_f1: 0.5551
 epoch: 48, train_loss: 0.5129, test_loss: 1.2264, test_f1: 0.6250
 epoch: 49, train_loss: 0.5092, test_loss: 1.3631, test_f1: 0.6267
 epoch: 50, train_loss: 0.4942, test_loss: 1.3268, test_f1: 0.6158
 epoch: 51, train_loss: 0.4782, test_loss: 1.5018, test_f1: 0.5976
 epoch: 52, train_loss: 0.4780, test_loss: 1.2572, test_f1: 0.6412
 epoch: 53, train_loss: 0.4609, test_loss: 1.3298, test_f1: 0.6433
 epoch: 54, train_loss: 0.4567, test_loss: 1.3401, test_f1: 0.6250
 epoch: 55, train_loss: 0.4376, test_loss: 1.4591, test_f1: 0.6361
 epoch: 56, train_loss: 0.4582, test_loss: 1.4829, test_f1: 0.6259
 epoch: 57, train_loss: 0.4355, test_loss: 1.3792, test_f1: 0.6353
 epoch: 58, train_loss: 0.4229, test_loss: 1.5017, test_f1: 0.6266
 epoch: 59, train_loss: 0.4234, test_loss: 1.4415, test_f1: 0.6329
 epoch: 60, train_loss: 0.4261, test_loss: 1.4705, test_f1: 0.6243
 epoch: 61, train_loss: 0.4151, test_loss: 1.6490, test_f1: 0.6160
 epoch: 62, train_loss: 0.4136, test_loss: 1.6588, test_f1: 0.6183
 epoch: 63, train_loss: 0.4341, test_loss: 1.6603, test_f1: 0.6041
 epoch: 64, train_loss: 0.4203, test_loss: 1.5275, test_f1: 0.6439
 epoch: 65, train_loss: 0.4055, test_loss: 1.6059, test_f1: 0.6383
 epoch: 66, train_loss: 0.3963, test_loss: 1.5888, test_f1: 0.6014
 epoch: 67, train_loss: 0.4221, test_loss: 1.7662, test_f1: 0.6043
 epoch: 68, train_loss: 0.4115, test_loss: 1.6302, test_f1: 0.6299
 epoch: 69, train_loss: 0.4043, test_loss: 1.7797, test_f1: 0.6249
 epoch: 70, train_loss: 0.4168, test_loss: 1.8439, test_f1: 0.6260
 epoch: 71, train_loss: 0.3981, test_loss: 1.7454, test_f1: 0.6381
 epoch: 72, train_loss: 0.3960, test_loss: 1.6804, test_f1: 0.6272
 epoch: 73, train_loss: 0.3999, test_loss: 1.7398, test_f1: 0.6111
 epoch: 74, train_loss: 0.3765, test_loss: 1.6748, test_f1: 0.6300
 epoch: 75, train_loss: 0.4027, test_loss: 1.7699, test_f1: 0.6229
 epoch: 76, train_loss: 0.3752, test_loss: 1.7851, test_f1: 0.6536
 epoch: 77, train_loss: 0.3600, test_loss: 1.8281, test_f1: 0.6505
 epoch: 78, train_loss: 0.3816, test_loss: 1.7484, test_f1: 0.6561
 epoch: 79, train_loss: 0.3709, test_loss: 1.8008, test_f1: 0.6364
 epoch: 80, train_loss: 0.3519, test_loss: 1.8034, test_f1: 0.6284
 epoch: 81, train_loss: 0.3754, test_loss: 1.6814, test_f1: 0.6249
 epoch: 82, train_loss: 0.3647, test_loss: 1.8757, test_f1: 0.6082
 epoch: 83, train_loss: 0.3586, test_loss: 2.0063, test_f1: 0.6392
 epoch: 84, train_loss: 0.3631, test_loss: 1.7436, test_f1: 0.6279
 epoch: 85, train_loss: 0.3560, test_loss: 1.9545, test_f1: 0.6560
 epoch: 86, train_loss: 0.3615, test_loss: 1.9713, test_f1: 0.6325
 epoch: 87, train_loss: 0.3854, test_loss: 1.8707, test_f1: 0.6306
 epoch: 88, train_loss: 0.3649, test_loss: 1.9103, test_f1: 0.6101
 epoch: 89, train_loss: 0.3686, test_loss: 1.8127, test_f1: 0.5984
 epoch: 90, train_loss: 0.3776, test_loss: 1.8334, test_f1: 0.6175
 epoch: 91, train_loss: 0.3806, test_loss: 1.9247, test_f1: 0.6272
 epoch: 92, train_loss: 0.3376, test_loss: 1.9864, test_f1: 0.6222
 epoch: 93, train_loss: 0.3695, test_loss: 1.9198, test_f1: 0.6186
 epoch: 94, train_loss: 0.3545, test_loss: 1.9990, test_f1: 0.6243
 epoch: 95, train_loss: 0.3465, test_loss: 1.9104, test_f1: 0.6120
 epoch: 96, train_loss: 0.3376, test_loss: 1.9083, test_f1: 0.6308
 epoch: 97, train_loss: 0.3597, test_loss: 2.2271, test_f1: 0.5874
 epoch: 98, train_loss: 0.3650, test_loss: 2.0165, test_f1: 0.6131
 epoch: 99, train_loss: 0.3483, test_loss: 2.0842, test_f1: 0.6048
##################ITERATION #4 ****************************************
 epoch: 0, train_loss: 1.2813, test_loss: 1.2668, test_f1: 0.3273
 epoch: 1, train_loss: 1.1160, test_loss: 1.1353, test_f1: 0.4521
 epoch: 2, train_loss: 1.0212, test_loss: 1.0862, test_f1: 0.5022
 epoch: 3, train_loss: 1.0015, test_loss: 1.0692, test_f1: 0.5038
 epoch: 4, train_loss: 0.9498, test_loss: 1.0244, test_f1: 0.5125
 epoch: 5, train_loss: 0.9358, test_loss: 1.0307, test_f1: 0.5346
 epoch: 6, train_loss: 0.9074, test_loss: 1.0147, test_f1: 0.5726
 epoch: 7, train_loss: 0.9037, test_loss: 1.0411, test_f1: 0.5335
 epoch: 8, train_loss: 0.8699, test_loss: 1.0061, test_f1: 0.5530
 epoch: 9, train_loss: 0.8510, test_loss: 0.9951, test_f1: 0.5608
 epoch: 10, train_loss: 0.8469, test_loss: 0.9353, test_f1: 0.5888
 epoch: 11, train_loss: 0.8142, test_loss: 1.0107, test_f1: 0.6032
 epoch: 12, train_loss: 0.8258, test_loss: 1.0516, test_f1: 0.5492
 epoch: 13, train_loss: 0.8138, test_loss: 1.0140, test_f1: 0.5545
 epoch: 14, train_loss: 0.8159, test_loss: 1.0704, test_f1: 0.5705
 epoch: 15, train_loss: 0.7907, test_loss: 1.0124, test_f1: 0.5869
 epoch: 16, train_loss: 0.7944, test_loss: 1.0227, test_f1: 0.5897
 epoch: 17, train_loss: 0.7719, test_loss: 1.0556, test_f1: 0.5879
 epoch: 18, train_loss: 0.7658, test_loss: 1.0035, test_f1: 0.6072
 epoch: 19, train_loss: 0.7393, test_loss: 1.0260, test_f1: 0.5042
 epoch: 20, train_loss: 0.7427, test_loss: 1.0211, test_f1: 0.5657
 epoch: 21, train_loss: 0.7497, test_loss: 1.0078, test_f1: 0.5971
 epoch: 22, train_loss: 0.7433, test_loss: 1.1755, test_f1: 0.5727
 epoch: 23, train_loss: 0.7206, test_loss: 1.0760, test_f1: 0.6232
 epoch: 24, train_loss: 0.7166, test_loss: 1.1174, test_f1: 0.5945
 epoch: 25, train_loss: 0.7148, test_loss: 1.3213, test_f1: 0.5432
 epoch: 26, train_loss: 0.6952, test_loss: 1.3033, test_f1: 0.5358
 epoch: 27, train_loss: 0.7210, test_loss: 1.2969, test_f1: 0.5679
 epoch: 28, train_loss: 0.7081, test_loss: 1.0413, test_f1: 0.5989
 epoch: 29, train_loss: 0.6733, test_loss: 1.2080, test_f1: 0.5734
 epoch: 30, train_loss: 0.7045, test_loss: 1.0957, test_f1: 0.5914
 epoch: 31, train_loss: 0.6825, test_loss: 1.2205, test_f1: 0.6103
 epoch: 32, train_loss: 0.6464, test_loss: 1.0086, test_f1: 0.5509
 epoch: 33, train_loss: 0.6692, test_loss: 1.1955, test_f1: 0.6046
 epoch: 34, train_loss: 0.6799, test_loss: 1.5962, test_f1: 0.5516
 epoch: 35, train_loss: 0.6601, test_loss: 1.2426, test_f1: 0.5867
 epoch: 36, train_loss: 0.6369, test_loss: 1.3940, test_f1: 0.5856
 epoch: 37, train_loss: 0.6277, test_loss: 1.1292, test_f1: 0.5720
 epoch: 38, train_loss: 0.6483, test_loss: 1.0930, test_f1: 0.6160
 epoch: 39, train_loss: 0.6548, test_loss: 1.0225, test_f1: 0.5727
 epoch: 40, train_loss: 0.6545, test_loss: 1.1535, test_f1: 0.5753
 epoch: 41, train_loss: 0.6134, test_loss: 1.2120, test_f1: 0.5472
 epoch: 42, train_loss: 0.6103, test_loss: 1.0988, test_f1: 0.5688
 epoch: 43, train_loss: 0.5925, test_loss: 1.3205, test_f1: 0.5305
 epoch: 44, train_loss: 0.6209, test_loss: 1.4146, test_f1: 0.6052
 epoch: 45, train_loss: 0.6109, test_loss: 1.2607, test_f1: 0.5575
 epoch: 46, train_loss: 0.5955, test_loss: 1.3234, test_f1: 0.5866
 epoch: 47, train_loss: 0.6058, test_loss: 1.1984, test_f1: 0.5807
 epoch: 48, train_loss: 0.6087, test_loss: 1.4084, test_f1: 0.5816
 epoch: 49, train_loss: 0.5971, test_loss: 1.2593, test_f1: 0.5451
 epoch: 50, train_loss: 0.6137, test_loss: 1.4463, test_f1: 0.5696
 epoch: 51, train_loss: 0.5671, test_loss: 1.3823, test_f1: 0.5997
 epoch: 52, train_loss: 0.5374, test_loss: 1.4676, test_f1: 0.5627
 epoch: 53, train_loss: 0.5340, test_loss: 1.2304, test_f1: 0.6160
 epoch: 54, train_loss: 0.5332, test_loss: 1.4109, test_f1: 0.5695
 epoch: 55, train_loss: 0.5407, test_loss: 1.2820, test_f1: 0.5864
 epoch: 56, train_loss: 0.5413, test_loss: 1.4201, test_f1: 0.5902
 epoch: 57, train_loss: 0.5362, test_loss: 1.3845, test_f1: 0.6027
 epoch: 58, train_loss: 0.5311, test_loss: 1.4910, test_f1: 0.5708
 epoch: 59, train_loss: 0.5398, test_loss: 1.3026, test_f1: 0.6172
 epoch: 60, train_loss: 0.5226, test_loss: 1.2091, test_f1: 0.6454
 epoch: 61, train_loss: 0.5139, test_loss: 1.3968, test_f1: 0.6055
 epoch: 62, train_loss: 0.5132, test_loss: 1.2406, test_f1: 0.6462
 epoch: 63, train_loss: 0.5005, test_loss: 1.2309, test_f1: 0.6345
 epoch: 64, train_loss: 0.5008, test_loss: 1.1922, test_f1: 0.6311
 epoch: 65, train_loss: 0.5200, test_loss: 1.4018, test_f1: 0.5958
 epoch: 66, train_loss: 0.4839, test_loss: 1.5300, test_f1: 0.6030
 epoch: 67, train_loss: 0.5054, test_loss: 1.3764, test_f1: 0.6192
 epoch: 68, train_loss: 0.5071, test_loss: 1.4124, test_f1: 0.6088
 epoch: 69, train_loss: 0.5000, test_loss: 1.6268, test_f1: 0.6038
 epoch: 70, train_loss: 0.4930, test_loss: 1.4256, test_f1: 0.6025
 epoch: 71, train_loss: 0.5075, test_loss: 1.3274, test_f1: 0.6267
 epoch: 72, train_loss: 0.5026, test_loss: 1.3341, test_f1: 0.6342
 epoch: 73, train_loss: 0.4679, test_loss: 1.5823, test_f1: 0.5723
 epoch: 74, train_loss: 0.4949, test_loss: 1.3825, test_f1: 0.6547
 epoch: 75, train_loss: 0.4642, test_loss: 1.5310, test_f1: 0.5821
 epoch: 76, train_loss: 0.4772, test_loss: 1.3708, test_f1: 0.6533
 epoch: 77, train_loss: 0.4515, test_loss: 1.3245, test_f1: 0.6263
 epoch: 78, train_loss: 0.4831, test_loss: 1.4650, test_f1: 0.5848
 epoch: 79, train_loss: 0.4616, test_loss: 1.3607, test_f1: 0.6423
 epoch: 80, train_loss: 0.4896, test_loss: 1.2634, test_f1: 0.6539
 epoch: 81, train_loss: 0.4789, test_loss: 1.3984, test_f1: 0.6099
 epoch: 82, train_loss: 0.4723, test_loss: 1.3132, test_f1: 0.6456
 epoch: 83, train_loss: 0.4601, test_loss: 1.2693, test_f1: 0.6782
 epoch: 84, train_loss: 0.4559, test_loss: 1.3602, test_f1: 0.6409
 epoch: 85, train_loss: 0.4769, test_loss: 1.3975, test_f1: 0.6233
 epoch: 86, train_loss: 0.4734, test_loss: 1.4851, test_f1: 0.6518
 epoch: 87, train_loss: 0.4531, test_loss: 1.4060, test_f1: 0.6635
 epoch: 88, train_loss: 0.4546, test_loss: 1.4026, test_f1: 0.6469
 epoch: 89, train_loss: 0.4530, test_loss: 1.4217, test_f1: 0.6066
 epoch: 90, train_loss: 0.4329, test_loss: 1.4650, test_f1: 0.5939
 epoch: 91, train_loss: 0.4276, test_loss: 1.4568, test_f1: 0.6415
 epoch: 92, train_loss: 0.4424, test_loss: 1.4085, test_f1: 0.6359
 epoch: 93, train_loss: 0.4376, test_loss: 1.6874, test_f1: 0.5937
 epoch: 94, train_loss: 0.4645, test_loss: 1.5511, test_f1: 0.6071
 epoch: 95, train_loss: 0.4252, test_loss: 1.5698, test_f1: 0.6159
 epoch: 96, train_loss: 0.4447, test_loss: 1.5320, test_f1: 0.6165
 epoch: 97, train_loss: 0.4307, test_loss: 1.9692, test_f1: 0.6302
 epoch: 98, train_loss: 0.4143, test_loss: 1.5806, test_f1: 0.6274
 epoch: 99, train_loss: 0.4201, test_loss: 1.5846, test_f1: 0.6209
##################ITERATION #5 ****************************************
 epoch: 0, train_loss: 1.2479, test_loss: 1.1940, test_f1: 0.4071
 epoch: 1, train_loss: 1.0309, test_loss: 1.0970, test_f1: 0.4702
 epoch: 2, train_loss: 0.9796, test_loss: 1.0590, test_f1: 0.5123
 epoch: 3, train_loss: 0.9395, test_loss: 1.0131, test_f1: 0.5499
 epoch: 4, train_loss: 0.9170, test_loss: 0.9820, test_f1: 0.5364
 epoch: 5, train_loss: 0.8981, test_loss: 1.0314, test_f1: 0.5474
 epoch: 6, train_loss: 0.8699, test_loss: 0.9958, test_f1: 0.5573
 epoch: 7, train_loss: 0.8423, test_loss: 0.9933, test_f1: 0.5773
 epoch: 8, train_loss: 0.8262, test_loss: 1.0033, test_f1: 0.5346
 epoch: 9, train_loss: 0.8117, test_loss: 0.9548, test_f1: 0.5362
 epoch: 10, train_loss: 0.7896, test_loss: 0.9898, test_f1: 0.5473
 epoch: 11, train_loss: 0.7763, test_loss: 0.9560, test_f1: 0.6047
 epoch: 12, train_loss: 0.7795, test_loss: 0.9808, test_f1: 0.6081
 epoch: 13, train_loss: 0.7863, test_loss: 0.9710, test_f1: 0.5756
 epoch: 14, train_loss: 0.7554, test_loss: 1.0698, test_f1: 0.5404
 epoch: 15, train_loss: 0.7527, test_loss: 0.9848, test_f1: 0.6311
 epoch: 16, train_loss: 0.7568, test_loss: 1.0893, test_f1: 0.5248
 epoch: 17, train_loss: 0.7311, test_loss: 1.0167, test_f1: 0.5960
 epoch: 18, train_loss: 0.7419, test_loss: 1.0451, test_f1: 0.5889
 epoch: 19, train_loss: 0.7156, test_loss: 1.0384, test_f1: 0.5893
 epoch: 20, train_loss: 0.7237, test_loss: 1.0682, test_f1: 0.5335
 epoch: 21, train_loss: 0.6944, test_loss: 1.1354, test_f1: 0.5541
 epoch: 22, train_loss: 0.7144, test_loss: 1.1283, test_f1: 0.5624
 epoch: 23, train_loss: 0.7032, test_loss: 1.2156, test_f1: 0.5447
 epoch: 24, train_loss: 0.6820, test_loss: 1.0719, test_f1: 0.6048
 epoch: 25, train_loss: 0.6786, test_loss: 1.0885, test_f1: 0.5623
 epoch: 26, train_loss: 0.6794, test_loss: 1.3221, test_f1: 0.5404
 epoch: 27, train_loss: 0.6721, test_loss: 0.9888, test_f1: 0.6146
 epoch: 28, train_loss: 0.6712, test_loss: 1.1654, test_f1: 0.5818
 epoch: 29, train_loss: 0.6895, test_loss: 1.0926, test_f1: 0.5577
 epoch: 30, train_loss: 0.6687, test_loss: 1.0147, test_f1: 0.6184
 epoch: 31, train_loss: 0.6485, test_loss: 1.1263, test_f1: 0.6047
 epoch: 32, train_loss: 0.6517, test_loss: 1.0265, test_f1: 0.6517
 epoch: 33, train_loss: 0.6442, test_loss: 1.1193, test_f1: 0.5530
 epoch: 34, train_loss: 0.6482, test_loss: 1.1317, test_f1: 0.6118
 epoch: 35, train_loss: 0.6136, test_loss: 1.2620, test_f1: 0.5959
 epoch: 36, train_loss: 0.6434, test_loss: 1.1459, test_f1: 0.6206
 epoch: 37, train_loss: 0.6177, test_loss: 1.1924, test_f1: 0.6263
 epoch: 38, train_loss: 0.6125, test_loss: 1.2572, test_f1: 0.5691
 epoch: 39, train_loss: 0.6180, test_loss: 1.3028, test_f1: 0.5689
 epoch: 40, train_loss: 0.6071, test_loss: 1.2329, test_f1: 0.5703
 epoch: 41, train_loss: 0.6096, test_loss: 1.3326, test_f1: 0.6008
 epoch: 42, train_loss: 0.5942, test_loss: 1.2439, test_f1: 0.6175
 epoch: 43, train_loss: 0.5951, test_loss: 1.1211, test_f1: 0.6157
 epoch: 44, train_loss: 0.6009, test_loss: 1.2873, test_f1: 0.5774
 epoch: 45, train_loss: 0.6205, test_loss: 1.5987, test_f1: 0.5609
 epoch: 46, train_loss: 0.5744, test_loss: 1.3732, test_f1: 0.5707
 epoch: 47, train_loss: 0.5611, test_loss: 1.3916, test_f1: 0.5934
 epoch: 48, train_loss: 0.5685, test_loss: 1.4141, test_f1: 0.5703
 epoch: 49, train_loss: 0.5657, test_loss: 1.3433, test_f1: 0.5234
 epoch: 50, train_loss: 0.5495, test_loss: 1.4548, test_f1: 0.6030
 epoch: 51, train_loss: 0.5472, test_loss: 1.2692, test_f1: 0.6387
 epoch: 52, train_loss: 0.5228, test_loss: 1.2945, test_f1: 0.5863
 epoch: 53, train_loss: 0.5397, test_loss: 1.4233, test_f1: 0.6470
 epoch: 54, train_loss: 0.5367, test_loss: 1.3903, test_f1: 0.6224
 epoch: 55, train_loss: 0.5171, test_loss: 1.5856, test_f1: 0.6206
 epoch: 56, train_loss: 0.5322, test_loss: 1.3284, test_f1: 0.6347
 epoch: 57, train_loss: 0.5090, test_loss: 1.2167, test_f1: 0.6281
 epoch: 58, train_loss: 0.5142, test_loss: 1.2524, test_f1: 0.6513
 epoch: 59, train_loss: 0.5147, test_loss: 1.3701, test_f1: 0.6207
 epoch: 60, train_loss: 0.4997, test_loss: 1.4201, test_f1: 0.6321
 epoch: 61, train_loss: 0.5157, test_loss: 1.4104, test_f1: 0.6328
 epoch: 62, train_loss: 0.4842, test_loss: 1.5123, test_f1: 0.6241
 epoch: 63, train_loss: 0.4841, test_loss: 1.5844, test_f1: 0.6247
 epoch: 64, train_loss: 0.5095, test_loss: 1.5052, test_f1: 0.6084
 epoch: 65, train_loss: 0.4752, test_loss: 1.4896, test_f1: 0.5940
 epoch: 66, train_loss: 0.4793, test_loss: 1.7235, test_f1: 0.5683
 epoch: 67, train_loss: 0.4913, test_loss: 1.5894, test_f1: 0.6255
 epoch: 68, train_loss: 0.4725, test_loss: 1.6061, test_f1: 0.5857
 epoch: 69, train_loss: 0.4714, test_loss: 1.3529, test_f1: 0.6341
 epoch: 70, train_loss: 0.4989, test_loss: 1.4742, test_f1: 0.6234
 epoch: 71, train_loss: 0.4880, test_loss: 1.5387, test_f1: 0.6389
 epoch: 72, train_loss: 0.4722, test_loss: 1.3605, test_f1: 0.5748
 epoch: 73, train_loss: 0.4814, test_loss: 1.5221, test_f1: 0.6534
 epoch: 74, train_loss: 0.4623, test_loss: 1.4914, test_f1: 0.5830
 epoch: 75, train_loss: 0.4653, test_loss: 1.5481, test_f1: 0.6044
 epoch: 76, train_loss: 0.4664, test_loss: 1.3262, test_f1: 0.6017
 epoch: 77, train_loss: 0.4619, test_loss: 1.6436, test_f1: 0.6211
 epoch: 78, train_loss: 0.4576, test_loss: 1.6846, test_f1: 0.6050
 epoch: 79, train_loss: 0.4372, test_loss: 1.6243, test_f1: 0.6391
 epoch: 80, train_loss: 0.4256, test_loss: 1.7976, test_f1: 0.6264
 epoch: 81, train_loss: 0.4315, test_loss: 1.6833, test_f1: 0.6198
 epoch: 82, train_loss: 0.4218, test_loss: 1.4575, test_f1: 0.6311
 epoch: 83, train_loss: 0.4319, test_loss: 1.8508, test_f1: 0.5919
 epoch: 84, train_loss: 0.4425, test_loss: 1.7569, test_f1: 0.6099
 epoch: 85, train_loss: 0.4059, test_loss: 1.8574, test_f1: 0.6329
 epoch: 86, train_loss: 0.4300, test_loss: 1.6750, test_f1: 0.6108
 epoch: 87, train_loss: 0.4173, test_loss: 1.5299, test_f1: 0.6378
 epoch: 88, train_loss: 0.4296, test_loss: 1.8451, test_f1: 0.6136
 epoch: 89, train_loss: 0.4577, test_loss: 1.4832, test_f1: 0.6532
 epoch: 90, train_loss: 0.4039, test_loss: 1.7157, test_f1: 0.5961
 epoch: 91, train_loss: 0.4101, test_loss: 1.9580, test_f1: 0.6124
 epoch: 92, train_loss: 0.4315, test_loss: 2.0451, test_f1: 0.5955
 epoch: 93, train_loss: 0.4298, test_loss: 1.5958, test_f1: 0.6298
 epoch: 94, train_loss: 0.4393, test_loss: 1.7411, test_f1: 0.5998
 epoch: 95, train_loss: 0.4093, test_loss: 1.9622, test_f1: 0.6230
 epoch: 96, train_loss: 0.4209, test_loss: 1.7749, test_f1: 0.6225
 epoch: 97, train_loss: 0.3995, test_loss: 1.7655, test_f1: 0.6089
 epoch: 98, train_loss: 0.4144, test_loss: 2.0033, test_f1: 0.5858
 epoch: 99, train_loss: 0.3892, test_loss: 1.6640, test_f1: 0.6243
##################ITERATION #6 ****************************************
 epoch: 0, train_loss: 1.3095, test_loss: 1.2297, test_f1: 0.4217
 epoch: 1, train_loss: 1.0609, test_loss: 1.0908, test_f1: 0.5666
 epoch: 2, train_loss: 0.9960, test_loss: 1.0437, test_f1: 0.5734
 epoch: 3, train_loss: 0.9558, test_loss: 1.0378, test_f1: 0.5322
 epoch: 4, train_loss: 0.9251, test_loss: 1.0702, test_f1: 0.5182
 epoch: 5, train_loss: 0.9037, test_loss: 1.0138, test_f1: 0.5601
 epoch: 6, train_loss: 0.8773, test_loss: 1.0445, test_f1: 0.5079
 epoch: 7, train_loss: 0.8808, test_loss: 1.0184, test_f1: 0.5657
 epoch: 8, train_loss: 0.8472, test_loss: 0.9880, test_f1: 0.5591
 epoch: 9, train_loss: 0.8399, test_loss: 0.9978, test_f1: 0.5353
 epoch: 10, train_loss: 0.8401, test_loss: 0.9863, test_f1: 0.5293
 epoch: 11, train_loss: 0.8506, test_loss: 1.0160, test_f1: 0.5644
 epoch: 12, train_loss: 0.8147, test_loss: 0.9826, test_f1: 0.5750
 epoch: 13, train_loss: 0.7916, test_loss: 1.0087, test_f1: 0.5826
 epoch: 14, train_loss: 0.7801, test_loss: 0.9966, test_f1: 0.6019
 epoch: 15, train_loss: 0.8048, test_loss: 0.9671, test_f1: 0.5724
 epoch: 16, train_loss: 0.8026, test_loss: 0.9549, test_f1: 0.5668
 epoch: 17, train_loss: 0.7689, test_loss: 0.9810, test_f1: 0.5573
 epoch: 18, train_loss: 0.7593, test_loss: 0.9407, test_f1: 0.6180
 epoch: 19, train_loss: 0.7493, test_loss: 0.9809, test_f1: 0.6250
 epoch: 20, train_loss: 0.7420, test_loss: 0.9729, test_f1: 0.6160
 epoch: 21, train_loss: 0.7320, test_loss: 1.0568, test_f1: 0.6116
 epoch: 22, train_loss: 0.7367, test_loss: 0.9918, test_f1: 0.6083
 epoch: 23, train_loss: 0.7583, test_loss: 0.9726, test_f1: 0.6300
 epoch: 24, train_loss: 0.7225, test_loss: 1.0057, test_f1: 0.6285
 epoch: 25, train_loss: 0.7156, test_loss: 1.0168, test_f1: 0.5908
 epoch: 26, train_loss: 0.7168, test_loss: 0.9809, test_f1: 0.5908
 epoch: 27, train_loss: 0.7010, test_loss: 1.0324, test_f1: 0.5858
 epoch: 28, train_loss: 0.7004, test_loss: 0.9736, test_f1: 0.6126
 epoch: 29, train_loss: 0.7016, test_loss: 0.9758, test_f1: 0.5844
 epoch: 30, train_loss: 0.7043, test_loss: 1.2148, test_f1: 0.5788
 epoch: 31, train_loss: 0.6769, test_loss: 1.0128, test_f1: 0.6350
 epoch: 32, train_loss: 0.6719, test_loss: 1.2140, test_f1: 0.5221
 epoch: 33, train_loss: 0.6818, test_loss: 1.0382, test_f1: 0.6051
 epoch: 34, train_loss: 0.6573, test_loss: 1.0696, test_f1: 0.5974
 epoch: 35, train_loss: 0.6505, test_loss: 1.0725, test_f1: 0.6163
 epoch: 36, train_loss: 0.6574, test_loss: 1.1031, test_f1: 0.5686
 epoch: 37, train_loss: 0.6639, test_loss: 1.1527, test_f1: 0.6172
 epoch: 38, train_loss: 0.6584, test_loss: 1.1028, test_f1: 0.6066
 epoch: 39, train_loss: 0.6583, test_loss: 1.0039, test_f1: 0.6396
 epoch: 40, train_loss: 0.6405, test_loss: 1.1514, test_f1: 0.5988
 epoch: 41, train_loss: 0.6349, test_loss: 1.0918, test_f1: 0.5855
 epoch: 42, train_loss: 0.6230, test_loss: 1.0757, test_f1: 0.5991
 epoch: 43, train_loss: 0.6195, test_loss: 1.2330, test_f1: 0.5993
 epoch: 44, train_loss: 0.6558, test_loss: 1.0771, test_f1: 0.5881
 epoch: 45, train_loss: 0.6194, test_loss: 1.1619, test_f1: 0.5975
 epoch: 46, train_loss: 0.6258, test_loss: 1.1572, test_f1: 0.5778
 epoch: 47, train_loss: 0.6202, test_loss: 1.1531, test_f1: 0.6380
 epoch: 48, train_loss: 0.6013, test_loss: 1.1691, test_f1: 0.6036
 epoch: 49, train_loss: 0.5899, test_loss: 1.2362, test_f1: 0.5588
 epoch: 50, train_loss: 0.6393, test_loss: 1.1865, test_f1: 0.6092
 epoch: 51, train_loss: 0.5808, test_loss: 1.1971, test_f1: 0.6244
 epoch: 52, train_loss: 0.5832, test_loss: 1.2358, test_f1: 0.5646
 epoch: 53, train_loss: 0.5614, test_loss: 1.2311, test_f1: 0.5820
 epoch: 54, train_loss: 0.5565, test_loss: 1.2213, test_f1: 0.5884
 epoch: 55, train_loss: 0.5724, test_loss: 1.1888, test_f1: 0.6158
 epoch: 56, train_loss: 0.5631, test_loss: 1.3143, test_f1: 0.5902
 epoch: 57, train_loss: 0.5591, test_loss: 1.2851, test_f1: 0.5837
 epoch: 58, train_loss: 0.5447, test_loss: 1.3142, test_f1: 0.5618
 epoch: 59, train_loss: 0.5452, test_loss: 1.3416, test_f1: 0.5952
 epoch: 60, train_loss: 0.5446, test_loss: 1.3077, test_f1: 0.6121
 epoch: 61, train_loss: 0.5496, test_loss: 1.2815, test_f1: 0.6135
 epoch: 62, train_loss: 0.5447, test_loss: 1.4384, test_f1: 0.5824
 epoch: 63, train_loss: 0.5342, test_loss: 1.3544, test_f1: 0.6114
 epoch: 64, train_loss: 0.5382, test_loss: 1.2863, test_f1: 0.5968
 epoch: 65, train_loss: 0.5433, test_loss: 1.4572, test_f1: 0.5866
 epoch: 66, train_loss: 0.5230, test_loss: 1.3580, test_f1: 0.6168
 epoch: 67, train_loss: 0.5369, test_loss: 1.4367, test_f1: 0.5871
 epoch: 68, train_loss: 0.5275, test_loss: 1.3797, test_f1: 0.6039
 epoch: 69, train_loss: 0.5051, test_loss: 1.3461, test_f1: 0.6059
 epoch: 70, train_loss: 0.5183, test_loss: 1.3944, test_f1: 0.5916
 epoch: 71, train_loss: 0.5050, test_loss: 1.4835, test_f1: 0.5818
 epoch: 72, train_loss: 0.5094, test_loss: 1.4675, test_f1: 0.5943
 epoch: 73, train_loss: 0.5114, test_loss: 1.4665, test_f1: 0.5892
 epoch: 74, train_loss: 0.4870, test_loss: 1.4731, test_f1: 0.6085
 epoch: 75, train_loss: 0.5120, test_loss: 1.3889, test_f1: 0.6290
 epoch: 76, train_loss: 0.5004, test_loss: 1.4107, test_f1: 0.5964
 epoch: 77, train_loss: 0.5065, test_loss: 1.4225, test_f1: 0.5872
 epoch: 78, train_loss: 0.5048, test_loss: 1.4106, test_f1: 0.5874
 epoch: 79, train_loss: 0.4985, test_loss: 1.4117, test_f1: 0.5944
 epoch: 80, train_loss: 0.5221, test_loss: 1.4846, test_f1: 0.5853
 epoch: 81, train_loss: 0.4976, test_loss: 1.3244, test_f1: 0.5972
 epoch: 82, train_loss: 0.4750, test_loss: 1.3947, test_f1: 0.6140
 epoch: 83, train_loss: 0.4964, test_loss: 1.4570, test_f1: 0.6142
 epoch: 84, train_loss: 0.4680, test_loss: 1.4968, test_f1: 0.6048
 epoch: 85, train_loss: 0.4739, test_loss: 1.5420, test_f1: 0.5947
 epoch: 86, train_loss: 0.4843, test_loss: 1.5123, test_f1: 0.6142
 epoch: 87, train_loss: 0.4674, test_loss: 1.4936, test_f1: 0.6152
 epoch: 88, train_loss: 0.4706, test_loss: 1.5869, test_f1: 0.6206
 epoch: 89, train_loss: 0.4603, test_loss: 1.5952, test_f1: 0.6217
 epoch: 90, train_loss: 0.4740, test_loss: 1.4323, test_f1: 0.5962
 epoch: 91, train_loss: 0.4611, test_loss: 1.5121, test_f1: 0.6273
 epoch: 92, train_loss: 0.4614, test_loss: 1.6146, test_f1: 0.6259
 epoch: 93, train_loss: 0.4817, test_loss: 1.7492, test_f1: 0.5799
 epoch: 94, train_loss: 0.4845, test_loss: 1.4665, test_f1: 0.6422
 epoch: 95, train_loss: 0.4522, test_loss: 1.6311, test_f1: 0.6114
 epoch: 96, train_loss: 0.4593, test_loss: 1.5890, test_f1: 0.6180
 epoch: 97, train_loss: 0.4377, test_loss: 1.6411, test_f1: 0.6009
 epoch: 98, train_loss: 0.4518, test_loss: 1.5584, test_f1: 0.6050
 epoch: 99, train_loss: 0.4626, test_loss: 1.7093, test_f1: 0.5954
##################ITERATION #7 ****************************************
 epoch: 0, train_loss: 1.5463, test_loss: 1.2459, test_f1: 0.3694
 epoch: 1, train_loss: 1.1160, test_loss: 1.1079, test_f1: 0.4925
 epoch: 2, train_loss: 1.0289, test_loss: 1.0440, test_f1: 0.5314
 epoch: 3, train_loss: 0.9848, test_loss: 1.0305, test_f1: 0.5262
 epoch: 4, train_loss: 0.9576, test_loss: 1.0031, test_f1: 0.5526
 epoch: 5, train_loss: 0.9322, test_loss: 0.9934, test_f1: 0.5573
 epoch: 6, train_loss: 0.8710, test_loss: 0.9955, test_f1: 0.5542
 epoch: 7, train_loss: 0.8740, test_loss: 0.9733, test_f1: 0.5735
 epoch: 8, train_loss: 0.8558, test_loss: 0.9847, test_f1: 0.5787
 epoch: 9, train_loss: 0.8309, test_loss: 0.9728, test_f1: 0.5733
 epoch: 10, train_loss: 0.8279, test_loss: 1.0850, test_f1: 0.5094
 epoch: 11, train_loss: 0.8277, test_loss: 1.0428, test_f1: 0.5798
 epoch: 12, train_loss: 0.8123, test_loss: 0.9576, test_f1: 0.5806
 epoch: 13, train_loss: 0.8048, test_loss: 1.0065, test_f1: 0.5583
 epoch: 14, train_loss: 0.7752, test_loss: 1.0064, test_f1: 0.6072
 epoch: 15, train_loss: 0.7643, test_loss: 1.0993, test_f1: 0.6066
 epoch: 16, train_loss: 0.7831, test_loss: 1.0110, test_f1: 0.5694
 epoch: 17, train_loss: 0.7470, test_loss: 1.0398, test_f1: 0.5792
 epoch: 18, train_loss: 0.7584, test_loss: 1.0071, test_f1: 0.6176
 epoch: 19, train_loss: 0.7507, test_loss: 1.0383, test_f1: 0.5946
 epoch: 20, train_loss: 0.7419, test_loss: 1.0185, test_f1: 0.5793
 epoch: 21, train_loss: 0.7058, test_loss: 1.0163, test_f1: 0.6284
 epoch: 22, train_loss: 0.7066, test_loss: 1.0073, test_f1: 0.6145
 epoch: 23, train_loss: 0.6828, test_loss: 1.0064, test_f1: 0.6176
 epoch: 24, train_loss: 0.6755, test_loss: 1.0709, test_f1: 0.5587
 epoch: 25, train_loss: 0.6783, test_loss: 1.1071, test_f1: 0.5007
 epoch: 26, train_loss: 0.6658, test_loss: 1.0637, test_f1: 0.5748
 epoch: 27, train_loss: 0.6525, test_loss: 1.0702, test_f1: 0.6103
 epoch: 28, train_loss: 0.6441, test_loss: 1.0760, test_f1: 0.5682
 epoch: 29, train_loss: 0.6298, test_loss: 1.0850, test_f1: 0.5966
 epoch: 30, train_loss: 0.6341, test_loss: 1.1188, test_f1: 0.6021
 epoch: 31, train_loss: 0.6420, test_loss: 1.0251, test_f1: 0.6108
 epoch: 32, train_loss: 0.6217, test_loss: 1.2428, test_f1: 0.6032
 epoch: 33, train_loss: 0.6120, test_loss: 1.4085, test_f1: 0.5548
 epoch: 34, train_loss: 0.6173, test_loss: 1.1346, test_f1: 0.6224
 epoch: 35, train_loss: 0.6241, test_loss: 1.1078, test_f1: 0.6215
 epoch: 36, train_loss: 0.6053, test_loss: 1.1133, test_f1: 0.6173
 epoch: 37, train_loss: 0.5831, test_loss: 1.1475, test_f1: 0.6308
 epoch: 38, train_loss: 0.5782, test_loss: 1.2724, test_f1: 0.5819
 epoch: 39, train_loss: 0.5792, test_loss: 1.2214, test_f1: 0.5705
 epoch: 40, train_loss: 0.5715, test_loss: 1.2858, test_f1: 0.6160
 epoch: 41, train_loss: 0.5794, test_loss: 1.4449, test_f1: 0.5839
 epoch: 42, train_loss: 0.5574, test_loss: 1.2834, test_f1: 0.5854
 epoch: 43, train_loss: 0.5491, test_loss: 1.2703, test_f1: 0.6047
 epoch: 44, train_loss: 0.5439, test_loss: 1.2511, test_f1: 0.6136
 epoch: 45, train_loss: 0.5723, test_loss: 1.3667, test_f1: 0.5653
 epoch: 46, train_loss: 0.5511, test_loss: 1.5723, test_f1: 0.5730
 epoch: 47, train_loss: 0.5364, test_loss: 1.3163, test_f1: 0.6120
 epoch: 48, train_loss: 0.5143, test_loss: 1.4562, test_f1: 0.5969
 epoch: 49, train_loss: 0.5292, test_loss: 1.4927, test_f1: 0.5824
 epoch: 50, train_loss: 0.5007, test_loss: 1.4640, test_f1: 0.5437
 epoch: 51, train_loss: 0.4800, test_loss: 1.4638, test_f1: 0.5737
 epoch: 52, train_loss: 0.4751, test_loss: 1.5695, test_f1: 0.6118
 epoch: 53, train_loss: 0.4550, test_loss: 1.3760, test_f1: 0.5579
 epoch: 54, train_loss: 0.4675, test_loss: 1.4999, test_f1: 0.5710
 epoch: 55, train_loss: 0.4564, test_loss: 1.4759, test_f1: 0.5821
 epoch: 56, train_loss: 0.4569, test_loss: 1.5409, test_f1: 0.5951
 epoch: 57, train_loss: 0.4542, test_loss: 1.4161, test_f1: 0.5872
 epoch: 58, train_loss: 0.4436, test_loss: 1.6373, test_f1: 0.5767
 epoch: 59, train_loss: 0.4434, test_loss: 1.6040, test_f1: 0.5865
 epoch: 60, train_loss: 0.4608, test_loss: 1.3950, test_f1: 0.6056
 epoch: 61, train_loss: 0.4478, test_loss: 1.6247, test_f1: 0.5753
 epoch: 62, train_loss: 0.4583, test_loss: 1.4961, test_f1: 0.5878
 epoch: 63, train_loss: 0.4323, test_loss: 1.5219, test_f1: 0.5525
 epoch: 64, train_loss: 0.4423, test_loss: 1.7496, test_f1: 0.5745
 epoch: 65, train_loss: 0.4372, test_loss: 1.5475, test_f1: 0.5570
 epoch: 66, train_loss: 0.4228, test_loss: 1.6361, test_f1: 0.5900
 epoch: 67, train_loss: 0.4490, test_loss: 1.6651, test_f1: 0.5429
 epoch: 68, train_loss: 0.4303, test_loss: 1.5970, test_f1: 0.5865
 epoch: 69, train_loss: 0.4146, test_loss: 1.7010, test_f1: 0.5941
 epoch: 70, train_loss: 0.3940, test_loss: 1.7722, test_f1: 0.5726
 epoch: 71, train_loss: 0.4241, test_loss: 1.7113, test_f1: 0.5509
 epoch: 72, train_loss: 0.4210, test_loss: 1.6472, test_f1: 0.5945
 epoch: 73, train_loss: 0.3979, test_loss: 1.5613, test_f1: 0.6182
 epoch: 74, train_loss: 0.4131, test_loss: 1.7924, test_f1: 0.5814
 epoch: 75, train_loss: 0.3965, test_loss: 1.8281, test_f1: 0.5659
 epoch: 76, train_loss: 0.3987, test_loss: 1.7156, test_f1: 0.5836
 epoch: 77, train_loss: 0.4059, test_loss: 1.7600, test_f1: 0.5707
 epoch: 78, train_loss: 0.4068, test_loss: 1.6905, test_f1: 0.6007
 epoch: 79, train_loss: 0.3823, test_loss: 1.9414, test_f1: 0.5535
 epoch: 80, train_loss: 0.3803, test_loss: 1.8817, test_f1: 0.5457
 epoch: 81, train_loss: 0.4114, test_loss: 1.9255, test_f1: 0.5436
 epoch: 82, train_loss: 0.3949, test_loss: 1.8915, test_f1: 0.5300
 epoch: 83, train_loss: 0.3926, test_loss: 2.0362, test_f1: 0.6137
 epoch: 84, train_loss: 0.3593, test_loss: 1.6172, test_f1: 0.5794
 epoch: 85, train_loss: 0.3904, test_loss: 1.7718, test_f1: 0.5699
 epoch: 86, train_loss: 0.3576, test_loss: 1.7973, test_f1: 0.6007
 epoch: 87, train_loss: 0.4069, test_loss: 1.7745, test_f1: 0.5597
 epoch: 88, train_loss: 0.3941, test_loss: 2.0110, test_f1: 0.5773
 epoch: 89, train_loss: 0.3966, test_loss: 1.9453, test_f1: 0.5421
 epoch: 90, train_loss: 0.3465, test_loss: 1.9877, test_f1: 0.5878
 epoch: 91, train_loss: 0.3754, test_loss: 1.8175, test_f1: 0.5441
 epoch: 92, train_loss: 0.3585, test_loss: 2.1476, test_f1: 0.5502
 epoch: 93, train_loss: 0.3344, test_loss: 1.9371, test_f1: 0.5847
 epoch: 94, train_loss: 0.3709, test_loss: 2.2146, test_f1: 0.5635
 epoch: 95, train_loss: 0.3503, test_loss: 1.8001, test_f1: 0.5748
 epoch: 96, train_loss: 0.3375, test_loss: 2.0302, test_f1: 0.5669
 epoch: 97, train_loss: 0.3734, test_loss: 2.1988, test_f1: 0.5626
 epoch: 98, train_loss: 0.3568, test_loss: 2.0185, test_f1: 0.5745
 epoch: 99, train_loss: 0.3618, test_loss: 2.0492, test_f1: 0.5931
##################ITERATION #8 ****************************************
 epoch: 0, train_loss: 1.3099, test_loss: 1.3003, test_f1: 0.3801
 epoch: 1, train_loss: 1.0879, test_loss: 1.2069, test_f1: 0.3865
 epoch: 2, train_loss: 1.0074, test_loss: 1.1655, test_f1: 0.4299
 epoch: 3, train_loss: 0.9757, test_loss: 1.0634, test_f1: 0.4835
 epoch: 4, train_loss: 0.9617, test_loss: 1.0950, test_f1: 0.4731
 epoch: 5, train_loss: 0.9404, test_loss: 1.0168, test_f1: 0.5046
 epoch: 6, train_loss: 0.9053, test_loss: 1.0081, test_f1: 0.5354
 epoch: 7, train_loss: 0.8580, test_loss: 1.0111, test_f1: 0.5425
 epoch: 8, train_loss: 0.8548, test_loss: 1.0619, test_f1: 0.5172
 epoch: 9, train_loss: 0.8218, test_loss: 1.0600, test_f1: 0.5537
 epoch: 10, train_loss: 0.8111, test_loss: 0.9701, test_f1: 0.5528
 epoch: 11, train_loss: 0.8125, test_loss: 0.9538, test_f1: 0.5884
 epoch: 12, train_loss: 0.7871, test_loss: 0.9736, test_f1: 0.5718
 epoch: 13, train_loss: 0.7807, test_loss: 0.9937, test_f1: 0.5817
 epoch: 14, train_loss: 0.7767, test_loss: 1.3309, test_f1: 0.5096
 epoch: 15, train_loss: 0.7585, test_loss: 0.9824, test_f1: 0.6150
 epoch: 16, train_loss: 0.7520, test_loss: 0.9613, test_f1: 0.5978
 epoch: 17, train_loss: 0.7377, test_loss: 1.4686, test_f1: 0.4501
 epoch: 18, train_loss: 0.7252, test_loss: 1.0141, test_f1: 0.6355
 epoch: 19, train_loss: 0.7128, test_loss: 1.0265, test_f1: 0.5366
 epoch: 20, train_loss: 0.7296, test_loss: 0.9928, test_f1: 0.5727
 epoch: 21, train_loss: 0.7270, test_loss: 0.9905, test_f1: 0.5699
 epoch: 22, train_loss: 0.7108, test_loss: 1.0151, test_f1: 0.5695
 epoch: 23, train_loss: 0.6855, test_loss: 0.9874, test_f1: 0.5797
 epoch: 24, train_loss: 0.6879, test_loss: 1.1253, test_f1: 0.5843
 epoch: 25, train_loss: 0.6926, test_loss: 1.0824, test_f1: 0.6340
 epoch: 26, train_loss: 0.6890, test_loss: 1.1706, test_f1: 0.5553
 epoch: 27, train_loss: 0.6972, test_loss: 1.1005, test_f1: 0.5532
 epoch: 28, train_loss: 0.6701, test_loss: 1.1714, test_f1: 0.5713
 epoch: 29, train_loss: 0.6730, test_loss: 1.0563, test_f1: 0.5394
 epoch: 30, train_loss: 0.6530, test_loss: 1.0266, test_f1: 0.5573
 epoch: 31, train_loss: 0.6541, test_loss: 1.0832, test_f1: 0.5786
 epoch: 32, train_loss: 0.6461, test_loss: 1.0787, test_f1: 0.5872
 epoch: 33, train_loss: 0.6704, test_loss: 1.0479, test_f1: 0.5658
 epoch: 34, train_loss: 0.6349, test_loss: 1.0669, test_f1: 0.5776
 epoch: 35, train_loss: 0.6353, test_loss: 1.0436, test_f1: 0.5903
 epoch: 36, train_loss: 0.6295, test_loss: 1.0782, test_f1: 0.5582
 epoch: 37, train_loss: 0.6036, test_loss: 1.1457, test_f1: 0.5281
 epoch: 38, train_loss: 0.6303, test_loss: 1.0437, test_f1: 0.6252
 epoch: 39, train_loss: 0.5903, test_loss: 1.1777, test_f1: 0.5871
 epoch: 40, train_loss: 0.6138, test_loss: 1.1279, test_f1: 0.6161
 epoch: 41, train_loss: 0.6030, test_loss: 1.0838, test_f1: 0.5954
 epoch: 42, train_loss: 0.5982, test_loss: 1.3605, test_f1: 0.5746
 epoch: 43, train_loss: 0.5928, test_loss: 1.1851, test_f1: 0.5757
 epoch: 44, train_loss: 0.5795, test_loss: 1.2081, test_f1: 0.5947
 epoch: 45, train_loss: 0.5802, test_loss: 1.1932, test_f1: 0.6103
 epoch: 46, train_loss: 0.5744, test_loss: 1.2791, test_f1: 0.6014
 epoch: 47, train_loss: 0.5765, test_loss: 1.2497, test_f1: 0.5777
 epoch: 48, train_loss: 0.5714, test_loss: 1.1652, test_f1: 0.6336
 epoch: 49, train_loss: 0.5737, test_loss: 1.2288, test_f1: 0.5781
 epoch: 50, train_loss: 0.5439, test_loss: 1.1868, test_f1: 0.6042
 epoch: 51, train_loss: 0.5447, test_loss: 1.1412, test_f1: 0.5866
 epoch: 52, train_loss: 0.5149, test_loss: 1.1486, test_f1: 0.6342
 epoch: 53, train_loss: 0.5148, test_loss: 1.1585, test_f1: 0.6148
 epoch: 54, train_loss: 0.5169, test_loss: 1.2049, test_f1: 0.6012
 epoch: 55, train_loss: 0.4899, test_loss: 1.1805, test_f1: 0.5839
 epoch: 56, train_loss: 0.4976, test_loss: 1.1897, test_f1: 0.6232
 epoch: 57, train_loss: 0.4865, test_loss: 1.2581, test_f1: 0.5930
 epoch: 58, train_loss: 0.4857, test_loss: 1.2679, test_f1: 0.6254
 epoch: 59, train_loss: 0.5192, test_loss: 1.2030, test_f1: 0.6172
 epoch: 60, train_loss: 0.4960, test_loss: 1.2360, test_f1: 0.6059
 epoch: 61, train_loss: 0.4902, test_loss: 1.3082, test_f1: 0.6055
 epoch: 62, train_loss: 0.4990, test_loss: 1.2842, test_f1: 0.5780
 epoch: 63, train_loss: 0.5068, test_loss: 1.3139, test_f1: 0.6137
 epoch: 64, train_loss: 0.4926, test_loss: 1.2355, test_f1: 0.6206
 epoch: 65, train_loss: 0.4899, test_loss: 1.2548, test_f1: 0.5715
 epoch: 66, train_loss: 0.4787, test_loss: 1.1836, test_f1: 0.6054
 epoch: 67, train_loss: 0.4790, test_loss: 1.2755, test_f1: 0.5819
 epoch: 68, train_loss: 0.4737, test_loss: 1.3712, test_f1: 0.5944
 epoch: 69, train_loss: 0.4790, test_loss: 1.3222, test_f1: 0.6095
 epoch: 70, train_loss: 0.4641, test_loss: 1.2841, test_f1: 0.5855
 epoch: 71, train_loss: 0.4839, test_loss: 1.3401, test_f1: 0.6047
 epoch: 72, train_loss: 0.4831, test_loss: 1.3359, test_f1: 0.6020
 epoch: 73, train_loss: 0.4555, test_loss: 1.2768, test_f1: 0.5987
 epoch: 74, train_loss: 0.4618, test_loss: 1.3411, test_f1: 0.5837
 epoch: 75, train_loss: 0.4470, test_loss: 1.3221, test_f1: 0.5883
 epoch: 76, train_loss: 0.4575, test_loss: 1.3651, test_f1: 0.5941
 epoch: 77, train_loss: 0.4604, test_loss: 1.2709, test_f1: 0.5986
 epoch: 78, train_loss: 0.4517, test_loss: 1.3662, test_f1: 0.5793
 epoch: 79, train_loss: 0.4668, test_loss: 1.3625, test_f1: 0.5968
 epoch: 80, train_loss: 0.4745, test_loss: 1.3052, test_f1: 0.5945
 epoch: 81, train_loss: 0.4533, test_loss: 1.3008, test_f1: 0.6288
 epoch: 82, train_loss: 0.4447, test_loss: 1.3516, test_f1: 0.5985
 epoch: 83, train_loss: 0.4417, test_loss: 1.4407, test_f1: 0.5880
 epoch: 84, train_loss: 0.4265, test_loss: 1.4171, test_f1: 0.6038
 epoch: 85, train_loss: 0.4336, test_loss: 1.5832, test_f1: 0.5752
 epoch: 86, train_loss: 0.4261, test_loss: 1.5347, test_f1: 0.6139
 epoch: 87, train_loss: 0.4258, test_loss: 1.4675, test_f1: 0.6111
 epoch: 88, train_loss: 0.4532, test_loss: 1.2992, test_f1: 0.6094
 epoch: 89, train_loss: 0.4433, test_loss: 1.4332, test_f1: 0.6250
 epoch: 90, train_loss: 0.4008, test_loss: 1.3404, test_f1: 0.6061
 epoch: 91, train_loss: 0.4316, test_loss: 1.4486, test_f1: 0.6203
 epoch: 92, train_loss: 0.4065, test_loss: 1.4286, test_f1: 0.6045
 epoch: 93, train_loss: 0.4246, test_loss: 1.3318, test_f1: 0.6198
 epoch: 94, train_loss: 0.4303, test_loss: 1.4928, test_f1: 0.5981
 epoch: 95, train_loss: 0.4014, test_loss: 1.5125, test_f1: 0.5766
 epoch: 96, train_loss: 0.4316, test_loss: 1.4268, test_f1: 0.6119
 epoch: 97, train_loss: 0.4315, test_loss: 1.4303, test_f1: 0.5998
 epoch: 98, train_loss: 0.4142, test_loss: 1.5285, test_f1: 0.6072
 epoch: 99, train_loss: 0.4127, test_loss: 1.5330, test_f1: 0.6012
##################ITERATION #9 ****************************************
 epoch: 0, train_loss: 1.5594, test_loss: 1.3203, test_f1: 0.3399
 epoch: 1, train_loss: 1.0862, test_loss: 1.1481, test_f1: 0.4949
 epoch: 2, train_loss: 1.0313, test_loss: 1.1404, test_f1: 0.4608
 epoch: 3, train_loss: 0.9361, test_loss: 1.1095, test_f1: 0.5175
 epoch: 4, train_loss: 0.9404, test_loss: 1.0718, test_f1: 0.5362
 epoch: 5, train_loss: 0.8795, test_loss: 1.0370, test_f1: 0.5394
 epoch: 6, train_loss: 0.8696, test_loss: 1.0768, test_f1: 0.5233
 epoch: 7, train_loss: 0.8399, test_loss: 1.1134, test_f1: 0.5125
 epoch: 8, train_loss: 0.8325, test_loss: 1.0463, test_f1: 0.5308
 epoch: 9, train_loss: 0.8177, test_loss: 1.0307, test_f1: 0.5379
 epoch: 10, train_loss: 0.8111, test_loss: 1.0180, test_f1: 0.5358
 epoch: 11, train_loss: 0.7928, test_loss: 1.0973, test_f1: 0.5448
 epoch: 12, train_loss: 0.7783, test_loss: 1.0580, test_f1: 0.5548
 epoch: 13, train_loss: 0.7813, test_loss: 1.0186, test_f1: 0.5730
 epoch: 14, train_loss: 0.7569, test_loss: 1.0060, test_f1: 0.5612
 epoch: 15, train_loss: 0.7509, test_loss: 1.0016, test_f1: 0.5306
 epoch: 16, train_loss: 0.7416, test_loss: 0.9676, test_f1: 0.5887
 epoch: 17, train_loss: 0.7360, test_loss: 0.9941, test_f1: 0.5681
 epoch: 18, train_loss: 0.7349, test_loss: 1.0029, test_f1: 0.5655
 epoch: 19, train_loss: 0.7346, test_loss: 1.0016, test_f1: 0.5700
 epoch: 20, train_loss: 0.7053, test_loss: 1.0062, test_f1: 0.5635
 epoch: 21, train_loss: 0.7110, test_loss: 0.9779, test_f1: 0.5920
 epoch: 22, train_loss: 0.7194, test_loss: 0.9771, test_f1: 0.5910
 epoch: 23, train_loss: 0.6819, test_loss: 1.0548, test_f1: 0.5711
 epoch: 24, train_loss: 0.6913, test_loss: 1.0458, test_f1: 0.5663
 epoch: 25, train_loss: 0.6714, test_loss: 1.0602, test_f1: 0.5305
 epoch: 26, train_loss: 0.6909, test_loss: 0.9814, test_f1: 0.5866
 epoch: 27, train_loss: 0.6775, test_loss: 0.9483, test_f1: 0.5810
 epoch: 28, train_loss: 0.6936, test_loss: 1.0008, test_f1: 0.5669
 epoch: 29, train_loss: 0.6614, test_loss: 1.0692, test_f1: 0.5510
 epoch: 30, train_loss: 0.6789, test_loss: 1.0551, test_f1: 0.5442
 epoch: 31, train_loss: 0.6805, test_loss: 1.0845, test_f1: 0.5386
 epoch: 32, train_loss: 0.6568, test_loss: 1.0015, test_f1: 0.6022
 epoch: 33, train_loss: 0.6311, test_loss: 1.0107, test_f1: 0.5611
 epoch: 34, train_loss: 0.6375, test_loss: 1.2870, test_f1: 0.5311
 epoch: 35, train_loss: 0.6500, test_loss: 1.0303, test_f1: 0.5841
 epoch: 36, train_loss: 0.6353, test_loss: 1.2552, test_f1: 0.5532
 epoch: 37, train_loss: 0.6366, test_loss: 1.1078, test_f1: 0.5152
 epoch: 38, train_loss: 0.6024, test_loss: 0.9865, test_f1: 0.5875
 epoch: 39, train_loss: 0.6066, test_loss: 1.1168, test_f1: 0.5399
 epoch: 40, train_loss: 0.6044, test_loss: 1.0949, test_f1: 0.5357
 epoch: 41, train_loss: 0.6353, test_loss: 1.0817, test_f1: 0.5749
 epoch: 42, train_loss: 0.6053, test_loss: 1.3313, test_f1: 0.5199
 epoch: 43, train_loss: 0.6032, test_loss: 1.1752, test_f1: 0.5312
 epoch: 44, train_loss: 0.6015, test_loss: 1.1042, test_f1: 0.5680
 epoch: 45, train_loss: 0.5833, test_loss: 1.2502, test_f1: 0.5055
 epoch: 46, train_loss: 0.5778, test_loss: 1.1169, test_f1: 0.5546
 epoch: 47, train_loss: 0.5687, test_loss: 1.1990, test_f1: 0.5064
 epoch: 48, train_loss: 0.5499, test_loss: 1.0295, test_f1: 0.5732
 epoch: 49, train_loss: 0.5619, test_loss: 1.0970, test_f1: 0.5960
 epoch: 50, train_loss: 0.5617, test_loss: 1.1063, test_f1: 0.5581
 epoch: 51, train_loss: 0.5346, test_loss: 1.1239, test_f1: 0.5423
 epoch: 52, train_loss: 0.5261, test_loss: 1.1448, test_f1: 0.5579
 epoch: 53, train_loss: 0.5239, test_loss: 1.0978, test_f1: 0.5628
 epoch: 54, train_loss: 0.5265, test_loss: 1.1182, test_f1: 0.5772
 epoch: 55, train_loss: 0.5039, test_loss: 1.2013, test_f1: 0.5461
 epoch: 56, train_loss: 0.5170, test_loss: 1.1085, test_f1: 0.5654
 epoch: 57, train_loss: 0.5129, test_loss: 1.1022, test_f1: 0.5628
 epoch: 58, train_loss: 0.4899, test_loss: 1.1522, test_f1: 0.5714
 epoch: 59, train_loss: 0.4946, test_loss: 1.1819, test_f1: 0.5619
 epoch: 60, train_loss: 0.5036, test_loss: 1.2599, test_f1: 0.5452
 epoch: 61, train_loss: 0.4857, test_loss: 1.2283, test_f1: 0.5544
 epoch: 62, train_loss: 0.4810, test_loss: 1.3098, test_f1: 0.5705
 epoch: 63, train_loss: 0.4689, test_loss: 1.4013, test_f1: 0.5659
 epoch: 64, train_loss: 0.4998, test_loss: 1.2393, test_f1: 0.5784
 epoch: 65, train_loss: 0.4685, test_loss: 1.2482, test_f1: 0.5517
 epoch: 66, train_loss: 0.4650, test_loss: 1.3069, test_f1: 0.5498
 epoch: 67, train_loss: 0.4590, test_loss: 1.2573, test_f1: 0.5626
 epoch: 68, train_loss: 0.4655, test_loss: 1.3532, test_f1: 0.5665
 epoch: 69, train_loss: 0.4567, test_loss: 1.2416, test_f1: 0.5447
 epoch: 70, train_loss: 0.4378, test_loss: 1.2833, test_f1: 0.5362
 epoch: 71, train_loss: 0.4781, test_loss: 1.3215, test_f1: 0.5750
 epoch: 72, train_loss: 0.4428, test_loss: 1.3933, test_f1: 0.5759
 epoch: 73, train_loss: 0.4899, test_loss: 1.3829, test_f1: 0.5907
 epoch: 74, train_loss: 0.4519, test_loss: 1.2901, test_f1: 0.5669
 epoch: 75, train_loss: 0.4689, test_loss: 1.4342, test_f1: 0.5987
 epoch: 76, train_loss: 0.4390, test_loss: 1.3852, test_f1: 0.5379
 epoch: 77, train_loss: 0.4872, test_loss: 1.5543, test_f1: 0.5616
 epoch: 78, train_loss: 0.4552, test_loss: 1.3495, test_f1: 0.5473
 epoch: 79, train_loss: 0.4556, test_loss: 1.3232, test_f1: 0.5687
 epoch: 80, train_loss: 0.4145, test_loss: 1.5294, test_f1: 0.5740
 epoch: 81, train_loss: 0.4156, test_loss: 1.5314, test_f1: 0.5704
 epoch: 82, train_loss: 0.4619, test_loss: 1.4132, test_f1: 0.5275
 epoch: 83, train_loss: 0.4537, test_loss: 1.3533, test_f1: 0.5712
 epoch: 84, train_loss: 0.4367, test_loss: 1.5363, test_f1: 0.5757
 epoch: 85, train_loss: 0.4616, test_loss: 1.2825, test_f1: 0.5824
 epoch: 86, train_loss: 0.4277, test_loss: 1.4674, test_f1: 0.5804
 epoch: 87, train_loss: 0.4173, test_loss: 1.4528, test_f1: 0.5615
 epoch: 88, train_loss: 0.4063, test_loss: 1.4111, test_f1: 0.5727
 epoch: 89, train_loss: 0.4331, test_loss: 1.4308, test_f1: 0.5843
 epoch: 90, train_loss: 0.4392, test_loss: 1.4007, test_f1: 0.6115
 epoch: 91, train_loss: 0.4338, test_loss: 1.4785, test_f1: 0.5902
 epoch: 92, train_loss: 0.4217, test_loss: 1.4304, test_f1: 0.5597
 epoch: 93, train_loss: 0.4060, test_loss: 1.4222, test_f1: 0.6026
 epoch: 94, train_loss: 0.4195, test_loss: 1.5282, test_f1: 0.5691
 epoch: 95, train_loss: 0.4012, test_loss: 1.5193, test_f1: 0.5723
 epoch: 96, train_loss: 0.4091, test_loss: 1.5916, test_f1: 0.5491
 epoch: 97, train_loss: 0.4252, test_loss: 1.4773, test_f1: 0.5886
 epoch: 98, train_loss: 0.3945, test_loss: 1.6425, test_f1: 0.5742
 epoch: 99, train_loss: 0.4010, test_loss: 1.5918, test_f1: 0.5964

Training completed in 500.25 seconds
Best F1: 0.6782 at epoch 83
Mean F1 across iterations: 0.6512  0.0199
========================FINAL RESULTS================================
FEGIN weighted F1: 0.6782  0.0199
python main.py --data ltspice_demos --representation component_pin --model FEGIN --layers 2 --hiddens 32 --batch_size 32 --lr 0.001 --emb_size 512 --epochs 100 --save_appendix component_pin_L2_H32_BS32_LR0.001_E512 --no_val
-----



STDERR:
  File "main.py", line 370, in <module>
    main()
  File "main.py", line 254, in main
    dataset = dataset_class(
  File "/home/philip/projects/ltspice_examples_code_repo/Circuit-Completion-Using-GNNs/component_classification_with_link_prediction_head/evaluation/FEGIN/kernel/circuit_datasets.py", line 15, in __init__
    self.data, self.slices = torch.load(self.processed_paths[0])
  File "/home/philip/.local/lib/python3.8/site-packages/torch/serialization.py", line 1040, in load
    warnings.warn(
  File "/usr/lib/python3.8/warnings.py", line 109, in _showwarnmsg
    sw(msg.message, msg.category, msg.filename, msg.lineno,
  File "main.py", line 47, in warn_with_traceback
    traceback.print_stack(file=log)
/home/philip/projects/ltspice_examples_code_repo/Circuit-Completion-Using-GNNs/component_classification_with_link_prediction_head/evaluation/FEGIN/kernel/circuit_datasets.py:15: FutureWarning: You are using `torch.load` with `weights_only=False` (the current default value), which uses the default pickle module implicitly. It is possible to construct malicious pickle data which will execute arbitrary code during unpickling (See https://github.com/pytorch/pytorch/blob/main/SECURITY.md#untrusted-models for more details). In a future release, the default value for `weights_only` will be flipped to `True`. This limits the functions that could be executed during unpickling. Arbitrary objects will no longer be allowed to be loaded via this mode unless they are explicitly allowlisted by the user via `torch.serialization.add_safe_globals`. We recommend you start setting `weights_only=True` for any use case where you don't have full control of the loaded file. Please open an issue on GitHub for any issues related to this experimental feature.
  self.data, self.slices = torch.load(self.processed_paths[0])
