STDOUT:
Results will be saved in /home/philip/projects/ltspice_examples_code_repo/Circuit-Completion-Using-GNNs/component_classification_with_link_prediction_head/evaluation/FEGIN/results/model_FEGIN_dataset_ltspice_demos
Command line input: python main.py --data ltspice_demos --representation component_pin --model FEGIN --layers 6 --hiddens 64 --batch_size 256 --lr 0.001 --emb_size 128 --epochs 100 --save_appendix component_pin_L6_H64_BS256_LR0.001_E128 --no_val
 is saved.
-----
ltspice_demos - FEGIN
Using 6 layers, 64 hidden units, h = 2
Loading component_pin representation dataset
ENTERED
Training FEGIN on component_pin representation
Train: 1565, Test: 383
##################ITERATION #0 ****************************************
 epoch: 0, train_loss: 1.3756, test_loss: 1.3743, test_f1: 0.1365
 epoch: 1, train_loss: 1.3197, test_loss: 1.3504, test_f1: 0.3091
 epoch: 2, train_loss: 1.2651, test_loss: 1.3226, test_f1: 0.2849
 epoch: 3, train_loss: 1.2144, test_loss: 1.3029, test_f1: 0.3001
 epoch: 4, train_loss: 1.1794, test_loss: 1.2882, test_f1: 0.3403
 epoch: 5, train_loss: 1.1616, test_loss: 1.2732, test_f1: 0.3347
 epoch: 6, train_loss: 1.1509, test_loss: 1.2614, test_f1: 0.3179
 epoch: 7, train_loss: 1.1322, test_loss: 1.2562, test_f1: 0.3526
 epoch: 8, train_loss: 1.1168, test_loss: 1.2453, test_f1: 0.3821
 epoch: 9, train_loss: 1.0974, test_loss: 1.2040, test_f1: 0.4057
 epoch: 10, train_loss: 1.0846, test_loss: 1.1838, test_f1: 0.4467
 epoch: 11, train_loss: 1.0488, test_loss: 1.1679, test_f1: 0.4328
 epoch: 12, train_loss: 1.0227, test_loss: 1.1132, test_f1: 0.4303
 epoch: 13, train_loss: 0.9818, test_loss: 1.0950, test_f1: 0.4403
 epoch: 14, train_loss: 0.9320, test_loss: 1.0729, test_f1: 0.4893
 epoch: 15, train_loss: 0.9313, test_loss: 1.1194, test_f1: 0.5075
 epoch: 16, train_loss: 0.8893, test_loss: 1.1020, test_f1: 0.5543
 epoch: 17, train_loss: 0.8607, test_loss: 1.0939, test_f1: 0.4779
 epoch: 18, train_loss: 0.8445, test_loss: 1.1309, test_f1: 0.4962
 epoch: 19, train_loss: 0.8362, test_loss: 1.1019, test_f1: 0.5642
 epoch: 20, train_loss: 0.8100, test_loss: 1.0724, test_f1: 0.5872
 epoch: 21, train_loss: 0.8017, test_loss: 1.0802, test_f1: 0.5349
 epoch: 22, train_loss: 0.8049, test_loss: 1.0930, test_f1: 0.5697
 epoch: 23, train_loss: 0.8080, test_loss: 1.0702, test_f1: 0.5382
 epoch: 24, train_loss: 0.7844, test_loss: 1.0266, test_f1: 0.5904
 epoch: 25, train_loss: 0.7642, test_loss: 1.5496, test_f1: 0.4252
 epoch: 26, train_loss: 0.7424, test_loss: 1.0618, test_f1: 0.5348
 epoch: 27, train_loss: 0.7480, test_loss: 1.1442, test_f1: 0.4870
 epoch: 28, train_loss: 0.7394, test_loss: 1.2043, test_f1: 0.4799
 epoch: 29, train_loss: 0.7278, test_loss: 1.0386, test_f1: 0.5382
 epoch: 30, train_loss: 0.7478, test_loss: 1.7461, test_f1: 0.3828
 epoch: 31, train_loss: 0.7376, test_loss: 1.0171, test_f1: 0.6003
 epoch: 32, train_loss: 0.7072, test_loss: 1.0643, test_f1: 0.5461
 epoch: 33, train_loss: 0.6915, test_loss: 1.0685, test_f1: 0.5203
 epoch: 34, train_loss: 0.6896, test_loss: 0.9825, test_f1: 0.6122
 epoch: 35, train_loss: 0.7314, test_loss: 1.0802, test_f1: 0.5422
 epoch: 36, train_loss: 0.7027, test_loss: 1.0416, test_f1: 0.5077
 epoch: 37, train_loss: 0.6715, test_loss: 1.0969, test_f1: 0.6021
 epoch: 38, train_loss: 0.6828, test_loss: 1.1866, test_f1: 0.5340
 epoch: 39, train_loss: 0.6689, test_loss: 1.2928, test_f1: 0.4737
 epoch: 40, train_loss: 0.6625, test_loss: 1.1383, test_f1: 0.5283
 epoch: 41, train_loss: 0.6420, test_loss: 1.1486, test_f1: 0.5242
 epoch: 42, train_loss: 0.6181, test_loss: 1.1423, test_f1: 0.5333
 epoch: 43, train_loss: 0.6050, test_loss: 1.1053, test_f1: 0.5305
 epoch: 44, train_loss: 0.5914, test_loss: 1.0985, test_f1: 0.5417
 epoch: 45, train_loss: 0.5786, test_loss: 1.1618, test_f1: 0.5887
 epoch: 46, train_loss: 0.5749, test_loss: 1.1211, test_f1: 0.5498
 epoch: 47, train_loss: 0.6186, test_loss: 1.1457, test_f1: 0.5573
 epoch: 48, train_loss: 0.6100, test_loss: 1.1275, test_f1: 0.5870
 epoch: 49, train_loss: 0.5880, test_loss: 1.1125, test_f1: 0.5535
 epoch: 50, train_loss: 0.5710, test_loss: 1.0983, test_f1: 0.5498
 epoch: 51, train_loss: 0.5798, test_loss: 1.1502, test_f1: 0.5268
 epoch: 52, train_loss: 0.5459, test_loss: 1.0926, test_f1: 0.5838
 epoch: 53, train_loss: 0.5374, test_loss: 1.1128, test_f1: 0.6008
 epoch: 54, train_loss: 0.5431, test_loss: 1.1531, test_f1: 0.5844
 epoch: 55, train_loss: 0.5315, test_loss: 1.1868, test_f1: 0.5763
 epoch: 56, train_loss: 0.5084, test_loss: 1.1332, test_f1: 0.5954
 epoch: 57, train_loss: 0.5007, test_loss: 1.1520, test_f1: 0.5928
 epoch: 58, train_loss: 0.4987, test_loss: 1.1314, test_f1: 0.5986
 epoch: 59, train_loss: 0.5143, test_loss: 1.2615, test_f1: 0.5542
 epoch: 60, train_loss: 0.5034, test_loss: 1.2000, test_f1: 0.5714
 epoch: 61, train_loss: 0.4972, test_loss: 1.1909, test_f1: 0.5456
 epoch: 62, train_loss: 0.4796, test_loss: 1.1817, test_f1: 0.6141
 epoch: 63, train_loss: 0.4743, test_loss: 1.2076, test_f1: 0.5760
 epoch: 64, train_loss: 0.4756, test_loss: 1.2536, test_f1: 0.5456
 epoch: 65, train_loss: 0.4627, test_loss: 1.2503, test_f1: 0.5603
 epoch: 66, train_loss: 0.4616, test_loss: 1.2534, test_f1: 0.5694
 epoch: 67, train_loss: 0.4491, test_loss: 1.2219, test_f1: 0.5863
 epoch: 68, train_loss: 0.4536, test_loss: 1.2424, test_f1: 0.6045
 epoch: 69, train_loss: 0.4467, test_loss: 1.2496, test_f1: 0.5673
 epoch: 70, train_loss: 0.4552, test_loss: 1.3098, test_f1: 0.5902
 epoch: 71, train_loss: 0.4368, test_loss: 1.2899, test_f1: 0.5685
 epoch: 72, train_loss: 0.4483, test_loss: 1.3651, test_f1: 0.5536
 epoch: 73, train_loss: 0.4303, test_loss: 1.4258, test_f1: 0.5402
 epoch: 74, train_loss: 0.4472, test_loss: 1.3507, test_f1: 0.5612
 epoch: 75, train_loss: 0.4313, test_loss: 1.4667, test_f1: 0.5236
 epoch: 76, train_loss: 0.4218, test_loss: 1.3686, test_f1: 0.5691
 epoch: 77, train_loss: 0.4046, test_loss: 1.4189, test_f1: 0.5617
 epoch: 78, train_loss: 0.3899, test_loss: 1.2887, test_f1: 0.5607
 epoch: 79, train_loss: 0.4036, test_loss: 1.3523, test_f1: 0.5665
 epoch: 80, train_loss: 0.3789, test_loss: 1.4169, test_f1: 0.5599
 epoch: 81, train_loss: 0.3754, test_loss: 1.3588, test_f1: 0.5653
 epoch: 82, train_loss: 0.3647, test_loss: 1.4564, test_f1: 0.5622
 epoch: 83, train_loss: 0.3617, test_loss: 1.4878, test_f1: 0.5652
 epoch: 84, train_loss: 0.3560, test_loss: 1.4068, test_f1: 0.6153
 epoch: 85, train_loss: 0.3713, test_loss: 1.4461, test_f1: 0.5896
 epoch: 86, train_loss: 0.3723, test_loss: 1.4943, test_f1: 0.5835
 epoch: 87, train_loss: 0.3479, test_loss: 1.4753, test_f1: 0.5540
 epoch: 88, train_loss: 0.3642, test_loss: 1.4887, test_f1: 0.5727
 epoch: 89, train_loss: 0.4223, test_loss: 1.3358, test_f1: 0.5925
 epoch: 90, train_loss: 0.3888, test_loss: 1.5713, test_f1: 0.5170
 epoch: 91, train_loss: 0.4071, test_loss: 1.3796, test_f1: 0.6023
 epoch: 92, train_loss: 0.3839, test_loss: 1.5273, test_f1: 0.5091
 epoch: 93, train_loss: 0.3342, test_loss: 1.5716, test_f1: 0.5123
 epoch: 94, train_loss: 0.3386, test_loss: 1.5077, test_f1: 0.5543
 epoch: 95, train_loss: 0.3244, test_loss: 1.4183, test_f1: 0.5772
 epoch: 96, train_loss: 0.3387, test_loss: 1.4979, test_f1: 0.5676
 epoch: 97, train_loss: 0.3698, test_loss: 1.5821, test_f1: 0.5459
 epoch: 98, train_loss: 0.3681, test_loss: 1.4045, test_f1: 0.5794
 epoch: 99, train_loss: 0.3569, test_loss: 1.4641, test_f1: 0.5814
##################ITERATION #1 ****************************************
 epoch: 0, train_loss: 1.3058, test_loss: 1.3256, test_f1: 0.1365
 epoch: 1, train_loss: 1.1874, test_loss: 1.3051, test_f1: 0.3246
 epoch: 2, train_loss: 1.1297, test_loss: 1.3075, test_f1: 0.3048
 epoch: 3, train_loss: 1.0838, test_loss: 1.3114, test_f1: 0.2869
 epoch: 4, train_loss: 1.0359, test_loss: 1.3164, test_f1: 0.3302
 epoch: 5, train_loss: 0.9880, test_loss: 1.2601, test_f1: 0.3493
 epoch: 6, train_loss: 0.9462, test_loss: 1.1748, test_f1: 0.4383
 epoch: 7, train_loss: 0.9010, test_loss: 1.0870, test_f1: 0.5161
 epoch: 8, train_loss: 0.8923, test_loss: 1.0770, test_f1: 0.5304
 epoch: 9, train_loss: 0.8632, test_loss: 1.0355, test_f1: 0.5565
 epoch: 10, train_loss: 0.8383, test_loss: 1.0063, test_f1: 0.5835
 epoch: 11, train_loss: 0.8269, test_loss: 1.0074, test_f1: 0.5509
 epoch: 12, train_loss: 0.8049, test_loss: 1.0463, test_f1: 0.5665
 epoch: 13, train_loss: 0.8105, test_loss: 1.0614, test_f1: 0.5554
 epoch: 14, train_loss: 0.8041, test_loss: 0.9943, test_f1: 0.5823
 epoch: 15, train_loss: 0.7797, test_loss: 1.0244, test_f1: 0.5713
 epoch: 16, train_loss: 0.7699, test_loss: 0.9800, test_f1: 0.5884
 epoch: 17, train_loss: 0.7299, test_loss: 1.0001, test_f1: 0.5615
 epoch: 18, train_loss: 0.7219, test_loss: 1.0709, test_f1: 0.5277
 epoch: 19, train_loss: 0.7138, test_loss: 1.0631, test_f1: 0.5450
 epoch: 20, train_loss: 0.6920, test_loss: 1.0560, test_f1: 0.5605
 epoch: 21, train_loss: 0.6980, test_loss: 1.0612, test_f1: 0.5839
 epoch: 22, train_loss: 0.6681, test_loss: 1.0529, test_f1: 0.5771
 epoch: 23, train_loss: 0.6626, test_loss: 1.0778, test_f1: 0.5470
 epoch: 24, train_loss: 0.6669, test_loss: 1.1258, test_f1: 0.5316
 epoch: 25, train_loss: 0.6596, test_loss: 1.1842, test_f1: 0.5173
 epoch: 26, train_loss: 0.6575, test_loss: 1.1177, test_f1: 0.5462
 epoch: 27, train_loss: 0.6495, test_loss: 1.1264, test_f1: 0.5809
 epoch: 28, train_loss: 0.6427, test_loss: 1.1524, test_f1: 0.5750
 epoch: 29, train_loss: 0.6324, test_loss: 1.2422, test_f1: 0.5458
 epoch: 30, train_loss: 0.6206, test_loss: 1.2719, test_f1: 0.5334
 epoch: 31, train_loss: 0.6051, test_loss: 1.1774, test_f1: 0.5516
 epoch: 32, train_loss: 0.6023, test_loss: 1.1175, test_f1: 0.5675
 epoch: 33, train_loss: 0.6208, test_loss: 1.1833, test_f1: 0.5423
 epoch: 34, train_loss: 0.6038, test_loss: 1.1297, test_f1: 0.5942
 epoch: 35, train_loss: 0.5870, test_loss: 1.1266, test_f1: 0.5634
 epoch: 36, train_loss: 0.5779, test_loss: 1.2042, test_f1: 0.5728
 epoch: 37, train_loss: 0.5744, test_loss: 1.2334, test_f1: 0.5772
 epoch: 38, train_loss: 0.5777, test_loss: 1.2490, test_f1: 0.5642
 epoch: 39, train_loss: 0.5848, test_loss: 1.2533, test_f1: 0.5479
 epoch: 40, train_loss: 0.6148, test_loss: 1.3034, test_f1: 0.5120
 epoch: 41, train_loss: 0.5945, test_loss: 1.5085, test_f1: 0.4919
 epoch: 42, train_loss: 0.5735, test_loss: 1.4560, test_f1: 0.4872
 epoch: 43, train_loss: 0.5770, test_loss: 1.4560, test_f1: 0.5141
 epoch: 44, train_loss: 0.5571, test_loss: 1.3387, test_f1: 0.5175
 epoch: 45, train_loss: 0.5586, test_loss: 1.2828, test_f1: 0.5501
 epoch: 46, train_loss: 0.5390, test_loss: 1.3595, test_f1: 0.5761
 epoch: 47, train_loss: 0.5163, test_loss: 1.3521, test_f1: 0.5820
 epoch: 48, train_loss: 0.5053, test_loss: 1.4375, test_f1: 0.5446
 epoch: 49, train_loss: 0.5546, test_loss: 1.6944, test_f1: 0.4789
 epoch: 50, train_loss: 0.6004, test_loss: 1.4616, test_f1: 0.5507
 epoch: 51, train_loss: 0.5883, test_loss: 1.4296, test_f1: 0.5728
 epoch: 52, train_loss: 0.5362, test_loss: 1.4355, test_f1: 0.5553
 epoch: 53, train_loss: 0.5363, test_loss: 1.3606, test_f1: 0.5174
 epoch: 54, train_loss: 0.5119, test_loss: 1.4367, test_f1: 0.5233
 epoch: 55, train_loss: 0.5078, test_loss: 1.4554, test_f1: 0.5405
 epoch: 56, train_loss: 0.4998, test_loss: 1.4687, test_f1: 0.5203
 epoch: 57, train_loss: 0.4855, test_loss: 1.5442, test_f1: 0.5242
 epoch: 58, train_loss: 0.4746, test_loss: 1.5935, test_f1: 0.5196
 epoch: 59, train_loss: 0.4881, test_loss: 1.5511, test_f1: 0.5351
 epoch: 60, train_loss: 0.5019, test_loss: 1.5978, test_f1: 0.5539
 epoch: 61, train_loss: 0.4665, test_loss: 1.6680, test_f1: 0.5484
 epoch: 62, train_loss: 0.4560, test_loss: 1.6459, test_f1: 0.5459
 epoch: 63, train_loss: 0.4525, test_loss: 1.7196, test_f1: 0.5373
 epoch: 64, train_loss: 0.4563, test_loss: 1.7380, test_f1: 0.5239
 epoch: 65, train_loss: 0.4529, test_loss: 1.6328, test_f1: 0.5670
 epoch: 66, train_loss: 0.4465, test_loss: 1.5928, test_f1: 0.5606
 epoch: 67, train_loss: 0.4393, test_loss: 1.7567, test_f1: 0.5125
 epoch: 68, train_loss: 0.4406, test_loss: 1.7549, test_f1: 0.5316
 epoch: 69, train_loss: 0.4176, test_loss: 1.8422, test_f1: 0.5481
 epoch: 70, train_loss: 0.4178, test_loss: 1.8540, test_f1: 0.5373
 epoch: 71, train_loss: 0.4215, test_loss: 1.8319, test_f1: 0.5531
 epoch: 72, train_loss: 0.4165, test_loss: 1.8568, test_f1: 0.5653
 epoch: 73, train_loss: 0.4193, test_loss: 1.8866, test_f1: 0.5175
 epoch: 74, train_loss: 0.4108, test_loss: 1.9896, test_f1: 0.5399
 epoch: 75, train_loss: 0.3840, test_loss: 1.9436, test_f1: 0.5496
 epoch: 76, train_loss: 0.4078, test_loss: 1.8647, test_f1: 0.5314
 epoch: 77, train_loss: 0.3849, test_loss: 1.9840, test_f1: 0.5230
 epoch: 78, train_loss: 0.3788, test_loss: 1.8104, test_f1: 0.5621
 epoch: 79, train_loss: 0.3894, test_loss: 1.8524, test_f1: 0.5775
 epoch: 80, train_loss: 0.3843, test_loss: 1.9488, test_f1: 0.6035
 epoch: 81, train_loss: 0.3573, test_loss: 2.1050, test_f1: 0.5540
 epoch: 82, train_loss: 0.3780, test_loss: 2.0441, test_f1: 0.5635
 epoch: 83, train_loss: 0.3755, test_loss: 2.1091, test_f1: 0.5446
 epoch: 84, train_loss: 0.3706, test_loss: 2.1044, test_f1: 0.5342
 epoch: 85, train_loss: 0.3763, test_loss: 2.2498, test_f1: 0.5337
 epoch: 86, train_loss: 0.3681, test_loss: 2.1163, test_f1: 0.5538
 epoch: 87, train_loss: 0.3602, test_loss: 2.1863, test_f1: 0.5251
 epoch: 88, train_loss: 0.3426, test_loss: 2.2231, test_f1: 0.5351
 epoch: 89, train_loss: 0.3412, test_loss: 2.2391, test_f1: 0.5550
 epoch: 90, train_loss: 0.3549, test_loss: 2.2713, test_f1: 0.5407
 epoch: 91, train_loss: 0.3488, test_loss: 2.2998, test_f1: 0.5651
 epoch: 92, train_loss: 0.3616, test_loss: 2.1672, test_f1: 0.5706
 epoch: 93, train_loss: 0.3574, test_loss: 2.2856, test_f1: 0.5302
 epoch: 94, train_loss: 0.3366, test_loss: 2.5452, test_f1: 0.5273
 epoch: 95, train_loss: 0.3274, test_loss: 2.7084, test_f1: 0.5093
 epoch: 96, train_loss: 0.3352, test_loss: 2.6328, test_f1: 0.5525
 epoch: 97, train_loss: 0.3284, test_loss: 2.6441, test_f1: 0.5521
 epoch: 98, train_loss: 0.3552, test_loss: 2.4041, test_f1: 0.5427
 epoch: 99, train_loss: 0.3422, test_loss: 2.4613, test_f1: 0.5853
##################ITERATION #2 ****************************************
 epoch: 0, train_loss: 1.2476, test_loss: 1.3030, test_f1: 0.2404
 epoch: 1, train_loss: 1.1549, test_loss: 1.2971, test_f1: 0.2404
 epoch: 2, train_loss: 1.1188, test_loss: 1.2953, test_f1: 0.2404
 epoch: 3, train_loss: 1.0817, test_loss: 1.2940, test_f1: 0.2438
 epoch: 4, train_loss: 1.0278, test_loss: 1.3502, test_f1: 0.3300
 epoch: 5, train_loss: 0.9772, test_loss: 1.3774, test_f1: 0.3410
 epoch: 6, train_loss: 0.9432, test_loss: 1.3657, test_f1: 0.3562
 epoch: 7, train_loss: 0.9128, test_loss: 1.3774, test_f1: 0.3721
 epoch: 8, train_loss: 0.8815, test_loss: 1.3213, test_f1: 0.3816
 epoch: 9, train_loss: 0.8558, test_loss: 1.2311, test_f1: 0.4662
 epoch: 10, train_loss: 0.8451, test_loss: 1.1609, test_f1: 0.5016
 epoch: 11, train_loss: 0.8187, test_loss: 1.1807, test_f1: 0.5266
 epoch: 12, train_loss: 0.8016, test_loss: 1.1140, test_f1: 0.4871
 epoch: 13, train_loss: 0.7880, test_loss: 1.1879, test_f1: 0.4905
 epoch: 14, train_loss: 0.8034, test_loss: 1.1561, test_f1: 0.5010
 epoch: 15, train_loss: 0.7948, test_loss: 1.1249, test_f1: 0.5205
 epoch: 16, train_loss: 0.7737, test_loss: 1.0350, test_f1: 0.5827
 epoch: 17, train_loss: 0.7629, test_loss: 1.0194, test_f1: 0.5939
 epoch: 18, train_loss: 0.7505, test_loss: 1.0070, test_f1: 0.5848
 epoch: 19, train_loss: 0.7341, test_loss: 1.0298, test_f1: 0.5604
 epoch: 20, train_loss: 0.7314, test_loss: 1.1748, test_f1: 0.5424
 epoch: 21, train_loss: 0.7113, test_loss: 1.1152, test_f1: 0.5474
 epoch: 22, train_loss: 0.7367, test_loss: 1.1308, test_f1: 0.5189
 epoch: 23, train_loss: 0.7102, test_loss: 1.1109, test_f1: 0.6017
 epoch: 24, train_loss: 0.6863, test_loss: 1.0823, test_f1: 0.5768
 epoch: 25, train_loss: 0.6727, test_loss: 1.3501, test_f1: 0.5156
 epoch: 26, train_loss: 0.6748, test_loss: 1.4102, test_f1: 0.5129
 epoch: 27, train_loss: 0.6517, test_loss: 1.3306, test_f1: 0.5200
 epoch: 28, train_loss: 0.6495, test_loss: 1.3305, test_f1: 0.5009
 epoch: 29, train_loss: 0.6619, test_loss: 1.1664, test_f1: 0.5262
 epoch: 30, train_loss: 0.6530, test_loss: 1.1432, test_f1: 0.5869
 epoch: 31, train_loss: 0.6555, test_loss: 1.1816, test_f1: 0.5343
 epoch: 32, train_loss: 0.6460, test_loss: 1.1875, test_f1: 0.5324
 epoch: 33, train_loss: 0.6401, test_loss: 1.2891, test_f1: 0.4901
 epoch: 34, train_loss: 0.6163, test_loss: 1.4019, test_f1: 0.5090
 epoch: 35, train_loss: 0.6209, test_loss: 1.3961, test_f1: 0.5352
 epoch: 36, train_loss: 0.6598, test_loss: 1.1898, test_f1: 0.5683
 epoch: 37, train_loss: 0.6137, test_loss: 1.2788, test_f1: 0.5747
 epoch: 38, train_loss: 0.6016, test_loss: 1.1675, test_f1: 0.5835
 epoch: 39, train_loss: 0.5963, test_loss: 1.2423, test_f1: 0.5740
 epoch: 40, train_loss: 0.5815, test_loss: 1.1583, test_f1: 0.5725
 epoch: 41, train_loss: 0.5719, test_loss: 1.1210, test_f1: 0.5872
 epoch: 42, train_loss: 0.5887, test_loss: 1.1385, test_f1: 0.5841
 epoch: 43, train_loss: 0.5842, test_loss: 1.4507, test_f1: 0.5210
 epoch: 44, train_loss: 0.5912, test_loss: 1.0833, test_f1: 0.6147
 epoch: 45, train_loss: 0.6013, test_loss: 1.3494, test_f1: 0.5874
 epoch: 46, train_loss: 0.6067, test_loss: 1.2282, test_f1: 0.5827
 epoch: 47, train_loss: 0.5756, test_loss: 1.3051, test_f1: 0.5669
 epoch: 48, train_loss: 0.5805, test_loss: 1.2437, test_f1: 0.6039
 epoch: 49, train_loss: 0.5783, test_loss: 1.1107, test_f1: 0.6204
 epoch: 50, train_loss: 0.5611, test_loss: 1.0903, test_f1: 0.6100
 epoch: 51, train_loss: 0.5721, test_loss: 1.1401, test_f1: 0.6077
 epoch: 52, train_loss: 0.5500, test_loss: 1.1654, test_f1: 0.6007
 epoch: 53, train_loss: 0.5287, test_loss: 1.2504, test_f1: 0.5802
 epoch: 54, train_loss: 0.5082, test_loss: 1.2724, test_f1: 0.5700
 epoch: 55, train_loss: 0.4916, test_loss: 1.2594, test_f1: 0.5737
 epoch: 56, train_loss: 0.4985, test_loss: 1.2748, test_f1: 0.5767
 epoch: 57, train_loss: 0.4977, test_loss: 1.3619, test_f1: 0.5863
 epoch: 58, train_loss: 0.4823, test_loss: 1.3264, test_f1: 0.5545
 epoch: 59, train_loss: 0.4748, test_loss: 1.2699, test_f1: 0.5712
 epoch: 60, train_loss: 0.4589, test_loss: 1.3597, test_f1: 0.5653
 epoch: 61, train_loss: 0.4673, test_loss: 1.4466, test_f1: 0.5573
 epoch: 62, train_loss: 0.4428, test_loss: 1.4402, test_f1: 0.5837
 epoch: 63, train_loss: 0.4613, test_loss: 1.4744, test_f1: 0.5885
 epoch: 64, train_loss: 0.4524, test_loss: 1.4332, test_f1: 0.5690
 epoch: 65, train_loss: 0.4415, test_loss: 1.4602, test_f1: 0.5846
 epoch: 66, train_loss: 0.4419, test_loss: 1.4186, test_f1: 0.5887
 epoch: 67, train_loss: 0.4421, test_loss: 1.4152, test_f1: 0.6218
 epoch: 68, train_loss: 0.4400, test_loss: 1.4955, test_f1: 0.5788
 epoch: 69, train_loss: 0.4312, test_loss: 1.3951, test_f1: 0.5996
 epoch: 70, train_loss: 0.4270, test_loss: 1.5082, test_f1: 0.5819
 epoch: 71, train_loss: 0.4190, test_loss: 1.3751, test_f1: 0.5771
 epoch: 72, train_loss: 0.4349, test_loss: 1.3187, test_f1: 0.6202
 epoch: 73, train_loss: 0.4219, test_loss: 1.3961, test_f1: 0.6161
 epoch: 74, train_loss: 0.4166, test_loss: 1.3625, test_f1: 0.6156
 epoch: 75, train_loss: 0.4108, test_loss: 1.3905, test_f1: 0.5883
 epoch: 76, train_loss: 0.4182, test_loss: 1.3350, test_f1: 0.5972
 epoch: 77, train_loss: 0.3941, test_loss: 1.4020, test_f1: 0.6037
 epoch: 78, train_loss: 0.4159, test_loss: 1.3973, test_f1: 0.5945
 epoch: 79, train_loss: 0.4075, test_loss: 1.4157, test_f1: 0.6002
 epoch: 80, train_loss: 0.3925, test_loss: 1.4038, test_f1: 0.6194
 epoch: 81, train_loss: 0.3801, test_loss: 1.2564, test_f1: 0.6407
 epoch: 82, train_loss: 0.3702, test_loss: 1.3490, test_f1: 0.6131
 epoch: 83, train_loss: 0.3598, test_loss: 1.3355, test_f1: 0.6206
 epoch: 84, train_loss: 0.3621, test_loss: 1.4063, test_f1: 0.6051
 epoch: 85, train_loss: 0.3577, test_loss: 1.4014, test_f1: 0.5862
 epoch: 86, train_loss: 0.3576, test_loss: 1.4297, test_f1: 0.5939
 epoch: 87, train_loss: 0.3673, test_loss: 1.3914, test_f1: 0.6072
 epoch: 88, train_loss: 0.3714, test_loss: 1.5017, test_f1: 0.6101
 epoch: 89, train_loss: 0.3611, test_loss: 1.4507, test_f1: 0.6237
 epoch: 90, train_loss: 0.3488, test_loss: 1.4410, test_f1: 0.6234
 epoch: 91, train_loss: 0.3542, test_loss: 1.4658, test_f1: 0.6384
 epoch: 92, train_loss: 0.3531, test_loss: 1.4493, test_f1: 0.6509
 epoch: 93, train_loss: 0.3301, test_loss: 1.4545, test_f1: 0.6205
 epoch: 94, train_loss: 0.3388, test_loss: 1.6321, test_f1: 0.5953
 epoch: 95, train_loss: 0.3506, test_loss: 1.6579, test_f1: 0.6041
 epoch: 96, train_loss: 0.3310, test_loss: 1.7298, test_f1: 0.5989
 epoch: 97, train_loss: 0.3277, test_loss: 1.7212, test_f1: 0.5734
 epoch: 98, train_loss: 0.3356, test_loss: 1.7177, test_f1: 0.5544
 epoch: 99, train_loss: 0.3421, test_loss: 1.6200, test_f1: 0.5950
##################ITERATION #3 ****************************************
 epoch: 0, train_loss: 1.2188, test_loss: 1.3020, test_f1: 0.3345
 epoch: 1, train_loss: 1.0986, test_loss: 1.2906, test_f1: 0.3262
 epoch: 2, train_loss: 1.0185, test_loss: 1.3004, test_f1: 0.3198
 epoch: 3, train_loss: 0.9591, test_loss: 1.3491, test_f1: 0.2453
 epoch: 4, train_loss: 0.9153, test_loss: 1.4045, test_f1: 0.1944
 epoch: 5, train_loss: 0.8874, test_loss: 1.3387, test_f1: 0.2828
 epoch: 6, train_loss: 0.8724, test_loss: 1.4307, test_f1: 0.2827
 epoch: 7, train_loss: 0.8384, test_loss: 1.3086, test_f1: 0.3399
 epoch: 8, train_loss: 0.8297, test_loss: 1.3182, test_f1: 0.3519
 epoch: 9, train_loss: 0.7878, test_loss: 1.1412, test_f1: 0.4570
 epoch: 10, train_loss: 0.7806, test_loss: 1.0384, test_f1: 0.5083
 epoch: 11, train_loss: 0.7494, test_loss: 0.9839, test_f1: 0.5929
 epoch: 12, train_loss: 0.7526, test_loss: 1.0187, test_f1: 0.5798
 epoch: 13, train_loss: 0.7479, test_loss: 1.0250, test_f1: 0.5731
 epoch: 14, train_loss: 0.7231, test_loss: 0.9941, test_f1: 0.6155
 epoch: 15, train_loss: 0.7153, test_loss: 0.9939, test_f1: 0.6014
 epoch: 16, train_loss: 0.7465, test_loss: 1.0383, test_f1: 0.6026
 epoch: 17, train_loss: 0.7059, test_loss: 1.0287, test_f1: 0.5814
 epoch: 18, train_loss: 0.6945, test_loss: 1.0722, test_f1: 0.5616
 epoch: 19, train_loss: 0.6777, test_loss: 1.0867, test_f1: 0.5767
 epoch: 20, train_loss: 0.6560, test_loss: 1.0064, test_f1: 0.5695
 epoch: 21, train_loss: 0.6564, test_loss: 0.9968, test_f1: 0.6005
 epoch: 22, train_loss: 0.6288, test_loss: 1.0528, test_f1: 0.5574
 epoch: 23, train_loss: 0.6342, test_loss: 1.0432, test_f1: 0.5324
 epoch: 24, train_loss: 0.6330, test_loss: 1.0432, test_f1: 0.5607
 epoch: 25, train_loss: 0.5954, test_loss: 1.4095, test_f1: 0.4692
 epoch: 26, train_loss: 0.6018, test_loss: 1.0498, test_f1: 0.6117
 epoch: 27, train_loss: 0.6147, test_loss: 1.2085, test_f1: 0.5538
 epoch: 28, train_loss: 0.5959, test_loss: 1.1476, test_f1: 0.5599
 epoch: 29, train_loss: 0.6093, test_loss: 1.2755, test_f1: 0.5946
 epoch: 30, train_loss: 0.6295, test_loss: 1.2065, test_f1: 0.5684
 epoch: 31, train_loss: 0.5873, test_loss: 1.0841, test_f1: 0.6193
 epoch: 32, train_loss: 0.5688, test_loss: 1.0479, test_f1: 0.5915
 epoch: 33, train_loss: 0.5511, test_loss: 1.1089, test_f1: 0.5954
 epoch: 34, train_loss: 0.5594, test_loss: 1.1673, test_f1: 0.5989
 epoch: 35, train_loss: 0.5436, test_loss: 1.2336, test_f1: 0.5760
 epoch: 36, train_loss: 0.5443, test_loss: 1.4968, test_f1: 0.5103
 epoch: 37, train_loss: 0.5380, test_loss: 1.2743, test_f1: 0.5191
 epoch: 38, train_loss: 0.5355, test_loss: 1.3104, test_f1: 0.5323
 epoch: 39, train_loss: 0.5220, test_loss: 1.3803, test_f1: 0.4816
 epoch: 40, train_loss: 0.5066, test_loss: 1.0993, test_f1: 0.5546
 epoch: 41, train_loss: 0.4914, test_loss: 1.1617, test_f1: 0.5713
 epoch: 42, train_loss: 0.5425, test_loss: 1.4351, test_f1: 0.5372
 epoch: 43, train_loss: 0.5302, test_loss: 1.4254, test_f1: 0.5258
 epoch: 44, train_loss: 0.5100, test_loss: 1.2425, test_f1: 0.5747
 epoch: 45, train_loss: 0.4805, test_loss: 1.2855, test_f1: 0.5392
 epoch: 46, train_loss: 0.4733, test_loss: 1.3870, test_f1: 0.5394
 epoch: 47, train_loss: 0.4935, test_loss: 1.3560, test_f1: 0.6085
 epoch: 48, train_loss: 0.5238, test_loss: 1.5476, test_f1: 0.5626
 epoch: 49, train_loss: 0.5008, test_loss: 1.5178, test_f1: 0.5193
 epoch: 50, train_loss: 0.5083, test_loss: 1.5627, test_f1: 0.5613
 epoch: 51, train_loss: 0.5001, test_loss: 1.4141, test_f1: 0.5975
 epoch: 52, train_loss: 0.5116, test_loss: 1.5444, test_f1: 0.5313
 epoch: 53, train_loss: 0.4763, test_loss: 1.5410, test_f1: 0.5289
 epoch: 54, train_loss: 0.4417, test_loss: 1.2998, test_f1: 0.5587
 epoch: 55, train_loss: 0.4365, test_loss: 1.3851, test_f1: 0.5511
 epoch: 56, train_loss: 0.4285, test_loss: 1.3922, test_f1: 0.5731
 epoch: 57, train_loss: 0.4097, test_loss: 1.4507, test_f1: 0.5947
 epoch: 58, train_loss: 0.4198, test_loss: 1.5383, test_f1: 0.5680
 epoch: 59, train_loss: 0.4086, test_loss: 1.5123, test_f1: 0.5741
 epoch: 60, train_loss: 0.3984, test_loss: 1.5041, test_f1: 0.5515
 epoch: 61, train_loss: 0.4071, test_loss: 1.6109, test_f1: 0.5268
 epoch: 62, train_loss: 0.3893, test_loss: 1.4223, test_f1: 0.5854
 epoch: 63, train_loss: 0.3879, test_loss: 1.4340, test_f1: 0.5829
 epoch: 64, train_loss: 0.3777, test_loss: 1.4718, test_f1: 0.5774
 epoch: 65, train_loss: 0.3678, test_loss: 1.5449, test_f1: 0.5811
 epoch: 66, train_loss: 0.3451, test_loss: 1.5479, test_f1: 0.6052
 epoch: 67, train_loss: 0.3528, test_loss: 1.5084, test_f1: 0.5771
 epoch: 68, train_loss: 0.3655, test_loss: 1.5857, test_f1: 0.5680
 epoch: 69, train_loss: 0.3689, test_loss: 1.7130, test_f1: 0.5312
 epoch: 70, train_loss: 0.3344, test_loss: 1.6542, test_f1: 0.5849
 epoch: 71, train_loss: 0.3392, test_loss: 1.7610, test_f1: 0.5600
 epoch: 72, train_loss: 0.3625, test_loss: 1.7785, test_f1: 0.5879
 epoch: 73, train_loss: 0.3630, test_loss: 1.6390, test_f1: 0.5837
 epoch: 74, train_loss: 0.3724, test_loss: 1.7567, test_f1: 0.5648
 epoch: 75, train_loss: 0.3788, test_loss: 1.4515, test_f1: 0.6056
 epoch: 76, train_loss: 0.3514, test_loss: 1.5492, test_f1: 0.5972
 epoch: 77, train_loss: 0.3493, test_loss: 1.6417, test_f1: 0.5890
 epoch: 78, train_loss: 0.3169, test_loss: 1.8674, test_f1: 0.5760
 epoch: 79, train_loss: 0.3227, test_loss: 1.9861, test_f1: 0.5480
 epoch: 80, train_loss: 0.3006, test_loss: 1.9863, test_f1: 0.5640
 epoch: 81, train_loss: 0.3103, test_loss: 1.7936, test_f1: 0.5840
 epoch: 82, train_loss: 0.2919, test_loss: 1.6443, test_f1: 0.6060
 epoch: 83, train_loss: 0.2954, test_loss: 1.7999, test_f1: 0.5831
 epoch: 84, train_loss: 0.2923, test_loss: 1.9879, test_f1: 0.6003
 epoch: 85, train_loss: 0.2865, test_loss: 2.1045, test_f1: 0.5830
 epoch: 86, train_loss: 0.2781, test_loss: 2.0122, test_f1: 0.5935
 epoch: 87, train_loss: 0.2784, test_loss: 1.9932, test_f1: 0.6054
 epoch: 88, train_loss: 0.2710, test_loss: 2.1463, test_f1: 0.5657
 epoch: 89, train_loss: 0.2785, test_loss: 2.1268, test_f1: 0.5568
 epoch: 90, train_loss: 0.2881, test_loss: 2.0510, test_f1: 0.5449
 epoch: 91, train_loss: 0.2969, test_loss: 1.9930, test_f1: 0.5894
 epoch: 92, train_loss: 0.2718, test_loss: 1.9499, test_f1: 0.6088
 epoch: 93, train_loss: 0.2768, test_loss: 1.9457, test_f1: 0.6118
 epoch: 94, train_loss: 0.2812, test_loss: 1.9138, test_f1: 0.6134
 epoch: 95, train_loss: 0.2847, test_loss: 1.9109, test_f1: 0.6097
 epoch: 96, train_loss: 0.2718, test_loss: 1.8657, test_f1: 0.5982
 epoch: 97, train_loss: 0.2620, test_loss: 1.8321, test_f1: 0.6155
 epoch: 98, train_loss: 0.2712, test_loss: 1.8175, test_f1: 0.6300
 epoch: 99, train_loss: 0.2528, test_loss: 1.9996, test_f1: 0.5950
##################ITERATION #4 ****************************************
 epoch: 0, train_loss: 1.2142, test_loss: 1.3165, test_f1: 0.3368
 epoch: 1, train_loss: 1.1094, test_loss: 1.2898, test_f1: 0.3346
 epoch: 2, train_loss: 1.0508, test_loss: 1.2750, test_f1: 0.3146
 epoch: 3, train_loss: 1.0002, test_loss: 1.2516, test_f1: 0.2655
 epoch: 4, train_loss: 0.9543, test_loss: 1.2196, test_f1: 0.3497
 epoch: 5, train_loss: 0.9317, test_loss: 1.1828, test_f1: 0.3733
 epoch: 6, train_loss: 0.9008, test_loss: 1.1398, test_f1: 0.4669
 epoch: 7, train_loss: 0.8953, test_loss: 1.1023, test_f1: 0.5230
 epoch: 8, train_loss: 0.8702, test_loss: 1.1286, test_f1: 0.4954
 epoch: 9, train_loss: 0.8512, test_loss: 1.0844, test_f1: 0.5092
 epoch: 10, train_loss: 0.8380, test_loss: 1.0804, test_f1: 0.4984
 epoch: 11, train_loss: 0.8088, test_loss: 1.0825, test_f1: 0.5229
 epoch: 12, train_loss: 0.7846, test_loss: 1.1400, test_f1: 0.5177
 epoch: 13, train_loss: 0.7697, test_loss: 1.0270, test_f1: 0.5639
 epoch: 14, train_loss: 0.7642, test_loss: 1.0993, test_f1: 0.4530
 epoch: 15, train_loss: 0.7750, test_loss: 1.0135, test_f1: 0.5941
 epoch: 16, train_loss: 0.7886, test_loss: 1.1539, test_f1: 0.4619
 epoch: 17, train_loss: 0.7706, test_loss: 0.9807, test_f1: 0.6336
 epoch: 18, train_loss: 0.7328, test_loss: 1.0462, test_f1: 0.5811
 epoch: 19, train_loss: 0.7371, test_loss: 1.0681, test_f1: 0.5831
 epoch: 20, train_loss: 0.7187, test_loss: 1.0709, test_f1: 0.6048
 epoch: 21, train_loss: 0.7119, test_loss: 1.1266, test_f1: 0.5428
 epoch: 22, train_loss: 0.7016, test_loss: 1.1376, test_f1: 0.5560
 epoch: 23, train_loss: 0.7011, test_loss: 1.1303, test_f1: 0.5309
 epoch: 24, train_loss: 0.7022, test_loss: 1.2328, test_f1: 0.5214
 epoch: 25, train_loss: 0.6899, test_loss: 1.0865, test_f1: 0.5797
 epoch: 26, train_loss: 0.7056, test_loss: 1.1834, test_f1: 0.5542
 epoch: 27, train_loss: 0.6711, test_loss: 1.0474, test_f1: 0.5948
 epoch: 28, train_loss: 0.6508, test_loss: 1.1423, test_f1: 0.6132
 epoch: 29, train_loss: 0.6542, test_loss: 1.1437, test_f1: 0.5947
 epoch: 30, train_loss: 0.6208, test_loss: 1.2346, test_f1: 0.5223
 epoch: 31, train_loss: 0.6169, test_loss: 1.2852, test_f1: 0.5650
 epoch: 32, train_loss: 0.6291, test_loss: 1.1551, test_f1: 0.5434
 epoch: 33, train_loss: 0.6525, test_loss: 1.1677, test_f1: 0.5224
 epoch: 34, train_loss: 0.6658, test_loss: 1.2278, test_f1: 0.5846
 epoch: 35, train_loss: 0.6415, test_loss: 1.1454, test_f1: 0.5872
 epoch: 36, train_loss: 0.6160, test_loss: 1.0759, test_f1: 0.5734
 epoch: 37, train_loss: 0.5939, test_loss: 1.1470, test_f1: 0.5641
 epoch: 38, train_loss: 0.5669, test_loss: 1.3747, test_f1: 0.4930
 epoch: 39, train_loss: 0.5730, test_loss: 1.3022, test_f1: 0.5016
 epoch: 40, train_loss: 0.5579, test_loss: 1.2936, test_f1: 0.4913
 epoch: 41, train_loss: 0.5698, test_loss: 1.3064, test_f1: 0.5225
 epoch: 42, train_loss: 0.5583, test_loss: 1.1330, test_f1: 0.6315
 epoch: 43, train_loss: 0.5454, test_loss: 1.3019, test_f1: 0.5778
 epoch: 44, train_loss: 0.5533, test_loss: 1.1250, test_f1: 0.6322
 epoch: 45, train_loss: 0.5685, test_loss: 1.2779, test_f1: 0.5465
 epoch: 46, train_loss: 0.5498, test_loss: 1.2392, test_f1: 0.5985
 epoch: 47, train_loss: 0.5442, test_loss: 1.2710, test_f1: 0.5449
 epoch: 48, train_loss: 0.5440, test_loss: 1.3002, test_f1: 0.5581
 epoch: 49, train_loss: 0.5135, test_loss: 1.2339, test_f1: 0.5676
 epoch: 50, train_loss: 0.5370, test_loss: 1.3007, test_f1: 0.5590
 epoch: 51, train_loss: 0.5074, test_loss: 1.1696, test_f1: 0.5953
 epoch: 52, train_loss: 0.5003, test_loss: 1.1564, test_f1: 0.6144
 epoch: 53, train_loss: 0.4769, test_loss: 1.2210, test_f1: 0.5996
 epoch: 54, train_loss: 0.4768, test_loss: 1.2770, test_f1: 0.5926
 epoch: 55, train_loss: 0.4789, test_loss: 1.1767, test_f1: 0.5830
 epoch: 56, train_loss: 0.4646, test_loss: 1.1888, test_f1: 0.5858
 epoch: 57, train_loss: 0.4465, test_loss: 1.3322, test_f1: 0.5635
 epoch: 58, train_loss: 0.4429, test_loss: 1.3419, test_f1: 0.5728
 epoch: 59, train_loss: 0.4553, test_loss: 1.3776, test_f1: 0.5610
 epoch: 60, train_loss: 0.4680, test_loss: 1.4059, test_f1: 0.5767
 epoch: 61, train_loss: 0.4637, test_loss: 1.1467, test_f1: 0.6493
 epoch: 62, train_loss: 0.4423, test_loss: 1.4204, test_f1: 0.5511
 epoch: 63, train_loss: 0.4555, test_loss: 1.4089, test_f1: 0.5777
 epoch: 64, train_loss: 0.4288, test_loss: 1.5211, test_f1: 0.5229
 epoch: 65, train_loss: 0.4222, test_loss: 1.3026, test_f1: 0.6053
 epoch: 66, train_loss: 0.4039, test_loss: 1.1852, test_f1: 0.6032
 epoch: 67, train_loss: 0.4160, test_loss: 1.2716, test_f1: 0.5780
 epoch: 68, train_loss: 0.4293, test_loss: 1.3457, test_f1: 0.6039
 epoch: 69, train_loss: 0.3966, test_loss: 1.4283, test_f1: 0.5814
 epoch: 70, train_loss: 0.3913, test_loss: 1.3267, test_f1: 0.6160
 epoch: 71, train_loss: 0.3976, test_loss: 1.3406, test_f1: 0.6238
 epoch: 72, train_loss: 0.3867, test_loss: 1.5094, test_f1: 0.5463
 epoch: 73, train_loss: 0.3921, test_loss: 1.5592, test_f1: 0.5226
 epoch: 74, train_loss: 0.4051, test_loss: 1.4211, test_f1: 0.5912
 epoch: 75, train_loss: 0.3789, test_loss: 1.5098, test_f1: 0.5921
 epoch: 76, train_loss: 0.3824, test_loss: 1.5001, test_f1: 0.5709
 epoch: 77, train_loss: 0.3733, test_loss: 1.6316, test_f1: 0.5585
 epoch: 78, train_loss: 0.3862, test_loss: 1.9510, test_f1: 0.5309
 epoch: 79, train_loss: 0.3877, test_loss: 1.7158, test_f1: 0.5524
 epoch: 80, train_loss: 0.4191, test_loss: 1.4483, test_f1: 0.6186
 epoch: 81, train_loss: 0.3785, test_loss: 1.4776, test_f1: 0.6142
 epoch: 82, train_loss: 0.3709, test_loss: 1.4143, test_f1: 0.5831
 epoch: 83, train_loss: 0.3965, test_loss: 1.3992, test_f1: 0.5921
 epoch: 84, train_loss: 0.3807, test_loss: 1.5474, test_f1: 0.5924
 epoch: 85, train_loss: 0.3664, test_loss: 1.4012, test_f1: 0.6406
 epoch: 86, train_loss: 0.3743, test_loss: 1.5638, test_f1: 0.6191
 epoch: 87, train_loss: 0.3692, test_loss: 1.5225, test_f1: 0.6244
 epoch: 88, train_loss: 0.3427, test_loss: 1.6627, test_f1: 0.5997
 epoch: 89, train_loss: 0.3278, test_loss: 1.7168, test_f1: 0.5966
 epoch: 90, train_loss: 0.3233, test_loss: 1.7851, test_f1: 0.5881
 epoch: 91, train_loss: 0.3312, test_loss: 1.7294, test_f1: 0.6082
 epoch: 92, train_loss: 0.3559, test_loss: 1.6972, test_f1: 0.5927
 epoch: 93, train_loss: 0.3399, test_loss: 1.7771, test_f1: 0.5951
 epoch: 94, train_loss: 0.3284, test_loss: 1.9245, test_f1: 0.5790
 epoch: 95, train_loss: 0.3342, test_loss: 1.8143, test_f1: 0.5595
 epoch: 96, train_loss: 0.3453, test_loss: 1.6271, test_f1: 0.6091
 epoch: 97, train_loss: 0.3393, test_loss: 1.6484, test_f1: 0.6116
 epoch: 98, train_loss: 0.3287, test_loss: 1.9280, test_f1: 0.5513
 epoch: 99, train_loss: 0.3024, test_loss: 2.1516, test_f1: 0.5215
##################ITERATION #5 ****************************************
 epoch: 0, train_loss: 1.2422, test_loss: 1.3217, test_f1: 0.3428
 epoch: 1, train_loss: 1.1009, test_loss: 1.3865, test_f1: 0.1365
 epoch: 2, train_loss: 1.0249, test_loss: 1.4088, test_f1: 0.1365
 epoch: 3, train_loss: 0.9820, test_loss: 1.4803, test_f1: 0.2672
 epoch: 4, train_loss: 0.9444, test_loss: 1.4643, test_f1: 0.2773
 epoch: 5, train_loss: 0.9294, test_loss: 1.4430, test_f1: 0.2494
 epoch: 6, train_loss: 0.9021, test_loss: 1.4240, test_f1: 0.2521
 epoch: 7, train_loss: 0.8640, test_loss: 1.3229, test_f1: 0.2916
 epoch: 8, train_loss: 0.8373, test_loss: 1.2763, test_f1: 0.3054
 epoch: 9, train_loss: 0.8260, test_loss: 1.2124, test_f1: 0.3974
 epoch: 10, train_loss: 0.7887, test_loss: 1.1012, test_f1: 0.5258
 epoch: 11, train_loss: 0.7724, test_loss: 1.1257, test_f1: 0.5379
 epoch: 12, train_loss: 0.7656, test_loss: 1.0420, test_f1: 0.5887
 epoch: 13, train_loss: 0.7423, test_loss: 1.0066, test_f1: 0.6100
 epoch: 14, train_loss: 0.7239, test_loss: 1.0225, test_f1: 0.5956
 epoch: 15, train_loss: 0.7449, test_loss: 1.0267, test_f1: 0.5797
 epoch: 16, train_loss: 0.7106, test_loss: 1.0240, test_f1: 0.6172
 epoch: 17, train_loss: 0.7097, test_loss: 1.1660, test_f1: 0.6246
 epoch: 18, train_loss: 0.6871, test_loss: 1.0322, test_f1: 0.5977
 epoch: 19, train_loss: 0.6898, test_loss: 1.1734, test_f1: 0.6171
 epoch: 20, train_loss: 0.6870, test_loss: 1.5946, test_f1: 0.6111
 epoch: 21, train_loss: 0.6639, test_loss: 1.7781, test_f1: 0.5543
 epoch: 22, train_loss: 0.6727, test_loss: 1.0262, test_f1: 0.5780
 epoch: 23, train_loss: 0.6729, test_loss: 2.1218, test_f1: 0.5951
 epoch: 24, train_loss: 0.6576, test_loss: 1.0014, test_f1: 0.6194
 epoch: 25, train_loss: 0.6469, test_loss: 0.9404, test_f1: 0.6090
 epoch: 26, train_loss: 0.6323, test_loss: 1.0817, test_f1: 0.5504
 epoch: 27, train_loss: 0.6540, test_loss: 1.0282, test_f1: 0.5960
 epoch: 28, train_loss: 0.6408, test_loss: 1.1432, test_f1: 0.5998
 epoch: 29, train_loss: 0.6471, test_loss: 1.5708, test_f1: 0.4807
 epoch: 30, train_loss: 0.6737, test_loss: 1.3958, test_f1: 0.4799
 epoch: 31, train_loss: 0.6498, test_loss: 1.2102, test_f1: 0.6106
 epoch: 32, train_loss: 0.6478, test_loss: 1.3424, test_f1: 0.5223
 epoch: 33, train_loss: 0.6201, test_loss: 1.1401, test_f1: 0.5762
 epoch: 34, train_loss: 0.6091, test_loss: 1.1030, test_f1: 0.6083
 epoch: 35, train_loss: 0.5928, test_loss: 1.0371, test_f1: 0.6120
 epoch: 36, train_loss: 0.5788, test_loss: 1.1948, test_f1: 0.5473
 epoch: 37, train_loss: 0.6240, test_loss: 1.0990, test_f1: 0.5865
 epoch: 38, train_loss: 0.6390, test_loss: 1.1042, test_f1: 0.6090
 epoch: 39, train_loss: 0.5904, test_loss: 1.2787, test_f1: 0.6011
 epoch: 40, train_loss: 0.5702, test_loss: 1.1077, test_f1: 0.6555
 epoch: 41, train_loss: 0.5662, test_loss: 1.1558, test_f1: 0.6354
 epoch: 42, train_loss: 0.5725, test_loss: 1.0536, test_f1: 0.6431
 epoch: 43, train_loss: 0.5844, test_loss: 1.1218, test_f1: 0.6361
 epoch: 44, train_loss: 0.5610, test_loss: 1.1705, test_f1: 0.6187
 epoch: 45, train_loss: 0.5284, test_loss: 1.3500, test_f1: 0.6177
 epoch: 46, train_loss: 0.5218, test_loss: 1.4870, test_f1: 0.5969
 epoch: 47, train_loss: 0.5186, test_loss: 1.1976, test_f1: 0.6114
 epoch: 48, train_loss: 0.5100, test_loss: 1.1210, test_f1: 0.6417
 epoch: 49, train_loss: 0.4981, test_loss: 1.2309, test_f1: 0.6392
 epoch: 50, train_loss: 0.4834, test_loss: 1.1545, test_f1: 0.6842
 epoch: 51, train_loss: 0.4504, test_loss: 1.1441, test_f1: 0.6823
 epoch: 52, train_loss: 0.4628, test_loss: 1.1755, test_f1: 0.6738
 epoch: 53, train_loss: 0.4276, test_loss: 1.2410, test_f1: 0.6557
 epoch: 54, train_loss: 0.4331, test_loss: 1.2107, test_f1: 0.6581
 epoch: 55, train_loss: 0.4263, test_loss: 1.2098, test_f1: 0.6793
 epoch: 56, train_loss: 0.4395, test_loss: 1.1588, test_f1: 0.6711
 epoch: 57, train_loss: 0.4250, test_loss: 1.2410, test_f1: 0.6472
 epoch: 58, train_loss: 0.4216, test_loss: 1.1944, test_f1: 0.6429
 epoch: 59, train_loss: 0.4099, test_loss: 1.1820, test_f1: 0.6551
 epoch: 60, train_loss: 0.4318, test_loss: 1.3204, test_f1: 0.6111
 epoch: 61, train_loss: 0.4244, test_loss: 1.2318, test_f1: 0.6762
 epoch: 62, train_loss: 0.3942, test_loss: 1.2037, test_f1: 0.6762
 epoch: 63, train_loss: 0.4012, test_loss: 1.2051, test_f1: 0.6620
 epoch: 64, train_loss: 0.3750, test_loss: 1.2787, test_f1: 0.6394
 epoch: 65, train_loss: 0.3628, test_loss: 1.3140, test_f1: 0.6517
 epoch: 66, train_loss: 0.3579, test_loss: 1.2953, test_f1: 0.6487
 epoch: 67, train_loss: 0.3562, test_loss: 1.3840, test_f1: 0.6398
 epoch: 68, train_loss: 0.3635, test_loss: 1.4712, test_f1: 0.6432
 epoch: 69, train_loss: 0.3498, test_loss: 1.4131, test_f1: 0.6768
 epoch: 70, train_loss: 0.3526, test_loss: 1.4503, test_f1: 0.6169
 epoch: 71, train_loss: 0.3302, test_loss: 1.4434, test_f1: 0.6215
 epoch: 72, train_loss: 0.3612, test_loss: 1.4273, test_f1: 0.6482
 epoch: 73, train_loss: 0.3409, test_loss: 1.5144, test_f1: 0.6601
 epoch: 74, train_loss: 0.3274, test_loss: 1.4606, test_f1: 0.6922
 epoch: 75, train_loss: 0.3221, test_loss: 1.4399, test_f1: 0.6431
 epoch: 76, train_loss: 0.3253, test_loss: 1.3713, test_f1: 0.6480
 epoch: 77, train_loss: 0.3306, test_loss: 1.5380, test_f1: 0.6677
 epoch: 78, train_loss: 0.3354, test_loss: 1.5157, test_f1: 0.6532
 epoch: 79, train_loss: 0.3154, test_loss: 1.4953, test_f1: 0.6455
 epoch: 80, train_loss: 0.3132, test_loss: 1.5651, test_f1: 0.6065
 epoch: 81, train_loss: 0.3001, test_loss: 1.7775, test_f1: 0.6532
 epoch: 82, train_loss: 0.3108, test_loss: 1.5754, test_f1: 0.6485
 epoch: 83, train_loss: 0.3069, test_loss: 1.5346, test_f1: 0.6317
 epoch: 84, train_loss: 0.3277, test_loss: 1.7132, test_f1: 0.6346
 epoch: 85, train_loss: 0.3790, test_loss: 1.9949, test_f1: 0.4859
 epoch: 86, train_loss: 0.4014, test_loss: 1.6248, test_f1: 0.6212
 epoch: 87, train_loss: 0.3533, test_loss: 1.6128, test_f1: 0.6352
 epoch: 88, train_loss: 0.3678, test_loss: 1.4578, test_f1: 0.6425
 epoch: 89, train_loss: 0.3298, test_loss: 1.6115, test_f1: 0.6094
 epoch: 90, train_loss: 0.3544, test_loss: 1.5542, test_f1: 0.6141
 epoch: 91, train_loss: 0.3143, test_loss: 1.4940, test_f1: 0.6383
 epoch: 92, train_loss: 0.3201, test_loss: 1.4399, test_f1: 0.6264
 epoch: 93, train_loss: 0.3273, test_loss: 1.4768, test_f1: 0.6297
 epoch: 94, train_loss: 0.3293, test_loss: 1.6327, test_f1: 0.6079
 epoch: 95, train_loss: 0.2966, test_loss: 1.5753, test_f1: 0.6145
 epoch: 96, train_loss: 0.3008, test_loss: 1.5200, test_f1: 0.6154
 epoch: 97, train_loss: 0.2797, test_loss: 1.5460, test_f1: 0.6396
 epoch: 98, train_loss: 0.2669, test_loss: 1.6672, test_f1: 0.6408
 epoch: 99, train_loss: 0.2605, test_loss: 1.7371, test_f1: 0.6120
##################ITERATION #6 ****************************************
 epoch: 0, train_loss: 1.2743, test_loss: 1.3282, test_f1: 0.1385
 epoch: 1, train_loss: 1.1298, test_loss: 1.3019, test_f1: 0.3318
 epoch: 2, train_loss: 1.0740, test_loss: 1.2990, test_f1: 0.3468
 epoch: 3, train_loss: 1.0279, test_loss: 1.3195, test_f1: 0.3688
 epoch: 4, train_loss: 0.9890, test_loss: 1.3345, test_f1: 0.3419
 epoch: 5, train_loss: 0.9709, test_loss: 1.3516, test_f1: 0.3350
 epoch: 6, train_loss: 0.9407, test_loss: 1.3228, test_f1: 0.4322
 epoch: 7, train_loss: 0.9037, test_loss: 1.2303, test_f1: 0.4644
 epoch: 8, train_loss: 0.8940, test_loss: 1.1353, test_f1: 0.5092
 epoch: 9, train_loss: 0.8691, test_loss: 1.0715, test_f1: 0.5358
 epoch: 10, train_loss: 0.8612, test_loss: 1.0564, test_f1: 0.4979
 epoch: 11, train_loss: 0.8222, test_loss: 1.0823, test_f1: 0.5573
 epoch: 12, train_loss: 0.8185, test_loss: 1.1039, test_f1: 0.5259
 epoch: 13, train_loss: 0.8044, test_loss: 1.0209, test_f1: 0.5497
 epoch: 14, train_loss: 0.7830, test_loss: 0.9909, test_f1: 0.5336
 epoch: 15, train_loss: 0.7841, test_loss: 1.0925, test_f1: 0.4933
 epoch: 16, train_loss: 0.7564, test_loss: 1.0443, test_f1: 0.5398
 epoch: 17, train_loss: 0.7215, test_loss: 0.9855, test_f1: 0.5673
 epoch: 18, train_loss: 0.7119, test_loss: 1.0467, test_f1: 0.5512
 epoch: 19, train_loss: 0.6974, test_loss: 1.0968, test_f1: 0.5583
 epoch: 20, train_loss: 0.6791, test_loss: 1.1524, test_f1: 0.5876
 epoch: 21, train_loss: 0.7087, test_loss: 1.4625, test_f1: 0.4613
 epoch: 22, train_loss: 0.7205, test_loss: 1.0460, test_f1: 0.5833
 epoch: 23, train_loss: 0.7077, test_loss: 1.0654, test_f1: 0.5523
 epoch: 24, train_loss: 0.6803, test_loss: 1.0876, test_f1: 0.5630
 epoch: 25, train_loss: 0.6913, test_loss: 1.0760, test_f1: 0.5420
 epoch: 26, train_loss: 0.6645, test_loss: 1.1111, test_f1: 0.5598
 epoch: 27, train_loss: 0.6671, test_loss: 1.2240, test_f1: 0.5047
 epoch: 28, train_loss: 0.6517, test_loss: 1.2068, test_f1: 0.5056
 epoch: 29, train_loss: 0.6217, test_loss: 1.2541, test_f1: 0.5599
 epoch: 30, train_loss: 0.6327, test_loss: 1.2277, test_f1: 0.5526
 epoch: 31, train_loss: 0.6556, test_loss: 1.1320, test_f1: 0.5635
 epoch: 32, train_loss: 0.6352, test_loss: 1.1061, test_f1: 0.5864
 epoch: 33, train_loss: 0.6250, test_loss: 1.0969, test_f1: 0.5893
 epoch: 34, train_loss: 0.6219, test_loss: 1.3002, test_f1: 0.5401
 epoch: 35, train_loss: 0.6252, test_loss: 1.2694, test_f1: 0.5628
 epoch: 36, train_loss: 0.6247, test_loss: 1.2932, test_f1: 0.5720
 epoch: 37, train_loss: 0.6156, test_loss: 1.2271, test_f1: 0.5678
 epoch: 38, train_loss: 0.5867, test_loss: 1.0638, test_f1: 0.5517
 epoch: 39, train_loss: 0.5710, test_loss: 1.0989, test_f1: 0.5816
 epoch: 40, train_loss: 0.5502, test_loss: 1.2282, test_f1: 0.5666
 epoch: 41, train_loss: 0.5634, test_loss: 1.2492, test_f1: 0.5320
 epoch: 42, train_loss: 0.5420, test_loss: 1.1523, test_f1: 0.5567
 epoch: 43, train_loss: 0.5649, test_loss: 1.0910, test_f1: 0.6261
 epoch: 44, train_loss: 0.5769, test_loss: 1.2781, test_f1: 0.5794
 epoch: 45, train_loss: 0.5770, test_loss: 1.1525, test_f1: 0.6236
 epoch: 46, train_loss: 0.5612, test_loss: 1.1379, test_f1: 0.6061
 epoch: 47, train_loss: 0.5736, test_loss: 1.2362, test_f1: 0.6085
 epoch: 48, train_loss: 0.5310, test_loss: 1.3128, test_f1: 0.5875
 epoch: 49, train_loss: 0.5707, test_loss: 1.3178, test_f1: 0.6025
 epoch: 50, train_loss: 0.5375, test_loss: 1.3902, test_f1: 0.6009
 epoch: 51, train_loss: 0.5005, test_loss: 1.2214, test_f1: 0.6172
 epoch: 52, train_loss: 0.4875, test_loss: 1.2368, test_f1: 0.6368
 epoch: 53, train_loss: 0.4603, test_loss: 1.2628, test_f1: 0.5909
 epoch: 54, train_loss: 0.4781, test_loss: 1.3170, test_f1: 0.6179
 epoch: 55, train_loss: 0.4485, test_loss: 1.2861, test_f1: 0.6322
 epoch: 56, train_loss: 0.4416, test_loss: 1.3232, test_f1: 0.6063
 epoch: 57, train_loss: 0.4278, test_loss: 1.3132, test_f1: 0.5921
 epoch: 58, train_loss: 0.4066, test_loss: 1.2385, test_f1: 0.6163
 epoch: 59, train_loss: 0.4047, test_loss: 1.1497, test_f1: 0.6152
 epoch: 60, train_loss: 0.4166, test_loss: 1.2593, test_f1: 0.6386
 epoch: 61, train_loss: 0.4117, test_loss: 1.3884, test_f1: 0.5873
 epoch: 62, train_loss: 0.4282, test_loss: 1.2561, test_f1: 0.6427
 epoch: 63, train_loss: 0.4290, test_loss: 1.2737, test_f1: 0.6470
 epoch: 64, train_loss: 0.4116, test_loss: 1.2951, test_f1: 0.6353
 epoch: 65, train_loss: 0.4005, test_loss: 1.3910, test_f1: 0.6441
 epoch: 66, train_loss: 0.3840, test_loss: 1.4090, test_f1: 0.6403
 epoch: 67, train_loss: 0.3823, test_loss: 1.4945, test_f1: 0.6070
 epoch: 68, train_loss: 0.3822, test_loss: 1.3855, test_f1: 0.6073
 epoch: 69, train_loss: 0.3655, test_loss: 1.4096, test_f1: 0.6070
 epoch: 70, train_loss: 0.3824, test_loss: 1.3791, test_f1: 0.6209
 epoch: 71, train_loss: 0.3801, test_loss: 1.2465, test_f1: 0.6438
 epoch: 72, train_loss: 0.3571, test_loss: 1.3383, test_f1: 0.6390
 epoch: 73, train_loss: 0.3634, test_loss: 1.3161, test_f1: 0.6333
 epoch: 74, train_loss: 0.3801, test_loss: 1.3319, test_f1: 0.6372
 epoch: 75, train_loss: 0.3810, test_loss: 1.4576, test_f1: 0.6137
 epoch: 76, train_loss: 0.3583, test_loss: 1.4729, test_f1: 0.5932
 epoch: 77, train_loss: 0.3563, test_loss: 1.3278, test_f1: 0.6009
 epoch: 78, train_loss: 0.3324, test_loss: 1.3940, test_f1: 0.6272
 epoch: 79, train_loss: 0.3604, test_loss: 1.2993, test_f1: 0.6291
 epoch: 80, train_loss: 0.3663, test_loss: 1.4537, test_f1: 0.5989
 epoch: 81, train_loss: 0.3362, test_loss: 1.4895, test_f1: 0.5743
 epoch: 82, train_loss: 0.3455, test_loss: 1.3979, test_f1: 0.5714
 epoch: 83, train_loss: 0.3674, test_loss: 1.4290, test_f1: 0.5910
 epoch: 84, train_loss: 0.3224, test_loss: 1.3607, test_f1: 0.6152
 epoch: 85, train_loss: 0.3458, test_loss: 1.3180, test_f1: 0.6389
 epoch: 86, train_loss: 0.3307, test_loss: 1.3548, test_f1: 0.6278
 epoch: 87, train_loss: 0.3244, test_loss: 1.4970, test_f1: 0.6458
 epoch: 88, train_loss: 0.3154, test_loss: 1.6017, test_f1: 0.6262
 epoch: 89, train_loss: 0.3343, test_loss: 1.5858, test_f1: 0.5934
 epoch: 90, train_loss: 0.3051, test_loss: 1.5101, test_f1: 0.6175
 epoch: 91, train_loss: 0.2797, test_loss: 1.4617, test_f1: 0.6318
 epoch: 92, train_loss: 0.2957, test_loss: 1.4667, test_f1: 0.6543
 epoch: 93, train_loss: 0.3060, test_loss: 1.5013, test_f1: 0.6212
 epoch: 94, train_loss: 0.2795, test_loss: 1.6082, test_f1: 0.6087
 epoch: 95, train_loss: 0.2933, test_loss: 1.4934, test_f1: 0.6181
 epoch: 96, train_loss: 0.3115, test_loss: 1.4112, test_f1: 0.6141
 epoch: 97, train_loss: 0.3056, test_loss: 1.3371, test_f1: 0.6160
 epoch: 98, train_loss: 0.3072, test_loss: 1.4777, test_f1: 0.6078
 epoch: 99, train_loss: 0.2748, test_loss: 1.4562, test_f1: 0.6236
##################ITERATION #7 ****************************************
 epoch: 0, train_loss: 1.2324, test_loss: 1.3662, test_f1: 0.1836
 epoch: 1, train_loss: 1.0901, test_loss: 1.3920, test_f1: 0.1836
 epoch: 2, train_loss: 1.0336, test_loss: 1.4601, test_f1: 0.2460
 epoch: 3, train_loss: 0.9650, test_loss: 1.5886, test_f1: 0.1833
 epoch: 4, train_loss: 0.9639, test_loss: 1.5211, test_f1: 0.2128
 epoch: 5, train_loss: 0.9231, test_loss: 1.5686, test_f1: 0.2199
 epoch: 6, train_loss: 0.9005, test_loss: 1.5664, test_f1: 0.2943
 epoch: 7, train_loss: 0.8704, test_loss: 1.3098, test_f1: 0.3827
 epoch: 8, train_loss: 0.8514, test_loss: 1.1346, test_f1: 0.4915
 epoch: 9, train_loss: 0.8293, test_loss: 1.0863, test_f1: 0.5459
 epoch: 10, train_loss: 0.8291, test_loss: 1.0130, test_f1: 0.5592
 epoch: 11, train_loss: 0.8207, test_loss: 1.0191, test_f1: 0.5795
 epoch: 12, train_loss: 0.7930, test_loss: 1.0618, test_f1: 0.5353
 epoch: 13, train_loss: 0.7781, test_loss: 1.1112, test_f1: 0.5392
 epoch: 14, train_loss: 0.7893, test_loss: 1.1122, test_f1: 0.5461
 epoch: 15, train_loss: 0.8069, test_loss: 1.0591, test_f1: 0.5299
 epoch: 16, train_loss: 0.7834, test_loss: 1.0446, test_f1: 0.5588
 epoch: 17, train_loss: 0.7785, test_loss: 0.9871, test_f1: 0.5995
 epoch: 18, train_loss: 0.7513, test_loss: 1.0023, test_f1: 0.6348
 epoch: 19, train_loss: 0.7283, test_loss: 1.0989, test_f1: 0.5560
 epoch: 20, train_loss: 0.7760, test_loss: 1.0042, test_f1: 0.5488
 epoch: 21, train_loss: 0.7354, test_loss: 1.0145, test_f1: 0.5826
 epoch: 22, train_loss: 0.7166, test_loss: 1.1859, test_f1: 0.5405
 epoch: 23, train_loss: 0.6830, test_loss: 1.0282, test_f1: 0.6004
 epoch: 24, train_loss: 0.7006, test_loss: 0.9888, test_f1: 0.5817
 epoch: 25, train_loss: 0.6680, test_loss: 1.0577, test_f1: 0.6008
 epoch: 26, train_loss: 0.6771, test_loss: 1.0050, test_f1: 0.6000
 epoch: 27, train_loss: 0.6670, test_loss: 0.9721, test_f1: 0.5896
 epoch: 28, train_loss: 0.6508, test_loss: 1.0087, test_f1: 0.5957
 epoch: 29, train_loss: 0.6406, test_loss: 1.0085, test_f1: 0.5588
 epoch: 30, train_loss: 0.6170, test_loss: 1.0804, test_f1: 0.5868
 epoch: 31, train_loss: 0.6211, test_loss: 1.1650, test_f1: 0.5244
 epoch: 32, train_loss: 0.6159, test_loss: 1.3251, test_f1: 0.5808
 epoch: 33, train_loss: 0.6371, test_loss: 1.2503, test_f1: 0.5566
 epoch: 34, train_loss: 0.6196, test_loss: 1.3774, test_f1: 0.5235
 epoch: 35, train_loss: 0.6478, test_loss: 1.3016, test_f1: 0.5731
 epoch: 36, train_loss: 0.6282, test_loss: 1.2772, test_f1: 0.5846
 epoch: 37, train_loss: 0.6178, test_loss: 1.2683, test_f1: 0.5456
 epoch: 38, train_loss: 0.5910, test_loss: 1.2760, test_f1: 0.5427
 epoch: 39, train_loss: 0.5899, test_loss: 1.1086, test_f1: 0.5815
 epoch: 40, train_loss: 0.5605, test_loss: 1.0726, test_f1: 0.6101
 epoch: 41, train_loss: 0.5596, test_loss: 1.0954, test_f1: 0.5658
 epoch: 42, train_loss: 0.5943, test_loss: 1.1964, test_f1: 0.5783
 epoch: 43, train_loss: 0.5871, test_loss: 1.3310, test_f1: 0.5421
 epoch: 44, train_loss: 0.5749, test_loss: 1.3653, test_f1: 0.5586
 epoch: 45, train_loss: 0.5421, test_loss: 1.2941, test_f1: 0.5854
 epoch: 46, train_loss: 0.5471, test_loss: 1.2127, test_f1: 0.6123
 epoch: 47, train_loss: 0.5733, test_loss: 1.3940, test_f1: 0.4673
 epoch: 48, train_loss: 0.5568, test_loss: 1.4718, test_f1: 0.5263
 epoch: 49, train_loss: 0.5567, test_loss: 1.3310, test_f1: 0.5320
 epoch: 50, train_loss: 0.5611, test_loss: 1.5354, test_f1: 0.5401
 epoch: 51, train_loss: 0.5522, test_loss: 1.4821, test_f1: 0.5579
 epoch: 52, train_loss: 0.5245, test_loss: 1.4659, test_f1: 0.5565
 epoch: 53, train_loss: 0.5027, test_loss: 1.3764, test_f1: 0.5689
 epoch: 54, train_loss: 0.4896, test_loss: 1.3428, test_f1: 0.5515
 epoch: 55, train_loss: 0.4758, test_loss: 1.3373, test_f1: 0.5984
 epoch: 56, train_loss: 0.4930, test_loss: 1.3421, test_f1: 0.5881
 epoch: 57, train_loss: 0.4690, test_loss: 1.5171, test_f1: 0.5571
 epoch: 58, train_loss: 0.4635, test_loss: 1.5086, test_f1: 0.5879
 epoch: 59, train_loss: 0.4614, test_loss: 1.4601, test_f1: 0.5907
 epoch: 60, train_loss: 0.4432, test_loss: 1.3757, test_f1: 0.6034
 epoch: 61, train_loss: 0.4410, test_loss: 1.4968, test_f1: 0.5893
 epoch: 62, train_loss: 0.4396, test_loss: 1.4815, test_f1: 0.5852
 epoch: 63, train_loss: 0.4366, test_loss: 1.7111, test_f1: 0.5547
 epoch: 64, train_loss: 0.4402, test_loss: 1.5671, test_f1: 0.5333
 epoch: 65, train_loss: 0.4300, test_loss: 1.6077, test_f1: 0.5870
 epoch: 66, train_loss: 0.4134, test_loss: 1.7430, test_f1: 0.5567
 epoch: 67, train_loss: 0.4148, test_loss: 1.6362, test_f1: 0.5746
 epoch: 68, train_loss: 0.3935, test_loss: 1.6051, test_f1: 0.5576
 epoch: 69, train_loss: 0.3916, test_loss: 1.5256, test_f1: 0.5393
 epoch: 70, train_loss: 0.4018, test_loss: 1.4456, test_f1: 0.5829
 epoch: 71, train_loss: 0.3871, test_loss: 1.4367, test_f1: 0.5706
 epoch: 72, train_loss: 0.4082, test_loss: 1.6874, test_f1: 0.5868
 epoch: 73, train_loss: 0.3888, test_loss: 1.7691, test_f1: 0.5772
 epoch: 74, train_loss: 0.3821, test_loss: 1.7770, test_f1: 0.5897
 epoch: 75, train_loss: 0.3800, test_loss: 1.7293, test_f1: 0.5623
 epoch: 76, train_loss: 0.3721, test_loss: 1.5445, test_f1: 0.5766
 epoch: 77, train_loss: 0.3971, test_loss: 1.7184, test_f1: 0.5933
 epoch: 78, train_loss: 0.3818, test_loss: 1.7917, test_f1: 0.5860
 epoch: 79, train_loss: 0.3909, test_loss: 1.6651, test_f1: 0.6041
 epoch: 80, train_loss: 0.3779, test_loss: 1.6214, test_f1: 0.5866
 epoch: 81, train_loss: 0.3690, test_loss: 1.6760, test_f1: 0.5925
 epoch: 82, train_loss: 0.3593, test_loss: 1.8266, test_f1: 0.5831
 epoch: 83, train_loss: 0.3742, test_loss: 1.8495, test_f1: 0.5521
 epoch: 84, train_loss: 0.3694, test_loss: 1.7945, test_f1: 0.5746
 epoch: 85, train_loss: 0.3667, test_loss: 1.6314, test_f1: 0.5718
 epoch: 86, train_loss: 0.3676, test_loss: 1.5383, test_f1: 0.5882
 epoch: 87, train_loss: 0.3573, test_loss: 1.5752, test_f1: 0.6147
 epoch: 88, train_loss: 0.3233, test_loss: 1.6085, test_f1: 0.5781
 epoch: 89, train_loss: 0.3158, test_loss: 1.7907, test_f1: 0.5553
 epoch: 90, train_loss: 0.3211, test_loss: 1.7573, test_f1: 0.5781
 epoch: 91, train_loss: 0.3304, test_loss: 1.7535, test_f1: 0.6004
 epoch: 92, train_loss: 0.3054, test_loss: 1.9287, test_f1: 0.5765
 epoch: 93, train_loss: 0.3509, test_loss: 1.8679, test_f1: 0.5750
 epoch: 94, train_loss: 0.3502, test_loss: 1.6952, test_f1: 0.6099
 epoch: 95, train_loss: 0.3448, test_loss: 1.5731, test_f1: 0.6250
 epoch: 96, train_loss: 0.3138, test_loss: 1.4904, test_f1: 0.6171
 epoch: 97, train_loss: 0.3072, test_loss: 1.8502, test_f1: 0.5543
 epoch: 98, train_loss: 0.3248, test_loss: 1.7635, test_f1: 0.5505
 epoch: 99, train_loss: 0.3205, test_loss: 1.7166, test_f1: 0.5585
##################ITERATION #8 ****************************************
 epoch: 0, train_loss: 1.3170, test_loss: 1.3338, test_f1: 0.3351
 epoch: 1, train_loss: 1.1421, test_loss: 1.3268, test_f1: 0.2865
 epoch: 2, train_loss: 1.0414, test_loss: 1.3307, test_f1: 0.2549
 epoch: 3, train_loss: 1.0084, test_loss: 1.3316, test_f1: 0.2649
 epoch: 4, train_loss: 0.9391, test_loss: 1.3389, test_f1: 0.3132
 epoch: 5, train_loss: 0.9160, test_loss: 1.2314, test_f1: 0.3265
 epoch: 6, train_loss: 0.8946, test_loss: 1.1661, test_f1: 0.4107
 epoch: 7, train_loss: 0.8803, test_loss: 1.1189, test_f1: 0.4522
 epoch: 8, train_loss: 0.8512, test_loss: 1.0398, test_f1: 0.5069
 epoch: 9, train_loss: 0.8133, test_loss: 1.0346, test_f1: 0.5246
 epoch: 10, train_loss: 0.8218, test_loss: 1.0262, test_f1: 0.4982
 epoch: 11, train_loss: 0.7943, test_loss: 1.0343, test_f1: 0.4761
 epoch: 12, train_loss: 0.7625, test_loss: 1.0287, test_f1: 0.5659
 epoch: 13, train_loss: 0.7395, test_loss: 1.0367, test_f1: 0.5710
 epoch: 14, train_loss: 0.7458, test_loss: 1.0795, test_f1: 0.5247
 epoch: 15, train_loss: 0.7531, test_loss: 1.0451, test_f1: 0.5532
 epoch: 16, train_loss: 0.7651, test_loss: 1.1375, test_f1: 0.5512
 epoch: 17, train_loss: 0.7406, test_loss: 1.1212, test_f1: 0.5584
 epoch: 18, train_loss: 0.7427, test_loss: 1.1451, test_f1: 0.5313
 epoch: 19, train_loss: 0.7376, test_loss: 1.2076, test_f1: 0.5306
 epoch: 20, train_loss: 0.6951, test_loss: 1.1713, test_f1: 0.5402
 epoch: 21, train_loss: 0.7470, test_loss: 1.2990, test_f1: 0.5209
 epoch: 22, train_loss: 0.7460, test_loss: 1.1336, test_f1: 0.5717
 epoch: 23, train_loss: 0.7144, test_loss: 1.0766, test_f1: 0.5826
 epoch: 24, train_loss: 0.6967, test_loss: 1.0548, test_f1: 0.6192
 epoch: 25, train_loss: 0.7170, test_loss: 1.0654, test_f1: 0.5553
 epoch: 26, train_loss: 0.6870, test_loss: 1.0937, test_f1: 0.5427
 epoch: 27, train_loss: 0.6666, test_loss: 1.0618, test_f1: 0.5572
 epoch: 28, train_loss: 0.6582, test_loss: 1.0007, test_f1: 0.6000
 epoch: 29, train_loss: 0.6552, test_loss: 1.0847, test_f1: 0.5918
 epoch: 30, train_loss: 0.6267, test_loss: 1.0828, test_f1: 0.6181
 epoch: 31, train_loss: 0.6329, test_loss: 1.0717, test_f1: 0.6157
 epoch: 32, train_loss: 0.5990, test_loss: 1.1020, test_f1: 0.5973
 epoch: 33, train_loss: 0.5794, test_loss: 1.1039, test_f1: 0.5947
 epoch: 34, train_loss: 0.5884, test_loss: 1.0561, test_f1: 0.5836
 epoch: 35, train_loss: 0.5884, test_loss: 1.0906, test_f1: 0.5989
 epoch: 36, train_loss: 0.5764, test_loss: 1.1605, test_f1: 0.5793
 epoch: 37, train_loss: 0.5926, test_loss: 1.2059, test_f1: 0.6151
 epoch: 38, train_loss: 0.5720, test_loss: 1.2357, test_f1: 0.5654
 epoch: 39, train_loss: 0.5841, test_loss: 1.1516, test_f1: 0.6022
 epoch: 40, train_loss: 0.5627, test_loss: 1.1673, test_f1: 0.5963
 epoch: 41, train_loss: 0.5523, test_loss: 1.1010, test_f1: 0.6069
 epoch: 42, train_loss: 0.5561, test_loss: 1.0693, test_f1: 0.6014
 epoch: 43, train_loss: 0.5700, test_loss: 1.1143, test_f1: 0.6199
 epoch: 44, train_loss: 0.5264, test_loss: 1.1738, test_f1: 0.5893
 epoch: 45, train_loss: 0.5262, test_loss: 1.2426, test_f1: 0.5859
 epoch: 46, train_loss: 0.5277, test_loss: 1.3262, test_f1: 0.5386
 epoch: 47, train_loss: 0.5012, test_loss: 1.2457, test_f1: 0.6605
 epoch: 48, train_loss: 0.4992, test_loss: 1.1454, test_f1: 0.6525
 epoch: 49, train_loss: 0.4657, test_loss: 1.2502, test_f1: 0.5796
 epoch: 50, train_loss: 0.4677, test_loss: 1.2391, test_f1: 0.5881
 epoch: 51, train_loss: 0.4666, test_loss: 1.1754, test_f1: 0.6126
 epoch: 52, train_loss: 0.4613, test_loss: 1.2196, test_f1: 0.6290
 epoch: 53, train_loss: 0.4484, test_loss: 1.2166, test_f1: 0.6400
 epoch: 54, train_loss: 0.4623, test_loss: 1.2532, test_f1: 0.6277
 epoch: 55, train_loss: 0.4271, test_loss: 1.1476, test_f1: 0.6381
 epoch: 56, train_loss: 0.4309, test_loss: 1.2396, test_f1: 0.5947
 epoch: 57, train_loss: 0.4217, test_loss: 1.2723, test_f1: 0.5999
 epoch: 58, train_loss: 0.3930, test_loss: 1.2082, test_f1: 0.6048
 epoch: 59, train_loss: 0.3874, test_loss: 1.2322, test_f1: 0.6227
 epoch: 60, train_loss: 0.3963, test_loss: 1.2561, test_f1: 0.6002
 epoch: 61, train_loss: 0.3680, test_loss: 1.2841, test_f1: 0.6279
 epoch: 62, train_loss: 0.3596, test_loss: 1.3382, test_f1: 0.5917
 epoch: 63, train_loss: 0.3634, test_loss: 1.3353, test_f1: 0.6180
 epoch: 64, train_loss: 0.3668, test_loss: 1.3017, test_f1: 0.6200
 epoch: 65, train_loss: 0.3727, test_loss: 1.2963, test_f1: 0.6196
 epoch: 66, train_loss: 0.3812, test_loss: 1.4020, test_f1: 0.6170
 epoch: 67, train_loss: 0.3694, test_loss: 1.3996, test_f1: 0.6212
 epoch: 68, train_loss: 0.3462, test_loss: 1.4100, test_f1: 0.5979
 epoch: 69, train_loss: 0.3293, test_loss: 1.4472, test_f1: 0.6070
 epoch: 70, train_loss: 0.3130, test_loss: 1.3877, test_f1: 0.6141
 epoch: 71, train_loss: 0.3180, test_loss: 1.3722, test_f1: 0.6315
 epoch: 72, train_loss: 0.3450, test_loss: 1.3745, test_f1: 0.6557
 epoch: 73, train_loss: 0.3534, test_loss: 1.6497, test_f1: 0.5988
 epoch: 74, train_loss: 0.3644, test_loss: 1.5493, test_f1: 0.6242
 epoch: 75, train_loss: 0.3543, test_loss: 1.4875, test_f1: 0.6121
 epoch: 76, train_loss: 0.3142, test_loss: 1.4994, test_f1: 0.6104
 epoch: 77, train_loss: 0.3290, test_loss: 1.5606, test_f1: 0.5708
 epoch: 78, train_loss: 0.3167, test_loss: 1.6396, test_f1: 0.5738
 epoch: 79, train_loss: 0.3422, test_loss: 1.7281, test_f1: 0.5806
 epoch: 80, train_loss: 0.3128, test_loss: 1.8104, test_f1: 0.5641
 epoch: 81, train_loss: 0.3006, test_loss: 1.5557, test_f1: 0.5690
 epoch: 82, train_loss: 0.3143, test_loss: 1.5583, test_f1: 0.5421
 epoch: 83, train_loss: 0.2924, test_loss: 1.7445, test_f1: 0.5517
 epoch: 84, train_loss: 0.3066, test_loss: 1.5568, test_f1: 0.6004
 epoch: 85, train_loss: 0.3300, test_loss: 1.6033, test_f1: 0.5856
 epoch: 86, train_loss: 0.3173, test_loss: 1.6714, test_f1: 0.6008
 epoch: 87, train_loss: 0.3117, test_loss: 1.5541, test_f1: 0.6037
 epoch: 88, train_loss: 0.2974, test_loss: 1.5472, test_f1: 0.6131
 epoch: 89, train_loss: 0.2951, test_loss: 1.6406, test_f1: 0.5952
 epoch: 90, train_loss: 0.3128, test_loss: 1.5745, test_f1: 0.5911
 epoch: 91, train_loss: 0.3399, test_loss: 1.7455, test_f1: 0.5897
 epoch: 92, train_loss: 0.3274, test_loss: 1.5936, test_f1: 0.6248
 epoch: 93, train_loss: 0.3069, test_loss: 1.5605, test_f1: 0.6008
 epoch: 94, train_loss: 0.3139, test_loss: 1.6392, test_f1: 0.6085
 epoch: 95, train_loss: 0.2966, test_loss: 1.6093, test_f1: 0.5987
 epoch: 96, train_loss: 0.2978, test_loss: 1.5612, test_f1: 0.5878
 epoch: 97, train_loss: 0.2907, test_loss: 1.6264, test_f1: 0.5863
 epoch: 98, train_loss: 0.2892, test_loss: 1.6587, test_f1: 0.5993
 epoch: 99, train_loss: 0.2684, test_loss: 1.6722, test_f1: 0.5900
##################ITERATION #9 ****************************************
 epoch: 0, train_loss: 1.3109, test_loss: 1.3582, test_f1: 0.1427
 epoch: 1, train_loss: 1.0831, test_loss: 1.3350, test_f1: 0.1814
 epoch: 2, train_loss: 1.0110, test_loss: 1.3816, test_f1: 0.1785
 epoch: 3, train_loss: 0.9735, test_loss: 1.4721, test_f1: 0.1223
 epoch: 4, train_loss: 0.9201, test_loss: 1.6109, test_f1: 0.1191
 epoch: 5, train_loss: 0.8914, test_loss: 1.4999, test_f1: 0.1744
 epoch: 6, train_loss: 0.8831, test_loss: 1.5233, test_f1: 0.2166
 epoch: 7, train_loss: 0.8477, test_loss: 1.2679, test_f1: 0.4137
 epoch: 8, train_loss: 0.8386, test_loss: 1.1093, test_f1: 0.5413
 epoch: 9, train_loss: 0.8113, test_loss: 1.0882, test_f1: 0.5305
 epoch: 10, train_loss: 0.8097, test_loss: 1.1182, test_f1: 0.5197
 epoch: 11, train_loss: 0.7834, test_loss: 1.0910, test_f1: 0.5102
 epoch: 12, train_loss: 0.7837, test_loss: 1.0634, test_f1: 0.5259
 epoch: 13, train_loss: 0.7342, test_loss: 1.0899, test_f1: 0.5463
 epoch: 14, train_loss: 0.7449, test_loss: 1.0415, test_f1: 0.5522
 epoch: 15, train_loss: 0.7457, test_loss: 1.0814, test_f1: 0.5665
 epoch: 16, train_loss: 0.7218, test_loss: 1.0928, test_f1: 0.5824
 epoch: 17, train_loss: 0.6996, test_loss: 1.0635, test_f1: 0.5695
 epoch: 18, train_loss: 0.7023, test_loss: 1.0836, test_f1: 0.5853
 epoch: 19, train_loss: 0.6799, test_loss: 1.1260, test_f1: 0.5579
 epoch: 20, train_loss: 0.6708, test_loss: 1.1530, test_f1: 0.5284
 epoch: 21, train_loss: 0.6703, test_loss: 1.1700, test_f1: 0.5616
 epoch: 22, train_loss: 0.6505, test_loss: 1.2561, test_f1: 0.5343
 epoch: 23, train_loss: 0.6430, test_loss: 1.2425, test_f1: 0.5618
 epoch: 24, train_loss: 0.6870, test_loss: 1.2136, test_f1: 0.5967
 epoch: 25, train_loss: 0.6647, test_loss: 1.1175, test_f1: 0.5818
 epoch: 26, train_loss: 0.6751, test_loss: 1.1332, test_f1: 0.5775
 epoch: 27, train_loss: 0.6601, test_loss: 1.2896, test_f1: 0.5809
 epoch: 28, train_loss: 0.6410, test_loss: 1.2570, test_f1: 0.5787
 epoch: 29, train_loss: 0.6121, test_loss: 1.1922, test_f1: 0.5858
 epoch: 30, train_loss: 0.5951, test_loss: 1.2200, test_f1: 0.5387
 epoch: 31, train_loss: 0.6067, test_loss: 1.2049, test_f1: 0.5270
 epoch: 32, train_loss: 0.5830, test_loss: 1.2824, test_f1: 0.5422
 epoch: 33, train_loss: 0.5816, test_loss: 1.2771, test_f1: 0.5405
 epoch: 34, train_loss: 0.6265, test_loss: 1.2586, test_f1: 0.5692
 epoch: 35, train_loss: 0.5910, test_loss: 1.1757, test_f1: 0.5677
 epoch: 36, train_loss: 0.6116, test_loss: 1.2819, test_f1: 0.5551
 epoch: 37, train_loss: 0.6221, test_loss: 1.2184, test_f1: 0.5661
 epoch: 38, train_loss: 0.6147, test_loss: 1.3859, test_f1: 0.5671
 epoch: 39, train_loss: 0.5863, test_loss: 1.2174, test_f1: 0.5703
 epoch: 40, train_loss: 0.5863, test_loss: 1.4794, test_f1: 0.5488
 epoch: 41, train_loss: 0.5780, test_loss: 1.2369, test_f1: 0.5640
 epoch: 42, train_loss: 0.5671, test_loss: 1.4071, test_f1: 0.5517
 epoch: 43, train_loss: 0.5274, test_loss: 1.4276, test_f1: 0.6017
 epoch: 44, train_loss: 0.5262, test_loss: 1.3659, test_f1: 0.5411
 epoch: 45, train_loss: 0.5695, test_loss: 1.5175, test_f1: 0.4873
 epoch: 46, train_loss: 0.5647, test_loss: 1.4255, test_f1: 0.5713
 epoch: 47, train_loss: 0.5677, test_loss: 1.2933, test_f1: 0.6256
 epoch: 48, train_loss: 0.5342, test_loss: 1.3910, test_f1: 0.5531
 epoch: 49, train_loss: 0.5349, test_loss: 1.3672, test_f1: 0.5856
 epoch: 50, train_loss: 0.5137, test_loss: 1.3485, test_f1: 0.5786
 epoch: 51, train_loss: 0.4982, test_loss: 1.3485, test_f1: 0.5888
 epoch: 52, train_loss: 0.4543, test_loss: 1.3723, test_f1: 0.5991
 epoch: 53, train_loss: 0.4412, test_loss: 1.4061, test_f1: 0.6072
 epoch: 54, train_loss: 0.4322, test_loss: 1.4533, test_f1: 0.5902
 epoch: 55, train_loss: 0.4296, test_loss: 1.4403, test_f1: 0.5983
 epoch: 56, train_loss: 0.4116, test_loss: 1.5270, test_f1: 0.6142
 epoch: 57, train_loss: 0.4298, test_loss: 1.4397, test_f1: 0.6275
 epoch: 58, train_loss: 0.4135, test_loss: 1.4674, test_f1: 0.5875
 epoch: 59, train_loss: 0.3989, test_loss: 1.4278, test_f1: 0.5979
 epoch: 60, train_loss: 0.3917, test_loss: 1.3763, test_f1: 0.6290
 epoch: 61, train_loss: 0.3804, test_loss: 1.4539, test_f1: 0.6390
 epoch: 62, train_loss: 0.3728, test_loss: 1.5223, test_f1: 0.6277
 epoch: 63, train_loss: 0.3848, test_loss: 1.5000, test_f1: 0.6254
 epoch: 64, train_loss: 0.3898, test_loss: 1.4612, test_f1: 0.6092
 epoch: 65, train_loss: 0.3891, test_loss: 1.4496, test_f1: 0.6052
 epoch: 66, train_loss: 0.3733, test_loss: 1.3660, test_f1: 0.5869
 epoch: 67, train_loss: 0.3624, test_loss: 1.5787, test_f1: 0.5894
 epoch: 68, train_loss: 0.3665, test_loss: 1.7121, test_f1: 0.5568
 epoch: 69, train_loss: 0.3617, test_loss: 1.5246, test_f1: 0.5960
 epoch: 70, train_loss: 0.3433, test_loss: 1.5664, test_f1: 0.6012
 epoch: 71, train_loss: 0.3431, test_loss: 1.5939, test_f1: 0.5787
 epoch: 72, train_loss: 0.3731, test_loss: 1.4517, test_f1: 0.6070
 epoch: 73, train_loss: 0.3715, test_loss: 1.5700, test_f1: 0.5873
 epoch: 74, train_loss: 0.3564, test_loss: 1.5332, test_f1: 0.6209
 epoch: 75, train_loss: 0.3431, test_loss: 1.4833, test_f1: 0.5852
 epoch: 76, train_loss: 0.3466, test_loss: 1.5212, test_f1: 0.5597
 epoch: 77, train_loss: 0.3365, test_loss: 1.4941, test_f1: 0.5825
 epoch: 78, train_loss: 0.3415, test_loss: 1.5768, test_f1: 0.5090
 epoch: 79, train_loss: 0.3679, test_loss: 1.6083, test_f1: 0.5627
 epoch: 80, train_loss: 0.3519, test_loss: 1.7990, test_f1: 0.5208
 epoch: 81, train_loss: 0.3351, test_loss: 1.8290, test_f1: 0.5759
 epoch: 82, train_loss: 0.3161, test_loss: 1.7081, test_f1: 0.5916
 epoch: 83, train_loss: 0.2815, test_loss: 1.7133, test_f1: 0.6317
 epoch: 84, train_loss: 0.2937, test_loss: 1.7078, test_f1: 0.5985
 epoch: 85, train_loss: 0.3017, test_loss: 1.7004, test_f1: 0.6296
 epoch: 86, train_loss: 0.3050, test_loss: 1.6307, test_f1: 0.6384
 epoch: 87, train_loss: 0.2786, test_loss: 1.6569, test_f1: 0.6169
 epoch: 88, train_loss: 0.2832, test_loss: 1.7543, test_f1: 0.6252
 epoch: 89, train_loss: 0.2871, test_loss: 1.8320, test_f1: 0.5657
 epoch: 90, train_loss: 0.2806, test_loss: 1.9543, test_f1: 0.5709
 epoch: 91, train_loss: 0.2903, test_loss: 1.7358, test_f1: 0.5950
 epoch: 92, train_loss: 0.2829, test_loss: 1.8000, test_f1: 0.5182
 epoch: 93, train_loss: 0.2738, test_loss: 1.7704, test_f1: 0.6114
 epoch: 94, train_loss: 0.2693, test_loss: 1.8626, test_f1: 0.5972
 epoch: 95, train_loss: 0.2822, test_loss: 1.7099, test_f1: 0.6170
 epoch: 96, train_loss: 0.2683, test_loss: 1.8258, test_f1: 0.6268
 epoch: 97, train_loss: 0.2876, test_loss: 1.9159, test_f1: 0.6285
 epoch: 98, train_loss: 0.2618, test_loss: 1.9045, test_f1: 0.5989
 epoch: 99, train_loss: 0.2574, test_loss: 1.9075, test_f1: 0.6029

Training completed in 419.77 seconds
Best F1: 0.6922 at epoch 74
Mean F1 across iterations: 0.6430  0.0235
========================FINAL RESULTS================================
FEGIN weighted F1: 0.6922  0.0235
python main.py --data ltspice_demos --representation component_pin --model FEGIN --layers 6 --hiddens 64 --batch_size 256 --lr 0.001 --emb_size 128 --epochs 100 --save_appendix component_pin_L6_H64_BS256_LR0.001_E128 --no_val
-----



STDERR:
  File "main.py", line 370, in <module>
    main()
  File "main.py", line 254, in main
    dataset = dataset_class(
  File "/home/philip/projects/ltspice_examples_code_repo/Circuit-Completion-Using-GNNs/component_classification_with_link_prediction_head/evaluation/FEGIN/kernel/circuit_datasets.py", line 15, in __init__
    self.data, self.slices = torch.load(self.processed_paths[0])
  File "/home/philip/.local/lib/python3.8/site-packages/torch/serialization.py", line 1040, in load
    warnings.warn(
  File "/usr/lib/python3.8/warnings.py", line 109, in _showwarnmsg
    sw(msg.message, msg.category, msg.filename, msg.lineno,
  File "main.py", line 47, in warn_with_traceback
    traceback.print_stack(file=log)
/home/philip/projects/ltspice_examples_code_repo/Circuit-Completion-Using-GNNs/component_classification_with_link_prediction_head/evaluation/FEGIN/kernel/circuit_datasets.py:15: FutureWarning: You are using `torch.load` with `weights_only=False` (the current default value), which uses the default pickle module implicitly. It is possible to construct malicious pickle data which will execute arbitrary code during unpickling (See https://github.com/pytorch/pytorch/blob/main/SECURITY.md#untrusted-models for more details). In a future release, the default value for `weights_only` will be flipped to `True`. This limits the functions that could be executed during unpickling. Arbitrary objects will no longer be allowed to be loaded via this mode unless they are explicitly allowlisted by the user via `torch.serialization.add_safe_globals`. We recommend you start setting `weights_only=True` for any use case where you don't have full control of the loaded file. Please open an issue on GitHub for any issues related to this experimental feature.
  self.data, self.slices = torch.load(self.processed_paths[0])
