STDOUT:
Results will be saved in /home/philip/projects/ltspice_examples_code_repo/Circuit-Completion-Using-GNNs/component_classification_with_link_prediction_head/evaluation/FEGIN/results/model_FEGIN_dataset_ltspice_examples
Command line input: python main.py --data ltspice_examples --representation component_pin_net --model FEGIN --layers 6 --hiddens 16 --batch_size 64 --lr 0.01 --emb_size 512 --epochs 100 --save_appendix component_pin_net_L6_H16_BS64_LR0.01_E512 --no_val
 is saved.
-----
ltspice_examples - FEGIN
Using 6 layers, 16 hidden units, h = 2
Loading component_pin_net representation dataset
ENTERED
Training FEGIN on component_pin_net representation
Train: 3558, Test: 846
##################ITERATION #0 ****************************************
 epoch: 0, train_loss: 1.2319, test_loss: 1.0812, test_f1: 0.3422
 epoch: 1, train_loss: 1.0465, test_loss: 1.0128, test_f1: 0.4122
 epoch: 2, train_loss: 1.0100, test_loss: 1.1084, test_f1: 0.4447
 epoch: 3, train_loss: 0.9906, test_loss: 1.0991, test_f1: 0.4074
 epoch: 4, train_loss: 0.9827, test_loss: 0.9833, test_f1: 0.4744
 epoch: 5, train_loss: 0.9719, test_loss: 1.0502, test_f1: 0.4713
 epoch: 6, train_loss: 0.9681, test_loss: 0.9809, test_f1: 0.4703
 epoch: 7, train_loss: 0.9627, test_loss: 0.8903, test_f1: 0.4934
 epoch: 8, train_loss: 0.9444, test_loss: 0.8967, test_f1: 0.4805
 epoch: 9, train_loss: 0.9453, test_loss: 0.9923, test_f1: 0.5041
 epoch: 10, train_loss: 0.9334, test_loss: 0.9083, test_f1: 0.5079
 epoch: 11, train_loss: 0.9505, test_loss: 0.9105, test_f1: 0.4957
 epoch: 12, train_loss: 0.9387, test_loss: 0.9869, test_f1: 0.4961
 epoch: 13, train_loss: 0.9409, test_loss: 0.8975, test_f1: 0.5150
 epoch: 14, train_loss: 0.9221, test_loss: 0.9665, test_f1: 0.5106
 epoch: 15, train_loss: 0.8980, test_loss: 1.0154, test_f1: 0.4936
 epoch: 16, train_loss: 0.9180, test_loss: 0.9016, test_f1: 0.5114
 epoch: 17, train_loss: 0.8996, test_loss: 0.9497, test_f1: 0.4910
 epoch: 18, train_loss: 0.9049, test_loss: 1.0015, test_f1: 0.5003
 epoch: 19, train_loss: 0.8950, test_loss: 0.9562, test_f1: 0.4700
 epoch: 20, train_loss: 0.8803, test_loss: 0.9020, test_f1: 0.5250
 epoch: 21, train_loss: 0.8898, test_loss: 0.8472, test_f1: 0.5185
 epoch: 22, train_loss: 0.8817, test_loss: 0.9874, test_f1: 0.4973
 epoch: 23, train_loss: 0.9163, test_loss: 0.8950, test_f1: 0.5116
 epoch: 24, train_loss: 0.9102, test_loss: 0.9252, test_f1: 0.4915
 epoch: 25, train_loss: 0.8784, test_loss: 0.9011, test_f1: 0.5039
 epoch: 26, train_loss: 0.8711, test_loss: 0.8856, test_f1: 0.5213
 epoch: 27, train_loss: 0.8659, test_loss: 0.8794, test_f1: 0.5300
 epoch: 28, train_loss: 0.8447, test_loss: 0.9571, test_f1: 0.4765
 epoch: 29, train_loss: 0.8633, test_loss: 0.9220, test_f1: 0.5203
 epoch: 30, train_loss: 0.8558, test_loss: 0.8635, test_f1: 0.5424
 epoch: 31, train_loss: 0.8577, test_loss: 0.8660, test_f1: 0.5497
 epoch: 32, train_loss: 0.8437, test_loss: 0.8806, test_f1: 0.5232
 epoch: 33, train_loss: 0.8211, test_loss: 0.8445, test_f1: 0.5356
 epoch: 34, train_loss: 0.8555, test_loss: 0.8591, test_f1: 0.5749
 epoch: 35, train_loss: 0.8436, test_loss: 0.8609, test_f1: 0.5323
 epoch: 36, train_loss: 0.8190, test_loss: 0.8892, test_f1: 0.5148
 epoch: 37, train_loss: 0.8471, test_loss: 0.8297, test_f1: 0.5385
 epoch: 38, train_loss: 0.8359, test_loss: 0.8712, test_f1: 0.5202
 epoch: 39, train_loss: 0.8394, test_loss: 0.8554, test_f1: 0.5393
 epoch: 40, train_loss: 0.8205, test_loss: 0.8862, test_f1: 0.5288
 epoch: 41, train_loss: 0.8257, test_loss: 0.8668, test_f1: 0.5275
 epoch: 42, train_loss: 0.8306, test_loss: 0.8503, test_f1: 0.5225
 epoch: 43, train_loss: 0.8238, test_loss: 0.8460, test_f1: 0.5169
 epoch: 44, train_loss: 0.8228, test_loss: 0.9326, test_f1: 0.4893
 epoch: 45, train_loss: 0.8022, test_loss: 0.8740, test_f1: 0.5221
 epoch: 46, train_loss: 0.7941, test_loss: 0.8268, test_f1: 0.5504
 epoch: 47, train_loss: 0.8136, test_loss: 0.8541, test_f1: 0.5395
 epoch: 48, train_loss: 0.7995, test_loss: 0.9334, test_f1: 0.4996
 epoch: 49, train_loss: 0.8121, test_loss: 0.8751, test_f1: 0.5233
 epoch: 50, train_loss: 0.8107, test_loss: 0.8880, test_f1: 0.5165
 epoch: 51, train_loss: 0.7862, test_loss: 0.8415, test_f1: 0.5361
 epoch: 52, train_loss: 0.7674, test_loss: 0.8088, test_f1: 0.5545
 epoch: 53, train_loss: 0.7623, test_loss: 0.8452, test_f1: 0.5486
 epoch: 54, train_loss: 0.7551, test_loss: 0.8582, test_f1: 0.5510
 epoch: 55, train_loss: 0.7567, test_loss: 0.8915, test_f1: 0.5368
 epoch: 56, train_loss: 0.7486, test_loss: 0.8374, test_f1: 0.5503
 epoch: 57, train_loss: 0.7425, test_loss: 0.8280, test_f1: 0.5442
 epoch: 58, train_loss: 0.7594, test_loss: 0.8619, test_f1: 0.5440
 epoch: 59, train_loss: 0.7356, test_loss: 0.8760, test_f1: 0.5662
 epoch: 60, train_loss: 0.7575, test_loss: 0.8650, test_f1: 0.5484
 epoch: 61, train_loss: 0.7525, test_loss: 0.8459, test_f1: 0.5425
 epoch: 62, train_loss: 0.7330, test_loss: 0.8467, test_f1: 0.5793
 epoch: 63, train_loss: 0.7386, test_loss: 0.8867, test_f1: 0.5749
 epoch: 64, train_loss: 0.7273, test_loss: 0.8288, test_f1: 0.5621
 epoch: 65, train_loss: 0.7291, test_loss: 0.8956, test_f1: 0.5461
 epoch: 66, train_loss: 0.7275, test_loss: 0.8542, test_f1: 0.5527
 epoch: 67, train_loss: 0.7199, test_loss: 0.8472, test_f1: 0.5562
 epoch: 68, train_loss: 0.7351, test_loss: 0.8542, test_f1: 0.5856
 epoch: 69, train_loss: 0.7357, test_loss: 0.8940, test_f1: 0.5568
 epoch: 70, train_loss: 0.7371, test_loss: 0.8514, test_f1: 0.5549
 epoch: 71, train_loss: 0.7191, test_loss: 0.7940, test_f1: 0.5572
 epoch: 72, train_loss: 0.7220, test_loss: 0.8464, test_f1: 0.5553
 epoch: 73, train_loss: 0.7171, test_loss: 0.8404, test_f1: 0.5778
 epoch: 74, train_loss: 0.7129, test_loss: 0.9350, test_f1: 0.5636
 epoch: 75, train_loss: 0.7128, test_loss: 0.8416, test_f1: 0.5608
 epoch: 76, train_loss: 0.7090, test_loss: 0.9419, test_f1: 0.5468
 epoch: 77, train_loss: 0.7226, test_loss: 0.8536, test_f1: 0.5656
 epoch: 78, train_loss: 0.7114, test_loss: 0.8927, test_f1: 0.5898
 epoch: 79, train_loss: 0.7236, test_loss: 0.8264, test_f1: 0.5475
 epoch: 80, train_loss: 0.7100, test_loss: 0.8653, test_f1: 0.5819
 epoch: 81, train_loss: 0.7202, test_loss: 0.7938, test_f1: 0.5660
 epoch: 82, train_loss: 0.7131, test_loss: 0.8680, test_f1: 0.5629
 epoch: 83, train_loss: 0.7157, test_loss: 0.8078, test_f1: 0.5588
 epoch: 84, train_loss: 0.7238, test_loss: 0.8428, test_f1: 0.5888
 epoch: 85, train_loss: 0.7112, test_loss: 0.8391, test_f1: 0.5622
 epoch: 86, train_loss: 0.7007, test_loss: 0.8095, test_f1: 0.6116
 epoch: 87, train_loss: 0.7127, test_loss: 0.8677, test_f1: 0.5549
 epoch: 88, train_loss: 0.7012, test_loss: 0.7607, test_f1: 0.5779
 epoch: 89, train_loss: 0.6958, test_loss: 0.8348, test_f1: 0.5773
 epoch: 90, train_loss: 0.6929, test_loss: 0.7397, test_f1: 0.6234
 epoch: 91, train_loss: 0.7040, test_loss: 0.8493, test_f1: 0.6013
 epoch: 92, train_loss: 0.7059, test_loss: 0.9017, test_f1: 0.6039
 epoch: 93, train_loss: 0.7003, test_loss: 0.7683, test_f1: 0.5777
 epoch: 94, train_loss: 0.7182, test_loss: 0.8409, test_f1: 0.6017
 epoch: 95, train_loss: 0.7090, test_loss: 0.8570, test_f1: 0.5631
 epoch: 96, train_loss: 0.6955, test_loss: 0.8528, test_f1: 0.5969
 epoch: 97, train_loss: 0.7030, test_loss: 0.8747, test_f1: 0.5725
 epoch: 98, train_loss: 0.7020, test_loss: 0.8503, test_f1: 0.6171
 epoch: 99, train_loss: 0.6914, test_loss: 0.8895, test_f1: 0.5625
##################ITERATION #1 ****************************************
 epoch: 0, train_loss: 1.1055, test_loss: 1.0406, test_f1: 0.4424
 epoch: 1, train_loss: 1.0250, test_loss: 1.0849, test_f1: 0.4399
 epoch: 2, train_loss: 0.9978, test_loss: 1.0653, test_f1: 0.4428
 epoch: 3, train_loss: 0.9748, test_loss: 0.9963, test_f1: 0.4735
 epoch: 4, train_loss: 0.9571, test_loss: 1.0301, test_f1: 0.4614
 epoch: 5, train_loss: 0.9524, test_loss: 1.0118, test_f1: 0.4680
 epoch: 6, train_loss: 0.9611, test_loss: 1.0622, test_f1: 0.4588
 epoch: 7, train_loss: 0.9376, test_loss: 0.9574, test_f1: 0.5002
 epoch: 8, train_loss: 0.9384, test_loss: 0.9746, test_f1: 0.5126
 epoch: 9, train_loss: 0.9437, test_loss: 0.9617, test_f1: 0.5046
 epoch: 10, train_loss: 0.9137, test_loss: 0.9108, test_f1: 0.5194
 epoch: 11, train_loss: 0.9177, test_loss: 0.9207, test_f1: 0.5131
 epoch: 12, train_loss: 0.9045, test_loss: 0.9660, test_f1: 0.5457
 epoch: 13, train_loss: 0.9013, test_loss: 0.9798, test_f1: 0.4790
 epoch: 14, train_loss: 0.8946, test_loss: 0.9079, test_f1: 0.5091
 epoch: 15, train_loss: 0.9046, test_loss: 0.9221, test_f1: 0.5144
 epoch: 16, train_loss: 0.8762, test_loss: 1.0426, test_f1: 0.4690
 epoch: 17, train_loss: 0.8842, test_loss: 0.9918, test_f1: 0.4891
 epoch: 18, train_loss: 0.8868, test_loss: 1.0461, test_f1: 0.4763
 epoch: 19, train_loss: 0.8774, test_loss: 0.8854, test_f1: 0.5159
 epoch: 20, train_loss: 0.8597, test_loss: 1.0669, test_f1: 0.4686
 epoch: 21, train_loss: 0.8602, test_loss: 1.0619, test_f1: 0.4643
 epoch: 22, train_loss: 0.8690, test_loss: 0.8653, test_f1: 0.5457
 epoch: 23, train_loss: 0.8515, test_loss: 0.8631, test_f1: 0.5172
 epoch: 24, train_loss: 0.8530, test_loss: 0.8948, test_f1: 0.5144
 epoch: 25, train_loss: 0.8446, test_loss: 1.0298, test_f1: 0.4895
 epoch: 26, train_loss: 0.8299, test_loss: 0.9903, test_f1: 0.4981
 epoch: 27, train_loss: 0.8354, test_loss: 1.0010, test_f1: 0.5068
 epoch: 28, train_loss: 0.8352, test_loss: 0.8866, test_f1: 0.5350
 epoch: 29, train_loss: 0.8423, test_loss: 0.8616, test_f1: 0.5393
 epoch: 30, train_loss: 0.8233, test_loss: 1.1452, test_f1: 0.5345
 epoch: 31, train_loss: 0.8351, test_loss: 0.9406, test_f1: 0.5462
 epoch: 32, train_loss: 0.8431, test_loss: 0.8646, test_f1: 0.5281
 epoch: 33, train_loss: 0.8155, test_loss: 0.8844, test_f1: 0.5395
 epoch: 34, train_loss: 0.8053, test_loss: 0.8807, test_f1: 0.6076
 epoch: 35, train_loss: 0.8197, test_loss: 0.9945, test_f1: 0.5274
 epoch: 36, train_loss: 0.8074, test_loss: 0.9274, test_f1: 0.5450
 epoch: 37, train_loss: 0.8261, test_loss: 0.9463, test_f1: 0.5613
 epoch: 38, train_loss: 0.8100, test_loss: 0.9264, test_f1: 0.5494
 epoch: 39, train_loss: 0.8063, test_loss: 0.8931, test_f1: 0.5722
 epoch: 40, train_loss: 0.8115, test_loss: 0.9384, test_f1: 0.5362
 epoch: 41, train_loss: 0.8036, test_loss: 0.8602, test_f1: 0.5819
 epoch: 42, train_loss: 0.7963, test_loss: 0.9568, test_f1: 0.5511
 epoch: 43, train_loss: 0.8075, test_loss: 0.8915, test_f1: 0.5406
 epoch: 44, train_loss: 0.7863, test_loss: 0.8653, test_f1: 0.5496
 epoch: 45, train_loss: 0.8085, test_loss: 0.8460, test_f1: 0.5458
 epoch: 46, train_loss: 0.7762, test_loss: 0.9654, test_f1: 0.5501
 epoch: 47, train_loss: 0.7914, test_loss: 0.9535, test_f1: 0.5909
 epoch: 48, train_loss: 0.7942, test_loss: 0.9430, test_f1: 0.6048
 epoch: 49, train_loss: 0.7877, test_loss: 0.9687, test_f1: 0.5078
 epoch: 50, train_loss: 0.7821, test_loss: 0.8646, test_f1: 0.5814
 epoch: 51, train_loss: 0.7677, test_loss: 0.8173, test_f1: 0.5864
 epoch: 52, train_loss: 0.7507, test_loss: 0.9229, test_f1: 0.5834
 epoch: 53, train_loss: 0.7508, test_loss: 0.9176, test_f1: 0.6164
 epoch: 54, train_loss: 0.7467, test_loss: 0.8834, test_f1: 0.5864
 epoch: 55, train_loss: 0.7326, test_loss: 0.8730, test_f1: 0.6006
 epoch: 56, train_loss: 0.7467, test_loss: 0.9495, test_f1: 0.6100
 epoch: 57, train_loss: 0.7338, test_loss: 0.9590, test_f1: 0.5619
 epoch: 58, train_loss: 0.7383, test_loss: 0.9316, test_f1: 0.6360
 epoch: 59, train_loss: 0.7446, test_loss: 0.8968, test_f1: 0.5594
 epoch: 60, train_loss: 0.7421, test_loss: 0.9621, test_f1: 0.5734
 epoch: 61, train_loss: 0.7402, test_loss: 0.9212, test_f1: 0.6026
 epoch: 62, train_loss: 0.7303, test_loss: 0.8966, test_f1: 0.6211
 epoch: 63, train_loss: 0.7182, test_loss: 0.8656, test_f1: 0.5948
 epoch: 64, train_loss: 0.7333, test_loss: 0.9166, test_f1: 0.6297
 epoch: 65, train_loss: 0.7268, test_loss: 0.9663, test_f1: 0.6013
 epoch: 66, train_loss: 0.7168, test_loss: 1.1261, test_f1: 0.5607
 epoch: 67, train_loss: 0.7417, test_loss: 1.0147, test_f1: 0.5852
 epoch: 68, train_loss: 0.7237, test_loss: 0.9553, test_f1: 0.6059
 epoch: 69, train_loss: 0.7276, test_loss: 0.9328, test_f1: 0.6356
 epoch: 70, train_loss: 0.7285, test_loss: 0.9873, test_f1: 0.6282
 epoch: 71, train_loss: 0.7201, test_loss: 1.0804, test_f1: 0.6369
 epoch: 72, train_loss: 0.7263, test_loss: 1.0854, test_f1: 0.5867
 epoch: 73, train_loss: 0.7205, test_loss: 0.9232, test_f1: 0.6117
 epoch: 74, train_loss: 0.7220, test_loss: 0.9345, test_f1: 0.6130
 epoch: 75, train_loss: 0.7207, test_loss: 0.9182, test_f1: 0.6200
 epoch: 76, train_loss: 0.7200, test_loss: 0.9311, test_f1: 0.6051
 epoch: 77, train_loss: 0.7097, test_loss: 0.9482, test_f1: 0.5897
 epoch: 78, train_loss: 0.7204, test_loss: 1.2255, test_f1: 0.5629
 epoch: 79, train_loss: 0.7190, test_loss: 1.0173, test_f1: 0.6260
 epoch: 80, train_loss: 0.7032, test_loss: 0.9743, test_f1: 0.6120
 epoch: 81, train_loss: 0.7040, test_loss: 0.9476, test_f1: 0.6405
 epoch: 82, train_loss: 0.6883, test_loss: 1.0165, test_f1: 0.6286
 epoch: 83, train_loss: 0.7264, test_loss: 1.0087, test_f1: 0.6261
 epoch: 84, train_loss: 0.7129, test_loss: 1.1080, test_f1: 0.5905
 epoch: 85, train_loss: 0.7018, test_loss: 1.0713, test_f1: 0.5820
 epoch: 86, train_loss: 0.7154, test_loss: 1.0069, test_f1: 0.6082
 epoch: 87, train_loss: 0.7100, test_loss: 1.1153, test_f1: 0.6104
 epoch: 88, train_loss: 0.7122, test_loss: 0.9393, test_f1: 0.6012
 epoch: 89, train_loss: 0.7008, test_loss: 1.2240, test_f1: 0.5618
 epoch: 90, train_loss: 0.7079, test_loss: 0.9639, test_f1: 0.6144
 epoch: 91, train_loss: 0.6909, test_loss: 0.9931, test_f1: 0.6389
 epoch: 92, train_loss: 0.6832, test_loss: 1.0862, test_f1: 0.6058
 epoch: 93, train_loss: 0.7066, test_loss: 1.0180, test_f1: 0.6277
 epoch: 94, train_loss: 0.6775, test_loss: 1.0706, test_f1: 0.6192
 epoch: 95, train_loss: 0.7043, test_loss: 1.0286, test_f1: 0.6091
 epoch: 96, train_loss: 0.6996, test_loss: 1.0632, test_f1: 0.6383
 epoch: 97, train_loss: 0.7065, test_loss: 0.9586, test_f1: 0.6339
 epoch: 98, train_loss: 0.6783, test_loss: 1.1146, test_f1: 0.6367
 epoch: 99, train_loss: 0.6925, test_loss: 1.0659, test_f1: 0.6124
##################ITERATION #2 ****************************************
 epoch: 0, train_loss: 1.1332, test_loss: 1.1160, test_f1: 0.3907
 epoch: 1, train_loss: 1.0132, test_loss: 1.1640, test_f1: 0.4791
 epoch: 2, train_loss: 0.9979, test_loss: 1.0435, test_f1: 0.5003
 epoch: 3, train_loss: 0.9704, test_loss: 0.9941, test_f1: 0.4872
 epoch: 4, train_loss: 0.9433, test_loss: 1.0681, test_f1: 0.4872
 epoch: 5, train_loss: 0.9525, test_loss: 0.9931, test_f1: 0.4974
 epoch: 6, train_loss: 0.9460, test_loss: 0.9748, test_f1: 0.4966
 epoch: 7, train_loss: 0.9326, test_loss: 1.0127, test_f1: 0.5085
 epoch: 8, train_loss: 0.9312, test_loss: 1.0062, test_f1: 0.5028
 epoch: 9, train_loss: 0.9158, test_loss: 1.0140, test_f1: 0.4890
 epoch: 10, train_loss: 0.9067, test_loss: 0.9351, test_f1: 0.5544
 epoch: 11, train_loss: 0.9166, test_loss: 0.9730, test_f1: 0.5077
 epoch: 12, train_loss: 0.8994, test_loss: 0.9876, test_f1: 0.5219
 epoch: 13, train_loss: 0.9087, test_loss: 0.9636, test_f1: 0.4983
 epoch: 14, train_loss: 0.8931, test_loss: 0.9125, test_f1: 0.5144
 epoch: 15, train_loss: 0.9011, test_loss: 1.0139, test_f1: 0.4765
 epoch: 16, train_loss: 0.8982, test_loss: 0.9463, test_f1: 0.5165
 epoch: 17, train_loss: 0.8962, test_loss: 0.9549, test_f1: 0.5376
 epoch: 18, train_loss: 0.8858, test_loss: 0.9655, test_f1: 0.5384
 epoch: 19, train_loss: 0.8830, test_loss: 1.1150, test_f1: 0.4569
 epoch: 20, train_loss: 0.8956, test_loss: 1.0117, test_f1: 0.4610
 epoch: 21, train_loss: 0.8771, test_loss: 0.9577, test_f1: 0.5261
 epoch: 22, train_loss: 0.8712, test_loss: 0.9586, test_f1: 0.5291
 epoch: 23, train_loss: 0.8609, test_loss: 0.9766, test_f1: 0.4973
 epoch: 24, train_loss: 0.8567, test_loss: 0.8668, test_f1: 0.5381
 epoch: 25, train_loss: 0.8587, test_loss: 0.8762, test_f1: 0.5290
 epoch: 26, train_loss: 0.8528, test_loss: 0.9118, test_f1: 0.5205
 epoch: 27, train_loss: 0.8638, test_loss: 0.9910, test_f1: 0.5213
 epoch: 28, train_loss: 0.8643, test_loss: 0.9023, test_f1: 0.5389
 epoch: 29, train_loss: 0.8612, test_loss: 0.9262, test_f1: 0.5300
 epoch: 30, train_loss: 0.8512, test_loss: 0.8319, test_f1: 0.5575
 epoch: 31, train_loss: 0.8526, test_loss: 0.9267, test_f1: 0.5815
 epoch: 32, train_loss: 0.8530, test_loss: 0.8984, test_f1: 0.5281
 epoch: 33, train_loss: 0.8398, test_loss: 0.9012, test_f1: 0.5149
 epoch: 34, train_loss: 0.8460, test_loss: 0.8547, test_f1: 0.5582
 epoch: 35, train_loss: 0.8476, test_loss: 0.8768, test_f1: 0.5412
 epoch: 36, train_loss: 0.8325, test_loss: 0.8718, test_f1: 0.5633
 epoch: 37, train_loss: 0.8294, test_loss: 0.8385, test_f1: 0.5986
 epoch: 38, train_loss: 0.8301, test_loss: 1.0009, test_f1: 0.4993
 epoch: 39, train_loss: 0.8380, test_loss: 0.9120, test_f1: 0.5663
 epoch: 40, train_loss: 0.8377, test_loss: 0.8629, test_f1: 0.5771
 epoch: 41, train_loss: 0.8225, test_loss: 0.8985, test_f1: 0.5609
 epoch: 42, train_loss: 0.8330, test_loss: 0.8145, test_f1: 0.5651
 epoch: 43, train_loss: 0.8477, test_loss: 0.8648, test_f1: 0.5231
 epoch: 44, train_loss: 0.8270, test_loss: 0.9267, test_f1: 0.5558
 epoch: 45, train_loss: 0.8233, test_loss: 0.8703, test_f1: 0.5610
 epoch: 46, train_loss: 0.8124, test_loss: 0.9127, test_f1: 0.5559
 epoch: 47, train_loss: 0.8268, test_loss: 0.9043, test_f1: 0.5485
 epoch: 48, train_loss: 0.8261, test_loss: 0.9012, test_f1: 0.5470
 epoch: 49, train_loss: 0.8109, test_loss: 0.8527, test_f1: 0.5964
 epoch: 50, train_loss: 0.8099, test_loss: 0.9929, test_f1: 0.5000
 epoch: 51, train_loss: 0.7962, test_loss: 0.8520, test_f1: 0.5816
 epoch: 52, train_loss: 0.7902, test_loss: 0.8715, test_f1: 0.5872
 epoch: 53, train_loss: 0.7784, test_loss: 0.8411, test_f1: 0.6010
 epoch: 54, train_loss: 0.7779, test_loss: 0.8715, test_f1: 0.5884
 epoch: 55, train_loss: 0.7735, test_loss: 0.8772, test_f1: 0.5922
 epoch: 56, train_loss: 0.7906, test_loss: 0.8178, test_f1: 0.5961
 epoch: 57, train_loss: 0.7679, test_loss: 0.8714, test_f1: 0.5762
 epoch: 58, train_loss: 0.7708, test_loss: 0.8610, test_f1: 0.5985
 epoch: 59, train_loss: 0.7654, test_loss: 0.9154, test_f1: 0.5706
 epoch: 60, train_loss: 0.7667, test_loss: 0.8865, test_f1: 0.5570
 epoch: 61, train_loss: 0.7607, test_loss: 0.8318, test_f1: 0.5791
 epoch: 62, train_loss: 0.7678, test_loss: 0.9035, test_f1: 0.5791
 epoch: 63, train_loss: 0.7620, test_loss: 0.9177, test_f1: 0.5570
 epoch: 64, train_loss: 0.7617, test_loss: 0.9789, test_f1: 0.5702
 epoch: 65, train_loss: 0.7623, test_loss: 0.8122, test_f1: 0.6029
 epoch: 66, train_loss: 0.7577, test_loss: 0.8265, test_f1: 0.6110
 epoch: 67, train_loss: 0.7426, test_loss: 0.8439, test_f1: 0.5977
 epoch: 68, train_loss: 0.7641, test_loss: 0.8894, test_f1: 0.5356
 epoch: 69, train_loss: 0.7561, test_loss: 0.8825, test_f1: 0.5630
 epoch: 70, train_loss: 0.7459, test_loss: 0.9097, test_f1: 0.5859
 epoch: 71, train_loss: 0.7553, test_loss: 0.9158, test_f1: 0.5947
 epoch: 72, train_loss: 0.7467, test_loss: 0.9437, test_f1: 0.5808
 epoch: 73, train_loss: 0.7458, test_loss: 0.9195, test_f1: 0.5867
 epoch: 74, train_loss: 0.7495, test_loss: 0.9743, test_f1: 0.6021
 epoch: 75, train_loss: 0.7376, test_loss: 0.8439, test_f1: 0.5977
 epoch: 76, train_loss: 0.7438, test_loss: 0.9233, test_f1: 0.5861
 epoch: 77, train_loss: 0.7593, test_loss: 0.8226, test_f1: 0.6059
 epoch: 78, train_loss: 0.7460, test_loss: 0.8396, test_f1: 0.6153
 epoch: 79, train_loss: 0.7324, test_loss: 0.9171, test_f1: 0.5928
 epoch: 80, train_loss: 0.7435, test_loss: 0.8768, test_f1: 0.6073
 epoch: 81, train_loss: 0.7359, test_loss: 0.8557, test_f1: 0.5964
 epoch: 82, train_loss: 0.7356, test_loss: 0.9400, test_f1: 0.5973
 epoch: 83, train_loss: 0.7283, test_loss: 0.9404, test_f1: 0.5716
 epoch: 84, train_loss: 0.7298, test_loss: 0.9078, test_f1: 0.5808
 epoch: 85, train_loss: 0.7321, test_loss: 0.9621, test_f1: 0.5660
 epoch: 86, train_loss: 0.7326, test_loss: 0.9191, test_f1: 0.5998
 epoch: 87, train_loss: 0.7296, test_loss: 0.9475, test_f1: 0.5805
 epoch: 88, train_loss: 0.7301, test_loss: 0.8767, test_f1: 0.5949
 epoch: 89, train_loss: 0.7308, test_loss: 0.9374, test_f1: 0.5927
 epoch: 90, train_loss: 0.7305, test_loss: 0.8969, test_f1: 0.5956
 epoch: 91, train_loss: 0.7221, test_loss: 0.8527, test_f1: 0.5953
 epoch: 92, train_loss: 0.7449, test_loss: 0.9479, test_f1: 0.5738
 epoch: 93, train_loss: 0.7185, test_loss: 0.8726, test_f1: 0.5664
 epoch: 94, train_loss: 0.7257, test_loss: 0.9625, test_f1: 0.5603
 epoch: 95, train_loss: 0.7166, test_loss: 0.9664, test_f1: 0.5684
 epoch: 96, train_loss: 0.7415, test_loss: 0.9154, test_f1: 0.5899
 epoch: 97, train_loss: 0.7270, test_loss: 0.9275, test_f1: 0.6060
 epoch: 98, train_loss: 0.7182, test_loss: 0.9115, test_f1: 0.5865
 epoch: 99, train_loss: 0.7070, test_loss: 0.9005, test_f1: 0.6120
##################ITERATION #3 ****************************************
 epoch: 0, train_loss: 1.1683, test_loss: 1.0652, test_f1: 0.4053
 epoch: 1, train_loss: 1.0326, test_loss: 1.0368, test_f1: 0.4312
 epoch: 2, train_loss: 1.0055, test_loss: 1.0200, test_f1: 0.4569
 epoch: 3, train_loss: 0.9858, test_loss: 0.9929, test_f1: 0.4739
 epoch: 4, train_loss: 0.9742, test_loss: 1.0453, test_f1: 0.4593
 epoch: 5, train_loss: 0.9826, test_loss: 1.1841, test_f1: 0.4281
 epoch: 6, train_loss: 0.9972, test_loss: 1.0235, test_f1: 0.4899
 epoch: 7, train_loss: 0.9630, test_loss: 0.9698, test_f1: 0.4695
 epoch: 8, train_loss: 0.9442, test_loss: 0.9930, test_f1: 0.5187
 epoch: 9, train_loss: 0.9445, test_loss: 0.9989, test_f1: 0.5025
 epoch: 10, train_loss: 0.9254, test_loss: 0.9754, test_f1: 0.5031
 epoch: 11, train_loss: 0.9188, test_loss: 0.9799, test_f1: 0.4818
 epoch: 12, train_loss: 0.9081, test_loss: 0.9812, test_f1: 0.5080
 epoch: 13, train_loss: 0.8965, test_loss: 0.9698, test_f1: 0.4838
 epoch: 14, train_loss: 0.8945, test_loss: 0.9262, test_f1: 0.5395
 epoch: 15, train_loss: 0.8935, test_loss: 0.9235, test_f1: 0.5434
 epoch: 16, train_loss: 0.8956, test_loss: 0.9140, test_f1: 0.5339
 epoch: 17, train_loss: 0.9055, test_loss: 0.8988, test_f1: 0.5390
 epoch: 18, train_loss: 0.9046, test_loss: 0.9255, test_f1: 0.5250
 epoch: 19, train_loss: 0.8805, test_loss: 1.0106, test_f1: 0.5109
 epoch: 20, train_loss: 0.8668, test_loss: 0.9257, test_f1: 0.5062
 epoch: 21, train_loss: 0.8794, test_loss: 0.9416, test_f1: 0.5127
 epoch: 22, train_loss: 0.8696, test_loss: 0.9304, test_f1: 0.5194
 epoch: 23, train_loss: 0.8753, test_loss: 0.9187, test_f1: 0.5075
 epoch: 24, train_loss: 0.8719, test_loss: 0.9471, test_f1: 0.5071
 epoch: 25, train_loss: 0.8512, test_loss: 0.9200, test_f1: 0.5545
 epoch: 26, train_loss: 0.8390, test_loss: 0.8913, test_f1: 0.5366
 epoch: 27, train_loss: 0.8450, test_loss: 0.9032, test_f1: 0.5238
 epoch: 28, train_loss: 0.8483, test_loss: 0.8937, test_f1: 0.5462
 epoch: 29, train_loss: 0.8487, test_loss: 0.9216, test_f1: 0.5355
 epoch: 30, train_loss: 0.8627, test_loss: 0.9736, test_f1: 0.5046
 epoch: 31, train_loss: 0.8417, test_loss: 0.8922, test_f1: 0.5835
 epoch: 32, train_loss: 0.8402, test_loss: 0.9445, test_f1: 0.5294
 epoch: 33, train_loss: 0.8342, test_loss: 0.9029, test_f1: 0.5460
 epoch: 34, train_loss: 0.8181, test_loss: 0.8980, test_f1: 0.5547
 epoch: 35, train_loss: 0.8410, test_loss: 0.8987, test_f1: 0.5395
 epoch: 36, train_loss: 0.8329, test_loss: 0.9636, test_f1: 0.5078
 epoch: 37, train_loss: 0.8326, test_loss: 0.8799, test_f1: 0.5406
 epoch: 38, train_loss: 0.8259, test_loss: 0.8817, test_f1: 0.5589
 epoch: 39, train_loss: 0.8185, test_loss: 0.8324, test_f1: 0.5945
 epoch: 40, train_loss: 0.8122, test_loss: 0.8874, test_f1: 0.5154
 epoch: 41, train_loss: 0.8094, test_loss: 0.8556, test_f1: 0.5913
 epoch: 42, train_loss: 0.7982, test_loss: 0.8797, test_f1: 0.5516
 epoch: 43, train_loss: 0.8236, test_loss: 0.9719, test_f1: 0.5578
 epoch: 44, train_loss: 0.8247, test_loss: 0.9403, test_f1: 0.5095
 epoch: 45, train_loss: 0.8013, test_loss: 0.9068, test_f1: 0.5717
 epoch: 46, train_loss: 0.8170, test_loss: 0.8611, test_f1: 0.5335
 epoch: 47, train_loss: 0.8253, test_loss: 0.9168, test_f1: 0.5491
 epoch: 48, train_loss: 0.8084, test_loss: 0.8524, test_f1: 0.5876
 epoch: 49, train_loss: 0.8034, test_loss: 0.9277, test_f1: 0.5284
 epoch: 50, train_loss: 0.8068, test_loss: 0.8648, test_f1: 0.5598
 epoch: 51, train_loss: 0.7836, test_loss: 0.8474, test_f1: 0.5639
 epoch: 52, train_loss: 0.7780, test_loss: 0.8906, test_f1: 0.6065
 epoch: 53, train_loss: 0.7689, test_loss: 0.8829, test_f1: 0.5488
 epoch: 54, train_loss: 0.7738, test_loss: 0.8778, test_f1: 0.5526
 epoch: 55, train_loss: 0.7774, test_loss: 0.8887, test_f1: 0.5404
 epoch: 56, train_loss: 0.7615, test_loss: 0.8753, test_f1: 0.5739
 epoch: 57, train_loss: 0.7577, test_loss: 0.8678, test_f1: 0.5967
 epoch: 58, train_loss: 0.7543, test_loss: 0.8869, test_f1: 0.5538
 epoch: 59, train_loss: 0.7629, test_loss: 0.8772, test_f1: 0.6213
 epoch: 60, train_loss: 0.7628, test_loss: 0.8492, test_f1: 0.5774
 epoch: 61, train_loss: 0.7754, test_loss: 0.8677, test_f1: 0.5815
 epoch: 62, train_loss: 0.7492, test_loss: 0.8672, test_f1: 0.5726
 epoch: 63, train_loss: 0.7388, test_loss: 0.8771, test_f1: 0.5643
 epoch: 64, train_loss: 0.7483, test_loss: 0.8946, test_f1: 0.5659
 epoch: 65, train_loss: 0.7501, test_loss: 0.9177, test_f1: 0.5777
 epoch: 66, train_loss: 0.7438, test_loss: 0.8741, test_f1: 0.5884
 epoch: 67, train_loss: 0.7437, test_loss: 0.8746, test_f1: 0.5945
 epoch: 68, train_loss: 0.7425, test_loss: 0.8708, test_f1: 0.5969
 epoch: 69, train_loss: 0.7396, test_loss: 0.8552, test_f1: 0.5823
 epoch: 70, train_loss: 0.7521, test_loss: 0.8849, test_f1: 0.5835
 epoch: 71, train_loss: 0.7377, test_loss: 0.9257, test_f1: 0.5734
 epoch: 72, train_loss: 0.7456, test_loss: 0.8693, test_f1: 0.6046
 epoch: 73, train_loss: 0.7326, test_loss: 0.8999, test_f1: 0.5727
 epoch: 74, train_loss: 0.7347, test_loss: 0.9278, test_f1: 0.5845
 epoch: 75, train_loss: 0.7512, test_loss: 0.8896, test_f1: 0.5808
 epoch: 76, train_loss: 0.7415, test_loss: 1.0045, test_f1: 0.5696
 epoch: 77, train_loss: 0.7333, test_loss: 0.8909, test_f1: 0.5804
 epoch: 78, train_loss: 0.7322, test_loss: 0.8617, test_f1: 0.5698
 epoch: 79, train_loss: 0.7268, test_loss: 0.9095, test_f1: 0.5815
 epoch: 80, train_loss: 0.7241, test_loss: 0.8530, test_f1: 0.5945
 epoch: 81, train_loss: 0.7390, test_loss: 0.8897, test_f1: 0.5712
 epoch: 82, train_loss: 0.7291, test_loss: 0.8725, test_f1: 0.6021
 epoch: 83, train_loss: 0.7374, test_loss: 0.8710, test_f1: 0.5838
 epoch: 84, train_loss: 0.7401, test_loss: 0.9131, test_f1: 0.5766
 epoch: 85, train_loss: 0.7150, test_loss: 0.8897, test_f1: 0.5680
 epoch: 86, train_loss: 0.7233, test_loss: 0.8669, test_f1: 0.6096
 epoch: 87, train_loss: 0.7357, test_loss: 0.9198, test_f1: 0.5853
 epoch: 88, train_loss: 0.7284, test_loss: 0.8617, test_f1: 0.5940
 epoch: 89, train_loss: 0.7194, test_loss: 0.8575, test_f1: 0.6116
 epoch: 90, train_loss: 0.7258, test_loss: 0.8593, test_f1: 0.5928
 epoch: 91, train_loss: 0.7141, test_loss: 0.8680, test_f1: 0.6125
 epoch: 92, train_loss: 0.7007, test_loss: 0.8864, test_f1: 0.5716
 epoch: 93, train_loss: 0.7180, test_loss: 0.9205, test_f1: 0.6074
 epoch: 94, train_loss: 0.6980, test_loss: 0.8924, test_f1: 0.6183
 epoch: 95, train_loss: 0.7038, test_loss: 0.8517, test_f1: 0.5780
 epoch: 96, train_loss: 0.7051, test_loss: 0.8848, test_f1: 0.5799
 epoch: 97, train_loss: 0.7218, test_loss: 0.8385, test_f1: 0.6037
 epoch: 98, train_loss: 0.7192, test_loss: 0.8939, test_f1: 0.5745
 epoch: 99, train_loss: 0.7044, test_loss: 0.8733, test_f1: 0.6064
##################ITERATION #4 ****************************************
 epoch: 0, train_loss: 1.1219, test_loss: 1.1855, test_f1: 0.3481
 epoch: 1, train_loss: 1.0154, test_loss: 1.0624, test_f1: 0.4936
 epoch: 2, train_loss: 0.9922, test_loss: 1.0281, test_f1: 0.4669
 epoch: 3, train_loss: 0.9702, test_loss: 1.0293, test_f1: 0.5017
 epoch: 4, train_loss: 0.9671, test_loss: 1.0475, test_f1: 0.4585
 epoch: 5, train_loss: 0.9723, test_loss: 1.2834, test_f1: 0.3333
 epoch: 6, train_loss: 0.9550, test_loss: 0.9878, test_f1: 0.5268
 epoch: 7, train_loss: 0.9513, test_loss: 0.9912, test_f1: 0.5210
 epoch: 8, train_loss: 0.9333, test_loss: 0.9607, test_f1: 0.5178
 epoch: 9, train_loss: 0.9265, test_loss: 0.9738, test_f1: 0.4666
 epoch: 10, train_loss: 0.9176, test_loss: 0.9506, test_f1: 0.4762
 epoch: 11, train_loss: 0.9268, test_loss: 0.9798, test_f1: 0.4994
 epoch: 12, train_loss: 0.9145, test_loss: 0.9187, test_f1: 0.5299
 epoch: 13, train_loss: 0.9003, test_loss: 0.9386, test_f1: 0.5469
 epoch: 14, train_loss: 0.8999, test_loss: 1.2077, test_f1: 0.4606
 epoch: 15, train_loss: 0.8928, test_loss: 0.9030, test_f1: 0.4753
 epoch: 16, train_loss: 0.8804, test_loss: 0.9424, test_f1: 0.5048
 epoch: 17, train_loss: 0.8889, test_loss: 0.8767, test_f1: 0.5225
 epoch: 18, train_loss: 0.8850, test_loss: 0.9301, test_f1: 0.5080
 epoch: 19, train_loss: 0.8686, test_loss: 0.9166, test_f1: 0.5428
 epoch: 20, train_loss: 0.8640, test_loss: 0.8794, test_f1: 0.5509
 epoch: 21, train_loss: 0.8849, test_loss: 0.9439, test_f1: 0.5232
 epoch: 22, train_loss: 0.8713, test_loss: 0.8986, test_f1: 0.5143
 epoch: 23, train_loss: 0.8670, test_loss: 1.1527, test_f1: 0.4567
 epoch: 24, train_loss: 0.8758, test_loss: 0.8593, test_f1: 0.5414
 epoch: 25, train_loss: 0.8508, test_loss: 0.9755, test_f1: 0.5004
 epoch: 26, train_loss: 0.8729, test_loss: 1.0701, test_f1: 0.4667
 epoch: 27, train_loss: 0.8629, test_loss: 0.9031, test_f1: 0.5238
 epoch: 28, train_loss: 0.8563, test_loss: 0.8283, test_f1: 0.5394
 epoch: 29, train_loss: 0.8494, test_loss: 0.8706, test_f1: 0.5410
 epoch: 30, train_loss: 0.8424, test_loss: 0.9557, test_f1: 0.5054
 epoch: 31, train_loss: 0.8305, test_loss: 0.8606, test_f1: 0.5476
 epoch: 32, train_loss: 0.8398, test_loss: 0.9756, test_f1: 0.5211
 epoch: 33, train_loss: 0.8323, test_loss: 0.8490, test_f1: 0.5602
 epoch: 34, train_loss: 0.8309, test_loss: 1.1026, test_f1: 0.4708
 epoch: 35, train_loss: 0.8344, test_loss: 1.0250, test_f1: 0.4861
 epoch: 36, train_loss: 0.8242, test_loss: 0.8868, test_f1: 0.5353
 epoch: 37, train_loss: 0.8374, test_loss: 0.8596, test_f1: 0.5446
 epoch: 38, train_loss: 0.8125, test_loss: 0.9068, test_f1: 0.5334
 epoch: 39, train_loss: 0.8149, test_loss: 0.9073, test_f1: 0.5344
 epoch: 40, train_loss: 0.8199, test_loss: 0.8541, test_f1: 0.5545
 epoch: 41, train_loss: 0.8282, test_loss: 0.8513, test_f1: 0.5565
 epoch: 42, train_loss: 0.8034, test_loss: 0.8928, test_f1: 0.5321
 epoch: 43, train_loss: 0.8011, test_loss: 0.8495, test_f1: 0.5505
 epoch: 44, train_loss: 0.7985, test_loss: 0.8643, test_f1: 0.5696
 epoch: 45, train_loss: 0.7988, test_loss: 0.8531, test_f1: 0.5696
 epoch: 46, train_loss: 0.7938, test_loss: 0.8345, test_f1: 0.5557
 epoch: 47, train_loss: 0.7970, test_loss: 0.8608, test_f1: 0.5295
 epoch: 48, train_loss: 0.8103, test_loss: 0.8569, test_f1: 0.5214
 epoch: 49, train_loss: 0.7969, test_loss: 0.8599, test_f1: 0.5596
 epoch: 50, train_loss: 0.8243, test_loss: 0.8756, test_f1: 0.5419
 epoch: 51, train_loss: 0.7865, test_loss: 0.8273, test_f1: 0.5701
 epoch: 52, train_loss: 0.7669, test_loss: 0.8200, test_f1: 0.5836
 epoch: 53, train_loss: 0.7685, test_loss: 0.8312, test_f1: 0.5652
 epoch: 54, train_loss: 0.7669, test_loss: 0.8007, test_f1: 0.5773
 epoch: 55, train_loss: 0.7698, test_loss: 0.8734, test_f1: 0.5571
 epoch: 56, train_loss: 0.7596, test_loss: 0.8485, test_f1: 0.5839
 epoch: 57, train_loss: 0.7614, test_loss: 0.8488, test_f1: 0.5606
 epoch: 58, train_loss: 0.7539, test_loss: 0.8996, test_f1: 0.5226
 epoch: 59, train_loss: 0.7561, test_loss: 0.8257, test_f1: 0.6024
 epoch: 60, train_loss: 0.7544, test_loss: 0.8374, test_f1: 0.6096
 epoch: 61, train_loss: 0.7650, test_loss: 0.8421, test_f1: 0.5900
 epoch: 62, train_loss: 0.7555, test_loss: 0.8737, test_f1: 0.5690
 epoch: 63, train_loss: 0.7371, test_loss: 0.8688, test_f1: 0.5590
 epoch: 64, train_loss: 0.7471, test_loss: 0.8506, test_f1: 0.5927
 epoch: 65, train_loss: 0.7432, test_loss: 0.8991, test_f1: 0.5676
 epoch: 66, train_loss: 0.7428, test_loss: 0.8273, test_f1: 0.5939
 epoch: 67, train_loss: 0.7379, test_loss: 0.8235, test_f1: 0.6149
 epoch: 68, train_loss: 0.7423, test_loss: 0.8370, test_f1: 0.5555
 epoch: 69, train_loss: 0.7392, test_loss: 0.8433, test_f1: 0.5767
 epoch: 70, train_loss: 0.7298, test_loss: 0.8235, test_f1: 0.5991
 epoch: 71, train_loss: 0.7451, test_loss: 0.8060, test_f1: 0.6080
 epoch: 72, train_loss: 0.7502, test_loss: 0.8653, test_f1: 0.5659
 epoch: 73, train_loss: 0.7496, test_loss: 0.8293, test_f1: 0.5743
 epoch: 74, train_loss: 0.7293, test_loss: 0.8353, test_f1: 0.6007
 epoch: 75, train_loss: 0.7390, test_loss: 0.8609, test_f1: 0.6139
 epoch: 76, train_loss: 0.7319, test_loss: 0.8471, test_f1: 0.6191
 epoch: 77, train_loss: 0.7405, test_loss: 0.8368, test_f1: 0.6116
 epoch: 78, train_loss: 0.7361, test_loss: 0.8563, test_f1: 0.5841
 epoch: 79, train_loss: 0.7342, test_loss: 0.8720, test_f1: 0.6022
 epoch: 80, train_loss: 0.7441, test_loss: 0.8414, test_f1: 0.5701
 epoch: 81, train_loss: 0.7337, test_loss: 0.8930, test_f1: 0.5978
 epoch: 82, train_loss: 0.7324, test_loss: 0.8260, test_f1: 0.5813
 epoch: 83, train_loss: 0.7371, test_loss: 0.8292, test_f1: 0.5811
 epoch: 84, train_loss: 0.7317, test_loss: 0.8406, test_f1: 0.6382
 epoch: 85, train_loss: 0.7208, test_loss: 0.8406, test_f1: 0.6188
 epoch: 86, train_loss: 0.7311, test_loss: 0.8192, test_f1: 0.6322
 epoch: 87, train_loss: 0.7299, test_loss: 0.8550, test_f1: 0.6269
 epoch: 88, train_loss: 0.7279, test_loss: 0.8441, test_f1: 0.5942
 epoch: 89, train_loss: 0.7250, test_loss: 0.7982, test_f1: 0.6135
 epoch: 90, train_loss: 0.7236, test_loss: 0.8326, test_f1: 0.5916
 epoch: 91, train_loss: 0.7202, test_loss: 0.8366, test_f1: 0.5818
 epoch: 92, train_loss: 0.7350, test_loss: 0.8956, test_f1: 0.6137
 epoch: 93, train_loss: 0.7315, test_loss: 0.8251, test_f1: 0.5893
 epoch: 94, train_loss: 0.7318, test_loss: 0.8473, test_f1: 0.6197
 epoch: 95, train_loss: 0.7152, test_loss: 0.8273, test_f1: 0.6051
 epoch: 96, train_loss: 0.7132, test_loss: 0.8545, test_f1: 0.5909
 epoch: 97, train_loss: 0.7203, test_loss: 0.8330, test_f1: 0.5905
 epoch: 98, train_loss: 0.7267, test_loss: 0.8473, test_f1: 0.5645
 epoch: 99, train_loss: 0.7134, test_loss: 0.8376, test_f1: 0.5900
##################ITERATION #5 ****************************************
 epoch: 0, train_loss: 1.1204, test_loss: 1.0936, test_f1: 0.3468
 epoch: 1, train_loss: 1.0166, test_loss: 0.9998, test_f1: 0.4817
 epoch: 2, train_loss: 1.0022, test_loss: 1.0197, test_f1: 0.4339
 epoch: 3, train_loss: 0.9707, test_loss: 0.9869, test_f1: 0.4798
 epoch: 4, train_loss: 0.9727, test_loss: 1.1207, test_f1: 0.4711
 epoch: 5, train_loss: 0.9517, test_loss: 0.9410, test_f1: 0.4997
 epoch: 6, train_loss: 0.9430, test_loss: 0.9319, test_f1: 0.5084
 epoch: 7, train_loss: 0.9312, test_loss: 0.9805, test_f1: 0.4685
 epoch: 8, train_loss: 0.9153, test_loss: 0.9540, test_f1: 0.5039
 epoch: 9, train_loss: 0.9171, test_loss: 0.8841, test_f1: 0.5165
 epoch: 10, train_loss: 0.9023, test_loss: 0.8788, test_f1: 0.5030
 epoch: 11, train_loss: 0.8793, test_loss: 0.8227, test_f1: 0.5601
 epoch: 12, train_loss: 0.8805, test_loss: 0.8632, test_f1: 0.5295
 epoch: 13, train_loss: 0.8785, test_loss: 0.8547, test_f1: 0.5277
 epoch: 14, train_loss: 0.8760, test_loss: 0.8573, test_f1: 0.5058
 epoch: 15, train_loss: 0.8612, test_loss: 0.9644, test_f1: 0.5234
 epoch: 16, train_loss: 0.8988, test_loss: 0.8292, test_f1: 0.5832
 epoch: 17, train_loss: 0.8864, test_loss: 0.9263, test_f1: 0.5428
 epoch: 18, train_loss: 0.8755, test_loss: 0.8980, test_f1: 0.5286
 epoch: 19, train_loss: 0.8561, test_loss: 0.8234, test_f1: 0.5604
 epoch: 20, train_loss: 0.8646, test_loss: 0.8508, test_f1: 0.5287
 epoch: 21, train_loss: 0.8405, test_loss: 0.8717, test_f1: 0.5728
 epoch: 22, train_loss: 0.8557, test_loss: 0.9602, test_f1: 0.4950
 epoch: 23, train_loss: 0.8513, test_loss: 0.8431, test_f1: 0.5558
 epoch: 24, train_loss: 0.8379, test_loss: 0.8302, test_f1: 0.5479
 epoch: 25, train_loss: 0.8415, test_loss: 0.9111, test_f1: 0.5614
 epoch: 26, train_loss: 0.8279, test_loss: 0.9340, test_f1: 0.5167
 epoch: 27, train_loss: 0.8241, test_loss: 0.8074, test_f1: 0.5710
 epoch: 28, train_loss: 0.8080, test_loss: 0.8331, test_f1: 0.6113
 epoch: 29, train_loss: 0.8267, test_loss: 0.8383, test_f1: 0.5719
 epoch: 30, train_loss: 0.8141, test_loss: 0.8617, test_f1: 0.5913
 epoch: 31, train_loss: 0.8045, test_loss: 0.7932, test_f1: 0.6102
 epoch: 32, train_loss: 0.8260, test_loss: 0.8526, test_f1: 0.5596
 epoch: 33, train_loss: 0.8266, test_loss: 0.8190, test_f1: 0.5290
 epoch: 34, train_loss: 0.8100, test_loss: 0.8161, test_f1: 0.6022
 epoch: 35, train_loss: 0.8304, test_loss: 0.8433, test_f1: 0.5572
 epoch: 36, train_loss: 0.8224, test_loss: 0.8059, test_f1: 0.5972
 epoch: 37, train_loss: 0.7980, test_loss: 0.7732, test_f1: 0.5785
 epoch: 38, train_loss: 0.7913, test_loss: 0.8287, test_f1: 0.5872
 epoch: 39, train_loss: 0.7979, test_loss: 0.7913, test_f1: 0.5643
 epoch: 40, train_loss: 0.8077, test_loss: 0.8159, test_f1: 0.6000
 epoch: 41, train_loss: 0.7948, test_loss: 0.8497, test_f1: 0.5651
 epoch: 42, train_loss: 0.7726, test_loss: 0.8206, test_f1: 0.5556
 epoch: 43, train_loss: 0.7831, test_loss: 0.8505, test_f1: 0.5376
 epoch: 44, train_loss: 0.7950, test_loss: 0.8369, test_f1: 0.5696
 epoch: 45, train_loss: 0.8067, test_loss: 0.8041, test_f1: 0.5547
 epoch: 46, train_loss: 0.8087, test_loss: 0.8638, test_f1: 0.6034
 epoch: 47, train_loss: 0.7933, test_loss: 0.7696, test_f1: 0.5784
 epoch: 48, train_loss: 0.7836, test_loss: 0.7858, test_f1: 0.5853
 epoch: 49, train_loss: 0.7898, test_loss: 0.9138, test_f1: 0.5522
 epoch: 50, train_loss: 0.7947, test_loss: 0.7844, test_f1: 0.5753
 epoch: 51, train_loss: 0.7543, test_loss: 0.8248, test_f1: 0.5755
 epoch: 52, train_loss: 0.7575, test_loss: 0.8172, test_f1: 0.6046
 epoch: 53, train_loss: 0.7434, test_loss: 0.8327, test_f1: 0.5759
 epoch: 54, train_loss: 0.7538, test_loss: 0.8111, test_f1: 0.5849
 epoch: 55, train_loss: 0.7386, test_loss: 0.8003, test_f1: 0.6120
 epoch: 56, train_loss: 0.7491, test_loss: 0.8212, test_f1: 0.5899
 epoch: 57, train_loss: 0.7392, test_loss: 0.8011, test_f1: 0.6098
 epoch: 58, train_loss: 0.7259, test_loss: 0.7995, test_f1: 0.5985
 epoch: 59, train_loss: 0.7381, test_loss: 0.7465, test_f1: 0.6025
 epoch: 60, train_loss: 0.7442, test_loss: 0.8124, test_f1: 0.5999
 epoch: 61, train_loss: 0.7343, test_loss: 0.8275, test_f1: 0.5801
 epoch: 62, train_loss: 0.7359, test_loss: 0.7568, test_f1: 0.6092
 epoch: 63, train_loss: 0.7217, test_loss: 0.8348, test_f1: 0.5948
 epoch: 64, train_loss: 0.7396, test_loss: 0.8016, test_f1: 0.6362
 epoch: 65, train_loss: 0.7331, test_loss: 0.8249, test_f1: 0.5778
 epoch: 66, train_loss: 0.7305, test_loss: 0.7939, test_f1: 0.6128
 epoch: 67, train_loss: 0.7125, test_loss: 0.7935, test_f1: 0.5954
 epoch: 68, train_loss: 0.7159, test_loss: 0.8102, test_f1: 0.6211
 epoch: 69, train_loss: 0.7098, test_loss: 0.8245, test_f1: 0.6070
 epoch: 70, train_loss: 0.7242, test_loss: 0.9158, test_f1: 0.5540
 epoch: 71, train_loss: 0.7335, test_loss: 0.8515, test_f1: 0.6169
 epoch: 72, train_loss: 0.7100, test_loss: 0.7966, test_f1: 0.6108
 epoch: 73, train_loss: 0.7114, test_loss: 0.8146, test_f1: 0.6215
 epoch: 74, train_loss: 0.7049, test_loss: 0.9109, test_f1: 0.5524
 epoch: 75, train_loss: 0.7102, test_loss: 0.7838, test_f1: 0.6216
 epoch: 76, train_loss: 0.6942, test_loss: 0.8185, test_f1: 0.6352
 epoch: 77, train_loss: 0.6960, test_loss: 0.9375, test_f1: 0.5788
 epoch: 78, train_loss: 0.7017, test_loss: 0.8097, test_f1: 0.6260
 epoch: 79, train_loss: 0.7191, test_loss: 0.7777, test_f1: 0.6306
 epoch: 80, train_loss: 0.7049, test_loss: 0.8217, test_f1: 0.6040
 epoch: 81, train_loss: 0.7227, test_loss: 0.7493, test_f1: 0.6194
 epoch: 82, train_loss: 0.7128, test_loss: 0.8633, test_f1: 0.6286
 epoch: 83, train_loss: 0.7067, test_loss: 0.8529, test_f1: 0.6115
 epoch: 84, train_loss: 0.7003, test_loss: 0.8645, test_f1: 0.6070
 epoch: 85, train_loss: 0.7198, test_loss: 0.8598, test_f1: 0.5867
 epoch: 86, train_loss: 0.7015, test_loss: 0.8346, test_f1: 0.6406
 epoch: 87, train_loss: 0.6836, test_loss: 0.8810, test_f1: 0.6435
 epoch: 88, train_loss: 0.7027, test_loss: 0.9024, test_f1: 0.6257
 epoch: 89, train_loss: 0.7103, test_loss: 0.8699, test_f1: 0.6273
 epoch: 90, train_loss: 0.6871, test_loss: 0.9166, test_f1: 0.6338
 epoch: 91, train_loss: 0.6988, test_loss: 0.9135, test_f1: 0.6270
 epoch: 92, train_loss: 0.6721, test_loss: 0.9472, test_f1: 0.6072
 epoch: 93, train_loss: 0.7064, test_loss: 0.8003, test_f1: 0.6175
 epoch: 94, train_loss: 0.6884, test_loss: 0.8236, test_f1: 0.6318
 epoch: 95, train_loss: 0.6865, test_loss: 0.8589, test_f1: 0.6504
 epoch: 96, train_loss: 0.6952, test_loss: 0.8319, test_f1: 0.5928
 epoch: 97, train_loss: 0.7037, test_loss: 0.8599, test_f1: 0.6407
 epoch: 98, train_loss: 0.7038, test_loss: 1.7462, test_f1: 0.4820
 epoch: 99, train_loss: 0.6967, test_loss: 0.7795, test_f1: 0.6471
##################ITERATION #6 ****************************************
 epoch: 0, train_loss: 1.1747, test_loss: 1.0840, test_f1: 0.4696
 epoch: 1, train_loss: 1.0654, test_loss: 1.0646, test_f1: 0.5051
 epoch: 2, train_loss: 1.0132, test_loss: 1.0598, test_f1: 0.4739
 epoch: 3, train_loss: 0.9999, test_loss: 1.0626, test_f1: 0.5127
 epoch: 4, train_loss: 0.9913, test_loss: 1.0981, test_f1: 0.4378
 epoch: 5, train_loss: 1.0282, test_loss: 1.0398, test_f1: 0.4840
 epoch: 6, train_loss: 0.9831, test_loss: 0.9758, test_f1: 0.5382
 epoch: 7, train_loss: 0.9690, test_loss: 1.0405, test_f1: 0.4968
 epoch: 8, train_loss: 0.9609, test_loss: 0.9708, test_f1: 0.4876
 epoch: 9, train_loss: 0.9475, test_loss: 1.2553, test_f1: 0.4076
 epoch: 10, train_loss: 0.9408, test_loss: 0.9665, test_f1: 0.4810
 epoch: 11, train_loss: 0.9458, test_loss: 0.9745, test_f1: 0.4857
 epoch: 12, train_loss: 0.9296, test_loss: 0.9295, test_f1: 0.5050
 epoch: 13, train_loss: 0.9307, test_loss: 1.0548, test_f1: 0.4730
 epoch: 14, train_loss: 0.9308, test_loss: 0.9717, test_f1: 0.5081
 epoch: 15, train_loss: 0.9100, test_loss: 0.9398, test_f1: 0.5777
 epoch: 16, train_loss: 0.9103, test_loss: 0.8701, test_f1: 0.5108
 epoch: 17, train_loss: 0.8935, test_loss: 0.9429, test_f1: 0.5140
 epoch: 18, train_loss: 0.8996, test_loss: 0.9984, test_f1: 0.4860
 epoch: 19, train_loss: 0.9089, test_loss: 1.0249, test_f1: 0.4309
 epoch: 20, train_loss: 0.9046, test_loss: 0.9239, test_f1: 0.5064
 epoch: 21, train_loss: 0.8956, test_loss: 0.9240, test_f1: 0.4907
 epoch: 22, train_loss: 0.9009, test_loss: 0.9456, test_f1: 0.4901
 epoch: 23, train_loss: 0.8933, test_loss: 0.9465, test_f1: 0.5385
 epoch: 24, train_loss: 0.8854, test_loss: 0.9286, test_f1: 0.5285
 epoch: 25, train_loss: 0.8672, test_loss: 0.8983, test_f1: 0.5300
 epoch: 26, train_loss: 0.8684, test_loss: 0.8860, test_f1: 0.5401
 epoch: 27, train_loss: 0.8448, test_loss: 0.9207, test_f1: 0.5820
 epoch: 28, train_loss: 0.8621, test_loss: 1.0037, test_f1: 0.5026
 epoch: 29, train_loss: 0.8562, test_loss: 0.9678, test_f1: 0.4988
 epoch: 30, train_loss: 0.8461, test_loss: 1.0217, test_f1: 0.5083
 epoch: 31, train_loss: 0.8511, test_loss: 0.9769, test_f1: 0.5060
 epoch: 32, train_loss: 0.8709, test_loss: 0.8479, test_f1: 0.5336
 epoch: 33, train_loss: 0.8481, test_loss: 0.9169, test_f1: 0.5319
 epoch: 34, train_loss: 0.8416, test_loss: 0.9046, test_f1: 0.5198
 epoch: 35, train_loss: 0.8449, test_loss: 0.9227, test_f1: 0.5541
 epoch: 36, train_loss: 0.8393, test_loss: 1.0646, test_f1: 0.4697
 epoch: 37, train_loss: 0.8517, test_loss: 0.8832, test_f1: 0.5859
 epoch: 38, train_loss: 0.8328, test_loss: 0.8972, test_f1: 0.5295
 epoch: 39, train_loss: 0.8375, test_loss: 0.9186, test_f1: 0.5309
 epoch: 40, train_loss: 0.8284, test_loss: 0.8420, test_f1: 0.6012
 epoch: 41, train_loss: 0.8486, test_loss: 0.8338, test_f1: 0.5857
 epoch: 42, train_loss: 0.8310, test_loss: 0.9084, test_f1: 0.5608
 epoch: 43, train_loss: 0.8146, test_loss: 0.8471, test_f1: 0.5524
 epoch: 44, train_loss: 0.8255, test_loss: 0.9361, test_f1: 0.5718
 epoch: 45, train_loss: 0.8162, test_loss: 0.8399, test_f1: 0.5422
 epoch: 46, train_loss: 0.8255, test_loss: 0.9410, test_f1: 0.5182
 epoch: 47, train_loss: 0.8168, test_loss: 0.8903, test_f1: 0.5661
 epoch: 48, train_loss: 0.7975, test_loss: 0.9288, test_f1: 0.5684
 epoch: 49, train_loss: 0.8083, test_loss: 0.8743, test_f1: 0.6061
 epoch: 50, train_loss: 0.7998, test_loss: 0.8896, test_f1: 0.5437
 epoch: 51, train_loss: 0.7867, test_loss: 0.8321, test_f1: 0.6012
 epoch: 52, train_loss: 0.7937, test_loss: 0.8285, test_f1: 0.5942
 epoch: 53, train_loss: 0.7824, test_loss: 0.8730, test_f1: 0.5724
 epoch: 54, train_loss: 0.7825, test_loss: 0.8305, test_f1: 0.5813
 epoch: 55, train_loss: 0.7668, test_loss: 0.8558, test_f1: 0.5637
 epoch: 56, train_loss: 0.7593, test_loss: 0.8343, test_f1: 0.5899
 epoch: 57, train_loss: 0.7616, test_loss: 0.8463, test_f1: 0.6019
 epoch: 58, train_loss: 0.7647, test_loss: 0.8461, test_f1: 0.6051
 epoch: 59, train_loss: 0.7701, test_loss: 0.8262, test_f1: 0.6155
 epoch: 60, train_loss: 0.7668, test_loss: 0.8225, test_f1: 0.5789
 epoch: 61, train_loss: 0.7581, test_loss: 0.8467, test_f1: 0.5932
 epoch: 62, train_loss: 0.7589, test_loss: 0.8301, test_f1: 0.5894
 epoch: 63, train_loss: 0.7633, test_loss: 0.8634, test_f1: 0.5938
 epoch: 64, train_loss: 0.7469, test_loss: 0.8350, test_f1: 0.5762
 epoch: 65, train_loss: 0.7611, test_loss: 0.8540, test_f1: 0.6020
 epoch: 66, train_loss: 0.7508, test_loss: 0.8515, test_f1: 0.5744
 epoch: 67, train_loss: 0.7654, test_loss: 0.8401, test_f1: 0.5948
 epoch: 68, train_loss: 0.7686, test_loss: 0.8637, test_f1: 0.5710
 epoch: 69, train_loss: 0.7623, test_loss: 0.8668, test_f1: 0.5825
 epoch: 70, train_loss: 0.7509, test_loss: 0.8361, test_f1: 0.5844
 epoch: 71, train_loss: 0.7477, test_loss: 0.8181, test_f1: 0.5882
 epoch: 72, train_loss: 0.7395, test_loss: 0.8283, test_f1: 0.5734
 epoch: 73, train_loss: 0.7531, test_loss: 0.8114, test_f1: 0.5874
 epoch: 74, train_loss: 0.7397, test_loss: 0.8797, test_f1: 0.5650
 epoch: 75, train_loss: 0.7695, test_loss: 0.8010, test_f1: 0.6351
 epoch: 76, train_loss: 0.7415, test_loss: 0.8239, test_f1: 0.5605
 epoch: 77, train_loss: 0.7494, test_loss: 0.8288, test_f1: 0.5764
 epoch: 78, train_loss: 0.7367, test_loss: 0.8405, test_f1: 0.5752
 epoch: 79, train_loss: 0.7452, test_loss: 0.8581, test_f1: 0.6193
 epoch: 80, train_loss: 0.7240, test_loss: 0.8895, test_f1: 0.5771
 epoch: 81, train_loss: 0.7380, test_loss: 0.8394, test_f1: 0.6070
 epoch: 82, train_loss: 0.7478, test_loss: 0.8943, test_f1: 0.5983
 epoch: 83, train_loss: 0.7314, test_loss: 0.8648, test_f1: 0.6293
 epoch: 84, train_loss: 0.7244, test_loss: 0.8404, test_f1: 0.5854
 epoch: 85, train_loss: 0.7439, test_loss: 0.8219, test_f1: 0.5767
 epoch: 86, train_loss: 0.7279, test_loss: 0.8584, test_f1: 0.6029
 epoch: 87, train_loss: 0.7236, test_loss: 0.9000, test_f1: 0.5940
 epoch: 88, train_loss: 0.7328, test_loss: 0.8067, test_f1: 0.6095
 epoch: 89, train_loss: 0.7333, test_loss: 0.8621, test_f1: 0.6001
 epoch: 90, train_loss: 0.7425, test_loss: 0.8611, test_f1: 0.5992
 epoch: 91, train_loss: 0.7259, test_loss: 0.8959, test_f1: 0.6353
 epoch: 92, train_loss: 0.7318, test_loss: 0.8641, test_f1: 0.6194
 epoch: 93, train_loss: 0.7354, test_loss: 0.8536, test_f1: 0.6032
 epoch: 94, train_loss: 0.7274, test_loss: 0.8437, test_f1: 0.6378
 epoch: 95, train_loss: 0.7268, test_loss: 0.8565, test_f1: 0.5905
 epoch: 96, train_loss: 0.7277, test_loss: 0.8523, test_f1: 0.6323
 epoch: 97, train_loss: 0.7236, test_loss: 0.8163, test_f1: 0.6087
 epoch: 98, train_loss: 0.7260, test_loss: 0.8132, test_f1: 0.6214
 epoch: 99, train_loss: 0.7190, test_loss: 0.8740, test_f1: 0.6077
##################ITERATION #7 ****************************************
 epoch: 0, train_loss: 1.1195, test_loss: 1.0380, test_f1: 0.4958
 epoch: 1, train_loss: 1.0255, test_loss: 1.0460, test_f1: 0.4567
 epoch: 2, train_loss: 0.9994, test_loss: 1.0981, test_f1: 0.4288
 epoch: 3, train_loss: 1.0043, test_loss: 1.0225, test_f1: 0.4646
 epoch: 4, train_loss: 0.9993, test_loss: 1.0459, test_f1: 0.4850
 epoch: 5, train_loss: 0.9847, test_loss: 1.0409, test_f1: 0.5235
 epoch: 6, train_loss: 0.9635, test_loss: 1.0066, test_f1: 0.5316
 epoch: 7, train_loss: 0.9496, test_loss: 0.9867, test_f1: 0.5027
 epoch: 8, train_loss: 0.9528, test_loss: 1.0279, test_f1: 0.5229
 epoch: 9, train_loss: 0.9513, test_loss: 0.9784, test_f1: 0.5102
 epoch: 10, train_loss: 0.9359, test_loss: 0.9779, test_f1: 0.5552
 epoch: 11, train_loss: 0.9378, test_loss: 0.9961, test_f1: 0.4957
 epoch: 12, train_loss: 0.9262, test_loss: 0.9912, test_f1: 0.5225
 epoch: 13, train_loss: 0.9175, test_loss: 0.9661, test_f1: 0.5183
 epoch: 14, train_loss: 0.9074, test_loss: 1.0601, test_f1: 0.5117
 epoch: 15, train_loss: 0.9112, test_loss: 0.9774, test_f1: 0.5111
 epoch: 16, train_loss: 0.8946, test_loss: 0.9765, test_f1: 0.5577
 epoch: 17, train_loss: 0.9159, test_loss: 0.9697, test_f1: 0.5239
 epoch: 18, train_loss: 0.9003, test_loss: 0.9282, test_f1: 0.4636
 epoch: 19, train_loss: 0.8968, test_loss: 0.9351, test_f1: 0.4977
 epoch: 20, train_loss: 0.8827, test_loss: 0.8918, test_f1: 0.5509
 epoch: 21, train_loss: 0.8912, test_loss: 0.9436, test_f1: 0.5488
 epoch: 22, train_loss: 0.9164, test_loss: 0.9396, test_f1: 0.5635
 epoch: 23, train_loss: 0.8975, test_loss: 0.9273, test_f1: 0.5379
 epoch: 24, train_loss: 0.8974, test_loss: 0.9970, test_f1: 0.4634
 epoch: 25, train_loss: 0.8846, test_loss: 0.9592, test_f1: 0.5017
 epoch: 26, train_loss: 0.8805, test_loss: 1.0243, test_f1: 0.4995
 epoch: 27, train_loss: 0.9006, test_loss: 0.9432, test_f1: 0.5527
 epoch: 28, train_loss: 0.8866, test_loss: 0.9712, test_f1: 0.5387
 epoch: 29, train_loss: 0.8783, test_loss: 0.9124, test_f1: 0.5634
 epoch: 30, train_loss: 0.8814, test_loss: 0.9101, test_f1: 0.5793
 epoch: 31, train_loss: 0.8670, test_loss: 1.0634, test_f1: 0.5211
 epoch: 32, train_loss: 0.8710, test_loss: 0.9529, test_f1: 0.5306
 epoch: 33, train_loss: 0.8535, test_loss: 0.9612, test_f1: 0.5509
 epoch: 34, train_loss: 0.8668, test_loss: 0.9544, test_f1: 0.4795
 epoch: 35, train_loss: 0.8693, test_loss: 1.0290, test_f1: 0.4980
 epoch: 36, train_loss: 0.8769, test_loss: 0.9482, test_f1: 0.5397
 epoch: 37, train_loss: 0.8587, test_loss: 0.9147, test_f1: 0.5392
 epoch: 38, train_loss: 0.8418, test_loss: 0.9755, test_f1: 0.5860
 epoch: 39, train_loss: 0.8368, test_loss: 1.0157, test_f1: 0.5302
 epoch: 40, train_loss: 0.8589, test_loss: 0.9264, test_f1: 0.5745
 epoch: 41, train_loss: 0.8805, test_loss: 0.9739, test_f1: 0.4472
 epoch: 42, train_loss: 0.8695, test_loss: 0.9225, test_f1: 0.5502
 epoch: 43, train_loss: 0.8547, test_loss: 0.9442, test_f1: 0.5326
 epoch: 44, train_loss: 0.8592, test_loss: 0.9250, test_f1: 0.5368
 epoch: 45, train_loss: 0.8589, test_loss: 0.9325, test_f1: 0.5343
 epoch: 46, train_loss: 0.8375, test_loss: 0.8923, test_f1: 0.5879
 epoch: 47, train_loss: 0.8395, test_loss: 0.8606, test_f1: 0.5893
 epoch: 48, train_loss: 0.8373, test_loss: 0.9531, test_f1: 0.5468
 epoch: 49, train_loss: 0.8293, test_loss: 0.8807, test_f1: 0.5596
 epoch: 50, train_loss: 0.8324, test_loss: 0.9060, test_f1: 0.6015
 epoch: 51, train_loss: 0.7952, test_loss: 0.9111, test_f1: 0.6100
 epoch: 52, train_loss: 0.8030, test_loss: 0.9910, test_f1: 0.5358
 epoch: 53, train_loss: 0.7786, test_loss: 0.8995, test_f1: 0.6119
 epoch: 54, train_loss: 0.7866, test_loss: 0.8616, test_f1: 0.6131
 epoch: 55, train_loss: 0.7805, test_loss: 0.8825, test_f1: 0.6005
 epoch: 56, train_loss: 0.8002, test_loss: 0.8926, test_f1: 0.5861
 epoch: 57, train_loss: 0.7871, test_loss: 0.9150, test_f1: 0.5895
 epoch: 58, train_loss: 0.7739, test_loss: 0.8880, test_f1: 0.6241
 epoch: 59, train_loss: 0.7797, test_loss: 0.8719, test_f1: 0.6173
 epoch: 60, train_loss: 0.7813, test_loss: 0.8785, test_f1: 0.6227
 epoch: 61, train_loss: 0.7878, test_loss: 0.8899, test_f1: 0.6249
 epoch: 62, train_loss: 0.7723, test_loss: 0.9014, test_f1: 0.5592
 epoch: 63, train_loss: 0.7776, test_loss: 0.9329, test_f1: 0.5811
 epoch: 64, train_loss: 0.7776, test_loss: 0.8644, test_f1: 0.6077
 epoch: 65, train_loss: 0.7633, test_loss: 0.8836, test_f1: 0.6231
 epoch: 66, train_loss: 0.7637, test_loss: 0.8850, test_f1: 0.6061
 epoch: 67, train_loss: 0.7674, test_loss: 0.8552, test_f1: 0.6053
 epoch: 68, train_loss: 0.7612, test_loss: 0.9300, test_f1: 0.5990
 epoch: 69, train_loss: 0.7723, test_loss: 0.9426, test_f1: 0.5570
 epoch: 70, train_loss: 0.7711, test_loss: 0.8631, test_f1: 0.6283
 epoch: 71, train_loss: 0.7761, test_loss: 0.8897, test_f1: 0.6030
 epoch: 72, train_loss: 0.7704, test_loss: 0.8461, test_f1: 0.6462
 epoch: 73, train_loss: 0.7618, test_loss: 0.8545, test_f1: 0.6093
 epoch: 74, train_loss: 0.7605, test_loss: 0.8635, test_f1: 0.6359
 epoch: 75, train_loss: 0.7569, test_loss: 0.8513, test_f1: 0.6147
 epoch: 76, train_loss: 0.7529, test_loss: 0.8286, test_f1: 0.6211
 epoch: 77, train_loss: 0.7561, test_loss: 0.8738, test_f1: 0.6218
 epoch: 78, train_loss: 0.7508, test_loss: 0.9250, test_f1: 0.6272
 epoch: 79, train_loss: 0.7528, test_loss: 0.8792, test_f1: 0.6267
 epoch: 80, train_loss: 0.7499, test_loss: 0.8928, test_f1: 0.5900
 epoch: 81, train_loss: 0.7404, test_loss: 0.9409, test_f1: 0.6121
 epoch: 82, train_loss: 0.7727, test_loss: 0.8902, test_f1: 0.6213
 epoch: 83, train_loss: 0.7435, test_loss: 0.8842, test_f1: 0.6127
 epoch: 84, train_loss: 0.7534, test_loss: 0.8928, test_f1: 0.6152
 epoch: 85, train_loss: 0.7466, test_loss: 0.8697, test_f1: 0.6409
 epoch: 86, train_loss: 0.7310, test_loss: 0.8981, test_f1: 0.6203
 epoch: 87, train_loss: 0.7418, test_loss: 0.9060, test_f1: 0.6402
 epoch: 88, train_loss: 0.7354, test_loss: 0.8693, test_f1: 0.6191
 epoch: 89, train_loss: 0.7411, test_loss: 0.8561, test_f1: 0.6176
 epoch: 90, train_loss: 0.7235, test_loss: 0.9315, test_f1: 0.6055
 epoch: 91, train_loss: 0.7270, test_loss: 0.9117, test_f1: 0.6249
 epoch: 92, train_loss: 0.7442, test_loss: 0.9492, test_f1: 0.5808
 epoch: 93, train_loss: 0.7385, test_loss: 0.9598, test_f1: 0.5929
 epoch: 94, train_loss: 0.7400, test_loss: 0.9142, test_f1: 0.5948
 epoch: 95, train_loss: 0.7453, test_loss: 0.8330, test_f1: 0.6222
 epoch: 96, train_loss: 0.7391, test_loss: 0.8297, test_f1: 0.6119
 epoch: 97, train_loss: 0.7327, test_loss: 0.8256, test_f1: 0.6243
 epoch: 98, train_loss: 0.7363, test_loss: 0.8404, test_f1: 0.6219
 epoch: 99, train_loss: 0.7404, test_loss: 0.8227, test_f1: 0.6173
##################ITERATION #8 ****************************************
 epoch: 0, train_loss: 1.1574, test_loss: 1.1021, test_f1: 0.4208
 epoch: 1, train_loss: 1.0200, test_loss: 1.1231, test_f1: 0.4427
 epoch: 2, train_loss: 0.9895, test_loss: 1.0232, test_f1: 0.4767
 epoch: 3, train_loss: 0.9838, test_loss: 1.0196, test_f1: 0.5000
 epoch: 4, train_loss: 0.9758, test_loss: 1.0289, test_f1: 0.5065
 epoch: 5, train_loss: 0.9685, test_loss: 0.9550, test_f1: 0.5629
 epoch: 6, train_loss: 0.9382, test_loss: 1.0011, test_f1: 0.5226
 epoch: 7, train_loss: 0.9362, test_loss: 0.9099, test_f1: 0.5116
 epoch: 8, train_loss: 0.9519, test_loss: 0.9328, test_f1: 0.5163
 epoch: 9, train_loss: 0.9274, test_loss: 0.9605, test_f1: 0.5116
 epoch: 10, train_loss: 0.9230, test_loss: 0.9636, test_f1: 0.5189
 epoch: 11, train_loss: 0.9442, test_loss: 1.2997, test_f1: 0.4121
 epoch: 12, train_loss: 0.9550, test_loss: 0.9130, test_f1: 0.5092
 epoch: 13, train_loss: 0.9286, test_loss: 0.9126, test_f1: 0.5340
 epoch: 14, train_loss: 0.9186, test_loss: 0.9335, test_f1: 0.5035
 epoch: 15, train_loss: 0.9197, test_loss: 1.0573, test_f1: 0.4788
 epoch: 16, train_loss: 0.9233, test_loss: 0.9348, test_f1: 0.5053
 epoch: 17, train_loss: 0.9088, test_loss: 0.9000, test_f1: 0.5257
 epoch: 18, train_loss: 0.8856, test_loss: 0.9898, test_f1: 0.4832
 epoch: 19, train_loss: 0.9006, test_loss: 0.8802, test_f1: 0.5262
 epoch: 20, train_loss: 0.8874, test_loss: 0.8752, test_f1: 0.5316
 epoch: 21, train_loss: 0.8783, test_loss: 0.9835, test_f1: 0.5163
 epoch: 22, train_loss: 0.8871, test_loss: 0.8552, test_f1: 0.5353
 epoch: 23, train_loss: 0.8749, test_loss: 0.8741, test_f1: 0.5267
 epoch: 24, train_loss: 0.9005, test_loss: 0.9072, test_f1: 0.5638
 epoch: 25, train_loss: 0.8753, test_loss: 0.9012, test_f1: 0.5273
 epoch: 26, train_loss: 0.8757, test_loss: 0.9966, test_f1: 0.4899
 epoch: 27, train_loss: 0.8652, test_loss: 1.0192, test_f1: 0.5372
 epoch: 28, train_loss: 0.8608, test_loss: 0.8568, test_f1: 0.5488
 epoch: 29, train_loss: 0.8661, test_loss: 0.9355, test_f1: 0.5301
 epoch: 30, train_loss: 0.8710, test_loss: 0.9565, test_f1: 0.5281
 epoch: 31, train_loss: 0.8571, test_loss: 0.8371, test_f1: 0.5389
 epoch: 32, train_loss: 0.8645, test_loss: 1.0045, test_f1: 0.5072
 epoch: 33, train_loss: 0.8649, test_loss: 0.8924, test_f1: 0.5567
 epoch: 34, train_loss: 0.8438, test_loss: 0.8257, test_f1: 0.5794
 epoch: 35, train_loss: 0.8544, test_loss: 0.8348, test_f1: 0.5869
 epoch: 36, train_loss: 0.8485, test_loss: 0.8061, test_f1: 0.5786
 epoch: 37, train_loss: 0.8183, test_loss: 0.9193, test_f1: 0.5422
 epoch: 38, train_loss: 0.8530, test_loss: 0.9151, test_f1: 0.5331
 epoch: 39, train_loss: 0.8270, test_loss: 0.8991, test_f1: 0.5370
 epoch: 40, train_loss: 0.8379, test_loss: 0.8116, test_f1: 0.5991
 epoch: 41, train_loss: 0.8343, test_loss: 0.8847, test_f1: 0.5930
 epoch: 42, train_loss: 0.8063, test_loss: 0.8790, test_f1: 0.5464
 epoch: 43, train_loss: 0.8336, test_loss: 0.8887, test_f1: 0.5572
 epoch: 44, train_loss: 0.8288, test_loss: 0.9028, test_f1: 0.5659
 epoch: 45, train_loss: 0.8157, test_loss: 0.8638, test_f1: 0.5820
 epoch: 46, train_loss: 0.8320, test_loss: 0.8552, test_f1: 0.6064
 epoch: 47, train_loss: 0.8060, test_loss: 0.8756, test_f1: 0.5997
 epoch: 48, train_loss: 0.8211, test_loss: 0.9781, test_f1: 0.5154
 epoch: 49, train_loss: 0.8227, test_loss: 0.7724, test_f1: 0.5914
 epoch: 50, train_loss: 0.8006, test_loss: 0.8260, test_f1: 0.5706
 epoch: 51, train_loss: 0.7908, test_loss: 0.8145, test_f1: 0.6136
 epoch: 52, train_loss: 0.7727, test_loss: 0.7858, test_f1: 0.6012
 epoch: 53, train_loss: 0.7640, test_loss: 0.7989, test_f1: 0.6179
 epoch: 54, train_loss: 0.7661, test_loss: 0.7972, test_f1: 0.5924
 epoch: 55, train_loss: 0.7701, test_loss: 0.8134, test_f1: 0.5919
 epoch: 56, train_loss: 0.7596, test_loss: 0.8001, test_f1: 0.6191
 epoch: 57, train_loss: 0.7649, test_loss: 0.8135, test_f1: 0.6018
 epoch: 58, train_loss: 0.7557, test_loss: 0.8224, test_f1: 0.6336
 epoch: 59, train_loss: 0.7616, test_loss: 0.8263, test_f1: 0.6324
 epoch: 60, train_loss: 0.7592, test_loss: 0.8191, test_f1: 0.6217
 epoch: 61, train_loss: 0.7463, test_loss: 0.7906, test_f1: 0.6193
 epoch: 62, train_loss: 0.7411, test_loss: 0.8202, test_f1: 0.6384
 epoch: 63, train_loss: 0.7513, test_loss: 0.7960, test_f1: 0.5949
 epoch: 64, train_loss: 0.7464, test_loss: 0.9872, test_f1: 0.5164
 epoch: 65, train_loss: 0.7354, test_loss: 0.8053, test_f1: 0.6235
 epoch: 66, train_loss: 0.7314, test_loss: 0.8363, test_f1: 0.6230
 epoch: 67, train_loss: 0.7400, test_loss: 0.8337, test_f1: 0.6096
 epoch: 68, train_loss: 0.7362, test_loss: 0.8104, test_f1: 0.6375
 epoch: 69, train_loss: 0.7316, test_loss: 0.8424, test_f1: 0.6145
 epoch: 70, train_loss: 0.7565, test_loss: 0.7975, test_f1: 0.6276
 epoch: 71, train_loss: 0.7277, test_loss: 0.8275, test_f1: 0.6540
 epoch: 72, train_loss: 0.7341, test_loss: 0.8163, test_f1: 0.6241
 epoch: 73, train_loss: 0.7331, test_loss: 0.8598, test_f1: 0.6116
 epoch: 74, train_loss: 0.7275, test_loss: 0.8138, test_f1: 0.6333
 epoch: 75, train_loss: 0.7390, test_loss: 0.7822, test_f1: 0.6365
 epoch: 76, train_loss: 0.7355, test_loss: 0.7985, test_f1: 0.6123
 epoch: 77, train_loss: 0.7383, test_loss: 0.8060, test_f1: 0.6413
 epoch: 78, train_loss: 0.7250, test_loss: 0.8355, test_f1: 0.6304
 epoch: 79, train_loss: 0.7245, test_loss: 0.8252, test_f1: 0.6230
 epoch: 80, train_loss: 0.7248, test_loss: 0.8352, test_f1: 0.6295
 epoch: 81, train_loss: 0.7349, test_loss: 0.8368, test_f1: 0.5783
 epoch: 82, train_loss: 0.7330, test_loss: 0.7961, test_f1: 0.6321
 epoch: 83, train_loss: 0.7397, test_loss: 0.8285, test_f1: 0.6451
 epoch: 84, train_loss: 0.7265, test_loss: 0.7537, test_f1: 0.6140
 epoch: 85, train_loss: 0.7158, test_loss: 0.7833, test_f1: 0.6626
 epoch: 86, train_loss: 0.7224, test_loss: 0.8032, test_f1: 0.6138
 epoch: 87, train_loss: 0.7092, test_loss: 0.8375, test_f1: 0.6327
 epoch: 88, train_loss: 0.7271, test_loss: 0.7884, test_f1: 0.6518
 epoch: 89, train_loss: 0.7183, test_loss: 0.7860, test_f1: 0.6511
 epoch: 90, train_loss: 0.7332, test_loss: 0.8367, test_f1: 0.6400
 epoch: 91, train_loss: 0.7214, test_loss: 0.8764, test_f1: 0.6221
 epoch: 92, train_loss: 0.7051, test_loss: 0.8488, test_f1: 0.6348
 epoch: 93, train_loss: 0.7197, test_loss: 0.8364, test_f1: 0.6276
 epoch: 94, train_loss: 0.7152, test_loss: 0.7860, test_f1: 0.6274
 epoch: 95, train_loss: 0.7083, test_loss: 0.8408, test_f1: 0.6134
 epoch: 96, train_loss: 0.7080, test_loss: 0.8442, test_f1: 0.6086
 epoch: 97, train_loss: 0.7076, test_loss: 0.8402, test_f1: 0.6219
 epoch: 98, train_loss: 0.6973, test_loss: 0.8212, test_f1: 0.6268
 epoch: 99, train_loss: 0.7029, test_loss: 0.8027, test_f1: 0.6343
##################ITERATION #9 ****************************************
 epoch: 0, train_loss: 1.1549, test_loss: 1.1469, test_f1: 0.3639
 epoch: 1, train_loss: 1.0478, test_loss: 1.0707, test_f1: 0.4296
 epoch: 2, train_loss: 1.0250, test_loss: 1.0341, test_f1: 0.4429
 epoch: 3, train_loss: 1.0149, test_loss: 1.0476, test_f1: 0.4691
 epoch: 4, train_loss: 0.9943, test_loss: 1.1086, test_f1: 0.4318
 epoch: 5, train_loss: 0.9677, test_loss: 1.0335, test_f1: 0.4744
 epoch: 6, train_loss: 0.9663, test_loss: 1.0432, test_f1: 0.4785
 epoch: 7, train_loss: 0.9564, test_loss: 1.0494, test_f1: 0.4829
 epoch: 8, train_loss: 0.9489, test_loss: 0.9811, test_f1: 0.5277
 epoch: 9, train_loss: 0.9281, test_loss: 0.9565, test_f1: 0.4808
 epoch: 10, train_loss: 1.0127, test_loss: 1.0777, test_f1: 0.5258
 epoch: 11, train_loss: 0.9705, test_loss: 1.0376, test_f1: 0.5116
 epoch: 12, train_loss: 0.9399, test_loss: 1.0050, test_f1: 0.4872
 epoch: 13, train_loss: 0.9268, test_loss: 0.9656, test_f1: 0.5349
 epoch: 14, train_loss: 0.9261, test_loss: 1.0379, test_f1: 0.4700
 epoch: 15, train_loss: 0.9071, test_loss: 1.0642, test_f1: 0.4806
 epoch: 16, train_loss: 0.8894, test_loss: 0.9272, test_f1: 0.5730
 epoch: 17, train_loss: 0.8831, test_loss: 0.9043, test_f1: 0.5836
 epoch: 18, train_loss: 0.8853, test_loss: 0.9644, test_f1: 0.4798
 epoch: 19, train_loss: 0.8880, test_loss: 0.9901, test_f1: 0.5118
 epoch: 20, train_loss: 0.8782, test_loss: 0.9135, test_f1: 0.5240
 epoch: 21, train_loss: 0.8615, test_loss: 0.8702, test_f1: 0.5899
 epoch: 22, train_loss: 0.8524, test_loss: 0.8678, test_f1: 0.5412
 epoch: 23, train_loss: 0.8540, test_loss: 0.8873, test_f1: 0.5730
 epoch: 24, train_loss: 0.8329, test_loss: 0.8429, test_f1: 0.5855
 epoch: 25, train_loss: 0.8629, test_loss: 1.1880, test_f1: 0.4686
 epoch: 26, train_loss: 0.8520, test_loss: 0.9389, test_f1: 0.5606
 epoch: 27, train_loss: 0.8427, test_loss: 0.8505, test_f1: 0.5736
 epoch: 28, train_loss: 0.8459, test_loss: 0.8806, test_f1: 0.5486
 epoch: 29, train_loss: 0.8274, test_loss: 0.8601, test_f1: 0.5807
 epoch: 30, train_loss: 0.8341, test_loss: 0.8893, test_f1: 0.5288
 epoch: 31, train_loss: 0.8295, test_loss: 0.9036, test_f1: 0.5288
 epoch: 32, train_loss: 0.8246, test_loss: 0.9775, test_f1: 0.6006
 epoch: 33, train_loss: 0.8383, test_loss: 0.9426, test_f1: 0.5898
 epoch: 34, train_loss: 0.8260, test_loss: 0.9444, test_f1: 0.5311
 epoch: 35, train_loss: 0.8073, test_loss: 0.9112, test_f1: 0.5963
 epoch: 36, train_loss: 0.8088, test_loss: 0.8658, test_f1: 0.5888
 epoch: 37, train_loss: 0.8062, test_loss: 0.8519, test_f1: 0.5829
 epoch: 38, train_loss: 0.8156, test_loss: 0.8260, test_f1: 0.5753
 epoch: 39, train_loss: 0.8156, test_loss: 0.8793, test_f1: 0.5665
 epoch: 40, train_loss: 0.7962, test_loss: 0.8888, test_f1: 0.5113
 epoch: 41, train_loss: 0.7983, test_loss: 0.8275, test_f1: 0.5483
 epoch: 42, train_loss: 0.7914, test_loss: 0.8351, test_f1: 0.5701
 epoch: 43, train_loss: 0.7959, test_loss: 0.8029, test_f1: 0.5657
 epoch: 44, train_loss: 0.7955, test_loss: 0.9116, test_f1: 0.5705
 epoch: 45, train_loss: 0.7885, test_loss: 0.8147, test_f1: 0.5976
 epoch: 46, train_loss: 0.7860, test_loss: 0.8748, test_f1: 0.5824
 epoch: 47, train_loss: 0.8102, test_loss: 0.9274, test_f1: 0.5131
 epoch: 48, train_loss: 0.7980, test_loss: 0.8236, test_f1: 0.5817
 epoch: 49, train_loss: 0.8011, test_loss: 0.8743, test_f1: 0.5758
 epoch: 50, train_loss: 0.7879, test_loss: 0.8865, test_f1: 0.5347
 epoch: 51, train_loss: 0.7507, test_loss: 0.8280, test_f1: 0.5880
 epoch: 52, train_loss: 0.7523, test_loss: 0.8242, test_f1: 0.5720
 epoch: 53, train_loss: 0.7465, test_loss: 0.8126, test_f1: 0.6066
 epoch: 54, train_loss: 0.7298, test_loss: 0.8087, test_f1: 0.6178
 epoch: 55, train_loss: 0.7263, test_loss: 0.8568, test_f1: 0.6163
 epoch: 56, train_loss: 0.7452, test_loss: 0.8636, test_f1: 0.5776
 epoch: 57, train_loss: 0.7240, test_loss: 0.8122, test_f1: 0.6202
 epoch: 58, train_loss: 0.7218, test_loss: 0.8832, test_f1: 0.5791
 epoch: 59, train_loss: 0.7227, test_loss: 0.8084, test_f1: 0.6038
 epoch: 60, train_loss: 0.7257, test_loss: 0.8263, test_f1: 0.5974
 epoch: 61, train_loss: 0.7235, test_loss: 0.8521, test_f1: 0.6012
 epoch: 62, train_loss: 0.7104, test_loss: 0.8914, test_f1: 0.5977
 epoch: 63, train_loss: 0.7270, test_loss: 0.8766, test_f1: 0.5915
 epoch: 64, train_loss: 0.7104, test_loss: 0.8623, test_f1: 0.5914
 epoch: 65, train_loss: 0.7093, test_loss: 0.8527, test_f1: 0.6207
 epoch: 66, train_loss: 0.7236, test_loss: 0.8642, test_f1: 0.6092
 epoch: 67, train_loss: 0.7189, test_loss: 0.8294, test_f1: 0.5937
 epoch: 68, train_loss: 0.7233, test_loss: 0.8108, test_f1: 0.6178
 epoch: 69, train_loss: 0.7007, test_loss: 0.8380, test_f1: 0.5907
 epoch: 70, train_loss: 0.7250, test_loss: 0.8793, test_f1: 0.6097
 epoch: 71, train_loss: 0.7077, test_loss: 0.8255, test_f1: 0.6156
 epoch: 72, train_loss: 0.7029, test_loss: 1.0120, test_f1: 0.5658
 epoch: 73, train_loss: 0.7133, test_loss: 0.9454, test_f1: 0.5809
 epoch: 74, train_loss: 0.7186, test_loss: 0.8280, test_f1: 0.6250
 epoch: 75, train_loss: 0.6966, test_loss: 0.8503, test_f1: 0.6095
 epoch: 76, train_loss: 0.7159, test_loss: 0.8326, test_f1: 0.5986
 epoch: 77, train_loss: 0.7081, test_loss: 0.8535, test_f1: 0.6082
 epoch: 78, train_loss: 0.6962, test_loss: 0.8612, test_f1: 0.6356
 epoch: 79, train_loss: 0.6822, test_loss: 0.8286, test_f1: 0.6346
 epoch: 80, train_loss: 0.6948, test_loss: 0.8812, test_f1: 0.6076
 epoch: 81, train_loss: 0.6983, test_loss: 0.9085, test_f1: 0.6025
 epoch: 82, train_loss: 0.6869, test_loss: 0.8333, test_f1: 0.6121
 epoch: 83, train_loss: 0.7024, test_loss: 0.8157, test_f1: 0.6067
 epoch: 84, train_loss: 0.6952, test_loss: 0.8846, test_f1: 0.6009
 epoch: 85, train_loss: 0.6926, test_loss: 0.8935, test_f1: 0.5918
 epoch: 86, train_loss: 0.6878, test_loss: 0.9172, test_f1: 0.6094
 epoch: 87, train_loss: 0.6879, test_loss: 0.8336, test_f1: 0.6178
 epoch: 88, train_loss: 0.6927, test_loss: 0.8304, test_f1: 0.6079
 epoch: 89, train_loss: 0.6779, test_loss: 0.9394, test_f1: 0.5931
 epoch: 90, train_loss: 0.6802, test_loss: 0.8766, test_f1: 0.6238
 epoch: 91, train_loss: 0.6885, test_loss: 0.8875, test_f1: 0.5896
 epoch: 92, train_loss: 0.6945, test_loss: 0.8264, test_f1: 0.6296
 epoch: 93, train_loss: 0.6851, test_loss: 0.8271, test_f1: 0.6223
 epoch: 94, train_loss: 0.6792, test_loss: 0.9029, test_f1: 0.5901
 epoch: 95, train_loss: 0.6866, test_loss: 0.9006, test_f1: 0.5954
 epoch: 96, train_loss: 0.6723, test_loss: 0.8986, test_f1: 0.6101
 epoch: 97, train_loss: 0.6643, test_loss: 0.8704, test_f1: 0.6327
 epoch: 98, train_loss: 0.6850, test_loss: 0.8331, test_f1: 0.6069
 epoch: 99, train_loss: 0.6871, test_loss: 0.8927, test_f1: 0.6400

Training completed in 815.00 seconds
Best F1: 0.6626 at epoch 85
Mean F1 across iterations: 0.6376  0.0136
========================FINAL RESULTS================================
FEGIN weighted F1: 0.6626  0.0136
python main.py --data ltspice_examples --representation component_pin_net --model FEGIN --layers 6 --hiddens 16 --batch_size 64 --lr 0.01 --emb_size 512 --epochs 100 --save_appendix component_pin_net_L6_H16_BS64_LR0.01_E512 --no_val
-----



STDERR:
  File "main.py", line 370, in <module>
    main()
  File "main.py", line 254, in main
    dataset = dataset_class(
  File "/home/philip/projects/ltspice_examples_code_repo/Circuit-Completion-Using-GNNs/component_classification_with_link_prediction_head/evaluation/FEGIN/kernel/circuit_datasets.py", line 15, in __init__
    self.data, self.slices = torch.load(self.processed_paths[0])
  File "/home/philip/.local/lib/python3.8/site-packages/torch/serialization.py", line 1040, in load
    warnings.warn(
  File "/usr/lib/python3.8/warnings.py", line 109, in _showwarnmsg
    sw(msg.message, msg.category, msg.filename, msg.lineno,
  File "main.py", line 47, in warn_with_traceback
    traceback.print_stack(file=log)
/home/philip/projects/ltspice_examples_code_repo/Circuit-Completion-Using-GNNs/component_classification_with_link_prediction_head/evaluation/FEGIN/kernel/circuit_datasets.py:15: FutureWarning: You are using `torch.load` with `weights_only=False` (the current default value), which uses the default pickle module implicitly. It is possible to construct malicious pickle data which will execute arbitrary code during unpickling (See https://github.com/pytorch/pytorch/blob/main/SECURITY.md#untrusted-models for more details). In a future release, the default value for `weights_only` will be flipped to `True`. This limits the functions that could be executed during unpickling. Arbitrary objects will no longer be allowed to be loaded via this mode unless they are explicitly allowlisted by the user via `torch.serialization.add_safe_globals`. We recommend you start setting `weights_only=True` for any use case where you don't have full control of the loaded file. Please open an issue on GitHub for any issues related to this experimental feature.
  self.data, self.slices = torch.load(self.processed_paths[0])
