STDOUT:
Results will be saved in /home/philip/projects/ltspice_examples_code_repo/Circuit-Completion-Using-GNNs/component_classification_with_link_prediction_head/evaluation/FEGIN/results/model_FEGIN_dataset_ltspice_examples
Command line input: python main.py --data ltspice_examples --representation component_pin --model FEGIN --layers 2 --hiddens 128 --batch_size 128 --lr 0.001 --emb_size 250 --epochs 100 --save_appendix component_pin_L2_H128_BS128_LR0.001_E250 --no_val
 is saved.
-----
ltspice_examples - FEGIN
Using 2 layers, 128 hidden units, h = 2
Loading component_pin representation dataset
ENTERED
Training FEGIN on component_pin representation
Train: 3560, Test: 848
##################ITERATION #0 ****************************************
 epoch: 0, train_loss: 1.2110, test_loss: 1.2531, test_f1: 0.2260
 epoch: 1, train_loss: 1.0317, test_loss: 1.0563, test_f1: 0.3447
 epoch: 2, train_loss: 0.9797, test_loss: 1.0305, test_f1: 0.4077
 epoch: 3, train_loss: 0.9355, test_loss: 0.9868, test_f1: 0.5042
 epoch: 4, train_loss: 0.9003, test_loss: 0.9431, test_f1: 0.5161
 epoch: 5, train_loss: 0.8538, test_loss: 0.9683, test_f1: 0.5167
 epoch: 6, train_loss: 0.8204, test_loss: 0.9885, test_f1: 0.5296
 epoch: 7, train_loss: 0.8003, test_loss: 0.8854, test_f1: 0.5385
 epoch: 8, train_loss: 0.7907, test_loss: 0.8729, test_f1: 0.5366
 epoch: 9, train_loss: 0.7655, test_loss: 0.9239, test_f1: 0.5019
 epoch: 10, train_loss: 0.7384, test_loss: 0.8571, test_f1: 0.5613
 epoch: 11, train_loss: 0.7152, test_loss: 0.9182, test_f1: 0.5553
 epoch: 12, train_loss: 0.6970, test_loss: 0.9184, test_f1: 0.5658
 epoch: 13, train_loss: 0.6857, test_loss: 0.8981, test_f1: 0.5864
 epoch: 14, train_loss: 0.6828, test_loss: 1.0701, test_f1: 0.5271
 epoch: 15, train_loss: 0.6452, test_loss: 1.0082, test_f1: 0.5886
 epoch: 16, train_loss: 0.6723, test_loss: 0.9470, test_f1: 0.5586
 epoch: 17, train_loss: 0.6449, test_loss: 0.8625, test_f1: 0.6192
 epoch: 18, train_loss: 0.6340, test_loss: 0.8754, test_f1: 0.6013
 epoch: 19, train_loss: 0.6137, test_loss: 0.9945, test_f1: 0.5982
 epoch: 20, train_loss: 0.6096, test_loss: 0.9207, test_f1: 0.6439
 epoch: 21, train_loss: 0.5794, test_loss: 0.9803, test_f1: 0.6061
 epoch: 22, train_loss: 0.5744, test_loss: 0.9601, test_f1: 0.6222
 epoch: 23, train_loss: 0.5785, test_loss: 0.9854, test_f1: 0.6283
 epoch: 24, train_loss: 0.5624, test_loss: 1.2821, test_f1: 0.5484
 epoch: 25, train_loss: 0.5587, test_loss: 0.9939, test_f1: 0.6096
 epoch: 26, train_loss: 0.5463, test_loss: 0.9578, test_f1: 0.6148
 epoch: 27, train_loss: 0.5362, test_loss: 1.1196, test_f1: 0.5910
 epoch: 28, train_loss: 0.5251, test_loss: 1.0529, test_f1: 0.6076
 epoch: 29, train_loss: 0.5011, test_loss: 0.9763, test_f1: 0.5874
 epoch: 30, train_loss: 0.4872, test_loss: 1.0658, test_f1: 0.6417
 epoch: 31, train_loss: 0.4907, test_loss: 1.2133, test_f1: 0.6020
 epoch: 32, train_loss: 0.4693, test_loss: 1.0175, test_f1: 0.6458
 epoch: 33, train_loss: 0.4659, test_loss: 1.2801, test_f1: 0.6045
 epoch: 34, train_loss: 0.4807, test_loss: 1.0155, test_f1: 0.6139
 epoch: 35, train_loss: 0.4512, test_loss: 1.0800, test_f1: 0.6338
 epoch: 36, train_loss: 0.4336, test_loss: 0.9992, test_f1: 0.6645
 epoch: 37, train_loss: 0.4470, test_loss: 1.0787, test_f1: 0.6195
 epoch: 38, train_loss: 0.4446, test_loss: 1.0309, test_f1: 0.6439
 epoch: 39, train_loss: 0.4216, test_loss: 1.1037, test_f1: 0.6334
 epoch: 40, train_loss: 0.4028, test_loss: 1.1681, test_f1: 0.6442
 epoch: 41, train_loss: 0.3943, test_loss: 1.2404, test_f1: 0.6249
 epoch: 42, train_loss: 0.3892, test_loss: 1.0919, test_f1: 0.6667
 epoch: 43, train_loss: 0.3899, test_loss: 1.2735, test_f1: 0.6426
 epoch: 44, train_loss: 0.3938, test_loss: 1.1325, test_f1: 0.6492
 epoch: 45, train_loss: 0.3759, test_loss: 1.2024, test_f1: 0.6045
 epoch: 46, train_loss: 0.3867, test_loss: 1.1063, test_f1: 0.6724
 epoch: 47, train_loss: 0.3423, test_loss: 1.2023, test_f1: 0.5818
 epoch: 48, train_loss: 0.3484, test_loss: 1.1482, test_f1: 0.6616
 epoch: 49, train_loss: 0.3411, test_loss: 1.1812, test_f1: 0.6426
 epoch: 50, train_loss: 0.3413, test_loss: 1.5372, test_f1: 0.6510
 epoch: 51, train_loss: 0.3003, test_loss: 1.3541, test_f1: 0.6527
 epoch: 52, train_loss: 0.2787, test_loss: 1.3460, test_f1: 0.6614
 epoch: 53, train_loss: 0.2635, test_loss: 1.4158, test_f1: 0.6657
 epoch: 54, train_loss: 0.2702, test_loss: 1.3971, test_f1: 0.6458
 epoch: 55, train_loss: 0.2710, test_loss: 1.3331, test_f1: 0.6787
 epoch: 56, train_loss: 0.2476, test_loss: 1.4746, test_f1: 0.6561
 epoch: 57, train_loss: 0.2325, test_loss: 1.3980, test_f1: 0.6534
 epoch: 58, train_loss: 0.2341, test_loss: 1.6869, test_f1: 0.6461
 epoch: 59, train_loss: 0.2369, test_loss: 1.6026, test_f1: 0.6522
 epoch: 60, train_loss: 0.2545, test_loss: 1.5000, test_f1: 0.6520
 epoch: 61, train_loss: 0.2282, test_loss: 1.5253, test_f1: 0.6701
 epoch: 62, train_loss: 0.2295, test_loss: 1.4806, test_f1: 0.6447
 epoch: 63, train_loss: 0.2276, test_loss: 1.5698, test_f1: 0.6583
 epoch: 64, train_loss: 0.2245, test_loss: 1.4508, test_f1: 0.6746
 epoch: 65, train_loss: 0.2053, test_loss: 1.4826, test_f1: 0.6778
 epoch: 66, train_loss: 0.2255, test_loss: 1.6783, test_f1: 0.6602
 epoch: 67, train_loss: 0.2156, test_loss: 1.6211, test_f1: 0.6497
 epoch: 68, train_loss: 0.2082, test_loss: 1.5395, test_f1: 0.6832
 epoch: 69, train_loss: 0.2066, test_loss: 1.8360, test_f1: 0.6407
 epoch: 70, train_loss: 0.2002, test_loss: 1.4316, test_f1: 0.6639
 epoch: 71, train_loss: 0.2139, test_loss: 1.8028, test_f1: 0.6405
 epoch: 72, train_loss: 0.1955, test_loss: 1.5593, test_f1: 0.6680
 epoch: 73, train_loss: 0.2046, test_loss: 1.7783, test_f1: 0.6774
 epoch: 74, train_loss: 0.2047, test_loss: 1.6638, test_f1: 0.6731
 epoch: 75, train_loss: 0.1679, test_loss: 1.6326, test_f1: 0.6761
 epoch: 76, train_loss: 0.1735, test_loss: 1.6636, test_f1: 0.6708
 epoch: 77, train_loss: 0.1798, test_loss: 1.6962, test_f1: 0.6639
 epoch: 78, train_loss: 0.1751, test_loss: 1.8493, test_f1: 0.6610
 epoch: 79, train_loss: 0.1738, test_loss: 1.5938, test_f1: 0.6548
 epoch: 80, train_loss: 0.1620, test_loss: 1.9656, test_f1: 0.6699
 epoch: 81, train_loss: 0.1618, test_loss: 1.9002, test_f1: 0.6737
 epoch: 82, train_loss: 0.1531, test_loss: 2.0604, test_f1: 0.6537
 epoch: 83, train_loss: 0.1728, test_loss: 1.9988, test_f1: 0.6176
 epoch: 84, train_loss: 0.1806, test_loss: 1.8559, test_f1: 0.6786
 epoch: 85, train_loss: 0.1692, test_loss: 2.1770, test_f1: 0.6675
 epoch: 86, train_loss: 0.1846, test_loss: 1.7913, test_f1: 0.6327
 epoch: 87, train_loss: 0.1769, test_loss: 1.8013, test_f1: 0.6600
 epoch: 88, train_loss: 0.1740, test_loss: 1.9544, test_f1: 0.6464
 epoch: 89, train_loss: 0.1874, test_loss: 2.0022, test_f1: 0.6226
 epoch: 90, train_loss: 0.1579, test_loss: 1.9489, test_f1: 0.6241
 epoch: 91, train_loss: 0.1506, test_loss: 2.1960, test_f1: 0.6481
 epoch: 92, train_loss: 0.1531, test_loss: 1.9549, test_f1: 0.6697
 epoch: 93, train_loss: 0.1406, test_loss: 2.0633, test_f1: 0.6526
 epoch: 94, train_loss: 0.1283, test_loss: 2.2184, test_f1: 0.6601
 epoch: 95, train_loss: 0.1582, test_loss: 2.0174, test_f1: 0.6461
 epoch: 96, train_loss: 0.1507, test_loss: 1.9203, test_f1: 0.6815
 epoch: 97, train_loss: 0.1412, test_loss: 2.0480, test_f1: 0.6896
 epoch: 98, train_loss: 0.1407, test_loss: 2.1800, test_f1: 0.6530
 epoch: 99, train_loss: 0.1491, test_loss: 2.1911, test_f1: 0.6556
##################ITERATION #1 ****************************************
 epoch: 0, train_loss: 1.1144, test_loss: 1.1085, test_f1: 0.4078
 epoch: 1, train_loss: 0.9641, test_loss: 1.1198, test_f1: 0.3950
 epoch: 2, train_loss: 0.9090, test_loss: 0.8965, test_f1: 0.5366
 epoch: 3, train_loss: 0.8543, test_loss: 0.8578, test_f1: 0.5276
 epoch: 4, train_loss: 0.8329, test_loss: 0.8805, test_f1: 0.5516
 epoch: 5, train_loss: 0.7911, test_loss: 0.9160, test_f1: 0.5767
 epoch: 6, train_loss: 0.7734, test_loss: 0.8455, test_f1: 0.6154
 epoch: 7, train_loss: 0.7643, test_loss: 1.1102, test_f1: 0.5832
 epoch: 8, train_loss: 0.7354, test_loss: 0.9598, test_f1: 0.5283
 epoch: 9, train_loss: 0.7279, test_loss: 0.9114, test_f1: 0.5753
 epoch: 10, train_loss: 0.7249, test_loss: 0.8066, test_f1: 0.6221
 epoch: 11, train_loss: 0.6848, test_loss: 0.7817, test_f1: 0.6307
 epoch: 12, train_loss: 0.6699, test_loss: 0.8671, test_f1: 0.6066
 epoch: 13, train_loss: 0.6729, test_loss: 0.8573, test_f1: 0.6242
 epoch: 14, train_loss: 0.6515, test_loss: 0.8818, test_f1: 0.5875
 epoch: 15, train_loss: 0.6319, test_loss: 0.8470, test_f1: 0.6396
 epoch: 16, train_loss: 0.6296, test_loss: 0.8679, test_f1: 0.6514
 epoch: 17, train_loss: 0.6088, test_loss: 0.8383, test_f1: 0.5993
 epoch: 18, train_loss: 0.5879, test_loss: 0.8946, test_f1: 0.6226
 epoch: 19, train_loss: 0.5873, test_loss: 0.8609, test_f1: 0.6262
 epoch: 20, train_loss: 0.6016, test_loss: 0.8887, test_f1: 0.6213
 epoch: 21, train_loss: 0.5736, test_loss: 0.8093, test_f1: 0.6669
 epoch: 22, train_loss: 0.5672, test_loss: 0.9283, test_f1: 0.6288
 epoch: 23, train_loss: 0.5484, test_loss: 0.9041, test_f1: 0.5840
 epoch: 24, train_loss: 0.5392, test_loss: 0.9363, test_f1: 0.6290
 epoch: 25, train_loss: 0.5272, test_loss: 0.8375, test_f1: 0.6698
 epoch: 26, train_loss: 0.5085, test_loss: 1.1726, test_f1: 0.5785
 epoch: 27, train_loss: 0.5199, test_loss: 1.0256, test_f1: 0.6179
 epoch: 28, train_loss: 0.4971, test_loss: 1.0429, test_f1: 0.5791
 epoch: 29, train_loss: 0.5143, test_loss: 1.0327, test_f1: 0.5541
 epoch: 30, train_loss: 0.4988, test_loss: 0.8735, test_f1: 0.6467
 epoch: 31, train_loss: 0.4780, test_loss: 1.0488, test_f1: 0.6439
 epoch: 32, train_loss: 0.4605, test_loss: 0.9257, test_f1: 0.6295
 epoch: 33, train_loss: 0.4619, test_loss: 0.9520, test_f1: 0.5969
 epoch: 34, train_loss: 0.4501, test_loss: 1.0127, test_f1: 0.5968
 epoch: 35, train_loss: 0.4455, test_loss: 0.9320, test_f1: 0.6151
 epoch: 36, train_loss: 0.4233, test_loss: 1.0321, test_f1: 0.5916
 epoch: 37, train_loss: 0.4226, test_loss: 1.0719, test_f1: 0.6170
 epoch: 38, train_loss: 0.4192, test_loss: 0.9151, test_f1: 0.6300
 epoch: 39, train_loss: 0.3828, test_loss: 1.1143, test_f1: 0.6347
 epoch: 40, train_loss: 0.3867, test_loss: 1.1716, test_f1: 0.6390
 epoch: 41, train_loss: 0.3576, test_loss: 1.1456, test_f1: 0.6275
 epoch: 42, train_loss: 0.3916, test_loss: 1.0664, test_f1: 0.6625
 epoch: 43, train_loss: 0.3817, test_loss: 1.3516, test_f1: 0.5937
 epoch: 44, train_loss: 0.3909, test_loss: 0.9258, test_f1: 0.6631
 epoch: 45, train_loss: 0.3902, test_loss: 1.1011, test_f1: 0.6516
 epoch: 46, train_loss: 0.3526, test_loss: 1.1043, test_f1: 0.6387
 epoch: 47, train_loss: 0.3723, test_loss: 1.2105, test_f1: 0.6418
 epoch: 48, train_loss: 0.3350, test_loss: 1.0846, test_f1: 0.6075
 epoch: 49, train_loss: 0.3567, test_loss: 1.1584, test_f1: 0.6203
 epoch: 50, train_loss: 0.3205, test_loss: 1.2809, test_f1: 0.6292
 epoch: 51, train_loss: 0.2883, test_loss: 1.0974, test_f1: 0.6781
 epoch: 52, train_loss: 0.2639, test_loss: 1.1777, test_f1: 0.6730
 epoch: 53, train_loss: 0.2773, test_loss: 1.1944, test_f1: 0.6678
 epoch: 54, train_loss: 0.2770, test_loss: 1.2101, test_f1: 0.6622
 epoch: 55, train_loss: 0.2460, test_loss: 1.2009, test_f1: 0.6847
 epoch: 56, train_loss: 0.2507, test_loss: 1.1998, test_f1: 0.6713
 epoch: 57, train_loss: 0.2508, test_loss: 1.4044, test_f1: 0.6455
 epoch: 58, train_loss: 0.2475, test_loss: 1.2829, test_f1: 0.6548
 epoch: 59, train_loss: 0.2520, test_loss: 1.2219, test_f1: 0.6546
 epoch: 60, train_loss: 0.2349, test_loss: 1.2593, test_f1: 0.6612
 epoch: 61, train_loss: 0.2341, test_loss: 1.4779, test_f1: 0.6463
 epoch: 62, train_loss: 0.2265, test_loss: 1.3786, test_f1: 0.6604
 epoch: 63, train_loss: 0.2113, test_loss: 1.2713, test_f1: 0.6876
 epoch: 64, train_loss: 0.2018, test_loss: 1.4338, test_f1: 0.6410
 epoch: 65, train_loss: 0.2171, test_loss: 1.3625, test_f1: 0.6621
 epoch: 66, train_loss: 0.2087, test_loss: 1.3671, test_f1: 0.6489
 epoch: 67, train_loss: 0.2077, test_loss: 1.3492, test_f1: 0.6608
 epoch: 68, train_loss: 0.2203, test_loss: 1.4502, test_f1: 0.6615
 epoch: 69, train_loss: 0.2043, test_loss: 1.4114, test_f1: 0.6726
 epoch: 70, train_loss: 0.2201, test_loss: 1.4512, test_f1: 0.6756
 epoch: 71, train_loss: 0.2063, test_loss: 1.5689, test_f1: 0.6810
 epoch: 72, train_loss: 0.2138, test_loss: 1.4854, test_f1: 0.6297
 epoch: 73, train_loss: 0.1995, test_loss: 1.3882, test_f1: 0.6510
 epoch: 74, train_loss: 0.2060, test_loss: 1.4840, test_f1: 0.6555
 epoch: 75, train_loss: 0.1952, test_loss: 1.4735, test_f1: 0.6637
 epoch: 76, train_loss: 0.1918, test_loss: 1.4130, test_f1: 0.6676
 epoch: 77, train_loss: 0.1914, test_loss: 1.5567, test_f1: 0.6634
 epoch: 78, train_loss: 0.1754, test_loss: 1.4163, test_f1: 0.6904
 epoch: 79, train_loss: 0.1824, test_loss: 1.4842, test_f1: 0.6691
 epoch: 80, train_loss: 0.1838, test_loss: 1.6056, test_f1: 0.6693
 epoch: 81, train_loss: 0.1819, test_loss: 1.5302, test_f1: 0.6855
 epoch: 82, train_loss: 0.1880, test_loss: 1.5582, test_f1: 0.6492
 epoch: 83, train_loss: 0.1729, test_loss: 1.6191, test_f1: 0.6750
 epoch: 84, train_loss: 0.1636, test_loss: 1.7317, test_f1: 0.6591
 epoch: 85, train_loss: 0.1696, test_loss: 1.5224, test_f1: 0.6503
 epoch: 86, train_loss: 0.1659, test_loss: 1.5223, test_f1: 0.6571
 epoch: 87, train_loss: 0.1789, test_loss: 1.6357, test_f1: 0.6530
 epoch: 88, train_loss: 0.1819, test_loss: 1.4476, test_f1: 0.6756
 epoch: 89, train_loss: 0.1562, test_loss: 1.5632, test_f1: 0.6696
 epoch: 90, train_loss: 0.1620, test_loss: 1.7230, test_f1: 0.6182
 epoch: 91, train_loss: 0.1463, test_loss: 1.5298, test_f1: 0.6725
 epoch: 92, train_loss: 0.1453, test_loss: 1.7686, test_f1: 0.6592
 epoch: 93, train_loss: 0.1465, test_loss: 1.7396, test_f1: 0.6680
 epoch: 94, train_loss: 0.1518, test_loss: 1.8105, test_f1: 0.6427
 epoch: 95, train_loss: 0.1451, test_loss: 1.7539, test_f1: 0.6786
 epoch: 96, train_loss: 0.1619, test_loss: 1.7001, test_f1: 0.6510
 epoch: 97, train_loss: 0.1587, test_loss: 1.7274, test_f1: 0.6518
 epoch: 98, train_loss: 0.1673, test_loss: 1.6014, test_f1: 0.6501
 epoch: 99, train_loss: 0.1456, test_loss: 1.6464, test_f1: 0.6741
##################ITERATION #2 ****************************************
 epoch: 0, train_loss: 1.1483, test_loss: 1.2084, test_f1: 0.2317
 epoch: 1, train_loss: 0.9548, test_loss: 0.9938, test_f1: 0.4714
 epoch: 2, train_loss: 0.8964, test_loss: 0.9412, test_f1: 0.5305
 epoch: 3, train_loss: 0.8588, test_loss: 1.0699, test_f1: 0.4941
 epoch: 4, train_loss: 0.8285, test_loss: 0.8856, test_f1: 0.5623
 epoch: 5, train_loss: 0.8039, test_loss: 1.0289, test_f1: 0.5616
 epoch: 6, train_loss: 0.7805, test_loss: 0.9795, test_f1: 0.5448
 epoch: 7, train_loss: 0.7494, test_loss: 0.9273, test_f1: 0.5719
 epoch: 8, train_loss: 0.7369, test_loss: 0.8377, test_f1: 0.6078
 epoch: 9, train_loss: 0.7043, test_loss: 1.1683, test_f1: 0.5325
 epoch: 10, train_loss: 0.7109, test_loss: 0.8916, test_f1: 0.5844
 epoch: 11, train_loss: 0.6946, test_loss: 0.8144, test_f1: 0.6333
 epoch: 12, train_loss: 0.6684, test_loss: 0.8003, test_f1: 0.6447
 epoch: 13, train_loss: 0.6415, test_loss: 0.8439, test_f1: 0.6510
 epoch: 14, train_loss: 0.6394, test_loss: 0.8181, test_f1: 0.6581
 epoch: 15, train_loss: 0.6237, test_loss: 0.8980, test_f1: 0.6604
 epoch: 16, train_loss: 0.5897, test_loss: 0.9011, test_f1: 0.6648
 epoch: 17, train_loss: 0.6000, test_loss: 0.9218, test_f1: 0.6266
 epoch: 18, train_loss: 0.5869, test_loss: 0.8359, test_f1: 0.6484
 epoch: 19, train_loss: 0.5784, test_loss: 0.9816, test_f1: 0.5910
 epoch: 20, train_loss: 0.5673, test_loss: 0.9633, test_f1: 0.6497
 epoch: 21, train_loss: 0.5473, test_loss: 0.9535, test_f1: 0.6663
 epoch: 22, train_loss: 0.5344, test_loss: 0.7717, test_f1: 0.6785
 epoch: 23, train_loss: 0.5137, test_loss: 0.9353, test_f1: 0.6600
 epoch: 24, train_loss: 0.5183, test_loss: 0.9355, test_f1: 0.6701
 epoch: 25, train_loss: 0.4991, test_loss: 1.0026, test_f1: 0.6795
 epoch: 26, train_loss: 0.4996, test_loss: 1.0162, test_f1: 0.6947
 epoch: 27, train_loss: 0.4922, test_loss: 1.0143, test_f1: 0.6277
 epoch: 28, train_loss: 0.4813, test_loss: 0.9968, test_f1: 0.6431
 epoch: 29, train_loss: 0.4625, test_loss: 0.9181, test_f1: 0.6632
 epoch: 30, train_loss: 0.4515, test_loss: 1.0228, test_f1: 0.6782
 epoch: 31, train_loss: 0.4578, test_loss: 0.9543, test_f1: 0.7063
 epoch: 32, train_loss: 0.4348, test_loss: 1.2676, test_f1: 0.6292
 epoch: 33, train_loss: 0.4235, test_loss: 1.0974, test_f1: 0.6696
 epoch: 34, train_loss: 0.4223, test_loss: 1.0339, test_f1: 0.6921
 epoch: 35, train_loss: 0.4282, test_loss: 1.1287, test_f1: 0.6461
 epoch: 36, train_loss: 0.4125, test_loss: 1.2049, test_f1: 0.6505
 epoch: 37, train_loss: 0.3941, test_loss: 1.2097, test_f1: 0.6650
 epoch: 38, train_loss: 0.3923, test_loss: 1.1263, test_f1: 0.6305
 epoch: 39, train_loss: 0.3808, test_loss: 1.1521, test_f1: 0.6668
 epoch: 40, train_loss: 0.3741, test_loss: 1.0623, test_f1: 0.7108
 epoch: 41, train_loss: 0.3650, test_loss: 1.1353, test_f1: 0.6808
 epoch: 42, train_loss: 0.3557, test_loss: 1.3318, test_f1: 0.6747
 epoch: 43, train_loss: 0.3628, test_loss: 1.2522, test_f1: 0.6378
 epoch: 44, train_loss: 0.3757, test_loss: 1.3039, test_f1: 0.6468
 epoch: 45, train_loss: 0.3537, test_loss: 1.2365, test_f1: 0.6424
 epoch: 46, train_loss: 0.3503, test_loss: 1.3498, test_f1: 0.5984
 epoch: 47, train_loss: 0.3379, test_loss: 1.2806, test_f1: 0.6448
 epoch: 48, train_loss: 0.3542, test_loss: 1.1578, test_f1: 0.6763
 epoch: 49, train_loss: 0.3247, test_loss: 1.2749, test_f1: 0.6331
 epoch: 50, train_loss: 0.3168, test_loss: 1.4050, test_f1: 0.6154
 epoch: 51, train_loss: 0.2736, test_loss: 1.1744, test_f1: 0.6940
 epoch: 52, train_loss: 0.2728, test_loss: 1.2431, test_f1: 0.6614
 epoch: 53, train_loss: 0.2393, test_loss: 1.3331, test_f1: 0.6751
 epoch: 54, train_loss: 0.2391, test_loss: 1.3228, test_f1: 0.6583
 epoch: 55, train_loss: 0.2431, test_loss: 1.3431, test_f1: 0.6720
 epoch: 56, train_loss: 0.2178, test_loss: 1.3048, test_f1: 0.6854
 epoch: 57, train_loss: 0.2137, test_loss: 1.4276, test_f1: 0.6686
 epoch: 58, train_loss: 0.2287, test_loss: 1.3553, test_f1: 0.6822
 epoch: 59, train_loss: 0.2225, test_loss: 1.4525, test_f1: 0.6561
 epoch: 60, train_loss: 0.2131, test_loss: 1.4001, test_f1: 0.6937
 epoch: 61, train_loss: 0.2238, test_loss: 1.5157, test_f1: 0.6780
 epoch: 62, train_loss: 0.2129, test_loss: 1.6728, test_f1: 0.6456
 epoch: 63, train_loss: 0.2202, test_loss: 1.5491, test_f1: 0.6768
 epoch: 64, train_loss: 0.2135, test_loss: 1.4809, test_f1: 0.6516
 epoch: 65, train_loss: 0.2084, test_loss: 1.6239, test_f1: 0.6388
 epoch: 66, train_loss: 0.1975, test_loss: 1.8166, test_f1: 0.6095
 epoch: 67, train_loss: 0.1959, test_loss: 1.5563, test_f1: 0.6598
 epoch: 68, train_loss: 0.2059, test_loss: 1.4732, test_f1: 0.6717
 epoch: 69, train_loss: 0.1946, test_loss: 1.4980, test_f1: 0.6647
 epoch: 70, train_loss: 0.1886, test_loss: 1.5720, test_f1: 0.6677
 epoch: 71, train_loss: 0.1794, test_loss: 1.8046, test_f1: 0.6336
 epoch: 72, train_loss: 0.1844, test_loss: 1.4853, test_f1: 0.6719
 epoch: 73, train_loss: 0.1807, test_loss: 1.6360, test_f1: 0.6708
 epoch: 74, train_loss: 0.1663, test_loss: 1.5322, test_f1: 0.6993
 epoch: 75, train_loss: 0.1722, test_loss: 1.6770, test_f1: 0.6553
 epoch: 76, train_loss: 0.1544, test_loss: 1.8263, test_f1: 0.6724
 epoch: 77, train_loss: 0.1755, test_loss: 1.8013, test_f1: 0.6776
 epoch: 78, train_loss: 0.1927, test_loss: 1.6378, test_f1: 0.6376
 epoch: 79, train_loss: 0.2094, test_loss: 1.6520, test_f1: 0.6616
 epoch: 80, train_loss: 0.1837, test_loss: 1.6322, test_f1: 0.6972
 epoch: 81, train_loss: 0.1808, test_loss: 1.8331, test_f1: 0.6359
 epoch: 82, train_loss: 0.1784, test_loss: 1.8886, test_f1: 0.6810
 epoch: 83, train_loss: 0.1561, test_loss: 1.7832, test_f1: 0.6695
 epoch: 84, train_loss: 0.1459, test_loss: 1.6375, test_f1: 0.6918
 epoch: 85, train_loss: 0.1716, test_loss: 1.7617, test_f1: 0.6855
 epoch: 86, train_loss: 0.1661, test_loss: 2.0633, test_f1: 0.6071
 epoch: 87, train_loss: 0.1563, test_loss: 1.6761, test_f1: 0.6725
 epoch: 88, train_loss: 0.1756, test_loss: 1.7003, test_f1: 0.6310
 epoch: 89, train_loss: 0.1604, test_loss: 1.9536, test_f1: 0.6679
 epoch: 90, train_loss: 0.1556, test_loss: 1.7056, test_f1: 0.6594
 epoch: 91, train_loss: 0.1640, test_loss: 1.8655, test_f1: 0.6482
 epoch: 92, train_loss: 0.1448, test_loss: 1.8215, test_f1: 0.6769
 epoch: 93, train_loss: 0.1342, test_loss: 1.8598, test_f1: 0.6702
 epoch: 94, train_loss: 0.1456, test_loss: 1.9043, test_f1: 0.6482
 epoch: 95, train_loss: 0.1410, test_loss: 2.1257, test_f1: 0.6183
 epoch: 96, train_loss: 0.1523, test_loss: 1.9734, test_f1: 0.6388
 epoch: 97, train_loss: 0.1514, test_loss: 1.8512, test_f1: 0.6536
 epoch: 98, train_loss: 0.1535, test_loss: 1.8414, test_f1: 0.6688
 epoch: 99, train_loss: 0.1483, test_loss: 2.1344, test_f1: 0.6423
##################ITERATION #3 ****************************************
 epoch: 0, train_loss: 1.1945, test_loss: 1.3013, test_f1: 0.2722
 epoch: 1, train_loss: 0.9940, test_loss: 1.0634, test_f1: 0.4513
 epoch: 2, train_loss: 0.9288, test_loss: 0.9902, test_f1: 0.4799
 epoch: 3, train_loss: 0.8990, test_loss: 0.9438, test_f1: 0.5468
 epoch: 4, train_loss: 0.8514, test_loss: 0.9222, test_f1: 0.5900
 epoch: 5, train_loss: 0.8558, test_loss: 0.9492, test_f1: 0.5305
 epoch: 6, train_loss: 0.8122, test_loss: 0.9100, test_f1: 0.5862
 epoch: 7, train_loss: 0.7759, test_loss: 0.8736, test_f1: 0.5460
 epoch: 8, train_loss: 0.7722, test_loss: 0.8921, test_f1: 0.5667
 epoch: 9, train_loss: 0.7488, test_loss: 0.8148, test_f1: 0.5924
 epoch: 10, train_loss: 0.7369, test_loss: 1.0272, test_f1: 0.5407
 epoch: 11, train_loss: 0.7192, test_loss: 0.8190, test_f1: 0.6404
 epoch: 12, train_loss: 0.7025, test_loss: 0.8123, test_f1: 0.6143
 epoch: 13, train_loss: 0.6900, test_loss: 0.8192, test_f1: 0.6215
 epoch: 14, train_loss: 0.6671, test_loss: 0.9797, test_f1: 0.5842
 epoch: 15, train_loss: 0.6530, test_loss: 0.8122, test_f1: 0.6436
 epoch: 16, train_loss: 0.6497, test_loss: 0.8807, test_f1: 0.5760
 epoch: 17, train_loss: 0.6520, test_loss: 0.8500, test_f1: 0.6189
 epoch: 18, train_loss: 0.6011, test_loss: 1.0016, test_f1: 0.5521
 epoch: 19, train_loss: 0.6194, test_loss: 0.8859, test_f1: 0.6216
 epoch: 20, train_loss: 0.6048, test_loss: 0.8307, test_f1: 0.6406
 epoch: 21, train_loss: 0.5663, test_loss: 0.8265, test_f1: 0.6228
 epoch: 22, train_loss: 0.5903, test_loss: 0.8318, test_f1: 0.6147
 epoch: 23, train_loss: 0.5569, test_loss: 0.8720, test_f1: 0.6041
 epoch: 24, train_loss: 0.5450, test_loss: 1.0590, test_f1: 0.6148
 epoch: 25, train_loss: 0.5423, test_loss: 0.9218, test_f1: 0.6110
 epoch: 26, train_loss: 0.5355, test_loss: 0.8308, test_f1: 0.6343
 epoch: 27, train_loss: 0.5151, test_loss: 0.9925, test_f1: 0.6176
 epoch: 28, train_loss: 0.5176, test_loss: 0.8463, test_f1: 0.6768
 epoch: 29, train_loss: 0.5010, test_loss: 0.9771, test_f1: 0.6104
 epoch: 30, train_loss: 0.4899, test_loss: 0.9734, test_f1: 0.6307
 epoch: 31, train_loss: 0.4901, test_loss: 0.9767, test_f1: 0.6557
 epoch: 32, train_loss: 0.4917, test_loss: 1.0050, test_f1: 0.6306
 epoch: 33, train_loss: 0.4894, test_loss: 0.9245, test_f1: 0.6286
 epoch: 34, train_loss: 0.4466, test_loss: 1.0090, test_f1: 0.6408
 epoch: 35, train_loss: 0.4703, test_loss: 0.9422, test_f1: 0.6630
 epoch: 36, train_loss: 0.4321, test_loss: 1.0863, test_f1: 0.6083
 epoch: 37, train_loss: 0.4301, test_loss: 0.8975, test_f1: 0.6699
 epoch: 38, train_loss: 0.4031, test_loss: 1.1628, test_f1: 0.6377
 epoch: 39, train_loss: 0.4206, test_loss: 1.0316, test_f1: 0.6513
 epoch: 40, train_loss: 0.4033, test_loss: 1.1244, test_f1: 0.6224
 epoch: 41, train_loss: 0.4261, test_loss: 1.0637, test_f1: 0.6394
 epoch: 42, train_loss: 0.4046, test_loss: 1.1175, test_f1: 0.6313
 epoch: 43, train_loss: 0.3960, test_loss: 1.1700, test_f1: 0.6214
 epoch: 44, train_loss: 0.3906, test_loss: 1.1935, test_f1: 0.6406
 epoch: 45, train_loss: 0.3971, test_loss: 1.1220, test_f1: 0.6513
 epoch: 46, train_loss: 0.3976, test_loss: 1.1736, test_f1: 0.6614
 epoch: 47, train_loss: 0.3617, test_loss: 1.1498, test_f1: 0.6372
 epoch: 48, train_loss: 0.3614, test_loss: 1.1814, test_f1: 0.6622
 epoch: 49, train_loss: 0.3649, test_loss: 1.1996, test_f1: 0.6441
 epoch: 50, train_loss: 0.3633, test_loss: 1.1774, test_f1: 0.6689
 epoch: 51, train_loss: 0.3130, test_loss: 1.1264, test_f1: 0.6765
 epoch: 52, train_loss: 0.3136, test_loss: 1.1898, test_f1: 0.6690
 epoch: 53, train_loss: 0.2818, test_loss: 1.2483, test_f1: 0.6728
 epoch: 54, train_loss: 0.2727, test_loss: 1.1888, test_f1: 0.6881
 epoch: 55, train_loss: 0.2804, test_loss: 1.2832, test_f1: 0.6669
 epoch: 56, train_loss: 0.2588, test_loss: 1.2242, test_f1: 0.6934
 epoch: 57, train_loss: 0.2707, test_loss: 1.3175, test_f1: 0.6728
 epoch: 58, train_loss: 0.2608, test_loss: 1.2632, test_f1: 0.6693
 epoch: 59, train_loss: 0.2660, test_loss: 1.3236, test_f1: 0.6717
 epoch: 60, train_loss: 0.2685, test_loss: 1.3539, test_f1: 0.6839
 epoch: 61, train_loss: 0.2582, test_loss: 1.3373, test_f1: 0.6882
 epoch: 62, train_loss: 0.2550, test_loss: 1.2976, test_f1: 0.6728
 epoch: 63, train_loss: 0.2302, test_loss: 1.3389, test_f1: 0.6791
 epoch: 64, train_loss: 0.2314, test_loss: 1.3863, test_f1: 0.6650
 epoch: 65, train_loss: 0.2368, test_loss: 1.3241, test_f1: 0.6827
 epoch: 66, train_loss: 0.2514, test_loss: 1.5283, test_f1: 0.6669
 epoch: 67, train_loss: 0.2236, test_loss: 1.6857, test_f1: 0.6469
 epoch: 68, train_loss: 0.2200, test_loss: 1.4680, test_f1: 0.6903
 epoch: 69, train_loss: 0.2293, test_loss: 1.6233, test_f1: 0.6616
 epoch: 70, train_loss: 0.2291, test_loss: 1.4391, test_f1: 0.6651
 epoch: 71, train_loss: 0.2087, test_loss: 1.4146, test_f1: 0.6811
 epoch: 72, train_loss: 0.2093, test_loss: 1.6964, test_f1: 0.6519
 epoch: 73, train_loss: 0.2208, test_loss: 1.4384, test_f1: 0.6618
 epoch: 74, train_loss: 0.1976, test_loss: 1.4579, test_f1: 0.6836
 epoch: 75, train_loss: 0.2081, test_loss: 1.5072, test_f1: 0.6635
 epoch: 76, train_loss: 0.2150, test_loss: 1.6432, test_f1: 0.6480
 epoch: 77, train_loss: 0.2210, test_loss: 1.6577, test_f1: 0.6345
 epoch: 78, train_loss: 0.1968, test_loss: 1.6731, test_f1: 0.6507
 epoch: 79, train_loss: 0.1989, test_loss: 1.5907, test_f1: 0.6921
 epoch: 80, train_loss: 0.2036, test_loss: 1.7453, test_f1: 0.6462
 epoch: 81, train_loss: 0.1908, test_loss: 1.4321, test_f1: 0.6824
 epoch: 82, train_loss: 0.1952, test_loss: 1.6119, test_f1: 0.6888
 epoch: 83, train_loss: 0.2038, test_loss: 1.6100, test_f1: 0.6693
 epoch: 84, train_loss: 0.1875, test_loss: 1.6440, test_f1: 0.6729
 epoch: 85, train_loss: 0.1954, test_loss: 1.6303, test_f1: 0.6853
 epoch: 86, train_loss: 0.1826, test_loss: 1.6425, test_f1: 0.6558
 epoch: 87, train_loss: 0.1911, test_loss: 1.7641, test_f1: 0.6553
 epoch: 88, train_loss: 0.1916, test_loss: 1.6715, test_f1: 0.6497
 epoch: 89, train_loss: 0.1805, test_loss: 1.5642, test_f1: 0.6576
 epoch: 90, train_loss: 0.1703, test_loss: 1.8837, test_f1: 0.6475
 epoch: 91, train_loss: 0.1658, test_loss: 1.8694, test_f1: 0.6700
 epoch: 92, train_loss: 0.1602, test_loss: 1.6495, test_f1: 0.6729
 epoch: 93, train_loss: 0.1586, test_loss: 1.9757, test_f1: 0.6391
 epoch: 94, train_loss: 0.1764, test_loss: 1.8083, test_f1: 0.6729
 epoch: 95, train_loss: 0.1659, test_loss: 1.7232, test_f1: 0.6733
 epoch: 96, train_loss: 0.1748, test_loss: 1.9711, test_f1: 0.6118
 epoch: 97, train_loss: 0.1723, test_loss: 1.7225, test_f1: 0.6691
 epoch: 98, train_loss: 0.1633, test_loss: 1.8357, test_f1: 0.6601
 epoch: 99, train_loss: 0.1677, test_loss: 1.6848, test_f1: 0.6755
##################ITERATION #4 ****************************************
 epoch: 0, train_loss: 1.3234, test_loss: 1.1491, test_f1: 0.3154
 epoch: 1, train_loss: 1.0029, test_loss: 1.0096, test_f1: 0.4187
 epoch: 2, train_loss: 0.9397, test_loss: 0.9449, test_f1: 0.5366
 epoch: 3, train_loss: 0.8945, test_loss: 0.8842, test_f1: 0.5438
 epoch: 4, train_loss: 0.8607, test_loss: 0.9873, test_f1: 0.4972
 epoch: 5, train_loss: 0.8493, test_loss: 0.8963, test_f1: 0.5851
 epoch: 6, train_loss: 0.8085, test_loss: 0.9330, test_f1: 0.5621
 epoch: 7, train_loss: 0.8011, test_loss: 0.8897, test_f1: 0.5730
 epoch: 8, train_loss: 0.7814, test_loss: 0.9269, test_f1: 0.5893
 epoch: 9, train_loss: 0.7725, test_loss: 0.8671, test_f1: 0.5958
 epoch: 10, train_loss: 0.7554, test_loss: 0.8962, test_f1: 0.5895
 epoch: 11, train_loss: 0.7298, test_loss: 0.9615, test_f1: 0.5529
 epoch: 12, train_loss: 0.7149, test_loss: 0.9327, test_f1: 0.6070
 epoch: 13, train_loss: 0.7156, test_loss: 0.9741, test_f1: 0.5866
 epoch: 14, train_loss: 0.7053, test_loss: 0.9183, test_f1: 0.6385
 epoch: 15, train_loss: 0.6981, test_loss: 0.8530, test_f1: 0.6176
 epoch: 16, train_loss: 0.6666, test_loss: 0.8838, test_f1: 0.6311
 epoch: 17, train_loss: 0.6660, test_loss: 0.9003, test_f1: 0.5965
 epoch: 18, train_loss: 0.6544, test_loss: 0.8604, test_f1: 0.6298
 epoch: 19, train_loss: 0.6587, test_loss: 0.9314, test_f1: 0.6048
 epoch: 20, train_loss: 0.6163, test_loss: 0.8752, test_f1: 0.6246
 epoch: 21, train_loss: 0.6190, test_loss: 0.8388, test_f1: 0.6317
 epoch: 22, train_loss: 0.6356, test_loss: 0.8887, test_f1: 0.6396
 epoch: 23, train_loss: 0.5812, test_loss: 0.8461, test_f1: 0.6325
 epoch: 24, train_loss: 0.5739, test_loss: 0.9121, test_f1: 0.6353
 epoch: 25, train_loss: 0.5617, test_loss: 0.8571, test_f1: 0.6325
 epoch: 26, train_loss: 0.5701, test_loss: 1.1278, test_f1: 0.5980
 epoch: 27, train_loss: 0.5505, test_loss: 0.9436, test_f1: 0.6196
 epoch: 28, train_loss: 0.5385, test_loss: 0.9506, test_f1: 0.6377
 epoch: 29, train_loss: 0.5307, test_loss: 1.0442, test_f1: 0.5801
 epoch: 30, train_loss: 0.5065, test_loss: 0.9471, test_f1: 0.6450
 epoch: 31, train_loss: 0.5208, test_loss: 0.9076, test_f1: 0.6488
 epoch: 32, train_loss: 0.5328, test_loss: 0.9653, test_f1: 0.6558
 epoch: 33, train_loss: 0.4933, test_loss: 0.9224, test_f1: 0.6767
 epoch: 34, train_loss: 0.4855, test_loss: 0.9656, test_f1: 0.6310
 epoch: 35, train_loss: 0.4705, test_loss: 0.9313, test_f1: 0.6565
 epoch: 36, train_loss: 0.4847, test_loss: 0.9756, test_f1: 0.6735
 epoch: 37, train_loss: 0.4812, test_loss: 1.0727, test_f1: 0.6357
 epoch: 38, train_loss: 0.4692, test_loss: 1.0163, test_f1: 0.6438
 epoch: 39, train_loss: 0.4545, test_loss: 0.9177, test_f1: 0.6904
 epoch: 40, train_loss: 0.4299, test_loss: 1.0054, test_f1: 0.6595
 epoch: 41, train_loss: 0.4156, test_loss: 1.0212, test_f1: 0.6632
 epoch: 42, train_loss: 0.4469, test_loss: 0.9918, test_f1: 0.6579
 epoch: 43, train_loss: 0.4360, test_loss: 1.0321, test_f1: 0.6416
 epoch: 44, train_loss: 0.4207, test_loss: 1.1642, test_f1: 0.6116
 epoch: 45, train_loss: 0.4098, test_loss: 0.9315, test_f1: 0.6474
 epoch: 46, train_loss: 0.4049, test_loss: 1.1950, test_f1: 0.6371
 epoch: 47, train_loss: 0.3973, test_loss: 1.0792, test_f1: 0.6639
 epoch: 48, train_loss: 0.3885, test_loss: 1.1510, test_f1: 0.6275
 epoch: 49, train_loss: 0.4262, test_loss: 1.0953, test_f1: 0.6521
 epoch: 50, train_loss: 0.3815, test_loss: 1.0908, test_f1: 0.6579
 epoch: 51, train_loss: 0.3370, test_loss: 0.9753, test_f1: 0.6954
 epoch: 52, train_loss: 0.3101, test_loss: 1.1112, test_f1: 0.6575
 epoch: 53, train_loss: 0.2918, test_loss: 1.1216, test_f1: 0.6779
 epoch: 54, train_loss: 0.2925, test_loss: 1.2646, test_f1: 0.6514
 epoch: 55, train_loss: 0.2883, test_loss: 1.1692, test_f1: 0.6751
 epoch: 56, train_loss: 0.2823, test_loss: 1.1326, test_f1: 0.6883
 epoch: 57, train_loss: 0.2909, test_loss: 1.2874, test_f1: 0.6764
 epoch: 58, train_loss: 0.2880, test_loss: 1.1165, test_f1: 0.6445
 epoch: 59, train_loss: 0.2752, test_loss: 1.1947, test_f1: 0.6918
 epoch: 60, train_loss: 0.2638, test_loss: 1.2173, test_f1: 0.6623
 epoch: 61, train_loss: 0.2611, test_loss: 1.2380, test_f1: 0.6815
 epoch: 62, train_loss: 0.2670, test_loss: 1.1986, test_f1: 0.6616
 epoch: 63, train_loss: 0.2790, test_loss: 1.2469, test_f1: 0.6607
 epoch: 64, train_loss: 0.2706, test_loss: 1.2709, test_f1: 0.6655
 epoch: 65, train_loss: 0.2553, test_loss: 1.1932, test_f1: 0.6750
 epoch: 66, train_loss: 0.2515, test_loss: 1.3507, test_f1: 0.6413
 epoch: 67, train_loss: 0.2457, test_loss: 1.2872, test_f1: 0.6463
 epoch: 68, train_loss: 0.2653, test_loss: 1.2801, test_f1: 0.6611
 epoch: 69, train_loss: 0.2438, test_loss: 1.3182, test_f1: 0.6846
 epoch: 70, train_loss: 0.2501, test_loss: 1.2669, test_f1: 0.6521
 epoch: 71, train_loss: 0.2397, test_loss: 1.2606, test_f1: 0.6518
 epoch: 72, train_loss: 0.2450, test_loss: 1.4133, test_f1: 0.6166
 epoch: 73, train_loss: 0.2332, test_loss: 1.4022, test_f1: 0.6520
 epoch: 74, train_loss: 0.2243, test_loss: 1.4651, test_f1: 0.6401
 epoch: 75, train_loss: 0.2399, test_loss: 1.3772, test_f1: 0.6757
 epoch: 76, train_loss: 0.2231, test_loss: 1.4111, test_f1: 0.6926
 epoch: 77, train_loss: 0.2237, test_loss: 1.4695, test_f1: 0.6605
 epoch: 78, train_loss: 0.2087, test_loss: 1.4682, test_f1: 0.6620
 epoch: 79, train_loss: 0.2273, test_loss: 1.3668, test_f1: 0.6677
 epoch: 80, train_loss: 0.2069, test_loss: 1.4370, test_f1: 0.6568
 epoch: 81, train_loss: 0.2232, test_loss: 1.4907, test_f1: 0.6613
 epoch: 82, train_loss: 0.2380, test_loss: 1.4786, test_f1: 0.6564
 epoch: 83, train_loss: 0.2088, test_loss: 1.4920, test_f1: 0.6775
 epoch: 84, train_loss: 0.2002, test_loss: 1.4144, test_f1: 0.6536
 epoch: 85, train_loss: 0.1882, test_loss: 1.6176, test_f1: 0.6299
 epoch: 86, train_loss: 0.1969, test_loss: 1.7590, test_f1: 0.6407
 epoch: 87, train_loss: 0.1923, test_loss: 1.4851, test_f1: 0.6689
 epoch: 88, train_loss: 0.1916, test_loss: 1.5960, test_f1: 0.6769
 epoch: 89, train_loss: 0.1796, test_loss: 1.6821, test_f1: 0.6524
 epoch: 90, train_loss: 0.2016, test_loss: 1.6833, test_f1: 0.6156
 epoch: 91, train_loss: 0.1956, test_loss: 1.6400, test_f1: 0.6627
 epoch: 92, train_loss: 0.1883, test_loss: 1.4776, test_f1: 0.6466
 epoch: 93, train_loss: 0.1719, test_loss: 1.6893, test_f1: 0.6536
 epoch: 94, train_loss: 0.1767, test_loss: 1.6197, test_f1: 0.6622
 epoch: 95, train_loss: 0.1800, test_loss: 1.5977, test_f1: 0.6576
 epoch: 96, train_loss: 0.1784, test_loss: 1.8045, test_f1: 0.6665
 epoch: 97, train_loss: 0.1882, test_loss: 1.6699, test_f1: 0.6136
 epoch: 98, train_loss: 0.1991, test_loss: 1.8496, test_f1: 0.6579
 epoch: 99, train_loss: 0.1803, test_loss: 1.7769, test_f1: 0.6604
##################ITERATION #5 ****************************************
 epoch: 0, train_loss: 1.4136, test_loss: 1.2957, test_f1: 0.3396
 epoch: 1, train_loss: 1.0295, test_loss: 1.0555, test_f1: 0.4827
 epoch: 2, train_loss: 0.9671, test_loss: 0.9783, test_f1: 0.5269
 epoch: 3, train_loss: 0.9120, test_loss: 0.9538, test_f1: 0.5224
 epoch: 4, train_loss: 0.8775, test_loss: 0.9249, test_f1: 0.5681
 epoch: 5, train_loss: 0.8510, test_loss: 0.8726, test_f1: 0.5447
 epoch: 6, train_loss: 0.8229, test_loss: 0.9216, test_f1: 0.5656
 epoch: 7, train_loss: 0.8007, test_loss: 0.9228, test_f1: 0.5574
 epoch: 8, train_loss: 0.7745, test_loss: 0.9014, test_f1: 0.5930
 epoch: 9, train_loss: 0.7401, test_loss: 0.9477, test_f1: 0.5661
 epoch: 10, train_loss: 0.7247, test_loss: 0.8285, test_f1: 0.6339
 epoch: 11, train_loss: 0.7244, test_loss: 0.8105, test_f1: 0.6347
 epoch: 12, train_loss: 0.6989, test_loss: 0.8061, test_f1: 0.5961
 epoch: 13, train_loss: 0.6806, test_loss: 0.9665, test_f1: 0.5554
 epoch: 14, train_loss: 0.6699, test_loss: 0.8784, test_f1: 0.5904
 epoch: 15, train_loss: 0.6570, test_loss: 0.7781, test_f1: 0.5944
 epoch: 16, train_loss: 0.6469, test_loss: 0.8367, test_f1: 0.6204
 epoch: 17, train_loss: 0.6154, test_loss: 0.8799, test_f1: 0.6309
 epoch: 18, train_loss: 0.6083, test_loss: 0.8675, test_f1: 0.6679
 epoch: 19, train_loss: 0.6048, test_loss: 0.9683, test_f1: 0.5907
 epoch: 20, train_loss: 0.5927, test_loss: 0.8527, test_f1: 0.6321
 epoch: 21, train_loss: 0.5847, test_loss: 0.8973, test_f1: 0.6233
 epoch: 22, train_loss: 0.5780, test_loss: 0.8446, test_f1: 0.6629
 epoch: 23, train_loss: 0.5477, test_loss: 0.8544, test_f1: 0.6703
 epoch: 24, train_loss: 0.5422, test_loss: 1.0112, test_f1: 0.5917
 epoch: 25, train_loss: 0.5288, test_loss: 0.8857, test_f1: 0.6294
 epoch: 26, train_loss: 0.5372, test_loss: 0.9396, test_f1: 0.6381
 epoch: 27, train_loss: 0.5113, test_loss: 0.8524, test_f1: 0.6213
 epoch: 28, train_loss: 0.5120, test_loss: 0.9531, test_f1: 0.6384
 epoch: 29, train_loss: 0.5035, test_loss: 0.9769, test_f1: 0.6598
 epoch: 30, train_loss: 0.5190, test_loss: 1.0527, test_f1: 0.6105
 epoch: 31, train_loss: 0.4939, test_loss: 0.9152, test_f1: 0.6401
 epoch: 32, train_loss: 0.4901, test_loss: 0.9648, test_f1: 0.6534
 epoch: 33, train_loss: 0.4823, test_loss: 0.8772, test_f1: 0.6534
 epoch: 34, train_loss: 0.4758, test_loss: 0.9535, test_f1: 0.6652
 epoch: 35, train_loss: 0.4449, test_loss: 1.0685, test_f1: 0.6377
 epoch: 36, train_loss: 0.4632, test_loss: 0.9875, test_f1: 0.6335
 epoch: 37, train_loss: 0.4503, test_loss: 0.9815, test_f1: 0.6576
 epoch: 38, train_loss: 0.4241, test_loss: 0.9680, test_f1: 0.6669
 epoch: 39, train_loss: 0.4313, test_loss: 1.1526, test_f1: 0.6457
 epoch: 40, train_loss: 0.4257, test_loss: 0.9154, test_f1: 0.6407
 epoch: 41, train_loss: 0.4291, test_loss: 0.9975, test_f1: 0.6603
 epoch: 42, train_loss: 0.4228, test_loss: 1.0057, test_f1: 0.6607
 epoch: 43, train_loss: 0.4041, test_loss: 1.0513, test_f1: 0.6638
 epoch: 44, train_loss: 0.3966, test_loss: 1.0213, test_f1: 0.6918
 epoch: 45, train_loss: 0.3653, test_loss: 0.9793, test_f1: 0.6516
 epoch: 46, train_loss: 0.3697, test_loss: 1.1062, test_f1: 0.6355
 epoch: 47, train_loss: 0.3857, test_loss: 1.0266, test_f1: 0.6752
 epoch: 48, train_loss: 0.3797, test_loss: 0.9952, test_f1: 0.6531
 epoch: 49, train_loss: 0.3753, test_loss: 1.0143, test_f1: 0.6644
 epoch: 50, train_loss: 0.3524, test_loss: 1.0225, test_f1: 0.6621
 epoch: 51, train_loss: 0.3341, test_loss: 1.0486, test_f1: 0.6454
 epoch: 52, train_loss: 0.3012, test_loss: 1.0301, test_f1: 0.6716
 epoch: 53, train_loss: 0.2883, test_loss: 1.0666, test_f1: 0.6658
 epoch: 54, train_loss: 0.2919, test_loss: 1.0822, test_f1: 0.6753
 epoch: 55, train_loss: 0.2816, test_loss: 1.1979, test_f1: 0.6327
 epoch: 56, train_loss: 0.2680, test_loss: 1.1045, test_f1: 0.6722
 epoch: 57, train_loss: 0.2596, test_loss: 1.1490, test_f1: 0.6546
 epoch: 58, train_loss: 0.2743, test_loss: 1.1507, test_f1: 0.6860
 epoch: 59, train_loss: 0.2599, test_loss: 1.2073, test_f1: 0.6630
 epoch: 60, train_loss: 0.2487, test_loss: 1.1907, test_f1: 0.6642
 epoch: 61, train_loss: 0.2596, test_loss: 1.1178, test_f1: 0.6705
 epoch: 62, train_loss: 0.2563, test_loss: 1.2344, test_f1: 0.6553
 epoch: 63, train_loss: 0.2405, test_loss: 1.2023, test_f1: 0.6566
 epoch: 64, train_loss: 0.2437, test_loss: 1.2185, test_f1: 0.6667
 epoch: 65, train_loss: 0.2353, test_loss: 1.3683, test_f1: 0.6480
 epoch: 66, train_loss: 0.2511, test_loss: 1.3140, test_f1: 0.6472
 epoch: 67, train_loss: 0.2615, test_loss: 1.3299, test_f1: 0.6267
 epoch: 68, train_loss: 0.2374, test_loss: 1.2225, test_f1: 0.6542
 epoch: 69, train_loss: 0.2455, test_loss: 1.3565, test_f1: 0.6676
 epoch: 70, train_loss: 0.2488, test_loss: 1.2605, test_f1: 0.6656
 epoch: 71, train_loss: 0.2245, test_loss: 1.3379, test_f1: 0.6583
 epoch: 72, train_loss: 0.2383, test_loss: 1.2836, test_f1: 0.6549
 epoch: 73, train_loss: 0.2493, test_loss: 1.2330, test_f1: 0.6709
 epoch: 74, train_loss: 0.2192, test_loss: 1.3227, test_f1: 0.6753
 epoch: 75, train_loss: 0.2057, test_loss: 1.4563, test_f1: 0.6505
 epoch: 76, train_loss: 0.2196, test_loss: 1.4223, test_f1: 0.6482
 epoch: 77, train_loss: 0.2117, test_loss: 1.3410, test_f1: 0.6786
 epoch: 78, train_loss: 0.2166, test_loss: 1.4438, test_f1: 0.6482
 epoch: 79, train_loss: 0.2178, test_loss: 1.4356, test_f1: 0.6510
 epoch: 80, train_loss: 0.2338, test_loss: 1.3352, test_f1: 0.6325
 epoch: 81, train_loss: 0.2141, test_loss: 1.4277, test_f1: 0.6560
 epoch: 82, train_loss: 0.2089, test_loss: 1.4404, test_f1: 0.6668
 epoch: 83, train_loss: 0.2192, test_loss: 1.6484, test_f1: 0.6246
 epoch: 84, train_loss: 0.2045, test_loss: 1.4788, test_f1: 0.6543
 epoch: 85, train_loss: 0.2044, test_loss: 1.4432, test_f1: 0.6747
 epoch: 86, train_loss: 0.1904, test_loss: 1.4831, test_f1: 0.6699
 epoch: 87, train_loss: 0.2002, test_loss: 1.5649, test_f1: 0.6505
 epoch: 88, train_loss: 0.1818, test_loss: 1.6564, test_f1: 0.6375
 epoch: 89, train_loss: 0.2014, test_loss: 1.4556, test_f1: 0.6465
 epoch: 90, train_loss: 0.1674, test_loss: 1.6569, test_f1: 0.6456
 epoch: 91, train_loss: 0.1894, test_loss: 1.5743, test_f1: 0.6574
 epoch: 92, train_loss: 0.1933, test_loss: 1.6788, test_f1: 0.6189
 epoch: 93, train_loss: 0.2000, test_loss: 1.4004, test_f1: 0.6593
 epoch: 94, train_loss: 0.1673, test_loss: 1.6164, test_f1: 0.6298
 epoch: 95, train_loss: 0.1783, test_loss: 1.4755, test_f1: 0.6561
 epoch: 96, train_loss: 0.1859, test_loss: 1.8336, test_f1: 0.6115
 epoch: 97, train_loss: 0.1861, test_loss: 1.5776, test_f1: 0.6406
 epoch: 98, train_loss: 0.1582, test_loss: 1.5845, test_f1: 0.6439
 epoch: 99, train_loss: 0.1618, test_loss: 1.5265, test_f1: 0.6446
##################ITERATION #6 ****************************************
 epoch: 0, train_loss: 1.3741, test_loss: 1.2617, test_f1: 0.3904
 epoch: 1, train_loss: 0.9739, test_loss: 0.9885, test_f1: 0.4906
 epoch: 2, train_loss: 0.9117, test_loss: 0.9541, test_f1: 0.5650
 epoch: 3, train_loss: 0.8843, test_loss: 0.9347, test_f1: 0.5646
 epoch: 4, train_loss: 0.8552, test_loss: 0.9517, test_f1: 0.5554
 epoch: 5, train_loss: 0.8189, test_loss: 0.8820, test_f1: 0.5940
 epoch: 6, train_loss: 0.7871, test_loss: 0.8688, test_f1: 0.5911
 epoch: 7, train_loss: 0.7742, test_loss: 0.8546, test_f1: 0.5988
 epoch: 8, train_loss: 0.7453, test_loss: 0.8570, test_f1: 0.5754
 epoch: 9, train_loss: 0.7322, test_loss: 0.8623, test_f1: 0.5675
 epoch: 10, train_loss: 0.7178, test_loss: 0.8083, test_f1: 0.6029
 epoch: 11, train_loss: 0.6917, test_loss: 0.8351, test_f1: 0.6254
 epoch: 12, train_loss: 0.6760, test_loss: 0.7893, test_f1: 0.6427
 epoch: 13, train_loss: 0.6748, test_loss: 0.8796, test_f1: 0.6128
 epoch: 14, train_loss: 0.6515, test_loss: 0.7539, test_f1: 0.6777
 epoch: 15, train_loss: 0.6637, test_loss: 0.8087, test_f1: 0.6512
 epoch: 16, train_loss: 0.6204, test_loss: 0.7875, test_f1: 0.6304
 epoch: 17, train_loss: 0.6259, test_loss: 0.8477, test_f1: 0.6136
 epoch: 18, train_loss: 0.5955, test_loss: 0.7965, test_f1: 0.6325
 epoch: 19, train_loss: 0.5757, test_loss: 0.9174, test_f1: 0.6209
 epoch: 20, train_loss: 0.5894, test_loss: 0.7793, test_f1: 0.6729
 epoch: 21, train_loss: 0.5731, test_loss: 0.7803, test_f1: 0.6844
 epoch: 22, train_loss: 0.5840, test_loss: 0.8492, test_f1: 0.6129
 epoch: 23, train_loss: 0.5585, test_loss: 0.8846, test_f1: 0.6399
 epoch: 24, train_loss: 0.5343, test_loss: 0.8652, test_f1: 0.6459
 epoch: 25, train_loss: 0.5201, test_loss: 0.8067, test_f1: 0.6796
 epoch: 26, train_loss: 0.5297, test_loss: 0.8526, test_f1: 0.6538
 epoch: 27, train_loss: 0.5019, test_loss: 0.8550, test_f1: 0.6461
 epoch: 28, train_loss: 0.4989, test_loss: 1.0071, test_f1: 0.6044
 epoch: 29, train_loss: 0.4870, test_loss: 0.8481, test_f1: 0.6387
 epoch: 30, train_loss: 0.4983, test_loss: 0.8127, test_f1: 0.6630
 epoch: 31, train_loss: 0.4707, test_loss: 0.8138, test_f1: 0.6759
 epoch: 32, train_loss: 0.4823, test_loss: 0.7677, test_f1: 0.6720
 epoch: 33, train_loss: 0.4529, test_loss: 0.8140, test_f1: 0.6773
 epoch: 34, train_loss: 0.4488, test_loss: 0.8040, test_f1: 0.6990
 epoch: 35, train_loss: 0.4283, test_loss: 0.8999, test_f1: 0.6566
 epoch: 36, train_loss: 0.4144, test_loss: 0.8474, test_f1: 0.6319
 epoch: 37, train_loss: 0.4306, test_loss: 0.8397, test_f1: 0.6496
 epoch: 38, train_loss: 0.4231, test_loss: 0.7890, test_f1: 0.6786
 epoch: 39, train_loss: 0.4144, test_loss: 0.8899, test_f1: 0.6478
 epoch: 40, train_loss: 0.4009, test_loss: 0.8839, test_f1: 0.6756
 epoch: 41, train_loss: 0.4329, test_loss: 0.8302, test_f1: 0.6462
 epoch: 42, train_loss: 0.4061, test_loss: 0.9297, test_f1: 0.6319
 epoch: 43, train_loss: 0.3858, test_loss: 0.8757, test_f1: 0.6887
 epoch: 44, train_loss: 0.3894, test_loss: 0.9482, test_f1: 0.6320
 epoch: 45, train_loss: 0.3781, test_loss: 0.9456, test_f1: 0.6563
 epoch: 46, train_loss: 0.3857, test_loss: 0.9129, test_f1: 0.6810
 epoch: 47, train_loss: 0.3717, test_loss: 1.0525, test_f1: 0.6546
 epoch: 48, train_loss: 0.3507, test_loss: 0.9415, test_f1: 0.6564
 epoch: 49, train_loss: 0.3397, test_loss: 0.9587, test_f1: 0.6547
 epoch: 50, train_loss: 0.3457, test_loss: 0.9721, test_f1: 0.6764
 epoch: 51, train_loss: 0.3354, test_loss: 0.9105, test_f1: 0.7029
 epoch: 52, train_loss: 0.2936, test_loss: 0.9205, test_f1: 0.7005
 epoch: 53, train_loss: 0.2799, test_loss: 0.9233, test_f1: 0.6817
 epoch: 54, train_loss: 0.2855, test_loss: 0.9849, test_f1: 0.6574
 epoch: 55, train_loss: 0.2913, test_loss: 1.0150, test_f1: 0.6901
 epoch: 56, train_loss: 0.2645, test_loss: 0.9476, test_f1: 0.6798
 epoch: 57, train_loss: 0.2574, test_loss: 0.9579, test_f1: 0.6897
 epoch: 58, train_loss: 0.2605, test_loss: 0.9493, test_f1: 0.6955
 epoch: 59, train_loss: 0.2607, test_loss: 1.0392, test_f1: 0.6992
 epoch: 60, train_loss: 0.2589, test_loss: 1.1026, test_f1: 0.6777
 epoch: 61, train_loss: 0.2373, test_loss: 0.9969, test_f1: 0.6864
 epoch: 62, train_loss: 0.2387, test_loss: 1.0469, test_f1: 0.6916
 epoch: 63, train_loss: 0.2459, test_loss: 1.0576, test_f1: 0.6931
 epoch: 64, train_loss: 0.2312, test_loss: 1.0882, test_f1: 0.6731
 epoch: 65, train_loss: 0.2488, test_loss: 1.1084, test_f1: 0.7073
 epoch: 66, train_loss: 0.2353, test_loss: 1.1556, test_f1: 0.6585
 epoch: 67, train_loss: 0.2147, test_loss: 1.2287, test_f1: 0.6671
 epoch: 68, train_loss: 0.2244, test_loss: 1.2215, test_f1: 0.6976
 epoch: 69, train_loss: 0.2310, test_loss: 1.1554, test_f1: 0.7034
 epoch: 70, train_loss: 0.2189, test_loss: 1.3080, test_f1: 0.6905
 epoch: 71, train_loss: 0.2111, test_loss: 1.2738, test_f1: 0.6664
 epoch: 72, train_loss: 0.2338, test_loss: 1.1904, test_f1: 0.6636
 epoch: 73, train_loss: 0.2074, test_loss: 1.1824, test_f1: 0.6697
 epoch: 74, train_loss: 0.2241, test_loss: 1.2300, test_f1: 0.6719
 epoch: 75, train_loss: 0.2246, test_loss: 1.2739, test_f1: 0.6541
 epoch: 76, train_loss: 0.2147, test_loss: 1.2267, test_f1: 0.6480
 epoch: 77, train_loss: 0.2121, test_loss: 1.1855, test_f1: 0.6642
 epoch: 78, train_loss: 0.1947, test_loss: 1.2334, test_f1: 0.6832
 epoch: 79, train_loss: 0.2063, test_loss: 1.2436, test_f1: 0.6761
 epoch: 80, train_loss: 0.1860, test_loss: 1.2561, test_f1: 0.6935
 epoch: 81, train_loss: 0.1953, test_loss: 1.4273, test_f1: 0.6900
 epoch: 82, train_loss: 0.1981, test_loss: 1.3480, test_f1: 0.6863
 epoch: 83, train_loss: 0.1960, test_loss: 1.2958, test_f1: 0.6668
 epoch: 84, train_loss: 0.1974, test_loss: 1.6062, test_f1: 0.6311
 epoch: 85, train_loss: 0.1947, test_loss: 1.2034, test_f1: 0.6623
 epoch: 86, train_loss: 0.1876, test_loss: 1.8609, test_f1: 0.6361
 epoch: 87, train_loss: 0.2020, test_loss: 1.1917, test_f1: 0.6817
 epoch: 88, train_loss: 0.1883, test_loss: 1.3474, test_f1: 0.6480
 epoch: 89, train_loss: 0.1935, test_loss: 1.2213, test_f1: 0.6755
 epoch: 90, train_loss: 0.1853, test_loss: 1.3787, test_f1: 0.6943
 epoch: 91, train_loss: 0.1802, test_loss: 1.5721, test_f1: 0.6717
 epoch: 92, train_loss: 0.1844, test_loss: 1.3724, test_f1: 0.6457
 epoch: 93, train_loss: 0.1917, test_loss: 1.5211, test_f1: 0.6842
 epoch: 94, train_loss: 0.1905, test_loss: 1.3361, test_f1: 0.7023
 epoch: 95, train_loss: 0.1902, test_loss: 1.2290, test_f1: 0.7199
 epoch: 96, train_loss: 0.2023, test_loss: 1.2646, test_f1: 0.6696
 epoch: 97, train_loss: 0.1676, test_loss: 1.2490, test_f1: 0.7049
 epoch: 98, train_loss: 0.1692, test_loss: 1.3118, test_f1: 0.6727
 epoch: 99, train_loss: 0.1554, test_loss: 1.4059, test_f1: 0.7078
##################ITERATION #7 ****************************************
 epoch: 0, train_loss: 1.4740, test_loss: 1.3498, test_f1: 0.2286
 epoch: 1, train_loss: 1.0147, test_loss: 1.0573, test_f1: 0.4022
 epoch: 2, train_loss: 0.9597, test_loss: 1.0229, test_f1: 0.4718
 epoch: 3, train_loss: 0.9147, test_loss: 0.9755, test_f1: 0.5197
 epoch: 4, train_loss: 0.8889, test_loss: 0.9217, test_f1: 0.5576
 epoch: 5, train_loss: 0.8503, test_loss: 0.9652, test_f1: 0.5125
 epoch: 6, train_loss: 0.8305, test_loss: 0.8725, test_f1: 0.5744
 epoch: 7, train_loss: 0.8088, test_loss: 0.8579, test_f1: 0.5652
 epoch: 8, train_loss: 0.7794, test_loss: 0.9540, test_f1: 0.5252
 epoch: 9, train_loss: 0.7608, test_loss: 0.8974, test_f1: 0.5987
 epoch: 10, train_loss: 0.7544, test_loss: 0.8555, test_f1: 0.5909
 epoch: 11, train_loss: 0.7342, test_loss: 0.9174, test_f1: 0.5836
 epoch: 12, train_loss: 0.7266, test_loss: 0.8629, test_f1: 0.5922
 epoch: 13, train_loss: 0.7222, test_loss: 0.9264, test_f1: 0.5755
 epoch: 14, train_loss: 0.6983, test_loss: 0.8819, test_f1: 0.5846
 epoch: 15, train_loss: 0.6778, test_loss: 0.8569, test_f1: 0.6067
 epoch: 16, train_loss: 0.6759, test_loss: 0.9702, test_f1: 0.5836
 epoch: 17, train_loss: 0.6657, test_loss: 0.9034, test_f1: 0.6141
 epoch: 18, train_loss: 0.6414, test_loss: 0.8800, test_f1: 0.6181
 epoch: 19, train_loss: 0.6183, test_loss: 0.9475, test_f1: 0.6131
 epoch: 20, train_loss: 0.6213, test_loss: 1.1942, test_f1: 0.5251
 epoch: 21, train_loss: 0.6097, test_loss: 0.9220, test_f1: 0.5958
 epoch: 22, train_loss: 0.5945, test_loss: 0.9893, test_f1: 0.5548
 epoch: 23, train_loss: 0.5870, test_loss: 0.8973, test_f1: 0.6463
 epoch: 24, train_loss: 0.5833, test_loss: 0.9348, test_f1: 0.5767
 epoch: 25, train_loss: 0.5694, test_loss: 0.9828, test_f1: 0.5735
 epoch: 26, train_loss: 0.5482, test_loss: 0.8929, test_f1: 0.5974
 epoch: 27, train_loss: 0.5730, test_loss: 1.2128, test_f1: 0.5173
 epoch: 28, train_loss: 0.5389, test_loss: 0.8868, test_f1: 0.6445
 epoch: 29, train_loss: 0.5124, test_loss: 0.8847, test_f1: 0.5878
 epoch: 30, train_loss: 0.5063, test_loss: 0.9038, test_f1: 0.6250
 epoch: 31, train_loss: 0.5132, test_loss: 1.0820, test_f1: 0.6022
 epoch: 32, train_loss: 0.5132, test_loss: 0.9694, test_f1: 0.6122
 epoch: 33, train_loss: 0.4985, test_loss: 0.8918, test_f1: 0.6338
 epoch: 34, train_loss: 0.5126, test_loss: 0.8804, test_f1: 0.6411
 epoch: 35, train_loss: 0.4812, test_loss: 0.9196, test_f1: 0.6320
 epoch: 36, train_loss: 0.4608, test_loss: 0.9913, test_f1: 0.6129
 epoch: 37, train_loss: 0.4611, test_loss: 0.9234, test_f1: 0.6299
 epoch: 38, train_loss: 0.4493, test_loss: 1.4065, test_f1: 0.5612
 epoch: 39, train_loss: 0.4716, test_loss: 0.9909, test_f1: 0.6404
 epoch: 40, train_loss: 0.4386, test_loss: 0.9678, test_f1: 0.6316
 epoch: 41, train_loss: 0.4413, test_loss: 1.0358, test_f1: 0.6131
 epoch: 42, train_loss: 0.4521, test_loss: 1.0315, test_f1: 0.6357
 epoch: 43, train_loss: 0.4480, test_loss: 0.9491, test_f1: 0.6261
 epoch: 44, train_loss: 0.4279, test_loss: 1.1723, test_f1: 0.5941
 epoch: 45, train_loss: 0.4253, test_loss: 1.0488, test_f1: 0.6408
 epoch: 46, train_loss: 0.4039, test_loss: 0.9086, test_f1: 0.6590
 epoch: 47, train_loss: 0.4022, test_loss: 1.0188, test_f1: 0.6296
 epoch: 48, train_loss: 0.3811, test_loss: 1.0829, test_f1: 0.6463
 epoch: 49, train_loss: 0.3945, test_loss: 1.1152, test_f1: 0.5907
 epoch: 50, train_loss: 0.3793, test_loss: 0.9650, test_f1: 0.6412
 epoch: 51, train_loss: 0.3508, test_loss: 1.0095, test_f1: 0.6792
 epoch: 52, train_loss: 0.3196, test_loss: 1.0169, test_f1: 0.6333
 epoch: 53, train_loss: 0.3230, test_loss: 1.1276, test_f1: 0.6463
 epoch: 54, train_loss: 0.3068, test_loss: 1.0720, test_f1: 0.6781
 epoch: 55, train_loss: 0.2906, test_loss: 1.0495, test_f1: 0.6532
 epoch: 56, train_loss: 0.2977, test_loss: 1.1735, test_f1: 0.6323
 epoch: 57, train_loss: 0.2937, test_loss: 1.0979, test_f1: 0.6646
 epoch: 58, train_loss: 0.2990, test_loss: 1.1371, test_f1: 0.6346
 epoch: 59, train_loss: 0.2781, test_loss: 1.1621, test_f1: 0.6428
 epoch: 60, train_loss: 0.2945, test_loss: 1.0584, test_f1: 0.6640
 epoch: 61, train_loss: 0.2922, test_loss: 1.1320, test_f1: 0.6684
 epoch: 62, train_loss: 0.2583, test_loss: 1.1510, test_f1: 0.6813
 epoch: 63, train_loss: 0.2760, test_loss: 1.3611, test_f1: 0.6234
 epoch: 64, train_loss: 0.2593, test_loss: 1.2462, test_f1: 0.6395
 epoch: 65, train_loss: 0.2641, test_loss: 1.1594, test_f1: 0.6714
 epoch: 66, train_loss: 0.2573, test_loss: 1.1665, test_f1: 0.6522
 epoch: 67, train_loss: 0.2706, test_loss: 1.2543, test_f1: 0.6354
 epoch: 68, train_loss: 0.2596, test_loss: 1.2056, test_f1: 0.6479
 epoch: 69, train_loss: 0.2583, test_loss: 1.2290, test_f1: 0.6429
 epoch: 70, train_loss: 0.2663, test_loss: 1.2822, test_f1: 0.6575
 epoch: 71, train_loss: 0.2584, test_loss: 1.3409, test_f1: 0.6340
 epoch: 72, train_loss: 0.2578, test_loss: 1.2474, test_f1: 0.6589
 epoch: 73, train_loss: 0.2441, test_loss: 1.1396, test_f1: 0.6722
 epoch: 74, train_loss: 0.2429, test_loss: 1.2541, test_f1: 0.6592
 epoch: 75, train_loss: 0.2438, test_loss: 1.3390, test_f1: 0.6684
 epoch: 76, train_loss: 0.2450, test_loss: 1.2738, test_f1: 0.6324
 epoch: 77, train_loss: 0.2338, test_loss: 1.2068, test_f1: 0.6315
 epoch: 78, train_loss: 0.2255, test_loss: 1.2891, test_f1: 0.6444
 epoch: 79, train_loss: 0.2282, test_loss: 1.1567, test_f1: 0.6715
 epoch: 80, train_loss: 0.2300, test_loss: 1.2898, test_f1: 0.6585
 epoch: 81, train_loss: 0.2301, test_loss: 1.2420, test_f1: 0.6489
 epoch: 82, train_loss: 0.2391, test_loss: 1.2852, test_f1: 0.6451
 epoch: 83, train_loss: 0.2084, test_loss: 1.2330, test_f1: 0.6492
 epoch: 84, train_loss: 0.2175, test_loss: 1.3496, test_f1: 0.6444
 epoch: 85, train_loss: 0.2177, test_loss: 1.6484, test_f1: 0.6114
 epoch: 86, train_loss: 0.2121, test_loss: 1.3778, test_f1: 0.6233
 epoch: 87, train_loss: 0.2288, test_loss: 1.3252, test_f1: 0.6727
 epoch: 88, train_loss: 0.2044, test_loss: 1.2627, test_f1: 0.6561
 epoch: 89, train_loss: 0.1995, test_loss: 1.3974, test_f1: 0.6469
 epoch: 90, train_loss: 0.2006, test_loss: 1.4089, test_f1: 0.6406
 epoch: 91, train_loss: 0.2104, test_loss: 1.4389, test_f1: 0.6553
 epoch: 92, train_loss: 0.2025, test_loss: 1.4506, test_f1: 0.6650
 epoch: 93, train_loss: 0.2078, test_loss: 1.3652, test_f1: 0.6748
 epoch: 94, train_loss: 0.1955, test_loss: 1.3881, test_f1: 0.6605
 epoch: 95, train_loss: 0.1814, test_loss: 1.4905, test_f1: 0.6577
 epoch: 96, train_loss: 0.1984, test_loss: 1.5987, test_f1: 0.6214
 epoch: 97, train_loss: 0.2008, test_loss: 1.3551, test_f1: 0.6402
 epoch: 98, train_loss: 0.2011, test_loss: 1.9166, test_f1: 0.5934
 epoch: 99, train_loss: 0.1983, test_loss: 1.5068, test_f1: 0.6367
##################ITERATION #8 ****************************************
 epoch: 0, train_loss: 1.4984, test_loss: 1.1583, test_f1: 0.2406
 epoch: 1, train_loss: 1.0288, test_loss: 1.0007, test_f1: 0.4362
 epoch: 2, train_loss: 0.9655, test_loss: 0.9717, test_f1: 0.5122
 epoch: 3, train_loss: 0.9375, test_loss: 0.9653, test_f1: 0.5709
 epoch: 4, train_loss: 0.9150, test_loss: 0.9480, test_f1: 0.5269
 epoch: 5, train_loss: 0.8995, test_loss: 0.9316, test_f1: 0.5484
 epoch: 6, train_loss: 0.8600, test_loss: 0.9200, test_f1: 0.5351
 epoch: 7, train_loss: 0.8348, test_loss: 0.9705, test_f1: 0.5383
 epoch: 8, train_loss: 0.8218, test_loss: 0.9904, test_f1: 0.5434
 epoch: 9, train_loss: 0.7973, test_loss: 0.8994, test_f1: 0.5776
 epoch: 10, train_loss: 0.7537, test_loss: 0.8606, test_f1: 0.6153
 epoch: 11, train_loss: 0.7261, test_loss: 0.9734, test_f1: 0.5668
 epoch: 12, train_loss: 0.7375, test_loss: 0.9596, test_f1: 0.5478
 epoch: 13, train_loss: 0.7348, test_loss: 0.8584, test_f1: 0.6226
 epoch: 14, train_loss: 0.7020, test_loss: 0.8644, test_f1: 0.5872
 epoch: 15, train_loss: 0.6841, test_loss: 0.8339, test_f1: 0.6277
 epoch: 16, train_loss: 0.6625, test_loss: 0.8546, test_f1: 0.6170
 epoch: 17, train_loss: 0.6426, test_loss: 0.8667, test_f1: 0.6277
 epoch: 18, train_loss: 0.6297, test_loss: 0.8974, test_f1: 0.5877
 epoch: 19, train_loss: 0.6269, test_loss: 0.8377, test_f1: 0.6325
 epoch: 20, train_loss: 0.6151, test_loss: 0.8836, test_f1: 0.6012
 epoch: 21, train_loss: 0.6192, test_loss: 0.8708, test_f1: 0.6282
 epoch: 22, train_loss: 0.5969, test_loss: 0.8868, test_f1: 0.6063
 epoch: 23, train_loss: 0.5817, test_loss: 0.8676, test_f1: 0.6233
 epoch: 24, train_loss: 0.5781, test_loss: 0.8468, test_f1: 0.6279
 epoch: 25, train_loss: 0.5780, test_loss: 0.9015, test_f1: 0.5904
 epoch: 26, train_loss: 0.5556, test_loss: 1.0829, test_f1: 0.5475
 epoch: 27, train_loss: 0.5270, test_loss: 0.9184, test_f1: 0.6209
 epoch: 28, train_loss: 0.5330, test_loss: 0.8806, test_f1: 0.6471
 epoch: 29, train_loss: 0.5351, test_loss: 0.8288, test_f1: 0.6590
 epoch: 30, train_loss: 0.4882, test_loss: 0.9356, test_f1: 0.6352
 epoch: 31, train_loss: 0.4896, test_loss: 1.0314, test_f1: 0.6446
 epoch: 32, train_loss: 0.4900, test_loss: 0.9108, test_f1: 0.6452
 epoch: 33, train_loss: 0.4644, test_loss: 0.9753, test_f1: 0.6060
 epoch: 34, train_loss: 0.4563, test_loss: 1.0359, test_f1: 0.5935
 epoch: 35, train_loss: 0.4781, test_loss: 0.9610, test_f1: 0.6612
 epoch: 36, train_loss: 0.4567, test_loss: 0.9361, test_f1: 0.6360
 epoch: 37, train_loss: 0.4479, test_loss: 1.1371, test_f1: 0.5879
 epoch: 38, train_loss: 0.4513, test_loss: 0.9818, test_f1: 0.6534
 epoch: 39, train_loss: 0.4479, test_loss: 1.1114, test_f1: 0.6305
 epoch: 40, train_loss: 0.4352, test_loss: 1.0721, test_f1: 0.5730
 epoch: 41, train_loss: 0.4136, test_loss: 1.1213, test_f1: 0.6175
 epoch: 42, train_loss: 0.4510, test_loss: 0.9030, test_f1: 0.6544
 epoch: 43, train_loss: 0.3963, test_loss: 1.0771, test_f1: 0.6411
 epoch: 44, train_loss: 0.4020, test_loss: 1.0425, test_f1: 0.6355
 epoch: 45, train_loss: 0.4110, test_loss: 0.9772, test_f1: 0.6476
 epoch: 46, train_loss: 0.3671, test_loss: 1.0108, test_f1: 0.6587
 epoch: 47, train_loss: 0.3845, test_loss: 1.0016, test_f1: 0.6315
 epoch: 48, train_loss: 0.4049, test_loss: 1.2832, test_f1: 0.5991
 epoch: 49, train_loss: 0.3766, test_loss: 1.0935, test_f1: 0.6486
 epoch: 50, train_loss: 0.3683, test_loss: 1.2000, test_f1: 0.6121
 epoch: 51, train_loss: 0.3267, test_loss: 1.0002, test_f1: 0.6524
 epoch: 52, train_loss: 0.3064, test_loss: 1.0962, test_f1: 0.6624
 epoch: 53, train_loss: 0.3219, test_loss: 1.0636, test_f1: 0.6750
 epoch: 54, train_loss: 0.2974, test_loss: 1.0925, test_f1: 0.6708
 epoch: 55, train_loss: 0.2778, test_loss: 1.1017, test_f1: 0.6724
 epoch: 56, train_loss: 0.2889, test_loss: 1.1348, test_f1: 0.6681
 epoch: 57, train_loss: 0.2687, test_loss: 1.0841, test_f1: 0.6783
 epoch: 58, train_loss: 0.2720, test_loss: 1.1693, test_f1: 0.6726
 epoch: 59, train_loss: 0.2743, test_loss: 1.1346, test_f1: 0.6673
 epoch: 60, train_loss: 0.2750, test_loss: 1.2196, test_f1: 0.6829
 epoch: 61, train_loss: 0.2849, test_loss: 1.0853, test_f1: 0.6767
 epoch: 62, train_loss: 0.2613, test_loss: 1.2611, test_f1: 0.6613
 epoch: 63, train_loss: 0.2521, test_loss: 1.2285, test_f1: 0.6870
 epoch: 64, train_loss: 0.2474, test_loss: 1.2258, test_f1: 0.6387
 epoch: 65, train_loss: 0.2453, test_loss: 1.1406, test_f1: 0.6746
 epoch: 66, train_loss: 0.2433, test_loss: 1.2806, test_f1: 0.6662
 epoch: 67, train_loss: 0.2598, test_loss: 1.3189, test_f1: 0.6577
 epoch: 68, train_loss: 0.2493, test_loss: 1.2555, test_f1: 0.6756
 epoch: 69, train_loss: 0.2373, test_loss: 1.2913, test_f1: 0.6518
 epoch: 70, train_loss: 0.2394, test_loss: 1.3352, test_f1: 0.6631
 epoch: 71, train_loss: 0.2474, test_loss: 1.2952, test_f1: 0.6586
 epoch: 72, train_loss: 0.2383, test_loss: 1.3857, test_f1: 0.6394
 epoch: 73, train_loss: 0.2454, test_loss: 1.2551, test_f1: 0.6829
 epoch: 74, train_loss: 0.2348, test_loss: 1.4278, test_f1: 0.6818
 epoch: 75, train_loss: 0.2395, test_loss: 1.2862, test_f1: 0.6587
 epoch: 76, train_loss: 0.2273, test_loss: 1.4245, test_f1: 0.6679
 epoch: 77, train_loss: 0.2414, test_loss: 1.3446, test_f1: 0.6808
 epoch: 78, train_loss: 0.2443, test_loss: 1.2891, test_f1: 0.6843
 epoch: 79, train_loss: 0.2430, test_loss: 1.4639, test_f1: 0.6684
 epoch: 80, train_loss: 0.2282, test_loss: 1.3909, test_f1: 0.6226
 epoch: 81, train_loss: 0.2108, test_loss: 1.3383, test_f1: 0.6770
 epoch: 82, train_loss: 0.1993, test_loss: 1.4330, test_f1: 0.6839
 epoch: 83, train_loss: 0.2128, test_loss: 1.3981, test_f1: 0.6571
 epoch: 84, train_loss: 0.2052, test_loss: 1.4797, test_f1: 0.6777
 epoch: 85, train_loss: 0.2093, test_loss: 1.3474, test_f1: 0.6555
 epoch: 86, train_loss: 0.2037, test_loss: 1.4819, test_f1: 0.6354
 epoch: 87, train_loss: 0.1924, test_loss: 1.4614, test_f1: 0.6616
 epoch: 88, train_loss: 0.1872, test_loss: 1.5977, test_f1: 0.6028
 epoch: 89, train_loss: 0.1961, test_loss: 1.5306, test_f1: 0.6580
 epoch: 90, train_loss: 0.1951, test_loss: 1.4870, test_f1: 0.6625
 epoch: 91, train_loss: 0.1795, test_loss: 1.4940, test_f1: 0.6371
 epoch: 92, train_loss: 0.1858, test_loss: 1.5328, test_f1: 0.6580
 epoch: 93, train_loss: 0.2055, test_loss: 1.4273, test_f1: 0.6521
 epoch: 94, train_loss: 0.1961, test_loss: 1.4804, test_f1: 0.6261
 epoch: 95, train_loss: 0.1936, test_loss: 1.5204, test_f1: 0.6582
 epoch: 96, train_loss: 0.1955, test_loss: 1.6626, test_f1: 0.6498
 epoch: 97, train_loss: 0.1788, test_loss: 1.4835, test_f1: 0.6714
 epoch: 98, train_loss: 0.1883, test_loss: 1.5130, test_f1: 0.6581
 epoch: 99, train_loss: 0.1756, test_loss: 1.6370, test_f1: 0.6514
##################ITERATION #9 ****************************************
 epoch: 0, train_loss: 1.3948, test_loss: 1.1991, test_f1: 0.2932
 epoch: 1, train_loss: 0.9932, test_loss: 0.9822, test_f1: 0.5037
 epoch: 2, train_loss: 0.9354, test_loss: 0.9305, test_f1: 0.5485
 epoch: 3, train_loss: 0.8943, test_loss: 0.8895, test_f1: 0.5708
 epoch: 4, train_loss: 0.8731, test_loss: 0.9115, test_f1: 0.5841
 epoch: 5, train_loss: 0.8478, test_loss: 0.8947, test_f1: 0.5791
 epoch: 6, train_loss: 0.8209, test_loss: 0.8395, test_f1: 0.5819
 epoch: 7, train_loss: 0.7887, test_loss: 0.8823, test_f1: 0.5577
 epoch: 8, train_loss: 0.7824, test_loss: 1.0580, test_f1: 0.5013
 epoch: 9, train_loss: 0.7588, test_loss: 0.8823, test_f1: 0.5327
 epoch: 10, train_loss: 0.7373, test_loss: 0.8395, test_f1: 0.5909
 epoch: 11, train_loss: 0.7240, test_loss: 0.8223, test_f1: 0.5620
 epoch: 12, train_loss: 0.7065, test_loss: 0.9293, test_f1: 0.6141
 epoch: 13, train_loss: 0.7047, test_loss: 0.8354, test_f1: 0.6122
 epoch: 14, train_loss: 0.6778, test_loss: 0.8458, test_f1: 0.6154
 epoch: 15, train_loss: 0.6647, test_loss: 0.8801, test_f1: 0.6156
 epoch: 16, train_loss: 0.6537, test_loss: 0.9360, test_f1: 0.5899
 epoch: 17, train_loss: 0.6386, test_loss: 0.8646, test_f1: 0.6018
 epoch: 18, train_loss: 0.6247, test_loss: 0.9615, test_f1: 0.5959
 epoch: 19, train_loss: 0.6149, test_loss: 0.9863, test_f1: 0.5978
 epoch: 20, train_loss: 0.5951, test_loss: 0.8615, test_f1: 0.6347
 epoch: 21, train_loss: 0.6121, test_loss: 0.8645, test_f1: 0.6054
 epoch: 22, train_loss: 0.5952, test_loss: 0.9554, test_f1: 0.6505
 epoch: 23, train_loss: 0.5738, test_loss: 0.9099, test_f1: 0.6301
 epoch: 24, train_loss: 0.5475, test_loss: 0.9119, test_f1: 0.6545
 epoch: 25, train_loss: 0.5553, test_loss: 0.9379, test_f1: 0.6070
 epoch: 26, train_loss: 0.5335, test_loss: 0.9079, test_f1: 0.6447
 epoch: 27, train_loss: 0.5325, test_loss: 1.0699, test_f1: 0.5613
 epoch: 28, train_loss: 0.5089, test_loss: 0.9606, test_f1: 0.6494
 epoch: 29, train_loss: 0.5091, test_loss: 1.0810, test_f1: 0.6310
 epoch: 30, train_loss: 0.5128, test_loss: 1.0091, test_f1: 0.5817
 epoch: 31, train_loss: 0.5089, test_loss: 1.0535, test_f1: 0.6243
 epoch: 32, train_loss: 0.4777, test_loss: 0.9553, test_f1: 0.6439
 epoch: 33, train_loss: 0.4643, test_loss: 0.8395, test_f1: 0.6483
 epoch: 34, train_loss: 0.4688, test_loss: 0.9508, test_f1: 0.6559
 epoch: 35, train_loss: 0.4549, test_loss: 1.0738, test_f1: 0.6202
 epoch: 36, train_loss: 0.4549, test_loss: 1.0053, test_f1: 0.6371
 epoch: 37, train_loss: 0.4537, test_loss: 1.2026, test_f1: 0.6014
 epoch: 38, train_loss: 0.4339, test_loss: 1.1334, test_f1: 0.6119
 epoch: 39, train_loss: 0.4398, test_loss: 1.0310, test_f1: 0.6668
 epoch: 40, train_loss: 0.4162, test_loss: 1.0485, test_f1: 0.6452
 epoch: 41, train_loss: 0.4056, test_loss: 0.9761, test_f1: 0.6676
 epoch: 42, train_loss: 0.4070, test_loss: 0.9445, test_f1: 0.6518
 epoch: 43, train_loss: 0.3960, test_loss: 1.0855, test_f1: 0.6419
 epoch: 44, train_loss: 0.3568, test_loss: 1.1952, test_f1: 0.6455
 epoch: 45, train_loss: 0.3687, test_loss: 1.1029, test_f1: 0.6326
 epoch: 46, train_loss: 0.3580, test_loss: 1.1790, test_f1: 0.6444
 epoch: 47, train_loss: 0.3629, test_loss: 1.2451, test_f1: 0.6715
 epoch: 48, train_loss: 0.3676, test_loss: 1.2346, test_f1: 0.6039
 epoch: 49, train_loss: 0.3638, test_loss: 1.2579, test_f1: 0.6702
 epoch: 50, train_loss: 0.3493, test_loss: 1.1552, test_f1: 0.6418
 epoch: 51, train_loss: 0.3143, test_loss: 1.1578, test_f1: 0.6500
 epoch: 52, train_loss: 0.2843, test_loss: 1.1823, test_f1: 0.6447
 epoch: 53, train_loss: 0.2716, test_loss: 1.2141, test_f1: 0.6539
 epoch: 54, train_loss: 0.2635, test_loss: 1.2407, test_f1: 0.6649
 epoch: 55, train_loss: 0.2684, test_loss: 1.2533, test_f1: 0.6703
 epoch: 56, train_loss: 0.2567, test_loss: 1.2972, test_f1: 0.6265
 epoch: 57, train_loss: 0.2646, test_loss: 1.3918, test_f1: 0.6322
 epoch: 58, train_loss: 0.2553, test_loss: 1.2464, test_f1: 0.6608
 epoch: 59, train_loss: 0.2481, test_loss: 1.5109, test_f1: 0.6356
 epoch: 60, train_loss: 0.2434, test_loss: 1.3020, test_f1: 0.6790
 epoch: 61, train_loss: 0.2429, test_loss: 1.6806, test_f1: 0.6360
 epoch: 62, train_loss: 0.2306, test_loss: 1.3261, test_f1: 0.6688
 epoch: 63, train_loss: 0.2349, test_loss: 1.4496, test_f1: 0.6550
 epoch: 64, train_loss: 0.2342, test_loss: 1.5688, test_f1: 0.6428
 epoch: 65, train_loss: 0.2175, test_loss: 1.3731, test_f1: 0.6737
 epoch: 66, train_loss: 0.2532, test_loss: 1.4908, test_f1: 0.6509
 epoch: 67, train_loss: 0.2123, test_loss: 1.3613, test_f1: 0.6634
 epoch: 68, train_loss: 0.2154, test_loss: 1.5206, test_f1: 0.6743
 epoch: 69, train_loss: 0.2156, test_loss: 1.5515, test_f1: 0.6307
 epoch: 70, train_loss: 0.2035, test_loss: 1.3563, test_f1: 0.6702
 epoch: 71, train_loss: 0.2129, test_loss: 1.5117, test_f1: 0.6694
 epoch: 72, train_loss: 0.2027, test_loss: 1.5766, test_f1: 0.6426
 epoch: 73, train_loss: 0.2052, test_loss: 1.3745, test_f1: 0.6662
 epoch: 74, train_loss: 0.1988, test_loss: 1.5462, test_f1: 0.6604
 epoch: 75, train_loss: 0.1922, test_loss: 1.7456, test_f1: 0.6592
 epoch: 76, train_loss: 0.1989, test_loss: 1.5870, test_f1: 0.6339
 epoch: 77, train_loss: 0.2015, test_loss: 1.7246, test_f1: 0.6360
 epoch: 78, train_loss: 0.1934, test_loss: 1.6415, test_f1: 0.6517
 epoch: 79, train_loss: 0.2020, test_loss: 1.6307, test_f1: 0.6319
 epoch: 80, train_loss: 0.2167, test_loss: 1.4701, test_f1: 0.6593
 epoch: 81, train_loss: 0.2171, test_loss: 1.5674, test_f1: 0.6516
 epoch: 82, train_loss: 0.2083, test_loss: 1.5757, test_f1: 0.6752
 epoch: 83, train_loss: 0.1988, test_loss: 1.8575, test_f1: 0.6215
 epoch: 84, train_loss: 0.2010, test_loss: 1.6472, test_f1: 0.6692
 epoch: 85, train_loss: 0.1971, test_loss: 1.5843, test_f1: 0.6307
 epoch: 86, train_loss: 0.1774, test_loss: 1.5672, test_f1: 0.6540
 epoch: 87, train_loss: 0.1821, test_loss: 1.7928, test_f1: 0.6172
 epoch: 88, train_loss: 0.1805, test_loss: 1.6440, test_f1: 0.6617
 epoch: 89, train_loss: 0.1788, test_loss: 1.6735, test_f1: 0.6179
 epoch: 90, train_loss: 0.1797, test_loss: 1.7393, test_f1: 0.6547
 epoch: 91, train_loss: 0.1722, test_loss: 1.6841, test_f1: 0.6383
 epoch: 92, train_loss: 0.1887, test_loss: 1.7640, test_f1: 0.6393
 epoch: 93, train_loss: 0.1785, test_loss: 1.6801, test_f1: 0.6391
 epoch: 94, train_loss: 0.1786, test_loss: 1.7353, test_f1: 0.6499
 epoch: 95, train_loss: 0.1604, test_loss: 1.6491, test_f1: 0.6332
 epoch: 96, train_loss: 0.1619, test_loss: 1.8836, test_f1: 0.6155
 epoch: 97, train_loss: 0.1469, test_loss: 1.7917, test_f1: 0.6486
 epoch: 98, train_loss: 0.1483, test_loss: 1.9926, test_f1: 0.6227
 epoch: 99, train_loss: 0.1654, test_loss: 1.8284, test_f1: 0.6476

Training completed in 473.14 seconds
Best F1: 0.7199 at epoch 95
Mean F1 across iterations: 0.6938  0.0119
========================FINAL RESULTS================================
FEGIN weighted F1: 0.7199  0.0119
python main.py --data ltspice_examples --representation component_pin --model FEGIN --layers 2 --hiddens 128 --batch_size 128 --lr 0.001 --emb_size 250 --epochs 100 --save_appendix component_pin_L2_H128_BS128_LR0.001_E250 --no_val
-----



STDERR:
  File "main.py", line 370, in <module>
    main()
  File "main.py", line 254, in main
    dataset = dataset_class(
  File "/home/philip/projects/ltspice_examples_code_repo/Circuit-Completion-Using-GNNs/component_classification_with_link_prediction_head/evaluation/FEGIN/kernel/circuit_datasets.py", line 15, in __init__
    self.data, self.slices = torch.load(self.processed_paths[0])
  File "/home/philip/.local/lib/python3.8/site-packages/torch/serialization.py", line 1040, in load
    warnings.warn(
  File "/usr/lib/python3.8/warnings.py", line 109, in _showwarnmsg
    sw(msg.message, msg.category, msg.filename, msg.lineno,
  File "main.py", line 47, in warn_with_traceback
    traceback.print_stack(file=log)
/home/philip/projects/ltspice_examples_code_repo/Circuit-Completion-Using-GNNs/component_classification_with_link_prediction_head/evaluation/FEGIN/kernel/circuit_datasets.py:15: FutureWarning: You are using `torch.load` with `weights_only=False` (the current default value), which uses the default pickle module implicitly. It is possible to construct malicious pickle data which will execute arbitrary code during unpickling (See https://github.com/pytorch/pytorch/blob/main/SECURITY.md#untrusted-models for more details). In a future release, the default value for `weights_only` will be flipped to `True`. This limits the functions that could be executed during unpickling. Arbitrary objects will no longer be allowed to be loaded via this mode unless they are explicitly allowlisted by the user via `torch.serialization.add_safe_globals`. We recommend you start setting `weights_only=True` for any use case where you don't have full control of the loaded file. Please open an issue on GitHub for any issues related to this experimental feature.
  self.data, self.slices = torch.load(self.processed_paths[0])
