STDOUT:
Results will be saved in /home/philip/projects/ltspice_examples_code_repo/Circuit-Completion-Using-GNNs/component_classification_with_link_prediction_head/evaluation/FEGIN/results/model_FEGIN_dataset_ltspice_demos
Command line input: python main.py --data ltspice_demos --representation component_pin_net --model FEGIN --layers 3 --hiddens 128 --batch_size 256 --lr 0.0001 --emb_size 128 --epochs 100 --save_appendix component_pin_net_L3_H128_BS256_LR0.0001_E128 --no_val
 is saved.
-----
ltspice_demos - FEGIN
Using 3 layers, 128 hidden units, h = 2
Loading component_pin_net representation dataset
ENTERED
Training FEGIN on component_pin_net representation
Train: 1565, Test: 383
##################ITERATION #0 ****************************************
 epoch: 0, train_loss: 1.3886, test_loss: 1.3913, test_f1: 0.0301
 epoch: 1, train_loss: 1.3787, test_loss: 1.3886, test_f1: 0.0301
 epoch: 2, train_loss: 1.3730, test_loss: 1.3855, test_f1: 0.1387
 epoch: 3, train_loss: 1.3659, test_loss: 1.3815, test_f1: 0.1365
 epoch: 4, train_loss: 1.3577, test_loss: 1.3768, test_f1: 0.1365
 epoch: 5, train_loss: 1.3492, test_loss: 1.3713, test_f1: 0.1365
 epoch: 6, train_loss: 1.3393, test_loss: 1.3640, test_f1: 0.2611
 epoch: 7, train_loss: 1.3261, test_loss: 1.3538, test_f1: 0.3420
 epoch: 8, train_loss: 1.3096, test_loss: 1.3394, test_f1: 0.3458
 epoch: 9, train_loss: 1.2933, test_loss: 1.3221, test_f1: 0.3388
 epoch: 10, train_loss: 1.2732, test_loss: 1.3039, test_f1: 0.3512
 epoch: 11, train_loss: 1.2523, test_loss: 1.2847, test_f1: 0.3414
 epoch: 12, train_loss: 1.2318, test_loss: 1.2680, test_f1: 0.3529
 epoch: 13, train_loss: 1.2117, test_loss: 1.2537, test_f1: 0.3562
 epoch: 14, train_loss: 1.1948, test_loss: 1.2412, test_f1: 0.3586
 epoch: 15, train_loss: 1.1783, test_loss: 1.2315, test_f1: 0.3674
 epoch: 16, train_loss: 1.1658, test_loss: 1.2242, test_f1: 0.3590
 epoch: 17, train_loss: 1.1536, test_loss: 1.2180, test_f1: 0.3866
 epoch: 18, train_loss: 1.1441, test_loss: 1.2130, test_f1: 0.4024
 epoch: 19, train_loss: 1.1331, test_loss: 1.2085, test_f1: 0.4234
 epoch: 20, train_loss: 1.1262, test_loss: 1.2052, test_f1: 0.4296
 epoch: 21, train_loss: 1.1204, test_loss: 1.2007, test_f1: 0.4368
 epoch: 22, train_loss: 1.1157, test_loss: 1.1994, test_f1: 0.4328
 epoch: 23, train_loss: 1.1101, test_loss: 1.1972, test_f1: 0.4328
 epoch: 24, train_loss: 1.1049, test_loss: 1.1945, test_f1: 0.4323
 epoch: 25, train_loss: 1.1039, test_loss: 1.1921, test_f1: 0.4409
 epoch: 26, train_loss: 1.1000, test_loss: 1.1892, test_f1: 0.4409
 epoch: 27, train_loss: 1.0932, test_loss: 1.1872, test_f1: 0.4397
 epoch: 28, train_loss: 1.0909, test_loss: 1.1846, test_f1: 0.4373
 epoch: 29, train_loss: 1.0827, test_loss: 1.1851, test_f1: 0.4437
 epoch: 30, train_loss: 1.0795, test_loss: 1.1799, test_f1: 0.4415
 epoch: 31, train_loss: 1.0728, test_loss: 1.1757, test_f1: 0.4426
 epoch: 32, train_loss: 1.0695, test_loss: 1.1715, test_f1: 0.4438
 epoch: 33, train_loss: 1.0676, test_loss: 1.1692, test_f1: 0.4456
 epoch: 34, train_loss: 1.0620, test_loss: 1.1673, test_f1: 0.4456
 epoch: 35, train_loss: 1.0568, test_loss: 1.1648, test_f1: 0.4428
 epoch: 36, train_loss: 1.0479, test_loss: 1.1605, test_f1: 0.4395
 epoch: 37, train_loss: 1.0459, test_loss: 1.1592, test_f1: 0.4448
 epoch: 38, train_loss: 1.0369, test_loss: 1.1566, test_f1: 0.4426
 epoch: 39, train_loss: 1.0315, test_loss: 1.1460, test_f1: 0.4447
 epoch: 40, train_loss: 1.0191, test_loss: 1.1403, test_f1: 0.4492
 epoch: 41, train_loss: 1.0147, test_loss: 1.1372, test_f1: 0.4451
 epoch: 42, train_loss: 1.0083, test_loss: 1.1297, test_f1: 0.4450
 epoch: 43, train_loss: 1.0031, test_loss: 1.1256, test_f1: 0.4708
 epoch: 44, train_loss: 0.9975, test_loss: 1.1226, test_f1: 0.4772
 epoch: 45, train_loss: 0.9903, test_loss: 1.1175, test_f1: 0.4634
 epoch: 46, train_loss: 0.9816, test_loss: 1.1122, test_f1: 0.4629
 epoch: 47, train_loss: 0.9740, test_loss: 1.1039, test_f1: 0.4713
 epoch: 48, train_loss: 0.9722, test_loss: 1.1012, test_f1: 0.4707
 epoch: 49, train_loss: 0.9595, test_loss: 1.0976, test_f1: 0.4757
 epoch: 50, train_loss: 0.9598, test_loss: 1.0902, test_f1: 0.5046
 epoch: 51, train_loss: 0.9563, test_loss: 1.0822, test_f1: 0.5095
 epoch: 52, train_loss: 0.9450, test_loss: 1.0838, test_f1: 0.5196
 epoch: 53, train_loss: 0.9483, test_loss: 1.0822, test_f1: 0.5223
 epoch: 54, train_loss: 0.9424, test_loss: 1.0786, test_f1: 0.5052
 epoch: 55, train_loss: 0.9397, test_loss: 1.0714, test_f1: 0.5077
 epoch: 56, train_loss: 0.9345, test_loss: 1.0698, test_f1: 0.4981
 epoch: 57, train_loss: 0.9315, test_loss: 1.0687, test_f1: 0.5176
 epoch: 58, train_loss: 0.9272, test_loss: 1.0649, test_f1: 0.5051
 epoch: 59, train_loss: 0.9330, test_loss: 1.0698, test_f1: 0.5073
 epoch: 60, train_loss: 0.9275, test_loss: 1.0690, test_f1: 0.5054
 epoch: 61, train_loss: 0.9246, test_loss: 1.0699, test_f1: 0.5067
 epoch: 62, train_loss: 0.9228, test_loss: 1.0653, test_f1: 0.5107
 epoch: 63, train_loss: 0.9193, test_loss: 1.0616, test_f1: 0.5252
 epoch: 64, train_loss: 0.9172, test_loss: 1.0609, test_f1: 0.5200
 epoch: 65, train_loss: 0.9171, test_loss: 1.0597, test_f1: 0.5263
 epoch: 66, train_loss: 0.9177, test_loss: 1.0580, test_f1: 0.5312
 epoch: 67, train_loss: 0.9120, test_loss: 1.0578, test_f1: 0.5342
 epoch: 68, train_loss: 0.9146, test_loss: 1.0570, test_f1: 0.5316
 epoch: 69, train_loss: 0.9096, test_loss: 1.0430, test_f1: 0.5449
 epoch: 70, train_loss: 0.8997, test_loss: 1.0433, test_f1: 0.5550
 epoch: 71, train_loss: 0.8973, test_loss: 1.0459, test_f1: 0.5470
 epoch: 72, train_loss: 0.8996, test_loss: 1.0469, test_f1: 0.5494
 epoch: 73, train_loss: 0.8987, test_loss: 1.0490, test_f1: 0.5577
 epoch: 74, train_loss: 0.8996, test_loss: 1.0409, test_f1: 0.5540
 epoch: 75, train_loss: 0.8922, test_loss: 1.0432, test_f1: 0.5673
 epoch: 76, train_loss: 0.8899, test_loss: 1.0478, test_f1: 0.5592
 epoch: 77, train_loss: 0.8888, test_loss: 1.0409, test_f1: 0.5631
 epoch: 78, train_loss: 0.8925, test_loss: 1.0409, test_f1: 0.5540
 epoch: 79, train_loss: 0.8893, test_loss: 1.0358, test_f1: 0.5526
 epoch: 80, train_loss: 0.8919, test_loss: 1.0296, test_f1: 0.5560
 epoch: 81, train_loss: 0.8822, test_loss: 1.0404, test_f1: 0.5481
 epoch: 82, train_loss: 0.8796, test_loss: 1.0411, test_f1: 0.5499
 epoch: 83, train_loss: 0.8763, test_loss: 1.0346, test_f1: 0.5575
 epoch: 84, train_loss: 0.8749, test_loss: 1.0290, test_f1: 0.5611
 epoch: 85, train_loss: 0.8754, test_loss: 1.0296, test_f1: 0.5558
 epoch: 86, train_loss: 0.8684, test_loss: 1.0304, test_f1: 0.5544
 epoch: 87, train_loss: 0.8721, test_loss: 1.0379, test_f1: 0.5563
 epoch: 88, train_loss: 0.8685, test_loss: 1.0379, test_f1: 0.5584
 epoch: 89, train_loss: 0.8648, test_loss: 1.0304, test_f1: 0.5635
 epoch: 90, train_loss: 0.8687, test_loss: 1.0243, test_f1: 0.5689
 epoch: 91, train_loss: 0.8608, test_loss: 1.0268, test_f1: 0.5616
 epoch: 92, train_loss: 0.8579, test_loss: 1.0297, test_f1: 0.5536
 epoch: 93, train_loss: 0.8484, test_loss: 1.0274, test_f1: 0.5494
 epoch: 94, train_loss: 0.8495, test_loss: 1.0259, test_f1: 0.5536
 epoch: 95, train_loss: 0.8478, test_loss: 1.0283, test_f1: 0.5545
 epoch: 96, train_loss: 0.8469, test_loss: 1.0191, test_f1: 0.5488
 epoch: 97, train_loss: 0.8473, test_loss: 1.0177, test_f1: 0.5507
 epoch: 98, train_loss: 0.8449, test_loss: 1.0099, test_f1: 0.5517
 epoch: 99, train_loss: 0.8379, test_loss: 1.0086, test_f1: 0.5555
##################ITERATION #1 ****************************************
 epoch: 0, train_loss: 1.3534, test_loss: 1.3769, test_f1: 0.1365
 epoch: 1, train_loss: 1.3159, test_loss: 1.3657, test_f1: 0.1365
 epoch: 2, train_loss: 1.2910, test_loss: 1.3502, test_f1: 0.1365
 epoch: 3, train_loss: 1.2679, test_loss: 1.3336, test_f1: 0.3332
 epoch: 4, train_loss: 1.2442, test_loss: 1.3169, test_f1: 0.3247
 epoch: 5, train_loss: 1.2211, test_loss: 1.3000, test_f1: 0.3247
 epoch: 6, train_loss: 1.1963, test_loss: 1.2826, test_f1: 0.3477
 epoch: 7, train_loss: 1.1773, test_loss: 1.2618, test_f1: 0.4151
 epoch: 8, train_loss: 1.1545, test_loss: 1.2387, test_f1: 0.4273
 epoch: 9, train_loss: 1.1404, test_loss: 1.2172, test_f1: 0.4321
 epoch: 10, train_loss: 1.1219, test_loss: 1.1969, test_f1: 0.4321
 epoch: 11, train_loss: 1.1069, test_loss: 1.1817, test_f1: 0.4516
 epoch: 12, train_loss: 1.0927, test_loss: 1.1703, test_f1: 0.4378
 epoch: 13, train_loss: 1.0843, test_loss: 1.1608, test_f1: 0.4436
 epoch: 14, train_loss: 1.0727, test_loss: 1.1522, test_f1: 0.4391
 epoch: 15, train_loss: 1.0621, test_loss: 1.1480, test_f1: 0.4466
 epoch: 16, train_loss: 1.0500, test_loss: 1.1436, test_f1: 0.4441
 epoch: 17, train_loss: 1.0423, test_loss: 1.1389, test_f1: 0.4468
 epoch: 18, train_loss: 1.0376, test_loss: 1.1322, test_f1: 0.4441
 epoch: 19, train_loss: 1.0233, test_loss: 1.1254, test_f1: 0.4462
 epoch: 20, train_loss: 1.0204, test_loss: 1.1159, test_f1: 0.4468
 epoch: 21, train_loss: 1.0139, test_loss: 1.1132, test_f1: 0.4487
 epoch: 22, train_loss: 1.0079, test_loss: 1.1113, test_f1: 0.4579
 epoch: 23, train_loss: 0.9981, test_loss: 1.1080, test_f1: 0.4609
 epoch: 24, train_loss: 0.9960, test_loss: 1.1040, test_f1: 0.4607
 epoch: 25, train_loss: 0.9909, test_loss: 1.1015, test_f1: 0.4607
 epoch: 26, train_loss: 0.9878, test_loss: 1.0992, test_f1: 0.4601
 epoch: 27, train_loss: 0.9785, test_loss: 1.0925, test_f1: 0.4579
 epoch: 28, train_loss: 0.9733, test_loss: 1.0888, test_f1: 0.4579
 epoch: 29, train_loss: 0.9737, test_loss: 1.0871, test_f1: 0.4593
 epoch: 30, train_loss: 0.9696, test_loss: 1.0931, test_f1: 0.4640
 epoch: 31, train_loss: 0.9669, test_loss: 1.0888, test_f1: 0.4754
 epoch: 32, train_loss: 0.9617, test_loss: 1.0779, test_f1: 0.4725
 epoch: 33, train_loss: 0.9594, test_loss: 1.0755, test_f1: 0.4865
 epoch: 34, train_loss: 0.9569, test_loss: 1.0760, test_f1: 0.4994
 epoch: 35, train_loss: 0.9474, test_loss: 1.0718, test_f1: 0.5028
 epoch: 36, train_loss: 0.9451, test_loss: 1.0747, test_f1: 0.5144
 epoch: 37, train_loss: 0.9378, test_loss: 1.0774, test_f1: 0.4957
 epoch: 38, train_loss: 0.9356, test_loss: 1.0803, test_f1: 0.5131
 epoch: 39, train_loss: 0.9381, test_loss: 1.0703, test_f1: 0.5030
 epoch: 40, train_loss: 0.9358, test_loss: 1.0759, test_f1: 0.5099
 epoch: 41, train_loss: 0.9306, test_loss: 1.0696, test_f1: 0.4793
 epoch: 42, train_loss: 0.9261, test_loss: 1.0730, test_f1: 0.5043
 epoch: 43, train_loss: 0.9222, test_loss: 1.0629, test_f1: 0.5385
 epoch: 44, train_loss: 0.9183, test_loss: 1.0616, test_f1: 0.5228
 epoch: 45, train_loss: 0.9155, test_loss: 1.0671, test_f1: 0.5253
 epoch: 46, train_loss: 0.9112, test_loss: 1.0623, test_f1: 0.5544
 epoch: 47, train_loss: 0.8990, test_loss: 1.0593, test_f1: 0.5659
 epoch: 48, train_loss: 0.9045, test_loss: 1.0605, test_f1: 0.5182
 epoch: 49, train_loss: 0.9026, test_loss: 1.0620, test_f1: 0.5077
 epoch: 50, train_loss: 0.8976, test_loss: 1.0680, test_f1: 0.5193
 epoch: 51, train_loss: 0.8937, test_loss: 1.0631, test_f1: 0.5198
 epoch: 52, train_loss: 0.8939, test_loss: 1.0570, test_f1: 0.5335
 epoch: 53, train_loss: 0.8908, test_loss: 1.0566, test_f1: 0.5262
 epoch: 54, train_loss: 0.8866, test_loss: 1.0640, test_f1: 0.5409
 epoch: 55, train_loss: 0.8846, test_loss: 1.0679, test_f1: 0.5389
 epoch: 56, train_loss: 0.8817, test_loss: 1.0631, test_f1: 0.5409
 epoch: 57, train_loss: 0.8769, test_loss: 1.0606, test_f1: 0.5455
 epoch: 58, train_loss: 0.8795, test_loss: 1.0583, test_f1: 0.5467
 epoch: 59, train_loss: 0.8743, test_loss: 1.0755, test_f1: 0.5384
 epoch: 60, train_loss: 0.8728, test_loss: 1.0641, test_f1: 0.5364
 epoch: 61, train_loss: 0.8732, test_loss: 1.0566, test_f1: 0.5467
 epoch: 62, train_loss: 0.8718, test_loss: 1.0566, test_f1: 0.5501
 epoch: 63, train_loss: 0.8673, test_loss: 1.0565, test_f1: 0.5420
 epoch: 64, train_loss: 0.8645, test_loss: 1.0547, test_f1: 0.5254
 epoch: 65, train_loss: 0.8657, test_loss: 1.0583, test_f1: 0.5440
 epoch: 66, train_loss: 0.8676, test_loss: 1.0605, test_f1: 0.5464
 epoch: 67, train_loss: 0.8610, test_loss: 1.0653, test_f1: 0.5504
 epoch: 68, train_loss: 0.8591, test_loss: 1.0547, test_f1: 0.5444
 epoch: 69, train_loss: 0.8552, test_loss: 1.0541, test_f1: 0.5330
 epoch: 70, train_loss: 0.8613, test_loss: 1.0499, test_f1: 0.5370
 epoch: 71, train_loss: 0.8574, test_loss: 1.0474, test_f1: 0.5329
 epoch: 72, train_loss: 0.8582, test_loss: 1.0672, test_f1: 0.5386
 epoch: 73, train_loss: 0.8515, test_loss: 1.0561, test_f1: 0.5405
 epoch: 74, train_loss: 0.8560, test_loss: 1.0449, test_f1: 0.5521
 epoch: 75, train_loss: 0.8531, test_loss: 1.0482, test_f1: 0.5548
 epoch: 76, train_loss: 0.8424, test_loss: 1.0493, test_f1: 0.5498
 epoch: 77, train_loss: 0.8422, test_loss: 1.0514, test_f1: 0.5464
 epoch: 78, train_loss: 0.8427, test_loss: 1.0566, test_f1: 0.5418
 epoch: 79, train_loss: 0.8320, test_loss: 1.0547, test_f1: 0.5349
 epoch: 80, train_loss: 0.8314, test_loss: 1.0527, test_f1: 0.5439
 epoch: 81, train_loss: 0.8312, test_loss: 1.0574, test_f1: 0.5394
 epoch: 82, train_loss: 0.8334, test_loss: 1.0496, test_f1: 0.5407
 epoch: 83, train_loss: 0.8335, test_loss: 1.0455, test_f1: 0.5405
 epoch: 84, train_loss: 0.8311, test_loss: 1.0459, test_f1: 0.5346
 epoch: 85, train_loss: 0.8257, test_loss: 1.0633, test_f1: 0.5368
 epoch: 86, train_loss: 0.8290, test_loss: 1.0591, test_f1: 0.5355
 epoch: 87, train_loss: 0.8215, test_loss: 1.0511, test_f1: 0.5380
 epoch: 88, train_loss: 0.8202, test_loss: 1.0485, test_f1: 0.5294
 epoch: 89, train_loss: 0.8164, test_loss: 1.0538, test_f1: 0.5528
 epoch: 90, train_loss: 0.8216, test_loss: 1.0414, test_f1: 0.5557
 epoch: 91, train_loss: 0.8128, test_loss: 1.0256, test_f1: 0.5459
 epoch: 92, train_loss: 0.8194, test_loss: 1.0436, test_f1: 0.5476
 epoch: 93, train_loss: 0.8123, test_loss: 1.0637, test_f1: 0.5391
 epoch: 94, train_loss: 0.8037, test_loss: 1.0476, test_f1: 0.5313
 epoch: 95, train_loss: 0.8075, test_loss: 1.0446, test_f1: 0.5357
 epoch: 96, train_loss: 0.8041, test_loss: 1.0541, test_f1: 0.5318
 epoch: 97, train_loss: 0.8009, test_loss: 1.0599, test_f1: 0.5325
 epoch: 98, train_loss: 0.8070, test_loss: 1.0540, test_f1: 0.5405
 epoch: 99, train_loss: 0.7975, test_loss: 1.0440, test_f1: 0.5495
##################ITERATION #2 ****************************************
 epoch: 0, train_loss: 1.3397, test_loss: 1.3711, test_f1: 0.1365
 epoch: 1, train_loss: 1.2803, test_loss: 1.3565, test_f1: 0.1365
 epoch: 2, train_loss: 1.2492, test_loss: 1.3383, test_f1: 0.1365
 epoch: 3, train_loss: 1.2194, test_loss: 1.3184, test_f1: 0.1996
 epoch: 4, train_loss: 1.1941, test_loss: 1.2970, test_f1: 0.3329
 epoch: 5, train_loss: 1.1709, test_loss: 1.2752, test_f1: 0.3373
 epoch: 6, train_loss: 1.1479, test_loss: 1.2535, test_f1: 0.3507
 epoch: 7, train_loss: 1.1307, test_loss: 1.2306, test_f1: 0.4135
 epoch: 8, train_loss: 1.1145, test_loss: 1.2096, test_f1: 0.4379
 epoch: 9, train_loss: 1.0992, test_loss: 1.1916, test_f1: 0.4280
 epoch: 10, train_loss: 1.0862, test_loss: 1.1772, test_f1: 0.4458
 epoch: 11, train_loss: 1.0767, test_loss: 1.1652, test_f1: 0.4518
 epoch: 12, train_loss: 1.0572, test_loss: 1.1563, test_f1: 0.4470
 epoch: 13, train_loss: 1.0516, test_loss: 1.1459, test_f1: 0.4452
 epoch: 14, train_loss: 1.0406, test_loss: 1.1393, test_f1: 0.4393
 epoch: 15, train_loss: 1.0402, test_loss: 1.1311, test_f1: 0.4413
 epoch: 16, train_loss: 1.0288, test_loss: 1.1245, test_f1: 0.4433
 epoch: 17, train_loss: 1.0222, test_loss: 1.1187, test_f1: 0.4433
 epoch: 18, train_loss: 1.0149, test_loss: 1.1107, test_f1: 0.4303
 epoch: 19, train_loss: 1.0062, test_loss: 1.1076, test_f1: 0.4486
 epoch: 20, train_loss: 0.9960, test_loss: 1.1017, test_f1: 0.4533
 epoch: 21, train_loss: 0.9982, test_loss: 1.0972, test_f1: 0.4526
 epoch: 22, train_loss: 0.9827, test_loss: 1.0959, test_f1: 0.4515
 epoch: 23, train_loss: 0.9852, test_loss: 1.0896, test_f1: 0.4727
 epoch: 24, train_loss: 0.9750, test_loss: 1.0841, test_f1: 0.4880
 epoch: 25, train_loss: 0.9663, test_loss: 1.0749, test_f1: 0.5005
 epoch: 26, train_loss: 0.9681, test_loss: 1.0725, test_f1: 0.5039
 epoch: 27, train_loss: 0.9550, test_loss: 1.0647, test_f1: 0.5134
 epoch: 28, train_loss: 0.9529, test_loss: 1.0661, test_f1: 0.5090
 epoch: 29, train_loss: 0.9498, test_loss: 1.0605, test_f1: 0.5177
 epoch: 30, train_loss: 0.9491, test_loss: 1.0598, test_f1: 0.4961
 epoch: 31, train_loss: 0.9359, test_loss: 1.0546, test_f1: 0.5140
 epoch: 32, train_loss: 0.9301, test_loss: 1.0516, test_f1: 0.5297
 epoch: 33, train_loss: 0.9282, test_loss: 1.0464, test_f1: 0.5286
 epoch: 34, train_loss: 0.9240, test_loss: 1.0484, test_f1: 0.5445
 epoch: 35, train_loss: 0.9197, test_loss: 1.0463, test_f1: 0.5430
 epoch: 36, train_loss: 0.9133, test_loss: 1.0469, test_f1: 0.5468
 epoch: 37, train_loss: 0.9092, test_loss: 1.0459, test_f1: 0.5597
 epoch: 38, train_loss: 0.9140, test_loss: 1.0376, test_f1: 0.5612
 epoch: 39, train_loss: 0.9045, test_loss: 1.0320, test_f1: 0.5662
 epoch: 40, train_loss: 0.8948, test_loss: 1.0244, test_f1: 0.5582
 epoch: 41, train_loss: 0.8981, test_loss: 1.0267, test_f1: 0.5628
 epoch: 42, train_loss: 0.8915, test_loss: 1.0186, test_f1: 0.5240
 epoch: 43, train_loss: 0.8853, test_loss: 1.0254, test_f1: 0.5312
 epoch: 44, train_loss: 0.8782, test_loss: 1.0373, test_f1: 0.5420
 epoch: 45, train_loss: 0.8828, test_loss: 1.0278, test_f1: 0.5240
 epoch: 46, train_loss: 0.8629, test_loss: 1.0157, test_f1: 0.5307
 epoch: 47, train_loss: 0.8615, test_loss: 1.0229, test_f1: 0.5493
 epoch: 48, train_loss: 0.8598, test_loss: 1.0329, test_f1: 0.5843
 epoch: 49, train_loss: 0.8625, test_loss: 1.0328, test_f1: 0.5743
 epoch: 50, train_loss: 0.8518, test_loss: 1.0206, test_f1: 0.5380
 epoch: 51, train_loss: 0.8441, test_loss: 1.0224, test_f1: 0.5341
 epoch: 52, train_loss: 0.8399, test_loss: 1.0236, test_f1: 0.5269
 epoch: 53, train_loss: 0.8472, test_loss: 1.0261, test_f1: 0.5203
 epoch: 54, train_loss: 0.8374, test_loss: 1.0189, test_f1: 0.5285
 epoch: 55, train_loss: 0.8380, test_loss: 1.0229, test_f1: 0.5206
 epoch: 56, train_loss: 0.8394, test_loss: 1.0211, test_f1: 0.5253
 epoch: 57, train_loss: 0.8332, test_loss: 1.0192, test_f1: 0.5399
 epoch: 58, train_loss: 0.8219, test_loss: 1.0151, test_f1: 0.5495
 epoch: 59, train_loss: 0.8234, test_loss: 1.0137, test_f1: 0.5297
 epoch: 60, train_loss: 0.8271, test_loss: 1.0169, test_f1: 0.5328
 epoch: 61, train_loss: 0.8221, test_loss: 1.0261, test_f1: 0.5235
 epoch: 62, train_loss: 0.8169, test_loss: 1.0253, test_f1: 0.5182
 epoch: 63, train_loss: 0.8162, test_loss: 1.0229, test_f1: 0.5221
 epoch: 64, train_loss: 0.8178, test_loss: 1.0287, test_f1: 0.5315
 epoch: 65, train_loss: 0.8083, test_loss: 1.0224, test_f1: 0.5235
 epoch: 66, train_loss: 0.8125, test_loss: 1.0171, test_f1: 0.5198
 epoch: 67, train_loss: 0.8005, test_loss: 1.0146, test_f1: 0.5166
 epoch: 68, train_loss: 0.8048, test_loss: 1.0191, test_f1: 0.5214
 epoch: 69, train_loss: 0.8066, test_loss: 1.0233, test_f1: 0.5254
 epoch: 70, train_loss: 0.8017, test_loss: 1.0233, test_f1: 0.5286
 epoch: 71, train_loss: 0.8015, test_loss: 1.0160, test_f1: 0.5238
 epoch: 72, train_loss: 0.7972, test_loss: 1.0145, test_f1: 0.5292
 epoch: 73, train_loss: 0.7985, test_loss: 1.0154, test_f1: 0.5292
 epoch: 74, train_loss: 0.7868, test_loss: 1.0150, test_f1: 0.5379
 epoch: 75, train_loss: 0.7868, test_loss: 1.0141, test_f1: 0.5362
 epoch: 76, train_loss: 0.7835, test_loss: 1.0151, test_f1: 0.5311
 epoch: 77, train_loss: 0.7874, test_loss: 1.0187, test_f1: 0.5310
 epoch: 78, train_loss: 0.7833, test_loss: 1.0384, test_f1: 0.5254
 epoch: 79, train_loss: 0.7814, test_loss: 1.0297, test_f1: 0.5256
 epoch: 80, train_loss: 0.7817, test_loss: 1.0070, test_f1: 0.5432
 epoch: 81, train_loss: 0.7791, test_loss: 1.0157, test_f1: 0.5450
 epoch: 82, train_loss: 0.7767, test_loss: 1.0098, test_f1: 0.5449
 epoch: 83, train_loss: 0.7662, test_loss: 1.0058, test_f1: 0.5489
 epoch: 84, train_loss: 0.7614, test_loss: 1.0132, test_f1: 0.5446
 epoch: 85, train_loss: 0.7676, test_loss: 1.0190, test_f1: 0.5449
 epoch: 86, train_loss: 0.7611, test_loss: 1.0221, test_f1: 0.5483
 epoch: 87, train_loss: 0.7633, test_loss: 1.0148, test_f1: 0.5583
 epoch: 88, train_loss: 0.7537, test_loss: 1.0152, test_f1: 0.5363
 epoch: 89, train_loss: 0.7585, test_loss: 1.0207, test_f1: 0.5384
 epoch: 90, train_loss: 0.7576, test_loss: 1.0232, test_f1: 0.5383
 epoch: 91, train_loss: 0.7516, test_loss: 1.0326, test_f1: 0.5361
 epoch: 92, train_loss: 0.7491, test_loss: 1.0335, test_f1: 0.5356
 epoch: 93, train_loss: 0.7505, test_loss: 1.0218, test_f1: 0.5370
 epoch: 94, train_loss: 0.7567, test_loss: 1.0170, test_f1: 0.5450
 epoch: 95, train_loss: 0.7410, test_loss: 1.0376, test_f1: 0.5287
 epoch: 96, train_loss: 0.7438, test_loss: 1.0265, test_f1: 0.5545
 epoch: 97, train_loss: 0.7355, test_loss: 1.0291, test_f1: 0.5517
 epoch: 98, train_loss: 0.7326, test_loss: 1.0207, test_f1: 0.5534
 epoch: 99, train_loss: 0.7383, test_loss: 1.0136, test_f1: 0.5439
##################ITERATION #3 ****************************************
 epoch: 0, train_loss: 1.2967, test_loss: 1.3526, test_f1: 0.1365
 epoch: 1, train_loss: 1.2303, test_loss: 1.3363, test_f1: 0.1365
 epoch: 2, train_loss: 1.1983, test_loss: 1.3208, test_f1: 0.1365
 epoch: 3, train_loss: 1.1693, test_loss: 1.3069, test_f1: 0.1365
 epoch: 4, train_loss: 1.1457, test_loss: 1.2925, test_f1: 0.1425
 epoch: 5, train_loss: 1.1244, test_loss: 1.2734, test_f1: 0.2300
 epoch: 6, train_loss: 1.1095, test_loss: 1.2440, test_f1: 0.3539
 epoch: 7, train_loss: 1.0877, test_loss: 1.2115, test_f1: 0.4203
 epoch: 8, train_loss: 1.0713, test_loss: 1.1834, test_f1: 0.4525
 epoch: 9, train_loss: 1.0596, test_loss: 1.1646, test_f1: 0.4621
 epoch: 10, train_loss: 1.0513, test_loss: 1.1498, test_f1: 0.4476
 epoch: 11, train_loss: 1.0360, test_loss: 1.1360, test_f1: 0.4318
 epoch: 12, train_loss: 1.0287, test_loss: 1.1206, test_f1: 0.4311
 epoch: 13, train_loss: 1.0225, test_loss: 1.1106, test_f1: 0.4481
 epoch: 14, train_loss: 1.0115, test_loss: 1.1031, test_f1: 0.4510
 epoch: 15, train_loss: 0.9994, test_loss: 1.0921, test_f1: 0.4631
 epoch: 16, train_loss: 0.9938, test_loss: 1.0838, test_f1: 0.4697
 epoch: 17, train_loss: 0.9913, test_loss: 1.0786, test_f1: 0.4835
 epoch: 18, train_loss: 0.9800, test_loss: 1.0733, test_f1: 0.4793
 epoch: 19, train_loss: 0.9752, test_loss: 1.0685, test_f1: 0.4904
 epoch: 20, train_loss: 0.9669, test_loss: 1.0641, test_f1: 0.4967
 epoch: 21, train_loss: 0.9644, test_loss: 1.0623, test_f1: 0.4924
 epoch: 22, train_loss: 0.9614, test_loss: 1.0587, test_f1: 0.4968
 epoch: 23, train_loss: 0.9534, test_loss: 1.0503, test_f1: 0.5045
 epoch: 24, train_loss: 0.9445, test_loss: 1.0432, test_f1: 0.5062
 epoch: 25, train_loss: 0.9361, test_loss: 1.0401, test_f1: 0.5069
 epoch: 26, train_loss: 0.9377, test_loss: 1.0413, test_f1: 0.5308
 epoch: 27, train_loss: 0.9332, test_loss: 1.0340, test_f1: 0.5368
 epoch: 28, train_loss: 0.9226, test_loss: 1.0296, test_f1: 0.5397
 epoch: 29, train_loss: 0.9173, test_loss: 1.0316, test_f1: 0.5432
 epoch: 30, train_loss: 0.9199, test_loss: 1.0340, test_f1: 0.5467
 epoch: 31, train_loss: 0.9130, test_loss: 1.0318, test_f1: 0.5465
 epoch: 32, train_loss: 0.9086, test_loss: 1.0233, test_f1: 0.5538
 epoch: 33, train_loss: 0.8993, test_loss: 1.0251, test_f1: 0.5522
 epoch: 34, train_loss: 0.8974, test_loss: 1.0158, test_f1: 0.5511
 epoch: 35, train_loss: 0.8968, test_loss: 1.0119, test_f1: 0.5557
 epoch: 36, train_loss: 0.8895, test_loss: 1.0122, test_f1: 0.5687
 epoch: 37, train_loss: 0.8889, test_loss: 1.0104, test_f1: 0.5684
 epoch: 38, train_loss: 0.8842, test_loss: 1.0102, test_f1: 0.5705
 epoch: 39, train_loss: 0.8781, test_loss: 1.0203, test_f1: 0.5659
 epoch: 40, train_loss: 0.8778, test_loss: 1.0067, test_f1: 0.5618
 epoch: 41, train_loss: 0.8751, test_loss: 0.9958, test_f1: 0.5576
 epoch: 42, train_loss: 0.8717, test_loss: 0.9951, test_f1: 0.5595
 epoch: 43, train_loss: 0.8596, test_loss: 0.9944, test_f1: 0.5422
 epoch: 44, train_loss: 0.8606, test_loss: 0.9959, test_f1: 0.5567
 epoch: 45, train_loss: 0.8524, test_loss: 1.0039, test_f1: 0.5618
 epoch: 46, train_loss: 0.8561, test_loss: 0.9955, test_f1: 0.5693
 epoch: 47, train_loss: 0.8484, test_loss: 0.9921, test_f1: 0.5211
 epoch: 48, train_loss: 0.8431, test_loss: 0.9923, test_f1: 0.5131
 epoch: 49, train_loss: 0.8429, test_loss: 0.9865, test_f1: 0.5358
 epoch: 50, train_loss: 0.8394, test_loss: 0.9854, test_f1: 0.5479
 epoch: 51, train_loss: 0.8287, test_loss: 0.9841, test_f1: 0.5429
 epoch: 52, train_loss: 0.8280, test_loss: 0.9934, test_f1: 0.5416
 epoch: 53, train_loss: 0.8228, test_loss: 0.9906, test_f1: 0.5412
 epoch: 54, train_loss: 0.8213, test_loss: 0.9885, test_f1: 0.5288
 epoch: 55, train_loss: 0.8196, test_loss: 0.9879, test_f1: 0.5321
 epoch: 56, train_loss: 0.8235, test_loss: 0.9873, test_f1: 0.5631
 epoch: 57, train_loss: 0.8205, test_loss: 0.9861, test_f1: 0.5722
 epoch: 58, train_loss: 0.8110, test_loss: 0.9823, test_f1: 0.5795
 epoch: 59, train_loss: 0.8114, test_loss: 0.9810, test_f1: 0.5399
 epoch: 60, train_loss: 0.8186, test_loss: 0.9803, test_f1: 0.5435
 epoch: 61, train_loss: 0.8076, test_loss: 0.9829, test_f1: 0.5447
 epoch: 62, train_loss: 0.8037, test_loss: 0.9859, test_f1: 0.5552
 epoch: 63, train_loss: 0.8058, test_loss: 0.9847, test_f1: 0.5387
 epoch: 64, train_loss: 0.7996, test_loss: 0.9846, test_f1: 0.5641
 epoch: 65, train_loss: 0.7942, test_loss: 0.9897, test_f1: 0.5641
 epoch: 66, train_loss: 0.7948, test_loss: 0.9893, test_f1: 0.5629
 epoch: 67, train_loss: 0.7908, test_loss: 0.9829, test_f1: 0.5625
 epoch: 68, train_loss: 0.7896, test_loss: 0.9830, test_f1: 0.5611
 epoch: 69, train_loss: 0.7903, test_loss: 0.9852, test_f1: 0.5468
 epoch: 70, train_loss: 0.7901, test_loss: 0.9796, test_f1: 0.5587
 epoch: 71, train_loss: 0.7860, test_loss: 0.9833, test_f1: 0.5593
 epoch: 72, train_loss: 0.7842, test_loss: 0.9892, test_f1: 0.5587
 epoch: 73, train_loss: 0.7927, test_loss: 0.9881, test_f1: 0.5635
 epoch: 74, train_loss: 0.7751, test_loss: 0.9856, test_f1: 0.5701
 epoch: 75, train_loss: 0.7761, test_loss: 0.9853, test_f1: 0.5654
 epoch: 76, train_loss: 0.7723, test_loss: 0.9822, test_f1: 0.5706
 epoch: 77, train_loss: 0.7721, test_loss: 0.9823, test_f1: 0.5675
 epoch: 78, train_loss: 0.7735, test_loss: 0.9844, test_f1: 0.5539
 epoch: 79, train_loss: 0.7617, test_loss: 0.9840, test_f1: 0.5628
 epoch: 80, train_loss: 0.7681, test_loss: 0.9839, test_f1: 0.5706
 epoch: 81, train_loss: 0.7618, test_loss: 0.9844, test_f1: 0.5689
 epoch: 82, train_loss: 0.7608, test_loss: 0.9899, test_f1: 0.5590
 epoch: 83, train_loss: 0.7677, test_loss: 0.9928, test_f1: 0.5479
 epoch: 84, train_loss: 0.7515, test_loss: 0.9937, test_f1: 0.5651
 epoch: 85, train_loss: 0.7584, test_loss: 0.9928, test_f1: 0.5625
 epoch: 86, train_loss: 0.7560, test_loss: 0.9919, test_f1: 0.5627
 epoch: 87, train_loss: 0.7585, test_loss: 0.9920, test_f1: 0.5538
 epoch: 88, train_loss: 0.7485, test_loss: 0.9879, test_f1: 0.5661
 epoch: 89, train_loss: 0.7512, test_loss: 0.9911, test_f1: 0.5700
 epoch: 90, train_loss: 0.7522, test_loss: 0.9907, test_f1: 0.5756
 epoch: 91, train_loss: 0.7419, test_loss: 0.9973, test_f1: 0.5756
 epoch: 92, train_loss: 0.7406, test_loss: 0.9940, test_f1: 0.5753
 epoch: 93, train_loss: 0.7370, test_loss: 0.9897, test_f1: 0.5797
 epoch: 94, train_loss: 0.7428, test_loss: 0.9931, test_f1: 0.5802
 epoch: 95, train_loss: 0.7327, test_loss: 0.9943, test_f1: 0.5810
 epoch: 96, train_loss: 0.7295, test_loss: 0.9857, test_f1: 0.5656
 epoch: 97, train_loss: 0.7297, test_loss: 0.9878, test_f1: 0.5567
 epoch: 98, train_loss: 0.7273, test_loss: 0.9992, test_f1: 0.5757
 epoch: 99, train_loss: 0.7212, test_loss: 1.0041, test_f1: 0.5593
##################ITERATION #4 ****************************************
 epoch: 0, train_loss: 1.2639, test_loss: 1.3333, test_f1: 0.1365
 epoch: 1, train_loss: 1.2087, test_loss: 1.3166, test_f1: 0.1365
 epoch: 2, train_loss: 1.1812, test_loss: 1.3032, test_f1: 0.1365
 epoch: 3, train_loss: 1.1531, test_loss: 1.2953, test_f1: 0.1472
 epoch: 4, train_loss: 1.1377, test_loss: 1.2882, test_f1: 0.3171
 epoch: 5, train_loss: 1.1211, test_loss: 1.2741, test_f1: 0.3194
 epoch: 6, train_loss: 1.1030, test_loss: 1.2484, test_f1: 0.3228
 epoch: 7, train_loss: 1.0878, test_loss: 1.2157, test_f1: 0.3765
 epoch: 8, train_loss: 1.0713, test_loss: 1.1809, test_f1: 0.4472
 epoch: 9, train_loss: 1.0551, test_loss: 1.1591, test_f1: 0.4294
 epoch: 10, train_loss: 1.0467, test_loss: 1.1457, test_f1: 0.4284
 epoch: 11, train_loss: 1.0346, test_loss: 1.1350, test_f1: 0.4279
 epoch: 12, train_loss: 1.0286, test_loss: 1.1262, test_f1: 0.4269
 epoch: 13, train_loss: 1.0185, test_loss: 1.1192, test_f1: 0.4247
 epoch: 14, train_loss: 1.0116, test_loss: 1.1110, test_f1: 0.4247
 epoch: 15, train_loss: 1.0022, test_loss: 1.1063, test_f1: 0.4318
 epoch: 16, train_loss: 0.9949, test_loss: 1.1025, test_f1: 0.4401
 epoch: 17, train_loss: 0.9875, test_loss: 1.1002, test_f1: 0.4509
 epoch: 18, train_loss: 0.9785, test_loss: 1.0921, test_f1: 0.4610
 epoch: 19, train_loss: 0.9762, test_loss: 1.0815, test_f1: 0.4713
 epoch: 20, train_loss: 0.9705, test_loss: 1.0759, test_f1: 0.4871
 epoch: 21, train_loss: 0.9664, test_loss: 1.0687, test_f1: 0.4897
 epoch: 22, train_loss: 0.9596, test_loss: 1.0713, test_f1: 0.4830
 epoch: 23, train_loss: 0.9575, test_loss: 1.0730, test_f1: 0.4804
 epoch: 24, train_loss: 0.9557, test_loss: 1.0655, test_f1: 0.4962
 epoch: 25, train_loss: 0.9441, test_loss: 1.0607, test_f1: 0.5071
 epoch: 26, train_loss: 0.9413, test_loss: 1.0563, test_f1: 0.5088
 epoch: 27, train_loss: 0.9372, test_loss: 1.0549, test_f1: 0.5088
 epoch: 28, train_loss: 0.9289, test_loss: 1.0520, test_f1: 0.5211
 epoch: 29, train_loss: 0.9260, test_loss: 1.0495, test_f1: 0.5236
 epoch: 30, train_loss: 0.9178, test_loss: 1.0445, test_f1: 0.5151
 epoch: 31, train_loss: 0.9149, test_loss: 1.0411, test_f1: 0.5284
 epoch: 32, train_loss: 0.9104, test_loss: 1.0335, test_f1: 0.5264
 epoch: 33, train_loss: 0.9067, test_loss: 1.0421, test_f1: 0.5207
 epoch: 34, train_loss: 0.9009, test_loss: 1.0413, test_f1: 0.5277
 epoch: 35, train_loss: 0.9009, test_loss: 1.0432, test_f1: 0.5141
 epoch: 36, train_loss: 0.8931, test_loss: 1.0343, test_f1: 0.5349
 epoch: 37, train_loss: 0.8846, test_loss: 1.0286, test_f1: 0.5377
 epoch: 38, train_loss: 0.8866, test_loss: 1.0290, test_f1: 0.5485
 epoch: 39, train_loss: 0.8669, test_loss: 1.0215, test_f1: 0.5624
 epoch: 40, train_loss: 0.8733, test_loss: 1.0252, test_f1: 0.5609
 epoch: 41, train_loss: 0.8690, test_loss: 1.0269, test_f1: 0.5456
 epoch: 42, train_loss: 0.8636, test_loss: 1.0283, test_f1: 0.5570
 epoch: 43, train_loss: 0.8579, test_loss: 1.0316, test_f1: 0.5595
 epoch: 44, train_loss: 0.8583, test_loss: 1.0323, test_f1: 0.5623
 epoch: 45, train_loss: 0.8515, test_loss: 1.0176, test_f1: 0.5512
 epoch: 46, train_loss: 0.8476, test_loss: 1.0053, test_f1: 0.5546
 epoch: 47, train_loss: 0.8302, test_loss: 1.0232, test_f1: 0.5462
 epoch: 48, train_loss: 0.8330, test_loss: 1.0308, test_f1: 0.5326
 epoch: 49, train_loss: 0.8250, test_loss: 1.0228, test_f1: 0.5437
 epoch: 50, train_loss: 0.8211, test_loss: 1.0257, test_f1: 0.5423
 epoch: 51, train_loss: 0.8148, test_loss: 1.0150, test_f1: 0.5556
 epoch: 52, train_loss: 0.8115, test_loss: 1.0177, test_f1: 0.5543
 epoch: 53, train_loss: 0.8059, test_loss: 1.0145, test_f1: 0.5558
 epoch: 54, train_loss: 0.8005, test_loss: 1.0192, test_f1: 0.5595
 epoch: 55, train_loss: 0.8001, test_loss: 1.0196, test_f1: 0.5551
 epoch: 56, train_loss: 0.7967, test_loss: 1.0165, test_f1: 0.5554
 epoch: 57, train_loss: 0.7956, test_loss: 1.0245, test_f1: 0.5481
 epoch: 58, train_loss: 0.7953, test_loss: 1.0292, test_f1: 0.5502
 epoch: 59, train_loss: 0.7887, test_loss: 1.0184, test_f1: 0.5515
 epoch: 60, train_loss: 0.7928, test_loss: 1.0167, test_f1: 0.5528
 epoch: 61, train_loss: 0.7890, test_loss: 1.0268, test_f1: 0.5643
 epoch: 62, train_loss: 0.7834, test_loss: 1.0295, test_f1: 0.5533
 epoch: 63, train_loss: 0.7852, test_loss: 1.0273, test_f1: 0.5452
 epoch: 64, train_loss: 0.7751, test_loss: 1.0229, test_f1: 0.5549
 epoch: 65, train_loss: 0.7831, test_loss: 1.0211, test_f1: 0.5658
 epoch: 66, train_loss: 0.7729, test_loss: 1.0203, test_f1: 0.5738
 epoch: 67, train_loss: 0.7709, test_loss: 1.0230, test_f1: 0.5473
 epoch: 68, train_loss: 0.7705, test_loss: 1.0213, test_f1: 0.5401
 epoch: 69, train_loss: 0.7702, test_loss: 1.0160, test_f1: 0.5663
 epoch: 70, train_loss: 0.7630, test_loss: 1.0262, test_f1: 0.5461
 epoch: 71, train_loss: 0.7607, test_loss: 1.0350, test_f1: 0.5436
 epoch: 72, train_loss: 0.7557, test_loss: 1.0318, test_f1: 0.5583
 epoch: 73, train_loss: 0.7575, test_loss: 1.0314, test_f1: 0.5739
 epoch: 74, train_loss: 0.7536, test_loss: 1.0352, test_f1: 0.5581
 epoch: 75, train_loss: 0.7606, test_loss: 1.0202, test_f1: 0.5686
 epoch: 76, train_loss: 0.7536, test_loss: 1.0088, test_f1: 0.5602
 epoch: 77, train_loss: 0.7469, test_loss: 1.0184, test_f1: 0.5546
 epoch: 78, train_loss: 0.7425, test_loss: 1.0254, test_f1: 0.5695
 epoch: 79, train_loss: 0.7347, test_loss: 1.0339, test_f1: 0.5592
 epoch: 80, train_loss: 0.7372, test_loss: 1.0245, test_f1: 0.5593
 epoch: 81, train_loss: 0.7330, test_loss: 1.0404, test_f1: 0.5609
 epoch: 82, train_loss: 0.7365, test_loss: 1.0377, test_f1: 0.5662
 epoch: 83, train_loss: 0.7353, test_loss: 1.0230, test_f1: 0.5814
 epoch: 84, train_loss: 0.7282, test_loss: 1.0341, test_f1: 0.5689
 epoch: 85, train_loss: 0.7243, test_loss: 1.0366, test_f1: 0.5612
 epoch: 86, train_loss: 0.7244, test_loss: 1.0258, test_f1: 0.5713
 epoch: 87, train_loss: 0.7143, test_loss: 1.0356, test_f1: 0.5713
 epoch: 88, train_loss: 0.7103, test_loss: 1.0317, test_f1: 0.5762
 epoch: 89, train_loss: 0.7156, test_loss: 1.0272, test_f1: 0.5787
 epoch: 90, train_loss: 0.7059, test_loss: 1.0310, test_f1: 0.5644
 epoch: 91, train_loss: 0.7002, test_loss: 1.0302, test_f1: 0.5692
 epoch: 92, train_loss: 0.6991, test_loss: 1.0442, test_f1: 0.5737
 epoch: 93, train_loss: 0.7017, test_loss: 1.0631, test_f1: 0.5720
 epoch: 94, train_loss: 0.6983, test_loss: 1.0528, test_f1: 0.5738
 epoch: 95, train_loss: 0.6976, test_loss: 1.0548, test_f1: 0.5772
 epoch: 96, train_loss: 0.6917, test_loss: 1.0617, test_f1: 0.5780
 epoch: 97, train_loss: 0.6884, test_loss: 1.0575, test_f1: 0.5819
 epoch: 98, train_loss: 0.7006, test_loss: 1.0546, test_f1: 0.5816
 epoch: 99, train_loss: 0.6849, test_loss: 1.0600, test_f1: 0.5789
##################ITERATION #5 ****************************************
 epoch: 0, train_loss: 1.2800, test_loss: 1.3643, test_f1: 0.1365
 epoch: 1, train_loss: 1.1783, test_loss: 1.3441, test_f1: 0.1365
 epoch: 2, train_loss: 1.1446, test_loss: 1.3204, test_f1: 0.1365
 epoch: 3, train_loss: 1.1123, test_loss: 1.3058, test_f1: 0.1365
 epoch: 4, train_loss: 1.0877, test_loss: 1.2955, test_f1: 0.1365
 epoch: 5, train_loss: 1.0696, test_loss: 1.2784, test_f1: 0.1395
 epoch: 6, train_loss: 1.0484, test_loss: 1.2519, test_f1: 0.2166
 epoch: 7, train_loss: 1.0439, test_loss: 1.2197, test_f1: 0.3033
 epoch: 8, train_loss: 1.0275, test_loss: 1.1821, test_f1: 0.3826
 epoch: 9, train_loss: 1.0193, test_loss: 1.1459, test_f1: 0.4543
 epoch: 10, train_loss: 1.0033, test_loss: 1.1176, test_f1: 0.4838
 epoch: 11, train_loss: 0.9967, test_loss: 1.0986, test_f1: 0.4599
 epoch: 12, train_loss: 0.9897, test_loss: 1.0909, test_f1: 0.4537
 epoch: 13, train_loss: 0.9803, test_loss: 1.0792, test_f1: 0.4956
 epoch: 14, train_loss: 0.9774, test_loss: 1.0686, test_f1: 0.5187
 epoch: 15, train_loss: 0.9711, test_loss: 1.0625, test_f1: 0.5272
 epoch: 16, train_loss: 0.9631, test_loss: 1.0582, test_f1: 0.5360
 epoch: 17, train_loss: 0.9536, test_loss: 1.0545, test_f1: 0.5444
 epoch: 18, train_loss: 0.9509, test_loss: 1.0492, test_f1: 0.5402
 epoch: 19, train_loss: 0.9526, test_loss: 1.0441, test_f1: 0.5472
 epoch: 20, train_loss: 0.9422, test_loss: 1.0434, test_f1: 0.5528
 epoch: 21, train_loss: 0.9389, test_loss: 1.0406, test_f1: 0.5478
 epoch: 22, train_loss: 0.9310, test_loss: 1.0392, test_f1: 0.5507
 epoch: 23, train_loss: 0.9265, test_loss: 1.0408, test_f1: 0.5433
 epoch: 24, train_loss: 0.9210, test_loss: 1.0363, test_f1: 0.5407
 epoch: 25, train_loss: 0.9256, test_loss: 1.0308, test_f1: 0.5436
 epoch: 26, train_loss: 0.9072, test_loss: 1.0303, test_f1: 0.5422
 epoch: 27, train_loss: 0.9167, test_loss: 1.0256, test_f1: 0.5546
 epoch: 28, train_loss: 0.9054, test_loss: 1.0247, test_f1: 0.5498
 epoch: 29, train_loss: 0.9011, test_loss: 1.0255, test_f1: 0.5527
 epoch: 30, train_loss: 0.8946, test_loss: 1.0242, test_f1: 0.5544
 epoch: 31, train_loss: 0.8972, test_loss: 1.0208, test_f1: 0.5564
 epoch: 32, train_loss: 0.8852, test_loss: 1.0184, test_f1: 0.5572
 epoch: 33, train_loss: 0.8847, test_loss: 1.0169, test_f1: 0.5530
 epoch: 34, train_loss: 0.8845, test_loss: 1.0234, test_f1: 0.5342
 epoch: 35, train_loss: 0.8752, test_loss: 1.0252, test_f1: 0.5306
 epoch: 36, train_loss: 0.8775, test_loss: 1.0185, test_f1: 0.5299
 epoch: 37, train_loss: 0.8627, test_loss: 1.0109, test_f1: 0.5314
 epoch: 38, train_loss: 0.8638, test_loss: 1.0106, test_f1: 0.5330
 epoch: 39, train_loss: 0.8589, test_loss: 1.0087, test_f1: 0.5695
 epoch: 40, train_loss: 0.8525, test_loss: 1.0124, test_f1: 0.5577
 epoch: 41, train_loss: 0.8525, test_loss: 1.0182, test_f1: 0.5617
 epoch: 42, train_loss: 0.8474, test_loss: 1.0135, test_f1: 0.5540
 epoch: 43, train_loss: 0.8486, test_loss: 1.0148, test_f1: 0.5688
 epoch: 44, train_loss: 0.8414, test_loss: 1.0142, test_f1: 0.5249
 epoch: 45, train_loss: 0.8349, test_loss: 1.0114, test_f1: 0.5231
 epoch: 46, train_loss: 0.8257, test_loss: 1.0144, test_f1: 0.5748
 epoch: 47, train_loss: 0.8322, test_loss: 1.0136, test_f1: 0.5601
 epoch: 48, train_loss: 0.8200, test_loss: 1.0133, test_f1: 0.5269
 epoch: 49, train_loss: 0.8161, test_loss: 1.0044, test_f1: 0.5403
 epoch: 50, train_loss: 0.8121, test_loss: 1.0041, test_f1: 0.5625
 epoch: 51, train_loss: 0.8139, test_loss: 1.0047, test_f1: 0.5564
 epoch: 52, train_loss: 0.8105, test_loss: 1.0059, test_f1: 0.5498
 epoch: 53, train_loss: 0.8060, test_loss: 1.0047, test_f1: 0.5451
 epoch: 54, train_loss: 0.7948, test_loss: 0.9993, test_f1: 0.5622
 epoch: 55, train_loss: 0.8065, test_loss: 0.9974, test_f1: 0.5605
 epoch: 56, train_loss: 0.7982, test_loss: 0.9975, test_f1: 0.5585
 epoch: 57, train_loss: 0.7953, test_loss: 0.9965, test_f1: 0.5579
 epoch: 58, train_loss: 0.8019, test_loss: 1.0014, test_f1: 0.5476
 epoch: 59, train_loss: 0.7897, test_loss: 1.0060, test_f1: 0.5424
 epoch: 60, train_loss: 0.7830, test_loss: 1.0042, test_f1: 0.5548
 epoch: 61, train_loss: 0.7828, test_loss: 1.0038, test_f1: 0.5477
 epoch: 62, train_loss: 0.7872, test_loss: 1.0010, test_f1: 0.5492
 epoch: 63, train_loss: 0.7887, test_loss: 0.9969, test_f1: 0.5524
 epoch: 64, train_loss: 0.7838, test_loss: 1.0011, test_f1: 0.5554
 epoch: 65, train_loss: 0.7781, test_loss: 1.0040, test_f1: 0.5460
 epoch: 66, train_loss: 0.7772, test_loss: 1.0076, test_f1: 0.5419
 epoch: 67, train_loss: 0.7856, test_loss: 1.0076, test_f1: 0.5483
 epoch: 68, train_loss: 0.7755, test_loss: 1.0042, test_f1: 0.5574
 epoch: 69, train_loss: 0.7629, test_loss: 1.0029, test_f1: 0.5584
 epoch: 70, train_loss: 0.7635, test_loss: 1.0047, test_f1: 0.5579
 epoch: 71, train_loss: 0.7625, test_loss: 1.0034, test_f1: 0.5618
 epoch: 72, train_loss: 0.7672, test_loss: 1.0053, test_f1: 0.5632
 epoch: 73, train_loss: 0.7647, test_loss: 1.0070, test_f1: 0.5602
 epoch: 74, train_loss: 0.7549, test_loss: 1.0045, test_f1: 0.5511
 epoch: 75, train_loss: 0.7562, test_loss: 1.0072, test_f1: 0.5604
 epoch: 76, train_loss: 0.7535, test_loss: 1.0105, test_f1: 0.5470
 epoch: 77, train_loss: 0.7501, test_loss: 1.0101, test_f1: 0.5712
 epoch: 78, train_loss: 0.7476, test_loss: 1.0128, test_f1: 0.5638
 epoch: 79, train_loss: 0.7505, test_loss: 1.0093, test_f1: 0.5583
 epoch: 80, train_loss: 0.7487, test_loss: 1.0053, test_f1: 0.5581
 epoch: 81, train_loss: 0.7372, test_loss: 1.0136, test_f1: 0.5519
 epoch: 82, train_loss: 0.7405, test_loss: 1.0192, test_f1: 0.5431
 epoch: 83, train_loss: 0.7386, test_loss: 1.0127, test_f1: 0.5520
 epoch: 84, train_loss: 0.7419, test_loss: 1.0127, test_f1: 0.5620
 epoch: 85, train_loss: 0.7368, test_loss: 1.0192, test_f1: 0.5530
 epoch: 86, train_loss: 0.7297, test_loss: 1.0222, test_f1: 0.5376
 epoch: 87, train_loss: 0.7322, test_loss: 1.0245, test_f1: 0.5531
 epoch: 88, train_loss: 0.7266, test_loss: 1.0229, test_f1: 0.5532
 epoch: 89, train_loss: 0.7233, test_loss: 1.0212, test_f1: 0.5472
 epoch: 90, train_loss: 0.7160, test_loss: 1.0218, test_f1: 0.5523
 epoch: 91, train_loss: 0.7260, test_loss: 1.0233, test_f1: 0.5600
 epoch: 92, train_loss: 0.7096, test_loss: 1.0215, test_f1: 0.5416
 epoch: 93, train_loss: 0.7194, test_loss: 1.0210, test_f1: 0.5542
 epoch: 94, train_loss: 0.7137, test_loss: 1.0258, test_f1: 0.5579
 epoch: 95, train_loss: 0.7162, test_loss: 1.0173, test_f1: 0.5558
 epoch: 96, train_loss: 0.7067, test_loss: 1.0213, test_f1: 0.5438
 epoch: 97, train_loss: 0.7127, test_loss: 1.0276, test_f1: 0.5587
 epoch: 98, train_loss: 0.7070, test_loss: 1.0300, test_f1: 0.5573
 epoch: 99, train_loss: 0.7036, test_loss: 1.0210, test_f1: 0.5614
##################ITERATION #6 ****************************************
 epoch: 0, train_loss: 1.2373, test_loss: 1.3358, test_f1: 0.2281
 epoch: 1, train_loss: 1.1624, test_loss: 1.3256, test_f1: 0.2281
 epoch: 2, train_loss: 1.1397, test_loss: 1.3177, test_f1: 0.2281
 epoch: 3, train_loss: 1.1110, test_loss: 1.3087, test_f1: 0.2281
 epoch: 4, train_loss: 1.0881, test_loss: 1.2910, test_f1: 0.2281
 epoch: 5, train_loss: 1.0760, test_loss: 1.2671, test_f1: 0.2631
 epoch: 6, train_loss: 1.0565, test_loss: 1.2347, test_f1: 0.3594
 epoch: 7, train_loss: 1.0405, test_loss: 1.1988, test_f1: 0.3810
 epoch: 8, train_loss: 1.0325, test_loss: 1.1638, test_f1: 0.3772
 epoch: 9, train_loss: 1.0147, test_loss: 1.1317, test_f1: 0.4235
 epoch: 10, train_loss: 1.0042, test_loss: 1.1044, test_f1: 0.4466
 epoch: 11, train_loss: 0.9949, test_loss: 1.0873, test_f1: 0.4530
 epoch: 12, train_loss: 0.9949, test_loss: 1.0755, test_f1: 0.4701
 epoch: 13, train_loss: 0.9817, test_loss: 1.0678, test_f1: 0.4822
 epoch: 14, train_loss: 0.9726, test_loss: 1.0618, test_f1: 0.4845
 epoch: 15, train_loss: 0.9647, test_loss: 1.0552, test_f1: 0.4979
 epoch: 16, train_loss: 0.9590, test_loss: 1.0495, test_f1: 0.5068
 epoch: 17, train_loss: 0.9547, test_loss: 1.0456, test_f1: 0.5096
 epoch: 18, train_loss: 0.9566, test_loss: 1.0405, test_f1: 0.5128
 epoch: 19, train_loss: 0.9425, test_loss: 1.0368, test_f1: 0.5118
 epoch: 20, train_loss: 0.9385, test_loss: 1.0371, test_f1: 0.5166
 epoch: 21, train_loss: 0.9390, test_loss: 1.0314, test_f1: 0.5128
 epoch: 22, train_loss: 0.9305, test_loss: 1.0298, test_f1: 0.5115
 epoch: 23, train_loss: 0.9222, test_loss: 1.0311, test_f1: 0.5250
 epoch: 24, train_loss: 0.9225, test_loss: 1.0311, test_f1: 0.5284
 epoch: 25, train_loss: 0.9078, test_loss: 1.0284, test_f1: 0.5276
 epoch: 26, train_loss: 0.9089, test_loss: 1.0272, test_f1: 0.5456
 epoch: 27, train_loss: 0.8959, test_loss: 1.0210, test_f1: 0.5416
 epoch: 28, train_loss: 0.8921, test_loss: 1.0178, test_f1: 0.5425
 epoch: 29, train_loss: 0.8885, test_loss: 1.0248, test_f1: 0.5519
 epoch: 30, train_loss: 0.8834, test_loss: 1.0247, test_f1: 0.5446
 epoch: 31, train_loss: 0.8830, test_loss: 1.0175, test_f1: 0.5485
 epoch: 32, train_loss: 0.8852, test_loss: 1.0141, test_f1: 0.5546
 epoch: 33, train_loss: 0.8747, test_loss: 1.0100, test_f1: 0.5298
 epoch: 34, train_loss: 0.8677, test_loss: 1.0119, test_f1: 0.5557
 epoch: 35, train_loss: 0.8761, test_loss: 1.0090, test_f1: 0.5561
 epoch: 36, train_loss: 0.8565, test_loss: 1.0113, test_f1: 0.5340
 epoch: 37, train_loss: 0.8562, test_loss: 1.0117, test_f1: 0.5547
 epoch: 38, train_loss: 0.8522, test_loss: 1.0060, test_f1: 0.5636
 epoch: 39, train_loss: 0.8467, test_loss: 1.0037, test_f1: 0.5709
 epoch: 40, train_loss: 0.8456, test_loss: 1.0006, test_f1: 0.5551
 epoch: 41, train_loss: 0.8409, test_loss: 1.0091, test_f1: 0.5605
 epoch: 42, train_loss: 0.8369, test_loss: 1.0052, test_f1: 0.5492
 epoch: 43, train_loss: 0.8317, test_loss: 1.0040, test_f1: 0.5538
 epoch: 44, train_loss: 0.8170, test_loss: 1.0049, test_f1: 0.5400
 epoch: 45, train_loss: 0.8135, test_loss: 1.0019, test_f1: 0.5411
 epoch: 46, train_loss: 0.8126, test_loss: 1.0053, test_f1: 0.5482
 epoch: 47, train_loss: 0.8169, test_loss: 1.0034, test_f1: 0.5360
 epoch: 48, train_loss: 0.8036, test_loss: 1.0101, test_f1: 0.5491
 epoch: 49, train_loss: 0.8010, test_loss: 1.0054, test_f1: 0.5461
 epoch: 50, train_loss: 0.7920, test_loss: 0.9952, test_f1: 0.5482
 epoch: 51, train_loss: 0.8007, test_loss: 0.9953, test_f1: 0.5554
 epoch: 52, train_loss: 0.7920, test_loss: 0.9927, test_f1: 0.5471
 epoch: 53, train_loss: 0.7807, test_loss: 0.9931, test_f1: 0.5515
 epoch: 54, train_loss: 0.7710, test_loss: 0.9934, test_f1: 0.5509
 epoch: 55, train_loss: 0.7847, test_loss: 0.9932, test_f1: 0.5446
 epoch: 56, train_loss: 0.7776, test_loss: 0.9942, test_f1: 0.5487
 epoch: 57, train_loss: 0.7785, test_loss: 0.9953, test_f1: 0.5420
 epoch: 58, train_loss: 0.7730, test_loss: 0.9983, test_f1: 0.5448
 epoch: 59, train_loss: 0.7666, test_loss: 1.0037, test_f1: 0.5449
 epoch: 60, train_loss: 0.7701, test_loss: 1.0050, test_f1: 0.5367
 epoch: 61, train_loss: 0.7734, test_loss: 1.0067, test_f1: 0.5539
 epoch: 62, train_loss: 0.7631, test_loss: 1.0077, test_f1: 0.5392
 epoch: 63, train_loss: 0.7649, test_loss: 1.0051, test_f1: 0.5567
 epoch: 64, train_loss: 0.7564, test_loss: 1.0072, test_f1: 0.5559
 epoch: 65, train_loss: 0.7470, test_loss: 1.0067, test_f1: 0.5471
 epoch: 66, train_loss: 0.7586, test_loss: 1.0108, test_f1: 0.5519
 epoch: 67, train_loss: 0.7511, test_loss: 1.0112, test_f1: 0.5424
 epoch: 68, train_loss: 0.7543, test_loss: 1.0061, test_f1: 0.5449
 epoch: 69, train_loss: 0.7392, test_loss: 1.0117, test_f1: 0.5617
 epoch: 70, train_loss: 0.7555, test_loss: 1.0167, test_f1: 0.5681
 epoch: 71, train_loss: 0.7408, test_loss: 1.0099, test_f1: 0.5788
 epoch: 72, train_loss: 0.7334, test_loss: 1.0085, test_f1: 0.5778
 epoch: 73, train_loss: 0.7342, test_loss: 1.0078, test_f1: 0.5652
 epoch: 74, train_loss: 0.7368, test_loss: 1.0043, test_f1: 0.5649
 epoch: 75, train_loss: 0.7352, test_loss: 1.0012, test_f1: 0.5668
 epoch: 76, train_loss: 0.7349, test_loss: 1.0066, test_f1: 0.5554
 epoch: 77, train_loss: 0.7232, test_loss: 1.0031, test_f1: 0.5643
 epoch: 78, train_loss: 0.7216, test_loss: 1.0043, test_f1: 0.5565
 epoch: 79, train_loss: 0.7311, test_loss: 1.0128, test_f1: 0.5486
 epoch: 80, train_loss: 0.7261, test_loss: 1.0143, test_f1: 0.5313
 epoch: 81, train_loss: 0.7132, test_loss: 1.0053, test_f1: 0.5432
 epoch: 82, train_loss: 0.7095, test_loss: 1.0068, test_f1: 0.5389
 epoch: 83, train_loss: 0.7041, test_loss: 1.0129, test_f1: 0.5402
 epoch: 84, train_loss: 0.7133, test_loss: 1.0173, test_f1: 0.5427
 epoch: 85, train_loss: 0.7004, test_loss: 1.0080, test_f1: 0.5670
 epoch: 86, train_loss: 0.7007, test_loss: 1.0057, test_f1: 0.5625
 epoch: 87, train_loss: 0.7072, test_loss: 1.0013, test_f1: 0.5650
 epoch: 88, train_loss: 0.7079, test_loss: 0.9925, test_f1: 0.5668
 epoch: 89, train_loss: 0.6988, test_loss: 0.9898, test_f1: 0.5653
 epoch: 90, train_loss: 0.6974, test_loss: 0.9971, test_f1: 0.5563
 epoch: 91, train_loss: 0.7025, test_loss: 1.0115, test_f1: 0.5513
 epoch: 92, train_loss: 0.6901, test_loss: 1.0216, test_f1: 0.5479
 epoch: 93, train_loss: 0.6933, test_loss: 1.0237, test_f1: 0.5537
 epoch: 94, train_loss: 0.6799, test_loss: 1.0230, test_f1: 0.5564
 epoch: 95, train_loss: 0.6974, test_loss: 1.0144, test_f1: 0.5583
 epoch: 96, train_loss: 0.6884, test_loss: 1.0245, test_f1: 0.5611
 epoch: 97, train_loss: 0.6850, test_loss: 1.0261, test_f1: 0.5700
 epoch: 98, train_loss: 0.6796, test_loss: 1.0219, test_f1: 0.5647
 epoch: 99, train_loss: 0.6670, test_loss: 1.0172, test_f1: 0.5656
##################ITERATION #7 ****************************************
 epoch: 0, train_loss: 1.2283, test_loss: 1.3246, test_f1: 0.2281
 epoch: 1, train_loss: 1.1297, test_loss: 1.3056, test_f1: 0.2281
 epoch: 2, train_loss: 1.1001, test_loss: 1.2971, test_f1: 0.2281
 epoch: 3, train_loss: 1.0783, test_loss: 1.3053, test_f1: 0.2281
 epoch: 4, train_loss: 1.0615, test_loss: 1.3129, test_f1: 0.2285
 epoch: 5, train_loss: 1.0391, test_loss: 1.3045, test_f1: 0.2721
 epoch: 6, train_loss: 1.0288, test_loss: 1.2681, test_f1: 0.3301
 epoch: 7, train_loss: 1.0107, test_loss: 1.2167, test_f1: 0.3594
 epoch: 8, train_loss: 1.0049, test_loss: 1.1783, test_f1: 0.4179
 epoch: 9, train_loss: 0.9977, test_loss: 1.1458, test_f1: 0.4335
 epoch: 10, train_loss: 0.9832, test_loss: 1.1209, test_f1: 0.4768
 epoch: 11, train_loss: 0.9816, test_loss: 1.1014, test_f1: 0.4872
 epoch: 12, train_loss: 0.9715, test_loss: 1.0835, test_f1: 0.5067
 epoch: 13, train_loss: 0.9625, test_loss: 1.0712, test_f1: 0.5215
 epoch: 14, train_loss: 0.9577, test_loss: 1.0631, test_f1: 0.5140
 epoch: 15, train_loss: 0.9544, test_loss: 1.0613, test_f1: 0.5121
 epoch: 16, train_loss: 0.9468, test_loss: 1.0551, test_f1: 0.5175
 epoch: 17, train_loss: 0.9344, test_loss: 1.0518, test_f1: 0.5213
 epoch: 18, train_loss: 0.9387, test_loss: 1.0548, test_f1: 0.5181
 epoch: 19, train_loss: 0.9283, test_loss: 1.0489, test_f1: 0.5218
 epoch: 20, train_loss: 0.9257, test_loss: 1.0418, test_f1: 0.5261
 epoch: 21, train_loss: 0.9176, test_loss: 1.0350, test_f1: 0.5301
 epoch: 22, train_loss: 0.9152, test_loss: 1.0321, test_f1: 0.5305
 epoch: 23, train_loss: 0.9050, test_loss: 1.0294, test_f1: 0.5362
 epoch: 24, train_loss: 0.8985, test_loss: 1.0330, test_f1: 0.5320
 epoch: 25, train_loss: 0.8933, test_loss: 1.0355, test_f1: 0.5447
 epoch: 26, train_loss: 0.8943, test_loss: 1.0301, test_f1: 0.5364
 epoch: 27, train_loss: 0.8891, test_loss: 1.0221, test_f1: 0.5414
 epoch: 28, train_loss: 0.8827, test_loss: 1.0177, test_f1: 0.5430
 epoch: 29, train_loss: 0.8723, test_loss: 1.0203, test_f1: 0.5312
 epoch: 30, train_loss: 0.8847, test_loss: 1.0261, test_f1: 0.5212
 epoch: 31, train_loss: 0.8653, test_loss: 1.0172, test_f1: 0.5343
 epoch: 32, train_loss: 0.8652, test_loss: 1.0129, test_f1: 0.5401
 epoch: 33, train_loss: 0.8570, test_loss: 1.0102, test_f1: 0.5465
 epoch: 34, train_loss: 0.8573, test_loss: 1.0097, test_f1: 0.5385
 epoch: 35, train_loss: 0.8535, test_loss: 1.0073, test_f1: 0.5479
 epoch: 36, train_loss: 0.8503, test_loss: 1.0084, test_f1: 0.5463
 epoch: 37, train_loss: 0.8393, test_loss: 1.0094, test_f1: 0.5441
 epoch: 38, train_loss: 0.8404, test_loss: 1.0216, test_f1: 0.5471
 epoch: 39, train_loss: 0.8272, test_loss: 1.0251, test_f1: 0.5492
 epoch: 40, train_loss: 0.8296, test_loss: 1.0123, test_f1: 0.5503
 epoch: 41, train_loss: 0.8227, test_loss: 1.0062, test_f1: 0.5430
 epoch: 42, train_loss: 0.8237, test_loss: 1.0125, test_f1: 0.5580
 epoch: 43, train_loss: 0.8048, test_loss: 1.0048, test_f1: 0.5571
 epoch: 44, train_loss: 0.8054, test_loss: 0.9990, test_f1: 0.5517
 epoch: 45, train_loss: 0.8032, test_loss: 1.0184, test_f1: 0.5362
 epoch: 46, train_loss: 0.8014, test_loss: 1.0252, test_f1: 0.5340
 epoch: 47, train_loss: 0.8035, test_loss: 1.0127, test_f1: 0.5533
 epoch: 48, train_loss: 0.7941, test_loss: 0.9978, test_f1: 0.5571
 epoch: 49, train_loss: 0.7913, test_loss: 1.0117, test_f1: 0.5573
 epoch: 50, train_loss: 0.7776, test_loss: 1.0217, test_f1: 0.5498
 epoch: 51, train_loss: 0.7783, test_loss: 1.0134, test_f1: 0.5581
 epoch: 52, train_loss: 0.7691, test_loss: 1.0040, test_f1: 0.5493
 epoch: 53, train_loss: 0.7699, test_loss: 0.9991, test_f1: 0.5584
 epoch: 54, train_loss: 0.7693, test_loss: 1.0062, test_f1: 0.5581
 epoch: 55, train_loss: 0.7618, test_loss: 1.0115, test_f1: 0.5586
 epoch: 56, train_loss: 0.7580, test_loss: 1.0089, test_f1: 0.5585
 epoch: 57, train_loss: 0.7637, test_loss: 1.0078, test_f1: 0.5589
 epoch: 58, train_loss: 0.7600, test_loss: 1.0183, test_f1: 0.5606
 epoch: 59, train_loss: 0.7516, test_loss: 1.0091, test_f1: 0.5646
 epoch: 60, train_loss: 0.7506, test_loss: 1.0069, test_f1: 0.5588
 epoch: 61, train_loss: 0.7521, test_loss: 1.0082, test_f1: 0.5601
 epoch: 62, train_loss: 0.7380, test_loss: 1.0134, test_f1: 0.5710
 epoch: 63, train_loss: 0.7466, test_loss: 1.0166, test_f1: 0.5693
 epoch: 64, train_loss: 0.7329, test_loss: 1.0477, test_f1: 0.5741
 epoch: 65, train_loss: 0.7439, test_loss: 1.0272, test_f1: 0.5851
 epoch: 66, train_loss: 0.7392, test_loss: 1.0171, test_f1: 0.5583
 epoch: 67, train_loss: 0.7338, test_loss: 1.0110, test_f1: 0.5636
 epoch: 68, train_loss: 0.7275, test_loss: 1.0133, test_f1: 0.5665
 epoch: 69, train_loss: 0.7369, test_loss: 1.0129, test_f1: 0.5690
 epoch: 70, train_loss: 0.7273, test_loss: 1.0148, test_f1: 0.5755
 epoch: 71, train_loss: 0.7173, test_loss: 1.0121, test_f1: 0.5763
 epoch: 72, train_loss: 0.7261, test_loss: 1.0212, test_f1: 0.5765
 epoch: 73, train_loss: 0.7183, test_loss: 1.0245, test_f1: 0.5806
 epoch: 74, train_loss: 0.7224, test_loss: 1.0215, test_f1: 0.5901
 epoch: 75, train_loss: 0.7166, test_loss: 1.0193, test_f1: 0.5762
 epoch: 76, train_loss: 0.7185, test_loss: 1.0154, test_f1: 0.5721
 epoch: 77, train_loss: 0.7066, test_loss: 1.0149, test_f1: 0.5771
 epoch: 78, train_loss: 0.7065, test_loss: 1.0096, test_f1: 0.5822
 epoch: 79, train_loss: 0.7059, test_loss: 1.0211, test_f1: 0.5985
 epoch: 80, train_loss: 0.7046, test_loss: 1.0208, test_f1: 0.5960
 epoch: 81, train_loss: 0.6956, test_loss: 1.0173, test_f1: 0.5845
 epoch: 82, train_loss: 0.6966, test_loss: 1.0177, test_f1: 0.5761
 epoch: 83, train_loss: 0.6918, test_loss: 1.0274, test_f1: 0.5793
 epoch: 84, train_loss: 0.7003, test_loss: 1.0332, test_f1: 0.5720
 epoch: 85, train_loss: 0.6891, test_loss: 1.0282, test_f1: 0.5690
 epoch: 86, train_loss: 0.6902, test_loss: 1.0181, test_f1: 0.5692
 epoch: 87, train_loss: 0.6830, test_loss: 1.0283, test_f1: 0.5785
 epoch: 88, train_loss: 0.6732, test_loss: 1.0337, test_f1: 0.5850
 epoch: 89, train_loss: 0.6861, test_loss: 1.0343, test_f1: 0.5974
 epoch: 90, train_loss: 0.6759, test_loss: 1.0403, test_f1: 0.5993
 epoch: 91, train_loss: 0.6798, test_loss: 1.0416, test_f1: 0.5941
 epoch: 92, train_loss: 0.6717, test_loss: 1.0438, test_f1: 0.5748
 epoch: 93, train_loss: 0.6695, test_loss: 1.0486, test_f1: 0.5691
 epoch: 94, train_loss: 0.6780, test_loss: 1.0611, test_f1: 0.5720
 epoch: 95, train_loss: 0.6751, test_loss: 1.0485, test_f1: 0.5718
 epoch: 96, train_loss: 0.6691, test_loss: 1.0435, test_f1: 0.5813
 epoch: 97, train_loss: 0.6626, test_loss: 1.0363, test_f1: 0.5764
 epoch: 98, train_loss: 0.6572, test_loss: 1.0329, test_f1: 0.5818
 epoch: 99, train_loss: 0.6547, test_loss: 1.0456, test_f1: 0.5665
##################ITERATION #8 ****************************************
 epoch: 0, train_loss: 1.2337, test_loss: 1.3082, test_f1: 0.1365
 epoch: 1, train_loss: 1.1382, test_loss: 1.2975, test_f1: 0.3232
 epoch: 2, train_loss: 1.1018, test_loss: 1.2838, test_f1: 0.2722
 epoch: 3, train_loss: 1.0807, test_loss: 1.2657, test_f1: 0.2974
 epoch: 4, train_loss: 1.0562, test_loss: 1.2369, test_f1: 0.3232
 epoch: 5, train_loss: 1.0373, test_loss: 1.2011, test_f1: 0.3870
 epoch: 6, train_loss: 1.0259, test_loss: 1.1669, test_f1: 0.4446
 epoch: 7, train_loss: 1.0101, test_loss: 1.1371, test_f1: 0.4387
 epoch: 8, train_loss: 0.9983, test_loss: 1.1112, test_f1: 0.4643
 epoch: 9, train_loss: 0.9886, test_loss: 1.0869, test_f1: 0.4856
 epoch: 10, train_loss: 0.9882, test_loss: 1.0720, test_f1: 0.4933
 epoch: 11, train_loss: 0.9644, test_loss: 1.0588, test_f1: 0.5016
 epoch: 12, train_loss: 0.9591, test_loss: 1.0512, test_f1: 0.5079
 epoch: 13, train_loss: 0.9540, test_loss: 1.0454, test_f1: 0.5117
 epoch: 14, train_loss: 0.9454, test_loss: 1.0399, test_f1: 0.5058
 epoch: 15, train_loss: 0.9397, test_loss: 1.0275, test_f1: 0.5017
 epoch: 16, train_loss: 0.9375, test_loss: 1.0216, test_f1: 0.5075
 epoch: 17, train_loss: 0.9315, test_loss: 1.0231, test_f1: 0.5402
 epoch: 18, train_loss: 0.9330, test_loss: 1.0175, test_f1: 0.5378
 epoch: 19, train_loss: 0.9181, test_loss: 1.0142, test_f1: 0.5314
 epoch: 20, train_loss: 0.9053, test_loss: 1.0133, test_f1: 0.5375
 epoch: 21, train_loss: 0.9062, test_loss: 1.0106, test_f1: 0.5210
 epoch: 22, train_loss: 0.9010, test_loss: 1.0135, test_f1: 0.5238
 epoch: 23, train_loss: 0.8911, test_loss: 1.0122, test_f1: 0.5335
 epoch: 24, train_loss: 0.8933, test_loss: 1.0065, test_f1: 0.5418
 epoch: 25, train_loss: 0.8927, test_loss: 1.0006, test_f1: 0.5324
 epoch: 26, train_loss: 0.8865, test_loss: 1.0012, test_f1: 0.5222
 epoch: 27, train_loss: 0.8877, test_loss: 1.0020, test_f1: 0.5287
 epoch: 28, train_loss: 0.8717, test_loss: 1.0038, test_f1: 0.5229
 epoch: 29, train_loss: 0.8649, test_loss: 1.0054, test_f1: 0.5213
 epoch: 30, train_loss: 0.8653, test_loss: 0.9983, test_f1: 0.5243
 epoch: 31, train_loss: 0.8534, test_loss: 0.9947, test_f1: 0.5321
 epoch: 32, train_loss: 0.8487, test_loss: 0.9950, test_f1: 0.5360
 epoch: 33, train_loss: 0.8570, test_loss: 0.9981, test_f1: 0.5296
 epoch: 34, train_loss: 0.8487, test_loss: 0.9958, test_f1: 0.5311
 epoch: 35, train_loss: 0.8333, test_loss: 0.9958, test_f1: 0.5347
 epoch: 36, train_loss: 0.8348, test_loss: 0.9919, test_f1: 0.5385
 epoch: 37, train_loss: 0.8294, test_loss: 0.9964, test_f1: 0.5417
 epoch: 38, train_loss: 0.8328, test_loss: 0.9924, test_f1: 0.5362
 epoch: 39, train_loss: 0.8323, test_loss: 0.9944, test_f1: 0.5313
 epoch: 40, train_loss: 0.8107, test_loss: 0.9992, test_f1: 0.5280
 epoch: 41, train_loss: 0.8170, test_loss: 1.0026, test_f1: 0.5350
 epoch: 42, train_loss: 0.8129, test_loss: 0.9996, test_f1: 0.5339
 epoch: 43, train_loss: 0.8032, test_loss: 0.9913, test_f1: 0.5484
 epoch: 44, train_loss: 0.8057, test_loss: 0.9900, test_f1: 0.5448
 epoch: 45, train_loss: 0.7932, test_loss: 0.9944, test_f1: 0.5485
 epoch: 46, train_loss: 0.7930, test_loss: 0.9897, test_f1: 0.5467
 epoch: 47, train_loss: 0.7896, test_loss: 0.9848, test_f1: 0.5395
 epoch: 48, train_loss: 0.7738, test_loss: 0.9882, test_f1: 0.5376
 epoch: 49, train_loss: 0.7782, test_loss: 1.0021, test_f1: 0.5281
 epoch: 50, train_loss: 0.7800, test_loss: 1.0076, test_f1: 0.5336
 epoch: 51, train_loss: 0.7702, test_loss: 0.9973, test_f1: 0.5427
 epoch: 52, train_loss: 0.7692, test_loss: 0.9866, test_f1: 0.5443
 epoch: 53, train_loss: 0.7649, test_loss: 0.9819, test_f1: 0.5500
 epoch: 54, train_loss: 0.7588, test_loss: 0.9835, test_f1: 0.5512
 epoch: 55, train_loss: 0.7554, test_loss: 0.9864, test_f1: 0.5550
 epoch: 56, train_loss: 0.7465, test_loss: 0.9957, test_f1: 0.5453
 epoch: 57, train_loss: 0.7550, test_loss: 0.9958, test_f1: 0.5488
 epoch: 58, train_loss: 0.7436, test_loss: 0.9911, test_f1: 0.5499
 epoch: 59, train_loss: 0.7384, test_loss: 0.9897, test_f1: 0.5539
 epoch: 60, train_loss: 0.7382, test_loss: 0.9896, test_f1: 0.5492
 epoch: 61, train_loss: 0.7465, test_loss: 0.9872, test_f1: 0.5494
 epoch: 62, train_loss: 0.7388, test_loss: 0.9842, test_f1: 0.5532
 epoch: 63, train_loss: 0.7272, test_loss: 0.9880, test_f1: 0.5482
 epoch: 64, train_loss: 0.7264, test_loss: 0.9946, test_f1: 0.5624
 epoch: 65, train_loss: 0.7264, test_loss: 0.9878, test_f1: 0.5605
 epoch: 66, train_loss: 0.7323, test_loss: 0.9844, test_f1: 0.5598
 epoch: 67, train_loss: 0.7221, test_loss: 0.9874, test_f1: 0.5563
 epoch: 68, train_loss: 0.7219, test_loss: 0.9899, test_f1: 0.5552
 epoch: 69, train_loss: 0.7294, test_loss: 0.9867, test_f1: 0.5616
 epoch: 70, train_loss: 0.7205, test_loss: 0.9923, test_f1: 0.5649
 epoch: 71, train_loss: 0.7218, test_loss: 0.9991, test_f1: 0.5610
 epoch: 72, train_loss: 0.7113, test_loss: 0.9970, test_f1: 0.5585
 epoch: 73, train_loss: 0.7063, test_loss: 0.9898, test_f1: 0.5777
 epoch: 74, train_loss: 0.7075, test_loss: 0.9955, test_f1: 0.5653
 epoch: 75, train_loss: 0.7106, test_loss: 0.9908, test_f1: 0.5668
 epoch: 76, train_loss: 0.7139, test_loss: 0.9857, test_f1: 0.5631
 epoch: 77, train_loss: 0.7055, test_loss: 0.9886, test_f1: 0.5646
 epoch: 78, train_loss: 0.7079, test_loss: 1.0057, test_f1: 0.5614
 epoch: 79, train_loss: 0.6939, test_loss: 0.9828, test_f1: 0.5739
 epoch: 80, train_loss: 0.7005, test_loss: 0.9830, test_f1: 0.5787
 epoch: 81, train_loss: 0.6907, test_loss: 0.9888, test_f1: 0.5833
 epoch: 82, train_loss: 0.6972, test_loss: 1.0029, test_f1: 0.5687
 epoch: 83, train_loss: 0.6905, test_loss: 0.9916, test_f1: 0.5754
 epoch: 84, train_loss: 0.6831, test_loss: 0.9906, test_f1: 0.5659
 epoch: 85, train_loss: 0.6800, test_loss: 0.9902, test_f1: 0.5728
 epoch: 86, train_loss: 0.6781, test_loss: 0.9884, test_f1: 0.5674
 epoch: 87, train_loss: 0.6767, test_loss: 0.9933, test_f1: 0.5662
 epoch: 88, train_loss: 0.6825, test_loss: 0.9951, test_f1: 0.5687
 epoch: 89, train_loss: 0.6786, test_loss: 1.0023, test_f1: 0.5684
 epoch: 90, train_loss: 0.6821, test_loss: 0.9932, test_f1: 0.5768
 epoch: 91, train_loss: 0.6725, test_loss: 0.9896, test_f1: 0.5707
 epoch: 92, train_loss: 0.6661, test_loss: 0.9965, test_f1: 0.5747
 epoch: 93, train_loss: 0.6608, test_loss: 1.0110, test_f1: 0.5710
 epoch: 94, train_loss: 0.6737, test_loss: 1.0015, test_f1: 0.5789
 epoch: 95, train_loss: 0.6702, test_loss: 1.0027, test_f1: 0.5726
 epoch: 96, train_loss: 0.6605, test_loss: 0.9921, test_f1: 0.5801
 epoch: 97, train_loss: 0.6557, test_loss: 0.9872, test_f1: 0.5800
 epoch: 98, train_loss: 0.6599, test_loss: 0.9966, test_f1: 0.5781
 epoch: 99, train_loss: 0.6426, test_loss: 1.0007, test_f1: 0.5913
##################ITERATION #9 ****************************************
 epoch: 0, train_loss: 1.2460, test_loss: 1.3133, test_f1: 0.2281
 epoch: 1, train_loss: 1.1062, test_loss: 1.2928, test_f1: 0.2281
 epoch: 2, train_loss: 1.0799, test_loss: 1.2830, test_f1: 0.2281
 epoch: 3, train_loss: 1.0481, test_loss: 1.2749, test_f1: 0.2281
 epoch: 4, train_loss: 1.0325, test_loss: 1.2623, test_f1: 0.2270
 epoch: 5, train_loss: 1.0133, test_loss: 1.2433, test_f1: 0.2996
 epoch: 6, train_loss: 0.9947, test_loss: 1.2134, test_f1: 0.3466
 epoch: 7, train_loss: 0.9851, test_loss: 1.1817, test_f1: 0.4235
 epoch: 8, train_loss: 0.9749, test_loss: 1.1411, test_f1: 0.4767
 epoch: 9, train_loss: 0.9631, test_loss: 1.1053, test_f1: 0.4831
 epoch: 10, train_loss: 0.9530, test_loss: 1.0711, test_f1: 0.4883
 epoch: 11, train_loss: 0.9504, test_loss: 1.0468, test_f1: 0.5029
 epoch: 12, train_loss: 0.9408, test_loss: 1.0408, test_f1: 0.5040
 epoch: 13, train_loss: 0.9362, test_loss: 1.0308, test_f1: 0.5194
 epoch: 14, train_loss: 0.9312, test_loss: 1.0298, test_f1: 0.5233
 epoch: 15, train_loss: 0.9148, test_loss: 1.0271, test_f1: 0.5209
 epoch: 16, train_loss: 0.9207, test_loss: 1.0279, test_f1: 0.5323
 epoch: 17, train_loss: 0.9190, test_loss: 1.0236, test_f1: 0.5366
 epoch: 18, train_loss: 0.9061, test_loss: 1.0150, test_f1: 0.5440
 epoch: 19, train_loss: 0.8992, test_loss: 1.0188, test_f1: 0.5208
 epoch: 20, train_loss: 0.8893, test_loss: 1.0118, test_f1: 0.5277
 epoch: 21, train_loss: 0.8834, test_loss: 1.0076, test_f1: 0.5416
 epoch: 22, train_loss: 0.8875, test_loss: 1.0093, test_f1: 0.5381
 epoch: 23, train_loss: 0.8874, test_loss: 1.0092, test_f1: 0.5402
 epoch: 24, train_loss: 0.8713, test_loss: 1.0120, test_f1: 0.5406
 epoch: 25, train_loss: 0.8686, test_loss: 1.0097, test_f1: 0.5458
 epoch: 26, train_loss: 0.8597, test_loss: 1.0105, test_f1: 0.5717
 epoch: 27, train_loss: 0.8537, test_loss: 1.0025, test_f1: 0.5530
 epoch: 28, train_loss: 0.8459, test_loss: 1.0053, test_f1: 0.5416
 epoch: 29, train_loss: 0.8493, test_loss: 0.9924, test_f1: 0.5507
 epoch: 30, train_loss: 0.8440, test_loss: 0.9898, test_f1: 0.5459
 epoch: 31, train_loss: 0.8430, test_loss: 0.9887, test_f1: 0.5433
 epoch: 32, train_loss: 0.8262, test_loss: 0.9959, test_f1: 0.5613
 epoch: 33, train_loss: 0.8336, test_loss: 0.9917, test_f1: 0.5603
 epoch: 34, train_loss: 0.8209, test_loss: 0.9803, test_f1: 0.5237
 epoch: 35, train_loss: 0.8130, test_loss: 0.9897, test_f1: 0.5241
 epoch: 36, train_loss: 0.8005, test_loss: 0.9852, test_f1: 0.5358
 epoch: 37, train_loss: 0.8055, test_loss: 0.9880, test_f1: 0.5292
 epoch: 38, train_loss: 0.8098, test_loss: 0.9972, test_f1: 0.5206
 epoch: 39, train_loss: 0.7940, test_loss: 0.9900, test_f1: 0.5255
 epoch: 40, train_loss: 0.7861, test_loss: 0.9892, test_f1: 0.5588
 epoch: 41, train_loss: 0.7877, test_loss: 0.9960, test_f1: 0.5547
 epoch: 42, train_loss: 0.7810, test_loss: 0.9977, test_f1: 0.5300
 epoch: 43, train_loss: 0.7854, test_loss: 0.9927, test_f1: 0.5346
 epoch: 44, train_loss: 0.7777, test_loss: 1.0029, test_f1: 0.5414
 epoch: 45, train_loss: 0.7662, test_loss: 0.9906, test_f1: 0.5481
 epoch: 46, train_loss: 0.7663, test_loss: 0.9904, test_f1: 0.5399
 epoch: 47, train_loss: 0.7637, test_loss: 0.9934, test_f1: 0.5479
 epoch: 48, train_loss: 0.7467, test_loss: 1.0014, test_f1: 0.5411
 epoch: 49, train_loss: 0.7459, test_loss: 1.0096, test_f1: 0.5397
 epoch: 50, train_loss: 0.7397, test_loss: 1.0027, test_f1: 0.5360
 epoch: 51, train_loss: 0.7335, test_loss: 0.9959, test_f1: 0.5563
 epoch: 52, train_loss: 0.7328, test_loss: 0.9953, test_f1: 0.5516
 epoch: 53, train_loss: 0.7312, test_loss: 1.0055, test_f1: 0.5340
 epoch: 54, train_loss: 0.7251, test_loss: 1.0066, test_f1: 0.5384
 epoch: 55, train_loss: 0.7276, test_loss: 1.0049, test_f1: 0.5382
 epoch: 56, train_loss: 0.7223, test_loss: 1.0063, test_f1: 0.5573
 epoch: 57, train_loss: 0.7183, test_loss: 1.0042, test_f1: 0.5563
 epoch: 58, train_loss: 0.7320, test_loss: 1.0103, test_f1: 0.5661
 epoch: 59, train_loss: 0.7165, test_loss: 1.0227, test_f1: 0.5343
 epoch: 60, train_loss: 0.7156, test_loss: 1.0236, test_f1: 0.5417
 epoch: 61, train_loss: 0.7116, test_loss: 1.0139, test_f1: 0.5567
 epoch: 62, train_loss: 0.7142, test_loss: 1.0011, test_f1: 0.5339
 epoch: 63, train_loss: 0.7122, test_loss: 0.9972, test_f1: 0.5562
 epoch: 64, train_loss: 0.7055, test_loss: 1.0101, test_f1: 0.5460
 epoch: 65, train_loss: 0.7037, test_loss: 1.0053, test_f1: 0.5521
 epoch: 66, train_loss: 0.6975, test_loss: 1.0046, test_f1: 0.5433
 epoch: 67, train_loss: 0.6884, test_loss: 1.0062, test_f1: 0.5539
 epoch: 68, train_loss: 0.6897, test_loss: 1.0093, test_f1: 0.5534
 epoch: 69, train_loss: 0.7006, test_loss: 1.0121, test_f1: 0.5589
 epoch: 70, train_loss: 0.6904, test_loss: 1.0071, test_f1: 0.5458
 epoch: 71, train_loss: 0.6905, test_loss: 1.0112, test_f1: 0.5521
 epoch: 72, train_loss: 0.6825, test_loss: 1.0128, test_f1: 0.5591
 epoch: 73, train_loss: 0.6830, test_loss: 1.0084, test_f1: 0.5678
 epoch: 74, train_loss: 0.6919, test_loss: 1.0130, test_f1: 0.5802
 epoch: 75, train_loss: 0.6827, test_loss: 1.0300, test_f1: 0.5407
 epoch: 76, train_loss: 0.6738, test_loss: 1.0238, test_f1: 0.5428
 epoch: 77, train_loss: 0.6650, test_loss: 1.0143, test_f1: 0.5660
 epoch: 78, train_loss: 0.6761, test_loss: 1.0085, test_f1: 0.5781
 epoch: 79, train_loss: 0.6643, test_loss: 1.0244, test_f1: 0.5798
 epoch: 80, train_loss: 0.6628, test_loss: 1.0292, test_f1: 0.5628
 epoch: 81, train_loss: 0.6628, test_loss: 1.0242, test_f1: 0.5712
 epoch: 82, train_loss: 0.6695, test_loss: 1.0337, test_f1: 0.5545
 epoch: 83, train_loss: 0.6633, test_loss: 1.0276, test_f1: 0.5814
 epoch: 84, train_loss: 0.6623, test_loss: 1.0207, test_f1: 0.5826
 epoch: 85, train_loss: 0.6673, test_loss: 1.0205, test_f1: 0.5829
 epoch: 86, train_loss: 0.6607, test_loss: 1.0188, test_f1: 0.5859
 epoch: 87, train_loss: 0.6606, test_loss: 1.0344, test_f1: 0.5482
 epoch: 88, train_loss: 0.6479, test_loss: 1.0347, test_f1: 0.5720
 epoch: 89, train_loss: 0.6518, test_loss: 1.0313, test_f1: 0.5895
 epoch: 90, train_loss: 0.6525, test_loss: 1.0212, test_f1: 0.5759
 epoch: 91, train_loss: 0.6534, test_loss: 1.0347, test_f1: 0.5725
 epoch: 92, train_loss: 0.6396, test_loss: 1.0579, test_f1: 0.5787
 epoch: 93, train_loss: 0.6431, test_loss: 1.0552, test_f1: 0.5612
 epoch: 94, train_loss: 0.6417, test_loss: 1.0388, test_f1: 0.5712
 epoch: 95, train_loss: 0.6371, test_loss: 1.0237, test_f1: 0.5730
 epoch: 96, train_loss: 0.6402, test_loss: 1.0362, test_f1: 0.5789
 epoch: 97, train_loss: 0.6315, test_loss: 1.0382, test_f1: 0.5802
 epoch: 98, train_loss: 0.6316, test_loss: 1.0456, test_f1: 0.5899
 epoch: 99, train_loss: 0.6236, test_loss: 1.0496, test_f1: 0.5807

Training completed in 326.16 seconds
Best F1: 0.5993 at epoch 90
Mean F1 across iterations: 0.5816  0.0097
========================FINAL RESULTS================================
FEGIN weighted F1: 0.5993  0.0097
python main.py --data ltspice_demos --representation component_pin_net --model FEGIN --layers 3 --hiddens 128 --batch_size 256 --lr 0.0001 --emb_size 128 --epochs 100 --save_appendix component_pin_net_L3_H128_BS256_LR0.0001_E128 --no_val
-----



STDERR:
  File "main.py", line 370, in <module>
    main()
  File "main.py", line 254, in main
    dataset = dataset_class(
  File "/home/philip/projects/ltspice_examples_code_repo/Circuit-Completion-Using-GNNs/component_classification_with_link_prediction_head/evaluation/FEGIN/kernel/circuit_datasets.py", line 15, in __init__
    self.data, self.slices = torch.load(self.processed_paths[0])
  File "/home/philip/.local/lib/python3.8/site-packages/torch/serialization.py", line 1040, in load
    warnings.warn(
  File "/usr/lib/python3.8/warnings.py", line 109, in _showwarnmsg
    sw(msg.message, msg.category, msg.filename, msg.lineno,
  File "main.py", line 47, in warn_with_traceback
    traceback.print_stack(file=log)
/home/philip/projects/ltspice_examples_code_repo/Circuit-Completion-Using-GNNs/component_classification_with_link_prediction_head/evaluation/FEGIN/kernel/circuit_datasets.py:15: FutureWarning: You are using `torch.load` with `weights_only=False` (the current default value), which uses the default pickle module implicitly. It is possible to construct malicious pickle data which will execute arbitrary code during unpickling (See https://github.com/pytorch/pytorch/blob/main/SECURITY.md#untrusted-models for more details). In a future release, the default value for `weights_only` will be flipped to `True`. This limits the functions that could be executed during unpickling. Arbitrary objects will no longer be allowed to be loaded via this mode unless they are explicitly allowlisted by the user via `torch.serialization.add_safe_globals`. We recommend you start setting `weights_only=True` for any use case where you don't have full control of the loaded file. Please open an issue on GitHub for any issues related to this experimental feature.
  self.data, self.slices = torch.load(self.processed_paths[0])
