STDOUT:
Results will be saved in /home/philip/projects/llm_inference_code_repo/Circuit-Completion-Using-GNNs/component_classification_with_link_prediction_head/evaluation/FEGIN/results/model_FEGIN_dataset_ltspice_examples
Command line input: python main.py --data ltspice_examples --representation component_pin --model FEGIN --layers 3 --hiddens 32 --batch_size 128 --lr 0.01 --emb_size 128 --epochs 100 --save_appendix component_pin_L3_H32_BS128_LR0.01_E128 --no_val
 is saved.
-----
ltspice_examples - FEGIN
Using 3 layers, 32 hidden units, h = 2
Loading component_pin representation dataset
ENTERED
Training FEGIN on component_pin representation
Train: 3560, Test: 848
##################ITERATION #0 ****************************************
 epoch: 0, train_loss: 1.2167, test_loss: 1.1995, test_f1: 0.3031
 epoch: 1, train_loss: 1.0552, test_loss: 1.0138, test_f1: 0.4555
 epoch: 2, train_loss: 1.0066, test_loss: 1.0253, test_f1: 0.4745
 epoch: 3, train_loss: 0.9860, test_loss: 0.9513, test_f1: 0.4762
 epoch: 4, train_loss: 0.9350, test_loss: 1.0014, test_f1: 0.3871
 epoch: 5, train_loss: 0.9235, test_loss: 0.9199, test_f1: 0.5072
 epoch: 6, train_loss: 0.9215, test_loss: 0.9779, test_f1: 0.5473
 epoch: 7, train_loss: 0.8747, test_loss: 0.9095, test_f1: 0.5343
 epoch: 8, train_loss: 0.8605, test_loss: 0.8985, test_f1: 0.5648
 epoch: 9, train_loss: 0.8442, test_loss: 0.9534, test_f1: 0.5118
 epoch: 10, train_loss: 0.8186, test_loss: 0.8596, test_f1: 0.6051
 epoch: 11, train_loss: 0.8262, test_loss: 0.8280, test_f1: 0.5758
 epoch: 12, train_loss: 0.8075, test_loss: 0.9919, test_f1: 0.5059
 epoch: 13, train_loss: 0.7918, test_loss: 0.8486, test_f1: 0.5599
 epoch: 14, train_loss: 0.7848, test_loss: 1.0174, test_f1: 0.4948
 epoch: 15, train_loss: 0.7916, test_loss: 0.8560, test_f1: 0.6037
 epoch: 16, train_loss: 0.7705, test_loss: 0.8893, test_f1: 0.5393
 epoch: 17, train_loss: 0.7852, test_loss: 0.8116, test_f1: 0.5642
 epoch: 18, train_loss: 0.7756, test_loss: 0.9437, test_f1: 0.5475
 epoch: 19, train_loss: 0.7534, test_loss: 0.9162, test_f1: 0.5396
 epoch: 20, train_loss: 0.7620, test_loss: 0.8145, test_f1: 0.6208
 epoch: 21, train_loss: 0.7439, test_loss: 0.8420, test_f1: 0.6126
 epoch: 22, train_loss: 0.7465, test_loss: 0.8243, test_f1: 0.6074
 epoch: 23, train_loss: 0.7243, test_loss: 0.8591, test_f1: 0.5780
 epoch: 24, train_loss: 0.7207, test_loss: 0.8184, test_f1: 0.5921
 epoch: 25, train_loss: 0.7069, test_loss: 0.8679, test_f1: 0.6500
 epoch: 26, train_loss: 0.6927, test_loss: 0.8653, test_f1: 0.5582
 epoch: 27, train_loss: 0.7079, test_loss: 1.1534, test_f1: 0.5493
 epoch: 28, train_loss: 0.7101, test_loss: 0.9197, test_f1: 0.5839
 epoch: 29, train_loss: 0.7033, test_loss: 0.9380, test_f1: 0.6000
 epoch: 30, train_loss: 0.6921, test_loss: 0.9727, test_f1: 0.5664
 epoch: 31, train_loss: 0.6720, test_loss: 0.9706, test_f1: 0.6135
 epoch: 32, train_loss: 0.6690, test_loss: 0.9250, test_f1: 0.5896
 epoch: 33, train_loss: 0.6554, test_loss: 0.8949, test_f1: 0.6161
 epoch: 34, train_loss: 0.6768, test_loss: 0.8832, test_f1: 0.5994
 epoch: 35, train_loss: 0.6761, test_loss: 0.8461, test_f1: 0.5785
 epoch: 36, train_loss: 0.6815, test_loss: 0.9175, test_f1: 0.5382
 epoch: 37, train_loss: 0.7159, test_loss: 0.9249, test_f1: 0.5683
 epoch: 38, train_loss: 0.6731, test_loss: 1.0049, test_f1: 0.5837
 epoch: 39, train_loss: 0.6626, test_loss: 0.8736, test_f1: 0.6199
 epoch: 40, train_loss: 0.6693, test_loss: 0.8966, test_f1: 0.5782
 epoch: 41, train_loss: 0.6551, test_loss: 0.8181, test_f1: 0.6363
 epoch: 42, train_loss: 0.6455, test_loss: 0.9956, test_f1: 0.5753
 epoch: 43, train_loss: 0.6353, test_loss: 0.9913, test_f1: 0.6175
 epoch: 44, train_loss: 0.6511, test_loss: 0.9729, test_f1: 0.5672
 epoch: 45, train_loss: 0.6446, test_loss: 0.9287, test_f1: 0.5839
 epoch: 46, train_loss: 0.6517, test_loss: 0.8834, test_f1: 0.6115
 epoch: 47, train_loss: 0.6470, test_loss: 0.9246, test_f1: 0.6278
 epoch: 48, train_loss: 0.6149, test_loss: 0.9813, test_f1: 0.6022
 epoch: 49, train_loss: 0.6244, test_loss: 0.8574, test_f1: 0.6315
 epoch: 50, train_loss: 0.5964, test_loss: 0.8861, test_f1: 0.6353
 epoch: 51, train_loss: 0.5912, test_loss: 0.9827, test_f1: 0.6271
 epoch: 52, train_loss: 0.5624, test_loss: 0.9127, test_f1: 0.6455
 epoch: 53, train_loss: 0.5355, test_loss: 0.9988, test_f1: 0.6336
 epoch: 54, train_loss: 0.5469, test_loss: 0.8920, test_f1: 0.6473
 epoch: 55, train_loss: 0.5279, test_loss: 0.9804, test_f1: 0.6307
 epoch: 56, train_loss: 0.5394, test_loss: 0.9537, test_f1: 0.6332
 epoch: 57, train_loss: 0.5273, test_loss: 1.0545, test_f1: 0.6391
 epoch: 58, train_loss: 0.5212, test_loss: 0.9229, test_f1: 0.6531
 epoch: 59, train_loss: 0.5265, test_loss: 1.0183, test_f1: 0.6382
 epoch: 60, train_loss: 0.5281, test_loss: 0.9455, test_f1: 0.6457
 epoch: 61, train_loss: 0.5261, test_loss: 1.0564, test_f1: 0.6234
 epoch: 62, train_loss: 0.5057, test_loss: 1.1077, test_f1: 0.6198
 epoch: 63, train_loss: 0.5064, test_loss: 0.9861, test_f1: 0.6292
 epoch: 64, train_loss: 0.5164, test_loss: 0.9895, test_f1: 0.6552
 epoch: 65, train_loss: 0.5265, test_loss: 1.0948, test_f1: 0.6361
 epoch: 66, train_loss: 0.5035, test_loss: 1.0822, test_f1: 0.6384
 epoch: 67, train_loss: 0.5039, test_loss: 1.1132, test_f1: 0.6458
 epoch: 68, train_loss: 0.5000, test_loss: 1.0507, test_f1: 0.6509
 epoch: 69, train_loss: 0.4861, test_loss: 1.1079, test_f1: 0.6589
 epoch: 70, train_loss: 0.5190, test_loss: 1.0702, test_f1: 0.6454
 epoch: 71, train_loss: 0.4886, test_loss: 1.1929, test_f1: 0.6168
 epoch: 72, train_loss: 0.4844, test_loss: 1.2258, test_f1: 0.6521
 epoch: 73, train_loss: 0.4762, test_loss: 1.2407, test_f1: 0.6256
 epoch: 74, train_loss: 0.4962, test_loss: 1.0707, test_f1: 0.6154
 epoch: 75, train_loss: 0.4795, test_loss: 1.0847, test_f1: 0.6467
 epoch: 76, train_loss: 0.4767, test_loss: 1.2482, test_f1: 0.6470
 epoch: 77, train_loss: 0.4802, test_loss: 1.2230, test_f1: 0.6250
 epoch: 78, train_loss: 0.4980, test_loss: 1.2336, test_f1: 0.6248
 epoch: 79, train_loss: 0.4939, test_loss: 1.1556, test_f1: 0.6159
 epoch: 80, train_loss: 0.4825, test_loss: 1.1328, test_f1: 0.6161
 epoch: 81, train_loss: 0.4731, test_loss: 1.1625, test_f1: 0.6291
 epoch: 82, train_loss: 0.4725, test_loss: 1.1042, test_f1: 0.6163
 epoch: 83, train_loss: 0.4517, test_loss: 1.1304, test_f1: 0.6284
 epoch: 84, train_loss: 0.4645, test_loss: 1.0919, test_f1: 0.6001
 epoch: 85, train_loss: 0.4617, test_loss: 1.2786, test_f1: 0.5978
 epoch: 86, train_loss: 0.4584, test_loss: 1.1155, test_f1: 0.6368
 epoch: 87, train_loss: 0.4709, test_loss: 1.0855, test_f1: 0.6441
 epoch: 88, train_loss: 0.4248, test_loss: 1.3125, test_f1: 0.6113
 epoch: 89, train_loss: 0.4538, test_loss: 1.1784, test_f1: 0.6536
 epoch: 90, train_loss: 0.4431, test_loss: 1.0875, test_f1: 0.6003
 epoch: 91, train_loss: 0.4463, test_loss: 1.2132, test_f1: 0.6331
 epoch: 92, train_loss: 0.4522, test_loss: 1.0862, test_f1: 0.6268
 epoch: 93, train_loss: 0.4320, test_loss: 1.0807, test_f1: 0.6508
 epoch: 94, train_loss: 0.4370, test_loss: 1.2069, test_f1: 0.6437
 epoch: 95, train_loss: 0.4212, test_loss: 1.2230, test_f1: 0.6343
 epoch: 96, train_loss: 0.4333, test_loss: 1.2663, test_f1: 0.6558
 epoch: 97, train_loss: 0.4216, test_loss: 1.1449, test_f1: 0.6276
 epoch: 98, train_loss: 0.4192, test_loss: 1.3915, test_f1: 0.6279
 epoch: 99, train_loss: 0.4180, test_loss: 1.0476, test_f1: 0.6329
##################ITERATION #1 ****************************************
 epoch: 0, train_loss: 1.1166, test_loss: 1.1335, test_f1: 0.3517
 epoch: 1, train_loss: 1.0012, test_loss: 1.0356, test_f1: 0.4509
 epoch: 2, train_loss: 0.9560, test_loss: 0.9721, test_f1: 0.4407
 epoch: 3, train_loss: 0.9109, test_loss: 1.0131, test_f1: 0.5101
 epoch: 4, train_loss: 0.9019, test_loss: 1.0360, test_f1: 0.4964
 epoch: 5, train_loss: 0.9179, test_loss: 0.9401, test_f1: 0.5286
 epoch: 6, train_loss: 0.8791, test_loss: 1.0030, test_f1: 0.4762
 epoch: 7, train_loss: 0.8472, test_loss: 0.8986, test_f1: 0.5425
 epoch: 8, train_loss: 0.8343, test_loss: 0.9619, test_f1: 0.5248
 epoch: 9, train_loss: 0.8181, test_loss: 0.9595, test_f1: 0.5288
 epoch: 10, train_loss: 0.8285, test_loss: 0.9120, test_f1: 0.5342
 epoch: 11, train_loss: 0.8207, test_loss: 0.9912, test_f1: 0.5516
 epoch: 12, train_loss: 0.8063, test_loss: 0.9465, test_f1: 0.5151
 epoch: 13, train_loss: 0.7930, test_loss: 0.9379, test_f1: 0.5230
 epoch: 14, train_loss: 0.7711, test_loss: 0.8995, test_f1: 0.5435
 epoch: 15, train_loss: 0.7807, test_loss: 1.2586, test_f1: 0.4292
 epoch: 16, train_loss: 0.7779, test_loss: 0.9512, test_f1: 0.5473
 epoch: 17, train_loss: 0.7532, test_loss: 0.8800, test_f1: 0.5472
 epoch: 18, train_loss: 0.7838, test_loss: 0.8764, test_f1: 0.5356
 epoch: 19, train_loss: 0.7638, test_loss: 0.9538, test_f1: 0.4936
 epoch: 20, train_loss: 0.7549, test_loss: 0.9366, test_f1: 0.5105
 epoch: 21, train_loss: 0.7317, test_loss: 0.9235, test_f1: 0.5387
 epoch: 22, train_loss: 0.7609, test_loss: 0.8471, test_f1: 0.5368
 epoch: 23, train_loss: 0.7298, test_loss: 0.9669, test_f1: 0.5200
 epoch: 24, train_loss: 0.7394, test_loss: 0.9251, test_f1: 0.5419
 epoch: 25, train_loss: 0.7233, test_loss: 0.9530, test_f1: 0.5745
 epoch: 26, train_loss: 0.7112, test_loss: 0.8990, test_f1: 0.5350
 epoch: 27, train_loss: 0.7338, test_loss: 0.8306, test_f1: 0.5801
 epoch: 28, train_loss: 0.7228, test_loss: 0.9190, test_f1: 0.5853
 epoch: 29, train_loss: 0.6958, test_loss: 1.2153, test_f1: 0.4815
 epoch: 30, train_loss: 0.7031, test_loss: 0.8367, test_f1: 0.5820
 epoch: 31, train_loss: 0.6997, test_loss: 1.0377, test_f1: 0.5402
 epoch: 32, train_loss: 0.6917, test_loss: 1.0407, test_f1: 0.4945
 epoch: 33, train_loss: 0.6928, test_loss: 0.8033, test_f1: 0.5714
 epoch: 34, train_loss: 0.6836, test_loss: 0.8597, test_f1: 0.5158
 epoch: 35, train_loss: 0.6835, test_loss: 0.9059, test_f1: 0.5542
 epoch: 36, train_loss: 0.6734, test_loss: 0.8566, test_f1: 0.5829
 epoch: 37, train_loss: 0.6588, test_loss: 1.1122, test_f1: 0.5214
 epoch: 38, train_loss: 0.6736, test_loss: 0.8705, test_f1: 0.5905
 epoch: 39, train_loss: 0.6688, test_loss: 0.9919, test_f1: 0.5209
 epoch: 40, train_loss: 0.6836, test_loss: 0.8136, test_f1: 0.5793
 epoch: 41, train_loss: 0.6645, test_loss: 0.8616, test_f1: 0.5860
 epoch: 42, train_loss: 0.6581, test_loss: 0.9499, test_f1: 0.5533
 epoch: 43, train_loss: 0.6445, test_loss: 0.9074, test_f1: 0.5932
 epoch: 44, train_loss: 0.6675, test_loss: 0.9293, test_f1: 0.6049
 epoch: 45, train_loss: 0.6493, test_loss: 0.8621, test_f1: 0.6230
 epoch: 46, train_loss: 0.6442, test_loss: 0.9297, test_f1: 0.6021
 epoch: 47, train_loss: 0.6496, test_loss: 0.8146, test_f1: 0.6152
 epoch: 48, train_loss: 0.6497, test_loss: 1.0200, test_f1: 0.5537
 epoch: 49, train_loss: 0.6533, test_loss: 0.8161, test_f1: 0.6078
 epoch: 50, train_loss: 0.6329, test_loss: 0.9567, test_f1: 0.5800
 epoch: 51, train_loss: 0.5856, test_loss: 0.7978, test_f1: 0.6036
 epoch: 52, train_loss: 0.5894, test_loss: 0.9501, test_f1: 0.5891
 epoch: 53, train_loss: 0.5816, test_loss: 0.9626, test_f1: 0.5511
 epoch: 54, train_loss: 0.5567, test_loss: 0.9767, test_f1: 0.6110
 epoch: 55, train_loss: 0.5720, test_loss: 1.0168, test_f1: 0.5768
 epoch: 56, train_loss: 0.5604, test_loss: 0.8948, test_f1: 0.5908
 epoch: 57, train_loss: 0.5735, test_loss: 0.8295, test_f1: 0.6271
 epoch: 58, train_loss: 0.5538, test_loss: 0.9455, test_f1: 0.6107
 epoch: 59, train_loss: 0.5498, test_loss: 0.8460, test_f1: 0.6323
 epoch: 60, train_loss: 0.5500, test_loss: 0.8662, test_f1: 0.6416
 epoch: 61, train_loss: 0.5559, test_loss: 0.8499, test_f1: 0.6415
 epoch: 62, train_loss: 0.5417, test_loss: 0.9937, test_f1: 0.6106
 epoch: 63, train_loss: 0.5403, test_loss: 0.8444, test_f1: 0.6273
 epoch: 64, train_loss: 0.5459, test_loss: 0.9898, test_f1: 0.5765
 epoch: 65, train_loss: 0.5536, test_loss: 0.8380, test_f1: 0.6179
 epoch: 66, train_loss: 0.5327, test_loss: 0.8878, test_f1: 0.6039
 epoch: 67, train_loss: 0.5329, test_loss: 1.0265, test_f1: 0.5895
 epoch: 68, train_loss: 0.5511, test_loss: 0.9302, test_f1: 0.6059
 epoch: 69, train_loss: 0.5275, test_loss: 0.8527, test_f1: 0.6272
 epoch: 70, train_loss: 0.5501, test_loss: 1.0515, test_f1: 0.6025
 epoch: 71, train_loss: 0.5617, test_loss: 0.9859, test_f1: 0.6159
 epoch: 72, train_loss: 0.5148, test_loss: 0.8898, test_f1: 0.6299
 epoch: 73, train_loss: 0.5198, test_loss: 0.8686, test_f1: 0.6464
 epoch: 74, train_loss: 0.5214, test_loss: 1.0304, test_f1: 0.6011
 epoch: 75, train_loss: 0.5182, test_loss: 0.9848, test_f1: 0.5790
 epoch: 76, train_loss: 0.4981, test_loss: 0.8786, test_f1: 0.6318
 epoch: 77, train_loss: 0.5097, test_loss: 1.0103, test_f1: 0.5948
 epoch: 78, train_loss: 0.5043, test_loss: 0.8898, test_f1: 0.6258
 epoch: 79, train_loss: 0.5120, test_loss: 0.8773, test_f1: 0.6364
 epoch: 80, train_loss: 0.5066, test_loss: 0.9860, test_f1: 0.6156
 epoch: 81, train_loss: 0.4907, test_loss: 1.0436, test_f1: 0.6111
 epoch: 82, train_loss: 0.5125, test_loss: 0.9199, test_f1: 0.5854
 epoch: 83, train_loss: 0.4987, test_loss: 1.0790, test_f1: 0.5743
 epoch: 84, train_loss: 0.5167, test_loss: 1.0279, test_f1: 0.6125
 epoch: 85, train_loss: 0.4920, test_loss: 0.9304, test_f1: 0.6332
 epoch: 86, train_loss: 0.5011, test_loss: 0.9910, test_f1: 0.5928
 epoch: 87, train_loss: 0.4876, test_loss: 0.9917, test_f1: 0.6285
 epoch: 88, train_loss: 0.5021, test_loss: 0.9720, test_f1: 0.6203
 epoch: 89, train_loss: 0.4924, test_loss: 0.8583, test_f1: 0.6549
 epoch: 90, train_loss: 0.5032, test_loss: 0.9920, test_f1: 0.6233
 epoch: 91, train_loss: 0.4868, test_loss: 0.8795, test_f1: 0.6293
 epoch: 92, train_loss: 0.4859, test_loss: 0.9651, test_f1: 0.6326
 epoch: 93, train_loss: 0.4861, test_loss: 0.9583, test_f1: 0.6046
 epoch: 94, train_loss: 0.5010, test_loss: 0.9955, test_f1: 0.6171
 epoch: 95, train_loss: 0.4795, test_loss: 1.0357, test_f1: 0.5792
 epoch: 96, train_loss: 0.4997, test_loss: 0.9359, test_f1: 0.6169
 epoch: 97, train_loss: 0.4680, test_loss: 0.9733, test_f1: 0.6185
 epoch: 98, train_loss: 0.4742, test_loss: 1.1098, test_f1: 0.6137
 epoch: 99, train_loss: 0.5014, test_loss: 1.0061, test_f1: 0.6162
##################ITERATION #2 ****************************************
 epoch: 0, train_loss: 1.1494, test_loss: 1.0795, test_f1: 0.3738
 epoch: 1, train_loss: 0.9888, test_loss: 0.9695, test_f1: 0.4205
 epoch: 2, train_loss: 0.9509, test_loss: 0.9611, test_f1: 0.4921
 epoch: 3, train_loss: 0.9190, test_loss: 0.9756, test_f1: 0.4928
 epoch: 4, train_loss: 0.9006, test_loss: 0.9526, test_f1: 0.4742
 epoch: 5, train_loss: 0.8833, test_loss: 0.8244, test_f1: 0.5423
 epoch: 6, train_loss: 0.8828, test_loss: 1.0223, test_f1: 0.4649
 epoch: 7, train_loss: 0.8719, test_loss: 0.8771, test_f1: 0.5180
 epoch: 8, train_loss: 0.8352, test_loss: 0.9173, test_f1: 0.4897
 epoch: 9, train_loss: 0.8344, test_loss: 0.8451, test_f1: 0.5715
 epoch: 10, train_loss: 0.8242, test_loss: 0.9140, test_f1: 0.5166
 epoch: 11, train_loss: 0.8136, test_loss: 0.8155, test_f1: 0.5419
 epoch: 12, train_loss: 0.7964, test_loss: 0.9228, test_f1: 0.4867
 epoch: 13, train_loss: 0.7948, test_loss: 0.8660, test_f1: 0.5324
 epoch: 14, train_loss: 0.7981, test_loss: 0.8233, test_f1: 0.5361
 epoch: 15, train_loss: 0.7796, test_loss: 0.9235, test_f1: 0.4788
 epoch: 16, train_loss: 0.7763, test_loss: 0.8366, test_f1: 0.5843
 epoch: 17, train_loss: 0.7723, test_loss: 0.8759, test_f1: 0.5534
 epoch: 18, train_loss: 0.7699, test_loss: 0.8035, test_f1: 0.5637
 epoch: 19, train_loss: 0.7619, test_loss: 1.0785, test_f1: 0.4718
 epoch: 20, train_loss: 0.7514, test_loss: 0.9096, test_f1: 0.5723
 epoch: 21, train_loss: 0.7500, test_loss: 0.7573, test_f1: 0.5644
 epoch: 22, train_loss: 0.7266, test_loss: 0.8181, test_f1: 0.6080
 epoch: 23, train_loss: 0.7283, test_loss: 0.8138, test_f1: 0.5711
 epoch: 24, train_loss: 0.7291, test_loss: 0.8847, test_f1: 0.5864
 epoch: 25, train_loss: 0.7207, test_loss: 0.8378, test_f1: 0.6060
 epoch: 26, train_loss: 0.7431, test_loss: 0.7992, test_f1: 0.5468
 epoch: 27, train_loss: 0.7399, test_loss: 0.8530, test_f1: 0.5645
 epoch: 28, train_loss: 0.7201, test_loss: 0.8765, test_f1: 0.5708
 epoch: 29, train_loss: 0.7072, test_loss: 0.9355, test_f1: 0.5818
 epoch: 30, train_loss: 0.7033, test_loss: 0.8441, test_f1: 0.5860
 epoch: 31, train_loss: 0.6851, test_loss: 0.8205, test_f1: 0.6226
 epoch: 32, train_loss: 0.6883, test_loss: 0.7683, test_f1: 0.6041
 epoch: 33, train_loss: 0.7055, test_loss: 0.9050, test_f1: 0.6298
 epoch: 34, train_loss: 0.6898, test_loss: 0.7829, test_f1: 0.6256
 epoch: 35, train_loss: 0.6670, test_loss: 0.7778, test_f1: 0.6296
 epoch: 36, train_loss: 0.6534, test_loss: 0.7964, test_f1: 0.6663
 epoch: 37, train_loss: 0.6801, test_loss: 0.7566, test_f1: 0.6126
 epoch: 38, train_loss: 0.6611, test_loss: 0.7834, test_f1: 0.6156
 epoch: 39, train_loss: 0.6616, test_loss: 0.8007, test_f1: 0.6057
 epoch: 40, train_loss: 0.6714, test_loss: 0.8046, test_f1: 0.6573
 epoch: 41, train_loss: 0.6549, test_loss: 0.8246, test_f1: 0.6485
 epoch: 42, train_loss: 0.6389, test_loss: 0.7803, test_f1: 0.6501
 epoch: 43, train_loss: 0.6608, test_loss: 0.7670, test_f1: 0.6296
 epoch: 44, train_loss: 0.6528, test_loss: 0.7830, test_f1: 0.6607
 epoch: 45, train_loss: 0.6244, test_loss: 0.9026, test_f1: 0.6102
 epoch: 46, train_loss: 0.6366, test_loss: 0.8809, test_f1: 0.6225
 epoch: 47, train_loss: 0.6402, test_loss: 0.7860, test_f1: 0.6759
 epoch: 48, train_loss: 0.6299, test_loss: 0.9267, test_f1: 0.6268
 epoch: 49, train_loss: 0.6449, test_loss: 0.8291, test_f1: 0.6328
 epoch: 50, train_loss: 0.6542, test_loss: 0.9024, test_f1: 0.5741
 epoch: 51, train_loss: 0.6147, test_loss: 0.8210, test_f1: 0.6473
 epoch: 52, train_loss: 0.5593, test_loss: 0.8009, test_f1: 0.6550
 epoch: 53, train_loss: 0.5689, test_loss: 0.8484, test_f1: 0.6582
 epoch: 54, train_loss: 0.5686, test_loss: 0.7331, test_f1: 0.6963
 epoch: 55, train_loss: 0.5631, test_loss: 0.8839, test_f1: 0.6311
 epoch: 56, train_loss: 0.5611, test_loss: 0.8041, test_f1: 0.6729
 epoch: 57, train_loss: 0.5618, test_loss: 0.8129, test_f1: 0.6661
 epoch: 58, train_loss: 0.5648, test_loss: 0.8514, test_f1: 0.6222
 epoch: 59, train_loss: 0.5569, test_loss: 0.8588, test_f1: 0.6460
 epoch: 60, train_loss: 0.5469, test_loss: 0.8327, test_f1: 0.6442
 epoch: 61, train_loss: 0.5494, test_loss: 0.8451, test_f1: 0.6374
 epoch: 62, train_loss: 0.5497, test_loss: 0.8288, test_f1: 0.6681
 epoch: 63, train_loss: 0.5564, test_loss: 0.8551, test_f1: 0.6471
 epoch: 64, train_loss: 0.5398, test_loss: 0.9068, test_f1: 0.6494
 epoch: 65, train_loss: 0.5405, test_loss: 0.8204, test_f1: 0.6674
 epoch: 66, train_loss: 0.5171, test_loss: 0.8305, test_f1: 0.6709
 epoch: 67, train_loss: 0.5417, test_loss: 0.8023, test_f1: 0.6695
 epoch: 68, train_loss: 0.5340, test_loss: 0.9365, test_f1: 0.6448
 epoch: 69, train_loss: 0.5421, test_loss: 0.8488, test_f1: 0.6806
 epoch: 70, train_loss: 0.5248, test_loss: 0.9642, test_f1: 0.6454
 epoch: 71, train_loss: 0.5208, test_loss: 0.8879, test_f1: 0.6573
 epoch: 72, train_loss: 0.5398, test_loss: 0.8817, test_f1: 0.6747
 epoch: 73, train_loss: 0.5128, test_loss: 0.9363, test_f1: 0.6617
 epoch: 74, train_loss: 0.5375, test_loss: 0.8444, test_f1: 0.6688
 epoch: 75, train_loss: 0.5277, test_loss: 0.8591, test_f1: 0.6760
 epoch: 76, train_loss: 0.5418, test_loss: 0.8253, test_f1: 0.6499
 epoch: 77, train_loss: 0.5109, test_loss: 1.0074, test_f1: 0.6519
 epoch: 78, train_loss: 0.5251, test_loss: 0.8855, test_f1: 0.6610
 epoch: 79, train_loss: 0.5369, test_loss: 0.8305, test_f1: 0.6577
 epoch: 80, train_loss: 0.5237, test_loss: 0.9624, test_f1: 0.6509
 epoch: 81, train_loss: 0.5297, test_loss: 0.8723, test_f1: 0.6771
 epoch: 82, train_loss: 0.5113, test_loss: 0.9599, test_f1: 0.6644
 epoch: 83, train_loss: 0.5136, test_loss: 0.8400, test_f1: 0.6615
 epoch: 84, train_loss: 0.5139, test_loss: 0.8914, test_f1: 0.6751
 epoch: 85, train_loss: 0.5006, test_loss: 0.9156, test_f1: 0.6644
 epoch: 86, train_loss: 0.5030, test_loss: 1.0516, test_f1: 0.6353
 epoch: 87, train_loss: 0.5052, test_loss: 0.9772, test_f1: 0.6554
 epoch: 88, train_loss: 0.4952, test_loss: 0.9174, test_f1: 0.6670
 epoch: 89, train_loss: 0.4855, test_loss: 0.9436, test_f1: 0.6784
 epoch: 90, train_loss: 0.4893, test_loss: 0.9871, test_f1: 0.6557
 epoch: 91, train_loss: 0.4738, test_loss: 0.9171, test_f1: 0.6882
 epoch: 92, train_loss: 0.4790, test_loss: 1.1014, test_f1: 0.6439
 epoch: 93, train_loss: 0.5000, test_loss: 0.9030, test_f1: 0.6773
 epoch: 94, train_loss: 0.4926, test_loss: 1.0149, test_f1: 0.6588
 epoch: 95, train_loss: 0.4877, test_loss: 0.8990, test_f1: 0.6589
 epoch: 96, train_loss: 0.4803, test_loss: 1.1884, test_f1: 0.6240
 epoch: 97, train_loss: 0.4847, test_loss: 0.9382, test_f1: 0.6440
 epoch: 98, train_loss: 0.4785, test_loss: 0.9407, test_f1: 0.6651
 epoch: 99, train_loss: 0.4746, test_loss: 0.9744, test_f1: 0.6522
##################ITERATION #3 ****************************************
 epoch: 0, train_loss: 1.1967, test_loss: 1.1896, test_f1: 0.3635
 epoch: 1, train_loss: 1.0089, test_loss: 1.0520, test_f1: 0.4548
 epoch: 2, train_loss: 0.9686, test_loss: 0.9644, test_f1: 0.4840
 epoch: 3, train_loss: 0.9418, test_loss: 0.9685, test_f1: 0.4764
 epoch: 4, train_loss: 0.9255, test_loss: 0.9849, test_f1: 0.4470
 epoch: 5, train_loss: 0.9018, test_loss: 1.2252, test_f1: 0.4291
 epoch: 6, train_loss: 0.8894, test_loss: 1.0200, test_f1: 0.5086
 epoch: 7, train_loss: 0.8734, test_loss: 0.9924, test_f1: 0.5470
 epoch: 8, train_loss: 0.8675, test_loss: 0.9283, test_f1: 0.4967
 epoch: 9, train_loss: 0.8408, test_loss: 0.9417, test_f1: 0.5702
 epoch: 10, train_loss: 0.8488, test_loss: 1.1199, test_f1: 0.4775
 epoch: 11, train_loss: 0.8462, test_loss: 0.9891, test_f1: 0.5313
 epoch: 12, train_loss: 0.8215, test_loss: 0.9068, test_f1: 0.5832
 epoch: 13, train_loss: 0.7970, test_loss: 0.9299, test_f1: 0.5720
 epoch: 14, train_loss: 0.8144, test_loss: 1.0348, test_f1: 0.4720
 epoch: 15, train_loss: 0.7989, test_loss: 1.0005, test_f1: 0.5463
 epoch: 16, train_loss: 0.7952, test_loss: 0.8768, test_f1: 0.5449
 epoch: 17, train_loss: 0.7935, test_loss: 1.0499, test_f1: 0.4918
 epoch: 18, train_loss: 0.7814, test_loss: 0.8997, test_f1: 0.5345
 epoch: 19, train_loss: 0.7782, test_loss: 0.9435, test_f1: 0.5350
 epoch: 20, train_loss: 0.7474, test_loss: 1.0107, test_f1: 0.5235
 epoch: 21, train_loss: 0.7304, test_loss: 1.0220, test_f1: 0.5837
 epoch: 22, train_loss: 0.7531, test_loss: 0.9266, test_f1: 0.5624
 epoch: 23, train_loss: 0.7486, test_loss: 0.8692, test_f1: 0.6026
 epoch: 24, train_loss: 0.7293, test_loss: 1.0154, test_f1: 0.5795
 epoch: 25, train_loss: 0.7322, test_loss: 0.9747, test_f1: 0.5920
 epoch: 26, train_loss: 0.7144, test_loss: 0.9788, test_f1: 0.5799
 epoch: 27, train_loss: 0.7202, test_loss: 0.9247, test_f1: 0.6023
 epoch: 28, train_loss: 0.7025, test_loss: 0.8193, test_f1: 0.6334
 epoch: 29, train_loss: 0.6875, test_loss: 0.7858, test_f1: 0.6488
 epoch: 30, train_loss: 0.7104, test_loss: 1.0432, test_f1: 0.5973
 epoch: 31, train_loss: 0.7003, test_loss: 0.9110, test_f1: 0.6387
 epoch: 32, train_loss: 0.7215, test_loss: 0.9400, test_f1: 0.6343
 epoch: 33, train_loss: 0.7014, test_loss: 0.9087, test_f1: 0.6285
 epoch: 34, train_loss: 0.7166, test_loss: 1.0265, test_f1: 0.5615
 epoch: 35, train_loss: 0.6868, test_loss: 0.9584, test_f1: 0.6120
 epoch: 36, train_loss: 0.6952, test_loss: 0.9516, test_f1: 0.5621
 epoch: 37, train_loss: 0.6857, test_loss: 0.8929, test_f1: 0.6506
 epoch: 38, train_loss: 0.6831, test_loss: 1.0519, test_f1: 0.5501
 epoch: 39, train_loss: 0.6834, test_loss: 0.9625, test_f1: 0.6253
 epoch: 40, train_loss: 0.6885, test_loss: 1.0140, test_f1: 0.5333
 epoch: 41, train_loss: 0.6844, test_loss: 0.9063, test_f1: 0.6065
 epoch: 42, train_loss: 0.6717, test_loss: 1.0238, test_f1: 0.6102
 epoch: 43, train_loss: 0.6532, test_loss: 0.8880, test_f1: 0.6554
 epoch: 44, train_loss: 0.6649, test_loss: 0.8979, test_f1: 0.5940
 epoch: 45, train_loss: 0.6616, test_loss: 0.9249, test_f1: 0.6111
 epoch: 46, train_loss: 0.6720, test_loss: 0.9054, test_f1: 0.6745
 epoch: 47, train_loss: 0.6517, test_loss: 0.8317, test_f1: 0.6385
 epoch: 48, train_loss: 0.6514, test_loss: 0.8826, test_f1: 0.6227
 epoch: 49, train_loss: 0.6356, test_loss: 0.9404, test_f1: 0.5940
 epoch: 50, train_loss: 0.6624, test_loss: 0.9481, test_f1: 0.6207
 epoch: 51, train_loss: 0.6168, test_loss: 0.8986, test_f1: 0.6281
 epoch: 52, train_loss: 0.5956, test_loss: 0.9183, test_f1: 0.6618
 epoch: 53, train_loss: 0.5837, test_loss: 0.9760, test_f1: 0.6299
 epoch: 54, train_loss: 0.5827, test_loss: 0.9339, test_f1: 0.6495
 epoch: 55, train_loss: 0.5850, test_loss: 0.8884, test_f1: 0.6671
 epoch: 56, train_loss: 0.5561, test_loss: 0.8975, test_f1: 0.6534
 epoch: 57, train_loss: 0.5672, test_loss: 1.0510, test_f1: 0.6371
 epoch: 58, train_loss: 0.5816, test_loss: 0.9801, test_f1: 0.6476
 epoch: 59, train_loss: 0.5466, test_loss: 0.9108, test_f1: 0.6389
 epoch: 60, train_loss: 0.5686, test_loss: 0.8971, test_f1: 0.6796
 epoch: 61, train_loss: 0.5767, test_loss: 0.9993, test_f1: 0.6278
 epoch: 62, train_loss: 0.5564, test_loss: 1.0361, test_f1: 0.6270
 epoch: 63, train_loss: 0.5605, test_loss: 0.9849, test_f1: 0.6219
 epoch: 64, train_loss: 0.5663, test_loss: 1.0144, test_f1: 0.6019
 epoch: 65, train_loss: 0.5591, test_loss: 0.9459, test_f1: 0.6353
 epoch: 66, train_loss: 0.5524, test_loss: 0.9517, test_f1: 0.6643
 epoch: 67, train_loss: 0.5547, test_loss: 0.9682, test_f1: 0.6400
 epoch: 68, train_loss: 0.5448, test_loss: 1.0451, test_f1: 0.6063
 epoch: 69, train_loss: 0.5435, test_loss: 0.9892, test_f1: 0.6228
 epoch: 70, train_loss: 0.5454, test_loss: 1.0356, test_f1: 0.6403
 epoch: 71, train_loss: 0.5382, test_loss: 0.9857, test_f1: 0.6194
 epoch: 72, train_loss: 0.5366, test_loss: 0.9582, test_f1: 0.6490
 epoch: 73, train_loss: 0.5169, test_loss: 1.0287, test_f1: 0.6395
 epoch: 74, train_loss: 0.5395, test_loss: 1.1033, test_f1: 0.6172
 epoch: 75, train_loss: 0.5157, test_loss: 0.9102, test_f1: 0.6624
 epoch: 76, train_loss: 0.5324, test_loss: 0.8878, test_f1: 0.6388
 epoch: 77, train_loss: 0.5147, test_loss: 1.0129, test_f1: 0.6407
 epoch: 78, train_loss: 0.5372, test_loss: 1.0161, test_f1: 0.6467
 epoch: 79, train_loss: 0.5180, test_loss: 0.9879, test_f1: 0.6369
 epoch: 80, train_loss: 0.5362, test_loss: 1.0496, test_f1: 0.6251
 epoch: 81, train_loss: 0.5378, test_loss: 1.0274, test_f1: 0.6284
 epoch: 82, train_loss: 0.4932, test_loss: 1.0249, test_f1: 0.6548
 epoch: 83, train_loss: 0.5196, test_loss: 0.9559, test_f1: 0.6589
 epoch: 84, train_loss: 0.5093, test_loss: 0.9945, test_f1: 0.6449
 epoch: 85, train_loss: 0.5126, test_loss: 1.0384, test_f1: 0.6562
 epoch: 86, train_loss: 0.5003, test_loss: 1.0211, test_f1: 0.6374
 epoch: 87, train_loss: 0.5184, test_loss: 1.0292, test_f1: 0.6426
 epoch: 88, train_loss: 0.4990, test_loss: 0.9617, test_f1: 0.6524
 epoch: 89, train_loss: 0.5066, test_loss: 1.1875, test_f1: 0.6290
 epoch: 90, train_loss: 0.5250, test_loss: 1.0009, test_f1: 0.6513
 epoch: 91, train_loss: 0.5150, test_loss: 1.0620, test_f1: 0.6441
 epoch: 92, train_loss: 0.5061, test_loss: 0.9999, test_f1: 0.6451
 epoch: 93, train_loss: 0.5068, test_loss: 1.0903, test_f1: 0.6304
 epoch: 94, train_loss: 0.4990, test_loss: 1.0675, test_f1: 0.6485
 epoch: 95, train_loss: 0.5119, test_loss: 1.1353, test_f1: 0.6157
 epoch: 96, train_loss: 0.4892, test_loss: 1.0120, test_f1: 0.6626
 epoch: 97, train_loss: 0.4917, test_loss: 1.0869, test_f1: 0.6469
 epoch: 98, train_loss: 0.5073, test_loss: 1.0666, test_f1: 0.6424
 epoch: 99, train_loss: 0.4903, test_loss: 1.0943, test_f1: 0.6556
##################ITERATION #4 ****************************************
 epoch: 0, train_loss: 1.1708, test_loss: 1.2420, test_f1: 0.3321
 epoch: 1, train_loss: 0.9919, test_loss: 0.9659, test_f1: 0.4938
 epoch: 2, train_loss: 0.9526, test_loss: 0.9810, test_f1: 0.4600
 epoch: 3, train_loss: 0.9181, test_loss: 1.1131, test_f1: 0.4146
 epoch: 4, train_loss: 0.8904, test_loss: 0.9786, test_f1: 0.5382
 epoch: 5, train_loss: 0.8884, test_loss: 1.0016, test_f1: 0.4928
 epoch: 6, train_loss: 0.8674, test_loss: 0.8888, test_f1: 0.5755
 epoch: 7, train_loss: 0.8724, test_loss: 0.9718, test_f1: 0.5069
 epoch: 8, train_loss: 0.8565, test_loss: 1.1508, test_f1: 0.4896
 epoch: 9, train_loss: 0.8310, test_loss: 0.8483, test_f1: 0.5510
 epoch: 10, train_loss: 0.8193, test_loss: 0.9000, test_f1: 0.5601
 epoch: 11, train_loss: 0.8320, test_loss: 0.9928, test_f1: 0.4964
 epoch: 12, train_loss: 0.8371, test_loss: 1.1388, test_f1: 0.4269
 epoch: 13, train_loss: 0.8101, test_loss: 0.9019, test_f1: 0.5249
 epoch: 14, train_loss: 0.7947, test_loss: 0.8991, test_f1: 0.5693
 epoch: 15, train_loss: 0.7937, test_loss: 1.2067, test_f1: 0.3957
 epoch: 16, train_loss: 0.7977, test_loss: 0.9197, test_f1: 0.5675
 epoch: 17, train_loss: 0.7837, test_loss: 0.9540, test_f1: 0.5554
 epoch: 18, train_loss: 0.7922, test_loss: 0.8382, test_f1: 0.5710
 epoch: 19, train_loss: 0.7889, test_loss: 0.8066, test_f1: 0.5842
 epoch: 20, train_loss: 0.7669, test_loss: 0.8398, test_f1: 0.5757
 epoch: 21, train_loss: 0.7652, test_loss: 0.7768, test_f1: 0.6227
 epoch: 22, train_loss: 0.7682, test_loss: 1.2088, test_f1: 0.4809
 epoch: 23, train_loss: 0.7585, test_loss: 0.7948, test_f1: 0.5446
 epoch: 24, train_loss: 0.7408, test_loss: 0.9204, test_f1: 0.5588
 epoch: 25, train_loss: 0.7320, test_loss: 0.9722, test_f1: 0.5786
 epoch: 26, train_loss: 0.7384, test_loss: 0.9076, test_f1: 0.6037
 epoch: 27, train_loss: 0.7213, test_loss: 1.5924, test_f1: 0.4870
 epoch: 28, train_loss: 0.7507, test_loss: 0.8670, test_f1: 0.5837
 epoch: 29, train_loss: 0.7099, test_loss: 0.9069, test_f1: 0.5789
 epoch: 30, train_loss: 0.7182, test_loss: 1.0657, test_f1: 0.5313
 epoch: 31, train_loss: 0.7279, test_loss: 0.9124, test_f1: 0.5758
 epoch: 32, train_loss: 0.7044, test_loss: 0.9394, test_f1: 0.5632
 epoch: 33, train_loss: 0.7205, test_loss: 0.9358, test_f1: 0.5762
 epoch: 34, train_loss: 0.7244, test_loss: 0.9205, test_f1: 0.5531
 epoch: 35, train_loss: 0.7068, test_loss: 0.8451, test_f1: 0.5977
 epoch: 36, train_loss: 0.7053, test_loss: 0.8909, test_f1: 0.5600
 epoch: 37, train_loss: 0.7031, test_loss: 0.8220, test_f1: 0.5758
 epoch: 38, train_loss: 0.7025, test_loss: 0.8765, test_f1: 0.5665
 epoch: 39, train_loss: 0.6887, test_loss: 0.9917, test_f1: 0.5680
 epoch: 40, train_loss: 0.6882, test_loss: 0.8262, test_f1: 0.6083
 epoch: 41, train_loss: 0.6786, test_loss: 0.8322, test_f1: 0.6049
 epoch: 42, train_loss: 0.6740, test_loss: 0.8107, test_f1: 0.5995
 epoch: 43, train_loss: 0.6573, test_loss: 0.9374, test_f1: 0.5789
 epoch: 44, train_loss: 0.6582, test_loss: 0.8286, test_f1: 0.6051
 epoch: 45, train_loss: 0.6795, test_loss: 0.9273, test_f1: 0.6002
 epoch: 46, train_loss: 0.6606, test_loss: 1.0039, test_f1: 0.5736
 epoch: 47, train_loss: 0.6421, test_loss: 0.9014, test_f1: 0.6186
 epoch: 48, train_loss: 0.6560, test_loss: 0.8935, test_f1: 0.6108
 epoch: 49, train_loss: 0.6557, test_loss: 0.8041, test_f1: 0.6111
 epoch: 50, train_loss: 0.6593, test_loss: 1.0815, test_f1: 0.5398
 epoch: 51, train_loss: 0.6356, test_loss: 0.8099, test_f1: 0.6375
 epoch: 52, train_loss: 0.6006, test_loss: 0.8760, test_f1: 0.6068
 epoch: 53, train_loss: 0.6054, test_loss: 0.8289, test_f1: 0.6318
 epoch: 54, train_loss: 0.5926, test_loss: 0.8029, test_f1: 0.6246
 epoch: 55, train_loss: 0.5917, test_loss: 0.9348, test_f1: 0.5937
 epoch: 56, train_loss: 0.5923, test_loss: 0.7757, test_f1: 0.6215
 epoch: 57, train_loss: 0.5912, test_loss: 0.8767, test_f1: 0.6443
 epoch: 58, train_loss: 0.5743, test_loss: 0.9435, test_f1: 0.5792
 epoch: 59, train_loss: 0.5955, test_loss: 0.8685, test_f1: 0.6406
 epoch: 60, train_loss: 0.6000, test_loss: 0.7863, test_f1: 0.6230
 epoch: 61, train_loss: 0.5977, test_loss: 0.7748, test_f1: 0.6189
 epoch: 62, train_loss: 0.5795, test_loss: 0.8555, test_f1: 0.6240
 epoch: 63, train_loss: 0.5716, test_loss: 0.9544, test_f1: 0.6074
 epoch: 64, train_loss: 0.5702, test_loss: 0.8319, test_f1: 0.6487
 epoch: 65, train_loss: 0.5778, test_loss: 0.8004, test_f1: 0.6192
 epoch: 66, train_loss: 0.5667, test_loss: 0.8515, test_f1: 0.6111
 epoch: 67, train_loss: 0.5671, test_loss: 0.8366, test_f1: 0.6195
 epoch: 68, train_loss: 0.5670, test_loss: 0.8585, test_f1: 0.6146
 epoch: 69, train_loss: 0.5649, test_loss: 0.8381, test_f1: 0.6106
 epoch: 70, train_loss: 0.5605, test_loss: 0.9012, test_f1: 0.5983
 epoch: 71, train_loss: 0.5649, test_loss: 0.8454, test_f1: 0.6429
 epoch: 72, train_loss: 0.5525, test_loss: 1.0780, test_f1: 0.5900
 epoch: 73, train_loss: 0.5545, test_loss: 0.8553, test_f1: 0.6128
 epoch: 74, train_loss: 0.5602, test_loss: 0.7999, test_f1: 0.6314
 epoch: 75, train_loss: 0.5417, test_loss: 0.8288, test_f1: 0.6242
 epoch: 76, train_loss: 0.5324, test_loss: 0.8547, test_f1: 0.6032
 epoch: 77, train_loss: 0.5612, test_loss: 0.8274, test_f1: 0.6454
 epoch: 78, train_loss: 0.5481, test_loss: 0.9886, test_f1: 0.6202
 epoch: 79, train_loss: 0.5428, test_loss: 0.8971, test_f1: 0.6275
 epoch: 80, train_loss: 0.5467, test_loss: 0.8142, test_f1: 0.6422
 epoch: 81, train_loss: 0.5473, test_loss: 0.9188, test_f1: 0.6089
 epoch: 82, train_loss: 0.5400, test_loss: 0.8050, test_f1: 0.6353
 epoch: 83, train_loss: 0.5464, test_loss: 0.9542, test_f1: 0.5992
 epoch: 84, train_loss: 0.5457, test_loss: 1.0796, test_f1: 0.5943
 epoch: 85, train_loss: 0.5538, test_loss: 0.9916, test_f1: 0.5630
 epoch: 86, train_loss: 0.5358, test_loss: 0.8537, test_f1: 0.6061
 epoch: 87, train_loss: 0.5358, test_loss: 0.9379, test_f1: 0.6307
 epoch: 88, train_loss: 0.5563, test_loss: 0.9510, test_f1: 0.6307
 epoch: 89, train_loss: 0.5283, test_loss: 0.8496, test_f1: 0.6434
 epoch: 90, train_loss: 0.5452, test_loss: 0.8522, test_f1: 0.6099
 epoch: 91, train_loss: 0.5197, test_loss: 0.9449, test_f1: 0.6209
 epoch: 92, train_loss: 0.5142, test_loss: 0.8723, test_f1: 0.6264
 epoch: 93, train_loss: 0.5148, test_loss: 0.8290, test_f1: 0.6207
 epoch: 94, train_loss: 0.5305, test_loss: 0.9999, test_f1: 0.5978
 epoch: 95, train_loss: 0.5232, test_loss: 0.9004, test_f1: 0.6247
 epoch: 96, train_loss: 0.5226, test_loss: 1.0095, test_f1: 0.6007
 epoch: 97, train_loss: 0.5179, test_loss: 0.8392, test_f1: 0.6399
 epoch: 98, train_loss: 0.5120, test_loss: 0.9488, test_f1: 0.6028
 epoch: 99, train_loss: 0.5201, test_loss: 0.9578, test_f1: 0.6300
##################ITERATION #5 ****************************************
 epoch: 0, train_loss: 1.1744, test_loss: 1.1407, test_f1: 0.3721
 epoch: 1, train_loss: 0.9905, test_loss: 1.0431, test_f1: 0.4386
 epoch: 2, train_loss: 0.9566, test_loss: 1.0074, test_f1: 0.4952
 epoch: 3, train_loss: 0.9368, test_loss: 0.9868, test_f1: 0.5155
 epoch: 4, train_loss: 0.9406, test_loss: 0.9433, test_f1: 0.4448
 epoch: 5, train_loss: 0.9328, test_loss: 1.2951, test_f1: 0.4685
 epoch: 6, train_loss: 0.9178, test_loss: 1.0120, test_f1: 0.4666
 epoch: 7, train_loss: 0.8837, test_loss: 1.1834, test_f1: 0.4436
 epoch: 8, train_loss: 0.8845, test_loss: 1.1671, test_f1: 0.4820
 epoch: 9, train_loss: 0.8755, test_loss: 1.0502, test_f1: 0.4810
 epoch: 10, train_loss: 0.8878, test_loss: 1.1133, test_f1: 0.3965
 epoch: 11, train_loss: 0.8784, test_loss: 0.9368, test_f1: 0.5326
 epoch: 12, train_loss: 0.8671, test_loss: 0.9628, test_f1: 0.5229
 epoch: 13, train_loss: 0.8552, test_loss: 1.0937, test_f1: 0.4837
 epoch: 14, train_loss: 0.8407, test_loss: 0.9984, test_f1: 0.5068
 epoch: 15, train_loss: 0.8157, test_loss: 0.9243, test_f1: 0.5180
 epoch: 16, train_loss: 0.8126, test_loss: 0.9876, test_f1: 0.4993
 epoch: 17, train_loss: 0.8072, test_loss: 1.0138, test_f1: 0.5517
 epoch: 18, train_loss: 0.8051, test_loss: 1.0298, test_f1: 0.4895
 epoch: 19, train_loss: 0.7915, test_loss: 0.8780, test_f1: 0.6051
 epoch: 20, train_loss: 0.7786, test_loss: 0.8895, test_f1: 0.5478
 epoch: 21, train_loss: 0.7836, test_loss: 0.9462, test_f1: 0.5877
 epoch: 22, train_loss: 0.7868, test_loss: 0.8823, test_f1: 0.5614
 epoch: 23, train_loss: 0.7758, test_loss: 0.8729, test_f1: 0.5641
 epoch: 24, train_loss: 0.7691, test_loss: 0.8639, test_f1: 0.6020
 epoch: 25, train_loss: 0.7600, test_loss: 0.9300, test_f1: 0.5193
 epoch: 26, train_loss: 0.7700, test_loss: 0.9094, test_f1: 0.6317
 epoch: 27, train_loss: 0.7501, test_loss: 0.9703, test_f1: 0.5678
 epoch: 28, train_loss: 0.7340, test_loss: 1.0031, test_f1: 0.5855
 epoch: 29, train_loss: 0.7208, test_loss: 0.8520, test_f1: 0.6071
 epoch: 30, train_loss: 0.7419, test_loss: 0.9906, test_f1: 0.5604
 epoch: 31, train_loss: 0.7444, test_loss: 0.9750, test_f1: 0.5811
 epoch: 32, train_loss: 0.7355, test_loss: 0.9818, test_f1: 0.5479
 epoch: 33, train_loss: 0.7316, test_loss: 1.0933, test_f1: 0.5151
 epoch: 34, train_loss: 0.7292, test_loss: 0.9913, test_f1: 0.5920
 epoch: 35, train_loss: 0.7362, test_loss: 0.8961, test_f1: 0.6074
 epoch: 36, train_loss: 0.7404, test_loss: 1.0443, test_f1: 0.5949
 epoch: 37, train_loss: 0.7259, test_loss: 0.9459, test_f1: 0.6056
 epoch: 38, train_loss: 0.7044, test_loss: 1.2306, test_f1: 0.5557
 epoch: 39, train_loss: 0.7038, test_loss: 0.9628, test_f1: 0.5963
 epoch: 40, train_loss: 0.6716, test_loss: 0.9237, test_f1: 0.6425
 epoch: 41, train_loss: 0.6939, test_loss: 0.9403, test_f1: 0.5820
 epoch: 42, train_loss: 0.6935, test_loss: 0.9010, test_f1: 0.6030
 epoch: 43, train_loss: 0.6594, test_loss: 1.0238, test_f1: 0.5503
 epoch: 44, train_loss: 0.6750, test_loss: 0.9223, test_f1: 0.6233
 epoch: 45, train_loss: 0.6965, test_loss: 0.9316, test_f1: 0.6019
 epoch: 46, train_loss: 0.6872, test_loss: 1.2626, test_f1: 0.5445
 epoch: 47, train_loss: 0.6650, test_loss: 1.1223, test_f1: 0.5886
 epoch: 48, train_loss: 0.7184, test_loss: 0.9686, test_f1: 0.5329
 epoch: 49, train_loss: 0.6930, test_loss: 0.9100, test_f1: 0.5886
 epoch: 50, train_loss: 0.6935, test_loss: 0.9568, test_f1: 0.5689
 epoch: 51, train_loss: 0.6629, test_loss: 0.9308, test_f1: 0.6222
 epoch: 52, train_loss: 0.6326, test_loss: 0.8890, test_f1: 0.6355
 epoch: 53, train_loss: 0.6234, test_loss: 0.8994, test_f1: 0.6534
 epoch: 54, train_loss: 0.6035, test_loss: 0.9519, test_f1: 0.6391
 epoch: 55, train_loss: 0.6205, test_loss: 0.9282, test_f1: 0.6265
 epoch: 56, train_loss: 0.6243, test_loss: 0.9471, test_f1: 0.6428
 epoch: 57, train_loss: 0.5985, test_loss: 0.8786, test_f1: 0.6531
 epoch: 58, train_loss: 0.6007, test_loss: 0.9088, test_f1: 0.6522
 epoch: 59, train_loss: 0.5946, test_loss: 0.9050, test_f1: 0.6149
 epoch: 60, train_loss: 0.5882, test_loss: 0.8970, test_f1: 0.6472
 epoch: 61, train_loss: 0.5824, test_loss: 1.0601, test_f1: 0.5939
 epoch: 62, train_loss: 0.5953, test_loss: 0.9213, test_f1: 0.6475
 epoch: 63, train_loss: 0.5916, test_loss: 0.9226, test_f1: 0.6302
 epoch: 64, train_loss: 0.5786, test_loss: 0.9164, test_f1: 0.6373
 epoch: 65, train_loss: 0.5897, test_loss: 0.9754, test_f1: 0.6031
 epoch: 66, train_loss: 0.5953, test_loss: 0.9689, test_f1: 0.6013
 epoch: 67, train_loss: 0.5870, test_loss: 0.9302, test_f1: 0.6457
 epoch: 68, train_loss: 0.5822, test_loss: 0.9230, test_f1: 0.6109
 epoch: 69, train_loss: 0.5827, test_loss: 0.9144, test_f1: 0.6333
 epoch: 70, train_loss: 0.5827, test_loss: 0.8902, test_f1: 0.6270
 epoch: 71, train_loss: 0.5610, test_loss: 1.1277, test_f1: 0.5632
 epoch: 72, train_loss: 0.5951, test_loss: 0.8930, test_f1: 0.6265
 epoch: 73, train_loss: 0.5712, test_loss: 0.9515, test_f1: 0.6048
 epoch: 74, train_loss: 0.5664, test_loss: 0.9240, test_f1: 0.6381
 epoch: 75, train_loss: 0.5785, test_loss: 0.9798, test_f1: 0.6257
 epoch: 76, train_loss: 0.5637, test_loss: 1.0047, test_f1: 0.6045
 epoch: 77, train_loss: 0.5570, test_loss: 0.9756, test_f1: 0.6269
 epoch: 78, train_loss: 0.5544, test_loss: 0.9265, test_f1: 0.6030
 epoch: 79, train_loss: 0.5694, test_loss: 0.8903, test_f1: 0.6218
 epoch: 80, train_loss: 0.5545, test_loss: 0.9283, test_f1: 0.6459
 epoch: 81, train_loss: 0.5370, test_loss: 0.9793, test_f1: 0.6093
 epoch: 82, train_loss: 0.5553, test_loss: 1.0798, test_f1: 0.5999
 epoch: 83, train_loss: 0.5708, test_loss: 0.9067, test_f1: 0.6220
 epoch: 84, train_loss: 0.5708, test_loss: 0.9755, test_f1: 0.6120
 epoch: 85, train_loss: 0.5459, test_loss: 0.9503, test_f1: 0.5953
 epoch: 86, train_loss: 0.5514, test_loss: 0.9128, test_f1: 0.6559
 epoch: 87, train_loss: 0.5415, test_loss: 0.9961, test_f1: 0.6191
 epoch: 88, train_loss: 0.5420, test_loss: 1.0135, test_f1: 0.6384
 epoch: 89, train_loss: 0.5570, test_loss: 0.9547, test_f1: 0.6239
 epoch: 90, train_loss: 0.5349, test_loss: 1.0413, test_f1: 0.5872
 epoch: 91, train_loss: 0.5164, test_loss: 1.0465, test_f1: 0.5937
 epoch: 92, train_loss: 0.5265, test_loss: 0.9223, test_f1: 0.6435
 epoch: 93, train_loss: 0.5300, test_loss: 1.1060, test_f1: 0.5837
 epoch: 94, train_loss: 0.5336, test_loss: 0.9306, test_f1: 0.6258
 epoch: 95, train_loss: 0.5280, test_loss: 1.0347, test_f1: 0.6078
 epoch: 96, train_loss: 0.5120, test_loss: 1.0198, test_f1: 0.6195
 epoch: 97, train_loss: 0.5229, test_loss: 0.8938, test_f1: 0.6361
 epoch: 98, train_loss: 0.5422, test_loss: 0.9314, test_f1: 0.6414
 epoch: 99, train_loss: 0.5150, test_loss: 0.9346, test_f1: 0.6121
##################ITERATION #6 ****************************************
 epoch: 0, train_loss: 1.1855, test_loss: 1.1701, test_f1: 0.3414
 epoch: 1, train_loss: 1.0085, test_loss: 1.0025, test_f1: 0.4992
 epoch: 2, train_loss: 0.9768, test_loss: 1.2899, test_f1: 0.3883
 epoch: 3, train_loss: 0.9557, test_loss: 0.9926, test_f1: 0.5408
 epoch: 4, train_loss: 0.9298, test_loss: 0.9932, test_f1: 0.5011
 epoch: 5, train_loss: 0.9049, test_loss: 1.0469, test_f1: 0.4925
 epoch: 6, train_loss: 0.9093, test_loss: 0.9196, test_f1: 0.5384
 epoch: 7, train_loss: 0.8641, test_loss: 1.0074, test_f1: 0.5346
 epoch: 8, train_loss: 0.8651, test_loss: 1.1243, test_f1: 0.4454
 epoch: 9, train_loss: 0.8488, test_loss: 0.9103, test_f1: 0.5738
 epoch: 10, train_loss: 0.8218, test_loss: 0.9208, test_f1: 0.5378
 epoch: 11, train_loss: 0.8232, test_loss: 0.9790, test_f1: 0.4660
 epoch: 12, train_loss: 0.8460, test_loss: 0.8530, test_f1: 0.5352
 epoch: 13, train_loss: 0.8226, test_loss: 1.0504, test_f1: 0.5163
 epoch: 14, train_loss: 0.7905, test_loss: 0.9664, test_f1: 0.5165
 epoch: 15, train_loss: 0.7849, test_loss: 0.9226, test_f1: 0.5296
 epoch: 16, train_loss: 0.7914, test_loss: 0.9928, test_f1: 0.5196
 epoch: 17, train_loss: 0.7760, test_loss: 0.9647, test_f1: 0.4980
 epoch: 18, train_loss: 0.7896, test_loss: 0.9601, test_f1: 0.5270
 epoch: 19, train_loss: 0.7479, test_loss: 0.8909, test_f1: 0.5629
 epoch: 20, train_loss: 0.7615, test_loss: 0.8919, test_f1: 0.5150
 epoch: 21, train_loss: 0.7667, test_loss: 0.8655, test_f1: 0.5442
 epoch: 22, train_loss: 0.7444, test_loss: 0.9048, test_f1: 0.5449
 epoch: 23, train_loss: 0.7558, test_loss: 1.0694, test_f1: 0.5428
 epoch: 24, train_loss: 0.7508, test_loss: 1.1649, test_f1: 0.5506
 epoch: 25, train_loss: 0.7298, test_loss: 0.9899, test_f1: 0.5687
 epoch: 26, train_loss: 0.7110, test_loss: 0.9783, test_f1: 0.5615
 epoch: 27, train_loss: 0.7073, test_loss: 0.9064, test_f1: 0.5006
 epoch: 28, train_loss: 0.7408, test_loss: 1.0680, test_f1: 0.5905
 epoch: 29, train_loss: 0.7199, test_loss: 1.0311, test_f1: 0.5860
 epoch: 30, train_loss: 0.7103, test_loss: 0.9874, test_f1: 0.5983
 epoch: 31, train_loss: 0.6988, test_loss: 0.8869, test_f1: 0.5539
 epoch: 32, train_loss: 0.6879, test_loss: 0.8083, test_f1: 0.5707
 epoch: 33, train_loss: 0.7069, test_loss: 1.0449, test_f1: 0.5290
 epoch: 34, train_loss: 0.6833, test_loss: 1.1820, test_f1: 0.4825
 epoch: 35, train_loss: 0.7280, test_loss: 0.8208, test_f1: 0.5582
 epoch: 36, train_loss: 0.6898, test_loss: 0.8326, test_f1: 0.6160
 epoch: 37, train_loss: 0.6708, test_loss: 0.9148, test_f1: 0.5793
 epoch: 38, train_loss: 0.6681, test_loss: 0.9035, test_f1: 0.5927
 epoch: 39, train_loss: 0.6808, test_loss: 0.9624, test_f1: 0.5762
 epoch: 40, train_loss: 0.6723, test_loss: 0.8477, test_f1: 0.5762
 epoch: 41, train_loss: 0.6696, test_loss: 1.1318, test_f1: 0.5769
 epoch: 42, train_loss: 0.6672, test_loss: 0.9217, test_f1: 0.6097
 epoch: 43, train_loss: 0.6465, test_loss: 0.9111, test_f1: 0.5983
 epoch: 44, train_loss: 0.6555, test_loss: 1.0758, test_f1: 0.5862
 epoch: 45, train_loss: 0.6756, test_loss: 0.8406, test_f1: 0.6358
 epoch: 46, train_loss: 0.6531, test_loss: 0.9533, test_f1: 0.5891
 epoch: 47, train_loss: 0.6259, test_loss: 0.8718, test_f1: 0.6015
 epoch: 48, train_loss: 0.6539, test_loss: 0.9717, test_f1: 0.6016
 epoch: 49, train_loss: 0.6394, test_loss: 0.9722, test_f1: 0.6177
 epoch: 50, train_loss: 0.6474, test_loss: 1.2688, test_f1: 0.5013
 epoch: 51, train_loss: 0.6401, test_loss: 0.8782, test_f1: 0.6484
 epoch: 52, train_loss: 0.6121, test_loss: 0.9761, test_f1: 0.6344
 epoch: 53, train_loss: 0.5963, test_loss: 0.9665, test_f1: 0.6546
 epoch: 54, train_loss: 0.5812, test_loss: 1.0084, test_f1: 0.6456
 epoch: 55, train_loss: 0.5817, test_loss: 0.9689, test_f1: 0.6323
 epoch: 56, train_loss: 0.5802, test_loss: 1.0020, test_f1: 0.6200
 epoch: 57, train_loss: 0.5606, test_loss: 0.9485, test_f1: 0.6347
 epoch: 58, train_loss: 0.5724, test_loss: 1.0510, test_f1: 0.6155
 epoch: 59, train_loss: 0.5695, test_loss: 1.0178, test_f1: 0.6306
 epoch: 60, train_loss: 0.5726, test_loss: 1.2103, test_f1: 0.6054
 epoch: 61, train_loss: 0.5610, test_loss: 0.9278, test_f1: 0.6388
 epoch: 62, train_loss: 0.5682, test_loss: 0.9286, test_f1: 0.6244
 epoch: 63, train_loss: 0.5520, test_loss: 1.1030, test_f1: 0.6364
 epoch: 64, train_loss: 0.5569, test_loss: 1.0656, test_f1: 0.6233
 epoch: 65, train_loss: 0.5801, test_loss: 1.1699, test_f1: 0.5922
 epoch: 66, train_loss: 0.5601, test_loss: 1.0164, test_f1: 0.6367
 epoch: 67, train_loss: 0.5531, test_loss: 0.9659, test_f1: 0.6192
 epoch: 68, train_loss: 0.5702, test_loss: 1.0935, test_f1: 0.6282
 epoch: 69, train_loss: 0.5656, test_loss: 1.0718, test_f1: 0.6131
 epoch: 70, train_loss: 0.5493, test_loss: 1.0295, test_f1: 0.6433
 epoch: 71, train_loss: 0.5607, test_loss: 1.0955, test_f1: 0.6268
 epoch: 72, train_loss: 0.5697, test_loss: 0.9427, test_f1: 0.6624
 epoch: 73, train_loss: 0.5671, test_loss: 1.1517, test_f1: 0.6208
 epoch: 74, train_loss: 0.5351, test_loss: 0.9411, test_f1: 0.6442
 epoch: 75, train_loss: 0.5391, test_loss: 1.0438, test_f1: 0.6366
 epoch: 76, train_loss: 0.5309, test_loss: 1.0351, test_f1: 0.6523
 epoch: 77, train_loss: 0.5500, test_loss: 1.0368, test_f1: 0.6303
 epoch: 78, train_loss: 0.5439, test_loss: 0.9391, test_f1: 0.6476
 epoch: 79, train_loss: 0.5468, test_loss: 1.0847, test_f1: 0.5952
 epoch: 80, train_loss: 0.5419, test_loss: 1.2344, test_f1: 0.6138
 epoch: 81, train_loss: 0.5201, test_loss: 1.0329, test_f1: 0.6476
 epoch: 82, train_loss: 0.5253, test_loss: 1.1491, test_f1: 0.6241
 epoch: 83, train_loss: 0.5340, test_loss: 1.0305, test_f1: 0.6420
 epoch: 84, train_loss: 0.5212, test_loss: 1.1104, test_f1: 0.6275
 epoch: 85, train_loss: 0.5453, test_loss: 1.1622, test_f1: 0.6163
 epoch: 86, train_loss: 0.5269, test_loss: 1.1550, test_f1: 0.6225
 epoch: 87, train_loss: 0.5342, test_loss: 1.1428, test_f1: 0.6083
 epoch: 88, train_loss: 0.5359, test_loss: 1.1478, test_f1: 0.6188
 epoch: 89, train_loss: 0.5110, test_loss: 1.2082, test_f1: 0.6360
 epoch: 90, train_loss: 0.5265, test_loss: 1.1287, test_f1: 0.6298
 epoch: 91, train_loss: 0.5167, test_loss: 1.1278, test_f1: 0.6174
 epoch: 92, train_loss: 0.5303, test_loss: 1.0948, test_f1: 0.6109
 epoch: 93, train_loss: 0.5307, test_loss: 1.1114, test_f1: 0.6304
 epoch: 94, train_loss: 0.5174, test_loss: 1.0833, test_f1: 0.6216
 epoch: 95, train_loss: 0.5091, test_loss: 1.1128, test_f1: 0.6158
 epoch: 96, train_loss: 0.5043, test_loss: 1.0999, test_f1: 0.6222
 epoch: 97, train_loss: 0.4989, test_loss: 1.2033, test_f1: 0.6114
 epoch: 98, train_loss: 0.4804, test_loss: 1.2451, test_f1: 0.6175
 epoch: 99, train_loss: 0.4882, test_loss: 1.1195, test_f1: 0.6182
##################ITERATION #7 ****************************************
 epoch: 0, train_loss: 1.2402, test_loss: 1.1337, test_f1: 0.3394
 epoch: 1, train_loss: 1.0207, test_loss: 0.9883, test_f1: 0.4586
 epoch: 2, train_loss: 0.9648, test_loss: 1.6022, test_f1: 0.3586
 epoch: 3, train_loss: 0.9852, test_loss: 1.0338, test_f1: 0.4826
 epoch: 4, train_loss: 0.9595, test_loss: 0.9534, test_f1: 0.5447
 epoch: 5, train_loss: 0.9223, test_loss: 0.9559, test_f1: 0.5549
 epoch: 6, train_loss: 0.9164, test_loss: 0.9726, test_f1: 0.4920
 epoch: 7, train_loss: 0.8747, test_loss: 1.0053, test_f1: 0.4614
 epoch: 8, train_loss: 0.8788, test_loss: 1.0063, test_f1: 0.4996
 epoch: 9, train_loss: 0.8581, test_loss: 0.8828, test_f1: 0.5895
 epoch: 10, train_loss: 0.8543, test_loss: 0.9005, test_f1: 0.5321
 epoch: 11, train_loss: 0.8460, test_loss: 1.0770, test_f1: 0.4691
 epoch: 12, train_loss: 0.8441, test_loss: 0.8788, test_f1: 0.5974
 epoch: 13, train_loss: 0.8275, test_loss: 0.8613, test_f1: 0.6027
 epoch: 14, train_loss: 0.8019, test_loss: 1.0794, test_f1: 0.5334
 epoch: 15, train_loss: 0.8017, test_loss: 0.9221, test_f1: 0.5332
 epoch: 16, train_loss: 0.8135, test_loss: 0.8768, test_f1: 0.5877
 epoch: 17, train_loss: 0.8014, test_loss: 0.9134, test_f1: 0.5337
 epoch: 18, train_loss: 0.7678, test_loss: 0.8490, test_f1: 0.5760
 epoch: 19, train_loss: 0.7769, test_loss: 0.9636, test_f1: 0.5310
 epoch: 20, train_loss: 0.7616, test_loss: 0.9144, test_f1: 0.5572
 epoch: 21, train_loss: 0.7572, test_loss: 0.9876, test_f1: 0.5533
 epoch: 22, train_loss: 0.7507, test_loss: 0.8940, test_f1: 0.5853
 epoch: 23, train_loss: 0.7532, test_loss: 0.8456, test_f1: 0.5826
 epoch: 24, train_loss: 0.7501, test_loss: 0.8399, test_f1: 0.5785
 epoch: 25, train_loss: 0.7464, test_loss: 1.0817, test_f1: 0.4653
 epoch: 26, train_loss: 0.7570, test_loss: 1.0739, test_f1: 0.4681
 epoch: 27, train_loss: 0.7497, test_loss: 0.8339, test_f1: 0.5625
 epoch: 28, train_loss: 0.7319, test_loss: 1.2269, test_f1: 0.4873
 epoch: 29, train_loss: 0.7108, test_loss: 0.8133, test_f1: 0.6235
 epoch: 30, train_loss: 0.7381, test_loss: 0.9098, test_f1: 0.5533
 epoch: 31, train_loss: 0.7142, test_loss: 0.8607, test_f1: 0.5768
 epoch: 32, train_loss: 0.7082, test_loss: 0.9428, test_f1: 0.5284
 epoch: 33, train_loss: 0.7025, test_loss: 0.9256, test_f1: 0.5886
 epoch: 34, train_loss: 0.7317, test_loss: 0.9646, test_f1: 0.5372
 epoch: 35, train_loss: 0.7143, test_loss: 0.8974, test_f1: 0.5563
 epoch: 36, train_loss: 0.7086, test_loss: 0.8414, test_f1: 0.6186
 epoch: 37, train_loss: 0.6778, test_loss: 0.9666, test_f1: 0.5691
 epoch: 38, train_loss: 0.6676, test_loss: 0.8551, test_f1: 0.6218
 epoch: 39, train_loss: 0.6923, test_loss: 0.8892, test_f1: 0.6238
 epoch: 40, train_loss: 0.7041, test_loss: 0.8748, test_f1: 0.5415
 epoch: 41, train_loss: 0.6829, test_loss: 0.9253, test_f1: 0.5943
 epoch: 42, train_loss: 0.6879, test_loss: 0.8718, test_f1: 0.5560
 epoch: 43, train_loss: 0.6783, test_loss: 0.9047, test_f1: 0.5794
 epoch: 44, train_loss: 0.6772, test_loss: 0.8961, test_f1: 0.5894
 epoch: 45, train_loss: 0.6844, test_loss: 0.8697, test_f1: 0.6142
 epoch: 46, train_loss: 0.6642, test_loss: 0.8242, test_f1: 0.6225
 epoch: 47, train_loss: 0.6664, test_loss: 0.8230, test_f1: 0.6298
 epoch: 48, train_loss: 0.6535, test_loss: 0.9221, test_f1: 0.5870
 epoch: 49, train_loss: 0.6745, test_loss: 0.8830, test_f1: 0.5686
 epoch: 50, train_loss: 0.6538, test_loss: 0.9460, test_f1: 0.5542
 epoch: 51, train_loss: 0.6343, test_loss: 0.8755, test_f1: 0.6101
 epoch: 52, train_loss: 0.6033, test_loss: 0.8054, test_f1: 0.6020
 epoch: 53, train_loss: 0.6046, test_loss: 0.8432, test_f1: 0.6003
 epoch: 54, train_loss: 0.6036, test_loss: 0.8543, test_f1: 0.6051
 epoch: 55, train_loss: 0.6026, test_loss: 0.8630, test_f1: 0.6396
 epoch: 56, train_loss: 0.5972, test_loss: 0.8217, test_f1: 0.5996
 epoch: 57, train_loss: 0.5930, test_loss: 0.8816, test_f1: 0.5832
 epoch: 58, train_loss: 0.5898, test_loss: 0.8903, test_f1: 0.6007
 epoch: 59, train_loss: 0.6093, test_loss: 0.8682, test_f1: 0.6212
 epoch: 60, train_loss: 0.6060, test_loss: 0.9006, test_f1: 0.6096
 epoch: 61, train_loss: 0.5958, test_loss: 0.9497, test_f1: 0.5601
 epoch: 62, train_loss: 0.5985, test_loss: 0.9441, test_f1: 0.5958
 epoch: 63, train_loss: 0.5863, test_loss: 0.8571, test_f1: 0.6213
 epoch: 64, train_loss: 0.5690, test_loss: 0.8340, test_f1: 0.6334
 epoch: 65, train_loss: 0.5671, test_loss: 0.8310, test_f1: 0.6199
 epoch: 66, train_loss: 0.5810, test_loss: 0.8866, test_f1: 0.6392
 epoch: 67, train_loss: 0.5868, test_loss: 0.9141, test_f1: 0.6091
 epoch: 68, train_loss: 0.5815, test_loss: 0.9069, test_f1: 0.6061
 epoch: 69, train_loss: 0.5711, test_loss: 0.8511, test_f1: 0.6212
 epoch: 70, train_loss: 0.5694, test_loss: 0.8411, test_f1: 0.6567
 epoch: 71, train_loss: 0.5767, test_loss: 0.8854, test_f1: 0.6004
 epoch: 72, train_loss: 0.5640, test_loss: 0.8568, test_f1: 0.6319
 epoch: 73, train_loss: 0.5547, test_loss: 0.9087, test_f1: 0.5892
 epoch: 74, train_loss: 0.5589, test_loss: 0.8866, test_f1: 0.6249
 epoch: 75, train_loss: 0.5446, test_loss: 0.9309, test_f1: 0.6326
 epoch: 76, train_loss: 0.5470, test_loss: 0.8951, test_f1: 0.6381
 epoch: 77, train_loss: 0.5584, test_loss: 0.9135, test_f1: 0.6393
 epoch: 78, train_loss: 0.5805, test_loss: 1.0217, test_f1: 0.6206
 epoch: 79, train_loss: 0.5482, test_loss: 1.0294, test_f1: 0.5867
 epoch: 80, train_loss: 0.5571, test_loss: 0.9277, test_f1: 0.5975
 epoch: 81, train_loss: 0.5553, test_loss: 0.8724, test_f1: 0.6340
 epoch: 82, train_loss: 0.5424, test_loss: 0.8505, test_f1: 0.6241
 epoch: 83, train_loss: 0.5406, test_loss: 0.9634, test_f1: 0.6001
 epoch: 84, train_loss: 0.5363, test_loss: 0.9565, test_f1: 0.6038
 epoch: 85, train_loss: 0.5608, test_loss: 0.8890, test_f1: 0.6032
 epoch: 86, train_loss: 0.5388, test_loss: 0.9381, test_f1: 0.6340
 epoch: 87, train_loss: 0.5443, test_loss: 0.8872, test_f1: 0.6432
 epoch: 88, train_loss: 0.5442, test_loss: 1.0109, test_f1: 0.6228
 epoch: 89, train_loss: 0.5225, test_loss: 0.9370, test_f1: 0.6484
 epoch: 90, train_loss: 0.5209, test_loss: 0.9725, test_f1: 0.6343
 epoch: 91, train_loss: 0.5341, test_loss: 0.9923, test_f1: 0.5801
 epoch: 92, train_loss: 0.5081, test_loss: 0.8904, test_f1: 0.6507
 epoch: 93, train_loss: 0.5153, test_loss: 0.8707, test_f1: 0.6535
 epoch: 94, train_loss: 0.5367, test_loss: 0.9744, test_f1: 0.6266
 epoch: 95, train_loss: 0.5384, test_loss: 0.8685, test_f1: 0.6317
 epoch: 96, train_loss: 0.5341, test_loss: 1.0080, test_f1: 0.6065
 epoch: 97, train_loss: 0.5207, test_loss: 0.8817, test_f1: 0.6402
 epoch: 98, train_loss: 0.5336, test_loss: 0.8727, test_f1: 0.6653
 epoch: 99, train_loss: 0.5108, test_loss: 0.8648, test_f1: 0.6156
##################ITERATION #8 ****************************************
 epoch: 0, train_loss: 1.1709, test_loss: 1.2723, test_f1: 0.3214
 epoch: 1, train_loss: 0.9964, test_loss: 1.0563, test_f1: 0.4674
 epoch: 2, train_loss: 0.9729, test_loss: 1.0428, test_f1: 0.5117
 epoch: 3, train_loss: 0.9454, test_loss: 1.0592, test_f1: 0.4678
 epoch: 4, train_loss: 0.9386, test_loss: 1.0006, test_f1: 0.5377
 epoch: 5, train_loss: 0.9093, test_loss: 1.0694, test_f1: 0.4851
 epoch: 6, train_loss: 0.9049, test_loss: 0.9825, test_f1: 0.5181
 epoch: 7, train_loss: 0.8758, test_loss: 1.0102, test_f1: 0.5357
 epoch: 8, train_loss: 0.8593, test_loss: 0.9849, test_f1: 0.5294
 epoch: 9, train_loss: 0.8717, test_loss: 0.9739, test_f1: 0.5277
 epoch: 10, train_loss: 0.8489, test_loss: 1.0364, test_f1: 0.4624
 epoch: 11, train_loss: 0.8394, test_loss: 0.9568, test_f1: 0.5147
 epoch: 12, train_loss: 0.8214, test_loss: 1.0140, test_f1: 0.5185
 epoch: 13, train_loss: 0.8213, test_loss: 1.0270, test_f1: 0.5230
 epoch: 14, train_loss: 0.8234, test_loss: 1.1263, test_f1: 0.4891
 epoch: 15, train_loss: 0.8048, test_loss: 0.9713, test_f1: 0.5627
 epoch: 16, train_loss: 0.8226, test_loss: 1.0164, test_f1: 0.5270
 epoch: 17, train_loss: 0.8329, test_loss: 0.9013, test_f1: 0.5851
 epoch: 18, train_loss: 0.8032, test_loss: 0.9099, test_f1: 0.5647
 epoch: 19, train_loss: 0.7838, test_loss: 0.9304, test_f1: 0.5623
 epoch: 20, train_loss: 0.7707, test_loss: 0.8605, test_f1: 0.5598
 epoch: 21, train_loss: 0.7932, test_loss: 0.9637, test_f1: 0.5078
 epoch: 22, train_loss: 0.8028, test_loss: 0.9135, test_f1: 0.5986
 epoch: 23, train_loss: 0.7690, test_loss: 1.0147, test_f1: 0.5601
 epoch: 24, train_loss: 0.7460, test_loss: 1.0066, test_f1: 0.5232
 epoch: 25, train_loss: 0.7441, test_loss: 0.9000, test_f1: 0.6167
 epoch: 26, train_loss: 0.7404, test_loss: 0.9527, test_f1: 0.5666
 epoch: 27, train_loss: 0.7411, test_loss: 0.9802, test_f1: 0.5572
 epoch: 28, train_loss: 0.7595, test_loss: 0.9736, test_f1: 0.5782
 epoch: 29, train_loss: 0.7672, test_loss: 0.9710, test_f1: 0.5789
 epoch: 30, train_loss: 0.7529, test_loss: 0.9337, test_f1: 0.5474
 epoch: 31, train_loss: 0.7437, test_loss: 0.9640, test_f1: 0.5674
 epoch: 32, train_loss: 0.7368, test_loss: 0.9631, test_f1: 0.5109
 epoch: 33, train_loss: 0.7351, test_loss: 1.0378, test_f1: 0.5173
 epoch: 34, train_loss: 0.7315, test_loss: 0.9234, test_f1: 0.5450
 epoch: 35, train_loss: 0.7234, test_loss: 0.8803, test_f1: 0.6249
 epoch: 36, train_loss: 0.7354, test_loss: 0.8911, test_f1: 0.5895
 epoch: 37, train_loss: 0.7328, test_loss: 0.9713, test_f1: 0.5596
 epoch: 38, train_loss: 0.7209, test_loss: 0.9607, test_f1: 0.5701
 epoch: 39, train_loss: 0.7361, test_loss: 1.1155, test_f1: 0.4966
 epoch: 40, train_loss: 0.7128, test_loss: 0.9844, test_f1: 0.6082
 epoch: 41, train_loss: 0.7153, test_loss: 1.1482, test_f1: 0.5123
 epoch: 42, train_loss: 0.7066, test_loss: 0.9167, test_f1: 0.5915
 epoch: 43, train_loss: 0.7037, test_loss: 0.8887, test_f1: 0.5986
 epoch: 44, train_loss: 0.6842, test_loss: 0.8570, test_f1: 0.5594
 epoch: 45, train_loss: 0.7099, test_loss: 0.9703, test_f1: 0.5227
 epoch: 46, train_loss: 0.7000, test_loss: 0.9305, test_f1: 0.5893
 epoch: 47, train_loss: 0.6915, test_loss: 1.0171, test_f1: 0.5998
 epoch: 48, train_loss: 0.6827, test_loss: 0.9267, test_f1: 0.5815
 epoch: 49, train_loss: 0.6734, test_loss: 0.9314, test_f1: 0.6374
 epoch: 50, train_loss: 0.6846, test_loss: 1.0093, test_f1: 0.5605
 epoch: 51, train_loss: 0.6521, test_loss: 0.9223, test_f1: 0.5622
 epoch: 52, train_loss: 0.6535, test_loss: 0.9217, test_f1: 0.6317
 epoch: 53, train_loss: 0.6530, test_loss: 0.9607, test_f1: 0.6028
 epoch: 54, train_loss: 0.6498, test_loss: 0.9896, test_f1: 0.5990
 epoch: 55, train_loss: 0.6369, test_loss: 0.9465, test_f1: 0.5865
 epoch: 56, train_loss: 0.6352, test_loss: 0.9021, test_f1: 0.6473
 epoch: 57, train_loss: 0.6240, test_loss: 0.9769, test_f1: 0.6150
 epoch: 58, train_loss: 0.6420, test_loss: 0.9958, test_f1: 0.5865
 epoch: 59, train_loss: 0.6316, test_loss: 0.9286, test_f1: 0.6459
 epoch: 60, train_loss: 0.6298, test_loss: 0.9806, test_f1: 0.6211
 epoch: 61, train_loss: 0.6300, test_loss: 0.9597, test_f1: 0.6203
 epoch: 62, train_loss: 0.6207, test_loss: 0.9526, test_f1: 0.5895
 epoch: 63, train_loss: 0.6163, test_loss: 1.0425, test_f1: 0.5716
 epoch: 64, train_loss: 0.6187, test_loss: 0.9522, test_f1: 0.6127
 epoch: 65, train_loss: 0.6360, test_loss: 0.9166, test_f1: 0.6375
 epoch: 66, train_loss: 0.6328, test_loss: 0.9605, test_f1: 0.5979
 epoch: 67, train_loss: 0.6178, test_loss: 0.9152, test_f1: 0.6414
 epoch: 68, train_loss: 0.6190, test_loss: 0.9503, test_f1: 0.6154
 epoch: 69, train_loss: 0.6022, test_loss: 0.9525, test_f1: 0.5960
 epoch: 70, train_loss: 0.6121, test_loss: 0.9553, test_f1: 0.5958
 epoch: 71, train_loss: 0.6034, test_loss: 1.0270, test_f1: 0.5965
 epoch: 72, train_loss: 0.5987, test_loss: 0.9115, test_f1: 0.6155
 epoch: 73, train_loss: 0.6092, test_loss: 1.0128, test_f1: 0.6107
 epoch: 74, train_loss: 0.6064, test_loss: 1.0487, test_f1: 0.6294
 epoch: 75, train_loss: 0.6111, test_loss: 0.9168, test_f1: 0.6227
 epoch: 76, train_loss: 0.6004, test_loss: 0.9993, test_f1: 0.6065
 epoch: 77, train_loss: 0.6083, test_loss: 1.0125, test_f1: 0.6199
 epoch: 78, train_loss: 0.5878, test_loss: 0.9693, test_f1: 0.6178
 epoch: 79, train_loss: 0.5904, test_loss: 1.0110, test_f1: 0.5996
 epoch: 80, train_loss: 0.6047, test_loss: 1.0144, test_f1: 0.5985
 epoch: 81, train_loss: 0.5998, test_loss: 0.9790, test_f1: 0.6104
 epoch: 82, train_loss: 0.5766, test_loss: 0.9421, test_f1: 0.6400
 epoch: 83, train_loss: 0.5885, test_loss: 0.9352, test_f1: 0.6182
 epoch: 84, train_loss: 0.5895, test_loss: 1.0852, test_f1: 0.5849
 epoch: 85, train_loss: 0.5917, test_loss: 0.9467, test_f1: 0.6530
 epoch: 86, train_loss: 0.5884, test_loss: 0.9482, test_f1: 0.6342
 epoch: 87, train_loss: 0.5934, test_loss: 1.0071, test_f1: 0.6299
 epoch: 88, train_loss: 0.5858, test_loss: 0.9725, test_f1: 0.6213
 epoch: 89, train_loss: 0.5811, test_loss: 1.0034, test_f1: 0.6075
 epoch: 90, train_loss: 0.5710, test_loss: 1.0436, test_f1: 0.5995
 epoch: 91, train_loss: 0.5586, test_loss: 1.0058, test_f1: 0.6167
 epoch: 92, train_loss: 0.5808, test_loss: 0.9616, test_f1: 0.6154
 epoch: 93, train_loss: 0.5679, test_loss: 0.9863, test_f1: 0.6125
 epoch: 94, train_loss: 0.5664, test_loss: 0.9486, test_f1: 0.6512
 epoch: 95, train_loss: 0.5762, test_loss: 1.0911, test_f1: 0.6123
 epoch: 96, train_loss: 0.5811, test_loss: 1.1183, test_f1: 0.5842
 epoch: 97, train_loss: 0.5689, test_loss: 1.1067, test_f1: 0.5989
 epoch: 98, train_loss: 0.5652, test_loss: 1.0579, test_f1: 0.6081
 epoch: 99, train_loss: 0.5689, test_loss: 1.0789, test_f1: 0.6075
##################ITERATION #9 ****************************************
 epoch: 0, train_loss: 1.1872, test_loss: 1.0950, test_f1: 0.3532
 epoch: 1, train_loss: 1.0322, test_loss: 1.1993, test_f1: 0.3594
 epoch: 2, train_loss: 0.9886, test_loss: 1.0699, test_f1: 0.4201
 epoch: 3, train_loss: 0.9592, test_loss: 1.0074, test_f1: 0.5152
 epoch: 4, train_loss: 0.9392, test_loss: 0.9800, test_f1: 0.5393
 epoch: 5, train_loss: 0.9285, test_loss: 0.9869, test_f1: 0.5615
 epoch: 6, train_loss: 0.9348, test_loss: 0.9159, test_f1: 0.5442
 epoch: 7, train_loss: 0.9168, test_loss: 0.9480, test_f1: 0.5261
 epoch: 8, train_loss: 0.8993, test_loss: 0.9801, test_f1: 0.4991
 epoch: 9, train_loss: 0.8651, test_loss: 0.9523, test_f1: 0.5746
 epoch: 10, train_loss: 0.9016, test_loss: 1.1378, test_f1: 0.4875
 epoch: 11, train_loss: 0.8837, test_loss: 0.9504, test_f1: 0.5165
 epoch: 12, train_loss: 0.8563, test_loss: 0.9463, test_f1: 0.5485
 epoch: 13, train_loss: 0.8478, test_loss: 1.1298, test_f1: 0.4531
 epoch: 14, train_loss: 0.8498, test_loss: 0.9676, test_f1: 0.5395
 epoch: 15, train_loss: 0.8264, test_loss: 0.9298, test_f1: 0.5798
 epoch: 16, train_loss: 0.8126, test_loss: 1.0682, test_f1: 0.5103
 epoch: 17, train_loss: 0.8103, test_loss: 0.9500, test_f1: 0.5422
 epoch: 18, train_loss: 0.8121, test_loss: 0.9622, test_f1: 0.5654
 epoch: 19, train_loss: 0.7952, test_loss: 0.9767, test_f1: 0.5376
 epoch: 20, train_loss: 0.7888, test_loss: 0.9856, test_f1: 0.5460
 epoch: 21, train_loss: 0.7958, test_loss: 0.9549, test_f1: 0.5370
 epoch: 22, train_loss: 0.7695, test_loss: 1.0443, test_f1: 0.5210
 epoch: 23, train_loss: 0.7728, test_loss: 0.9424, test_f1: 0.5331
 epoch: 24, train_loss: 0.7609, test_loss: 1.0608, test_f1: 0.5383
 epoch: 25, train_loss: 0.7840, test_loss: 0.9075, test_f1: 0.5803
 epoch: 26, train_loss: 0.7848, test_loss: 0.9206, test_f1: 0.5290
 epoch: 27, train_loss: 0.7445, test_loss: 0.9314, test_f1: 0.5866
 epoch: 28, train_loss: 0.7448, test_loss: 1.0021, test_f1: 0.5066
 epoch: 29, train_loss: 0.7330, test_loss: 0.9528, test_f1: 0.6002
 epoch: 30, train_loss: 0.7382, test_loss: 0.8918, test_f1: 0.5861
 epoch: 31, train_loss: 0.7449, test_loss: 0.8777, test_f1: 0.6281
 epoch: 32, train_loss: 0.7424, test_loss: 0.8650, test_f1: 0.5702
 epoch: 33, train_loss: 0.7152, test_loss: 0.8887, test_f1: 0.6036
 epoch: 34, train_loss: 0.7224, test_loss: 0.8735, test_f1: 0.5841
 epoch: 35, train_loss: 0.7168, test_loss: 0.9669, test_f1: 0.5855
 epoch: 36, train_loss: 0.7395, test_loss: 0.9330, test_f1: 0.6302
 epoch: 37, train_loss: 0.7302, test_loss: 0.9179, test_f1: 0.5975
 epoch: 38, train_loss: 0.7304, test_loss: 1.3706, test_f1: 0.4424
 epoch: 39, train_loss: 0.7139, test_loss: 0.9945, test_f1: 0.5742
 epoch: 40, train_loss: 0.7110, test_loss: 0.9924, test_f1: 0.5831
 epoch: 41, train_loss: 0.6888, test_loss: 0.8541, test_f1: 0.6256
 epoch: 42, train_loss: 0.6892, test_loss: 0.9202, test_f1: 0.5793
 epoch: 43, train_loss: 0.7066, test_loss: 0.9390, test_f1: 0.5661
 epoch: 44, train_loss: 0.6912, test_loss: 0.9227, test_f1: 0.6055
 epoch: 45, train_loss: 0.6705, test_loss: 0.9118, test_f1: 0.6125
 epoch: 46, train_loss: 0.6954, test_loss: 0.9290, test_f1: 0.6149
 epoch: 47, train_loss: 0.6789, test_loss: 0.8718, test_f1: 0.6216
 epoch: 48, train_loss: 0.6785, test_loss: 0.9064, test_f1: 0.6023
 epoch: 49, train_loss: 0.6657, test_loss: 0.9379, test_f1: 0.5851
 epoch: 50, train_loss: 0.6562, test_loss: 0.9554, test_f1: 0.5713
 epoch: 51, train_loss: 0.6385, test_loss: 0.9021, test_f1: 0.6203
 epoch: 52, train_loss: 0.6155, test_loss: 0.8588, test_f1: 0.6120
 epoch: 53, train_loss: 0.6013, test_loss: 0.8777, test_f1: 0.6088
 epoch: 54, train_loss: 0.5990, test_loss: 0.9202, test_f1: 0.5989
 epoch: 55, train_loss: 0.6016, test_loss: 0.8694, test_f1: 0.6076
 epoch: 56, train_loss: 0.6047, test_loss: 0.8996, test_f1: 0.5876
 epoch: 57, train_loss: 0.5981, test_loss: 0.9172, test_f1: 0.5997
 epoch: 58, train_loss: 0.5928, test_loss: 0.8471, test_f1: 0.6127
 epoch: 59, train_loss: 0.6078, test_loss: 0.9013, test_f1: 0.6365
 epoch: 60, train_loss: 0.5963, test_loss: 0.8849, test_f1: 0.6355
 epoch: 61, train_loss: 0.5850, test_loss: 0.9335, test_f1: 0.6063
 epoch: 62, train_loss: 0.5786, test_loss: 0.9651, test_f1: 0.6089
 epoch: 63, train_loss: 0.5943, test_loss: 0.9354, test_f1: 0.6052
 epoch: 64, train_loss: 0.5898, test_loss: 0.9505, test_f1: 0.6277
 epoch: 65, train_loss: 0.6113, test_loss: 0.9118, test_f1: 0.5897
 epoch: 66, train_loss: 0.5826, test_loss: 0.9007, test_f1: 0.6331
 epoch: 67, train_loss: 0.5594, test_loss: 0.9392, test_f1: 0.6186
 epoch: 68, train_loss: 0.5821, test_loss: 0.9468, test_f1: 0.6046
 epoch: 69, train_loss: 0.5456, test_loss: 1.0215, test_f1: 0.5828
 epoch: 70, train_loss: 0.5601, test_loss: 0.8998, test_f1: 0.6369
 epoch: 71, train_loss: 0.5771, test_loss: 0.9104, test_f1: 0.6255
 epoch: 72, train_loss: 0.5588, test_loss: 0.8706, test_f1: 0.6372
 epoch: 73, train_loss: 0.5592, test_loss: 0.9246, test_f1: 0.6405
 epoch: 74, train_loss: 0.5669, test_loss: 1.0206, test_f1: 0.5975
 epoch: 75, train_loss: 0.5560, test_loss: 0.9417, test_f1: 0.6172
 epoch: 76, train_loss: 0.5551, test_loss: 0.9614, test_f1: 0.6152
 epoch: 77, train_loss: 0.5458, test_loss: 1.0253, test_f1: 0.6074
 epoch: 78, train_loss: 0.5410, test_loss: 1.0596, test_f1: 0.5835
 epoch: 79, train_loss: 0.5314, test_loss: 0.9861, test_f1: 0.6087
 epoch: 80, train_loss: 0.5358, test_loss: 0.9656, test_f1: 0.6222
 epoch: 81, train_loss: 0.5464, test_loss: 0.9932, test_f1: 0.5844
 epoch: 82, train_loss: 0.5742, test_loss: 0.9708, test_f1: 0.6110
 epoch: 83, train_loss: 0.5264, test_loss: 0.9518, test_f1: 0.6020
 epoch: 84, train_loss: 0.5307, test_loss: 1.0442, test_f1: 0.6091
 epoch: 85, train_loss: 0.5294, test_loss: 1.0352, test_f1: 0.6099
 epoch: 86, train_loss: 0.5276, test_loss: 0.9485, test_f1: 0.6147
 epoch: 87, train_loss: 0.5213, test_loss: 0.8863, test_f1: 0.6145
 epoch: 88, train_loss: 0.5161, test_loss: 1.0090, test_f1: 0.5691
 epoch: 89, train_loss: 0.5563, test_loss: 1.0024, test_f1: 0.5958
 epoch: 90, train_loss: 0.5336, test_loss: 1.0480, test_f1: 0.6199
 epoch: 91, train_loss: 0.5254, test_loss: 1.0113, test_f1: 0.6003
 epoch: 92, train_loss: 0.5152, test_loss: 0.9312, test_f1: 0.6242
 epoch: 93, train_loss: 0.5231, test_loss: 0.9394, test_f1: 0.6335
 epoch: 94, train_loss: 0.5341, test_loss: 1.0509, test_f1: 0.6133
 epoch: 95, train_loss: 0.5225, test_loss: 1.0206, test_f1: 0.6063
 epoch: 96, train_loss: 0.5016, test_loss: 1.1166, test_f1: 0.6018
 epoch: 97, train_loss: 0.5307, test_loss: 1.0203, test_f1: 0.6083
 epoch: 98, train_loss: 0.5257, test_loss: 1.0225, test_f1: 0.6152
 epoch: 99, train_loss: 0.5081, test_loss: 1.0280, test_f1: 0.5957

Training completed in 665.74 seconds
Best F1: 0.6963 at epoch 54
Mean F1 across iterations: 0.6615  0.0152
========================FINAL RESULTS================================
FEGIN weighted F1: 0.6963  0.0152
python main.py --data ltspice_examples --representation component_pin --model FEGIN --layers 3 --hiddens 32 --batch_size 128 --lr 0.01 --emb_size 128 --epochs 100 --save_appendix component_pin_L3_H32_BS128_LR0.01_E128 --no_val
-----



STDERR:
  File "main.py", line 370, in <module>
    main()
  File "main.py", line 254, in main
    dataset = dataset_class(
  File "/home/philip/projects/llm_inference_code_repo/Circuit-Completion-Using-GNNs/component_classification_with_link_prediction_head/evaluation/FEGIN/kernel/circuit_datasets.py", line 15, in __init__
    self.data, self.slices = torch.load(self.processed_paths[0])
  File "/home/philip/.local/lib/python3.8/site-packages/torch/serialization.py", line 1040, in load
    warnings.warn(
  File "/usr/lib/python3.8/warnings.py", line 109, in _showwarnmsg
    sw(msg.message, msg.category, msg.filename, msg.lineno,
  File "main.py", line 47, in warn_with_traceback
    traceback.print_stack(file=log)
/home/philip/projects/llm_inference_code_repo/Circuit-Completion-Using-GNNs/component_classification_with_link_prediction_head/evaluation/FEGIN/kernel/circuit_datasets.py:15: FutureWarning: You are using `torch.load` with `weights_only=False` (the current default value), which uses the default pickle module implicitly. It is possible to construct malicious pickle data which will execute arbitrary code during unpickling (See https://github.com/pytorch/pytorch/blob/main/SECURITY.md#untrusted-models for more details). In a future release, the default value for `weights_only` will be flipped to `True`. This limits the functions that could be executed during unpickling. Arbitrary objects will no longer be allowed to be loaded via this mode unless they are explicitly allowlisted by the user via `torch.serialization.add_safe_globals`. We recommend you start setting `weights_only=True` for any use case where you don't have full control of the loaded file. Please open an issue on GitHub for any issues related to this experimental feature.
  self.data, self.slices = torch.load(self.processed_paths[0])
