STDOUT:
Results will be saved in /home/philip/projects/ltspice_examples_code_repo/Circuit-Completion-Using-GNNs/component_classification_with_link_prediction_head/evaluation/FEGIN/results/model_FEGIN_dataset_ltspice_examples
Command line input: python main.py --data ltspice_examples --representation component_pin_net --model FEGIN --layers 5 --hiddens 32 --batch_size 128 --lr 0.0001 --emb_size 512 --epochs 100 --save_appendix component_pin_net_L5_H32_BS128_LR0.0001_E512 --no_val
 is saved.
-----
ltspice_examples - FEGIN
Using 5 layers, 32 hidden units, h = 2
Loading component_pin_net representation dataset
ENTERED
Training FEGIN on component_pin_net representation
Train: 3558, Test: 846
##################ITERATION #0 ****************************************
 epoch: 0, train_loss: 1.3972, test_loss: 1.3959, test_f1: 0.1004
 epoch: 1, train_loss: 1.3879, test_loss: 1.3916, test_f1: 0.1004
 epoch: 2, train_loss: 1.3809, test_loss: 1.3794, test_f1: 0.1004
 epoch: 3, train_loss: 1.3713, test_loss: 1.3674, test_f1: 0.1318
 epoch: 4, train_loss: 1.3598, test_loss: 1.3544, test_f1: 0.1814
 epoch: 5, train_loss: 1.3457, test_loss: 1.3388, test_f1: 0.2656
 epoch: 6, train_loss: 1.3288, test_loss: 1.3207, test_f1: 0.3015
 epoch: 7, train_loss: 1.3103, test_loss: 1.3023, test_f1: 0.2675
 epoch: 8, train_loss: 1.2911, test_loss: 1.2801, test_f1: 0.2419
 epoch: 9, train_loss: 1.2733, test_loss: 1.2630, test_f1: 0.2352
 epoch: 10, train_loss: 1.2582, test_loss: 1.2460, test_f1: 0.2310
 epoch: 11, train_loss: 1.2496, test_loss: 1.2334, test_f1: 0.2299
 epoch: 12, train_loss: 1.2353, test_loss: 1.2216, test_f1: 0.2295
 epoch: 13, train_loss: 1.2277, test_loss: 1.2129, test_f1: 0.2270
 epoch: 14, train_loss: 1.2153, test_loss: 1.2034, test_f1: 0.2270
 epoch: 15, train_loss: 1.2101, test_loss: 1.1935, test_f1: 0.2270
 epoch: 16, train_loss: 1.2066, test_loss: 1.1880, test_f1: 0.2416
 epoch: 17, train_loss: 1.1958, test_loss: 1.1816, test_f1: 0.2966
 epoch: 18, train_loss: 1.1906, test_loss: 1.1734, test_f1: 0.3208
 epoch: 19, train_loss: 1.1864, test_loss: 1.1684, test_f1: 0.3441
 epoch: 20, train_loss: 1.1807, test_loss: 1.1604, test_f1: 0.3374
 epoch: 21, train_loss: 1.1676, test_loss: 1.1539, test_f1: 0.3403
 epoch: 22, train_loss: 1.1676, test_loss: 1.1469, test_f1: 0.3403
 epoch: 23, train_loss: 1.1603, test_loss: 1.1400, test_f1: 0.3405
 epoch: 24, train_loss: 1.1502, test_loss: 1.1309, test_f1: 0.3434
 epoch: 25, train_loss: 1.1431, test_loss: 1.1259, test_f1: 0.3583
 epoch: 26, train_loss: 1.1373, test_loss: 1.1161, test_f1: 0.3713
 epoch: 27, train_loss: 1.1289, test_loss: 1.1102, test_f1: 0.3690
 epoch: 28, train_loss: 1.1177, test_loss: 1.0995, test_f1: 0.3859
 epoch: 29, train_loss: 1.1063, test_loss: 1.0947, test_f1: 0.3994
 epoch: 30, train_loss: 1.1014, test_loss: 1.0852, test_f1: 0.3908
 epoch: 31, train_loss: 1.0961, test_loss: 1.0780, test_f1: 0.3951
 epoch: 32, train_loss: 1.0880, test_loss: 1.0716, test_f1: 0.4059
 epoch: 33, train_loss: 1.0772, test_loss: 1.0654, test_f1: 0.4011
 epoch: 34, train_loss: 1.0798, test_loss: 1.0614, test_f1: 0.3861
 epoch: 35, train_loss: 1.0631, test_loss: 1.0557, test_f1: 0.3847
 epoch: 36, train_loss: 1.0561, test_loss: 1.0500, test_f1: 0.3942
 epoch: 37, train_loss: 1.0482, test_loss: 1.0523, test_f1: 0.4114
 epoch: 38, train_loss: 1.0461, test_loss: 1.0447, test_f1: 0.4244
 epoch: 39, train_loss: 1.0406, test_loss: 1.0428, test_f1: 0.4191
 epoch: 40, train_loss: 1.0339, test_loss: 1.0386, test_f1: 0.4272
 epoch: 41, train_loss: 1.0310, test_loss: 1.0352, test_f1: 0.4375
 epoch: 42, train_loss: 1.0224, test_loss: 1.0272, test_f1: 0.4487
 epoch: 43, train_loss: 1.0133, test_loss: 1.0250, test_f1: 0.4685
 epoch: 44, train_loss: 1.0115, test_loss: 1.0251, test_f1: 0.4521
 epoch: 45, train_loss: 1.0117, test_loss: 1.0266, test_f1: 0.4562
 epoch: 46, train_loss: 1.0045, test_loss: 1.0140, test_f1: 0.4973
 epoch: 47, train_loss: 0.9943, test_loss: 1.0130, test_f1: 0.4828
 epoch: 48, train_loss: 0.9872, test_loss: 1.0155, test_f1: 0.4783
 epoch: 49, train_loss: 0.9882, test_loss: 1.0320, test_f1: 0.4792
 epoch: 50, train_loss: 0.9814, test_loss: 1.0112, test_f1: 0.5122
 epoch: 51, train_loss: 0.9811, test_loss: 1.0149, test_f1: 0.5091
 epoch: 52, train_loss: 0.9802, test_loss: 1.0223, test_f1: 0.4829
 epoch: 53, train_loss: 0.9711, test_loss: 1.0032, test_f1: 0.5096
 epoch: 54, train_loss: 0.9717, test_loss: 1.0030, test_f1: 0.5132
 epoch: 55, train_loss: 0.9730, test_loss: 1.0081, test_f1: 0.5160
 epoch: 56, train_loss: 0.9677, test_loss: 1.0051, test_f1: 0.5175
 epoch: 57, train_loss: 0.9664, test_loss: 1.0008, test_f1: 0.5205
 epoch: 58, train_loss: 0.9657, test_loss: 1.0016, test_f1: 0.5289
 epoch: 59, train_loss: 0.9598, test_loss: 1.0043, test_f1: 0.5258
 epoch: 60, train_loss: 0.9558, test_loss: 1.0020, test_f1: 0.5201
 epoch: 61, train_loss: 0.9691, test_loss: 1.0040, test_f1: 0.5180
 epoch: 62, train_loss: 0.9543, test_loss: 0.9984, test_f1: 0.5316
 epoch: 63, train_loss: 0.9685, test_loss: 0.9997, test_f1: 0.5235
 epoch: 64, train_loss: 0.9538, test_loss: 0.9942, test_f1: 0.5268
 epoch: 65, train_loss: 0.9549, test_loss: 0.9950, test_f1: 0.5301
 epoch: 66, train_loss: 0.9555, test_loss: 0.9929, test_f1: 0.5338
 epoch: 67, train_loss: 0.9488, test_loss: 0.9930, test_f1: 0.5396
 epoch: 68, train_loss: 0.9457, test_loss: 0.9919, test_f1: 0.5345
 epoch: 69, train_loss: 0.9494, test_loss: 0.9912, test_f1: 0.5359
 epoch: 70, train_loss: 0.9492, test_loss: 0.9933, test_f1: 0.5367
 epoch: 71, train_loss: 0.9426, test_loss: 0.9901, test_f1: 0.5366
 epoch: 72, train_loss: 0.9475, test_loss: 0.9888, test_f1: 0.5123
 epoch: 73, train_loss: 0.9408, test_loss: 0.9888, test_f1: 0.5358
 epoch: 74, train_loss: 0.9410, test_loss: 0.9894, test_f1: 0.5355
 epoch: 75, train_loss: 0.9443, test_loss: 0.9886, test_f1: 0.5329
 epoch: 76, train_loss: 0.9437, test_loss: 0.9845, test_f1: 0.5277
 epoch: 77, train_loss: 0.9369, test_loss: 0.9870, test_f1: 0.5260
 epoch: 78, train_loss: 0.9389, test_loss: 0.9843, test_f1: 0.5307
 epoch: 79, train_loss: 0.9299, test_loss: 0.9826, test_f1: 0.5249
 epoch: 80, train_loss: 0.9307, test_loss: 0.9806, test_f1: 0.5384
 epoch: 81, train_loss: 0.9283, test_loss: 0.9773, test_f1: 0.5338
 epoch: 82, train_loss: 0.9265, test_loss: 0.9785, test_f1: 0.5309
 epoch: 83, train_loss: 0.9291, test_loss: 0.9822, test_f1: 0.5189
 epoch: 84, train_loss: 0.9341, test_loss: 0.9762, test_f1: 0.5252
 epoch: 85, train_loss: 0.9345, test_loss: 0.9777, test_f1: 0.5141
 epoch: 86, train_loss: 0.9306, test_loss: 0.9723, test_f1: 0.5364
 epoch: 87, train_loss: 0.9253, test_loss: 0.9807, test_f1: 0.5144
 epoch: 88, train_loss: 0.9208, test_loss: 0.9766, test_f1: 0.5380
 epoch: 89, train_loss: 0.9284, test_loss: 0.9728, test_f1: 0.5186
 epoch: 90, train_loss: 0.9196, test_loss: 0.9723, test_f1: 0.5328
 epoch: 91, train_loss: 0.9287, test_loss: 0.9724, test_f1: 0.5318
 epoch: 92, train_loss: 0.9173, test_loss: 0.9692, test_f1: 0.5277
 epoch: 93, train_loss: 0.9167, test_loss: 0.9713, test_f1: 0.5262
 epoch: 94, train_loss: 0.9102, test_loss: 0.9718, test_f1: 0.5316
 epoch: 95, train_loss: 0.9199, test_loss: 0.9741, test_f1: 0.5236
 epoch: 96, train_loss: 0.9207, test_loss: 0.9683, test_f1: 0.5310
 epoch: 97, train_loss: 0.9239, test_loss: 0.9685, test_f1: 0.5100
 epoch: 98, train_loss: 0.9189, test_loss: 0.9683, test_f1: 0.5176
 epoch: 99, train_loss: 0.9076, test_loss: 0.9657, test_f1: 0.5171
##################ITERATION #1 ****************************************
 epoch: 0, train_loss: 1.3663, test_loss: 1.3741, test_f1: 0.1004
 epoch: 1, train_loss: 1.3412, test_loss: 1.3635, test_f1: 0.1099
 epoch: 2, train_loss: 1.3242, test_loss: 1.3209, test_f1: 0.3292
 epoch: 3, train_loss: 1.3061, test_loss: 1.2966, test_f1: 0.4041
 epoch: 4, train_loss: 1.2865, test_loss: 1.2733, test_f1: 0.3924
 epoch: 5, train_loss: 1.2677, test_loss: 1.2507, test_f1: 0.3448
 epoch: 6, train_loss: 1.2458, test_loss: 1.2314, test_f1: 0.3451
 epoch: 7, train_loss: 1.2262, test_loss: 1.2093, test_f1: 0.3432
 epoch: 8, train_loss: 1.2078, test_loss: 1.1889, test_f1: 0.3460
 epoch: 9, train_loss: 1.1924, test_loss: 1.1732, test_f1: 0.3460
 epoch: 10, train_loss: 1.1752, test_loss: 1.1553, test_f1: 0.3460
 epoch: 11, train_loss: 1.1625, test_loss: 1.1424, test_f1: 0.3460
 epoch: 12, train_loss: 1.1482, test_loss: 1.1278, test_f1: 0.3441
 epoch: 13, train_loss: 1.1373, test_loss: 1.1150, test_f1: 0.3441
 epoch: 14, train_loss: 1.1273, test_loss: 1.1076, test_f1: 0.3371
 epoch: 15, train_loss: 1.1150, test_loss: 1.0982, test_f1: 0.3392
 epoch: 16, train_loss: 1.1055, test_loss: 1.0884, test_f1: 0.3401
 epoch: 17, train_loss: 1.0906, test_loss: 1.0807, test_f1: 0.3401
 epoch: 18, train_loss: 1.0833, test_loss: 1.0740, test_f1: 0.3369
 epoch: 19, train_loss: 1.0779, test_loss: 1.0696, test_f1: 0.3373
 epoch: 20, train_loss: 1.0753, test_loss: 1.0643, test_f1: 0.3359
 epoch: 21, train_loss: 1.0637, test_loss: 1.0608, test_f1: 0.3368
 epoch: 22, train_loss: 1.0588, test_loss: 1.0592, test_f1: 0.3381
 epoch: 23, train_loss: 1.0473, test_loss: 1.0524, test_f1: 0.3515
 epoch: 24, train_loss: 1.0412, test_loss: 1.0523, test_f1: 0.3560
 epoch: 25, train_loss: 1.0389, test_loss: 1.0573, test_f1: 0.3666
 epoch: 26, train_loss: 1.0361, test_loss: 1.0510, test_f1: 0.3910
 epoch: 27, train_loss: 1.0332, test_loss: 1.0464, test_f1: 0.4041
 epoch: 28, train_loss: 1.0297, test_loss: 1.0453, test_f1: 0.4269
 epoch: 29, train_loss: 1.0206, test_loss: 1.0449, test_f1: 0.4327
 epoch: 30, train_loss: 1.0217, test_loss: 1.0406, test_f1: 0.4574
 epoch: 31, train_loss: 1.0161, test_loss: 1.0395, test_f1: 0.4236
 epoch: 32, train_loss: 1.0120, test_loss: 1.0465, test_f1: 0.4321
 epoch: 33, train_loss: 1.0082, test_loss: 1.0359, test_f1: 0.4603
 epoch: 34, train_loss: 1.0060, test_loss: 1.0328, test_f1: 0.4652
 epoch: 35, train_loss: 0.9954, test_loss: 1.0177, test_f1: 0.4656
 epoch: 36, train_loss: 0.9968, test_loss: 1.0188, test_f1: 0.4575
 epoch: 37, train_loss: 0.9898, test_loss: 1.0219, test_f1: 0.4663
 epoch: 38, train_loss: 0.9899, test_loss: 1.0166, test_f1: 0.4597
 epoch: 39, train_loss: 0.9799, test_loss: 1.0295, test_f1: 0.4579
 epoch: 40, train_loss: 0.9745, test_loss: 1.0121, test_f1: 0.4677
 epoch: 41, train_loss: 0.9728, test_loss: 0.9971, test_f1: 0.4924
 epoch: 42, train_loss: 0.9701, test_loss: 1.0010, test_f1: 0.5034
 epoch: 43, train_loss: 0.9657, test_loss: 0.9944, test_f1: 0.4891
 epoch: 44, train_loss: 0.9636, test_loss: 0.9845, test_f1: 0.5083
 epoch: 45, train_loss: 0.9592, test_loss: 0.9889, test_f1: 0.5004
 epoch: 46, train_loss: 0.9511, test_loss: 0.9762, test_f1: 0.5111
 epoch: 47, train_loss: 0.9502, test_loss: 0.9830, test_f1: 0.5278
 epoch: 48, train_loss: 0.9501, test_loss: 0.9809, test_f1: 0.5021
 epoch: 49, train_loss: 0.9414, test_loss: 0.9897, test_f1: 0.5110
 epoch: 50, train_loss: 0.9302, test_loss: 0.9666, test_f1: 0.4990
 epoch: 51, train_loss: 0.9426, test_loss: 0.9739, test_f1: 0.4985
 epoch: 52, train_loss: 0.9332, test_loss: 0.9739, test_f1: 0.5051
 epoch: 53, train_loss: 0.9307, test_loss: 0.9712, test_f1: 0.5034
 epoch: 54, train_loss: 0.9307, test_loss: 0.9622, test_f1: 0.5163
 epoch: 55, train_loss: 0.9231, test_loss: 0.9638, test_f1: 0.5059
 epoch: 56, train_loss: 0.9289, test_loss: 0.9595, test_f1: 0.5060
 epoch: 57, train_loss: 0.9267, test_loss: 0.9576, test_f1: 0.5022
 epoch: 58, train_loss: 0.9252, test_loss: 0.9519, test_f1: 0.4998
 epoch: 59, train_loss: 0.9226, test_loss: 0.9473, test_f1: 0.4992
 epoch: 60, train_loss: 0.9187, test_loss: 0.9480, test_f1: 0.5109
 epoch: 61, train_loss: 0.9186, test_loss: 0.9430, test_f1: 0.5021
 epoch: 62, train_loss: 0.9136, test_loss: 0.9406, test_f1: 0.4993
 epoch: 63, train_loss: 0.9230, test_loss: 0.9409, test_f1: 0.5046
 epoch: 64, train_loss: 0.9165, test_loss: 0.9404, test_f1: 0.5080
 epoch: 65, train_loss: 0.9142, test_loss: 0.9423, test_f1: 0.5224
 epoch: 66, train_loss: 0.9148, test_loss: 0.9441, test_f1: 0.5099
 epoch: 67, train_loss: 0.9108, test_loss: 0.9362, test_f1: 0.5116
 epoch: 68, train_loss: 0.9082, test_loss: 0.9330, test_f1: 0.5064
 epoch: 69, train_loss: 0.9174, test_loss: 0.9239, test_f1: 0.5241
 epoch: 70, train_loss: 0.9103, test_loss: 0.9269, test_f1: 0.5137
 epoch: 71, train_loss: 0.9074, test_loss: 0.9363, test_f1: 0.5226
 epoch: 72, train_loss: 0.9092, test_loss: 0.9308, test_f1: 0.5138
 epoch: 73, train_loss: 0.9052, test_loss: 0.9177, test_f1: 0.5139
 epoch: 74, train_loss: 0.9052, test_loss: 0.9293, test_f1: 0.5140
 epoch: 75, train_loss: 0.8986, test_loss: 0.9221, test_f1: 0.5281
 epoch: 76, train_loss: 0.9019, test_loss: 0.9145, test_f1: 0.5384
 epoch: 77, train_loss: 0.9034, test_loss: 0.9225, test_f1: 0.5262
 epoch: 78, train_loss: 0.9013, test_loss: 0.9213, test_f1: 0.5239
 epoch: 79, train_loss: 0.8943, test_loss: 0.9129, test_f1: 0.5308
 epoch: 80, train_loss: 0.9072, test_loss: 0.9165, test_f1: 0.5241
 epoch: 81, train_loss: 0.8935, test_loss: 0.9156, test_f1: 0.5161
 epoch: 82, train_loss: 0.8944, test_loss: 0.9228, test_f1: 0.5282
 epoch: 83, train_loss: 0.8964, test_loss: 0.9212, test_f1: 0.5354
 epoch: 84, train_loss: 0.8945, test_loss: 0.9271, test_f1: 0.5249
 epoch: 85, train_loss: 0.8940, test_loss: 0.9179, test_f1: 0.5243
 epoch: 86, train_loss: 0.8904, test_loss: 0.9105, test_f1: 0.5199
 epoch: 87, train_loss: 0.8935, test_loss: 0.9227, test_f1: 0.5260
 epoch: 88, train_loss: 0.8945, test_loss: 0.9149, test_f1: 0.5250
 epoch: 89, train_loss: 0.8894, test_loss: 0.9045, test_f1: 0.5285
 epoch: 90, train_loss: 0.8883, test_loss: 0.9173, test_f1: 0.5333
 epoch: 91, train_loss: 0.8839, test_loss: 0.9037, test_f1: 0.5341
 epoch: 92, train_loss: 0.8920, test_loss: 0.9084, test_f1: 0.5375
 epoch: 93, train_loss: 0.8892, test_loss: 0.9082, test_f1: 0.5359
 epoch: 94, train_loss: 0.8845, test_loss: 0.8983, test_f1: 0.5364
 epoch: 95, train_loss: 0.8858, test_loss: 0.9066, test_f1: 0.5315
 epoch: 96, train_loss: 0.8750, test_loss: 0.8973, test_f1: 0.5312
 epoch: 97, train_loss: 0.8879, test_loss: 0.9016, test_f1: 0.5351
 epoch: 98, train_loss: 0.8913, test_loss: 0.9010, test_f1: 0.5377
 epoch: 99, train_loss: 0.8877, test_loss: 0.9086, test_f1: 0.5375
##################ITERATION #2 ****************************************
 epoch: 0, train_loss: 1.3185, test_loss: 1.3397, test_f1: 0.1125
 epoch: 1, train_loss: 1.2859, test_loss: 1.3103, test_f1: 0.2545
 epoch: 2, train_loss: 1.2648, test_loss: 1.2666, test_f1: 0.3017
 epoch: 3, train_loss: 1.2439, test_loss: 1.2371, test_f1: 0.3422
 epoch: 4, train_loss: 1.2245, test_loss: 1.2100, test_f1: 0.3658
 epoch: 5, train_loss: 1.2018, test_loss: 1.1871, test_f1: 0.3460
 epoch: 6, train_loss: 1.1814, test_loss: 1.1694, test_f1: 0.3274
 epoch: 7, train_loss: 1.1643, test_loss: 1.1526, test_f1: 0.3241
 epoch: 8, train_loss: 1.1473, test_loss: 1.1384, test_f1: 0.3219
 epoch: 9, train_loss: 1.1349, test_loss: 1.1253, test_f1: 0.3222
 epoch: 10, train_loss: 1.1169, test_loss: 1.1100, test_f1: 0.3253
 epoch: 11, train_loss: 1.1099, test_loss: 1.1004, test_f1: 0.3393
 epoch: 12, train_loss: 1.0926, test_loss: 1.0983, test_f1: 0.3422
 epoch: 13, train_loss: 1.0839, test_loss: 1.0828, test_f1: 0.3847
 epoch: 14, train_loss: 1.0718, test_loss: 1.0828, test_f1: 0.3845
 epoch: 15, train_loss: 1.0621, test_loss: 1.0705, test_f1: 0.4056
 epoch: 16, train_loss: 1.0475, test_loss: 1.0772, test_f1: 0.3857
 epoch: 17, train_loss: 1.0441, test_loss: 1.0602, test_f1: 0.4332
 epoch: 18, train_loss: 1.0351, test_loss: 1.0644, test_f1: 0.4086
 epoch: 19, train_loss: 1.0240, test_loss: 1.0459, test_f1: 0.4369
 epoch: 20, train_loss: 1.0191, test_loss: 1.0469, test_f1: 0.4432
 epoch: 21, train_loss: 1.0159, test_loss: 1.0640, test_f1: 0.4236
 epoch: 22, train_loss: 1.0130, test_loss: 1.0615, test_f1: 0.4234
 epoch: 23, train_loss: 1.0060, test_loss: 1.0337, test_f1: 0.4448
 epoch: 24, train_loss: 0.9989, test_loss: 1.0421, test_f1: 0.4573
 epoch: 25, train_loss: 0.9900, test_loss: 1.0347, test_f1: 0.4545
 epoch: 26, train_loss: 0.9833, test_loss: 1.0292, test_f1: 0.4606
 epoch: 27, train_loss: 0.9839, test_loss: 1.0265, test_f1: 0.4521
 epoch: 28, train_loss: 0.9768, test_loss: 1.0171, test_f1: 0.4574
 epoch: 29, train_loss: 0.9673, test_loss: 1.0180, test_f1: 0.4551
 epoch: 30, train_loss: 0.9663, test_loss: 1.0732, test_f1: 0.4388
 epoch: 31, train_loss: 0.9638, test_loss: 1.0216, test_f1: 0.4791
 epoch: 32, train_loss: 0.9619, test_loss: 1.0153, test_f1: 0.4784
 epoch: 33, train_loss: 0.9545, test_loss: 1.0151, test_f1: 0.4820
 epoch: 34, train_loss: 0.9592, test_loss: 1.0414, test_f1: 0.4446
 epoch: 35, train_loss: 0.9489, test_loss: 1.0189, test_f1: 0.4845
 epoch: 36, train_loss: 0.9526, test_loss: 1.0009, test_f1: 0.5024
 epoch: 37, train_loss: 0.9413, test_loss: 0.9994, test_f1: 0.4978
 epoch: 38, train_loss: 0.9397, test_loss: 1.0085, test_f1: 0.4901
 epoch: 39, train_loss: 0.9345, test_loss: 1.0169, test_f1: 0.4784
 epoch: 40, train_loss: 0.9306, test_loss: 0.9949, test_f1: 0.4986
 epoch: 41, train_loss: 0.9306, test_loss: 1.0068, test_f1: 0.4890
 epoch: 42, train_loss: 0.9241, test_loss: 1.0064, test_f1: 0.5070
 epoch: 43, train_loss: 0.9259, test_loss: 0.9866, test_f1: 0.4940
 epoch: 44, train_loss: 0.9293, test_loss: 1.0168, test_f1: 0.4759
 epoch: 45, train_loss: 0.9240, test_loss: 1.0108, test_f1: 0.4924
 epoch: 46, train_loss: 0.9292, test_loss: 0.9850, test_f1: 0.5094
 epoch: 47, train_loss: 0.9191, test_loss: 0.9550, test_f1: 0.5109
 epoch: 48, train_loss: 0.9206, test_loss: 1.0187, test_f1: 0.4969
 epoch: 49, train_loss: 0.9254, test_loss: 1.0063, test_f1: 0.4867
 epoch: 50, train_loss: 0.9148, test_loss: 0.9672, test_f1: 0.5176
 epoch: 51, train_loss: 0.9081, test_loss: 0.9611, test_f1: 0.5158
 epoch: 52, train_loss: 0.9078, test_loss: 0.9584, test_f1: 0.5134
 epoch: 53, train_loss: 0.8998, test_loss: 0.9674, test_f1: 0.5168
 epoch: 54, train_loss: 0.9042, test_loss: 0.9644, test_f1: 0.5158
 epoch: 55, train_loss: 0.9072, test_loss: 0.9591, test_f1: 0.5092
 epoch: 56, train_loss: 0.9003, test_loss: 0.9554, test_f1: 0.5147
 epoch: 57, train_loss: 0.9005, test_loss: 0.9498, test_f1: 0.5169
 epoch: 58, train_loss: 0.8949, test_loss: 0.9740, test_f1: 0.5153
 epoch: 59, train_loss: 0.8981, test_loss: 0.9600, test_f1: 0.5208
 epoch: 60, train_loss: 0.8964, test_loss: 0.9664, test_f1: 0.5170
 epoch: 61, train_loss: 0.8936, test_loss: 0.9485, test_f1: 0.5166
 epoch: 62, train_loss: 0.8937, test_loss: 0.9577, test_f1: 0.5214
 epoch: 63, train_loss: 0.8950, test_loss: 0.9487, test_f1: 0.5256
 epoch: 64, train_loss: 0.8895, test_loss: 0.9473, test_f1: 0.5187
 epoch: 65, train_loss: 0.8900, test_loss: 0.9419, test_f1: 0.5215
 epoch: 66, train_loss: 0.8901, test_loss: 0.9624, test_f1: 0.5220
 epoch: 67, train_loss: 0.8869, test_loss: 0.9452, test_f1: 0.5222
 epoch: 68, train_loss: 0.8829, test_loss: 0.9493, test_f1: 0.5202
 epoch: 69, train_loss: 0.8873, test_loss: 0.9427, test_f1: 0.5325
 epoch: 70, train_loss: 0.8861, test_loss: 0.9542, test_f1: 0.5270
 epoch: 71, train_loss: 0.8844, test_loss: 0.9448, test_f1: 0.5243
 epoch: 72, train_loss: 0.8808, test_loss: 0.9440, test_f1: 0.5215
 epoch: 73, train_loss: 0.8902, test_loss: 0.9359, test_f1: 0.5275
 epoch: 74, train_loss: 0.8823, test_loss: 0.9280, test_f1: 0.5284
 epoch: 75, train_loss: 0.8769, test_loss: 0.9374, test_f1: 0.5253
 epoch: 76, train_loss: 0.8718, test_loss: 0.9389, test_f1: 0.5417
 epoch: 77, train_loss: 0.8796, test_loss: 0.9516, test_f1: 0.5144
 epoch: 78, train_loss: 0.8800, test_loss: 0.9366, test_f1: 0.5368
 epoch: 79, train_loss: 0.8717, test_loss: 0.9274, test_f1: 0.5301
 epoch: 80, train_loss: 0.8825, test_loss: 0.9229, test_f1: 0.5283
 epoch: 81, train_loss: 0.8784, test_loss: 0.9401, test_f1: 0.5253
 epoch: 82, train_loss: 0.8793, test_loss: 0.9396, test_f1: 0.5353
 epoch: 83, train_loss: 0.8690, test_loss: 0.9328, test_f1: 0.5309
 epoch: 84, train_loss: 0.8740, test_loss: 0.9388, test_f1: 0.5316
 epoch: 85, train_loss: 0.8712, test_loss: 0.9480, test_f1: 0.5340
 epoch: 86, train_loss: 0.8693, test_loss: 0.9361, test_f1: 0.5268
 epoch: 87, train_loss: 0.8678, test_loss: 0.9470, test_f1: 0.5334
 epoch: 88, train_loss: 0.8762, test_loss: 0.9248, test_f1: 0.5335
 epoch: 89, train_loss: 0.8797, test_loss: 0.9436, test_f1: 0.5325
 epoch: 90, train_loss: 0.8713, test_loss: 0.9402, test_f1: 0.5294
 epoch: 91, train_loss: 0.8673, test_loss: 0.9376, test_f1: 0.5313
 epoch: 92, train_loss: 0.8602, test_loss: 0.9315, test_f1: 0.5361
 epoch: 93, train_loss: 0.8619, test_loss: 0.9247, test_f1: 0.5281
 epoch: 94, train_loss: 0.8656, test_loss: 0.9357, test_f1: 0.5299
 epoch: 95, train_loss: 0.8683, test_loss: 0.9244, test_f1: 0.5378
 epoch: 96, train_loss: 0.8655, test_loss: 0.9294, test_f1: 0.5302
 epoch: 97, train_loss: 0.8684, test_loss: 0.9459, test_f1: 0.5244
 epoch: 98, train_loss: 0.8579, test_loss: 0.9318, test_f1: 0.5325
 epoch: 99, train_loss: 0.8570, test_loss: 0.9171, test_f1: 0.5437
##################ITERATION #3 ****************************************
 epoch: 0, train_loss: 1.3136, test_loss: 1.3170, test_f1: 0.2270
 epoch: 1, train_loss: 1.2684, test_loss: 1.2701, test_f1: 0.2270
 epoch: 2, train_loss: 1.2417, test_loss: 1.2286, test_f1: 0.2912
 epoch: 3, train_loss: 1.2206, test_loss: 1.1953, test_f1: 0.3508
 epoch: 4, train_loss: 1.1999, test_loss: 1.1678, test_f1: 0.3425
 epoch: 5, train_loss: 1.1786, test_loss: 1.1454, test_f1: 0.3466
 epoch: 6, train_loss: 1.1603, test_loss: 1.1251, test_f1: 0.3511
 epoch: 7, train_loss: 1.1403, test_loss: 1.1057, test_f1: 0.3629
 epoch: 8, train_loss: 1.1281, test_loss: 1.0895, test_f1: 0.4013
 epoch: 9, train_loss: 1.1061, test_loss: 1.0750, test_f1: 0.4033
 epoch: 10, train_loss: 1.0897, test_loss: 1.0655, test_f1: 0.4141
 epoch: 11, train_loss: 1.0785, test_loss: 1.0546, test_f1: 0.4217
 epoch: 12, train_loss: 1.0654, test_loss: 1.0480, test_f1: 0.4255
 epoch: 13, train_loss: 1.0539, test_loss: 1.0398, test_f1: 0.4283
 epoch: 14, train_loss: 1.0425, test_loss: 1.0333, test_f1: 0.4286
 epoch: 15, train_loss: 1.0341, test_loss: 1.0269, test_f1: 0.4528
 epoch: 16, train_loss: 1.0251, test_loss: 1.0205, test_f1: 0.4563
 epoch: 17, train_loss: 1.0218, test_loss: 1.0162, test_f1: 0.4558
 epoch: 18, train_loss: 1.0094, test_loss: 1.0166, test_f1: 0.4693
 epoch: 19, train_loss: 1.0021, test_loss: 1.0081, test_f1: 0.4674
 epoch: 20, train_loss: 1.0018, test_loss: 1.0044, test_f1: 0.4707
 epoch: 21, train_loss: 0.9902, test_loss: 0.9929, test_f1: 0.4756
 epoch: 22, train_loss: 0.9808, test_loss: 0.9928, test_f1: 0.4759
 epoch: 23, train_loss: 0.9794, test_loss: 0.9893, test_f1: 0.4788
 epoch: 24, train_loss: 0.9748, test_loss: 0.9777, test_f1: 0.4789
 epoch: 25, train_loss: 0.9615, test_loss: 0.9913, test_f1: 0.4779
 epoch: 26, train_loss: 0.9609, test_loss: 0.9720, test_f1: 0.4907
 epoch: 27, train_loss: 0.9575, test_loss: 0.9753, test_f1: 0.4897
 epoch: 28, train_loss: 0.9565, test_loss: 0.9664, test_f1: 0.4954
 epoch: 29, train_loss: 0.9459, test_loss: 0.9749, test_f1: 0.4937
 epoch: 30, train_loss: 0.9411, test_loss: 0.9625, test_f1: 0.5017
 epoch: 31, train_loss: 0.9397, test_loss: 0.9618, test_f1: 0.5004
 epoch: 32, train_loss: 0.9318, test_loss: 0.9512, test_f1: 0.4961
 epoch: 33, train_loss: 0.9262, test_loss: 0.9543, test_f1: 0.5003
 epoch: 34, train_loss: 0.9259, test_loss: 0.9492, test_f1: 0.4966
 epoch: 35, train_loss: 0.9223, test_loss: 0.9494, test_f1: 0.4992
 epoch: 36, train_loss: 0.9076, test_loss: 0.9423, test_f1: 0.5097
 epoch: 37, train_loss: 0.9166, test_loss: 0.9415, test_f1: 0.5071
 epoch: 38, train_loss: 0.9127, test_loss: 0.9268, test_f1: 0.5199
 epoch: 39, train_loss: 0.9072, test_loss: 0.9349, test_f1: 0.5226
 epoch: 40, train_loss: 0.9042, test_loss: 0.9421, test_f1: 0.5114
 epoch: 41, train_loss: 0.9033, test_loss: 0.9373, test_f1: 0.5172
 epoch: 42, train_loss: 0.8941, test_loss: 0.9350, test_f1: 0.5164
 epoch: 43, train_loss: 0.8997, test_loss: 0.9198, test_f1: 0.5106
 epoch: 44, train_loss: 0.8918, test_loss: 0.9102, test_f1: 0.5172
 epoch: 45, train_loss: 0.8883, test_loss: 0.9214, test_f1: 0.5161
 epoch: 46, train_loss: 0.8955, test_loss: 0.9150, test_f1: 0.5274
 epoch: 47, train_loss: 0.8804, test_loss: 0.9147, test_f1: 0.5128
 epoch: 48, train_loss: 0.8812, test_loss: 0.9292, test_f1: 0.5069
 epoch: 49, train_loss: 0.8920, test_loss: 0.9326, test_f1: 0.5111
 epoch: 50, train_loss: 0.8788, test_loss: 0.9236, test_f1: 0.5187
 epoch: 51, train_loss: 0.8731, test_loss: 0.9224, test_f1: 0.5139
 epoch: 52, train_loss: 0.8643, test_loss: 0.9119, test_f1: 0.5186
 epoch: 53, train_loss: 0.8741, test_loss: 0.9056, test_f1: 0.5187
 epoch: 54, train_loss: 0.8605, test_loss: 0.9065, test_f1: 0.5215
 epoch: 55, train_loss: 0.8705, test_loss: 0.9124, test_f1: 0.5086
 epoch: 56, train_loss: 0.8668, test_loss: 0.8997, test_f1: 0.5233
 epoch: 57, train_loss: 0.8658, test_loss: 0.9075, test_f1: 0.5251
 epoch: 58, train_loss: 0.8626, test_loss: 0.9088, test_f1: 0.5158
 epoch: 59, train_loss: 0.8584, test_loss: 0.9058, test_f1: 0.5201
 epoch: 60, train_loss: 0.8598, test_loss: 0.9169, test_f1: 0.5135
 epoch: 61, train_loss: 0.8573, test_loss: 0.9065, test_f1: 0.5208
 epoch: 62, train_loss: 0.8528, test_loss: 0.9109, test_f1: 0.5195
 epoch: 63, train_loss: 0.8584, test_loss: 0.9069, test_f1: 0.5232
 epoch: 64, train_loss: 0.8648, test_loss: 0.9113, test_f1: 0.5221
 epoch: 65, train_loss: 0.8554, test_loss: 0.9075, test_f1: 0.5193
 epoch: 66, train_loss: 0.8551, test_loss: 0.8990, test_f1: 0.5235
 epoch: 67, train_loss: 0.8500, test_loss: 0.9037, test_f1: 0.5219
 epoch: 68, train_loss: 0.8551, test_loss: 0.9056, test_f1: 0.5193
 epoch: 69, train_loss: 0.8549, test_loss: 0.9106, test_f1: 0.5194
 epoch: 70, train_loss: 0.8506, test_loss: 0.9029, test_f1: 0.5262
 epoch: 71, train_loss: 0.8443, test_loss: 0.9176, test_f1: 0.5162
 epoch: 72, train_loss: 0.8440, test_loss: 0.9084, test_f1: 0.5131
 epoch: 73, train_loss: 0.8492, test_loss: 0.9029, test_f1: 0.5350
 epoch: 74, train_loss: 0.8466, test_loss: 0.9262, test_f1: 0.5183
 epoch: 75, train_loss: 0.8438, test_loss: 0.8965, test_f1: 0.5199
 epoch: 76, train_loss: 0.8466, test_loss: 0.9085, test_f1: 0.5185
 epoch: 77, train_loss: 0.8483, test_loss: 0.9046, test_f1: 0.5210
 epoch: 78, train_loss: 0.8344, test_loss: 0.9008, test_f1: 0.5285
 epoch: 79, train_loss: 0.8375, test_loss: 0.8951, test_f1: 0.5194
 epoch: 80, train_loss: 0.8505, test_loss: 0.9121, test_f1: 0.5309
 epoch: 81, train_loss: 0.8436, test_loss: 0.9143, test_f1: 0.5202
 epoch: 82, train_loss: 0.8364, test_loss: 0.8938, test_f1: 0.5180
 epoch: 83, train_loss: 0.8385, test_loss: 0.9048, test_f1: 0.5307
 epoch: 84, train_loss: 0.8294, test_loss: 0.9025, test_f1: 0.5299
 epoch: 85, train_loss: 0.8362, test_loss: 0.9016, test_f1: 0.5211
 epoch: 86, train_loss: 0.8278, test_loss: 0.9081, test_f1: 0.5172
 epoch: 87, train_loss: 0.8319, test_loss: 0.9063, test_f1: 0.5332
 epoch: 88, train_loss: 0.8304, test_loss: 0.8990, test_f1: 0.5189
 epoch: 89, train_loss: 0.8318, test_loss: 0.9015, test_f1: 0.5183
 epoch: 90, train_loss: 0.8261, test_loss: 0.9118, test_f1: 0.5214
 epoch: 91, train_loss: 0.8239, test_loss: 0.9185, test_f1: 0.5313
 epoch: 92, train_loss: 0.8312, test_loss: 0.8842, test_f1: 0.5281
 epoch: 93, train_loss: 0.8266, test_loss: 0.9063, test_f1: 0.5179
 epoch: 94, train_loss: 0.8273, test_loss: 0.8987, test_f1: 0.5342
 epoch: 95, train_loss: 0.8213, test_loss: 0.9071, test_f1: 0.5245
 epoch: 96, train_loss: 0.8190, test_loss: 0.9009, test_f1: 0.5263
 epoch: 97, train_loss: 0.8155, test_loss: 0.8887, test_f1: 0.5278
 epoch: 98, train_loss: 0.8277, test_loss: 0.9027, test_f1: 0.5265
 epoch: 99, train_loss: 0.8173, test_loss: 0.9049, test_f1: 0.5202
##################ITERATION #4 ****************************************
 epoch: 0, train_loss: 1.2857, test_loss: 1.3115, test_f1: 0.2270
 epoch: 1, train_loss: 1.2482, test_loss: 1.2757, test_f1: 0.2594
 epoch: 2, train_loss: 1.2322, test_loss: 1.2121, test_f1: 0.2702
 epoch: 3, train_loss: 1.2070, test_loss: 1.1779, test_f1: 0.3641
 epoch: 4, train_loss: 1.1862, test_loss: 1.1492, test_f1: 0.4216
 epoch: 5, train_loss: 1.1606, test_loss: 1.1208, test_f1: 0.4317
 epoch: 6, train_loss: 1.1359, test_loss: 1.0989, test_f1: 0.4471
 epoch: 7, train_loss: 1.1160, test_loss: 1.0796, test_f1: 0.4452
 epoch: 8, train_loss: 1.0982, test_loss: 1.0659, test_f1: 0.4504
 epoch: 9, train_loss: 1.0827, test_loss: 1.0524, test_f1: 0.4658
 epoch: 10, train_loss: 1.0701, test_loss: 1.0396, test_f1: 0.4605
 epoch: 11, train_loss: 1.0671, test_loss: 1.0338, test_f1: 0.4772
 epoch: 12, train_loss: 1.0490, test_loss: 1.0274, test_f1: 0.4767
 epoch: 13, train_loss: 1.0379, test_loss: 1.0223, test_f1: 0.4716
 epoch: 14, train_loss: 1.0345, test_loss: 1.0080, test_f1: 0.4746
 epoch: 15, train_loss: 1.0273, test_loss: 1.0097, test_f1: 0.4856
 epoch: 16, train_loss: 1.0170, test_loss: 0.9960, test_f1: 0.4885
 epoch: 17, train_loss: 1.0202, test_loss: 0.9922, test_f1: 0.4985
 epoch: 18, train_loss: 1.0029, test_loss: 0.9886, test_f1: 0.4786
 epoch: 19, train_loss: 1.0018, test_loss: 0.9882, test_f1: 0.4857
 epoch: 20, train_loss: 0.9913, test_loss: 0.9852, test_f1: 0.4864
 epoch: 21, train_loss: 0.9927, test_loss: 0.9794, test_f1: 0.4971
 epoch: 22, train_loss: 0.9918, test_loss: 0.9803, test_f1: 0.4936
 epoch: 23, train_loss: 0.9829, test_loss: 0.9690, test_f1: 0.5038
 epoch: 24, train_loss: 0.9768, test_loss: 0.9566, test_f1: 0.5006
 epoch: 25, train_loss: 0.9740, test_loss: 0.9553, test_f1: 0.5059
 epoch: 26, train_loss: 0.9708, test_loss: 0.9516, test_f1: 0.5072
 epoch: 27, train_loss: 0.9662, test_loss: 0.9459, test_f1: 0.5197
 epoch: 28, train_loss: 0.9662, test_loss: 0.9479, test_f1: 0.5088
 epoch: 29, train_loss: 0.9557, test_loss: 0.9632, test_f1: 0.4968
 epoch: 30, train_loss: 0.9602, test_loss: 0.9475, test_f1: 0.5140
 epoch: 31, train_loss: 0.9551, test_loss: 0.9423, test_f1: 0.5021
 epoch: 32, train_loss: 0.9488, test_loss: 0.9399, test_f1: 0.5171
 epoch: 33, train_loss: 0.9489, test_loss: 0.9350, test_f1: 0.5073
 epoch: 34, train_loss: 0.9415, test_loss: 0.9358, test_f1: 0.5121
 epoch: 35, train_loss: 0.9378, test_loss: 0.9346, test_f1: 0.5201
 epoch: 36, train_loss: 0.9426, test_loss: 0.9320, test_f1: 0.5117
 epoch: 37, train_loss: 0.9400, test_loss: 0.9227, test_f1: 0.5222
 epoch: 38, train_loss: 0.9303, test_loss: 0.9272, test_f1: 0.5137
 epoch: 39, train_loss: 0.9353, test_loss: 0.9296, test_f1: 0.5193
 epoch: 40, train_loss: 0.9206, test_loss: 0.9213, test_f1: 0.5287
 epoch: 41, train_loss: 0.9294, test_loss: 0.9150, test_f1: 0.5238
 epoch: 42, train_loss: 0.9232, test_loss: 0.9112, test_f1: 0.5261
 epoch: 43, train_loss: 0.9161, test_loss: 0.9251, test_f1: 0.5182
 epoch: 44, train_loss: 0.9175, test_loss: 0.8994, test_f1: 0.5233
 epoch: 45, train_loss: 0.9166, test_loss: 0.9186, test_f1: 0.5112
 epoch: 46, train_loss: 0.9182, test_loss: 0.9074, test_f1: 0.5268
 epoch: 47, train_loss: 0.9172, test_loss: 0.8919, test_f1: 0.5211
 epoch: 48, train_loss: 0.9091, test_loss: 0.8981, test_f1: 0.5187
 epoch: 49, train_loss: 0.8990, test_loss: 0.9029, test_f1: 0.5219
 epoch: 50, train_loss: 0.8964, test_loss: 0.9048, test_f1: 0.5224
 epoch: 51, train_loss: 0.8963, test_loss: 0.8927, test_f1: 0.5265
 epoch: 52, train_loss: 0.8960, test_loss: 0.8917, test_f1: 0.5232
 epoch: 53, train_loss: 0.9019, test_loss: 0.8880, test_f1: 0.5236
 epoch: 54, train_loss: 0.8864, test_loss: 0.8950, test_f1: 0.5234
 epoch: 55, train_loss: 0.8881, test_loss: 0.8865, test_f1: 0.5257
 epoch: 56, train_loss: 0.8901, test_loss: 0.8876, test_f1: 0.5229
 epoch: 57, train_loss: 0.8821, test_loss: 0.8900, test_f1: 0.5239
 epoch: 58, train_loss: 0.8832, test_loss: 0.8815, test_f1: 0.5306
 epoch: 59, train_loss: 0.8937, test_loss: 0.8859, test_f1: 0.5211
 epoch: 60, train_loss: 0.8895, test_loss: 0.8898, test_f1: 0.5276
 epoch: 61, train_loss: 0.8826, test_loss: 0.8835, test_f1: 0.5274
 epoch: 62, train_loss: 0.8853, test_loss: 0.8853, test_f1: 0.5260
 epoch: 63, train_loss: 0.8868, test_loss: 0.8840, test_f1: 0.5277
 epoch: 64, train_loss: 0.8822, test_loss: 0.8836, test_f1: 0.5262
 epoch: 65, train_loss: 0.8881, test_loss: 0.8809, test_f1: 0.5279
 epoch: 66, train_loss: 0.8785, test_loss: 0.8778, test_f1: 0.5307
 epoch: 67, train_loss: 0.8802, test_loss: 0.8833, test_f1: 0.5287
 epoch: 68, train_loss: 0.8750, test_loss: 0.8795, test_f1: 0.5305
 epoch: 69, train_loss: 0.8736, test_loss: 0.8829, test_f1: 0.5245
 epoch: 70, train_loss: 0.8689, test_loss: 0.8720, test_f1: 0.5323
 epoch: 71, train_loss: 0.8719, test_loss: 0.8813, test_f1: 0.5275
 epoch: 72, train_loss: 0.8679, test_loss: 0.8779, test_f1: 0.5288
 epoch: 73, train_loss: 0.8715, test_loss: 0.8825, test_f1: 0.5266
 epoch: 74, train_loss: 0.8678, test_loss: 0.8761, test_f1: 0.5246
 epoch: 75, train_loss: 0.8723, test_loss: 0.8767, test_f1: 0.5274
 epoch: 76, train_loss: 0.8618, test_loss: 0.8814, test_f1: 0.5252
 epoch: 77, train_loss: 0.8682, test_loss: 0.8768, test_f1: 0.5307
 epoch: 78, train_loss: 0.8650, test_loss: 0.8769, test_f1: 0.5286
 epoch: 79, train_loss: 0.8673, test_loss: 0.8736, test_f1: 0.5288
 epoch: 80, train_loss: 0.8639, test_loss: 0.8712, test_f1: 0.5306
 epoch: 81, train_loss: 0.8647, test_loss: 0.8710, test_f1: 0.5294
 epoch: 82, train_loss: 0.8686, test_loss: 0.8673, test_f1: 0.5262
 epoch: 83, train_loss: 0.8659, test_loss: 0.8750, test_f1: 0.5222
 epoch: 84, train_loss: 0.8620, test_loss: 0.8758, test_f1: 0.5276
 epoch: 85, train_loss: 0.8579, test_loss: 0.8715, test_f1: 0.5262
 epoch: 86, train_loss: 0.8600, test_loss: 0.8668, test_f1: 0.5281
 epoch: 87, train_loss: 0.8671, test_loss: 0.8698, test_f1: 0.5277
 epoch: 88, train_loss: 0.8585, test_loss: 0.8684, test_f1: 0.5344
 epoch: 89, train_loss: 0.8495, test_loss: 0.8628, test_f1: 0.5255
 epoch: 90, train_loss: 0.8586, test_loss: 0.8625, test_f1: 0.5300
 epoch: 91, train_loss: 0.8547, test_loss: 0.8723, test_f1: 0.5247
 epoch: 92, train_loss: 0.8572, test_loss: 0.8687, test_f1: 0.5212
 epoch: 93, train_loss: 0.8539, test_loss: 0.8712, test_f1: 0.5256
 epoch: 94, train_loss: 0.8580, test_loss: 0.8660, test_f1: 0.5282
 epoch: 95, train_loss: 0.8482, test_loss: 0.8610, test_f1: 0.5274
 epoch: 96, train_loss: 0.8478, test_loss: 0.8627, test_f1: 0.5323
 epoch: 97, train_loss: 0.8509, test_loss: 0.8699, test_f1: 0.5278
 epoch: 98, train_loss: 0.8548, test_loss: 0.8643, test_f1: 0.5295
 epoch: 99, train_loss: 0.8473, test_loss: 0.8652, test_f1: 0.5273
##################ITERATION #5 ****************************************
 epoch: 0, train_loss: 1.2806, test_loss: 1.3222, test_f1: 0.2270
 epoch: 1, train_loss: 1.2318, test_loss: 1.2842, test_f1: 0.2270
 epoch: 2, train_loss: 1.2063, test_loss: 1.1810, test_f1: 0.3328
 epoch: 3, train_loss: 1.1807, test_loss: 1.1400, test_f1: 0.3996
 epoch: 4, train_loss: 1.1494, test_loss: 1.1076, test_f1: 0.4058
 epoch: 5, train_loss: 1.1275, test_loss: 1.0907, test_f1: 0.4246
 epoch: 6, train_loss: 1.1080, test_loss: 1.0752, test_f1: 0.4327
 epoch: 7, train_loss: 1.0934, test_loss: 1.0647, test_f1: 0.4456
 epoch: 8, train_loss: 1.0779, test_loss: 1.0578, test_f1: 0.4512
 epoch: 9, train_loss: 1.0613, test_loss: 1.0506, test_f1: 0.4623
 epoch: 10, train_loss: 1.0564, test_loss: 1.0420, test_f1: 0.4609
 epoch: 11, train_loss: 1.0379, test_loss: 1.0380, test_f1: 0.4630
 epoch: 12, train_loss: 1.0332, test_loss: 1.0266, test_f1: 0.4738
 epoch: 13, train_loss: 1.0246, test_loss: 1.0250, test_f1: 0.4640
 epoch: 14, train_loss: 1.0131, test_loss: 1.0149, test_f1: 0.4764
 epoch: 15, train_loss: 1.0056, test_loss: 1.0076, test_f1: 0.4862
 epoch: 16, train_loss: 0.9959, test_loss: 0.9992, test_f1: 0.4799
 epoch: 17, train_loss: 0.9948, test_loss: 1.0093, test_f1: 0.4695
 epoch: 18, train_loss: 0.9949, test_loss: 1.0099, test_f1: 0.4714
 epoch: 19, train_loss: 0.9798, test_loss: 0.9841, test_f1: 0.4973
 epoch: 20, train_loss: 0.9769, test_loss: 0.9780, test_f1: 0.5030
 epoch: 21, train_loss: 0.9734, test_loss: 0.9801, test_f1: 0.5066
 epoch: 22, train_loss: 0.9629, test_loss: 0.9767, test_f1: 0.4976
 epoch: 23, train_loss: 0.9641, test_loss: 0.9718, test_f1: 0.5075
 epoch: 24, train_loss: 0.9536, test_loss: 0.9700, test_f1: 0.5049
 epoch: 25, train_loss: 0.9510, test_loss: 0.9650, test_f1: 0.4964
 epoch: 26, train_loss: 0.9431, test_loss: 0.9673, test_f1: 0.5128
 epoch: 27, train_loss: 0.9405, test_loss: 0.9631, test_f1: 0.5157
 epoch: 28, train_loss: 0.9428, test_loss: 0.9617, test_f1: 0.5082
 epoch: 29, train_loss: 0.9305, test_loss: 0.9695, test_f1: 0.5128
 epoch: 30, train_loss: 0.9295, test_loss: 0.9566, test_f1: 0.5112
 epoch: 31, train_loss: 0.9385, test_loss: 0.9560, test_f1: 0.5053
 epoch: 32, train_loss: 0.9276, test_loss: 0.9667, test_f1: 0.5013
 epoch: 33, train_loss: 0.9195, test_loss: 0.9530, test_f1: 0.4993
 epoch: 34, train_loss: 0.9173, test_loss: 0.9464, test_f1: 0.5079
 epoch: 35, train_loss: 0.9152, test_loss: 0.9600, test_f1: 0.5112
 epoch: 36, train_loss: 0.9232, test_loss: 0.9453, test_f1: 0.5062
 epoch: 37, train_loss: 0.9158, test_loss: 0.9545, test_f1: 0.4996
 epoch: 38, train_loss: 0.9066, test_loss: 0.9507, test_f1: 0.4977
 epoch: 39, train_loss: 0.9087, test_loss: 0.9468, test_f1: 0.5179
 epoch: 40, train_loss: 0.9106, test_loss: 0.9630, test_f1: 0.5136
 epoch: 41, train_loss: 0.8976, test_loss: 0.9367, test_f1: 0.5146
 epoch: 42, train_loss: 0.8975, test_loss: 0.9490, test_f1: 0.5189
 epoch: 43, train_loss: 0.9011, test_loss: 0.9414, test_f1: 0.5131
 epoch: 44, train_loss: 0.8981, test_loss: 0.9276, test_f1: 0.5117
 epoch: 45, train_loss: 0.9002, test_loss: 0.9427, test_f1: 0.5257
 epoch: 46, train_loss: 0.8878, test_loss: 0.9304, test_f1: 0.5161
 epoch: 47, train_loss: 0.8853, test_loss: 0.9438, test_f1: 0.5109
 epoch: 48, train_loss: 0.8836, test_loss: 0.9101, test_f1: 0.5152
 epoch: 49, train_loss: 0.8864, test_loss: 0.9283, test_f1: 0.5015
 epoch: 50, train_loss: 0.8847, test_loss: 0.9394, test_f1: 0.5179
 epoch: 51, train_loss: 0.8792, test_loss: 0.9198, test_f1: 0.5167
 epoch: 52, train_loss: 0.8813, test_loss: 0.9229, test_f1: 0.5241
 epoch: 53, train_loss: 0.8794, test_loss: 0.9235, test_f1: 0.5348
 epoch: 54, train_loss: 0.8797, test_loss: 0.9192, test_f1: 0.5120
 epoch: 55, train_loss: 0.8776, test_loss: 0.9124, test_f1: 0.5141
 epoch: 56, train_loss: 0.8751, test_loss: 0.9250, test_f1: 0.5183
 epoch: 57, train_loss: 0.8719, test_loss: 0.9171, test_f1: 0.5167
 epoch: 58, train_loss: 0.8709, test_loss: 0.9155, test_f1: 0.5233
 epoch: 59, train_loss: 0.8722, test_loss: 0.9204, test_f1: 0.5183
 epoch: 60, train_loss: 0.8702, test_loss: 0.9131, test_f1: 0.5153
 epoch: 61, train_loss: 0.8692, test_loss: 0.9212, test_f1: 0.5187
 epoch: 62, train_loss: 0.8609, test_loss: 0.9145, test_f1: 0.5145
 epoch: 63, train_loss: 0.8702, test_loss: 0.9206, test_f1: 0.5205
 epoch: 64, train_loss: 0.8701, test_loss: 0.9126, test_f1: 0.5242
 epoch: 65, train_loss: 0.8733, test_loss: 0.9230, test_f1: 0.5031
 epoch: 66, train_loss: 0.8608, test_loss: 0.9217, test_f1: 0.5186
 epoch: 67, train_loss: 0.8564, test_loss: 0.9338, test_f1: 0.5256
 epoch: 68, train_loss: 0.8622, test_loss: 0.9108, test_f1: 0.5216
 epoch: 69, train_loss: 0.8568, test_loss: 0.8946, test_f1: 0.5267
 epoch: 70, train_loss: 0.8660, test_loss: 0.9158, test_f1: 0.5229
 epoch: 71, train_loss: 0.8576, test_loss: 0.9134, test_f1: 0.5242
 epoch: 72, train_loss: 0.8616, test_loss: 0.9077, test_f1: 0.5267
 epoch: 73, train_loss: 0.8559, test_loss: 0.9048, test_f1: 0.5243
 epoch: 74, train_loss: 0.8611, test_loss: 0.9107, test_f1: 0.5266
 epoch: 75, train_loss: 0.8561, test_loss: 0.9233, test_f1: 0.5216
 epoch: 76, train_loss: 0.8538, test_loss: 0.9176, test_f1: 0.5293
 epoch: 77, train_loss: 0.8602, test_loss: 0.9104, test_f1: 0.5220
 epoch: 78, train_loss: 0.8522, test_loss: 0.9245, test_f1: 0.5214
 epoch: 79, train_loss: 0.8559, test_loss: 0.9105, test_f1: 0.5191
 epoch: 80, train_loss: 0.8575, test_loss: 0.9075, test_f1: 0.5235
 epoch: 81, train_loss: 0.8588, test_loss: 0.9121, test_f1: 0.5193
 epoch: 82, train_loss: 0.8513, test_loss: 0.9148, test_f1: 0.5257
 epoch: 83, train_loss: 0.8454, test_loss: 0.9112, test_f1: 0.5233
 epoch: 84, train_loss: 0.8460, test_loss: 0.9062, test_f1: 0.5183
 epoch: 85, train_loss: 0.8472, test_loss: 0.9111, test_f1: 0.5237
 epoch: 86, train_loss: 0.8456, test_loss: 0.9052, test_f1: 0.5295
 epoch: 87, train_loss: 0.8486, test_loss: 0.9085, test_f1: 0.5139
 epoch: 88, train_loss: 0.8485, test_loss: 0.9250, test_f1: 0.5223
 epoch: 89, train_loss: 0.8503, test_loss: 0.9309, test_f1: 0.5192
 epoch: 90, train_loss: 0.8449, test_loss: 0.9180, test_f1: 0.5327
 epoch: 91, train_loss: 0.8441, test_loss: 0.9207, test_f1: 0.5264
 epoch: 92, train_loss: 0.8401, test_loss: 0.9076, test_f1: 0.5314
 epoch: 93, train_loss: 0.8409, test_loss: 0.9008, test_f1: 0.5301
 epoch: 94, train_loss: 0.8390, test_loss: 0.9048, test_f1: 0.5241
 epoch: 95, train_loss: 0.8442, test_loss: 0.9005, test_f1: 0.5226
 epoch: 96, train_loss: 0.8486, test_loss: 0.9038, test_f1: 0.5223
 epoch: 97, train_loss: 0.8360, test_loss: 0.9010, test_f1: 0.5244
 epoch: 98, train_loss: 0.8266, test_loss: 0.8991, test_f1: 0.5229
 epoch: 99, train_loss: 0.8356, test_loss: 0.9105, test_f1: 0.5180
##################ITERATION #6 ****************************************
 epoch: 0, train_loss: 1.3146, test_loss: 1.3437, test_f1: 0.2270
 epoch: 1, train_loss: 1.2627, test_loss: 1.2680, test_f1: 0.2270
 epoch: 2, train_loss: 1.2441, test_loss: 1.2021, test_f1: 0.2270
 epoch: 3, train_loss: 1.2144, test_loss: 1.1674, test_f1: 0.2938
 epoch: 4, train_loss: 1.1907, test_loss: 1.1354, test_f1: 0.3249
 epoch: 5, train_loss: 1.1561, test_loss: 1.1062, test_f1: 0.3795
 epoch: 6, train_loss: 1.1336, test_loss: 1.0854, test_f1: 0.3927
 epoch: 7, train_loss: 1.1158, test_loss: 1.0653, test_f1: 0.4063
 epoch: 8, train_loss: 1.1009, test_loss: 1.0530, test_f1: 0.4124
 epoch: 9, train_loss: 1.0766, test_loss: 1.0477, test_f1: 0.4214
 epoch: 10, train_loss: 1.0699, test_loss: 1.0363, test_f1: 0.4300
 epoch: 11, train_loss: 1.0566, test_loss: 1.0263, test_f1: 0.4334
 epoch: 12, train_loss: 1.0479, test_loss: 1.0294, test_f1: 0.4395
 epoch: 13, train_loss: 1.0331, test_loss: 1.0192, test_f1: 0.4595
 epoch: 14, train_loss: 1.0326, test_loss: 1.0197, test_f1: 0.4361
 epoch: 15, train_loss: 1.0271, test_loss: 1.0041, test_f1: 0.4768
 epoch: 16, train_loss: 1.0228, test_loss: 1.0103, test_f1: 0.4762
 epoch: 17, train_loss: 1.0148, test_loss: 1.0050, test_f1: 0.4715
 epoch: 18, train_loss: 1.0049, test_loss: 0.9996, test_f1: 0.4749
 epoch: 19, train_loss: 1.0060, test_loss: 0.9883, test_f1: 0.4836
 epoch: 20, train_loss: 0.9998, test_loss: 0.9876, test_f1: 0.5053
 epoch: 21, train_loss: 0.9978, test_loss: 1.0001, test_f1: 0.4832
 epoch: 22, train_loss: 0.9855, test_loss: 0.9785, test_f1: 0.4892
 epoch: 23, train_loss: 0.9835, test_loss: 0.9838, test_f1: 0.4915
 epoch: 24, train_loss: 0.9773, test_loss: 0.9766, test_f1: 0.5024
 epoch: 25, train_loss: 0.9769, test_loss: 0.9750, test_f1: 0.4886
 epoch: 26, train_loss: 0.9663, test_loss: 0.9676, test_f1: 0.4919
 epoch: 27, train_loss: 0.9643, test_loss: 0.9578, test_f1: 0.5034
 epoch: 28, train_loss: 0.9612, test_loss: 0.9637, test_f1: 0.4991
 epoch: 29, train_loss: 0.9529, test_loss: 0.9580, test_f1: 0.4936
 epoch: 30, train_loss: 0.9492, test_loss: 0.9567, test_f1: 0.4969
 epoch: 31, train_loss: 0.9458, test_loss: 0.9581, test_f1: 0.4926
 epoch: 32, train_loss: 0.9481, test_loss: 0.9566, test_f1: 0.5032
 epoch: 33, train_loss: 0.9349, test_loss: 0.9556, test_f1: 0.4890
 epoch: 34, train_loss: 0.9394, test_loss: 0.9451, test_f1: 0.4971
 epoch: 35, train_loss: 0.9290, test_loss: 0.9396, test_f1: 0.4984
 epoch: 36, train_loss: 0.9338, test_loss: 0.9355, test_f1: 0.5029
 epoch: 37, train_loss: 0.9224, test_loss: 0.9461, test_f1: 0.5044
 epoch: 38, train_loss: 0.9172, test_loss: 0.9475, test_f1: 0.4981
 epoch: 39, train_loss: 0.9212, test_loss: 0.9321, test_f1: 0.5043
 epoch: 40, train_loss: 0.9158, test_loss: 0.9508, test_f1: 0.5013
 epoch: 41, train_loss: 0.9172, test_loss: 0.9320, test_f1: 0.4990
 epoch: 42, train_loss: 0.9187, test_loss: 0.9780, test_f1: 0.4962
 epoch: 43, train_loss: 0.9141, test_loss: 0.9344, test_f1: 0.5195
 epoch: 44, train_loss: 0.9091, test_loss: 0.9312, test_f1: 0.5205
 epoch: 45, train_loss: 0.9035, test_loss: 0.9386, test_f1: 0.5145
 epoch: 46, train_loss: 0.9094, test_loss: 0.9158, test_f1: 0.5220
 epoch: 47, train_loss: 0.8973, test_loss: 0.9191, test_f1: 0.5203
 epoch: 48, train_loss: 0.9061, test_loss: 0.9351, test_f1: 0.5204
 epoch: 49, train_loss: 0.8934, test_loss: 0.9227, test_f1: 0.5230
 epoch: 50, train_loss: 0.8917, test_loss: 0.9106, test_f1: 0.5220
 epoch: 51, train_loss: 0.8862, test_loss: 0.9221, test_f1: 0.5276
 epoch: 52, train_loss: 0.8878, test_loss: 0.9217, test_f1: 0.5207
 epoch: 53, train_loss: 0.8883, test_loss: 0.9227, test_f1: 0.5223
 epoch: 54, train_loss: 0.8845, test_loss: 0.9200, test_f1: 0.5315
 epoch: 55, train_loss: 0.8864, test_loss: 0.9269, test_f1: 0.5316
 epoch: 56, train_loss: 0.8711, test_loss: 0.9216, test_f1: 0.5306
 epoch: 57, train_loss: 0.8822, test_loss: 0.9193, test_f1: 0.5353
 epoch: 58, train_loss: 0.8790, test_loss: 0.9220, test_f1: 0.5234
 epoch: 59, train_loss: 0.8685, test_loss: 0.9153, test_f1: 0.5352
 epoch: 60, train_loss: 0.8702, test_loss: 0.9189, test_f1: 0.5293
 epoch: 61, train_loss: 0.8758, test_loss: 0.9327, test_f1: 0.5324
 epoch: 62, train_loss: 0.8689, test_loss: 0.9157, test_f1: 0.5312
 epoch: 63, train_loss: 0.8698, test_loss: 0.9066, test_f1: 0.5321
 epoch: 64, train_loss: 0.8716, test_loss: 0.9078, test_f1: 0.5352
 epoch: 65, train_loss: 0.8772, test_loss: 0.9174, test_f1: 0.5340
 epoch: 66, train_loss: 0.8695, test_loss: 0.9180, test_f1: 0.5283
 epoch: 67, train_loss: 0.8767, test_loss: 0.9150, test_f1: 0.5317
 epoch: 68, train_loss: 0.8606, test_loss: 0.9172, test_f1: 0.5344
 epoch: 69, train_loss: 0.8603, test_loss: 0.9125, test_f1: 0.5321
 epoch: 70, train_loss: 0.8664, test_loss: 0.8999, test_f1: 0.5302
 epoch: 71, train_loss: 0.8656, test_loss: 0.9072, test_f1: 0.5368
 epoch: 72, train_loss: 0.8615, test_loss: 0.9124, test_f1: 0.5266
 epoch: 73, train_loss: 0.8597, test_loss: 0.9097, test_f1: 0.5289
 epoch: 74, train_loss: 0.8637, test_loss: 0.9140, test_f1: 0.5337
 epoch: 75, train_loss: 0.8491, test_loss: 0.9136, test_f1: 0.5300
 epoch: 76, train_loss: 0.8597, test_loss: 0.9113, test_f1: 0.5323
 epoch: 77, train_loss: 0.8550, test_loss: 0.9074, test_f1: 0.5354
 epoch: 78, train_loss: 0.8583, test_loss: 0.9100, test_f1: 0.5331
 epoch: 79, train_loss: 0.8536, test_loss: 0.9231, test_f1: 0.5349
 epoch: 80, train_loss: 0.8477, test_loss: 0.9132, test_f1: 0.5349
 epoch: 81, train_loss: 0.8432, test_loss: 0.9075, test_f1: 0.5383
 epoch: 82, train_loss: 0.8506, test_loss: 0.9143, test_f1: 0.5367
 epoch: 83, train_loss: 0.8459, test_loss: 0.9072, test_f1: 0.5316
 epoch: 84, train_loss: 0.8510, test_loss: 0.9052, test_f1: 0.5338
 epoch: 85, train_loss: 0.8475, test_loss: 0.9082, test_f1: 0.5304
 epoch: 86, train_loss: 0.8469, test_loss: 0.9108, test_f1: 0.5241
 epoch: 87, train_loss: 0.8522, test_loss: 0.9097, test_f1: 0.5346
 epoch: 88, train_loss: 0.8472, test_loss: 0.8994, test_f1: 0.5272
 epoch: 89, train_loss: 0.8471, test_loss: 0.9139, test_f1: 0.5238
 epoch: 90, train_loss: 0.8492, test_loss: 0.9060, test_f1: 0.5323
 epoch: 91, train_loss: 0.8438, test_loss: 0.9067, test_f1: 0.5352
 epoch: 92, train_loss: 0.8389, test_loss: 0.9009, test_f1: 0.5223
 epoch: 93, train_loss: 0.8392, test_loss: 0.9003, test_f1: 0.5318
 epoch: 94, train_loss: 0.8404, test_loss: 0.9226, test_f1: 0.5214
 epoch: 95, train_loss: 0.8472, test_loss: 0.8995, test_f1: 0.5271
 epoch: 96, train_loss: 0.8408, test_loss: 0.9043, test_f1: 0.5355
 epoch: 97, train_loss: 0.8433, test_loss: 0.9026, test_f1: 0.5282
 epoch: 98, train_loss: 0.8346, test_loss: 0.9133, test_f1: 0.5258
 epoch: 99, train_loss: 0.8383, test_loss: 0.8888, test_f1: 0.5394
##################ITERATION #7 ****************************************
 epoch: 0, train_loss: 1.2965, test_loss: 1.3162, test_f1: 0.2270
 epoch: 1, train_loss: 1.2265, test_loss: 1.3033, test_f1: 0.2527
 epoch: 2, train_loss: 1.1838, test_loss: 1.1919, test_f1: 0.3450
 epoch: 3, train_loss: 1.1570, test_loss: 1.1086, test_f1: 0.4205
 epoch: 4, train_loss: 1.1300, test_loss: 1.0867, test_f1: 0.4292
 epoch: 5, train_loss: 1.1014, test_loss: 1.0736, test_f1: 0.4351
 epoch: 6, train_loss: 1.0898, test_loss: 1.0592, test_f1: 0.4469
 epoch: 7, train_loss: 1.0762, test_loss: 1.0509, test_f1: 0.4488
 epoch: 8, train_loss: 1.0598, test_loss: 1.0471, test_f1: 0.4487
 epoch: 9, train_loss: 1.0435, test_loss: 1.0382, test_f1: 0.4652
 epoch: 10, train_loss: 1.0360, test_loss: 1.0364, test_f1: 0.4795
 epoch: 11, train_loss: 1.0363, test_loss: 1.0345, test_f1: 0.4712
 epoch: 12, train_loss: 1.0200, test_loss: 1.0281, test_f1: 0.4722
 epoch: 13, train_loss: 1.0141, test_loss: 1.0256, test_f1: 0.4869
 epoch: 14, train_loss: 1.0123, test_loss: 1.0259, test_f1: 0.4903
 epoch: 15, train_loss: 1.0083, test_loss: 1.0161, test_f1: 0.4890
 epoch: 16, train_loss: 1.0011, test_loss: 1.0163, test_f1: 0.4897
 epoch: 17, train_loss: 0.9983, test_loss: 1.0178, test_f1: 0.4799
 epoch: 18, train_loss: 0.9885, test_loss: 1.0074, test_f1: 0.4843
 epoch: 19, train_loss: 0.9867, test_loss: 1.0138, test_f1: 0.4834
 epoch: 20, train_loss: 0.9744, test_loss: 1.0013, test_f1: 0.4839
 epoch: 21, train_loss: 0.9811, test_loss: 1.0072, test_f1: 0.4895
 epoch: 22, train_loss: 0.9743, test_loss: 0.9997, test_f1: 0.4894
 epoch: 23, train_loss: 0.9711, test_loss: 0.9949, test_f1: 0.5046
 epoch: 24, train_loss: 0.9638, test_loss: 1.0109, test_f1: 0.4982
 epoch: 25, train_loss: 0.9643, test_loss: 0.9910, test_f1: 0.4909
 epoch: 26, train_loss: 0.9591, test_loss: 1.0018, test_f1: 0.4902
 epoch: 27, train_loss: 0.9636, test_loss: 1.0012, test_f1: 0.4951
 epoch: 28, train_loss: 0.9581, test_loss: 0.9987, test_f1: 0.4837
 epoch: 29, train_loss: 0.9536, test_loss: 0.9891, test_f1: 0.4945
 epoch: 30, train_loss: 0.9504, test_loss: 0.9952, test_f1: 0.4951
 epoch: 31, train_loss: 0.9449, test_loss: 0.9842, test_f1: 0.4920
 epoch: 32, train_loss: 0.9335, test_loss: 0.9959, test_f1: 0.4976
 epoch: 33, train_loss: 0.9354, test_loss: 0.9957, test_f1: 0.4962
 epoch: 34, train_loss: 0.9464, test_loss: 0.9863, test_f1: 0.4935
 epoch: 35, train_loss: 0.9323, test_loss: 0.9870, test_f1: 0.5030
 epoch: 36, train_loss: 0.9235, test_loss: 0.9810, test_f1: 0.4936
 epoch: 37, train_loss: 0.9276, test_loss: 0.9787, test_f1: 0.4952
 epoch: 38, train_loss: 0.9298, test_loss: 0.9875, test_f1: 0.4930
 epoch: 39, train_loss: 0.9262, test_loss: 0.9906, test_f1: 0.5020
 epoch: 40, train_loss: 0.9222, test_loss: 0.9864, test_f1: 0.5025
 epoch: 41, train_loss: 0.9107, test_loss: 0.9893, test_f1: 0.4980
 epoch: 42, train_loss: 0.9143, test_loss: 0.9804, test_f1: 0.5034
 epoch: 43, train_loss: 0.9143, test_loss: 0.9832, test_f1: 0.5032
 epoch: 44, train_loss: 0.9126, test_loss: 0.9928, test_f1: 0.5019
 epoch: 45, train_loss: 0.9128, test_loss: 0.9766, test_f1: 0.5063
 epoch: 46, train_loss: 0.9150, test_loss: 0.9797, test_f1: 0.5097
 epoch: 47, train_loss: 0.9078, test_loss: 0.9761, test_f1: 0.5083
 epoch: 48, train_loss: 0.9059, test_loss: 0.9807, test_f1: 0.5053
 epoch: 49, train_loss: 0.9015, test_loss: 0.9669, test_f1: 0.5149
 epoch: 50, train_loss: 0.9052, test_loss: 0.9883, test_f1: 0.5028
 epoch: 51, train_loss: 0.8948, test_loss: 0.9806, test_f1: 0.5019
 epoch: 52, train_loss: 0.8945, test_loss: 0.9779, test_f1: 0.5134
 epoch: 53, train_loss: 0.8949, test_loss: 0.9755, test_f1: 0.5010
 epoch: 54, train_loss: 0.8962, test_loss: 0.9778, test_f1: 0.5066
 epoch: 55, train_loss: 0.8936, test_loss: 0.9794, test_f1: 0.5082
 epoch: 56, train_loss: 0.8998, test_loss: 0.9733, test_f1: 0.5086
 epoch: 57, train_loss: 0.8869, test_loss: 0.9808, test_f1: 0.5047
 epoch: 58, train_loss: 0.8817, test_loss: 0.9781, test_f1: 0.5053
 epoch: 59, train_loss: 0.8809, test_loss: 0.9763, test_f1: 0.5146
 epoch: 60, train_loss: 0.8846, test_loss: 0.9850, test_f1: 0.5082
 epoch: 61, train_loss: 0.8774, test_loss: 0.9821, test_f1: 0.5050
 epoch: 62, train_loss: 0.8847, test_loss: 0.9766, test_f1: 0.5041
 epoch: 63, train_loss: 0.8900, test_loss: 0.9746, test_f1: 0.5059
 epoch: 64, train_loss: 0.8815, test_loss: 0.9863, test_f1: 0.5164
 epoch: 65, train_loss: 0.8809, test_loss: 0.9818, test_f1: 0.5085
 epoch: 66, train_loss: 0.8794, test_loss: 0.9893, test_f1: 0.5094
 epoch: 67, train_loss: 0.8777, test_loss: 0.9871, test_f1: 0.5098
 epoch: 68, train_loss: 0.8716, test_loss: 0.9756, test_f1: 0.5122
 epoch: 69, train_loss: 0.8750, test_loss: 0.9797, test_f1: 0.5091
 epoch: 70, train_loss: 0.8752, test_loss: 0.9725, test_f1: 0.5116
 epoch: 71, train_loss: 0.8816, test_loss: 0.9762, test_f1: 0.5157
 epoch: 72, train_loss: 0.8728, test_loss: 0.9693, test_f1: 0.5097
 epoch: 73, train_loss: 0.8771, test_loss: 0.9796, test_f1: 0.5159
 epoch: 74, train_loss: 0.8810, test_loss: 0.9756, test_f1: 0.5172
 epoch: 75, train_loss: 0.8860, test_loss: 0.9786, test_f1: 0.5201
 epoch: 76, train_loss: 0.8736, test_loss: 0.9683, test_f1: 0.5208
 epoch: 77, train_loss: 0.8724, test_loss: 0.9698, test_f1: 0.5155
 epoch: 78, train_loss: 0.8823, test_loss: 0.9772, test_f1: 0.5115
 epoch: 79, train_loss: 0.8740, test_loss: 0.9717, test_f1: 0.5146
 epoch: 80, train_loss: 0.8601, test_loss: 0.9746, test_f1: 0.5202
 epoch: 81, train_loss: 0.8558, test_loss: 0.9699, test_f1: 0.5309
 epoch: 82, train_loss: 0.8688, test_loss: 0.9765, test_f1: 0.5339
 epoch: 83, train_loss: 0.8685, test_loss: 0.9788, test_f1: 0.5270
 epoch: 84, train_loss: 0.8674, test_loss: 0.9665, test_f1: 0.5247
 epoch: 85, train_loss: 0.8644, test_loss: 0.9676, test_f1: 0.5171
 epoch: 86, train_loss: 0.8667, test_loss: 0.9674, test_f1: 0.5238
 epoch: 87, train_loss: 0.8696, test_loss: 0.9644, test_f1: 0.5298
 epoch: 88, train_loss: 0.8750, test_loss: 0.9665, test_f1: 0.5277
 epoch: 89, train_loss: 0.8603, test_loss: 0.9660, test_f1: 0.5184
 epoch: 90, train_loss: 0.8662, test_loss: 0.9756, test_f1: 0.5271
 epoch: 91, train_loss: 0.8612, test_loss: 0.9730, test_f1: 0.5339
 epoch: 92, train_loss: 0.8737, test_loss: 0.9700, test_f1: 0.5162
 epoch: 93, train_loss: 0.8694, test_loss: 0.9688, test_f1: 0.5223
 epoch: 94, train_loss: 0.8636, test_loss: 0.9737, test_f1: 0.5184
 epoch: 95, train_loss: 0.8579, test_loss: 0.9686, test_f1: 0.5223
 epoch: 96, train_loss: 0.8646, test_loss: 0.9589, test_f1: 0.5282
 epoch: 97, train_loss: 0.8575, test_loss: 0.9706, test_f1: 0.5205
 epoch: 98, train_loss: 0.8550, test_loss: 0.9674, test_f1: 0.5223
 epoch: 99, train_loss: 0.8574, test_loss: 0.9737, test_f1: 0.5198
##################ITERATION #8 ****************************************
 epoch: 0, train_loss: 1.2834, test_loss: 1.3326, test_f1: 0.2270
 epoch: 1, train_loss: 1.2046, test_loss: 1.2915, test_f1: 0.2270
 epoch: 2, train_loss: 1.1888, test_loss: 1.1716, test_f1: 0.2659
 epoch: 3, train_loss: 1.1615, test_loss: 1.1057, test_f1: 0.3802
 epoch: 4, train_loss: 1.1450, test_loss: 1.0908, test_f1: 0.4057
 epoch: 5, train_loss: 1.1294, test_loss: 1.0789, test_f1: 0.4129
 epoch: 6, train_loss: 1.1037, test_loss: 1.0743, test_f1: 0.4230
 epoch: 7, train_loss: 1.0947, test_loss: 1.0638, test_f1: 0.4279
 epoch: 8, train_loss: 1.0823, test_loss: 1.0556, test_f1: 0.4484
 epoch: 9, train_loss: 1.0696, test_loss: 1.0523, test_f1: 0.4504
 epoch: 10, train_loss: 1.0534, test_loss: 1.0446, test_f1: 0.4563
 epoch: 11, train_loss: 1.0470, test_loss: 1.0332, test_f1: 0.4576
 epoch: 12, train_loss: 1.0381, test_loss: 1.0351, test_f1: 0.4718
 epoch: 13, train_loss: 1.0337, test_loss: 1.0339, test_f1: 0.4508
 epoch: 14, train_loss: 1.0213, test_loss: 1.0185, test_f1: 0.4858
 epoch: 15, train_loss: 1.0146, test_loss: 1.0157, test_f1: 0.4785
 epoch: 16, train_loss: 1.0094, test_loss: 1.0210, test_f1: 0.4709
 epoch: 17, train_loss: 1.0015, test_loss: 1.0074, test_f1: 0.4825
 epoch: 18, train_loss: 0.9985, test_loss: 1.0005, test_f1: 0.4881
 epoch: 19, train_loss: 0.9932, test_loss: 0.9939, test_f1: 0.4853
 epoch: 20, train_loss: 0.9822, test_loss: 0.9909, test_f1: 0.4906
 epoch: 21, train_loss: 0.9737, test_loss: 0.9869, test_f1: 0.5056
 epoch: 22, train_loss: 0.9859, test_loss: 0.9811, test_f1: 0.4809
 epoch: 23, train_loss: 0.9733, test_loss: 0.9805, test_f1: 0.4808
 epoch: 24, train_loss: 0.9784, test_loss: 0.9704, test_f1: 0.4990
 epoch: 25, train_loss: 0.9724, test_loss: 0.9648, test_f1: 0.5052
 epoch: 26, train_loss: 0.9655, test_loss: 0.9747, test_f1: 0.4986
 epoch: 27, train_loss: 0.9569, test_loss: 0.9592, test_f1: 0.5034
 epoch: 28, train_loss: 0.9576, test_loss: 0.9694, test_f1: 0.4976
 epoch: 29, train_loss: 0.9573, test_loss: 0.9603, test_f1: 0.5076
 epoch: 30, train_loss: 0.9542, test_loss: 0.9568, test_f1: 0.4986
 epoch: 31, train_loss: 0.9419, test_loss: 0.9480, test_f1: 0.4982
 epoch: 32, train_loss: 0.9396, test_loss: 0.9446, test_f1: 0.5047
 epoch: 33, train_loss: 0.9454, test_loss: 0.9345, test_f1: 0.5089
 epoch: 34, train_loss: 0.9425, test_loss: 0.9556, test_f1: 0.5068
 epoch: 35, train_loss: 0.9369, test_loss: 0.9392, test_f1: 0.5084
 epoch: 36, train_loss: 0.9389, test_loss: 0.9405, test_f1: 0.5083
 epoch: 37, train_loss: 0.9401, test_loss: 0.9342, test_f1: 0.5045
 epoch: 38, train_loss: 0.9223, test_loss: 0.9457, test_f1: 0.4974
 epoch: 39, train_loss: 0.9248, test_loss: 0.9125, test_f1: 0.5169
 epoch: 40, train_loss: 0.9209, test_loss: 0.9357, test_f1: 0.5108
 epoch: 41, train_loss: 0.9257, test_loss: 0.9074, test_f1: 0.5208
 epoch: 42, train_loss: 0.9215, test_loss: 0.9247, test_f1: 0.5082
 epoch: 43, train_loss: 0.9167, test_loss: 0.9121, test_f1: 0.5260
 epoch: 44, train_loss: 0.9196, test_loss: 0.8977, test_f1: 0.5356
 epoch: 45, train_loss: 0.9102, test_loss: 0.9059, test_f1: 0.5199
 epoch: 46, train_loss: 0.9106, test_loss: 0.9044, test_f1: 0.5309
 epoch: 47, train_loss: 0.9116, test_loss: 0.9079, test_f1: 0.5287
 epoch: 48, train_loss: 0.9032, test_loss: 0.9238, test_f1: 0.5161
 epoch: 49, train_loss: 0.9081, test_loss: 0.8953, test_f1: 0.5296
 epoch: 50, train_loss: 0.9003, test_loss: 0.8893, test_f1: 0.5341
 epoch: 51, train_loss: 0.9029, test_loss: 0.9033, test_f1: 0.5252
 epoch: 52, train_loss: 0.8923, test_loss: 0.9003, test_f1: 0.5289
 epoch: 53, train_loss: 0.8877, test_loss: 0.8966, test_f1: 0.5309
 epoch: 54, train_loss: 0.8913, test_loss: 0.8994, test_f1: 0.5257
 epoch: 55, train_loss: 0.8923, test_loss: 0.8991, test_f1: 0.5311
 epoch: 56, train_loss: 0.8818, test_loss: 0.9025, test_f1: 0.5315
 epoch: 57, train_loss: 0.8935, test_loss: 0.8950, test_f1: 0.5379
 epoch: 58, train_loss: 0.8830, test_loss: 0.8843, test_f1: 0.5464
 epoch: 59, train_loss: 0.8770, test_loss: 0.9048, test_f1: 0.5316
 epoch: 60, train_loss: 0.8826, test_loss: 0.8976, test_f1: 0.5400
 epoch: 61, train_loss: 0.8859, test_loss: 0.9001, test_f1: 0.5358
 epoch: 62, train_loss: 0.8803, test_loss: 0.9038, test_f1: 0.5312
 epoch: 63, train_loss: 0.8721, test_loss: 0.9020, test_f1: 0.5260
 epoch: 64, train_loss: 0.8799, test_loss: 0.8919, test_f1: 0.5470
 epoch: 65, train_loss: 0.8787, test_loss: 0.8890, test_f1: 0.5418
 epoch: 66, train_loss: 0.8800, test_loss: 0.8826, test_f1: 0.5425
 epoch: 67, train_loss: 0.8783, test_loss: 0.8847, test_f1: 0.5362
 epoch: 68, train_loss: 0.8770, test_loss: 0.8969, test_f1: 0.5341
 epoch: 69, train_loss: 0.8761, test_loss: 0.8915, test_f1: 0.5391
 epoch: 70, train_loss: 0.8733, test_loss: 0.8952, test_f1: 0.5313
 epoch: 71, train_loss: 0.8687, test_loss: 0.8838, test_f1: 0.5372
 epoch: 72, train_loss: 0.8648, test_loss: 0.8859, test_f1: 0.5389
 epoch: 73, train_loss: 0.8669, test_loss: 0.8898, test_f1: 0.5292
 epoch: 74, train_loss: 0.8711, test_loss: 0.8843, test_f1: 0.5384
 epoch: 75, train_loss: 0.8668, test_loss: 0.8931, test_f1: 0.5326
 epoch: 76, train_loss: 0.8667, test_loss: 0.8877, test_f1: 0.5295
 epoch: 77, train_loss: 0.8631, test_loss: 0.8842, test_f1: 0.5340
 epoch: 78, train_loss: 0.8660, test_loss: 0.8928, test_f1: 0.5359
 epoch: 79, train_loss: 0.8579, test_loss: 0.8925, test_f1: 0.5377
 epoch: 80, train_loss: 0.8561, test_loss: 0.8814, test_f1: 0.5428
 epoch: 81, train_loss: 0.8633, test_loss: 0.8884, test_f1: 0.5337
 epoch: 82, train_loss: 0.8601, test_loss: 0.8771, test_f1: 0.5423
 epoch: 83, train_loss: 0.8649, test_loss: 0.8758, test_f1: 0.5377
 epoch: 84, train_loss: 0.8528, test_loss: 0.8818, test_f1: 0.5426
 epoch: 85, train_loss: 0.8658, test_loss: 0.8878, test_f1: 0.5398
 epoch: 86, train_loss: 0.8652, test_loss: 0.8678, test_f1: 0.5289
 epoch: 87, train_loss: 0.8631, test_loss: 0.8805, test_f1: 0.5465
 epoch: 88, train_loss: 0.8551, test_loss: 0.8864, test_f1: 0.5306
 epoch: 89, train_loss: 0.8472, test_loss: 0.8866, test_f1: 0.5480
 epoch: 90, train_loss: 0.8544, test_loss: 0.8827, test_f1: 0.5401
 epoch: 91, train_loss: 0.8588, test_loss: 0.8831, test_f1: 0.5451
 epoch: 92, train_loss: 0.8481, test_loss: 0.8909, test_f1: 0.5391
 epoch: 93, train_loss: 0.8498, test_loss: 0.8793, test_f1: 0.5477
 epoch: 94, train_loss: 0.8436, test_loss: 0.8847, test_f1: 0.5373
 epoch: 95, train_loss: 0.8444, test_loss: 0.8710, test_f1: 0.5536
 epoch: 96, train_loss: 0.8479, test_loss: 0.8751, test_f1: 0.5479
 epoch: 97, train_loss: 0.8519, test_loss: 0.8923, test_f1: 0.5448
 epoch: 98, train_loss: 0.8386, test_loss: 0.8716, test_f1: 0.5540
 epoch: 99, train_loss: 0.8407, test_loss: 0.8744, test_f1: 0.5532
##################ITERATION #9 ****************************************
 epoch: 0, train_loss: 1.3023, test_loss: 1.3303, test_f1: 0.2270
 epoch: 1, train_loss: 1.2043, test_loss: 1.2435, test_f1: 0.2345
 epoch: 2, train_loss: 1.1678, test_loss: 1.1367, test_f1: 0.3762
 epoch: 3, train_loss: 1.1528, test_loss: 1.0991, test_f1: 0.3946
 epoch: 4, train_loss: 1.1220, test_loss: 1.0828, test_f1: 0.3996
 epoch: 5, train_loss: 1.1009, test_loss: 1.0718, test_f1: 0.4230
 epoch: 6, train_loss: 1.0860, test_loss: 1.0616, test_f1: 0.4391
 epoch: 7, train_loss: 1.0690, test_loss: 1.0568, test_f1: 0.4254
 epoch: 8, train_loss: 1.0570, test_loss: 1.0493, test_f1: 0.4403
 epoch: 9, train_loss: 1.0506, test_loss: 1.0401, test_f1: 0.4376
 epoch: 10, train_loss: 1.0343, test_loss: 1.0379, test_f1: 0.4578
 epoch: 11, train_loss: 1.0303, test_loss: 1.0366, test_f1: 0.4602
 epoch: 12, train_loss: 1.0283, test_loss: 1.0317, test_f1: 0.4753
 epoch: 13, train_loss: 1.0190, test_loss: 1.0340, test_f1: 0.4741
 epoch: 14, train_loss: 1.0084, test_loss: 1.0278, test_f1: 0.4790
 epoch: 15, train_loss: 1.0055, test_loss: 1.0218, test_f1: 0.4685
 epoch: 16, train_loss: 1.0002, test_loss: 1.0235, test_f1: 0.4725
 epoch: 17, train_loss: 0.9958, test_loss: 1.0153, test_f1: 0.4775
 epoch: 18, train_loss: 0.9906, test_loss: 1.0154, test_f1: 0.4796
 epoch: 19, train_loss: 0.9862, test_loss: 1.0099, test_f1: 0.4817
 epoch: 20, train_loss: 0.9762, test_loss: 1.0025, test_f1: 0.4949
 epoch: 21, train_loss: 0.9812, test_loss: 1.0041, test_f1: 0.4996
 epoch: 22, train_loss: 0.9721, test_loss: 1.0018, test_f1: 0.4992
 epoch: 23, train_loss: 0.9678, test_loss: 0.9989, test_f1: 0.4936
 epoch: 24, train_loss: 0.9693, test_loss: 0.9921, test_f1: 0.5031
 epoch: 25, train_loss: 0.9593, test_loss: 0.9934, test_f1: 0.5033
 epoch: 26, train_loss: 0.9568, test_loss: 0.9967, test_f1: 0.4937
 epoch: 27, train_loss: 0.9471, test_loss: 0.9925, test_f1: 0.5073
 epoch: 28, train_loss: 0.9493, test_loss: 0.9851, test_f1: 0.4964
 epoch: 29, train_loss: 0.9498, test_loss: 0.9833, test_f1: 0.5137
 epoch: 30, train_loss: 0.9411, test_loss: 0.9837, test_f1: 0.4968
 epoch: 31, train_loss: 0.9362, test_loss: 0.9889, test_f1: 0.5015
 epoch: 32, train_loss: 0.9358, test_loss: 0.9767, test_f1: 0.5085
 epoch: 33, train_loss: 0.9356, test_loss: 0.9924, test_f1: 0.5147
 epoch: 34, train_loss: 0.9303, test_loss: 0.9784, test_f1: 0.5152
 epoch: 35, train_loss: 0.9178, test_loss: 0.9638, test_f1: 0.5189
 epoch: 36, train_loss: 0.9219, test_loss: 0.9654, test_f1: 0.5225
 epoch: 37, train_loss: 0.9218, test_loss: 0.9545, test_f1: 0.5224
 epoch: 38, train_loss: 0.9136, test_loss: 0.9535, test_f1: 0.5075
 epoch: 39, train_loss: 0.9139, test_loss: 0.9649, test_f1: 0.5183
 epoch: 40, train_loss: 0.9052, test_loss: 0.9410, test_f1: 0.5284
 epoch: 41, train_loss: 0.9026, test_loss: 0.9438, test_f1: 0.5215
 epoch: 42, train_loss: 0.9060, test_loss: 0.9656, test_f1: 0.5110
 epoch: 43, train_loss: 0.9130, test_loss: 0.9385, test_f1: 0.5115
 epoch: 44, train_loss: 0.8963, test_loss: 0.9392, test_f1: 0.5275
 epoch: 45, train_loss: 0.8915, test_loss: 0.9441, test_f1: 0.5233
 epoch: 46, train_loss: 0.8867, test_loss: 0.9370, test_f1: 0.5275
 epoch: 47, train_loss: 0.8858, test_loss: 0.9351, test_f1: 0.5359
 epoch: 48, train_loss: 0.8855, test_loss: 0.9359, test_f1: 0.5113
 epoch: 49, train_loss: 0.8867, test_loss: 0.9387, test_f1: 0.5372
 epoch: 50, train_loss: 0.8751, test_loss: 0.9264, test_f1: 0.5257
 epoch: 51, train_loss: 0.8829, test_loss: 0.9324, test_f1: 0.5178
 epoch: 52, train_loss: 0.8866, test_loss: 0.9340, test_f1: 0.5226
 epoch: 53, train_loss: 0.8727, test_loss: 0.9263, test_f1: 0.5236
 epoch: 54, train_loss: 0.8698, test_loss: 0.9198, test_f1: 0.5201
 epoch: 55, train_loss: 0.8787, test_loss: 0.9309, test_f1: 0.5295
 epoch: 56, train_loss: 0.8755, test_loss: 0.9319, test_f1: 0.5242
 epoch: 57, train_loss: 0.8687, test_loss: 0.9168, test_f1: 0.5221
 epoch: 58, train_loss: 0.8822, test_loss: 0.9195, test_f1: 0.5202
 epoch: 59, train_loss: 0.8630, test_loss: 0.9198, test_f1: 0.5271
 epoch: 60, train_loss: 0.8709, test_loss: 0.9144, test_f1: 0.5268
 epoch: 61, train_loss: 0.8602, test_loss: 0.9203, test_f1: 0.5276
 epoch: 62, train_loss: 0.8677, test_loss: 0.9219, test_f1: 0.5253
 epoch: 63, train_loss: 0.8673, test_loss: 0.9220, test_f1: 0.5289
 epoch: 64, train_loss: 0.8607, test_loss: 0.9260, test_f1: 0.5230
 epoch: 65, train_loss: 0.8535, test_loss: 0.9128, test_f1: 0.5216
 epoch: 66, train_loss: 0.8502, test_loss: 0.9224, test_f1: 0.5287
 epoch: 67, train_loss: 0.8523, test_loss: 0.9142, test_f1: 0.5220
 epoch: 68, train_loss: 0.8639, test_loss: 0.9207, test_f1: 0.5270
 epoch: 69, train_loss: 0.8594, test_loss: 0.9104, test_f1: 0.5329
 epoch: 70, train_loss: 0.8631, test_loss: 0.9100, test_f1: 0.5225
 epoch: 71, train_loss: 0.8486, test_loss: 0.9121, test_f1: 0.5287
 epoch: 72, train_loss: 0.8514, test_loss: 0.9102, test_f1: 0.5262
 epoch: 73, train_loss: 0.8416, test_loss: 0.9021, test_f1: 0.5314
 epoch: 74, train_loss: 0.8301, test_loss: 0.9176, test_f1: 0.5276
 epoch: 75, train_loss: 0.8519, test_loss: 0.9113, test_f1: 0.5313
 epoch: 76, train_loss: 0.8482, test_loss: 0.9092, test_f1: 0.5252
 epoch: 77, train_loss: 0.8485, test_loss: 0.9090, test_f1: 0.5294
 epoch: 78, train_loss: 0.8546, test_loss: 0.9102, test_f1: 0.5310
 epoch: 79, train_loss: 0.8431, test_loss: 0.9047, test_f1: 0.5259
 epoch: 80, train_loss: 0.8458, test_loss: 0.9113, test_f1: 0.5284
 epoch: 81, train_loss: 0.8416, test_loss: 0.8993, test_f1: 0.5293
 epoch: 82, train_loss: 0.8351, test_loss: 0.9104, test_f1: 0.5311
 epoch: 83, train_loss: 0.8309, test_loss: 0.9084, test_f1: 0.5304
 epoch: 84, train_loss: 0.8390, test_loss: 0.8982, test_f1: 0.5310
 epoch: 85, train_loss: 0.8386, test_loss: 0.8958, test_f1: 0.5313
 epoch: 86, train_loss: 0.8310, test_loss: 0.9010, test_f1: 0.5296
 epoch: 87, train_loss: 0.8386, test_loss: 0.9026, test_f1: 0.5325
 epoch: 88, train_loss: 0.8241, test_loss: 0.8983, test_f1: 0.5311
 epoch: 89, train_loss: 0.8282, test_loss: 0.9009, test_f1: 0.5296
 epoch: 90, train_loss: 0.8196, test_loss: 0.9131, test_f1: 0.5361
 epoch: 91, train_loss: 0.8302, test_loss: 0.8972, test_f1: 0.5293
 epoch: 92, train_loss: 0.8339, test_loss: 0.9033, test_f1: 0.5334
 epoch: 93, train_loss: 0.8265, test_loss: 0.9039, test_f1: 0.5359
 epoch: 94, train_loss: 0.8210, test_loss: 0.9010, test_f1: 0.5298
 epoch: 95, train_loss: 0.8240, test_loss: 0.8913, test_f1: 0.5380
 epoch: 96, train_loss: 0.8210, test_loss: 0.8899, test_f1: 0.5389
 epoch: 97, train_loss: 0.8153, test_loss: 0.8977, test_f1: 0.5350
 epoch: 98, train_loss: 0.8206, test_loss: 0.8833, test_f1: 0.5386
 epoch: 99, train_loss: 0.8144, test_loss: 0.8918, test_f1: 0.5368

Training completed in 548.61 seconds
Best F1: 0.5540 at epoch 98
Mean F1 across iterations: 0.5392  0.0057
========================FINAL RESULTS================================
FEGIN weighted F1: 0.5540  0.0057
python main.py --data ltspice_examples --representation component_pin_net --model FEGIN --layers 5 --hiddens 32 --batch_size 128 --lr 0.0001 --emb_size 512 --epochs 100 --save_appendix component_pin_net_L5_H32_BS128_LR0.0001_E512 --no_val
-----



STDERR:
  File "main.py", line 370, in <module>
    main()
  File "main.py", line 254, in main
    dataset = dataset_class(
  File "/home/philip/projects/ltspice_examples_code_repo/Circuit-Completion-Using-GNNs/component_classification_with_link_prediction_head/evaluation/FEGIN/kernel/circuit_datasets.py", line 15, in __init__
    self.data, self.slices = torch.load(self.processed_paths[0])
  File "/home/philip/.local/lib/python3.8/site-packages/torch/serialization.py", line 1040, in load
    warnings.warn(
  File "/usr/lib/python3.8/warnings.py", line 109, in _showwarnmsg
    sw(msg.message, msg.category, msg.filename, msg.lineno,
  File "main.py", line 47, in warn_with_traceback
    traceback.print_stack(file=log)
/home/philip/projects/ltspice_examples_code_repo/Circuit-Completion-Using-GNNs/component_classification_with_link_prediction_head/evaluation/FEGIN/kernel/circuit_datasets.py:15: FutureWarning: You are using `torch.load` with `weights_only=False` (the current default value), which uses the default pickle module implicitly. It is possible to construct malicious pickle data which will execute arbitrary code during unpickling (See https://github.com/pytorch/pytorch/blob/main/SECURITY.md#untrusted-models for more details). In a future release, the default value for `weights_only` will be flipped to `True`. This limits the functions that could be executed during unpickling. Arbitrary objects will no longer be allowed to be loaded via this mode unless they are explicitly allowlisted by the user via `torch.serialization.add_safe_globals`. We recommend you start setting `weights_only=True` for any use case where you don't have full control of the loaded file. Please open an issue on GitHub for any issues related to this experimental feature.
  self.data, self.slices = torch.load(self.processed_paths[0])
