STDOUT:
Results will be saved in /home/philip/projects/ltspice_examples_code_repo/Circuit-Completion-Using-GNNs/component_classification_with_link_prediction_head/evaluation/FEGIN/results/model_FEGIN_dataset_ltspice_examples
Command line input: python main.py --data ltspice_examples --representation component_net --model FEGIN --layers 6 --hiddens 128 --batch_size 128 --lr 0.001 --emb_size 128 --epochs 100 --save_appendix component_net_L6_H128_BS128_LR0.001_E128 --no_val
 is saved.
-----
ltspice_examples - FEGIN
Using 6 layers, 128 hidden units, h = 2
Loading component_net representation dataset
ENTERED
Training FEGIN on component_net representation
Train: 3558, Test: 846
##################ITERATION #0 ****************************************
 epoch: 0, train_loss: 1.2195, test_loss: 1.2440, test_f1: 0.2959
 epoch: 1, train_loss: 1.0221, test_loss: 0.9925, test_f1: 0.4795
 epoch: 2, train_loss: 0.9625, test_loss: 0.9624, test_f1: 0.5185
 epoch: 3, train_loss: 0.9206, test_loss: 0.9524, test_f1: 0.5074
 epoch: 4, train_loss: 0.9054, test_loss: 0.9622, test_f1: 0.4961
 epoch: 5, train_loss: 0.8853, test_loss: 0.8540, test_f1: 0.5456
 epoch: 6, train_loss: 0.8560, test_loss: 0.8840, test_f1: 0.5542
 epoch: 7, train_loss: 0.8624, test_loss: 1.1526, test_f1: 0.5019
 epoch: 8, train_loss: 0.8161, test_loss: 0.8677, test_f1: 0.5595
 epoch: 9, train_loss: 0.8129, test_loss: 0.9321, test_f1: 0.4931
 epoch: 10, train_loss: 0.8074, test_loss: 0.9646, test_f1: 0.5849
 epoch: 11, train_loss: 0.7846, test_loss: 1.0588, test_f1: 0.5410
 epoch: 12, train_loss: 0.7815, test_loss: 0.9268, test_f1: 0.5934
 epoch: 13, train_loss: 0.7567, test_loss: 0.8826, test_f1: 0.6161
 epoch: 14, train_loss: 0.7495, test_loss: 1.0055, test_f1: 0.5634
 epoch: 15, train_loss: 0.7429, test_loss: 0.9198, test_f1: 0.6353
 epoch: 16, train_loss: 0.7114, test_loss: 0.9448, test_f1: 0.6070
 epoch: 17, train_loss: 0.6953, test_loss: 0.8691, test_f1: 0.6238
 epoch: 18, train_loss: 0.6956, test_loss: 0.9383, test_f1: 0.5869
 epoch: 19, train_loss: 0.7017, test_loss: 0.9354, test_f1: 0.5685
 epoch: 20, train_loss: 0.6666, test_loss: 0.9678, test_f1: 0.6010
 epoch: 21, train_loss: 0.6678, test_loss: 0.9770, test_f1: 0.5910
 epoch: 22, train_loss: 0.6318, test_loss: 0.9649, test_f1: 0.6252
 epoch: 23, train_loss: 0.6486, test_loss: 1.1067, test_f1: 0.5728
 epoch: 24, train_loss: 0.6289, test_loss: 1.0121, test_f1: 0.6525
 epoch: 25, train_loss: 0.6172, test_loss: 1.0607, test_f1: 0.5574
 epoch: 26, train_loss: 0.6396, test_loss: 0.9811, test_f1: 0.6281
 epoch: 27, train_loss: 0.6139, test_loss: 0.9880, test_f1: 0.6458
 epoch: 28, train_loss: 0.6015, test_loss: 1.0392, test_f1: 0.6238
 epoch: 29, train_loss: 0.5922, test_loss: 0.9929, test_f1: 0.6027
 epoch: 30, train_loss: 0.5690, test_loss: 1.0848, test_f1: 0.6126
 epoch: 31, train_loss: 0.5519, test_loss: 1.1358, test_f1: 0.6050
 epoch: 32, train_loss: 0.5802, test_loss: 1.1121, test_f1: 0.5808
 epoch: 33, train_loss: 0.5493, test_loss: 1.0228, test_f1: 0.6086
 epoch: 34, train_loss: 0.5059, test_loss: 1.1307, test_f1: 0.6065
 epoch: 35, train_loss: 0.4986, test_loss: 1.2723, test_f1: 0.5934
 epoch: 36, train_loss: 0.5385, test_loss: 1.1983, test_f1: 0.6014
 epoch: 37, train_loss: 0.5201, test_loss: 1.1196, test_f1: 0.6106
 epoch: 38, train_loss: 0.4829, test_loss: 1.1723, test_f1: 0.6195
 epoch: 39, train_loss: 0.4872, test_loss: 1.1208, test_f1: 0.5706
 epoch: 40, train_loss: 0.4689, test_loss: 1.3573, test_f1: 0.5735
 epoch: 41, train_loss: 0.4844, test_loss: 1.2027, test_f1: 0.5990
 epoch: 42, train_loss: 0.5350, test_loss: 1.2053, test_f1: 0.5882
 epoch: 43, train_loss: 0.4744, test_loss: 1.2231, test_f1: 0.5996
 epoch: 44, train_loss: 0.4313, test_loss: 1.3216, test_f1: 0.6121
 epoch: 45, train_loss: 0.4495, test_loss: 1.2459, test_f1: 0.5640
 epoch: 46, train_loss: 0.4680, test_loss: 1.2565, test_f1: 0.6114
 epoch: 47, train_loss: 0.4295, test_loss: 1.2832, test_f1: 0.6391
 epoch: 48, train_loss: 0.4179, test_loss: 1.3611, test_f1: 0.6110
 epoch: 49, train_loss: 0.4292, test_loss: 1.3024, test_f1: 0.6061
 epoch: 50, train_loss: 0.4189, test_loss: 1.4003, test_f1: 0.6192
 epoch: 51, train_loss: 0.3758, test_loss: 1.3725, test_f1: 0.6048
 epoch: 52, train_loss: 0.3178, test_loss: 1.3621, test_f1: 0.6365
 epoch: 53, train_loss: 0.3110, test_loss: 1.3959, test_f1: 0.6482
 epoch: 54, train_loss: 0.2984, test_loss: 1.5126, test_f1: 0.6327
 epoch: 55, train_loss: 0.2947, test_loss: 1.6014, test_f1: 0.6093
 epoch: 56, train_loss: 0.2925, test_loss: 1.6096, test_f1: 0.6396
 epoch: 57, train_loss: 0.2842, test_loss: 1.5556, test_f1: 0.6291
 epoch: 58, train_loss: 0.2584, test_loss: 1.7160, test_f1: 0.6487
 epoch: 59, train_loss: 0.2734, test_loss: 1.6226, test_f1: 0.6457
 epoch: 60, train_loss: 0.2711, test_loss: 1.7244, test_f1: 0.6450
 epoch: 61, train_loss: 0.2672, test_loss: 1.5783, test_f1: 0.6467
 epoch: 62, train_loss: 0.2499, test_loss: 1.7195, test_f1: 0.6383
 epoch: 63, train_loss: 0.2664, test_loss: 1.7967, test_f1: 0.6436
 epoch: 64, train_loss: 0.2433, test_loss: 1.7802, test_f1: 0.6330
 epoch: 65, train_loss: 0.2427, test_loss: 1.7815, test_f1: 0.6103
 epoch: 66, train_loss: 0.2298, test_loss: 2.0046, test_f1: 0.6170
 epoch: 67, train_loss: 0.2421, test_loss: 2.0013, test_f1: 0.6152
 epoch: 68, train_loss: 0.2285, test_loss: 2.0391, test_f1: 0.6247
 epoch: 69, train_loss: 0.2284, test_loss: 1.9995, test_f1: 0.6338
 epoch: 70, train_loss: 0.2199, test_loss: 2.0473, test_f1: 0.6109
 epoch: 71, train_loss: 0.2057, test_loss: 2.1110, test_f1: 0.6248
 epoch: 72, train_loss: 0.2268, test_loss: 2.1595, test_f1: 0.6179
 epoch: 73, train_loss: 0.2379, test_loss: 2.0800, test_f1: 0.6466
 epoch: 74, train_loss: 0.2178, test_loss: 1.9149, test_f1: 0.6410
 epoch: 75, train_loss: 0.1935, test_loss: 2.1344, test_f1: 0.6002
 epoch: 76, train_loss: 0.2016, test_loss: 2.0961, test_f1: 0.6221
 epoch: 77, train_loss: 0.1998, test_loss: 2.0184, test_f1: 0.6195
 epoch: 78, train_loss: 0.2058, test_loss: 2.2555, test_f1: 0.6190
 epoch: 79, train_loss: 0.2163, test_loss: 2.1698, test_f1: 0.6379
 epoch: 80, train_loss: 0.2114, test_loss: 2.2722, test_f1: 0.6334
 epoch: 81, train_loss: 0.2044, test_loss: 2.1283, test_f1: 0.6224
 epoch: 82, train_loss: 0.2206, test_loss: 2.1401, test_f1: 0.6309
 epoch: 83, train_loss: 0.1962, test_loss: 2.2169, test_f1: 0.6317
 epoch: 84, train_loss: 0.1938, test_loss: 2.3615, test_f1: 0.6157
 epoch: 85, train_loss: 0.2051, test_loss: 2.3570, test_f1: 0.6140
 epoch: 86, train_loss: 0.2011, test_loss: 2.2804, test_f1: 0.6383
 epoch: 87, train_loss: 0.1755, test_loss: 2.3267, test_f1: 0.6093
 epoch: 88, train_loss: 0.1828, test_loss: 2.3770, test_f1: 0.6190
 epoch: 89, train_loss: 0.1848, test_loss: 2.1901, test_f1: 0.6269
 epoch: 90, train_loss: 0.1820, test_loss: 2.3640, test_f1: 0.6148
 epoch: 91, train_loss: 0.1610, test_loss: 2.4800, test_f1: 0.6263
 epoch: 92, train_loss: 0.1727, test_loss: 2.5170, test_f1: 0.6173
 epoch: 93, train_loss: 0.1827, test_loss: 2.6036, test_f1: 0.6365
 epoch: 94, train_loss: 0.1973, test_loss: 2.4037, test_f1: 0.6208
 epoch: 95, train_loss: 0.1633, test_loss: 2.5735, test_f1: 0.6124
 epoch: 96, train_loss: 0.1668, test_loss: 2.3983, test_f1: 0.6340
 epoch: 97, train_loss: 0.1625, test_loss: 2.6011, test_f1: 0.6318
 epoch: 98, train_loss: 0.1721, test_loss: 2.6182, test_f1: 0.6177
 epoch: 99, train_loss: 0.1634, test_loss: 2.5933, test_f1: 0.6265
##################ITERATION #1 ****************************************
 epoch: 0, train_loss: 1.1541, test_loss: 1.1298, test_f1: 0.3552
 epoch: 1, train_loss: 0.9901, test_loss: 0.9340, test_f1: 0.4993
 epoch: 2, train_loss: 0.9246, test_loss: 0.9584, test_f1: 0.4981
 epoch: 3, train_loss: 0.9190, test_loss: 0.9208, test_f1: 0.5363
 epoch: 4, train_loss: 0.8781, test_loss: 0.8997, test_f1: 0.5465
 epoch: 5, train_loss: 0.8649, test_loss: 0.8828, test_f1: 0.5996
 epoch: 6, train_loss: 0.8578, test_loss: 0.9300, test_f1: 0.5127
 epoch: 7, train_loss: 0.8157, test_loss: 0.9607, test_f1: 0.5444
 epoch: 8, train_loss: 0.8105, test_loss: 0.9676, test_f1: 0.5798
 epoch: 9, train_loss: 0.7870, test_loss: 0.9793, test_f1: 0.5938
 epoch: 10, train_loss: 0.7731, test_loss: 0.9984, test_f1: 0.5864
 epoch: 11, train_loss: 0.7582, test_loss: 0.9423, test_f1: 0.6079
 epoch: 12, train_loss: 0.7404, test_loss: 0.9800, test_f1: 0.5728
 epoch: 13, train_loss: 0.7443, test_loss: 0.9820, test_f1: 0.5326
 epoch: 14, train_loss: 0.7211, test_loss: 1.0394, test_f1: 0.6139
 epoch: 15, train_loss: 0.7024, test_loss: 0.9754, test_f1: 0.6018
 epoch: 16, train_loss: 0.6973, test_loss: 1.0506, test_f1: 0.5986
 epoch: 17, train_loss: 0.6755, test_loss: 1.0848, test_f1: 0.5972
 epoch: 18, train_loss: 0.6522, test_loss: 1.0400, test_f1: 0.6204
 epoch: 19, train_loss: 0.6453, test_loss: 1.1407, test_f1: 0.6065
 epoch: 20, train_loss: 0.6499, test_loss: 1.0536, test_f1: 0.5983
 epoch: 21, train_loss: 0.6344, test_loss: 1.0797, test_f1: 0.6254
 epoch: 22, train_loss: 0.6371, test_loss: 1.1177, test_f1: 0.5962
 epoch: 23, train_loss: 0.6163, test_loss: 1.0711, test_f1: 0.6031
 epoch: 24, train_loss: 0.6309, test_loss: 1.0812, test_f1: 0.6267
 epoch: 25, train_loss: 0.6113, test_loss: 1.1267, test_f1: 0.6314
 epoch: 26, train_loss: 0.6009, test_loss: 1.0553, test_f1: 0.6381
 epoch: 27, train_loss: 0.5736, test_loss: 1.2928, test_f1: 0.5969
 epoch: 28, train_loss: 0.5532, test_loss: 1.2152, test_f1: 0.6215
 epoch: 29, train_loss: 0.5617, test_loss: 1.2266, test_f1: 0.6317
 epoch: 30, train_loss: 0.5445, test_loss: 1.1932, test_f1: 0.6339
 epoch: 31, train_loss: 0.5143, test_loss: 1.1555, test_f1: 0.6523
 epoch: 32, train_loss: 0.5162, test_loss: 1.3715, test_f1: 0.5992
 epoch: 33, train_loss: 0.5081, test_loss: 1.2178, test_f1: 0.6342
 epoch: 34, train_loss: 0.5265, test_loss: 1.3309, test_f1: 0.5907
 epoch: 35, train_loss: 0.5070, test_loss: 1.3900, test_f1: 0.5966
 epoch: 36, train_loss: 0.4825, test_loss: 1.3537, test_f1: 0.6328
 epoch: 37, train_loss: 0.4671, test_loss: 1.4567, test_f1: 0.6089
 epoch: 38, train_loss: 0.4928, test_loss: 1.3949, test_f1: 0.6385
 epoch: 39, train_loss: 0.4940, test_loss: 1.4710, test_f1: 0.6009
 epoch: 40, train_loss: 0.4494, test_loss: 1.2271, test_f1: 0.6324
 epoch: 41, train_loss: 0.4738, test_loss: 1.4075, test_f1: 0.6676
 epoch: 42, train_loss: 0.4414, test_loss: 1.3343, test_f1: 0.6128
 epoch: 43, train_loss: 0.4374, test_loss: 1.3489, test_f1: 0.6284
 epoch: 44, train_loss: 0.4143, test_loss: 1.3232, test_f1: 0.6159
 epoch: 45, train_loss: 0.4069, test_loss: 1.4953, test_f1: 0.6028
 epoch: 46, train_loss: 0.3846, test_loss: 1.3894, test_f1: 0.6306
 epoch: 47, train_loss: 0.3898, test_loss: 1.6593, test_f1: 0.5817
 epoch: 48, train_loss: 0.3879, test_loss: 1.5395, test_f1: 0.6358
 epoch: 49, train_loss: 0.3751, test_loss: 1.4144, test_f1: 0.6110
 epoch: 50, train_loss: 0.4108, test_loss: 1.4535, test_f1: 0.6190
 epoch: 51, train_loss: 0.3477, test_loss: 1.4490, test_f1: 0.6401
 epoch: 52, train_loss: 0.2876, test_loss: 1.5776, test_f1: 0.6406
 epoch: 53, train_loss: 0.2759, test_loss: 1.7045, test_f1: 0.6449
 epoch: 54, train_loss: 0.2677, test_loss: 1.7969, test_f1: 0.6186
 epoch: 55, train_loss: 0.2786, test_loss: 1.7492, test_f1: 0.6347
 epoch: 56, train_loss: 0.2482, test_loss: 1.8249, test_f1: 0.6409
 epoch: 57, train_loss: 0.2591, test_loss: 1.8571, test_f1: 0.6041
 epoch: 58, train_loss: 0.2609, test_loss: 1.8298, test_f1: 0.6215
 epoch: 59, train_loss: 0.2576, test_loss: 1.8363, test_f1: 0.6204
 epoch: 60, train_loss: 0.2336, test_loss: 1.8371, test_f1: 0.6454
 epoch: 61, train_loss: 0.2229, test_loss: 1.9204, test_f1: 0.6309
 epoch: 62, train_loss: 0.2338, test_loss: 1.9029, test_f1: 0.6304
 epoch: 63, train_loss: 0.2352, test_loss: 1.9636, test_f1: 0.6345
 epoch: 64, train_loss: 0.2298, test_loss: 1.9567, test_f1: 0.6305
 epoch: 65, train_loss: 0.2367, test_loss: 2.0742, test_f1: 0.6369
 epoch: 66, train_loss: 0.2198, test_loss: 1.8826, test_f1: 0.6504
 epoch: 67, train_loss: 0.2095, test_loss: 2.0964, test_f1: 0.6326
 epoch: 68, train_loss: 0.2142, test_loss: 2.1667, test_f1: 0.6164
 epoch: 69, train_loss: 0.1968, test_loss: 2.1727, test_f1: 0.6435
 epoch: 70, train_loss: 0.2183, test_loss: 2.1644, test_f1: 0.6222
 epoch: 71, train_loss: 0.2098, test_loss: 2.1502, test_f1: 0.6473
 epoch: 72, train_loss: 0.2052, test_loss: 2.2180, test_f1: 0.6277
 epoch: 73, train_loss: 0.2099, test_loss: 2.3114, test_f1: 0.6293
 epoch: 74, train_loss: 0.1970, test_loss: 2.2617, test_f1: 0.6312
 epoch: 75, train_loss: 0.2106, test_loss: 2.2844, test_f1: 0.6197
 epoch: 76, train_loss: 0.2171, test_loss: 2.1554, test_f1: 0.6537
 epoch: 77, train_loss: 0.2039, test_loss: 2.1710, test_f1: 0.6385
 epoch: 78, train_loss: 0.2159, test_loss: 2.2178, test_f1: 0.6308
 epoch: 79, train_loss: 0.1815, test_loss: 2.1701, test_f1: 0.6325
 epoch: 80, train_loss: 0.1902, test_loss: 2.3118, test_f1: 0.6210
 epoch: 81, train_loss: 0.1724, test_loss: 2.4418, test_f1: 0.6349
 epoch: 82, train_loss: 0.1686, test_loss: 2.3731, test_f1: 0.6242
 epoch: 83, train_loss: 0.1794, test_loss: 2.5424, test_f1: 0.6047
 epoch: 84, train_loss: 0.1894, test_loss: 2.3049, test_f1: 0.6180
 epoch: 85, train_loss: 0.1747, test_loss: 2.3245, test_f1: 0.6417
 epoch: 86, train_loss: 0.1857, test_loss: 2.3610, test_f1: 0.6129
 epoch: 87, train_loss: 0.1927, test_loss: 2.3896, test_f1: 0.6194
 epoch: 88, train_loss: 0.1758, test_loss: 2.3784, test_f1: 0.6227
 epoch: 89, train_loss: 0.1615, test_loss: 2.3885, test_f1: 0.6352
 epoch: 90, train_loss: 0.1742, test_loss: 2.4249, test_f1: 0.6280
 epoch: 91, train_loss: 0.1931, test_loss: 2.3644, test_f1: 0.6328
 epoch: 92, train_loss: 0.1587, test_loss: 2.2883, test_f1: 0.6325
 epoch: 93, train_loss: 0.1468, test_loss: 2.4119, test_f1: 0.6249
 epoch: 94, train_loss: 0.1458, test_loss: 2.5759, test_f1: 0.6153
 epoch: 95, train_loss: 0.1442, test_loss: 2.5786, test_f1: 0.6259
 epoch: 96, train_loss: 0.1541, test_loss: 2.6262, test_f1: 0.6204
 epoch: 97, train_loss: 0.1692, test_loss: 2.7412, test_f1: 0.6018
 epoch: 98, train_loss: 0.1615, test_loss: 2.7793, test_f1: 0.5992
 epoch: 99, train_loss: 0.1476, test_loss: 2.7596, test_f1: 0.6235
##################ITERATION #2 ****************************************
 epoch: 0, train_loss: 1.1849, test_loss: 1.6917, test_f1: 0.0891
 epoch: 1, train_loss: 1.0171, test_loss: 0.9813, test_f1: 0.4839
 epoch: 2, train_loss: 0.9838, test_loss: 0.9482, test_f1: 0.4880
 epoch: 3, train_loss: 0.9272, test_loss: 0.9419, test_f1: 0.5081
 epoch: 4, train_loss: 0.8822, test_loss: 0.9708, test_f1: 0.5194
 epoch: 5, train_loss: 0.8772, test_loss: 0.9350, test_f1: 0.5040
 epoch: 6, train_loss: 0.8654, test_loss: 1.0099, test_f1: 0.5063
 epoch: 7, train_loss: 0.8392, test_loss: 0.9471, test_f1: 0.5194
 epoch: 8, train_loss: 0.8224, test_loss: 0.9479, test_f1: 0.5428
 epoch: 9, train_loss: 0.8029, test_loss: 0.9979, test_f1: 0.5654
 epoch: 10, train_loss: 0.7967, test_loss: 1.0398, test_f1: 0.5299
 epoch: 11, train_loss: 0.7759, test_loss: 0.9881, test_f1: 0.5456
 epoch: 12, train_loss: 0.7798, test_loss: 0.9446, test_f1: 0.5874
 epoch: 13, train_loss: 0.7627, test_loss: 1.0016, test_f1: 0.5442
 epoch: 14, train_loss: 0.7447, test_loss: 1.0486, test_f1: 0.5280
 epoch: 15, train_loss: 0.7427, test_loss: 0.9854, test_f1: 0.6072
 epoch: 16, train_loss: 0.7297, test_loss: 1.0863, test_f1: 0.5531
 epoch: 17, train_loss: 0.7128, test_loss: 1.0135, test_f1: 0.5924
 epoch: 18, train_loss: 0.7216, test_loss: 1.0176, test_f1: 0.6070
 epoch: 19, train_loss: 0.6791, test_loss: 0.9742, test_f1: 0.6265
 epoch: 20, train_loss: 0.6796, test_loss: 1.0597, test_f1: 0.5761
 epoch: 21, train_loss: 0.6724, test_loss: 1.1136, test_f1: 0.5653
 epoch: 22, train_loss: 0.6527, test_loss: 1.0089, test_f1: 0.6022
 epoch: 23, train_loss: 0.6800, test_loss: 1.0109, test_f1: 0.6377
 epoch: 24, train_loss: 0.6598, test_loss: 1.1109, test_f1: 0.6062
 epoch: 25, train_loss: 0.6254, test_loss: 0.9772, test_f1: 0.5945
 epoch: 26, train_loss: 0.6042, test_loss: 1.0920, test_f1: 0.6258
 epoch: 27, train_loss: 0.5900, test_loss: 1.0237, test_f1: 0.6313
 epoch: 28, train_loss: 0.5948, test_loss: 1.1940, test_f1: 0.5920
 epoch: 29, train_loss: 0.5819, test_loss: 1.1869, test_f1: 0.6066
 epoch: 30, train_loss: 0.5874, test_loss: 1.0481, test_f1: 0.6393
 epoch: 31, train_loss: 0.5739, test_loss: 1.0852, test_f1: 0.6053
 epoch: 32, train_loss: 0.5570, test_loss: 1.1001, test_f1: 0.6164
 epoch: 33, train_loss: 0.5383, test_loss: 1.1586, test_f1: 0.6146
 epoch: 34, train_loss: 0.5230, test_loss: 1.1410, test_f1: 0.5894
 epoch: 35, train_loss: 0.5323, test_loss: 1.2400, test_f1: 0.6201
 epoch: 36, train_loss: 0.5174, test_loss: 1.0933, test_f1: 0.6196
 epoch: 37, train_loss: 0.5017, test_loss: 1.1938, test_f1: 0.6030
 epoch: 38, train_loss: 0.4939, test_loss: 1.2504, test_f1: 0.6179
 epoch: 39, train_loss: 0.4913, test_loss: 1.1260, test_f1: 0.6580
 epoch: 40, train_loss: 0.4715, test_loss: 1.1704, test_f1: 0.6526
 epoch: 41, train_loss: 0.4581, test_loss: 1.3087, test_f1: 0.6212
 epoch: 42, train_loss: 0.4835, test_loss: 1.3021, test_f1: 0.6273
 epoch: 43, train_loss: 0.4345, test_loss: 1.2960, test_f1: 0.6319
 epoch: 44, train_loss: 0.4272, test_loss: 1.4820, test_f1: 0.6203
 epoch: 45, train_loss: 0.4658, test_loss: 1.2641, test_f1: 0.6163
 epoch: 46, train_loss: 0.4361, test_loss: 1.3067, test_f1: 0.6370
 epoch: 47, train_loss: 0.4174, test_loss: 1.3846, test_f1: 0.6505
 epoch: 48, train_loss: 0.4107, test_loss: 1.4169, test_f1: 0.6140
 epoch: 49, train_loss: 0.4793, test_loss: 1.2626, test_f1: 0.6451
 epoch: 50, train_loss: 0.4014, test_loss: 1.3729, test_f1: 0.6261
 epoch: 51, train_loss: 0.3586, test_loss: 1.4230, test_f1: 0.6590
 epoch: 52, train_loss: 0.3236, test_loss: 1.4239, test_f1: 0.6475
 epoch: 53, train_loss: 0.3059, test_loss: 1.4942, test_f1: 0.6401
 epoch: 54, train_loss: 0.2981, test_loss: 1.5181, test_f1: 0.6550
 epoch: 55, train_loss: 0.2859, test_loss: 1.5533, test_f1: 0.6522
 epoch: 56, train_loss: 0.2782, test_loss: 1.5174, test_f1: 0.6702
 epoch: 57, train_loss: 0.2734, test_loss: 1.6101, test_f1: 0.6781
 epoch: 58, train_loss: 0.2927, test_loss: 1.5734, test_f1: 0.6479
 epoch: 59, train_loss: 0.2826, test_loss: 1.5515, test_f1: 0.6762
 epoch: 60, train_loss: 0.2708, test_loss: 1.6091, test_f1: 0.6541
 epoch: 61, train_loss: 0.2582, test_loss: 1.7397, test_f1: 0.6543
 epoch: 62, train_loss: 0.2548, test_loss: 1.5528, test_f1: 0.6619
 epoch: 63, train_loss: 0.2609, test_loss: 1.6498, test_f1: 0.6550
 epoch: 64, train_loss: 0.2628, test_loss: 1.7458, test_f1: 0.6409
 epoch: 65, train_loss: 0.2862, test_loss: 1.6539, test_f1: 0.6601
 epoch: 66, train_loss: 0.2679, test_loss: 1.6029, test_f1: 0.6518
 epoch: 67, train_loss: 0.2697, test_loss: 1.7036, test_f1: 0.6532
 epoch: 68, train_loss: 0.2722, test_loss: 1.7752, test_f1: 0.6562
 epoch: 69, train_loss: 0.2360, test_loss: 1.7426, test_f1: 0.6434
 epoch: 70, train_loss: 0.2349, test_loss: 1.9673, test_f1: 0.6187
 epoch: 71, train_loss: 0.2341, test_loss: 1.7668, test_f1: 0.6620
 epoch: 72, train_loss: 0.2271, test_loss: 1.7850, test_f1: 0.6464
 epoch: 73, train_loss: 0.2182, test_loss: 1.7300, test_f1: 0.6658
 epoch: 74, train_loss: 0.2130, test_loss: 1.7198, test_f1: 0.6480
 epoch: 75, train_loss: 0.2172, test_loss: 1.9252, test_f1: 0.6415
 epoch: 76, train_loss: 0.2197, test_loss: 1.9923, test_f1: 0.6256
 epoch: 77, train_loss: 0.2294, test_loss: 1.7734, test_f1: 0.6665
 epoch: 78, train_loss: 0.2152, test_loss: 1.8621, test_f1: 0.6506
 epoch: 79, train_loss: 0.2098, test_loss: 1.9667, test_f1: 0.6342
 epoch: 80, train_loss: 0.2413, test_loss: 1.8331, test_f1: 0.6498
 epoch: 81, train_loss: 0.2032, test_loss: 1.9892, test_f1: 0.6432
 epoch: 82, train_loss: 0.1990, test_loss: 1.9561, test_f1: 0.6360
 epoch: 83, train_loss: 0.1796, test_loss: 2.1004, test_f1: 0.6397
 epoch: 84, train_loss: 0.1949, test_loss: 1.9460, test_f1: 0.6616
 epoch: 85, train_loss: 0.1924, test_loss: 1.8502, test_f1: 0.6666
 epoch: 86, train_loss: 0.1904, test_loss: 2.0133, test_f1: 0.6398
 epoch: 87, train_loss: 0.2135, test_loss: 1.9057, test_f1: 0.6474
 epoch: 88, train_loss: 0.1858, test_loss: 2.2490, test_f1: 0.6444
 epoch: 89, train_loss: 0.2054, test_loss: 2.3058, test_f1: 0.6541
 epoch: 90, train_loss: 0.1833, test_loss: 2.1850, test_f1: 0.6490
 epoch: 91, train_loss: 0.2084, test_loss: 1.8717, test_f1: 0.6616
 epoch: 92, train_loss: 0.2005, test_loss: 2.1512, test_f1: 0.6582
 epoch: 93, train_loss: 0.1896, test_loss: 2.0453, test_f1: 0.6525
 epoch: 94, train_loss: 0.1840, test_loss: 2.0182, test_f1: 0.6486
 epoch: 95, train_loss: 0.1798, test_loss: 2.1175, test_f1: 0.6551
 epoch: 96, train_loss: 0.1772, test_loss: 1.9609, test_f1: 0.6560
 epoch: 97, train_loss: 0.1661, test_loss: 2.1267, test_f1: 0.6449
 epoch: 98, train_loss: 0.1576, test_loss: 2.0540, test_f1: 0.6386
 epoch: 99, train_loss: 0.1701, test_loss: 2.1523, test_f1: 0.6478
##################ITERATION #3 ****************************************
 epoch: 0, train_loss: 1.2071, test_loss: 1.1359, test_f1: 0.3262
 epoch: 1, train_loss: 0.9972, test_loss: 0.9972, test_f1: 0.4825
 epoch: 2, train_loss: 0.9432, test_loss: 1.0104, test_f1: 0.5310
 epoch: 3, train_loss: 0.9111, test_loss: 0.9361, test_f1: 0.4882
 epoch: 4, train_loss: 0.8967, test_loss: 0.9981, test_f1: 0.5163
 epoch: 5, train_loss: 0.8852, test_loss: 1.0258, test_f1: 0.4819
 epoch: 6, train_loss: 0.8537, test_loss: 0.9996, test_f1: 0.5011
 epoch: 7, train_loss: 0.8341, test_loss: 1.0066, test_f1: 0.5465
 epoch: 8, train_loss: 0.8237, test_loss: 1.0315, test_f1: 0.5320
 epoch: 9, train_loss: 0.8166, test_loss: 1.0027, test_f1: 0.5448
 epoch: 10, train_loss: 0.8064, test_loss: 1.0503, test_f1: 0.5419
 epoch: 11, train_loss: 0.7954, test_loss: 1.0361, test_f1: 0.5345
 epoch: 12, train_loss: 0.7860, test_loss: 0.9938, test_f1: 0.5612
 epoch: 13, train_loss: 0.7785, test_loss: 1.0642, test_f1: 0.5903
 epoch: 14, train_loss: 0.7771, test_loss: 1.0425, test_f1: 0.5760
 epoch: 15, train_loss: 0.7520, test_loss: 1.0659, test_f1: 0.5826
 epoch: 16, train_loss: 0.7498, test_loss: 1.0014, test_f1: 0.5494
 epoch: 17, train_loss: 0.7299, test_loss: 0.9992, test_f1: 0.5361
 epoch: 18, train_loss: 0.7350, test_loss: 1.0060, test_f1: 0.5878
 epoch: 19, train_loss: 0.7311, test_loss: 1.0291, test_f1: 0.6001
 epoch: 20, train_loss: 0.7042, test_loss: 1.0824, test_f1: 0.6090
 epoch: 21, train_loss: 0.6944, test_loss: 1.0766, test_f1: 0.5917
 epoch: 22, train_loss: 0.6967, test_loss: 1.1221, test_f1: 0.5851
 epoch: 23, train_loss: 0.6865, test_loss: 1.0686, test_f1: 0.6038
 epoch: 24, train_loss: 0.6705, test_loss: 1.0640, test_f1: 0.5945
 epoch: 25, train_loss: 0.6681, test_loss: 1.0354, test_f1: 0.5932
 epoch: 26, train_loss: 0.6372, test_loss: 1.1972, test_f1: 0.5889
 epoch: 27, train_loss: 0.6334, test_loss: 1.1794, test_f1: 0.5923
 epoch: 28, train_loss: 0.6252, test_loss: 1.0739, test_f1: 0.5750
 epoch: 29, train_loss: 0.6097, test_loss: 1.0639, test_f1: 0.6120
 epoch: 30, train_loss: 0.6058, test_loss: 1.1368, test_f1: 0.6032
 epoch: 31, train_loss: 0.5892, test_loss: 1.1681, test_f1: 0.6174
 epoch: 32, train_loss: 0.5821, test_loss: 1.1404, test_f1: 0.6299
 epoch: 33, train_loss: 0.5736, test_loss: 1.2407, test_f1: 0.5896
 epoch: 34, train_loss: 0.5882, test_loss: 1.1224, test_f1: 0.6191
 epoch: 35, train_loss: 0.5741, test_loss: 1.1438, test_f1: 0.6188
 epoch: 36, train_loss: 0.5440, test_loss: 1.2365, test_f1: 0.6157
 epoch: 37, train_loss: 0.5421, test_loss: 1.3664, test_f1: 0.5907
 epoch: 38, train_loss: 0.5341, test_loss: 1.3004, test_f1: 0.6362
 epoch: 39, train_loss: 0.5337, test_loss: 1.2180, test_f1: 0.6301
 epoch: 40, train_loss: 0.5251, test_loss: 1.1703, test_f1: 0.6283
 epoch: 41, train_loss: 0.5060, test_loss: 1.3172, test_f1: 0.6028
 epoch: 42, train_loss: 0.4902, test_loss: 1.3300, test_f1: 0.6390
 epoch: 43, train_loss: 0.5048, test_loss: 1.2625, test_f1: 0.6463
 epoch: 44, train_loss: 0.4785, test_loss: 1.2718, test_f1: 0.6227
 epoch: 45, train_loss: 0.5119, test_loss: 1.3035, test_f1: 0.5951
 epoch: 46, train_loss: 0.4938, test_loss: 1.2780, test_f1: 0.6155
 epoch: 47, train_loss: 0.4866, test_loss: 1.4189, test_f1: 0.6297
 epoch: 48, train_loss: 0.4875, test_loss: 1.2501, test_f1: 0.6085
 epoch: 49, train_loss: 0.4584, test_loss: 1.3640, test_f1: 0.6417
 epoch: 50, train_loss: 0.4544, test_loss: 1.3304, test_f1: 0.6151
 epoch: 51, train_loss: 0.3930, test_loss: 1.3285, test_f1: 0.6474
 epoch: 52, train_loss: 0.3747, test_loss: 1.3358, test_f1: 0.6497
 epoch: 53, train_loss: 0.3661, test_loss: 1.4433, test_f1: 0.6638
 epoch: 54, train_loss: 0.3490, test_loss: 1.5195, test_f1: 0.6540
 epoch: 55, train_loss: 0.3377, test_loss: 1.5994, test_f1: 0.6533
 epoch: 56, train_loss: 0.3343, test_loss: 1.5200, test_f1: 0.6411
 epoch: 57, train_loss: 0.3324, test_loss: 1.5885, test_f1: 0.6395
 epoch: 58, train_loss: 0.3211, test_loss: 1.5736, test_f1: 0.6313
 epoch: 59, train_loss: 0.3112, test_loss: 1.6780, test_f1: 0.6278
 epoch: 60, train_loss: 0.3091, test_loss: 1.6324, test_f1: 0.6328
 epoch: 61, train_loss: 0.3289, test_loss: 1.7322, test_f1: 0.6427
 epoch: 62, train_loss: 0.3152, test_loss: 1.6011, test_f1: 0.6524
 epoch: 63, train_loss: 0.3063, test_loss: 1.7488, test_f1: 0.6156
 epoch: 64, train_loss: 0.3152, test_loss: 1.6586, test_f1: 0.6617
 epoch: 65, train_loss: 0.2913, test_loss: 1.8050, test_f1: 0.6176
 epoch: 66, train_loss: 0.2748, test_loss: 1.7777, test_f1: 0.6434
 epoch: 67, train_loss: 0.2867, test_loss: 1.7937, test_f1: 0.6351
 epoch: 68, train_loss: 0.2855, test_loss: 1.7284, test_f1: 0.6483
 epoch: 69, train_loss: 0.2717, test_loss: 1.8810, test_f1: 0.6571
 epoch: 70, train_loss: 0.2649, test_loss: 1.9639, test_f1: 0.6302
 epoch: 71, train_loss: 0.2769, test_loss: 1.8578, test_f1: 0.6488
 epoch: 72, train_loss: 0.2570, test_loss: 1.8843, test_f1: 0.6281
 epoch: 73, train_loss: 0.2529, test_loss: 1.8669, test_f1: 0.6363
 epoch: 74, train_loss: 0.2649, test_loss: 1.9366, test_f1: 0.6451
 epoch: 75, train_loss: 0.2632, test_loss: 1.7807, test_f1: 0.6298
 epoch: 76, train_loss: 0.2530, test_loss: 2.0554, test_f1: 0.6305
 epoch: 77, train_loss: 0.2544, test_loss: 2.0585, test_f1: 0.6442
 epoch: 78, train_loss: 0.2609, test_loss: 1.9713, test_f1: 0.6424
 epoch: 79, train_loss: 0.2403, test_loss: 1.9161, test_f1: 0.6351
 epoch: 80, train_loss: 0.2578, test_loss: 2.0131, test_f1: 0.6519
 epoch: 81, train_loss: 0.2417, test_loss: 1.9869, test_f1: 0.6388
 epoch: 82, train_loss: 0.2468, test_loss: 2.0111, test_f1: 0.6375
 epoch: 83, train_loss: 0.2210, test_loss: 2.0512, test_f1: 0.6177
 epoch: 84, train_loss: 0.2134, test_loss: 2.0911, test_f1: 0.6474
 epoch: 85, train_loss: 0.2243, test_loss: 1.9924, test_f1: 0.6309
 epoch: 86, train_loss: 0.2399, test_loss: 2.0760, test_f1: 0.6251
 epoch: 87, train_loss: 0.2400, test_loss: 1.9927, test_f1: 0.6424
 epoch: 88, train_loss: 0.2127, test_loss: 2.1706, test_f1: 0.6167
 epoch: 89, train_loss: 0.2200, test_loss: 2.2306, test_f1: 0.6502
 epoch: 90, train_loss: 0.2261, test_loss: 2.1227, test_f1: 0.6343
 epoch: 91, train_loss: 0.2062, test_loss: 2.1108, test_f1: 0.6259
 epoch: 92, train_loss: 0.2025, test_loss: 2.2797, test_f1: 0.6562
 epoch: 93, train_loss: 0.1981, test_loss: 2.3123, test_f1: 0.6492
 epoch: 94, train_loss: 0.1991, test_loss: 2.2946, test_f1: 0.6208
 epoch: 95, train_loss: 0.1851, test_loss: 2.2359, test_f1: 0.6306
 epoch: 96, train_loss: 0.2130, test_loss: 2.4980, test_f1: 0.6339
 epoch: 97, train_loss: 0.2406, test_loss: 2.3387, test_f1: 0.6488
 epoch: 98, train_loss: 0.2244, test_loss: 2.2112, test_f1: 0.6214
 epoch: 99, train_loss: 0.2082, test_loss: 2.1384, test_f1: 0.6341
##################ITERATION #4 ****************************************
 epoch: 0, train_loss: 1.2640, test_loss: 1.2042, test_f1: 0.3212
 epoch: 1, train_loss: 1.0128, test_loss: 0.9705, test_f1: 0.4662
 epoch: 2, train_loss: 0.9561, test_loss: 0.9416, test_f1: 0.4773
 epoch: 3, train_loss: 0.9201, test_loss: 0.9068, test_f1: 0.4779
 epoch: 4, train_loss: 0.8934, test_loss: 0.9149, test_f1: 0.4955
 epoch: 5, train_loss: 0.8755, test_loss: 0.9788, test_f1: 0.4706
 epoch: 6, train_loss: 0.8586, test_loss: 0.9495, test_f1: 0.5168
 epoch: 7, train_loss: 0.8329, test_loss: 0.9573, test_f1: 0.5325
 epoch: 8, train_loss: 0.8365, test_loss: 0.9103, test_f1: 0.5033
 epoch: 9, train_loss: 0.8322, test_loss: 0.9453, test_f1: 0.5385
 epoch: 10, train_loss: 0.8183, test_loss: 0.8655, test_f1: 0.5482
 epoch: 11, train_loss: 0.7904, test_loss: 0.9528, test_f1: 0.5578
 epoch: 12, train_loss: 0.7754, test_loss: 0.9511, test_f1: 0.5522
 epoch: 13, train_loss: 0.7859, test_loss: 0.9337, test_f1: 0.5641
 epoch: 14, train_loss: 0.7530, test_loss: 0.9529, test_f1: 0.5448
 epoch: 15, train_loss: 0.7437, test_loss: 0.9396, test_f1: 0.5607
 epoch: 16, train_loss: 0.7234, test_loss: 0.9008, test_f1: 0.5957
 epoch: 17, train_loss: 0.7243, test_loss: 0.9937, test_f1: 0.5826
 epoch: 18, train_loss: 0.7193, test_loss: 0.9869, test_f1: 0.5605
 epoch: 19, train_loss: 0.7264, test_loss: 0.9436, test_f1: 0.6027
 epoch: 20, train_loss: 0.6951, test_loss: 0.9818, test_f1: 0.5748
 epoch: 21, train_loss: 0.6905, test_loss: 0.9833, test_f1: 0.6347
 epoch: 22, train_loss: 0.6886, test_loss: 0.9515, test_f1: 0.5616
 epoch: 23, train_loss: 0.6521, test_loss: 0.9302, test_f1: 0.6260
 epoch: 24, train_loss: 0.6597, test_loss: 0.9987, test_f1: 0.6234
 epoch: 25, train_loss: 0.6534, test_loss: 1.0631, test_f1: 0.5825
 epoch: 26, train_loss: 0.6478, test_loss: 1.0035, test_f1: 0.5822
 epoch: 27, train_loss: 0.6615, test_loss: 0.9021, test_f1: 0.5949
 epoch: 28, train_loss: 0.6327, test_loss: 0.9996, test_f1: 0.6052
 epoch: 29, train_loss: 0.6215, test_loss: 1.0372, test_f1: 0.6193
 epoch: 30, train_loss: 0.5973, test_loss: 0.9632, test_f1: 0.6287
 epoch: 31, train_loss: 0.5949, test_loss: 1.0912, test_f1: 0.6082
 epoch: 32, train_loss: 0.5765, test_loss: 1.0235, test_f1: 0.6143
 epoch: 33, train_loss: 0.5787, test_loss: 1.1126, test_f1: 0.6172
 epoch: 34, train_loss: 0.5799, test_loss: 1.0699, test_f1: 0.5966
 epoch: 35, train_loss: 0.5719, test_loss: 1.0800, test_f1: 0.6033
 epoch: 36, train_loss: 0.5422, test_loss: 1.1397, test_f1: 0.6040
 epoch: 37, train_loss: 0.5426, test_loss: 1.0642, test_f1: 0.6594
 epoch: 38, train_loss: 0.5332, test_loss: 1.1658, test_f1: 0.6402
 epoch: 39, train_loss: 0.5169, test_loss: 1.0814, test_f1: 0.6423
 epoch: 40, train_loss: 0.5202, test_loss: 1.2707, test_f1: 0.5852
 epoch: 41, train_loss: 0.5155, test_loss: 1.3131, test_f1: 0.6192
 epoch: 42, train_loss: 0.5112, test_loss: 1.0165, test_f1: 0.6306
 epoch: 43, train_loss: 0.5125, test_loss: 1.1199, test_f1: 0.6287
 epoch: 44, train_loss: 0.4786, test_loss: 1.1514, test_f1: 0.6708
 epoch: 45, train_loss: 0.4683, test_loss: 1.0449, test_f1: 0.6496
 epoch: 46, train_loss: 0.4743, test_loss: 1.1860, test_f1: 0.6273
 epoch: 47, train_loss: 0.4814, test_loss: 1.2875, test_f1: 0.6250
 epoch: 48, train_loss: 0.4710, test_loss: 1.2502, test_f1: 0.6448
 epoch: 49, train_loss: 0.4433, test_loss: 1.2516, test_f1: 0.6440
 epoch: 50, train_loss: 0.4613, test_loss: 1.1741, test_f1: 0.6202
 epoch: 51, train_loss: 0.3954, test_loss: 1.3107, test_f1: 0.6367
 epoch: 52, train_loss: 0.3607, test_loss: 1.3219, test_f1: 0.6380
 epoch: 53, train_loss: 0.3659, test_loss: 1.3203, test_f1: 0.6390
 epoch: 54, train_loss: 0.3420, test_loss: 1.3819, test_f1: 0.6340
 epoch: 55, train_loss: 0.3384, test_loss: 1.5497, test_f1: 0.6125
 epoch: 56, train_loss: 0.3368, test_loss: 1.4304, test_f1: 0.6614
 epoch: 57, train_loss: 0.3179, test_loss: 1.4736, test_f1: 0.6402
 epoch: 58, train_loss: 0.3387, test_loss: 1.5309, test_f1: 0.6042
 epoch: 59, train_loss: 0.3320, test_loss: 1.5113, test_f1: 0.6308
 epoch: 60, train_loss: 0.3186, test_loss: 1.3727, test_f1: 0.6628
 epoch: 61, train_loss: 0.3059, test_loss: 1.5054, test_f1: 0.6535
 epoch: 62, train_loss: 0.2991, test_loss: 1.6316, test_f1: 0.6197
 epoch: 63, train_loss: 0.2959, test_loss: 1.6281, test_f1: 0.6424
 epoch: 64, train_loss: 0.2901, test_loss: 1.5691, test_f1: 0.6341
 epoch: 65, train_loss: 0.2946, test_loss: 1.5848, test_f1: 0.6450
 epoch: 66, train_loss: 0.2931, test_loss: 1.6743, test_f1: 0.6268
 epoch: 67, train_loss: 0.2885, test_loss: 1.6404, test_f1: 0.6313
 epoch: 68, train_loss: 0.2836, test_loss: 1.4753, test_f1: 0.6478
 epoch: 69, train_loss: 0.2693, test_loss: 1.6407, test_f1: 0.6299
 epoch: 70, train_loss: 0.2879, test_loss: 1.8362, test_f1: 0.6177
 epoch: 71, train_loss: 0.2788, test_loss: 1.5610, test_f1: 0.6444
 epoch: 72, train_loss: 0.2831, test_loss: 1.7713, test_f1: 0.6207
 epoch: 73, train_loss: 0.2778, test_loss: 1.5607, test_f1: 0.6228
 epoch: 74, train_loss: 0.2675, test_loss: 1.6804, test_f1: 0.6265
 epoch: 75, train_loss: 0.2436, test_loss: 1.6817, test_f1: 0.6375
 epoch: 76, train_loss: 0.2462, test_loss: 1.6397, test_f1: 0.6545
 epoch: 77, train_loss: 0.2501, test_loss: 1.7071, test_f1: 0.6430
 epoch: 78, train_loss: 0.2429, test_loss: 1.7962, test_f1: 0.6269
 epoch: 79, train_loss: 0.2320, test_loss: 1.7827, test_f1: 0.6431
 epoch: 80, train_loss: 0.2314, test_loss: 1.9943, test_f1: 0.6140
 epoch: 81, train_loss: 0.2403, test_loss: 1.7877, test_f1: 0.6367
 epoch: 82, train_loss: 0.2395, test_loss: 1.7804, test_f1: 0.6672
 epoch: 83, train_loss: 0.2304, test_loss: 1.7573, test_f1: 0.6496
 epoch: 84, train_loss: 0.2423, test_loss: 2.0219, test_f1: 0.6437
 epoch: 85, train_loss: 0.2309, test_loss: 1.9097, test_f1: 0.6312
 epoch: 86, train_loss: 0.2090, test_loss: 2.0970, test_f1: 0.6411
 epoch: 87, train_loss: 0.2277, test_loss: 1.9611, test_f1: 0.6358
 epoch: 88, train_loss: 0.2532, test_loss: 1.7389, test_f1: 0.6281
 epoch: 89, train_loss: 0.2238, test_loss: 1.7809, test_f1: 0.6298
 epoch: 90, train_loss: 0.2297, test_loss: 1.8632, test_f1: 0.6494
 epoch: 91, train_loss: 0.2239, test_loss: 1.8919, test_f1: 0.6342
 epoch: 92, train_loss: 0.2143, test_loss: 1.9110, test_f1: 0.6299
 epoch: 93, train_loss: 0.2178, test_loss: 1.8723, test_f1: 0.6322
 epoch: 94, train_loss: 0.2144, test_loss: 1.9314, test_f1: 0.6377
 epoch: 95, train_loss: 0.2391, test_loss: 1.8646, test_f1: 0.6494
 epoch: 96, train_loss: 0.2041, test_loss: 2.0414, test_f1: 0.6411
 epoch: 97, train_loss: 0.2139, test_loss: 1.9867, test_f1: 0.6220
 epoch: 98, train_loss: 0.2107, test_loss: 2.0370, test_f1: 0.6378
 epoch: 99, train_loss: 0.1972, test_loss: 2.1189, test_f1: 0.6595
##################ITERATION #5 ****************************************
 epoch: 0, train_loss: 1.3509, test_loss: 1.1908, test_f1: 0.3238
 epoch: 1, train_loss: 1.0078, test_loss: 0.9634, test_f1: 0.4756
 epoch: 2, train_loss: 0.9595, test_loss: 0.9457, test_f1: 0.4753
 epoch: 3, train_loss: 0.9210, test_loss: 0.9581, test_f1: 0.4804
 epoch: 4, train_loss: 0.9033, test_loss: 0.9980, test_f1: 0.5071
 epoch: 5, train_loss: 0.8784, test_loss: 0.9576, test_f1: 0.5163
 epoch: 6, train_loss: 0.8486, test_loss: 0.9761, test_f1: 0.5353
 epoch: 7, train_loss: 0.8539, test_loss: 0.9965, test_f1: 0.5015
 epoch: 8, train_loss: 0.8481, test_loss: 0.9657, test_f1: 0.5588
 epoch: 9, train_loss: 0.8305, test_loss: 1.0709, test_f1: 0.4872
 epoch: 10, train_loss: 0.8123, test_loss: 0.9821, test_f1: 0.5468
 epoch: 11, train_loss: 0.8046, test_loss: 0.9652, test_f1: 0.5617
 epoch: 12, train_loss: 0.7887, test_loss: 0.9303, test_f1: 0.5199
 epoch: 13, train_loss: 0.7812, test_loss: 1.0098, test_f1: 0.5546
 epoch: 14, train_loss: 0.7630, test_loss: 0.9952, test_f1: 0.5588
 epoch: 15, train_loss: 0.7544, test_loss: 0.9976, test_f1: 0.5645
 epoch: 16, train_loss: 0.7481, test_loss: 1.0772, test_f1: 0.5377
 epoch: 17, train_loss: 0.7283, test_loss: 1.0418, test_f1: 0.5951
 epoch: 18, train_loss: 0.7231, test_loss: 1.0097, test_f1: 0.5838
 epoch: 19, train_loss: 0.7087, test_loss: 1.0343, test_f1: 0.6030
 epoch: 20, train_loss: 0.7000, test_loss: 1.0930, test_f1: 0.5801
 epoch: 21, train_loss: 0.6914, test_loss: 1.1278, test_f1: 0.5480
 epoch: 22, train_loss: 0.6840, test_loss: 0.9757, test_f1: 0.6162
 epoch: 23, train_loss: 0.6823, test_loss: 1.0525, test_f1: 0.5902
 epoch: 24, train_loss: 0.6830, test_loss: 1.0803, test_f1: 0.6123
 epoch: 25, train_loss: 0.6747, test_loss: 1.0116, test_f1: 0.6032
 epoch: 26, train_loss: 0.6626, test_loss: 1.1992, test_f1: 0.5610
 epoch: 27, train_loss: 0.6337, test_loss: 1.0648, test_f1: 0.6085
 epoch: 28, train_loss: 0.6175, test_loss: 1.0670, test_f1: 0.6104
 epoch: 29, train_loss: 0.6218, test_loss: 1.1530, test_f1: 0.5902
 epoch: 30, train_loss: 0.6407, test_loss: 1.0716, test_f1: 0.6156
 epoch: 31, train_loss: 0.6264, test_loss: 1.0755, test_f1: 0.6243
 epoch: 32, train_loss: 0.5919, test_loss: 1.2275, test_f1: 0.6048
 epoch: 33, train_loss: 0.6120, test_loss: 1.2513, test_f1: 0.5996
 epoch: 34, train_loss: 0.5846, test_loss: 1.1484, test_f1: 0.6110
 epoch: 35, train_loss: 0.5802, test_loss: 1.1389, test_f1: 0.5691
 epoch: 36, train_loss: 0.5586, test_loss: 1.2194, test_f1: 0.6091
 epoch: 37, train_loss: 0.5642, test_loss: 1.1738, test_f1: 0.5931
 epoch: 38, train_loss: 0.5626, test_loss: 1.0917, test_f1: 0.6272
 epoch: 39, train_loss: 0.5346, test_loss: 1.0930, test_f1: 0.6310
 epoch: 40, train_loss: 0.5557, test_loss: 1.1742, test_f1: 0.5815
 epoch: 41, train_loss: 0.5336, test_loss: 1.2743, test_f1: 0.6217
 epoch: 42, train_loss: 0.4905, test_loss: 1.2062, test_f1: 0.6032
 epoch: 43, train_loss: 0.5076, test_loss: 1.1968, test_f1: 0.6386
 epoch: 44, train_loss: 0.5075, test_loss: 1.2189, test_f1: 0.6097
 epoch: 45, train_loss: 0.4995, test_loss: 1.1980, test_f1: 0.6149
 epoch: 46, train_loss: 0.4676, test_loss: 1.2998, test_f1: 0.6447
 epoch: 47, train_loss: 0.4926, test_loss: 1.2158, test_f1: 0.6246
 epoch: 48, train_loss: 0.4915, test_loss: 1.2246, test_f1: 0.6202
 epoch: 49, train_loss: 0.4590, test_loss: 1.3595, test_f1: 0.6132
 epoch: 50, train_loss: 0.4653, test_loss: 1.4494, test_f1: 0.5936
 epoch: 51, train_loss: 0.4422, test_loss: 1.3157, test_f1: 0.6330
 epoch: 52, train_loss: 0.4122, test_loss: 1.2818, test_f1: 0.6439
 epoch: 53, train_loss: 0.3671, test_loss: 1.4450, test_f1: 0.6198
 epoch: 54, train_loss: 0.3549, test_loss: 1.4129, test_f1: 0.6280
 epoch: 55, train_loss: 0.3592, test_loss: 1.3272, test_f1: 0.6461
 epoch: 56, train_loss: 0.3427, test_loss: 1.3468, test_f1: 0.6650
 epoch: 57, train_loss: 0.3474, test_loss: 1.4146, test_f1: 0.6371
 epoch: 58, train_loss: 0.3323, test_loss: 1.4500, test_f1: 0.6548
 epoch: 59, train_loss: 0.3168, test_loss: 1.4908, test_f1: 0.6517
 epoch: 60, train_loss: 0.3161, test_loss: 1.4420, test_f1: 0.6499
 epoch: 61, train_loss: 0.3193, test_loss: 1.4159, test_f1: 0.6258
 epoch: 62, train_loss: 0.3143, test_loss: 1.4708, test_f1: 0.6487
 epoch: 63, train_loss: 0.3170, test_loss: 1.5051, test_f1: 0.6454
 epoch: 64, train_loss: 0.3163, test_loss: 1.5278, test_f1: 0.6372
 epoch: 65, train_loss: 0.3074, test_loss: 1.4847, test_f1: 0.6356
 epoch: 66, train_loss: 0.2973, test_loss: 1.5437, test_f1: 0.6431
 epoch: 67, train_loss: 0.3053, test_loss: 1.4801, test_f1: 0.6494
 epoch: 68, train_loss: 0.3069, test_loss: 1.4391, test_f1: 0.6728
 epoch: 69, train_loss: 0.2951, test_loss: 1.5290, test_f1: 0.6410
 epoch: 70, train_loss: 0.2923, test_loss: 1.6605, test_f1: 0.6278
 epoch: 71, train_loss: 0.2756, test_loss: 1.6093, test_f1: 0.6599
 epoch: 72, train_loss: 0.2814, test_loss: 1.5425, test_f1: 0.6485
 epoch: 73, train_loss: 0.2835, test_loss: 1.6712, test_f1: 0.6530
 epoch: 74, train_loss: 0.2910, test_loss: 1.5084, test_f1: 0.6674
 epoch: 75, train_loss: 0.2841, test_loss: 1.6739, test_f1: 0.6392
 epoch: 76, train_loss: 0.2825, test_loss: 1.6250, test_f1: 0.6445
 epoch: 77, train_loss: 0.2751, test_loss: 1.5156, test_f1: 0.6473
 epoch: 78, train_loss: 0.2618, test_loss: 1.6598, test_f1: 0.6300
 epoch: 79, train_loss: 0.2535, test_loss: 1.5730, test_f1: 0.6614
 epoch: 80, train_loss: 0.2635, test_loss: 1.6308, test_f1: 0.6449
 epoch: 81, train_loss: 0.2432, test_loss: 1.7220, test_f1: 0.6408
 epoch: 82, train_loss: 0.2409, test_loss: 1.7095, test_f1: 0.6368
 epoch: 83, train_loss: 0.2573, test_loss: 1.7379, test_f1: 0.6467
 epoch: 84, train_loss: 0.2492, test_loss: 1.6254, test_f1: 0.6244
 epoch: 85, train_loss: 0.2451, test_loss: 1.6529, test_f1: 0.6519
 epoch: 86, train_loss: 0.2414, test_loss: 1.7147, test_f1: 0.6607
 epoch: 87, train_loss: 0.2486, test_loss: 1.8488, test_f1: 0.6565
 epoch: 88, train_loss: 0.2447, test_loss: 1.7513, test_f1: 0.6597
 epoch: 89, train_loss: 0.2349, test_loss: 1.6861, test_f1: 0.6420
 epoch: 90, train_loss: 0.2399, test_loss: 1.8119, test_f1: 0.6509
 epoch: 91, train_loss: 0.2314, test_loss: 1.7074, test_f1: 0.6316
 epoch: 92, train_loss: 0.2205, test_loss: 1.8576, test_f1: 0.6478
 epoch: 93, train_loss: 0.2215, test_loss: 1.6859, test_f1: 0.6492
 epoch: 94, train_loss: 0.2428, test_loss: 1.7481, test_f1: 0.6457
 epoch: 95, train_loss: 0.2279, test_loss: 1.6966, test_f1: 0.6392
 epoch: 96, train_loss: 0.2192, test_loss: 1.6736, test_f1: 0.6543
 epoch: 97, train_loss: 0.2194, test_loss: 1.7771, test_f1: 0.6488
 epoch: 98, train_loss: 0.2115, test_loss: 1.8148, test_f1: 0.6409
 epoch: 99, train_loss: 0.2070, test_loss: 1.9517, test_f1: 0.6551
##################ITERATION #6 ****************************************
 epoch: 0, train_loss: 1.3437, test_loss: 1.1702, test_f1: 0.4047
 epoch: 1, train_loss: 1.0282, test_loss: 1.0359, test_f1: 0.4667
 epoch: 2, train_loss: 0.9721, test_loss: 0.9942, test_f1: 0.4856
 epoch: 3, train_loss: 0.9344, test_loss: 0.9608, test_f1: 0.4913
 epoch: 4, train_loss: 0.9061, test_loss: 1.0909, test_f1: 0.4735
 epoch: 5, train_loss: 0.8883, test_loss: 0.9782, test_f1: 0.5088
 epoch: 6, train_loss: 0.8718, test_loss: 1.0101, test_f1: 0.5040
 epoch: 7, train_loss: 0.8630, test_loss: 1.0143, test_f1: 0.4899
 epoch: 8, train_loss: 0.8358, test_loss: 0.9998, test_f1: 0.5486
 epoch: 9, train_loss: 0.8251, test_loss: 0.9397, test_f1: 0.5343
 epoch: 10, train_loss: 0.8176, test_loss: 0.8567, test_f1: 0.5693
 epoch: 11, train_loss: 0.7942, test_loss: 1.0197, test_f1: 0.5351
 epoch: 12, train_loss: 0.7912, test_loss: 0.9595, test_f1: 0.5567
 epoch: 13, train_loss: 0.7815, test_loss: 0.9735, test_f1: 0.5263
 epoch: 14, train_loss: 0.7792, test_loss: 1.0063, test_f1: 0.5730
 epoch: 15, train_loss: 0.7609, test_loss: 1.0020, test_f1: 0.5537
 epoch: 16, train_loss: 0.7538, test_loss: 1.0086, test_f1: 0.5584
 epoch: 17, train_loss: 0.7568, test_loss: 1.1008, test_f1: 0.5433
 epoch: 18, train_loss: 0.7400, test_loss: 0.9916, test_f1: 0.5992
 epoch: 19, train_loss: 0.7127, test_loss: 1.1107, test_f1: 0.5571
 epoch: 20, train_loss: 0.7063, test_loss: 1.0531, test_f1: 0.5919
 epoch: 21, train_loss: 0.7048, test_loss: 1.0566, test_f1: 0.5944
 epoch: 22, train_loss: 0.7011, test_loss: 0.9903, test_f1: 0.5496
 epoch: 23, train_loss: 0.6859, test_loss: 1.1167, test_f1: 0.5491
 epoch: 24, train_loss: 0.6725, test_loss: 1.0631, test_f1: 0.5795
 epoch: 25, train_loss: 0.6643, test_loss: 1.1710, test_f1: 0.5901
 epoch: 26, train_loss: 0.6794, test_loss: 0.9539, test_f1: 0.5736
 epoch: 27, train_loss: 0.6808, test_loss: 1.0233, test_f1: 0.5950
 epoch: 28, train_loss: 0.6416, test_loss: 1.1028, test_f1: 0.5752
 epoch: 29, train_loss: 0.6269, test_loss: 1.0420, test_f1: 0.6103
 epoch: 30, train_loss: 0.6293, test_loss: 1.0344, test_f1: 0.5913
 epoch: 31, train_loss: 0.6211, test_loss: 1.1261, test_f1: 0.5909
 epoch: 32, train_loss: 0.6299, test_loss: 1.0234, test_f1: 0.5945
 epoch: 33, train_loss: 0.6065, test_loss: 1.0894, test_f1: 0.6330
 epoch: 34, train_loss: 0.5920, test_loss: 1.0728, test_f1: 0.6076
 epoch: 35, train_loss: 0.5847, test_loss: 1.1594, test_f1: 0.5997
 epoch: 36, train_loss: 0.5726, test_loss: 1.0448, test_f1: 0.6453
 epoch: 37, train_loss: 0.5502, test_loss: 1.0928, test_f1: 0.6222
 epoch: 38, train_loss: 0.5687, test_loss: 1.1514, test_f1: 0.6070
 epoch: 39, train_loss: 0.5758, test_loss: 1.0904, test_f1: 0.6469
 epoch: 40, train_loss: 0.5423, test_loss: 1.1341, test_f1: 0.5691
 epoch: 41, train_loss: 0.5350, test_loss: 1.3126, test_f1: 0.6047
 epoch: 42, train_loss: 0.5467, test_loss: 1.2276, test_f1: 0.5933
 epoch: 43, train_loss: 0.5218, test_loss: 1.3334, test_f1: 0.6144
 epoch: 44, train_loss: 0.5099, test_loss: 1.1465, test_f1: 0.6445
 epoch: 45, train_loss: 0.5196, test_loss: 1.1779, test_f1: 0.6350
 epoch: 46, train_loss: 0.5009, test_loss: 1.1714, test_f1: 0.6205
 epoch: 47, train_loss: 0.5203, test_loss: 1.3835, test_f1: 0.5895
 epoch: 48, train_loss: 0.5028, test_loss: 1.1881, test_f1: 0.6408
 epoch: 49, train_loss: 0.4831, test_loss: 1.3819, test_f1: 0.6026
 epoch: 50, train_loss: 0.4643, test_loss: 1.3285, test_f1: 0.6122
 epoch: 51, train_loss: 0.4549, test_loss: 1.3894, test_f1: 0.6043
 epoch: 52, train_loss: 0.3992, test_loss: 1.3157, test_f1: 0.6267
 epoch: 53, train_loss: 0.3879, test_loss: 1.3418, test_f1: 0.6195
 epoch: 54, train_loss: 0.3745, test_loss: 1.3667, test_f1: 0.6310
 epoch: 55, train_loss: 0.3677, test_loss: 1.3673, test_f1: 0.6594
 epoch: 56, train_loss: 0.3856, test_loss: 1.3305, test_f1: 0.6547
 epoch: 57, train_loss: 0.3765, test_loss: 1.4366, test_f1: 0.6401
 epoch: 58, train_loss: 0.3630, test_loss: 1.4754, test_f1: 0.6244
 epoch: 59, train_loss: 0.3270, test_loss: 1.4677, test_f1: 0.6227
 epoch: 60, train_loss: 0.3402, test_loss: 1.4856, test_f1: 0.6280
 epoch: 61, train_loss: 0.3321, test_loss: 1.6303, test_f1: 0.6295
 epoch: 62, train_loss: 0.3353, test_loss: 1.6686, test_f1: 0.6333
 epoch: 63, train_loss: 0.3309, test_loss: 1.5246, test_f1: 0.6144
 epoch: 64, train_loss: 0.3228, test_loss: 1.5798, test_f1: 0.6246
 epoch: 65, train_loss: 0.3117, test_loss: 1.6199, test_f1: 0.6048
 epoch: 66, train_loss: 0.3323, test_loss: 1.5069, test_f1: 0.6296
 epoch: 67, train_loss: 0.3390, test_loss: 1.5392, test_f1: 0.6156
 epoch: 68, train_loss: 0.3188, test_loss: 1.6578, test_f1: 0.6489
 epoch: 69, train_loss: 0.2889, test_loss: 1.5507, test_f1: 0.6494
 epoch: 70, train_loss: 0.2976, test_loss: 1.5668, test_f1: 0.6589
 epoch: 71, train_loss: 0.2890, test_loss: 1.6920, test_f1: 0.6491
 epoch: 72, train_loss: 0.2951, test_loss: 1.5404, test_f1: 0.6773
 epoch: 73, train_loss: 0.2708, test_loss: 1.7316, test_f1: 0.6329
 epoch: 74, train_loss: 0.2783, test_loss: 1.6900, test_f1: 0.6515
 epoch: 75, train_loss: 0.2727, test_loss: 1.7480, test_f1: 0.6370
 epoch: 76, train_loss: 0.2933, test_loss: 1.7815, test_f1: 0.6411
 epoch: 77, train_loss: 0.2761, test_loss: 1.9544, test_f1: 0.6155
 epoch: 78, train_loss: 0.2804, test_loss: 1.8313, test_f1: 0.6135
 epoch: 79, train_loss: 0.2772, test_loss: 1.7516, test_f1: 0.6385
 epoch: 80, train_loss: 0.2815, test_loss: 1.8501, test_f1: 0.6176
 epoch: 81, train_loss: 0.2616, test_loss: 1.7757, test_f1: 0.6463
 epoch: 82, train_loss: 0.2640, test_loss: 1.7476, test_f1: 0.6812
 epoch: 83, train_loss: 0.2524, test_loss: 1.8042, test_f1: 0.6307
 epoch: 84, train_loss: 0.2670, test_loss: 1.7622, test_f1: 0.6412
 epoch: 85, train_loss: 0.2446, test_loss: 1.7318, test_f1: 0.6409
 epoch: 86, train_loss: 0.2354, test_loss: 1.7501, test_f1: 0.6571
 epoch: 87, train_loss: 0.2594, test_loss: 1.8232, test_f1: 0.6379
 epoch: 88, train_loss: 0.2998, test_loss: 1.6479, test_f1: 0.6587
 epoch: 89, train_loss: 0.2813, test_loss: 1.9307, test_f1: 0.6220
 epoch: 90, train_loss: 0.2531, test_loss: 1.7941, test_f1: 0.6326
 epoch: 91, train_loss: 0.2377, test_loss: 1.8557, test_f1: 0.6235
 epoch: 92, train_loss: 0.2421, test_loss: 1.8403, test_f1: 0.6405
 epoch: 93, train_loss: 0.2321, test_loss: 1.7691, test_f1: 0.6299
 epoch: 94, train_loss: 0.2165, test_loss: 1.9105, test_f1: 0.6445
 epoch: 95, train_loss: 0.2286, test_loss: 2.0141, test_f1: 0.6199
 epoch: 96, train_loss: 0.2218, test_loss: 2.1054, test_f1: 0.6152
 epoch: 97, train_loss: 0.2275, test_loss: 1.8468, test_f1: 0.6287
 epoch: 98, train_loss: 0.2146, test_loss: 2.0224, test_f1: 0.6343
 epoch: 99, train_loss: 0.2115, test_loss: 2.1350, test_f1: 0.6198
##################ITERATION #7 ****************************************
 epoch: 0, train_loss: 1.3702, test_loss: 1.2010, test_f1: 0.2887
 epoch: 1, train_loss: 1.0371, test_loss: 1.0298, test_f1: 0.4339
 epoch: 2, train_loss: 0.9724, test_loss: 1.0340, test_f1: 0.4600
 epoch: 3, train_loss: 0.9392, test_loss: 0.9622, test_f1: 0.4727
 epoch: 4, train_loss: 0.9131, test_loss: 0.9142, test_f1: 0.5060
 epoch: 5, train_loss: 0.8960, test_loss: 1.0147, test_f1: 0.4880
 epoch: 6, train_loss: 0.8735, test_loss: 1.0020, test_f1: 0.5301
 epoch: 7, train_loss: 0.8451, test_loss: 1.0329, test_f1: 0.5099
 epoch: 8, train_loss: 0.8471, test_loss: 1.0080, test_f1: 0.5306
 epoch: 9, train_loss: 0.8402, test_loss: 0.9880, test_f1: 0.5415
 epoch: 10, train_loss: 0.8120, test_loss: 0.9109, test_f1: 0.5502
 epoch: 11, train_loss: 0.7835, test_loss: 0.9045, test_f1: 0.5304
 epoch: 12, train_loss: 0.7973, test_loss: 0.9669, test_f1: 0.5836
 epoch: 13, train_loss: 0.7688, test_loss: 1.0410, test_f1: 0.5622
 epoch: 14, train_loss: 0.7612, test_loss: 0.9643, test_f1: 0.5593
 epoch: 15, train_loss: 0.7635, test_loss: 0.9946, test_f1: 0.5454
 epoch: 16, train_loss: 0.7358, test_loss: 1.0123, test_f1: 0.5457
 epoch: 17, train_loss: 0.7305, test_loss: 0.9418, test_f1: 0.6058
 epoch: 18, train_loss: 0.7133, test_loss: 0.9871, test_f1: 0.5865
 epoch: 19, train_loss: 0.7137, test_loss: 0.9817, test_f1: 0.6093
 epoch: 20, train_loss: 0.7102, test_loss: 1.0765, test_f1: 0.5794
 epoch: 21, train_loss: 0.7078, test_loss: 0.9517, test_f1: 0.5967
 epoch: 22, train_loss: 0.6644, test_loss: 1.0015, test_f1: 0.6103
 epoch: 23, train_loss: 0.6810, test_loss: 0.9844, test_f1: 0.5521
 epoch: 24, train_loss: 0.6550, test_loss: 0.9884, test_f1: 0.6286
 epoch: 25, train_loss: 0.6598, test_loss: 1.1040, test_f1: 0.5790
 epoch: 26, train_loss: 0.6529, test_loss: 1.0768, test_f1: 0.5994
 epoch: 27, train_loss: 0.6457, test_loss: 0.9934, test_f1: 0.6169
 epoch: 28, train_loss: 0.6235, test_loss: 1.1385, test_f1: 0.6335
 epoch: 29, train_loss: 0.6300, test_loss: 1.1751, test_f1: 0.5999
 epoch: 30, train_loss: 0.6070, test_loss: 1.0672, test_f1: 0.5797
 epoch: 31, train_loss: 0.6100, test_loss: 1.1478, test_f1: 0.5895
 epoch: 32, train_loss: 0.5910, test_loss: 1.1556, test_f1: 0.6124
 epoch: 33, train_loss: 0.6076, test_loss: 1.1012, test_f1: 0.5721
 epoch: 34, train_loss: 0.5781, test_loss: 1.0103, test_f1: 0.6106
 epoch: 35, train_loss: 0.5739, test_loss: 1.0469, test_f1: 0.6141
 epoch: 36, train_loss: 0.5773, test_loss: 1.1485, test_f1: 0.6322
 epoch: 37, train_loss: 0.5768, test_loss: 1.3313, test_f1: 0.5603
 epoch: 38, train_loss: 0.5557, test_loss: 1.0840, test_f1: 0.6017
 epoch: 39, train_loss: 0.5609, test_loss: 1.1236, test_f1: 0.5948
 epoch: 40, train_loss: 0.5112, test_loss: 1.1401, test_f1: 0.6084
 epoch: 41, train_loss: 0.5284, test_loss: 1.1785, test_f1: 0.6170
 epoch: 42, train_loss: 0.5311, test_loss: 1.2540, test_f1: 0.6061
 epoch: 43, train_loss: 0.4977, test_loss: 1.2663, test_f1: 0.6157
 epoch: 44, train_loss: 0.4904, test_loss: 1.1450, test_f1: 0.6469
 epoch: 45, train_loss: 0.5024, test_loss: 1.1994, test_f1: 0.6355
 epoch: 46, train_loss: 0.4934, test_loss: 1.3598, test_f1: 0.5881
 epoch: 47, train_loss: 0.4849, test_loss: 1.2930, test_f1: 0.6149
 epoch: 48, train_loss: 0.4926, test_loss: 1.2605, test_f1: 0.6292
 epoch: 49, train_loss: 0.4711, test_loss: 1.3359, test_f1: 0.6335
 epoch: 50, train_loss: 0.4588, test_loss: 1.2423, test_f1: 0.6255
 epoch: 51, train_loss: 0.4134, test_loss: 1.3580, test_f1: 0.6285
 epoch: 52, train_loss: 0.3806, test_loss: 1.3747, test_f1: 0.6358
 epoch: 53, train_loss: 0.3754, test_loss: 1.3460, test_f1: 0.6202
 epoch: 54, train_loss: 0.3698, test_loss: 1.3830, test_f1: 0.6234
 epoch: 55, train_loss: 0.3623, test_loss: 1.3549, test_f1: 0.6336
 epoch: 56, train_loss: 0.3466, test_loss: 1.4469, test_f1: 0.6468
 epoch: 57, train_loss: 0.3472, test_loss: 1.3538, test_f1: 0.6186
 epoch: 58, train_loss: 0.3427, test_loss: 1.4854, test_f1: 0.6199
 epoch: 59, train_loss: 0.3329, test_loss: 1.5039, test_f1: 0.6104
 epoch: 60, train_loss: 0.3222, test_loss: 1.5190, test_f1: 0.6253
 epoch: 61, train_loss: 0.3271, test_loss: 1.4016, test_f1: 0.6494
 epoch: 62, train_loss: 0.3239, test_loss: 1.4838, test_f1: 0.6198
 epoch: 63, train_loss: 0.3323, test_loss: 1.5875, test_f1: 0.6161
 epoch: 64, train_loss: 0.3067, test_loss: 1.4996, test_f1: 0.6341
 epoch: 65, train_loss: 0.3080, test_loss: 1.6045, test_f1: 0.6240
 epoch: 66, train_loss: 0.2974, test_loss: 1.6478, test_f1: 0.6233
 epoch: 67, train_loss: 0.3087, test_loss: 1.7109, test_f1: 0.6373
 epoch: 68, train_loss: 0.2927, test_loss: 1.6248, test_f1: 0.6531
 epoch: 69, train_loss: 0.3022, test_loss: 1.8123, test_f1: 0.6252
 epoch: 70, train_loss: 0.3082, test_loss: 1.6170, test_f1: 0.6227
 epoch: 71, train_loss: 0.2835, test_loss: 1.7088, test_f1: 0.6279
 epoch: 72, train_loss: 0.2746, test_loss: 1.8461, test_f1: 0.6228
 epoch: 73, train_loss: 0.2941, test_loss: 1.6996, test_f1: 0.6138
 epoch: 74, train_loss: 0.2798, test_loss: 1.7554, test_f1: 0.6491
 epoch: 75, train_loss: 0.2617, test_loss: 1.7748, test_f1: 0.6196
 epoch: 76, train_loss: 0.2612, test_loss: 1.6616, test_f1: 0.6306
 epoch: 77, train_loss: 0.2595, test_loss: 1.8443, test_f1: 0.6462
 epoch: 78, train_loss: 0.2451, test_loss: 1.8079, test_f1: 0.6296
 epoch: 79, train_loss: 0.2449, test_loss: 1.8168, test_f1: 0.6182
 epoch: 80, train_loss: 0.2637, test_loss: 1.8099, test_f1: 0.6197
 epoch: 81, train_loss: 0.2533, test_loss: 1.7818, test_f1: 0.6183
 epoch: 82, train_loss: 0.2345, test_loss: 1.8297, test_f1: 0.6370
 epoch: 83, train_loss: 0.2512, test_loss: 1.8770, test_f1: 0.6296
 epoch: 84, train_loss: 0.2502, test_loss: 1.7662, test_f1: 0.6343
 epoch: 85, train_loss: 0.2466, test_loss: 1.6641, test_f1: 0.6547
 epoch: 86, train_loss: 0.2381, test_loss: 1.9208, test_f1: 0.6395
 epoch: 87, train_loss: 0.2333, test_loss: 1.7823, test_f1: 0.6442
 epoch: 88, train_loss: 0.2427, test_loss: 1.8514, test_f1: 0.6534
 epoch: 89, train_loss: 0.2385, test_loss: 1.8632, test_f1: 0.6368
 epoch: 90, train_loss: 0.2455, test_loss: 1.7908, test_f1: 0.6157
 epoch: 91, train_loss: 0.2329, test_loss: 1.8640, test_f1: 0.6322
 epoch: 92, train_loss: 0.2312, test_loss: 2.0858, test_f1: 0.6309
 epoch: 93, train_loss: 0.2222, test_loss: 1.9802, test_f1: 0.6335
 epoch: 94, train_loss: 0.2094, test_loss: 1.9115, test_f1: 0.6477
 epoch: 95, train_loss: 0.2196, test_loss: 1.9256, test_f1: 0.6470
 epoch: 96, train_loss: 0.2191, test_loss: 2.0372, test_f1: 0.6593
 epoch: 97, train_loss: 0.2080, test_loss: 1.9633, test_f1: 0.6232
 epoch: 98, train_loss: 0.2146, test_loss: 1.9539, test_f1: 0.6362
 epoch: 99, train_loss: 0.2300, test_loss: 1.9400, test_f1: 0.6478
##################ITERATION #8 ****************************************
 epoch: 0, train_loss: 1.4322, test_loss: 1.1859, test_f1: 0.3446
 epoch: 1, train_loss: 1.0364, test_loss: 0.9906, test_f1: 0.4517
 epoch: 2, train_loss: 0.9735, test_loss: 0.9962, test_f1: 0.4449
 epoch: 3, train_loss: 0.9359, test_loss: 0.9878, test_f1: 0.4949
 epoch: 4, train_loss: 0.9073, test_loss: 0.9780, test_f1: 0.4927
 epoch: 5, train_loss: 0.8751, test_loss: 0.9601, test_f1: 0.4987
 epoch: 6, train_loss: 0.8698, test_loss: 0.9961, test_f1: 0.5018
 epoch: 7, train_loss: 0.8537, test_loss: 0.9476, test_f1: 0.5332
 epoch: 8, train_loss: 0.8320, test_loss: 0.9801, test_f1: 0.5244
 epoch: 9, train_loss: 0.8280, test_loss: 0.9436, test_f1: 0.5179
 epoch: 10, train_loss: 0.8153, test_loss: 1.0180, test_f1: 0.5210
 epoch: 11, train_loss: 0.8058, test_loss: 0.9856, test_f1: 0.5292
 epoch: 12, train_loss: 0.7770, test_loss: 0.9964, test_f1: 0.5352
 epoch: 13, train_loss: 0.7923, test_loss: 1.0570, test_f1: 0.5351
 epoch: 14, train_loss: 0.7716, test_loss: 0.9937, test_f1: 0.5743
 epoch: 15, train_loss: 0.7704, test_loss: 0.9811, test_f1: 0.5719
 epoch: 16, train_loss: 0.7667, test_loss: 0.9740, test_f1: 0.5516
 epoch: 17, train_loss: 0.7358, test_loss: 1.0341, test_f1: 0.5986
 epoch: 18, train_loss: 0.7388, test_loss: 1.0195, test_f1: 0.5964
 epoch: 19, train_loss: 0.7141, test_loss: 1.0110, test_f1: 0.6074
 epoch: 20, train_loss: 0.7090, test_loss: 1.0274, test_f1: 0.6237
 epoch: 21, train_loss: 0.6864, test_loss: 1.0666, test_f1: 0.5841
 epoch: 22, train_loss: 0.7005, test_loss: 0.9794, test_f1: 0.5905
 epoch: 23, train_loss: 0.6758, test_loss: 1.0550, test_f1: 0.5484
 epoch: 24, train_loss: 0.6756, test_loss: 1.0014, test_f1: 0.6312
 epoch: 25, train_loss: 0.6610, test_loss: 0.9872, test_f1: 0.6259
 epoch: 26, train_loss: 0.6498, test_loss: 1.0230, test_f1: 0.5848
 epoch: 27, train_loss: 0.6691, test_loss: 1.0450, test_f1: 0.5445
 epoch: 28, train_loss: 0.6499, test_loss: 1.0484, test_f1: 0.6239
 epoch: 29, train_loss: 0.6338, test_loss: 1.1824, test_f1: 0.5797
 epoch: 30, train_loss: 0.6512, test_loss: 1.0775, test_f1: 0.6156
 epoch: 31, train_loss: 0.6440, test_loss: 1.0360, test_f1: 0.6094
 epoch: 32, train_loss: 0.6170, test_loss: 1.1649, test_f1: 0.6007
 epoch: 33, train_loss: 0.6266, test_loss: 1.0620, test_f1: 0.6249
 epoch: 34, train_loss: 0.5954, test_loss: 1.1143, test_f1: 0.6568
 epoch: 35, train_loss: 0.6189, test_loss: 1.0983, test_f1: 0.6323
 epoch: 36, train_loss: 0.5835, test_loss: 1.0268, test_f1: 0.5972
 epoch: 37, train_loss: 0.5850, test_loss: 1.1360, test_f1: 0.5897
 epoch: 38, train_loss: 0.5663, test_loss: 1.1271, test_f1: 0.6377
 epoch: 39, train_loss: 0.5703, test_loss: 1.1012, test_f1: 0.6580
 epoch: 40, train_loss: 0.5669, test_loss: 1.0301, test_f1: 0.6475
 epoch: 41, train_loss: 0.5521, test_loss: 1.1653, test_f1: 0.6185
 epoch: 42, train_loss: 0.5363, test_loss: 1.2277, test_f1: 0.6212
 epoch: 43, train_loss: 0.5218, test_loss: 1.1826, test_f1: 0.6400
 epoch: 44, train_loss: 0.5063, test_loss: 1.1266, test_f1: 0.6476
 epoch: 45, train_loss: 0.5015, test_loss: 1.1839, test_f1: 0.6472
 epoch: 46, train_loss: 0.5003, test_loss: 1.2365, test_f1: 0.6514
 epoch: 47, train_loss: 0.5006, test_loss: 1.1951, test_f1: 0.6334
 epoch: 48, train_loss: 0.5046, test_loss: 1.1347, test_f1: 0.6456
 epoch: 49, train_loss: 0.4831, test_loss: 1.1142, test_f1: 0.6640
 epoch: 50, train_loss: 0.4657, test_loss: 1.2452, test_f1: 0.6500
 epoch: 51, train_loss: 0.4256, test_loss: 1.2459, test_f1: 0.6726
 epoch: 52, train_loss: 0.4170, test_loss: 1.2479, test_f1: 0.6531
 epoch: 53, train_loss: 0.3921, test_loss: 1.3024, test_f1: 0.6430
 epoch: 54, train_loss: 0.3699, test_loss: 1.2861, test_f1: 0.6579
 epoch: 55, train_loss: 0.3677, test_loss: 1.2495, test_f1: 0.6557
 epoch: 56, train_loss: 0.3625, test_loss: 1.5731, test_f1: 0.6275
 epoch: 57, train_loss: 0.3721, test_loss: 1.3499, test_f1: 0.6603
 epoch: 58, train_loss: 0.3659, test_loss: 1.3475, test_f1: 0.6538
 epoch: 59, train_loss: 0.3532, test_loss: 1.3449, test_f1: 0.6614
 epoch: 60, train_loss: 0.3339, test_loss: 1.3704, test_f1: 0.6314
 epoch: 61, train_loss: 0.3266, test_loss: 1.4686, test_f1: 0.6619
 epoch: 62, train_loss: 0.3341, test_loss: 1.4111, test_f1: 0.6411
 epoch: 63, train_loss: 0.3298, test_loss: 1.4301, test_f1: 0.6427
 epoch: 64, train_loss: 0.3227, test_loss: 1.4825, test_f1: 0.6237
 epoch: 65, train_loss: 0.3213, test_loss: 1.4748, test_f1: 0.6518
 epoch: 66, train_loss: 0.3147, test_loss: 1.6616, test_f1: 0.6491
 epoch: 67, train_loss: 0.3098, test_loss: 1.6393, test_f1: 0.6432
 epoch: 68, train_loss: 0.3146, test_loss: 1.6058, test_f1: 0.6292
 epoch: 69, train_loss: 0.2995, test_loss: 1.6400, test_f1: 0.6129
 epoch: 70, train_loss: 0.2995, test_loss: 1.5613, test_f1: 0.6431
 epoch: 71, train_loss: 0.2873, test_loss: 1.4973, test_f1: 0.6232
 epoch: 72, train_loss: 0.2909, test_loss: 1.8574, test_f1: 0.6207
 epoch: 73, train_loss: 0.2948, test_loss: 1.6180, test_f1: 0.6706
 epoch: 74, train_loss: 0.2837, test_loss: 1.7567, test_f1: 0.6538
 epoch: 75, train_loss: 0.2975, test_loss: 1.6910, test_f1: 0.6342
 epoch: 76, train_loss: 0.2909, test_loss: 1.4908, test_f1: 0.6474
 epoch: 77, train_loss: 0.3036, test_loss: 1.6327, test_f1: 0.6482
 epoch: 78, train_loss: 0.2702, test_loss: 1.7775, test_f1: 0.6343
 epoch: 79, train_loss: 0.2654, test_loss: 1.6369, test_f1: 0.6519
 epoch: 80, train_loss: 0.2581, test_loss: 1.8159, test_f1: 0.6257
 epoch: 81, train_loss: 0.2654, test_loss: 1.8880, test_f1: 0.6428
 epoch: 82, train_loss: 0.2689, test_loss: 1.7702, test_f1: 0.6405
 epoch: 83, train_loss: 0.2512, test_loss: 1.7366, test_f1: 0.6725
 epoch: 84, train_loss: 0.2457, test_loss: 1.7332, test_f1: 0.6475
 epoch: 85, train_loss: 0.2595, test_loss: 1.7548, test_f1: 0.6379
 epoch: 86, train_loss: 0.2435, test_loss: 1.8964, test_f1: 0.6359
 epoch: 87, train_loss: 0.2378, test_loss: 1.8284, test_f1: 0.6355
 epoch: 88, train_loss: 0.2474, test_loss: 1.9007, test_f1: 0.6460
 epoch: 89, train_loss: 0.2312, test_loss: 2.0620, test_f1: 0.6262
 epoch: 90, train_loss: 0.2356, test_loss: 1.8951, test_f1: 0.6386
 epoch: 91, train_loss: 0.2384, test_loss: 1.8322, test_f1: 0.6411
 epoch: 92, train_loss: 0.2272, test_loss: 1.9450, test_f1: 0.6386
 epoch: 93, train_loss: 0.2409, test_loss: 1.8678, test_f1: 0.6267
 epoch: 94, train_loss: 0.2483, test_loss: 1.8229, test_f1: 0.6627
 epoch: 95, train_loss: 0.2168, test_loss: 1.8665, test_f1: 0.6387
 epoch: 96, train_loss: 0.2250, test_loss: 2.2617, test_f1: 0.6155
 epoch: 97, train_loss: 0.2202, test_loss: 2.0837, test_f1: 0.6436
 epoch: 98, train_loss: 0.2147, test_loss: 2.0099, test_f1: 0.6213
 epoch: 99, train_loss: 0.2239, test_loss: 2.0907, test_f1: 0.6318
##################ITERATION #9 ****************************************
 epoch: 0, train_loss: 1.3976, test_loss: 1.3079, test_f1: 0.3475
 epoch: 1, train_loss: 1.0307, test_loss: 1.0280, test_f1: 0.4404
 epoch: 2, train_loss: 0.9522, test_loss: 0.9312, test_f1: 0.4983
 epoch: 3, train_loss: 0.9299, test_loss: 0.9462, test_f1: 0.4727
 epoch: 4, train_loss: 0.9151, test_loss: 0.9771, test_f1: 0.5007
 epoch: 5, train_loss: 0.9105, test_loss: 0.9340, test_f1: 0.5020
 epoch: 6, train_loss: 0.8696, test_loss: 1.0021, test_f1: 0.5100
 epoch: 7, train_loss: 0.8605, test_loss: 0.9864, test_f1: 0.5117
 epoch: 8, train_loss: 0.8418, test_loss: 0.9804, test_f1: 0.5399
 epoch: 9, train_loss: 0.8329, test_loss: 0.9584, test_f1: 0.5577
 epoch: 10, train_loss: 0.8003, test_loss: 0.9820, test_f1: 0.5573
 epoch: 11, train_loss: 0.7873, test_loss: 1.0493, test_f1: 0.5406
 epoch: 12, train_loss: 0.7865, test_loss: 0.9577, test_f1: 0.5663
 epoch: 13, train_loss: 0.7814, test_loss: 0.9682, test_f1: 0.5676
 epoch: 14, train_loss: 0.7743, test_loss: 1.0048, test_f1: 0.5805
 epoch: 15, train_loss: 0.7437, test_loss: 1.0141, test_f1: 0.6004
 epoch: 16, train_loss: 0.7568, test_loss: 0.9821, test_f1: 0.5908
 epoch: 17, train_loss: 0.7445, test_loss: 0.9986, test_f1: 0.5842
 epoch: 18, train_loss: 0.7294, test_loss: 0.9588, test_f1: 0.6133
 epoch: 19, train_loss: 0.7118, test_loss: 1.0327, test_f1: 0.5943
 epoch: 20, train_loss: 0.7028, test_loss: 1.0032, test_f1: 0.6002
 epoch: 21, train_loss: 0.7092, test_loss: 0.9378, test_f1: 0.6137
 epoch: 22, train_loss: 0.7196, test_loss: 1.0487, test_f1: 0.6085
 epoch: 23, train_loss: 0.6734, test_loss: 1.1034, test_f1: 0.5851
 epoch: 24, train_loss: 0.6712, test_loss: 1.0483, test_f1: 0.5964
 epoch: 25, train_loss: 0.6731, test_loss: 1.0948, test_f1: 0.5742
 epoch: 26, train_loss: 0.6591, test_loss: 1.0152, test_f1: 0.6225
 epoch: 27, train_loss: 0.6466, test_loss: 0.9957, test_f1: 0.6015
 epoch: 28, train_loss: 0.6291, test_loss: 1.0626, test_f1: 0.6133
 epoch: 29, train_loss: 0.6401, test_loss: 0.9812, test_f1: 0.6220
 epoch: 30, train_loss: 0.6300, test_loss: 1.1466, test_f1: 0.6402
 epoch: 31, train_loss: 0.6104, test_loss: 1.1738, test_f1: 0.6266
 epoch: 32, train_loss: 0.6081, test_loss: 0.9966, test_f1: 0.6721
 epoch: 33, train_loss: 0.6067, test_loss: 1.0834, test_f1: 0.6058
 epoch: 34, train_loss: 0.5936, test_loss: 1.0741, test_f1: 0.6249
 epoch: 35, train_loss: 0.5710, test_loss: 1.0364, test_f1: 0.6097
 epoch: 36, train_loss: 0.5647, test_loss: 1.1133, test_f1: 0.6139
 epoch: 37, train_loss: 0.5555, test_loss: 1.1429, test_f1: 0.5975
 epoch: 38, train_loss: 0.5501, test_loss: 1.3487, test_f1: 0.5820
 epoch: 39, train_loss: 0.5620, test_loss: 1.1185, test_f1: 0.6439
 epoch: 40, train_loss: 0.5480, test_loss: 1.2409, test_f1: 0.6038
 epoch: 41, train_loss: 0.5251, test_loss: 1.0725, test_f1: 0.6303
 epoch: 42, train_loss: 0.5294, test_loss: 1.2737, test_f1: 0.6262
 epoch: 43, train_loss: 0.5158, test_loss: 1.1941, test_f1: 0.6188
 epoch: 44, train_loss: 0.5378, test_loss: 1.1529, test_f1: 0.6383
 epoch: 45, train_loss: 0.5043, test_loss: 1.2137, test_f1: 0.6092
 epoch: 46, train_loss: 0.5154, test_loss: 1.0356, test_f1: 0.6364
 epoch: 47, train_loss: 0.5085, test_loss: 1.1554, test_f1: 0.6598
 epoch: 48, train_loss: 0.4960, test_loss: 1.2274, test_f1: 0.6114
 epoch: 49, train_loss: 0.4874, test_loss: 1.2866, test_f1: 0.6206
 epoch: 50, train_loss: 0.4700, test_loss: 1.1765, test_f1: 0.6481
 epoch: 51, train_loss: 0.4164, test_loss: 1.2275, test_f1: 0.6630
 epoch: 52, train_loss: 0.3927, test_loss: 1.1945, test_f1: 0.6410
 epoch: 53, train_loss: 0.3821, test_loss: 1.4016, test_f1: 0.6409
 epoch: 54, train_loss: 0.3736, test_loss: 1.3101, test_f1: 0.6510
 epoch: 55, train_loss: 0.3714, test_loss: 1.3790, test_f1: 0.6309
 epoch: 56, train_loss: 0.3612, test_loss: 1.3090, test_f1: 0.6824
 epoch: 57, train_loss: 0.3506, test_loss: 1.3969, test_f1: 0.6531
 epoch: 58, train_loss: 0.3456, test_loss: 1.3317, test_f1: 0.6529
 epoch: 59, train_loss: 0.3474, test_loss: 1.3579, test_f1: 0.6348
 epoch: 60, train_loss: 0.3371, test_loss: 1.3968, test_f1: 0.6411
 epoch: 61, train_loss: 0.3407, test_loss: 1.3554, test_f1: 0.6312
 epoch: 62, train_loss: 0.3150, test_loss: 1.5035, test_f1: 0.6556
 epoch: 63, train_loss: 0.3370, test_loss: 1.5243, test_f1: 0.6346
 epoch: 64, train_loss: 0.3193, test_loss: 1.4658, test_f1: 0.6419
 epoch: 65, train_loss: 0.3267, test_loss: 1.4926, test_f1: 0.6495
 epoch: 66, train_loss: 0.3119, test_loss: 1.5441, test_f1: 0.6537
 epoch: 67, train_loss: 0.2950, test_loss: 1.5263, test_f1: 0.6510
 epoch: 68, train_loss: 0.2755, test_loss: 1.6315, test_f1: 0.6626
 epoch: 69, train_loss: 0.2917, test_loss: 1.6650, test_f1: 0.6276
 epoch: 70, train_loss: 0.3316, test_loss: 1.7266, test_f1: 0.6459
 epoch: 71, train_loss: 0.3229, test_loss: 1.5522, test_f1: 0.6611
 epoch: 72, train_loss: 0.3055, test_loss: 1.4702, test_f1: 0.6448
 epoch: 73, train_loss: 0.2879, test_loss: 1.6049, test_f1: 0.6331
 epoch: 74, train_loss: 0.2763, test_loss: 1.5481, test_f1: 0.6516
 epoch: 75, train_loss: 0.2999, test_loss: 1.5287, test_f1: 0.6589
 epoch: 76, train_loss: 0.2870, test_loss: 1.7776, test_f1: 0.6333
 epoch: 77, train_loss: 0.2852, test_loss: 1.6340, test_f1: 0.6434
 epoch: 78, train_loss: 0.2808, test_loss: 1.8673, test_f1: 0.6181
 epoch: 79, train_loss: 0.2614, test_loss: 1.6410, test_f1: 0.6684
 epoch: 80, train_loss: 0.2715, test_loss: 1.4985, test_f1: 0.6736
 epoch: 81, train_loss: 0.2540, test_loss: 1.5723, test_f1: 0.6658
 epoch: 82, train_loss: 0.2473, test_loss: 1.7220, test_f1: 0.6379
 epoch: 83, train_loss: 0.2351, test_loss: 1.6605, test_f1: 0.6745
 epoch: 84, train_loss: 0.2429, test_loss: 1.7933, test_f1: 0.6672
 epoch: 85, train_loss: 0.2507, test_loss: 1.6498, test_f1: 0.6513
 epoch: 86, train_loss: 0.2461, test_loss: 1.7001, test_f1: 0.6573
 epoch: 87, train_loss: 0.2469, test_loss: 1.5950, test_f1: 0.6653
 epoch: 88, train_loss: 0.2912, test_loss: 1.7277, test_f1: 0.6389
 epoch: 89, train_loss: 0.2494, test_loss: 1.7551, test_f1: 0.6700
 epoch: 90, train_loss: 0.2415, test_loss: 1.8375, test_f1: 0.6744
 epoch: 91, train_loss: 0.2330, test_loss: 1.9210, test_f1: 0.6594
 epoch: 92, train_loss: 0.2203, test_loss: 1.7611, test_f1: 0.6524
 epoch: 93, train_loss: 0.2375, test_loss: 1.8792, test_f1: 0.6516
 epoch: 94, train_loss: 0.2274, test_loss: 1.8998, test_f1: 0.6629
 epoch: 95, train_loss: 0.2322, test_loss: 1.8266, test_f1: 0.6259
 epoch: 96, train_loss: 0.2435, test_loss: 1.8251, test_f1: 0.6580
 epoch: 97, train_loss: 0.2314, test_loss: 2.0362, test_f1: 0.6314
 epoch: 98, train_loss: 0.2127, test_loss: 1.8342, test_f1: 0.6595
 epoch: 99, train_loss: 0.2162, test_loss: 1.9010, test_f1: 0.6586

Training completed in 569.64 seconds
Best F1: 0.6824 at epoch 56
Mean F1 across iterations: 0.6701  0.0091
========================FINAL RESULTS================================
FEGIN weighted F1: 0.6824  0.0091
python main.py --data ltspice_examples --representation component_net --model FEGIN --layers 6 --hiddens 128 --batch_size 128 --lr 0.001 --emb_size 128 --epochs 100 --save_appendix component_net_L6_H128_BS128_LR0.001_E128 --no_val
-----



STDERR:
  File "main.py", line 370, in <module>
    main()
  File "main.py", line 254, in main
    dataset = dataset_class(
  File "/home/philip/projects/ltspice_examples_code_repo/Circuit-Completion-Using-GNNs/component_classification_with_link_prediction_head/evaluation/FEGIN/kernel/circuit_datasets.py", line 15, in __init__
    self.data, self.slices = torch.load(self.processed_paths[0])
  File "/home/philip/.local/lib/python3.8/site-packages/torch/serialization.py", line 1040, in load
    warnings.warn(
  File "/usr/lib/python3.8/warnings.py", line 109, in _showwarnmsg
    sw(msg.message, msg.category, msg.filename, msg.lineno,
  File "main.py", line 47, in warn_with_traceback
    traceback.print_stack(file=log)
/home/philip/projects/ltspice_examples_code_repo/Circuit-Completion-Using-GNNs/component_classification_with_link_prediction_head/evaluation/FEGIN/kernel/circuit_datasets.py:15: FutureWarning: You are using `torch.load` with `weights_only=False` (the current default value), which uses the default pickle module implicitly. It is possible to construct malicious pickle data which will execute arbitrary code during unpickling (See https://github.com/pytorch/pytorch/blob/main/SECURITY.md#untrusted-models for more details). In a future release, the default value for `weights_only` will be flipped to `True`. This limits the functions that could be executed during unpickling. Arbitrary objects will no longer be allowed to be loaded via this mode unless they are explicitly allowlisted by the user via `torch.serialization.add_safe_globals`. We recommend you start setting `weights_only=True` for any use case where you don't have full control of the loaded file. Please open an issue on GitHub for any issues related to this experimental feature.
  self.data, self.slices = torch.load(self.processed_paths[0])
