STDOUT:
Results will be saved in /home/philip/projects/ltspice_examples_code_repo/Circuit-Completion-Using-GNNs/component_classification_with_link_prediction_head/evaluation/FEGIN/results/model_FEGIN_dataset_ltspice_demos
Command line input: python main.py --data ltspice_demos --representation component_pin --model FEGIN --layers 2 --hiddens 32 --batch_size 32 --lr 0.001 --emb_size 512 --epochs 100 --save_appendix component_pin_L2_H32_BS32_LR0.001_E512 --no_val
 is saved.
-----
ltspice_demos - FEGIN
Using 2 layers, 32 hidden units, h = 2
Loading component_pin representation dataset
ENTERED
Training FEGIN on component_pin representation
Train: 1565, Test: 383
##################ITERATION #0 ****************************************
 epoch: 0, train_loss: 1.3144, test_loss: 1.2976, test_f1: 0.3480
 epoch: 1, train_loss: 1.1931, test_loss: 1.2139, test_f1: 0.3907
 epoch: 2, train_loss: 1.0861, test_loss: 1.1149, test_f1: 0.4084
 epoch: 3, train_loss: 1.0177, test_loss: 1.0590, test_f1: 0.3903
 epoch: 4, train_loss: 1.0031, test_loss: 1.1511, test_f1: 0.4396
 epoch: 5, train_loss: 0.9639, test_loss: 1.0508, test_f1: 0.3853
 epoch: 6, train_loss: 0.9539, test_loss: 1.0709, test_f1: 0.4796
 epoch: 7, train_loss: 0.9385, test_loss: 1.0561, test_f1: 0.4839
 epoch: 8, train_loss: 0.9072, test_loss: 0.9962, test_f1: 0.5464
 epoch: 9, train_loss: 0.8781, test_loss: 1.0529, test_f1: 0.5461
 epoch: 10, train_loss: 0.8638, test_loss: 0.9789, test_f1: 0.5475
 epoch: 11, train_loss: 0.8582, test_loss: 0.9459, test_f1: 0.5328
 epoch: 12, train_loss: 0.8323, test_loss: 0.9987, test_f1: 0.5160
 epoch: 13, train_loss: 0.8027, test_loss: 0.9810, test_f1: 0.5563
 epoch: 14, train_loss: 0.7999, test_loss: 1.0895, test_f1: 0.4874
 epoch: 15, train_loss: 0.7842, test_loss: 1.0489, test_f1: 0.4876
 epoch: 16, train_loss: 0.7788, test_loss: 1.0160, test_f1: 0.5704
 epoch: 17, train_loss: 0.7645, test_loss: 1.2623, test_f1: 0.4435
 epoch: 18, train_loss: 0.7663, test_loss: 1.0975, test_f1: 0.5713
 epoch: 19, train_loss: 0.7574, test_loss: 0.9749, test_f1: 0.5941
 epoch: 20, train_loss: 0.7643, test_loss: 1.0181, test_f1: 0.5694
 epoch: 21, train_loss: 0.7512, test_loss: 0.9576, test_f1: 0.5326
 epoch: 22, train_loss: 0.7475, test_loss: 0.9382, test_f1: 0.5629
 epoch: 23, train_loss: 0.7322, test_loss: 0.9287, test_f1: 0.6177
 epoch: 24, train_loss: 0.7431, test_loss: 0.9372, test_f1: 0.5854
 epoch: 25, train_loss: 0.7231, test_loss: 0.9523, test_f1: 0.6008
 epoch: 26, train_loss: 0.7168, test_loss: 0.9386, test_f1: 0.5852
 epoch: 27, train_loss: 0.6990, test_loss: 1.1172, test_f1: 0.5179
 epoch: 28, train_loss: 0.7088, test_loss: 1.2153, test_f1: 0.5916
 epoch: 29, train_loss: 0.7048, test_loss: 1.0549, test_f1: 0.6011
 epoch: 30, train_loss: 0.6950, test_loss: 1.0506, test_f1: 0.6147
 epoch: 31, train_loss: 0.7147, test_loss: 1.0772, test_f1: 0.5420
 epoch: 32, train_loss: 0.6905, test_loss: 1.0624, test_f1: 0.6012
 epoch: 33, train_loss: 0.6980, test_loss: 1.1451, test_f1: 0.5683
 epoch: 34, train_loss: 0.6857, test_loss: 1.0475, test_f1: 0.5686
 epoch: 35, train_loss: 0.6975, test_loss: 1.0909, test_f1: 0.5387
 epoch: 36, train_loss: 0.6911, test_loss: 0.9876, test_f1: 0.6122
 epoch: 37, train_loss: 0.6570, test_loss: 1.0455, test_f1: 0.5866
 epoch: 38, train_loss: 0.6726, test_loss: 1.0131, test_f1: 0.5694
 epoch: 39, train_loss: 0.6635, test_loss: 1.0208, test_f1: 0.5741
 epoch: 40, train_loss: 0.6619, test_loss: 1.1458, test_f1: 0.5507
 epoch: 41, train_loss: 0.6527, test_loss: 1.0552, test_f1: 0.5516
 epoch: 42, train_loss: 0.6616, test_loss: 1.0134, test_f1: 0.5284
 epoch: 43, train_loss: 0.6371, test_loss: 1.1018, test_f1: 0.5947
 epoch: 44, train_loss: 0.6559, test_loss: 0.9967, test_f1: 0.5923
 epoch: 45, train_loss: 0.6432, test_loss: 1.0562, test_f1: 0.5850
 epoch: 46, train_loss: 0.6241, test_loss: 1.0344, test_f1: 0.6168
 epoch: 47, train_loss: 0.6294, test_loss: 1.1244, test_f1: 0.5879
 epoch: 48, train_loss: 0.6310, test_loss: 1.0321, test_f1: 0.5775
 epoch: 49, train_loss: 0.6170, test_loss: 1.0836, test_f1: 0.5874
 epoch: 50, train_loss: 0.6285, test_loss: 1.0538, test_f1: 0.6003
 epoch: 51, train_loss: 0.5933, test_loss: 1.0204, test_f1: 0.6022
 epoch: 52, train_loss: 0.5909, test_loss: 1.0501, test_f1: 0.6015
 epoch: 53, train_loss: 0.5848, test_loss: 1.1738, test_f1: 0.6018
 epoch: 54, train_loss: 0.5961, test_loss: 1.0007, test_f1: 0.6129
 epoch: 55, train_loss: 0.5823, test_loss: 1.0427, test_f1: 0.6284
 epoch: 56, train_loss: 0.5770, test_loss: 1.0133, test_f1: 0.6344
 epoch: 57, train_loss: 0.5805, test_loss: 1.0647, test_f1: 0.6008
 epoch: 58, train_loss: 0.5755, test_loss: 1.0519, test_f1: 0.6060
 epoch: 59, train_loss: 0.5655, test_loss: 1.0305, test_f1: 0.5920
 epoch: 60, train_loss: 0.5591, test_loss: 1.0928, test_f1: 0.6328
 epoch: 61, train_loss: 0.5720, test_loss: 1.0571, test_f1: 0.6221
 epoch: 62, train_loss: 0.5535, test_loss: 1.1503, test_f1: 0.6587
 epoch: 63, train_loss: 0.5722, test_loss: 1.0985, test_f1: 0.6089
 epoch: 64, train_loss: 0.5648, test_loss: 1.1032, test_f1: 0.6320
 epoch: 65, train_loss: 0.5560, test_loss: 1.1474, test_f1: 0.5927
 epoch: 66, train_loss: 0.5688, test_loss: 1.2148, test_f1: 0.6407
 epoch: 67, train_loss: 0.5501, test_loss: 1.1092, test_f1: 0.5924
 epoch: 68, train_loss: 0.5597, test_loss: 1.1128, test_f1: 0.6309
 epoch: 69, train_loss: 0.5406, test_loss: 1.0811, test_f1: 0.6261
 epoch: 70, train_loss: 0.5206, test_loss: 1.0894, test_f1: 0.6691
 epoch: 71, train_loss: 0.5618, test_loss: 1.1842, test_f1: 0.6072
 epoch: 72, train_loss: 0.5565, test_loss: 1.1571, test_f1: 0.6286
 epoch: 73, train_loss: 0.5396, test_loss: 1.1735, test_f1: 0.6360
 epoch: 74, train_loss: 0.5231, test_loss: 1.0715, test_f1: 0.6364
 epoch: 75, train_loss: 0.5398, test_loss: 1.1491, test_f1: 0.6011
 epoch: 76, train_loss: 0.5214, test_loss: 1.1716, test_f1: 0.6538
 epoch: 77, train_loss: 0.5206, test_loss: 1.1318, test_f1: 0.6217
 epoch: 78, train_loss: 0.5077, test_loss: 1.1306, test_f1: 0.6626
 epoch: 79, train_loss: 0.5201, test_loss: 1.1731, test_f1: 0.6661
 epoch: 80, train_loss: 0.5181, test_loss: 1.1124, test_f1: 0.6726
 epoch: 81, train_loss: 0.5183, test_loss: 1.1191, test_f1: 0.6735
 epoch: 82, train_loss: 0.4943, test_loss: 1.1674, test_f1: 0.6514
 epoch: 83, train_loss: 0.5159, test_loss: 1.1253, test_f1: 0.6685
 epoch: 84, train_loss: 0.4984, test_loss: 1.2685, test_f1: 0.6401
 epoch: 85, train_loss: 0.5075, test_loss: 1.1665, test_f1: 0.6340
 epoch: 86, train_loss: 0.4863, test_loss: 1.2077, test_f1: 0.6339
 epoch: 87, train_loss: 0.4796, test_loss: 1.1458, test_f1: 0.6685
 epoch: 88, train_loss: 0.5031, test_loss: 1.1979, test_f1: 0.6516
 epoch: 89, train_loss: 0.4997, test_loss: 1.1505, test_f1: 0.6509
 epoch: 90, train_loss: 0.4981, test_loss: 1.2410, test_f1: 0.6500
 epoch: 91, train_loss: 0.4980, test_loss: 1.2486, test_f1: 0.6646
 epoch: 92, train_loss: 0.4950, test_loss: 1.1318, test_f1: 0.6428
 epoch: 93, train_loss: 0.4801, test_loss: 1.2950, test_f1: 0.6125
 epoch: 94, train_loss: 0.4892, test_loss: 1.2131, test_f1: 0.6383
 epoch: 95, train_loss: 0.4753, test_loss: 1.1655, test_f1: 0.6731
 epoch: 96, train_loss: 0.4824, test_loss: 1.2796, test_f1: 0.6403
 epoch: 97, train_loss: 0.4786, test_loss: 1.2777, test_f1: 0.6013
 epoch: 98, train_loss: 0.5004, test_loss: 1.1685, test_f1: 0.6626
 epoch: 99, train_loss: 0.4746, test_loss: 1.3059, test_f1: 0.5965
##################ITERATION #1 ****************************************
 epoch: 0, train_loss: 1.2089, test_loss: 1.2433, test_f1: 0.3272
 epoch: 1, train_loss: 1.0510, test_loss: 1.0683, test_f1: 0.4615
 epoch: 2, train_loss: 0.9683, test_loss: 1.0170, test_f1: 0.4811
 epoch: 3, train_loss: 0.9140, test_loss: 0.9771, test_f1: 0.4845
 epoch: 4, train_loss: 0.8744, test_loss: 0.9852, test_f1: 0.5469
 epoch: 5, train_loss: 0.8249, test_loss: 0.9608, test_f1: 0.5777
 epoch: 6, train_loss: 0.8055, test_loss: 1.0342, test_f1: 0.5704
 epoch: 7, train_loss: 0.7822, test_loss: 1.1001, test_f1: 0.5369
 epoch: 8, train_loss: 0.7855, test_loss: 1.1731, test_f1: 0.5910
 epoch: 9, train_loss: 0.7678, test_loss: 0.9950, test_f1: 0.6472
 epoch: 10, train_loss: 0.7345, test_loss: 1.0942, test_f1: 0.6037
 epoch: 11, train_loss: 0.7273, test_loss: 1.0304, test_f1: 0.5175
 epoch: 12, train_loss: 0.7338, test_loss: 1.0069, test_f1: 0.6508
 epoch: 13, train_loss: 0.7146, test_loss: 1.0973, test_f1: 0.6074
 epoch: 14, train_loss: 0.7308, test_loss: 1.3874, test_f1: 0.5457
 epoch: 15, train_loss: 0.7189, test_loss: 1.2119, test_f1: 0.5848
 epoch: 16, train_loss: 0.6999, test_loss: 1.1179, test_f1: 0.5970
 epoch: 17, train_loss: 0.6996, test_loss: 1.2071, test_f1: 0.5918
 epoch: 18, train_loss: 0.6887, test_loss: 1.0610, test_f1: 0.6233
 epoch: 19, train_loss: 0.6952, test_loss: 1.0653, test_f1: 0.6286
 epoch: 20, train_loss: 0.6781, test_loss: 1.2298, test_f1: 0.6051
 epoch: 21, train_loss: 0.6757, test_loss: 1.2155, test_f1: 0.6749
 epoch: 22, train_loss: 0.6667, test_loss: 1.1812, test_f1: 0.5934
 epoch: 23, train_loss: 0.6765, test_loss: 1.0974, test_f1: 0.6239
 epoch: 24, train_loss: 0.6504, test_loss: 1.3254, test_f1: 0.5829
 epoch: 25, train_loss: 0.6414, test_loss: 1.0211, test_f1: 0.6089
 epoch: 26, train_loss: 0.6518, test_loss: 1.3400, test_f1: 0.5650
 epoch: 27, train_loss: 0.6452, test_loss: 1.2319, test_f1: 0.5984
 epoch: 28, train_loss: 0.6344, test_loss: 1.3153, test_f1: 0.5274
 epoch: 29, train_loss: 0.6290, test_loss: 1.1486, test_f1: 0.6162
 epoch: 30, train_loss: 0.6247, test_loss: 1.1070, test_f1: 0.6318
 epoch: 31, train_loss: 0.6145, test_loss: 1.3756, test_f1: 0.5714
 epoch: 32, train_loss: 0.6100, test_loss: 1.3883, test_f1: 0.5970
 epoch: 33, train_loss: 0.6097, test_loss: 1.1830, test_f1: 0.5812
 epoch: 34, train_loss: 0.5903, test_loss: 1.0766, test_f1: 0.5839
 epoch: 35, train_loss: 0.6117, test_loss: 1.4092, test_f1: 0.5903
 epoch: 36, train_loss: 0.5899, test_loss: 1.3319, test_f1: 0.6239
 epoch: 37, train_loss: 0.5958, test_loss: 1.2304, test_f1: 0.6030
 epoch: 38, train_loss: 0.5832, test_loss: 1.1478, test_f1: 0.5666
 epoch: 39, train_loss: 0.5988, test_loss: 1.1897, test_f1: 0.5984
 epoch: 40, train_loss: 0.5980, test_loss: 1.3021, test_f1: 0.5655
 epoch: 41, train_loss: 0.5683, test_loss: 1.3837, test_f1: 0.5855
 epoch: 42, train_loss: 0.5828, test_loss: 1.0958, test_f1: 0.6214
 epoch: 43, train_loss: 0.5761, test_loss: 1.5368, test_f1: 0.5841
 epoch: 44, train_loss: 0.5521, test_loss: 1.1942, test_f1: 0.6299
 epoch: 45, train_loss: 0.5703, test_loss: 1.2692, test_f1: 0.6059
 epoch: 46, train_loss: 0.5349, test_loss: 1.2783, test_f1: 0.6375
 epoch: 47, train_loss: 0.5498, test_loss: 1.2771, test_f1: 0.6425
 epoch: 48, train_loss: 0.5559, test_loss: 1.3076, test_f1: 0.6176
 epoch: 49, train_loss: 0.5550, test_loss: 1.3895, test_f1: 0.6137
 epoch: 50, train_loss: 0.5297, test_loss: 1.1575, test_f1: 0.6246
 epoch: 51, train_loss: 0.5289, test_loss: 1.2954, test_f1: 0.6132
 epoch: 52, train_loss: 0.5335, test_loss: 1.3334, test_f1: 0.5826
 epoch: 53, train_loss: 0.5009, test_loss: 1.2851, test_f1: 0.6193
 epoch: 54, train_loss: 0.5044, test_loss: 1.2836, test_f1: 0.6778
 epoch: 55, train_loss: 0.4972, test_loss: 1.3062, test_f1: 0.6136
 epoch: 56, train_loss: 0.4918, test_loss: 1.2820, test_f1: 0.6411
 epoch: 57, train_loss: 0.4897, test_loss: 1.2825, test_f1: 0.6097
 epoch: 58, train_loss: 0.4876, test_loss: 1.3025, test_f1: 0.6067
 epoch: 59, train_loss: 0.4914, test_loss: 1.4644, test_f1: 0.6013
 epoch: 60, train_loss: 0.4842, test_loss: 1.4982, test_f1: 0.6169
 epoch: 61, train_loss: 0.4642, test_loss: 1.4834, test_f1: 0.5846
 epoch: 62, train_loss: 0.4707, test_loss: 1.4025, test_f1: 0.5934
 epoch: 63, train_loss: 0.4911, test_loss: 1.3666, test_f1: 0.6090
 epoch: 64, train_loss: 0.4650, test_loss: 1.4370, test_f1: 0.6467
 epoch: 65, train_loss: 0.4613, test_loss: 1.4170, test_f1: 0.6084
 epoch: 66, train_loss: 0.4793, test_loss: 1.4418, test_f1: 0.6238
 epoch: 67, train_loss: 0.4893, test_loss: 1.2515, test_f1: 0.6747
 epoch: 68, train_loss: 0.4665, test_loss: 1.3313, test_f1: 0.6211
 epoch: 69, train_loss: 0.4576, test_loss: 1.3267, test_f1: 0.6248
 epoch: 70, train_loss: 0.4705, test_loss: 1.3385, test_f1: 0.6442
 epoch: 71, train_loss: 0.4603, test_loss: 1.4689, test_f1: 0.6193
 epoch: 72, train_loss: 0.4589, test_loss: 1.5350, test_f1: 0.5901
 epoch: 73, train_loss: 0.4779, test_loss: 1.6158, test_f1: 0.6010
 epoch: 74, train_loss: 0.4227, test_loss: 1.5314, test_f1: 0.5956
 epoch: 75, train_loss: 0.4474, test_loss: 1.3604, test_f1: 0.6722
 epoch: 76, train_loss: 0.4174, test_loss: 1.3506, test_f1: 0.6286
 epoch: 77, train_loss: 0.4358, test_loss: 1.4695, test_f1: 0.6299
 epoch: 78, train_loss: 0.4395, test_loss: 1.4299, test_f1: 0.6321
 epoch: 79, train_loss: 0.4518, test_loss: 1.4874, test_f1: 0.5868
 epoch: 80, train_loss: 0.4535, test_loss: 1.6175, test_f1: 0.6384
 epoch: 81, train_loss: 0.4163, test_loss: 1.5282, test_f1: 0.5916
 epoch: 82, train_loss: 0.4206, test_loss: 1.3203, test_f1: 0.6036
 epoch: 83, train_loss: 0.4130, test_loss: 1.2930, test_f1: 0.6581
 epoch: 84, train_loss: 0.4195, test_loss: 1.4747, test_f1: 0.6338
 epoch: 85, train_loss: 0.4331, test_loss: 1.5583, test_f1: 0.6565
 epoch: 86, train_loss: 0.4458, test_loss: 1.5444, test_f1: 0.6226
 epoch: 87, train_loss: 0.4184, test_loss: 1.4919, test_f1: 0.6361
 epoch: 88, train_loss: 0.4182, test_loss: 1.5300, test_f1: 0.6330
 epoch: 89, train_loss: 0.4493, test_loss: 1.5202, test_f1: 0.6001
 epoch: 90, train_loss: 0.4137, test_loss: 1.4433, test_f1: 0.5830
 epoch: 91, train_loss: 0.4247, test_loss: 1.4857, test_f1: 0.5997
 epoch: 92, train_loss: 0.4128, test_loss: 1.6269, test_f1: 0.6309
 epoch: 93, train_loss: 0.4132, test_loss: 1.4717, test_f1: 0.6315
 epoch: 94, train_loss: 0.3950, test_loss: 1.5305, test_f1: 0.6451
 epoch: 95, train_loss: 0.4018, test_loss: 1.6042, test_f1: 0.6216
 epoch: 96, train_loss: 0.3829, test_loss: 1.6692, test_f1: 0.6168
 epoch: 97, train_loss: 0.4182, test_loss: 1.5832, test_f1: 0.6319
 epoch: 98, train_loss: 0.4132, test_loss: 1.6924, test_f1: 0.6284
 epoch: 99, train_loss: 0.3778, test_loss: 1.6574, test_f1: 0.6306
##################ITERATION #2 ****************************************
 epoch: 0, train_loss: 1.1983, test_loss: 1.2173, test_f1: 0.4004
 epoch: 1, train_loss: 1.0617, test_loss: 1.0806, test_f1: 0.5173
 epoch: 2, train_loss: 0.9952, test_loss: 1.0090, test_f1: 0.5305
 epoch: 3, train_loss: 0.9435, test_loss: 0.9822, test_f1: 0.5921
 epoch: 4, train_loss: 0.9013, test_loss: 0.9784, test_f1: 0.6042
 epoch: 5, train_loss: 0.8712, test_loss: 0.9806, test_f1: 0.5705
 epoch: 6, train_loss: 0.8657, test_loss: 1.0152, test_f1: 0.5805
 epoch: 7, train_loss: 0.8651, test_loss: 0.9973, test_f1: 0.6046
 epoch: 8, train_loss: 0.8434, test_loss: 0.9916, test_f1: 0.6175
 epoch: 9, train_loss: 0.8163, test_loss: 0.9509, test_f1: 0.5361
 epoch: 10, train_loss: 0.8070, test_loss: 1.0339, test_f1: 0.5551
 epoch: 11, train_loss: 0.8119, test_loss: 0.9769, test_f1: 0.5697
 epoch: 12, train_loss: 0.7825, test_loss: 0.9556, test_f1: 0.5824
 epoch: 13, train_loss: 0.7785, test_loss: 0.9113, test_f1: 0.6205
 epoch: 14, train_loss: 0.7571, test_loss: 0.9434, test_f1: 0.5951
 epoch: 15, train_loss: 0.7454, test_loss: 0.9719, test_f1: 0.5801
 epoch: 16, train_loss: 0.7433, test_loss: 0.9772, test_f1: 0.5704
 epoch: 17, train_loss: 0.7386, test_loss: 0.9922, test_f1: 0.5881
 epoch: 18, train_loss: 0.7204, test_loss: 1.0325, test_f1: 0.5598
 epoch: 19, train_loss: 0.7145, test_loss: 1.0965, test_f1: 0.5419
 epoch: 20, train_loss: 0.7172, test_loss: 0.9956, test_f1: 0.5593
 epoch: 21, train_loss: 0.6938, test_loss: 0.9825, test_f1: 0.6242
 epoch: 22, train_loss: 0.7025, test_loss: 1.1351, test_f1: 0.6334
 epoch: 23, train_loss: 0.7063, test_loss: 1.0707, test_f1: 0.5889
 epoch: 24, train_loss: 0.6635, test_loss: 1.0498, test_f1: 0.6147
 epoch: 25, train_loss: 0.6756, test_loss: 1.0793, test_f1: 0.5882
 epoch: 26, train_loss: 0.6888, test_loss: 1.0307, test_f1: 0.6646
 epoch: 27, train_loss: 0.6861, test_loss: 1.1190, test_f1: 0.5991
 epoch: 28, train_loss: 0.6554, test_loss: 1.1515, test_f1: 0.5965
 epoch: 29, train_loss: 0.6598, test_loss: 1.0788, test_f1: 0.6078
 epoch: 30, train_loss: 0.6460, test_loss: 1.0375, test_f1: 0.6183
 epoch: 31, train_loss: 0.6588, test_loss: 1.0001, test_f1: 0.6266
 epoch: 32, train_loss: 0.6295, test_loss: 1.0611, test_f1: 0.6008
 epoch: 33, train_loss: 0.6321, test_loss: 0.9841, test_f1: 0.6020
 epoch: 34, train_loss: 0.6328, test_loss: 1.1345, test_f1: 0.5610
 epoch: 35, train_loss: 0.6427, test_loss: 1.0637, test_f1: 0.5879
 epoch: 36, train_loss: 0.6312, test_loss: 1.1294, test_f1: 0.5403
 epoch: 37, train_loss: 0.6459, test_loss: 0.9719, test_f1: 0.5921
 epoch: 38, train_loss: 0.6107, test_loss: 1.1115, test_f1: 0.5876
 epoch: 39, train_loss: 0.6192, test_loss: 1.1685, test_f1: 0.5432
 epoch: 40, train_loss: 0.6154, test_loss: 0.9915, test_f1: 0.6072
 epoch: 41, train_loss: 0.5748, test_loss: 1.1896, test_f1: 0.6571
 epoch: 42, train_loss: 0.5848, test_loss: 1.1381, test_f1: 0.5841
 epoch: 43, train_loss: 0.5818, test_loss: 1.0743, test_f1: 0.6206
 epoch: 44, train_loss: 0.5869, test_loss: 1.1737, test_f1: 0.5003
 epoch: 45, train_loss: 0.6067, test_loss: 1.0277, test_f1: 0.6287
 epoch: 46, train_loss: 0.5933, test_loss: 1.2156, test_f1: 0.5818
 epoch: 47, train_loss: 0.5680, test_loss: 1.3554, test_f1: 0.5407
 epoch: 48, train_loss: 0.5677, test_loss: 1.2714, test_f1: 0.5857
 epoch: 49, train_loss: 0.5792, test_loss: 1.3053, test_f1: 0.5584
 epoch: 50, train_loss: 0.5617, test_loss: 1.2477, test_f1: 0.5768
 epoch: 51, train_loss: 0.5414, test_loss: 1.1477, test_f1: 0.6033
 epoch: 52, train_loss: 0.5078, test_loss: 1.1841, test_f1: 0.6239
 epoch: 53, train_loss: 0.5195, test_loss: 1.2778, test_f1: 0.6041
 epoch: 54, train_loss: 0.5085, test_loss: 1.3003, test_f1: 0.6018
 epoch: 55, train_loss: 0.5043, test_loss: 1.2058, test_f1: 0.6048
 epoch: 56, train_loss: 0.5191, test_loss: 1.2459, test_f1: 0.6035
 epoch: 57, train_loss: 0.5281, test_loss: 1.2287, test_f1: 0.6294
 epoch: 58, train_loss: 0.5116, test_loss: 1.1957, test_f1: 0.6415
 epoch: 59, train_loss: 0.4893, test_loss: 1.2755, test_f1: 0.6351
 epoch: 60, train_loss: 0.4899, test_loss: 1.2918, test_f1: 0.6281
 epoch: 61, train_loss: 0.4788, test_loss: 1.3817, test_f1: 0.6029
 epoch: 62, train_loss: 0.4819, test_loss: 1.3016, test_f1: 0.6263
 epoch: 63, train_loss: 0.4811, test_loss: 1.4056, test_f1: 0.6334
 epoch: 64, train_loss: 0.4847, test_loss: 1.1752, test_f1: 0.6319
 epoch: 65, train_loss: 0.4626, test_loss: 1.1978, test_f1: 0.6220
 epoch: 66, train_loss: 0.4797, test_loss: 1.3915, test_f1: 0.6004
 epoch: 67, train_loss: 0.4783, test_loss: 1.3638, test_f1: 0.6421
 epoch: 68, train_loss: 0.4645, test_loss: 1.4608, test_f1: 0.5980
 epoch: 69, train_loss: 0.4731, test_loss: 1.2337, test_f1: 0.6615
 epoch: 70, train_loss: 0.4502, test_loss: 1.3582, test_f1: 0.6299
 epoch: 71, train_loss: 0.4690, test_loss: 1.3360, test_f1: 0.6293
 epoch: 72, train_loss: 0.4736, test_loss: 1.4206, test_f1: 0.6129
 epoch: 73, train_loss: 0.4413, test_loss: 1.4227, test_f1: 0.6132
 epoch: 74, train_loss: 0.4477, test_loss: 1.5929, test_f1: 0.6072
 epoch: 75, train_loss: 0.4503, test_loss: 1.4630, test_f1: 0.6432
 epoch: 76, train_loss: 0.4538, test_loss: 1.4360, test_f1: 0.6356
 epoch: 77, train_loss: 0.4359, test_loss: 1.4426, test_f1: 0.6041
 epoch: 78, train_loss: 0.4513, test_loss: 1.3489, test_f1: 0.6214
 epoch: 79, train_loss: 0.4388, test_loss: 1.4454, test_f1: 0.6199
 epoch: 80, train_loss: 0.4206, test_loss: 1.3820, test_f1: 0.6745
 epoch: 81, train_loss: 0.4339, test_loss: 1.4290, test_f1: 0.6437
 epoch: 82, train_loss: 0.4165, test_loss: 1.5643, test_f1: 0.6622
 epoch: 83, train_loss: 0.4352, test_loss: 1.4615, test_f1: 0.6691
 epoch: 84, train_loss: 0.4254, test_loss: 1.6022, test_f1: 0.6313
 epoch: 85, train_loss: 0.4164, test_loss: 1.6413, test_f1: 0.5949
 epoch: 86, train_loss: 0.4135, test_loss: 1.7898, test_f1: 0.5745
 epoch: 87, train_loss: 0.4342, test_loss: 1.5780, test_f1: 0.6335
 epoch: 88, train_loss: 0.4072, test_loss: 1.5129, test_f1: 0.6477
 epoch: 89, train_loss: 0.4351, test_loss: 1.4280, test_f1: 0.6507
 epoch: 90, train_loss: 0.3901, test_loss: 1.5318, test_f1: 0.6574
 epoch: 91, train_loss: 0.4107, test_loss: 1.6565, test_f1: 0.6078
 epoch: 92, train_loss: 0.3991, test_loss: 1.5508, test_f1: 0.6484
 epoch: 93, train_loss: 0.4005, test_loss: 1.5892, test_f1: 0.6101
 epoch: 94, train_loss: 0.3968, test_loss: 1.8214, test_f1: 0.6108
 epoch: 95, train_loss: 0.3906, test_loss: 1.7059, test_f1: 0.6499
 epoch: 96, train_loss: 0.4084, test_loss: 1.6621, test_f1: 0.6406
 epoch: 97, train_loss: 0.4112, test_loss: 1.7575, test_f1: 0.6032
 epoch: 98, train_loss: 0.3881, test_loss: 1.6019, test_f1: 0.6295
 epoch: 99, train_loss: 0.3906, test_loss: 1.7800, test_f1: 0.6058
##################ITERATION #3 ****************************************
 epoch: 0, train_loss: 1.3104, test_loss: 1.1852, test_f1: 0.3490
 epoch: 1, train_loss: 1.0402, test_loss: 1.0729, test_f1: 0.5331
 epoch: 2, train_loss: 1.0032, test_loss: 1.0300, test_f1: 0.5543
 epoch: 3, train_loss: 0.9306, test_loss: 1.0069, test_f1: 0.5698
 epoch: 4, train_loss: 0.8975, test_loss: 0.9825, test_f1: 0.5723
 epoch: 5, train_loss: 0.8704, test_loss: 0.9725, test_f1: 0.5710
 epoch: 6, train_loss: 0.8216, test_loss: 0.9575, test_f1: 0.6093
 epoch: 7, train_loss: 0.8072, test_loss: 1.0044, test_f1: 0.6138
 epoch: 8, train_loss: 0.7826, test_loss: 1.0126, test_f1: 0.6129
 epoch: 9, train_loss: 0.7811, test_loss: 0.9411, test_f1: 0.6412
 epoch: 10, train_loss: 0.7754, test_loss: 0.9352, test_f1: 0.6419
 epoch: 11, train_loss: 0.7490, test_loss: 0.9579, test_f1: 0.6139
 epoch: 12, train_loss: 0.7350, test_loss: 0.9718, test_f1: 0.5959
 epoch: 13, train_loss: 0.7210, test_loss: 0.9509, test_f1: 0.6299
 epoch: 14, train_loss: 0.7195, test_loss: 0.9732, test_f1: 0.5973
 epoch: 15, train_loss: 0.7109, test_loss: 1.0614, test_f1: 0.5763
 epoch: 16, train_loss: 0.7024, test_loss: 0.9717, test_f1: 0.6202
 epoch: 17, train_loss: 0.6934, test_loss: 0.9414, test_f1: 0.6363
 epoch: 18, train_loss: 0.6730, test_loss: 0.9615, test_f1: 0.5520
 epoch: 19, train_loss: 0.6819, test_loss: 1.0262, test_f1: 0.5648
 epoch: 20, train_loss: 0.6644, test_loss: 1.0019, test_f1: 0.5833
 epoch: 21, train_loss: 0.6617, test_loss: 1.0766, test_f1: 0.5721
 epoch: 22, train_loss: 0.6681, test_loss: 1.0344, test_f1: 0.5848
 epoch: 23, train_loss: 0.6546, test_loss: 1.0799, test_f1: 0.5682
 epoch: 24, train_loss: 0.6235, test_loss: 1.0474, test_f1: 0.5927
 epoch: 25, train_loss: 0.6373, test_loss: 1.0924, test_f1: 0.6046
 epoch: 26, train_loss: 0.6151, test_loss: 1.1243, test_f1: 0.5938
 epoch: 27, train_loss: 0.6144, test_loss: 1.0269, test_f1: 0.6040
 epoch: 28, train_loss: 0.5855, test_loss: 1.1352, test_f1: 0.6537
 epoch: 29, train_loss: 0.5855, test_loss: 1.1567, test_f1: 0.5568
 epoch: 30, train_loss: 0.5825, test_loss: 1.1012, test_f1: 0.5722
 epoch: 31, train_loss: 0.5704, test_loss: 1.1328, test_f1: 0.6178
 epoch: 32, train_loss: 0.5719, test_loss: 1.1913, test_f1: 0.5888
 epoch: 33, train_loss: 0.5552, test_loss: 1.2922, test_f1: 0.5617
 epoch: 34, train_loss: 0.5678, test_loss: 1.1901, test_f1: 0.5651
 epoch: 35, train_loss: 0.5731, test_loss: 1.2400, test_f1: 0.5794
 epoch: 36, train_loss: 0.5456, test_loss: 1.2767, test_f1: 0.5978
 epoch: 37, train_loss: 0.5312, test_loss: 1.2124, test_f1: 0.5926
 epoch: 38, train_loss: 0.5475, test_loss: 1.2331, test_f1: 0.5697
 epoch: 39, train_loss: 0.5263, test_loss: 1.1740, test_f1: 0.6094
 epoch: 40, train_loss: 0.5330, test_loss: 1.3336, test_f1: 0.5954
 epoch: 41, train_loss: 0.5218, test_loss: 1.2808, test_f1: 0.6100
 epoch: 42, train_loss: 0.5181, test_loss: 1.4886, test_f1: 0.5629
 epoch: 43, train_loss: 0.5214, test_loss: 1.3023, test_f1: 0.6148
 epoch: 44, train_loss: 0.5368, test_loss: 1.2117, test_f1: 0.5946
 epoch: 45, train_loss: 0.4855, test_loss: 1.2328, test_f1: 0.5918
 epoch: 46, train_loss: 0.4903, test_loss: 1.4649, test_f1: 0.6009
 epoch: 47, train_loss: 0.4896, test_loss: 1.4887, test_f1: 0.5908
 epoch: 48, train_loss: 0.4876, test_loss: 1.3067, test_f1: 0.5674
 epoch: 49, train_loss: 0.4883, test_loss: 1.4313, test_f1: 0.5645
 epoch: 50, train_loss: 0.4812, test_loss: 1.5393, test_f1: 0.5852
 epoch: 51, train_loss: 0.4626, test_loss: 1.4076, test_f1: 0.6101
 epoch: 52, train_loss: 0.4478, test_loss: 1.3829, test_f1: 0.6369
 epoch: 53, train_loss: 0.4266, test_loss: 1.5127, test_f1: 0.5994
 epoch: 54, train_loss: 0.4436, test_loss: 1.5947, test_f1: 0.5755
 epoch: 55, train_loss: 0.4275, test_loss: 1.5004, test_f1: 0.6143
 epoch: 56, train_loss: 0.4427, test_loss: 1.5150, test_f1: 0.6428
 epoch: 57, train_loss: 0.4098, test_loss: 1.5688, test_f1: 0.6158
 epoch: 58, train_loss: 0.3919, test_loss: 1.6461, test_f1: 0.6102
 epoch: 59, train_loss: 0.4066, test_loss: 1.6050, test_f1: 0.6365
 epoch: 60, train_loss: 0.3999, test_loss: 1.6459, test_f1: 0.6094
 epoch: 61, train_loss: 0.3966, test_loss: 1.5314, test_f1: 0.6072
 epoch: 62, train_loss: 0.4012, test_loss: 1.7045, test_f1: 0.6081
 epoch: 63, train_loss: 0.4298, test_loss: 1.6662, test_f1: 0.6195
 epoch: 64, train_loss: 0.3885, test_loss: 1.7323, test_f1: 0.6070
 epoch: 65, train_loss: 0.3659, test_loss: 1.6255, test_f1: 0.6192
 epoch: 66, train_loss: 0.3788, test_loss: 1.8048, test_f1: 0.5785
 epoch: 67, train_loss: 0.3723, test_loss: 1.7840, test_f1: 0.6009
 epoch: 68, train_loss: 0.3795, test_loss: 1.7068, test_f1: 0.6000
 epoch: 69, train_loss: 0.3756, test_loss: 1.7400, test_f1: 0.6035
 epoch: 70, train_loss: 0.3700, test_loss: 1.7016, test_f1: 0.6087
 epoch: 71, train_loss: 0.3705, test_loss: 1.7158, test_f1: 0.6015
 epoch: 72, train_loss: 0.3670, test_loss: 1.7453, test_f1: 0.6224
 epoch: 73, train_loss: 0.3795, test_loss: 1.9681, test_f1: 0.5985
 epoch: 74, train_loss: 0.3623, test_loss: 2.0121, test_f1: 0.5865
 epoch: 75, train_loss: 0.3637, test_loss: 1.8132, test_f1: 0.6159
 epoch: 76, train_loss: 0.3416, test_loss: 1.7538, test_f1: 0.6025
 epoch: 77, train_loss: 0.3448, test_loss: 1.9117, test_f1: 0.6103
 epoch: 78, train_loss: 0.3503, test_loss: 2.0054, test_f1: 0.5894
 epoch: 79, train_loss: 0.3443, test_loss: 1.9446, test_f1: 0.6036
 epoch: 80, train_loss: 0.3245, test_loss: 1.8245, test_f1: 0.5986
 epoch: 81, train_loss: 0.3579, test_loss: 1.9334, test_f1: 0.5911
 epoch: 82, train_loss: 0.3200, test_loss: 2.0208, test_f1: 0.5791
 epoch: 83, train_loss: 0.3425, test_loss: 1.8764, test_f1: 0.5970
 epoch: 84, train_loss: 0.3453, test_loss: 2.0935, test_f1: 0.6140
 epoch: 85, train_loss: 0.3104, test_loss: 2.1516, test_f1: 0.5675
 epoch: 86, train_loss: 0.3253, test_loss: 2.1911, test_f1: 0.6097
 epoch: 87, train_loss: 0.3521, test_loss: 1.9874, test_f1: 0.5959
 epoch: 88, train_loss: 0.3361, test_loss: 1.9404, test_f1: 0.6249
 epoch: 89, train_loss: 0.3424, test_loss: 2.1635, test_f1: 0.6036
 epoch: 90, train_loss: 0.3306, test_loss: 2.1156, test_f1: 0.6113
 epoch: 91, train_loss: 0.3568, test_loss: 2.0508, test_f1: 0.6177
 epoch: 92, train_loss: 0.3073, test_loss: 2.3335, test_f1: 0.5610
 epoch: 93, train_loss: 0.3077, test_loss: 2.1619, test_f1: 0.5793
 epoch: 94, train_loss: 0.2885, test_loss: 2.3202, test_f1: 0.6322
 epoch: 95, train_loss: 0.3146, test_loss: 2.2056, test_f1: 0.6094
 epoch: 96, train_loss: 0.3052, test_loss: 2.1931, test_f1: 0.6231
 epoch: 97, train_loss: 0.3142, test_loss: 2.2274, test_f1: 0.5945
 epoch: 98, train_loss: 0.3474, test_loss: 2.1825, test_f1: 0.6209
 epoch: 99, train_loss: 0.2974, test_loss: 2.1962, test_f1: 0.5945
##################ITERATION #4 ****************************************
 epoch: 0, train_loss: 1.2853, test_loss: 1.2537, test_f1: 0.3021
 epoch: 1, train_loss: 1.1169, test_loss: 1.1247, test_f1: 0.4214
 epoch: 2, train_loss: 1.0329, test_loss: 1.0725, test_f1: 0.5115
 epoch: 3, train_loss: 1.0013, test_loss: 1.0655, test_f1: 0.5423
 epoch: 4, train_loss: 0.9556, test_loss: 1.0367, test_f1: 0.5389
 epoch: 5, train_loss: 0.9413, test_loss: 1.1003, test_f1: 0.4707
 epoch: 6, train_loss: 0.9032, test_loss: 1.0192, test_f1: 0.5472
 epoch: 7, train_loss: 0.8952, test_loss: 1.2559, test_f1: 0.4906
 epoch: 8, train_loss: 0.8811, test_loss: 1.0723, test_f1: 0.5505
 epoch: 9, train_loss: 0.8412, test_loss: 1.0089, test_f1: 0.5380
 epoch: 10, train_loss: 0.8464, test_loss: 1.3807, test_f1: 0.5601
 epoch: 11, train_loss: 0.8253, test_loss: 1.0727, test_f1: 0.5807
 epoch: 12, train_loss: 0.8291, test_loss: 0.9915, test_f1: 0.5776
 epoch: 13, train_loss: 0.8022, test_loss: 0.9970, test_f1: 0.5715
 epoch: 14, train_loss: 0.7978, test_loss: 0.9943, test_f1: 0.5553
 epoch: 15, train_loss: 0.7836, test_loss: 1.0138, test_f1: 0.5588
 epoch: 16, train_loss: 0.7915, test_loss: 1.0051, test_f1: 0.5708
 epoch: 17, train_loss: 0.7796, test_loss: 1.1403, test_f1: 0.5582
 epoch: 18, train_loss: 0.7795, test_loss: 1.1437, test_f1: 0.5738
 epoch: 19, train_loss: 0.7429, test_loss: 1.0351, test_f1: 0.5366
 epoch: 20, train_loss: 0.7478, test_loss: 0.9831, test_f1: 0.6164
 epoch: 21, train_loss: 0.7263, test_loss: 1.0802, test_f1: 0.5807
 epoch: 22, train_loss: 0.7348, test_loss: 1.3020, test_f1: 0.5195
 epoch: 23, train_loss: 0.7406, test_loss: 1.1386, test_f1: 0.5961
 epoch: 24, train_loss: 0.7124, test_loss: 1.0417, test_f1: 0.5694
 epoch: 25, train_loss: 0.7154, test_loss: 1.2464, test_f1: 0.5579
 epoch: 26, train_loss: 0.6911, test_loss: 1.1577, test_f1: 0.5467
 epoch: 27, train_loss: 0.6888, test_loss: 1.0259, test_f1: 0.6086
 epoch: 28, train_loss: 0.6956, test_loss: 1.0403, test_f1: 0.5755
 epoch: 29, train_loss: 0.6819, test_loss: 1.2866, test_f1: 0.5683
 epoch: 30, train_loss: 0.6932, test_loss: 1.1895, test_f1: 0.5338
 epoch: 31, train_loss: 0.6817, test_loss: 1.1787, test_f1: 0.6053
 epoch: 32, train_loss: 0.6623, test_loss: 0.9944, test_f1: 0.6059
 epoch: 33, train_loss: 0.6694, test_loss: 1.1860, test_f1: 0.5760
 epoch: 34, train_loss: 0.6795, test_loss: 1.2794, test_f1: 0.5982
 epoch: 35, train_loss: 0.6926, test_loss: 1.1335, test_f1: 0.5563
 epoch: 36, train_loss: 0.6598, test_loss: 1.2273, test_f1: 0.5816
 epoch: 37, train_loss: 0.6488, test_loss: 1.1595, test_f1: 0.6160
 epoch: 38, train_loss: 0.6412, test_loss: 1.1607, test_f1: 0.6061
 epoch: 39, train_loss: 0.6662, test_loss: 1.3318, test_f1: 0.5859
 epoch: 40, train_loss: 0.6284, test_loss: 1.5063, test_f1: 0.6277
 epoch: 41, train_loss: 0.6074, test_loss: 1.1469, test_f1: 0.6203
 epoch: 42, train_loss: 0.6019, test_loss: 1.1852, test_f1: 0.6001
 epoch: 43, train_loss: 0.5990, test_loss: 1.2135, test_f1: 0.5898
 epoch: 44, train_loss: 0.6268, test_loss: 1.1502, test_f1: 0.5917
 epoch: 45, train_loss: 0.6108, test_loss: 1.3560, test_f1: 0.5417
 epoch: 46, train_loss: 0.6289, test_loss: 1.2195, test_f1: 0.6401
 epoch: 47, train_loss: 0.6035, test_loss: 1.2355, test_f1: 0.5767
 epoch: 48, train_loss: 0.5909, test_loss: 1.4618, test_f1: 0.6050
 epoch: 49, train_loss: 0.5973, test_loss: 1.3930, test_f1: 0.5277
 epoch: 50, train_loss: 0.6128, test_loss: 1.4036, test_f1: 0.5387
 epoch: 51, train_loss: 0.5731, test_loss: 1.3818, test_f1: 0.5748
 epoch: 52, train_loss: 0.5579, test_loss: 1.3156, test_f1: 0.5697
 epoch: 53, train_loss: 0.5444, test_loss: 1.3335, test_f1: 0.5728
 epoch: 54, train_loss: 0.5649, test_loss: 1.3950, test_f1: 0.5787
 epoch: 55, train_loss: 0.5508, test_loss: 1.2495, test_f1: 0.5698
 epoch: 56, train_loss: 0.5444, test_loss: 1.3932, test_f1: 0.5833
 epoch: 57, train_loss: 0.5502, test_loss: 1.2939, test_f1: 0.5933
 epoch: 58, train_loss: 0.5291, test_loss: 1.5549, test_f1: 0.5799
 epoch: 59, train_loss: 0.5467, test_loss: 1.2912, test_f1: 0.6121
 epoch: 60, train_loss: 0.5361, test_loss: 1.3878, test_f1: 0.6111
 epoch: 61, train_loss: 0.5303, test_loss: 1.3107, test_f1: 0.6024
 epoch: 62, train_loss: 0.5369, test_loss: 1.3728, test_f1: 0.6197
 epoch: 63, train_loss: 0.5181, test_loss: 1.0878, test_f1: 0.6091
 epoch: 64, train_loss: 0.5129, test_loss: 1.4242, test_f1: 0.5978
 epoch: 65, train_loss: 0.5374, test_loss: 1.3957, test_f1: 0.6061
 epoch: 66, train_loss: 0.5154, test_loss: 1.1621, test_f1: 0.5942
 epoch: 67, train_loss: 0.5352, test_loss: 1.3995, test_f1: 0.6170
 epoch: 68, train_loss: 0.4945, test_loss: 1.2704, test_f1: 0.6067
 epoch: 69, train_loss: 0.4999, test_loss: 1.4949, test_f1: 0.6076
 epoch: 70, train_loss: 0.5013, test_loss: 1.3195, test_f1: 0.6069
 epoch: 71, train_loss: 0.5157, test_loss: 1.4744, test_f1: 0.6056
 epoch: 72, train_loss: 0.5097, test_loss: 1.3114, test_f1: 0.6165
 epoch: 73, train_loss: 0.4971, test_loss: 1.3176, test_f1: 0.6189
 epoch: 74, train_loss: 0.5089, test_loss: 1.3183, test_f1: 0.6120
 epoch: 75, train_loss: 0.4887, test_loss: 1.3391, test_f1: 0.5912
 epoch: 76, train_loss: 0.4922, test_loss: 1.3223, test_f1: 0.6239
 epoch: 77, train_loss: 0.5189, test_loss: 1.4317, test_f1: 0.5919
 epoch: 78, train_loss: 0.4939, test_loss: 1.3037, test_f1: 0.5950
 epoch: 79, train_loss: 0.4747, test_loss: 1.6021, test_f1: 0.5679
 epoch: 80, train_loss: 0.4812, test_loss: 1.6145, test_f1: 0.6181
 epoch: 81, train_loss: 0.5049, test_loss: 1.2606, test_f1: 0.6036
 epoch: 82, train_loss: 0.4799, test_loss: 1.5216, test_f1: 0.6098
 epoch: 83, train_loss: 0.4851, test_loss: 1.3154, test_f1: 0.6049
 epoch: 84, train_loss: 0.4686, test_loss: 1.5822, test_f1: 0.5982
 epoch: 85, train_loss: 0.4911, test_loss: 1.4700, test_f1: 0.6047
 epoch: 86, train_loss: 0.4823, test_loss: 1.6322, test_f1: 0.6160
 epoch: 87, train_loss: 0.4727, test_loss: 1.4860, test_f1: 0.5834
 epoch: 88, train_loss: 0.4575, test_loss: 1.4181, test_f1: 0.6218
 epoch: 89, train_loss: 0.4475, test_loss: 1.4060, test_f1: 0.6028
 epoch: 90, train_loss: 0.4555, test_loss: 1.4859, test_f1: 0.5915
 epoch: 91, train_loss: 0.4492, test_loss: 1.5871, test_f1: 0.6180
 epoch: 92, train_loss: 0.4584, test_loss: 1.5240, test_f1: 0.6052
 epoch: 93, train_loss: 0.4583, test_loss: 1.5405, test_f1: 0.5870
 epoch: 94, train_loss: 0.4616, test_loss: 1.3708, test_f1: 0.6129
 epoch: 95, train_loss: 0.4436, test_loss: 1.4700, test_f1: 0.6020
 epoch: 96, train_loss: 0.4485, test_loss: 1.5135, test_f1: 0.6041
 epoch: 97, train_loss: 0.4435, test_loss: 1.4560, test_f1: 0.6307
 epoch: 98, train_loss: 0.4378, test_loss: 1.3596, test_f1: 0.6293
 epoch: 99, train_loss: 0.4339, test_loss: 1.4281, test_f1: 0.6097
##################ITERATION #5 ****************************************
 epoch: 0, train_loss: 1.2850, test_loss: 1.1802, test_f1: 0.4005
 epoch: 1, train_loss: 1.0407, test_loss: 1.0865, test_f1: 0.3925
 epoch: 2, train_loss: 0.9869, test_loss: 1.0747, test_f1: 0.4501
 epoch: 3, train_loss: 0.9483, test_loss: 1.0146, test_f1: 0.5174
 epoch: 4, train_loss: 0.9260, test_loss: 0.9812, test_f1: 0.5785
 epoch: 5, train_loss: 0.9108, test_loss: 0.9796, test_f1: 0.5672
 epoch: 6, train_loss: 0.8796, test_loss: 0.9699, test_f1: 0.5796
 epoch: 7, train_loss: 0.8546, test_loss: 1.0042, test_f1: 0.5367
 epoch: 8, train_loss: 0.8356, test_loss: 0.9642, test_f1: 0.5901
 epoch: 9, train_loss: 0.8185, test_loss: 0.9638, test_f1: 0.5102
 epoch: 10, train_loss: 0.7880, test_loss: 0.9820, test_f1: 0.5303
 epoch: 11, train_loss: 0.7937, test_loss: 0.9807, test_f1: 0.5459
 epoch: 12, train_loss: 0.7639, test_loss: 1.0477, test_f1: 0.5852
 epoch: 13, train_loss: 0.7855, test_loss: 1.0113, test_f1: 0.5087
 epoch: 14, train_loss: 0.7564, test_loss: 1.0276, test_f1: 0.5836
 epoch: 15, train_loss: 0.7478, test_loss: 1.0293, test_f1: 0.5157
 epoch: 16, train_loss: 0.7445, test_loss: 1.0439, test_f1: 0.5822
 epoch: 17, train_loss: 0.7334, test_loss: 1.0000, test_f1: 0.5587
 epoch: 18, train_loss: 0.6996, test_loss: 1.1309, test_f1: 0.5929
 epoch: 19, train_loss: 0.7055, test_loss: 1.1042, test_f1: 0.5701
 epoch: 20, train_loss: 0.6918, test_loss: 0.9741, test_f1: 0.6019
 epoch: 21, train_loss: 0.6827, test_loss: 1.0640, test_f1: 0.5607
 epoch: 22, train_loss: 0.7021, test_loss: 1.1911, test_f1: 0.6019
 epoch: 23, train_loss: 0.6928, test_loss: 0.9595, test_f1: 0.6365
 epoch: 24, train_loss: 0.6587, test_loss: 1.0618, test_f1: 0.6216
 epoch: 25, train_loss: 0.6908, test_loss: 1.2558, test_f1: 0.5859
 epoch: 26, train_loss: 0.6657, test_loss: 1.0981, test_f1: 0.5111
 epoch: 27, train_loss: 0.6591, test_loss: 1.0321, test_f1: 0.5999
 epoch: 28, train_loss: 0.6592, test_loss: 1.0758, test_f1: 0.5996
 epoch: 29, train_loss: 0.6345, test_loss: 1.0584, test_f1: 0.6223
 epoch: 30, train_loss: 0.6449, test_loss: 1.2280, test_f1: 0.6008
 epoch: 31, train_loss: 0.6540, test_loss: 1.4679, test_f1: 0.5515
 epoch: 32, train_loss: 0.6274, test_loss: 1.1432, test_f1: 0.5791
 epoch: 33, train_loss: 0.6567, test_loss: 1.1993, test_f1: 0.5705
 epoch: 34, train_loss: 0.6429, test_loss: 1.1523, test_f1: 0.5863
 epoch: 35, train_loss: 0.6380, test_loss: 1.2587, test_f1: 0.6089
 epoch: 36, train_loss: 0.6550, test_loss: 1.2318, test_f1: 0.6087
 epoch: 37, train_loss: 0.6185, test_loss: 1.1325, test_f1: 0.6821
 epoch: 38, train_loss: 0.6049, test_loss: 1.1140, test_f1: 0.6016
 epoch: 39, train_loss: 0.6206, test_loss: 1.1426, test_f1: 0.5901
 epoch: 40, train_loss: 0.5976, test_loss: 1.4830, test_f1: 0.5225
 epoch: 41, train_loss: 0.6255, test_loss: 1.0895, test_f1: 0.6151
 epoch: 42, train_loss: 0.6024, test_loss: 1.2372, test_f1: 0.6143
 epoch: 43, train_loss: 0.5741, test_loss: 1.1071, test_f1: 0.6381
 epoch: 44, train_loss: 0.5797, test_loss: 1.3224, test_f1: 0.5912
 epoch: 45, train_loss: 0.5945, test_loss: 1.1990, test_f1: 0.6157
 epoch: 46, train_loss: 0.5705, test_loss: 1.3309, test_f1: 0.5933
 epoch: 47, train_loss: 0.5923, test_loss: 1.1990, test_f1: 0.6102
 epoch: 48, train_loss: 0.5596, test_loss: 1.1320, test_f1: 0.6180
 epoch: 49, train_loss: 0.5619, test_loss: 1.2276, test_f1: 0.5995
 epoch: 50, train_loss: 0.5586, test_loss: 1.3804, test_f1: 0.6349
 epoch: 51, train_loss: 0.5507, test_loss: 1.2304, test_f1: 0.6238
 epoch: 52, train_loss: 0.5267, test_loss: 1.2804, test_f1: 0.5901
 epoch: 53, train_loss: 0.5155, test_loss: 1.3218, test_f1: 0.6246
 epoch: 54, train_loss: 0.5419, test_loss: 1.2711, test_f1: 0.6060
 epoch: 55, train_loss: 0.5037, test_loss: 1.2370, test_f1: 0.6355
 epoch: 56, train_loss: 0.5260, test_loss: 1.2067, test_f1: 0.6303
 epoch: 57, train_loss: 0.5104, test_loss: 1.2875, test_f1: 0.6136
 epoch: 58, train_loss: 0.4879, test_loss: 1.3519, test_f1: 0.6337
 epoch: 59, train_loss: 0.5059, test_loss: 1.4304, test_f1: 0.6290
 epoch: 60, train_loss: 0.5159, test_loss: 1.3421, test_f1: 0.5983
 epoch: 61, train_loss: 0.5028, test_loss: 1.3574, test_f1: 0.6064
 epoch: 62, train_loss: 0.4919, test_loss: 1.3331, test_f1: 0.6071
 epoch: 63, train_loss: 0.4907, test_loss: 1.5959, test_f1: 0.5593
 epoch: 64, train_loss: 0.4907, test_loss: 1.4736, test_f1: 0.6478
 epoch: 65, train_loss: 0.4801, test_loss: 1.2887, test_f1: 0.6337
 epoch: 66, train_loss: 0.4820, test_loss: 1.5918, test_f1: 0.6327
 epoch: 67, train_loss: 0.4865, test_loss: 1.4238, test_f1: 0.6230
 epoch: 68, train_loss: 0.4663, test_loss: 1.4989, test_f1: 0.6196
 epoch: 69, train_loss: 0.4727, test_loss: 1.4521, test_f1: 0.6135
 epoch: 70, train_loss: 0.4357, test_loss: 1.2762, test_f1: 0.6398
 epoch: 71, train_loss: 0.4853, test_loss: 1.5330, test_f1: 0.6414
 epoch: 72, train_loss: 0.4675, test_loss: 1.5581, test_f1: 0.5946
 epoch: 73, train_loss: 0.4622, test_loss: 1.6624, test_f1: 0.6149
 epoch: 74, train_loss: 0.4595, test_loss: 1.4205, test_f1: 0.6203
 epoch: 75, train_loss: 0.4658, test_loss: 1.4889, test_f1: 0.6127
 epoch: 76, train_loss: 0.4799, test_loss: 1.5338, test_f1: 0.6529
 epoch: 77, train_loss: 0.4509, test_loss: 1.4306, test_f1: 0.6267
 epoch: 78, train_loss: 0.4447, test_loss: 1.5875, test_f1: 0.5919
 epoch: 79, train_loss: 0.4452, test_loss: 1.5570, test_f1: 0.6392
 epoch: 80, train_loss: 0.4568, test_loss: 1.5449, test_f1: 0.5990
 epoch: 81, train_loss: 0.4519, test_loss: 1.5741, test_f1: 0.6152
 epoch: 82, train_loss: 0.4298, test_loss: 1.5461, test_f1: 0.6086
 epoch: 83, train_loss: 0.4342, test_loss: 1.5308, test_f1: 0.6063
 epoch: 84, train_loss: 0.4306, test_loss: 1.5947, test_f1: 0.6062
 epoch: 85, train_loss: 0.4263, test_loss: 1.6904, test_f1: 0.6291
 epoch: 86, train_loss: 0.4296, test_loss: 1.4945, test_f1: 0.6113
 epoch: 87, train_loss: 0.4102, test_loss: 1.4726, test_f1: 0.6418
 epoch: 88, train_loss: 0.4382, test_loss: 1.6522, test_f1: 0.6426
 epoch: 89, train_loss: 0.4526, test_loss: 1.6053, test_f1: 0.6395
 epoch: 90, train_loss: 0.4124, test_loss: 1.6853, test_f1: 0.6240
 epoch: 91, train_loss: 0.4238, test_loss: 1.6158, test_f1: 0.6341
 epoch: 92, train_loss: 0.4300, test_loss: 1.7061, test_f1: 0.6096
 epoch: 93, train_loss: 0.4234, test_loss: 1.6979, test_f1: 0.6192
 epoch: 94, train_loss: 0.4096, test_loss: 1.7868, test_f1: 0.6140
 epoch: 95, train_loss: 0.3949, test_loss: 1.6801, test_f1: 0.6227
 epoch: 96, train_loss: 0.3981, test_loss: 1.6506, test_f1: 0.5946
 epoch: 97, train_loss: 0.4127, test_loss: 1.7775, test_f1: 0.6506
 epoch: 98, train_loss: 0.3876, test_loss: 1.6778, test_f1: 0.6566
 epoch: 99, train_loss: 0.3821, test_loss: 1.9138, test_f1: 0.6113
##################ITERATION #6 ****************************************
 epoch: 0, train_loss: 1.2920, test_loss: 1.2812, test_f1: 0.4581
 epoch: 1, train_loss: 1.0349, test_loss: 1.1497, test_f1: 0.5286
 epoch: 2, train_loss: 0.9922, test_loss: 1.1270, test_f1: 0.5329
 epoch: 3, train_loss: 0.9468, test_loss: 1.0803, test_f1: 0.5065
 epoch: 4, train_loss: 0.9162, test_loss: 1.1038, test_f1: 0.5659
 epoch: 5, train_loss: 0.9134, test_loss: 1.0513, test_f1: 0.5132
 epoch: 6, train_loss: 0.8685, test_loss: 1.0496, test_f1: 0.5500
 epoch: 7, train_loss: 0.8766, test_loss: 1.0729, test_f1: 0.5903
 epoch: 8, train_loss: 0.8457, test_loss: 1.0433, test_f1: 0.5704
 epoch: 9, train_loss: 0.8203, test_loss: 1.0896, test_f1: 0.5863
 epoch: 10, train_loss: 0.8317, test_loss: 0.9657, test_f1: 0.5833
 epoch: 11, train_loss: 0.8305, test_loss: 1.0012, test_f1: 0.5826
 epoch: 12, train_loss: 0.7951, test_loss: 1.0223, test_f1: 0.5782
 epoch: 13, train_loss: 0.7808, test_loss: 0.9362, test_f1: 0.6293
 epoch: 14, train_loss: 0.7806, test_loss: 0.9939, test_f1: 0.6285
 epoch: 15, train_loss: 0.7927, test_loss: 0.9642, test_f1: 0.6244
 epoch: 16, train_loss: 0.7708, test_loss: 0.9523, test_f1: 0.5696
 epoch: 17, train_loss: 0.7370, test_loss: 0.9495, test_f1: 0.5802
 epoch: 18, train_loss: 0.7454, test_loss: 0.9500, test_f1: 0.5934
 epoch: 19, train_loss: 0.7407, test_loss: 0.9575, test_f1: 0.5890
 epoch: 20, train_loss: 0.7332, test_loss: 1.0032, test_f1: 0.6073
 epoch: 21, train_loss: 0.7255, test_loss: 0.9701, test_f1: 0.5622
 epoch: 22, train_loss: 0.7266, test_loss: 0.9559, test_f1: 0.5851
 epoch: 23, train_loss: 0.7198, test_loss: 0.9681, test_f1: 0.6134
 epoch: 24, train_loss: 0.7073, test_loss: 0.9306, test_f1: 0.6191
 epoch: 25, train_loss: 0.7068, test_loss: 1.0146, test_f1: 0.5900
 epoch: 26, train_loss: 0.7043, test_loss: 0.9660, test_f1: 0.6000
 epoch: 27, train_loss: 0.6743, test_loss: 0.9951, test_f1: 0.5856
 epoch: 28, train_loss: 0.6798, test_loss: 1.0025, test_f1: 0.5835
 epoch: 29, train_loss: 0.6651, test_loss: 1.0450, test_f1: 0.5797
 epoch: 30, train_loss: 0.6859, test_loss: 0.9937, test_f1: 0.5922
 epoch: 31, train_loss: 0.6623, test_loss: 1.0035, test_f1: 0.5862
 epoch: 32, train_loss: 0.6532, test_loss: 1.1341, test_f1: 0.5481
 epoch: 33, train_loss: 0.6638, test_loss: 1.0609, test_f1: 0.5689
 epoch: 34, train_loss: 0.6451, test_loss: 0.9397, test_f1: 0.5955
 epoch: 35, train_loss: 0.6525, test_loss: 1.0166, test_f1: 0.5971
 epoch: 36, train_loss: 0.6268, test_loss: 1.0024, test_f1: 0.6062
 epoch: 37, train_loss: 0.6567, test_loss: 1.0644, test_f1: 0.5916
 epoch: 38, train_loss: 0.6524, test_loss: 0.9763, test_f1: 0.6150
 epoch: 39, train_loss: 0.6356, test_loss: 0.9377, test_f1: 0.6168
 epoch: 40, train_loss: 0.6240, test_loss: 1.0562, test_f1: 0.5884
 epoch: 41, train_loss: 0.6078, test_loss: 1.0299, test_f1: 0.5842
 epoch: 42, train_loss: 0.5976, test_loss: 0.9362, test_f1: 0.6087
 epoch: 43, train_loss: 0.6105, test_loss: 1.0359, test_f1: 0.5832
 epoch: 44, train_loss: 0.6031, test_loss: 1.0516, test_f1: 0.6128
 epoch: 45, train_loss: 0.5778, test_loss: 0.9870, test_f1: 0.5835
 epoch: 46, train_loss: 0.5958, test_loss: 1.0952, test_f1: 0.5775
 epoch: 47, train_loss: 0.5876, test_loss: 1.0188, test_f1: 0.6013
 epoch: 48, train_loss: 0.5766, test_loss: 1.0006, test_f1: 0.6393
 epoch: 49, train_loss: 0.5531, test_loss: 1.0064, test_f1: 0.6661
 epoch: 50, train_loss: 0.5782, test_loss: 1.0785, test_f1: 0.5962
 epoch: 51, train_loss: 0.5539, test_loss: 1.1320, test_f1: 0.5943
 epoch: 52, train_loss: 0.5587, test_loss: 1.0392, test_f1: 0.6010
 epoch: 53, train_loss: 0.5437, test_loss: 1.1554, test_f1: 0.5788
 epoch: 54, train_loss: 0.5192, test_loss: 1.1745, test_f1: 0.5861
 epoch: 55, train_loss: 0.5393, test_loss: 1.1257, test_f1: 0.6136
 epoch: 56, train_loss: 0.5218, test_loss: 1.1836, test_f1: 0.5828
 epoch: 57, train_loss: 0.5167, test_loss: 1.1165, test_f1: 0.6000
 epoch: 58, train_loss: 0.5078, test_loss: 1.1346, test_f1: 0.5854
 epoch: 59, train_loss: 0.5060, test_loss: 1.2604, test_f1: 0.5778
 epoch: 60, train_loss: 0.5356, test_loss: 1.0640, test_f1: 0.6074
 epoch: 61, train_loss: 0.5187, test_loss: 1.1573, test_f1: 0.6015
 epoch: 62, train_loss: 0.4953, test_loss: 1.1709, test_f1: 0.6100
 epoch: 63, train_loss: 0.5039, test_loss: 1.0792, test_f1: 0.6454
 epoch: 64, train_loss: 0.4930, test_loss: 1.1731, test_f1: 0.6025
 epoch: 65, train_loss: 0.4804, test_loss: 1.2624, test_f1: 0.5891
 epoch: 66, train_loss: 0.4744, test_loss: 1.1872, test_f1: 0.6018
 epoch: 67, train_loss: 0.5020, test_loss: 1.3500, test_f1: 0.5796
 epoch: 68, train_loss: 0.4713, test_loss: 1.3196, test_f1: 0.5877
 epoch: 69, train_loss: 0.4794, test_loss: 1.1938, test_f1: 0.5964
 epoch: 70, train_loss: 0.4885, test_loss: 1.1480, test_f1: 0.6183
 epoch: 71, train_loss: 0.4764, test_loss: 1.2331, test_f1: 0.6047
 epoch: 72, train_loss: 0.4774, test_loss: 1.2239, test_f1: 0.6175
 epoch: 73, train_loss: 0.4810, test_loss: 1.2102, test_f1: 0.6319
 epoch: 74, train_loss: 0.4521, test_loss: 1.3237, test_f1: 0.6201
 epoch: 75, train_loss: 0.4785, test_loss: 1.2359, test_f1: 0.6070
 epoch: 76, train_loss: 0.4592, test_loss: 1.2149, test_f1: 0.6068
 epoch: 77, train_loss: 0.4602, test_loss: 1.3614, test_f1: 0.5773
 epoch: 78, train_loss: 0.4631, test_loss: 1.1768, test_f1: 0.6347
 epoch: 79, train_loss: 0.4607, test_loss: 1.1736, test_f1: 0.6419
 epoch: 80, train_loss: 0.4824, test_loss: 1.1236, test_f1: 0.6763
 epoch: 81, train_loss: 0.4548, test_loss: 1.2255, test_f1: 0.6202
 epoch: 82, train_loss: 0.4346, test_loss: 1.2473, test_f1: 0.6312
 epoch: 83, train_loss: 0.4619, test_loss: 1.2717, test_f1: 0.6311
 epoch: 84, train_loss: 0.4366, test_loss: 1.4503, test_f1: 0.6150
 epoch: 85, train_loss: 0.4542, test_loss: 1.2513, test_f1: 0.6194
 epoch: 86, train_loss: 0.4532, test_loss: 1.3500, test_f1: 0.6049
 epoch: 87, train_loss: 0.4575, test_loss: 1.1211, test_f1: 0.6504
 epoch: 88, train_loss: 0.4455, test_loss: 1.3246, test_f1: 0.6274
 epoch: 89, train_loss: 0.4376, test_loss: 1.2104, test_f1: 0.6331
 epoch: 90, train_loss: 0.4296, test_loss: 1.4257, test_f1: 0.5929
 epoch: 91, train_loss: 0.4328, test_loss: 1.2128, test_f1: 0.6452
 epoch: 92, train_loss: 0.4017, test_loss: 1.2934, test_f1: 0.6198
 epoch: 93, train_loss: 0.4378, test_loss: 1.2586, test_f1: 0.6711
 epoch: 94, train_loss: 0.4264, test_loss: 1.2225, test_f1: 0.6571
 epoch: 95, train_loss: 0.4151, test_loss: 1.4463, test_f1: 0.6098
 epoch: 96, train_loss: 0.4235, test_loss: 1.2388, test_f1: 0.6328
 epoch: 97, train_loss: 0.3950, test_loss: 1.2732, test_f1: 0.6471
 epoch: 98, train_loss: 0.4281, test_loss: 1.3223, test_f1: 0.6376
 epoch: 99, train_loss: 0.4289, test_loss: 1.2857, test_f1: 0.6354
##################ITERATION #7 ****************************************
 epoch: 0, train_loss: 1.5209, test_loss: 1.2682, test_f1: 0.3199
 epoch: 1, train_loss: 1.1082, test_loss: 1.1084, test_f1: 0.4914
 epoch: 2, train_loss: 1.0224, test_loss: 1.0890, test_f1: 0.4756
 epoch: 3, train_loss: 0.9826, test_loss: 1.0522, test_f1: 0.5227
 epoch: 4, train_loss: 0.9517, test_loss: 1.0367, test_f1: 0.5624
 epoch: 5, train_loss: 0.9375, test_loss: 1.0344, test_f1: 0.5561
 epoch: 6, train_loss: 0.8896, test_loss: 1.0029, test_f1: 0.6006
 epoch: 7, train_loss: 0.8675, test_loss: 1.0217, test_f1: 0.5635
 epoch: 8, train_loss: 0.8513, test_loss: 0.9729, test_f1: 0.6241
 epoch: 9, train_loss: 0.8547, test_loss: 1.0335, test_f1: 0.5534
 epoch: 10, train_loss: 0.8210, test_loss: 1.0949, test_f1: 0.5012
 epoch: 11, train_loss: 0.8272, test_loss: 1.0048, test_f1: 0.5387
 epoch: 12, train_loss: 0.8053, test_loss: 1.0299, test_f1: 0.5587
 epoch: 13, train_loss: 0.8050, test_loss: 1.0571, test_f1: 0.5572
 epoch: 14, train_loss: 0.7809, test_loss: 1.0310, test_f1: 0.6003
 epoch: 15, train_loss: 0.7713, test_loss: 1.0796, test_f1: 0.5725
 epoch: 16, train_loss: 0.7688, test_loss: 1.0728, test_f1: 0.5871
 epoch: 17, train_loss: 0.7364, test_loss: 1.1596, test_f1: 0.5804
 epoch: 18, train_loss: 0.7483, test_loss: 1.1316, test_f1: 0.5955
 epoch: 19, train_loss: 0.7253, test_loss: 1.2531, test_f1: 0.5614
 epoch: 20, train_loss: 0.7256, test_loss: 1.1417, test_f1: 0.5721
 epoch: 21, train_loss: 0.7061, test_loss: 1.1522, test_f1: 0.5933
 epoch: 22, train_loss: 0.7024, test_loss: 1.2024, test_f1: 0.5541
 epoch: 23, train_loss: 0.6885, test_loss: 1.1946, test_f1: 0.5675
 epoch: 24, train_loss: 0.6824, test_loss: 1.1460, test_f1: 0.6006
 epoch: 25, train_loss: 0.6746, test_loss: 1.1399, test_f1: 0.5799
 epoch: 26, train_loss: 0.6914, test_loss: 1.1906, test_f1: 0.5672
 epoch: 27, train_loss: 0.6576, test_loss: 1.0704, test_f1: 0.6064
 epoch: 28, train_loss: 0.6495, test_loss: 1.0822, test_f1: 0.5737
 epoch: 29, train_loss: 0.6479, test_loss: 1.1459, test_f1: 0.6043
 epoch: 30, train_loss: 0.6394, test_loss: 1.1292, test_f1: 0.5663
 epoch: 31, train_loss: 0.6623, test_loss: 1.0645, test_f1: 0.6077
 epoch: 32, train_loss: 0.6301, test_loss: 1.0729, test_f1: 0.5826
 epoch: 33, train_loss: 0.6037, test_loss: 1.1718, test_f1: 0.6012
 epoch: 34, train_loss: 0.6361, test_loss: 1.1118, test_f1: 0.6495
 epoch: 35, train_loss: 0.6189, test_loss: 1.2100, test_f1: 0.6123
 epoch: 36, train_loss: 0.5988, test_loss: 1.1354, test_f1: 0.5869
 epoch: 37, train_loss: 0.5836, test_loss: 1.1188, test_f1: 0.5839
 epoch: 38, train_loss: 0.5950, test_loss: 1.1620, test_f1: 0.6027
 epoch: 39, train_loss: 0.5882, test_loss: 1.2000, test_f1: 0.5948
 epoch: 40, train_loss: 0.5897, test_loss: 1.2705, test_f1: 0.5907
 epoch: 41, train_loss: 0.5685, test_loss: 1.2546, test_f1: 0.5981
 epoch: 42, train_loss: 0.5685, test_loss: 1.2077, test_f1: 0.6151
 epoch: 43, train_loss: 0.5529, test_loss: 1.3135, test_f1: 0.6161
 epoch: 44, train_loss: 0.5597, test_loss: 1.3479, test_f1: 0.5570
 epoch: 45, train_loss: 0.5458, test_loss: 1.4678, test_f1: 0.5807
 epoch: 46, train_loss: 0.5523, test_loss: 1.4892, test_f1: 0.5926
 epoch: 47, train_loss: 0.5587, test_loss: 1.2885, test_f1: 0.6051
 epoch: 48, train_loss: 0.5444, test_loss: 1.3189, test_f1: 0.5453
 epoch: 49, train_loss: 0.5454, test_loss: 1.5050, test_f1: 0.5912
 epoch: 50, train_loss: 0.5183, test_loss: 1.2920, test_f1: 0.5758
 epoch: 51, train_loss: 0.5000, test_loss: 1.3942, test_f1: 0.5983
 epoch: 52, train_loss: 0.4850, test_loss: 1.3277, test_f1: 0.6003
 epoch: 53, train_loss: 0.4751, test_loss: 1.3628, test_f1: 0.5965
 epoch: 54, train_loss: 0.4875, test_loss: 1.3388, test_f1: 0.5959
 epoch: 55, train_loss: 0.4786, test_loss: 1.2285, test_f1: 0.6111
 epoch: 56, train_loss: 0.4673, test_loss: 1.4644, test_f1: 0.5935
 epoch: 57, train_loss: 0.4718, test_loss: 1.4835, test_f1: 0.5929
 epoch: 58, train_loss: 0.4727, test_loss: 1.3475, test_f1: 0.6135
 epoch: 59, train_loss: 0.4540, test_loss: 1.4353, test_f1: 0.6331
 epoch: 60, train_loss: 0.4590, test_loss: 1.3463, test_f1: 0.6266
 epoch: 61, train_loss: 0.4655, test_loss: 1.3620, test_f1: 0.6252
 epoch: 62, train_loss: 0.4584, test_loss: 1.6333, test_f1: 0.5733
 epoch: 63, train_loss: 0.4550, test_loss: 1.4209, test_f1: 0.6094
 epoch: 64, train_loss: 0.4471, test_loss: 1.6546, test_f1: 0.5997
 epoch: 65, train_loss: 0.4524, test_loss: 1.4669, test_f1: 0.6317
 epoch: 66, train_loss: 0.4438, test_loss: 1.5649, test_f1: 0.5942
 epoch: 67, train_loss: 0.4562, test_loss: 1.4930, test_f1: 0.6002
 epoch: 68, train_loss: 0.4396, test_loss: 1.5183, test_f1: 0.5874
 epoch: 69, train_loss: 0.4228, test_loss: 1.5490, test_f1: 0.6037
 epoch: 70, train_loss: 0.4473, test_loss: 1.4049, test_f1: 0.6431
 epoch: 71, train_loss: 0.4525, test_loss: 1.4974, test_f1: 0.6049
 epoch: 72, train_loss: 0.4282, test_loss: 1.5124, test_f1: 0.6406
 epoch: 73, train_loss: 0.4263, test_loss: 1.5534, test_f1: 0.6213
 epoch: 74, train_loss: 0.3968, test_loss: 1.5831, test_f1: 0.6075
 epoch: 75, train_loss: 0.4124, test_loss: 1.5357, test_f1: 0.5874
 epoch: 76, train_loss: 0.4281, test_loss: 1.5702, test_f1: 0.6248
 epoch: 77, train_loss: 0.4232, test_loss: 1.8440, test_f1: 0.6103
 epoch: 78, train_loss: 0.4293, test_loss: 1.5971, test_f1: 0.5932
 epoch: 79, train_loss: 0.4047, test_loss: 1.6030, test_f1: 0.5969
 epoch: 80, train_loss: 0.4006, test_loss: 1.5643, test_f1: 0.6128
 epoch: 81, train_loss: 0.4148, test_loss: 1.5462, test_f1: 0.6026
 epoch: 82, train_loss: 0.3915, test_loss: 1.6733, test_f1: 0.5816
 epoch: 83, train_loss: 0.4177, test_loss: 1.6626, test_f1: 0.5902
 epoch: 84, train_loss: 0.3901, test_loss: 1.5057, test_f1: 0.6127
 epoch: 85, train_loss: 0.3986, test_loss: 1.6627, test_f1: 0.6072
 epoch: 86, train_loss: 0.3812, test_loss: 1.6054, test_f1: 0.5970
 epoch: 87, train_loss: 0.3993, test_loss: 1.8056, test_f1: 0.6038
 epoch: 88, train_loss: 0.3941, test_loss: 1.8503, test_f1: 0.5888
 epoch: 89, train_loss: 0.4142, test_loss: 1.7610, test_f1: 0.5974
 epoch: 90, train_loss: 0.3627, test_loss: 1.8812, test_f1: 0.5886
 epoch: 91, train_loss: 0.3827, test_loss: 1.7263, test_f1: 0.6090
 epoch: 92, train_loss: 0.3720, test_loss: 1.9160, test_f1: 0.6098
 epoch: 93, train_loss: 0.3580, test_loss: 1.7260, test_f1: 0.6075
 epoch: 94, train_loss: 0.3792, test_loss: 1.8603, test_f1: 0.5970
 epoch: 95, train_loss: 0.3794, test_loss: 1.8726, test_f1: 0.5879
 epoch: 96, train_loss: 0.3748, test_loss: 1.7943, test_f1: 0.6177
 epoch: 97, train_loss: 0.4152, test_loss: 2.0710, test_f1: 0.5898
 epoch: 98, train_loss: 0.3855, test_loss: 1.7445, test_f1: 0.6161
 epoch: 99, train_loss: 0.3732, test_loss: 1.5787, test_f1: 0.6235
##################ITERATION #8 ****************************************
 epoch: 0, train_loss: 1.3264, test_loss: 1.2486, test_f1: 0.3183
 epoch: 1, train_loss: 1.0846, test_loss: 1.0784, test_f1: 0.4885
 epoch: 2, train_loss: 1.0181, test_loss: 1.0562, test_f1: 0.5315
 epoch: 3, train_loss: 0.9796, test_loss: 1.0559, test_f1: 0.5391
 epoch: 4, train_loss: 0.9632, test_loss: 1.0649, test_f1: 0.5557
 epoch: 5, train_loss: 0.9429, test_loss: 0.9901, test_f1: 0.5751
 epoch: 6, train_loss: 0.8972, test_loss: 1.0286, test_f1: 0.5677
 epoch: 7, train_loss: 0.8642, test_loss: 1.0186, test_f1: 0.5702
 epoch: 8, train_loss: 0.8774, test_loss: 1.0460, test_f1: 0.5536
 epoch: 9, train_loss: 0.8282, test_loss: 1.0256, test_f1: 0.5877
 epoch: 10, train_loss: 0.8218, test_loss: 1.0408, test_f1: 0.5556
 epoch: 11, train_loss: 0.8340, test_loss: 0.9949, test_f1: 0.5813
 epoch: 12, train_loss: 0.8059, test_loss: 0.9781, test_f1: 0.5647
 epoch: 13, train_loss: 0.7966, test_loss: 1.0136, test_f1: 0.5954
 epoch: 14, train_loss: 0.7897, test_loss: 1.0214, test_f1: 0.5930
 epoch: 15, train_loss: 0.7728, test_loss: 0.9813, test_f1: 0.5742
 epoch: 16, train_loss: 0.7725, test_loss: 1.2179, test_f1: 0.5153
 epoch: 17, train_loss: 0.7449, test_loss: 1.2253, test_f1: 0.5095
 epoch: 18, train_loss: 0.7554, test_loss: 1.0984, test_f1: 0.5246
 epoch: 19, train_loss: 0.7336, test_loss: 1.0120, test_f1: 0.5964
 epoch: 20, train_loss: 0.7367, test_loss: 1.0966, test_f1: 0.5709
 epoch: 21, train_loss: 0.7322, test_loss: 1.0803, test_f1: 0.5771
 epoch: 22, train_loss: 0.7187, test_loss: 1.0210, test_f1: 0.5803
 epoch: 23, train_loss: 0.6962, test_loss: 1.1250, test_f1: 0.5670
 epoch: 24, train_loss: 0.7046, test_loss: 1.1154, test_f1: 0.5703
 epoch: 25, train_loss: 0.6916, test_loss: 1.1111, test_f1: 0.5481
 epoch: 26, train_loss: 0.6719, test_loss: 1.0952, test_f1: 0.5531
 epoch: 27, train_loss: 0.6984, test_loss: 1.0504, test_f1: 0.5998
 epoch: 28, train_loss: 0.6908, test_loss: 1.0610, test_f1: 0.5276
 epoch: 29, train_loss: 0.6825, test_loss: 1.0984, test_f1: 0.5881
 epoch: 30, train_loss: 0.6560, test_loss: 1.1136, test_f1: 0.5694
 epoch: 31, train_loss: 0.6644, test_loss: 1.1083, test_f1: 0.5394
 epoch: 32, train_loss: 0.6599, test_loss: 1.0873, test_f1: 0.5411
 epoch: 33, train_loss: 0.6678, test_loss: 1.0769, test_f1: 0.5892
 epoch: 34, train_loss: 0.6437, test_loss: 1.1262, test_f1: 0.5564
 epoch: 35, train_loss: 0.6413, test_loss: 1.0326, test_f1: 0.5990
 epoch: 36, train_loss: 0.6348, test_loss: 1.1379, test_f1: 0.5550
 epoch: 37, train_loss: 0.6237, test_loss: 1.0802, test_f1: 0.6121
 epoch: 38, train_loss: 0.6330, test_loss: 1.2214, test_f1: 0.5706
 epoch: 39, train_loss: 0.6120, test_loss: 1.1427, test_f1: 0.5763
 epoch: 40, train_loss: 0.5954, test_loss: 1.0384, test_f1: 0.6288
 epoch: 41, train_loss: 0.6098, test_loss: 1.1202, test_f1: 0.5925
 epoch: 42, train_loss: 0.5933, test_loss: 1.1168, test_f1: 0.6102
 epoch: 43, train_loss: 0.5974, test_loss: 1.2707, test_f1: 0.5559
 epoch: 44, train_loss: 0.5836, test_loss: 1.1471, test_f1: 0.5427
 epoch: 45, train_loss: 0.6033, test_loss: 1.2432, test_f1: 0.5454
 epoch: 46, train_loss: 0.5779, test_loss: 1.1600, test_f1: 0.5726
 epoch: 47, train_loss: 0.5698, test_loss: 1.1956, test_f1: 0.5848
 epoch: 48, train_loss: 0.5643, test_loss: 1.1321, test_f1: 0.6187
 epoch: 49, train_loss: 0.5751, test_loss: 1.3653, test_f1: 0.5418
 epoch: 50, train_loss: 0.5845, test_loss: 1.2537, test_f1: 0.5885
 epoch: 51, train_loss: 0.5631, test_loss: 1.1483, test_f1: 0.5785
 epoch: 52, train_loss: 0.5381, test_loss: 1.1821, test_f1: 0.6143
 epoch: 53, train_loss: 0.5282, test_loss: 1.2048, test_f1: 0.6023
 epoch: 54, train_loss: 0.5223, test_loss: 1.3304, test_f1: 0.5923
 epoch: 55, train_loss: 0.5014, test_loss: 1.2297, test_f1: 0.6208
 epoch: 56, train_loss: 0.5168, test_loss: 1.2342, test_f1: 0.6059
 epoch: 57, train_loss: 0.4872, test_loss: 1.2560, test_f1: 0.6079
 epoch: 58, train_loss: 0.4892, test_loss: 1.2859, test_f1: 0.6054
 epoch: 59, train_loss: 0.5117, test_loss: 1.3105, test_f1: 0.5869
 epoch: 60, train_loss: 0.5040, test_loss: 1.2651, test_f1: 0.6043
 epoch: 61, train_loss: 0.4997, test_loss: 1.2778, test_f1: 0.5668
 epoch: 62, train_loss: 0.4927, test_loss: 1.4028, test_f1: 0.5760
 epoch: 63, train_loss: 0.5092, test_loss: 1.4823, test_f1: 0.5411
 epoch: 64, train_loss: 0.5005, test_loss: 1.4137, test_f1: 0.5646
 epoch: 65, train_loss: 0.4973, test_loss: 1.4041, test_f1: 0.5919
 epoch: 66, train_loss: 0.4823, test_loss: 1.3725, test_f1: 0.5674
 epoch: 67, train_loss: 0.4903, test_loss: 1.3555, test_f1: 0.5846
 epoch: 68, train_loss: 0.4925, test_loss: 1.3989, test_f1: 0.5887
 epoch: 69, train_loss: 0.4787, test_loss: 1.3656, test_f1: 0.5831
 epoch: 70, train_loss: 0.4822, test_loss: 1.4609, test_f1: 0.5718
 epoch: 71, train_loss: 0.4464, test_loss: 1.3882, test_f1: 0.5664
 epoch: 72, train_loss: 0.4839, test_loss: 1.5621, test_f1: 0.5744
 epoch: 73, train_loss: 0.4667, test_loss: 1.4191, test_f1: 0.5517
 epoch: 74, train_loss: 0.4633, test_loss: 1.4807, test_f1: 0.5690
 epoch: 75, train_loss: 0.4617, test_loss: 1.4500, test_f1: 0.5456
 epoch: 76, train_loss: 0.4535, test_loss: 1.4052, test_f1: 0.5752
 epoch: 77, train_loss: 0.4487, test_loss: 1.4952, test_f1: 0.5606
 epoch: 78, train_loss: 0.4416, test_loss: 1.6043, test_f1: 0.5599
 epoch: 79, train_loss: 0.4596, test_loss: 1.6262, test_f1: 0.5393
 epoch: 80, train_loss: 0.4686, test_loss: 1.3988, test_f1: 0.5893
 epoch: 81, train_loss: 0.4538, test_loss: 1.5050, test_f1: 0.5513
 epoch: 82, train_loss: 0.4372, test_loss: 1.6120, test_f1: 0.5804
 epoch: 83, train_loss: 0.4423, test_loss: 1.4920, test_f1: 0.5663
 epoch: 84, train_loss: 0.4102, test_loss: 1.5038, test_f1: 0.5776
 epoch: 85, train_loss: 0.4126, test_loss: 1.4959, test_f1: 0.5695
 epoch: 86, train_loss: 0.4624, test_loss: 1.4342, test_f1: 0.6214
 epoch: 87, train_loss: 0.4335, test_loss: 1.5845, test_f1: 0.5678
 epoch: 88, train_loss: 0.4414, test_loss: 1.5684, test_f1: 0.5665
 epoch: 89, train_loss: 0.4251, test_loss: 1.6660, test_f1: 0.5611
 epoch: 90, train_loss: 0.4052, test_loss: 1.5557, test_f1: 0.5940
 epoch: 91, train_loss: 0.4166, test_loss: 1.4539, test_f1: 0.5710
 epoch: 92, train_loss: 0.3955, test_loss: 1.5471, test_f1: 0.6124
 epoch: 93, train_loss: 0.4505, test_loss: 1.4249, test_f1: 0.6026
 epoch: 94, train_loss: 0.4369, test_loss: 1.6618, test_f1: 0.5613
 epoch: 95, train_loss: 0.4100, test_loss: 1.5175, test_f1: 0.5955
 epoch: 96, train_loss: 0.4169, test_loss: 1.6469, test_f1: 0.5408
 epoch: 97, train_loss: 0.4336, test_loss: 1.8846, test_f1: 0.5733
 epoch: 98, train_loss: 0.4457, test_loss: 1.4245, test_f1: 0.5854
 epoch: 99, train_loss: 0.4276, test_loss: 1.6423, test_f1: 0.6132
##################ITERATION #9 ****************************************
 epoch: 0, train_loss: 1.7077, test_loss: 1.2540, test_f1: 0.3619
 epoch: 1, train_loss: 1.0821, test_loss: 1.1310, test_f1: 0.4981
 epoch: 2, train_loss: 1.0288, test_loss: 1.1119, test_f1: 0.5139
 epoch: 3, train_loss: 0.9541, test_loss: 1.1313, test_f1: 0.4577
 epoch: 4, train_loss: 0.9298, test_loss: 1.0791, test_f1: 0.4967
 epoch: 5, train_loss: 0.8864, test_loss: 1.0444, test_f1: 0.5455
 epoch: 6, train_loss: 0.8657, test_loss: 1.0688, test_f1: 0.5816
 epoch: 7, train_loss: 0.8508, test_loss: 1.0735, test_f1: 0.5405
 epoch: 8, train_loss: 0.8354, test_loss: 1.0057, test_f1: 0.5475
 epoch: 9, train_loss: 0.8307, test_loss: 1.0283, test_f1: 0.5750
 epoch: 10, train_loss: 0.7963, test_loss: 1.0789, test_f1: 0.5686
 epoch: 11, train_loss: 0.7840, test_loss: 0.9904, test_f1: 0.6102
 epoch: 12, train_loss: 0.7835, test_loss: 1.0069, test_f1: 0.5767
 epoch: 13, train_loss: 0.7560, test_loss: 0.9815, test_f1: 0.5850
 epoch: 14, train_loss: 0.7551, test_loss: 1.0341, test_f1: 0.5178
 epoch: 15, train_loss: 0.7322, test_loss: 1.0076, test_f1: 0.6017
 epoch: 16, train_loss: 0.7385, test_loss: 1.0029, test_f1: 0.5685
 epoch: 17, train_loss: 0.7363, test_loss: 1.0000, test_f1: 0.5986
 epoch: 18, train_loss: 0.7223, test_loss: 0.9869, test_f1: 0.5857
 epoch: 19, train_loss: 0.7094, test_loss: 1.0320, test_f1: 0.5744
 epoch: 20, train_loss: 0.6929, test_loss: 1.0121, test_f1: 0.5668
 epoch: 21, train_loss: 0.7060, test_loss: 1.0673, test_f1: 0.5360
 epoch: 22, train_loss: 0.7031, test_loss: 1.0395, test_f1: 0.6113
 epoch: 23, train_loss: 0.6746, test_loss: 1.1235, test_f1: 0.5300
 epoch: 24, train_loss: 0.6399, test_loss: 1.0333, test_f1: 0.5698
 epoch: 25, train_loss: 0.6717, test_loss: 1.1438, test_f1: 0.5708
 epoch: 26, train_loss: 0.6717, test_loss: 1.0625, test_f1: 0.5438
 epoch: 27, train_loss: 0.6569, test_loss: 1.0030, test_f1: 0.5752
 epoch: 28, train_loss: 0.6753, test_loss: 1.0002, test_f1: 0.5839
 epoch: 29, train_loss: 0.6574, test_loss: 1.0312, test_f1: 0.6192
 epoch: 30, train_loss: 0.6638, test_loss: 1.0439, test_f1: 0.5531
 epoch: 31, train_loss: 0.6552, test_loss: 1.0332, test_f1: 0.5776
 epoch: 32, train_loss: 0.6336, test_loss: 1.0682, test_f1: 0.5698
 epoch: 33, train_loss: 0.6391, test_loss: 1.0359, test_f1: 0.5615
 epoch: 34, train_loss: 0.6401, test_loss: 1.0087, test_f1: 0.5811
 epoch: 35, train_loss: 0.6339, test_loss: 1.0181, test_f1: 0.5834
 epoch: 36, train_loss: 0.6309, test_loss: 1.0491, test_f1: 0.5793
 epoch: 37, train_loss: 0.6191, test_loss: 1.0672, test_f1: 0.5888
 epoch: 38, train_loss: 0.5873, test_loss: 1.0501, test_f1: 0.6076
 epoch: 39, train_loss: 0.5967, test_loss: 1.0435, test_f1: 0.5638
 epoch: 40, train_loss: 0.6017, test_loss: 1.0113, test_f1: 0.5912
 epoch: 41, train_loss: 0.5946, test_loss: 1.0723, test_f1: 0.5865
 epoch: 42, train_loss: 0.5971, test_loss: 1.0187, test_f1: 0.5697
 epoch: 43, train_loss: 0.5843, test_loss: 1.1101, test_f1: 0.5413
 epoch: 44, train_loss: 0.5730, test_loss: 1.1796, test_f1: 0.5516
 epoch: 45, train_loss: 0.5861, test_loss: 1.1793, test_f1: 0.5776
 epoch: 46, train_loss: 0.5544, test_loss: 1.2269, test_f1: 0.5489
 epoch: 47, train_loss: 0.5752, test_loss: 1.1787, test_f1: 0.5533
 epoch: 48, train_loss: 0.5601, test_loss: 1.1382, test_f1: 0.5912
 epoch: 49, train_loss: 0.5731, test_loss: 1.1866, test_f1: 0.5392
 epoch: 50, train_loss: 0.5815, test_loss: 1.1430, test_f1: 0.5744
 epoch: 51, train_loss: 0.5607, test_loss: 1.1465, test_f1: 0.5777
 epoch: 52, train_loss: 0.5265, test_loss: 1.1609, test_f1: 0.5727
 epoch: 53, train_loss: 0.5258, test_loss: 1.2475, test_f1: 0.5804
 epoch: 54, train_loss: 0.5329, test_loss: 1.1833, test_f1: 0.6010
 epoch: 55, train_loss: 0.4965, test_loss: 1.2980, test_f1: 0.5478
 epoch: 56, train_loss: 0.5179, test_loss: 1.2486, test_f1: 0.5624
 epoch: 57, train_loss: 0.5241, test_loss: 1.2693, test_f1: 0.5609
 epoch: 58, train_loss: 0.4933, test_loss: 1.2374, test_f1: 0.5717
 epoch: 59, train_loss: 0.5054, test_loss: 1.2247, test_f1: 0.5665
 epoch: 60, train_loss: 0.4891, test_loss: 1.2787, test_f1: 0.5833
 epoch: 61, train_loss: 0.5155, test_loss: 1.2031, test_f1: 0.5621
 epoch: 62, train_loss: 0.4929, test_loss: 1.3574, test_f1: 0.5858
 epoch: 63, train_loss: 0.4843, test_loss: 1.3337, test_f1: 0.5744
 epoch: 64, train_loss: 0.5046, test_loss: 1.2382, test_f1: 0.5982
 epoch: 65, train_loss: 0.4761, test_loss: 1.3866, test_f1: 0.5506
 epoch: 66, train_loss: 0.4719, test_loss: 1.2738, test_f1: 0.5646
 epoch: 67, train_loss: 0.4738, test_loss: 1.4132, test_f1: 0.5575
 epoch: 68, train_loss: 0.4593, test_loss: 1.3417, test_f1: 0.5585
 epoch: 69, train_loss: 0.4608, test_loss: 1.4753, test_f1: 0.5540
 epoch: 70, train_loss: 0.4394, test_loss: 1.4282, test_f1: 0.5714
 epoch: 71, train_loss: 0.4701, test_loss: 1.3584, test_f1: 0.5494
 epoch: 72, train_loss: 0.4485, test_loss: 1.4593, test_f1: 0.5559
 epoch: 73, train_loss: 0.4840, test_loss: 1.4134, test_f1: 0.5758
 epoch: 74, train_loss: 0.4658, test_loss: 1.4737, test_f1: 0.5773
 epoch: 75, train_loss: 0.4650, test_loss: 1.4471, test_f1: 0.5488
 epoch: 76, train_loss: 0.4554, test_loss: 1.4952, test_f1: 0.5647
 epoch: 77, train_loss: 0.4534, test_loss: 1.5284, test_f1: 0.5582
 epoch: 78, train_loss: 0.4515, test_loss: 1.3775, test_f1: 0.5547
 epoch: 79, train_loss: 0.4472, test_loss: 1.3875, test_f1: 0.5739
 epoch: 80, train_loss: 0.4566, test_loss: 1.6019, test_f1: 0.5558
 epoch: 81, train_loss: 0.4279, test_loss: 1.5100, test_f1: 0.6061
 epoch: 82, train_loss: 0.4426, test_loss: 1.4765, test_f1: 0.5865
 epoch: 83, train_loss: 0.4435, test_loss: 1.3841, test_f1: 0.6053
 epoch: 84, train_loss: 0.4391, test_loss: 1.5590, test_f1: 0.5534
 epoch: 85, train_loss: 0.4426, test_loss: 1.5361, test_f1: 0.6107
 epoch: 86, train_loss: 0.4511, test_loss: 1.4505, test_f1: 0.5637
 epoch: 87, train_loss: 0.4264, test_loss: 1.6635, test_f1: 0.5615
 epoch: 88, train_loss: 0.4188, test_loss: 1.6305, test_f1: 0.5697
 epoch: 89, train_loss: 0.4177, test_loss: 1.5844, test_f1: 0.5672
 epoch: 90, train_loss: 0.4184, test_loss: 1.5756, test_f1: 0.5644
 epoch: 91, train_loss: 0.4276, test_loss: 1.5371, test_f1: 0.5635
 epoch: 92, train_loss: 0.4403, test_loss: 1.5695, test_f1: 0.5555
 epoch: 93, train_loss: 0.4167, test_loss: 1.5612, test_f1: 0.5721
 epoch: 94, train_loss: 0.4357, test_loss: 1.5534, test_f1: 0.5745
 epoch: 95, train_loss: 0.4091, test_loss: 1.4658, test_f1: 0.5832
 epoch: 96, train_loss: 0.4136, test_loss: 1.7067, test_f1: 0.5783
 epoch: 97, train_loss: 0.4111, test_loss: 1.5489, test_f1: 0.5721
 epoch: 98, train_loss: 0.4064, test_loss: 1.6470, test_f1: 0.5842
 epoch: 99, train_loss: 0.3973, test_loss: 1.5863, test_f1: 0.5874

Training completed in 500.72 seconds
Best F1: 0.6821 at epoch 37
Mean F1 across iterations: 0.6575  0.0214
========================FINAL RESULTS================================
FEGIN weighted F1: 0.6821  0.0214
python main.py --data ltspice_demos --representation component_pin --model FEGIN --layers 2 --hiddens 32 --batch_size 32 --lr 0.001 --emb_size 512 --epochs 100 --save_appendix component_pin_L2_H32_BS32_LR0.001_E512 --no_val
-----



STDERR:
  File "main.py", line 370, in <module>
    main()
  File "main.py", line 254, in main
    dataset = dataset_class(
  File "/home/philip/projects/ltspice_examples_code_repo/Circuit-Completion-Using-GNNs/component_classification_with_link_prediction_head/evaluation/FEGIN/kernel/circuit_datasets.py", line 15, in __init__
    self.data, self.slices = torch.load(self.processed_paths[0])
  File "/home/philip/.local/lib/python3.8/site-packages/torch/serialization.py", line 1040, in load
    warnings.warn(
  File "/usr/lib/python3.8/warnings.py", line 109, in _showwarnmsg
    sw(msg.message, msg.category, msg.filename, msg.lineno,
  File "main.py", line 47, in warn_with_traceback
    traceback.print_stack(file=log)
/home/philip/projects/ltspice_examples_code_repo/Circuit-Completion-Using-GNNs/component_classification_with_link_prediction_head/evaluation/FEGIN/kernel/circuit_datasets.py:15: FutureWarning: You are using `torch.load` with `weights_only=False` (the current default value), which uses the default pickle module implicitly. It is possible to construct malicious pickle data which will execute arbitrary code during unpickling (See https://github.com/pytorch/pytorch/blob/main/SECURITY.md#untrusted-models for more details). In a future release, the default value for `weights_only` will be flipped to `True`. This limits the functions that could be executed during unpickling. Arbitrary objects will no longer be allowed to be loaded via this mode unless they are explicitly allowlisted by the user via `torch.serialization.add_safe_globals`. We recommend you start setting `weights_only=True` for any use case where you don't have full control of the loaded file. Please open an issue on GitHub for any issues related to this experimental feature.
  self.data, self.slices = torch.load(self.processed_paths[0])
