STDOUT:
Results will be saved in /home/philip/projects/ltspice_examples_code_repo/Circuit-Completion-Using-GNNs/component_classification_with_link_prediction_head/evaluation/FEGIN/results/model_FEGIN_dataset_ltspice_examples
Command line input: python main.py --data ltspice_examples --representation component_net --model FEGIN --layers 3 --hiddens 16 --batch_size 256 --lr 0.01 --emb_size 250 --epochs 100 --save_appendix component_net_L3_H16_BS256_LR0.01_E250 --no_val
 is saved.
-----
ltspice_examples - FEGIN
Using 3 layers, 16 hidden units, h = 2
Loading component_net representation dataset
ENTERED
Training FEGIN on component_net representation
Train: 3558, Test: 846
##################ITERATION #0 ****************************************
 epoch: 0, train_loss: 1.3074, test_loss: 1.2981, test_f1: 0.2270
 epoch: 1, train_loss: 1.2206, test_loss: 1.2381, test_f1: 0.2270
 epoch: 2, train_loss: 1.1827, test_loss: 1.1829, test_f1: 0.2270
 epoch: 3, train_loss: 1.1431, test_loss: 1.1402, test_f1: 0.2371
 epoch: 4, train_loss: 1.1066, test_loss: 1.1068, test_f1: 0.4073
 epoch: 5, train_loss: 1.0625, test_loss: 1.1148, test_f1: 0.3752
 epoch: 6, train_loss: 1.0222, test_loss: 0.9876, test_f1: 0.4853
 epoch: 7, train_loss: 1.0003, test_loss: 1.0788, test_f1: 0.3889
 epoch: 8, train_loss: 0.9719, test_loss: 1.0081, test_f1: 0.4891
 epoch: 9, train_loss: 0.9545, test_loss: 1.0310, test_f1: 0.4900
 epoch: 10, train_loss: 0.9508, test_loss: 1.0610, test_f1: 0.3823
 epoch: 11, train_loss: 0.9491, test_loss: 0.9380, test_f1: 0.5368
 epoch: 12, train_loss: 0.9313, test_loss: 1.0005, test_f1: 0.5162
 epoch: 13, train_loss: 0.9091, test_loss: 1.0178, test_f1: 0.4767
 epoch: 14, train_loss: 0.9144, test_loss: 0.9805, test_f1: 0.4785
 epoch: 15, train_loss: 0.9154, test_loss: 0.9289, test_f1: 0.5067
 epoch: 16, train_loss: 0.9176, test_loss: 1.0496, test_f1: 0.4752
 epoch: 17, train_loss: 0.8993, test_loss: 1.0328, test_f1: 0.4962
 epoch: 18, train_loss: 0.9037, test_loss: 0.9436, test_f1: 0.5441
 epoch: 19, train_loss: 0.8923, test_loss: 0.8886, test_f1: 0.5563
 epoch: 20, train_loss: 0.8871, test_loss: 0.9155, test_f1: 0.5299
 epoch: 21, train_loss: 0.8734, test_loss: 1.0058, test_f1: 0.4940
 epoch: 22, train_loss: 0.8794, test_loss: 0.9402, test_f1: 0.5459
 epoch: 23, train_loss: 0.8713, test_loss: 0.9459, test_f1: 0.5123
 epoch: 24, train_loss: 0.8609, test_loss: 0.9722, test_f1: 0.5201
 epoch: 25, train_loss: 0.8670, test_loss: 0.9069, test_f1: 0.5729
 epoch: 26, train_loss: 0.8611, test_loss: 0.9947, test_f1: 0.5055
 epoch: 27, train_loss: 0.8581, test_loss: 0.9544, test_f1: 0.5037
 epoch: 28, train_loss: 0.8623, test_loss: 0.9824, test_f1: 0.5391
 epoch: 29, train_loss: 0.8402, test_loss: 0.9323, test_f1: 0.5309
 epoch: 30, train_loss: 0.8597, test_loss: 0.9462, test_f1: 0.5305
 epoch: 31, train_loss: 0.8578, test_loss: 0.9478, test_f1: 0.5604
 epoch: 32, train_loss: 0.8459, test_loss: 1.0039, test_f1: 0.5474
 epoch: 33, train_loss: 0.8503, test_loss: 1.0029, test_f1: 0.4959
 epoch: 34, train_loss: 0.8352, test_loss: 0.8656, test_f1: 0.5773
 epoch: 35, train_loss: 0.8266, test_loss: 0.9129, test_f1: 0.5520
 epoch: 36, train_loss: 0.8113, test_loss: 0.8878, test_f1: 0.5670
 epoch: 37, train_loss: 0.8285, test_loss: 0.9740, test_f1: 0.5602
 epoch: 38, train_loss: 0.8259, test_loss: 0.9690, test_f1: 0.5348
 epoch: 39, train_loss: 0.8060, test_loss: 0.9122, test_f1: 0.5772
 epoch: 40, train_loss: 0.8140, test_loss: 0.8909, test_f1: 0.5827
 epoch: 41, train_loss: 0.8098, test_loss: 0.9782, test_f1: 0.5352
 epoch: 42, train_loss: 0.8245, test_loss: 1.0239, test_f1: 0.5469
 epoch: 43, train_loss: 0.8088, test_loss: 0.9622, test_f1: 0.5037
 epoch: 44, train_loss: 0.7912, test_loss: 0.9437, test_f1: 0.5413
 epoch: 45, train_loss: 0.8069, test_loss: 0.9778, test_f1: 0.5350
 epoch: 46, train_loss: 0.7984, test_loss: 1.1348, test_f1: 0.4905
 epoch: 47, train_loss: 0.8018, test_loss: 0.8920, test_f1: 0.5653
 epoch: 48, train_loss: 0.7979, test_loss: 0.9237, test_f1: 0.5592
 epoch: 49, train_loss: 0.8038, test_loss: 0.8909, test_f1: 0.5187
 epoch: 50, train_loss: 0.7939, test_loss: 0.8846, test_f1: 0.6098
 epoch: 51, train_loss: 0.7695, test_loss: 0.9715, test_f1: 0.5461
 epoch: 52, train_loss: 0.7618, test_loss: 0.9544, test_f1: 0.6064
 epoch: 53, train_loss: 0.7692, test_loss: 0.9473, test_f1: 0.5780
 epoch: 54, train_loss: 0.7575, test_loss: 0.9337, test_f1: 0.5880
 epoch: 55, train_loss: 0.7592, test_loss: 0.9746, test_f1: 0.5460
 epoch: 56, train_loss: 0.7646, test_loss: 0.9251, test_f1: 0.5854
 epoch: 57, train_loss: 0.7507, test_loss: 0.9977, test_f1: 0.5904
 epoch: 58, train_loss: 0.7511, test_loss: 0.9779, test_f1: 0.5650
 epoch: 59, train_loss: 0.7572, test_loss: 0.9683, test_f1: 0.5501
 epoch: 60, train_loss: 0.7411, test_loss: 0.9863, test_f1: 0.5613
 epoch: 61, train_loss: 0.7629, test_loss: 0.9731, test_f1: 0.5536
 epoch: 62, train_loss: 0.7475, test_loss: 0.9920, test_f1: 0.5611
 epoch: 63, train_loss: 0.7518, test_loss: 0.9665, test_f1: 0.5644
 epoch: 64, train_loss: 0.7516, test_loss: 0.8984, test_f1: 0.5888
 epoch: 65, train_loss: 0.7387, test_loss: 1.0244, test_f1: 0.5756
 epoch: 66, train_loss: 0.7462, test_loss: 0.9467, test_f1: 0.5798
 epoch: 67, train_loss: 0.7445, test_loss: 0.9994, test_f1: 0.5792
 epoch: 68, train_loss: 0.7370, test_loss: 0.9595, test_f1: 0.5954
 epoch: 69, train_loss: 0.7443, test_loss: 0.9851, test_f1: 0.5742
 epoch: 70, train_loss: 0.7479, test_loss: 1.0671, test_f1: 0.5715
 epoch: 71, train_loss: 0.7500, test_loss: 0.9712, test_f1: 0.5809
 epoch: 72, train_loss: 0.7414, test_loss: 1.0030, test_f1: 0.5899
 epoch: 73, train_loss: 0.7388, test_loss: 1.0245, test_f1: 0.5666
 epoch: 74, train_loss: 0.7435, test_loss: 1.0162, test_f1: 0.5707
 epoch: 75, train_loss: 0.7411, test_loss: 1.0138, test_f1: 0.5762
 epoch: 76, train_loss: 0.7356, test_loss: 1.0199, test_f1: 0.5653
 epoch: 77, train_loss: 0.7251, test_loss: 1.0069, test_f1: 0.5962
 epoch: 78, train_loss: 0.7335, test_loss: 1.0353, test_f1: 0.5889
 epoch: 79, train_loss: 0.7337, test_loss: 0.9870, test_f1: 0.6001
 epoch: 80, train_loss: 0.7262, test_loss: 0.9894, test_f1: 0.5692
 epoch: 81, train_loss: 0.7244, test_loss: 1.0377, test_f1: 0.5662
 epoch: 82, train_loss: 0.7243, test_loss: 0.9800, test_f1: 0.5969
 epoch: 83, train_loss: 0.7287, test_loss: 1.0012, test_f1: 0.5460
 epoch: 84, train_loss: 0.7284, test_loss: 0.9303, test_f1: 0.6015
 epoch: 85, train_loss: 0.7284, test_loss: 1.0373, test_f1: 0.5588
 epoch: 86, train_loss: 0.7206, test_loss: 1.0472, test_f1: 0.5527
 epoch: 87, train_loss: 0.7154, test_loss: 0.9764, test_f1: 0.5737
 epoch: 88, train_loss: 0.7235, test_loss: 1.0274, test_f1: 0.5832
 epoch: 89, train_loss: 0.7211, test_loss: 1.0218, test_f1: 0.5685
 epoch: 90, train_loss: 0.7266, test_loss: 1.0300, test_f1: 0.6026
 epoch: 91, train_loss: 0.7150, test_loss: 1.0509, test_f1: 0.5747
 epoch: 92, train_loss: 0.7219, test_loss: 1.0606, test_f1: 0.5834
 epoch: 93, train_loss: 0.7144, test_loss: 1.0518, test_f1: 0.6039
 epoch: 94, train_loss: 0.7304, test_loss: 1.0603, test_f1: 0.5985
 epoch: 95, train_loss: 0.7169, test_loss: 1.0742, test_f1: 0.5980
 epoch: 96, train_loss: 0.7272, test_loss: 1.0605, test_f1: 0.5614
 epoch: 97, train_loss: 0.7275, test_loss: 1.0804, test_f1: 0.5815
 epoch: 98, train_loss: 0.7220, test_loss: 1.0370, test_f1: 0.5764
 epoch: 99, train_loss: 0.7403, test_loss: 1.0788, test_f1: 0.5739
##################ITERATION #1 ****************************************
 epoch: 0, train_loss: 1.2858, test_loss: 1.2715, test_f1: 0.2270
 epoch: 1, train_loss: 1.1834, test_loss: 1.1901, test_f1: 0.3120
 epoch: 2, train_loss: 1.1204, test_loss: 1.1558, test_f1: 0.3357
 epoch: 3, train_loss: 1.0766, test_loss: 1.0489, test_f1: 0.4207
 epoch: 4, train_loss: 1.0369, test_loss: 1.0103, test_f1: 0.4327
 epoch: 5, train_loss: 1.0075, test_loss: 1.0029, test_f1: 0.4637
 epoch: 6, train_loss: 0.9887, test_loss: 1.1227, test_f1: 0.4330
 epoch: 7, train_loss: 0.9816, test_loss: 1.0173, test_f1: 0.4730
 epoch: 8, train_loss: 0.9791, test_loss: 1.0532, test_f1: 0.4423
 epoch: 9, train_loss: 0.9700, test_loss: 1.0434, test_f1: 0.4662
 epoch: 10, train_loss: 0.9574, test_loss: 1.0495, test_f1: 0.4932
 epoch: 11, train_loss: 0.9544, test_loss: 1.1566, test_f1: 0.4371
 epoch: 12, train_loss: 0.9390, test_loss: 0.9949, test_f1: 0.5143
 epoch: 13, train_loss: 0.9449, test_loss: 1.0298, test_f1: 0.4649
 epoch: 14, train_loss: 0.9300, test_loss: 1.1023, test_f1: 0.4800
 epoch: 15, train_loss: 0.9172, test_loss: 1.0444, test_f1: 0.4839
 epoch: 16, train_loss: 0.9321, test_loss: 0.9940, test_f1: 0.5384
 epoch: 17, train_loss: 0.9244, test_loss: 1.0255, test_f1: 0.4722
 epoch: 18, train_loss: 0.9129, test_loss: 1.0320, test_f1: 0.4846
 epoch: 19, train_loss: 0.9086, test_loss: 1.0092, test_f1: 0.5181
 epoch: 20, train_loss: 0.9060, test_loss: 0.9645, test_f1: 0.4942
 epoch: 21, train_loss: 0.8929, test_loss: 1.0198, test_f1: 0.5026
 epoch: 22, train_loss: 0.8933, test_loss: 1.0419, test_f1: 0.5563
 epoch: 23, train_loss: 0.8868, test_loss: 1.0348, test_f1: 0.5040
 epoch: 24, train_loss: 0.8738, test_loss: 1.1260, test_f1: 0.4772
 epoch: 25, train_loss: 0.8730, test_loss: 1.0542, test_f1: 0.5293
 epoch: 26, train_loss: 0.8647, test_loss: 1.0229, test_f1: 0.5489
 epoch: 27, train_loss: 0.8554, test_loss: 1.0944, test_f1: 0.5125
 epoch: 28, train_loss: 0.8569, test_loss: 1.1357, test_f1: 0.4948
 epoch: 29, train_loss: 0.8753, test_loss: 1.0985, test_f1: 0.5114
 epoch: 30, train_loss: 0.8579, test_loss: 1.0371, test_f1: 0.5379
 epoch: 31, train_loss: 0.8442, test_loss: 1.0666, test_f1: 0.5593
 epoch: 32, train_loss: 0.8470, test_loss: 1.0368, test_f1: 0.5298
 epoch: 33, train_loss: 0.8514, test_loss: 1.0997, test_f1: 0.5534
 epoch: 34, train_loss: 0.8465, test_loss: 1.0980, test_f1: 0.5109
 epoch: 35, train_loss: 0.8409, test_loss: 1.0933, test_f1: 0.5164
 epoch: 36, train_loss: 0.8398, test_loss: 1.0719, test_f1: 0.5407
 epoch: 37, train_loss: 0.8515, test_loss: 1.0833, test_f1: 0.5244
 epoch: 38, train_loss: 0.8407, test_loss: 1.0015, test_f1: 0.5057
 epoch: 39, train_loss: 0.8591, test_loss: 1.0705, test_f1: 0.4999
 epoch: 40, train_loss: 0.8474, test_loss: 1.0856, test_f1: 0.5784
 epoch: 41, train_loss: 0.8445, test_loss: 1.0743, test_f1: 0.5094
 epoch: 42, train_loss: 0.8551, test_loss: 1.0077, test_f1: 0.5419
 epoch: 43, train_loss: 0.8394, test_loss: 1.0186, test_f1: 0.4872
 epoch: 44, train_loss: 0.8280, test_loss: 1.2147, test_f1: 0.4834
 epoch: 45, train_loss: 0.8429, test_loss: 1.0853, test_f1: 0.5444
 epoch: 46, train_loss: 0.8432, test_loss: 1.1867, test_f1: 0.4631
 epoch: 47, train_loss: 0.8456, test_loss: 1.0680, test_f1: 0.5062
 epoch: 48, train_loss: 0.8294, test_loss: 1.0718, test_f1: 0.5261
 epoch: 49, train_loss: 0.8229, test_loss: 1.0553, test_f1: 0.5309
 epoch: 50, train_loss: 0.8283, test_loss: 1.0942, test_f1: 0.5600
 epoch: 51, train_loss: 0.8343, test_loss: 1.0396, test_f1: 0.5702
 epoch: 52, train_loss: 0.8088, test_loss: 1.0324, test_f1: 0.5439
 epoch: 53, train_loss: 0.8046, test_loss: 1.0318, test_f1: 0.5924
 epoch: 54, train_loss: 0.7925, test_loss: 1.0246, test_f1: 0.5856
 epoch: 55, train_loss: 0.7905, test_loss: 1.0654, test_f1: 0.5654
 epoch: 56, train_loss: 0.7855, test_loss: 1.1116, test_f1: 0.5413
 epoch: 57, train_loss: 0.7878, test_loss: 1.1089, test_f1: 0.5643
 epoch: 58, train_loss: 0.7875, test_loss: 1.0978, test_f1: 0.5741
 epoch: 59, train_loss: 0.7857, test_loss: 1.0959, test_f1: 0.5689
 epoch: 60, train_loss: 0.7999, test_loss: 1.0754, test_f1: 0.5617
 epoch: 61, train_loss: 0.7936, test_loss: 1.0878, test_f1: 0.5509
 epoch: 62, train_loss: 0.7817, test_loss: 1.1294, test_f1: 0.5487
 epoch: 63, train_loss: 0.7799, test_loss: 1.1179, test_f1: 0.5608
 epoch: 64, train_loss: 0.7771, test_loss: 1.1267, test_f1: 0.5459
 epoch: 65, train_loss: 0.7893, test_loss: 1.1935, test_f1: 0.5538
 epoch: 66, train_loss: 0.7819, test_loss: 1.1062, test_f1: 0.5359
 epoch: 67, train_loss: 0.7758, test_loss: 1.1423, test_f1: 0.5400
 epoch: 68, train_loss: 0.7809, test_loss: 1.2848, test_f1: 0.5120
 epoch: 69, train_loss: 0.7649, test_loss: 1.1078, test_f1: 0.6110
 epoch: 70, train_loss: 0.7811, test_loss: 1.1652, test_f1: 0.5525
 epoch: 71, train_loss: 0.7728, test_loss: 1.1244, test_f1: 0.5771
 epoch: 72, train_loss: 0.7659, test_loss: 1.1853, test_f1: 0.5310
 epoch: 73, train_loss: 0.7778, test_loss: 1.2624, test_f1: 0.4953
 epoch: 74, train_loss: 0.7781, test_loss: 1.1807, test_f1: 0.5746
 epoch: 75, train_loss: 0.7689, test_loss: 1.1387, test_f1: 0.5399
 epoch: 76, train_loss: 0.7724, test_loss: 1.2388, test_f1: 0.5223
 epoch: 77, train_loss: 0.7682, test_loss: 1.1533, test_f1: 0.5742
 epoch: 78, train_loss: 0.7705, test_loss: 1.2079, test_f1: 0.5332
 epoch: 79, train_loss: 0.7740, test_loss: 1.1029, test_f1: 0.5371
 epoch: 80, train_loss: 0.7598, test_loss: 1.1721, test_f1: 0.5439
 epoch: 81, train_loss: 0.7650, test_loss: 1.1447, test_f1: 0.5456
 epoch: 82, train_loss: 0.7705, test_loss: 1.2657, test_f1: 0.5579
 epoch: 83, train_loss: 0.7714, test_loss: 1.1705, test_f1: 0.5529
 epoch: 84, train_loss: 0.7605, test_loss: 1.1499, test_f1: 0.5893
 epoch: 85, train_loss: 0.7527, test_loss: 1.2268, test_f1: 0.5364
 epoch: 86, train_loss: 0.7632, test_loss: 1.1611, test_f1: 0.5807
 epoch: 87, train_loss: 0.7585, test_loss: 1.1836, test_f1: 0.5427
 epoch: 88, train_loss: 0.7543, test_loss: 1.1711, test_f1: 0.5785
 epoch: 89, train_loss: 0.7552, test_loss: 1.2113, test_f1: 0.5359
 epoch: 90, train_loss: 0.7613, test_loss: 1.1691, test_f1: 0.5630
 epoch: 91, train_loss: 0.7653, test_loss: 1.2377, test_f1: 0.5550
 epoch: 92, train_loss: 0.7531, test_loss: 1.1890, test_f1: 0.5795
 epoch: 93, train_loss: 0.7534, test_loss: 1.1785, test_f1: 0.5706
 epoch: 94, train_loss: 0.7567, test_loss: 1.1860, test_f1: 0.5519
 epoch: 95, train_loss: 0.7400, test_loss: 1.2095, test_f1: 0.5822
 epoch: 96, train_loss: 0.7336, test_loss: 1.2453, test_f1: 0.5433
 epoch: 97, train_loss: 0.7576, test_loss: 1.1630, test_f1: 0.5833
 epoch: 98, train_loss: 0.7507, test_loss: 1.2141, test_f1: 0.5858
 epoch: 99, train_loss: 0.7504, test_loss: 1.2490, test_f1: 0.5864
##################ITERATION #2 ****************************************
 epoch: 0, train_loss: 1.2279, test_loss: 1.2977, test_f1: 0.2270
 epoch: 1, train_loss: 1.0853, test_loss: 1.1048, test_f1: 0.3389
 epoch: 2, train_loss: 1.0539, test_loss: 1.1088, test_f1: 0.3465
 epoch: 3, train_loss: 1.0433, test_loss: 1.1043, test_f1: 0.3841
 epoch: 4, train_loss: 1.0264, test_loss: 1.0801, test_f1: 0.4195
 epoch: 5, train_loss: 1.0049, test_loss: 1.0811, test_f1: 0.4442
 epoch: 6, train_loss: 0.9933, test_loss: 1.0209, test_f1: 0.4560
 epoch: 7, train_loss: 0.9723, test_loss: 0.9978, test_f1: 0.4433
 epoch: 8, train_loss: 0.9723, test_loss: 1.0141, test_f1: 0.4700
 epoch: 9, train_loss: 0.9617, test_loss: 1.0711, test_f1: 0.4685
 epoch: 10, train_loss: 0.9478, test_loss: 1.1226, test_f1: 0.4273
 epoch: 11, train_loss: 0.9351, test_loss: 1.0149, test_f1: 0.4962
 epoch: 12, train_loss: 0.9273, test_loss: 0.9826, test_f1: 0.4795
 epoch: 13, train_loss: 0.9274, test_loss: 1.0339, test_f1: 0.4849
 epoch: 14, train_loss: 0.9269, test_loss: 1.0472, test_f1: 0.4734
 epoch: 15, train_loss: 0.9266, test_loss: 1.1459, test_f1: 0.4309
 epoch: 16, train_loss: 0.9320, test_loss: 0.9671, test_f1: 0.5054
 epoch: 17, train_loss: 0.9045, test_loss: 0.9608, test_f1: 0.5188
 epoch: 18, train_loss: 0.8973, test_loss: 0.9640, test_f1: 0.5259
 epoch: 19, train_loss: 0.8828, test_loss: 1.0482, test_f1: 0.4607
 epoch: 20, train_loss: 0.8800, test_loss: 0.9759, test_f1: 0.5085
 epoch: 21, train_loss: 0.8790, test_loss: 1.1450, test_f1: 0.4513
 epoch: 22, train_loss: 0.8865, test_loss: 0.9468, test_f1: 0.5136
 epoch: 23, train_loss: 0.8786, test_loss: 0.9717, test_f1: 0.5061
 epoch: 24, train_loss: 0.8706, test_loss: 1.2860, test_f1: 0.3831
 epoch: 25, train_loss: 0.8714, test_loss: 1.0288, test_f1: 0.4996
 epoch: 26, train_loss: 0.8880, test_loss: 0.9959, test_f1: 0.4699
 epoch: 27, train_loss: 0.8860, test_loss: 1.0247, test_f1: 0.4820
 epoch: 28, train_loss: 0.8689, test_loss: 0.9889, test_f1: 0.4864
 epoch: 29, train_loss: 0.8674, test_loss: 0.9567, test_f1: 0.5201
 epoch: 30, train_loss: 0.8523, test_loss: 0.9834, test_f1: 0.4991
 epoch: 31, train_loss: 0.8584, test_loss: 0.9592, test_f1: 0.5271
 epoch: 32, train_loss: 0.8531, test_loss: 0.9471, test_f1: 0.5243
 epoch: 33, train_loss: 0.8465, test_loss: 0.9231, test_f1: 0.5547
 epoch: 34, train_loss: 0.8463, test_loss: 0.9405, test_f1: 0.5361
 epoch: 35, train_loss: 0.8327, test_loss: 0.9701, test_f1: 0.4806
 epoch: 36, train_loss: 0.8332, test_loss: 0.9473, test_f1: 0.5410
 epoch: 37, train_loss: 0.8398, test_loss: 0.9944, test_f1: 0.5300
 epoch: 38, train_loss: 0.8473, test_loss: 1.0078, test_f1: 0.5035
 epoch: 39, train_loss: 0.8742, test_loss: 1.1979, test_f1: 0.4596
 epoch: 40, train_loss: 0.8421, test_loss: 0.9444, test_f1: 0.5607
 epoch: 41, train_loss: 0.8277, test_loss: 1.0255, test_f1: 0.4990
 epoch: 42, train_loss: 0.8344, test_loss: 0.9668, test_f1: 0.5160
 epoch: 43, train_loss: 0.8196, test_loss: 1.0022, test_f1: 0.5015
 epoch: 44, train_loss: 0.8428, test_loss: 0.9803, test_f1: 0.5029
 epoch: 45, train_loss: 0.8323, test_loss: 0.9708, test_f1: 0.5585
 epoch: 46, train_loss: 0.8235, test_loss: 0.9778, test_f1: 0.5179
 epoch: 47, train_loss: 0.8201, test_loss: 0.9616, test_f1: 0.5357
 epoch: 48, train_loss: 0.8122, test_loss: 0.9390, test_f1: 0.5517
 epoch: 49, train_loss: 0.8161, test_loss: 0.8679, test_f1: 0.5259
 epoch: 50, train_loss: 0.8382, test_loss: 1.0559, test_f1: 0.4730
 epoch: 51, train_loss: 0.8206, test_loss: 0.9414, test_f1: 0.5341
 epoch: 52, train_loss: 0.7965, test_loss: 0.9555, test_f1: 0.5679
 epoch: 53, train_loss: 0.8013, test_loss: 1.1238, test_f1: 0.4858
 epoch: 54, train_loss: 0.8004, test_loss: 0.9512, test_f1: 0.5357
 epoch: 55, train_loss: 0.7878, test_loss: 0.9829, test_f1: 0.5198
 epoch: 56, train_loss: 0.7940, test_loss: 0.9982, test_f1: 0.5258
 epoch: 57, train_loss: 0.7714, test_loss: 0.9165, test_f1: 0.5504
 epoch: 58, train_loss: 0.7734, test_loss: 0.9345, test_f1: 0.5607
 epoch: 59, train_loss: 0.7821, test_loss: 0.9269, test_f1: 0.5792
 epoch: 60, train_loss: 0.7780, test_loss: 1.0705, test_f1: 0.4716
 epoch: 61, train_loss: 0.7829, test_loss: 0.9106, test_f1: 0.5525
 epoch: 62, train_loss: 0.7727, test_loss: 0.9192, test_f1: 0.5482
 epoch: 63, train_loss: 0.7723, test_loss: 0.9419, test_f1: 0.5523
 epoch: 64, train_loss: 0.7786, test_loss: 0.9272, test_f1: 0.5371
 epoch: 65, train_loss: 0.7715, test_loss: 0.9651, test_f1: 0.5225
 epoch: 66, train_loss: 0.7625, test_loss: 0.9114, test_f1: 0.5609
 epoch: 67, train_loss: 0.7658, test_loss: 0.9068, test_f1: 0.5357
 epoch: 68, train_loss: 0.7778, test_loss: 0.9889, test_f1: 0.4923
 epoch: 69, train_loss: 0.7536, test_loss: 0.9215, test_f1: 0.5358
 epoch: 70, train_loss: 0.7551, test_loss: 0.9319, test_f1: 0.5660
 epoch: 71, train_loss: 0.7692, test_loss: 0.9234, test_f1: 0.5572
 epoch: 72, train_loss: 0.7621, test_loss: 0.9371, test_f1: 0.5490
 epoch: 73, train_loss: 0.7610, test_loss: 0.9281, test_f1: 0.5422
 epoch: 74, train_loss: 0.7643, test_loss: 0.9128, test_f1: 0.5661
 epoch: 75, train_loss: 0.7689, test_loss: 0.9975, test_f1: 0.5195
 epoch: 76, train_loss: 0.7590, test_loss: 0.9271, test_f1: 0.5699
 epoch: 77, train_loss: 0.7662, test_loss: 1.0133, test_f1: 0.5077
 epoch: 78, train_loss: 0.7538, test_loss: 0.9471, test_f1: 0.5261
 epoch: 79, train_loss: 0.7665, test_loss: 0.9895, test_f1: 0.5131
 epoch: 80, train_loss: 0.7584, test_loss: 0.8970, test_f1: 0.5612
 epoch: 81, train_loss: 0.7529, test_loss: 0.9160, test_f1: 0.5655
 epoch: 82, train_loss: 0.7530, test_loss: 0.9360, test_f1: 0.5261
 epoch: 83, train_loss: 0.7610, test_loss: 0.9323, test_f1: 0.5384
 epoch: 84, train_loss: 0.7474, test_loss: 0.9143, test_f1: 0.5715
 epoch: 85, train_loss: 0.7481, test_loss: 0.9208, test_f1: 0.5613
 epoch: 86, train_loss: 0.7559, test_loss: 1.0248, test_f1: 0.5132
 epoch: 87, train_loss: 0.7687, test_loss: 0.9173, test_f1: 0.5456
 epoch: 88, train_loss: 0.7651, test_loss: 0.9392, test_f1: 0.5538
 epoch: 89, train_loss: 0.7447, test_loss: 0.9359, test_f1: 0.5478
 epoch: 90, train_loss: 0.7317, test_loss: 0.9475, test_f1: 0.5409
 epoch: 91, train_loss: 0.7465, test_loss: 0.9111, test_f1: 0.5540
 epoch: 92, train_loss: 0.7453, test_loss: 0.9199, test_f1: 0.5462
 epoch: 93, train_loss: 0.7376, test_loss: 0.9169, test_f1: 0.5742
 epoch: 94, train_loss: 0.7180, test_loss: 0.9310, test_f1: 0.5603
 epoch: 95, train_loss: 0.7319, test_loss: 0.9349, test_f1: 0.5648
 epoch: 96, train_loss: 0.7253, test_loss: 1.0053, test_f1: 0.5308
 epoch: 97, train_loss: 0.7288, test_loss: 0.9449, test_f1: 0.5426
 epoch: 98, train_loss: 0.7418, test_loss: 0.9784, test_f1: 0.5549
 epoch: 99, train_loss: 0.7254, test_loss: 0.9329, test_f1: 0.5686
##################ITERATION #3 ****************************************
 epoch: 0, train_loss: 1.3112, test_loss: 1.2869, test_f1: 0.2270
 epoch: 1, train_loss: 1.1581, test_loss: 1.2205, test_f1: 0.2344
 epoch: 2, train_loss: 1.0925, test_loss: 1.1018, test_f1: 0.3396
 epoch: 3, train_loss: 1.0569, test_loss: 1.0893, test_f1: 0.3702
 epoch: 4, train_loss: 1.0323, test_loss: 1.0742, test_f1: 0.4646
 epoch: 5, train_loss: 1.0227, test_loss: 1.0707, test_f1: 0.4320
 epoch: 6, train_loss: 0.9999, test_loss: 1.1344, test_f1: 0.3994
 epoch: 7, train_loss: 0.9874, test_loss: 1.0595, test_f1: 0.4445
 epoch: 8, train_loss: 0.9746, test_loss: 1.0031, test_f1: 0.4575
 epoch: 9, train_loss: 0.9667, test_loss: 0.9884, test_f1: 0.4626
 epoch: 10, train_loss: 0.9481, test_loss: 0.9660, test_f1: 0.5158
 epoch: 11, train_loss: 0.9359, test_loss: 1.0374, test_f1: 0.4697
 epoch: 12, train_loss: 0.9369, test_loss: 0.9828, test_f1: 0.5173
 epoch: 13, train_loss: 0.9204, test_loss: 1.0378, test_f1: 0.4680
 epoch: 14, train_loss: 0.9078, test_loss: 0.9602, test_f1: 0.4879
 epoch: 15, train_loss: 0.8987, test_loss: 0.9851, test_f1: 0.5590
 epoch: 16, train_loss: 0.9051, test_loss: 0.9374, test_f1: 0.5254
 epoch: 17, train_loss: 0.8906, test_loss: 1.0461, test_f1: 0.4677
 epoch: 18, train_loss: 0.8927, test_loss: 0.9685, test_f1: 0.5131
 epoch: 19, train_loss: 0.8796, test_loss: 1.0056, test_f1: 0.5117
 epoch: 20, train_loss: 0.8722, test_loss: 0.9471, test_f1: 0.5241
 epoch: 21, train_loss: 0.8709, test_loss: 0.9974, test_f1: 0.5008
 epoch: 22, train_loss: 0.8801, test_loss: 0.9899, test_f1: 0.5434
 epoch: 23, train_loss: 0.8671, test_loss: 1.0006, test_f1: 0.5046
 epoch: 24, train_loss: 0.8732, test_loss: 0.9901, test_f1: 0.4976
 epoch: 25, train_loss: 0.8715, test_loss: 1.0577, test_f1: 0.4799
 epoch: 26, train_loss: 0.8720, test_loss: 0.9807, test_f1: 0.5212
 epoch: 27, train_loss: 0.8536, test_loss: 0.9679, test_f1: 0.5583
 epoch: 28, train_loss: 0.8539, test_loss: 1.0497, test_f1: 0.4608
 epoch: 29, train_loss: 0.8394, test_loss: 0.9868, test_f1: 0.5165
 epoch: 30, train_loss: 0.8415, test_loss: 0.9620, test_f1: 0.5159
 epoch: 31, train_loss: 0.8522, test_loss: 0.9766, test_f1: 0.5225
 epoch: 32, train_loss: 0.8546, test_loss: 0.9749, test_f1: 0.5413
 epoch: 33, train_loss: 0.8507, test_loss: 0.9557, test_f1: 0.5344
 epoch: 34, train_loss: 0.8354, test_loss: 0.9416, test_f1: 0.5547
 epoch: 35, train_loss: 0.8445, test_loss: 0.9695, test_f1: 0.5282
 epoch: 36, train_loss: 0.8275, test_loss: 0.9530, test_f1: 0.5626
 epoch: 37, train_loss: 0.8235, test_loss: 0.9831, test_f1: 0.5192
 epoch: 38, train_loss: 0.8234, test_loss: 0.9168, test_f1: 0.5472
 epoch: 39, train_loss: 0.8287, test_loss: 1.0346, test_f1: 0.4622
 epoch: 40, train_loss: 0.8250, test_loss: 1.0127, test_f1: 0.5433
 epoch: 41, train_loss: 0.8202, test_loss: 0.9338, test_f1: 0.5333
 epoch: 42, train_loss: 0.8102, test_loss: 0.9330, test_f1: 0.5530
 epoch: 43, train_loss: 0.8052, test_loss: 0.9418, test_f1: 0.5365
 epoch: 44, train_loss: 0.8199, test_loss: 0.9998, test_f1: 0.5094
 epoch: 45, train_loss: 0.8172, test_loss: 0.9243, test_f1: 0.5581
 epoch: 46, train_loss: 0.8067, test_loss: 0.9670, test_f1: 0.5425
 epoch: 47, train_loss: 0.8010, test_loss: 0.9636, test_f1: 0.5532
 epoch: 48, train_loss: 0.7977, test_loss: 0.9065, test_f1: 0.5594
 epoch: 49, train_loss: 0.7908, test_loss: 0.9368, test_f1: 0.5487
 epoch: 50, train_loss: 0.7964, test_loss: 0.9442, test_f1: 0.5474
 epoch: 51, train_loss: 0.7762, test_loss: 1.0116, test_f1: 0.5157
 epoch: 52, train_loss: 0.7715, test_loss: 0.9292, test_f1: 0.5567
 epoch: 53, train_loss: 0.7565, test_loss: 0.9368, test_f1: 0.5736
 epoch: 54, train_loss: 0.7732, test_loss: 0.9454, test_f1: 0.5445
 epoch: 55, train_loss: 0.7659, test_loss: 0.9258, test_f1: 0.5740
 epoch: 56, train_loss: 0.7588, test_loss: 0.9723, test_f1: 0.5435
 epoch: 57, train_loss: 0.7616, test_loss: 0.9539, test_f1: 0.5640
 epoch: 58, train_loss: 0.7505, test_loss: 0.9474, test_f1: 0.5621
 epoch: 59, train_loss: 0.7407, test_loss: 0.9545, test_f1: 0.5734
 epoch: 60, train_loss: 0.7387, test_loss: 0.9869, test_f1: 0.5220
 epoch: 61, train_loss: 0.7462, test_loss: 0.9765, test_f1: 0.5831
 epoch: 62, train_loss: 0.7689, test_loss: 0.9984, test_f1: 0.5391
 epoch: 63, train_loss: 0.7569, test_loss: 0.9483, test_f1: 0.5800
 epoch: 64, train_loss: 0.7480, test_loss: 0.9883, test_f1: 0.5568
 epoch: 65, train_loss: 0.7455, test_loss: 0.9521, test_f1: 0.5561
 epoch: 66, train_loss: 0.7538, test_loss: 0.9697, test_f1: 0.5464
 epoch: 67, train_loss: 0.7367, test_loss: 0.9827, test_f1: 0.5649
 epoch: 68, train_loss: 0.7310, test_loss: 1.0280, test_f1: 0.5187
 epoch: 69, train_loss: 0.7440, test_loss: 0.9309, test_f1: 0.5653
 epoch: 70, train_loss: 0.7444, test_loss: 1.0375, test_f1: 0.5261
 epoch: 71, train_loss: 0.7432, test_loss: 1.0016, test_f1: 0.5701
 epoch: 72, train_loss: 0.7373, test_loss: 0.9934, test_f1: 0.5678
 epoch: 73, train_loss: 0.7307, test_loss: 0.9998, test_f1: 0.5453
 epoch: 74, train_loss: 0.7409, test_loss: 0.9664, test_f1: 0.5622
 epoch: 75, train_loss: 0.7391, test_loss: 0.9952, test_f1: 0.5392
 epoch: 76, train_loss: 0.7325, test_loss: 1.0078, test_f1: 0.5481
 epoch: 77, train_loss: 0.7224, test_loss: 1.0096, test_f1: 0.5634
 epoch: 78, train_loss: 0.7347, test_loss: 1.0709, test_f1: 0.5545
 epoch: 79, train_loss: 0.7206, test_loss: 0.9960, test_f1: 0.5590
 epoch: 80, train_loss: 0.7220, test_loss: 1.0126, test_f1: 0.5662
 epoch: 81, train_loss: 0.7293, test_loss: 0.9956, test_f1: 0.5548
 epoch: 82, train_loss: 0.7378, test_loss: 1.0444, test_f1: 0.5299
 epoch: 83, train_loss: 0.7234, test_loss: 0.9768, test_f1: 0.5582
 epoch: 84, train_loss: 0.7231, test_loss: 1.0342, test_f1: 0.5253
 epoch: 85, train_loss: 0.7162, test_loss: 1.0349, test_f1: 0.5261
 epoch: 86, train_loss: 0.7179, test_loss: 0.9953, test_f1: 0.5623
 epoch: 87, train_loss: 0.7262, test_loss: 1.0039, test_f1: 0.5363
 epoch: 88, train_loss: 0.7356, test_loss: 0.9672, test_f1: 0.5682
 epoch: 89, train_loss: 0.7240, test_loss: 0.9863, test_f1: 0.5749
 epoch: 90, train_loss: 0.7151, test_loss: 1.0780, test_f1: 0.5344
 epoch: 91, train_loss: 0.7140, test_loss: 1.0266, test_f1: 0.5542
 epoch: 92, train_loss: 0.7221, test_loss: 1.0739, test_f1: 0.5268
 epoch: 93, train_loss: 0.7150, test_loss: 1.0075, test_f1: 0.5366
 epoch: 94, train_loss: 0.7010, test_loss: 1.0349, test_f1: 0.5603
 epoch: 95, train_loss: 0.7064, test_loss: 0.9673, test_f1: 0.5745
 epoch: 96, train_loss: 0.7057, test_loss: 1.0143, test_f1: 0.5525
 epoch: 97, train_loss: 0.7085, test_loss: 1.0551, test_f1: 0.5559
 epoch: 98, train_loss: 0.7053, test_loss: 1.0148, test_f1: 0.5673
 epoch: 99, train_loss: 0.7130, test_loss: 1.0025, test_f1: 0.5584
##################ITERATION #4 ****************************************
 epoch: 0, train_loss: 1.4165, test_loss: 1.3701, test_f1: 0.2270
 epoch: 1, train_loss: 1.2095, test_loss: 1.2360, test_f1: 0.2271
 epoch: 2, train_loss: 1.1532, test_loss: 1.1248, test_f1: 0.3555
 epoch: 3, train_loss: 1.1017, test_loss: 1.0445, test_f1: 0.4168
 epoch: 4, train_loss: 1.0502, test_loss: 1.0459, test_f1: 0.4354
 epoch: 5, train_loss: 1.0175, test_loss: 0.9835, test_f1: 0.4369
 epoch: 6, train_loss: 0.9837, test_loss: 1.0171, test_f1: 0.4496
 epoch: 7, train_loss: 0.9864, test_loss: 1.0064, test_f1: 0.5009
 epoch: 8, train_loss: 0.9711, test_loss: 0.9669, test_f1: 0.4846
 epoch: 9, train_loss: 0.9652, test_loss: 0.9699, test_f1: 0.4548
 epoch: 10, train_loss: 0.9495, test_loss: 1.0016, test_f1: 0.4811
 epoch: 11, train_loss: 0.9371, test_loss: 1.2157, test_f1: 0.4664
 epoch: 12, train_loss: 0.9357, test_loss: 0.9419, test_f1: 0.4945
 epoch: 13, train_loss: 0.9231, test_loss: 0.9244, test_f1: 0.5085
 epoch: 14, train_loss: 0.9131, test_loss: 0.9728, test_f1: 0.5152
 epoch: 15, train_loss: 0.9077, test_loss: 1.0033, test_f1: 0.5155
 epoch: 16, train_loss: 0.9211, test_loss: 0.9135, test_f1: 0.4933
 epoch: 17, train_loss: 0.9191, test_loss: 0.9405, test_f1: 0.5156
 epoch: 18, train_loss: 0.9056, test_loss: 1.0329, test_f1: 0.4960
 epoch: 19, train_loss: 0.9061, test_loss: 1.0346, test_f1: 0.4949
 epoch: 20, train_loss: 0.8887, test_loss: 1.0970, test_f1: 0.4896
 epoch: 21, train_loss: 0.8884, test_loss: 0.9886, test_f1: 0.4949
 epoch: 22, train_loss: 0.8840, test_loss: 0.9031, test_f1: 0.5249
 epoch: 23, train_loss: 0.8944, test_loss: 0.9109, test_f1: 0.5099
 epoch: 24, train_loss: 0.8878, test_loss: 0.9753, test_f1: 0.5309
 epoch: 25, train_loss: 0.8693, test_loss: 0.9750, test_f1: 0.4989
 epoch: 26, train_loss: 0.8861, test_loss: 0.9693, test_f1: 0.5267
 epoch: 27, train_loss: 0.8666, test_loss: 0.9028, test_f1: 0.5224
 epoch: 28, train_loss: 0.8679, test_loss: 0.9180, test_f1: 0.5221
 epoch: 29, train_loss: 0.8731, test_loss: 1.1082, test_f1: 0.5113
 epoch: 30, train_loss: 0.8592, test_loss: 0.9110, test_f1: 0.5400
 epoch: 31, train_loss: 0.8622, test_loss: 0.9832, test_f1: 0.5053
 epoch: 32, train_loss: 0.8648, test_loss: 1.0548, test_f1: 0.4909
 epoch: 33, train_loss: 0.8331, test_loss: 0.9741, test_f1: 0.5084
 epoch: 34, train_loss: 0.8462, test_loss: 0.9469, test_f1: 0.5333
 epoch: 35, train_loss: 0.8483, test_loss: 0.9965, test_f1: 0.5011
 epoch: 36, train_loss: 0.8587, test_loss: 0.9100, test_f1: 0.5820
 epoch: 37, train_loss: 0.8661, test_loss: 0.9518, test_f1: 0.5168
 epoch: 38, train_loss: 0.8449, test_loss: 0.9187, test_f1: 0.5176
 epoch: 39, train_loss: 0.8361, test_loss: 0.9216, test_f1: 0.5139
 epoch: 40, train_loss: 0.8337, test_loss: 1.0062, test_f1: 0.4785
 epoch: 41, train_loss: 0.8216, test_loss: 0.8811, test_f1: 0.5340
 epoch: 42, train_loss: 0.8254, test_loss: 0.9000, test_f1: 0.5182
 epoch: 43, train_loss: 0.8216, test_loss: 0.9233, test_f1: 0.5439
 epoch: 44, train_loss: 0.8223, test_loss: 0.8952, test_f1: 0.5605
 epoch: 45, train_loss: 0.8344, test_loss: 0.9379, test_f1: 0.5434
 epoch: 46, train_loss: 0.8223, test_loss: 1.0540, test_f1: 0.4757
 epoch: 47, train_loss: 0.8210, test_loss: 0.9068, test_f1: 0.5370
 epoch: 48, train_loss: 0.8141, test_loss: 0.9857, test_f1: 0.4789
 epoch: 49, train_loss: 0.8060, test_loss: 0.9231, test_f1: 0.5216
 epoch: 50, train_loss: 0.8110, test_loss: 0.9166, test_f1: 0.5580
 epoch: 51, train_loss: 0.7758, test_loss: 0.9090, test_f1: 0.5283
 epoch: 52, train_loss: 0.7759, test_loss: 0.9106, test_f1: 0.5535
 epoch: 53, train_loss: 0.7630, test_loss: 0.8829, test_f1: 0.5545
 epoch: 54, train_loss: 0.7734, test_loss: 0.8870, test_f1: 0.5460
 epoch: 55, train_loss: 0.7603, test_loss: 0.8792, test_f1: 0.5778
 epoch: 56, train_loss: 0.7764, test_loss: 0.9110, test_f1: 0.5418
 epoch: 57, train_loss: 0.7700, test_loss: 0.9627, test_f1: 0.5381
 epoch: 58, train_loss: 0.7576, test_loss: 0.9036, test_f1: 0.5314
 epoch: 59, train_loss: 0.7724, test_loss: 0.8828, test_f1: 0.5565
 epoch: 60, train_loss: 0.7548, test_loss: 0.9014, test_f1: 0.5680
 epoch: 61, train_loss: 0.7577, test_loss: 0.8863, test_f1: 0.5526
 epoch: 62, train_loss: 0.7526, test_loss: 0.9071, test_f1: 0.5434
 epoch: 63, train_loss: 0.7561, test_loss: 0.9139, test_f1: 0.5565
 epoch: 64, train_loss: 0.7635, test_loss: 0.8896, test_f1: 0.5758
 epoch: 65, train_loss: 0.7575, test_loss: 0.8955, test_f1: 0.5366
 epoch: 66, train_loss: 0.7586, test_loss: 0.9435, test_f1: 0.5486
 epoch: 67, train_loss: 0.7503, test_loss: 0.8922, test_f1: 0.5664
 epoch: 68, train_loss: 0.7505, test_loss: 0.9250, test_f1: 0.5492
 epoch: 69, train_loss: 0.7425, test_loss: 0.9155, test_f1: 0.5697
 epoch: 70, train_loss: 0.7468, test_loss: 0.9425, test_f1: 0.5342
 epoch: 71, train_loss: 0.7571, test_loss: 0.9065, test_f1: 0.5786
 epoch: 72, train_loss: 0.7477, test_loss: 0.9043, test_f1: 0.5696
 epoch: 73, train_loss: 0.7496, test_loss: 0.9255, test_f1: 0.5506
 epoch: 74, train_loss: 0.7374, test_loss: 0.8934, test_f1: 0.5494
 epoch: 75, train_loss: 0.7429, test_loss: 0.9133, test_f1: 0.5504
 epoch: 76, train_loss: 0.7583, test_loss: 0.9171, test_f1: 0.5691
 epoch: 77, train_loss: 0.7411, test_loss: 0.9292, test_f1: 0.5690
 epoch: 78, train_loss: 0.7383, test_loss: 0.9307, test_f1: 0.5440
 epoch: 79, train_loss: 0.7316, test_loss: 0.9248, test_f1: 0.5401
 epoch: 80, train_loss: 0.7397, test_loss: 0.8833, test_f1: 0.5821
 epoch: 81, train_loss: 0.7494, test_loss: 0.8869, test_f1: 0.5833
 epoch: 82, train_loss: 0.7487, test_loss: 0.9482, test_f1: 0.5692
 epoch: 83, train_loss: 0.7413, test_loss: 0.9015, test_f1: 0.5714
 epoch: 84, train_loss: 0.7458, test_loss: 0.9391, test_f1: 0.5472
 epoch: 85, train_loss: 0.7519, test_loss: 0.9851, test_f1: 0.5740
 epoch: 86, train_loss: 0.7465, test_loss: 0.8804, test_f1: 0.5495
 epoch: 87, train_loss: 0.7390, test_loss: 0.9250, test_f1: 0.5936
 epoch: 88, train_loss: 0.7313, test_loss: 0.9433, test_f1: 0.6016
 epoch: 89, train_loss: 0.7303, test_loss: 0.8928, test_f1: 0.5736
 epoch: 90, train_loss: 0.7128, test_loss: 0.9542, test_f1: 0.5839
 epoch: 91, train_loss: 0.7244, test_loss: 0.9162, test_f1: 0.6019
 epoch: 92, train_loss: 0.7124, test_loss: 0.9273, test_f1: 0.5804
 epoch: 93, train_loss: 0.7159, test_loss: 0.8786, test_f1: 0.6061
 epoch: 94, train_loss: 0.7148, test_loss: 0.8561, test_f1: 0.5987
 epoch: 95, train_loss: 0.7304, test_loss: 0.8853, test_f1: 0.5920
 epoch: 96, train_loss: 0.7204, test_loss: 0.8786, test_f1: 0.5942
 epoch: 97, train_loss: 0.7246, test_loss: 0.8853, test_f1: 0.5839
 epoch: 98, train_loss: 0.7142, test_loss: 0.9327, test_f1: 0.5952
 epoch: 99, train_loss: 0.7144, test_loss: 0.9571, test_f1: 0.6226
##################ITERATION #5 ****************************************
 epoch: 0, train_loss: 1.3295, test_loss: 1.3472, test_f1: 0.2270
 epoch: 1, train_loss: 1.1863, test_loss: 1.2768, test_f1: 0.2429
 epoch: 2, train_loss: 1.1228, test_loss: 1.2952, test_f1: 0.2758
 epoch: 3, train_loss: 1.0838, test_loss: 1.0381, test_f1: 0.4867
 epoch: 4, train_loss: 1.0422, test_loss: 1.1474, test_f1: 0.4072
 epoch: 5, train_loss: 1.0130, test_loss: 0.9861, test_f1: 0.4532
 epoch: 6, train_loss: 1.0047, test_loss: 1.1408, test_f1: 0.4373
 epoch: 7, train_loss: 0.9886, test_loss: 1.0602, test_f1: 0.4833
 epoch: 8, train_loss: 1.0048, test_loss: 1.0196, test_f1: 0.4623
 epoch: 9, train_loss: 0.9852, test_loss: 1.0184, test_f1: 0.4860
 epoch: 10, train_loss: 0.9607, test_loss: 1.0916, test_f1: 0.4677
 epoch: 11, train_loss: 0.9386, test_loss: 0.9971, test_f1: 0.5331
 epoch: 12, train_loss: 0.9444, test_loss: 1.0043, test_f1: 0.5008
 epoch: 13, train_loss: 0.9363, test_loss: 0.9982, test_f1: 0.4973
 epoch: 14, train_loss: 0.9300, test_loss: 1.0378, test_f1: 0.5069
 epoch: 15, train_loss: 0.9295, test_loss: 0.8994, test_f1: 0.5114
 epoch: 16, train_loss: 0.9172, test_loss: 0.9282, test_f1: 0.5433
 epoch: 17, train_loss: 0.9119, test_loss: 1.0553, test_f1: 0.4887
 epoch: 18, train_loss: 0.9337, test_loss: 1.2529, test_f1: 0.4245
 epoch: 19, train_loss: 0.9155, test_loss: 1.3516, test_f1: 0.4346
 epoch: 20, train_loss: 0.9103, test_loss: 0.9771, test_f1: 0.5181
 epoch: 21, train_loss: 0.8961, test_loss: 0.9163, test_f1: 0.5239
 epoch: 22, train_loss: 0.9102, test_loss: 1.2062, test_f1: 0.4677
 epoch: 23, train_loss: 0.9091, test_loss: 1.0569, test_f1: 0.5028
 epoch: 24, train_loss: 0.8947, test_loss: 1.0869, test_f1: 0.4773
 epoch: 25, train_loss: 0.8964, test_loss: 1.0395, test_f1: 0.4719
 epoch: 26, train_loss: 0.8961, test_loss: 1.0452, test_f1: 0.4979
 epoch: 27, train_loss: 0.8947, test_loss: 1.0517, test_f1: 0.5028
 epoch: 28, train_loss: 0.9066, test_loss: 1.0186, test_f1: 0.4960
 epoch: 29, train_loss: 0.9019, test_loss: 0.9905, test_f1: 0.5160
 epoch: 30, train_loss: 0.8843, test_loss: 1.2373, test_f1: 0.4673
 epoch: 31, train_loss: 0.8842, test_loss: 1.0244, test_f1: 0.5051
 epoch: 32, train_loss: 0.8769, test_loss: 0.9125, test_f1: 0.5279
 epoch: 33, train_loss: 0.8716, test_loss: 0.9879, test_f1: 0.4994
 epoch: 34, train_loss: 0.8600, test_loss: 0.9304, test_f1: 0.5236
 epoch: 35, train_loss: 0.8592, test_loss: 0.9946, test_f1: 0.4930
 epoch: 36, train_loss: 0.8650, test_loss: 0.9828, test_f1: 0.5140
 epoch: 37, train_loss: 0.8764, test_loss: 0.9143, test_f1: 0.5432
 epoch: 38, train_loss: 0.8622, test_loss: 1.0714, test_f1: 0.4978
 epoch: 39, train_loss: 0.8475, test_loss: 0.9455, test_f1: 0.5442
 epoch: 40, train_loss: 0.8397, test_loss: 1.1816, test_f1: 0.4814
 epoch: 41, train_loss: 0.8409, test_loss: 0.9673, test_f1: 0.5133
 epoch: 42, train_loss: 0.8323, test_loss: 0.9770, test_f1: 0.5216
 epoch: 43, train_loss: 0.8324, test_loss: 1.0707, test_f1: 0.5242
 epoch: 44, train_loss: 0.8365, test_loss: 1.0924, test_f1: 0.4864
 epoch: 45, train_loss: 0.8358, test_loss: 1.0690, test_f1: 0.4863
 epoch: 46, train_loss: 0.8266, test_loss: 1.0074, test_f1: 0.5265
 epoch: 47, train_loss: 0.8389, test_loss: 1.0515, test_f1: 0.5287
 epoch: 48, train_loss: 0.8332, test_loss: 0.9636, test_f1: 0.5231
 epoch: 49, train_loss: 0.8234, test_loss: 1.0769, test_f1: 0.4983
 epoch: 50, train_loss: 0.8122, test_loss: 1.0490, test_f1: 0.5242
 epoch: 51, train_loss: 0.8055, test_loss: 0.9643, test_f1: 0.5425
 epoch: 52, train_loss: 0.7908, test_loss: 0.9391, test_f1: 0.5371
 epoch: 53, train_loss: 0.7897, test_loss: 0.9525, test_f1: 0.5513
 epoch: 54, train_loss: 0.7993, test_loss: 0.9449, test_f1: 0.5598
 epoch: 55, train_loss: 0.7749, test_loss: 0.9487, test_f1: 0.5446
 epoch: 56, train_loss: 0.7840, test_loss: 1.0172, test_f1: 0.5328
 epoch: 57, train_loss: 0.7670, test_loss: 0.9766, test_f1: 0.5603
 epoch: 58, train_loss: 0.7755, test_loss: 0.9813, test_f1: 0.5548
 epoch: 59, train_loss: 0.7719, test_loss: 0.9115, test_f1: 0.5760
 epoch: 60, train_loss: 0.7739, test_loss: 0.9796, test_f1: 0.5510
 epoch: 61, train_loss: 0.7488, test_loss: 0.9629, test_f1: 0.5848
 epoch: 62, train_loss: 0.7549, test_loss: 0.9866, test_f1: 0.5713
 epoch: 63, train_loss: 0.7644, test_loss: 0.9481, test_f1: 0.5650
 epoch: 64, train_loss: 0.7668, test_loss: 0.9994, test_f1: 0.5652
 epoch: 65, train_loss: 0.7572, test_loss: 0.9656, test_f1: 0.5748
 epoch: 66, train_loss: 0.7649, test_loss: 0.9375, test_f1: 0.5449
 epoch: 67, train_loss: 0.7702, test_loss: 0.9174, test_f1: 0.5693
 epoch: 68, train_loss: 0.7610, test_loss: 0.9419, test_f1: 0.5563
 epoch: 69, train_loss: 0.7503, test_loss: 0.9095, test_f1: 0.5969
 epoch: 70, train_loss: 0.7519, test_loss: 0.9563, test_f1: 0.5656
 epoch: 71, train_loss: 0.7584, test_loss: 0.9396, test_f1: 0.5875
 epoch: 72, train_loss: 0.7504, test_loss: 0.9628, test_f1: 0.5593
 epoch: 73, train_loss: 0.7604, test_loss: 1.0994, test_f1: 0.5430
 epoch: 74, train_loss: 0.7529, test_loss: 0.9522, test_f1: 0.5650
 epoch: 75, train_loss: 0.7309, test_loss: 1.0094, test_f1: 0.5844
 epoch: 76, train_loss: 0.7319, test_loss: 0.9596, test_f1: 0.5678
 epoch: 77, train_loss: 0.7236, test_loss: 0.9854, test_f1: 0.5587
 epoch: 78, train_loss: 0.7360, test_loss: 1.0112, test_f1: 0.5670
 epoch: 79, train_loss: 0.7337, test_loss: 0.9404, test_f1: 0.6032
 epoch: 80, train_loss: 0.7311, test_loss: 0.9890, test_f1: 0.5851
 epoch: 81, train_loss: 0.7591, test_loss: 1.2089, test_f1: 0.5281
 epoch: 82, train_loss: 0.7397, test_loss: 0.9291, test_f1: 0.5910
 epoch: 83, train_loss: 0.7293, test_loss: 0.9537, test_f1: 0.5684
 epoch: 84, train_loss: 0.7275, test_loss: 0.9512, test_f1: 0.6263
 epoch: 85, train_loss: 0.7388, test_loss: 0.9550, test_f1: 0.6037
 epoch: 86, train_loss: 0.7361, test_loss: 1.0001, test_f1: 0.5474
 epoch: 87, train_loss: 0.7205, test_loss: 0.9624, test_f1: 0.6281
 epoch: 88, train_loss: 0.7099, test_loss: 0.9269, test_f1: 0.5943
 epoch: 89, train_loss: 0.7167, test_loss: 0.9230, test_f1: 0.6092
 epoch: 90, train_loss: 0.7118, test_loss: 1.1294, test_f1: 0.5619
 epoch: 91, train_loss: 0.7324, test_loss: 0.9595, test_f1: 0.5842
 epoch: 92, train_loss: 0.7493, test_loss: 1.0686, test_f1: 0.5484
 epoch: 93, train_loss: 0.7353, test_loss: 0.9607, test_f1: 0.6017
 epoch: 94, train_loss: 0.7233, test_loss: 0.9751, test_f1: 0.5952
 epoch: 95, train_loss: 0.7309, test_loss: 1.0528, test_f1: 0.5729
 epoch: 96, train_loss: 0.7139, test_loss: 0.9258, test_f1: 0.6006
 epoch: 97, train_loss: 0.7073, test_loss: 0.9586, test_f1: 0.5852
 epoch: 98, train_loss: 0.7054, test_loss: 0.9405, test_f1: 0.6102
 epoch: 99, train_loss: 0.7259, test_loss: 0.9520, test_f1: 0.6025
##################ITERATION #6 ****************************************
 epoch: 0, train_loss: 1.5632, test_loss: 1.5644, test_f1: 0.2270
 epoch: 1, train_loss: 1.2486, test_loss: 1.3665, test_f1: 0.2270
 epoch: 2, train_loss: 1.1843, test_loss: 1.2199, test_f1: 0.2573
 epoch: 3, train_loss: 1.1328, test_loss: 1.1611, test_f1: 0.3496
 epoch: 4, train_loss: 1.0954, test_loss: 1.0778, test_f1: 0.3888
 epoch: 5, train_loss: 1.0645, test_loss: 1.0660, test_f1: 0.4234
 epoch: 6, train_loss: 1.0414, test_loss: 1.0525, test_f1: 0.4235
 epoch: 7, train_loss: 1.0227, test_loss: 1.0423, test_f1: 0.4026
 epoch: 8, train_loss: 1.0184, test_loss: 1.0669, test_f1: 0.3825
 epoch: 9, train_loss: 0.9845, test_loss: 1.0508, test_f1: 0.4645
 epoch: 10, train_loss: 0.9715, test_loss: 1.1225, test_f1: 0.4491
 epoch: 11, train_loss: 0.9636, test_loss: 1.0864, test_f1: 0.4392
 epoch: 12, train_loss: 0.9455, test_loss: 1.0865, test_f1: 0.4314
 epoch: 13, train_loss: 0.9498, test_loss: 1.0230, test_f1: 0.4331
 epoch: 14, train_loss: 0.9318, test_loss: 0.9977, test_f1: 0.4798
 epoch: 15, train_loss: 0.9546, test_loss: 1.0251, test_f1: 0.4773
 epoch: 16, train_loss: 0.9317, test_loss: 1.1017, test_f1: 0.4188
 epoch: 17, train_loss: 0.9373, test_loss: 1.0320, test_f1: 0.4832
 epoch: 18, train_loss: 0.9313, test_loss: 1.4179, test_f1: 0.3805
 epoch: 19, train_loss: 0.9282, test_loss: 1.0126, test_f1: 0.4694
 epoch: 20, train_loss: 0.9430, test_loss: 1.0310, test_f1: 0.4704
 epoch: 21, train_loss: 0.9248, test_loss: 1.0229, test_f1: 0.4899
 epoch: 22, train_loss: 0.9080, test_loss: 1.3681, test_f1: 0.3533
 epoch: 23, train_loss: 0.9022, test_loss: 0.9720, test_f1: 0.4731
 epoch: 24, train_loss: 0.9023, test_loss: 1.0388, test_f1: 0.4825
 epoch: 25, train_loss: 0.8917, test_loss: 1.0987, test_f1: 0.4498
 epoch: 26, train_loss: 0.8930, test_loss: 0.9913, test_f1: 0.5092
 epoch: 27, train_loss: 0.8948, test_loss: 1.1905, test_f1: 0.4275
 epoch: 28, train_loss: 0.8926, test_loss: 0.9860, test_f1: 0.4873
 epoch: 29, train_loss: 0.8849, test_loss: 0.9214, test_f1: 0.5477
 epoch: 30, train_loss: 0.8918, test_loss: 0.9732, test_f1: 0.4863
 epoch: 31, train_loss: 0.8812, test_loss: 0.9573, test_f1: 0.5021
 epoch: 32, train_loss: 0.8913, test_loss: 1.0571, test_f1: 0.4761
 epoch: 33, train_loss: 0.8777, test_loss: 1.0342, test_f1: 0.4995
 epoch: 34, train_loss: 0.8707, test_loss: 1.0075, test_f1: 0.5133
 epoch: 35, train_loss: 0.8850, test_loss: 0.9853, test_f1: 0.4678
 epoch: 36, train_loss: 0.8662, test_loss: 0.9000, test_f1: 0.5228
 epoch: 37, train_loss: 0.8607, test_loss: 1.0023, test_f1: 0.4973
 epoch: 38, train_loss: 0.8788, test_loss: 1.0067, test_f1: 0.5003
 epoch: 39, train_loss: 0.8633, test_loss: 1.0647, test_f1: 0.4873
 epoch: 40, train_loss: 0.8646, test_loss: 0.9705, test_f1: 0.5231
 epoch: 41, train_loss: 0.8698, test_loss: 0.9922, test_f1: 0.4992
 epoch: 42, train_loss: 0.8423, test_loss: 1.0030, test_f1: 0.5194
 epoch: 43, train_loss: 0.8610, test_loss: 0.9501, test_f1: 0.5374
 epoch: 44, train_loss: 0.8405, test_loss: 1.0657, test_f1: 0.4827
 epoch: 45, train_loss: 0.8458, test_loss: 0.9698, test_f1: 0.5078
 epoch: 46, train_loss: 0.8445, test_loss: 0.8893, test_f1: 0.5404
 epoch: 47, train_loss: 0.8551, test_loss: 0.9700, test_f1: 0.5137
 epoch: 48, train_loss: 0.8342, test_loss: 0.9331, test_f1: 0.5243
 epoch: 49, train_loss: 0.8421, test_loss: 0.9473, test_f1: 0.5185
 epoch: 50, train_loss: 0.8466, test_loss: 1.1135, test_f1: 0.4629
 epoch: 51, train_loss: 0.8409, test_loss: 0.9789, test_f1: 0.5048
 epoch: 52, train_loss: 0.8276, test_loss: 0.9789, test_f1: 0.5109
 epoch: 53, train_loss: 0.8231, test_loss: 0.9394, test_f1: 0.5495
 epoch: 54, train_loss: 0.8321, test_loss: 0.8925, test_f1: 0.5558
 epoch: 55, train_loss: 0.8137, test_loss: 0.9207, test_f1: 0.5837
 epoch: 56, train_loss: 0.8083, test_loss: 0.9439, test_f1: 0.5171
 epoch: 57, train_loss: 0.8046, test_loss: 0.9321, test_f1: 0.5333
 epoch: 58, train_loss: 0.8062, test_loss: 1.0098, test_f1: 0.5146
 epoch: 59, train_loss: 0.8093, test_loss: 0.9677, test_f1: 0.5054
 epoch: 60, train_loss: 0.8063, test_loss: 0.9306, test_f1: 0.5858
 epoch: 61, train_loss: 0.8021, test_loss: 0.9356, test_f1: 0.5837
 epoch: 62, train_loss: 0.8037, test_loss: 0.9556, test_f1: 0.5583
 epoch: 63, train_loss: 0.7976, test_loss: 1.0330, test_f1: 0.4994
 epoch: 64, train_loss: 0.7993, test_loss: 0.9115, test_f1: 0.5858
 epoch: 65, train_loss: 0.7990, test_loss: 1.0673, test_f1: 0.5080
 epoch: 66, train_loss: 0.7853, test_loss: 0.9234, test_f1: 0.5669
 epoch: 67, train_loss: 0.7977, test_loss: 0.9816, test_f1: 0.5146
 epoch: 68, train_loss: 0.8039, test_loss: 0.9592, test_f1: 0.5488
 epoch: 69, train_loss: 0.7981, test_loss: 0.9003, test_f1: 0.5951
 epoch: 70, train_loss: 0.7917, test_loss: 0.9839, test_f1: 0.5101
 epoch: 71, train_loss: 0.7843, test_loss: 0.9491, test_f1: 0.5636
 epoch: 72, train_loss: 0.7943, test_loss: 1.0113, test_f1: 0.5557
 epoch: 73, train_loss: 0.7982, test_loss: 0.8828, test_f1: 0.5965
 epoch: 74, train_loss: 0.7900, test_loss: 0.9809, test_f1: 0.5070
 epoch: 75, train_loss: 0.7807, test_loss: 0.8903, test_f1: 0.5866
 epoch: 76, train_loss: 0.7787, test_loss: 1.0933, test_f1: 0.5090
 epoch: 77, train_loss: 0.7732, test_loss: 0.8930, test_f1: 0.5951
 epoch: 78, train_loss: 0.7921, test_loss: 1.0893, test_f1: 0.4878
 epoch: 79, train_loss: 0.7886, test_loss: 0.9338, test_f1: 0.5948
 epoch: 80, train_loss: 0.7886, test_loss: 0.9055, test_f1: 0.5633
 epoch: 81, train_loss: 0.7785, test_loss: 0.9923, test_f1: 0.5161
 epoch: 82, train_loss: 0.7779, test_loss: 1.0276, test_f1: 0.5429
 epoch: 83, train_loss: 0.7736, test_loss: 0.9033, test_f1: 0.5819
 epoch: 84, train_loss: 0.7897, test_loss: 0.9560, test_f1: 0.5902
 epoch: 85, train_loss: 0.7731, test_loss: 0.9654, test_f1: 0.5522
 epoch: 86, train_loss: 0.7844, test_loss: 1.0505, test_f1: 0.5357
 epoch: 87, train_loss: 0.7748, test_loss: 0.9766, test_f1: 0.5648
 epoch: 88, train_loss: 0.7677, test_loss: 0.9241, test_f1: 0.5773
 epoch: 89, train_loss: 0.7712, test_loss: 0.9712, test_f1: 0.5756
 epoch: 90, train_loss: 0.7734, test_loss: 0.9505, test_f1: 0.5630
 epoch: 91, train_loss: 0.7584, test_loss: 0.9348, test_f1: 0.5900
 epoch: 92, train_loss: 0.7640, test_loss: 0.9942, test_f1: 0.5346
 epoch: 93, train_loss: 0.7661, test_loss: 0.9102, test_f1: 0.5494
 epoch: 94, train_loss: 0.7717, test_loss: 0.9509, test_f1: 0.5830
 epoch: 95, train_loss: 0.7652, test_loss: 0.9264, test_f1: 0.5819
 epoch: 96, train_loss: 0.7540, test_loss: 0.9061, test_f1: 0.5938
 epoch: 97, train_loss: 0.7568, test_loss: 1.0308, test_f1: 0.5044
 epoch: 98, train_loss: 0.7570, test_loss: 1.0352, test_f1: 0.5464
 epoch: 99, train_loss: 0.7629, test_loss: 0.9785, test_f1: 0.5460
##################ITERATION #7 ****************************************
 epoch: 0, train_loss: 1.3019, test_loss: 1.7695, test_f1: 0.2270
 epoch: 1, train_loss: 1.1284, test_loss: 1.2801, test_f1: 0.2439
 epoch: 2, train_loss: 1.0664, test_loss: 1.0717, test_f1: 0.3553
 epoch: 3, train_loss: 1.0276, test_loss: 1.0309, test_f1: 0.3707
 epoch: 4, train_loss: 0.9884, test_loss: 1.0773, test_f1: 0.3501
 epoch: 5, train_loss: 0.9774, test_loss: 0.9685, test_f1: 0.4772
 epoch: 6, train_loss: 0.9646, test_loss: 0.9207, test_f1: 0.5080
 epoch: 7, train_loss: 0.9461, test_loss: 0.9743, test_f1: 0.4818
 epoch: 8, train_loss: 0.9470, test_loss: 0.9993, test_f1: 0.4558
 epoch: 9, train_loss: 0.9374, test_loss: 0.9636, test_f1: 0.4763
 epoch: 10, train_loss: 0.9184, test_loss: 0.9345, test_f1: 0.5242
 epoch: 11, train_loss: 0.9138, test_loss: 1.1074, test_f1: 0.4810
 epoch: 12, train_loss: 0.9139, test_loss: 1.0143, test_f1: 0.4958
 epoch: 13, train_loss: 0.9104, test_loss: 0.9325, test_f1: 0.5157
 epoch: 14, train_loss: 0.8988, test_loss: 0.9796, test_f1: 0.4977
 epoch: 15, train_loss: 0.9083, test_loss: 0.9764, test_f1: 0.5039
 epoch: 16, train_loss: 0.8998, test_loss: 0.9716, test_f1: 0.5127
 epoch: 17, train_loss: 0.8919, test_loss: 1.0331, test_f1: 0.4864
 epoch: 18, train_loss: 0.8807, test_loss: 1.0421, test_f1: 0.4222
 epoch: 19, train_loss: 0.8890, test_loss: 0.9390, test_f1: 0.4901
 epoch: 20, train_loss: 0.8822, test_loss: 0.9710, test_f1: 0.5125
 epoch: 21, train_loss: 0.8784, test_loss: 0.8972, test_f1: 0.5133
 epoch: 22, train_loss: 0.8718, test_loss: 0.9250, test_f1: 0.5372
 epoch: 23, train_loss: 0.8916, test_loss: 0.9847, test_f1: 0.4924
 epoch: 24, train_loss: 0.8751, test_loss: 0.9748, test_f1: 0.5261
 epoch: 25, train_loss: 0.8604, test_loss: 0.9157, test_f1: 0.5381
 epoch: 26, train_loss: 0.8564, test_loss: 0.9452, test_f1: 0.5523
 epoch: 27, train_loss: 0.8568, test_loss: 1.0513, test_f1: 0.4946
 epoch: 28, train_loss: 0.8746, test_loss: 0.9748, test_f1: 0.5331
 epoch: 29, train_loss: 0.8792, test_loss: 0.9156, test_f1: 0.5420
 epoch: 30, train_loss: 0.8521, test_loss: 0.9627, test_f1: 0.5149
 epoch: 31, train_loss: 0.8455, test_loss: 0.9641, test_f1: 0.5147
 epoch: 32, train_loss: 0.8326, test_loss: 0.9190, test_f1: 0.5402
 epoch: 33, train_loss: 0.8307, test_loss: 1.0961, test_f1: 0.4706
 epoch: 34, train_loss: 0.8386, test_loss: 0.9269, test_f1: 0.5312
 epoch: 35, train_loss: 0.8419, test_loss: 1.0238, test_f1: 0.4945
 epoch: 36, train_loss: 0.8618, test_loss: 0.9873, test_f1: 0.5101
 epoch: 37, train_loss: 0.8495, test_loss: 1.0277, test_f1: 0.4687
 epoch: 38, train_loss: 0.8421, test_loss: 0.9559, test_f1: 0.5492
 epoch: 39, train_loss: 0.8368, test_loss: 0.9474, test_f1: 0.5225
 epoch: 40, train_loss: 0.8282, test_loss: 0.9959, test_f1: 0.5618
 epoch: 41, train_loss: 0.8270, test_loss: 0.9848, test_f1: 0.5142
 epoch: 42, train_loss: 0.8222, test_loss: 0.8350, test_f1: 0.5356
 epoch: 43, train_loss: 0.8173, test_loss: 1.0050, test_f1: 0.5343
 epoch: 44, train_loss: 0.8198, test_loss: 0.9786, test_f1: 0.5232
 epoch: 45, train_loss: 0.8245, test_loss: 0.8665, test_f1: 0.5792
 epoch: 46, train_loss: 0.8429, test_loss: 0.9609, test_f1: 0.5121
 epoch: 47, train_loss: 0.8334, test_loss: 1.0393, test_f1: 0.5120
 epoch: 48, train_loss: 0.8317, test_loss: 0.8962, test_f1: 0.5613
 epoch: 49, train_loss: 0.8264, test_loss: 0.9642, test_f1: 0.5429
 epoch: 50, train_loss: 0.8257, test_loss: 0.9787, test_f1: 0.5552
 epoch: 51, train_loss: 0.8035, test_loss: 0.9448, test_f1: 0.5584
 epoch: 52, train_loss: 0.7901, test_loss: 1.0778, test_f1: 0.5001
 epoch: 53, train_loss: 0.7962, test_loss: 0.9539, test_f1: 0.5337
 epoch: 54, train_loss: 0.7818, test_loss: 0.9213, test_f1: 0.5523
 epoch: 55, train_loss: 0.7668, test_loss: 0.9796, test_f1: 0.5730
 epoch: 56, train_loss: 0.7647, test_loss: 0.9696, test_f1: 0.5333
 epoch: 57, train_loss: 0.7787, test_loss: 0.9646, test_f1: 0.5695
 epoch: 58, train_loss: 0.7706, test_loss: 0.9404, test_f1: 0.5891
 epoch: 59, train_loss: 0.7794, test_loss: 0.8564, test_f1: 0.5452
 epoch: 60, train_loss: 0.7725, test_loss: 0.9810, test_f1: 0.5588
 epoch: 61, train_loss: 0.7637, test_loss: 1.0337, test_f1: 0.5286
 epoch: 62, train_loss: 0.7639, test_loss: 0.9806, test_f1: 0.5856
 epoch: 63, train_loss: 0.7686, test_loss: 0.8711, test_f1: 0.5821
 epoch: 64, train_loss: 0.7648, test_loss: 0.9478, test_f1: 0.5914
 epoch: 65, train_loss: 0.7527, test_loss: 1.0108, test_f1: 0.5414
 epoch: 66, train_loss: 0.7483, test_loss: 1.0792, test_f1: 0.5485
 epoch: 67, train_loss: 0.7587, test_loss: 0.9489, test_f1: 0.5633
 epoch: 68, train_loss: 0.7394, test_loss: 0.9777, test_f1: 0.5662
 epoch: 69, train_loss: 0.7482, test_loss: 1.0378, test_f1: 0.5322
 epoch: 70, train_loss: 0.7366, test_loss: 0.9772, test_f1: 0.5841
 epoch: 71, train_loss: 0.7323, test_loss: 0.9946, test_f1: 0.5507
 epoch: 72, train_loss: 0.7325, test_loss: 0.9895, test_f1: 0.5594
 epoch: 73, train_loss: 0.7451, test_loss: 0.9383, test_f1: 0.5578
 epoch: 74, train_loss: 0.7605, test_loss: 1.0804, test_f1: 0.5471
 epoch: 75, train_loss: 0.7345, test_loss: 0.9680, test_f1: 0.5824
 epoch: 76, train_loss: 0.7306, test_loss: 0.9901, test_f1: 0.5933
 epoch: 77, train_loss: 0.7376, test_loss: 1.0286, test_f1: 0.5565
 epoch: 78, train_loss: 0.7437, test_loss: 0.9762, test_f1: 0.5934
 epoch: 79, train_loss: 0.7391, test_loss: 0.9945, test_f1: 0.5542
 epoch: 80, train_loss: 0.7251, test_loss: 0.9485, test_f1: 0.5889
 epoch: 81, train_loss: 0.7368, test_loss: 1.0015, test_f1: 0.5646
 epoch: 82, train_loss: 0.7281, test_loss: 1.0271, test_f1: 0.5874
 epoch: 83, train_loss: 0.7206, test_loss: 1.1270, test_f1: 0.5928
 epoch: 84, train_loss: 0.7139, test_loss: 1.0200, test_f1: 0.5480
 epoch: 85, train_loss: 0.7218, test_loss: 0.9721, test_f1: 0.5926
 epoch: 86, train_loss: 0.7207, test_loss: 0.9782, test_f1: 0.5967
 epoch: 87, train_loss: 0.7180, test_loss: 1.1289, test_f1: 0.5894
 epoch: 88, train_loss: 0.7305, test_loss: 1.0727, test_f1: 0.5595
 epoch: 89, train_loss: 0.7252, test_loss: 1.0713, test_f1: 0.5682
 epoch: 90, train_loss: 0.7242, test_loss: 1.0065, test_f1: 0.5418
 epoch: 91, train_loss: 0.7113, test_loss: 1.0120, test_f1: 0.5704
 epoch: 92, train_loss: 0.7044, test_loss: 1.0096, test_f1: 0.6075
 epoch: 93, train_loss: 0.7151, test_loss: 0.9793, test_f1: 0.5768
 epoch: 94, train_loss: 0.7098, test_loss: 1.0340, test_f1: 0.5660
 epoch: 95, train_loss: 0.7243, test_loss: 1.0111, test_f1: 0.5387
 epoch: 96, train_loss: 0.7080, test_loss: 1.0385, test_f1: 0.5847
 epoch: 97, train_loss: 0.7106, test_loss: 1.0621, test_f1: 0.5805
 epoch: 98, train_loss: 0.6996, test_loss: 0.9682, test_f1: 0.5882
 epoch: 99, train_loss: 0.7138, test_loss: 0.9932, test_f1: 0.6068
##################ITERATION #8 ****************************************
 epoch: 0, train_loss: 1.3557, test_loss: 1.3598, test_f1: 0.2270
 epoch: 1, train_loss: 1.1203, test_loss: 1.1082, test_f1: 0.3573
 epoch: 2, train_loss: 1.0540, test_loss: 1.0473, test_f1: 0.3547
 epoch: 3, train_loss: 1.0289, test_loss: 1.0695, test_f1: 0.3533
 epoch: 4, train_loss: 1.0211, test_loss: 1.0448, test_f1: 0.3877
 epoch: 5, train_loss: 0.9933, test_loss: 1.0694, test_f1: 0.4788
 epoch: 6, train_loss: 0.9976, test_loss: 1.0711, test_f1: 0.4180
 epoch: 7, train_loss: 0.9740, test_loss: 1.0954, test_f1: 0.4257
 epoch: 8, train_loss: 0.9773, test_loss: 1.0391, test_f1: 0.4579
 epoch: 9, train_loss: 0.9767, test_loss: 1.3489, test_f1: 0.3277
 epoch: 10, train_loss: 0.9778, test_loss: 1.0007, test_f1: 0.5150
 epoch: 11, train_loss: 0.9550, test_loss: 0.9447, test_f1: 0.4895
 epoch: 12, train_loss: 0.9433, test_loss: 0.9446, test_f1: 0.4766
 epoch: 13, train_loss: 0.9300, test_loss: 0.9273, test_f1: 0.4603
 epoch: 14, train_loss: 0.9276, test_loss: 0.9828, test_f1: 0.5041
 epoch: 15, train_loss: 0.9362, test_loss: 0.9500, test_f1: 0.5012
 epoch: 16, train_loss: 0.9139, test_loss: 0.9652, test_f1: 0.4882
 epoch: 17, train_loss: 0.9091, test_loss: 0.9298, test_f1: 0.4982
 epoch: 18, train_loss: 0.9214, test_loss: 0.9709, test_f1: 0.4998
 epoch: 19, train_loss: 0.9027, test_loss: 0.9608, test_f1: 0.5048
 epoch: 20, train_loss: 0.8930, test_loss: 0.9565, test_f1: 0.5019
 epoch: 21, train_loss: 0.8890, test_loss: 1.0084, test_f1: 0.5241
 epoch: 22, train_loss: 0.8855, test_loss: 1.1070, test_f1: 0.4668
 epoch: 23, train_loss: 0.9151, test_loss: 0.9331, test_f1: 0.4717
 epoch: 24, train_loss: 0.8970, test_loss: 0.9533, test_f1: 0.5193
 epoch: 25, train_loss: 0.8698, test_loss: 0.9161, test_f1: 0.4968
 epoch: 26, train_loss: 0.8806, test_loss: 0.9514, test_f1: 0.4787
 epoch: 27, train_loss: 0.8766, test_loss: 0.9360, test_f1: 0.5393
 epoch: 28, train_loss: 0.8829, test_loss: 1.1921, test_f1: 0.4670
 epoch: 29, train_loss: 0.8883, test_loss: 1.0125, test_f1: 0.4890
 epoch: 30, train_loss: 0.8741, test_loss: 1.0791, test_f1: 0.4802
 epoch: 31, train_loss: 0.8675, test_loss: 0.9403, test_f1: 0.5232
 epoch: 32, train_loss: 0.8676, test_loss: 0.9044, test_f1: 0.5243
 epoch: 33, train_loss: 0.8542, test_loss: 0.9469, test_f1: 0.5391
 epoch: 34, train_loss: 0.8514, test_loss: 0.9972, test_f1: 0.5273
 epoch: 35, train_loss: 0.8435, test_loss: 0.9265, test_f1: 0.5704
 epoch: 36, train_loss: 0.8495, test_loss: 0.8947, test_f1: 0.5317
 epoch: 37, train_loss: 0.8324, test_loss: 0.9257, test_f1: 0.5597
 epoch: 38, train_loss: 0.8508, test_loss: 0.9743, test_f1: 0.5090
 epoch: 39, train_loss: 0.8426, test_loss: 0.9501, test_f1: 0.5191
 epoch: 40, train_loss: 0.8619, test_loss: 0.9953, test_f1: 0.4794
 epoch: 41, train_loss: 0.8291, test_loss: 0.9126, test_f1: 0.5660
 epoch: 42, train_loss: 0.8235, test_loss: 0.9847, test_f1: 0.5429
 epoch: 43, train_loss: 0.8196, test_loss: 0.9361, test_f1: 0.5537
 epoch: 44, train_loss: 0.8316, test_loss: 0.9174, test_f1: 0.5550
 epoch: 45, train_loss: 0.8312, test_loss: 0.9528, test_f1: 0.5249
 epoch: 46, train_loss: 0.8237, test_loss: 0.9005, test_f1: 0.5397
 epoch: 47, train_loss: 0.8210, test_loss: 0.8965, test_f1: 0.5598
 epoch: 48, train_loss: 0.8115, test_loss: 0.9235, test_f1: 0.5500
 epoch: 49, train_loss: 0.8026, test_loss: 0.9642, test_f1: 0.5103
 epoch: 50, train_loss: 0.8124, test_loss: 0.9450, test_f1: 0.5284
 epoch: 51, train_loss: 0.7913, test_loss: 0.9325, test_f1: 0.5641
 epoch: 52, train_loss: 0.7804, test_loss: 0.8948, test_f1: 0.5580
 epoch: 53, train_loss: 0.7855, test_loss: 0.9264, test_f1: 0.5478
 epoch: 54, train_loss: 0.7742, test_loss: 0.9087, test_f1: 0.5577
 epoch: 55, train_loss: 0.7735, test_loss: 0.8984, test_f1: 0.5712
 epoch: 56, train_loss: 0.7720, test_loss: 0.9095, test_f1: 0.5501
 epoch: 57, train_loss: 0.7597, test_loss: 0.8992, test_f1: 0.5582
 epoch: 58, train_loss: 0.7815, test_loss: 0.9086, test_f1: 0.5373
 epoch: 59, train_loss: 0.7640, test_loss: 0.9210, test_f1: 0.5587
 epoch: 60, train_loss: 0.7825, test_loss: 0.9441, test_f1: 0.5311
 epoch: 61, train_loss: 0.7634, test_loss: 0.9397, test_f1: 0.5520
 epoch: 62, train_loss: 0.7510, test_loss: 0.9303, test_f1: 0.5643
 epoch: 63, train_loss: 0.7597, test_loss: 0.9914, test_f1: 0.5776
 epoch: 64, train_loss: 0.7615, test_loss: 0.9263, test_f1: 0.5511
 epoch: 65, train_loss: 0.7744, test_loss: 0.9805, test_f1: 0.5407
 epoch: 66, train_loss: 0.7767, test_loss: 0.9372, test_f1: 0.5810
 epoch: 67, train_loss: 0.7733, test_loss: 0.9259, test_f1: 0.5507
 epoch: 68, train_loss: 0.7540, test_loss: 0.9444, test_f1: 0.5303
 epoch: 69, train_loss: 0.7642, test_loss: 1.0658, test_f1: 0.5122
 epoch: 70, train_loss: 0.7590, test_loss: 0.9444, test_f1: 0.5262
 epoch: 71, train_loss: 0.7501, test_loss: 0.9584, test_f1: 0.5554
 epoch: 72, train_loss: 0.7532, test_loss: 0.8993, test_f1: 0.6144
 epoch: 73, train_loss: 0.7376, test_loss: 1.0059, test_f1: 0.5432
 epoch: 74, train_loss: 0.7494, test_loss: 0.9220, test_f1: 0.5695
 epoch: 75, train_loss: 0.7459, test_loss: 0.9647, test_f1: 0.5371
 epoch: 76, train_loss: 0.7549, test_loss: 0.9066, test_f1: 0.5715
 epoch: 77, train_loss: 0.7398, test_loss: 0.9352, test_f1: 0.5608
 epoch: 78, train_loss: 0.7233, test_loss: 0.9641, test_f1: 0.5692
 epoch: 79, train_loss: 0.7446, test_loss: 0.9380, test_f1: 0.5971
 epoch: 80, train_loss: 0.7596, test_loss: 1.0144, test_f1: 0.5294
 epoch: 81, train_loss: 0.7413, test_loss: 0.9358, test_f1: 0.5791
 epoch: 82, train_loss: 0.7294, test_loss: 0.9687, test_f1: 0.5532
 epoch: 83, train_loss: 0.7356, test_loss: 0.9474, test_f1: 0.5677
 epoch: 84, train_loss: 0.7419, test_loss: 0.9797, test_f1: 0.5898
 epoch: 85, train_loss: 0.7443, test_loss: 1.0124, test_f1: 0.5355
 epoch: 86, train_loss: 0.7401, test_loss: 0.9869, test_f1: 0.5462
 epoch: 87, train_loss: 0.7321, test_loss: 0.9689, test_f1: 0.5601
 epoch: 88, train_loss: 0.7318, test_loss: 0.9436, test_f1: 0.5669
 epoch: 89, train_loss: 0.7416, test_loss: 0.9911, test_f1: 0.5762
 epoch: 90, train_loss: 0.7502, test_loss: 0.9472, test_f1: 0.5503
 epoch: 91, train_loss: 0.7413, test_loss: 0.9520, test_f1: 0.5887
 epoch: 92, train_loss: 0.7507, test_loss: 0.9568, test_f1: 0.5565
 epoch: 93, train_loss: 0.7103, test_loss: 0.9384, test_f1: 0.5926
 epoch: 94, train_loss: 0.7224, test_loss: 0.9912, test_f1: 0.5682
 epoch: 95, train_loss: 0.7258, test_loss: 0.9522, test_f1: 0.5649
 epoch: 96, train_loss: 0.7307, test_loss: 0.9655, test_f1: 0.5584
 epoch: 97, train_loss: 0.7234, test_loss: 0.9519, test_f1: 0.5927
 epoch: 98, train_loss: 0.7202, test_loss: 0.9809, test_f1: 0.5809
 epoch: 99, train_loss: 0.7262, test_loss: 0.9465, test_f1: 0.5684
##################ITERATION #9 ****************************************
 epoch: 0, train_loss: 1.3034, test_loss: 1.2898, test_f1: 0.2270
 epoch: 1, train_loss: 1.1288, test_loss: 1.1531, test_f1: 0.2747
 epoch: 2, train_loss: 1.0699, test_loss: 1.0423, test_f1: 0.4241
 epoch: 3, train_loss: 1.0434, test_loss: 1.0782, test_f1: 0.3952
 epoch: 4, train_loss: 1.0247, test_loss: 1.0462, test_f1: 0.4391
 epoch: 5, train_loss: 1.0013, test_loss: 1.0416, test_f1: 0.4857
 epoch: 6, train_loss: 0.9908, test_loss: 1.0785, test_f1: 0.4595
 epoch: 7, train_loss: 0.9836, test_loss: 1.0347, test_f1: 0.4789
 epoch: 8, train_loss: 0.9764, test_loss: 1.0667, test_f1: 0.4430
 epoch: 9, train_loss: 0.9624, test_loss: 0.9982, test_f1: 0.5005
 epoch: 10, train_loss: 0.9555, test_loss: 0.9870, test_f1: 0.5214
 epoch: 11, train_loss: 0.9455, test_loss: 1.0088, test_f1: 0.4748
 epoch: 12, train_loss: 0.9509, test_loss: 1.0696, test_f1: 0.4803
 epoch: 13, train_loss: 0.9476, test_loss: 1.0873, test_f1: 0.4254
 epoch: 14, train_loss: 0.9607, test_loss: 0.9961, test_f1: 0.5003
 epoch: 15, train_loss: 0.9469, test_loss: 0.9803, test_f1: 0.5073
 epoch: 16, train_loss: 0.9343, test_loss: 1.0320, test_f1: 0.4452
 epoch: 17, train_loss: 0.9290, test_loss: 0.9759, test_f1: 0.4865
 epoch: 18, train_loss: 0.9127, test_loss: 0.9624, test_f1: 0.5025
 epoch: 19, train_loss: 0.9186, test_loss: 0.9660, test_f1: 0.5049
 epoch: 20, train_loss: 0.9121, test_loss: 0.9616, test_f1: 0.5062
 epoch: 21, train_loss: 0.9049, test_loss: 0.9441, test_f1: 0.5241
 epoch: 22, train_loss: 0.9061, test_loss: 0.9581, test_f1: 0.5164
 epoch: 23, train_loss: 0.8961, test_loss: 0.9423, test_f1: 0.5160
 epoch: 24, train_loss: 0.8978, test_loss: 1.0032, test_f1: 0.4961
 epoch: 25, train_loss: 0.8859, test_loss: 0.9483, test_f1: 0.5077
 epoch: 26, train_loss: 0.8796, test_loss: 1.0156, test_f1: 0.4885
 epoch: 27, train_loss: 0.8885, test_loss: 0.9406, test_f1: 0.5559
 epoch: 28, train_loss: 0.8877, test_loss: 0.9596, test_f1: 0.5392
 epoch: 29, train_loss: 0.8880, test_loss: 1.0035, test_f1: 0.5038
 epoch: 30, train_loss: 0.8786, test_loss: 0.9262, test_f1: 0.5315
 epoch: 31, train_loss: 0.8809, test_loss: 0.9307, test_f1: 0.5192
 epoch: 32, train_loss: 0.8664, test_loss: 0.8815, test_f1: 0.5498
 epoch: 33, train_loss: 0.8625, test_loss: 0.9924, test_f1: 0.4769
 epoch: 34, train_loss: 0.8666, test_loss: 1.0378, test_f1: 0.4815
 epoch: 35, train_loss: 0.8681, test_loss: 0.9801, test_f1: 0.4852
 epoch: 36, train_loss: 0.8541, test_loss: 0.9747, test_f1: 0.5156
 epoch: 37, train_loss: 0.8542, test_loss: 0.9621, test_f1: 0.5071
 epoch: 38, train_loss: 0.8484, test_loss: 0.9322, test_f1: 0.5163
 epoch: 39, train_loss: 0.8439, test_loss: 0.9492, test_f1: 0.5154
 epoch: 40, train_loss: 0.8612, test_loss: 0.9863, test_f1: 0.5140
 epoch: 41, train_loss: 0.8336, test_loss: 0.9658, test_f1: 0.4810
 epoch: 42, train_loss: 0.8246, test_loss: 0.9440, test_f1: 0.5589
 epoch: 43, train_loss: 0.8286, test_loss: 0.9226, test_f1: 0.5171
 epoch: 44, train_loss: 0.8216, test_loss: 1.0358, test_f1: 0.5059
 epoch: 45, train_loss: 0.8198, test_loss: 0.9480, test_f1: 0.5197
 epoch: 46, train_loss: 0.8321, test_loss: 0.9346, test_f1: 0.5402
 epoch: 47, train_loss: 0.8266, test_loss: 0.9319, test_f1: 0.5095
 epoch: 48, train_loss: 0.8154, test_loss: 0.9112, test_f1: 0.5048
 epoch: 49, train_loss: 0.8338, test_loss: 0.9442, test_f1: 0.5300
 epoch: 50, train_loss: 0.8264, test_loss: 1.0123, test_f1: 0.4972
 epoch: 51, train_loss: 0.8038, test_loss: 0.8807, test_f1: 0.5433
 epoch: 52, train_loss: 0.7907, test_loss: 0.8868, test_f1: 0.5553
 epoch: 53, train_loss: 0.7962, test_loss: 0.9396, test_f1: 0.5357
 epoch: 54, train_loss: 0.7916, test_loss: 0.8793, test_f1: 0.5463
 epoch: 55, train_loss: 0.7896, test_loss: 0.8906, test_f1: 0.5683
 epoch: 56, train_loss: 0.7712, test_loss: 0.8986, test_f1: 0.5320
 epoch: 57, train_loss: 0.7709, test_loss: 0.9210, test_f1: 0.5427
 epoch: 58, train_loss: 0.7689, test_loss: 0.9298, test_f1: 0.5369
 epoch: 59, train_loss: 0.7651, test_loss: 0.8994, test_f1: 0.5459
 epoch: 60, train_loss: 0.7726, test_loss: 0.9058, test_f1: 0.5664
 epoch: 61, train_loss: 0.7699, test_loss: 0.8949, test_f1: 0.5403
 epoch: 62, train_loss: 0.7784, test_loss: 0.9732, test_f1: 0.5342
 epoch: 63, train_loss: 0.7623, test_loss: 0.8770, test_f1: 0.5461
 epoch: 64, train_loss: 0.7651, test_loss: 0.8836, test_f1: 0.5506
 epoch: 65, train_loss: 0.7730, test_loss: 0.8755, test_f1: 0.5646
 epoch: 66, train_loss: 0.7525, test_loss: 0.8823, test_f1: 0.5662
 epoch: 67, train_loss: 0.7492, test_loss: 0.9083, test_f1: 0.5237
 epoch: 68, train_loss: 0.7516, test_loss: 0.9409, test_f1: 0.5116
 epoch: 69, train_loss: 0.7460, test_loss: 0.9531, test_f1: 0.5431
 epoch: 70, train_loss: 0.7344, test_loss: 0.8906, test_f1: 0.5349
 epoch: 71, train_loss: 0.7478, test_loss: 0.8793, test_f1: 0.5960
 epoch: 72, train_loss: 0.7430, test_loss: 0.8896, test_f1: 0.5714
 epoch: 73, train_loss: 0.7508, test_loss: 0.8906, test_f1: 0.5638
 epoch: 74, train_loss: 0.7509, test_loss: 0.9190, test_f1: 0.5471
 epoch: 75, train_loss: 0.7525, test_loss: 1.0679, test_f1: 0.5147
 epoch: 76, train_loss: 0.7562, test_loss: 0.9191, test_f1: 0.5746
 epoch: 77, train_loss: 0.7420, test_loss: 0.9355, test_f1: 0.5350
 epoch: 78, train_loss: 0.7318, test_loss: 0.9096, test_f1: 0.5229
 epoch: 79, train_loss: 0.7278, test_loss: 0.8882, test_f1: 0.5427
 epoch: 80, train_loss: 0.7475, test_loss: 0.9004, test_f1: 0.5593
 epoch: 81, train_loss: 0.7232, test_loss: 0.8745, test_f1: 0.5421
 epoch: 82, train_loss: 0.7307, test_loss: 0.9002, test_f1: 0.5378
 epoch: 83, train_loss: 0.7358, test_loss: 0.9014, test_f1: 0.5621
 epoch: 84, train_loss: 0.7379, test_loss: 0.9097, test_f1: 0.5530
 epoch: 85, train_loss: 0.7277, test_loss: 0.9400, test_f1: 0.5122
 epoch: 86, train_loss: 0.7171, test_loss: 0.9260, test_f1: 0.5568
 epoch: 87, train_loss: 0.7219, test_loss: 1.0079, test_f1: 0.5387
 epoch: 88, train_loss: 0.7304, test_loss: 0.8987, test_f1: 0.5887
 epoch: 89, train_loss: 0.7507, test_loss: 0.9066, test_f1: 0.5532
 epoch: 90, train_loss: 0.7350, test_loss: 0.9411, test_f1: 0.5860
 epoch: 91, train_loss: 0.7294, test_loss: 0.9095, test_f1: 0.5742
 epoch: 92, train_loss: 0.7325, test_loss: 0.9255, test_f1: 0.5303
 epoch: 93, train_loss: 0.7093, test_loss: 0.8724, test_f1: 0.5870
 epoch: 94, train_loss: 0.7178, test_loss: 0.9318, test_f1: 0.5486
 epoch: 95, train_loss: 0.7367, test_loss: 0.9112, test_f1: 0.5891
 epoch: 96, train_loss: 0.7369, test_loss: 0.8667, test_f1: 0.6011
 epoch: 97, train_loss: 0.7282, test_loss: 0.9916, test_f1: 0.5154
 epoch: 98, train_loss: 0.7128, test_loss: 0.8977, test_f1: 0.6096
 epoch: 99, train_loss: 0.7161, test_loss: 0.9644, test_f1: 0.5919

Training completed in 386.20 seconds
Best F1: 0.6281 at epoch 87
Mean F1 across iterations: 0.6062  0.0149
========================FINAL RESULTS================================
FEGIN weighted F1: 0.6281  0.0149
python main.py --data ltspice_examples --representation component_net --model FEGIN --layers 3 --hiddens 16 --batch_size 256 --lr 0.01 --emb_size 250 --epochs 100 --save_appendix component_net_L3_H16_BS256_LR0.01_E250 --no_val
-----



STDERR:
  File "main.py", line 370, in <module>
    main()
  File "main.py", line 254, in main
    dataset = dataset_class(
  File "/home/philip/projects/ltspice_examples_code_repo/Circuit-Completion-Using-GNNs/component_classification_with_link_prediction_head/evaluation/FEGIN/kernel/circuit_datasets.py", line 15, in __init__
    self.data, self.slices = torch.load(self.processed_paths[0])
  File "/home/philip/.local/lib/python3.8/site-packages/torch/serialization.py", line 1040, in load
    warnings.warn(
  File "/usr/lib/python3.8/warnings.py", line 109, in _showwarnmsg
    sw(msg.message, msg.category, msg.filename, msg.lineno,
  File "main.py", line 47, in warn_with_traceback
    traceback.print_stack(file=log)
/home/philip/projects/ltspice_examples_code_repo/Circuit-Completion-Using-GNNs/component_classification_with_link_prediction_head/evaluation/FEGIN/kernel/circuit_datasets.py:15: FutureWarning: You are using `torch.load` with `weights_only=False` (the current default value), which uses the default pickle module implicitly. It is possible to construct malicious pickle data which will execute arbitrary code during unpickling (See https://github.com/pytorch/pytorch/blob/main/SECURITY.md#untrusted-models for more details). In a future release, the default value for `weights_only` will be flipped to `True`. This limits the functions that could be executed during unpickling. Arbitrary objects will no longer be allowed to be loaded via this mode unless they are explicitly allowlisted by the user via `torch.serialization.add_safe_globals`. We recommend you start setting `weights_only=True` for any use case where you don't have full control of the loaded file. Please open an issue on GitHub for any issues related to this experimental feature.
  self.data, self.slices = torch.load(self.processed_paths[0])
