STDOUT:
Results will be saved in /home/philip/projects/ltspice_examples_code_repo/Circuit-Completion-Using-GNNs/component_classification_with_link_prediction_head/evaluation/FEGIN/results/model_FEGIN_dataset_ltspice_demos
Command line input: python main.py --data ltspice_demos --representation component_pin_net --model FEGIN --layers 2 --hiddens 32 --batch_size 256 --lr 0.1 --emb_size 250 --epochs 100 --save_appendix component_pin_net_L2_H32_BS256_LR0.1_E250 --no_val
 is saved.
-----
ltspice_demos - FEGIN
Using 2 layers, 32 hidden units, h = 2
Loading component_pin_net representation dataset
ENTERED
Training FEGIN on component_pin_net representation
Train: 1565, Test: 383
##################ITERATION #0 ****************************************
 epoch: 0, train_loss: 1.2932, test_loss: 32.8505, test_f1: 0.0301
 epoch: 1, train_loss: 1.1111, test_loss: 17.6870, test_f1: 0.0301
 epoch: 2, train_loss: 1.0743, test_loss: 8.0671, test_f1: 0.1285
 epoch: 3, train_loss: 1.0475, test_loss: 1.2617, test_f1: 0.3720
 epoch: 4, train_loss: 1.0461, test_loss: 1.2793, test_f1: 0.2951
 epoch: 5, train_loss: 1.0404, test_loss: 1.1198, test_f1: 0.3485
 epoch: 6, train_loss: 1.0399, test_loss: 1.1113, test_f1: 0.4212
 epoch: 7, train_loss: 1.0242, test_loss: 1.1647, test_f1: 0.4126
 epoch: 8, train_loss: 1.0446, test_loss: 1.1162, test_f1: 0.3400
 epoch: 9, train_loss: 1.0206, test_loss: 1.1089, test_f1: 0.3502
 epoch: 10, train_loss: 1.0183, test_loss: 1.1340, test_f1: 0.3409
 epoch: 11, train_loss: 1.0214, test_loss: 1.1423, test_f1: 0.3290
 epoch: 12, train_loss: 1.0059, test_loss: 1.3502, test_f1: 0.3277
 epoch: 13, train_loss: 1.0124, test_loss: 1.0893, test_f1: 0.3395
 epoch: 14, train_loss: 0.9850, test_loss: 1.1458, test_f1: 0.3595
 epoch: 15, train_loss: 1.0074, test_loss: 1.1129, test_f1: 0.4429
 epoch: 16, train_loss: 1.0256, test_loss: 1.1198, test_f1: 0.3292
 epoch: 17, train_loss: 1.0184, test_loss: 1.1058, test_f1: 0.4340
 epoch: 18, train_loss: 0.9995, test_loss: 1.1901, test_f1: 0.4495
 epoch: 19, train_loss: 0.9962, test_loss: 1.0447, test_f1: 0.3420
 epoch: 20, train_loss: 1.0015, test_loss: 1.1026, test_f1: 0.4005
 epoch: 21, train_loss: 1.0054, test_loss: 1.0610, test_f1: 0.3560
 epoch: 22, train_loss: 0.9811, test_loss: 6.6385, test_f1: 0.3024
 epoch: 23, train_loss: 0.9699, test_loss: 1.0693, test_f1: 0.3341
 epoch: 24, train_loss: 0.9932, test_loss: 1.0895, test_f1: 0.3855
 epoch: 25, train_loss: 0.9744, test_loss: 1.0276, test_f1: 0.3492
 epoch: 26, train_loss: 0.9613, test_loss: 1.0958, test_f1: 0.3529
 epoch: 27, train_loss: 0.9882, test_loss: 1.6626, test_f1: 0.3085
 epoch: 28, train_loss: 0.9892, test_loss: 1.3150, test_f1: 0.3756
 epoch: 29, train_loss: 0.9809, test_loss: 1.2320, test_f1: 0.3482
 epoch: 30, train_loss: 1.0203, test_loss: 1.0941, test_f1: 0.3295
 epoch: 31, train_loss: 1.0414, test_loss: 1.0972, test_f1: 0.3344
 epoch: 32, train_loss: 1.0067, test_loss: 1.0838, test_f1: 0.3939
 epoch: 33, train_loss: 1.0101, test_loss: 1.0559, test_f1: 0.3685
 epoch: 34, train_loss: 1.0154, test_loss: 1.0622, test_f1: 0.4595
 epoch: 35, train_loss: 1.0126, test_loss: 1.0729, test_f1: 0.3612
 epoch: 36, train_loss: 1.0016, test_loss: 1.0886, test_f1: 0.3405
 epoch: 37, train_loss: 0.9969, test_loss: 1.6738, test_f1: 0.3379
 epoch: 38, train_loss: 1.0276, test_loss: 1.0203, test_f1: 0.4186
 epoch: 39, train_loss: 1.0262, test_loss: 1.0706, test_f1: 0.3344
 epoch: 40, train_loss: 0.9973, test_loss: 1.0669, test_f1: 0.3395
 epoch: 41, train_loss: 0.9834, test_loss: 1.3250, test_f1: 0.3322
 epoch: 42, train_loss: 1.0060, test_loss: 1.1258, test_f1: 0.3344
 epoch: 43, train_loss: 0.9824, test_loss: 1.1464, test_f1: 0.3352
 epoch: 44, train_loss: 0.9813, test_loss: 1.1928, test_f1: 0.3344
 epoch: 45, train_loss: 1.0026, test_loss: 1.1692, test_f1: 0.3444
 epoch: 46, train_loss: 0.9722, test_loss: 1.0977, test_f1: 0.2985
 epoch: 47, train_loss: 0.9983, test_loss: 1.4583, test_f1: 0.2491
 epoch: 48, train_loss: 1.0033, test_loss: 1.2231, test_f1: 0.3196
 epoch: 49, train_loss: 0.9781, test_loss: 1.0407, test_f1: 0.4724
 epoch: 50, train_loss: 0.9746, test_loss: 1.0544, test_f1: 0.3444
 epoch: 51, train_loss: 0.9863, test_loss: 1.1364, test_f1: 0.3395
 epoch: 52, train_loss: 0.9694, test_loss: 1.1101, test_f1: 0.3395
 epoch: 53, train_loss: 0.9782, test_loss: 1.0780, test_f1: 0.3943
 epoch: 54, train_loss: 0.9540, test_loss: 1.2036, test_f1: 0.4357
 epoch: 55, train_loss: 0.9565, test_loss: 1.1535, test_f1: 0.4648
 epoch: 56, train_loss: 0.9518, test_loss: 1.0513, test_f1: 0.4772
 epoch: 57, train_loss: 0.9817, test_loss: 1.0758, test_f1: 0.4259
 epoch: 58, train_loss: 0.9783, test_loss: 1.2590, test_f1: 0.3312
 epoch: 59, train_loss: 0.9638, test_loss: 1.1770, test_f1: 0.4410
 epoch: 60, train_loss: 0.9555, test_loss: 1.1514, test_f1: 0.4532
 epoch: 61, train_loss: 0.9767, test_loss: 1.0827, test_f1: 0.3344
 epoch: 62, train_loss: 0.9842, test_loss: 1.0826, test_f1: 0.3344
 epoch: 63, train_loss: 0.9758, test_loss: 1.0543, test_f1: 0.4058
 epoch: 64, train_loss: 0.9672, test_loss: 1.0506, test_f1: 0.3461
 epoch: 65, train_loss: 0.9539, test_loss: 1.0211, test_f1: 0.3838
 epoch: 66, train_loss: 0.9619, test_loss: 1.0189, test_f1: 0.3484
 epoch: 67, train_loss: 0.9551, test_loss: 1.1112, test_f1: 0.3371
 epoch: 68, train_loss: 0.9744, test_loss: 1.0422, test_f1: 0.3604
 epoch: 69, train_loss: 0.9670, test_loss: 1.0670, test_f1: 0.4338
 epoch: 70, train_loss: 0.9546, test_loss: 1.0501, test_f1: 0.4319
 epoch: 71, train_loss: 0.9613, test_loss: 1.0869, test_f1: 0.3544
 epoch: 72, train_loss: 0.9675, test_loss: 1.1061, test_f1: 0.3476
 epoch: 73, train_loss: 0.9668, test_loss: 1.0282, test_f1: 0.3527
 epoch: 74, train_loss: 0.9645, test_loss: 1.0293, test_f1: 0.3491
 epoch: 75, train_loss: 0.9705, test_loss: 1.0208, test_f1: 0.4012
 epoch: 76, train_loss: 0.9555, test_loss: 1.0796, test_f1: 0.4319
 epoch: 77, train_loss: 0.9512, test_loss: 1.1864, test_f1: 0.4233
 epoch: 78, train_loss: 0.9443, test_loss: 1.0723, test_f1: 0.4315
 epoch: 79, train_loss: 0.9417, test_loss: 1.1094, test_f1: 0.4004
 epoch: 80, train_loss: 0.9318, test_loss: 1.0422, test_f1: 0.3460
 epoch: 81, train_loss: 0.9362, test_loss: 1.0887, test_f1: 0.3507
 epoch: 82, train_loss: 0.9465, test_loss: 1.2330, test_f1: 0.3491
 epoch: 83, train_loss: 0.9485, test_loss: 1.0885, test_f1: 0.5185
 epoch: 84, train_loss: 0.9622, test_loss: 1.1089, test_f1: 0.5087
 epoch: 85, train_loss: 0.9413, test_loss: 1.1711, test_f1: 0.3638
 epoch: 86, train_loss: 0.9361, test_loss: 1.2042, test_f1: 0.3780
 epoch: 87, train_loss: 0.9313, test_loss: 1.1677, test_f1: 0.4777
 epoch: 88, train_loss: 0.9915, test_loss: 1.5111, test_f1: 0.3819
 epoch: 89, train_loss: 0.9873, test_loss: 1.3773, test_f1: 0.3529
 epoch: 90, train_loss: 0.9747, test_loss: 1.0685, test_f1: 0.4838
 epoch: 91, train_loss: 0.9792, test_loss: 1.0755, test_f1: 0.3304
 epoch: 92, train_loss: 0.9737, test_loss: 1.0258, test_f1: 0.3407
 epoch: 93, train_loss: 0.9646, test_loss: 1.0237, test_f1: 0.3448
 epoch: 94, train_loss: 0.9570, test_loss: 1.0534, test_f1: 0.4059
 epoch: 95, train_loss: 0.9496, test_loss: 1.0709, test_f1: 0.4013
 epoch: 96, train_loss: 0.9592, test_loss: 1.0054, test_f1: 0.4349
 epoch: 97, train_loss: 0.9366, test_loss: 1.0011, test_f1: 0.4920
 epoch: 98, train_loss: 0.9372, test_loss: 1.0087, test_f1: 0.4206
 epoch: 99, train_loss: 0.9383, test_loss: 1.0204, test_f1: 0.4760
##################ITERATION #1 ****************************************
 epoch: 0, train_loss: 1.3472, test_loss: 4.5602, test_f1: 0.1365
 epoch: 1, train_loss: 1.2450, test_loss: 1.5004, test_f1: 0.1365
 epoch: 2, train_loss: 1.2344, test_loss: 1.7229, test_f1: 0.1371
 epoch: 3, train_loss: 1.1973, test_loss: 2.2924, test_f1: 0.1379
 epoch: 4, train_loss: 1.1241, test_loss: 2.2385, test_f1: 0.1382
 epoch: 5, train_loss: 1.1416, test_loss: 1.6103, test_f1: 0.3363
 epoch: 6, train_loss: 1.0770, test_loss: 1.3381, test_f1: 0.2441
 epoch: 7, train_loss: 1.0761, test_loss: 1.8584, test_f1: 0.2448
 epoch: 8, train_loss: 1.0576, test_loss: 10.2067, test_f1: 0.1167
 epoch: 9, train_loss: 1.0419, test_loss: 2.1507, test_f1: 0.2343
 epoch: 10, train_loss: 1.0407, test_loss: 1.0975, test_f1: 0.3895
 epoch: 11, train_loss: 1.0172, test_loss: 1.0897, test_f1: 0.3317
 epoch: 12, train_loss: 0.9989, test_loss: 1.1183, test_f1: 0.4390
 epoch: 13, train_loss: 0.9887, test_loss: 1.1302, test_f1: 0.4022
 epoch: 14, train_loss: 1.0227, test_loss: 1.1025, test_f1: 0.4308
 epoch: 15, train_loss: 1.0079, test_loss: 1.1080, test_f1: 0.3290
 epoch: 16, train_loss: 0.9891, test_loss: 1.0640, test_f1: 0.4086
 epoch: 17, train_loss: 1.0182, test_loss: 1.1310, test_f1: 0.4609
 epoch: 18, train_loss: 1.0153, test_loss: 1.1859, test_f1: 0.3256
 epoch: 19, train_loss: 0.9887, test_loss: 1.1106, test_f1: 0.3344
 epoch: 20, train_loss: 0.9758, test_loss: 1.1098, test_f1: 0.5462
 epoch: 21, train_loss: 0.9999, test_loss: 1.1306, test_f1: 0.3827
 epoch: 22, train_loss: 0.9942, test_loss: 1.0314, test_f1: 0.4531
 epoch: 23, train_loss: 0.9826, test_loss: 1.2106, test_f1: 0.3348
 epoch: 24, train_loss: 0.9974, test_loss: 1.0660, test_f1: 0.3772
 epoch: 25, train_loss: 0.9962, test_loss: 1.1555, test_f1: 0.4368
 epoch: 26, train_loss: 0.9821, test_loss: 1.1333, test_f1: 0.4353
 epoch: 27, train_loss: 0.9560, test_loss: 1.2131, test_f1: 0.4213
 epoch: 28, train_loss: 0.9477, test_loss: 1.4261, test_f1: 0.3613
 epoch: 29, train_loss: 0.9511, test_loss: 1.0711, test_f1: 0.4497
 epoch: 30, train_loss: 0.9768, test_loss: 1.1114, test_f1: 0.4056
 epoch: 31, train_loss: 0.9590, test_loss: 1.1522, test_f1: 0.3818
 epoch: 32, train_loss: 0.9798, test_loss: 3.8257, test_f1: 0.3309
 epoch: 33, train_loss: 0.9919, test_loss: 1.1678, test_f1: 0.3820
 epoch: 34, train_loss: 0.9226, test_loss: 1.0298, test_f1: 0.5571
 epoch: 35, train_loss: 0.9804, test_loss: 1.2495, test_f1: 0.1830
 epoch: 36, train_loss: 0.9615, test_loss: 1.0797, test_f1: 0.4583
 epoch: 37, train_loss: 0.9779, test_loss: 1.0985, test_f1: 0.4381
 epoch: 38, train_loss: 0.9800, test_loss: 2.3057, test_f1: 0.3838
 epoch: 39, train_loss: 0.9720, test_loss: 2.4555, test_f1: 0.3392
 epoch: 40, train_loss: 1.0018, test_loss: 1.5141, test_f1: 0.4568
 epoch: 41, train_loss: 0.9879, test_loss: 1.0446, test_f1: 0.4184
 epoch: 42, train_loss: 0.9690, test_loss: 1.0396, test_f1: 0.5547
 epoch: 43, train_loss: 0.9541, test_loss: 1.0281, test_f1: 0.4250
 epoch: 44, train_loss: 0.9284, test_loss: 1.0317, test_f1: 0.5540
 epoch: 45, train_loss: 0.9455, test_loss: 1.0564, test_f1: 0.4120
 epoch: 46, train_loss: 0.9598, test_loss: 1.0747, test_f1: 0.4613
 epoch: 47, train_loss: 0.9337, test_loss: 1.0750, test_f1: 0.4386
 epoch: 48, train_loss: 0.9103, test_loss: 1.3809, test_f1: 0.2195
 epoch: 49, train_loss: 0.9128, test_loss: 1.0674, test_f1: 0.4175
 epoch: 50, train_loss: 0.9751, test_loss: 1.1599, test_f1: 0.4732
 epoch: 51, train_loss: 0.9454, test_loss: 1.7138, test_f1: 0.3544
 epoch: 52, train_loss: 0.9191, test_loss: 1.1088, test_f1: 0.4317
 epoch: 53, train_loss: 0.9138, test_loss: 1.1283, test_f1: 0.4127
 epoch: 54, train_loss: 0.9089, test_loss: 1.0888, test_f1: 0.4494
 epoch: 55, train_loss: 0.9110, test_loss: 1.0338, test_f1: 0.4732
 epoch: 56, train_loss: 0.8804, test_loss: 1.1017, test_f1: 0.4153
 epoch: 57, train_loss: 0.8668, test_loss: 1.0291, test_f1: 0.4489
 epoch: 58, train_loss: 0.8705, test_loss: 1.1027, test_f1: 0.5530
 epoch: 59, train_loss: 0.8666, test_loss: 1.2699, test_f1: 0.5552
 epoch: 60, train_loss: 0.8571, test_loss: 1.6673, test_f1: 0.4020
 epoch: 61, train_loss: 0.8706, test_loss: 2.2496, test_f1: 0.3626
 epoch: 62, train_loss: 0.8568, test_loss: 1.1394, test_f1: 0.4560
 epoch: 63, train_loss: 0.8715, test_loss: 1.0415, test_f1: 0.4466
 epoch: 64, train_loss: 0.8676, test_loss: 1.0823, test_f1: 0.4299
 epoch: 65, train_loss: 0.8701, test_loss: 1.4898, test_f1: 0.4417
 epoch: 66, train_loss: 0.8597, test_loss: 0.9955, test_f1: 0.4593
 epoch: 67, train_loss: 0.8511, test_loss: 1.0038, test_f1: 0.5457
 epoch: 68, train_loss: 0.8296, test_loss: 1.2825, test_f1: 0.4900
 epoch: 69, train_loss: 0.8387, test_loss: 1.4682, test_f1: 0.4009
 epoch: 70, train_loss: 0.8372, test_loss: 1.2470, test_f1: 0.5349
 epoch: 71, train_loss: 0.8461, test_loss: 1.1136, test_f1: 0.5202
 epoch: 72, train_loss: 0.8378, test_loss: 1.0416, test_f1: 0.4183
 epoch: 73, train_loss: 0.8120, test_loss: 1.0023, test_f1: 0.4789
 epoch: 74, train_loss: 0.8304, test_loss: 0.9850, test_f1: 0.4558
 epoch: 75, train_loss: 0.8398, test_loss: 2.1820, test_f1: 0.3790
 epoch: 76, train_loss: 0.8203, test_loss: 1.4723, test_f1: 0.4711
 epoch: 77, train_loss: 0.8277, test_loss: 1.1896, test_f1: 0.5566
 epoch: 78, train_loss: 0.8270, test_loss: 1.2162, test_f1: 0.3914
 epoch: 79, train_loss: 0.8237, test_loss: 2.3951, test_f1: 0.4618
 epoch: 80, train_loss: 0.8227, test_loss: 1.0097, test_f1: 0.4442
 epoch: 81, train_loss: 0.8266, test_loss: 1.8884, test_f1: 0.4411
 epoch: 82, train_loss: 0.8288, test_loss: 0.9980, test_f1: 0.5561
 epoch: 83, train_loss: 0.8262, test_loss: 1.4602, test_f1: 0.4539
 epoch: 84, train_loss: 0.8176, test_loss: 1.5957, test_f1: 0.4617
 epoch: 85, train_loss: 0.8031, test_loss: 1.3371, test_f1: 0.5696
 epoch: 86, train_loss: 0.8138, test_loss: 1.7241, test_f1: 0.4610
 epoch: 87, train_loss: 0.8079, test_loss: 1.5049, test_f1: 0.4734
 epoch: 88, train_loss: 0.8634, test_loss: 2.2373, test_f1: 0.4091
 epoch: 89, train_loss: 0.8771, test_loss: 0.9808, test_f1: 0.5983
 epoch: 90, train_loss: 0.8120, test_loss: 1.0093, test_f1: 0.5239
 epoch: 91, train_loss: 0.8241, test_loss: 1.4938, test_f1: 0.4112
 epoch: 92, train_loss: 0.8268, test_loss: 1.2639, test_f1: 0.4224
 epoch: 93, train_loss: 0.8216, test_loss: 1.4915, test_f1: 0.5454
 epoch: 94, train_loss: 0.7992, test_loss: 1.3060, test_f1: 0.4893
 epoch: 95, train_loss: 0.7886, test_loss: 1.3481, test_f1: 0.5418
 epoch: 96, train_loss: 0.7924, test_loss: 1.6561, test_f1: 0.5630
 epoch: 97, train_loss: 0.7919, test_loss: 1.9645, test_f1: 0.5040
 epoch: 98, train_loss: 0.7944, test_loss: 1.8196, test_f1: 0.4960
 epoch: 99, train_loss: 0.8108, test_loss: 1.8640, test_f1: 0.4513
##################ITERATION #2 ****************************************
 epoch: 0, train_loss: 1.7216, test_loss: 2.7071, test_f1: 0.1365
 epoch: 1, train_loss: 1.2652, test_loss: 1.4191, test_f1: 0.2281
 epoch: 2, train_loss: 1.2806, test_loss: 1.3369, test_f1: 0.2281
 epoch: 3, train_loss: 1.2178, test_loss: 1.3677, test_f1: 0.2281
 epoch: 4, train_loss: 1.2139, test_loss: 1.3108, test_f1: 0.2285
 epoch: 5, train_loss: 1.1839, test_loss: 1.2484, test_f1: 0.2692
 epoch: 6, train_loss: 1.1450, test_loss: 1.1561, test_f1: 0.3610
 epoch: 7, train_loss: 1.1175, test_loss: 1.1546, test_f1: 0.3754
 epoch: 8, train_loss: 1.0717, test_loss: 1.1690, test_f1: 0.3364
 epoch: 9, train_loss: 1.0312, test_loss: 2.9651, test_f1: 0.2646
 epoch: 10, train_loss: 1.0216, test_loss: 2.5225, test_f1: 0.2431
 epoch: 11, train_loss: 1.0177, test_loss: 1.7467, test_f1: 0.2479
 epoch: 12, train_loss: 1.0256, test_loss: 1.4347, test_f1: 0.2660
 epoch: 13, train_loss: 1.0530, test_loss: 1.1093, test_f1: 0.3774
 epoch: 14, train_loss: 1.0148, test_loss: 1.1405, test_f1: 0.3696
 epoch: 15, train_loss: 1.0032, test_loss: 1.1892, test_f1: 0.3658
 epoch: 16, train_loss: 0.9848, test_loss: 1.2732, test_f1: 0.3265
 epoch: 17, train_loss: 0.9917, test_loss: 1.1374, test_f1: 0.4036
 epoch: 18, train_loss: 0.9773, test_loss: 1.0416, test_f1: 0.4223
 epoch: 19, train_loss: 0.9815, test_loss: 1.1606, test_f1: 0.4315
 epoch: 20, train_loss: 0.9932, test_loss: 1.1429, test_f1: 0.4158
 epoch: 21, train_loss: 1.0465, test_loss: 1.0414, test_f1: 0.4379
 epoch: 22, train_loss: 0.9742, test_loss: 1.3820, test_f1: 0.3806
 epoch: 23, train_loss: 0.9750, test_loss: 1.0580, test_f1: 0.4159
 epoch: 24, train_loss: 0.9422, test_loss: 1.1690, test_f1: 0.3889
 epoch: 25, train_loss: 0.9627, test_loss: 1.0709, test_f1: 0.4211
 epoch: 26, train_loss: 0.9639, test_loss: 1.1649, test_f1: 0.3671
 epoch: 27, train_loss: 0.9579, test_loss: 1.6613, test_f1: 0.3433
 epoch: 28, train_loss: 0.9513, test_loss: 1.1638, test_f1: 0.3843
 epoch: 29, train_loss: 0.9327, test_loss: 1.1589, test_f1: 0.4137
 epoch: 30, train_loss: 0.9180, test_loss: 1.0297, test_f1: 0.4735
 epoch: 31, train_loss: 0.9153, test_loss: 1.0548, test_f1: 0.4102
 epoch: 32, train_loss: 0.9354, test_loss: 1.2285, test_f1: 0.3841
 epoch: 33, train_loss: 0.9440, test_loss: 1.0236, test_f1: 0.4348
 epoch: 34, train_loss: 0.9379, test_loss: 1.1029, test_f1: 0.4135
 epoch: 35, train_loss: 0.9112, test_loss: 1.1462, test_f1: 0.3909
 epoch: 36, train_loss: 0.9141, test_loss: 1.0733, test_f1: 0.4116
 epoch: 37, train_loss: 0.8979, test_loss: 1.0455, test_f1: 0.4248
 epoch: 38, train_loss: 0.8855, test_loss: 1.0716, test_f1: 0.4236
 epoch: 39, train_loss: 0.9236, test_loss: 1.2190, test_f1: 0.3626
 epoch: 40, train_loss: 1.1479, test_loss: 1.3823, test_f1: 0.2939
 epoch: 41, train_loss: 1.0486, test_loss: 1.5653, test_f1: 0.3082
 epoch: 42, train_loss: 0.9882, test_loss: 1.7378, test_f1: 0.2756
 epoch: 43, train_loss: 0.9437, test_loss: 1.5079, test_f1: 0.3470
 epoch: 44, train_loss: 0.9186, test_loss: 1.6063, test_f1: 0.3653
 epoch: 45, train_loss: 0.9767, test_loss: 1.2471, test_f1: 0.4470
 epoch: 46, train_loss: 0.9606, test_loss: 1.1041, test_f1: 0.4093
 epoch: 47, train_loss: 0.9508, test_loss: 1.3575, test_f1: 0.3899
 epoch: 48, train_loss: 0.9331, test_loss: 1.4913, test_f1: 0.3358
 epoch: 49, train_loss: 0.9169, test_loss: 1.0970, test_f1: 0.3686
 epoch: 50, train_loss: 0.8958, test_loss: 1.0130, test_f1: 0.4468
 epoch: 51, train_loss: 0.8883, test_loss: 0.9698, test_f1: 0.4321
 epoch: 52, train_loss: 0.8880, test_loss: 0.9839, test_f1: 0.4321
 epoch: 53, train_loss: 0.8711, test_loss: 1.0038, test_f1: 0.4296
 epoch: 54, train_loss: 0.8731, test_loss: 0.9827, test_f1: 0.4346
 epoch: 55, train_loss: 0.8784, test_loss: 0.9903, test_f1: 0.4317
 epoch: 56, train_loss: 0.8748, test_loss: 1.0071, test_f1: 0.4296
 epoch: 57, train_loss: 0.8778, test_loss: 1.0123, test_f1: 0.5709
 epoch: 58, train_loss: 0.8700, test_loss: 0.9492, test_f1: 0.5779
 epoch: 59, train_loss: 0.8738, test_loss: 0.9473, test_f1: 0.5797
 epoch: 60, train_loss: 0.8623, test_loss: 0.9705, test_f1: 0.5179
 epoch: 61, train_loss: 0.8699, test_loss: 0.9752, test_f1: 0.4301
 epoch: 62, train_loss: 0.8699, test_loss: 0.9567, test_f1: 0.5709
 epoch: 63, train_loss: 0.8641, test_loss: 0.9763, test_f1: 0.5791
 epoch: 64, train_loss: 0.8612, test_loss: 0.9529, test_f1: 0.5727
 epoch: 65, train_loss: 0.8690, test_loss: 1.0005, test_f1: 0.5608
 epoch: 66, train_loss: 0.8680, test_loss: 0.9896, test_f1: 0.4827
 epoch: 67, train_loss: 0.8764, test_loss: 1.0203, test_f1: 0.5585
 epoch: 68, train_loss: 0.8630, test_loss: 0.9592, test_f1: 0.5626
 epoch: 69, train_loss: 0.8610, test_loss: 0.9813, test_f1: 0.5662
 epoch: 70, train_loss: 0.8686, test_loss: 0.9622, test_f1: 0.5552
 epoch: 71, train_loss: 0.8534, test_loss: 0.9446, test_f1: 0.5254
 epoch: 72, train_loss: 0.8704, test_loss: 0.9670, test_f1: 0.5640
 epoch: 73, train_loss: 0.8532, test_loss: 0.9436, test_f1: 0.4797
 epoch: 74, train_loss: 0.8672, test_loss: 0.9797, test_f1: 0.5704
 epoch: 75, train_loss: 0.8752, test_loss: 1.0042, test_f1: 0.5694
 epoch: 76, train_loss: 0.8561, test_loss: 0.9424, test_f1: 0.5292
 epoch: 77, train_loss: 0.8579, test_loss: 0.9370, test_f1: 0.5778
 epoch: 78, train_loss: 0.8528, test_loss: 0.9628, test_f1: 0.5381
 epoch: 79, train_loss: 0.8583, test_loss: 0.9813, test_f1: 0.5792
 epoch: 80, train_loss: 0.8565, test_loss: 0.9731, test_f1: 0.5471
 epoch: 81, train_loss: 0.8643, test_loss: 0.9786, test_f1: 0.5541
 epoch: 82, train_loss: 0.8496, test_loss: 0.9607, test_f1: 0.4394
 epoch: 83, train_loss: 0.8527, test_loss: 0.9683, test_f1: 0.5755
 epoch: 84, train_loss: 0.8625, test_loss: 0.9973, test_f1: 0.5301
 epoch: 85, train_loss: 0.8396, test_loss: 0.9770, test_f1: 0.4346
 epoch: 86, train_loss: 0.8516, test_loss: 0.9781, test_f1: 0.5643
 epoch: 87, train_loss: 0.8534, test_loss: 0.9503, test_f1: 0.5434
 epoch: 88, train_loss: 0.8534, test_loss: 0.9536, test_f1: 0.4334
 epoch: 89, train_loss: 0.8504, test_loss: 0.9933, test_f1: 0.5621
 epoch: 90, train_loss: 0.8563, test_loss: 0.9567, test_f1: 0.5742
 epoch: 91, train_loss: 0.8411, test_loss: 0.9611, test_f1: 0.5644
 epoch: 92, train_loss: 0.8422, test_loss: 0.9542, test_f1: 0.5722
 epoch: 93, train_loss: 0.8452, test_loss: 0.9862, test_f1: 0.5658
 epoch: 94, train_loss: 0.8789, test_loss: 0.9770, test_f1: 0.5690
 epoch: 95, train_loss: 0.8750, test_loss: 0.9504, test_f1: 0.4441
 epoch: 96, train_loss: 0.8646, test_loss: 0.9631, test_f1: 0.5847
 epoch: 97, train_loss: 0.8729, test_loss: 0.9787, test_f1: 0.4275
 epoch: 98, train_loss: 0.8844, test_loss: 0.9742, test_f1: 0.5668
 epoch: 99, train_loss: 0.8649, test_loss: 1.1085, test_f1: 0.5679
##################ITERATION #3 ****************************************
 epoch: 0, train_loss: 1.7222, test_loss: 30.1976, test_f1: 0.0301
 epoch: 1, train_loss: 1.2996, test_loss: 1.7429, test_f1: 0.2281
 epoch: 2, train_loss: 1.2528, test_loss: 1.3148, test_f1: 0.2281
 epoch: 3, train_loss: 1.2109, test_loss: 1.2898, test_f1: 0.2306
 epoch: 4, train_loss: 1.1596, test_loss: 3.4303, test_f1: 0.1815
 epoch: 5, train_loss: 1.1019, test_loss: 17.1302, test_f1: 0.0778
 epoch: 6, train_loss: 1.0300, test_loss: 4.5649, test_f1: 0.2238
 epoch: 7, train_loss: 1.0093, test_loss: 1.4077, test_f1: 0.3055
 epoch: 8, train_loss: 1.0058, test_loss: 1.0999, test_f1: 0.4028
 epoch: 9, train_loss: 0.9919, test_loss: 1.2667, test_f1: 0.2799
 epoch: 10, train_loss: 1.0136, test_loss: 1.0587, test_f1: 0.3926
 epoch: 11, train_loss: 0.9672, test_loss: 1.1957, test_f1: 0.3692
 epoch: 12, train_loss: 0.9795, test_loss: 1.0667, test_f1: 0.2997
 epoch: 13, train_loss: 0.9747, test_loss: 1.0542, test_f1: 0.4217
 epoch: 14, train_loss: 0.9830, test_loss: 1.0310, test_f1: 0.4223
 epoch: 15, train_loss: 0.9715, test_loss: 1.2714, test_f1: 0.2614
 epoch: 16, train_loss: 1.0553, test_loss: 1.0794, test_f1: 0.4007
 epoch: 17, train_loss: 0.9966, test_loss: 1.1064, test_f1: 0.3844
 epoch: 18, train_loss: 1.0087, test_loss: 1.3809, test_f1: 0.2637
 epoch: 19, train_loss: 1.0160, test_loss: 0.9940, test_f1: 0.4321
 epoch: 20, train_loss: 0.9849, test_loss: 1.0316, test_f1: 0.4170
 epoch: 21, train_loss: 1.0029, test_loss: 1.0466, test_f1: 0.4153
 epoch: 22, train_loss: 1.0285, test_loss: 1.0763, test_f1: 0.3795
 epoch: 23, train_loss: 1.0316, test_loss: 1.3446, test_f1: 0.3352
 epoch: 24, train_loss: 1.0050, test_loss: 1.0244, test_f1: 0.4001
 epoch: 25, train_loss: 0.9887, test_loss: 1.0241, test_f1: 0.4358
 epoch: 26, train_loss: 0.9815, test_loss: 1.1001, test_f1: 0.3966
 epoch: 27, train_loss: 0.9672, test_loss: 1.0384, test_f1: 0.4370
 epoch: 28, train_loss: 0.9817, test_loss: 1.0212, test_f1: 0.4310
 epoch: 29, train_loss: 0.9505, test_loss: 1.1561, test_f1: 0.4006
 epoch: 30, train_loss: 0.9576, test_loss: 1.0701, test_f1: 0.4202
 epoch: 31, train_loss: 0.9739, test_loss: 1.3031, test_f1: 0.3911
 epoch: 32, train_loss: 0.9594, test_loss: 1.1486, test_f1: 0.3986
 epoch: 33, train_loss: 0.9579, test_loss: 1.0902, test_f1: 0.4140
 epoch: 34, train_loss: 0.9655, test_loss: 1.1448, test_f1: 0.3426
 epoch: 35, train_loss: 0.9649, test_loss: 1.1112, test_f1: 0.3970
 epoch: 36, train_loss: 0.9731, test_loss: 246.3547, test_f1: 0.0301
 epoch: 37, train_loss: 0.9570, test_loss: 12.7187, test_f1: 0.1363
 epoch: 38, train_loss: 1.0075, test_loss: 1.3517, test_f1: 0.3125
 epoch: 39, train_loss: 0.9956, test_loss: 1.6962, test_f1: 0.3257
 epoch: 40, train_loss: 0.9830, test_loss: 1.3337, test_f1: 0.3892
 epoch: 41, train_loss: 1.0030, test_loss: 1.0984, test_f1: 0.3745
 epoch: 42, train_loss: 1.0040, test_loss: 1.1610, test_f1: 0.3317
 epoch: 43, train_loss: 1.0132, test_loss: 1.1151, test_f1: 0.3373
 epoch: 44, train_loss: 0.9751, test_loss: 1.0237, test_f1: 0.5005
 epoch: 45, train_loss: 0.9600, test_loss: 1.0606, test_f1: 0.4088
 epoch: 46, train_loss: 0.9545, test_loss: 1.0749, test_f1: 0.4380
 epoch: 47, train_loss: 0.9973, test_loss: 1.4789, test_f1: 0.3255
 epoch: 48, train_loss: 0.9845, test_loss: 1.3166, test_f1: 0.3991
 epoch: 49, train_loss: 0.9332, test_loss: 1.4314, test_f1: 0.4011
 epoch: 50, train_loss: 0.9345, test_loss: 1.2969, test_f1: 0.3951
 epoch: 51, train_loss: 0.9372, test_loss: 1.0686, test_f1: 0.4080
 epoch: 52, train_loss: 0.9259, test_loss: 11.2406, test_f1: 0.3971
 epoch: 53, train_loss: 0.9339, test_loss: 1.1316, test_f1: 0.4014
 epoch: 54, train_loss: 0.9166, test_loss: 1.0789, test_f1: 0.4277
 epoch: 55, train_loss: 0.9218, test_loss: 1.0140, test_f1: 0.4244
 epoch: 56, train_loss: 0.9150, test_loss: 0.9990, test_f1: 0.4417
 epoch: 57, train_loss: 0.8990, test_loss: 1.0073, test_f1: 0.4298
 epoch: 58, train_loss: 0.8934, test_loss: 1.0812, test_f1: 0.4198
 epoch: 59, train_loss: 0.9010, test_loss: 1.0173, test_f1: 0.4364
 epoch: 60, train_loss: 0.8914, test_loss: 1.0085, test_f1: 0.4340
 epoch: 61, train_loss: 0.8929, test_loss: 0.9997, test_f1: 0.4371
 epoch: 62, train_loss: 0.9068, test_loss: 0.9990, test_f1: 0.4329
 epoch: 63, train_loss: 0.8987, test_loss: 1.0162, test_f1: 0.4364
 epoch: 64, train_loss: 0.8983, test_loss: 1.0033, test_f1: 0.4364
 epoch: 65, train_loss: 0.8983, test_loss: 1.2013, test_f1: 0.4120
 epoch: 66, train_loss: 0.8994, test_loss: 1.0140, test_f1: 0.4298
 epoch: 67, train_loss: 0.9056, test_loss: 1.0325, test_f1: 0.4298
 epoch: 68, train_loss: 0.9007, test_loss: 1.0510, test_f1: 0.4217
 epoch: 69, train_loss: 0.9115, test_loss: 1.0285, test_f1: 0.4217
 epoch: 70, train_loss: 1.1022, test_loss: 1.1564, test_f1: 0.3426
 epoch: 71, train_loss: 1.0181, test_loss: 1.1547, test_f1: 0.3319
 epoch: 72, train_loss: 1.0128, test_loss: 1.1392, test_f1: 0.3883
 epoch: 73, train_loss: 1.0233, test_loss: 1.1529, test_f1: 0.3290
 epoch: 74, train_loss: 1.0337, test_loss: 1.1615, test_f1: 0.3290
 epoch: 75, train_loss: 1.0217, test_loss: 1.1220, test_f1: 0.2419
 epoch: 76, train_loss: 1.0366, test_loss: 1.1685, test_f1: 0.3262
 epoch: 77, train_loss: 1.0390, test_loss: 1.0930, test_f1: 0.3397
 epoch: 78, train_loss: 1.0110, test_loss: 1.0927, test_f1: 0.3593
 epoch: 79, train_loss: 1.0200, test_loss: 1.0361, test_f1: 0.4335
 epoch: 80, train_loss: 1.0055, test_loss: 1.0408, test_f1: 0.4150
 epoch: 81, train_loss: 1.0006, test_loss: 1.0823, test_f1: 0.3808
 epoch: 82, train_loss: 1.0037, test_loss: 1.0815, test_f1: 0.3984
 epoch: 83, train_loss: 0.9936, test_loss: 1.1501, test_f1: 0.3800
 epoch: 84, train_loss: 0.9811, test_loss: 1.1216, test_f1: 0.3801
 epoch: 85, train_loss: 0.9731, test_loss: 1.1357, test_f1: 0.3987
 epoch: 86, train_loss: 0.9896, test_loss: 1.0825, test_f1: 0.3818
 epoch: 87, train_loss: 0.9799, test_loss: 1.0836, test_f1: 0.3370
 epoch: 88, train_loss: 0.9842, test_loss: 1.0420, test_f1: 0.4121
 epoch: 89, train_loss: 1.0219, test_loss: 1.1305, test_f1: 0.4056
 epoch: 90, train_loss: 1.0059, test_loss: 1.1925, test_f1: 0.3808
 epoch: 91, train_loss: 0.9918, test_loss: 1.0777, test_f1: 0.4068
 epoch: 92, train_loss: 0.9952, test_loss: 1.0330, test_f1: 0.4196
 epoch: 93, train_loss: 0.9797, test_loss: 1.0132, test_f1: 0.3780
 epoch: 94, train_loss: 0.9752, test_loss: 1.0159, test_f1: 0.4331
 epoch: 95, train_loss: 0.9702, test_loss: 0.9969, test_f1: 0.4347
 epoch: 96, train_loss: 0.9421, test_loss: 1.0201, test_f1: 0.4140
 epoch: 97, train_loss: 0.9684, test_loss: 1.0445, test_f1: 0.4211
 epoch: 98, train_loss: 0.9563, test_loss: 1.0379, test_f1: 0.4224
 epoch: 99, train_loss: 0.9504, test_loss: 1.0673, test_f1: 0.3963
##################ITERATION #4 ****************************************
 epoch: 0, train_loss: 1.3212, test_loss: 4.0008, test_f1: 0.1418
 epoch: 1, train_loss: 1.1608, test_loss: 2.7957, test_f1: 0.1645
 epoch: 2, train_loss: 1.0869, test_loss: 1.1914, test_f1: 0.3286
 epoch: 3, train_loss: 1.0731, test_loss: 1.2616, test_f1: 0.3316
 epoch: 4, train_loss: 1.0466, test_loss: 1.1401, test_f1: 0.2456
 epoch: 5, train_loss: 1.0460, test_loss: 1.5360, test_f1: 0.3184
 epoch: 6, train_loss: 1.0465, test_loss: 2.4842, test_f1: 0.3599
 epoch: 7, train_loss: 1.0536, test_loss: 5.1512, test_f1: 0.2482
 epoch: 8, train_loss: 1.0419, test_loss: 1.1871, test_f1: 0.4027
 epoch: 9, train_loss: 1.0314, test_loss: 1.1595, test_f1: 0.4301
 epoch: 10, train_loss: 1.0412, test_loss: 1.6485, test_f1: 0.2730
 epoch: 11, train_loss: 1.0345, test_loss: 1.1864, test_f1: 0.4357
 epoch: 12, train_loss: 0.9979, test_loss: 1.2247, test_f1: 0.4041
 epoch: 13, train_loss: 1.0018, test_loss: 1.3777, test_f1: 0.2608
 epoch: 14, train_loss: 1.1093, test_loss: 2.9733, test_f1: 0.1368
 epoch: 15, train_loss: 1.1816, test_loss: 3.1616, test_f1: 0.2432
 epoch: 16, train_loss: 1.0789, test_loss: 1.5926, test_f1: 0.3630
 epoch: 17, train_loss: 1.0774, test_loss: 1.1684, test_f1: 0.3523
 epoch: 18, train_loss: 1.0664, test_loss: 1.1701, test_f1: 0.3279
 epoch: 19, train_loss: 1.0399, test_loss: 1.1394, test_f1: 0.3344
 epoch: 20, train_loss: 1.0368, test_loss: 1.1040, test_f1: 0.3684
 epoch: 21, train_loss: 1.0306, test_loss: 1.1260, test_f1: 0.3344
 epoch: 22, train_loss: 1.0343, test_loss: 1.1862, test_f1: 0.3234
 epoch: 23, train_loss: 1.0141, test_loss: 1.1207, test_f1: 0.3397
 epoch: 24, train_loss: 1.0147, test_loss: 1.1170, test_f1: 0.3397
 epoch: 25, train_loss: 1.0122, test_loss: 1.1462, test_f1: 0.3372
 epoch: 26, train_loss: 1.0355, test_loss: 4.2456, test_f1: 0.2572
 epoch: 27, train_loss: 1.0206, test_loss: 3.0082, test_f1: 0.2792
 epoch: 28, train_loss: 1.0124, test_loss: 1.7894, test_f1: 0.3101
 epoch: 29, train_loss: 1.0035, test_loss: 1.7388, test_f1: 0.2631
 epoch: 30, train_loss: 1.0163, test_loss: 1.2972, test_f1: 0.2705
 epoch: 31, train_loss: 1.0112, test_loss: 1.1375, test_f1: 0.3399
 epoch: 32, train_loss: 1.0036, test_loss: 1.1239, test_f1: 0.3397
 epoch: 33, train_loss: 1.0371, test_loss: 1.4049, test_f1: 0.2390
 epoch: 34, train_loss: 1.0244, test_loss: 1.2220, test_f1: 0.3268
 epoch: 35, train_loss: 1.0222, test_loss: 2.0802, test_f1: 0.3343
 epoch: 36, train_loss: 0.9915, test_loss: 1.1944, test_f1: 0.3621
 epoch: 37, train_loss: 1.0267, test_loss: 1.1396, test_f1: 0.3640
 epoch: 38, train_loss: 1.0175, test_loss: 1.9101, test_f1: 0.3031
 epoch: 39, train_loss: 0.9930, test_loss: 1.6541, test_f1: 0.2792
 epoch: 40, train_loss: 1.0124, test_loss: 2.0229, test_f1: 0.3063
 epoch: 41, train_loss: 1.0751, test_loss: 1.2755, test_f1: 0.2913
 epoch: 42, train_loss: 1.1021, test_loss: 8.8716, test_f1: 0.2074
 epoch: 43, train_loss: 1.0555, test_loss: 16.4477, test_f1: 0.1703
 epoch: 44, train_loss: 1.0447, test_loss: 2.7829, test_f1: 0.2713
 epoch: 45, train_loss: 1.0361, test_loss: 1.2077, test_f1: 0.3286
 epoch: 46, train_loss: 1.0246, test_loss: 1.1397, test_f1: 0.3431
 epoch: 47, train_loss: 1.0236, test_loss: 1.3456, test_f1: 0.3253
 epoch: 48, train_loss: 1.0218, test_loss: 1.2158, test_f1: 0.3910
 epoch: 49, train_loss: 1.0343, test_loss: 1.1100, test_f1: 0.3431
 epoch: 50, train_loss: 1.0581, test_loss: 1.1677, test_f1: 0.3338
 epoch: 51, train_loss: 1.0225, test_loss: 1.1718, test_f1: 0.3425
 epoch: 52, train_loss: 1.0616, test_loss: 1.1931, test_f1: 0.3272
 epoch: 53, train_loss: 1.0475, test_loss: 1.1875, test_f1: 0.3380
 epoch: 54, train_loss: 1.0143, test_loss: 1.3587, test_f1: 0.3118
 epoch: 55, train_loss: 1.0142, test_loss: 1.1730, test_f1: 0.3279
 epoch: 56, train_loss: 1.0096, test_loss: 1.2133, test_f1: 0.3437
 epoch: 57, train_loss: 1.0004, test_loss: 1.1554, test_f1: 0.3397
 epoch: 58, train_loss: 1.0075, test_loss: 1.1396, test_f1: 0.3420
 epoch: 59, train_loss: 1.0036, test_loss: 1.1558, test_f1: 0.3351
 epoch: 60, train_loss: 1.0136, test_loss: 1.1742, test_f1: 0.3328
 epoch: 61, train_loss: 1.0008, test_loss: 1.2446, test_f1: 0.3208
 epoch: 62, train_loss: 0.9943, test_loss: 1.3900, test_f1: 0.3059
 epoch: 63, train_loss: 0.9932, test_loss: 1.4304, test_f1: 0.3439
 epoch: 64, train_loss: 0.9970, test_loss: 1.2644, test_f1: 0.3061
 epoch: 65, train_loss: 0.9883, test_loss: 1.4351, test_f1: 0.3043
 epoch: 66, train_loss: 0.9859, test_loss: 1.4637, test_f1: 0.3064
 epoch: 67, train_loss: 0.9862, test_loss: 1.2899, test_f1: 0.3066
 epoch: 68, train_loss: 0.9845, test_loss: 1.2234, test_f1: 0.3187
 epoch: 69, train_loss: 0.9729, test_loss: 1.2468, test_f1: 0.3187
 epoch: 70, train_loss: 0.9679, test_loss: 1.2950, test_f1: 0.3083
 epoch: 71, train_loss: 0.9775, test_loss: 1.5182, test_f1: 0.3019
 epoch: 72, train_loss: 0.9725, test_loss: 1.2904, test_f1: 0.3066
 epoch: 73, train_loss: 0.9793, test_loss: 1.4790, test_f1: 0.3151
 epoch: 74, train_loss: 0.9701, test_loss: 1.7378, test_f1: 0.3156
 epoch: 75, train_loss: 0.9632, test_loss: 1.1912, test_f1: 0.3522
 epoch: 76, train_loss: 0.9639, test_loss: 1.1433, test_f1: 0.3437
 epoch: 77, train_loss: 0.9569, test_loss: 1.1739, test_f1: 0.3609
 epoch: 78, train_loss: 0.9478, test_loss: 1.1951, test_f1: 0.3562
 epoch: 79, train_loss: 0.9553, test_loss: 1.4338, test_f1: 0.3515
 epoch: 80, train_loss: 0.9466, test_loss: 1.5853, test_f1: 0.3745
 epoch: 81, train_loss: 0.9426, test_loss: 2.3652, test_f1: 0.3575
 epoch: 82, train_loss: 0.9367, test_loss: 1.5680, test_f1: 0.3511
 epoch: 83, train_loss: 0.9643, test_loss: 2.4245, test_f1: 0.3925
 epoch: 84, train_loss: 0.9483, test_loss: 2.0512, test_f1: 0.3344
 epoch: 85, train_loss: 0.9360, test_loss: 1.1623, test_f1: 0.4033
 epoch: 86, train_loss: 0.9746, test_loss: 1.1367, test_f1: 0.3778
 epoch: 87, train_loss: 0.9340, test_loss: 1.0975, test_f1: 0.4018
 epoch: 88, train_loss: 0.9501, test_loss: 1.0848, test_f1: 0.4058
 epoch: 89, train_loss: 0.9353, test_loss: 1.0505, test_f1: 0.4325
 epoch: 90, train_loss: 0.9308, test_loss: 1.8431, test_f1: 0.3502
 epoch: 91, train_loss: 0.9380, test_loss: 1.2429, test_f1: 0.3704
 epoch: 92, train_loss: 0.9369, test_loss: 1.4390, test_f1: 0.3855
 epoch: 93, train_loss: 0.9404, test_loss: 1.1940, test_f1: 0.3939
 epoch: 94, train_loss: 0.9240, test_loss: 1.3198, test_f1: 0.4111
 epoch: 95, train_loss: 0.9224, test_loss: 1.2725, test_f1: 0.4038
 epoch: 96, train_loss: 0.9165, test_loss: 1.5015, test_f1: 0.3932
 epoch: 97, train_loss: 0.9049, test_loss: 1.8258, test_f1: 0.4021
 epoch: 98, train_loss: 0.9089, test_loss: 1.4251, test_f1: 0.3942
 epoch: 99, train_loss: 0.9164, test_loss: 1.1529, test_f1: 0.4096
##################ITERATION #5 ****************************************
 epoch: 0, train_loss: 1.4168, test_loss: 1.3998, test_f1: 0.1365
 epoch: 1, train_loss: 1.2590, test_loss: 1.2008, test_f1: 0.2491
 epoch: 2, train_loss: 1.1430, test_loss: 1.5918, test_f1: 0.2455
 epoch: 3, train_loss: 1.1455, test_loss: 1.1409, test_f1: 0.3344
 epoch: 4, train_loss: 1.1438, test_loss: 1.1923, test_f1: 0.3115
 epoch: 5, train_loss: 1.1169, test_loss: 1.1464, test_f1: 0.3317
 epoch: 6, train_loss: 1.1289, test_loss: 1.1385, test_f1: 0.3317
 epoch: 7, train_loss: 1.1017, test_loss: 1.2058, test_f1: 0.3018
 epoch: 8, train_loss: 1.1005, test_loss: 1.3023, test_f1: 0.2491
 epoch: 9, train_loss: 1.1145, test_loss: 1.1757, test_f1: 0.3146
 epoch: 10, train_loss: 1.0979, test_loss: 1.1869, test_f1: 0.3146
 epoch: 11, train_loss: 1.1355, test_loss: 1.1133, test_f1: 0.3344
 epoch: 12, train_loss: 1.1064, test_loss: 1.0933, test_f1: 0.3470
 epoch: 13, train_loss: 1.1060, test_loss: 1.1352, test_f1: 0.3317
 epoch: 14, train_loss: 1.1134, test_loss: 1.1435, test_f1: 0.3317
 epoch: 15, train_loss: 1.0816, test_loss: 1.1498, test_f1: 0.3322
 epoch: 16, train_loss: 1.1167, test_loss: 1.1202, test_f1: 0.3317
 epoch: 17, train_loss: 1.1133, test_loss: 1.1073, test_f1: 0.3403
 epoch: 18, train_loss: 1.1047, test_loss: 1.1448, test_f1: 0.3234
 epoch: 19, train_loss: 1.1161, test_loss: 1.4195, test_f1: 0.2827
 epoch: 20, train_loss: 1.0915, test_loss: 1.2193, test_f1: 0.3135
 epoch: 21, train_loss: 1.1115, test_loss: 1.1174, test_f1: 0.3358
 epoch: 22, train_loss: 1.0831, test_loss: 1.1121, test_f1: 0.3344
 epoch: 23, train_loss: 1.1129, test_loss: 1.3320, test_f1: 0.2441
 epoch: 24, train_loss: 1.1111, test_loss: 1.2090, test_f1: 0.3018
 epoch: 25, train_loss: 1.0682, test_loss: 1.1786, test_f1: 0.3146
 epoch: 26, train_loss: 1.0832, test_loss: 1.3320, test_f1: 0.2491
 epoch: 27, train_loss: 1.0711, test_loss: 1.1684, test_f1: 0.3234
 epoch: 28, train_loss: 1.0510, test_loss: 1.1102, test_f1: 0.3338
 epoch: 29, train_loss: 1.0494, test_loss: 1.5984, test_f1: 0.2983
 epoch: 30, train_loss: 1.0379, test_loss: 1.1489, test_f1: 0.3321
 epoch: 31, train_loss: 1.0412, test_loss: 1.1695, test_f1: 0.3262
 epoch: 32, train_loss: 1.0055, test_loss: 1.1823, test_f1: 0.3338
 epoch: 33, train_loss: 1.0197, test_loss: 1.6326, test_f1: 0.3102
 epoch: 34, train_loss: 1.1741, test_loss: 1.3876, test_f1: 0.2336
 epoch: 35, train_loss: 1.2102, test_loss: 1.2107, test_f1: 0.3018
 epoch: 36, train_loss: 1.0900, test_loss: 1.1349, test_f1: 0.3344
 epoch: 37, train_loss: 1.0616, test_loss: 1.1198, test_f1: 0.3395
 epoch: 38, train_loss: 1.1222, test_loss: 1.4815, test_f1: 0.1365
 epoch: 39, train_loss: 1.1489, test_loss: 1.4893, test_f1: 0.2336
 epoch: 40, train_loss: 1.0518, test_loss: 1.3032, test_f1: 0.2949
 epoch: 41, train_loss: 1.0755, test_loss: 1.4449, test_f1: 0.2336
 epoch: 42, train_loss: 1.0728, test_loss: 1.4109, test_f1: 0.2336
 epoch: 43, train_loss: 1.0749, test_loss: 1.2623, test_f1: 0.2876
 epoch: 44, train_loss: 1.0659, test_loss: 1.1532, test_f1: 0.3262
 epoch: 45, train_loss: 1.0596, test_loss: 1.1002, test_f1: 0.3444
 epoch: 46, train_loss: 1.0519, test_loss: 1.1179, test_f1: 0.3395
 epoch: 47, train_loss: 1.0566, test_loss: 1.1288, test_f1: 0.3344
 epoch: 48, train_loss: 1.0525, test_loss: 1.1039, test_f1: 0.3444
 epoch: 49, train_loss: 1.0402, test_loss: 1.0873, test_f1: 0.3492
 epoch: 50, train_loss: 1.0341, test_loss: 1.1004, test_f1: 0.3529
 epoch: 51, train_loss: 1.0248, test_loss: 1.1179, test_f1: 0.3470
 epoch: 52, train_loss: 1.0248, test_loss: 1.0829, test_f1: 0.3484
 epoch: 53, train_loss: 1.0185, test_loss: 1.0867, test_f1: 0.3492
 epoch: 54, train_loss: 1.0221, test_loss: 1.0919, test_f1: 0.3473
 epoch: 55, train_loss: 1.0203, test_loss: 1.1046, test_f1: 0.3468
 epoch: 56, train_loss: 1.0259, test_loss: 1.1264, test_f1: 0.3395
 epoch: 57, train_loss: 1.0296, test_loss: 1.1337, test_f1: 0.3395
 epoch: 58, train_loss: 1.0358, test_loss: 1.1179, test_f1: 0.3425
 epoch: 59, train_loss: 1.0330, test_loss: 1.0920, test_f1: 0.3468
 epoch: 60, train_loss: 1.0209, test_loss: 1.0832, test_f1: 0.3492
 epoch: 61, train_loss: 1.0245, test_loss: 1.0899, test_f1: 0.3473
 epoch: 62, train_loss: 1.0233, test_loss: 1.1044, test_f1: 0.3444
 epoch: 63, train_loss: 1.0323, test_loss: 1.1496, test_f1: 0.3344
 epoch: 64, train_loss: 1.0443, test_loss: 1.1492, test_f1: 0.3344
 epoch: 65, train_loss: 1.0358, test_loss: 1.1282, test_f1: 0.3395
 epoch: 66, train_loss: 1.0309, test_loss: 1.1243, test_f1: 0.3395
 epoch: 67, train_loss: 1.0298, test_loss: 1.0964, test_f1: 0.3444
 epoch: 68, train_loss: 1.0352, test_loss: 1.1042, test_f1: 0.3444
 epoch: 69, train_loss: 1.0242, test_loss: 1.1300, test_f1: 0.3395
 epoch: 70, train_loss: 1.0345, test_loss: 1.1511, test_f1: 0.3344
 epoch: 71, train_loss: 1.0423, test_loss: 1.1401, test_f1: 0.3344
 epoch: 72, train_loss: 1.0304, test_loss: 1.1236, test_f1: 0.3395
 epoch: 73, train_loss: 1.0229, test_loss: 1.0705, test_f1: 0.3536
 epoch: 74, train_loss: 1.0307, test_loss: 1.0784, test_f1: 0.3492
 epoch: 75, train_loss: 1.0208, test_loss: 1.1115, test_f1: 0.3395
 epoch: 76, train_loss: 1.0183, test_loss: 1.1056, test_f1: 0.3395
 epoch: 77, train_loss: 1.0171, test_loss: 1.0877, test_f1: 0.3492
 epoch: 78, train_loss: 1.0207, test_loss: 1.0990, test_f1: 0.3444
 epoch: 79, train_loss: 1.0215, test_loss: 1.0887, test_f1: 0.3492
 epoch: 80, train_loss: 1.0313, test_loss: 1.1573, test_f1: 0.3317
 epoch: 81, train_loss: 1.0496, test_loss: 1.1580, test_f1: 0.3317
 epoch: 82, train_loss: 1.0448, test_loss: 1.1333, test_f1: 0.3370
 epoch: 83, train_loss: 1.0333, test_loss: 1.1130, test_f1: 0.3394
 epoch: 84, train_loss: 1.0241, test_loss: 1.1200, test_f1: 0.3397
 epoch: 85, train_loss: 1.0389, test_loss: 1.1529, test_f1: 0.3317
 epoch: 86, train_loss: 1.0194, test_loss: 1.1731, test_f1: 0.3262
 epoch: 87, train_loss: 1.0342, test_loss: 1.1751, test_f1: 0.3290
 epoch: 88, train_loss: 1.0619, test_loss: 1.1674, test_f1: 0.2384
 epoch: 89, train_loss: 1.0978, test_loss: 1.1456, test_f1: 0.3344
 epoch: 90, train_loss: 1.0777, test_loss: 1.1420, test_f1: 0.3344
 epoch: 91, train_loss: 1.0728, test_loss: 1.1449, test_f1: 0.3317
 epoch: 92, train_loss: 1.0700, test_loss: 1.1540, test_f1: 0.3290
 epoch: 93, train_loss: 1.0661, test_loss: 1.1537, test_f1: 0.3290
 epoch: 94, train_loss: 1.0694, test_loss: 1.1502, test_f1: 0.3290
 epoch: 95, train_loss: 1.0645, test_loss: 1.1474, test_f1: 0.3290
 epoch: 96, train_loss: 1.0663, test_loss: 1.1485, test_f1: 0.3290
 epoch: 97, train_loss: 1.0652, test_loss: 1.1529, test_f1: 0.3290
 epoch: 98, train_loss: 1.0681, test_loss: 1.1512, test_f1: 0.3290
 epoch: 99, train_loss: 1.0651, test_loss: 1.1494, test_f1: 0.3290
##################ITERATION #6 ****************************************
 epoch: 0, train_loss: 1.4622, test_loss: 1.4842, test_f1: 0.2281
 epoch: 1, train_loss: 1.3871, test_loss: 1.4586, test_f1: 0.2281
 epoch: 2, train_loss: 1.3577, test_loss: 1.4171, test_f1: 0.2281
 epoch: 3, train_loss: 1.3235, test_loss: 1.3725, test_f1: 0.2281
 epoch: 4, train_loss: 1.2913, test_loss: 1.3400, test_f1: 0.2281
 epoch: 5, train_loss: 1.2690, test_loss: 1.3176, test_f1: 0.2281
 epoch: 6, train_loss: 1.2573, test_loss: 1.3050, test_f1: 0.2281
 epoch: 7, train_loss: 1.2522, test_loss: 1.3023, test_f1: 0.2281
 epoch: 8, train_loss: 1.2526, test_loss: 1.3045, test_f1: 0.2281
 epoch: 9, train_loss: 1.2538, test_loss: 1.3037, test_f1: 0.2281
 epoch: 10, train_loss: 1.2530, test_loss: 1.3027, test_f1: 0.2281
 epoch: 11, train_loss: 1.2525, test_loss: 1.3013, test_f1: 0.2281
 epoch: 12, train_loss: 1.2530, test_loss: 1.3050, test_f1: 0.2281
 epoch: 13, train_loss: 1.2526, test_loss: 1.3086, test_f1: 0.2281
 epoch: 14, train_loss: 1.2530, test_loss: 1.3067, test_f1: 0.2281
 epoch: 15, train_loss: 1.2525, test_loss: 1.3060, test_f1: 0.2281
 epoch: 16, train_loss: 1.2523, test_loss: 1.3061, test_f1: 0.2281
 epoch: 17, train_loss: 1.2532, test_loss: 1.3038, test_f1: 0.2281
 epoch: 18, train_loss: 1.2525, test_loss: 1.3034, test_f1: 0.2281
 epoch: 19, train_loss: 1.2531, test_loss: 1.3062, test_f1: 0.2281
 epoch: 20, train_loss: 1.2525, test_loss: 1.3057, test_f1: 0.2281
 epoch: 21, train_loss: 1.2536, test_loss: 1.3089, test_f1: 0.2281
 epoch: 22, train_loss: 1.2540, test_loss: 1.3070, test_f1: 0.2281
 epoch: 23, train_loss: 1.2527, test_loss: 1.3100, test_f1: 0.2281
 epoch: 24, train_loss: 1.2532, test_loss: 1.3062, test_f1: 0.2281
 epoch: 25, train_loss: 1.2534, test_loss: 1.3049, test_f1: 0.2281
 epoch: 26, train_loss: 1.2528, test_loss: 1.3019, test_f1: 0.2281
 epoch: 27, train_loss: 1.2524, test_loss: 1.3021, test_f1: 0.2281
 epoch: 28, train_loss: 1.2532, test_loss: 1.3020, test_f1: 0.2281
 epoch: 29, train_loss: 1.2530, test_loss: 1.3075, test_f1: 0.2281
 epoch: 30, train_loss: 1.2545, test_loss: 1.3124, test_f1: 0.2281
 epoch: 31, train_loss: 1.2539, test_loss: 1.3084, test_f1: 0.2281
 epoch: 32, train_loss: 1.2555, test_loss: 1.3049, test_f1: 0.2281
 epoch: 33, train_loss: 1.2546, test_loss: 1.3040, test_f1: 0.2281
 epoch: 34, train_loss: 1.2523, test_loss: 1.3085, test_f1: 0.2281
 epoch: 35, train_loss: 1.2528, test_loss: 1.3081, test_f1: 0.2281
 epoch: 36, train_loss: 1.2529, test_loss: 1.3039, test_f1: 0.2281
 epoch: 37, train_loss: 1.2521, test_loss: 1.3021, test_f1: 0.2281
 epoch: 38, train_loss: 1.2528, test_loss: 1.3047, test_f1: 0.2281
 epoch: 39, train_loss: 1.2524, test_loss: 1.3055, test_f1: 0.2281
 epoch: 40, train_loss: 1.2521, test_loss: 1.3057, test_f1: 0.2281
 epoch: 41, train_loss: 1.2545, test_loss: 1.3033, test_f1: 0.2281
 epoch: 42, train_loss: 1.2531, test_loss: 1.3057, test_f1: 0.2281
 epoch: 43, train_loss: 1.2522, test_loss: 1.3082, test_f1: 0.2281
 epoch: 44, train_loss: 1.2524, test_loss: 1.3081, test_f1: 0.2281
 epoch: 45, train_loss: 1.2527, test_loss: 1.3120, test_f1: 0.2281
 epoch: 46, train_loss: 1.2544, test_loss: 1.3131, test_f1: 0.2281
 epoch: 47, train_loss: 1.2549, test_loss: 1.3089, test_f1: 0.2281
 epoch: 48, train_loss: 1.2531, test_loss: 1.3017, test_f1: 0.2281
 epoch: 49, train_loss: 1.2527, test_loss: 1.3022, test_f1: 0.2281
 epoch: 50, train_loss: 1.2524, test_loss: 1.3059, test_f1: 0.2281
 epoch: 51, train_loss: 1.2527, test_loss: 1.3061, test_f1: 0.2281
 epoch: 52, train_loss: 1.2527, test_loss: 1.3040, test_f1: 0.2281
 epoch: 53, train_loss: 1.2526, test_loss: 1.3047, test_f1: 0.2281
 epoch: 54, train_loss: 1.2522, test_loss: 1.3029, test_f1: 0.2281
 epoch: 55, train_loss: 1.2527, test_loss: 1.3017, test_f1: 0.2281
 epoch: 56, train_loss: 1.2532, test_loss: 1.3028, test_f1: 0.2281
 epoch: 57, train_loss: 1.2545, test_loss: 1.3044, test_f1: 0.2281
 epoch: 58, train_loss: 1.2543, test_loss: 1.3047, test_f1: 0.2281
 epoch: 59, train_loss: 1.2524, test_loss: 1.3073, test_f1: 0.2281
 epoch: 60, train_loss: 1.2523, test_loss: 1.3078, test_f1: 0.2281
 epoch: 61, train_loss: 1.2524, test_loss: 1.3078, test_f1: 0.2281
 epoch: 62, train_loss: 1.2523, test_loss: 1.3070, test_f1: 0.2281
 epoch: 63, train_loss: 1.2522, test_loss: 1.3040, test_f1: 0.2281
 epoch: 64, train_loss: 1.2523, test_loss: 1.3028, test_f1: 0.2281
 epoch: 65, train_loss: 1.2524, test_loss: 1.3056, test_f1: 0.2281
 epoch: 66, train_loss: 1.2522, test_loss: 1.3075, test_f1: 0.2281
 epoch: 67, train_loss: 1.2527, test_loss: 1.3089, test_f1: 0.2281
 epoch: 68, train_loss: 1.2531, test_loss: 1.3088, test_f1: 0.2281
 epoch: 69, train_loss: 1.2527, test_loss: 1.3079, test_f1: 0.2281
 epoch: 70, train_loss: 1.2535, test_loss: 1.3088, test_f1: 0.2281
 epoch: 71, train_loss: 1.2529, test_loss: 1.3068, test_f1: 0.2281
 epoch: 72, train_loss: 1.2522, test_loss: 1.3054, test_f1: 0.2281
 epoch: 73, train_loss: 1.2525, test_loss: 1.3062, test_f1: 0.2281
 epoch: 74, train_loss: 1.2523, test_loss: 1.3060, test_f1: 0.2281
 epoch: 75, train_loss: 1.2522, test_loss: 1.3062, test_f1: 0.2281
 epoch: 76, train_loss: 1.2522, test_loss: 1.3079, test_f1: 0.2281
 epoch: 77, train_loss: 1.2526, test_loss: 1.3097, test_f1: 0.2281
 epoch: 78, train_loss: 1.2528, test_loss: 1.3090, test_f1: 0.2281
 epoch: 79, train_loss: 1.2529, test_loss: 1.3081, test_f1: 0.2281
 epoch: 80, train_loss: 1.2523, test_loss: 1.3059, test_f1: 0.2281
 epoch: 81, train_loss: 1.2522, test_loss: 1.3049, test_f1: 0.2281
 epoch: 82, train_loss: 1.2521, test_loss: 1.3057, test_f1: 0.2281
 epoch: 83, train_loss: 1.2523, test_loss: 1.3038, test_f1: 0.2281
 epoch: 84, train_loss: 1.2522, test_loss: 1.3026, test_f1: 0.2281
 epoch: 85, train_loss: 1.2523, test_loss: 1.3038, test_f1: 0.2281
 epoch: 86, train_loss: 1.2524, test_loss: 1.3047, test_f1: 0.2281
 epoch: 87, train_loss: 1.2521, test_loss: 1.3072, test_f1: 0.2281
 epoch: 88, train_loss: 1.2523, test_loss: 1.3073, test_f1: 0.2281
 epoch: 89, train_loss: 1.2525, test_loss: 1.3087, test_f1: 0.2281
 epoch: 90, train_loss: 1.2530, test_loss: 1.3095, test_f1: 0.2281
 epoch: 91, train_loss: 1.2528, test_loss: 1.3062, test_f1: 0.2281
 epoch: 92, train_loss: 1.2522, test_loss: 1.3023, test_f1: 0.2281
 epoch: 93, train_loss: 1.2525, test_loss: 1.3026, test_f1: 0.2281
 epoch: 94, train_loss: 1.2524, test_loss: 1.3019, test_f1: 0.2281
 epoch: 95, train_loss: 1.2527, test_loss: 1.3019, test_f1: 0.2281
 epoch: 96, train_loss: 1.2524, test_loss: 1.3032, test_f1: 0.2281
 epoch: 97, train_loss: 1.2519, test_loss: 1.3074, test_f1: 0.2281
 epoch: 98, train_loss: 1.2524, test_loss: 1.3079, test_f1: 0.2281
 epoch: 99, train_loss: 1.2524, test_loss: 1.3062, test_f1: 0.2281
##################ITERATION #7 ****************************************
 epoch: 0, train_loss: 1.2566, test_loss: 1.3117, test_f1: 0.2281
 epoch: 1, train_loss: 1.2557, test_loss: 1.3169, test_f1: 0.2281
 epoch: 2, train_loss: 1.2543, test_loss: 1.3098, test_f1: 0.2281
 epoch: 3, train_loss: 1.2554, test_loss: 1.3026, test_f1: 0.2281
 epoch: 4, train_loss: 1.2527, test_loss: 1.3035, test_f1: 0.2281
 epoch: 5, train_loss: 1.2532, test_loss: 1.3017, test_f1: 0.2281
 epoch: 6, train_loss: 1.2533, test_loss: 1.3031, test_f1: 0.2281
 epoch: 7, train_loss: 1.2528, test_loss: 1.3019, test_f1: 0.2281
 epoch: 8, train_loss: 1.2529, test_loss: 1.3025, test_f1: 0.2281
 epoch: 9, train_loss: 1.2521, test_loss: 1.3033, test_f1: 0.2281
 epoch: 10, train_loss: 1.2531, test_loss: 1.3010, test_f1: 0.2281
 epoch: 11, train_loss: 1.2539, test_loss: 1.2995, test_f1: 0.2281
 epoch: 12, train_loss: 1.2537, test_loss: 1.3007, test_f1: 0.2281
 epoch: 13, train_loss: 1.2528, test_loss: 1.3060, test_f1: 0.2281
 epoch: 14, train_loss: 1.2522, test_loss: 1.3082, test_f1: 0.2281
 epoch: 15, train_loss: 1.2530, test_loss: 1.3064, test_f1: 0.2281
 epoch: 16, train_loss: 1.2526, test_loss: 1.3059, test_f1: 0.2281
 epoch: 17, train_loss: 1.2527, test_loss: 1.3064, test_f1: 0.2281
 epoch: 18, train_loss: 1.2537, test_loss: 1.3106, test_f1: 0.2281
 epoch: 19, train_loss: 1.2533, test_loss: 1.3076, test_f1: 0.2281
 epoch: 20, train_loss: 1.2532, test_loss: 1.3011, test_f1: 0.2281
 epoch: 21, train_loss: 1.2536, test_loss: 1.2991, test_f1: 0.2281
 epoch: 22, train_loss: 1.2533, test_loss: 1.3032, test_f1: 0.2281
 epoch: 23, train_loss: 1.2524, test_loss: 1.3070, test_f1: 0.2281
 epoch: 24, train_loss: 1.2531, test_loss: 1.3082, test_f1: 0.2281
 epoch: 25, train_loss: 1.2527, test_loss: 1.3063, test_f1: 0.2281
 epoch: 26, train_loss: 1.2534, test_loss: 1.3066, test_f1: 0.2281
 epoch: 27, train_loss: 1.2523, test_loss: 1.3026, test_f1: 0.2281
 epoch: 28, train_loss: 1.2531, test_loss: 1.3042, test_f1: 0.2281
 epoch: 29, train_loss: 1.2529, test_loss: 1.3051, test_f1: 0.2281
 epoch: 30, train_loss: 1.2522, test_loss: 1.3070, test_f1: 0.2281
 epoch: 31, train_loss: 1.2524, test_loss: 1.3091, test_f1: 0.2281
 epoch: 32, train_loss: 1.2533, test_loss: 1.3065, test_f1: 0.2281
 epoch: 33, train_loss: 1.2528, test_loss: 1.3053, test_f1: 0.2281
 epoch: 34, train_loss: 1.2530, test_loss: 1.3041, test_f1: 0.2281
 epoch: 35, train_loss: 1.2530, test_loss: 1.3077, test_f1: 0.2281
 epoch: 36, train_loss: 1.2524, test_loss: 1.3097, test_f1: 0.2281
 epoch: 37, train_loss: 1.2542, test_loss: 1.3045, test_f1: 0.2281
 epoch: 38, train_loss: 1.2536, test_loss: 1.3061, test_f1: 0.2281
 epoch: 39, train_loss: 1.2530, test_loss: 1.3022, test_f1: 0.2281
 epoch: 40, train_loss: 1.2539, test_loss: 1.3035, test_f1: 0.2281
 epoch: 41, train_loss: 1.2535, test_loss: 1.3026, test_f1: 0.2281
 epoch: 42, train_loss: 1.2523, test_loss: 1.3063, test_f1: 0.2281
 epoch: 43, train_loss: 1.2525, test_loss: 1.3083, test_f1: 0.2281
 epoch: 44, train_loss: 1.2527, test_loss: 1.3054, test_f1: 0.2281
 epoch: 45, train_loss: 1.2522, test_loss: 1.3037, test_f1: 0.2281
 epoch: 46, train_loss: 1.2522, test_loss: 1.3083, test_f1: 0.2281
 epoch: 47, train_loss: 1.2530, test_loss: 1.3083, test_f1: 0.2281
 epoch: 48, train_loss: 1.2527, test_loss: 1.3054, test_f1: 0.2281
 epoch: 49, train_loss: 1.2523, test_loss: 1.3069, test_f1: 0.2281
 epoch: 50, train_loss: 1.2527, test_loss: 1.3072, test_f1: 0.2281
 epoch: 51, train_loss: 1.2526, test_loss: 1.3080, test_f1: 0.2281
 epoch: 52, train_loss: 1.2525, test_loss: 1.3079, test_f1: 0.2281
 epoch: 53, train_loss: 1.2524, test_loss: 1.3057, test_f1: 0.2281
 epoch: 54, train_loss: 1.2527, test_loss: 1.3070, test_f1: 0.2281
 epoch: 55, train_loss: 1.2534, test_loss: 1.3067, test_f1: 0.2281
 epoch: 56, train_loss: 1.2520, test_loss: 1.3077, test_f1: 0.2281
 epoch: 57, train_loss: 1.2529, test_loss: 1.3077, test_f1: 0.2281
 epoch: 58, train_loss: 1.2533, test_loss: 1.3033, test_f1: 0.2281
 epoch: 59, train_loss: 1.2526, test_loss: 1.3025, test_f1: 0.2281
 epoch: 60, train_loss: 1.2522, test_loss: 1.3047, test_f1: 0.2281
 epoch: 61, train_loss: 1.2526, test_loss: 1.3064, test_f1: 0.2281
 epoch: 62, train_loss: 1.2528, test_loss: 1.3062, test_f1: 0.2281
 epoch: 63, train_loss: 1.2521, test_loss: 1.3059, test_f1: 0.2281
 epoch: 64, train_loss: 1.2527, test_loss: 1.3046, test_f1: 0.2281
 epoch: 65, train_loss: 1.2525, test_loss: 1.3041, test_f1: 0.2281
 epoch: 66, train_loss: 1.2525, test_loss: 1.3044, test_f1: 0.2281
 epoch: 67, train_loss: 1.2521, test_loss: 1.3047, test_f1: 0.2281
 epoch: 68, train_loss: 1.2520, test_loss: 1.3031, test_f1: 0.2281
 epoch: 69, train_loss: 1.2527, test_loss: 1.3027, test_f1: 0.2281
 epoch: 70, train_loss: 1.2522, test_loss: 1.3026, test_f1: 0.2281
 epoch: 71, train_loss: 1.2528, test_loss: 1.3036, test_f1: 0.2281
 epoch: 72, train_loss: 1.2533, test_loss: 1.3060, test_f1: 0.2281
 epoch: 73, train_loss: 1.2524, test_loss: 1.3071, test_f1: 0.2281
 epoch: 74, train_loss: 1.2520, test_loss: 1.3059, test_f1: 0.2281
 epoch: 75, train_loss: 1.2521, test_loss: 1.3036, test_f1: 0.2281
 epoch: 76, train_loss: 1.2522, test_loss: 1.3032, test_f1: 0.2281
 epoch: 77, train_loss: 1.2524, test_loss: 1.3045, test_f1: 0.2281
 epoch: 78, train_loss: 1.2522, test_loss: 1.3053, test_f1: 0.2281
 epoch: 79, train_loss: 1.2523, test_loss: 1.3076, test_f1: 0.2281
 epoch: 80, train_loss: 1.2524, test_loss: 1.3064, test_f1: 0.2281
 epoch: 81, train_loss: 1.2522, test_loss: 1.3060, test_f1: 0.2281
 epoch: 82, train_loss: 1.2521, test_loss: 1.3045, test_f1: 0.2281
 epoch: 83, train_loss: 1.2527, test_loss: 1.3040, test_f1: 0.2281
 epoch: 84, train_loss: 1.2523, test_loss: 1.3034, test_f1: 0.2281
 epoch: 85, train_loss: 1.2527, test_loss: 1.3057, test_f1: 0.2281
 epoch: 86, train_loss: 1.2530, test_loss: 1.3049, test_f1: 0.2281
 epoch: 87, train_loss: 1.2532, test_loss: 1.3057, test_f1: 0.2281
 epoch: 88, train_loss: 1.2524, test_loss: 1.3066, test_f1: 0.2281
 epoch: 89, train_loss: 1.2521, test_loss: 1.3053, test_f1: 0.2281
 epoch: 90, train_loss: 1.2529, test_loss: 1.3038, test_f1: 0.2281
 epoch: 91, train_loss: 1.2527, test_loss: 1.3083, test_f1: 0.2281
 epoch: 92, train_loss: 1.2533, test_loss: 1.3083, test_f1: 0.2281
 epoch: 93, train_loss: 1.2528, test_loss: 1.3068, test_f1: 0.2281
 epoch: 94, train_loss: 1.2524, test_loss: 1.3061, test_f1: 0.2281
 epoch: 95, train_loss: 1.2522, test_loss: 1.3030, test_f1: 0.2281
 epoch: 96, train_loss: 1.2522, test_loss: 1.3024, test_f1: 0.2281
 epoch: 97, train_loss: 1.2523, test_loss: 1.3042, test_f1: 0.2281
 epoch: 98, train_loss: 1.2523, test_loss: 1.3075, test_f1: 0.2281
 epoch: 99, train_loss: 1.2528, test_loss: 1.3090, test_f1: 0.2281
##################ITERATION #8 ****************************************
 epoch: 0, train_loss: 1.3626, test_loss: 1.3271, test_f1: 0.2281
 epoch: 1, train_loss: 1.2619, test_loss: 1.3267, test_f1: 0.2281
 epoch: 2, train_loss: 1.2587, test_loss: 1.3160, test_f1: 0.2281
 epoch: 3, train_loss: 1.2538, test_loss: 1.3081, test_f1: 0.2281
 epoch: 4, train_loss: 1.2529, test_loss: 1.3035, test_f1: 0.2281
 epoch: 5, train_loss: 1.2531, test_loss: 1.3030, test_f1: 0.2281
 epoch: 6, train_loss: 1.2529, test_loss: 1.3012, test_f1: 0.2281
 epoch: 7, train_loss: 1.2535, test_loss: 1.3006, test_f1: 0.2281
 epoch: 8, train_loss: 1.2534, test_loss: 1.3000, test_f1: 0.2281
 epoch: 9, train_loss: 1.2526, test_loss: 1.3043, test_f1: 0.2281
 epoch: 10, train_loss: 1.2518, test_loss: 1.3090, test_f1: 0.2281
 epoch: 11, train_loss: 1.2538, test_loss: 1.3110, test_f1: 0.2281
 epoch: 12, train_loss: 1.2531, test_loss: 1.3039, test_f1: 0.2281
 epoch: 13, train_loss: 1.2529, test_loss: 1.3020, test_f1: 0.2281
 epoch: 14, train_loss: 1.2523, test_loss: 1.3048, test_f1: 0.2281
 epoch: 15, train_loss: 1.2548, test_loss: 1.3090, test_f1: 0.2281
 epoch: 16, train_loss: 1.2533, test_loss: 1.3050, test_f1: 0.2281
 epoch: 17, train_loss: 1.2520, test_loss: 1.3010, test_f1: 0.2281
 epoch: 18, train_loss: 1.2534, test_loss: 1.3025, test_f1: 0.2281
 epoch: 19, train_loss: 1.2529, test_loss: 1.3065, test_f1: 0.2281
 epoch: 20, train_loss: 1.2526, test_loss: 1.3124, test_f1: 0.2281
 epoch: 21, train_loss: 1.2552, test_loss: 1.3155, test_f1: 0.2281
 epoch: 22, train_loss: 1.2540, test_loss: 1.3077, test_f1: 0.2281
 epoch: 23, train_loss: 1.2526, test_loss: 1.3033, test_f1: 0.2281
 epoch: 24, train_loss: 1.2532, test_loss: 1.3034, test_f1: 0.2281
 epoch: 25, train_loss: 1.2526, test_loss: 1.3030, test_f1: 0.2281
 epoch: 26, train_loss: 1.2525, test_loss: 1.3036, test_f1: 0.2281
 epoch: 27, train_loss: 1.2520, test_loss: 1.3066, test_f1: 0.2281
 epoch: 28, train_loss: 1.2526, test_loss: 1.3047, test_f1: 0.2281
 epoch: 29, train_loss: 1.2531, test_loss: 1.3004, test_f1: 0.2281
 epoch: 30, train_loss: 1.2541, test_loss: 1.3071, test_f1: 0.2281
 epoch: 31, train_loss: 1.2524, test_loss: 1.3087, test_f1: 0.2281
 epoch: 32, train_loss: 1.2533, test_loss: 1.3104, test_f1: 0.2281
 epoch: 33, train_loss: 1.2531, test_loss: 1.3053, test_f1: 0.2281
 epoch: 34, train_loss: 1.2527, test_loss: 1.3018, test_f1: 0.2281
 epoch: 35, train_loss: 1.2524, test_loss: 1.3032, test_f1: 0.2281
 epoch: 36, train_loss: 1.2529, test_loss: 1.3052, test_f1: 0.2281
 epoch: 37, train_loss: 1.2529, test_loss: 1.3073, test_f1: 0.2281
 epoch: 38, train_loss: 1.2523, test_loss: 1.3095, test_f1: 0.2281
 epoch: 39, train_loss: 1.2528, test_loss: 1.3059, test_f1: 0.2281
 epoch: 40, train_loss: 1.2521, test_loss: 1.3031, test_f1: 0.2281
 epoch: 41, train_loss: 1.2525, test_loss: 1.3041, test_f1: 0.2281
 epoch: 42, train_loss: 1.2536, test_loss: 1.3054, test_f1: 0.2281
 epoch: 43, train_loss: 1.2538, test_loss: 1.3153, test_f1: 0.1365
 epoch: 44, train_loss: 1.2574, test_loss: 1.3118, test_f1: 0.2281
 epoch: 45, train_loss: 1.2529, test_loss: 1.3048, test_f1: 0.2281
 epoch: 46, train_loss: 1.2532, test_loss: 1.3038, test_f1: 0.2281
 epoch: 47, train_loss: 1.2529, test_loss: 1.3055, test_f1: 0.2281
 epoch: 48, train_loss: 1.2532, test_loss: 1.3093, test_f1: 0.2281
 epoch: 49, train_loss: 1.2530, test_loss: 1.3092, test_f1: 0.2281
 epoch: 50, train_loss: 1.2523, test_loss: 1.3052, test_f1: 0.2281
 epoch: 51, train_loss: 1.2521, test_loss: 1.3051, test_f1: 0.2281
 epoch: 52, train_loss: 1.2530, test_loss: 1.3056, test_f1: 0.2281
 epoch: 53, train_loss: 1.2526, test_loss: 1.3044, test_f1: 0.2281
 epoch: 54, train_loss: 1.2518, test_loss: 1.3038, test_f1: 0.2281
 epoch: 55, train_loss: 1.2525, test_loss: 1.3026, test_f1: 0.2281
 epoch: 56, train_loss: 1.2525, test_loss: 1.3023, test_f1: 0.2281
 epoch: 57, train_loss: 1.2527, test_loss: 1.3034, test_f1: 0.2281
 epoch: 58, train_loss: 1.2524, test_loss: 1.3041, test_f1: 0.2281
 epoch: 59, train_loss: 1.2522, test_loss: 1.3055, test_f1: 0.2281
 epoch: 60, train_loss: 1.2520, test_loss: 1.3056, test_f1: 0.2281
 epoch: 61, train_loss: 1.2523, test_loss: 1.3040, test_f1: 0.2281
 epoch: 62, train_loss: 1.2528, test_loss: 1.3029, test_f1: 0.2281
 epoch: 63, train_loss: 1.2525, test_loss: 1.3039, test_f1: 0.2281
 epoch: 64, train_loss: 1.2523, test_loss: 1.3037, test_f1: 0.2281
 epoch: 65, train_loss: 1.2521, test_loss: 1.3028, test_f1: 0.2281
 epoch: 66, train_loss: 1.2521, test_loss: 1.3027, test_f1: 0.2281
 epoch: 67, train_loss: 1.2521, test_loss: 1.3025, test_f1: 0.2281
 epoch: 68, train_loss: 1.2526, test_loss: 1.3038, test_f1: 0.2281
 epoch: 69, train_loss: 1.2527, test_loss: 1.3042, test_f1: 0.2281
 epoch: 70, train_loss: 1.2522, test_loss: 1.3058, test_f1: 0.2281
 epoch: 71, train_loss: 1.2527, test_loss: 1.3072, test_f1: 0.2281
 epoch: 72, train_loss: 1.2532, test_loss: 1.3083, test_f1: 0.2281
 epoch: 73, train_loss: 1.2521, test_loss: 1.3060, test_f1: 0.2281
 epoch: 74, train_loss: 1.2523, test_loss: 1.3067, test_f1: 0.2281
 epoch: 75, train_loss: 1.2530, test_loss: 1.3054, test_f1: 0.2281
 epoch: 76, train_loss: 1.2528, test_loss: 1.3037, test_f1: 0.2281
 epoch: 77, train_loss: 1.2526, test_loss: 1.3063, test_f1: 0.2281
 epoch: 78, train_loss: 1.2528, test_loss: 1.3085, test_f1: 0.2281
 epoch: 79, train_loss: 1.2531, test_loss: 1.3100, test_f1: 0.2281
 epoch: 80, train_loss: 1.2530, test_loss: 1.3065, test_f1: 0.2281
 epoch: 81, train_loss: 1.2524, test_loss: 1.3055, test_f1: 0.2281
 epoch: 82, train_loss: 1.2523, test_loss: 1.3053, test_f1: 0.2281
 epoch: 83, train_loss: 1.2523, test_loss: 1.3052, test_f1: 0.2281
 epoch: 84, train_loss: 1.2534, test_loss: 1.3022, test_f1: 0.2281
 epoch: 85, train_loss: 1.2527, test_loss: 1.3006, test_f1: 0.2281
 epoch: 86, train_loss: 1.2526, test_loss: 1.3041, test_f1: 0.2281
 epoch: 87, train_loss: 1.2531, test_loss: 1.3065, test_f1: 0.2281
 epoch: 88, train_loss: 1.2527, test_loss: 1.3073, test_f1: 0.2281
 epoch: 89, train_loss: 1.2524, test_loss: 1.3095, test_f1: 0.2281
 epoch: 90, train_loss: 1.2530, test_loss: 1.3084, test_f1: 0.2281
 epoch: 91, train_loss: 1.2522, test_loss: 1.3047, test_f1: 0.2281
 epoch: 92, train_loss: 1.2521, test_loss: 1.3036, test_f1: 0.2281
 epoch: 93, train_loss: 1.2525, test_loss: 1.3026, test_f1: 0.2281
 epoch: 94, train_loss: 1.2524, test_loss: 1.3040, test_f1: 0.2281
 epoch: 95, train_loss: 1.2522, test_loss: 1.3034, test_f1: 0.2281
 epoch: 96, train_loss: 1.2523, test_loss: 1.3028, test_f1: 0.2281
 epoch: 97, train_loss: 1.2522, test_loss: 1.3046, test_f1: 0.2281
 epoch: 98, train_loss: 1.2521, test_loss: 1.3066, test_f1: 0.2281
 epoch: 99, train_loss: 1.2522, test_loss: 1.3060, test_f1: 0.2281
##################ITERATION #9 ****************************************
 epoch: 0, train_loss: 1.2638, test_loss: 1.8041, test_f1: 0.1365
 epoch: 1, train_loss: 1.2354, test_loss: 1.6516, test_f1: 0.2281
 epoch: 2, train_loss: 1.1928, test_loss: 1.6949, test_f1: 0.1497
 epoch: 3, train_loss: 1.1721, test_loss: 1.4940, test_f1: 0.2583
 epoch: 4, train_loss: 1.1374, test_loss: 1.4607, test_f1: 0.3122
 epoch: 5, train_loss: 1.1401, test_loss: 1.4822, test_f1: 0.2336
 epoch: 6, train_loss: 1.1103, test_loss: 1.2317, test_f1: 0.4357
 epoch: 7, train_loss: 1.1052, test_loss: 1.1867, test_f1: 0.3731
 epoch: 8, train_loss: 1.0707, test_loss: 1.2047, test_f1: 0.3115
 epoch: 9, train_loss: 1.0712, test_loss: 1.3231, test_f1: 0.2929
 epoch: 10, train_loss: 1.0581, test_loss: 1.2033, test_f1: 0.2949
 epoch: 11, train_loss: 1.0820, test_loss: 1.2501, test_f1: 0.3933
 epoch: 12, train_loss: 1.1353, test_loss: 1.2528, test_f1: 0.3395
 epoch: 13, train_loss: 1.0788, test_loss: 1.2531, test_f1: 0.4101
 epoch: 14, train_loss: 1.0673, test_loss: 1.2971, test_f1: 0.2913
 epoch: 15, train_loss: 1.0742, test_loss: 1.3248, test_f1: 0.2711
 epoch: 16, train_loss: 1.0620, test_loss: 1.1968, test_f1: 0.3072
 epoch: 17, train_loss: 1.0747, test_loss: 1.3898, test_f1: 0.3267
 epoch: 18, train_loss: 1.0787, test_loss: 1.1228, test_f1: 0.4440
 epoch: 19, train_loss: 1.0645, test_loss: 2.1173, test_f1: 0.1663
 epoch: 20, train_loss: 1.0604, test_loss: 1.1757, test_f1: 0.3195
 epoch: 21, train_loss: 1.1175, test_loss: 1.3222, test_f1: 0.2631
 epoch: 22, train_loss: 1.0767, test_loss: 1.3747, test_f1: 0.3128
 epoch: 23, train_loss: 1.0708, test_loss: 1.2689, test_f1: 0.3394
 epoch: 24, train_loss: 1.0599, test_loss: 1.1864, test_f1: 0.3051
 epoch: 25, train_loss: 1.0482, test_loss: 1.1767, test_f1: 0.4224
 epoch: 26, train_loss: 1.0325, test_loss: 1.2192, test_f1: 0.4106
 epoch: 27, train_loss: 1.0455, test_loss: 1.1935, test_f1: 0.3262
 epoch: 28, train_loss: 1.0252, test_loss: 1.1922, test_f1: 0.4044
 epoch: 29, train_loss: 1.0319, test_loss: 1.1359, test_f1: 0.3395
 epoch: 30, train_loss: 1.0227, test_loss: 1.1415, test_f1: 0.4540
 epoch: 31, train_loss: 1.0271, test_loss: 1.1229, test_f1: 0.3344
 epoch: 32, train_loss: 1.0124, test_loss: 1.1037, test_f1: 0.3780
 epoch: 33, train_loss: 1.0154, test_loss: 1.1044, test_f1: 0.3387
 epoch: 34, train_loss: 1.0220, test_loss: 1.1036, test_f1: 0.3507
 epoch: 35, train_loss: 1.0122, test_loss: 1.1269, test_f1: 0.4194
 epoch: 36, train_loss: 1.0054, test_loss: 1.1374, test_f1: 0.3699
 epoch: 37, train_loss: 1.0109, test_loss: 1.1821, test_f1: 0.3083
 epoch: 38, train_loss: 1.0149, test_loss: 1.1929, test_f1: 0.4097
 epoch: 39, train_loss: 0.9963, test_loss: 1.2370, test_f1: 0.3954
 epoch: 40, train_loss: 1.0087, test_loss: 1.1608, test_f1: 0.4297
 epoch: 41, train_loss: 1.0004, test_loss: 1.1653, test_f1: 0.4262
 epoch: 42, train_loss: 1.0024, test_loss: 1.2218, test_f1: 0.3991
 epoch: 43, train_loss: 1.0152, test_loss: 1.0898, test_f1: 0.3421
 epoch: 44, train_loss: 1.0164, test_loss: 1.2652, test_f1: 0.3877
 epoch: 45, train_loss: 1.2421, test_loss: 1.2889, test_f1: 0.2281
 epoch: 46, train_loss: 1.2392, test_loss: 1.3458, test_f1: 0.2289
 epoch: 47, train_loss: 1.2085, test_loss: 1.3012, test_f1: 0.2281
 epoch: 48, train_loss: 1.2332, test_loss: 1.2943, test_f1: 0.2281
 epoch: 49, train_loss: 1.2013, test_loss: 1.2978, test_f1: 0.2586
 epoch: 50, train_loss: 1.3967, test_loss: 1.4217, test_f1: 0.2571
 epoch: 51, train_loss: 1.1615, test_loss: 1.3041, test_f1: 0.2949
 epoch: 52, train_loss: 1.1268, test_loss: 1.1786, test_f1: 0.3200
 epoch: 53, train_loss: 1.1388, test_loss: 1.2012, test_f1: 0.3124
 epoch: 54, train_loss: 1.1022, test_loss: 1.1413, test_f1: 0.3421
 epoch: 55, train_loss: 1.0770, test_loss: 1.1521, test_f1: 0.3344
 epoch: 56, train_loss: 1.0742, test_loss: 1.1499, test_f1: 0.3344
 epoch: 57, train_loss: 1.0650, test_loss: 1.1254, test_f1: 0.4317
 epoch: 58, train_loss: 1.0755, test_loss: 1.1172, test_f1: 0.3438
 epoch: 59, train_loss: 1.0817, test_loss: 1.1609, test_f1: 0.3314
 epoch: 60, train_loss: 1.0724, test_loss: 1.1295, test_f1: 0.3438
 epoch: 61, train_loss: 1.0565, test_loss: 1.1283, test_f1: 0.3421
 epoch: 62, train_loss: 1.0543, test_loss: 1.1206, test_f1: 0.3421
 epoch: 63, train_loss: 1.0721, test_loss: 1.1325, test_f1: 0.3370
 epoch: 64, train_loss: 1.0686, test_loss: 1.1126, test_f1: 0.3754
 epoch: 65, train_loss: 1.0589, test_loss: 1.2826, test_f1: 0.2962
 epoch: 66, train_loss: 1.0814, test_loss: 1.3728, test_f1: 0.2847
 epoch: 67, train_loss: 1.0721, test_loss: 1.1342, test_f1: 0.3424
 epoch: 68, train_loss: 1.0516, test_loss: 1.1475, test_f1: 0.3395
 epoch: 69, train_loss: 1.0601, test_loss: 1.1495, test_f1: 0.3344
 epoch: 70, train_loss: 1.0595, test_loss: 1.1341, test_f1: 0.3395
 epoch: 71, train_loss: 1.0479, test_loss: 1.1365, test_f1: 0.3395
 epoch: 72, train_loss: 1.0504, test_loss: 1.1614, test_f1: 0.3317
 epoch: 73, train_loss: 1.0552, test_loss: 1.1548, test_f1: 0.3317
 epoch: 74, train_loss: 1.0505, test_loss: 1.1328, test_f1: 0.3344
 epoch: 75, train_loss: 1.0587, test_loss: 1.1348, test_f1: 0.3822
 epoch: 76, train_loss: 1.0406, test_loss: 1.1311, test_f1: 0.3395
 epoch: 77, train_loss: 1.0424, test_loss: 1.1328, test_f1: 0.3384
 epoch: 78, train_loss: 1.0412, test_loss: 1.1289, test_f1: 0.4190
 epoch: 79, train_loss: 1.0413, test_loss: 1.1666, test_f1: 0.3384
 epoch: 80, train_loss: 1.0371, test_loss: 1.1335, test_f1: 0.3395
 epoch: 81, train_loss: 1.0375, test_loss: 1.1398, test_f1: 0.4318
 epoch: 82, train_loss: 1.0409, test_loss: 1.1344, test_f1: 0.3438
 epoch: 83, train_loss: 1.0339, test_loss: 1.1473, test_f1: 0.4337
 epoch: 84, train_loss: 1.0324, test_loss: 1.1573, test_f1: 0.3362
 epoch: 85, train_loss: 1.0196, test_loss: 1.1285, test_f1: 0.3395
 epoch: 86, train_loss: 1.0330, test_loss: 1.1544, test_f1: 0.3975
 epoch: 87, train_loss: 1.0289, test_loss: 1.1500, test_f1: 0.4159
 epoch: 88, train_loss: 1.0404, test_loss: 1.1139, test_f1: 0.3438
 epoch: 89, train_loss: 1.0421, test_loss: 1.1229, test_f1: 0.3420
 epoch: 90, train_loss: 1.0258, test_loss: 1.1386, test_f1: 0.4315
 epoch: 91, train_loss: 1.0296, test_loss: 1.1333, test_f1: 0.4355
 epoch: 92, train_loss: 1.0223, test_loss: 1.1296, test_f1: 0.3861
 epoch: 93, train_loss: 1.0284, test_loss: 1.1197, test_f1: 0.3420
 epoch: 94, train_loss: 1.0239, test_loss: 1.1841, test_f1: 0.4273
 epoch: 95, train_loss: 1.0194, test_loss: 1.1186, test_f1: 0.3994
 epoch: 96, train_loss: 1.0399, test_loss: 1.1394, test_f1: 0.4235
 epoch: 97, train_loss: 1.0383, test_loss: 1.1302, test_f1: 0.3395
 epoch: 98, train_loss: 1.0320, test_loss: 1.1215, test_f1: 0.3395
 epoch: 99, train_loss: 1.0300, test_loss: 1.1438, test_f1: 0.4241

Training completed in 293.51 seconds
Best F1: 0.5983 at epoch 89
Mean F1 across iterations: 0.4130  0.1382
========================FINAL RESULTS================================
FEGIN weighted F1: 0.5983  0.1382
python main.py --data ltspice_demos --representation component_pin_net --model FEGIN --layers 2 --hiddens 32 --batch_size 256 --lr 0.1 --emb_size 250 --epochs 100 --save_appendix component_pin_net_L2_H32_BS256_LR0.1_E250 --no_val
-----



STDERR:
  File "main.py", line 370, in <module>
    main()
  File "main.py", line 254, in main
    dataset = dataset_class(
  File "/home/philip/projects/ltspice_examples_code_repo/Circuit-Completion-Using-GNNs/component_classification_with_link_prediction_head/evaluation/FEGIN/kernel/circuit_datasets.py", line 15, in __init__
    self.data, self.slices = torch.load(self.processed_paths[0])
  File "/home/philip/.local/lib/python3.8/site-packages/torch/serialization.py", line 1040, in load
    warnings.warn(
  File "/usr/lib/python3.8/warnings.py", line 109, in _showwarnmsg
    sw(msg.message, msg.category, msg.filename, msg.lineno,
  File "main.py", line 47, in warn_with_traceback
    traceback.print_stack(file=log)
/home/philip/projects/ltspice_examples_code_repo/Circuit-Completion-Using-GNNs/component_classification_with_link_prediction_head/evaluation/FEGIN/kernel/circuit_datasets.py:15: FutureWarning: You are using `torch.load` with `weights_only=False` (the current default value), which uses the default pickle module implicitly. It is possible to construct malicious pickle data which will execute arbitrary code during unpickling (See https://github.com/pytorch/pytorch/blob/main/SECURITY.md#untrusted-models for more details). In a future release, the default value for `weights_only` will be flipped to `True`. This limits the functions that could be executed during unpickling. Arbitrary objects will no longer be allowed to be loaded via this mode unless they are explicitly allowlisted by the user via `torch.serialization.add_safe_globals`. We recommend you start setting `weights_only=True` for any use case where you don't have full control of the loaded file. Please open an issue on GitHub for any issues related to this experimental feature.
  self.data, self.slices = torch.load(self.processed_paths[0])
