STDOUT:
Results will be saved in /home/philip/projects/llm_inference_code_repo/Circuit-Completion-Using-GNNs/component_classification_with_link_prediction_head/evaluation/FEGIN/results/model_FEGIN_dataset_ltspice_examples
Command line input: python main.py --data ltspice_examples --representation component_net --model FEGIN --layers 4 --hiddens 128 --batch_size 256 --lr 0.001 --emb_size 128 --epochs 100 --save_appendix component_net_L4_H128_BS256_LR0.001_E128 --no_val
 is saved.
-----
ltspice_examples - FEGIN
Using 4 layers, 128 hidden units, h = 2
Loading component_net representation dataset
ENTERED
Training FEGIN on component_net representation
Train: 3558, Test: 846
##################ITERATION #0 ****************************************
 epoch: 0, train_loss: 1.2894, test_loss: 1.3060, test_f1: 0.2270
 epoch: 1, train_loss: 1.1696, test_loss: 1.2214, test_f1: 0.3114
 epoch: 2, train_loss: 1.0820, test_loss: 1.1351, test_f1: 0.3824
 epoch: 3, train_loss: 0.9942, test_loss: 1.0125, test_f1: 0.4675
 epoch: 4, train_loss: 0.9297, test_loss: 1.0028, test_f1: 0.4848
 epoch: 5, train_loss: 0.9013, test_loss: 1.0927, test_f1: 0.4699
 epoch: 6, train_loss: 0.8780, test_loss: 0.9313, test_f1: 0.5267
 epoch: 7, train_loss: 0.8614, test_loss: 0.9365, test_f1: 0.5738
 epoch: 8, train_loss: 0.8326, test_loss: 0.9042, test_f1: 0.5103
 epoch: 9, train_loss: 0.7997, test_loss: 0.9060, test_f1: 0.5455
 epoch: 10, train_loss: 0.8004, test_loss: 0.9108, test_f1: 0.5652
 epoch: 11, train_loss: 0.7797, test_loss: 0.9148, test_f1: 0.5741
 epoch: 12, train_loss: 0.7628, test_loss: 0.8966, test_f1: 0.5564
 epoch: 13, train_loss: 0.7499, test_loss: 1.0091, test_f1: 0.5916
 epoch: 14, train_loss: 0.7257, test_loss: 0.8889, test_f1: 0.6143
 epoch: 15, train_loss: 0.7170, test_loss: 0.9716, test_f1: 0.5920
 epoch: 16, train_loss: 0.7087, test_loss: 0.9922, test_f1: 0.5712
 epoch: 17, train_loss: 0.6987, test_loss: 0.9370, test_f1: 0.6014
 epoch: 18, train_loss: 0.6788, test_loss: 1.0005, test_f1: 0.6311
 epoch: 19, train_loss: 0.6734, test_loss: 1.0339, test_f1: 0.6022
 epoch: 20, train_loss: 0.6600, test_loss: 0.9658, test_f1: 0.6348
 epoch: 21, train_loss: 0.6522, test_loss: 0.9604, test_f1: 0.5836
 epoch: 22, train_loss: 0.6279, test_loss: 0.9551, test_f1: 0.5961
 epoch: 23, train_loss: 0.5996, test_loss: 0.8594, test_f1: 0.5854
 epoch: 24, train_loss: 0.6048, test_loss: 1.1155, test_f1: 0.5911
 epoch: 25, train_loss: 0.6020, test_loss: 0.9611, test_f1: 0.6496
 epoch: 26, train_loss: 0.5817, test_loss: 1.0371, test_f1: 0.6204
 epoch: 27, train_loss: 0.5678, test_loss: 1.0422, test_f1: 0.6281
 epoch: 28, train_loss: 0.5455, test_loss: 1.1135, test_f1: 0.6079
 epoch: 29, train_loss: 0.5481, test_loss: 0.9981, test_f1: 0.6459
 epoch: 30, train_loss: 0.5253, test_loss: 1.0696, test_f1: 0.6279
 epoch: 31, train_loss: 0.5412, test_loss: 1.2636, test_f1: 0.5977
 epoch: 32, train_loss: 0.5131, test_loss: 1.0504, test_f1: 0.6241
 epoch: 33, train_loss: 0.5014, test_loss: 1.1874, test_f1: 0.6101
 epoch: 34, train_loss: 0.4869, test_loss: 1.0738, test_f1: 0.6748
 epoch: 35, train_loss: 0.4606, test_loss: 1.1806, test_f1: 0.6472
 epoch: 36, train_loss: 0.4447, test_loss: 1.1934, test_f1: 0.6173
 epoch: 37, train_loss: 0.4528, test_loss: 1.2109, test_f1: 0.6603
 epoch: 38, train_loss: 0.4613, test_loss: 1.2768, test_f1: 0.6377
 epoch: 39, train_loss: 0.4410, test_loss: 1.1140, test_f1: 0.6514
 epoch: 40, train_loss: 0.4286, test_loss: 1.3032, test_f1: 0.6498
 epoch: 41, train_loss: 0.4074, test_loss: 1.2914, test_f1: 0.6672
 epoch: 42, train_loss: 0.4039, test_loss: 1.2913, test_f1: 0.6292
 epoch: 43, train_loss: 0.3727, test_loss: 1.3175, test_f1: 0.6120
 epoch: 44, train_loss: 0.4107, test_loss: 1.3615, test_f1: 0.6616
 epoch: 45, train_loss: 0.3883, test_loss: 1.4169, test_f1: 0.6251
 epoch: 46, train_loss: 0.3785, test_loss: 1.1795, test_f1: 0.6612
 epoch: 47, train_loss: 0.3584, test_loss: 1.5359, test_f1: 0.6023
 epoch: 48, train_loss: 0.3513, test_loss: 1.3603, test_f1: 0.6509
 epoch: 49, train_loss: 0.3321, test_loss: 1.5080, test_f1: 0.6247
 epoch: 50, train_loss: 0.3481, test_loss: 1.5426, test_f1: 0.6225
 epoch: 51, train_loss: 0.3058, test_loss: 1.4914, test_f1: 0.6474
 epoch: 52, train_loss: 0.2825, test_loss: 1.5213, test_f1: 0.6565
 epoch: 53, train_loss: 0.2596, test_loss: 1.5101, test_f1: 0.6614
 epoch: 54, train_loss: 0.2472, test_loss: 1.6117, test_f1: 0.6582
 epoch: 55, train_loss: 0.2233, test_loss: 1.7974, test_f1: 0.6282
 epoch: 56, train_loss: 0.2150, test_loss: 1.6770, test_f1: 0.6471
 epoch: 57, train_loss: 0.2178, test_loss: 1.7532, test_f1: 0.6480
 epoch: 58, train_loss: 0.2220, test_loss: 1.9204, test_f1: 0.6206
 epoch: 59, train_loss: 0.2165, test_loss: 1.9901, test_f1: 0.6519
 epoch: 60, train_loss: 0.1963, test_loss: 1.8493, test_f1: 0.6662
 epoch: 61, train_loss: 0.2020, test_loss: 1.8435, test_f1: 0.6366
 epoch: 62, train_loss: 0.1910, test_loss: 2.0076, test_f1: 0.6347
 epoch: 63, train_loss: 0.2054, test_loss: 1.8822, test_f1: 0.6697
 epoch: 64, train_loss: 0.1967, test_loss: 2.0205, test_f1: 0.6411
 epoch: 65, train_loss: 0.1868, test_loss: 1.9420, test_f1: 0.6590
 epoch: 66, train_loss: 0.1823, test_loss: 2.0149, test_f1: 0.6323
 epoch: 67, train_loss: 0.1934, test_loss: 2.0932, test_f1: 0.6226
 epoch: 68, train_loss: 0.1810, test_loss: 2.1250, test_f1: 0.6494
 epoch: 69, train_loss: 0.1872, test_loss: 2.0778, test_f1: 0.6076
 epoch: 70, train_loss: 0.1808, test_loss: 2.2538, test_f1: 0.6402
 epoch: 71, train_loss: 0.1933, test_loss: 2.1758, test_f1: 0.6515
 epoch: 72, train_loss: 0.1814, test_loss: 1.9838, test_f1: 0.6386
 epoch: 73, train_loss: 0.1827, test_loss: 2.0932, test_f1: 0.6538
 epoch: 74, train_loss: 0.1939, test_loss: 2.0689, test_f1: 0.6354
 epoch: 75, train_loss: 0.1925, test_loss: 2.1918, test_f1: 0.5985
 epoch: 76, train_loss: 0.1853, test_loss: 2.4046, test_f1: 0.6268
 epoch: 77, train_loss: 0.1782, test_loss: 2.1783, test_f1: 0.6170
 epoch: 78, train_loss: 0.1740, test_loss: 2.1110, test_f1: 0.6351
 epoch: 79, train_loss: 0.1849, test_loss: 2.1554, test_f1: 0.6297
 epoch: 80, train_loss: 0.1620, test_loss: 2.1253, test_f1: 0.6458
 epoch: 81, train_loss: 0.1648, test_loss: 2.2138, test_f1: 0.6284
 epoch: 82, train_loss: 0.1768, test_loss: 2.2995, test_f1: 0.6316
 epoch: 83, train_loss: 0.1540, test_loss: 2.4058, test_f1: 0.6300
 epoch: 84, train_loss: 0.1540, test_loss: 2.2663, test_f1: 0.6554
 epoch: 85, train_loss: 0.1584, test_loss: 2.4746, test_f1: 0.6251
 epoch: 86, train_loss: 0.1535, test_loss: 2.4049, test_f1: 0.6499
 epoch: 87, train_loss: 0.1520, test_loss: 2.3301, test_f1: 0.6277
 epoch: 88, train_loss: 0.1607, test_loss: 2.3822, test_f1: 0.6513
 epoch: 89, train_loss: 0.1881, test_loss: 2.6242, test_f1: 0.6453
 epoch: 90, train_loss: 0.1800, test_loss: 2.3999, test_f1: 0.6093
 epoch: 91, train_loss: 0.1552, test_loss: 2.2730, test_f1: 0.6446
 epoch: 92, train_loss: 0.1488, test_loss: 2.5701, test_f1: 0.6657
 epoch: 93, train_loss: 0.1605, test_loss: 2.6391, test_f1: 0.6476
 epoch: 94, train_loss: 0.1536, test_loss: 2.7720, test_f1: 0.5979
 epoch: 95, train_loss: 0.1468, test_loss: 2.6476, test_f1: 0.6323
 epoch: 96, train_loss: 0.1387, test_loss: 2.4440, test_f1: 0.6364
 epoch: 97, train_loss: 0.1403, test_loss: 2.5755, test_f1: 0.6428
 epoch: 98, train_loss: 0.1299, test_loss: 2.6023, test_f1: 0.6487
 epoch: 99, train_loss: 0.1330, test_loss: 2.5530, test_f1: 0.6496
##################ITERATION #1 ****************************************
 epoch: 0, train_loss: 1.1595, test_loss: 1.2456, test_f1: 0.3139
 epoch: 1, train_loss: 0.9887, test_loss: 1.1895, test_f1: 0.3455
 epoch: 2, train_loss: 0.9192, test_loss: 1.1416, test_f1: 0.4317
 epoch: 3, train_loss: 0.8839, test_loss: 0.9811, test_f1: 0.5237
 epoch: 4, train_loss: 0.8579, test_loss: 0.9092, test_f1: 0.5470
 epoch: 5, train_loss: 0.8306, test_loss: 0.9044, test_f1: 0.5543
 epoch: 6, train_loss: 0.8179, test_loss: 0.9642, test_f1: 0.5448
 epoch: 7, train_loss: 0.8148, test_loss: 0.9898, test_f1: 0.5241
 epoch: 8, train_loss: 0.7951, test_loss: 0.8694, test_f1: 0.5536
 epoch: 9, train_loss: 0.7797, test_loss: 0.9309, test_f1: 0.5337
 epoch: 10, train_loss: 0.7672, test_loss: 0.9115, test_f1: 0.5560
 epoch: 11, train_loss: 0.7327, test_loss: 0.9475, test_f1: 0.5965
 epoch: 12, train_loss: 0.7092, test_loss: 0.9354, test_f1: 0.5978
 epoch: 13, train_loss: 0.7185, test_loss: 1.0367, test_f1: 0.5555
 epoch: 14, train_loss: 0.6948, test_loss: 0.9635, test_f1: 0.6182
 epoch: 15, train_loss: 0.6953, test_loss: 0.8471, test_f1: 0.6156
 epoch: 16, train_loss: 0.6720, test_loss: 0.9342, test_f1: 0.5738
 epoch: 17, train_loss: 0.6631, test_loss: 0.9736, test_f1: 0.6061
 epoch: 18, train_loss: 0.6397, test_loss: 0.8939, test_f1: 0.6438
 epoch: 19, train_loss: 0.6303, test_loss: 1.0857, test_f1: 0.5853
 epoch: 20, train_loss: 0.6269, test_loss: 1.0295, test_f1: 0.5998
 epoch: 21, train_loss: 0.6201, test_loss: 0.9431, test_f1: 0.6387
 epoch: 22, train_loss: 0.5976, test_loss: 0.9840, test_f1: 0.6247
 epoch: 23, train_loss: 0.5593, test_loss: 1.0015, test_f1: 0.5693
 epoch: 24, train_loss: 0.5771, test_loss: 0.9949, test_f1: 0.6274
 epoch: 25, train_loss: 0.5378, test_loss: 1.0182, test_f1: 0.6232
 epoch: 26, train_loss: 0.5319, test_loss: 1.1076, test_f1: 0.6225
 epoch: 27, train_loss: 0.5145, test_loss: 1.1184, test_f1: 0.5876
 epoch: 28, train_loss: 0.5411, test_loss: 1.2066, test_f1: 0.6004
 epoch: 29, train_loss: 0.5427, test_loss: 1.0930, test_f1: 0.6083
 epoch: 30, train_loss: 0.5121, test_loss: 1.2629, test_f1: 0.5599
 epoch: 31, train_loss: 0.4902, test_loss: 1.0042, test_f1: 0.6449
 epoch: 32, train_loss: 0.4823, test_loss: 1.0327, test_f1: 0.6400
 epoch: 33, train_loss: 0.4545, test_loss: 1.1534, test_f1: 0.6091
 epoch: 34, train_loss: 0.4723, test_loss: 1.1903, test_f1: 0.6257
 epoch: 35, train_loss: 0.4677, test_loss: 1.3628, test_f1: 0.5702
 epoch: 36, train_loss: 0.4506, test_loss: 1.1402, test_f1: 0.6317
 epoch: 37, train_loss: 0.4561, test_loss: 1.2399, test_f1: 0.6117
 epoch: 38, train_loss: 0.4261, test_loss: 1.0760, test_f1: 0.6337
 epoch: 39, train_loss: 0.4046, test_loss: 1.2315, test_f1: 0.6423
 epoch: 40, train_loss: 0.4075, test_loss: 1.2499, test_f1: 0.6364
 epoch: 41, train_loss: 0.3935, test_loss: 1.2038, test_f1: 0.6149
 epoch: 42, train_loss: 0.3877, test_loss: 1.3380, test_f1: 0.6442
 epoch: 43, train_loss: 0.3680, test_loss: 1.3043, test_f1: 0.6360
 epoch: 44, train_loss: 0.3430, test_loss: 1.5221, test_f1: 0.6381
 epoch: 45, train_loss: 0.3282, test_loss: 1.5653, test_f1: 0.6318
 epoch: 46, train_loss: 0.3530, test_loss: 1.3833, test_f1: 0.6529
 epoch: 47, train_loss: 0.3442, test_loss: 1.3348, test_f1: 0.6225
 epoch: 48, train_loss: 0.3341, test_loss: 1.4393, test_f1: 0.6387
 epoch: 49, train_loss: 0.3185, test_loss: 1.5025, test_f1: 0.6220
 epoch: 50, train_loss: 0.3242, test_loss: 1.7137, test_f1: 0.6199
 epoch: 51, train_loss: 0.2933, test_loss: 1.4914, test_f1: 0.6322
 epoch: 52, train_loss: 0.2683, test_loss: 1.4643, test_f1: 0.6322
 epoch: 53, train_loss: 0.2543, test_loss: 1.5568, test_f1: 0.6591
 epoch: 54, train_loss: 0.2328, test_loss: 1.6945, test_f1: 0.6432
 epoch: 55, train_loss: 0.2279, test_loss: 1.7503, test_f1: 0.6388
 epoch: 56, train_loss: 0.2185, test_loss: 1.8087, test_f1: 0.6479
 epoch: 57, train_loss: 0.2063, test_loss: 1.7380, test_f1: 0.6367
 epoch: 58, train_loss: 0.2103, test_loss: 1.7747, test_f1: 0.6378
 epoch: 59, train_loss: 0.2107, test_loss: 1.8807, test_f1: 0.6152
 epoch: 60, train_loss: 0.2047, test_loss: 1.9146, test_f1: 0.6203
 epoch: 61, train_loss: 0.2195, test_loss: 1.8329, test_f1: 0.5903
 epoch: 62, train_loss: 0.2158, test_loss: 1.8587, test_f1: 0.6598
 epoch: 63, train_loss: 0.1918, test_loss: 1.8634, test_f1: 0.6584
 epoch: 64, train_loss: 0.1949, test_loss: 1.9791, test_f1: 0.6284
 epoch: 65, train_loss: 0.1818, test_loss: 1.8032, test_f1: 0.6667
 epoch: 66, train_loss: 0.2042, test_loss: 1.7783, test_f1: 0.6524
 epoch: 67, train_loss: 0.1869, test_loss: 1.8002, test_f1: 0.6239
 epoch: 68, train_loss: 0.1958, test_loss: 2.0416, test_f1: 0.6470
 epoch: 69, train_loss: 0.1766, test_loss: 2.0263, test_f1: 0.6223
 epoch: 70, train_loss: 0.1724, test_loss: 1.9186, test_f1: 0.6429
 epoch: 71, train_loss: 0.1782, test_loss: 2.1860, test_f1: 0.6161
 epoch: 72, train_loss: 0.1899, test_loss: 1.8270, test_f1: 0.6178
 epoch: 73, train_loss: 0.1803, test_loss: 2.0820, test_f1: 0.6336
 epoch: 74, train_loss: 0.1676, test_loss: 2.2403, test_f1: 0.6479
 epoch: 75, train_loss: 0.1801, test_loss: 2.0140, test_f1: 0.6365
 epoch: 76, train_loss: 0.1789, test_loss: 2.0626, test_f1: 0.6340
 epoch: 77, train_loss: 0.1542, test_loss: 2.0981, test_f1: 0.6593
 epoch: 78, train_loss: 0.1702, test_loss: 2.2395, test_f1: 0.6535
 epoch: 79, train_loss: 0.1847, test_loss: 1.9038, test_f1: 0.6528
 epoch: 80, train_loss: 0.1642, test_loss: 2.4661, test_f1: 0.6532
 epoch: 81, train_loss: 0.1642, test_loss: 2.1173, test_f1: 0.6153
 epoch: 82, train_loss: 0.1624, test_loss: 2.1926, test_f1: 0.6209
 epoch: 83, train_loss: 0.1592, test_loss: 2.3685, test_f1: 0.6267
 epoch: 84, train_loss: 0.1560, test_loss: 2.3774, test_f1: 0.6026
 epoch: 85, train_loss: 0.1512, test_loss: 2.3236, test_f1: 0.6422
 epoch: 86, train_loss: 0.1641, test_loss: 2.4696, test_f1: 0.6356
 epoch: 87, train_loss: 0.1395, test_loss: 2.4442, test_f1: 0.6250
 epoch: 88, train_loss: 0.1484, test_loss: 2.3766, test_f1: 0.6382
 epoch: 89, train_loss: 0.1470, test_loss: 2.2922, test_f1: 0.6021
 epoch: 90, train_loss: 0.1481, test_loss: 2.4826, test_f1: 0.6289
 epoch: 91, train_loss: 0.1480, test_loss: 2.4637, test_f1: 0.6368
 epoch: 92, train_loss: 0.1398, test_loss: 2.5993, test_f1: 0.6253
 epoch: 93, train_loss: 0.1517, test_loss: 2.4398, test_f1: 0.6117
 epoch: 94, train_loss: 0.1526, test_loss: 2.4312, test_f1: 0.6188
 epoch: 95, train_loss: 0.1490, test_loss: 2.2236, test_f1: 0.6116
 epoch: 96, train_loss: 0.1404, test_loss: 2.8097, test_f1: 0.6028
 epoch: 97, train_loss: 0.1389, test_loss: 2.2885, test_f1: 0.6258
 epoch: 98, train_loss: 0.1256, test_loss: 2.4672, test_f1: 0.6091
 epoch: 99, train_loss: 0.1386, test_loss: 2.6572, test_f1: 0.6160
##################ITERATION #2 ****************************************
 epoch: 0, train_loss: 1.2043, test_loss: 1.2402, test_f1: 0.2295
 epoch: 1, train_loss: 1.0129, test_loss: 1.1452, test_f1: 0.3622
 epoch: 2, train_loss: 0.9573, test_loss: 1.0837, test_f1: 0.4477
 epoch: 3, train_loss: 0.9156, test_loss: 1.0009, test_f1: 0.4878
 epoch: 4, train_loss: 0.8860, test_loss: 1.0096, test_f1: 0.4802
 epoch: 5, train_loss: 0.8579, test_loss: 0.9648, test_f1: 0.5276
 epoch: 6, train_loss: 0.8532, test_loss: 0.8691, test_f1: 0.5558
 epoch: 7, train_loss: 0.8387, test_loss: 0.9180, test_f1: 0.5589
 epoch: 8, train_loss: 0.8297, test_loss: 0.9525, test_f1: 0.5600
 epoch: 9, train_loss: 0.8017, test_loss: 0.9004, test_f1: 0.6028
 epoch: 10, train_loss: 0.7807, test_loss: 0.9434, test_f1: 0.5890
 epoch: 11, train_loss: 0.7492, test_loss: 0.9427, test_f1: 0.5899
 epoch: 12, train_loss: 0.7575, test_loss: 0.9374, test_f1: 0.6098
 epoch: 13, train_loss: 0.7454, test_loss: 0.9584, test_f1: 0.6209
 epoch: 14, train_loss: 0.7340, test_loss: 0.9836, test_f1: 0.5689
 epoch: 15, train_loss: 0.7179, test_loss: 0.9128, test_f1: 0.6016
 epoch: 16, train_loss: 0.6994, test_loss: 0.9819, test_f1: 0.6025
 epoch: 17, train_loss: 0.6970, test_loss: 1.0685, test_f1: 0.5910
 epoch: 18, train_loss: 0.6826, test_loss: 0.9770, test_f1: 0.5871
 epoch: 19, train_loss: 0.6643, test_loss: 0.9736, test_f1: 0.6371
 epoch: 20, train_loss: 0.6446, test_loss: 1.0402, test_f1: 0.5987
 epoch: 21, train_loss: 0.6373, test_loss: 0.9547, test_f1: 0.6331
 epoch: 22, train_loss: 0.6116, test_loss: 0.9598, test_f1: 0.6201
 epoch: 23, train_loss: 0.6079, test_loss: 1.0017, test_f1: 0.6418
 epoch: 24, train_loss: 0.5935, test_loss: 0.9125, test_f1: 0.6409
 epoch: 25, train_loss: 0.5730, test_loss: 0.9553, test_f1: 0.5921
 epoch: 26, train_loss: 0.6125, test_loss: 1.1296, test_f1: 0.5934
 epoch: 27, train_loss: 0.6023, test_loss: 1.1680, test_f1: 0.5737
 epoch: 28, train_loss: 0.6119, test_loss: 1.0411, test_f1: 0.6258
 epoch: 29, train_loss: 0.5817, test_loss: 1.0442, test_f1: 0.6144
 epoch: 30, train_loss: 0.5448, test_loss: 0.9768, test_f1: 0.6594
 epoch: 31, train_loss: 0.5287, test_loss: 0.9974, test_f1: 0.6542
 epoch: 32, train_loss: 0.5306, test_loss: 1.0838, test_f1: 0.6152
 epoch: 33, train_loss: 0.5137, test_loss: 1.0994, test_f1: 0.6454
 epoch: 34, train_loss: 0.4939, test_loss: 1.2308, test_f1: 0.5968
 epoch: 35, train_loss: 0.4845, test_loss: 1.1145, test_f1: 0.6347
 epoch: 36, train_loss: 0.5020, test_loss: 1.1664, test_f1: 0.6257
 epoch: 37, train_loss: 0.4750, test_loss: 1.1181, test_f1: 0.6334
 epoch: 38, train_loss: 0.4723, test_loss: 1.0394, test_f1: 0.6507
 epoch: 39, train_loss: 0.4504, test_loss: 1.1252, test_f1: 0.6722
 epoch: 40, train_loss: 0.4766, test_loss: 1.3873, test_f1: 0.6178
 epoch: 41, train_loss: 0.4879, test_loss: 1.1389, test_f1: 0.6326
 epoch: 42, train_loss: 0.4380, test_loss: 1.3030, test_f1: 0.5896
 epoch: 43, train_loss: 0.4234, test_loss: 1.0946, test_f1: 0.6461
 epoch: 44, train_loss: 0.4085, test_loss: 1.2570, test_f1: 0.6431
 epoch: 45, train_loss: 0.4214, test_loss: 1.2908, test_f1: 0.6599
 epoch: 46, train_loss: 0.4263, test_loss: 1.2645, test_f1: 0.6561
 epoch: 47, train_loss: 0.3885, test_loss: 1.3577, test_f1: 0.6196
 epoch: 48, train_loss: 0.3833, test_loss: 1.3221, test_f1: 0.6080
 epoch: 49, train_loss: 0.3950, test_loss: 1.4247, test_f1: 0.6221
 epoch: 50, train_loss: 0.3845, test_loss: 1.2708, test_f1: 0.6712
 epoch: 51, train_loss: 0.3395, test_loss: 1.3364, test_f1: 0.6415
 epoch: 52, train_loss: 0.3118, test_loss: 1.3525, test_f1: 0.6488
 epoch: 53, train_loss: 0.2987, test_loss: 1.3450, test_f1: 0.6495
 epoch: 54, train_loss: 0.2987, test_loss: 1.3878, test_f1: 0.6554
 epoch: 55, train_loss: 0.2894, test_loss: 1.4273, test_f1: 0.6377
 epoch: 56, train_loss: 0.2722, test_loss: 1.5939, test_f1: 0.6222
 epoch: 57, train_loss: 0.2689, test_loss: 1.5047, test_f1: 0.6568
 epoch: 58, train_loss: 0.2749, test_loss: 1.4808, test_f1: 0.6748
 epoch: 59, train_loss: 0.2628, test_loss: 1.4749, test_f1: 0.6455
 epoch: 60, train_loss: 0.2431, test_loss: 1.6130, test_f1: 0.6292
 epoch: 61, train_loss: 0.2486, test_loss: 1.6404, test_f1: 0.6510
 epoch: 62, train_loss: 0.2355, test_loss: 1.6640, test_f1: 0.6612
 epoch: 63, train_loss: 0.2287, test_loss: 1.7063, test_f1: 0.6252
 epoch: 64, train_loss: 0.2243, test_loss: 1.6848, test_f1: 0.6312
 epoch: 65, train_loss: 0.2248, test_loss: 1.7183, test_f1: 0.6269
 epoch: 66, train_loss: 0.2339, test_loss: 1.8757, test_f1: 0.6272
 epoch: 67, train_loss: 0.2269, test_loss: 1.6259, test_f1: 0.6589
 epoch: 68, train_loss: 0.2276, test_loss: 1.7367, test_f1: 0.6397
 epoch: 69, train_loss: 0.2230, test_loss: 1.8778, test_f1: 0.6373
 epoch: 70, train_loss: 0.2066, test_loss: 1.8491, test_f1: 0.6355
 epoch: 71, train_loss: 0.1998, test_loss: 2.0941, test_f1: 0.6187
 epoch: 72, train_loss: 0.1995, test_loss: 2.0060, test_f1: 0.6280
 epoch: 73, train_loss: 0.2267, test_loss: 1.9198, test_f1: 0.6267
 epoch: 74, train_loss: 0.2252, test_loss: 1.9137, test_f1: 0.6470
 epoch: 75, train_loss: 0.2244, test_loss: 1.9978, test_f1: 0.6128
 epoch: 76, train_loss: 0.2260, test_loss: 1.8723, test_f1: 0.6221
 epoch: 77, train_loss: 0.2132, test_loss: 1.9375, test_f1: 0.6251
 epoch: 78, train_loss: 0.2170, test_loss: 2.0362, test_f1: 0.6115
 epoch: 79, train_loss: 0.2249, test_loss: 1.9188, test_f1: 0.6253
 epoch: 80, train_loss: 0.1992, test_loss: 1.9768, test_f1: 0.6293
 epoch: 81, train_loss: 0.1846, test_loss: 2.1059, test_f1: 0.6341
 epoch: 82, train_loss: 0.1706, test_loss: 2.4116, test_f1: 0.6212
 epoch: 83, train_loss: 0.1800, test_loss: 2.2343, test_f1: 0.6225
 epoch: 84, train_loss: 0.1912, test_loss: 2.1306, test_f1: 0.6048
 epoch: 85, train_loss: 0.1821, test_loss: 2.1015, test_f1: 0.6203
 epoch: 86, train_loss: 0.1692, test_loss: 2.1702, test_f1: 0.6191
 epoch: 87, train_loss: 0.1784, test_loss: 2.1731, test_f1: 0.6426
 epoch: 88, train_loss: 0.1792, test_loss: 2.2741, test_f1: 0.6205
 epoch: 89, train_loss: 0.1948, test_loss: 2.2466, test_f1: 0.6232
 epoch: 90, train_loss: 0.1661, test_loss: 2.2108, test_f1: 0.6164
 epoch: 91, train_loss: 0.1859, test_loss: 2.3683, test_f1: 0.6190
 epoch: 92, train_loss: 0.1737, test_loss: 2.2962, test_f1: 0.6238
 epoch: 93, train_loss: 0.1698, test_loss: 2.2713, test_f1: 0.6271
 epoch: 94, train_loss: 0.1989, test_loss: 2.2407, test_f1: 0.6200
 epoch: 95, train_loss: 0.1717, test_loss: 2.2625, test_f1: 0.6174
 epoch: 96, train_loss: 0.1637, test_loss: 2.2972, test_f1: 0.6223
 epoch: 97, train_loss: 0.1515, test_loss: 2.2601, test_f1: 0.6224
 epoch: 98, train_loss: 0.1438, test_loss: 2.4675, test_f1: 0.6357
 epoch: 99, train_loss: 0.1456, test_loss: 2.3504, test_f1: 0.6359
##################ITERATION #3 ****************************************
 epoch: 0, train_loss: 1.2773, test_loss: 1.2500, test_f1: 0.2819
 epoch: 1, train_loss: 1.0692, test_loss: 1.1447, test_f1: 0.3443
 epoch: 2, train_loss: 0.9664, test_loss: 1.0951, test_f1: 0.3575
 epoch: 3, train_loss: 0.9370, test_loss: 1.0094, test_f1: 0.4129
 epoch: 4, train_loss: 0.8994, test_loss: 0.9860, test_f1: 0.4802
 epoch: 5, train_loss: 0.8587, test_loss: 0.9334, test_f1: 0.5273
 epoch: 6, train_loss: 0.8739, test_loss: 0.9672, test_f1: 0.5509
 epoch: 7, train_loss: 0.8314, test_loss: 0.9126, test_f1: 0.5419
 epoch: 8, train_loss: 0.8283, test_loss: 0.8894, test_f1: 0.5524
 epoch: 9, train_loss: 0.7929, test_loss: 0.9320, test_f1: 0.5614
 epoch: 10, train_loss: 0.7949, test_loss: 0.9328, test_f1: 0.5575
 epoch: 11, train_loss: 0.7803, test_loss: 0.9242, test_f1: 0.5780
 epoch: 12, train_loss: 0.7786, test_loss: 0.9342, test_f1: 0.5707
 epoch: 13, train_loss: 0.7550, test_loss: 0.9193, test_f1: 0.5781
 epoch: 14, train_loss: 0.7406, test_loss: 0.9047, test_f1: 0.5774
 epoch: 15, train_loss: 0.7047, test_loss: 0.9452, test_f1: 0.6012
 epoch: 16, train_loss: 0.7130, test_loss: 0.9746, test_f1: 0.5866
 epoch: 17, train_loss: 0.7168, test_loss: 0.9529, test_f1: 0.6201
 epoch: 18, train_loss: 0.6951, test_loss: 0.9655, test_f1: 0.5957
 epoch: 19, train_loss: 0.6795, test_loss: 0.8838, test_f1: 0.6334
 epoch: 20, train_loss: 0.6672, test_loss: 0.9326, test_f1: 0.5933
 epoch: 21, train_loss: 0.6587, test_loss: 0.9620, test_f1: 0.6211
 epoch: 22, train_loss: 0.6382, test_loss: 0.9720, test_f1: 0.5848
 epoch: 23, train_loss: 0.6440, test_loss: 0.9163, test_f1: 0.6109
 epoch: 24, train_loss: 0.6393, test_loss: 1.0220, test_f1: 0.6061
 epoch: 25, train_loss: 0.6432, test_loss: 0.9904, test_f1: 0.5967
 epoch: 26, train_loss: 0.6255, test_loss: 0.9644, test_f1: 0.6064
 epoch: 27, train_loss: 0.6205, test_loss: 0.9721, test_f1: 0.5986
 epoch: 28, train_loss: 0.6063, test_loss: 0.9466, test_f1: 0.6286
 epoch: 29, train_loss: 0.5800, test_loss: 1.0688, test_f1: 0.6143
 epoch: 30, train_loss: 0.5515, test_loss: 1.0790, test_f1: 0.6241
 epoch: 31, train_loss: 0.5495, test_loss: 1.0090, test_f1: 0.6108
 epoch: 32, train_loss: 0.5330, test_loss: 1.0066, test_f1: 0.6325
 epoch: 33, train_loss: 0.5278, test_loss: 1.0552, test_f1: 0.6203
 epoch: 34, train_loss: 0.5237, test_loss: 1.0259, test_f1: 0.6347
 epoch: 35, train_loss: 0.5019, test_loss: 1.0728, test_f1: 0.6326
 epoch: 36, train_loss: 0.4923, test_loss: 1.0598, test_f1: 0.6266
 epoch: 37, train_loss: 0.4784, test_loss: 1.2574, test_f1: 0.5783
 epoch: 38, train_loss: 0.4994, test_loss: 1.0529, test_f1: 0.6339
 epoch: 39, train_loss: 0.4917, test_loss: 1.0473, test_f1: 0.6254
 epoch: 40, train_loss: 0.5112, test_loss: 1.0619, test_f1: 0.6197
 epoch: 41, train_loss: 0.4710, test_loss: 1.1779, test_f1: 0.6197
 epoch: 42, train_loss: 0.4648, test_loss: 1.2276, test_f1: 0.5892
 epoch: 43, train_loss: 0.4438, test_loss: 1.0302, test_f1: 0.6169
 epoch: 44, train_loss: 0.4188, test_loss: 1.1197, test_f1: 0.6201
 epoch: 45, train_loss: 0.4365, test_loss: 1.2179, test_f1: 0.6416
 epoch: 46, train_loss: 0.4010, test_loss: 1.2024, test_f1: 0.6344
 epoch: 47, train_loss: 0.4078, test_loss: 1.1007, test_f1: 0.6467
 epoch: 48, train_loss: 0.3905, test_loss: 1.1903, test_f1: 0.6242
 epoch: 49, train_loss: 0.3772, test_loss: 1.1986, test_f1: 0.6818
 epoch: 50, train_loss: 0.3817, test_loss: 1.0542, test_f1: 0.6889
 epoch: 51, train_loss: 0.3328, test_loss: 1.2118, test_f1: 0.6610
 epoch: 52, train_loss: 0.3112, test_loss: 1.3277, test_f1: 0.6623
 epoch: 53, train_loss: 0.2934, test_loss: 1.2895, test_f1: 0.6450
 epoch: 54, train_loss: 0.2831, test_loss: 1.3266, test_f1: 0.6520
 epoch: 55, train_loss: 0.2685, test_loss: 1.5272, test_f1: 0.6494
 epoch: 56, train_loss: 0.2680, test_loss: 1.4764, test_f1: 0.6511
 epoch: 57, train_loss: 0.2601, test_loss: 1.3668, test_f1: 0.6510
 epoch: 58, train_loss: 0.2515, test_loss: 1.4547, test_f1: 0.6555
 epoch: 59, train_loss: 0.2602, test_loss: 1.4610, test_f1: 0.6512
 epoch: 60, train_loss: 0.2686, test_loss: 1.3975, test_f1: 0.6593
 epoch: 61, train_loss: 0.2569, test_loss: 1.4763, test_f1: 0.6342
 epoch: 62, train_loss: 0.2411, test_loss: 1.5363, test_f1: 0.6271
 epoch: 63, train_loss: 0.2325, test_loss: 1.5456, test_f1: 0.6474
 epoch: 64, train_loss: 0.2419, test_loss: 1.6941, test_f1: 0.6564
 epoch: 65, train_loss: 0.2247, test_loss: 1.6237, test_f1: 0.6472
 epoch: 66, train_loss: 0.2115, test_loss: 1.6561, test_f1: 0.6249
 epoch: 67, train_loss: 0.2176, test_loss: 1.7128, test_f1: 0.6339
 epoch: 68, train_loss: 0.2313, test_loss: 1.6337, test_f1: 0.6665
 epoch: 69, train_loss: 0.2035, test_loss: 1.5775, test_f1: 0.6410
 epoch: 70, train_loss: 0.1868, test_loss: 1.6666, test_f1: 0.6323
 epoch: 71, train_loss: 0.2120, test_loss: 1.6990, test_f1: 0.6364
 epoch: 72, train_loss: 0.2168, test_loss: 1.7282, test_f1: 0.6545
 epoch: 73, train_loss: 0.2195, test_loss: 1.6876, test_f1: 0.6463
 epoch: 74, train_loss: 0.2034, test_loss: 1.7246, test_f1: 0.6504
 epoch: 75, train_loss: 0.2154, test_loss: 1.6263, test_f1: 0.6704
 epoch: 76, train_loss: 0.1921, test_loss: 1.7600, test_f1: 0.6365
 epoch: 77, train_loss: 0.1957, test_loss: 1.7357, test_f1: 0.6603
 epoch: 78, train_loss: 0.2033, test_loss: 1.7552, test_f1: 0.6445
 epoch: 79, train_loss: 0.1912, test_loss: 1.7773, test_f1: 0.6374
 epoch: 80, train_loss: 0.1911, test_loss: 1.7771, test_f1: 0.6473
 epoch: 81, train_loss: 0.1766, test_loss: 1.7618, test_f1: 0.6617
 epoch: 82, train_loss: 0.1707, test_loss: 1.8240, test_f1: 0.6647
 epoch: 83, train_loss: 0.1842, test_loss: 1.9885, test_f1: 0.6424
 epoch: 84, train_loss: 0.1683, test_loss: 1.9260, test_f1: 0.6386
 epoch: 85, train_loss: 0.1669, test_loss: 2.0766, test_f1: 0.6231
 epoch: 86, train_loss: 0.1775, test_loss: 1.9299, test_f1: 0.6436
 epoch: 87, train_loss: 0.1755, test_loss: 1.8500, test_f1: 0.6509
 epoch: 88, train_loss: 0.1740, test_loss: 2.0243, test_f1: 0.6185
 epoch: 89, train_loss: 0.1617, test_loss: 1.9539, test_f1: 0.6304
 epoch: 90, train_loss: 0.1494, test_loss: 1.8744, test_f1: 0.6718
 epoch: 91, train_loss: 0.1631, test_loss: 2.0445, test_f1: 0.6309
 epoch: 92, train_loss: 0.1515, test_loss: 2.0850, test_f1: 0.6458
 epoch: 93, train_loss: 0.1521, test_loss: 2.1090, test_f1: 0.6317
 epoch: 94, train_loss: 0.1542, test_loss: 2.0581, test_f1: 0.6438
 epoch: 95, train_loss: 0.1543, test_loss: 2.0678, test_f1: 0.6505
 epoch: 96, train_loss: 0.2004, test_loss: 2.2699, test_f1: 0.6278
 epoch: 97, train_loss: 0.1819, test_loss: 2.1231, test_f1: 0.6260
 epoch: 98, train_loss: 0.1813, test_loss: 2.3109, test_f1: 0.6116
 epoch: 99, train_loss: 0.1494, test_loss: 1.9209, test_f1: 0.6525
##################ITERATION #4 ****************************************
 epoch: 0, train_loss: 1.3629, test_loss: 1.2921, test_f1: 0.2270
 epoch: 1, train_loss: 1.0747, test_loss: 1.1549, test_f1: 0.3088
 epoch: 2, train_loss: 0.9889, test_loss: 1.0120, test_f1: 0.4468
 epoch: 3, train_loss: 0.9418, test_loss: 0.9834, test_f1: 0.4821
 epoch: 4, train_loss: 0.9201, test_loss: 0.9619, test_f1: 0.5088
 epoch: 5, train_loss: 0.9002, test_loss: 0.9390, test_f1: 0.5097
 epoch: 6, train_loss: 0.8739, test_loss: 0.9600, test_f1: 0.5134
 epoch: 7, train_loss: 0.8684, test_loss: 0.9512, test_f1: 0.5443
 epoch: 8, train_loss: 0.8292, test_loss: 0.9522, test_f1: 0.5373
 epoch: 9, train_loss: 0.8201, test_loss: 0.8646, test_f1: 0.5552
 epoch: 10, train_loss: 0.7976, test_loss: 0.9735, test_f1: 0.5700
 epoch: 11, train_loss: 0.8006, test_loss: 0.9286, test_f1: 0.5993
 epoch: 12, train_loss: 0.7686, test_loss: 0.9523, test_f1: 0.5686
 epoch: 13, train_loss: 0.7794, test_loss: 0.9389, test_f1: 0.5608
 epoch: 14, train_loss: 0.7541, test_loss: 0.9547, test_f1: 0.5478
 epoch: 15, train_loss: 0.7360, test_loss: 0.9318, test_f1: 0.5817
 epoch: 16, train_loss: 0.7316, test_loss: 0.9284, test_f1: 0.5841
 epoch: 17, train_loss: 0.7173, test_loss: 0.9659, test_f1: 0.5724
 epoch: 18, train_loss: 0.7313, test_loss: 1.1566, test_f1: 0.5604
 epoch: 19, train_loss: 0.7253, test_loss: 1.0002, test_f1: 0.5832
 epoch: 20, train_loss: 0.7100, test_loss: 0.9825, test_f1: 0.5582
 epoch: 21, train_loss: 0.6991, test_loss: 0.9269, test_f1: 0.6130
 epoch: 22, train_loss: 0.6731, test_loss: 1.0520, test_f1: 0.5820
 epoch: 23, train_loss: 0.6835, test_loss: 0.9675, test_f1: 0.6004
 epoch: 24, train_loss: 0.6709, test_loss: 0.9768, test_f1: 0.5746
 epoch: 25, train_loss: 0.6699, test_loss: 0.9960, test_f1: 0.5903
 epoch: 26, train_loss: 0.6540, test_loss: 1.0180, test_f1: 0.6074
 epoch: 27, train_loss: 0.6442, test_loss: 0.9820, test_f1: 0.6338
 epoch: 28, train_loss: 0.6153, test_loss: 1.0599, test_f1: 0.6006
 epoch: 29, train_loss: 0.6122, test_loss: 0.9812, test_f1: 0.6049
 epoch: 30, train_loss: 0.6089, test_loss: 0.9908, test_f1: 0.6128
 epoch: 31, train_loss: 0.6063, test_loss: 1.0242, test_f1: 0.5965
 epoch: 32, train_loss: 0.5809, test_loss: 1.0318, test_f1: 0.6191
 epoch: 33, train_loss: 0.5690, test_loss: 1.0549, test_f1: 0.6394
 epoch: 34, train_loss: 0.5682, test_loss: 1.1363, test_f1: 0.6224
 epoch: 35, train_loss: 0.5473, test_loss: 0.9618, test_f1: 0.6261
 epoch: 36, train_loss: 0.5344, test_loss: 1.1669, test_f1: 0.5960
 epoch: 37, train_loss: 0.5331, test_loss: 1.0189, test_f1: 0.6415
 epoch: 38, train_loss: 0.5130, test_loss: 1.0562, test_f1: 0.6437
 epoch: 39, train_loss: 0.5063, test_loss: 1.1631, test_f1: 0.5894
 epoch: 40, train_loss: 0.4815, test_loss: 1.1351, test_f1: 0.6210
 epoch: 41, train_loss: 0.5023, test_loss: 1.4483, test_f1: 0.5557
 epoch: 42, train_loss: 0.5014, test_loss: 1.1447, test_f1: 0.6366
 epoch: 43, train_loss: 0.4909, test_loss: 1.2543, test_f1: 0.6019
 epoch: 44, train_loss: 0.4942, test_loss: 1.1049, test_f1: 0.5944
 epoch: 45, train_loss: 0.4776, test_loss: 1.0930, test_f1: 0.6532
 epoch: 46, train_loss: 0.4497, test_loss: 1.2081, test_f1: 0.6493
 epoch: 47, train_loss: 0.4658, test_loss: 1.2108, test_f1: 0.6200
 epoch: 48, train_loss: 0.4761, test_loss: 1.2518, test_f1: 0.6213
 epoch: 49, train_loss: 0.4557, test_loss: 1.2256, test_f1: 0.6246
 epoch: 50, train_loss: 0.4552, test_loss: 1.3033, test_f1: 0.6165
 epoch: 51, train_loss: 0.4131, test_loss: 1.1321, test_f1: 0.6487
 epoch: 52, train_loss: 0.3843, test_loss: 1.1472, test_f1: 0.6603
 epoch: 53, train_loss: 0.3473, test_loss: 1.2131, test_f1: 0.6591
 epoch: 54, train_loss: 0.3344, test_loss: 1.2690, test_f1: 0.6663
 epoch: 55, train_loss: 0.3331, test_loss: 1.2441, test_f1: 0.6698
 epoch: 56, train_loss: 0.3105, test_loss: 1.2666, test_f1: 0.6575
 epoch: 57, train_loss: 0.3206, test_loss: 1.2841, test_f1: 0.6225
 epoch: 58, train_loss: 0.3122, test_loss: 1.2858, test_f1: 0.6483
 epoch: 59, train_loss: 0.3087, test_loss: 1.2688, test_f1: 0.6719
 epoch: 60, train_loss: 0.2956, test_loss: 1.3244, test_f1: 0.6495
 epoch: 61, train_loss: 0.3020, test_loss: 1.3876, test_f1: 0.6478
 epoch: 62, train_loss: 0.2930, test_loss: 1.4783, test_f1: 0.6382
 epoch: 63, train_loss: 0.2738, test_loss: 1.4722, test_f1: 0.6310
 epoch: 64, train_loss: 0.2769, test_loss: 1.3440, test_f1: 0.6680
 epoch: 65, train_loss: 0.2698, test_loss: 1.4350, test_f1: 0.6383
 epoch: 66, train_loss: 0.2724, test_loss: 1.4974, test_f1: 0.6385
 epoch: 67, train_loss: 0.2559, test_loss: 1.3905, test_f1: 0.6414
 epoch: 68, train_loss: 0.2614, test_loss: 1.4660, test_f1: 0.6769
 epoch: 69, train_loss: 0.2726, test_loss: 1.5853, test_f1: 0.6322
 epoch: 70, train_loss: 0.2650, test_loss: 1.4634, test_f1: 0.6416
 epoch: 71, train_loss: 0.2600, test_loss: 1.5634, test_f1: 0.6128
 epoch: 72, train_loss: 0.2398, test_loss: 1.5617, test_f1: 0.6371
 epoch: 73, train_loss: 0.2322, test_loss: 1.5599, test_f1: 0.6461
 epoch: 74, train_loss: 0.2434, test_loss: 1.5965, test_f1: 0.6686
 epoch: 75, train_loss: 0.2615, test_loss: 1.5540, test_f1: 0.6314
 epoch: 76, train_loss: 0.2666, test_loss: 1.6780, test_f1: 0.6403
 epoch: 77, train_loss: 0.2319, test_loss: 1.5383, test_f1: 0.6412
 epoch: 78, train_loss: 0.2315, test_loss: 1.8317, test_f1: 0.6094
 epoch: 79, train_loss: 0.2329, test_loss: 1.7170, test_f1: 0.6396
 epoch: 80, train_loss: 0.2449, test_loss: 1.6981, test_f1: 0.6347
 epoch: 81, train_loss: 0.2136, test_loss: 1.8074, test_f1: 0.6177
 epoch: 82, train_loss: 0.2063, test_loss: 1.7309, test_f1: 0.6384
 epoch: 83, train_loss: 0.2364, test_loss: 1.7583, test_f1: 0.6330
 epoch: 84, train_loss: 0.2146, test_loss: 1.8184, test_f1: 0.6273
 epoch: 85, train_loss: 0.2198, test_loss: 2.0953, test_f1: 0.6431
 epoch: 86, train_loss: 0.2056, test_loss: 1.7179, test_f1: 0.6756
 epoch: 87, train_loss: 0.2122, test_loss: 1.7679, test_f1: 0.6330
 epoch: 88, train_loss: 0.1912, test_loss: 1.8357, test_f1: 0.6273
 epoch: 89, train_loss: 0.2072, test_loss: 1.7153, test_f1: 0.6414
 epoch: 90, train_loss: 0.1939, test_loss: 1.7957, test_f1: 0.6345
 epoch: 91, train_loss: 0.1853, test_loss: 1.7469, test_f1: 0.6409
 epoch: 92, train_loss: 0.1975, test_loss: 1.7705, test_f1: 0.6389
 epoch: 93, train_loss: 0.1912, test_loss: 2.0984, test_f1: 0.6153
 epoch: 94, train_loss: 0.1918, test_loss: 1.9519, test_f1: 0.6312
 epoch: 95, train_loss: 0.1804, test_loss: 1.8618, test_f1: 0.6582
 epoch: 96, train_loss: 0.1834, test_loss: 1.9573, test_f1: 0.6325
 epoch: 97, train_loss: 0.1753, test_loss: 2.0563, test_f1: 0.6212
 epoch: 98, train_loss: 0.1890, test_loss: 2.4439, test_f1: 0.6006
 epoch: 99, train_loss: 0.1923, test_loss: 2.0893, test_f1: 0.6295
##################ITERATION #5 ****************************************
 epoch: 0, train_loss: 1.4726, test_loss: 1.3563, test_f1: 0.2270
 epoch: 1, train_loss: 1.0660, test_loss: 1.1518, test_f1: 0.3382
 epoch: 2, train_loss: 0.9672, test_loss: 1.0087, test_f1: 0.4658
 epoch: 3, train_loss: 0.9325, test_loss: 0.9340, test_f1: 0.4771
 epoch: 4, train_loss: 0.9161, test_loss: 0.8951, test_f1: 0.5024
 epoch: 5, train_loss: 0.8869, test_loss: 0.9198, test_f1: 0.5259
 epoch: 6, train_loss: 0.8590, test_loss: 0.9477, test_f1: 0.5766
 epoch: 7, train_loss: 0.8360, test_loss: 0.9828, test_f1: 0.5751
 epoch: 8, train_loss: 0.8356, test_loss: 0.9337, test_f1: 0.5571
 epoch: 9, train_loss: 0.8248, test_loss: 0.9830, test_f1: 0.5789
 epoch: 10, train_loss: 0.7985, test_loss: 0.9573, test_f1: 0.5203
 epoch: 11, train_loss: 0.7952, test_loss: 0.9459, test_f1: 0.5729
 epoch: 12, train_loss: 0.7740, test_loss: 0.9363, test_f1: 0.5996
 epoch: 13, train_loss: 0.7545, test_loss: 0.9543, test_f1: 0.5868
 epoch: 14, train_loss: 0.7454, test_loss: 0.9352, test_f1: 0.6030
 epoch: 15, train_loss: 0.7528, test_loss: 0.9948, test_f1: 0.5903
 epoch: 16, train_loss: 0.7326, test_loss: 0.9734, test_f1: 0.5689
 epoch: 17, train_loss: 0.7083, test_loss: 0.9344, test_f1: 0.5934
 epoch: 18, train_loss: 0.6982, test_loss: 1.0000, test_f1: 0.5945
 epoch: 19, train_loss: 0.6912, test_loss: 0.9380, test_f1: 0.6053
 epoch: 20, train_loss: 0.6968, test_loss: 1.1959, test_f1: 0.5584
 epoch: 21, train_loss: 0.6744, test_loss: 1.1495, test_f1: 0.5637
 epoch: 22, train_loss: 0.6736, test_loss: 1.0566, test_f1: 0.6088
 epoch: 23, train_loss: 0.6476, test_loss: 1.0610, test_f1: 0.5991
 epoch: 24, train_loss: 0.6492, test_loss: 1.0513, test_f1: 0.5815
 epoch: 25, train_loss: 0.6411, test_loss: 1.0075, test_f1: 0.6189
 epoch: 26, train_loss: 0.6192, test_loss: 1.0249, test_f1: 0.6092
 epoch: 27, train_loss: 0.6198, test_loss: 1.1023, test_f1: 0.5865
 epoch: 28, train_loss: 0.6040, test_loss: 1.1323, test_f1: 0.5954
 epoch: 29, train_loss: 0.5864, test_loss: 1.0299, test_f1: 0.6343
 epoch: 30, train_loss: 0.5683, test_loss: 1.0438, test_f1: 0.6288
 epoch: 31, train_loss: 0.5493, test_loss: 1.1082, test_f1: 0.6237
 epoch: 32, train_loss: 0.5436, test_loss: 1.0660, test_f1: 0.6229
 epoch: 33, train_loss: 0.5413, test_loss: 1.1270, test_f1: 0.6302
 epoch: 34, train_loss: 0.5463, test_loss: 1.1467, test_f1: 0.6193
 epoch: 35, train_loss: 0.5179, test_loss: 1.0789, test_f1: 0.6452
 epoch: 36, train_loss: 0.5250, test_loss: 1.0912, test_f1: 0.6217
 epoch: 37, train_loss: 0.5037, test_loss: 1.1047, test_f1: 0.6331
 epoch: 38, train_loss: 0.4713, test_loss: 1.2132, test_f1: 0.6371
 epoch: 39, train_loss: 0.4763, test_loss: 1.1506, test_f1: 0.5974
 epoch: 40, train_loss: 0.4652, test_loss: 1.1977, test_f1: 0.6451
 epoch: 41, train_loss: 0.4880, test_loss: 1.1326, test_f1: 0.6764
 epoch: 42, train_loss: 0.4594, test_loss: 1.2389, test_f1: 0.6154
 epoch: 43, train_loss: 0.4526, test_loss: 1.3389, test_f1: 0.5843
 epoch: 44, train_loss: 0.4562, test_loss: 1.2766, test_f1: 0.6116
 epoch: 45, train_loss: 0.4322, test_loss: 1.3330, test_f1: 0.5857
 epoch: 46, train_loss: 0.4293, test_loss: 1.3547, test_f1: 0.6132
 epoch: 47, train_loss: 0.4136, test_loss: 1.4854, test_f1: 0.6020
 epoch: 48, train_loss: 0.4096, test_loss: 1.4602, test_f1: 0.6373
 epoch: 49, train_loss: 0.3951, test_loss: 1.4503, test_f1: 0.6199
 epoch: 50, train_loss: 0.4110, test_loss: 1.3924, test_f1: 0.5960
 epoch: 51, train_loss: 0.3629, test_loss: 1.3309, test_f1: 0.6383
 epoch: 52, train_loss: 0.3363, test_loss: 1.4901, test_f1: 0.6210
 epoch: 53, train_loss: 0.3116, test_loss: 1.3832, test_f1: 0.6328
 epoch: 54, train_loss: 0.3026, test_loss: 1.3801, test_f1: 0.6435
 epoch: 55, train_loss: 0.2986, test_loss: 1.5136, test_f1: 0.6117
 epoch: 56, train_loss: 0.2831, test_loss: 1.4707, test_f1: 0.6257
 epoch: 57, train_loss: 0.2778, test_loss: 1.5875, test_f1: 0.6047
 epoch: 58, train_loss: 0.2823, test_loss: 1.5917, test_f1: 0.6071
 epoch: 59, train_loss: 0.2716, test_loss: 1.5824, test_f1: 0.6061
 epoch: 60, train_loss: 0.2527, test_loss: 1.4988, test_f1: 0.6542
 epoch: 61, train_loss: 0.2634, test_loss: 1.5601, test_f1: 0.6366
 epoch: 62, train_loss: 0.2642, test_loss: 1.5198, test_f1: 0.6363
 epoch: 63, train_loss: 0.2650, test_loss: 1.6612, test_f1: 0.6223
 epoch: 64, train_loss: 0.2720, test_loss: 1.7108, test_f1: 0.5999
 epoch: 65, train_loss: 0.2646, test_loss: 1.6546, test_f1: 0.6112
 epoch: 66, train_loss: 0.2522, test_loss: 1.6114, test_f1: 0.6169
 epoch: 67, train_loss: 0.2588, test_loss: 1.6636, test_f1: 0.6331
 epoch: 68, train_loss: 0.2503, test_loss: 1.7202, test_f1: 0.6118
 epoch: 69, train_loss: 0.2421, test_loss: 1.7215, test_f1: 0.6156
 epoch: 70, train_loss: 0.2485, test_loss: 1.7228, test_f1: 0.6342
 epoch: 71, train_loss: 0.2350, test_loss: 1.8419, test_f1: 0.6099
 epoch: 72, train_loss: 0.2283, test_loss: 1.7317, test_f1: 0.6369
 epoch: 73, train_loss: 0.2247, test_loss: 1.8113, test_f1: 0.6119
 epoch: 74, train_loss: 0.2173, test_loss: 1.8881, test_f1: 0.5972
 epoch: 75, train_loss: 0.2301, test_loss: 1.9570, test_f1: 0.5896
 epoch: 76, train_loss: 0.2211, test_loss: 2.0238, test_f1: 0.6174
 epoch: 77, train_loss: 0.2374, test_loss: 1.7296, test_f1: 0.6141
 epoch: 78, train_loss: 0.2205, test_loss: 1.7385, test_f1: 0.6277
 epoch: 79, train_loss: 0.2279, test_loss: 1.8365, test_f1: 0.6071
 epoch: 80, train_loss: 0.2234, test_loss: 1.8045, test_f1: 0.6130
 epoch: 81, train_loss: 0.2304, test_loss: 1.9775, test_f1: 0.5994
 epoch: 82, train_loss: 0.2022, test_loss: 1.7849, test_f1: 0.6297
 epoch: 83, train_loss: 0.1943, test_loss: 2.0266, test_f1: 0.6141
 epoch: 84, train_loss: 0.2033, test_loss: 1.9039, test_f1: 0.6181
 epoch: 85, train_loss: 0.2005, test_loss: 2.0100, test_f1: 0.6108
 epoch: 86, train_loss: 0.2039, test_loss: 1.9955, test_f1: 0.6271
 epoch: 87, train_loss: 0.2000, test_loss: 2.0155, test_f1: 0.5998
 epoch: 88, train_loss: 0.1937, test_loss: 2.0752, test_f1: 0.5979
 epoch: 89, train_loss: 0.2079, test_loss: 2.0834, test_f1: 0.6154
 epoch: 90, train_loss: 0.2028, test_loss: 2.0223, test_f1: 0.6046
 epoch: 91, train_loss: 0.1996, test_loss: 2.0619, test_f1: 0.6178
 epoch: 92, train_loss: 0.1928, test_loss: 2.0142, test_f1: 0.6105
 epoch: 93, train_loss: 0.1888, test_loss: 2.0894, test_f1: 0.5951
 epoch: 94, train_loss: 0.1737, test_loss: 2.1150, test_f1: 0.6161
 epoch: 95, train_loss: 0.1862, test_loss: 2.2578, test_f1: 0.6044
 epoch: 96, train_loss: 0.1876, test_loss: 2.1641, test_f1: 0.6162
 epoch: 97, train_loss: 0.1910, test_loss: 2.1423, test_f1: 0.6010
 epoch: 98, train_loss: 0.1908, test_loss: 2.0709, test_f1: 0.5982
 epoch: 99, train_loss: 0.1776, test_loss: 2.0852, test_f1: 0.6163
##################ITERATION #6 ****************************************
 epoch: 0, train_loss: 1.4446, test_loss: 1.3564, test_f1: 0.3121
 epoch: 1, train_loss: 1.0716, test_loss: 1.3709, test_f1: 0.2532
 epoch: 2, train_loss: 0.9806, test_loss: 1.0614, test_f1: 0.4072
 epoch: 3, train_loss: 0.9503, test_loss: 0.9655, test_f1: 0.4620
 epoch: 4, train_loss: 0.9179, test_loss: 0.9345, test_f1: 0.4932
 epoch: 5, train_loss: 0.8826, test_loss: 0.9255, test_f1: 0.5048
 epoch: 6, train_loss: 0.8616, test_loss: 0.9391, test_f1: 0.5100
 epoch: 7, train_loss: 0.8299, test_loss: 0.9405, test_f1: 0.5105
 epoch: 8, train_loss: 0.8247, test_loss: 0.9149, test_f1: 0.5553
 epoch: 9, train_loss: 0.8004, test_loss: 1.0149, test_f1: 0.4963
 epoch: 10, train_loss: 0.7971, test_loss: 0.8198, test_f1: 0.5338
 epoch: 11, train_loss: 0.7899, test_loss: 0.9283, test_f1: 0.5300
 epoch: 12, train_loss: 0.7592, test_loss: 0.9565, test_f1: 0.5774
 epoch: 13, train_loss: 0.7579, test_loss: 0.9517, test_f1: 0.5604
 epoch: 14, train_loss: 0.7559, test_loss: 1.0202, test_f1: 0.5891
 epoch: 15, train_loss: 0.7469, test_loss: 0.9595, test_f1: 0.5717
 epoch: 16, train_loss: 0.7389, test_loss: 0.9804, test_f1: 0.5770
 epoch: 17, train_loss: 0.7086, test_loss: 1.0624, test_f1: 0.5959
 epoch: 18, train_loss: 0.7150, test_loss: 0.9732, test_f1: 0.5634
 epoch: 19, train_loss: 0.7141, test_loss: 1.0591, test_f1: 0.6018
 epoch: 20, train_loss: 0.6831, test_loss: 1.0521, test_f1: 0.5753
 epoch: 21, train_loss: 0.6885, test_loss: 1.0701, test_f1: 0.5943
 epoch: 22, train_loss: 0.6802, test_loss: 0.9956, test_f1: 0.5588
 epoch: 23, train_loss: 0.6615, test_loss: 1.0894, test_f1: 0.5887
 epoch: 24, train_loss: 0.6430, test_loss: 1.1207, test_f1: 0.5871
 epoch: 25, train_loss: 0.6371, test_loss: 1.1100, test_f1: 0.6141
 epoch: 26, train_loss: 0.6132, test_loss: 1.0800, test_f1: 0.6211
 epoch: 27, train_loss: 0.5964, test_loss: 1.1516, test_f1: 0.6013
 epoch: 28, train_loss: 0.5992, test_loss: 1.1097, test_f1: 0.6261
 epoch: 29, train_loss: 0.5628, test_loss: 1.1082, test_f1: 0.6099
 epoch: 30, train_loss: 0.5814, test_loss: 1.1398, test_f1: 0.6060
 epoch: 31, train_loss: 0.5628, test_loss: 1.1463, test_f1: 0.6124
 epoch: 32, train_loss: 0.5594, test_loss: 1.2303, test_f1: 0.5859
 epoch: 33, train_loss: 0.5401, test_loss: 1.0959, test_f1: 0.6275
 epoch: 34, train_loss: 0.5573, test_loss: 1.2032, test_f1: 0.5886
 epoch: 35, train_loss: 0.5481, test_loss: 1.1833, test_f1: 0.6358
 epoch: 36, train_loss: 0.5120, test_loss: 1.2519, test_f1: 0.6095
 epoch: 37, train_loss: 0.4980, test_loss: 1.1848, test_f1: 0.6353
 epoch: 38, train_loss: 0.4966, test_loss: 1.2802, test_f1: 0.6209
 epoch: 39, train_loss: 0.4903, test_loss: 1.1117, test_f1: 0.6523
 epoch: 40, train_loss: 0.4897, test_loss: 1.1562, test_f1: 0.6204
 epoch: 41, train_loss: 0.4596, test_loss: 1.1929, test_f1: 0.6114
 epoch: 42, train_loss: 0.4662, test_loss: 1.3248, test_f1: 0.5739
 epoch: 43, train_loss: 0.4737, test_loss: 1.2892, test_f1: 0.5802
 epoch: 44, train_loss: 0.4457, test_loss: 1.3081, test_f1: 0.6277
 epoch: 45, train_loss: 0.4334, test_loss: 1.2731, test_f1: 0.6341
 epoch: 46, train_loss: 0.4307, test_loss: 1.2296, test_f1: 0.6271
 epoch: 47, train_loss: 0.4290, test_loss: 1.2433, test_f1: 0.6235
 epoch: 48, train_loss: 0.4149, test_loss: 1.2518, test_f1: 0.6257
 epoch: 49, train_loss: 0.4070, test_loss: 1.3879, test_f1: 0.6161
 epoch: 50, train_loss: 0.3971, test_loss: 1.3291, test_f1: 0.6467
 epoch: 51, train_loss: 0.3541, test_loss: 1.4035, test_f1: 0.6249
 epoch: 52, train_loss: 0.3283, test_loss: 1.4283, test_f1: 0.6375
 epoch: 53, train_loss: 0.3088, test_loss: 1.4906, test_f1: 0.6315
 epoch: 54, train_loss: 0.2927, test_loss: 1.5700, test_f1: 0.6238
 epoch: 55, train_loss: 0.2958, test_loss: 1.4559, test_f1: 0.6399
 epoch: 56, train_loss: 0.2838, test_loss: 1.5084, test_f1: 0.6123
 epoch: 57, train_loss: 0.2963, test_loss: 1.5314, test_f1: 0.6395
 epoch: 58, train_loss: 0.2871, test_loss: 1.4606, test_f1: 0.6732
 epoch: 59, train_loss: 0.2872, test_loss: 1.6301, test_f1: 0.6148
 epoch: 60, train_loss: 0.2943, test_loss: 1.5383, test_f1: 0.6399
 epoch: 61, train_loss: 0.2863, test_loss: 1.6009, test_f1: 0.6212
 epoch: 62, train_loss: 0.2721, test_loss: 1.6554, test_f1: 0.6365
 epoch: 63, train_loss: 0.2705, test_loss: 1.6063, test_f1: 0.6791
 epoch: 64, train_loss: 0.2606, test_loss: 1.6858, test_f1: 0.6210
 epoch: 65, train_loss: 0.2528, test_loss: 1.7537, test_f1: 0.6193
 epoch: 66, train_loss: 0.2393, test_loss: 1.6950, test_f1: 0.6111
 epoch: 67, train_loss: 0.2474, test_loss: 1.6559, test_f1: 0.6404
 epoch: 68, train_loss: 0.2694, test_loss: 1.6852, test_f1: 0.6427
 epoch: 69, train_loss: 0.2543, test_loss: 1.8451, test_f1: 0.6391
 epoch: 70, train_loss: 0.2490, test_loss: 1.7460, test_f1: 0.6328
 epoch: 71, train_loss: 0.2428, test_loss: 1.7265, test_f1: 0.6403
 epoch: 72, train_loss: 0.2331, test_loss: 1.6726, test_f1: 0.6426
 epoch: 73, train_loss: 0.2342, test_loss: 1.8571, test_f1: 0.6111
 epoch: 74, train_loss: 0.2401, test_loss: 1.8810, test_f1: 0.6243
 epoch: 75, train_loss: 0.2514, test_loss: 1.9564, test_f1: 0.6173
 epoch: 76, train_loss: 0.2359, test_loss: 1.8220, test_f1: 0.6302
 epoch: 77, train_loss: 0.2346, test_loss: 1.6975, test_f1: 0.6622
 epoch: 78, train_loss: 0.2381, test_loss: 1.7042, test_f1: 0.6464
 epoch: 79, train_loss: 0.2219, test_loss: 1.6635, test_f1: 0.6647
 epoch: 80, train_loss: 0.2152, test_loss: 1.8305, test_f1: 0.6249
 epoch: 81, train_loss: 0.2301, test_loss: 1.9659, test_f1: 0.6234
 epoch: 82, train_loss: 0.2336, test_loss: 1.8054, test_f1: 0.6307
 epoch: 83, train_loss: 0.2094, test_loss: 1.8488, test_f1: 0.6161
 epoch: 84, train_loss: 0.1937, test_loss: 2.0771, test_f1: 0.6260
 epoch: 85, train_loss: 0.2065, test_loss: 2.0258, test_f1: 0.6419
 epoch: 86, train_loss: 0.1992, test_loss: 1.8767, test_f1: 0.6380
 epoch: 87, train_loss: 0.2037, test_loss: 1.9714, test_f1: 0.6341
 epoch: 88, train_loss: 0.2026, test_loss: 2.0039, test_f1: 0.6290
 epoch: 89, train_loss: 0.1986, test_loss: 1.9717, test_f1: 0.6484
 epoch: 90, train_loss: 0.1995, test_loss: 2.1785, test_f1: 0.6331
 epoch: 91, train_loss: 0.2005, test_loss: 2.0851, test_f1: 0.6477
 epoch: 92, train_loss: 0.1909, test_loss: 2.0941, test_f1: 0.6383
 epoch: 93, train_loss: 0.1847, test_loss: 2.3374, test_f1: 0.6148
 epoch: 94, train_loss: 0.1994, test_loss: 2.0905, test_f1: 0.6206
 epoch: 95, train_loss: 0.1932, test_loss: 2.0317, test_f1: 0.6510
 epoch: 96, train_loss: 0.1800, test_loss: 2.0052, test_f1: 0.6471
 epoch: 97, train_loss: 0.1807, test_loss: 2.0702, test_f1: 0.6217
 epoch: 98, train_loss: 0.1801, test_loss: 1.9563, test_f1: 0.6273
 epoch: 99, train_loss: 0.1748, test_loss: 2.0549, test_f1: 0.6273
##################ITERATION #7 ****************************************
 epoch: 0, train_loss: 1.6652, test_loss: 1.2687, test_f1: 0.2344
 epoch: 1, train_loss: 1.1087, test_loss: 1.1220, test_f1: 0.3431
 epoch: 2, train_loss: 0.9835, test_loss: 1.0592, test_f1: 0.4012
 epoch: 3, train_loss: 0.9299, test_loss: 1.0126, test_f1: 0.4402
 epoch: 4, train_loss: 0.8921, test_loss: 0.9706, test_f1: 0.4733
 epoch: 5, train_loss: 0.8679, test_loss: 0.9377, test_f1: 0.5114
 epoch: 6, train_loss: 0.8453, test_loss: 0.8913, test_f1: 0.5259
 epoch: 7, train_loss: 0.8093, test_loss: 0.8656, test_f1: 0.5482
 epoch: 8, train_loss: 0.8100, test_loss: 0.9388, test_f1: 0.5156
 epoch: 9, train_loss: 0.7798, test_loss: 0.9268, test_f1: 0.5393
 epoch: 10, train_loss: 0.7809, test_loss: 0.9921, test_f1: 0.5080
 epoch: 11, train_loss: 0.7594, test_loss: 0.8670, test_f1: 0.5420
 epoch: 12, train_loss: 0.7506, test_loss: 0.9226, test_f1: 0.5464
 epoch: 13, train_loss: 0.7380, test_loss: 0.9194, test_f1: 0.5756
 epoch: 14, train_loss: 0.7215, test_loss: 0.9951, test_f1: 0.5520
 epoch: 15, train_loss: 0.7183, test_loss: 0.9129, test_f1: 0.5622
 epoch: 16, train_loss: 0.7068, test_loss: 0.8888, test_f1: 0.5760
 epoch: 17, train_loss: 0.6951, test_loss: 0.9194, test_f1: 0.5539
 epoch: 18, train_loss: 0.6820, test_loss: 0.9591, test_f1: 0.5686
 epoch: 19, train_loss: 0.6823, test_loss: 0.9253, test_f1: 0.5999
 epoch: 20, train_loss: 0.6690, test_loss: 0.9919, test_f1: 0.5531
 epoch: 21, train_loss: 0.6562, test_loss: 0.9495, test_f1: 0.5742
 epoch: 22, train_loss: 0.6384, test_loss: 0.9684, test_f1: 0.5666
 epoch: 23, train_loss: 0.6236, test_loss: 0.9834, test_f1: 0.5931
 epoch: 24, train_loss: 0.6252, test_loss: 1.0325, test_f1: 0.5489
 epoch: 25, train_loss: 0.6025, test_loss: 0.9095, test_f1: 0.6235
 epoch: 26, train_loss: 0.6016, test_loss: 1.0985, test_f1: 0.5597
 epoch: 27, train_loss: 0.5948, test_loss: 0.9599, test_f1: 0.5926
 epoch: 28, train_loss: 0.5709, test_loss: 1.0208, test_f1: 0.6203
 epoch: 29, train_loss: 0.5788, test_loss: 1.0653, test_f1: 0.6314
 epoch: 30, train_loss: 0.5600, test_loss: 1.1364, test_f1: 0.5871
 epoch: 31, train_loss: 0.5457, test_loss: 1.0489, test_f1: 0.6029
 epoch: 32, train_loss: 0.5500, test_loss: 1.1189, test_f1: 0.5831
 epoch: 33, train_loss: 0.5345, test_loss: 1.0720, test_f1: 0.6013
 epoch: 34, train_loss: 0.5063, test_loss: 1.0531, test_f1: 0.6200
 epoch: 35, train_loss: 0.5077, test_loss: 1.1749, test_f1: 0.5745
 epoch: 36, train_loss: 0.4788, test_loss: 1.1051, test_f1: 0.6044
 epoch: 37, train_loss: 0.5020, test_loss: 1.0755, test_f1: 0.6056
 epoch: 38, train_loss: 0.5128, test_loss: 0.9916, test_f1: 0.6263
 epoch: 39, train_loss: 0.4971, test_loss: 1.1631, test_f1: 0.5884
 epoch: 40, train_loss: 0.4806, test_loss: 1.1011, test_f1: 0.6281
 epoch: 41, train_loss: 0.4606, test_loss: 1.2838, test_f1: 0.5994
 epoch: 42, train_loss: 0.4755, test_loss: 1.2507, test_f1: 0.6347
 epoch: 43, train_loss: 0.4670, test_loss: 1.3191, test_f1: 0.6022
 epoch: 44, train_loss: 0.4512, test_loss: 1.0749, test_f1: 0.6402
 epoch: 45, train_loss: 0.4383, test_loss: 1.1455, test_f1: 0.6393
 epoch: 46, train_loss: 0.4334, test_loss: 1.0454, test_f1: 0.6331
 epoch: 47, train_loss: 0.4354, test_loss: 1.1779, test_f1: 0.6426
 epoch: 48, train_loss: 0.4029, test_loss: 1.2587, test_f1: 0.6308
 epoch: 49, train_loss: 0.4061, test_loss: 1.2553, test_f1: 0.6517
 epoch: 50, train_loss: 0.3907, test_loss: 1.3043, test_f1: 0.6723
 epoch: 51, train_loss: 0.3739, test_loss: 1.3168, test_f1: 0.6411
 epoch: 52, train_loss: 0.3280, test_loss: 1.1607, test_f1: 0.6734
 epoch: 53, train_loss: 0.3034, test_loss: 1.2146, test_f1: 0.6544
 epoch: 54, train_loss: 0.3002, test_loss: 1.4494, test_f1: 0.6286
 epoch: 55, train_loss: 0.2987, test_loss: 1.2188, test_f1: 0.6651
 epoch: 56, train_loss: 0.2949, test_loss: 1.3219, test_f1: 0.6376
 epoch: 57, train_loss: 0.2847, test_loss: 1.3445, test_f1: 0.6235
 epoch: 58, train_loss: 0.2903, test_loss: 1.4664, test_f1: 0.6079
 epoch: 59, train_loss: 0.2636, test_loss: 1.4975, test_f1: 0.6241
 epoch: 60, train_loss: 0.2864, test_loss: 1.3245, test_f1: 0.6520
 epoch: 61, train_loss: 0.2837, test_loss: 1.3489, test_f1: 0.6342
 epoch: 62, train_loss: 0.2624, test_loss: 1.4704, test_f1: 0.6571
 epoch: 63, train_loss: 0.2763, test_loss: 1.5400, test_f1: 0.6369
 epoch: 64, train_loss: 0.2744, test_loss: 1.5441, test_f1: 0.6167
 epoch: 65, train_loss: 0.2574, test_loss: 1.4623, test_f1: 0.6551
 epoch: 66, train_loss: 0.2498, test_loss: 1.4197, test_f1: 0.6364
 epoch: 67, train_loss: 0.2429, test_loss: 1.5714, test_f1: 0.6290
 epoch: 68, train_loss: 0.2454, test_loss: 1.5761, test_f1: 0.6365
 epoch: 69, train_loss: 0.2541, test_loss: 1.4430, test_f1: 0.6581
 epoch: 70, train_loss: 0.2476, test_loss: 1.6478, test_f1: 0.5981
 epoch: 71, train_loss: 0.2414, test_loss: 1.4687, test_f1: 0.6506
 epoch: 72, train_loss: 0.2346, test_loss: 1.5488, test_f1: 0.6372
 epoch: 73, train_loss: 0.2455, test_loss: 1.6646, test_f1: 0.6527
 epoch: 74, train_loss: 0.2452, test_loss: 1.5870, test_f1: 0.6121
 epoch: 75, train_loss: 0.2433, test_loss: 1.7258, test_f1: 0.6374
 epoch: 76, train_loss: 0.2402, test_loss: 1.5989, test_f1: 0.6295
 epoch: 77, train_loss: 0.2385, test_loss: 1.6061, test_f1: 0.6519
 epoch: 78, train_loss: 0.2153, test_loss: 1.6462, test_f1: 0.6132
 epoch: 79, train_loss: 0.2040, test_loss: 1.6334, test_f1: 0.6361
 epoch: 80, train_loss: 0.2018, test_loss: 1.7051, test_f1: 0.6235
 epoch: 81, train_loss: 0.2056, test_loss: 1.8646, test_f1: 0.6229
 epoch: 82, train_loss: 0.2298, test_loss: 1.8660, test_f1: 0.6293
 epoch: 83, train_loss: 0.2102, test_loss: 1.7923, test_f1: 0.6330
 epoch: 84, train_loss: 0.2024, test_loss: 1.8718, test_f1: 0.6188
 epoch: 85, train_loss: 0.2162, test_loss: 1.8531, test_f1: 0.6087
 epoch: 86, train_loss: 0.1957, test_loss: 1.8384, test_f1: 0.6467
 epoch: 87, train_loss: 0.2005, test_loss: 1.8334, test_f1: 0.6367
 epoch: 88, train_loss: 0.2149, test_loss: 1.7972, test_f1: 0.6194
 epoch: 89, train_loss: 0.1988, test_loss: 1.8326, test_f1: 0.6405
 epoch: 90, train_loss: 0.2043, test_loss: 1.9595, test_f1: 0.6267
 epoch: 91, train_loss: 0.2007, test_loss: 1.6863, test_f1: 0.6327
 epoch: 92, train_loss: 0.1833, test_loss: 1.8816, test_f1: 0.6325
 epoch: 93, train_loss: 0.2048, test_loss: 1.7594, test_f1: 0.6361
 epoch: 94, train_loss: 0.1944, test_loss: 1.8048, test_f1: 0.6678
 epoch: 95, train_loss: 0.2045, test_loss: 1.8778, test_f1: 0.6363
 epoch: 96, train_loss: 0.1995, test_loss: 1.7885, test_f1: 0.6335
 epoch: 97, train_loss: 0.1754, test_loss: 1.7370, test_f1: 0.6249
 epoch: 98, train_loss: 0.1828, test_loss: 1.7350, test_f1: 0.6332
 epoch: 99, train_loss: 0.1783, test_loss: 1.7449, test_f1: 0.6483
##################ITERATION #8 ****************************************
 epoch: 0, train_loss: 1.5481, test_loss: 1.3069, test_f1: 0.2270
 epoch: 1, train_loss: 1.0489, test_loss: 1.1300, test_f1: 0.3404
 epoch: 2, train_loss: 0.9637, test_loss: 1.0778, test_f1: 0.4185
 epoch: 3, train_loss: 0.9153, test_loss: 1.0851, test_f1: 0.4342
 epoch: 4, train_loss: 0.9016, test_loss: 1.1041, test_f1: 0.4609
 epoch: 5, train_loss: 0.8764, test_loss: 0.9699, test_f1: 0.4776
 epoch: 6, train_loss: 0.8371, test_loss: 0.9301, test_f1: 0.5303
 epoch: 7, train_loss: 0.8145, test_loss: 0.9943, test_f1: 0.4921
 epoch: 8, train_loss: 0.8190, test_loss: 0.9248, test_f1: 0.5729
 epoch: 9, train_loss: 0.8026, test_loss: 0.9665, test_f1: 0.5088
 epoch: 10, train_loss: 0.7813, test_loss: 0.9186, test_f1: 0.5871
 epoch: 11, train_loss: 0.7813, test_loss: 0.8964, test_f1: 0.5584
 epoch: 12, train_loss: 0.7719, test_loss: 0.9984, test_f1: 0.5457
 epoch: 13, train_loss: 0.7473, test_loss: 0.9164, test_f1: 0.5985
 epoch: 14, train_loss: 0.7345, test_loss: 0.9071, test_f1: 0.5916
 epoch: 15, train_loss: 0.7203, test_loss: 0.9148, test_f1: 0.5589
 epoch: 16, train_loss: 0.7197, test_loss: 0.9099, test_f1: 0.6132
 epoch: 17, train_loss: 0.6993, test_loss: 0.9610, test_f1: 0.5838
 epoch: 18, train_loss: 0.6928, test_loss: 1.0345, test_f1: 0.5442
 epoch: 19, train_loss: 0.6866, test_loss: 0.8683, test_f1: 0.6191
 epoch: 20, train_loss: 0.6546, test_loss: 0.9958, test_f1: 0.5640
 epoch: 21, train_loss: 0.6648, test_loss: 0.9203, test_f1: 0.6337
 epoch: 22, train_loss: 0.6605, test_loss: 0.9619, test_f1: 0.5800
 epoch: 23, train_loss: 0.6421, test_loss: 1.0774, test_f1: 0.5818
 epoch: 24, train_loss: 0.6317, test_loss: 1.0840, test_f1: 0.5781
 epoch: 25, train_loss: 0.6230, test_loss: 1.0829, test_f1: 0.5894
 epoch: 26, train_loss: 0.6169, test_loss: 0.9627, test_f1: 0.6298
 epoch: 27, train_loss: 0.6045, test_loss: 0.9737, test_f1: 0.6152
 epoch: 28, train_loss: 0.5714, test_loss: 1.1747, test_f1: 0.5961
 epoch: 29, train_loss: 0.5911, test_loss: 1.0344, test_f1: 0.6265
 epoch: 30, train_loss: 0.5704, test_loss: 1.0279, test_f1: 0.6162
 epoch: 31, train_loss: 0.5633, test_loss: 1.0245, test_f1: 0.6350
 epoch: 32, train_loss: 0.5579, test_loss: 1.1917, test_f1: 0.5951
 epoch: 33, train_loss: 0.5399, test_loss: 0.9908, test_f1: 0.6188
 epoch: 34, train_loss: 0.5199, test_loss: 1.0529, test_f1: 0.6255
 epoch: 35, train_loss: 0.5220, test_loss: 1.1157, test_f1: 0.6228
 epoch: 36, train_loss: 0.5154, test_loss: 1.0358, test_f1: 0.6272
 epoch: 37, train_loss: 0.5017, test_loss: 1.0341, test_f1: 0.6293
 epoch: 38, train_loss: 0.4702, test_loss: 1.0708, test_f1: 0.6420
 epoch: 39, train_loss: 0.4617, test_loss: 1.1732, test_f1: 0.6606
 epoch: 40, train_loss: 0.4409, test_loss: 1.3027, test_f1: 0.6091
 epoch: 41, train_loss: 0.4696, test_loss: 1.1801, test_f1: 0.6432
 epoch: 42, train_loss: 0.4511, test_loss: 1.1635, test_f1: 0.6350
 epoch: 43, train_loss: 0.4516, test_loss: 1.0893, test_f1: 0.6365
 epoch: 44, train_loss: 0.4418, test_loss: 1.3351, test_f1: 0.6125
 epoch: 45, train_loss: 0.4615, test_loss: 1.2928, test_f1: 0.5929
 epoch: 46, train_loss: 0.4193, test_loss: 1.1680, test_f1: 0.6265
 epoch: 47, train_loss: 0.4262, test_loss: 1.1896, test_f1: 0.6319
 epoch: 48, train_loss: 0.4154, test_loss: 1.2985, test_f1: 0.6102
 epoch: 49, train_loss: 0.4134, test_loss: 1.3403, test_f1: 0.6282
 epoch: 50, train_loss: 0.4070, test_loss: 1.2411, test_f1: 0.6238
 epoch: 51, train_loss: 0.3592, test_loss: 1.2621, test_f1: 0.6377
 epoch: 52, train_loss: 0.3469, test_loss: 1.2238, test_f1: 0.6647
 epoch: 53, train_loss: 0.3209, test_loss: 1.3574, test_f1: 0.6299
 epoch: 54, train_loss: 0.2992, test_loss: 1.3290, test_f1: 0.6431
 epoch: 55, train_loss: 0.2953, test_loss: 1.3459, test_f1: 0.6592
 epoch: 56, train_loss: 0.3089, test_loss: 1.3379, test_f1: 0.6335
 epoch: 57, train_loss: 0.2968, test_loss: 1.5067, test_f1: 0.6376
 epoch: 58, train_loss: 0.3033, test_loss: 1.4510, test_f1: 0.6365
 epoch: 59, train_loss: 0.2720, test_loss: 1.4897, test_f1: 0.6276
 epoch: 60, train_loss: 0.2924, test_loss: 1.4528, test_f1: 0.6514
 epoch: 61, train_loss: 0.2745, test_loss: 1.4120, test_f1: 0.6606
 epoch: 62, train_loss: 0.2711, test_loss: 1.5675, test_f1: 0.6326
 epoch: 63, train_loss: 0.2642, test_loss: 1.4302, test_f1: 0.6492
 epoch: 64, train_loss: 0.2570, test_loss: 1.4239, test_f1: 0.6434
 epoch: 65, train_loss: 0.2484, test_loss: 1.4817, test_f1: 0.6550
 epoch: 66, train_loss: 0.2461, test_loss: 1.6272, test_f1: 0.6285
 epoch: 67, train_loss: 0.2474, test_loss: 1.5341, test_f1: 0.6393
 epoch: 68, train_loss: 0.2495, test_loss: 1.5082, test_f1: 0.6564
 epoch: 69, train_loss: 0.2316, test_loss: 1.5652, test_f1: 0.6674
 epoch: 70, train_loss: 0.2351, test_loss: 1.7087, test_f1: 0.6510
 epoch: 71, train_loss: 0.2360, test_loss: 1.5945, test_f1: 0.6429
 epoch: 72, train_loss: 0.2480, test_loss: 1.7043, test_f1: 0.6429
 epoch: 73, train_loss: 0.2642, test_loss: 1.5269, test_f1: 0.6248
 epoch: 74, train_loss: 0.2408, test_loss: 1.7291, test_f1: 0.6275
 epoch: 75, train_loss: 0.2294, test_loss: 1.6408, test_f1: 0.6479
 epoch: 76, train_loss: 0.2402, test_loss: 1.6643, test_f1: 0.6426
 epoch: 77, train_loss: 0.2613, test_loss: 1.5813, test_f1: 0.6571
 epoch: 78, train_loss: 0.2404, test_loss: 1.6415, test_f1: 0.6255
 epoch: 79, train_loss: 0.2305, test_loss: 1.6330, test_f1: 0.6410
 epoch: 80, train_loss: 0.2136, test_loss: 1.6731, test_f1: 0.6666
 epoch: 81, train_loss: 0.2187, test_loss: 1.7163, test_f1: 0.6340
 epoch: 82, train_loss: 0.2164, test_loss: 1.6783, test_f1: 0.6523
 epoch: 83, train_loss: 0.1962, test_loss: 1.7261, test_f1: 0.6432
 epoch: 84, train_loss: 0.2073, test_loss: 1.7130, test_f1: 0.6498
 epoch: 85, train_loss: 0.2106, test_loss: 1.7441, test_f1: 0.6550
 epoch: 86, train_loss: 0.2077, test_loss: 1.8910, test_f1: 0.6232
 epoch: 87, train_loss: 0.2057, test_loss: 1.8110, test_f1: 0.6281
 epoch: 88, train_loss: 0.2123, test_loss: 1.7740, test_f1: 0.6565
 epoch: 89, train_loss: 0.2308, test_loss: 1.8416, test_f1: 0.6166
 epoch: 90, train_loss: 0.2065, test_loss: 1.6876, test_f1: 0.6522
 epoch: 91, train_loss: 0.2239, test_loss: 1.7666, test_f1: 0.6678
 epoch: 92, train_loss: 0.2118, test_loss: 1.7280, test_f1: 0.6561
 epoch: 93, train_loss: 0.1942, test_loss: 1.7559, test_f1: 0.6221
 epoch: 94, train_loss: 0.1935, test_loss: 1.7806, test_f1: 0.6396
 epoch: 95, train_loss: 0.1834, test_loss: 1.7622, test_f1: 0.6612
 epoch: 96, train_loss: 0.1719, test_loss: 1.7266, test_f1: 0.6782
 epoch: 97, train_loss: 0.2118, test_loss: 1.7946, test_f1: 0.6428
 epoch: 98, train_loss: 0.1913, test_loss: 1.7486, test_f1: 0.6658
 epoch: 99, train_loss: 0.1861, test_loss: 1.8321, test_f1: 0.6445
##################ITERATION #9 ****************************************
 epoch: 0, train_loss: 1.6310, test_loss: 1.4081, test_f1: 0.2270
 epoch: 1, train_loss: 1.0663, test_loss: 1.2143, test_f1: 0.2801
 epoch: 2, train_loss: 0.9918, test_loss: 1.0615, test_f1: 0.3712
 epoch: 3, train_loss: 0.9321, test_loss: 1.0174, test_f1: 0.4726
 epoch: 4, train_loss: 0.9087, test_loss: 1.0055, test_f1: 0.4800
 epoch: 5, train_loss: 0.8892, test_loss: 0.9869, test_f1: 0.4814
 epoch: 6, train_loss: 0.8652, test_loss: 0.9902, test_f1: 0.4999
 epoch: 7, train_loss: 0.8384, test_loss: 0.9610, test_f1: 0.5075
 epoch: 8, train_loss: 0.8377, test_loss: 1.0441, test_f1: 0.4924
 epoch: 9, train_loss: 0.8226, test_loss: 1.0097, test_f1: 0.5303
 epoch: 10, train_loss: 0.8151, test_loss: 0.9911, test_f1: 0.5318
 epoch: 11, train_loss: 0.8009, test_loss: 0.9817, test_f1: 0.5340
 epoch: 12, train_loss: 0.7833, test_loss: 0.9273, test_f1: 0.5380
 epoch: 13, train_loss: 0.7688, test_loss: 0.9829, test_f1: 0.5380
 epoch: 14, train_loss: 0.7535, test_loss: 0.9798, test_f1: 0.5264
 epoch: 15, train_loss: 0.7646, test_loss: 0.9464, test_f1: 0.5379
 epoch: 16, train_loss: 0.7619, test_loss: 0.9547, test_f1: 0.5280
 epoch: 17, train_loss: 0.7504, test_loss: 0.9820, test_f1: 0.5508
 epoch: 18, train_loss: 0.7449, test_loss: 0.9588, test_f1: 0.5548
 epoch: 19, train_loss: 0.7106, test_loss: 0.9564, test_f1: 0.5615
 epoch: 20, train_loss: 0.7022, test_loss: 1.0158, test_f1: 0.5621
 epoch: 21, train_loss: 0.6874, test_loss: 1.0246, test_f1: 0.5476
 epoch: 22, train_loss: 0.6992, test_loss: 0.9453, test_f1: 0.6104
 epoch: 23, train_loss: 0.6667, test_loss: 1.0868, test_f1: 0.5149
 epoch: 24, train_loss: 0.6607, test_loss: 0.9401, test_f1: 0.5826
 epoch: 25, train_loss: 0.6579, test_loss: 1.0326, test_f1: 0.5972
 epoch: 26, train_loss: 0.6489, test_loss: 0.9834, test_f1: 0.5859
 epoch: 27, train_loss: 0.6277, test_loss: 0.9416, test_f1: 0.5811
 epoch: 28, train_loss: 0.6102, test_loss: 0.9669, test_f1: 0.6010
 epoch: 29, train_loss: 0.6054, test_loss: 0.9562, test_f1: 0.6205
 epoch: 30, train_loss: 0.5989, test_loss: 0.9954, test_f1: 0.5972
 epoch: 31, train_loss: 0.5809, test_loss: 1.0372, test_f1: 0.5875
 epoch: 32, train_loss: 0.5738, test_loss: 1.0482, test_f1: 0.6049
 epoch: 33, train_loss: 0.5852, test_loss: 0.9642, test_f1: 0.6171
 epoch: 34, train_loss: 0.5837, test_loss: 0.9581, test_f1: 0.6079
 epoch: 35, train_loss: 0.5546, test_loss: 0.9768, test_f1: 0.5877
 epoch: 36, train_loss: 0.5584, test_loss: 1.0240, test_f1: 0.5998
 epoch: 37, train_loss: 0.5398, test_loss: 1.0981, test_f1: 0.6113
 epoch: 38, train_loss: 0.5344, test_loss: 1.0492, test_f1: 0.6159
 epoch: 39, train_loss: 0.5310, test_loss: 1.1554, test_f1: 0.5583
 epoch: 40, train_loss: 0.5103, test_loss: 1.0402, test_f1: 0.6113
 epoch: 41, train_loss: 0.5235, test_loss: 1.0474, test_f1: 0.6127
 epoch: 42, train_loss: 0.5138, test_loss: 1.1693, test_f1: 0.6201
 epoch: 43, train_loss: 0.4847, test_loss: 1.1448, test_f1: 0.6294
 epoch: 44, train_loss: 0.4838, test_loss: 1.1156, test_f1: 0.6156
 epoch: 45, train_loss: 0.4769, test_loss: 1.1614, test_f1: 0.6242
 epoch: 46, train_loss: 0.4543, test_loss: 1.1689, test_f1: 0.5999
 epoch: 47, train_loss: 0.4493, test_loss: 1.1945, test_f1: 0.6332
 epoch: 48, train_loss: 0.4256, test_loss: 1.1453, test_f1: 0.6173
 epoch: 49, train_loss: 0.4531, test_loss: 1.2145, test_f1: 0.6327
 epoch: 50, train_loss: 0.4315, test_loss: 1.1591, test_f1: 0.6194
 epoch: 51, train_loss: 0.4035, test_loss: 1.1547, test_f1: 0.6186
 epoch: 52, train_loss: 0.3612, test_loss: 1.2487, test_f1: 0.6476
 epoch: 53, train_loss: 0.3448, test_loss: 1.3659, test_f1: 0.6232
 epoch: 54, train_loss: 0.3321, test_loss: 1.2195, test_f1: 0.6531
 epoch: 55, train_loss: 0.3361, test_loss: 1.3676, test_f1: 0.6418
 epoch: 56, train_loss: 0.3237, test_loss: 1.3919, test_f1: 0.6287
 epoch: 57, train_loss: 0.3118, test_loss: 1.3714, test_f1: 0.6169
 epoch: 58, train_loss: 0.3179, test_loss: 1.3438, test_f1: 0.6419
 epoch: 59, train_loss: 0.3116, test_loss: 1.4774, test_f1: 0.6005
 epoch: 60, train_loss: 0.3040, test_loss: 1.3428, test_f1: 0.6253
 epoch: 61, train_loss: 0.2843, test_loss: 1.4786, test_f1: 0.6323
 epoch: 62, train_loss: 0.2795, test_loss: 1.4063, test_f1: 0.6224
 epoch: 63, train_loss: 0.2890, test_loss: 1.4501, test_f1: 0.6120
 epoch: 64, train_loss: 0.2737, test_loss: 1.4631, test_f1: 0.6346
 epoch: 65, train_loss: 0.2779, test_loss: 1.4699, test_f1: 0.6670
 epoch: 66, train_loss: 0.2845, test_loss: 1.5397, test_f1: 0.6055
 epoch: 67, train_loss: 0.2924, test_loss: 1.4125, test_f1: 0.6279
 epoch: 68, train_loss: 0.2820, test_loss: 1.4966, test_f1: 0.6112
 epoch: 69, train_loss: 0.2685, test_loss: 1.4491, test_f1: 0.6527
 epoch: 70, train_loss: 0.2590, test_loss: 1.5471, test_f1: 0.6370
 epoch: 71, train_loss: 0.2539, test_loss: 1.6320, test_f1: 0.6582
 epoch: 72, train_loss: 0.2565, test_loss: 1.5089, test_f1: 0.6374
 epoch: 73, train_loss: 0.2600, test_loss: 1.3632, test_f1: 0.6639
 epoch: 74, train_loss: 0.2421, test_loss: 1.6054, test_f1: 0.6376
 epoch: 75, train_loss: 0.2552, test_loss: 1.5871, test_f1: 0.6296
 epoch: 76, train_loss: 0.2360, test_loss: 1.5945, test_f1: 0.6470
 epoch: 77, train_loss: 0.2347, test_loss: 1.6422, test_f1: 0.6482
 epoch: 78, train_loss: 0.2400, test_loss: 1.6616, test_f1: 0.6608
 epoch: 79, train_loss: 0.2283, test_loss: 1.7271, test_f1: 0.6205
 epoch: 80, train_loss: 0.2322, test_loss: 1.6558, test_f1: 0.6470
 epoch: 81, train_loss: 0.2304, test_loss: 1.6925, test_f1: 0.6316
 epoch: 82, train_loss: 0.2394, test_loss: 1.6472, test_f1: 0.6250
 epoch: 83, train_loss: 0.2248, test_loss: 1.6690, test_f1: 0.6225
 epoch: 84, train_loss: 0.2406, test_loss: 1.6601, test_f1: 0.6286
 epoch: 85, train_loss: 0.2253, test_loss: 1.8023, test_f1: 0.6493
 epoch: 86, train_loss: 0.2357, test_loss: 1.7206, test_f1: 0.6197
 epoch: 87, train_loss: 0.2395, test_loss: 1.8014, test_f1: 0.6328
 epoch: 88, train_loss: 0.2343, test_loss: 1.8191, test_f1: 0.6229
 epoch: 89, train_loss: 0.2229, test_loss: 1.6038, test_f1: 0.6268
 epoch: 90, train_loss: 0.2264, test_loss: 1.6765, test_f1: 0.6372
 epoch: 91, train_loss: 0.2223, test_loss: 1.8279, test_f1: 0.6464
 epoch: 92, train_loss: 0.2139, test_loss: 1.6954, test_f1: 0.6376
 epoch: 93, train_loss: 0.2020, test_loss: 1.7899, test_f1: 0.6225
 epoch: 94, train_loss: 0.2242, test_loss: 1.6748, test_f1: 0.6311
 epoch: 95, train_loss: 0.2095, test_loss: 1.5641, test_f1: 0.6395
 epoch: 96, train_loss: 0.2011, test_loss: 1.8298, test_f1: 0.6241
 epoch: 97, train_loss: 0.2146, test_loss: 1.9922, test_f1: 0.6178
 epoch: 98, train_loss: 0.2036, test_loss: 1.9063, test_f1: 0.6338
 epoch: 99, train_loss: 0.2034, test_loss: 1.7879, test_f1: 0.6400

Training completed in 895.43 seconds
Best F1: 0.6889 at epoch 50
Mean F1 across iterations: 0.6756  0.0060
========================FINAL RESULTS================================
FEGIN weighted F1: 0.6889  0.0060
python main.py --data ltspice_examples --representation component_net --model FEGIN --layers 4 --hiddens 128 --batch_size 256 --lr 0.001 --emb_size 128 --epochs 100 --save_appendix component_net_L4_H128_BS256_LR0.001_E128 --no_val
-----



STDERR:
  File "main.py", line 370, in <module>
    main()
  File "main.py", line 254, in main
    dataset = dataset_class(
  File "/home/philip/projects/llm_inference_code_repo/Circuit-Completion-Using-GNNs/component_classification_with_link_prediction_head/evaluation/FEGIN/kernel/circuit_datasets.py", line 15, in __init__
    self.data, self.slices = torch.load(self.processed_paths[0])
  File "/home/philip/.local/lib/python3.8/site-packages/torch/serialization.py", line 1040, in load
    warnings.warn(
  File "/usr/lib/python3.8/warnings.py", line 109, in _showwarnmsg
    sw(msg.message, msg.category, msg.filename, msg.lineno,
  File "main.py", line 47, in warn_with_traceback
    traceback.print_stack(file=log)
/home/philip/projects/llm_inference_code_repo/Circuit-Completion-Using-GNNs/component_classification_with_link_prediction_head/evaluation/FEGIN/kernel/circuit_datasets.py:15: FutureWarning: You are using `torch.load` with `weights_only=False` (the current default value), which uses the default pickle module implicitly. It is possible to construct malicious pickle data which will execute arbitrary code during unpickling (See https://github.com/pytorch/pytorch/blob/main/SECURITY.md#untrusted-models for more details). In a future release, the default value for `weights_only` will be flipped to `True`. This limits the functions that could be executed during unpickling. Arbitrary objects will no longer be allowed to be loaded via this mode unless they are explicitly allowlisted by the user via `torch.serialization.add_safe_globals`. We recommend you start setting `weights_only=True` for any use case where you don't have full control of the loaded file. Please open an issue on GitHub for any issues related to this experimental feature.
  self.data, self.slices = torch.load(self.processed_paths[0])
