STDOUT:
Results will be saved in /home/philip/projects/ltspice_examples_code_repo/Circuit-Completion-Using-GNNs/component_classification_with_link_prediction_head/evaluation/FEGIN/results/model_FEGIN_dataset_ltspice_examples
Command line input: python main.py --data ltspice_examples --representation component_pin_net --model FEGIN --layers 4 --hiddens 16 --batch_size 256 --lr 0.001 --emb_size 128 --epochs 100 --save_appendix component_pin_net_L4_H16_BS256_LR0.001_E128 --no_val
 is saved.
-----
ltspice_examples - FEGIN
Using 4 layers, 16 hidden units, h = 2
Loading component_pin_net representation dataset
ENTERED
Training FEGIN on component_pin_net representation
Train: 3558, Test: 846
##################ITERATION #0 ****************************************
 epoch: 0, train_loss: 1.4147, test_loss: 1.4126, test_f1: 0.1004
 epoch: 1, train_loss: 1.3925, test_loss: 1.3980, test_f1: 0.1004
 epoch: 2, train_loss: 1.3711, test_loss: 1.3674, test_f1: 0.1964
 epoch: 3, train_loss: 1.3432, test_loss: 1.3221, test_f1: 0.1943
 epoch: 4, train_loss: 1.3139, test_loss: 1.2799, test_f1: 0.2783
 epoch: 5, train_loss: 1.2813, test_loss: 1.2428, test_f1: 0.3167
 epoch: 6, train_loss: 1.2468, test_loss: 1.2105, test_f1: 0.2363
 epoch: 7, train_loss: 1.2147, test_loss: 1.1858, test_f1: 0.2378
 epoch: 8, train_loss: 1.1980, test_loss: 1.1629, test_f1: 0.2981
 epoch: 9, train_loss: 1.1788, test_loss: 1.1444, test_f1: 0.3310
 epoch: 10, train_loss: 1.1590, test_loss: 1.1250, test_f1: 0.3381
 epoch: 11, train_loss: 1.1428, test_loss: 1.1006, test_f1: 0.3530
 epoch: 12, train_loss: 1.1237, test_loss: 1.0757, test_f1: 0.3425
 epoch: 13, train_loss: 1.1006, test_loss: 1.0572, test_f1: 0.3470
 epoch: 14, train_loss: 1.0954, test_loss: 1.0367, test_f1: 0.3416
 epoch: 15, train_loss: 1.0644, test_loss: 1.0215, test_f1: 0.3450
 epoch: 16, train_loss: 1.0556, test_loss: 1.0029, test_f1: 0.4042
 epoch: 17, train_loss: 1.0421, test_loss: 1.0018, test_f1: 0.3908
 epoch: 18, train_loss: 1.0363, test_loss: 1.0097, test_f1: 0.4321
 epoch: 19, train_loss: 1.0236, test_loss: 1.0137, test_f1: 0.4093
 epoch: 20, train_loss: 1.0154, test_loss: 1.0018, test_f1: 0.4306
 epoch: 21, train_loss: 0.9982, test_loss: 0.9843, test_f1: 0.4379
 epoch: 22, train_loss: 0.9941, test_loss: 0.9630, test_f1: 0.4634
 epoch: 23, train_loss: 0.9812, test_loss: 0.9435, test_f1: 0.4737
 epoch: 24, train_loss: 0.9780, test_loss: 0.9396, test_f1: 0.4815
 epoch: 25, train_loss: 0.9635, test_loss: 0.9320, test_f1: 0.4892
 epoch: 26, train_loss: 0.9605, test_loss: 0.9518, test_f1: 0.4860
 epoch: 27, train_loss: 0.9560, test_loss: 0.9391, test_f1: 0.4804
 epoch: 28, train_loss: 0.9525, test_loss: 0.9286, test_f1: 0.5061
 epoch: 29, train_loss: 0.9416, test_loss: 0.9415, test_f1: 0.5045
 epoch: 30, train_loss: 0.9431, test_loss: 0.8965, test_f1: 0.5139
 epoch: 31, train_loss: 0.9317, test_loss: 0.9122, test_f1: 0.4999
 epoch: 32, train_loss: 0.9240, test_loss: 0.8852, test_f1: 0.5283
 epoch: 33, train_loss: 0.9159, test_loss: 0.8885, test_f1: 0.5176
 epoch: 34, train_loss: 0.9202, test_loss: 0.8949, test_f1: 0.5314
 epoch: 35, train_loss: 0.9174, test_loss: 0.8862, test_f1: 0.5337
 epoch: 36, train_loss: 0.9144, test_loss: 0.8859, test_f1: 0.5262
 epoch: 37, train_loss: 0.9080, test_loss: 0.9158, test_f1: 0.5080
 epoch: 38, train_loss: 0.9117, test_loss: 0.8780, test_f1: 0.5506
 epoch: 39, train_loss: 0.8875, test_loss: 0.8879, test_f1: 0.5260
 epoch: 40, train_loss: 0.8888, test_loss: 0.9097, test_f1: 0.4953
 epoch: 41, train_loss: 0.8843, test_loss: 0.9005, test_f1: 0.5118
 epoch: 42, train_loss: 0.8767, test_loss: 0.9272, test_f1: 0.4860
 epoch: 43, train_loss: 0.8848, test_loss: 0.8861, test_f1: 0.5242
 epoch: 44, train_loss: 0.8764, test_loss: 0.9249, test_f1: 0.5101
 epoch: 45, train_loss: 0.8746, test_loss: 0.8921, test_f1: 0.5117
 epoch: 46, train_loss: 0.8665, test_loss: 0.9189, test_f1: 0.5183
 epoch: 47, train_loss: 0.8629, test_loss: 0.9347, test_f1: 0.5297
 epoch: 48, train_loss: 0.8627, test_loss: 0.9080, test_f1: 0.5013
 epoch: 49, train_loss: 0.8520, test_loss: 0.9593, test_f1: 0.5093
 epoch: 50, train_loss: 0.8457, test_loss: 0.9034, test_f1: 0.5389
 epoch: 51, train_loss: 0.8417, test_loss: 0.9149, test_f1: 0.5292
 epoch: 52, train_loss: 0.8344, test_loss: 0.9028, test_f1: 0.5478
 epoch: 53, train_loss: 0.8358, test_loss: 0.8981, test_f1: 0.5468
 epoch: 54, train_loss: 0.8359, test_loss: 0.9023, test_f1: 0.5385
 epoch: 55, train_loss: 0.8337, test_loss: 0.9287, test_f1: 0.5219
 epoch: 56, train_loss: 0.8217, test_loss: 0.8897, test_f1: 0.5477
 epoch: 57, train_loss: 0.8261, test_loss: 0.9084, test_f1: 0.5420
 epoch: 58, train_loss: 0.8273, test_loss: 0.8988, test_f1: 0.5441
 epoch: 59, train_loss: 0.8225, test_loss: 0.8936, test_f1: 0.5518
 epoch: 60, train_loss: 0.8269, test_loss: 0.9191, test_f1: 0.5596
 epoch: 61, train_loss: 0.8133, test_loss: 0.9217, test_f1: 0.5358
 epoch: 62, train_loss: 0.8254, test_loss: 0.9371, test_f1: 0.5315
 epoch: 63, train_loss: 0.8123, test_loss: 0.9348, test_f1: 0.5397
 epoch: 64, train_loss: 0.8089, test_loss: 0.9187, test_f1: 0.5485
 epoch: 65, train_loss: 0.8056, test_loss: 0.9402, test_f1: 0.5254
 epoch: 66, train_loss: 0.8031, test_loss: 0.9177, test_f1: 0.5522
 epoch: 67, train_loss: 0.8084, test_loss: 0.9158, test_f1: 0.5357
 epoch: 68, train_loss: 0.8019, test_loss: 0.9500, test_f1: 0.5466
 epoch: 69, train_loss: 0.8145, test_loss: 0.9104, test_f1: 0.5392
 epoch: 70, train_loss: 0.8030, test_loss: 0.9458, test_f1: 0.5276
 epoch: 71, train_loss: 0.8004, test_loss: 0.9503, test_f1: 0.5322
 epoch: 72, train_loss: 0.7977, test_loss: 0.9339, test_f1: 0.5231
 epoch: 73, train_loss: 0.8027, test_loss: 0.9176, test_f1: 0.5482
 epoch: 74, train_loss: 0.7921, test_loss: 0.9481, test_f1: 0.5216
 epoch: 75, train_loss: 0.7898, test_loss: 0.9185, test_f1: 0.5504
 epoch: 76, train_loss: 0.7868, test_loss: 0.9433, test_f1: 0.5440
 epoch: 77, train_loss: 0.7926, test_loss: 0.9532, test_f1: 0.5325
 epoch: 78, train_loss: 0.7860, test_loss: 0.9523, test_f1: 0.5395
 epoch: 79, train_loss: 0.7812, test_loss: 0.9542, test_f1: 0.5576
 epoch: 80, train_loss: 0.7817, test_loss: 0.9527, test_f1: 0.5307
 epoch: 81, train_loss: 0.7835, test_loss: 0.9483, test_f1: 0.5404
 epoch: 82, train_loss: 0.7906, test_loss: 0.9563, test_f1: 0.5373
 epoch: 83, train_loss: 0.7749, test_loss: 0.9510, test_f1: 0.5347
 epoch: 84, train_loss: 0.7733, test_loss: 0.9471, test_f1: 0.5463
 epoch: 85, train_loss: 0.7760, test_loss: 0.9390, test_f1: 0.5500
 epoch: 86, train_loss: 0.7774, test_loss: 0.9527, test_f1: 0.5363
 epoch: 87, train_loss: 0.7851, test_loss: 0.9454, test_f1: 0.5455
 epoch: 88, train_loss: 0.7774, test_loss: 0.9674, test_f1: 0.5422
 epoch: 89, train_loss: 0.7733, test_loss: 0.9488, test_f1: 0.5447
 epoch: 90, train_loss: 0.7734, test_loss: 0.9488, test_f1: 0.5449
 epoch: 91, train_loss: 0.7698, test_loss: 0.9574, test_f1: 0.5346
 epoch: 92, train_loss: 0.7699, test_loss: 0.9573, test_f1: 0.5356
 epoch: 93, train_loss: 0.7723, test_loss: 0.9454, test_f1: 0.5498
 epoch: 94, train_loss: 0.7626, test_loss: 0.9463, test_f1: 0.5565
 epoch: 95, train_loss: 0.7566, test_loss: 0.9336, test_f1: 0.5518
 epoch: 96, train_loss: 0.7679, test_loss: 0.9753, test_f1: 0.5385
 epoch: 97, train_loss: 0.7587, test_loss: 0.9576, test_f1: 0.5367
 epoch: 98, train_loss: 0.7665, test_loss: 0.9524, test_f1: 0.5455
 epoch: 99, train_loss: 0.7566, test_loss: 0.9626, test_f1: 0.5497
##################ITERATION #1 ****************************************
 epoch: 0, train_loss: 1.3299, test_loss: 1.3405, test_f1: 0.2270
 epoch: 1, train_loss: 1.2521, test_loss: 1.3172, test_f1: 0.2270
 epoch: 2, train_loss: 1.2086, test_loss: 1.3002, test_f1: 0.2270
 epoch: 3, train_loss: 1.1638, test_loss: 1.2184, test_f1: 0.2270
 epoch: 4, train_loss: 1.1276, test_loss: 1.1112, test_f1: 0.3451
 epoch: 5, train_loss: 1.0963, test_loss: 1.0895, test_f1: 0.3384
 epoch: 6, train_loss: 1.0841, test_loss: 1.0827, test_f1: 0.3243
 epoch: 7, train_loss: 1.0683, test_loss: 1.0765, test_f1: 0.3407
 epoch: 8, train_loss: 1.0494, test_loss: 1.0473, test_f1: 0.3574
 epoch: 9, train_loss: 1.0450, test_loss: 1.0468, test_f1: 0.3575
 epoch: 10, train_loss: 1.0327, test_loss: 1.0342, test_f1: 0.3722
 epoch: 11, train_loss: 1.0274, test_loss: 1.0455, test_f1: 0.3653
 epoch: 12, train_loss: 1.0191, test_loss: 1.0355, test_f1: 0.3929
 epoch: 13, train_loss: 1.0094, test_loss: 1.0717, test_f1: 0.3873
 epoch: 14, train_loss: 1.0058, test_loss: 1.0150, test_f1: 0.4019
 epoch: 15, train_loss: 0.9991, test_loss: 1.0654, test_f1: 0.4415
 epoch: 16, train_loss: 0.9864, test_loss: 1.0161, test_f1: 0.4502
 epoch: 17, train_loss: 0.9899, test_loss: 0.9908, test_f1: 0.4722
 epoch: 18, train_loss: 0.9820, test_loss: 1.1446, test_f1: 0.3901
 epoch: 19, train_loss: 0.9711, test_loss: 0.9820, test_f1: 0.4511
 epoch: 20, train_loss: 0.9652, test_loss: 1.0195, test_f1: 0.4558
 epoch: 21, train_loss: 0.9670, test_loss: 1.0097, test_f1: 0.4794
 epoch: 22, train_loss: 0.9543, test_loss: 0.9755, test_f1: 0.4730
 epoch: 23, train_loss: 0.9516, test_loss: 0.9802, test_f1: 0.4797
 epoch: 24, train_loss: 0.9499, test_loss: 0.9400, test_f1: 0.4958
 epoch: 25, train_loss: 0.9347, test_loss: 0.9481, test_f1: 0.4994
 epoch: 26, train_loss: 0.9319, test_loss: 0.9593, test_f1: 0.4707
 epoch: 27, train_loss: 0.9358, test_loss: 0.9327, test_f1: 0.5024
 epoch: 28, train_loss: 0.9321, test_loss: 0.9733, test_f1: 0.4728
 epoch: 29, train_loss: 0.9278, test_loss: 0.9487, test_f1: 0.5116
 epoch: 30, train_loss: 0.9243, test_loss: 0.9875, test_f1: 0.4685
 epoch: 31, train_loss: 0.9264, test_loss: 0.9939, test_f1: 0.4944
 epoch: 32, train_loss: 0.9224, test_loss: 0.9354, test_f1: 0.5087
 epoch: 33, train_loss: 0.9124, test_loss: 0.9796, test_f1: 0.5013
 epoch: 34, train_loss: 0.9035, test_loss: 0.9741, test_f1: 0.4900
 epoch: 35, train_loss: 0.8963, test_loss: 0.9557, test_f1: 0.5161
 epoch: 36, train_loss: 0.9062, test_loss: 1.0063, test_f1: 0.4720
 epoch: 37, train_loss: 0.9051, test_loss: 0.9270, test_f1: 0.5189
 epoch: 38, train_loss: 0.9003, test_loss: 0.9412, test_f1: 0.4967
 epoch: 39, train_loss: 0.9029, test_loss: 1.0533, test_f1: 0.4711
 epoch: 40, train_loss: 0.8879, test_loss: 0.9220, test_f1: 0.5104
 epoch: 41, train_loss: 0.8859, test_loss: 0.8985, test_f1: 0.5167
 epoch: 42, train_loss: 0.8934, test_loss: 1.2348, test_f1: 0.4118
 epoch: 43, train_loss: 0.8875, test_loss: 0.8977, test_f1: 0.5066
 epoch: 44, train_loss: 0.8751, test_loss: 0.9352, test_f1: 0.5027
 epoch: 45, train_loss: 0.8753, test_loss: 0.8892, test_f1: 0.5127
 epoch: 46, train_loss: 0.8731, test_loss: 0.8857, test_f1: 0.5301
 epoch: 47, train_loss: 0.8722, test_loss: 0.8656, test_f1: 0.5128
 epoch: 48, train_loss: 0.8653, test_loss: 0.8698, test_f1: 0.5203
 epoch: 49, train_loss: 0.8667, test_loss: 0.9129, test_f1: 0.5084
 epoch: 50, train_loss: 0.8597, test_loss: 0.8625, test_f1: 0.5177
 epoch: 51, train_loss: 0.8560, test_loss: 0.9105, test_f1: 0.4896
 epoch: 52, train_loss: 0.8614, test_loss: 0.9313, test_f1: 0.4842
 epoch: 53, train_loss: 0.8506, test_loss: 0.8975, test_f1: 0.4958
 epoch: 54, train_loss: 0.8390, test_loss: 0.8655, test_f1: 0.5176
 epoch: 55, train_loss: 0.8538, test_loss: 0.8593, test_f1: 0.5227
 epoch: 56, train_loss: 0.8469, test_loss: 0.8668, test_f1: 0.5193
 epoch: 57, train_loss: 0.8408, test_loss: 0.8747, test_f1: 0.5077
 epoch: 58, train_loss: 0.8436, test_loss: 0.8729, test_f1: 0.5000
 epoch: 59, train_loss: 0.8403, test_loss: 0.8424, test_f1: 0.5237
 epoch: 60, train_loss: 0.8409, test_loss: 0.8651, test_f1: 0.5129
 epoch: 61, train_loss: 0.8442, test_loss: 0.9047, test_f1: 0.4990
 epoch: 62, train_loss: 0.8325, test_loss: 0.8430, test_f1: 0.5280
 epoch: 63, train_loss: 0.8342, test_loss: 0.8781, test_f1: 0.5157
 epoch: 64, train_loss: 0.8295, test_loss: 0.8774, test_f1: 0.5128
 epoch: 65, train_loss: 0.8264, test_loss: 0.8789, test_f1: 0.5174
 epoch: 66, train_loss: 0.8255, test_loss: 0.8730, test_f1: 0.5009
 epoch: 67, train_loss: 0.8260, test_loss: 0.8567, test_f1: 0.5040
 epoch: 68, train_loss: 0.8325, test_loss: 0.8566, test_f1: 0.5182
 epoch: 69, train_loss: 0.8290, test_loss: 0.8505, test_f1: 0.5412
 epoch: 70, train_loss: 0.8266, test_loss: 0.8484, test_f1: 0.5247
 epoch: 71, train_loss: 0.8240, test_loss: 0.8519, test_f1: 0.5353
 epoch: 72, train_loss: 0.8152, test_loss: 0.8748, test_f1: 0.5116
 epoch: 73, train_loss: 0.8148, test_loss: 0.9391, test_f1: 0.4794
 epoch: 74, train_loss: 0.8162, test_loss: 0.8785, test_f1: 0.5000
 epoch: 75, train_loss: 0.8148, test_loss: 0.8816, test_f1: 0.5266
 epoch: 76, train_loss: 0.8156, test_loss: 0.8846, test_f1: 0.4927
 epoch: 77, train_loss: 0.8248, test_loss: 0.8538, test_f1: 0.5462
 epoch: 78, train_loss: 0.8071, test_loss: 0.8592, test_f1: 0.5189
 epoch: 79, train_loss: 0.8038, test_loss: 0.8688, test_f1: 0.5150
 epoch: 80, train_loss: 0.8050, test_loss: 0.9013, test_f1: 0.4963
 epoch: 81, train_loss: 0.8045, test_loss: 0.8564, test_f1: 0.5308
 epoch: 82, train_loss: 0.7984, test_loss: 0.8536, test_f1: 0.5287
 epoch: 83, train_loss: 0.8029, test_loss: 0.8752, test_f1: 0.4883
 epoch: 84, train_loss: 0.7978, test_loss: 0.9084, test_f1: 0.4871
 epoch: 85, train_loss: 0.7920, test_loss: 0.8705, test_f1: 0.5133
 epoch: 86, train_loss: 0.7978, test_loss: 0.8502, test_f1: 0.5272
 epoch: 87, train_loss: 0.7915, test_loss: 0.8780, test_f1: 0.4971
 epoch: 88, train_loss: 0.8002, test_loss: 0.8445, test_f1: 0.5471
 epoch: 89, train_loss: 0.7889, test_loss: 0.8534, test_f1: 0.5572
 epoch: 90, train_loss: 0.7940, test_loss: 0.8581, test_f1: 0.5547
 epoch: 91, train_loss: 0.7983, test_loss: 0.8502, test_f1: 0.5363
 epoch: 92, train_loss: 0.7887, test_loss: 0.8630, test_f1: 0.5372
 epoch: 93, train_loss: 0.7934, test_loss: 0.8620, test_f1: 0.5335
 epoch: 94, train_loss: 0.7812, test_loss: 0.8377, test_f1: 0.5519
 epoch: 95, train_loss: 0.7733, test_loss: 0.8779, test_f1: 0.5193
 epoch: 96, train_loss: 0.7825, test_loss: 0.8596, test_f1: 0.5371
 epoch: 97, train_loss: 0.7751, test_loss: 0.8440, test_f1: 0.5561
 epoch: 98, train_loss: 0.7788, test_loss: 0.8860, test_f1: 0.5181
 epoch: 99, train_loss: 0.7734, test_loss: 0.8549, test_f1: 0.5260
##################ITERATION #2 ****************************************
 epoch: 0, train_loss: 1.3134, test_loss: 1.3257, test_f1: 0.2270
 epoch: 1, train_loss: 1.2345, test_loss: 1.3123, test_f1: 0.2270
 epoch: 2, train_loss: 1.1917, test_loss: 1.2815, test_f1: 0.2270
 epoch: 3, train_loss: 1.1558, test_loss: 1.1952, test_f1: 0.2270
 epoch: 4, train_loss: 1.1136, test_loss: 1.1070, test_f1: 0.3731
 epoch: 5, train_loss: 1.0831, test_loss: 1.0545, test_f1: 0.4133
 epoch: 6, train_loss: 1.0609, test_loss: 1.0295, test_f1: 0.4409
 epoch: 7, train_loss: 1.0407, test_loss: 1.0121, test_f1: 0.4518
 epoch: 8, train_loss: 1.0177, test_loss: 1.0124, test_f1: 0.4422
 epoch: 9, train_loss: 1.0051, test_loss: 0.9980, test_f1: 0.4449
 epoch: 10, train_loss: 0.9857, test_loss: 0.9881, test_f1: 0.4749
 epoch: 11, train_loss: 0.9892, test_loss: 0.9785, test_f1: 0.4742
 epoch: 12, train_loss: 0.9770, test_loss: 0.9660, test_f1: 0.4815
 epoch: 13, train_loss: 0.9655, test_loss: 0.9615, test_f1: 0.4854
 epoch: 14, train_loss: 0.9526, test_loss: 0.9495, test_f1: 0.5003
 epoch: 15, train_loss: 0.9481, test_loss: 0.9456, test_f1: 0.4987
 epoch: 16, train_loss: 0.9309, test_loss: 0.9558, test_f1: 0.4908
 epoch: 17, train_loss: 0.9318, test_loss: 0.9338, test_f1: 0.5040
 epoch: 18, train_loss: 0.9242, test_loss: 0.9361, test_f1: 0.5013
 epoch: 19, train_loss: 0.9178, test_loss: 0.9434, test_f1: 0.5242
 epoch: 20, train_loss: 0.9170, test_loss: 0.9358, test_f1: 0.5273
 epoch: 21, train_loss: 0.9045, test_loss: 0.9437, test_f1: 0.5025
 epoch: 22, train_loss: 0.9076, test_loss: 0.9376, test_f1: 0.5097
 epoch: 23, train_loss: 0.9015, test_loss: 0.9633, test_f1: 0.4986
 epoch: 24, train_loss: 0.8996, test_loss: 0.9465, test_f1: 0.4909
 epoch: 25, train_loss: 0.8909, test_loss: 0.9447, test_f1: 0.5191
 epoch: 26, train_loss: 0.8788, test_loss: 0.9540, test_f1: 0.4914
 epoch: 27, train_loss: 0.8725, test_loss: 0.9398, test_f1: 0.5194
 epoch: 28, train_loss: 0.8669, test_loss: 0.9382, test_f1: 0.5370
 epoch: 29, train_loss: 0.8704, test_loss: 0.9363, test_f1: 0.5319
 epoch: 30, train_loss: 0.8578, test_loss: 0.9381, test_f1: 0.5242
 epoch: 31, train_loss: 0.8466, test_loss: 0.9275, test_f1: 0.5227
 epoch: 32, train_loss: 0.8552, test_loss: 0.9691, test_f1: 0.4979
 epoch: 33, train_loss: 0.8563, test_loss: 0.9593, test_f1: 0.5089
 epoch: 34, train_loss: 0.8481, test_loss: 0.9213, test_f1: 0.5228
 epoch: 35, train_loss: 0.8592, test_loss: 0.9330, test_f1: 0.5376
 epoch: 36, train_loss: 0.8635, test_loss: 0.9942, test_f1: 0.5030
 epoch: 37, train_loss: 0.8562, test_loss: 0.9434, test_f1: 0.5287
 epoch: 38, train_loss: 0.8391, test_loss: 0.9362, test_f1: 0.5343
 epoch: 39, train_loss: 0.8428, test_loss: 0.9564, test_f1: 0.5270
 epoch: 40, train_loss: 0.8377, test_loss: 0.9319, test_f1: 0.5229
 epoch: 41, train_loss: 0.8201, test_loss: 0.9256, test_f1: 0.5252
 epoch: 42, train_loss: 0.8217, test_loss: 0.9465, test_f1: 0.5269
 epoch: 43, train_loss: 0.8184, test_loss: 0.9586, test_f1: 0.5149
 epoch: 44, train_loss: 0.8126, test_loss: 0.9194, test_f1: 0.5463
 epoch: 45, train_loss: 0.8111, test_loss: 0.9667, test_f1: 0.5230
 epoch: 46, train_loss: 0.8144, test_loss: 0.9794, test_f1: 0.5122
 epoch: 47, train_loss: 0.8133, test_loss: 0.9806, test_f1: 0.5260
 epoch: 48, train_loss: 0.8133, test_loss: 0.8921, test_f1: 0.5368
 epoch: 49, train_loss: 0.8083, test_loss: 0.9626, test_f1: 0.5427
 epoch: 50, train_loss: 0.8031, test_loss: 0.9441, test_f1: 0.5480
 epoch: 51, train_loss: 0.8008, test_loss: 0.9296, test_f1: 0.5463
 epoch: 52, train_loss: 0.7958, test_loss: 0.9432, test_f1: 0.5314
 epoch: 53, train_loss: 0.7903, test_loss: 0.9380, test_f1: 0.5358
 epoch: 54, train_loss: 0.7961, test_loss: 0.9330, test_f1: 0.5371
 epoch: 55, train_loss: 0.7896, test_loss: 0.9223, test_f1: 0.5455
 epoch: 56, train_loss: 0.7839, test_loss: 0.9436, test_f1: 0.5345
 epoch: 57, train_loss: 0.7768, test_loss: 0.9335, test_f1: 0.5407
 epoch: 58, train_loss: 0.7779, test_loss: 0.9370, test_f1: 0.5396
 epoch: 59, train_loss: 0.7832, test_loss: 0.9178, test_f1: 0.5337
 epoch: 60, train_loss: 0.7696, test_loss: 0.9414, test_f1: 0.5358
 epoch: 61, train_loss: 0.7813, test_loss: 0.9409, test_f1: 0.5414
 epoch: 62, train_loss: 0.7843, test_loss: 0.9484, test_f1: 0.5456
 epoch: 63, train_loss: 0.7733, test_loss: 0.9510, test_f1: 0.5441
 epoch: 64, train_loss: 0.7699, test_loss: 0.9555, test_f1: 0.5481
 epoch: 65, train_loss: 0.7795, test_loss: 0.9500, test_f1: 0.5489
 epoch: 66, train_loss: 0.7725, test_loss: 0.9353, test_f1: 0.5455
 epoch: 67, train_loss: 0.7749, test_loss: 0.9411, test_f1: 0.5473
 epoch: 68, train_loss: 0.7623, test_loss: 0.9462, test_f1: 0.5420
 epoch: 69, train_loss: 0.7654, test_loss: 0.9443, test_f1: 0.5494
 epoch: 70, train_loss: 0.7578, test_loss: 0.9638, test_f1: 0.5344
 epoch: 71, train_loss: 0.7617, test_loss: 0.9519, test_f1: 0.5442
 epoch: 72, train_loss: 0.7617, test_loss: 0.9561, test_f1: 0.5408
 epoch: 73, train_loss: 0.7599, test_loss: 0.9528, test_f1: 0.5380
 epoch: 74, train_loss: 0.7599, test_loss: 0.9468, test_f1: 0.5474
 epoch: 75, train_loss: 0.7483, test_loss: 0.9568, test_f1: 0.5445
 epoch: 76, train_loss: 0.7567, test_loss: 0.9598, test_f1: 0.5378
 epoch: 77, train_loss: 0.7588, test_loss: 0.9436, test_f1: 0.5508
 epoch: 78, train_loss: 0.7672, test_loss: 0.9474, test_f1: 0.5442
 epoch: 79, train_loss: 0.7503, test_loss: 0.9500, test_f1: 0.5441
 epoch: 80, train_loss: 0.7458, test_loss: 0.9447, test_f1: 0.5481
 epoch: 81, train_loss: 0.7443, test_loss: 0.9431, test_f1: 0.5457
 epoch: 82, train_loss: 0.7609, test_loss: 0.9394, test_f1: 0.5340
 epoch: 83, train_loss: 0.7460, test_loss: 0.9262, test_f1: 0.5289
 epoch: 84, train_loss: 0.7537, test_loss: 0.9473, test_f1: 0.5405
 epoch: 85, train_loss: 0.7463, test_loss: 0.9400, test_f1: 0.5490
 epoch: 86, train_loss: 0.7485, test_loss: 0.9424, test_f1: 0.5458
 epoch: 87, train_loss: 0.7473, test_loss: 0.9559, test_f1: 0.5400
 epoch: 88, train_loss: 0.7446, test_loss: 0.9389, test_f1: 0.5512
 epoch: 89, train_loss: 0.7463, test_loss: 0.9511, test_f1: 0.5402
 epoch: 90, train_loss: 0.7371, test_loss: 0.9560, test_f1: 0.5372
 epoch: 91, train_loss: 0.7448, test_loss: 0.9246, test_f1: 0.5364
 epoch: 92, train_loss: 0.7318, test_loss: 0.9855, test_f1: 0.5437
 epoch: 93, train_loss: 0.7339, test_loss: 0.9431, test_f1: 0.5408
 epoch: 94, train_loss: 0.7342, test_loss: 0.9524, test_f1: 0.5494
 epoch: 95, train_loss: 0.7373, test_loss: 0.9634, test_f1: 0.5376
 epoch: 96, train_loss: 0.7389, test_loss: 0.9585, test_f1: 0.5487
 epoch: 97, train_loss: 0.7482, test_loss: 0.9747, test_f1: 0.5377
 epoch: 98, train_loss: 0.7420, test_loss: 0.9729, test_f1: 0.5218
 epoch: 99, train_loss: 0.7291, test_loss: 0.9640, test_f1: 0.5412
##################ITERATION #3 ****************************************
 epoch: 0, train_loss: 1.2857, test_loss: 1.3344, test_f1: 0.2270
 epoch: 1, train_loss: 1.1655, test_loss: 1.3457, test_f1: 0.2270
 epoch: 2, train_loss: 1.1282, test_loss: 1.4095, test_f1: 0.2420
 epoch: 3, train_loss: 1.0917, test_loss: 1.2925, test_f1: 0.3545
 epoch: 4, train_loss: 1.0753, test_loss: 1.0549, test_f1: 0.4644
 epoch: 5, train_loss: 1.0526, test_loss: 1.0197, test_f1: 0.4475
 epoch: 6, train_loss: 1.0364, test_loss: 1.0027, test_f1: 0.4691
 epoch: 7, train_loss: 1.0349, test_loss: 0.9796, test_f1: 0.4888
 epoch: 8, train_loss: 1.0165, test_loss: 0.9743, test_f1: 0.4883
 epoch: 9, train_loss: 1.0051, test_loss: 0.9989, test_f1: 0.4883
 epoch: 10, train_loss: 0.9869, test_loss: 0.9490, test_f1: 0.4932
 epoch: 11, train_loss: 0.9884, test_loss: 0.9683, test_f1: 0.4960
 epoch: 12, train_loss: 0.9681, test_loss: 0.9470, test_f1: 0.5026
 epoch: 13, train_loss: 0.9800, test_loss: 0.9286, test_f1: 0.5202
 epoch: 14, train_loss: 0.9559, test_loss: 0.9367, test_f1: 0.5053
 epoch: 15, train_loss: 0.9614, test_loss: 0.9105, test_f1: 0.5182
 epoch: 16, train_loss: 0.9592, test_loss: 0.9443, test_f1: 0.4971
 epoch: 17, train_loss: 0.9545, test_loss: 0.9305, test_f1: 0.5118
 epoch: 18, train_loss: 0.9484, test_loss: 0.9267, test_f1: 0.5113
 epoch: 19, train_loss: 0.9395, test_loss: 0.9079, test_f1: 0.4958
 epoch: 20, train_loss: 0.9312, test_loss: 0.9045, test_f1: 0.5102
 epoch: 21, train_loss: 0.9346, test_loss: 0.9062, test_f1: 0.5061
 epoch: 22, train_loss: 0.9298, test_loss: 0.8924, test_f1: 0.5151
 epoch: 23, train_loss: 0.9211, test_loss: 0.9028, test_f1: 0.5222
 epoch: 24, train_loss: 0.9202, test_loss: 0.9131, test_f1: 0.5100
 epoch: 25, train_loss: 0.9145, test_loss: 0.8722, test_f1: 0.5319
 epoch: 26, train_loss: 0.9149, test_loss: 0.8764, test_f1: 0.5289
 epoch: 27, train_loss: 0.9028, test_loss: 0.8870, test_f1: 0.5201
 epoch: 28, train_loss: 0.8911, test_loss: 0.9079, test_f1: 0.5111
 epoch: 29, train_loss: 0.9015, test_loss: 0.8692, test_f1: 0.5218
 epoch: 30, train_loss: 0.9082, test_loss: 0.8766, test_f1: 0.5320
 epoch: 31, train_loss: 0.8976, test_loss: 0.8909, test_f1: 0.5214
 epoch: 32, train_loss: 0.8786, test_loss: 0.8831, test_f1: 0.5300
 epoch: 33, train_loss: 0.8823, test_loss: 0.8787, test_f1: 0.5337
 epoch: 34, train_loss: 0.8803, test_loss: 0.8979, test_f1: 0.5256
 epoch: 35, train_loss: 0.8835, test_loss: 0.8814, test_f1: 0.5462
 epoch: 36, train_loss: 0.8777, test_loss: 0.8595, test_f1: 0.5400
 epoch: 37, train_loss: 0.8675, test_loss: 0.8846, test_f1: 0.5350
 epoch: 38, train_loss: 0.8763, test_loss: 0.8746, test_f1: 0.5250
 epoch: 39, train_loss: 0.8780, test_loss: 0.9149, test_f1: 0.5187
 epoch: 40, train_loss: 0.8704, test_loss: 0.8881, test_f1: 0.5221
 epoch: 41, train_loss: 0.8611, test_loss: 0.8498, test_f1: 0.5515
 epoch: 42, train_loss: 0.8529, test_loss: 0.8454, test_f1: 0.5502
 epoch: 43, train_loss: 0.8563, test_loss: 0.8707, test_f1: 0.5402
 epoch: 44, train_loss: 0.8546, test_loss: 0.8818, test_f1: 0.5270
 epoch: 45, train_loss: 0.8534, test_loss: 0.8812, test_f1: 0.5492
 epoch: 46, train_loss: 0.8464, test_loss: 0.8908, test_f1: 0.5471
 epoch: 47, train_loss: 0.8676, test_loss: 0.8547, test_f1: 0.5484
 epoch: 48, train_loss: 0.8366, test_loss: 0.8696, test_f1: 0.5462
 epoch: 49, train_loss: 0.8397, test_loss: 0.8928, test_f1: 0.5339
 epoch: 50, train_loss: 0.8340, test_loss: 0.8590, test_f1: 0.5461
 epoch: 51, train_loss: 0.8277, test_loss: 0.8708, test_f1: 0.5482
 epoch: 52, train_loss: 0.8173, test_loss: 0.8886, test_f1: 0.5450
 epoch: 53, train_loss: 0.8228, test_loss: 0.8518, test_f1: 0.5608
 epoch: 54, train_loss: 0.8222, test_loss: 0.8525, test_f1: 0.5516
 epoch: 55, train_loss: 0.8189, test_loss: 0.8613, test_f1: 0.5552
 epoch: 56, train_loss: 0.8103, test_loss: 0.8456, test_f1: 0.5521
 epoch: 57, train_loss: 0.8219, test_loss: 0.8693, test_f1: 0.5466
 epoch: 58, train_loss: 0.8220, test_loss: 0.8468, test_f1: 0.5679
 epoch: 59, train_loss: 0.8073, test_loss: 0.8848, test_f1: 0.5486
 epoch: 60, train_loss: 0.8132, test_loss: 0.8518, test_f1: 0.5588
 epoch: 61, train_loss: 0.8087, test_loss: 0.8980, test_f1: 0.5280
 epoch: 62, train_loss: 0.8042, test_loss: 0.8521, test_f1: 0.5557
 epoch: 63, train_loss: 0.7993, test_loss: 0.8539, test_f1: 0.5544
 epoch: 64, train_loss: 0.8069, test_loss: 0.8501, test_f1: 0.5584
 epoch: 65, train_loss: 0.8070, test_loss: 0.8516, test_f1: 0.5521
 epoch: 66, train_loss: 0.7997, test_loss: 0.9030, test_f1: 0.5365
 epoch: 67, train_loss: 0.7967, test_loss: 0.8474, test_f1: 0.5608
 epoch: 68, train_loss: 0.7996, test_loss: 0.8712, test_f1: 0.5492
 epoch: 69, train_loss: 0.7958, test_loss: 0.8519, test_f1: 0.5644
 epoch: 70, train_loss: 0.7978, test_loss: 0.8647, test_f1: 0.5427
 epoch: 71, train_loss: 0.7944, test_loss: 0.8574, test_f1: 0.5603
 epoch: 72, train_loss: 0.7865, test_loss: 0.8820, test_f1: 0.5465
 epoch: 73, train_loss: 0.7843, test_loss: 0.8815, test_f1: 0.5502
 epoch: 74, train_loss: 0.7881, test_loss: 0.8550, test_f1: 0.5577
 epoch: 75, train_loss: 0.7849, test_loss: 0.8534, test_f1: 0.5625
 epoch: 76, train_loss: 0.7996, test_loss: 0.9003, test_f1: 0.5544
 epoch: 77, train_loss: 0.7989, test_loss: 0.8743, test_f1: 0.5545
 epoch: 78, train_loss: 0.7836, test_loss: 0.8940, test_f1: 0.5479
 epoch: 79, train_loss: 0.7843, test_loss: 0.8731, test_f1: 0.5520
 epoch: 80, train_loss: 0.7726, test_loss: 0.8794, test_f1: 0.5475
 epoch: 81, train_loss: 0.7796, test_loss: 0.8857, test_f1: 0.5462
 epoch: 82, train_loss: 0.7649, test_loss: 0.8621, test_f1: 0.5484
 epoch: 83, train_loss: 0.7702, test_loss: 0.8799, test_f1: 0.5559
 epoch: 84, train_loss: 0.7716, test_loss: 0.8830, test_f1: 0.5607
 epoch: 85, train_loss: 0.7811, test_loss: 0.8891, test_f1: 0.5480
 epoch: 86, train_loss: 0.7774, test_loss: 0.8797, test_f1: 0.5466
 epoch: 87, train_loss: 0.7801, test_loss: 0.8711, test_f1: 0.5535
 epoch: 88, train_loss: 0.7616, test_loss: 0.8737, test_f1: 0.5554
 epoch: 89, train_loss: 0.7811, test_loss: 0.8645, test_f1: 0.5553
 epoch: 90, train_loss: 0.7672, test_loss: 0.8685, test_f1: 0.5584
 epoch: 91, train_loss: 0.7652, test_loss: 0.8710, test_f1: 0.5605
 epoch: 92, train_loss: 0.7670, test_loss: 0.8670, test_f1: 0.5526
 epoch: 93, train_loss: 0.7536, test_loss: 0.9367, test_f1: 0.5406
 epoch: 94, train_loss: 0.7716, test_loss: 0.9126, test_f1: 0.5598
 epoch: 95, train_loss: 0.7652, test_loss: 0.8881, test_f1: 0.5549
 epoch: 96, train_loss: 0.7613, test_loss: 0.8866, test_f1: 0.5432
 epoch: 97, train_loss: 0.7544, test_loss: 0.8723, test_f1: 0.5597
 epoch: 98, train_loss: 0.7520, test_loss: 0.8752, test_f1: 0.5665
 epoch: 99, train_loss: 0.7666, test_loss: 0.8812, test_f1: 0.5534
##################ITERATION #4 ****************************************
 epoch: 0, train_loss: 1.4133, test_loss: 1.4103, test_f1: 0.2270
 epoch: 1, train_loss: 1.2125, test_loss: 1.3734, test_f1: 0.2270
 epoch: 2, train_loss: 1.1572, test_loss: 1.3582, test_f1: 0.2270
 epoch: 3, train_loss: 1.1236, test_loss: 1.3660, test_f1: 0.2270
 epoch: 4, train_loss: 1.0959, test_loss: 1.2956, test_f1: 0.2491
 epoch: 5, train_loss: 1.0815, test_loss: 1.1313, test_f1: 0.3398
 epoch: 6, train_loss: 1.0666, test_loss: 1.0609, test_f1: 0.3751
 epoch: 7, train_loss: 1.0568, test_loss: 1.0488, test_f1: 0.3893
 epoch: 8, train_loss: 1.0437, test_loss: 1.0486, test_f1: 0.4049
 epoch: 9, train_loss: 1.0373, test_loss: 1.0434, test_f1: 0.4085
 epoch: 10, train_loss: 1.0326, test_loss: 1.0333, test_f1: 0.4200
 epoch: 11, train_loss: 1.0193, test_loss: 1.0237, test_f1: 0.4175
 epoch: 12, train_loss: 1.0138, test_loss: 1.0263, test_f1: 0.4241
 epoch: 13, train_loss: 1.0037, test_loss: 1.0108, test_f1: 0.4406
 epoch: 14, train_loss: 1.0006, test_loss: 0.9987, test_f1: 0.4371
 epoch: 15, train_loss: 0.9930, test_loss: 0.9982, test_f1: 0.4426
 epoch: 16, train_loss: 0.9772, test_loss: 0.9679, test_f1: 0.4423
 epoch: 17, train_loss: 0.9739, test_loss: 0.9798, test_f1: 0.4513
 epoch: 18, train_loss: 0.9714, test_loss: 0.9385, test_f1: 0.4783
 epoch: 19, train_loss: 0.9607, test_loss: 0.9453, test_f1: 0.4636
 epoch: 20, train_loss: 0.9528, test_loss: 0.9547, test_f1: 0.4735
 epoch: 21, train_loss: 0.9547, test_loss: 0.9194, test_f1: 0.4914
 epoch: 22, train_loss: 0.9409, test_loss: 0.9201, test_f1: 0.4890
 epoch: 23, train_loss: 0.9359, test_loss: 0.9006, test_f1: 0.4976
 epoch: 24, train_loss: 0.9337, test_loss: 0.9765, test_f1: 0.4830
 epoch: 25, train_loss: 0.9309, test_loss: 0.9269, test_f1: 0.5027
 epoch: 26, train_loss: 0.9255, test_loss: 0.9106, test_f1: 0.4986
 epoch: 27, train_loss: 0.9218, test_loss: 0.9060, test_f1: 0.4953
 epoch: 28, train_loss: 0.9057, test_loss: 0.9226, test_f1: 0.5039
 epoch: 29, train_loss: 0.9099, test_loss: 1.0204, test_f1: 0.4675
 epoch: 30, train_loss: 0.9103, test_loss: 0.9134, test_f1: 0.5093
 epoch: 31, train_loss: 0.9032, test_loss: 0.8927, test_f1: 0.5078
 epoch: 32, train_loss: 0.8917, test_loss: 0.8848, test_f1: 0.4998
 epoch: 33, train_loss: 0.8932, test_loss: 0.8768, test_f1: 0.5213
 epoch: 34, train_loss: 0.8825, test_loss: 0.8733, test_f1: 0.5217
 epoch: 35, train_loss: 0.8938, test_loss: 0.9206, test_f1: 0.5012
 epoch: 36, train_loss: 0.8811, test_loss: 0.8718, test_f1: 0.5252
 epoch: 37, train_loss: 0.8811, test_loss: 0.8709, test_f1: 0.5366
 epoch: 38, train_loss: 0.8750, test_loss: 0.9007, test_f1: 0.5387
 epoch: 39, train_loss: 0.8808, test_loss: 0.9014, test_f1: 0.5070
 epoch: 40, train_loss: 0.8799, test_loss: 0.9238, test_f1: 0.4905
 epoch: 41, train_loss: 0.8689, test_loss: 0.8653, test_f1: 0.5291
 epoch: 42, train_loss: 0.8852, test_loss: 0.8955, test_f1: 0.5269
 epoch: 43, train_loss: 0.8711, test_loss: 0.8971, test_f1: 0.5004
 epoch: 44, train_loss: 0.8788, test_loss: 0.8936, test_f1: 0.5117
 epoch: 45, train_loss: 0.8691, test_loss: 0.8849, test_f1: 0.5196
 epoch: 46, train_loss: 0.8655, test_loss: 0.8590, test_f1: 0.5421
 epoch: 47, train_loss: 0.8664, test_loss: 0.9217, test_f1: 0.5101
 epoch: 48, train_loss: 0.8595, test_loss: 0.8672, test_f1: 0.5273
 epoch: 49, train_loss: 0.8493, test_loss: 0.9282, test_f1: 0.5188
 epoch: 50, train_loss: 0.8439, test_loss: 0.8791, test_f1: 0.5371
 epoch: 51, train_loss: 0.8468, test_loss: 0.8993, test_f1: 0.5117
 epoch: 52, train_loss: 0.8403, test_loss: 0.9070, test_f1: 0.5010
 epoch: 53, train_loss: 0.8345, test_loss: 0.9013, test_f1: 0.5103
 epoch: 54, train_loss: 0.8354, test_loss: 0.9149, test_f1: 0.5101
 epoch: 55, train_loss: 0.8398, test_loss: 0.9277, test_f1: 0.5211
 epoch: 56, train_loss: 0.8352, test_loss: 0.8876, test_f1: 0.5269
 epoch: 57, train_loss: 0.8346, test_loss: 0.9494, test_f1: 0.5043
 epoch: 58, train_loss: 0.8314, test_loss: 0.9057, test_f1: 0.5256
 epoch: 59, train_loss: 0.8346, test_loss: 0.8609, test_f1: 0.5366
 epoch: 60, train_loss: 0.8236, test_loss: 0.9012, test_f1: 0.5131
 epoch: 61, train_loss: 0.8302, test_loss: 0.8713, test_f1: 0.5413
 epoch: 62, train_loss: 0.8224, test_loss: 0.9081, test_f1: 0.5212
 epoch: 63, train_loss: 0.8263, test_loss: 0.8870, test_f1: 0.5178
 epoch: 64, train_loss: 0.8202, test_loss: 0.8806, test_f1: 0.5181
 epoch: 65, train_loss: 0.8133, test_loss: 0.8944, test_f1: 0.5252
 epoch: 66, train_loss: 0.8212, test_loss: 0.8966, test_f1: 0.5295
 epoch: 67, train_loss: 0.8195, test_loss: 0.8901, test_f1: 0.5506
 epoch: 68, train_loss: 0.8194, test_loss: 0.8634, test_f1: 0.5328
 epoch: 69, train_loss: 0.8135, test_loss: 0.8932, test_f1: 0.5405
 epoch: 70, train_loss: 0.8046, test_loss: 0.8667, test_f1: 0.5424
 epoch: 71, train_loss: 0.7968, test_loss: 0.9055, test_f1: 0.5268
 epoch: 72, train_loss: 0.8090, test_loss: 0.9541, test_f1: 0.5237
 epoch: 73, train_loss: 0.7989, test_loss: 0.8932, test_f1: 0.5284
 epoch: 74, train_loss: 0.8028, test_loss: 0.8548, test_f1: 0.5483
 epoch: 75, train_loss: 0.8175, test_loss: 0.8753, test_f1: 0.5374
 epoch: 76, train_loss: 0.8055, test_loss: 0.9768, test_f1: 0.5180
 epoch: 77, train_loss: 0.8096, test_loss: 0.8829, test_f1: 0.5269
 epoch: 78, train_loss: 0.7977, test_loss: 0.9082, test_f1: 0.5307
 epoch: 79, train_loss: 0.8024, test_loss: 0.8898, test_f1: 0.5544
 epoch: 80, train_loss: 0.7998, test_loss: 0.9309, test_f1: 0.5283
 epoch: 81, train_loss: 0.7977, test_loss: 0.9148, test_f1: 0.5410
 epoch: 82, train_loss: 0.7999, test_loss: 0.8809, test_f1: 0.5412
 epoch: 83, train_loss: 0.7961, test_loss: 0.8956, test_f1: 0.5240
 epoch: 84, train_loss: 0.7786, test_loss: 0.9387, test_f1: 0.5271
 epoch: 85, train_loss: 0.7930, test_loss: 0.8908, test_f1: 0.5458
 epoch: 86, train_loss: 0.7943, test_loss: 0.8874, test_f1: 0.5414
 epoch: 87, train_loss: 0.7980, test_loss: 0.8800, test_f1: 0.5292
 epoch: 88, train_loss: 0.7938, test_loss: 0.8535, test_f1: 0.5345
 epoch: 89, train_loss: 0.8003, test_loss: 0.8709, test_f1: 0.5430
 epoch: 90, train_loss: 0.7789, test_loss: 0.8756, test_f1: 0.5513
 epoch: 91, train_loss: 0.7896, test_loss: 0.9798, test_f1: 0.5139
 epoch: 92, train_loss: 0.7773, test_loss: 0.9048, test_f1: 0.5386
 epoch: 93, train_loss: 0.7825, test_loss: 0.9141, test_f1: 0.5419
 epoch: 94, train_loss: 0.7790, test_loss: 0.9085, test_f1: 0.5495
 epoch: 95, train_loss: 0.7822, test_loss: 0.8994, test_f1: 0.5452
 epoch: 96, train_loss: 0.8007, test_loss: 0.8545, test_f1: 0.5586
 epoch: 97, train_loss: 0.7829, test_loss: 0.9193, test_f1: 0.5452
 epoch: 98, train_loss: 0.7780, test_loss: 0.8980, test_f1: 0.5552
 epoch: 99, train_loss: 0.7773, test_loss: 0.9199, test_f1: 0.5415
##################ITERATION #5 ****************************************
 epoch: 0, train_loss: 1.2757, test_loss: 1.3564, test_f1: 0.2270
 epoch: 1, train_loss: 1.1823, test_loss: 1.3159, test_f1: 0.2270
 epoch: 2, train_loss: 1.1333, test_loss: 1.2292, test_f1: 0.3080
 epoch: 3, train_loss: 1.1029, test_loss: 1.2055, test_f1: 0.3108
 epoch: 4, train_loss: 1.0851, test_loss: 1.1646, test_f1: 0.3411
 epoch: 5, train_loss: 1.0658, test_loss: 1.1088, test_f1: 0.3680
 epoch: 6, train_loss: 1.0541, test_loss: 1.0707, test_f1: 0.3897
 epoch: 7, train_loss: 1.0375, test_loss: 1.0424, test_f1: 0.4153
 epoch: 8, train_loss: 1.0412, test_loss: 1.0743, test_f1: 0.4412
 epoch: 9, train_loss: 1.0187, test_loss: 1.0591, test_f1: 0.4297
 epoch: 10, train_loss: 1.0094, test_loss: 1.0313, test_f1: 0.4357
 epoch: 11, train_loss: 1.0056, test_loss: 1.0514, test_f1: 0.4816
 epoch: 12, train_loss: 0.9931, test_loss: 1.0442, test_f1: 0.4710
 epoch: 13, train_loss: 0.9939, test_loss: 1.0250, test_f1: 0.4814
 epoch: 14, train_loss: 0.9874, test_loss: 1.0216, test_f1: 0.4818
 epoch: 15, train_loss: 0.9822, test_loss: 1.0401, test_f1: 0.4866
 epoch: 16, train_loss: 0.9847, test_loss: 1.0541, test_f1: 0.5090
 epoch: 17, train_loss: 0.9692, test_loss: 1.0420, test_f1: 0.4880
 epoch: 18, train_loss: 0.9608, test_loss: 1.0282, test_f1: 0.4930
 epoch: 19, train_loss: 0.9563, test_loss: 1.0296, test_f1: 0.4794
 epoch: 20, train_loss: 0.9539, test_loss: 0.9989, test_f1: 0.4762
 epoch: 21, train_loss: 0.9441, test_loss: 1.0111, test_f1: 0.5112
 epoch: 22, train_loss: 0.9370, test_loss: 0.9987, test_f1: 0.5103
 epoch: 23, train_loss: 0.9394, test_loss: 0.9928, test_f1: 0.4842
 epoch: 24, train_loss: 0.9263, test_loss: 1.0360, test_f1: 0.4649
 epoch: 25, train_loss: 0.9231, test_loss: 0.9782, test_f1: 0.4957
 epoch: 26, train_loss: 0.9185, test_loss: 1.0110, test_f1: 0.4895
 epoch: 27, train_loss: 0.9141, test_loss: 0.9451, test_f1: 0.4917
 epoch: 28, train_loss: 0.9144, test_loss: 1.0077, test_f1: 0.4923
 epoch: 29, train_loss: 0.8980, test_loss: 0.9095, test_f1: 0.5250
 epoch: 30, train_loss: 0.9004, test_loss: 1.0122, test_f1: 0.4994
 epoch: 31, train_loss: 0.8882, test_loss: 0.9471, test_f1: 0.5066
 epoch: 32, train_loss: 0.8862, test_loss: 0.9230, test_f1: 0.5131
 epoch: 33, train_loss: 0.8918, test_loss: 0.9227, test_f1: 0.5207
 epoch: 34, train_loss: 0.8832, test_loss: 1.0173, test_f1: 0.4862
 epoch: 35, train_loss: 0.8796, test_loss: 0.9732, test_f1: 0.4919
 epoch: 36, train_loss: 0.8793, test_loss: 0.9487, test_f1: 0.4809
 epoch: 37, train_loss: 0.8728, test_loss: 0.9138, test_f1: 0.5170
 epoch: 38, train_loss: 0.8612, test_loss: 0.8698, test_f1: 0.5478
 epoch: 39, train_loss: 0.8642, test_loss: 0.9408, test_f1: 0.5085
 epoch: 40, train_loss: 0.8622, test_loss: 0.9530, test_f1: 0.5117
 epoch: 41, train_loss: 0.8582, test_loss: 0.8844, test_f1: 0.5460
 epoch: 42, train_loss: 0.8516, test_loss: 0.8903, test_f1: 0.5203
 epoch: 43, train_loss: 0.8405, test_loss: 0.8874, test_f1: 0.5303
 epoch: 44, train_loss: 0.8381, test_loss: 0.8926, test_f1: 0.5257
 epoch: 45, train_loss: 0.8345, test_loss: 0.8583, test_f1: 0.5483
 epoch: 46, train_loss: 0.8364, test_loss: 0.8722, test_f1: 0.5317
 epoch: 47, train_loss: 0.8321, test_loss: 0.9306, test_f1: 0.5352
 epoch: 48, train_loss: 0.8376, test_loss: 1.0267, test_f1: 0.5199
 epoch: 49, train_loss: 0.8360, test_loss: 0.8557, test_f1: 0.5353
 epoch: 50, train_loss: 0.8325, test_loss: 0.8801, test_f1: 0.5224
 epoch: 51, train_loss: 0.8134, test_loss: 0.8430, test_f1: 0.5629
 epoch: 52, train_loss: 0.8089, test_loss: 0.9535, test_f1: 0.5205
 epoch: 53, train_loss: 0.8026, test_loss: 0.8409, test_f1: 0.5582
 epoch: 54, train_loss: 0.8040, test_loss: 0.8440, test_f1: 0.5494
 epoch: 55, train_loss: 0.8085, test_loss: 0.8842, test_f1: 0.5139
 epoch: 56, train_loss: 0.7959, test_loss: 0.8488, test_f1: 0.5531
 epoch: 57, train_loss: 0.8061, test_loss: 0.9258, test_f1: 0.5064
 epoch: 58, train_loss: 0.8105, test_loss: 0.8478, test_f1: 0.5560
 epoch: 59, train_loss: 0.7978, test_loss: 0.8548, test_f1: 0.5582
 epoch: 60, train_loss: 0.7865, test_loss: 0.8763, test_f1: 0.5392
 epoch: 61, train_loss: 0.7948, test_loss: 0.8905, test_f1: 0.5414
 epoch: 62, train_loss: 0.7988, test_loss: 0.8498, test_f1: 0.5639
 epoch: 63, train_loss: 0.7885, test_loss: 0.8625, test_f1: 0.5326
 epoch: 64, train_loss: 0.7837, test_loss: 0.8400, test_f1: 0.5596
 epoch: 65, train_loss: 0.7862, test_loss: 0.8371, test_f1: 0.5582
 epoch: 66, train_loss: 0.7892, test_loss: 0.8856, test_f1: 0.5421
 epoch: 67, train_loss: 0.7857, test_loss: 0.8472, test_f1: 0.5421
 epoch: 68, train_loss: 0.7927, test_loss: 0.8716, test_f1: 0.5385
 epoch: 69, train_loss: 0.7899, test_loss: 0.8552, test_f1: 0.5620
 epoch: 70, train_loss: 0.7940, test_loss: 0.8442, test_f1: 0.5580
 epoch: 71, train_loss: 0.7883, test_loss: 0.9866, test_f1: 0.5237
 epoch: 72, train_loss: 0.7808, test_loss: 0.8889, test_f1: 0.5431
 epoch: 73, train_loss: 0.7741, test_loss: 0.8791, test_f1: 0.5207
 epoch: 74, train_loss: 0.7741, test_loss: 0.8862, test_f1: 0.5420
 epoch: 75, train_loss: 0.7767, test_loss: 0.8532, test_f1: 0.5447
 epoch: 76, train_loss: 0.7539, test_loss: 0.8875, test_f1: 0.5386
 epoch: 77, train_loss: 0.7691, test_loss: 0.8704, test_f1: 0.5284
 epoch: 78, train_loss: 0.7586, test_loss: 0.9039, test_f1: 0.5303
 epoch: 79, train_loss: 0.7774, test_loss: 0.8905, test_f1: 0.5460
 epoch: 80, train_loss: 0.7752, test_loss: 0.9151, test_f1: 0.5441
 epoch: 81, train_loss: 0.7664, test_loss: 0.8415, test_f1: 0.5601
 epoch: 82, train_loss: 0.7755, test_loss: 0.8299, test_f1: 0.5610
 epoch: 83, train_loss: 0.7657, test_loss: 0.8590, test_f1: 0.5605
 epoch: 84, train_loss: 0.7662, test_loss: 0.8504, test_f1: 0.5511
 epoch: 85, train_loss: 0.7610, test_loss: 0.9373, test_f1: 0.5514
 epoch: 86, train_loss: 0.7619, test_loss: 0.8258, test_f1: 0.5613
 epoch: 87, train_loss: 0.7609, test_loss: 0.8994, test_f1: 0.5511
 epoch: 88, train_loss: 0.7492, test_loss: 0.9161, test_f1: 0.5556
 epoch: 89, train_loss: 0.7598, test_loss: 0.8227, test_f1: 0.5646
 epoch: 90, train_loss: 0.7550, test_loss: 0.8843, test_f1: 0.5437
 epoch: 91, train_loss: 0.7634, test_loss: 0.8622, test_f1: 0.5429
 epoch: 92, train_loss: 0.7497, test_loss: 0.8417, test_f1: 0.5592
 epoch: 93, train_loss: 0.7650, test_loss: 0.8279, test_f1: 0.5652
 epoch: 94, train_loss: 0.7472, test_loss: 0.8872, test_f1: 0.5598
 epoch: 95, train_loss: 0.7501, test_loss: 0.8176, test_f1: 0.5804
 epoch: 96, train_loss: 0.7567, test_loss: 0.8332, test_f1: 0.5648
 epoch: 97, train_loss: 0.7406, test_loss: 0.9071, test_f1: 0.5427
 epoch: 98, train_loss: 0.7506, test_loss: 0.9244, test_f1: 0.5453
 epoch: 99, train_loss: 0.7510, test_loss: 0.8544, test_f1: 0.5672
##################ITERATION #6 ****************************************
 epoch: 0, train_loss: 1.2736, test_loss: 1.3322, test_f1: 0.2270
 epoch: 1, train_loss: 1.1422, test_loss: 1.3131, test_f1: 0.2270
 epoch: 2, train_loss: 1.1051, test_loss: 1.2682, test_f1: 0.2255
 epoch: 3, train_loss: 1.0638, test_loss: 1.1140, test_f1: 0.3466
 epoch: 4, train_loss: 1.0401, test_loss: 1.0324, test_f1: 0.4113
 epoch: 5, train_loss: 1.0429, test_loss: 1.0182, test_f1: 0.4417
 epoch: 6, train_loss: 1.0125, test_loss: 0.9965, test_f1: 0.4465
 epoch: 7, train_loss: 1.0011, test_loss: 0.9765, test_f1: 0.4608
 epoch: 8, train_loss: 0.9864, test_loss: 0.9703, test_f1: 0.4679
 epoch: 9, train_loss: 0.9873, test_loss: 0.9897, test_f1: 0.4611
 epoch: 10, train_loss: 0.9705, test_loss: 0.9960, test_f1: 0.4638
 epoch: 11, train_loss: 0.9730, test_loss: 0.9849, test_f1: 0.4611
 epoch: 12, train_loss: 0.9615, test_loss: 0.9629, test_f1: 0.4908
 epoch: 13, train_loss: 0.9563, test_loss: 0.9573, test_f1: 0.4808
 epoch: 14, train_loss: 0.9564, test_loss: 0.9634, test_f1: 0.4767
 epoch: 15, train_loss: 0.9567, test_loss: 0.9388, test_f1: 0.4860
 epoch: 16, train_loss: 0.9423, test_loss: 0.9631, test_f1: 0.5034
 epoch: 17, train_loss: 0.9316, test_loss: 0.9634, test_f1: 0.4785
 epoch: 18, train_loss: 0.9263, test_loss: 0.9320, test_f1: 0.4920
 epoch: 19, train_loss: 0.9141, test_loss: 0.9448, test_f1: 0.4921
 epoch: 20, train_loss: 0.9166, test_loss: 0.9683, test_f1: 0.4730
 epoch: 21, train_loss: 0.9141, test_loss: 0.9346, test_f1: 0.5039
 epoch: 22, train_loss: 0.9020, test_loss: 0.9595, test_f1: 0.4796
 epoch: 23, train_loss: 0.8941, test_loss: 0.9126, test_f1: 0.5171
 epoch: 24, train_loss: 0.9039, test_loss: 0.9938, test_f1: 0.4685
 epoch: 25, train_loss: 0.8838, test_loss: 0.9427, test_f1: 0.5059
 epoch: 26, train_loss: 0.8866, test_loss: 0.9721, test_f1: 0.4903
 epoch: 27, train_loss: 0.8892, test_loss: 0.9522, test_f1: 0.4882
 epoch: 28, train_loss: 0.8809, test_loss: 0.9365, test_f1: 0.4993
 epoch: 29, train_loss: 0.8789, test_loss: 0.9490, test_f1: 0.5081
 epoch: 30, train_loss: 0.8703, test_loss: 0.9367, test_f1: 0.5193
 epoch: 31, train_loss: 0.8631, test_loss: 0.9969, test_f1: 0.4834
 epoch: 32, train_loss: 0.8704, test_loss: 0.9475, test_f1: 0.5215
 epoch: 33, train_loss: 0.8608, test_loss: 0.9416, test_f1: 0.5269
 epoch: 34, train_loss: 0.8615, test_loss: 0.8956, test_f1: 0.5396
 epoch: 35, train_loss: 0.8570, test_loss: 0.9882, test_f1: 0.4958
 epoch: 36, train_loss: 0.8491, test_loss: 0.9011, test_f1: 0.5618
 epoch: 37, train_loss: 0.8557, test_loss: 0.9738, test_f1: 0.5015
 epoch: 38, train_loss: 0.8392, test_loss: 0.9288, test_f1: 0.5182
 epoch: 39, train_loss: 0.8409, test_loss: 0.9842, test_f1: 0.4824
 epoch: 40, train_loss: 0.8492, test_loss: 0.9352, test_f1: 0.5209
 epoch: 41, train_loss: 0.8515, test_loss: 0.9408, test_f1: 0.5305
 epoch: 42, train_loss: 0.8359, test_loss: 0.9378, test_f1: 0.5367
 epoch: 43, train_loss: 0.8333, test_loss: 0.9513, test_f1: 0.5180
 epoch: 44, train_loss: 0.8334, test_loss: 0.9442, test_f1: 0.5534
 epoch: 45, train_loss: 0.8324, test_loss: 0.8787, test_f1: 0.5267
 epoch: 46, train_loss: 0.8226, test_loss: 0.8843, test_f1: 0.5435
 epoch: 47, train_loss: 0.8256, test_loss: 0.9359, test_f1: 0.5174
 epoch: 48, train_loss: 0.8183, test_loss: 0.9584, test_f1: 0.4987
 epoch: 49, train_loss: 0.8311, test_loss: 0.9822, test_f1: 0.5140
 epoch: 50, train_loss: 0.8361, test_loss: 0.9551, test_f1: 0.5402
 epoch: 51, train_loss: 0.8230, test_loss: 0.9343, test_f1: 0.5548
 epoch: 52, train_loss: 0.8011, test_loss: 0.9187, test_f1: 0.5309
 epoch: 53, train_loss: 0.8069, test_loss: 0.9233, test_f1: 0.5334
 epoch: 54, train_loss: 0.7978, test_loss: 0.9326, test_f1: 0.5443
 epoch: 55, train_loss: 0.8051, test_loss: 0.9248, test_f1: 0.5368
 epoch: 56, train_loss: 0.8011, test_loss: 0.9287, test_f1: 0.5322
 epoch: 57, train_loss: 0.8013, test_loss: 0.9179, test_f1: 0.5219
 epoch: 58, train_loss: 0.7972, test_loss: 0.9401, test_f1: 0.5519
 epoch: 59, train_loss: 0.7886, test_loss: 0.9206, test_f1: 0.5559
 epoch: 60, train_loss: 0.7896, test_loss: 0.9063, test_f1: 0.5569
 epoch: 61, train_loss: 0.7896, test_loss: 0.9200, test_f1: 0.5479
 epoch: 62, train_loss: 0.7984, test_loss: 0.9359, test_f1: 0.5366
 epoch: 63, train_loss: 0.7931, test_loss: 0.9586, test_f1: 0.5278
 epoch: 64, train_loss: 0.7925, test_loss: 0.9276, test_f1: 0.5398
 epoch: 65, train_loss: 0.7899, test_loss: 0.8968, test_f1: 0.5498
 epoch: 66, train_loss: 0.7766, test_loss: 0.9027, test_f1: 0.5607
 epoch: 67, train_loss: 0.7803, test_loss: 0.9186, test_f1: 0.5629
 epoch: 68, train_loss: 0.7829, test_loss: 0.9578, test_f1: 0.5293
 epoch: 69, train_loss: 0.7871, test_loss: 0.9575, test_f1: 0.5161
 epoch: 70, train_loss: 0.7740, test_loss: 0.9042, test_f1: 0.5445
 epoch: 71, train_loss: 0.7779, test_loss: 0.9008, test_f1: 0.5566
 epoch: 72, train_loss: 0.7667, test_loss: 0.8892, test_f1: 0.5535
 epoch: 73, train_loss: 0.7648, test_loss: 0.9641, test_f1: 0.5290
 epoch: 74, train_loss: 0.7676, test_loss: 0.9117, test_f1: 0.5546
 epoch: 75, train_loss: 0.7793, test_loss: 0.9382, test_f1: 0.5393
 epoch: 76, train_loss: 0.7800, test_loss: 0.9140, test_f1: 0.5557
 epoch: 77, train_loss: 0.7726, test_loss: 0.9187, test_f1: 0.5634
 epoch: 78, train_loss: 0.7774, test_loss: 0.9733, test_f1: 0.5154
 epoch: 79, train_loss: 0.7745, test_loss: 0.9043, test_f1: 0.5627
 epoch: 80, train_loss: 0.7705, test_loss: 0.9007, test_f1: 0.5489
 epoch: 81, train_loss: 0.7694, test_loss: 0.8998, test_f1: 0.5634
 epoch: 82, train_loss: 0.7624, test_loss: 0.9367, test_f1: 0.5535
 epoch: 83, train_loss: 0.7732, test_loss: 0.9564, test_f1: 0.5251
 epoch: 84, train_loss: 0.7673, test_loss: 0.8928, test_f1: 0.5559
 epoch: 85, train_loss: 0.7625, test_loss: 0.9287, test_f1: 0.5577
 epoch: 86, train_loss: 0.7710, test_loss: 0.9303, test_f1: 0.5517
 epoch: 87, train_loss: 0.7635, test_loss: 0.9328, test_f1: 0.5425
 epoch: 88, train_loss: 0.7642, test_loss: 0.9192, test_f1: 0.5520
 epoch: 89, train_loss: 0.7613, test_loss: 0.9110, test_f1: 0.5602
 epoch: 90, train_loss: 0.7573, test_loss: 0.9224, test_f1: 0.5679
 epoch: 91, train_loss: 0.7570, test_loss: 0.9542, test_f1: 0.5378
 epoch: 92, train_loss: 0.7548, test_loss: 0.9221, test_f1: 0.5497
 epoch: 93, train_loss: 0.7598, test_loss: 0.9305, test_f1: 0.5601
 epoch: 94, train_loss: 0.7516, test_loss: 0.8931, test_f1: 0.5592
 epoch: 95, train_loss: 0.7485, test_loss: 0.9301, test_f1: 0.5570
 epoch: 96, train_loss: 0.7575, test_loss: 0.9141, test_f1: 0.5380
 epoch: 97, train_loss: 0.7514, test_loss: 0.9193, test_f1: 0.5510
 epoch: 98, train_loss: 0.7556, test_loss: 0.9468, test_f1: 0.5375
 epoch: 99, train_loss: 0.7481, test_loss: 0.9262, test_f1: 0.5530
##################ITERATION #7 ****************************************
 epoch: 0, train_loss: 1.5132, test_loss: 1.3228, test_f1: 0.2270
 epoch: 1, train_loss: 1.2137, test_loss: 1.3592, test_f1: 0.2270
 epoch: 2, train_loss: 1.1647, test_loss: 1.2873, test_f1: 0.2287
 epoch: 3, train_loss: 1.1440, test_loss: 1.1439, test_f1: 0.3515
 epoch: 4, train_loss: 1.1136, test_loss: 1.0595, test_f1: 0.4325
 epoch: 5, train_loss: 1.0843, test_loss: 1.0420, test_f1: 0.4246
 epoch: 6, train_loss: 1.0690, test_loss: 1.0217, test_f1: 0.4249
 epoch: 7, train_loss: 1.0602, test_loss: 1.0079, test_f1: 0.4350
 epoch: 8, train_loss: 1.0517, test_loss: 1.0017, test_f1: 0.4416
 epoch: 9, train_loss: 1.0451, test_loss: 0.9875, test_f1: 0.4487
 epoch: 10, train_loss: 1.0217, test_loss: 0.9809, test_f1: 0.4552
 epoch: 11, train_loss: 1.0222, test_loss: 0.9679, test_f1: 0.4800
 epoch: 12, train_loss: 1.0136, test_loss: 0.9655, test_f1: 0.4835
 epoch: 13, train_loss: 1.0007, test_loss: 0.9591, test_f1: 0.4936
 epoch: 14, train_loss: 0.9878, test_loss: 0.9449, test_f1: 0.5209
 epoch: 15, train_loss: 0.9861, test_loss: 0.9375, test_f1: 0.5073
 epoch: 16, train_loss: 0.9908, test_loss: 0.9281, test_f1: 0.5183
 epoch: 17, train_loss: 0.9759, test_loss: 0.9291, test_f1: 0.5344
 epoch: 18, train_loss: 0.9722, test_loss: 0.9269, test_f1: 0.5271
 epoch: 19, train_loss: 0.9611, test_loss: 0.9214, test_f1: 0.5240
 epoch: 20, train_loss: 0.9533, test_loss: 0.9024, test_f1: 0.5355
 epoch: 21, train_loss: 0.9539, test_loss: 0.9009, test_f1: 0.5464
 epoch: 22, train_loss: 0.9408, test_loss: 0.9043, test_f1: 0.5235
 epoch: 23, train_loss: 0.9446, test_loss: 0.9008, test_f1: 0.5413
 epoch: 24, train_loss: 0.9455, test_loss: 0.8893, test_f1: 0.5549
 epoch: 25, train_loss: 0.9352, test_loss: 0.9143, test_f1: 0.5105
 epoch: 26, train_loss: 0.9276, test_loss: 0.8998, test_f1: 0.5105
 epoch: 27, train_loss: 0.9240, test_loss: 0.8941, test_f1: 0.5568
 epoch: 28, train_loss: 0.9207, test_loss: 0.8821, test_f1: 0.5507
 epoch: 29, train_loss: 0.9244, test_loss: 0.8858, test_f1: 0.5284
 epoch: 30, train_loss: 0.9121, test_loss: 0.8879, test_f1: 0.5457
 epoch: 31, train_loss: 0.9063, test_loss: 0.8698, test_f1: 0.5397
 epoch: 32, train_loss: 0.9165, test_loss: 0.8696, test_f1: 0.5610
 epoch: 33, train_loss: 0.9088, test_loss: 0.8817, test_f1: 0.5407
 epoch: 34, train_loss: 0.8936, test_loss: 0.8618, test_f1: 0.5569
 epoch: 35, train_loss: 0.8923, test_loss: 0.8594, test_f1: 0.5563
 epoch: 36, train_loss: 0.8921, test_loss: 0.8614, test_f1: 0.5644
 epoch: 37, train_loss: 0.8977, test_loss: 0.8574, test_f1: 0.5606
 epoch: 38, train_loss: 0.8851, test_loss: 0.8739, test_f1: 0.5270
 epoch: 39, train_loss: 0.8881, test_loss: 0.8792, test_f1: 0.5439
 epoch: 40, train_loss: 0.8819, test_loss: 0.8432, test_f1: 0.5504
 epoch: 41, train_loss: 0.8771, test_loss: 0.8592, test_f1: 0.5537
 epoch: 42, train_loss: 0.8708, test_loss: 0.8561, test_f1: 0.5597
 epoch: 43, train_loss: 0.8817, test_loss: 0.9036, test_f1: 0.4941
 epoch: 44, train_loss: 0.8731, test_loss: 0.8563, test_f1: 0.5672
 epoch: 45, train_loss: 0.8689, test_loss: 0.8779, test_f1: 0.5174
 epoch: 46, train_loss: 0.8621, test_loss: 0.8481, test_f1: 0.5707
 epoch: 47, train_loss: 0.8525, test_loss: 0.8621, test_f1: 0.5485
 epoch: 48, train_loss: 0.8615, test_loss: 0.8840, test_f1: 0.5295
 epoch: 49, train_loss: 0.8465, test_loss: 0.8800, test_f1: 0.5244
 epoch: 50, train_loss: 0.8614, test_loss: 0.8363, test_f1: 0.5442
 epoch: 51, train_loss: 0.8443, test_loss: 0.8489, test_f1: 0.5444
 epoch: 52, train_loss: 0.8467, test_loss: 0.8282, test_f1: 0.5664
 epoch: 53, train_loss: 0.8478, test_loss: 0.8319, test_f1: 0.5671
 epoch: 54, train_loss: 0.8356, test_loss: 0.8271, test_f1: 0.5564
 epoch: 55, train_loss: 0.8318, test_loss: 0.8249, test_f1: 0.5667
 epoch: 56, train_loss: 0.8300, test_loss: 0.8226, test_f1: 0.5579
 epoch: 57, train_loss: 0.8255, test_loss: 0.8437, test_f1: 0.5549
 epoch: 58, train_loss: 0.8321, test_loss: 0.8324, test_f1: 0.5645
 epoch: 59, train_loss: 0.8148, test_loss: 0.8291, test_f1: 0.5513
 epoch: 60, train_loss: 0.8307, test_loss: 0.8376, test_f1: 0.5642
 epoch: 61, train_loss: 0.8227, test_loss: 0.8452, test_f1: 0.5538
 epoch: 62, train_loss: 0.8161, test_loss: 0.8225, test_f1: 0.5602
 epoch: 63, train_loss: 0.8167, test_loss: 0.8338, test_f1: 0.5600
 epoch: 64, train_loss: 0.8170, test_loss: 0.8416, test_f1: 0.5516
 epoch: 65, train_loss: 0.8178, test_loss: 0.8337, test_f1: 0.5590
 epoch: 66, train_loss: 0.8176, test_loss: 0.8402, test_f1: 0.5613
 epoch: 67, train_loss: 0.8230, test_loss: 0.8353, test_f1: 0.5654
 epoch: 68, train_loss: 0.8244, test_loss: 0.8273, test_f1: 0.5506
 epoch: 69, train_loss: 0.8093, test_loss: 0.8204, test_f1: 0.5701
 epoch: 70, train_loss: 0.8200, test_loss: 0.8094, test_f1: 0.5671
 epoch: 71, train_loss: 0.8036, test_loss: 0.8136, test_f1: 0.5560
 epoch: 72, train_loss: 0.8068, test_loss: 0.8155, test_f1: 0.5735
 epoch: 73, train_loss: 0.8037, test_loss: 0.8175, test_f1: 0.5657
 epoch: 74, train_loss: 0.8015, test_loss: 0.8132, test_f1: 0.5672
 epoch: 75, train_loss: 0.8153, test_loss: 0.8258, test_f1: 0.5666
 epoch: 76, train_loss: 0.7946, test_loss: 0.7986, test_f1: 0.5746
 epoch: 77, train_loss: 0.8020, test_loss: 0.8286, test_f1: 0.5637
 epoch: 78, train_loss: 0.7995, test_loss: 0.8275, test_f1: 0.5585
 epoch: 79, train_loss: 0.7965, test_loss: 0.8167, test_f1: 0.5684
 epoch: 80, train_loss: 0.7969, test_loss: 0.8126, test_f1: 0.5794
 epoch: 81, train_loss: 0.7921, test_loss: 0.8421, test_f1: 0.5497
 epoch: 82, train_loss: 0.7999, test_loss: 0.8133, test_f1: 0.5708
 epoch: 83, train_loss: 0.7983, test_loss: 0.8219, test_f1: 0.5601
 epoch: 84, train_loss: 0.7958, test_loss: 0.8038, test_f1: 0.5683
 epoch: 85, train_loss: 0.7862, test_loss: 0.8170, test_f1: 0.5651
 epoch: 86, train_loss: 0.7767, test_loss: 0.8076, test_f1: 0.5690
 epoch: 87, train_loss: 0.7783, test_loss: 0.8147, test_f1: 0.5698
 epoch: 88, train_loss: 0.7812, test_loss: 0.8039, test_f1: 0.5758
 epoch: 89, train_loss: 0.7833, test_loss: 0.8155, test_f1: 0.5857
 epoch: 90, train_loss: 0.7800, test_loss: 0.8060, test_f1: 0.5748
 epoch: 91, train_loss: 0.7818, test_loss: 0.8063, test_f1: 0.5723
 epoch: 92, train_loss: 0.7891, test_loss: 0.8056, test_f1: 0.5582
 epoch: 93, train_loss: 0.7884, test_loss: 0.8384, test_f1: 0.5504
 epoch: 94, train_loss: 0.7769, test_loss: 0.8265, test_f1: 0.5652
 epoch: 95, train_loss: 0.7843, test_loss: 0.8274, test_f1: 0.5723
 epoch: 96, train_loss: 0.7865, test_loss: 0.8059, test_f1: 0.5670
 epoch: 97, train_loss: 0.7780, test_loss: 0.8043, test_f1: 0.5820
 epoch: 98, train_loss: 0.7762, test_loss: 0.8287, test_f1: 0.5529
 epoch: 99, train_loss: 0.7917, test_loss: 0.8182, test_f1: 0.5650
##################ITERATION #8 ****************************************
 epoch: 0, train_loss: 1.4171, test_loss: 1.4677, test_f1: 0.2270
 epoch: 1, train_loss: 1.1555, test_loss: 1.3045, test_f1: 0.2270
 epoch: 2, train_loss: 1.1064, test_loss: 1.2879, test_f1: 0.2754
 epoch: 3, train_loss: 1.0726, test_loss: 1.2846, test_f1: 0.3236
 epoch: 4, train_loss: 1.0587, test_loss: 1.2475, test_f1: 0.3436
 epoch: 5, train_loss: 1.0386, test_loss: 1.0742, test_f1: 0.4418
 epoch: 6, train_loss: 1.0349, test_loss: 0.9800, test_f1: 0.4453
 epoch: 7, train_loss: 1.0217, test_loss: 0.9640, test_f1: 0.4844
 epoch: 8, train_loss: 1.0005, test_loss: 0.9889, test_f1: 0.4629
 epoch: 9, train_loss: 1.0034, test_loss: 0.9591, test_f1: 0.4897
 epoch: 10, train_loss: 0.9937, test_loss: 0.9767, test_f1: 0.4654
 epoch: 11, train_loss: 0.9941, test_loss: 0.9495, test_f1: 0.4847
 epoch: 12, train_loss: 0.9870, test_loss: 0.9478, test_f1: 0.4916
 epoch: 13, train_loss: 0.9718, test_loss: 0.9395, test_f1: 0.5101
 epoch: 14, train_loss: 0.9631, test_loss: 0.9302, test_f1: 0.4960
 epoch: 15, train_loss: 0.9670, test_loss: 0.9302, test_f1: 0.5127
 epoch: 16, train_loss: 0.9599, test_loss: 0.9296, test_f1: 0.5045
 epoch: 17, train_loss: 0.9482, test_loss: 0.9309, test_f1: 0.4790
 epoch: 18, train_loss: 0.9413, test_loss: 0.9123, test_f1: 0.5064
 epoch: 19, train_loss: 0.9418, test_loss: 0.9104, test_f1: 0.5007
 epoch: 20, train_loss: 0.9348, test_loss: 0.9478, test_f1: 0.4661
 epoch: 21, train_loss: 0.9368, test_loss: 0.9134, test_f1: 0.4892
 epoch: 22, train_loss: 0.9233, test_loss: 0.9130, test_f1: 0.5048
 epoch: 23, train_loss: 0.9191, test_loss: 0.9188, test_f1: 0.5075
 epoch: 24, train_loss: 0.9158, test_loss: 0.9078, test_f1: 0.4844
 epoch: 25, train_loss: 0.9173, test_loss: 0.8962, test_f1: 0.4984
 epoch: 26, train_loss: 0.9204, test_loss: 0.9269, test_f1: 0.4917
 epoch: 27, train_loss: 0.9099, test_loss: 0.9414, test_f1: 0.5018
 epoch: 28, train_loss: 0.9047, test_loss: 0.8860, test_f1: 0.5152
 epoch: 29, train_loss: 0.9163, test_loss: 0.8908, test_f1: 0.4975
 epoch: 30, train_loss: 0.8913, test_loss: 0.9121, test_f1: 0.5122
 epoch: 31, train_loss: 0.8910, test_loss: 0.8790, test_f1: 0.5168
 epoch: 32, train_loss: 0.9001, test_loss: 0.8780, test_f1: 0.5033
 epoch: 33, train_loss: 0.8943, test_loss: 0.8941, test_f1: 0.4991
 epoch: 34, train_loss: 0.9011, test_loss: 1.0737, test_f1: 0.4551
 epoch: 35, train_loss: 0.8852, test_loss: 0.8964, test_f1: 0.5079
 epoch: 36, train_loss: 0.8827, test_loss: 0.8961, test_f1: 0.5062
 epoch: 37, train_loss: 0.8689, test_loss: 0.8636, test_f1: 0.5177
 epoch: 38, train_loss: 0.8769, test_loss: 0.9331, test_f1: 0.5089
 epoch: 39, train_loss: 0.8778, test_loss: 0.8697, test_f1: 0.5049
 epoch: 40, train_loss: 0.8595, test_loss: 0.8551, test_f1: 0.5417
 epoch: 41, train_loss: 0.8742, test_loss: 0.9445, test_f1: 0.5040
 epoch: 42, train_loss: 0.8585, test_loss: 0.9379, test_f1: 0.5100
 epoch: 43, train_loss: 0.8600, test_loss: 0.8978, test_f1: 0.5163
 epoch: 44, train_loss: 0.8606, test_loss: 0.8550, test_f1: 0.5493
 epoch: 45, train_loss: 0.8569, test_loss: 0.9771, test_f1: 0.5105
 epoch: 46, train_loss: 0.8603, test_loss: 0.9629, test_f1: 0.5134
 epoch: 47, train_loss: 0.8445, test_loss: 0.8572, test_f1: 0.5302
 epoch: 48, train_loss: 0.8477, test_loss: 0.9971, test_f1: 0.4782
 epoch: 49, train_loss: 0.8530, test_loss: 0.9195, test_f1: 0.5086
 epoch: 50, train_loss: 0.8479, test_loss: 0.8769, test_f1: 0.5284
 epoch: 51, train_loss: 0.8373, test_loss: 0.8647, test_f1: 0.5261
 epoch: 52, train_loss: 0.8313, test_loss: 0.8581, test_f1: 0.5380
 epoch: 53, train_loss: 0.8424, test_loss: 0.8853, test_f1: 0.5042
 epoch: 54, train_loss: 0.8224, test_loss: 0.8974, test_f1: 0.5073
 epoch: 55, train_loss: 0.8356, test_loss: 0.9255, test_f1: 0.5140
 epoch: 56, train_loss: 0.8192, test_loss: 0.9566, test_f1: 0.4846
 epoch: 57, train_loss: 0.8248, test_loss: 0.8341, test_f1: 0.5483
 epoch: 58, train_loss: 0.8169, test_loss: 0.8442, test_f1: 0.5289
 epoch: 59, train_loss: 0.8254, test_loss: 0.9011, test_f1: 0.5268
 epoch: 60, train_loss: 0.8160, test_loss: 0.8997, test_f1: 0.5240
 epoch: 61, train_loss: 0.8172, test_loss: 0.9156, test_f1: 0.5136
 epoch: 62, train_loss: 0.8143, test_loss: 0.9323, test_f1: 0.5147
 epoch: 63, train_loss: 0.8302, test_loss: 0.9135, test_f1: 0.5390
 epoch: 64, train_loss: 0.8205, test_loss: 0.8807, test_f1: 0.5198
 epoch: 65, train_loss: 0.8123, test_loss: 0.8907, test_f1: 0.5310
 epoch: 66, train_loss: 0.8130, test_loss: 0.8454, test_f1: 0.5373
 epoch: 67, train_loss: 0.8045, test_loss: 0.8412, test_f1: 0.5242
 epoch: 68, train_loss: 0.8048, test_loss: 0.9092, test_f1: 0.5246
 epoch: 69, train_loss: 0.8027, test_loss: 0.8626, test_f1: 0.5345
 epoch: 70, train_loss: 0.8026, test_loss: 0.9179, test_f1: 0.5180
 epoch: 71, train_loss: 0.8199, test_loss: 0.8763, test_f1: 0.5158
 epoch: 72, train_loss: 0.8114, test_loss: 0.8834, test_f1: 0.5178
 epoch: 73, train_loss: 0.8128, test_loss: 0.8749, test_f1: 0.5126
 epoch: 74, train_loss: 0.8009, test_loss: 0.8933, test_f1: 0.5226
 epoch: 75, train_loss: 0.7976, test_loss: 0.8962, test_f1: 0.5148
 epoch: 76, train_loss: 0.8048, test_loss: 0.9360, test_f1: 0.5106
 epoch: 77, train_loss: 0.8098, test_loss: 0.9037, test_f1: 0.5316
 epoch: 78, train_loss: 0.7945, test_loss: 0.9682, test_f1: 0.5146
 epoch: 79, train_loss: 0.7885, test_loss: 0.8861, test_f1: 0.5277
 epoch: 80, train_loss: 0.7945, test_loss: 0.8952, test_f1: 0.5223
 epoch: 81, train_loss: 0.7933, test_loss: 0.8616, test_f1: 0.5281
 epoch: 82, train_loss: 0.7862, test_loss: 0.8797, test_f1: 0.5228
 epoch: 83, train_loss: 0.7888, test_loss: 0.9296, test_f1: 0.5074
 epoch: 84, train_loss: 0.7914, test_loss: 0.9544, test_f1: 0.5150
 epoch: 85, train_loss: 0.7755, test_loss: 0.9236, test_f1: 0.5243
 epoch: 86, train_loss: 0.7882, test_loss: 0.9083, test_f1: 0.5192
 epoch: 87, train_loss: 0.7830, test_loss: 0.8816, test_f1: 0.5231
 epoch: 88, train_loss: 0.7940, test_loss: 0.8438, test_f1: 0.5392
 epoch: 89, train_loss: 0.7753, test_loss: 0.8845, test_f1: 0.5240
 epoch: 90, train_loss: 0.7821, test_loss: 0.8979, test_f1: 0.5293
 epoch: 91, train_loss: 0.7870, test_loss: 0.8789, test_f1: 0.5352
 epoch: 92, train_loss: 0.7930, test_loss: 0.8462, test_f1: 0.5426
 epoch: 93, train_loss: 0.7751, test_loss: 0.9110, test_f1: 0.5353
 epoch: 94, train_loss: 0.7803, test_loss: 0.8532, test_f1: 0.5341
 epoch: 95, train_loss: 0.7718, test_loss: 0.8423, test_f1: 0.5382
 epoch: 96, train_loss: 0.7768, test_loss: 0.9348, test_f1: 0.5212
 epoch: 97, train_loss: 0.7766, test_loss: 0.8861, test_f1: 0.5342
 epoch: 98, train_loss: 0.7747, test_loss: 0.8787, test_f1: 0.5248
 epoch: 99, train_loss: 0.7702, test_loss: 0.8553, test_f1: 0.5441
##################ITERATION #9 ****************************************
 epoch: 0, train_loss: 1.3620, test_loss: 1.3745, test_f1: 0.2270
 epoch: 1, train_loss: 1.1460, test_loss: 1.3766, test_f1: 0.2270
 epoch: 2, train_loss: 1.1124, test_loss: 1.1914, test_f1: 0.2591
 epoch: 3, train_loss: 1.0771, test_loss: 1.1138, test_f1: 0.3413
 epoch: 4, train_loss: 1.0538, test_loss: 1.0644, test_f1: 0.3598
 epoch: 5, train_loss: 1.0319, test_loss: 1.0368, test_f1: 0.4139
 epoch: 6, train_loss: 1.0245, test_loss: 1.0100, test_f1: 0.4437
 epoch: 7, train_loss: 1.0108, test_loss: 1.0224, test_f1: 0.4427
 epoch: 8, train_loss: 1.0044, test_loss: 1.0176, test_f1: 0.4564
 epoch: 9, train_loss: 0.9884, test_loss: 1.0019, test_f1: 0.4593
 epoch: 10, train_loss: 0.9810, test_loss: 1.0185, test_f1: 0.4709
 epoch: 11, train_loss: 0.9687, test_loss: 0.9918, test_f1: 0.4850
 epoch: 12, train_loss: 0.9778, test_loss: 0.9961, test_f1: 0.4681
 epoch: 13, train_loss: 0.9587, test_loss: 1.0144, test_f1: 0.4743
 epoch: 14, train_loss: 0.9539, test_loss: 0.9882, test_f1: 0.5054
 epoch: 15, train_loss: 0.9480, test_loss: 0.9904, test_f1: 0.4757
 epoch: 16, train_loss: 0.9538, test_loss: 1.0131, test_f1: 0.4928
 epoch: 17, train_loss: 0.9447, test_loss: 0.9561, test_f1: 0.4799
 epoch: 18, train_loss: 0.9430, test_loss: 0.9610, test_f1: 0.5011
 epoch: 19, train_loss: 0.9368, test_loss: 0.9773, test_f1: 0.5071
 epoch: 20, train_loss: 0.9355, test_loss: 0.9499, test_f1: 0.5258
 epoch: 21, train_loss: 0.9155, test_loss: 0.9586, test_f1: 0.5076
 epoch: 22, train_loss: 0.9272, test_loss: 0.9861, test_f1: 0.4931
 epoch: 23, train_loss: 0.9164, test_loss: 0.9378, test_f1: 0.4935
 epoch: 24, train_loss: 0.9102, test_loss: 0.9928, test_f1: 0.4891
 epoch: 25, train_loss: 0.9098, test_loss: 0.9385, test_f1: 0.5262
 epoch: 26, train_loss: 0.9171, test_loss: 0.9332, test_f1: 0.5037
 epoch: 27, train_loss: 0.8961, test_loss: 0.9907, test_f1: 0.4872
 epoch: 28, train_loss: 0.9025, test_loss: 0.9418, test_f1: 0.5162
 epoch: 29, train_loss: 0.8985, test_loss: 0.9868, test_f1: 0.5160
 epoch: 30, train_loss: 0.8952, test_loss: 0.9760, test_f1: 0.5036
 epoch: 31, train_loss: 0.8922, test_loss: 0.9355, test_f1: 0.5198
 epoch: 32, train_loss: 0.8845, test_loss: 0.9327, test_f1: 0.5288
 epoch: 33, train_loss: 0.8869, test_loss: 0.9634, test_f1: 0.5251
 epoch: 34, train_loss: 0.8848, test_loss: 0.9584, test_f1: 0.5280
 epoch: 35, train_loss: 0.8853, test_loss: 0.9551, test_f1: 0.5268
 epoch: 36, train_loss: 0.8766, test_loss: 0.9855, test_f1: 0.5097
 epoch: 37, train_loss: 0.8738, test_loss: 0.9432, test_f1: 0.5127
 epoch: 38, train_loss: 0.8691, test_loss: 0.9586, test_f1: 0.5327
 epoch: 39, train_loss: 0.8776, test_loss: 0.9344, test_f1: 0.5421
 epoch: 40, train_loss: 0.8652, test_loss: 0.9417, test_f1: 0.5297
 epoch: 41, train_loss: 0.8563, test_loss: 0.9472, test_f1: 0.5228
 epoch: 42, train_loss: 0.8639, test_loss: 0.9209, test_f1: 0.5133
 epoch: 43, train_loss: 0.8678, test_loss: 0.9102, test_f1: 0.5219
 epoch: 44, train_loss: 0.8615, test_loss: 0.9908, test_f1: 0.5243
 epoch: 45, train_loss: 0.8582, test_loss: 0.8984, test_f1: 0.5473
 epoch: 46, train_loss: 0.8455, test_loss: 0.9401, test_f1: 0.5184
 epoch: 47, train_loss: 0.8505, test_loss: 0.8765, test_f1: 0.5390
 epoch: 48, train_loss: 0.8481, test_loss: 0.9186, test_f1: 0.5165
 epoch: 49, train_loss: 0.8501, test_loss: 0.9284, test_f1: 0.5210
 epoch: 50, train_loss: 0.8481, test_loss: 0.8969, test_f1: 0.5343
 epoch: 51, train_loss: 0.8418, test_loss: 0.9356, test_f1: 0.5292
 epoch: 52, train_loss: 0.8266, test_loss: 0.9026, test_f1: 0.5166
 epoch: 53, train_loss: 0.8326, test_loss: 0.9408, test_f1: 0.5134
 epoch: 54, train_loss: 0.8227, test_loss: 0.9372, test_f1: 0.5164
 epoch: 55, train_loss: 0.8303, test_loss: 0.9235, test_f1: 0.5178
 epoch: 56, train_loss: 0.8257, test_loss: 0.9380, test_f1: 0.5353
 epoch: 57, train_loss: 0.8249, test_loss: 0.9004, test_f1: 0.5211
 epoch: 58, train_loss: 0.8338, test_loss: 0.9138, test_f1: 0.5356
 epoch: 59, train_loss: 0.8280, test_loss: 0.8943, test_f1: 0.5206
 epoch: 60, train_loss: 0.8265, test_loss: 0.9022, test_f1: 0.5285
 epoch: 61, train_loss: 0.8259, test_loss: 0.9301, test_f1: 0.5358
 epoch: 62, train_loss: 0.8277, test_loss: 0.9301, test_f1: 0.5250
 epoch: 63, train_loss: 0.8242, test_loss: 0.9415, test_f1: 0.5312
 epoch: 64, train_loss: 0.8275, test_loss: 0.9323, test_f1: 0.5208
 epoch: 65, train_loss: 0.8140, test_loss: 0.9338, test_f1: 0.5322
 epoch: 66, train_loss: 0.8080, test_loss: 0.9258, test_f1: 0.5278
 epoch: 67, train_loss: 0.8236, test_loss: 0.9185, test_f1: 0.5284
 epoch: 68, train_loss: 0.8198, test_loss: 0.9338, test_f1: 0.5224
 epoch: 69, train_loss: 0.8006, test_loss: 0.9394, test_f1: 0.5232
 epoch: 70, train_loss: 0.8081, test_loss: 0.9162, test_f1: 0.5375
 epoch: 71, train_loss: 0.8091, test_loss: 0.9336, test_f1: 0.5294
 epoch: 72, train_loss: 0.8041, test_loss: 0.9454, test_f1: 0.5227
 epoch: 73, train_loss: 0.8161, test_loss: 0.9311, test_f1: 0.5373
 epoch: 74, train_loss: 0.8124, test_loss: 0.9139, test_f1: 0.5403
 epoch: 75, train_loss: 0.8039, test_loss: 0.9169, test_f1: 0.5341
 epoch: 76, train_loss: 0.8028, test_loss: 0.9425, test_f1: 0.5263
 epoch: 77, train_loss: 0.8152, test_loss: 0.9363, test_f1: 0.5252
 epoch: 78, train_loss: 0.8097, test_loss: 0.9190, test_f1: 0.5267
 epoch: 79, train_loss: 0.8011, test_loss: 0.9242, test_f1: 0.5347
 epoch: 80, train_loss: 0.8073, test_loss: 0.9190, test_f1: 0.5314
 epoch: 81, train_loss: 0.8079, test_loss: 0.9261, test_f1: 0.5356
 epoch: 82, train_loss: 0.8033, test_loss: 0.9176, test_f1: 0.5380
 epoch: 83, train_loss: 0.7944, test_loss: 0.9024, test_f1: 0.5344
 epoch: 84, train_loss: 0.7964, test_loss: 0.9091, test_f1: 0.5358
 epoch: 85, train_loss: 0.8001, test_loss: 0.9268, test_f1: 0.5249
 epoch: 86, train_loss: 0.8009, test_loss: 0.9166, test_f1: 0.5418
 epoch: 87, train_loss: 0.7990, test_loss: 0.9191, test_f1: 0.5315
 epoch: 88, train_loss: 0.7951, test_loss: 0.9283, test_f1: 0.5388
 epoch: 89, train_loss: 0.8051, test_loss: 0.9063, test_f1: 0.5399
 epoch: 90, train_loss: 0.8038, test_loss: 0.8960, test_f1: 0.5426
 epoch: 91, train_loss: 0.7961, test_loss: 0.9079, test_f1: 0.5443
 epoch: 92, train_loss: 0.7849, test_loss: 0.9201, test_f1: 0.5358
 epoch: 93, train_loss: 0.7889, test_loss: 0.9245, test_f1: 0.5273
 epoch: 94, train_loss: 0.7858, test_loss: 0.9095, test_f1: 0.5319
 epoch: 95, train_loss: 0.7854, test_loss: 0.9213, test_f1: 0.5277
 epoch: 96, train_loss: 0.7958, test_loss: 0.9123, test_f1: 0.5293
 epoch: 97, train_loss: 0.7872, test_loss: 0.9413, test_f1: 0.5310
 epoch: 98, train_loss: 0.7767, test_loss: 0.9281, test_f1: 0.5316
 epoch: 99, train_loss: 0.7924, test_loss: 0.9051, test_f1: 0.5295

Training completed in 415.81 seconds
Best F1: 0.5857 at epoch 89
Mean F1 across iterations: 0.5625  0.0123
========================FINAL RESULTS================================
FEGIN weighted F1: 0.5857  0.0123
python main.py --data ltspice_examples --representation component_pin_net --model FEGIN --layers 4 --hiddens 16 --batch_size 256 --lr 0.001 --emb_size 128 --epochs 100 --save_appendix component_pin_net_L4_H16_BS256_LR0.001_E128 --no_val
-----



STDERR:
  File "main.py", line 370, in <module>
    main()
  File "main.py", line 254, in main
    dataset = dataset_class(
  File "/home/philip/projects/ltspice_examples_code_repo/Circuit-Completion-Using-GNNs/component_classification_with_link_prediction_head/evaluation/FEGIN/kernel/circuit_datasets.py", line 15, in __init__
    self.data, self.slices = torch.load(self.processed_paths[0])
  File "/home/philip/.local/lib/python3.8/site-packages/torch/serialization.py", line 1040, in load
    warnings.warn(
  File "/usr/lib/python3.8/warnings.py", line 109, in _showwarnmsg
    sw(msg.message, msg.category, msg.filename, msg.lineno,
  File "main.py", line 47, in warn_with_traceback
    traceback.print_stack(file=log)
/home/philip/projects/ltspice_examples_code_repo/Circuit-Completion-Using-GNNs/component_classification_with_link_prediction_head/evaluation/FEGIN/kernel/circuit_datasets.py:15: FutureWarning: You are using `torch.load` with `weights_only=False` (the current default value), which uses the default pickle module implicitly. It is possible to construct malicious pickle data which will execute arbitrary code during unpickling (See https://github.com/pytorch/pytorch/blob/main/SECURITY.md#untrusted-models for more details). In a future release, the default value for `weights_only` will be flipped to `True`. This limits the functions that could be executed during unpickling. Arbitrary objects will no longer be allowed to be loaded via this mode unless they are explicitly allowlisted by the user via `torch.serialization.add_safe_globals`. We recommend you start setting `weights_only=True` for any use case where you don't have full control of the loaded file. Please open an issue on GitHub for any issues related to this experimental feature.
  self.data, self.slices = torch.load(self.processed_paths[0])
