STDOUT:
Results will be saved in /home/philip/projects/ltspice_examples_code_repo/Circuit-Completion-Using-GNNs/component_classification_with_link_prediction_head/evaluation/FEGIN/results/model_FEGIN_dataset_ltspice_examples
Command line input: python main.py --data ltspice_examples --representation component_component --model FEGIN --layers 4 --hiddens 32 --batch_size 32 --lr 0.0001 --emb_size 250 --epochs 100 --save_appendix component_component_L4_H32_BS32_LR0.0001_E250 --no_val
 is saved.
-----
ltspice_examples - FEGIN
Using 4 layers, 32 hidden units, h = 2
Loading component_component representation dataset
ENTERED
Training FEGIN on component_component representation
Train: 3556, Test: 845
##################ITERATION #0 ****************************************
 epoch: 0, train_loss: 1.3803, test_loss: 1.3721, test_f1: 0.1604
 epoch: 1, train_loss: 1.3623, test_loss: 1.3586, test_f1: 0.1965
 epoch: 2, train_loss: 1.3462, test_loss: 1.3403, test_f1: 0.2603
 epoch: 3, train_loss: 1.3291, test_loss: 1.3187, test_f1: 0.2305
 epoch: 4, train_loss: 1.3112, test_loss: 1.3012, test_f1: 0.2274
 epoch: 5, train_loss: 1.2961, test_loss: 1.2894, test_f1: 0.2274
 epoch: 6, train_loss: 1.2825, test_loss: 1.2746, test_f1: 0.2274
 epoch: 7, train_loss: 1.2699, test_loss: 1.2624, test_f1: 0.2274
 epoch: 8, train_loss: 1.2599, test_loss: 1.2489, test_f1: 0.2274
 epoch: 9, train_loss: 1.2539, test_loss: 1.2419, test_f1: 0.2336
 epoch: 10, train_loss: 1.2415, test_loss: 1.2302, test_f1: 0.2515
 epoch: 11, train_loss: 1.2394, test_loss: 1.2258, test_f1: 0.2819
 epoch: 12, train_loss: 1.2322, test_loss: 1.2166, test_f1: 0.2916
 epoch: 13, train_loss: 1.2268, test_loss: 1.2044, test_f1: 0.2959
 epoch: 14, train_loss: 1.2223, test_loss: 1.2019, test_f1: 0.3156
 epoch: 15, train_loss: 1.2172, test_loss: 1.1945, test_f1: 0.3033
 epoch: 16, train_loss: 1.2116, test_loss: 1.1886, test_f1: 0.3167
 epoch: 17, train_loss: 1.2049, test_loss: 1.1836, test_f1: 0.3371
 epoch: 18, train_loss: 1.1960, test_loss: 1.1765, test_f1: 0.3693
 epoch: 19, train_loss: 1.1931, test_loss: 1.1707, test_f1: 0.3366
 epoch: 20, train_loss: 1.1890, test_loss: 1.1677, test_f1: 0.3625
 epoch: 21, train_loss: 1.1844, test_loss: 1.1567, test_f1: 0.3717
 epoch: 22, train_loss: 1.1766, test_loss: 1.1524, test_f1: 0.3702
 epoch: 23, train_loss: 1.1725, test_loss: 1.1469, test_f1: 0.3545
 epoch: 24, train_loss: 1.1706, test_loss: 1.1403, test_f1: 0.3790
 epoch: 25, train_loss: 1.1593, test_loss: 1.1361, test_f1: 0.3763
 epoch: 26, train_loss: 1.1553, test_loss: 1.1321, test_f1: 0.3708
 epoch: 27, train_loss: 1.1535, test_loss: 1.1261, test_f1: 0.3755
 epoch: 28, train_loss: 1.1473, test_loss: 1.1166, test_f1: 0.3794
 epoch: 29, train_loss: 1.1461, test_loss: 1.1190, test_f1: 0.3918
 epoch: 30, train_loss: 1.1487, test_loss: 1.1068, test_f1: 0.3875
 epoch: 31, train_loss: 1.1387, test_loss: 1.1103, test_f1: 0.4098
 epoch: 32, train_loss: 1.1349, test_loss: 1.1064, test_f1: 0.4233
 epoch: 33, train_loss: 1.1222, test_loss: 1.0997, test_f1: 0.4327
 epoch: 34, train_loss: 1.1317, test_loss: 1.1025, test_f1: 0.4465
 epoch: 35, train_loss: 1.1218, test_loss: 1.0983, test_f1: 0.4287
 epoch: 36, train_loss: 1.1176, test_loss: 1.0963, test_f1: 0.4540
 epoch: 37, train_loss: 1.1153, test_loss: 1.0932, test_f1: 0.4566
 epoch: 38, train_loss: 1.1105, test_loss: 1.0829, test_f1: 0.4637
 epoch: 39, train_loss: 1.1144, test_loss: 1.0848, test_f1: 0.4489
 epoch: 40, train_loss: 1.1070, test_loss: 1.0770, test_f1: 0.4619
 epoch: 41, train_loss: 1.1034, test_loss: 1.0768, test_f1: 0.4402
 epoch: 42, train_loss: 1.1057, test_loss: 1.0800, test_f1: 0.4533
 epoch: 43, train_loss: 1.1044, test_loss: 1.0816, test_f1: 0.4440
 epoch: 44, train_loss: 1.0902, test_loss: 1.0780, test_f1: 0.4594
 epoch: 45, train_loss: 1.0952, test_loss: 1.0738, test_f1: 0.4561
 epoch: 46, train_loss: 1.0937, test_loss: 1.0785, test_f1: 0.4676
 epoch: 47, train_loss: 1.0891, test_loss: 1.0785, test_f1: 0.4584
 epoch: 48, train_loss: 1.0847, test_loss: 1.0653, test_f1: 0.4543
 epoch: 49, train_loss: 1.0814, test_loss: 1.0568, test_f1: 0.4691
 epoch: 50, train_loss: 1.0755, test_loss: 1.0658, test_f1: 0.4582
 epoch: 51, train_loss: 1.0776, test_loss: 1.0678, test_f1: 0.4574
 epoch: 52, train_loss: 1.0801, test_loss: 1.0661, test_f1: 0.4597
 epoch: 53, train_loss: 1.0721, test_loss: 1.0552, test_f1: 0.4532
 epoch: 54, train_loss: 1.0679, test_loss: 1.0690, test_f1: 0.4494
 epoch: 55, train_loss: 1.0585, test_loss: 1.0623, test_f1: 0.4572
 epoch: 56, train_loss: 1.0652, test_loss: 1.0587, test_f1: 0.4577
 epoch: 57, train_loss: 1.0656, test_loss: 1.0611, test_f1: 0.4637
 epoch: 58, train_loss: 1.0595, test_loss: 1.0676, test_f1: 0.4574
 epoch: 59, train_loss: 1.0531, test_loss: 1.0691, test_f1: 0.4476
 epoch: 60, train_loss: 1.0625, test_loss: 1.0789, test_f1: 0.4623
 epoch: 61, train_loss: 1.0700, test_loss: 1.0701, test_f1: 0.4406
 epoch: 62, train_loss: 1.0503, test_loss: 1.0598, test_f1: 0.4398
 epoch: 63, train_loss: 1.0468, test_loss: 1.0611, test_f1: 0.4413
 epoch: 64, train_loss: 1.0639, test_loss: 1.0560, test_f1: 0.4567
 epoch: 65, train_loss: 1.0504, test_loss: 1.0660, test_f1: 0.4566
 epoch: 66, train_loss: 1.0516, test_loss: 1.0513, test_f1: 0.4557
 epoch: 67, train_loss: 1.0436, test_loss: 1.0517, test_f1: 0.4496
 epoch: 68, train_loss: 1.0490, test_loss: 1.0519, test_f1: 0.4485
 epoch: 69, train_loss: 1.0503, test_loss: 1.0448, test_f1: 0.4625
 epoch: 70, train_loss: 1.0594, test_loss: 1.0477, test_f1: 0.4552
 epoch: 71, train_loss: 1.0506, test_loss: 1.0463, test_f1: 0.4678
 epoch: 72, train_loss: 1.0464, test_loss: 1.0688, test_f1: 0.4583
 epoch: 73, train_loss: 1.0522, test_loss: 1.0543, test_f1: 0.4618
 epoch: 74, train_loss: 1.0528, test_loss: 1.0518, test_f1: 0.4531
 epoch: 75, train_loss: 1.0484, test_loss: 1.0629, test_f1: 0.4550
 epoch: 76, train_loss: 1.0535, test_loss: 1.0549, test_f1: 0.4550
 epoch: 77, train_loss: 1.0399, test_loss: 1.0417, test_f1: 0.4666
 epoch: 78, train_loss: 1.0406, test_loss: 1.0578, test_f1: 0.4436
 epoch: 79, train_loss: 1.0434, test_loss: 1.0615, test_f1: 0.4459
 epoch: 80, train_loss: 1.0388, test_loss: 1.0578, test_f1: 0.4517
 epoch: 81, train_loss: 1.0307, test_loss: 1.0557, test_f1: 0.4503
 epoch: 82, train_loss: 1.0401, test_loss: 1.0485, test_f1: 0.4509
 epoch: 83, train_loss: 1.0427, test_loss: 1.0496, test_f1: 0.4473
 epoch: 84, train_loss: 1.0380, test_loss: 1.0429, test_f1: 0.4609
 epoch: 85, train_loss: 1.0420, test_loss: 1.0485, test_f1: 0.4458
 epoch: 86, train_loss: 1.0370, test_loss: 1.0515, test_f1: 0.4585
 epoch: 87, train_loss: 1.0365, test_loss: 1.0613, test_f1: 0.4408
 epoch: 88, train_loss: 1.0389, test_loss: 1.0258, test_f1: 0.4585
 epoch: 89, train_loss: 1.0291, test_loss: 1.0423, test_f1: 0.4426
 epoch: 90, train_loss: 1.0328, test_loss: 1.0433, test_f1: 0.4660
 epoch: 91, train_loss: 1.0281, test_loss: 1.0335, test_f1: 0.4633
 epoch: 92, train_loss: 1.0338, test_loss: 1.0596, test_f1: 0.4466
 epoch: 93, train_loss: 1.0232, test_loss: 1.0301, test_f1: 0.4711
 epoch: 94, train_loss: 1.0372, test_loss: 1.0629, test_f1: 0.4575
 epoch: 95, train_loss: 1.0202, test_loss: 1.0716, test_f1: 0.4611
 epoch: 96, train_loss: 1.0310, test_loss: 1.0484, test_f1: 0.4525
 epoch: 97, train_loss: 1.0253, test_loss: 1.0711, test_f1: 0.4421
 epoch: 98, train_loss: 1.0212, test_loss: 1.0490, test_f1: 0.4386
 epoch: 99, train_loss: 1.0173, test_loss: 1.0396, test_f1: 0.4546
##################ITERATION #1 ****************************************
 epoch: 0, train_loss: 1.3650, test_loss: 1.3428, test_f1: 0.2808
 epoch: 1, train_loss: 1.3155, test_loss: 1.3032, test_f1: 0.2578
 epoch: 2, train_loss: 1.2925, test_loss: 1.2805, test_f1: 0.2617
 epoch: 3, train_loss: 1.2749, test_loss: 1.2598, test_f1: 0.2995
 epoch: 4, train_loss: 1.2647, test_loss: 1.2384, test_f1: 0.3178
 epoch: 5, train_loss: 1.2516, test_loss: 1.2288, test_f1: 0.3212
 epoch: 6, train_loss: 1.2440, test_loss: 1.2200, test_f1: 0.3228
 epoch: 7, train_loss: 1.2347, test_loss: 1.2091, test_f1: 0.3325
 epoch: 8, train_loss: 1.2275, test_loss: 1.2040, test_f1: 0.3340
 epoch: 9, train_loss: 1.2224, test_loss: 1.1945, test_f1: 0.3838
 epoch: 10, train_loss: 1.2181, test_loss: 1.1865, test_f1: 0.3965
 epoch: 11, train_loss: 1.2111, test_loss: 1.1840, test_f1: 0.4019
 epoch: 12, train_loss: 1.2029, test_loss: 1.1792, test_f1: 0.4102
 epoch: 13, train_loss: 1.2018, test_loss: 1.1713, test_f1: 0.4091
 epoch: 14, train_loss: 1.1932, test_loss: 1.1658, test_f1: 0.4118
 epoch: 15, train_loss: 1.1969, test_loss: 1.1550, test_f1: 0.4155
 epoch: 16, train_loss: 1.1880, test_loss: 1.1526, test_f1: 0.4182
 epoch: 17, train_loss: 1.1809, test_loss: 1.1444, test_f1: 0.4315
 epoch: 18, train_loss: 1.1846, test_loss: 1.1431, test_f1: 0.4299
 epoch: 19, train_loss: 1.1748, test_loss: 1.1319, test_f1: 0.4360
 epoch: 20, train_loss: 1.1742, test_loss: 1.1286, test_f1: 0.4223
 epoch: 21, train_loss: 1.1723, test_loss: 1.1307, test_f1: 0.4374
 epoch: 22, train_loss: 1.1662, test_loss: 1.1163, test_f1: 0.4379
 epoch: 23, train_loss: 1.1568, test_loss: 1.1212, test_f1: 0.4375
 epoch: 24, train_loss: 1.1551, test_loss: 1.1081, test_f1: 0.4383
 epoch: 25, train_loss: 1.1492, test_loss: 1.1041, test_f1: 0.4425
 epoch: 26, train_loss: 1.1514, test_loss: 1.0927, test_f1: 0.4741
 epoch: 27, train_loss: 1.1486, test_loss: 1.0903, test_f1: 0.4656
 epoch: 28, train_loss: 1.1397, test_loss: 1.0880, test_f1: 0.4512
 epoch: 29, train_loss: 1.1380, test_loss: 1.0844, test_f1: 0.4576
 epoch: 30, train_loss: 1.1336, test_loss: 1.0834, test_f1: 0.4550
 epoch: 31, train_loss: 1.1261, test_loss: 1.0737, test_f1: 0.4489
 epoch: 32, train_loss: 1.1285, test_loss: 1.0726, test_f1: 0.4648
 epoch: 33, train_loss: 1.1314, test_loss: 1.0699, test_f1: 0.4564
 epoch: 34, train_loss: 1.1177, test_loss: 1.0656, test_f1: 0.4419
 epoch: 35, train_loss: 1.1151, test_loss: 1.0692, test_f1: 0.4429
 epoch: 36, train_loss: 1.1178, test_loss: 1.0639, test_f1: 0.4417
 epoch: 37, train_loss: 1.1128, test_loss: 1.0604, test_f1: 0.4408
 epoch: 38, train_loss: 1.1077, test_loss: 1.0516, test_f1: 0.4692
 epoch: 39, train_loss: 1.1085, test_loss: 1.0544, test_f1: 0.4670
 epoch: 40, train_loss: 1.0989, test_loss: 1.0519, test_f1: 0.4797
 epoch: 41, train_loss: 1.1019, test_loss: 1.0483, test_f1: 0.4666
 epoch: 42, train_loss: 1.0937, test_loss: 1.0383, test_f1: 0.4821
 epoch: 43, train_loss: 1.0885, test_loss: 1.0507, test_f1: 0.4709
 epoch: 44, train_loss: 1.0890, test_loss: 1.0253, test_f1: 0.4855
 epoch: 45, train_loss: 1.0955, test_loss: 1.0365, test_f1: 0.4770
 epoch: 46, train_loss: 1.0874, test_loss: 1.0351, test_f1: 0.4519
 epoch: 47, train_loss: 1.0791, test_loss: 1.0351, test_f1: 0.4486
 epoch: 48, train_loss: 1.0690, test_loss: 1.0218, test_f1: 0.4604
 epoch: 49, train_loss: 1.0724, test_loss: 1.0274, test_f1: 0.4646
 epoch: 50, train_loss: 1.0658, test_loss: 1.0413, test_f1: 0.4746
 epoch: 51, train_loss: 1.0667, test_loss: 1.0297, test_f1: 0.4485
 epoch: 52, train_loss: 1.0716, test_loss: 1.0202, test_f1: 0.4593
 epoch: 53, train_loss: 1.0712, test_loss: 1.0219, test_f1: 0.4606
 epoch: 54, train_loss: 1.0713, test_loss: 1.0115, test_f1: 0.4664
 epoch: 55, train_loss: 1.0643, test_loss: 1.0180, test_f1: 0.4568
 epoch: 56, train_loss: 1.0652, test_loss: 1.0201, test_f1: 0.4575
 epoch: 57, train_loss: 1.0569, test_loss: 1.0178, test_f1: 0.4721
 epoch: 58, train_loss: 1.0632, test_loss: 1.0153, test_f1: 0.4843
 epoch: 59, train_loss: 1.0604, test_loss: 1.0206, test_f1: 0.4713
 epoch: 60, train_loss: 1.0636, test_loss: 1.0126, test_f1: 0.4699
 epoch: 61, train_loss: 1.0603, test_loss: 1.0359, test_f1: 0.4806
 epoch: 62, train_loss: 1.0467, test_loss: 1.0123, test_f1: 0.4640
 epoch: 63, train_loss: 1.0604, test_loss: 1.0205, test_f1: 0.4730
 epoch: 64, train_loss: 1.0372, test_loss: 1.0182, test_f1: 0.4695
 epoch: 65, train_loss: 1.0489, test_loss: 1.0098, test_f1: 0.4733
 epoch: 66, train_loss: 1.0478, test_loss: 1.0256, test_f1: 0.4707
 epoch: 67, train_loss: 1.0479, test_loss: 1.0130, test_f1: 0.4820
 epoch: 68, train_loss: 1.0504, test_loss: 1.0097, test_f1: 0.4863
 epoch: 69, train_loss: 1.0528, test_loss: 1.0155, test_f1: 0.4795
 epoch: 70, train_loss: 1.0530, test_loss: 1.0232, test_f1: 0.4855
 epoch: 71, train_loss: 1.0492, test_loss: 1.0171, test_f1: 0.4572
 epoch: 72, train_loss: 1.0422, test_loss: 1.0306, test_f1: 0.4654
 epoch: 73, train_loss: 1.0527, test_loss: 1.0247, test_f1: 0.4740
 epoch: 74, train_loss: 1.0553, test_loss: 1.0092, test_f1: 0.4854
 epoch: 75, train_loss: 1.0321, test_loss: 1.0118, test_f1: 0.4926
 epoch: 76, train_loss: 1.0507, test_loss: 1.0039, test_f1: 0.4912
 epoch: 77, train_loss: 1.0448, test_loss: 1.0184, test_f1: 0.4858
 epoch: 78, train_loss: 1.0382, test_loss: 1.0111, test_f1: 0.4550
 epoch: 79, train_loss: 1.0392, test_loss: 1.0071, test_f1: 0.4836
 epoch: 80, train_loss: 1.0484, test_loss: 1.0093, test_f1: 0.4592
 epoch: 81, train_loss: 1.0381, test_loss: 0.9996, test_f1: 0.4978
 epoch: 82, train_loss: 1.0364, test_loss: 1.0066, test_f1: 0.4858
 epoch: 83, train_loss: 1.0384, test_loss: 1.0035, test_f1: 0.4905
 epoch: 84, train_loss: 1.0288, test_loss: 1.0020, test_f1: 0.4961
 epoch: 85, train_loss: 1.0361, test_loss: 1.0040, test_f1: 0.4892
 epoch: 86, train_loss: 1.0364, test_loss: 1.0118, test_f1: 0.4902
 epoch: 87, train_loss: 1.0347, test_loss: 1.0072, test_f1: 0.4920
 epoch: 88, train_loss: 1.0261, test_loss: 1.0022, test_f1: 0.4922
 epoch: 89, train_loss: 1.0296, test_loss: 0.9996, test_f1: 0.4917
 epoch: 90, train_loss: 1.0296, test_loss: 1.0091, test_f1: 0.4884
 epoch: 91, train_loss: 1.0274, test_loss: 0.9986, test_f1: 0.5014
 epoch: 92, train_loss: 1.0238, test_loss: 1.0090, test_f1: 0.4911
 epoch: 93, train_loss: 1.0264, test_loss: 1.0177, test_f1: 0.4704
 epoch: 94, train_loss: 1.0195, test_loss: 1.0050, test_f1: 0.4832
 epoch: 95, train_loss: 1.0221, test_loss: 1.0125, test_f1: 0.4659
 epoch: 96, train_loss: 1.0396, test_loss: 0.9950, test_f1: 0.4926
 epoch: 97, train_loss: 1.0209, test_loss: 1.0083, test_f1: 0.4573
 epoch: 98, train_loss: 1.0194, test_loss: 1.0004, test_f1: 0.4904
 epoch: 99, train_loss: 1.0190, test_loss: 1.0065, test_f1: 0.4860
##################ITERATION #2 ****************************************
 epoch: 0, train_loss: 1.3095, test_loss: 1.2869, test_f1: 0.2855
 epoch: 1, train_loss: 1.2771, test_loss: 1.2706, test_f1: 0.2880
 epoch: 2, train_loss: 1.2651, test_loss: 1.2509, test_f1: 0.2913
 epoch: 3, train_loss: 1.2520, test_loss: 1.2373, test_f1: 0.2861
 epoch: 4, train_loss: 1.2387, test_loss: 1.2212, test_f1: 0.2881
 epoch: 5, train_loss: 1.2297, test_loss: 1.2120, test_f1: 0.3052
 epoch: 6, train_loss: 1.2241, test_loss: 1.1969, test_f1: 0.3389
 epoch: 7, train_loss: 1.2180, test_loss: 1.1914, test_f1: 0.3534
 epoch: 8, train_loss: 1.2083, test_loss: 1.1816, test_f1: 0.3925
 epoch: 9, train_loss: 1.1971, test_loss: 1.1718, test_f1: 0.3840
 epoch: 10, train_loss: 1.1937, test_loss: 1.1636, test_f1: 0.4074
 epoch: 11, train_loss: 1.1928, test_loss: 1.1570, test_f1: 0.4140
 epoch: 12, train_loss: 1.1786, test_loss: 1.1417, test_f1: 0.4212
 epoch: 13, train_loss: 1.1718, test_loss: 1.1393, test_f1: 0.4267
 epoch: 14, train_loss: 1.1702, test_loss: 1.1276, test_f1: 0.4230
 epoch: 15, train_loss: 1.1614, test_loss: 1.1240, test_f1: 0.4369
 epoch: 16, train_loss: 1.1558, test_loss: 1.1061, test_f1: 0.4434
 epoch: 17, train_loss: 1.1468, test_loss: 1.1097, test_f1: 0.4326
 epoch: 18, train_loss: 1.1468, test_loss: 1.1057, test_f1: 0.4376
 epoch: 19, train_loss: 1.1436, test_loss: 1.1007, test_f1: 0.4558
 epoch: 20, train_loss: 1.1324, test_loss: 1.0885, test_f1: 0.4431
 epoch: 21, train_loss: 1.1311, test_loss: 1.0788, test_f1: 0.4545
 epoch: 22, train_loss: 1.1262, test_loss: 1.0779, test_f1: 0.4618
 epoch: 23, train_loss: 1.1220, test_loss: 1.0762, test_f1: 0.4537
 epoch: 24, train_loss: 1.1166, test_loss: 1.0708, test_f1: 0.4419
 epoch: 25, train_loss: 1.1105, test_loss: 1.0694, test_f1: 0.4482
 epoch: 26, train_loss: 1.1111, test_loss: 1.0740, test_f1: 0.4460
 epoch: 27, train_loss: 1.1228, test_loss: 1.0638, test_f1: 0.4425
 epoch: 28, train_loss: 1.1131, test_loss: 1.0581, test_f1: 0.4503
 epoch: 29, train_loss: 1.1053, test_loss: 1.0541, test_f1: 0.4531
 epoch: 30, train_loss: 1.0869, test_loss: 1.0677, test_f1: 0.4311
 epoch: 31, train_loss: 1.0943, test_loss: 1.0561, test_f1: 0.4455
 epoch: 32, train_loss: 1.0972, test_loss: 1.0421, test_f1: 0.4568
 epoch: 33, train_loss: 1.0960, test_loss: 1.0546, test_f1: 0.4581
 epoch: 34, train_loss: 1.0824, test_loss: 1.0487, test_f1: 0.4574
 epoch: 35, train_loss: 1.0848, test_loss: 1.0549, test_f1: 0.4450
 epoch: 36, train_loss: 1.0846, test_loss: 1.0439, test_f1: 0.4503
 epoch: 37, train_loss: 1.0784, test_loss: 1.0313, test_f1: 0.4685
 epoch: 38, train_loss: 1.0660, test_loss: 1.0229, test_f1: 0.4656
 epoch: 39, train_loss: 1.0747, test_loss: 1.0418, test_f1: 0.4515
 epoch: 40, train_loss: 1.0635, test_loss: 1.0388, test_f1: 0.4476
 epoch: 41, train_loss: 1.0559, test_loss: 1.0534, test_f1: 0.4411
 epoch: 42, train_loss: 1.0710, test_loss: 1.0402, test_f1: 0.4451
 epoch: 43, train_loss: 1.0604, test_loss: 1.0467, test_f1: 0.4270
 epoch: 44, train_loss: 1.0677, test_loss: 1.0433, test_f1: 0.4268
 epoch: 45, train_loss: 1.0659, test_loss: 1.0449, test_f1: 0.4383
 epoch: 46, train_loss: 1.0607, test_loss: 1.0314, test_f1: 0.4482
 epoch: 47, train_loss: 1.0572, test_loss: 1.0142, test_f1: 0.4482
 epoch: 48, train_loss: 1.0498, test_loss: 1.0213, test_f1: 0.4374
 epoch: 49, train_loss: 1.0481, test_loss: 1.0074, test_f1: 0.4507
 epoch: 50, train_loss: 1.0442, test_loss: 1.0039, test_f1: 0.4667
 epoch: 51, train_loss: 1.0428, test_loss: 1.0045, test_f1: 0.4749
 epoch: 52, train_loss: 1.0421, test_loss: 1.0118, test_f1: 0.4513
 epoch: 53, train_loss: 1.0429, test_loss: 1.0159, test_f1: 0.4464
 epoch: 54, train_loss: 1.0456, test_loss: 1.0305, test_f1: 0.4415
 epoch: 55, train_loss: 1.0437, test_loss: 1.0243, test_f1: 0.4523
 epoch: 56, train_loss: 1.0478, test_loss: 1.0074, test_f1: 0.4666
 epoch: 57, train_loss: 1.0323, test_loss: 1.0304, test_f1: 0.4368
 epoch: 58, train_loss: 1.0460, test_loss: 1.0186, test_f1: 0.4551
 epoch: 59, train_loss: 1.0372, test_loss: 1.0417, test_f1: 0.4311
 epoch: 60, train_loss: 1.0374, test_loss: 1.0235, test_f1: 0.4356
 epoch: 61, train_loss: 1.0430, test_loss: 1.0049, test_f1: 0.4473
 epoch: 62, train_loss: 1.0371, test_loss: 1.0021, test_f1: 0.4573
 epoch: 63, train_loss: 1.0328, test_loss: 1.0031, test_f1: 0.4615
 epoch: 64, train_loss: 1.0351, test_loss: 1.0174, test_f1: 0.4542
 epoch: 65, train_loss: 1.0229, test_loss: 1.0122, test_f1: 0.4466
 epoch: 66, train_loss: 1.0238, test_loss: 1.0086, test_f1: 0.4670
 epoch: 67, train_loss: 1.0294, test_loss: 1.0113, test_f1: 0.4557
 epoch: 68, train_loss: 1.0309, test_loss: 1.0463, test_f1: 0.4482
 epoch: 69, train_loss: 1.0293, test_loss: 1.0169, test_f1: 0.4554
 epoch: 70, train_loss: 1.0381, test_loss: 1.0158, test_f1: 0.4547
 epoch: 71, train_loss: 1.0247, test_loss: 1.0199, test_f1: 0.4255
 epoch: 72, train_loss: 1.0231, test_loss: 1.0056, test_f1: 0.4472
 epoch: 73, train_loss: 1.0294, test_loss: 1.0173, test_f1: 0.4530
 epoch: 74, train_loss: 1.0140, test_loss: 1.0060, test_f1: 0.4546
 epoch: 75, train_loss: 1.0139, test_loss: 1.0095, test_f1: 0.4407
 epoch: 76, train_loss: 1.0175, test_loss: 1.0109, test_f1: 0.4481
 epoch: 77, train_loss: 1.0248, test_loss: 1.0131, test_f1: 0.4446
 epoch: 78, train_loss: 1.0195, test_loss: 1.0151, test_f1: 0.4373
 epoch: 79, train_loss: 1.0269, test_loss: 0.9955, test_f1: 0.4563
 epoch: 80, train_loss: 1.0176, test_loss: 1.0169, test_f1: 0.4361
 epoch: 81, train_loss: 1.0139, test_loss: 1.0171, test_f1: 0.4485
 epoch: 82, train_loss: 1.0168, test_loss: 0.9956, test_f1: 0.4505
 epoch: 83, train_loss: 1.0157, test_loss: 1.0018, test_f1: 0.4409
 epoch: 84, train_loss: 1.0084, test_loss: 0.9933, test_f1: 0.4510
 epoch: 85, train_loss: 1.0184, test_loss: 1.0321, test_f1: 0.4406
 epoch: 86, train_loss: 1.0084, test_loss: 0.9978, test_f1: 0.4499
 epoch: 87, train_loss: 1.0175, test_loss: 0.9952, test_f1: 0.4618
 epoch: 88, train_loss: 1.0110, test_loss: 1.0033, test_f1: 0.4545
 epoch: 89, train_loss: 1.0183, test_loss: 0.9961, test_f1: 0.4459
 epoch: 90, train_loss: 1.0090, test_loss: 0.9851, test_f1: 0.4701
 epoch: 91, train_loss: 1.0113, test_loss: 0.9999, test_f1: 0.4442
 epoch: 92, train_loss: 1.0046, test_loss: 0.9842, test_f1: 0.4562
 epoch: 93, train_loss: 1.0087, test_loss: 0.9951, test_f1: 0.4440
 epoch: 94, train_loss: 0.9994, test_loss: 1.0123, test_f1: 0.4525
 epoch: 95, train_loss: 1.0050, test_loss: 1.0139, test_f1: 0.4371
 epoch: 96, train_loss: 1.0059, test_loss: 0.9903, test_f1: 0.4570
 epoch: 97, train_loss: 0.9955, test_loss: 1.0252, test_f1: 0.4328
 epoch: 98, train_loss: 1.0060, test_loss: 1.0310, test_f1: 0.4508
 epoch: 99, train_loss: 1.0084, test_loss: 0.9883, test_f1: 0.4594
##################ITERATION #3 ****************************************
 epoch: 0, train_loss: 1.3128, test_loss: 1.2961, test_f1: 0.2318
 epoch: 1, train_loss: 1.2716, test_loss: 1.2745, test_f1: 0.2353
 epoch: 2, train_loss: 1.2589, test_loss: 1.2546, test_f1: 0.2350
 epoch: 3, train_loss: 1.2525, test_loss: 1.2520, test_f1: 0.2389
 epoch: 4, train_loss: 1.2439, test_loss: 1.2312, test_f1: 0.2497
 epoch: 5, train_loss: 1.2333, test_loss: 1.2142, test_f1: 0.2835
 epoch: 6, train_loss: 1.2197, test_loss: 1.2065, test_f1: 0.3072
 epoch: 7, train_loss: 1.2112, test_loss: 1.2218, test_f1: 0.3462
 epoch: 8, train_loss: 1.2060, test_loss: 1.1807, test_f1: 0.3677
 epoch: 9, train_loss: 1.1964, test_loss: 1.1696, test_f1: 0.3867
 epoch: 10, train_loss: 1.1958, test_loss: 1.1634, test_f1: 0.3895
 epoch: 11, train_loss: 1.1843, test_loss: 1.1565, test_f1: 0.3926
 epoch: 12, train_loss: 1.1805, test_loss: 1.1527, test_f1: 0.3884
 epoch: 13, train_loss: 1.1672, test_loss: 1.1380, test_f1: 0.4268
 epoch: 14, train_loss: 1.1698, test_loss: 1.1307, test_f1: 0.4119
 epoch: 15, train_loss: 1.1643, test_loss: 1.1507, test_f1: 0.4047
 epoch: 16, train_loss: 1.1601, test_loss: 1.1206, test_f1: 0.4153
 epoch: 17, train_loss: 1.1543, test_loss: 1.1160, test_f1: 0.4207
 epoch: 18, train_loss: 1.1548, test_loss: 1.1106, test_f1: 0.4197
 epoch: 19, train_loss: 1.1491, test_loss: 1.1045, test_f1: 0.4538
 epoch: 20, train_loss: 1.1388, test_loss: 1.1006, test_f1: 0.4291
 epoch: 21, train_loss: 1.1469, test_loss: 1.0906, test_f1: 0.4279
 epoch: 22, train_loss: 1.1371, test_loss: 1.0940, test_f1: 0.4357
 epoch: 23, train_loss: 1.1316, test_loss: 1.0862, test_f1: 0.4289
 epoch: 24, train_loss: 1.1244, test_loss: 1.0808, test_f1: 0.4389
 epoch: 25, train_loss: 1.1311, test_loss: 1.0783, test_f1: 0.4359
 epoch: 26, train_loss: 1.1255, test_loss: 1.0848, test_f1: 0.4267
 epoch: 27, train_loss: 1.1229, test_loss: 1.0741, test_f1: 0.4346
 epoch: 28, train_loss: 1.1088, test_loss: 1.0655, test_f1: 0.4324
 epoch: 29, train_loss: 1.1048, test_loss: 1.0677, test_f1: 0.4387
 epoch: 30, train_loss: 1.1088, test_loss: 1.0689, test_f1: 0.4432
 epoch: 31, train_loss: 1.1010, test_loss: 1.0636, test_f1: 0.4530
 epoch: 32, train_loss: 1.0899, test_loss: 1.0535, test_f1: 0.4587
 epoch: 33, train_loss: 1.1012, test_loss: 1.0839, test_f1: 0.4384
 epoch: 34, train_loss: 1.0977, test_loss: 1.0536, test_f1: 0.4725
 epoch: 35, train_loss: 1.0944, test_loss: 1.0368, test_f1: 0.4852
 epoch: 36, train_loss: 1.0876, test_loss: 1.0460, test_f1: 0.4517
 epoch: 37, train_loss: 1.0836, test_loss: 1.0529, test_f1: 0.4596
 epoch: 38, train_loss: 1.0863, test_loss: 1.0478, test_f1: 0.4655
 epoch: 39, train_loss: 1.0815, test_loss: 1.0586, test_f1: 0.4467
 epoch: 40, train_loss: 1.0797, test_loss: 1.0308, test_f1: 0.4601
 epoch: 41, train_loss: 1.0781, test_loss: 1.0314, test_f1: 0.4484
 epoch: 42, train_loss: 1.0711, test_loss: 1.0806, test_f1: 0.4453
 epoch: 43, train_loss: 1.0647, test_loss: 1.0230, test_f1: 0.4626
 epoch: 44, train_loss: 1.0746, test_loss: 1.0179, test_f1: 0.4710
 epoch: 45, train_loss: 1.0598, test_loss: 1.0224, test_f1: 0.4542
 epoch: 46, train_loss: 1.0573, test_loss: 1.0643, test_f1: 0.4531
 epoch: 47, train_loss: 1.0599, test_loss: 1.0361, test_f1: 0.4483
 epoch: 48, train_loss: 1.0599, test_loss: 1.0189, test_f1: 0.4790
 epoch: 49, train_loss: 1.0540, test_loss: 1.0173, test_f1: 0.4617
 epoch: 50, train_loss: 1.0471, test_loss: 1.0238, test_f1: 0.4665
 epoch: 51, train_loss: 1.0397, test_loss: 1.0678, test_f1: 0.4663
 epoch: 52, train_loss: 1.0407, test_loss: 1.0353, test_f1: 0.4529
 epoch: 53, train_loss: 1.0426, test_loss: 1.0366, test_f1: 0.4475
 epoch: 54, train_loss: 1.0491, test_loss: 1.0722, test_f1: 0.4485
 epoch: 55, train_loss: 1.0407, test_loss: 1.1506, test_f1: 0.4467
 epoch: 56, train_loss: 1.0363, test_loss: 1.0732, test_f1: 0.4442
 epoch: 57, train_loss: 1.0395, test_loss: 1.0998, test_f1: 0.4444
 epoch: 58, train_loss: 1.0375, test_loss: 1.0920, test_f1: 0.4682
 epoch: 59, train_loss: 1.0376, test_loss: 1.0971, test_f1: 0.4561
 epoch: 60, train_loss: 1.0362, test_loss: 1.0213, test_f1: 0.4613
 epoch: 61, train_loss: 1.0353, test_loss: 1.0284, test_f1: 0.4458
 epoch: 62, train_loss: 1.0323, test_loss: 1.0073, test_f1: 0.4552
 epoch: 63, train_loss: 1.0259, test_loss: 1.1109, test_f1: 0.4455
 epoch: 64, train_loss: 1.0298, test_loss: 1.0145, test_f1: 0.4729
 epoch: 65, train_loss: 1.0288, test_loss: 0.9904, test_f1: 0.4897
 epoch: 66, train_loss: 1.0235, test_loss: 1.0975, test_f1: 0.4480
 epoch: 67, train_loss: 1.0253, test_loss: 1.1531, test_f1: 0.4550
 epoch: 68, train_loss: 1.0201, test_loss: 1.1439, test_f1: 0.4708
 epoch: 69, train_loss: 1.0237, test_loss: 1.0245, test_f1: 0.4652
 epoch: 70, train_loss: 1.0131, test_loss: 1.0458, test_f1: 0.4498
 epoch: 71, train_loss: 1.0284, test_loss: 1.0896, test_f1: 0.4615
 epoch: 72, train_loss: 1.0206, test_loss: 1.0408, test_f1: 0.4681
 epoch: 73, train_loss: 1.0282, test_loss: 1.1473, test_f1: 0.4758
 epoch: 74, train_loss: 1.0144, test_loss: 1.0101, test_f1: 0.4715
 epoch: 75, train_loss: 1.0090, test_loss: 1.1023, test_f1: 0.4517
 epoch: 76, train_loss: 1.0244, test_loss: 1.0650, test_f1: 0.4602
 epoch: 77, train_loss: 1.0163, test_loss: 1.2285, test_f1: 0.4881
 epoch: 78, train_loss: 1.0022, test_loss: 1.2550, test_f1: 0.4642
 epoch: 79, train_loss: 1.0076, test_loss: 1.0194, test_f1: 0.4594
 epoch: 80, train_loss: 1.0003, test_loss: 1.0191, test_f1: 0.4731
 epoch: 81, train_loss: 1.0007, test_loss: 1.1544, test_f1: 0.4542
 epoch: 82, train_loss: 1.0062, test_loss: 1.1335, test_f1: 0.4554
 epoch: 83, train_loss: 1.0167, test_loss: 1.0167, test_f1: 0.4588
 epoch: 84, train_loss: 0.9969, test_loss: 1.0106, test_f1: 0.4868
 epoch: 85, train_loss: 1.0119, test_loss: 1.0422, test_f1: 0.4508
 epoch: 86, train_loss: 0.9991, test_loss: 1.0494, test_f1: 0.4488
 epoch: 87, train_loss: 0.9987, test_loss: 1.0470, test_f1: 0.4616
 epoch: 88, train_loss: 1.0046, test_loss: 1.1574, test_f1: 0.4429
 epoch: 89, train_loss: 0.9925, test_loss: 0.9983, test_f1: 0.4787
 epoch: 90, train_loss: 0.9936, test_loss: 1.0930, test_f1: 0.4428
 epoch: 91, train_loss: 0.9940, test_loss: 1.1622, test_f1: 0.4693
 epoch: 92, train_loss: 0.9934, test_loss: 1.1306, test_f1: 0.4580
 epoch: 93, train_loss: 0.9922, test_loss: 1.0574, test_f1: 0.4719
 epoch: 94, train_loss: 0.9968, test_loss: 0.9972, test_f1: 0.4701
 epoch: 95, train_loss: 0.9905, test_loss: 1.0760, test_f1: 0.4648
 epoch: 96, train_loss: 0.9912, test_loss: 1.0204, test_f1: 0.4637
 epoch: 97, train_loss: 0.9938, test_loss: 1.1287, test_f1: 0.4536
 epoch: 98, train_loss: 0.9885, test_loss: 1.1316, test_f1: 0.4660
 epoch: 99, train_loss: 0.9884, test_loss: 1.0671, test_f1: 0.4664
##################ITERATION #4 ****************************************
 epoch: 0, train_loss: 1.2938, test_loss: 1.2604, test_f1: 0.2601
 epoch: 1, train_loss: 1.2585, test_loss: 1.2353, test_f1: 0.2708
 epoch: 2, train_loss: 1.2477, test_loss: 1.2239, test_f1: 0.2554
 epoch: 3, train_loss: 1.2382, test_loss: 1.2083, test_f1: 0.2700
 epoch: 4, train_loss: 1.2293, test_loss: 1.1986, test_f1: 0.2929
 epoch: 5, train_loss: 1.2231, test_loss: 1.1885, test_f1: 0.3137
 epoch: 6, train_loss: 1.2177, test_loss: 1.1793, test_f1: 0.3421
 epoch: 7, train_loss: 1.2081, test_loss: 1.1717, test_f1: 0.3474
 epoch: 8, train_loss: 1.2025, test_loss: 1.1625, test_f1: 0.3693
 epoch: 9, train_loss: 1.2045, test_loss: 1.1592, test_f1: 0.3938
 epoch: 10, train_loss: 1.1925, test_loss: 1.1500, test_f1: 0.4234
 epoch: 11, train_loss: 1.1853, test_loss: 1.1461, test_f1: 0.4267
 epoch: 12, train_loss: 1.1810, test_loss: 1.1388, test_f1: 0.4344
 epoch: 13, train_loss: 1.1705, test_loss: 1.1403, test_f1: 0.4450
 epoch: 14, train_loss: 1.1696, test_loss: 1.1295, test_f1: 0.4480
 epoch: 15, train_loss: 1.1667, test_loss: 1.1167, test_f1: 0.4394
 epoch: 16, train_loss: 1.1615, test_loss: 1.1171, test_f1: 0.4489
 epoch: 17, train_loss: 1.1577, test_loss: 1.1102, test_f1: 0.4162
 epoch: 18, train_loss: 1.1470, test_loss: 1.1052, test_f1: 0.4390
 epoch: 19, train_loss: 1.1507, test_loss: 1.0996, test_f1: 0.4573
 epoch: 20, train_loss: 1.1429, test_loss: 1.0994, test_f1: 0.4469
 epoch: 21, train_loss: 1.1381, test_loss: 1.0933, test_f1: 0.4485
 epoch: 22, train_loss: 1.1353, test_loss: 1.0847, test_f1: 0.4476
 epoch: 23, train_loss: 1.1325, test_loss: 1.0831, test_f1: 0.4526
 epoch: 24, train_loss: 1.1219, test_loss: 1.0934, test_f1: 0.4250
 epoch: 25, train_loss: 1.1170, test_loss: 1.0812, test_f1: 0.4377
 epoch: 26, train_loss: 1.1074, test_loss: 1.0803, test_f1: 0.4659
 epoch: 27, train_loss: 1.1128, test_loss: 1.0801, test_f1: 0.4551
 epoch: 28, train_loss: 1.1068, test_loss: 1.0738, test_f1: 0.4602
 epoch: 29, train_loss: 1.0967, test_loss: 1.0712, test_f1: 0.4301
 epoch: 30, train_loss: 1.0975, test_loss: 1.0673, test_f1: 0.4321
 epoch: 31, train_loss: 1.0977, test_loss: 1.0667, test_f1: 0.4570
 epoch: 32, train_loss: 1.0879, test_loss: 1.0616, test_f1: 0.4355
 epoch: 33, train_loss: 1.0997, test_loss: 1.0757, test_f1: 0.4604
 epoch: 34, train_loss: 1.0780, test_loss: 1.0624, test_f1: 0.4310
 epoch: 35, train_loss: 1.0784, test_loss: 1.0532, test_f1: 0.4241
 epoch: 36, train_loss: 1.0711, test_loss: 1.0473, test_f1: 0.4272
 epoch: 37, train_loss: 1.0764, test_loss: 1.0394, test_f1: 0.4411
 epoch: 38, train_loss: 1.0696, test_loss: 1.0381, test_f1: 0.4648
 epoch: 39, train_loss: 1.0774, test_loss: 1.0477, test_f1: 0.4440
 epoch: 40, train_loss: 1.0566, test_loss: 1.0439, test_f1: 0.4487
 epoch: 41, train_loss: 1.0580, test_loss: 1.0343, test_f1: 0.4545
 epoch: 42, train_loss: 1.0664, test_loss: 1.0266, test_f1: 0.4738
 epoch: 43, train_loss: 1.0575, test_loss: 1.0298, test_f1: 0.4306
 epoch: 44, train_loss: 1.0516, test_loss: 1.0204, test_f1: 0.4630
 epoch: 45, train_loss: 1.0459, test_loss: 1.0267, test_f1: 0.4604
 epoch: 46, train_loss: 1.0420, test_loss: 1.0388, test_f1: 0.4407
 epoch: 47, train_loss: 1.0499, test_loss: 1.0193, test_f1: 0.4484
 epoch: 48, train_loss: 1.0381, test_loss: 1.0192, test_f1: 0.4490
 epoch: 49, train_loss: 1.0300, test_loss: 1.0179, test_f1: 0.4447
 epoch: 50, train_loss: 1.0367, test_loss: 1.0239, test_f1: 0.4427
 epoch: 51, train_loss: 1.0367, test_loss: 1.0220, test_f1: 0.4689
 epoch: 52, train_loss: 1.0361, test_loss: 1.0231, test_f1: 0.4649
 epoch: 53, train_loss: 1.0261, test_loss: 1.0171, test_f1: 0.4611
 epoch: 54, train_loss: 1.0246, test_loss: 1.0170, test_f1: 0.4428
 epoch: 55, train_loss: 1.0288, test_loss: 1.0356, test_f1: 0.4443
 epoch: 56, train_loss: 1.0260, test_loss: 1.0222, test_f1: 0.4483
 epoch: 57, train_loss: 1.0171, test_loss: 1.0212, test_f1: 0.4686
 epoch: 58, train_loss: 1.0301, test_loss: 1.0249, test_f1: 0.4405
 epoch: 59, train_loss: 1.0298, test_loss: 1.0108, test_f1: 0.4615
 epoch: 60, train_loss: 1.0245, test_loss: 1.0378, test_f1: 0.4486
 epoch: 61, train_loss: 1.0174, test_loss: 1.0143, test_f1: 0.4836
 epoch: 62, train_loss: 1.0189, test_loss: 1.0245, test_f1: 0.4521
 epoch: 63, train_loss: 1.0090, test_loss: 1.0073, test_f1: 0.4660
 epoch: 64, train_loss: 1.0130, test_loss: 1.0194, test_f1: 0.4494
 epoch: 65, train_loss: 1.0179, test_loss: 1.0097, test_f1: 0.4646
 epoch: 66, train_loss: 1.0168, test_loss: 1.0060, test_f1: 0.4690
 epoch: 67, train_loss: 1.0172, test_loss: 0.9974, test_f1: 0.4672
 epoch: 68, train_loss: 1.0132, test_loss: 1.0186, test_f1: 0.4502
 epoch: 69, train_loss: 1.0096, test_loss: 1.0120, test_f1: 0.4514
 epoch: 70, train_loss: 1.0155, test_loss: 1.0275, test_f1: 0.4531
 epoch: 71, train_loss: 1.0035, test_loss: 1.0182, test_f1: 0.4679
 epoch: 72, train_loss: 1.0085, test_loss: 1.0069, test_f1: 0.4758
 epoch: 73, train_loss: 1.0115, test_loss: 1.0176, test_f1: 0.4553
 epoch: 74, train_loss: 1.0108, test_loss: 1.0242, test_f1: 0.4582
 epoch: 75, train_loss: 0.9972, test_loss: 1.0107, test_f1: 0.4508
 epoch: 76, train_loss: 1.0074, test_loss: 0.9986, test_f1: 0.4637
 epoch: 77, train_loss: 1.0085, test_loss: 1.0012, test_f1: 0.4710
 epoch: 78, train_loss: 1.0087, test_loss: 1.0148, test_f1: 0.4710
 epoch: 79, train_loss: 1.0105, test_loss: 1.0065, test_f1: 0.4563
 epoch: 80, train_loss: 1.0017, test_loss: 1.0099, test_f1: 0.4539
 epoch: 81, train_loss: 1.0064, test_loss: 1.0042, test_f1: 0.4652
 epoch: 82, train_loss: 0.9951, test_loss: 1.0031, test_f1: 0.4328
 epoch: 83, train_loss: 1.0039, test_loss: 0.9836, test_f1: 0.4608
 epoch: 84, train_loss: 1.0027, test_loss: 1.0056, test_f1: 0.4639
 epoch: 85, train_loss: 1.0010, test_loss: 0.9978, test_f1: 0.4790
 epoch: 86, train_loss: 0.9942, test_loss: 0.9939, test_f1: 0.4658
 epoch: 87, train_loss: 0.9921, test_loss: 1.0293, test_f1: 0.4498
 epoch: 88, train_loss: 0.9987, test_loss: 1.0030, test_f1: 0.4612
 epoch: 89, train_loss: 0.9908, test_loss: 1.0013, test_f1: 0.4614
 epoch: 90, train_loss: 1.0018, test_loss: 1.0046, test_f1: 0.4695
 epoch: 91, train_loss: 0.9924, test_loss: 1.0011, test_f1: 0.4662
 epoch: 92, train_loss: 0.9910, test_loss: 1.0024, test_f1: 0.4463
 epoch: 93, train_loss: 0.9883, test_loss: 0.9985, test_f1: 0.4581
 epoch: 94, train_loss: 0.9883, test_loss: 1.0036, test_f1: 0.4511
 epoch: 95, train_loss: 0.9904, test_loss: 0.9948, test_f1: 0.4640
 epoch: 96, train_loss: 0.9832, test_loss: 0.9917, test_f1: 0.4778
 epoch: 97, train_loss: 0.9764, test_loss: 0.9852, test_f1: 0.4713
 epoch: 98, train_loss: 0.9734, test_loss: 1.0224, test_f1: 0.4772
 epoch: 99, train_loss: 0.9796, test_loss: 1.0045, test_f1: 0.4676
##################ITERATION #5 ****************************************
 epoch: 0, train_loss: 1.2939, test_loss: 1.2572, test_f1: 0.2352
 epoch: 1, train_loss: 1.2532, test_loss: 1.2341, test_f1: 0.3089
 epoch: 2, train_loss: 1.2378, test_loss: 1.2262, test_f1: 0.3126
 epoch: 3, train_loss: 1.2293, test_loss: 1.2136, test_f1: 0.3880
 epoch: 4, train_loss: 1.2300, test_loss: 1.1995, test_f1: 0.3784
 epoch: 5, train_loss: 1.2207, test_loss: 1.1905, test_f1: 0.4022
 epoch: 6, train_loss: 1.2142, test_loss: 1.1804, test_f1: 0.3925
 epoch: 7, train_loss: 1.2104, test_loss: 1.1834, test_f1: 0.3981
 epoch: 8, train_loss: 1.2063, test_loss: 1.1679, test_f1: 0.4107
 epoch: 9, train_loss: 1.2039, test_loss: 1.1626, test_f1: 0.4037
 epoch: 10, train_loss: 1.2049, test_loss: 1.1562, test_f1: 0.3948
 epoch: 11, train_loss: 1.1917, test_loss: 1.1571, test_f1: 0.4019
 epoch: 12, train_loss: 1.1865, test_loss: 1.1421, test_f1: 0.4220
 epoch: 13, train_loss: 1.1825, test_loss: 1.1370, test_f1: 0.4095
 epoch: 14, train_loss: 1.1846, test_loss: 1.1300, test_f1: 0.4216
 epoch: 15, train_loss: 1.1754, test_loss: 1.1197, test_f1: 0.4230
 epoch: 16, train_loss: 1.1770, test_loss: 1.1205, test_f1: 0.4330
 epoch: 17, train_loss: 1.1809, test_loss: 1.1113, test_f1: 0.4428
 epoch: 18, train_loss: 1.1663, test_loss: 1.1127, test_f1: 0.4439
 epoch: 19, train_loss: 1.1686, test_loss: 1.1097, test_f1: 0.4429
 epoch: 20, train_loss: 1.1583, test_loss: 1.1036, test_f1: 0.4388
 epoch: 21, train_loss: 1.1646, test_loss: 1.0998, test_f1: 0.4505
 epoch: 22, train_loss: 1.1554, test_loss: 1.1001, test_f1: 0.4534
 epoch: 23, train_loss: 1.1552, test_loss: 1.1010, test_f1: 0.4222
 epoch: 24, train_loss: 1.1423, test_loss: 1.0815, test_f1: 0.4625
 epoch: 25, train_loss: 1.1486, test_loss: 1.1032, test_f1: 0.4224
 epoch: 26, train_loss: 1.1363, test_loss: 1.0771, test_f1: 0.4511
 epoch: 27, train_loss: 1.1390, test_loss: 1.0792, test_f1: 0.4430
 epoch: 28, train_loss: 1.1425, test_loss: 1.0767, test_f1: 0.4477
 epoch: 29, train_loss: 1.1514, test_loss: 1.0583, test_f1: 0.4649
 epoch: 30, train_loss: 1.1299, test_loss: 1.0626, test_f1: 0.4662
 epoch: 31, train_loss: 1.1202, test_loss: 1.0556, test_f1: 0.4646
 epoch: 32, train_loss: 1.1181, test_loss: 1.0744, test_f1: 0.4493
 epoch: 33, train_loss: 1.1225, test_loss: 1.0589, test_f1: 0.4729
 epoch: 34, train_loss: 1.1136, test_loss: 1.0562, test_f1: 0.4453
 epoch: 35, train_loss: 1.1091, test_loss: 1.0446, test_f1: 0.4680
 epoch: 36, train_loss: 1.1094, test_loss: 1.0450, test_f1: 0.4808
 epoch: 37, train_loss: 1.1066, test_loss: 1.0425, test_f1: 0.4784
 epoch: 38, train_loss: 1.1089, test_loss: 1.0429, test_f1: 0.4419
 epoch: 39, train_loss: 1.1112, test_loss: 1.0331, test_f1: 0.4631
 epoch: 40, train_loss: 1.1031, test_loss: 1.0382, test_f1: 0.4671
 epoch: 41, train_loss: 1.1152, test_loss: 1.0287, test_f1: 0.4568
 epoch: 42, train_loss: 1.0929, test_loss: 1.0305, test_f1: 0.4631
 epoch: 43, train_loss: 1.0906, test_loss: 1.0283, test_f1: 0.4709
 epoch: 44, train_loss: 1.1002, test_loss: 1.0378, test_f1: 0.4485
 epoch: 45, train_loss: 1.0832, test_loss: 1.0179, test_f1: 0.4812
 epoch: 46, train_loss: 1.0866, test_loss: 1.0235, test_f1: 0.4603
 epoch: 47, train_loss: 1.0798, test_loss: 1.0149, test_f1: 0.4557
 epoch: 48, train_loss: 1.0886, test_loss: 1.0162, test_f1: 0.4616
 epoch: 49, train_loss: 1.0840, test_loss: 1.0190, test_f1: 0.4634
 epoch: 50, train_loss: 1.0784, test_loss: 1.0217, test_f1: 0.4853
 epoch: 51, train_loss: 1.0663, test_loss: 1.0118, test_f1: 0.4701
 epoch: 52, train_loss: 1.0673, test_loss: 1.0089, test_f1: 0.4687
 epoch: 53, train_loss: 1.0713, test_loss: 1.0115, test_f1: 0.4839
 epoch: 54, train_loss: 1.0788, test_loss: 1.0191, test_f1: 0.4510
 epoch: 55, train_loss: 1.0726, test_loss: 1.1045, test_f1: 0.4515
 epoch: 56, train_loss: 1.0687, test_loss: 1.0362, test_f1: 0.4477
 epoch: 57, train_loss: 1.0607, test_loss: 1.0269, test_f1: 0.4430
 epoch: 58, train_loss: 1.0659, test_loss: 1.0063, test_f1: 0.4631
 epoch: 59, train_loss: 1.0715, test_loss: 1.0100, test_f1: 0.4558
 epoch: 60, train_loss: 1.0632, test_loss: 1.0105, test_f1: 0.4718
 epoch: 61, train_loss: 1.0678, test_loss: 1.0079, test_f1: 0.4527
 epoch: 62, train_loss: 1.0680, test_loss: 1.0196, test_f1: 0.4622
 epoch: 63, train_loss: 1.0648, test_loss: 1.0023, test_f1: 0.4688
 epoch: 64, train_loss: 1.0614, test_loss: 1.0045, test_f1: 0.4580
 epoch: 65, train_loss: 1.0594, test_loss: 0.9998, test_f1: 0.4695
 epoch: 66, train_loss: 1.0640, test_loss: 1.0051, test_f1: 0.4671
 epoch: 67, train_loss: 1.0633, test_loss: 1.0030, test_f1: 0.4609
 epoch: 68, train_loss: 1.0559, test_loss: 1.0075, test_f1: 0.4603
 epoch: 69, train_loss: 1.0614, test_loss: 1.0020, test_f1: 0.4608
 epoch: 70, train_loss: 1.0480, test_loss: 1.0121, test_f1: 0.4558
 epoch: 71, train_loss: 1.0553, test_loss: 1.0022, test_f1: 0.4712
 epoch: 72, train_loss: 1.0436, test_loss: 1.0089, test_f1: 0.4506
 epoch: 73, train_loss: 1.0489, test_loss: 0.9974, test_f1: 0.4576
 epoch: 74, train_loss: 1.0456, test_loss: 0.9996, test_f1: 0.4599
 epoch: 75, train_loss: 1.0523, test_loss: 0.9913, test_f1: 0.4650
 epoch: 76, train_loss: 1.0504, test_loss: 0.9947, test_f1: 0.4676
 epoch: 77, train_loss: 1.0486, test_loss: 1.0015, test_f1: 0.4576
 epoch: 78, train_loss: 1.0494, test_loss: 0.9995, test_f1: 0.4575
 epoch: 79, train_loss: 1.0452, test_loss: 0.9963, test_f1: 0.4594
 epoch: 80, train_loss: 1.0347, test_loss: 1.0022, test_f1: 0.4551
 epoch: 81, train_loss: 1.0551, test_loss: 1.0022, test_f1: 0.4559
 epoch: 82, train_loss: 1.0428, test_loss: 1.0018, test_f1: 0.4587
 epoch: 83, train_loss: 1.0442, test_loss: 1.0039, test_f1: 0.4547
 epoch: 84, train_loss: 1.0292, test_loss: 0.9888, test_f1: 0.4526
 epoch: 85, train_loss: 1.0346, test_loss: 0.9974, test_f1: 0.4569
 epoch: 86, train_loss: 1.0344, test_loss: 0.9908, test_f1: 0.4607
 epoch: 87, train_loss: 1.0362, test_loss: 0.9959, test_f1: 0.4532
 epoch: 88, train_loss: 1.0448, test_loss: 0.9924, test_f1: 0.4666
 epoch: 89, train_loss: 1.0333, test_loss: 0.9877, test_f1: 0.4625
 epoch: 90, train_loss: 1.0335, test_loss: 0.9953, test_f1: 0.4654
 epoch: 91, train_loss: 1.0438, test_loss: 0.9994, test_f1: 0.4601
 epoch: 92, train_loss: 1.0374, test_loss: 0.9847, test_f1: 0.4642
 epoch: 93, train_loss: 1.0321, test_loss: 0.9890, test_f1: 0.4568
 epoch: 94, train_loss: 1.0296, test_loss: 0.9899, test_f1: 0.4625
 epoch: 95, train_loss: 1.0120, test_loss: 0.9917, test_f1: 0.4590
 epoch: 96, train_loss: 1.0346, test_loss: 0.9903, test_f1: 0.4590
 epoch: 97, train_loss: 1.0285, test_loss: 1.0159, test_f1: 0.4583
 epoch: 98, train_loss: 1.0312, test_loss: 1.0103, test_f1: 0.4559
 epoch: 99, train_loss: 1.0289, test_loss: 0.9758, test_f1: 0.4695
##################ITERATION #6 ****************************************
 epoch: 0, train_loss: 1.3094, test_loss: 1.2348, test_f1: 0.2543
 epoch: 1, train_loss: 1.2607, test_loss: 1.2140, test_f1: 0.2576
 epoch: 2, train_loss: 1.2458, test_loss: 1.2017, test_f1: 0.3033
 epoch: 3, train_loss: 1.2399, test_loss: 1.1939, test_f1: 0.3403
 epoch: 4, train_loss: 1.2367, test_loss: 1.1856, test_f1: 0.3725
 epoch: 5, train_loss: 1.2193, test_loss: 1.1723, test_f1: 0.4041
 epoch: 6, train_loss: 1.2157, test_loss: 1.1682, test_f1: 0.3849
 epoch: 7, train_loss: 1.2020, test_loss: 1.1649, test_f1: 0.4025
 epoch: 8, train_loss: 1.2008, test_loss: 1.1603, test_f1: 0.3932
 epoch: 9, train_loss: 1.1826, test_loss: 1.1479, test_f1: 0.4241
 epoch: 10, train_loss: 1.1929, test_loss: 1.1457, test_f1: 0.4106
 epoch: 11, train_loss: 1.1913, test_loss: 1.1438, test_f1: 0.4331
 epoch: 12, train_loss: 1.1780, test_loss: 1.1399, test_f1: 0.4490
 epoch: 13, train_loss: 1.1809, test_loss: 1.1337, test_f1: 0.4431
 epoch: 14, train_loss: 1.1748, test_loss: 1.1378, test_f1: 0.4363
 epoch: 15, train_loss: 1.1738, test_loss: 1.1301, test_f1: 0.4343
 epoch: 16, train_loss: 1.1614, test_loss: 1.1300, test_f1: 0.4320
 epoch: 17, train_loss: 1.1634, test_loss: 1.1298, test_f1: 0.4269
 epoch: 18, train_loss: 1.1486, test_loss: 1.1206, test_f1: 0.4445
 epoch: 19, train_loss: 1.1489, test_loss: 1.1164, test_f1: 0.4334
 epoch: 20, train_loss: 1.1554, test_loss: 1.1108, test_f1: 0.4288
 epoch: 21, train_loss: 1.1500, test_loss: 1.1066, test_f1: 0.4248
 epoch: 22, train_loss: 1.1458, test_loss: 1.1101, test_f1: 0.4469
 epoch: 23, train_loss: 1.1410, test_loss: 1.0971, test_f1: 0.4417
 epoch: 24, train_loss: 1.1405, test_loss: 1.1083, test_f1: 0.4280
 epoch: 25, train_loss: 1.1425, test_loss: 1.1028, test_f1: 0.4505
 epoch: 26, train_loss: 1.1381, test_loss: 1.0937, test_f1: 0.4402
 epoch: 27, train_loss: 1.1268, test_loss: 1.0912, test_f1: 0.4374
 epoch: 28, train_loss: 1.1278, test_loss: 1.0904, test_f1: 0.4583
 epoch: 29, train_loss: 1.1273, test_loss: 1.0846, test_f1: 0.4580
 epoch: 30, train_loss: 1.1204, test_loss: 1.0843, test_f1: 0.4349
 epoch: 31, train_loss: 1.1091, test_loss: 1.0796, test_f1: 0.4389
 epoch: 32, train_loss: 1.1243, test_loss: 1.0787, test_f1: 0.4453
 epoch: 33, train_loss: 1.1111, test_loss: 1.0735, test_f1: 0.4433
 epoch: 34, train_loss: 1.1073, test_loss: 1.0672, test_f1: 0.4535
 epoch: 35, train_loss: 1.1153, test_loss: 1.0596, test_f1: 0.4487
 epoch: 36, train_loss: 1.1036, test_loss: 1.0664, test_f1: 0.4547
 epoch: 37, train_loss: 1.1063, test_loss: 1.0604, test_f1: 0.4451
 epoch: 38, train_loss: 1.0952, test_loss: 1.0504, test_f1: 0.4726
 epoch: 39, train_loss: 1.0914, test_loss: 1.0494, test_f1: 0.4760
 epoch: 40, train_loss: 1.0892, test_loss: 1.0491, test_f1: 0.4721
 epoch: 41, train_loss: 1.0977, test_loss: 1.0615, test_f1: 0.4498
 epoch: 42, train_loss: 1.0930, test_loss: 1.0560, test_f1: 0.4589
 epoch: 43, train_loss: 1.0878, test_loss: 1.0437, test_f1: 0.4798
 epoch: 44, train_loss: 1.0919, test_loss: 1.0384, test_f1: 0.4644
 epoch: 45, train_loss: 1.0824, test_loss: 1.0449, test_f1: 0.4868
 epoch: 46, train_loss: 1.0769, test_loss: 1.0324, test_f1: 0.4810
 epoch: 47, train_loss: 1.0745, test_loss: 1.0275, test_f1: 0.4846
 epoch: 48, train_loss: 1.0666, test_loss: 1.0236, test_f1: 0.4769
 epoch: 49, train_loss: 1.0672, test_loss: 1.0164, test_f1: 0.4723
 epoch: 50, train_loss: 1.0635, test_loss: 1.0230, test_f1: 0.4710
 epoch: 51, train_loss: 1.0683, test_loss: 1.0307, test_f1: 0.4783
 epoch: 52, train_loss: 1.0678, test_loss: 1.0362, test_f1: 0.4718
 epoch: 53, train_loss: 1.0577, test_loss: 1.0116, test_f1: 0.4795
 epoch: 54, train_loss: 1.0589, test_loss: 1.0315, test_f1: 0.4838
 epoch: 55, train_loss: 1.0564, test_loss: 1.0298, test_f1: 0.5034
 epoch: 56, train_loss: 1.0605, test_loss: 1.0206, test_f1: 0.4819
 epoch: 57, train_loss: 1.0547, test_loss: 1.0214, test_f1: 0.4929
 epoch: 58, train_loss: 1.0577, test_loss: 1.0035, test_f1: 0.4855
 epoch: 59, train_loss: 1.0605, test_loss: 1.0097, test_f1: 0.4849
 epoch: 60, train_loss: 1.0512, test_loss: 1.0103, test_f1: 0.4753
 epoch: 61, train_loss: 1.0527, test_loss: 1.0146, test_f1: 0.4632
 epoch: 62, train_loss: 1.0481, test_loss: 1.0043, test_f1: 0.4871
 epoch: 63, train_loss: 1.0446, test_loss: 1.0107, test_f1: 0.4570
 epoch: 64, train_loss: 1.0509, test_loss: 1.0197, test_f1: 0.4789
 epoch: 65, train_loss: 1.0460, test_loss: 1.0362, test_f1: 0.4608
 epoch: 66, train_loss: 1.0466, test_loss: 1.0146, test_f1: 0.4555
 epoch: 67, train_loss: 1.0554, test_loss: 1.0212, test_f1: 0.4665
 epoch: 68, train_loss: 1.0472, test_loss: 1.0268, test_f1: 0.4706
 epoch: 69, train_loss: 1.0374, test_loss: 1.0167, test_f1: 0.4665
 epoch: 70, train_loss: 1.0503, test_loss: 1.0149, test_f1: 0.4702
 epoch: 71, train_loss: 1.0414, test_loss: 1.0226, test_f1: 0.4907
 epoch: 72, train_loss: 1.0442, test_loss: 1.0092, test_f1: 0.4914
 epoch: 73, train_loss: 1.0463, test_loss: 1.0197, test_f1: 0.5018
 epoch: 74, train_loss: 1.0386, test_loss: 1.0162, test_f1: 0.4796
 epoch: 75, train_loss: 1.0497, test_loss: 1.0001, test_f1: 0.5010
 epoch: 76, train_loss: 1.0402, test_loss: 0.9945, test_f1: 0.5072
 epoch: 77, train_loss: 1.0367, test_loss: 1.0152, test_f1: 0.4658
 epoch: 78, train_loss: 1.0341, test_loss: 0.9939, test_f1: 0.4846
 epoch: 79, train_loss: 1.0395, test_loss: 1.0027, test_f1: 0.4810
 epoch: 80, train_loss: 1.0298, test_loss: 0.9928, test_f1: 0.4745
 epoch: 81, train_loss: 1.0345, test_loss: 0.9923, test_f1: 0.4779
 epoch: 82, train_loss: 1.0344, test_loss: 0.9977, test_f1: 0.4751
 epoch: 83, train_loss: 1.0219, test_loss: 1.0077, test_f1: 0.4935
 epoch: 84, train_loss: 1.0335, test_loss: 0.9909, test_f1: 0.4831
 epoch: 85, train_loss: 1.0459, test_loss: 1.0024, test_f1: 0.4652
 epoch: 86, train_loss: 1.0289, test_loss: 0.9958, test_f1: 0.4799
 epoch: 87, train_loss: 1.0319, test_loss: 0.9890, test_f1: 0.4984
 epoch: 88, train_loss: 1.0274, test_loss: 1.0056, test_f1: 0.4814
 epoch: 89, train_loss: 1.0270, test_loss: 0.9943, test_f1: 0.4726
 epoch: 90, train_loss: 1.0295, test_loss: 1.0018, test_f1: 0.4883
 epoch: 91, train_loss: 1.0180, test_loss: 0.9858, test_f1: 0.4693
 epoch: 92, train_loss: 1.0285, test_loss: 1.0049, test_f1: 0.4806
 epoch: 93, train_loss: 1.0236, test_loss: 0.9856, test_f1: 0.4855
 epoch: 94, train_loss: 1.0216, test_loss: 0.9914, test_f1: 0.4941
 epoch: 95, train_loss: 1.0164, test_loss: 1.0041, test_f1: 0.4844
 epoch: 96, train_loss: 1.0189, test_loss: 0.9938, test_f1: 0.4868
 epoch: 97, train_loss: 1.0144, test_loss: 0.9902, test_f1: 0.5055
 epoch: 98, train_loss: 1.0161, test_loss: 0.9898, test_f1: 0.4769
 epoch: 99, train_loss: 1.0154, test_loss: 1.0075, test_f1: 0.4915
##################ITERATION #7 ****************************************
 epoch: 0, train_loss: 1.3311, test_loss: 1.3588, test_f1: 0.2655
 epoch: 1, train_loss: 1.2852, test_loss: 1.3094, test_f1: 0.2753
 epoch: 2, train_loss: 1.2711, test_loss: 1.2808, test_f1: 0.2925
 epoch: 3, train_loss: 1.2520, test_loss: 1.3138, test_f1: 0.3172
 epoch: 4, train_loss: 1.2460, test_loss: 1.2767, test_f1: 0.3147
 epoch: 5, train_loss: 1.2379, test_loss: 1.2251, test_f1: 0.3344
 epoch: 6, train_loss: 1.2361, test_loss: 1.2413, test_f1: 0.3440
 epoch: 7, train_loss: 1.2311, test_loss: 1.2056, test_f1: 0.3587
 epoch: 8, train_loss: 1.2215, test_loss: 1.2409, test_f1: 0.3610
 epoch: 9, train_loss: 1.2224, test_loss: 1.1839, test_f1: 0.3668
 epoch: 10, train_loss: 1.2134, test_loss: 1.1900, test_f1: 0.3705
 epoch: 11, train_loss: 1.2066, test_loss: 1.1821, test_f1: 0.3860
 epoch: 12, train_loss: 1.1987, test_loss: 1.2421, test_f1: 0.3872
 epoch: 13, train_loss: 1.1997, test_loss: 1.1729, test_f1: 0.3943
 epoch: 14, train_loss: 1.1910, test_loss: 1.1960, test_f1: 0.4209
 epoch: 15, train_loss: 1.1974, test_loss: 1.1542, test_f1: 0.4215
 epoch: 16, train_loss: 1.1768, test_loss: 1.1445, test_f1: 0.4173
 epoch: 17, train_loss: 1.1756, test_loss: 1.1382, test_f1: 0.4348
 epoch: 18, train_loss: 1.1787, test_loss: 1.1413, test_f1: 0.4301
 epoch: 19, train_loss: 1.1778, test_loss: 1.1746, test_f1: 0.4356
 epoch: 20, train_loss: 1.1721, test_loss: 1.1432, test_f1: 0.4492
 epoch: 21, train_loss: 1.1585, test_loss: 1.1267, test_f1: 0.4559
 epoch: 22, train_loss: 1.1636, test_loss: 1.1251, test_f1: 0.4611
 epoch: 23, train_loss: 1.1524, test_loss: 1.1588, test_f1: 0.4646
 epoch: 24, train_loss: 1.1471, test_loss: 1.1192, test_f1: 0.4630
 epoch: 25, train_loss: 1.1402, test_loss: 1.1038, test_f1: 0.4640
 epoch: 26, train_loss: 1.1544, test_loss: 1.1129, test_f1: 0.4595
 epoch: 27, train_loss: 1.1375, test_loss: 1.0916, test_f1: 0.4582
 epoch: 28, train_loss: 1.1304, test_loss: 1.0867, test_f1: 0.4683
 epoch: 29, train_loss: 1.1309, test_loss: 1.1045, test_f1: 0.4543
 epoch: 30, train_loss: 1.1271, test_loss: 1.0793, test_f1: 0.4456
 epoch: 31, train_loss: 1.1274, test_loss: 1.0772, test_f1: 0.4608
 epoch: 32, train_loss: 1.1208, test_loss: 1.0825, test_f1: 0.4652
 epoch: 33, train_loss: 1.1202, test_loss: 1.0988, test_f1: 0.4681
 epoch: 34, train_loss: 1.1120, test_loss: 1.0786, test_f1: 0.4546
 epoch: 35, train_loss: 1.1137, test_loss: 1.0735, test_f1: 0.4650
 epoch: 36, train_loss: 1.1110, test_loss: 1.0894, test_f1: 0.4679
 epoch: 37, train_loss: 1.1094, test_loss: 1.0776, test_f1: 0.4627
 epoch: 38, train_loss: 1.1105, test_loss: 1.0812, test_f1: 0.4701
 epoch: 39, train_loss: 1.1127, test_loss: 1.0601, test_f1: 0.4706
 epoch: 40, train_loss: 1.1026, test_loss: 1.0613, test_f1: 0.4462
 epoch: 41, train_loss: 1.1026, test_loss: 1.0594, test_f1: 0.4697
 epoch: 42, train_loss: 1.1052, test_loss: 1.0494, test_f1: 0.4631
 epoch: 43, train_loss: 1.0952, test_loss: 1.0654, test_f1: 0.4718
 epoch: 44, train_loss: 1.0967, test_loss: 1.0514, test_f1: 0.4712
 epoch: 45, train_loss: 1.0850, test_loss: 1.0532, test_f1: 0.4824
 epoch: 46, train_loss: 1.0863, test_loss: 1.0462, test_f1: 0.4831
 epoch: 47, train_loss: 1.0919, test_loss: 1.0425, test_f1: 0.4523
 epoch: 48, train_loss: 1.0881, test_loss: 1.0390, test_f1: 0.4663
 epoch: 49, train_loss: 1.0806, test_loss: 1.0386, test_f1: 0.4629
 epoch: 50, train_loss: 1.0709, test_loss: 1.0440, test_f1: 0.4687
 epoch: 51, train_loss: 1.0824, test_loss: 1.0385, test_f1: 0.4616
 epoch: 52, train_loss: 1.0745, test_loss: 1.0426, test_f1: 0.4621
 epoch: 53, train_loss: 1.0748, test_loss: 1.0361, test_f1: 0.4773
 epoch: 54, train_loss: 1.0860, test_loss: 1.0333, test_f1: 0.4566
 epoch: 55, train_loss: 1.0690, test_loss: 1.0403, test_f1: 0.4629
 epoch: 56, train_loss: 1.0765, test_loss: 1.0401, test_f1: 0.4594
 epoch: 57, train_loss: 1.0752, test_loss: 1.0295, test_f1: 0.4691
 epoch: 58, train_loss: 1.0580, test_loss: 1.0330, test_f1: 0.4591
 epoch: 59, train_loss: 1.0698, test_loss: 1.0327, test_f1: 0.4610
 epoch: 60, train_loss: 1.0611, test_loss: 1.0301, test_f1: 0.4663
 epoch: 61, train_loss: 1.0522, test_loss: 1.0256, test_f1: 0.4554
 epoch: 62, train_loss: 1.0566, test_loss: 1.0274, test_f1: 0.4638
 epoch: 63, train_loss: 1.0607, test_loss: 1.0277, test_f1: 0.4621
 epoch: 64, train_loss: 1.0581, test_loss: 1.0335, test_f1: 0.4692
 epoch: 65, train_loss: 1.0649, test_loss: 1.0390, test_f1: 0.4537
 epoch: 66, train_loss: 1.0584, test_loss: 1.0270, test_f1: 0.4634
 epoch: 67, train_loss: 1.0576, test_loss: 1.0352, test_f1: 0.4687
 epoch: 68, train_loss: 1.0645, test_loss: 1.0272, test_f1: 0.4756
 epoch: 69, train_loss: 1.0558, test_loss: 1.0338, test_f1: 0.4630
 epoch: 70, train_loss: 1.0620, test_loss: 1.0274, test_f1: 0.4613
 epoch: 71, train_loss: 1.0475, test_loss: 1.0234, test_f1: 0.4505
 epoch: 72, train_loss: 1.0499, test_loss: 1.0326, test_f1: 0.4668
 epoch: 73, train_loss: 1.0466, test_loss: 1.0223, test_f1: 0.4803
 epoch: 74, train_loss: 1.0490, test_loss: 1.0300, test_f1: 0.4615
 epoch: 75, train_loss: 1.0480, test_loss: 1.0229, test_f1: 0.4640
 epoch: 76, train_loss: 1.0441, test_loss: 1.0341, test_f1: 0.4698
 epoch: 77, train_loss: 1.0534, test_loss: 1.0211, test_f1: 0.4742
 epoch: 78, train_loss: 1.0374, test_loss: 1.0211, test_f1: 0.4575
 epoch: 79, train_loss: 1.0454, test_loss: 1.0363, test_f1: 0.4523
 epoch: 80, train_loss: 1.0360, test_loss: 1.0254, test_f1: 0.4570
 epoch: 81, train_loss: 1.0435, test_loss: 1.0179, test_f1: 0.4716
 epoch: 82, train_loss: 1.0547, test_loss: 1.0328, test_f1: 0.4469
 epoch: 83, train_loss: 1.0493, test_loss: 1.0304, test_f1: 0.4713
 epoch: 84, train_loss: 1.0421, test_loss: 1.0209, test_f1: 0.4735
 epoch: 85, train_loss: 1.0411, test_loss: 1.0406, test_f1: 0.4679
 epoch: 86, train_loss: 1.0377, test_loss: 1.0236, test_f1: 0.4718
 epoch: 87, train_loss: 1.0376, test_loss: 1.0229, test_f1: 0.4648
 epoch: 88, train_loss: 1.0469, test_loss: 1.0326, test_f1: 0.4482
 epoch: 89, train_loss: 1.0319, test_loss: 1.0254, test_f1: 0.4610
 epoch: 90, train_loss: 1.0423, test_loss: 1.0144, test_f1: 0.4710
 epoch: 91, train_loss: 1.0261, test_loss: 1.0280, test_f1: 0.4594
 epoch: 92, train_loss: 1.0308, test_loss: 1.0155, test_f1: 0.4820
 epoch: 93, train_loss: 1.0298, test_loss: 1.0123, test_f1: 0.4896
 epoch: 94, train_loss: 1.0403, test_loss: 1.0390, test_f1: 0.4682
 epoch: 95, train_loss: 1.0343, test_loss: 1.0169, test_f1: 0.4805
 epoch: 96, train_loss: 1.0325, test_loss: 1.0291, test_f1: 0.4665
 epoch: 97, train_loss: 1.0379, test_loss: 1.0164, test_f1: 0.4655
 epoch: 98, train_loss: 1.0267, test_loss: 1.0252, test_f1: 0.4647
 epoch: 99, train_loss: 1.0322, test_loss: 1.0235, test_f1: 0.4744
##################ITERATION #8 ****************************************
 epoch: 0, train_loss: 1.2984, test_loss: 1.2624, test_f1: 0.2963
 epoch: 1, train_loss: 1.2584, test_loss: 1.2294, test_f1: 0.3406
 epoch: 2, train_loss: 1.2490, test_loss: 1.2155, test_f1: 0.3267
 epoch: 3, train_loss: 1.2380, test_loss: 1.2087, test_f1: 0.3402
 epoch: 4, train_loss: 1.2241, test_loss: 1.1933, test_f1: 0.3639
 epoch: 5, train_loss: 1.2100, test_loss: 1.1877, test_f1: 0.4106
 epoch: 6, train_loss: 1.2148, test_loss: 1.1679, test_f1: 0.4304
 epoch: 7, train_loss: 1.2042, test_loss: 1.1576, test_f1: 0.4177
 epoch: 8, train_loss: 1.1992, test_loss: 1.1494, test_f1: 0.4306
 epoch: 9, train_loss: 1.1906, test_loss: 1.1410, test_f1: 0.4423
 epoch: 10, train_loss: 1.1838, test_loss: 1.1284, test_f1: 0.4425
 epoch: 11, train_loss: 1.1810, test_loss: 1.1235, test_f1: 0.4549
 epoch: 12, train_loss: 1.1606, test_loss: 1.1174, test_f1: 0.4248
 epoch: 13, train_loss: 1.1520, test_loss: 1.1065, test_f1: 0.4494
 epoch: 14, train_loss: 1.1536, test_loss: 1.1030, test_f1: 0.4336
 epoch: 15, train_loss: 1.1459, test_loss: 1.1024, test_f1: 0.4630
 epoch: 16, train_loss: 1.1380, test_loss: 1.1073, test_f1: 0.4296
 epoch: 17, train_loss: 1.1356, test_loss: 1.0894, test_f1: 0.4482
 epoch: 18, train_loss: 1.1326, test_loss: 1.0835, test_f1: 0.4502
 epoch: 19, train_loss: 1.1329, test_loss: 1.0792, test_f1: 0.4568
 epoch: 20, train_loss: 1.1184, test_loss: 1.0796, test_f1: 0.4388
 epoch: 21, train_loss: 1.1197, test_loss: 1.0673, test_f1: 0.4584
 epoch: 22, train_loss: 1.1143, test_loss: 1.0728, test_f1: 0.4550
 epoch: 23, train_loss: 1.1117, test_loss: 1.0766, test_f1: 0.4393
 epoch: 24, train_loss: 1.1076, test_loss: 1.0641, test_f1: 0.4389
 epoch: 25, train_loss: 1.0934, test_loss: 1.0533, test_f1: 0.4635
 epoch: 26, train_loss: 1.1000, test_loss: 1.0488, test_f1: 0.4431
 epoch: 27, train_loss: 1.0890, test_loss: 1.0459, test_f1: 0.4505
 epoch: 28, train_loss: 1.0907, test_loss: 1.0451, test_f1: 0.4482
 epoch: 29, train_loss: 1.0829, test_loss: 1.0430, test_f1: 0.4600
 epoch: 30, train_loss: 1.0804, test_loss: 1.0453, test_f1: 0.4428
 epoch: 31, train_loss: 1.0820, test_loss: 1.0352, test_f1: 0.4635
 epoch: 32, train_loss: 1.0704, test_loss: 1.0339, test_f1: 0.4533
 epoch: 33, train_loss: 1.0658, test_loss: 1.0235, test_f1: 0.4674
 epoch: 34, train_loss: 1.0714, test_loss: 1.0179, test_f1: 0.4576
 epoch: 35, train_loss: 1.0696, test_loss: 1.0087, test_f1: 0.4732
 epoch: 36, train_loss: 1.0570, test_loss: 1.0121, test_f1: 0.4670
 epoch: 37, train_loss: 1.0619, test_loss: 1.0172, test_f1: 0.4680
 epoch: 38, train_loss: 1.0596, test_loss: 1.0102, test_f1: 0.4553
 epoch: 39, train_loss: 1.0478, test_loss: 1.0043, test_f1: 0.4733
 epoch: 40, train_loss: 1.0530, test_loss: 1.0092, test_f1: 0.4549
 epoch: 41, train_loss: 1.0489, test_loss: 0.9991, test_f1: 0.4658
 epoch: 42, train_loss: 1.0430, test_loss: 1.0100, test_f1: 0.4600
 epoch: 43, train_loss: 1.0557, test_loss: 0.9994, test_f1: 0.4719
 epoch: 44, train_loss: 1.0421, test_loss: 1.0077, test_f1: 0.4582
 epoch: 45, train_loss: 1.0413, test_loss: 1.0169, test_f1: 0.4524
 epoch: 46, train_loss: 1.0420, test_loss: 1.0012, test_f1: 0.4598
 epoch: 47, train_loss: 1.0351, test_loss: 0.9965, test_f1: 0.4638
 epoch: 48, train_loss: 1.0359, test_loss: 1.0038, test_f1: 0.4636
 epoch: 49, train_loss: 1.0194, test_loss: 0.9825, test_f1: 0.4622
 epoch: 50, train_loss: 1.0309, test_loss: 1.0033, test_f1: 0.4577
 epoch: 51, train_loss: 1.0207, test_loss: 0.9915, test_f1: 0.4654
 epoch: 52, train_loss: 1.0247, test_loss: 0.9938, test_f1: 0.4504
 epoch: 53, train_loss: 1.0273, test_loss: 0.9896, test_f1: 0.4657
 epoch: 54, train_loss: 1.0142, test_loss: 0.9966, test_f1: 0.4569
 epoch: 55, train_loss: 1.0289, test_loss: 0.9751, test_f1: 0.4581
 epoch: 56, train_loss: 1.0162, test_loss: 0.9893, test_f1: 0.4580
 epoch: 57, train_loss: 1.0147, test_loss: 0.9645, test_f1: 0.4642
 epoch: 58, train_loss: 1.0085, test_loss: 0.9968, test_f1: 0.4595
 epoch: 59, train_loss: 0.9941, test_loss: 0.9702, test_f1: 0.4657
 epoch: 60, train_loss: 1.0099, test_loss: 0.9917, test_f1: 0.4557
 epoch: 61, train_loss: 1.0061, test_loss: 0.9809, test_f1: 0.4663
 epoch: 62, train_loss: 1.0100, test_loss: 0.9805, test_f1: 0.4596
 epoch: 63, train_loss: 1.0158, test_loss: 0.9875, test_f1: 0.4518
 epoch: 64, train_loss: 1.0185, test_loss: 0.9736, test_f1: 0.4604
 epoch: 65, train_loss: 1.0084, test_loss: 0.9810, test_f1: 0.4606
 epoch: 66, train_loss: 1.0037, test_loss: 0.9645, test_f1: 0.4591
 epoch: 67, train_loss: 1.0038, test_loss: 0.9782, test_f1: 0.4637
 epoch: 68, train_loss: 1.0015, test_loss: 0.9755, test_f1: 0.4667
 epoch: 69, train_loss: 1.0032, test_loss: 0.9739, test_f1: 0.4674
 epoch: 70, train_loss: 1.0075, test_loss: 0.9768, test_f1: 0.4554
 epoch: 71, train_loss: 1.0017, test_loss: 0.9797, test_f1: 0.4569
 epoch: 72, train_loss: 1.0041, test_loss: 0.9910, test_f1: 0.4607
 epoch: 73, train_loss: 0.9995, test_loss: 0.9722, test_f1: 0.4668
 epoch: 74, train_loss: 1.0042, test_loss: 0.9775, test_f1: 0.4683
 epoch: 75, train_loss: 0.9998, test_loss: 0.9693, test_f1: 0.4594
 epoch: 76, train_loss: 1.0048, test_loss: 0.9774, test_f1: 0.4654
 epoch: 77, train_loss: 0.9899, test_loss: 0.9663, test_f1: 0.4596
 epoch: 78, train_loss: 0.9997, test_loss: 0.9545, test_f1: 0.4815
 epoch: 79, train_loss: 0.9976, test_loss: 0.9721, test_f1: 0.4624
 epoch: 80, train_loss: 1.0022, test_loss: 0.9760, test_f1: 0.4628
 epoch: 81, train_loss: 0.9891, test_loss: 0.9706, test_f1: 0.4685
 epoch: 82, train_loss: 0.9923, test_loss: 0.9767, test_f1: 0.4565
 epoch: 83, train_loss: 0.9813, test_loss: 0.9689, test_f1: 0.4626
 epoch: 84, train_loss: 0.9934, test_loss: 0.9627, test_f1: 0.4709
 epoch: 85, train_loss: 0.9862, test_loss: 0.9576, test_f1: 0.4717
 epoch: 86, train_loss: 0.9828, test_loss: 0.9613, test_f1: 0.4650
 epoch: 87, train_loss: 0.9916, test_loss: 0.9928, test_f1: 0.4515
 epoch: 88, train_loss: 0.9805, test_loss: 0.9805, test_f1: 0.4638
 epoch: 89, train_loss: 0.9866, test_loss: 0.9670, test_f1: 0.4588
 epoch: 90, train_loss: 0.9873, test_loss: 0.9794, test_f1: 0.4470
 epoch: 91, train_loss: 0.9901, test_loss: 0.9827, test_f1: 0.4623
 epoch: 92, train_loss: 0.9841, test_loss: 0.9741, test_f1: 0.4620
 epoch: 93, train_loss: 0.9831, test_loss: 0.9597, test_f1: 0.4753
 epoch: 94, train_loss: 0.9802, test_loss: 0.9498, test_f1: 0.4748
 epoch: 95, train_loss: 0.9837, test_loss: 0.9606, test_f1: 0.4647
 epoch: 96, train_loss: 0.9794, test_loss: 0.9694, test_f1: 0.4674
 epoch: 97, train_loss: 0.9690, test_loss: 0.9792, test_f1: 0.4628
 epoch: 98, train_loss: 0.9682, test_loss: 0.9762, test_f1: 0.4626
 epoch: 99, train_loss: 0.9840, test_loss: 0.9878, test_f1: 0.4588
##################ITERATION #9 ****************************************
 epoch: 0, train_loss: 1.3544, test_loss: 1.2641, test_f1: 0.2675
 epoch: 1, train_loss: 1.2696, test_loss: 1.2366, test_f1: 0.2886
 epoch: 2, train_loss: 1.2531, test_loss: 1.2143, test_f1: 0.3667
 epoch: 3, train_loss: 1.2443, test_loss: 1.2097, test_f1: 0.3507
 epoch: 4, train_loss: 1.2269, test_loss: 1.1925, test_f1: 0.3867
 epoch: 5, train_loss: 1.2292, test_loss: 1.1861, test_f1: 0.3922
 epoch: 6, train_loss: 1.2127, test_loss: 1.1739, test_f1: 0.3993
 epoch: 7, train_loss: 1.2093, test_loss: 1.1687, test_f1: 0.3827
 epoch: 8, train_loss: 1.2022, test_loss: 1.1592, test_f1: 0.4004
 epoch: 9, train_loss: 1.1971, test_loss: 1.1576, test_f1: 0.3858
 epoch: 10, train_loss: 1.1934, test_loss: 1.1542, test_f1: 0.3900
 epoch: 11, train_loss: 1.1916, test_loss: 1.1430, test_f1: 0.3941
 epoch: 12, train_loss: 1.1880, test_loss: 1.1404, test_f1: 0.3970
 epoch: 13, train_loss: 1.1736, test_loss: 1.1347, test_f1: 0.4061
 epoch: 14, train_loss: 1.1742, test_loss: 1.1344, test_f1: 0.4151
 epoch: 15, train_loss: 1.1629, test_loss: 1.1254, test_f1: 0.4155
 epoch: 16, train_loss: 1.1611, test_loss: 1.1188, test_f1: 0.4245
 epoch: 17, train_loss: 1.1586, test_loss: 1.1157, test_f1: 0.4311
 epoch: 18, train_loss: 1.1487, test_loss: 1.1174, test_f1: 0.4237
 epoch: 19, train_loss: 1.1423, test_loss: 1.1122, test_f1: 0.4223
 epoch: 20, train_loss: 1.1379, test_loss: 1.1004, test_f1: 0.4251
 epoch: 21, train_loss: 1.1371, test_loss: 1.1011, test_f1: 0.4187
 epoch: 22, train_loss: 1.1340, test_loss: 1.0940, test_f1: 0.4348
 epoch: 23, train_loss: 1.1331, test_loss: 1.0925, test_f1: 0.4271
 epoch: 24, train_loss: 1.1284, test_loss: 1.0894, test_f1: 0.4466
 epoch: 25, train_loss: 1.1306, test_loss: 1.0869, test_f1: 0.4255
 epoch: 26, train_loss: 1.1259, test_loss: 1.0728, test_f1: 0.4353
 epoch: 27, train_loss: 1.1240, test_loss: 1.0666, test_f1: 0.4445
 epoch: 28, train_loss: 1.1239, test_loss: 1.0736, test_f1: 0.4338
 epoch: 29, train_loss: 1.1148, test_loss: 1.0690, test_f1: 0.4331
 epoch: 30, train_loss: 1.1086, test_loss: 1.0836, test_f1: 0.4190
 epoch: 31, train_loss: 1.1093, test_loss: 1.0597, test_f1: 0.4439
 epoch: 32, train_loss: 1.0996, test_loss: 1.0772, test_f1: 0.4379
 epoch: 33, train_loss: 1.1103, test_loss: 1.0897, test_f1: 0.4210
 epoch: 34, train_loss: 1.0963, test_loss: 1.0489, test_f1: 0.4330
 epoch: 35, train_loss: 1.1003, test_loss: 1.0571, test_f1: 0.4547
 epoch: 36, train_loss: 1.1017, test_loss: 1.0521, test_f1: 0.4316
 epoch: 37, train_loss: 1.1006, test_loss: 1.0752, test_f1: 0.4342
 epoch: 38, train_loss: 1.0783, test_loss: 1.0627, test_f1: 0.4229
 epoch: 39, train_loss: 1.0775, test_loss: 1.0576, test_f1: 0.4152
 epoch: 40, train_loss: 1.0827, test_loss: 1.0582, test_f1: 0.4308
 epoch: 41, train_loss: 1.0773, test_loss: 1.0677, test_f1: 0.4299
 epoch: 42, train_loss: 1.0801, test_loss: 1.0316, test_f1: 0.4468
 epoch: 43, train_loss: 1.0734, test_loss: 1.0685, test_f1: 0.4413
 epoch: 44, train_loss: 1.0763, test_loss: 1.0437, test_f1: 0.4261
 epoch: 45, train_loss: 1.0634, test_loss: 1.0581, test_f1: 0.4489
 epoch: 46, train_loss: 1.0661, test_loss: 1.1028, test_f1: 0.4469
 epoch: 47, train_loss: 1.0600, test_loss: 1.1073, test_f1: 0.4351
 epoch: 48, train_loss: 1.0616, test_loss: 1.1266, test_f1: 0.4562
 epoch: 49, train_loss: 1.0642, test_loss: 1.0274, test_f1: 0.4506
 epoch: 50, train_loss: 1.0513, test_loss: 1.0951, test_f1: 0.4331
 epoch: 51, train_loss: 1.0572, test_loss: 1.1346, test_f1: 0.4434
 epoch: 52, train_loss: 1.0487, test_loss: 1.1182, test_f1: 0.4412
 epoch: 53, train_loss: 1.0484, test_loss: 1.1212, test_f1: 0.4506
 epoch: 54, train_loss: 1.0517, test_loss: 1.1484, test_f1: 0.4578
 epoch: 55, train_loss: 1.0460, test_loss: 1.0783, test_f1: 0.4648
 epoch: 56, train_loss: 1.0578, test_loss: 1.0771, test_f1: 0.4494
 epoch: 57, train_loss: 1.0360, test_loss: 1.0378, test_f1: 0.4559
 epoch: 58, train_loss: 1.0326, test_loss: 1.0130, test_f1: 0.4638
 epoch: 59, train_loss: 1.0354, test_loss: 1.0034, test_f1: 0.4677
 epoch: 60, train_loss: 1.0522, test_loss: 1.0093, test_f1: 0.4572
 epoch: 61, train_loss: 1.0421, test_loss: 1.0344, test_f1: 0.4553
 epoch: 62, train_loss: 1.0347, test_loss: 1.0800, test_f1: 0.4562
 epoch: 63, train_loss: 1.0437, test_loss: 1.0287, test_f1: 0.4535
 epoch: 64, train_loss: 1.0329, test_loss: 1.0537, test_f1: 0.4477
 epoch: 65, train_loss: 1.0281, test_loss: 1.0229, test_f1: 0.4514
 epoch: 66, train_loss: 1.0389, test_loss: 1.0029, test_f1: 0.4541
 epoch: 67, train_loss: 1.0422, test_loss: 1.0449, test_f1: 0.4490
 epoch: 68, train_loss: 1.0438, test_loss: 1.0893, test_f1: 0.4513
 epoch: 69, train_loss: 1.0207, test_loss: 1.0819, test_f1: 0.4672
 epoch: 70, train_loss: 1.0278, test_loss: 1.1113, test_f1: 0.4447
 epoch: 71, train_loss: 1.0206, test_loss: 1.1807, test_f1: 0.4762
 epoch: 72, train_loss: 1.0338, test_loss: 1.0793, test_f1: 0.4541
 epoch: 73, train_loss: 1.0366, test_loss: 1.0479, test_f1: 0.4541
 epoch: 74, train_loss: 1.0212, test_loss: 1.0341, test_f1: 0.4545
 epoch: 75, train_loss: 1.0309, test_loss: 1.0644, test_f1: 0.4565
 epoch: 76, train_loss: 1.0325, test_loss: 1.1007, test_f1: 0.4689
 epoch: 77, train_loss: 1.0162, test_loss: 1.1108, test_f1: 0.4754
 epoch: 78, train_loss: 1.0217, test_loss: 1.0646, test_f1: 0.4615
 epoch: 79, train_loss: 1.0194, test_loss: 1.0187, test_f1: 0.4501
 epoch: 80, train_loss: 1.0311, test_loss: 1.0864, test_f1: 0.4529
 epoch: 81, train_loss: 1.0183, test_loss: 1.0903, test_f1: 0.4696
 epoch: 82, train_loss: 1.0188, test_loss: 1.1720, test_f1: 0.4659
 epoch: 83, train_loss: 1.0186, test_loss: 1.0121, test_f1: 0.4534
 epoch: 84, train_loss: 1.0213, test_loss: 1.0440, test_f1: 0.4601
 epoch: 85, train_loss: 1.0211, test_loss: 1.0209, test_f1: 0.4562
 epoch: 86, train_loss: 1.0158, test_loss: 1.0808, test_f1: 0.4741
 epoch: 87, train_loss: 1.0252, test_loss: 0.9872, test_f1: 0.4741
 epoch: 88, train_loss: 1.0112, test_loss: 1.0453, test_f1: 0.4583
 epoch: 89, train_loss: 1.0067, test_loss: 1.0296, test_f1: 0.4639
 epoch: 90, train_loss: 1.0083, test_loss: 1.0368, test_f1: 0.4403
 epoch: 91, train_loss: 1.0075, test_loss: 1.0653, test_f1: 0.4471
 epoch: 92, train_loss: 1.0115, test_loss: 1.0688, test_f1: 0.4858
 epoch: 93, train_loss: 1.0134, test_loss: 1.0333, test_f1: 0.4577
 epoch: 94, train_loss: 1.0013, test_loss: 1.0572, test_f1: 0.4373
 epoch: 95, train_loss: 1.0045, test_loss: 1.1622, test_f1: 0.4700
 epoch: 96, train_loss: 1.0042, test_loss: 0.9964, test_f1: 0.4714
 epoch: 97, train_loss: 0.9932, test_loss: 1.0105, test_f1: 0.4474
 epoch: 98, train_loss: 1.0126, test_loss: 1.0171, test_f1: 0.4732
 epoch: 99, train_loss: 1.0039, test_loss: 1.0501, test_f1: 0.4684

Training completed in 1132.98 seconds
Best F1: 0.5072 at epoch 76
Mean F1 across iterations: 0.4870  0.0104
========================FINAL RESULTS================================
FEGIN weighted F1: 0.5072  0.0104
python main.py --data ltspice_examples --representation component_component --model FEGIN --layers 4 --hiddens 32 --batch_size 32 --lr 0.0001 --emb_size 250 --epochs 100 --save_appendix component_component_L4_H32_BS32_LR0.0001_E250 --no_val
-----



STDERR:
  File "main.py", line 370, in <module>
    main()
  File "main.py", line 254, in main
    dataset = dataset_class(
  File "/home/philip/projects/ltspice_examples_code_repo/Circuit-Completion-Using-GNNs/component_classification_with_link_prediction_head/evaluation/FEGIN/kernel/circuit_datasets.py", line 15, in __init__
    self.data, self.slices = torch.load(self.processed_paths[0])
  File "/home/philip/.local/lib/python3.8/site-packages/torch/serialization.py", line 1040, in load
    warnings.warn(
  File "/usr/lib/python3.8/warnings.py", line 109, in _showwarnmsg
    sw(msg.message, msg.category, msg.filename, msg.lineno,
  File "main.py", line 47, in warn_with_traceback
    traceback.print_stack(file=log)
/home/philip/projects/ltspice_examples_code_repo/Circuit-Completion-Using-GNNs/component_classification_with_link_prediction_head/evaluation/FEGIN/kernel/circuit_datasets.py:15: FutureWarning: You are using `torch.load` with `weights_only=False` (the current default value), which uses the default pickle module implicitly. It is possible to construct malicious pickle data which will execute arbitrary code during unpickling (See https://github.com/pytorch/pytorch/blob/main/SECURITY.md#untrusted-models for more details). In a future release, the default value for `weights_only` will be flipped to `True`. This limits the functions that could be executed during unpickling. Arbitrary objects will no longer be allowed to be loaded via this mode unless they are explicitly allowlisted by the user via `torch.serialization.add_safe_globals`. We recommend you start setting `weights_only=True` for any use case where you don't have full control of the loaded file. Please open an issue on GitHub for any issues related to this experimental feature.
  self.data, self.slices = torch.load(self.processed_paths[0])
