STDOUT:
Results will be saved in /home/philip/projects/ltspice_examples_code_repo/Circuit-Completion-Using-GNNs/component_classification_with_link_prediction_head/evaluation/FEGIN/results/model_FEGIN_dataset_ltspice_examples
Command line input: python main.py --data ltspice_examples --representation component_pin --model FEGIN --layers 2 --hiddens 128 --batch_size 64 --lr 0.01 --emb_size 512 --epochs 100 --save_appendix component_pin_L2_H128_BS64_LR0.01_E512 --no_val
 is saved.
-----
ltspice_examples - FEGIN
Using 2 layers, 128 hidden units, h = 2
Loading component_pin representation dataset
ENTERED
Training FEGIN on component_pin representation
Train: 3560, Test: 848
##################ITERATION #0 ****************************************
 epoch: 0, train_loss: 1.1622, test_loss: 1.0727, test_f1: 0.3973
 epoch: 1, train_loss: 1.0164, test_loss: 0.9575, test_f1: 0.5458
 epoch: 2, train_loss: 0.9603, test_loss: 0.9740, test_f1: 0.4920
 epoch: 3, train_loss: 0.9251, test_loss: 0.9583, test_f1: 0.4848
 epoch: 4, train_loss: 0.8934, test_loss: 0.8553, test_f1: 0.5542
 epoch: 5, train_loss: 0.8681, test_loss: 0.9077, test_f1: 0.5011
 epoch: 6, train_loss: 0.8430, test_loss: 0.8683, test_f1: 0.5475
 epoch: 7, train_loss: 0.8485, test_loss: 0.9196, test_f1: 0.5459
 epoch: 8, train_loss: 0.8489, test_loss: 0.8597, test_f1: 0.5397
 epoch: 9, train_loss: 0.8159, test_loss: 0.8235, test_f1: 0.6099
 epoch: 10, train_loss: 0.7931, test_loss: 0.9104, test_f1: 0.5868
 epoch: 11, train_loss: 0.7768, test_loss: 0.9920, test_f1: 0.5243
 epoch: 12, train_loss: 0.7679, test_loss: 0.9295, test_f1: 0.5517
 epoch: 13, train_loss: 0.7462, test_loss: 0.8418, test_f1: 0.5451
 epoch: 14, train_loss: 0.7518, test_loss: 0.8532, test_f1: 0.6024
 epoch: 15, train_loss: 0.7511, test_loss: 0.9215, test_f1: 0.5358
 epoch: 16, train_loss: 0.7372, test_loss: 0.8758, test_f1: 0.5955
 epoch: 17, train_loss: 0.7209, test_loss: 1.0563, test_f1: 0.6026
 epoch: 18, train_loss: 0.7214, test_loss: 0.9189, test_f1: 0.6259
 epoch: 19, train_loss: 0.7360, test_loss: 1.0056, test_f1: 0.5748
 epoch: 20, train_loss: 0.6973, test_loss: 0.8393, test_f1: 0.6081
 epoch: 21, train_loss: 0.6945, test_loss: 0.8369, test_f1: 0.5754
 epoch: 22, train_loss: 0.6785, test_loss: 1.0129, test_f1: 0.5987
 epoch: 23, train_loss: 0.6805, test_loss: 0.9090, test_f1: 0.6443
 epoch: 24, train_loss: 0.6675, test_loss: 1.0224, test_f1: 0.6274
 epoch: 25, train_loss: 0.6666, test_loss: 1.1082, test_f1: 0.6072
 epoch: 26, train_loss: 0.6524, test_loss: 0.9003, test_f1: 0.6427
 epoch: 27, train_loss: 0.6278, test_loss: 1.0470, test_f1: 0.5711
 epoch: 28, train_loss: 0.6182, test_loss: 1.1436, test_f1: 0.6433
 epoch: 29, train_loss: 0.6321, test_loss: 0.8003, test_f1: 0.6482
 epoch: 30, train_loss: 0.6334, test_loss: 0.9071, test_f1: 0.6215
 epoch: 31, train_loss: 0.6195, test_loss: 0.9688, test_f1: 0.6161
 epoch: 32, train_loss: 0.6159, test_loss: 1.4673, test_f1: 0.5970
 epoch: 33, train_loss: 0.6095, test_loss: 1.3143, test_f1: 0.6528
 epoch: 34, train_loss: 0.5943, test_loss: 1.6027, test_f1: 0.6237
 epoch: 35, train_loss: 0.5809, test_loss: 1.0423, test_f1: 0.6385
 epoch: 36, train_loss: 0.5744, test_loss: 0.8356, test_f1: 0.6289
 epoch: 37, train_loss: 0.5611, test_loss: 1.1525, test_f1: 0.6127
 epoch: 38, train_loss: 0.5746, test_loss: 0.9177, test_f1: 0.6335
 epoch: 39, train_loss: 0.5660, test_loss: 1.6644, test_f1: 0.6002
 epoch: 40, train_loss: 0.5393, test_loss: 1.1575, test_f1: 0.6303
 epoch: 41, train_loss: 0.5363, test_loss: 1.3595, test_f1: 0.6320
 epoch: 42, train_loss: 0.5246, test_loss: 0.9279, test_f1: 0.6461
 epoch: 43, train_loss: 0.5416, test_loss: 1.2201, test_f1: 0.6154
 epoch: 44, train_loss: 0.5317, test_loss: 1.1989, test_f1: 0.6334
 epoch: 45, train_loss: 0.5286, test_loss: 1.1198, test_f1: 0.6481
 epoch: 46, train_loss: 0.5407, test_loss: 0.9130, test_f1: 0.5909
 epoch: 47, train_loss: 0.5250, test_loss: 0.9940, test_f1: 0.6859
 epoch: 48, train_loss: 0.5034, test_loss: 1.0439, test_f1: 0.6739
 epoch: 49, train_loss: 0.5020, test_loss: 1.6881, test_f1: 0.6218
 epoch: 50, train_loss: 0.4978, test_loss: 1.1256, test_f1: 0.6610
 epoch: 51, train_loss: 0.4544, test_loss: 1.1432, test_f1: 0.6795
 epoch: 52, train_loss: 0.4385, test_loss: 1.5086, test_f1: 0.6597
 epoch: 53, train_loss: 0.4481, test_loss: 1.1981, test_f1: 0.6848
 epoch: 54, train_loss: 0.4070, test_loss: 1.3906, test_f1: 0.6461
 epoch: 55, train_loss: 0.3976, test_loss: 1.6238, test_f1: 0.6810
 epoch: 56, train_loss: 0.3958, test_loss: 1.4123, test_f1: 0.6788
 epoch: 57, train_loss: 0.3876, test_loss: 1.5760, test_f1: 0.6707
 epoch: 58, train_loss: 0.3889, test_loss: 1.5783, test_f1: 0.6731
 epoch: 59, train_loss: 0.3932, test_loss: 1.1207, test_f1: 0.6850
 epoch: 60, train_loss: 0.3889, test_loss: 1.0248, test_f1: 0.6609
 epoch: 61, train_loss: 0.3885, test_loss: 1.3215, test_f1: 0.6792
 epoch: 62, train_loss: 0.4017, test_loss: 1.4476, test_f1: 0.6612
 epoch: 63, train_loss: 0.3943, test_loss: 1.1618, test_f1: 0.6807
 epoch: 64, train_loss: 0.3731, test_loss: 1.2861, test_f1: 0.6776
 epoch: 65, train_loss: 0.3442, test_loss: 1.2811, test_f1: 0.6796
 epoch: 66, train_loss: 0.3435, test_loss: 1.6118, test_f1: 0.6525
 epoch: 67, train_loss: 0.3641, test_loss: 1.1641, test_f1: 0.6533
 epoch: 68, train_loss: 0.3846, test_loss: 1.0671, test_f1: 0.6860
 epoch: 69, train_loss: 0.3557, test_loss: 1.4345, test_f1: 0.6550
 epoch: 70, train_loss: 0.3516, test_loss: 1.5341, test_f1: 0.6721
 epoch: 71, train_loss: 0.3353, test_loss: 1.4179, test_f1: 0.6881
 epoch: 72, train_loss: 0.3195, test_loss: 1.4219, test_f1: 0.6515
 epoch: 73, train_loss: 0.3232, test_loss: 1.3365, test_f1: 0.6685
 epoch: 74, train_loss: 0.3394, test_loss: 1.4753, test_f1: 0.6751
 epoch: 75, train_loss: 0.3284, test_loss: 1.5332, test_f1: 0.6817
 epoch: 76, train_loss: 0.3146, test_loss: 1.4732, test_f1: 0.6689
 epoch: 77, train_loss: 0.3352, test_loss: 1.5882, test_f1: 0.6769
 epoch: 78, train_loss: 0.3199, test_loss: 1.6442, test_f1: 0.6631
 epoch: 79, train_loss: 0.2875, test_loss: 1.8721, test_f1: 0.6727
 epoch: 80, train_loss: 0.2984, test_loss: 1.9744, test_f1: 0.6484
 epoch: 81, train_loss: 0.2931, test_loss: 1.6373, test_f1: 0.7001
 epoch: 82, train_loss: 0.3071, test_loss: 1.9515, test_f1: 0.6771
 epoch: 83, train_loss: 0.2995, test_loss: 1.3100, test_f1: 0.6730
 epoch: 84, train_loss: 0.3105, test_loss: 1.6793, test_f1: 0.6985
 epoch: 85, train_loss: 0.3010, test_loss: 1.4090, test_f1: 0.6852
 epoch: 86, train_loss: 0.2937, test_loss: 1.4077, test_f1: 0.6868
 epoch: 87, train_loss: 0.2887, test_loss: 1.6731, test_f1: 0.6826
 epoch: 88, train_loss: 0.2970, test_loss: 1.7267, test_f1: 0.6699
 epoch: 89, train_loss: 0.2886, test_loss: 1.4755, test_f1: 0.6719
 epoch: 90, train_loss: 0.2974, test_loss: 1.5656, test_f1: 0.6935
 epoch: 91, train_loss: 0.3110, test_loss: 1.6331, test_f1: 0.6811
 epoch: 92, train_loss: 0.2760, test_loss: 1.7422, test_f1: 0.7140
 epoch: 93, train_loss: 0.2801, test_loss: 1.9675, test_f1: 0.6364
 epoch: 94, train_loss: 0.2925, test_loss: 1.7342, test_f1: 0.6803
 epoch: 95, train_loss: 0.2609, test_loss: 1.7945, test_f1: 0.6497
 epoch: 96, train_loss: 0.2623, test_loss: 1.6240, test_f1: 0.6687
 epoch: 97, train_loss: 0.2640, test_loss: 2.1633, test_f1: 0.6810
 epoch: 98, train_loss: 0.2647, test_loss: 1.8750, test_f1: 0.6718
 epoch: 99, train_loss: 0.2864, test_loss: 1.9177, test_f1: 0.6757
##################ITERATION #1 ****************************************
 epoch: 0, train_loss: 1.1656, test_loss: 1.1336, test_f1: 0.4268
 epoch: 1, train_loss: 0.9975, test_loss: 1.2402, test_f1: 0.3641
 epoch: 2, train_loss: 0.9453, test_loss: 1.0198, test_f1: 0.4730
 epoch: 3, train_loss: 0.9168, test_loss: 0.9179, test_f1: 0.5276
 epoch: 4, train_loss: 0.8940, test_loss: 1.0064, test_f1: 0.4943
 epoch: 5, train_loss: 0.8710, test_loss: 1.0702, test_f1: 0.4929
 epoch: 6, train_loss: 0.8528, test_loss: 0.9283, test_f1: 0.5854
 epoch: 7, train_loss: 0.8361, test_loss: 0.9342, test_f1: 0.5440
 epoch: 8, train_loss: 0.8334, test_loss: 0.9628, test_f1: 0.5010
 epoch: 9, train_loss: 0.8463, test_loss: 0.9951, test_f1: 0.5227
 epoch: 10, train_loss: 0.8237, test_loss: 0.9378, test_f1: 0.5199
 epoch: 11, train_loss: 0.8083, test_loss: 0.9054, test_f1: 0.5660
 epoch: 12, train_loss: 0.7868, test_loss: 0.7997, test_f1: 0.6128
 epoch: 13, train_loss: 0.7602, test_loss: 0.8228, test_f1: 0.6167
 epoch: 14, train_loss: 0.7613, test_loss: 0.7700, test_f1: 0.6201
 epoch: 15, train_loss: 0.7263, test_loss: 0.9732, test_f1: 0.5684
 epoch: 16, train_loss: 0.7492, test_loss: 0.8292, test_f1: 0.5960
 epoch: 17, train_loss: 0.7175, test_loss: 0.9232, test_f1: 0.5600
 epoch: 18, train_loss: 0.6975, test_loss: 0.7186, test_f1: 0.6553
 epoch: 19, train_loss: 0.6983, test_loss: 0.8271, test_f1: 0.6596
 epoch: 20, train_loss: 0.6848, test_loss: 1.2794, test_f1: 0.5106
 epoch: 21, train_loss: 0.6738, test_loss: 0.8932, test_f1: 0.6057
 epoch: 22, train_loss: 0.6996, test_loss: 0.9535, test_f1: 0.6352
 epoch: 23, train_loss: 0.6603, test_loss: 0.8321, test_f1: 0.6144
 epoch: 24, train_loss: 0.6673, test_loss: 0.8249, test_f1: 0.6377
 epoch: 25, train_loss: 0.6468, test_loss: 0.8798, test_f1: 0.6251
 epoch: 26, train_loss: 0.6164, test_loss: 1.0104, test_f1: 0.5825
 epoch: 27, train_loss: 0.6276, test_loss: 1.0759, test_f1: 0.5588
 epoch: 28, train_loss: 0.6470, test_loss: 1.0648, test_f1: 0.6217
 epoch: 29, train_loss: 0.6264, test_loss: 0.8545, test_f1: 0.6264
 epoch: 30, train_loss: 0.6302, test_loss: 0.9761, test_f1: 0.6010
 epoch: 31, train_loss: 0.5945, test_loss: 0.9714, test_f1: 0.6167
 epoch: 32, train_loss: 0.5679, test_loss: 1.1708, test_f1: 0.5970
 epoch: 33, train_loss: 0.5620, test_loss: 0.9553, test_f1: 0.6406
 epoch: 34, train_loss: 0.5961, test_loss: 1.0249, test_f1: 0.6073
 epoch: 35, train_loss: 0.5795, test_loss: 1.1174, test_f1: 0.5951
 epoch: 36, train_loss: 0.5505, test_loss: 0.9924, test_f1: 0.6411
 epoch: 37, train_loss: 0.5565, test_loss: 0.9129, test_f1: 0.6498
 epoch: 38, train_loss: 0.5792, test_loss: 0.8715, test_f1: 0.6544
 epoch: 39, train_loss: 0.5272, test_loss: 1.0299, test_f1: 0.5920
 epoch: 40, train_loss: 0.5472, test_loss: 0.8713, test_f1: 0.6182
 epoch: 41, train_loss: 0.5081, test_loss: 1.2877, test_f1: 0.6368
 epoch: 42, train_loss: 0.5505, test_loss: 1.2217, test_f1: 0.6330
 epoch: 43, train_loss: 0.5397, test_loss: 0.9866, test_f1: 0.5864
 epoch: 44, train_loss: 0.5467, test_loss: 1.0781, test_f1: 0.6019
 epoch: 45, train_loss: 0.5117, test_loss: 1.0977, test_f1: 0.6502
 epoch: 46, train_loss: 0.4971, test_loss: 0.9775, test_f1: 0.6526
 epoch: 47, train_loss: 0.4744, test_loss: 0.9099, test_f1: 0.6674
 epoch: 48, train_loss: 0.5089, test_loss: 0.9016, test_f1: 0.6296
 epoch: 49, train_loss: 0.4742, test_loss: 0.7256, test_f1: 0.6653
 epoch: 50, train_loss: 0.4991, test_loss: 0.8934, test_f1: 0.6714
 epoch: 51, train_loss: 0.4442, test_loss: 1.0292, test_f1: 0.6760
 epoch: 52, train_loss: 0.3856, test_loss: 1.2185, test_f1: 0.6591
 epoch: 53, train_loss: 0.3831, test_loss: 1.2011, test_f1: 0.6647
 epoch: 54, train_loss: 0.3812, test_loss: 1.1239, test_f1: 0.6773
 epoch: 55, train_loss: 0.3821, test_loss: 1.1574, test_f1: 0.6875
 epoch: 56, train_loss: 0.3667, test_loss: 1.2327, test_f1: 0.6498
 epoch: 57, train_loss: 0.3697, test_loss: 1.1249, test_f1: 0.6844
 epoch: 58, train_loss: 0.3714, test_loss: 1.3234, test_f1: 0.6370
 epoch: 59, train_loss: 0.3503, test_loss: 1.1660, test_f1: 0.6839
 epoch: 60, train_loss: 0.3535, test_loss: 1.2194, test_f1: 0.6730
 epoch: 61, train_loss: 0.3538, test_loss: 1.3327, test_f1: 0.6812
 epoch: 62, train_loss: 0.3288, test_loss: 1.3689, test_f1: 0.6505
 epoch: 63, train_loss: 0.3491, test_loss: 1.3135, test_f1: 0.6378
 epoch: 64, train_loss: 0.3353, test_loss: 1.1590, test_f1: 0.6691
 epoch: 65, train_loss: 0.3441, test_loss: 1.3615, test_f1: 0.6587
 epoch: 66, train_loss: 0.3305, test_loss: 1.2033, test_f1: 0.6584
 epoch: 67, train_loss: 0.3231, test_loss: 1.2996, test_f1: 0.6655
 epoch: 68, train_loss: 0.3251, test_loss: 1.2311, test_f1: 0.6710
 epoch: 69, train_loss: 0.3333, test_loss: 1.4090, test_f1: 0.6521
 epoch: 70, train_loss: 0.3187, test_loss: 1.2612, test_f1: 0.6503
 epoch: 71, train_loss: 0.3066, test_loss: 1.3052, test_f1: 0.6492
 epoch: 72, train_loss: 0.3118, test_loss: 1.5186, test_f1: 0.6359
 epoch: 73, train_loss: 0.3231, test_loss: 1.3232, test_f1: 0.6522
 epoch: 74, train_loss: 0.3122, test_loss: 1.4114, test_f1: 0.6795
 epoch: 75, train_loss: 0.3004, test_loss: 1.1968, test_f1: 0.6747
 epoch: 76, train_loss: 0.2938, test_loss: 1.5224, test_f1: 0.6600
 epoch: 77, train_loss: 0.2813, test_loss: 1.5641, test_f1: 0.6914
 epoch: 78, train_loss: 0.3055, test_loss: 1.5590, test_f1: 0.6884
 epoch: 79, train_loss: 0.2975, test_loss: 1.2839, test_f1: 0.6601
 epoch: 80, train_loss: 0.2786, test_loss: 1.3315, test_f1: 0.6526
 epoch: 81, train_loss: 0.3010, test_loss: 1.1554, test_f1: 0.6782
 epoch: 82, train_loss: 0.2860, test_loss: 1.3284, test_f1: 0.6767
 epoch: 83, train_loss: 0.2868, test_loss: 1.2777, test_f1: 0.6678
 epoch: 84, train_loss: 0.2764, test_loss: 1.1537, test_f1: 0.6530
 epoch: 85, train_loss: 0.2762, test_loss: 1.2563, test_f1: 0.6582
 epoch: 86, train_loss: 0.2997, test_loss: 1.4255, test_f1: 0.6721
 epoch: 87, train_loss: 0.2488, test_loss: 1.3592, test_f1: 0.6717
 epoch: 88, train_loss: 0.2414, test_loss: 1.5070, test_f1: 0.6559
 epoch: 89, train_loss: 0.2657, test_loss: 1.4962, test_f1: 0.6921
 epoch: 90, train_loss: 0.2538, test_loss: 1.9887, test_f1: 0.6275
 epoch: 91, train_loss: 0.2618, test_loss: 1.5691, test_f1: 0.6576
 epoch: 92, train_loss: 0.2619, test_loss: 1.8030, test_f1: 0.6620
 epoch: 93, train_loss: 0.2430, test_loss: 1.6655, test_f1: 0.6593
 epoch: 94, train_loss: 0.2372, test_loss: 1.8737, test_f1: 0.6502
 epoch: 95, train_loss: 0.2665, test_loss: 1.4084, test_f1: 0.6495
 epoch: 96, train_loss: 0.2670, test_loss: 1.6117, test_f1: 0.6671
 epoch: 97, train_loss: 0.2178, test_loss: 1.6731, test_f1: 0.6360
 epoch: 98, train_loss: 0.2494, test_loss: 1.4803, test_f1: 0.6647
 epoch: 99, train_loss: 0.2302, test_loss: 1.8304, test_f1: 0.6544
##################ITERATION #2 ****************************************
 epoch: 0, train_loss: 1.2310, test_loss: 1.2672, test_f1: 0.2976
 epoch: 1, train_loss: 1.1090, test_loss: 1.1052, test_f1: 0.3338
 epoch: 2, train_loss: 1.0714, test_loss: 1.1233, test_f1: 0.3388
 epoch: 3, train_loss: 1.0456, test_loss: 1.5727, test_f1: 0.2893
 epoch: 4, train_loss: 0.9968, test_loss: 0.9496, test_f1: 0.4675
 epoch: 5, train_loss: 0.9605, test_loss: 0.9302, test_f1: 0.5222
 epoch: 6, train_loss: 0.9482, test_loss: 1.0192, test_f1: 0.4370
 epoch: 7, train_loss: 0.9150, test_loss: 0.9328, test_f1: 0.5004
 epoch: 8, train_loss: 0.9024, test_loss: 0.9994, test_f1: 0.4829
 epoch: 9, train_loss: 0.8808, test_loss: 1.0425, test_f1: 0.4743
 epoch: 10, train_loss: 0.8751, test_loss: 0.8967, test_f1: 0.5307
 epoch: 11, train_loss: 0.8720, test_loss: 0.9765, test_f1: 0.5070
 epoch: 12, train_loss: 0.8545, test_loss: 1.0013, test_f1: 0.5576
 epoch: 13, train_loss: 0.8503, test_loss: 1.0308, test_f1: 0.5439
 epoch: 14, train_loss: 0.8348, test_loss: 0.9860, test_f1: 0.5148
 epoch: 15, train_loss: 0.8304, test_loss: 0.8453, test_f1: 0.5562
 epoch: 16, train_loss: 0.8179, test_loss: 1.0069, test_f1: 0.5207
 epoch: 17, train_loss: 0.7954, test_loss: 0.8846, test_f1: 0.5377
 epoch: 18, train_loss: 0.7889, test_loss: 1.2468, test_f1: 0.4267
 epoch: 19, train_loss: 0.8047, test_loss: 0.9683, test_f1: 0.5387
 epoch: 20, train_loss: 0.7904, test_loss: 1.0010, test_f1: 0.5287
 epoch: 21, train_loss: 0.7680, test_loss: 1.2947, test_f1: 0.5443
 epoch: 22, train_loss: 0.7918, test_loss: 0.8737, test_f1: 0.5700
 epoch: 23, train_loss: 0.7349, test_loss: 1.0406, test_f1: 0.5935
 epoch: 24, train_loss: 0.7546, test_loss: 0.9278, test_f1: 0.5486
 epoch: 25, train_loss: 0.7585, test_loss: 0.9675, test_f1: 0.5990
 epoch: 26, train_loss: 0.7504, test_loss: 0.9808, test_f1: 0.6067
 epoch: 27, train_loss: 0.7252, test_loss: 0.8893, test_f1: 0.6273
 epoch: 28, train_loss: 0.7361, test_loss: 0.9510, test_f1: 0.5338
 epoch: 29, train_loss: 0.7168, test_loss: 0.9618, test_f1: 0.5806
 epoch: 30, train_loss: 0.6961, test_loss: 0.9778, test_f1: 0.5781
 epoch: 31, train_loss: 0.7031, test_loss: 1.2240, test_f1: 0.5720
 epoch: 32, train_loss: 0.7060, test_loss: 0.8971, test_f1: 0.5932
 epoch: 33, train_loss: 0.6898, test_loss: 1.0602, test_f1: 0.6012
 epoch: 34, train_loss: 0.6575, test_loss: 0.9513, test_f1: 0.6485
 epoch: 35, train_loss: 0.6463, test_loss: 1.2323, test_f1: 0.5811
 epoch: 36, train_loss: 0.6931, test_loss: 1.1088, test_f1: 0.5926
 epoch: 37, train_loss: 0.6746, test_loss: 1.0989, test_f1: 0.5738
 epoch: 38, train_loss: 0.6482, test_loss: 0.9926, test_f1: 0.5887
 epoch: 39, train_loss: 0.6724, test_loss: 1.0253, test_f1: 0.6095
 epoch: 40, train_loss: 0.6538, test_loss: 1.1660, test_f1: 0.6469
 epoch: 41, train_loss: 0.6519, test_loss: 1.2423, test_f1: 0.5735
 epoch: 42, train_loss: 0.6327, test_loss: 1.2453, test_f1: 0.6215
 epoch: 43, train_loss: 0.6132, test_loss: 1.2424, test_f1: 0.5866
 epoch: 44, train_loss: 0.6361, test_loss: 1.3075, test_f1: 0.6228
 epoch: 45, train_loss: 0.6235, test_loss: 1.1993, test_f1: 0.6293
 epoch: 46, train_loss: 0.6408, test_loss: 1.0875, test_f1: 0.6012
 epoch: 47, train_loss: 0.5984, test_loss: 0.8942, test_f1: 0.6644
 epoch: 48, train_loss: 0.6053, test_loss: 1.2264, test_f1: 0.6263
 epoch: 49, train_loss: 0.5963, test_loss: 1.2443, test_f1: 0.6310
 epoch: 50, train_loss: 0.6177, test_loss: 0.9644, test_f1: 0.6423
 epoch: 51, train_loss: 0.5348, test_loss: 1.0675, test_f1: 0.6752
 epoch: 52, train_loss: 0.5261, test_loss: 1.1482, test_f1: 0.6173
 epoch: 53, train_loss: 0.5175, test_loss: 1.2683, test_f1: 0.6527
 epoch: 54, train_loss: 0.4910, test_loss: 1.3717, test_f1: 0.6363
 epoch: 55, train_loss: 0.4747, test_loss: 1.2395, test_f1: 0.6769
 epoch: 56, train_loss: 0.4886, test_loss: 1.1657, test_f1: 0.6636
 epoch: 57, train_loss: 0.4810, test_loss: 1.1727, test_f1: 0.6658
 epoch: 58, train_loss: 0.4772, test_loss: 1.1840, test_f1: 0.6467
 epoch: 59, train_loss: 0.4829, test_loss: 1.2530, test_f1: 0.6466
 epoch: 60, train_loss: 0.4683, test_loss: 1.1175, test_f1: 0.6711
 epoch: 61, train_loss: 0.4681, test_loss: 1.0459, test_f1: 0.6515
 epoch: 62, train_loss: 0.4624, test_loss: 1.4052, test_f1: 0.6352
 epoch: 63, train_loss: 0.4730, test_loss: 1.1845, test_f1: 0.6467
 epoch: 64, train_loss: 0.4586, test_loss: 1.1733, test_f1: 0.6818
 epoch: 65, train_loss: 0.4333, test_loss: 1.3008, test_f1: 0.6723
 epoch: 66, train_loss: 0.4390, test_loss: 1.1521, test_f1: 0.6635
 epoch: 67, train_loss: 0.4347, test_loss: 1.0750, test_f1: 0.6702
 epoch: 68, train_loss: 0.4212, test_loss: 1.3429, test_f1: 0.6615
 epoch: 69, train_loss: 0.4513, test_loss: 1.2655, test_f1: 0.6830
 epoch: 70, train_loss: 0.4231, test_loss: 1.2469, test_f1: 0.6826
 epoch: 71, train_loss: 0.4162, test_loss: 1.2384, test_f1: 0.6535
 epoch: 72, train_loss: 0.3920, test_loss: 1.2100, test_f1: 0.6824
 epoch: 73, train_loss: 0.3991, test_loss: 1.2466, test_f1: 0.6636
 epoch: 74, train_loss: 0.3859, test_loss: 1.2686, test_f1: 0.6445
 epoch: 75, train_loss: 0.3991, test_loss: 1.2370, test_f1: 0.6471
 epoch: 76, train_loss: 0.3855, test_loss: 1.3034, test_f1: 0.6720
 epoch: 77, train_loss: 0.4037, test_loss: 1.2665, test_f1: 0.6678
 epoch: 78, train_loss: 0.3969, test_loss: 1.4317, test_f1: 0.6688
 epoch: 79, train_loss: 0.3640, test_loss: 1.5336, test_f1: 0.6795
 epoch: 80, train_loss: 0.3849, test_loss: 1.3513, test_f1: 0.6578
 epoch: 81, train_loss: 0.3955, test_loss: 1.3931, test_f1: 0.6527
 epoch: 82, train_loss: 0.3716, test_loss: 1.5405, test_f1: 0.6608
 epoch: 83, train_loss: 0.3678, test_loss: 1.3236, test_f1: 0.6769
 epoch: 84, train_loss: 0.3819, test_loss: 1.4235, test_f1: 0.6609
 epoch: 85, train_loss: 0.3567, test_loss: 1.2514, test_f1: 0.6925
 epoch: 86, train_loss: 0.3465, test_loss: 1.5548, test_f1: 0.6540
 epoch: 87, train_loss: 0.3696, test_loss: 1.3217, test_f1: 0.6663
 epoch: 88, train_loss: 0.3773, test_loss: 1.4543, test_f1: 0.6667
 epoch: 89, train_loss: 0.3372, test_loss: 1.3077, test_f1: 0.6785
 epoch: 90, train_loss: 0.3563, test_loss: 1.3898, test_f1: 0.6662
 epoch: 91, train_loss: 0.3290, test_loss: 1.5562, test_f1: 0.6888
 epoch: 92, train_loss: 0.3226, test_loss: 1.5181, test_f1: 0.6775
 epoch: 93, train_loss: 0.3121, test_loss: 1.6674, test_f1: 0.6550
 epoch: 94, train_loss: 0.3304, test_loss: 1.6216, test_f1: 0.6667
 epoch: 95, train_loss: 0.3340, test_loss: 1.6545, test_f1: 0.6751
 epoch: 96, train_loss: 0.3667, test_loss: 1.3592, test_f1: 0.6783
 epoch: 97, train_loss: 0.3188, test_loss: 1.5992, test_f1: 0.6761
 epoch: 98, train_loss: 0.3177, test_loss: 1.7142, test_f1: 0.6719
 epoch: 99, train_loss: 0.3335, test_loss: 1.6302, test_f1: 0.6693
##################ITERATION #3 ****************************************
 epoch: 0, train_loss: 1.2153, test_loss: 1.6232, test_f1: 0.3032
 epoch: 1, train_loss: 1.0285, test_loss: 1.1294, test_f1: 0.3714
 epoch: 2, train_loss: 1.0044, test_loss: 1.0518, test_f1: 0.3794
 epoch: 3, train_loss: 0.9762, test_loss: 1.2910, test_f1: 0.3145
 epoch: 4, train_loss: 0.9538, test_loss: 0.9861, test_f1: 0.5281
 epoch: 5, train_loss: 0.9524, test_loss: 0.9604, test_f1: 0.5390
 epoch: 6, train_loss: 0.9360, test_loss: 0.9574, test_f1: 0.5098
 epoch: 7, train_loss: 0.9061, test_loss: 0.9778, test_f1: 0.5043
 epoch: 8, train_loss: 0.8990, test_loss: 0.9212, test_f1: 0.4946
 epoch: 9, train_loss: 0.9094, test_loss: 0.8918, test_f1: 0.5237
 epoch: 10, train_loss: 0.8765, test_loss: 1.3814, test_f1: 0.4749
 epoch: 11, train_loss: 0.8632, test_loss: 0.8848, test_f1: 0.5925
 epoch: 12, train_loss: 0.8683, test_loss: 0.8800, test_f1: 0.5820
 epoch: 13, train_loss: 0.8839, test_loss: 1.0196, test_f1: 0.5043
 epoch: 14, train_loss: 0.8626, test_loss: 0.8789, test_f1: 0.5431
 epoch: 15, train_loss: 0.8444, test_loss: 0.9396, test_f1: 0.5294
 epoch: 16, train_loss: 0.8297, test_loss: 1.0101, test_f1: 0.5626
 epoch: 17, train_loss: 0.8469, test_loss: 0.9631, test_f1: 0.5864
 epoch: 18, train_loss: 0.8166, test_loss: 0.9077, test_f1: 0.5343
 epoch: 19, train_loss: 0.8142, test_loss: 0.8475, test_f1: 0.5922
 epoch: 20, train_loss: 0.8074, test_loss: 0.8814, test_f1: 0.5655
 epoch: 21, train_loss: 0.7997, test_loss: 0.9745, test_f1: 0.6260
 epoch: 22, train_loss: 0.7812, test_loss: 0.9962, test_f1: 0.5700
 epoch: 23, train_loss: 0.7922, test_loss: 0.8718, test_f1: 0.5361
 epoch: 24, train_loss: 0.7478, test_loss: 1.7622, test_f1: 0.4085
 epoch: 25, train_loss: 0.7403, test_loss: 0.9861, test_f1: 0.5478
 epoch: 26, train_loss: 0.7542, test_loss: 0.9846, test_f1: 0.6261
 epoch: 27, train_loss: 0.7524, test_loss: 0.8482, test_f1: 0.5912
 epoch: 28, train_loss: 0.7289, test_loss: 0.9076, test_f1: 0.5876
 epoch: 29, train_loss: 0.7193, test_loss: 1.0598, test_f1: 0.6471
 epoch: 30, train_loss: 0.7082, test_loss: 0.8802, test_f1: 0.5795
 epoch: 31, train_loss: 0.7034, test_loss: 0.9905, test_f1: 0.5590
 epoch: 32, train_loss: 0.6828, test_loss: 1.0612, test_f1: 0.6160
 epoch: 33, train_loss: 0.6829, test_loss: 0.9443, test_f1: 0.6236
 epoch: 34, train_loss: 0.6694, test_loss: 0.8353, test_f1: 0.6147
 epoch: 35, train_loss: 0.6609, test_loss: 0.9070, test_f1: 0.5579
 epoch: 36, train_loss: 0.6800, test_loss: 0.8618, test_f1: 0.6242
 epoch: 37, train_loss: 0.6528, test_loss: 1.0447, test_f1: 0.6762
 epoch: 38, train_loss: 0.6424, test_loss: 1.0454, test_f1: 0.6229
 epoch: 39, train_loss: 0.6522, test_loss: 0.9539, test_f1: 0.6452
 epoch: 40, train_loss: 0.6489, test_loss: 0.9891, test_f1: 0.6151
 epoch: 41, train_loss: 0.6232, test_loss: 0.8915, test_f1: 0.6212
 epoch: 42, train_loss: 0.6275, test_loss: 0.9557, test_f1: 0.5848
 epoch: 43, train_loss: 0.6411, test_loss: 1.2694, test_f1: 0.5968
 epoch: 44, train_loss: 0.6085, test_loss: 0.8436, test_f1: 0.6456
 epoch: 45, train_loss: 0.6388, test_loss: 1.1244, test_f1: 0.5983
 epoch: 46, train_loss: 0.6274, test_loss: 1.0524, test_f1: 0.6599
 epoch: 47, train_loss: 0.6078, test_loss: 0.9657, test_f1: 0.6489
 epoch: 48, train_loss: 0.6202, test_loss: 0.9965, test_f1: 0.6814
 epoch: 49, train_loss: 0.5963, test_loss: 0.9441, test_f1: 0.6465
 epoch: 50, train_loss: 0.6005, test_loss: 0.9443, test_f1: 0.6040
 epoch: 51, train_loss: 0.5459, test_loss: 0.9225, test_f1: 0.6369
 epoch: 52, train_loss: 0.5225, test_loss: 0.9975, test_f1: 0.6800
 epoch: 53, train_loss: 0.5233, test_loss: 1.0577, test_f1: 0.6697
 epoch: 54, train_loss: 0.4858, test_loss: 1.1291, test_f1: 0.6601
 epoch: 55, train_loss: 0.4804, test_loss: 1.1086, test_f1: 0.6611
 epoch: 56, train_loss: 0.4766, test_loss: 1.1067, test_f1: 0.6434
 epoch: 57, train_loss: 0.4763, test_loss: 1.1562, test_f1: 0.6656
 epoch: 58, train_loss: 0.4957, test_loss: 1.1413, test_f1: 0.6838
 epoch: 59, train_loss: 0.4825, test_loss: 1.0797, test_f1: 0.6557
 epoch: 60, train_loss: 0.4767, test_loss: 0.9882, test_f1: 0.6870
 epoch: 61, train_loss: 0.4715, test_loss: 1.1000, test_f1: 0.6766
 epoch: 62, train_loss: 0.4462, test_loss: 1.0083, test_f1: 0.6654
 epoch: 63, train_loss: 0.4580, test_loss: 1.1216, test_f1: 0.7029
 epoch: 64, train_loss: 0.4407, test_loss: 1.0624, test_f1: 0.6651
 epoch: 65, train_loss: 0.4336, test_loss: 1.1768, test_f1: 0.6755
 epoch: 66, train_loss: 0.4433, test_loss: 1.0062, test_f1: 0.6724
 epoch: 67, train_loss: 0.4209, test_loss: 1.1536, test_f1: 0.6875
 epoch: 68, train_loss: 0.4265, test_loss: 1.2382, test_f1: 0.6426
 epoch: 69, train_loss: 0.4427, test_loss: 1.1604, test_f1: 0.6841
 epoch: 70, train_loss: 0.4171, test_loss: 1.0489, test_f1: 0.6736
 epoch: 71, train_loss: 0.4200, test_loss: 0.9959, test_f1: 0.6825
 epoch: 72, train_loss: 0.4149, test_loss: 1.0552, test_f1: 0.6891
 epoch: 73, train_loss: 0.4022, test_loss: 1.2508, test_f1: 0.6720
 epoch: 74, train_loss: 0.4035, test_loss: 1.0913, test_f1: 0.6634
 epoch: 75, train_loss: 0.3966, test_loss: 1.0664, test_f1: 0.6922
 epoch: 76, train_loss: 0.3995, test_loss: 1.0897, test_f1: 0.6504
 epoch: 77, train_loss: 0.3975, test_loss: 1.1398, test_f1: 0.6828
 epoch: 78, train_loss: 0.3885, test_loss: 1.1423, test_f1: 0.6886
 epoch: 79, train_loss: 0.3894, test_loss: 1.2060, test_f1: 0.6738
 epoch: 80, train_loss: 0.3674, test_loss: 1.1172, test_f1: 0.7088
 epoch: 81, train_loss: 0.3639, test_loss: 1.2310, test_f1: 0.6751
 epoch: 82, train_loss: 0.3739, test_loss: 1.3220, test_f1: 0.6693
 epoch: 83, train_loss: 0.3653, test_loss: 1.3138, test_f1: 0.6795
 epoch: 84, train_loss: 0.3833, test_loss: 1.2770, test_f1: 0.6831
 epoch: 85, train_loss: 0.3774, test_loss: 1.1520, test_f1: 0.6882
 epoch: 86, train_loss: 0.3666, test_loss: 1.2300, test_f1: 0.7017
 epoch: 87, train_loss: 0.3411, test_loss: 1.5235, test_f1: 0.6649
 epoch: 88, train_loss: 0.3691, test_loss: 1.5444, test_f1: 0.6508
 epoch: 89, train_loss: 0.3713, test_loss: 1.4051, test_f1: 0.7028
 epoch: 90, train_loss: 0.3645, test_loss: 1.0923, test_f1: 0.6961
 epoch: 91, train_loss: 0.3549, test_loss: 1.0751, test_f1: 0.6708
 epoch: 92, train_loss: 0.3283, test_loss: 1.2687, test_f1: 0.6958
 epoch: 93, train_loss: 0.3438, test_loss: 1.2044, test_f1: 0.6907
 epoch: 94, train_loss: 0.3241, test_loss: 1.2768, test_f1: 0.7131
 epoch: 95, train_loss: 0.3189, test_loss: 1.2938, test_f1: 0.6991
 epoch: 96, train_loss: 0.3670, test_loss: 1.1201, test_f1: 0.6826
 epoch: 97, train_loss: 0.3325, test_loss: 1.1012, test_f1: 0.6681
 epoch: 98, train_loss: 0.3174, test_loss: 1.1704, test_f1: 0.7117
 epoch: 99, train_loss: 0.3190, test_loss: 1.1375, test_f1: 0.7000
##################ITERATION #4 ****************************************
 epoch: 0, train_loss: 1.2039, test_loss: 1.2125, test_f1: 0.4304
 epoch: 1, train_loss: 0.9861, test_loss: 1.0731, test_f1: 0.4648
 epoch: 2, train_loss: 0.9476, test_loss: 1.0630, test_f1: 0.5187
 epoch: 3, train_loss: 0.9069, test_loss: 0.9186, test_f1: 0.5172
 epoch: 4, train_loss: 0.9160, test_loss: 0.9304, test_f1: 0.5335
 epoch: 5, train_loss: 0.8859, test_loss: 1.0663, test_f1: 0.4735
 epoch: 6, train_loss: 0.8941, test_loss: 0.9452, test_f1: 0.5139
 epoch: 7, train_loss: 0.8624, test_loss: 0.9924, test_f1: 0.5185
 epoch: 8, train_loss: 0.8709, test_loss: 0.9249, test_f1: 0.5153
 epoch: 9, train_loss: 0.8541, test_loss: 0.9874, test_f1: 0.4892
 epoch: 10, train_loss: 0.8748, test_loss: 0.8642, test_f1: 0.5657
 epoch: 11, train_loss: 0.8370, test_loss: 0.8939, test_f1: 0.5922
 epoch: 12, train_loss: 0.8159, test_loss: 1.0169, test_f1: 0.5093
 epoch: 13, train_loss: 0.8070, test_loss: 1.0824, test_f1: 0.5580
 epoch: 14, train_loss: 0.7844, test_loss: 0.8143, test_f1: 0.5770
 epoch: 15, train_loss: 0.7792, test_loss: 0.9794, test_f1: 0.5699
 epoch: 16, train_loss: 0.7352, test_loss: 0.8859, test_f1: 0.5894
 epoch: 17, train_loss: 0.7565, test_loss: 0.9146, test_f1: 0.5494
 epoch: 18, train_loss: 0.7540, test_loss: 0.9206, test_f1: 0.5397
 epoch: 19, train_loss: 0.7325, test_loss: 0.8591, test_f1: 0.5440
 epoch: 20, train_loss: 0.7282, test_loss: 0.8261, test_f1: 0.6275
 epoch: 21, train_loss: 0.7197, test_loss: 0.8742, test_f1: 0.5646
 epoch: 22, train_loss: 0.7130, test_loss: 0.8710, test_f1: 0.5974
 epoch: 23, train_loss: 0.7134, test_loss: 0.8071, test_f1: 0.6546
 epoch: 24, train_loss: 0.6665, test_loss: 0.9303, test_f1: 0.6203
 epoch: 25, train_loss: 0.6717, test_loss: 1.0101, test_f1: 0.5255
 epoch: 26, train_loss: 0.6934, test_loss: 0.8490, test_f1: 0.5663
 epoch: 27, train_loss: 0.6887, test_loss: 0.7651, test_f1: 0.6165
 epoch: 28, train_loss: 0.6654, test_loss: 0.8032, test_f1: 0.6263
 epoch: 29, train_loss: 0.6558, test_loss: 0.9854, test_f1: 0.6374
 epoch: 30, train_loss: 0.6596, test_loss: 0.9323, test_f1: 0.6165
 epoch: 31, train_loss: 0.6480, test_loss: 0.8154, test_f1: 0.6079
 epoch: 32, train_loss: 0.6332, test_loss: 0.8073, test_f1: 0.6542
 epoch: 33, train_loss: 0.6259, test_loss: 0.9684, test_f1: 0.6081
 epoch: 34, train_loss: 0.6070, test_loss: 0.8846, test_f1: 0.6372
 epoch: 35, train_loss: 0.6128, test_loss: 0.8361, test_f1: 0.6042
 epoch: 36, train_loss: 0.6105, test_loss: 0.8551, test_f1: 0.6569
 epoch: 37, train_loss: 0.6238, test_loss: 1.3802, test_f1: 0.5874
 epoch: 38, train_loss: 0.5909, test_loss: 0.8804, test_f1: 0.6139
 epoch: 39, train_loss: 0.6008, test_loss: 0.8746, test_f1: 0.6566
 epoch: 40, train_loss: 0.5851, test_loss: 0.8430, test_f1: 0.6430
 epoch: 41, train_loss: 0.6014, test_loss: 0.7892, test_f1: 0.6083
 epoch: 42, train_loss: 0.5819, test_loss: 0.8445, test_f1: 0.6458
 epoch: 43, train_loss: 0.5530, test_loss: 0.9229, test_f1: 0.5538
 epoch: 44, train_loss: 0.5662, test_loss: 0.8184, test_f1: 0.6218
 epoch: 45, train_loss: 0.5420, test_loss: 0.9232, test_f1: 0.6622
 epoch: 46, train_loss: 0.5474, test_loss: 0.7696, test_f1: 0.6675
 epoch: 47, train_loss: 0.5764, test_loss: 0.9107, test_f1: 0.6203
 epoch: 48, train_loss: 0.5556, test_loss: 0.8413, test_f1: 0.6698
 epoch: 49, train_loss: 0.5279, test_loss: 0.7909, test_f1: 0.6775
 epoch: 50, train_loss: 0.5122, test_loss: 0.8337, test_f1: 0.6292
 epoch: 51, train_loss: 0.4856, test_loss: 0.8388, test_f1: 0.6863
 epoch: 52, train_loss: 0.4592, test_loss: 0.9208, test_f1: 0.6753
 epoch: 53, train_loss: 0.4558, test_loss: 0.8616, test_f1: 0.6757
 epoch: 54, train_loss: 0.4394, test_loss: 0.8795, test_f1: 0.6581
 epoch: 55, train_loss: 0.4565, test_loss: 0.7821, test_f1: 0.6876
 epoch: 56, train_loss: 0.4537, test_loss: 0.7808, test_f1: 0.6891
 epoch: 57, train_loss: 0.4388, test_loss: 0.8425, test_f1: 0.6640
 epoch: 58, train_loss: 0.4475, test_loss: 0.8379, test_f1: 0.6611
 epoch: 59, train_loss: 0.4171, test_loss: 0.7238, test_f1: 0.6774
 epoch: 60, train_loss: 0.4078, test_loss: 0.9177, test_f1: 0.6786
 epoch: 61, train_loss: 0.4262, test_loss: 0.8109, test_f1: 0.6844
 epoch: 62, train_loss: 0.4053, test_loss: 1.0438, test_f1: 0.6863
 epoch: 63, train_loss: 0.4394, test_loss: 0.8188, test_f1: 0.6865
 epoch: 64, train_loss: 0.4070, test_loss: 0.9309, test_f1: 0.6735
 epoch: 65, train_loss: 0.3848, test_loss: 0.8978, test_f1: 0.6957
 epoch: 66, train_loss: 0.3982, test_loss: 0.8597, test_f1: 0.6885
 epoch: 67, train_loss: 0.3770, test_loss: 0.8684, test_f1: 0.6881
 epoch: 68, train_loss: 0.3810, test_loss: 0.9100, test_f1: 0.6822
 epoch: 69, train_loss: 0.3865, test_loss: 0.8595, test_f1: 0.7051
 epoch: 70, train_loss: 0.3842, test_loss: 0.8437, test_f1: 0.6710
 epoch: 71, train_loss: 0.3937, test_loss: 0.7954, test_f1: 0.7023
 epoch: 72, train_loss: 0.3841, test_loss: 0.7777, test_f1: 0.6976
 epoch: 73, train_loss: 0.3857, test_loss: 0.8832, test_f1: 0.6769
 epoch: 74, train_loss: 0.3629, test_loss: 0.9126, test_f1: 0.6814
 epoch: 75, train_loss: 0.3728, test_loss: 0.8266, test_f1: 0.6858
 epoch: 76, train_loss: 0.3501, test_loss: 1.0300, test_f1: 0.6535
 epoch: 77, train_loss: 0.3744, test_loss: 0.8929, test_f1: 0.6988
 epoch: 78, train_loss: 0.3762, test_loss: 0.9250, test_f1: 0.7030
 epoch: 79, train_loss: 0.3605, test_loss: 0.8687, test_f1: 0.6941
 epoch: 80, train_loss: 0.3418, test_loss: 0.8583, test_f1: 0.6830
 epoch: 81, train_loss: 0.3705, test_loss: 0.8432, test_f1: 0.6845
 epoch: 82, train_loss: 0.3410, test_loss: 0.9549, test_f1: 0.6839
 epoch: 83, train_loss: 0.3384, test_loss: 0.8776, test_f1: 0.6637
 epoch: 84, train_loss: 0.3341, test_loss: 0.8804, test_f1: 0.6794
 epoch: 85, train_loss: 0.3296, test_loss: 0.8538, test_f1: 0.6841
 epoch: 86, train_loss: 0.3237, test_loss: 1.0232, test_f1: 0.6783
 epoch: 87, train_loss: 0.3325, test_loss: 0.9094, test_f1: 0.6765
 epoch: 88, train_loss: 0.3438, test_loss: 0.9263, test_f1: 0.6940
 epoch: 89, train_loss: 0.3231, test_loss: 0.9263, test_f1: 0.6574
 epoch: 90, train_loss: 0.3273, test_loss: 0.9227, test_f1: 0.6720
 epoch: 91, train_loss: 0.3258, test_loss: 0.9523, test_f1: 0.6702
 epoch: 92, train_loss: 0.3207, test_loss: 0.9668, test_f1: 0.6695
 epoch: 93, train_loss: 0.3053, test_loss: 1.0431, test_f1: 0.6922
 epoch: 94, train_loss: 0.3104, test_loss: 0.9923, test_f1: 0.6666
 epoch: 95, train_loss: 0.2958, test_loss: 1.0234, test_f1: 0.6837
 epoch: 96, train_loss: 0.2986, test_loss: 0.9892, test_f1: 0.6867
 epoch: 97, train_loss: 0.3035, test_loss: 0.9016, test_f1: 0.7036
 epoch: 98, train_loss: 0.3083, test_loss: 1.1237, test_f1: 0.6963
 epoch: 99, train_loss: 0.3101, test_loss: 1.0436, test_f1: 0.6703
##################ITERATION #5 ****************************************
 epoch: 0, train_loss: 1.2174, test_loss: 1.0592, test_f1: 0.4506
 epoch: 1, train_loss: 1.0076, test_loss: 1.1500, test_f1: 0.4113
 epoch: 2, train_loss: 0.9586, test_loss: 1.0335, test_f1: 0.4891
 epoch: 3, train_loss: 0.9267, test_loss: 0.9222, test_f1: 0.5401
 epoch: 4, train_loss: 0.9268, test_loss: 0.9773, test_f1: 0.5098
 epoch: 5, train_loss: 0.9042, test_loss: 0.8734, test_f1: 0.5897
 epoch: 6, train_loss: 0.8874, test_loss: 0.9905, test_f1: 0.5092
 epoch: 7, train_loss: 0.8632, test_loss: 0.9489, test_f1: 0.5351
 epoch: 8, train_loss: 0.8409, test_loss: 0.9486, test_f1: 0.5234
 epoch: 9, train_loss: 0.8362, test_loss: 0.9599, test_f1: 0.5208
 epoch: 10, train_loss: 0.8314, test_loss: 0.8523, test_f1: 0.5404
 epoch: 11, train_loss: 0.7984, test_loss: 0.8993, test_f1: 0.6040
 epoch: 12, train_loss: 0.8113, test_loss: 0.9918, test_f1: 0.5213
 epoch: 13, train_loss: 0.7966, test_loss: 0.8937, test_f1: 0.5403
 epoch: 14, train_loss: 0.7833, test_loss: 1.0356, test_f1: 0.5466
 epoch: 15, train_loss: 0.7784, test_loss: 1.2406, test_f1: 0.4950
 epoch: 16, train_loss: 0.7979, test_loss: 0.8871, test_f1: 0.5817
 epoch: 17, train_loss: 0.7785, test_loss: 1.0045, test_f1: 0.5132
 epoch: 18, train_loss: 0.7611, test_loss: 0.8555, test_f1: 0.5646
 epoch: 19, train_loss: 0.7672, test_loss: 0.7968, test_f1: 0.6224
 epoch: 20, train_loss: 0.7680, test_loss: 0.8508, test_f1: 0.5696
 epoch: 21, train_loss: 0.7874, test_loss: 0.8646, test_f1: 0.5666
 epoch: 22, train_loss: 0.7132, test_loss: 0.7660, test_f1: 0.6646
 epoch: 23, train_loss: 0.7103, test_loss: 0.7863, test_f1: 0.5930
 epoch: 24, train_loss: 0.7124, test_loss: 0.8516, test_f1: 0.5894
 epoch: 25, train_loss: 0.7001, test_loss: 0.8018, test_f1: 0.6442
 epoch: 26, train_loss: 0.6872, test_loss: 0.7683, test_f1: 0.6052
 epoch: 27, train_loss: 0.6825, test_loss: 0.9632, test_f1: 0.5947
 epoch: 28, train_loss: 0.6953, test_loss: 0.7995, test_f1: 0.5820
 epoch: 29, train_loss: 0.6725, test_loss: 1.0973, test_f1: 0.5936
 epoch: 30, train_loss: 0.6775, test_loss: 0.7891, test_f1: 0.6589
 epoch: 31, train_loss: 0.6709, test_loss: 0.8688, test_f1: 0.6303
 epoch: 32, train_loss: 0.6587, test_loss: 0.7129, test_f1: 0.7005
 epoch: 33, train_loss: 0.6563, test_loss: 0.8301, test_f1: 0.6776
 epoch: 34, train_loss: 0.6412, test_loss: 0.8381, test_f1: 0.6612
 epoch: 35, train_loss: 0.6255, test_loss: 0.7562, test_f1: 0.6474
 epoch: 36, train_loss: 0.6516, test_loss: 0.8825, test_f1: 0.6054
 epoch: 37, train_loss: 0.6045, test_loss: 0.8995, test_f1: 0.6414
 epoch: 38, train_loss: 0.6143, test_loss: 0.9111, test_f1: 0.6634
 epoch: 39, train_loss: 0.6330, test_loss: 0.8267, test_f1: 0.6420
 epoch: 40, train_loss: 0.6336, test_loss: 0.7874, test_f1: 0.6747
 epoch: 41, train_loss: 0.6171, test_loss: 0.8321, test_f1: 0.5807
 epoch: 42, train_loss: 0.6259, test_loss: 0.7587, test_f1: 0.6666
 epoch: 43, train_loss: 0.6128, test_loss: 0.9390, test_f1: 0.5766
 epoch: 44, train_loss: 0.6141, test_loss: 0.9624, test_f1: 0.5953
 epoch: 45, train_loss: 0.6038, test_loss: 0.8027, test_f1: 0.6192
 epoch: 46, train_loss: 0.6102, test_loss: 0.7493, test_f1: 0.6388
 epoch: 47, train_loss: 0.5918, test_loss: 0.8932, test_f1: 0.6193
 epoch: 48, train_loss: 0.5904, test_loss: 0.8179, test_f1: 0.6506
 epoch: 49, train_loss: 0.6076, test_loss: 0.8637, test_f1: 0.6668
 epoch: 50, train_loss: 0.5679, test_loss: 0.8309, test_f1: 0.6764
 epoch: 51, train_loss: 0.5246, test_loss: 0.8717, test_f1: 0.6838
 epoch: 52, train_loss: 0.5118, test_loss: 0.7717, test_f1: 0.6662
 epoch: 53, train_loss: 0.4921, test_loss: 0.8466, test_f1: 0.6616
 epoch: 54, train_loss: 0.4919, test_loss: 0.8386, test_f1: 0.6239
 epoch: 55, train_loss: 0.4709, test_loss: 0.8538, test_f1: 0.6685
 epoch: 56, train_loss: 0.4566, test_loss: 0.8744, test_f1: 0.6444
 epoch: 57, train_loss: 0.4906, test_loss: 0.7773, test_f1: 0.6778
 epoch: 58, train_loss: 0.4663, test_loss: 0.8603, test_f1: 0.6645
 epoch: 59, train_loss: 0.4326, test_loss: 0.9833, test_f1: 0.6976
 epoch: 60, train_loss: 0.4532, test_loss: 0.9451, test_f1: 0.6610
 epoch: 61, train_loss: 0.4770, test_loss: 1.0313, test_f1: 0.6419
 epoch: 62, train_loss: 0.4578, test_loss: 0.9625, test_f1: 0.6462
 epoch: 63, train_loss: 0.4594, test_loss: 1.1338, test_f1: 0.6177
 epoch: 64, train_loss: 0.4392, test_loss: 0.9302, test_f1: 0.6345
 epoch: 65, train_loss: 0.4189, test_loss: 1.0695, test_f1: 0.6458
 epoch: 66, train_loss: 0.4410, test_loss: 0.8054, test_f1: 0.6404
 epoch: 67, train_loss: 0.4394, test_loss: 0.8386, test_f1: 0.6369
 epoch: 68, train_loss: 0.4316, test_loss: 0.9736, test_f1: 0.6411
 epoch: 69, train_loss: 0.4118, test_loss: 0.9054, test_f1: 0.6845
 epoch: 70, train_loss: 0.4134, test_loss: 1.1196, test_f1: 0.6426
 epoch: 71, train_loss: 0.4074, test_loss: 1.0061, test_f1: 0.6380
 epoch: 72, train_loss: 0.4256, test_loss: 0.8619, test_f1: 0.6430
 epoch: 73, train_loss: 0.4042, test_loss: 0.8014, test_f1: 0.6763
 epoch: 74, train_loss: 0.3922, test_loss: 0.8772, test_f1: 0.6863
 epoch: 75, train_loss: 0.4082, test_loss: 0.8859, test_f1: 0.6338
 epoch: 76, train_loss: 0.3896, test_loss: 0.9013, test_f1: 0.6774
 epoch: 77, train_loss: 0.3873, test_loss: 1.1284, test_f1: 0.6349
 epoch: 78, train_loss: 0.3782, test_loss: 0.9749, test_f1: 0.6833
 epoch: 79, train_loss: 0.3718, test_loss: 0.9934, test_f1: 0.6685
 epoch: 80, train_loss: 0.3688, test_loss: 1.0777, test_f1: 0.6490
 epoch: 81, train_loss: 0.3631, test_loss: 0.9847, test_f1: 0.6526
 epoch: 82, train_loss: 0.3762, test_loss: 0.9452, test_f1: 0.6755
 epoch: 83, train_loss: 0.3679, test_loss: 1.1288, test_f1: 0.6600
 epoch: 84, train_loss: 0.3786, test_loss: 0.9990, test_f1: 0.6492
 epoch: 85, train_loss: 0.3766, test_loss: 0.8612, test_f1: 0.6893
 epoch: 86, train_loss: 0.3441, test_loss: 1.1326, test_f1: 0.6614
 epoch: 87, train_loss: 0.3530, test_loss: 1.0728, test_f1: 0.6494
 epoch: 88, train_loss: 0.3428, test_loss: 0.9994, test_f1: 0.6464
 epoch: 89, train_loss: 0.3454, test_loss: 1.1348, test_f1: 0.6361
 epoch: 90, train_loss: 0.3440, test_loss: 0.9998, test_f1: 0.6637
 epoch: 91, train_loss: 0.3505, test_loss: 1.2909, test_f1: 0.6558
 epoch: 92, train_loss: 0.3467, test_loss: 1.0860, test_f1: 0.6454
 epoch: 93, train_loss: 0.3501, test_loss: 0.9442, test_f1: 0.6533
 epoch: 94, train_loss: 0.3314, test_loss: 0.9840, test_f1: 0.6580
 epoch: 95, train_loss: 0.3363, test_loss: 1.2071, test_f1: 0.6577
 epoch: 96, train_loss: 0.3231, test_loss: 0.9140, test_f1: 0.6656
 epoch: 97, train_loss: 0.3418, test_loss: 1.1054, test_f1: 0.6466
 epoch: 98, train_loss: 0.3107, test_loss: 1.0046, test_f1: 0.6619
 epoch: 99, train_loss: 0.3091, test_loss: 1.3548, test_f1: 0.6321
##################ITERATION #6 ****************************************
 epoch: 0, train_loss: 1.3065, test_loss: 1.2158, test_f1: 0.3368
 epoch: 1, train_loss: 1.0304, test_loss: 1.1265, test_f1: 0.4820
 epoch: 2, train_loss: 0.9832, test_loss: 0.9478, test_f1: 0.5033
 epoch: 3, train_loss: 0.9563, test_loss: 0.9163, test_f1: 0.4840
 epoch: 4, train_loss: 0.9291, test_loss: 0.9649, test_f1: 0.5015
 epoch: 5, train_loss: 0.9064, test_loss: 0.9802, test_f1: 0.5058
 epoch: 6, train_loss: 0.8810, test_loss: 1.0247, test_f1: 0.5335
 epoch: 7, train_loss: 0.8683, test_loss: 0.9932, test_f1: 0.5319
 epoch: 8, train_loss: 0.8661, test_loss: 0.9816, test_f1: 0.5103
 epoch: 9, train_loss: 0.8476, test_loss: 0.8723, test_f1: 0.6103
 epoch: 10, train_loss: 0.8384, test_loss: 0.9676, test_f1: 0.5203
 epoch: 11, train_loss: 0.8347, test_loss: 0.8723, test_f1: 0.5823
 epoch: 12, train_loss: 0.8158, test_loss: 0.9800, test_f1: 0.5910
 epoch: 13, train_loss: 0.8052, test_loss: 0.9344, test_f1: 0.5806
 epoch: 14, train_loss: 0.7924, test_loss: 1.0895, test_f1: 0.5642
 epoch: 15, train_loss: 0.7941, test_loss: 1.2340, test_f1: 0.4531
 epoch: 16, train_loss: 0.7835, test_loss: 0.9654, test_f1: 0.5357
 epoch: 17, train_loss: 0.7575, test_loss: 0.9082, test_f1: 0.6093
 epoch: 18, train_loss: 0.7631, test_loss: 0.9250, test_f1: 0.5870
 epoch: 19, train_loss: 0.7372, test_loss: 0.9316, test_f1: 0.6144
 epoch: 20, train_loss: 0.7653, test_loss: 0.8815, test_f1: 0.5422
 epoch: 21, train_loss: 0.7285, test_loss: 0.8754, test_f1: 0.6218
 epoch: 22, train_loss: 0.7209, test_loss: 1.1269, test_f1: 0.6106
 epoch: 23, train_loss: 0.7345, test_loss: 0.9580, test_f1: 0.6361
 epoch: 24, train_loss: 0.7158, test_loss: 0.9767, test_f1: 0.5490
 epoch: 25, train_loss: 0.7050, test_loss: 1.0222, test_f1: 0.6027
 epoch: 26, train_loss: 0.6829, test_loss: 0.9656, test_f1: 0.6197
 epoch: 27, train_loss: 0.6845, test_loss: 1.1680, test_f1: 0.5701
 epoch: 28, train_loss: 0.6666, test_loss: 1.1131, test_f1: 0.6286
 epoch: 29, train_loss: 0.6853, test_loss: 1.1811, test_f1: 0.5338
 epoch: 30, train_loss: 0.6933, test_loss: 1.1129, test_f1: 0.5958
 epoch: 31, train_loss: 0.6614, test_loss: 1.0782, test_f1: 0.6366
 epoch: 32, train_loss: 0.6472, test_loss: 1.0678, test_f1: 0.6328
 epoch: 33, train_loss: 0.6652, test_loss: 1.0266, test_f1: 0.6256
 epoch: 34, train_loss: 0.6381, test_loss: 1.0307, test_f1: 0.6399
 epoch: 35, train_loss: 0.6457, test_loss: 1.0910, test_f1: 0.6013
 epoch: 36, train_loss: 0.6318, test_loss: 1.0657, test_f1: 0.6684
 epoch: 37, train_loss: 0.6085, test_loss: 1.0979, test_f1: 0.6041
 epoch: 38, train_loss: 0.6274, test_loss: 0.9862, test_f1: 0.6270
 epoch: 39, train_loss: 0.6344, test_loss: 1.0661, test_f1: 0.6269
 epoch: 40, train_loss: 0.6351, test_loss: 1.0756, test_f1: 0.6685
 epoch: 41, train_loss: 0.6155, test_loss: 0.9747, test_f1: 0.6250
 epoch: 42, train_loss: 0.5997, test_loss: 0.9493, test_f1: 0.6335
 epoch: 43, train_loss: 0.5780, test_loss: 1.1120, test_f1: 0.6453
 epoch: 44, train_loss: 0.6012, test_loss: 1.0918, test_f1: 0.6454
 epoch: 45, train_loss: 0.5721, test_loss: 1.1016, test_f1: 0.6181
 epoch: 46, train_loss: 0.5981, test_loss: 1.2121, test_f1: 0.6222
 epoch: 47, train_loss: 0.5754, test_loss: 1.2065, test_f1: 0.6329
 epoch: 48, train_loss: 0.5560, test_loss: 1.2084, test_f1: 0.6343
 epoch: 49, train_loss: 0.5655, test_loss: 0.9887, test_f1: 0.6325
 epoch: 50, train_loss: 0.5606, test_loss: 1.2694, test_f1: 0.6238
 epoch: 51, train_loss: 0.5219, test_loss: 1.1810, test_f1: 0.6514
 epoch: 52, train_loss: 0.4808, test_loss: 1.1986, test_f1: 0.6667
 epoch: 53, train_loss: 0.4941, test_loss: 1.1691, test_f1: 0.6635
 epoch: 54, train_loss: 0.4636, test_loss: 1.3606, test_f1: 0.6544
 epoch: 55, train_loss: 0.4691, test_loss: 1.1112, test_f1: 0.6465
 epoch: 56, train_loss: 0.4404, test_loss: 1.2364, test_f1: 0.6793
 epoch: 57, train_loss: 0.4464, test_loss: 1.0709, test_f1: 0.6546
 epoch: 58, train_loss: 0.4512, test_loss: 1.2554, test_f1: 0.6705
 epoch: 59, train_loss: 0.4397, test_loss: 1.2236, test_f1: 0.6532
 epoch: 60, train_loss: 0.4201, test_loss: 1.3888, test_f1: 0.6501
 epoch: 61, train_loss: 0.4196, test_loss: 1.3164, test_f1: 0.6643
 epoch: 62, train_loss: 0.4256, test_loss: 1.2551, test_f1: 0.6491
 epoch: 63, train_loss: 0.4312, test_loss: 1.2696, test_f1: 0.6700
 epoch: 64, train_loss: 0.4166, test_loss: 1.2866, test_f1: 0.6858
 epoch: 65, train_loss: 0.4129, test_loss: 1.2397, test_f1: 0.6562
 epoch: 66, train_loss: 0.4026, test_loss: 1.3028, test_f1: 0.6387
 epoch: 67, train_loss: 0.4029, test_loss: 1.2778, test_f1: 0.6893
 epoch: 68, train_loss: 0.4003, test_loss: 1.4717, test_f1: 0.6492
 epoch: 69, train_loss: 0.4035, test_loss: 1.5156, test_f1: 0.6876
 epoch: 70, train_loss: 0.3743, test_loss: 1.5999, test_f1: 0.6720
 epoch: 71, train_loss: 0.3888, test_loss: 1.4818, test_f1: 0.6705
 epoch: 72, train_loss: 0.3805, test_loss: 1.4315, test_f1: 0.6471
 epoch: 73, train_loss: 0.3814, test_loss: 1.7285, test_f1: 0.6558
 epoch: 74, train_loss: 0.3805, test_loss: 1.5018, test_f1: 0.6732
 epoch: 75, train_loss: 0.4048, test_loss: 1.4827, test_f1: 0.6888
 epoch: 76, train_loss: 0.3720, test_loss: 1.5689, test_f1: 0.6691
 epoch: 77, train_loss: 0.3747, test_loss: 1.6185, test_f1: 0.6978
 epoch: 78, train_loss: 0.3738, test_loss: 1.6717, test_f1: 0.6667
 epoch: 79, train_loss: 0.3636, test_loss: 1.5261, test_f1: 0.6604
 epoch: 80, train_loss: 0.3423, test_loss: 1.6772, test_f1: 0.6519
 epoch: 81, train_loss: 0.3483, test_loss: 1.6902, test_f1: 0.6489
 epoch: 82, train_loss: 0.3557, test_loss: 1.5602, test_f1: 0.6532
 epoch: 83, train_loss: 0.3422, test_loss: 1.8987, test_f1: 0.6682
 epoch: 84, train_loss: 0.3358, test_loss: 1.5612, test_f1: 0.6632
 epoch: 85, train_loss: 0.3452, test_loss: 1.7799, test_f1: 0.6888
 epoch: 86, train_loss: 0.3387, test_loss: 1.5371, test_f1: 0.6323
 epoch: 87, train_loss: 0.3427, test_loss: 1.7236, test_f1: 0.6806
 epoch: 88, train_loss: 0.3120, test_loss: 1.6789, test_f1: 0.6268
 epoch: 89, train_loss: 0.3235, test_loss: 1.7799, test_f1: 0.6655
 epoch: 90, train_loss: 0.3325, test_loss: 1.6608, test_f1: 0.6535
 epoch: 91, train_loss: 0.3304, test_loss: 1.9415, test_f1: 0.6433
 epoch: 92, train_loss: 0.3370, test_loss: 2.0078, test_f1: 0.6603
 epoch: 93, train_loss: 0.3097, test_loss: 1.9819, test_f1: 0.6674
 epoch: 94, train_loss: 0.3104, test_loss: 1.7535, test_f1: 0.6761
 epoch: 95, train_loss: 0.3051, test_loss: 1.8038, test_f1: 0.6435
 epoch: 96, train_loss: 0.3117, test_loss: 1.8946, test_f1: 0.6672
 epoch: 97, train_loss: 0.2881, test_loss: 1.9514, test_f1: 0.6595
 epoch: 98, train_loss: 0.2958, test_loss: 1.7637, test_f1: 0.6627
 epoch: 99, train_loss: 0.2833, test_loss: 1.8240, test_f1: 0.6712
##################ITERATION #7 ****************************************
 epoch: 0, train_loss: 1.2563, test_loss: 1.2832, test_f1: 0.4918
 epoch: 1, train_loss: 1.0160, test_loss: 0.9757, test_f1: 0.4802
 epoch: 2, train_loss: 0.9650, test_loss: 0.9530, test_f1: 0.4820
 epoch: 3, train_loss: 0.9321, test_loss: 1.0395, test_f1: 0.4985
 epoch: 4, train_loss: 0.9060, test_loss: 0.9416, test_f1: 0.4709
 epoch: 5, train_loss: 0.8837, test_loss: 0.9134, test_f1: 0.5388
 epoch: 6, train_loss: 0.8708, test_loss: 1.0650, test_f1: 0.4735
 epoch: 7, train_loss: 0.8636, test_loss: 1.1052, test_f1: 0.5368
 epoch: 8, train_loss: 0.8529, test_loss: 0.8818, test_f1: 0.5816
 epoch: 9, train_loss: 0.8191, test_loss: 0.9000, test_f1: 0.5693
 epoch: 10, train_loss: 0.8008, test_loss: 0.8824, test_f1: 0.6001
 epoch: 11, train_loss: 0.7960, test_loss: 0.9990, test_f1: 0.4881
 epoch: 12, train_loss: 0.7847, test_loss: 0.9287, test_f1: 0.5302
 epoch: 13, train_loss: 0.7530, test_loss: 1.3419, test_f1: 0.4597
 epoch: 14, train_loss: 0.7308, test_loss: 0.8311, test_f1: 0.5231
 epoch: 15, train_loss: 0.7383, test_loss: 0.8104, test_f1: 0.5859
 epoch: 16, train_loss: 0.7289, test_loss: 0.8348, test_f1: 0.6093
 epoch: 17, train_loss: 0.7098, test_loss: 0.8491, test_f1: 0.5628
 epoch: 18, train_loss: 0.6998, test_loss: 0.7960, test_f1: 0.6355
 epoch: 19, train_loss: 0.7021, test_loss: 0.8716, test_f1: 0.6006
 epoch: 20, train_loss: 0.6966, test_loss: 0.8540, test_f1: 0.6167
 epoch: 21, train_loss: 0.6963, test_loss: 0.8889, test_f1: 0.6560
 epoch: 22, train_loss: 0.6887, test_loss: 0.9475, test_f1: 0.5992
 epoch: 23, train_loss: 0.6430, test_loss: 1.0282, test_f1: 0.6295
 epoch: 24, train_loss: 0.6515, test_loss: 0.9971, test_f1: 0.5831
 epoch: 25, train_loss: 0.6202, test_loss: 1.0291, test_f1: 0.6227
 epoch: 26, train_loss: 0.6216, test_loss: 1.0499, test_f1: 0.6057
 epoch: 27, train_loss: 0.6441, test_loss: 1.0091, test_f1: 0.5956
 epoch: 28, train_loss: 0.6325, test_loss: 1.0247, test_f1: 0.6535
 epoch: 29, train_loss: 0.5911, test_loss: 1.0844, test_f1: 0.5855
 epoch: 30, train_loss: 0.6057, test_loss: 1.1661, test_f1: 0.6417
 epoch: 31, train_loss: 0.5904, test_loss: 0.9449, test_f1: 0.6662
 epoch: 32, train_loss: 0.5808, test_loss: 0.9918, test_f1: 0.6146
 epoch: 33, train_loss: 0.5546, test_loss: 1.1171, test_f1: 0.6178
 epoch: 34, train_loss: 0.5875, test_loss: 1.0026, test_f1: 0.6134
 epoch: 35, train_loss: 0.5988, test_loss: 0.9884, test_f1: 0.6493
 epoch: 36, train_loss: 0.5552, test_loss: 0.8827, test_f1: 0.6841
 epoch: 37, train_loss: 0.5379, test_loss: 1.0367, test_f1: 0.6523
 epoch: 38, train_loss: 0.5522, test_loss: 0.9679, test_f1: 0.6657
 epoch: 39, train_loss: 0.5395, test_loss: 1.0071, test_f1: 0.6637
 epoch: 40, train_loss: 0.5491, test_loss: 1.2040, test_f1: 0.5931
 epoch: 41, train_loss: 0.5535, test_loss: 0.9780, test_f1: 0.6160
 epoch: 42, train_loss: 0.5281, test_loss: 1.0575, test_f1: 0.6341
 epoch: 43, train_loss: 0.5265, test_loss: 0.9970, test_f1: 0.6762
 epoch: 44, train_loss: 0.5045, test_loss: 0.8781, test_f1: 0.6669
 epoch: 45, train_loss: 0.5132, test_loss: 1.0600, test_f1: 0.6807
 epoch: 46, train_loss: 0.5206, test_loss: 1.0931, test_f1: 0.6443
 epoch: 47, train_loss: 0.4910, test_loss: 1.0973, test_f1: 0.6202
 epoch: 48, train_loss: 0.5136, test_loss: 0.9427, test_f1: 0.6564
 epoch: 49, train_loss: 0.5191, test_loss: 0.8266, test_f1: 0.6908
 epoch: 50, train_loss: 0.4656, test_loss: 1.0739, test_f1: 0.6415
 epoch: 51, train_loss: 0.4647, test_loss: 0.9165, test_f1: 0.6912
 epoch: 52, train_loss: 0.4349, test_loss: 0.8730, test_f1: 0.6693
 epoch: 53, train_loss: 0.4126, test_loss: 0.8805, test_f1: 0.6995
 epoch: 54, train_loss: 0.4103, test_loss: 0.9829, test_f1: 0.6705
 epoch: 55, train_loss: 0.3836, test_loss: 0.9177, test_f1: 0.6969
 epoch: 56, train_loss: 0.3804, test_loss: 0.9393, test_f1: 0.6803
 epoch: 57, train_loss: 0.3943, test_loss: 1.0552, test_f1: 0.6689
 epoch: 58, train_loss: 0.3824, test_loss: 1.1330, test_f1: 0.6778
 epoch: 59, train_loss: 0.3756, test_loss: 0.9469, test_f1: 0.6792
 epoch: 60, train_loss: 0.3780, test_loss: 0.9158, test_f1: 0.7108
 epoch: 61, train_loss: 0.3740, test_loss: 1.1517, test_f1: 0.6527
 epoch: 62, train_loss: 0.3585, test_loss: 0.9532, test_f1: 0.7209
 epoch: 63, train_loss: 0.3851, test_loss: 1.1563, test_f1: 0.6502
 epoch: 64, train_loss: 0.3636, test_loss: 1.1279, test_f1: 0.6736
 epoch: 65, train_loss: 0.3670, test_loss: 1.1070, test_f1: 0.6967
 epoch: 66, train_loss: 0.3477, test_loss: 1.0434, test_f1: 0.6980
 epoch: 67, train_loss: 0.3724, test_loss: 1.1289, test_f1: 0.7119
 epoch: 68, train_loss: 0.3630, test_loss: 0.9475, test_f1: 0.7376
 epoch: 69, train_loss: 0.3442, test_loss: 1.0601, test_f1: 0.7041
 epoch: 70, train_loss: 0.3456, test_loss: 0.9570, test_f1: 0.7343
 epoch: 71, train_loss: 0.3438, test_loss: 1.1835, test_f1: 0.6891
 epoch: 72, train_loss: 0.3440, test_loss: 1.0655, test_f1: 0.6982
 epoch: 73, train_loss: 0.3352, test_loss: 0.9737, test_f1: 0.7055
 epoch: 74, train_loss: 0.3256, test_loss: 1.0445, test_f1: 0.7056
 epoch: 75, train_loss: 0.3302, test_loss: 1.0334, test_f1: 0.7181
 epoch: 76, train_loss: 0.3574, test_loss: 1.1267, test_f1: 0.7002
 epoch: 77, train_loss: 0.3149, test_loss: 1.0193, test_f1: 0.6951
 epoch: 78, train_loss: 0.3198, test_loss: 0.9716, test_f1: 0.7165
 epoch: 79, train_loss: 0.3335, test_loss: 0.9983, test_f1: 0.7001
 epoch: 80, train_loss: 0.3286, test_loss: 1.0685, test_f1: 0.7073
 epoch: 81, train_loss: 0.3197, test_loss: 1.1331, test_f1: 0.6909
 epoch: 82, train_loss: 0.3279, test_loss: 1.1069, test_f1: 0.7035
 epoch: 83, train_loss: 0.2982, test_loss: 1.0852, test_f1: 0.6914
 epoch: 84, train_loss: 0.3118, test_loss: 1.0629, test_f1: 0.6793
 epoch: 85, train_loss: 0.2988, test_loss: 1.2172, test_f1: 0.6826
 epoch: 86, train_loss: 0.2975, test_loss: 1.1860, test_f1: 0.6831
 epoch: 87, train_loss: 0.3174, test_loss: 1.1353, test_f1: 0.7109
 epoch: 88, train_loss: 0.2953, test_loss: 0.8751, test_f1: 0.7143
 epoch: 89, train_loss: 0.2890, test_loss: 0.9820, test_f1: 0.6963
 epoch: 90, train_loss: 0.2793, test_loss: 1.1051, test_f1: 0.7074
 epoch: 91, train_loss: 0.3020, test_loss: 1.1436, test_f1: 0.6862
 epoch: 92, train_loss: 0.2935, test_loss: 1.0705, test_f1: 0.6980
 epoch: 93, train_loss: 0.2873, test_loss: 1.1521, test_f1: 0.6976
 epoch: 94, train_loss: 0.2948, test_loss: 1.0595, test_f1: 0.6942
 epoch: 95, train_loss: 0.2900, test_loss: 1.2026, test_f1: 0.7149
 epoch: 96, train_loss: 0.2824, test_loss: 1.1596, test_f1: 0.7213
 epoch: 97, train_loss: 0.2719, test_loss: 1.3103, test_f1: 0.7089
 epoch: 98, train_loss: 0.2788, test_loss: 1.0234, test_f1: 0.7062
 epoch: 99, train_loss: 0.2874, test_loss: 1.1321, test_f1: 0.7303
##################ITERATION #8 ****************************************
 epoch: 0, train_loss: 1.2605, test_loss: 1.6612, test_f1: 0.3458
 epoch: 1, train_loss: 1.0259, test_loss: 1.2682, test_f1: 0.4800
 epoch: 2, train_loss: 0.9808, test_loss: 1.0858, test_f1: 0.4480
 epoch: 3, train_loss: 0.9679, test_loss: 1.0483, test_f1: 0.4941
 epoch: 4, train_loss: 0.9557, test_loss: 0.9376, test_f1: 0.5397
 epoch: 5, train_loss: 0.9237, test_loss: 0.9749, test_f1: 0.5444
 epoch: 6, train_loss: 0.8933, test_loss: 1.0242, test_f1: 0.5663
 epoch: 7, train_loss: 0.8957, test_loss: 1.0638, test_f1: 0.5283
 epoch: 8, train_loss: 0.8780, test_loss: 0.9952, test_f1: 0.5228
 epoch: 9, train_loss: 0.8758, test_loss: 0.9875, test_f1: 0.5527
 epoch: 10, train_loss: 0.8615, test_loss: 1.1102, test_f1: 0.4913
 epoch: 11, train_loss: 0.8417, test_loss: 0.9660, test_f1: 0.5779
 epoch: 12, train_loss: 0.8451, test_loss: 1.0409, test_f1: 0.5530
 epoch: 13, train_loss: 0.8557, test_loss: 1.0081, test_f1: 0.4999
 epoch: 14, train_loss: 0.8440, test_loss: 1.0055, test_f1: 0.5696
 epoch: 15, train_loss: 0.7939, test_loss: 1.1425, test_f1: 0.5732
 epoch: 16, train_loss: 0.8010, test_loss: 1.8118, test_f1: 0.3685
 epoch: 17, train_loss: 0.7828, test_loss: 0.9929, test_f1: 0.5736
 epoch: 18, train_loss: 0.7833, test_loss: 1.2688, test_f1: 0.5116
 epoch: 19, train_loss: 0.7868, test_loss: 1.0425, test_f1: 0.6018
 epoch: 20, train_loss: 0.7563, test_loss: 1.1808, test_f1: 0.5564
 epoch: 21, train_loss: 0.7605, test_loss: 1.2715, test_f1: 0.5519
 epoch: 22, train_loss: 0.7564, test_loss: 1.0896, test_f1: 0.6011
 epoch: 23, train_loss: 0.7301, test_loss: 0.9965, test_f1: 0.6058
 epoch: 24, train_loss: 0.7173, test_loss: 1.0700, test_f1: 0.6259
 epoch: 25, train_loss: 0.7319, test_loss: 1.0652, test_f1: 0.5991
 epoch: 26, train_loss: 0.7064, test_loss: 1.0118, test_f1: 0.6168
 epoch: 27, train_loss: 0.7076, test_loss: 0.9174, test_f1: 0.6583
 epoch: 28, train_loss: 0.6942, test_loss: 0.9165, test_f1: 0.6665
 epoch: 29, train_loss: 0.6883, test_loss: 1.1795, test_f1: 0.6313
 epoch: 30, train_loss: 0.6788, test_loss: 1.0649, test_f1: 0.6534
 epoch: 31, train_loss: 0.6488, test_loss: 1.2325, test_f1: 0.6231
 epoch: 32, train_loss: 0.7122, test_loss: 1.0715, test_f1: 0.6456
 epoch: 33, train_loss: 0.6573, test_loss: 1.1957, test_f1: 0.5983
 epoch: 34, train_loss: 0.6631, test_loss: 1.0053, test_f1: 0.6190
 epoch: 35, train_loss: 0.6539, test_loss: 1.0548, test_f1: 0.6210
 epoch: 36, train_loss: 0.6500, test_loss: 1.1356, test_f1: 0.6094
 epoch: 37, train_loss: 0.6657, test_loss: 0.9401, test_f1: 0.6635
 epoch: 38, train_loss: 0.6633, test_loss: 1.0401, test_f1: 0.5550
 epoch: 39, train_loss: 0.6824, test_loss: 0.9911, test_f1: 0.6538
 epoch: 40, train_loss: 0.6224, test_loss: 1.0199, test_f1: 0.6653
 epoch: 41, train_loss: 0.6377, test_loss: 1.0454, test_f1: 0.6455
 epoch: 42, train_loss: 0.6168, test_loss: 1.0216, test_f1: 0.6458
 epoch: 43, train_loss: 0.6094, test_loss: 1.0868, test_f1: 0.6210
 epoch: 44, train_loss: 0.6124, test_loss: 1.3550, test_f1: 0.6333
 epoch: 45, train_loss: 0.6200, test_loss: 1.4010, test_f1: 0.5596
 epoch: 46, train_loss: 0.5879, test_loss: 1.2739, test_f1: 0.6639
 epoch: 47, train_loss: 0.5788, test_loss: 1.2866, test_f1: 0.6219
 epoch: 48, train_loss: 0.6165, test_loss: 1.1601, test_f1: 0.6590
 epoch: 49, train_loss: 0.5855, test_loss: 1.2811, test_f1: 0.6237
 epoch: 50, train_loss: 0.5649, test_loss: 1.2817, test_f1: 0.6660
 epoch: 51, train_loss: 0.5379, test_loss: 1.2923, test_f1: 0.6515
 epoch: 52, train_loss: 0.5152, test_loss: 1.3470, test_f1: 0.6459
 epoch: 53, train_loss: 0.5122, test_loss: 1.2076, test_f1: 0.6716
 epoch: 54, train_loss: 0.5010, test_loss: 1.3165, test_f1: 0.6628
 epoch: 55, train_loss: 0.4832, test_loss: 1.3848, test_f1: 0.6547
 epoch: 56, train_loss: 0.4696, test_loss: 1.5647, test_f1: 0.6153
 epoch: 57, train_loss: 0.4668, test_loss: 1.7850, test_f1: 0.6461
 epoch: 58, train_loss: 0.4740, test_loss: 1.5789, test_f1: 0.6344
 epoch: 59, train_loss: 0.4690, test_loss: 1.3125, test_f1: 0.6582
 epoch: 60, train_loss: 0.4672, test_loss: 1.6570, test_f1: 0.6527
 epoch: 61, train_loss: 0.4783, test_loss: 1.8302, test_f1: 0.6588
 epoch: 62, train_loss: 0.4804, test_loss: 1.6934, test_f1: 0.6554
 epoch: 63, train_loss: 0.4597, test_loss: 1.5069, test_f1: 0.6533
 epoch: 64, train_loss: 0.4431, test_loss: 1.5054, test_f1: 0.6650
 epoch: 65, train_loss: 0.4605, test_loss: 1.3706, test_f1: 0.6494
 epoch: 66, train_loss: 0.4291, test_loss: 1.6435, test_f1: 0.6640
 epoch: 67, train_loss: 0.4388, test_loss: 1.7255, test_f1: 0.6674
 epoch: 68, train_loss: 0.4318, test_loss: 1.5439, test_f1: 0.6602
 epoch: 69, train_loss: 0.4328, test_loss: 1.5924, test_f1: 0.6323
 epoch: 70, train_loss: 0.4329, test_loss: 1.4923, test_f1: 0.6336
 epoch: 71, train_loss: 0.4302, test_loss: 1.3344, test_f1: 0.6618
 epoch: 72, train_loss: 0.4108, test_loss: 1.5068, test_f1: 0.6476
 epoch: 73, train_loss: 0.4181, test_loss: 1.4953, test_f1: 0.6709
 epoch: 74, train_loss: 0.4169, test_loss: 1.4644, test_f1: 0.6417
 epoch: 75, train_loss: 0.4236, test_loss: 1.2524, test_f1: 0.6456
 epoch: 76, train_loss: 0.3998, test_loss: 1.4820, test_f1: 0.6647
 epoch: 77, train_loss: 0.4071, test_loss: 1.2229, test_f1: 0.6804
 epoch: 78, train_loss: 0.3967, test_loss: 1.2355, test_f1: 0.6684
 epoch: 79, train_loss: 0.4057, test_loss: 1.3511, test_f1: 0.6586
 epoch: 80, train_loss: 0.3856, test_loss: 1.5351, test_f1: 0.6495
 epoch: 81, train_loss: 0.3964, test_loss: 1.2764, test_f1: 0.6808
 epoch: 82, train_loss: 0.3893, test_loss: 1.2734, test_f1: 0.6609
 epoch: 83, train_loss: 0.3933, test_loss: 1.4685, test_f1: 0.6721
 epoch: 84, train_loss: 0.3946, test_loss: 1.3355, test_f1: 0.6621
 epoch: 85, train_loss: 0.3783, test_loss: 1.4644, test_f1: 0.6595
 epoch: 86, train_loss: 0.3826, test_loss: 1.4616, test_f1: 0.6353
 epoch: 87, train_loss: 0.3815, test_loss: 1.4848, test_f1: 0.6624
 epoch: 88, train_loss: 0.3709, test_loss: 1.6807, test_f1: 0.6650
 epoch: 89, train_loss: 0.3850, test_loss: 1.6355, test_f1: 0.6401
 epoch: 90, train_loss: 0.3569, test_loss: 1.6646, test_f1: 0.6504
 epoch: 91, train_loss: 0.3766, test_loss: 1.4300, test_f1: 0.6929
 epoch: 92, train_loss: 0.3439, test_loss: 1.4928, test_f1: 0.6559
 epoch: 93, train_loss: 0.3747, test_loss: 1.5337, test_f1: 0.6577
 epoch: 94, train_loss: 0.3625, test_loss: 1.3181, test_f1: 0.6570
 epoch: 95, train_loss: 0.3630, test_loss: 1.3693, test_f1: 0.6324
 epoch: 96, train_loss: 0.3643, test_loss: 1.7023, test_f1: 0.6429
 epoch: 97, train_loss: 0.3693, test_loss: 1.5608, test_f1: 0.6822
 epoch: 98, train_loss: 0.3701, test_loss: 1.3807, test_f1: 0.6758
 epoch: 99, train_loss: 0.3393, test_loss: 1.2440, test_f1: 0.6724
##################ITERATION #9 ****************************************
 epoch: 0, train_loss: 1.1741, test_loss: 1.0744, test_f1: 0.4676
 epoch: 1, train_loss: 1.0245, test_loss: 0.9842, test_f1: 0.4890
 epoch: 2, train_loss: 0.9622, test_loss: 1.0501, test_f1: 0.5133
 epoch: 3, train_loss: 0.9430, test_loss: 0.9904, test_f1: 0.5610
 epoch: 4, train_loss: 0.9301, test_loss: 0.9709, test_f1: 0.5664
 epoch: 5, train_loss: 0.9116, test_loss: 0.9214, test_f1: 0.5612
 epoch: 6, train_loss: 0.8802, test_loss: 0.9005, test_f1: 0.5723
 epoch: 7, train_loss: 0.8734, test_loss: 0.9605, test_f1: 0.5274
 epoch: 8, train_loss: 0.8465, test_loss: 0.8902, test_f1: 0.5388
 epoch: 9, train_loss: 0.8235, test_loss: 1.0135, test_f1: 0.5178
 epoch: 10, train_loss: 0.8215, test_loss: 0.8333, test_f1: 0.5541
 epoch: 11, train_loss: 0.7964, test_loss: 1.0032, test_f1: 0.5690
 epoch: 12, train_loss: 0.7819, test_loss: 0.8664, test_f1: 0.6009
 epoch: 13, train_loss: 0.7728, test_loss: 0.9162, test_f1: 0.6133
 epoch: 14, train_loss: 0.7591, test_loss: 0.8987, test_f1: 0.6044
 epoch: 15, train_loss: 0.7638, test_loss: 0.8687, test_f1: 0.5960
 epoch: 16, train_loss: 0.7501, test_loss: 0.9245, test_f1: 0.5722
 epoch: 17, train_loss: 0.7549, test_loss: 0.9630, test_f1: 0.5955
 epoch: 18, train_loss: 0.7349, test_loss: 0.8229, test_f1: 0.5863
 epoch: 19, train_loss: 0.7069, test_loss: 1.2037, test_f1: 0.5678
 epoch: 20, train_loss: 0.7436, test_loss: 0.8727, test_f1: 0.6121
 epoch: 21, train_loss: 0.6857, test_loss: 1.0091, test_f1: 0.5789
 epoch: 22, train_loss: 0.6828, test_loss: 0.8865, test_f1: 0.6191
 epoch: 23, train_loss: 0.6888, test_loss: 1.0326, test_f1: 0.6029
 epoch: 24, train_loss: 0.6762, test_loss: 0.8540, test_f1: 0.6300
 epoch: 25, train_loss: 0.6844, test_loss: 1.0590, test_f1: 0.5998
 epoch: 26, train_loss: 0.6750, test_loss: 0.8262, test_f1: 0.6858
 epoch: 27, train_loss: 0.6732, test_loss: 0.9268, test_f1: 0.6299
 epoch: 28, train_loss: 0.6511, test_loss: 0.9405, test_f1: 0.6066
 epoch: 29, train_loss: 0.6283, test_loss: 0.8371, test_f1: 0.6481
 epoch: 30, train_loss: 0.6151, test_loss: 0.8221, test_f1: 0.6514
 epoch: 31, train_loss: 0.6088, test_loss: 0.8560, test_f1: 0.6505
 epoch: 32, train_loss: 0.6007, test_loss: 0.8437, test_f1: 0.6452
 epoch: 33, train_loss: 0.6026, test_loss: 0.8750, test_f1: 0.6433
 epoch: 34, train_loss: 0.6106, test_loss: 1.0221, test_f1: 0.5990
 epoch: 35, train_loss: 0.5758, test_loss: 1.0723, test_f1: 0.6217
 epoch: 36, train_loss: 0.5809, test_loss: 1.0304, test_f1: 0.6553
 epoch: 37, train_loss: 0.5751, test_loss: 1.1547, test_f1: 0.5869
 epoch: 38, train_loss: 0.5866, test_loss: 0.8507, test_f1: 0.6589
 epoch: 39, train_loss: 0.5502, test_loss: 0.9616, test_f1: 0.6619
 epoch: 40, train_loss: 0.5428, test_loss: 0.9427, test_f1: 0.6321
 epoch: 41, train_loss: 0.5302, test_loss: 0.8651, test_f1: 0.6343
 epoch: 42, train_loss: 0.5479, test_loss: 0.7684, test_f1: 0.6638
 epoch: 43, train_loss: 0.5561, test_loss: 0.9850, test_f1: 0.6798
 epoch: 44, train_loss: 0.5352, test_loss: 1.2083, test_f1: 0.5432
 epoch: 45, train_loss: 0.5222, test_loss: 0.9266, test_f1: 0.6392
 epoch: 46, train_loss: 0.4939, test_loss: 0.9026, test_f1: 0.6734
 epoch: 47, train_loss: 0.5355, test_loss: 1.1153, test_f1: 0.6150
 epoch: 48, train_loss: 0.5413, test_loss: 0.9458, test_f1: 0.6385
 epoch: 49, train_loss: 0.5089, test_loss: 0.9148, test_f1: 0.6542
 epoch: 50, train_loss: 0.5151, test_loss: 1.1138, test_f1: 0.6441
 epoch: 51, train_loss: 0.4575, test_loss: 1.0511, test_f1: 0.6838
 epoch: 52, train_loss: 0.4314, test_loss: 1.1373, test_f1: 0.6526
 epoch: 53, train_loss: 0.4324, test_loss: 1.0199, test_f1: 0.6802
 epoch: 54, train_loss: 0.4285, test_loss: 0.9772, test_f1: 0.6550
 epoch: 55, train_loss: 0.4251, test_loss: 1.1248, test_f1: 0.6538
 epoch: 56, train_loss: 0.4005, test_loss: 1.0739, test_f1: 0.6815
 epoch: 57, train_loss: 0.4296, test_loss: 1.1298, test_f1: 0.6398
 epoch: 58, train_loss: 0.4250, test_loss: 1.1331, test_f1: 0.6450
 epoch: 59, train_loss: 0.3887, test_loss: 1.1673, test_f1: 0.6718
 epoch: 60, train_loss: 0.3985, test_loss: 1.2470, test_f1: 0.6455
 epoch: 61, train_loss: 0.3788, test_loss: 1.2866, test_f1: 0.6316
 epoch: 62, train_loss: 0.3820, test_loss: 1.2375, test_f1: 0.6593
 epoch: 63, train_loss: 0.3789, test_loss: 1.2762, test_f1: 0.6497
 epoch: 64, train_loss: 0.3681, test_loss: 1.0920, test_f1: 0.6355
 epoch: 65, train_loss: 0.3771, test_loss: 1.2230, test_f1: 0.6427
 epoch: 66, train_loss: 0.3855, test_loss: 1.1772, test_f1: 0.6531
 epoch: 67, train_loss: 0.3785, test_loss: 1.2623, test_f1: 0.6302
 epoch: 68, train_loss: 0.3593, test_loss: 1.3072, test_f1: 0.6335
 epoch: 69, train_loss: 0.3866, test_loss: 1.1123, test_f1: 0.6575
 epoch: 70, train_loss: 0.3427, test_loss: 1.1554, test_f1: 0.6530
 epoch: 71, train_loss: 0.3452, test_loss: 1.2858, test_f1: 0.6480
 epoch: 72, train_loss: 0.3495, test_loss: 1.2269, test_f1: 0.6624
 epoch: 73, train_loss: 0.3750, test_loss: 1.3385, test_f1: 0.6447
 epoch: 74, train_loss: 0.3659, test_loss: 1.3298, test_f1: 0.6291
 epoch: 75, train_loss: 0.3339, test_loss: 1.3515, test_f1: 0.6415
 epoch: 76, train_loss: 0.3463, test_loss: 1.4948, test_f1: 0.6130
 epoch: 77, train_loss: 0.3350, test_loss: 1.4107, test_f1: 0.6286
 epoch: 78, train_loss: 0.3397, test_loss: 1.3102, test_f1: 0.6406
 epoch: 79, train_loss: 0.3508, test_loss: 1.2182, test_f1: 0.6646
 epoch: 80, train_loss: 0.3465, test_loss: 1.1408, test_f1: 0.6626
 epoch: 81, train_loss: 0.3206, test_loss: 1.3004, test_f1: 0.6486
 epoch: 82, train_loss: 0.3279, test_loss: 1.2415, test_f1: 0.6669
 epoch: 83, train_loss: 0.3238, test_loss: 1.2785, test_f1: 0.6572
 epoch: 84, train_loss: 0.3244, test_loss: 1.3499, test_f1: 0.6365
 epoch: 85, train_loss: 0.3316, test_loss: 1.3582, test_f1: 0.6429
 epoch: 86, train_loss: 0.3303, test_loss: 1.3954, test_f1: 0.6429
 epoch: 87, train_loss: 0.3307, test_loss: 1.3887, test_f1: 0.6452
 epoch: 88, train_loss: 0.3219, test_loss: 1.4381, test_f1: 0.6445
 epoch: 89, train_loss: 0.3453, test_loss: 1.4404, test_f1: 0.6569
 epoch: 90, train_loss: 0.3115, test_loss: 1.3559, test_f1: 0.6463
 epoch: 91, train_loss: 0.3172, test_loss: 1.2422, test_f1: 0.6747
 epoch: 92, train_loss: 0.2947, test_loss: 1.3686, test_f1: 0.6542
 epoch: 93, train_loss: 0.3060, test_loss: 1.5543, test_f1: 0.6230
 epoch: 94, train_loss: 0.2893, test_loss: 1.2958, test_f1: 0.6752
 epoch: 95, train_loss: 0.2980, test_loss: 1.3593, test_f1: 0.6320
 epoch: 96, train_loss: 0.3127, test_loss: 1.4019, test_f1: 0.6323
 epoch: 97, train_loss: 0.3234, test_loss: 1.6162, test_f1: 0.6123
 epoch: 98, train_loss: 0.3145, test_loss: 1.3625, test_f1: 0.6396
 epoch: 99, train_loss: 0.2839, test_loss: 1.4594, test_f1: 0.6559

Training completed in 591.51 seconds
Best F1: 0.7376 at epoch 68
Mean F1 across iterations: 0.7031  0.0144
========================FINAL RESULTS================================
FEGIN weighted F1: 0.7376  0.0144
python main.py --data ltspice_examples --representation component_pin --model FEGIN --layers 2 --hiddens 128 --batch_size 64 --lr 0.01 --emb_size 512 --epochs 100 --save_appendix component_pin_L2_H128_BS64_LR0.01_E512 --no_val
-----



STDERR:
  File "main.py", line 370, in <module>
    main()
  File "main.py", line 254, in main
    dataset = dataset_class(
  File "/home/philip/projects/ltspice_examples_code_repo/Circuit-Completion-Using-GNNs/component_classification_with_link_prediction_head/evaluation/FEGIN/kernel/circuit_datasets.py", line 15, in __init__
    self.data, self.slices = torch.load(self.processed_paths[0])
  File "/home/philip/.local/lib/python3.8/site-packages/torch/serialization.py", line 1040, in load
    warnings.warn(
  File "/usr/lib/python3.8/warnings.py", line 109, in _showwarnmsg
    sw(msg.message, msg.category, msg.filename, msg.lineno,
  File "main.py", line 47, in warn_with_traceback
    traceback.print_stack(file=log)
/home/philip/projects/ltspice_examples_code_repo/Circuit-Completion-Using-GNNs/component_classification_with_link_prediction_head/evaluation/FEGIN/kernel/circuit_datasets.py:15: FutureWarning: You are using `torch.load` with `weights_only=False` (the current default value), which uses the default pickle module implicitly. It is possible to construct malicious pickle data which will execute arbitrary code during unpickling (See https://github.com/pytorch/pytorch/blob/main/SECURITY.md#untrusted-models for more details). In a future release, the default value for `weights_only` will be flipped to `True`. This limits the functions that could be executed during unpickling. Arbitrary objects will no longer be allowed to be loaded via this mode unless they are explicitly allowlisted by the user via `torch.serialization.add_safe_globals`. We recommend you start setting `weights_only=True` for any use case where you don't have full control of the loaded file. Please open an issue on GitHub for any issues related to this experimental feature.
  self.data, self.slices = torch.load(self.processed_paths[0])
