STDOUT:
Results will be saved in /home/philip/projects/ltspice_examples_code_repo/Circuit-Completion-Using-GNNs/component_classification_with_link_prediction_head/evaluation/FEGIN/results/model_FEGIN_dataset_ltspice_examples
Command line input: python main.py --data ltspice_examples --representation component_pin_net --model FEGIN --layers 5 --hiddens 128 --batch_size 256 --lr 0.01 --emb_size 512 --epochs 100 --save_appendix component_pin_net_L5_H128_BS256_LR0.01_E512 --no_val
 is saved.
-----
ltspice_examples - FEGIN
Using 5 layers, 128 hidden units, h = 2
Loading component_pin_net representation dataset
Loading component_pin_net representation data...
Loaded 4404 examples (component_pin_net)
saving path: data/processed/ltspice_examples_component_pin_net_processed.pt
ENTERED
Training FEGIN on component_pin_net representation
Train: 3558, Test: 846
##################ITERATION #0 ****************************************
 epoch: 0, train_loss: 1.1733, test_loss: 1.3217, test_f1: 0.2882
 epoch: 1, train_loss: 1.0167, test_loss: 1.0548, test_f1: 0.3699
 epoch: 2, train_loss: 0.9714, test_loss: 1.0072, test_f1: 0.4082
 epoch: 3, train_loss: 0.9347, test_loss: 0.9333, test_f1: 0.4795
 epoch: 4, train_loss: 0.9056, test_loss: 0.9911, test_f1: 0.5051
 epoch: 5, train_loss: 0.8976, test_loss: 1.1316, test_f1: 0.4270
 epoch: 6, train_loss: 0.8700, test_loss: 1.1313, test_f1: 0.4720
 epoch: 7, train_loss: 0.8540, test_loss: 0.8551, test_f1: 0.5482
 epoch: 8, train_loss: 0.8484, test_loss: 1.0338, test_f1: 0.5593
 epoch: 9, train_loss: 0.8207, test_loss: 0.8750, test_f1: 0.5037
 epoch: 10, train_loss: 0.8041, test_loss: 1.1789, test_f1: 0.4527
 epoch: 11, train_loss: 0.7986, test_loss: 1.2029, test_f1: 0.4247
 epoch: 12, train_loss: 0.7755, test_loss: 0.9213, test_f1: 0.6016
 epoch: 13, train_loss: 0.7620, test_loss: 0.8271, test_f1: 0.6046
 epoch: 14, train_loss: 0.7307, test_loss: 0.9515, test_f1: 0.5754
 epoch: 15, train_loss: 0.7181, test_loss: 0.7940, test_f1: 0.5653
 epoch: 16, train_loss: 0.7234, test_loss: 0.8380, test_f1: 0.6238
 epoch: 17, train_loss: 0.7212, test_loss: 0.7846, test_f1: 0.5709
 epoch: 18, train_loss: 0.6776, test_loss: 1.2075, test_f1: 0.5415
 epoch: 19, train_loss: 0.6631, test_loss: 1.7026, test_f1: 0.4576
 epoch: 20, train_loss: 0.6663, test_loss: 0.7729, test_f1: 0.6260
 epoch: 21, train_loss: 0.6464, test_loss: 0.9028, test_f1: 0.6292
 epoch: 22, train_loss: 0.6381, test_loss: 0.7085, test_f1: 0.6794
 epoch: 23, train_loss: 0.6170, test_loss: 0.8346, test_f1: 0.6009
 epoch: 24, train_loss: 0.6070, test_loss: 1.0397, test_f1: 0.5932
 epoch: 25, train_loss: 0.5841, test_loss: 0.8725, test_f1: 0.5954
 epoch: 26, train_loss: 0.5893, test_loss: 0.7411, test_f1: 0.6630
 epoch: 27, train_loss: 0.5784, test_loss: 0.7961, test_f1: 0.6289
 epoch: 28, train_loss: 0.6044, test_loss: 0.8108, test_f1: 0.6376
 epoch: 29, train_loss: 0.5747, test_loss: 0.7248, test_f1: 0.6360
 epoch: 30, train_loss: 0.5644, test_loss: 0.9502, test_f1: 0.6245
 epoch: 31, train_loss: 0.5673, test_loss: 0.8584, test_f1: 0.5901
 epoch: 32, train_loss: 0.5346, test_loss: 1.1623, test_f1: 0.5235
 epoch: 33, train_loss: 0.5416, test_loss: 0.9461, test_f1: 0.6469
 epoch: 34, train_loss: 0.4968, test_loss: 0.8310, test_f1: 0.6498
 epoch: 35, train_loss: 0.4969, test_loss: 1.1616, test_f1: 0.6105
 epoch: 36, train_loss: 0.5006, test_loss: 0.7075, test_f1: 0.6725
 epoch: 37, train_loss: 0.4732, test_loss: 1.0484, test_f1: 0.6316
 epoch: 38, train_loss: 0.4928, test_loss: 0.9689, test_f1: 0.6410
 epoch: 39, train_loss: 0.4768, test_loss: 0.7650, test_f1: 0.6812
 epoch: 40, train_loss: 0.4705, test_loss: 1.0316, test_f1: 0.6094
 epoch: 41, train_loss: 0.4437, test_loss: 1.3167, test_f1: 0.5566
 epoch: 42, train_loss: 0.4468, test_loss: 0.9373, test_f1: 0.6627
 epoch: 43, train_loss: 0.4619, test_loss: 1.0407, test_f1: 0.5919
 epoch: 44, train_loss: 0.4725, test_loss: 1.2465, test_f1: 0.6046
 epoch: 45, train_loss: 0.4626, test_loss: 0.8659, test_f1: 0.6446
 epoch: 46, train_loss: 0.4349, test_loss: 1.0898, test_f1: 0.6504
 epoch: 47, train_loss: 0.4268, test_loss: 0.8909, test_f1: 0.6769
 epoch: 48, train_loss: 0.4337, test_loss: 1.0192, test_f1: 0.6180
 epoch: 49, train_loss: 0.4241, test_loss: 0.9765, test_f1: 0.6308
 epoch: 50, train_loss: 0.3969, test_loss: 0.9867, test_f1: 0.6608
 epoch: 51, train_loss: 0.3441, test_loss: 0.8504, test_f1: 0.6670
 epoch: 52, train_loss: 0.3206, test_loss: 0.8640, test_f1: 0.6849
 epoch: 53, train_loss: 0.3214, test_loss: 0.9359, test_f1: 0.6701
 epoch: 54, train_loss: 0.2966, test_loss: 1.0166, test_f1: 0.6673
 epoch: 55, train_loss: 0.3041, test_loss: 1.0382, test_f1: 0.6805
 epoch: 56, train_loss: 0.2931, test_loss: 1.0193, test_f1: 0.6719
 epoch: 57, train_loss: 0.2837, test_loss: 1.0940, test_f1: 0.7025
 epoch: 58, train_loss: 0.2770, test_loss: 0.8940, test_f1: 0.6941
 epoch: 59, train_loss: 0.2673, test_loss: 0.9581, test_f1: 0.6907
 epoch: 60, train_loss: 0.2683, test_loss: 1.1256, test_f1: 0.6725
 epoch: 61, train_loss: 0.2806, test_loss: 1.0905, test_f1: 0.6660
 epoch: 62, train_loss: 0.2553, test_loss: 1.0085, test_f1: 0.6731
 epoch: 63, train_loss: 0.2603, test_loss: 1.1498, test_f1: 0.6945
 epoch: 64, train_loss: 0.2527, test_loss: 1.2545, test_f1: 0.6618
 epoch: 65, train_loss: 0.2571, test_loss: 1.1828, test_f1: 0.6923
 epoch: 66, train_loss: 0.2733, test_loss: 1.2792, test_f1: 0.6645
 epoch: 67, train_loss: 0.2586, test_loss: 1.0298, test_f1: 0.6668
 epoch: 68, train_loss: 0.2455, test_loss: 1.0576, test_f1: 0.6802
 epoch: 69, train_loss: 0.2564, test_loss: 1.0476, test_f1: 0.6738
 epoch: 70, train_loss: 0.2599, test_loss: 1.0630, test_f1: 0.6612
 epoch: 71, train_loss: 0.2257, test_loss: 1.1947, test_f1: 0.6806
 epoch: 72, train_loss: 0.2301, test_loss: 1.1033, test_f1: 0.6659
 epoch: 73, train_loss: 0.2144, test_loss: 1.0943, test_f1: 0.7159
 epoch: 74, train_loss: 0.1868, test_loss: 1.3025, test_f1: 0.6815
 epoch: 75, train_loss: 0.1906, test_loss: 1.2849, test_f1: 0.6765
 epoch: 76, train_loss: 0.2158, test_loss: 1.0815, test_f1: 0.6796
 epoch: 77, train_loss: 0.2452, test_loss: 1.2761, test_f1: 0.6973
 epoch: 78, train_loss: 0.2403, test_loss: 1.1998, test_f1: 0.6761
 epoch: 79, train_loss: 0.1925, test_loss: 1.1586, test_f1: 0.6805
 epoch: 80, train_loss: 0.1855, test_loss: 1.3106, test_f1: 0.6545
 epoch: 81, train_loss: 0.2012, test_loss: 1.4705, test_f1: 0.6591
 epoch: 82, train_loss: 0.1814, test_loss: 1.3886, test_f1: 0.6456
 epoch: 83, train_loss: 0.2061, test_loss: 1.5294, test_f1: 0.6529
 epoch: 84, train_loss: 0.1932, test_loss: 1.2378, test_f1: 0.6568
 epoch: 85, train_loss: 0.1903, test_loss: 1.1351, test_f1: 0.7127
 epoch: 86, train_loss: 0.1836, test_loss: 1.2454, test_f1: 0.6853
 epoch: 87, train_loss: 0.1847, test_loss: 1.3013, test_f1: 0.6662
 epoch: 88, train_loss: 0.1916, test_loss: 1.2261, test_f1: 0.6772
 epoch: 89, train_loss: 0.1940, test_loss: 1.3116, test_f1: 0.7020
 epoch: 90, train_loss: 0.1931, test_loss: 1.1785, test_f1: 0.6820
 epoch: 91, train_loss: 0.1822, test_loss: 1.3326, test_f1: 0.6853
 epoch: 92, train_loss: 0.1635, test_loss: 1.3415, test_f1: 0.6808
 epoch: 93, train_loss: 0.1753, test_loss: 1.2764, test_f1: 0.6971
 epoch: 94, train_loss: 0.1976, test_loss: 1.2873, test_f1: 0.6997
 epoch: 95, train_loss: 0.2025, test_loss: 1.2515, test_f1: 0.6858
 epoch: 96, train_loss: 0.2241, test_loss: 1.1898, test_f1: 0.6862
 epoch: 97, train_loss: 0.1965, test_loss: 1.6795, test_f1: 0.6598
 epoch: 98, train_loss: 0.1987, test_loss: 1.3718, test_f1: 0.6833
 epoch: 99, train_loss: 0.1721, test_loss: 1.2976, test_f1: 0.6957
##################ITERATION #1 ****************************************
 epoch: 0, train_loss: 1.3401, test_loss: 1.1841, test_f1: 0.2819
 epoch: 1, train_loss: 1.0310, test_loss: 1.1398, test_f1: 0.3605
 epoch: 2, train_loss: 0.9847, test_loss: 0.9808, test_f1: 0.4801
 epoch: 3, train_loss: 0.9646, test_loss: 0.9910, test_f1: 0.4755
 epoch: 4, train_loss: 0.9548, test_loss: 0.9736, test_f1: 0.5081
 epoch: 5, train_loss: 0.9355, test_loss: 1.1025, test_f1: 0.4204
 epoch: 6, train_loss: 0.9219, test_loss: 0.9260, test_f1: 0.5166
 epoch: 7, train_loss: 0.8878, test_loss: 0.9599, test_f1: 0.4838
 epoch: 8, train_loss: 0.8917, test_loss: 0.8816, test_f1: 0.5292
 epoch: 9, train_loss: 0.8515, test_loss: 0.9333, test_f1: 0.5317
 epoch: 10, train_loss: 0.8396, test_loss: 0.8635, test_f1: 0.5422
 epoch: 11, train_loss: 0.8310, test_loss: 0.9407, test_f1: 0.5307
 epoch: 12, train_loss: 0.8069, test_loss: 1.0409, test_f1: 0.4795
 epoch: 13, train_loss: 0.7799, test_loss: 0.9857, test_f1: 0.5536
 epoch: 14, train_loss: 0.8095, test_loss: 0.9607, test_f1: 0.5687
 epoch: 15, train_loss: 0.7842, test_loss: 1.0916, test_f1: 0.4640
 epoch: 16, train_loss: 0.7657, test_loss: 0.9090, test_f1: 0.5258
 epoch: 17, train_loss: 0.7604, test_loss: 0.9662, test_f1: 0.5146
 epoch: 18, train_loss: 0.7336, test_loss: 0.9467, test_f1: 0.5670
 epoch: 19, train_loss: 0.7040, test_loss: 1.0496, test_f1: 0.5755
 epoch: 20, train_loss: 0.7063, test_loss: 0.8400, test_f1: 0.6250
 epoch: 21, train_loss: 0.7075, test_loss: 0.8429, test_f1: 0.5891
 epoch: 22, train_loss: 0.6999, test_loss: 0.9251, test_f1: 0.6224
 epoch: 23, train_loss: 0.6764, test_loss: 0.8837, test_f1: 0.6042
 epoch: 24, train_loss: 0.6821, test_loss: 0.8796, test_f1: 0.6170
 epoch: 25, train_loss: 0.6965, test_loss: 0.8620, test_f1: 0.5593
 epoch: 26, train_loss: 0.6599, test_loss: 1.1735, test_f1: 0.6016
 epoch: 27, train_loss: 0.6437, test_loss: 1.0007, test_f1: 0.5895
 epoch: 28, train_loss: 0.6546, test_loss: 1.0272, test_f1: 0.5825
 epoch: 29, train_loss: 0.6158, test_loss: 1.0188, test_f1: 0.5712
 epoch: 30, train_loss: 0.6096, test_loss: 0.8237, test_f1: 0.6037
 epoch: 31, train_loss: 0.6003, test_loss: 0.7542, test_f1: 0.6155
 epoch: 32, train_loss: 0.6017, test_loss: 1.1214, test_f1: 0.5841
 epoch: 33, train_loss: 0.5929, test_loss: 1.0077, test_f1: 0.5952
 epoch: 34, train_loss: 0.5810, test_loss: 0.8386, test_f1: 0.6217
 epoch: 35, train_loss: 0.5925, test_loss: 1.2314, test_f1: 0.5601
 epoch: 36, train_loss: 0.6370, test_loss: 0.7997, test_f1: 0.6053
 epoch: 37, train_loss: 0.5938, test_loss: 0.8718, test_f1: 0.5870
 epoch: 38, train_loss: 0.5552, test_loss: 1.0873, test_f1: 0.6079
 epoch: 39, train_loss: 0.5388, test_loss: 0.9135, test_f1: 0.5979
 epoch: 40, train_loss: 0.5314, test_loss: 1.0284, test_f1: 0.5854
 epoch: 41, train_loss: 0.5507, test_loss: 0.9495, test_f1: 0.5974
 epoch: 42, train_loss: 0.5547, test_loss: 0.8961, test_f1: 0.6047
 epoch: 43, train_loss: 0.5454, test_loss: 0.8742, test_f1: 0.6267
 epoch: 44, train_loss: 0.5474, test_loss: 1.0313, test_f1: 0.6056
 epoch: 45, train_loss: 0.5506, test_loss: 1.1197, test_f1: 0.5995
 epoch: 46, train_loss: 0.5171, test_loss: 0.9566, test_f1: 0.5890
 epoch: 47, train_loss: 0.4975, test_loss: 1.0948, test_f1: 0.5980
 epoch: 48, train_loss: 0.4997, test_loss: 0.8826, test_f1: 0.6327
 epoch: 49, train_loss: 0.4977, test_loss: 1.0979, test_f1: 0.6120
 epoch: 50, train_loss: 0.5122, test_loss: 1.0486, test_f1: 0.6497
 epoch: 51, train_loss: 0.4729, test_loss: 0.9765, test_f1: 0.6159
 epoch: 52, train_loss: 0.4380, test_loss: 0.9900, test_f1: 0.6496
 epoch: 53, train_loss: 0.4183, test_loss: 1.0492, test_f1: 0.6326
 epoch: 54, train_loss: 0.4112, test_loss: 1.0683, test_f1: 0.6596
 epoch: 55, train_loss: 0.3889, test_loss: 1.2226, test_f1: 0.6075
 epoch: 56, train_loss: 0.3997, test_loss: 1.1084, test_f1: 0.6415
 epoch: 57, train_loss: 0.3691, test_loss: 1.1954, test_f1: 0.6202
 epoch: 58, train_loss: 0.3724, test_loss: 1.3355, test_f1: 0.5594
 epoch: 59, train_loss: 0.3787, test_loss: 1.2205, test_f1: 0.6112
 epoch: 60, train_loss: 0.3611, test_loss: 1.1201, test_f1: 0.6362
 epoch: 61, train_loss: 0.3659, test_loss: 1.2663, test_f1: 0.6533
 epoch: 62, train_loss: 0.3557, test_loss: 1.2916, test_f1: 0.6307
 epoch: 63, train_loss: 0.3454, test_loss: 1.1128, test_f1: 0.6396
 epoch: 64, train_loss: 0.3508, test_loss: 1.4027, test_f1: 0.6097
 epoch: 65, train_loss: 0.3317, test_loss: 1.2386, test_f1: 0.6613
 epoch: 66, train_loss: 0.3332, test_loss: 1.4086, test_f1: 0.6203
 epoch: 67, train_loss: 0.3267, test_loss: 1.3532, test_f1: 0.6165
 epoch: 68, train_loss: 0.3612, test_loss: 1.2064, test_f1: 0.6212
 epoch: 69, train_loss: 0.3317, test_loss: 1.3144, test_f1: 0.6413
 epoch: 70, train_loss: 0.3299, test_loss: 1.1479, test_f1: 0.6490
 epoch: 71, train_loss: 0.3252, test_loss: 1.1471, test_f1: 0.6385
 epoch: 72, train_loss: 0.3116, test_loss: 1.4334, test_f1: 0.6337
 epoch: 73, train_loss: 0.3118, test_loss: 1.4885, test_f1: 0.5991
 epoch: 74, train_loss: 0.3372, test_loss: 1.0263, test_f1: 0.6208
 epoch: 75, train_loss: 0.3274, test_loss: 1.4900, test_f1: 0.6354
 epoch: 76, train_loss: 0.2929, test_loss: 1.2139, test_f1: 0.6516
 epoch: 77, train_loss: 0.2838, test_loss: 1.3839, test_f1: 0.6161
 epoch: 78, train_loss: 0.2867, test_loss: 1.4837, test_f1: 0.6172
 epoch: 79, train_loss: 0.2807, test_loss: 1.4312, test_f1: 0.6287
 epoch: 80, train_loss: 0.2898, test_loss: 1.0231, test_f1: 0.6259
 epoch: 81, train_loss: 0.2919, test_loss: 1.1705, test_f1: 0.6392
 epoch: 82, train_loss: 0.2666, test_loss: 1.4584, test_f1: 0.6049
 epoch: 83, train_loss: 0.2838, test_loss: 1.4999, test_f1: 0.6034
 epoch: 84, train_loss: 0.2760, test_loss: 1.5500, test_f1: 0.6042
 epoch: 85, train_loss: 0.2847, test_loss: 1.5341, test_f1: 0.5877
 epoch: 86, train_loss: 0.2797, test_loss: 1.5515, test_f1: 0.5983
 epoch: 87, train_loss: 0.2940, test_loss: 1.1938, test_f1: 0.6768
 epoch: 88, train_loss: 0.2974, test_loss: 1.3987, test_f1: 0.6027
 epoch: 89, train_loss: 0.2953, test_loss: 1.2254, test_f1: 0.6313
 epoch: 90, train_loss: 0.2711, test_loss: 1.6252, test_f1: 0.5856
 epoch: 91, train_loss: 0.2650, test_loss: 1.3991, test_f1: 0.6226
 epoch: 92, train_loss: 0.2443, test_loss: 1.4615, test_f1: 0.6294
 epoch: 93, train_loss: 0.2520, test_loss: 1.4228, test_f1: 0.6283
 epoch: 94, train_loss: 0.2571, test_loss: 1.5773, test_f1: 0.6111
 epoch: 95, train_loss: 0.2386, test_loss: 1.4331, test_f1: 0.6501
 epoch: 96, train_loss: 0.2552, test_loss: 1.4234, test_f1: 0.6251
 epoch: 97, train_loss: 0.2504, test_loss: 1.4505, test_f1: 0.6229
 epoch: 98, train_loss: 0.2694, test_loss: 1.3520, test_f1: 0.6496
 epoch: 99, train_loss: 0.2511, test_loss: 1.3647, test_f1: 0.6310
##################ITERATION #2 ****************************************
 epoch: 0, train_loss: 1.4468, test_loss: 1.4152, test_f1: 0.2524
 epoch: 1, train_loss: 1.1422, test_loss: 1.2365, test_f1: 0.3136
 epoch: 2, train_loss: 1.1033, test_loss: 1.0905, test_f1: 0.3658
 epoch: 3, train_loss: 1.0461, test_loss: 1.0009, test_f1: 0.5047
 epoch: 4, train_loss: 0.9627, test_loss: 0.9891, test_f1: 0.5071
 epoch: 5, train_loss: 0.9316, test_loss: 1.0168, test_f1: 0.5369
 epoch: 6, train_loss: 0.9135, test_loss: 1.0101, test_f1: 0.5089
 epoch: 7, train_loss: 0.8944, test_loss: 1.0146, test_f1: 0.5492
 epoch: 8, train_loss: 0.8755, test_loss: 1.0138, test_f1: 0.5261
 epoch: 9, train_loss: 0.8495, test_loss: 0.9533, test_f1: 0.5039
 epoch: 10, train_loss: 0.8213, test_loss: 1.0656, test_f1: 0.5464
 epoch: 11, train_loss: 0.8323, test_loss: 1.0084, test_f1: 0.5497
 epoch: 12, train_loss: 0.8338, test_loss: 0.9424, test_f1: 0.5507
 epoch: 13, train_loss: 0.8121, test_loss: 0.9240, test_f1: 0.5293
 epoch: 14, train_loss: 0.8019, test_loss: 0.9437, test_f1: 0.5812
 epoch: 15, train_loss: 0.7846, test_loss: 1.0178, test_f1: 0.5112
 epoch: 16, train_loss: 0.7966, test_loss: 1.2954, test_f1: 0.4094
 epoch: 17, train_loss: 0.7742, test_loss: 1.0278, test_f1: 0.5453
 epoch: 18, train_loss: 0.7399, test_loss: 0.9076, test_f1: 0.5415
 epoch: 19, train_loss: 0.7328, test_loss: 0.9991, test_f1: 0.5196
 epoch: 20, train_loss: 0.7033, test_loss: 1.1335, test_f1: 0.5615
 epoch: 21, train_loss: 0.7074, test_loss: 0.8330, test_f1: 0.6161
 epoch: 22, train_loss: 0.7007, test_loss: 0.9547, test_f1: 0.5786
 epoch: 23, train_loss: 0.6852, test_loss: 0.8942, test_f1: 0.5983
 epoch: 24, train_loss: 0.6771, test_loss: 0.8279, test_f1: 0.6156
 epoch: 25, train_loss: 0.6416, test_loss: 0.8614, test_f1: 0.6260
 epoch: 26, train_loss: 0.6284, test_loss: 1.1062, test_f1: 0.5789
 epoch: 27, train_loss: 0.6303, test_loss: 1.0340, test_f1: 0.5941
 epoch: 28, train_loss: 0.6571, test_loss: 0.9781, test_f1: 0.5907
 epoch: 29, train_loss: 0.6339, test_loss: 0.9057, test_f1: 0.6236
 epoch: 30, train_loss: 0.6268, test_loss: 1.2412, test_f1: 0.4731
 epoch: 31, train_loss: 0.5912, test_loss: 0.8551, test_f1: 0.5986
 epoch: 32, train_loss: 0.6287, test_loss: 1.0009, test_f1: 0.5866
 epoch: 33, train_loss: 0.6179, test_loss: 0.9775, test_f1: 0.6338
 epoch: 34, train_loss: 0.5823, test_loss: 1.0198, test_f1: 0.6185
 epoch: 35, train_loss: 0.5838, test_loss: 0.9887, test_f1: 0.6086
 epoch: 36, train_loss: 0.5597, test_loss: 0.9963, test_f1: 0.6255
 epoch: 37, train_loss: 0.5475, test_loss: 0.9264, test_f1: 0.6627
 epoch: 38, train_loss: 0.5276, test_loss: 1.0721, test_f1: 0.6445
 epoch: 39, train_loss: 0.5470, test_loss: 1.0217, test_f1: 0.6479
 epoch: 40, train_loss: 0.5465, test_loss: 0.7700, test_f1: 0.6738
 epoch: 41, train_loss: 0.5240, test_loss: 1.1587, test_f1: 0.6056
 epoch: 42, train_loss: 0.5159, test_loss: 0.9649, test_f1: 0.6230
 epoch: 43, train_loss: 0.5357, test_loss: 1.1827, test_f1: 0.5937
 epoch: 44, train_loss: 0.5276, test_loss: 1.0382, test_f1: 0.6096
 epoch: 45, train_loss: 0.5020, test_loss: 1.1151, test_f1: 0.6198
 epoch: 46, train_loss: 0.5021, test_loss: 1.1616, test_f1: 0.5771
 epoch: 47, train_loss: 0.4910, test_loss: 1.0598, test_f1: 0.6101
 epoch: 48, train_loss: 0.4798, test_loss: 1.1285, test_f1: 0.6455
 epoch: 49, train_loss: 0.4786, test_loss: 1.0108, test_f1: 0.6581
 epoch: 50, train_loss: 0.4660, test_loss: 1.1675, test_f1: 0.6279
 epoch: 51, train_loss: 0.4326, test_loss: 1.5030, test_f1: 0.5924
 epoch: 52, train_loss: 0.3799, test_loss: 1.1142, test_f1: 0.6801
 epoch: 53, train_loss: 0.3646, test_loss: 1.2099, test_f1: 0.6577
 epoch: 54, train_loss: 0.3698, test_loss: 1.0731, test_f1: 0.6864
 epoch: 55, train_loss: 0.3511, test_loss: 1.2069, test_f1: 0.6245
 epoch: 56, train_loss: 0.3290, test_loss: 1.2668, test_f1: 0.6590
 epoch: 57, train_loss: 0.3538, test_loss: 1.3863, test_f1: 0.6485
 epoch: 58, train_loss: 0.3457, test_loss: 1.2155, test_f1: 0.6834
 epoch: 59, train_loss: 0.3394, test_loss: 1.1785, test_f1: 0.6614
 epoch: 60, train_loss: 0.3286, test_loss: 1.3960, test_f1: 0.6969
 epoch: 61, train_loss: 0.3420, test_loss: 1.4455, test_f1: 0.6551
 epoch: 62, train_loss: 0.3361, test_loss: 1.2897, test_f1: 0.6558
 epoch: 63, train_loss: 0.3139, test_loss: 1.3062, test_f1: 0.6865
 epoch: 64, train_loss: 0.3379, test_loss: 1.3410, test_f1: 0.6820
 epoch: 65, train_loss: 0.3282, test_loss: 1.2127, test_f1: 0.6620
 epoch: 66, train_loss: 0.3061, test_loss: 1.4653, test_f1: 0.6723
 epoch: 67, train_loss: 0.3073, test_loss: 1.4940, test_f1: 0.6947
 epoch: 68, train_loss: 0.2881, test_loss: 1.4613, test_f1: 0.6784
 epoch: 69, train_loss: 0.2709, test_loss: 1.3753, test_f1: 0.6537
 epoch: 70, train_loss: 0.2843, test_loss: 1.5851, test_f1: 0.6658
 epoch: 71, train_loss: 0.2910, test_loss: 1.6166, test_f1: 0.6388
 epoch: 72, train_loss: 0.2825, test_loss: 1.5561, test_f1: 0.6635
 epoch: 73, train_loss: 0.2833, test_loss: 1.4812, test_f1: 0.6700
 epoch: 74, train_loss: 0.3018, test_loss: 1.4082, test_f1: 0.6767
 epoch: 75, train_loss: 0.3184, test_loss: 1.3564, test_f1: 0.6471
 epoch: 76, train_loss: 0.2880, test_loss: 1.6682, test_f1: 0.6794
 epoch: 77, train_loss: 0.2697, test_loss: 1.5599, test_f1: 0.6456
 epoch: 78, train_loss: 0.2706, test_loss: 1.4930, test_f1: 0.6660
 epoch: 79, train_loss: 0.2425, test_loss: 1.4121, test_f1: 0.6862
 epoch: 80, train_loss: 0.2773, test_loss: 1.6001, test_f1: 0.6715
 epoch: 81, train_loss: 0.2545, test_loss: 1.5718, test_f1: 0.6729
 epoch: 82, train_loss: 0.2611, test_loss: 1.6692, test_f1: 0.6732
 epoch: 83, train_loss: 0.2643, test_loss: 1.6256, test_f1: 0.6352
 epoch: 84, train_loss: 0.2720, test_loss: 1.4653, test_f1: 0.6802
 epoch: 85, train_loss: 0.2743, test_loss: 1.5884, test_f1: 0.6517
 epoch: 86, train_loss: 0.2392, test_loss: 1.6282, test_f1: 0.6676
 epoch: 87, train_loss: 0.2328, test_loss: 1.6792, test_f1: 0.6787
 epoch: 88, train_loss: 0.2631, test_loss: 1.8190, test_f1: 0.6354
 epoch: 89, train_loss: 0.2508, test_loss: 1.5812, test_f1: 0.6211
 epoch: 90, train_loss: 0.2351, test_loss: 1.9396, test_f1: 0.6293
 epoch: 91, train_loss: 0.2474, test_loss: 1.6565, test_f1: 0.6452
 epoch: 92, train_loss: 0.2692, test_loss: 1.9286, test_f1: 0.6513
 epoch: 93, train_loss: 0.2544, test_loss: 1.6379, test_f1: 0.6561
 epoch: 94, train_loss: 0.2475, test_loss: 1.5991, test_f1: 0.6677
 epoch: 95, train_loss: 0.2178, test_loss: 1.7232, test_f1: 0.6673
 epoch: 96, train_loss: 0.2414, test_loss: 1.6761, test_f1: 0.6848
 epoch: 97, train_loss: 0.2213, test_loss: 1.6861, test_f1: 0.6730
 epoch: 98, train_loss: 0.2501, test_loss: 1.6314, test_f1: 0.6781
 epoch: 99, train_loss: 0.2197, test_loss: 1.7527, test_f1: 0.6767
##################ITERATION #3 ****************************************
 epoch: 0, train_loss: 1.2693, test_loss: 1.6163, test_f1: 0.2392
 epoch: 1, train_loss: 1.0091, test_loss: 1.2026, test_f1: 0.3442
 epoch: 2, train_loss: 0.9739, test_loss: 1.0227, test_f1: 0.4365
 epoch: 3, train_loss: 0.9429, test_loss: 1.0121, test_f1: 0.4664
 epoch: 4, train_loss: 0.9181, test_loss: 0.9432, test_f1: 0.4859
 epoch: 5, train_loss: 0.8906, test_loss: 0.9036, test_f1: 0.5293
 epoch: 6, train_loss: 0.8632, test_loss: 0.9681, test_f1: 0.5392
 epoch: 7, train_loss: 0.8642, test_loss: 1.0290, test_f1: 0.4688
 epoch: 8, train_loss: 0.8643, test_loss: 1.0938, test_f1: 0.5236
 epoch: 9, train_loss: 0.8451, test_loss: 0.9931, test_f1: 0.5257
 epoch: 10, train_loss: 0.8146, test_loss: 0.8826, test_f1: 0.5634
 epoch: 11, train_loss: 0.8086, test_loss: 0.9630, test_f1: 0.5536
 epoch: 12, train_loss: 0.7907, test_loss: 0.9491, test_f1: 0.5881
 epoch: 13, train_loss: 0.7687, test_loss: 0.9385, test_f1: 0.5954
 epoch: 14, train_loss: 0.7607, test_loss: 0.9822, test_f1: 0.5943
 epoch: 15, train_loss: 0.7546, test_loss: 0.9056, test_f1: 0.5496
 epoch: 16, train_loss: 0.7741, test_loss: 0.9822, test_f1: 0.5730
 epoch: 17, train_loss: 0.7455, test_loss: 0.9772, test_f1: 0.5937
 epoch: 18, train_loss: 0.7355, test_loss: 0.9550, test_f1: 0.5814
 epoch: 19, train_loss: 0.7124, test_loss: 0.9501, test_f1: 0.5909
 epoch: 20, train_loss: 0.7095, test_loss: 1.1124, test_f1: 0.5536
 epoch: 21, train_loss: 0.6925, test_loss: 0.8253, test_f1: 0.6101
 epoch: 22, train_loss: 0.7088, test_loss: 1.0397, test_f1: 0.5682
 epoch: 23, train_loss: 0.7097, test_loss: 1.0738, test_f1: 0.5802
 epoch: 24, train_loss: 0.6682, test_loss: 1.0003, test_f1: 0.5867
 epoch: 25, train_loss: 0.6727, test_loss: 1.0560, test_f1: 0.5914
 epoch: 26, train_loss: 0.6774, test_loss: 0.9248, test_f1: 0.5909
 epoch: 27, train_loss: 0.6356, test_loss: 1.0923, test_f1: 0.5893
 epoch: 28, train_loss: 0.6242, test_loss: 0.9700, test_f1: 0.5939
 epoch: 29, train_loss: 0.6277, test_loss: 0.9848, test_f1: 0.6011
 epoch: 30, train_loss: 0.6265, test_loss: 0.9924, test_f1: 0.5887
 epoch: 31, train_loss: 0.6183, test_loss: 1.0432, test_f1: 0.5708
 epoch: 32, train_loss: 0.6078, test_loss: 0.8512, test_f1: 0.6405
 epoch: 33, train_loss: 0.6386, test_loss: 1.1620, test_f1: 0.6206
 epoch: 34, train_loss: 0.6303, test_loss: 1.1078, test_f1: 0.5919
 epoch: 35, train_loss: 0.6029, test_loss: 1.1144, test_f1: 0.5936
 epoch: 36, train_loss: 0.5881, test_loss: 1.1968, test_f1: 0.5823
 epoch: 37, train_loss: 0.5703, test_loss: 2.0063, test_f1: 0.4428
 epoch: 38, train_loss: 0.5785, test_loss: 1.2007, test_f1: 0.5734
 epoch: 39, train_loss: 0.5758, test_loss: 1.1731, test_f1: 0.5619
 epoch: 40, train_loss: 0.5583, test_loss: 1.1562, test_f1: 0.6450
 epoch: 41, train_loss: 0.5422, test_loss: 1.1462, test_f1: 0.6088
 epoch: 42, train_loss: 0.5430, test_loss: 1.2187, test_f1: 0.6049
 epoch: 43, train_loss: 0.5448, test_loss: 1.0939, test_f1: 0.6386
 epoch: 44, train_loss: 0.5283, test_loss: 1.2985, test_f1: 0.6281
 epoch: 45, train_loss: 0.5176, test_loss: 1.4160, test_f1: 0.5642
 epoch: 46, train_loss: 0.5045, test_loss: 1.0056, test_f1: 0.6422
 epoch: 47, train_loss: 0.5213, test_loss: 1.2067, test_f1: 0.6349
 epoch: 48, train_loss: 0.4795, test_loss: 1.1235, test_f1: 0.6231
 epoch: 49, train_loss: 0.4901, test_loss: 1.2390, test_f1: 0.5832
 epoch: 50, train_loss: 0.4922, test_loss: 1.2763, test_f1: 0.6069
 epoch: 51, train_loss: 0.4448, test_loss: 1.2797, test_f1: 0.5885
 epoch: 52, train_loss: 0.4300, test_loss: 1.4308, test_f1: 0.6203
 epoch: 53, train_loss: 0.4237, test_loss: 1.3992, test_f1: 0.6396
 epoch: 54, train_loss: 0.3972, test_loss: 1.4435, test_f1: 0.6080
 epoch: 55, train_loss: 0.3806, test_loss: 1.3790, test_f1: 0.6234
 epoch: 56, train_loss: 0.3649, test_loss: 1.3760, test_f1: 0.6236
 epoch: 57, train_loss: 0.3565, test_loss: 1.5951, test_f1: 0.5856
 epoch: 58, train_loss: 0.3636, test_loss: 1.3644, test_f1: 0.6291
 epoch: 59, train_loss: 0.3686, test_loss: 1.4115, test_f1: 0.5847
 epoch: 60, train_loss: 0.3633, test_loss: 1.2609, test_f1: 0.6202
 epoch: 61, train_loss: 0.3488, test_loss: 1.5874, test_f1: 0.6041
 epoch: 62, train_loss: 0.3416, test_loss: 1.3915, test_f1: 0.6356
 epoch: 63, train_loss: 0.3515, test_loss: 1.4506, test_f1: 0.6254
 epoch: 64, train_loss: 0.3426, test_loss: 1.4592, test_f1: 0.6039
 epoch: 65, train_loss: 0.3377, test_loss: 1.2490, test_f1: 0.6148
 epoch: 66, train_loss: 0.3256, test_loss: 1.6520, test_f1: 0.6079
 epoch: 67, train_loss: 0.3221, test_loss: 1.4609, test_f1: 0.6401
 epoch: 68, train_loss: 0.3355, test_loss: 1.3739, test_f1: 0.6365
 epoch: 69, train_loss: 0.3134, test_loss: 1.5157, test_f1: 0.6202
 epoch: 70, train_loss: 0.3230, test_loss: 1.4752, test_f1: 0.6258
 epoch: 71, train_loss: 0.3082, test_loss: 1.5647, test_f1: 0.5903
 epoch: 72, train_loss: 0.3068, test_loss: 1.4107, test_f1: 0.6366
 epoch: 73, train_loss: 0.3007, test_loss: 1.5988, test_f1: 0.6270
 epoch: 74, train_loss: 0.2791, test_loss: 1.5563, test_f1: 0.6357
 epoch: 75, train_loss: 0.2879, test_loss: 1.3964, test_f1: 0.6359
 epoch: 76, train_loss: 0.3073, test_loss: 1.5459, test_f1: 0.6215
 epoch: 77, train_loss: 0.3098, test_loss: 1.8525, test_f1: 0.6000
 epoch: 78, train_loss: 0.2834, test_loss: 1.6856, test_f1: 0.6125
 epoch: 79, train_loss: 0.2947, test_loss: 1.4469, test_f1: 0.6420
 epoch: 80, train_loss: 0.3152, test_loss: 1.5818, test_f1: 0.6478
 epoch: 81, train_loss: 0.3016, test_loss: 1.6349, test_f1: 0.5855
 epoch: 82, train_loss: 0.2918, test_loss: 1.7221, test_f1: 0.6045
 epoch: 83, train_loss: 0.2847, test_loss: 1.5579, test_f1: 0.6457
 epoch: 84, train_loss: 0.2838, test_loss: 1.6198, test_f1: 0.6532
 epoch: 85, train_loss: 0.2708, test_loss: 1.7531, test_f1: 0.6393
 epoch: 86, train_loss: 0.2758, test_loss: 1.5601, test_f1: 0.6282
 epoch: 87, train_loss: 0.2520, test_loss: 1.4940, test_f1: 0.6608
 epoch: 88, train_loss: 0.2750, test_loss: 1.6858, test_f1: 0.6618
 epoch: 89, train_loss: 0.2368, test_loss: 1.6580, test_f1: 0.6426
 epoch: 90, train_loss: 0.2396, test_loss: 1.6868, test_f1: 0.6519
 epoch: 91, train_loss: 0.2563, test_loss: 1.6228, test_f1: 0.6496
 epoch: 92, train_loss: 0.2829, test_loss: 1.8444, test_f1: 0.5903
 epoch: 93, train_loss: 0.2441, test_loss: 1.6552, test_f1: 0.6273
 epoch: 94, train_loss: 0.2372, test_loss: 1.9897, test_f1: 0.6226
 epoch: 95, train_loss: 0.2086, test_loss: 2.2550, test_f1: 0.5845
 epoch: 96, train_loss: 0.2236, test_loss: 1.6369, test_f1: 0.6366
 epoch: 97, train_loss: 0.2215, test_loss: 1.7442, test_f1: 0.6299
 epoch: 98, train_loss: 0.2512, test_loss: 1.9061, test_f1: 0.6352
 epoch: 99, train_loss: 0.2506, test_loss: 1.7302, test_f1: 0.6497
##################ITERATION #4 ****************************************
 epoch: 0, train_loss: 1.4450, test_loss: 1.9777, test_f1: 0.2270
 epoch: 1, train_loss: 1.0281, test_loss: 1.0932, test_f1: 0.3651
 epoch: 2, train_loss: 0.9717, test_loss: 1.4210, test_f1: 0.3270
 epoch: 3, train_loss: 0.9621, test_loss: 1.0463, test_f1: 0.4359
 epoch: 4, train_loss: 0.9438, test_loss: 0.9220, test_f1: 0.5024
 epoch: 5, train_loss: 0.9124, test_loss: 0.9050, test_f1: 0.5459
 epoch: 6, train_loss: 0.8945, test_loss: 1.1645, test_f1: 0.5060
 epoch: 7, train_loss: 0.8782, test_loss: 0.9835, test_f1: 0.4867
 epoch: 8, train_loss: 0.8711, test_loss: 0.9612, test_f1: 0.4645
 epoch: 9, train_loss: 0.8475, test_loss: 0.9012, test_f1: 0.4866
 epoch: 10, train_loss: 0.8383, test_loss: 0.8572, test_f1: 0.5078
 epoch: 11, train_loss: 0.8317, test_loss: 0.8980, test_f1: 0.5219
 epoch: 12, train_loss: 0.8182, test_loss: 0.9578, test_f1: 0.4961
 epoch: 13, train_loss: 0.7961, test_loss: 0.8759, test_f1: 0.4949
 epoch: 14, train_loss: 0.7892, test_loss: 0.9900, test_f1: 0.5054
 epoch: 15, train_loss: 0.7795, test_loss: 0.8220, test_f1: 0.5837
 epoch: 16, train_loss: 0.7932, test_loss: 0.8208, test_f1: 0.5441
 epoch: 17, train_loss: 0.7656, test_loss: 0.8094, test_f1: 0.5409
 epoch: 18, train_loss: 0.7419, test_loss: 0.8491, test_f1: 0.5960
 epoch: 19, train_loss: 0.7385, test_loss: 0.8340, test_f1: 0.5834
 epoch: 20, train_loss: 0.7281, test_loss: 0.8196, test_f1: 0.5837
 epoch: 21, train_loss: 0.7088, test_loss: 0.9431, test_f1: 0.5588
 epoch: 22, train_loss: 0.6993, test_loss: 0.8671, test_f1: 0.5784
 epoch: 23, train_loss: 0.7189, test_loss: 1.2161, test_f1: 0.5613
 epoch: 24, train_loss: 0.7020, test_loss: 0.8328, test_f1: 0.6085
 epoch: 25, train_loss: 0.6886, test_loss: 0.8064, test_f1: 0.6200
 epoch: 26, train_loss: 0.6642, test_loss: 0.8518, test_f1: 0.5971
 epoch: 27, train_loss: 0.6732, test_loss: 0.9329, test_f1: 0.5729
 epoch: 28, train_loss: 0.6595, test_loss: 0.8738, test_f1: 0.6118
 epoch: 29, train_loss: 0.6463, test_loss: 1.0049, test_f1: 0.5591
 epoch: 30, train_loss: 0.6292, test_loss: 1.2779, test_f1: 0.4870
 epoch: 31, train_loss: 0.6638, test_loss: 1.0733, test_f1: 0.5434
 epoch: 32, train_loss: 0.6488, test_loss: 0.9091, test_f1: 0.5961
 epoch: 33, train_loss: 0.6368, test_loss: 0.7928, test_f1: 0.6115
 epoch: 34, train_loss: 0.6190, test_loss: 0.7982, test_f1: 0.6140
 epoch: 35, train_loss: 0.6114, test_loss: 0.8769, test_f1: 0.5821
 epoch: 36, train_loss: 0.6216, test_loss: 0.7772, test_f1: 0.6214
 epoch: 37, train_loss: 0.5891, test_loss: 0.8659, test_f1: 0.5988
 epoch: 38, train_loss: 0.5892, test_loss: 0.7811, test_f1: 0.6293
 epoch: 39, train_loss: 0.5804, test_loss: 0.9950, test_f1: 0.6163
 epoch: 40, train_loss: 0.5817, test_loss: 0.8287, test_f1: 0.6298
 epoch: 41, train_loss: 0.5995, test_loss: 0.9948, test_f1: 0.6042
 epoch: 42, train_loss: 0.5878, test_loss: 0.8379, test_f1: 0.6267
 epoch: 43, train_loss: 0.5828, test_loss: 1.0341, test_f1: 0.5667
 epoch: 44, train_loss: 0.5647, test_loss: 1.0619, test_f1: 0.6186
 epoch: 45, train_loss: 0.5524, test_loss: 0.8573, test_f1: 0.6264
 epoch: 46, train_loss: 0.5506, test_loss: 0.8531, test_f1: 0.6232
 epoch: 47, train_loss: 0.5365, test_loss: 0.9656, test_f1: 0.6127
 epoch: 48, train_loss: 0.5484, test_loss: 1.0417, test_f1: 0.5979
 epoch: 49, train_loss: 0.5370, test_loss: 0.8474, test_f1: 0.6440
 epoch: 50, train_loss: 0.5219, test_loss: 0.9067, test_f1: 0.5887
 epoch: 51, train_loss: 0.5007, test_loss: 0.8594, test_f1: 0.6348
 epoch: 52, train_loss: 0.4781, test_loss: 0.9078, test_f1: 0.6392
 epoch: 53, train_loss: 0.4532, test_loss: 0.8385, test_f1: 0.6664
 epoch: 54, train_loss: 0.4404, test_loss: 0.8224, test_f1: 0.6627
 epoch: 55, train_loss: 0.4437, test_loss: 0.9260, test_f1: 0.6737
 epoch: 56, train_loss: 0.4208, test_loss: 0.8706, test_f1: 0.6613
 epoch: 57, train_loss: 0.4157, test_loss: 0.9865, test_f1: 0.6645
 epoch: 58, train_loss: 0.4106, test_loss: 1.0102, test_f1: 0.6676
 epoch: 59, train_loss: 0.4029, test_loss: 0.9647, test_f1: 0.6644
 epoch: 60, train_loss: 0.4283, test_loss: 1.0832, test_f1: 0.6459
 epoch: 61, train_loss: 0.3983, test_loss: 0.9613, test_f1: 0.6794
 epoch: 62, train_loss: 0.3786, test_loss: 0.9544, test_f1: 0.6753
 epoch: 63, train_loss: 0.3840, test_loss: 1.0759, test_f1: 0.6705
 epoch: 64, train_loss: 0.3748, test_loss: 1.0824, test_f1: 0.6423
 epoch: 65, train_loss: 0.3811, test_loss: 1.0047, test_f1: 0.6656
 epoch: 66, train_loss: 0.3713, test_loss: 0.9497, test_f1: 0.6764
 epoch: 67, train_loss: 0.3744, test_loss: 1.0468, test_f1: 0.6634
 epoch: 68, train_loss: 0.3885, test_loss: 1.1092, test_f1: 0.6681
 epoch: 69, train_loss: 0.3794, test_loss: 1.1268, test_f1: 0.6309
 epoch: 70, train_loss: 0.3946, test_loss: 1.0348, test_f1: 0.6722
 epoch: 71, train_loss: 0.3775, test_loss: 0.9532, test_f1: 0.6657
 epoch: 72, train_loss: 0.3584, test_loss: 1.0866, test_f1: 0.6598
 epoch: 73, train_loss: 0.3384, test_loss: 0.9459, test_f1: 0.6820
 epoch: 74, train_loss: 0.3379, test_loss: 1.1226, test_f1: 0.6196
 epoch: 75, train_loss: 0.3157, test_loss: 1.0238, test_f1: 0.6757
 epoch: 76, train_loss: 0.3359, test_loss: 1.1299, test_f1: 0.6520
 epoch: 77, train_loss: 0.3621, test_loss: 1.1792, test_f1: 0.6608
 epoch: 78, train_loss: 0.3583, test_loss: 1.3368, test_f1: 0.6442
 epoch: 79, train_loss: 0.3348, test_loss: 1.2052, test_f1: 0.6216
 epoch: 80, train_loss: 0.3417, test_loss: 1.3382, test_f1: 0.5936
 epoch: 81, train_loss: 0.3271, test_loss: 1.2028, test_f1: 0.6845
 epoch: 82, train_loss: 0.3172, test_loss: 1.2309, test_f1: 0.6390
 epoch: 83, train_loss: 0.2981, test_loss: 1.3154, test_f1: 0.6259
 epoch: 84, train_loss: 0.3265, test_loss: 1.1102, test_f1: 0.6587
 epoch: 85, train_loss: 0.2973, test_loss: 1.1574, test_f1: 0.6873
 epoch: 86, train_loss: 0.3066, test_loss: 1.2046, test_f1: 0.6395
 epoch: 87, train_loss: 0.3128, test_loss: 1.3508, test_f1: 0.6796
 epoch: 88, train_loss: 0.2888, test_loss: 1.1907, test_f1: 0.6577
 epoch: 89, train_loss: 0.2990, test_loss: 1.2769, test_f1: 0.6042
 epoch: 90, train_loss: 0.3024, test_loss: 1.1905, test_f1: 0.6370
 epoch: 91, train_loss: 0.2855, test_loss: 1.2527, test_f1: 0.6473
 epoch: 92, train_loss: 0.2706, test_loss: 1.1330, test_f1: 0.6500
 epoch: 93, train_loss: 0.2709, test_loss: 1.2845, test_f1: 0.6537
 epoch: 94, train_loss: 0.2848, test_loss: 1.0942, test_f1: 0.6742
 epoch: 95, train_loss: 0.2588, test_loss: 1.2397, test_f1: 0.6515
 epoch: 96, train_loss: 0.2915, test_loss: 1.3205, test_f1: 0.6359
 epoch: 97, train_loss: 0.2642, test_loss: 1.2957, test_f1: 0.6387
 epoch: 98, train_loss: 0.2693, test_loss: 1.4900, test_f1: 0.6238
 epoch: 99, train_loss: 0.2628, test_loss: 1.4769, test_f1: 0.6363
##################ITERATION #5 ****************************************
 epoch: 0, train_loss: 1.5202, test_loss: 2.0698, test_f1: 0.2858
 epoch: 1, train_loss: 1.0321, test_loss: 1.1576, test_f1: 0.3986
 epoch: 2, train_loss: 0.9873, test_loss: 1.0653, test_f1: 0.4143
 epoch: 3, train_loss: 0.9507, test_loss: 1.0114, test_f1: 0.5228
 epoch: 4, train_loss: 0.9199, test_loss: 1.0578, test_f1: 0.5106
 epoch: 5, train_loss: 0.9034, test_loss: 1.0399, test_f1: 0.5070
 epoch: 6, train_loss: 0.8727, test_loss: 0.9051, test_f1: 0.5580
 epoch: 7, train_loss: 0.8643, test_loss: 0.9372, test_f1: 0.5463
 epoch: 8, train_loss: 0.8365, test_loss: 0.8973, test_f1: 0.5240
 epoch: 9, train_loss: 0.8137, test_loss: 0.9929, test_f1: 0.5428
 epoch: 10, train_loss: 0.8089, test_loss: 0.9767, test_f1: 0.5588
 epoch: 11, train_loss: 0.8080, test_loss: 1.5937, test_f1: 0.4097
 epoch: 12, train_loss: 0.7762, test_loss: 0.9470, test_f1: 0.5960
 epoch: 13, train_loss: 0.7619, test_loss: 0.9418, test_f1: 0.5758
 epoch: 14, train_loss: 0.7654, test_loss: 0.9466, test_f1: 0.5321
 epoch: 15, train_loss: 0.7330, test_loss: 0.8736, test_f1: 0.5863
 epoch: 16, train_loss: 0.7168, test_loss: 1.0151, test_f1: 0.5913
 epoch: 17, train_loss: 0.7118, test_loss: 0.9757, test_f1: 0.5290
 epoch: 18, train_loss: 0.7100, test_loss: 1.1448, test_f1: 0.5970
 epoch: 19, train_loss: 0.6946, test_loss: 1.1505, test_f1: 0.5763
 epoch: 20, train_loss: 0.6724, test_loss: 0.9571, test_f1: 0.6212
 epoch: 21, train_loss: 0.6643, test_loss: 0.9689, test_f1: 0.5524
 epoch: 22, train_loss: 0.6332, test_loss: 1.1959, test_f1: 0.5950
 epoch: 23, train_loss: 0.6421, test_loss: 0.9460, test_f1: 0.5833
 epoch: 24, train_loss: 0.6192, test_loss: 0.9430, test_f1: 0.6178
 epoch: 25, train_loss: 0.6183, test_loss: 1.0225, test_f1: 0.6143
 epoch: 26, train_loss: 0.6237, test_loss: 1.1627, test_f1: 0.6185
 epoch: 27, train_loss: 0.5970, test_loss: 0.8834, test_f1: 0.6164
 epoch: 28, train_loss: 0.6087, test_loss: 1.1581, test_f1: 0.5843
 epoch: 29, train_loss: 0.6058, test_loss: 0.7968, test_f1: 0.6518
 epoch: 30, train_loss: 0.6033, test_loss: 1.0084, test_f1: 0.5816
 epoch: 31, train_loss: 0.5839, test_loss: 0.9092, test_f1: 0.6224
 epoch: 32, train_loss: 0.5721, test_loss: 1.0588, test_f1: 0.5721
 epoch: 33, train_loss: 0.5609, test_loss: 1.1230, test_f1: 0.6060
 epoch: 34, train_loss: 0.5491, test_loss: 0.9222, test_f1: 0.6315
 epoch: 35, train_loss: 0.5433, test_loss: 1.1586, test_f1: 0.5923
 epoch: 36, train_loss: 0.5226, test_loss: 0.9511, test_f1: 0.6487
 epoch: 37, train_loss: 0.5240, test_loss: 1.1177, test_f1: 0.6317
 epoch: 38, train_loss: 0.5230, test_loss: 1.2400, test_f1: 0.6281
 epoch: 39, train_loss: 0.5439, test_loss: 0.9016, test_f1: 0.6050
 epoch: 40, train_loss: 0.5199, test_loss: 0.9559, test_f1: 0.6255
 epoch: 41, train_loss: 0.5429, test_loss: 0.9516, test_f1: 0.6451
 epoch: 42, train_loss: 0.5123, test_loss: 1.0176, test_f1: 0.6389
 epoch: 43, train_loss: 0.4948, test_loss: 1.0081, test_f1: 0.6037
 epoch: 44, train_loss: 0.5026, test_loss: 1.0167, test_f1: 0.6233
 epoch: 45, train_loss: 0.5008, test_loss: 1.0425, test_f1: 0.6191
 epoch: 46, train_loss: 0.4924, test_loss: 1.4890, test_f1: 0.5899
 epoch: 47, train_loss: 0.5065, test_loss: 1.2163, test_f1: 0.6224
 epoch: 48, train_loss: 0.4569, test_loss: 1.0369, test_f1: 0.6298
 epoch: 49, train_loss: 0.4489, test_loss: 1.0103, test_f1: 0.6205
 epoch: 50, train_loss: 0.4542, test_loss: 1.0315, test_f1: 0.6392
 epoch: 51, train_loss: 0.4154, test_loss: 1.0886, test_f1: 0.6533
 epoch: 52, train_loss: 0.3863, test_loss: 1.0500, test_f1: 0.6834
 epoch: 53, train_loss: 0.3599, test_loss: 1.1265, test_f1: 0.6840
 epoch: 54, train_loss: 0.3458, test_loss: 1.1576, test_f1: 0.6617
 epoch: 55, train_loss: 0.3244, test_loss: 1.1482, test_f1: 0.6655
 epoch: 56, train_loss: 0.3328, test_loss: 1.2523, test_f1: 0.6472
 epoch: 57, train_loss: 0.3445, test_loss: 1.1986, test_f1: 0.6618
 epoch: 58, train_loss: 0.3461, test_loss: 1.0879, test_f1: 0.6654
 epoch: 59, train_loss: 0.3288, test_loss: 1.3041, test_f1: 0.6620
 epoch: 60, train_loss: 0.3449, test_loss: 1.4140, test_f1: 0.6535
 epoch: 61, train_loss: 0.3114, test_loss: 1.2098, test_f1: 0.6687
 epoch: 62, train_loss: 0.3247, test_loss: 1.3206, test_f1: 0.6763
 epoch: 63, train_loss: 0.2977, test_loss: 1.1183, test_f1: 0.6661
 epoch: 64, train_loss: 0.3053, test_loss: 1.3308, test_f1: 0.6570
 epoch: 65, train_loss: 0.2963, test_loss: 1.3997, test_f1: 0.6473
 epoch: 66, train_loss: 0.2797, test_loss: 1.3385, test_f1: 0.6673
 epoch: 67, train_loss: 0.2994, test_loss: 1.3071, test_f1: 0.6479
 epoch: 68, train_loss: 0.2929, test_loss: 1.1316, test_f1: 0.6665
 epoch: 69, train_loss: 0.3016, test_loss: 1.4135, test_f1: 0.6624
 epoch: 70, train_loss: 0.3172, test_loss: 1.3860, test_f1: 0.6768
 epoch: 71, train_loss: 0.3144, test_loss: 1.2400, test_f1: 0.6508
 epoch: 72, train_loss: 0.2867, test_loss: 1.2600, test_f1: 0.6725
 epoch: 73, train_loss: 0.2618, test_loss: 1.4308, test_f1: 0.6480
 epoch: 74, train_loss: 0.2608, test_loss: 1.4067, test_f1: 0.6544
 epoch: 75, train_loss: 0.2681, test_loss: 1.3911, test_f1: 0.6548
 epoch: 76, train_loss: 0.2964, test_loss: 1.3994, test_f1: 0.6353
 epoch: 77, train_loss: 0.2529, test_loss: 1.3305, test_f1: 0.6620
 epoch: 78, train_loss: 0.2696, test_loss: 1.4784, test_f1: 0.6945
 epoch: 79, train_loss: 0.2545, test_loss: 1.4928, test_f1: 0.6736
 epoch: 80, train_loss: 0.2755, test_loss: 1.4991, test_f1: 0.6427
 epoch: 81, train_loss: 0.2728, test_loss: 1.5046, test_f1: 0.6565
 epoch: 82, train_loss: 0.2622, test_loss: 1.5511, test_f1: 0.6695
 epoch: 83, train_loss: 0.2678, test_loss: 1.6007, test_f1: 0.6527
 epoch: 84, train_loss: 0.2908, test_loss: 1.4446, test_f1: 0.6284
 epoch: 85, train_loss: 0.2670, test_loss: 1.3017, test_f1: 0.6381
 epoch: 86, train_loss: 0.2330, test_loss: 1.5611, test_f1: 0.6478
 epoch: 87, train_loss: 0.2196, test_loss: 1.7042, test_f1: 0.6266
 epoch: 88, train_loss: 0.2112, test_loss: 1.5486, test_f1: 0.6227
 epoch: 89, train_loss: 0.2203, test_loss: 1.3973, test_f1: 0.6493
 epoch: 90, train_loss: 0.2506, test_loss: 1.5004, test_f1: 0.6528
 epoch: 91, train_loss: 0.2439, test_loss: 1.4701, test_f1: 0.6337
 epoch: 92, train_loss: 0.2401, test_loss: 1.4254, test_f1: 0.6634
 epoch: 93, train_loss: 0.2430, test_loss: 1.5728, test_f1: 0.6600
 epoch: 94, train_loss: 0.2360, test_loss: 1.3615, test_f1: 0.6782
 epoch: 95, train_loss: 0.2287, test_loss: 1.7262, test_f1: 0.6299
 epoch: 96, train_loss: 0.2241, test_loss: 1.3759, test_f1: 0.6328
 epoch: 97, train_loss: 0.2286, test_loss: 1.3872, test_f1: 0.6601
 epoch: 98, train_loss: 0.2055, test_loss: 1.5961, test_f1: 0.6388
 epoch: 99, train_loss: 0.2098, test_loss: 1.5349, test_f1: 0.6454
##################ITERATION #6 ****************************************
 epoch: 0, train_loss: 1.8009, test_loss: 1.8148, test_f1: 0.2409
 epoch: 1, train_loss: 1.0426, test_loss: 1.2443, test_f1: 0.3652
 epoch: 2, train_loss: 0.9891, test_loss: 1.0161, test_f1: 0.4419
 epoch: 3, train_loss: 0.9659, test_loss: 0.9807, test_f1: 0.5239
 epoch: 4, train_loss: 0.9442, test_loss: 0.9638, test_f1: 0.5095
 epoch: 5, train_loss: 0.9196, test_loss: 0.9475, test_f1: 0.5295
 epoch: 6, train_loss: 0.9040, test_loss: 0.9942, test_f1: 0.5562
 epoch: 7, train_loss: 0.8835, test_loss: 0.8940, test_f1: 0.5747
 epoch: 8, train_loss: 0.8949, test_loss: 0.9821, test_f1: 0.5342
 epoch: 9, train_loss: 0.8628, test_loss: 0.8905, test_f1: 0.5494
 epoch: 10, train_loss: 0.8406, test_loss: 1.0688, test_f1: 0.4934
 epoch: 11, train_loss: 0.8241, test_loss: 0.9266, test_f1: 0.5468
 epoch: 12, train_loss: 0.8118, test_loss: 0.9472, test_f1: 0.5598
 epoch: 13, train_loss: 0.8361, test_loss: 0.8524, test_f1: 0.5913
 epoch: 14, train_loss: 0.8056, test_loss: 0.8161, test_f1: 0.6095
 epoch: 15, train_loss: 0.7923, test_loss: 0.9144, test_f1: 0.5987
 epoch: 16, train_loss: 0.7937, test_loss: 0.8841, test_f1: 0.6114
 epoch: 17, train_loss: 0.7703, test_loss: 0.9230, test_f1: 0.5789
 epoch: 18, train_loss: 0.7444, test_loss: 0.8392, test_f1: 0.5738
 epoch: 19, train_loss: 0.7440, test_loss: 0.8342, test_f1: 0.5794
 epoch: 20, train_loss: 0.7254, test_loss: 0.8501, test_f1: 0.6107
 epoch: 21, train_loss: 0.7234, test_loss: 0.8260, test_f1: 0.6194
 epoch: 22, train_loss: 0.6957, test_loss: 1.0301, test_f1: 0.5375
 epoch: 23, train_loss: 0.7103, test_loss: 0.9714, test_f1: 0.5522
 epoch: 24, train_loss: 0.6893, test_loss: 0.8736, test_f1: 0.6294
 epoch: 25, train_loss: 0.6793, test_loss: 1.0936, test_f1: 0.4805
 epoch: 26, train_loss: 0.7438, test_loss: 1.1571, test_f1: 0.4333
 epoch: 27, train_loss: 0.7035, test_loss: 0.9813, test_f1: 0.5938
 epoch: 28, train_loss: 0.6610, test_loss: 0.8945, test_f1: 0.6126
 epoch: 29, train_loss: 0.6707, test_loss: 0.8941, test_f1: 0.6054
 epoch: 30, train_loss: 0.6590, test_loss: 0.8870, test_f1: 0.6108
 epoch: 31, train_loss: 0.6329, test_loss: 0.8060, test_f1: 0.6099
 epoch: 32, train_loss: 0.6171, test_loss: 0.8021, test_f1: 0.6185
 epoch: 33, train_loss: 0.6246, test_loss: 0.8403, test_f1: 0.5993
 epoch: 34, train_loss: 0.6103, test_loss: 0.9075, test_f1: 0.6192
 epoch: 35, train_loss: 0.5908, test_loss: 0.8194, test_f1: 0.6318
 epoch: 36, train_loss: 0.5719, test_loss: 1.3316, test_f1: 0.5761
 epoch: 37, train_loss: 0.5685, test_loss: 0.8196, test_f1: 0.6264
 epoch: 38, train_loss: 0.5573, test_loss: 0.9746, test_f1: 0.6343
 epoch: 39, train_loss: 0.5581, test_loss: 0.9674, test_f1: 0.6153
 epoch: 40, train_loss: 0.5601, test_loss: 0.9552, test_f1: 0.6130
 epoch: 41, train_loss: 0.5865, test_loss: 0.8386, test_f1: 0.6400
 epoch: 42, train_loss: 0.5675, test_loss: 0.8246, test_f1: 0.6196
 epoch: 43, train_loss: 0.5347, test_loss: 0.9235, test_f1: 0.6336
 epoch: 44, train_loss: 0.5269, test_loss: 0.7923, test_f1: 0.6688
 epoch: 45, train_loss: 0.5073, test_loss: 0.9503, test_f1: 0.6187
 epoch: 46, train_loss: 0.5030, test_loss: 0.9863, test_f1: 0.6259
 epoch: 47, train_loss: 0.4953, test_loss: 0.8972, test_f1: 0.6388
 epoch: 48, train_loss: 0.4856, test_loss: 0.8339, test_f1: 0.6582
 epoch: 49, train_loss: 0.4866, test_loss: 1.0686, test_f1: 0.6081
 epoch: 50, train_loss: 0.4745, test_loss: 0.8228, test_f1: 0.6729
 epoch: 51, train_loss: 0.4412, test_loss: 0.9575, test_f1: 0.6440
 epoch: 52, train_loss: 0.3989, test_loss: 0.9915, test_f1: 0.6722
 epoch: 53, train_loss: 0.3943, test_loss: 0.8749, test_f1: 0.6596
 epoch: 54, train_loss: 0.3744, test_loss: 0.8969, test_f1: 0.6666
 epoch: 55, train_loss: 0.3687, test_loss: 0.9463, test_f1: 0.6845
 epoch: 56, train_loss: 0.3562, test_loss: 0.9945, test_f1: 0.6771
 epoch: 57, train_loss: 0.3466, test_loss: 1.1962, test_f1: 0.6658
 epoch: 58, train_loss: 0.3638, test_loss: 0.9809, test_f1: 0.6743
 epoch: 59, train_loss: 0.3466, test_loss: 1.1420, test_f1: 0.6656
 epoch: 60, train_loss: 0.3532, test_loss: 1.0148, test_f1: 0.6578
 epoch: 61, train_loss: 0.3481, test_loss: 0.9783, test_f1: 0.6820
 epoch: 62, train_loss: 0.3374, test_loss: 1.2790, test_f1: 0.6442
 epoch: 63, train_loss: 0.3498, test_loss: 0.9220, test_f1: 0.6813
 epoch: 64, train_loss: 0.3529, test_loss: 1.4339, test_f1: 0.6426
 epoch: 65, train_loss: 0.3329, test_loss: 1.0691, test_f1: 0.6759
 epoch: 66, train_loss: 0.3323, test_loss: 1.0349, test_f1: 0.6796
 epoch: 67, train_loss: 0.3081, test_loss: 1.1612, test_f1: 0.6642
 epoch: 68, train_loss: 0.3175, test_loss: 1.1679, test_f1: 0.6735
 epoch: 69, train_loss: 0.2989, test_loss: 1.1008, test_f1: 0.6552
 epoch: 70, train_loss: 0.3065, test_loss: 1.0281, test_f1: 0.6574
 epoch: 71, train_loss: 0.3138, test_loss: 1.2361, test_f1: 0.6238
 epoch: 72, train_loss: 0.2717, test_loss: 1.2416, test_f1: 0.6678
 epoch: 73, train_loss: 0.2607, test_loss: 1.3685, test_f1: 0.6640
 epoch: 74, train_loss: 0.2634, test_loss: 1.3207, test_f1: 0.6813
 epoch: 75, train_loss: 0.2849, test_loss: 1.3047, test_f1: 0.6575
 epoch: 76, train_loss: 0.2939, test_loss: 1.2025, test_f1: 0.6499
 epoch: 77, train_loss: 0.2903, test_loss: 1.2075, test_f1: 0.6179
 epoch: 78, train_loss: 0.2836, test_loss: 1.3094, test_f1: 0.6484
 epoch: 79, train_loss: 0.2588, test_loss: 1.4831, test_f1: 0.6455
 epoch: 80, train_loss: 0.2697, test_loss: 1.0610, test_f1: 0.6609
 epoch: 81, train_loss: 0.2783, test_loss: 1.1825, test_f1: 0.6799
 epoch: 82, train_loss: 0.2593, test_loss: 1.2930, test_f1: 0.6656
 epoch: 83, train_loss: 0.2683, test_loss: 1.2726, test_f1: 0.6668
 epoch: 84, train_loss: 0.2512, test_loss: 1.2948, test_f1: 0.6750
 epoch: 85, train_loss: 0.2430, test_loss: 1.4351, test_f1: 0.6483
 epoch: 86, train_loss: 0.2511, test_loss: 1.3745, test_f1: 0.6756
 epoch: 87, train_loss: 0.2524, test_loss: 1.3769, test_f1: 0.6648
 epoch: 88, train_loss: 0.2443, test_loss: 1.4257, test_f1: 0.6417
 epoch: 89, train_loss: 0.2379, test_loss: 1.4994, test_f1: 0.6533
 epoch: 90, train_loss: 0.2203, test_loss: 1.4413, test_f1: 0.6719
 epoch: 91, train_loss: 0.2331, test_loss: 1.3565, test_f1: 0.6660
 epoch: 92, train_loss: 0.2390, test_loss: 1.3311, test_f1: 0.6568
 epoch: 93, train_loss: 0.2373, test_loss: 1.4448, test_f1: 0.6522
 epoch: 94, train_loss: 0.2248, test_loss: 1.4543, test_f1: 0.6483
 epoch: 95, train_loss: 0.2443, test_loss: 1.5236, test_f1: 0.6491
 epoch: 96, train_loss: 0.2231, test_loss: 1.3788, test_f1: 0.6702
 epoch: 97, train_loss: 0.2342, test_loss: 1.2860, test_f1: 0.6662
 epoch: 98, train_loss: 0.2357, test_loss: 1.2997, test_f1: 0.6457
 epoch: 99, train_loss: 0.2314, test_loss: 1.4841, test_f1: 0.6859
##################ITERATION #7 ****************************************
 epoch: 0, train_loss: 1.8621, test_loss: 1.7803, test_f1: 0.0811
 epoch: 1, train_loss: 1.0461, test_loss: 1.3675, test_f1: 0.3532
 epoch: 2, train_loss: 0.9980, test_loss: 1.1602, test_f1: 0.4259
 epoch: 3, train_loss: 0.9621, test_loss: 1.0187, test_f1: 0.5278
 epoch: 4, train_loss: 0.9346, test_loss: 0.9766, test_f1: 0.5234
 epoch: 5, train_loss: 0.9197, test_loss: 0.9389, test_f1: 0.5604
 epoch: 6, train_loss: 0.9145, test_loss: 0.9618, test_f1: 0.5441
 epoch: 7, train_loss: 0.8729, test_loss: 0.9395, test_f1: 0.5496
 epoch: 8, train_loss: 0.8546, test_loss: 0.9812, test_f1: 0.5535
 epoch: 9, train_loss: 0.8496, test_loss: 0.9247, test_f1: 0.5534
 epoch: 10, train_loss: 0.8305, test_loss: 0.9030, test_f1: 0.5805
 epoch: 11, train_loss: 0.8182, test_loss: 0.9092, test_f1: 0.5542
 epoch: 12, train_loss: 0.8013, test_loss: 1.0393, test_f1: 0.5288
 epoch: 13, train_loss: 0.7975, test_loss: 0.8984, test_f1: 0.5480
 epoch: 14, train_loss: 0.7733, test_loss: 0.8539, test_f1: 0.5584
 epoch: 15, train_loss: 0.7738, test_loss: 0.8767, test_f1: 0.5724
 epoch: 16, train_loss: 0.7520, test_loss: 0.8118, test_f1: 0.6103
 epoch: 17, train_loss: 0.7502, test_loss: 0.9095, test_f1: 0.5906
 epoch: 18, train_loss: 0.7284, test_loss: 1.0466, test_f1: 0.5467
 epoch: 19, train_loss: 0.7243, test_loss: 0.8605, test_f1: 0.5650
 epoch: 20, train_loss: 0.7121, test_loss: 0.8490, test_f1: 0.5996
 epoch: 21, train_loss: 0.6955, test_loss: 0.8067, test_f1: 0.6027
 epoch: 22, train_loss: 0.6934, test_loss: 0.8503, test_f1: 0.5974
 epoch: 23, train_loss: 0.6919, test_loss: 0.8696, test_f1: 0.5896
 epoch: 24, train_loss: 0.6909, test_loss: 0.9243, test_f1: 0.5801
 epoch: 25, train_loss: 0.6766, test_loss: 0.8677, test_f1: 0.5785
 epoch: 26, train_loss: 0.6777, test_loss: 0.8449, test_f1: 0.5717
 epoch: 27, train_loss: 0.6966, test_loss: 1.0518, test_f1: 0.5349
 epoch: 28, train_loss: 0.6677, test_loss: 0.9272, test_f1: 0.5659
 epoch: 29, train_loss: 0.6457, test_loss: 0.9228, test_f1: 0.5865
 epoch: 30, train_loss: 0.6530, test_loss: 0.8879, test_f1: 0.5760
 epoch: 31, train_loss: 0.6398, test_loss: 0.8538, test_f1: 0.6036
 epoch: 32, train_loss: 0.6173, test_loss: 0.8568, test_f1: 0.6144
 epoch: 33, train_loss: 0.6309, test_loss: 1.2873, test_f1: 0.4745
 epoch: 34, train_loss: 0.6203, test_loss: 0.9568, test_f1: 0.5842
 epoch: 35, train_loss: 0.6227, test_loss: 0.7928, test_f1: 0.6252
 epoch: 36, train_loss: 0.6185, test_loss: 0.9731, test_f1: 0.5860
 epoch: 37, train_loss: 0.5957, test_loss: 0.9551, test_f1: 0.5967
 epoch: 38, train_loss: 0.6007, test_loss: 0.8484, test_f1: 0.6174
 epoch: 39, train_loss: 0.5974, test_loss: 0.9675, test_f1: 0.5979
 epoch: 40, train_loss: 0.6000, test_loss: 1.0914, test_f1: 0.5725
 epoch: 41, train_loss: 0.5718, test_loss: 0.9709, test_f1: 0.6650
 epoch: 42, train_loss: 0.5680, test_loss: 0.8946, test_f1: 0.6238
 epoch: 43, train_loss: 0.5549, test_loss: 1.0615, test_f1: 0.6033
 epoch: 44, train_loss: 0.5691, test_loss: 1.0115, test_f1: 0.6574
 epoch: 45, train_loss: 0.5647, test_loss: 0.8747, test_f1: 0.6343
 epoch: 46, train_loss: 0.5365, test_loss: 1.1054, test_f1: 0.6010
 epoch: 47, train_loss: 0.5385, test_loss: 1.2727, test_f1: 0.6026
 epoch: 48, train_loss: 0.5353, test_loss: 0.8945, test_f1: 0.6210
 epoch: 49, train_loss: 0.5231, test_loss: 0.8584, test_f1: 0.6374
 epoch: 50, train_loss: 0.5406, test_loss: 1.0030, test_f1: 0.5974
 epoch: 51, train_loss: 0.5140, test_loss: 0.8881, test_f1: 0.6239
 epoch: 52, train_loss: 0.4981, test_loss: 0.8941, test_f1: 0.6403
 epoch: 53, train_loss: 0.4566, test_loss: 0.8484, test_f1: 0.6330
 epoch: 54, train_loss: 0.4378, test_loss: 1.0539, test_f1: 0.6357
 epoch: 55, train_loss: 0.4354, test_loss: 0.9888, test_f1: 0.6608
 epoch: 56, train_loss: 0.4251, test_loss: 0.8799, test_f1: 0.6687
 epoch: 57, train_loss: 0.4129, test_loss: 0.9182, test_f1: 0.6434
 epoch: 58, train_loss: 0.4189, test_loss: 0.8546, test_f1: 0.6565
 epoch: 59, train_loss: 0.3847, test_loss: 1.0516, test_f1: 0.6728
 epoch: 60, train_loss: 0.3849, test_loss: 1.0960, test_f1: 0.6530
 epoch: 61, train_loss: 0.3788, test_loss: 0.9278, test_f1: 0.6612
 epoch: 62, train_loss: 0.3866, test_loss: 0.8809, test_f1: 0.6488
 epoch: 63, train_loss: 0.3860, test_loss: 1.0678, test_f1: 0.6672
 epoch: 64, train_loss: 0.3746, test_loss: 0.9697, test_f1: 0.6579
 epoch: 65, train_loss: 0.3713, test_loss: 0.9682, test_f1: 0.6543
 epoch: 66, train_loss: 0.3664, test_loss: 1.1233, test_f1: 0.6617
 epoch: 67, train_loss: 0.3597, test_loss: 1.4040, test_f1: 0.6274
 epoch: 68, train_loss: 0.3502, test_loss: 0.9298, test_f1: 0.6590
 epoch: 69, train_loss: 0.3749, test_loss: 1.1923, test_f1: 0.6468
 epoch: 70, train_loss: 0.3559, test_loss: 1.5135, test_f1: 0.6171
 epoch: 71, train_loss: 0.3531, test_loss: 1.2614, test_f1: 0.6216
 epoch: 72, train_loss: 0.3600, test_loss: 1.0409, test_f1: 0.6461
 epoch: 73, train_loss: 0.3551, test_loss: 1.4279, test_f1: 0.6248
 epoch: 74, train_loss: 0.3302, test_loss: 1.2900, test_f1: 0.6543
 epoch: 75, train_loss: 0.3599, test_loss: 1.1883, test_f1: 0.6047
 epoch: 76, train_loss: 0.3366, test_loss: 1.1832, test_f1: 0.6464
 epoch: 77, train_loss: 0.3294, test_loss: 1.0725, test_f1: 0.6451
 epoch: 78, train_loss: 0.3079, test_loss: 1.4306, test_f1: 0.6241
 epoch: 79, train_loss: 0.3085, test_loss: 1.1887, test_f1: 0.6528
 epoch: 80, train_loss: 0.3078, test_loss: 1.2035, test_f1: 0.6349
 epoch: 81, train_loss: 0.3289, test_loss: 1.5684, test_f1: 0.6267
 epoch: 82, train_loss: 0.3430, test_loss: 1.0180, test_f1: 0.6602
 epoch: 83, train_loss: 0.3210, test_loss: 1.1842, test_f1: 0.6326
 epoch: 84, train_loss: 0.3052, test_loss: 1.3779, test_f1: 0.6414
 epoch: 85, train_loss: 0.3173, test_loss: 1.8492, test_f1: 0.6274
 epoch: 86, train_loss: 0.3348, test_loss: 1.2406, test_f1: 0.6551
 epoch: 87, train_loss: 0.3298, test_loss: 1.5696, test_f1: 0.6249
 epoch: 88, train_loss: 0.3463, test_loss: 1.4059, test_f1: 0.6454
 epoch: 89, train_loss: 0.3233, test_loss: 1.1578, test_f1: 0.6525
 epoch: 90, train_loss: 0.3170, test_loss: 1.2205, test_f1: 0.6198
 epoch: 91, train_loss: 0.3035, test_loss: 1.5897, test_f1: 0.6740
 epoch: 92, train_loss: 0.3087, test_loss: 1.4502, test_f1: 0.6480
 epoch: 93, train_loss: 0.2934, test_loss: 1.3640, test_f1: 0.6481
 epoch: 94, train_loss: 0.2953, test_loss: 1.6666, test_f1: 0.6268
 epoch: 95, train_loss: 0.2877, test_loss: 1.3308, test_f1: 0.6612
 epoch: 96, train_loss: 0.3007, test_loss: 1.5752, test_f1: 0.6450
 epoch: 97, train_loss: 0.2835, test_loss: 1.2039, test_f1: 0.6447
 epoch: 98, train_loss: 0.2866, test_loss: 1.5136, test_f1: 0.6697
 epoch: 99, train_loss: 0.2534, test_loss: 1.6844, test_f1: 0.6277
##################ITERATION #8 ****************************************
 epoch: 0, train_loss: 1.8538, test_loss: 3.9512, test_f1: 0.2581
 epoch: 1, train_loss: 1.0353, test_loss: 1.1628, test_f1: 0.4210
 epoch: 2, train_loss: 0.9524, test_loss: 0.9736, test_f1: 0.5244
 epoch: 3, train_loss: 0.9210, test_loss: 1.0053, test_f1: 0.4602
 epoch: 4, train_loss: 0.8970, test_loss: 0.9427, test_f1: 0.5292
 epoch: 5, train_loss: 0.8672, test_loss: 0.9290, test_f1: 0.5482
 epoch: 6, train_loss: 0.8493, test_loss: 1.1238, test_f1: 0.4773
 epoch: 7, train_loss: 0.8364, test_loss: 1.0348, test_f1: 0.5727
 epoch: 8, train_loss: 0.8228, test_loss: 1.0168, test_f1: 0.5926
 epoch: 9, train_loss: 0.8031, test_loss: 1.0323, test_f1: 0.5705
 epoch: 10, train_loss: 0.8205, test_loss: 1.0727, test_f1: 0.5593
 epoch: 11, train_loss: 0.8049, test_loss: 1.1388, test_f1: 0.5281
 epoch: 12, train_loss: 0.7833, test_loss: 1.0891, test_f1: 0.5489
 epoch: 13, train_loss: 0.7680, test_loss: 0.9588, test_f1: 0.5861
 epoch: 14, train_loss: 0.7542, test_loss: 1.0594, test_f1: 0.5628
 epoch: 15, train_loss: 0.7266, test_loss: 1.0479, test_f1: 0.5892
 epoch: 16, train_loss: 0.7426, test_loss: 0.9277, test_f1: 0.5930
 epoch: 17, train_loss: 0.7287, test_loss: 1.2603, test_f1: 0.5299
 epoch: 18, train_loss: 0.7068, test_loss: 0.9360, test_f1: 0.5877
 epoch: 19, train_loss: 0.7136, test_loss: 1.0337, test_f1: 0.5522
 epoch: 20, train_loss: 0.6918, test_loss: 0.9100, test_f1: 0.6380
 epoch: 21, train_loss: 0.6822, test_loss: 1.0411, test_f1: 0.6099
 epoch: 22, train_loss: 0.6718, test_loss: 1.1263, test_f1: 0.5264
 epoch: 23, train_loss: 0.6839, test_loss: 1.0064, test_f1: 0.5692
 epoch: 24, train_loss: 0.6610, test_loss: 0.9795, test_f1: 0.6028
 epoch: 25, train_loss: 0.6390, test_loss: 0.9749, test_f1: 0.5991
 epoch: 26, train_loss: 0.6392, test_loss: 1.0368, test_f1: 0.6207
 epoch: 27, train_loss: 0.6338, test_loss: 0.8465, test_f1: 0.6251
 epoch: 28, train_loss: 0.6196, test_loss: 0.8747, test_f1: 0.6309
 epoch: 29, train_loss: 0.6115, test_loss: 0.9518, test_f1: 0.6104
 epoch: 30, train_loss: 0.6128, test_loss: 1.0331, test_f1: 0.6270
 epoch: 31, train_loss: 0.5992, test_loss: 1.3839, test_f1: 0.5309
 epoch: 32, train_loss: 0.5822, test_loss: 1.1700, test_f1: 0.5928
 epoch: 33, train_loss: 0.6037, test_loss: 0.9277, test_f1: 0.6285
 epoch: 34, train_loss: 0.5960, test_loss: 1.0748, test_f1: 0.6226
 epoch: 35, train_loss: 0.5934, test_loss: 1.0425, test_f1: 0.6037
 epoch: 36, train_loss: 0.5656, test_loss: 1.1099, test_f1: 0.6068
 epoch: 37, train_loss: 0.5623, test_loss: 0.9317, test_f1: 0.5908
 epoch: 38, train_loss: 0.5748, test_loss: 1.0350, test_f1: 0.6583
 epoch: 39, train_loss: 0.5772, test_loss: 0.9911, test_f1: 0.5715
 epoch: 40, train_loss: 0.5733, test_loss: 1.2604, test_f1: 0.5855
 epoch: 41, train_loss: 0.6271, test_loss: 1.1463, test_f1: 0.5505
 epoch: 42, train_loss: 0.5445, test_loss: 1.0957, test_f1: 0.6293
 epoch: 43, train_loss: 0.5264, test_loss: 0.9816, test_f1: 0.6096
 epoch: 44, train_loss: 0.5286, test_loss: 1.2258, test_f1: 0.5819
 epoch: 45, train_loss: 0.5338, test_loss: 1.0768, test_f1: 0.6300
 epoch: 46, train_loss: 0.5323, test_loss: 1.1446, test_f1: 0.6172
 epoch: 47, train_loss: 0.5108, test_loss: 0.9871, test_f1: 0.6684
 epoch: 48, train_loss: 0.4856, test_loss: 1.2298, test_f1: 0.6370
 epoch: 49, train_loss: 0.5067, test_loss: 1.5451, test_f1: 0.5719
 epoch: 50, train_loss: 0.5341, test_loss: 1.0565, test_f1: 0.6048
 epoch: 51, train_loss: 0.4949, test_loss: 1.1891, test_f1: 0.6518
 epoch: 52, train_loss: 0.4546, test_loss: 1.1167, test_f1: 0.6670
 epoch: 53, train_loss: 0.4459, test_loss: 1.0506, test_f1: 0.6524
 epoch: 54, train_loss: 0.4277, test_loss: 1.1127, test_f1: 0.6408
 epoch: 55, train_loss: 0.4250, test_loss: 1.1623, test_f1: 0.6308
 epoch: 56, train_loss: 0.4051, test_loss: 1.2419, test_f1: 0.6263
 epoch: 57, train_loss: 0.3987, test_loss: 1.1129, test_f1: 0.6576
 epoch: 58, train_loss: 0.3775, test_loss: 1.1015, test_f1: 0.6503
 epoch: 59, train_loss: 0.4087, test_loss: 1.2007, test_f1: 0.6338
 epoch: 60, train_loss: 0.3962, test_loss: 1.2781, test_f1: 0.6405
 epoch: 61, train_loss: 0.3863, test_loss: 1.5465, test_f1: 0.6297
 epoch: 62, train_loss: 0.3764, test_loss: 1.2081, test_f1: 0.6446
 epoch: 63, train_loss: 0.3587, test_loss: 1.1615, test_f1: 0.6668
 epoch: 64, train_loss: 0.3579, test_loss: 1.2383, test_f1: 0.6583
 epoch: 65, train_loss: 0.3435, test_loss: 1.2637, test_f1: 0.6617
 epoch: 66, train_loss: 0.3484, test_loss: 1.3025, test_f1: 0.6236
 epoch: 67, train_loss: 0.3486, test_loss: 1.3196, test_f1: 0.6247
 epoch: 68, train_loss: 0.3811, test_loss: 1.2382, test_f1: 0.6448
 epoch: 69, train_loss: 0.3612, test_loss: 1.4112, test_f1: 0.6475
 epoch: 70, train_loss: 0.3501, test_loss: 1.3394, test_f1: 0.6412
 epoch: 71, train_loss: 0.3424, test_loss: 1.3629, test_f1: 0.6115
 epoch: 72, train_loss: 0.3446, test_loss: 1.5940, test_f1: 0.6485
 epoch: 73, train_loss: 0.3395, test_loss: 1.3382, test_f1: 0.6228
 epoch: 74, train_loss: 0.3325, test_loss: 1.3147, test_f1: 0.6451
 epoch: 75, train_loss: 0.3242, test_loss: 1.6770, test_f1: 0.6443
 epoch: 76, train_loss: 0.3377, test_loss: 1.4895, test_f1: 0.6493
 epoch: 77, train_loss: 0.3599, test_loss: 1.2883, test_f1: 0.6464
 epoch: 78, train_loss: 0.3634, test_loss: 1.4493, test_f1: 0.6627
 epoch: 79, train_loss: 0.3337, test_loss: 1.3908, test_f1: 0.6486
 epoch: 80, train_loss: 0.3325, test_loss: 1.4322, test_f1: 0.6518
 epoch: 81, train_loss: 0.3279, test_loss: 1.4584, test_f1: 0.6350
 epoch: 82, train_loss: 0.3164, test_loss: 1.7702, test_f1: 0.6429
 epoch: 83, train_loss: 0.3274, test_loss: 1.9201, test_f1: 0.6433
 epoch: 84, train_loss: 0.3150, test_loss: 1.4925, test_f1: 0.6283
 epoch: 85, train_loss: 0.3023, test_loss: 1.5129, test_f1: 0.6285
 epoch: 86, train_loss: 0.3090, test_loss: 1.4045, test_f1: 0.6342
 epoch: 87, train_loss: 0.2916, test_loss: 1.4826, test_f1: 0.6308
 epoch: 88, train_loss: 0.2791, test_loss: 1.7010, test_f1: 0.6108
 epoch: 89, train_loss: 0.3096, test_loss: 1.8208, test_f1: 0.6189
 epoch: 90, train_loss: 0.3052, test_loss: 1.5104, test_f1: 0.6585
 epoch: 91, train_loss: 0.2929, test_loss: 1.4275, test_f1: 0.6552
 epoch: 92, train_loss: 0.3020, test_loss: 1.5768, test_f1: 0.6438
 epoch: 93, train_loss: 0.3088, test_loss: 1.3955, test_f1: 0.6421
 epoch: 94, train_loss: 0.3022, test_loss: 1.6703, test_f1: 0.6231
 epoch: 95, train_loss: 0.2932, test_loss: 1.6853, test_f1: 0.6528
 epoch: 96, train_loss: 0.3025, test_loss: 1.7700, test_f1: 0.6381
 epoch: 97, train_loss: 0.3055, test_loss: 1.5540, test_f1: 0.6180
 epoch: 98, train_loss: 0.2684, test_loss: 1.5229, test_f1: 0.6535
 epoch: 99, train_loss: 0.2929, test_loss: 1.6119, test_f1: 0.6562
##################ITERATION #9 ****************************************
 epoch: 0, train_loss: 1.7052, test_loss: 3.3376, test_f1: 0.0844
 epoch: 1, train_loss: 1.0292, test_loss: 1.2169, test_f1: 0.3640
 epoch: 2, train_loss: 0.9903, test_loss: 1.0039, test_f1: 0.4947
 epoch: 3, train_loss: 0.9802, test_loss: 1.0275, test_f1: 0.5213
 epoch: 4, train_loss: 0.9627, test_loss: 0.9673, test_f1: 0.5316
 epoch: 5, train_loss: 0.9248, test_loss: 0.9829, test_f1: 0.5271
 epoch: 6, train_loss: 0.9172, test_loss: 1.0313, test_f1: 0.4865
 epoch: 7, train_loss: 0.8828, test_loss: 0.9885, test_f1: 0.5314
 epoch: 8, train_loss: 0.8846, test_loss: 0.9755, test_f1: 0.5521
 epoch: 9, train_loss: 0.8914, test_loss: 1.0302, test_f1: 0.5531
 epoch: 10, train_loss: 0.8478, test_loss: 0.8740, test_f1: 0.5987
 epoch: 11, train_loss: 0.8339, test_loss: 0.9395, test_f1: 0.5701
 epoch: 12, train_loss: 0.8193, test_loss: 0.8829, test_f1: 0.5686
 epoch: 13, train_loss: 0.8044, test_loss: 0.8711, test_f1: 0.5898
 epoch: 14, train_loss: 0.7966, test_loss: 0.8331, test_f1: 0.5888
 epoch: 15, train_loss: 0.7796, test_loss: 0.8539, test_f1: 0.6108
 epoch: 16, train_loss: 0.8054, test_loss: 0.9788, test_f1: 0.5367
 epoch: 17, train_loss: 0.7563, test_loss: 0.9084, test_f1: 0.5598
 epoch: 18, train_loss: 0.7560, test_loss: 1.0345, test_f1: 0.5726
 epoch: 19, train_loss: 0.7469, test_loss: 0.9041, test_f1: 0.5974
 epoch: 20, train_loss: 0.7283, test_loss: 0.8618, test_f1: 0.6009
 epoch: 21, train_loss: 0.7168, test_loss: 0.8754, test_f1: 0.6083
 epoch: 22, train_loss: 0.7106, test_loss: 0.8510, test_f1: 0.5963
 epoch: 23, train_loss: 0.6947, test_loss: 0.9492, test_f1: 0.5859
 epoch: 24, train_loss: 0.6925, test_loss: 1.0997, test_f1: 0.5355
 epoch: 25, train_loss: 0.6688, test_loss: 0.9410, test_f1: 0.5894
 epoch: 26, train_loss: 0.6889, test_loss: 1.0737, test_f1: 0.5520
 epoch: 27, train_loss: 0.7015, test_loss: 0.8354, test_f1: 0.6032
 epoch: 28, train_loss: 0.6798, test_loss: 0.9205, test_f1: 0.6230
 epoch: 29, train_loss: 0.6586, test_loss: 0.9018, test_f1: 0.6090
 epoch: 30, train_loss: 0.6541, test_loss: 0.8869, test_f1: 0.5903
 epoch: 31, train_loss: 0.6414, test_loss: 0.9483, test_f1: 0.6054
 epoch: 32, train_loss: 0.6256, test_loss: 0.9329, test_f1: 0.6278
 epoch: 33, train_loss: 0.6167, test_loss: 0.9490, test_f1: 0.5867
 epoch: 34, train_loss: 0.6204, test_loss: 1.0851, test_f1: 0.6204
 epoch: 35, train_loss: 0.5879, test_loss: 1.0261, test_f1: 0.5984
 epoch: 36, train_loss: 0.5711, test_loss: 0.8538, test_f1: 0.6313
 epoch: 37, train_loss: 0.5805, test_loss: 0.8732, test_f1: 0.6070
 epoch: 38, train_loss: 0.5868, test_loss: 1.0564, test_f1: 0.5948
 epoch: 39, train_loss: 0.5704, test_loss: 0.9626, test_f1: 0.6360
 epoch: 40, train_loss: 0.5638, test_loss: 1.0566, test_f1: 0.5701
 epoch: 41, train_loss: 0.5579, test_loss: 0.9752, test_f1: 0.6247
 epoch: 42, train_loss: 0.5362, test_loss: 0.9849, test_f1: 0.6451
 epoch: 43, train_loss: 0.5524, test_loss: 0.9203, test_f1: 0.6301
 epoch: 44, train_loss: 0.5406, test_loss: 1.0114, test_f1: 0.5987
 epoch: 45, train_loss: 0.5598, test_loss: 1.0625, test_f1: 0.6349
 epoch: 46, train_loss: 0.5216, test_loss: 1.0071, test_f1: 0.6241
 epoch: 47, train_loss: 0.5132, test_loss: 0.8188, test_f1: 0.6426
 epoch: 48, train_loss: 0.5220, test_loss: 0.9382, test_f1: 0.6368
 epoch: 49, train_loss: 0.4899, test_loss: 1.0568, test_f1: 0.6167
 epoch: 50, train_loss: 0.5089, test_loss: 1.1985, test_f1: 0.6317
 epoch: 51, train_loss: 0.4630, test_loss: 1.0792, test_f1: 0.6386
 epoch: 52, train_loss: 0.4172, test_loss: 1.1302, test_f1: 0.6534
 epoch: 53, train_loss: 0.4174, test_loss: 1.0732, test_f1: 0.6299
 epoch: 54, train_loss: 0.4007, test_loss: 1.0954, test_f1: 0.6421
 epoch: 55, train_loss: 0.4061, test_loss: 0.9793, test_f1: 0.6459
 epoch: 56, train_loss: 0.3798, test_loss: 1.2016, test_f1: 0.6449
 epoch: 57, train_loss: 0.3747, test_loss: 1.0390, test_f1: 0.6643
 epoch: 58, train_loss: 0.3574, test_loss: 1.1547, test_f1: 0.6294
 epoch: 59, train_loss: 0.3750, test_loss: 1.0224, test_f1: 0.6537
 epoch: 60, train_loss: 0.3720, test_loss: 1.1422, test_f1: 0.6403
 epoch: 61, train_loss: 0.3753, test_loss: 1.2209, test_f1: 0.6471
 epoch: 62, train_loss: 0.3775, test_loss: 1.2919, test_f1: 0.6549
 epoch: 63, train_loss: 0.3525, test_loss: 1.0624, test_f1: 0.6775
 epoch: 64, train_loss: 0.3242, test_loss: 1.1991, test_f1: 0.6384
 epoch: 65, train_loss: 0.3321, test_loss: 1.3563, test_f1: 0.6356
 epoch: 66, train_loss: 0.3526, test_loss: 1.2314, test_f1: 0.6330
 epoch: 67, train_loss: 0.3467, test_loss: 1.2722, test_f1: 0.6333
 epoch: 68, train_loss: 0.3505, test_loss: 1.2329, test_f1: 0.6258
 epoch: 69, train_loss: 0.3257, test_loss: 1.2853, test_f1: 0.6232
 epoch: 70, train_loss: 0.3090, test_loss: 1.3725, test_f1: 0.6211
 epoch: 71, train_loss: 0.3216, test_loss: 1.2516, test_f1: 0.6534
 epoch: 72, train_loss: 0.3368, test_loss: 1.2312, test_f1: 0.6445
 epoch: 73, train_loss: 0.3251, test_loss: 1.4492, test_f1: 0.6337
 epoch: 74, train_loss: 0.3084, test_loss: 1.2665, test_f1: 0.6550
 epoch: 75, train_loss: 0.3079, test_loss: 1.2722, test_f1: 0.6396
 epoch: 76, train_loss: 0.3014, test_loss: 1.1975, test_f1: 0.6417
 epoch: 77, train_loss: 0.2910, test_loss: 1.3323, test_f1: 0.6474
 epoch: 78, train_loss: 0.2793, test_loss: 1.3857, test_f1: 0.6349
 epoch: 79, train_loss: 0.2928, test_loss: 1.2611, test_f1: 0.6616
 epoch: 80, train_loss: 0.2981, test_loss: 1.3765, test_f1: 0.6388
 epoch: 81, train_loss: 0.3138, test_loss: 1.4240, test_f1: 0.6407
 epoch: 82, train_loss: 0.2911, test_loss: 1.5043, test_f1: 0.6288
 epoch: 83, train_loss: 0.2839, test_loss: 1.3354, test_f1: 0.6219
 epoch: 84, train_loss: 0.2701, test_loss: 1.3038, test_f1: 0.6542
 epoch: 85, train_loss: 0.2660, test_loss: 1.5789, test_f1: 0.6091
 epoch: 86, train_loss: 0.2537, test_loss: 1.4397, test_f1: 0.6425
 epoch: 87, train_loss: 0.2464, test_loss: 1.5960, test_f1: 0.6257
 epoch: 88, train_loss: 0.2652, test_loss: 1.5415, test_f1: 0.6311
 epoch: 89, train_loss: 0.2664, test_loss: 1.6775, test_f1: 0.6065
 epoch: 90, train_loss: 0.2638, test_loss: 1.5357, test_f1: 0.6399
 epoch: 91, train_loss: 0.2701, test_loss: 1.6130, test_f1: 0.6269
 epoch: 92, train_loss: 0.2703, test_loss: 1.7404, test_f1: 0.6375
 epoch: 93, train_loss: 0.2557, test_loss: 1.5168, test_f1: 0.6592
 epoch: 94, train_loss: 0.2692, test_loss: 1.5742, test_f1: 0.6229
 epoch: 95, train_loss: 0.2450, test_loss: 1.6093, test_f1: 0.6155
 epoch: 96, train_loss: 0.2674, test_loss: 1.5963, test_f1: 0.6478
 epoch: 97, train_loss: 0.2620, test_loss: 1.4333, test_f1: 0.6188
 epoch: 98, train_loss: 0.2776, test_loss: 1.5143, test_f1: 0.5879
 epoch: 99, train_loss: 0.2681, test_loss: 1.6033, test_f1: 0.6336

Training completed in 503.78 seconds
Best F1: 0.7159 at epoch 73
Mean F1 across iterations: 0.6839  0.0150
========================FINAL RESULTS================================
FEGIN weighted F1: 0.7159  0.0150
python main.py --data ltspice_examples --representation component_pin_net --model FEGIN --layers 5 --hiddens 128 --batch_size 256 --lr 0.01 --emb_size 512 --epochs 100 --save_appendix component_pin_net_L5_H128_BS256_LR0.01_E512 --no_val
-----



STDERR:
Processing...
Done!
  File "main.py", line 370, in <module>
    main()
  File "main.py", line 254, in main
    dataset = dataset_class(
  File "/home/philip/projects/ltspice_examples_code_repo/Circuit-Completion-Using-GNNs/component_classification_with_link_prediction_head/evaluation/FEGIN/kernel/circuit_datasets.py", line 15, in __init__
    self.data, self.slices = torch.load(self.processed_paths[0])
  File "/home/philip/.local/lib/python3.8/site-packages/torch/serialization.py", line 1040, in load
    warnings.warn(
  File "/usr/lib/python3.8/warnings.py", line 109, in _showwarnmsg
    sw(msg.message, msg.category, msg.filename, msg.lineno,
  File "main.py", line 47, in warn_with_traceback
    traceback.print_stack(file=log)
/home/philip/projects/ltspice_examples_code_repo/Circuit-Completion-Using-GNNs/component_classification_with_link_prediction_head/evaluation/FEGIN/kernel/circuit_datasets.py:15: FutureWarning: You are using `torch.load` with `weights_only=False` (the current default value), which uses the default pickle module implicitly. It is possible to construct malicious pickle data which will execute arbitrary code during unpickling (See https://github.com/pytorch/pytorch/blob/main/SECURITY.md#untrusted-models for more details). In a future release, the default value for `weights_only` will be flipped to `True`. This limits the functions that could be executed during unpickling. Arbitrary objects will no longer be allowed to be loaded via this mode unless they are explicitly allowlisted by the user via `torch.serialization.add_safe_globals`. We recommend you start setting `weights_only=True` for any use case where you don't have full control of the loaded file. Please open an issue on GitHub for any issues related to this experimental feature.
  self.data, self.slices = torch.load(self.processed_paths[0])
