STDOUT:
Results will be saved in /home/philip/projects/ltspice_examples_code_repo/Circuit-Completion-Using-GNNs/component_classification_with_link_prediction_head/evaluation/FEGIN/results/model_FEGIN_dataset_ltspice_examples
Command line input: python main.py --data ltspice_examples --representation component_pin --model FEGIN --layers 6 --hiddens 64 --batch_size 256 --lr 0.001 --emb_size 128 --epochs 100 --save_appendix component_pin_L6_H64_BS256_LR0.001_E128 --no_val
 is saved.
-----
ltspice_examples - FEGIN
Using 6 layers, 64 hidden units, h = 2
Loading component_pin representation dataset
ENTERED
Training FEGIN on component_pin representation
Train: 3560, Test: 848
##################ITERATION #0 ****************************************
 epoch: 0, train_loss: 1.3393, test_loss: 1.3311, test_f1: 0.2260
 epoch: 1, train_loss: 1.2282, test_loss: 1.3115, test_f1: 0.2553
 epoch: 2, train_loss: 1.1796, test_loss: 1.3044, test_f1: 0.2685
 epoch: 3, train_loss: 1.1321, test_loss: 1.3226, test_f1: 0.2127
 epoch: 4, train_loss: 1.0737, test_loss: 1.3335, test_f1: 0.2388
 epoch: 5, train_loss: 1.0172, test_loss: 1.1721, test_f1: 0.3824
 epoch: 6, train_loss: 0.9956, test_loss: 1.0369, test_f1: 0.4656
 epoch: 7, train_loss: 0.9661, test_loss: 1.1532, test_f1: 0.3857
 epoch: 8, train_loss: 0.9422, test_loss: 1.0192, test_f1: 0.4949
 epoch: 9, train_loss: 0.9094, test_loss: 1.0640, test_f1: 0.4661
 epoch: 10, train_loss: 0.8941, test_loss: 0.9739, test_f1: 0.4790
 epoch: 11, train_loss: 0.8587, test_loss: 0.9863, test_f1: 0.4957
 epoch: 12, train_loss: 0.8605, test_loss: 0.9900, test_f1: 0.4810
 epoch: 13, train_loss: 0.8342, test_loss: 0.9475, test_f1: 0.5212
 epoch: 14, train_loss: 0.7988, test_loss: 1.0029, test_f1: 0.4830
 epoch: 15, train_loss: 0.7839, test_loss: 1.0091, test_f1: 0.5313
 epoch: 16, train_loss: 0.7815, test_loss: 0.9958, test_f1: 0.5195
 epoch: 17, train_loss: 0.7485, test_loss: 1.0099, test_f1: 0.5210
 epoch: 18, train_loss: 0.7544, test_loss: 1.0570, test_f1: 0.5467
 epoch: 19, train_loss: 0.7301, test_loss: 0.9719, test_f1: 0.5264
 epoch: 20, train_loss: 0.7066, test_loss: 1.1058, test_f1: 0.5191
 epoch: 21, train_loss: 0.7222, test_loss: 1.1195, test_f1: 0.4926
 epoch: 22, train_loss: 0.7039, test_loss: 1.0367, test_f1: 0.5276
 epoch: 23, train_loss: 0.6915, test_loss: 1.0527, test_f1: 0.5473
 epoch: 24, train_loss: 0.6680, test_loss: 0.9978, test_f1: 0.6032
 epoch: 25, train_loss: 0.6625, test_loss: 1.0594, test_f1: 0.5631
 epoch: 26, train_loss: 0.6487, test_loss: 1.0404, test_f1: 0.5808
 epoch: 27, train_loss: 0.6665, test_loss: 1.1600, test_f1: 0.5617
 epoch: 28, train_loss: 0.6327, test_loss: 1.0987, test_f1: 0.5735
 epoch: 29, train_loss: 0.6264, test_loss: 1.0381, test_f1: 0.5809
 epoch: 30, train_loss: 0.6196, test_loss: 1.0522, test_f1: 0.5621
 epoch: 31, train_loss: 0.6089, test_loss: 1.1056, test_f1: 0.5826
 epoch: 32, train_loss: 0.6172, test_loss: 1.1016, test_f1: 0.5599
 epoch: 33, train_loss: 0.6204, test_loss: 1.1652, test_f1: 0.5247
 epoch: 34, train_loss: 0.6102, test_loss: 1.1274, test_f1: 0.5882
 epoch: 35, train_loss: 0.5941, test_loss: 1.0102, test_f1: 0.6062
 epoch: 36, train_loss: 0.5659, test_loss: 1.1386, test_f1: 0.5826
 epoch: 37, train_loss: 0.5774, test_loss: 1.1638, test_f1: 0.6085
 epoch: 38, train_loss: 0.5754, test_loss: 1.1735, test_f1: 0.5998
 epoch: 39, train_loss: 0.5849, test_loss: 1.0792, test_f1: 0.5684
 epoch: 40, train_loss: 0.5679, test_loss: 1.1125, test_f1: 0.5215
 epoch: 41, train_loss: 0.5559, test_loss: 1.2049, test_f1: 0.5655
 epoch: 42, train_loss: 0.5502, test_loss: 1.1058, test_f1: 0.5865
 epoch: 43, train_loss: 0.5385, test_loss: 1.1697, test_f1: 0.5734
 epoch: 44, train_loss: 0.5561, test_loss: 1.1810, test_f1: 0.5470
 epoch: 45, train_loss: 0.5394, test_loss: 1.0065, test_f1: 0.6116
 epoch: 46, train_loss: 0.5209, test_loss: 1.1772, test_f1: 0.5736
 epoch: 47, train_loss: 0.5227, test_loss: 1.1970, test_f1: 0.5651
 epoch: 48, train_loss: 0.5196, test_loss: 1.2303, test_f1: 0.5649
 epoch: 49, train_loss: 0.5029, test_loss: 1.1678, test_f1: 0.6170
 epoch: 50, train_loss: 0.4977, test_loss: 1.2614, test_f1: 0.6210
 epoch: 51, train_loss: 0.4678, test_loss: 1.1356, test_f1: 0.6111
 epoch: 52, train_loss: 0.4610, test_loss: 1.2262, test_f1: 0.5939
 epoch: 53, train_loss: 0.4499, test_loss: 1.2045, test_f1: 0.5941
 epoch: 54, train_loss: 0.4378, test_loss: 1.2215, test_f1: 0.6080
 epoch: 55, train_loss: 0.4264, test_loss: 1.1694, test_f1: 0.6117
 epoch: 56, train_loss: 0.4248, test_loss: 1.3025, test_f1: 0.5955
 epoch: 57, train_loss: 0.4218, test_loss: 1.3313, test_f1: 0.6150
 epoch: 58, train_loss: 0.4271, test_loss: 1.1368, test_f1: 0.6454
 epoch: 59, train_loss: 0.4228, test_loss: 1.3055, test_f1: 0.6186
 epoch: 60, train_loss: 0.4127, test_loss: 1.2177, test_f1: 0.6150
 epoch: 61, train_loss: 0.4066, test_loss: 1.2922, test_f1: 0.6127
 epoch: 62, train_loss: 0.4036, test_loss: 1.2983, test_f1: 0.6023
 epoch: 63, train_loss: 0.3965, test_loss: 1.3230, test_f1: 0.6151
 epoch: 64, train_loss: 0.4084, test_loss: 1.2466, test_f1: 0.6234
 epoch: 65, train_loss: 0.4009, test_loss: 1.2789, test_f1: 0.6214
 epoch: 66, train_loss: 0.3982, test_loss: 1.3759, test_f1: 0.5952
 epoch: 67, train_loss: 0.3774, test_loss: 1.3389, test_f1: 0.6057
 epoch: 68, train_loss: 0.3730, test_loss: 1.4277, test_f1: 0.6038
 epoch: 69, train_loss: 0.3837, test_loss: 1.3632, test_f1: 0.6276
 epoch: 70, train_loss: 0.3813, test_loss: 1.3271, test_f1: 0.6464
 epoch: 71, train_loss: 0.3776, test_loss: 1.4157, test_f1: 0.6060
 epoch: 72, train_loss: 0.3519, test_loss: 1.4403, test_f1: 0.6158
 epoch: 73, train_loss: 0.3513, test_loss: 1.6109, test_f1: 0.6275
 epoch: 74, train_loss: 0.3449, test_loss: 1.5672, test_f1: 0.6306
 epoch: 75, train_loss: 0.3416, test_loss: 1.6397, test_f1: 0.6336
 epoch: 76, train_loss: 0.3610, test_loss: 1.6484, test_f1: 0.6186
 epoch: 77, train_loss: 0.3517, test_loss: 1.5463, test_f1: 0.6114
 epoch: 78, train_loss: 0.3365, test_loss: 1.5573, test_f1: 0.6157
 epoch: 79, train_loss: 0.3707, test_loss: 1.3871, test_f1: 0.6096
 epoch: 80, train_loss: 0.3703, test_loss: 1.7119, test_f1: 0.5922
 epoch: 81, train_loss: 0.3468, test_loss: 1.5206, test_f1: 0.6262
 epoch: 82, train_loss: 0.3703, test_loss: 1.4423, test_f1: 0.6382
 epoch: 83, train_loss: 0.3310, test_loss: 1.5602, test_f1: 0.6182
 epoch: 84, train_loss: 0.3260, test_loss: 1.5135, test_f1: 0.6347
 epoch: 85, train_loss: 0.3283, test_loss: 1.4703, test_f1: 0.6259
 epoch: 86, train_loss: 0.3135, test_loss: 1.5457, test_f1: 0.6207
 epoch: 87, train_loss: 0.3261, test_loss: 1.4800, test_f1: 0.6267
 epoch: 88, train_loss: 0.3047, test_loss: 1.5747, test_f1: 0.6336
 epoch: 89, train_loss: 0.3023, test_loss: 1.6183, test_f1: 0.6374
 epoch: 90, train_loss: 0.3090, test_loss: 1.6034, test_f1: 0.6257
 epoch: 91, train_loss: 0.3132, test_loss: 1.4530, test_f1: 0.6603
 epoch: 92, train_loss: 0.2987, test_loss: 1.5705, test_f1: 0.6328
 epoch: 93, train_loss: 0.3024, test_loss: 1.6272, test_f1: 0.6428
 epoch: 94, train_loss: 0.3072, test_loss: 1.6932, test_f1: 0.6152
 epoch: 95, train_loss: 0.2979, test_loss: 1.5345, test_f1: 0.6447
 epoch: 96, train_loss: 0.2823, test_loss: 1.6714, test_f1: 0.6301
 epoch: 97, train_loss: 0.2843, test_loss: 1.6491, test_f1: 0.6249
 epoch: 98, train_loss: 0.2948, test_loss: 1.6113, test_f1: 0.6535
 epoch: 99, train_loss: 0.2783, test_loss: 1.5703, test_f1: 0.6590
##################ITERATION #1 ****************************************
 epoch: 0, train_loss: 1.2625, test_loss: 1.2915, test_f1: 0.2260
 epoch: 1, train_loss: 1.1268, test_loss: 1.2475, test_f1: 0.2260
 epoch: 2, train_loss: 1.0563, test_loss: 1.1218, test_f1: 0.3416
 epoch: 3, train_loss: 1.0030, test_loss: 1.1800, test_f1: 0.3491
 epoch: 4, train_loss: 0.9637, test_loss: 1.1270, test_f1: 0.4043
 epoch: 5, train_loss: 0.9310, test_loss: 0.9869, test_f1: 0.5079
 epoch: 6, train_loss: 0.9043, test_loss: 0.9881, test_f1: 0.4582
 epoch: 7, train_loss: 0.8851, test_loss: 1.0175, test_f1: 0.4768
 epoch: 8, train_loss: 0.8747, test_loss: 0.9873, test_f1: 0.4832
 epoch: 9, train_loss: 0.8678, test_loss: 0.9727, test_f1: 0.5278
 epoch: 10, train_loss: 0.8377, test_loss: 0.9705, test_f1: 0.5407
 epoch: 11, train_loss: 0.8158, test_loss: 0.9623, test_f1: 0.5133
 epoch: 12, train_loss: 0.8126, test_loss: 1.0117, test_f1: 0.5328
 epoch: 13, train_loss: 0.7941, test_loss: 0.9807, test_f1: 0.5461
 epoch: 14, train_loss: 0.7854, test_loss: 0.9567, test_f1: 0.5445
 epoch: 15, train_loss: 0.7592, test_loss: 1.0393, test_f1: 0.5399
 epoch: 16, train_loss: 0.7569, test_loss: 1.0084, test_f1: 0.5505
 epoch: 17, train_loss: 0.7248, test_loss: 0.9496, test_f1: 0.5489
 epoch: 18, train_loss: 0.7177, test_loss: 0.9841, test_f1: 0.5474
 epoch: 19, train_loss: 0.7158, test_loss: 1.0840, test_f1: 0.5355
 epoch: 20, train_loss: 0.7105, test_loss: 1.0571, test_f1: 0.5337
 epoch: 21, train_loss: 0.7037, test_loss: 0.9483, test_f1: 0.5729
 epoch: 22, train_loss: 0.6875, test_loss: 1.0036, test_f1: 0.5530
 epoch: 23, train_loss: 0.6719, test_loss: 0.9562, test_f1: 0.5899
 epoch: 24, train_loss: 0.6676, test_loss: 1.0725, test_f1: 0.5624
 epoch: 25, train_loss: 0.6712, test_loss: 1.1122, test_f1: 0.5421
 epoch: 26, train_loss: 0.6385, test_loss: 1.0503, test_f1: 0.5247
 epoch: 27, train_loss: 0.6373, test_loss: 1.1466, test_f1: 0.5384
 epoch: 28, train_loss: 0.6255, test_loss: 0.9612, test_f1: 0.5725
 epoch: 29, train_loss: 0.6193, test_loss: 1.0565, test_f1: 0.5874
 epoch: 30, train_loss: 0.6075, test_loss: 0.9623, test_f1: 0.5973
 epoch: 31, train_loss: 0.6198, test_loss: 1.0949, test_f1: 0.5520
 epoch: 32, train_loss: 0.6195, test_loss: 1.1282, test_f1: 0.5646
 epoch: 33, train_loss: 0.5863, test_loss: 0.9672, test_f1: 0.6354
 epoch: 34, train_loss: 0.5866, test_loss: 1.0801, test_f1: 0.5558
 epoch: 35, train_loss: 0.5682, test_loss: 1.0756, test_f1: 0.5927
 epoch: 36, train_loss: 0.5657, test_loss: 1.0465, test_f1: 0.6077
 epoch: 37, train_loss: 0.5607, test_loss: 0.9883, test_f1: 0.6073
 epoch: 38, train_loss: 0.5545, test_loss: 1.0795, test_f1: 0.5833
 epoch: 39, train_loss: 0.5451, test_loss: 1.1529, test_f1: 0.6146
 epoch: 40, train_loss: 0.5462, test_loss: 1.0351, test_f1: 0.6193
 epoch: 41, train_loss: 0.5378, test_loss: 1.1202, test_f1: 0.5786
 epoch: 42, train_loss: 0.5268, test_loss: 1.0899, test_f1: 0.6029
 epoch: 43, train_loss: 0.5154, test_loss: 1.1124, test_f1: 0.6053
 epoch: 44, train_loss: 0.5041, test_loss: 1.1800, test_f1: 0.5774
 epoch: 45, train_loss: 0.4990, test_loss: 1.1327, test_f1: 0.6247
 epoch: 46, train_loss: 0.4862, test_loss: 1.2216, test_f1: 0.6115
 epoch: 47, train_loss: 0.4963, test_loss: 1.1560, test_f1: 0.6309
 epoch: 48, train_loss: 0.4915, test_loss: 1.1945, test_f1: 0.6087
 epoch: 49, train_loss: 0.5121, test_loss: 1.3040, test_f1: 0.6182
 epoch: 50, train_loss: 0.4896, test_loss: 1.2107, test_f1: 0.5850
 epoch: 51, train_loss: 0.4475, test_loss: 1.2433, test_f1: 0.6342
 epoch: 52, train_loss: 0.4378, test_loss: 1.1715, test_f1: 0.6501
 epoch: 53, train_loss: 0.4287, test_loss: 1.1436, test_f1: 0.6519
 epoch: 54, train_loss: 0.4002, test_loss: 1.1470, test_f1: 0.6466
 epoch: 55, train_loss: 0.3878, test_loss: 1.1995, test_f1: 0.6413
 epoch: 56, train_loss: 0.3780, test_loss: 1.1904, test_f1: 0.6436
 epoch: 57, train_loss: 0.3848, test_loss: 1.3570, test_f1: 0.6215
 epoch: 58, train_loss: 0.3928, test_loss: 1.1863, test_f1: 0.6565
 epoch: 59, train_loss: 0.3737, test_loss: 1.2786, test_f1: 0.6536
 epoch: 60, train_loss: 0.3745, test_loss: 1.2743, test_f1: 0.6425
 epoch: 61, train_loss: 0.3657, test_loss: 1.2055, test_f1: 0.6484
 epoch: 62, train_loss: 0.3564, test_loss: 1.3662, test_f1: 0.6598
 epoch: 63, train_loss: 0.3413, test_loss: 1.4602, test_f1: 0.6323
 epoch: 64, train_loss: 0.3611, test_loss: 1.4189, test_f1: 0.6407
 epoch: 65, train_loss: 0.3578, test_loss: 1.3841, test_f1: 0.6315
 epoch: 66, train_loss: 0.3510, test_loss: 1.3777, test_f1: 0.6486
 epoch: 67, train_loss: 0.3267, test_loss: 1.4286, test_f1: 0.6112
 epoch: 68, train_loss: 0.3566, test_loss: 1.2530, test_f1: 0.6479
 epoch: 69, train_loss: 0.3521, test_loss: 1.4286, test_f1: 0.6430
 epoch: 70, train_loss: 0.3292, test_loss: 1.3984, test_f1: 0.6656
 epoch: 71, train_loss: 0.3280, test_loss: 1.3463, test_f1: 0.6452
 epoch: 72, train_loss: 0.3260, test_loss: 1.5809, test_f1: 0.6421
 epoch: 73, train_loss: 0.3284, test_loss: 1.3390, test_f1: 0.6567
 epoch: 74, train_loss: 0.3051, test_loss: 1.4486, test_f1: 0.6518
 epoch: 75, train_loss: 0.3108, test_loss: 1.4804, test_f1: 0.6467
 epoch: 76, train_loss: 0.3201, test_loss: 1.4581, test_f1: 0.6238
 epoch: 77, train_loss: 0.3031, test_loss: 1.5668, test_f1: 0.6380
 epoch: 78, train_loss: 0.2884, test_loss: 1.5114, test_f1: 0.6421
 epoch: 79, train_loss: 0.2948, test_loss: 1.5905, test_f1: 0.6514
 epoch: 80, train_loss: 0.3053, test_loss: 1.3350, test_f1: 0.6621
 epoch: 81, train_loss: 0.2902, test_loss: 1.6888, test_f1: 0.6309
 epoch: 82, train_loss: 0.2789, test_loss: 1.6365, test_f1: 0.6470
 epoch: 83, train_loss: 0.2974, test_loss: 1.7082, test_f1: 0.6120
 epoch: 84, train_loss: 0.2624, test_loss: 1.6119, test_f1: 0.6331
 epoch: 85, train_loss: 0.2894, test_loss: 1.5099, test_f1: 0.6373
 epoch: 86, train_loss: 0.2813, test_loss: 1.5351, test_f1: 0.6449
 epoch: 87, train_loss: 0.2721, test_loss: 1.6924, test_f1: 0.6216
 epoch: 88, train_loss: 0.2735, test_loss: 1.6598, test_f1: 0.6339
 epoch: 89, train_loss: 0.2680, test_loss: 1.8050, test_f1: 0.6339
 epoch: 90, train_loss: 0.2610, test_loss: 1.7702, test_f1: 0.6429
 epoch: 91, train_loss: 0.2438, test_loss: 1.7621, test_f1: 0.6381
 epoch: 92, train_loss: 0.2611, test_loss: 1.7803, test_f1: 0.6397
 epoch: 93, train_loss: 0.2732, test_loss: 1.6085, test_f1: 0.6554
 epoch: 94, train_loss: 0.2705, test_loss: 1.6534, test_f1: 0.6350
 epoch: 95, train_loss: 0.2621, test_loss: 1.8465, test_f1: 0.6238
 epoch: 96, train_loss: 0.2613, test_loss: 1.6871, test_f1: 0.6299
 epoch: 97, train_loss: 0.2693, test_loss: 1.7837, test_f1: 0.6349
 epoch: 98, train_loss: 0.2648, test_loss: 1.5567, test_f1: 0.6508
 epoch: 99, train_loss: 0.2559, test_loss: 1.8871, test_f1: 0.6272
##################ITERATION #2 ****************************************
 epoch: 0, train_loss: 1.2291, test_loss: 1.2768, test_f1: 0.2260
 epoch: 1, train_loss: 1.0473, test_loss: 1.2688, test_f1: 0.2260
 epoch: 2, train_loss: 0.9950, test_loss: 1.3152, test_f1: 0.3425
 epoch: 3, train_loss: 0.9525, test_loss: 0.9871, test_f1: 0.4690
 epoch: 4, train_loss: 0.9123, test_loss: 0.9268, test_f1: 0.5215
 epoch: 5, train_loss: 0.9083, test_loss: 0.8851, test_f1: 0.5214
 epoch: 6, train_loss: 0.8742, test_loss: 0.9143, test_f1: 0.5422
 epoch: 7, train_loss: 0.8451, test_loss: 0.8844, test_f1: 0.5321
 epoch: 8, train_loss: 0.8369, test_loss: 0.9191, test_f1: 0.5524
 epoch: 9, train_loss: 0.8172, test_loss: 0.8813, test_f1: 0.5455
 epoch: 10, train_loss: 0.8051, test_loss: 0.8468, test_f1: 0.5795
 epoch: 11, train_loss: 0.8013, test_loss: 0.8464, test_f1: 0.5669
 epoch: 12, train_loss: 0.7802, test_loss: 0.9480, test_f1: 0.5513
 epoch: 13, train_loss: 0.7692, test_loss: 0.9241, test_f1: 0.5520
 epoch: 14, train_loss: 0.7541, test_loss: 0.8885, test_f1: 0.6065
 epoch: 15, train_loss: 0.7407, test_loss: 0.9141, test_f1: 0.5749
 epoch: 16, train_loss: 0.7313, test_loss: 0.8844, test_f1: 0.5888
 epoch: 17, train_loss: 0.7098, test_loss: 0.9266, test_f1: 0.5878
 epoch: 18, train_loss: 0.7125, test_loss: 0.8386, test_f1: 0.6013
 epoch: 19, train_loss: 0.6978, test_loss: 0.9432, test_f1: 0.5551
 epoch: 20, train_loss: 0.6938, test_loss: 0.8658, test_f1: 0.5636
 epoch: 21, train_loss: 0.6654, test_loss: 0.8646, test_f1: 0.6088
 epoch: 22, train_loss: 0.6736, test_loss: 0.9805, test_f1: 0.5461
 epoch: 23, train_loss: 0.6712, test_loss: 0.8264, test_f1: 0.6026
 epoch: 24, train_loss: 0.6502, test_loss: 0.9674, test_f1: 0.5898
 epoch: 25, train_loss: 0.6492, test_loss: 0.9147, test_f1: 0.6118
 epoch: 26, train_loss: 0.6241, test_loss: 0.8631, test_f1: 0.5759
 epoch: 27, train_loss: 0.6275, test_loss: 0.9300, test_f1: 0.6265
 epoch: 28, train_loss: 0.6293, test_loss: 0.9894, test_f1: 0.5864
 epoch: 29, train_loss: 0.5971, test_loss: 0.9217, test_f1: 0.5902
 epoch: 30, train_loss: 0.5986, test_loss: 0.8754, test_f1: 0.5940
 epoch: 31, train_loss: 0.5986, test_loss: 0.9815, test_f1: 0.5537
 epoch: 32, train_loss: 0.6010, test_loss: 0.8793, test_f1: 0.6183
 epoch: 33, train_loss: 0.5723, test_loss: 0.9086, test_f1: 0.6227
 epoch: 34, train_loss: 0.5560, test_loss: 0.9696, test_f1: 0.6015
 epoch: 35, train_loss: 0.5525, test_loss: 0.8591, test_f1: 0.6262
 epoch: 36, train_loss: 0.5554, test_loss: 0.8903, test_f1: 0.6150
 epoch: 37, train_loss: 0.5629, test_loss: 0.9296, test_f1: 0.6030
 epoch: 38, train_loss: 0.5595, test_loss: 0.9345, test_f1: 0.6031
 epoch: 39, train_loss: 0.5440, test_loss: 0.9939, test_f1: 0.6221
 epoch: 40, train_loss: 0.5472, test_loss: 0.9011, test_f1: 0.6130
 epoch: 41, train_loss: 0.5408, test_loss: 0.8853, test_f1: 0.6424
 epoch: 42, train_loss: 0.5107, test_loss: 0.8850, test_f1: 0.6258
 epoch: 43, train_loss: 0.4967, test_loss: 1.0498, test_f1: 0.6067
 epoch: 44, train_loss: 0.5058, test_loss: 1.1053, test_f1: 0.5976
 epoch: 45, train_loss: 0.4910, test_loss: 0.9347, test_f1: 0.6341
 epoch: 46, train_loss: 0.4889, test_loss: 0.9839, test_f1: 0.5948
 epoch: 47, train_loss: 0.4853, test_loss: 0.9818, test_f1: 0.6460
 epoch: 48, train_loss: 0.4732, test_loss: 0.9635, test_f1: 0.6345
 epoch: 49, train_loss: 0.4710, test_loss: 0.9006, test_f1: 0.6599
 epoch: 50, train_loss: 0.4542, test_loss: 1.0225, test_f1: 0.6233
 epoch: 51, train_loss: 0.4188, test_loss: 1.0046, test_f1: 0.6141
 epoch: 52, train_loss: 0.4159, test_loss: 0.9907, test_f1: 0.6392
 epoch: 53, train_loss: 0.4094, test_loss: 0.9735, test_f1: 0.6522
 epoch: 54, train_loss: 0.4080, test_loss: 1.0223, test_f1: 0.6589
 epoch: 55, train_loss: 0.3921, test_loss: 0.9899, test_f1: 0.6491
 epoch: 56, train_loss: 0.3820, test_loss: 0.9694, test_f1: 0.6733
 epoch: 57, train_loss: 0.3741, test_loss: 1.0831, test_f1: 0.6569
 epoch: 58, train_loss: 0.3814, test_loss: 1.0063, test_f1: 0.6732
 epoch: 59, train_loss: 0.3743, test_loss: 1.1409, test_f1: 0.6518
 epoch: 60, train_loss: 0.3649, test_loss: 1.0687, test_f1: 0.6549
 epoch: 61, train_loss: 0.3620, test_loss: 1.1013, test_f1: 0.6421
 epoch: 62, train_loss: 0.3581, test_loss: 1.0758, test_f1: 0.6457
 epoch: 63, train_loss: 0.3554, test_loss: 1.0007, test_f1: 0.6711
 epoch: 64, train_loss: 0.3496, test_loss: 1.1361, test_f1: 0.6668
 epoch: 65, train_loss: 0.3296, test_loss: 1.0706, test_f1: 0.6595
 epoch: 66, train_loss: 0.3303, test_loss: 1.1799, test_f1: 0.6518
 epoch: 67, train_loss: 0.3296, test_loss: 1.1490, test_f1: 0.6673
 epoch: 68, train_loss: 0.3287, test_loss: 1.1232, test_f1: 0.6680
 epoch: 69, train_loss: 0.3285, test_loss: 1.2124, test_f1: 0.6488
 epoch: 70, train_loss: 0.3331, test_loss: 1.2112, test_f1: 0.6556
 epoch: 71, train_loss: 0.3234, test_loss: 1.1717, test_f1: 0.6774
 epoch: 72, train_loss: 0.3258, test_loss: 1.1503, test_f1: 0.6672
 epoch: 73, train_loss: 0.3122, test_loss: 1.3755, test_f1: 0.6599
 epoch: 74, train_loss: 0.3316, test_loss: 1.3124, test_f1: 0.6478
 epoch: 75, train_loss: 0.3139, test_loss: 1.4000, test_f1: 0.6456
 epoch: 76, train_loss: 0.3102, test_loss: 1.3033, test_f1: 0.6586
 epoch: 77, train_loss: 0.3007, test_loss: 1.1271, test_f1: 0.6745
 epoch: 78, train_loss: 0.2862, test_loss: 1.2511, test_f1: 0.6485
 epoch: 79, train_loss: 0.2927, test_loss: 1.3985, test_f1: 0.6770
 epoch: 80, train_loss: 0.2878, test_loss: 1.1898, test_f1: 0.6663
 epoch: 81, train_loss: 0.2849, test_loss: 1.4395, test_f1: 0.6524
 epoch: 82, train_loss: 0.2879, test_loss: 1.3017, test_f1: 0.6510
 epoch: 83, train_loss: 0.2849, test_loss: 1.3350, test_f1: 0.6387
 epoch: 84, train_loss: 0.2814, test_loss: 1.2394, test_f1: 0.6666
 epoch: 85, train_loss: 0.2809, test_loss: 1.3332, test_f1: 0.6622
 epoch: 86, train_loss: 0.2654, test_loss: 1.3964, test_f1: 0.6660
 epoch: 87, train_loss: 0.2652, test_loss: 1.4271, test_f1: 0.6625
 epoch: 88, train_loss: 0.2625, test_loss: 1.4461, test_f1: 0.6654
 epoch: 89, train_loss: 0.2903, test_loss: 1.3707, test_f1: 0.6534
 epoch: 90, train_loss: 0.2638, test_loss: 1.2549, test_f1: 0.6493
 epoch: 91, train_loss: 0.2562, test_loss: 1.4547, test_f1: 0.6504
 epoch: 92, train_loss: 0.2445, test_loss: 1.4363, test_f1: 0.6456
 epoch: 93, train_loss: 0.2367, test_loss: 1.6499, test_f1: 0.6455
 epoch: 94, train_loss: 0.2514, test_loss: 1.4955, test_f1: 0.6570
 epoch: 95, train_loss: 0.2479, test_loss: 1.5119, test_f1: 0.6541
 epoch: 96, train_loss: 0.2430, test_loss: 1.5159, test_f1: 0.6452
 epoch: 97, train_loss: 0.2302, test_loss: 1.7292, test_f1: 0.6452
 epoch: 98, train_loss: 0.2218, test_loss: 1.4216, test_f1: 0.6620
 epoch: 99, train_loss: 0.2372, test_loss: 1.5161, test_f1: 0.6565
##################ITERATION #3 ****************************************
 epoch: 0, train_loss: 1.1995, test_loss: 1.3757, test_f1: 0.2574
 epoch: 1, train_loss: 1.0374, test_loss: 1.3643, test_f1: 0.2311
 epoch: 2, train_loss: 0.9829, test_loss: 1.2791, test_f1: 0.3296
 epoch: 3, train_loss: 0.9431, test_loss: 1.1458, test_f1: 0.3987
 epoch: 4, train_loss: 0.9303, test_loss: 0.9853, test_f1: 0.4971
 epoch: 5, train_loss: 0.9000, test_loss: 0.9274, test_f1: 0.5286
 epoch: 6, train_loss: 0.8882, test_loss: 0.9731, test_f1: 0.4888
 epoch: 7, train_loss: 0.8668, test_loss: 0.9020, test_f1: 0.5587
 epoch: 8, train_loss: 0.8565, test_loss: 0.9163, test_f1: 0.5611
 epoch: 9, train_loss: 0.8383, test_loss: 0.9229, test_f1: 0.5699
 epoch: 10, train_loss: 0.8210, test_loss: 0.9343, test_f1: 0.5404
 epoch: 11, train_loss: 0.8011, test_loss: 0.9709, test_f1: 0.5375
 epoch: 12, train_loss: 0.7829, test_loss: 1.0855, test_f1: 0.5102
 epoch: 13, train_loss: 0.7665, test_loss: 0.9588, test_f1: 0.5676
 epoch: 14, train_loss: 0.7414, test_loss: 0.9135, test_f1: 0.5751
 epoch: 15, train_loss: 0.7392, test_loss: 0.8992, test_f1: 0.6032
 epoch: 16, train_loss: 0.7355, test_loss: 0.9015, test_f1: 0.5524
 epoch: 17, train_loss: 0.7294, test_loss: 1.5119, test_f1: 0.4367
 epoch: 18, train_loss: 0.7125, test_loss: 0.9355, test_f1: 0.5884
 epoch: 19, train_loss: 0.7096, test_loss: 0.9705, test_f1: 0.5465
 epoch: 20, train_loss: 0.7006, test_loss: 0.8642, test_f1: 0.6045
 epoch: 21, train_loss: 0.6782, test_loss: 1.1248, test_f1: 0.5387
 epoch: 22, train_loss: 0.6840, test_loss: 0.9092, test_f1: 0.5808
 epoch: 23, train_loss: 0.6598, test_loss: 0.8608, test_f1: 0.6012
 epoch: 24, train_loss: 0.6632, test_loss: 0.9977, test_f1: 0.5701
 epoch: 25, train_loss: 0.6636, test_loss: 0.9337, test_f1: 0.5850
 epoch: 26, train_loss: 0.6455, test_loss: 0.8925, test_f1: 0.6022
 epoch: 27, train_loss: 0.6369, test_loss: 0.9247, test_f1: 0.5796
 epoch: 28, train_loss: 0.6120, test_loss: 0.9790, test_f1: 0.6025
 epoch: 29, train_loss: 0.6081, test_loss: 1.0426, test_f1: 0.5574
 epoch: 30, train_loss: 0.6073, test_loss: 0.9577, test_f1: 0.5890
 epoch: 31, train_loss: 0.5989, test_loss: 0.9589, test_f1: 0.6075
 epoch: 32, train_loss: 0.5971, test_loss: 1.1423, test_f1: 0.5169
 epoch: 33, train_loss: 0.5947, test_loss: 0.8535, test_f1: 0.6220
 epoch: 34, train_loss: 0.5857, test_loss: 0.9980, test_f1: 0.5953
 epoch: 35, train_loss: 0.5598, test_loss: 1.2106, test_f1: 0.5058
 epoch: 36, train_loss: 0.5556, test_loss: 1.1788, test_f1: 0.5675
 epoch: 37, train_loss: 0.5591, test_loss: 1.8106, test_f1: 0.3982
 epoch: 38, train_loss: 0.5479, test_loss: 0.8965, test_f1: 0.6347
 epoch: 39, train_loss: 0.5443, test_loss: 1.0000, test_f1: 0.6135
 epoch: 40, train_loss: 0.5414, test_loss: 1.0114, test_f1: 0.5680
 epoch: 41, train_loss: 0.5249, test_loss: 1.1053, test_f1: 0.5763
 epoch: 42, train_loss: 0.5146, test_loss: 1.1998, test_f1: 0.5669
 epoch: 43, train_loss: 0.5423, test_loss: 1.0187, test_f1: 0.6138
 epoch: 44, train_loss: 0.5233, test_loss: 0.9612, test_f1: 0.5956
 epoch: 45, train_loss: 0.5032, test_loss: 1.1754, test_f1: 0.5700
 epoch: 46, train_loss: 0.5007, test_loss: 1.0822, test_f1: 0.5770
 epoch: 47, train_loss: 0.4903, test_loss: 1.8415, test_f1: 0.4698
 epoch: 48, train_loss: 0.5025, test_loss: 1.2527, test_f1: 0.5823
 epoch: 49, train_loss: 0.4998, test_loss: 1.1746, test_f1: 0.6155
 epoch: 50, train_loss: 0.4819, test_loss: 0.9602, test_f1: 0.6305
 epoch: 51, train_loss: 0.4513, test_loss: 1.0114, test_f1: 0.6120
 epoch: 52, train_loss: 0.4271, test_loss: 1.0300, test_f1: 0.6189
 epoch: 53, train_loss: 0.4117, test_loss: 1.0673, test_f1: 0.6220
 epoch: 54, train_loss: 0.4107, test_loss: 0.9616, test_f1: 0.6308
 epoch: 55, train_loss: 0.4042, test_loss: 0.9963, test_f1: 0.6521
 epoch: 56, train_loss: 0.3844, test_loss: 1.1360, test_f1: 0.5930
 epoch: 57, train_loss: 0.3934, test_loss: 1.1390, test_f1: 0.5977
 epoch: 58, train_loss: 0.3894, test_loss: 1.0955, test_f1: 0.6522
 epoch: 59, train_loss: 0.3864, test_loss: 1.1038, test_f1: 0.6489
 epoch: 60, train_loss: 0.3778, test_loss: 1.1430, test_f1: 0.6095
 epoch: 61, train_loss: 0.3633, test_loss: 0.9993, test_f1: 0.6491
 epoch: 62, train_loss: 0.3670, test_loss: 1.1898, test_f1: 0.6509
 epoch: 63, train_loss: 0.3568, test_loss: 1.1213, test_f1: 0.6152
 epoch: 64, train_loss: 0.3568, test_loss: 1.1623, test_f1: 0.5937
 epoch: 65, train_loss: 0.3611, test_loss: 1.2216, test_f1: 0.6146
 epoch: 66, train_loss: 0.3576, test_loss: 1.1368, test_f1: 0.6372
 epoch: 67, train_loss: 0.3616, test_loss: 1.2213, test_f1: 0.6034
 epoch: 68, train_loss: 0.3508, test_loss: 1.1062, test_f1: 0.6508
 epoch: 69, train_loss: 0.3531, test_loss: 1.2903, test_f1: 0.6132
 epoch: 70, train_loss: 0.3462, test_loss: 1.1639, test_f1: 0.6581
 epoch: 71, train_loss: 0.3380, test_loss: 1.2156, test_f1: 0.6445
 epoch: 72, train_loss: 0.3272, test_loss: 1.5268, test_f1: 0.5921
 epoch: 73, train_loss: 0.3298, test_loss: 1.1379, test_f1: 0.6615
 epoch: 74, train_loss: 0.3117, test_loss: 1.3171, test_f1: 0.6178
 epoch: 75, train_loss: 0.3134, test_loss: 1.3056, test_f1: 0.6106
 epoch: 76, train_loss: 0.2955, test_loss: 1.3599, test_f1: 0.6143
 epoch: 77, train_loss: 0.3121, test_loss: 1.3158, test_f1: 0.6371
 epoch: 78, train_loss: 0.3112, test_loss: 1.2102, test_f1: 0.6420
 epoch: 79, train_loss: 0.3130, test_loss: 1.3650, test_f1: 0.6008
 epoch: 80, train_loss: 0.3269, test_loss: 1.5937, test_f1: 0.6068
 epoch: 81, train_loss: 0.3145, test_loss: 1.1786, test_f1: 0.6328
 epoch: 82, train_loss: 0.2921, test_loss: 1.2445, test_f1: 0.6275
 epoch: 83, train_loss: 0.2907, test_loss: 1.4068, test_f1: 0.5864
 epoch: 84, train_loss: 0.2629, test_loss: 1.5351, test_f1: 0.6086
 epoch: 85, train_loss: 0.2897, test_loss: 1.3678, test_f1: 0.6486
 epoch: 86, train_loss: 0.2935, test_loss: 1.5488, test_f1: 0.5873
 epoch: 87, train_loss: 0.2950, test_loss: 1.2785, test_f1: 0.6049
 epoch: 88, train_loss: 0.2901, test_loss: 1.3506, test_f1: 0.6300
 epoch: 89, train_loss: 0.2910, test_loss: 1.4781, test_f1: 0.6018
 epoch: 90, train_loss: 0.2755, test_loss: 1.1864, test_f1: 0.6413
 epoch: 91, train_loss: 0.2771, test_loss: 1.3083, test_f1: 0.6579
 epoch: 92, train_loss: 0.2793, test_loss: 1.4465, test_f1: 0.5966
 epoch: 93, train_loss: 0.2778, test_loss: 1.2209, test_f1: 0.6663
 epoch: 94, train_loss: 0.2677, test_loss: 1.6143, test_f1: 0.5879
 epoch: 95, train_loss: 0.2630, test_loss: 1.4272, test_f1: 0.6057
 epoch: 96, train_loss: 0.2494, test_loss: 1.5139, test_f1: 0.5926
 epoch: 97, train_loss: 0.2528, test_loss: 1.4260, test_f1: 0.6482
 epoch: 98, train_loss: 0.2475, test_loss: 1.5306, test_f1: 0.6054
 epoch: 99, train_loss: 0.2321, test_loss: 1.3988, test_f1: 0.6486
##################ITERATION #4 ****************************************
 epoch: 0, train_loss: 1.1840, test_loss: 1.3540, test_f1: 0.2260
 epoch: 1, train_loss: 1.0324, test_loss: 1.4605, test_f1: 0.2264
 epoch: 2, train_loss: 0.9878, test_loss: 1.4697, test_f1: 0.2574
 epoch: 3, train_loss: 0.9337, test_loss: 1.2295, test_f1: 0.3591
 epoch: 4, train_loss: 0.8897, test_loss: 0.9711, test_f1: 0.5034
 epoch: 5, train_loss: 0.8636, test_loss: 0.9496, test_f1: 0.5189
 epoch: 6, train_loss: 0.8625, test_loss: 0.9218, test_f1: 0.5409
 epoch: 7, train_loss: 0.8272, test_loss: 0.8919, test_f1: 0.5736
 epoch: 8, train_loss: 0.8110, test_loss: 0.8379, test_f1: 0.5795
 epoch: 9, train_loss: 0.8159, test_loss: 0.8430, test_f1: 0.5558
 epoch: 10, train_loss: 0.7839, test_loss: 0.8822, test_f1: 0.5784
 epoch: 11, train_loss: 0.7631, test_loss: 0.9046, test_f1: 0.5761
 epoch: 12, train_loss: 0.7476, test_loss: 0.9138, test_f1: 0.5284
 epoch: 13, train_loss: 0.7450, test_loss: 0.9512, test_f1: 0.5667
 epoch: 14, train_loss: 0.7264, test_loss: 0.8856, test_f1: 0.5739
 epoch: 15, train_loss: 0.7116, test_loss: 1.1774, test_f1: 0.5197
 epoch: 16, train_loss: 0.7135, test_loss: 0.8357, test_f1: 0.5742
 epoch: 17, train_loss: 0.6871, test_loss: 0.8735, test_f1: 0.5841
 epoch: 18, train_loss: 0.6806, test_loss: 0.8315, test_f1: 0.6018
 epoch: 19, train_loss: 0.6786, test_loss: 0.8278, test_f1: 0.6030
 epoch: 20, train_loss: 0.6527, test_loss: 0.8455, test_f1: 0.6176
 epoch: 21, train_loss: 0.6585, test_loss: 0.9016, test_f1: 0.5607
 epoch: 22, train_loss: 0.6534, test_loss: 0.8523, test_f1: 0.5883
 epoch: 23, train_loss: 0.6556, test_loss: 1.0225, test_f1: 0.5780
 epoch: 24, train_loss: 0.6559, test_loss: 0.9323, test_f1: 0.5642
 epoch: 25, train_loss: 0.6216, test_loss: 0.8545, test_f1: 0.6028
 epoch: 26, train_loss: 0.6212, test_loss: 0.8552, test_f1: 0.5705
 epoch: 27, train_loss: 0.6059, test_loss: 0.8277, test_f1: 0.6349
 epoch: 28, train_loss: 0.5986, test_loss: 0.8374, test_f1: 0.6036
 epoch: 29, train_loss: 0.5938, test_loss: 0.8351, test_f1: 0.6575
 epoch: 30, train_loss: 0.5832, test_loss: 0.8872, test_f1: 0.5971
 epoch: 31, train_loss: 0.5932, test_loss: 0.8146, test_f1: 0.6358
 epoch: 32, train_loss: 0.6039, test_loss: 0.8289, test_f1: 0.6136
 epoch: 33, train_loss: 0.5546, test_loss: 0.8325, test_f1: 0.6454
 epoch: 34, train_loss: 0.5438, test_loss: 0.8023, test_f1: 0.6362
 epoch: 35, train_loss: 0.5570, test_loss: 0.8468, test_f1: 0.6260
 epoch: 36, train_loss: 0.5595, test_loss: 0.8632, test_f1: 0.6187
 epoch: 37, train_loss: 0.5541, test_loss: 0.8541, test_f1: 0.6279
 epoch: 38, train_loss: 0.5406, test_loss: 0.8439, test_f1: 0.6278
 epoch: 39, train_loss: 0.5088, test_loss: 0.8236, test_f1: 0.6409
 epoch: 40, train_loss: 0.5183, test_loss: 0.8541, test_f1: 0.6388
 epoch: 41, train_loss: 0.5230, test_loss: 0.9323, test_f1: 0.5874
 epoch: 42, train_loss: 0.5225, test_loss: 0.9419, test_f1: 0.6562
 epoch: 43, train_loss: 0.5097, test_loss: 0.8759, test_f1: 0.6345
 epoch: 44, train_loss: 0.4998, test_loss: 0.9093, test_f1: 0.6409
 epoch: 45, train_loss: 0.4957, test_loss: 0.8848, test_f1: 0.6458
 epoch: 46, train_loss: 0.4823, test_loss: 0.9293, test_f1: 0.6710
 epoch: 47, train_loss: 0.4889, test_loss: 1.2148, test_f1: 0.5940
 epoch: 48, train_loss: 0.4801, test_loss: 0.9072, test_f1: 0.6327
 epoch: 49, train_loss: 0.4707, test_loss: 0.9701, test_f1: 0.6435
 epoch: 50, train_loss: 0.4696, test_loss: 0.9408, test_f1: 0.6295
 epoch: 51, train_loss: 0.4463, test_loss: 0.9000, test_f1: 0.6476
 epoch: 52, train_loss: 0.4225, test_loss: 0.9010, test_f1: 0.6503
 epoch: 53, train_loss: 0.4010, test_loss: 0.9230, test_f1: 0.6535
 epoch: 54, train_loss: 0.3837, test_loss: 0.8849, test_f1: 0.6670
 epoch: 55, train_loss: 0.3802, test_loss: 0.9458, test_f1: 0.6671
 epoch: 56, train_loss: 0.3904, test_loss: 0.8889, test_f1: 0.6845
 epoch: 57, train_loss: 0.3645, test_loss: 1.0206, test_f1: 0.6536
 epoch: 58, train_loss: 0.3613, test_loss: 1.0057, test_f1: 0.6603
 epoch: 59, train_loss: 0.3732, test_loss: 1.2347, test_f1: 0.6311
 epoch: 60, train_loss: 0.3591, test_loss: 0.9941, test_f1: 0.6726
 epoch: 61, train_loss: 0.3610, test_loss: 1.1031, test_f1: 0.6661
 epoch: 62, train_loss: 0.3519, test_loss: 1.1115, test_f1: 0.6729
 epoch: 63, train_loss: 0.3458, test_loss: 0.9427, test_f1: 0.6572
 epoch: 64, train_loss: 0.3356, test_loss: 1.1891, test_f1: 0.6496
 epoch: 65, train_loss: 0.3421, test_loss: 1.1306, test_f1: 0.6495
 epoch: 66, train_loss: 0.3268, test_loss: 1.1325, test_f1: 0.6568
 epoch: 67, train_loss: 0.3225, test_loss: 1.0826, test_f1: 0.6519
 epoch: 68, train_loss: 0.3339, test_loss: 1.1438, test_f1: 0.6624
 epoch: 69, train_loss: 0.3251, test_loss: 1.1346, test_f1: 0.6595
 epoch: 70, train_loss: 0.3202, test_loss: 1.3267, test_f1: 0.6528
 epoch: 71, train_loss: 0.3019, test_loss: 1.1017, test_f1: 0.6651
 epoch: 72, train_loss: 0.3106, test_loss: 1.2268, test_f1: 0.6490
 epoch: 73, train_loss: 0.3053, test_loss: 1.2490, test_f1: 0.6644
 epoch: 74, train_loss: 0.3079, test_loss: 1.1621, test_f1: 0.6541
 epoch: 75, train_loss: 0.3077, test_loss: 1.3625, test_f1: 0.6608
 epoch: 76, train_loss: 0.3023, test_loss: 1.1539, test_f1: 0.6703
 epoch: 77, train_loss: 0.3054, test_loss: 1.1092, test_f1: 0.6768
 epoch: 78, train_loss: 0.2786, test_loss: 1.0978, test_f1: 0.6791
 epoch: 79, train_loss: 0.2856, test_loss: 1.2019, test_f1: 0.6640
 epoch: 80, train_loss: 0.2820, test_loss: 1.2614, test_f1: 0.6663
 epoch: 81, train_loss: 0.2828, test_loss: 1.2536, test_f1: 0.6592
 epoch: 82, train_loss: 0.2826, test_loss: 1.2209, test_f1: 0.6621
 epoch: 83, train_loss: 0.2866, test_loss: 1.3152, test_f1: 0.6682
 epoch: 84, train_loss: 0.2809, test_loss: 1.1544, test_f1: 0.6812
 epoch: 85, train_loss: 0.2755, test_loss: 1.4519, test_f1: 0.6468
 epoch: 86, train_loss: 0.2902, test_loss: 1.3356, test_f1: 0.6581
 epoch: 87, train_loss: 0.2694, test_loss: 1.3341, test_f1: 0.6513
 epoch: 88, train_loss: 0.2809, test_loss: 1.4956, test_f1: 0.6516
 epoch: 89, train_loss: 0.2890, test_loss: 1.3172, test_f1: 0.6785
 epoch: 90, train_loss: 0.2650, test_loss: 1.3083, test_f1: 0.6758
 epoch: 91, train_loss: 0.2522, test_loss: 1.4537, test_f1: 0.6541
 epoch: 92, train_loss: 0.2438, test_loss: 1.3312, test_f1: 0.6651
 epoch: 93, train_loss: 0.2430, test_loss: 1.4909, test_f1: 0.6583
 epoch: 94, train_loss: 0.2345, test_loss: 1.4367, test_f1: 0.6513
 epoch: 95, train_loss: 0.2357, test_loss: 1.2676, test_f1: 0.6769
 epoch: 96, train_loss: 0.2323, test_loss: 1.6581, test_f1: 0.6455
 epoch: 97, train_loss: 0.2420, test_loss: 1.5022, test_f1: 0.6590
 epoch: 98, train_loss: 0.2312, test_loss: 1.5232, test_f1: 0.6701
 epoch: 99, train_loss: 0.2322, test_loss: 1.4414, test_f1: 0.6645
##################ITERATION #5 ****************************************
 epoch: 0, train_loss: 1.2417, test_loss: 1.3463, test_f1: 0.2574
 epoch: 1, train_loss: 1.0833, test_loss: 1.2875, test_f1: 0.2398
 epoch: 2, train_loss: 1.0231, test_loss: 1.0915, test_f1: 0.3400
 epoch: 3, train_loss: 0.9802, test_loss: 1.0176, test_f1: 0.4199
 epoch: 4, train_loss: 0.9531, test_loss: 1.0159, test_f1: 0.4936
 epoch: 5, train_loss: 0.9271, test_loss: 1.0097, test_f1: 0.4883
 epoch: 6, train_loss: 0.9119, test_loss: 0.9267, test_f1: 0.5341
 epoch: 7, train_loss: 0.8830, test_loss: 0.8972, test_f1: 0.5539
 epoch: 8, train_loss: 0.8678, test_loss: 0.9266, test_f1: 0.5227
 epoch: 9, train_loss: 0.8403, test_loss: 0.9502, test_f1: 0.5301
 epoch: 10, train_loss: 0.8365, test_loss: 0.8455, test_f1: 0.5825
 epoch: 11, train_loss: 0.8195, test_loss: 0.9545, test_f1: 0.5261
 epoch: 12, train_loss: 0.7944, test_loss: 0.9233, test_f1: 0.5680
 epoch: 13, train_loss: 0.7886, test_loss: 0.9370, test_f1: 0.5309
 epoch: 14, train_loss: 0.7818, test_loss: 0.9221, test_f1: 0.5825
 epoch: 15, train_loss: 0.7561, test_loss: 0.8955, test_f1: 0.5765
 epoch: 16, train_loss: 0.7495, test_loss: 0.9158, test_f1: 0.5934
 epoch: 17, train_loss: 0.7461, test_loss: 0.9331, test_f1: 0.5638
 epoch: 18, train_loss: 0.7386, test_loss: 1.0179, test_f1: 0.5748
 epoch: 19, train_loss: 0.7391, test_loss: 0.9172, test_f1: 0.5801
 epoch: 20, train_loss: 0.7143, test_loss: 0.9636, test_f1: 0.5561
 epoch: 21, train_loss: 0.7063, test_loss: 0.9702, test_f1: 0.5701
 epoch: 22, train_loss: 0.6744, test_loss: 0.8935, test_f1: 0.6152
 epoch: 23, train_loss: 0.6591, test_loss: 0.9238, test_f1: 0.6067
 epoch: 24, train_loss: 0.6632, test_loss: 0.9481, test_f1: 0.5794
 epoch: 25, train_loss: 0.6600, test_loss: 0.9045, test_f1: 0.5763
 epoch: 26, train_loss: 0.6455, test_loss: 0.9308, test_f1: 0.6119
 epoch: 27, train_loss: 0.6417, test_loss: 0.8432, test_f1: 0.5789
 epoch: 28, train_loss: 0.6182, test_loss: 0.9172, test_f1: 0.6266
 epoch: 29, train_loss: 0.6342, test_loss: 0.9185, test_f1: 0.5839
 epoch: 30, train_loss: 0.6059, test_loss: 0.9642, test_f1: 0.6023
 epoch: 31, train_loss: 0.6106, test_loss: 0.8702, test_f1: 0.6334
 epoch: 32, train_loss: 0.6241, test_loss: 1.1030, test_f1: 0.5580
 epoch: 33, train_loss: 0.5913, test_loss: 0.9621, test_f1: 0.6138
 epoch: 34, train_loss: 0.5775, test_loss: 0.9721, test_f1: 0.5984
 epoch: 35, train_loss: 0.5642, test_loss: 0.9649, test_f1: 0.5955
 epoch: 36, train_loss: 0.5757, test_loss: 0.9484, test_f1: 0.6010
 epoch: 37, train_loss: 0.5579, test_loss: 1.0588, test_f1: 0.5948
 epoch: 38, train_loss: 0.5451, test_loss: 0.8334, test_f1: 0.6420
 epoch: 39, train_loss: 0.5464, test_loss: 1.0421, test_f1: 0.6080
 epoch: 40, train_loss: 0.5405, test_loss: 0.9393, test_f1: 0.6111
 epoch: 41, train_loss: 0.5518, test_loss: 0.9392, test_f1: 0.5956
 epoch: 42, train_loss: 0.5241, test_loss: 0.9393, test_f1: 0.6197
 epoch: 43, train_loss: 0.5017, test_loss: 1.0289, test_f1: 0.6021
 epoch: 44, train_loss: 0.4920, test_loss: 0.8819, test_f1: 0.6260
 epoch: 45, train_loss: 0.5093, test_loss: 0.9068, test_f1: 0.6593
 epoch: 46, train_loss: 0.4982, test_loss: 1.0461, test_f1: 0.5881
 epoch: 47, train_loss: 0.4939, test_loss: 0.9686, test_f1: 0.6188
 epoch: 48, train_loss: 0.4971, test_loss: 0.8480, test_f1: 0.6224
 epoch: 49, train_loss: 0.4738, test_loss: 0.9873, test_f1: 0.6463
 epoch: 50, train_loss: 0.4658, test_loss: 1.1051, test_f1: 0.5994
 epoch: 51, train_loss: 0.4368, test_loss: 1.0052, test_f1: 0.6380
 epoch: 52, train_loss: 0.4297, test_loss: 0.9958, test_f1: 0.6086
 epoch: 53, train_loss: 0.4130, test_loss: 0.9248, test_f1: 0.6538
 epoch: 54, train_loss: 0.4163, test_loss: 1.0198, test_f1: 0.6645
 epoch: 55, train_loss: 0.3959, test_loss: 1.0394, test_f1: 0.6397
 epoch: 56, train_loss: 0.4081, test_loss: 1.0889, test_f1: 0.6323
 epoch: 57, train_loss: 0.3837, test_loss: 1.0629, test_f1: 0.6368
 epoch: 58, train_loss: 0.3835, test_loss: 1.0576, test_f1: 0.6464
 epoch: 59, train_loss: 0.3830, test_loss: 1.1020, test_f1: 0.6082
 epoch: 60, train_loss: 0.3856, test_loss: 1.0535, test_f1: 0.6304
 epoch: 61, train_loss: 0.3737, test_loss: 1.0987, test_f1: 0.6388
 epoch: 62, train_loss: 0.3761, test_loss: 1.2500, test_f1: 0.6057
 epoch: 63, train_loss: 0.3753, test_loss: 1.1462, test_f1: 0.6323
 epoch: 64, train_loss: 0.3614, test_loss: 1.1531, test_f1: 0.6257
 epoch: 65, train_loss: 0.3488, test_loss: 1.1392, test_f1: 0.6438
 epoch: 66, train_loss: 0.3548, test_loss: 1.1780, test_f1: 0.6292
 epoch: 67, train_loss: 0.3385, test_loss: 1.1483, test_f1: 0.6299
 epoch: 68, train_loss: 0.3396, test_loss: 1.1470, test_f1: 0.6330
 epoch: 69, train_loss: 0.3413, test_loss: 1.2040, test_f1: 0.6110
 epoch: 70, train_loss: 0.3438, test_loss: 1.1098, test_f1: 0.6446
 epoch: 71, train_loss: 0.3409, test_loss: 1.2353, test_f1: 0.6263
 epoch: 72, train_loss: 0.3348, test_loss: 1.2680, test_f1: 0.6185
 epoch: 73, train_loss: 0.3360, test_loss: 1.2201, test_f1: 0.6406
 epoch: 74, train_loss: 0.3186, test_loss: 1.2907, test_f1: 0.6226
 epoch: 75, train_loss: 0.3279, test_loss: 1.3437, test_f1: 0.6110
 epoch: 76, train_loss: 0.3348, test_loss: 1.1216, test_f1: 0.6339
 epoch: 77, train_loss: 0.3330, test_loss: 1.1513, test_f1: 0.6334
 epoch: 78, train_loss: 0.3200, test_loss: 1.2625, test_f1: 0.6180
 epoch: 79, train_loss: 0.3268, test_loss: 1.2010, test_f1: 0.6363
 epoch: 80, train_loss: 0.3162, test_loss: 1.3371, test_f1: 0.6223
 epoch: 81, train_loss: 0.3110, test_loss: 1.2093, test_f1: 0.6498
 epoch: 82, train_loss: 0.3107, test_loss: 1.3947, test_f1: 0.6339
 epoch: 83, train_loss: 0.2960, test_loss: 1.3034, test_f1: 0.6255
 epoch: 84, train_loss: 0.2924, test_loss: 1.3318, test_f1: 0.6155
 epoch: 85, train_loss: 0.3019, test_loss: 1.4641, test_f1: 0.5986
 epoch: 86, train_loss: 0.2972, test_loss: 1.3822, test_f1: 0.6349
 epoch: 87, train_loss: 0.3022, test_loss: 1.3024, test_f1: 0.6314
 epoch: 88, train_loss: 0.2846, test_loss: 1.3767, test_f1: 0.6180
 epoch: 89, train_loss: 0.2908, test_loss: 1.3968, test_f1: 0.6230
 epoch: 90, train_loss: 0.2680, test_loss: 1.5479, test_f1: 0.6139
 epoch: 91, train_loss: 0.2744, test_loss: 1.5694, test_f1: 0.6066
 epoch: 92, train_loss: 0.2840, test_loss: 1.4744, test_f1: 0.6299
 epoch: 93, train_loss: 0.2806, test_loss: 1.5808, test_f1: 0.6121
 epoch: 94, train_loss: 0.2823, test_loss: 1.3347, test_f1: 0.6227
 epoch: 95, train_loss: 0.2575, test_loss: 1.4966, test_f1: 0.6196
 epoch: 96, train_loss: 0.2786, test_loss: 1.5663, test_f1: 0.6229
 epoch: 97, train_loss: 0.2862, test_loss: 1.5204, test_f1: 0.6081
 epoch: 98, train_loss: 0.2643, test_loss: 1.3165, test_f1: 0.6381
 epoch: 99, train_loss: 0.2682, test_loss: 1.5532, test_f1: 0.6214
##################ITERATION #6 ****************************************
 epoch: 0, train_loss: 1.3206, test_loss: 1.3070, test_f1: 0.2574
 epoch: 1, train_loss: 1.0881, test_loss: 1.3241, test_f1: 0.2598
 epoch: 2, train_loss: 1.0255, test_loss: 1.3944, test_f1: 0.3048
 epoch: 3, train_loss: 0.9885, test_loss: 1.4223, test_f1: 0.3324
 epoch: 4, train_loss: 0.9632, test_loss: 1.2827, test_f1: 0.3767
 epoch: 5, train_loss: 0.9222, test_loss: 1.1759, test_f1: 0.4349
 epoch: 6, train_loss: 0.9081, test_loss: 1.0326, test_f1: 0.4909
 epoch: 7, train_loss: 0.8865, test_loss: 0.9591, test_f1: 0.5494
 epoch: 8, train_loss: 0.8540, test_loss: 0.9460, test_f1: 0.5606
 epoch: 9, train_loss: 0.8365, test_loss: 0.9815, test_f1: 0.5512
 epoch: 10, train_loss: 0.8271, test_loss: 0.9281, test_f1: 0.5845
 epoch: 11, train_loss: 0.8106, test_loss: 0.9702, test_f1: 0.5404
 epoch: 12, train_loss: 0.8092, test_loss: 0.9230, test_f1: 0.5518
 epoch: 13, train_loss: 0.7950, test_loss: 0.9796, test_f1: 0.5424
 epoch: 14, train_loss: 0.7973, test_loss: 0.9357, test_f1: 0.5675
 epoch: 15, train_loss: 0.7579, test_loss: 0.9539, test_f1: 0.5773
 epoch: 16, train_loss: 0.7426, test_loss: 0.9315, test_f1: 0.5958
 epoch: 17, train_loss: 0.7523, test_loss: 1.0125, test_f1: 0.5533
 epoch: 18, train_loss: 0.7300, test_loss: 1.0290, test_f1: 0.5904
 epoch: 19, train_loss: 0.7348, test_loss: 0.9259, test_f1: 0.6042
 epoch: 20, train_loss: 0.6988, test_loss: 0.9553, test_f1: 0.5829
 epoch: 21, train_loss: 0.7075, test_loss: 0.9602, test_f1: 0.5723
 epoch: 22, train_loss: 0.7150, test_loss: 0.8997, test_f1: 0.6126
 epoch: 23, train_loss: 0.6790, test_loss: 0.9320, test_f1: 0.6010
 epoch: 24, train_loss: 0.6731, test_loss: 0.9156, test_f1: 0.5879
 epoch: 25, train_loss: 0.6516, test_loss: 0.8869, test_f1: 0.6168
 epoch: 26, train_loss: 0.6368, test_loss: 0.9433, test_f1: 0.5905
 epoch: 27, train_loss: 0.6509, test_loss: 0.9378, test_f1: 0.6132
 epoch: 28, train_loss: 0.6361, test_loss: 0.8943, test_f1: 0.6185
 epoch: 29, train_loss: 0.6212, test_loss: 0.9309, test_f1: 0.6077
 epoch: 30, train_loss: 0.6165, test_loss: 0.9802, test_f1: 0.6075
 epoch: 31, train_loss: 0.6166, test_loss: 0.9774, test_f1: 0.5843
 epoch: 32, train_loss: 0.6021, test_loss: 0.8849, test_f1: 0.6405
 epoch: 33, train_loss: 0.5878, test_loss: 1.0361, test_f1: 0.5728
 epoch: 34, train_loss: 0.5819, test_loss: 0.8539, test_f1: 0.6308
 epoch: 35, train_loss: 0.5732, test_loss: 0.8978, test_f1: 0.6323
 epoch: 36, train_loss: 0.5628, test_loss: 0.9064, test_f1: 0.6176
 epoch: 37, train_loss: 0.5799, test_loss: 0.9194, test_f1: 0.6120
 epoch: 38, train_loss: 0.5537, test_loss: 0.9233, test_f1: 0.6255
 epoch: 39, train_loss: 0.5372, test_loss: 1.0812, test_f1: 0.5978
 epoch: 40, train_loss: 0.5436, test_loss: 0.9059, test_f1: 0.5893
 epoch: 41, train_loss: 0.5430, test_loss: 0.9435, test_f1: 0.6138
 epoch: 42, train_loss: 0.5104, test_loss: 0.9520, test_f1: 0.6329
 epoch: 43, train_loss: 0.5005, test_loss: 0.9552, test_f1: 0.6080
 epoch: 44, train_loss: 0.4738, test_loss: 0.9361, test_f1: 0.6283
 epoch: 45, train_loss: 0.5143, test_loss: 0.9919, test_f1: 0.6159
 epoch: 46, train_loss: 0.5068, test_loss: 1.0091, test_f1: 0.6208
 epoch: 47, train_loss: 0.5005, test_loss: 1.0657, test_f1: 0.6062
 epoch: 48, train_loss: 0.4709, test_loss: 0.9849, test_f1: 0.6140
 epoch: 49, train_loss: 0.4812, test_loss: 1.0582, test_f1: 0.6042
 epoch: 50, train_loss: 0.4638, test_loss: 0.9776, test_f1: 0.6509
 epoch: 51, train_loss: 0.4412, test_loss: 1.0289, test_f1: 0.6117
 epoch: 52, train_loss: 0.4050, test_loss: 1.0277, test_f1: 0.6425
 epoch: 53, train_loss: 0.4055, test_loss: 0.9667, test_f1: 0.6536
 epoch: 54, train_loss: 0.4002, test_loss: 0.9697, test_f1: 0.6391
 epoch: 55, train_loss: 0.3875, test_loss: 1.0066, test_f1: 0.6433
 epoch: 56, train_loss: 0.4059, test_loss: 1.0369, test_f1: 0.6257
 epoch: 57, train_loss: 0.3855, test_loss: 1.0225, test_f1: 0.6337
 epoch: 58, train_loss: 0.3818, test_loss: 1.0539, test_f1: 0.6272
 epoch: 59, train_loss: 0.3747, test_loss: 1.0639, test_f1: 0.6314
 epoch: 60, train_loss: 0.3575, test_loss: 1.0813, test_f1: 0.6404
 epoch: 61, train_loss: 0.3453, test_loss: 1.0289, test_f1: 0.6600
 epoch: 62, train_loss: 0.3591, test_loss: 1.1162, test_f1: 0.6396
 epoch: 63, train_loss: 0.3313, test_loss: 1.1115, test_f1: 0.6385
 epoch: 64, train_loss: 0.3523, test_loss: 1.1638, test_f1: 0.6185
 epoch: 65, train_loss: 0.3318, test_loss: 1.1738, test_f1: 0.6093
 epoch: 66, train_loss: 0.3294, test_loss: 1.1866, test_f1: 0.6207
 epoch: 67, train_loss: 0.3313, test_loss: 1.1725, test_f1: 0.6163
 epoch: 68, train_loss: 0.3271, test_loss: 1.0841, test_f1: 0.6433
 epoch: 69, train_loss: 0.3208, test_loss: 1.2084, test_f1: 0.6294
 epoch: 70, train_loss: 0.3177, test_loss: 1.1496, test_f1: 0.6146
 epoch: 71, train_loss: 0.3144, test_loss: 1.2034, test_f1: 0.6284
 epoch: 72, train_loss: 0.3142, test_loss: 1.1850, test_f1: 0.6167
 epoch: 73, train_loss: 0.3255, test_loss: 1.2328, test_f1: 0.6207
 epoch: 74, train_loss: 0.3093, test_loss: 1.2203, test_f1: 0.6358
 epoch: 75, train_loss: 0.2928, test_loss: 1.1351, test_f1: 0.6377
 epoch: 76, train_loss: 0.3036, test_loss: 1.2034, test_f1: 0.6278
 epoch: 77, train_loss: 0.2911, test_loss: 1.2973, test_f1: 0.6255
 epoch: 78, train_loss: 0.2882, test_loss: 1.1523, test_f1: 0.6408
 epoch: 79, train_loss: 0.2778, test_loss: 1.2433, test_f1: 0.6210
 epoch: 80, train_loss: 0.2836, test_loss: 1.2267, test_f1: 0.6227
 epoch: 81, train_loss: 0.2922, test_loss: 1.2121, test_f1: 0.6477
 epoch: 82, train_loss: 0.2734, test_loss: 1.3390, test_f1: 0.6323
 epoch: 83, train_loss: 0.2882, test_loss: 1.3681, test_f1: 0.6229
 epoch: 84, train_loss: 0.2672, test_loss: 1.4110, test_f1: 0.6102
 epoch: 85, train_loss: 0.2792, test_loss: 1.1957, test_f1: 0.6437
 epoch: 86, train_loss: 0.2722, test_loss: 1.2406, test_f1: 0.6512
 epoch: 87, train_loss: 0.2534, test_loss: 1.3001, test_f1: 0.6383
 epoch: 88, train_loss: 0.2523, test_loss: 1.3070, test_f1: 0.6226
 epoch: 89, train_loss: 0.2570, test_loss: 1.3727, test_f1: 0.6190
 epoch: 90, train_loss: 0.2589, test_loss: 1.4709, test_f1: 0.6348
 epoch: 91, train_loss: 0.2490, test_loss: 1.3266, test_f1: 0.6165
 epoch: 92, train_loss: 0.2503, test_loss: 1.4428, test_f1: 0.6180
 epoch: 93, train_loss: 0.2518, test_loss: 1.3992, test_f1: 0.6287
 epoch: 94, train_loss: 0.2449, test_loss: 1.4305, test_f1: 0.6303
 epoch: 95, train_loss: 0.2508, test_loss: 1.4206, test_f1: 0.6361
 epoch: 96, train_loss: 0.2544, test_loss: 1.4478, test_f1: 0.6130
 epoch: 97, train_loss: 0.2583, test_loss: 1.5017, test_f1: 0.6230
 epoch: 98, train_loss: 0.2453, test_loss: 1.4802, test_f1: 0.6448
 epoch: 99, train_loss: 0.2398, test_loss: 1.3303, test_f1: 0.6294
##################ITERATION #7 ****************************************
 epoch: 0, train_loss: 1.3645, test_loss: 1.3201, test_f1: 0.2574
 epoch: 1, train_loss: 1.0976, test_loss: 1.2701, test_f1: 0.3281
 epoch: 2, train_loss: 1.0190, test_loss: 1.1347, test_f1: 0.4320
 epoch: 3, train_loss: 0.9767, test_loss: 1.0082, test_f1: 0.4645
 epoch: 4, train_loss: 0.9474, test_loss: 0.9973, test_f1: 0.4753
 epoch: 5, train_loss: 0.9099, test_loss: 0.9840, test_f1: 0.5505
 epoch: 6, train_loss: 0.8976, test_loss: 0.9223, test_f1: 0.5653
 epoch: 7, train_loss: 0.8864, test_loss: 0.9433, test_f1: 0.5478
 epoch: 8, train_loss: 0.8558, test_loss: 0.9415, test_f1: 0.5672
 epoch: 9, train_loss: 0.8408, test_loss: 0.9445, test_f1: 0.5713
 epoch: 10, train_loss: 0.8307, test_loss: 0.9575, test_f1: 0.5535
 epoch: 11, train_loss: 0.8101, test_loss: 0.9125, test_f1: 0.5610
 epoch: 12, train_loss: 0.8059, test_loss: 0.9205, test_f1: 0.5582
 epoch: 13, train_loss: 0.7805, test_loss: 0.9059, test_f1: 0.5678
 epoch: 14, train_loss: 0.7722, test_loss: 0.8731, test_f1: 0.6196
 epoch: 15, train_loss: 0.7553, test_loss: 0.9093, test_f1: 0.5934
 epoch: 16, train_loss: 0.7304, test_loss: 0.9061, test_f1: 0.5871
 epoch: 17, train_loss: 0.7286, test_loss: 0.9125, test_f1: 0.5949
 epoch: 18, train_loss: 0.7137, test_loss: 1.1468, test_f1: 0.5283
 epoch: 19, train_loss: 0.7326, test_loss: 0.9017, test_f1: 0.6050
 epoch: 20, train_loss: 0.7184, test_loss: 0.9715, test_f1: 0.5815
 epoch: 21, train_loss: 0.6664, test_loss: 0.8976, test_f1: 0.6111
 epoch: 22, train_loss: 0.6722, test_loss: 1.0999, test_f1: 0.5756
 epoch: 23, train_loss: 0.6794, test_loss: 0.9325, test_f1: 0.6097
 epoch: 24, train_loss: 0.6653, test_loss: 0.9577, test_f1: 0.5864
 epoch: 25, train_loss: 0.6677, test_loss: 0.9035, test_f1: 0.6038
 epoch: 26, train_loss: 0.6544, test_loss: 0.9565, test_f1: 0.5819
 epoch: 27, train_loss: 0.6207, test_loss: 0.9127, test_f1: 0.6181
 epoch: 28, train_loss: 0.6218, test_loss: 0.8941, test_f1: 0.6258
 epoch: 29, train_loss: 0.6037, test_loss: 0.8352, test_f1: 0.6512
 epoch: 30, train_loss: 0.6027, test_loss: 0.8735, test_f1: 0.6365
 epoch: 31, train_loss: 0.5911, test_loss: 0.9135, test_f1: 0.6131
 epoch: 32, train_loss: 0.5976, test_loss: 0.9522, test_f1: 0.6273
 epoch: 33, train_loss: 0.5923, test_loss: 1.0041, test_f1: 0.6213
 epoch: 34, train_loss: 0.6013, test_loss: 0.8857, test_f1: 0.6155
 epoch: 35, train_loss: 0.5817, test_loss: 0.9037, test_f1: 0.6344
 epoch: 36, train_loss: 0.5603, test_loss: 0.8857, test_f1: 0.6609
 epoch: 37, train_loss: 0.5541, test_loss: 0.8841, test_f1: 0.6505
 epoch: 38, train_loss: 0.5579, test_loss: 0.8919, test_f1: 0.6325
 epoch: 39, train_loss: 0.5437, test_loss: 0.9241, test_f1: 0.6073
 epoch: 40, train_loss: 0.5297, test_loss: 0.9506, test_f1: 0.6279
 epoch: 41, train_loss: 0.5316, test_loss: 0.8639, test_f1: 0.6530
 epoch: 42, train_loss: 0.5233, test_loss: 0.9205, test_f1: 0.6417
 epoch: 43, train_loss: 0.5091, test_loss: 0.9704, test_f1: 0.6104
 epoch: 44, train_loss: 0.5125, test_loss: 0.9448, test_f1: 0.6414
 epoch: 45, train_loss: 0.5173, test_loss: 0.9560, test_f1: 0.6232
 epoch: 46, train_loss: 0.4925, test_loss: 0.8918, test_f1: 0.6388
 epoch: 47, train_loss: 0.4908, test_loss: 0.9901, test_f1: 0.6198
 epoch: 48, train_loss: 0.4700, test_loss: 0.9725, test_f1: 0.6375
 epoch: 49, train_loss: 0.4574, test_loss: 1.1014, test_f1: 0.6218
 epoch: 50, train_loss: 0.4587, test_loss: 0.9717, test_f1: 0.6254
 epoch: 51, train_loss: 0.4421, test_loss: 0.9056, test_f1: 0.6597
 epoch: 52, train_loss: 0.4178, test_loss: 0.9617, test_f1: 0.6740
 epoch: 53, train_loss: 0.4126, test_loss: 1.0065, test_f1: 0.6627
 epoch: 54, train_loss: 0.4029, test_loss: 0.9508, test_f1: 0.6507
 epoch: 55, train_loss: 0.3858, test_loss: 0.9135, test_f1: 0.6632
 epoch: 56, train_loss: 0.3834, test_loss: 0.9501, test_f1: 0.6624
 epoch: 57, train_loss: 0.3839, test_loss: 1.0135, test_f1: 0.6671
 epoch: 58, train_loss: 0.3878, test_loss: 0.9648, test_f1: 0.6625
 epoch: 59, train_loss: 0.3783, test_loss: 1.1256, test_f1: 0.6402
 epoch: 60, train_loss: 0.3729, test_loss: 1.0303, test_f1: 0.6358
 epoch: 61, train_loss: 0.3542, test_loss: 0.9687, test_f1: 0.6642
 epoch: 62, train_loss: 0.3551, test_loss: 1.0323, test_f1: 0.6747
 epoch: 63, train_loss: 0.3657, test_loss: 0.9485, test_f1: 0.6768
 epoch: 64, train_loss: 0.3510, test_loss: 1.1841, test_f1: 0.6467
 epoch: 65, train_loss: 0.3597, test_loss: 1.0028, test_f1: 0.6662
 epoch: 66, train_loss: 0.3496, test_loss: 1.0227, test_f1: 0.6667
 epoch: 67, train_loss: 0.3443, test_loss: 1.1285, test_f1: 0.6360
 epoch: 68, train_loss: 0.3389, test_loss: 1.0764, test_f1: 0.6650
 epoch: 69, train_loss: 0.3343, test_loss: 1.1341, test_f1: 0.6319
 epoch: 70, train_loss: 0.3211, test_loss: 1.1425, test_f1: 0.6492
 epoch: 71, train_loss: 0.3475, test_loss: 1.0421, test_f1: 0.6694
 epoch: 72, train_loss: 0.3249, test_loss: 1.0593, test_f1: 0.6542
 epoch: 73, train_loss: 0.3267, test_loss: 1.0703, test_f1: 0.6460
 epoch: 74, train_loss: 0.3377, test_loss: 1.0136, test_f1: 0.6661
 epoch: 75, train_loss: 0.3336, test_loss: 1.1604, test_f1: 0.6493
 epoch: 76, train_loss: 0.3182, test_loss: 1.2759, test_f1: 0.6157
 epoch: 77, train_loss: 0.3129, test_loss: 1.1028, test_f1: 0.6522
 epoch: 78, train_loss: 0.2944, test_loss: 1.2343, test_f1: 0.6364
 epoch: 79, train_loss: 0.3119, test_loss: 1.0844, test_f1: 0.6607
 epoch: 80, train_loss: 0.2987, test_loss: 1.2064, test_f1: 0.6528
 epoch: 81, train_loss: 0.3059, test_loss: 1.0848, test_f1: 0.6722
 epoch: 82, train_loss: 0.3011, test_loss: 1.1427, test_f1: 0.6603
 epoch: 83, train_loss: 0.2884, test_loss: 1.1694, test_f1: 0.6606
 epoch: 84, train_loss: 0.2934, test_loss: 1.1508, test_f1: 0.6575
 epoch: 85, train_loss: 0.2783, test_loss: 1.2575, test_f1: 0.6221
 epoch: 86, train_loss: 0.2757, test_loss: 1.1346, test_f1: 0.6755
 epoch: 87, train_loss: 0.2861, test_loss: 1.1522, test_f1: 0.6632
 epoch: 88, train_loss: 0.2771, test_loss: 1.2955, test_f1: 0.6571
 epoch: 89, train_loss: 0.2733, test_loss: 1.1342, test_f1: 0.6646
 epoch: 90, train_loss: 0.3049, test_loss: 1.1263, test_f1: 0.6659
 epoch: 91, train_loss: 0.2932, test_loss: 1.2469, test_f1: 0.6437
 epoch: 92, train_loss: 0.2684, test_loss: 1.1915, test_f1: 0.6508
 epoch: 93, train_loss: 0.2664, test_loss: 1.0989, test_f1: 0.6756
 epoch: 94, train_loss: 0.2734, test_loss: 1.2319, test_f1: 0.6612
 epoch: 95, train_loss: 0.2587, test_loss: 1.1769, test_f1: 0.6656
 epoch: 96, train_loss: 0.2686, test_loss: 1.3294, test_f1: 0.6597
 epoch: 97, train_loss: 0.2574, test_loss: 1.2079, test_f1: 0.6506
 epoch: 98, train_loss: 0.2606, test_loss: 1.3110, test_f1: 0.6368
 epoch: 99, train_loss: 0.2528, test_loss: 1.3042, test_f1: 0.6603
##################ITERATION #8 ****************************************
 epoch: 0, train_loss: 1.3940, test_loss: 1.3009, test_f1: 0.2260
 epoch: 1, train_loss: 1.1182, test_loss: 1.2361, test_f1: 0.2435
 epoch: 2, train_loss: 1.0254, test_loss: 1.1030, test_f1: 0.3745
 epoch: 3, train_loss: 0.9824, test_loss: 1.0620, test_f1: 0.4277
 epoch: 4, train_loss: 0.9584, test_loss: 1.0165, test_f1: 0.4859
 epoch: 5, train_loss: 0.9377, test_loss: 0.9701, test_f1: 0.4879
 epoch: 6, train_loss: 0.9107, test_loss: 0.9408, test_f1: 0.5437
 epoch: 7, train_loss: 0.8893, test_loss: 0.9401, test_f1: 0.5394
 epoch: 8, train_loss: 0.8644, test_loss: 0.9744, test_f1: 0.5167
 epoch: 9, train_loss: 0.8455, test_loss: 0.9305, test_f1: 0.5747
 epoch: 10, train_loss: 0.8391, test_loss: 0.8823, test_f1: 0.5645
 epoch: 11, train_loss: 0.8195, test_loss: 0.9775, test_f1: 0.5301
 epoch: 12, train_loss: 0.8167, test_loss: 0.9192, test_f1: 0.5566
 epoch: 13, train_loss: 0.7996, test_loss: 0.9601, test_f1: 0.5577
 epoch: 14, train_loss: 0.7853, test_loss: 0.9057, test_f1: 0.5712
 epoch: 15, train_loss: 0.7690, test_loss: 0.8940, test_f1: 0.5793
 epoch: 16, train_loss: 0.7571, test_loss: 0.8787, test_f1: 0.5894
 epoch: 17, train_loss: 0.7334, test_loss: 0.9203, test_f1: 0.5413
 epoch: 18, train_loss: 0.7396, test_loss: 0.9265, test_f1: 0.5788
 epoch: 19, train_loss: 0.7350, test_loss: 0.8543, test_f1: 0.5801
 epoch: 20, train_loss: 0.7190, test_loss: 0.9444, test_f1: 0.5508
 epoch: 21, train_loss: 0.7116, test_loss: 0.9068, test_f1: 0.5938
 epoch: 22, train_loss: 0.6990, test_loss: 0.8795, test_f1: 0.6064
 epoch: 23, train_loss: 0.6845, test_loss: 0.9099, test_f1: 0.6023
 epoch: 24, train_loss: 0.6714, test_loss: 1.0428, test_f1: 0.5758
 epoch: 25, train_loss: 0.6760, test_loss: 0.9380, test_f1: 0.5865
 epoch: 26, train_loss: 0.6613, test_loss: 0.8889, test_f1: 0.6023
 epoch: 27, train_loss: 0.6427, test_loss: 0.9058, test_f1: 0.5790
 epoch: 28, train_loss: 0.6520, test_loss: 1.2796, test_f1: 0.4986
 epoch: 29, train_loss: 0.6516, test_loss: 0.9000, test_f1: 0.6033
 epoch: 30, train_loss: 0.6380, test_loss: 0.9150, test_f1: 0.6129
 epoch: 31, train_loss: 0.6086, test_loss: 1.0092, test_f1: 0.5644
 epoch: 32, train_loss: 0.6011, test_loss: 0.9720, test_f1: 0.5766
 epoch: 33, train_loss: 0.6032, test_loss: 0.8665, test_f1: 0.6171
 epoch: 34, train_loss: 0.5843, test_loss: 0.9803, test_f1: 0.5716
 epoch: 35, train_loss: 0.5898, test_loss: 0.8797, test_f1: 0.6307
 epoch: 36, train_loss: 0.5814, test_loss: 0.9566, test_f1: 0.5889
 epoch: 37, train_loss: 0.5810, test_loss: 0.9195, test_f1: 0.5862
 epoch: 38, train_loss: 0.5971, test_loss: 0.8982, test_f1: 0.6021
 epoch: 39, train_loss: 0.5798, test_loss: 0.8931, test_f1: 0.6012
 epoch: 40, train_loss: 0.5679, test_loss: 0.8843, test_f1: 0.6167
 epoch: 41, train_loss: 0.5502, test_loss: 0.8434, test_f1: 0.6257
 epoch: 42, train_loss: 0.5370, test_loss: 1.0028, test_f1: 0.6064
 epoch: 43, train_loss: 0.5291, test_loss: 0.8732, test_f1: 0.6271
 epoch: 44, train_loss: 0.5037, test_loss: 0.9440, test_f1: 0.5864
 epoch: 45, train_loss: 0.5023, test_loss: 0.9351, test_f1: 0.6253
 epoch: 46, train_loss: 0.5150, test_loss: 0.8936, test_f1: 0.6225
 epoch: 47, train_loss: 0.5171, test_loss: 1.0251, test_f1: 0.6041
 epoch: 48, train_loss: 0.5261, test_loss: 0.9607, test_f1: 0.6136
 epoch: 49, train_loss: 0.5029, test_loss: 1.0427, test_f1: 0.5957
 epoch: 50, train_loss: 0.5154, test_loss: 0.9141, test_f1: 0.6569
 epoch: 51, train_loss: 0.4630, test_loss: 0.9324, test_f1: 0.6555
 epoch: 52, train_loss: 0.4399, test_loss: 0.9735, test_f1: 0.6346
 epoch: 53, train_loss: 0.4267, test_loss: 0.9654, test_f1: 0.6291
 epoch: 54, train_loss: 0.4132, test_loss: 0.9664, test_f1: 0.6615
 epoch: 55, train_loss: 0.4109, test_loss: 0.9907, test_f1: 0.6574
 epoch: 56, train_loss: 0.3960, test_loss: 1.0095, test_f1: 0.6323
 epoch: 57, train_loss: 0.4070, test_loss: 1.0561, test_f1: 0.6382
 epoch: 58, train_loss: 0.3851, test_loss: 1.0039, test_f1: 0.6635
 epoch: 59, train_loss: 0.4000, test_loss: 1.0973, test_f1: 0.6017
 epoch: 60, train_loss: 0.3805, test_loss: 1.1474, test_f1: 0.6229
 epoch: 61, train_loss: 0.3937, test_loss: 1.0419, test_f1: 0.6299
 epoch: 62, train_loss: 0.3669, test_loss: 1.0431, test_f1: 0.6579
 epoch: 63, train_loss: 0.3580, test_loss: 1.0149, test_f1: 0.6511
 epoch: 64, train_loss: 0.3525, test_loss: 1.1211, test_f1: 0.6223
 epoch: 65, train_loss: 0.3558, test_loss: 1.0359, test_f1: 0.6691
 epoch: 66, train_loss: 0.3512, test_loss: 1.0931, test_f1: 0.6374
 epoch: 67, train_loss: 0.3416, test_loss: 1.1266, test_f1: 0.6375
 epoch: 68, train_loss: 0.3620, test_loss: 1.1654, test_f1: 0.6209
 epoch: 69, train_loss: 0.3597, test_loss: 1.1073, test_f1: 0.6317
 epoch: 70, train_loss: 0.3452, test_loss: 1.1573, test_f1: 0.6303
 epoch: 71, train_loss: 0.3472, test_loss: 1.1687, test_f1: 0.6355
 epoch: 72, train_loss: 0.3306, test_loss: 1.1854, test_f1: 0.6330
 epoch: 73, train_loss: 0.3253, test_loss: 1.1472, test_f1: 0.6384
 epoch: 74, train_loss: 0.3296, test_loss: 1.1314, test_f1: 0.6599
 epoch: 75, train_loss: 0.3188, test_loss: 1.2195, test_f1: 0.6424
 epoch: 76, train_loss: 0.3164, test_loss: 1.1864, test_f1: 0.6536
 epoch: 77, train_loss: 0.3163, test_loss: 1.2398, test_f1: 0.6295
 epoch: 78, train_loss: 0.3088, test_loss: 1.0851, test_f1: 0.6537
 epoch: 79, train_loss: 0.2968, test_loss: 1.1797, test_f1: 0.6507
 epoch: 80, train_loss: 0.3143, test_loss: 1.3311, test_f1: 0.6289
 epoch: 81, train_loss: 0.3340, test_loss: 1.3568, test_f1: 0.6099
 epoch: 82, train_loss: 0.3247, test_loss: 1.1310, test_f1: 0.6572
 epoch: 83, train_loss: 0.3005, test_loss: 1.2258, test_f1: 0.6489
 epoch: 84, train_loss: 0.3010, test_loss: 1.1546, test_f1: 0.6530
 epoch: 85, train_loss: 0.2937, test_loss: 1.3037, test_f1: 0.6288
 epoch: 86, train_loss: 0.2909, test_loss: 1.3008, test_f1: 0.6528
 epoch: 87, train_loss: 0.2911, test_loss: 1.3295, test_f1: 0.6687
 epoch: 88, train_loss: 0.2737, test_loss: 1.3623, test_f1: 0.6523
 epoch: 89, train_loss: 0.2919, test_loss: 1.1938, test_f1: 0.6474
 epoch: 90, train_loss: 0.2844, test_loss: 1.2744, test_f1: 0.6453
 epoch: 91, train_loss: 0.2728, test_loss: 1.1900, test_f1: 0.6659
 epoch: 92, train_loss: 0.2651, test_loss: 1.2751, test_f1: 0.6578
 epoch: 93, train_loss: 0.2763, test_loss: 1.3107, test_f1: 0.6328
 epoch: 94, train_loss: 0.2846, test_loss: 1.2741, test_f1: 0.6673
 epoch: 95, train_loss: 0.2758, test_loss: 1.2277, test_f1: 0.6689
 epoch: 96, train_loss: 0.2600, test_loss: 1.3773, test_f1: 0.6605
 epoch: 97, train_loss: 0.2587, test_loss: 1.3814, test_f1: 0.6525
 epoch: 98, train_loss: 0.2698, test_loss: 1.2978, test_f1: 0.6491
 epoch: 99, train_loss: 0.2420, test_loss: 1.2640, test_f1: 0.6307
##################ITERATION #9 ****************************************
 epoch: 0, train_loss: 1.4080, test_loss: 1.3408, test_f1: 0.2585
 epoch: 1, train_loss: 1.1179, test_loss: 1.2407, test_f1: 0.2585
 epoch: 2, train_loss: 1.0415, test_loss: 1.1308, test_f1: 0.3864
 epoch: 3, train_loss: 1.0031, test_loss: 1.0726, test_f1: 0.4029
 epoch: 4, train_loss: 0.9663, test_loss: 1.0586, test_f1: 0.4670
 epoch: 5, train_loss: 0.9399, test_loss: 1.0195, test_f1: 0.4768
 epoch: 6, train_loss: 0.8885, test_loss: 0.9596, test_f1: 0.5353
 epoch: 7, train_loss: 0.8827, test_loss: 0.9606, test_f1: 0.5133
 epoch: 8, train_loss: 0.8603, test_loss: 0.9918, test_f1: 0.5586
 epoch: 9, train_loss: 0.8186, test_loss: 0.9452, test_f1: 0.5454
 epoch: 10, train_loss: 0.8197, test_loss: 0.9306, test_f1: 0.5736
 epoch: 11, train_loss: 0.8197, test_loss: 0.9468, test_f1: 0.5700
 epoch: 12, train_loss: 0.7965, test_loss: 0.9379, test_f1: 0.5649
 epoch: 13, train_loss: 0.7708, test_loss: 0.9318, test_f1: 0.5588
 epoch: 14, train_loss: 0.7688, test_loss: 0.9705, test_f1: 0.5674
 epoch: 15, train_loss: 0.7516, test_loss: 0.9612, test_f1: 0.5509
 epoch: 16, train_loss: 0.7341, test_loss: 0.9809, test_f1: 0.5452
 epoch: 17, train_loss: 0.7319, test_loss: 0.9081, test_f1: 0.5840
 epoch: 18, train_loss: 0.7553, test_loss: 0.9208, test_f1: 0.5761
 epoch: 19, train_loss: 0.7254, test_loss: 0.9548, test_f1: 0.5814
 epoch: 20, train_loss: 0.7148, test_loss: 0.9243, test_f1: 0.6086
 epoch: 21, train_loss: 0.7046, test_loss: 0.9741, test_f1: 0.5413
 epoch: 22, train_loss: 0.6867, test_loss: 1.0153, test_f1: 0.5701
 epoch: 23, train_loss: 0.6696, test_loss: 0.9796, test_f1: 0.5957
 epoch: 24, train_loss: 0.6844, test_loss: 0.9175, test_f1: 0.5832
 epoch: 25, train_loss: 0.6822, test_loss: 1.0279, test_f1: 0.5437
 epoch: 26, train_loss: 0.6657, test_loss: 0.9319, test_f1: 0.5929
 epoch: 27, train_loss: 0.6520, test_loss: 0.9669, test_f1: 0.6023
 epoch: 28, train_loss: 0.6291, test_loss: 0.9344, test_f1: 0.6232
 epoch: 29, train_loss: 0.6304, test_loss: 0.8869, test_f1: 0.6011
 epoch: 30, train_loss: 0.6193, test_loss: 0.9619, test_f1: 0.5972
 epoch: 31, train_loss: 0.6310, test_loss: 0.9086, test_f1: 0.5828
 epoch: 32, train_loss: 0.6126, test_loss: 0.9389, test_f1: 0.6000
 epoch: 33, train_loss: 0.6130, test_loss: 0.9981, test_f1: 0.5844
 epoch: 34, train_loss: 0.5951, test_loss: 1.0340, test_f1: 0.5797
 epoch: 35, train_loss: 0.5892, test_loss: 0.8979, test_f1: 0.6332
 epoch: 36, train_loss: 0.5803, test_loss: 0.9460, test_f1: 0.5931
 epoch: 37, train_loss: 0.5904, test_loss: 0.9331, test_f1: 0.5832
 epoch: 38, train_loss: 0.5854, test_loss: 1.1642, test_f1: 0.5812
 epoch: 39, train_loss: 0.5910, test_loss: 0.9336, test_f1: 0.6201
 epoch: 40, train_loss: 0.5614, test_loss: 1.0066, test_f1: 0.6037
 epoch: 41, train_loss: 0.5357, test_loss: 0.9852, test_f1: 0.6213
 epoch: 42, train_loss: 0.5514, test_loss: 0.9340, test_f1: 0.6138
 epoch: 43, train_loss: 0.5430, test_loss: 1.0004, test_f1: 0.6361
 epoch: 44, train_loss: 0.5305, test_loss: 0.9387, test_f1: 0.6277
 epoch: 45, train_loss: 0.5298, test_loss: 1.0327, test_f1: 0.6275
 epoch: 46, train_loss: 0.5335, test_loss: 0.9542, test_f1: 0.5997
 epoch: 47, train_loss: 0.5065, test_loss: 1.1199, test_f1: 0.5581
 epoch: 48, train_loss: 0.5180, test_loss: 1.0117, test_f1: 0.6133
 epoch: 49, train_loss: 0.5134, test_loss: 0.9567, test_f1: 0.6036
 epoch: 50, train_loss: 0.5254, test_loss: 0.9008, test_f1: 0.6259
 epoch: 51, train_loss: 0.4933, test_loss: 0.9845, test_f1: 0.6322
 epoch: 52, train_loss: 0.4651, test_loss: 1.0122, test_f1: 0.6235
 epoch: 53, train_loss: 0.4473, test_loss: 1.0504, test_f1: 0.6332
 epoch: 54, train_loss: 0.4316, test_loss: 0.9887, test_f1: 0.6197
 epoch: 55, train_loss: 0.4410, test_loss: 0.9933, test_f1: 0.6369
 epoch: 56, train_loss: 0.4172, test_loss: 1.1353, test_f1: 0.6036
 epoch: 57, train_loss: 0.4199, test_loss: 1.0771, test_f1: 0.6293
 epoch: 58, train_loss: 0.4022, test_loss: 1.1760, test_f1: 0.6189
 epoch: 59, train_loss: 0.4061, test_loss: 1.0207, test_f1: 0.6344
 epoch: 60, train_loss: 0.3974, test_loss: 1.0112, test_f1: 0.6264
 epoch: 61, train_loss: 0.3974, test_loss: 1.0936, test_f1: 0.6262
 epoch: 62, train_loss: 0.3915, test_loss: 1.0499, test_f1: 0.6475
 epoch: 63, train_loss: 0.3969, test_loss: 1.1479, test_f1: 0.6024
 epoch: 64, train_loss: 0.4003, test_loss: 1.1465, test_f1: 0.6272
 epoch: 65, train_loss: 0.3830, test_loss: 0.9881, test_f1: 0.6306
 epoch: 66, train_loss: 0.3798, test_loss: 1.0493, test_f1: 0.6451
 epoch: 67, train_loss: 0.3856, test_loss: 1.0973, test_f1: 0.6300
 epoch: 68, train_loss: 0.3874, test_loss: 1.0563, test_f1: 0.6394
 epoch: 69, train_loss: 0.3902, test_loss: 1.0426, test_f1: 0.6331
 epoch: 70, train_loss: 0.3740, test_loss: 1.0779, test_f1: 0.6348
 epoch: 71, train_loss: 0.3784, test_loss: 1.1607, test_f1: 0.6245
 epoch: 72, train_loss: 0.3863, test_loss: 1.2956, test_f1: 0.6402
 epoch: 73, train_loss: 0.3735, test_loss: 1.0650, test_f1: 0.6427
 epoch: 74, train_loss: 0.3885, test_loss: 1.0571, test_f1: 0.6379
 epoch: 75, train_loss: 0.3712, test_loss: 1.2386, test_f1: 0.5849
 epoch: 76, train_loss: 0.3586, test_loss: 1.0897, test_f1: 0.6354
 epoch: 77, train_loss: 0.3643, test_loss: 1.1151, test_f1: 0.6412
 epoch: 78, train_loss: 0.3571, test_loss: 1.2868, test_f1: 0.6178
 epoch: 79, train_loss: 0.3652, test_loss: 1.0895, test_f1: 0.6424
 epoch: 80, train_loss: 0.3364, test_loss: 1.2356, test_f1: 0.6110
 epoch: 81, train_loss: 0.3461, test_loss: 1.2389, test_f1: 0.6350
 epoch: 82, train_loss: 0.3548, test_loss: 1.1297, test_f1: 0.6286
 epoch: 83, train_loss: 0.3225, test_loss: 1.2499, test_f1: 0.6201
 epoch: 84, train_loss: 0.3326, test_loss: 1.0654, test_f1: 0.6469
 epoch: 85, train_loss: 0.3205, test_loss: 1.1164, test_f1: 0.6475
 epoch: 86, train_loss: 0.3224, test_loss: 1.3116, test_f1: 0.6296
 epoch: 87, train_loss: 0.3124, test_loss: 1.2036, test_f1: 0.6504
 epoch: 88, train_loss: 0.3255, test_loss: 1.2115, test_f1: 0.6146
 epoch: 89, train_loss: 0.3165, test_loss: 1.2042, test_f1: 0.6441
 epoch: 90, train_loss: 0.3072, test_loss: 1.3437, test_f1: 0.5968
 epoch: 91, train_loss: 0.3180, test_loss: 1.1704, test_f1: 0.6458
 epoch: 92, train_loss: 0.3132, test_loss: 1.1488, test_f1: 0.6331
 epoch: 93, train_loss: 0.3098, test_loss: 1.1771, test_f1: 0.6458
 epoch: 94, train_loss: 0.2948, test_loss: 1.2423, test_f1: 0.6434
 epoch: 95, train_loss: 0.3033, test_loss: 1.2124, test_f1: 0.6397
 epoch: 96, train_loss: 0.2797, test_loss: 1.1848, test_f1: 0.6505
 epoch: 97, train_loss: 0.2960, test_loss: 1.2521, test_f1: 0.6546
 epoch: 98, train_loss: 0.3062, test_loss: 1.2357, test_f1: 0.6401
 epoch: 99, train_loss: 0.3051, test_loss: 1.2204, test_f1: 0.6579

Training completed in 481.05 seconds
Best F1: 0.6845 at epoch 56
Mean F1 across iterations: 0.6682  0.0083
========================FINAL RESULTS================================
FEGIN weighted F1: 0.6845  0.0083
python main.py --data ltspice_examples --representation component_pin --model FEGIN --layers 6 --hiddens 64 --batch_size 256 --lr 0.001 --emb_size 128 --epochs 100 --save_appendix component_pin_L6_H64_BS256_LR0.001_E128 --no_val
-----



STDERR:
  File "main.py", line 370, in <module>
    main()
  File "main.py", line 254, in main
    dataset = dataset_class(
  File "/home/philip/projects/ltspice_examples_code_repo/Circuit-Completion-Using-GNNs/component_classification_with_link_prediction_head/evaluation/FEGIN/kernel/circuit_datasets.py", line 15, in __init__
    self.data, self.slices = torch.load(self.processed_paths[0])
  File "/home/philip/.local/lib/python3.8/site-packages/torch/serialization.py", line 1040, in load
    warnings.warn(
  File "/usr/lib/python3.8/warnings.py", line 109, in _showwarnmsg
    sw(msg.message, msg.category, msg.filename, msg.lineno,
  File "main.py", line 47, in warn_with_traceback
    traceback.print_stack(file=log)
/home/philip/projects/ltspice_examples_code_repo/Circuit-Completion-Using-GNNs/component_classification_with_link_prediction_head/evaluation/FEGIN/kernel/circuit_datasets.py:15: FutureWarning: You are using `torch.load` with `weights_only=False` (the current default value), which uses the default pickle module implicitly. It is possible to construct malicious pickle data which will execute arbitrary code during unpickling (See https://github.com/pytorch/pytorch/blob/main/SECURITY.md#untrusted-models for more details). In a future release, the default value for `weights_only` will be flipped to `True`. This limits the functions that could be executed during unpickling. Arbitrary objects will no longer be allowed to be loaded via this mode unless they are explicitly allowlisted by the user via `torch.serialization.add_safe_globals`. We recommend you start setting `weights_only=True` for any use case where you don't have full control of the loaded file. Please open an issue on GitHub for any issues related to this experimental feature.
  self.data, self.slices = torch.load(self.processed_paths[0])
