STDOUT:
Results will be saved in /home/philip/projects/ltspice_examples_code_repo/Circuit-Completion-Using-GNNs/component_classification_with_link_prediction_head/evaluation/FEGIN/results/model_FEGIN_dataset_ltspice_examples
Command line input: python main.py --data ltspice_examples --representation component_net --model FEGIN --layers 6 --hiddens 64 --batch_size 64 --lr 0.0001 --emb_size 512 --epochs 100 --save_appendix component_net_L6_H64_BS64_LR0.0001_E512 --no_val
 is saved.
-----
ltspice_examples - FEGIN
Using 6 layers, 64 hidden units, h = 2
Loading component_net representation dataset
ENTERED
Training FEGIN on component_net representation
Train: 3558, Test: 846
##################ITERATION #0 ****************************************
 epoch: 0, train_loss: 1.3850, test_loss: 1.3690, test_f1: 0.0967
 epoch: 1, train_loss: 1.3421, test_loss: 1.3158, test_f1: 0.2568
 epoch: 2, train_loss: 1.3072, test_loss: 1.2772, test_f1: 0.2782
 epoch: 3, train_loss: 1.2727, test_loss: 1.2429, test_f1: 0.2542
 epoch: 4, train_loss: 1.2453, test_loss: 1.2198, test_f1: 0.2563
 epoch: 5, train_loss: 1.2249, test_loss: 1.2006, test_f1: 0.2750
 epoch: 6, train_loss: 1.2042, test_loss: 1.1751, test_f1: 0.2836
 epoch: 7, train_loss: 1.1909, test_loss: 1.1530, test_f1: 0.3368
 epoch: 8, train_loss: 1.1721, test_loss: 1.1342, test_f1: 0.3959
 epoch: 9, train_loss: 1.1508, test_loss: 1.1104, test_f1: 0.4611
 epoch: 10, train_loss: 1.1303, test_loss: 1.0903, test_f1: 0.5070
 epoch: 11, train_loss: 1.1047, test_loss: 1.0610, test_f1: 0.5105
 epoch: 12, train_loss: 1.0896, test_loss: 1.0479, test_f1: 0.4743
 epoch: 13, train_loss: 1.0661, test_loss: 1.0210, test_f1: 0.4946
 epoch: 14, train_loss: 1.0426, test_loss: 1.0060, test_f1: 0.5137
 epoch: 15, train_loss: 1.0153, test_loss: 0.9877, test_f1: 0.5154
 epoch: 16, train_loss: 0.9980, test_loss: 0.9751, test_f1: 0.4800
 epoch: 17, train_loss: 0.9788, test_loss: 0.9669, test_f1: 0.4887
 epoch: 18, train_loss: 0.9651, test_loss: 0.9325, test_f1: 0.5195
 epoch: 19, train_loss: 0.9479, test_loss: 0.9405, test_f1: 0.4818
 epoch: 20, train_loss: 0.9376, test_loss: 0.9343, test_f1: 0.4951
 epoch: 21, train_loss: 0.9223, test_loss: 0.9267, test_f1: 0.5086
 epoch: 22, train_loss: 0.9136, test_loss: 0.9314, test_f1: 0.4845
 epoch: 23, train_loss: 0.9066, test_loss: 0.9190, test_f1: 0.5213
 epoch: 24, train_loss: 0.8993, test_loss: 0.9338, test_f1: 0.5340
 epoch: 25, train_loss: 0.8837, test_loss: 0.9109, test_f1: 0.5241
 epoch: 26, train_loss: 0.8944, test_loss: 0.9155, test_f1: 0.5149
 epoch: 27, train_loss: 0.8820, test_loss: 0.9163, test_f1: 0.5369
 epoch: 28, train_loss: 0.8710, test_loss: 0.9322, test_f1: 0.5319
 epoch: 29, train_loss: 0.8687, test_loss: 0.9351, test_f1: 0.5260
 epoch: 30, train_loss: 0.8623, test_loss: 0.9095, test_f1: 0.5458
 epoch: 31, train_loss: 0.8571, test_loss: 0.9242, test_f1: 0.5393
 epoch: 32, train_loss: 0.8517, test_loss: 0.9084, test_f1: 0.5450
 epoch: 33, train_loss: 0.8499, test_loss: 0.9417, test_f1: 0.5423
 epoch: 34, train_loss: 0.8299, test_loss: 0.9468, test_f1: 0.5375
 epoch: 35, train_loss: 0.8382, test_loss: 0.9427, test_f1: 0.5520
 epoch: 36, train_loss: 0.8341, test_loss: 0.9509, test_f1: 0.5677
 epoch: 37, train_loss: 0.8308, test_loss: 0.9119, test_f1: 0.5650
 epoch: 38, train_loss: 0.8259, test_loss: 0.9453, test_f1: 0.5436
 epoch: 39, train_loss: 0.8257, test_loss: 0.9352, test_f1: 0.5441
 epoch: 40, train_loss: 0.8241, test_loss: 0.9046, test_f1: 0.5635
 epoch: 41, train_loss: 0.8155, test_loss: 0.9157, test_f1: 0.5653
 epoch: 42, train_loss: 0.8156, test_loss: 0.9309, test_f1: 0.5568
 epoch: 43, train_loss: 0.8072, test_loss: 0.9311, test_f1: 0.5615
 epoch: 44, train_loss: 0.8032, test_loss: 0.9206, test_f1: 0.5522
 epoch: 45, train_loss: 0.8035, test_loss: 0.9201, test_f1: 0.5616
 epoch: 46, train_loss: 0.8082, test_loss: 0.9403, test_f1: 0.5628
 epoch: 47, train_loss: 0.7978, test_loss: 0.9301, test_f1: 0.5680
 epoch: 48, train_loss: 0.7925, test_loss: 0.9481, test_f1: 0.5250
 epoch: 49, train_loss: 0.7947, test_loss: 0.9287, test_f1: 0.5477
 epoch: 50, train_loss: 0.8028, test_loss: 0.9663, test_f1: 0.5717
 epoch: 51, train_loss: 0.7891, test_loss: 0.9453, test_f1: 0.5349
 epoch: 52, train_loss: 0.7794, test_loss: 0.9262, test_f1: 0.5462
 epoch: 53, train_loss: 0.7685, test_loss: 0.9264, test_f1: 0.5659
 epoch: 54, train_loss: 0.7582, test_loss: 0.9437, test_f1: 0.5630
 epoch: 55, train_loss: 0.7747, test_loss: 0.9421, test_f1: 0.5428
 epoch: 56, train_loss: 0.7654, test_loss: 0.9518, test_f1: 0.5497
 epoch: 57, train_loss: 0.7637, test_loss: 0.9596, test_f1: 0.5641
 epoch: 58, train_loss: 0.7711, test_loss: 0.9390, test_f1: 0.5536
 epoch: 59, train_loss: 0.7682, test_loss: 0.9617, test_f1: 0.5499
 epoch: 60, train_loss: 0.7710, test_loss: 0.9826, test_f1: 0.5467
 epoch: 61, train_loss: 0.7637, test_loss: 0.9595, test_f1: 0.5692
 epoch: 62, train_loss: 0.7570, test_loss: 0.9443, test_f1: 0.5602
 epoch: 63, train_loss: 0.7622, test_loss: 0.9642, test_f1: 0.5548
 epoch: 64, train_loss: 0.7442, test_loss: 0.9635, test_f1: 0.5527
 epoch: 65, train_loss: 0.7646, test_loss: 0.9528, test_f1: 0.5728
 epoch: 66, train_loss: 0.7619, test_loss: 0.9549, test_f1: 0.5679
 epoch: 67, train_loss: 0.7528, test_loss: 0.9517, test_f1: 0.5558
 epoch: 68, train_loss: 0.7536, test_loss: 0.9508, test_f1: 0.5698
 epoch: 69, train_loss: 0.7541, test_loss: 0.9621, test_f1: 0.5589
 epoch: 70, train_loss: 0.7472, test_loss: 0.9509, test_f1: 0.5650
 epoch: 71, train_loss: 0.7423, test_loss: 0.9494, test_f1: 0.6062
 epoch: 72, train_loss: 0.7509, test_loss: 0.9506, test_f1: 0.5931
 epoch: 73, train_loss: 0.7432, test_loss: 0.9806, test_f1: 0.5698
 epoch: 74, train_loss: 0.7360, test_loss: 0.9765, test_f1: 0.5840
 epoch: 75, train_loss: 0.7497, test_loss: 0.9695, test_f1: 0.5781
 epoch: 76, train_loss: 0.7407, test_loss: 0.9719, test_f1: 0.5612
 epoch: 77, train_loss: 0.7376, test_loss: 0.9625, test_f1: 0.5798
 epoch: 78, train_loss: 0.7332, test_loss: 0.9626, test_f1: 0.5371
 epoch: 79, train_loss: 0.7369, test_loss: 0.9441, test_f1: 0.5581
 epoch: 80, train_loss: 0.7419, test_loss: 0.9687, test_f1: 0.5650
 epoch: 81, train_loss: 0.7396, test_loss: 0.9561, test_f1: 0.5700
 epoch: 82, train_loss: 0.7489, test_loss: 0.9636, test_f1: 0.5776
 epoch: 83, train_loss: 0.7314, test_loss: 0.9939, test_f1: 0.5400
 epoch: 84, train_loss: 0.7224, test_loss: 0.9649, test_f1: 0.5742
 epoch: 85, train_loss: 0.7189, test_loss: 0.9763, test_f1: 0.5523
 epoch: 86, train_loss: 0.7406, test_loss: 0.9731, test_f1: 0.5646
 epoch: 87, train_loss: 0.7220, test_loss: 0.9768, test_f1: 0.5642
 epoch: 88, train_loss: 0.7254, test_loss: 0.9635, test_f1: 0.5815
 epoch: 89, train_loss: 0.7302, test_loss: 0.9854, test_f1: 0.5635
 epoch: 90, train_loss: 0.7379, test_loss: 0.9662, test_f1: 0.5947
 epoch: 91, train_loss: 0.7268, test_loss: 1.0041, test_f1: 0.5760
 epoch: 92, train_loss: 0.7277, test_loss: 0.9920, test_f1: 0.5799
 epoch: 93, train_loss: 0.7281, test_loss: 0.9526, test_f1: 0.5963
 epoch: 94, train_loss: 0.7263, test_loss: 0.9756, test_f1: 0.5845
 epoch: 95, train_loss: 0.7211, test_loss: 0.9762, test_f1: 0.5925
 epoch: 96, train_loss: 0.7244, test_loss: 0.9989, test_f1: 0.5922
 epoch: 97, train_loss: 0.7119, test_loss: 0.9865, test_f1: 0.6070
 epoch: 98, train_loss: 0.7106, test_loss: 0.9695, test_f1: 0.5947
 epoch: 99, train_loss: 0.7155, test_loss: 0.9739, test_f1: 0.5770
##################ITERATION #1 ****************************************
 epoch: 0, train_loss: 1.3113, test_loss: 1.3004, test_f1: 0.2270
 epoch: 1, train_loss: 1.2459, test_loss: 1.2119, test_f1: 0.3722
 epoch: 2, train_loss: 1.2108, test_loss: 1.1674, test_f1: 0.4167
 epoch: 3, train_loss: 1.1756, test_loss: 1.1169, test_f1: 0.4433
 epoch: 4, train_loss: 1.1338, test_loss: 1.0806, test_f1: 0.4504
 epoch: 5, train_loss: 1.0935, test_loss: 1.0348, test_f1: 0.4612
 epoch: 6, train_loss: 1.0630, test_loss: 1.0156, test_f1: 0.4643
 epoch: 7, train_loss: 1.0378, test_loss: 0.9794, test_f1: 0.4808
 epoch: 8, train_loss: 1.0175, test_loss: 0.9685, test_f1: 0.4825
 epoch: 9, train_loss: 1.0003, test_loss: 0.9540, test_f1: 0.4972
 epoch: 10, train_loss: 0.9809, test_loss: 0.9499, test_f1: 0.4837
 epoch: 11, train_loss: 0.9716, test_loss: 0.9476, test_f1: 0.5074
 epoch: 12, train_loss: 0.9509, test_loss: 0.9287, test_f1: 0.5069
 epoch: 13, train_loss: 0.9465, test_loss: 0.9341, test_f1: 0.5096
 epoch: 14, train_loss: 0.9337, test_loss: 0.9224, test_f1: 0.5092
 epoch: 15, train_loss: 0.9242, test_loss: 0.9429, test_f1: 0.5272
 epoch: 16, train_loss: 0.9245, test_loss: 0.9247, test_f1: 0.5120
 epoch: 17, train_loss: 0.9184, test_loss: 0.9234, test_f1: 0.5036
 epoch: 18, train_loss: 0.8986, test_loss: 0.9037, test_f1: 0.5296
 epoch: 19, train_loss: 0.8953, test_loss: 0.9277, test_f1: 0.5396
 epoch: 20, train_loss: 0.8915, test_loss: 0.9277, test_f1: 0.5129
 epoch: 21, train_loss: 0.8759, test_loss: 0.9301, test_f1: 0.5382
 epoch: 22, train_loss: 0.8732, test_loss: 0.9170, test_f1: 0.5378
 epoch: 23, train_loss: 0.8680, test_loss: 0.9306, test_f1: 0.5284
 epoch: 24, train_loss: 0.8668, test_loss: 0.9219, test_f1: 0.5266
 epoch: 25, train_loss: 0.8635, test_loss: 0.9168, test_f1: 0.5445
 epoch: 26, train_loss: 0.8596, test_loss: 0.9262, test_f1: 0.5611
 epoch: 27, train_loss: 0.8491, test_loss: 0.9296, test_f1: 0.5387
 epoch: 28, train_loss: 0.8422, test_loss: 0.9140, test_f1: 0.5354
 epoch: 29, train_loss: 0.8451, test_loss: 0.9295, test_f1: 0.5422
 epoch: 30, train_loss: 0.8381, test_loss: 0.9250, test_f1: 0.5441
 epoch: 31, train_loss: 0.8289, test_loss: 0.9429, test_f1: 0.5437
 epoch: 32, train_loss: 0.8328, test_loss: 0.9212, test_f1: 0.5648
 epoch: 33, train_loss: 0.8255, test_loss: 0.9193, test_f1: 0.5671
 epoch: 34, train_loss: 0.8337, test_loss: 0.9191, test_f1: 0.5609
 epoch: 35, train_loss: 0.8100, test_loss: 0.9129, test_f1: 0.5722
 epoch: 36, train_loss: 0.8046, test_loss: 0.9288, test_f1: 0.5494
 epoch: 37, train_loss: 0.8038, test_loss: 0.9100, test_f1: 0.5531
 epoch: 38, train_loss: 0.8041, test_loss: 0.9135, test_f1: 0.5737
 epoch: 39, train_loss: 0.8038, test_loss: 0.9145, test_f1: 0.5645
 epoch: 40, train_loss: 0.7959, test_loss: 0.9293, test_f1: 0.5706
 epoch: 41, train_loss: 0.8007, test_loss: 0.9084, test_f1: 0.5756
 epoch: 42, train_loss: 0.7928, test_loss: 0.8892, test_f1: 0.5712
 epoch: 43, train_loss: 0.7869, test_loss: 0.9188, test_f1: 0.5853
 epoch: 44, train_loss: 0.7755, test_loss: 0.9194, test_f1: 0.5790
 epoch: 45, train_loss: 0.7837, test_loss: 0.9195, test_f1: 0.5838
 epoch: 46, train_loss: 0.7884, test_loss: 0.9255, test_f1: 0.5877
 epoch: 47, train_loss: 0.7777, test_loss: 0.9289, test_f1: 0.5758
 epoch: 48, train_loss: 0.7755, test_loss: 0.9356, test_f1: 0.6045
 epoch: 49, train_loss: 0.7639, test_loss: 0.9279, test_f1: 0.5898
 epoch: 50, train_loss: 0.7684, test_loss: 0.9156, test_f1: 0.5868
 epoch: 51, train_loss: 0.7674, test_loss: 0.9115, test_f1: 0.5909
 epoch: 52, train_loss: 0.7526, test_loss: 0.9147, test_f1: 0.5919
 epoch: 53, train_loss: 0.7530, test_loss: 0.9072, test_f1: 0.6087
 epoch: 54, train_loss: 0.7408, test_loss: 0.9233, test_f1: 0.5936
 epoch: 55, train_loss: 0.7523, test_loss: 0.9234, test_f1: 0.5876
 epoch: 56, train_loss: 0.7367, test_loss: 0.9008, test_f1: 0.5997
 epoch: 57, train_loss: 0.7445, test_loss: 0.9167, test_f1: 0.6026
 epoch: 58, train_loss: 0.7417, test_loss: 0.9199, test_f1: 0.6080
 epoch: 59, train_loss: 0.7444, test_loss: 0.9175, test_f1: 0.5907
 epoch: 60, train_loss: 0.7423, test_loss: 0.9135, test_f1: 0.5784
 epoch: 61, train_loss: 0.7474, test_loss: 0.9153, test_f1: 0.5959
 epoch: 62, train_loss: 0.7344, test_loss: 0.9254, test_f1: 0.6031
 epoch: 63, train_loss: 0.7400, test_loss: 0.9251, test_f1: 0.5930
 epoch: 64, train_loss: 0.7267, test_loss: 0.9349, test_f1: 0.5809
 epoch: 65, train_loss: 0.7262, test_loss: 0.9318, test_f1: 0.5864
 epoch: 66, train_loss: 0.7275, test_loss: 0.9190, test_f1: 0.5809
 epoch: 67, train_loss: 0.7243, test_loss: 0.9280, test_f1: 0.5909
 epoch: 68, train_loss: 0.7266, test_loss: 0.9356, test_f1: 0.5937
 epoch: 69, train_loss: 0.7302, test_loss: 0.9205, test_f1: 0.6016
 epoch: 70, train_loss: 0.7325, test_loss: 0.9225, test_f1: 0.5826
 epoch: 71, train_loss: 0.7226, test_loss: 0.9179, test_f1: 0.5878
 epoch: 72, train_loss: 0.7202, test_loss: 0.9181, test_f1: 0.6014
 epoch: 73, train_loss: 0.7147, test_loss: 0.9344, test_f1: 0.5837
 epoch: 74, train_loss: 0.7208, test_loss: 0.9231, test_f1: 0.5896
 epoch: 75, train_loss: 0.7201, test_loss: 0.9095, test_f1: 0.5898
 epoch: 76, train_loss: 0.7090, test_loss: 0.9264, test_f1: 0.5976
 epoch: 77, train_loss: 0.7057, test_loss: 0.9292, test_f1: 0.5964
 epoch: 78, train_loss: 0.6995, test_loss: 0.9117, test_f1: 0.5946
 epoch: 79, train_loss: 0.7042, test_loss: 0.9230, test_f1: 0.6099
 epoch: 80, train_loss: 0.7152, test_loss: 0.9280, test_f1: 0.6074
 epoch: 81, train_loss: 0.7057, test_loss: 0.9320, test_f1: 0.5970
 epoch: 82, train_loss: 0.7053, test_loss: 0.9428, test_f1: 0.5817
 epoch: 83, train_loss: 0.7017, test_loss: 0.9310, test_f1: 0.6171
 epoch: 84, train_loss: 0.7012, test_loss: 0.9389, test_f1: 0.5986
 epoch: 85, train_loss: 0.6899, test_loss: 0.9256, test_f1: 0.5990
 epoch: 86, train_loss: 0.7011, test_loss: 0.9295, test_f1: 0.6165
 epoch: 87, train_loss: 0.6990, test_loss: 0.9361, test_f1: 0.6073
 epoch: 88, train_loss: 0.6931, test_loss: 0.9340, test_f1: 0.6219
 epoch: 89, train_loss: 0.6803, test_loss: 0.9135, test_f1: 0.6051
 epoch: 90, train_loss: 0.7028, test_loss: 0.9424, test_f1: 0.5853
 epoch: 91, train_loss: 0.6851, test_loss: 0.9155, test_f1: 0.6042
 epoch: 92, train_loss: 0.6860, test_loss: 0.9182, test_f1: 0.6065
 epoch: 93, train_loss: 0.6800, test_loss: 0.9341, test_f1: 0.5929
 epoch: 94, train_loss: 0.6883, test_loss: 0.9251, test_f1: 0.6130
 epoch: 95, train_loss: 0.6930, test_loss: 0.9283, test_f1: 0.6012
 epoch: 96, train_loss: 0.6828, test_loss: 0.9402, test_f1: 0.6049
 epoch: 97, train_loss: 0.6867, test_loss: 0.9427, test_f1: 0.5999
 epoch: 98, train_loss: 0.6882, test_loss: 0.9278, test_f1: 0.6086
 epoch: 99, train_loss: 0.6839, test_loss: 0.9542, test_f1: 0.6056
##################ITERATION #2 ****************************************
 epoch: 0, train_loss: 1.2662, test_loss: 1.2420, test_f1: 0.2591
 epoch: 1, train_loss: 1.1821, test_loss: 1.1299, test_f1: 0.4136
 epoch: 2, train_loss: 1.1425, test_loss: 1.0815, test_f1: 0.4288
 epoch: 3, train_loss: 1.1110, test_loss: 1.0514, test_f1: 0.4643
 epoch: 4, train_loss: 1.0775, test_loss: 1.0231, test_f1: 0.4738
 epoch: 5, train_loss: 1.0545, test_loss: 1.0008, test_f1: 0.4806
 epoch: 6, train_loss: 1.0296, test_loss: 0.9794, test_f1: 0.4788
 epoch: 7, train_loss: 1.0159, test_loss: 0.9659, test_f1: 0.4935
 epoch: 8, train_loss: 1.0037, test_loss: 0.9643, test_f1: 0.4706
 epoch: 9, train_loss: 0.9806, test_loss: 0.9488, test_f1: 0.4878
 epoch: 10, train_loss: 0.9795, test_loss: 0.9432, test_f1: 0.4817
 epoch: 11, train_loss: 0.9596, test_loss: 0.9315, test_f1: 0.4914
 epoch: 12, train_loss: 0.9512, test_loss: 0.9255, test_f1: 0.4927
 epoch: 13, train_loss: 0.9487, test_loss: 0.9261, test_f1: 0.5014
 epoch: 14, train_loss: 0.9331, test_loss: 0.9173, test_f1: 0.5227
 epoch: 15, train_loss: 0.9224, test_loss: 0.9092, test_f1: 0.5147
 epoch: 16, train_loss: 0.9215, test_loss: 0.9169, test_f1: 0.5224
 epoch: 17, train_loss: 0.9191, test_loss: 0.9058, test_f1: 0.5272
 epoch: 18, train_loss: 0.9104, test_loss: 0.8901, test_f1: 0.5364
 epoch: 19, train_loss: 0.9053, test_loss: 0.8949, test_f1: 0.5295
 epoch: 20, train_loss: 0.8997, test_loss: 0.9197, test_f1: 0.5068
 epoch: 21, train_loss: 0.8861, test_loss: 0.8977, test_f1: 0.5207
 epoch: 22, train_loss: 0.8849, test_loss: 0.9154, test_f1: 0.5206
 epoch: 23, train_loss: 0.8818, test_loss: 0.8968, test_f1: 0.5389
 epoch: 24, train_loss: 0.8819, test_loss: 0.9173, test_f1: 0.5217
 epoch: 25, train_loss: 0.8647, test_loss: 0.8928, test_f1: 0.5272
 epoch: 26, train_loss: 0.8732, test_loss: 0.9158, test_f1: 0.5248
 epoch: 27, train_loss: 0.8549, test_loss: 0.9052, test_f1: 0.5257
 epoch: 28, train_loss: 0.8535, test_loss: 0.8909, test_f1: 0.5497
 epoch: 29, train_loss: 0.8595, test_loss: 0.9114, test_f1: 0.5525
 epoch: 30, train_loss: 0.8452, test_loss: 0.8729, test_f1: 0.5577
 epoch: 31, train_loss: 0.8529, test_loss: 0.8857, test_f1: 0.5467
 epoch: 32, train_loss: 0.8349, test_loss: 0.8854, test_f1: 0.5505
 epoch: 33, train_loss: 0.8429, test_loss: 0.9047, test_f1: 0.5388
 epoch: 34, train_loss: 0.8446, test_loss: 0.9030, test_f1: 0.5520
 epoch: 35, train_loss: 0.8361, test_loss: 0.8918, test_f1: 0.5439
 epoch: 36, train_loss: 0.8283, test_loss: 0.8891, test_f1: 0.5497
 epoch: 37, train_loss: 0.8202, test_loss: 0.9173, test_f1: 0.5527
 epoch: 38, train_loss: 0.8261, test_loss: 0.9027, test_f1: 0.5424
 epoch: 39, train_loss: 0.8210, test_loss: 0.9142, test_f1: 0.5571
 epoch: 40, train_loss: 0.8145, test_loss: 0.8898, test_f1: 0.5630
 epoch: 41, train_loss: 0.8136, test_loss: 0.9008, test_f1: 0.5394
 epoch: 42, train_loss: 0.8081, test_loss: 0.8747, test_f1: 0.5804
 epoch: 43, train_loss: 0.8057, test_loss: 0.9135, test_f1: 0.5596
 epoch: 44, train_loss: 0.7932, test_loss: 0.8953, test_f1: 0.5696
 epoch: 45, train_loss: 0.8005, test_loss: 0.9044, test_f1: 0.5663
 epoch: 46, train_loss: 0.8045, test_loss: 0.9043, test_f1: 0.5698
 epoch: 47, train_loss: 0.8001, test_loss: 0.8934, test_f1: 0.5698
 epoch: 48, train_loss: 0.7875, test_loss: 0.9034, test_f1: 0.5638
 epoch: 49, train_loss: 0.7833, test_loss: 0.9275, test_f1: 0.5571
 epoch: 50, train_loss: 0.7808, test_loss: 0.9033, test_f1: 0.5718
 epoch: 51, train_loss: 0.7763, test_loss: 0.9148, test_f1: 0.5794
 epoch: 52, train_loss: 0.7808, test_loss: 0.9029, test_f1: 0.5689
 epoch: 53, train_loss: 0.7777, test_loss: 0.9152, test_f1: 0.5811
 epoch: 54, train_loss: 0.7645, test_loss: 0.9070, test_f1: 0.5787
 epoch: 55, train_loss: 0.7691, test_loss: 0.9112, test_f1: 0.5660
 epoch: 56, train_loss: 0.7765, test_loss: 0.9145, test_f1: 0.5731
 epoch: 57, train_loss: 0.7606, test_loss: 0.9396, test_f1: 0.5744
 epoch: 58, train_loss: 0.7685, test_loss: 0.9182, test_f1: 0.5726
 epoch: 59, train_loss: 0.7582, test_loss: 0.9059, test_f1: 0.5768
 epoch: 60, train_loss: 0.7647, test_loss: 0.8781, test_f1: 0.5853
 epoch: 61, train_loss: 0.7676, test_loss: 0.9111, test_f1: 0.5813
 epoch: 62, train_loss: 0.7640, test_loss: 0.9143, test_f1: 0.5863
 epoch: 63, train_loss: 0.7600, test_loss: 0.9163, test_f1: 0.5844
 epoch: 64, train_loss: 0.7514, test_loss: 0.9166, test_f1: 0.5817
 epoch: 65, train_loss: 0.7526, test_loss: 0.9266, test_f1: 0.5800
 epoch: 66, train_loss: 0.7545, test_loss: 0.9144, test_f1: 0.5855
 epoch: 67, train_loss: 0.7528, test_loss: 0.8904, test_f1: 0.5706
 epoch: 68, train_loss: 0.7452, test_loss: 0.9184, test_f1: 0.5825
 epoch: 69, train_loss: 0.7420, test_loss: 0.8920, test_f1: 0.5862
 epoch: 70, train_loss: 0.7495, test_loss: 0.9352, test_f1: 0.5724
 epoch: 71, train_loss: 0.7244, test_loss: 0.9244, test_f1: 0.5751
 epoch: 72, train_loss: 0.7500, test_loss: 0.9334, test_f1: 0.5779
 epoch: 73, train_loss: 0.7410, test_loss: 0.9447, test_f1: 0.5708
 epoch: 74, train_loss: 0.7469, test_loss: 0.9053, test_f1: 0.5963
 epoch: 75, train_loss: 0.7343, test_loss: 0.9161, test_f1: 0.5826
 epoch: 76, train_loss: 0.7374, test_loss: 0.9240, test_f1: 0.5908
 epoch: 77, train_loss: 0.7300, test_loss: 0.9327, test_f1: 0.5738
 epoch: 78, train_loss: 0.7329, test_loss: 0.9189, test_f1: 0.5775
 epoch: 79, train_loss: 0.7397, test_loss: 0.9469, test_f1: 0.5817
 epoch: 80, train_loss: 0.7324, test_loss: 0.9227, test_f1: 0.5864
 epoch: 81, train_loss: 0.7309, test_loss: 0.9539, test_f1: 0.5759
 epoch: 82, train_loss: 0.7271, test_loss: 0.9357, test_f1: 0.5900
 epoch: 83, train_loss: 0.7241, test_loss: 0.9198, test_f1: 0.5950
 epoch: 84, train_loss: 0.7354, test_loss: 0.9446, test_f1: 0.5855
 epoch: 85, train_loss: 0.7255, test_loss: 0.9388, test_f1: 0.5903
 epoch: 86, train_loss: 0.7229, test_loss: 0.9564, test_f1: 0.5839
 epoch: 87, train_loss: 0.7188, test_loss: 0.9322, test_f1: 0.5814
 epoch: 88, train_loss: 0.7210, test_loss: 0.9339, test_f1: 0.5896
 epoch: 89, train_loss: 0.7236, test_loss: 0.9351, test_f1: 0.5824
 epoch: 90, train_loss: 0.7100, test_loss: 0.9271, test_f1: 0.5953
 epoch: 91, train_loss: 0.7201, test_loss: 0.9287, test_f1: 0.6027
 epoch: 92, train_loss: 0.7139, test_loss: 0.9484, test_f1: 0.5908
 epoch: 93, train_loss: 0.7184, test_loss: 0.9356, test_f1: 0.5927
 epoch: 94, train_loss: 0.7086, test_loss: 0.9448, test_f1: 0.5897
 epoch: 95, train_loss: 0.7106, test_loss: 0.9145, test_f1: 0.5991
 epoch: 96, train_loss: 0.7161, test_loss: 0.9300, test_f1: 0.6157
 epoch: 97, train_loss: 0.7119, test_loss: 0.9419, test_f1: 0.5846
 epoch: 98, train_loss: 0.7059, test_loss: 0.9363, test_f1: 0.5980
 epoch: 99, train_loss: 0.7183, test_loss: 0.9441, test_f1: 0.5979
##################ITERATION #3 ****************************************
 epoch: 0, train_loss: 1.2642, test_loss: 1.2314, test_f1: 0.3603
 epoch: 1, train_loss: 1.1793, test_loss: 1.1262, test_f1: 0.4591
 epoch: 2, train_loss: 1.1505, test_loss: 1.0918, test_f1: 0.4528
 epoch: 3, train_loss: 1.1173, test_loss: 1.0658, test_f1: 0.4593
 epoch: 4, train_loss: 1.0966, test_loss: 1.0372, test_f1: 0.4694
 epoch: 5, train_loss: 1.0762, test_loss: 1.0092, test_f1: 0.4729
 epoch: 6, train_loss: 1.0537, test_loss: 1.0032, test_f1: 0.4787
 epoch: 7, train_loss: 1.0473, test_loss: 0.9841, test_f1: 0.4896
 epoch: 8, train_loss: 1.0196, test_loss: 0.9669, test_f1: 0.5126
 epoch: 9, train_loss: 1.0091, test_loss: 0.9694, test_f1: 0.5009
 epoch: 10, train_loss: 0.9906, test_loss: 0.9608, test_f1: 0.5076
 epoch: 11, train_loss: 0.9772, test_loss: 0.9333, test_f1: 0.5297
 epoch: 12, train_loss: 0.9695, test_loss: 0.9415, test_f1: 0.5179
 epoch: 13, train_loss: 0.9537, test_loss: 0.9412, test_f1: 0.5234
 epoch: 14, train_loss: 0.9404, test_loss: 0.9324, test_f1: 0.5231
 epoch: 15, train_loss: 0.9416, test_loss: 0.9516, test_f1: 0.5214
 epoch: 16, train_loss: 0.9320, test_loss: 0.9359, test_f1: 0.5333
 epoch: 17, train_loss: 0.9243, test_loss: 0.9390, test_f1: 0.5322
 epoch: 18, train_loss: 0.9123, test_loss: 0.9472, test_f1: 0.5257
 epoch: 19, train_loss: 0.9090, test_loss: 0.9445, test_f1: 0.5473
 epoch: 20, train_loss: 0.8962, test_loss: 0.9438, test_f1: 0.5423
 epoch: 21, train_loss: 0.8935, test_loss: 0.9522, test_f1: 0.5467
 epoch: 22, train_loss: 0.8898, test_loss: 0.9392, test_f1: 0.5382
 epoch: 23, train_loss: 0.8900, test_loss: 0.9307, test_f1: 0.5527
 epoch: 24, train_loss: 0.8812, test_loss: 0.9406, test_f1: 0.5441
 epoch: 25, train_loss: 0.8807, test_loss: 0.9590, test_f1: 0.5343
 epoch: 26, train_loss: 0.8647, test_loss: 0.9361, test_f1: 0.5631
 epoch: 27, train_loss: 0.8615, test_loss: 0.9582, test_f1: 0.5478
 epoch: 28, train_loss: 0.8506, test_loss: 0.9627, test_f1: 0.5584
 epoch: 29, train_loss: 0.8534, test_loss: 0.9522, test_f1: 0.5521
 epoch: 30, train_loss: 0.8546, test_loss: 0.9803, test_f1: 0.5574
 epoch: 31, train_loss: 0.8374, test_loss: 0.9355, test_f1: 0.5625
 epoch: 32, train_loss: 0.8445, test_loss: 0.9598, test_f1: 0.5699
 epoch: 33, train_loss: 0.8312, test_loss: 0.9398, test_f1: 0.5625
 epoch: 34, train_loss: 0.8347, test_loss: 0.9508, test_f1: 0.5793
 epoch: 35, train_loss: 0.8163, test_loss: 0.9555, test_f1: 0.5684
 epoch: 36, train_loss: 0.8163, test_loss: 0.9300, test_f1: 0.5775
 epoch: 37, train_loss: 0.8231, test_loss: 0.9757, test_f1: 0.5746
 epoch: 38, train_loss: 0.8201, test_loss: 0.9708, test_f1: 0.5699
 epoch: 39, train_loss: 0.8125, test_loss: 0.9807, test_f1: 0.5718
 epoch: 40, train_loss: 0.8072, test_loss: 0.9931, test_f1: 0.5678
 epoch: 41, train_loss: 0.8104, test_loss: 0.9986, test_f1: 0.5755
 epoch: 42, train_loss: 0.7960, test_loss: 0.9991, test_f1: 0.5719
 epoch: 43, train_loss: 0.8041, test_loss: 0.9877, test_f1: 0.5772
 epoch: 44, train_loss: 0.8005, test_loss: 0.9627, test_f1: 0.5687
 epoch: 45, train_loss: 0.7951, test_loss: 0.9677, test_f1: 0.5786
 epoch: 46, train_loss: 0.7826, test_loss: 0.9658, test_f1: 0.5774
 epoch: 47, train_loss: 0.7922, test_loss: 1.0002, test_f1: 0.5561
 epoch: 48, train_loss: 0.7894, test_loss: 0.9835, test_f1: 0.5744
 epoch: 49, train_loss: 0.7819, test_loss: 0.9865, test_f1: 0.5815
 epoch: 50, train_loss: 0.7688, test_loss: 1.0187, test_f1: 0.5618
 epoch: 51, train_loss: 0.7619, test_loss: 1.0108, test_f1: 0.5648
 epoch: 52, train_loss: 0.7696, test_loss: 1.0129, test_f1: 0.5654
 epoch: 53, train_loss: 0.7651, test_loss: 1.0192, test_f1: 0.5787
 epoch: 54, train_loss: 0.7589, test_loss: 1.0144, test_f1: 0.5806
 epoch: 55, train_loss: 0.7640, test_loss: 1.0071, test_f1: 0.5674
 epoch: 56, train_loss: 0.7461, test_loss: 1.0054, test_f1: 0.5692
 epoch: 57, train_loss: 0.7595, test_loss: 1.0051, test_f1: 0.5785
 epoch: 58, train_loss: 0.7483, test_loss: 1.0128, test_f1: 0.5884
 epoch: 59, train_loss: 0.7455, test_loss: 1.0192, test_f1: 0.5783
 epoch: 60, train_loss: 0.7614, test_loss: 1.0077, test_f1: 0.5756
 epoch: 61, train_loss: 0.7503, test_loss: 1.0029, test_f1: 0.5686
 epoch: 62, train_loss: 0.7489, test_loss: 1.0274, test_f1: 0.5722
 epoch: 63, train_loss: 0.7434, test_loss: 1.0214, test_f1: 0.5623
 epoch: 64, train_loss: 0.7390, test_loss: 1.0147, test_f1: 0.5704
 epoch: 65, train_loss: 0.7369, test_loss: 1.0264, test_f1: 0.5751
 epoch: 66, train_loss: 0.7427, test_loss: 1.0309, test_f1: 0.5636
 epoch: 67, train_loss: 0.7349, test_loss: 1.0273, test_f1: 0.5496
 epoch: 68, train_loss: 0.7447, test_loss: 1.0151, test_f1: 0.5565
 epoch: 69, train_loss: 0.7356, test_loss: 1.0222, test_f1: 0.5624
 epoch: 70, train_loss: 0.7326, test_loss: 1.0307, test_f1: 0.5544
 epoch: 71, train_loss: 0.7315, test_loss: 1.0154, test_f1: 0.5631
 epoch: 72, train_loss: 0.7214, test_loss: 1.0249, test_f1: 0.5593
 epoch: 73, train_loss: 0.7153, test_loss: 1.0571, test_f1: 0.5657
 epoch: 74, train_loss: 0.7238, test_loss: 1.0215, test_f1: 0.5815
 epoch: 75, train_loss: 0.7220, test_loss: 1.0201, test_f1: 0.5675
 epoch: 76, train_loss: 0.7314, test_loss: 1.0576, test_f1: 0.5646
 epoch: 77, train_loss: 0.7257, test_loss: 1.0359, test_f1: 0.5574
 epoch: 78, train_loss: 0.7210, test_loss: 1.0335, test_f1: 0.5660
 epoch: 79, train_loss: 0.7158, test_loss: 1.0349, test_f1: 0.5526
 epoch: 80, train_loss: 0.7136, test_loss: 1.0431, test_f1: 0.5727
 epoch: 81, train_loss: 0.7103, test_loss: 1.0204, test_f1: 0.5630
 epoch: 82, train_loss: 0.7114, test_loss: 1.0299, test_f1: 0.5670
 epoch: 83, train_loss: 0.7133, test_loss: 1.0445, test_f1: 0.5798
 epoch: 84, train_loss: 0.7086, test_loss: 1.0464, test_f1: 0.5658
 epoch: 85, train_loss: 0.7075, test_loss: 1.0560, test_f1: 0.5657
 epoch: 86, train_loss: 0.7030, test_loss: 1.0428, test_f1: 0.5468
 epoch: 87, train_loss: 0.7125, test_loss: 1.0599, test_f1: 0.5631
 epoch: 88, train_loss: 0.7081, test_loss: 1.0679, test_f1: 0.5500
 epoch: 89, train_loss: 0.7076, test_loss: 1.0379, test_f1: 0.5630
 epoch: 90, train_loss: 0.7022, test_loss: 1.0273, test_f1: 0.5593
 epoch: 91, train_loss: 0.7066, test_loss: 1.0348, test_f1: 0.5525
 epoch: 92, train_loss: 0.6947, test_loss: 1.0502, test_f1: 0.5660
 epoch: 93, train_loss: 0.6978, test_loss: 1.0372, test_f1: 0.5712
 epoch: 94, train_loss: 0.6897, test_loss: 1.0232, test_f1: 0.5713
 epoch: 95, train_loss: 0.6841, test_loss: 1.0383, test_f1: 0.5717
 epoch: 96, train_loss: 0.7000, test_loss: 1.0485, test_f1: 0.5594
 epoch: 97, train_loss: 0.6971, test_loss: 1.0496, test_f1: 0.5688
 epoch: 98, train_loss: 0.6985, test_loss: 1.0499, test_f1: 0.5682
 epoch: 99, train_loss: 0.6938, test_loss: 1.0557, test_f1: 0.5594
##################ITERATION #4 ****************************************
 epoch: 0, train_loss: 1.2570, test_loss: 1.2928, test_f1: 0.2789
 epoch: 1, train_loss: 1.1672, test_loss: 1.1083, test_f1: 0.4347
 epoch: 2, train_loss: 1.1324, test_loss: 1.0692, test_f1: 0.4684
 epoch: 3, train_loss: 1.1077, test_loss: 1.0424, test_f1: 0.4598
 epoch: 4, train_loss: 1.0950, test_loss: 1.0273, test_f1: 0.4682
 epoch: 5, train_loss: 1.0651, test_loss: 1.0025, test_f1: 0.4817
 epoch: 6, train_loss: 1.0489, test_loss: 0.9894, test_f1: 0.4883
 epoch: 7, train_loss: 1.0382, test_loss: 0.9576, test_f1: 0.4987
 epoch: 8, train_loss: 1.0313, test_loss: 0.9600, test_f1: 0.4999
 epoch: 9, train_loss: 1.0023, test_loss: 0.9541, test_f1: 0.5017
 epoch: 10, train_loss: 0.9921, test_loss: 0.9512, test_f1: 0.4999
 epoch: 11, train_loss: 0.9849, test_loss: 0.9445, test_f1: 0.5041
 epoch: 12, train_loss: 0.9716, test_loss: 0.9420, test_f1: 0.5115
 epoch: 13, train_loss: 0.9591, test_loss: 0.9462, test_f1: 0.5190
 epoch: 14, train_loss: 0.9585, test_loss: 0.9486, test_f1: 0.5346
 epoch: 15, train_loss: 0.9565, test_loss: 0.9294, test_f1: 0.5205
 epoch: 16, train_loss: 0.9533, test_loss: 0.9257, test_f1: 0.5102
 epoch: 17, train_loss: 0.9243, test_loss: 0.9422, test_f1: 0.5262
 epoch: 18, train_loss: 0.9291, test_loss: 0.9194, test_f1: 0.5081
 epoch: 19, train_loss: 0.9202, test_loss: 0.9324, test_f1: 0.5394
 epoch: 20, train_loss: 0.9201, test_loss: 0.9216, test_f1: 0.5248
 epoch: 21, train_loss: 0.9177, test_loss: 0.9302, test_f1: 0.5337
 epoch: 22, train_loss: 0.9084, test_loss: 0.9363, test_f1: 0.5258
 epoch: 23, train_loss: 0.9055, test_loss: 0.9450, test_f1: 0.5454
 epoch: 24, train_loss: 0.8944, test_loss: 0.9320, test_f1: 0.5340
 epoch: 25, train_loss: 0.8939, test_loss: 0.9270, test_f1: 0.5183
 epoch: 26, train_loss: 0.8866, test_loss: 0.9022, test_f1: 0.5368
 epoch: 27, train_loss: 0.8789, test_loss: 0.9317, test_f1: 0.5353
 epoch: 28, train_loss: 0.8700, test_loss: 0.9340, test_f1: 0.5574
 epoch: 29, train_loss: 0.8678, test_loss: 0.9297, test_f1: 0.5548
 epoch: 30, train_loss: 0.8601, test_loss: 0.9345, test_f1: 0.5365
 epoch: 31, train_loss: 0.8632, test_loss: 0.9353, test_f1: 0.5424
 epoch: 32, train_loss: 0.8505, test_loss: 0.9211, test_f1: 0.5663
 epoch: 33, train_loss: 0.8591, test_loss: 0.9312, test_f1: 0.5669
 epoch: 34, train_loss: 0.8483, test_loss: 0.9519, test_f1: 0.5554
 epoch: 35, train_loss: 0.8431, test_loss: 0.9349, test_f1: 0.5619
 epoch: 36, train_loss: 0.8434, test_loss: 0.9537, test_f1: 0.5696
 epoch: 37, train_loss: 0.8344, test_loss: 0.9505, test_f1: 0.5582
 epoch: 38, train_loss: 0.8275, test_loss: 0.9565, test_f1: 0.5586
 epoch: 39, train_loss: 0.8332, test_loss: 0.9715, test_f1: 0.5519
 epoch: 40, train_loss: 0.8188, test_loss: 0.9549, test_f1: 0.5529
 epoch: 41, train_loss: 0.8218, test_loss: 0.9778, test_f1: 0.5423
 epoch: 42, train_loss: 0.8281, test_loss: 0.9234, test_f1: 0.5776
 epoch: 43, train_loss: 0.8181, test_loss: 0.9576, test_f1: 0.5722
 epoch: 44, train_loss: 0.8098, test_loss: 0.9627, test_f1: 0.5583
 epoch: 45, train_loss: 0.8051, test_loss: 0.9490, test_f1: 0.5788
 epoch: 46, train_loss: 0.8007, test_loss: 0.9539, test_f1: 0.5584
 epoch: 47, train_loss: 0.8079, test_loss: 0.9733, test_f1: 0.5806
 epoch: 48, train_loss: 0.7979, test_loss: 0.9597, test_f1: 0.5758
 epoch: 49, train_loss: 0.7911, test_loss: 0.9660, test_f1: 0.5723
 epoch: 50, train_loss: 0.7934, test_loss: 0.9719, test_f1: 0.5783
 epoch: 51, train_loss: 0.7818, test_loss: 0.9854, test_f1: 0.5773
 epoch: 52, train_loss: 0.7760, test_loss: 0.9662, test_f1: 0.5761
 epoch: 53, train_loss: 0.7722, test_loss: 0.9716, test_f1: 0.5786
 epoch: 54, train_loss: 0.7723, test_loss: 0.9701, test_f1: 0.5846
 epoch: 55, train_loss: 0.7780, test_loss: 0.9869, test_f1: 0.5716
 epoch: 56, train_loss: 0.7718, test_loss: 0.9659, test_f1: 0.5806
 epoch: 57, train_loss: 0.7695, test_loss: 0.9742, test_f1: 0.5620
 epoch: 58, train_loss: 0.7719, test_loss: 0.9551, test_f1: 0.5678
 epoch: 59, train_loss: 0.7697, test_loss: 0.9660, test_f1: 0.5786
 epoch: 60, train_loss: 0.7611, test_loss: 0.9920, test_f1: 0.5649
 epoch: 61, train_loss: 0.7644, test_loss: 0.9754, test_f1: 0.5851
 epoch: 62, train_loss: 0.7598, test_loss: 0.9613, test_f1: 0.5784
 epoch: 63, train_loss: 0.7570, test_loss: 0.9902, test_f1: 0.5734
 epoch: 64, train_loss: 0.7616, test_loss: 0.9819, test_f1: 0.5759
 epoch: 65, train_loss: 0.7525, test_loss: 0.9820, test_f1: 0.5782
 epoch: 66, train_loss: 0.7568, test_loss: 0.9667, test_f1: 0.5838
 epoch: 67, train_loss: 0.7522, test_loss: 0.9804, test_f1: 0.5760
 epoch: 68, train_loss: 0.7549, test_loss: 0.9760, test_f1: 0.5665
 epoch: 69, train_loss: 0.7566, test_loss: 0.9923, test_f1: 0.5835
 epoch: 70, train_loss: 0.7557, test_loss: 0.9817, test_f1: 0.5827
 epoch: 71, train_loss: 0.7434, test_loss: 1.0064, test_f1: 0.5683
 epoch: 72, train_loss: 0.7496, test_loss: 0.9870, test_f1: 0.5775
 epoch: 73, train_loss: 0.7459, test_loss: 0.9767, test_f1: 0.5706
 epoch: 74, train_loss: 0.7377, test_loss: 0.9912, test_f1: 0.5740
 epoch: 75, train_loss: 0.7346, test_loss: 0.9814, test_f1: 0.5740
 epoch: 76, train_loss: 0.7442, test_loss: 0.9914, test_f1: 0.5809
 epoch: 77, train_loss: 0.7518, test_loss: 0.9910, test_f1: 0.5827
 epoch: 78, train_loss: 0.7383, test_loss: 0.9854, test_f1: 0.5820
 epoch: 79, train_loss: 0.7442, test_loss: 0.9774, test_f1: 0.5637
 epoch: 80, train_loss: 0.7472, test_loss: 0.9931, test_f1: 0.5584
 epoch: 81, train_loss: 0.7321, test_loss: 0.9848, test_f1: 0.5968
 epoch: 82, train_loss: 0.7349, test_loss: 0.9878, test_f1: 0.5840
 epoch: 83, train_loss: 0.7238, test_loss: 0.9915, test_f1: 0.5768
 epoch: 84, train_loss: 0.7230, test_loss: 0.9849, test_f1: 0.5727
 epoch: 85, train_loss: 0.7348, test_loss: 0.9971, test_f1: 0.5839
 epoch: 86, train_loss: 0.7265, test_loss: 1.0013, test_f1: 0.5859
 epoch: 87, train_loss: 0.7270, test_loss: 0.9883, test_f1: 0.5874
 epoch: 88, train_loss: 0.7160, test_loss: 0.9898, test_f1: 0.6015
 epoch: 89, train_loss: 0.7166, test_loss: 0.9849, test_f1: 0.5976
 epoch: 90, train_loss: 0.7260, test_loss: 1.0161, test_f1: 0.5919
 epoch: 91, train_loss: 0.7155, test_loss: 0.9979, test_f1: 0.5891
 epoch: 92, train_loss: 0.7152, test_loss: 0.9874, test_f1: 0.5960
 epoch: 93, train_loss: 0.7236, test_loss: 0.9972, test_f1: 0.5924
 epoch: 94, train_loss: 0.7228, test_loss: 1.0104, test_f1: 0.5771
 epoch: 95, train_loss: 0.7217, test_loss: 1.0000, test_f1: 0.5860
 epoch: 96, train_loss: 0.7105, test_loss: 1.0015, test_f1: 0.5786
 epoch: 97, train_loss: 0.7121, test_loss: 1.0003, test_f1: 0.5776
 epoch: 98, train_loss: 0.7194, test_loss: 0.9945, test_f1: 0.5905
 epoch: 99, train_loss: 0.7065, test_loss: 1.0033, test_f1: 0.5819
##################ITERATION #5 ****************************************
 epoch: 0, train_loss: 1.2485, test_loss: 1.2005, test_f1: 0.4221
 epoch: 1, train_loss: 1.1540, test_loss: 1.0830, test_f1: 0.4705
 epoch: 2, train_loss: 1.1229, test_loss: 1.0306, test_f1: 0.4914
 epoch: 3, train_loss: 1.0929, test_loss: 1.0070, test_f1: 0.4908
 epoch: 4, train_loss: 1.0619, test_loss: 0.9739, test_f1: 0.5139
 epoch: 5, train_loss: 1.0420, test_loss: 0.9636, test_f1: 0.5050
 epoch: 6, train_loss: 1.0185, test_loss: 0.9483, test_f1: 0.5071
 epoch: 7, train_loss: 1.0176, test_loss: 0.9415, test_f1: 0.5143
 epoch: 8, train_loss: 0.9993, test_loss: 0.9240, test_f1: 0.5115
 epoch: 9, train_loss: 0.9814, test_loss: 0.9116, test_f1: 0.5097
 epoch: 10, train_loss: 0.9745, test_loss: 0.9118, test_f1: 0.5093
 epoch: 11, train_loss: 0.9745, test_loss: 0.9012, test_f1: 0.5188
 epoch: 12, train_loss: 0.9591, test_loss: 0.8996, test_f1: 0.5234
 epoch: 13, train_loss: 0.9485, test_loss: 0.9002, test_f1: 0.5141
 epoch: 14, train_loss: 0.9319, test_loss: 0.9020, test_f1: 0.5403
 epoch: 15, train_loss: 0.9223, test_loss: 0.8912, test_f1: 0.5291
 epoch: 16, train_loss: 0.9277, test_loss: 0.8931, test_f1: 0.5326
 epoch: 17, train_loss: 0.9085, test_loss: 0.8859, test_f1: 0.5331
 epoch: 18, train_loss: 0.9101, test_loss: 0.8862, test_f1: 0.5424
 epoch: 19, train_loss: 0.9104, test_loss: 0.8878, test_f1: 0.5314
 epoch: 20, train_loss: 0.8912, test_loss: 0.8840, test_f1: 0.5483
 epoch: 21, train_loss: 0.8891, test_loss: 0.8897, test_f1: 0.5529
 epoch: 22, train_loss: 0.8866, test_loss: 0.8900, test_f1: 0.5466
 epoch: 23, train_loss: 0.8785, test_loss: 0.8857, test_f1: 0.5494
 epoch: 24, train_loss: 0.8720, test_loss: 0.8839, test_f1: 0.5515
 epoch: 25, train_loss: 0.8747, test_loss: 0.8966, test_f1: 0.5594
 epoch: 26, train_loss: 0.8729, test_loss: 0.8924, test_f1: 0.5482
 epoch: 27, train_loss: 0.8632, test_loss: 0.9071, test_f1: 0.5552
 epoch: 28, train_loss: 0.8575, test_loss: 0.8971, test_f1: 0.5615
 epoch: 29, train_loss: 0.8536, test_loss: 0.8853, test_f1: 0.5682
 epoch: 30, train_loss: 0.8516, test_loss: 0.8811, test_f1: 0.5672
 epoch: 31, train_loss: 0.8416, test_loss: 0.8953, test_f1: 0.5663
 epoch: 32, train_loss: 0.8390, test_loss: 0.8898, test_f1: 0.5603
 epoch: 33, train_loss: 0.8355, test_loss: 0.8869, test_f1: 0.5634
 epoch: 34, train_loss: 0.8337, test_loss: 0.8814, test_f1: 0.5627
 epoch: 35, train_loss: 0.8214, test_loss: 0.8875, test_f1: 0.5796
 epoch: 36, train_loss: 0.8266, test_loss: 0.8940, test_f1: 0.5956
 epoch: 37, train_loss: 0.8279, test_loss: 0.8651, test_f1: 0.5902
 epoch: 38, train_loss: 0.8120, test_loss: 0.8605, test_f1: 0.5969
 epoch: 39, train_loss: 0.8109, test_loss: 0.8755, test_f1: 0.5790
 epoch: 40, train_loss: 0.8026, test_loss: 0.8815, test_f1: 0.5905
 epoch: 41, train_loss: 0.8019, test_loss: 0.8962, test_f1: 0.5768
 epoch: 42, train_loss: 0.7997, test_loss: 0.8960, test_f1: 0.5949
 epoch: 43, train_loss: 0.7901, test_loss: 0.8912, test_f1: 0.5843
 epoch: 44, train_loss: 0.7940, test_loss: 0.8795, test_f1: 0.5989
 epoch: 45, train_loss: 0.7961, test_loss: 0.8791, test_f1: 0.5973
 epoch: 46, train_loss: 0.7931, test_loss: 0.8999, test_f1: 0.5907
 epoch: 47, train_loss: 0.7881, test_loss: 0.8827, test_f1: 0.5936
 epoch: 48, train_loss: 0.7768, test_loss: 0.8867, test_f1: 0.6008
 epoch: 49, train_loss: 0.7836, test_loss: 0.9008, test_f1: 0.5946
 epoch: 50, train_loss: 0.7688, test_loss: 0.8937, test_f1: 0.5988
 epoch: 51, train_loss: 0.7671, test_loss: 0.8933, test_f1: 0.5913
 epoch: 52, train_loss: 0.7636, test_loss: 0.8901, test_f1: 0.5820
 epoch: 53, train_loss: 0.7534, test_loss: 0.8855, test_f1: 0.5976
 epoch: 54, train_loss: 0.7587, test_loss: 0.8874, test_f1: 0.5865
 epoch: 55, train_loss: 0.7478, test_loss: 0.8882, test_f1: 0.5877
 epoch: 56, train_loss: 0.7396, test_loss: 0.8991, test_f1: 0.5945
 epoch: 57, train_loss: 0.7575, test_loss: 0.8825, test_f1: 0.6035
 epoch: 58, train_loss: 0.7453, test_loss: 0.8854, test_f1: 0.6007
 epoch: 59, train_loss: 0.7481, test_loss: 0.8907, test_f1: 0.5921
 epoch: 60, train_loss: 0.7531, test_loss: 0.8836, test_f1: 0.6041
 epoch: 61, train_loss: 0.7356, test_loss: 0.8945, test_f1: 0.5987
 epoch: 62, train_loss: 0.7413, test_loss: 0.8854, test_f1: 0.6043
 epoch: 63, train_loss: 0.7499, test_loss: 0.8759, test_f1: 0.6065
 epoch: 64, train_loss: 0.7357, test_loss: 0.8780, test_f1: 0.6056
 epoch: 65, train_loss: 0.7347, test_loss: 0.8756, test_f1: 0.6084
 epoch: 66, train_loss: 0.7309, test_loss: 0.8988, test_f1: 0.6016
 epoch: 67, train_loss: 0.7302, test_loss: 0.8867, test_f1: 0.6154
 epoch: 68, train_loss: 0.7266, test_loss: 0.8973, test_f1: 0.6039
 epoch: 69, train_loss: 0.7323, test_loss: 0.8768, test_f1: 0.6113
 epoch: 70, train_loss: 0.7264, test_loss: 0.8864, test_f1: 0.5972
 epoch: 71, train_loss: 0.7122, test_loss: 0.8898, test_f1: 0.6136
 epoch: 72, train_loss: 0.7204, test_loss: 0.8927, test_f1: 0.6075
 epoch: 73, train_loss: 0.7155, test_loss: 0.8928, test_f1: 0.6088
 epoch: 74, train_loss: 0.7210, test_loss: 0.8912, test_f1: 0.6063
 epoch: 75, train_loss: 0.7123, test_loss: 0.8838, test_f1: 0.6106
 epoch: 76, train_loss: 0.7148, test_loss: 0.8745, test_f1: 0.6089
 epoch: 77, train_loss: 0.7107, test_loss: 0.8854, test_f1: 0.6154
 epoch: 78, train_loss: 0.7206, test_loss: 0.8990, test_f1: 0.6112
 epoch: 79, train_loss: 0.7130, test_loss: 0.8819, test_f1: 0.6221
 epoch: 80, train_loss: 0.7125, test_loss: 0.9021, test_f1: 0.6086
 epoch: 81, train_loss: 0.7181, test_loss: 0.8709, test_f1: 0.6089
 epoch: 82, train_loss: 0.7001, test_loss: 0.8808, test_f1: 0.6146
 epoch: 83, train_loss: 0.7141, test_loss: 0.8905, test_f1: 0.6146
 epoch: 84, train_loss: 0.7057, test_loss: 0.8905, test_f1: 0.6150
 epoch: 85, train_loss: 0.6987, test_loss: 0.8994, test_f1: 0.6156
 epoch: 86, train_loss: 0.6935, test_loss: 0.8722, test_f1: 0.6306
 epoch: 87, train_loss: 0.6980, test_loss: 0.8825, test_f1: 0.6044
 epoch: 88, train_loss: 0.7019, test_loss: 0.8979, test_f1: 0.6265
 epoch: 89, train_loss: 0.6839, test_loss: 0.8946, test_f1: 0.6032
 epoch: 90, train_loss: 0.7007, test_loss: 0.8805, test_f1: 0.6164
 epoch: 91, train_loss: 0.6921, test_loss: 0.8897, test_f1: 0.6023
 epoch: 92, train_loss: 0.7037, test_loss: 0.8702, test_f1: 0.6218
 epoch: 93, train_loss: 0.6887, test_loss: 0.8967, test_f1: 0.6034
 epoch: 94, train_loss: 0.6860, test_loss: 0.9142, test_f1: 0.6061
 epoch: 95, train_loss: 0.6936, test_loss: 0.9027, test_f1: 0.6147
 epoch: 96, train_loss: 0.6862, test_loss: 0.9094, test_f1: 0.5992
 epoch: 97, train_loss: 0.6810, test_loss: 0.9186, test_f1: 0.6017
 epoch: 98, train_loss: 0.6799, test_loss: 0.9024, test_f1: 0.6036
 epoch: 99, train_loss: 0.6946, test_loss: 0.8994, test_f1: 0.6121
##################ITERATION #6 ****************************************
 epoch: 0, train_loss: 1.2525, test_loss: 1.1831, test_f1: 0.3568
 epoch: 1, train_loss: 1.1646, test_loss: 1.1045, test_f1: 0.4083
 epoch: 2, train_loss: 1.1325, test_loss: 1.0838, test_f1: 0.4369
 epoch: 3, train_loss: 1.1236, test_loss: 1.0492, test_f1: 0.4388
 epoch: 4, train_loss: 1.0914, test_loss: 1.0380, test_f1: 0.4323
 epoch: 5, train_loss: 1.0877, test_loss: 1.0197, test_f1: 0.4305
 epoch: 6, train_loss: 1.0652, test_loss: 0.9936, test_f1: 0.4418
 epoch: 7, train_loss: 1.0468, test_loss: 0.9882, test_f1: 0.4631
 epoch: 8, train_loss: 1.0361, test_loss: 0.9671, test_f1: 0.4570
 epoch: 9, train_loss: 1.0215, test_loss: 0.9751, test_f1: 0.4599
 epoch: 10, train_loss: 1.0128, test_loss: 0.9585, test_f1: 0.4669
 epoch: 11, train_loss: 1.0091, test_loss: 0.9446, test_f1: 0.4884
 epoch: 12, train_loss: 0.9908, test_loss: 0.9413, test_f1: 0.4880
 epoch: 13, train_loss: 0.9903, test_loss: 0.9472, test_f1: 0.4799
 epoch: 14, train_loss: 0.9838, test_loss: 0.9451, test_f1: 0.4835
 epoch: 15, train_loss: 0.9709, test_loss: 0.9483, test_f1: 0.5083
 epoch: 16, train_loss: 0.9618, test_loss: 0.9347, test_f1: 0.5085
 epoch: 17, train_loss: 0.9471, test_loss: 0.9279, test_f1: 0.5257
 epoch: 18, train_loss: 0.9428, test_loss: 0.9266, test_f1: 0.5268
 epoch: 19, train_loss: 0.9409, test_loss: 0.9273, test_f1: 0.5091
 epoch: 20, train_loss: 0.9235, test_loss: 0.9377, test_f1: 0.5105
 epoch: 21, train_loss: 0.9286, test_loss: 0.9401, test_f1: 0.5118
 epoch: 22, train_loss: 0.9245, test_loss: 0.9345, test_f1: 0.5147
 epoch: 23, train_loss: 0.9093, test_loss: 0.9269, test_f1: 0.5317
 epoch: 24, train_loss: 0.9141, test_loss: 0.9205, test_f1: 0.5449
 epoch: 25, train_loss: 0.9038, test_loss: 0.9188, test_f1: 0.5341
 epoch: 26, train_loss: 0.8931, test_loss: 0.9214, test_f1: 0.5335
 epoch: 27, train_loss: 0.8814, test_loss: 0.9248, test_f1: 0.5313
 epoch: 28, train_loss: 0.8861, test_loss: 0.9337, test_f1: 0.5558
 epoch: 29, train_loss: 0.8779, test_loss: 0.9065, test_f1: 0.5552
 epoch: 30, train_loss: 0.8725, test_loss: 0.9225, test_f1: 0.5473
 epoch: 31, train_loss: 0.8687, test_loss: 0.9282, test_f1: 0.5537
 epoch: 32, train_loss: 0.8690, test_loss: 0.9171, test_f1: 0.5434
 epoch: 33, train_loss: 0.8555, test_loss: 0.9265, test_f1: 0.5638
 epoch: 34, train_loss: 0.8587, test_loss: 0.9151, test_f1: 0.5506
 epoch: 35, train_loss: 0.8458, test_loss: 0.9145, test_f1: 0.5465
 epoch: 36, train_loss: 0.8424, test_loss: 0.9279, test_f1: 0.5511
 epoch: 37, train_loss: 0.8451, test_loss: 0.9243, test_f1: 0.5616
 epoch: 38, train_loss: 0.8544, test_loss: 0.9174, test_f1: 0.5408
 epoch: 39, train_loss: 0.8418, test_loss: 0.9089, test_f1: 0.5689
 epoch: 40, train_loss: 0.8289, test_loss: 0.9259, test_f1: 0.5660
 epoch: 41, train_loss: 0.8297, test_loss: 0.9181, test_f1: 0.5667
 epoch: 42, train_loss: 0.8223, test_loss: 0.9176, test_f1: 0.5780
 epoch: 43, train_loss: 0.8174, test_loss: 0.9351, test_f1: 0.5758
 epoch: 44, train_loss: 0.8255, test_loss: 0.9407, test_f1: 0.5676
 epoch: 45, train_loss: 0.8180, test_loss: 0.9411, test_f1: 0.5619
 epoch: 46, train_loss: 0.8071, test_loss: 0.9239, test_f1: 0.5853
 epoch: 47, train_loss: 0.8057, test_loss: 0.9372, test_f1: 0.5898
 epoch: 48, train_loss: 0.8072, test_loss: 0.9307, test_f1: 0.5939
 epoch: 49, train_loss: 0.8053, test_loss: 0.9221, test_f1: 0.5898
 epoch: 50, train_loss: 0.7925, test_loss: 0.9440, test_f1: 0.5910
 epoch: 51, train_loss: 0.7901, test_loss: 0.9451, test_f1: 0.6083
 epoch: 52, train_loss: 0.7974, test_loss: 0.9317, test_f1: 0.5968
 epoch: 53, train_loss: 0.7761, test_loss: 0.9355, test_f1: 0.5938
 epoch: 54, train_loss: 0.7901, test_loss: 0.9267, test_f1: 0.5989
 epoch: 55, train_loss: 0.7823, test_loss: 0.9231, test_f1: 0.5859
 epoch: 56, train_loss: 0.7862, test_loss: 0.9348, test_f1: 0.5747
 epoch: 57, train_loss: 0.7823, test_loss: 0.9394, test_f1: 0.5819
 epoch: 58, train_loss: 0.7652, test_loss: 0.9354, test_f1: 0.5744
 epoch: 59, train_loss: 0.7720, test_loss: 0.9280, test_f1: 0.5715
 epoch: 60, train_loss: 0.7688, test_loss: 0.9424, test_f1: 0.5835
 epoch: 61, train_loss: 0.7573, test_loss: 0.9332, test_f1: 0.5864
 epoch: 62, train_loss: 0.7679, test_loss: 0.9391, test_f1: 0.5775
 epoch: 63, train_loss: 0.7719, test_loss: 0.9459, test_f1: 0.5890
 epoch: 64, train_loss: 0.7592, test_loss: 0.9302, test_f1: 0.5994
 epoch: 65, train_loss: 0.7572, test_loss: 0.9419, test_f1: 0.5958
 epoch: 66, train_loss: 0.7530, test_loss: 0.9321, test_f1: 0.5933
 epoch: 67, train_loss: 0.7649, test_loss: 0.9418, test_f1: 0.5747
 epoch: 68, train_loss: 0.7696, test_loss: 0.9412, test_f1: 0.5887
 epoch: 69, train_loss: 0.7574, test_loss: 0.9549, test_f1: 0.5843
 epoch: 70, train_loss: 0.7493, test_loss: 0.9458, test_f1: 0.5840
 epoch: 71, train_loss: 0.7538, test_loss: 0.9235, test_f1: 0.5771
 epoch: 72, train_loss: 0.7530, test_loss: 0.9435, test_f1: 0.5875
 epoch: 73, train_loss: 0.7496, test_loss: 0.9423, test_f1: 0.5847
 epoch: 74, train_loss: 0.7409, test_loss: 0.9349, test_f1: 0.5970
 epoch: 75, train_loss: 0.7519, test_loss: 0.9444, test_f1: 0.5930
 epoch: 76, train_loss: 0.7423, test_loss: 0.9385, test_f1: 0.5993
 epoch: 77, train_loss: 0.7417, test_loss: 0.9557, test_f1: 0.6048
 epoch: 78, train_loss: 0.7496, test_loss: 0.9419, test_f1: 0.5855
 epoch: 79, train_loss: 0.7463, test_loss: 0.9408, test_f1: 0.5848
 epoch: 80, train_loss: 0.7294, test_loss: 0.9442, test_f1: 0.6027
 epoch: 81, train_loss: 0.7283, test_loss: 0.9416, test_f1: 0.6052
 epoch: 82, train_loss: 0.7316, test_loss: 0.9507, test_f1: 0.5921
 epoch: 83, train_loss: 0.7267, test_loss: 0.9560, test_f1: 0.5864
 epoch: 84, train_loss: 0.7359, test_loss: 0.9602, test_f1: 0.5902
 epoch: 85, train_loss: 0.7280, test_loss: 0.9443, test_f1: 0.5858
 epoch: 86, train_loss: 0.7268, test_loss: 0.9521, test_f1: 0.5937
 epoch: 87, train_loss: 0.7189, test_loss: 0.9364, test_f1: 0.5922
 epoch: 88, train_loss: 0.7259, test_loss: 0.9522, test_f1: 0.5781
 epoch: 89, train_loss: 0.7299, test_loss: 0.9455, test_f1: 0.5886
 epoch: 90, train_loss: 0.7200, test_loss: 0.9707, test_f1: 0.6023
 epoch: 91, train_loss: 0.7268, test_loss: 0.9626, test_f1: 0.6043
 epoch: 92, train_loss: 0.7108, test_loss: 0.9665, test_f1: 0.6009
 epoch: 93, train_loss: 0.7310, test_loss: 0.9597, test_f1: 0.6031
 epoch: 94, train_loss: 0.7180, test_loss: 0.9561, test_f1: 0.5947
 epoch: 95, train_loss: 0.7032, test_loss: 0.9479, test_f1: 0.5987
 epoch: 96, train_loss: 0.6991, test_loss: 0.9362, test_f1: 0.6255
 epoch: 97, train_loss: 0.7244, test_loss: 0.9436, test_f1: 0.6018
 epoch: 98, train_loss: 0.7110, test_loss: 0.9489, test_f1: 0.6043
 epoch: 99, train_loss: 0.7069, test_loss: 0.9518, test_f1: 0.5921
##################ITERATION #7 ****************************************
 epoch: 0, train_loss: 1.3098, test_loss: 1.1839, test_f1: 0.3210
 epoch: 1, train_loss: 1.1777, test_loss: 1.0846, test_f1: 0.4585
 epoch: 2, train_loss: 1.1566, test_loss: 1.0505, test_f1: 0.4916
 epoch: 3, train_loss: 1.1209, test_loss: 1.0364, test_f1: 0.4730
 epoch: 4, train_loss: 1.0941, test_loss: 1.0132, test_f1: 0.4798
 epoch: 5, train_loss: 1.0680, test_loss: 0.9930, test_f1: 0.4778
 epoch: 6, train_loss: 1.0442, test_loss: 0.9838, test_f1: 0.5054
 epoch: 7, train_loss: 1.0303, test_loss: 0.9704, test_f1: 0.5017
 epoch: 8, train_loss: 1.0193, test_loss: 0.9552, test_f1: 0.5245
 epoch: 9, train_loss: 1.0067, test_loss: 0.9844, test_f1: 0.5077
 epoch: 10, train_loss: 0.9937, test_loss: 0.9582, test_f1: 0.5453
 epoch: 11, train_loss: 0.9805, test_loss: 0.9524, test_f1: 0.5254
 epoch: 12, train_loss: 0.9646, test_loss: 0.9408, test_f1: 0.5254
 epoch: 13, train_loss: 0.9557, test_loss: 0.9380, test_f1: 0.5301
 epoch: 14, train_loss: 0.9569, test_loss: 0.9335, test_f1: 0.5286
 epoch: 15, train_loss: 0.9370, test_loss: 0.9253, test_f1: 0.5430
 epoch: 16, train_loss: 0.9323, test_loss: 0.9335, test_f1: 0.5092
 epoch: 17, train_loss: 0.9261, test_loss: 0.9388, test_f1: 0.5298
 epoch: 18, train_loss: 0.9143, test_loss: 0.9299, test_f1: 0.5313
 epoch: 19, train_loss: 0.9206, test_loss: 0.9196, test_f1: 0.5252
 epoch: 20, train_loss: 0.9122, test_loss: 0.9288, test_f1: 0.5122
 epoch: 21, train_loss: 0.8939, test_loss: 0.9639, test_f1: 0.5160
 epoch: 22, train_loss: 0.8920, test_loss: 0.9441, test_f1: 0.5417
 epoch: 23, train_loss: 0.8907, test_loss: 0.9236, test_f1: 0.5592
 epoch: 24, train_loss: 0.8782, test_loss: 0.9175, test_f1: 0.5432
 epoch: 25, train_loss: 0.8773, test_loss: 0.9261, test_f1: 0.5422
 epoch: 26, train_loss: 0.8835, test_loss: 0.9219, test_f1: 0.5277
 epoch: 27, train_loss: 0.8733, test_loss: 0.9121, test_f1: 0.5233
 epoch: 28, train_loss: 0.8763, test_loss: 0.9294, test_f1: 0.5307
 epoch: 29, train_loss: 0.8635, test_loss: 0.9212, test_f1: 0.5439
 epoch: 30, train_loss: 0.8518, test_loss: 0.9138, test_f1: 0.5457
 epoch: 31, train_loss: 0.8582, test_loss: 0.9316, test_f1: 0.5563
 epoch: 32, train_loss: 0.8445, test_loss: 0.9275, test_f1: 0.5492
 epoch: 33, train_loss: 0.8579, test_loss: 0.9307, test_f1: 0.5516
 epoch: 34, train_loss: 0.8561, test_loss: 0.8958, test_f1: 0.5499
 epoch: 35, train_loss: 0.8392, test_loss: 0.9265, test_f1: 0.5423
 epoch: 36, train_loss: 0.8365, test_loss: 0.9266, test_f1: 0.5696
 epoch: 37, train_loss: 0.8366, test_loss: 0.9188, test_f1: 0.5747
 epoch: 38, train_loss: 0.8367, test_loss: 0.9433, test_f1: 0.5742
 epoch: 39, train_loss: 0.8387, test_loss: 0.9332, test_f1: 0.5739
 epoch: 40, train_loss: 0.8227, test_loss: 0.9407, test_f1: 0.5780
 epoch: 41, train_loss: 0.8135, test_loss: 0.9339, test_f1: 0.5555
 epoch: 42, train_loss: 0.8314, test_loss: 0.9625, test_f1: 0.5603
 epoch: 43, train_loss: 0.8200, test_loss: 0.9225, test_f1: 0.5619
 epoch: 44, train_loss: 0.8222, test_loss: 0.9303, test_f1: 0.5594
 epoch: 45, train_loss: 0.8038, test_loss: 0.9291, test_f1: 0.5573
 epoch: 46, train_loss: 0.8061, test_loss: 0.9454, test_f1: 0.5537
 epoch: 47, train_loss: 0.8052, test_loss: 0.9176, test_f1: 0.5614
 epoch: 48, train_loss: 0.8059, test_loss: 0.9549, test_f1: 0.5604
 epoch: 49, train_loss: 0.7996, test_loss: 0.9383, test_f1: 0.5781
 epoch: 50, train_loss: 0.7967, test_loss: 0.9400, test_f1: 0.5707
 epoch: 51, train_loss: 0.7841, test_loss: 0.9504, test_f1: 0.5693
 epoch: 52, train_loss: 0.7840, test_loss: 0.9408, test_f1: 0.5676
 epoch: 53, train_loss: 0.7874, test_loss: 0.9298, test_f1: 0.5734
 epoch: 54, train_loss: 0.7802, test_loss: 0.9560, test_f1: 0.5657
 epoch: 55, train_loss: 0.7730, test_loss: 0.9201, test_f1: 0.5810
 epoch: 56, train_loss: 0.7781, test_loss: 0.9256, test_f1: 0.5750
 epoch: 57, train_loss: 0.7755, test_loss: 0.9374, test_f1: 0.5734
 epoch: 58, train_loss: 0.7725, test_loss: 0.9403, test_f1: 0.5662
 epoch: 59, train_loss: 0.7684, test_loss: 0.9321, test_f1: 0.5796
 epoch: 60, train_loss: 0.7653, test_loss: 0.9445, test_f1: 0.5842
 epoch: 61, train_loss: 0.7686, test_loss: 0.9396, test_f1: 0.5799
 epoch: 62, train_loss: 0.7554, test_loss: 0.9250, test_f1: 0.5808
 epoch: 63, train_loss: 0.7624, test_loss: 0.9438, test_f1: 0.5755
 epoch: 64, train_loss: 0.7627, test_loss: 0.9048, test_f1: 0.5861
 epoch: 65, train_loss: 0.7565, test_loss: 0.9413, test_f1: 0.5640
 epoch: 66, train_loss: 0.7411, test_loss: 0.9328, test_f1: 0.5672
 epoch: 67, train_loss: 0.7514, test_loss: 0.9172, test_f1: 0.5886
 epoch: 68, train_loss: 0.7503, test_loss: 0.9125, test_f1: 0.5899
 epoch: 69, train_loss: 0.7586, test_loss: 0.9343, test_f1: 0.5690
 epoch: 70, train_loss: 0.7548, test_loss: 0.9399, test_f1: 0.5890
 epoch: 71, train_loss: 0.7461, test_loss: 0.9240, test_f1: 0.5902
 epoch: 72, train_loss: 0.7532, test_loss: 0.9509, test_f1: 0.5767
 epoch: 73, train_loss: 0.7408, test_loss: 0.9462, test_f1: 0.5757
 epoch: 74, train_loss: 0.7570, test_loss: 0.9346, test_f1: 0.5836
 epoch: 75, train_loss: 0.7502, test_loss: 0.9346, test_f1: 0.5869
 epoch: 76, train_loss: 0.7457, test_loss: 0.9409, test_f1: 0.5857
 epoch: 77, train_loss: 0.7432, test_loss: 0.9450, test_f1: 0.5739
 epoch: 78, train_loss: 0.7506, test_loss: 0.9314, test_f1: 0.5819
 epoch: 79, train_loss: 0.7403, test_loss: 0.9344, test_f1: 0.5793
 epoch: 80, train_loss: 0.7502, test_loss: 0.9416, test_f1: 0.5846
 epoch: 81, train_loss: 0.7235, test_loss: 0.9415, test_f1: 0.5846
 epoch: 82, train_loss: 0.7364, test_loss: 0.9442, test_f1: 0.5813
 epoch: 83, train_loss: 0.7372, test_loss: 0.9592, test_f1: 0.5747
 epoch: 84, train_loss: 0.7415, test_loss: 0.9709, test_f1: 0.5700
 epoch: 85, train_loss: 0.7391, test_loss: 0.9520, test_f1: 0.5871
 epoch: 86, train_loss: 0.7289, test_loss: 0.9345, test_f1: 0.5901
 epoch: 87, train_loss: 0.7370, test_loss: 0.9281, test_f1: 0.5973
 epoch: 88, train_loss: 0.7087, test_loss: 0.9470, test_f1: 0.5799
 epoch: 89, train_loss: 0.7277, test_loss: 0.9430, test_f1: 0.5886
 epoch: 90, train_loss: 0.7272, test_loss: 0.9539, test_f1: 0.5804
 epoch: 91, train_loss: 0.7304, test_loss: 0.9601, test_f1: 0.5723
 epoch: 92, train_loss: 0.7234, test_loss: 0.9796, test_f1: 0.5779
 epoch: 93, train_loss: 0.7112, test_loss: 0.9408, test_f1: 0.5809
 epoch: 94, train_loss: 0.7163, test_loss: 0.9525, test_f1: 0.5862
 epoch: 95, train_loss: 0.7122, test_loss: 0.9785, test_f1: 0.5988
 epoch: 96, train_loss: 0.7230, test_loss: 0.9563, test_f1: 0.5852
 epoch: 97, train_loss: 0.7229, test_loss: 0.9566, test_f1: 0.5706
 epoch: 98, train_loss: 0.7252, test_loss: 0.9732, test_f1: 0.5878
 epoch: 99, train_loss: 0.7166, test_loss: 0.9814, test_f1: 0.5870
##################ITERATION #8 ****************************************
 epoch: 0, train_loss: 1.2354, test_loss: 1.2168, test_f1: 0.2997
 epoch: 1, train_loss: 1.1412, test_loss: 1.0661, test_f1: 0.4301
 epoch: 2, train_loss: 1.1033, test_loss: 1.0394, test_f1: 0.4599
 epoch: 3, train_loss: 1.0787, test_loss: 1.0332, test_f1: 0.4512
 epoch: 4, train_loss: 1.0547, test_loss: 1.0009, test_f1: 0.4687
 epoch: 5, train_loss: 1.0416, test_loss: 1.0147, test_f1: 0.4631
 epoch: 6, train_loss: 1.0266, test_loss: 0.9975, test_f1: 0.4640
 epoch: 7, train_loss: 1.0153, test_loss: 0.9820, test_f1: 0.4834
 epoch: 8, train_loss: 0.9961, test_loss: 0.9706, test_f1: 0.4981
 epoch: 9, train_loss: 0.9893, test_loss: 0.9559, test_f1: 0.4651
 epoch: 10, train_loss: 0.9762, test_loss: 0.9482, test_f1: 0.5066
 epoch: 11, train_loss: 0.9769, test_loss: 0.9481, test_f1: 0.5131
 epoch: 12, train_loss: 0.9611, test_loss: 0.9715, test_f1: 0.4997
 epoch: 13, train_loss: 0.9588, test_loss: 0.9557, test_f1: 0.4964
 epoch: 14, train_loss: 0.9523, test_loss: 0.9647, test_f1: 0.4824
 epoch: 15, train_loss: 0.9384, test_loss: 0.9698, test_f1: 0.4689
 epoch: 16, train_loss: 0.9244, test_loss: 0.9611, test_f1: 0.5024
 epoch: 17, train_loss: 0.9237, test_loss: 0.9747, test_f1: 0.5043
 epoch: 18, train_loss: 0.9096, test_loss: 0.9744, test_f1: 0.5003
 epoch: 19, train_loss: 0.9079, test_loss: 0.9716, test_f1: 0.5031
 epoch: 20, train_loss: 0.9062, test_loss: 0.9830, test_f1: 0.4893
 epoch: 21, train_loss: 0.9039, test_loss: 0.9894, test_f1: 0.4825
 epoch: 22, train_loss: 0.8955, test_loss: 0.9874, test_f1: 0.5010
 epoch: 23, train_loss: 0.8897, test_loss: 0.9723, test_f1: 0.4997
 epoch: 24, train_loss: 0.8865, test_loss: 0.9946, test_f1: 0.4918
 epoch: 25, train_loss: 0.8864, test_loss: 0.9740, test_f1: 0.5238
 epoch: 26, train_loss: 0.8837, test_loss: 0.9700, test_f1: 0.5354
 epoch: 27, train_loss: 0.8650, test_loss: 0.9958, test_f1: 0.5309
 epoch: 28, train_loss: 0.8746, test_loss: 0.9938, test_f1: 0.5357
 epoch: 29, train_loss: 0.8630, test_loss: 0.9741, test_f1: 0.5379
 epoch: 30, train_loss: 0.8709, test_loss: 0.9779, test_f1: 0.5403
 epoch: 31, train_loss: 0.8541, test_loss: 1.0002, test_f1: 0.5411
 epoch: 32, train_loss: 0.8531, test_loss: 0.9694, test_f1: 0.5173
 epoch: 33, train_loss: 0.8408, test_loss: 0.9794, test_f1: 0.5308
 epoch: 34, train_loss: 0.8488, test_loss: 0.9779, test_f1: 0.5221
 epoch: 35, train_loss: 0.8401, test_loss: 0.9666, test_f1: 0.5392
 epoch: 36, train_loss: 0.8267, test_loss: 0.9854, test_f1: 0.5268
 epoch: 37, train_loss: 0.8267, test_loss: 0.9660, test_f1: 0.5315
 epoch: 38, train_loss: 0.8280, test_loss: 0.9663, test_f1: 0.5407
 epoch: 39, train_loss: 0.8221, test_loss: 0.9714, test_f1: 0.5409
 epoch: 40, train_loss: 0.8184, test_loss: 0.9733, test_f1: 0.5375
 epoch: 41, train_loss: 0.8189, test_loss: 0.9870, test_f1: 0.5397
 epoch: 42, train_loss: 0.8265, test_loss: 0.9781, test_f1: 0.5431
 epoch: 43, train_loss: 0.8030, test_loss: 0.9814, test_f1: 0.5420
 epoch: 44, train_loss: 0.8135, test_loss: 0.9789, test_f1: 0.5332
 epoch: 45, train_loss: 0.8112, test_loss: 0.9637, test_f1: 0.5362
 epoch: 46, train_loss: 0.8145, test_loss: 0.9834, test_f1: 0.5370
 epoch: 47, train_loss: 0.8138, test_loss: 0.9938, test_f1: 0.5448
 epoch: 48, train_loss: 0.7911, test_loss: 0.9762, test_f1: 0.5638
 epoch: 49, train_loss: 0.7925, test_loss: 0.9955, test_f1: 0.5628
 epoch: 50, train_loss: 0.7834, test_loss: 0.9923, test_f1: 0.5656
 epoch: 51, train_loss: 0.7808, test_loss: 0.9818, test_f1: 0.5536
 epoch: 52, train_loss: 0.7704, test_loss: 0.9965, test_f1: 0.5403
 epoch: 53, train_loss: 0.7784, test_loss: 0.9912, test_f1: 0.5367
 epoch: 54, train_loss: 0.7720, test_loss: 0.9832, test_f1: 0.5547
 epoch: 55, train_loss: 0.7777, test_loss: 0.9882, test_f1: 0.5205
 epoch: 56, train_loss: 0.7614, test_loss: 0.9862, test_f1: 0.5444
 epoch: 57, train_loss: 0.7761, test_loss: 0.9930, test_f1: 0.5487
 epoch: 58, train_loss: 0.7604, test_loss: 0.9852, test_f1: 0.5515
 epoch: 59, train_loss: 0.7694, test_loss: 1.0015, test_f1: 0.5442
 epoch: 60, train_loss: 0.7555, test_loss: 0.9849, test_f1: 0.5466
 epoch: 61, train_loss: 0.7613, test_loss: 0.9804, test_f1: 0.5470
 epoch: 62, train_loss: 0.7648, test_loss: 0.9876, test_f1: 0.5580
 epoch: 63, train_loss: 0.7529, test_loss: 0.9909, test_f1: 0.5483
 epoch: 64, train_loss: 0.7679, test_loss: 0.9996, test_f1: 0.5571
 epoch: 65, train_loss: 0.7501, test_loss: 1.0026, test_f1: 0.5383
 epoch: 66, train_loss: 0.7561, test_loss: 0.9923, test_f1: 0.5582
 epoch: 67, train_loss: 0.7593, test_loss: 0.9777, test_f1: 0.5579
 epoch: 68, train_loss: 0.7566, test_loss: 0.9937, test_f1: 0.5714
 epoch: 69, train_loss: 0.7616, test_loss: 0.9736, test_f1: 0.5752
 epoch: 70, train_loss: 0.7539, test_loss: 0.9754, test_f1: 0.5582
 epoch: 71, train_loss: 0.7460, test_loss: 0.9862, test_f1: 0.5651
 epoch: 72, train_loss: 0.7497, test_loss: 0.9752, test_f1: 0.5678
 epoch: 73, train_loss: 0.7472, test_loss: 0.9832, test_f1: 0.5640
 epoch: 74, train_loss: 0.7465, test_loss: 0.9934, test_f1: 0.5627
 epoch: 75, train_loss: 0.7412, test_loss: 0.9733, test_f1: 0.5687
 epoch: 76, train_loss: 0.7413, test_loss: 0.9798, test_f1: 0.5751
 epoch: 77, train_loss: 0.7364, test_loss: 0.9869, test_f1: 0.5549
 epoch: 78, train_loss: 0.7347, test_loss: 0.9841, test_f1: 0.5672
 epoch: 79, train_loss: 0.7308, test_loss: 0.9756, test_f1: 0.5792
 epoch: 80, train_loss: 0.7426, test_loss: 0.9801, test_f1: 0.5664
 epoch: 81, train_loss: 0.7234, test_loss: 0.9777, test_f1: 0.5826
 epoch: 82, train_loss: 0.7348, test_loss: 0.9687, test_f1: 0.5705
 epoch: 83, train_loss: 0.7273, test_loss: 0.9715, test_f1: 0.5700
 epoch: 84, train_loss: 0.7409, test_loss: 0.9768, test_f1: 0.5730
 epoch: 85, train_loss: 0.7180, test_loss: 0.9942, test_f1: 0.5641
 epoch: 86, train_loss: 0.7343, test_loss: 0.9904, test_f1: 0.5606
 epoch: 87, train_loss: 0.7330, test_loss: 0.9856, test_f1: 0.5590
 epoch: 88, train_loss: 0.7214, test_loss: 0.9903, test_f1: 0.5608
 epoch: 89, train_loss: 0.7415, test_loss: 1.0086, test_f1: 0.5579
 epoch: 90, train_loss: 0.7307, test_loss: 0.9904, test_f1: 0.5808
 epoch: 91, train_loss: 0.7173, test_loss: 0.9912, test_f1: 0.5865
 epoch: 92, train_loss: 0.7216, test_loss: 0.9907, test_f1: 0.5585
 epoch: 93, train_loss: 0.7189, test_loss: 0.9996, test_f1: 0.5625
 epoch: 94, train_loss: 0.7108, test_loss: 0.9919, test_f1: 0.5621
 epoch: 95, train_loss: 0.7080, test_loss: 1.0046, test_f1: 0.5677
 epoch: 96, train_loss: 0.7043, test_loss: 1.0039, test_f1: 0.5629
 epoch: 97, train_loss: 0.7142, test_loss: 0.9997, test_f1: 0.5806
 epoch: 98, train_loss: 0.7032, test_loss: 0.9975, test_f1: 0.5794
 epoch: 99, train_loss: 0.7224, test_loss: 0.9918, test_f1: 0.5733
##################ITERATION #9 ****************************************
 epoch: 0, train_loss: 1.3135, test_loss: 1.1934, test_f1: 0.3736
 epoch: 1, train_loss: 1.1746, test_loss: 1.0890, test_f1: 0.4191
 epoch: 2, train_loss: 1.1431, test_loss: 1.0526, test_f1: 0.4536
 epoch: 3, train_loss: 1.1085, test_loss: 1.0373, test_f1: 0.4718
 epoch: 4, train_loss: 1.0834, test_loss: 1.0287, test_f1: 0.4827
 epoch: 5, train_loss: 1.0598, test_loss: 0.9986, test_f1: 0.4991
 epoch: 6, train_loss: 1.0502, test_loss: 0.9914, test_f1: 0.4786
 epoch: 7, train_loss: 1.0310, test_loss: 0.9792, test_f1: 0.4830
 epoch: 8, train_loss: 1.0216, test_loss: 0.9618, test_f1: 0.4884
 epoch: 9, train_loss: 1.0030, test_loss: 0.9833, test_f1: 0.5108
 epoch: 10, train_loss: 0.9964, test_loss: 0.9889, test_f1: 0.5129
 epoch: 11, train_loss: 0.9938, test_loss: 0.9733, test_f1: 0.5058
 epoch: 12, train_loss: 0.9805, test_loss: 0.9875, test_f1: 0.4987
 epoch: 13, train_loss: 0.9717, test_loss: 0.9497, test_f1: 0.5110
 epoch: 14, train_loss: 0.9581, test_loss: 0.9511, test_f1: 0.5317
 epoch: 15, train_loss: 0.9662, test_loss: 0.9500, test_f1: 0.5148
 epoch: 16, train_loss: 0.9498, test_loss: 0.9577, test_f1: 0.5196
 epoch: 17, train_loss: 0.9488, test_loss: 0.9497, test_f1: 0.4978
 epoch: 18, train_loss: 0.9358, test_loss: 0.9534, test_f1: 0.5023
 epoch: 19, train_loss: 0.9200, test_loss: 0.9470, test_f1: 0.5230
 epoch: 20, train_loss: 0.9201, test_loss: 0.9398, test_f1: 0.5207
 epoch: 21, train_loss: 0.9227, test_loss: 0.9298, test_f1: 0.5267
 epoch: 22, train_loss: 0.9145, test_loss: 0.9401, test_f1: 0.5305
 epoch: 23, train_loss: 0.9068, test_loss: 0.9329, test_f1: 0.5115
 epoch: 24, train_loss: 0.8921, test_loss: 0.9378, test_f1: 0.5308
 epoch: 25, train_loss: 0.9015, test_loss: 0.9318, test_f1: 0.5184
 epoch: 26, train_loss: 0.8946, test_loss: 0.9131, test_f1: 0.5377
 epoch: 27, train_loss: 0.8990, test_loss: 0.9236, test_f1: 0.5336
 epoch: 28, train_loss: 0.8901, test_loss: 0.9331, test_f1: 0.5363
 epoch: 29, train_loss: 0.8699, test_loss: 0.9368, test_f1: 0.5328
 epoch: 30, train_loss: 0.8751, test_loss: 0.9245, test_f1: 0.5284
 epoch: 31, train_loss: 0.8724, test_loss: 0.9260, test_f1: 0.5404
 epoch: 32, train_loss: 0.8695, test_loss: 0.9298, test_f1: 0.5290
 epoch: 33, train_loss: 0.8705, test_loss: 0.9179, test_f1: 0.5441
 epoch: 34, train_loss: 0.8589, test_loss: 0.9375, test_f1: 0.5320
 epoch: 35, train_loss: 0.8503, test_loss: 0.9269, test_f1: 0.5308
 epoch: 36, train_loss: 0.8452, test_loss: 0.9356, test_f1: 0.5367
 epoch: 37, train_loss: 0.8463, test_loss: 0.9429, test_f1: 0.5246
 epoch: 38, train_loss: 0.8601, test_loss: 0.9238, test_f1: 0.5344
 epoch: 39, train_loss: 0.8415, test_loss: 0.9259, test_f1: 0.5492
 epoch: 40, train_loss: 0.8286, test_loss: 0.9288, test_f1: 0.5423
 epoch: 41, train_loss: 0.8325, test_loss: 0.9376, test_f1: 0.5401
 epoch: 42, train_loss: 0.8366, test_loss: 0.9423, test_f1: 0.5560
 epoch: 43, train_loss: 0.8331, test_loss: 0.9420, test_f1: 0.5413
 epoch: 44, train_loss: 0.8253, test_loss: 0.9346, test_f1: 0.5589
 epoch: 45, train_loss: 0.8309, test_loss: 0.9432, test_f1: 0.5531
 epoch: 46, train_loss: 0.8093, test_loss: 0.9398, test_f1: 0.5558
 epoch: 47, train_loss: 0.8062, test_loss: 0.9408, test_f1: 0.5454
 epoch: 48, train_loss: 0.8171, test_loss: 0.9373, test_f1: 0.5607
 epoch: 49, train_loss: 0.8167, test_loss: 0.9480, test_f1: 0.5664
 epoch: 50, train_loss: 0.7991, test_loss: 0.9450, test_f1: 0.5605
 epoch: 51, train_loss: 0.8015, test_loss: 0.9435, test_f1: 0.5545
 epoch: 52, train_loss: 0.7954, test_loss: 0.9374, test_f1: 0.5580
 epoch: 53, train_loss: 0.7934, test_loss: 0.9467, test_f1: 0.5590
 epoch: 54, train_loss: 0.7863, test_loss: 0.9403, test_f1: 0.5640
 epoch: 55, train_loss: 0.7886, test_loss: 0.9362, test_f1: 0.5693
 epoch: 56, train_loss: 0.7795, test_loss: 0.9422, test_f1: 0.5726
 epoch: 57, train_loss: 0.7844, test_loss: 0.9464, test_f1: 0.5651
 epoch: 58, train_loss: 0.7863, test_loss: 0.9382, test_f1: 0.5719
 epoch: 59, train_loss: 0.7837, test_loss: 0.9351, test_f1: 0.5667
 epoch: 60, train_loss: 0.7802, test_loss: 0.9478, test_f1: 0.5715
 epoch: 61, train_loss: 0.7756, test_loss: 0.9464, test_f1: 0.5606
 epoch: 62, train_loss: 0.7725, test_loss: 0.9424, test_f1: 0.5661
 epoch: 63, train_loss: 0.7696, test_loss: 0.9449, test_f1: 0.5774
 epoch: 64, train_loss: 0.7707, test_loss: 0.9400, test_f1: 0.5712
 epoch: 65, train_loss: 0.7876, test_loss: 0.9346, test_f1: 0.5846
 epoch: 66, train_loss: 0.7663, test_loss: 0.9430, test_f1: 0.5722
 epoch: 67, train_loss: 0.7677, test_loss: 0.9443, test_f1: 0.5708
 epoch: 68, train_loss: 0.7769, test_loss: 0.9466, test_f1: 0.5716
 epoch: 69, train_loss: 0.7696, test_loss: 0.9407, test_f1: 0.5800
 epoch: 70, train_loss: 0.7732, test_loss: 0.9313, test_f1: 0.5766
 epoch: 71, train_loss: 0.7618, test_loss: 0.9458, test_f1: 0.5763
 epoch: 72, train_loss: 0.7703, test_loss: 0.9445, test_f1: 0.5734
 epoch: 73, train_loss: 0.7705, test_loss: 0.9453, test_f1: 0.5737
 epoch: 74, train_loss: 0.7546, test_loss: 0.9523, test_f1: 0.5693
 epoch: 75, train_loss: 0.7526, test_loss: 0.9486, test_f1: 0.5764
 epoch: 76, train_loss: 0.7662, test_loss: 0.9424, test_f1: 0.5641
 epoch: 77, train_loss: 0.7454, test_loss: 0.9345, test_f1: 0.5596
 epoch: 78, train_loss: 0.7576, test_loss: 0.9512, test_f1: 0.5708
 epoch: 79, train_loss: 0.7428, test_loss: 0.9432, test_f1: 0.5712
 epoch: 80, train_loss: 0.7500, test_loss: 0.9516, test_f1: 0.5784
 epoch: 81, train_loss: 0.7452, test_loss: 0.9498, test_f1: 0.5739
 epoch: 82, train_loss: 0.7500, test_loss: 0.9478, test_f1: 0.5761
 epoch: 83, train_loss: 0.7402, test_loss: 0.9672, test_f1: 0.5767
 epoch: 84, train_loss: 0.7439, test_loss: 0.9505, test_f1: 0.5724
 epoch: 85, train_loss: 0.7418, test_loss: 0.9433, test_f1: 0.5704
 epoch: 86, train_loss: 0.7463, test_loss: 0.9461, test_f1: 0.6049
 epoch: 87, train_loss: 0.7394, test_loss: 0.9580, test_f1: 0.5967
 epoch: 88, train_loss: 0.7414, test_loss: 0.9420, test_f1: 0.5989
 epoch: 89, train_loss: 0.7232, test_loss: 0.9361, test_f1: 0.6066
 epoch: 90, train_loss: 0.7320, test_loss: 0.9497, test_f1: 0.6037
 epoch: 91, train_loss: 0.7357, test_loss: 0.9442, test_f1: 0.5986
 epoch: 92, train_loss: 0.7305, test_loss: 0.9436, test_f1: 0.6072
 epoch: 93, train_loss: 0.7277, test_loss: 0.9404, test_f1: 0.6070
 epoch: 94, train_loss: 0.7236, test_loss: 0.9419, test_f1: 0.5769
 epoch: 95, train_loss: 0.7375, test_loss: 0.9336, test_f1: 0.6043
 epoch: 96, train_loss: 0.7315, test_loss: 0.9519, test_f1: 0.6143
 epoch: 97, train_loss: 0.7222, test_loss: 0.9552, test_f1: 0.6006
 epoch: 98, train_loss: 0.7171, test_loss: 0.9540, test_f1: 0.5807
 epoch: 99, train_loss: 0.7245, test_loss: 0.9533, test_f1: 0.6169

Training completed in 860.00 seconds
Best F1: 0.6306 at epoch 86
Mean F1 across iterations: 0.6093  0.0145
========================FINAL RESULTS================================
FEGIN weighted F1: 0.6306  0.0145
python main.py --data ltspice_examples --representation component_net --model FEGIN --layers 6 --hiddens 64 --batch_size 64 --lr 0.0001 --emb_size 512 --epochs 100 --save_appendix component_net_L6_H64_BS64_LR0.0001_E512 --no_val
-----



STDERR:
  File "main.py", line 370, in <module>
    main()
  File "main.py", line 254, in main
    dataset = dataset_class(
  File "/home/philip/projects/ltspice_examples_code_repo/Circuit-Completion-Using-GNNs/component_classification_with_link_prediction_head/evaluation/FEGIN/kernel/circuit_datasets.py", line 15, in __init__
    self.data, self.slices = torch.load(self.processed_paths[0])
  File "/home/philip/.local/lib/python3.8/site-packages/torch/serialization.py", line 1040, in load
    warnings.warn(
  File "/usr/lib/python3.8/warnings.py", line 109, in _showwarnmsg
    sw(msg.message, msg.category, msg.filename, msg.lineno,
  File "main.py", line 47, in warn_with_traceback
    traceback.print_stack(file=log)
/home/philip/projects/ltspice_examples_code_repo/Circuit-Completion-Using-GNNs/component_classification_with_link_prediction_head/evaluation/FEGIN/kernel/circuit_datasets.py:15: FutureWarning: You are using `torch.load` with `weights_only=False` (the current default value), which uses the default pickle module implicitly. It is possible to construct malicious pickle data which will execute arbitrary code during unpickling (See https://github.com/pytorch/pytorch/blob/main/SECURITY.md#untrusted-models for more details). In a future release, the default value for `weights_only` will be flipped to `True`. This limits the functions that could be executed during unpickling. Arbitrary objects will no longer be allowed to be loaded via this mode unless they are explicitly allowlisted by the user via `torch.serialization.add_safe_globals`. We recommend you start setting `weights_only=True` for any use case where you don't have full control of the loaded file. Please open an issue on GitHub for any issues related to this experimental feature.
  self.data, self.slices = torch.load(self.processed_paths[0])
