STDOUT:
Results will be saved in /home/philip/projects/ltspice_examples_code_repo/Circuit-Completion-Using-GNNs/component_classification_with_link_prediction_head/evaluation/FEGIN/results/model_FEGIN_dataset_ltspice_demos
Command line input: python main.py --data ltspice_demos --representation component_component --model FEGIN --layers 2 --hiddens 128 --batch_size 32 --lr 0.0001 --emb_size 250 --epochs 100 --save_appendix component_component_L2_H128_BS32_LR0.0001_E250 --no_val
 is saved.
-----
ltspice_demos - FEGIN
Using 2 layers, 128 hidden units, h = 2
Loading component_component representation dataset
ENTERED
Training FEGIN on component_component representation
Train: 1565, Test: 383
##################ITERATION #0 ****************************************
 epoch: 0, train_loss: 1.3501, test_loss: 1.3354, test_f1: 0.2281
 epoch: 1, train_loss: 1.2844, test_loss: 1.3004, test_f1: 0.2281
 epoch: 2, train_loss: 1.2347, test_loss: 1.2808, test_f1: 0.2281
 epoch: 3, train_loss: 1.1984, test_loss: 1.2666, test_f1: 0.2571
 epoch: 4, train_loss: 1.1743, test_loss: 1.2454, test_f1: 0.2592
 epoch: 5, train_loss: 1.1543, test_loss: 1.2304, test_f1: 0.2904
 epoch: 6, train_loss: 1.1322, test_loss: 1.2181, test_f1: 0.3368
 epoch: 7, train_loss: 1.1039, test_loss: 1.1993, test_f1: 0.3598
 epoch: 8, train_loss: 1.0922, test_loss: 1.1899, test_f1: 0.3938
 epoch: 9, train_loss: 1.0636, test_loss: 1.1729, test_f1: 0.3972
 epoch: 10, train_loss: 1.0457, test_loss: 1.1791, test_f1: 0.3887
 epoch: 11, train_loss: 1.0276, test_loss: 1.1613, test_f1: 0.3954
 epoch: 12, train_loss: 1.0058, test_loss: 1.1580, test_f1: 0.4168
 epoch: 13, train_loss: 0.9830, test_loss: 1.1660, test_f1: 0.4736
 epoch: 14, train_loss: 0.9729, test_loss: 1.1681, test_f1: 0.4559
 epoch: 15, train_loss: 0.9435, test_loss: 1.1683, test_f1: 0.4910
 epoch: 16, train_loss: 0.9371, test_loss: 1.1399, test_f1: 0.5047
 epoch: 17, train_loss: 0.9158, test_loss: 1.1308, test_f1: 0.5105
 epoch: 18, train_loss: 0.9054, test_loss: 1.1850, test_f1: 0.4968
 epoch: 19, train_loss: 0.8979, test_loss: 1.1353, test_f1: 0.5206
 epoch: 20, train_loss: 0.8798, test_loss: 1.1279, test_f1: 0.5079
 epoch: 21, train_loss: 0.8839, test_loss: 1.1443, test_f1: 0.4896
 epoch: 22, train_loss: 0.8547, test_loss: 1.1231, test_f1: 0.5245
 epoch: 23, train_loss: 0.8614, test_loss: 1.1162, test_f1: 0.5105
 epoch: 24, train_loss: 0.8250, test_loss: 1.1487, test_f1: 0.5534
 epoch: 25, train_loss: 0.8188, test_loss: 1.1368, test_f1: 0.5880
 epoch: 26, train_loss: 0.8282, test_loss: 1.1437, test_f1: 0.5225
 epoch: 27, train_loss: 0.8187, test_loss: 1.1191, test_f1: 0.5849
 epoch: 28, train_loss: 0.8075, test_loss: 1.1796, test_f1: 0.5631
 epoch: 29, train_loss: 0.7807, test_loss: 1.1859, test_f1: 0.5791
 epoch: 30, train_loss: 0.7747, test_loss: 1.1363, test_f1: 0.5812
 epoch: 31, train_loss: 0.7690, test_loss: 1.1583, test_f1: 0.6112
 epoch: 32, train_loss: 0.7513, test_loss: 1.2177, test_f1: 0.5781
 epoch: 33, train_loss: 0.7627, test_loss: 1.1753, test_f1: 0.5970
 epoch: 34, train_loss: 0.7396, test_loss: 1.1564, test_f1: 0.6057
 epoch: 35, train_loss: 0.7295, test_loss: 1.2322, test_f1: 0.5856
 epoch: 36, train_loss: 0.7202, test_loss: 1.2222, test_f1: 0.6010
 epoch: 37, train_loss: 0.7281, test_loss: 1.2897, test_f1: 0.6013
 epoch: 38, train_loss: 0.7053, test_loss: 1.2056, test_f1: 0.5976
 epoch: 39, train_loss: 0.6918, test_loss: 1.3465, test_f1: 0.5670
 epoch: 40, train_loss: 0.6932, test_loss: 1.2195, test_f1: 0.5936
 epoch: 41, train_loss: 0.6855, test_loss: 1.2772, test_f1: 0.6088
 epoch: 42, train_loss: 0.6779, test_loss: 1.2968, test_f1: 0.6002
 epoch: 43, train_loss: 0.6749, test_loss: 1.2559, test_f1: 0.6064
 epoch: 44, train_loss: 0.6574, test_loss: 1.2994, test_f1: 0.5946
 epoch: 45, train_loss: 0.6459, test_loss: 1.3879, test_f1: 0.5840
 epoch: 46, train_loss: 0.6549, test_loss: 1.2875, test_f1: 0.6117
 epoch: 47, train_loss: 0.6380, test_loss: 1.4459, test_f1: 0.5763
 epoch: 48, train_loss: 0.6244, test_loss: 1.3676, test_f1: 0.5966
 epoch: 49, train_loss: 0.6256, test_loss: 1.3803, test_f1: 0.6017
 epoch: 50, train_loss: 0.6151, test_loss: 1.4317, test_f1: 0.5762
 epoch: 51, train_loss: 0.6152, test_loss: 1.4208, test_f1: 0.6073
 epoch: 52, train_loss: 0.5991, test_loss: 1.4904, test_f1: 0.6012
 epoch: 53, train_loss: 0.5800, test_loss: 1.4629, test_f1: 0.5904
 epoch: 54, train_loss: 0.5855, test_loss: 1.4629, test_f1: 0.5908
 epoch: 55, train_loss: 0.5894, test_loss: 1.5207, test_f1: 0.5642
 epoch: 56, train_loss: 0.5663, test_loss: 1.4361, test_f1: 0.5981
 epoch: 57, train_loss: 0.5727, test_loss: 1.4430, test_f1: 0.5894
 epoch: 58, train_loss: 0.5600, test_loss: 1.4138, test_f1: 0.5853
 epoch: 59, train_loss: 0.5663, test_loss: 1.5131, test_f1: 0.5964
 epoch: 60, train_loss: 0.5624, test_loss: 1.5061, test_f1: 0.5998
 epoch: 61, train_loss: 0.5719, test_loss: 1.5119, test_f1: 0.6078
 epoch: 62, train_loss: 0.5505, test_loss: 1.4916, test_f1: 0.6131
 epoch: 63, train_loss: 0.5535, test_loss: 1.5367, test_f1: 0.6013
 epoch: 64, train_loss: 0.5685, test_loss: 1.5373, test_f1: 0.6064
 epoch: 65, train_loss: 0.5522, test_loss: 1.6315, test_f1: 0.5797
 epoch: 66, train_loss: 0.5268, test_loss: 1.6506, test_f1: 0.5877
 epoch: 67, train_loss: 0.5526, test_loss: 1.6276, test_f1: 0.5996
 epoch: 68, train_loss: 0.5332, test_loss: 1.6580, test_f1: 0.5984
 epoch: 69, train_loss: 0.5356, test_loss: 1.6427, test_f1: 0.5982
 epoch: 70, train_loss: 0.5311, test_loss: 1.6526, test_f1: 0.5638
 epoch: 71, train_loss: 0.5227, test_loss: 1.5308, test_f1: 0.6077
 epoch: 72, train_loss: 0.5234, test_loss: 1.6875, test_f1: 0.5944
 epoch: 73, train_loss: 0.5371, test_loss: 1.7170, test_f1: 0.5865
 epoch: 74, train_loss: 0.5385, test_loss: 1.7164, test_f1: 0.5720
 epoch: 75, train_loss: 0.5114, test_loss: 1.5944, test_f1: 0.6002
 epoch: 76, train_loss: 0.5250, test_loss: 1.7677, test_f1: 0.5754
 epoch: 77, train_loss: 0.5014, test_loss: 1.6291, test_f1: 0.5993
 epoch: 78, train_loss: 0.5105, test_loss: 1.6817, test_f1: 0.5941
 epoch: 79, train_loss: 0.5274, test_loss: 1.6534, test_f1: 0.5854
 epoch: 80, train_loss: 0.5264, test_loss: 1.8408, test_f1: 0.5767
 epoch: 81, train_loss: 0.5080, test_loss: 1.8118, test_f1: 0.5726
 epoch: 82, train_loss: 0.5206, test_loss: 1.7663, test_f1: 0.5740
 epoch: 83, train_loss: 0.5028, test_loss: 1.9276, test_f1: 0.5715
 epoch: 84, train_loss: 0.4903, test_loss: 1.7472, test_f1: 0.5910
 epoch: 85, train_loss: 0.4901, test_loss: 1.8266, test_f1: 0.5929
 epoch: 86, train_loss: 0.4817, test_loss: 1.7800, test_f1: 0.5732
 epoch: 87, train_loss: 0.5064, test_loss: 1.7407, test_f1: 0.5884
 epoch: 88, train_loss: 0.4845, test_loss: 1.8683, test_f1: 0.5688
 epoch: 89, train_loss: 0.4822, test_loss: 1.7988, test_f1: 0.5813
 epoch: 90, train_loss: 0.4795, test_loss: 1.8365, test_f1: 0.5736
 epoch: 91, train_loss: 0.4685, test_loss: 1.8321, test_f1: 0.5734
 epoch: 92, train_loss: 0.4949, test_loss: 1.9072, test_f1: 0.5861
 epoch: 93, train_loss: 0.4763, test_loss: 1.8173, test_f1: 0.5772
 epoch: 94, train_loss: 0.4570, test_loss: 1.7805, test_f1: 0.6084
 epoch: 95, train_loss: 0.4654, test_loss: 1.8703, test_f1: 0.5880
 epoch: 96, train_loss: 0.4593, test_loss: 1.8839, test_f1: 0.5929
 epoch: 97, train_loss: 0.4792, test_loss: 1.9122, test_f1: 0.5681
 epoch: 98, train_loss: 0.4684, test_loss: 1.8024, test_f1: 0.5782
 epoch: 99, train_loss: 0.4716, test_loss: 1.8203, test_f1: 0.5977
##################ITERATION #1 ****************************************
 epoch: 0, train_loss: 1.2564, test_loss: 1.2655, test_f1: 0.3526
 epoch: 1, train_loss: 1.1703, test_loss: 1.2771, test_f1: 0.3793
 epoch: 2, train_loss: 1.1276, test_loss: 1.2550, test_f1: 0.4082
 epoch: 3, train_loss: 1.0939, test_loss: 1.2604, test_f1: 0.4314
 epoch: 4, train_loss: 1.0659, test_loss: 1.3290, test_f1: 0.4379
 epoch: 5, train_loss: 1.0422, test_loss: 1.2161, test_f1: 0.4830
 epoch: 6, train_loss: 1.0245, test_loss: 1.2406, test_f1: 0.4775
 epoch: 7, train_loss: 1.0083, test_loss: 1.1635, test_f1: 0.5007
 epoch: 8, train_loss: 0.9866, test_loss: 1.1761, test_f1: 0.5104
 epoch: 9, train_loss: 0.9688, test_loss: 1.1364, test_f1: 0.5378
 epoch: 10, train_loss: 0.9473, test_loss: 1.1551, test_f1: 0.5385
 epoch: 11, train_loss: 0.9389, test_loss: 1.2341, test_f1: 0.5491
 epoch: 12, train_loss: 0.9302, test_loss: 1.2016, test_f1: 0.5653
 epoch: 13, train_loss: 0.9099, test_loss: 1.2033, test_f1: 0.5590
 epoch: 14, train_loss: 0.9084, test_loss: 1.1224, test_f1: 0.5860
 epoch: 15, train_loss: 0.9013, test_loss: 1.1514, test_f1: 0.5595
 epoch: 16, train_loss: 0.8724, test_loss: 1.1828, test_f1: 0.5553
 epoch: 17, train_loss: 0.8758, test_loss: 1.2798, test_f1: 0.5976
 epoch: 18, train_loss: 0.8370, test_loss: 1.1355, test_f1: 0.5774
 epoch: 19, train_loss: 0.8286, test_loss: 1.2873, test_f1: 0.5604
 epoch: 20, train_loss: 0.8375, test_loss: 1.1623, test_f1: 0.5604
 epoch: 21, train_loss: 0.8146, test_loss: 1.1543, test_f1: 0.5743
 epoch: 22, train_loss: 0.8201, test_loss: 1.1577, test_f1: 0.5865
 epoch: 23, train_loss: 0.7951, test_loss: 1.1356, test_f1: 0.5609
 epoch: 24, train_loss: 0.7688, test_loss: 1.2079, test_f1: 0.5568
 epoch: 25, train_loss: 0.7890, test_loss: 1.2588, test_f1: 0.5751
 epoch: 26, train_loss: 0.7670, test_loss: 1.3426, test_f1: 0.5704
 epoch: 27, train_loss: 0.7614, test_loss: 1.2078, test_f1: 0.5950
 epoch: 28, train_loss: 0.7578, test_loss: 1.2190, test_f1: 0.5530
 epoch: 29, train_loss: 0.7446, test_loss: 1.6060, test_f1: 0.6212
 epoch: 30, train_loss: 0.7404, test_loss: 1.4826, test_f1: 0.5822
 epoch: 31, train_loss: 0.7268, test_loss: 2.5582, test_f1: 0.6101
 epoch: 32, train_loss: 0.7309, test_loss: 1.3251, test_f1: 0.5452
 epoch: 33, train_loss: 0.7161, test_loss: 1.5415, test_f1: 0.5716
 epoch: 34, train_loss: 0.7092, test_loss: 1.6328, test_f1: 0.5801
 epoch: 35, train_loss: 0.7012, test_loss: 1.2625, test_f1: 0.5766
 epoch: 36, train_loss: 0.6940, test_loss: 1.9362, test_f1: 0.5482
 epoch: 37, train_loss: 0.6848, test_loss: 1.5152, test_f1: 0.5513
 epoch: 38, train_loss: 0.6707, test_loss: 1.5416, test_f1: 0.5729
 epoch: 39, train_loss: 0.6692, test_loss: 1.5561, test_f1: 0.6004
 epoch: 40, train_loss: 0.6786, test_loss: 1.6611, test_f1: 0.5587
 epoch: 41, train_loss: 0.6648, test_loss: 1.6402, test_f1: 0.5860
 epoch: 42, train_loss: 0.6410, test_loss: 2.1644, test_f1: 0.5887
 epoch: 43, train_loss: 0.6372, test_loss: 1.9905, test_f1: 0.5654
 epoch: 44, train_loss: 0.6503, test_loss: 1.7989, test_f1: 0.5537
 epoch: 45, train_loss: 0.6344, test_loss: 2.0535, test_f1: 0.5828
 epoch: 46, train_loss: 0.6290, test_loss: 1.8074, test_f1: 0.5885
 epoch: 47, train_loss: 0.6159, test_loss: 1.7313, test_f1: 0.5805
 epoch: 48, train_loss: 0.6118, test_loss: 2.2123, test_f1: 0.5480
 epoch: 49, train_loss: 0.6020, test_loss: 1.9014, test_f1: 0.5682
 epoch: 50, train_loss: 0.6003, test_loss: 1.7297, test_f1: 0.5783
 epoch: 51, train_loss: 0.5795, test_loss: 1.7913, test_f1: 0.6021
 epoch: 52, train_loss: 0.5684, test_loss: 1.8435, test_f1: 0.5934
 epoch: 53, train_loss: 0.5721, test_loss: 2.3574, test_f1: 0.5778
 epoch: 54, train_loss: 0.5582, test_loss: 1.9156, test_f1: 0.5703
 epoch: 55, train_loss: 0.5452, test_loss: 2.9414, test_f1: 0.5704
 epoch: 56, train_loss: 0.5580, test_loss: 2.6054, test_f1: 0.5678
 epoch: 57, train_loss: 0.5612, test_loss: 2.0216, test_f1: 0.5796
 epoch: 58, train_loss: 0.5617, test_loss: 1.9704, test_f1: 0.5564
 epoch: 59, train_loss: 0.5456, test_loss: 2.0918, test_f1: 0.5995
 epoch: 60, train_loss: 0.5534, test_loss: 2.2820, test_f1: 0.5612
 epoch: 61, train_loss: 0.5516, test_loss: 1.7940, test_f1: 0.5897
 epoch: 62, train_loss: 0.5282, test_loss: 1.7828, test_f1: 0.5826
 epoch: 63, train_loss: 0.5471, test_loss: 2.1514, test_f1: 0.5861
 epoch: 64, train_loss: 0.5190, test_loss: 2.0415, test_f1: 0.5717
 epoch: 65, train_loss: 0.5284, test_loss: 2.1880, test_f1: 0.5882
 epoch: 66, train_loss: 0.5378, test_loss: 2.0820, test_f1: 0.5673
 epoch: 67, train_loss: 0.5279, test_loss: 2.0068, test_f1: 0.5738
 epoch: 68, train_loss: 0.5199, test_loss: 2.1883, test_f1: 0.5788
 epoch: 69, train_loss: 0.5186, test_loss: 2.2744, test_f1: 0.5715
 epoch: 70, train_loss: 0.5189, test_loss: 2.6789, test_f1: 0.5973
 epoch: 71, train_loss: 0.5125, test_loss: 2.2697, test_f1: 0.5870
 epoch: 72, train_loss: 0.5086, test_loss: 2.2775, test_f1: 0.5865
 epoch: 73, train_loss: 0.4951, test_loss: 2.6038, test_f1: 0.5877
 epoch: 74, train_loss: 0.5025, test_loss: 2.9275, test_f1: 0.5790
 epoch: 75, train_loss: 0.4956, test_loss: 2.0209, test_f1: 0.5792
 epoch: 76, train_loss: 0.4912, test_loss: 2.6159, test_f1: 0.5938
 epoch: 77, train_loss: 0.5020, test_loss: 2.3499, test_f1: 0.5731
 epoch: 78, train_loss: 0.5034, test_loss: 2.8892, test_f1: 0.5889
 epoch: 79, train_loss: 0.4727, test_loss: 2.3769, test_f1: 0.5850
 epoch: 80, train_loss: 0.4941, test_loss: 3.0375, test_f1: 0.5843
 epoch: 81, train_loss: 0.4824, test_loss: 2.5475, test_f1: 0.5905
 epoch: 82, train_loss: 0.5082, test_loss: 2.0298, test_f1: 0.5983
 epoch: 83, train_loss: 0.4755, test_loss: 2.5496, test_f1: 0.5765
 epoch: 84, train_loss: 0.4656, test_loss: 2.4103, test_f1: 0.5714
 epoch: 85, train_loss: 0.4635, test_loss: 2.4855, test_f1: 0.5721
 epoch: 86, train_loss: 0.4584, test_loss: 2.5437, test_f1: 0.5663
 epoch: 87, train_loss: 0.4775, test_loss: 2.7275, test_f1: 0.5922
 epoch: 88, train_loss: 0.4457, test_loss: 2.9874, test_f1: 0.5866
 epoch: 89, train_loss: 0.4615, test_loss: 2.3985, test_f1: 0.5938
 epoch: 90, train_loss: 0.4602, test_loss: 3.1170, test_f1: 0.5800
 epoch: 91, train_loss: 0.4359, test_loss: 3.1197, test_f1: 0.5813
 epoch: 92, train_loss: 0.4535, test_loss: 2.9851, test_f1: 0.5919
 epoch: 93, train_loss: 0.4572, test_loss: 2.8648, test_f1: 0.5784
 epoch: 94, train_loss: 0.4579, test_loss: 2.2580, test_f1: 0.5752
 epoch: 95, train_loss: 0.4588, test_loss: 2.8951, test_f1: 0.5801
 epoch: 96, train_loss: 0.4530, test_loss: 2.9042, test_f1: 0.5863
 epoch: 97, train_loss: 0.4528, test_loss: 2.7184, test_f1: 0.5832
 epoch: 98, train_loss: 0.4357, test_loss: 2.6515, test_f1: 0.5827
 epoch: 99, train_loss: 0.4329, test_loss: 2.6749, test_f1: 0.5860
##################ITERATION #2 ****************************************
 epoch: 0, train_loss: 1.2430, test_loss: 1.3201, test_f1: 0.3423
 epoch: 1, train_loss: 1.1628, test_loss: 1.2886, test_f1: 0.3633
 epoch: 2, train_loss: 1.1194, test_loss: 1.2035, test_f1: 0.3986
 epoch: 3, train_loss: 1.0796, test_loss: 1.2013, test_f1: 0.4541
 epoch: 4, train_loss: 1.0571, test_loss: 1.1620, test_f1: 0.4808
 epoch: 5, train_loss: 1.0287, test_loss: 1.1347, test_f1: 0.5474
 epoch: 6, train_loss: 1.0102, test_loss: 1.1238, test_f1: 0.5504
 epoch: 7, train_loss: 0.9937, test_loss: 1.1046, test_f1: 0.5448
 epoch: 8, train_loss: 0.9672, test_loss: 1.1248, test_f1: 0.5641
 epoch: 9, train_loss: 0.9553, test_loss: 1.1076, test_f1: 0.5614
 epoch: 10, train_loss: 0.9290, test_loss: 1.1148, test_f1: 0.5611
 epoch: 11, train_loss: 0.9172, test_loss: 1.1021, test_f1: 0.5678
 epoch: 12, train_loss: 0.8975, test_loss: 1.0862, test_f1: 0.5810
 epoch: 13, train_loss: 0.8960, test_loss: 1.1245, test_f1: 0.5779
 epoch: 14, train_loss: 0.8640, test_loss: 1.1148, test_f1: 0.5664
 epoch: 15, train_loss: 0.8784, test_loss: 1.1127, test_f1: 0.5979
 epoch: 16, train_loss: 0.8605, test_loss: 1.1086, test_f1: 0.5982
 epoch: 17, train_loss: 0.8444, test_loss: 1.1285, test_f1: 0.6009
 epoch: 18, train_loss: 0.8450, test_loss: 1.1353, test_f1: 0.5876
 epoch: 19, train_loss: 0.8332, test_loss: 1.0972, test_f1: 0.6013
 epoch: 20, train_loss: 0.8294, test_loss: 1.1202, test_f1: 0.5887
 epoch: 21, train_loss: 0.8016, test_loss: 1.1494, test_f1: 0.5670
 epoch: 22, train_loss: 0.7966, test_loss: 1.1347, test_f1: 0.6096
 epoch: 23, train_loss: 0.7679, test_loss: 1.1641, test_f1: 0.5878
 epoch: 24, train_loss: 0.7686, test_loss: 1.1331, test_f1: 0.6009
 epoch: 25, train_loss: 0.7722, test_loss: 1.1336, test_f1: 0.5846
 epoch: 26, train_loss: 0.7545, test_loss: 1.1427, test_f1: 0.6048
 epoch: 27, train_loss: 0.7567, test_loss: 1.1969, test_f1: 0.5529
 epoch: 28, train_loss: 0.7466, test_loss: 1.1738, test_f1: 0.6066
 epoch: 29, train_loss: 0.7465, test_loss: 1.1877, test_f1: 0.5955
 epoch: 30, train_loss: 0.7373, test_loss: 1.1534, test_f1: 0.6447
 epoch: 31, train_loss: 0.7195, test_loss: 1.1628, test_f1: 0.6354
 epoch: 32, train_loss: 0.7216, test_loss: 1.1745, test_f1: 0.6242
 epoch: 33, train_loss: 0.7142, test_loss: 1.1833, test_f1: 0.6145
 epoch: 34, train_loss: 0.7120, test_loss: 1.2275, test_f1: 0.6072
 epoch: 35, train_loss: 0.6950, test_loss: 1.1822, test_f1: 0.6024
 epoch: 36, train_loss: 0.6699, test_loss: 1.2493, test_f1: 0.6070
 epoch: 37, train_loss: 0.6756, test_loss: 1.2423, test_f1: 0.6210
 epoch: 38, train_loss: 0.7000, test_loss: 1.1828, test_f1: 0.5898
 epoch: 39, train_loss: 0.6684, test_loss: 1.2539, test_f1: 0.6138
 epoch: 40, train_loss: 0.6469, test_loss: 1.2544, test_f1: 0.6162
 epoch: 41, train_loss: 0.6577, test_loss: 1.2236, test_f1: 0.6105
 epoch: 42, train_loss: 0.6460, test_loss: 1.3577, test_f1: 0.5790
 epoch: 43, train_loss: 0.6437, test_loss: 1.2308, test_f1: 0.6192
 epoch: 44, train_loss: 0.6250, test_loss: 1.2587, test_f1: 0.5855
 epoch: 45, train_loss: 0.6233, test_loss: 1.3051, test_f1: 0.6054
 epoch: 46, train_loss: 0.6089, test_loss: 1.3249, test_f1: 0.5975
 epoch: 47, train_loss: 0.5973, test_loss: 1.3571, test_f1: 0.5890
 epoch: 48, train_loss: 0.6036, test_loss: 1.3107, test_f1: 0.5933
 epoch: 49, train_loss: 0.5880, test_loss: 1.3721, test_f1: 0.6004
 epoch: 50, train_loss: 0.6038, test_loss: 1.4444, test_f1: 0.6051
 epoch: 51, train_loss: 0.5842, test_loss: 1.3926, test_f1: 0.5863
 epoch: 52, train_loss: 0.5755, test_loss: 1.3585, test_f1: 0.6099
 epoch: 53, train_loss: 0.5801, test_loss: 1.4346, test_f1: 0.5768
 epoch: 54, train_loss: 0.5775, test_loss: 1.4040, test_f1: 0.6001
 epoch: 55, train_loss: 0.5661, test_loss: 1.4664, test_f1: 0.5920
 epoch: 56, train_loss: 0.5595, test_loss: 1.3781, test_f1: 0.5936
 epoch: 57, train_loss: 0.5667, test_loss: 1.4529, test_f1: 0.5906
 epoch: 58, train_loss: 0.5529, test_loss: 1.4304, test_f1: 0.6064
 epoch: 59, train_loss: 0.5388, test_loss: 1.4057, test_f1: 0.6068
 epoch: 60, train_loss: 0.5508, test_loss: 1.4523, test_f1: 0.5953
 epoch: 61, train_loss: 0.5380, test_loss: 1.5223, test_f1: 0.5662
 epoch: 62, train_loss: 0.5411, test_loss: 1.5309, test_f1: 0.6078
 epoch: 63, train_loss: 0.5365, test_loss: 1.4481, test_f1: 0.6176
 epoch: 64, train_loss: 0.5290, test_loss: 1.4939, test_f1: 0.6065
 epoch: 65, train_loss: 0.5493, test_loss: 1.6012, test_f1: 0.5716
 epoch: 66, train_loss: 0.5328, test_loss: 1.4673, test_f1: 0.6210
 epoch: 67, train_loss: 0.5450, test_loss: 1.4863, test_f1: 0.6203
 epoch: 68, train_loss: 0.5310, test_loss: 1.5515, test_f1: 0.5868
 epoch: 69, train_loss: 0.5294, test_loss: 1.4537, test_f1: 0.6049
 epoch: 70, train_loss: 0.5126, test_loss: 1.4730, test_f1: 0.5970
 epoch: 71, train_loss: 0.5005, test_loss: 1.5047, test_f1: 0.6170
 epoch: 72, train_loss: 0.5219, test_loss: 1.5677, test_f1: 0.6107
 epoch: 73, train_loss: 0.5124, test_loss: 1.6198, test_f1: 0.6023
 epoch: 74, train_loss: 0.5030, test_loss: 1.6056, test_f1: 0.5960
 epoch: 75, train_loss: 0.5105, test_loss: 1.6335, test_f1: 0.6154
 epoch: 76, train_loss: 0.5085, test_loss: 1.5273, test_f1: 0.6026
 epoch: 77, train_loss: 0.5044, test_loss: 1.6443, test_f1: 0.5982
 epoch: 78, train_loss: 0.4889, test_loss: 1.7011, test_f1: 0.6005
 epoch: 79, train_loss: 0.4903, test_loss: 1.6329, test_f1: 0.5851
 epoch: 80, train_loss: 0.4855, test_loss: 1.5808, test_f1: 0.5920
 epoch: 81, train_loss: 0.4904, test_loss: 1.5660, test_f1: 0.6065
 epoch: 82, train_loss: 0.4713, test_loss: 1.6708, test_f1: 0.5990
 epoch: 83, train_loss: 0.4661, test_loss: 1.6219, test_f1: 0.6126
 epoch: 84, train_loss: 0.4937, test_loss: 1.6590, test_f1: 0.6176
 epoch: 85, train_loss: 0.4762, test_loss: 1.6061, test_f1: 0.6077
 epoch: 86, train_loss: 0.4775, test_loss: 1.6224, test_f1: 0.5873
 epoch: 87, train_loss: 0.4671, test_loss: 1.7677, test_f1: 0.5897
 epoch: 88, train_loss: 0.4809, test_loss: 1.6526, test_f1: 0.6196
 epoch: 89, train_loss: 0.4914, test_loss: 1.6953, test_f1: 0.6160
 epoch: 90, train_loss: 0.4498, test_loss: 1.7664, test_f1: 0.5945
 epoch: 91, train_loss: 0.4828, test_loss: 1.6985, test_f1: 0.6135
 epoch: 92, train_loss: 0.4855, test_loss: 1.7372, test_f1: 0.6048
 epoch: 93, train_loss: 0.4485, test_loss: 1.7367, test_f1: 0.6128
 epoch: 94, train_loss: 0.4785, test_loss: 1.7060, test_f1: 0.5959
 epoch: 95, train_loss: 0.4556, test_loss: 1.6902, test_f1: 0.6011
 epoch: 96, train_loss: 0.4511, test_loss: 1.7222, test_f1: 0.6128
 epoch: 97, train_loss: 0.4510, test_loss: 1.7704, test_f1: 0.6040
 epoch: 98, train_loss: 0.4848, test_loss: 1.8028, test_f1: 0.5949
 epoch: 99, train_loss: 0.4512, test_loss: 1.6991, test_f1: 0.5760
##################ITERATION #3 ****************************************
 epoch: 0, train_loss: 1.2621, test_loss: 1.2801, test_f1: 0.4079
 epoch: 1, train_loss: 1.1633, test_loss: 1.2433, test_f1: 0.4800
 epoch: 2, train_loss: 1.1155, test_loss: 1.1834, test_f1: 0.4918
 epoch: 3, train_loss: 1.0799, test_loss: 1.1534, test_f1: 0.5172
 epoch: 4, train_loss: 1.0489, test_loss: 1.1340, test_f1: 0.5346
 epoch: 5, train_loss: 1.0168, test_loss: 1.1031, test_f1: 0.5413
 epoch: 6, train_loss: 1.0044, test_loss: 1.0898, test_f1: 0.5508
 epoch: 7, train_loss: 0.9634, test_loss: 1.0913, test_f1: 0.5854
 epoch: 8, train_loss: 0.9514, test_loss: 1.0687, test_f1: 0.5942
 epoch: 9, train_loss: 0.9337, test_loss: 1.0666, test_f1: 0.6025
 epoch: 10, train_loss: 0.9174, test_loss: 1.0435, test_f1: 0.6102
 epoch: 11, train_loss: 0.9070, test_loss: 1.0733, test_f1: 0.5724
 epoch: 12, train_loss: 0.8936, test_loss: 1.0506, test_f1: 0.6273
 epoch: 13, train_loss: 0.8761, test_loss: 1.0413, test_f1: 0.6374
 epoch: 14, train_loss: 0.8617, test_loss: 1.0433, test_f1: 0.6189
 epoch: 15, train_loss: 0.8501, test_loss: 1.1211, test_f1: 0.5555
 epoch: 16, train_loss: 0.8443, test_loss: 1.0260, test_f1: 0.6250
 epoch: 17, train_loss: 0.8362, test_loss: 1.0687, test_f1: 0.6028
 epoch: 18, train_loss: 0.8203, test_loss: 1.0263, test_f1: 0.6223
 epoch: 19, train_loss: 0.8327, test_loss: 1.0592, test_f1: 0.6196
 epoch: 20, train_loss: 0.8059, test_loss: 1.0376, test_f1: 0.6279
 epoch: 21, train_loss: 0.7917, test_loss: 1.0340, test_f1: 0.6301
 epoch: 22, train_loss: 0.7700, test_loss: 1.0383, test_f1: 0.6088
 epoch: 23, train_loss: 0.7640, test_loss: 1.0570, test_f1: 0.6122
 epoch: 24, train_loss: 0.7744, test_loss: 1.0517, test_f1: 0.6070
 epoch: 25, train_loss: 0.7615, test_loss: 1.0460, test_f1: 0.6141
 epoch: 26, train_loss: 0.7453, test_loss: 1.0683, test_f1: 0.5943
 epoch: 27, train_loss: 0.7358, test_loss: 1.0240, test_f1: 0.6356
 epoch: 28, train_loss: 0.7177, test_loss: 1.0273, test_f1: 0.6619
 epoch: 29, train_loss: 0.7211, test_loss: 1.0295, test_f1: 0.6311
 epoch: 30, train_loss: 0.7417, test_loss: 0.9961, test_f1: 0.6416
 epoch: 31, train_loss: 0.6989, test_loss: 1.0275, test_f1: 0.6184
 epoch: 32, train_loss: 0.7135, test_loss: 1.0637, test_f1: 0.5815
 epoch: 33, train_loss: 0.6925, test_loss: 1.0436, test_f1: 0.6357
 epoch: 34, train_loss: 0.6909, test_loss: 1.0749, test_f1: 0.6209
 epoch: 35, train_loss: 0.6787, test_loss: 1.1059, test_f1: 0.5945
 epoch: 36, train_loss: 0.6834, test_loss: 1.1039, test_f1: 0.5941
 epoch: 37, train_loss: 0.6868, test_loss: 1.1047, test_f1: 0.6114
 epoch: 38, train_loss: 0.6719, test_loss: 1.1429, test_f1: 0.5886
 epoch: 39, train_loss: 0.6448, test_loss: 1.1547, test_f1: 0.6152
 epoch: 40, train_loss: 0.6632, test_loss: 1.1872, test_f1: 0.5664
 epoch: 41, train_loss: 0.6535, test_loss: 1.2071, test_f1: 0.5908
 epoch: 42, train_loss: 0.6348, test_loss: 1.1606, test_f1: 0.5577
 epoch: 43, train_loss: 0.6272, test_loss: 1.2805, test_f1: 0.5439
 epoch: 44, train_loss: 0.6535, test_loss: 1.2147, test_f1: 0.5694
 epoch: 45, train_loss: 0.6121, test_loss: 1.3259, test_f1: 0.5637
 epoch: 46, train_loss: 0.6254, test_loss: 1.2786, test_f1: 0.5536
 epoch: 47, train_loss: 0.6070, test_loss: 1.2943, test_f1: 0.5763
 epoch: 48, train_loss: 0.6015, test_loss: 1.3431, test_f1: 0.5672
 epoch: 49, train_loss: 0.5943, test_loss: 1.4120, test_f1: 0.5826
 epoch: 50, train_loss: 0.5895, test_loss: 1.3166, test_f1: 0.5912
 epoch: 51, train_loss: 0.5988, test_loss: 1.2809, test_f1: 0.6074
 epoch: 52, train_loss: 0.5755, test_loss: 1.3510, test_f1: 0.5657
 epoch: 53, train_loss: 0.5687, test_loss: 1.3929, test_f1: 0.5651
 epoch: 54, train_loss: 0.5709, test_loss: 1.3702, test_f1: 0.5962
 epoch: 55, train_loss: 0.5494, test_loss: 1.3222, test_f1: 0.5805
 epoch: 56, train_loss: 0.5461, test_loss: 1.3765, test_f1: 0.5802
 epoch: 57, train_loss: 0.5487, test_loss: 1.3832, test_f1: 0.6007
 epoch: 58, train_loss: 0.5510, test_loss: 1.3876, test_f1: 0.5860
 epoch: 59, train_loss: 0.5526, test_loss: 1.4054, test_f1: 0.5950
 epoch: 60, train_loss: 0.5522, test_loss: 1.3947, test_f1: 0.5705
 epoch: 61, train_loss: 0.5438, test_loss: 1.4457, test_f1: 0.5923
 epoch: 62, train_loss: 0.5295, test_loss: 1.4056, test_f1: 0.5725
 epoch: 63, train_loss: 0.5405, test_loss: 1.4217, test_f1: 0.6040
 epoch: 64, train_loss: 0.5674, test_loss: 1.3888, test_f1: 0.5769
 epoch: 65, train_loss: 0.5396, test_loss: 1.4868, test_f1: 0.5662
 epoch: 66, train_loss: 0.5430, test_loss: 1.4067, test_f1: 0.5947
 epoch: 67, train_loss: 0.5305, test_loss: 1.4872, test_f1: 0.5732
 epoch: 68, train_loss: 0.5297, test_loss: 1.4684, test_f1: 0.5724
 epoch: 69, train_loss: 0.5213, test_loss: 1.4989, test_f1: 0.5657
 epoch: 70, train_loss: 0.5266, test_loss: 1.4770, test_f1: 0.5786
 epoch: 71, train_loss: 0.5227, test_loss: 1.4928, test_f1: 0.5683
 epoch: 72, train_loss: 0.5037, test_loss: 1.5454, test_f1: 0.5732
 epoch: 73, train_loss: 0.5146, test_loss: 1.5350, test_f1: 0.5713
 epoch: 74, train_loss: 0.5175, test_loss: 1.5627, test_f1: 0.5561
 epoch: 75, train_loss: 0.4867, test_loss: 1.5733, test_f1: 0.5854
 epoch: 76, train_loss: 0.5276, test_loss: 1.5691, test_f1: 0.5614
 epoch: 77, train_loss: 0.5036, test_loss: 1.5980, test_f1: 0.5702
 epoch: 78, train_loss: 0.4913, test_loss: 1.5034, test_f1: 0.5784
 epoch: 79, train_loss: 0.5158, test_loss: 1.6249, test_f1: 0.5751
 epoch: 80, train_loss: 0.5066, test_loss: 1.6141, test_f1: 0.5597
 epoch: 81, train_loss: 0.4872, test_loss: 1.5953, test_f1: 0.5828
 epoch: 82, train_loss: 0.4927, test_loss: 1.6429, test_f1: 0.5671
 epoch: 83, train_loss: 0.4980, test_loss: 1.6827, test_f1: 0.5694
 epoch: 84, train_loss: 0.5029, test_loss: 1.6664, test_f1: 0.5825
 epoch: 85, train_loss: 0.4958, test_loss: 1.6818, test_f1: 0.5753
 epoch: 86, train_loss: 0.5017, test_loss: 1.7096, test_f1: 0.5814
 epoch: 87, train_loss: 0.4803, test_loss: 1.6363, test_f1: 0.5986
 epoch: 88, train_loss: 0.4951, test_loss: 1.7397, test_f1: 0.5698
 epoch: 89, train_loss: 0.4869, test_loss: 1.6725, test_f1: 0.5718
 epoch: 90, train_loss: 0.4699, test_loss: 1.7082, test_f1: 0.5819
 epoch: 91, train_loss: 0.4754, test_loss: 1.6971, test_f1: 0.5835
 epoch: 92, train_loss: 0.4751, test_loss: 1.7263, test_f1: 0.5880
 epoch: 93, train_loss: 0.4637, test_loss: 1.7767, test_f1: 0.5901
 epoch: 94, train_loss: 0.4608, test_loss: 1.8067, test_f1: 0.5742
 epoch: 95, train_loss: 0.4586, test_loss: 1.7828, test_f1: 0.5701
 epoch: 96, train_loss: 0.4422, test_loss: 1.7859, test_f1: 0.5784
 epoch: 97, train_loss: 0.4426, test_loss: 1.7805, test_f1: 0.5615
 epoch: 98, train_loss: 0.4672, test_loss: 1.7209, test_f1: 0.5875
 epoch: 99, train_loss: 0.4519, test_loss: 1.7889, test_f1: 0.5671
##################ITERATION #4 ****************************************
 epoch: 0, train_loss: 1.2681, test_loss: 1.2549, test_f1: 0.3661
 epoch: 1, train_loss: 1.1443, test_loss: 1.2714, test_f1: 0.4519
 epoch: 2, train_loss: 1.1122, test_loss: 1.2291, test_f1: 0.4546
 epoch: 3, train_loss: 1.0690, test_loss: 1.1839, test_f1: 0.4780
 epoch: 4, train_loss: 1.0563, test_loss: 1.2043, test_f1: 0.4920
 epoch: 5, train_loss: 1.0312, test_loss: 1.1698, test_f1: 0.5053
 epoch: 6, train_loss: 1.0200, test_loss: 1.1689, test_f1: 0.5413
 epoch: 7, train_loss: 0.9810, test_loss: 1.2282, test_f1: 0.5092
 epoch: 8, train_loss: 0.9620, test_loss: 1.1734, test_f1: 0.5558
 epoch: 9, train_loss: 0.9561, test_loss: 1.1871, test_f1: 0.5576
 epoch: 10, train_loss: 0.9513, test_loss: 1.2206, test_f1: 0.5404
 epoch: 11, train_loss: 0.9284, test_loss: 1.2833, test_f1: 0.5641
 epoch: 12, train_loss: 0.9115, test_loss: 1.2116, test_f1: 0.5679
 epoch: 13, train_loss: 0.8955, test_loss: 1.2451, test_f1: 0.5455
 epoch: 14, train_loss: 0.8969, test_loss: 1.3294, test_f1: 0.5517
 epoch: 15, train_loss: 0.8771, test_loss: 1.2408, test_f1: 0.5771
 epoch: 16, train_loss: 0.8646, test_loss: 1.2948, test_f1: 0.5825
 epoch: 17, train_loss: 0.8340, test_loss: 1.1886, test_f1: 0.5766
 epoch: 18, train_loss: 0.8325, test_loss: 1.3177, test_f1: 0.5465
 epoch: 19, train_loss: 0.8278, test_loss: 1.2329, test_f1: 0.5778
 epoch: 20, train_loss: 0.8102, test_loss: 1.3176, test_f1: 0.5604
 epoch: 21, train_loss: 0.8076, test_loss: 1.2375, test_f1: 0.5762
 epoch: 22, train_loss: 0.7959, test_loss: 1.2884, test_f1: 0.5949
 epoch: 23, train_loss: 0.8005, test_loss: 1.2917, test_f1: 0.5684
 epoch: 24, train_loss: 0.7778, test_loss: 1.3105, test_f1: 0.5743
 epoch: 25, train_loss: 0.7665, test_loss: 1.2622, test_f1: 0.5569
 epoch: 26, train_loss: 0.7609, test_loss: 1.3313, test_f1: 0.5704
 epoch: 27, train_loss: 0.7477, test_loss: 1.4066, test_f1: 0.5535
 epoch: 28, train_loss: 0.7438, test_loss: 1.3268, test_f1: 0.5667
 epoch: 29, train_loss: 0.7395, test_loss: 1.4797, test_f1: 0.5941
 epoch: 30, train_loss: 0.7387, test_loss: 1.4279, test_f1: 0.5870
 epoch: 31, train_loss: 0.7077, test_loss: 1.3660, test_f1: 0.5718
 epoch: 32, train_loss: 0.7278, test_loss: 1.4038, test_f1: 0.5666
 epoch: 33, train_loss: 0.7067, test_loss: 1.4137, test_f1: 0.5782
 epoch: 34, train_loss: 0.6915, test_loss: 1.5550, test_f1: 0.5922
 epoch: 35, train_loss: 0.7016, test_loss: 1.4256, test_f1: 0.5740
 epoch: 36, train_loss: 0.6770, test_loss: 1.5125, test_f1: 0.5478
 epoch: 37, train_loss: 0.6826, test_loss: 1.4235, test_f1: 0.5746
 epoch: 38, train_loss: 0.6720, test_loss: 1.5550, test_f1: 0.5832
 epoch: 39, train_loss: 0.6568, test_loss: 1.4918, test_f1: 0.5653
 epoch: 40, train_loss: 0.6390, test_loss: 1.4809, test_f1: 0.5640
 epoch: 41, train_loss: 0.6571, test_loss: 1.4874, test_f1: 0.5745
 epoch: 42, train_loss: 0.6276, test_loss: 1.6063, test_f1: 0.5722
 epoch: 43, train_loss: 0.6307, test_loss: 1.3993, test_f1: 0.5635
 epoch: 44, train_loss: 0.6371, test_loss: 1.6698, test_f1: 0.5408
 epoch: 45, train_loss: 0.6300, test_loss: 1.5478, test_f1: 0.5652
 epoch: 46, train_loss: 0.6081, test_loss: 1.4990, test_f1: 0.5704
 epoch: 47, train_loss: 0.6059, test_loss: 1.7072, test_f1: 0.5784
 epoch: 48, train_loss: 0.6135, test_loss: 1.6585, test_f1: 0.5321
 epoch: 49, train_loss: 0.5896, test_loss: 1.5536, test_f1: 0.5841
 epoch: 50, train_loss: 0.5739, test_loss: 1.6164, test_f1: 0.5728
 epoch: 51, train_loss: 0.5707, test_loss: 1.7279, test_f1: 0.5544
 epoch: 52, train_loss: 0.5687, test_loss: 1.6723, test_f1: 0.5557
 epoch: 53, train_loss: 0.5567, test_loss: 1.5762, test_f1: 0.5634
 epoch: 54, train_loss: 0.5528, test_loss: 1.6824, test_f1: 0.5594
 epoch: 55, train_loss: 0.5387, test_loss: 1.6138, test_f1: 0.5734
 epoch: 56, train_loss: 0.5609, test_loss: 1.5853, test_f1: 0.5807
 epoch: 57, train_loss: 0.5506, test_loss: 1.7726, test_f1: 0.5481
 epoch: 58, train_loss: 0.5565, test_loss: 1.7107, test_f1: 0.5428
 epoch: 59, train_loss: 0.5537, test_loss: 1.6833, test_f1: 0.5592
 epoch: 60, train_loss: 0.5599, test_loss: 1.7700, test_f1: 0.5630
 epoch: 61, train_loss: 0.5292, test_loss: 1.6403, test_f1: 0.5527
 epoch: 62, train_loss: 0.5498, test_loss: 1.6718, test_f1: 0.5570
 epoch: 63, train_loss: 0.5139, test_loss: 1.6210, test_f1: 0.5650
 epoch: 64, train_loss: 0.5318, test_loss: 1.7255, test_f1: 0.5451
 epoch: 65, train_loss: 0.5237, test_loss: 1.7904, test_f1: 0.5414
 epoch: 66, train_loss: 0.5140, test_loss: 1.9002, test_f1: 0.5498
 epoch: 67, train_loss: 0.5074, test_loss: 1.8754, test_f1: 0.5455
 epoch: 68, train_loss: 0.5230, test_loss: 1.8020, test_f1: 0.5731
 epoch: 69, train_loss: 0.5098, test_loss: 1.7990, test_f1: 0.5761
 epoch: 70, train_loss: 0.4883, test_loss: 1.8429, test_f1: 0.5666
 epoch: 71, train_loss: 0.4993, test_loss: 1.8372, test_f1: 0.5694
 epoch: 72, train_loss: 0.5076, test_loss: 1.8835, test_f1: 0.5550
 epoch: 73, train_loss: 0.5055, test_loss: 1.8135, test_f1: 0.5630
 epoch: 74, train_loss: 0.5049, test_loss: 1.8379, test_f1: 0.5435
 epoch: 75, train_loss: 0.4935, test_loss: 1.8298, test_f1: 0.5454
 epoch: 76, train_loss: 0.4927, test_loss: 1.9119, test_f1: 0.5583
 epoch: 77, train_loss: 0.4823, test_loss: 1.8703, test_f1: 0.5500
 epoch: 78, train_loss: 0.4887, test_loss: 1.9416, test_f1: 0.5664
 epoch: 79, train_loss: 0.5007, test_loss: 1.9114, test_f1: 0.5635
 epoch: 80, train_loss: 0.4933, test_loss: 2.0205, test_f1: 0.5590
 epoch: 81, train_loss: 0.4544, test_loss: 1.9891, test_f1: 0.5571
 epoch: 82, train_loss: 0.4774, test_loss: 2.0665, test_f1: 0.5539
 epoch: 83, train_loss: 0.4804, test_loss: 2.0048, test_f1: 0.5507
 epoch: 84, train_loss: 0.4650, test_loss: 1.8755, test_f1: 0.5584
 epoch: 85, train_loss: 0.4699, test_loss: 2.1012, test_f1: 0.5530
 epoch: 86, train_loss: 0.4759, test_loss: 1.9681, test_f1: 0.5591
 epoch: 87, train_loss: 0.4820, test_loss: 1.8475, test_f1: 0.5607
 epoch: 88, train_loss: 0.4742, test_loss: 2.1815, test_f1: 0.5438
 epoch: 89, train_loss: 0.4400, test_loss: 2.1318, test_f1: 0.5529
 epoch: 90, train_loss: 0.4674, test_loss: 1.9831, test_f1: 0.5430
 epoch: 91, train_loss: 0.4813, test_loss: 1.9869, test_f1: 0.5707
 epoch: 92, train_loss: 0.4661, test_loss: 2.1071, test_f1: 0.5553
 epoch: 93, train_loss: 0.4283, test_loss: 2.0176, test_f1: 0.5614
 epoch: 94, train_loss: 0.4369, test_loss: 2.0795, test_f1: 0.5692
 epoch: 95, train_loss: 0.4546, test_loss: 2.0225, test_f1: 0.5661
 epoch: 96, train_loss: 0.4577, test_loss: 2.0704, test_f1: 0.5577
 epoch: 97, train_loss: 0.4349, test_loss: 2.0109, test_f1: 0.5553
 epoch: 98, train_loss: 0.4603, test_loss: 2.0606, test_f1: 0.5607
 epoch: 99, train_loss: 0.4507, test_loss: 2.3530, test_f1: 0.5497
##################ITERATION #5 ****************************************
 epoch: 0, train_loss: 1.2717, test_loss: 1.2838, test_f1: 0.3677
 epoch: 1, train_loss: 1.1784, test_loss: 1.2484, test_f1: 0.4760
 epoch: 2, train_loss: 1.1142, test_loss: 1.2251, test_f1: 0.4708
 epoch: 3, train_loss: 1.0932, test_loss: 1.1747, test_f1: 0.4991
 epoch: 4, train_loss: 1.0615, test_loss: 1.1783, test_f1: 0.5031
 epoch: 5, train_loss: 1.0413, test_loss: 1.1618, test_f1: 0.5287
 epoch: 6, train_loss: 1.0333, test_loss: 1.1624, test_f1: 0.5245
 epoch: 7, train_loss: 0.9841, test_loss: 1.1542, test_f1: 0.5727
 epoch: 8, train_loss: 0.9834, test_loss: 1.1414, test_f1: 0.5177
 epoch: 9, train_loss: 0.9624, test_loss: 1.1239, test_f1: 0.5608
 epoch: 10, train_loss: 0.9485, test_loss: 1.2012, test_f1: 0.5602
 epoch: 11, train_loss: 0.9351, test_loss: 1.1510, test_f1: 0.5321
 epoch: 12, train_loss: 0.9265, test_loss: 1.1392, test_f1: 0.5509
 epoch: 13, train_loss: 0.8997, test_loss: 1.1477, test_f1: 0.5464
 epoch: 14, train_loss: 0.8830, test_loss: 1.1668, test_f1: 0.5131
 epoch: 15, train_loss: 0.8735, test_loss: 1.1460, test_f1: 0.5481
 epoch: 16, train_loss: 0.8757, test_loss: 1.1542, test_f1: 0.5368
 epoch: 17, train_loss: 0.8783, test_loss: 1.1164, test_f1: 0.5343
 epoch: 18, train_loss: 0.8713, test_loss: 1.1273, test_f1: 0.5913
 epoch: 19, train_loss: 0.8344, test_loss: 1.1269, test_f1: 0.5753
 epoch: 20, train_loss: 0.8470, test_loss: 1.1438, test_f1: 0.5786
 epoch: 21, train_loss: 0.8144, test_loss: 1.1907, test_f1: 0.5517
 epoch: 22, train_loss: 0.8151, test_loss: 1.1090, test_f1: 0.6142
 epoch: 23, train_loss: 0.8000, test_loss: 1.1339, test_f1: 0.5838
 epoch: 24, train_loss: 0.7967, test_loss: 1.0951, test_f1: 0.5699
 epoch: 25, train_loss: 0.8047, test_loss: 1.1730, test_f1: 0.5572
 epoch: 26, train_loss: 0.7845, test_loss: 1.0682, test_f1: 0.6122
 epoch: 27, train_loss: 0.7916, test_loss: 1.1146, test_f1: 0.6115
 epoch: 28, train_loss: 0.7861, test_loss: 1.1524, test_f1: 0.5881
 epoch: 29, train_loss: 0.7695, test_loss: 1.1769, test_f1: 0.5672
 epoch: 30, train_loss: 0.7616, test_loss: 1.1757, test_f1: 0.6075
 epoch: 31, train_loss: 0.7699, test_loss: 1.1705, test_f1: 0.5546
 epoch: 32, train_loss: 0.7503, test_loss: 1.2213, test_f1: 0.5606
 epoch: 33, train_loss: 0.7509, test_loss: 1.2811, test_f1: 0.5313
 epoch: 34, train_loss: 0.7217, test_loss: 1.2201, test_f1: 0.5743
 epoch: 35, train_loss: 0.7297, test_loss: 1.1897, test_f1: 0.5899
 epoch: 36, train_loss: 0.7245, test_loss: 1.2584, test_f1: 0.5460
 epoch: 37, train_loss: 0.6957, test_loss: 1.2749, test_f1: 0.5600
 epoch: 38, train_loss: 0.7049, test_loss: 1.2692, test_f1: 0.5614
 epoch: 39, train_loss: 0.7067, test_loss: 1.2064, test_f1: 0.5866
 epoch: 40, train_loss: 0.6932, test_loss: 1.2491, test_f1: 0.5930
 epoch: 41, train_loss: 0.6980, test_loss: 1.2186, test_f1: 0.6021
 epoch: 42, train_loss: 0.6894, test_loss: 1.2495, test_f1: 0.5929
 epoch: 43, train_loss: 0.6879, test_loss: 1.3086, test_f1: 0.5725
 epoch: 44, train_loss: 0.6647, test_loss: 1.2798, test_f1: 0.5832
 epoch: 45, train_loss: 0.6590, test_loss: 1.3347, test_f1: 0.5762
 epoch: 46, train_loss: 0.6839, test_loss: 1.4992, test_f1: 0.5711
 epoch: 47, train_loss: 0.6478, test_loss: 1.3580, test_f1: 0.5684
 epoch: 48, train_loss: 0.6523, test_loss: 1.3803, test_f1: 0.5592
 epoch: 49, train_loss: 0.6492, test_loss: 1.5155, test_f1: 0.5639
 epoch: 50, train_loss: 0.6508, test_loss: 1.6969, test_f1: 0.5768
 epoch: 51, train_loss: 0.6218, test_loss: 1.4911, test_f1: 0.5577
 epoch: 52, train_loss: 0.6108, test_loss: 1.4492, test_f1: 0.5659
 epoch: 53, train_loss: 0.6236, test_loss: 1.5377, test_f1: 0.5638
 epoch: 54, train_loss: 0.6115, test_loss: 1.4358, test_f1: 0.5738
 epoch: 55, train_loss: 0.5981, test_loss: 1.4904, test_f1: 0.5753
 epoch: 56, train_loss: 0.5976, test_loss: 1.5969, test_f1: 0.5626
 epoch: 57, train_loss: 0.6053, test_loss: 1.5251, test_f1: 0.5579
 epoch: 58, train_loss: 0.6034, test_loss: 1.4651, test_f1: 0.5721
 epoch: 59, train_loss: 0.6056, test_loss: 1.6176, test_f1: 0.5646
 epoch: 60, train_loss: 0.6145, test_loss: 1.5137, test_f1: 0.5916
 epoch: 61, train_loss: 0.5955, test_loss: 1.6427, test_f1: 0.5724
 epoch: 62, train_loss: 0.5867, test_loss: 1.5826, test_f1: 0.5680
 epoch: 63, train_loss: 0.5888, test_loss: 1.5862, test_f1: 0.5833
 epoch: 64, train_loss: 0.5894, test_loss: 1.6101, test_f1: 0.5588
 epoch: 65, train_loss: 0.5736, test_loss: 1.6149, test_f1: 0.5700
 epoch: 66, train_loss: 0.5899, test_loss: 1.7099, test_f1: 0.5852
 epoch: 67, train_loss: 0.5520, test_loss: 1.6450, test_f1: 0.5665
 epoch: 68, train_loss: 0.5601, test_loss: 1.6046, test_f1: 0.5784
 epoch: 69, train_loss: 0.5830, test_loss: 1.7085, test_f1: 0.5805
 epoch: 70, train_loss: 0.5596, test_loss: 1.6220, test_f1: 0.5793
 epoch: 71, train_loss: 0.5578, test_loss: 1.6769, test_f1: 0.5678
 epoch: 72, train_loss: 0.5496, test_loss: 1.8867, test_f1: 0.5601
 epoch: 73, train_loss: 0.5598, test_loss: 1.6680, test_f1: 0.5783
 epoch: 74, train_loss: 0.5799, test_loss: 1.7225, test_f1: 0.5638
 epoch: 75, train_loss: 0.5425, test_loss: 1.6195, test_f1: 0.5707
 epoch: 76, train_loss: 0.5392, test_loss: 1.7993, test_f1: 0.5580
 epoch: 77, train_loss: 0.5405, test_loss: 1.6309, test_f1: 0.5806
 epoch: 78, train_loss: 0.5421, test_loss: 1.6904, test_f1: 0.5742
 epoch: 79, train_loss: 0.5404, test_loss: 1.8234, test_f1: 0.5835
 epoch: 80, train_loss: 0.5278, test_loss: 1.7952, test_f1: 0.5828
 epoch: 81, train_loss: 0.5329, test_loss: 1.7607, test_f1: 0.5740
 epoch: 82, train_loss: 0.5392, test_loss: 1.6273, test_f1: 0.5873
 epoch: 83, train_loss: 0.5258, test_loss: 1.8634, test_f1: 0.5880
 epoch: 84, train_loss: 0.5213, test_loss: 1.8222, test_f1: 0.5657
 epoch: 85, train_loss: 0.5539, test_loss: 1.7030, test_f1: 0.5877
 epoch: 86, train_loss: 0.5260, test_loss: 1.8057, test_f1: 0.5913
 epoch: 87, train_loss: 0.5151, test_loss: 1.7281, test_f1: 0.5944
 epoch: 88, train_loss: 0.5008, test_loss: 1.5875, test_f1: 0.5934
 epoch: 89, train_loss: 0.5120, test_loss: 1.8568, test_f1: 0.5789
 epoch: 90, train_loss: 0.5293, test_loss: 1.9333, test_f1: 0.5777
 epoch: 91, train_loss: 0.5199, test_loss: 1.8850, test_f1: 0.5887
 epoch: 92, train_loss: 0.5068, test_loss: 1.8406, test_f1: 0.5766
 epoch: 93, train_loss: 0.4842, test_loss: 1.8650, test_f1: 0.5772
 epoch: 94, train_loss: 0.5051, test_loss: 1.7864, test_f1: 0.5966
 epoch: 95, train_loss: 0.5111, test_loss: 1.7856, test_f1: 0.5964
 epoch: 96, train_loss: 0.5137, test_loss: 1.9667, test_f1: 0.5748
 epoch: 97, train_loss: 0.4983, test_loss: 1.7982, test_f1: 0.5894
 epoch: 98, train_loss: 0.4977, test_loss: 1.8985, test_f1: 0.5862
 epoch: 99, train_loss: 0.5064, test_loss: 1.9283, test_f1: 0.5876
##################ITERATION #6 ****************************************
 epoch: 0, train_loss: 1.2999, test_loss: 1.2842, test_f1: 0.3704
 epoch: 1, train_loss: 1.1309, test_loss: 1.1994, test_f1: 0.4690
 epoch: 2, train_loss: 1.1191, test_loss: 1.1784, test_f1: 0.4989
 epoch: 3, train_loss: 1.0806, test_loss: 1.1661, test_f1: 0.5062
 epoch: 4, train_loss: 1.0530, test_loss: 1.1471, test_f1: 0.4902
 epoch: 5, train_loss: 1.0161, test_loss: 1.1448, test_f1: 0.5239
 epoch: 6, train_loss: 1.0068, test_loss: 1.1089, test_f1: 0.5217
 epoch: 7, train_loss: 1.0163, test_loss: 1.1161, test_f1: 0.5207
 epoch: 8, train_loss: 0.9898, test_loss: 1.1252, test_f1: 0.4944
 epoch: 9, train_loss: 0.9553, test_loss: 1.1315, test_f1: 0.5012
 epoch: 10, train_loss: 0.9618, test_loss: 1.1692, test_f1: 0.5373
 epoch: 11, train_loss: 0.9392, test_loss: 1.1353, test_f1: 0.5577
 epoch: 12, train_loss: 0.9240, test_loss: 1.1578, test_f1: 0.5319
 epoch: 13, train_loss: 0.8989, test_loss: 1.0963, test_f1: 0.5649
 epoch: 14, train_loss: 0.9125, test_loss: 1.1086, test_f1: 0.5693
 epoch: 15, train_loss: 0.9010, test_loss: 1.1117, test_f1: 0.5693
 epoch: 16, train_loss: 0.8690, test_loss: 1.1020, test_f1: 0.5394
 epoch: 17, train_loss: 0.8608, test_loss: 1.1803, test_f1: 0.5485
 epoch: 18, train_loss: 0.8481, test_loss: 1.1137, test_f1: 0.5504
 epoch: 19, train_loss: 0.8405, test_loss: 1.1527, test_f1: 0.5334
 epoch: 20, train_loss: 0.8391, test_loss: 1.1859, test_f1: 0.5578
 epoch: 21, train_loss: 0.8178, test_loss: 1.1911, test_f1: 0.5531
 epoch: 22, train_loss: 0.8429, test_loss: 1.1994, test_f1: 0.5668
 epoch: 23, train_loss: 0.8376, test_loss: 1.1665, test_f1: 0.5345
 epoch: 24, train_loss: 0.8133, test_loss: 1.1015, test_f1: 0.5744
 epoch: 25, train_loss: 0.8032, test_loss: 1.1240, test_f1: 0.5742
 epoch: 26, train_loss: 0.7930, test_loss: 1.1356, test_f1: 0.5975
 epoch: 27, train_loss: 0.7827, test_loss: 1.0973, test_f1: 0.6000
 epoch: 28, train_loss: 0.7756, test_loss: 1.1617, test_f1: 0.6185
 epoch: 29, train_loss: 0.7958, test_loss: 1.2560, test_f1: 0.5772
 epoch: 30, train_loss: 0.7525, test_loss: 1.1056, test_f1: 0.6118
 epoch: 31, train_loss: 0.7528, test_loss: 1.1914, test_f1: 0.5680
 epoch: 32, train_loss: 0.7485, test_loss: 1.1368, test_f1: 0.6011
 epoch: 33, train_loss: 0.7325, test_loss: 1.1187, test_f1: 0.6070
 epoch: 34, train_loss: 0.7308, test_loss: 1.1967, test_f1: 0.5936
 epoch: 35, train_loss: 0.7348, test_loss: 1.2398, test_f1: 0.6005
 epoch: 36, train_loss: 0.7097, test_loss: 1.2356, test_f1: 0.5878
 epoch: 37, train_loss: 0.7010, test_loss: 1.2208, test_f1: 0.6186
 epoch: 38, train_loss: 0.7151, test_loss: 1.2250, test_f1: 0.6217
 epoch: 39, train_loss: 0.7136, test_loss: 1.3074, test_f1: 0.5635
 epoch: 40, train_loss: 0.6928, test_loss: 1.2251, test_f1: 0.5917
 epoch: 41, train_loss: 0.7011, test_loss: 1.3016, test_f1: 0.6122
 epoch: 42, train_loss: 0.6806, test_loss: 1.3165, test_f1: 0.5807
 epoch: 43, train_loss: 0.6892, test_loss: 1.2952, test_f1: 0.5904
 epoch: 44, train_loss: 0.6640, test_loss: 1.6321, test_f1: 0.6081
 epoch: 45, train_loss: 0.6589, test_loss: 1.4379, test_f1: 0.5681
 epoch: 46, train_loss: 0.6537, test_loss: 1.3195, test_f1: 0.5829
 epoch: 47, train_loss: 0.6743, test_loss: 1.2168, test_f1: 0.6048
 epoch: 48, train_loss: 0.6457, test_loss: 1.3295, test_f1: 0.6086
 epoch: 49, train_loss: 0.6334, test_loss: 1.3318, test_f1: 0.5753
 epoch: 50, train_loss: 0.6326, test_loss: 1.4495, test_f1: 0.6080
 epoch: 51, train_loss: 0.6282, test_loss: 1.4262, test_f1: 0.5822
 epoch: 52, train_loss: 0.6001, test_loss: 1.4462, test_f1: 0.5875
 epoch: 53, train_loss: 0.6091, test_loss: 1.4007, test_f1: 0.5845
 epoch: 54, train_loss: 0.5963, test_loss: 1.3983, test_f1: 0.5801
 epoch: 55, train_loss: 0.5966, test_loss: 1.4320, test_f1: 0.5631
 epoch: 56, train_loss: 0.5876, test_loss: 1.5421, test_f1: 0.5973
 epoch: 57, train_loss: 0.5987, test_loss: 1.4390, test_f1: 0.5674
 epoch: 58, train_loss: 0.5747, test_loss: 1.4466, test_f1: 0.5923
 epoch: 59, train_loss: 0.5939, test_loss: 1.4139, test_f1: 0.5999
 epoch: 60, train_loss: 0.5729, test_loss: 1.4554, test_f1: 0.5825
 epoch: 61, train_loss: 0.5850, test_loss: 1.4331, test_f1: 0.5775
 epoch: 62, train_loss: 0.5854, test_loss: 1.4357, test_f1: 0.5646
 epoch: 63, train_loss: 0.5642, test_loss: 1.4284, test_f1: 0.5971
 epoch: 64, train_loss: 0.5867, test_loss: 1.4475, test_f1: 0.6026
 epoch: 65, train_loss: 0.5573, test_loss: 1.4365, test_f1: 0.5750
 epoch: 66, train_loss: 0.5454, test_loss: 1.4853, test_f1: 0.5855
 epoch: 67, train_loss: 0.5366, test_loss: 1.4527, test_f1: 0.5793
 epoch: 68, train_loss: 0.5666, test_loss: 1.5162, test_f1: 0.5699
 epoch: 69, train_loss: 0.5677, test_loss: 1.4908, test_f1: 0.5837
 epoch: 70, train_loss: 0.5586, test_loss: 1.4882, test_f1: 0.5812
 epoch: 71, train_loss: 0.5378, test_loss: 1.4684, test_f1: 0.5913
 epoch: 72, train_loss: 0.5605, test_loss: 1.4629, test_f1: 0.5823
 epoch: 73, train_loss: 0.5676, test_loss: 1.4874, test_f1: 0.5899
 epoch: 74, train_loss: 0.5409, test_loss: 1.5989, test_f1: 0.5659
 epoch: 75, train_loss: 0.5546, test_loss: 1.5160, test_f1: 0.5601
 epoch: 76, train_loss: 0.5513, test_loss: 1.5580, test_f1: 0.5839
 epoch: 77, train_loss: 0.5318, test_loss: 1.5994, test_f1: 0.5903
 epoch: 78, train_loss: 0.5324, test_loss: 1.5342, test_f1: 0.5740
 epoch: 79, train_loss: 0.5324, test_loss: 1.6190, test_f1: 0.5658
 epoch: 80, train_loss: 0.5348, test_loss: 1.5613, test_f1: 0.5692
 epoch: 81, train_loss: 0.5241, test_loss: 1.5234, test_f1: 0.5915
 epoch: 82, train_loss: 0.5379, test_loss: 1.5813, test_f1: 0.5883
 epoch: 83, train_loss: 0.5029, test_loss: 1.6262, test_f1: 0.5763
 epoch: 84, train_loss: 0.5204, test_loss: 1.5646, test_f1: 0.5871
 epoch: 85, train_loss: 0.5291, test_loss: 1.5345, test_f1: 0.5758
 epoch: 86, train_loss: 0.5017, test_loss: 1.6338, test_f1: 0.5808
 epoch: 87, train_loss: 0.4994, test_loss: 1.6046, test_f1: 0.5739
 epoch: 88, train_loss: 0.5087, test_loss: 1.6129, test_f1: 0.5803
 epoch: 89, train_loss: 0.4920, test_loss: 1.6425, test_f1: 0.5819
 epoch: 90, train_loss: 0.5187, test_loss: 1.6672, test_f1: 0.6069
 epoch: 91, train_loss: 0.4852, test_loss: 1.6238, test_f1: 0.5896
 epoch: 92, train_loss: 0.5300, test_loss: 1.7427, test_f1: 0.5821
 epoch: 93, train_loss: 0.4867, test_loss: 1.6570, test_f1: 0.5843
 epoch: 94, train_loss: 0.4904, test_loss: 1.7216, test_f1: 0.5806
 epoch: 95, train_loss: 0.4694, test_loss: 1.7149, test_f1: 0.5950
 epoch: 96, train_loss: 0.4871, test_loss: 1.6406, test_f1: 0.5889
 epoch: 97, train_loss: 0.4889, test_loss: 1.7047, test_f1: 0.5858
 epoch: 98, train_loss: 0.4965, test_loss: 1.6802, test_f1: 0.5956
 epoch: 99, train_loss: 0.4870, test_loss: 1.7516, test_f1: 0.5871
##################ITERATION #7 ****************************************
 epoch: 0, train_loss: 1.3023, test_loss: 1.1995, test_f1: 0.4664
 epoch: 1, train_loss: 1.1282, test_loss: 1.1801, test_f1: 0.5251
 epoch: 2, train_loss: 1.1056, test_loss: 1.1696, test_f1: 0.5227
 epoch: 3, train_loss: 1.0609, test_loss: 1.1686, test_f1: 0.5298
 epoch: 4, train_loss: 1.0403, test_loss: 1.1462, test_f1: 0.5400
 epoch: 5, train_loss: 0.9821, test_loss: 1.1302, test_f1: 0.5503
 epoch: 6, train_loss: 0.9752, test_loss: 1.1289, test_f1: 0.5618
 epoch: 7, train_loss: 0.9615, test_loss: 1.1505, test_f1: 0.5495
 epoch: 8, train_loss: 0.9774, test_loss: 1.1390, test_f1: 0.5656
 epoch: 9, train_loss: 0.9320, test_loss: 1.1324, test_f1: 0.5880
 epoch: 10, train_loss: 0.9125, test_loss: 1.1460, test_f1: 0.5826
 epoch: 11, train_loss: 0.9199, test_loss: 1.1399, test_f1: 0.5801
 epoch: 12, train_loss: 0.8985, test_loss: 1.1276, test_f1: 0.5749
 epoch: 13, train_loss: 0.8846, test_loss: 1.1348, test_f1: 0.5753
 epoch: 14, train_loss: 0.8728, test_loss: 1.1450, test_f1: 0.5710
 epoch: 15, train_loss: 0.8630, test_loss: 1.1508, test_f1: 0.5914
 epoch: 16, train_loss: 0.8617, test_loss: 1.1525, test_f1: 0.5787
 epoch: 17, train_loss: 0.8570, test_loss: 1.1338, test_f1: 0.5993
 epoch: 18, train_loss: 0.8386, test_loss: 1.1807, test_f1: 0.5763
 epoch: 19, train_loss: 0.8230, test_loss: 1.1747, test_f1: 0.5765
 epoch: 20, train_loss: 0.8089, test_loss: 1.1971, test_f1: 0.5660
 epoch: 21, train_loss: 0.8108, test_loss: 1.1938, test_f1: 0.5613
 epoch: 22, train_loss: 0.7968, test_loss: 1.2226, test_f1: 0.5414
 epoch: 23, train_loss: 0.7886, test_loss: 1.1984, test_f1: 0.5861
 epoch: 24, train_loss: 0.7881, test_loss: 1.2643, test_f1: 0.5665
 epoch: 25, train_loss: 0.7906, test_loss: 1.2077, test_f1: 0.5689
 epoch: 26, train_loss: 0.7554, test_loss: 1.2084, test_f1: 0.5805
 epoch: 27, train_loss: 0.7623, test_loss: 1.2115, test_f1: 0.5884
 epoch: 28, train_loss: 0.7541, test_loss: 1.2267, test_f1: 0.5844
 epoch: 29, train_loss: 0.7527, test_loss: 1.2280, test_f1: 0.5743
 epoch: 30, train_loss: 0.7414, test_loss: 1.2757, test_f1: 0.5785
 epoch: 31, train_loss: 0.7209, test_loss: 1.2908, test_f1: 0.5969
 epoch: 32, train_loss: 0.7086, test_loss: 1.2575, test_f1: 0.5756
 epoch: 33, train_loss: 0.7272, test_loss: 1.3022, test_f1: 0.5623
 epoch: 34, train_loss: 0.7138, test_loss: 1.2991, test_f1: 0.5725
 epoch: 35, train_loss: 0.7039, test_loss: 1.3340, test_f1: 0.5797
 epoch: 36, train_loss: 0.7046, test_loss: 1.3462, test_f1: 0.5646
 epoch: 37, train_loss: 0.7006, test_loss: 1.3313, test_f1: 0.5720
 epoch: 38, train_loss: 0.6796, test_loss: 1.3636, test_f1: 0.5683
 epoch: 39, train_loss: 0.6597, test_loss: 1.3670, test_f1: 0.5849
 epoch: 40, train_loss: 0.6695, test_loss: 1.3102, test_f1: 0.5878
 epoch: 41, train_loss: 0.6720, test_loss: 1.3386, test_f1: 0.5733
 epoch: 42, train_loss: 0.6780, test_loss: 1.3434, test_f1: 0.5748
 epoch: 43, train_loss: 0.6455, test_loss: 1.3977, test_f1: 0.5906
 epoch: 44, train_loss: 0.6466, test_loss: 1.4389, test_f1: 0.5919
 epoch: 45, train_loss: 0.6253, test_loss: 1.5996, test_f1: 0.5829
 epoch: 46, train_loss: 0.6300, test_loss: 1.3861, test_f1: 0.6070
 epoch: 47, train_loss: 0.6349, test_loss: 1.4069, test_f1: 0.5526
 epoch: 48, train_loss: 0.6119, test_loss: 1.4065, test_f1: 0.5585
 epoch: 49, train_loss: 0.6146, test_loss: 1.4712, test_f1: 0.5966
 epoch: 50, train_loss: 0.6004, test_loss: 1.4896, test_f1: 0.5845
 epoch: 51, train_loss: 0.5908, test_loss: 1.5483, test_f1: 0.5789
 epoch: 52, train_loss: 0.5922, test_loss: 1.5219, test_f1: 0.5857
 epoch: 53, train_loss: 0.5760, test_loss: 1.5400, test_f1: 0.5698
 epoch: 54, train_loss: 0.5960, test_loss: 1.5376, test_f1: 0.5886
 epoch: 55, train_loss: 0.5724, test_loss: 1.6043, test_f1: 0.5827
 epoch: 56, train_loss: 0.5848, test_loss: 1.6117, test_f1: 0.5911
 epoch: 57, train_loss: 0.5577, test_loss: 1.5577, test_f1: 0.5805
 epoch: 58, train_loss: 0.5782, test_loss: 1.6073, test_f1: 0.5707
 epoch: 59, train_loss: 0.5741, test_loss: 1.5758, test_f1: 0.5968
 epoch: 60, train_loss: 0.5571, test_loss: 1.5769, test_f1: 0.5914
 epoch: 61, train_loss: 0.5643, test_loss: 1.5435, test_f1: 0.5996
 epoch: 62, train_loss: 0.5699, test_loss: 1.5798, test_f1: 0.5794
 epoch: 63, train_loss: 0.5635, test_loss: 1.6715, test_f1: 0.5701
 epoch: 64, train_loss: 0.5656, test_loss: 1.6060, test_f1: 0.5862
 epoch: 65, train_loss: 0.5410, test_loss: 1.6846, test_f1: 0.5992
 epoch: 66, train_loss: 0.5668, test_loss: 1.8199, test_f1: 0.5910
 epoch: 67, train_loss: 0.5339, test_loss: 1.7076, test_f1: 0.5751
 epoch: 68, train_loss: 0.5488, test_loss: 1.7094, test_f1: 0.5756
 epoch: 69, train_loss: 0.5326, test_loss: 1.7832, test_f1: 0.5722
 epoch: 70, train_loss: 0.5560, test_loss: 1.6687, test_f1: 0.5752
 epoch: 71, train_loss: 0.5270, test_loss: 1.7737, test_f1: 0.5862
 epoch: 72, train_loss: 0.5418, test_loss: 1.8160, test_f1: 0.5746
 epoch: 73, train_loss: 0.5246, test_loss: 1.8065, test_f1: 0.5651
 epoch: 74, train_loss: 0.5369, test_loss: 1.8100, test_f1: 0.5895
 epoch: 75, train_loss: 0.5319, test_loss: 1.7988, test_f1: 0.5727
 epoch: 76, train_loss: 0.5460, test_loss: 1.7654, test_f1: 0.5691
 epoch: 77, train_loss: 0.5225, test_loss: 1.8157, test_f1: 0.5801
 epoch: 78, train_loss: 0.5405, test_loss: 1.8635, test_f1: 0.5799
 epoch: 79, train_loss: 0.5308, test_loss: 1.7956, test_f1: 0.5912
 epoch: 80, train_loss: 0.5224, test_loss: 1.8431, test_f1: 0.5901
 epoch: 81, train_loss: 0.5248, test_loss: 1.8930, test_f1: 0.5828
 epoch: 82, train_loss: 0.5311, test_loss: 1.7986, test_f1: 0.5794
 epoch: 83, train_loss: 0.5108, test_loss: 1.9019, test_f1: 0.5894
 epoch: 84, train_loss: 0.5189, test_loss: 1.8388, test_f1: 0.5977
 epoch: 85, train_loss: 0.4980, test_loss: 1.9046, test_f1: 0.5876
 epoch: 86, train_loss: 0.4871, test_loss: 1.8648, test_f1: 0.5735
 epoch: 87, train_loss: 0.5169, test_loss: 1.9372, test_f1: 0.5785
 epoch: 88, train_loss: 0.5013, test_loss: 1.8561, test_f1: 0.5950
 epoch: 89, train_loss: 0.4968, test_loss: 1.8884, test_f1: 0.5781
 epoch: 90, train_loss: 0.4932, test_loss: 1.8545, test_f1: 0.5801
 epoch: 91, train_loss: 0.5252, test_loss: 2.0445, test_f1: 0.5673
 epoch: 92, train_loss: 0.5017, test_loss: 1.8550, test_f1: 0.5706
 epoch: 93, train_loss: 0.4775, test_loss: 1.8765, test_f1: 0.5910
 epoch: 94, train_loss: 0.4813, test_loss: 1.9088, test_f1: 0.5815
 epoch: 95, train_loss: 0.4810, test_loss: 1.8635, test_f1: 0.5693
 epoch: 96, train_loss: 0.4911, test_loss: 1.9324, test_f1: 0.6011
 epoch: 97, train_loss: 0.4682, test_loss: 1.9177, test_f1: 0.5881
 epoch: 98, train_loss: 0.4909, test_loss: 1.9919, test_f1: 0.5918
 epoch: 99, train_loss: 0.4831, test_loss: 1.8809, test_f1: 0.5597
##################ITERATION #8 ****************************************
 epoch: 0, train_loss: 1.3411, test_loss: 1.1780, test_f1: 0.4741
 epoch: 1, train_loss: 1.1723, test_loss: 1.2013, test_f1: 0.4836
 epoch: 2, train_loss: 1.1338, test_loss: 1.2573, test_f1: 0.4915
 epoch: 3, train_loss: 1.0960, test_loss: 1.2049, test_f1: 0.5007
 epoch: 4, train_loss: 1.0505, test_loss: 1.1440, test_f1: 0.5055
 epoch: 5, train_loss: 1.0498, test_loss: 1.1421, test_f1: 0.5412
 epoch: 6, train_loss: 1.0284, test_loss: 1.1440, test_f1: 0.5362
 epoch: 7, train_loss: 1.0063, test_loss: 1.1154, test_f1: 0.5687
 epoch: 8, train_loss: 0.9898, test_loss: 1.0853, test_f1: 0.5686
 epoch: 9, train_loss: 0.9781, test_loss: 1.1508, test_f1: 0.5667
 epoch: 10, train_loss: 0.9624, test_loss: 1.1271, test_f1: 0.5661
 epoch: 11, train_loss: 0.9268, test_loss: 1.0829, test_f1: 0.5648
 epoch: 12, train_loss: 0.9364, test_loss: 1.0698, test_f1: 0.5658
 epoch: 13, train_loss: 0.9180, test_loss: 1.0783, test_f1: 0.5500
 epoch: 14, train_loss: 0.8962, test_loss: 1.0721, test_f1: 0.5790
 epoch: 15, train_loss: 0.9016, test_loss: 1.1568, test_f1: 0.5290
 epoch: 16, train_loss: 0.8785, test_loss: 1.0614, test_f1: 0.5561
 epoch: 17, train_loss: 0.8548, test_loss: 1.0735, test_f1: 0.5578
 epoch: 18, train_loss: 0.8626, test_loss: 1.0784, test_f1: 0.5484
 epoch: 19, train_loss: 0.8371, test_loss: 1.1119, test_f1: 0.5790
 epoch: 20, train_loss: 0.8441, test_loss: 1.0674, test_f1: 0.5707
 epoch: 21, train_loss: 0.8431, test_loss: 1.0651, test_f1: 0.5317
 epoch: 22, train_loss: 0.8170, test_loss: 1.0622, test_f1: 0.5691
 epoch: 23, train_loss: 0.8216, test_loss: 1.1340, test_f1: 0.5280
 epoch: 24, train_loss: 0.8026, test_loss: 1.0939, test_f1: 0.5931
 epoch: 25, train_loss: 0.8000, test_loss: 1.0648, test_f1: 0.5595
 epoch: 26, train_loss: 0.7999, test_loss: 1.0515, test_f1: 0.5598
 epoch: 27, train_loss: 0.7939, test_loss: 1.0805, test_f1: 0.5599
 epoch: 28, train_loss: 0.7856, test_loss: 1.0469, test_f1: 0.5815
 epoch: 29, train_loss: 0.7720, test_loss: 1.0567, test_f1: 0.6056
 epoch: 30, train_loss: 0.7483, test_loss: 1.0762, test_f1: 0.5726
 epoch: 31, train_loss: 0.7538, test_loss: 1.1462, test_f1: 0.5532
 epoch: 32, train_loss: 0.7430, test_loss: 1.1716, test_f1: 0.5281
 epoch: 33, train_loss: 0.7386, test_loss: 1.1499, test_f1: 0.5945
 epoch: 34, train_loss: 0.7395, test_loss: 1.2037, test_f1: 0.5952
 epoch: 35, train_loss: 0.7436, test_loss: 1.1741, test_f1: 0.5787
 epoch: 36, train_loss: 0.7178, test_loss: 1.1972, test_f1: 0.5832
 epoch: 37, train_loss: 0.7097, test_loss: 1.1812, test_f1: 0.5666
 epoch: 38, train_loss: 0.7154, test_loss: 1.2525, test_f1: 0.5553
 epoch: 39, train_loss: 0.7109, test_loss: 1.1318, test_f1: 0.5998
 epoch: 40, train_loss: 0.7032, test_loss: 1.1477, test_f1: 0.5884
 epoch: 41, train_loss: 0.7004, test_loss: 1.2768, test_f1: 0.5948
 epoch: 42, train_loss: 0.6887, test_loss: 1.2625, test_f1: 0.5777
 epoch: 43, train_loss: 0.6859, test_loss: 1.2250, test_f1: 0.5878
 epoch: 44, train_loss: 0.6887, test_loss: 1.2290, test_f1: 0.5698
 epoch: 45, train_loss: 0.6749, test_loss: 1.2665, test_f1: 0.5932
 epoch: 46, train_loss: 0.6863, test_loss: 1.2816, test_f1: 0.5905
 epoch: 47, train_loss: 0.6729, test_loss: 1.2680, test_f1: 0.5813
 epoch: 48, train_loss: 0.6569, test_loss: 1.2662, test_f1: 0.5952
 epoch: 49, train_loss: 0.6512, test_loss: 1.2205, test_f1: 0.5948
 epoch: 50, train_loss: 0.6517, test_loss: 1.3647, test_f1: 0.5341
 epoch: 51, train_loss: 0.6551, test_loss: 1.2680, test_f1: 0.5670
 epoch: 52, train_loss: 0.6149, test_loss: 1.3056, test_f1: 0.5589
 epoch: 53, train_loss: 0.6213, test_loss: 1.2843, test_f1: 0.5770
 epoch: 54, train_loss: 0.6185, test_loss: 1.3363, test_f1: 0.5810
 epoch: 55, train_loss: 0.6245, test_loss: 1.3777, test_f1: 0.5785
 epoch: 56, train_loss: 0.6090, test_loss: 1.3371, test_f1: 0.5675
 epoch: 57, train_loss: 0.5927, test_loss: 1.3604, test_f1: 0.5792
 epoch: 58, train_loss: 0.5949, test_loss: 1.4132, test_f1: 0.5694
 epoch: 59, train_loss: 0.6033, test_loss: 1.4009, test_f1: 0.5685
 epoch: 60, train_loss: 0.6003, test_loss: 1.3386, test_f1: 0.5609
 epoch: 61, train_loss: 0.6120, test_loss: 1.4018, test_f1: 0.5701
 epoch: 62, train_loss: 0.5895, test_loss: 1.3195, test_f1: 0.5812
 epoch: 63, train_loss: 0.6045, test_loss: 1.4120, test_f1: 0.5671
 epoch: 64, train_loss: 0.5857, test_loss: 1.4511, test_f1: 0.5770
 epoch: 65, train_loss: 0.5913, test_loss: 1.4273, test_f1: 0.5675
 epoch: 66, train_loss: 0.5805, test_loss: 1.4861, test_f1: 0.5535
 epoch: 67, train_loss: 0.6094, test_loss: 1.4833, test_f1: 0.5688
 epoch: 68, train_loss: 0.5867, test_loss: 1.4436, test_f1: 0.5613
 epoch: 69, train_loss: 0.5752, test_loss: 1.4552, test_f1: 0.5830
 epoch: 70, train_loss: 0.5761, test_loss: 1.3924, test_f1: 0.5639
 epoch: 71, train_loss: 0.5601, test_loss: 1.4541, test_f1: 0.5625
 epoch: 72, train_loss: 0.5623, test_loss: 1.4816, test_f1: 0.5774
 epoch: 73, train_loss: 0.5450, test_loss: 1.6193, test_f1: 0.5507
 epoch: 74, train_loss: 0.5591, test_loss: 1.4606, test_f1: 0.5755
 epoch: 75, train_loss: 0.5824, test_loss: 1.4779, test_f1: 0.5516
 epoch: 76, train_loss: 0.5434, test_loss: 1.5184, test_f1: 0.5679
 epoch: 77, train_loss: 0.5266, test_loss: 1.4872, test_f1: 0.5636
 epoch: 78, train_loss: 0.5463, test_loss: 1.4644, test_f1: 0.5800
 epoch: 79, train_loss: 0.5648, test_loss: 1.5141, test_f1: 0.5590
 epoch: 80, train_loss: 0.5313, test_loss: 1.5071, test_f1: 0.5777
 epoch: 81, train_loss: 0.5546, test_loss: 1.5807, test_f1: 0.5744
 epoch: 82, train_loss: 0.5574, test_loss: 1.5157, test_f1: 0.5576
 epoch: 83, train_loss: 0.5440, test_loss: 1.5844, test_f1: 0.5643
 epoch: 84, train_loss: 0.5402, test_loss: 1.4861, test_f1: 0.5823
 epoch: 85, train_loss: 0.5483, test_loss: 1.4917, test_f1: 0.5845
 epoch: 86, train_loss: 0.5439, test_loss: 1.5782, test_f1: 0.5527
 epoch: 87, train_loss: 0.5301, test_loss: 1.5906, test_f1: 0.5656
 epoch: 88, train_loss: 0.5196, test_loss: 1.6625, test_f1: 0.5592
 epoch: 89, train_loss: 0.5209, test_loss: 1.5121, test_f1: 0.5787
 epoch: 90, train_loss: 0.5439, test_loss: 1.6553, test_f1: 0.5653
 epoch: 91, train_loss: 0.5250, test_loss: 1.5967, test_f1: 0.5577
 epoch: 92, train_loss: 0.5327, test_loss: 1.5798, test_f1: 0.5638
 epoch: 93, train_loss: 0.5281, test_loss: 1.5805, test_f1: 0.5700
 epoch: 94, train_loss: 0.5040, test_loss: 1.5935, test_f1: 0.5561
 epoch: 95, train_loss: 0.5215, test_loss: 1.6315, test_f1: 0.5429
 epoch: 96, train_loss: 0.5017, test_loss: 1.5690, test_f1: 0.5733
 epoch: 97, train_loss: 0.4874, test_loss: 1.7925, test_f1: 0.5560
 epoch: 98, train_loss: 0.5154, test_loss: 1.7343, test_f1: 0.5509
 epoch: 99, train_loss: 0.5081, test_loss: 1.6148, test_f1: 0.5700
##################ITERATION #9 ****************************************
 epoch: 0, train_loss: 1.3754, test_loss: 1.3028, test_f1: 0.4737
 epoch: 1, train_loss: 1.2192, test_loss: 1.2819, test_f1: 0.4762
 epoch: 2, train_loss: 1.1579, test_loss: 1.2997, test_f1: 0.5135
 epoch: 3, train_loss: 1.1026, test_loss: 1.2305, test_f1: 0.5155
 epoch: 4, train_loss: 1.0822, test_loss: 1.2042, test_f1: 0.5213
 epoch: 5, train_loss: 1.0387, test_loss: 1.2193, test_f1: 0.5044
 epoch: 6, train_loss: 1.0372, test_loss: 1.2046, test_f1: 0.5677
 epoch: 7, train_loss: 1.0322, test_loss: 1.2457, test_f1: 0.4900
 epoch: 8, train_loss: 0.9991, test_loss: 1.1876, test_f1: 0.5714
 epoch: 9, train_loss: 0.9626, test_loss: 1.2279, test_f1: 0.5394
 epoch: 10, train_loss: 0.9544, test_loss: 1.1839, test_f1: 0.5537
 epoch: 11, train_loss: 0.9302, test_loss: 1.2247, test_f1: 0.5432
 epoch: 12, train_loss: 0.9314, test_loss: 1.1778, test_f1: 0.5541
 epoch: 13, train_loss: 0.9144, test_loss: 1.2036, test_f1: 0.5586
 epoch: 14, train_loss: 0.9160, test_loss: 1.2298, test_f1: 0.5433
 epoch: 15, train_loss: 0.9185, test_loss: 1.2378, test_f1: 0.5443
 epoch: 16, train_loss: 0.8864, test_loss: 1.2140, test_f1: 0.5585
 epoch: 17, train_loss: 0.8757, test_loss: 1.1733, test_f1: 0.5598
 epoch: 18, train_loss: 0.8656, test_loss: 1.2057, test_f1: 0.5736
 epoch: 19, train_loss: 0.8549, test_loss: 1.2072, test_f1: 0.5542
 epoch: 20, train_loss: 0.8326, test_loss: 1.2124, test_f1: 0.5651
 epoch: 21, train_loss: 0.8318, test_loss: 1.1982, test_f1: 0.5801
 epoch: 22, train_loss: 0.8287, test_loss: 1.1914, test_f1: 0.5652
 epoch: 23, train_loss: 0.8184, test_loss: 1.2478, test_f1: 0.5340
 epoch: 24, train_loss: 0.7920, test_loss: 1.1889, test_f1: 0.5574
 epoch: 25, train_loss: 0.8143, test_loss: 1.1611, test_f1: 0.5755
 epoch: 26, train_loss: 0.7986, test_loss: 1.1672, test_f1: 0.5782
 epoch: 27, train_loss: 0.7924, test_loss: 1.1727, test_f1: 0.5812
 epoch: 28, train_loss: 0.7802, test_loss: 1.2645, test_f1: 0.5410
 epoch: 29, train_loss: 0.7981, test_loss: 1.2627, test_f1: 0.5625
 epoch: 30, train_loss: 0.7556, test_loss: 1.2419, test_f1: 0.5674
 epoch: 31, train_loss: 0.7598, test_loss: 1.2595, test_f1: 0.5832
 epoch: 32, train_loss: 0.7458, test_loss: 1.2377, test_f1: 0.5753
 epoch: 33, train_loss: 0.7494, test_loss: 1.1871, test_f1: 0.5811
 epoch: 34, train_loss: 0.7435, test_loss: 1.3177, test_f1: 0.5604
 epoch: 35, train_loss: 0.7440, test_loss: 1.2491, test_f1: 0.5761
 epoch: 36, train_loss: 0.7262, test_loss: 1.2712, test_f1: 0.5834
 epoch: 37, train_loss: 0.7113, test_loss: 1.2942, test_f1: 0.5623
 epoch: 38, train_loss: 0.7043, test_loss: 1.2908, test_f1: 0.5963
 epoch: 39, train_loss: 0.6986, test_loss: 1.3186, test_f1: 0.5995
 epoch: 40, train_loss: 0.6930, test_loss: 1.3411, test_f1: 0.5761
 epoch: 41, train_loss: 0.6848, test_loss: 1.3855, test_f1: 0.5719
 epoch: 42, train_loss: 0.6950, test_loss: 1.3379, test_f1: 0.6021
 epoch: 43, train_loss: 0.6686, test_loss: 1.4405, test_f1: 0.6021
 epoch: 44, train_loss: 0.6712, test_loss: 1.3441, test_f1: 0.5777
 epoch: 45, train_loss: 0.6591, test_loss: 1.3763, test_f1: 0.6061
 epoch: 46, train_loss: 0.6820, test_loss: 1.4746, test_f1: 0.5553
 epoch: 47, train_loss: 0.6377, test_loss: 1.4280, test_f1: 0.5775
 epoch: 48, train_loss: 0.6403, test_loss: 1.3264, test_f1: 0.5881
 epoch: 49, train_loss: 0.6319, test_loss: 1.4231, test_f1: 0.6000
 epoch: 50, train_loss: 0.6118, test_loss: 1.4004, test_f1: 0.5974
 epoch: 51, train_loss: 0.6133, test_loss: 1.4641, test_f1: 0.5928
 epoch: 52, train_loss: 0.6351, test_loss: 1.4485, test_f1: 0.5802
 epoch: 53, train_loss: 0.6053, test_loss: 1.4518, test_f1: 0.5873
 epoch: 54, train_loss: 0.5947, test_loss: 1.5248, test_f1: 0.5974
 epoch: 55, train_loss: 0.6065, test_loss: 1.4504, test_f1: 0.6035
 epoch: 56, train_loss: 0.6043, test_loss: 1.4602, test_f1: 0.5917
 epoch: 57, train_loss: 0.5997, test_loss: 1.4987, test_f1: 0.5903
 epoch: 58, train_loss: 0.5900, test_loss: 1.4923, test_f1: 0.6060
 epoch: 59, train_loss: 0.5661, test_loss: 1.5086, test_f1: 0.6066
 epoch: 60, train_loss: 0.5822, test_loss: 1.5456, test_f1: 0.6177
 epoch: 61, train_loss: 0.5732, test_loss: 1.5363, test_f1: 0.5948
 epoch: 62, train_loss: 0.5882, test_loss: 1.5541, test_f1: 0.6168
 epoch: 63, train_loss: 0.5884, test_loss: 1.5216, test_f1: 0.5916
 epoch: 64, train_loss: 0.5802, test_loss: 1.6105, test_f1: 0.5942
 epoch: 65, train_loss: 0.5914, test_loss: 1.5793, test_f1: 0.6071
 epoch: 66, train_loss: 0.5640, test_loss: 1.5964, test_f1: 0.6256
 epoch: 67, train_loss: 0.5734, test_loss: 1.5568, test_f1: 0.6197
 epoch: 68, train_loss: 0.5625, test_loss: 1.6187, test_f1: 0.6006
 epoch: 69, train_loss: 0.5542, test_loss: 1.5244, test_f1: 0.6023
 epoch: 70, train_loss: 0.5667, test_loss: 1.4918, test_f1: 0.6186
 epoch: 71, train_loss: 0.5699, test_loss: 1.5236, test_f1: 0.6091
 epoch: 72, train_loss: 0.5502, test_loss: 1.5370, test_f1: 0.6009
 epoch: 73, train_loss: 0.5436, test_loss: 1.5466, test_f1: 0.6230
 epoch: 74, train_loss: 0.5528, test_loss: 1.5513, test_f1: 0.6188
 epoch: 75, train_loss: 0.5490, test_loss: 1.5525, test_f1: 0.6124
 epoch: 76, train_loss: 0.5606, test_loss: 1.5494, test_f1: 0.6109
 epoch: 77, train_loss: 0.5450, test_loss: 1.6053, test_f1: 0.5944
 epoch: 78, train_loss: 0.5256, test_loss: 1.5812, test_f1: 0.6034
 epoch: 79, train_loss: 0.5335, test_loss: 1.6510, test_f1: 0.6103
 epoch: 80, train_loss: 0.5404, test_loss: 1.6295, test_f1: 0.5855
 epoch: 81, train_loss: 0.5347, test_loss: 1.6373, test_f1: 0.6046
 epoch: 82, train_loss: 0.5325, test_loss: 1.7024, test_f1: 0.6192
 epoch: 83, train_loss: 0.5517, test_loss: 1.6677, test_f1: 0.5950
 epoch: 84, train_loss: 0.5431, test_loss: 1.7115, test_f1: 0.5882
 epoch: 85, train_loss: 0.5260, test_loss: 1.6750, test_f1: 0.6077
 epoch: 86, train_loss: 0.5206, test_loss: 1.7392, test_f1: 0.5927
 epoch: 87, train_loss: 0.5182, test_loss: 1.7068, test_f1: 0.6154
 epoch: 88, train_loss: 0.5361, test_loss: 1.6770, test_f1: 0.6143
 epoch: 89, train_loss: 0.5205, test_loss: 1.6813, test_f1: 0.6010
 epoch: 90, train_loss: 0.5182, test_loss: 1.7256, test_f1: 0.5985
 epoch: 91, train_loss: 0.5244, test_loss: 1.6044, test_f1: 0.6092
 epoch: 92, train_loss: 0.4934, test_loss: 1.6806, test_f1: 0.5836
 epoch: 93, train_loss: 0.4913, test_loss: 1.7640, test_f1: 0.6213
 epoch: 94, train_loss: 0.5074, test_loss: 1.7249, test_f1: 0.5980
 epoch: 95, train_loss: 0.4859, test_loss: 1.8191, test_f1: 0.5805
 epoch: 96, train_loss: 0.5013, test_loss: 1.7400, test_f1: 0.5871
 epoch: 97, train_loss: 0.5058, test_loss: 1.6888, test_f1: 0.5902
 epoch: 98, train_loss: 0.4995, test_loss: 1.7061, test_f1: 0.5904
 epoch: 99, train_loss: 0.4930, test_loss: 1.7244, test_f1: 0.6123

Training completed in 499.14 seconds
Best F1: 0.6619 at epoch 28
Mean F1 across iterations: 0.6210  0.0187
========================FINAL RESULTS================================
FEGIN weighted F1: 0.6619  0.0187
python main.py --data ltspice_demos --representation component_component --model FEGIN --layers 2 --hiddens 128 --batch_size 32 --lr 0.0001 --emb_size 250 --epochs 100 --save_appendix component_component_L2_H128_BS32_LR0.0001_E250 --no_val
-----



STDERR:
  File "main.py", line 370, in <module>
    main()
  File "main.py", line 254, in main
    dataset = dataset_class(
  File "/home/philip/projects/ltspice_examples_code_repo/Circuit-Completion-Using-GNNs/component_classification_with_link_prediction_head/evaluation/FEGIN/kernel/circuit_datasets.py", line 15, in __init__
    self.data, self.slices = torch.load(self.processed_paths[0])
  File "/home/philip/.local/lib/python3.8/site-packages/torch/serialization.py", line 1040, in load
    warnings.warn(
  File "/usr/lib/python3.8/warnings.py", line 109, in _showwarnmsg
    sw(msg.message, msg.category, msg.filename, msg.lineno,
  File "main.py", line 47, in warn_with_traceback
    traceback.print_stack(file=log)
/home/philip/projects/ltspice_examples_code_repo/Circuit-Completion-Using-GNNs/component_classification_with_link_prediction_head/evaluation/FEGIN/kernel/circuit_datasets.py:15: FutureWarning: You are using `torch.load` with `weights_only=False` (the current default value), which uses the default pickle module implicitly. It is possible to construct malicious pickle data which will execute arbitrary code during unpickling (See https://github.com/pytorch/pytorch/blob/main/SECURITY.md#untrusted-models for more details). In a future release, the default value for `weights_only` will be flipped to `True`. This limits the functions that could be executed during unpickling. Arbitrary objects will no longer be allowed to be loaded via this mode unless they are explicitly allowlisted by the user via `torch.serialization.add_safe_globals`. We recommend you start setting `weights_only=True` for any use case where you don't have full control of the loaded file. Please open an issue on GitHub for any issues related to this experimental feature.
  self.data, self.slices = torch.load(self.processed_paths[0])
