STDOUT:
Results will be saved in /home/philip/projects/ltspice_examples_code_repo/Circuit-Completion-Using-GNNs/component_classification_with_link_prediction_head/evaluation/FEGIN/results/model_FEGIN_dataset_ltspice_examples
Command line input: python main.py --data ltspice_examples --representation component_component --model FEGIN --layers 5 --hiddens 16 --batch_size 128 --lr 0.001 --emb_size 128 --epochs 100 --save_appendix component_component_L5_H16_BS128_LR0.001_E128 --no_val
 is saved.
-----
ltspice_examples - FEGIN
Using 5 layers, 16 hidden units, h = 2
Loading component_component representation dataset
Loading component_component representation data...
Loaded 4401 examples (component_component)
saving path: data/processed/ltspice_examples_component_component_processed.pt
ENTERED
Training FEGIN on component_component representation
Train: 3556, Test: 845
##################ITERATION #0 ****************************************
 epoch: 0, train_loss: 1.3935, test_loss: 1.3672, test_f1: 0.2220
 epoch: 1, train_loss: 1.3381, test_loss: 1.3261, test_f1: 0.2274
 epoch: 2, train_loss: 1.3094, test_loss: 1.3078, test_f1: 0.2274
 epoch: 3, train_loss: 1.2909, test_loss: 1.2885, test_f1: 0.2274
 epoch: 4, train_loss: 1.2759, test_loss: 1.2705, test_f1: 0.2274
 epoch: 5, train_loss: 1.2626, test_loss: 1.2535, test_f1: 0.2274
 epoch: 6, train_loss: 1.2518, test_loss: 1.2402, test_f1: 0.2274
 epoch: 7, train_loss: 1.2410, test_loss: 1.2253, test_f1: 0.2274
 epoch: 8, train_loss: 1.2332, test_loss: 1.2090, test_f1: 0.2274
 epoch: 9, train_loss: 1.2132, test_loss: 1.1939, test_f1: 0.2957
 epoch: 10, train_loss: 1.2077, test_loss: 1.1753, test_f1: 0.4122
 epoch: 11, train_loss: 1.1935, test_loss: 1.1668, test_f1: 0.4286
 epoch: 12, train_loss: 1.1778, test_loss: 1.1453, test_f1: 0.4342
 epoch: 13, train_loss: 1.1738, test_loss: 1.1389, test_f1: 0.4394
 epoch: 14, train_loss: 1.1736, test_loss: 1.1352, test_f1: 0.4411
 epoch: 15, train_loss: 1.1578, test_loss: 1.1264, test_f1: 0.4372
 epoch: 16, train_loss: 1.1491, test_loss: 1.1096, test_f1: 0.4509
 epoch: 17, train_loss: 1.1385, test_loss: 1.1092, test_f1: 0.4353
 epoch: 18, train_loss: 1.1268, test_loss: 1.1035, test_f1: 0.4425
 epoch: 19, train_loss: 1.1180, test_loss: 1.0803, test_f1: 0.4680
 epoch: 20, train_loss: 1.1211, test_loss: 1.0850, test_f1: 0.4483
 epoch: 21, train_loss: 1.1092, test_loss: 1.0830, test_f1: 0.4559
 epoch: 22, train_loss: 1.1051, test_loss: 1.0720, test_f1: 0.4546
 epoch: 23, train_loss: 1.0926, test_loss: 1.0784, test_f1: 0.4696
 epoch: 24, train_loss: 1.0898, test_loss: 1.0580, test_f1: 0.4757
 epoch: 25, train_loss: 1.0899, test_loss: 1.0634, test_f1: 0.4570
 epoch: 26, train_loss: 1.0677, test_loss: 1.0517, test_f1: 0.4703
 epoch: 27, train_loss: 1.0736, test_loss: 1.0397, test_f1: 0.4914
 epoch: 28, train_loss: 1.0666, test_loss: 1.0616, test_f1: 0.4596
 epoch: 29, train_loss: 1.0549, test_loss: 1.0330, test_f1: 0.4823
 epoch: 30, train_loss: 1.0568, test_loss: 1.0595, test_f1: 0.4448
 epoch: 31, train_loss: 1.0379, test_loss: 1.0524, test_f1: 0.4543
 epoch: 32, train_loss: 1.0331, test_loss: 1.0347, test_f1: 0.4977
 epoch: 33, train_loss: 1.0250, test_loss: 1.0455, test_f1: 0.4558
 epoch: 34, train_loss: 1.0282, test_loss: 1.0390, test_f1: 0.4689
 epoch: 35, train_loss: 1.0165, test_loss: 1.0519, test_f1: 0.4513
 epoch: 36, train_loss: 1.0180, test_loss: 1.0547, test_f1: 0.4732
 epoch: 37, train_loss: 1.0193, test_loss: 1.0306, test_f1: 0.4698
 epoch: 38, train_loss: 1.0081, test_loss: 1.0478, test_f1: 0.4484
 epoch: 39, train_loss: 1.0073, test_loss: 1.0553, test_f1: 0.4586
 epoch: 40, train_loss: 0.9945, test_loss: 1.0486, test_f1: 0.4483
 epoch: 41, train_loss: 0.9783, test_loss: 1.0314, test_f1: 0.4619
 epoch: 42, train_loss: 0.9982, test_loss: 1.0412, test_f1: 0.4847
 epoch: 43, train_loss: 0.9865, test_loss: 1.0440, test_f1: 0.4765
 epoch: 44, train_loss: 0.9898, test_loss: 1.0567, test_f1: 0.4506
 epoch: 45, train_loss: 0.9808, test_loss: 1.0425, test_f1: 0.4779
 epoch: 46, train_loss: 0.9625, test_loss: 1.0418, test_f1: 0.4540
 epoch: 47, train_loss: 0.9647, test_loss: 1.0647, test_f1: 0.4704
 epoch: 48, train_loss: 0.9728, test_loss: 1.0564, test_f1: 0.4820
 epoch: 49, train_loss: 0.9566, test_loss: 1.0403, test_f1: 0.5007
 epoch: 50, train_loss: 0.9528, test_loss: 1.0928, test_f1: 0.4858
 epoch: 51, train_loss: 0.9489, test_loss: 1.0714, test_f1: 0.4623
 epoch: 52, train_loss: 0.9390, test_loss: 1.0676, test_f1: 0.4870
 epoch: 53, train_loss: 0.9445, test_loss: 1.0392, test_f1: 0.5008
 epoch: 54, train_loss: 0.9360, test_loss: 1.0455, test_f1: 0.4787
 epoch: 55, train_loss: 0.9447, test_loss: 1.0368, test_f1: 0.4770
 epoch: 56, train_loss: 0.9317, test_loss: 1.0774, test_f1: 0.4748
 epoch: 57, train_loss: 0.9357, test_loss: 1.0494, test_f1: 0.4713
 epoch: 58, train_loss: 0.9314, test_loss: 1.0392, test_f1: 0.4796
 epoch: 59, train_loss: 0.9186, test_loss: 1.0431, test_f1: 0.5071
 epoch: 60, train_loss: 0.9222, test_loss: 1.0995, test_f1: 0.4615
 epoch: 61, train_loss: 0.9282, test_loss: 1.0510, test_f1: 0.4783
 epoch: 62, train_loss: 0.9062, test_loss: 1.0625, test_f1: 0.4724
 epoch: 63, train_loss: 0.9174, test_loss: 1.0568, test_f1: 0.4795
 epoch: 64, train_loss: 0.9208, test_loss: 1.0522, test_f1: 0.4935
 epoch: 65, train_loss: 0.9232, test_loss: 1.0673, test_f1: 0.4681
 epoch: 66, train_loss: 0.9143, test_loss: 1.0702, test_f1: 0.4824
 epoch: 67, train_loss: 0.9081, test_loss: 1.0875, test_f1: 0.4891
 epoch: 68, train_loss: 0.9070, test_loss: 1.0588, test_f1: 0.4613
 epoch: 69, train_loss: 0.9132, test_loss: 1.1141, test_f1: 0.4705
 epoch: 70, train_loss: 0.8958, test_loss: 1.0998, test_f1: 0.4645
 epoch: 71, train_loss: 0.9020, test_loss: 1.0508, test_f1: 0.4902
 epoch: 72, train_loss: 0.9125, test_loss: 1.0348, test_f1: 0.4955
 epoch: 73, train_loss: 0.8983, test_loss: 1.0859, test_f1: 0.4613
 epoch: 74, train_loss: 0.9010, test_loss: 1.0595, test_f1: 0.4927
 epoch: 75, train_loss: 0.8899, test_loss: 1.1093, test_f1: 0.4675
 epoch: 76, train_loss: 0.9121, test_loss: 1.0642, test_f1: 0.4626
 epoch: 77, train_loss: 0.9025, test_loss: 1.0949, test_f1: 0.4570
 epoch: 78, train_loss: 0.8992, test_loss: 1.0990, test_f1: 0.4616
 epoch: 79, train_loss: 0.8926, test_loss: 1.0788, test_f1: 0.4672
 epoch: 80, train_loss: 0.8967, test_loss: 1.0652, test_f1: 0.5000
 epoch: 81, train_loss: 0.8968, test_loss: 1.0390, test_f1: 0.4984
 epoch: 82, train_loss: 0.8946, test_loss: 1.1685, test_f1: 0.4657
 epoch: 83, train_loss: 0.9010, test_loss: 1.0726, test_f1: 0.4528
 epoch: 84, train_loss: 0.8752, test_loss: 1.0807, test_f1: 0.4690
 epoch: 85, train_loss: 0.8787, test_loss: 1.1556, test_f1: 0.4727
 epoch: 86, train_loss: 0.8872, test_loss: 1.0925, test_f1: 0.4653
 epoch: 87, train_loss: 0.8832, test_loss: 1.1177, test_f1: 0.4674
 epoch: 88, train_loss: 0.8820, test_loss: 1.1128, test_f1: 0.4655
 epoch: 89, train_loss: 0.8894, test_loss: 1.0484, test_f1: 0.4902
 epoch: 90, train_loss: 0.8813, test_loss: 1.0988, test_f1: 0.4696
 epoch: 91, train_loss: 0.8804, test_loss: 1.1090, test_f1: 0.4651
 epoch: 92, train_loss: 0.8802, test_loss: 1.0879, test_f1: 0.4721
 epoch: 93, train_loss: 0.8660, test_loss: 1.0591, test_f1: 0.4889
 epoch: 94, train_loss: 0.8697, test_loss: 1.1432, test_f1: 0.4774
 epoch: 95, train_loss: 0.8725, test_loss: 1.1072, test_f1: 0.4735
 epoch: 96, train_loss: 0.8767, test_loss: 1.0881, test_f1: 0.4760
 epoch: 97, train_loss: 0.8809, test_loss: 1.0982, test_f1: 0.4644
 epoch: 98, train_loss: 0.8656, test_loss: 1.0865, test_f1: 0.4703
 epoch: 99, train_loss: 0.8721, test_loss: 1.1479, test_f1: 0.4766
##################ITERATION #1 ****************************************
 epoch: 0, train_loss: 1.3322, test_loss: 1.3085, test_f1: 0.2274
 epoch: 1, train_loss: 1.2850, test_loss: 1.2923, test_f1: 0.2274
 epoch: 2, train_loss: 1.2725, test_loss: 1.2537, test_f1: 0.2343
 epoch: 3, train_loss: 1.2525, test_loss: 1.2270, test_f1: 0.2687
 epoch: 4, train_loss: 1.2481, test_loss: 1.2144, test_f1: 0.2939
 epoch: 5, train_loss: 1.2352, test_loss: 1.1943, test_f1: 0.2927
 epoch: 6, train_loss: 1.2235, test_loss: 1.1904, test_f1: 0.3178
 epoch: 7, train_loss: 1.2149, test_loss: 1.1868, test_f1: 0.3411
 epoch: 8, train_loss: 1.2123, test_loss: 1.1889, test_f1: 0.3676
 epoch: 9, train_loss: 1.2035, test_loss: 1.1721, test_f1: 0.3977
 epoch: 10, train_loss: 1.1997, test_loss: 1.1612, test_f1: 0.3869
 epoch: 11, train_loss: 1.1865, test_loss: 1.1559, test_f1: 0.4156
 epoch: 12, train_loss: 1.1741, test_loss: 1.1582, test_f1: 0.3929
 epoch: 13, train_loss: 1.1658, test_loss: 1.1324, test_f1: 0.4076
 epoch: 14, train_loss: 1.1559, test_loss: 1.1312, test_f1: 0.4052
 epoch: 15, train_loss: 1.1476, test_loss: 1.1284, test_f1: 0.4072
 epoch: 16, train_loss: 1.1390, test_loss: 1.1049, test_f1: 0.4123
 epoch: 17, train_loss: 1.1290, test_loss: 1.1058, test_f1: 0.4134
 epoch: 18, train_loss: 1.1281, test_loss: 1.1202, test_f1: 0.3921
 epoch: 19, train_loss: 1.1241, test_loss: 1.1015, test_f1: 0.4188
 epoch: 20, train_loss: 1.1136, test_loss: 1.1279, test_f1: 0.4132
 epoch: 21, train_loss: 1.1070, test_loss: 1.0875, test_f1: 0.4307
 epoch: 22, train_loss: 1.0979, test_loss: 1.0901, test_f1: 0.4254
 epoch: 23, train_loss: 1.1029, test_loss: 1.0844, test_f1: 0.4207
 epoch: 24, train_loss: 1.0980, test_loss: 1.0754, test_f1: 0.4214
 epoch: 25, train_loss: 1.0931, test_loss: 1.0775, test_f1: 0.4432
 epoch: 26, train_loss: 1.0801, test_loss: 1.1075, test_f1: 0.4196
 epoch: 27, train_loss: 1.0880, test_loss: 1.1109, test_f1: 0.4135
 epoch: 28, train_loss: 1.0724, test_loss: 1.0643, test_f1: 0.4408
 epoch: 29, train_loss: 1.0667, test_loss: 1.0674, test_f1: 0.4438
 epoch: 30, train_loss: 1.0790, test_loss: 1.0515, test_f1: 0.4557
 epoch: 31, train_loss: 1.0770, test_loss: 1.0610, test_f1: 0.4242
 epoch: 32, train_loss: 1.0809, test_loss: 1.0575, test_f1: 0.4350
 epoch: 33, train_loss: 1.0593, test_loss: 1.0666, test_f1: 0.4061
 epoch: 34, train_loss: 1.0664, test_loss: 1.0628, test_f1: 0.4283
 epoch: 35, train_loss: 1.0566, test_loss: 1.0542, test_f1: 0.4268
 epoch: 36, train_loss: 1.0579, test_loss: 1.0632, test_f1: 0.4319
 epoch: 37, train_loss: 1.0594, test_loss: 1.0571, test_f1: 0.4357
 epoch: 38, train_loss: 1.0431, test_loss: 1.0604, test_f1: 0.4317
 epoch: 39, train_loss: 1.0384, test_loss: 1.0586, test_f1: 0.4292
 epoch: 40, train_loss: 1.0447, test_loss: 1.0725, test_f1: 0.4286
 epoch: 41, train_loss: 1.0496, test_loss: 1.0442, test_f1: 0.4453
 epoch: 42, train_loss: 1.0495, test_loss: 1.0650, test_f1: 0.4346
 epoch: 43, train_loss: 1.0363, test_loss: 1.0480, test_f1: 0.4452
 epoch: 44, train_loss: 1.0231, test_loss: 1.0443, test_f1: 0.4508
 epoch: 45, train_loss: 1.0199, test_loss: 1.0504, test_f1: 0.4455
 epoch: 46, train_loss: 1.0138, test_loss: 1.0661, test_f1: 0.4374
 epoch: 47, train_loss: 1.0188, test_loss: 1.0516, test_f1: 0.4523
 epoch: 48, train_loss: 1.0288, test_loss: 1.0564, test_f1: 0.4356
 epoch: 49, train_loss: 1.0226, test_loss: 1.0597, test_f1: 0.4305
 epoch: 50, train_loss: 1.0036, test_loss: 1.0358, test_f1: 0.4775
 epoch: 51, train_loss: 0.9955, test_loss: 1.0285, test_f1: 0.4679
 epoch: 52, train_loss: 0.9949, test_loss: 1.0466, test_f1: 0.4617
 epoch: 53, train_loss: 0.9959, test_loss: 1.0599, test_f1: 0.4445
 epoch: 54, train_loss: 0.9950, test_loss: 1.0450, test_f1: 0.4520
 epoch: 55, train_loss: 0.9969, test_loss: 1.0625, test_f1: 0.4496
 epoch: 56, train_loss: 0.9938, test_loss: 1.0991, test_f1: 0.4437
 epoch: 57, train_loss: 0.9893, test_loss: 1.0554, test_f1: 0.4565
 epoch: 58, train_loss: 0.9802, test_loss: 1.0451, test_f1: 0.4617
 epoch: 59, train_loss: 0.9887, test_loss: 1.0475, test_f1: 0.4560
 epoch: 60, train_loss: 0.9788, test_loss: 1.1096, test_f1: 0.4389
 epoch: 61, train_loss: 0.9821, test_loss: 1.0764, test_f1: 0.4388
 epoch: 62, train_loss: 0.9693, test_loss: 1.1165, test_f1: 0.4479
 epoch: 63, train_loss: 0.9670, test_loss: 1.0922, test_f1: 0.4376
 epoch: 64, train_loss: 0.9708, test_loss: 1.0825, test_f1: 0.4418
 epoch: 65, train_loss: 0.9766, test_loss: 1.0409, test_f1: 0.4629
 epoch: 66, train_loss: 0.9763, test_loss: 1.1192, test_f1: 0.4464
 epoch: 67, train_loss: 0.9695, test_loss: 1.0589, test_f1: 0.4717
 epoch: 68, train_loss: 0.9680, test_loss: 1.1474, test_f1: 0.4477
 epoch: 69, train_loss: 0.9772, test_loss: 1.0735, test_f1: 0.4607
 epoch: 70, train_loss: 0.9663, test_loss: 1.1381, test_f1: 0.4447
 epoch: 71, train_loss: 0.9569, test_loss: 1.0947, test_f1: 0.4492
 epoch: 72, train_loss: 0.9682, test_loss: 1.1075, test_f1: 0.4541
 epoch: 73, train_loss: 0.9747, test_loss: 1.1315, test_f1: 0.4509
 epoch: 74, train_loss: 0.9639, test_loss: 1.1172, test_f1: 0.4311
 epoch: 75, train_loss: 0.9708, test_loss: 1.0944, test_f1: 0.4345
 epoch: 76, train_loss: 0.9693, test_loss: 1.1272, test_f1: 0.4437
 epoch: 77, train_loss: 0.9607, test_loss: 1.1154, test_f1: 0.4439
 epoch: 78, train_loss: 0.9524, test_loss: 1.1327, test_f1: 0.4469
 epoch: 79, train_loss: 0.9579, test_loss: 1.0487, test_f1: 0.4619
 epoch: 80, train_loss: 0.9489, test_loss: 1.1241, test_f1: 0.4312
 epoch: 81, train_loss: 0.9576, test_loss: 1.1389, test_f1: 0.4313
 epoch: 82, train_loss: 0.9559, test_loss: 1.0887, test_f1: 0.4600
 epoch: 83, train_loss: 0.9417, test_loss: 1.0668, test_f1: 0.4671
 epoch: 84, train_loss: 0.9595, test_loss: 1.0420, test_f1: 0.4824
 epoch: 85, train_loss: 0.9460, test_loss: 1.0338, test_f1: 0.4844
 epoch: 86, train_loss: 0.9441, test_loss: 1.0712, test_f1: 0.4636
 epoch: 87, train_loss: 0.9539, test_loss: 1.0825, test_f1: 0.4594
 epoch: 88, train_loss: 0.9477, test_loss: 1.1127, test_f1: 0.4544
 epoch: 89, train_loss: 0.9385, test_loss: 1.0977, test_f1: 0.4608
 epoch: 90, train_loss: 0.9395, test_loss: 1.0814, test_f1: 0.4720
 epoch: 91, train_loss: 0.9437, test_loss: 1.0657, test_f1: 0.4695
 epoch: 92, train_loss: 0.9412, test_loss: 1.0242, test_f1: 0.4903
 epoch: 93, train_loss: 0.9370, test_loss: 1.0652, test_f1: 0.4541
 epoch: 94, train_loss: 0.9425, test_loss: 1.1054, test_f1: 0.4490
 epoch: 95, train_loss: 0.9467, test_loss: 1.1164, test_f1: 0.4560
 epoch: 96, train_loss: 0.9364, test_loss: 1.0931, test_f1: 0.4759
 epoch: 97, train_loss: 0.9311, test_loss: 1.1260, test_f1: 0.4656
 epoch: 98, train_loss: 0.9371, test_loss: 1.1291, test_f1: 0.4608
 epoch: 99, train_loss: 0.9245, test_loss: 1.0725, test_f1: 0.4769
##################ITERATION #2 ****************************************
 epoch: 0, train_loss: 1.3647, test_loss: 1.2989, test_f1: 0.2274
 epoch: 1, train_loss: 1.2755, test_loss: 1.2571, test_f1: 0.2555
 epoch: 2, train_loss: 1.2519, test_loss: 1.2294, test_f1: 0.2557
 epoch: 3, train_loss: 1.2375, test_loss: 1.2119, test_f1: 0.2695
 epoch: 4, train_loss: 1.2353, test_loss: 1.2090, test_f1: 0.2657
 epoch: 5, train_loss: 1.2265, test_loss: 1.2039, test_f1: 0.2768
 epoch: 6, train_loss: 1.2265, test_loss: 1.1971, test_f1: 0.2861
 epoch: 7, train_loss: 1.2186, test_loss: 1.1966, test_f1: 0.2885
 epoch: 8, train_loss: 1.2097, test_loss: 1.1938, test_f1: 0.2964
 epoch: 9, train_loss: 1.2014, test_loss: 1.1895, test_f1: 0.3143
 epoch: 10, train_loss: 1.1965, test_loss: 1.1985, test_f1: 0.3370
 epoch: 11, train_loss: 1.1927, test_loss: 1.1837, test_f1: 0.3316
 epoch: 12, train_loss: 1.1838, test_loss: 1.1694, test_f1: 0.3634
 epoch: 13, train_loss: 1.1810, test_loss: 1.1738, test_f1: 0.3444
 epoch: 14, train_loss: 1.1729, test_loss: 1.1759, test_f1: 0.3767
 epoch: 15, train_loss: 1.1723, test_loss: 1.1640, test_f1: 0.3914
 epoch: 16, train_loss: 1.1661, test_loss: 1.1551, test_f1: 0.3845
 epoch: 17, train_loss: 1.1455, test_loss: 1.1519, test_f1: 0.3784
 epoch: 18, train_loss: 1.1434, test_loss: 1.1399, test_f1: 0.3986
 epoch: 19, train_loss: 1.1417, test_loss: 1.1351, test_f1: 0.3984
 epoch: 20, train_loss: 1.1430, test_loss: 1.1255, test_f1: 0.4154
 epoch: 21, train_loss: 1.1277, test_loss: 1.1266, test_f1: 0.4075
 epoch: 22, train_loss: 1.1211, test_loss: 1.1175, test_f1: 0.4231
 epoch: 23, train_loss: 1.1168, test_loss: 1.1094, test_f1: 0.4323
 epoch: 24, train_loss: 1.1152, test_loss: 1.1196, test_f1: 0.4340
 epoch: 25, train_loss: 1.1073, test_loss: 1.1068, test_f1: 0.4227
 epoch: 26, train_loss: 1.0967, test_loss: 1.1006, test_f1: 0.4153
 epoch: 27, train_loss: 1.0954, test_loss: 1.0991, test_f1: 0.4339
 epoch: 28, train_loss: 1.0905, test_loss: 1.0967, test_f1: 0.4295
 epoch: 29, train_loss: 1.0882, test_loss: 1.0762, test_f1: 0.4413
 epoch: 30, train_loss: 1.0743, test_loss: 1.0812, test_f1: 0.4424
 epoch: 31, train_loss: 1.0731, test_loss: 1.0693, test_f1: 0.4443
 epoch: 32, train_loss: 1.0714, test_loss: 1.0687, test_f1: 0.4395
 epoch: 33, train_loss: 1.0709, test_loss: 1.0743, test_f1: 0.4434
 epoch: 34, train_loss: 1.0612, test_loss: 1.0599, test_f1: 0.4557
 epoch: 35, train_loss: 1.0567, test_loss: 1.0620, test_f1: 0.4623
 epoch: 36, train_loss: 1.0499, test_loss: 1.0451, test_f1: 0.4472
 epoch: 37, train_loss: 1.0488, test_loss: 1.0406, test_f1: 0.4521
 epoch: 38, train_loss: 1.0401, test_loss: 1.0463, test_f1: 0.4431
 epoch: 39, train_loss: 1.0428, test_loss: 1.0546, test_f1: 0.4460
 epoch: 40, train_loss: 1.0464, test_loss: 1.0450, test_f1: 0.4500
 epoch: 41, train_loss: 1.0290, test_loss: 1.0351, test_f1: 0.4652
 epoch: 42, train_loss: 1.0202, test_loss: 1.0479, test_f1: 0.4280
 epoch: 43, train_loss: 1.0268, test_loss: 1.0284, test_f1: 0.4520
 epoch: 44, train_loss: 1.0260, test_loss: 1.0298, test_f1: 0.4504
 epoch: 45, train_loss: 1.0235, test_loss: 1.0291, test_f1: 0.4580
 epoch: 46, train_loss: 1.0014, test_loss: 1.0499, test_f1: 0.4477
 epoch: 47, train_loss: 1.0200, test_loss: 1.0358, test_f1: 0.4355
 epoch: 48, train_loss: 1.0156, test_loss: 1.0398, test_f1: 0.4487
 epoch: 49, train_loss: 1.0149, test_loss: 1.0325, test_f1: 0.4532
 epoch: 50, train_loss: 1.0003, test_loss: 1.0404, test_f1: 0.4542
 epoch: 51, train_loss: 0.9943, test_loss: 1.0242, test_f1: 0.4419
 epoch: 52, train_loss: 0.9876, test_loss: 1.0622, test_f1: 0.4328
 epoch: 53, train_loss: 0.9782, test_loss: 1.0336, test_f1: 0.4501
 epoch: 54, train_loss: 0.9900, test_loss: 1.0197, test_f1: 0.4543
 epoch: 55, train_loss: 0.9895, test_loss: 1.0412, test_f1: 0.4474
 epoch: 56, train_loss: 0.9827, test_loss: 1.0400, test_f1: 0.4450
 epoch: 57, train_loss: 0.9804, test_loss: 1.0404, test_f1: 0.4487
 epoch: 58, train_loss: 0.9882, test_loss: 1.0302, test_f1: 0.4400
 epoch: 59, train_loss: 0.9793, test_loss: 1.0310, test_f1: 0.4425
 epoch: 60, train_loss: 0.9700, test_loss: 1.0505, test_f1: 0.4481
 epoch: 61, train_loss: 0.9792, test_loss: 1.0435, test_f1: 0.4517
 epoch: 62, train_loss: 0.9653, test_loss: 1.0317, test_f1: 0.4417
 epoch: 63, train_loss: 0.9848, test_loss: 1.0339, test_f1: 0.4513
 epoch: 64, train_loss: 0.9695, test_loss: 1.0462, test_f1: 0.4420
 epoch: 65, train_loss: 0.9582, test_loss: 1.0432, test_f1: 0.4482
 epoch: 66, train_loss: 0.9477, test_loss: 1.0612, test_f1: 0.4413
 epoch: 67, train_loss: 0.9698, test_loss: 1.0379, test_f1: 0.4530
 epoch: 68, train_loss: 0.9604, test_loss: 1.0433, test_f1: 0.4493
 epoch: 69, train_loss: 0.9555, test_loss: 1.0737, test_f1: 0.4352
 epoch: 70, train_loss: 0.9671, test_loss: 1.0510, test_f1: 0.4618
 epoch: 71, train_loss: 0.9760, test_loss: 1.0518, test_f1: 0.4348
 epoch: 72, train_loss: 0.9583, test_loss: 1.0536, test_f1: 0.4559
 epoch: 73, train_loss: 0.9507, test_loss: 1.0723, test_f1: 0.4554
 epoch: 74, train_loss: 0.9560, test_loss: 1.0735, test_f1: 0.4354
 epoch: 75, train_loss: 0.9551, test_loss: 1.0694, test_f1: 0.4482
 epoch: 76, train_loss: 0.9514, test_loss: 1.0734, test_f1: 0.4538
 epoch: 77, train_loss: 0.9696, test_loss: 1.0499, test_f1: 0.4560
 epoch: 78, train_loss: 0.9565, test_loss: 1.0465, test_f1: 0.4510
 epoch: 79, train_loss: 0.9545, test_loss: 1.0537, test_f1: 0.4601
 epoch: 80, train_loss: 0.9446, test_loss: 1.0634, test_f1: 0.4749
 epoch: 81, train_loss: 0.9477, test_loss: 1.0511, test_f1: 0.4778
 epoch: 82, train_loss: 0.9432, test_loss: 1.0553, test_f1: 0.4775
 epoch: 83, train_loss: 0.9414, test_loss: 1.0560, test_f1: 0.4834
 epoch: 84, train_loss: 0.9518, test_loss: 1.0750, test_f1: 0.4770
 epoch: 85, train_loss: 0.9509, test_loss: 1.0713, test_f1: 0.4575
 epoch: 86, train_loss: 0.9433, test_loss: 1.0499, test_f1: 0.4638
 epoch: 87, train_loss: 0.9303, test_loss: 1.0775, test_f1: 0.4550
 epoch: 88, train_loss: 0.9475, test_loss: 1.0775, test_f1: 0.4615
 epoch: 89, train_loss: 0.9337, test_loss: 1.0491, test_f1: 0.4762
 epoch: 90, train_loss: 0.9148, test_loss: 1.0846, test_f1: 0.4931
 epoch: 91, train_loss: 0.9373, test_loss: 1.0844, test_f1: 0.4629
 epoch: 92, train_loss: 0.9330, test_loss: 1.0701, test_f1: 0.4652
 epoch: 93, train_loss: 0.9231, test_loss: 1.0923, test_f1: 0.4759
 epoch: 94, train_loss: 0.9178, test_loss: 1.0681, test_f1: 0.4700
 epoch: 95, train_loss: 0.9218, test_loss: 1.0870, test_f1: 0.4624
 epoch: 96, train_loss: 0.9206, test_loss: 1.0778, test_f1: 0.4648
 epoch: 97, train_loss: 0.9233, test_loss: 1.0937, test_f1: 0.4746
 epoch: 98, train_loss: 0.9185, test_loss: 1.0687, test_f1: 0.4778
 epoch: 99, train_loss: 0.9155, test_loss: 1.0722, test_f1: 0.4772
##################ITERATION #3 ****************************************
 epoch: 0, train_loss: 1.4876, test_loss: 1.2955, test_f1: 0.2274
 epoch: 1, train_loss: 1.2964, test_loss: 1.2681, test_f1: 0.2276
 epoch: 2, train_loss: 1.2749, test_loss: 1.2478, test_f1: 0.2284
 epoch: 3, train_loss: 1.2542, test_loss: 1.2233, test_f1: 0.2826
 epoch: 4, train_loss: 1.2547, test_loss: 1.2198, test_f1: 0.2961
 epoch: 5, train_loss: 1.2418, test_loss: 1.2119, test_f1: 0.3228
 epoch: 6, train_loss: 1.2376, test_loss: 1.2056, test_f1: 0.3109
 epoch: 7, train_loss: 1.2267, test_loss: 1.1912, test_f1: 0.3391
 epoch: 8, train_loss: 1.2246, test_loss: 1.1840, test_f1: 0.3348
 epoch: 9, train_loss: 1.2162, test_loss: 1.1872, test_f1: 0.3562
 epoch: 10, train_loss: 1.2023, test_loss: 1.1604, test_f1: 0.3750
 epoch: 11, train_loss: 1.1900, test_loss: 1.1612, test_f1: 0.3812
 epoch: 12, train_loss: 1.1941, test_loss: 1.1633, test_f1: 0.3765
 epoch: 13, train_loss: 1.1808, test_loss: 1.1444, test_f1: 0.3748
 epoch: 14, train_loss: 1.1827, test_loss: 1.1278, test_f1: 0.3961
 epoch: 15, train_loss: 1.1795, test_loss: 1.1459, test_f1: 0.3817
 epoch: 16, train_loss: 1.1675, test_loss: 1.1314, test_f1: 0.3872
 epoch: 17, train_loss: 1.1600, test_loss: 1.1171, test_f1: 0.3944
 epoch: 18, train_loss: 1.1465, test_loss: 1.1001, test_f1: 0.4186
 epoch: 19, train_loss: 1.1447, test_loss: 1.0991, test_f1: 0.4134
 epoch: 20, train_loss: 1.1346, test_loss: 1.0821, test_f1: 0.4400
 epoch: 21, train_loss: 1.1384, test_loss: 1.0892, test_f1: 0.4186
 epoch: 22, train_loss: 1.1207, test_loss: 1.0652, test_f1: 0.4310
 epoch: 23, train_loss: 1.1214, test_loss: 1.0584, test_f1: 0.4467
 epoch: 24, train_loss: 1.1100, test_loss: 1.0699, test_f1: 0.4488
 epoch: 25, train_loss: 1.1065, test_loss: 1.0409, test_f1: 0.4530
 epoch: 26, train_loss: 1.1049, test_loss: 1.0360, test_f1: 0.4428
 epoch: 27, train_loss: 1.0931, test_loss: 1.0416, test_f1: 0.4472
 epoch: 28, train_loss: 1.0877, test_loss: 1.0490, test_f1: 0.4481
 epoch: 29, train_loss: 1.0754, test_loss: 1.0330, test_f1: 0.4337
 epoch: 30, train_loss: 1.0596, test_loss: 1.0182, test_f1: 0.4467
 epoch: 31, train_loss: 1.0582, test_loss: 1.0236, test_f1: 0.4549
 epoch: 32, train_loss: 1.0659, test_loss: 1.0216, test_f1: 0.4442
 epoch: 33, train_loss: 1.0503, test_loss: 1.0227, test_f1: 0.4522
 epoch: 34, train_loss: 1.0563, test_loss: 1.0162, test_f1: 0.4425
 epoch: 35, train_loss: 1.0420, test_loss: 1.0201, test_f1: 0.4353
 epoch: 36, train_loss: 1.0462, test_loss: 1.0162, test_f1: 0.4542
 epoch: 37, train_loss: 1.0419, test_loss: 1.0055, test_f1: 0.4536
 epoch: 38, train_loss: 1.0350, test_loss: 1.0060, test_f1: 0.4548
 epoch: 39, train_loss: 1.0342, test_loss: 1.0024, test_f1: 0.4498
 epoch: 40, train_loss: 1.0294, test_loss: 0.9955, test_f1: 0.4601
 epoch: 41, train_loss: 1.0171, test_loss: 1.0383, test_f1: 0.4541
 epoch: 42, train_loss: 1.0142, test_loss: 0.9857, test_f1: 0.4695
 epoch: 43, train_loss: 1.0095, test_loss: 1.0166, test_f1: 0.4470
 epoch: 44, train_loss: 1.0077, test_loss: 0.9936, test_f1: 0.4746
 epoch: 45, train_loss: 0.9952, test_loss: 0.9936, test_f1: 0.4591
 epoch: 46, train_loss: 0.9908, test_loss: 1.0415, test_f1: 0.4639
 epoch: 47, train_loss: 0.9869, test_loss: 1.0364, test_f1: 0.4513
 epoch: 48, train_loss: 0.9884, test_loss: 0.9884, test_f1: 0.4599
 epoch: 49, train_loss: 0.9860, test_loss: 0.9804, test_f1: 0.4714
 epoch: 50, train_loss: 0.9701, test_loss: 0.9944, test_f1: 0.4789
 epoch: 51, train_loss: 0.9673, test_loss: 0.9698, test_f1: 0.4708
 epoch: 52, train_loss: 0.9571, test_loss: 1.0249, test_f1: 0.4940
 epoch: 53, train_loss: 0.9666, test_loss: 0.9700, test_f1: 0.4770
 epoch: 54, train_loss: 0.9565, test_loss: 0.9960, test_f1: 0.4766
 epoch: 55, train_loss: 0.9498, test_loss: 0.9760, test_f1: 0.4830
 epoch: 56, train_loss: 0.9455, test_loss: 1.0038, test_f1: 0.4799
 epoch: 57, train_loss: 0.9572, test_loss: 0.9635, test_f1: 0.4800
 epoch: 58, train_loss: 0.9409, test_loss: 0.9700, test_f1: 0.4762
 epoch: 59, train_loss: 0.9481, test_loss: 0.9693, test_f1: 0.4867
 epoch: 60, train_loss: 0.9312, test_loss: 0.9937, test_f1: 0.4709
 epoch: 61, train_loss: 0.9400, test_loss: 0.9836, test_f1: 0.4762
 epoch: 62, train_loss: 0.9388, test_loss: 0.9670, test_f1: 0.4816
 epoch: 63, train_loss: 0.9449, test_loss: 1.0038, test_f1: 0.4741
 epoch: 64, train_loss: 0.9323, test_loss: 0.9813, test_f1: 0.4841
 epoch: 65, train_loss: 0.9293, test_loss: 0.9831, test_f1: 0.4879
 epoch: 66, train_loss: 0.9342, test_loss: 1.0025, test_f1: 0.5009
 epoch: 67, train_loss: 0.9362, test_loss: 0.9735, test_f1: 0.4779
 epoch: 68, train_loss: 0.9326, test_loss: 0.9870, test_f1: 0.4886
 epoch: 69, train_loss: 0.9268, test_loss: 0.9904, test_f1: 0.5109
 epoch: 70, train_loss: 0.9262, test_loss: 0.9524, test_f1: 0.4913
 epoch: 71, train_loss: 0.9222, test_loss: 0.9787, test_f1: 0.4825
 epoch: 72, train_loss: 0.9192, test_loss: 0.9734, test_f1: 0.4839
 epoch: 73, train_loss: 0.9205, test_loss: 1.0064, test_f1: 0.4871
 epoch: 74, train_loss: 0.9210, test_loss: 1.0083, test_f1: 0.4706
 epoch: 75, train_loss: 0.9117, test_loss: 0.9939, test_f1: 0.4761
 epoch: 76, train_loss: 0.9160, test_loss: 0.9965, test_f1: 0.4760
 epoch: 77, train_loss: 0.9042, test_loss: 0.9549, test_f1: 0.4924
 epoch: 78, train_loss: 0.9088, test_loss: 0.9595, test_f1: 0.4819
 epoch: 79, train_loss: 0.9085, test_loss: 0.9760, test_f1: 0.4848
 epoch: 80, train_loss: 0.9097, test_loss: 0.9883, test_f1: 0.4893
 epoch: 81, train_loss: 0.9089, test_loss: 0.9673, test_f1: 0.4853
 epoch: 82, train_loss: 0.9054, test_loss: 0.9808, test_f1: 0.4822
 epoch: 83, train_loss: 0.9045, test_loss: 0.9933, test_f1: 0.4754
 epoch: 84, train_loss: 0.9024, test_loss: 1.0062, test_f1: 0.4806
 epoch: 85, train_loss: 0.9103, test_loss: 1.0197, test_f1: 0.4795
 epoch: 86, train_loss: 0.9087, test_loss: 0.9959, test_f1: 0.4790
 epoch: 87, train_loss: 0.9004, test_loss: 0.9836, test_f1: 0.4751
 epoch: 88, train_loss: 0.8981, test_loss: 0.9848, test_f1: 0.4733
 epoch: 89, train_loss: 0.9043, test_loss: 0.9803, test_f1: 0.4744
 epoch: 90, train_loss: 0.8951, test_loss: 1.0167, test_f1: 0.4892
 epoch: 91, train_loss: 0.9025, test_loss: 0.9817, test_f1: 0.4813
 epoch: 92, train_loss: 0.8895, test_loss: 1.0419, test_f1: 0.4807
 epoch: 93, train_loss: 0.8928, test_loss: 0.9934, test_f1: 0.4760
 epoch: 94, train_loss: 0.8841, test_loss: 0.9950, test_f1: 0.4868
 epoch: 95, train_loss: 0.8837, test_loss: 1.0345, test_f1: 0.4803
 epoch: 96, train_loss: 0.8848, test_loss: 0.9927, test_f1: 0.4776
 epoch: 97, train_loss: 0.9023, test_loss: 1.0004, test_f1: 0.4809
 epoch: 98, train_loss: 0.8977, test_loss: 1.0009, test_f1: 0.4728
 epoch: 99, train_loss: 0.8802, test_loss: 1.0158, test_f1: 0.4798
##################ITERATION #4 ****************************************
 epoch: 0, train_loss: 1.3250, test_loss: 1.2689, test_f1: 0.2274
 epoch: 1, train_loss: 1.2580, test_loss: 1.2245, test_f1: 0.2860
 epoch: 2, train_loss: 1.2453, test_loss: 1.1908, test_f1: 0.3183
 epoch: 3, train_loss: 1.2171, test_loss: 1.1698, test_f1: 0.3682
 epoch: 4, train_loss: 1.2004, test_loss: 1.1534, test_f1: 0.3770
 epoch: 5, train_loss: 1.1867, test_loss: 1.1327, test_f1: 0.4194
 epoch: 6, train_loss: 1.1925, test_loss: 1.1207, test_f1: 0.4087
 epoch: 7, train_loss: 1.1596, test_loss: 1.1066, test_f1: 0.4212
 epoch: 8, train_loss: 1.1604, test_loss: 1.0927, test_f1: 0.4203
 epoch: 9, train_loss: 1.1392, test_loss: 1.0858, test_f1: 0.4258
 epoch: 10, train_loss: 1.1317, test_loss: 1.0753, test_f1: 0.4282
 epoch: 11, train_loss: 1.1341, test_loss: 1.0716, test_f1: 0.4392
 epoch: 12, train_loss: 1.1216, test_loss: 1.0657, test_f1: 0.4320
 epoch: 13, train_loss: 1.1062, test_loss: 1.0519, test_f1: 0.4431
 epoch: 14, train_loss: 1.1074, test_loss: 1.0428, test_f1: 0.4502
 epoch: 15, train_loss: 1.0923, test_loss: 1.0317, test_f1: 0.4473
 epoch: 16, train_loss: 1.0940, test_loss: 1.0194, test_f1: 0.4548
 epoch: 17, train_loss: 1.0722, test_loss: 1.0170, test_f1: 0.4775
 epoch: 18, train_loss: 1.0612, test_loss: 1.0130, test_f1: 0.4580
 epoch: 19, train_loss: 1.0576, test_loss: 1.0026, test_f1: 0.4523
 epoch: 20, train_loss: 1.0443, test_loss: 0.9870, test_f1: 0.4774
 epoch: 21, train_loss: 1.0401, test_loss: 0.9887, test_f1: 0.4513
 epoch: 22, train_loss: 1.0386, test_loss: 0.9847, test_f1: 0.4829
 epoch: 23, train_loss: 1.0290, test_loss: 0.9811, test_f1: 0.4525
 epoch: 24, train_loss: 1.0363, test_loss: 0.9880, test_f1: 0.4499
 epoch: 25, train_loss: 1.0269, test_loss: 0.9708, test_f1: 0.4654
 epoch: 26, train_loss: 1.0262, test_loss: 0.9780, test_f1: 0.4591
 epoch: 27, train_loss: 1.0066, test_loss: 0.9591, test_f1: 0.4763
 epoch: 28, train_loss: 1.0233, test_loss: 0.9633, test_f1: 0.4898
 epoch: 29, train_loss: 1.0138, test_loss: 0.9602, test_f1: 0.4688
 epoch: 30, train_loss: 1.0002, test_loss: 0.9521, test_f1: 0.4771
 epoch: 31, train_loss: 0.9899, test_loss: 0.9554, test_f1: 0.4597
 epoch: 32, train_loss: 0.9901, test_loss: 0.9530, test_f1: 0.4853
 epoch: 33, train_loss: 0.9822, test_loss: 0.9320, test_f1: 0.5025
 epoch: 34, train_loss: 0.9746, test_loss: 0.9349, test_f1: 0.4741
 epoch: 35, train_loss: 0.9840, test_loss: 0.9293, test_f1: 0.4932
 epoch: 36, train_loss: 0.9696, test_loss: 0.9468, test_f1: 0.4861
 epoch: 37, train_loss: 0.9823, test_loss: 0.9234, test_f1: 0.4943
 epoch: 38, train_loss: 0.9708, test_loss: 0.9385, test_f1: 0.4957
 epoch: 39, train_loss: 0.9631, test_loss: 0.9329, test_f1: 0.5031
 epoch: 40, train_loss: 0.9558, test_loss: 0.9227, test_f1: 0.4873
 epoch: 41, train_loss: 0.9533, test_loss: 0.9325, test_f1: 0.4935
 epoch: 42, train_loss: 0.9471, test_loss: 0.9350, test_f1: 0.4873
 epoch: 43, train_loss: 0.9470, test_loss: 0.9155, test_f1: 0.5256
 epoch: 44, train_loss: 0.9441, test_loss: 0.9438, test_f1: 0.5002
 epoch: 45, train_loss: 0.9431, test_loss: 0.9130, test_f1: 0.4826
 epoch: 46, train_loss: 0.9431, test_loss: 0.9060, test_f1: 0.4947
 epoch: 47, train_loss: 0.9299, test_loss: 0.9308, test_f1: 0.4858
 epoch: 48, train_loss: 0.9400, test_loss: 0.9379, test_f1: 0.4790
 epoch: 49, train_loss: 0.9340, test_loss: 0.8949, test_f1: 0.4918
 epoch: 50, train_loss: 0.9501, test_loss: 0.9067, test_f1: 0.4879
 epoch: 51, train_loss: 0.9241, test_loss: 0.9116, test_f1: 0.5300
 epoch: 52, train_loss: 0.9129, test_loss: 0.9074, test_f1: 0.5184
 epoch: 53, train_loss: 0.9183, test_loss: 0.8979, test_f1: 0.5084
 epoch: 54, train_loss: 0.9111, test_loss: 0.9067, test_f1: 0.5013
 epoch: 55, train_loss: 0.9136, test_loss: 0.9013, test_f1: 0.4902
 epoch: 56, train_loss: 0.9123, test_loss: 0.9010, test_f1: 0.4984
 epoch: 57, train_loss: 0.9002, test_loss: 0.9049, test_f1: 0.5237
 epoch: 58, train_loss: 0.9212, test_loss: 0.9075, test_f1: 0.5183
 epoch: 59, train_loss: 0.8959, test_loss: 0.9048, test_f1: 0.5315
 epoch: 60, train_loss: 0.9104, test_loss: 0.8797, test_f1: 0.5313
 epoch: 61, train_loss: 0.9016, test_loss: 0.9056, test_f1: 0.4942
 epoch: 62, train_loss: 0.9117, test_loss: 0.8937, test_f1: 0.5288
 epoch: 63, train_loss: 0.8972, test_loss: 0.9105, test_f1: 0.5027
 epoch: 64, train_loss: 0.8870, test_loss: 0.8908, test_f1: 0.5074
 epoch: 65, train_loss: 0.8820, test_loss: 0.8954, test_f1: 0.5439
 epoch: 66, train_loss: 0.8945, test_loss: 0.8968, test_f1: 0.5403
 epoch: 67, train_loss: 0.8929, test_loss: 0.8872, test_f1: 0.5372
 epoch: 68, train_loss: 0.8891, test_loss: 0.8928, test_f1: 0.5364
 epoch: 69, train_loss: 0.8890, test_loss: 0.8914, test_f1: 0.5181
 epoch: 70, train_loss: 0.8940, test_loss: 0.9009, test_f1: 0.5355
 epoch: 71, train_loss: 0.8972, test_loss: 0.8877, test_f1: 0.5113
 epoch: 72, train_loss: 0.8882, test_loss: 0.8802, test_f1: 0.5137
 epoch: 73, train_loss: 0.8797, test_loss: 0.8785, test_f1: 0.5156
 epoch: 74, train_loss: 0.8820, test_loss: 0.8876, test_f1: 0.5101
 epoch: 75, train_loss: 0.8862, test_loss: 0.8885, test_f1: 0.5023
 epoch: 76, train_loss: 0.8718, test_loss: 0.8865, test_f1: 0.5146
 epoch: 77, train_loss: 0.8837, test_loss: 0.8868, test_f1: 0.5124
 epoch: 78, train_loss: 0.8801, test_loss: 0.9117, test_f1: 0.5087
 epoch: 79, train_loss: 0.8805, test_loss: 0.8687, test_f1: 0.5083
 epoch: 80, train_loss: 0.8808, test_loss: 0.8932, test_f1: 0.5045
 epoch: 81, train_loss: 0.8721, test_loss: 0.8919, test_f1: 0.5101
 epoch: 82, train_loss: 0.8741, test_loss: 0.8916, test_f1: 0.5070
 epoch: 83, train_loss: 0.8822, test_loss: 0.8862, test_f1: 0.5095
 epoch: 84, train_loss: 0.8718, test_loss: 0.8879, test_f1: 0.5061
 epoch: 85, train_loss: 0.8711, test_loss: 0.8971, test_f1: 0.5049
 epoch: 86, train_loss: 0.8683, test_loss: 0.8934, test_f1: 0.5072
 epoch: 87, train_loss: 0.8630, test_loss: 0.8927, test_f1: 0.5066
 epoch: 88, train_loss: 0.8630, test_loss: 0.8832, test_f1: 0.5066
 epoch: 89, train_loss: 0.8466, test_loss: 0.8968, test_f1: 0.5000
 epoch: 90, train_loss: 0.8642, test_loss: 0.8798, test_f1: 0.5151
 epoch: 91, train_loss: 0.8621, test_loss: 0.8909, test_f1: 0.4924
 epoch: 92, train_loss: 0.8606, test_loss: 0.8974, test_f1: 0.5201
 epoch: 93, train_loss: 0.8613, test_loss: 0.8890, test_f1: 0.5059
 epoch: 94, train_loss: 0.8605, test_loss: 0.8949, test_f1: 0.5113
 epoch: 95, train_loss: 0.8624, test_loss: 0.9093, test_f1: 0.4772
 epoch: 96, train_loss: 0.8706, test_loss: 0.9002, test_f1: 0.4796
 epoch: 97, train_loss: 0.8618, test_loss: 0.9025, test_f1: 0.5088
 epoch: 98, train_loss: 0.8527, test_loss: 0.9036, test_f1: 0.5056
 epoch: 99, train_loss: 0.8657, test_loss: 0.9012, test_f1: 0.5282
##################ITERATION #5 ****************************************
 epoch: 0, train_loss: 1.4091, test_loss: 1.2855, test_f1: 0.2625
 epoch: 1, train_loss: 1.3056, test_loss: 1.2369, test_f1: 0.2972
 epoch: 2, train_loss: 1.2606, test_loss: 1.2074, test_f1: 0.3120
 epoch: 3, train_loss: 1.2410, test_loss: 1.1924, test_f1: 0.3172
 epoch: 4, train_loss: 1.2340, test_loss: 1.1812, test_f1: 0.3215
 epoch: 5, train_loss: 1.2187, test_loss: 1.1650, test_f1: 0.3331
 epoch: 6, train_loss: 1.2117, test_loss: 1.1593, test_f1: 0.3423
 epoch: 7, train_loss: 1.2082, test_loss: 1.1482, test_f1: 0.3647
 epoch: 8, train_loss: 1.1886, test_loss: 1.1366, test_f1: 0.3822
 epoch: 9, train_loss: 1.1859, test_loss: 1.1285, test_f1: 0.3820
 epoch: 10, train_loss: 1.1777, test_loss: 1.1277, test_f1: 0.3966
 epoch: 11, train_loss: 1.1704, test_loss: 1.1170, test_f1: 0.4130
 epoch: 12, train_loss: 1.1659, test_loss: 1.1071, test_f1: 0.4303
 epoch: 13, train_loss: 1.1564, test_loss: 1.0949, test_f1: 0.4244
 epoch: 14, train_loss: 1.1504, test_loss: 1.0913, test_f1: 0.4303
 epoch: 15, train_loss: 1.1467, test_loss: 1.0860, test_f1: 0.4474
 epoch: 16, train_loss: 1.1336, test_loss: 1.0659, test_f1: 0.4689
 epoch: 17, train_loss: 1.1262, test_loss: 1.0583, test_f1: 0.4703
 epoch: 18, train_loss: 1.1235, test_loss: 1.0394, test_f1: 0.4958
 epoch: 19, train_loss: 1.1082, test_loss: 1.0334, test_f1: 0.4693
 epoch: 20, train_loss: 1.1188, test_loss: 1.0229, test_f1: 0.4887
 epoch: 21, train_loss: 1.0968, test_loss: 1.0220, test_f1: 0.4875
 epoch: 22, train_loss: 1.1012, test_loss: 1.0225, test_f1: 0.4616
 epoch: 23, train_loss: 1.0933, test_loss: 1.0128, test_f1: 0.4787
 epoch: 24, train_loss: 1.0887, test_loss: 0.9943, test_f1: 0.4710
 epoch: 25, train_loss: 1.0785, test_loss: 0.9952, test_f1: 0.4625
 epoch: 26, train_loss: 1.0863, test_loss: 1.0000, test_f1: 0.4933
 epoch: 27, train_loss: 1.0682, test_loss: 0.9854, test_f1: 0.4779
 epoch: 28, train_loss: 1.0560, test_loss: 0.9832, test_f1: 0.4590
 epoch: 29, train_loss: 1.0545, test_loss: 0.9773, test_f1: 0.4815
 epoch: 30, train_loss: 1.0563, test_loss: 0.9669, test_f1: 0.4751
 epoch: 31, train_loss: 1.0397, test_loss: 0.9607, test_f1: 0.4837
 epoch: 32, train_loss: 1.0371, test_loss: 0.9558, test_f1: 0.4886
 epoch: 33, train_loss: 1.0357, test_loss: 0.9540, test_f1: 0.4968
 epoch: 34, train_loss: 1.0247, test_loss: 0.9398, test_f1: 0.4955
 epoch: 35, train_loss: 1.0290, test_loss: 0.9608, test_f1: 0.4685
 epoch: 36, train_loss: 1.0078, test_loss: 0.9369, test_f1: 0.4775
 epoch: 37, train_loss: 1.0169, test_loss: 0.9298, test_f1: 0.4924
 epoch: 38, train_loss: 1.0102, test_loss: 0.9545, test_f1: 0.4753
 epoch: 39, train_loss: 1.0119, test_loss: 0.9199, test_f1: 0.4848
 epoch: 40, train_loss: 1.0026, test_loss: 0.9328, test_f1: 0.4899
 epoch: 41, train_loss: 0.9902, test_loss: 0.9526, test_f1: 0.4651
 epoch: 42, train_loss: 0.9954, test_loss: 0.9166, test_f1: 0.4995
 epoch: 43, train_loss: 0.9886, test_loss: 0.9232, test_f1: 0.4791
 epoch: 44, train_loss: 0.9872, test_loss: 0.9057, test_f1: 0.4847
 epoch: 45, train_loss: 0.9874, test_loss: 0.9163, test_f1: 0.5020
 epoch: 46, train_loss: 0.9790, test_loss: 0.9137, test_f1: 0.5163
 epoch: 47, train_loss: 0.9706, test_loss: 0.9150, test_f1: 0.5035
 epoch: 48, train_loss: 0.9688, test_loss: 0.8987, test_f1: 0.5048
 epoch: 49, train_loss: 0.9597, test_loss: 0.9127, test_f1: 0.5108
 epoch: 50, train_loss: 0.9679, test_loss: 0.9089, test_f1: 0.5076
 epoch: 51, train_loss: 0.9483, test_loss: 0.9055, test_f1: 0.5104
 epoch: 52, train_loss: 0.9426, test_loss: 0.9051, test_f1: 0.4991
 epoch: 53, train_loss: 0.9510, test_loss: 0.9078, test_f1: 0.4940
 epoch: 54, train_loss: 0.9460, test_loss: 0.9083, test_f1: 0.5008
 epoch: 55, train_loss: 0.9483, test_loss: 0.8816, test_f1: 0.5138
 epoch: 56, train_loss: 0.9513, test_loss: 0.8904, test_f1: 0.5167
 epoch: 57, train_loss: 0.9416, test_loss: 0.8883, test_f1: 0.5024
 epoch: 58, train_loss: 0.9428, test_loss: 0.9002, test_f1: 0.5115
 epoch: 59, train_loss: 0.9386, test_loss: 0.9067, test_f1: 0.5013
 epoch: 60, train_loss: 0.9356, test_loss: 0.9004, test_f1: 0.5140
 epoch: 61, train_loss: 0.9380, test_loss: 0.8940, test_f1: 0.5026
 epoch: 62, train_loss: 0.9373, test_loss: 0.8979, test_f1: 0.5095
 epoch: 63, train_loss: 0.9358, test_loss: 0.9003, test_f1: 0.5097
 epoch: 64, train_loss: 0.9312, test_loss: 0.9132, test_f1: 0.5110
 epoch: 65, train_loss: 0.9214, test_loss: 0.8948, test_f1: 0.5133
 epoch: 66, train_loss: 0.9326, test_loss: 0.8943, test_f1: 0.5233
 epoch: 67, train_loss: 0.9318, test_loss: 0.9011, test_f1: 0.5087
 epoch: 68, train_loss: 0.9263, test_loss: 0.8960, test_f1: 0.5099
 epoch: 69, train_loss: 0.9267, test_loss: 0.8955, test_f1: 0.5231
 epoch: 70, train_loss: 0.9248, test_loss: 0.8881, test_f1: 0.5232
 epoch: 71, train_loss: 0.9238, test_loss: 0.9001, test_f1: 0.5071
 epoch: 72, train_loss: 0.9211, test_loss: 0.8979, test_f1: 0.5170
 epoch: 73, train_loss: 0.9204, test_loss: 0.8906, test_f1: 0.5292
 epoch: 74, train_loss: 0.9112, test_loss: 0.9000, test_f1: 0.5303
 epoch: 75, train_loss: 0.9148, test_loss: 0.9046, test_f1: 0.5111
 epoch: 76, train_loss: 0.9233, test_loss: 0.9039, test_f1: 0.5086
 epoch: 77, train_loss: 0.9109, test_loss: 0.8912, test_f1: 0.5111
 epoch: 78, train_loss: 0.9099, test_loss: 0.9039, test_f1: 0.5093
 epoch: 79, train_loss: 0.9073, test_loss: 0.9010, test_f1: 0.5137
 epoch: 80, train_loss: 0.9096, test_loss: 0.8984, test_f1: 0.5120
 epoch: 81, train_loss: 0.9136, test_loss: 0.8912, test_f1: 0.5323
 epoch: 82, train_loss: 0.9088, test_loss: 0.8866, test_f1: 0.5117
 epoch: 83, train_loss: 0.8950, test_loss: 0.9031, test_f1: 0.5204
 epoch: 84, train_loss: 0.9056, test_loss: 0.9055, test_f1: 0.5192
 epoch: 85, train_loss: 0.9062, test_loss: 0.8807, test_f1: 0.5217
 epoch: 86, train_loss: 0.9152, test_loss: 0.8728, test_f1: 0.5278
 epoch: 87, train_loss: 0.9009, test_loss: 0.8755, test_f1: 0.5209
 epoch: 88, train_loss: 0.9000, test_loss: 0.8845, test_f1: 0.5258
 epoch: 89, train_loss: 0.8967, test_loss: 0.8746, test_f1: 0.5375
 epoch: 90, train_loss: 0.8972, test_loss: 0.8901, test_f1: 0.5130
 epoch: 91, train_loss: 0.8939, test_loss: 0.8820, test_f1: 0.5190
 epoch: 92, train_loss: 0.8847, test_loss: 0.8804, test_f1: 0.5301
 epoch: 93, train_loss: 0.8951, test_loss: 0.8983, test_f1: 0.5237
 epoch: 94, train_loss: 0.9049, test_loss: 0.9041, test_f1: 0.5200
 epoch: 95, train_loss: 0.8916, test_loss: 0.8892, test_f1: 0.5121
 epoch: 96, train_loss: 0.8881, test_loss: 0.8826, test_f1: 0.5298
 epoch: 97, train_loss: 0.8833, test_loss: 0.8911, test_f1: 0.5043
 epoch: 98, train_loss: 0.8860, test_loss: 0.9025, test_f1: 0.5231
 epoch: 99, train_loss: 0.8874, test_loss: 0.8879, test_f1: 0.5343
##################ITERATION #6 ****************************************
 epoch: 0, train_loss: 1.3868, test_loss: 1.3072, test_f1: 0.2274
 epoch: 1, train_loss: 1.2572, test_loss: 1.2455, test_f1: 0.2552
 epoch: 2, train_loss: 1.2473, test_loss: 1.2192, test_f1: 0.3362
 epoch: 3, train_loss: 1.2301, test_loss: 1.1998, test_f1: 0.3432
 epoch: 4, train_loss: 1.2172, test_loss: 1.1834, test_f1: 0.3429
 epoch: 5, train_loss: 1.2011, test_loss: 1.1818, test_f1: 0.3750
 epoch: 6, train_loss: 1.2027, test_loss: 1.1673, test_f1: 0.3759
 epoch: 7, train_loss: 1.1941, test_loss: 1.1557, test_f1: 0.3718
 epoch: 8, train_loss: 1.1779, test_loss: 1.1404, test_f1: 0.3885
 epoch: 9, train_loss: 1.1729, test_loss: 1.1201, test_f1: 0.4161
 epoch: 10, train_loss: 1.1519, test_loss: 1.1090, test_f1: 0.4244
 epoch: 11, train_loss: 1.1530, test_loss: 1.0935, test_f1: 0.4356
 epoch: 12, train_loss: 1.1299, test_loss: 1.0772, test_f1: 0.4409
 epoch: 13, train_loss: 1.1246, test_loss: 1.0708, test_f1: 0.4459
 epoch: 14, train_loss: 1.1281, test_loss: 1.0566, test_f1: 0.4565
 epoch: 15, train_loss: 1.1076, test_loss: 1.0334, test_f1: 0.4642
 epoch: 16, train_loss: 1.1081, test_loss: 1.0721, test_f1: 0.4764
 epoch: 17, train_loss: 1.0946, test_loss: 1.0219, test_f1: 0.4533
 epoch: 18, train_loss: 1.0889, test_loss: 1.0160, test_f1: 0.4829
 epoch: 19, train_loss: 1.0916, test_loss: 1.0241, test_f1: 0.4938
 epoch: 20, train_loss: 1.0710, test_loss: 1.0098, test_f1: 0.4864
 epoch: 21, train_loss: 1.0763, test_loss: 1.0019, test_f1: 0.4872
 epoch: 22, train_loss: 1.0702, test_loss: 0.9843, test_f1: 0.5041
 epoch: 23, train_loss: 1.0570, test_loss: 0.9811, test_f1: 0.4994
 epoch: 24, train_loss: 1.0518, test_loss: 0.9709, test_f1: 0.5154
 epoch: 25, train_loss: 1.0460, test_loss: 0.9598, test_f1: 0.5100
 epoch: 26, train_loss: 1.0248, test_loss: 0.9716, test_f1: 0.5003
 epoch: 27, train_loss: 1.0544, test_loss: 0.9648, test_f1: 0.5148
 epoch: 28, train_loss: 1.0303, test_loss: 0.9591, test_f1: 0.5146
 epoch: 29, train_loss: 1.0311, test_loss: 0.9655, test_f1: 0.4889
 epoch: 30, train_loss: 1.0080, test_loss: 0.9739, test_f1: 0.4899
 epoch: 31, train_loss: 1.0156, test_loss: 0.9526, test_f1: 0.5180
 epoch: 32, train_loss: 0.9988, test_loss: 0.9846, test_f1: 0.5086
 epoch: 33, train_loss: 0.9943, test_loss: 0.9403, test_f1: 0.5140
 epoch: 34, train_loss: 0.9941, test_loss: 0.9499, test_f1: 0.5074
 epoch: 35, train_loss: 0.9899, test_loss: 0.9451, test_f1: 0.5069
 epoch: 36, train_loss: 0.9777, test_loss: 0.9401, test_f1: 0.5246
 epoch: 37, train_loss: 0.9766, test_loss: 0.9498, test_f1: 0.5215
 epoch: 38, train_loss: 0.9831, test_loss: 0.9280, test_f1: 0.5111
 epoch: 39, train_loss: 0.9892, test_loss: 0.9300, test_f1: 0.5350
 epoch: 40, train_loss: 0.9703, test_loss: 0.9493, test_f1: 0.4992
 epoch: 41, train_loss: 0.9599, test_loss: 0.9457, test_f1: 0.5203
 epoch: 42, train_loss: 0.9531, test_loss: 0.9392, test_f1: 0.5085
 epoch: 43, train_loss: 0.9655, test_loss: 0.9349, test_f1: 0.4867
 epoch: 44, train_loss: 0.9618, test_loss: 0.9677, test_f1: 0.5168
 epoch: 45, train_loss: 0.9580, test_loss: 0.9275, test_f1: 0.5154
 epoch: 46, train_loss: 0.9599, test_loss: 0.9188, test_f1: 0.5122
 epoch: 47, train_loss: 0.9399, test_loss: 0.9403, test_f1: 0.4973
 epoch: 48, train_loss: 0.9438, test_loss: 0.9374, test_f1: 0.5180
 epoch: 49, train_loss: 0.9333, test_loss: 0.9416, test_f1: 0.5124
 epoch: 50, train_loss: 0.9438, test_loss: 0.9410, test_f1: 0.5149
 epoch: 51, train_loss: 0.9307, test_loss: 0.9419, test_f1: 0.5142
 epoch: 52, train_loss: 0.9238, test_loss: 0.9495, test_f1: 0.4873
 epoch: 53, train_loss: 0.9206, test_loss: 0.9429, test_f1: 0.5267
 epoch: 54, train_loss: 0.9202, test_loss: 0.9220, test_f1: 0.5158
 epoch: 55, train_loss: 0.9089, test_loss: 0.9427, test_f1: 0.5066
 epoch: 56, train_loss: 0.9144, test_loss: 0.9358, test_f1: 0.5200
 epoch: 57, train_loss: 0.8998, test_loss: 0.9323, test_f1: 0.4871
 epoch: 58, train_loss: 0.9155, test_loss: 0.9291, test_f1: 0.4879
 epoch: 59, train_loss: 0.9115, test_loss: 0.9539, test_f1: 0.4850
 epoch: 60, train_loss: 0.9046, test_loss: 0.9263, test_f1: 0.5074
 epoch: 61, train_loss: 0.9101, test_loss: 0.9552, test_f1: 0.5182
 epoch: 62, train_loss: 0.9073, test_loss: 0.9473, test_f1: 0.5239
 epoch: 63, train_loss: 0.9060, test_loss: 0.9465, test_f1: 0.5090
 epoch: 64, train_loss: 0.8980, test_loss: 0.9527, test_f1: 0.5224
 epoch: 65, train_loss: 0.8934, test_loss: 0.9273, test_f1: 0.5165
 epoch: 66, train_loss: 0.8967, test_loss: 0.9549, test_f1: 0.5073
 epoch: 67, train_loss: 0.8940, test_loss: 0.9514, test_f1: 0.5173
 epoch: 68, train_loss: 0.8967, test_loss: 0.9377, test_f1: 0.5111
 epoch: 69, train_loss: 0.8930, test_loss: 0.9574, test_f1: 0.5204
 epoch: 70, train_loss: 0.8968, test_loss: 0.9902, test_f1: 0.4844
 epoch: 71, train_loss: 0.8886, test_loss: 0.9762, test_f1: 0.5018
 epoch: 72, train_loss: 0.8917, test_loss: 0.9684, test_f1: 0.5174
 epoch: 73, train_loss: 0.8919, test_loss: 0.9439, test_f1: 0.4912
 epoch: 74, train_loss: 0.8867, test_loss: 0.9659, test_f1: 0.5073
 epoch: 75, train_loss: 0.8844, test_loss: 0.9603, test_f1: 0.5136
 epoch: 76, train_loss: 0.8870, test_loss: 0.9683, test_f1: 0.5181
 epoch: 77, train_loss: 0.8819, test_loss: 0.9577, test_f1: 0.5139
 epoch: 78, train_loss: 0.8973, test_loss: 0.9539, test_f1: 0.4877
 epoch: 79, train_loss: 0.8880, test_loss: 0.9462, test_f1: 0.5141
 epoch: 80, train_loss: 0.8803, test_loss: 0.9497, test_f1: 0.5148
 epoch: 81, train_loss: 0.8778, test_loss: 0.9353, test_f1: 0.5320
 epoch: 82, train_loss: 0.8774, test_loss: 0.9697, test_f1: 0.5155
 epoch: 83, train_loss: 0.8748, test_loss: 0.9664, test_f1: 0.5224
 epoch: 84, train_loss: 0.8790, test_loss: 0.9767, test_f1: 0.5164
 epoch: 85, train_loss: 0.8794, test_loss: 0.9528, test_f1: 0.5353
 epoch: 86, train_loss: 0.8709, test_loss: 0.9486, test_f1: 0.5347
 epoch: 87, train_loss: 0.8839, test_loss: 0.9615, test_f1: 0.5136
 epoch: 88, train_loss: 0.8719, test_loss: 0.9548, test_f1: 0.5233
 epoch: 89, train_loss: 0.8535, test_loss: 0.9596, test_f1: 0.5250
 epoch: 90, train_loss: 0.8617, test_loss: 0.9876, test_f1: 0.5392
 epoch: 91, train_loss: 0.8572, test_loss: 0.9553, test_f1: 0.5108
 epoch: 92, train_loss: 0.8700, test_loss: 0.9619, test_f1: 0.5123
 epoch: 93, train_loss: 0.8628, test_loss: 0.9653, test_f1: 0.5180
 epoch: 94, train_loss: 0.8685, test_loss: 0.9615, test_f1: 0.5155
 epoch: 95, train_loss: 0.8577, test_loss: 0.9567, test_f1: 0.5277
 epoch: 96, train_loss: 0.8509, test_loss: 0.9506, test_f1: 0.5349
 epoch: 97, train_loss: 0.8516, test_loss: 0.9438, test_f1: 0.5309
 epoch: 98, train_loss: 0.8571, test_loss: 0.9635, test_f1: 0.5267
 epoch: 99, train_loss: 0.8698, test_loss: 0.9702, test_f1: 0.5159
##################ITERATION #7 ****************************************
 epoch: 0, train_loss: 1.4358, test_loss: 1.2760, test_f1: 0.2414
 epoch: 1, train_loss: 1.2600, test_loss: 1.1991, test_f1: 0.3258
 epoch: 2, train_loss: 1.2460, test_loss: 1.1663, test_f1: 0.4165
 epoch: 3, train_loss: 1.2229, test_loss: 1.1505, test_f1: 0.4278
 epoch: 4, train_loss: 1.1998, test_loss: 1.1430, test_f1: 0.4279
 epoch: 5, train_loss: 1.1909, test_loss: 1.1339, test_f1: 0.4466
 epoch: 6, train_loss: 1.1760, test_loss: 1.1195, test_f1: 0.4293
 epoch: 7, train_loss: 1.1612, test_loss: 1.1105, test_f1: 0.4561
 epoch: 8, train_loss: 1.1599, test_loss: 1.1035, test_f1: 0.4534
 epoch: 9, train_loss: 1.1497, test_loss: 1.0805, test_f1: 0.4413
 epoch: 10, train_loss: 1.1391, test_loss: 1.0673, test_f1: 0.4519
 epoch: 11, train_loss: 1.1230, test_loss: 1.0547, test_f1: 0.4622
 epoch: 12, train_loss: 1.1303, test_loss: 1.0547, test_f1: 0.4665
 epoch: 13, train_loss: 1.1041, test_loss: 1.0384, test_f1: 0.4700
 epoch: 14, train_loss: 1.1067, test_loss: 1.0873, test_f1: 0.4552
 epoch: 15, train_loss: 1.1042, test_loss: 1.0368, test_f1: 0.4629
 epoch: 16, train_loss: 1.1020, test_loss: 1.0525, test_f1: 0.4455
 epoch: 17, train_loss: 1.0833, test_loss: 1.0458, test_f1: 0.4462
 epoch: 18, train_loss: 1.0779, test_loss: 1.0419, test_f1: 0.4464
 epoch: 19, train_loss: 1.0781, test_loss: 1.0777, test_f1: 0.4498
 epoch: 20, train_loss: 1.0661, test_loss: 1.0034, test_f1: 0.4706
 epoch: 21, train_loss: 1.0701, test_loss: 1.0243, test_f1: 0.4671
 epoch: 22, train_loss: 1.0699, test_loss: 0.9998, test_f1: 0.4724
 epoch: 23, train_loss: 1.0802, test_loss: 0.9947, test_f1: 0.4727
 epoch: 24, train_loss: 1.0438, test_loss: 0.9963, test_f1: 0.4738
 epoch: 25, train_loss: 1.0470, test_loss: 1.0080, test_f1: 0.4652
 epoch: 26, train_loss: 1.0391, test_loss: 0.9889, test_f1: 0.4618
 epoch: 27, train_loss: 1.0387, test_loss: 1.0154, test_f1: 0.4577
 epoch: 28, train_loss: 1.0288, test_loss: 0.9759, test_f1: 0.4743
 epoch: 29, train_loss: 1.0165, test_loss: 0.9734, test_f1: 0.4508
 epoch: 30, train_loss: 1.0269, test_loss: 0.9827, test_f1: 0.4759
 epoch: 31, train_loss: 1.0226, test_loss: 0.9810, test_f1: 0.4751
 epoch: 32, train_loss: 1.0065, test_loss: 0.9690, test_f1: 0.4744
 epoch: 33, train_loss: 1.0057, test_loss: 0.9785, test_f1: 0.4715
 epoch: 34, train_loss: 1.0022, test_loss: 0.9863, test_f1: 0.4734
 epoch: 35, train_loss: 1.0051, test_loss: 0.9768, test_f1: 0.4670
 epoch: 36, train_loss: 0.9909, test_loss: 0.9833, test_f1: 0.4637
 epoch: 37, train_loss: 0.9919, test_loss: 0.9906, test_f1: 0.4545
 epoch: 38, train_loss: 0.9882, test_loss: 0.9938, test_f1: 0.4661
 epoch: 39, train_loss: 0.9888, test_loss: 1.0070, test_f1: 0.4552
 epoch: 40, train_loss: 0.9933, test_loss: 0.9961, test_f1: 0.4641
 epoch: 41, train_loss: 0.9981, test_loss: 1.0698, test_f1: 0.4537
 epoch: 42, train_loss: 0.9742, test_loss: 1.0045, test_f1: 0.4742
 epoch: 43, train_loss: 0.9674, test_loss: 0.9763, test_f1: 0.4726
 epoch: 44, train_loss: 0.9752, test_loss: 1.0776, test_f1: 0.4529
 epoch: 45, train_loss: 0.9760, test_loss: 1.0080, test_f1: 0.4521
 epoch: 46, train_loss: 0.9768, test_loss: 1.0071, test_f1: 0.4730
 epoch: 47, train_loss: 0.9718, test_loss: 0.9882, test_f1: 0.4800
 epoch: 48, train_loss: 0.9598, test_loss: 1.0301, test_f1: 0.4677
 epoch: 49, train_loss: 0.9631, test_loss: 1.0249, test_f1: 0.4691
 epoch: 50, train_loss: 0.9634, test_loss: 1.0533, test_f1: 0.4616
 epoch: 51, train_loss: 0.9543, test_loss: 1.0373, test_f1: 0.4743
 epoch: 52, train_loss: 0.9449, test_loss: 1.0275, test_f1: 0.4790
 epoch: 53, train_loss: 0.9552, test_loss: 1.0113, test_f1: 0.4724
 epoch: 54, train_loss: 0.9465, test_loss: 1.0341, test_f1: 0.4694
 epoch: 55, train_loss: 0.9393, test_loss: 1.0339, test_f1: 0.4681
 epoch: 56, train_loss: 0.9431, test_loss: 1.0520, test_f1: 0.4580
 epoch: 57, train_loss: 0.9388, test_loss: 1.0330, test_f1: 0.4568
 epoch: 58, train_loss: 0.9336, test_loss: 1.0222, test_f1: 0.4620
 epoch: 59, train_loss: 0.9379, test_loss: 1.0384, test_f1: 0.4648
 epoch: 60, train_loss: 0.9430, test_loss: 1.0280, test_f1: 0.4660
 epoch: 61, train_loss: 0.9292, test_loss: 1.0735, test_f1: 0.4610
 epoch: 62, train_loss: 0.9329, test_loss: 1.0081, test_f1: 0.4832
 epoch: 63, train_loss: 0.9346, test_loss: 1.0320, test_f1: 0.4799
 epoch: 64, train_loss: 0.9314, test_loss: 1.0284, test_f1: 0.4734
 epoch: 65, train_loss: 0.9353, test_loss: 1.0310, test_f1: 0.4629
 epoch: 66, train_loss: 0.9204, test_loss: 1.0649, test_f1: 0.4632
 epoch: 67, train_loss: 0.9232, test_loss: 1.0515, test_f1: 0.4609
 epoch: 68, train_loss: 0.9196, test_loss: 1.0524, test_f1: 0.4763
 epoch: 69, train_loss: 0.9257, test_loss: 1.0696, test_f1: 0.4577
 epoch: 70, train_loss: 0.9246, test_loss: 1.0635, test_f1: 0.4555
 epoch: 71, train_loss: 0.9189, test_loss: 1.0612, test_f1: 0.4659
 epoch: 72, train_loss: 0.9209, test_loss: 1.0422, test_f1: 0.4795
 epoch: 73, train_loss: 0.9170, test_loss: 1.0950, test_f1: 0.4652
 epoch: 74, train_loss: 0.9137, test_loss: 1.0747, test_f1: 0.4663
 epoch: 75, train_loss: 0.9129, test_loss: 1.0628, test_f1: 0.4580
 epoch: 76, train_loss: 0.9133, test_loss: 1.0575, test_f1: 0.4731
 epoch: 77, train_loss: 0.9073, test_loss: 1.0982, test_f1: 0.4637
 epoch: 78, train_loss: 0.9138, test_loss: 1.0592, test_f1: 0.4666
 epoch: 79, train_loss: 0.9089, test_loss: 1.1287, test_f1: 0.4646
 epoch: 80, train_loss: 0.9009, test_loss: 1.1082, test_f1: 0.4678
 epoch: 81, train_loss: 0.9100, test_loss: 1.0663, test_f1: 0.4617
 epoch: 82, train_loss: 0.9016, test_loss: 1.0947, test_f1: 0.4718
 epoch: 83, train_loss: 0.9021, test_loss: 1.0977, test_f1: 0.4619
 epoch: 84, train_loss: 0.9047, test_loss: 1.1040, test_f1: 0.4673
 epoch: 85, train_loss: 0.9138, test_loss: 1.0905, test_f1: 0.4629
 epoch: 86, train_loss: 0.9099, test_loss: 1.0991, test_f1: 0.4656
 epoch: 87, train_loss: 0.8939, test_loss: 1.0707, test_f1: 0.4777
 epoch: 88, train_loss: 0.9006, test_loss: 1.1176, test_f1: 0.4758
 epoch: 89, train_loss: 0.8972, test_loss: 1.1033, test_f1: 0.4572
 epoch: 90, train_loss: 0.8952, test_loss: 1.1003, test_f1: 0.4609
 epoch: 91, train_loss: 0.8954, test_loss: 1.0844, test_f1: 0.4660
 epoch: 92, train_loss: 0.8963, test_loss: 1.0682, test_f1: 0.4825
 epoch: 93, train_loss: 0.8847, test_loss: 1.1043, test_f1: 0.4624
 epoch: 94, train_loss: 0.9087, test_loss: 1.0730, test_f1: 0.4802
 epoch: 95, train_loss: 0.8955, test_loss: 1.0533, test_f1: 0.4737
 epoch: 96, train_loss: 0.8849, test_loss: 1.0469, test_f1: 0.4770
 epoch: 97, train_loss: 0.8840, test_loss: 1.0529, test_f1: 0.4872
 epoch: 98, train_loss: 0.8857, test_loss: 1.1070, test_f1: 0.4632
 epoch: 99, train_loss: 0.8943, test_loss: 1.1436, test_f1: 0.4594
##################ITERATION #8 ****************************************
 epoch: 0, train_loss: 1.4758, test_loss: 1.2891, test_f1: 0.2274
 epoch: 1, train_loss: 1.2732, test_loss: 1.2244, test_f1: 0.2538
 epoch: 2, train_loss: 1.2583, test_loss: 1.2059, test_f1: 0.2953
 epoch: 3, train_loss: 1.2392, test_loss: 1.1974, test_f1: 0.3003
 epoch: 4, train_loss: 1.2198, test_loss: 1.1781, test_f1: 0.3591
 epoch: 5, train_loss: 1.2080, test_loss: 1.1632, test_f1: 0.3657
 epoch: 6, train_loss: 1.1973, test_loss: 1.1597, test_f1: 0.3675
 epoch: 7, train_loss: 1.1951, test_loss: 1.1465, test_f1: 0.3829
 epoch: 8, train_loss: 1.1925, test_loss: 1.1337, test_f1: 0.4069
 epoch: 9, train_loss: 1.1784, test_loss: 1.1229, test_f1: 0.3990
 epoch: 10, train_loss: 1.1678, test_loss: 1.1099, test_f1: 0.4186
 epoch: 11, train_loss: 1.1544, test_loss: 1.0991, test_f1: 0.4197
 epoch: 12, train_loss: 1.1531, test_loss: 1.0965, test_f1: 0.4285
 epoch: 13, train_loss: 1.1358, test_loss: 1.0728, test_f1: 0.4601
 epoch: 14, train_loss: 1.1345, test_loss: 1.0620, test_f1: 0.4395
 epoch: 15, train_loss: 1.1217, test_loss: 1.0438, test_f1: 0.4327
 epoch: 16, train_loss: 1.1191, test_loss: 1.0544, test_f1: 0.4344
 epoch: 17, train_loss: 1.1113, test_loss: 1.0231, test_f1: 0.4564
 epoch: 18, train_loss: 1.0814, test_loss: 1.0128, test_f1: 0.4536
 epoch: 19, train_loss: 1.0767, test_loss: 0.9929, test_f1: 0.4478
 epoch: 20, train_loss: 1.0802, test_loss: 1.0294, test_f1: 0.4489
 epoch: 21, train_loss: 1.0668, test_loss: 0.9852, test_f1: 0.4544
 epoch: 22, train_loss: 1.0525, test_loss: 1.0148, test_f1: 0.4441
 epoch: 23, train_loss: 1.0434, test_loss: 0.9629, test_f1: 0.4560
 epoch: 24, train_loss: 1.0454, test_loss: 0.9618, test_f1: 0.4561
 epoch: 25, train_loss: 1.0379, test_loss: 0.9571, test_f1: 0.4531
 epoch: 26, train_loss: 1.0284, test_loss: 0.9619, test_f1: 0.4604
 epoch: 27, train_loss: 1.0189, test_loss: 0.9926, test_f1: 0.4668
 epoch: 28, train_loss: 1.0188, test_loss: 0.9610, test_f1: 0.4820
 epoch: 29, train_loss: 1.0086, test_loss: 0.9591, test_f1: 0.4657
 epoch: 30, train_loss: 1.0006, test_loss: 0.9905, test_f1: 0.4689
 epoch: 31, train_loss: 0.9961, test_loss: 0.9470, test_f1: 0.4881
 epoch: 32, train_loss: 0.9939, test_loss: 0.9830, test_f1: 0.4843
 epoch: 33, train_loss: 0.9919, test_loss: 0.9591, test_f1: 0.4857
 epoch: 34, train_loss: 0.9729, test_loss: 0.9930, test_f1: 0.4693
 epoch: 35, train_loss: 0.9749, test_loss: 0.9506, test_f1: 0.4796
 epoch: 36, train_loss: 0.9780, test_loss: 0.9873, test_f1: 0.4694
 epoch: 37, train_loss: 0.9808, test_loss: 0.9908, test_f1: 0.4741
 epoch: 38, train_loss: 0.9695, test_loss: 1.0131, test_f1: 0.4619
 epoch: 39, train_loss: 0.9742, test_loss: 0.9460, test_f1: 0.4781
 epoch: 40, train_loss: 0.9603, test_loss: 0.9830, test_f1: 0.4844
 epoch: 41, train_loss: 0.9613, test_loss: 0.9509, test_f1: 0.4840
 epoch: 42, train_loss: 0.9582, test_loss: 1.0169, test_f1: 0.4733
 epoch: 43, train_loss: 0.9426, test_loss: 1.0231, test_f1: 0.4662
 epoch: 44, train_loss: 0.9484, test_loss: 0.9654, test_f1: 0.4849
 epoch: 45, train_loss: 0.9489, test_loss: 0.9086, test_f1: 0.5051
 epoch: 46, train_loss: 0.9482, test_loss: 0.9926, test_f1: 0.4862
 epoch: 47, train_loss: 0.9535, test_loss: 0.9835, test_f1: 0.4846
 epoch: 48, train_loss: 0.9254, test_loss: 1.0237, test_f1: 0.4723
 epoch: 49, train_loss: 0.9348, test_loss: 0.9387, test_f1: 0.4918
 epoch: 50, train_loss: 0.9255, test_loss: 0.9550, test_f1: 0.5002
 epoch: 51, train_loss: 0.9134, test_loss: 0.9790, test_f1: 0.4854
 epoch: 52, train_loss: 0.9175, test_loss: 1.0035, test_f1: 0.4769
 epoch: 53, train_loss: 0.9137, test_loss: 0.9893, test_f1: 0.5072
 epoch: 54, train_loss: 0.9211, test_loss: 0.9706, test_f1: 0.4877
 epoch: 55, train_loss: 0.9109, test_loss: 1.0153, test_f1: 0.4788
 epoch: 56, train_loss: 0.9065, test_loss: 0.9754, test_f1: 0.4950
 epoch: 57, train_loss: 0.9007, test_loss: 1.0130, test_f1: 0.4860
 epoch: 58, train_loss: 0.9111, test_loss: 0.9826, test_f1: 0.4866
 epoch: 59, train_loss: 0.8949, test_loss: 1.0411, test_f1: 0.4782
 epoch: 60, train_loss: 0.8974, test_loss: 0.9804, test_f1: 0.5173
 epoch: 61, train_loss: 0.9066, test_loss: 1.0202, test_f1: 0.4874
 epoch: 62, train_loss: 0.8986, test_loss: 0.9884, test_f1: 0.4910
 epoch: 63, train_loss: 0.9098, test_loss: 1.0377, test_f1: 0.4906
 epoch: 64, train_loss: 0.8947, test_loss: 0.9986, test_f1: 0.4984
 epoch: 65, train_loss: 0.8880, test_loss: 1.0250, test_f1: 0.4884
 epoch: 66, train_loss: 0.8958, test_loss: 0.9958, test_f1: 0.4801
 epoch: 67, train_loss: 0.9024, test_loss: 0.9886, test_f1: 0.4926
 epoch: 68, train_loss: 0.8876, test_loss: 1.0353, test_f1: 0.4751
 epoch: 69, train_loss: 0.8890, test_loss: 1.0068, test_f1: 0.4985
 epoch: 70, train_loss: 0.8879, test_loss: 0.9921, test_f1: 0.4974
 epoch: 71, train_loss: 0.8807, test_loss: 0.9794, test_f1: 0.5110
 epoch: 72, train_loss: 0.8906, test_loss: 1.0388, test_f1: 0.4779
 epoch: 73, train_loss: 0.8825, test_loss: 1.0269, test_f1: 0.5066
 epoch: 74, train_loss: 0.8724, test_loss: 1.0224, test_f1: 0.4911
 epoch: 75, train_loss: 0.8813, test_loss: 1.0080, test_f1: 0.5054
 epoch: 76, train_loss: 0.8853, test_loss: 1.0406, test_f1: 0.4940
 epoch: 77, train_loss: 0.8767, test_loss: 1.0229, test_f1: 0.4926
 epoch: 78, train_loss: 0.8906, test_loss: 1.0497, test_f1: 0.4808
 epoch: 79, train_loss: 0.8750, test_loss: 1.0547, test_f1: 0.4833
 epoch: 80, train_loss: 0.8753, test_loss: 1.0198, test_f1: 0.4950
 epoch: 81, train_loss: 0.8631, test_loss: 1.0554, test_f1: 0.4971
 epoch: 82, train_loss: 0.8731, test_loss: 1.0749, test_f1: 0.4861
 epoch: 83, train_loss: 0.8786, test_loss: 1.0482, test_f1: 0.4953
 epoch: 84, train_loss: 0.8849, test_loss: 1.0670, test_f1: 0.4761
 epoch: 85, train_loss: 0.8790, test_loss: 1.0257, test_f1: 0.4949
 epoch: 86, train_loss: 0.8788, test_loss: 1.0832, test_f1: 0.4834
 epoch: 87, train_loss: 0.8714, test_loss: 1.0252, test_f1: 0.4910
 epoch: 88, train_loss: 0.8657, test_loss: 1.0202, test_f1: 0.4919
 epoch: 89, train_loss: 0.8770, test_loss: 1.0555, test_f1: 0.4807
 epoch: 90, train_loss: 0.8622, test_loss: 1.0436, test_f1: 0.4881
 epoch: 91, train_loss: 0.8650, test_loss: 1.0276, test_f1: 0.4992
 epoch: 92, train_loss: 0.8683, test_loss: 1.0572, test_f1: 0.4866
 epoch: 93, train_loss: 0.8711, test_loss: 1.0247, test_f1: 0.4934
 epoch: 94, train_loss: 0.8688, test_loss: 1.0492, test_f1: 0.4900
 epoch: 95, train_loss: 0.8596, test_loss: 1.0635, test_f1: 0.4796
 epoch: 96, train_loss: 0.8669, test_loss: 1.0374, test_f1: 0.4935
 epoch: 97, train_loss: 0.8557, test_loss: 1.0741, test_f1: 0.4863
 epoch: 98, train_loss: 0.8647, test_loss: 1.0505, test_f1: 0.4892
 epoch: 99, train_loss: 0.8532, test_loss: 1.0234, test_f1: 0.4938
##################ITERATION #9 ****************************************
 epoch: 0, train_loss: 1.5491, test_loss: 1.2950, test_f1: 0.2644
 epoch: 1, train_loss: 1.3279, test_loss: 1.2346, test_f1: 0.3547
 epoch: 2, train_loss: 1.2844, test_loss: 1.2043, test_f1: 0.3632
 epoch: 3, train_loss: 1.2598, test_loss: 1.1832, test_f1: 0.3769
 epoch: 4, train_loss: 1.2351, test_loss: 1.1591, test_f1: 0.3892
 epoch: 5, train_loss: 1.2043, test_loss: 1.1390, test_f1: 0.4125
 epoch: 6, train_loss: 1.1966, test_loss: 1.1277, test_f1: 0.4159
 epoch: 7, train_loss: 1.1809, test_loss: 1.1063, test_f1: 0.4114
 epoch: 8, train_loss: 1.1711, test_loss: 1.1025, test_f1: 0.4184
 epoch: 9, train_loss: 1.1615, test_loss: 1.0954, test_f1: 0.4127
 epoch: 10, train_loss: 1.1565, test_loss: 1.0968, test_f1: 0.4255
 epoch: 11, train_loss: 1.1485, test_loss: 1.0795, test_f1: 0.4347
 epoch: 12, train_loss: 1.1390, test_loss: 1.0807, test_f1: 0.4308
 epoch: 13, train_loss: 1.1415, test_loss: 1.0841, test_f1: 0.4272
 epoch: 14, train_loss: 1.1464, test_loss: 1.0831, test_f1: 0.4291
 epoch: 15, train_loss: 1.1278, test_loss: 1.0748, test_f1: 0.4112
 epoch: 16, train_loss: 1.1168, test_loss: 1.0723, test_f1: 0.4294
 epoch: 17, train_loss: 1.1140, test_loss: 1.0545, test_f1: 0.4268
 epoch: 18, train_loss: 1.0998, test_loss: 1.0690, test_f1: 0.4115
 epoch: 19, train_loss: 1.1001, test_loss: 1.0508, test_f1: 0.4453
 epoch: 20, train_loss: 1.0975, test_loss: 1.0494, test_f1: 0.4339
 epoch: 21, train_loss: 1.0888, test_loss: 1.0495, test_f1: 0.4421
 epoch: 22, train_loss: 1.0948, test_loss: 1.0336, test_f1: 0.4555
 epoch: 23, train_loss: 1.0838, test_loss: 1.0369, test_f1: 0.4544
 epoch: 24, train_loss: 1.0795, test_loss: 1.0416, test_f1: 0.4616
 epoch: 25, train_loss: 1.0632, test_loss: 1.0352, test_f1: 0.4633
 epoch: 26, train_loss: 1.0779, test_loss: 1.0465, test_f1: 0.4444
 epoch: 27, train_loss: 1.0677, test_loss: 1.0369, test_f1: 0.4509
 epoch: 28, train_loss: 1.0680, test_loss: 1.0334, test_f1: 0.4665
 epoch: 29, train_loss: 1.0722, test_loss: 1.0202, test_f1: 0.4771
 epoch: 30, train_loss: 1.0613, test_loss: 1.0223, test_f1: 0.4798
 epoch: 31, train_loss: 1.0582, test_loss: 1.0516, test_f1: 0.4616
 epoch: 32, train_loss: 1.0698, test_loss: 1.0271, test_f1: 0.4622
 epoch: 33, train_loss: 1.0547, test_loss: 1.0151, test_f1: 0.4645
 epoch: 34, train_loss: 1.0451, test_loss: 1.0102, test_f1: 0.4700
 epoch: 35, train_loss: 1.0420, test_loss: 1.0189, test_f1: 0.4584
 epoch: 36, train_loss: 1.0464, test_loss: 1.0121, test_f1: 0.4526
 epoch: 37, train_loss: 1.0466, test_loss: 1.0047, test_f1: 0.4747
 epoch: 38, train_loss: 1.0437, test_loss: 1.0217, test_f1: 0.4600
 epoch: 39, train_loss: 1.0331, test_loss: 1.0140, test_f1: 0.4640
 epoch: 40, train_loss: 1.0358, test_loss: 0.9872, test_f1: 0.4580
 epoch: 41, train_loss: 1.0342, test_loss: 1.0052, test_f1: 0.4651
 epoch: 42, train_loss: 1.0266, test_loss: 1.0247, test_f1: 0.4614
 epoch: 43, train_loss: 1.0344, test_loss: 0.9820, test_f1: 0.4788
 epoch: 44, train_loss: 1.0328, test_loss: 0.9919, test_f1: 0.4654
 epoch: 45, train_loss: 1.0267, test_loss: 0.9969, test_f1: 0.4533
 epoch: 46, train_loss: 1.0234, test_loss: 0.9954, test_f1: 0.4446
 epoch: 47, train_loss: 1.0155, test_loss: 0.9909, test_f1: 0.4529
 epoch: 48, train_loss: 1.0197, test_loss: 0.9842, test_f1: 0.4763
 epoch: 49, train_loss: 1.0092, test_loss: 0.9881, test_f1: 0.4678
 epoch: 50, train_loss: 1.0128, test_loss: 0.9828, test_f1: 0.4653
 epoch: 51, train_loss: 0.9948, test_loss: 0.9757, test_f1: 0.4570
 epoch: 52, train_loss: 0.9986, test_loss: 0.9881, test_f1: 0.4538
 epoch: 53, train_loss: 0.9998, test_loss: 0.9721, test_f1: 0.4673
 epoch: 54, train_loss: 0.9965, test_loss: 0.9873, test_f1: 0.4636
 epoch: 55, train_loss: 0.9919, test_loss: 0.9851, test_f1: 0.4672
 epoch: 56, train_loss: 0.9943, test_loss: 0.9877, test_f1: 0.4711
 epoch: 57, train_loss: 0.9933, test_loss: 0.9865, test_f1: 0.4585
 epoch: 58, train_loss: 0.9992, test_loss: 0.9704, test_f1: 0.4634
 epoch: 59, train_loss: 0.9816, test_loss: 0.9752, test_f1: 0.4486
 epoch: 60, train_loss: 0.9879, test_loss: 0.9738, test_f1: 0.4607
 epoch: 61, train_loss: 0.9956, test_loss: 0.9764, test_f1: 0.4590
 epoch: 62, train_loss: 0.9888, test_loss: 0.9740, test_f1: 0.4658
 epoch: 63, train_loss: 0.9874, test_loss: 0.9843, test_f1: 0.4547
 epoch: 64, train_loss: 0.9809, test_loss: 0.9646, test_f1: 0.4668
 epoch: 65, train_loss: 0.9780, test_loss: 0.9823, test_f1: 0.4530
 epoch: 66, train_loss: 0.9782, test_loss: 0.9870, test_f1: 0.4600
 epoch: 67, train_loss: 0.9942, test_loss: 0.9693, test_f1: 0.4505
 epoch: 68, train_loss: 0.9772, test_loss: 0.9712, test_f1: 0.4576
 epoch: 69, train_loss: 0.9844, test_loss: 0.9702, test_f1: 0.4661
 epoch: 70, train_loss: 0.9830, test_loss: 0.9760, test_f1: 0.4638
 epoch: 71, train_loss: 0.9793, test_loss: 0.9824, test_f1: 0.4643
 epoch: 72, train_loss: 0.9725, test_loss: 0.9606, test_f1: 0.4639
 epoch: 73, train_loss: 0.9774, test_loss: 0.9536, test_f1: 0.4696
 epoch: 74, train_loss: 0.9849, test_loss: 0.9794, test_f1: 0.4595
 epoch: 75, train_loss: 0.9751, test_loss: 0.9728, test_f1: 0.4660
 epoch: 76, train_loss: 0.9712, test_loss: 0.9735, test_f1: 0.4634
 epoch: 77, train_loss: 0.9692, test_loss: 0.9799, test_f1: 0.4616
 epoch: 78, train_loss: 0.9659, test_loss: 0.9722, test_f1: 0.4640
 epoch: 79, train_loss: 0.9707, test_loss: 0.9653, test_f1: 0.4710
 epoch: 80, train_loss: 0.9673, test_loss: 0.9741, test_f1: 0.4605
 epoch: 81, train_loss: 0.9648, test_loss: 0.9651, test_f1: 0.4746
 epoch: 82, train_loss: 0.9729, test_loss: 0.9698, test_f1: 0.4664
 epoch: 83, train_loss: 0.9631, test_loss: 0.9798, test_f1: 0.4628
 epoch: 84, train_loss: 0.9591, test_loss: 0.9731, test_f1: 0.4690
 epoch: 85, train_loss: 0.9659, test_loss: 0.9676, test_f1: 0.4723
 epoch: 86, train_loss: 0.9523, test_loss: 0.9723, test_f1: 0.4597
 epoch: 87, train_loss: 0.9552, test_loss: 0.9652, test_f1: 0.4619
 epoch: 88, train_loss: 0.9576, test_loss: 0.9560, test_f1: 0.4613
 epoch: 89, train_loss: 0.9497, test_loss: 0.9606, test_f1: 0.4624
 epoch: 90, train_loss: 0.9548, test_loss: 0.9716, test_f1: 0.4671
 epoch: 91, train_loss: 0.9522, test_loss: 0.9665, test_f1: 0.4603
 epoch: 92, train_loss: 0.9485, test_loss: 0.9646, test_f1: 0.4633
 epoch: 93, train_loss: 0.9572, test_loss: 0.9548, test_f1: 0.4609
 epoch: 94, train_loss: 0.9550, test_loss: 0.9688, test_f1: 0.4600
 epoch: 95, train_loss: 0.9535, test_loss: 0.9686, test_f1: 0.4752
 epoch: 96, train_loss: 0.9536, test_loss: 0.9675, test_f1: 0.4672
 epoch: 97, train_loss: 0.9375, test_loss: 0.9609, test_f1: 0.4754
 epoch: 98, train_loss: 0.9416, test_loss: 0.9583, test_f1: 0.4648
 epoch: 99, train_loss: 0.9429, test_loss: 0.9700, test_f1: 0.4607

Training completed in 528.09 seconds
Best F1: 0.5439 at epoch 65
Mean F1 across iterations: 0.5106  0.0222
========================FINAL RESULTS================================
FEGIN weighted F1: 0.5439  0.0222
python main.py --data ltspice_examples --representation component_component --model FEGIN --layers 5 --hiddens 16 --batch_size 128 --lr 0.001 --emb_size 128 --epochs 100 --save_appendix component_component_L5_H16_BS128_LR0.001_E128 --no_val
-----



STDERR:
Processing...
Done!
  File "main.py", line 370, in <module>
    main()
  File "main.py", line 254, in main
    dataset = dataset_class(
  File "/home/philip/projects/ltspice_examples_code_repo/Circuit-Completion-Using-GNNs/component_classification_with_link_prediction_head/evaluation/FEGIN/kernel/circuit_datasets.py", line 15, in __init__
    self.data, self.slices = torch.load(self.processed_paths[0])
  File "/home/philip/.local/lib/python3.8/site-packages/torch/serialization.py", line 1040, in load
    warnings.warn(
  File "/usr/lib/python3.8/warnings.py", line 109, in _showwarnmsg
    sw(msg.message, msg.category, msg.filename, msg.lineno,
  File "main.py", line 47, in warn_with_traceback
    traceback.print_stack(file=log)
/home/philip/projects/ltspice_examples_code_repo/Circuit-Completion-Using-GNNs/component_classification_with_link_prediction_head/evaluation/FEGIN/kernel/circuit_datasets.py:15: FutureWarning: You are using `torch.load` with `weights_only=False` (the current default value), which uses the default pickle module implicitly. It is possible to construct malicious pickle data which will execute arbitrary code during unpickling (See https://github.com/pytorch/pytorch/blob/main/SECURITY.md#untrusted-models for more details). In a future release, the default value for `weights_only` will be flipped to `True`. This limits the functions that could be executed during unpickling. Arbitrary objects will no longer be allowed to be loaded via this mode unless they are explicitly allowlisted by the user via `torch.serialization.add_safe_globals`. We recommend you start setting `weights_only=True` for any use case where you don't have full control of the loaded file. Please open an issue on GitHub for any issues related to this experimental feature.
  self.data, self.slices = torch.load(self.processed_paths[0])
