STDOUT:
Results will be saved in /home/philip/projects/llm_inference_code_repo/Circuit-Completion-Using-GNNs/component_classification_with_link_prediction_head/evaluation/FEGIN/results/model_FEGIN_dataset_ltspice_examples
Command line input: python main.py --data ltspice_examples --representation component_pin_net --model FEGIN --layers 6 --hiddens 32 --batch_size 128 --lr 0.0001 --emb_size 128 --epochs 100 --save_appendix component_pin_net_L6_H32_BS128_LR0.0001_E128 --no_val
 is saved.
-----
ltspice_examples - FEGIN
Using 6 layers, 32 hidden units, h = 2
Loading component_pin_net representation dataset
ENTERED
Training FEGIN on component_pin_net representation
Train: 3558, Test: 846
##################ITERATION #0 ****************************************
 epoch: 0, train_loss: 1.3888, test_loss: 1.3892, test_f1: 0.0375
 epoch: 1, train_loss: 1.3826, test_loss: 1.3843, test_f1: 0.1411
 epoch: 2, train_loss: 1.3781, test_loss: 1.3768, test_f1: 0.2242
 epoch: 3, train_loss: 1.3740, test_loss: 1.3714, test_f1: 0.2446
 epoch: 4, train_loss: 1.3687, test_loss: 1.3657, test_f1: 0.3627
 epoch: 5, train_loss: 1.3625, test_loss: 1.3590, test_f1: 0.3563
 epoch: 6, train_loss: 1.3557, test_loss: 1.3507, test_f1: 0.4182
 epoch: 7, train_loss: 1.3466, test_loss: 1.3396, test_f1: 0.3902
 epoch: 8, train_loss: 1.3340, test_loss: 1.3243, test_f1: 0.3401
 epoch: 9, train_loss: 1.3176, test_loss: 1.3063, test_f1: 0.3228
 epoch: 10, train_loss: 1.2992, test_loss: 1.2844, test_f1: 0.3304
 epoch: 11, train_loss: 1.2800, test_loss: 1.2633, test_f1: 0.3387
 epoch: 12, train_loss: 1.2570, test_loss: 1.2416, test_f1: 0.3354
 epoch: 13, train_loss: 1.2331, test_loss: 1.2198, test_f1: 0.3404
 epoch: 14, train_loss: 1.2120, test_loss: 1.2069, test_f1: 0.3364
 epoch: 15, train_loss: 1.1936, test_loss: 1.1899, test_f1: 0.3400
 epoch: 16, train_loss: 1.1764, test_loss: 1.1787, test_f1: 0.3400
 epoch: 17, train_loss: 1.1583, test_loss: 1.1671, test_f1: 0.3409
 epoch: 18, train_loss: 1.1482, test_loss: 1.1563, test_f1: 0.3430
 epoch: 19, train_loss: 1.1350, test_loss: 1.1465, test_f1: 0.3436
 epoch: 20, train_loss: 1.1244, test_loss: 1.1344, test_f1: 0.3419
 epoch: 21, train_loss: 1.1133, test_loss: 1.1298, test_f1: 0.3430
 epoch: 22, train_loss: 1.1050, test_loss: 1.1328, test_f1: 0.3446
 epoch: 23, train_loss: 1.0989, test_loss: 1.1235, test_f1: 0.3448
 epoch: 24, train_loss: 1.0811, test_loss: 1.1144, test_f1: 0.3440
 epoch: 25, train_loss: 1.0800, test_loss: 1.1163, test_f1: 0.3446
 epoch: 26, train_loss: 1.0731, test_loss: 1.1053, test_f1: 0.3458
 epoch: 27, train_loss: 1.0720, test_loss: 1.1072, test_f1: 0.3467
 epoch: 28, train_loss: 1.0640, test_loss: 1.1030, test_f1: 0.3457
 epoch: 29, train_loss: 1.0583, test_loss: 1.1027, test_f1: 0.3441
 epoch: 30, train_loss: 1.0541, test_loss: 1.1091, test_f1: 0.3465
 epoch: 31, train_loss: 1.0461, test_loss: 1.1090, test_f1: 0.3422
 epoch: 32, train_loss: 1.0415, test_loss: 1.0923, test_f1: 0.3477
 epoch: 33, train_loss: 1.0387, test_loss: 1.0801, test_f1: 0.3478
 epoch: 34, train_loss: 1.0351, test_loss: 1.1110, test_f1: 0.3435
 epoch: 35, train_loss: 1.0320, test_loss: 1.0939, test_f1: 0.3465
 epoch: 36, train_loss: 1.0331, test_loss: 1.0960, test_f1: 0.3469
 epoch: 37, train_loss: 1.0235, test_loss: 1.0936, test_f1: 0.3467
 epoch: 38, train_loss: 1.0244, test_loss: 1.0885, test_f1: 0.3487
 epoch: 39, train_loss: 1.0199, test_loss: 1.0830, test_f1: 0.3576
 epoch: 40, train_loss: 1.0187, test_loss: 1.0757, test_f1: 0.3842
 epoch: 41, train_loss: 1.0158, test_loss: 1.0665, test_f1: 0.3724
 epoch: 42, train_loss: 1.0095, test_loss: 1.0577, test_f1: 0.3993
 epoch: 43, train_loss: 1.0012, test_loss: 1.0817, test_f1: 0.3969
 epoch: 44, train_loss: 1.0024, test_loss: 1.0506, test_f1: 0.3990
 epoch: 45, train_loss: 0.9968, test_loss: 1.0410, test_f1: 0.4136
 epoch: 46, train_loss: 0.9956, test_loss: 1.0470, test_f1: 0.4240
 epoch: 47, train_loss: 0.9908, test_loss: 1.1000, test_f1: 0.4341
 epoch: 48, train_loss: 0.9898, test_loss: 1.0708, test_f1: 0.4339
 epoch: 49, train_loss: 0.9833, test_loss: 1.0767, test_f1: 0.4416
 epoch: 50, train_loss: 0.9873, test_loss: 1.0375, test_f1: 0.4574
 epoch: 51, train_loss: 0.9822, test_loss: 1.0531, test_f1: 0.4498
 epoch: 52, train_loss: 0.9755, test_loss: 1.0425, test_f1: 0.4579
 epoch: 53, train_loss: 0.9714, test_loss: 1.0568, test_f1: 0.4594
 epoch: 54, train_loss: 0.9729, test_loss: 1.0411, test_f1: 0.4501
 epoch: 55, train_loss: 0.9723, test_loss: 1.0512, test_f1: 0.4494
 epoch: 56, train_loss: 0.9661, test_loss: 1.0650, test_f1: 0.4592
 epoch: 57, train_loss: 0.9628, test_loss: 1.0522, test_f1: 0.4689
 epoch: 58, train_loss: 0.9655, test_loss: 1.0553, test_f1: 0.4594
 epoch: 59, train_loss: 0.9656, test_loss: 1.0543, test_f1: 0.4795
 epoch: 60, train_loss: 0.9605, test_loss: 1.0607, test_f1: 0.4783
 epoch: 61, train_loss: 0.9578, test_loss: 1.0673, test_f1: 0.4754
 epoch: 62, train_loss: 0.9606, test_loss: 1.0524, test_f1: 0.4748
 epoch: 63, train_loss: 0.9535, test_loss: 1.0619, test_f1: 0.4793
 epoch: 64, train_loss: 0.9500, test_loss: 1.0724, test_f1: 0.4804
 epoch: 65, train_loss: 0.9497, test_loss: 1.0578, test_f1: 0.4911
 epoch: 66, train_loss: 0.9505, test_loss: 1.0448, test_f1: 0.4950
 epoch: 67, train_loss: 0.9483, test_loss: 1.0580, test_f1: 0.4832
 epoch: 68, train_loss: 0.9492, test_loss: 1.0732, test_f1: 0.4823
 epoch: 69, train_loss: 0.9387, test_loss: 1.0549, test_f1: 0.4962
 epoch: 70, train_loss: 0.9510, test_loss: 1.0533, test_f1: 0.4945
 epoch: 71, train_loss: 0.9429, test_loss: 1.0670, test_f1: 0.4809
 epoch: 72, train_loss: 0.9401, test_loss: 1.0618, test_f1: 0.4886
 epoch: 73, train_loss: 0.9387, test_loss: 1.0589, test_f1: 0.5013
 epoch: 74, train_loss: 0.9330, test_loss: 1.0704, test_f1: 0.4841
 epoch: 75, train_loss: 0.9270, test_loss: 1.0472, test_f1: 0.4925
 epoch: 76, train_loss: 0.9337, test_loss: 1.0575, test_f1: 0.4951
 epoch: 77, train_loss: 0.9347, test_loss: 1.0497, test_f1: 0.4880
 epoch: 78, train_loss: 0.9316, test_loss: 1.0391, test_f1: 0.5000
 epoch: 79, train_loss: 0.9334, test_loss: 1.0495, test_f1: 0.5020
 epoch: 80, train_loss: 0.9286, test_loss: 1.0297, test_f1: 0.5028
 epoch: 81, train_loss: 0.9303, test_loss: 1.0488, test_f1: 0.4900
 epoch: 82, train_loss: 0.9315, test_loss: 1.0366, test_f1: 0.5027
 epoch: 83, train_loss: 0.9303, test_loss: 1.0508, test_f1: 0.5019
 epoch: 84, train_loss: 0.9150, test_loss: 1.0469, test_f1: 0.5024
 epoch: 85, train_loss: 0.9151, test_loss: 1.0194, test_f1: 0.5036
 epoch: 86, train_loss: 0.9189, test_loss: 1.0406, test_f1: 0.5013
 epoch: 87, train_loss: 0.9184, test_loss: 1.0257, test_f1: 0.5004
 epoch: 88, train_loss: 0.9066, test_loss: 1.0315, test_f1: 0.5170
 epoch: 89, train_loss: 0.9232, test_loss: 1.0369, test_f1: 0.4939
 epoch: 90, train_loss: 0.9156, test_loss: 1.0365, test_f1: 0.5061
 epoch: 91, train_loss: 0.9095, test_loss: 1.0215, test_f1: 0.5013
 epoch: 92, train_loss: 0.9154, test_loss: 1.0223, test_f1: 0.4964
 epoch: 93, train_loss: 0.9078, test_loss: 1.0296, test_f1: 0.4990
 epoch: 94, train_loss: 0.9108, test_loss: 1.0377, test_f1: 0.5085
 epoch: 95, train_loss: 0.9126, test_loss: 1.0381, test_f1: 0.5043
 epoch: 96, train_loss: 0.9057, test_loss: 1.0278, test_f1: 0.5058
 epoch: 97, train_loss: 0.9026, test_loss: 1.0244, test_f1: 0.5057
 epoch: 98, train_loss: 0.9129, test_loss: 1.0241, test_f1: 0.5046
 epoch: 99, train_loss: 0.9062, test_loss: 1.0345, test_f1: 0.5173
##################ITERATION #1 ****************************************
 epoch: 0, train_loss: 1.3553, test_loss: 1.3648, test_f1: 0.2270
 epoch: 1, train_loss: 1.3363, test_loss: 1.3479, test_f1: 0.2270
 epoch: 2, train_loss: 1.3238, test_loss: 1.3153, test_f1: 0.2287
 epoch: 3, train_loss: 1.3087, test_loss: 1.2937, test_f1: 0.2392
 epoch: 4, train_loss: 1.2939, test_loss: 1.2738, test_f1: 0.3017
 epoch: 5, train_loss: 1.2769, test_loss: 1.2521, test_f1: 0.3364
 epoch: 6, train_loss: 1.2552, test_loss: 1.2314, test_f1: 0.3403
 epoch: 7, train_loss: 1.2343, test_loss: 1.2063, test_f1: 0.3400
 epoch: 8, train_loss: 1.2122, test_loss: 1.1797, test_f1: 0.3374
 epoch: 9, train_loss: 1.1898, test_loss: 1.1559, test_f1: 0.3357
 epoch: 10, train_loss: 1.1620, test_loss: 1.1307, test_f1: 0.3380
 epoch: 11, train_loss: 1.1449, test_loss: 1.1157, test_f1: 0.3373
 epoch: 12, train_loss: 1.1245, test_loss: 1.1006, test_f1: 0.3373
 epoch: 13, train_loss: 1.1081, test_loss: 1.0882, test_f1: 0.3382
 epoch: 14, train_loss: 1.0947, test_loss: 1.0795, test_f1: 0.3377
 epoch: 15, train_loss: 1.0846, test_loss: 1.0807, test_f1: 0.3351
 epoch: 16, train_loss: 1.0752, test_loss: 1.0703, test_f1: 0.3431
 epoch: 17, train_loss: 1.0680, test_loss: 1.0638, test_f1: 0.3406
 epoch: 18, train_loss: 1.0616, test_loss: 1.0596, test_f1: 0.3460
 epoch: 19, train_loss: 1.0535, test_loss: 1.0587, test_f1: 0.3430
 epoch: 20, train_loss: 1.0433, test_loss: 1.0562, test_f1: 0.3476
 epoch: 21, train_loss: 1.0479, test_loss: 1.0614, test_f1: 0.3643
 epoch: 22, train_loss: 1.0319, test_loss: 1.0541, test_f1: 0.3609
 epoch: 23, train_loss: 1.0336, test_loss: 1.0539, test_f1: 0.3772
 epoch: 24, train_loss: 1.0266, test_loss: 1.0510, test_f1: 0.4036
 epoch: 25, train_loss: 1.0209, test_loss: 1.0302, test_f1: 0.4218
 epoch: 26, train_loss: 1.0143, test_loss: 1.0339, test_f1: 0.4325
 epoch: 27, train_loss: 1.0113, test_loss: 1.0304, test_f1: 0.4362
 epoch: 28, train_loss: 1.0091, test_loss: 1.0380, test_f1: 0.4541
 epoch: 29, train_loss: 1.0018, test_loss: 1.0312, test_f1: 0.4540
 epoch: 30, train_loss: 0.9987, test_loss: 1.0480, test_f1: 0.4377
 epoch: 31, train_loss: 0.9980, test_loss: 1.0217, test_f1: 0.4795
 epoch: 32, train_loss: 0.9910, test_loss: 1.0150, test_f1: 0.4791
 epoch: 33, train_loss: 0.9818, test_loss: 1.0624, test_f1: 0.4423
 epoch: 34, train_loss: 0.9780, test_loss: 1.0064, test_f1: 0.4891
 epoch: 35, train_loss: 0.9762, test_loss: 1.0155, test_f1: 0.5045
 epoch: 36, train_loss: 0.9715, test_loss: 0.9994, test_f1: 0.4982
 epoch: 37, train_loss: 0.9648, test_loss: 0.9878, test_f1: 0.5100
 epoch: 38, train_loss: 0.9573, test_loss: 0.9994, test_f1: 0.4912
 epoch: 39, train_loss: 0.9592, test_loss: 1.0039, test_f1: 0.4889
 epoch: 40, train_loss: 0.9484, test_loss: 0.9827, test_f1: 0.5132
 epoch: 41, train_loss: 0.9435, test_loss: 0.9781, test_f1: 0.4995
 epoch: 42, train_loss: 0.9525, test_loss: 0.9733, test_f1: 0.5035
 epoch: 43, train_loss: 0.9405, test_loss: 0.9917, test_f1: 0.4923
 epoch: 44, train_loss: 0.9413, test_loss: 0.9596, test_f1: 0.5131
 epoch: 45, train_loss: 0.9349, test_loss: 0.9588, test_f1: 0.5196
 epoch: 46, train_loss: 0.9229, test_loss: 1.0217, test_f1: 0.4757
 epoch: 47, train_loss: 0.9399, test_loss: 0.9481, test_f1: 0.5151
 epoch: 48, train_loss: 0.9227, test_loss: 0.9493, test_f1: 0.5024
 epoch: 49, train_loss: 0.9245, test_loss: 0.9438, test_f1: 0.5104
 epoch: 50, train_loss: 0.9235, test_loss: 0.9375, test_f1: 0.5114
 epoch: 51, train_loss: 0.9113, test_loss: 0.9392, test_f1: 0.5159
 epoch: 52, train_loss: 0.9177, test_loss: 0.9375, test_f1: 0.5051
 epoch: 53, train_loss: 0.9136, test_loss: 0.9357, test_f1: 0.5100
 epoch: 54, train_loss: 0.9109, test_loss: 0.9295, test_f1: 0.5083
 epoch: 55, train_loss: 0.9113, test_loss: 0.9311, test_f1: 0.5130
 epoch: 56, train_loss: 0.9104, test_loss: 0.9346, test_f1: 0.5151
 epoch: 57, train_loss: 0.9057, test_loss: 0.9261, test_f1: 0.5062
 epoch: 58, train_loss: 0.9042, test_loss: 0.9221, test_f1: 0.5039
 epoch: 59, train_loss: 0.9033, test_loss: 0.9183, test_f1: 0.5093
 epoch: 60, train_loss: 0.9036, test_loss: 0.9258, test_f1: 0.5090
 epoch: 61, train_loss: 0.8977, test_loss: 0.9106, test_f1: 0.5029
 epoch: 62, train_loss: 0.9034, test_loss: 0.9275, test_f1: 0.5044
 epoch: 63, train_loss: 0.9002, test_loss: 0.9379, test_f1: 0.5137
 epoch: 64, train_loss: 0.9031, test_loss: 0.9326, test_f1: 0.5012
 epoch: 65, train_loss: 0.9056, test_loss: 0.9196, test_f1: 0.5094
 epoch: 66, train_loss: 0.8915, test_loss: 0.9170, test_f1: 0.5061
 epoch: 67, train_loss: 0.9005, test_loss: 0.9208, test_f1: 0.4981
 epoch: 68, train_loss: 0.8995, test_loss: 0.9092, test_f1: 0.5071
 epoch: 69, train_loss: 0.8991, test_loss: 0.9064, test_f1: 0.5070
 epoch: 70, train_loss: 0.8833, test_loss: 0.9172, test_f1: 0.4994
 epoch: 71, train_loss: 0.8865, test_loss: 0.9172, test_f1: 0.5183
 epoch: 72, train_loss: 0.8902, test_loss: 0.9070, test_f1: 0.5026
 epoch: 73, train_loss: 0.8903, test_loss: 0.9102, test_f1: 0.5064
 epoch: 74, train_loss: 0.8817, test_loss: 0.9134, test_f1: 0.5061
 epoch: 75, train_loss: 0.8906, test_loss: 0.9207, test_f1: 0.5099
 epoch: 76, train_loss: 0.8936, test_loss: 0.9117, test_f1: 0.5008
 epoch: 77, train_loss: 0.8832, test_loss: 0.9062, test_f1: 0.5078
 epoch: 78, train_loss: 0.8900, test_loss: 0.9091, test_f1: 0.5123
 epoch: 79, train_loss: 0.8863, test_loss: 0.8983, test_f1: 0.5096
 epoch: 80, train_loss: 0.8786, test_loss: 0.9009, test_f1: 0.5106
 epoch: 81, train_loss: 0.8795, test_loss: 0.9087, test_f1: 0.5046
 epoch: 82, train_loss: 0.8712, test_loss: 0.9055, test_f1: 0.5057
 epoch: 83, train_loss: 0.8727, test_loss: 0.9019, test_f1: 0.5093
 epoch: 84, train_loss: 0.8757, test_loss: 0.9025, test_f1: 0.5058
 epoch: 85, train_loss: 0.8833, test_loss: 0.9044, test_f1: 0.5166
 epoch: 86, train_loss: 0.8771, test_loss: 0.8996, test_f1: 0.5095
 epoch: 87, train_loss: 0.8693, test_loss: 0.8973, test_f1: 0.5108
 epoch: 88, train_loss: 0.8716, test_loss: 0.9068, test_f1: 0.5134
 epoch: 89, train_loss: 0.8696, test_loss: 0.9068, test_f1: 0.5101
 epoch: 90, train_loss: 0.8724, test_loss: 0.8973, test_f1: 0.5126
 epoch: 91, train_loss: 0.8678, test_loss: 0.8932, test_f1: 0.5146
 epoch: 92, train_loss: 0.8719, test_loss: 0.9070, test_f1: 0.5074
 epoch: 93, train_loss: 0.8659, test_loss: 0.8962, test_f1: 0.5158
 epoch: 94, train_loss: 0.8614, test_loss: 0.8936, test_f1: 0.5153
 epoch: 95, train_loss: 0.8761, test_loss: 0.8977, test_f1: 0.5070
 epoch: 96, train_loss: 0.8736, test_loss: 0.9035, test_f1: 0.5098
 epoch: 97, train_loss: 0.8736, test_loss: 0.8940, test_f1: 0.5188
 epoch: 98, train_loss: 0.8583, test_loss: 0.8892, test_f1: 0.5181
 epoch: 99, train_loss: 0.8584, test_loss: 0.8927, test_f1: 0.5144
##################ITERATION #2 ****************************************
 epoch: 0, train_loss: 1.3394, test_loss: 1.3461, test_f1: 0.2270
 epoch: 1, train_loss: 1.3149, test_loss: 1.3271, test_f1: 0.2270
 epoch: 2, train_loss: 1.2978, test_loss: 1.2869, test_f1: 0.3312
 epoch: 3, train_loss: 1.2767, test_loss: 1.2607, test_f1: 0.3492
 epoch: 4, train_loss: 1.2548, test_loss: 1.2343, test_f1: 0.3384
 epoch: 5, train_loss: 1.2307, test_loss: 1.2053, test_f1: 0.3430
 epoch: 6, train_loss: 1.2055, test_loss: 1.1792, test_f1: 0.3430
 epoch: 7, train_loss: 1.1806, test_loss: 1.1575, test_f1: 0.3427
 epoch: 8, train_loss: 1.1602, test_loss: 1.1388, test_f1: 0.3404
 epoch: 9, train_loss: 1.1407, test_loss: 1.1189, test_f1: 0.3439
 epoch: 10, train_loss: 1.1185, test_loss: 1.1019, test_f1: 0.3440
 epoch: 11, train_loss: 1.1065, test_loss: 1.0900, test_f1: 0.3439
 epoch: 12, train_loss: 1.0841, test_loss: 1.0778, test_f1: 0.3430
 epoch: 13, train_loss: 1.0775, test_loss: 1.0713, test_f1: 0.3491
 epoch: 14, train_loss: 1.0696, test_loss: 1.0597, test_f1: 0.3566
 epoch: 15, train_loss: 1.0535, test_loss: 1.0551, test_f1: 0.3739
 epoch: 16, train_loss: 1.0476, test_loss: 1.0498, test_f1: 0.3832
 epoch: 17, train_loss: 1.0384, test_loss: 1.0407, test_f1: 0.3987
 epoch: 18, train_loss: 1.0265, test_loss: 1.0301, test_f1: 0.4195
 epoch: 19, train_loss: 1.0267, test_loss: 1.0219, test_f1: 0.4307
 epoch: 20, train_loss: 1.0206, test_loss: 1.0110, test_f1: 0.4344
 epoch: 21, train_loss: 1.0081, test_loss: 1.0134, test_f1: 0.4480
 epoch: 22, train_loss: 1.0020, test_loss: 1.0047, test_f1: 0.4615
 epoch: 23, train_loss: 0.9881, test_loss: 0.9995, test_f1: 0.4632
 epoch: 24, train_loss: 0.9840, test_loss: 0.9920, test_f1: 0.4784
 epoch: 25, train_loss: 0.9812, test_loss: 0.9832, test_f1: 0.4774
 epoch: 26, train_loss: 0.9775, test_loss: 0.9653, test_f1: 0.4942
 epoch: 27, train_loss: 0.9703, test_loss: 0.9830, test_f1: 0.4845
 epoch: 28, train_loss: 0.9741, test_loss: 0.9658, test_f1: 0.4961
 epoch: 29, train_loss: 0.9597, test_loss: 0.9620, test_f1: 0.4849
 epoch: 30, train_loss: 0.9560, test_loss: 0.9632, test_f1: 0.4914
 epoch: 31, train_loss: 0.9477, test_loss: 0.9538, test_f1: 0.4969
 epoch: 32, train_loss: 0.9433, test_loss: 0.9407, test_f1: 0.4989
 epoch: 33, train_loss: 0.9435, test_loss: 0.9356, test_f1: 0.4929
 epoch: 34, train_loss: 0.9369, test_loss: 0.9303, test_f1: 0.5038
 epoch: 35, train_loss: 0.9247, test_loss: 0.9300, test_f1: 0.4939
 epoch: 36, train_loss: 0.9334, test_loss: 0.9231, test_f1: 0.4995
 epoch: 37, train_loss: 0.9219, test_loss: 0.9139, test_f1: 0.5048
 epoch: 38, train_loss: 0.9221, test_loss: 0.9124, test_f1: 0.5044
 epoch: 39, train_loss: 0.9208, test_loss: 0.9083, test_f1: 0.4937
 epoch: 40, train_loss: 0.9161, test_loss: 0.9090, test_f1: 0.4975
 epoch: 41, train_loss: 0.9142, test_loss: 0.8957, test_f1: 0.5010
 epoch: 42, train_loss: 0.9104, test_loss: 0.9056, test_f1: 0.5083
 epoch: 43, train_loss: 0.8974, test_loss: 0.8877, test_f1: 0.5123
 epoch: 44, train_loss: 0.9002, test_loss: 0.8908, test_f1: 0.5260
 epoch: 45, train_loss: 0.8980, test_loss: 0.8893, test_f1: 0.5143
 epoch: 46, train_loss: 0.8929, test_loss: 0.8904, test_f1: 0.5160
 epoch: 47, train_loss: 0.8933, test_loss: 0.8866, test_f1: 0.5269
 epoch: 48, train_loss: 0.8909, test_loss: 0.8884, test_f1: 0.5303
 epoch: 49, train_loss: 0.8934, test_loss: 0.8866, test_f1: 0.5237
 epoch: 50, train_loss: 0.8891, test_loss: 0.8897, test_f1: 0.5251
 epoch: 51, train_loss: 0.8842, test_loss: 0.8842, test_f1: 0.5258
 epoch: 52, train_loss: 0.8819, test_loss: 0.8853, test_f1: 0.5290
 epoch: 53, train_loss: 0.8861, test_loss: 0.8815, test_f1: 0.5292
 epoch: 54, train_loss: 0.8820, test_loss: 0.8819, test_f1: 0.5308
 epoch: 55, train_loss: 0.8792, test_loss: 0.8720, test_f1: 0.5336
 epoch: 56, train_loss: 0.8795, test_loss: 0.8735, test_f1: 0.5253
 epoch: 57, train_loss: 0.8802, test_loss: 0.8774, test_f1: 0.5309
 epoch: 58, train_loss: 0.8729, test_loss: 0.8682, test_f1: 0.5432
 epoch: 59, train_loss: 0.8751, test_loss: 0.8740, test_f1: 0.5352
 epoch: 60, train_loss: 0.8796, test_loss: 0.8806, test_f1: 0.5281
 epoch: 61, train_loss: 0.8790, test_loss: 0.8775, test_f1: 0.5362
 epoch: 62, train_loss: 0.8775, test_loss: 0.8711, test_f1: 0.5320
 epoch: 63, train_loss: 0.8694, test_loss: 0.8657, test_f1: 0.5471
 epoch: 64, train_loss: 0.8621, test_loss: 0.8684, test_f1: 0.5443
 epoch: 65, train_loss: 0.8659, test_loss: 0.8820, test_f1: 0.5194
 epoch: 66, train_loss: 0.8766, test_loss: 0.8745, test_f1: 0.5333
 epoch: 67, train_loss: 0.8685, test_loss: 0.8678, test_f1: 0.5455
 epoch: 68, train_loss: 0.8795, test_loss: 0.8693, test_f1: 0.5382
 epoch: 69, train_loss: 0.8597, test_loss: 0.8725, test_f1: 0.5304
 epoch: 70, train_loss: 0.8650, test_loss: 0.8655, test_f1: 0.5441
 epoch: 71, train_loss: 0.8568, test_loss: 0.8659, test_f1: 0.5342
 epoch: 72, train_loss: 0.8643, test_loss: 0.8669, test_f1: 0.5390
 epoch: 73, train_loss: 0.8608, test_loss: 0.8632, test_f1: 0.5443
 epoch: 74, train_loss: 0.8580, test_loss: 0.8623, test_f1: 0.5445
 epoch: 75, train_loss: 0.8617, test_loss: 0.8590, test_f1: 0.5475
 epoch: 76, train_loss: 0.8556, test_loss: 0.8645, test_f1: 0.5425
 epoch: 77, train_loss: 0.8651, test_loss: 0.8646, test_f1: 0.5400
 epoch: 78, train_loss: 0.8550, test_loss: 0.8620, test_f1: 0.5495
 epoch: 79, train_loss: 0.8516, test_loss: 0.8622, test_f1: 0.5489
 epoch: 80, train_loss: 0.8486, test_loss: 0.8613, test_f1: 0.5437
 epoch: 81, train_loss: 0.8493, test_loss: 0.8616, test_f1: 0.5401
 epoch: 82, train_loss: 0.8489, test_loss: 0.8601, test_f1: 0.5393
 epoch: 83, train_loss: 0.8485, test_loss: 0.8589, test_f1: 0.5428
 epoch: 84, train_loss: 0.8451, test_loss: 0.8590, test_f1: 0.5442
 epoch: 85, train_loss: 0.8551, test_loss: 0.8556, test_f1: 0.5487
 epoch: 86, train_loss: 0.8546, test_loss: 0.8581, test_f1: 0.5400
 epoch: 87, train_loss: 0.8444, test_loss: 0.8599, test_f1: 0.5366
 epoch: 88, train_loss: 0.8435, test_loss: 0.8555, test_f1: 0.5447
 epoch: 89, train_loss: 0.8456, test_loss: 0.8591, test_f1: 0.5378
 epoch: 90, train_loss: 0.8476, test_loss: 0.8608, test_f1: 0.5317
 epoch: 91, train_loss: 0.8431, test_loss: 0.8621, test_f1: 0.5487
 epoch: 92, train_loss: 0.8342, test_loss: 0.8555, test_f1: 0.5442
 epoch: 93, train_loss: 0.8433, test_loss: 0.8554, test_f1: 0.5423
 epoch: 94, train_loss: 0.8353, test_loss: 0.8543, test_f1: 0.5507
 epoch: 95, train_loss: 0.8487, test_loss: 0.8522, test_f1: 0.5443
 epoch: 96, train_loss: 0.8277, test_loss: 0.8568, test_f1: 0.5574
 epoch: 97, train_loss: 0.8460, test_loss: 0.8466, test_f1: 0.5456
 epoch: 98, train_loss: 0.8319, test_loss: 0.8535, test_f1: 0.5429
 epoch: 99, train_loss: 0.8309, test_loss: 0.8540, test_f1: 0.5441
##################ITERATION #3 ****************************************
 epoch: 0, train_loss: 1.2988, test_loss: 1.3187, test_f1: 0.2270
 epoch: 1, train_loss: 1.2730, test_loss: 1.2980, test_f1: 0.2270
 epoch: 2, train_loss: 1.2554, test_loss: 1.2515, test_f1: 0.2270
 epoch: 3, train_loss: 1.2392, test_loss: 1.2162, test_f1: 0.2527
 epoch: 4, train_loss: 1.2169, test_loss: 1.1869, test_f1: 0.3134
 epoch: 5, train_loss: 1.1982, test_loss: 1.1633, test_f1: 0.3425
 epoch: 6, train_loss: 1.1788, test_loss: 1.1377, test_f1: 0.3516
 epoch: 7, train_loss: 1.1537, test_loss: 1.1140, test_f1: 0.3452
 epoch: 8, train_loss: 1.1324, test_loss: 1.0974, test_f1: 0.3472
 epoch: 9, train_loss: 1.1175, test_loss: 1.0886, test_f1: 0.3456
 epoch: 10, train_loss: 1.1027, test_loss: 1.0742, test_f1: 0.3559
 epoch: 11, train_loss: 1.0835, test_loss: 1.0711, test_f1: 0.3587
 epoch: 12, train_loss: 1.0727, test_loss: 1.0550, test_f1: 0.3858
 epoch: 13, train_loss: 1.0558, test_loss: 1.0560, test_f1: 0.3736
 epoch: 14, train_loss: 1.0533, test_loss: 1.0578, test_f1: 0.3727
 epoch: 15, train_loss: 1.0418, test_loss: 1.0599, test_f1: 0.3755
 epoch: 16, train_loss: 1.0312, test_loss: 1.0456, test_f1: 0.4054
 epoch: 17, train_loss: 1.0273, test_loss: 1.0498, test_f1: 0.4014
 epoch: 18, train_loss: 1.0209, test_loss: 1.0373, test_f1: 0.4139
 epoch: 19, train_loss: 1.0128, test_loss: 1.0469, test_f1: 0.4233
 epoch: 20, train_loss: 1.0146, test_loss: 1.0472, test_f1: 0.4302
 epoch: 21, train_loss: 1.0051, test_loss: 1.0253, test_f1: 0.4260
 epoch: 22, train_loss: 1.0085, test_loss: 1.0317, test_f1: 0.4345
 epoch: 23, train_loss: 0.9986, test_loss: 1.0329, test_f1: 0.4315
 epoch: 24, train_loss: 0.9899, test_loss: 1.0239, test_f1: 0.4461
 epoch: 25, train_loss: 0.9831, test_loss: 1.0296, test_f1: 0.4590
 epoch: 26, train_loss: 0.9829, test_loss: 0.9901, test_f1: 0.4698
 epoch: 27, train_loss: 0.9799, test_loss: 1.0224, test_f1: 0.4825
 epoch: 28, train_loss: 0.9702, test_loss: 1.0162, test_f1: 0.4683
 epoch: 29, train_loss: 0.9721, test_loss: 0.9993, test_f1: 0.4609
 epoch: 30, train_loss: 0.9656, test_loss: 0.9854, test_f1: 0.4834
 epoch: 31, train_loss: 0.9605, test_loss: 0.9765, test_f1: 0.4896
 epoch: 32, train_loss: 0.9561, test_loss: 0.9749, test_f1: 0.4913
 epoch: 33, train_loss: 0.9515, test_loss: 1.0056, test_f1: 0.4835
 epoch: 34, train_loss: 0.9521, test_loss: 0.9898, test_f1: 0.4887
 epoch: 35, train_loss: 0.9432, test_loss: 0.9701, test_f1: 0.5001
 epoch: 36, train_loss: 0.9386, test_loss: 0.9899, test_f1: 0.4990
 epoch: 37, train_loss: 0.9420, test_loss: 0.9788, test_f1: 0.5012
 epoch: 38, train_loss: 0.9292, test_loss: 0.9619, test_f1: 0.5000
 epoch: 39, train_loss: 0.9266, test_loss: 0.9643, test_f1: 0.5014
 epoch: 40, train_loss: 0.9298, test_loss: 0.9869, test_f1: 0.5119
 epoch: 41, train_loss: 0.9225, test_loss: 0.9659, test_f1: 0.5043
 epoch: 42, train_loss: 0.9216, test_loss: 0.9904, test_f1: 0.4997
 epoch: 43, train_loss: 0.9284, test_loss: 0.9568, test_f1: 0.5159
 epoch: 44, train_loss: 0.9139, test_loss: 0.9425, test_f1: 0.5142
 epoch: 45, train_loss: 0.9118, test_loss: 0.9609, test_f1: 0.5177
 epoch: 46, train_loss: 0.9121, test_loss: 0.9716, test_f1: 0.5114
 epoch: 47, train_loss: 0.9099, test_loss: 0.9347, test_f1: 0.5170
 epoch: 48, train_loss: 0.9007, test_loss: 0.9623, test_f1: 0.5070
 epoch: 49, train_loss: 0.9015, test_loss: 0.9468, test_f1: 0.5139
 epoch: 50, train_loss: 0.8969, test_loss: 0.9365, test_f1: 0.5118
 epoch: 51, train_loss: 0.8942, test_loss: 0.9169, test_f1: 0.5060
 epoch: 52, train_loss: 0.8843, test_loss: 0.9231, test_f1: 0.5093
 epoch: 53, train_loss: 0.8966, test_loss: 0.9345, test_f1: 0.5127
 epoch: 54, train_loss: 0.8807, test_loss: 0.9526, test_f1: 0.5129
 epoch: 55, train_loss: 0.8870, test_loss: 0.9342, test_f1: 0.5097
 epoch: 56, train_loss: 0.8853, test_loss: 0.9395, test_f1: 0.5160
 epoch: 57, train_loss: 0.8880, test_loss: 0.9375, test_f1: 0.5177
 epoch: 58, train_loss: 0.8853, test_loss: 0.9297, test_f1: 0.5218
 epoch: 59, train_loss: 0.8766, test_loss: 0.9258, test_f1: 0.5210
 epoch: 60, train_loss: 0.8772, test_loss: 0.9239, test_f1: 0.5231
 epoch: 61, train_loss: 0.8787, test_loss: 0.9244, test_f1: 0.5205
 epoch: 62, train_loss: 0.8753, test_loss: 0.9199, test_f1: 0.5230
 epoch: 63, train_loss: 0.8681, test_loss: 0.9481, test_f1: 0.5186
 epoch: 64, train_loss: 0.8814, test_loss: 0.9304, test_f1: 0.5242
 epoch: 65, train_loss: 0.8685, test_loss: 0.9343, test_f1: 0.5232
 epoch: 66, train_loss: 0.8655, test_loss: 0.9160, test_f1: 0.5224
 epoch: 67, train_loss: 0.8817, test_loss: 0.9316, test_f1: 0.5230
 epoch: 68, train_loss: 0.8697, test_loss: 0.9337, test_f1: 0.5235
 epoch: 69, train_loss: 0.8660, test_loss: 0.9162, test_f1: 0.5176
 epoch: 70, train_loss: 0.8658, test_loss: 0.9129, test_f1: 0.5213
 epoch: 71, train_loss: 0.8672, test_loss: 0.9187, test_f1: 0.5251
 epoch: 72, train_loss: 0.8717, test_loss: 0.9185, test_f1: 0.5278
 epoch: 73, train_loss: 0.8645, test_loss: 0.9126, test_f1: 0.5182
 epoch: 74, train_loss: 0.8678, test_loss: 0.9157, test_f1: 0.5181
 epoch: 75, train_loss: 0.8571, test_loss: 0.9080, test_f1: 0.5256
 epoch: 76, train_loss: 0.8668, test_loss: 0.8905, test_f1: 0.5223
 epoch: 77, train_loss: 0.8595, test_loss: 0.9279, test_f1: 0.5236
 epoch: 78, train_loss: 0.8610, test_loss: 0.9209, test_f1: 0.5208
 epoch: 79, train_loss: 0.8629, test_loss: 0.8988, test_f1: 0.5290
 epoch: 80, train_loss: 0.8743, test_loss: 0.9136, test_f1: 0.5285
 epoch: 81, train_loss: 0.8573, test_loss: 0.9178, test_f1: 0.5352
 epoch: 82, train_loss: 0.8558, test_loss: 0.9076, test_f1: 0.5291
 epoch: 83, train_loss: 0.8515, test_loss: 0.9044, test_f1: 0.5246
 epoch: 84, train_loss: 0.8519, test_loss: 0.9247, test_f1: 0.5224
 epoch: 85, train_loss: 0.8556, test_loss: 0.9036, test_f1: 0.5212
 epoch: 86, train_loss: 0.8539, test_loss: 0.9248, test_f1: 0.5271
 epoch: 87, train_loss: 0.8491, test_loss: 0.9223, test_f1: 0.5246
 epoch: 88, train_loss: 0.8528, test_loss: 0.9123, test_f1: 0.5249
 epoch: 89, train_loss: 0.8521, test_loss: 0.8938, test_f1: 0.5301
 epoch: 90, train_loss: 0.8424, test_loss: 0.9105, test_f1: 0.5274
 epoch: 91, train_loss: 0.8488, test_loss: 0.8893, test_f1: 0.5285
 epoch: 92, train_loss: 0.8479, test_loss: 0.9087, test_f1: 0.5279
 epoch: 93, train_loss: 0.8489, test_loss: 0.9133, test_f1: 0.5287
 epoch: 94, train_loss: 0.8428, test_loss: 0.8914, test_f1: 0.5316
 epoch: 95, train_loss: 0.8391, test_loss: 0.9014, test_f1: 0.5319
 epoch: 96, train_loss: 0.8407, test_loss: 0.9174, test_f1: 0.5170
 epoch: 97, train_loss: 0.8500, test_loss: 0.8783, test_f1: 0.5406
 epoch: 98, train_loss: 0.8441, test_loss: 0.9078, test_f1: 0.5249
 epoch: 99, train_loss: 0.8440, test_loss: 0.9244, test_f1: 0.5331
##################ITERATION #4 ****************************************
 epoch: 0, train_loss: 1.2833, test_loss: 1.3163, test_f1: 0.2270
 epoch: 1, train_loss: 1.2405, test_loss: 1.3418, test_f1: 0.2906
 epoch: 2, train_loss: 1.2131, test_loss: 1.2034, test_f1: 0.3059
 epoch: 3, train_loss: 1.1922, test_loss: 1.1729, test_f1: 0.3795
 epoch: 4, train_loss: 1.1684, test_loss: 1.1486, test_f1: 0.4174
 epoch: 5, train_loss: 1.1410, test_loss: 1.1291, test_f1: 0.4277
 epoch: 6, train_loss: 1.1256, test_loss: 1.1084, test_f1: 0.4374
 epoch: 7, train_loss: 1.1023, test_loss: 1.0961, test_f1: 0.4436
 epoch: 8, train_loss: 1.0859, test_loss: 1.0866, test_f1: 0.4505
 epoch: 9, train_loss: 1.0737, test_loss: 1.0794, test_f1: 0.4545
 epoch: 10, train_loss: 1.0601, test_loss: 1.0633, test_f1: 0.4733
 epoch: 11, train_loss: 1.0463, test_loss: 1.0566, test_f1: 0.4564
 epoch: 12, train_loss: 1.0380, test_loss: 1.0370, test_f1: 0.4735
 epoch: 13, train_loss: 1.0235, test_loss: 1.0445, test_f1: 0.4750
 epoch: 14, train_loss: 1.0199, test_loss: 1.0283, test_f1: 0.4774
 epoch: 15, train_loss: 1.0130, test_loss: 1.0194, test_f1: 0.4819
 epoch: 16, train_loss: 1.0105, test_loss: 1.0136, test_f1: 0.4844
 epoch: 17, train_loss: 1.0016, test_loss: 1.0066, test_f1: 0.4860
 epoch: 18, train_loss: 0.9985, test_loss: 1.0033, test_f1: 0.4755
 epoch: 19, train_loss: 0.9953, test_loss: 1.0017, test_f1: 0.4838
 epoch: 20, train_loss: 0.9812, test_loss: 0.9974, test_f1: 0.4858
 epoch: 21, train_loss: 0.9824, test_loss: 0.9919, test_f1: 0.4816
 epoch: 22, train_loss: 0.9746, test_loss: 0.9925, test_f1: 0.4860
 epoch: 23, train_loss: 0.9718, test_loss: 0.9728, test_f1: 0.4921
 epoch: 24, train_loss: 0.9663, test_loss: 0.9601, test_f1: 0.4952
 epoch: 25, train_loss: 0.9637, test_loss: 0.9555, test_f1: 0.4993
 epoch: 26, train_loss: 0.9601, test_loss: 0.9497, test_f1: 0.4994
 epoch: 27, train_loss: 0.9448, test_loss: 0.9508, test_f1: 0.5010
 epoch: 28, train_loss: 0.9494, test_loss: 0.9605, test_f1: 0.5005
 epoch: 29, train_loss: 0.9450, test_loss: 0.9415, test_f1: 0.4990
 epoch: 30, train_loss: 0.9337, test_loss: 0.9357, test_f1: 0.4974
 epoch: 31, train_loss: 0.9353, test_loss: 0.9322, test_f1: 0.5073
 epoch: 32, train_loss: 0.9227, test_loss: 0.9281, test_f1: 0.5128
 epoch: 33, train_loss: 0.9321, test_loss: 0.9210, test_f1: 0.5034
 epoch: 34, train_loss: 0.9221, test_loss: 0.9381, test_f1: 0.5202
 epoch: 35, train_loss: 0.9261, test_loss: 0.9208, test_f1: 0.5228
 epoch: 36, train_loss: 0.9193, test_loss: 0.9104, test_f1: 0.5374
 epoch: 37, train_loss: 0.9193, test_loss: 0.9244, test_f1: 0.5236
 epoch: 38, train_loss: 0.9125, test_loss: 0.9172, test_f1: 0.5186
 epoch: 39, train_loss: 0.9096, test_loss: 0.9165, test_f1: 0.5228
 epoch: 40, train_loss: 0.9051, test_loss: 0.9160, test_f1: 0.5297
 epoch: 41, train_loss: 0.8993, test_loss: 0.9303, test_f1: 0.5224
 epoch: 42, train_loss: 0.9029, test_loss: 0.9239, test_f1: 0.5117
 epoch: 43, train_loss: 0.8993, test_loss: 0.8972, test_f1: 0.5363
 epoch: 44, train_loss: 0.8897, test_loss: 0.9101, test_f1: 0.5286
 epoch: 45, train_loss: 0.8981, test_loss: 0.9304, test_f1: 0.5182
 epoch: 46, train_loss: 0.8909, test_loss: 0.9245, test_f1: 0.5213
 epoch: 47, train_loss: 0.8899, test_loss: 0.9242, test_f1: 0.5300
 epoch: 48, train_loss: 0.8844, test_loss: 0.8914, test_f1: 0.5335
 epoch: 49, train_loss: 0.8907, test_loss: 0.9047, test_f1: 0.5250
 epoch: 50, train_loss: 0.8811, test_loss: 0.9158, test_f1: 0.5360
 epoch: 51, train_loss: 0.8848, test_loss: 0.9049, test_f1: 0.5343
 epoch: 52, train_loss: 0.8782, test_loss: 0.9000, test_f1: 0.5304
 epoch: 53, train_loss: 0.8694, test_loss: 0.8918, test_f1: 0.5355
 epoch: 54, train_loss: 0.8730, test_loss: 0.9024, test_f1: 0.5150
 epoch: 55, train_loss: 0.8735, test_loss: 0.8937, test_f1: 0.5273
 epoch: 56, train_loss: 0.8688, test_loss: 0.9043, test_f1: 0.5331
 epoch: 57, train_loss: 0.8624, test_loss: 0.9079, test_f1: 0.5337
 epoch: 58, train_loss: 0.8596, test_loss: 0.8937, test_f1: 0.5296
 epoch: 59, train_loss: 0.8628, test_loss: 0.8997, test_f1: 0.5289
 epoch: 60, train_loss: 0.8637, test_loss: 0.9048, test_f1: 0.5265
 epoch: 61, train_loss: 0.8697, test_loss: 0.9062, test_f1: 0.5264
 epoch: 62, train_loss: 0.8685, test_loss: 0.8894, test_f1: 0.5317
 epoch: 63, train_loss: 0.8608, test_loss: 0.8799, test_f1: 0.5457
 epoch: 64, train_loss: 0.8657, test_loss: 0.8896, test_f1: 0.5368
 epoch: 65, train_loss: 0.8684, test_loss: 0.9029, test_f1: 0.5320
 epoch: 66, train_loss: 0.8615, test_loss: 0.8877, test_f1: 0.5367
 epoch: 67, train_loss: 0.8571, test_loss: 0.8832, test_f1: 0.5401
 epoch: 68, train_loss: 0.8597, test_loss: 0.8870, test_f1: 0.5307
 epoch: 69, train_loss: 0.8610, test_loss: 0.8938, test_f1: 0.5301
 epoch: 70, train_loss: 0.8607, test_loss: 0.8890, test_f1: 0.5298
 epoch: 71, train_loss: 0.8721, test_loss: 0.8822, test_f1: 0.5488
 epoch: 72, train_loss: 0.8568, test_loss: 0.8798, test_f1: 0.5437
 epoch: 73, train_loss: 0.8588, test_loss: 0.8981, test_f1: 0.5338
 epoch: 74, train_loss: 0.8506, test_loss: 0.8955, test_f1: 0.5330
 epoch: 75, train_loss: 0.8482, test_loss: 0.8952, test_f1: 0.5349
 epoch: 76, train_loss: 0.8521, test_loss: 0.8903, test_f1: 0.5323
 epoch: 77, train_loss: 0.8530, test_loss: 0.8807, test_f1: 0.5351
 epoch: 78, train_loss: 0.8569, test_loss: 0.8856, test_f1: 0.5320
 epoch: 79, train_loss: 0.8510, test_loss: 0.8833, test_f1: 0.5431
 epoch: 80, train_loss: 0.8494, test_loss: 0.8971, test_f1: 0.5380
 epoch: 81, train_loss: 0.8465, test_loss: 0.8684, test_f1: 0.5468
 epoch: 82, train_loss: 0.8461, test_loss: 0.8737, test_f1: 0.5541
 epoch: 83, train_loss: 0.8441, test_loss: 0.8859, test_f1: 0.5390
 epoch: 84, train_loss: 0.8430, test_loss: 0.8846, test_f1: 0.5355
 epoch: 85, train_loss: 0.8385, test_loss: 0.8990, test_f1: 0.5292
 epoch: 86, train_loss: 0.8367, test_loss: 0.8859, test_f1: 0.5339
 epoch: 87, train_loss: 0.8428, test_loss: 0.8970, test_f1: 0.5370
 epoch: 88, train_loss: 0.8384, test_loss: 0.8797, test_f1: 0.5374
 epoch: 89, train_loss: 0.8428, test_loss: 0.8689, test_f1: 0.5357
 epoch: 90, train_loss: 0.8393, test_loss: 0.8639, test_f1: 0.5434
 epoch: 91, train_loss: 0.8477, test_loss: 0.8785, test_f1: 0.5317
 epoch: 92, train_loss: 0.8367, test_loss: 0.8899, test_f1: 0.5319
 epoch: 93, train_loss: 0.8350, test_loss: 0.8777, test_f1: 0.5393
 epoch: 94, train_loss: 0.8282, test_loss: 0.8958, test_f1: 0.5316
 epoch: 95, train_loss: 0.8302, test_loss: 0.8892, test_f1: 0.5327
 epoch: 96, train_loss: 0.8368, test_loss: 0.8700, test_f1: 0.5456
 epoch: 97, train_loss: 0.8340, test_loss: 0.8585, test_f1: 0.5538
 epoch: 98, train_loss: 0.8226, test_loss: 0.8620, test_f1: 0.5538
 epoch: 99, train_loss: 0.8259, test_loss: 0.8808, test_f1: 0.5390
##################ITERATION #5 ****************************************
 epoch: 0, train_loss: 1.2778, test_loss: 1.3086, test_f1: 0.2270
 epoch: 1, train_loss: 1.2325, test_loss: 1.2699, test_f1: 0.2853
 epoch: 2, train_loss: 1.2045, test_loss: 1.2101, test_f1: 0.3239
 epoch: 3, train_loss: 1.1731, test_loss: 1.1504, test_f1: 0.3432
 epoch: 4, train_loss: 1.1530, test_loss: 1.1264, test_f1: 0.3431
 epoch: 5, train_loss: 1.1365, test_loss: 1.1078, test_f1: 0.3493
 epoch: 6, train_loss: 1.1192, test_loss: 1.1000, test_f1: 0.3575
 epoch: 7, train_loss: 1.1004, test_loss: 1.0871, test_f1: 0.3870
 epoch: 8, train_loss: 1.0873, test_loss: 1.0806, test_f1: 0.4069
 epoch: 9, train_loss: 1.0818, test_loss: 1.0742, test_f1: 0.4170
 epoch: 10, train_loss: 1.0674, test_loss: 1.0773, test_f1: 0.4113
 epoch: 11, train_loss: 1.0544, test_loss: 1.0530, test_f1: 0.4223
 epoch: 12, train_loss: 1.0434, test_loss: 1.0519, test_f1: 0.4162
 epoch: 13, train_loss: 1.0420, test_loss: 1.0490, test_f1: 0.4160
 epoch: 14, train_loss: 1.0382, test_loss: 1.0436, test_f1: 0.4258
 epoch: 15, train_loss: 1.0262, test_loss: 1.0476, test_f1: 0.4323
 epoch: 16, train_loss: 1.0242, test_loss: 1.0279, test_f1: 0.4404
 epoch: 17, train_loss: 1.0220, test_loss: 1.0247, test_f1: 0.4514
 epoch: 18, train_loss: 1.0070, test_loss: 1.0245, test_f1: 0.4465
 epoch: 19, train_loss: 1.0097, test_loss: 1.0156, test_f1: 0.4486
 epoch: 20, train_loss: 1.0023, test_loss: 1.0108, test_f1: 0.4566
 epoch: 21, train_loss: 1.0009, test_loss: 1.0131, test_f1: 0.4506
 epoch: 22, train_loss: 0.9927, test_loss: 1.0101, test_f1: 0.4526
 epoch: 23, train_loss: 0.9885, test_loss: 1.0055, test_f1: 0.4555
 epoch: 24, train_loss: 0.9813, test_loss: 1.0034, test_f1: 0.4676
 epoch: 25, train_loss: 0.9777, test_loss: 1.0010, test_f1: 0.4666
 epoch: 26, train_loss: 0.9723, test_loss: 0.9988, test_f1: 0.4672
 epoch: 27, train_loss: 0.9707, test_loss: 0.9827, test_f1: 0.4723
 epoch: 28, train_loss: 0.9697, test_loss: 0.9924, test_f1: 0.4705
 epoch: 29, train_loss: 0.9603, test_loss: 0.9898, test_f1: 0.4702
 epoch: 30, train_loss: 0.9584, test_loss: 0.9949, test_f1: 0.4678
 epoch: 31, train_loss: 0.9605, test_loss: 0.9755, test_f1: 0.4680
 epoch: 32, train_loss: 0.9554, test_loss: 0.9690, test_f1: 0.4715
 epoch: 33, train_loss: 0.9412, test_loss: 0.9719, test_f1: 0.4622
 epoch: 34, train_loss: 0.9426, test_loss: 0.9596, test_f1: 0.4737
 epoch: 35, train_loss: 0.9403, test_loss: 0.9588, test_f1: 0.4720
 epoch: 36, train_loss: 0.9423, test_loss: 0.9585, test_f1: 0.4721
 epoch: 37, train_loss: 0.9357, test_loss: 0.9854, test_f1: 0.4794
 epoch: 38, train_loss: 0.9265, test_loss: 0.9485, test_f1: 0.4708
 epoch: 39, train_loss: 0.9285, test_loss: 0.9469, test_f1: 0.4886
 epoch: 40, train_loss: 0.9236, test_loss: 0.9459, test_f1: 0.4869
 epoch: 41, train_loss: 0.9173, test_loss: 0.9677, test_f1: 0.4900
 epoch: 42, train_loss: 0.9244, test_loss: 0.9737, test_f1: 0.4890
 epoch: 43, train_loss: 0.9189, test_loss: 0.9527, test_f1: 0.4845
 epoch: 44, train_loss: 0.9176, test_loss: 0.9549, test_f1: 0.4865
 epoch: 45, train_loss: 0.9115, test_loss: 0.9574, test_f1: 0.4869
 epoch: 46, train_loss: 0.9212, test_loss: 0.9422, test_f1: 0.4938
 epoch: 47, train_loss: 0.9054, test_loss: 0.9389, test_f1: 0.5022
 epoch: 48, train_loss: 0.9038, test_loss: 0.9127, test_f1: 0.4998
 epoch: 49, train_loss: 0.9028, test_loss: 0.9168, test_f1: 0.4965
 epoch: 50, train_loss: 0.9020, test_loss: 0.9156, test_f1: 0.4988
 epoch: 51, train_loss: 0.8939, test_loss: 0.9111, test_f1: 0.5031
 epoch: 52, train_loss: 0.8970, test_loss: 0.9026, test_f1: 0.5140
 epoch: 53, train_loss: 0.8886, test_loss: 0.9126, test_f1: 0.4953
 epoch: 54, train_loss: 0.8992, test_loss: 0.9160, test_f1: 0.5068
 epoch: 55, train_loss: 0.8915, test_loss: 0.9097, test_f1: 0.5051
 epoch: 56, train_loss: 0.8899, test_loss: 0.9262, test_f1: 0.4996
 epoch: 57, train_loss: 0.8810, test_loss: 0.9149, test_f1: 0.5042
 epoch: 58, train_loss: 0.8902, test_loss: 0.9176, test_f1: 0.5040
 epoch: 59, train_loss: 0.8904, test_loss: 0.9209, test_f1: 0.5024
 epoch: 60, train_loss: 0.8863, test_loss: 0.9035, test_f1: 0.5027
 epoch: 61, train_loss: 0.8803, test_loss: 0.9045, test_f1: 0.5064
 epoch: 62, train_loss: 0.8767, test_loss: 0.8945, test_f1: 0.5130
 epoch: 63, train_loss: 0.8822, test_loss: 0.8947, test_f1: 0.5124
 epoch: 64, train_loss: 0.8850, test_loss: 0.9027, test_f1: 0.5042
 epoch: 65, train_loss: 0.8770, test_loss: 0.9193, test_f1: 0.4955
 epoch: 66, train_loss: 0.8731, test_loss: 0.8979, test_f1: 0.5096
 epoch: 67, train_loss: 0.8755, test_loss: 0.8962, test_f1: 0.5155
 epoch: 68, train_loss: 0.8746, test_loss: 0.8903, test_f1: 0.5212
 epoch: 69, train_loss: 0.8725, test_loss: 0.9087, test_f1: 0.5157
 epoch: 70, train_loss: 0.8695, test_loss: 0.9066, test_f1: 0.5023
 epoch: 71, train_loss: 0.8702, test_loss: 0.9000, test_f1: 0.5161
 epoch: 72, train_loss: 0.8778, test_loss: 0.8939, test_f1: 0.5065
 epoch: 73, train_loss: 0.8771, test_loss: 0.8891, test_f1: 0.5153
 epoch: 74, train_loss: 0.8668, test_loss: 0.8842, test_f1: 0.5270
 epoch: 75, train_loss: 0.8715, test_loss: 0.9059, test_f1: 0.5092
 epoch: 76, train_loss: 0.8594, test_loss: 0.8931, test_f1: 0.5250
 epoch: 77, train_loss: 0.8672, test_loss: 0.8910, test_f1: 0.5282
 epoch: 78, train_loss: 0.8660, test_loss: 0.8845, test_f1: 0.5364
 epoch: 79, train_loss: 0.8622, test_loss: 0.8863, test_f1: 0.5430
 epoch: 80, train_loss: 0.8652, test_loss: 0.9042, test_f1: 0.5280
 epoch: 81, train_loss: 0.8573, test_loss: 0.8741, test_f1: 0.5301
 epoch: 82, train_loss: 0.8626, test_loss: 0.8760, test_f1: 0.5413
 epoch: 83, train_loss: 0.8607, test_loss: 0.8831, test_f1: 0.5403
 epoch: 84, train_loss: 0.8569, test_loss: 0.8668, test_f1: 0.5344
 epoch: 85, train_loss: 0.8593, test_loss: 0.8650, test_f1: 0.5396
 epoch: 86, train_loss: 0.8593, test_loss: 0.8840, test_f1: 0.5232
 epoch: 87, train_loss: 0.8583, test_loss: 0.8849, test_f1: 0.5367
 epoch: 88, train_loss: 0.8591, test_loss: 0.8961, test_f1: 0.5412
 epoch: 89, train_loss: 0.8555, test_loss: 0.9030, test_f1: 0.5194
 epoch: 90, train_loss: 0.8512, test_loss: 0.8855, test_f1: 0.5236
 epoch: 91, train_loss: 0.8488, test_loss: 0.9024, test_f1: 0.5250
 epoch: 92, train_loss: 0.8483, test_loss: 0.8836, test_f1: 0.5401
 epoch: 93, train_loss: 0.8517, test_loss: 0.8760, test_f1: 0.5476
 epoch: 94, train_loss: 0.8474, test_loss: 0.8677, test_f1: 0.5288
 epoch: 95, train_loss: 0.8490, test_loss: 0.8697, test_f1: 0.5416
 epoch: 96, train_loss: 0.8491, test_loss: 0.8821, test_f1: 0.5389
 epoch: 97, train_loss: 0.8474, test_loss: 0.8857, test_f1: 0.5316
 epoch: 98, train_loss: 0.8423, test_loss: 0.8714, test_f1: 0.5469
 epoch: 99, train_loss: 0.8526, test_loss: 0.8612, test_f1: 0.5422
##################ITERATION #6 ****************************************
 epoch: 0, train_loss: 1.3003, test_loss: 1.3170, test_f1: 0.2270
 epoch: 1, train_loss: 1.2475, test_loss: 1.2937, test_f1: 0.2270
 epoch: 2, train_loss: 1.2197, test_loss: 1.2290, test_f1: 0.2551
 epoch: 3, train_loss: 1.1885, test_loss: 1.1647, test_f1: 0.3527
 epoch: 4, train_loss: 1.1560, test_loss: 1.1326, test_f1: 0.3844
 epoch: 5, train_loss: 1.1345, test_loss: 1.1056, test_f1: 0.3943
 epoch: 6, train_loss: 1.1124, test_loss: 1.0919, test_f1: 0.3989
 epoch: 7, train_loss: 1.0951, test_loss: 1.0736, test_f1: 0.3978
 epoch: 8, train_loss: 1.0763, test_loss: 1.0712, test_f1: 0.4320
 epoch: 9, train_loss: 1.0623, test_loss: 1.0658, test_f1: 0.4347
 epoch: 10, train_loss: 1.0509, test_loss: 1.0538, test_f1: 0.4528
 epoch: 11, train_loss: 1.0461, test_loss: 1.0557, test_f1: 0.4661
 epoch: 12, train_loss: 1.0396, test_loss: 1.0419, test_f1: 0.4469
 epoch: 13, train_loss: 1.0367, test_loss: 1.0467, test_f1: 0.4523
 epoch: 14, train_loss: 1.0201, test_loss: 1.0399, test_f1: 0.4610
 epoch: 15, train_loss: 1.0253, test_loss: 1.0344, test_f1: 0.4667
 epoch: 16, train_loss: 1.0176, test_loss: 1.0293, test_f1: 0.4604
 epoch: 17, train_loss: 1.0121, test_loss: 1.0301, test_f1: 0.4674
 epoch: 18, train_loss: 1.0018, test_loss: 1.0303, test_f1: 0.4689
 epoch: 19, train_loss: 0.9996, test_loss: 1.0310, test_f1: 0.4660
 epoch: 20, train_loss: 0.9991, test_loss: 1.0258, test_f1: 0.4714
 epoch: 21, train_loss: 0.9869, test_loss: 1.0190, test_f1: 0.4642
 epoch: 22, train_loss: 0.9759, test_loss: 1.0081, test_f1: 0.4671
 epoch: 23, train_loss: 0.9888, test_loss: 1.0000, test_f1: 0.4785
 epoch: 24, train_loss: 0.9767, test_loss: 0.9998, test_f1: 0.4692
 epoch: 25, train_loss: 0.9700, test_loss: 1.0023, test_f1: 0.4757
 epoch: 26, train_loss: 0.9702, test_loss: 0.9845, test_f1: 0.4884
 epoch: 27, train_loss: 0.9631, test_loss: 0.9806, test_f1: 0.4733
 epoch: 28, train_loss: 0.9678, test_loss: 0.9803, test_f1: 0.4792
 epoch: 29, train_loss: 0.9709, test_loss: 0.9761, test_f1: 0.4837
 epoch: 30, train_loss: 0.9607, test_loss: 0.9785, test_f1: 0.4783
 epoch: 31, train_loss: 0.9518, test_loss: 0.9712, test_f1: 0.4969
 epoch: 32, train_loss: 0.9604, test_loss: 0.9703, test_f1: 0.4924
 epoch: 33, train_loss: 0.9455, test_loss: 0.9670, test_f1: 0.4831
 epoch: 34, train_loss: 0.9515, test_loss: 0.9786, test_f1: 0.4733
 epoch: 35, train_loss: 0.9429, test_loss: 0.9689, test_f1: 0.4931
 epoch: 36, train_loss: 0.9401, test_loss: 0.9548, test_f1: 0.5040
 epoch: 37, train_loss: 0.9396, test_loss: 0.9478, test_f1: 0.4942
 epoch: 38, train_loss: 0.9292, test_loss: 0.9496, test_f1: 0.5015
 epoch: 39, train_loss: 0.9379, test_loss: 0.9518, test_f1: 0.5005
 epoch: 40, train_loss: 0.9280, test_loss: 0.9547, test_f1: 0.4977
 epoch: 41, train_loss: 0.9256, test_loss: 0.9439, test_f1: 0.5095
 epoch: 42, train_loss: 0.9233, test_loss: 0.9498, test_f1: 0.4895
 epoch: 43, train_loss: 0.9197, test_loss: 0.9480, test_f1: 0.4967
 epoch: 44, train_loss: 0.9127, test_loss: 0.9240, test_f1: 0.5033
 epoch: 45, train_loss: 0.9127, test_loss: 0.9343, test_f1: 0.4981
 epoch: 46, train_loss: 0.9128, test_loss: 0.9278, test_f1: 0.5117
 epoch: 47, train_loss: 0.9058, test_loss: 0.9455, test_f1: 0.4987
 epoch: 48, train_loss: 0.9127, test_loss: 0.9170, test_f1: 0.5148
 epoch: 49, train_loss: 0.9076, test_loss: 0.9200, test_f1: 0.5109
 epoch: 50, train_loss: 0.8990, test_loss: 0.9161, test_f1: 0.5107
 epoch: 51, train_loss: 0.9074, test_loss: 0.9050, test_f1: 0.5129
 epoch: 52, train_loss: 0.9008, test_loss: 0.9168, test_f1: 0.5137
 epoch: 53, train_loss: 0.8921, test_loss: 0.9249, test_f1: 0.5163
 epoch: 54, train_loss: 0.8924, test_loss: 0.9209, test_f1: 0.5204
 epoch: 55, train_loss: 0.8910, test_loss: 0.9201, test_f1: 0.5204
 epoch: 56, train_loss: 0.8929, test_loss: 0.9040, test_f1: 0.5289
 epoch: 57, train_loss: 0.8956, test_loss: 0.9092, test_f1: 0.5228
 epoch: 58, train_loss: 0.8880, test_loss: 0.9156, test_f1: 0.5237
 epoch: 59, train_loss: 0.8887, test_loss: 0.9188, test_f1: 0.5142
 epoch: 60, train_loss: 0.8857, test_loss: 0.9088, test_f1: 0.5265
 epoch: 61, train_loss: 0.8907, test_loss: 0.9017, test_f1: 0.5261
 epoch: 62, train_loss: 0.8858, test_loss: 0.9007, test_f1: 0.5208
 epoch: 63, train_loss: 0.8899, test_loss: 0.9079, test_f1: 0.5223
 epoch: 64, train_loss: 0.8883, test_loss: 0.8889, test_f1: 0.5263
 epoch: 65, train_loss: 0.8811, test_loss: 0.9034, test_f1: 0.5263
 epoch: 66, train_loss: 0.8743, test_loss: 0.9019, test_f1: 0.5180
 epoch: 67, train_loss: 0.8820, test_loss: 0.9090, test_f1: 0.5190
 epoch: 68, train_loss: 0.8773, test_loss: 0.8979, test_f1: 0.5275
 epoch: 69, train_loss: 0.8789, test_loss: 0.8970, test_f1: 0.5260
 epoch: 70, train_loss: 0.8783, test_loss: 0.8955, test_f1: 0.5229
 epoch: 71, train_loss: 0.8782, test_loss: 0.8992, test_f1: 0.5272
 epoch: 72, train_loss: 0.8786, test_loss: 0.8965, test_f1: 0.5300
 epoch: 73, train_loss: 0.8770, test_loss: 0.8998, test_f1: 0.5191
 epoch: 74, train_loss: 0.8744, test_loss: 0.8890, test_f1: 0.5262
 epoch: 75, train_loss: 0.8785, test_loss: 0.9074, test_f1: 0.5225
 epoch: 76, train_loss: 0.8742, test_loss: 0.8849, test_f1: 0.5269
 epoch: 77, train_loss: 0.8776, test_loss: 0.8885, test_f1: 0.5241
 epoch: 78, train_loss: 0.8708, test_loss: 0.8896, test_f1: 0.5257
 epoch: 79, train_loss: 0.8725, test_loss: 0.9033, test_f1: 0.5228
 epoch: 80, train_loss: 0.8677, test_loss: 0.8841, test_f1: 0.5259
 epoch: 81, train_loss: 0.8708, test_loss: 0.8832, test_f1: 0.5273
 epoch: 82, train_loss: 0.8756, test_loss: 0.8831, test_f1: 0.5265
 epoch: 83, train_loss: 0.8611, test_loss: 0.8795, test_f1: 0.5277
 epoch: 84, train_loss: 0.8656, test_loss: 0.8783, test_f1: 0.5230
 epoch: 85, train_loss: 0.8649, test_loss: 0.8898, test_f1: 0.5274
 epoch: 86, train_loss: 0.8529, test_loss: 0.8826, test_f1: 0.5329
 epoch: 87, train_loss: 0.8563, test_loss: 0.8910, test_f1: 0.5253
 epoch: 88, train_loss: 0.8639, test_loss: 0.8830, test_f1: 0.5261
 epoch: 89, train_loss: 0.8663, test_loss: 0.8796, test_f1: 0.5334
 epoch: 90, train_loss: 0.8598, test_loss: 0.8897, test_f1: 0.5266
 epoch: 91, train_loss: 0.8620, test_loss: 0.8780, test_f1: 0.5225
 epoch: 92, train_loss: 0.8616, test_loss: 0.8856, test_f1: 0.5321
 epoch: 93, train_loss: 0.8592, test_loss: 0.8914, test_f1: 0.5319
 epoch: 94, train_loss: 0.8571, test_loss: 0.8780, test_f1: 0.5263
 epoch: 95, train_loss: 0.8645, test_loss: 0.8837, test_f1: 0.5254
 epoch: 96, train_loss: 0.8570, test_loss: 0.8773, test_f1: 0.5299
 epoch: 97, train_loss: 0.8508, test_loss: 0.8703, test_f1: 0.5242
 epoch: 98, train_loss: 0.8580, test_loss: 0.8777, test_f1: 0.5304
 epoch: 99, train_loss: 0.8524, test_loss: 0.8831, test_f1: 0.5300
##################ITERATION #7 ****************************************
 epoch: 0, train_loss: 1.3300, test_loss: 1.3518, test_f1: 0.2270
 epoch: 1, train_loss: 1.2280, test_loss: 1.2655, test_f1: 0.3059
 epoch: 2, train_loss: 1.1897, test_loss: 1.1843, test_f1: 0.3303
 epoch: 3, train_loss: 1.1671, test_loss: 1.1326, test_f1: 0.3480
 epoch: 4, train_loss: 1.1330, test_loss: 1.1099, test_f1: 0.3675
 epoch: 5, train_loss: 1.1167, test_loss: 1.0959, test_f1: 0.3927
 epoch: 6, train_loss: 1.1061, test_loss: 1.0844, test_f1: 0.4162
 epoch: 7, train_loss: 1.0839, test_loss: 1.0681, test_f1: 0.4211
 epoch: 8, train_loss: 1.0755, test_loss: 1.0550, test_f1: 0.4426
 epoch: 9, train_loss: 1.0620, test_loss: 1.0487, test_f1: 0.4466
 epoch: 10, train_loss: 1.0490, test_loss: 1.0410, test_f1: 0.4402
 epoch: 11, train_loss: 1.0381, test_loss: 1.0289, test_f1: 0.4574
 epoch: 12, train_loss: 1.0279, test_loss: 1.0214, test_f1: 0.4621
 epoch: 13, train_loss: 1.0201, test_loss: 1.0110, test_f1: 0.4568
 epoch: 14, train_loss: 1.0129, test_loss: 1.0087, test_f1: 0.4655
 epoch: 15, train_loss: 1.0097, test_loss: 1.0111, test_f1: 0.4479
 epoch: 16, train_loss: 1.0040, test_loss: 0.9955, test_f1: 0.4631
 epoch: 17, train_loss: 0.9983, test_loss: 0.9811, test_f1: 0.4756
 epoch: 18, train_loss: 0.9880, test_loss: 0.9832, test_f1: 0.4627
 epoch: 19, train_loss: 0.9887, test_loss: 0.9726, test_f1: 0.4720
 epoch: 20, train_loss: 0.9763, test_loss: 0.9671, test_f1: 0.4839
 epoch: 21, train_loss: 0.9704, test_loss: 0.9580, test_f1: 0.4790
 epoch: 22, train_loss: 0.9634, test_loss: 0.9597, test_f1: 0.4725
 epoch: 23, train_loss: 0.9585, test_loss: 0.9515, test_f1: 0.4866
 epoch: 24, train_loss: 0.9611, test_loss: 0.9425, test_f1: 0.4844
 epoch: 25, train_loss: 0.9509, test_loss: 0.9413, test_f1: 0.4920
 epoch: 26, train_loss: 0.9523, test_loss: 0.9449, test_f1: 0.4844
 epoch: 27, train_loss: 0.9381, test_loss: 0.9534, test_f1: 0.4886
 epoch: 28, train_loss: 0.9402, test_loss: 0.9265, test_f1: 0.4964
 epoch: 29, train_loss: 0.9345, test_loss: 0.9157, test_f1: 0.5092
 epoch: 30, train_loss: 0.9356, test_loss: 0.9156, test_f1: 0.5134
 epoch: 31, train_loss: 0.9276, test_loss: 0.9198, test_f1: 0.4953
 epoch: 32, train_loss: 0.9278, test_loss: 0.9190, test_f1: 0.4851
 epoch: 33, train_loss: 0.9241, test_loss: 0.9077, test_f1: 0.5142
 epoch: 34, train_loss: 0.9116, test_loss: 0.9041, test_f1: 0.5217
 epoch: 35, train_loss: 0.9096, test_loss: 0.9236, test_f1: 0.5006
 epoch: 36, train_loss: 0.9237, test_loss: 0.9068, test_f1: 0.5093
 epoch: 37, train_loss: 0.8995, test_loss: 0.8974, test_f1: 0.5236
 epoch: 38, train_loss: 0.9036, test_loss: 0.8940, test_f1: 0.5320
 epoch: 39, train_loss: 0.8995, test_loss: 0.8928, test_f1: 0.5157
 epoch: 40, train_loss: 0.9011, test_loss: 0.8995, test_f1: 0.5140
 epoch: 41, train_loss: 0.9019, test_loss: 0.9313, test_f1: 0.5109
 epoch: 42, train_loss: 0.9072, test_loss: 0.8806, test_f1: 0.5347
 epoch: 43, train_loss: 0.9001, test_loss: 0.8908, test_f1: 0.5355
 epoch: 44, train_loss: 0.8950, test_loss: 0.9082, test_f1: 0.5078
 epoch: 45, train_loss: 0.8835, test_loss: 0.8694, test_f1: 0.5384
 epoch: 46, train_loss: 0.8784, test_loss: 0.8880, test_f1: 0.5186
 epoch: 47, train_loss: 0.8806, test_loss: 0.8735, test_f1: 0.5247
 epoch: 48, train_loss: 0.8819, test_loss: 0.8790, test_f1: 0.5440
 epoch: 49, train_loss: 0.8717, test_loss: 0.8633, test_f1: 0.5361
 epoch: 50, train_loss: 0.8772, test_loss: 0.8682, test_f1: 0.5377
 epoch: 51, train_loss: 0.8699, test_loss: 0.8586, test_f1: 0.5327
 epoch: 52, train_loss: 0.8686, test_loss: 0.8759, test_f1: 0.5402
 epoch: 53, train_loss: 0.8673, test_loss: 0.8578, test_f1: 0.5337
 epoch: 54, train_loss: 0.8638, test_loss: 0.8567, test_f1: 0.5427
 epoch: 55, train_loss: 0.8608, test_loss: 0.8646, test_f1: 0.5407
 epoch: 56, train_loss: 0.8704, test_loss: 0.8533, test_f1: 0.5396
 epoch: 57, train_loss: 0.8593, test_loss: 0.8512, test_f1: 0.5397
 epoch: 58, train_loss: 0.8532, test_loss: 0.8530, test_f1: 0.5411
 epoch: 59, train_loss: 0.8614, test_loss: 0.8477, test_f1: 0.5492
 epoch: 60, train_loss: 0.8590, test_loss: 0.8514, test_f1: 0.5533
 epoch: 61, train_loss: 0.8591, test_loss: 0.8455, test_f1: 0.5458
 epoch: 62, train_loss: 0.8579, test_loss: 0.8477, test_f1: 0.5474
 epoch: 63, train_loss: 0.8581, test_loss: 0.8622, test_f1: 0.5533
 epoch: 64, train_loss: 0.8492, test_loss: 0.8460, test_f1: 0.5434
 epoch: 65, train_loss: 0.8474, test_loss: 0.8461, test_f1: 0.5536
 epoch: 66, train_loss: 0.8546, test_loss: 0.8472, test_f1: 0.5454
 epoch: 67, train_loss: 0.8551, test_loss: 0.8494, test_f1: 0.5493
 epoch: 68, train_loss: 0.8496, test_loss: 0.8430, test_f1: 0.5451
 epoch: 69, train_loss: 0.8484, test_loss: 0.8467, test_f1: 0.5473
 epoch: 70, train_loss: 0.8413, test_loss: 0.8501, test_f1: 0.5566
 epoch: 71, train_loss: 0.8523, test_loss: 0.8419, test_f1: 0.5465
 epoch: 72, train_loss: 0.8432, test_loss: 0.8471, test_f1: 0.5439
 epoch: 73, train_loss: 0.8395, test_loss: 0.8432, test_f1: 0.5496
 epoch: 74, train_loss: 0.8375, test_loss: 0.8369, test_f1: 0.5459
 epoch: 75, train_loss: 0.8367, test_loss: 0.8400, test_f1: 0.5414
 epoch: 76, train_loss: 0.8453, test_loss: 0.8339, test_f1: 0.5532
 epoch: 77, train_loss: 0.8319, test_loss: 0.8356, test_f1: 0.5596
 epoch: 78, train_loss: 0.8452, test_loss: 0.8433, test_f1: 0.5482
 epoch: 79, train_loss: 0.8381, test_loss: 0.8445, test_f1: 0.5496
 epoch: 80, train_loss: 0.8375, test_loss: 0.8361, test_f1: 0.5503
 epoch: 81, train_loss: 0.8384, test_loss: 0.8333, test_f1: 0.5434
 epoch: 82, train_loss: 0.8377, test_loss: 0.8326, test_f1: 0.5576
 epoch: 83, train_loss: 0.8362, test_loss: 0.8363, test_f1: 0.5535
 epoch: 84, train_loss: 0.8353, test_loss: 0.8351, test_f1: 0.5506
 epoch: 85, train_loss: 0.8328, test_loss: 0.8395, test_f1: 0.5623
 epoch: 86, train_loss: 0.8340, test_loss: 0.8354, test_f1: 0.5524
 epoch: 87, train_loss: 0.8351, test_loss: 0.8299, test_f1: 0.5509
 epoch: 88, train_loss: 0.8314, test_loss: 0.8316, test_f1: 0.5525
 epoch: 89, train_loss: 0.8225, test_loss: 0.8417, test_f1: 0.5479
 epoch: 90, train_loss: 0.8237, test_loss: 0.8278, test_f1: 0.5450
 epoch: 91, train_loss: 0.8306, test_loss: 0.8277, test_f1: 0.5628
 epoch: 92, train_loss: 0.8244, test_loss: 0.8335, test_f1: 0.5488
 epoch: 93, train_loss: 0.8154, test_loss: 0.8295, test_f1: 0.5535
 epoch: 94, train_loss: 0.8173, test_loss: 0.8308, test_f1: 0.5505
 epoch: 95, train_loss: 0.8323, test_loss: 0.8334, test_f1: 0.5497
 epoch: 96, train_loss: 0.8263, test_loss: 0.8262, test_f1: 0.5502
 epoch: 97, train_loss: 0.8244, test_loss: 0.8233, test_f1: 0.5462
 epoch: 98, train_loss: 0.8205, test_loss: 0.8312, test_f1: 0.5468
 epoch: 99, train_loss: 0.8170, test_loss: 0.8283, test_f1: 0.5516
##################ITERATION #8 ****************************************
 epoch: 0, train_loss: 1.3539, test_loss: 1.3944, test_f1: 0.2270
 epoch: 1, train_loss: 1.2234, test_loss: 1.2464, test_f1: 0.2270
 epoch: 2, train_loss: 1.1702, test_loss: 1.1183, test_f1: 0.3113
 epoch: 3, train_loss: 1.1339, test_loss: 1.0735, test_f1: 0.3670
 epoch: 4, train_loss: 1.1006, test_loss: 1.0613, test_f1: 0.3933
 epoch: 5, train_loss: 1.0809, test_loss: 1.0462, test_f1: 0.4058
 epoch: 6, train_loss: 1.0714, test_loss: 1.0394, test_f1: 0.4325
 epoch: 7, train_loss: 1.0597, test_loss: 1.0324, test_f1: 0.4376
 epoch: 8, train_loss: 1.0526, test_loss: 1.0294, test_f1: 0.4480
 epoch: 9, train_loss: 1.0364, test_loss: 1.0175, test_f1: 0.4681
 epoch: 10, train_loss: 1.0241, test_loss: 1.0107, test_f1: 0.4632
 epoch: 11, train_loss: 1.0169, test_loss: 1.0058, test_f1: 0.4773
 epoch: 12, train_loss: 1.0071, test_loss: 0.9953, test_f1: 0.4840
 epoch: 13, train_loss: 0.9966, test_loss: 0.9867, test_f1: 0.5037
 epoch: 14, train_loss: 0.9913, test_loss: 0.9745, test_f1: 0.5025
 epoch: 15, train_loss: 0.9889, test_loss: 0.9722, test_f1: 0.5075
 epoch: 16, train_loss: 0.9744, test_loss: 0.9607, test_f1: 0.5027
 epoch: 17, train_loss: 0.9665, test_loss: 0.9557, test_f1: 0.5100
 epoch: 18, train_loss: 0.9659, test_loss: 0.9568, test_f1: 0.5193
 epoch: 19, train_loss: 0.9625, test_loss: 0.9573, test_f1: 0.5120
 epoch: 20, train_loss: 0.9627, test_loss: 0.9412, test_f1: 0.5141
 epoch: 21, train_loss: 0.9483, test_loss: 0.9356, test_f1: 0.5007
 epoch: 22, train_loss: 0.9573, test_loss: 0.9463, test_f1: 0.5135
 epoch: 23, train_loss: 0.9478, test_loss: 0.9348, test_f1: 0.5145
 epoch: 24, train_loss: 0.9488, test_loss: 0.9241, test_f1: 0.5249
 epoch: 25, train_loss: 0.9356, test_loss: 0.9217, test_f1: 0.5161
 epoch: 26, train_loss: 0.9359, test_loss: 0.9296, test_f1: 0.5094
 epoch: 27, train_loss: 0.9314, test_loss: 0.9196, test_f1: 0.5221
 epoch: 28, train_loss: 0.9284, test_loss: 0.9080, test_f1: 0.5267
 epoch: 29, train_loss: 0.9240, test_loss: 0.9010, test_f1: 0.5271
 epoch: 30, train_loss: 0.9140, test_loss: 0.9041, test_f1: 0.5250
 epoch: 31, train_loss: 0.9161, test_loss: 0.9123, test_f1: 0.5217
 epoch: 32, train_loss: 0.9121, test_loss: 0.8946, test_f1: 0.5143
 epoch: 33, train_loss: 0.9046, test_loss: 0.8856, test_f1: 0.5277
 epoch: 34, train_loss: 0.9108, test_loss: 0.8831, test_f1: 0.5312
 epoch: 35, train_loss: 0.9037, test_loss: 0.8950, test_f1: 0.5360
 epoch: 36, train_loss: 0.8997, test_loss: 0.8825, test_f1: 0.5325
 epoch: 37, train_loss: 0.8972, test_loss: 0.8879, test_f1: 0.5312
 epoch: 38, train_loss: 0.8984, test_loss: 0.8827, test_f1: 0.5223
 epoch: 39, train_loss: 0.8911, test_loss: 0.8739, test_f1: 0.5419
 epoch: 40, train_loss: 0.8896, test_loss: 0.8817, test_f1: 0.5245
 epoch: 41, train_loss: 0.8907, test_loss: 0.8689, test_f1: 0.5420
 epoch: 42, train_loss: 0.8821, test_loss: 0.8655, test_f1: 0.5461
 epoch: 43, train_loss: 0.8802, test_loss: 0.8650, test_f1: 0.5459
 epoch: 44, train_loss: 0.8790, test_loss: 0.8620, test_f1: 0.5459
 epoch: 45, train_loss: 0.8734, test_loss: 0.8623, test_f1: 0.5518
 epoch: 46, train_loss: 0.8695, test_loss: 0.8603, test_f1: 0.5520
 epoch: 47, train_loss: 0.8718, test_loss: 0.8589, test_f1: 0.5494
 epoch: 48, train_loss: 0.8694, test_loss: 0.8535, test_f1: 0.5543
 epoch: 49, train_loss: 0.8733, test_loss: 0.8659, test_f1: 0.5328
 epoch: 50, train_loss: 0.8604, test_loss: 0.8544, test_f1: 0.5569
 epoch: 51, train_loss: 0.8574, test_loss: 0.8592, test_f1: 0.5408
 epoch: 52, train_loss: 0.8656, test_loss: 0.8538, test_f1: 0.5522
 epoch: 53, train_loss: 0.8546, test_loss: 0.8534, test_f1: 0.5570
 epoch: 54, train_loss: 0.8652, test_loss: 0.8504, test_f1: 0.5538
 epoch: 55, train_loss: 0.8453, test_loss: 0.8545, test_f1: 0.5566
 epoch: 56, train_loss: 0.8550, test_loss: 0.8553, test_f1: 0.5406
 epoch: 57, train_loss: 0.8526, test_loss: 0.8492, test_f1: 0.5562
 epoch: 58, train_loss: 0.8528, test_loss: 0.8491, test_f1: 0.5601
 epoch: 59, train_loss: 0.8442, test_loss: 0.8506, test_f1: 0.5621
 epoch: 60, train_loss: 0.8484, test_loss: 0.8489, test_f1: 0.5564
 epoch: 61, train_loss: 0.8476, test_loss: 0.8517, test_f1: 0.5536
 epoch: 62, train_loss: 0.8462, test_loss: 0.8508, test_f1: 0.5572
 epoch: 63, train_loss: 0.8419, test_loss: 0.8510, test_f1: 0.5546
 epoch: 64, train_loss: 0.8406, test_loss: 0.8508, test_f1: 0.5535
 epoch: 65, train_loss: 0.8460, test_loss: 0.8476, test_f1: 0.5598
 epoch: 66, train_loss: 0.8406, test_loss: 0.8436, test_f1: 0.5612
 epoch: 67, train_loss: 0.8410, test_loss: 0.8440, test_f1: 0.5640
 epoch: 68, train_loss: 0.8405, test_loss: 0.8485, test_f1: 0.5583
 epoch: 69, train_loss: 0.8346, test_loss: 0.8464, test_f1: 0.5553
 epoch: 70, train_loss: 0.8348, test_loss: 0.8473, test_f1: 0.5574
 epoch: 71, train_loss: 0.8347, test_loss: 0.8378, test_f1: 0.5605
 epoch: 72, train_loss: 0.8319, test_loss: 0.8375, test_f1: 0.5575
 epoch: 73, train_loss: 0.8311, test_loss: 0.8390, test_f1: 0.5619
 epoch: 74, train_loss: 0.8316, test_loss: 0.8453, test_f1: 0.5556
 epoch: 75, train_loss: 0.8232, test_loss: 0.8375, test_f1: 0.5613
 epoch: 76, train_loss: 0.8306, test_loss: 0.8394, test_f1: 0.5609
 epoch: 77, train_loss: 0.8278, test_loss: 0.8397, test_f1: 0.5654
 epoch: 78, train_loss: 0.8274, test_loss: 0.8432, test_f1: 0.5613
 epoch: 79, train_loss: 0.8239, test_loss: 0.8385, test_f1: 0.5666
 epoch: 80, train_loss: 0.8253, test_loss: 0.8419, test_f1: 0.5604
 epoch: 81, train_loss: 0.8236, test_loss: 0.8395, test_f1: 0.5564
 epoch: 82, train_loss: 0.8292, test_loss: 0.8374, test_f1: 0.5640
 epoch: 83, train_loss: 0.8182, test_loss: 0.8413, test_f1: 0.5650
 epoch: 84, train_loss: 0.8255, test_loss: 0.8371, test_f1: 0.5588
 epoch: 85, train_loss: 0.8203, test_loss: 0.8381, test_f1: 0.5575
 epoch: 86, train_loss: 0.8161, test_loss: 0.8334, test_f1: 0.5637
 epoch: 87, train_loss: 0.8314, test_loss: 0.8323, test_f1: 0.5609
 epoch: 88, train_loss: 0.8154, test_loss: 0.8371, test_f1: 0.5580
 epoch: 89, train_loss: 0.8166, test_loss: 0.8345, test_f1: 0.5684
 epoch: 90, train_loss: 0.8239, test_loss: 0.8323, test_f1: 0.5638
 epoch: 91, train_loss: 0.8138, test_loss: 0.8314, test_f1: 0.5647
 epoch: 92, train_loss: 0.8182, test_loss: 0.8388, test_f1: 0.5640
 epoch: 93, train_loss: 0.8269, test_loss: 0.8343, test_f1: 0.5619
 epoch: 94, train_loss: 0.8200, test_loss: 0.8358, test_f1: 0.5602
 epoch: 95, train_loss: 0.8159, test_loss: 0.8310, test_f1: 0.5698
 epoch: 96, train_loss: 0.8021, test_loss: 0.8335, test_f1: 0.5639
 epoch: 97, train_loss: 0.8043, test_loss: 0.8316, test_f1: 0.5691
 epoch: 98, train_loss: 0.8163, test_loss: 0.8281, test_f1: 0.5684
 epoch: 99, train_loss: 0.8136, test_loss: 0.8320, test_f1: 0.5618
##################ITERATION #9 ****************************************
 epoch: 0, train_loss: 1.3206, test_loss: 1.3593, test_f1: 0.2270
 epoch: 1, train_loss: 1.2348, test_loss: 1.3079, test_f1: 0.2270
 epoch: 2, train_loss: 1.2012, test_loss: 1.1573, test_f1: 0.2993
 epoch: 3, train_loss: 1.1627, test_loss: 1.1077, test_f1: 0.3433
 epoch: 4, train_loss: 1.1430, test_loss: 1.0816, test_f1: 0.3697
 epoch: 5, train_loss: 1.1204, test_loss: 1.0646, test_f1: 0.3992
 epoch: 6, train_loss: 1.1008, test_loss: 1.0500, test_f1: 0.4028
 epoch: 7, train_loss: 1.0800, test_loss: 1.0349, test_f1: 0.4270
 epoch: 8, train_loss: 1.0725, test_loss: 1.0296, test_f1: 0.4454
 epoch: 9, train_loss: 1.0504, test_loss: 1.0137, test_f1: 0.4481
 epoch: 10, train_loss: 1.0469, test_loss: 0.9992, test_f1: 0.4476
 epoch: 11, train_loss: 1.0351, test_loss: 0.9936, test_f1: 0.4746
 epoch: 12, train_loss: 1.0215, test_loss: 0.9847, test_f1: 0.4657
 epoch: 13, train_loss: 1.0165, test_loss: 0.9677, test_f1: 0.4776
 epoch: 14, train_loss: 1.0097, test_loss: 0.9625, test_f1: 0.4778
 epoch: 15, train_loss: 0.9969, test_loss: 0.9612, test_f1: 0.4828
 epoch: 16, train_loss: 0.9957, test_loss: 0.9649, test_f1: 0.4783
 epoch: 17, train_loss: 0.9778, test_loss: 0.9632, test_f1: 0.4850
 epoch: 18, train_loss: 0.9771, test_loss: 0.9664, test_f1: 0.4822
 epoch: 19, train_loss: 0.9710, test_loss: 0.9649, test_f1: 0.4886
 epoch: 20, train_loss: 0.9725, test_loss: 0.9621, test_f1: 0.4849
 epoch: 21, train_loss: 0.9545, test_loss: 0.9542, test_f1: 0.4834
 epoch: 22, train_loss: 0.9547, test_loss: 0.9518, test_f1: 0.4926
 epoch: 23, train_loss: 0.9548, test_loss: 0.9589, test_f1: 0.5032
 epoch: 24, train_loss: 0.9590, test_loss: 0.9539, test_f1: 0.4956
 epoch: 25, train_loss: 0.9478, test_loss: 0.9546, test_f1: 0.4887
 epoch: 26, train_loss: 0.9379, test_loss: 0.9499, test_f1: 0.5039
 epoch: 27, train_loss: 0.9378, test_loss: 0.9426, test_f1: 0.4973
 epoch: 28, train_loss: 0.9336, test_loss: 0.9410, test_f1: 0.5054
 epoch: 29, train_loss: 0.9292, test_loss: 0.9396, test_f1: 0.5055
 epoch: 30, train_loss: 0.9315, test_loss: 0.9331, test_f1: 0.5128
 epoch: 31, train_loss: 0.9226, test_loss: 0.9303, test_f1: 0.5173
 epoch: 32, train_loss: 0.9117, test_loss: 0.9336, test_f1: 0.5168
 epoch: 33, train_loss: 0.9166, test_loss: 0.9268, test_f1: 0.5029
 epoch: 34, train_loss: 0.9199, test_loss: 0.9359, test_f1: 0.4960
 epoch: 35, train_loss: 0.9180, test_loss: 0.9349, test_f1: 0.5023
 epoch: 36, train_loss: 0.9010, test_loss: 0.9256, test_f1: 0.5293
 epoch: 37, train_loss: 0.8966, test_loss: 0.9498, test_f1: 0.5189
 epoch: 38, train_loss: 0.9092, test_loss: 0.9554, test_f1: 0.5125
 epoch: 39, train_loss: 0.8959, test_loss: 0.9320, test_f1: 0.5126
 epoch: 40, train_loss: 0.8894, test_loss: 0.9182, test_f1: 0.5112
 epoch: 41, train_loss: 0.8896, test_loss: 0.9075, test_f1: 0.5262
 epoch: 42, train_loss: 0.8903, test_loss: 0.9112, test_f1: 0.5119
 epoch: 43, train_loss: 0.8824, test_loss: 0.9328, test_f1: 0.5193
 epoch: 44, train_loss: 0.8854, test_loss: 0.9213, test_f1: 0.5204
 epoch: 45, train_loss: 0.8722, test_loss: 0.9393, test_f1: 0.5266
 epoch: 46, train_loss: 0.8811, test_loss: 0.9471, test_f1: 0.5253
 epoch: 47, train_loss: 0.8776, test_loss: 0.9168, test_f1: 0.5296
 epoch: 48, train_loss: 0.8739, test_loss: 0.9048, test_f1: 0.5305
 epoch: 49, train_loss: 0.8599, test_loss: 0.9084, test_f1: 0.5209
 epoch: 50, train_loss: 0.8654, test_loss: 0.9334, test_f1: 0.5352
 epoch: 51, train_loss: 0.8698, test_loss: 0.9398, test_f1: 0.5422
 epoch: 52, train_loss: 0.8585, test_loss: 0.9422, test_f1: 0.5356
 epoch: 53, train_loss: 0.8544, test_loss: 0.9419, test_f1: 0.5335
 epoch: 54, train_loss: 0.8485, test_loss: 0.9413, test_f1: 0.5391
 epoch: 55, train_loss: 0.8541, test_loss: 0.9258, test_f1: 0.5354
 epoch: 56, train_loss: 0.8559, test_loss: 0.9302, test_f1: 0.5379
 epoch: 57, train_loss: 0.8509, test_loss: 0.9185, test_f1: 0.5231
 epoch: 58, train_loss: 0.8595, test_loss: 0.9192, test_f1: 0.5398
 epoch: 59, train_loss: 0.8457, test_loss: 0.9288, test_f1: 0.5294
 epoch: 60, train_loss: 0.8420, test_loss: 0.9328, test_f1: 0.5392
 epoch: 61, train_loss: 0.8465, test_loss: 0.9293, test_f1: 0.5411
 epoch: 62, train_loss: 0.8494, test_loss: 0.9239, test_f1: 0.5382
 epoch: 63, train_loss: 0.8494, test_loss: 0.9100, test_f1: 0.5338
 epoch: 64, train_loss: 0.8481, test_loss: 0.9168, test_f1: 0.5422
 epoch: 65, train_loss: 0.8468, test_loss: 0.9191, test_f1: 0.5389
 epoch: 66, train_loss: 0.8460, test_loss: 0.9249, test_f1: 0.5325
 epoch: 67, train_loss: 0.8428, test_loss: 0.9282, test_f1: 0.5385
 epoch: 68, train_loss: 0.8361, test_loss: 0.9397, test_f1: 0.5321
 epoch: 69, train_loss: 0.8345, test_loss: 0.9265, test_f1: 0.5352
 epoch: 70, train_loss: 0.8415, test_loss: 0.9425, test_f1: 0.5358
 epoch: 71, train_loss: 0.8370, test_loss: 0.9374, test_f1: 0.5339
 epoch: 72, train_loss: 0.8329, test_loss: 0.9451, test_f1: 0.5265
 epoch: 73, train_loss: 0.8302, test_loss: 0.9355, test_f1: 0.5301
 epoch: 74, train_loss: 0.8287, test_loss: 0.9481, test_f1: 0.5336
 epoch: 75, train_loss: 0.8321, test_loss: 0.9389, test_f1: 0.5320
 epoch: 76, train_loss: 0.8247, test_loss: 0.9212, test_f1: 0.5248
 epoch: 77, train_loss: 0.8304, test_loss: 0.9308, test_f1: 0.5287
 epoch: 78, train_loss: 0.8316, test_loss: 0.9383, test_f1: 0.5388
 epoch: 79, train_loss: 0.8235, test_loss: 0.9371, test_f1: 0.5328
 epoch: 80, train_loss: 0.8302, test_loss: 0.9270, test_f1: 0.5289
 epoch: 81, train_loss: 0.8279, test_loss: 0.9490, test_f1: 0.5306
 epoch: 82, train_loss: 0.8238, test_loss: 0.9344, test_f1: 0.5360
 epoch: 83, train_loss: 0.8186, test_loss: 0.9361, test_f1: 0.5456
 epoch: 84, train_loss: 0.8167, test_loss: 0.9343, test_f1: 0.5312
 epoch: 85, train_loss: 0.8149, test_loss: 0.9427, test_f1: 0.5308
 epoch: 86, train_loss: 0.8194, test_loss: 0.9317, test_f1: 0.5294
 epoch: 87, train_loss: 0.8248, test_loss: 0.8970, test_f1: 0.5342
 epoch: 88, train_loss: 0.8292, test_loss: 0.9153, test_f1: 0.5285
 epoch: 89, train_loss: 0.8141, test_loss: 0.9179, test_f1: 0.5428
 epoch: 90, train_loss: 0.8039, test_loss: 0.9375, test_f1: 0.5328
 epoch: 91, train_loss: 0.8108, test_loss: 0.9330, test_f1: 0.5306
 epoch: 92, train_loss: 0.8169, test_loss: 0.9271, test_f1: 0.5263
 epoch: 93, train_loss: 0.8131, test_loss: 0.9366, test_f1: 0.5276
 epoch: 94, train_loss: 0.8135, test_loss: 0.9414, test_f1: 0.5270
 epoch: 95, train_loss: 0.8052, test_loss: 0.9465, test_f1: 0.5272
 epoch: 96, train_loss: 0.8117, test_loss: 0.9366, test_f1: 0.5294
 epoch: 97, train_loss: 0.8112, test_loss: 0.9414, test_f1: 0.5407
 epoch: 98, train_loss: 0.8109, test_loss: 0.9755, test_f1: 0.5319
 epoch: 99, train_loss: 0.8172, test_loss: 0.9530, test_f1: 0.5398

Training completed in 889.27 seconds
Best F1: 0.5698 at epoch 95
Mean F1 across iterations: 0.5448  0.0166
========================FINAL RESULTS================================
FEGIN weighted F1: 0.5698  0.0166
python main.py --data ltspice_examples --representation component_pin_net --model FEGIN --layers 6 --hiddens 32 --batch_size 128 --lr 0.0001 --emb_size 128 --epochs 100 --save_appendix component_pin_net_L6_H32_BS128_LR0.0001_E128 --no_val
-----



STDERR:
  File "main.py", line 370, in <module>
    main()
  File "main.py", line 254, in main
    dataset = dataset_class(
  File "/home/philip/projects/llm_inference_code_repo/Circuit-Completion-Using-GNNs/component_classification_with_link_prediction_head/evaluation/FEGIN/kernel/circuit_datasets.py", line 15, in __init__
    self.data, self.slices = torch.load(self.processed_paths[0])
  File "/home/philip/.local/lib/python3.8/site-packages/torch/serialization.py", line 1040, in load
    warnings.warn(
  File "/usr/lib/python3.8/warnings.py", line 109, in _showwarnmsg
    sw(msg.message, msg.category, msg.filename, msg.lineno,
  File "main.py", line 47, in warn_with_traceback
    traceback.print_stack(file=log)
/home/philip/projects/llm_inference_code_repo/Circuit-Completion-Using-GNNs/component_classification_with_link_prediction_head/evaluation/FEGIN/kernel/circuit_datasets.py:15: FutureWarning: You are using `torch.load` with `weights_only=False` (the current default value), which uses the default pickle module implicitly. It is possible to construct malicious pickle data which will execute arbitrary code during unpickling (See https://github.com/pytorch/pytorch/blob/main/SECURITY.md#untrusted-models for more details). In a future release, the default value for `weights_only` will be flipped to `True`. This limits the functions that could be executed during unpickling. Arbitrary objects will no longer be allowed to be loaded via this mode unless they are explicitly allowlisted by the user via `torch.serialization.add_safe_globals`. We recommend you start setting `weights_only=True` for any use case where you don't have full control of the loaded file. Please open an issue on GitHub for any issues related to this experimental feature.
  self.data, self.slices = torch.load(self.processed_paths[0])
