STDOUT:
Results will be saved in /home/philip/projects/ltspice_examples_code_repo/Circuit-Completion-Using-GNNs/component_classification_with_link_prediction_head/evaluation/FEGIN/results/model_FEGIN_dataset_ltspice_demos
Command line input: python main.py --data ltspice_demos --representation component_pin --model FEGIN --layers 3 --hiddens 64 --batch_size 64 --lr 0.001 --emb_size 250 --epochs 100 --save_appendix component_pin_L3_H64_BS64_LR0.001_E250 --no_val
 is saved.
-----
ltspice_demos - FEGIN
Using 3 layers, 64 hidden units, h = 2
Loading component_pin representation dataset
ENTERED
Training FEGIN on component_pin representation
Train: 1565, Test: 383
##################ITERATION #0 ****************************************
 epoch: 0, train_loss: 1.3132, test_loss: 1.3033, test_f1: 0.2655
 epoch: 1, train_loss: 1.1782, test_loss: 1.2472, test_f1: 0.3426
 epoch: 2, train_loss: 1.1342, test_loss: 1.2012, test_f1: 0.4630
 epoch: 3, train_loss: 1.0837, test_loss: 1.1372, test_f1: 0.4638
 epoch: 4, train_loss: 1.0097, test_loss: 1.0831, test_f1: 0.4739
 epoch: 5, train_loss: 0.9613, test_loss: 1.0529, test_f1: 0.5139
 epoch: 6, train_loss: 0.9263, test_loss: 1.0312, test_f1: 0.5572
 epoch: 7, train_loss: 0.8735, test_loss: 1.0054, test_f1: 0.5400
 epoch: 8, train_loss: 0.8565, test_loss: 0.9805, test_f1: 0.5487
 epoch: 9, train_loss: 0.8281, test_loss: 1.0352, test_f1: 0.5365
 epoch: 10, train_loss: 0.7964, test_loss: 1.0232, test_f1: 0.5725
 epoch: 11, train_loss: 0.7704, test_loss: 0.9682, test_f1: 0.5989
 epoch: 12, train_loss: 0.7630, test_loss: 0.9610, test_f1: 0.5648
 epoch: 13, train_loss: 0.7320, test_loss: 0.9955, test_f1: 0.5699
 epoch: 14, train_loss: 0.7210, test_loss: 0.9708, test_f1: 0.5945
 epoch: 15, train_loss: 0.6924, test_loss: 0.9853, test_f1: 0.6057
 epoch: 16, train_loss: 0.6718, test_loss: 1.0319, test_f1: 0.5726
 epoch: 17, train_loss: 0.6683, test_loss: 1.1110, test_f1: 0.5484
 epoch: 18, train_loss: 0.6670, test_loss: 1.0749, test_f1: 0.5511
 epoch: 19, train_loss: 0.6541, test_loss: 1.0959, test_f1: 0.5593
 epoch: 20, train_loss: 0.6331, test_loss: 1.0918, test_f1: 0.5980
 epoch: 21, train_loss: 0.6295, test_loss: 1.0679, test_f1: 0.5677
 epoch: 22, train_loss: 0.6103, test_loss: 1.0642, test_f1: 0.5997
 epoch: 23, train_loss: 0.5847, test_loss: 1.1702, test_f1: 0.5522
 epoch: 24, train_loss: 0.5994, test_loss: 1.0612, test_f1: 0.5663
 epoch: 25, train_loss: 0.6026, test_loss: 1.1077, test_f1: 0.5744
 epoch: 26, train_loss: 0.5796, test_loss: 1.1499, test_f1: 0.5891
 epoch: 27, train_loss: 0.5669, test_loss: 1.1041, test_f1: 0.5896
 epoch: 28, train_loss: 0.5522, test_loss: 1.1720, test_f1: 0.5970
 epoch: 29, train_loss: 0.5432, test_loss: 1.1118, test_f1: 0.6324
 epoch: 30, train_loss: 0.5455, test_loss: 1.1509, test_f1: 0.6067
 epoch: 31, train_loss: 0.5329, test_loss: 1.1803, test_f1: 0.6000
 epoch: 32, train_loss: 0.5266, test_loss: 1.2537, test_f1: 0.5402
 epoch: 33, train_loss: 0.5168, test_loss: 1.2145, test_f1: 0.5968
 epoch: 34, train_loss: 0.5032, test_loss: 1.3387, test_f1: 0.6335
 epoch: 35, train_loss: 0.4743, test_loss: 1.3238, test_f1: 0.5696
 epoch: 36, train_loss: 0.4645, test_loss: 1.5096, test_f1: 0.6291
 epoch: 37, train_loss: 0.4657, test_loss: 1.3923, test_f1: 0.6274
 epoch: 38, train_loss: 0.4838, test_loss: 1.3521, test_f1: 0.6307
 epoch: 39, train_loss: 0.4530, test_loss: 1.2240, test_f1: 0.6331
 epoch: 40, train_loss: 0.4461, test_loss: 1.2727, test_f1: 0.5890
 epoch: 41, train_loss: 0.4013, test_loss: 1.3074, test_f1: 0.6358
 epoch: 42, train_loss: 0.3958, test_loss: 1.3279, test_f1: 0.6436
 epoch: 43, train_loss: 0.4029, test_loss: 1.5025, test_f1: 0.6214
 epoch: 44, train_loss: 0.4150, test_loss: 1.4094, test_f1: 0.6512
 epoch: 45, train_loss: 0.3805, test_loss: 1.4090, test_f1: 0.6074
 epoch: 46, train_loss: 0.3581, test_loss: 1.4401, test_f1: 0.6295
 epoch: 47, train_loss: 0.3619, test_loss: 1.4266, test_f1: 0.6446
 epoch: 48, train_loss: 0.3515, test_loss: 1.3791, test_f1: 0.6340
 epoch: 49, train_loss: 0.3348, test_loss: 1.5071, test_f1: 0.6267
 epoch: 50, train_loss: 0.3225, test_loss: 1.3855, test_f1: 0.6812
 epoch: 51, train_loss: 0.2893, test_loss: 1.7261, test_f1: 0.6710
 epoch: 52, train_loss: 0.2744, test_loss: 1.5700, test_f1: 0.6309
 epoch: 53, train_loss: 0.2486, test_loss: 1.8634, test_f1: 0.6011
 epoch: 54, train_loss: 0.2327, test_loss: 1.8714, test_f1: 0.6045
 epoch: 55, train_loss: 0.2290, test_loss: 1.8585, test_f1: 0.6099
 epoch: 56, train_loss: 0.2316, test_loss: 1.9491, test_f1: 0.6238
 epoch: 57, train_loss: 0.2582, test_loss: 2.0962, test_f1: 0.5986
 epoch: 58, train_loss: 0.2040, test_loss: 1.9062, test_f1: 0.6382
 epoch: 59, train_loss: 0.2124, test_loss: 1.8905, test_f1: 0.6268
 epoch: 60, train_loss: 0.2292, test_loss: 2.1545, test_f1: 0.6268
 epoch: 61, train_loss: 0.2390, test_loss: 1.8925, test_f1: 0.6326
 epoch: 62, train_loss: 0.2059, test_loss: 2.1911, test_f1: 0.6320
 epoch: 63, train_loss: 0.2346, test_loss: 2.2352, test_f1: 0.6121
 epoch: 64, train_loss: 0.2121, test_loss: 1.8642, test_f1: 0.6338
 epoch: 65, train_loss: 0.1735, test_loss: 2.1017, test_f1: 0.6318
 epoch: 66, train_loss: 0.1768, test_loss: 2.1115, test_f1: 0.6264
 epoch: 67, train_loss: 0.1665, test_loss: 2.1562, test_f1: 0.6197
 epoch: 68, train_loss: 0.1637, test_loss: 2.1138, test_f1: 0.6398
 epoch: 69, train_loss: 0.1823, test_loss: 2.2303, test_f1: 0.6426
 epoch: 70, train_loss: 0.1750, test_loss: 2.0222, test_f1: 0.6474
 epoch: 71, train_loss: 0.1596, test_loss: 2.0872, test_f1: 0.6351
 epoch: 72, train_loss: 0.1790, test_loss: 2.2739, test_f1: 0.6249
 epoch: 73, train_loss: 0.1288, test_loss: 2.1345, test_f1: 0.6456
 epoch: 74, train_loss: 0.1524, test_loss: 2.1607, test_f1: 0.6306
 epoch: 75, train_loss: 0.1605, test_loss: 2.6369, test_f1: 0.5751
 epoch: 76, train_loss: 0.1563, test_loss: 2.3254, test_f1: 0.6097
 epoch: 77, train_loss: 0.1533, test_loss: 2.3207, test_f1: 0.6234
 epoch: 78, train_loss: 0.1605, test_loss: 2.4696, test_f1: 0.6355
 epoch: 79, train_loss: 0.1561, test_loss: 2.1279, test_f1: 0.6337
 epoch: 80, train_loss: 0.1401, test_loss: 2.2609, test_f1: 0.6231
 epoch: 81, train_loss: 0.1550, test_loss: 2.3848, test_f1: 0.6419
 epoch: 82, train_loss: 0.1372, test_loss: 2.4810, test_f1: 0.6222
 epoch: 83, train_loss: 0.1365, test_loss: 2.5617, test_f1: 0.6379
 epoch: 84, train_loss: 0.1357, test_loss: 2.5066, test_f1: 0.6293
 epoch: 85, train_loss: 0.1301, test_loss: 2.2480, test_f1: 0.6481
 epoch: 86, train_loss: 0.1405, test_loss: 2.3421, test_f1: 0.6216
 epoch: 87, train_loss: 0.1214, test_loss: 2.2104, test_f1: 0.6685
 epoch: 88, train_loss: 0.1535, test_loss: 2.5209, test_f1: 0.6189
 epoch: 89, train_loss: 0.1421, test_loss: 2.3372, test_f1: 0.6132
 epoch: 90, train_loss: 0.1432, test_loss: 2.3154, test_f1: 0.6435
 epoch: 91, train_loss: 0.1477, test_loss: 2.3375, test_f1: 0.6069
 epoch: 92, train_loss: 0.1344, test_loss: 2.4185, test_f1: 0.6479
 epoch: 93, train_loss: 0.1132, test_loss: 2.4846, test_f1: 0.6286
 epoch: 94, train_loss: 0.1365, test_loss: 2.4152, test_f1: 0.6273
 epoch: 95, train_loss: 0.1236, test_loss: 2.4959, test_f1: 0.6214
 epoch: 96, train_loss: 0.1098, test_loss: 2.6910, test_f1: 0.6067
 epoch: 97, train_loss: 0.0957, test_loss: 2.6006, test_f1: 0.6300
 epoch: 98, train_loss: 0.1199, test_loss: 2.8515, test_f1: 0.5945
 epoch: 99, train_loss: 0.1356, test_loss: 2.7166, test_f1: 0.5861
##################ITERATION #1 ****************************************
 epoch: 0, train_loss: 1.2040, test_loss: 1.3007, test_f1: 0.2860
 epoch: 1, train_loss: 1.0387, test_loss: 1.3953, test_f1: 0.3775
 epoch: 2, train_loss: 0.9773, test_loss: 1.0963, test_f1: 0.5284
 epoch: 3, train_loss: 0.8915, test_loss: 0.9767, test_f1: 0.5636
 epoch: 4, train_loss: 0.8435, test_loss: 0.9806, test_f1: 0.5549
 epoch: 5, train_loss: 0.8057, test_loss: 0.9506, test_f1: 0.6283
 epoch: 6, train_loss: 0.7710, test_loss: 1.0613, test_f1: 0.5040
 epoch: 7, train_loss: 0.7672, test_loss: 0.9086, test_f1: 0.6481
 epoch: 8, train_loss: 0.7170, test_loss: 0.9733, test_f1: 0.6355
 epoch: 9, train_loss: 0.7143, test_loss: 1.2579, test_f1: 0.4535
 epoch: 10, train_loss: 0.7079, test_loss: 1.0045, test_f1: 0.5981
 epoch: 11, train_loss: 0.6797, test_loss: 1.1637, test_f1: 0.5316
 epoch: 12, train_loss: 0.6578, test_loss: 1.0908, test_f1: 0.5911
 epoch: 13, train_loss: 0.6455, test_loss: 0.9962, test_f1: 0.5607
 epoch: 14, train_loss: 0.6210, test_loss: 1.0434, test_f1: 0.5555
 epoch: 15, train_loss: 0.5852, test_loss: 1.1077, test_f1: 0.6136
 epoch: 16, train_loss: 0.5728, test_loss: 1.0125, test_f1: 0.6551
 epoch: 17, train_loss: 0.5829, test_loss: 1.0095, test_f1: 0.6333
 epoch: 18, train_loss: 0.5809, test_loss: 1.1919, test_f1: 0.5573
 epoch: 19, train_loss: 0.5419, test_loss: 1.3699, test_f1: 0.5857
 epoch: 20, train_loss: 0.5473, test_loss: 1.1534, test_f1: 0.6232
 epoch: 21, train_loss: 0.5545, test_loss: 1.0749, test_f1: 0.6563
 epoch: 22, train_loss: 0.5231, test_loss: 1.2767, test_f1: 0.5941
 epoch: 23, train_loss: 0.5063, test_loss: 1.0067, test_f1: 0.6447
 epoch: 24, train_loss: 0.5190, test_loss: 1.2521, test_f1: 0.5821
 epoch: 25, train_loss: 0.5170, test_loss: 1.2354, test_f1: 0.5964
 epoch: 26, train_loss: 0.4637, test_loss: 1.1974, test_f1: 0.5991
 epoch: 27, train_loss: 0.4718, test_loss: 1.1490, test_f1: 0.6377
 epoch: 28, train_loss: 0.4803, test_loss: 1.2784, test_f1: 0.5954
 epoch: 29, train_loss: 0.4866, test_loss: 1.2337, test_f1: 0.6342
 epoch: 30, train_loss: 0.4485, test_loss: 1.1828, test_f1: 0.6547
 epoch: 31, train_loss: 0.4306, test_loss: 1.3361, test_f1: 0.6049
 epoch: 32, train_loss: 0.4599, test_loss: 1.1756, test_f1: 0.6454
 epoch: 33, train_loss: 0.4115, test_loss: 1.4655, test_f1: 0.6033
 epoch: 34, train_loss: 0.3959, test_loss: 1.4056, test_f1: 0.6081
 epoch: 35, train_loss: 0.3874, test_loss: 1.4507, test_f1: 0.6568
 epoch: 36, train_loss: 0.3847, test_loss: 1.6160, test_f1: 0.5752
 epoch: 37, train_loss: 0.4000, test_loss: 1.3783, test_f1: 0.6674
 epoch: 38, train_loss: 0.3812, test_loss: 1.5754, test_f1: 0.6315
 epoch: 39, train_loss: 0.3730, test_loss: 1.2853, test_f1: 0.6228
 epoch: 40, train_loss: 0.3522, test_loss: 1.5851, test_f1: 0.6319
 epoch: 41, train_loss: 0.3432, test_loss: 1.4329, test_f1: 0.6020
 epoch: 42, train_loss: 0.3415, test_loss: 1.4712, test_f1: 0.6246
 epoch: 43, train_loss: 0.3498, test_loss: 1.6894, test_f1: 0.6312
 epoch: 44, train_loss: 0.3147, test_loss: 1.6232, test_f1: 0.6465
 epoch: 45, train_loss: 0.3209, test_loss: 1.6577, test_f1: 0.6093
 epoch: 46, train_loss: 0.3674, test_loss: 2.1078, test_f1: 0.5835
 epoch: 47, train_loss: 0.3792, test_loss: 1.7641, test_f1: 0.5901
 epoch: 48, train_loss: 0.3172, test_loss: 1.4727, test_f1: 0.6245
 epoch: 49, train_loss: 0.3412, test_loss: 1.4751, test_f1: 0.6120
 epoch: 50, train_loss: 0.2901, test_loss: 1.5707, test_f1: 0.6523
 epoch: 51, train_loss: 0.2741, test_loss: 1.6259, test_f1: 0.6411
 epoch: 52, train_loss: 0.2476, test_loss: 1.5795, test_f1: 0.6448
 epoch: 53, train_loss: 0.2206, test_loss: 1.7732, test_f1: 0.6461
 epoch: 54, train_loss: 0.2037, test_loss: 1.5999, test_f1: 0.6674
 epoch: 55, train_loss: 0.2218, test_loss: 2.1376, test_f1: 0.6330
 epoch: 56, train_loss: 0.2230, test_loss: 2.0468, test_f1: 0.6290
 epoch: 57, train_loss: 0.1987, test_loss: 1.8351, test_f1: 0.6297
 epoch: 58, train_loss: 0.2101, test_loss: 1.9092, test_f1: 0.6642
 epoch: 59, train_loss: 0.2028, test_loss: 1.8385, test_f1: 0.6452
 epoch: 60, train_loss: 0.1717, test_loss: 1.8055, test_f1: 0.6447
 epoch: 61, train_loss: 0.1895, test_loss: 2.0722, test_f1: 0.6106
 epoch: 62, train_loss: 0.2106, test_loss: 1.8491, test_f1: 0.6425
 epoch: 63, train_loss: 0.2054, test_loss: 1.9306, test_f1: 0.6275
 epoch: 64, train_loss: 0.1664, test_loss: 2.0660, test_f1: 0.6632
 epoch: 65, train_loss: 0.1709, test_loss: 2.0972, test_f1: 0.6380
 epoch: 66, train_loss: 0.1727, test_loss: 1.9460, test_f1: 0.6292
 epoch: 67, train_loss: 0.1828, test_loss: 1.9959, test_f1: 0.6376
 epoch: 68, train_loss: 0.1641, test_loss: 2.1956, test_f1: 0.5912
 epoch: 69, train_loss: 0.1766, test_loss: 2.1569, test_f1: 0.6574
 epoch: 70, train_loss: 0.1667, test_loss: 2.0153, test_f1: 0.6469
 epoch: 71, train_loss: 0.1588, test_loss: 2.0237, test_f1: 0.6714
 epoch: 72, train_loss: 0.1571, test_loss: 2.1277, test_f1: 0.6349
 epoch: 73, train_loss: 0.1674, test_loss: 2.2335, test_f1: 0.6130
 epoch: 74, train_loss: 0.1768, test_loss: 2.2331, test_f1: 0.6486
 epoch: 75, train_loss: 0.1390, test_loss: 2.2462, test_f1: 0.6400
 epoch: 76, train_loss: 0.1329, test_loss: 2.3228, test_f1: 0.6299
 epoch: 77, train_loss: 0.1615, test_loss: 2.6265, test_f1: 0.5993
 epoch: 78, train_loss: 0.1601, test_loss: 2.2767, test_f1: 0.6217
 epoch: 79, train_loss: 0.1555, test_loss: 2.3827, test_f1: 0.6334
 epoch: 80, train_loss: 0.1548, test_loss: 2.2919, test_f1: 0.6412
 epoch: 81, train_loss: 0.1682, test_loss: 2.4532, test_f1: 0.6015
 epoch: 82, train_loss: 0.1325, test_loss: 2.1594, test_f1: 0.6630
 epoch: 83, train_loss: 0.1441, test_loss: 2.2337, test_f1: 0.6362
 epoch: 84, train_loss: 0.1436, test_loss: 2.2758, test_f1: 0.5886
 epoch: 85, train_loss: 0.1322, test_loss: 2.3193, test_f1: 0.6377
 epoch: 86, train_loss: 0.1477, test_loss: 2.3919, test_f1: 0.6640
 epoch: 87, train_loss: 0.1488, test_loss: 2.5102, test_f1: 0.6469
 epoch: 88, train_loss: 0.1220, test_loss: 2.5084, test_f1: 0.6194
 epoch: 89, train_loss: 0.1237, test_loss: 2.8122, test_f1: 0.6335
 epoch: 90, train_loss: 0.1456, test_loss: 2.5995, test_f1: 0.6595
 epoch: 91, train_loss: 0.1447, test_loss: 2.3950, test_f1: 0.6132
 epoch: 92, train_loss: 0.1492, test_loss: 2.5387, test_f1: 0.6086
 epoch: 93, train_loss: 0.1674, test_loss: 2.4085, test_f1: 0.6652
 epoch: 94, train_loss: 0.1309, test_loss: 2.5234, test_f1: 0.6426
 epoch: 95, train_loss: 0.1420, test_loss: 2.5201, test_f1: 0.6399
 epoch: 96, train_loss: 0.1301, test_loss: 2.6097, test_f1: 0.6322
 epoch: 97, train_loss: 0.1035, test_loss: 2.5647, test_f1: 0.6389
 epoch: 98, train_loss: 0.1346, test_loss: 2.3568, test_f1: 0.6669
 epoch: 99, train_loss: 0.1647, test_loss: 2.7827, test_f1: 0.6456
##################ITERATION #2 ****************************************
 epoch: 0, train_loss: 1.1601, test_loss: 1.2491, test_f1: 0.3105
 epoch: 1, train_loss: 0.9619, test_loss: 1.0406, test_f1: 0.5422
 epoch: 2, train_loss: 0.8830, test_loss: 0.9926, test_f1: 0.4809
 epoch: 3, train_loss: 0.8350, test_loss: 0.9713, test_f1: 0.5259
 epoch: 4, train_loss: 0.8205, test_loss: 0.9955, test_f1: 0.5628
 epoch: 5, train_loss: 0.7723, test_loss: 1.0085, test_f1: 0.6234
 epoch: 6, train_loss: 0.7476, test_loss: 0.9612, test_f1: 0.6055
 epoch: 7, train_loss: 0.7258, test_loss: 0.9832, test_f1: 0.6190
 epoch: 8, train_loss: 0.6956, test_loss: 0.9843, test_f1: 0.5928
 epoch: 9, train_loss: 0.6947, test_loss: 0.9858, test_f1: 0.5992
 epoch: 10, train_loss: 0.6940, test_loss: 1.0494, test_f1: 0.5250
 epoch: 11, train_loss: 0.6545, test_loss: 1.2187, test_f1: 0.5687
 epoch: 12, train_loss: 0.6501, test_loss: 1.0422, test_f1: 0.5938
 epoch: 13, train_loss: 0.6174, test_loss: 1.2075, test_f1: 0.6008
 epoch: 14, train_loss: 0.6123, test_loss: 1.1197, test_f1: 0.6409
 epoch: 15, train_loss: 0.6146, test_loss: 1.1367, test_f1: 0.5721
 epoch: 16, train_loss: 0.5917, test_loss: 1.1740, test_f1: 0.5974
 epoch: 17, train_loss: 0.5595, test_loss: 1.0012, test_f1: 0.6472
 epoch: 18, train_loss: 0.5734, test_loss: 1.1827, test_f1: 0.6362
 epoch: 19, train_loss: 0.5391, test_loss: 1.1845, test_f1: 0.6268
 epoch: 20, train_loss: 0.5661, test_loss: 1.0830, test_f1: 0.6309
 epoch: 21, train_loss: 0.5251, test_loss: 1.2949, test_f1: 0.5818
 epoch: 22, train_loss: 0.5448, test_loss: 1.3031, test_f1: 0.5675
 epoch: 23, train_loss: 0.5237, test_loss: 1.2717, test_f1: 0.5333
 epoch: 24, train_loss: 0.5078, test_loss: 1.2570, test_f1: 0.5913
 epoch: 25, train_loss: 0.4814, test_loss: 1.3630, test_f1: 0.6015
 epoch: 26, train_loss: 0.4551, test_loss: 1.5280, test_f1: 0.6057
 epoch: 27, train_loss: 0.4858, test_loss: 1.2714, test_f1: 0.6151
 epoch: 28, train_loss: 0.4559, test_loss: 1.3192, test_f1: 0.6353
 epoch: 29, train_loss: 0.4544, test_loss: 1.2251, test_f1: 0.6194
 epoch: 30, train_loss: 0.4449, test_loss: 1.3715, test_f1: 0.5546
 epoch: 31, train_loss: 0.4289, test_loss: 1.3491, test_f1: 0.5946
 epoch: 32, train_loss: 0.3723, test_loss: 1.4804, test_f1: 0.5968
 epoch: 33, train_loss: 0.3662, test_loss: 1.4321, test_f1: 0.6233
 epoch: 34, train_loss: 0.4363, test_loss: 1.4052, test_f1: 0.6170
 epoch: 35, train_loss: 0.4520, test_loss: 1.3166, test_f1: 0.6401
 epoch: 36, train_loss: 0.3962, test_loss: 1.3145, test_f1: 0.6196
 epoch: 37, train_loss: 0.3645, test_loss: 1.5376, test_f1: 0.6019
 epoch: 38, train_loss: 0.3490, test_loss: 1.5401, test_f1: 0.5917
 epoch: 39, train_loss: 0.3578, test_loss: 1.8392, test_f1: 0.4937
 epoch: 40, train_loss: 0.3831, test_loss: 1.5756, test_f1: 0.6071
 epoch: 41, train_loss: 0.3410, test_loss: 1.6194, test_f1: 0.6097
 epoch: 42, train_loss: 0.3157, test_loss: 1.5988, test_f1: 0.5479
 epoch: 43, train_loss: 0.3139, test_loss: 1.6530, test_f1: 0.5920
 epoch: 44, train_loss: 0.3356, test_loss: 1.8588, test_f1: 0.5587
 epoch: 45, train_loss: 0.3298, test_loss: 1.6153, test_f1: 0.6304
 epoch: 46, train_loss: 0.3019, test_loss: 1.7059, test_f1: 0.5761
 epoch: 47, train_loss: 0.3032, test_loss: 1.8765, test_f1: 0.5996
 epoch: 48, train_loss: 0.3168, test_loss: 1.6929, test_f1: 0.5869
 epoch: 49, train_loss: 0.2961, test_loss: 1.6088, test_f1: 0.6054
 epoch: 50, train_loss: 0.3245, test_loss: 1.7758, test_f1: 0.6210
 epoch: 51, train_loss: 0.2611, test_loss: 1.5558, test_f1: 0.6208
 epoch: 52, train_loss: 0.2248, test_loss: 1.8587, test_f1: 0.6236
 epoch: 53, train_loss: 0.2122, test_loss: 1.9221, test_f1: 0.6198
 epoch: 54, train_loss: 0.1917, test_loss: 1.8494, test_f1: 0.6180
 epoch: 55, train_loss: 0.2040, test_loss: 1.9249, test_f1: 0.6144
 epoch: 56, train_loss: 0.2245, test_loss: 1.9229, test_f1: 0.6237
 epoch: 57, train_loss: 0.1950, test_loss: 2.1009, test_f1: 0.6234
 epoch: 58, train_loss: 0.1932, test_loss: 1.8287, test_f1: 0.6520
 epoch: 59, train_loss: 0.1848, test_loss: 2.0486, test_f1: 0.6125
 epoch: 60, train_loss: 0.1917, test_loss: 1.9462, test_f1: 0.6257
 epoch: 61, train_loss: 0.1771, test_loss: 2.0753, test_f1: 0.6044
 epoch: 62, train_loss: 0.1857, test_loss: 2.3913, test_f1: 0.5951
 epoch: 63, train_loss: 0.1654, test_loss: 1.9535, test_f1: 0.6375
 epoch: 64, train_loss: 0.1623, test_loss: 2.2883, test_f1: 0.6151
 epoch: 65, train_loss: 0.1560, test_loss: 2.2308, test_f1: 0.6061
 epoch: 66, train_loss: 0.1741, test_loss: 2.3154, test_f1: 0.6343
 epoch: 67, train_loss: 0.1713, test_loss: 2.2267, test_f1: 0.6366
 epoch: 68, train_loss: 0.1727, test_loss: 2.1601, test_f1: 0.6514
 epoch: 69, train_loss: 0.1846, test_loss: 2.4598, test_f1: 0.5729
 epoch: 70, train_loss: 0.1758, test_loss: 2.4962, test_f1: 0.6326
 epoch: 71, train_loss: 0.1574, test_loss: 2.3642, test_f1: 0.6207
 epoch: 72, train_loss: 0.1434, test_loss: 2.3641, test_f1: 0.6219
 epoch: 73, train_loss: 0.1544, test_loss: 2.5009, test_f1: 0.6150
 epoch: 74, train_loss: 0.1520, test_loss: 2.2818, test_f1: 0.6176
 epoch: 75, train_loss: 0.1519, test_loss: 2.3765, test_f1: 0.5905
 epoch: 76, train_loss: 0.1607, test_loss: 2.4978, test_f1: 0.6125
 epoch: 77, train_loss: 0.1617, test_loss: 2.3289, test_f1: 0.6310
 epoch: 78, train_loss: 0.1664, test_loss: 2.2945, test_f1: 0.6363
 epoch: 79, train_loss: 0.2018, test_loss: 2.5068, test_f1: 0.6081
 epoch: 80, train_loss: 0.1557, test_loss: 2.5397, test_f1: 0.6141
 epoch: 81, train_loss: 0.1502, test_loss: 2.3314, test_f1: 0.6093
 epoch: 82, train_loss: 0.1388, test_loss: 2.1865, test_f1: 0.6273
 epoch: 83, train_loss: 0.1504, test_loss: 2.7753, test_f1: 0.6021
 epoch: 84, train_loss: 0.1365, test_loss: 2.7320, test_f1: 0.5909
 epoch: 85, train_loss: 0.1277, test_loss: 2.7241, test_f1: 0.5876
 epoch: 86, train_loss: 0.1216, test_loss: 2.6059, test_f1: 0.6153
 epoch: 87, train_loss: 0.1216, test_loss: 2.5600, test_f1: 0.6287
 epoch: 88, train_loss: 0.1343, test_loss: 2.4892, test_f1: 0.6094
 epoch: 89, train_loss: 0.1213, test_loss: 2.9686, test_f1: 0.5992
 epoch: 90, train_loss: 0.1393, test_loss: 2.6205, test_f1: 0.6503
 epoch: 91, train_loss: 0.1261, test_loss: 2.8290, test_f1: 0.6228
 epoch: 92, train_loss: 0.1096, test_loss: 2.7462, test_f1: 0.6051
 epoch: 93, train_loss: 0.1414, test_loss: 2.8103, test_f1: 0.5995
 epoch: 94, train_loss: 0.1178, test_loss: 2.9917, test_f1: 0.6038
 epoch: 95, train_loss: 0.2131, test_loss: 2.8769, test_f1: 0.5983
 epoch: 96, train_loss: 0.1528, test_loss: 2.5614, test_f1: 0.6162
 epoch: 97, train_loss: 0.1668, test_loss: 2.5468, test_f1: 0.6042
 epoch: 98, train_loss: 0.1218, test_loss: 2.9231, test_f1: 0.5960
 epoch: 99, train_loss: 0.1515, test_loss: 2.4622, test_f1: 0.6210
##################ITERATION #3 ****************************************
 epoch: 0, train_loss: 1.1856, test_loss: 1.2747, test_f1: 0.3334
 epoch: 1, train_loss: 0.9867, test_loss: 1.1373, test_f1: 0.4430
 epoch: 2, train_loss: 0.9294, test_loss: 1.0609, test_f1: 0.5465
 epoch: 3, train_loss: 0.8972, test_loss: 0.9688, test_f1: 0.6281
 epoch: 4, train_loss: 0.8402, test_loss: 0.9320, test_f1: 0.6001
 epoch: 5, train_loss: 0.8208, test_loss: 0.9744, test_f1: 0.5959
 epoch: 6, train_loss: 0.7972, test_loss: 0.9487, test_f1: 0.5818
 epoch: 7, train_loss: 0.7657, test_loss: 0.9723, test_f1: 0.5606
 epoch: 8, train_loss: 0.7587, test_loss: 0.9491, test_f1: 0.6032
 epoch: 9, train_loss: 0.7266, test_loss: 0.9509, test_f1: 0.5497
 epoch: 10, train_loss: 0.6978, test_loss: 1.0165, test_f1: 0.5445
 epoch: 11, train_loss: 0.7057, test_loss: 1.0513, test_f1: 0.5409
 epoch: 12, train_loss: 0.6927, test_loss: 1.0290, test_f1: 0.5652
 epoch: 13, train_loss: 0.6726, test_loss: 1.0222, test_f1: 0.5676
 epoch: 14, train_loss: 0.6531, test_loss: 0.9295, test_f1: 0.6052
 epoch: 15, train_loss: 0.6235, test_loss: 0.9428, test_f1: 0.5992
 epoch: 16, train_loss: 0.6012, test_loss: 1.0586, test_f1: 0.5798
 epoch: 17, train_loss: 0.6161, test_loss: 0.9426, test_f1: 0.6443
 epoch: 18, train_loss: 0.5851, test_loss: 1.0343, test_f1: 0.5810
 epoch: 19, train_loss: 0.5680, test_loss: 0.9589, test_f1: 0.6194
 epoch: 20, train_loss: 0.5703, test_loss: 1.0978, test_f1: 0.5485
 epoch: 21, train_loss: 0.5537, test_loss: 1.0556, test_f1: 0.5981
 epoch: 22, train_loss: 0.5159, test_loss: 1.1312, test_f1: 0.5896
 epoch: 23, train_loss: 0.5026, test_loss: 1.1409, test_f1: 0.5314
 epoch: 24, train_loss: 0.5140, test_loss: 1.2966, test_f1: 0.5285
 epoch: 25, train_loss: 0.5107, test_loss: 1.0599, test_f1: 0.5716
 epoch: 26, train_loss: 0.4455, test_loss: 1.0452, test_f1: 0.5897
 epoch: 27, train_loss: 0.4618, test_loss: 1.0513, test_f1: 0.6039
 epoch: 28, train_loss: 0.4479, test_loss: 1.0444, test_f1: 0.6010
 epoch: 29, train_loss: 0.4426, test_loss: 1.3707, test_f1: 0.5573
 epoch: 30, train_loss: 0.4298, test_loss: 1.3713, test_f1: 0.5106
 epoch: 31, train_loss: 0.4301, test_loss: 1.0274, test_f1: 0.6696
 epoch: 32, train_loss: 0.4542, test_loss: 1.0562, test_f1: 0.6435
 epoch: 33, train_loss: 0.4150, test_loss: 1.1190, test_f1: 0.5915
 epoch: 34, train_loss: 0.3984, test_loss: 1.1316, test_f1: 0.6442
 epoch: 35, train_loss: 0.3947, test_loss: 1.3632, test_f1: 0.5780
 epoch: 36, train_loss: 0.3922, test_loss: 1.0920, test_f1: 0.6252
 epoch: 37, train_loss: 0.3809, test_loss: 1.2840, test_f1: 0.5991
 epoch: 38, train_loss: 0.3861, test_loss: 1.3801, test_f1: 0.6301
 epoch: 39, train_loss: 0.3379, test_loss: 1.1467, test_f1: 0.6350
 epoch: 40, train_loss: 0.3490, test_loss: 1.4530, test_f1: 0.5397
 epoch: 41, train_loss: 0.3543, test_loss: 1.2862, test_f1: 0.6109
 epoch: 42, train_loss: 0.2892, test_loss: 1.2393, test_f1: 0.6387
 epoch: 43, train_loss: 0.3298, test_loss: 1.3355, test_f1: 0.6052
 epoch: 44, train_loss: 0.3318, test_loss: 1.2922, test_f1: 0.6180
 epoch: 45, train_loss: 0.3279, test_loss: 1.2650, test_f1: 0.6182
 epoch: 46, train_loss: 0.3382, test_loss: 1.5146, test_f1: 0.5727
 epoch: 47, train_loss: 0.3098, test_loss: 1.3999, test_f1: 0.5969
 epoch: 48, train_loss: 0.2976, test_loss: 1.4399, test_f1: 0.5930
 epoch: 49, train_loss: 0.2701, test_loss: 1.1938, test_f1: 0.6331
 epoch: 50, train_loss: 0.2646, test_loss: 1.5419, test_f1: 0.6285
 epoch: 51, train_loss: 0.2371, test_loss: 1.2574, test_f1: 0.6404
 epoch: 52, train_loss: 0.1977, test_loss: 1.6031, test_f1: 0.6156
 epoch: 53, train_loss: 0.2121, test_loss: 1.3707, test_f1: 0.6471
 epoch: 54, train_loss: 0.1791, test_loss: 1.4591, test_f1: 0.6197
 epoch: 55, train_loss: 0.1900, test_loss: 1.5870, test_f1: 0.6262
 epoch: 56, train_loss: 0.2026, test_loss: 1.4675, test_f1: 0.6410
 epoch: 57, train_loss: 0.1780, test_loss: 1.3999, test_f1: 0.6500
 epoch: 58, train_loss: 0.1693, test_loss: 1.4590, test_f1: 0.6328
 epoch: 59, train_loss: 0.1611, test_loss: 1.7431, test_f1: 0.6058
 epoch: 60, train_loss: 0.1581, test_loss: 1.8400, test_f1: 0.6120
 epoch: 61, train_loss: 0.1486, test_loss: 1.6680, test_f1: 0.6384
 epoch: 62, train_loss: 0.1700, test_loss: 1.6355, test_f1: 0.6456
 epoch: 63, train_loss: 0.1594, test_loss: 1.7736, test_f1: 0.5897
 epoch: 64, train_loss: 0.1659, test_loss: 1.7624, test_f1: 0.6046
 epoch: 65, train_loss: 0.1428, test_loss: 1.8517, test_f1: 0.6316
 epoch: 66, train_loss: 0.1428, test_loss: 1.6669, test_f1: 0.6489
 epoch: 67, train_loss: 0.1389, test_loss: 1.8082, test_f1: 0.5910
 epoch: 68, train_loss: 0.1760, test_loss: 1.6422, test_f1: 0.6291
 epoch: 69, train_loss: 0.1570, test_loss: 1.7242, test_f1: 0.6509
 epoch: 70, train_loss: 0.1822, test_loss: 1.8644, test_f1: 0.6141
 epoch: 71, train_loss: 0.1397, test_loss: 1.9798, test_f1: 0.6357
 epoch: 72, train_loss: 0.1375, test_loss: 1.7444, test_f1: 0.5973
 epoch: 73, train_loss: 0.1509, test_loss: 1.8243, test_f1: 0.6027
 epoch: 74, train_loss: 0.1720, test_loss: 1.7695, test_f1: 0.6362
 epoch: 75, train_loss: 0.1403, test_loss: 1.7962, test_f1: 0.6105
 epoch: 76, train_loss: 0.1312, test_loss: 1.9787, test_f1: 0.6033
 epoch: 77, train_loss: 0.1396, test_loss: 1.8491, test_f1: 0.6149
 epoch: 78, train_loss: 0.1555, test_loss: 2.1191, test_f1: 0.6253
 epoch: 79, train_loss: 0.1414, test_loss: 1.9286, test_f1: 0.6345
 epoch: 80, train_loss: 0.1430, test_loss: 2.0834, test_f1: 0.6124
 epoch: 81, train_loss: 0.1357, test_loss: 2.1550, test_f1: 0.5922
 epoch: 82, train_loss: 0.1319, test_loss: 2.2145, test_f1: 0.5722
 epoch: 83, train_loss: 0.1386, test_loss: 2.0687, test_f1: 0.5956
 epoch: 84, train_loss: 0.1351, test_loss: 2.1375, test_f1: 0.5807
 epoch: 85, train_loss: 0.1304, test_loss: 2.1447, test_f1: 0.5727
 epoch: 86, train_loss: 0.1331, test_loss: 2.1062, test_f1: 0.5849
 epoch: 87, train_loss: 0.1058, test_loss: 2.0132, test_f1: 0.5865
 epoch: 88, train_loss: 0.1025, test_loss: 2.1108, test_f1: 0.5936
 epoch: 89, train_loss: 0.1135, test_loss: 2.0013, test_f1: 0.6197
 epoch: 90, train_loss: 0.1157, test_loss: 2.1136, test_f1: 0.5961
 epoch: 91, train_loss: 0.1083, test_loss: 1.9725, test_f1: 0.6356
 epoch: 92, train_loss: 0.0950, test_loss: 2.2196, test_f1: 0.5876
 epoch: 93, train_loss: 0.0844, test_loss: 2.2912, test_f1: 0.5846
 epoch: 94, train_loss: 0.0989, test_loss: 2.3002, test_f1: 0.5992
 epoch: 95, train_loss: 0.0920, test_loss: 2.2500, test_f1: 0.6193
 epoch: 96, train_loss: 0.1055, test_loss: 2.0434, test_f1: 0.6303
 epoch: 97, train_loss: 0.1185, test_loss: 2.2688, test_f1: 0.5944
 epoch: 98, train_loss: 0.0974, test_loss: 2.3241, test_f1: 0.6077
 epoch: 99, train_loss: 0.1129, test_loss: 2.3464, test_f1: 0.6094
##################ITERATION #4 ****************************************
 epoch: 0, train_loss: 1.2377, test_loss: 1.4478, test_f1: 0.1661
 epoch: 1, train_loss: 1.0042, test_loss: 1.2418, test_f1: 0.4397
 epoch: 2, train_loss: 0.9265, test_loss: 1.0456, test_f1: 0.5242
 epoch: 3, train_loss: 0.8977, test_loss: 1.0673, test_f1: 0.5717
 epoch: 4, train_loss: 0.8379, test_loss: 1.0516, test_f1: 0.5381
 epoch: 5, train_loss: 0.8086, test_loss: 1.0145, test_f1: 0.5364
 epoch: 6, train_loss: 0.7732, test_loss: 1.0632, test_f1: 0.6081
 epoch: 7, train_loss: 0.7563, test_loss: 1.0920, test_f1: 0.5416
 epoch: 8, train_loss: 0.7538, test_loss: 1.0689, test_f1: 0.6253
 epoch: 9, train_loss: 0.7228, test_loss: 1.0601, test_f1: 0.5596
 epoch: 10, train_loss: 0.6854, test_loss: 1.0920, test_f1: 0.6062
 epoch: 11, train_loss: 0.6862, test_loss: 1.1267, test_f1: 0.5603
 epoch: 12, train_loss: 0.6577, test_loss: 1.0736, test_f1: 0.6106
 epoch: 13, train_loss: 0.6345, test_loss: 1.1231, test_f1: 0.6045
 epoch: 14, train_loss: 0.6291, test_loss: 1.1444, test_f1: 0.5634
 epoch: 15, train_loss: 0.5747, test_loss: 1.1437, test_f1: 0.5957
 epoch: 16, train_loss: 0.5890, test_loss: 1.1415, test_f1: 0.5704
 epoch: 17, train_loss: 0.5762, test_loss: 1.1370, test_f1: 0.5945
 epoch: 18, train_loss: 0.5693, test_loss: 1.1755, test_f1: 0.6175
 epoch: 19, train_loss: 0.5414, test_loss: 1.4405, test_f1: 0.5792
 epoch: 20, train_loss: 0.5321, test_loss: 1.1310, test_f1: 0.6097
 epoch: 21, train_loss: 0.5316, test_loss: 1.1927, test_f1: 0.6337
 epoch: 22, train_loss: 0.5323, test_loss: 1.3456, test_f1: 0.5842
 epoch: 23, train_loss: 0.5056, test_loss: 1.4416, test_f1: 0.6011
 epoch: 24, train_loss: 0.5102, test_loss: 1.2610, test_f1: 0.5822
 epoch: 25, train_loss: 0.5038, test_loss: 1.7147, test_f1: 0.5384
 epoch: 26, train_loss: 0.4738, test_loss: 1.2635, test_f1: 0.5928
 epoch: 27, train_loss: 0.4408, test_loss: 1.3098, test_f1: 0.6253
 epoch: 28, train_loss: 0.4668, test_loss: 1.4548, test_f1: 0.6025
 epoch: 29, train_loss: 0.4364, test_loss: 1.3340, test_f1: 0.6218
 epoch: 30, train_loss: 0.4030, test_loss: 1.8714, test_f1: 0.5501
 epoch: 31, train_loss: 0.4110, test_loss: 1.5496, test_f1: 0.6413
 epoch: 32, train_loss: 0.3942, test_loss: 1.6742, test_f1: 0.5824
 epoch: 33, train_loss: 0.3847, test_loss: 1.7145, test_f1: 0.5506
 epoch: 34, train_loss: 0.3935, test_loss: 1.5655, test_f1: 0.5800
 epoch: 35, train_loss: 0.3759, test_loss: 1.9101, test_f1: 0.6094
 epoch: 36, train_loss: 0.3704, test_loss: 1.7117, test_f1: 0.5879
 epoch: 37, train_loss: 0.3578, test_loss: 1.7189, test_f1: 0.5667
 epoch: 38, train_loss: 0.3618, test_loss: 1.8695, test_f1: 0.5722
 epoch: 39, train_loss: 0.3659, test_loss: 1.7047, test_f1: 0.5527
 epoch: 40, train_loss: 0.3483, test_loss: 1.6396, test_f1: 0.6087
 epoch: 41, train_loss: 0.3596, test_loss: 1.7368, test_f1: 0.5898
 epoch: 42, train_loss: 0.3074, test_loss: 1.8096, test_f1: 0.6017
 epoch: 43, train_loss: 0.3238, test_loss: 1.7708, test_f1: 0.5882
 epoch: 44, train_loss: 0.2744, test_loss: 1.7385, test_f1: 0.6169
 epoch: 45, train_loss: 0.2846, test_loss: 2.0466, test_f1: 0.5668
 epoch: 46, train_loss: 0.2828, test_loss: 2.0761, test_f1: 0.5271
 epoch: 47, train_loss: 0.2968, test_loss: 1.8486, test_f1: 0.6025
 epoch: 48, train_loss: 0.2906, test_loss: 2.1516, test_f1: 0.5821
 epoch: 49, train_loss: 0.3174, test_loss: 1.9259, test_f1: 0.5835
 epoch: 50, train_loss: 0.3016, test_loss: 2.0456, test_f1: 0.5985
 epoch: 51, train_loss: 0.2685, test_loss: 1.8850, test_f1: 0.6230
 epoch: 52, train_loss: 0.2167, test_loss: 2.0433, test_f1: 0.6224
 epoch: 53, train_loss: 0.2162, test_loss: 2.2199, test_f1: 0.6175
 epoch: 54, train_loss: 0.1936, test_loss: 2.3384, test_f1: 0.5805
 epoch: 55, train_loss: 0.1913, test_loss: 2.1229, test_f1: 0.6197
 epoch: 56, train_loss: 0.1818, test_loss: 2.3226, test_f1: 0.6173
 epoch: 57, train_loss: 0.1819, test_loss: 2.2235, test_f1: 0.5632
 epoch: 58, train_loss: 0.1795, test_loss: 2.2063, test_f1: 0.6124
 epoch: 59, train_loss: 0.1904, test_loss: 2.1805, test_f1: 0.6157
 epoch: 60, train_loss: 0.1782, test_loss: 2.4789, test_f1: 0.5954
 epoch: 61, train_loss: 0.1654, test_loss: 2.4148, test_f1: 0.6035
 epoch: 62, train_loss: 0.1539, test_loss: 2.3753, test_f1: 0.5910
 epoch: 63, train_loss: 0.1373, test_loss: 2.3869, test_f1: 0.6082
 epoch: 64, train_loss: 0.1560, test_loss: 2.2570, test_f1: 0.5769
 epoch: 65, train_loss: 0.1581, test_loss: 2.4570, test_f1: 0.5923
 epoch: 66, train_loss: 0.1529, test_loss: 2.4750, test_f1: 0.6032
 epoch: 67, train_loss: 0.1527, test_loss: 2.4828, test_f1: 0.5571
 epoch: 68, train_loss: 0.1579, test_loss: 2.3608, test_f1: 0.6143
 epoch: 69, train_loss: 0.1543, test_loss: 2.4640, test_f1: 0.6153
 epoch: 70, train_loss: 0.1454, test_loss: 2.5153, test_f1: 0.5987
 epoch: 71, train_loss: 0.1667, test_loss: 2.4513, test_f1: 0.6032
 epoch: 72, train_loss: 0.1555, test_loss: 2.5205, test_f1: 0.6035
 epoch: 73, train_loss: 0.1599, test_loss: 2.3008, test_f1: 0.6598
 epoch: 74, train_loss: 0.1385, test_loss: 2.7447, test_f1: 0.5989
 epoch: 75, train_loss: 0.1554, test_loss: 2.4524, test_f1: 0.5928
 epoch: 76, train_loss: 0.1455, test_loss: 2.7992, test_f1: 0.6151
 epoch: 77, train_loss: 0.1540, test_loss: 2.7291, test_f1: 0.5813
 epoch: 78, train_loss: 0.1243, test_loss: 2.7032, test_f1: 0.5744
 epoch: 79, train_loss: 0.1106, test_loss: 2.7471, test_f1: 0.5687
 epoch: 80, train_loss: 0.1407, test_loss: 2.9529, test_f1: 0.5830
 epoch: 81, train_loss: 0.1492, test_loss: 2.7253, test_f1: 0.6060
 epoch: 82, train_loss: 0.1330, test_loss: 2.6936, test_f1: 0.5842
 epoch: 83, train_loss: 0.1135, test_loss: 2.7502, test_f1: 0.5856
 epoch: 84, train_loss: 0.1106, test_loss: 2.8557, test_f1: 0.6321
 epoch: 85, train_loss: 0.1192, test_loss: 2.9052, test_f1: 0.6128
 epoch: 86, train_loss: 0.1341, test_loss: 2.8957, test_f1: 0.6226
 epoch: 87, train_loss: 0.1397, test_loss: 3.1828, test_f1: 0.6185
 epoch: 88, train_loss: 0.1442, test_loss: 3.0504, test_f1: 0.6225
 epoch: 89, train_loss: 0.1292, test_loss: 3.1499, test_f1: 0.5427
 epoch: 90, train_loss: 0.1104, test_loss: 2.6745, test_f1: 0.6018
 epoch: 91, train_loss: 0.1201, test_loss: 2.6875, test_f1: 0.6464
 epoch: 92, train_loss: 0.1009, test_loss: 3.1037, test_f1: 0.5935
 epoch: 93, train_loss: 0.1236, test_loss: 2.9900, test_f1: 0.5603
 epoch: 94, train_loss: 0.1165, test_loss: 2.9365, test_f1: 0.6139
 epoch: 95, train_loss: 0.1163, test_loss: 2.9978, test_f1: 0.6194
 epoch: 96, train_loss: 0.1211, test_loss: 3.2652, test_f1: 0.6111
 epoch: 97, train_loss: 0.1172, test_loss: 3.0638, test_f1: 0.5899
 epoch: 98, train_loss: 0.1057, test_loss: 2.9165, test_f1: 0.6166
 epoch: 99, train_loss: 0.1123, test_loss: 3.0279, test_f1: 0.6102
##################ITERATION #5 ****************************************
 epoch: 0, train_loss: 1.2313, test_loss: 1.3004, test_f1: 0.2976
 epoch: 1, train_loss: 1.0273, test_loss: 1.1847, test_f1: 0.4772
 epoch: 2, train_loss: 0.9128, test_loss: 1.0374, test_f1: 0.5790
 epoch: 3, train_loss: 0.8789, test_loss: 1.0478, test_f1: 0.5778
 epoch: 4, train_loss: 0.8137, test_loss: 1.0274, test_f1: 0.5803
 epoch: 5, train_loss: 0.7878, test_loss: 1.0999, test_f1: 0.5879
 epoch: 6, train_loss: 0.7652, test_loss: 0.9521, test_f1: 0.6311
 epoch: 7, train_loss: 0.7482, test_loss: 0.9606, test_f1: 0.5853
 epoch: 8, train_loss: 0.7405, test_loss: 0.9914, test_f1: 0.6381
 epoch: 9, train_loss: 0.7029, test_loss: 1.0414, test_f1: 0.5955
 epoch: 10, train_loss: 0.6779, test_loss: 1.0174, test_f1: 0.6405
 epoch: 11, train_loss: 0.6822, test_loss: 1.0471, test_f1: 0.5932
 epoch: 12, train_loss: 0.6576, test_loss: 1.1136, test_f1: 0.5421
 epoch: 13, train_loss: 0.6383, test_loss: 1.1800, test_f1: 0.5834
 epoch: 14, train_loss: 0.6466, test_loss: 1.0877, test_f1: 0.5994
 epoch: 15, train_loss: 0.6249, test_loss: 1.0847, test_f1: 0.6129
 epoch: 16, train_loss: 0.5857, test_loss: 1.0155, test_f1: 0.6312
 epoch: 17, train_loss: 0.5819, test_loss: 1.1113, test_f1: 0.6184
 epoch: 18, train_loss: 0.5875, test_loss: 1.0253, test_f1: 0.6211
 epoch: 19, train_loss: 0.5909, test_loss: 1.1896, test_f1: 0.5926
 epoch: 20, train_loss: 0.5697, test_loss: 1.2434, test_f1: 0.5469
 epoch: 21, train_loss: 0.5445, test_loss: 1.1727, test_f1: 0.5477
 epoch: 22, train_loss: 0.5391, test_loss: 1.2191, test_f1: 0.5993
 epoch: 23, train_loss: 0.5425, test_loss: 1.4288, test_f1: 0.5980
 epoch: 24, train_loss: 0.5129, test_loss: 1.3417, test_f1: 0.6003
 epoch: 25, train_loss: 0.5200, test_loss: 1.2605, test_f1: 0.6011
 epoch: 26, train_loss: 0.4897, test_loss: 1.2262, test_f1: 0.5993
 epoch: 27, train_loss: 0.4805, test_loss: 1.0416, test_f1: 0.6478
 epoch: 28, train_loss: 0.5018, test_loss: 1.4265, test_f1: 0.5881
 epoch: 29, train_loss: 0.4545, test_loss: 1.7974, test_f1: 0.5494
 epoch: 30, train_loss: 0.4839, test_loss: 1.3374, test_f1: 0.5799
 epoch: 31, train_loss: 0.4508, test_loss: 1.6944, test_f1: 0.5685
 epoch: 32, train_loss: 0.4780, test_loss: 1.1642, test_f1: 0.6162
 epoch: 33, train_loss: 0.4424, test_loss: 1.4181, test_f1: 0.6169
 epoch: 34, train_loss: 0.4120, test_loss: 1.4768, test_f1: 0.6041
 epoch: 35, train_loss: 0.4128, test_loss: 1.3490, test_f1: 0.6350
 epoch: 36, train_loss: 0.4336, test_loss: 1.5911, test_f1: 0.6092
 epoch: 37, train_loss: 0.4103, test_loss: 1.4260, test_f1: 0.5758
 epoch: 38, train_loss: 0.3879, test_loss: 1.7594, test_f1: 0.5423
 epoch: 39, train_loss: 0.3866, test_loss: 1.5321, test_f1: 0.6011
 epoch: 40, train_loss: 0.3487, test_loss: 1.4518, test_f1: 0.5970
 epoch: 41, train_loss: 0.3873, test_loss: 1.8769, test_f1: 0.5610
 epoch: 42, train_loss: 0.3400, test_loss: 1.7024, test_f1: 0.5910
 epoch: 43, train_loss: 0.3367, test_loss: 1.6340, test_f1: 0.5692
 epoch: 44, train_loss: 0.3234, test_loss: 1.8087, test_f1: 0.5989
 epoch: 45, train_loss: 0.3372, test_loss: 1.8103, test_f1: 0.6038
 epoch: 46, train_loss: 0.3373, test_loss: 1.6226, test_f1: 0.5911
 epoch: 47, train_loss: 0.3382, test_loss: 1.7595, test_f1: 0.6118
 epoch: 48, train_loss: 0.3270, test_loss: 1.8912, test_f1: 0.6204
 epoch: 49, train_loss: 0.3289, test_loss: 1.7605, test_f1: 0.5437
 epoch: 50, train_loss: 0.3274, test_loss: 1.6819, test_f1: 0.5601
 epoch: 51, train_loss: 0.3035, test_loss: 1.5805, test_f1: 0.5959
 epoch: 52, train_loss: 0.2664, test_loss: 1.5699, test_f1: 0.6085
 epoch: 53, train_loss: 0.2330, test_loss: 1.6361, test_f1: 0.6235
 epoch: 54, train_loss: 0.2258, test_loss: 1.9687, test_f1: 0.5993
 epoch: 55, train_loss: 0.2244, test_loss: 1.8945, test_f1: 0.6051
 epoch: 56, train_loss: 0.2082, test_loss: 1.9638, test_f1: 0.6024
 epoch: 57, train_loss: 0.2162, test_loss: 1.9667, test_f1: 0.5956
 epoch: 58, train_loss: 0.2133, test_loss: 1.9821, test_f1: 0.5870
 epoch: 59, train_loss: 0.2018, test_loss: 1.7488, test_f1: 0.6244
 epoch: 60, train_loss: 0.2149, test_loss: 2.0199, test_f1: 0.6165
 epoch: 61, train_loss: 0.2128, test_loss: 2.0152, test_f1: 0.6256
 epoch: 62, train_loss: 0.1933, test_loss: 1.9206, test_f1: 0.6060
 epoch: 63, train_loss: 0.1847, test_loss: 2.0943, test_f1: 0.6129
 epoch: 64, train_loss: 0.1935, test_loss: 2.0386, test_f1: 0.6186
 epoch: 65, train_loss: 0.1577, test_loss: 2.2096, test_f1: 0.5793
 epoch: 66, train_loss: 0.1744, test_loss: 2.0783, test_f1: 0.6086
 epoch: 67, train_loss: 0.1691, test_loss: 2.1577, test_f1: 0.6194
 epoch: 68, train_loss: 0.1865, test_loss: 2.1487, test_f1: 0.6028
 epoch: 69, train_loss: 0.1891, test_loss: 2.2098, test_f1: 0.6022
 epoch: 70, train_loss: 0.1881, test_loss: 2.2097, test_f1: 0.5987
 epoch: 71, train_loss: 0.1755, test_loss: 2.0828, test_f1: 0.6030
 epoch: 72, train_loss: 0.1828, test_loss: 2.1065, test_f1: 0.5943
 epoch: 73, train_loss: 0.1977, test_loss: 2.2758, test_f1: 0.6069
 epoch: 74, train_loss: 0.1581, test_loss: 2.2651, test_f1: 0.5884
 epoch: 75, train_loss: 0.1793, test_loss: 2.3667, test_f1: 0.5971
 epoch: 76, train_loss: 0.1429, test_loss: 2.3537, test_f1: 0.6048
 epoch: 77, train_loss: 0.1802, test_loss: 2.3332, test_f1: 0.6001
 epoch: 78, train_loss: 0.1602, test_loss: 2.2231, test_f1: 0.5998
 epoch: 79, train_loss: 0.1579, test_loss: 2.3471, test_f1: 0.5932
 epoch: 80, train_loss: 0.1870, test_loss: 2.1606, test_f1: 0.6108
 epoch: 81, train_loss: 0.1599, test_loss: 1.9905, test_f1: 0.6186
 epoch: 82, train_loss: 0.1750, test_loss: 2.3121, test_f1: 0.6196
 epoch: 83, train_loss: 0.1672, test_loss: 2.1546, test_f1: 0.5891
 epoch: 84, train_loss: 0.1439, test_loss: 2.1384, test_f1: 0.6388
 epoch: 85, train_loss: 0.1724, test_loss: 2.1893, test_f1: 0.6145
 epoch: 86, train_loss: 0.1674, test_loss: 2.4994, test_f1: 0.5888
 epoch: 87, train_loss: 0.1283, test_loss: 2.3387, test_f1: 0.6256
 epoch: 88, train_loss: 0.1358, test_loss: 2.5613, test_f1: 0.5847
 epoch: 89, train_loss: 0.1482, test_loss: 2.5253, test_f1: 0.5790
 epoch: 90, train_loss: 0.1348, test_loss: 2.2633, test_f1: 0.5992
 epoch: 91, train_loss: 0.1175, test_loss: 2.6627, test_f1: 0.6336
 epoch: 92, train_loss: 0.1349, test_loss: 2.6835, test_f1: 0.6283
 epoch: 93, train_loss: 0.1246, test_loss: 2.5106, test_f1: 0.5945
 epoch: 94, train_loss: 0.0997, test_loss: 2.6792, test_f1: 0.6095
 epoch: 95, train_loss: 0.1447, test_loss: 2.7509, test_f1: 0.6104
 epoch: 96, train_loss: 0.1274, test_loss: 2.4349, test_f1: 0.6660
 epoch: 97, train_loss: 0.1399, test_loss: 2.6420, test_f1: 0.6541
 epoch: 98, train_loss: 0.1639, test_loss: 2.5422, test_f1: 0.6286
 epoch: 99, train_loss: 0.1463, test_loss: 2.6227, test_f1: 0.5809
##################ITERATION #6 ****************************************
 epoch: 0, train_loss: 1.3982, test_loss: 1.4348, test_f1: 0.1425
 epoch: 1, train_loss: 1.0382, test_loss: 1.2540, test_f1: 0.3519
 epoch: 2, train_loss: 0.9707, test_loss: 1.0311, test_f1: 0.5946
 epoch: 3, train_loss: 0.9338, test_loss: 0.9949, test_f1: 0.5914
 epoch: 4, train_loss: 0.9005, test_loss: 1.0265, test_f1: 0.6146
 epoch: 5, train_loss: 0.8583, test_loss: 1.0514, test_f1: 0.5955
 epoch: 6, train_loss: 0.8243, test_loss: 1.0786, test_f1: 0.6436
 epoch: 7, train_loss: 0.8372, test_loss: 1.0933, test_f1: 0.5706
 epoch: 8, train_loss: 0.7962, test_loss: 0.9833, test_f1: 0.6268
 epoch: 9, train_loss: 0.7459, test_loss: 0.9614, test_f1: 0.5763
 epoch: 10, train_loss: 0.7572, test_loss: 1.0568, test_f1: 0.6121
 epoch: 11, train_loss: 0.7327, test_loss: 0.9531, test_f1: 0.6403
 epoch: 12, train_loss: 0.6921, test_loss: 1.0846, test_f1: 0.6201
 epoch: 13, train_loss: 0.6945, test_loss: 1.1096, test_f1: 0.5732
 epoch: 14, train_loss: 0.6959, test_loss: 1.1444, test_f1: 0.6192
 epoch: 15, train_loss: 0.6589, test_loss: 1.1038, test_f1: 0.6001
 epoch: 16, train_loss: 0.6288, test_loss: 1.2441, test_f1: 0.5611
 epoch: 17, train_loss: 0.6515, test_loss: 1.1507, test_f1: 0.5727
 epoch: 18, train_loss: 0.6357, test_loss: 1.1705, test_f1: 0.5276
 epoch: 19, train_loss: 0.6010, test_loss: 1.1448, test_f1: 0.6014
 epoch: 20, train_loss: 0.6396, test_loss: 1.0576, test_f1: 0.5648
 epoch: 21, train_loss: 0.6175, test_loss: 1.1324, test_f1: 0.5645
 epoch: 22, train_loss: 0.6012, test_loss: 1.1723, test_f1: 0.5639
 epoch: 23, train_loss: 0.5502, test_loss: 1.1809, test_f1: 0.5813
 epoch: 24, train_loss: 0.5890, test_loss: 1.0836, test_f1: 0.5898
 epoch: 25, train_loss: 0.5822, test_loss: 1.1601, test_f1: 0.5988
 epoch: 26, train_loss: 0.5723, test_loss: 1.2278, test_f1: 0.5950
 epoch: 27, train_loss: 0.5299, test_loss: 1.3868, test_f1: 0.5722
 epoch: 28, train_loss: 0.5251, test_loss: 1.2699, test_f1: 0.5458
 epoch: 29, train_loss: 0.5217, test_loss: 1.1996, test_f1: 0.5920
 epoch: 30, train_loss: 0.5393, test_loss: 1.1653, test_f1: 0.6022
 epoch: 31, train_loss: 0.4916, test_loss: 1.3601, test_f1: 0.5839
 epoch: 32, train_loss: 0.4942, test_loss: 1.4208, test_f1: 0.5498
 epoch: 33, train_loss: 0.4673, test_loss: 1.3430, test_f1: 0.5520
 epoch: 34, train_loss: 0.4702, test_loss: 1.3296, test_f1: 0.5446
 epoch: 35, train_loss: 0.4753, test_loss: 1.3614, test_f1: 0.5975
 epoch: 36, train_loss: 0.4773, test_loss: 1.2608, test_f1: 0.6175
 epoch: 37, train_loss: 0.4787, test_loss: 1.6373, test_f1: 0.5611
 epoch: 38, train_loss: 0.4395, test_loss: 1.6293, test_f1: 0.5264
 epoch: 39, train_loss: 0.4165, test_loss: 1.3550, test_f1: 0.5630
 epoch: 40, train_loss: 0.4228, test_loss: 1.3141, test_f1: 0.5886
 epoch: 41, train_loss: 0.3991, test_loss: 1.6753, test_f1: 0.5825
 epoch: 42, train_loss: 0.4147, test_loss: 1.6334, test_f1: 0.5629
 epoch: 43, train_loss: 0.3721, test_loss: 1.9708, test_f1: 0.5460
 epoch: 44, train_loss: 0.3943, test_loss: 1.5919, test_f1: 0.5865
 epoch: 45, train_loss: 0.3663, test_loss: 1.6212, test_f1: 0.5723
 epoch: 46, train_loss: 0.3305, test_loss: 1.6931, test_f1: 0.5774
 epoch: 47, train_loss: 0.3817, test_loss: 1.9347, test_f1: 0.5381
 epoch: 48, train_loss: 0.3711, test_loss: 1.6724, test_f1: 0.5990
 epoch: 49, train_loss: 0.3768, test_loss: 1.6836, test_f1: 0.5514
 epoch: 50, train_loss: 0.3763, test_loss: 1.6283, test_f1: 0.5755
 epoch: 51, train_loss: 0.3092, test_loss: 1.5932, test_f1: 0.5821
 epoch: 52, train_loss: 0.2894, test_loss: 1.6480, test_f1: 0.5992
 epoch: 53, train_loss: 0.2763, test_loss: 1.7834, test_f1: 0.5991
 epoch: 54, train_loss: 0.2587, test_loss: 1.8378, test_f1: 0.5912
 epoch: 55, train_loss: 0.2434, test_loss: 1.7335, test_f1: 0.6378
 epoch: 56, train_loss: 0.2563, test_loss: 1.8403, test_f1: 0.5986
 epoch: 57, train_loss: 0.2495, test_loss: 1.9711, test_f1: 0.5754
 epoch: 58, train_loss: 0.2945, test_loss: 1.8448, test_f1: 0.5967
 epoch: 59, train_loss: 0.2456, test_loss: 2.0562, test_f1: 0.5842
 epoch: 60, train_loss: 0.2286, test_loss: 1.9507, test_f1: 0.6072
 epoch: 61, train_loss: 0.2130, test_loss: 2.0760, test_f1: 0.5858
 epoch: 62, train_loss: 0.2277, test_loss: 1.9359, test_f1: 0.5679
 epoch: 63, train_loss: 0.2520, test_loss: 1.8289, test_f1: 0.6176
 epoch: 64, train_loss: 0.2239, test_loss: 2.2245, test_f1: 0.5734
 epoch: 65, train_loss: 0.2405, test_loss: 2.2831, test_f1: 0.5449
 epoch: 66, train_loss: 0.2280, test_loss: 2.0353, test_f1: 0.5999
 epoch: 67, train_loss: 0.2034, test_loss: 2.0435, test_f1: 0.6012
 epoch: 68, train_loss: 0.2213, test_loss: 2.1807, test_f1: 0.5890
 epoch: 69, train_loss: 0.2222, test_loss: 2.2201, test_f1: 0.5735
 epoch: 70, train_loss: 0.2332, test_loss: 2.2352, test_f1: 0.6015
 epoch: 71, train_loss: 0.1901, test_loss: 2.4847, test_f1: 0.5584
 epoch: 72, train_loss: 0.1764, test_loss: 2.3462, test_f1: 0.5774
 epoch: 73, train_loss: 0.1857, test_loss: 2.4335, test_f1: 0.5215
 epoch: 74, train_loss: 0.2356, test_loss: 2.3828, test_f1: 0.5847
 epoch: 75, train_loss: 0.1882, test_loss: 2.2800, test_f1: 0.5974
 epoch: 76, train_loss: 0.1806, test_loss: 2.1770, test_f1: 0.6037
 epoch: 77, train_loss: 0.1623, test_loss: 2.6112, test_f1: 0.5691
 epoch: 78, train_loss: 0.1627, test_loss: 2.4810, test_f1: 0.5597
 epoch: 79, train_loss: 0.1959, test_loss: 2.5429, test_f1: 0.5821
 epoch: 80, train_loss: 0.2083, test_loss: 2.3454, test_f1: 0.6025
 epoch: 81, train_loss: 0.1890, test_loss: 2.3930, test_f1: 0.6055
 epoch: 82, train_loss: 0.1746, test_loss: 2.5083, test_f1: 0.5751
 epoch: 83, train_loss: 0.1801, test_loss: 2.4788, test_f1: 0.5639
 epoch: 84, train_loss: 0.1602, test_loss: 2.3966, test_f1: 0.5743
 epoch: 85, train_loss: 0.1599, test_loss: 2.3742, test_f1: 0.6029
 epoch: 86, train_loss: 0.1789, test_loss: 2.3776, test_f1: 0.5735
 epoch: 87, train_loss: 0.1796, test_loss: 2.4829, test_f1: 0.5834
 epoch: 88, train_loss: 0.1685, test_loss: 2.6699, test_f1: 0.5702
 epoch: 89, train_loss: 0.1628, test_loss: 2.4881, test_f1: 0.6079
 epoch: 90, train_loss: 0.1556, test_loss: 2.4552, test_f1: 0.5534
 epoch: 91, train_loss: 0.1804, test_loss: 2.4610, test_f1: 0.6107
 epoch: 92, train_loss: 0.1675, test_loss: 2.6051, test_f1: 0.6152
 epoch: 93, train_loss: 0.1318, test_loss: 2.7842, test_f1: 0.5898
 epoch: 94, train_loss: 0.1782, test_loss: 2.8669, test_f1: 0.5964
 epoch: 95, train_loss: 0.1888, test_loss: 2.2271, test_f1: 0.5830
 epoch: 96, train_loss: 0.1617, test_loss: 2.7697, test_f1: 0.5473
 epoch: 97, train_loss: 0.1672, test_loss: 2.3774, test_f1: 0.6139
 epoch: 98, train_loss: 0.1800, test_loss: 2.9820, test_f1: 0.5649
 epoch: 99, train_loss: 0.1690, test_loss: 2.6774, test_f1: 0.5668
##################ITERATION #7 ****************************************
 epoch: 0, train_loss: 1.3017, test_loss: 1.3495, test_f1: 0.2340
 epoch: 1, train_loss: 1.0505, test_loss: 1.1008, test_f1: 0.4486
 epoch: 2, train_loss: 0.9723, test_loss: 1.0981, test_f1: 0.5285
 epoch: 3, train_loss: 0.9149, test_loss: 1.1212, test_f1: 0.5894
 epoch: 4, train_loss: 0.8710, test_loss: 1.0330, test_f1: 0.5940
 epoch: 5, train_loss: 0.8492, test_loss: 1.0489, test_f1: 0.5732
 epoch: 6, train_loss: 0.8129, test_loss: 1.1712, test_f1: 0.5085
 epoch: 7, train_loss: 0.7808, test_loss: 1.0812, test_f1: 0.5993
 epoch: 8, train_loss: 0.7762, test_loss: 1.0785, test_f1: 0.5422
 epoch: 9, train_loss: 0.7350, test_loss: 1.1872, test_f1: 0.6525
 epoch: 10, train_loss: 0.7243, test_loss: 1.0977, test_f1: 0.5983
 epoch: 11, train_loss: 0.7278, test_loss: 0.9820, test_f1: 0.5938
 epoch: 12, train_loss: 0.6919, test_loss: 1.1604, test_f1: 0.5661
 epoch: 13, train_loss: 0.6666, test_loss: 1.2131, test_f1: 0.6510
 epoch: 14, train_loss: 0.6590, test_loss: 1.3209, test_f1: 0.5411
 epoch: 15, train_loss: 0.6373, test_loss: 1.2205, test_f1: 0.5485
 epoch: 16, train_loss: 0.6250, test_loss: 1.3164, test_f1: 0.5150
 epoch: 17, train_loss: 0.6216, test_loss: 1.3831, test_f1: 0.5720
 epoch: 18, train_loss: 0.6183, test_loss: 1.0930, test_f1: 0.6354
 epoch: 19, train_loss: 0.5893, test_loss: 1.5064, test_f1: 0.4817
 epoch: 20, train_loss: 0.5766, test_loss: 1.5035, test_f1: 0.4825
 epoch: 21, train_loss: 0.5748, test_loss: 1.1508, test_f1: 0.6036
 epoch: 22, train_loss: 0.5599, test_loss: 1.1173, test_f1: 0.6201
 epoch: 23, train_loss: 0.5553, test_loss: 1.5135, test_f1: 0.5788
 epoch: 24, train_loss: 0.5456, test_loss: 1.2055, test_f1: 0.6086
 epoch: 25, train_loss: 0.5233, test_loss: 1.4119, test_f1: 0.5505
 epoch: 26, train_loss: 0.4988, test_loss: 1.3933, test_f1: 0.5446
 epoch: 27, train_loss: 0.5361, test_loss: 1.3779, test_f1: 0.6159
 epoch: 28, train_loss: 0.5121, test_loss: 1.2049, test_f1: 0.6347
 epoch: 29, train_loss: 0.4731, test_loss: 1.1887, test_f1: 0.6161
 epoch: 30, train_loss: 0.4920, test_loss: 1.2897, test_f1: 0.6005
 epoch: 31, train_loss: 0.4358, test_loss: 1.2669, test_f1: 0.6195
 epoch: 32, train_loss: 0.4297, test_loss: 1.3458, test_f1: 0.6227
 epoch: 33, train_loss: 0.4688, test_loss: 1.2670, test_f1: 0.6383
 epoch: 34, train_loss: 0.4150, test_loss: 1.5829, test_f1: 0.6274
 epoch: 35, train_loss: 0.4372, test_loss: 1.4349, test_f1: 0.6749
 epoch: 36, train_loss: 0.4117, test_loss: 1.5019, test_f1: 0.5823
 epoch: 37, train_loss: 0.4054, test_loss: 1.4032, test_f1: 0.6219
 epoch: 38, train_loss: 0.4246, test_loss: 1.5331, test_f1: 0.5744
 epoch: 39, train_loss: 0.3567, test_loss: 1.8080, test_f1: 0.5767
 epoch: 40, train_loss: 0.3780, test_loss: 1.8390, test_f1: 0.5348
 epoch: 41, train_loss: 0.3930, test_loss: 1.5719, test_f1: 0.5362
 epoch: 42, train_loss: 0.3541, test_loss: 1.6568, test_f1: 0.5494
 epoch: 43, train_loss: 0.3521, test_loss: 1.7678, test_f1: 0.6201
 epoch: 44, train_loss: 0.3574, test_loss: 1.7978, test_f1: 0.5920
 epoch: 45, train_loss: 0.3347, test_loss: 2.0447, test_f1: 0.5284
 epoch: 46, train_loss: 0.3865, test_loss: 1.6135, test_f1: 0.6084
 epoch: 47, train_loss: 0.4167, test_loss: 1.5226, test_f1: 0.6248
 epoch: 48, train_loss: 0.3773, test_loss: 1.7117, test_f1: 0.5575
 epoch: 49, train_loss: 0.3388, test_loss: 1.5610, test_f1: 0.6256
 epoch: 50, train_loss: 0.3088, test_loss: 1.7693, test_f1: 0.5946
 epoch: 51, train_loss: 0.2969, test_loss: 1.8441, test_f1: 0.5836
 epoch: 52, train_loss: 0.2647, test_loss: 1.8855, test_f1: 0.6014
 epoch: 53, train_loss: 0.2286, test_loss: 1.8319, test_f1: 0.6127
 epoch: 54, train_loss: 0.2207, test_loss: 2.0297, test_f1: 0.5967
 epoch: 55, train_loss: 0.2534, test_loss: 1.9428, test_f1: 0.6257
 epoch: 56, train_loss: 0.2561, test_loss: 1.9642, test_f1: 0.5991
 epoch: 57, train_loss: 0.2348, test_loss: 2.0240, test_f1: 0.6004
 epoch: 58, train_loss: 0.2302, test_loss: 2.1478, test_f1: 0.5997
 epoch: 59, train_loss: 0.1967, test_loss: 2.3830, test_f1: 0.5573
 epoch: 60, train_loss: 0.2067, test_loss: 1.9978, test_f1: 0.5687
 epoch: 61, train_loss: 0.2062, test_loss: 2.2251, test_f1: 0.6433
 epoch: 62, train_loss: 0.2173, test_loss: 2.3667, test_f1: 0.5525
 epoch: 63, train_loss: 0.2331, test_loss: 2.5917, test_f1: 0.6012
 epoch: 64, train_loss: 0.2276, test_loss: 2.3411, test_f1: 0.5805
 epoch: 65, train_loss: 0.2103, test_loss: 2.4923, test_f1: 0.5686
 epoch: 66, train_loss: 0.2338, test_loss: 2.1821, test_f1: 0.6247
 epoch: 67, train_loss: 0.2177, test_loss: 2.4859, test_f1: 0.6072
 epoch: 68, train_loss: 0.2113, test_loss: 2.1100, test_f1: 0.6013
 epoch: 69, train_loss: 0.1817, test_loss: 2.1543, test_f1: 0.6340
 epoch: 70, train_loss: 0.1876, test_loss: 2.3152, test_f1: 0.5925
 epoch: 71, train_loss: 0.1778, test_loss: 2.3857, test_f1: 0.6027
 epoch: 72, train_loss: 0.1917, test_loss: 2.3907, test_f1: 0.5981
 epoch: 73, train_loss: 0.1699, test_loss: 2.4338, test_f1: 0.5878
 epoch: 74, train_loss: 0.1724, test_loss: 2.5468, test_f1: 0.5647
 epoch: 75, train_loss: 0.1799, test_loss: 2.4016, test_f1: 0.5832
 epoch: 76, train_loss: 0.1575, test_loss: 2.4289, test_f1: 0.5929
 epoch: 77, train_loss: 0.1604, test_loss: 2.5276, test_f1: 0.5638
 epoch: 78, train_loss: 0.1729, test_loss: 2.5863, test_f1: 0.5680
 epoch: 79, train_loss: 0.1837, test_loss: 2.3892, test_f1: 0.6082
 epoch: 80, train_loss: 0.1607, test_loss: 2.7494, test_f1: 0.5623
 epoch: 81, train_loss: 0.1746, test_loss: 2.6139, test_f1: 0.5786
 epoch: 82, train_loss: 0.1685, test_loss: 2.6536, test_f1: 0.5575
 epoch: 83, train_loss: 0.1636, test_loss: 2.7070, test_f1: 0.5380
 epoch: 84, train_loss: 0.1351, test_loss: 2.7126, test_f1: 0.5758
 epoch: 85, train_loss: 0.1755, test_loss: 3.1021, test_f1: 0.5611
 epoch: 86, train_loss: 0.1811, test_loss: 3.0662, test_f1: 0.5188
 epoch: 87, train_loss: 0.2144, test_loss: 2.5667, test_f1: 0.5911
 epoch: 88, train_loss: 0.1588, test_loss: 2.8317, test_f1: 0.5793
 epoch: 89, train_loss: 0.1681, test_loss: 2.5875, test_f1: 0.5504
 epoch: 90, train_loss: 0.1575, test_loss: 2.6174, test_f1: 0.5470
 epoch: 91, train_loss: 0.1446, test_loss: 2.7729, test_f1: 0.5695
 epoch: 92, train_loss: 0.1614, test_loss: 3.0597, test_f1: 0.5533
 epoch: 93, train_loss: 0.1563, test_loss: 2.8620, test_f1: 0.5884
 epoch: 94, train_loss: 0.1459, test_loss: 2.6950, test_f1: 0.5725
 epoch: 95, train_loss: 0.1472, test_loss: 2.7375, test_f1: 0.5864
 epoch: 96, train_loss: 0.1268, test_loss: 2.7052, test_f1: 0.5903
 epoch: 97, train_loss: 0.1510, test_loss: 3.3572, test_f1: 0.5695
 epoch: 98, train_loss: 0.1590, test_loss: 2.4688, test_f1: 0.5926
 epoch: 99, train_loss: 0.1429, test_loss: 2.6296, test_f1: 0.6029
##################ITERATION #8 ****************************************
 epoch: 0, train_loss: 1.3421, test_loss: 1.3731, test_f1: 0.3471
 epoch: 1, train_loss: 1.0550, test_loss: 1.1829, test_f1: 0.4442
 epoch: 2, train_loss: 0.9841, test_loss: 1.0917, test_f1: 0.5579
 epoch: 3, train_loss: 0.9104, test_loss: 1.0474, test_f1: 0.5999
 epoch: 4, train_loss: 0.8563, test_loss: 1.0367, test_f1: 0.5730
 epoch: 5, train_loss: 0.8359, test_loss: 1.0512, test_f1: 0.5764
 epoch: 6, train_loss: 0.7824, test_loss: 0.9804, test_f1: 0.6440
 epoch: 7, train_loss: 0.7871, test_loss: 1.0306, test_f1: 0.5781
 epoch: 8, train_loss: 0.7598, test_loss: 1.1134, test_f1: 0.5339
 epoch: 9, train_loss: 0.7597, test_loss: 1.1534, test_f1: 0.6101
 epoch: 10, train_loss: 0.7498, test_loss: 1.0072, test_f1: 0.5994
 epoch: 11, train_loss: 0.7089, test_loss: 1.0633, test_f1: 0.5838
 epoch: 12, train_loss: 0.7066, test_loss: 1.2107, test_f1: 0.6201
 epoch: 13, train_loss: 0.6636, test_loss: 1.2127, test_f1: 0.5588
 epoch: 14, train_loss: 0.6514, test_loss: 1.2128, test_f1: 0.5829
 epoch: 15, train_loss: 0.6300, test_loss: 1.1756, test_f1: 0.5789
 epoch: 16, train_loss: 0.6463, test_loss: 1.2271, test_f1: 0.5612
 epoch: 17, train_loss: 0.6157, test_loss: 1.3336, test_f1: 0.5621
 epoch: 18, train_loss: 0.5912, test_loss: 1.3346, test_f1: 0.5649
 epoch: 19, train_loss: 0.5815, test_loss: 1.2459, test_f1: 0.5476
 epoch: 20, train_loss: 0.5546, test_loss: 1.5312, test_f1: 0.5216
 epoch: 21, train_loss: 0.5723, test_loss: 1.2320, test_f1: 0.6227
 epoch: 22, train_loss: 0.5428, test_loss: 1.2900, test_f1: 0.5838
 epoch: 23, train_loss: 0.5182, test_loss: 1.3785, test_f1: 0.5589
 epoch: 24, train_loss: 0.5378, test_loss: 1.3846, test_f1: 0.5726
 epoch: 25, train_loss: 0.4835, test_loss: 1.4311, test_f1: 0.5973
 epoch: 26, train_loss: 0.5030, test_loss: 1.5065, test_f1: 0.5648
 epoch: 27, train_loss: 0.4773, test_loss: 1.4306, test_f1: 0.6022
 epoch: 28, train_loss: 0.4850, test_loss: 1.7231, test_f1: 0.5046
 epoch: 29, train_loss: 0.4657, test_loss: 1.7159, test_f1: 0.5732
 epoch: 30, train_loss: 0.4656, test_loss: 1.5446, test_f1: 0.5748
 epoch: 31, train_loss: 0.4418, test_loss: 1.3881, test_f1: 0.6469
 epoch: 32, train_loss: 0.4662, test_loss: 1.4877, test_f1: 0.5987
 epoch: 33, train_loss: 0.4442, test_loss: 1.6346, test_f1: 0.5633
 epoch: 34, train_loss: 0.4229, test_loss: 1.7233, test_f1: 0.5311
 epoch: 35, train_loss: 0.3617, test_loss: 1.6780, test_f1: 0.5875
 epoch: 36, train_loss: 0.3953, test_loss: 1.6571, test_f1: 0.5690
 epoch: 37, train_loss: 0.4337, test_loss: 1.5306, test_f1: 0.6280
 epoch: 38, train_loss: 0.3817, test_loss: 1.8038, test_f1: 0.5744
 epoch: 39, train_loss: 0.3532, test_loss: 1.6806, test_f1: 0.5851
 epoch: 40, train_loss: 0.3591, test_loss: 1.6751, test_f1: 0.6233
 epoch: 41, train_loss: 0.3437, test_loss: 2.0383, test_f1: 0.5945
 epoch: 42, train_loss: 0.3866, test_loss: 1.7867, test_f1: 0.6461
 epoch: 43, train_loss: 0.3282, test_loss: 1.7948, test_f1: 0.6182
 epoch: 44, train_loss: 0.3163, test_loss: 1.8038, test_f1: 0.6153
 epoch: 45, train_loss: 0.3186, test_loss: 1.6857, test_f1: 0.6178
 epoch: 46, train_loss: 0.3159, test_loss: 1.9272, test_f1: 0.6191
 epoch: 47, train_loss: 0.3196, test_loss: 2.2000, test_f1: 0.6072
 epoch: 48, train_loss: 0.3066, test_loss: 2.1630, test_f1: 0.5898
 epoch: 49, train_loss: 0.3015, test_loss: 1.8293, test_f1: 0.6128
 epoch: 50, train_loss: 0.3095, test_loss: 1.9280, test_f1: 0.5991
 epoch: 51, train_loss: 0.2588, test_loss: 1.9065, test_f1: 0.6239
 epoch: 52, train_loss: 0.2580, test_loss: 2.0146, test_f1: 0.6012
 epoch: 53, train_loss: 0.2304, test_loss: 2.1091, test_f1: 0.6011
 epoch: 54, train_loss: 0.2261, test_loss: 2.1178, test_f1: 0.5970
 epoch: 55, train_loss: 0.1935, test_loss: 2.0732, test_f1: 0.6101
 epoch: 56, train_loss: 0.2220, test_loss: 2.2544, test_f1: 0.6163
 epoch: 57, train_loss: 0.2104, test_loss: 2.1466, test_f1: 0.6036
 epoch: 58, train_loss: 0.1800, test_loss: 2.1110, test_f1: 0.6092
 epoch: 59, train_loss: 0.1781, test_loss: 2.5081, test_f1: 0.6095
 epoch: 60, train_loss: 0.1984, test_loss: 2.5590, test_f1: 0.5964
 epoch: 61, train_loss: 0.1859, test_loss: 2.3462, test_f1: 0.6336
 epoch: 62, train_loss: 0.1971, test_loss: 2.3351, test_f1: 0.5863
 epoch: 63, train_loss: 0.1910, test_loss: 2.2728, test_f1: 0.6223
 epoch: 64, train_loss: 0.1795, test_loss: 2.2636, test_f1: 0.6007
 epoch: 65, train_loss: 0.1888, test_loss: 2.2023, test_f1: 0.5874
 epoch: 66, train_loss: 0.1877, test_loss: 2.4745, test_f1: 0.6093
 epoch: 67, train_loss: 0.1607, test_loss: 2.4755, test_f1: 0.5897
 epoch: 68, train_loss: 0.1834, test_loss: 2.5682, test_f1: 0.6250
 epoch: 69, train_loss: 0.2075, test_loss: 2.4225, test_f1: 0.5854
 epoch: 70, train_loss: 0.1889, test_loss: 2.5814, test_f1: 0.6081
 epoch: 71, train_loss: 0.1572, test_loss: 2.3730, test_f1: 0.6099
 epoch: 72, train_loss: 0.1645, test_loss: 2.5579, test_f1: 0.6073
 epoch: 73, train_loss: 0.1536, test_loss: 2.5922, test_f1: 0.6210
 epoch: 74, train_loss: 0.1475, test_loss: 2.5017, test_f1: 0.5856
 epoch: 75, train_loss: 0.1720, test_loss: 2.5918, test_f1: 0.5924
 epoch: 76, train_loss: 0.1501, test_loss: 2.7222, test_f1: 0.6166
 epoch: 77, train_loss: 0.1605, test_loss: 2.9274, test_f1: 0.6125
 epoch: 78, train_loss: 0.1392, test_loss: 2.6337, test_f1: 0.6197
 epoch: 79, train_loss: 0.1235, test_loss: 2.8210, test_f1: 0.6192
 epoch: 80, train_loss: 0.1309, test_loss: 2.8222, test_f1: 0.6114
 epoch: 81, train_loss: 0.1575, test_loss: 3.0913, test_f1: 0.5880
 epoch: 82, train_loss: 0.1783, test_loss: 2.7359, test_f1: 0.5700
 epoch: 83, train_loss: 0.1576, test_loss: 2.9688, test_f1: 0.6238
 epoch: 84, train_loss: 0.1581, test_loss: 2.5791, test_f1: 0.6214
 epoch: 85, train_loss: 0.1469, test_loss: 2.7318, test_f1: 0.6286
 epoch: 86, train_loss: 0.1174, test_loss: 2.9346, test_f1: 0.5951
 epoch: 87, train_loss: 0.1251, test_loss: 2.7899, test_f1: 0.5954
 epoch: 88, train_loss: 0.1301, test_loss: 2.6890, test_f1: 0.6240
 epoch: 89, train_loss: 0.1441, test_loss: 2.9073, test_f1: 0.5812
 epoch: 90, train_loss: 0.1302, test_loss: 2.9612, test_f1: 0.5880
 epoch: 91, train_loss: 0.1462, test_loss: 3.1189, test_f1: 0.6138
 epoch: 92, train_loss: 0.1438, test_loss: 2.8190, test_f1: 0.6055
 epoch: 93, train_loss: 0.1465, test_loss: 3.0818, test_f1: 0.6068
 epoch: 94, train_loss: 0.1312, test_loss: 2.8047, test_f1: 0.6190
 epoch: 95, train_loss: 0.1636, test_loss: 3.2159, test_f1: 0.6202
 epoch: 96, train_loss: 0.1598, test_loss: 3.2186, test_f1: 0.6229
 epoch: 97, train_loss: 0.1425, test_loss: 2.4343, test_f1: 0.6291
 epoch: 98, train_loss: 0.1145, test_loss: 2.9213, test_f1: 0.5990
 epoch: 99, train_loss: 0.1168, test_loss: 2.6889, test_f1: 0.6391
##################ITERATION #9 ****************************************
 epoch: 0, train_loss: 1.3652, test_loss: 1.4080, test_f1: 0.2952
 epoch: 1, train_loss: 1.0908, test_loss: 1.2478, test_f1: 0.3978
 epoch: 2, train_loss: 0.9734, test_loss: 1.1778, test_f1: 0.5298
 epoch: 3, train_loss: 0.9204, test_loss: 1.2650, test_f1: 0.5231
 epoch: 4, train_loss: 0.8813, test_loss: 1.0658, test_f1: 0.6156
 epoch: 5, train_loss: 0.8602, test_loss: 1.2450, test_f1: 0.5475
 epoch: 6, train_loss: 0.8188, test_loss: 1.1491, test_f1: 0.5842
 epoch: 7, train_loss: 0.8224, test_loss: 1.2974, test_f1: 0.5587
 epoch: 8, train_loss: 0.7918, test_loss: 1.0713, test_f1: 0.5897
 epoch: 9, train_loss: 0.7674, test_loss: 1.1074, test_f1: 0.5818
 epoch: 10, train_loss: 0.7406, test_loss: 1.2172, test_f1: 0.5435
 epoch: 11, train_loss: 0.6843, test_loss: 1.1714, test_f1: 0.5441
 epoch: 12, train_loss: 0.6926, test_loss: 1.1958, test_f1: 0.5593
 epoch: 13, train_loss: 0.6871, test_loss: 1.3886, test_f1: 0.5616
 epoch: 14, train_loss: 0.6884, test_loss: 1.1579, test_f1: 0.5868
 epoch: 15, train_loss: 0.6580, test_loss: 1.2819, test_f1: 0.5807
 epoch: 16, train_loss: 0.6449, test_loss: 1.1596, test_f1: 0.5908
 epoch: 17, train_loss: 0.6189, test_loss: 1.3090, test_f1: 0.5622
 epoch: 18, train_loss: 0.5940, test_loss: 1.1971, test_f1: 0.6019
 epoch: 19, train_loss: 0.6069, test_loss: 1.2448, test_f1: 0.6196
 epoch: 20, train_loss: 0.5971, test_loss: 1.1808, test_f1: 0.6182
 epoch: 21, train_loss: 0.6066, test_loss: 1.2449, test_f1: 0.6071
 epoch: 22, train_loss: 0.5931, test_loss: 1.1971, test_f1: 0.6316
 epoch: 23, train_loss: 0.5756, test_loss: 1.2478, test_f1: 0.6249
 epoch: 24, train_loss: 0.5641, test_loss: 1.2893, test_f1: 0.5888
 epoch: 25, train_loss: 0.5430, test_loss: 1.2696, test_f1: 0.5855
 epoch: 26, train_loss: 0.5406, test_loss: 1.3859, test_f1: 0.6163
 epoch: 27, train_loss: 0.5217, test_loss: 1.3577, test_f1: 0.5939
 epoch: 28, train_loss: 0.5442, test_loss: 1.6027, test_f1: 0.5232
 epoch: 29, train_loss: 0.4896, test_loss: 1.2063, test_f1: 0.6121
 epoch: 30, train_loss: 0.4561, test_loss: 1.4252, test_f1: 0.5995
 epoch: 31, train_loss: 0.4762, test_loss: 1.4763, test_f1: 0.6280
 epoch: 32, train_loss: 0.4998, test_loss: 1.4703, test_f1: 0.5928
 epoch: 33, train_loss: 0.4440, test_loss: 1.4345, test_f1: 0.5947
 epoch: 34, train_loss: 0.4787, test_loss: 1.4291, test_f1: 0.6226
 epoch: 35, train_loss: 0.4724, test_loss: 1.5748, test_f1: 0.6351
 epoch: 36, train_loss: 0.4351, test_loss: 1.5291, test_f1: 0.6222
 epoch: 37, train_loss: 0.4377, test_loss: 1.5300, test_f1: 0.6059
 epoch: 38, train_loss: 0.4051, test_loss: 1.4357, test_f1: 0.6042
 epoch: 39, train_loss: 0.4849, test_loss: 1.3517, test_f1: 0.6485
 epoch: 40, train_loss: 0.3761, test_loss: 1.5336, test_f1: 0.6160
 epoch: 41, train_loss: 0.3984, test_loss: 1.5382, test_f1: 0.6670
 epoch: 42, train_loss: 0.3667, test_loss: 1.4836, test_f1: 0.6307
 epoch: 43, train_loss: 0.3459, test_loss: 1.5025, test_f1: 0.6453
 epoch: 44, train_loss: 0.3393, test_loss: 1.5916, test_f1: 0.6345
 epoch: 45, train_loss: 0.3771, test_loss: 1.7668, test_f1: 0.6012
 epoch: 46, train_loss: 0.3876, test_loss: 1.5058, test_f1: 0.6452
 epoch: 47, train_loss: 0.3503, test_loss: 1.8052, test_f1: 0.5985
 epoch: 48, train_loss: 0.3651, test_loss: 1.9223, test_f1: 0.5703
 epoch: 49, train_loss: 0.3332, test_loss: 1.6953, test_f1: 0.6334
 epoch: 50, train_loss: 0.3700, test_loss: 1.5643, test_f1: 0.6201
 epoch: 51, train_loss: 0.2988, test_loss: 1.8135, test_f1: 0.5958
 epoch: 52, train_loss: 0.2905, test_loss: 1.5903, test_f1: 0.6449
 epoch: 53, train_loss: 0.2461, test_loss: 1.8512, test_f1: 0.5998
 epoch: 54, train_loss: 0.2319, test_loss: 1.6593, test_f1: 0.6749
 epoch: 55, train_loss: 0.2165, test_loss: 2.1231, test_f1: 0.5767
 epoch: 56, train_loss: 0.2517, test_loss: 1.7522, test_f1: 0.6439
 epoch: 57, train_loss: 0.2318, test_loss: 1.7648, test_f1: 0.6626
 epoch: 58, train_loss: 0.2379, test_loss: 1.8132, test_f1: 0.6648
 epoch: 59, train_loss: 0.2320, test_loss: 1.9587, test_f1: 0.6308
 epoch: 60, train_loss: 0.2139, test_loss: 1.8924, test_f1: 0.6219
 epoch: 61, train_loss: 0.2056, test_loss: 1.8936, test_f1: 0.6116
 epoch: 62, train_loss: 0.2105, test_loss: 2.0371, test_f1: 0.6275
 epoch: 63, train_loss: 0.2227, test_loss: 1.8773, test_f1: 0.6412
 epoch: 64, train_loss: 0.2139, test_loss: 1.9381, test_f1: 0.5996
 epoch: 65, train_loss: 0.2065, test_loss: 1.9930, test_f1: 0.6380
 epoch: 66, train_loss: 0.1823, test_loss: 2.0200, test_f1: 0.6385
 epoch: 67, train_loss: 0.1893, test_loss: 2.1964, test_f1: 0.5934
 epoch: 68, train_loss: 0.1684, test_loss: 1.9914, test_f1: 0.6365
 epoch: 69, train_loss: 0.1826, test_loss: 2.0288, test_f1: 0.6540
 epoch: 70, train_loss: 0.2023, test_loss: 2.2302, test_f1: 0.6226
 epoch: 71, train_loss: 0.1699, test_loss: 2.1261, test_f1: 0.6180
 epoch: 72, train_loss: 0.2168, test_loss: 2.0304, test_f1: 0.6371
 epoch: 73, train_loss: 0.1954, test_loss: 2.0364, test_f1: 0.6116
 epoch: 74, train_loss: 0.1817, test_loss: 2.3057, test_f1: 0.6008
 epoch: 75, train_loss: 0.1832, test_loss: 2.1662, test_f1: 0.6266
 epoch: 76, train_loss: 0.2087, test_loss: 2.3332, test_f1: 0.5805
 epoch: 77, train_loss: 0.1649, test_loss: 2.0089, test_f1: 0.6457
 epoch: 78, train_loss: 0.1567, test_loss: 2.3053, test_f1: 0.6227
 epoch: 79, train_loss: 0.1519, test_loss: 2.3326, test_f1: 0.6462
 epoch: 80, train_loss: 0.1539, test_loss: 2.1434, test_f1: 0.6156
 epoch: 81, train_loss: 0.1698, test_loss: 2.4422, test_f1: 0.5902
 epoch: 82, train_loss: 0.1782, test_loss: 2.0726, test_f1: 0.6584
 epoch: 83, train_loss: 0.1775, test_loss: 2.5151, test_f1: 0.5764
 epoch: 84, train_loss: 0.1536, test_loss: 2.3336, test_f1: 0.6139
 epoch: 85, train_loss: 0.1441, test_loss: 2.1461, test_f1: 0.6664
 epoch: 86, train_loss: 0.1608, test_loss: 2.0113, test_f1: 0.6417
 epoch: 87, train_loss: 0.1468, test_loss: 2.1870, test_f1: 0.6284
 epoch: 88, train_loss: 0.1380, test_loss: 2.2908, test_f1: 0.6322
 epoch: 89, train_loss: 0.1606, test_loss: 2.2869, test_f1: 0.6189
 epoch: 90, train_loss: 0.1323, test_loss: 2.2390, test_f1: 0.6415
 epoch: 91, train_loss: 0.1400, test_loss: 2.4793, test_f1: 0.6237
 epoch: 92, train_loss: 0.1689, test_loss: 2.4474, test_f1: 0.6329
 epoch: 93, train_loss: 0.1730, test_loss: 2.2901, test_f1: 0.6549
 epoch: 94, train_loss: 0.1475, test_loss: 2.1392, test_f1: 0.6330
 epoch: 95, train_loss: 0.1627, test_loss: 2.2776, test_f1: 0.6447
 epoch: 96, train_loss: 0.1572, test_loss: 2.3391, test_f1: 0.6160
 epoch: 97, train_loss: 0.1735, test_loss: 2.3925, test_f1: 0.6204
 epoch: 98, train_loss: 0.1286, test_loss: 2.1320, test_f1: 0.6326
 epoch: 99, train_loss: 0.1289, test_loss: 2.3103, test_f1: 0.6524

Training completed in 421.44 seconds
Best F1: 0.6812 at epoch 50
Mean F1 across iterations: 0.6640  0.0122
========================FINAL RESULTS================================
FEGIN weighted F1: 0.6812  0.0122
python main.py --data ltspice_demos --representation component_pin --model FEGIN --layers 3 --hiddens 64 --batch_size 64 --lr 0.001 --emb_size 250 --epochs 100 --save_appendix component_pin_L3_H64_BS64_LR0.001_E250 --no_val
-----



STDERR:
  File "main.py", line 370, in <module>
    main()
  File "main.py", line 254, in main
    dataset = dataset_class(
  File "/home/philip/projects/ltspice_examples_code_repo/Circuit-Completion-Using-GNNs/component_classification_with_link_prediction_head/evaluation/FEGIN/kernel/circuit_datasets.py", line 15, in __init__
    self.data, self.slices = torch.load(self.processed_paths[0])
  File "/home/philip/.local/lib/python3.8/site-packages/torch/serialization.py", line 1040, in load
    warnings.warn(
  File "/usr/lib/python3.8/warnings.py", line 109, in _showwarnmsg
    sw(msg.message, msg.category, msg.filename, msg.lineno,
  File "main.py", line 47, in warn_with_traceback
    traceback.print_stack(file=log)
/home/philip/projects/ltspice_examples_code_repo/Circuit-Completion-Using-GNNs/component_classification_with_link_prediction_head/evaluation/FEGIN/kernel/circuit_datasets.py:15: FutureWarning: You are using `torch.load` with `weights_only=False` (the current default value), which uses the default pickle module implicitly. It is possible to construct malicious pickle data which will execute arbitrary code during unpickling (See https://github.com/pytorch/pytorch/blob/main/SECURITY.md#untrusted-models for more details). In a future release, the default value for `weights_only` will be flipped to `True`. This limits the functions that could be executed during unpickling. Arbitrary objects will no longer be allowed to be loaded via this mode unless they are explicitly allowlisted by the user via `torch.serialization.add_safe_globals`. We recommend you start setting `weights_only=True` for any use case where you don't have full control of the loaded file. Please open an issue on GitHub for any issues related to this experimental feature.
  self.data, self.slices = torch.load(self.processed_paths[0])
