STDOUT:
Results will be saved in /home/philip/projects/llm_inference_code_repo/Circuit-Completion-Using-GNNs/component_classification_with_link_prediction_head/evaluation/FEGIN/results/model_FEGIN_dataset_ltspice_examples
Command line input: python main.py --data ltspice_examples --representation component_component --model FEGIN --layers 5 --hiddens 16 --batch_size 64 --lr 0.0001 --emb_size 128 --epochs 100 --save_appendix component_component_L5_H16_BS64_LR0.0001_E128 --no_val
 is saved.
-----
ltspice_examples - FEGIN
Using 5 layers, 16 hidden units, h = 2
Loading component_component representation dataset
ENTERED
Training FEGIN on component_component representation
Train: 3556, Test: 845
##################ITERATION #0 ****************************************
 epoch: 0, train_loss: 1.4119, test_loss: 1.4094, test_f1: 0.0295
 epoch: 1, train_loss: 1.4052, test_loss: 1.4033, test_f1: 0.0672
 epoch: 2, train_loss: 1.4007, test_loss: 1.3983, test_f1: 0.0955
 epoch: 3, train_loss: 1.3953, test_loss: 1.3937, test_f1: 0.0957
 epoch: 4, train_loss: 1.3904, test_loss: 1.3892, test_f1: 0.1261
 epoch: 5, train_loss: 1.3847, test_loss: 1.3841, test_f1: 0.1557
 epoch: 6, train_loss: 1.3790, test_loss: 1.3788, test_f1: 0.1785
 epoch: 7, train_loss: 1.3730, test_loss: 1.3737, test_f1: 0.2294
 epoch: 8, train_loss: 1.3660, test_loss: 1.3661, test_f1: 0.2301
 epoch: 9, train_loss: 1.3578, test_loss: 1.3574, test_f1: 0.2274
 epoch: 10, train_loss: 1.3514, test_loss: 1.3513, test_f1: 0.2274
 epoch: 11, train_loss: 1.3442, test_loss: 1.3438, test_f1: 0.2274
 epoch: 12, train_loss: 1.3364, test_loss: 1.3373, test_f1: 0.2274
 epoch: 13, train_loss: 1.3286, test_loss: 1.3311, test_f1: 0.2274
 epoch: 14, train_loss: 1.3209, test_loss: 1.3244, test_f1: 0.2274
 epoch: 15, train_loss: 1.3159, test_loss: 1.3185, test_f1: 0.2274
 epoch: 16, train_loss: 1.3087, test_loss: 1.3138, test_f1: 0.2274
 epoch: 17, train_loss: 1.3032, test_loss: 1.3091, test_f1: 0.2274
 epoch: 18, train_loss: 1.2999, test_loss: 1.3041, test_f1: 0.2274
 epoch: 19, train_loss: 1.2962, test_loss: 1.2995, test_f1: 0.2274
 epoch: 20, train_loss: 1.2944, test_loss: 1.2954, test_f1: 0.2274
 epoch: 21, train_loss: 1.2903, test_loss: 1.2909, test_f1: 0.2274
 epoch: 22, train_loss: 1.2876, test_loss: 1.2883, test_f1: 0.2274
 epoch: 23, train_loss: 1.2824, test_loss: 1.2840, test_f1: 0.2274
 epoch: 24, train_loss: 1.2815, test_loss: 1.2808, test_f1: 0.2274
 epoch: 25, train_loss: 1.2743, test_loss: 1.2765, test_f1: 0.2274
 epoch: 26, train_loss: 1.2743, test_loss: 1.2732, test_f1: 0.2274
 epoch: 27, train_loss: 1.2740, test_loss: 1.2691, test_f1: 0.2274
 epoch: 28, train_loss: 1.2711, test_loss: 1.2663, test_f1: 0.2274
 epoch: 29, train_loss: 1.2679, test_loss: 1.2629, test_f1: 0.2274
 epoch: 30, train_loss: 1.2671, test_loss: 1.2596, test_f1: 0.2274
 epoch: 31, train_loss: 1.2603, test_loss: 1.2570, test_f1: 0.2274
 epoch: 32, train_loss: 1.2605, test_loss: 1.2548, test_f1: 0.2274
 epoch: 33, train_loss: 1.2603, test_loss: 1.2524, test_f1: 0.2274
 epoch: 34, train_loss: 1.2570, test_loss: 1.2502, test_f1: 0.2300
 epoch: 35, train_loss: 1.2496, test_loss: 1.2477, test_f1: 0.2300
 epoch: 36, train_loss: 1.2525, test_loss: 1.2446, test_f1: 0.2300
 epoch: 37, train_loss: 1.2501, test_loss: 1.2418, test_f1: 0.2300
 epoch: 38, train_loss: 1.2482, test_loss: 1.2382, test_f1: 0.2373
 epoch: 39, train_loss: 1.2456, test_loss: 1.2358, test_f1: 0.2420
 epoch: 40, train_loss: 1.2481, test_loss: 1.2341, test_f1: 0.2420
 epoch: 41, train_loss: 1.2461, test_loss: 1.2302, test_f1: 0.2420
 epoch: 42, train_loss: 1.2420, test_loss: 1.2285, test_f1: 0.2492
 epoch: 43, train_loss: 1.2365, test_loss: 1.2268, test_f1: 0.2527
 epoch: 44, train_loss: 1.2407, test_loss: 1.2231, test_f1: 0.2543
 epoch: 45, train_loss: 1.2349, test_loss: 1.2218, test_f1: 0.2749
 epoch: 46, train_loss: 1.2346, test_loss: 1.2207, test_f1: 0.2882
 epoch: 47, train_loss: 1.2389, test_loss: 1.2189, test_f1: 0.2902
 epoch: 48, train_loss: 1.2314, test_loss: 1.2146, test_f1: 0.2956
 epoch: 49, train_loss: 1.2322, test_loss: 1.2153, test_f1: 0.2964
 epoch: 50, train_loss: 1.2273, test_loss: 1.2117, test_f1: 0.2984
 epoch: 51, train_loss: 1.2295, test_loss: 1.2107, test_f1: 0.3045
 epoch: 52, train_loss: 1.2258, test_loss: 1.2091, test_f1: 0.3065
 epoch: 53, train_loss: 1.2282, test_loss: 1.2085, test_f1: 0.2988
 epoch: 54, train_loss: 1.2250, test_loss: 1.2080, test_f1: 0.3068
 epoch: 55, train_loss: 1.2290, test_loss: 1.2066, test_f1: 0.3071
 epoch: 56, train_loss: 1.2277, test_loss: 1.2056, test_f1: 0.3108
 epoch: 57, train_loss: 1.2279, test_loss: 1.2032, test_f1: 0.3028
 epoch: 58, train_loss: 1.2240, test_loss: 1.2029, test_f1: 0.3113
 epoch: 59, train_loss: 1.2271, test_loss: 1.2038, test_f1: 0.3106
 epoch: 60, train_loss: 1.2194, test_loss: 1.2020, test_f1: 0.3123
 epoch: 61, train_loss: 1.2236, test_loss: 1.2018, test_f1: 0.3200
 epoch: 62, train_loss: 1.2245, test_loss: 1.2011, test_f1: 0.3163
 epoch: 63, train_loss: 1.2204, test_loss: 1.1999, test_f1: 0.3234
 epoch: 64, train_loss: 1.2197, test_loss: 1.1987, test_f1: 0.3230
 epoch: 65, train_loss: 1.2199, test_loss: 1.1975, test_f1: 0.3236
 epoch: 66, train_loss: 1.2230, test_loss: 1.1979, test_f1: 0.3276
 epoch: 67, train_loss: 1.2238, test_loss: 1.1965, test_f1: 0.3314
 epoch: 68, train_loss: 1.2191, test_loss: 1.1957, test_f1: 0.3265
 epoch: 69, train_loss: 1.2152, test_loss: 1.1959, test_f1: 0.3214
 epoch: 70, train_loss: 1.2189, test_loss: 1.1949, test_f1: 0.3314
 epoch: 71, train_loss: 1.2145, test_loss: 1.1940, test_f1: 0.3509
 epoch: 72, train_loss: 1.2146, test_loss: 1.1924, test_f1: 0.3486
 epoch: 73, train_loss: 1.2152, test_loss: 1.1934, test_f1: 0.3558
 epoch: 74, train_loss: 1.2168, test_loss: 1.1913, test_f1: 0.3456
 epoch: 75, train_loss: 1.2148, test_loss: 1.1901, test_f1: 0.3458
 epoch: 76, train_loss: 1.2117, test_loss: 1.1893, test_f1: 0.3509
 epoch: 77, train_loss: 1.2153, test_loss: 1.1895, test_f1: 0.3564
 epoch: 78, train_loss: 1.2066, test_loss: 1.1892, test_f1: 0.3613
 epoch: 79, train_loss: 1.2120, test_loss: 1.1862, test_f1: 0.3475
 epoch: 80, train_loss: 1.2120, test_loss: 1.1860, test_f1: 0.3589
 epoch: 81, train_loss: 1.2122, test_loss: 1.1872, test_f1: 0.3580
 epoch: 82, train_loss: 1.2081, test_loss: 1.1846, test_f1: 0.3492
 epoch: 83, train_loss: 1.2062, test_loss: 1.1828, test_f1: 0.3660
 epoch: 84, train_loss: 1.2032, test_loss: 1.1822, test_f1: 0.3571
 epoch: 85, train_loss: 1.2045, test_loss: 1.1830, test_f1: 0.3593
 epoch: 86, train_loss: 1.2030, test_loss: 1.1809, test_f1: 0.3655
 epoch: 87, train_loss: 1.2040, test_loss: 1.1829, test_f1: 0.3757
 epoch: 88, train_loss: 1.2125, test_loss: 1.1803, test_f1: 0.3628
 epoch: 89, train_loss: 1.2064, test_loss: 1.1789, test_f1: 0.3673
 epoch: 90, train_loss: 1.2067, test_loss: 1.1799, test_f1: 0.3751
 epoch: 91, train_loss: 1.2062, test_loss: 1.1792, test_f1: 0.3703
 epoch: 92, train_loss: 1.2004, test_loss: 1.1785, test_f1: 0.3737
 epoch: 93, train_loss: 1.2032, test_loss: 1.1757, test_f1: 0.3665
 epoch: 94, train_loss: 1.2036, test_loss: 1.1792, test_f1: 0.3713
 epoch: 95, train_loss: 1.2036, test_loss: 1.1758, test_f1: 0.3766
 epoch: 96, train_loss: 1.1953, test_loss: 1.1738, test_f1: 0.3778
 epoch: 97, train_loss: 1.2035, test_loss: 1.1723, test_f1: 0.3898
 epoch: 98, train_loss: 1.1978, test_loss: 1.1750, test_f1: 0.3824
 epoch: 99, train_loss: 1.1944, test_loss: 1.1742, test_f1: 0.3797
##################ITERATION #1 ****************************************
 epoch: 0, train_loss: 1.3658, test_loss: 1.3635, test_f1: 0.2276
 epoch: 1, train_loss: 1.3543, test_loss: 1.3560, test_f1: 0.2276
 epoch: 2, train_loss: 1.3467, test_loss: 1.3486, test_f1: 0.2300
 epoch: 3, train_loss: 1.3392, test_loss: 1.3393, test_f1: 0.2274
 epoch: 4, train_loss: 1.3329, test_loss: 1.3312, test_f1: 0.2274
 epoch: 5, train_loss: 1.3233, test_loss: 1.3237, test_f1: 0.2274
 epoch: 6, train_loss: 1.3174, test_loss: 1.3140, test_f1: 0.2274
 epoch: 7, train_loss: 1.3114, test_loss: 1.3071, test_f1: 0.2274
 epoch: 8, train_loss: 1.3087, test_loss: 1.2999, test_f1: 0.2274
 epoch: 9, train_loss: 1.2997, test_loss: 1.2941, test_f1: 0.2274
 epoch: 10, train_loss: 1.2966, test_loss: 1.2888, test_f1: 0.2274
 epoch: 11, train_loss: 1.2902, test_loss: 1.2826, test_f1: 0.2274
 epoch: 12, train_loss: 1.2872, test_loss: 1.2782, test_f1: 0.2274
 epoch: 13, train_loss: 1.2854, test_loss: 1.2746, test_f1: 0.2274
 epoch: 14, train_loss: 1.2798, test_loss: 1.2708, test_f1: 0.2274
 epoch: 15, train_loss: 1.2758, test_loss: 1.2666, test_f1: 0.2274
 epoch: 16, train_loss: 1.2758, test_loss: 1.2630, test_f1: 0.2274
 epoch: 17, train_loss: 1.2753, test_loss: 1.2601, test_f1: 0.2554
 epoch: 18, train_loss: 1.2730, test_loss: 1.2566, test_f1: 0.2555
 epoch: 19, train_loss: 1.2666, test_loss: 1.2556, test_f1: 0.2555
 epoch: 20, train_loss: 1.2642, test_loss: 1.2508, test_f1: 0.2555
 epoch: 21, train_loss: 1.2619, test_loss: 1.2481, test_f1: 0.2578
 epoch: 22, train_loss: 1.2620, test_loss: 1.2453, test_f1: 0.2690
 epoch: 23, train_loss: 1.2629, test_loss: 1.2427, test_f1: 0.2668
 epoch: 24, train_loss: 1.2563, test_loss: 1.2418, test_f1: 0.2720
 epoch: 25, train_loss: 1.2549, test_loss: 1.2395, test_f1: 0.2722
 epoch: 26, train_loss: 1.2546, test_loss: 1.2365, test_f1: 0.2749
 epoch: 27, train_loss: 1.2532, test_loss: 1.2348, test_f1: 0.2735
 epoch: 28, train_loss: 1.2495, test_loss: 1.2332, test_f1: 0.2843
 epoch: 29, train_loss: 1.2510, test_loss: 1.2294, test_f1: 0.2846
 epoch: 30, train_loss: 1.2477, test_loss: 1.2286, test_f1: 0.2827
 epoch: 31, train_loss: 1.2489, test_loss: 1.2278, test_f1: 0.2834
 epoch: 32, train_loss: 1.2492, test_loss: 1.2255, test_f1: 0.2851
 epoch: 33, train_loss: 1.2393, test_loss: 1.2213, test_f1: 0.2913
 epoch: 34, train_loss: 1.2438, test_loss: 1.2205, test_f1: 0.2797
 epoch: 35, train_loss: 1.2402, test_loss: 1.2185, test_f1: 0.2921
 epoch: 36, train_loss: 1.2375, test_loss: 1.2174, test_f1: 0.2840
 epoch: 37, train_loss: 1.2360, test_loss: 1.2158, test_f1: 0.2902
 epoch: 38, train_loss: 1.2294, test_loss: 1.2124, test_f1: 0.2917
 epoch: 39, train_loss: 1.2332, test_loss: 1.2100, test_f1: 0.2843
 epoch: 40, train_loss: 1.2342, test_loss: 1.2088, test_f1: 0.2866
 epoch: 41, train_loss: 1.2392, test_loss: 1.2073, test_f1: 0.2920
 epoch: 42, train_loss: 1.2286, test_loss: 1.2050, test_f1: 0.2861
 epoch: 43, train_loss: 1.2277, test_loss: 1.2033, test_f1: 0.2873
 epoch: 44, train_loss: 1.2255, test_loss: 1.2006, test_f1: 0.2839
 epoch: 45, train_loss: 1.2231, test_loss: 1.1996, test_f1: 0.2804
 epoch: 46, train_loss: 1.2246, test_loss: 1.1973, test_f1: 0.2861
 epoch: 47, train_loss: 1.2239, test_loss: 1.1953, test_f1: 0.2822
 epoch: 48, train_loss: 1.2189, test_loss: 1.1914, test_f1: 0.2805
 epoch: 49, train_loss: 1.2165, test_loss: 1.1901, test_f1: 0.2888
 epoch: 50, train_loss: 1.2181, test_loss: 1.1906, test_f1: 0.2913
 epoch: 51, train_loss: 1.2176, test_loss: 1.1890, test_f1: 0.2928
 epoch: 52, train_loss: 1.2176, test_loss: 1.1879, test_f1: 0.2881
 epoch: 53, train_loss: 1.2161, test_loss: 1.1877, test_f1: 0.2898
 epoch: 54, train_loss: 1.2135, test_loss: 1.1873, test_f1: 0.2849
 epoch: 55, train_loss: 1.2118, test_loss: 1.1853, test_f1: 0.2943
 epoch: 56, train_loss: 1.2141, test_loss: 1.1845, test_f1: 0.2958
 epoch: 57, train_loss: 1.2092, test_loss: 1.1832, test_f1: 0.2951
 epoch: 58, train_loss: 1.2096, test_loss: 1.1834, test_f1: 0.2939
 epoch: 59, train_loss: 1.2124, test_loss: 1.1825, test_f1: 0.2959
 epoch: 60, train_loss: 1.2102, test_loss: 1.1822, test_f1: 0.3022
 epoch: 61, train_loss: 1.2102, test_loss: 1.1829, test_f1: 0.2989
 epoch: 62, train_loss: 1.2070, test_loss: 1.1798, test_f1: 0.3038
 epoch: 63, train_loss: 1.2065, test_loss: 1.1789, test_f1: 0.3132
 epoch: 64, train_loss: 1.2085, test_loss: 1.1797, test_f1: 0.3061
 epoch: 65, train_loss: 1.1987, test_loss: 1.1802, test_f1: 0.3022
 epoch: 66, train_loss: 1.1985, test_loss: 1.1780, test_f1: 0.3022
 epoch: 67, train_loss: 1.2101, test_loss: 1.1772, test_f1: 0.3132
 epoch: 68, train_loss: 1.2053, test_loss: 1.1787, test_f1: 0.3006
 epoch: 69, train_loss: 1.2016, test_loss: 1.1788, test_f1: 0.3013
 epoch: 70, train_loss: 1.2056, test_loss: 1.1771, test_f1: 0.3198
 epoch: 71, train_loss: 1.2008, test_loss: 1.1754, test_f1: 0.3307
 epoch: 72, train_loss: 1.1961, test_loss: 1.1750, test_f1: 0.3171
 epoch: 73, train_loss: 1.2070, test_loss: 1.1733, test_f1: 0.3339
 epoch: 74, train_loss: 1.2033, test_loss: 1.1732, test_f1: 0.3293
 epoch: 75, train_loss: 1.2026, test_loss: 1.1725, test_f1: 0.3337
 epoch: 76, train_loss: 1.1992, test_loss: 1.1704, test_f1: 0.3215
 epoch: 77, train_loss: 1.1970, test_loss: 1.1713, test_f1: 0.3256
 epoch: 78, train_loss: 1.1975, test_loss: 1.1697, test_f1: 0.3228
 epoch: 79, train_loss: 1.1965, test_loss: 1.1690, test_f1: 0.3369
 epoch: 80, train_loss: 1.1948, test_loss: 1.1686, test_f1: 0.3293
 epoch: 81, train_loss: 1.1956, test_loss: 1.1695, test_f1: 0.3342
 epoch: 82, train_loss: 1.1855, test_loss: 1.1664, test_f1: 0.3438
 epoch: 83, train_loss: 1.1985, test_loss: 1.1663, test_f1: 0.3451
 epoch: 84, train_loss: 1.1979, test_loss: 1.1668, test_f1: 0.3347
 epoch: 85, train_loss: 1.1896, test_loss: 1.1637, test_f1: 0.3435
 epoch: 86, train_loss: 1.1909, test_loss: 1.1654, test_f1: 0.3425
 epoch: 87, train_loss: 1.1889, test_loss: 1.1673, test_f1: 0.3412
 epoch: 88, train_loss: 1.1919, test_loss: 1.1673, test_f1: 0.3445
 epoch: 89, train_loss: 1.1836, test_loss: 1.1626, test_f1: 0.3522
 epoch: 90, train_loss: 1.1918, test_loss: 1.1626, test_f1: 0.3480
 epoch: 91, train_loss: 1.1903, test_loss: 1.1604, test_f1: 0.3618
 epoch: 92, train_loss: 1.1863, test_loss: 1.1645, test_f1: 0.3454
 epoch: 93, train_loss: 1.1886, test_loss: 1.1612, test_f1: 0.3652
 epoch: 94, train_loss: 1.1884, test_loss: 1.1622, test_f1: 0.3667
 epoch: 95, train_loss: 1.1869, test_loss: 1.1589, test_f1: 0.3593
 epoch: 96, train_loss: 1.1887, test_loss: 1.1591, test_f1: 0.3726
 epoch: 97, train_loss: 1.1850, test_loss: 1.1576, test_f1: 0.3771
 epoch: 98, train_loss: 1.1855, test_loss: 1.1590, test_f1: 0.3726
 epoch: 99, train_loss: 1.1822, test_loss: 1.1591, test_f1: 0.3715
##################ITERATION #2 ****************************************
 epoch: 0, train_loss: 1.3256, test_loss: 1.3287, test_f1: 0.2274
 epoch: 1, train_loss: 1.3164, test_loss: 1.3238, test_f1: 0.2274
 epoch: 2, train_loss: 1.3101, test_loss: 1.3180, test_f1: 0.2274
 epoch: 3, train_loss: 1.3042, test_loss: 1.3120, test_f1: 0.2274
 epoch: 4, train_loss: 1.2995, test_loss: 1.3054, test_f1: 0.2274
 epoch: 5, train_loss: 1.2940, test_loss: 1.3023, test_f1: 0.2274
 epoch: 6, train_loss: 1.2890, test_loss: 1.2967, test_f1: 0.2274
 epoch: 7, train_loss: 1.2871, test_loss: 1.2921, test_f1: 0.2274
 epoch: 8, train_loss: 1.2815, test_loss: 1.2877, test_f1: 0.2274
 epoch: 9, train_loss: 1.2772, test_loss: 1.2804, test_f1: 0.2274
 epoch: 10, train_loss: 1.2726, test_loss: 1.2757, test_f1: 0.2274
 epoch: 11, train_loss: 1.2729, test_loss: 1.2710, test_f1: 0.2274
 epoch: 12, train_loss: 1.2647, test_loss: 1.2650, test_f1: 0.2274
 epoch: 13, train_loss: 1.2619, test_loss: 1.2597, test_f1: 0.2274
 epoch: 14, train_loss: 1.2554, test_loss: 1.2563, test_f1: 0.2274
 epoch: 15, train_loss: 1.2569, test_loss: 1.2501, test_f1: 0.2300
 epoch: 16, train_loss: 1.2513, test_loss: 1.2453, test_f1: 0.2325
 epoch: 17, train_loss: 1.2496, test_loss: 1.2415, test_f1: 0.2484
 epoch: 18, train_loss: 1.2456, test_loss: 1.2399, test_f1: 0.2721
 epoch: 19, train_loss: 1.2429, test_loss: 1.2343, test_f1: 0.2749
 epoch: 20, train_loss: 1.2436, test_loss: 1.2319, test_f1: 0.2889
 epoch: 21, train_loss: 1.2381, test_loss: 1.2276, test_f1: 0.2823
 epoch: 22, train_loss: 1.2382, test_loss: 1.2229, test_f1: 0.2957
 epoch: 23, train_loss: 1.2346, test_loss: 1.2203, test_f1: 0.2900
 epoch: 24, train_loss: 1.2283, test_loss: 1.2169, test_f1: 0.2898
 epoch: 25, train_loss: 1.2290, test_loss: 1.2156, test_f1: 0.2984
 epoch: 26, train_loss: 1.2289, test_loss: 1.2133, test_f1: 0.3016
 epoch: 27, train_loss: 1.2258, test_loss: 1.2114, test_f1: 0.3028
 epoch: 28, train_loss: 1.2225, test_loss: 1.2068, test_f1: 0.3016
 epoch: 29, train_loss: 1.2215, test_loss: 1.2051, test_f1: 0.3092
 epoch: 30, train_loss: 1.2222, test_loss: 1.2040, test_f1: 0.3052
 epoch: 31, train_loss: 1.2142, test_loss: 1.2012, test_f1: 0.3059
 epoch: 32, train_loss: 1.2120, test_loss: 1.1974, test_f1: 0.3137
 epoch: 33, train_loss: 1.2076, test_loss: 1.1929, test_f1: 0.3138
 epoch: 34, train_loss: 1.2069, test_loss: 1.1912, test_f1: 0.3274
 epoch: 35, train_loss: 1.2119, test_loss: 1.1904, test_f1: 0.3214
 epoch: 36, train_loss: 1.2092, test_loss: 1.1908, test_f1: 0.3266
 epoch: 37, train_loss: 1.2001, test_loss: 1.1874, test_f1: 0.3361
 epoch: 38, train_loss: 1.2004, test_loss: 1.1823, test_f1: 0.3448
 epoch: 39, train_loss: 1.2034, test_loss: 1.1812, test_f1: 0.3412
 epoch: 40, train_loss: 1.2025, test_loss: 1.1805, test_f1: 0.3496
 epoch: 41, train_loss: 1.1971, test_loss: 1.1777, test_f1: 0.3493
 epoch: 42, train_loss: 1.1981, test_loss: 1.1757, test_f1: 0.3474
 epoch: 43, train_loss: 1.1907, test_loss: 1.1748, test_f1: 0.3470
 epoch: 44, train_loss: 1.1903, test_loss: 1.1727, test_f1: 0.3444
 epoch: 45, train_loss: 1.1932, test_loss: 1.1705, test_f1: 0.3487
 epoch: 46, train_loss: 1.1877, test_loss: 1.1698, test_f1: 0.3387
 epoch: 47, train_loss: 1.1852, test_loss: 1.1649, test_f1: 0.3410
 epoch: 48, train_loss: 1.1770, test_loss: 1.1680, test_f1: 0.3401
 epoch: 49, train_loss: 1.1819, test_loss: 1.1629, test_f1: 0.3486
 epoch: 50, train_loss: 1.1747, test_loss: 1.1608, test_f1: 0.3417
 epoch: 51, train_loss: 1.1804, test_loss: 1.1601, test_f1: 0.3464
 epoch: 52, train_loss: 1.1771, test_loss: 1.1615, test_f1: 0.3470
 epoch: 53, train_loss: 1.1760, test_loss: 1.1623, test_f1: 0.3396
 epoch: 54, train_loss: 1.1738, test_loss: 1.1611, test_f1: 0.3485
 epoch: 55, train_loss: 1.1723, test_loss: 1.1620, test_f1: 0.3452
 epoch: 56, train_loss: 1.1737, test_loss: 1.1581, test_f1: 0.3517
 epoch: 57, train_loss: 1.1731, test_loss: 1.1569, test_f1: 0.3531
 epoch: 58, train_loss: 1.1683, test_loss: 1.1631, test_f1: 0.3475
 epoch: 59, train_loss: 1.1599, test_loss: 1.1561, test_f1: 0.3559
 epoch: 60, train_loss: 1.1754, test_loss: 1.1549, test_f1: 0.3576
 epoch: 61, train_loss: 1.1696, test_loss: 1.1540, test_f1: 0.3543
 epoch: 62, train_loss: 1.1715, test_loss: 1.1551, test_f1: 0.3557
 epoch: 63, train_loss: 1.1696, test_loss: 1.1524, test_f1: 0.3683
 epoch: 64, train_loss: 1.1608, test_loss: 1.1553, test_f1: 0.3564
 epoch: 65, train_loss: 1.1630, test_loss: 1.1559, test_f1: 0.3711
 epoch: 66, train_loss: 1.1667, test_loss: 1.1541, test_f1: 0.3681
 epoch: 67, train_loss: 1.1652, test_loss: 1.1550, test_f1: 0.3599
 epoch: 68, train_loss: 1.1659, test_loss: 1.1494, test_f1: 0.3644
 epoch: 69, train_loss: 1.1635, test_loss: 1.1505, test_f1: 0.3785
 epoch: 70, train_loss: 1.1578, test_loss: 1.1464, test_f1: 0.3865
 epoch: 71, train_loss: 1.1640, test_loss: 1.1480, test_f1: 0.3909
 epoch: 72, train_loss: 1.1688, test_loss: 1.1507, test_f1: 0.3790
 epoch: 73, train_loss: 1.1555, test_loss: 1.1471, test_f1: 0.3865
 epoch: 74, train_loss: 1.1578, test_loss: 1.1493, test_f1: 0.3878
 epoch: 75, train_loss: 1.1592, test_loss: 1.1470, test_f1: 0.3940
 epoch: 76, train_loss: 1.1521, test_loss: 1.1487, test_f1: 0.3855
 epoch: 77, train_loss: 1.1569, test_loss: 1.1461, test_f1: 0.3961
 epoch: 78, train_loss: 1.1576, test_loss: 1.1474, test_f1: 0.3953
 epoch: 79, train_loss: 1.1604, test_loss: 1.1446, test_f1: 0.3950
 epoch: 80, train_loss: 1.1562, test_loss: 1.1424, test_f1: 0.4105
 epoch: 81, train_loss: 1.1513, test_loss: 1.1432, test_f1: 0.4043
 epoch: 82, train_loss: 1.1577, test_loss: 1.1464, test_f1: 0.4077
 epoch: 83, train_loss: 1.1622, test_loss: 1.1430, test_f1: 0.4073
 epoch: 84, train_loss: 1.1536, test_loss: 1.1431, test_f1: 0.4066
 epoch: 85, train_loss: 1.1463, test_loss: 1.1456, test_f1: 0.4117
 epoch: 86, train_loss: 1.1509, test_loss: 1.1414, test_f1: 0.4170
 epoch: 87, train_loss: 1.1560, test_loss: 1.1396, test_f1: 0.4121
 epoch: 88, train_loss: 1.1557, test_loss: 1.1385, test_f1: 0.4173
 epoch: 89, train_loss: 1.1507, test_loss: 1.1388, test_f1: 0.4134
 epoch: 90, train_loss: 1.1501, test_loss: 1.1368, test_f1: 0.4179
 epoch: 91, train_loss: 1.1458, test_loss: 1.1389, test_f1: 0.4120
 epoch: 92, train_loss: 1.1455, test_loss: 1.1385, test_f1: 0.4147
 epoch: 93, train_loss: 1.1508, test_loss: 1.1417, test_f1: 0.4107
 epoch: 94, train_loss: 1.1466, test_loss: 1.1394, test_f1: 0.4084
 epoch: 95, train_loss: 1.1469, test_loss: 1.1387, test_f1: 0.4181
 epoch: 96, train_loss: 1.1426, test_loss: 1.1376, test_f1: 0.4214
 epoch: 97, train_loss: 1.1455, test_loss: 1.1408, test_f1: 0.4104
 epoch: 98, train_loss: 1.1433, test_loss: 1.1376, test_f1: 0.4156
 epoch: 99, train_loss: 1.1419, test_loss: 1.1404, test_f1: 0.4156
##################ITERATION #3 ****************************************
 epoch: 0, train_loss: 1.3195, test_loss: 1.3196, test_f1: 0.2274
 epoch: 1, train_loss: 1.3065, test_loss: 1.3160, test_f1: 0.2274
 epoch: 2, train_loss: 1.3001, test_loss: 1.3128, test_f1: 0.2274
 epoch: 3, train_loss: 1.2982, test_loss: 1.3099, test_f1: 0.2300
 epoch: 4, train_loss: 1.2901, test_loss: 1.2980, test_f1: 0.2274
 epoch: 5, train_loss: 1.2836, test_loss: 1.2931, test_f1: 0.2295
 epoch: 6, train_loss: 1.2836, test_loss: 1.2883, test_f1: 0.2462
 epoch: 7, train_loss: 1.2772, test_loss: 1.2835, test_f1: 0.2399
 epoch: 8, train_loss: 1.2778, test_loss: 1.2793, test_f1: 0.2381
 epoch: 9, train_loss: 1.2708, test_loss: 1.2790, test_f1: 0.2404
 epoch: 10, train_loss: 1.2685, test_loss: 1.2728, test_f1: 0.2579
 epoch: 11, train_loss: 1.2663, test_loss: 1.2670, test_f1: 0.2690
 epoch: 12, train_loss: 1.2619, test_loss: 1.2637, test_f1: 0.2788
 epoch: 13, train_loss: 1.2627, test_loss: 1.2598, test_f1: 0.2756
 epoch: 14, train_loss: 1.2642, test_loss: 1.2597, test_f1: 0.2734
 epoch: 15, train_loss: 1.2581, test_loss: 1.2525, test_f1: 0.2701
 epoch: 16, train_loss: 1.2550, test_loss: 1.2502, test_f1: 0.2776
 epoch: 17, train_loss: 1.2492, test_loss: 1.2473, test_f1: 0.2882
 epoch: 18, train_loss: 1.2463, test_loss: 1.2450, test_f1: 0.2948
 epoch: 19, train_loss: 1.2414, test_loss: 1.2402, test_f1: 0.3118
 epoch: 20, train_loss: 1.2407, test_loss: 1.2408, test_f1: 0.3233
 epoch: 21, train_loss: 1.2369, test_loss: 1.2382, test_f1: 0.3285
 epoch: 22, train_loss: 1.2401, test_loss: 1.2324, test_f1: 0.3418
 epoch: 23, train_loss: 1.2314, test_loss: 1.2256, test_f1: 0.3410
 epoch: 24, train_loss: 1.2362, test_loss: 1.2308, test_f1: 0.3425
 epoch: 25, train_loss: 1.2315, test_loss: 1.2253, test_f1: 0.3580
 epoch: 26, train_loss: 1.2300, test_loss: 1.2187, test_f1: 0.3527
 epoch: 27, train_loss: 1.2304, test_loss: 1.2173, test_f1: 0.3540
 epoch: 28, train_loss: 1.2255, test_loss: 1.2171, test_f1: 0.3612
 epoch: 29, train_loss: 1.2175, test_loss: 1.2136, test_f1: 0.3595
 epoch: 30, train_loss: 1.2187, test_loss: 1.2112, test_f1: 0.3636
 epoch: 31, train_loss: 1.2116, test_loss: 1.2068, test_f1: 0.3750
 epoch: 32, train_loss: 1.2179, test_loss: 1.2083, test_f1: 0.3649
 epoch: 33, train_loss: 1.2086, test_loss: 1.2035, test_f1: 0.3679
 epoch: 34, train_loss: 1.2145, test_loss: 1.2012, test_f1: 0.3704
 epoch: 35, train_loss: 1.2057, test_loss: 1.2035, test_f1: 0.3689
 epoch: 36, train_loss: 1.2049, test_loss: 1.1965, test_f1: 0.3740
 epoch: 37, train_loss: 1.2067, test_loss: 1.1923, test_f1: 0.3709
 epoch: 38, train_loss: 1.2016, test_loss: 1.1936, test_f1: 0.3701
 epoch: 39, train_loss: 1.1987, test_loss: 1.1879, test_f1: 0.3708
 epoch: 40, train_loss: 1.2008, test_loss: 1.1854, test_f1: 0.3708
 epoch: 41, train_loss: 1.1916, test_loss: 1.1842, test_f1: 0.3700
 epoch: 42, train_loss: 1.2041, test_loss: 1.1816, test_f1: 0.3765
 epoch: 43, train_loss: 1.1953, test_loss: 1.1800, test_f1: 0.3714
 epoch: 44, train_loss: 1.1964, test_loss: 1.1813, test_f1: 0.3656
 epoch: 45, train_loss: 1.1879, test_loss: 1.1762, test_f1: 0.3718
 epoch: 46, train_loss: 1.1827, test_loss: 1.1743, test_f1: 0.3776
 epoch: 47, train_loss: 1.1862, test_loss: 1.1709, test_f1: 0.3825
 epoch: 48, train_loss: 1.1803, test_loss: 1.1700, test_f1: 0.3772
 epoch: 49, train_loss: 1.1856, test_loss: 1.1685, test_f1: 0.3746
 epoch: 50, train_loss: 1.1828, test_loss: 1.1603, test_f1: 0.3820
 epoch: 51, train_loss: 1.1751, test_loss: 1.1610, test_f1: 0.3860
 epoch: 52, train_loss: 1.1780, test_loss: 1.1643, test_f1: 0.3788
 epoch: 53, train_loss: 1.1741, test_loss: 1.1576, test_f1: 0.3909
 epoch: 54, train_loss: 1.1816, test_loss: 1.1629, test_f1: 0.3857
 epoch: 55, train_loss: 1.1787, test_loss: 1.1600, test_f1: 0.3906
 epoch: 56, train_loss: 1.1711, test_loss: 1.1547, test_f1: 0.3898
 epoch: 57, train_loss: 1.1742, test_loss: 1.1553, test_f1: 0.3874
 epoch: 58, train_loss: 1.1699, test_loss: 1.1540, test_f1: 0.3914
 epoch: 59, train_loss: 1.1669, test_loss: 1.1551, test_f1: 0.3960
 epoch: 60, train_loss: 1.1714, test_loss: 1.1542, test_f1: 0.3774
 epoch: 61, train_loss: 1.1668, test_loss: 1.1549, test_f1: 0.3891
 epoch: 62, train_loss: 1.1730, test_loss: 1.1521, test_f1: 0.3943
 epoch: 63, train_loss: 1.1599, test_loss: 1.1476, test_f1: 0.3948
 epoch: 64, train_loss: 1.1742, test_loss: 1.1576, test_f1: 0.3832
 epoch: 65, train_loss: 1.1676, test_loss: 1.1511, test_f1: 0.3935
 epoch: 66, train_loss: 1.1659, test_loss: 1.1449, test_f1: 0.3965
 epoch: 67, train_loss: 1.1664, test_loss: 1.1478, test_f1: 0.3975
 epoch: 68, train_loss: 1.1621, test_loss: 1.1385, test_f1: 0.3984
 epoch: 69, train_loss: 1.1659, test_loss: 1.1439, test_f1: 0.3989
 epoch: 70, train_loss: 1.1626, test_loss: 1.1440, test_f1: 0.3948
 epoch: 71, train_loss: 1.1608, test_loss: 1.1413, test_f1: 0.3931
 epoch: 72, train_loss: 1.1497, test_loss: 1.1315, test_f1: 0.4016
 epoch: 73, train_loss: 1.1586, test_loss: 1.1335, test_f1: 0.3990
 epoch: 74, train_loss: 1.1556, test_loss: 1.1348, test_f1: 0.3992
 epoch: 75, train_loss: 1.1605, test_loss: 1.1338, test_f1: 0.4008
 epoch: 76, train_loss: 1.1537, test_loss: 1.1312, test_f1: 0.4069
 epoch: 77, train_loss: 1.1486, test_loss: 1.1326, test_f1: 0.3951
 epoch: 78, train_loss: 1.1577, test_loss: 1.1331, test_f1: 0.4017
 epoch: 79, train_loss: 1.1522, test_loss: 1.1295, test_f1: 0.4049
 epoch: 80, train_loss: 1.1560, test_loss: 1.1314, test_f1: 0.4004
 epoch: 81, train_loss: 1.1483, test_loss: 1.1280, test_f1: 0.4045
 epoch: 82, train_loss: 1.1548, test_loss: 1.1275, test_f1: 0.4086
 epoch: 83, train_loss: 1.1517, test_loss: 1.1303, test_f1: 0.4036
 epoch: 84, train_loss: 1.1499, test_loss: 1.1276, test_f1: 0.4061
 epoch: 85, train_loss: 1.1545, test_loss: 1.1333, test_f1: 0.3949
 epoch: 86, train_loss: 1.1526, test_loss: 1.1266, test_f1: 0.4042
 epoch: 87, train_loss: 1.1538, test_loss: 1.1287, test_f1: 0.4043
 epoch: 88, train_loss: 1.1461, test_loss: 1.1267, test_f1: 0.4053
 epoch: 89, train_loss: 1.1457, test_loss: 1.1295, test_f1: 0.3976
 epoch: 90, train_loss: 1.1515, test_loss: 1.1261, test_f1: 0.4058
 epoch: 91, train_loss: 1.1445, test_loss: 1.1227, test_f1: 0.4052
 epoch: 92, train_loss: 1.1480, test_loss: 1.1219, test_f1: 0.4036
 epoch: 93, train_loss: 1.1427, test_loss: 1.1216, test_f1: 0.4091
 epoch: 94, train_loss: 1.1440, test_loss: 1.1209, test_f1: 0.4069
 epoch: 95, train_loss: 1.1442, test_loss: 1.1206, test_f1: 0.4062
 epoch: 96, train_loss: 1.1447, test_loss: 1.1182, test_f1: 0.4072
 epoch: 97, train_loss: 1.1511, test_loss: 1.1186, test_f1: 0.4073
 epoch: 98, train_loss: 1.1392, test_loss: 1.1212, test_f1: 0.3936
 epoch: 99, train_loss: 1.1473, test_loss: 1.1192, test_f1: 0.4017
##################ITERATION #4 ****************************************
 epoch: 0, train_loss: 1.3089, test_loss: 1.3051, test_f1: 0.2274
 epoch: 1, train_loss: 1.2992, test_loss: 1.2941, test_f1: 0.2274
 epoch: 2, train_loss: 1.2942, test_loss: 1.2885, test_f1: 0.2274
 epoch: 3, train_loss: 1.2916, test_loss: 1.2830, test_f1: 0.2274
 epoch: 4, train_loss: 1.2857, test_loss: 1.2793, test_f1: 0.2274
 epoch: 5, train_loss: 1.2832, test_loss: 1.2764, test_f1: 0.2274
 epoch: 6, train_loss: 1.2831, test_loss: 1.2715, test_f1: 0.2274
 epoch: 7, train_loss: 1.2785, test_loss: 1.2682, test_f1: 0.2274
 epoch: 8, train_loss: 1.2766, test_loss: 1.2652, test_f1: 0.2274
 epoch: 9, train_loss: 1.2722, test_loss: 1.2625, test_f1: 0.2274
 epoch: 10, train_loss: 1.2706, test_loss: 1.2575, test_f1: 0.2274
 epoch: 11, train_loss: 1.2695, test_loss: 1.2552, test_f1: 0.2274
 epoch: 12, train_loss: 1.2688, test_loss: 1.2557, test_f1: 0.2274
 epoch: 13, train_loss: 1.2640, test_loss: 1.2510, test_f1: 0.2274
 epoch: 14, train_loss: 1.2615, test_loss: 1.2476, test_f1: 0.2274
 epoch: 15, train_loss: 1.2603, test_loss: 1.2466, test_f1: 0.2274
 epoch: 16, train_loss: 1.2576, test_loss: 1.2440, test_f1: 0.2274
 epoch: 17, train_loss: 1.2559, test_loss: 1.2417, test_f1: 0.2300
 epoch: 18, train_loss: 1.2568, test_loss: 1.2404, test_f1: 0.2327
 epoch: 19, train_loss: 1.2558, test_loss: 1.2383, test_f1: 0.2300
 epoch: 20, train_loss: 1.2499, test_loss: 1.2373, test_f1: 0.2371
 epoch: 21, train_loss: 1.2515, test_loss: 1.2345, test_f1: 0.2382
 epoch: 22, train_loss: 1.2487, test_loss: 1.2313, test_f1: 0.2382
 epoch: 23, train_loss: 1.2484, test_loss: 1.2313, test_f1: 0.2380
 epoch: 24, train_loss: 1.2495, test_loss: 1.2292, test_f1: 0.2367
 epoch: 25, train_loss: 1.2423, test_loss: 1.2254, test_f1: 0.2390
 epoch: 26, train_loss: 1.2431, test_loss: 1.2252, test_f1: 0.2414
 epoch: 27, train_loss: 1.2442, test_loss: 1.2222, test_f1: 0.2468
 epoch: 28, train_loss: 1.2365, test_loss: 1.2207, test_f1: 0.2514
 epoch: 29, train_loss: 1.2375, test_loss: 1.2198, test_f1: 0.2508
 epoch: 30, train_loss: 1.2353, test_loss: 1.2156, test_f1: 0.2703
 epoch: 31, train_loss: 1.2349, test_loss: 1.2160, test_f1: 0.2594
 epoch: 32, train_loss: 1.2312, test_loss: 1.2140, test_f1: 0.2770
 epoch: 33, train_loss: 1.2287, test_loss: 1.2113, test_f1: 0.2997
 epoch: 34, train_loss: 1.2235, test_loss: 1.2106, test_f1: 0.2898
 epoch: 35, train_loss: 1.2246, test_loss: 1.2069, test_f1: 0.3035
 epoch: 36, train_loss: 1.2249, test_loss: 1.2063, test_f1: 0.3058
 epoch: 37, train_loss: 1.2218, test_loss: 1.2044, test_f1: 0.3106
 epoch: 38, train_loss: 1.2214, test_loss: 1.2017, test_f1: 0.3285
 epoch: 39, train_loss: 1.2196, test_loss: 1.2019, test_f1: 0.3351
 epoch: 40, train_loss: 1.2146, test_loss: 1.1975, test_f1: 0.3354
 epoch: 41, train_loss: 1.2173, test_loss: 1.1983, test_f1: 0.3473
 epoch: 42, train_loss: 1.2209, test_loss: 1.1955, test_f1: 0.3459
 epoch: 43, train_loss: 1.2114, test_loss: 1.1916, test_f1: 0.3573
 epoch: 44, train_loss: 1.2114, test_loss: 1.1922, test_f1: 0.3637
 epoch: 45, train_loss: 1.2088, test_loss: 1.1880, test_f1: 0.3770
 epoch: 46, train_loss: 1.2061, test_loss: 1.1879, test_f1: 0.3582
 epoch: 47, train_loss: 1.2104, test_loss: 1.1803, test_f1: 0.3763
 epoch: 48, train_loss: 1.2113, test_loss: 1.1802, test_f1: 0.3704
 epoch: 49, train_loss: 1.2038, test_loss: 1.1767, test_f1: 0.3786
 epoch: 50, train_loss: 1.2026, test_loss: 1.1813, test_f1: 0.3770
 epoch: 51, train_loss: 1.2070, test_loss: 1.1766, test_f1: 0.3754
 epoch: 52, train_loss: 1.2024, test_loss: 1.1797, test_f1: 0.3764
 epoch: 53, train_loss: 1.1953, test_loss: 1.1786, test_f1: 0.3704
 epoch: 54, train_loss: 1.1992, test_loss: 1.1764, test_f1: 0.3811
 epoch: 55, train_loss: 1.1916, test_loss: 1.1765, test_f1: 0.3743
 epoch: 56, train_loss: 1.1901, test_loss: 1.1764, test_f1: 0.3678
 epoch: 57, train_loss: 1.1916, test_loss: 1.1762, test_f1: 0.3681
 epoch: 58, train_loss: 1.1917, test_loss: 1.1745, test_f1: 0.3791
 epoch: 59, train_loss: 1.1913, test_loss: 1.1718, test_f1: 0.3780
 epoch: 60, train_loss: 1.1888, test_loss: 1.1732, test_f1: 0.3745
 epoch: 61, train_loss: 1.1921, test_loss: 1.1714, test_f1: 0.3772
 epoch: 62, train_loss: 1.1833, test_loss: 1.1710, test_f1: 0.3821
 epoch: 63, train_loss: 1.2011, test_loss: 1.1751, test_f1: 0.3739
 epoch: 64, train_loss: 1.1888, test_loss: 1.1722, test_f1: 0.3721
 epoch: 65, train_loss: 1.1904, test_loss: 1.1671, test_f1: 0.3789
 epoch: 66, train_loss: 1.1810, test_loss: 1.1670, test_f1: 0.3783
 epoch: 67, train_loss: 1.1858, test_loss: 1.1649, test_f1: 0.3907
 epoch: 68, train_loss: 1.1822, test_loss: 1.1677, test_f1: 0.3727
 epoch: 69, train_loss: 1.1872, test_loss: 1.1657, test_f1: 0.3889
 epoch: 70, train_loss: 1.1876, test_loss: 1.1678, test_f1: 0.3747
 epoch: 71, train_loss: 1.1816, test_loss: 1.1619, test_f1: 0.3750
 epoch: 72, train_loss: 1.1874, test_loss: 1.1682, test_f1: 0.3863
 epoch: 73, train_loss: 1.1860, test_loss: 1.1572, test_f1: 0.3966
 epoch: 74, train_loss: 1.1757, test_loss: 1.1634, test_f1: 0.3874
 epoch: 75, train_loss: 1.1838, test_loss: 1.1614, test_f1: 0.3846
 epoch: 76, train_loss: 1.1803, test_loss: 1.1565, test_f1: 0.3864
 epoch: 77, train_loss: 1.1754, test_loss: 1.1594, test_f1: 0.3878
 epoch: 78, train_loss: 1.1743, test_loss: 1.1592, test_f1: 0.3907
 epoch: 79, train_loss: 1.1833, test_loss: 1.1546, test_f1: 0.3987
 epoch: 80, train_loss: 1.1771, test_loss: 1.1561, test_f1: 0.3908
 epoch: 81, train_loss: 1.1790, test_loss: 1.1564, test_f1: 0.3927
 epoch: 82, train_loss: 1.1791, test_loss: 1.1547, test_f1: 0.3910
 epoch: 83, train_loss: 1.1741, test_loss: 1.1592, test_f1: 0.3801
 epoch: 84, train_loss: 1.1831, test_loss: 1.1593, test_f1: 0.3895
 epoch: 85, train_loss: 1.1755, test_loss: 1.1648, test_f1: 0.3845
 epoch: 86, train_loss: 1.1749, test_loss: 1.1558, test_f1: 0.3910
 epoch: 87, train_loss: 1.1784, test_loss: 1.1541, test_f1: 0.3965
 epoch: 88, train_loss: 1.1684, test_loss: 1.1558, test_f1: 0.3888
 epoch: 89, train_loss: 1.1728, test_loss: 1.1538, test_f1: 0.3779
 epoch: 90, train_loss: 1.1768, test_loss: 1.1625, test_f1: 0.3786
 epoch: 91, train_loss: 1.1735, test_loss: 1.1526, test_f1: 0.3913
 epoch: 92, train_loss: 1.1730, test_loss: 1.1506, test_f1: 0.3976
 epoch: 93, train_loss: 1.1776, test_loss: 1.1518, test_f1: 0.3853
 epoch: 94, train_loss: 1.1703, test_loss: 1.1473, test_f1: 0.3858
 epoch: 95, train_loss: 1.1716, test_loss: 1.1474, test_f1: 0.3963
 epoch: 96, train_loss: 1.1637, test_loss: 1.1449, test_f1: 0.3956
 epoch: 97, train_loss: 1.1649, test_loss: 1.1513, test_f1: 0.3923
 epoch: 98, train_loss: 1.1680, test_loss: 1.1504, test_f1: 0.4007
 epoch: 99, train_loss: 1.1603, test_loss: 1.1446, test_f1: 0.3889
##################ITERATION #5 ****************************************
 epoch: 0, train_loss: 1.2939, test_loss: 1.2850, test_f1: 0.2350
 epoch: 1, train_loss: 1.2843, test_loss: 1.2734, test_f1: 0.2709
 epoch: 2, train_loss: 1.2769, test_loss: 1.2680, test_f1: 0.2782
 epoch: 3, train_loss: 1.2736, test_loss: 1.2638, test_f1: 0.2855
 epoch: 4, train_loss: 1.2689, test_loss: 1.2594, test_f1: 0.2879
 epoch: 5, train_loss: 1.2667, test_loss: 1.2533, test_f1: 0.2899
 epoch: 6, train_loss: 1.2626, test_loss: 1.2459, test_f1: 0.2998
 epoch: 7, train_loss: 1.2577, test_loss: 1.2419, test_f1: 0.3109
 epoch: 8, train_loss: 1.2542, test_loss: 1.2390, test_f1: 0.3212
 epoch: 9, train_loss: 1.2558, test_loss: 1.2373, test_f1: 0.3414
 epoch: 10, train_loss: 1.2521, test_loss: 1.2294, test_f1: 0.3343
 epoch: 11, train_loss: 1.2487, test_loss: 1.2322, test_f1: 0.3256
 epoch: 12, train_loss: 1.2434, test_loss: 1.2279, test_f1: 0.3297
 epoch: 13, train_loss: 1.2432, test_loss: 1.2250, test_f1: 0.3435
 epoch: 14, train_loss: 1.2415, test_loss: 1.2238, test_f1: 0.3458
 epoch: 15, train_loss: 1.2433, test_loss: 1.2190, test_f1: 0.3450
 epoch: 16, train_loss: 1.2414, test_loss: 1.2160, test_f1: 0.3402
 epoch: 17, train_loss: 1.2381, test_loss: 1.2121, test_f1: 0.3488
 epoch: 18, train_loss: 1.2317, test_loss: 1.2129, test_f1: 0.3506
 epoch: 19, train_loss: 1.2307, test_loss: 1.2092, test_f1: 0.3508
 epoch: 20, train_loss: 1.2327, test_loss: 1.2055, test_f1: 0.3436
 epoch: 21, train_loss: 1.2276, test_loss: 1.2028, test_f1: 0.3473
 epoch: 22, train_loss: 1.2290, test_loss: 1.2014, test_f1: 0.3500
 epoch: 23, train_loss: 1.2309, test_loss: 1.1989, test_f1: 0.3493
 epoch: 24, train_loss: 1.2193, test_loss: 1.1974, test_f1: 0.3437
 epoch: 25, train_loss: 1.2245, test_loss: 1.1951, test_f1: 0.3424
 epoch: 26, train_loss: 1.2221, test_loss: 1.1945, test_f1: 0.3420
 epoch: 27, train_loss: 1.2224, test_loss: 1.1907, test_f1: 0.3404
 epoch: 28, train_loss: 1.2196, test_loss: 1.1896, test_f1: 0.3508
 epoch: 29, train_loss: 1.2170, test_loss: 1.1884, test_f1: 0.3485
 epoch: 30, train_loss: 1.2197, test_loss: 1.1856, test_f1: 0.3412
 epoch: 31, train_loss: 1.2068, test_loss: 1.1832, test_f1: 0.3421
 epoch: 32, train_loss: 1.2120, test_loss: 1.1846, test_f1: 0.3415
 epoch: 33, train_loss: 1.2143, test_loss: 1.1813, test_f1: 0.3400
 epoch: 34, train_loss: 1.2110, test_loss: 1.1807, test_f1: 0.3448
 epoch: 35, train_loss: 1.2067, test_loss: 1.1784, test_f1: 0.3493
 epoch: 36, train_loss: 1.2072, test_loss: 1.1745, test_f1: 0.3468
 epoch: 37, train_loss: 1.2036, test_loss: 1.1729, test_f1: 0.3449
 epoch: 38, train_loss: 1.2078, test_loss: 1.1694, test_f1: 0.3480
 epoch: 39, train_loss: 1.2014, test_loss: 1.1667, test_f1: 0.3554
 epoch: 40, train_loss: 1.2051, test_loss: 1.1689, test_f1: 0.3586
 epoch: 41, train_loss: 1.1988, test_loss: 1.1632, test_f1: 0.3556
 epoch: 42, train_loss: 1.1909, test_loss: 1.1662, test_f1: 0.3524
 epoch: 43, train_loss: 1.1990, test_loss: 1.1596, test_f1: 0.3554
 epoch: 44, train_loss: 1.1923, test_loss: 1.1590, test_f1: 0.3671
 epoch: 45, train_loss: 1.1973, test_loss: 1.1546, test_f1: 0.3704
 epoch: 46, train_loss: 1.1922, test_loss: 1.1553, test_f1: 0.3741
 epoch: 47, train_loss: 1.1902, test_loss: 1.1538, test_f1: 0.3747
 epoch: 48, train_loss: 1.1972, test_loss: 1.1519, test_f1: 0.3551
 epoch: 49, train_loss: 1.1910, test_loss: 1.1541, test_f1: 0.3771
 epoch: 50, train_loss: 1.1850, test_loss: 1.1479, test_f1: 0.3706
 epoch: 51, train_loss: 1.1866, test_loss: 1.1474, test_f1: 0.3839
 epoch: 52, train_loss: 1.1830, test_loss: 1.1504, test_f1: 0.3884
 epoch: 53, train_loss: 1.1901, test_loss: 1.1459, test_f1: 0.3822
 epoch: 54, train_loss: 1.1882, test_loss: 1.1463, test_f1: 0.3894
 epoch: 55, train_loss: 1.1833, test_loss: 1.1425, test_f1: 0.3801
 epoch: 56, train_loss: 1.1893, test_loss: 1.1454, test_f1: 0.3889
 epoch: 57, train_loss: 1.1839, test_loss: 1.1428, test_f1: 0.3839
 epoch: 58, train_loss: 1.1770, test_loss: 1.1476, test_f1: 0.3859
 epoch: 59, train_loss: 1.1792, test_loss: 1.1409, test_f1: 0.3924
 epoch: 60, train_loss: 1.1842, test_loss: 1.1467, test_f1: 0.3894
 epoch: 61, train_loss: 1.1768, test_loss: 1.1455, test_f1: 0.3751
 epoch: 62, train_loss: 1.1767, test_loss: 1.1407, test_f1: 0.3940
 epoch: 63, train_loss: 1.1760, test_loss: 1.1390, test_f1: 0.3962
 epoch: 64, train_loss: 1.1749, test_loss: 1.1408, test_f1: 0.3969
 epoch: 65, train_loss: 1.1759, test_loss: 1.1348, test_f1: 0.3930
 epoch: 66, train_loss: 1.1783, test_loss: 1.1360, test_f1: 0.3972
 epoch: 67, train_loss: 1.1789, test_loss: 1.1314, test_f1: 0.3927
 epoch: 68, train_loss: 1.1745, test_loss: 1.1347, test_f1: 0.3990
 epoch: 69, train_loss: 1.1734, test_loss: 1.1361, test_f1: 0.4012
 epoch: 70, train_loss: 1.1736, test_loss: 1.1359, test_f1: 0.4038
 epoch: 71, train_loss: 1.1729, test_loss: 1.1371, test_f1: 0.3999
 epoch: 72, train_loss: 1.1697, test_loss: 1.1302, test_f1: 0.4035
 epoch: 73, train_loss: 1.1752, test_loss: 1.1337, test_f1: 0.3957
 epoch: 74, train_loss: 1.1697, test_loss: 1.1307, test_f1: 0.3998
 epoch: 75, train_loss: 1.1699, test_loss: 1.1293, test_f1: 0.4038
 epoch: 76, train_loss: 1.1648, test_loss: 1.1350, test_f1: 0.4026
 epoch: 77, train_loss: 1.1670, test_loss: 1.1300, test_f1: 0.3928
 epoch: 78, train_loss: 1.1680, test_loss: 1.1339, test_f1: 0.4000
 epoch: 79, train_loss: 1.1647, test_loss: 1.1287, test_f1: 0.4032
 epoch: 80, train_loss: 1.1672, test_loss: 1.1278, test_f1: 0.4072
 epoch: 81, train_loss: 1.1667, test_loss: 1.1311, test_f1: 0.4004
 epoch: 82, train_loss: 1.1653, test_loss: 1.1313, test_f1: 0.4023
 epoch: 83, train_loss: 1.1621, test_loss: 1.1328, test_f1: 0.4016
 epoch: 84, train_loss: 1.1668, test_loss: 1.1268, test_f1: 0.3949
 epoch: 85, train_loss: 1.1598, test_loss: 1.1246, test_f1: 0.4007
 epoch: 86, train_loss: 1.1687, test_loss: 1.1241, test_f1: 0.3935
 epoch: 87, train_loss: 1.1650, test_loss: 1.1294, test_f1: 0.3916
 epoch: 88, train_loss: 1.1621, test_loss: 1.1281, test_f1: 0.4073
 epoch: 89, train_loss: 1.1601, test_loss: 1.1193, test_f1: 0.4072
 epoch: 90, train_loss: 1.1647, test_loss: 1.1250, test_f1: 0.4065
 epoch: 91, train_loss: 1.1662, test_loss: 1.1255, test_f1: 0.4088
 epoch: 92, train_loss: 1.1603, test_loss: 1.1231, test_f1: 0.3970
 epoch: 93, train_loss: 1.1589, test_loss: 1.1260, test_f1: 0.3994
 epoch: 94, train_loss: 1.1619, test_loss: 1.1228, test_f1: 0.4048
 epoch: 95, train_loss: 1.1583, test_loss: 1.1219, test_f1: 0.4089
 epoch: 96, train_loss: 1.1487, test_loss: 1.1243, test_f1: 0.4074
 epoch: 97, train_loss: 1.1598, test_loss: 1.1250, test_f1: 0.3973
 epoch: 98, train_loss: 1.1591, test_loss: 1.1173, test_f1: 0.4008
 epoch: 99, train_loss: 1.1572, test_loss: 1.1231, test_f1: 0.4089
##################ITERATION #6 ****************************************
 epoch: 0, train_loss: 1.3111, test_loss: 1.3018, test_f1: 0.2274
 epoch: 1, train_loss: 1.2954, test_loss: 1.2895, test_f1: 0.2780
 epoch: 2, train_loss: 1.2855, test_loss: 1.2776, test_f1: 0.2869
 epoch: 3, train_loss: 1.2816, test_loss: 1.2766, test_f1: 0.2898
 epoch: 4, train_loss: 1.2772, test_loss: 1.2687, test_f1: 0.2960
 epoch: 5, train_loss: 1.2703, test_loss: 1.2684, test_f1: 0.2951
 epoch: 6, train_loss: 1.2704, test_loss: 1.2648, test_f1: 0.3021
 epoch: 7, train_loss: 1.2629, test_loss: 1.2592, test_f1: 0.3125
 epoch: 8, train_loss: 1.2645, test_loss: 1.2464, test_f1: 0.3145
 epoch: 9, train_loss: 1.2588, test_loss: 1.2500, test_f1: 0.3197
 epoch: 10, train_loss: 1.2526, test_loss: 1.2370, test_f1: 0.3356
 epoch: 11, train_loss: 1.2554, test_loss: 1.2419, test_f1: 0.3249
 epoch: 12, train_loss: 1.2487, test_loss: 1.2431, test_f1: 0.3487
 epoch: 13, train_loss: 1.2477, test_loss: 1.2529, test_f1: 0.3391
 epoch: 14, train_loss: 1.2423, test_loss: 1.2193, test_f1: 0.3239
 epoch: 15, train_loss: 1.2374, test_loss: 1.2197, test_f1: 0.3361
 epoch: 16, train_loss: 1.2378, test_loss: 1.2120, test_f1: 0.3413
 epoch: 17, train_loss: 1.2355, test_loss: 1.2087, test_f1: 0.3458
 epoch: 18, train_loss: 1.2294, test_loss: 1.2075, test_f1: 0.3432
 epoch: 19, train_loss: 1.2305, test_loss: 1.2066, test_f1: 0.3431
 epoch: 20, train_loss: 1.2298, test_loss: 1.2052, test_f1: 0.3330
 epoch: 21, train_loss: 1.2190, test_loss: 1.1991, test_f1: 0.3427
 epoch: 22, train_loss: 1.2211, test_loss: 1.1936, test_f1: 0.3530
 epoch: 23, train_loss: 1.2183, test_loss: 1.1963, test_f1: 0.3460
 epoch: 24, train_loss: 1.2181, test_loss: 1.1945, test_f1: 0.3473
 epoch: 25, train_loss: 1.2132, test_loss: 1.1892, test_f1: 0.3672
 epoch: 26, train_loss: 1.2153, test_loss: 1.1861, test_f1: 0.3571
 epoch: 27, train_loss: 1.2142, test_loss: 1.1798, test_f1: 0.3809
 epoch: 28, train_loss: 1.2130, test_loss: 1.1840, test_f1: 0.3953
 epoch: 29, train_loss: 1.2118, test_loss: 1.1793, test_f1: 0.3652
 epoch: 30, train_loss: 1.2111, test_loss: 1.1721, test_f1: 0.4043
 epoch: 31, train_loss: 1.2048, test_loss: 1.2592, test_f1: 0.4086
 epoch: 32, train_loss: 1.2026, test_loss: 1.2304, test_f1: 0.4128
 epoch: 33, train_loss: 1.2017, test_loss: 1.3193, test_f1: 0.4245
 epoch: 34, train_loss: 1.1962, test_loss: 1.2212, test_f1: 0.4197
 epoch: 35, train_loss: 1.1991, test_loss: 1.1632, test_f1: 0.3997
 epoch: 36, train_loss: 1.1941, test_loss: 1.2349, test_f1: 0.4164
 epoch: 37, train_loss: 1.1962, test_loss: 1.1580, test_f1: 0.4033
 epoch: 38, train_loss: 1.1899, test_loss: 1.1594, test_f1: 0.3948
 epoch: 39, train_loss: 1.1908, test_loss: 1.1581, test_f1: 0.3991
 epoch: 40, train_loss: 1.1908, test_loss: 1.1551, test_f1: 0.4146
 epoch: 41, train_loss: 1.1862, test_loss: 1.1476, test_f1: 0.4088
 epoch: 42, train_loss: 1.1839, test_loss: 1.1465, test_f1: 0.4136
 epoch: 43, train_loss: 1.1871, test_loss: 1.1508, test_f1: 0.4283
 epoch: 44, train_loss: 1.1859, test_loss: 1.1456, test_f1: 0.4060
 epoch: 45, train_loss: 1.1749, test_loss: 1.1427, test_f1: 0.4133
 epoch: 46, train_loss: 1.1790, test_loss: 1.1428, test_f1: 0.4170
 epoch: 47, train_loss: 1.1761, test_loss: 1.1409, test_f1: 0.4128
 epoch: 48, train_loss: 1.1691, test_loss: 1.1395, test_f1: 0.4100
 epoch: 49, train_loss: 1.1713, test_loss: 1.1366, test_f1: 0.4186
 epoch: 50, train_loss: 1.1691, test_loss: 1.1344, test_f1: 0.4119
 epoch: 51, train_loss: 1.1666, test_loss: 1.1351, test_f1: 0.4312
 epoch: 52, train_loss: 1.1640, test_loss: 1.1369, test_f1: 0.4291
 epoch: 53, train_loss: 1.1652, test_loss: 1.1301, test_f1: 0.4366
 epoch: 54, train_loss: 1.1646, test_loss: 1.1256, test_f1: 0.4306
 epoch: 55, train_loss: 1.1712, test_loss: 1.1260, test_f1: 0.4298
 epoch: 56, train_loss: 1.1590, test_loss: 1.1264, test_f1: 0.4162
 epoch: 57, train_loss: 1.1729, test_loss: 1.1257, test_f1: 0.4194
 epoch: 58, train_loss: 1.1600, test_loss: 1.1279, test_f1: 0.4254
 epoch: 59, train_loss: 1.1639, test_loss: 1.1256, test_f1: 0.4283
 epoch: 60, train_loss: 1.1589, test_loss: 1.1255, test_f1: 0.4255
 epoch: 61, train_loss: 1.1602, test_loss: 1.1284, test_f1: 0.4199
 epoch: 62, train_loss: 1.1604, test_loss: 1.1287, test_f1: 0.4286
 epoch: 63, train_loss: 1.1622, test_loss: 1.1276, test_f1: 0.4283
 epoch: 64, train_loss: 1.1597, test_loss: 1.1213, test_f1: 0.4269
 epoch: 65, train_loss: 1.1647, test_loss: 1.1266, test_f1: 0.4255
 epoch: 66, train_loss: 1.1579, test_loss: 1.1253, test_f1: 0.4458
 epoch: 67, train_loss: 1.1585, test_loss: 1.1242, test_f1: 0.4333
 epoch: 68, train_loss: 1.1556, test_loss: 1.1226, test_f1: 0.4240
 epoch: 69, train_loss: 1.1479, test_loss: 1.1233, test_f1: 0.4300
 epoch: 70, train_loss: 1.1614, test_loss: 1.1229, test_f1: 0.4431
 epoch: 71, train_loss: 1.1553, test_loss: 1.1293, test_f1: 0.4307
 epoch: 72, train_loss: 1.1583, test_loss: 1.1179, test_f1: 0.4211
 epoch: 73, train_loss: 1.1507, test_loss: 1.1236, test_f1: 0.4239
 epoch: 74, train_loss: 1.1588, test_loss: 1.1234, test_f1: 0.4224
 epoch: 75, train_loss: 1.1474, test_loss: 1.1205, test_f1: 0.4213
 epoch: 76, train_loss: 1.1478, test_loss: 1.1219, test_f1: 0.4281
 epoch: 77, train_loss: 1.1437, test_loss: 1.1156, test_f1: 0.4304
 epoch: 78, train_loss: 1.1468, test_loss: 1.1160, test_f1: 0.4312
 epoch: 79, train_loss: 1.1520, test_loss: 1.1092, test_f1: 0.4257
 epoch: 80, train_loss: 1.1490, test_loss: 1.1122, test_f1: 0.4316
 epoch: 81, train_loss: 1.1546, test_loss: 1.1151, test_f1: 0.4308
 epoch: 82, train_loss: 1.1449, test_loss: 1.1139, test_f1: 0.4308
 epoch: 83, train_loss: 1.1394, test_loss: 1.1124, test_f1: 0.4360
 epoch: 84, train_loss: 1.1411, test_loss: 1.1103, test_f1: 0.4274
 epoch: 85, train_loss: 1.1474, test_loss: 1.1074, test_f1: 0.4376
 epoch: 86, train_loss: 1.1460, test_loss: 1.1097, test_f1: 0.4415
 epoch: 87, train_loss: 1.1400, test_loss: 1.1117, test_f1: 0.4418
 epoch: 88, train_loss: 1.1409, test_loss: 1.1174, test_f1: 0.4439
 epoch: 89, train_loss: 1.1329, test_loss: 1.1179, test_f1: 0.4516
 epoch: 90, train_loss: 1.1415, test_loss: 1.1087, test_f1: 0.4375
 epoch: 91, train_loss: 1.1432, test_loss: 1.1090, test_f1: 0.4347
 epoch: 92, train_loss: 1.1320, test_loss: 1.1138, test_f1: 0.4447
 epoch: 93, train_loss: 1.1412, test_loss: 1.1101, test_f1: 0.4363
 epoch: 94, train_loss: 1.1378, test_loss: 1.1095, test_f1: 0.4325
 epoch: 95, train_loss: 1.1426, test_loss: 1.1100, test_f1: 0.4354
 epoch: 96, train_loss: 1.1349, test_loss: 1.1124, test_f1: 0.4525
 epoch: 97, train_loss: 1.1335, test_loss: 1.1146, test_f1: 0.4299
 epoch: 98, train_loss: 1.1408, test_loss: 1.1067, test_f1: 0.4298
 epoch: 99, train_loss: 1.1407, test_loss: 1.1088, test_f1: 0.4322
##################ITERATION #7 ****************************************
 epoch: 0, train_loss: 1.3209, test_loss: 1.3264, test_f1: 0.2274
 epoch: 1, train_loss: 1.2990, test_loss: 1.3109, test_f1: 0.2276
 epoch: 2, train_loss: 1.2955, test_loss: 1.2945, test_f1: 0.2276
 epoch: 3, train_loss: 1.2809, test_loss: 1.2911, test_f1: 0.2276
 epoch: 4, train_loss: 1.2817, test_loss: 1.2798, test_f1: 0.2276
 epoch: 5, train_loss: 1.2797, test_loss: 1.2793, test_f1: 0.2276
 epoch: 6, train_loss: 1.2674, test_loss: 1.2735, test_f1: 0.2276
 epoch: 7, train_loss: 1.2693, test_loss: 1.2664, test_f1: 0.2274
 epoch: 8, train_loss: 1.2678, test_loss: 1.2678, test_f1: 0.2274
 epoch: 9, train_loss: 1.2640, test_loss: 1.2582, test_f1: 0.2399
 epoch: 10, train_loss: 1.2593, test_loss: 1.2525, test_f1: 0.2390
 epoch: 11, train_loss: 1.2532, test_loss: 1.2467, test_f1: 0.2385
 epoch: 12, train_loss: 1.2559, test_loss: 1.2476, test_f1: 0.2375
 epoch: 13, train_loss: 1.2519, test_loss: 1.2413, test_f1: 0.2376
 epoch: 14, train_loss: 1.2468, test_loss: 1.2382, test_f1: 0.2385
 epoch: 15, train_loss: 1.2446, test_loss: 1.2344, test_f1: 0.2353
 epoch: 16, train_loss: 1.2457, test_loss: 1.2326, test_f1: 0.2669
 epoch: 17, train_loss: 1.2443, test_loss: 1.2299, test_f1: 0.2477
 epoch: 18, train_loss: 1.2452, test_loss: 1.2220, test_f1: 0.2682
 epoch: 19, train_loss: 1.2442, test_loss: 1.2235, test_f1: 0.2796
 epoch: 20, train_loss: 1.2350, test_loss: 1.2172, test_f1: 0.2708
 epoch: 21, train_loss: 1.2355, test_loss: 1.2146, test_f1: 0.2880
 epoch: 22, train_loss: 1.2376, test_loss: 1.2164, test_f1: 0.2754
 epoch: 23, train_loss: 1.2302, test_loss: 1.2125, test_f1: 0.2958
 epoch: 24, train_loss: 1.2338, test_loss: 1.2069, test_f1: 0.3009
 epoch: 25, train_loss: 1.2389, test_loss: 1.2032, test_f1: 0.3118
 epoch: 26, train_loss: 1.2334, test_loss: 1.2052, test_f1: 0.3093
 epoch: 27, train_loss: 1.2253, test_loss: 1.2036, test_f1: 0.3287
 epoch: 28, train_loss: 1.2280, test_loss: 1.2029, test_f1: 0.3283
 epoch: 29, train_loss: 1.2247, test_loss: 1.2014, test_f1: 0.3061
 epoch: 30, train_loss: 1.2245, test_loss: 1.1944, test_f1: 0.3318
 epoch: 31, train_loss: 1.2261, test_loss: 1.1887, test_f1: 0.3429
 epoch: 32, train_loss: 1.2173, test_loss: 1.1898, test_f1: 0.3328
 epoch: 33, train_loss: 1.2261, test_loss: 1.1976, test_f1: 0.3114
 epoch: 34, train_loss: 1.2174, test_loss: 1.1899, test_f1: 0.3464
 epoch: 35, train_loss: 1.2168, test_loss: 1.1828, test_f1: 0.3628
 epoch: 36, train_loss: 1.2113, test_loss: 1.1845, test_f1: 0.3550
 epoch: 37, train_loss: 1.2157, test_loss: 1.1807, test_f1: 0.3561
 epoch: 38, train_loss: 1.2096, test_loss: 1.1783, test_f1: 0.3748
 epoch: 39, train_loss: 1.2129, test_loss: 1.1761, test_f1: 0.3436
 epoch: 40, train_loss: 1.2111, test_loss: 1.1692, test_f1: 0.4032
 epoch: 41, train_loss: 1.2096, test_loss: 1.1688, test_f1: 0.3771
 epoch: 42, train_loss: 1.2079, test_loss: 1.1617, test_f1: 0.3903
 epoch: 43, train_loss: 1.2074, test_loss: 1.1632, test_f1: 0.3836
 epoch: 44, train_loss: 1.1944, test_loss: 1.1601, test_f1: 0.3784
 epoch: 45, train_loss: 1.1943, test_loss: 1.1583, test_f1: 0.4150
 epoch: 46, train_loss: 1.2013, test_loss: 1.1620, test_f1: 0.4159
 epoch: 47, train_loss: 1.1976, test_loss: 1.1546, test_f1: 0.4159
 epoch: 48, train_loss: 1.1951, test_loss: 1.1456, test_f1: 0.4209
 epoch: 49, train_loss: 1.1926, test_loss: 1.1478, test_f1: 0.4192
 epoch: 50, train_loss: 1.1913, test_loss: 1.1491, test_f1: 0.4184
 epoch: 51, train_loss: 1.1833, test_loss: 1.1379, test_f1: 0.4286
 epoch: 52, train_loss: 1.1880, test_loss: 1.1389, test_f1: 0.4216
 epoch: 53, train_loss: 1.1855, test_loss: 1.1393, test_f1: 0.4266
 epoch: 54, train_loss: 1.1911, test_loss: 1.1366, test_f1: 0.4172
 epoch: 55, train_loss: 1.1851, test_loss: 1.1374, test_f1: 0.4151
 epoch: 56, train_loss: 1.1791, test_loss: 1.1355, test_f1: 0.4256
 epoch: 57, train_loss: 1.1798, test_loss: 1.1368, test_f1: 0.4228
 epoch: 58, train_loss: 1.1873, test_loss: 1.1337, test_f1: 0.4179
 epoch: 59, train_loss: 1.1756, test_loss: 1.1383, test_f1: 0.4184
 epoch: 60, train_loss: 1.1906, test_loss: 1.1277, test_f1: 0.4231
 epoch: 61, train_loss: 1.1733, test_loss: 1.1309, test_f1: 0.4175
 epoch: 62, train_loss: 1.1812, test_loss: 1.1339, test_f1: 0.4244
 epoch: 63, train_loss: 1.1723, test_loss: 1.1289, test_f1: 0.4294
 epoch: 64, train_loss: 1.1750, test_loss: 1.1233, test_f1: 0.4275
 epoch: 65, train_loss: 1.1659, test_loss: 1.1231, test_f1: 0.4286
 epoch: 66, train_loss: 1.1760, test_loss: 1.1275, test_f1: 0.4262
 epoch: 67, train_loss: 1.1733, test_loss: 1.1227, test_f1: 0.4407
 epoch: 68, train_loss: 1.1747, test_loss: 1.1244, test_f1: 0.4289
 epoch: 69, train_loss: 1.1695, test_loss: 1.1143, test_f1: 0.4437
 epoch: 70, train_loss: 1.1729, test_loss: 1.1161, test_f1: 0.4395
 epoch: 71, train_loss: 1.1741, test_loss: 1.1145, test_f1: 0.4425
 epoch: 72, train_loss: 1.1804, test_loss: 1.1216, test_f1: 0.4347
 epoch: 73, train_loss: 1.1724, test_loss: 1.1245, test_f1: 0.4446
 epoch: 74, train_loss: 1.1718, test_loss: 1.1146, test_f1: 0.4376
 epoch: 75, train_loss: 1.1629, test_loss: 1.1151, test_f1: 0.4413
 epoch: 76, train_loss: 1.1659, test_loss: 1.1162, test_f1: 0.4341
 epoch: 77, train_loss: 1.1725, test_loss: 1.1201, test_f1: 0.4252
 epoch: 78, train_loss: 1.1654, test_loss: 1.1209, test_f1: 0.4198
 epoch: 79, train_loss: 1.1648, test_loss: 1.1137, test_f1: 0.4343
 epoch: 80, train_loss: 1.1626, test_loss: 1.1114, test_f1: 0.4363
 epoch: 81, train_loss: 1.1624, test_loss: 1.1084, test_f1: 0.4489
 epoch: 82, train_loss: 1.1633, test_loss: 1.1143, test_f1: 0.4354
 epoch: 83, train_loss: 1.1540, test_loss: 1.1086, test_f1: 0.4404
 epoch: 84, train_loss: 1.1618, test_loss: 1.1080, test_f1: 0.4408
 epoch: 85, train_loss: 1.1593, test_loss: 1.1039, test_f1: 0.4478
 epoch: 86, train_loss: 1.1549, test_loss: 1.1061, test_f1: 0.4380
 epoch: 87, train_loss: 1.1607, test_loss: 1.1123, test_f1: 0.4328
 epoch: 88, train_loss: 1.1538, test_loss: 1.1010, test_f1: 0.4438
 epoch: 89, train_loss: 1.1523, test_loss: 1.1115, test_f1: 0.4264
 epoch: 90, train_loss: 1.1524, test_loss: 1.1093, test_f1: 0.4375
 epoch: 91, train_loss: 1.1498, test_loss: 1.1116, test_f1: 0.4164
 epoch: 92, train_loss: 1.1554, test_loss: 1.1006, test_f1: 0.4414
 epoch: 93, train_loss: 1.1586, test_loss: 1.1071, test_f1: 0.4316
 epoch: 94, train_loss: 1.1531, test_loss: 1.1060, test_f1: 0.4395
 epoch: 95, train_loss: 1.1539, test_loss: 1.0997, test_f1: 0.4411
 epoch: 96, train_loss: 1.1561, test_loss: 1.0990, test_f1: 0.4438
 epoch: 97, train_loss: 1.1563, test_loss: 1.1054, test_f1: 0.4361
 epoch: 98, train_loss: 1.1484, test_loss: 1.0995, test_f1: 0.4457
 epoch: 99, train_loss: 1.1575, test_loss: 1.1020, test_f1: 0.4277
##################ITERATION #8 ****************************************
 epoch: 0, train_loss: 1.3192, test_loss: 1.3050, test_f1: 0.2274
 epoch: 1, train_loss: 1.3020, test_loss: 1.2968, test_f1: 0.2274
 epoch: 2, train_loss: 1.2894, test_loss: 1.2807, test_f1: 0.2302
 epoch: 3, train_loss: 1.2847, test_loss: 1.2721, test_f1: 0.2577
 epoch: 4, train_loss: 1.2757, test_loss: 1.2615, test_f1: 0.2625
 epoch: 5, train_loss: 1.2651, test_loss: 1.2581, test_f1: 0.2596
 epoch: 6, train_loss: 1.2690, test_loss: 1.2486, test_f1: 0.2591
 epoch: 7, train_loss: 1.2649, test_loss: 1.2452, test_f1: 0.2617
 epoch: 8, train_loss: 1.2649, test_loss: 1.2429, test_f1: 0.2614
 epoch: 9, train_loss: 1.2652, test_loss: 1.2353, test_f1: 0.2680
 epoch: 10, train_loss: 1.2526, test_loss: 1.2339, test_f1: 0.2743
 epoch: 11, train_loss: 1.2518, test_loss: 1.2279, test_f1: 0.2776
 epoch: 12, train_loss: 1.2456, test_loss: 1.2246, test_f1: 0.2742
 epoch: 13, train_loss: 1.2410, test_loss: 1.2190, test_f1: 0.2933
 epoch: 14, train_loss: 1.2485, test_loss: 1.2147, test_f1: 0.3066
 epoch: 15, train_loss: 1.2378, test_loss: 1.2127, test_f1: 0.3095
 epoch: 16, train_loss: 1.2443, test_loss: 1.2102, test_f1: 0.3118
 epoch: 17, train_loss: 1.2386, test_loss: 1.2056, test_f1: 0.3007
 epoch: 18, train_loss: 1.2380, test_loss: 1.2059, test_f1: 0.3006
 epoch: 19, train_loss: 1.2315, test_loss: 1.2024, test_f1: 0.3014
 epoch: 20, train_loss: 1.2335, test_loss: 1.2004, test_f1: 0.3226
 epoch: 21, train_loss: 1.2339, test_loss: 1.1971, test_f1: 0.3072
 epoch: 22, train_loss: 1.2262, test_loss: 1.1966, test_f1: 0.3143
 epoch: 23, train_loss: 1.2140, test_loss: 1.1940, test_f1: 0.3242
 epoch: 24, train_loss: 1.2226, test_loss: 1.1933, test_f1: 0.3267
 epoch: 25, train_loss: 1.2210, test_loss: 1.1873, test_f1: 0.3359
 epoch: 26, train_loss: 1.2284, test_loss: 1.1868, test_f1: 0.3169
 epoch: 27, train_loss: 1.2166, test_loss: 1.1843, test_f1: 0.3093
 epoch: 28, train_loss: 1.2128, test_loss: 1.1828, test_f1: 0.3130
 epoch: 29, train_loss: 1.2135, test_loss: 1.1818, test_f1: 0.3200
 epoch: 30, train_loss: 1.2158, test_loss: 1.1816, test_f1: 0.3270
 epoch: 31, train_loss: 1.2053, test_loss: 1.1775, test_f1: 0.3138
 epoch: 32, train_loss: 1.2084, test_loss: 1.1740, test_f1: 0.3273
 epoch: 33, train_loss: 1.2053, test_loss: 1.1750, test_f1: 0.3201
 epoch: 34, train_loss: 1.2002, test_loss: 1.1700, test_f1: 0.3218
 epoch: 35, train_loss: 1.2038, test_loss: 1.1703, test_f1: 0.3235
 epoch: 36, train_loss: 1.2078, test_loss: 1.1670, test_f1: 0.3368
 epoch: 37, train_loss: 1.2021, test_loss: 1.1628, test_f1: 0.3501
 epoch: 38, train_loss: 1.1983, test_loss: 1.1669, test_f1: 0.3462
 epoch: 39, train_loss: 1.1995, test_loss: 1.1634, test_f1: 0.3473
 epoch: 40, train_loss: 1.1919, test_loss: 1.1637, test_f1: 0.3716
 epoch: 41, train_loss: 1.1907, test_loss: 1.1587, test_f1: 0.3689
 epoch: 42, train_loss: 1.1978, test_loss: 1.1581, test_f1: 0.3801
 epoch: 43, train_loss: 1.1932, test_loss: 1.1582, test_f1: 0.3804
 epoch: 44, train_loss: 1.1948, test_loss: 1.1563, test_f1: 0.3838
 epoch: 45, train_loss: 1.1843, test_loss: 1.1509, test_f1: 0.3879
 epoch: 46, train_loss: 1.1932, test_loss: 1.1529, test_f1: 0.4025
 epoch: 47, train_loss: 1.1837, test_loss: 1.1506, test_f1: 0.3954
 epoch: 48, train_loss: 1.1769, test_loss: 1.1489, test_f1: 0.3991
 epoch: 49, train_loss: 1.1850, test_loss: 1.1484, test_f1: 0.3936
 epoch: 50, train_loss: 1.1817, test_loss: 1.1427, test_f1: 0.4048
 epoch: 51, train_loss: 1.1860, test_loss: 1.1449, test_f1: 0.4108
 epoch: 52, train_loss: 1.1754, test_loss: 1.1450, test_f1: 0.3953
 epoch: 53, train_loss: 1.1820, test_loss: 1.1450, test_f1: 0.3932
 epoch: 54, train_loss: 1.1819, test_loss: 1.1450, test_f1: 0.4038
 epoch: 55, train_loss: 1.1764, test_loss: 1.1438, test_f1: 0.3935
 epoch: 56, train_loss: 1.1840, test_loss: 1.1449, test_f1: 0.3998
 epoch: 57, train_loss: 1.1760, test_loss: 1.1415, test_f1: 0.3885
 epoch: 58, train_loss: 1.1743, test_loss: 1.1382, test_f1: 0.3975
 epoch: 59, train_loss: 1.1810, test_loss: 1.1408, test_f1: 0.3944
 epoch: 60, train_loss: 1.1682, test_loss: 1.1380, test_f1: 0.4046
 epoch: 61, train_loss: 1.1761, test_loss: 1.1404, test_f1: 0.3955
 epoch: 62, train_loss: 1.1743, test_loss: 1.1399, test_f1: 0.3950
 epoch: 63, train_loss: 1.1752, test_loss: 1.1354, test_f1: 0.3960
 epoch: 64, train_loss: 1.1764, test_loss: 1.1380, test_f1: 0.3957
 epoch: 65, train_loss: 1.1695, test_loss: 1.1380, test_f1: 0.4009
 epoch: 66, train_loss: 1.1752, test_loss: 1.1363, test_f1: 0.3854
 epoch: 67, train_loss: 1.1751, test_loss: 1.1352, test_f1: 0.3996
 epoch: 68, train_loss: 1.1774, test_loss: 1.1356, test_f1: 0.3971
 epoch: 69, train_loss: 1.1737, test_loss: 1.1386, test_f1: 0.3854
 epoch: 70, train_loss: 1.1583, test_loss: 1.1348, test_f1: 0.3985
 epoch: 71, train_loss: 1.1698, test_loss: 1.1330, test_f1: 0.3966
 epoch: 72, train_loss: 1.1678, test_loss: 1.1320, test_f1: 0.3967
 epoch: 73, train_loss: 1.1721, test_loss: 1.1332, test_f1: 0.3971
 epoch: 74, train_loss: 1.1619, test_loss: 1.1299, test_f1: 0.4052
 epoch: 75, train_loss: 1.1637, test_loss: 1.1285, test_f1: 0.4113
 epoch: 76, train_loss: 1.1656, test_loss: 1.1290, test_f1: 0.3905
 epoch: 77, train_loss: 1.1655, test_loss: 1.1276, test_f1: 0.4019
 epoch: 78, train_loss: 1.1570, test_loss: 1.1293, test_f1: 0.4001
 epoch: 79, train_loss: 1.1656, test_loss: 1.1262, test_f1: 0.4059
 epoch: 80, train_loss: 1.1672, test_loss: 1.1283, test_f1: 0.4005
 epoch: 81, train_loss: 1.1630, test_loss: 1.1275, test_f1: 0.3954
 epoch: 82, train_loss: 1.1667, test_loss: 1.1263, test_f1: 0.4057
 epoch: 83, train_loss: 1.1633, test_loss: 1.1270, test_f1: 0.4191
 epoch: 84, train_loss: 1.1655, test_loss: 1.1278, test_f1: 0.3918
 epoch: 85, train_loss: 1.1629, test_loss: 1.1256, test_f1: 0.4041
 epoch: 86, train_loss: 1.1610, test_loss: 1.1275, test_f1: 0.3933
 epoch: 87, train_loss: 1.1699, test_loss: 1.1246, test_f1: 0.4075
 epoch: 88, train_loss: 1.1585, test_loss: 1.1277, test_f1: 0.3989
 epoch: 89, train_loss: 1.1610, test_loss: 1.1221, test_f1: 0.4142
 epoch: 90, train_loss: 1.1566, test_loss: 1.1225, test_f1: 0.4041
 epoch: 91, train_loss: 1.1535, test_loss: 1.1255, test_f1: 0.4005
 epoch: 92, train_loss: 1.1532, test_loss: 1.1227, test_f1: 0.4127
 epoch: 93, train_loss: 1.1578, test_loss: 1.1222, test_f1: 0.4155
 epoch: 94, train_loss: 1.1553, test_loss: 1.1214, test_f1: 0.4114
 epoch: 95, train_loss: 1.1668, test_loss: 1.1225, test_f1: 0.4048
 epoch: 96, train_loss: 1.1532, test_loss: 1.1242, test_f1: 0.4124
 epoch: 97, train_loss: 1.1569, test_loss: 1.1196, test_f1: 0.3899
 epoch: 98, train_loss: 1.1467, test_loss: 1.1180, test_f1: 0.4103
 epoch: 99, train_loss: 1.1616, test_loss: 1.1188, test_f1: 0.4158
##################ITERATION #9 ****************************************
 epoch: 0, train_loss: 1.3317, test_loss: 1.3451, test_f1: 0.2276
 epoch: 1, train_loss: 1.3034, test_loss: 1.3208, test_f1: 0.2274
 epoch: 2, train_loss: 1.2886, test_loss: 1.3063, test_f1: 0.2274
 epoch: 3, train_loss: 1.2747, test_loss: 1.2868, test_f1: 0.2300
 epoch: 4, train_loss: 1.2684, test_loss: 1.2736, test_f1: 0.2295
 epoch: 5, train_loss: 1.2577, test_loss: 1.2624, test_f1: 0.2407
 epoch: 6, train_loss: 1.2606, test_loss: 1.2545, test_f1: 0.2393
 epoch: 7, train_loss: 1.2508, test_loss: 1.2467, test_f1: 0.2483
 epoch: 8, train_loss: 1.2466, test_loss: 1.2365, test_f1: 0.2467
 epoch: 9, train_loss: 1.2403, test_loss: 1.2325, test_f1: 0.2569
 epoch: 10, train_loss: 1.2393, test_loss: 1.2242, test_f1: 0.2741
 epoch: 11, train_loss: 1.2338, test_loss: 1.2164, test_f1: 0.2815
 epoch: 12, train_loss: 1.2287, test_loss: 1.2144, test_f1: 0.2830
 epoch: 13, train_loss: 1.2329, test_loss: 1.2106, test_f1: 0.2800
 epoch: 14, train_loss: 1.2239, test_loss: 1.2059, test_f1: 0.2937
 epoch: 15, train_loss: 1.2245, test_loss: 1.2026, test_f1: 0.2851
 epoch: 16, train_loss: 1.2244, test_loss: 1.1987, test_f1: 0.2824
 epoch: 17, train_loss: 1.2181, test_loss: 1.1957, test_f1: 0.2903
 epoch: 18, train_loss: 1.2240, test_loss: 1.1916, test_f1: 0.3052
 epoch: 19, train_loss: 1.2105, test_loss: 1.1858, test_f1: 0.3120
 epoch: 20, train_loss: 1.2088, test_loss: 1.1852, test_f1: 0.3299
 epoch: 21, train_loss: 1.2120, test_loss: 1.1814, test_f1: 0.3087
 epoch: 22, train_loss: 1.2074, test_loss: 1.1804, test_f1: 0.3443
 epoch: 23, train_loss: 1.2077, test_loss: 1.1780, test_f1: 0.3474
 epoch: 24, train_loss: 1.2144, test_loss: 1.1772, test_f1: 0.3587
 epoch: 25, train_loss: 1.2085, test_loss: 1.1742, test_f1: 0.3597
 epoch: 26, train_loss: 1.2028, test_loss: 1.1740, test_f1: 0.3507
 epoch: 27, train_loss: 1.2028, test_loss: 1.1681, test_f1: 0.3797
 epoch: 28, train_loss: 1.1979, test_loss: 1.1685, test_f1: 0.3711
 epoch: 29, train_loss: 1.1983, test_loss: 1.1639, test_f1: 0.3912
 epoch: 30, train_loss: 1.1998, test_loss: 1.1646, test_f1: 0.3764
 epoch: 31, train_loss: 1.1923, test_loss: 1.1617, test_f1: 0.3907
 epoch: 32, train_loss: 1.1986, test_loss: 1.1600, test_f1: 0.4166
 epoch: 33, train_loss: 1.1938, test_loss: 1.1571, test_f1: 0.4109
 epoch: 34, train_loss: 1.1925, test_loss: 1.1574, test_f1: 0.4082
 epoch: 35, train_loss: 1.1942, test_loss: 1.1530, test_f1: 0.4134
 epoch: 36, train_loss: 1.1949, test_loss: 1.1530, test_f1: 0.3918
 epoch: 37, train_loss: 1.1932, test_loss: 1.1513, test_f1: 0.3890
 epoch: 38, train_loss: 1.1845, test_loss: 1.1500, test_f1: 0.3939
 epoch: 39, train_loss: 1.1861, test_loss: 1.1491, test_f1: 0.3966
 epoch: 40, train_loss: 1.1830, test_loss: 1.1459, test_f1: 0.3949
 epoch: 41, train_loss: 1.1796, test_loss: 1.1455, test_f1: 0.4004
 epoch: 42, train_loss: 1.1786, test_loss: 1.1436, test_f1: 0.3952
 epoch: 43, train_loss: 1.1819, test_loss: 1.1425, test_f1: 0.4070
 epoch: 44, train_loss: 1.1816, test_loss: 1.1399, test_f1: 0.4069
 epoch: 45, train_loss: 1.1837, test_loss: 1.1385, test_f1: 0.4044
 epoch: 46, train_loss: 1.1711, test_loss: 1.1384, test_f1: 0.4001
 epoch: 47, train_loss: 1.1793, test_loss: 1.1380, test_f1: 0.4081
 epoch: 48, train_loss: 1.1826, test_loss: 1.1370, test_f1: 0.4086
 epoch: 49, train_loss: 1.1740, test_loss: 1.1343, test_f1: 0.4078
 epoch: 50, train_loss: 1.1727, test_loss: 1.1323, test_f1: 0.4083
 epoch: 51, train_loss: 1.1737, test_loss: 1.1358, test_f1: 0.4118
 epoch: 52, train_loss: 1.1655, test_loss: 1.1328, test_f1: 0.4037
 epoch: 53, train_loss: 1.1775, test_loss: 1.1318, test_f1: 0.4081
 epoch: 54, train_loss: 1.1677, test_loss: 1.1308, test_f1: 0.4072
 epoch: 55, train_loss: 1.1649, test_loss: 1.1290, test_f1: 0.4184
 epoch: 56, train_loss: 1.1652, test_loss: 1.1311, test_f1: 0.4132
 epoch: 57, train_loss: 1.1723, test_loss: 1.1332, test_f1: 0.4090
 epoch: 58, train_loss: 1.1719, test_loss: 1.1290, test_f1: 0.4104
 epoch: 59, train_loss: 1.1624, test_loss: 1.1283, test_f1: 0.4169
 epoch: 60, train_loss: 1.1582, test_loss: 1.1282, test_f1: 0.4165
 epoch: 61, train_loss: 1.1683, test_loss: 1.1293, test_f1: 0.4130
 epoch: 62, train_loss: 1.1747, test_loss: 1.1257, test_f1: 0.4124
 epoch: 63, train_loss: 1.1542, test_loss: 1.1250, test_f1: 0.4089
 epoch: 64, train_loss: 1.1604, test_loss: 1.1248, test_f1: 0.4177
 epoch: 65, train_loss: 1.1617, test_loss: 1.1230, test_f1: 0.4228
 epoch: 66, train_loss: 1.1649, test_loss: 1.1233, test_f1: 0.4193
 epoch: 67, train_loss: 1.1717, test_loss: 1.1243, test_f1: 0.4202
 epoch: 68, train_loss: 1.1586, test_loss: 1.1221, test_f1: 0.4177
 epoch: 69, train_loss: 1.1558, test_loss: 1.1223, test_f1: 0.4206
 epoch: 70, train_loss: 1.1623, test_loss: 1.1196, test_f1: 0.4252
 epoch: 71, train_loss: 1.1573, test_loss: 1.1228, test_f1: 0.4234
 epoch: 72, train_loss: 1.1558, test_loss: 1.1207, test_f1: 0.4184
 epoch: 73, train_loss: 1.1616, test_loss: 1.1214, test_f1: 0.4218
 epoch: 74, train_loss: 1.1486, test_loss: 1.1173, test_f1: 0.4297
 epoch: 75, train_loss: 1.1491, test_loss: 1.1171, test_f1: 0.4225
 epoch: 76, train_loss: 1.1598, test_loss: 1.1194, test_f1: 0.4263
 epoch: 77, train_loss: 1.1546, test_loss: 1.1153, test_f1: 0.4246
 epoch: 78, train_loss: 1.1596, test_loss: 1.1172, test_f1: 0.4272
 epoch: 79, train_loss: 1.1487, test_loss: 1.1136, test_f1: 0.4343
 epoch: 80, train_loss: 1.1515, test_loss: 1.1123, test_f1: 0.4314
 epoch: 81, train_loss: 1.1544, test_loss: 1.1113, test_f1: 0.4310
 epoch: 82, train_loss: 1.1575, test_loss: 1.1161, test_f1: 0.4328
 epoch: 83, train_loss: 1.1629, test_loss: 1.1108, test_f1: 0.4288
 epoch: 84, train_loss: 1.1543, test_loss: 1.1121, test_f1: 0.4309
 epoch: 85, train_loss: 1.1507, test_loss: 1.1112, test_f1: 0.4302
 epoch: 86, train_loss: 1.1412, test_loss: 1.1111, test_f1: 0.4339
 epoch: 87, train_loss: 1.1457, test_loss: 1.1096, test_f1: 0.4449
 epoch: 88, train_loss: 1.1482, test_loss: 1.1055, test_f1: 0.4385
 epoch: 89, train_loss: 1.1398, test_loss: 1.1088, test_f1: 0.4415
 epoch: 90, train_loss: 1.1446, test_loss: 1.1066, test_f1: 0.4286
 epoch: 91, train_loss: 1.1496, test_loss: 1.1071, test_f1: 0.4443
 epoch: 92, train_loss: 1.1505, test_loss: 1.1085, test_f1: 0.4455
 epoch: 93, train_loss: 1.1481, test_loss: 1.1029, test_f1: 0.4256
 epoch: 94, train_loss: 1.1440, test_loss: 1.1056, test_f1: 0.4405
 epoch: 95, train_loss: 1.1438, test_loss: 1.1034, test_f1: 0.4465
 epoch: 96, train_loss: 1.1453, test_loss: 1.1091, test_f1: 0.4419
 epoch: 97, train_loss: 1.1381, test_loss: 1.1040, test_f1: 0.4372
 epoch: 98, train_loss: 1.1393, test_loss: 1.1003, test_f1: 0.4457
 epoch: 99, train_loss: 1.1433, test_loss: 1.0988, test_f1: 0.4412

Training completed in 770.51 seconds
Best F1: 0.4525 at epoch 96
Mean F1 across iterations: 0.4174  0.0243
========================FINAL RESULTS================================
FEGIN weighted F1: 0.4525  0.0243
python main.py --data ltspice_examples --representation component_component --model FEGIN --layers 5 --hiddens 16 --batch_size 64 --lr 0.0001 --emb_size 128 --epochs 100 --save_appendix component_component_L5_H16_BS64_LR0.0001_E128 --no_val
-----



STDERR:
  File "main.py", line 370, in <module>
    main()
  File "main.py", line 254, in main
    dataset = dataset_class(
  File "/home/philip/projects/llm_inference_code_repo/Circuit-Completion-Using-GNNs/component_classification_with_link_prediction_head/evaluation/FEGIN/kernel/circuit_datasets.py", line 15, in __init__
    self.data, self.slices = torch.load(self.processed_paths[0])
  File "/home/philip/.local/lib/python3.8/site-packages/torch/serialization.py", line 1040, in load
    warnings.warn(
  File "/usr/lib/python3.8/warnings.py", line 109, in _showwarnmsg
    sw(msg.message, msg.category, msg.filename, msg.lineno,
  File "main.py", line 47, in warn_with_traceback
    traceback.print_stack(file=log)
/home/philip/projects/llm_inference_code_repo/Circuit-Completion-Using-GNNs/component_classification_with_link_prediction_head/evaluation/FEGIN/kernel/circuit_datasets.py:15: FutureWarning: You are using `torch.load` with `weights_only=False` (the current default value), which uses the default pickle module implicitly. It is possible to construct malicious pickle data which will execute arbitrary code during unpickling (See https://github.com/pytorch/pytorch/blob/main/SECURITY.md#untrusted-models for more details). In a future release, the default value for `weights_only` will be flipped to `True`. This limits the functions that could be executed during unpickling. Arbitrary objects will no longer be allowed to be loaded via this mode unless they are explicitly allowlisted by the user via `torch.serialization.add_safe_globals`. We recommend you start setting `weights_only=True` for any use case where you don't have full control of the loaded file. Please open an issue on GitHub for any issues related to this experimental feature.
  self.data, self.slices = torch.load(self.processed_paths[0])
