STDOUT:
Results will be saved in /home/philip/projects/ltspice_examples_code_repo/Circuit-Completion-Using-GNNs/component_classification_with_link_prediction_head/evaluation/FEGIN/results/model_FEGIN_dataset_ltspice_examples
Command line input: python main.py --data ltspice_examples --representation component_net --model FEGIN --layers 4 --hiddens 64 --batch_size 256 --lr 0.0001 --emb_size 250 --epochs 100 --save_appendix component_net_L4_H64_BS256_LR0.0001_E250 --no_val
 is saved.
-----
ltspice_examples - FEGIN
Using 4 layers, 64 hidden units, h = 2
Loading component_net representation dataset
ENTERED
Training FEGIN on component_net representation
Train: 3558, Test: 846
##################ITERATION #0 ****************************************
 epoch: 0, train_loss: 1.3697, test_loss: 1.3756, test_f1: 0.2270
 epoch: 1, train_loss: 1.3602, test_loss: 1.3738, test_f1: 0.2270
 epoch: 2, train_loss: 1.3535, test_loss: 1.3686, test_f1: 0.2270
 epoch: 3, train_loss: 1.3456, test_loss: 1.3573, test_f1: 0.2270
 epoch: 4, train_loss: 1.3370, test_loss: 1.3415, test_f1: 0.2270
 epoch: 5, train_loss: 1.3274, test_loss: 1.3280, test_f1: 0.2270
 epoch: 6, train_loss: 1.3181, test_loss: 1.3169, test_f1: 0.2270
 epoch: 7, train_loss: 1.3084, test_loss: 1.3060, test_f1: 0.2270
 epoch: 8, train_loss: 1.2981, test_loss: 1.2960, test_f1: 0.2270
 epoch: 9, train_loss: 1.2872, test_loss: 1.2856, test_f1: 0.2270
 epoch: 10, train_loss: 1.2778, test_loss: 1.2743, test_f1: 0.2270
 epoch: 11, train_loss: 1.2656, test_loss: 1.2625, test_f1: 0.2270
 epoch: 12, train_loss: 1.2544, test_loss: 1.2503, test_f1: 0.2270
 epoch: 13, train_loss: 1.2409, test_loss: 1.2373, test_f1: 0.2320
 epoch: 14, train_loss: 1.2310, test_loss: 1.2261, test_f1: 0.2443
 epoch: 15, train_loss: 1.2222, test_loss: 1.2135, test_f1: 0.2746
 epoch: 16, train_loss: 1.2122, test_loss: 1.2021, test_f1: 0.2830
 epoch: 17, train_loss: 1.2016, test_loss: 1.1923, test_f1: 0.3007
 epoch: 18, train_loss: 1.1917, test_loss: 1.1775, test_f1: 0.3308
 epoch: 19, train_loss: 1.1766, test_loss: 1.1664, test_f1: 0.3368
 epoch: 20, train_loss: 1.1681, test_loss: 1.1500, test_f1: 0.3528
 epoch: 21, train_loss: 1.1557, test_loss: 1.1436, test_f1: 0.3384
 epoch: 22, train_loss: 1.1441, test_loss: 1.1206, test_f1: 0.3722
 epoch: 23, train_loss: 1.1259, test_loss: 1.1088, test_f1: 0.3836
 epoch: 24, train_loss: 1.1202, test_loss: 1.0920, test_f1: 0.4176
 epoch: 25, train_loss: 1.1070, test_loss: 1.0823, test_f1: 0.4393
 epoch: 26, train_loss: 1.0888, test_loss: 1.0644, test_f1: 0.4546
 epoch: 27, train_loss: 1.0754, test_loss: 1.0504, test_f1: 0.4781
 epoch: 28, train_loss: 1.0636, test_loss: 1.0340, test_f1: 0.4909
 epoch: 29, train_loss: 1.0546, test_loss: 1.0245, test_f1: 0.4847
 epoch: 30, train_loss: 1.0330, test_loss: 1.0076, test_f1: 0.4867
 epoch: 31, train_loss: 1.0217, test_loss: 0.9979, test_f1: 0.4879
 epoch: 32, train_loss: 1.0094, test_loss: 0.9827, test_f1: 0.4988
 epoch: 33, train_loss: 0.9947, test_loss: 0.9816, test_f1: 0.5045
 epoch: 34, train_loss: 0.9841, test_loss: 0.9647, test_f1: 0.5031
 epoch: 35, train_loss: 0.9738, test_loss: 0.9494, test_f1: 0.5050
 epoch: 36, train_loss: 0.9704, test_loss: 0.9457, test_f1: 0.5030
 epoch: 37, train_loss: 0.9554, test_loss: 0.9383, test_f1: 0.5229
 epoch: 38, train_loss: 0.9442, test_loss: 0.9308, test_f1: 0.5173
 epoch: 39, train_loss: 0.9419, test_loss: 0.9277, test_f1: 0.5022
 epoch: 40, train_loss: 0.9243, test_loss: 0.9158, test_f1: 0.5148
 epoch: 41, train_loss: 0.9222, test_loss: 0.9115, test_f1: 0.5290
 epoch: 42, train_loss: 0.9144, test_loss: 0.9268, test_f1: 0.5142
 epoch: 43, train_loss: 0.9075, test_loss: 0.9426, test_f1: 0.4948
 epoch: 44, train_loss: 0.9009, test_loss: 0.8963, test_f1: 0.5179
 epoch: 45, train_loss: 0.8925, test_loss: 0.9119, test_f1: 0.5116
 epoch: 46, train_loss: 0.8882, test_loss: 0.8937, test_f1: 0.5117
 epoch: 47, train_loss: 0.8872, test_loss: 0.9189, test_f1: 0.5032
 epoch: 48, train_loss: 0.8838, test_loss: 0.8919, test_f1: 0.5323
 epoch: 49, train_loss: 0.8787, test_loss: 0.9033, test_f1: 0.5192
 epoch: 50, train_loss: 0.8689, test_loss: 0.8868, test_f1: 0.5387
 epoch: 51, train_loss: 0.8713, test_loss: 0.8861, test_f1: 0.5326
 epoch: 52, train_loss: 0.8602, test_loss: 0.8976, test_f1: 0.5298
 epoch: 53, train_loss: 0.8569, test_loss: 0.9024, test_f1: 0.5142
 epoch: 54, train_loss: 0.8588, test_loss: 0.8901, test_f1: 0.5251
 epoch: 55, train_loss: 0.8526, test_loss: 0.8882, test_f1: 0.5209
 epoch: 56, train_loss: 0.8584, test_loss: 0.8960, test_f1: 0.5145
 epoch: 57, train_loss: 0.8623, test_loss: 0.8980, test_f1: 0.5298
 epoch: 58, train_loss: 0.8575, test_loss: 0.8975, test_f1: 0.5249
 epoch: 59, train_loss: 0.8578, test_loss: 0.9021, test_f1: 0.5224
 epoch: 60, train_loss: 0.8422, test_loss: 0.8955, test_f1: 0.5232
 epoch: 61, train_loss: 0.8525, test_loss: 0.9100, test_f1: 0.5376
 epoch: 62, train_loss: 0.8455, test_loss: 0.8883, test_f1: 0.5268
 epoch: 63, train_loss: 0.8404, test_loss: 0.8887, test_f1: 0.5183
 epoch: 64, train_loss: 0.8427, test_loss: 0.9020, test_f1: 0.5147
 epoch: 65, train_loss: 0.8379, test_loss: 0.9002, test_f1: 0.5156
 epoch: 66, train_loss: 0.8299, test_loss: 0.8922, test_f1: 0.5341
 epoch: 67, train_loss: 0.8341, test_loss: 0.8923, test_f1: 0.5407
 epoch: 68, train_loss: 0.8341, test_loss: 0.8999, test_f1: 0.5216
 epoch: 69, train_loss: 0.8270, test_loss: 0.9047, test_f1: 0.5405
 epoch: 70, train_loss: 0.8313, test_loss: 0.8895, test_f1: 0.5401
 epoch: 71, train_loss: 0.8321, test_loss: 0.9085, test_f1: 0.5306
 epoch: 72, train_loss: 0.8275, test_loss: 0.8922, test_f1: 0.5412
 epoch: 73, train_loss: 0.8296, test_loss: 0.9081, test_f1: 0.5193
 epoch: 74, train_loss: 0.8333, test_loss: 0.9089, test_f1: 0.5388
 epoch: 75, train_loss: 0.8243, test_loss: 0.8954, test_f1: 0.5444
 epoch: 76, train_loss: 0.8250, test_loss: 0.9052, test_f1: 0.5336
 epoch: 77, train_loss: 0.8319, test_loss: 0.8910, test_f1: 0.5469
 epoch: 78, train_loss: 0.8205, test_loss: 0.8907, test_f1: 0.5470
 epoch: 79, train_loss: 0.8242, test_loss: 0.9156, test_f1: 0.5373
 epoch: 80, train_loss: 0.8255, test_loss: 0.8872, test_f1: 0.5422
 epoch: 81, train_loss: 0.8195, test_loss: 0.9233, test_f1: 0.5313
 epoch: 82, train_loss: 0.8178, test_loss: 0.9017, test_f1: 0.5412
 epoch: 83, train_loss: 0.8187, test_loss: 0.9063, test_f1: 0.5401
 epoch: 84, train_loss: 0.8102, test_loss: 0.9169, test_f1: 0.5359
 epoch: 85, train_loss: 0.8140, test_loss: 0.9107, test_f1: 0.5390
 epoch: 86, train_loss: 0.8149, test_loss: 0.9071, test_f1: 0.5439
 epoch: 87, train_loss: 0.8012, test_loss: 0.9085, test_f1: 0.5392
 epoch: 88, train_loss: 0.8162, test_loss: 0.8978, test_f1: 0.5417
 epoch: 89, train_loss: 0.8080, test_loss: 0.9007, test_f1: 0.5373
 epoch: 90, train_loss: 0.8112, test_loss: 0.9066, test_f1: 0.5403
 epoch: 91, train_loss: 0.8026, test_loss: 0.8988, test_f1: 0.5378
 epoch: 92, train_loss: 0.8046, test_loss: 0.9028, test_f1: 0.5360
 epoch: 93, train_loss: 0.8005, test_loss: 0.8916, test_f1: 0.5415
 epoch: 94, train_loss: 0.7959, test_loss: 0.9002, test_f1: 0.5380
 epoch: 95, train_loss: 0.7974, test_loss: 0.9097, test_f1: 0.5325
 epoch: 96, train_loss: 0.7986, test_loss: 0.9254, test_f1: 0.5306
 epoch: 97, train_loss: 0.7904, test_loss: 0.9018, test_f1: 0.5393
 epoch: 98, train_loss: 0.7929, test_loss: 0.9243, test_f1: 0.5350
 epoch: 99, train_loss: 0.8006, test_loss: 0.8983, test_f1: 0.5504
##################ITERATION #1 ****************************************
 epoch: 0, train_loss: 1.3298, test_loss: 1.3592, test_f1: 0.2270
 epoch: 1, train_loss: 1.3063, test_loss: 1.3449, test_f1: 0.2270
 epoch: 2, train_loss: 1.2911, test_loss: 1.3257, test_f1: 0.2270
 epoch: 3, train_loss: 1.2788, test_loss: 1.2994, test_f1: 0.2270
 epoch: 4, train_loss: 1.2663, test_loss: 1.2724, test_f1: 0.2270
 epoch: 5, train_loss: 1.2526, test_loss: 1.2493, test_f1: 0.2270
 epoch: 6, train_loss: 1.2407, test_loss: 1.2310, test_f1: 0.2728
 epoch: 7, train_loss: 1.2278, test_loss: 1.2140, test_f1: 0.2853
 epoch: 8, train_loss: 1.2139, test_loss: 1.2012, test_f1: 0.2996
 epoch: 9, train_loss: 1.2004, test_loss: 1.1805, test_f1: 0.3351
 epoch: 10, train_loss: 1.1838, test_loss: 1.1647, test_f1: 0.3631
 epoch: 11, train_loss: 1.1701, test_loss: 1.1491, test_f1: 0.4072
 epoch: 12, train_loss: 1.1498, test_loss: 1.1254, test_f1: 0.4130
 epoch: 13, train_loss: 1.1360, test_loss: 1.1119, test_f1: 0.4211
 epoch: 14, train_loss: 1.1139, test_loss: 1.0851, test_f1: 0.4271
 epoch: 15, train_loss: 1.0994, test_loss: 1.0662, test_f1: 0.4495
 epoch: 16, train_loss: 1.0794, test_loss: 1.0458, test_f1: 0.4716
 epoch: 17, train_loss: 1.0653, test_loss: 1.0252, test_f1: 0.4764
 epoch: 18, train_loss: 1.0511, test_loss: 1.0113, test_f1: 0.4751
 epoch: 19, train_loss: 1.0315, test_loss: 1.0035, test_f1: 0.4843
 epoch: 20, train_loss: 1.0292, test_loss: 0.9922, test_f1: 0.4785
 epoch: 21, train_loss: 1.0089, test_loss: 0.9838, test_f1: 0.4956
 epoch: 22, train_loss: 0.9957, test_loss: 0.9643, test_f1: 0.4987
 epoch: 23, train_loss: 0.9949, test_loss: 0.9657, test_f1: 0.4983
 epoch: 24, train_loss: 0.9796, test_loss: 0.9531, test_f1: 0.5092
 epoch: 25, train_loss: 0.9676, test_loss: 0.9592, test_f1: 0.5048
 epoch: 26, train_loss: 0.9625, test_loss: 0.9458, test_f1: 0.5003
 epoch: 27, train_loss: 0.9500, test_loss: 0.9527, test_f1: 0.5056
 epoch: 28, train_loss: 0.9398, test_loss: 0.9193, test_f1: 0.5111
 epoch: 29, train_loss: 0.9300, test_loss: 0.9836, test_f1: 0.4773
 epoch: 30, train_loss: 0.9262, test_loss: 0.9188, test_f1: 0.5121
 epoch: 31, train_loss: 0.9199, test_loss: 0.9177, test_f1: 0.5145
 epoch: 32, train_loss: 0.9098, test_loss: 0.9766, test_f1: 0.4839
 epoch: 33, train_loss: 0.9141, test_loss: 0.9526, test_f1: 0.4900
 epoch: 34, train_loss: 0.9008, test_loss: 0.9254, test_f1: 0.5126
 epoch: 35, train_loss: 0.9002, test_loss: 0.9099, test_f1: 0.5156
 epoch: 36, train_loss: 0.8985, test_loss: 1.0437, test_f1: 0.4909
 epoch: 37, train_loss: 0.8906, test_loss: 0.9136, test_f1: 0.5184
 epoch: 38, train_loss: 0.8854, test_loss: 0.8967, test_f1: 0.5094
 epoch: 39, train_loss: 0.8835, test_loss: 0.9087, test_f1: 0.5258
 epoch: 40, train_loss: 0.8740, test_loss: 0.9069, test_f1: 0.5168
 epoch: 41, train_loss: 0.8715, test_loss: 0.9265, test_f1: 0.5163
 epoch: 42, train_loss: 0.8666, test_loss: 0.9226, test_f1: 0.5263
 epoch: 43, train_loss: 0.8622, test_loss: 0.9204, test_f1: 0.5264
 epoch: 44, train_loss: 0.8643, test_loss: 0.9084, test_f1: 0.5184
 epoch: 45, train_loss: 0.8601, test_loss: 0.9080, test_f1: 0.5256
 epoch: 46, train_loss: 0.8510, test_loss: 0.9673, test_f1: 0.5143
 epoch: 47, train_loss: 0.8510, test_loss: 0.8957, test_f1: 0.5191
 epoch: 48, train_loss: 0.8449, test_loss: 0.8984, test_f1: 0.5052
 epoch: 49, train_loss: 0.8485, test_loss: 0.9980, test_f1: 0.5110
 epoch: 50, train_loss: 0.8427, test_loss: 0.8901, test_f1: 0.5125
 epoch: 51, train_loss: 0.8339, test_loss: 0.9046, test_f1: 0.5231
 epoch: 52, train_loss: 0.8286, test_loss: 0.9291, test_f1: 0.5181
 epoch: 53, train_loss: 0.8312, test_loss: 0.8945, test_f1: 0.5146
 epoch: 54, train_loss: 0.8311, test_loss: 0.9237, test_f1: 0.5185
 epoch: 55, train_loss: 0.8256, test_loss: 0.9252, test_f1: 0.5134
 epoch: 56, train_loss: 0.8312, test_loss: 0.9045, test_f1: 0.5263
 epoch: 57, train_loss: 0.8265, test_loss: 0.9298, test_f1: 0.5247
 epoch: 58, train_loss: 0.8217, test_loss: 0.9239, test_f1: 0.5267
 epoch: 59, train_loss: 0.8197, test_loss: 0.8972, test_f1: 0.5225
 epoch: 60, train_loss: 0.8220, test_loss: 0.9149, test_f1: 0.5253
 epoch: 61, train_loss: 0.8087, test_loss: 0.9411, test_f1: 0.5276
 epoch: 62, train_loss: 0.8115, test_loss: 0.8986, test_f1: 0.5253
 epoch: 63, train_loss: 0.8136, test_loss: 0.9168, test_f1: 0.5269
 epoch: 64, train_loss: 0.8104, test_loss: 0.9197, test_f1: 0.5510
 epoch: 65, train_loss: 0.8170, test_loss: 0.9421, test_f1: 0.5291
 epoch: 66, train_loss: 0.8129, test_loss: 0.9082, test_f1: 0.5164
 epoch: 67, train_loss: 0.8068, test_loss: 0.9200, test_f1: 0.5187
 epoch: 68, train_loss: 0.8127, test_loss: 0.9172, test_f1: 0.5325
 epoch: 69, train_loss: 0.8076, test_loss: 0.9141, test_f1: 0.5269
 epoch: 70, train_loss: 0.8081, test_loss: 0.9177, test_f1: 0.5230
 epoch: 71, train_loss: 0.8111, test_loss: 0.9243, test_f1: 0.5260
 epoch: 72, train_loss: 0.8052, test_loss: 0.9176, test_f1: 0.5213
 epoch: 73, train_loss: 0.8070, test_loss: 0.9121, test_f1: 0.5160
 epoch: 74, train_loss: 0.7980, test_loss: 0.9440, test_f1: 0.5226
 epoch: 75, train_loss: 0.7967, test_loss: 0.9106, test_f1: 0.5275
 epoch: 76, train_loss: 0.8047, test_loss: 0.9282, test_f1: 0.5273
 epoch: 77, train_loss: 0.7956, test_loss: 0.9350, test_f1: 0.5233
 epoch: 78, train_loss: 0.7932, test_loss: 0.9234, test_f1: 0.5258
 epoch: 79, train_loss: 0.7945, test_loss: 0.9329, test_f1: 0.5223
 epoch: 80, train_loss: 0.7942, test_loss: 0.9141, test_f1: 0.5263
 epoch: 81, train_loss: 0.7951, test_loss: 0.9375, test_f1: 0.5143
 epoch: 82, train_loss: 0.7892, test_loss: 0.9277, test_f1: 0.5182
 epoch: 83, train_loss: 0.7857, test_loss: 0.9353, test_f1: 0.5239
 epoch: 84, train_loss: 0.7857, test_loss: 0.9243, test_f1: 0.5273
 epoch: 85, train_loss: 0.7868, test_loss: 0.9173, test_f1: 0.5264
 epoch: 86, train_loss: 0.7869, test_loss: 0.9472, test_f1: 0.5265
 epoch: 87, train_loss: 0.7906, test_loss: 0.9129, test_f1: 0.5212
 epoch: 88, train_loss: 0.7844, test_loss: 0.9406, test_f1: 0.5190
 epoch: 89, train_loss: 0.7829, test_loss: 0.9418, test_f1: 0.5145
 epoch: 90, train_loss: 0.7808, test_loss: 0.9168, test_f1: 0.5289
 epoch: 91, train_loss: 0.7790, test_loss: 0.9217, test_f1: 0.5217
 epoch: 92, train_loss: 0.7825, test_loss: 0.9391, test_f1: 0.5241
 epoch: 93, train_loss: 0.7677, test_loss: 0.9348, test_f1: 0.5201
 epoch: 94, train_loss: 0.7796, test_loss: 0.9631, test_f1: 0.5198
 epoch: 95, train_loss: 0.7769, test_loss: 0.9282, test_f1: 0.5171
 epoch: 96, train_loss: 0.7830, test_loss: 0.9769, test_f1: 0.5156
 epoch: 97, train_loss: 0.7715, test_loss: 0.9271, test_f1: 0.5138
 epoch: 98, train_loss: 0.7753, test_loss: 0.9369, test_f1: 0.5288
 epoch: 99, train_loss: 0.7887, test_loss: 0.9236, test_f1: 0.5122
##################ITERATION #2 ****************************************
 epoch: 0, train_loss: 1.3153, test_loss: 1.3422, test_f1: 0.2270
 epoch: 1, train_loss: 1.2798, test_loss: 1.3265, test_f1: 0.2270
 epoch: 2, train_loss: 1.2654, test_loss: 1.3086, test_f1: 0.2270
 epoch: 3, train_loss: 1.2463, test_loss: 1.2767, test_f1: 0.2270
 epoch: 4, train_loss: 1.2316, test_loss: 1.2328, test_f1: 0.3087
 epoch: 5, train_loss: 1.2148, test_loss: 1.1970, test_f1: 0.3481
 epoch: 6, train_loss: 1.1975, test_loss: 1.1692, test_f1: 0.3763
 epoch: 7, train_loss: 1.1769, test_loss: 1.1480, test_f1: 0.4188
 epoch: 8, train_loss: 1.1647, test_loss: 1.1302, test_f1: 0.4326
 epoch: 9, train_loss: 1.1450, test_loss: 1.1112, test_f1: 0.4333
 epoch: 10, train_loss: 1.1276, test_loss: 1.0919, test_f1: 0.4308
 epoch: 11, train_loss: 1.1123, test_loss: 1.0776, test_f1: 0.4374
 epoch: 12, train_loss: 1.0968, test_loss: 1.0590, test_f1: 0.4308
 epoch: 13, train_loss: 1.0805, test_loss: 1.0474, test_f1: 0.4374
 epoch: 14, train_loss: 1.0651, test_loss: 1.0318, test_f1: 0.4436
 epoch: 15, train_loss: 1.0527, test_loss: 1.0174, test_f1: 0.4431
 epoch: 16, train_loss: 1.0365, test_loss: 1.0114, test_f1: 0.4478
 epoch: 17, train_loss: 1.0224, test_loss: 0.9988, test_f1: 0.4577
 epoch: 18, train_loss: 1.0104, test_loss: 0.9842, test_f1: 0.4664
 epoch: 19, train_loss: 0.9953, test_loss: 0.9738, test_f1: 0.4685
 epoch: 20, train_loss: 0.9852, test_loss: 0.9694, test_f1: 0.4668
 epoch: 21, train_loss: 0.9722, test_loss: 0.9591, test_f1: 0.4837
 epoch: 22, train_loss: 0.9673, test_loss: 0.9421, test_f1: 0.4852
 epoch: 23, train_loss: 0.9550, test_loss: 0.9413, test_f1: 0.4888
 epoch: 24, train_loss: 0.9475, test_loss: 0.9286, test_f1: 0.5072
 epoch: 25, train_loss: 0.9369, test_loss: 0.9325, test_f1: 0.4991
 epoch: 26, train_loss: 0.9312, test_loss: 0.9279, test_f1: 0.5111
 epoch: 27, train_loss: 0.9194, test_loss: 0.9223, test_f1: 0.5218
 epoch: 28, train_loss: 0.9245, test_loss: 0.9195, test_f1: 0.5026
 epoch: 29, train_loss: 0.9152, test_loss: 0.9208, test_f1: 0.5035
 epoch: 30, train_loss: 0.9094, test_loss: 0.9125, test_f1: 0.4991
 epoch: 31, train_loss: 0.8997, test_loss: 0.9145, test_f1: 0.4976
 epoch: 32, train_loss: 0.8935, test_loss: 0.9091, test_f1: 0.5082
 epoch: 33, train_loss: 0.8899, test_loss: 0.9068, test_f1: 0.5013
 epoch: 34, train_loss: 0.8868, test_loss: 0.9314, test_f1: 0.5178
 epoch: 35, train_loss: 0.8777, test_loss: 0.9165, test_f1: 0.5204
 epoch: 36, train_loss: 0.8779, test_loss: 0.9208, test_f1: 0.5129
 epoch: 37, train_loss: 0.8639, test_loss: 0.9191, test_f1: 0.5168
 epoch: 38, train_loss: 0.8683, test_loss: 0.9059, test_f1: 0.5249
 epoch: 39, train_loss: 0.8646, test_loss: 0.9158, test_f1: 0.5211
 epoch: 40, train_loss: 0.8534, test_loss: 0.9216, test_f1: 0.5152
 epoch: 41, train_loss: 0.8505, test_loss: 0.9290, test_f1: 0.5231
 epoch: 42, train_loss: 0.8540, test_loss: 0.9196, test_f1: 0.5291
 epoch: 43, train_loss: 0.8532, test_loss: 0.9153, test_f1: 0.5272
 epoch: 44, train_loss: 0.8380, test_loss: 0.9207, test_f1: 0.5255
 epoch: 45, train_loss: 0.8385, test_loss: 0.9152, test_f1: 0.5268
 epoch: 46, train_loss: 0.8354, test_loss: 0.9260, test_f1: 0.5258
 epoch: 47, train_loss: 0.8313, test_loss: 0.9257, test_f1: 0.5226
 epoch: 48, train_loss: 0.8296, test_loss: 0.9233, test_f1: 0.5272
 epoch: 49, train_loss: 0.8311, test_loss: 0.9456, test_f1: 0.5150
 epoch: 50, train_loss: 0.8276, test_loss: 0.9235, test_f1: 0.5301
 epoch: 51, train_loss: 0.8186, test_loss: 0.9324, test_f1: 0.5180
 epoch: 52, train_loss: 0.8139, test_loss: 0.9355, test_f1: 0.5173
 epoch: 53, train_loss: 0.8117, test_loss: 0.9378, test_f1: 0.5182
 epoch: 54, train_loss: 0.8153, test_loss: 0.9292, test_f1: 0.5251
 epoch: 55, train_loss: 0.8205, test_loss: 0.9296, test_f1: 0.5248
 epoch: 56, train_loss: 0.8157, test_loss: 0.9256, test_f1: 0.5222
 epoch: 57, train_loss: 0.8085, test_loss: 0.9341, test_f1: 0.5218
 epoch: 58, train_loss: 0.8013, test_loss: 0.9364, test_f1: 0.5272
 epoch: 59, train_loss: 0.8009, test_loss: 0.9419, test_f1: 0.5273
 epoch: 60, train_loss: 0.8177, test_loss: 0.9349, test_f1: 0.5305
 epoch: 61, train_loss: 0.8043, test_loss: 0.9395, test_f1: 0.5293
 epoch: 62, train_loss: 0.8033, test_loss: 0.9393, test_f1: 0.5182
 epoch: 63, train_loss: 0.8016, test_loss: 0.9392, test_f1: 0.5179
 epoch: 64, train_loss: 0.7948, test_loss: 0.9427, test_f1: 0.5118
 epoch: 65, train_loss: 0.7946, test_loss: 0.9243, test_f1: 0.5228
 epoch: 66, train_loss: 0.7886, test_loss: 0.9331, test_f1: 0.5331
 epoch: 67, train_loss: 0.7945, test_loss: 0.9439, test_f1: 0.5214
 epoch: 68, train_loss: 0.7912, test_loss: 0.9391, test_f1: 0.5249
 epoch: 69, train_loss: 0.7932, test_loss: 0.9407, test_f1: 0.5322
 epoch: 70, train_loss: 0.7808, test_loss: 0.9458, test_f1: 0.5331
 epoch: 71, train_loss: 0.7891, test_loss: 0.9429, test_f1: 0.5360
 epoch: 72, train_loss: 0.7880, test_loss: 0.9442, test_f1: 0.5166
 epoch: 73, train_loss: 0.7833, test_loss: 0.9420, test_f1: 0.5143
 epoch: 74, train_loss: 0.7867, test_loss: 0.9458, test_f1: 0.5320
 epoch: 75, train_loss: 0.7852, test_loss: 0.9402, test_f1: 0.5334
 epoch: 76, train_loss: 0.7721, test_loss: 0.9418, test_f1: 0.5280
 epoch: 77, train_loss: 0.7796, test_loss: 0.9423, test_f1: 0.5365
 epoch: 78, train_loss: 0.7825, test_loss: 0.9467, test_f1: 0.5423
 epoch: 79, train_loss: 0.7845, test_loss: 0.9420, test_f1: 0.5443
 epoch: 80, train_loss: 0.7871, test_loss: 0.9459, test_f1: 0.5334
 epoch: 81, train_loss: 0.7764, test_loss: 0.9489, test_f1: 0.5315
 epoch: 82, train_loss: 0.7883, test_loss: 0.9396, test_f1: 0.5345
 epoch: 83, train_loss: 0.7770, test_loss: 0.9541, test_f1: 0.5385
 epoch: 84, train_loss: 0.7680, test_loss: 0.9525, test_f1: 0.5352
 epoch: 85, train_loss: 0.7729, test_loss: 0.9488, test_f1: 0.5397
 epoch: 86, train_loss: 0.7721, test_loss: 0.9453, test_f1: 0.5404
 epoch: 87, train_loss: 0.7738, test_loss: 0.9429, test_f1: 0.5444
 epoch: 88, train_loss: 0.7634, test_loss: 0.9463, test_f1: 0.5449
 epoch: 89, train_loss: 0.7700, test_loss: 0.9524, test_f1: 0.5404
 epoch: 90, train_loss: 0.7642, test_loss: 0.9560, test_f1: 0.5375
 epoch: 91, train_loss: 0.7591, test_loss: 0.9543, test_f1: 0.5402
 epoch: 92, train_loss: 0.7637, test_loss: 0.9563, test_f1: 0.5450
 epoch: 93, train_loss: 0.7726, test_loss: 0.9461, test_f1: 0.5416
 epoch: 94, train_loss: 0.7616, test_loss: 0.9501, test_f1: 0.5473
 epoch: 95, train_loss: 0.7613, test_loss: 0.9547, test_f1: 0.5412
 epoch: 96, train_loss: 0.7549, test_loss: 0.9461, test_f1: 0.5455
 epoch: 97, train_loss: 0.7588, test_loss: 0.9507, test_f1: 0.5463
 epoch: 98, train_loss: 0.7536, test_loss: 0.9697, test_f1: 0.5475
 epoch: 99, train_loss: 0.7649, test_loss: 0.9592, test_f1: 0.5452
##################ITERATION #3 ****************************************
 epoch: 0, train_loss: 1.2919, test_loss: 1.3254, test_f1: 0.2270
 epoch: 1, train_loss: 1.2605, test_loss: 1.3144, test_f1: 0.2270
 epoch: 2, train_loss: 1.2483, test_loss: 1.2864, test_f1: 0.2270
 epoch: 3, train_loss: 1.2367, test_loss: 1.2469, test_f1: 0.2270
 epoch: 4, train_loss: 1.2189, test_loss: 1.2133, test_f1: 0.2938
 epoch: 5, train_loss: 1.2065, test_loss: 1.1879, test_f1: 0.3230
 epoch: 6, train_loss: 1.1959, test_loss: 1.1674, test_f1: 0.3763
 epoch: 7, train_loss: 1.1741, test_loss: 1.1479, test_f1: 0.3968
 epoch: 8, train_loss: 1.1662, test_loss: 1.1296, test_f1: 0.4239
 epoch: 9, train_loss: 1.1520, test_loss: 1.1117, test_f1: 0.4408
 epoch: 10, train_loss: 1.1387, test_loss: 1.0931, test_f1: 0.4591
 epoch: 11, train_loss: 1.1197, test_loss: 1.0765, test_f1: 0.4628
 epoch: 12, train_loss: 1.1001, test_loss: 1.0593, test_f1: 0.4686
 epoch: 13, train_loss: 1.0902, test_loss: 1.0378, test_f1: 0.4783
 epoch: 14, train_loss: 1.0755, test_loss: 1.0259, test_f1: 0.4736
 epoch: 15, train_loss: 1.0558, test_loss: 1.0118, test_f1: 0.4983
 epoch: 16, train_loss: 1.0361, test_loss: 0.9881, test_f1: 0.4921
 epoch: 17, train_loss: 1.0311, test_loss: 0.9801, test_f1: 0.4920
 epoch: 18, train_loss: 1.0151, test_loss: 0.9665, test_f1: 0.5038
 epoch: 19, train_loss: 1.0023, test_loss: 0.9550, test_f1: 0.5021
 epoch: 20, train_loss: 0.9944, test_loss: 0.9418, test_f1: 0.4986
 epoch: 21, train_loss: 0.9790, test_loss: 0.9377, test_f1: 0.5084
 epoch: 22, train_loss: 0.9644, test_loss: 0.9350, test_f1: 0.5095
 epoch: 23, train_loss: 0.9601, test_loss: 0.9281, test_f1: 0.5031
 epoch: 24, train_loss: 0.9436, test_loss: 0.9185, test_f1: 0.5095
 epoch: 25, train_loss: 0.9442, test_loss: 0.9124, test_f1: 0.5091
 epoch: 26, train_loss: 0.9408, test_loss: 0.9151, test_f1: 0.5120
 epoch: 27, train_loss: 0.9230, test_loss: 0.9042, test_f1: 0.5184
 epoch: 28, train_loss: 0.9278, test_loss: 0.9024, test_f1: 0.5241
 epoch: 29, train_loss: 0.9212, test_loss: 0.9043, test_f1: 0.5113
 epoch: 30, train_loss: 0.9082, test_loss: 0.8934, test_f1: 0.5055
 epoch: 31, train_loss: 0.9014, test_loss: 0.8968, test_f1: 0.5233
 epoch: 32, train_loss: 0.8960, test_loss: 0.8987, test_f1: 0.5188
 epoch: 33, train_loss: 0.8868, test_loss: 0.8937, test_f1: 0.5273
 epoch: 34, train_loss: 0.8912, test_loss: 0.9074, test_f1: 0.5205
 epoch: 35, train_loss: 0.8829, test_loss: 0.8948, test_f1: 0.5230
 epoch: 36, train_loss: 0.8756, test_loss: 0.8950, test_f1: 0.5249
 epoch: 37, train_loss: 0.8771, test_loss: 0.8917, test_f1: 0.5218
 epoch: 38, train_loss: 0.8794, test_loss: 0.8888, test_f1: 0.5205
 epoch: 39, train_loss: 0.8680, test_loss: 0.8803, test_f1: 0.5236
 epoch: 40, train_loss: 0.8579, test_loss: 0.8787, test_f1: 0.5491
 epoch: 41, train_loss: 0.8592, test_loss: 0.8956, test_f1: 0.5184
 epoch: 42, train_loss: 0.8617, test_loss: 0.8897, test_f1: 0.5316
 epoch: 43, train_loss: 0.8487, test_loss: 0.8867, test_f1: 0.5401
 epoch: 44, train_loss: 0.8556, test_loss: 0.8928, test_f1: 0.5370
 epoch: 45, train_loss: 0.8476, test_loss: 0.8899, test_f1: 0.5393
 epoch: 46, train_loss: 0.8390, test_loss: 0.8948, test_f1: 0.5241
 epoch: 47, train_loss: 0.8312, test_loss: 0.8893, test_f1: 0.5330
 epoch: 48, train_loss: 0.8310, test_loss: 0.8786, test_f1: 0.5189
 epoch: 49, train_loss: 0.8319, test_loss: 0.8907, test_f1: 0.5277
 epoch: 50, train_loss: 0.8213, test_loss: 0.8915, test_f1: 0.5332
 epoch: 51, train_loss: 0.8260, test_loss: 0.8884, test_f1: 0.5291
 epoch: 52, train_loss: 0.8216, test_loss: 0.8852, test_f1: 0.5308
 epoch: 53, train_loss: 0.8234, test_loss: 0.8868, test_f1: 0.5308
 epoch: 54, train_loss: 0.8214, test_loss: 0.8878, test_f1: 0.5356
 epoch: 55, train_loss: 0.8154, test_loss: 0.8882, test_f1: 0.5335
 epoch: 56, train_loss: 0.8126, test_loss: 0.8987, test_f1: 0.5351
 epoch: 57, train_loss: 0.8160, test_loss: 0.8903, test_f1: 0.5262
 epoch: 58, train_loss: 0.8102, test_loss: 0.8845, test_f1: 0.5324
 epoch: 59, train_loss: 0.8098, test_loss: 0.8902, test_f1: 0.5393
 epoch: 60, train_loss: 0.8132, test_loss: 0.8877, test_f1: 0.5331
 epoch: 61, train_loss: 0.8043, test_loss: 0.8876, test_f1: 0.5367
 epoch: 62, train_loss: 0.8012, test_loss: 0.8959, test_f1: 0.5360
 epoch: 63, train_loss: 0.8018, test_loss: 0.8901, test_f1: 0.5301
 epoch: 64, train_loss: 0.8045, test_loss: 0.9005, test_f1: 0.5484
 epoch: 65, train_loss: 0.8037, test_loss: 0.8957, test_f1: 0.5367
 epoch: 66, train_loss: 0.7925, test_loss: 0.8886, test_f1: 0.5318
 epoch: 67, train_loss: 0.8015, test_loss: 0.8937, test_f1: 0.5337
 epoch: 68, train_loss: 0.7903, test_loss: 0.8950, test_f1: 0.5355
 epoch: 69, train_loss: 0.7885, test_loss: 0.8945, test_f1: 0.5360
 epoch: 70, train_loss: 0.7857, test_loss: 0.8933, test_f1: 0.5304
 epoch: 71, train_loss: 0.7859, test_loss: 0.8964, test_f1: 0.5408
 epoch: 72, train_loss: 0.7896, test_loss: 0.9013, test_f1: 0.5359
 epoch: 73, train_loss: 0.7913, test_loss: 0.9045, test_f1: 0.5316
 epoch: 74, train_loss: 0.7812, test_loss: 0.8937, test_f1: 0.5346
 epoch: 75, train_loss: 0.7887, test_loss: 0.9083, test_f1: 0.5278
 epoch: 76, train_loss: 0.7840, test_loss: 0.9064, test_f1: 0.5359
 epoch: 77, train_loss: 0.7846, test_loss: 0.8995, test_f1: 0.5379
 epoch: 78, train_loss: 0.7801, test_loss: 0.9098, test_f1: 0.5385
 epoch: 79, train_loss: 0.7793, test_loss: 0.9021, test_f1: 0.5352
 epoch: 80, train_loss: 0.7791, test_loss: 0.8938, test_f1: 0.5312
 epoch: 81, train_loss: 0.7729, test_loss: 0.9003, test_f1: 0.5322
 epoch: 82, train_loss: 0.7780, test_loss: 0.8988, test_f1: 0.5405
 epoch: 83, train_loss: 0.7674, test_loss: 0.9047, test_f1: 0.5317
 epoch: 84, train_loss: 0.7720, test_loss: 0.8974, test_f1: 0.5308
 epoch: 85, train_loss: 0.7729, test_loss: 0.9100, test_f1: 0.5352
 epoch: 86, train_loss: 0.7779, test_loss: 0.9052, test_f1: 0.5352
 epoch: 87, train_loss: 0.7663, test_loss: 0.9115, test_f1: 0.5403
 epoch: 88, train_loss: 0.7660, test_loss: 0.9198, test_f1: 0.5386
 epoch: 89, train_loss: 0.7716, test_loss: 0.9197, test_f1: 0.5298
 epoch: 90, train_loss: 0.7570, test_loss: 0.9194, test_f1: 0.5288
 epoch: 91, train_loss: 0.7618, test_loss: 0.9184, test_f1: 0.5301
 epoch: 92, train_loss: 0.7633, test_loss: 0.9184, test_f1: 0.5385
 epoch: 93, train_loss: 0.7601, test_loss: 0.9196, test_f1: 0.5395
 epoch: 94, train_loss: 0.7566, test_loss: 0.9197, test_f1: 0.5389
 epoch: 95, train_loss: 0.7600, test_loss: 0.9149, test_f1: 0.5374
 epoch: 96, train_loss: 0.7541, test_loss: 0.9160, test_f1: 0.5368
 epoch: 97, train_loss: 0.7499, test_loss: 0.9169, test_f1: 0.5430
 epoch: 98, train_loss: 0.7549, test_loss: 0.9179, test_f1: 0.5389
 epoch: 99, train_loss: 0.7574, test_loss: 0.9134, test_f1: 0.5333
##################ITERATION #4 ****************************************
 epoch: 0, train_loss: 1.2932, test_loss: 1.3327, test_f1: 0.2270
 epoch: 1, train_loss: 1.2364, test_loss: 1.3114, test_f1: 0.2270
 epoch: 2, train_loss: 1.2237, test_loss: 1.2759, test_f1: 0.2270
 epoch: 3, train_loss: 1.2006, test_loss: 1.2161, test_f1: 0.2785
 epoch: 4, train_loss: 1.1833, test_loss: 1.1657, test_f1: 0.3702
 epoch: 5, train_loss: 1.1665, test_loss: 1.1338, test_f1: 0.3965
 epoch: 6, train_loss: 1.1501, test_loss: 1.1113, test_f1: 0.4046
 epoch: 7, train_loss: 1.1363, test_loss: 1.0931, test_f1: 0.4145
 epoch: 8, train_loss: 1.1219, test_loss: 1.0748, test_f1: 0.4282
 epoch: 9, train_loss: 1.1036, test_loss: 1.0554, test_f1: 0.4336
 epoch: 10, train_loss: 1.0959, test_loss: 1.0412, test_f1: 0.4431
 epoch: 11, train_loss: 1.0789, test_loss: 1.0296, test_f1: 0.4473
 epoch: 12, train_loss: 1.0660, test_loss: 1.0180, test_f1: 0.4637
 epoch: 13, train_loss: 1.0517, test_loss: 1.0050, test_f1: 0.4733
 epoch: 14, train_loss: 1.0391, test_loss: 0.9968, test_f1: 0.4851
 epoch: 15, train_loss: 1.0317, test_loss: 0.9838, test_f1: 0.4826
 epoch: 16, train_loss: 1.0204, test_loss: 0.9729, test_f1: 0.4850
 epoch: 17, train_loss: 1.0047, test_loss: 0.9638, test_f1: 0.4910
 epoch: 18, train_loss: 0.9940, test_loss: 0.9558, test_f1: 0.4890
 epoch: 19, train_loss: 0.9915, test_loss: 0.9520, test_f1: 0.5011
 epoch: 20, train_loss: 0.9828, test_loss: 0.9454, test_f1: 0.5029
 epoch: 21, train_loss: 0.9769, test_loss: 0.9427, test_f1: 0.4960
 epoch: 22, train_loss: 0.9632, test_loss: 0.9365, test_f1: 0.5007
 epoch: 23, train_loss: 0.9623, test_loss: 0.9311, test_f1: 0.5062
 epoch: 24, train_loss: 0.9556, test_loss: 0.9233, test_f1: 0.5051
 epoch: 25, train_loss: 0.9547, test_loss: 0.9239, test_f1: 0.5099
 epoch: 26, train_loss: 0.9445, test_loss: 0.9192, test_f1: 0.5107
 epoch: 27, train_loss: 0.9375, test_loss: 0.9234, test_f1: 0.5092
 epoch: 28, train_loss: 0.9357, test_loss: 0.9177, test_f1: 0.5051
 epoch: 29, train_loss: 0.9238, test_loss: 0.9199, test_f1: 0.5155
 epoch: 30, train_loss: 0.9229, test_loss: 0.9102, test_f1: 0.5207
 epoch: 31, train_loss: 0.9161, test_loss: 0.9118, test_f1: 0.5286
 epoch: 32, train_loss: 0.9070, test_loss: 0.9061, test_f1: 0.5181
 epoch: 33, train_loss: 0.9098, test_loss: 0.9093, test_f1: 0.5240
 epoch: 34, train_loss: 0.9048, test_loss: 0.9265, test_f1: 0.5266
 epoch: 35, train_loss: 0.8979, test_loss: 0.9074, test_f1: 0.5208
 epoch: 36, train_loss: 0.8883, test_loss: 0.9017, test_f1: 0.5266
 epoch: 37, train_loss: 0.8891, test_loss: 0.9038, test_f1: 0.5404
 epoch: 38, train_loss: 0.8854, test_loss: 0.9118, test_f1: 0.5411
 epoch: 39, train_loss: 0.8806, test_loss: 0.9110, test_f1: 0.5387
 epoch: 40, train_loss: 0.8752, test_loss: 0.9080, test_f1: 0.5364
 epoch: 41, train_loss: 0.8823, test_loss: 0.9103, test_f1: 0.5404
 epoch: 42, train_loss: 0.8601, test_loss: 0.9040, test_f1: 0.5444
 epoch: 43, train_loss: 0.8653, test_loss: 0.8931, test_f1: 0.5350
 epoch: 44, train_loss: 0.8624, test_loss: 0.9109, test_f1: 0.5412
 epoch: 45, train_loss: 0.8535, test_loss: 0.9061, test_f1: 0.5346
 epoch: 46, train_loss: 0.8515, test_loss: 0.8963, test_f1: 0.5450
 epoch: 47, train_loss: 0.8493, test_loss: 0.9059, test_f1: 0.5371
 epoch: 48, train_loss: 0.8456, test_loss: 0.9062, test_f1: 0.5435
 epoch: 49, train_loss: 0.8411, test_loss: 0.9029, test_f1: 0.5442
 epoch: 50, train_loss: 0.8392, test_loss: 0.9087, test_f1: 0.5383
 epoch: 51, train_loss: 0.8298, test_loss: 0.8960, test_f1: 0.5465
 epoch: 52, train_loss: 0.8286, test_loss: 0.8988, test_f1: 0.5500
 epoch: 53, train_loss: 0.8205, test_loss: 0.9005, test_f1: 0.5578
 epoch: 54, train_loss: 0.8263, test_loss: 0.8990, test_f1: 0.5441
 epoch: 55, train_loss: 0.8276, test_loss: 0.9093, test_f1: 0.5429
 epoch: 56, train_loss: 0.8191, test_loss: 0.8999, test_f1: 0.5517
 epoch: 57, train_loss: 0.8211, test_loss: 0.8952, test_f1: 0.5556
 epoch: 58, train_loss: 0.8168, test_loss: 0.8964, test_f1: 0.5400
 epoch: 59, train_loss: 0.8202, test_loss: 0.8965, test_f1: 0.5486
 epoch: 60, train_loss: 0.8197, test_loss: 0.9077, test_f1: 0.5420
 epoch: 61, train_loss: 0.8116, test_loss: 0.9084, test_f1: 0.5317
 epoch: 62, train_loss: 0.8026, test_loss: 0.8994, test_f1: 0.5482
 epoch: 63, train_loss: 0.8061, test_loss: 0.9014, test_f1: 0.5348
 epoch: 64, train_loss: 0.8121, test_loss: 0.8999, test_f1: 0.5425
 epoch: 65, train_loss: 0.8049, test_loss: 0.8912, test_f1: 0.5511
 epoch: 66, train_loss: 0.8076, test_loss: 0.8971, test_f1: 0.5550
 epoch: 67, train_loss: 0.8036, test_loss: 0.8973, test_f1: 0.5446
 epoch: 68, train_loss: 0.8053, test_loss: 0.9161, test_f1: 0.5377
 epoch: 69, train_loss: 0.8020, test_loss: 0.9063, test_f1: 0.5462
 epoch: 70, train_loss: 0.7941, test_loss: 0.8980, test_f1: 0.5493
 epoch: 71, train_loss: 0.7965, test_loss: 0.9025, test_f1: 0.5478
 epoch: 72, train_loss: 0.7916, test_loss: 0.9099, test_f1: 0.5464
 epoch: 73, train_loss: 0.7950, test_loss: 0.8992, test_f1: 0.5496
 epoch: 74, train_loss: 0.7884, test_loss: 0.9056, test_f1: 0.5424
 epoch: 75, train_loss: 0.7937, test_loss: 0.9082, test_f1: 0.5500
 epoch: 76, train_loss: 0.7936, test_loss: 0.8997, test_f1: 0.5569
 epoch: 77, train_loss: 0.7789, test_loss: 0.9166, test_f1: 0.5379
 epoch: 78, train_loss: 0.7842, test_loss: 0.9121, test_f1: 0.5397
 epoch: 79, train_loss: 0.7829, test_loss: 0.8979, test_f1: 0.5513
 epoch: 80, train_loss: 0.7908, test_loss: 0.8980, test_f1: 0.5497
 epoch: 81, train_loss: 0.7785, test_loss: 0.9002, test_f1: 0.5528
 epoch: 82, train_loss: 0.7810, test_loss: 0.9011, test_f1: 0.5415
 epoch: 83, train_loss: 0.7808, test_loss: 0.9079, test_f1: 0.5392
 epoch: 84, train_loss: 0.7752, test_loss: 0.9090, test_f1: 0.5400
 epoch: 85, train_loss: 0.7855, test_loss: 0.9030, test_f1: 0.5476
 epoch: 86, train_loss: 0.7734, test_loss: 0.8991, test_f1: 0.5551
 epoch: 87, train_loss: 0.7747, test_loss: 0.9107, test_f1: 0.5600
 epoch: 88, train_loss: 0.7809, test_loss: 0.9048, test_f1: 0.5473
 epoch: 89, train_loss: 0.7743, test_loss: 0.9133, test_f1: 0.5424
 epoch: 90, train_loss: 0.7703, test_loss: 0.9146, test_f1: 0.5394
 epoch: 91, train_loss: 0.7700, test_loss: 0.9091, test_f1: 0.5446
 epoch: 92, train_loss: 0.7806, test_loss: 0.9095, test_f1: 0.5544
 epoch: 93, train_loss: 0.7679, test_loss: 0.9213, test_f1: 0.5434
 epoch: 94, train_loss: 0.7758, test_loss: 0.9032, test_f1: 0.5405
 epoch: 95, train_loss: 0.7690, test_loss: 0.9122, test_f1: 0.5467
 epoch: 96, train_loss: 0.7658, test_loss: 0.9090, test_f1: 0.5426
 epoch: 97, train_loss: 0.7534, test_loss: 0.9174, test_f1: 0.5451
 epoch: 98, train_loss: 0.7670, test_loss: 0.9121, test_f1: 0.5431
 epoch: 99, train_loss: 0.7535, test_loss: 0.9157, test_f1: 0.5433
##################ITERATION #5 ****************************************
 epoch: 0, train_loss: 1.3056, test_loss: 1.3271, test_f1: 0.2270
 epoch: 1, train_loss: 1.2482, test_loss: 1.3063, test_f1: 0.2270
 epoch: 2, train_loss: 1.2157, test_loss: 1.2836, test_f1: 0.2270
 epoch: 3, train_loss: 1.1961, test_loss: 1.2294, test_f1: 0.2270
 epoch: 4, train_loss: 1.1779, test_loss: 1.1746, test_f1: 0.3183
 epoch: 5, train_loss: 1.1479, test_loss: 1.1298, test_f1: 0.4215
 epoch: 6, train_loss: 1.1480, test_loss: 1.0974, test_f1: 0.4396
 epoch: 7, train_loss: 1.1244, test_loss: 1.0794, test_f1: 0.4410
 epoch: 8, train_loss: 1.1152, test_loss: 1.0647, test_f1: 0.4498
 epoch: 9, train_loss: 1.0980, test_loss: 1.0517, test_f1: 0.4532
 epoch: 10, train_loss: 1.0880, test_loss: 1.0409, test_f1: 0.4594
 epoch: 11, train_loss: 1.0695, test_loss: 1.0310, test_f1: 0.4622
 epoch: 12, train_loss: 1.0615, test_loss: 1.0212, test_f1: 0.4626
 epoch: 13, train_loss: 1.0504, test_loss: 1.0130, test_f1: 0.4720
 epoch: 14, train_loss: 1.0420, test_loss: 1.0008, test_f1: 0.4767
 epoch: 15, train_loss: 1.0306, test_loss: 0.9972, test_f1: 0.4853
 epoch: 16, train_loss: 1.0205, test_loss: 0.9874, test_f1: 0.4912
 epoch: 17, train_loss: 1.0089, test_loss: 0.9791, test_f1: 0.4900
 epoch: 18, train_loss: 1.0070, test_loss: 0.9768, test_f1: 0.4942
 epoch: 19, train_loss: 0.9914, test_loss: 0.9728, test_f1: 0.4949
 epoch: 20, train_loss: 0.9901, test_loss: 0.9695, test_f1: 0.4906
 epoch: 21, train_loss: 0.9820, test_loss: 0.9664, test_f1: 0.4892
 epoch: 22, train_loss: 0.9738, test_loss: 0.9594, test_f1: 0.4852
 epoch: 23, train_loss: 0.9647, test_loss: 0.9572, test_f1: 0.4963
 epoch: 24, train_loss: 0.9606, test_loss: 0.9614, test_f1: 0.4795
 epoch: 25, train_loss: 0.9488, test_loss: 0.9553, test_f1: 0.4811
 epoch: 26, train_loss: 0.9502, test_loss: 0.9519, test_f1: 0.4812
 epoch: 27, train_loss: 0.9392, test_loss: 0.9499, test_f1: 0.4811
 epoch: 28, train_loss: 0.9414, test_loss: 0.9505, test_f1: 0.4854
 epoch: 29, train_loss: 0.9314, test_loss: 0.9465, test_f1: 0.4860
 epoch: 30, train_loss: 0.9224, test_loss: 0.9424, test_f1: 0.4950
 epoch: 31, train_loss: 0.9151, test_loss: 0.9490, test_f1: 0.4910
 epoch: 32, train_loss: 0.9092, test_loss: 0.9458, test_f1: 0.4998
 epoch: 33, train_loss: 0.9049, test_loss: 0.9474, test_f1: 0.4964
 epoch: 34, train_loss: 0.9060, test_loss: 0.9457, test_f1: 0.4986
 epoch: 35, train_loss: 0.9036, test_loss: 0.9363, test_f1: 0.5132
 epoch: 36, train_loss: 0.8967, test_loss: 0.9518, test_f1: 0.5091
 epoch: 37, train_loss: 0.8894, test_loss: 0.9482, test_f1: 0.5121
 epoch: 38, train_loss: 0.8901, test_loss: 0.9269, test_f1: 0.5167
 epoch: 39, train_loss: 0.8830, test_loss: 0.9412, test_f1: 0.5248
 epoch: 40, train_loss: 0.8843, test_loss: 0.9436, test_f1: 0.5231
 epoch: 41, train_loss: 0.8704, test_loss: 0.9502, test_f1: 0.5195
 epoch: 42, train_loss: 0.8671, test_loss: 0.9352, test_f1: 0.5297
 epoch: 43, train_loss: 0.8659, test_loss: 0.9323, test_f1: 0.5324
 epoch: 44, train_loss: 0.8702, test_loss: 0.9538, test_f1: 0.5275
 epoch: 45, train_loss: 0.8604, test_loss: 0.9383, test_f1: 0.5244
 epoch: 46, train_loss: 0.8551, test_loss: 0.9289, test_f1: 0.5342
 epoch: 47, train_loss: 0.8497, test_loss: 0.9332, test_f1: 0.5336
 epoch: 48, train_loss: 0.8522, test_loss: 0.9383, test_f1: 0.5388
 epoch: 49, train_loss: 0.8458, test_loss: 0.9410, test_f1: 0.5303
 epoch: 50, train_loss: 0.8446, test_loss: 0.9453, test_f1: 0.5292
 epoch: 51, train_loss: 0.8435, test_loss: 0.9361, test_f1: 0.5315
 epoch: 52, train_loss: 0.8326, test_loss: 0.9378, test_f1: 0.5325
 epoch: 53, train_loss: 0.8294, test_loss: 0.9353, test_f1: 0.5371
 epoch: 54, train_loss: 0.8246, test_loss: 0.9404, test_f1: 0.5358
 epoch: 55, train_loss: 0.8243, test_loss: 0.9367, test_f1: 0.5390
 epoch: 56, train_loss: 0.8318, test_loss: 0.9347, test_f1: 0.5466
 epoch: 57, train_loss: 0.8186, test_loss: 0.9338, test_f1: 0.5428
 epoch: 58, train_loss: 0.8216, test_loss: 0.9420, test_f1: 0.5388
 epoch: 59, train_loss: 0.8183, test_loss: 0.9341, test_f1: 0.5451
 epoch: 60, train_loss: 0.8213, test_loss: 0.9349, test_f1: 0.5450
 epoch: 61, train_loss: 0.8217, test_loss: 0.9344, test_f1: 0.5462
 epoch: 62, train_loss: 0.8219, test_loss: 0.9362, test_f1: 0.5381
 epoch: 63, train_loss: 0.8252, test_loss: 0.9282, test_f1: 0.5543
 epoch: 64, train_loss: 0.8147, test_loss: 0.9391, test_f1: 0.5448
 epoch: 65, train_loss: 0.8165, test_loss: 0.9446, test_f1: 0.5491
 epoch: 66, train_loss: 0.8105, test_loss: 0.9512, test_f1: 0.5560
 epoch: 67, train_loss: 0.8106, test_loss: 0.9506, test_f1: 0.5487
 epoch: 68, train_loss: 0.8156, test_loss: 0.9339, test_f1: 0.5569
 epoch: 69, train_loss: 0.8092, test_loss: 0.9435, test_f1: 0.5567
 epoch: 70, train_loss: 0.8056, test_loss: 0.9400, test_f1: 0.5537
 epoch: 71, train_loss: 0.8085, test_loss: 0.9388, test_f1: 0.5501
 epoch: 72, train_loss: 0.8021, test_loss: 0.9302, test_f1: 0.5492
 epoch: 73, train_loss: 0.7995, test_loss: 0.9437, test_f1: 0.5469
 epoch: 74, train_loss: 0.8019, test_loss: 0.9403, test_f1: 0.5510
 epoch: 75, train_loss: 0.7975, test_loss: 0.9396, test_f1: 0.5562
 epoch: 76, train_loss: 0.8024, test_loss: 0.9444, test_f1: 0.5562
 epoch: 77, train_loss: 0.8013, test_loss: 0.9470, test_f1: 0.5640
 epoch: 78, train_loss: 0.7972, test_loss: 0.9365, test_f1: 0.5618
 epoch: 79, train_loss: 0.7878, test_loss: 0.9560, test_f1: 0.5543
 epoch: 80, train_loss: 0.7978, test_loss: 0.9390, test_f1: 0.5506
 epoch: 81, train_loss: 0.7919, test_loss: 0.9542, test_f1: 0.5606
 epoch: 82, train_loss: 0.7861, test_loss: 0.9374, test_f1: 0.5560
 epoch: 83, train_loss: 0.7818, test_loss: 0.9403, test_f1: 0.5664
 epoch: 84, train_loss: 0.7829, test_loss: 0.9464, test_f1: 0.5626
 epoch: 85, train_loss: 0.7929, test_loss: 0.9367, test_f1: 0.5739
 epoch: 86, train_loss: 0.7914, test_loss: 0.9485, test_f1: 0.5621
 epoch: 87, train_loss: 0.7830, test_loss: 0.9509, test_f1: 0.5482
 epoch: 88, train_loss: 0.7782, test_loss: 0.9425, test_f1: 0.5548
 epoch: 89, train_loss: 0.7798, test_loss: 0.9561, test_f1: 0.5584
 epoch: 90, train_loss: 0.7811, test_loss: 0.9476, test_f1: 0.5701
 epoch: 91, train_loss: 0.7861, test_loss: 0.9519, test_f1: 0.5629
 epoch: 92, train_loss: 0.7775, test_loss: 0.9562, test_f1: 0.5622
 epoch: 93, train_loss: 0.7717, test_loss: 0.9466, test_f1: 0.5671
 epoch: 94, train_loss: 0.7852, test_loss: 0.9491, test_f1: 0.5700
 epoch: 95, train_loss: 0.7786, test_loss: 0.9533, test_f1: 0.5570
 epoch: 96, train_loss: 0.7803, test_loss: 0.9580, test_f1: 0.5643
 epoch: 97, train_loss: 0.7713, test_loss: 0.9632, test_f1: 0.5596
 epoch: 98, train_loss: 0.7746, test_loss: 0.9488, test_f1: 0.5612
 epoch: 99, train_loss: 0.7734, test_loss: 0.9540, test_f1: 0.5575
##################ITERATION #6 ****************************************
 epoch: 0, train_loss: 1.3386, test_loss: 1.3686, test_f1: 0.2270
 epoch: 1, train_loss: 1.2475, test_loss: 1.3317, test_f1: 0.2270
 epoch: 2, train_loss: 1.2114, test_loss: 1.2762, test_f1: 0.2320
 epoch: 3, train_loss: 1.1901, test_loss: 1.1971, test_f1: 0.3704
 epoch: 4, train_loss: 1.1740, test_loss: 1.1450, test_f1: 0.3841
 epoch: 5, train_loss: 1.1524, test_loss: 1.1029, test_f1: 0.4132
 epoch: 6, train_loss: 1.1340, test_loss: 1.0849, test_f1: 0.4351
 epoch: 7, train_loss: 1.1199, test_loss: 1.0612, test_f1: 0.4515
 epoch: 8, train_loss: 1.0997, test_loss: 1.0429, test_f1: 0.4555
 epoch: 9, train_loss: 1.0864, test_loss: 1.0363, test_f1: 0.4585
 epoch: 10, train_loss: 1.0568, test_loss: 1.0258, test_f1: 0.4633
 epoch: 11, train_loss: 1.0536, test_loss: 1.0160, test_f1: 0.4653
 epoch: 12, train_loss: 1.0513, test_loss: 1.0170, test_f1: 0.4704
 epoch: 13, train_loss: 1.0267, test_loss: 0.9984, test_f1: 0.4816
 epoch: 14, train_loss: 1.0172, test_loss: 0.9894, test_f1: 0.4786
 epoch: 15, train_loss: 1.0098, test_loss: 0.9831, test_f1: 0.4864
 epoch: 16, train_loss: 1.0016, test_loss: 0.9808, test_f1: 0.4864
 epoch: 17, train_loss: 0.9841, test_loss: 0.9807, test_f1: 0.4819
 epoch: 18, train_loss: 0.9885, test_loss: 0.9799, test_f1: 0.4837
 epoch: 19, train_loss: 0.9717, test_loss: 0.9826, test_f1: 0.4979
 epoch: 20, train_loss: 0.9723, test_loss: 0.9695, test_f1: 0.4972
 epoch: 21, train_loss: 0.9554, test_loss: 0.9715, test_f1: 0.4855
 epoch: 22, train_loss: 0.9521, test_loss: 0.9644, test_f1: 0.4981
 epoch: 23, train_loss: 0.9438, test_loss: 0.9636, test_f1: 0.4937
 epoch: 24, train_loss: 0.9523, test_loss: 0.9738, test_f1: 0.4900
 epoch: 25, train_loss: 0.9389, test_loss: 0.9704, test_f1: 0.5236
 epoch: 26, train_loss: 0.9297, test_loss: 0.9596, test_f1: 0.4994
 epoch: 27, train_loss: 0.9343, test_loss: 0.9724, test_f1: 0.5004
 epoch: 28, train_loss: 0.9187, test_loss: 0.9467, test_f1: 0.4908
 epoch: 29, train_loss: 0.9174, test_loss: 0.9477, test_f1: 0.5000
 epoch: 30, train_loss: 0.9085, test_loss: 0.9608, test_f1: 0.5249
 epoch: 31, train_loss: 0.9122, test_loss: 0.9531, test_f1: 0.5416
 epoch: 32, train_loss: 0.9033, test_loss: 0.9678, test_f1: 0.5239
 epoch: 33, train_loss: 0.9132, test_loss: 0.9447, test_f1: 0.5533
 epoch: 34, train_loss: 0.8914, test_loss: 0.9482, test_f1: 0.5487
 epoch: 35, train_loss: 0.8899, test_loss: 0.9499, test_f1: 0.5480
 epoch: 36, train_loss: 0.8931, test_loss: 0.9589, test_f1: 0.5329
 epoch: 37, train_loss: 0.8906, test_loss: 0.9625, test_f1: 0.5395
 epoch: 38, train_loss: 0.8813, test_loss: 0.9609, test_f1: 0.5470
 epoch: 39, train_loss: 0.8825, test_loss: 0.9598, test_f1: 0.5442
 epoch: 40, train_loss: 0.8707, test_loss: 0.9626, test_f1: 0.5433
 epoch: 41, train_loss: 0.8762, test_loss: 0.9524, test_f1: 0.5493
 epoch: 42, train_loss: 0.8726, test_loss: 0.9693, test_f1: 0.5417
 epoch: 43, train_loss: 0.8633, test_loss: 0.9650, test_f1: 0.5430
 epoch: 44, train_loss: 0.8606, test_loss: 0.9600, test_f1: 0.5447
 epoch: 45, train_loss: 0.8642, test_loss: 0.9559, test_f1: 0.5487
 epoch: 46, train_loss: 0.8514, test_loss: 0.9599, test_f1: 0.5459
 epoch: 47, train_loss: 0.8510, test_loss: 0.9726, test_f1: 0.5370
 epoch: 48, train_loss: 0.8514, test_loss: 0.9654, test_f1: 0.5528
 epoch: 49, train_loss: 0.8438, test_loss: 0.9775, test_f1: 0.5408
 epoch: 50, train_loss: 0.8434, test_loss: 0.9576, test_f1: 0.5326
 epoch: 51, train_loss: 0.8508, test_loss: 0.9756, test_f1: 0.5267
 epoch: 52, train_loss: 0.8333, test_loss: 0.9740, test_f1: 0.5425
 epoch: 53, train_loss: 0.8411, test_loss: 0.9760, test_f1: 0.5297
 epoch: 54, train_loss: 0.8317, test_loss: 0.9829, test_f1: 0.5381
 epoch: 55, train_loss: 0.8305, test_loss: 0.9693, test_f1: 0.5369
 epoch: 56, train_loss: 0.8379, test_loss: 0.9680, test_f1: 0.5342
 epoch: 57, train_loss: 0.8279, test_loss: 0.9728, test_f1: 0.5358
 epoch: 58, train_loss: 0.8343, test_loss: 0.9684, test_f1: 0.5306
 epoch: 59, train_loss: 0.8299, test_loss: 0.9767, test_f1: 0.5322
 epoch: 60, train_loss: 0.8281, test_loss: 0.9800, test_f1: 0.5357
 epoch: 61, train_loss: 0.8426, test_loss: 0.9777, test_f1: 0.5378
 epoch: 62, train_loss: 0.8185, test_loss: 0.9745, test_f1: 0.5333
 epoch: 63, train_loss: 0.8254, test_loss: 0.9769, test_f1: 0.5344
 epoch: 64, train_loss: 0.8200, test_loss: 0.9865, test_f1: 0.5329
 epoch: 65, train_loss: 0.8189, test_loss: 0.9659, test_f1: 0.5373
 epoch: 66, train_loss: 0.8201, test_loss: 0.9805, test_f1: 0.5307
 epoch: 67, train_loss: 0.8268, test_loss: 0.9732, test_f1: 0.5320
 epoch: 68, train_loss: 0.8191, test_loss: 0.9744, test_f1: 0.5314
 epoch: 69, train_loss: 0.8182, test_loss: 0.9684, test_f1: 0.5355
 epoch: 70, train_loss: 0.8181, test_loss: 0.9778, test_f1: 0.5280
 epoch: 71, train_loss: 0.8163, test_loss: 0.9810, test_f1: 0.5329
 epoch: 72, train_loss: 0.8181, test_loss: 0.9838, test_f1: 0.5374
 epoch: 73, train_loss: 0.8162, test_loss: 0.9739, test_f1: 0.5313
 epoch: 74, train_loss: 0.8110, test_loss: 0.9757, test_f1: 0.5374
 epoch: 75, train_loss: 0.8047, test_loss: 0.9748, test_f1: 0.5373
 epoch: 76, train_loss: 0.8187, test_loss: 0.9769, test_f1: 0.5286
 epoch: 77, train_loss: 0.8041, test_loss: 0.9809, test_f1: 0.5267
 epoch: 78, train_loss: 0.8083, test_loss: 0.9895, test_f1: 0.5306
 epoch: 79, train_loss: 0.8064, test_loss: 0.9841, test_f1: 0.5334
 epoch: 80, train_loss: 0.8033, test_loss: 0.9815, test_f1: 0.5266
 epoch: 81, train_loss: 0.8041, test_loss: 0.9836, test_f1: 0.5229
 epoch: 82, train_loss: 0.8021, test_loss: 0.9928, test_f1: 0.5255
 epoch: 83, train_loss: 0.8132, test_loss: 0.9888, test_f1: 0.5302
 epoch: 84, train_loss: 0.8023, test_loss: 0.9770, test_f1: 0.5287
 epoch: 85, train_loss: 0.7968, test_loss: 0.9774, test_f1: 0.5303
 epoch: 86, train_loss: 0.7938, test_loss: 0.9781, test_f1: 0.5347
 epoch: 87, train_loss: 0.7886, test_loss: 0.9771, test_f1: 0.5431
 epoch: 88, train_loss: 0.7942, test_loss: 0.9924, test_f1: 0.5363
 epoch: 89, train_loss: 0.7988, test_loss: 0.9835, test_f1: 0.5357
 epoch: 90, train_loss: 0.7991, test_loss: 0.9839, test_f1: 0.5261
 epoch: 91, train_loss: 0.7944, test_loss: 0.9758, test_f1: 0.5301
 epoch: 92, train_loss: 0.7914, test_loss: 0.9943, test_f1: 0.5242
 epoch: 93, train_loss: 0.7962, test_loss: 1.0001, test_f1: 0.5257
 epoch: 94, train_loss: 0.7928, test_loss: 0.9886, test_f1: 0.5250
 epoch: 95, train_loss: 0.7944, test_loss: 0.9906, test_f1: 0.5356
 epoch: 96, train_loss: 0.7899, test_loss: 0.9941, test_f1: 0.5276
 epoch: 97, train_loss: 0.7850, test_loss: 0.9928, test_f1: 0.5308
 epoch: 98, train_loss: 0.7873, test_loss: 0.9942, test_f1: 0.5363
 epoch: 99, train_loss: 0.7874, test_loss: 0.9925, test_f1: 0.5362
##################ITERATION #7 ****************************************
 epoch: 0, train_loss: 1.3077, test_loss: 1.3286, test_f1: 0.2270
 epoch: 1, train_loss: 1.2267, test_loss: 1.3094, test_f1: 0.2270
 epoch: 2, train_loss: 1.2013, test_loss: 1.2855, test_f1: 0.2320
 epoch: 3, train_loss: 1.1804, test_loss: 1.2516, test_f1: 0.3318
 epoch: 4, train_loss: 1.1644, test_loss: 1.1887, test_f1: 0.3507
 epoch: 5, train_loss: 1.1447, test_loss: 1.1246, test_f1: 0.3954
 epoch: 6, train_loss: 1.1245, test_loss: 1.0858, test_f1: 0.4353
 epoch: 7, train_loss: 1.1166, test_loss: 1.0593, test_f1: 0.4572
 epoch: 8, train_loss: 1.0975, test_loss: 1.0398, test_f1: 0.4422
 epoch: 9, train_loss: 1.0811, test_loss: 1.0294, test_f1: 0.4451
 epoch: 10, train_loss: 1.0662, test_loss: 1.0133, test_f1: 0.4508
 epoch: 11, train_loss: 1.0530, test_loss: 0.9999, test_f1: 0.4466
 epoch: 12, train_loss: 1.0410, test_loss: 0.9870, test_f1: 0.4670
 epoch: 13, train_loss: 1.0379, test_loss: 0.9818, test_f1: 0.4738
 epoch: 14, train_loss: 1.0212, test_loss: 0.9712, test_f1: 0.4849
 epoch: 15, train_loss: 1.0212, test_loss: 0.9654, test_f1: 0.4930
 epoch: 16, train_loss: 1.0152, test_loss: 0.9606, test_f1: 0.4943
 epoch: 17, train_loss: 1.0012, test_loss: 0.9551, test_f1: 0.4973
 epoch: 18, train_loss: 0.9933, test_loss: 0.9497, test_f1: 0.5023
 epoch: 19, train_loss: 0.9833, test_loss: 0.9455, test_f1: 0.5087
 epoch: 20, train_loss: 0.9771, test_loss: 0.9409, test_f1: 0.5073
 epoch: 21, train_loss: 0.9741, test_loss: 0.9393, test_f1: 0.5083
 epoch: 22, train_loss: 0.9521, test_loss: 0.9357, test_f1: 0.5085
 epoch: 23, train_loss: 0.9583, test_loss: 0.9227, test_f1: 0.5192
 epoch: 24, train_loss: 0.9567, test_loss: 0.9282, test_f1: 0.5145
 epoch: 25, train_loss: 0.9407, test_loss: 0.9238, test_f1: 0.5101
 epoch: 26, train_loss: 0.9392, test_loss: 0.9246, test_f1: 0.5098
 epoch: 27, train_loss: 0.9343, test_loss: 0.9285, test_f1: 0.5074
 epoch: 28, train_loss: 0.9341, test_loss: 0.9203, test_f1: 0.5275
 epoch: 29, train_loss: 0.9238, test_loss: 0.9213, test_f1: 0.5179
 epoch: 30, train_loss: 0.9189, test_loss: 0.9185, test_f1: 0.5159
 epoch: 31, train_loss: 0.9225, test_loss: 0.9214, test_f1: 0.5112
 epoch: 32, train_loss: 0.9088, test_loss: 0.9219, test_f1: 0.5048
 epoch: 33, train_loss: 0.9093, test_loss: 0.9157, test_f1: 0.5198
 epoch: 34, train_loss: 0.8942, test_loss: 0.9361, test_f1: 0.5075
 epoch: 35, train_loss: 0.8902, test_loss: 0.9088, test_f1: 0.5178
 epoch: 36, train_loss: 0.8933, test_loss: 0.9218, test_f1: 0.5260
 epoch: 37, train_loss: 0.8873, test_loss: 0.9212, test_f1: 0.5285
 epoch: 38, train_loss: 0.8816, test_loss: 0.9084, test_f1: 0.5217
 epoch: 39, train_loss: 0.8799, test_loss: 0.9271, test_f1: 0.5246
 epoch: 40, train_loss: 0.8719, test_loss: 0.9068, test_f1: 0.5331
 epoch: 41, train_loss: 0.8719, test_loss: 0.9151, test_f1: 0.5283
 epoch: 42, train_loss: 0.8685, test_loss: 0.9176, test_f1: 0.5287
 epoch: 43, train_loss: 0.8579, test_loss: 0.9256, test_f1: 0.5218
 epoch: 44, train_loss: 0.8564, test_loss: 0.8889, test_f1: 0.5287
 epoch: 45, train_loss: 0.8526, test_loss: 0.9236, test_f1: 0.5209
 epoch: 46, train_loss: 0.8543, test_loss: 0.9002, test_f1: 0.5415
 epoch: 47, train_loss: 0.8429, test_loss: 0.9078, test_f1: 0.5537
 epoch: 48, train_loss: 0.8467, test_loss: 1.0055, test_f1: 0.4866
 epoch: 49, train_loss: 0.8499, test_loss: 0.9277, test_f1: 0.5548
 epoch: 50, train_loss: 0.8405, test_loss: 0.9463, test_f1: 0.5252
 epoch: 51, train_loss: 0.8397, test_loss: 0.9422, test_f1: 0.5300
 epoch: 52, train_loss: 0.8339, test_loss: 0.9449, test_f1: 0.5256
 epoch: 53, train_loss: 0.8238, test_loss: 0.9230, test_f1: 0.5237
 epoch: 54, train_loss: 0.8328, test_loss: 0.9386, test_f1: 0.5235
 epoch: 55, train_loss: 0.8326, test_loss: 0.9532, test_f1: 0.5345
 epoch: 56, train_loss: 0.8290, test_loss: 0.9294, test_f1: 0.5423
 epoch: 57, train_loss: 0.8220, test_loss: 0.9393, test_f1: 0.5479
 epoch: 58, train_loss: 0.8255, test_loss: 0.9672, test_f1: 0.5466
 epoch: 59, train_loss: 0.8173, test_loss: 0.9328, test_f1: 0.5464
 epoch: 60, train_loss: 0.8206, test_loss: 0.9416, test_f1: 0.5601
 epoch: 61, train_loss: 0.8138, test_loss: 0.9302, test_f1: 0.5413
 epoch: 62, train_loss: 0.8116, test_loss: 0.9307, test_f1: 0.5271
 epoch: 63, train_loss: 0.8154, test_loss: 0.9299, test_f1: 0.5365
 epoch: 64, train_loss: 0.8070, test_loss: 0.9356, test_f1: 0.5487
 epoch: 65, train_loss: 0.8168, test_loss: 0.9266, test_f1: 0.5406
 epoch: 66, train_loss: 0.8034, test_loss: 0.9246, test_f1: 0.5504
 epoch: 67, train_loss: 0.8013, test_loss: 0.9293, test_f1: 0.5435
 epoch: 68, train_loss: 0.8060, test_loss: 0.9432, test_f1: 0.5510
 epoch: 69, train_loss: 0.8000, test_loss: 0.9369, test_f1: 0.5376
 epoch: 70, train_loss: 0.8030, test_loss: 0.9532, test_f1: 0.5192
 epoch: 71, train_loss: 0.8042, test_loss: 0.9551, test_f1: 0.5164
 epoch: 72, train_loss: 0.8051, test_loss: 0.9646, test_f1: 0.5208
 epoch: 73, train_loss: 0.8014, test_loss: 0.9765, test_f1: 0.5389
 epoch: 74, train_loss: 0.7946, test_loss: 0.9495, test_f1: 0.5484
 epoch: 75, train_loss: 0.7970, test_loss: 0.9372, test_f1: 0.5491
 epoch: 76, train_loss: 0.7931, test_loss: 0.9676, test_f1: 0.5270
 epoch: 77, train_loss: 0.7898, test_loss: 0.9717, test_f1: 0.5345
 epoch: 78, train_loss: 0.7943, test_loss: 0.9766, test_f1: 0.5275
 epoch: 79, train_loss: 0.7850, test_loss: 0.9498, test_f1: 0.5328
 epoch: 80, train_loss: 0.7931, test_loss: 0.9649, test_f1: 0.5329
 epoch: 81, train_loss: 0.7820, test_loss: 0.9901, test_f1: 0.5209
 epoch: 82, train_loss: 0.7920, test_loss: 0.9530, test_f1: 0.5171
 epoch: 83, train_loss: 0.7904, test_loss: 0.9731, test_f1: 0.5356
 epoch: 84, train_loss: 0.7767, test_loss: 0.9872, test_f1: 0.5221
 epoch: 85, train_loss: 0.7853, test_loss: 0.9746, test_f1: 0.5225
 epoch: 86, train_loss: 0.7822, test_loss: 0.9618, test_f1: 0.5248
 epoch: 87, train_loss: 0.7808, test_loss: 0.9620, test_f1: 0.5323
 epoch: 88, train_loss: 0.7829, test_loss: 0.9691, test_f1: 0.5397
 epoch: 89, train_loss: 0.7725, test_loss: 0.9819, test_f1: 0.5260
 epoch: 90, train_loss: 0.7838, test_loss: 0.9972, test_f1: 0.5233
 epoch: 91, train_loss: 0.7743, test_loss: 0.9685, test_f1: 0.5326
 epoch: 92, train_loss: 0.7751, test_loss: 0.9878, test_f1: 0.5221
 epoch: 93, train_loss: 0.7728, test_loss: 0.9512, test_f1: 0.5335
 epoch: 94, train_loss: 0.7758, test_loss: 0.9491, test_f1: 0.5264
 epoch: 95, train_loss: 0.7721, test_loss: 0.9634, test_f1: 0.5297
 epoch: 96, train_loss: 0.7695, test_loss: 0.9707, test_f1: 0.5502
 epoch: 97, train_loss: 0.7703, test_loss: 0.9478, test_f1: 0.5532
 epoch: 98, train_loss: 0.7666, test_loss: 0.9553, test_f1: 0.5277
 epoch: 99, train_loss: 0.7599, test_loss: 0.9347, test_f1: 0.5330
##################ITERATION #8 ****************************************
 epoch: 0, train_loss: 1.3408, test_loss: 1.3152, test_f1: 0.2270
 epoch: 1, train_loss: 1.2306, test_loss: 1.3068, test_f1: 0.2270
 epoch: 2, train_loss: 1.2126, test_loss: 1.2703, test_f1: 0.3028
 epoch: 3, train_loss: 1.1895, test_loss: 1.2318, test_f1: 0.3049
 epoch: 4, train_loss: 1.1566, test_loss: 1.1671, test_f1: 0.3852
 epoch: 5, train_loss: 1.1415, test_loss: 1.1149, test_f1: 0.4278
 epoch: 6, train_loss: 1.1226, test_loss: 1.0759, test_f1: 0.4594
 epoch: 7, train_loss: 1.1051, test_loss: 1.0587, test_f1: 0.4699
 epoch: 8, train_loss: 1.0852, test_loss: 1.0462, test_f1: 0.4819
 epoch: 9, train_loss: 1.0701, test_loss: 1.0346, test_f1: 0.4765
 epoch: 10, train_loss: 1.0636, test_loss: 1.0165, test_f1: 0.4821
 epoch: 11, train_loss: 1.0392, test_loss: 0.9941, test_f1: 0.5005
 epoch: 12, train_loss: 1.0250, test_loss: 0.9874, test_f1: 0.4966
 epoch: 13, train_loss: 1.0183, test_loss: 0.9852, test_f1: 0.4982
 epoch: 14, train_loss: 1.0089, test_loss: 0.9791, test_f1: 0.5067
 epoch: 15, train_loss: 1.0015, test_loss: 0.9775, test_f1: 0.5034
 epoch: 16, train_loss: 0.9902, test_loss: 0.9689, test_f1: 0.5070
 epoch: 17, train_loss: 0.9771, test_loss: 0.9681, test_f1: 0.5018
 epoch: 18, train_loss: 0.9671, test_loss: 0.9561, test_f1: 0.5139
 epoch: 19, train_loss: 0.9634, test_loss: 0.9510, test_f1: 0.5095
 epoch: 20, train_loss: 0.9592, test_loss: 0.9538, test_f1: 0.5187
 epoch: 21, train_loss: 0.9433, test_loss: 0.9510, test_f1: 0.5165
 epoch: 22, train_loss: 0.9410, test_loss: 0.9479, test_f1: 0.5161
 epoch: 23, train_loss: 0.9320, test_loss: 0.9506, test_f1: 0.5139
 epoch: 24, train_loss: 0.9158, test_loss: 0.9495, test_f1: 0.5122
 epoch: 25, train_loss: 0.9222, test_loss: 0.9530, test_f1: 0.5172
 epoch: 26, train_loss: 0.9178, test_loss: 0.9600, test_f1: 0.4997
 epoch: 27, train_loss: 0.9048, test_loss: 0.9359, test_f1: 0.5180
 epoch: 28, train_loss: 0.9069, test_loss: 0.9459, test_f1: 0.5129
 epoch: 29, train_loss: 0.9017, test_loss: 0.9541, test_f1: 0.5037
 epoch: 30, train_loss: 0.8818, test_loss: 0.9420, test_f1: 0.5128
 epoch: 31, train_loss: 0.8833, test_loss: 0.9448, test_f1: 0.5114
 epoch: 32, train_loss: 0.8816, test_loss: 0.9513, test_f1: 0.5103
 epoch: 33, train_loss: 0.8709, test_loss: 0.9482, test_f1: 0.5059
 epoch: 34, train_loss: 0.8690, test_loss: 0.9553, test_f1: 0.5109
 epoch: 35, train_loss: 0.8632, test_loss: 0.9409, test_f1: 0.5128
 epoch: 36, train_loss: 0.8646, test_loss: 0.9619, test_f1: 0.5165
 epoch: 37, train_loss: 0.8661, test_loss: 0.9487, test_f1: 0.5149
 epoch: 38, train_loss: 0.8531, test_loss: 0.9330, test_f1: 0.5171
 epoch: 39, train_loss: 0.8530, test_loss: 0.9598, test_f1: 0.5182
 epoch: 40, train_loss: 0.8508, test_loss: 0.9504, test_f1: 0.5312
 epoch: 41, train_loss: 0.8467, test_loss: 0.9912, test_f1: 0.5157
 epoch: 42, train_loss: 0.8379, test_loss: 0.9616, test_f1: 0.5174
 epoch: 43, train_loss: 0.8481, test_loss: 0.9641, test_f1: 0.5226
 epoch: 44, train_loss: 0.8395, test_loss: 0.9788, test_f1: 0.5151
 epoch: 45, train_loss: 0.8376, test_loss: 0.9619, test_f1: 0.5142
 epoch: 46, train_loss: 0.8309, test_loss: 0.9727, test_f1: 0.5109
 epoch: 47, train_loss: 0.8285, test_loss: 0.9658, test_f1: 0.5199
 epoch: 48, train_loss: 0.8311, test_loss: 0.9615, test_f1: 0.5248
 epoch: 49, train_loss: 0.8238, test_loss: 0.9775, test_f1: 0.5306
 epoch: 50, train_loss: 0.8175, test_loss: 0.9791, test_f1: 0.5287
 epoch: 51, train_loss: 0.8184, test_loss: 0.9786, test_f1: 0.5317
 epoch: 52, train_loss: 0.8170, test_loss: 0.9758, test_f1: 0.5341
 epoch: 53, train_loss: 0.8133, test_loss: 0.9795, test_f1: 0.5352
 epoch: 54, train_loss: 0.8097, test_loss: 0.9850, test_f1: 0.5353
 epoch: 55, train_loss: 0.8068, test_loss: 0.9748, test_f1: 0.5358
 epoch: 56, train_loss: 0.8118, test_loss: 0.9749, test_f1: 0.5384
 epoch: 57, train_loss: 0.8024, test_loss: 0.9813, test_f1: 0.5414
 epoch: 58, train_loss: 0.8017, test_loss: 0.9752, test_f1: 0.5507
 epoch: 59, train_loss: 0.7975, test_loss: 0.9745, test_f1: 0.5415
 epoch: 60, train_loss: 0.7986, test_loss: 0.9882, test_f1: 0.5379
 epoch: 61, train_loss: 0.8007, test_loss: 0.9743, test_f1: 0.5460
 epoch: 62, train_loss: 0.7950, test_loss: 0.9826, test_f1: 0.5418
 epoch: 63, train_loss: 0.7864, test_loss: 0.9948, test_f1: 0.5391
 epoch: 64, train_loss: 0.7908, test_loss: 0.9870, test_f1: 0.5454
 epoch: 65, train_loss: 0.7918, test_loss: 0.9904, test_f1: 0.5503
 epoch: 66, train_loss: 0.7934, test_loss: 1.0015, test_f1: 0.5479
 epoch: 67, train_loss: 0.7897, test_loss: 0.9967, test_f1: 0.5480
 epoch: 68, train_loss: 0.7877, test_loss: 0.9922, test_f1: 0.5462
 epoch: 69, train_loss: 0.7883, test_loss: 0.9921, test_f1: 0.5484
 epoch: 70, train_loss: 0.7894, test_loss: 1.0029, test_f1: 0.5431
 epoch: 71, train_loss: 0.7922, test_loss: 1.0042, test_f1: 0.5486
 epoch: 72, train_loss: 0.7867, test_loss: 0.9982, test_f1: 0.5492
 epoch: 73, train_loss: 0.7854, test_loss: 1.0129, test_f1: 0.5498
 epoch: 74, train_loss: 0.7935, test_loss: 1.0073, test_f1: 0.5464
 epoch: 75, train_loss: 0.7782, test_loss: 1.0105, test_f1: 0.5451
 epoch: 76, train_loss: 0.7802, test_loss: 1.0086, test_f1: 0.5468
 epoch: 77, train_loss: 0.7675, test_loss: 1.0149, test_f1: 0.5512
 epoch: 78, train_loss: 0.7837, test_loss: 1.0055, test_f1: 0.5497
 epoch: 79, train_loss: 0.7742, test_loss: 1.0064, test_f1: 0.5531
 epoch: 80, train_loss: 0.7727, test_loss: 1.0049, test_f1: 0.5483
 epoch: 81, train_loss: 0.7743, test_loss: 1.0198, test_f1: 0.5531
 epoch: 82, train_loss: 0.7755, test_loss: 1.0005, test_f1: 0.5568
 epoch: 83, train_loss: 0.7714, test_loss: 1.0069, test_f1: 0.5604
 epoch: 84, train_loss: 0.7705, test_loss: 1.0083, test_f1: 0.5570
 epoch: 85, train_loss: 0.7819, test_loss: 1.0092, test_f1: 0.5544
 epoch: 86, train_loss: 0.7762, test_loss: 1.0056, test_f1: 0.5524
 epoch: 87, train_loss: 0.7659, test_loss: 1.0083, test_f1: 0.5639
 epoch: 88, train_loss: 0.7700, test_loss: 1.0095, test_f1: 0.5557
 epoch: 89, train_loss: 0.7743, test_loss: 1.0137, test_f1: 0.5611
 epoch: 90, train_loss: 0.7657, test_loss: 1.0020, test_f1: 0.5651
 epoch: 91, train_loss: 0.7606, test_loss: 1.0074, test_f1: 0.5653
 epoch: 92, train_loss: 0.7661, test_loss: 1.0185, test_f1: 0.5566
 epoch: 93, train_loss: 0.7611, test_loss: 1.0250, test_f1: 0.5570
 epoch: 94, train_loss: 0.7587, test_loss: 1.0095, test_f1: 0.5650
 epoch: 95, train_loss: 0.7575, test_loss: 1.0098, test_f1: 0.5638
 epoch: 96, train_loss: 0.7482, test_loss: 1.0149, test_f1: 0.5655
 epoch: 97, train_loss: 0.7573, test_loss: 1.0206, test_f1: 0.5687
 epoch: 98, train_loss: 0.7513, test_loss: 1.0099, test_f1: 0.5652
 epoch: 99, train_loss: 0.7559, test_loss: 1.0057, test_f1: 0.5727
##################ITERATION #9 ****************************************
 epoch: 0, train_loss: 1.3072, test_loss: 1.3083, test_f1: 0.2270
 epoch: 1, train_loss: 1.2082, test_loss: 1.2939, test_f1: 0.3359
 epoch: 2, train_loss: 1.1815, test_loss: 1.2539, test_f1: 0.2870
 epoch: 3, train_loss: 1.1574, test_loss: 1.1657, test_f1: 0.3785
 epoch: 4, train_loss: 1.1327, test_loss: 1.1331, test_f1: 0.4007
 epoch: 5, train_loss: 1.1065, test_loss: 1.1163, test_f1: 0.4258
 epoch: 6, train_loss: 1.1038, test_loss: 1.0707, test_f1: 0.4491
 epoch: 7, train_loss: 1.0794, test_loss: 1.0314, test_f1: 0.4721
 epoch: 8, train_loss: 1.0650, test_loss: 1.0172, test_f1: 0.4718
 epoch: 9, train_loss: 1.0484, test_loss: 1.0138, test_f1: 0.4595
 epoch: 10, train_loss: 1.0442, test_loss: 1.0050, test_f1: 0.4795
 epoch: 11, train_loss: 1.0273, test_loss: 0.9985, test_f1: 0.4821
 epoch: 12, train_loss: 1.0196, test_loss: 0.9832, test_f1: 0.4854
 epoch: 13, train_loss: 1.0115, test_loss: 0.9796, test_f1: 0.4942
 epoch: 14, train_loss: 0.9988, test_loss: 0.9748, test_f1: 0.4945
 epoch: 15, train_loss: 0.9924, test_loss: 0.9743, test_f1: 0.4991
 epoch: 16, train_loss: 0.9846, test_loss: 0.9631, test_f1: 0.5013
 epoch: 17, train_loss: 0.9732, test_loss: 0.9589, test_f1: 0.4959
 epoch: 18, train_loss: 0.9662, test_loss: 0.9547, test_f1: 0.5088
 epoch: 19, train_loss: 0.9679, test_loss: 0.9470, test_f1: 0.5078
 epoch: 20, train_loss: 0.9518, test_loss: 0.9537, test_f1: 0.5113
 epoch: 21, train_loss: 0.9509, test_loss: 0.9466, test_f1: 0.5042
 epoch: 22, train_loss: 0.9397, test_loss: 0.9389, test_f1: 0.5131
 epoch: 23, train_loss: 0.9409, test_loss: 0.9468, test_f1: 0.5065
 epoch: 24, train_loss: 0.9343, test_loss: 0.9418, test_f1: 0.4990
 epoch: 25, train_loss: 0.9343, test_loss: 0.9458, test_f1: 0.5059
 epoch: 26, train_loss: 0.9307, test_loss: 0.9396, test_f1: 0.5056
 epoch: 27, train_loss: 0.9180, test_loss: 0.9355, test_f1: 0.5131
 epoch: 28, train_loss: 0.9185, test_loss: 0.9400, test_f1: 0.5085
 epoch: 29, train_loss: 0.9177, test_loss: 0.9317, test_f1: 0.5110
 epoch: 30, train_loss: 0.9117, test_loss: 0.9308, test_f1: 0.5086
 epoch: 31, train_loss: 0.9032, test_loss: 0.9326, test_f1: 0.5144
 epoch: 32, train_loss: 0.8997, test_loss: 0.9416, test_f1: 0.5096
 epoch: 33, train_loss: 0.8972, test_loss: 0.9337, test_f1: 0.5200
 epoch: 34, train_loss: 0.8973, test_loss: 0.9282, test_f1: 0.5207
 epoch: 35, train_loss: 0.8883, test_loss: 0.9310, test_f1: 0.5186
 epoch: 36, train_loss: 0.8926, test_loss: 0.9268, test_f1: 0.5192
 epoch: 37, train_loss: 0.8803, test_loss: 0.9143, test_f1: 0.5206
 epoch: 38, train_loss: 0.8796, test_loss: 0.9292, test_f1: 0.5186
 epoch: 39, train_loss: 0.8733, test_loss: 0.9352, test_f1: 0.5184
 epoch: 40, train_loss: 0.8660, test_loss: 0.9302, test_f1: 0.5188
 epoch: 41, train_loss: 0.8712, test_loss: 0.9168, test_f1: 0.5148
 epoch: 42, train_loss: 0.8670, test_loss: 0.9186, test_f1: 0.5242
 epoch: 43, train_loss: 0.8577, test_loss: 0.9276, test_f1: 0.5185
 epoch: 44, train_loss: 0.8616, test_loss: 0.9218, test_f1: 0.5244
 epoch: 45, train_loss: 0.8682, test_loss: 0.9175, test_f1: 0.5276
 epoch: 46, train_loss: 0.8540, test_loss: 0.9272, test_f1: 0.5278
 epoch: 47, train_loss: 0.8541, test_loss: 0.9256, test_f1: 0.5216
 epoch: 48, train_loss: 0.8379, test_loss: 0.9241, test_f1: 0.5233
 epoch: 49, train_loss: 0.8404, test_loss: 0.9226, test_f1: 0.5239
 epoch: 50, train_loss: 0.8455, test_loss: 0.9241, test_f1: 0.5248
 epoch: 51, train_loss: 0.8456, test_loss: 0.9232, test_f1: 0.5242
 epoch: 52, train_loss: 0.8387, test_loss: 0.9220, test_f1: 0.5265
 epoch: 53, train_loss: 0.8378, test_loss: 0.9210, test_f1: 0.5326
 epoch: 54, train_loss: 0.8363, test_loss: 0.9209, test_f1: 0.5295
 epoch: 55, train_loss: 0.8269, test_loss: 0.9205, test_f1: 0.5275
 epoch: 56, train_loss: 0.8360, test_loss: 0.9214, test_f1: 0.5337
 epoch: 57, train_loss: 0.8354, test_loss: 0.9201, test_f1: 0.5243
 epoch: 58, train_loss: 0.8294, test_loss: 0.9185, test_f1: 0.5244
 epoch: 59, train_loss: 0.8241, test_loss: 0.9228, test_f1: 0.5269
 epoch: 60, train_loss: 0.8197, test_loss: 0.9227, test_f1: 0.5243
 epoch: 61, train_loss: 0.8293, test_loss: 0.9225, test_f1: 0.5266
 epoch: 62, train_loss: 0.8200, test_loss: 0.9252, test_f1: 0.5246
 epoch: 63, train_loss: 0.8202, test_loss: 0.9199, test_f1: 0.5257
 epoch: 64, train_loss: 0.8202, test_loss: 0.9257, test_f1: 0.5209
 epoch: 65, train_loss: 0.8152, test_loss: 0.9298, test_f1: 0.5227
 epoch: 66, train_loss: 0.8198, test_loss: 0.9223, test_f1: 0.5323
 epoch: 67, train_loss: 0.8153, test_loss: 0.9181, test_f1: 0.5265
 epoch: 68, train_loss: 0.8144, test_loss: 0.9264, test_f1: 0.5231
 epoch: 69, train_loss: 0.8175, test_loss: 0.9244, test_f1: 0.5261
 epoch: 70, train_loss: 0.8043, test_loss: 0.9205, test_f1: 0.5271
 epoch: 71, train_loss: 0.8051, test_loss: 0.9168, test_f1: 0.5314
 epoch: 72, train_loss: 0.8054, test_loss: 0.9238, test_f1: 0.5281
 epoch: 73, train_loss: 0.8106, test_loss: 0.9206, test_f1: 0.5229
 epoch: 74, train_loss: 0.8076, test_loss: 0.9289, test_f1: 0.5260
 epoch: 75, train_loss: 0.8053, test_loss: 0.9263, test_f1: 0.5296
 epoch: 76, train_loss: 0.8028, test_loss: 0.9199, test_f1: 0.5284
 epoch: 77, train_loss: 0.8026, test_loss: 0.9247, test_f1: 0.5218
 epoch: 78, train_loss: 0.8045, test_loss: 0.9223, test_f1: 0.5242
 epoch: 79, train_loss: 0.7925, test_loss: 0.9296, test_f1: 0.5259
 epoch: 80, train_loss: 0.7920, test_loss: 0.9261, test_f1: 0.5276
 epoch: 81, train_loss: 0.7959, test_loss: 0.9200, test_f1: 0.5294
 epoch: 82, train_loss: 0.7950, test_loss: 0.9225, test_f1: 0.5302
 epoch: 83, train_loss: 0.7883, test_loss: 0.9207, test_f1: 0.5274
 epoch: 84, train_loss: 0.7914, test_loss: 0.9209, test_f1: 0.5304
 epoch: 85, train_loss: 0.7936, test_loss: 0.9136, test_f1: 0.5228
 epoch: 86, train_loss: 0.7936, test_loss: 0.9175, test_f1: 0.5257
 epoch: 87, train_loss: 0.7873, test_loss: 0.9210, test_f1: 0.5305
 epoch: 88, train_loss: 0.7822, test_loss: 0.9202, test_f1: 0.5293
 epoch: 89, train_loss: 0.7864, test_loss: 0.9222, test_f1: 0.5288
 epoch: 90, train_loss: 0.7814, test_loss: 0.9234, test_f1: 0.5321
 epoch: 91, train_loss: 0.7841, test_loss: 0.9253, test_f1: 0.5332
 epoch: 92, train_loss: 0.7830, test_loss: 0.9272, test_f1: 0.5324
 epoch: 93, train_loss: 0.7864, test_loss: 0.9264, test_f1: 0.5324
 epoch: 94, train_loss: 0.7865, test_loss: 0.9293, test_f1: 0.5308
 epoch: 95, train_loss: 0.7776, test_loss: 0.9221, test_f1: 0.5333
 epoch: 96, train_loss: 0.7789, test_loss: 0.9200, test_f1: 0.5333
 epoch: 97, train_loss: 0.7801, test_loss: 0.9276, test_f1: 0.5307
 epoch: 98, train_loss: 0.7753, test_loss: 0.9293, test_f1: 0.5340
 epoch: 99, train_loss: 0.7762, test_loss: 0.9320, test_f1: 0.5370

Training completed in 399.00 seconds
Best F1: 0.5739 at epoch 85
Mean F1 across iterations: 0.5555  0.0108
========================FINAL RESULTS================================
FEGIN weighted F1: 0.5739  0.0108
python main.py --data ltspice_examples --representation component_net --model FEGIN --layers 4 --hiddens 64 --batch_size 256 --lr 0.0001 --emb_size 250 --epochs 100 --save_appendix component_net_L4_H64_BS256_LR0.0001_E250 --no_val
-----



STDERR:
  File "main.py", line 370, in <module>
    main()
  File "main.py", line 254, in main
    dataset = dataset_class(
  File "/home/philip/projects/ltspice_examples_code_repo/Circuit-Completion-Using-GNNs/component_classification_with_link_prediction_head/evaluation/FEGIN/kernel/circuit_datasets.py", line 15, in __init__
    self.data, self.slices = torch.load(self.processed_paths[0])
  File "/home/philip/.local/lib/python3.8/site-packages/torch/serialization.py", line 1040, in load
    warnings.warn(
  File "/usr/lib/python3.8/warnings.py", line 109, in _showwarnmsg
    sw(msg.message, msg.category, msg.filename, msg.lineno,
  File "main.py", line 47, in warn_with_traceback
    traceback.print_stack(file=log)
/home/philip/projects/ltspice_examples_code_repo/Circuit-Completion-Using-GNNs/component_classification_with_link_prediction_head/evaluation/FEGIN/kernel/circuit_datasets.py:15: FutureWarning: You are using `torch.load` with `weights_only=False` (the current default value), which uses the default pickle module implicitly. It is possible to construct malicious pickle data which will execute arbitrary code during unpickling (See https://github.com/pytorch/pytorch/blob/main/SECURITY.md#untrusted-models for more details). In a future release, the default value for `weights_only` will be flipped to `True`. This limits the functions that could be executed during unpickling. Arbitrary objects will no longer be allowed to be loaded via this mode unless they are explicitly allowlisted by the user via `torch.serialization.add_safe_globals`. We recommend you start setting `weights_only=True` for any use case where you don't have full control of the loaded file. Please open an issue on GitHub for any issues related to this experimental feature.
  self.data, self.slices = torch.load(self.processed_paths[0])
